[I 2026-06-01 22:26:55,499] Trial 50 finished with value: 0.20818188320659128 and parameters: {'alpha': 96213.17388030188, 'n_pcs': 5000, 'iw_method': 'pc_logistic', 'iw_clip_max': 7.0, 'iw_prob_clip': 0.005783285146011804, 'iw_n_components': 40, 'iw_logistic_c': 1.0385489484486191e-07, 'iw_pca_fit': 'combined', 'iw_solver': 'lbfgs', 'iw_rho': 0.5}. Best is trial 35 with value: 0.2185976392563048.
2026-06-01 22:26:55 | INFO | Trial 51 | outer=8 | alpha=7.912e+04 n_pcs=5000 (pc_topk) weight={'name': 'pc_logistic', 'floor': 1e-06, 'clip_max': 7.0, 'prob_clip': 0.013613664041889654, 'n_components': 40, 'logistic_c': 2.852221114074112e-05, 'pca_fit': 'combined', 'solver': 'lbfgs', 'max_iter': 2000, 'fit_intercept': True, 'standardize_with_source': True, 'rho': 0.5}
[I 2026-06-01 22:27:12,366] Trial 51 finished with value: 0.21869246282367943 and parameters: {'alpha': 79123.82070464749, 'n_pcs': 5000, 'iw_method': 'pc_logistic', 'iw_clip_max': 7.0, 'iw_prob_clip': 0.013613664041889654, 'iw_n_components': 40, 'iw_logistic_c': 2.852221114074112e-05, 'iw_pca_fit': 'combined', 'iw_solver': 'lbfgs', 'iw_rho': 0.5}. Best is trial 51 with value: 0.21869246282367943.
2026-06-01 22:27:12 | INFO | Trial 52 | outer=8 | alpha=5.449e+04 n_pcs=5000 (pc_topk) weight={'name': 'pc_logistic', 'floor': 1e-06, 'clip_max': 7.0, 'prob_clip': 0.00768823162284222, 'n_components': 40, 'logistic_c': 6.793709825283027e-06, 'pca_fit': 'combined', 'solver': 'lbfgs', 'max_iter': 2000, 'fit_intercept': True, 'standardize_with_source': True, 'rho': 0.5}
[I 2026-06-01 22:27:28,611] Trial 52 finished with value: 0.21694322307580333 and parameters: {'alpha': 54489.564300095975, 'n_pcs': 5000, 'iw_method': 'pc_logistic', 'iw_clip_max': 7.0, 'iw_prob_clip': 0.00768823162284222, 'iw_n_components': 40, 'iw_logistic_c': 6.793709825283027e-06, 'iw_pca_fit': 'combined', 'iw_solver': 'lbfgs', 'iw_rho': 0.5}. Best is trial 51 with value: 0.21869246282367943.
2026-06-01 22:27:28 | INFO | Trial 53 | outer=8 | alpha=8.355e+03 n_pcs=5000 (pc_topk) weight={'name': 'pc_logistic', 'floor': 1e-06, 'clip_max': 1.5, 'prob_clip': 0.023538388512550367, 'n_components': 80, 'logistic_c': 4.605445332847992e-05, 'pca_fit': 'combined', 'solver': 'lbfgs', 'max_iter': 2000, 'fit_intercept': True, 'standardize_with_source': True, 'rho': 0.5}
[I 2026-06-01 22:27:46,262] Trial 53 finished with value: 0.20817390161552782 and parameters: {'alpha': 8354.823105630734, 'n_pcs': 5000, 'iw_method': 'pc_logistic', 'iw_clip_max': 1.5, 'iw_prob_clip': 0.023538388512550367, 'iw_n_components': 80, 'iw_logistic_c': 4.605445332847992e-05, 'iw_pca_fit': 'combined', 'iw_solver': 'lbfgs', 'iw_rho': 0.5}. Best is trial 51 with value: 0.21869246282367943.
2026-06-01 22:27:46 | INFO | Trial 54 | outer=8 | alpha=1.350e+05 n_pcs=4500 (pc_topk) weight={'name': 'pc_logistic', 'floor': 1e-06, 'clip_max': 7.0, 'prob_clip': 0.013249261669271139, 'n_components': 40, 'logistic_c': 0.00034023739098245736, 'pca_fit': 'combined', 'solver': 'lbfgs', 'max_iter': 2000, 'fit_intercept': True, 'standardize_with_source': True, 'rho': 0.3}
[I 2026-06-01 22:28:03,903] Trial 54 finished with value: 0.2164065189859526 and parameters: {'alpha': 134970.1715613239, 'n_pcs': 4500, 'iw_method': 'pc_logistic', 'iw_clip_max': 7.0, 'iw_prob_clip': 0.013249261669271139, 'iw_n_components': 40, 'iw_logistic_c': 0.00034023739098245736, 'iw_pca_fit': 'combined', 'iw_solver': 'lbfgs', 'iw_rho': 0.3}. Best is trial 51 with value: 0.21869246282367943.
2026-06-01 22:28:03 | INFO | Trial 55 | outer=8 | alpha=7.858e+04 n_pcs=4000 (pc_topk) weight={'name': 'pc_logistic', 'floor': 1e-06, 'clip_max': 7.0, 'prob_clip': 0.008888961281777186, 'n_components': 20, 'logistic_c': 1.538099420672922e-05, 'pca_fit': 'combined', 'solver': 'lbfgs', 'max_iter': 2000, 'fit_intercept': True, 'standardize_with_source': True, 'rho': 1.0}
[I 2026-06-01 22:28:17,058] Trial 55 finished with value: 0.21910206629744106 and parameters: {'alpha': 78575.03695658223, 'n_pcs': 4000, 'iw_method': 'pc_logistic', 'iw_clip_max': 7.0, 'iw_prob_clip': 0.008888961281777186, 'iw_n_components': 20, 'iw_logistic_c': 1.538099420672922e-05, 'iw_pca_fit': 'combined', 'iw_solver': 'lbfgs', 'iw_rho': 1.0}. Best is trial 55 with value: 0.21910206629744106.
2026-06-01 22:28:17 | INFO | Trial 56 | outer=8 | alpha=4.962e+04 n_pcs=4000 (pc_topk) weight={'name': 'pc_logistic', 'floor': 1e-06, 'clip_max': 7.0, 'prob_clip': 0.018025728299821374, 'n_components': 20, 'logistic_c': 1.2615253039574559e-06, 'pca_fit': 'combined', 'solver': 'lbfgs', 'max_iter': 2000, 'fit_intercept': True, 'standardize_with_source': True, 'rho': 1.0}
[I 2026-06-01 22:28:29,389] Trial 56 finished with value: 0.2166638176306337 and parameters: {'alpha': 49624.7621659884, 'n_pcs': 4000, 'iw_method': 'pc_logistic', 'iw_clip_max': 7.0, 'iw_prob_clip': 0.018025728299821374, 'iw_n_components': 20, 'iw_logistic_c': 1.2615253039574559e-06, 'iw_pca_fit': 'combined', 'iw_solver': 'lbfgs', 'iw_rho': 1.0}. Best is trial 55 with value: 0.21910206629744106.
2026-06-01 22:28:29 | INFO | Trial 57 | outer=8 | alpha=2.324e+04 n_pcs=3000 (pc_topk) weight={'name': 'pc_logistic', 'floor': 1e-06, 'clip_max': 12.0, 'prob_clip': 0.0037555347485936524, 'n_components': 20, 'logistic_c': 9.58280218836944e-06, 'pca_fit': 'combined', 'solver': 'lbfgs', 'max_iter': 2000, 'fit_intercept': True, 'standardize_with_source': True, 'rho': 1.0}
[I 2026-06-01 22:28:39,872] Trial 57 finished with value: 0.20487758199284567 and parameters: {'alpha': 23243.32644973957, 'n_pcs': 3000, 'iw_method': 'pc_logistic', 'iw_clip_max': 12.0, 'iw_prob_clip': 0.0037555347485936524, 'iw_n_components': 20, 'iw_logistic_c': 9.58280218836944e-06, 'iw_pca_fit': 'combined', 'iw_solver': 'lbfgs', 'iw_rho': 1.0}. Best is trial 55 with value: 0.21910206629744106.
2026-06-01 22:28:39 | INFO | Trial 58 | outer=8 | alpha=2.669e+05 n_pcs=4500 (pc_topk) weight={'name': 'pc_logistic', 'floor': 1e-06, 'clip_max': 4.0, 'prob_clip': 0.00968224339432509, 'n_components': 20, 'logistic_c': 0.00015580933698302015, 'pca_fit': 'combined', 'solver': 'lbfgs', 'max_iter': 2000, 'fit_intercept': True, 'standardize_with_source': True, 'rho': 1.0}
[I 2026-06-01 22:28:55,489] Trial 58 finished with value: 0.21376768862104134 and parameters: {'alpha': 266884.95251872804, 'n_pcs': 4500, 'iw_method': 'pc_logistic', 'iw_clip_max': 4.0, 'iw_prob_clip': 0.00968224339432509, 'iw_n_components': 20, 'iw_logistic_c': 0.00015580933698302015, 'iw_pca_fit': 'combined', 'iw_solver': 'lbfgs', 'iw_rho': 1.0}. Best is trial 55 with value: 0.21910206629744106.
2026-06-01 22:28:55 | INFO | Trial 59 | outer=8 | alpha=9.923e+04 n_pcs=4000 (pc_topk) weight={'name': 'pc_logistic', 'floor': 1e-06, 'clip_max': 1.5, 'prob_clip': 0.0016374866395664589, 'n_components': 80, 'logistic_c': 4.732852229820855e-06, 'pca_fit': 'combined', 'solver': 'lbfgs', 'max_iter': 2000, 'fit_intercept': True, 'standardize_with_source': True, 'rho': 0.7}
[I 2026-06-01 22:29:08,167] Trial 59 finished with value: 0.21503579171644466 and parameters: {'alpha': 99226.10668793425, 'n_pcs': 4000, 'iw_method': 'pc_logistic', 'iw_clip_max': 1.5, 'iw_prob_clip': 0.0016374866395664589, 'iw_n_components': 80, 'iw_logistic_c': 4.732852229820855e-06, 'iw_pca_fit': 'combined', 'iw_solver': 'lbfgs', 'iw_rho': 0.7}. Best is trial 55 with value: 0.21910206629744106.
2026-06-01 22:29:08 | INFO | Trial 60 | outer=8 | alpha=1.528e+05 n_pcs=4500 (pc_topk) weight={'name': 'pc_logistic', 'floor': 1e-06, 'clip_max': 7.0, 'prob_clip': 0.0007383024404216891, 'n_components': 60, 'logistic_c': 0.021897455184526432, 'pca_fit': 'combined', 'solver': 'lbfgs', 'max_iter': 2000, 'fit_intercept': True, 'standardize_with_source': True, 'rho': 1.0}
2026-06-01 22:29:31 | INFO | Trial 60 rejected by ESS guard: mean_ess=603.87 threshold=1012.84
[I 2026-06-01 22:29:31,101] Trial 60 finished with value: -1.0 and parameters: {'alpha': 152816.78872195896, 'n_pcs': 4500, 'iw_method': 'pc_logistic', 'iw_clip_max': 7.0, 'iw_prob_clip': 0.0007383024404216891, 'iw_n_components': 60, 'iw_logistic_c': 0.021897455184526432, 'iw_pca_fit': 'combined', 'iw_solver': 'lbfgs', 'iw_rho': 1.0}. Best is trial 55 with value: 0.21910206629744106.
2026-06-01 22:29:31 | INFO | Trial 61 | outer=8 | alpha=6.595e+04 n_pcs=5000 (pc_topk) weight={'name': 'pc_logistic', 'floor': 1e-06, 'clip_max': 7.0, 'prob_clip': 0.008055731869711253, 'n_components': 10, 'logistic_c': 2.9564705843514676e-05, 'pca_fit': 'combined', 'solver': 'lbfgs', 'max_iter': 2000, 'fit_intercept': True, 'standardize_with_source': True, 'rho': 0.85}
[I 2026-06-01 22:29:47,725] Trial 61 finished with value: 0.218186702388324 and parameters: {'alpha': 65945.89976537385, 'n_pcs': 5000, 'iw_method': 'pc_logistic', 'iw_clip_max': 7.0, 'iw_prob_clip': 0.008055731869711253, 'iw_n_components': 10, 'iw_logistic_c': 2.9564705843514676e-05, 'iw_pca_fit': 'combined', 'iw_solver': 'lbfgs', 'iw_rho': 0.85}. Best is trial 55 with value: 0.21910206629744106.
2026-06-01 22:29:47 | INFO | Trial 62 | outer=8 | alpha=8.056e+04 n_pcs=5000 (pc_topk) weight={'name': 'pc_logistic', 'floor': 1e-06, 'clip_max': 7.0, 'prob_clip': 0.012626279636457415, 'n_components': 20, 'logistic_c': 4.464345382322264, 'pca_fit': 'combined', 'solver': 'lbfgs', 'max_iter': 2000, 'fit_intercept': True, 'standardize_with_source': True, 'rho': 0.5}
[I 2026-06-01 22:30:10,024] Trial 62 finished with value: 0.2149374683638438 and parameters: {'alpha': 80562.91177918263, 'n_pcs': 5000, 'iw_method': 'pc_logistic', 'iw_clip_max': 7.0, 'iw_prob_clip': 0.012626279636457415, 'iw_n_components': 20, 'iw_logistic_c': 4.464345382322264, 'iw_pca_fit': 'combined', 'iw_solver': 'lbfgs', 'iw_rho': 0.5}. Best is trial 55 with value: 0.21910206629744106.
2026-06-01 22:30:10 | INFO | Trial 63 | outer=8 | alpha=4.248e+05 n_pcs=5000 (pc_topk) weight={'name': 'pc_logistic', 'floor': 1e-06, 'clip_max': 7.0, 'prob_clip': 0.004650631967793262, 'n_components': 40, 'logistic_c': 1.834503924524424e-05, 'pca_fit': 'combined', 'solver': 'lbfgs', 'max_iter': 2000, 'fit_intercept': True, 'standardize_with_source': True, 'rho': 1.0}
[I 2026-06-01 22:30:27,359] Trial 63 finished with value: 0.2083675746471357 and parameters: {'alpha': 424783.80301685527, 'n_pcs': 5000, 'iw_method': 'pc_logistic', 'iw_clip_max': 7.0, 'iw_prob_clip': 0.004650631967793262, 'iw_n_components': 40, 'iw_logistic_c': 1.834503924524424e-05, 'iw_pca_fit': 'combined', 'iw_solver': 'lbfgs', 'iw_rho': 1.0}. Best is trial 55 with value: 0.21910206629744106.
2026-06-01 22:30:27 | INFO | Trial 64 | outer=8 | alpha=4.970e+04 n_pcs=4500 (pc_topk) weight={'name': 'pc_logistic', 'floor': 1e-06, 'clip_max': 2.5, 'prob_clip': 0.006287234868632435, 'n_components': 100, 'logistic_c': 7.697712523466805e-05, 'pca_fit': 'combined', 'solver': 'lbfgs', 'max_iter': 2000, 'fit_intercept': True, 'standardize_with_source': True, 'rho': 0.5}
[I 2026-06-01 22:30:42,610] Trial 64 finished with value: 0.22279905205096084 and parameters: {'alpha': 49704.88388249975, 'n_pcs': 4500, 'iw_method': 'pc_logistic', 'iw_clip_max': 2.5, 'iw_prob_clip': 0.006287234868632435, 'iw_n_components': 100, 'iw_logistic_c': 7.697712523466805e-05, 'iw_pca_fit': 'combined', 'iw_solver': 'lbfgs', 'iw_rho': 0.5}. Best is trial 64 with value: 0.22279905205096084.
2026-06-01 22:30:42 | INFO | Trial 65 | outer=8 | alpha=2.716e+04 n_pcs=4500 (pc_topk) weight={'name': 'pc_logistic', 'floor': 1e-06, 'clip_max': 2.5, 'prob_clip': 0.017664226798956708, 'n_components': 100, 'logistic_c': 0.0002393281311401142, 'pca_fit': 'combined', 'solver': 'lbfgs', 'max_iter': 2000, 'fit_intercept': True, 'standardize_with_source': True, 'rho': 0.5}
[I 2026-06-01 22:31:00,511] Trial 65 finished with value: 0.22314318310596062 and parameters: {'alpha': 27160.3846016662, 'n_pcs': 4500, 'iw_method': 'pc_logistic', 'iw_clip_max': 2.5, 'iw_prob_clip': 0.017664226798956708, 'iw_n_components': 100, 'iw_logistic_c': 0.0002393281311401142, 'iw_pca_fit': 'combined', 'iw_solver': 'lbfgs', 'iw_rho': 0.5}. Best is trial 65 with value: 0.22314318310596062.
2026-06-01 22:31:00 | INFO | Trial 66 | outer=8 | alpha=4.459e+04 n_pcs=4500 (pc_topk) weight={'name': 'pc_logistic', 'floor': 1e-06, 'clip_max': 2.5, 'prob_clip': 0.0178735494238686, 'n_components': 100, 'logistic_c': 0.0013361683268164437, 'pca_fit': 'combined', 'solver': 'lbfgs', 'max_iter': 2000, 'fit_intercept': True, 'standardize_with_source': True, 'rho': 0.7}
[I 2026-06-01 22:31:21,597] Trial 66 finished with value: 0.22256299446358171 and parameters: {'alpha': 44585.637560307136, 'n_pcs': 4500, 'iw_method': 'pc_logistic', 'iw_clip_max': 2.5, 'iw_prob_clip': 0.0178735494238686, 'iw_n_components': 100, 'iw_logistic_c': 0.0013361683268164437, 'iw_pca_fit': 'combined', 'iw_solver': 'lbfgs', 'iw_rho': 0.7}. Best is trial 65 with value: 0.22314318310596062.
2026-06-01 22:31:21 | INFO | Trial 67 | outer=8 | alpha=4.545e+04 n_pcs=4500 (pc_topk) weight={'name': 'pc_logistic', 'floor': 1e-06, 'clip_max': 2.5, 'prob_clip': 0.018343899057029815, 'n_components': 100, 'logistic_c': 0.0008351238819893285, 'pca_fit': 'combined', 'solver': 'lbfgs', 'max_iter': 2000, 'fit_intercept': True, 'standardize_with_source': True, 'rho': 0.7}
[I 2026-06-01 22:31:39,984] Trial 67 finished with value: 0.22329059589719744 and parameters: {'alpha': 45445.766359651185, 'n_pcs': 4500, 'iw_method': 'pc_logistic', 'iw_clip_max': 2.5, 'iw_prob_clip': 0.018343899057029815, 'iw_n_components': 100, 'iw_logistic_c': 0.0008351238819893285, 'iw_pca_fit': 'combined', 'iw_solver': 'lbfgs', 'iw_rho': 0.7}. Best is trial 67 with value: 0.22329059589719744.
2026-06-01 22:31:39 | INFO | Trial 68 | outer=8 | alpha=4.451e+04 n_pcs=4000 (pc_topk) weight={'name': 'pc_logistic', 'floor': 1e-06, 'clip_max': 2.5, 'prob_clip': 0.018902459450098105, 'n_components': 100, 'logistic_c': 0.007158748386878957, 'pca_fit': 'combined', 'solver': 'lbfgs', 'max_iter': 2000, 'fit_intercept': True, 'standardize_with_source': True, 'rho': 0.7}
[I 2026-06-01 22:32:02,778] Trial 68 finished with value: 0.22075606349305313 and parameters: {'alpha': 44509.27562526067, 'n_pcs': 4000, 'iw_method': 'pc_logistic', 'iw_clip_max': 2.5, 'iw_prob_clip': 0.018902459450098105, 'iw_n_components': 100, 'iw_logistic_c': 0.007158748386878957, 'iw_pca_fit': 'combined', 'iw_solver': 'lbfgs', 'iw_rho': 0.7}. Best is trial 67 with value: 0.22329059589719744.
2026-06-01 22:32:02 | INFO | Trial 69 | outer=8 | alpha=1.054e+04 n_pcs=4000 (pc_topk) weight={'name': 'pc_logistic', 'floor': 1e-06, 'clip_max': 2.5, 'prob_clip': 0.033528467833181856, 'n_components': 100, 'logistic_c': 0.006043285480207443, 'pca_fit': 'combined', 'solver': 'lbfgs', 'max_iter': 2000, 'fit_intercept': True, 'standardize_with_source': True, 'rho': 0.7}
[I 2026-06-01 22:32:24,466] Trial 69 finished with value: 0.20210827413381366 and parameters: {'alpha': 10544.259731572873, 'n_pcs': 4000, 'iw_method': 'pc_logistic', 'iw_clip_max': 2.5, 'iw_prob_clip': 0.033528467833181856, 'iw_n_components': 100, 'iw_logistic_c': 0.006043285480207443, 'iw_pca_fit': 'combined', 'iw_solver': 'lbfgs', 'iw_rho': 0.7}. Best is trial 67 with value: 0.22329059589719744.
2026-06-01 22:32:24 | INFO | Trial 70 | outer=8 | alpha=1.906e+04 n_pcs=3500 (pc_topk) weight={'name': 'pc_logistic', 'floor': 1e-06, 'clip_max': 2.5, 'prob_clip': 0.018459756872493127, 'n_components': 100, 'logistic_c': 0.001782825775622368, 'pca_fit': 'combined', 'solver': 'lbfgs', 'max_iter': 2000, 'fit_intercept': True, 'standardize_with_source': True, 'rho': 0.7}
[I 2026-06-01 22:32:41,318] Trial 70 finished with value: 0.20900701581395734 and parameters: {'alpha': 19058.245126805294, 'n_pcs': 3500, 'iw_method': 'pc_logistic', 'iw_clip_max': 2.5, 'iw_prob_clip': 0.018459756872493127, 'iw_n_components': 100, 'iw_logistic_c': 0.001782825775622368, 'iw_pca_fit': 'combined', 'iw_solver': 'lbfgs', 'iw_rho': 0.7}. Best is trial 67 with value: 0.22329059589719744.
2026-06-01 22:32:41 | INFO | Trial 71 | outer=8 | alpha=4.503e+04 n_pcs=4000 (pc_topk) weight={'name': 'pc_logistic', 'floor': 1e-06, 'clip_max': 2.5, 'prob_clip': 0.015321186474949823, 'n_components': 100, 'logistic_c': 0.012247314073903294, 'pca_fit': 'combined', 'solver': 'lbfgs', 'max_iter': 2000, 'fit_intercept': True, 'standardize_with_source': True, 'rho': 0.7}
[I 2026-06-01 22:33:05,371] Trial 71 finished with value: 0.22060566217617908 and parameters: {'alpha': 45028.00000750741, 'n_pcs': 4000, 'iw_method': 'pc_logistic', 'iw_clip_max': 2.5, 'iw_prob_clip': 0.015321186474949823, 'iw_n_components': 100, 'iw_logistic_c': 0.012247314073903294, 'iw_pca_fit': 'combined', 'iw_solver': 'lbfgs', 'iw_rho': 0.7}. Best is trial 67 with value: 0.22329059589719744.
2026-06-01 22:33:05 | INFO | Trial 72 | outer=8 | alpha=2.814e+04 n_pcs=4000 (pc_topk) weight={'name': 'pc_logistic', 'floor': 1e-06, 'clip_max': 2.5, 'prob_clip': 0.01659970489492117, 'n_components': 100, 'logistic_c': 0.016755911609353157, 'pca_fit': 'combined', 'solver': 'lbfgs', 'max_iter': 2000, 'fit_intercept': True, 'standardize_with_source': True, 'rho': 0.7}
[I 2026-06-01 22:33:28,426] Trial 72 finished with value: 0.2185546220295061 and parameters: {'alpha': 28138.620615337706, 'n_pcs': 4000, 'iw_method': 'pc_logistic', 'iw_clip_max': 2.5, 'iw_prob_clip': 0.01659970489492117, 'iw_n_components': 100, 'iw_logistic_c': 0.016755911609353157, 'iw_pca_fit': 'combined', 'iw_solver': 'lbfgs', 'iw_rho': 0.7}. Best is trial 67 with value: 0.22329059589719744.
2026-06-01 22:33:28 | INFO | Trial 73 | outer=8 | alpha=4.826e+04 n_pcs=4000 (pc_topk) weight={'name': 'pc_logistic', 'floor': 1e-06, 'clip_max': 2.5, 'prob_clip': 0.021254345023513015, 'n_components': 100, 'logistic_c': 0.0009429344470531343, 'pca_fit': 'combined', 'solver': 'lbfgs', 'max_iter': 2000, 'fit_intercept': True, 'standardize_with_source': True, 'rho': 0.7}
[I 2026-06-01 22:33:46,351] Trial 73 finished with value: 0.22236445601431823 and parameters: {'alpha': 48255.18081954851, 'n_pcs': 4000, 'iw_method': 'pc_logistic', 'iw_clip_max': 2.5, 'iw_prob_clip': 0.021254345023513015, 'iw_n_components': 100, 'iw_logistic_c': 0.0009429344470531343, 'iw_pca_fit': 'combined', 'iw_solver': 'lbfgs', 'iw_rho': 0.7}. Best is trial 67 with value: 0.22329059589719744.
2026-06-01 22:33:46 | INFO | Trial 74 | outer=8 | alpha=4.540e+04 n_pcs=3500 (pc_topk) weight={'name': 'pc_logistic', 'floor': 1e-06, 'clip_max': 2.5, 'prob_clip': 0.03047912687796059, 'n_components': 100, 'logistic_c': 0.0011947396567151794, 'pca_fit': 'combined', 'solver': 'lbfgs', 'max_iter': 2000, 'fit_intercept': True, 'standardize_with_source': True, 'rho': 0.7}
[I 2026-06-01 22:34:02,504] Trial 74 finished with value: 0.21945374776379306 and parameters: {'alpha': 45404.27267163533, 'n_pcs': 3500, 'iw_method': 'pc_logistic', 'iw_clip_max': 2.5, 'iw_prob_clip': 0.03047912687796059, 'iw_n_components': 100, 'iw_logistic_c': 0.0011947396567151794, 'iw_pca_fit': 'combined', 'iw_solver': 'lbfgs', 'iw_rho': 0.7}. Best is trial 67 with value: 0.22329059589719744.
2026-06-01 22:34:02 | INFO | Trial 75 | outer=8 | alpha=4.601e+04 n_pcs=3500 (pc_topk) weight={'name': 'pc_logistic', 'floor': 1e-06, 'clip_max': 2.5, 'prob_clip': 0.0316594868700124, 'n_components': 100, 'logistic_c': 0.0009608566942370581, 'pca_fit': 'combined', 'solver': 'lbfgs', 'max_iter': 2000, 'fit_intercept': True, 'standardize_with_source': True, 'rho': 0.7}
[I 2026-06-01 22:34:17,993] Trial 75 finished with value: 0.21981550563241736 and parameters: {'alpha': 46009.78447792395, 'n_pcs': 3500, 'iw_method': 'pc_logistic', 'iw_clip_max': 2.5, 'iw_prob_clip': 0.0316594868700124, 'iw_n_components': 100, 'iw_logistic_c': 0.0009608566942370581, 'iw_pca_fit': 'combined', 'iw_solver': 'lbfgs', 'iw_rho': 0.7}. Best is trial 67 with value: 0.22329059589719744.
2026-06-01 22:34:18 | INFO | Trial 76 | outer=8 | alpha=1.469e+04 n_pcs=3500 (pc_topk) weight={'name': 'pc_logistic', 'floor': 1e-06, 'clip_max': 2.5, 'prob_clip': 0.032176818137327645, 'n_components': 100, 'logistic_c': 0.007046886782333419, 'pca_fit': 'combined', 'solver': 'lbfgs', 'max_iter': 2000, 'fit_intercept': True, 'standardize_with_source': True, 'rho': 0.7}
[I 2026-06-01 22:34:39,993] Trial 76 finished with value: 0.2031019841026298 and parameters: {'alpha': 14690.219818764815, 'n_pcs': 3500, 'iw_method': 'pc_logistic', 'iw_clip_max': 2.5, 'iw_prob_clip': 0.032176818137327645, 'iw_n_components': 100, 'iw_logistic_c': 0.007046886782333419, 'iw_pca_fit': 'combined', 'iw_solver': 'lbfgs', 'iw_rho': 0.7}. Best is trial 67 with value: 0.22329059589719744.
2026-06-01 22:34:40 | INFO | Trial 77 | outer=8 | alpha=3.629e+04 n_pcs=4000 (pc_topk) weight={'name': 'pc_logistic', 'floor': 1e-06, 'clip_max': 2.5, 'prob_clip': 0.021446250417006565, 'n_components': 100, 'logistic_c': 0.0006115913403620609, 'pca_fit': 'combined', 'solver': 'lbfgs', 'max_iter': 2000, 'fit_intercept': True, 'standardize_with_source': True, 'rho': 0.7}
[I 2026-06-01 22:34:56,991] Trial 77 finished with value: 0.22186941989198633 and parameters: {'alpha': 36292.34835271667, 'n_pcs': 4000, 'iw_method': 'pc_logistic', 'iw_clip_max': 2.5, 'iw_prob_clip': 0.021446250417006565, 'iw_n_components': 100, 'iw_logistic_c': 0.0006115913403620609, 'iw_pca_fit': 'combined', 'iw_solver': 'lbfgs', 'iw_rho': 0.7}. Best is trial 67 with value: 0.22329059589719744.
2026-06-01 22:34:57 | INFO | Trial 78 | outer=8 | alpha=3.546e+04 n_pcs=4000 (pc_topk) weight={'name': 'pc_logistic', 'floor': 1e-06, 'clip_max': 2.5, 'prob_clip': 0.02094979025973624, 'n_components': 100, 'logistic_c': 0.0454720566204609, 'pca_fit': 'combined', 'solver': 'lbfgs', 'max_iter': 2000, 'fit_intercept': True, 'standardize_with_source': True, 'rho': 0.7}
