[I 2026-06-01 00:42:16,722] Trial 290 pruned. 
2026-06-01 00:42:16 | INFO | src.nested_cv_avggrm_weighted_unified | Trial 291 | outer=5 | alpha=7.222e+04 n_pcs=4000 (pc_topk) weight_search=on
2026-06-01 00:42:16 | INFO | src.nested_cv_avggrm_weighted_unified | Trial 291 | outer=5 | weight={'name': 'exponential', 'floor': 1e-06, 'clip_max': 5.0, 'beta': 8.703448411830077}
2026-06-01 00:42:21 | INFO | src.nested_cv_avggrm_weighted_unified | Trial 291 | outer=5 | pruned after 7/10 inner folds (mean r=0.2911)
[I 2026-06-01 00:42:21,019] Trial 291 pruned. 
2026-06-01 00:42:21 | INFO | src.nested_cv_avggrm_weighted_unified | Trial 292 | outer=5 | alpha=1.338e+05 n_pcs=4500 (pc_topk) weight_search=on
2026-06-01 00:42:21 | INFO | src.nested_cv_avggrm_weighted_unified | Trial 292 | outer=5 | weight={'name': 'exponential', 'floor': 1e-06, 'clip_max': 5.0, 'beta': 8.598814409752942}
[I 2026-06-01 00:42:27,670] Trial 292 finished with value: 0.2597063547539641 and parameters: {'alpha': 133843.7798095829, 'n_pcs': 4500, 'weight_scheme': 'exponential', 'weight_clip_max': 5.0, 'weight_exponential_beta': 8.598814409752942}. Best is trial 140 with value: 0.25996359913458195.
2026-06-01 00:42:27 | INFO | src.nested_cv_avggrm_weighted_unified | Trial 293 | outer=5 | alpha=9.249e+04 n_pcs=4000 (pc_topk) weight_search=on
2026-06-01 00:42:27 | INFO | src.nested_cv_avggrm_weighted_unified | Trial 293 | outer=5 | weight={'name': 'exponential', 'floor': 1e-06, 'clip_max': 5.0, 'beta': 8.41254727427202}
2026-06-01 00:42:31 | INFO | src.nested_cv_avggrm_weighted_unified | Trial 293 | outer=5 | pruned after 7/10 inner folds (mean r=0.2934)
[I 2026-06-01 00:42:31,498] Trial 293 pruned. 
2026-06-01 00:42:31 | INFO | src.nested_cv_avggrm_weighted_unified | Trial 294 | outer=5 | alpha=1.107e+05 n_pcs=2000 (pc_topk) weight_search=on
2026-06-01 00:42:31 | INFO | src.nested_cv_avggrm_weighted_unified | Trial 294 | outer=5 | weight={'name': 'exponential', 'floor': 1e-06, 'clip_max': 5.0, 'beta': 8.53905331238952}
2026-06-01 00:42:32 | INFO | src.nested_cv_avggrm_weighted_unified | Trial 294 | outer=5 | pruned after 6/10 inner folds (mean r=0.2600)
[I 2026-06-01 00:42:32,763] Trial 294 pruned. 
2026-06-01 00:42:32 | INFO | src.nested_cv_avggrm_weighted_unified | Trial 295 | outer=5 | alpha=1.637e+05 n_pcs=4500 (pc_topk) weight_search=on
2026-06-01 00:42:32 | INFO | src.nested_cv_avggrm_weighted_unified | Trial 295 | outer=5 | weight={'name': 'exponential', 'floor': 1e-06, 'clip_max': 5.0, 'beta': 8.276931426379603}
[I 2026-06-01 00:42:39,411] Trial 295 finished with value: 0.25921453219241053 and parameters: {'alpha': 163655.58085438624, 'n_pcs': 4500, 'weight_scheme': 'exponential', 'weight_clip_max': 5.0, 'weight_exponential_beta': 8.276931426379603}. Best is trial 140 with value: 0.25996359913458195.
2026-06-01 00:42:39 | INFO | src.nested_cv_avggrm_weighted_unified | Trial 296 | outer=5 | alpha=8.306e+04 n_pcs=4500 (pc_topk) weight_search=on
2026-06-01 00:42:39 | INFO | src.nested_cv_avggrm_weighted_unified | Trial 296 | outer=5 | weight={'name': 'exponential', 'floor': 1e-06, 'clip_max': 5.0, 'beta': 8.292400501550762}
2026-06-01 00:42:44 | INFO | src.nested_cv_avggrm_weighted_unified | Trial 296 | outer=5 | pruned after 7/10 inner folds (mean r=0.2938)
[I 2026-06-01 00:42:44,105] Trial 296 pruned. 
2026-06-01 00:42:44 | INFO | src.nested_cv_avggrm_weighted_unified | Trial 297 | outer=5 | alpha=1.002e+05 n_pcs=1500 (pc_topk) weight_search=on
2026-06-01 00:42:44 | INFO | src.nested_cv_avggrm_weighted_unified | Trial 297 | outer=5 | weight={'name': 'exponential', 'floor': 1e-06, 'clip_max': 5.0, 'beta': 8.582472823106876}
2026-06-01 00:42:45 | INFO | src.nested_cv_avggrm_weighted_unified | Trial 297 | outer=5 | pruned after 6/10 inner folds (mean r=0.2603)
[I 2026-06-01 00:42:45,110] Trial 297 pruned. 
2026-06-01 00:42:45 | INFO | src.nested_cv_avggrm_weighted_unified | Trial 298 | outer=5 | alpha=1.336e+05 n_pcs=4500 (pc_topk) weight_search=on
2026-06-01 00:42:45 | INFO | src.nested_cv_avggrm_weighted_unified | Trial 298 | outer=5 | weight={'name': 'exponential', 'floor': 1e-06, 'clip_max': 10.0, 'beta': 8.854784374397646}
[I 2026-06-01 00:42:51,761] Trial 298 finished with value: 0.25788995561150774 and parameters: {'alpha': 133600.82632160146, 'n_pcs': 4500, 'weight_scheme': 'exponential', 'weight_clip_max': 10.0, 'weight_exponential_beta': 8.854784374397646}. Best is trial 140 with value: 0.25996359913458195.
2026-06-01 00:42:51 | INFO | src.nested_cv_avggrm_weighted_unified | Trial 299 | outer=5 | alpha=6.070e+04 n_pcs=5000 (pc_topk) weight_search=on
2026-06-01 00:42:51 | INFO | src.nested_cv_avggrm_weighted_unified | Trial 299 | outer=5 | weight={'name': 'exponential', 'floor': 1e-06, 'clip_max': 5.0, 'beta': 8.148312675253164}
2026-06-01 00:42:57 | INFO | src.nested_cv_avggrm_weighted_unified | Trial 299 | outer=5 | pruned after 7/10 inner folds (mean r=0.2909)
[I 2026-06-01 00:42:57,298] Trial 299 pruned. 
2026-06-01 00:42:57 | INFO | src.nested_cv_avggrm_weighted_unified | OUTER 5 best (inner mean r=0.2600): {'model_type': 'pc_ridge', 'alpha': 110571.43779071631, 'n_pcs': 4000, 'use_snp_selection': True, 'num_snps': 4000, 'feature_mode': 'pc_topk', 'weighting': {'name': 'exponential', 'floor': 1e-06, 'clip_max': 5.0, 'beta': 8.06484811908058}}
2026-06-01 00:42:57 | INFO | src.nested_cv_avggrm_weighted_unified | OUTER 5 TEST r = 0.0935
2026-06-01 00:42:57 | INFO | src.nested_cv_avggrm_weighted_unified | OUTER 5 incremental summary saved to outputs/final_results/e6_pc_ridge_avggrm/thr_wing/e6_pc_ridge_avggrm_thr_wing_results.json
2026-06-01 00:42:57 | INFO | src.nested_cv_avggrm_weighted_unified | OUTER 6: test_size=1055 island=5 (Hestmannøy)
2026-06-01 00:42:57 | INFO | src.nested_cv_avggrm_weighted_unified | OUTER 6: inner LOIO validation islands: 0(Nesøy), 1(Myken), 2(Træna), 3(Selvær), 4(Gjerøy), 6(Indre Kvarøy), 7(Onøy og Lurøy), 8(Lovund), 9(Sleneset), 10(Aldra), 11(Leka), 12(Vega), 13(Vikna), 14(Lauvøya)
2026-06-01 00:42:58 | INFO | src.nested_cv_avggrm_weighted_unified | OUTER 6: using top 10 related inner validation islands for tuning: 4(Gjerøy, avgGRM=0.0047), 0(Nesøy, avgGRM=0.0045), 6(Indre Kvarøy, avgGRM=0.0039), 7(Onøy og Lurøy, avgGRM=0.0026), 1(Myken, avgGRM=0.0014), 3(Selvær, avgGRM=-0.0000), 2(Træna, avgGRM=-0.0005), 8(Lovund, avgGRM=-0.0006), 9(Sleneset, avgGRM=-0.0009), 10(Aldra, avgGRM=-0.0021)
[I 2026-06-01 00:42:58,052] A new study created in memory with name: ridge_inner_outer5
2026-06-01 00:42:58 | INFO | src.nested_cv_avggrm_weighted_unified | Trial 0 | outer=6 | alpha=1.137e+05 n_pcs=4000 (pc_topk) weight_search=on
2026-06-01 00:42:58 | INFO | src.nested_cv_avggrm_weighted_unified | Trial 0 | outer=6 | weight={'name': 'uniform', 'floor': 1e-06, 'clip_max': None}
[I 2026-06-01 00:43:02,998] Trial 0 finished with value: 0.22892103071758255 and parameters: {'alpha': 113703.38004442609, 'n_pcs': 4000, 'weight_scheme': 'uniform', 'weight_clip_max': None}. Best is trial 0 with value: 0.22892103071758255.
2026-06-01 00:43:03 | INFO | src.nested_cv_avggrm_weighted_unified | OUTER 6 | new best trial 0 (mean inner r=0.2289) saved to outputs/final_results/e6_pc_ridge_avggrm/thr_wing/e6_pc_ridge_avggrm_thr_wing_best_trials/split_06_best_trial.json
2026-06-01 00:43:03 | INFO | src.nested_cv_avggrm_weighted_unified | Trial 1 | outer=6 | alpha=1.682e+06 n_pcs=2000 (pc_topk) weight_search=on
2026-06-01 00:43:03 | INFO | src.nested_cv_avggrm_weighted_unified | Trial 1 | outer=6 | weight={'name': 'exponential', 'floor': 1e-06, 'clip_max': 3.0, 'beta': 8.711469579953913}
[I 2026-06-01 00:43:05,105] Trial 1 finished with value: 0.22924825215982483 and parameters: {'alpha': 1682385.170967095, 'n_pcs': 2000, 'weight_scheme': 'exponential', 'weight_clip_max': 3.0, 'weight_exponential_beta': 8.711469579953913}. Best is trial 1 with value: 0.22924825215982483.
2026-06-01 00:43:05 | INFO | src.nested_cv_avggrm_weighted_unified | OUTER 6 | new best trial 1 (mean inner r=0.2292) saved to outputs/final_results/e6_pc_ridge_avggrm/thr_wing/e6_pc_ridge_avggrm_thr_wing_best_trials/split_06_best_trial.json
2026-06-01 00:43:05 | INFO | src.nested_cv_avggrm_weighted_unified | Trial 2 | outer=6 | alpha=2.757e+03 n_pcs=2000 (pc_topk) weight_search=on
2026-06-01 00:43:05 | INFO | src.nested_cv_avggrm_weighted_unified | Trial 2 | outer=6 | weight={'name': 'linear', 'floor': 1e-06, 'clip_max': 20.0, 'min_weight': 0.12918170299726892, 'max_weight': 3.9862564805616327}
[I 2026-06-01 00:43:07,980] Trial 2 finished with value: 0.14858504161384617 and parameters: {'alpha': 2757.0504493185063, 'n_pcs': 2000, 'weight_scheme': 'linear', 'weight_clip_max': 20.0, 'weight_linear_min_weight': 0.12918170299726892, 'weight_linear_max_weight': 3.9862564805616327}. Best is trial 1 with value: 0.22924825215982483.
2026-06-01 00:43:07 | INFO | src.nested_cv_avggrm_weighted_unified | Trial 3 | outer=6 | alpha=1.776e+03 n_pcs=4000 (pc_topk) weight_search=on
2026-06-01 00:43:07 | INFO | src.nested_cv_avggrm_weighted_unified | Trial 3 | outer=6 | weight={'name': 'exponential', 'floor': 1e-06, 'clip_max': 10.0, 'beta': 0.563604612251006}
[I 2026-06-01 00:43:13,189] Trial 3 finished with value: 0.1416683186603198 and parameters: {'alpha': 1775.825123718637, 'n_pcs': 4000, 'weight_scheme': 'exponential', 'weight_clip_max': 10.0, 'weight_exponential_beta': 0.563604612251006}. Best is trial 1 with value: 0.22924825215982483.
2026-06-01 00:43:13 | INFO | src.nested_cv_avggrm_weighted_unified | Trial 4 | outer=6 | alpha=1.835e+04 n_pcs=5000 (pc_topk) weight_search=on
2026-06-01 00:43:13 | INFO | src.nested_cv_avggrm_weighted_unified | Trial 4 | outer=6 | weight={'name': 'exponential', 'floor': 1e-06, 'clip_max': None, 'beta': 9.957095048208117}
[I 2026-06-01 00:43:19,857] Trial 4 finished with value: 0.21763021610615113 and parameters: {'alpha': 18351.68801260339, 'n_pcs': 5000, 'weight_scheme': 'exponential', 'weight_clip_max': None, 'weight_exponential_beta': 9.957095048208117}. Best is trial 1 with value: 0.22924825215982483.
2026-06-01 00:43:19 | INFO | src.nested_cv_avggrm_weighted_unified | Trial 5 | outer=6 | alpha=9.696e+03 n_pcs=1000 (pc_topk) weight_search=on
2026-06-01 00:43:19 | INFO | src.nested_cv_avggrm_weighted_unified | Trial 5 | outer=6 | weight={'name': 'exponential', 'floor': 1e-06, 'clip_max': 3.0, 'beta': 1.5726039441128932}
[I 2026-06-01 00:43:21,823] Trial 5 finished with value: 0.20881095972974548 and parameters: {'alpha': 9695.792837096258, 'n_pcs': 1000, 'weight_scheme': 'exponential', 'weight_clip_max': 3.0, 'weight_exponential_beta': 1.5726039441128932}. Best is trial 1 with value: 0.22924825215982483.
2026-06-01 00:43:21 | INFO | src.nested_cv_avggrm_weighted_unified | Trial 6 | outer=6 | alpha=6.320e+04 n_pcs=2500 (pc_topk) weight_search=on
2026-06-01 00:43:21 | INFO | src.nested_cv_avggrm_weighted_unified | Trial 6 | outer=6 | weight={'name': 'uniform', 'floor': 1e-06, 'clip_max': 10.0}
[I 2026-06-01 00:43:24,418] Trial 6 finished with value: 0.226210042735832 and parameters: {'alpha': 63199.5851103866, 'n_pcs': 2500, 'weight_scheme': 'uniform', 'weight_clip_max': 10.0}. Best is trial 1 with value: 0.22924825215982483.
2026-06-01 00:43:24 | INFO | src.nested_cv_avggrm_weighted_unified | Trial 7 | outer=6 | alpha=4.681e+04 n_pcs=2500 (pc_topk) weight_search=on
2026-06-01 00:43:24 | INFO | src.nested_cv_avggrm_weighted_unified | Trial 7 | outer=6 | weight={'name': 'linear', 'floor': 1e-06, 'clip_max': 3.0, 'min_weight': 0.13798029304672477, 'max_weight': 3.0957974174373546}
[I 2026-06-01 00:43:26,987] Trial 7 finished with value: 0.2222401874059429 and parameters: {'alpha': 46806.97703257331, 'n_pcs': 2500, 'weight_scheme': 'linear', 'weight_clip_max': 3.0, 'weight_linear_min_weight': 0.13798029304672477, 'weight_linear_max_weight': 3.0957974174373546}. Best is trial 1 with value: 0.22924825215982483.
2026-06-01 00:43:26 | INFO | src.nested_cv_avggrm_weighted_unified | Trial 8 | outer=6 | alpha=5.456e+04 n_pcs=3000 (pc_topk) weight_search=on
2026-06-01 00:43:26 | INFO | src.nested_cv_avggrm_weighted_unified | Trial 8 | outer=6 | weight={'name': 'linear', 'floor': 1e-06, 'clip_max': 5.0, 'min_weight': 0.6690067570691431, 'max_weight': 4.8744640334054115}
[I 2026-06-01 00:43:30,520] Trial 8 finished with value: 0.23176131923967258 and parameters: {'alpha': 54559.68395210245, 'n_pcs': 3000, 'weight_scheme': 'linear', 'weight_clip_max': 5.0, 'weight_linear_min_weight': 0.6690067570691431, 'weight_linear_max_weight': 4.8744640334054115}. Best is trial 8 with value: 0.23176131923967258.
2026-06-01 00:43:30 | INFO | src.nested_cv_avggrm_weighted_unified | OUTER 6 | new best trial 8 (mean inner r=0.2318) saved to outputs/final_results/e6_pc_ridge_avggrm/thr_wing/e6_pc_ridge_avggrm_thr_wing_best_trials/split_06_best_trial.json
2026-06-01 00:43:30 | INFO | src.nested_cv_avggrm_weighted_unified | Trial 9 | outer=6 | alpha=8.868e+03 n_pcs=2000 (pc_topk) weight_search=on
2026-06-01 00:43:30 | INFO | src.nested_cv_avggrm_weighted_unified | Trial 9 | outer=6 | weight={'name': 'linear', 'floor': 1e-06, 'clip_max': 20.0, 'min_weight': 0.861124149305412, 'max_weight': 4.702809729786679}
2026-06-01 00:43:32 | INFO | src.nested_cv_avggrm_weighted_unified | Trial 9 | outer=6 | pruned after 6/10 inner folds (mean r=0.1860)
[I 2026-06-01 00:43:32,363] Trial 9 pruned. 
2026-06-01 00:43:32 | INFO | src.nested_cv_avggrm_weighted_unified | Trial 10 | outer=6 | alpha=5.986e+05 n_pcs=500 (pc_topk) weight_search=on
2026-06-01 00:43:32 | INFO | src.nested_cv_avggrm_weighted_unified | Trial 10 | outer=6 | weight={'name': 'linear', 'floor': 1e-06, 'clip_max': 5.0, 'min_weight': 0.6649918033453551, 'max_weight': 1.3005022441588598}
2026-06-01 00:43:32 | INFO | src.nested_cv_avggrm_weighted_unified | Trial 10 | outer=6 | pruned after 5/10 inner folds (mean r=0.1885)
[I 2026-06-01 00:43:32,865] Trial 10 pruned. 
2026-06-01 00:43:32 | INFO | src.nested_cv_avggrm_weighted_unified | Trial 11 | outer=6 | alpha=9.820e+06 n_pcs=3500 (pc_topk) weight_search=on
2026-06-01 00:43:32 | INFO | src.nested_cv_avggrm_weighted_unified | Trial 11 | outer=6 | weight={'name': 'exponential', 'floor': 1e-06, 'clip_max': 5.0, 'beta': 8.928948956746435}
[I 2026-06-01 00:43:38,060] Trial 11 finished with value: 0.22102674236595168 and parameters: {'alpha': 9819751.211795544, 'n_pcs': 3500, 'weight_scheme': 'exponential', 'weight_clip_max': 5.0, 'weight_exponential_beta': 8.928948956746435}. Best is trial 8 with value: 0.23176131923967258.
2026-06-01 00:43:38 | INFO | src.nested_cv_avggrm_weighted_unified | Trial 12 | outer=6 | alpha=8.246e+05 n_pcs=1500 (pc_topk) weight_search=on
2026-06-01 00:43:38 | INFO | src.nested_cv_avggrm_weighted_unified | Trial 12 | outer=6 | weight={'name': 'exponential', 'floor': 1e-06, 'clip_max': 3.0, 'beta': 5.982934772883383}
[I 2026-06-01 00:43:39,999] Trial 12 finished with value: 0.22777768961887684 and parameters: {'alpha': 824606.3021630079, 'n_pcs': 1500, 'weight_scheme': 'exponential', 'weight_clip_max': 3.0, 'weight_exponential_beta': 5.982934772883383}. Best is trial 8 with value: 0.23176131923967258.
2026-06-01 00:43:40 | INFO | src.nested_cv_avggrm_weighted_unified | Trial 13 | outer=6 | alpha=5.945e+05 n_pcs=3000 (pc_topk) weight_search=on
2026-06-01 00:43:40 | INFO | src.nested_cv_avggrm_weighted_unified | Trial 13 | outer=6 | weight={'name': 'linear', 'floor': 1e-06, 'clip_max': 5.0, 'min_weight': 0.44725940969778444, 'max_weight': 1.689579879242048}
[I 2026-06-01 00:43:44,422] Trial 13 finished with value: 0.2264937930191903 and parameters: {'alpha': 594462.3939741419, 'n_pcs': 3000, 'weight_scheme': 'linear', 'weight_clip_max': 5.0, 'weight_linear_min_weight': 0.44725940969778444, 'weight_linear_max_weight': 1.689579879242048}. Best is trial 8 with value: 0.23176131923967258.
2026-06-01 00:43:44 | INFO | src.nested_cv_avggrm_weighted_unified | Trial 14 | outer=6 | alpha=6.828e+06 n_pcs=3000 (pc_topk) weight_search=on
2026-06-01 00:43:44 | INFO | src.nested_cv_avggrm_weighted_unified | Trial 14 | outer=6 | weight={'name': 'uniform', 'floor': 1e-06, 'clip_max': 5.0}
2026-06-01 00:43:45 | INFO | src.nested_cv_avggrm_weighted_unified | Trial 14 | outer=6 | pruned after 5/10 inner folds (mean r=0.2000)
[I 2026-06-01 00:43:45,910] Trial 14 pruned. 
2026-06-01 00:43:45 | INFO | src.nested_cv_avggrm_weighted_unified | Trial 15 | outer=6 | alpha=2.575e+06 n_pcs=1500 (pc_topk) weight_search=on
2026-06-01 00:43:45 | INFO | src.nested_cv_avggrm_weighted_unified | Trial 15 | outer=6 | weight={'name': 'linear', 'floor': 1e-06, 'clip_max': 3.0, 'min_weight': 0.9689803782581343, 'max_weight': 4.9100809859168315}
2026-06-01 00:43:46 | INFO | src.nested_cv_avggrm_weighted_unified | Trial 15 | outer=6 | pruned after 6/10 inner folds (mean r=0.2388)
[I 2026-06-01 00:43:46,983] Trial 15 pruned. 
2026-06-01 00:43:46 | INFO | src.nested_cv_avggrm_weighted_unified | Trial 16 | outer=6 | alpha=1.971e+05 n_pcs=4000 (pc_topk) weight_search=on
2026-06-01 00:43:46 | INFO | src.nested_cv_avggrm_weighted_unified | Trial 16 | outer=6 | weight={'name': 'exponential', 'floor': 1e-06, 'clip_max': 5.0, 'beta': 6.257422035595178}
[I 2026-06-01 00:43:52,176] Trial 16 finished with value: 0.23733190345414826 and parameters: {'alpha': 197062.07683822478, 'n_pcs': 4000, 'weight_scheme': 'exponential', 'weight_clip_max': 5.0, 'weight_exponential_beta': 6.257422035595178}. Best is trial 16 with value: 0.23733190345414826.
2026-06-01 00:43:52 | INFO | src.nested_cv_avggrm_weighted_unified | OUTER 6 | new best trial 16 (mean inner r=0.2373) saved to outputs/final_results/e6_pc_ridge_avggrm/thr_wing/e6_pc_ridge_avggrm_thr_wing_best_trials/split_06_best_trial.json
2026-06-01 00:43:52 | INFO | src.nested_cv_avggrm_weighted_unified | Trial 17 | outer=6 | alpha=1.429e+05 n_pcs=5000 (pc_topk) weight_search=on
2026-06-01 00:43:52 | INFO | src.nested_cv_avggrm_weighted_unified | Trial 17 | outer=6 | weight={'name': 'exponential', 'floor': 1e-06, 'clip_max': 5.0, 'beta': 4.7609444110373085}
[I 2026-06-01 00:43:58,935] Trial 17 finished with value: 0.23605507968689707 and parameters: {'alpha': 142925.80558027924, 'n_pcs': 5000, 'weight_scheme': 'exponential', 'weight_clip_max': 5.0, 'weight_exponential_beta': 4.7609444110373085}. Best is trial 16 with value: 0.23733190345414826.
2026-06-01 00:43:58 | INFO | src.nested_cv_avggrm_weighted_unified | Trial 18 | outer=6 | alpha=1.758e+05 n_pcs=5000 (pc_topk) weight_search=on
2026-06-01 00:43:58 | INFO | src.nested_cv_avggrm_weighted_unified | Trial 18 | outer=6 | weight={'name': 'exponential', 'floor': 1e-06, 'clip_max': 5.0, 'beta': 4.760399744704552}
[I 2026-06-01 00:44:05,652] Trial 18 finished with value: 0.23602157403802035 and parameters: {'alpha': 175775.55039751038, 'n_pcs': 5000, 'weight_scheme': 'exponential', 'weight_clip_max': 5.0, 'weight_exponential_beta': 4.760399744704552}. Best is trial 16 with value: 0.23733190345414826.
2026-06-01 00:44:05 | INFO | src.nested_cv_avggrm_weighted_unified | Trial 19 | outer=6 | alpha=2.750e+05 n_pcs=4500 (pc_topk) weight_search=on
2026-06-01 00:44:05 | INFO | src.nested_cv_avggrm_weighted_unified | Trial 19 | outer=6 | weight={'name': 'exponential', 'floor': 1e-06, 'clip_max': 5.0, 'beta': 5.124407753064943}
[I 2026-06-01 00:44:12,091] Trial 19 finished with value: 0.23642058859162463 and parameters: {'alpha': 274975.166841956, 'n_pcs': 4500, 'weight_scheme': 'exponential', 'weight_clip_max': 5.0, 'weight_exponential_beta': 5.124407753064943}. Best is trial 16 with value: 0.23733190345414826.
2026-06-01 00:44:12 | INFO | src.nested_cv_avggrm_weighted_unified | Trial 20 | outer=6 | alpha=3.003e+05 n_pcs=4000 (pc_topk) weight_search=on
2026-06-01 00:44:12 | INFO | src.nested_cv_avggrm_weighted_unified | Trial 20 | outer=6 | weight={'name': 'exponential', 'floor': 1e-06, 'clip_max': 5.0, 'beta': 6.589285077096443}
[I 2026-06-01 00:44:17,319] Trial 20 finished with value: 0.23691286990053118 and parameters: {'alpha': 300298.03378528677, 'n_pcs': 4000, 'weight_scheme': 'exponential', 'weight_clip_max': 5.0, 'weight_exponential_beta': 6.589285077096443}. Best is trial 16 with value: 0.23733190345414826.
2026-06-01 00:44:17 | INFO | src.nested_cv_avggrm_weighted_unified | Trial 21 | outer=6 | alpha=2.529e+05 n_pcs=4000 (pc_topk) weight_search=on
2026-06-01 00:44:17 | INFO | src.nested_cv_avggrm_weighted_unified | Trial 21 | outer=6 | weight={'name': 'exponential', 'floor': 1e-06, 'clip_max': 5.0, 'beta': 6.399014959933055}
[I 2026-06-01 00:44:22,458] Trial 21 finished with value: 0.23721094540370205 and parameters: {'alpha': 252944.45213961488, 'n_pcs': 4000, 'weight_scheme': 'exponential', 'weight_clip_max': 5.0, 'weight_exponential_beta': 6.399014959933055}. Best is trial 16 with value: 0.23733190345414826.
2026-06-01 00:44:22 | INFO | src.nested_cv_avggrm_weighted_unified | Trial 22 | outer=6 | alpha=3.123e+05 n_pcs=4000 (pc_topk) weight_search=on
2026-06-01 00:44:22 | INFO | src.nested_cv_avggrm_weighted_unified | Trial 22 | outer=6 | weight={'name': 'exponential', 'floor': 1e-06, 'clip_max': 5.0, 'beta': 6.974422999094264}
[I 2026-06-01 00:44:27,557] Trial 22 finished with value: 0.2366694445586018 and parameters: {'alpha': 312318.8050715251, 'n_pcs': 4000, 'weight_scheme': 'exponential', 'weight_clip_max': 5.0, 'weight_exponential_beta': 6.974422999094264}. Best is trial 16 with value: 0.23733190345414826.
2026-06-01 00:44:27 | INFO | src.nested_cv_avggrm_weighted_unified | Trial 23 | outer=6 | alpha=1.902e+06 n_pcs=3500 (pc_topk) weight_search=on
2026-06-01 00:44:27 | INFO | src.nested_cv_avggrm_weighted_unified | Trial 23 | outer=6 | weight={'name': 'exponential', 'floor': 1e-06, 'clip_max': 5.0, 'beta': 7.170834769892776}
