[I 2026-06-01 01:08:22,838] Trial 53 finished with value: 0.22836002660360263 and parameters: {'alpha': 75100.91650989145, 'n_pcs': 4000, 'weight_scheme': 'linear', 'weight_clip_max': 20.0, 'weight_linear_min_weight': 0.258998963071039, 'weight_linear_max_weight': 3.424110477468894}. Best is trial 38 with value: 0.22840307880907104.
2026-06-01 01:08:22 | INFO | src.nested_cv_avggrm_weighted_unified | Trial 54 | outer=7 | alpha=7.882e+04 n_pcs=4000 (pc_topk) weight_search=on
2026-06-01 01:08:22 | INFO | src.nested_cv_avggrm_weighted_unified | Trial 54 | outer=7 | weight={'name': 'linear', 'floor': 1e-06, 'clip_max': 20.0, 'min_weight': 0.18087974810490312, 'max_weight': 3.266049362996241}
[I 2026-06-01 01:08:28,668] Trial 54 finished with value: 0.22837352656486626 and parameters: {'alpha': 78816.8660067558, 'n_pcs': 4000, 'weight_scheme': 'linear', 'weight_clip_max': 20.0, 'weight_linear_min_weight': 0.18087974810490312, 'weight_linear_max_weight': 3.266049362996241}. Best is trial 38 with value: 0.22840307880907104.
2026-06-01 01:08:28 | INFO | src.nested_cv_avggrm_weighted_unified | Trial 55 | outer=7 | alpha=8.248e+04 n_pcs=3500 (pc_topk) weight_search=on
2026-06-01 01:08:28 | INFO | src.nested_cv_avggrm_weighted_unified | Trial 55 | outer=7 | weight={'name': 'exponential', 'floor': 1e-06, 'clip_max': 20.0, 'beta': 3.306816181572241}
[I 2026-06-01 01:08:33,481] Trial 55 finished with value: 0.226105966769296 and parameters: {'alpha': 82475.29460131799, 'n_pcs': 3500, 'weight_scheme': 'exponential', 'weight_clip_max': 20.0, 'weight_exponential_beta': 3.306816181572241}. Best is trial 38 with value: 0.22840307880907104.
2026-06-01 01:08:33 | INFO | src.nested_cv_avggrm_weighted_unified | Trial 56 | outer=7 | alpha=1.637e+05 n_pcs=5000 (pc_topk) weight_search=on
2026-06-01 01:08:33 | INFO | src.nested_cv_avggrm_weighted_unified | Trial 56 | outer=7 | weight={'name': 'linear', 'floor': 1e-06, 'clip_max': 20.0, 'min_weight': 0.16285120100925887, 'max_weight': 3.319322411140001}
[I 2026-06-01 01:08:41,485] Trial 56 finished with value: 0.22249233289219972 and parameters: {'alpha': 163684.99606527996, 'n_pcs': 5000, 'weight_scheme': 'linear', 'weight_clip_max': 20.0, 'weight_linear_min_weight': 0.16285120100925887, 'weight_linear_max_weight': 3.319322411140001}. Best is trial 38 with value: 0.22840307880907104.
2026-06-01 01:08:41 | INFO | src.nested_cv_avggrm_weighted_unified | Trial 57 | outer=7 | alpha=2.734e+05 n_pcs=4500 (pc_topk) weight_search=on
2026-06-01 01:08:41 | INFO | src.nested_cv_avggrm_weighted_unified | Trial 57 | outer=7 | weight={'name': 'linear', 'floor': 1e-06, 'clip_max': 20.0, 'min_weight': 0.2358564019385895, 'max_weight': 3.789316423820662}
[I 2026-06-01 01:08:48,247] Trial 57 finished with value: 0.21926332420789527 and parameters: {'alpha': 273409.6322892011, 'n_pcs': 4500, 'weight_scheme': 'linear', 'weight_clip_max': 20.0, 'weight_linear_min_weight': 0.2358564019385895, 'weight_linear_max_weight': 3.789316423820662}. Best is trial 38 with value: 0.22840307880907104.
2026-06-01 01:08:48 | INFO | src.nested_cv_avggrm_weighted_unified | Trial 58 | outer=7 | alpha=8.603e+04 n_pcs=4000 (pc_topk) weight_search=on
2026-06-01 01:08:48 | INFO | src.nested_cv_avggrm_weighted_unified | Trial 58 | outer=7 | weight={'name': 'linear', 'floor': 1e-06, 'clip_max': None, 'min_weight': 0.1005949469408195, 'max_weight': 3.2226607171470976}
[I 2026-06-01 01:08:53,862] Trial 58 finished with value: 0.2282443112611688 and parameters: {'alpha': 86034.34727978802, 'n_pcs': 4000, 'weight_scheme': 'linear', 'weight_clip_max': None, 'weight_linear_min_weight': 0.1005949469408195, 'weight_linear_max_weight': 3.2226607171470976}. Best is trial 38 with value: 0.22840307880907104.
2026-06-01 01:08:53 | INFO | src.nested_cv_avggrm_weighted_unified | Trial 59 | outer=7 | alpha=4.240e+05 n_pcs=4500 (pc_topk) weight_search=on
2026-06-01 01:08:53 | INFO | src.nested_cv_avggrm_weighted_unified | Trial 59 | outer=7 | weight={'name': 'linear', 'floor': 1e-06, 'clip_max': None, 'min_weight': 0.08524059592384203, 'max_weight': 3.246548179026205}
[I 2026-06-01 01:09:00,603] Trial 59 finished with value: 0.21645091626980473 and parameters: {'alpha': 423995.8797741242, 'n_pcs': 4500, 'weight_scheme': 'linear', 'weight_clip_max': None, 'weight_linear_min_weight': 0.08524059592384203, 'weight_linear_max_weight': 3.246548179026205}. Best is trial 38 with value: 0.22840307880907104.
2026-06-01 01:09:00 | INFO | src.nested_cv_avggrm_weighted_unified | Trial 60 | outer=7 | alpha=1.047e+05 n_pcs=3000 (pc_topk) weight_search=on
2026-06-01 01:09:00 | INFO | src.nested_cv_avggrm_weighted_unified | Trial 60 | outer=7 | weight={'name': 'exponential', 'floor': 1e-06, 'clip_max': None, 'beta': 3.8796481424122695}
[I 2026-06-01 01:09:04,419] Trial 60 finished with value: 0.22397200798040512 and parameters: {'alpha': 104687.09812450164, 'n_pcs': 3000, 'weight_scheme': 'exponential', 'weight_clip_max': None, 'weight_exponential_beta': 3.8796481424122695}. Best is trial 38 with value: 0.22840307880907104.
2026-06-01 01:09:04 | INFO | src.nested_cv_avggrm_weighted_unified | Trial 61 | outer=7 | alpha=7.344e+04 n_pcs=4000 (pc_topk) weight_search=on
2026-06-01 01:09:04 | INFO | src.nested_cv_avggrm_weighted_unified | Trial 61 | outer=7 | weight={'name': 'linear', 'floor': 1e-06, 'clip_max': None, 'min_weight': 0.1509928615872368, 'max_weight': 4.031295469985293}
[I 2026-06-01 01:09:10,035] Trial 61 finished with value: 0.22856269672746823 and parameters: {'alpha': 73443.22759720442, 'n_pcs': 4000, 'weight_scheme': 'linear', 'weight_clip_max': None, 'weight_linear_min_weight': 0.1509928615872368, 'weight_linear_max_weight': 4.031295469985293}. Best is trial 61 with value: 0.22856269672746823.
2026-06-01 01:09:10 | INFO | src.nested_cv_avggrm_weighted_unified | OUTER 7 | new best trial 61 (mean inner r=0.2286) saved to outputs/final_results/e6_pc_ridge_avggrm/thr_wing/e6_pc_ridge_avggrm_thr_wing_best_trials/split_07_best_trial.json
2026-06-01 01:09:10 | INFO | src.nested_cv_avggrm_weighted_unified | Trial 62 | outer=7 | alpha=7.432e+04 n_pcs=4000 (pc_topk) weight_search=on
2026-06-01 01:09:10 | INFO | src.nested_cv_avggrm_weighted_unified | Trial 62 | outer=7 | weight={'name': 'linear', 'floor': 1e-06, 'clip_max': None, 'min_weight': 0.12022988493874312, 'max_weight': 4.630879972103207}
[I 2026-06-01 01:09:16,179] Trial 62 finished with value: 0.22852868171227692 and parameters: {'alpha': 74320.65712749504, 'n_pcs': 4000, 'weight_scheme': 'linear', 'weight_clip_max': None, 'weight_linear_min_weight': 0.12022988493874312, 'weight_linear_max_weight': 4.630879972103207}. Best is trial 61 with value: 0.22856269672746823.
2026-06-01 01:09:16 | INFO | src.nested_cv_avggrm_weighted_unified | Trial 63 | outer=7 | alpha=6.197e+04 n_pcs=3500 (pc_topk) weight_search=on
2026-06-01 01:09:16 | INFO | src.nested_cv_avggrm_weighted_unified | Trial 63 | outer=7 | weight={'name': 'linear', 'floor': 1e-06, 'clip_max': None, 'min_weight': 0.1808501497670968, 'max_weight': 4.325804430483836}
[I 2026-06-01 01:09:21,164] Trial 63 finished with value: 0.22554798172266222 and parameters: {'alpha': 61968.49260513653, 'n_pcs': 3500, 'weight_scheme': 'linear', 'weight_clip_max': None, 'weight_linear_min_weight': 0.1808501497670968, 'weight_linear_max_weight': 4.325804430483836}. Best is trial 61 with value: 0.22856269672746823.
2026-06-01 01:09:21 | INFO | src.nested_cv_avggrm_weighted_unified | Trial 64 | outer=7 | alpha=2.397e+04 n_pcs=4500 (pc_topk) weight_search=on
2026-06-01 01:09:21 | INFO | src.nested_cv_avggrm_weighted_unified | Trial 64 | outer=7 | weight={'name': 'linear', 'floor': 1e-06, 'clip_max': None, 'min_weight': 0.14745317162686689, 'max_weight': 4.327282864549274}
[I 2026-06-01 01:09:28,023] Trial 64 finished with value: 0.22561928119815802 and parameters: {'alpha': 23973.40846482553, 'n_pcs': 4500, 'weight_scheme': 'linear', 'weight_clip_max': None, 'weight_linear_min_weight': 0.14745317162686689, 'weight_linear_max_weight': 4.327282864549274}. Best is trial 61 with value: 0.22856269672746823.
2026-06-01 01:09:28 | INFO | src.nested_cv_avggrm_weighted_unified | Trial 65 | outer=7 | alpha=2.013e+05 n_pcs=4000 (pc_topk) weight_search=on
2026-06-01 01:09:28 | INFO | src.nested_cv_avggrm_weighted_unified | Trial 65 | outer=7 | weight={'name': 'linear', 'floor': 1e-06, 'clip_max': None, 'min_weight': 0.24295126118510404, 'max_weight': 4.291927962862556}
[I 2026-06-01 01:09:33,695] Trial 65 finished with value: 0.22304521896182386 and parameters: {'alpha': 201306.8131390432, 'n_pcs': 4000, 'weight_scheme': 'linear', 'weight_clip_max': None, 'weight_linear_min_weight': 0.24295126118510404, 'weight_linear_max_weight': 4.291927962862556}. Best is trial 61 with value: 0.22856269672746823.
2026-06-01 01:09:33 | INFO | src.nested_cv_avggrm_weighted_unified | Trial 66 | outer=7 | alpha=1.223e+05 n_pcs=4500 (pc_topk) weight_search=on
2026-06-01 01:09:33 | INFO | src.nested_cv_avggrm_weighted_unified | Trial 66 | outer=7 | weight={'name': 'uniform', 'floor': 1e-06, 'clip_max': 5.0}
[I 2026-06-01 01:09:39,716] Trial 66 finished with value: 0.20992915461299338 and parameters: {'alpha': 122252.53867932818, 'n_pcs': 4500, 'weight_scheme': 'uniform', 'weight_clip_max': 5.0}. Best is trial 61 with value: 0.22856269672746823.
2026-06-01 01:09:39 | INFO | src.nested_cv_avggrm_weighted_unified | Trial 67 | outer=7 | alpha=6.523e+04 n_pcs=3500 (pc_topk) weight_search=on
2026-06-01 01:09:39 | INFO | src.nested_cv_avggrm_weighted_unified | Trial 67 | outer=7 | weight={'name': 'linear', 'floor': 1e-06, 'clip_max': None, 'min_weight': 0.05586622232426186, 'max_weight': 4.640909151884996}
[I 2026-06-01 01:09:44,567] Trial 67 finished with value: 0.2253860128366917 and parameters: {'alpha': 65229.60715701763, 'n_pcs': 3500, 'weight_scheme': 'linear', 'weight_clip_max': None, 'weight_linear_min_weight': 0.05586622232426186, 'weight_linear_max_weight': 4.640909151884996}. Best is trial 61 with value: 0.22856269672746823.
2026-06-01 01:09:44 | INFO | src.nested_cv_avggrm_weighted_unified | Trial 68 | outer=7 | alpha=1.813e+04 n_pcs=4000 (pc_topk) weight_search=on
2026-06-01 01:09:44 | INFO | src.nested_cv_avggrm_weighted_unified | Trial 68 | outer=7 | weight={'name': 'linear', 'floor': 1e-06, 'clip_max': None, 'min_weight': 0.13843363938776299, 'max_weight': 3.937258392508296}
[I 2026-06-01 01:09:50,266] Trial 68 finished with value: 0.2190744671601319 and parameters: {'alpha': 18130.483707536, 'n_pcs': 4000, 'weight_scheme': 'linear', 'weight_clip_max': None, 'weight_linear_min_weight': 0.13843363938776299, 'weight_linear_max_weight': 3.937258392508296}. Best is trial 61 with value: 0.22856269672746823.
2026-06-01 01:09:50 | INFO | src.nested_cv_avggrm_weighted_unified | Trial 69 | outer=7 | alpha=2.779e+04 n_pcs=4500 (pc_topk) weight_search=on
2026-06-01 01:09:50 | INFO | src.nested_cv_avggrm_weighted_unified | Trial 69 | outer=7 | weight={'name': 'linear', 'floor': 1e-06, 'clip_max': 3.0, 'min_weight': 0.8245339226877968, 'max_weight': 3.436756250104556}
[I 2026-06-01 01:09:57,126] Trial 69 finished with value: 0.22658131795754533 and parameters: {'alpha': 27789.095794305736, 'n_pcs': 4500, 'weight_scheme': 'linear', 'weight_clip_max': 3.0, 'weight_linear_min_weight': 0.8245339226877968, 'weight_linear_max_weight': 3.436756250104556}. Best is trial 61 with value: 0.22856269672746823.
2026-06-01 01:09:57 | INFO | src.nested_cv_avggrm_weighted_unified | Trial 70 | outer=7 | alpha=8.873e+04 n_pcs=500 (pc_topk) weight_search=on
2026-06-01 01:09:57 | INFO | src.nested_cv_avggrm_weighted_unified | Trial 70 | outer=7 | weight={'name': 'linear', 'floor': 1e-06, 'clip_max': 5.0, 'min_weight': 0.19749530550517758, 'max_weight': 2.8195580216679934}
2026-06-01 01:09:57 | INFO | src.nested_cv_avggrm_weighted_unified | Trial 70 | outer=7 | pruned after 5/10 inner folds (mean r=0.1910)
[I 2026-06-01 01:09:57,566] Trial 70 pruned. 
2026-06-01 01:09:57 | INFO | src.nested_cv_avggrm_weighted_unified | Trial 71 | outer=7 | alpha=8.441e+04 n_pcs=4000 (pc_topk) weight_search=on
2026-06-01 01:09:57 | INFO | src.nested_cv_avggrm_weighted_unified | Trial 71 | outer=7 | weight={'name': 'linear', 'floor': 1e-06, 'clip_max': None, 'min_weight': 0.09068460386292226, 'max_weight': 3.1742327667606944}
[I 2026-06-01 01:10:03,638] Trial 71 finished with value: 0.22829682842943036 and parameters: {'alpha': 84412.16502214214, 'n_pcs': 4000, 'weight_scheme': 'linear', 'weight_clip_max': None, 'weight_linear_min_weight': 0.09068460386292226, 'weight_linear_max_weight': 3.1742327667606944}. Best is trial 61 with value: 0.22856269672746823.
2026-06-01 01:10:03 | INFO | src.nested_cv_avggrm_weighted_unified | Trial 72 | outer=7 | alpha=5.781e+04 n_pcs=4000 (pc_topk) weight_search=on
2026-06-01 01:10:03 | INFO | src.nested_cv_avggrm_weighted_unified | Trial 72 | outer=7 | weight={'name': 'linear', 'floor': 1e-06, 'clip_max': None, 'min_weight': 0.11454379170038669, 'max_weight': 2.9192529635539413}
[I 2026-06-01 01:10:09,273] Trial 72 finished with value: 0.22864501730187348 and parameters: {'alpha': 57805.72921672365, 'n_pcs': 4000, 'weight_scheme': 'linear', 'weight_clip_max': None, 'weight_linear_min_weight': 0.11454379170038669, 'weight_linear_max_weight': 2.9192529635539413}. Best is trial 72 with value: 0.22864501730187348.
2026-06-01 01:10:09 | INFO | src.nested_cv_avggrm_weighted_unified | OUTER 7 | new best trial 72 (mean inner r=0.2286) saved to outputs/final_results/e6_pc_ridge_avggrm/thr_wing/e6_pc_ridge_avggrm_thr_wing_best_trials/split_07_best_trial.json
2026-06-01 01:10:09 | INFO | src.nested_cv_avggrm_weighted_unified | Trial 73 | outer=7 | alpha=1.846e+05 n_pcs=4000 (pc_topk) weight_search=on
2026-06-01 01:10:09 | INFO | src.nested_cv_avggrm_weighted_unified | Trial 73 | outer=7 | weight={'name': 'linear', 'floor': 1e-06, 'clip_max': None, 'min_weight': 0.11451286550670964, 'max_weight': 2.9760602251900963}
[I 2026-06-01 01:10:15,342] Trial 73 finished with value: 0.22412691681198046 and parameters: {'alpha': 184606.0927510955, 'n_pcs': 4000, 'weight_scheme': 'linear', 'weight_clip_max': None, 'weight_linear_min_weight': 0.11451286550670964, 'weight_linear_max_weight': 2.9760602251900963}. Best is trial 72 with value: 0.22864501730187348.
2026-06-01 01:10:15 | INFO | src.nested_cv_avggrm_weighted_unified | Trial 74 | outer=7 | alpha=1.269e+05 n_pcs=3500 (pc_topk) weight_search=on
2026-06-01 01:10:15 | INFO | src.nested_cv_avggrm_weighted_unified | Trial 74 | outer=7 | weight={'name': 'linear', 'floor': 1e-06, 'clip_max': None, 'min_weight': 0.08343314380527518, 'max_weight': 2.9801812938297547}
[I 2026-06-01 01:10:20,114] Trial 74 finished with value: 0.22516587706053642 and parameters: {'alpha': 126864.92575441148, 'n_pcs': 3500, 'weight_scheme': 'linear', 'weight_clip_max': None, 'weight_linear_min_weight': 0.08343314380527518, 'weight_linear_max_weight': 2.9801812938297547}. Best is trial 72 with value: 0.22864501730187348.
2026-06-01 01:10:20 | INFO | src.nested_cv_avggrm_weighted_unified | Trial 75 | outer=7 | alpha=3.454e+04 n_pcs=4000 (pc_topk) weight_search=on
2026-06-01 01:10:20 | INFO | src.nested_cv_avggrm_weighted_unified | Trial 75 | outer=7 | weight={'name': 'linear', 'floor': 1e-06, 'clip_max': None, 'min_weight': 0.16172675088446686, 'max_weight': 3.74780497364103}
[I 2026-06-01 01:10:25,737] Trial 75 finished with value: 0.22674380678321024 and parameters: {'alpha': 34541.20659163311, 'n_pcs': 4000, 'weight_scheme': 'linear', 'weight_clip_max': None, 'weight_linear_min_weight': 0.16172675088446686, 'weight_linear_max_weight': 3.74780497364103}. Best is trial 72 with value: 0.22864501730187348.
2026-06-01 01:10:25 | INFO | src.nested_cv_avggrm_weighted_unified | Trial 76 | outer=7 | alpha=2.591e+05 n_pcs=4500 (pc_topk) weight_search=on
2026-06-01 01:10:25 | INFO | src.nested_cv_avggrm_weighted_unified | Trial 76 | outer=7 | weight={'name': 'linear', 'floor': 1e-06, 'clip_max': None, 'min_weight': 0.11228021655149319, 'max_weight': 3.114953237254277}
[I 2026-06-01 01:10:32,546] Trial 76 finished with value: 0.2205072482082034 and parameters: {'alpha': 259068.05496389826, 'n_pcs': 4500, 'weight_scheme': 'linear', 'weight_clip_max': None, 'weight_linear_min_weight': 0.11228021655149319, 'weight_linear_max_weight': 3.114953237254277}. Best is trial 72 with value: 0.22864501730187348.
2026-06-01 01:10:32 | INFO | src.nested_cv_avggrm_weighted_unified | Trial 77 | outer=7 | alpha=5.980e+04 n_pcs=3500 (pc_topk) weight_search=on
2026-06-01 01:10:32 | INFO | src.nested_cv_avggrm_weighted_unified | Trial 77 | outer=7 | weight={'name': 'linear', 'floor': 1e-06, 'clip_max': None, 'min_weight': 0.26825315593356025, 'max_weight': 2.7115353319789897}
[I 2026-06-01 01:10:37,350] Trial 77 finished with value: 0.22546915295271922 and parameters: {'alpha': 59795.109269902045, 'n_pcs': 3500, 'weight_scheme': 'linear', 'weight_clip_max': None, 'weight_linear_min_weight': 0.26825315593356025, 'weight_linear_max_weight': 2.7115353319789897}. Best is trial 72 with value: 0.22864501730187348.
2026-06-01 01:10:37 | INFO | src.nested_cv_avggrm_weighted_unified | Trial 78 | outer=7 | alpha=7.774e+04 n_pcs=4000 (pc_topk) weight_search=on
2026-06-01 01:10:37 | INFO | src.nested_cv_avggrm_weighted_unified | Trial 78 | outer=7 | weight={'name': 'uniform', 'floor': 1e-06, 'clip_max': None}
[I 2026-06-01 01:10:42,207] Trial 78 finished with value: 0.21581895281283248 and parameters: {'alpha': 77736.48248467845, 'n_pcs': 4000, 'weight_scheme': 'uniform', 'weight_clip_max': None}. Best is trial 72 with value: 0.22864501730187348.
2026-06-01 01:10:42 | INFO | src.nested_cv_avggrm_weighted_unified | Trial 79 | outer=7 | alpha=9.882e+04 n_pcs=4000 (pc_topk) weight_search=on
2026-06-01 01:10:42 | INFO | src.nested_cv_avggrm_weighted_unified | Trial 79 | outer=7 | weight={'name': 'linear', 'floor': 1e-06, 'clip_max': None, 'min_weight': 0.5928329106960337, 'max_weight': 3.49860791577321}
[I 2026-06-01 01:10:47,826] Trial 79 finished with value: 0.2258621822776131 and parameters: {'alpha': 98822.9255856498, 'n_pcs': 4000, 'weight_scheme': 'linear', 'weight_clip_max': None, 'weight_linear_min_weight': 0.5928329106960337, 'weight_linear_max_weight': 3.49860791577321}. Best is trial 72 with value: 0.22864501730187348.
2026-06-01 01:10:47 | INFO | src.nested_cv_avggrm_weighted_unified | Trial 80 | outer=7 | alpha=2.683e+04 n_pcs=5000 (pc_topk) weight_search=on
2026-06-01 01:10:47 | INFO | src.nested_cv_avggrm_weighted_unified | Trial 80 | outer=7 | weight={'name': 'exponential', 'floor': 1e-06, 'clip_max': None, 'beta': 7.274213390536963}
[I 2026-06-01 01:10:55,835] Trial 80 finished with value: 0.22384286395433292 and parameters: {'alpha': 26830.436274365955, 'n_pcs': 5000, 'weight_scheme': 'exponential', 'weight_clip_max': None, 'weight_exponential_beta': 7.274213390536963}. Best is trial 72 with value: 0.22864501730187348.
2026-06-01 01:10:55 | INFO | src.nested_cv_avggrm_weighted_unified | Trial 81 | outer=7 | alpha=5.272e+04 n_pcs=4000 (pc_topk) weight_search=on
2026-06-01 01:10:55 | INFO | src.nested_cv_avggrm_weighted_unified | Trial 81 | outer=7 | weight={'name': 'linear', 'floor': 1e-06, 'clip_max': 20.0, 'min_weight': 0.18731041785367472, 'max_weight': 4.111262955517111}
[I 2026-06-01 01:11:01,487] Trial 81 finished with value: 0.22856243304495324 and parameters: {'alpha': 52721.051581160275, 'n_pcs': 4000, 'weight_scheme': 'linear', 'weight_clip_max': 20.0, 'weight_linear_min_weight': 0.18731041785367472, 'weight_linear_max_weight': 4.111262955517111}. Best is trial 72 with value: 0.22864501730187348.
2026-06-01 01:11:01 | INFO | src.nested_cv_avggrm_weighted_unified | Trial 82 | outer=7 | alpha=5.231e+04 n_pcs=4000 (pc_topk) weight_search=on
2026-06-01 01:11:01 | INFO | src.nested_cv_avggrm_weighted_unified | Trial 82 | outer=7 | weight={'name': 'linear', 'floor': 1e-06, 'clip_max': 20.0, 'min_weight': 0.17402187717920786, 'max_weight': 4.558216040566831}
[I 2026-06-01 01:11:07,107] Trial 82 finished with value: 0.2284983605089559 and parameters: {'alpha': 52308.58077299748, 'n_pcs': 4000, 'weight_scheme': 'linear', 'weight_clip_max': 20.0, 'weight_linear_min_weight': 0.17402187717920786, 'weight_linear_max_weight': 4.558216040566831}. Best is trial 72 with value: 0.22864501730187348.
2026-06-01 01:11:07 | INFO | src.nested_cv_avggrm_weighted_unified | Trial 83 | outer=7 | alpha=4.833e+04 n_pcs=4500 (pc_topk) weight_search=on
2026-06-01 01:11:07 | INFO | src.nested_cv_avggrm_weighted_unified | Trial 83 | outer=7 | weight={'name': 'linear', 'floor': 1e-06, 'clip_max': 20.0, 'min_weight': 0.19193740445672902, 'max_weight': 4.611982541715451}
[I 2026-06-01 01:11:13,906] Trial 83 finished with value: 0.2287321870874001 and parameters: {'alpha': 48330.17239722411, 'n_pcs': 4500, 'weight_scheme': 'linear', 'weight_clip_max': 20.0, 'weight_linear_min_weight': 0.19193740445672902, 'weight_linear_max_weight': 4.611982541715451}. Best is trial 83 with value: 0.2287321870874001.
2026-06-01 01:11:13 | INFO | src.nested_cv_avggrm_weighted_unified | OUTER 7 | new best trial 83 (mean inner r=0.2287) saved to outputs/final_results/e6_pc_ridge_avggrm/thr_wing/e6_pc_ridge_avggrm_thr_wing_best_trials/split_07_best_trial.json
2026-06-01 01:11:13 | INFO | src.nested_cv_avggrm_weighted_unified | Trial 84 | outer=7 | alpha=1.289e+04 n_pcs=4500 (pc_topk) weight_search=on
2026-06-01 01:11:13 | INFO | src.nested_cv_avggrm_weighted_unified | Trial 84 | outer=7 | weight={'name': 'linear', 'floor': 1e-06, 'clip_max': 20.0, 'min_weight': 0.18688216216915343, 'max_weight': 4.577702748574922}
