[I 2026-06-01 18:33:26,123] Trial 34 finished with value: 0.24402750642232046 and parameters: {'alpha': 207616.65972710526, 'n_pcs': 4500, 'iw_method': 'pc_logistic', 'iw_clip_max': 4.0, 'iw_prob_clip': 0.021217090657884154, 'iw_n_components': 40, 'iw_logistic_c': 7.700415317664056e-05, 'iw_pca_fit': 'combined', 'iw_solver': 'lbfgs', 'iw_rho': 0.5}. Best is trial 17 with value: 0.2523770525022446.
2026-06-01 18:33:26 | INFO | Trial 35 | outer=5 | alpha=2.436e+04 n_pcs=4000 (pc_topk) weight={'name': 'pc_logistic', 'floor': 1e-06, 'clip_max': 4.0, 'prob_clip': 0.005704105088901605, 'n_components': 60, 'logistic_c': 0.022081122402272953, 'pca_fit': 'combined', 'solver': 'lbfgs', 'max_iter': 2000, 'fit_intercept': True, 'standardize_with_source': True, 'rho': 0.7}
[I 2026-06-01 18:33:56,929] Trial 35 finished with value: 0.24354178553898262 and parameters: {'alpha': 24359.38378370015, 'n_pcs': 4000, 'iw_method': 'pc_logistic', 'iw_clip_max': 4.0, 'iw_prob_clip': 0.005704105088901605, 'iw_n_components': 60, 'iw_logistic_c': 0.022081122402272953, 'iw_pca_fit': 'combined', 'iw_solver': 'lbfgs', 'iw_rho': 0.7}. Best is trial 17 with value: 0.2523770525022446.
2026-06-01 18:33:56 | INFO | Trial 36 | outer=5 | alpha=6.083e+05 n_pcs=3500 (pc_topk) weight={'name': 'pc_logistic', 'floor': 1e-06, 'clip_max': 2.5, 'prob_clip': 0.003137136241157283, 'n_components': 40, 'logistic_c': 9.587949150836692e-05, 'pca_fit': 'combined', 'solver': 'lbfgs', 'max_iter': 2000, 'fit_intercept': True, 'standardize_with_source': True, 'rho': 0.3}
[I 2026-06-01 18:34:08,851] Trial 36 finished with value: 0.22787159201027068 and parameters: {'alpha': 608347.4400361724, 'n_pcs': 3500, 'iw_method': 'pc_logistic', 'iw_clip_max': 2.5, 'iw_prob_clip': 0.003137136241157283, 'iw_n_components': 40, 'iw_logistic_c': 9.587949150836692e-05, 'iw_pca_fit': 'combined', 'iw_solver': 'lbfgs', 'iw_rho': 0.3}. Best is trial 17 with value: 0.2523770525022446.
2026-06-01 18:34:08 | INFO | Trial 37 | outer=5 | alpha=2.773e+06 n_pcs=5000 (pc_topk) weight={'name': 'pc_logistic', 'floor': 1e-06, 'clip_max': 1.5, 'prob_clip': 0.011373203047289577, 'n_components': 40, 'logistic_c': 4.367495686742524e-06, 'pca_fit': 'combined', 'solver': 'lbfgs', 'max_iter': 2000, 'fit_intercept': True, 'standardize_with_source': True, 'rho': 0.5}
[I 2026-06-01 18:34:39,063] Trial 37 finished with value: 0.20686194525930568 and parameters: {'alpha': 2772851.208718843, 'n_pcs': 5000, 'iw_method': 'pc_logistic', 'iw_clip_max': 1.5, 'iw_prob_clip': 0.011373203047289577, 'iw_n_components': 40, 'iw_logistic_c': 4.367495686742524e-06, 'iw_pca_fit': 'combined', 'iw_solver': 'lbfgs', 'iw_rho': 0.5}. Best is trial 17 with value: 0.2523770525022446.
2026-06-01 18:34:39 | INFO | Trial 38 | outer=5 | alpha=1.462e+05 n_pcs=4500 (pc_topk) weight={'name': 'pc_logistic', 'floor': 1e-06, 'clip_max': 12.0, 'prob_clip': 0.029529057554362748, 'n_components': 20, 'logistic_c': 0.0010537982010524235, 'pca_fit': 'combined', 'solver': 'lbfgs', 'max_iter': 2000, 'fit_intercept': True, 'standardize_with_source': True, 'rho': 0.3}
[I 2026-06-01 18:34:59,784] Trial 38 finished with value: 0.24247973550997165 and parameters: {'alpha': 146168.61367171322, 'n_pcs': 4500, 'iw_method': 'pc_logistic', 'iw_clip_max': 12.0, 'iw_prob_clip': 0.029529057554362748, 'iw_n_components': 20, 'iw_logistic_c': 0.0010537982010524235, 'iw_pca_fit': 'combined', 'iw_solver': 'lbfgs', 'iw_rho': 0.3}. Best is trial 17 with value: 0.2523770525022446.
2026-06-01 18:34:59 | INFO | Trial 39 | outer=5 | alpha=8.124e+04 n_pcs=1500 (pc_topk) weight={'name': 'uniform'}
[I 2026-06-01 18:35:03,079] Trial 39 finished with value: 0.2217412007185689 and parameters: {'alpha': 81238.73010932145, 'n_pcs': 1500, 'iw_method': 'uniform'}. Best is trial 17 with value: 0.2523770525022446.
2026-06-01 18:35:03 | INFO | Trial 40 | outer=5 | alpha=1.087e+04 n_pcs=4000 (pc_topk) weight={'name': 'pc_logistic', 'floor': 1e-06, 'clip_max': 1.5, 'prob_clip': 0.0019420215601351175, 'n_components': 100, 'logistic_c': 0.25454130844120976, 'pca_fit': 'combined', 'solver': 'lbfgs', 'max_iter': 2000, 'fit_intercept': True, 'standardize_with_source': True, 'rho': 1.0}
[I 2026-06-01 18:35:34,127] Trial 40 finished with value: 0.23353071185063184 and parameters: {'alpha': 10869.001227661014, 'n_pcs': 4000, 'iw_method': 'pc_logistic', 'iw_clip_max': 1.5, 'iw_prob_clip': 0.0019420215601351175, 'iw_n_components': 100, 'iw_logistic_c': 0.25454130844120976, 'iw_pca_fit': 'combined', 'iw_solver': 'lbfgs', 'iw_rho': 1.0}. Best is trial 17 with value: 0.2523770525022446.
2026-06-01 18:35:34 | INFO | Trial 41 | outer=5 | alpha=6.466e+04 n_pcs=4500 (pc_topk) weight={'name': 'pc_logistic', 'floor': 1e-06, 'clip_max': 4.0, 'prob_clip': 0.006246204658929793, 'n_components': 60, 'logistic_c': 0.021842797171554053, 'pca_fit': 'combined', 'solver': 'lbfgs', 'max_iter': 2000, 'fit_intercept': True, 'standardize_with_source': True, 'rho': 0.5}
[I 2026-06-01 18:36:00,909] Trial 41 finished with value: 0.2501854742832549 and parameters: {'alpha': 64661.19283724263, 'n_pcs': 4500, 'iw_method': 'pc_logistic', 'iw_clip_max': 4.0, 'iw_prob_clip': 0.006246204658929793, 'iw_n_components': 60, 'iw_logistic_c': 0.021842797171554053, 'iw_pca_fit': 'combined', 'iw_solver': 'lbfgs', 'iw_rho': 0.5}. Best is trial 17 with value: 0.2523770525022446.
2026-06-01 18:36:00 | INFO | Trial 42 | outer=5 | alpha=5.552e+04 n_pcs=4500 (pc_topk) weight={'name': 'pc_logistic', 'floor': 1e-06, 'clip_max': 4.0, 'prob_clip': 0.006242981768324863, 'n_components': 60, 'logistic_c': 0.8824963345812545, 'pca_fit': 'combined', 'solver': 'lbfgs', 'max_iter': 2000, 'fit_intercept': True, 'standardize_with_source': True, 'rho': 0.5}
[I 2026-06-01 18:36:30,254] Trial 42 finished with value: 0.2503991408297285 and parameters: {'alpha': 55523.037553274226, 'n_pcs': 4500, 'iw_method': 'pc_logistic', 'iw_clip_max': 4.0, 'iw_prob_clip': 0.006242981768324863, 'iw_n_components': 60, 'iw_logistic_c': 0.8824963345812545, 'iw_pca_fit': 'combined', 'iw_solver': 'lbfgs', 'iw_rho': 0.5}. Best is trial 17 with value: 0.2523770525022446.
2026-06-01 18:36:30 | INFO | Trial 43 | outer=5 | alpha=2.019e+04 n_pcs=4000 (pc_topk) weight={'name': 'pc_logistic', 'floor': 1e-06, 'clip_max': 4.0, 'prob_clip': 0.005899231142445788, 'n_components': 60, 'logistic_c': 2.311263108489904, 'pca_fit': 'combined', 'solver': 'lbfgs', 'max_iter': 2000, 'fit_intercept': True, 'standardize_with_source': True, 'rho': 0.5}
[I 2026-06-01 18:36:55,212] Trial 43 finished with value: 0.24350960804610958 and parameters: {'alpha': 20194.272708929693, 'n_pcs': 4000, 'iw_method': 'pc_logistic', 'iw_clip_max': 4.0, 'iw_prob_clip': 0.005899231142445788, 'iw_n_components': 60, 'iw_logistic_c': 2.311263108489904, 'iw_pca_fit': 'combined', 'iw_solver': 'lbfgs', 'iw_rho': 0.5}. Best is trial 17 with value: 0.2523770525022446.
2026-06-01 18:36:55 | INFO | Trial 44 | outer=5 | alpha=5.252e+04 n_pcs=5000 (pc_topk) weight={'name': 'pc_logistic', 'floor': 1e-06, 'clip_max': 4.0, 'prob_clip': 0.0034525866409766412, 'n_components': 80, 'logistic_c': 2.569488722981398, 'pca_fit': 'combined', 'solver': 'lbfgs', 'max_iter': 2000, 'fit_intercept': True, 'standardize_with_source': True, 'rho': 0.7}
[I 2026-06-01 18:37:27,671] Trial 44 finished with value: 0.25098328166639694 and parameters: {'alpha': 52520.65425009792, 'n_pcs': 5000, 'iw_method': 'pc_logistic', 'iw_clip_max': 4.0, 'iw_prob_clip': 0.0034525866409766412, 'iw_n_components': 80, 'iw_logistic_c': 2.569488722981398, 'iw_pca_fit': 'combined', 'iw_solver': 'lbfgs', 'iw_rho': 0.7}. Best is trial 17 with value: 0.2523770525022446.
2026-06-01 18:37:27 | INFO | Trial 45 | outer=5 | alpha=1.183e+05 n_pcs=5000 (pc_topk) weight={'name': 'pc_logistic', 'floor': 1e-06, 'clip_max': 4.0, 'prob_clip': 0.0038830144214042723, 'n_components': 80, 'logistic_c': 8.730697173643929, 'pca_fit': 'combined', 'solver': 'lbfgs', 'max_iter': 2000, 'fit_intercept': True, 'standardize_with_source': True, 'rho': 0.7}
[I 2026-06-01 18:37:58,958] Trial 45 finished with value: 0.2481244596290974 and parameters: {'alpha': 118277.48477982017, 'n_pcs': 5000, 'iw_method': 'pc_logistic', 'iw_clip_max': 4.0, 'iw_prob_clip': 0.0038830144214042723, 'iw_n_components': 80, 'iw_logistic_c': 8.730697173643929, 'iw_pca_fit': 'combined', 'iw_solver': 'lbfgs', 'iw_rho': 0.7}. Best is trial 17 with value: 0.2523770525022446.
2026-06-01 18:37:58 | INFO | Trial 46 | outer=5 | alpha=1.943e+05 n_pcs=5000 (pc_topk) weight={'name': 'pc_logistic', 'floor': 1e-06, 'clip_max': 7.0, 'prob_clip': 0.0018790395335991255, 'n_components': 80, 'logistic_c': 0.8281054251525339, 'pca_fit': 'combined', 'solver': 'lbfgs', 'max_iter': 2000, 'fit_intercept': True, 'standardize_with_source': True, 'rho': 0.7}
[I 2026-06-01 18:38:40,641] Trial 46 finished with value: 0.24275122378002317 and parameters: {'alpha': 194290.75239064748, 'n_pcs': 5000, 'iw_method': 'pc_logistic', 'iw_clip_max': 7.0, 'iw_prob_clip': 0.0018790395335991255, 'iw_n_components': 80, 'iw_logistic_c': 0.8281054251525339, 'iw_pca_fit': 'combined', 'iw_solver': 'lbfgs', 'iw_rho': 0.7}. Best is trial 17 with value: 0.2523770525022446.
2026-06-01 18:38:40 | INFO | Trial 47 | outer=5 | alpha=5.542e+04 n_pcs=3500 (pc_topk) weight={'name': 'uniform'}
[I 2026-06-01 18:38:53,171] Trial 47 finished with value: 0.2378702737175457 and parameters: {'alpha': 55423.048748623994, 'n_pcs': 3500, 'iw_method': 'uniform'}. Best is trial 17 with value: 0.2523770525022446.
2026-06-01 18:38:53 | INFO | Trial 48 | outer=5 | alpha=1.065e+04 n_pcs=5000 (pc_topk) weight={'name': 'pc_logistic', 'floor': 1e-06, 'clip_max': 12.0, 'prob_clip': 0.004236651692682301, 'n_components': 80, 'logistic_c': 1.4077766390548703, 'pca_fit': 'combined', 'solver': 'lbfgs', 'max_iter': 2000, 'fit_intercept': True, 'standardize_with_source': True, 'rho': 0.7}
[I 2026-06-01 18:39:37,822] Trial 48 finished with value: 0.24275025948111945 and parameters: {'alpha': 10653.515830659646, 'n_pcs': 5000, 'iw_method': 'pc_logistic', 'iw_clip_max': 12.0, 'iw_prob_clip': 0.004236651692682301, 'iw_n_components': 80, 'iw_logistic_c': 1.4077766390548703, 'iw_pca_fit': 'combined', 'iw_solver': 'lbfgs', 'iw_rho': 0.7}. Best is trial 17 with value: 0.2523770525022446.
2026-06-01 18:39:37 | INFO | Trial 49 | outer=5 | alpha=2.525e+04 n_pcs=4500 (pc_topk) weight={'name': 'pc_logistic', 'floor': 1e-06, 'clip_max': 2.5, 'prob_clip': 0.015865239605404338, 'n_components': 10, 'logistic_c': 9.229017417339238, 'pca_fit': 'combined', 'solver': 'lbfgs', 'max_iter': 2000, 'fit_intercept': True, 'standardize_with_source': True, 'rho': 1.0}
[I 2026-06-01 18:40:11,233] Trial 49 finished with value: 0.24655363354372914 and parameters: {'alpha': 25252.495024207543, 'n_pcs': 4500, 'iw_method': 'pc_logistic', 'iw_clip_max': 2.5, 'iw_prob_clip': 0.015865239605404338, 'iw_n_components': 10, 'iw_logistic_c': 9.229017417339238, 'iw_pca_fit': 'combined', 'iw_solver': 'lbfgs', 'iw_rho': 1.0}. Best is trial 17 with value: 0.2523770525022446.
2026-06-01 18:40:11 | INFO | Trial 50 | outer=5 | alpha=1.550e+04 n_pcs=3000 (pc_topk) weight={'name': 'uniform'}
[I 2026-06-01 18:40:17,313] Trial 50 finished with value: 0.22565718083510897 and parameters: {'alpha': 15495.548836198508, 'n_pcs': 3000, 'iw_method': 'uniform'}. Best is trial 17 with value: 0.2523770525022446.
2026-06-01 18:40:17 | INFO | Trial 51 | outer=5 | alpha=4.893e+04 n_pcs=4500 (pc_topk) weight={'name': 'pc_logistic', 'floor': 1e-06, 'clip_max': 4.0, 'prob_clip': 0.006783172750408256, 'n_components': 80, 'logistic_c': 0.3925130726435737, 'pca_fit': 'combined', 'solver': 'lbfgs', 'max_iter': 2000, 'fit_intercept': True, 'standardize_with_source': True, 'rho': 0.7}
[I 2026-06-01 18:40:53,389] Trial 51 finished with value: 0.25495053028727277 and parameters: {'alpha': 48927.08436367806, 'n_pcs': 4500, 'iw_method': 'pc_logistic', 'iw_clip_max': 4.0, 'iw_prob_clip': 0.006783172750408256, 'iw_n_components': 80, 'iw_logistic_c': 0.3925130726435737, 'iw_pca_fit': 'combined', 'iw_solver': 'lbfgs', 'iw_rho': 0.7}. Best is trial 51 with value: 0.25495053028727277.
2026-06-01 18:40:53 | INFO | Trial 52 | outer=5 | alpha=4.781e+04 n_pcs=5000 (pc_topk) weight={'name': 'pc_logistic', 'floor': 1e-06, 'clip_max': 4.0, 'prob_clip': 0.0027200579210725283, 'n_components': 80, 'logistic_c': 0.41935618102537886, 'pca_fit': 'combined', 'solver': 'lbfgs', 'max_iter': 2000, 'fit_intercept': True, 'standardize_with_source': True, 'rho': 0.7}
[I 2026-06-01 18:41:27,534] Trial 52 finished with value: 0.25137588361134505 and parameters: {'alpha': 47814.52899262275, 'n_pcs': 5000, 'iw_method': 'pc_logistic', 'iw_clip_max': 4.0, 'iw_prob_clip': 0.0027200579210725283, 'iw_n_components': 80, 'iw_logistic_c': 0.41935618102537886, 'iw_pca_fit': 'combined', 'iw_solver': 'lbfgs', 'iw_rho': 0.7}. Best is trial 51 with value: 0.25495053028727277.
2026-06-01 18:41:27 | INFO | Trial 53 | outer=5 | alpha=3.392e+04 n_pcs=5000 (pc_topk) weight={'name': 'pc_logistic', 'floor': 1e-06, 'clip_max': 4.0, 'prob_clip': 0.0011880631875892853, 'n_components': 80, 'logistic_c': 0.31825911242869576, 'pca_fit': 'combined', 'solver': 'lbfgs', 'max_iter': 2000, 'fit_intercept': True, 'standardize_with_source': True, 'rho': 0.7}
[I 2026-06-01 18:42:05,245] Trial 53 finished with value: 0.25012771116505605 and parameters: {'alpha': 33917.39793375635, 'n_pcs': 5000, 'iw_method': 'pc_logistic', 'iw_clip_max': 4.0, 'iw_prob_clip': 0.0011880631875892853, 'iw_n_components': 80, 'iw_logistic_c': 0.31825911242869576, 'iw_pca_fit': 'combined', 'iw_solver': 'lbfgs', 'iw_rho': 0.7}. Best is trial 51 with value: 0.25495053028727277.
2026-06-01 18:42:05 | INFO | Trial 54 | outer=5 | alpha=4.775e+04 n_pcs=5000 (pc_topk) weight={'name': 'pc_logistic', 'floor': 1e-06, 'clip_max': 4.0, 'prob_clip': 0.0028378528890025665, 'n_components': 80, 'logistic_c': 1.0515852276119405e-07, 'pca_fit': 'combined', 'solver': 'lbfgs', 'max_iter': 2000, 'fit_intercept': True, 'standardize_with_source': True, 'rho': 0.7}
[I 2026-06-01 18:42:27,182] Trial 54 finished with value: 0.24021509349022518 and parameters: {'alpha': 47747.518436668215, 'n_pcs': 5000, 'iw_method': 'pc_logistic', 'iw_clip_max': 4.0, 'iw_prob_clip': 0.0028378528890025665, 'iw_n_components': 80, 'iw_logistic_c': 1.0515852276119405e-07, 'iw_pca_fit': 'combined', 'iw_solver': 'lbfgs', 'iw_rho': 0.7}. Best is trial 51 with value: 0.25495053028727277.
2026-06-01 18:42:27 | INFO | Trial 55 | outer=5 | alpha=1.401e+04 n_pcs=5000 (pc_topk) weight={'name': 'pc_logistic', 'floor': 1e-06, 'clip_max': 12.0, 'prob_clip': 0.002620978407685102, 'n_components': 80, 'logistic_c': 3.83024549453443, 'pca_fit': 'combined', 'solver': 'lbfgs', 'max_iter': 2000, 'fit_intercept': True, 'standardize_with_source': True, 'rho': 0.7}
[I 2026-06-01 18:43:11,361] Trial 55 finished with value: 0.24477157995519122 and parameters: {'alpha': 14005.873608650742, 'n_pcs': 5000, 'iw_method': 'pc_logistic', 'iw_clip_max': 12.0, 'iw_prob_clip': 0.002620978407685102, 'iw_n_components': 80, 'iw_logistic_c': 3.83024549453443, 'iw_pca_fit': 'combined', 'iw_solver': 'lbfgs', 'iw_rho': 0.7}. Best is trial 51 with value: 0.25495053028727277.
2026-06-01 18:43:11 | INFO | Trial 56 | outer=5 | alpha=9.839e+04 n_pcs=4000 (pc_topk) weight={'name': 'pc_logistic', 'floor': 1e-06, 'clip_max': 7.0, 'prob_clip': 0.0038800601284949892, 'n_components': 80, 'logistic_c': 0.00030020436865681497, 'pca_fit': 'combined', 'solver': 'lbfgs', 'max_iter': 2000, 'fit_intercept': True, 'standardize_with_source': True, 'rho': 0.7}
[I 2026-06-01 18:43:26,376] Trial 56 finished with value: 0.2494877685244175 and parameters: {'alpha': 98385.62752511208, 'n_pcs': 4000, 'iw_method': 'pc_logistic', 'iw_clip_max': 7.0, 'iw_prob_clip': 0.0038800601284949892, 'iw_n_components': 80, 'iw_logistic_c': 0.00030020436865681497, 'iw_pca_fit': 'combined', 'iw_solver': 'lbfgs', 'iw_rho': 0.7}. Best is trial 51 with value: 0.25495053028727277.
2026-06-01 18:43:26 | INFO | Trial 57 | outer=5 | alpha=2.685e+04 n_pcs=4500 (pc_topk) weight={'name': 'pc_logistic', 'floor': 1e-06, 'clip_max': 4.0, 'prob_clip': 0.036220751145975026, 'n_components': 80, 'logistic_c': 3.670998858938056e-05, 'pca_fit': 'combined', 'solver': 'lbfgs', 'max_iter': 2000, 'fit_intercept': True, 'standardize_with_source': True, 'rho': 0.7}
[I 2026-06-01 18:43:40,961] Trial 57 finished with value: 0.2554448748384519 and parameters: {'alpha': 26848.552742090887, 'n_pcs': 4500, 'iw_method': 'pc_logistic', 'iw_clip_max': 4.0, 'iw_prob_clip': 0.036220751145975026, 'iw_n_components': 80, 'iw_logistic_c': 3.670998858938056e-05, 'iw_pca_fit': 'combined', 'iw_solver': 'lbfgs', 'iw_rho': 0.7}. Best is trial 57 with value: 0.2554448748384519.
2026-06-01 18:43:40 | INFO | Trial 58 | outer=5 | alpha=1.782e+05 n_pcs=1000 (pc_topk) weight={'name': 'pc_logistic', 'floor': 1e-06, 'clip_max': 4.0, 'prob_clip': 0.033875495980943804, 'n_components': 80, 'logistic_c': 5.522861436256575e-06, 'pca_fit': 'combined', 'solver': 'lbfgs', 'max_iter': 2000, 'fit_intercept': True, 'standardize_with_source': True, 'rho': 0.7}
[I 2026-06-01 18:43:47,738] Trial 58 finished with value: 0.23244526786851005 and parameters: {'alpha': 178231.73291715182, 'n_pcs': 1000, 'iw_method': 'pc_logistic', 'iw_clip_max': 4.0, 'iw_prob_clip': 0.033875495980943804, 'iw_n_components': 80, 'iw_logistic_c': 5.522861436256575e-06, 'iw_pca_fit': 'combined', 'iw_solver': 'lbfgs', 'iw_rho': 0.7}. Best is trial 57 with value: 0.2554448748384519.
2026-06-01 18:43:47 | INFO | Trial 59 | outer=5 | alpha=2.559e+04 n_pcs=4500 (pc_topk) weight={'name': 'uniform'}
[I 2026-06-01 18:43:56,735] Trial 59 finished with value: 0.24371654555159156 and parameters: {'alpha': 25592.765403736466, 'n_pcs': 4500, 'iw_method': 'uniform'}. Best is trial 57 with value: 0.2554448748384519.
2026-06-01 18:43:56 | INFO | Trial 60 | outer=5 | alpha=7.071e+03 n_pcs=2000 (pc_topk) weight={'name': 'pc_logistic', 'floor': 1e-06, 'clip_max': 4.0, 'prob_clip': 0.0014488931894866034, 'n_components': 80, 'logistic_c': 3.2366300416890035e-05, 'pca_fit': 'combined', 'solver': 'lbfgs', 'max_iter': 2000, 'fit_intercept': True, 'standardize_with_source': True, 'rho': 0.7}
[I 2026-06-01 18:44:05,916] Trial 60 finished with value: 0.1996231415701547 and parameters: {'alpha': 7070.752742902616, 'n_pcs': 2000, 'iw_method': 'pc_logistic', 'iw_clip_max': 4.0, 'iw_prob_clip': 0.0014488931894866034, 'iw_n_components': 80, 'iw_logistic_c': 3.2366300416890035e-05, 'iw_pca_fit': 'combined', 'iw_solver': 'lbfgs', 'iw_rho': 0.7}. Best is trial 57 with value: 0.2554448748384519.
2026-06-01 18:44:05 | INFO | Trial 61 | outer=5 | alpha=2.071e+04 n_pcs=4500 (pc_topk) weight={'name': 'pc_logistic', 'floor': 1e-06, 'clip_max': 4.0, 'prob_clip': 0.03522902138341996, 'n_components': 80, 'logistic_c': 3.264291336549432e-05, 'pca_fit': 'combined', 'solver': 'lbfgs', 'max_iter': 2000, 'fit_intercept': True, 'standardize_with_source': True, 'rho': 0.7}
[I 2026-06-01 18:44:20,715] Trial 61 finished with value: 0.25378810383357486 and parameters: {'alpha': 20712.07368670282, 'n_pcs': 4500, 'iw_method': 'pc_logistic', 'iw_clip_max': 4.0, 'iw_prob_clip': 0.03522902138341996, 'iw_n_components': 80, 'iw_logistic_c': 3.264291336549432e-05, 'iw_pca_fit': 'combined', 'iw_solver': 'lbfgs', 'iw_rho': 0.7}. Best is trial 57 with value: 0.2554448748384519.
2026-06-01 18:44:20 | INFO | Trial 62 | outer=5 | alpha=4.232e+04 n_pcs=4000 (pc_topk) weight={'name': 'pc_logistic', 'floor': 1e-06, 'clip_max': 4.0, 'prob_clip': 0.033795707683173574, 'n_components': 80, 'logistic_c': 4.5362675508636356e-05, 'pca_fit': 'combined', 'solver': 'lbfgs', 'max_iter': 2000, 'fit_intercept': True, 'standardize_with_source': True, 'rho': 0.7}
[I 2026-06-01 18:44:34,672] Trial 62 finished with value: 0.2563107245209508 and parameters: {'alpha': 42316.12426936273, 'n_pcs': 4000, 'iw_method': 'pc_logistic', 'iw_clip_max': 4.0, 'iw_prob_clip': 0.033795707683173574, 'iw_n_components': 80, 'iw_logistic_c': 4.5362675508636356e-05, 'iw_pca_fit': 'combined', 'iw_solver': 'lbfgs', 'iw_rho': 0.7}. Best is trial 62 with value: 0.2563107245209508.
2026-06-01 18:44:34 | INFO | Trial 63 | outer=5 | alpha=3.251e+04 n_pcs=3500 (pc_topk) weight={'name': 'pc_logistic', 'floor': 1e-06, 'clip_max': 4.0, 'prob_clip': 0.03782900468067252, 'n_components': 80, 'logistic_c': 0.0001798367305638146, 'pca_fit': 'combined', 'solver': 'lbfgs', 'max_iter': 2000, 'fit_intercept': True, 'standardize_with_source': True, 'rho': 0.85}
[I 2026-06-01 18:44:46,743] Trial 63 finished with value: 0.25010996589788964 and parameters: {'alpha': 32505.849837081576, 'n_pcs': 3500, 'iw_method': 'pc_logistic', 'iw_clip_max': 4.0, 'iw_prob_clip': 0.03782900468067252, 'iw_n_components': 80, 'iw_logistic_c': 0.0001798367305638146, 'iw_pca_fit': 'combined', 'iw_solver': 'lbfgs', 'iw_rho': 0.85}. Best is trial 62 with value: 0.2563107245209508.
2026-06-01 18:44:46 | INFO | Trial 64 | outer=5 | alpha=2.136e+04 n_pcs=4000 (pc_topk) weight={'name': 'pc_logistic', 'floor': 1e-06, 'clip_max': 4.0, 'prob_clip': 0.019282223647786447, 'n_components': 80, 'logistic_c': 8.729768989269247e-06, 'pca_fit': 'combined', 'solver': 'lbfgs', 'max_iter': 2000, 'fit_intercept': True, 'standardize_with_source': True, 'rho': 0.7}
