[I 2026-06-01 16:53:31,495] Trial 250 finished with value: 0.20872605836852326 and parameters: {'alpha': 155229.38677290565, 'n_pcs': 2000, 'iw_method': 'pc_logistic', 'iw_clip_max': 2.5, 'iw_prob_clip': 0.007057079385217098, 'iw_n_components': 80, 'iw_logistic_c': 7.374981107738341e-06, 'iw_pca_fit': 'combined', 'iw_solver': 'lbfgs', 'iw_rho': 1.0}. Best is trial 241 with value: 0.20932368732848952.
2026-06-01 16:53:31 | INFO | Trial 251 | outer=3 | alpha=1.616e+05 n_pcs=2000 (pc_topk) weight={'name': 'uniform'}
[I 2026-06-01 16:53:35,098] Trial 251 finished with value: 0.20092433997115022 and parameters: {'alpha': 161573.85729789027, 'n_pcs': 2000, 'iw_method': 'uniform'}. Best is trial 241 with value: 0.20932368732848952.
2026-06-01 16:53:35 | INFO | Trial 252 | outer=3 | alpha=1.637e+05 n_pcs=2000 (pc_topk) weight={'name': 'pc_logistic', 'floor': 1e-06, 'clip_max': 2.5, 'prob_clip': 0.007088550619921829, 'n_components': 80, 'logistic_c': 2.925484670792924e-06, 'pca_fit': 'combined', 'solver': 'lbfgs', 'max_iter': 2000, 'fit_intercept': True, 'standardize_with_source': True, 'rho': 1.0}
[I 2026-06-01 16:53:44,056] Trial 252 finished with value: 0.20569270149525165 and parameters: {'alpha': 163652.60296398995, 'n_pcs': 2000, 'iw_method': 'pc_logistic', 'iw_clip_max': 2.5, 'iw_prob_clip': 0.007088550619921829, 'iw_n_components': 80, 'iw_logistic_c': 2.925484670792924e-06, 'iw_pca_fit': 'combined', 'iw_solver': 'lbfgs', 'iw_rho': 1.0}. Best is trial 241 with value: 0.20932368732848952.
2026-06-01 16:53:44 | INFO | Trial 253 | outer=3 | alpha=1.393e+05 n_pcs=2000 (pc_topk) weight={'name': 'pc_logistic', 'floor': 1e-06, 'clip_max': 2.5, 'prob_clip': 0.006697306166401182, 'n_components': 80, 'logistic_c': 7.4752466695028e-06, 'pca_fit': 'combined', 'solver': 'lbfgs', 'max_iter': 2000, 'fit_intercept': True, 'standardize_with_source': True, 'rho': 1.0}
[I 2026-06-01 16:53:55,857] Trial 253 finished with value: 0.20886237603918817 and parameters: {'alpha': 139257.891732519, 'n_pcs': 2000, 'iw_method': 'pc_logistic', 'iw_clip_max': 2.5, 'iw_prob_clip': 0.006697306166401182, 'iw_n_components': 80, 'iw_logistic_c': 7.4752466695028e-06, 'iw_pca_fit': 'combined', 'iw_solver': 'lbfgs', 'iw_rho': 1.0}. Best is trial 241 with value: 0.20932368732848952.
2026-06-01 16:53:55 | INFO | Trial 254 | outer=3 | alpha=1.598e+05 n_pcs=2000 (pc_topk) weight={'name': 'pc_logistic', 'floor': 1e-06, 'clip_max': 2.5, 'prob_clip': 0.006378457463846457, 'n_components': 80, 'logistic_c': 7.225280239990617e-06, 'pca_fit': 'combined', 'solver': 'lbfgs', 'max_iter': 2000, 'fit_intercept': True, 'standardize_with_source': True, 'rho': 1.0}
[I 2026-06-01 16:54:05,955] Trial 254 finished with value: 0.20858557550917728 and parameters: {'alpha': 159755.31200208692, 'n_pcs': 2000, 'iw_method': 'pc_logistic', 'iw_clip_max': 2.5, 'iw_prob_clip': 0.006378457463846457, 'iw_n_components': 80, 'iw_logistic_c': 7.225280239990617e-06, 'iw_pca_fit': 'combined', 'iw_solver': 'lbfgs', 'iw_rho': 1.0}. Best is trial 241 with value: 0.20932368732848952.
2026-06-01 16:54:06 | INFO | Trial 255 | outer=3 | alpha=1.615e+05 n_pcs=2000 (pc_topk) weight={'name': 'pc_logistic', 'floor': 1e-06, 'clip_max': 2.5, 'prob_clip': 0.006473907807244913, 'n_components': 80, 'logistic_c': 6.566066125492285e-06, 'pca_fit': 'combined', 'solver': 'lbfgs', 'max_iter': 2000, 'fit_intercept': True, 'standardize_with_source': True, 'rho': 1.0}
[I 2026-06-01 16:54:14,087] Trial 255 finished with value: 0.20818952905344035 and parameters: {'alpha': 161545.0865534329, 'n_pcs': 2000, 'iw_method': 'pc_logistic', 'iw_clip_max': 2.5, 'iw_prob_clip': 0.006473907807244913, 'iw_n_components': 80, 'iw_logistic_c': 6.566066125492285e-06, 'iw_pca_fit': 'combined', 'iw_solver': 'lbfgs', 'iw_rho': 1.0}. Best is trial 241 with value: 0.20932368732848952.
2026-06-01 16:54:14 | INFO | Trial 256 | outer=3 | alpha=1.653e+05 n_pcs=2000 (pc_topk) weight={'name': 'pc_logistic', 'floor': 1e-06, 'clip_max': 2.5, 'prob_clip': 0.006584599919089556, 'n_components': 80, 'logistic_c': 4.312719464227424e-06, 'pca_fit': 'combined', 'solver': 'lbfgs', 'max_iter': 2000, 'fit_intercept': True, 'standardize_with_source': True, 'rho': 1.0}
[I 2026-06-01 16:54:23,079] Trial 256 finished with value: 0.20669390005940924 and parameters: {'alpha': 165283.54229561277, 'n_pcs': 2000, 'iw_method': 'pc_logistic', 'iw_clip_max': 2.5, 'iw_prob_clip': 0.006584599919089556, 'iw_n_components': 80, 'iw_logistic_c': 4.312719464227424e-06, 'iw_pca_fit': 'combined', 'iw_solver': 'lbfgs', 'iw_rho': 1.0}. Best is trial 241 with value: 0.20932368732848952.
2026-06-01 16:54:23 | INFO | Trial 257 | outer=3 | alpha=1.500e+05 n_pcs=2000 (pc_topk) weight={'name': 'pc_logistic', 'floor': 1e-06, 'clip_max': 2.5, 'prob_clip': 0.007420667588484688, 'n_components': 80, 'logistic_c': 6.962040555505501e-06, 'pca_fit': 'combined', 'solver': 'lbfgs', 'max_iter': 2000, 'fit_intercept': True, 'standardize_with_source': True, 'rho': 1.0}
[I 2026-06-01 16:54:31,412] Trial 257 finished with value: 0.20846954105771826 and parameters: {'alpha': 150007.14411864846, 'n_pcs': 2000, 'iw_method': 'pc_logistic', 'iw_clip_max': 2.5, 'iw_prob_clip': 0.007420667588484688, 'iw_n_components': 80, 'iw_logistic_c': 6.962040555505501e-06, 'iw_pca_fit': 'combined', 'iw_solver': 'lbfgs', 'iw_rho': 1.0}. Best is trial 241 with value: 0.20932368732848952.
2026-06-01 16:54:31 | INFO | Trial 258 | outer=3 | alpha=2.101e+05 n_pcs=2000 (pc_topk) weight={'name': 'pc_logistic', 'floor': 1e-06, 'clip_max': 2.5, 'prob_clip': 0.007316485228616216, 'n_components': 80, 'logistic_c': 7.676974905103725e-06, 'pca_fit': 'combined', 'solver': 'lbfgs', 'max_iter': 2000, 'fit_intercept': True, 'standardize_with_source': True, 'rho': 1.0}
[I 2026-06-01 16:54:40,578] Trial 258 finished with value: 0.20816224121980603 and parameters: {'alpha': 210075.4246606052, 'n_pcs': 2000, 'iw_method': 'pc_logistic', 'iw_clip_max': 2.5, 'iw_prob_clip': 0.007316485228616216, 'iw_n_components': 80, 'iw_logistic_c': 7.676974905103725e-06, 'iw_pca_fit': 'combined', 'iw_solver': 'lbfgs', 'iw_rho': 1.0}. Best is trial 241 with value: 0.20932368732848952.
2026-06-01 16:54:40 | INFO | Trial 259 | outer=3 | alpha=1.527e+05 n_pcs=2000 (pc_topk) weight={'name': 'pc_logistic', 'floor': 1e-06, 'clip_max': 2.5, 'prob_clip': 0.005309883447501319, 'n_components': 80, 'logistic_c': 6.2275892214285394e-06, 'pca_fit': 'combined', 'solver': 'lbfgs', 'max_iter': 2000, 'fit_intercept': True, 'standardize_with_source': True, 'rho': 1.0}
[I 2026-06-01 16:54:48,841] Trial 259 finished with value: 0.20813459844359553 and parameters: {'alpha': 152666.6350808617, 'n_pcs': 2000, 'iw_method': 'pc_logistic', 'iw_clip_max': 2.5, 'iw_prob_clip': 0.005309883447501319, 'iw_n_components': 80, 'iw_logistic_c': 6.2275892214285394e-06, 'iw_pca_fit': 'combined', 'iw_solver': 'lbfgs', 'iw_rho': 1.0}. Best is trial 241 with value: 0.20932368732848952.
2026-06-01 16:54:48 | INFO | Trial 260 | outer=3 | alpha=1.381e+05 n_pcs=2000 (pc_topk) weight={'name': 'pc_logistic', 'floor': 1e-06, 'clip_max': 2.5, 'prob_clip': 0.0062424124293053804, 'n_components': 80, 'logistic_c': 3.909441476765775e-06, 'pca_fit': 'combined', 'solver': 'lbfgs', 'max_iter': 2000, 'fit_intercept': True, 'standardize_with_source': True, 'rho': 1.0}
[I 2026-06-01 16:54:57,579] Trial 260 finished with value: 0.20674788768561636 and parameters: {'alpha': 138115.71058245547, 'n_pcs': 2000, 'iw_method': 'pc_logistic', 'iw_clip_max': 2.5, 'iw_prob_clip': 0.0062424124293053804, 'iw_n_components': 80, 'iw_logistic_c': 3.909441476765775e-06, 'iw_pca_fit': 'combined', 'iw_solver': 'lbfgs', 'iw_rho': 1.0}. Best is trial 241 with value: 0.20932368732848952.
2026-06-01 16:54:57 | INFO | Trial 261 | outer=3 | alpha=1.816e+05 n_pcs=2500 (pc_topk) weight={'name': 'pc_logistic', 'floor': 1e-06, 'clip_max': 2.5, 'prob_clip': 0.006733528385704803, 'n_components': 80, 'logistic_c': 7.234288728694263e-06, 'pca_fit': 'combined', 'solver': 'lbfgs', 'max_iter': 2000, 'fit_intercept': True, 'standardize_with_source': True, 'rho': 1.0}
[I 2026-06-01 16:55:07,411] Trial 261 finished with value: 0.20783312570095705 and parameters: {'alpha': 181553.3448348346, 'n_pcs': 2500, 'iw_method': 'pc_logistic', 'iw_clip_max': 2.5, 'iw_prob_clip': 0.006733528385704803, 'iw_n_components': 80, 'iw_logistic_c': 7.234288728694263e-06, 'iw_pca_fit': 'combined', 'iw_solver': 'lbfgs', 'iw_rho': 1.0}. Best is trial 241 with value: 0.20932368732848952.
2026-06-01 16:55:07 | INFO | Trial 262 | outer=3 | alpha=1.352e+05 n_pcs=2000 (pc_topk) weight={'name': 'pc_logistic', 'floor': 1e-06, 'clip_max': 2.5, 'prob_clip': 0.007284668569701078, 'n_components': 80, 'logistic_c': 2.477042978436823e-06, 'pca_fit': 'combined', 'solver': 'lbfgs', 'max_iter': 2000, 'fit_intercept': True, 'standardize_with_source': True, 'rho': 1.0}
[I 2026-06-01 16:55:15,834] Trial 262 finished with value: 0.20585128760624735 and parameters: {'alpha': 135241.6197446441, 'n_pcs': 2000, 'iw_method': 'pc_logistic', 'iw_clip_max': 2.5, 'iw_prob_clip': 0.007284668569701078, 'iw_n_components': 80, 'iw_logistic_c': 2.477042978436823e-06, 'iw_pca_fit': 'combined', 'iw_solver': 'lbfgs', 'iw_rho': 1.0}. Best is trial 241 with value: 0.20932368732848952.
2026-06-01 16:55:15 | INFO | Trial 263 | outer=3 | alpha=2.042e+05 n_pcs=2000 (pc_topk) weight={'name': 'pc_logistic', 'floor': 1e-06, 'clip_max': 2.5, 'prob_clip': 0.004600488399611778, 'n_components': 80, 'logistic_c': 4.8518256564616285e-06, 'pca_fit': 'combined', 'solver': 'lbfgs', 'max_iter': 2000, 'fit_intercept': True, 'standardize_with_source': True, 'rho': 1.0}
[I 2026-06-01 16:55:25,135] Trial 263 finished with value: 0.2065263040990158 and parameters: {'alpha': 204249.698022852, 'n_pcs': 2000, 'iw_method': 'pc_logistic', 'iw_clip_max': 2.5, 'iw_prob_clip': 0.004600488399611778, 'iw_n_components': 80, 'iw_logistic_c': 4.8518256564616285e-06, 'iw_pca_fit': 'combined', 'iw_solver': 'lbfgs', 'iw_rho': 1.0}. Best is trial 241 with value: 0.20932368732848952.
2026-06-01 16:55:25 | INFO | Trial 264 | outer=3 | alpha=1.596e+05 n_pcs=2000 (pc_topk) weight={'name': 'pc_logistic', 'floor': 1e-06, 'clip_max': 2.5, 'prob_clip': 0.006011668649270245, 'n_components': 80, 'logistic_c': 8.6293547185212e-06, 'pca_fit': 'combined', 'solver': 'lbfgs', 'max_iter': 2000, 'fit_intercept': True, 'standardize_with_source': True, 'rho': 1.0}
[I 2026-06-01 16:55:34,402] Trial 264 finished with value: 0.20892830290902661 and parameters: {'alpha': 159647.30462394244, 'n_pcs': 2000, 'iw_method': 'pc_logistic', 'iw_clip_max': 2.5, 'iw_prob_clip': 0.006011668649270245, 'iw_n_components': 80, 'iw_logistic_c': 8.6293547185212e-06, 'iw_pca_fit': 'combined', 'iw_solver': 'lbfgs', 'iw_rho': 1.0}. Best is trial 241 with value: 0.20932368732848952.
2026-06-01 16:55:34 | INFO | Trial 265 | outer=3 | alpha=2.377e+05 n_pcs=2000 (pc_topk) weight={'name': 'pc_logistic', 'floor': 1e-06, 'clip_max': 7.0, 'prob_clip': 0.005964903649476865, 'n_components': 80, 'logistic_c': 8.651534839397513e-06, 'pca_fit': 'combined', 'solver': 'lbfgs', 'max_iter': 2000, 'fit_intercept': True, 'standardize_with_source': True, 'rho': 1.0}
[I 2026-06-01 16:55:42,918] Trial 265 finished with value: 0.2033467202781758 and parameters: {'alpha': 237712.39489974026, 'n_pcs': 2000, 'iw_method': 'pc_logistic', 'iw_clip_max': 7.0, 'iw_prob_clip': 0.005964903649476865, 'iw_n_components': 80, 'iw_logistic_c': 8.651534839397513e-06, 'iw_pca_fit': 'combined', 'iw_solver': 'lbfgs', 'iw_rho': 1.0}. Best is trial 241 with value: 0.20932368732848952.
2026-06-01 16:55:42 | INFO | Trial 266 | outer=3 | alpha=1.314e+05 n_pcs=2500 (pc_topk) weight={'name': 'pc_logistic', 'floor': 1e-06, 'clip_max': 2.5, 'prob_clip': 0.007350092707140727, 'n_components': 80, 'logistic_c': 1.399842054470896e-06, 'pca_fit': 'combined', 'solver': 'lbfgs', 'max_iter': 2000, 'fit_intercept': True, 'standardize_with_source': True, 'rho': 1.0}
[I 2026-06-01 16:55:52,431] Trial 266 finished with value: 0.204440247415834 and parameters: {'alpha': 131431.68608189246, 'n_pcs': 2500, 'iw_method': 'pc_logistic', 'iw_clip_max': 2.5, 'iw_prob_clip': 0.007350092707140727, 'iw_n_components': 80, 'iw_logistic_c': 1.399842054470896e-06, 'iw_pca_fit': 'combined', 'iw_solver': 'lbfgs', 'iw_rho': 1.0}. Best is trial 241 with value: 0.20932368732848952.
2026-06-01 16:55:52 | INFO | Trial 267 | outer=3 | alpha=1.636e+05 n_pcs=2000 (pc_topk) weight={'name': 'pc_logistic', 'floor': 1e-06, 'clip_max': 2.5, 'prob_clip': 0.011929070954467701, 'n_components': 20, 'logistic_c': 9.379143363320458e-06, 'pca_fit': 'combined', 'solver': 'lbfgs', 'max_iter': 2000, 'fit_intercept': True, 'standardize_with_source': True, 'rho': 1.0}
[I 2026-06-01 16:56:01,088] Trial 267 finished with value: 0.20933291711767107 and parameters: {'alpha': 163632.53399865946, 'n_pcs': 2000, 'iw_method': 'pc_logistic', 'iw_clip_max': 2.5, 'iw_prob_clip': 0.011929070954467701, 'iw_n_components': 20, 'iw_logistic_c': 9.379143363320458e-06, 'iw_pca_fit': 'combined', 'iw_solver': 'lbfgs', 'iw_rho': 1.0}. Best is trial 267 with value: 0.20933291711767107.
2026-06-01 16:56:01 | INFO | Trial 268 | outer=3 | alpha=1.799e+05 n_pcs=2000 (pc_topk) weight={'name': 'pc_logistic', 'floor': 1e-06, 'clip_max': 2.5, 'prob_clip': 0.010016850274001494, 'n_components': 20, 'logistic_c': 9.209270747772322e-06, 'pca_fit': 'combined', 'solver': 'lbfgs', 'max_iter': 2000, 'fit_intercept': True, 'standardize_with_source': True, 'rho': 0.3}
[I 2026-06-01 16:56:09,777] Trial 268 finished with value: 0.2053165703355789 and parameters: {'alpha': 179926.50121678814, 'n_pcs': 2000, 'iw_method': 'pc_logistic', 'iw_clip_max': 2.5, 'iw_prob_clip': 0.010016850274001494, 'iw_n_components': 20, 'iw_logistic_c': 9.209270747772322e-06, 'iw_pca_fit': 'combined', 'iw_solver': 'lbfgs', 'iw_rho': 0.3}. Best is trial 267 with value: 0.20933291711767107.
2026-06-01 16:56:09 | INFO | Trial 269 | outer=3 | alpha=1.524e+05 n_pcs=2000 (pc_topk) weight={'name': 'pc_logistic', 'floor': 1e-06, 'clip_max': 12.0, 'prob_clip': 0.012025180515359848, 'n_components': 20, 'logistic_c': 3.4799700635167325e-06, 'pca_fit': 'combined', 'solver': 'lbfgs', 'max_iter': 2000, 'fit_intercept': True, 'standardize_with_source': True, 'rho': 1.0}
[I 2026-06-01 16:56:18,490] Trial 269 finished with value: 0.2059359176586213 and parameters: {'alpha': 152378.12889113836, 'n_pcs': 2000, 'iw_method': 'pc_logistic', 'iw_clip_max': 12.0, 'iw_prob_clip': 0.012025180515359848, 'iw_n_components': 20, 'iw_logistic_c': 3.4799700635167325e-06, 'iw_pca_fit': 'combined', 'iw_solver': 'lbfgs', 'iw_rho': 1.0}. Best is trial 267 with value: 0.20933291711767107.
2026-06-01 16:56:18 | INFO | Trial 270 | outer=3 | alpha=2.145e+05 n_pcs=2000 (pc_topk) weight={'name': 'pc_logistic', 'floor': 1e-06, 'clip_max': 4.0, 'prob_clip': 0.011296153723859429, 'n_components': 20, 'logistic_c': 5.856399079290527e-06, 'pca_fit': 'combined', 'solver': 'lbfgs', 'max_iter': 2000, 'fit_intercept': True, 'standardize_with_source': True, 'rho': 1.0}
[I 2026-06-01 16:56:27,015] Trial 270 finished with value: 0.20571065483459033 and parameters: {'alpha': 214509.29278042397, 'n_pcs': 2000, 'iw_method': 'pc_logistic', 'iw_clip_max': 4.0, 'iw_prob_clip': 0.011296153723859429, 'iw_n_components': 20, 'iw_logistic_c': 5.856399079290527e-06, 'iw_pca_fit': 'combined', 'iw_solver': 'lbfgs', 'iw_rho': 1.0}. Best is trial 267 with value: 0.20933291711767107.
2026-06-01 16:56:27 | INFO | Trial 271 | outer=3 | alpha=1.305e+05 n_pcs=2000 (pc_topk) weight={'name': 'uniform'}
[I 2026-06-01 16:56:30,582] Trial 271 finished with value: 0.20194468977239088 and parameters: {'alpha': 130512.10374035865, 'n_pcs': 2000, 'iw_method': 'uniform'}. Best is trial 267 with value: 0.20933291711767107.
2026-06-01 16:56:30 | INFO | Trial 272 | outer=3 | alpha=1.606e+05 n_pcs=2000 (pc_topk) weight={'name': 'pc_logistic', 'floor': 1e-06, 'clip_max': 2.5, 'prob_clip': 0.013584540357837592, 'n_components': 80, 'logistic_c': 8.996138428935949e-06, 'pca_fit': 'combined', 'solver': 'lbfgs', 'max_iter': 2000, 'fit_intercept': True, 'standardize_with_source': True, 'rho': 1.0}
[I 2026-06-01 16:56:41,579] Trial 272 finished with value: 0.20904763428710554 and parameters: {'alpha': 160577.54118724386, 'n_pcs': 2000, 'iw_method': 'pc_logistic', 'iw_clip_max': 2.5, 'iw_prob_clip': 0.013584540357837592, 'iw_n_components': 80, 'iw_logistic_c': 8.996138428935949e-06, 'iw_pca_fit': 'combined', 'iw_solver': 'lbfgs', 'iw_rho': 1.0}. Best is trial 267 with value: 0.20933291711767107.
2026-06-01 16:56:41 | INFO | Trial 273 | outer=3 | alpha=1.885e+05 n_pcs=2000 (pc_topk) weight={'name': 'pc_logistic', 'floor': 1e-06, 'clip_max': 2.5, 'prob_clip': 0.012741506616307944, 'n_components': 10, 'logistic_c': 8.708401051062116e-06, 'pca_fit': 'combined', 'solver': 'lbfgs', 'max_iter': 2000, 'fit_intercept': True, 'standardize_with_source': True, 'rho': 1.0}
[I 2026-06-01 16:56:49,874] Trial 273 finished with value: 0.2076729635153937 and parameters: {'alpha': 188547.4274044867, 'n_pcs': 2000, 'iw_method': 'pc_logistic', 'iw_clip_max': 2.5, 'iw_prob_clip': 0.012741506616307944, 'iw_n_components': 10, 'iw_logistic_c': 8.708401051062116e-06, 'iw_pca_fit': 'combined', 'iw_solver': 'lbfgs', 'iw_rho': 1.0}. Best is trial 267 with value: 0.20933291711767107.
2026-06-01 16:56:49 | INFO | Trial 274 | outer=3 | alpha=2.467e+05 n_pcs=2000 (pc_topk) weight={'name': 'pc_logistic', 'floor': 1e-06, 'clip_max': 2.5, 'prob_clip': 0.006709637307365237, 'n_components': 80, 'logistic_c': 5.135183439780395e-06, 'pca_fit': 'combined', 'solver': 'lbfgs', 'max_iter': 2000, 'fit_intercept': True, 'standardize_with_source': True, 'rho': 1.0}
[I 2026-06-01 16:56:58,833] Trial 274 finished with value: 0.20608758518891754 and parameters: {'alpha': 246669.99173971792, 'n_pcs': 2000, 'iw_method': 'pc_logistic', 'iw_clip_max': 2.5, 'iw_prob_clip': 0.006709637307365237, 'iw_n_components': 80, 'iw_logistic_c': 5.135183439780395e-06, 'iw_pca_fit': 'combined', 'iw_solver': 'lbfgs', 'iw_rho': 1.0}. Best is trial 267 with value: 0.20933291711767107.
2026-06-01 16:56:58 | INFO | Trial 275 | outer=3 | alpha=1.606e+05 n_pcs=2000 (pc_topk) weight={'name': 'pc_logistic', 'floor': 1e-06, 'clip_max': 2.5, 'prob_clip': 0.0073421995192015695, 'n_components': 80, 'logistic_c': 7.846807369936239e-06, 'pca_fit': 'combined', 'solver': 'lbfgs', 'max_iter': 2000, 'fit_intercept': True, 'standardize_with_source': True, 'rho': 1.0}
[I 2026-06-01 16:57:07,546] Trial 275 finished with value: 0.20876015984163782 and parameters: {'alpha': 160582.37988852148, 'n_pcs': 2000, 'iw_method': 'pc_logistic', 'iw_clip_max': 2.5, 'iw_prob_clip': 0.0073421995192015695, 'iw_n_components': 80, 'iw_logistic_c': 7.846807369936239e-06, 'iw_pca_fit': 'combined', 'iw_solver': 'lbfgs', 'iw_rho': 1.0}. Best is trial 267 with value: 0.20933291711767107.
2026-06-01 16:57:07 | INFO | Trial 276 | outer=3 | alpha=1.633e+05 n_pcs=2000 (pc_topk) weight={'name': 'pc_logistic', 'floor': 1e-06, 'clip_max': 2.5, 'prob_clip': 0.015304105013230672, 'n_components': 80, 'logistic_c': 6.912683999169151e-06, 'pca_fit': 'combined', 'solver': 'lbfgs', 'max_iter': 2000, 'fit_intercept': True, 'standardize_with_source': True, 'rho': 1.0}
[I 2026-06-01 16:57:15,256] Trial 276 finished with value: 0.2083359197740954 and parameters: {'alpha': 163283.6381116883, 'n_pcs': 2000, 'iw_method': 'pc_logistic', 'iw_clip_max': 2.5, 'iw_prob_clip': 0.015304105013230672, 'iw_n_components': 80, 'iw_logistic_c': 6.912683999169151e-06, 'iw_pca_fit': 'combined', 'iw_solver': 'lbfgs', 'iw_rho': 1.0}. Best is trial 267 with value: 0.20933291711767107.
2026-06-01 16:57:15 | INFO | Trial 277 | outer=3 | alpha=1.674e+05 n_pcs=2000 (pc_topk) weight={'name': 'pc_logistic', 'floor': 1e-06, 'clip_max': 2.5, 'prob_clip': 0.01694955460025961, 'n_components': 80, 'logistic_c': 3.698913438120274e-06, 'pca_fit': 'combined', 'solver': 'lbfgs', 'max_iter': 2000, 'fit_intercept': True, 'standardize_with_source': True, 'rho': 1.0}
[I 2026-06-01 16:57:24,205] Trial 277 finished with value: 0.2061962449677181 and parameters: {'alpha': 167428.9279746551, 'n_pcs': 2000, 'iw_method': 'pc_logistic', 'iw_clip_max': 2.5, 'iw_prob_clip': 0.01694955460025961, 'iw_n_components': 80, 'iw_logistic_c': 3.698913438120274e-06, 'iw_pca_fit': 'combined', 'iw_solver': 'lbfgs', 'iw_rho': 1.0}. Best is trial 267 with value: 0.20933291711767107.
2026-06-01 16:57:24 | INFO | Trial 278 | outer=3 | alpha=1.549e+05 n_pcs=2500 (pc_topk) weight={'name': 'pc_logistic', 'floor': 1e-06, 'clip_max': 2.5, 'prob_clip': 0.007608208077229287, 'n_components': 80, 'logistic_c': 6.8169664443104706e-06, 'pca_fit': 'combined', 'solver': 'lbfgs', 'max_iter': 2000, 'fit_intercept': True, 'standardize_with_source': True, 'rho': 1.0}
[I 2026-06-01 16:57:35,020] Trial 278 finished with value: 0.20787245471237575 and parameters: {'alpha': 154904.23231371172, 'n_pcs': 2500, 'iw_method': 'pc_logistic', 'iw_clip_max': 2.5, 'iw_prob_clip': 0.007608208077229287, 'iw_n_components': 80, 'iw_logistic_c': 6.8169664443104706e-06, 'iw_pca_fit': 'combined', 'iw_solver': 'lbfgs', 'iw_rho': 1.0}. Best is trial 267 with value: 0.20933291711767107.
2026-06-01 16:57:35 | INFO | Trial 279 | outer=3 | alpha=2.086e+05 n_pcs=1500 (pc_topk) weight={'name': 'pc_logistic', 'floor': 1e-06, 'clip_max': 2.5, 'prob_clip': 0.014700589238422575, 'n_components': 20, 'logistic_c': 8.811040670088229e-06, 'pca_fit': 'combined', 'solver': 'lbfgs', 'max_iter': 2000, 'fit_intercept': True, 'standardize_with_source': True, 'rho': 1.0}
