[I 2026-06-01 00:22:30,657] Trial 68 finished with value: 0.2562803575218239 and parameters: {'alpha': 49038.54384079, 'n_pcs': 5000, 'weight_scheme': 'exponential', 'weight_clip_max': 20.0, 'weight_exponential_beta': 6.073589970755425}. Best is trial 25 with value: 0.2585216221253553.
2026-06-01 00:22:30 | INFO | src.nested_cv_avggrm_weighted_unified | Trial 69 | outer=5 | alpha=8.196e+03 n_pcs=5000 (pc_topk) weight_search=on
2026-06-01 00:22:30 | INFO | src.nested_cv_avggrm_weighted_unified | Trial 69 | outer=5 | weight={'name': 'exponential', 'floor': 1e-06, 'clip_max': 3.0, 'beta': 4.964815898367399}
2026-06-01 00:22:36 | INFO | src.nested_cv_avggrm_weighted_unified | Trial 69 | outer=5 | pruned after 7/10 inner folds (mean r=0.2557)
[I 2026-06-01 00:22:36,169] Trial 69 pruned. 
2026-06-01 00:22:36 | INFO | src.nested_cv_avggrm_weighted_unified | Trial 70 | outer=5 | alpha=1.122e+05 n_pcs=4500 (pc_topk) weight_search=on
2026-06-01 00:22:36 | INFO | src.nested_cv_avggrm_weighted_unified | Trial 70 | outer=5 | weight={'name': 'exponential', 'floor': 1e-06, 'clip_max': 5.0, 'beta': 4.090228324936002}
[I 2026-06-01 00:22:42,807] Trial 70 finished with value: 0.25737108965565475 and parameters: {'alpha': 112187.83306443472, 'n_pcs': 4500, 'weight_scheme': 'exponential', 'weight_clip_max': 5.0, 'weight_exponential_beta': 4.090228324936002}. Best is trial 25 with value: 0.2585216221253553.
2026-06-01 00:22:42 | INFO | src.nested_cv_avggrm_weighted_unified | Trial 71 | outer=5 | alpha=1.077e+05 n_pcs=4500 (pc_topk) weight_search=on
2026-06-01 00:22:42 | INFO | src.nested_cv_avggrm_weighted_unified | Trial 71 | outer=5 | weight={'name': 'exponential', 'floor': 1e-06, 'clip_max': 5.0, 'beta': 3.8137441083559827}
[I 2026-06-01 00:22:49,441] Trial 71 finished with value: 0.2570273668698061 and parameters: {'alpha': 107739.18121575638, 'n_pcs': 4500, 'weight_scheme': 'exponential', 'weight_clip_max': 5.0, 'weight_exponential_beta': 3.8137441083559827}. Best is trial 25 with value: 0.2585216221253553.
2026-06-01 00:22:49 | INFO | src.nested_cv_avggrm_weighted_unified | Trial 72 | outer=5 | alpha=1.106e+05 n_pcs=4500 (pc_topk) weight_search=on
2026-06-01 00:22:49 | INFO | src.nested_cv_avggrm_weighted_unified | Trial 72 | outer=5 | weight={'name': 'exponential', 'floor': 1e-06, 'clip_max': 5.0, 'beta': 3.4534834883031773}
[I 2026-06-01 00:22:56,060] Trial 72 finished with value: 0.25610436269367265 and parameters: {'alpha': 110619.4656612076, 'n_pcs': 4500, 'weight_scheme': 'exponential', 'weight_clip_max': 5.0, 'weight_exponential_beta': 3.4534834883031773}. Best is trial 25 with value: 0.2585216221253553.
2026-06-01 00:22:56 | INFO | src.nested_cv_avggrm_weighted_unified | Trial 73 | outer=5 | alpha=1.966e+05 n_pcs=4500 (pc_topk) weight_search=on
2026-06-01 00:22:56 | INFO | src.nested_cv_avggrm_weighted_unified | Trial 73 | outer=5 | weight={'name': 'exponential', 'floor': 1e-06, 'clip_max': 5.0, 'beta': 3.16784935146875}
[I 2026-06-01 00:23:02,685] Trial 73 finished with value: 0.25119279156627977 and parameters: {'alpha': 196573.1725448272, 'n_pcs': 4500, 'weight_scheme': 'exponential', 'weight_clip_max': 5.0, 'weight_exponential_beta': 3.16784935146875}. Best is trial 25 with value: 0.2585216221253553.
2026-06-01 00:23:02 | INFO | src.nested_cv_avggrm_weighted_unified | Trial 74 | outer=5 | alpha=6.442e+04 n_pcs=4500 (pc_topk) weight_search=on
2026-06-01 00:23:02 | INFO | src.nested_cv_avggrm_weighted_unified | Trial 74 | outer=5 | weight={'name': 'exponential', 'floor': 1e-06, 'clip_max': 5.0, 'beta': 4.726283396739326}
[I 2026-06-01 00:23:09,325] Trial 74 finished with value: 0.25933602127307637 and parameters: {'alpha': 64417.78844724531, 'n_pcs': 4500, 'weight_scheme': 'exponential', 'weight_clip_max': 5.0, 'weight_exponential_beta': 4.726283396739326}. Best is trial 74 with value: 0.25933602127307637.
2026-06-01 00:23:09 | INFO | src.nested_cv_avggrm_weighted_unified | OUTER 5 | new best trial 74 (mean inner r=0.2593) saved to outputs/final_results/e6_pc_ridge_avggrm/thr_wing/e6_pc_ridge_avggrm_thr_wing_best_trials/split_05_best_trial.json
2026-06-01 00:23:09 | INFO | src.nested_cv_avggrm_weighted_unified | Trial 75 | outer=5 | alpha=7.357e+04 n_pcs=500 (pc_topk) weight_search=on
2026-06-01 00:23:09 | INFO | src.nested_cv_avggrm_weighted_unified | Trial 75 | outer=5 | weight={'name': 'exponential', 'floor': 1e-06, 'clip_max': 5.0, 'beta': 3.729833226996848}
2026-06-01 00:23:09 | INFO | src.nested_cv_avggrm_weighted_unified | Trial 75 | outer=5 | pruned after 5/10 inner folds (mean r=0.2044)
[I 2026-06-01 00:23:09,810] Trial 75 pruned. 
2026-06-01 00:23:09 | INFO | src.nested_cv_avggrm_weighted_unified | Trial 76 | outer=5 | alpha=1.271e+05 n_pcs=4500 (pc_topk) weight_search=on
2026-06-01 00:23:09 | INFO | src.nested_cv_avggrm_weighted_unified | Trial 76 | outer=5 | weight={'name': 'exponential', 'floor': 1e-06, 'clip_max': 5.0, 'beta': 5.5499197296355245}
[I 2026-06-01 00:23:16,518] Trial 76 finished with value: 0.2585010295575189 and parameters: {'alpha': 127103.66091866423, 'n_pcs': 4500, 'weight_scheme': 'exponential', 'weight_clip_max': 5.0, 'weight_exponential_beta': 5.5499197296355245}. Best is trial 74 with value: 0.25933602127307637.
2026-06-01 00:23:16 | INFO | src.nested_cv_avggrm_weighted_unified | Trial 77 | outer=5 | alpha=1.190e+05 n_pcs=4500 (pc_topk) weight_search=on
2026-06-01 00:23:16 | INFO | src.nested_cv_avggrm_weighted_unified | Trial 77 | outer=5 | weight={'name': 'uniform', 'floor': 1e-06, 'clip_max': 5.0}
2026-06-01 00:23:19 | INFO | src.nested_cv_avggrm_weighted_unified | Trial 77 | outer=5 | pruned after 5/10 inner folds (mean r=0.2332)
[I 2026-06-01 00:23:19,415] Trial 77 pruned. 
2026-06-01 00:23:19 | INFO | src.nested_cv_avggrm_weighted_unified | Trial 78 | outer=5 | alpha=3.028e+05 n_pcs=4000 (pc_topk) weight_search=on
2026-06-01 00:23:19 | INFO | src.nested_cv_avggrm_weighted_unified | Trial 78 | outer=5 | weight={'name': 'exponential', 'floor': 1e-06, 'clip_max': 5.0, 'beta': 5.441314477223461}
[I 2026-06-01 00:23:24,892] Trial 78 finished with value: 0.2543012939996159 and parameters: {'alpha': 302779.41785280587, 'n_pcs': 4000, 'weight_scheme': 'exponential', 'weight_clip_max': 5.0, 'weight_exponential_beta': 5.441314477223461}. Best is trial 74 with value: 0.25933602127307637.
2026-06-01 00:23:24 | INFO | src.nested_cv_avggrm_weighted_unified | Trial 79 | outer=5 | alpha=1.846e+05 n_pcs=4500 (pc_topk) weight_search=on
2026-06-01 00:23:24 | INFO | src.nested_cv_avggrm_weighted_unified | Trial 79 | outer=5 | weight={'name': 'exponential', 'floor': 1e-06, 'clip_max': 5.0, 'beta': 6.462616349262434}
[I 2026-06-01 00:23:31,528] Trial 79 finished with value: 0.2576730278018974 and parameters: {'alpha': 184573.32609483687, 'n_pcs': 4500, 'weight_scheme': 'exponential', 'weight_clip_max': 5.0, 'weight_exponential_beta': 6.462616349262434}. Best is trial 74 with value: 0.25933602127307637.
2026-06-01 00:23:31 | INFO | src.nested_cv_avggrm_weighted_unified | Trial 80 | outer=5 | alpha=5.740e+05 n_pcs=4500 (pc_topk) weight_search=on
2026-06-01 00:23:31 | INFO | src.nested_cv_avggrm_weighted_unified | Trial 80 | outer=5 | weight={'name': 'exponential', 'floor': 1e-06, 'clip_max': 5.0, 'beta': 6.481391479291946}
2026-06-01 00:23:35 | INFO | src.nested_cv_avggrm_weighted_unified | Trial 80 | outer=5 | pruned after 6/10 inner folds (mean r=0.2698)
[I 2026-06-01 00:23:35,491] Trial 80 pruned. 
2026-06-01 00:23:35 | INFO | src.nested_cv_avggrm_weighted_unified | Trial 81 | outer=5 | alpha=1.591e+05 n_pcs=4500 (pc_topk) weight_search=on
2026-06-01 00:23:35 | INFO | src.nested_cv_avggrm_weighted_unified | Trial 81 | outer=5 | weight={'name': 'exponential', 'floor': 1e-06, 'clip_max': 5.0, 'beta': 6.904410001871977}
[I 2026-06-01 00:23:42,120] Trial 81 finished with value: 0.25858515481919137 and parameters: {'alpha': 159078.6857139025, 'n_pcs': 4500, 'weight_scheme': 'exponential', 'weight_clip_max': 5.0, 'weight_exponential_beta': 6.904410001871977}. Best is trial 74 with value: 0.25933602127307637.
2026-06-01 00:23:42 | INFO | src.nested_cv_avggrm_weighted_unified | Trial 82 | outer=5 | alpha=1.696e+05 n_pcs=4000 (pc_topk) weight_search=on
2026-06-01 00:23:42 | INFO | src.nested_cv_avggrm_weighted_unified | Trial 82 | outer=5 | weight={'name': 'exponential', 'floor': 1e-06, 'clip_max': 5.0, 'beta': 8.10148014239723}
[I 2026-06-01 00:23:47,602] Trial 82 finished with value: 0.25946525927642006 and parameters: {'alpha': 169599.58480649564, 'n_pcs': 4000, 'weight_scheme': 'exponential', 'weight_clip_max': 5.0, 'weight_exponential_beta': 8.10148014239723}. Best is trial 82 with value: 0.25946525927642006.
2026-06-01 00:23:47 | INFO | src.nested_cv_avggrm_weighted_unified | OUTER 5 | new best trial 82 (mean inner r=0.2595) saved to outputs/final_results/e6_pc_ridge_avggrm/thr_wing/e6_pc_ridge_avggrm_thr_wing_best_trials/split_05_best_trial.json
2026-06-01 00:23:47 | INFO | src.nested_cv_avggrm_weighted_unified | Trial 83 | outer=5 | alpha=1.966e+05 n_pcs=3500 (pc_topk) weight_search=on
2026-06-01 00:23:47 | INFO | src.nested_cv_avggrm_weighted_unified | Trial 83 | outer=5 | weight={'name': 'exponential', 'floor': 1e-06, 'clip_max': 5.0, 'beta': 7.509178329819667}
[I 2026-06-01 00:23:52,780] Trial 83 finished with value: 0.25725014081605346 and parameters: {'alpha': 196586.2236048363, 'n_pcs': 3500, 'weight_scheme': 'exponential', 'weight_clip_max': 5.0, 'weight_exponential_beta': 7.509178329819667}. Best is trial 82 with value: 0.25946525927642006.
2026-06-01 00:23:52 | INFO | src.nested_cv_avggrm_weighted_unified | Trial 84 | outer=5 | alpha=1.580e+05 n_pcs=4000 (pc_topk) weight_search=on
2026-06-01 00:23:52 | INFO | src.nested_cv_avggrm_weighted_unified | Trial 84 | outer=5 | weight={'name': 'exponential', 'floor': 1e-06, 'clip_max': 5.0, 'beta': 8.365423083509382}
[I 2026-06-01 00:23:58,249] Trial 84 finished with value: 0.2596739459810974 and parameters: {'alpha': 157982.85716755842, 'n_pcs': 4000, 'weight_scheme': 'exponential', 'weight_clip_max': 5.0, 'weight_exponential_beta': 8.365423083509382}. Best is trial 84 with value: 0.2596739459810974.
2026-06-01 00:23:58 | INFO | src.nested_cv_avggrm_weighted_unified | OUTER 5 | new best trial 84 (mean inner r=0.2597) saved to outputs/final_results/e6_pc_ridge_avggrm/thr_wing/e6_pc_ridge_avggrm_thr_wing_best_trials/split_05_best_trial.json
2026-06-01 00:23:58 | INFO | src.nested_cv_avggrm_weighted_unified | Trial 85 | outer=5 | alpha=3.524e+05 n_pcs=4000 (pc_topk) weight_search=on
2026-06-01 00:23:58 | INFO | src.nested_cv_avggrm_weighted_unified | Trial 85 | outer=5 | weight={'name': 'exponential', 'floor': 1e-06, 'clip_max': 5.0, 'beta': 8.563289021379532}
[I 2026-06-01 00:24:03,823] Trial 85 finished with value: 0.2563311914374501 and parameters: {'alpha': 352387.3395677758, 'n_pcs': 4000, 'weight_scheme': 'exponential', 'weight_clip_max': 5.0, 'weight_exponential_beta': 8.563289021379532}. Best is trial 84 with value: 0.2596739459810974.
2026-06-01 00:24:03 | INFO | src.nested_cv_avggrm_weighted_unified | Trial 86 | outer=5 | alpha=7.536e+05 n_pcs=4000 (pc_topk) weight_search=on
2026-06-01 00:24:03 | INFO | src.nested_cv_avggrm_weighted_unified | Trial 86 | outer=5 | weight={'name': 'exponential', 'floor': 1e-06, 'clip_max': 5.0, 'beta': 8.175195030501802}
2026-06-01 00:24:07 | INFO | src.nested_cv_avggrm_weighted_unified | Trial 86 | outer=5 | pruned after 6/10 inner folds (mean r=0.2703)
[I 2026-06-01 00:24:07,115] Trial 86 pruned. 
2026-06-01 00:24:07 | INFO | src.nested_cv_avggrm_weighted_unified | Trial 87 | outer=5 | alpha=1.635e+05 n_pcs=4000 (pc_topk) weight_search=on
2026-06-01 00:24:07 | INFO | src.nested_cv_avggrm_weighted_unified | Trial 87 | outer=5 | weight={'name': 'exponential', 'floor': 1e-06, 'clip_max': 5.0, 'beta': 9.518690527841176}
[I 2026-06-01 00:24:12,600] Trial 87 finished with value: 0.25919737015810773 and parameters: {'alpha': 163471.48435073605, 'n_pcs': 4000, 'weight_scheme': 'exponential', 'weight_clip_max': 5.0, 'weight_exponential_beta': 9.518690527841176}. Best is trial 84 with value: 0.2596739459810974.
2026-06-01 00:24:12 | INFO | src.nested_cv_avggrm_weighted_unified | Trial 88 | outer=5 | alpha=1.515e+05 n_pcs=3500 (pc_topk) weight_search=on
2026-06-01 00:24:12 | INFO | src.nested_cv_avggrm_weighted_unified | Trial 88 | outer=5 | weight={'name': 'linear', 'floor': 1e-06, 'clip_max': 5.0, 'min_weight': 0.2596737919743966, 'max_weight': 1.1433194150506203}
2026-06-01 00:24:15 | INFO | src.nested_cv_avggrm_weighted_unified | Trial 88 | outer=5 | pruned after 6/10 inner folds (mean r=0.2612)
[I 2026-06-01 00:24:15,407] Trial 88 pruned. 
2026-06-01 00:24:15 | INFO | src.nested_cv_avggrm_weighted_unified | Trial 89 | outer=5 | alpha=4.725e+05 n_pcs=3500 (pc_topk) weight_search=on
2026-06-01 00:24:15 | INFO | src.nested_cv_avggrm_weighted_unified | Trial 89 | outer=5 | weight={'name': 'exponential', 'floor': 1e-06, 'clip_max': 5.0, 'beta': 9.74611739711386}
2026-06-01 00:24:18 | INFO | src.nested_cv_avggrm_weighted_unified | Trial 89 | outer=5 | pruned after 7/10 inner folds (mean r=0.2885)
[I 2026-06-01 00:24:18,685] Trial 89 pruned. 
2026-06-01 00:24:18 | INFO | src.nested_cv_avggrm_weighted_unified | Trial 90 | outer=5 | alpha=8.600e+04 n_pcs=4000 (pc_topk) weight_search=on
2026-06-01 00:24:18 | INFO | src.nested_cv_avggrm_weighted_unified | Trial 90 | outer=5 | weight={'name': 'exponential', 'floor': 1e-06, 'clip_max': 5.0, 'beta': 9.243761221701174}
[I 2026-06-01 00:24:24,177] Trial 90 finished with value: 0.2589456839442192 and parameters: {'alpha': 85995.82942920415, 'n_pcs': 4000, 'weight_scheme': 'exponential', 'weight_clip_max': 5.0, 'weight_exponential_beta': 9.243761221701174}. Best is trial 84 with value: 0.2596739459810974.
2026-06-01 00:24:24 | INFO | src.nested_cv_avggrm_weighted_unified | Trial 91 | outer=5 | alpha=2.383e+05 n_pcs=4000 (pc_topk) weight_search=on
2026-06-01 00:24:24 | INFO | src.nested_cv_avggrm_weighted_unified | Trial 91 | outer=5 | weight={'name': 'exponential', 'floor': 1e-06, 'clip_max': 5.0, 'beta': 9.139792995690307}
[I 2026-06-01 00:24:29,671] Trial 91 finished with value: 0.2583243991146476 and parameters: {'alpha': 238289.14760445664, 'n_pcs': 4000, 'weight_scheme': 'exponential', 'weight_clip_max': 5.0, 'weight_exponential_beta': 9.139792995690307}. Best is trial 84 with value: 0.2596739459810974.
2026-06-01 00:24:29 | INFO | src.nested_cv_avggrm_weighted_unified | Trial 92 | outer=5 | alpha=2.502e+05 n_pcs=4000 (pc_topk) weight_search=on
2026-06-01 00:24:29 | INFO | src.nested_cv_avggrm_weighted_unified | Trial 92 | outer=5 | weight={'name': 'exponential', 'floor': 1e-06, 'clip_max': 5.0, 'beta': 9.144383286722087}
[I 2026-06-01 00:24:35,148] Trial 92 finished with value: 0.2581132792547941 and parameters: {'alpha': 250221.43813470597, 'n_pcs': 4000, 'weight_scheme': 'exponential', 'weight_clip_max': 5.0, 'weight_exponential_beta': 9.144383286722087}. Best is trial 84 with value: 0.2596739459810974.
2026-06-01 00:24:35 | INFO | src.nested_cv_avggrm_weighted_unified | Trial 93 | outer=5 | alpha=1.347e+05 n_pcs=4000 (pc_topk) weight_search=on
2026-06-01 00:24:35 | INFO | src.nested_cv_avggrm_weighted_unified | Trial 93 | outer=5 | weight={'name': 'exponential', 'floor': 1e-06, 'clip_max': 5.0, 'beta': 9.037998411256753}
[I 2026-06-01 00:24:40,639] Trial 93 finished with value: 0.25972221628032655 and parameters: {'alpha': 134691.17664880079, 'n_pcs': 4000, 'weight_scheme': 'exponential', 'weight_clip_max': 5.0, 'weight_exponential_beta': 9.037998411256753}. Best is trial 93 with value: 0.25972221628032655.
2026-06-01 00:24:40 | INFO | src.nested_cv_avggrm_weighted_unified | OUTER 5 | new best trial 93 (mean inner r=0.2597) saved to outputs/final_results/e6_pc_ridge_avggrm/thr_wing/e6_pc_ridge_avggrm_thr_wing_best_trials/split_05_best_trial.json
2026-06-01 00:24:40 | INFO | src.nested_cv_avggrm_weighted_unified | Trial 94 | outer=5 | alpha=3.103e+05 n_pcs=3500 (pc_topk) weight_search=on
2026-06-01 00:24:40 | INFO | src.nested_cv_avggrm_weighted_unified | Trial 94 | outer=5 | weight={'name': 'exponential', 'floor': 1e-06, 'clip_max': 5.0, 'beta': 9.10845740397777}
[I 2026-06-01 00:24:45,391] Trial 94 finished with value: 0.25576689309392076 and parameters: {'alpha': 310272.8160689164, 'n_pcs': 3500, 'weight_scheme': 'exponential', 'weight_clip_max': 5.0, 'weight_exponential_beta': 9.10845740397777}. Best is trial 93 with value: 0.25972221628032655.
2026-06-01 00:24:45 | INFO | src.nested_cv_avggrm_weighted_unified | Trial 95 | outer=5 | alpha=1.457e+05 n_pcs=3000 (pc_topk) weight_search=on
2026-06-01 00:24:45 | INFO | src.nested_cv_avggrm_weighted_unified | Trial 95 | outer=5 | weight={'name': 'exponential', 'floor': 1e-06, 'clip_max': 5.0, 'beta': 8.2424209289971}
[I 2026-06-01 00:24:49,037] Trial 95 finished with value: 0.2584472500496807 and parameters: {'alpha': 145694.3340348033, 'n_pcs': 3000, 'weight_scheme': 'exponential', 'weight_clip_max': 5.0, 'weight_exponential_beta': 8.2424209289971}. Best is trial 93 with value: 0.25972221628032655.
2026-06-01 00:24:49 | INFO | src.nested_cv_avggrm_weighted_unified | Trial 96 | outer=5 | alpha=1.484e+05 n_pcs=2500 (pc_topk) weight_search=on
2026-06-01 00:24:49 | INFO | src.nested_cv_avggrm_weighted_unified | Trial 96 | outer=5 | weight={'name': 'exponential', 'floor': 1e-06, 'clip_max': 5.0, 'beta': 7.9689902474328465}
[I 2026-06-01 00:24:51,862] Trial 96 finished with value: 0.2546483260077381 and parameters: {'alpha': 148421.52075116284, 'n_pcs': 2500, 'weight_scheme': 'exponential', 'weight_clip_max': 5.0, 'weight_exponential_beta': 7.9689902474328465}. Best is trial 93 with value: 0.25972221628032655.
2026-06-01 00:24:51 | INFO | src.nested_cv_avggrm_weighted_unified | Trial 97 | outer=5 | alpha=8.906e+04 n_pcs=3000 (pc_topk) weight_search=on
2026-06-01 00:24:51 | INFO | src.nested_cv_avggrm_weighted_unified | Trial 97 | outer=5 | weight={'name': 'exponential', 'floor': 1e-06, 'clip_max': 5.0, 'beta': 8.480098560714582}
[I 2026-06-01 00:24:55,473] Trial 97 finished with value: 0.25745245472000566 and parameters: {'alpha': 89059.06344674474, 'n_pcs': 3000, 'weight_scheme': 'exponential', 'weight_clip_max': 5.0, 'weight_exponential_beta': 8.480098560714582}. Best is trial 93 with value: 0.25972221628032655.
2026-06-01 00:24:55 | INFO | src.nested_cv_avggrm_weighted_unified | Trial 98 | outer=5 | alpha=8.228e+06 n_pcs=4000 (pc_topk) weight_search=on
2026-06-01 00:24:55 | INFO | src.nested_cv_avggrm_weighted_unified | Trial 98 | outer=5 | weight={'name': 'uniform', 'floor': 1e-06, 'clip_max': 5.0}
2026-06-01 00:24:57 | INFO | src.nested_cv_avggrm_weighted_unified | Trial 98 | outer=5 | pruned after 5/10 inner folds (mean r=0.1887)
[I 2026-06-01 00:24:57,797] Trial 98 pruned. 
2026-06-01 00:24:57 | INFO | src.nested_cv_avggrm_weighted_unified | Trial 99 | outer=5 | alpha=1.379e+05 n_pcs=3500 (pc_topk) weight_search=on
2026-06-01 00:24:57 | INFO | src.nested_cv_avggrm_weighted_unified | Trial 99 | outer=5 | weight={'name': 'exponential', 'floor': 1e-06, 'clip_max': 5.0, 'beta': 9.63883423450717}
2026-06-01 00:25:01 | INFO | src.nested_cv_avggrm_weighted_unified | Trial 99 | outer=5 | pruned after 7/10 inner folds (mean r=0.2905)
[I 2026-06-01 00:25:01,072] Trial 99 pruned. 
2026-06-01 00:25:01 | INFO | src.nested_cv_avggrm_weighted_unified | Trial 100 | outer=5 | alpha=8.890e+04 n_pcs=4000 (pc_topk) weight_search=on
2026-06-01 00:25:01 | INFO | src.nested_cv_avggrm_weighted_unified | Trial 100 | outer=5 | weight={'name': 'exponential', 'floor': 1e-06, 'clip_max': 5.0, 'beta': 7.299459253011174}
[I 2026-06-01 00:25:06,571] Trial 100 finished with value: 0.25978472795967683 and parameters: {'alpha': 88900.1174231232, 'n_pcs': 4000, 'weight_scheme': 'exponential', 'weight_clip_max': 5.0, 'weight_exponential_beta': 7.299459253011174}. Best is trial 100 with value: 0.25978472795967683.
2026-06-01 00:25:06 | INFO | src.nested_cv_avggrm_weighted_unified | OUTER 5 | new best trial 100 (mean inner r=0.2598) saved to outputs/final_results/e6_pc_ridge_avggrm/thr_wing/e6_pc_ridge_avggrm_thr_wing_best_trials/split_05_best_trial.json
2026-06-01 00:25:06 | INFO | src.nested_cv_avggrm_weighted_unified | Trial 101 | outer=5 | alpha=1.752e+05 n_pcs=4000 (pc_topk) weight_search=on
2026-06-01 00:25:06 | INFO | src.nested_cv_avggrm_weighted_unified | Trial 101 | outer=5 | weight={'name': 'exponential', 'floor': 1e-06, 'clip_max': 5.0, 'beta': 7.211244722635042}
[I 2026-06-01 00:25:12,255] Trial 101 finished with value: 0.25895088057444454 and parameters: {'alpha': 175236.0233249979, 'n_pcs': 4000, 'weight_scheme': 'exponential', 'weight_clip_max': 5.0, 'weight_exponential_beta': 7.211244722635042}. Best is trial 100 with value: 0.25978472795967683.
2026-06-01 00:25:12 | INFO | src.nested_cv_avggrm_weighted_unified | Trial 102 | outer=5 | alpha=1.710e+05 n_pcs=4000 (pc_topk) weight_search=on
2026-06-01 00:25:12 | INFO | src.nested_cv_avggrm_weighted_unified | Trial 102 | outer=5 | weight={'name': 'exponential', 'floor': 1e-06, 'clip_max': 5.0, 'beta': 7.358567617506485}
[I 2026-06-01 00:25:17,695] Trial 102 finished with value: 0.25911747776142346 and parameters: {'alpha': 170966.32908893566, 'n_pcs': 4000, 'weight_scheme': 'exponential', 'weight_clip_max': 5.0, 'weight_exponential_beta': 7.358567617506485}. Best is trial 100 with value: 0.25978472795967683.
2026-06-01 00:25:17 | INFO | src.nested_cv_avggrm_weighted_unified | Trial 103 | outer=5 | alpha=1.729e+05 n_pcs=4000 (pc_topk) weight_search=on
2026-06-01 00:25:17 | INFO | src.nested_cv_avggrm_weighted_unified | Trial 103 | outer=5 | weight={'name': 'exponential', 'floor': 1e-06, 'clip_max': 5.0, 'beta': 7.1857430462892316}
