[I 2026-06-01 13:23:27,611] Trial 90 finished with value: 0.24901852177481348 and parameters: {'alpha': 43123.61785901085, 'n_pcs': 4000, 'iw_method': 'pc_logistic', 'iw_clip_max': 4.0, 'iw_prob_clip': 0.0034004593683511974, 'iw_n_components': 100, 'iw_logistic_c': 0.08121274358342116, 'iw_pca_fit': 'combined', 'iw_solver': 'lbfgs', 'iw_rho': 0.7}. Best is trial 81 with value: 0.25357534381681857.
2026-06-01 13:23:27 | INFO | Trial 91 | outer=1 | alpha=6.485e+04 n_pcs=4500 (pc_topk) weight={'name': 'pc_logistic', 'floor': 1e-06, 'clip_max': 4.0, 'prob_clip': 0.004380545003025182, 'n_components': 100, 'logistic_c': 0.05503138651128093, 'pca_fit': 'combined', 'solver': 'lbfgs', 'max_iter': 2000, 'fit_intercept': True, 'standardize_with_source': True, 'rho': 0.7}
[I 2026-06-01 13:23:58,291] Trial 91 finished with value: 0.2504935993011633 and parameters: {'alpha': 64852.01358293839, 'n_pcs': 4500, 'iw_method': 'pc_logistic', 'iw_clip_max': 4.0, 'iw_prob_clip': 0.004380545003025182, 'iw_n_components': 100, 'iw_logistic_c': 0.05503138651128093, 'iw_pca_fit': 'combined', 'iw_solver': 'lbfgs', 'iw_rho': 0.7}. Best is trial 81 with value: 0.25357534381681857.
2026-06-01 13:23:58 | INFO | Trial 92 | outer=1 | alpha=1.388e+05 n_pcs=5000 (pc_topk) weight={'name': 'pc_logistic', 'floor': 1e-06, 'clip_max': 4.0, 'prob_clip': 0.0028996596903636926, 'n_components': 100, 'logistic_c': 0.02348911210508521, 'pca_fit': 'combined', 'solver': 'lbfgs', 'max_iter': 2000, 'fit_intercept': True, 'standardize_with_source': True, 'rho': 0.7}
[I 2026-06-01 13:24:31,999] Trial 92 finished with value: 0.24719367697430866 and parameters: {'alpha': 138840.90957211968, 'n_pcs': 5000, 'iw_method': 'pc_logistic', 'iw_clip_max': 4.0, 'iw_prob_clip': 0.0028996596903636926, 'iw_n_components': 100, 'iw_logistic_c': 0.02348911210508521, 'iw_pca_fit': 'combined', 'iw_solver': 'lbfgs', 'iw_rho': 0.7}. Best is trial 81 with value: 0.25357534381681857.
2026-06-01 13:24:32 | INFO | Trial 93 | outer=1 | alpha=7.305e+04 n_pcs=4500 (pc_topk) weight={'name': 'pc_logistic', 'floor': 1e-06, 'clip_max': 4.0, 'prob_clip': 0.002229442938929267, 'n_components': 100, 'logistic_c': 0.009608066560448549, 'pca_fit': 'combined', 'solver': 'lbfgs', 'max_iter': 2000, 'fit_intercept': True, 'standardize_with_source': True, 'rho': 0.7}
[I 2026-06-01 13:25:00,736] Trial 93 finished with value: 0.2502778932869949 and parameters: {'alpha': 73045.19548953937, 'n_pcs': 4500, 'iw_method': 'pc_logistic', 'iw_clip_max': 4.0, 'iw_prob_clip': 0.002229442938929267, 'iw_n_components': 100, 'iw_logistic_c': 0.009608066560448549, 'iw_pca_fit': 'combined', 'iw_solver': 'lbfgs', 'iw_rho': 0.7}. Best is trial 81 with value: 0.25357534381681857.
2026-06-01 13:25:00 | INFO | Trial 94 | outer=1 | alpha=5.881e+04 n_pcs=4500 (pc_topk) weight={'name': 'pc_logistic', 'floor': 1e-06, 'clip_max': 4.0, 'prob_clip': 0.004201427154635922, 'n_components': 100, 'logistic_c': 0.1885154505801056, 'pca_fit': 'combined', 'solver': 'lbfgs', 'max_iter': 2000, 'fit_intercept': True, 'standardize_with_source': True, 'rho': 0.7}
[I 2026-06-01 13:25:34,073] Trial 94 finished with value: 0.25028634744801953 and parameters: {'alpha': 58806.39130845763, 'n_pcs': 4500, 'iw_method': 'pc_logistic', 'iw_clip_max': 4.0, 'iw_prob_clip': 0.004201427154635922, 'iw_n_components': 100, 'iw_logistic_c': 0.1885154505801056, 'iw_pca_fit': 'combined', 'iw_solver': 'lbfgs', 'iw_rho': 0.7}. Best is trial 81 with value: 0.25357534381681857.
2026-06-01 13:25:34 | INFO | Trial 95 | outer=1 | alpha=4.212e+04 n_pcs=4500 (pc_topk) weight={'name': 'pc_logistic', 'floor': 1e-06, 'clip_max': 7.0, 'prob_clip': 0.004967884329390499, 'n_components': 100, 'logistic_c': 0.035141637930344374, 'pca_fit': 'combined', 'solver': 'lbfgs', 'max_iter': 2000, 'fit_intercept': True, 'standardize_with_source': True, 'rho': 0.7}
[I 2026-06-01 13:26:00,498] Trial 95 finished with value: 0.24666283980076614 and parameters: {'alpha': 42124.29290994757, 'n_pcs': 4500, 'iw_method': 'pc_logistic', 'iw_clip_max': 7.0, 'iw_prob_clip': 0.004967884329390499, 'iw_n_components': 100, 'iw_logistic_c': 0.035141637930344374, 'iw_pca_fit': 'combined', 'iw_solver': 'lbfgs', 'iw_rho': 0.7}. Best is trial 81 with value: 0.25357534381681857.
2026-06-01 13:26:00 | INFO | Trial 96 | outer=1 | alpha=2.907e+04 n_pcs=4000 (pc_topk) weight={'name': 'pc_logistic', 'floor': 1e-06, 'clip_max': 4.0, 'prob_clip': 0.0027436928734995533, 'n_components': 100, 'logistic_c': 0.004850068319038085, 'pca_fit': 'combined', 'solver': 'lbfgs', 'max_iter': 2000, 'fit_intercept': True, 'standardize_with_source': True, 'rho': 0.3}
[I 2026-06-01 13:26:18,848] Trial 96 finished with value: 0.2487554318331569 and parameters: {'alpha': 29067.566268429524, 'n_pcs': 4000, 'iw_method': 'pc_logistic', 'iw_clip_max': 4.0, 'iw_prob_clip': 0.0027436928734995533, 'iw_n_components': 100, 'iw_logistic_c': 0.004850068319038085, 'iw_pca_fit': 'combined', 'iw_solver': 'lbfgs', 'iw_rho': 0.3}. Best is trial 81 with value: 0.25357534381681857.
2026-06-01 13:26:18 | INFO | Trial 97 | outer=1 | alpha=1.019e+05 n_pcs=4000 (pc_topk) weight={'name': 'pc_logistic', 'floor': 1e-06, 'clip_max': 4.0, 'prob_clip': 0.00204909551344312, 'n_components': 100, 'logistic_c': 0.013460876992911472, 'pca_fit': 'combined', 'solver': 'lbfgs', 'max_iter': 2000, 'fit_intercept': True, 'standardize_with_source': True, 'rho': 0.7}
[I 2026-06-01 13:26:41,855] Trial 97 finished with value: 0.24928916348527683 and parameters: {'alpha': 101917.0615705736, 'n_pcs': 4000, 'iw_method': 'pc_logistic', 'iw_clip_max': 4.0, 'iw_prob_clip': 0.00204909551344312, 'iw_n_components': 100, 'iw_logistic_c': 0.013460876992911472, 'iw_pca_fit': 'combined', 'iw_solver': 'lbfgs', 'iw_rho': 0.7}. Best is trial 81 with value: 0.25357534381681857.
2026-06-01 13:26:41 | INFO | Trial 98 | outer=1 | alpha=1.659e+05 n_pcs=4500 (pc_topk) weight={'name': 'pc_logistic', 'floor': 1e-06, 'clip_max': 1.5, 'prob_clip': 0.006167253200350201, 'n_components': 100, 'logistic_c': 0.007552375548382126, 'pca_fit': 'combined', 'solver': 'lbfgs', 'max_iter': 2000, 'fit_intercept': True, 'standardize_with_source': True, 'rho': 0.7}
[I 2026-06-01 13:27:09,597] Trial 98 finished with value: 0.24446601450645847 and parameters: {'alpha': 165947.16829567432, 'n_pcs': 4500, 'iw_method': 'pc_logistic', 'iw_clip_max': 1.5, 'iw_prob_clip': 0.006167253200350201, 'iw_n_components': 100, 'iw_logistic_c': 0.007552375548382126, 'iw_pca_fit': 'combined', 'iw_solver': 'lbfgs', 'iw_rho': 0.7}. Best is trial 81 with value: 0.25357534381681857.
2026-06-01 13:27:09 | INFO | Trial 99 | outer=1 | alpha=1.280e+05 n_pcs=5000 (pc_topk) weight={'name': 'pc_logistic', 'floor': 1e-06, 'clip_max': 4.0, 'prob_clip': 0.003492409632295951, 'n_components': 20, 'logistic_c': 0.018318011931975204, 'pca_fit': 'combined', 'solver': 'lbfgs', 'max_iter': 2000, 'fit_intercept': True, 'standardize_with_source': True, 'rho': 0.5}
[I 2026-06-01 13:27:33,505] Trial 99 finished with value: 0.24680682444766938 and parameters: {'alpha': 127970.09391137172, 'n_pcs': 5000, 'iw_method': 'pc_logistic', 'iw_clip_max': 4.0, 'iw_prob_clip': 0.003492409632295951, 'iw_n_components': 20, 'iw_logistic_c': 0.018318011931975204, 'iw_pca_fit': 'combined', 'iw_solver': 'lbfgs', 'iw_rho': 0.5}. Best is trial 81 with value: 0.25357534381681857.
2026-06-01 13:27:33 | INFO | Trial 100 | outer=1 | alpha=7.410e+04 n_pcs=4000 (pc_topk) weight={'name': 'pc_logistic', 'floor': 1e-06, 'clip_max': 4.0, 'prob_clip': 0.003979761498309868, 'n_components': 100, 'logistic_c': 0.20921130577292726, 'pca_fit': 'combined', 'solver': 'lbfgs', 'max_iter': 2000, 'fit_intercept': True, 'standardize_with_source': True, 'rho': 0.7}
[I 2026-06-01 13:28:03,813] Trial 100 finished with value: 0.24996824401144663 and parameters: {'alpha': 74104.63638952853, 'n_pcs': 4000, 'iw_method': 'pc_logistic', 'iw_clip_max': 4.0, 'iw_prob_clip': 0.003979761498309868, 'iw_n_components': 100, 'iw_logistic_c': 0.20921130577292726, 'iw_pca_fit': 'combined', 'iw_solver': 'lbfgs', 'iw_rho': 0.7}. Best is trial 81 with value: 0.25357534381681857.
2026-06-01 13:28:03 | INFO | Trial 101 | outer=1 | alpha=5.090e+04 n_pcs=4000 (pc_topk) weight={'name': 'pc_logistic', 'floor': 1e-06, 'clip_max': 4.0, 'prob_clip': 0.005184847255326105, 'n_components': 100, 'logistic_c': 0.0006847000869079613, 'pca_fit': 'combined', 'solver': 'lbfgs', 'max_iter': 2000, 'fit_intercept': True, 'standardize_with_source': True, 'rho': 0.7}
[I 2026-06-01 13:28:20,663] Trial 101 finished with value: 0.25212021668890505 and parameters: {'alpha': 50896.688821059186, 'n_pcs': 4000, 'iw_method': 'pc_logistic', 'iw_clip_max': 4.0, 'iw_prob_clip': 0.005184847255326105, 'iw_n_components': 100, 'iw_logistic_c': 0.0006847000869079613, 'iw_pca_fit': 'combined', 'iw_solver': 'lbfgs', 'iw_rho': 0.7}. Best is trial 81 with value: 0.25357534381681857.
2026-06-01 13:28:20 | INFO | Trial 102 | outer=1 | alpha=5.340e+04 n_pcs=4000 (pc_topk) weight={'name': 'pc_logistic', 'floor': 1e-06, 'clip_max': 4.0, 'prob_clip': 0.005301946899895144, 'n_components': 100, 'logistic_c': 0.0008936945593262048, 'pca_fit': 'combined', 'solver': 'lbfgs', 'max_iter': 2000, 'fit_intercept': True, 'standardize_with_source': True, 'rho': 0.7}
[I 2026-06-01 13:28:38,463] Trial 102 finished with value: 0.25224409291690786 and parameters: {'alpha': 53397.918890913716, 'n_pcs': 4000, 'iw_method': 'pc_logistic', 'iw_clip_max': 4.0, 'iw_prob_clip': 0.005301946899895144, 'iw_n_components': 100, 'iw_logistic_c': 0.0008936945593262048, 'iw_pca_fit': 'combined', 'iw_solver': 'lbfgs', 'iw_rho': 0.7}. Best is trial 81 with value: 0.25357534381681857.
2026-06-01 13:28:38 | INFO | Trial 103 | outer=1 | alpha=5.352e+04 n_pcs=4000 (pc_topk) weight={'name': 'pc_logistic', 'floor': 1e-06, 'clip_max': 4.0, 'prob_clip': 0.0054700201062470215, 'n_components': 100, 'logistic_c': 0.0008415280749170909, 'pca_fit': 'combined', 'solver': 'lbfgs', 'max_iter': 2000, 'fit_intercept': True, 'standardize_with_source': True, 'rho': 0.7}
[I 2026-06-01 13:28:56,914] Trial 103 finished with value: 0.2523897738633564 and parameters: {'alpha': 53515.403662509845, 'n_pcs': 4000, 'iw_method': 'pc_logistic', 'iw_clip_max': 4.0, 'iw_prob_clip': 0.0054700201062470215, 'iw_n_components': 100, 'iw_logistic_c': 0.0008415280749170909, 'iw_pca_fit': 'combined', 'iw_solver': 'lbfgs', 'iw_rho': 0.7}. Best is trial 81 with value: 0.25357534381681857.
2026-06-01 13:28:56 | INFO | Trial 104 | outer=1 | alpha=5.286e+04 n_pcs=3500 (pc_topk) weight={'name': 'pc_logistic', 'floor': 1e-06, 'clip_max': 4.0, 'prob_clip': 0.005318666452841237, 'n_components': 100, 'logistic_c': 0.0006399610539622708, 'pca_fit': 'combined', 'solver': 'lbfgs', 'max_iter': 2000, 'fit_intercept': True, 'standardize_with_source': True, 'rho': 0.7}
[I 2026-06-01 13:29:12,086] Trial 104 finished with value: 0.24954294988308687 and parameters: {'alpha': 52858.20685379524, 'n_pcs': 3500, 'iw_method': 'pc_logistic', 'iw_clip_max': 4.0, 'iw_prob_clip': 0.005318666452841237, 'iw_n_components': 100, 'iw_logistic_c': 0.0006399610539622708, 'iw_pca_fit': 'combined', 'iw_solver': 'lbfgs', 'iw_rho': 0.7}. Best is trial 81 with value: 0.25357534381681857.
2026-06-01 13:29:12 | INFO | Trial 105 | outer=1 | alpha=7.757e+06 n_pcs=3500 (pc_topk) weight={'name': 'pc_logistic', 'floor': 1e-06, 'clip_max': 4.0, 'prob_clip': 0.006209987336970481, 'n_components': 60, 'logistic_c': 0.0016022958433284573, 'pca_fit': 'combined', 'solver': 'lbfgs', 'max_iter': 2000, 'fit_intercept': True, 'standardize_with_source': True, 'rho': 0.7}
[I 2026-06-01 13:29:28,119] Trial 105 finished with value: 0.2277732293548469 and parameters: {'alpha': 7756539.137438042, 'n_pcs': 3500, 'iw_method': 'pc_logistic', 'iw_clip_max': 4.0, 'iw_prob_clip': 0.006209987336970481, 'iw_n_components': 60, 'iw_logistic_c': 0.0016022958433284573, 'iw_pca_fit': 'combined', 'iw_solver': 'lbfgs', 'iw_rho': 0.7}. Best is trial 81 with value: 0.25357534381681857.
2026-06-01 13:29:28 | INFO | Trial 106 | outer=1 | alpha=2.378e+04 n_pcs=4000 (pc_topk) weight={'name': 'pc_logistic', 'floor': 1e-06, 'clip_max': 4.0, 'prob_clip': 0.00779160222453831, 'n_components': 100, 'logistic_c': 0.0008318397962267038, 'pca_fit': 'combined', 'solver': 'lbfgs', 'max_iter': 2000, 'fit_intercept': True, 'standardize_with_source': True, 'rho': 0.7}
[I 2026-06-01 13:29:44,303] Trial 106 finished with value: 0.24534714596197826 and parameters: {'alpha': 23783.200140278634, 'n_pcs': 4000, 'iw_method': 'pc_logistic', 'iw_clip_max': 4.0, 'iw_prob_clip': 0.00779160222453831, 'iw_n_components': 100, 'iw_logistic_c': 0.0008318397962267038, 'iw_pca_fit': 'combined', 'iw_solver': 'lbfgs', 'iw_rho': 0.7}. Best is trial 81 with value: 0.25357534381681857.
2026-06-01 13:29:44 | INFO | Trial 107 | outer=1 | alpha=3.620e+04 n_pcs=3500 (pc_topk) weight={'name': 'pc_logistic', 'floor': 1e-06, 'clip_max': 12.0, 'prob_clip': 0.005038870441770565, 'n_components': 100, 'logistic_c': 0.0008864561205579838, 'pca_fit': 'combined', 'solver': 'lbfgs', 'max_iter': 2000, 'fit_intercept': True, 'standardize_with_source': True, 'rho': 1.0}
2026-06-01 13:29:58 | INFO | Trial 107 rejected by ESS guard: mean_ess=779.20 threshold=1037.68
[I 2026-06-01 13:29:58,763] Trial 107 finished with value: -1.0 and parameters: {'alpha': 36198.44991178976, 'n_pcs': 3500, 'iw_method': 'pc_logistic', 'iw_clip_max': 12.0, 'iw_prob_clip': 0.005038870441770565, 'iw_n_components': 100, 'iw_logistic_c': 0.0008864561205579838, 'iw_pca_fit': 'combined', 'iw_solver': 'lbfgs', 'iw_rho': 1.0}. Best is trial 81 with value: 0.25357534381681857.
2026-06-01 13:29:58 | INFO | Trial 108 | outer=1 | alpha=4.606e+04 n_pcs=4000 (pc_topk) weight={'name': 'uniform'}
[I 2026-06-01 13:30:05,877] Trial 108 finished with value: 0.24577123723842248 and parameters: {'alpha': 46055.891534768154, 'n_pcs': 4000, 'iw_method': 'uniform'}. Best is trial 81 with value: 0.25357534381681857.
2026-06-01 13:30:05 | INFO | Trial 109 | outer=1 | alpha=8.783e+04 n_pcs=4000 (pc_topk) weight={'name': 'pc_logistic', 'floor': 1e-06, 'clip_max': 4.0, 'prob_clip': 0.006621033923448942, 'n_components': 10, 'logistic_c': 0.0003206780360758468, 'pca_fit': 'combined', 'solver': 'lbfgs', 'max_iter': 2000, 'fit_intercept': True, 'standardize_with_source': True, 'rho': 0.85}
[I 2026-06-01 13:30:19,830] Trial 109 finished with value: 0.25109304417100325 and parameters: {'alpha': 87830.58800660558, 'n_pcs': 4000, 'iw_method': 'pc_logistic', 'iw_clip_max': 4.0, 'iw_prob_clip': 0.006621033923448942, 'iw_n_components': 10, 'iw_logistic_c': 0.0003206780360758468, 'iw_pca_fit': 'combined', 'iw_solver': 'lbfgs', 'iw_rho': 0.85}. Best is trial 81 with value: 0.25357534381681857.
2026-06-01 13:30:19 | INFO | Trial 110 | outer=1 | alpha=2.076e+05 n_pcs=4000 (pc_topk) weight={'name': 'pc_logistic', 'floor': 1e-06, 'clip_max': 4.0, 'prob_clip': 0.006578711910304835, 'n_components': 10, 'logistic_c': 0.0003432684810197166, 'pca_fit': 'combined', 'solver': 'lbfgs', 'max_iter': 2000, 'fit_intercept': True, 'standardize_with_source': True, 'rho': 0.85}
[I 2026-06-01 13:30:34,629] Trial 110 finished with value: 0.24935227504438098 and parameters: {'alpha': 207636.9001715066, 'n_pcs': 4000, 'iw_method': 'pc_logistic', 'iw_clip_max': 4.0, 'iw_prob_clip': 0.006578711910304835, 'iw_n_components': 10, 'iw_logistic_c': 0.0003432684810197166, 'iw_pca_fit': 'combined', 'iw_solver': 'lbfgs', 'iw_rho': 0.85}. Best is trial 81 with value: 0.25357534381681857.
2026-06-01 13:30:34 | INFO | Trial 111 | outer=1 | alpha=1.049e+05 n_pcs=4000 (pc_topk) weight={'name': 'pc_logistic', 'floor': 1e-06, 'clip_max': 4.0, 'prob_clip': 0.005340093532795714, 'n_components': 10, 'logistic_c': 0.0004426803975550702, 'pca_fit': 'combined', 'solver': 'lbfgs', 'max_iter': 2000, 'fit_intercept': True, 'standardize_with_source': True, 'rho': 0.85}
[I 2026-06-01 13:30:49,551] Trial 111 finished with value: 0.25039707566523545 and parameters: {'alpha': 104927.77539586376, 'n_pcs': 4000, 'iw_method': 'pc_logistic', 'iw_clip_max': 4.0, 'iw_prob_clip': 0.005340093532795714, 'iw_n_components': 10, 'iw_logistic_c': 0.0004426803975550702, 'iw_pca_fit': 'combined', 'iw_solver': 'lbfgs', 'iw_rho': 0.85}. Best is trial 81 with value: 0.25357534381681857.
2026-06-01 13:30:49 | INFO | Trial 112 | outer=1 | alpha=8.624e+04 n_pcs=4500 (pc_topk) weight={'name': 'pc_logistic', 'floor': 1e-06, 'clip_max': 4.0, 'prob_clip': 0.0058048708658673485, 'n_components': 10, 'logistic_c': 0.001723851202378554, 'pca_fit': 'combined', 'solver': 'lbfgs', 'max_iter': 2000, 'fit_intercept': True, 'standardize_with_source': True, 'rho': 0.85}
[I 2026-06-01 13:31:07,124] Trial 112 finished with value: 0.24831935285083553 and parameters: {'alpha': 86236.04721610578, 'n_pcs': 4500, 'iw_method': 'pc_logistic', 'iw_clip_max': 4.0, 'iw_prob_clip': 0.0058048708658673485, 'iw_n_components': 10, 'iw_logistic_c': 0.001723851202378554, 'iw_pca_fit': 'combined', 'iw_solver': 'lbfgs', 'iw_rho': 0.85}. Best is trial 81 with value: 0.25357534381681857.
2026-06-01 13:31:07 | INFO | Trial 113 | outer=1 | alpha=5.522e+04 n_pcs=4000 (pc_topk) weight={'name': 'pc_logistic', 'floor': 1e-06, 'clip_max': 4.0, 'prob_clip': 0.003983221552150025, 'n_components': 100, 'logistic_c': 0.0006015277557249319, 'pca_fit': 'combined', 'solver': 'lbfgs', 'max_iter': 2000, 'fit_intercept': True, 'standardize_with_source': True, 'rho': 0.85}
[I 2026-06-01 13:31:24,583] Trial 113 finished with value: 0.2511631140170596 and parameters: {'alpha': 55223.059213744455, 'n_pcs': 4000, 'iw_method': 'pc_logistic', 'iw_clip_max': 4.0, 'iw_prob_clip': 0.003983221552150025, 'iw_n_components': 100, 'iw_logistic_c': 0.0006015277557249319, 'iw_pca_fit': 'combined', 'iw_solver': 'lbfgs', 'iw_rho': 0.85}. Best is trial 81 with value: 0.25357534381681857.
2026-06-01 13:31:24 | INFO | Trial 114 | outer=1 | alpha=5.639e+04 n_pcs=4000 (pc_topk) weight={'name': 'pc_logistic', 'floor': 1e-06, 'clip_max': 4.0, 'prob_clip': 0.007156778275239523, 'n_components': 100, 'logistic_c': 0.0005750683959086282, 'pca_fit': 'combined', 'solver': 'lbfgs', 'max_iter': 2000, 'fit_intercept': True, 'standardize_with_source': True, 'rho': 0.85}
[I 2026-06-01 13:31:41,992] Trial 114 finished with value: 0.2531565274086074 and parameters: {'alpha': 56393.75461425455, 'n_pcs': 4000, 'iw_method': 'pc_logistic', 'iw_clip_max': 4.0, 'iw_prob_clip': 0.007156778275239523, 'iw_n_components': 100, 'iw_logistic_c': 0.0005750683959086282, 'iw_pca_fit': 'combined', 'iw_solver': 'lbfgs', 'iw_rho': 0.85}. Best is trial 81 with value: 0.25357534381681857.
2026-06-01 13:31:42 | INFO | Trial 115 | outer=1 | alpha=5.777e+04 n_pcs=3500 (pc_topk) weight={'name': 'pc_logistic', 'floor': 1e-06, 'clip_max': 4.0, 'prob_clip': 0.007045747847389338, 'n_components': 10, 'logistic_c': 0.0005003035333180596, 'pca_fit': 'combined', 'solver': 'lbfgs', 'max_iter': 2000, 'fit_intercept': True, 'standardize_with_source': True, 'rho': 0.85}
[I 2026-06-01 13:31:56,319] Trial 115 finished with value: 0.24445686934017927 and parameters: {'alpha': 57769.282530555756, 'n_pcs': 3500, 'iw_method': 'pc_logistic', 'iw_clip_max': 4.0, 'iw_prob_clip': 0.007045747847389338, 'iw_n_components': 10, 'iw_logistic_c': 0.0005003035333180596, 'iw_pca_fit': 'combined', 'iw_solver': 'lbfgs', 'iw_rho': 0.85}. Best is trial 81 with value: 0.25357534381681857.
2026-06-01 13:31:56 | INFO | Trial 116 | outer=1 | alpha=1.332e+05 n_pcs=4000 (pc_topk) weight={'name': 'pc_logistic', 'floor': 1e-06, 'clip_max': 7.0, 'prob_clip': 0.008766703093993586, 'n_components': 100, 'logistic_c': 0.0010430135094299264, 'pca_fit': 'combined', 'solver': 'lbfgs', 'max_iter': 2000, 'fit_intercept': True, 'standardize_with_source': True, 'rho': 0.85}
[I 2026-06-01 13:32:15,190] Trial 116 finished with value: 0.2482020866744275 and parameters: {'alpha': 133246.2384340736, 'n_pcs': 4000, 'iw_method': 'pc_logistic', 'iw_clip_max': 7.0, 'iw_prob_clip': 0.008766703093993586, 'iw_n_components': 100, 'iw_logistic_c': 0.0010430135094299264, 'iw_pca_fit': 'combined', 'iw_solver': 'lbfgs', 'iw_rho': 0.85}. Best is trial 81 with value: 0.25357534381681857.
2026-06-01 13:32:15 | INFO | Trial 117 | outer=1 | alpha=3.126e+04 n_pcs=4000 (pc_topk) weight={'name': 'pc_logistic', 'floor': 1e-06, 'clip_max': 4.0, 'prob_clip': 0.008035193553024164, 'n_components': 100, 'logistic_c': 0.00036034701981607685, 'pca_fit': 'combined', 'solver': 'lbfgs', 'max_iter': 2000, 'fit_intercept': True, 'standardize_with_source': True, 'rho': 0.85}
[I 2026-06-01 13:32:32,317] Trial 117 finished with value: 0.24886295608720185 and parameters: {'alpha': 31263.534192133808, 'n_pcs': 4000, 'iw_method': 'pc_logistic', 'iw_clip_max': 4.0, 'iw_prob_clip': 0.008035193553024164, 'iw_n_components': 100, 'iw_logistic_c': 0.00036034701981607685, 'iw_pca_fit': 'combined', 'iw_solver': 'lbfgs', 'iw_rho': 0.85}. Best is trial 81 with value: 0.25357534381681857.
2026-06-01 13:32:32 | INFO | Trial 118 | outer=1 | alpha=5.660e+06 n_pcs=4000 (pc_topk) weight={'name': 'pc_logistic', 'floor': 1e-06, 'clip_max': 4.0, 'prob_clip': 0.006535070536286109, 'n_components': 20, 'logistic_c': 0.0006092968842244883, 'pca_fit': 'combined', 'solver': 'lbfgs', 'max_iter': 2000, 'fit_intercept': True, 'standardize_with_source': True, 'rho': 0.85}
