[I 2026-06-02 00:31:57,641] Trial 254 finished with value: 0.23288925834605875 and parameters: {'alpha': 42925.46617515093, 'n_pcs': 5000, 'iw_method': 'pc_logistic', 'iw_clip_max': 2.5, 'iw_prob_clip': 0.009653268189118094, 'iw_n_components': 80, 'iw_logistic_c': 0.35974076696834567, 'iw_pca_fit': 'combined', 'iw_solver': 'lbfgs', 'iw_rho': 0.85}. Best is trial 249 with value: 0.2330357454325883.
2026-06-02 00:31:57 | INFO | Trial 255 | outer=9 | alpha=4.503e+04 n_pcs=5000 (pc_topk) weight={'name': 'pc_logistic', 'floor': 1e-06, 'clip_max': 1.5, 'prob_clip': 0.009834922357309952, 'n_components': 80, 'logistic_c': 0.3748646669978844, 'pca_fit': 'combined', 'solver': 'lbfgs', 'max_iter': 2000, 'fit_intercept': True, 'standardize_with_source': True, 'rho': 0.85}
[I 2026-06-02 00:32:23,280] Trial 255 finished with value: 0.23129884711294452 and parameters: {'alpha': 45027.44315191263, 'n_pcs': 5000, 'iw_method': 'pc_logistic', 'iw_clip_max': 1.5, 'iw_prob_clip': 0.009834922357309952, 'iw_n_components': 80, 'iw_logistic_c': 0.3748646669978844, 'iw_pca_fit': 'combined', 'iw_solver': 'lbfgs', 'iw_rho': 0.85}. Best is trial 249 with value: 0.2330357454325883.
2026-06-02 00:32:23 | INFO | Trial 256 | outer=9 | alpha=6.632e+04 n_pcs=1500 (pc_topk) weight={'name': 'pc_logistic', 'floor': 1e-06, 'clip_max': 2.5, 'prob_clip': 0.00951629248260589, 'n_components': 80, 'logistic_c': 0.30653923802334526, 'pca_fit': 'combined', 'solver': 'lbfgs', 'max_iter': 2000, 'fit_intercept': True, 'standardize_with_source': True, 'rho': 0.85}
[I 2026-06-02 00:32:39,231] Trial 256 finished with value: 0.2200508733369145 and parameters: {'alpha': 66321.13792582617, 'n_pcs': 1500, 'iw_method': 'pc_logistic', 'iw_clip_max': 2.5, 'iw_prob_clip': 0.00951629248260589, 'iw_n_components': 80, 'iw_logistic_c': 0.30653923802334526, 'iw_pca_fit': 'combined', 'iw_solver': 'lbfgs', 'iw_rho': 0.85}. Best is trial 249 with value: 0.2330357454325883.
2026-06-02 00:32:39 | INFO | Trial 257 | outer=9 | alpha=4.120e+04 n_pcs=5000 (pc_topk) weight={'name': 'pc_logistic', 'floor': 1e-06, 'clip_max': 7.0, 'prob_clip': 0.009471217095244018, 'n_components': 80, 'logistic_c': 0.028571807925495064, 'pca_fit': 'combined', 'solver': 'lbfgs', 'max_iter': 2000, 'fit_intercept': True, 'standardize_with_source': True, 'rho': 0.85}
[I 2026-06-02 00:33:03,334] Trial 257 finished with value: 0.22843222028988763 and parameters: {'alpha': 41199.34164187269, 'n_pcs': 5000, 'iw_method': 'pc_logistic', 'iw_clip_max': 7.0, 'iw_prob_clip': 0.009471217095244018, 'iw_n_components': 80, 'iw_logistic_c': 0.028571807925495064, 'iw_pca_fit': 'combined', 'iw_solver': 'lbfgs', 'iw_rho': 0.85}. Best is trial 249 with value: 0.2330357454325883.
2026-06-02 00:33:03 | INFO | Trial 258 | outer=9 | alpha=6.433e+04 n_pcs=5000 (pc_topk) weight={'name': 'pc_logistic', 'floor': 1e-06, 'clip_max': 2.5, 'prob_clip': 0.010275670425519069, 'n_components': 80, 'logistic_c': 0.32094776401955727, 'pca_fit': 'combined', 'solver': 'lbfgs', 'max_iter': 2000, 'fit_intercept': True, 'standardize_with_source': True, 'rho': 0.85}
[I 2026-06-02 00:33:29,396] Trial 258 finished with value: 0.23290663745310486 and parameters: {'alpha': 64334.748003257, 'n_pcs': 5000, 'iw_method': 'pc_logistic', 'iw_clip_max': 2.5, 'iw_prob_clip': 0.010275670425519069, 'iw_n_components': 80, 'iw_logistic_c': 0.32094776401955727, 'iw_pca_fit': 'combined', 'iw_solver': 'lbfgs', 'iw_rho': 0.85}. Best is trial 249 with value: 0.2330357454325883.
2026-06-02 00:33:29 | INFO | Trial 259 | outer=9 | alpha=7.033e+04 n_pcs=5000 (pc_topk) weight={'name': 'pc_logistic', 'floor': 1e-06, 'clip_max': 2.5, 'prob_clip': 0.010192684220710239, 'n_components': 80, 'logistic_c': 0.31275885691220445, 'pca_fit': 'combined', 'solver': 'lbfgs', 'max_iter': 2000, 'fit_intercept': True, 'standardize_with_source': True, 'rho': 0.85}
[I 2026-06-02 00:33:55,469] Trial 259 finished with value: 0.2327455869560834 and parameters: {'alpha': 70330.49500946846, 'n_pcs': 5000, 'iw_method': 'pc_logistic', 'iw_clip_max': 2.5, 'iw_prob_clip': 0.010192684220710239, 'iw_n_components': 80, 'iw_logistic_c': 0.31275885691220445, 'iw_pca_fit': 'combined', 'iw_solver': 'lbfgs', 'iw_rho': 0.85}. Best is trial 249 with value: 0.2330357454325883.
2026-06-02 00:33:55 | INFO | Trial 260 | outer=9 | alpha=6.488e+04 n_pcs=5000 (pc_topk) weight={'name': 'pc_logistic', 'floor': 1e-06, 'clip_max': 4.0, 'prob_clip': 0.009273959106936092, 'n_components': 80, 'logistic_c': 0.26616381558578783, 'pca_fit': 'combined', 'solver': 'lbfgs', 'max_iter': 2000, 'fit_intercept': True, 'standardize_with_source': True, 'rho': 0.85}
[I 2026-06-02 00:34:21,042] Trial 260 finished with value: 0.23233326733912416 and parameters: {'alpha': 64880.479511175596, 'n_pcs': 5000, 'iw_method': 'pc_logistic', 'iw_clip_max': 4.0, 'iw_prob_clip': 0.009273959106936092, 'iw_n_components': 80, 'iw_logistic_c': 0.26616381558578783, 'iw_pca_fit': 'combined', 'iw_solver': 'lbfgs', 'iw_rho': 0.85}. Best is trial 249 with value: 0.2330357454325883.
2026-06-02 00:34:21 | INFO | Trial 261 | outer=9 | alpha=6.833e+04 n_pcs=5000 (pc_topk) weight={'name': 'pc_logistic', 'floor': 1e-06, 'clip_max': 4.0, 'prob_clip': 0.008973452098820958, 'n_components': 80, 'logistic_c': 0.2716815675222708, 'pca_fit': 'combined', 'solver': 'lbfgs', 'max_iter': 2000, 'fit_intercept': True, 'standardize_with_source': True, 'rho': 0.85}
[I 2026-06-02 00:34:47,053] Trial 261 finished with value: 0.23230344751914553 and parameters: {'alpha': 68328.88841078903, 'n_pcs': 5000, 'iw_method': 'pc_logistic', 'iw_clip_max': 4.0, 'iw_prob_clip': 0.008973452098820958, 'iw_n_components': 80, 'iw_logistic_c': 0.2716815675222708, 'iw_pca_fit': 'combined', 'iw_solver': 'lbfgs', 'iw_rho': 0.85}. Best is trial 249 with value: 0.2330357454325883.
2026-06-02 00:34:47 | INFO | Trial 262 | outer=9 | alpha=6.577e+04 n_pcs=5000 (pc_topk) weight={'name': 'pc_logistic', 'floor': 1e-06, 'clip_max': 4.0, 'prob_clip': 0.008912465904985597, 'n_components': 10, 'logistic_c': 0.2933327276000097, 'pca_fit': 'combined', 'solver': 'lbfgs', 'max_iter': 2000, 'fit_intercept': True, 'standardize_with_source': True, 'rho': 0.85}
[I 2026-06-02 00:35:06,429] Trial 262 finished with value: 0.22361559204286618 and parameters: {'alpha': 65771.25680759233, 'n_pcs': 5000, 'iw_method': 'pc_logistic', 'iw_clip_max': 4.0, 'iw_prob_clip': 0.008912465904985597, 'iw_n_components': 10, 'iw_logistic_c': 0.2933327276000097, 'iw_pca_fit': 'combined', 'iw_solver': 'lbfgs', 'iw_rho': 0.85}. Best is trial 249 with value: 0.2330357454325883.
2026-06-02 00:35:06 | INFO | Trial 263 | outer=9 | alpha=6.532e+04 n_pcs=5000 (pc_topk) weight={'name': 'pc_logistic', 'floor': 1e-06, 'clip_max': 4.0, 'prob_clip': 0.00907852258991737, 'n_components': 80, 'logistic_c': 0.38181538732203707, 'pca_fit': 'combined', 'solver': 'lbfgs', 'max_iter': 2000, 'fit_intercept': True, 'standardize_with_source': True, 'rho': 0.85}
[I 2026-06-02 00:35:32,215] Trial 263 finished with value: 0.2323630518638386 and parameters: {'alpha': 65320.44597154313, 'n_pcs': 5000, 'iw_method': 'pc_logistic', 'iw_clip_max': 4.0, 'iw_prob_clip': 0.00907852258991737, 'iw_n_components': 80, 'iw_logistic_c': 0.38181538732203707, 'iw_pca_fit': 'combined', 'iw_solver': 'lbfgs', 'iw_rho': 0.85}. Best is trial 249 with value: 0.2330357454325883.
2026-06-02 00:35:32 | INFO | Trial 264 | outer=9 | alpha=6.405e+04 n_pcs=5000 (pc_topk) weight={'name': 'pc_logistic', 'floor': 1e-06, 'clip_max': 4.0, 'prob_clip': 0.008999272214546236, 'n_components': 80, 'logistic_c': 0.36577320534093843, 'pca_fit': 'combined', 'solver': 'lbfgs', 'max_iter': 2000, 'fit_intercept': True, 'standardize_with_source': True, 'rho': 0.85}
[I 2026-06-02 00:35:59,716] Trial 264 finished with value: 0.2323868575123833 and parameters: {'alpha': 64054.296335172985, 'n_pcs': 5000, 'iw_method': 'pc_logistic', 'iw_clip_max': 4.0, 'iw_prob_clip': 0.008999272214546236, 'iw_n_components': 80, 'iw_logistic_c': 0.36577320534093843, 'iw_pca_fit': 'combined', 'iw_solver': 'lbfgs', 'iw_rho': 0.85}. Best is trial 249 with value: 0.2330357454325883.
2026-06-02 00:35:59 | INFO | Trial 265 | outer=9 | alpha=4.312e+04 n_pcs=5000 (pc_topk) weight={'name': 'pc_logistic', 'floor': 1e-06, 'clip_max': 4.0, 'prob_clip': 0.009029070219339878, 'n_components': 100, 'logistic_c': 0.35818349852440406, 'pca_fit': 'combined', 'solver': 'lbfgs', 'max_iter': 2000, 'fit_intercept': True, 'standardize_with_source': True, 'rho': 0.85}
[I 2026-06-02 00:36:27,368] Trial 265 finished with value: 0.2330790181260937 and parameters: {'alpha': 43115.38442660544, 'n_pcs': 5000, 'iw_method': 'pc_logistic', 'iw_clip_max': 4.0, 'iw_prob_clip': 0.009029070219339878, 'iw_n_components': 100, 'iw_logistic_c': 0.35818349852440406, 'iw_pca_fit': 'combined', 'iw_solver': 'lbfgs', 'iw_rho': 0.85}. Best is trial 265 with value: 0.2330790181260937.
2026-06-02 00:36:27 | INFO | Trial 266 | outer=9 | alpha=4.329e+04 n_pcs=5000 (pc_topk) weight={'name': 'pc_logistic', 'floor': 1e-06, 'clip_max': 4.0, 'prob_clip': 0.00897243034361312, 'n_components': 100, 'logistic_c': 0.3022391181090482, 'pca_fit': 'combined', 'solver': 'lbfgs', 'max_iter': 2000, 'fit_intercept': True, 'standardize_with_source': True, 'rho': 0.85}
[I 2026-06-02 00:36:54,998] Trial 266 finished with value: 0.2331298083620595 and parameters: {'alpha': 43292.834256281465, 'n_pcs': 5000, 'iw_method': 'pc_logistic', 'iw_clip_max': 4.0, 'iw_prob_clip': 0.00897243034361312, 'iw_n_components': 100, 'iw_logistic_c': 0.3022391181090482, 'iw_pca_fit': 'combined', 'iw_solver': 'lbfgs', 'iw_rho': 0.85}. Best is trial 266 with value: 0.2331298083620595.
2026-06-02 00:36:55 | INFO | Trial 267 | outer=9 | alpha=4.533e+04 n_pcs=5000 (pc_topk) weight={'name': 'pc_logistic', 'floor': 1e-06, 'clip_max': 4.0, 'prob_clip': 0.00904812465025861, 'n_components': 100, 'logistic_c': 0.3695128691579902, 'pca_fit': 'combined', 'solver': 'lbfgs', 'max_iter': 2000, 'fit_intercept': True, 'standardize_with_source': True, 'rho': 0.85}
[I 2026-06-02 00:37:21,199] Trial 267 finished with value: 0.23317321415284004 and parameters: {'alpha': 45332.57041526585, 'n_pcs': 5000, 'iw_method': 'pc_logistic', 'iw_clip_max': 4.0, 'iw_prob_clip': 0.00904812465025861, 'iw_n_components': 100, 'iw_logistic_c': 0.3695128691579902, 'iw_pca_fit': 'combined', 'iw_solver': 'lbfgs', 'iw_rho': 0.85}. Best is trial 267 with value: 0.23317321415284004.
2026-06-02 00:37:21 | INFO | Trial 268 | outer=9 | alpha=3.815e+04 n_pcs=5000 (pc_topk) weight={'name': 'pc_logistic', 'floor': 1e-06, 'clip_max': 4.0, 'prob_clip': 0.008926888654694941, 'n_components': 100, 'logistic_c': 0.40765065995695443, 'pca_fit': 'combined', 'solver': 'lbfgs', 'max_iter': 2000, 'fit_intercept': True, 'standardize_with_source': True, 'rho': 0.85}
[I 2026-06-02 00:37:47,444] Trial 268 finished with value: 0.23283669143400404 and parameters: {'alpha': 38148.983268385695, 'n_pcs': 5000, 'iw_method': 'pc_logistic', 'iw_clip_max': 4.0, 'iw_prob_clip': 0.008926888654694941, 'iw_n_components': 100, 'iw_logistic_c': 0.40765065995695443, 'iw_pca_fit': 'combined', 'iw_solver': 'lbfgs', 'iw_rho': 0.85}. Best is trial 267 with value: 0.23317321415284004.
2026-06-02 00:37:47 | INFO | Trial 269 | outer=9 | alpha=4.275e+04 n_pcs=5000 (pc_topk) weight={'name': 'pc_logistic', 'floor': 1e-06, 'clip_max': 4.0, 'prob_clip': 0.010341397139350946, 'n_components': 100, 'logistic_c': 0.44380715448209745, 'pca_fit': 'combined', 'solver': 'lbfgs', 'max_iter': 2000, 'fit_intercept': True, 'standardize_with_source': True, 'rho': 0.85}
[I 2026-06-02 00:38:15,898] Trial 269 finished with value: 0.23313154068665143 and parameters: {'alpha': 42753.80518656203, 'n_pcs': 5000, 'iw_method': 'pc_logistic', 'iw_clip_max': 4.0, 'iw_prob_clip': 0.010341397139350946, 'iw_n_components': 100, 'iw_logistic_c': 0.44380715448209745, 'iw_pca_fit': 'combined', 'iw_solver': 'lbfgs', 'iw_rho': 0.85}. Best is trial 267 with value: 0.23317321415284004.
2026-06-02 00:38:15 | INFO | Trial 270 | outer=9 | alpha=4.207e+04 n_pcs=5000 (pc_topk) weight={'name': 'pc_logistic', 'floor': 1e-06, 'clip_max': 4.0, 'prob_clip': 0.010429891991234341, 'n_components': 100, 'logistic_c': 0.4211620882499129, 'pca_fit': 'combined', 'solver': 'lbfgs', 'max_iter': 2000, 'fit_intercept': True, 'standardize_with_source': True, 'rho': 0.85}
[I 2026-06-02 00:38:42,818] Trial 270 finished with value: 0.23311238043010846 and parameters: {'alpha': 42067.39168948942, 'n_pcs': 5000, 'iw_method': 'pc_logistic', 'iw_clip_max': 4.0, 'iw_prob_clip': 0.010429891991234341, 'iw_n_components': 100, 'iw_logistic_c': 0.4211620882499129, 'iw_pca_fit': 'combined', 'iw_solver': 'lbfgs', 'iw_rho': 0.85}. Best is trial 267 with value: 0.23317321415284004.
2026-06-02 00:38:42 | INFO | Trial 271 | outer=9 | alpha=4.200e+04 n_pcs=5000 (pc_topk) weight={'name': 'pc_logistic', 'floor': 1e-06, 'clip_max': 4.0, 'prob_clip': 0.010311471894335773, 'n_components': 100, 'logistic_c': 0.41816332119577465, 'pca_fit': 'combined', 'solver': 'lbfgs', 'max_iter': 2000, 'fit_intercept': True, 'standardize_with_source': True, 'rho': 0.85}
[I 2026-06-02 00:39:09,326] Trial 271 finished with value: 0.23311400645295155 and parameters: {'alpha': 41999.78527006236, 'n_pcs': 5000, 'iw_method': 'pc_logistic', 'iw_clip_max': 4.0, 'iw_prob_clip': 0.010311471894335773, 'iw_n_components': 100, 'iw_logistic_c': 0.41816332119577465, 'iw_pca_fit': 'combined', 'iw_solver': 'lbfgs', 'iw_rho': 0.85}. Best is trial 267 with value: 0.23317321415284004.
2026-06-02 00:39:09 | INFO | Trial 272 | outer=9 | alpha=3.939e+04 n_pcs=5000 (pc_topk) weight={'name': 'pc_logistic', 'floor': 1e-06, 'clip_max': 4.0, 'prob_clip': 0.010206946422802307, 'n_components': 100, 'logistic_c': 0.4584423742614296, 'pca_fit': 'combined', 'solver': 'lbfgs', 'max_iter': 2000, 'fit_intercept': True, 'standardize_with_source': True, 'rho': 0.85}
[I 2026-06-02 00:39:35,522] Trial 272 finished with value: 0.23295789745523438 and parameters: {'alpha': 39390.07548083896, 'n_pcs': 5000, 'iw_method': 'pc_logistic', 'iw_clip_max': 4.0, 'iw_prob_clip': 0.010206946422802307, 'iw_n_components': 100, 'iw_logistic_c': 0.4584423742614296, 'iw_pca_fit': 'combined', 'iw_solver': 'lbfgs', 'iw_rho': 0.85}. Best is trial 267 with value: 0.23317321415284004.
2026-06-02 00:39:35 | INFO | Trial 273 | outer=9 | alpha=4.079e+04 n_pcs=5000 (pc_topk) weight={'name': 'pc_logistic', 'floor': 1e-06, 'clip_max': 4.0, 'prob_clip': 0.010356230231790818, 'n_components': 100, 'logistic_c': 0.43843294671593935, 'pca_fit': 'combined', 'solver': 'lbfgs', 'max_iter': 2000, 'fit_intercept': True, 'standardize_with_source': True, 'rho': 0.85}
[I 2026-06-02 00:40:03,371] Trial 273 finished with value: 0.23304926855030478 and parameters: {'alpha': 40790.443566986825, 'n_pcs': 5000, 'iw_method': 'pc_logistic', 'iw_clip_max': 4.0, 'iw_prob_clip': 0.010356230231790818, 'iw_n_components': 100, 'iw_logistic_c': 0.43843294671593935, 'iw_pca_fit': 'combined', 'iw_solver': 'lbfgs', 'iw_rho': 0.85}. Best is trial 267 with value: 0.23317321415284004.
2026-06-02 00:40:03 | INFO | Trial 274 | outer=9 | alpha=4.009e+04 n_pcs=5000 (pc_topk) weight={'name': 'pc_logistic', 'floor': 1e-06, 'clip_max': 4.0, 'prob_clip': 0.010375274305214196, 'n_components': 100, 'logistic_c': 0.4679027339957875, 'pca_fit': 'combined', 'solver': 'lbfgs', 'max_iter': 2000, 'fit_intercept': True, 'standardize_with_source': True, 'rho': 0.85}
[I 2026-06-02 00:40:30,267] Trial 274 finished with value: 0.23298766745913896 and parameters: {'alpha': 40089.38157702451, 'n_pcs': 5000, 'iw_method': 'pc_logistic', 'iw_clip_max': 4.0, 'iw_prob_clip': 0.010375274305214196, 'iw_n_components': 100, 'iw_logistic_c': 0.4679027339957875, 'iw_pca_fit': 'combined', 'iw_solver': 'lbfgs', 'iw_rho': 0.85}. Best is trial 267 with value: 0.23317321415284004.
2026-06-02 00:40:30 | INFO | Trial 275 | outer=9 | alpha=4.017e+04 n_pcs=5000 (pc_topk) weight={'name': 'pc_logistic', 'floor': 1e-06, 'clip_max': 4.0, 'prob_clip': 0.010109014370093518, 'n_components': 100, 'logistic_c': 0.434852185985423, 'pca_fit': 'combined', 'solver': 'lbfgs', 'max_iter': 2000, 'fit_intercept': True, 'standardize_with_source': True, 'rho': 0.85}
[I 2026-06-02 00:40:58,256] Trial 275 finished with value: 0.233016341797348 and parameters: {'alpha': 40172.5505196276, 'n_pcs': 5000, 'iw_method': 'pc_logistic', 'iw_clip_max': 4.0, 'iw_prob_clip': 0.010109014370093518, 'iw_n_components': 100, 'iw_logistic_c': 0.434852185985423, 'iw_pca_fit': 'combined', 'iw_solver': 'lbfgs', 'iw_rho': 0.85}. Best is trial 267 with value: 0.23317321415284004.
2026-06-02 00:40:58 | INFO | Trial 276 | outer=9 | alpha=3.937e+04 n_pcs=5000 (pc_topk) weight={'name': 'pc_logistic', 'floor': 1e-06, 'clip_max': 4.0, 'prob_clip': 0.010392898892450486, 'n_components': 100, 'logistic_c': 0.42624725072031494, 'pca_fit': 'combined', 'solver': 'lbfgs', 'max_iter': 2000, 'fit_intercept': True, 'standardize_with_source': True, 'rho': 0.85}
[I 2026-06-02 00:41:25,361] Trial 276 finished with value: 0.23298348498484817 and parameters: {'alpha': 39365.739797379596, 'n_pcs': 5000, 'iw_method': 'pc_logistic', 'iw_clip_max': 4.0, 'iw_prob_clip': 0.010392898892450486, 'iw_n_components': 100, 'iw_logistic_c': 0.42624725072031494, 'iw_pca_fit': 'combined', 'iw_solver': 'lbfgs', 'iw_rho': 0.85}. Best is trial 267 with value: 0.23317321415284004.
2026-06-02 00:41:25 | INFO | Trial 277 | outer=9 | alpha=3.953e+04 n_pcs=5000 (pc_topk) weight={'name': 'pc_logistic', 'floor': 1e-06, 'clip_max': 4.0, 'prob_clip': 0.010392867843398776, 'n_components': 100, 'logistic_c': 1.115737101447948, 'pca_fit': 'combined', 'solver': 'lbfgs', 'max_iter': 2000, 'fit_intercept': True, 'standardize_with_source': True, 'rho': 0.85}
[I 2026-06-02 00:41:53,555] Trial 277 finished with value: 0.23295187675732398 and parameters: {'alpha': 39533.765235551065, 'n_pcs': 5000, 'iw_method': 'pc_logistic', 'iw_clip_max': 4.0, 'iw_prob_clip': 0.010392867843398776, 'iw_n_components': 100, 'iw_logistic_c': 1.115737101447948, 'iw_pca_fit': 'combined', 'iw_solver': 'lbfgs', 'iw_rho': 0.85}. Best is trial 267 with value: 0.23317321415284004.
2026-06-02 00:41:53 | INFO | Trial 278 | outer=9 | alpha=3.761e+04 n_pcs=5000 (pc_topk) weight={'name': 'pc_logistic', 'floor': 1e-06, 'clip_max': 4.0, 'prob_clip': 0.010125527086255347, 'n_components': 100, 'logistic_c': 0.3867342348004668, 'pca_fit': 'combined', 'solver': 'lbfgs', 'max_iter': 2000, 'fit_intercept': True, 'standardize_with_source': True, 'rho': 0.85}
[I 2026-06-02 00:42:20,923] Trial 278 finished with value: 0.2328079565903855 and parameters: {'alpha': 37612.996316854, 'n_pcs': 5000, 'iw_method': 'pc_logistic', 'iw_clip_max': 4.0, 'iw_prob_clip': 0.010125527086255347, 'iw_n_components': 100, 'iw_logistic_c': 0.3867342348004668, 'iw_pca_fit': 'combined', 'iw_solver': 'lbfgs', 'iw_rho': 0.85}. Best is trial 267 with value: 0.23317321415284004.
2026-06-02 00:42:20 | INFO | Trial 279 | outer=9 | alpha=3.847e+04 n_pcs=5000 (pc_topk) weight={'name': 'pc_logistic', 'floor': 1e-06, 'clip_max': 4.0, 'prob_clip': 0.010104983840761209, 'n_components': 100, 'logistic_c': 0.4667938222650906, 'pca_fit': 'combined', 'solver': 'lbfgs', 'max_iter': 2000, 'fit_intercept': True, 'standardize_with_source': True, 'rho': 0.85}
[I 2026-06-02 00:42:48,062] Trial 279 finished with value: 0.23290954213349985 and parameters: {'alpha': 38469.17571160497, 'n_pcs': 5000, 'iw_method': 'pc_logistic', 'iw_clip_max': 4.0, 'iw_prob_clip': 0.010104983840761209, 'iw_n_components': 100, 'iw_logistic_c': 0.4667938222650906, 'iw_pca_fit': 'combined', 'iw_solver': 'lbfgs', 'iw_rho': 0.85}. Best is trial 267 with value: 0.23317321415284004.
2026-06-02 00:42:48 | INFO | Trial 280 | outer=9 | alpha=3.874e+04 n_pcs=5000 (pc_topk) weight={'name': 'pc_logistic', 'floor': 1e-06, 'clip_max': 4.0, 'prob_clip': 0.010201004818654194, 'n_components': 100, 'logistic_c': 1.2576309500553677, 'pca_fit': 'combined', 'solver': 'lbfgs', 'max_iter': 2000, 'fit_intercept': True, 'standardize_with_source': True, 'rho': 0.85}
[I 2026-06-02 00:43:15,838] Trial 280 finished with value: 0.23286494132733987 and parameters: {'alpha': 38739.16478790987, 'n_pcs': 5000, 'iw_method': 'pc_logistic', 'iw_clip_max': 4.0, 'iw_prob_clip': 0.010201004818654194, 'iw_n_components': 100, 'iw_logistic_c': 1.2576309500553677, 'iw_pca_fit': 'combined', 'iw_solver': 'lbfgs', 'iw_rho': 0.85}. Best is trial 267 with value: 0.23317321415284004.
2026-06-02 00:43:15 | INFO | Trial 281 | outer=9 | alpha=3.948e+04 n_pcs=5000 (pc_topk) weight={'name': 'pc_logistic', 'floor': 1e-06, 'clip_max': 4.0, 'prob_clip': 0.010544854277384417, 'n_components': 100, 'logistic_c': 1.2168683183538227, 'pca_fit': 'combined', 'solver': 'lbfgs', 'max_iter': 2000, 'fit_intercept': True, 'standardize_with_source': True, 'rho': 0.85}
[I 2026-06-02 00:43:42,080] Trial 281 finished with value: 0.23293308703567 and parameters: {'alpha': 39484.94142331891, 'n_pcs': 5000, 'iw_method': 'pc_logistic', 'iw_clip_max': 4.0, 'iw_prob_clip': 0.010544854277384417, 'iw_n_components': 100, 'iw_logistic_c': 1.2168683183538227, 'iw_pca_fit': 'combined', 'iw_solver': 'lbfgs', 'iw_rho': 0.85}. Best is trial 267 with value: 0.23317321415284004.
2026-06-02 00:43:42 | INFO | Trial 282 | outer=9 | alpha=3.793e+04 n_pcs=5000 (pc_topk) weight={'name': 'pc_logistic', 'floor': 1e-06, 'clip_max': 4.0, 'prob_clip': 0.010392319478130015, 'n_components': 100, 'logistic_c': 1.4945347120109982, 'pca_fit': 'combined', 'solver': 'lbfgs', 'max_iter': 2000, 'fit_intercept': True, 'standardize_with_source': True, 'rho': 0.85}
