[I 2026-06-01 02:42:27,506] Trial 253 finished with value: 0.23584325912171566 and parameters: {'alpha': 136883.69743037634, 'n_pcs': 4000, 'weight_scheme': 'linear', 'weight_clip_max': None, 'weight_linear_min_weight': 0.09848738760503986, 'weight_linear_max_weight': 3.914375962286748}. Best is trial 235 with value: 0.23591664455924927.
2026-06-01 02:42:27 | INFO | src.nested_cv_avggrm_weighted_unified | Trial 254 | outer=10 | alpha=1.588e+05 n_pcs=4000 (pc_topk) weight_search=on
2026-06-01 02:42:27 | INFO | src.nested_cv_avggrm_weighted_unified | Trial 254 | outer=10 | weight={'name': 'linear', 'floor': 1e-06, 'clip_max': None, 'min_weight': 0.08901171395175068, 'max_weight': 4.0375951225589555}
[I 2026-06-01 02:42:33,293] Trial 254 finished with value: 0.2356318738735474 and parameters: {'alpha': 158770.67172895986, 'n_pcs': 4000, 'weight_scheme': 'linear', 'weight_clip_max': None, 'weight_linear_min_weight': 0.08901171395175068, 'weight_linear_max_weight': 4.0375951225589555}. Best is trial 235 with value: 0.23591664455924927.
2026-06-01 02:42:33 | INFO | src.nested_cv_avggrm_weighted_unified | Trial 255 | outer=10 | alpha=1.271e+05 n_pcs=4000 (pc_topk) weight_search=on
2026-06-01 02:42:33 | INFO | src.nested_cv_avggrm_weighted_unified | Trial 255 | outer=10 | weight={'name': 'exponential', 'floor': 1e-06, 'clip_max': 10.0, 'beta': 2.571552274692783}
[I 2026-06-01 02:42:39,088] Trial 255 finished with value: 0.2354464802000321 and parameters: {'alpha': 127064.40429417504, 'n_pcs': 4000, 'weight_scheme': 'exponential', 'weight_clip_max': 10.0, 'weight_exponential_beta': 2.571552274692783}. Best is trial 235 with value: 0.23591664455924927.
2026-06-01 02:42:39 | INFO | src.nested_cv_avggrm_weighted_unified | Trial 256 | outer=10 | alpha=1.798e+05 n_pcs=3500 (pc_topk) weight_search=on
2026-06-01 02:42:39 | INFO | src.nested_cv_avggrm_weighted_unified | Trial 256 | outer=10 | weight={'name': 'linear', 'floor': 1e-06, 'clip_max': None, 'min_weight': 0.11393528313345422, 'max_weight': 4.244468715505322}
[I 2026-06-01 02:42:44,930] Trial 256 finished with value: 0.23508662982245282 and parameters: {'alpha': 179760.91402141543, 'n_pcs': 3500, 'weight_scheme': 'linear', 'weight_clip_max': None, 'weight_linear_min_weight': 0.11393528313345422, 'weight_linear_max_weight': 4.244468715505322}. Best is trial 235 with value: 0.23591664455924927.
2026-06-01 02:42:44 | INFO | src.nested_cv_avggrm_weighted_unified | Trial 257 | outer=10 | alpha=8.774e+04 n_pcs=4000 (pc_topk) weight_search=on
2026-06-01 02:42:44 | INFO | src.nested_cv_avggrm_weighted_unified | Trial 257 | outer=10 | weight={'name': 'linear', 'floor': 1e-06, 'clip_max': None, 'min_weight': 0.36742684666503245, 'max_weight': 4.140882550915097}
2026-06-01 02:42:49 | INFO | src.nested_cv_avggrm_weighted_unified | Trial 257 | outer=10 | pruned after 8/10 inner folds (mean r=0.2681)
[I 2026-06-01 02:42:49,583] Trial 257 pruned. 
2026-06-01 02:42:49 | INFO | src.nested_cv_avggrm_weighted_unified | Trial 258 | outer=10 | alpha=1.234e+05 n_pcs=4000 (pc_topk) weight_search=on
2026-06-01 02:42:49 | INFO | src.nested_cv_avggrm_weighted_unified | Trial 258 | outer=10 | weight={'name': 'linear', 'floor': 1e-06, 'clip_max': None, 'min_weight': 0.07882055876966082, 'max_weight': 4.33844379048533}
[I 2026-06-01 02:42:55,414] Trial 258 finished with value: 0.23592669608374228 and parameters: {'alpha': 123398.39120846806, 'n_pcs': 4000, 'weight_scheme': 'linear', 'weight_clip_max': None, 'weight_linear_min_weight': 0.07882055876966082, 'weight_linear_max_weight': 4.33844379048533}. Best is trial 258 with value: 0.23592669608374228.
2026-06-01 02:42:55 | INFO | src.nested_cv_avggrm_weighted_unified | OUTER 10 | new best trial 258 (mean inner r=0.2359) saved to outputs/final_results/e6_pc_ridge_avggrm/thr_wing/e6_pc_ridge_avggrm_thr_wing_best_trials/split_10_best_trial.json
2026-06-01 02:42:55 | INFO | src.nested_cv_avggrm_weighted_unified | Trial 259 | outer=10 | alpha=2.029e+05 n_pcs=4000 (pc_topk) weight_search=on
2026-06-01 02:42:55 | INFO | src.nested_cv_avggrm_weighted_unified | Trial 259 | outer=10 | weight={'name': 'linear', 'floor': 1e-06, 'clip_max': None, 'min_weight': 0.09752632681275443, 'max_weight': 4.351039990420518}
[I 2026-06-01 02:43:01,650] Trial 259 finished with value: 0.2349094060041165 and parameters: {'alpha': 202904.52166737776, 'n_pcs': 4000, 'weight_scheme': 'linear', 'weight_clip_max': None, 'weight_linear_min_weight': 0.09752632681275443, 'weight_linear_max_weight': 4.351039990420518}. Best is trial 258 with value: 0.23592669608374228.
2026-06-01 02:43:01 | INFO | src.nested_cv_avggrm_weighted_unified | Trial 260 | outer=10 | alpha=1.457e+05 n_pcs=4500 (pc_topk) weight_search=on
2026-06-01 02:43:01 | INFO | src.nested_cv_avggrm_weighted_unified | Trial 260 | outer=10 | weight={'name': 'linear', 'floor': 1e-06, 'clip_max': None, 'min_weight': 0.08190990365811512, 'max_weight': 3.8075001259600385}
[I 2026-06-01 02:43:08,674] Trial 260 finished with value: 0.23569765246294794 and parameters: {'alpha': 145683.51370668583, 'n_pcs': 4500, 'weight_scheme': 'linear', 'weight_clip_max': None, 'weight_linear_min_weight': 0.08190990365811512, 'weight_linear_max_weight': 3.8075001259600385}. Best is trial 258 with value: 0.23592669608374228.
2026-06-01 02:43:08 | INFO | src.nested_cv_avggrm_weighted_unified | Trial 261 | outer=10 | alpha=1.250e+05 n_pcs=1000 (pc_topk) weight_search=on
2026-06-01 02:43:08 | INFO | src.nested_cv_avggrm_weighted_unified | Trial 261 | outer=10 | weight={'name': 'linear', 'floor': 1e-06, 'clip_max': None, 'min_weight': 0.13043877754938024, 'max_weight': 3.94946967347864}
2026-06-01 02:43:09 | INFO | src.nested_cv_avggrm_weighted_unified | Trial 261 | outer=10 | pruned after 8/10 inner folds (mean r=0.2596)
[I 2026-06-01 02:43:09,836] Trial 261 pruned. 
2026-06-01 02:43:09 | INFO | src.nested_cv_avggrm_weighted_unified | Trial 262 | outer=10 | alpha=1.568e+05 n_pcs=4000 (pc_topk) weight_search=on
2026-06-01 02:43:09 | INFO | src.nested_cv_avggrm_weighted_unified | Trial 262 | outer=10 | weight={'name': 'linear', 'floor': 1e-06, 'clip_max': None, 'min_weight': 0.10520594518539797, 'max_weight': 4.218029671240881}
[I 2026-06-01 02:43:15,733] Trial 262 finished with value: 0.23563209633498863 and parameters: {'alpha': 156753.6332164515, 'n_pcs': 4000, 'weight_scheme': 'linear', 'weight_clip_max': None, 'weight_linear_min_weight': 0.10520594518539797, 'weight_linear_max_weight': 4.218029671240881}. Best is trial 258 with value: 0.23592669608374228.
2026-06-01 02:43:15 | INFO | src.nested_cv_avggrm_weighted_unified | Trial 263 | outer=10 | alpha=1.017e+05 n_pcs=4000 (pc_topk) weight_search=on
2026-06-01 02:43:15 | INFO | src.nested_cv_avggrm_weighted_unified | Trial 263 | outer=10 | weight={'name': 'linear', 'floor': 1e-06, 'clip_max': None, 'min_weight': 0.08033120830290125, 'max_weight': 4.580173180591957}
2026-06-01 02:43:20 | INFO | src.nested_cv_avggrm_weighted_unified | Trial 263 | outer=10 | pruned after 8/10 inner folds (mean r=0.2694)
[I 2026-06-01 02:43:20,532] Trial 263 pruned. 
2026-06-01 02:43:20 | INFO | src.nested_cv_avggrm_weighted_unified | Trial 264 | outer=10 | alpha=1.791e+06 n_pcs=3500 (pc_topk) weight_search=on
2026-06-01 02:43:20 | INFO | src.nested_cv_avggrm_weighted_unified | Trial 264 | outer=10 | weight={'name': 'linear', 'floor': 1e-06, 'clip_max': 3.0, 'min_weight': 0.06745776772969056, 'max_weight': 4.05442853030343}
2026-06-01 02:43:23 | INFO | src.nested_cv_avggrm_weighted_unified | Trial 264 | outer=10 | pruned after 5/10 inner folds (mean r=0.2198)
[I 2026-06-01 02:43:23,021] Trial 264 pruned. 
2026-06-01 02:43:23 | INFO | src.nested_cv_avggrm_weighted_unified | Trial 265 | outer=10 | alpha=7.190e+04 n_pcs=4000 (pc_topk) weight_search=on
2026-06-01 02:43:23 | INFO | src.nested_cv_avggrm_weighted_unified | Trial 265 | outer=10 | weight={'name': 'linear', 'floor': 1e-06, 'clip_max': 5.0, 'min_weight': 0.11764556923354631, 'max_weight': 4.356632737509294}
2026-06-01 02:43:27 | INFO | src.nested_cv_avggrm_weighted_unified | Trial 265 | outer=10 | pruned after 8/10 inner folds (mean r=0.2664)
[I 2026-06-01 02:43:27,692] Trial 265 pruned. 
2026-06-01 02:43:27 | INFO | src.nested_cv_avggrm_weighted_unified | Trial 266 | outer=10 | alpha=1.260e+05 n_pcs=4000 (pc_topk) weight_search=on
2026-06-01 02:43:27 | INFO | src.nested_cv_avggrm_weighted_unified | Trial 266 | outer=10 | weight={'name': 'linear', 'floor': 1e-06, 'clip_max': 10.0, 'min_weight': 0.08794022267094942, 'max_weight': 4.281529005283702}
[I 2026-06-01 02:43:33,474] Trial 266 finished with value: 0.23591845679245158 and parameters: {'alpha': 126023.25401893763, 'n_pcs': 4000, 'weight_scheme': 'linear', 'weight_clip_max': 10.0, 'weight_linear_min_weight': 0.08794022267094942, 'weight_linear_max_weight': 4.281529005283702}. Best is trial 258 with value: 0.23592669608374228.
2026-06-01 02:43:33 | INFO | src.nested_cv_avggrm_weighted_unified | Trial 267 | outer=10 | alpha=1.882e+05 n_pcs=4000 (pc_topk) weight_search=on
2026-06-01 02:43:33 | INFO | src.nested_cv_avggrm_weighted_unified | Trial 267 | outer=10 | weight={'name': 'linear', 'floor': 1e-06, 'clip_max': None, 'min_weight': 0.06167812251564529, 'max_weight': 4.302646154956744}
[I 2026-06-01 02:43:39,230] Trial 267 finished with value: 0.23526950802930618 and parameters: {'alpha': 188165.58269843526, 'n_pcs': 4000, 'weight_scheme': 'linear', 'weight_clip_max': None, 'weight_linear_min_weight': 0.06167812251564529, 'weight_linear_max_weight': 4.302646154956744}. Best is trial 258 with value: 0.23592669608374228.
2026-06-01 02:43:39 | INFO | src.nested_cv_avggrm_weighted_unified | Trial 268 | outer=10 | alpha=1.380e+05 n_pcs=3500 (pc_topk) weight_search=on
2026-06-01 02:43:39 | INFO | src.nested_cv_avggrm_weighted_unified | Trial 268 | outer=10 | weight={'name': 'linear', 'floor': 1e-06, 'clip_max': 10.0, 'min_weight': 0.0968049961503139, 'max_weight': 4.149887324108519}
2026-06-01 02:43:43 | INFO | src.nested_cv_avggrm_weighted_unified | Trial 268 | outer=10 | pruned after 8/10 inner folds (mean r=0.2698)
[I 2026-06-01 02:43:43,866] Trial 268 pruned. 
2026-06-01 02:43:43 | INFO | src.nested_cv_avggrm_weighted_unified | Trial 269 | outer=10 | alpha=9.597e+04 n_pcs=4000 (pc_topk) weight_search=on
2026-06-01 02:43:43 | INFO | src.nested_cv_avggrm_weighted_unified | Trial 269 | outer=10 | weight={'name': 'linear', 'floor': 1e-06, 'clip_max': 10.0, 'min_weight': 0.07191390229584632, 'max_weight': 3.7949301584101365}
2026-06-01 02:43:48 | INFO | src.nested_cv_avggrm_weighted_unified | Trial 269 | outer=10 | pruned after 8/10 inner folds (mean r=0.2690)
[I 2026-06-01 02:43:48,496] Trial 269 pruned. 
2026-06-01 02:43:48 | INFO | src.nested_cv_avggrm_weighted_unified | Trial 270 | outer=10 | alpha=1.178e+05 n_pcs=4000 (pc_topk) weight_search=on
2026-06-01 02:43:48 | INFO | src.nested_cv_avggrm_weighted_unified | Trial 270 | outer=10 | weight={'name': 'uniform', 'floor': 1e-06, 'clip_max': 10.0}
2026-06-01 02:43:52 | INFO | src.nested_cv_avggrm_weighted_unified | Trial 270 | outer=10 | pruned after 7/10 inner folds (mean r=0.2317)
[I 2026-06-01 02:43:52,227] Trial 270 pruned. 
2026-06-01 02:43:52 | INFO | src.nested_cv_avggrm_weighted_unified | Trial 271 | outer=10 | alpha=8.126e+04 n_pcs=4500 (pc_topk) weight_search=on
2026-06-01 02:43:52 | INFO | src.nested_cv_avggrm_weighted_unified | Trial 271 | outer=10 | weight={'name': 'linear', 'floor': 1e-06, 'clip_max': 10.0, 'min_weight': 0.08247726612377063, 'max_weight': 4.223774163774759}
2026-06-01 02:43:57 | INFO | src.nested_cv_avggrm_weighted_unified | Trial 271 | outer=10 | pruned after 8/10 inner folds (mean r=0.2674)
[I 2026-06-01 02:43:57,846] Trial 271 pruned. 
2026-06-01 02:43:57 | INFO | src.nested_cv_avggrm_weighted_unified | Trial 272 | outer=10 | alpha=2.299e+05 n_pcs=4000 (pc_topk) weight_search=on
2026-06-01 02:43:57 | INFO | src.nested_cv_avggrm_weighted_unified | Trial 272 | outer=10 | weight={'name': 'linear', 'floor': 1e-06, 'clip_max': 10.0, 'min_weight': 0.5616864704973855, 'max_weight': 3.991789090528788}
2026-06-01 02:44:02 | INFO | src.nested_cv_avggrm_weighted_unified | Trial 272 | outer=10 | pruned after 8/10 inner folds (mean r=0.2681)
[I 2026-06-01 02:44:02,577] Trial 272 pruned. 
2026-06-01 02:44:02 | INFO | src.nested_cv_avggrm_weighted_unified | Trial 273 | outer=10 | alpha=1.108e+06 n_pcs=4000 (pc_topk) weight_search=on
2026-06-01 02:44:02 | INFO | src.nested_cv_avggrm_weighted_unified | Trial 273 | outer=10 | weight={'name': 'linear', 'floor': 1e-06, 'clip_max': 10.0, 'min_weight': 0.05068917109106726, 'max_weight': 4.0965677482867955}
2026-06-01 02:44:06 | INFO | src.nested_cv_avggrm_weighted_unified | Trial 273 | outer=10 | pruned after 7/10 inner folds (mean r=0.2436)
[I 2026-06-01 02:44:06,598] Trial 273 pruned. 
2026-06-01 02:44:06 | INFO | src.nested_cv_avggrm_weighted_unified | Trial 274 | outer=10 | alpha=1.582e+05 n_pcs=4000 (pc_topk) weight_search=on
2026-06-01 02:44:06 | INFO | src.nested_cv_avggrm_weighted_unified | Trial 274 | outer=10 | weight={'name': 'linear', 'floor': 1e-06, 'clip_max': 10.0, 'min_weight': 0.11698451490915401, 'max_weight': 4.559229735380214}
[I 2026-06-01 02:44:12,385] Trial 274 finished with value: 0.23560584979575422 and parameters: {'alpha': 158203.2933032695, 'n_pcs': 4000, 'weight_scheme': 'linear', 'weight_clip_max': 10.0, 'weight_linear_min_weight': 0.11698451490915401, 'weight_linear_max_weight': 4.559229735380214}. Best is trial 258 with value: 0.23592669608374228.
2026-06-01 02:44:12 | INFO | src.nested_cv_avggrm_weighted_unified | Trial 275 | outer=10 | alpha=1.045e+05 n_pcs=4500 (pc_topk) weight_search=on
2026-06-01 02:44:12 | INFO | src.nested_cv_avggrm_weighted_unified | Trial 275 | outer=10 | weight={'name': 'linear', 'floor': 1e-06, 'clip_max': 10.0, 'min_weight': 0.09814213773483062, 'max_weight': 4.3850397174428695}
2026-06-01 02:44:18 | INFO | src.nested_cv_avggrm_weighted_unified | Trial 275 | outer=10 | pruned after 8/10 inner folds (mean r=0.2691)
[I 2026-06-01 02:44:18,049] Trial 275 pruned. 
2026-06-01 02:44:18 | INFO | src.nested_cv_avggrm_weighted_unified | Trial 276 | outer=10 | alpha=1.310e+05 n_pcs=4000 (pc_topk) weight_search=on
2026-06-01 02:44:18 | INFO | src.nested_cv_avggrm_weighted_unified | Trial 276 | outer=10 | weight={'name': 'linear', 'floor': 1e-06, 'clip_max': None, 'min_weight': 0.0657764094428047, 'max_weight': 4.26673492077708}
[I 2026-06-01 02:44:23,975] Trial 276 finished with value: 0.2359181193926862 and parameters: {'alpha': 131040.55734200722, 'n_pcs': 4000, 'weight_scheme': 'linear', 'weight_clip_max': None, 'weight_linear_min_weight': 0.0657764094428047, 'weight_linear_max_weight': 4.26673492077708}. Best is trial 258 with value: 0.23592669608374228.
2026-06-01 02:44:23 | INFO | src.nested_cv_avggrm_weighted_unified | Trial 277 | outer=10 | alpha=1.181e+05 n_pcs=4000 (pc_topk) weight_search=on
2026-06-01 02:44:23 | INFO | src.nested_cv_avggrm_weighted_unified | Trial 277 | outer=10 | weight={'name': 'exponential', 'floor': 1e-06, 'clip_max': None, 'beta': 8.286238391181746}
2026-06-01 02:44:28 | INFO | src.nested_cv_avggrm_weighted_unified | Trial 277 | outer=10 | pruned after 8/10 inner folds (mean r=0.2522)
[I 2026-06-01 02:44:28,573] Trial 277 pruned. 
2026-06-01 02:44:28 | INFO | src.nested_cv_avggrm_weighted_unified | Trial 278 | outer=10 | alpha=1.553e+05 n_pcs=4000 (pc_topk) weight_search=on
2026-06-01 02:44:28 | INFO | src.nested_cv_avggrm_weighted_unified | Trial 278 | outer=10 | weight={'name': 'linear', 'floor': 1e-06, 'clip_max': None, 'min_weight': 0.13400861903259298, 'max_weight': 4.497709839956836}
[I 2026-06-01 02:44:34,367] Trial 278 finished with value: 0.23560454816154858 and parameters: {'alpha': 155302.18744873794, 'n_pcs': 4000, 'weight_scheme': 'linear', 'weight_clip_max': None, 'weight_linear_min_weight': 0.13400861903259298, 'weight_linear_max_weight': 4.497709839956836}. Best is trial 258 with value: 0.23592669608374228.
2026-06-01 02:44:34 | INFO | src.nested_cv_avggrm_weighted_unified | Trial 279 | outer=10 | alpha=8.544e+04 n_pcs=4000 (pc_topk) weight_search=on
2026-06-01 02:44:34 | INFO | src.nested_cv_avggrm_weighted_unified | Trial 279 | outer=10 | weight={'name': 'linear', 'floor': 1e-06, 'clip_max': None, 'min_weight': 0.07844754802678282, 'max_weight': 4.296968550963477}
2026-06-01 02:44:39 | INFO | src.nested_cv_avggrm_weighted_unified | Trial 279 | outer=10 | pruned after 8/10 inner folds (mean r=0.2681)
[I 2026-06-01 02:44:39,065] Trial 279 pruned. 
2026-06-01 02:44:39 | INFO | src.nested_cv_avggrm_weighted_unified | Trial 280 | outer=10 | alpha=1.814e+05 n_pcs=4000 (pc_topk) weight_search=on
2026-06-01 02:44:39 | INFO | src.nested_cv_avggrm_weighted_unified | Trial 280 | outer=10 | weight={'name': 'linear', 'floor': 1e-06, 'clip_max': None, 'min_weight': 0.10437887141951185, 'max_weight': 4.189609863384709}
[I 2026-06-01 02:44:45,222] Trial 280 finished with value: 0.2352551244905141 and parameters: {'alpha': 181420.26231616928, 'n_pcs': 4000, 'weight_scheme': 'linear', 'weight_clip_max': None, 'weight_linear_min_weight': 0.10437887141951185, 'weight_linear_max_weight': 4.189609863384709}. Best is trial 258 with value: 0.23592669608374228.
2026-06-01 02:44:45 | INFO | src.nested_cv_avggrm_weighted_unified | Trial 281 | outer=10 | alpha=1.011e+05 n_pcs=4000 (pc_topk) weight_search=on
2026-06-01 02:44:45 | INFO | src.nested_cv_avggrm_weighted_unified | Trial 281 | outer=10 | weight={'name': 'linear', 'floor': 1e-06, 'clip_max': None, 'min_weight': 0.657642177297461, 'max_weight': 4.279820984438228}
2026-06-01 02:44:49 | INFO | src.nested_cv_avggrm_weighted_unified | Trial 281 | outer=10 | pruned after 8/10 inner folds (mean r=0.2679)
[I 2026-06-01 02:44:49,859] Trial 281 pruned. 
2026-06-01 02:44:49 | INFO | src.nested_cv_avggrm_weighted_unified | Trial 282 | outer=10 | alpha=1.335e+05 n_pcs=4000 (pc_topk) weight_search=on
2026-06-01 02:44:49 | INFO | src.nested_cv_avggrm_weighted_unified | Trial 282 | outer=10 | weight={'name': 'linear', 'floor': 1e-06, 'clip_max': None, 'min_weight': 0.0678942317438197, 'max_weight': 4.056707170040944}
[I 2026-06-01 02:44:55,660] Trial 282 finished with value: 0.23590432647164117 and parameters: {'alpha': 133480.1002979192, 'n_pcs': 4000, 'weight_scheme': 'linear', 'weight_clip_max': None, 'weight_linear_min_weight': 0.0678942317438197, 'weight_linear_max_weight': 4.056707170040944}. Best is trial 258 with value: 0.23592669608374228.
2026-06-01 02:44:55 | INFO | src.nested_cv_avggrm_weighted_unified | Trial 283 | outer=10 | alpha=1.415e+05 n_pcs=3500 (pc_topk) weight_search=on
2026-06-01 02:44:55 | INFO | src.nested_cv_avggrm_weighted_unified | Trial 283 | outer=10 | weight={'name': 'linear', 'floor': 1e-06, 'clip_max': None, 'min_weight': 0.08428586993089465, 'max_weight': 4.050909404876325}
2026-06-01 02:44:59 | INFO | src.nested_cv_avggrm_weighted_unified | Trial 283 | outer=10 | pruned after 8/10 inner folds (mean r=0.2699)
[I 2026-06-01 02:44:59,767] Trial 283 pruned. 
2026-06-01 02:44:59 | INFO | src.nested_cv_avggrm_weighted_unified | Trial 284 | outer=10 | alpha=9.784e+03 n_pcs=4500 (pc_topk) weight_search=on
2026-06-01 02:44:59 | INFO | src.nested_cv_avggrm_weighted_unified | Trial 284 | outer=10 | weight={'name': 'linear', 'floor': 1e-06, 'clip_max': None, 'min_weight': 0.06754342328254294, 'max_weight': 4.136138328608224}
2026-06-01 02:45:05 | INFO | src.nested_cv_avggrm_weighted_unified | Trial 284 | outer=10 | pruned after 8/10 inner folds (mean r=0.2251)
[I 2026-06-01 02:45:05,393] Trial 284 pruned. 
2026-06-01 02:45:05 | INFO | src.nested_cv_avggrm_weighted_unified | Trial 285 | outer=10 | alpha=1.120e+05 n_pcs=4000 (pc_topk) weight_search=on
2026-06-01 02:45:05 | INFO | src.nested_cv_avggrm_weighted_unified | Trial 285 | outer=10 | weight={'name': 'linear', 'floor': 1e-06, 'clip_max': None, 'min_weight': 0.10043748392254238, 'max_weight': 3.953655305665719}
2026-06-01 02:45:10 | INFO | src.nested_cv_avggrm_weighted_unified | Trial 285 | outer=10 | pruned after 8/10 inner folds (mean r=0.2700)
[I 2026-06-01 02:45:10,033] Trial 285 pruned. 
2026-06-01 02:45:10 | INFO | src.nested_cv_avggrm_weighted_unified | Trial 286 | outer=10 | alpha=6.536e+04 n_pcs=4000 (pc_topk) weight_search=on
2026-06-01 02:45:10 | INFO | src.nested_cv_avggrm_weighted_unified | Trial 286 | outer=10 | weight={'name': 'linear', 'floor': 1e-06, 'clip_max': None, 'min_weight': 0.06492172358912138, 'max_weight': 4.207502769678775}
2026-06-01 02:45:14 | INFO | src.nested_cv_avggrm_weighted_unified | Trial 286 | outer=10 | pruned after 8/10 inner folds (mean r=0.2653)
[I 2026-06-01 02:45:14,766] Trial 286 pruned. 
2026-06-01 02:45:14 | INFO | src.nested_cv_avggrm_weighted_unified | Trial 287 | outer=10 | alpha=9.049e+04 n_pcs=4000 (pc_topk) weight_search=on
2026-06-01 02:45:14 | INFO | src.nested_cv_avggrm_weighted_unified | Trial 287 | outer=10 | weight={'name': 'linear', 'floor': 1e-06, 'clip_max': None, 'min_weight': 0.12018403596566524, 'max_weight': 3.869881997923646}
2026-06-01 02:45:19 | INFO | src.nested_cv_avggrm_weighted_unified | Trial 287 | outer=10 | pruned after 8/10 inner folds (mean r=0.2686)
[I 2026-06-01 02:45:19,402] Trial 287 pruned. 
2026-06-01 02:45:19 | INFO | src.nested_cv_avggrm_weighted_unified | Trial 288 | outer=10 | alpha=1.689e+05 n_pcs=4000 (pc_topk) weight_search=on
2026-06-01 02:45:19 | INFO | src.nested_cv_avggrm_weighted_unified | Trial 288 | outer=10 | weight={'name': 'linear', 'floor': 1e-06, 'clip_max': 3.0, 'min_weight': 0.14983365582220426, 'max_weight': 4.0283635424857085}
2026-06-01 02:45:24 | INFO | src.nested_cv_avggrm_weighted_unified | Trial 288 | outer=10 | pruned after 8/10 inner folds (mean r=0.2700)
