[I 2026-06-01 00:31:36,913] Trial 176 finished with value: 0.25987885394655763 and parameters: {'alpha': 100114.30303648206, 'n_pcs': 4500, 'weight_scheme': 'exponential', 'weight_clip_max': 5.0, 'weight_exponential_beta': 7.8540111488916065}. Best is trial 140 with value: 0.25996359913458195.
2026-06-01 00:31:36 | INFO | src.nested_cv_avggrm_weighted_unified | Trial 177 | outer=5 | alpha=9.557e+04 n_pcs=4500 (pc_topk) weight_search=on
2026-06-01 00:31:36 | INFO | src.nested_cv_avggrm_weighted_unified | Trial 177 | outer=5 | weight={'name': 'exponential', 'floor': 1e-06, 'clip_max': 5.0, 'beta': 7.939254987980787}
[I 2026-06-01 00:31:43,588] Trial 177 finished with value: 0.2598856170281161 and parameters: {'alpha': 95571.89813015377, 'n_pcs': 4500, 'weight_scheme': 'exponential', 'weight_clip_max': 5.0, 'weight_exponential_beta': 7.939254987980787}. Best is trial 140 with value: 0.25996359913458195.
2026-06-01 00:31:43 | INFO | src.nested_cv_avggrm_weighted_unified | Trial 178 | outer=5 | alpha=6.671e+04 n_pcs=4500 (pc_topk) weight_search=on
2026-06-01 00:31:43 | INFO | src.nested_cv_avggrm_weighted_unified | Trial 178 | outer=5 | weight={'name': 'exponential', 'floor': 1e-06, 'clip_max': 5.0, 'beta': 7.957279835306112}
2026-06-01 00:31:48 | INFO | src.nested_cv_avggrm_weighted_unified | Trial 178 | outer=5 | pruned after 7/10 inner folds (mean r=0.2926)
[I 2026-06-01 00:31:48,256] Trial 178 pruned. 
2026-06-01 00:31:48 | INFO | src.nested_cv_avggrm_weighted_unified | Trial 179 | outer=5 | alpha=1.013e+03 n_pcs=5000 (pc_topk) weight_search=on
2026-06-01 00:31:48 | INFO | src.nested_cv_avggrm_weighted_unified | Trial 179 | outer=5 | weight={'name': 'exponential', 'floor': 1e-06, 'clip_max': 5.0, 'beta': 7.124358674029043}
2026-06-01 00:31:52 | INFO | src.nested_cv_avggrm_weighted_unified | Trial 179 | outer=5 | pruned after 5/10 inner folds (mean r=0.1904)
[I 2026-06-01 00:31:52,224] Trial 179 pruned. 
2026-06-01 00:31:52 | INFO | src.nested_cv_avggrm_weighted_unified | Trial 180 | outer=5 | alpha=9.191e+04 n_pcs=4500 (pc_topk) weight_search=on
2026-06-01 00:31:52 | INFO | src.nested_cv_avggrm_weighted_unified | Trial 180 | outer=5 | weight={'name': 'exponential', 'floor': 1e-06, 'clip_max': 5.0, 'beta': 8.203389283946525}
[I 2026-06-01 00:31:58,884] Trial 180 finished with value: 0.2598692244833468 and parameters: {'alpha': 91914.34430889349, 'n_pcs': 4500, 'weight_scheme': 'exponential', 'weight_clip_max': 5.0, 'weight_exponential_beta': 8.203389283946525}. Best is trial 140 with value: 0.25996359913458195.
2026-06-01 00:31:58 | INFO | src.nested_cv_avggrm_weighted_unified | Trial 181 | outer=5 | alpha=9.707e+04 n_pcs=4500 (pc_topk) weight_search=on
2026-06-01 00:31:58 | INFO | src.nested_cv_avggrm_weighted_unified | Trial 181 | outer=5 | weight={'name': 'exponential', 'floor': 1e-06, 'clip_max': 5.0, 'beta': 8.179927268588948}
[I 2026-06-01 00:32:05,543] Trial 181 finished with value: 0.259898645750345 and parameters: {'alpha': 97069.11092037041, 'n_pcs': 4500, 'weight_scheme': 'exponential', 'weight_clip_max': 5.0, 'weight_exponential_beta': 8.179927268588948}. Best is trial 140 with value: 0.25996359913458195.
2026-06-01 00:32:05 | INFO | src.nested_cv_avggrm_weighted_unified | Trial 182 | outer=5 | alpha=7.245e+04 n_pcs=4500 (pc_topk) weight_search=on
2026-06-01 00:32:05 | INFO | src.nested_cv_avggrm_weighted_unified | Trial 182 | outer=5 | weight={'name': 'exponential', 'floor': 1e-06, 'clip_max': 5.0, 'beta': 8.162823131482135}
2026-06-01 00:32:10 | INFO | src.nested_cv_avggrm_weighted_unified | Trial 182 | outer=5 | pruned after 7/10 inner folds (mean r=0.2930)
[I 2026-06-01 00:32:10,176] Trial 182 pruned. 
2026-06-01 00:32:10 | INFO | src.nested_cv_avggrm_weighted_unified | Trial 183 | outer=5 | alpha=9.752e+04 n_pcs=4500 (pc_topk) weight_search=on
2026-06-01 00:32:10 | INFO | src.nested_cv_avggrm_weighted_unified | Trial 183 | outer=5 | weight={'name': 'exponential', 'floor': 1e-06, 'clip_max': 5.0, 'beta': 7.886815755787121}
[I 2026-06-01 00:32:16,831] Trial 183 finished with value: 0.25988385841977363 and parameters: {'alpha': 97520.535709427, 'n_pcs': 4500, 'weight_scheme': 'exponential', 'weight_clip_max': 5.0, 'weight_exponential_beta': 7.886815755787121}. Best is trial 140 with value: 0.25996359913458195.
2026-06-01 00:32:16 | INFO | src.nested_cv_avggrm_weighted_unified | Trial 184 | outer=5 | alpha=5.454e+04 n_pcs=4500 (pc_topk) weight_search=on
2026-06-01 00:32:16 | INFO | src.nested_cv_avggrm_weighted_unified | Trial 184 | outer=5 | weight={'name': 'exponential', 'floor': 1e-06, 'clip_max': 5.0, 'beta': 7.858640344569221}
2026-06-01 00:32:21 | INFO | src.nested_cv_avggrm_weighted_unified | Trial 184 | outer=5 | pruned after 7/10 inner folds (mean r=0.2909)
[I 2026-06-01 00:32:21,511] Trial 184 pruned. 
2026-06-01 00:32:21 | INFO | src.nested_cv_avggrm_weighted_unified | Trial 185 | outer=5 | alpha=1.257e+05 n_pcs=4500 (pc_topk) weight_search=on
2026-06-01 00:32:21 | INFO | src.nested_cv_avggrm_weighted_unified | Trial 185 | outer=5 | weight={'name': 'uniform', 'floor': 1e-06, 'clip_max': 5.0}
2026-06-01 00:32:24 | INFO | src.nested_cv_avggrm_weighted_unified | Trial 185 | outer=5 | pruned after 5/10 inner folds (mean r=0.2323)
[I 2026-06-01 00:32:24,419] Trial 185 pruned. 
2026-06-01 00:32:24 | INFO | src.nested_cv_avggrm_weighted_unified | Trial 186 | outer=5 | alpha=9.751e+04 n_pcs=4500 (pc_topk) weight_search=on
2026-06-01 00:32:24 | INFO | src.nested_cv_avggrm_weighted_unified | Trial 186 | outer=5 | weight={'name': 'exponential', 'floor': 1e-06, 'clip_max': 5.0, 'beta': 8.290330018454256}
[I 2026-06-01 00:32:31,081] Trial 186 finished with value: 0.2598960921484732 and parameters: {'alpha': 97513.99881946867, 'n_pcs': 4500, 'weight_scheme': 'exponential', 'weight_clip_max': 5.0, 'weight_exponential_beta': 8.290330018454256}. Best is trial 140 with value: 0.25996359913458195.
2026-06-01 00:32:31 | INFO | src.nested_cv_avggrm_weighted_unified | Trial 187 | outer=5 | alpha=9.411e+04 n_pcs=4500 (pc_topk) weight_search=on
2026-06-01 00:32:31 | INFO | src.nested_cv_avggrm_weighted_unified | Trial 187 | outer=5 | weight={'name': 'exponential', 'floor': 1e-06, 'clip_max': 5.0, 'beta': 8.176022958632043}
[I 2026-06-01 00:32:37,746] Trial 187 finished with value: 0.25988553907047834 and parameters: {'alpha': 94114.80874343493, 'n_pcs': 4500, 'weight_scheme': 'exponential', 'weight_clip_max': 5.0, 'weight_exponential_beta': 8.176022958632043}. Best is trial 140 with value: 0.25996359913458195.
2026-06-01 00:32:37 | INFO | src.nested_cv_avggrm_weighted_unified | Trial 188 | outer=5 | alpha=9.500e+04 n_pcs=5000 (pc_topk) weight_search=on
2026-06-01 00:32:37 | INFO | src.nested_cv_avggrm_weighted_unified | Trial 188 | outer=5 | weight={'name': 'exponential', 'floor': 1e-06, 'clip_max': 5.0, 'beta': 8.19052586383772}
2026-06-01 00:32:43 | INFO | src.nested_cv_avggrm_weighted_unified | Trial 188 | outer=5 | pruned after 7/10 inner folds (mean r=0.2933)
[I 2026-06-01 00:32:43,280] Trial 188 pruned. 
2026-06-01 00:32:43 | INFO | src.nested_cv_avggrm_weighted_unified | Trial 189 | outer=5 | alpha=7.275e+04 n_pcs=4500 (pc_topk) weight_search=on
2026-06-01 00:32:43 | INFO | src.nested_cv_avggrm_weighted_unified | Trial 189 | outer=5 | weight={'name': 'exponential', 'floor': 1e-06, 'clip_max': None, 'beta': 7.983144326115004}
[I 2026-06-01 00:32:49,921] Trial 189 finished with value: 0.2543754655437598 and parameters: {'alpha': 72750.18538877589, 'n_pcs': 4500, 'weight_scheme': 'exponential', 'weight_clip_max': None, 'weight_exponential_beta': 7.983144326115004}. Best is trial 140 with value: 0.25996359913458195.
2026-06-01 00:32:49 | INFO | src.nested_cv_avggrm_weighted_unified | Trial 190 | outer=5 | alpha=9.457e+04 n_pcs=4500 (pc_topk) weight_search=on
2026-06-01 00:32:49 | INFO | src.nested_cv_avggrm_weighted_unified | Trial 190 | outer=5 | weight={'name': 'exponential', 'floor': 1e-06, 'clip_max': 5.0, 'beta': 8.519420482365561}
[I 2026-06-01 00:32:56,593] Trial 190 finished with value: 0.2598515813251795 and parameters: {'alpha': 94569.05502523389, 'n_pcs': 4500, 'weight_scheme': 'exponential', 'weight_clip_max': 5.0, 'weight_exponential_beta': 8.519420482365561}. Best is trial 140 with value: 0.25996359913458195.
2026-06-01 00:32:56 | INFO | src.nested_cv_avggrm_weighted_unified | Trial 191 | outer=5 | alpha=9.506e+04 n_pcs=4500 (pc_topk) weight_search=on
2026-06-01 00:32:56 | INFO | src.nested_cv_avggrm_weighted_unified | Trial 191 | outer=5 | weight={'name': 'exponential', 'floor': 1e-06, 'clip_max': 5.0, 'beta': 8.620655697978602}
[I 2026-06-01 00:33:03,259] Trial 191 finished with value: 0.25983503274054087 and parameters: {'alpha': 95059.54080269323, 'n_pcs': 4500, 'weight_scheme': 'exponential', 'weight_clip_max': 5.0, 'weight_exponential_beta': 8.620655697978602}. Best is trial 140 with value: 0.25996359913458195.
2026-06-01 00:33:03 | INFO | src.nested_cv_avggrm_weighted_unified | Trial 192 | outer=5 | alpha=9.382e+04 n_pcs=4500 (pc_topk) weight_search=on
2026-06-01 00:33:03 | INFO | src.nested_cv_avggrm_weighted_unified | Trial 192 | outer=5 | weight={'name': 'exponential', 'floor': 1e-06, 'clip_max': 5.0, 'beta': 8.623251139528712}
[I 2026-06-01 00:33:09,929] Trial 192 finished with value: 0.2598238289490102 and parameters: {'alpha': 93824.80395768644, 'n_pcs': 4500, 'weight_scheme': 'exponential', 'weight_clip_max': 5.0, 'weight_exponential_beta': 8.623251139528712}. Best is trial 140 with value: 0.25996359913458195.
2026-06-01 00:33:09 | INFO | src.nested_cv_avggrm_weighted_unified | Trial 193 | outer=5 | alpha=1.004e+05 n_pcs=4500 (pc_topk) weight_search=on
2026-06-01 00:33:09 | INFO | src.nested_cv_avggrm_weighted_unified | Trial 193 | outer=5 | weight={'name': 'exponential', 'floor': 1e-06, 'clip_max': 5.0, 'beta': 8.6505883390909}
[I 2026-06-01 00:33:16,589] Trial 193 finished with value: 0.2598612676711819 and parameters: {'alpha': 100388.86390664443, 'n_pcs': 4500, 'weight_scheme': 'exponential', 'weight_clip_max': 5.0, 'weight_exponential_beta': 8.6505883390909}. Best is trial 140 with value: 0.25996359913458195.
2026-06-01 00:33:16 | INFO | src.nested_cv_avggrm_weighted_unified | Trial 194 | outer=5 | alpha=6.221e+04 n_pcs=4500 (pc_topk) weight_search=on
2026-06-01 00:33:16 | INFO | src.nested_cv_avggrm_weighted_unified | Trial 194 | outer=5 | weight={'name': 'exponential', 'floor': 1e-06, 'clip_max': 5.0, 'beta': 8.619590923397737}
2026-06-01 00:33:21 | INFO | src.nested_cv_avggrm_weighted_unified | Trial 194 | outer=5 | pruned after 7/10 inner folds (mean r=0.2915)
[I 2026-06-01 00:33:21,258] Trial 194 pruned. 
2026-06-01 00:33:21 | INFO | src.nested_cv_avggrm_weighted_unified | Trial 195 | outer=5 | alpha=7.338e+04 n_pcs=4500 (pc_topk) weight_search=on
2026-06-01 00:33:21 | INFO | src.nested_cv_avggrm_weighted_unified | Trial 195 | outer=5 | weight={'name': 'exponential', 'floor': 1e-06, 'clip_max': 5.0, 'beta': 8.538743381680673}
2026-06-01 00:33:25 | INFO | src.nested_cv_avggrm_weighted_unified | Trial 195 | outer=5 | pruned after 7/10 inner folds (mean r=0.2928)
[I 2026-06-01 00:33:25,924] Trial 195 pruned. 
2026-06-01 00:33:25 | INFO | src.nested_cv_avggrm_weighted_unified | Trial 196 | outer=5 | alpha=9.537e+04 n_pcs=4500 (pc_topk) weight_search=on
2026-06-01 00:33:25 | INFO | src.nested_cv_avggrm_weighted_unified | Trial 196 | outer=5 | weight={'name': 'exponential', 'floor': 1e-06, 'clip_max': 5.0, 'beta': 8.749405433449164}
2026-06-01 00:33:30 | INFO | src.nested_cv_avggrm_weighted_unified | Trial 196 | outer=5 | pruned after 7/10 inner folds (mean r=0.2941)
[I 2026-06-01 00:33:30,589] Trial 196 pruned. 
2026-06-01 00:33:30 | INFO | src.nested_cv_avggrm_weighted_unified | Trial 197 | outer=5 | alpha=4.894e+04 n_pcs=4500 (pc_topk) weight_search=on
2026-06-01 00:33:30 | INFO | src.nested_cv_avggrm_weighted_unified | Trial 197 | outer=5 | weight={'name': 'linear', 'floor': 1e-06, 'clip_max': 5.0, 'min_weight': 0.8290048219050374, 'max_weight': 1.651084518495587}
2026-06-01 00:33:35 | INFO | src.nested_cv_avggrm_weighted_unified | Trial 197 | outer=5 | pruned after 7/10 inner folds (mean r=0.2785)
[I 2026-06-01 00:33:35,232] Trial 197 pruned. 
2026-06-01 00:33:35 | INFO | src.nested_cv_avggrm_weighted_unified | Trial 198 | outer=5 | alpha=1.328e+05 n_pcs=5000 (pc_topk) weight_search=on
2026-06-01 00:33:35 | INFO | src.nested_cv_avggrm_weighted_unified | Trial 198 | outer=5 | weight={'name': 'exponential', 'floor': 1e-06, 'clip_max': 5.0, 'beta': 8.355955341551875}
2026-06-01 00:33:40 | INFO | src.nested_cv_avggrm_weighted_unified | Trial 198 | outer=5 | pruned after 7/10 inner folds (mean r=0.2939)
[I 2026-06-01 00:33:40,772] Trial 198 pruned. 
2026-06-01 00:33:40 | INFO | src.nested_cv_avggrm_weighted_unified | Trial 199 | outer=5 | alpha=1.045e+05 n_pcs=4500 (pc_topk) weight_search=on
2026-06-01 00:33:40 | INFO | src.nested_cv_avggrm_weighted_unified | Trial 199 | outer=5 | weight={'name': 'exponential', 'floor': 1e-06, 'clip_max': 5.0, 'beta': 8.148055675085532}
[I 2026-06-01 00:33:47,468] Trial 199 finished with value: 0.25990296371822574 and parameters: {'alpha': 104532.39261671757, 'n_pcs': 4500, 'weight_scheme': 'exponential', 'weight_clip_max': 5.0, 'weight_exponential_beta': 8.148055675085532}. Best is trial 140 with value: 0.25996359913458195.
2026-06-01 00:33:47 | INFO | src.nested_cv_avggrm_weighted_unified | Trial 200 | outer=5 | alpha=1.296e+05 n_pcs=4500 (pc_topk) weight_search=on
2026-06-01 00:33:47 | INFO | src.nested_cv_avggrm_weighted_unified | Trial 200 | outer=5 | weight={'name': 'exponential', 'floor': 1e-06, 'clip_max': 10.0, 'beta': 8.119539897936233}
[I 2026-06-01 00:33:54,116] Trial 200 finished with value: 0.25867888474532974 and parameters: {'alpha': 129595.0055973985, 'n_pcs': 4500, 'weight_scheme': 'exponential', 'weight_clip_max': 10.0, 'weight_exponential_beta': 8.119539897936233}. Best is trial 140 with value: 0.25996359913458195.
2026-06-01 00:33:54 | INFO | src.nested_cv_avggrm_weighted_unified | Trial 201 | outer=5 | alpha=1.020e+05 n_pcs=4500 (pc_topk) weight_search=on
2026-06-01 00:33:54 | INFO | src.nested_cv_avggrm_weighted_unified | Trial 201 | outer=5 | weight={'name': 'exponential', 'floor': 1e-06, 'clip_max': 5.0, 'beta': 8.274206363177882}
[I 2026-06-01 00:34:00,760] Trial 201 finished with value: 0.25990630038502677 and parameters: {'alpha': 101972.59010268435, 'n_pcs': 4500, 'weight_scheme': 'exponential', 'weight_clip_max': 5.0, 'weight_exponential_beta': 8.274206363177882}. Best is trial 140 with value: 0.25996359913458195.
2026-06-01 00:34:00 | INFO | src.nested_cv_avggrm_weighted_unified | Trial 202 | outer=5 | alpha=9.972e+04 n_pcs=4500 (pc_topk) weight_search=on
2026-06-01 00:34:00 | INFO | src.nested_cv_avggrm_weighted_unified | Trial 202 | outer=5 | weight={'name': 'exponential', 'floor': 1e-06, 'clip_max': 5.0, 'beta': 8.283247484130728}
[I 2026-06-01 00:34:07,410] Trial 202 finished with value: 0.2599029705406731 and parameters: {'alpha': 99720.64383556065, 'n_pcs': 4500, 'weight_scheme': 'exponential', 'weight_clip_max': 5.0, 'weight_exponential_beta': 8.283247484130728}. Best is trial 140 with value: 0.25996359913458195.
2026-06-01 00:34:07 | INFO | src.nested_cv_avggrm_weighted_unified | Trial 203 | outer=5 | alpha=7.122e+04 n_pcs=4500 (pc_topk) weight_search=on
2026-06-01 00:34:07 | INFO | src.nested_cv_avggrm_weighted_unified | Trial 203 | outer=5 | weight={'name': 'exponential', 'floor': 1e-06, 'clip_max': 5.0, 'beta': 8.2699795193964}
2026-06-01 00:34:12 | INFO | src.nested_cv_avggrm_weighted_unified | Trial 203 | outer=5 | pruned after 7/10 inner folds (mean r=0.2928)
[I 2026-06-01 00:34:12,070] Trial 203 pruned. 
2026-06-01 00:34:12 | INFO | src.nested_cv_avggrm_weighted_unified | Trial 204 | outer=5 | alpha=1.229e+05 n_pcs=4500 (pc_topk) weight_search=on
2026-06-01 00:34:12 | INFO | src.nested_cv_avggrm_weighted_unified | Trial 204 | outer=5 | weight={'name': 'exponential', 'floor': 1e-06, 'clip_max': 5.0, 'beta': 8.500663234320218}
[I 2026-06-01 00:34:18,723] Trial 204 finished with value: 0.2598145826800677 and parameters: {'alpha': 122859.08280245388, 'n_pcs': 4500, 'weight_scheme': 'exponential', 'weight_clip_max': 5.0, 'weight_exponential_beta': 8.500663234320218}. Best is trial 140 with value: 0.25996359913458195.
2026-06-01 00:34:18 | INFO | src.nested_cv_avggrm_weighted_unified | Trial 205 | outer=5 | alpha=9.831e+04 n_pcs=4500 (pc_topk) weight_search=on
2026-06-01 00:34:18 | INFO | src.nested_cv_avggrm_weighted_unified | Trial 205 | outer=5 | weight={'name': 'exponential', 'floor': 1e-06, 'clip_max': 5.0, 'beta': 8.265703028126557}
[I 2026-06-01 00:34:25,448] Trial 205 finished with value: 0.25989999558927657 and parameters: {'alpha': 98305.2538353258, 'n_pcs': 4500, 'weight_scheme': 'exponential', 'weight_clip_max': 5.0, 'weight_exponential_beta': 8.265703028126557}. Best is trial 140 with value: 0.25996359913458195.
2026-06-01 00:34:25 | INFO | src.nested_cv_avggrm_weighted_unified | Trial 206 | outer=5 | alpha=1.060e+05 n_pcs=4500 (pc_topk) weight_search=on
2026-06-01 00:34:25 | INFO | src.nested_cv_avggrm_weighted_unified | Trial 206 | outer=5 | weight={'name': 'exponential', 'floor': 1e-06, 'clip_max': 5.0, 'beta': 8.24285629054885}
[I 2026-06-01 00:34:32,100] Trial 206 finished with value: 0.25990298896829495 and parameters: {'alpha': 106019.176662526, 'n_pcs': 4500, 'weight_scheme': 'exponential', 'weight_clip_max': 5.0, 'weight_exponential_beta': 8.24285629054885}. Best is trial 140 with value: 0.25996359913458195.
2026-06-01 00:34:32 | INFO | src.nested_cv_avggrm_weighted_unified | Trial 207 | outer=5 | alpha=1.143e+05 n_pcs=4500 (pc_topk) weight_search=on
2026-06-01 00:34:32 | INFO | src.nested_cv_avggrm_weighted_unified | Trial 207 | outer=5 | weight={'name': 'exponential', 'floor': 1e-06, 'clip_max': 5.0, 'beta': 8.180902068718243}
[I 2026-06-01 00:34:39,196] Trial 207 finished with value: 0.2598619257444136 and parameters: {'alpha': 114334.89695550161, 'n_pcs': 4500, 'weight_scheme': 'exponential', 'weight_clip_max': 5.0, 'weight_exponential_beta': 8.180902068718243}. Best is trial 140 with value: 0.25996359913458195.
2026-06-01 00:34:39 | INFO | src.nested_cv_avggrm_weighted_unified | Trial 208 | outer=5 | alpha=1.246e+05 n_pcs=5000 (pc_topk) weight_search=on
2026-06-01 00:34:39 | INFO | src.nested_cv_avggrm_weighted_unified | Trial 208 | outer=5 | weight={'name': 'exponential', 'floor': 1e-06, 'clip_max': 5.0, 'beta': 8.23287554052047}
2026-06-01 00:34:44 | INFO | src.nested_cv_avggrm_weighted_unified | Trial 208 | outer=5 | pruned after 7/10 inner folds (mean r=0.2939)
[I 2026-06-01 00:34:44,728] Trial 208 pruned. 
2026-06-01 00:34:44 | INFO | src.nested_cv_avggrm_weighted_unified | Trial 209 | outer=5 | alpha=1.123e+05 n_pcs=4500 (pc_topk) weight_search=on
2026-06-01 00:34:44 | INFO | src.nested_cv_avggrm_weighted_unified | Trial 209 | outer=5 | weight={'name': 'exponential', 'floor': 1e-06, 'clip_max': 5.0, 'beta': 8.133651905799452}
[I 2026-06-01 00:34:51,375] Trial 209 finished with value: 0.25987032615686134 and parameters: {'alpha': 112266.28530632901, 'n_pcs': 4500, 'weight_scheme': 'exponential', 'weight_clip_max': 5.0, 'weight_exponential_beta': 8.133651905799452}. Best is trial 140 with value: 0.25996359913458195.
2026-06-01 00:34:51 | INFO | src.nested_cv_avggrm_weighted_unified | Trial 210 | outer=5 | alpha=1.141e+05 n_pcs=4500 (pc_topk) weight_search=on
2026-06-01 00:34:51 | INFO | src.nested_cv_avggrm_weighted_unified | Trial 210 | outer=5 | weight={'name': 'exponential', 'floor': 1e-06, 'clip_max': 5.0, 'beta': 7.985197915270749}
[I 2026-06-01 00:34:58,057] Trial 210 finished with value: 0.2598331073908861 and parameters: {'alpha': 114134.92496232783, 'n_pcs': 4500, 'weight_scheme': 'exponential', 'weight_clip_max': 5.0, 'weight_exponential_beta': 7.985197915270749}. Best is trial 140 with value: 0.25996359913458195.
2026-06-01 00:34:58 | INFO | src.nested_cv_avggrm_weighted_unified | Trial 211 | outer=5 | alpha=7.820e+04 n_pcs=4500 (pc_topk) weight_search=on
2026-06-01 00:34:58 | INFO | src.nested_cv_avggrm_weighted_unified | Trial 211 | outer=5 | weight={'name': 'exponential', 'floor': 1e-06, 'clip_max': 5.0, 'beta': 8.322281832846631}
2026-06-01 00:35:02 | INFO | src.nested_cv_avggrm_weighted_unified | Trial 211 | outer=5 | pruned after 7/10 inner folds (mean r=0.2934)
[I 2026-06-01 00:35:02,719] Trial 211 pruned. 
2026-06-01 00:35:02 | INFO | src.nested_cv_avggrm_weighted_unified | Trial 212 | outer=5 | alpha=1.078e+05 n_pcs=4500 (pc_topk) weight_search=on
2026-06-01 00:35:02 | INFO | src.nested_cv_avggrm_weighted_unified | Trial 212 | outer=5 | weight={'name': 'exponential', 'floor': 1e-06, 'clip_max': 5.0, 'beta': 8.101897687748213}
[I 2026-06-01 00:35:09,379] Trial 212 finished with value: 0.25988925203248237 and parameters: {'alpha': 107766.8461019525, 'n_pcs': 4500, 'weight_scheme': 'exponential', 'weight_clip_max': 5.0, 'weight_exponential_beta': 8.101897687748213}. Best is trial 140 with value: 0.25996359913458195.
2026-06-01 00:35:09 | INFO | src.nested_cv_avggrm_weighted_unified | Trial 213 | outer=5 | alpha=1.338e+05 n_pcs=1500 (pc_topk) weight_search=on
2026-06-01 00:35:09 | INFO | src.nested_cv_avggrm_weighted_unified | Trial 213 | outer=5 | weight={'name': 'exponential', 'floor': 1e-06, 'clip_max': 5.0, 'beta': 8.146956305897886}
2026-06-01 00:35:11 | INFO | src.nested_cv_avggrm_weighted_unified | Trial 213 | outer=5 | pruned after 6/10 inner folds (mean r=0.2631)
[I 2026-06-01 00:35:11,813] Trial 213 pruned. 
2026-06-01 00:35:11 | INFO | src.nested_cv_avggrm_weighted_unified | Trial 214 | outer=5 | alpha=1.127e+05 n_pcs=4500 (pc_topk) weight_search=on
2026-06-01 00:35:11 | INFO | src.nested_cv_avggrm_weighted_unified | Trial 214 | outer=5 | weight={'name': 'exponential', 'floor': 1e-06, 'clip_max': 5.0, 'beta': 8.082904050046656}
