[I 2026-06-01 18:24:36,973] Trial 2 finished with value: 0.21932950097205742 and parameters: {'alpha': 143482.76912965564, 'n_pcs': 1500, 'iw_method': 'uniform'}. Best is trial 1 with value: 0.24144309420148774.
2026-06-01 18:24:36 | INFO | Trial 3 | outer=5 | alpha=1.431e+05 n_pcs=500 (pc_topk) weight={'name': 'uniform'}
[I 2026-06-01 18:24:38,276] Trial 3 finished with value: 0.18588602076478428 and parameters: {'alpha': 143072.2464444983, 'n_pcs': 500, 'iw_method': 'uniform'}. Best is trial 1 with value: 0.24144309420148774.
2026-06-01 18:24:38 | INFO | Trial 4 | outer=5 | alpha=5.373e+06 n_pcs=2000 (pc_topk) weight={'name': 'pc_logistic', 'floor': 1e-06, 'clip_max': 1.5, 'prob_clip': 0.001637400317167702, 'n_components': 80, 'logistic_c': 0.09386700500068379, 'pca_fit': 'combined', 'solver': 'lbfgs', 'max_iter': 2000, 'fit_intercept': True, 'standardize_with_source': True, 'rho': 1.0}
[I 2026-06-01 18:25:00,769] Trial 4 finished with value: 0.2165886286631525 and parameters: {'alpha': 5373167.4046281455, 'n_pcs': 2000, 'iw_method': 'pc_logistic', 'iw_clip_max': 1.5, 'iw_prob_clip': 0.001637400317167702, 'iw_n_components': 80, 'iw_logistic_c': 0.09386700500068379, 'iw_pca_fit': 'combined', 'iw_solver': 'lbfgs', 'iw_rho': 1.0}. Best is trial 1 with value: 0.24144309420148774.
2026-06-01 18:25:00 | INFO | Trial 5 | outer=5 | alpha=6.435e+04 n_pcs=1000 (pc_topk) weight={'name': 'pc_logistic', 'floor': 1e-06, 'clip_max': 7.0, 'prob_clip': 0.004193356127903791, 'n_components': 20, 'logistic_c': 9.236417519010976, 'pca_fit': 'combined', 'solver': 'lbfgs', 'max_iter': 2000, 'fit_intercept': True, 'standardize_with_source': True, 'rho': 1.0}
2026-06-01 18:25:13 | INFO | Trial 5 rejected by ESS guard: mean_ess=784.57 threshold=959.38
[I 2026-06-01 18:25:13,313] Trial 5 finished with value: -1.0 and parameters: {'alpha': 64350.09539177312, 'n_pcs': 1000, 'iw_method': 'pc_logistic', 'iw_clip_max': 7.0, 'iw_prob_clip': 0.004193356127903791, 'iw_n_components': 20, 'iw_logistic_c': 9.236417519010976, 'iw_pca_fit': 'combined', 'iw_solver': 'lbfgs', 'iw_rho': 1.0}. Best is trial 1 with value: 0.24144309420148774.
2026-06-01 18:25:13 | INFO | Trial 6 | outer=5 | alpha=3.046e+05 n_pcs=3500 (pc_topk) weight={'name': 'pc_logistic', 'floor': 1e-06, 'clip_max': 12.0, 'prob_clip': 0.0007016380040663315, 'n_components': 80, 'logistic_c': 0.00021908930989278453, 'pca_fit': 'combined', 'solver': 'lbfgs', 'max_iter': 2000, 'fit_intercept': True, 'standardize_with_source': True, 'rho': 0.7}
[I 2026-06-01 18:25:26,485] Trial 6 finished with value: 0.23956124970701426 and parameters: {'alpha': 304631.0485153137, 'n_pcs': 3500, 'iw_method': 'pc_logistic', 'iw_clip_max': 12.0, 'iw_prob_clip': 0.0007016380040663315, 'iw_n_components': 80, 'iw_logistic_c': 0.00021908930989278453, 'iw_pca_fit': 'combined', 'iw_solver': 'lbfgs', 'iw_rho': 0.7}. Best is trial 1 with value: 0.24144309420148774.
2026-06-01 18:25:26 | INFO | Trial 7 | outer=5 | alpha=7.213e+06 n_pcs=500 (pc_topk) weight={'name': 'uniform'}
[I 2026-06-01 18:25:27,244] Trial 7 finished with value: 0.17395559195630506 and parameters: {'alpha': 7213019.60957054, 'n_pcs': 500, 'iw_method': 'uniform'}. Best is trial 1 with value: 0.24144309420148774.
2026-06-01 18:25:27 | INFO | Trial 8 | outer=5 | alpha=2.347e+03 n_pcs=3000 (pc_topk) weight={'name': 'pc_logistic', 'floor': 1e-06, 'clip_max': 2.5, 'prob_clip': 0.017782866059784724, 'n_components': 60, 'logistic_c': 4.584813955429537e-07, 'pca_fit': 'combined', 'solver': 'lbfgs', 'max_iter': 2000, 'fit_intercept': True, 'standardize_with_source': True, 'rho': 0.3}
[I 2026-06-01 18:25:36,457] Trial 8 finished with value: 0.16137198988299767 and parameters: {'alpha': 2346.6230871488538, 'n_pcs': 3000, 'iw_method': 'pc_logistic', 'iw_clip_max': 2.5, 'iw_prob_clip': 0.017782866059784724, 'iw_n_components': 60, 'iw_logistic_c': 4.584813955429537e-07, 'iw_pca_fit': 'combined', 'iw_solver': 'lbfgs', 'iw_rho': 0.3}. Best is trial 1 with value: 0.24144309420148774.
2026-06-01 18:25:36 | INFO | Trial 9 | outer=5 | alpha=1.067e+03 n_pcs=4000 (pc_topk) weight={'name': 'pc_logistic', 'floor': 1e-06, 'clip_max': 4.0, 'prob_clip': 0.003002704300062754, 'n_components': 10, 'logistic_c': 4.32601466983518e-06, 'pca_fit': 'combined', 'solver': 'lbfgs', 'max_iter': 2000, 'fit_intercept': True, 'standardize_with_source': True, 'rho': 1.0}
[I 2026-06-01 18:25:49,049] Trial 9 finished with value: 0.13307141805875927 and parameters: {'alpha': 1067.2105048492429, 'n_pcs': 4000, 'iw_method': 'pc_logistic', 'iw_clip_max': 4.0, 'iw_prob_clip': 0.003002704300062754, 'iw_n_components': 10, 'iw_logistic_c': 4.32601466983518e-06, 'iw_pca_fit': 'combined', 'iw_solver': 'lbfgs', 'iw_rho': 1.0}. Best is trial 1 with value: 0.24144309420148774.
2026-06-01 18:25:49 | INFO | Trial 10 | outer=5 | alpha=1.150e+04 n_pcs=5000 (pc_topk) weight={'name': 'uniform'}
[I 2026-06-01 18:26:00,057] Trial 10 finished with value: 0.2380947760150034 and parameters: {'alpha': 11501.099698953694, 'n_pcs': 5000, 'iw_method': 'uniform'}. Best is trial 1 with value: 0.24144309420148774.
2026-06-01 18:26:00 | INFO | Trial 11 | outer=5 | alpha=1.199e+06 n_pcs=5000 (pc_topk) weight={'name': 'pc_logistic', 'floor': 1e-06, 'clip_max': 12.0, 'prob_clip': 0.0007158490266448297, 'n_components': 80, 'logistic_c': 0.00047345791522711923, 'pca_fit': 'combined', 'solver': 'lbfgs', 'max_iter': 2000, 'fit_intercept': True, 'standardize_with_source': True, 'rho': 0.7}
[I 2026-06-01 18:26:34,917] Trial 11 finished with value: 0.2249543512714805 and parameters: {'alpha': 1199098.4863751335, 'n_pcs': 5000, 'iw_method': 'pc_logistic', 'iw_clip_max': 12.0, 'iw_prob_clip': 0.0007158490266448297, 'iw_n_components': 80, 'iw_logistic_c': 0.00047345791522711923, 'iw_pca_fit': 'combined', 'iw_solver': 'lbfgs', 'iw_rho': 0.7}. Best is trial 1 with value: 0.24144309420148774.
2026-06-01 18:26:34 | INFO | Trial 12 | outer=5 | alpha=1.651e+04 n_pcs=3500 (pc_topk) weight={'name': 'pc_logistic', 'floor': 1e-06, 'clip_max': 12.0, 'prob_clip': 0.0005593063313063697, 'n_components': 100, 'logistic_c': 0.00045106102832414717, 'pca_fit': 'combined', 'solver': 'lbfgs', 'max_iter': 2000, 'fit_intercept': True, 'standardize_with_source': True, 'rho': 0.5}
[I 2026-06-01 18:26:49,039] Trial 12 finished with value: 0.232856519360783 and parameters: {'alpha': 16513.01867784095, 'n_pcs': 3500, 'iw_method': 'pc_logistic', 'iw_clip_max': 12.0, 'iw_prob_clip': 0.0005593063313063697, 'iw_n_components': 100, 'iw_logistic_c': 0.00045106102832414717, 'iw_pca_fit': 'combined', 'iw_solver': 'lbfgs', 'iw_rho': 0.5}. Best is trial 1 with value: 0.24144309420148774.
2026-06-01 18:26:49 | INFO | Trial 13 | outer=5 | alpha=7.725e+05 n_pcs=2500 (pc_topk) weight={'name': 'uniform'}
[I 2026-06-01 18:26:53,386] Trial 13 finished with value: 0.21012740425029003 and parameters: {'alpha': 772521.7668112898, 'n_pcs': 2500, 'iw_method': 'uniform'}. Best is trial 1 with value: 0.24144309420148774.
2026-06-01 18:26:53 | INFO | Trial 14 | outer=5 | alpha=1.792e+04 n_pcs=4500 (pc_topk) weight={'name': 'pc_logistic', 'floor': 1e-06, 'clip_max': 12.0, 'prob_clip': 0.01473817737520998, 'n_components': 40, 'logistic_c': 3.191202215750811e-05, 'pca_fit': 'combined', 'solver': 'lbfgs', 'max_iter': 2000, 'fit_intercept': True, 'standardize_with_source': True, 'rho': 0.7}
[I 2026-06-01 18:27:07,903] Trial 14 finished with value: 0.25042450584820275 and parameters: {'alpha': 17920.618967560844, 'n_pcs': 4500, 'iw_method': 'pc_logistic', 'iw_clip_max': 12.0, 'iw_prob_clip': 0.01473817737520998, 'iw_n_components': 40, 'iw_logistic_c': 3.191202215750811e-05, 'iw_pca_fit': 'combined', 'iw_solver': 'lbfgs', 'iw_rho': 0.7}. Best is trial 14 with value: 0.25042450584820275.
2026-06-01 18:27:07 | INFO | Trial 15 | outer=5 | alpha=1.723e+04 n_pcs=4500 (pc_topk) weight={'name': 'uniform'}
[I 2026-06-01 18:27:19,578] Trial 15 finished with value: 0.24238763461235596 and parameters: {'alpha': 17228.29982979997, 'n_pcs': 4500, 'iw_method': 'uniform'}. Best is trial 14 with value: 0.25042450584820275.
2026-06-01 18:27:19 | INFO | Trial 16 | outer=5 | alpha=5.637e+03 n_pcs=4500 (pc_topk) weight={'name': 'uniform'}
[I 2026-06-01 18:27:28,215] Trial 16 finished with value: 0.2223801275445687 and parameters: {'alpha': 5636.553639398155, 'n_pcs': 4500, 'iw_method': 'uniform'}. Best is trial 14 with value: 0.25042450584820275.
2026-06-01 18:27:28 | INFO | Trial 17 | outer=5 | alpha=3.641e+04 n_pcs=4000 (pc_topk) weight={'name': 'pc_logistic', 'floor': 1e-06, 'clip_max': 7.0, 'prob_clip': 0.03337712720521348, 'n_components': 40, 'logistic_c': 8.281683443089995e-06, 'pca_fit': 'combined', 'solver': 'lbfgs', 'max_iter': 2000, 'fit_intercept': True, 'standardize_with_source': True, 'rho': 0.85}
[I 2026-06-01 18:27:45,756] Trial 17 finished with value: 0.2523770525022446 and parameters: {'alpha': 36411.74696869292, 'n_pcs': 4000, 'iw_method': 'pc_logistic', 'iw_clip_max': 7.0, 'iw_prob_clip': 0.03337712720521348, 'iw_n_components': 40, 'iw_logistic_c': 8.281683443089995e-06, 'iw_pca_fit': 'combined', 'iw_solver': 'lbfgs', 'iw_rho': 0.85}. Best is trial 17 with value: 0.2523770525022446.
2026-06-01 18:27:45 | INFO | Trial 18 | outer=5 | alpha=4.128e+04 n_pcs=3000 (pc_topk) weight={'name': 'pc_logistic', 'floor': 1e-06, 'clip_max': 7.0, 'prob_clip': 0.042441587678024965, 'n_components': 40, 'logistic_c': 1.386563881518709e-05, 'pca_fit': 'combined', 'solver': 'lbfgs', 'max_iter': 2000, 'fit_intercept': True, 'standardize_with_source': True, 'rho': 0.85}
[I 2026-06-01 18:28:02,538] Trial 18 finished with value: 0.2488948976737026 and parameters: {'alpha': 41275.644714677655, 'n_pcs': 3000, 'iw_method': 'pc_logistic', 'iw_clip_max': 7.0, 'iw_prob_clip': 0.042441587678024965, 'iw_n_components': 40, 'iw_logistic_c': 1.386563881518709e-05, 'iw_pca_fit': 'combined', 'iw_solver': 'lbfgs', 'iw_rho': 0.85}. Best is trial 17 with value: 0.2523770525022446.
2026-06-01 18:28:02 | INFO | Trial 19 | outer=5 | alpha=5.106e+03 n_pcs=4000 (pc_topk) weight={'name': 'pc_logistic', 'floor': 1e-06, 'clip_max': 7.0, 'prob_clip': 0.014526263976174323, 'n_components': 40, 'logistic_c': 2.746050909780874e-07, 'pca_fit': 'combined', 'solver': 'lbfgs', 'max_iter': 2000, 'fit_intercept': True, 'standardize_with_source': True, 'rho': 0.85}
[I 2026-06-01 18:28:14,217] Trial 19 finished with value: 0.20818968153696135 and parameters: {'alpha': 5105.564542116895, 'n_pcs': 4000, 'iw_method': 'pc_logistic', 'iw_clip_max': 7.0, 'iw_prob_clip': 0.014526263976174323, 'iw_n_components': 40, 'iw_logistic_c': 2.746050909780874e-07, 'iw_pca_fit': 'combined', 'iw_solver': 'lbfgs', 'iw_rho': 0.85}. Best is trial 17 with value: 0.2523770525022446.
2026-06-01 18:28:14 | INFO | Trial 20 | outer=5 | alpha=4.090e+04 n_pcs=3500 (pc_topk) weight={'name': 'pc_logistic', 'floor': 1e-06, 'clip_max': 2.5, 'prob_clip': 0.014007859203797862, 'n_components': 40, 'logistic_c': 2.059131840020274e-05, 'pca_fit': 'combined', 'solver': 'lbfgs', 'max_iter': 2000, 'fit_intercept': True, 'standardize_with_source': True, 'rho': 0.7}
[I 2026-06-01 18:28:24,810] Trial 20 finished with value: 0.24876917099105605 and parameters: {'alpha': 40902.90362787918, 'n_pcs': 3500, 'iw_method': 'pc_logistic', 'iw_clip_max': 2.5, 'iw_prob_clip': 0.014007859203797862, 'iw_n_components': 40, 'iw_logistic_c': 2.059131840020274e-05, 'iw_pca_fit': 'combined', 'iw_solver': 'lbfgs', 'iw_rho': 0.7}. Best is trial 17 with value: 0.2523770525022446.
2026-06-01 18:28:24 | INFO | Trial 21 | outer=5 | alpha=3.770e+04 n_pcs=3000 (pc_topk) weight={'name': 'pc_logistic', 'floor': 1e-06, 'clip_max': 7.0, 'prob_clip': 0.04339768920957333, 'n_components': 40, 'logistic_c': 1.2820571545745006e-05, 'pca_fit': 'combined', 'solver': 'lbfgs', 'max_iter': 2000, 'fit_intercept': True, 'standardize_with_source': True, 'rho': 0.85}
[I 2026-06-01 18:28:43,626] Trial 21 finished with value: 0.24779881011650925 and parameters: {'alpha': 37698.71320060063, 'n_pcs': 3000, 'iw_method': 'pc_logistic', 'iw_clip_max': 7.0, 'iw_prob_clip': 0.04339768920957333, 'iw_n_components': 40, 'iw_logistic_c': 1.2820571545745006e-05, 'iw_pca_fit': 'combined', 'iw_solver': 'lbfgs', 'iw_rho': 0.85}. Best is trial 17 with value: 0.2523770525022446.
2026-06-01 18:28:43 | INFO | Trial 22 | outer=5 | alpha=3.694e+04 n_pcs=2500 (pc_topk) weight={'name': 'pc_logistic', 'floor': 1e-06, 'clip_max': 7.0, 'prob_clip': 0.046764590581618345, 'n_components': 40, 'logistic_c': 1.7605878489002583e-05, 'pca_fit': 'combined', 'solver': 'lbfgs', 'max_iter': 2000, 'fit_intercept': True, 'standardize_with_source': True, 'rho': 0.85}
[I 2026-06-01 18:28:53,131] Trial 22 finished with value: 0.2466640692919826 and parameters: {'alpha': 36943.72194790893, 'n_pcs': 2500, 'iw_method': 'pc_logistic', 'iw_clip_max': 7.0, 'iw_prob_clip': 0.046764590581618345, 'iw_n_components': 40, 'iw_logistic_c': 1.7605878489002583e-05, 'iw_pca_fit': 'combined', 'iw_solver': 'lbfgs', 'iw_rho': 0.85}. Best is trial 17 with value: 0.2523770525022446.
2026-06-01 18:28:53 | INFO | Trial 23 | outer=5 | alpha=3.567e+05 n_pcs=4500 (pc_topk) weight={'name': 'pc_logistic', 'floor': 1e-06, 'clip_max': 7.0, 'prob_clip': 0.02492167974967763, 'n_components': 40, 'logistic_c': 0.006952315744965405, 'pca_fit': 'combined', 'solver': 'lbfgs', 'max_iter': 2000, 'fit_intercept': True, 'standardize_with_source': True, 'rho': 0.85}
[I 2026-06-01 18:29:15,062] Trial 23 finished with value: 0.2340385538737219 and parameters: {'alpha': 356691.4632492415, 'n_pcs': 4500, 'iw_method': 'pc_logistic', 'iw_clip_max': 7.0, 'iw_prob_clip': 0.02492167974967763, 'iw_n_components': 40, 'iw_logistic_c': 0.006952315744965405, 'iw_pca_fit': 'combined', 'iw_solver': 'lbfgs', 'iw_rho': 0.85}. Best is trial 17 with value: 0.2523770525022446.
2026-06-01 18:29:15 | INFO | Trial 24 | outer=5 | alpha=5.074e+03 n_pcs=3500 (pc_topk) weight={'name': 'pc_logistic', 'floor': 1e-06, 'clip_max': 1.5, 'prob_clip': 0.02733129466656171, 'n_components': 40, 'logistic_c': 2.083261963188113e-06, 'pca_fit': 'combined', 'solver': 'lbfgs', 'max_iter': 2000, 'fit_intercept': True, 'standardize_with_source': True, 'rho': 0.85}
[I 2026-06-01 18:29:25,004] Trial 24 finished with value: 0.19307178394555746 and parameters: {'alpha': 5074.387762070538, 'n_pcs': 3500, 'iw_method': 'pc_logistic', 'iw_clip_max': 1.5, 'iw_prob_clip': 0.02733129466656171, 'iw_n_components': 40, 'iw_logistic_c': 2.083261963188113e-06, 'iw_pca_fit': 'combined', 'iw_solver': 'lbfgs', 'iw_rho': 0.85}. Best is trial 17 with value: 0.2523770525022446.
2026-06-01 18:29:25 | INFO | Trial 25 | outer=5 | alpha=7.129e+04 n_pcs=4000 (pc_topk) weight={'name': 'pc_logistic', 'floor': 1e-06, 'clip_max': 4.0, 'prob_clip': 0.008866313319010199, 'n_components': 40, 'logistic_c': 8.294120188888794e-05, 'pca_fit': 'combined', 'solver': 'lbfgs', 'max_iter': 2000, 'fit_intercept': True, 'standardize_with_source': True, 'rho': 0.3}
[I 2026-06-01 18:29:52,467] Trial 25 finished with value: 0.25098964584816286 and parameters: {'alpha': 71286.43020951122, 'n_pcs': 4000, 'iw_method': 'pc_logistic', 'iw_clip_max': 4.0, 'iw_prob_clip': 0.008866313319010199, 'iw_n_components': 40, 'iw_logistic_c': 8.294120188888794e-05, 'iw_pca_fit': 'combined', 'iw_solver': 'lbfgs', 'iw_rho': 0.3}. Best is trial 17 with value: 0.2523770525022446.
2026-06-01 18:29:52 | INFO | Trial 26 | outer=5 | alpha=8.582e+03 n_pcs=4500 (pc_topk) weight={'name': 'pc_logistic', 'floor': 1e-06, 'clip_max': 4.0, 'prob_clip': 0.008099545073223975, 'n_components': 20, 'logistic_c': 8.347505017925936e-05, 'pca_fit': 'combined', 'solver': 'lbfgs', 'max_iter': 2000, 'fit_intercept': True, 'standardize_with_source': True, 'rho': 0.3}
[I 2026-06-01 18:30:08,831] Trial 26 finished with value: 0.23473810629004072 and parameters: {'alpha': 8581.681804050299, 'n_pcs': 4500, 'iw_method': 'pc_logistic', 'iw_clip_max': 4.0, 'iw_prob_clip': 0.008099545073223975, 'iw_n_components': 20, 'iw_logistic_c': 8.347505017925936e-05, 'iw_pca_fit': 'combined', 'iw_solver': 'lbfgs', 'iw_rho': 0.3}. Best is trial 17 with value: 0.2523770525022446.
2026-06-01 18:30:08 | INFO | Trial 27 | outer=5 | alpha=2.850e+05 n_pcs=4000 (pc_topk) weight={'name': 'pc_logistic', 'floor': 1e-06, 'clip_max': 4.0, 'prob_clip': 0.008177808324637666, 'n_components': 100, 'logistic_c': 0.0019125125834479288, 'pca_fit': 'combined', 'solver': 'lbfgs', 'max_iter': 2000, 'fit_intercept': True, 'standardize_with_source': True, 'rho': 0.3}
[I 2026-06-01 18:30:27,081] Trial 27 finished with value: 0.24186551264665074 and parameters: {'alpha': 284981.6105363464, 'n_pcs': 4000, 'iw_method': 'pc_logistic', 'iw_clip_max': 4.0, 'iw_prob_clip': 0.008177808324637666, 'iw_n_components': 100, 'iw_logistic_c': 0.0019125125834479288, 'iw_pca_fit': 'combined', 'iw_solver': 'lbfgs', 'iw_rho': 0.3}. Best is trial 17 with value: 0.2523770525022446.
2026-06-01 18:30:27 | INFO | Trial 28 | outer=5 | alpha=7.692e+04 n_pcs=4500 (pc_topk) weight={'name': 'pc_logistic', 'floor': 1e-06, 'clip_max': 4.0, 'prob_clip': 0.008426020536888559, 'n_components': 60, 'logistic_c': 0.007128061702451308, 'pca_fit': 'combined', 'solver': 'lbfgs', 'max_iter': 2000, 'fit_intercept': True, 'standardize_with_source': True, 'rho': 0.5}
[I 2026-06-01 18:30:50,683] Trial 28 finished with value: 0.2497305349357281 and parameters: {'alpha': 76923.42625132801, 'n_pcs': 4500, 'iw_method': 'pc_logistic', 'iw_clip_max': 4.0, 'iw_prob_clip': 0.008426020536888559, 'iw_n_components': 60, 'iw_logistic_c': 0.007128061702451308, 'iw_pca_fit': 'combined', 'iw_solver': 'lbfgs', 'iw_rho': 0.5}. Best is trial 17 with value: 0.2523770525022446.
2026-06-01 18:30:50 | INFO | Trial 29 | outer=5 | alpha=2.725e+03 n_pcs=4000 (pc_topk) weight={'name': 'pc_logistic', 'floor': 1e-06, 'clip_max': 12.0, 'prob_clip': 0.025753474295695605, 'n_components': 40, 'logistic_c': 1.4884371517215505e-06, 'pca_fit': 'combined', 'solver': 'lbfgs', 'max_iter': 2000, 'fit_intercept': True, 'standardize_with_source': True, 'rho': 0.7}
[I 2026-06-01 18:31:03,635] Trial 29 finished with value: 0.1793986618726813 and parameters: {'alpha': 2725.1896024046937, 'n_pcs': 4000, 'iw_method': 'pc_logistic', 'iw_clip_max': 12.0, 'iw_prob_clip': 0.025753474295695605, 'iw_n_components': 40, 'iw_logistic_c': 1.4884371517215505e-06, 'iw_pca_fit': 'combined', 'iw_solver': 'lbfgs', 'iw_rho': 0.7}. Best is trial 17 with value: 0.2523770525022446.
2026-06-01 18:31:03 | INFO | Trial 30 | outer=5 | alpha=1.175e+05 n_pcs=5000 (pc_topk) weight={'name': 'pc_logistic', 'floor': 1e-06, 'clip_max': 12.0, 'prob_clip': 0.01188728405280773, 'n_components': 10, 'logistic_c': 8.133675539393898e-05, 'pca_fit': 'combined', 'solver': 'lbfgs', 'max_iter': 2000, 'fit_intercept': True, 'standardize_with_source': True, 'rho': 0.3}
[I 2026-06-01 18:31:35,017] Trial 30 finished with value: 0.244043936229081 and parameters: {'alpha': 117452.9824965971, 'n_pcs': 5000, 'iw_method': 'pc_logistic', 'iw_clip_max': 12.0, 'iw_prob_clip': 0.01188728405280773, 'iw_n_components': 10, 'iw_logistic_c': 8.133675539393898e-05, 'iw_pca_fit': 'combined', 'iw_solver': 'lbfgs', 'iw_rho': 0.3}. Best is trial 17 with value: 0.2523770525022446.
2026-06-01 18:31:35 | INFO | Trial 31 | outer=5 | alpha=7.888e+04 n_pcs=4500 (pc_topk) weight={'name': 'pc_logistic', 'floor': 1e-06, 'clip_max': 4.0, 'prob_clip': 0.007600476553288443, 'n_components': 60, 'logistic_c': 0.02011753089901546, 'pca_fit': 'combined', 'solver': 'lbfgs', 'max_iter': 2000, 'fit_intercept': True, 'standardize_with_source': True, 'rho': 0.5}
[I 2026-06-01 18:32:20,272] Trial 31 finished with value: 0.24955091637442836 and parameters: {'alpha': 78875.942442509, 'n_pcs': 4500, 'iw_method': 'pc_logistic', 'iw_clip_max': 4.0, 'iw_prob_clip': 0.007600476553288443, 'iw_n_components': 60, 'iw_logistic_c': 0.02011753089901546, 'iw_pca_fit': 'combined', 'iw_solver': 'lbfgs', 'iw_rho': 0.5}. Best is trial 17 with value: 0.2523770525022446.
2026-06-01 18:32:20 | INFO | Trial 32 | outer=5 | alpha=2.865e+04 n_pcs=4000 (pc_topk) weight={'name': 'pc_logistic', 'floor': 1e-06, 'clip_max': 4.0, 'prob_clip': 0.005366514783428747, 'n_components': 60, 'logistic_c': 0.1324584957163793, 'pca_fit': 'combined', 'solver': 'lbfgs', 'max_iter': 2000, 'fit_intercept': True, 'standardize_with_source': True, 'rho': 0.5}
[I 2026-06-01 18:32:45,512] Trial 32 finished with value: 0.24685127820436387 and parameters: {'alpha': 28652.76756750435, 'n_pcs': 4000, 'iw_method': 'pc_logistic', 'iw_clip_max': 4.0, 'iw_prob_clip': 0.005366514783428747, 'iw_n_components': 60, 'iw_logistic_c': 0.1324584957163793, 'iw_pca_fit': 'combined', 'iw_solver': 'lbfgs', 'iw_rho': 0.5}. Best is trial 17 with value: 0.2523770525022446.
2026-06-01 18:32:45 | INFO | Trial 33 | outer=5 | alpha=6.471e+04 n_pcs=5000 (pc_topk) weight={'name': 'pc_logistic', 'floor': 1e-06, 'clip_max': 4.0, 'prob_clip': 0.009794795908685433, 'n_components': 60, 'logistic_c': 0.002475952070522523, 'pca_fit': 'combined', 'solver': 'lbfgs', 'max_iter': 2000, 'fit_intercept': True, 'standardize_with_source': True, 'rho': 0.5}
[I 2026-06-01 18:33:08,492] Trial 33 finished with value: 0.24873717881370552 and parameters: {'alpha': 64705.10223385939, 'n_pcs': 5000, 'iw_method': 'pc_logistic', 'iw_clip_max': 4.0, 'iw_prob_clip': 0.009794795908685433, 'iw_n_components': 60, 'iw_logistic_c': 0.002475952070522523, 'iw_pca_fit': 'combined', 'iw_solver': 'lbfgs', 'iw_rho': 0.5}. Best is trial 17 with value: 0.2523770525022446.
2026-06-01 18:33:08 | INFO | Trial 34 | outer=5 | alpha=2.076e+05 n_pcs=4500 (pc_topk) weight={'name': 'pc_logistic', 'floor': 1e-06, 'clip_max': 4.0, 'prob_clip': 0.021217090657884154, 'n_components': 40, 'logistic_c': 7.700415317664056e-05, 'pca_fit': 'combined', 'solver': 'lbfgs', 'max_iter': 2000, 'fit_intercept': True, 'standardize_with_source': True, 'rho': 0.5}
