[I 2026-06-01 00:47:02,735] Trial 62 finished with value: 0.23432888394995768 and parameters: {'alpha': 593352.1006607751, 'n_pcs': 4000, 'weight_scheme': 'exponential', 'weight_clip_max': 5.0, 'weight_exponential_beta': 4.8588777651490505}. Best is trial 57 with value: 0.23745149892178968.
2026-06-01 00:47:02 | INFO | src.nested_cv_avggrm_weighted_unified | Trial 63 | outer=6 | alpha=2.680e+05 n_pcs=4000 (pc_topk) weight_search=on
2026-06-01 00:47:02 | INFO | src.nested_cv_avggrm_weighted_unified | Trial 63 | outer=6 | weight={'name': 'exponential', 'floor': 1e-06, 'clip_max': 5.0, 'beta': 5.863202525084714}
[I 2026-06-01 00:47:07,897] Trial 63 finished with value: 0.23721480162746253 and parameters: {'alpha': 268046.92265257856, 'n_pcs': 4000, 'weight_scheme': 'exponential', 'weight_clip_max': 5.0, 'weight_exponential_beta': 5.863202525084714}. Best is trial 57 with value: 0.23745149892178968.
2026-06-01 00:47:07 | INFO | src.nested_cv_avggrm_weighted_unified | Trial 64 | outer=6 | alpha=1.336e+03 n_pcs=3500 (pc_topk) weight_search=on
2026-06-01 00:47:07 | INFO | src.nested_cv_avggrm_weighted_unified | Trial 64 | outer=6 | weight={'name': 'exponential', 'floor': 1e-06, 'clip_max': 5.0, 'beta': 5.72865247859473}
2026-06-01 00:47:10 | INFO | src.nested_cv_avggrm_weighted_unified | Trial 64 | outer=6 | pruned after 5/10 inner folds (mean r=0.1462)
[I 2026-06-01 00:47:10,152] Trial 64 pruned. 
2026-06-01 00:47:10 | INFO | src.nested_cv_avggrm_weighted_unified | Trial 65 | outer=6 | alpha=1.300e+05 n_pcs=4500 (pc_topk) weight_search=on
2026-06-01 00:47:10 | INFO | src.nested_cv_avggrm_weighted_unified | Trial 65 | outer=6 | weight={'name': 'exponential', 'floor': 1e-06, 'clip_max': 5.0, 'beta': 4.446122366771703}
2026-06-01 00:47:14 | INFO | src.nested_cv_avggrm_weighted_unified | Trial 65 | outer=6 | pruned after 7/10 inner folds (mean r=0.2615)
[I 2026-06-01 00:47:14,565] Trial 65 pruned. 
2026-06-01 00:47:14 | INFO | src.nested_cv_avggrm_weighted_unified | Trial 66 | outer=6 | alpha=5.724e+04 n_pcs=4000 (pc_topk) weight_search=on
2026-06-01 00:47:14 | INFO | src.nested_cv_avggrm_weighted_unified | Trial 66 | outer=6 | weight={'name': 'exponential', 'floor': 1e-06, 'clip_max': 5.0, 'beta': 5.038290090790219}
2026-06-01 00:47:18 | INFO | src.nested_cv_avggrm_weighted_unified | Trial 66 | outer=6 | pruned after 7/10 inner folds (mean r=0.2506)
[I 2026-06-01 00:47:18,187] Trial 66 pruned. 
2026-06-01 00:47:18 | INFO | src.nested_cv_avggrm_weighted_unified | Trial 67 | outer=6 | alpha=2.450e+05 n_pcs=3000 (pc_topk) weight_search=on
2026-06-01 00:47:18 | INFO | src.nested_cv_avggrm_weighted_unified | Trial 67 | outer=6 | weight={'name': 'exponential', 'floor': 1e-06, 'clip_max': 3.0, 'beta': 6.015932104837936}
[I 2026-06-01 00:47:22,697] Trial 67 finished with value: 0.23635536456034814 and parameters: {'alpha': 245009.70227021544, 'n_pcs': 3000, 'weight_scheme': 'exponential', 'weight_clip_max': 3.0, 'weight_exponential_beta': 6.015932104837936}. Best is trial 57 with value: 0.23745149892178968.
2026-06-01 00:47:22 | INFO | src.nested_cv_avggrm_weighted_unified | Trial 68 | outer=6 | alpha=9.584e+05 n_pcs=4500 (pc_topk) weight_search=on
2026-06-01 00:47:22 | INFO | src.nested_cv_avggrm_weighted_unified | Trial 68 | outer=6 | weight={'name': 'exponential', 'floor': 1e-06, 'clip_max': 5.0, 'beta': 2.896410824703549}
2026-06-01 00:47:26 | INFO | src.nested_cv_avggrm_weighted_unified | Trial 68 | outer=6 | pruned after 6/10 inner folds (mean r=0.2471)
[I 2026-06-01 00:47:26,538] Trial 68 pruned. 
2026-06-01 00:47:26 | INFO | src.nested_cv_avggrm_weighted_unified | Trial 69 | outer=6 | alpha=1.749e+06 n_pcs=4000 (pc_topk) weight_search=on
2026-06-01 00:47:26 | INFO | src.nested_cv_avggrm_weighted_unified | Trial 69 | outer=6 | weight={'name': 'exponential', 'floor': 1e-06, 'clip_max': 5.0, 'beta': 5.543139053707382}
2026-06-01 00:47:29 | INFO | src.nested_cv_avggrm_weighted_unified | Trial 69 | outer=6 | pruned after 6/10 inner folds (mean r=0.2509)
[I 2026-06-01 00:47:29,620] Trial 69 pruned. 
2026-06-01 00:47:29 | INFO | src.nested_cv_avggrm_weighted_unified | Trial 70 | outer=6 | alpha=9.304e+04 n_pcs=2000 (pc_topk) weight_search=on
2026-06-01 00:47:29 | INFO | src.nested_cv_avggrm_weighted_unified | Trial 70 | outer=6 | weight={'name': 'exponential', 'floor': 1e-06, 'clip_max': None, 'beta': 6.286719226924465}
2026-06-01 00:47:31 | INFO | src.nested_cv_avggrm_weighted_unified | Trial 70 | outer=6 | pruned after 6/10 inner folds (mean r=0.2114)
[I 2026-06-01 00:47:31,526] Trial 70 pruned. 
2026-06-01 00:47:31 | INFO | src.nested_cv_avggrm_weighted_unified | Trial 71 | outer=6 | alpha=3.759e+05 n_pcs=4000 (pc_topk) weight_search=on
2026-06-01 00:47:31 | INFO | src.nested_cv_avggrm_weighted_unified | Trial 71 | outer=6 | weight={'name': 'exponential', 'floor': 1e-06, 'clip_max': 5.0, 'beta': 7.053654277915311}
[I 2026-06-01 00:47:36,827] Trial 71 finished with value: 0.23627449499003647 and parameters: {'alpha': 375899.93556016666, 'n_pcs': 4000, 'weight_scheme': 'exponential', 'weight_clip_max': 5.0, 'weight_exponential_beta': 7.053654277915311}. Best is trial 57 with value: 0.23745149892178968.
2026-06-01 00:47:36 | INFO | src.nested_cv_avggrm_weighted_unified | Trial 72 | outer=6 | alpha=2.917e+05 n_pcs=3500 (pc_topk) weight_search=on
2026-06-01 00:47:36 | INFO | src.nested_cv_avggrm_weighted_unified | Trial 72 | outer=6 | weight={'name': 'exponential', 'floor': 1e-06, 'clip_max': 5.0, 'beta': 7.392890298179058}
2026-06-01 00:47:39 | INFO | src.nested_cv_avggrm_weighted_unified | Trial 72 | outer=6 | pruned after 6/10 inner folds (mean r=0.2516)
[I 2026-06-01 00:47:39,431] Trial 72 pruned. 
2026-06-01 00:47:39 | INFO | src.nested_cv_avggrm_weighted_unified | Trial 73 | outer=6 | alpha=1.695e+05 n_pcs=4000 (pc_topk) weight_search=on
2026-06-01 00:47:39 | INFO | src.nested_cv_avggrm_weighted_unified | Trial 73 | outer=6 | weight={'name': 'exponential', 'floor': 1e-06, 'clip_max': 5.0, 'beta': 6.571626246120961}
2026-06-01 00:47:43 | INFO | src.nested_cv_avggrm_weighted_unified | Trial 73 | outer=6 | pruned after 7/10 inner folds (mean r=0.2613)
[I 2026-06-01 00:47:43,244] Trial 73 pruned. 
2026-06-01 00:47:43 | INFO | src.nested_cv_avggrm_weighted_unified | Trial 74 | outer=6 | alpha=5.208e+05 n_pcs=4500 (pc_topk) weight_search=on
2026-06-01 00:47:43 | INFO | src.nested_cv_avggrm_weighted_unified | Trial 74 | outer=6 | weight={'name': 'exponential', 'floor': 1e-06, 'clip_max': 5.0, 'beta': 5.862650324103376}
[I 2026-06-01 00:47:49,691] Trial 74 finished with value: 0.23445828754301581 and parameters: {'alpha': 520813.68823500775, 'n_pcs': 4500, 'weight_scheme': 'exponential', 'weight_clip_max': 5.0, 'weight_exponential_beta': 5.862650324103376}. Best is trial 57 with value: 0.23745149892178968.
2026-06-01 00:47:49 | INFO | src.nested_cv_avggrm_weighted_unified | Trial 75 | outer=6 | alpha=3.601e+05 n_pcs=1000 (pc_topk) weight_search=on
2026-06-01 00:47:49 | INFO | src.nested_cv_avggrm_weighted_unified | Trial 75 | outer=6 | weight={'name': 'exponential', 'floor': 1e-06, 'clip_max': 5.0, 'beta': 5.4270155908791144}
2026-06-01 00:47:50 | INFO | src.nested_cv_avggrm_weighted_unified | Trial 75 | outer=6 | pruned after 6/10 inner folds (mean r=0.2450)
[I 2026-06-01 00:47:50,396] Trial 75 pruned. 
2026-06-01 00:47:50 | INFO | src.nested_cv_avggrm_weighted_unified | Trial 76 | outer=6 | alpha=1.117e+05 n_pcs=3500 (pc_topk) weight_search=on
2026-06-01 00:47:50 | INFO | src.nested_cv_avggrm_weighted_unified | Trial 76 | outer=6 | weight={'name': 'uniform', 'floor': 1e-06, 'clip_max': 5.0}
2026-06-01 00:47:52 | INFO | src.nested_cv_avggrm_weighted_unified | Trial 76 | outer=6 | pruned after 6/10 inner folds (mean r=0.2432)
[I 2026-06-01 00:47:52,690] Trial 76 pruned. 
2026-06-01 00:47:52 | INFO | src.nested_cv_avggrm_weighted_unified | Trial 77 | outer=6 | alpha=2.182e+05 n_pcs=4000 (pc_topk) weight_search=on
2026-06-01 00:47:52 | INFO | src.nested_cv_avggrm_weighted_unified | Trial 77 | outer=6 | weight={'name': 'exponential', 'floor': 1e-06, 'clip_max': 10.0, 'beta': 6.8511294064817}
2026-06-01 00:47:55 | INFO | src.nested_cv_avggrm_weighted_unified | Trial 77 | outer=6 | pruned after 6/10 inner folds (mean r=0.2439)
[I 2026-06-01 00:47:55,799] Trial 77 pruned. 
2026-06-01 00:47:55 | INFO | src.nested_cv_avggrm_weighted_unified | Trial 78 | outer=6 | alpha=2.910e+05 n_pcs=4000 (pc_topk) weight_search=on
2026-06-01 00:47:55 | INFO | src.nested_cv_avggrm_weighted_unified | Trial 78 | outer=6 | weight={'name': 'linear', 'floor': 1e-06, 'clip_max': 20.0, 'min_weight': 0.05131182637472337, 'max_weight': 3.9823873233208915}
2026-06-01 00:47:59 | INFO | src.nested_cv_avggrm_weighted_unified | Trial 78 | outer=6 | pruned after 6/10 inner folds (mean r=0.2498)
[I 2026-06-01 00:47:59,388] Trial 78 pruned. 
2026-06-01 00:47:59 | INFO | src.nested_cv_avggrm_weighted_unified | Trial 79 | outer=6 | alpha=6.171e+05 n_pcs=4500 (pc_topk) weight_search=on
2026-06-01 00:47:59 | INFO | src.nested_cv_avggrm_weighted_unified | Trial 79 | outer=6 | weight={'name': 'exponential', 'floor': 1e-06, 'clip_max': 5.0, 'beta': 7.770513569588527}
[I 2026-06-01 00:48:05,838] Trial 79 finished with value: 0.23347396515767188 and parameters: {'alpha': 617090.9735509807, 'n_pcs': 4500, 'weight_scheme': 'exponential', 'weight_clip_max': 5.0, 'weight_exponential_beta': 7.770513569588527}. Best is trial 57 with value: 0.23745149892178968.
2026-06-01 00:48:05 | INFO | src.nested_cv_avggrm_weighted_unified | Trial 80 | outer=6 | alpha=1.663e+05 n_pcs=3500 (pc_topk) weight_search=on
2026-06-01 00:48:05 | INFO | src.nested_cv_avggrm_weighted_unified | Trial 80 | outer=6 | weight={'name': 'exponential', 'floor': 1e-06, 'clip_max': 5.0, 'beta': 4.734701121836523}
2026-06-01 00:48:08 | INFO | src.nested_cv_avggrm_weighted_unified | Trial 80 | outer=6 | pruned after 7/10 inner folds (mean r=0.2614)
[I 2026-06-01 00:48:08,920] Trial 80 pruned. 
2026-06-01 00:48:08 | INFO | src.nested_cv_avggrm_weighted_unified | Trial 81 | outer=6 | alpha=3.448e+05 n_pcs=4000 (pc_topk) weight_search=on
2026-06-01 00:48:08 | INFO | src.nested_cv_avggrm_weighted_unified | Trial 81 | outer=6 | weight={'name': 'exponential', 'floor': 1e-06, 'clip_max': 5.0, 'beta': 6.517136720851251}
[I 2026-06-01 00:48:14,081] Trial 81 finished with value: 0.2366915612040581 and parameters: {'alpha': 344826.0718142215, 'n_pcs': 4000, 'weight_scheme': 'exponential', 'weight_clip_max': 5.0, 'weight_exponential_beta': 6.517136720851251}. Best is trial 57 with value: 0.23745149892178968.
2026-06-01 00:48:14 | INFO | src.nested_cv_avggrm_weighted_unified | Trial 82 | outer=6 | alpha=3.258e+05 n_pcs=4000 (pc_topk) weight_search=on
2026-06-01 00:48:14 | INFO | src.nested_cv_avggrm_weighted_unified | Trial 82 | outer=6 | weight={'name': 'exponential', 'floor': 1e-06, 'clip_max': 5.0, 'beta': 6.362719325346171}
[I 2026-06-01 00:48:19,292] Trial 82 finished with value: 0.23685645405562444 and parameters: {'alpha': 325750.8455941274, 'n_pcs': 4000, 'weight_scheme': 'exponential', 'weight_clip_max': 5.0, 'weight_exponential_beta': 6.362719325346171}. Best is trial 57 with value: 0.23745149892178968.
2026-06-01 00:48:19 | INFO | src.nested_cv_avggrm_weighted_unified | Trial 83 | outer=6 | alpha=4.511e+05 n_pcs=4000 (pc_topk) weight_search=on
2026-06-01 00:48:19 | INFO | src.nested_cv_avggrm_weighted_unified | Trial 83 | outer=6 | weight={'name': 'exponential', 'floor': 1e-06, 'clip_max': 5.0, 'beta': 6.3948684574853445}
[I 2026-06-01 00:48:24,456] Trial 83 finished with value: 0.23596927535417317 and parameters: {'alpha': 451058.31907955284, 'n_pcs': 4000, 'weight_scheme': 'exponential', 'weight_clip_max': 5.0, 'weight_exponential_beta': 6.3948684574853445}. Best is trial 57 with value: 0.23745149892178968.
2026-06-01 00:48:24 | INFO | src.nested_cv_avggrm_weighted_unified | Trial 84 | outer=6 | alpha=2.018e+05 n_pcs=4000 (pc_topk) weight_search=on
2026-06-01 00:48:24 | INFO | src.nested_cv_avggrm_weighted_unified | Trial 84 | outer=6 | weight={'name': 'exponential', 'floor': 1e-06, 'clip_max': 5.0, 'beta': 5.889331874398241}
2026-06-01 00:48:28 | INFO | src.nested_cv_avggrm_weighted_unified | Trial 84 | outer=6 | pruned after 7/10 inner folds (mean r=0.2630)
[I 2026-06-01 00:48:28,090] Trial 84 pruned. 
2026-06-01 00:48:28 | INFO | src.nested_cv_avggrm_weighted_unified | Trial 85 | outer=6 | alpha=3.221e+05 n_pcs=4500 (pc_topk) weight_search=on
2026-06-01 00:48:28 | INFO | src.nested_cv_avggrm_weighted_unified | Trial 85 | outer=6 | weight={'name': 'exponential', 'floor': 1e-06, 'clip_max': 5.0, 'beta': 6.0561149770764455}
[I 2026-06-01 00:48:34,535] Trial 85 finished with value: 0.23615305140953166 and parameters: {'alpha': 322078.00299505546, 'n_pcs': 4500, 'weight_scheme': 'exponential', 'weight_clip_max': 5.0, 'weight_exponential_beta': 6.0561149770764455}. Best is trial 57 with value: 0.23745149892178968.
2026-06-01 00:48:34 | INFO | src.nested_cv_avggrm_weighted_unified | Trial 86 | outer=6 | alpha=2.407e+05 n_pcs=4000 (pc_topk) weight_search=on
2026-06-01 00:48:34 | INFO | src.nested_cv_avggrm_weighted_unified | Trial 86 | outer=6 | weight={'name': 'exponential', 'floor': 1e-06, 'clip_max': 5.0, 'beta': 5.1675767140137125}
[I 2026-06-01 00:48:39,756] Trial 86 finished with value: 0.23736981453720243 and parameters: {'alpha': 240738.3488709653, 'n_pcs': 4000, 'weight_scheme': 'exponential', 'weight_clip_max': 5.0, 'weight_exponential_beta': 5.1675767140137125}. Best is trial 57 with value: 0.23745149892178968.
2026-06-01 00:48:39 | INFO | src.nested_cv_avggrm_weighted_unified | Trial 87 | outer=6 | alpha=1.271e+05 n_pcs=3500 (pc_topk) weight_search=on
2026-06-01 00:48:39 | INFO | src.nested_cv_avggrm_weighted_unified | Trial 87 | outer=6 | weight={'name': 'exponential', 'floor': 1e-06, 'clip_max': 5.0, 'beta': 5.220908094250349}
2026-06-01 00:48:42 | INFO | src.nested_cv_avggrm_weighted_unified | Trial 87 | outer=6 | pruned after 7/10 inner folds (mean r=0.2585)
[I 2026-06-01 00:48:42,835] Trial 87 pruned. 
2026-06-01 00:48:42 | INFO | src.nested_cv_avggrm_weighted_unified | Trial 88 | outer=6 | alpha=2.500e+05 n_pcs=4500 (pc_topk) weight_search=on
2026-06-01 00:48:42 | INFO | src.nested_cv_avggrm_weighted_unified | Trial 88 | outer=6 | weight={'name': 'exponential', 'floor': 1e-06, 'clip_max': 3.0, 'beta': 3.745694073769692}
[I 2026-06-01 00:48:49,278] Trial 88 finished with value: 0.23633357517746045 and parameters: {'alpha': 250033.40940883252, 'n_pcs': 4500, 'weight_scheme': 'exponential', 'weight_clip_max': 3.0, 'weight_exponential_beta': 3.745694073769692}. Best is trial 57 with value: 0.23745149892178968.
2026-06-01 00:48:49 | INFO | src.nested_cv_avggrm_weighted_unified | Trial 89 | outer=6 | alpha=8.950e+05 n_pcs=4000 (pc_topk) weight_search=on
2026-06-01 00:48:49 | INFO | src.nested_cv_avggrm_weighted_unified | Trial 89 | outer=6 | weight={'name': 'exponential', 'floor': 1e-06, 'clip_max': 5.0, 'beta': 4.070496821075007}
2026-06-01 00:48:52 | INFO | src.nested_cv_avggrm_weighted_unified | Trial 89 | outer=6 | pruned after 6/10 inner folds (mean r=0.2518)
[I 2026-06-01 00:48:52,494] Trial 89 pruned. 
2026-06-01 00:48:52 | INFO | src.nested_cv_avggrm_weighted_unified | Trial 90 | outer=6 | alpha=6.275e+05 n_pcs=4000 (pc_topk) weight_search=on
2026-06-01 00:48:52 | INFO | src.nested_cv_avggrm_weighted_unified | Trial 90 | outer=6 | weight={'name': 'uniform', 'floor': 1e-06, 'clip_max': 5.0}
2026-06-01 00:48:54 | INFO | src.nested_cv_avggrm_weighted_unified | Trial 90 | outer=6 | pruned after 5/10 inner folds (mean r=0.2079)
[I 2026-06-01 00:48:54,843] Trial 90 pruned. 
2026-06-01 00:48:54 | INFO | src.nested_cv_avggrm_weighted_unified | Trial 91 | outer=6 | alpha=4.094e+05 n_pcs=4000 (pc_topk) weight_search=on
2026-06-01 00:48:54 | INFO | src.nested_cv_avggrm_weighted_unified | Trial 91 | outer=6 | weight={'name': 'exponential', 'floor': 1e-06, 'clip_max': 5.0, 'beta': 6.455926389504945}
[I 2026-06-01 00:49:00,189] Trial 91 finished with value: 0.2362678742567093 and parameters: {'alpha': 409436.5237009709, 'n_pcs': 4000, 'weight_scheme': 'exponential', 'weight_clip_max': 5.0, 'weight_exponential_beta': 6.455926389504945}. Best is trial 57 with value: 0.23745149892178968.
2026-06-01 00:49:00 | INFO | src.nested_cv_avggrm_weighted_unified | Trial 92 | outer=6 | alpha=1.971e+05 n_pcs=3500 (pc_topk) weight_search=on
2026-06-01 00:49:00 | INFO | src.nested_cv_avggrm_weighted_unified | Trial 92 | outer=6 | weight={'name': 'exponential', 'floor': 1e-06, 'clip_max': 5.0, 'beta': 4.75985178289676}
2026-06-01 00:49:03 | INFO | src.nested_cv_avggrm_weighted_unified | Trial 92 | outer=6 | pruned after 7/10 inner folds (mean r=0.2625)
[I 2026-06-01 00:49:03,279] Trial 92 pruned. 
2026-06-01 00:49:03 | INFO | src.nested_cv_avggrm_weighted_unified | Trial 93 | outer=6 | alpha=2.534e+05 n_pcs=4000 (pc_topk) weight_search=on
2026-06-01 00:49:03 | INFO | src.nested_cv_avggrm_weighted_unified | Trial 93 | outer=6 | weight={'name': 'exponential', 'floor': 1e-06, 'clip_max': 5.0, 'beta': 7.230343574624215}
2026-06-01 00:49:06 | INFO | src.nested_cv_avggrm_weighted_unified | Trial 93 | outer=6 | pruned after 7/10 inner folds (mean r=0.2629)
[I 2026-06-01 00:49:06,907] Trial 93 pruned. 
2026-06-01 00:49:06 | INFO | src.nested_cv_avggrm_weighted_unified | Trial 94 | outer=6 | alpha=3.434e+05 n_pcs=4500 (pc_topk) weight_search=on
2026-06-01 00:49:06 | INFO | src.nested_cv_avggrm_weighted_unified | Trial 94 | outer=6 | weight={'name': 'exponential', 'floor': 1e-06, 'clip_max': None, 'beta': 5.62574808437796}
2026-06-01 00:49:10 | INFO | src.nested_cv_avggrm_weighted_unified | Trial 94 | outer=6 | pruned after 6/10 inner folds (mean r=0.2240)
[I 2026-06-01 00:49:10,725] Trial 94 pruned. 
2026-06-01 00:49:10 | INFO | src.nested_cv_avggrm_weighted_unified | Trial 95 | outer=6 | alpha=8.254e+04 n_pcs=3500 (pc_topk) weight_search=on
2026-06-01 00:49:10 | INFO | src.nested_cv_avggrm_weighted_unified | Trial 95 | outer=6 | weight={'name': 'exponential', 'floor': 1e-06, 'clip_max': 5.0, 'beta': 6.630036643209994}
2026-06-01 00:49:13 | INFO | src.nested_cv_avggrm_weighted_unified | Trial 95 | outer=6 | pruned after 6/10 inner folds (mean r=0.2408)
[I 2026-06-01 00:49:13,357] Trial 95 pruned. 
2026-06-01 00:49:13 | INFO | src.nested_cv_avggrm_weighted_unified | Trial 96 | outer=6 | alpha=4.752e+05 n_pcs=4000 (pc_topk) weight_search=on
2026-06-01 00:49:13 | INFO | src.nested_cv_avggrm_weighted_unified | Trial 96 | outer=6 | weight={'name': 'exponential', 'floor': 1e-06, 'clip_max': 5.0, 'beta': 6.035310137698289}
[I 2026-06-01 00:49:18,516] Trial 96 finished with value: 0.23571881398711084 and parameters: {'alpha': 475163.3487993228, 'n_pcs': 4000, 'weight_scheme': 'exponential', 'weight_clip_max': 5.0, 'weight_exponential_beta': 6.035310137698289}. Best is trial 57 with value: 0.23745149892178968.
2026-06-01 00:49:18 | INFO | src.nested_cv_avggrm_weighted_unified | Trial 97 | outer=6 | alpha=1.497e+05 n_pcs=5000 (pc_topk) weight_search=on
2026-06-01 00:49:18 | INFO | src.nested_cv_avggrm_weighted_unified | Trial 97 | outer=6 | weight={'name': 'linear', 'floor': 1e-06, 'clip_max': 10.0, 'min_weight': 0.8182542005245734, 'max_weight': 1.0041292262574504}
2026-06-01 00:49:22 | INFO | src.nested_cv_avggrm_weighted_unified | Trial 97 | outer=6 | pruned after 6/10 inner folds (mean r=0.2431)
[I 2026-06-01 00:49:22,517] Trial 97 pruned. 
2026-06-01 00:49:22 | INFO | src.nested_cv_avggrm_weighted_unified | Trial 98 | outer=6 | alpha=6.895e+05 n_pcs=4500 (pc_topk) weight_search=on
2026-06-01 00:49:22 | INFO | src.nested_cv_avggrm_weighted_unified | Trial 98 | outer=6 | weight={'name': 'exponential', 'floor': 1e-06, 'clip_max': 5.0, 'beta': 1.2795363776607198}
2026-06-01 00:49:26 | INFO | src.nested_cv_avggrm_weighted_unified | Trial 98 | outer=6 | pruned after 6/10 inner folds (mean r=0.2445)
[I 2026-06-01 00:49:26,332] Trial 98 pruned. 
2026-06-01 00:49:26 | INFO | src.nested_cv_avggrm_weighted_unified | Trial 99 | outer=6 | alpha=1.185e+05 n_pcs=4000 (pc_topk) weight_search=on
2026-06-01 00:49:26 | INFO | src.nested_cv_avggrm_weighted_unified | Trial 99 | outer=6 | weight={'name': 'exponential', 'floor': 1e-06, 'clip_max': 20.0, 'beta': 5.108528257470426}
2026-06-01 00:49:29 | INFO | src.nested_cv_avggrm_weighted_unified | Trial 99 | outer=6 | pruned after 6/10 inner folds (mean r=0.2341)
[I 2026-06-01 00:49:29,449] Trial 99 pruned. 
2026-06-01 00:49:29 | INFO | src.nested_cv_avggrm_weighted_unified | Trial 100 | outer=6 | alpha=1.250e+06 n_pcs=4500 (pc_topk) weight_search=on
2026-06-01 00:49:29 | INFO | src.nested_cv_avggrm_weighted_unified | Trial 100 | outer=6 | weight={'name': 'exponential', 'floor': 1e-06, 'clip_max': 5.0, 'beta': 6.879063588206816}
2026-06-01 00:49:33 | INFO | src.nested_cv_avggrm_weighted_unified | Trial 100 | outer=6 | pruned after 6/10 inner folds (mean r=0.2525)
[I 2026-06-01 00:49:33,270] Trial 100 pruned. 
2026-06-01 00:49:33 | INFO | src.nested_cv_avggrm_weighted_unified | Trial 101 | outer=6 | alpha=3.202e+05 n_pcs=4000 (pc_topk) weight_search=on
2026-06-01 00:49:33 | INFO | src.nested_cv_avggrm_weighted_unified | Trial 101 | outer=6 | weight={'name': 'exponential', 'floor': 1e-06, 'clip_max': 5.0, 'beta': 6.388623973659487}
