[I 2026-06-01 02:39:33,976] Trial 221 finished with value: 0.23582428317550536 and parameters: {'alpha': 128344.59829850456, 'n_pcs': 4000, 'weight_scheme': 'linear', 'weight_clip_max': 10.0, 'weight_linear_min_weight': 0.1084760678719317, 'weight_linear_max_weight': 2.9240017115632257}. Best is trial 161 with value: 0.23590282759169154.
2026-06-01 02:39:33 | INFO | src.nested_cv_avggrm_weighted_unified | Trial 222 | outer=10 | alpha=1.151e+05 n_pcs=4000 (pc_topk) weight_search=on
2026-06-01 02:39:33 | INFO | src.nested_cv_avggrm_weighted_unified | Trial 222 | outer=10 | weight={'name': 'linear', 'floor': 1e-06, 'clip_max': 10.0, 'min_weight': 0.06694433299557002, 'max_weight': 4.057365448584969}
[I 2026-06-01 02:39:39,761] Trial 222 finished with value: 0.23590654531055238 and parameters: {'alpha': 115125.02472546, 'n_pcs': 4000, 'weight_scheme': 'linear', 'weight_clip_max': 10.0, 'weight_linear_min_weight': 0.06694433299557002, 'weight_linear_max_weight': 4.057365448584969}. Best is trial 222 with value: 0.23590654531055238.
2026-06-01 02:39:39 | INFO | src.nested_cv_avggrm_weighted_unified | OUTER 10 | new best trial 222 (mean inner r=0.2359) saved to outputs/final_results/e6_pc_ridge_avggrm/thr_wing/e6_pc_ridge_avggrm_thr_wing_best_trials/split_10_best_trial.json
2026-06-01 02:39:39 | INFO | src.nested_cv_avggrm_weighted_unified | Trial 223 | outer=10 | alpha=1.077e+05 n_pcs=4000 (pc_topk) weight_search=on
2026-06-01 02:39:39 | INFO | src.nested_cv_avggrm_weighted_unified | Trial 223 | outer=10 | weight={'name': 'linear', 'floor': 1e-06, 'clip_max': 10.0, 'min_weight': 0.06652768908266307, 'max_weight': 4.858552252077579}
2026-06-01 02:39:44 | INFO | src.nested_cv_avggrm_weighted_unified | Trial 223 | outer=10 | pruned after 8/10 inner folds (mean r=0.2697)
[I 2026-06-01 02:39:44,577] Trial 223 pruned. 
2026-06-01 02:39:44 | INFO | src.nested_cv_avggrm_weighted_unified | Trial 224 | outer=10 | alpha=1.517e+05 n_pcs=4000 (pc_topk) weight_search=on
2026-06-01 02:39:44 | INFO | src.nested_cv_avggrm_weighted_unified | Trial 224 | outer=10 | weight={'name': 'linear', 'floor': 1e-06, 'clip_max': 10.0, 'min_weight': 0.0830717854937707, 'max_weight': 3.619283812436296}
[I 2026-06-01 02:39:50,432] Trial 224 finished with value: 0.23571217482050538 and parameters: {'alpha': 151739.48436549853, 'n_pcs': 4000, 'weight_scheme': 'linear', 'weight_clip_max': 10.0, 'weight_linear_min_weight': 0.0830717854937707, 'weight_linear_max_weight': 3.619283812436296}. Best is trial 222 with value: 0.23590654531055238.
2026-06-01 02:39:50 | INFO | src.nested_cv_avggrm_weighted_unified | Trial 225 | outer=10 | alpha=1.148e+05 n_pcs=4000 (pc_topk) weight_search=on
2026-06-01 02:39:50 | INFO | src.nested_cv_avggrm_weighted_unified | Trial 225 | outer=10 | weight={'name': 'linear', 'floor': 1e-06, 'clip_max': 10.0, 'min_weight': 0.050370332675844995, 'max_weight': 4.184102310178088}
[I 2026-06-01 02:39:56,168] Trial 225 finished with value: 0.23589773450620047 and parameters: {'alpha': 114777.35314354242, 'n_pcs': 4000, 'weight_scheme': 'linear', 'weight_clip_max': 10.0, 'weight_linear_min_weight': 0.050370332675844995, 'weight_linear_max_weight': 4.184102310178088}. Best is trial 222 with value: 0.23590654531055238.
2026-06-01 02:39:56 | INFO | src.nested_cv_avggrm_weighted_unified | Trial 226 | outer=10 | alpha=9.185e+04 n_pcs=4000 (pc_topk) weight_search=on
2026-06-01 02:39:56 | INFO | src.nested_cv_avggrm_weighted_unified | Trial 226 | outer=10 | weight={'name': 'linear', 'floor': 1e-06, 'clip_max': 10.0, 'min_weight': 0.0510486706562504, 'max_weight': 4.107924933201384}
2026-06-01 02:40:00 | INFO | src.nested_cv_avggrm_weighted_unified | Trial 226 | outer=10 | pruned after 8/10 inner folds (mean r=0.2686)
[I 2026-06-01 02:40:00,780] Trial 226 pruned. 
2026-06-01 02:40:00 | INFO | src.nested_cv_avggrm_weighted_unified | Trial 227 | outer=10 | alpha=1.135e+05 n_pcs=4000 (pc_topk) weight_search=on
2026-06-01 02:40:00 | INFO | src.nested_cv_avggrm_weighted_unified | Trial 227 | outer=10 | weight={'name': 'linear', 'floor': 1e-06, 'clip_max': 10.0, 'min_weight': 0.4540896774962644, 'max_weight': 4.413429955908483}
2026-06-01 02:40:05 | INFO | src.nested_cv_avggrm_weighted_unified | Trial 227 | outer=10 | pruned after 8/10 inner folds (mean r=0.2692)
[I 2026-06-01 02:40:05,386] Trial 227 pruned. 
2026-06-01 02:40:05 | INFO | src.nested_cv_avggrm_weighted_unified | Trial 228 | outer=10 | alpha=7.967e+04 n_pcs=4000 (pc_topk) weight_search=on
2026-06-01 02:40:05 | INFO | src.nested_cv_avggrm_weighted_unified | Trial 228 | outer=10 | weight={'name': 'linear', 'floor': 1e-06, 'clip_max': 3.0, 'min_weight': 0.08107834552046875, 'max_weight': 4.008164522576968}
2026-06-01 02:40:10 | INFO | src.nested_cv_avggrm_weighted_unified | Trial 228 | outer=10 | pruned after 8/10 inner folds (mean r=0.2665)
[I 2026-06-01 02:40:10,000] Trial 228 pruned. 
2026-06-01 02:40:10 | INFO | src.nested_cv_avggrm_weighted_unified | Trial 229 | outer=10 | alpha=1.786e+05 n_pcs=2500 (pc_topk) weight_search=on
2026-06-01 02:40:10 | INFO | src.nested_cv_avggrm_weighted_unified | Trial 229 | outer=10 | weight={'name': 'linear', 'floor': 1e-06, 'clip_max': 10.0, 'min_weight': 0.939524028978061, 'max_weight': 2.833245721850602}
2026-06-01 02:40:12 | INFO | src.nested_cv_avggrm_weighted_unified | Trial 229 | outer=10 | pruned after 8/10 inner folds (mean r=0.2635)
[I 2026-06-01 02:40:12,748] Trial 229 pruned. 
2026-06-01 02:40:12 | INFO | src.nested_cv_avggrm_weighted_unified | Trial 230 | outer=10 | alpha=1.017e+05 n_pcs=3500 (pc_topk) weight_search=on
2026-06-01 02:40:12 | INFO | src.nested_cv_avggrm_weighted_unified | Trial 230 | outer=10 | weight={'name': 'linear', 'floor': 1e-06, 'clip_max': 10.0, 'min_weight': 0.41492216762701617, 'max_weight': 4.158722093166785}
2026-06-01 02:40:16 | INFO | src.nested_cv_avggrm_weighted_unified | Trial 230 | outer=10 | pruned after 8/10 inner folds (mean r=0.2678)
[I 2026-06-01 02:40:16,779] Trial 230 pruned. 
2026-06-01 02:40:16 | INFO | src.nested_cv_avggrm_weighted_unified | Trial 231 | outer=10 | alpha=1.365e+05 n_pcs=4000 (pc_topk) weight_search=on
2026-06-01 02:40:16 | INFO | src.nested_cv_avggrm_weighted_unified | Trial 231 | outer=10 | weight={'name': 'linear', 'floor': 1e-06, 'clip_max': 10.0, 'min_weight': 0.06436294737461074, 'max_weight': 4.294809068370784}
[I 2026-06-01 02:40:22,722] Trial 231 finished with value: 0.23589422039477875 and parameters: {'alpha': 136536.4917498005, 'n_pcs': 4000, 'weight_scheme': 'linear', 'weight_clip_max': 10.0, 'weight_linear_min_weight': 0.06436294737461074, 'weight_linear_max_weight': 4.294809068370784}. Best is trial 222 with value: 0.23590654531055238.
2026-06-01 02:40:22 | INFO | src.nested_cv_avggrm_weighted_unified | Trial 232 | outer=10 | alpha=1.343e+05 n_pcs=4000 (pc_topk) weight_search=on
2026-06-01 02:40:22 | INFO | src.nested_cv_avggrm_weighted_unified | Trial 232 | outer=10 | weight={'name': 'linear', 'floor': 1e-06, 'clip_max': 10.0, 'min_weight': 0.06715101078861932, 'max_weight': 4.363377043511331}
[I 2026-06-01 02:40:28,525] Trial 232 finished with value: 0.23590486565896862 and parameters: {'alpha': 134259.29402115243, 'n_pcs': 4000, 'weight_scheme': 'linear', 'weight_clip_max': 10.0, 'weight_linear_min_weight': 0.06715101078861932, 'weight_linear_max_weight': 4.363377043511331}. Best is trial 222 with value: 0.23590654531055238.
2026-06-01 02:40:28 | INFO | src.nested_cv_avggrm_weighted_unified | Trial 233 | outer=10 | alpha=1.434e+05 n_pcs=4000 (pc_topk) weight_search=on
2026-06-01 02:40:28 | INFO | src.nested_cv_avggrm_weighted_unified | Trial 233 | outer=10 | weight={'name': 'linear', 'floor': 1e-06, 'clip_max': 10.0, 'min_weight': 0.06517543131569226, 'max_weight': 4.470097911423386}
[I 2026-06-01 02:40:34,904] Trial 233 finished with value: 0.23584846409087507 and parameters: {'alpha': 143424.89275330162, 'n_pcs': 4000, 'weight_scheme': 'linear', 'weight_clip_max': 10.0, 'weight_linear_min_weight': 0.06517543131569226, 'weight_linear_max_weight': 4.470097911423386}. Best is trial 222 with value: 0.23590654531055238.
2026-06-01 02:40:34 | INFO | src.nested_cv_avggrm_weighted_unified | Trial 234 | outer=10 | alpha=1.089e+05 n_pcs=4000 (pc_topk) weight_search=on
2026-06-01 02:40:34 | INFO | src.nested_cv_avggrm_weighted_unified | Trial 234 | outer=10 | weight={'name': 'linear', 'floor': 1e-06, 'clip_max': 10.0, 'min_weight': 0.08125946864533279, 'max_weight': 4.448571535219685}
2026-06-01 02:40:39 | INFO | src.nested_cv_avggrm_weighted_unified | Trial 234 | outer=10 | pruned after 8/10 inner folds (mean r=0.2698)
[I 2026-06-01 02:40:39,537] Trial 234 pruned. 
2026-06-01 02:40:39 | INFO | src.nested_cv_avggrm_weighted_unified | Trial 235 | outer=10 | alpha=1.335e+05 n_pcs=4000 (pc_topk) weight_search=on
2026-06-01 02:40:39 | INFO | src.nested_cv_avggrm_weighted_unified | Trial 235 | outer=10 | weight={'name': 'linear', 'floor': 1e-06, 'clip_max': 10.0, 'min_weight': 0.050274326928527346, 'max_weight': 4.21932036591887}
[I 2026-06-01 02:40:45,319] Trial 235 finished with value: 0.23591664455924927 and parameters: {'alpha': 133507.85611936107, 'n_pcs': 4000, 'weight_scheme': 'linear', 'weight_clip_max': 10.0, 'weight_linear_min_weight': 0.050274326928527346, 'weight_linear_max_weight': 4.21932036591887}. Best is trial 235 with value: 0.23591664455924927.
2026-06-01 02:40:45 | INFO | src.nested_cv_avggrm_weighted_unified | OUTER 10 | new best trial 235 (mean inner r=0.2359) saved to outputs/final_results/e6_pc_ridge_avggrm/thr_wing/e6_pc_ridge_avggrm_thr_wing_best_trials/split_10_best_trial.json
2026-06-01 02:40:45 | INFO | src.nested_cv_avggrm_weighted_unified | Trial 236 | outer=10 | alpha=1.736e+05 n_pcs=4000 (pc_topk) weight_search=on
2026-06-01 02:40:45 | INFO | src.nested_cv_avggrm_weighted_unified | Trial 236 | outer=10 | weight={'name': 'linear', 'floor': 1e-06, 'clip_max': 5.0, 'min_weight': 0.050438859606424746, 'max_weight': 4.178647595818535}
[I 2026-06-01 02:40:52,138] Trial 236 finished with value: 0.23536356420324905 and parameters: {'alpha': 173564.6808832646, 'n_pcs': 4000, 'weight_scheme': 'linear', 'weight_clip_max': 5.0, 'weight_linear_min_weight': 0.050438859606424746, 'weight_linear_max_weight': 4.178647595818535}. Best is trial 235 with value: 0.23591664455924927.
2026-06-01 02:40:52 | INFO | src.nested_cv_avggrm_weighted_unified | Trial 237 | outer=10 | alpha=1.125e+05 n_pcs=4000 (pc_topk) weight_search=on
2026-06-01 02:40:52 | INFO | src.nested_cv_avggrm_weighted_unified | Trial 237 | outer=10 | weight={'name': 'linear', 'floor': 1e-06, 'clip_max': 10.0, 'min_weight': 0.06717645660574079, 'max_weight': 4.019279444940864}
[I 2026-06-01 02:40:58,113] Trial 237 finished with value: 0.2358899813538154 and parameters: {'alpha': 112498.24690202189, 'n_pcs': 4000, 'weight_scheme': 'linear', 'weight_clip_max': 10.0, 'weight_linear_min_weight': 0.06717645660574079, 'weight_linear_max_weight': 4.019279444940864}. Best is trial 235 with value: 0.23591664455924927.
2026-06-01 02:40:58 | INFO | src.nested_cv_avggrm_weighted_unified | Trial 238 | outer=10 | alpha=1.357e+05 n_pcs=4000 (pc_topk) weight_search=on
2026-06-01 02:40:58 | INFO | src.nested_cv_avggrm_weighted_unified | Trial 238 | outer=10 | weight={'name': 'linear', 'floor': 1e-06, 'clip_max': 10.0, 'min_weight': 0.07115723498089273, 'max_weight': 4.045109832426752}
[I 2026-06-01 02:41:04,167] Trial 238 finished with value: 0.23588958382218977 and parameters: {'alpha': 135678.23865540233, 'n_pcs': 4000, 'weight_scheme': 'linear', 'weight_clip_max': 10.0, 'weight_linear_min_weight': 0.07115723498089273, 'weight_linear_max_weight': 4.045109832426752}. Best is trial 235 with value: 0.23591664455924927.
2026-06-01 02:41:04 | INFO | src.nested_cv_avggrm_weighted_unified | Trial 239 | outer=10 | alpha=1.512e+05 n_pcs=4000 (pc_topk) weight_search=on
2026-06-01 02:41:04 | INFO | src.nested_cv_avggrm_weighted_unified | Trial 239 | outer=10 | weight={'name': 'linear', 'floor': 1e-06, 'clip_max': 10.0, 'min_weight': 0.06803109838749336, 'max_weight': 4.281251080310423}
[I 2026-06-01 02:41:10,176] Trial 239 finished with value: 0.2357689747088921 and parameters: {'alpha': 151203.10246485422, 'n_pcs': 4000, 'weight_scheme': 'linear', 'weight_clip_max': 10.0, 'weight_linear_min_weight': 0.06803109838749336, 'weight_linear_max_weight': 4.281251080310423}. Best is trial 235 with value: 0.23591664455924927.
2026-06-01 02:41:10 | INFO | src.nested_cv_avggrm_weighted_unified | Trial 240 | outer=10 | alpha=9.107e+04 n_pcs=4000 (pc_topk) weight_search=on
2026-06-01 02:41:10 | INFO | src.nested_cv_avggrm_weighted_unified | Trial 240 | outer=10 | weight={'name': 'linear', 'floor': 1e-06, 'clip_max': 10.0, 'min_weight': 0.0666714927874217, 'max_weight': 4.285873469203527}
2026-06-01 02:41:15 | INFO | src.nested_cv_avggrm_weighted_unified | Trial 240 | outer=10 | pruned after 8/10 inner folds (mean r=0.2686)
[I 2026-06-01 02:41:15,056] Trial 240 pruned. 
2026-06-01 02:41:15 | INFO | src.nested_cv_avggrm_weighted_unified | Trial 241 | outer=10 | alpha=1.299e+05 n_pcs=4000 (pc_topk) weight_search=on
2026-06-01 02:41:15 | INFO | src.nested_cv_avggrm_weighted_unified | Trial 241 | outer=10 | weight={'name': 'linear', 'floor': 1e-06, 'clip_max': 10.0, 'min_weight': 0.08504197382847019, 'max_weight': 4.111976357562572}
[I 2026-06-01 02:41:20,805] Trial 241 finished with value: 0.23590611279292123 and parameters: {'alpha': 129943.9799819532, 'n_pcs': 4000, 'weight_scheme': 'linear', 'weight_clip_max': 10.0, 'weight_linear_min_weight': 0.08504197382847019, 'weight_linear_max_weight': 4.111976357562572}. Best is trial 235 with value: 0.23591664455924927.
2026-06-01 02:41:20 | INFO | src.nested_cv_avggrm_weighted_unified | Trial 242 | outer=10 | alpha=1.312e+05 n_pcs=4000 (pc_topk) weight_search=on
2026-06-01 02:41:20 | INFO | src.nested_cv_avggrm_weighted_unified | Trial 242 | outer=10 | weight={'name': 'linear', 'floor': 1e-06, 'clip_max': 10.0, 'min_weight': 0.07949090298360298, 'max_weight': 3.8925635695174545}
[I 2026-06-01 02:41:26,561] Trial 242 finished with value: 0.2359019395024689 and parameters: {'alpha': 131160.68261558583, 'n_pcs': 4000, 'weight_scheme': 'linear', 'weight_clip_max': 10.0, 'weight_linear_min_weight': 0.07949090298360298, 'weight_linear_max_weight': 3.8925635695174545}. Best is trial 235 with value: 0.23591664455924927.
2026-06-01 02:41:26 | INFO | src.nested_cv_avggrm_weighted_unified | Trial 243 | outer=10 | alpha=1.357e+05 n_pcs=4000 (pc_topk) weight_search=on
2026-06-01 02:41:26 | INFO | src.nested_cv_avggrm_weighted_unified | Trial 243 | outer=10 | weight={'name': 'linear', 'floor': 1e-06, 'clip_max': 10.0, 'min_weight': 0.10221248383278238, 'max_weight': 3.9134455639785135}
[I 2026-06-01 02:41:32,313] Trial 243 finished with value: 0.23584615448374202 and parameters: {'alpha': 135725.2483320537, 'n_pcs': 4000, 'weight_scheme': 'linear', 'weight_clip_max': 10.0, 'weight_linear_min_weight': 0.10221248383278238, 'weight_linear_max_weight': 3.9134455639785135}. Best is trial 235 with value: 0.23591664455924927.
2026-06-01 02:41:32 | INFO | src.nested_cv_avggrm_weighted_unified | Trial 244 | outer=10 | alpha=1.870e+05 n_pcs=4000 (pc_topk) weight_search=on
2026-06-01 02:41:32 | INFO | src.nested_cv_avggrm_weighted_unified | Trial 244 | outer=10 | weight={'name': 'linear', 'floor': 1e-06, 'clip_max': 10.0, 'min_weight': 0.08015854927836295, 'max_weight': 4.012085751912647}
[I 2026-06-01 02:41:38,061] Trial 244 finished with value: 0.23522306825584227 and parameters: {'alpha': 186956.77081038736, 'n_pcs': 4000, 'weight_scheme': 'linear', 'weight_clip_max': 10.0, 'weight_linear_min_weight': 0.08015854927836295, 'weight_linear_max_weight': 4.012085751912647}. Best is trial 235 with value: 0.23591664455924927.
2026-06-01 02:41:38 | INFO | src.nested_cv_avggrm_weighted_unified | Trial 245 | outer=10 | alpha=1.369e+05 n_pcs=4000 (pc_topk) weight_search=on
2026-06-01 02:41:38 | INFO | src.nested_cv_avggrm_weighted_unified | Trial 245 | outer=10 | weight={'name': 'linear', 'floor': 1e-06, 'clip_max': None, 'min_weight': 0.050276287081085606, 'max_weight': 4.086038083339269}
[I 2026-06-01 02:41:43,815] Trial 245 finished with value: 0.23590053432387345 and parameters: {'alpha': 136867.43471860437, 'n_pcs': 4000, 'weight_scheme': 'linear', 'weight_clip_max': None, 'weight_linear_min_weight': 0.050276287081085606, 'weight_linear_max_weight': 4.086038083339269}. Best is trial 235 with value: 0.23591664455924927.
2026-06-01 02:41:43 | INFO | src.nested_cv_avggrm_weighted_unified | Trial 246 | outer=10 | alpha=1.575e+05 n_pcs=4000 (pc_topk) weight_search=on
2026-06-01 02:41:43 | INFO | src.nested_cv_avggrm_weighted_unified | Trial 246 | outer=10 | weight={'name': 'linear', 'floor': 1e-06, 'clip_max': None, 'min_weight': 0.050499362689616065, 'max_weight': 3.890843451125183}
[I 2026-06-01 02:41:49,542] Trial 246 finished with value: 0.23571853955446703 and parameters: {'alpha': 157475.0593811457, 'n_pcs': 4000, 'weight_scheme': 'linear', 'weight_clip_max': None, 'weight_linear_min_weight': 0.050499362689616065, 'weight_linear_max_weight': 3.890843451125183}. Best is trial 235 with value: 0.23591664455924927.
2026-06-01 02:41:49 | INFO | src.nested_cv_avggrm_weighted_unified | Trial 247 | outer=10 | alpha=1.370e+05 n_pcs=4000 (pc_topk) weight_search=on
2026-06-01 02:41:49 | INFO | src.nested_cv_avggrm_weighted_unified | Trial 247 | outer=10 | weight={'name': 'linear', 'floor': 1e-06, 'clip_max': None, 'min_weight': 0.08393732999619088, 'max_weight': 4.095636123784654}
[I 2026-06-01 02:41:55,953] Trial 247 finished with value: 0.2358682324386446 and parameters: {'alpha': 136992.92155867635, 'n_pcs': 4000, 'weight_scheme': 'linear', 'weight_clip_max': None, 'weight_linear_min_weight': 0.08393732999619088, 'weight_linear_max_weight': 4.095636123784654}. Best is trial 235 with value: 0.23591664455924927.
2026-06-01 02:41:55 | INFO | src.nested_cv_avggrm_weighted_unified | Trial 248 | outer=10 | alpha=1.174e+05 n_pcs=4000 (pc_topk) weight_search=on
2026-06-01 02:41:55 | INFO | src.nested_cv_avggrm_weighted_unified | Trial 248 | outer=10 | weight={'name': 'uniform', 'floor': 1e-06, 'clip_max': None}
2026-06-01 02:41:59 | INFO | src.nested_cv_avggrm_weighted_unified | Trial 248 | outer=10 | pruned after 7/10 inner folds (mean r=0.2317)
[I 2026-06-01 02:41:59,534] Trial 248 pruned. 
2026-06-01 02:41:59 | INFO | src.nested_cv_avggrm_weighted_unified | Trial 249 | outer=10 | alpha=1.706e+05 n_pcs=4000 (pc_topk) weight_search=on
2026-06-01 02:41:59 | INFO | src.nested_cv_avggrm_weighted_unified | Trial 249 | outer=10 | weight={'name': 'linear', 'floor': 1e-06, 'clip_max': None, 'min_weight': 0.11562153365598385, 'max_weight': 4.3530198159814075}
[I 2026-06-01 02:42:05,330] Trial 249 finished with value: 0.23541231896791914 and parameters: {'alpha': 170632.2754626875, 'n_pcs': 4000, 'weight_scheme': 'linear', 'weight_clip_max': None, 'weight_linear_min_weight': 0.11562153365598385, 'weight_linear_max_weight': 4.3530198159814075}. Best is trial 235 with value: 0.23591664455924927.
2026-06-01 02:42:05 | INFO | src.nested_cv_avggrm_weighted_unified | Trial 250 | outer=10 | alpha=2.202e+05 n_pcs=4000 (pc_topk) weight_search=on
2026-06-01 02:42:05 | INFO | src.nested_cv_avggrm_weighted_unified | Trial 250 | outer=10 | weight={'name': 'linear', 'floor': 1e-06, 'clip_max': 10.0, 'min_weight': 0.064831513402417, 'max_weight': 4.203318647912006}
[I 2026-06-01 02:42:11,207] Trial 250 finished with value: 0.2346962229947626 and parameters: {'alpha': 220220.22920028956, 'n_pcs': 4000, 'weight_scheme': 'linear', 'weight_clip_max': 10.0, 'weight_linear_min_weight': 0.064831513402417, 'weight_linear_max_weight': 4.203318647912006}. Best is trial 235 with value: 0.23591664455924927.
2026-06-01 02:42:11 | INFO | src.nested_cv_avggrm_weighted_unified | Trial 251 | outer=10 | alpha=9.504e+04 n_pcs=4000 (pc_topk) weight_search=on
2026-06-01 02:42:11 | INFO | src.nested_cv_avggrm_weighted_unified | Trial 251 | outer=10 | weight={'name': 'linear', 'floor': 1e-06, 'clip_max': 10.0, 'min_weight': 0.05054325484393969, 'max_weight': 4.087086453035721}
2026-06-01 02:42:15 | INFO | src.nested_cv_avggrm_weighted_unified | Trial 251 | outer=10 | pruned after 8/10 inner folds (mean r=0.2689)
[I 2026-06-01 02:42:15,845] Trial 251 pruned. 
2026-06-01 02:42:15 | INFO | src.nested_cv_avggrm_weighted_unified | Trial 252 | outer=10 | alpha=1.304e+05 n_pcs=4000 (pc_topk) weight_search=on
2026-06-01 02:42:15 | INFO | src.nested_cv_avggrm_weighted_unified | Trial 252 | outer=10 | weight={'name': 'linear', 'floor': 1e-06, 'clip_max': None, 'min_weight': 0.09652457486669369, 'max_weight': 4.057201850667898}
[I 2026-06-01 02:42:21,639] Trial 252 finished with value: 0.23589124441084336 and parameters: {'alpha': 130406.0788424286, 'n_pcs': 4000, 'weight_scheme': 'linear', 'weight_clip_max': None, 'weight_linear_min_weight': 0.09652457486669369, 'weight_linear_max_weight': 4.057201850667898}. Best is trial 235 with value: 0.23591664455924927.
2026-06-01 02:42:21 | INFO | src.nested_cv_avggrm_weighted_unified | Trial 253 | outer=10 | alpha=1.369e+05 n_pcs=4000 (pc_topk) weight_search=on
2026-06-01 02:42:21 | INFO | src.nested_cv_avggrm_weighted_unified | Trial 253 | outer=10 | weight={'name': 'linear', 'floor': 1e-06, 'clip_max': None, 'min_weight': 0.09848738760503986, 'max_weight': 3.914375962286748}
