[I 2026-06-01 01:34:15,444] Trial 299 finished with value: 0.22574040283083813 and parameters: {'alpha': 31878.32458917131, 'n_pcs': 5000, 'weight_scheme': 'linear', 'weight_clip_max': 10.0, 'weight_linear_min_weight': 0.26406037280711975, 'weight_linear_max_weight': 3.98119721519352}. Best is trial 280 with value: 0.2287757813831091.
2026-06-01 01:34:15 | INFO | src.nested_cv_avggrm_weighted_unified | OUTER 7 best (inner mean r=0.2288): {'model_type': 'pc_ridge', 'alpha': 49430.87757657087, 'n_pcs': 4500, 'use_snp_selection': True, 'num_snps': 4500, 'feature_mode': 'pc_topk', 'weighting': {'name': 'linear', 'floor': 1e-06, 'clip_max': 10.0, 'min_weight': 0.2515303641845996, 'max_weight': 3.9546011693181757}}
2026-06-01 01:34:16 | INFO | src.nested_cv_avggrm_weighted_unified | OUTER 7 TEST r = 0.3566
2026-06-01 01:34:16 | INFO | src.nested_cv_avggrm_weighted_unified | OUTER 7 incremental summary saved to outputs/final_results/e6_pc_ridge_avggrm/thr_wing/e6_pc_ridge_avggrm_thr_wing_results.json
2026-06-01 01:34:16 | INFO | src.nested_cv_avggrm_weighted_unified | OUTER 8: test_size=256 island=7 (Onøy og Lurøy)
2026-06-01 01:34:16 | INFO | src.nested_cv_avggrm_weighted_unified | OUTER 8: inner LOIO validation islands: 0(Nesøy), 1(Myken), 2(Træna), 3(Selvær), 4(Gjerøy), 5(Hestmannøy), 6(Indre Kvarøy), 8(Lovund), 9(Sleneset), 10(Aldra), 11(Leka), 12(Vega), 13(Vikna), 14(Lauvøya)
2026-06-01 01:34:16 | INFO | src.nested_cv_avggrm_weighted_unified | OUTER 8: using top 10 related inner validation islands for tuning: 9(Sleneset, avgGRM=0.0092), 8(Lovund, avgGRM=0.0058), 6(Indre Kvarøy, avgGRM=0.0042), 5(Hestmannøy, avgGRM=0.0026), 0(Nesøy, avgGRM=0.0025), 1(Myken, avgGRM=0.0024), 2(Træna, avgGRM=0.0024), 3(Selvær, avgGRM=0.0018), 10(Aldra, avgGRM=0.0011), 4(Gjerøy, avgGRM=0.0002)
[I 2026-06-01 01:34:16,203] A new study created in memory with name: ridge_inner_outer7
2026-06-01 01:34:16 | INFO | src.nested_cv_avggrm_weighted_unified | Trial 0 | outer=8 | alpha=1.137e+05 n_pcs=4000 (pc_topk) weight_search=on
2026-06-01 01:34:16 | INFO | src.nested_cv_avggrm_weighted_unified | Trial 0 | outer=8 | weight={'name': 'uniform', 'floor': 1e-06, 'clip_max': None}
[I 2026-06-01 01:34:21,373] Trial 0 finished with value: 0.20743618155294102 and parameters: {'alpha': 113703.38004442609, 'n_pcs': 4000, 'weight_scheme': 'uniform', 'weight_clip_max': None}. Best is trial 0 with value: 0.20743618155294102.
2026-06-01 01:34:21 | INFO | src.nested_cv_avggrm_weighted_unified | OUTER 8 | new best trial 0 (mean inner r=0.2074) saved to outputs/final_results/e6_pc_ridge_avggrm/thr_wing/e6_pc_ridge_avggrm_thr_wing_best_trials/split_08_best_trial.json
2026-06-01 01:34:21 | INFO | src.nested_cv_avggrm_weighted_unified | Trial 1 | outer=8 | alpha=1.682e+06 n_pcs=2000 (pc_topk) weight_search=on
2026-06-01 01:34:21 | INFO | src.nested_cv_avggrm_weighted_unified | Trial 1 | outer=8 | weight={'name': 'exponential', 'floor': 1e-06, 'clip_max': 3.0, 'beta': 8.711469579953913}
[I 2026-06-01 01:34:24,461] Trial 1 finished with value: 0.216003712345708 and parameters: {'alpha': 1682385.170967095, 'n_pcs': 2000, 'weight_scheme': 'exponential', 'weight_clip_max': 3.0, 'weight_exponential_beta': 8.711469579953913}. Best is trial 1 with value: 0.216003712345708.
2026-06-01 01:34:24 | INFO | src.nested_cv_avggrm_weighted_unified | OUTER 8 | new best trial 1 (mean inner r=0.2160) saved to outputs/final_results/e6_pc_ridge_avggrm/thr_wing/e6_pc_ridge_avggrm_thr_wing_best_trials/split_08_best_trial.json
2026-06-01 01:34:24 | INFO | src.nested_cv_avggrm_weighted_unified | Trial 2 | outer=8 | alpha=2.757e+03 n_pcs=2000 (pc_topk) weight_search=on
2026-06-01 01:34:24 | INFO | src.nested_cv_avggrm_weighted_unified | Trial 2 | outer=8 | weight={'name': 'linear', 'floor': 1e-06, 'clip_max': 20.0, 'min_weight': 0.12918170299726892, 'max_weight': 3.9862564805616327}
[I 2026-06-01 01:34:27,190] Trial 2 finished with value: 0.15440026680562183 and parameters: {'alpha': 2757.0504493185063, 'n_pcs': 2000, 'weight_scheme': 'linear', 'weight_clip_max': 20.0, 'weight_linear_min_weight': 0.12918170299726892, 'weight_linear_max_weight': 3.9862564805616327}. Best is trial 1 with value: 0.216003712345708.
2026-06-01 01:34:27 | INFO | src.nested_cv_avggrm_weighted_unified | Trial 3 | outer=8 | alpha=1.776e+03 n_pcs=4000 (pc_topk) weight_search=on
2026-06-01 01:34:27 | INFO | src.nested_cv_avggrm_weighted_unified | Trial 3 | outer=8 | weight={'name': 'exponential', 'floor': 1e-06, 'clip_max': 10.0, 'beta': 0.563604612251006}
[I 2026-06-01 01:34:32,942] Trial 3 finished with value: 0.13684285531381885 and parameters: {'alpha': 1775.825123718637, 'n_pcs': 4000, 'weight_scheme': 'exponential', 'weight_clip_max': 10.0, 'weight_exponential_beta': 0.563604612251006}. Best is trial 1 with value: 0.216003712345708.
2026-06-01 01:34:32 | INFO | src.nested_cv_avggrm_weighted_unified | Trial 4 | outer=8 | alpha=1.835e+04 n_pcs=5000 (pc_topk) weight_search=on
2026-06-01 01:34:32 | INFO | src.nested_cv_avggrm_weighted_unified | Trial 4 | outer=8 | weight={'name': 'exponential', 'floor': 1e-06, 'clip_max': None, 'beta': 9.957095048208117}
[I 2026-06-01 01:34:40,893] Trial 4 finished with value: 0.2053385482382843 and parameters: {'alpha': 18351.68801260339, 'n_pcs': 5000, 'weight_scheme': 'exponential', 'weight_clip_max': None, 'weight_exponential_beta': 9.957095048208117}. Best is trial 1 with value: 0.216003712345708.
2026-06-01 01:34:40 | INFO | src.nested_cv_avggrm_weighted_unified | Trial 5 | outer=8 | alpha=9.696e+03 n_pcs=1000 (pc_topk) weight_search=on
2026-06-01 01:34:40 | INFO | src.nested_cv_avggrm_weighted_unified | Trial 5 | outer=8 | weight={'name': 'exponential', 'floor': 1e-06, 'clip_max': 3.0, 'beta': 1.5726039441128932}
[I 2026-06-01 01:34:42,801] Trial 5 finished with value: 0.18971174386762713 and parameters: {'alpha': 9695.792837096258, 'n_pcs': 1000, 'weight_scheme': 'exponential', 'weight_clip_max': 3.0, 'weight_exponential_beta': 1.5726039441128932}. Best is trial 1 with value: 0.216003712345708.
2026-06-01 01:34:42 | INFO | src.nested_cv_avggrm_weighted_unified | Trial 6 | outer=8 | alpha=6.320e+04 n_pcs=2500 (pc_topk) weight_search=on
2026-06-01 01:34:42 | INFO | src.nested_cv_avggrm_weighted_unified | Trial 6 | outer=8 | weight={'name': 'uniform', 'floor': 1e-06, 'clip_max': 10.0}
[I 2026-06-01 01:34:45,490] Trial 6 finished with value: 0.2108265928306393 and parameters: {'alpha': 63199.5851103866, 'n_pcs': 2500, 'weight_scheme': 'uniform', 'weight_clip_max': 10.0}. Best is trial 1 with value: 0.216003712345708.
2026-06-01 01:34:45 | INFO | src.nested_cv_avggrm_weighted_unified | Trial 7 | outer=8 | alpha=4.681e+04 n_pcs=2500 (pc_topk) weight_search=on
2026-06-01 01:34:45 | INFO | src.nested_cv_avggrm_weighted_unified | Trial 7 | outer=8 | weight={'name': 'linear', 'floor': 1e-06, 'clip_max': 3.0, 'min_weight': 0.13798029304672477, 'max_weight': 3.0957974174373546}
[I 2026-06-01 01:34:48,679] Trial 7 finished with value: 0.2138933390268681 and parameters: {'alpha': 46806.97703257331, 'n_pcs': 2500, 'weight_scheme': 'linear', 'weight_clip_max': 3.0, 'weight_linear_min_weight': 0.13798029304672477, 'weight_linear_max_weight': 3.0957974174373546}. Best is trial 1 with value: 0.216003712345708.
2026-06-01 01:34:48 | INFO | src.nested_cv_avggrm_weighted_unified | Trial 8 | outer=8 | alpha=5.456e+04 n_pcs=3000 (pc_topk) weight_search=on
2026-06-01 01:34:48 | INFO | src.nested_cv_avggrm_weighted_unified | Trial 8 | outer=8 | weight={'name': 'linear', 'floor': 1e-06, 'clip_max': 5.0, 'min_weight': 0.6690067570691431, 'max_weight': 4.8744640334054115}
[I 2026-06-01 01:34:52,533] Trial 8 finished with value: 0.21826546434761446 and parameters: {'alpha': 54559.68395210245, 'n_pcs': 3000, 'weight_scheme': 'linear', 'weight_clip_max': 5.0, 'weight_linear_min_weight': 0.6690067570691431, 'weight_linear_max_weight': 4.8744640334054115}. Best is trial 8 with value: 0.21826546434761446.
2026-06-01 01:34:52 | INFO | src.nested_cv_avggrm_weighted_unified | OUTER 8 | new best trial 8 (mean inner r=0.2183) saved to outputs/final_results/e6_pc_ridge_avggrm/thr_wing/e6_pc_ridge_avggrm_thr_wing_best_trials/split_08_best_trial.json
2026-06-01 01:34:52 | INFO | src.nested_cv_avggrm_weighted_unified | Trial 9 | outer=8 | alpha=8.868e+03 n_pcs=2000 (pc_topk) weight_search=on
2026-06-01 01:34:52 | INFO | src.nested_cv_avggrm_weighted_unified | Trial 9 | outer=8 | weight={'name': 'linear', 'floor': 1e-06, 'clip_max': 20.0, 'min_weight': 0.861124149305412, 'max_weight': 4.702809729786679}
2026-06-01 01:34:54 | INFO | src.nested_cv_avggrm_weighted_unified | Trial 9 | outer=8 | pruned after 7/10 inner folds (mean r=0.1832)
[I 2026-06-01 01:34:54,457] Trial 9 pruned. 
2026-06-01 01:34:54 | INFO | src.nested_cv_avggrm_weighted_unified | Trial 10 | outer=8 | alpha=5.986e+05 n_pcs=500 (pc_topk) weight_search=on
2026-06-01 01:34:54 | INFO | src.nested_cv_avggrm_weighted_unified | Trial 10 | outer=8 | weight={'name': 'linear', 'floor': 1e-06, 'clip_max': 5.0, 'min_weight': 0.6649918033453551, 'max_weight': 1.3005022441588598}
2026-06-01 01:34:54 | INFO | src.nested_cv_avggrm_weighted_unified | Trial 10 | outer=8 | pruned after 5/10 inner folds (mean r=0.1661)
[I 2026-06-01 01:34:54,999] Trial 10 pruned. 
2026-06-01 01:34:55 | INFO | src.nested_cv_avggrm_weighted_unified | Trial 11 | outer=8 | alpha=9.820e+06 n_pcs=3500 (pc_topk) weight_search=on
2026-06-01 01:34:55 | INFO | src.nested_cv_avggrm_weighted_unified | Trial 11 | outer=8 | weight={'name': 'exponential', 'floor': 1e-06, 'clip_max': 5.0, 'beta': 8.928948956746435}
[I 2026-06-01 01:34:59,961] Trial 11 finished with value: 0.20802019259614787 and parameters: {'alpha': 9819751.211795544, 'n_pcs': 3500, 'weight_scheme': 'exponential', 'weight_clip_max': 5.0, 'weight_exponential_beta': 8.928948956746435}. Best is trial 8 with value: 0.21826546434761446.
2026-06-01 01:34:59 | INFO | src.nested_cv_avggrm_weighted_unified | Trial 12 | outer=8 | alpha=8.246e+05 n_pcs=1500 (pc_topk) weight_search=on
2026-06-01 01:34:59 | INFO | src.nested_cv_avggrm_weighted_unified | Trial 12 | outer=8 | weight={'name': 'exponential', 'floor': 1e-06, 'clip_max': 3.0, 'beta': 5.982934772883383}
[I 2026-06-01 01:35:01,961] Trial 12 finished with value: 0.21303049110756106 and parameters: {'alpha': 824606.3021630079, 'n_pcs': 1500, 'weight_scheme': 'exponential', 'weight_clip_max': 3.0, 'weight_exponential_beta': 5.982934772883383}. Best is trial 8 with value: 0.21826546434761446.
2026-06-01 01:35:01 | INFO | src.nested_cv_avggrm_weighted_unified | Trial 13 | outer=8 | alpha=5.945e+05 n_pcs=3000 (pc_topk) weight_search=on
2026-06-01 01:35:01 | INFO | src.nested_cv_avggrm_weighted_unified | Trial 13 | outer=8 | weight={'name': 'linear', 'floor': 1e-06, 'clip_max': 5.0, 'min_weight': 0.44725940969778444, 'max_weight': 1.689579879242048}
[I 2026-06-01 01:35:05,950] Trial 13 finished with value: 0.20509819104362187 and parameters: {'alpha': 594462.3939741419, 'n_pcs': 3000, 'weight_scheme': 'linear', 'weight_clip_max': 5.0, 'weight_linear_min_weight': 0.44725940969778444, 'weight_linear_max_weight': 1.689579879242048}. Best is trial 8 with value: 0.21826546434761446.
2026-06-01 01:35:05 | INFO | src.nested_cv_avggrm_weighted_unified | Trial 14 | outer=8 | alpha=6.828e+06 n_pcs=3000 (pc_topk) weight_search=on
2026-06-01 01:35:05 | INFO | src.nested_cv_avggrm_weighted_unified | Trial 14 | outer=8 | weight={'name': 'uniform', 'floor': 1e-06, 'clip_max': 5.0}
2026-06-01 01:35:07 | INFO | src.nested_cv_avggrm_weighted_unified | Trial 14 | outer=8 | pruned after 5/10 inner folds (mean r=0.1789)
[I 2026-06-01 01:35:07,601] Trial 14 pruned. 
2026-06-01 01:35:07 | INFO | src.nested_cv_avggrm_weighted_unified | Trial 15 | outer=8 | alpha=2.575e+06 n_pcs=1500 (pc_topk) weight_search=on
2026-06-01 01:35:07 | INFO | src.nested_cv_avggrm_weighted_unified | Trial 15 | outer=8 | weight={'name': 'linear', 'floor': 1e-06, 'clip_max': 3.0, 'min_weight': 0.9689803782581343, 'max_weight': 4.9100809859168315}
2026-06-01 01:35:08 | INFO | src.nested_cv_avggrm_weighted_unified | Trial 15 | outer=8 | pruned after 5/10 inner folds (mean r=0.2050)
[I 2026-06-01 01:35:08,447] Trial 15 pruned. 
2026-06-01 01:35:08 | INFO | src.nested_cv_avggrm_weighted_unified | Trial 16 | outer=8 | alpha=1.971e+05 n_pcs=4000 (pc_topk) weight_search=on
2026-06-01 01:35:08 | INFO | src.nested_cv_avggrm_weighted_unified | Trial 16 | outer=8 | weight={'name': 'exponential', 'floor': 1e-06, 'clip_max': 5.0, 'beta': 6.257422035595178}
[I 2026-06-01 01:35:14,168] Trial 16 finished with value: 0.2230252978147868 and parameters: {'alpha': 197062.07683822478, 'n_pcs': 4000, 'weight_scheme': 'exponential', 'weight_clip_max': 5.0, 'weight_exponential_beta': 6.257422035595178}. Best is trial 16 with value: 0.2230252978147868.
2026-06-01 01:35:14 | INFO | src.nested_cv_avggrm_weighted_unified | OUTER 8 | new best trial 16 (mean inner r=0.2230) saved to outputs/final_results/e6_pc_ridge_avggrm/thr_wing/e6_pc_ridge_avggrm_thr_wing_best_trials/split_08_best_trial.json
2026-06-01 01:35:14 | INFO | src.nested_cv_avggrm_weighted_unified | Trial 17 | outer=8 | alpha=1.429e+05 n_pcs=5000 (pc_topk) weight_search=on
2026-06-01 01:35:14 | INFO | src.nested_cv_avggrm_weighted_unified | Trial 17 | outer=8 | weight={'name': 'exponential', 'floor': 1e-06, 'clip_max': 5.0, 'beta': 4.7609444110373085}
[I 2026-06-01 01:35:22,206] Trial 17 finished with value: 0.22132901618741047 and parameters: {'alpha': 142925.80558027924, 'n_pcs': 5000, 'weight_scheme': 'exponential', 'weight_clip_max': 5.0, 'weight_exponential_beta': 4.7609444110373085}. Best is trial 16 with value: 0.2230252978147868.
2026-06-01 01:35:22 | INFO | src.nested_cv_avggrm_weighted_unified | Trial 18 | outer=8 | alpha=1.758e+05 n_pcs=5000 (pc_topk) weight_search=on
2026-06-01 01:35:22 | INFO | src.nested_cv_avggrm_weighted_unified | Trial 18 | outer=8 | weight={'name': 'exponential', 'floor': 1e-06, 'clip_max': 5.0, 'beta': 4.760399744704552}
[I 2026-06-01 01:35:30,207] Trial 18 finished with value: 0.22111539214845632 and parameters: {'alpha': 175775.55039751038, 'n_pcs': 5000, 'weight_scheme': 'exponential', 'weight_clip_max': 5.0, 'weight_exponential_beta': 4.760399744704552}. Best is trial 16 with value: 0.2230252978147868.
2026-06-01 01:35:30 | INFO | src.nested_cv_avggrm_weighted_unified | Trial 19 | outer=8 | alpha=2.750e+05 n_pcs=4500 (pc_topk) weight_search=on
2026-06-01 01:35:30 | INFO | src.nested_cv_avggrm_weighted_unified | Trial 19 | outer=8 | weight={'name': 'exponential', 'floor': 1e-06, 'clip_max': 5.0, 'beta': 5.124407753064943}
[I 2026-06-01 01:35:37,046] Trial 19 finished with value: 0.2215767289647753 and parameters: {'alpha': 274975.166841956, 'n_pcs': 4500, 'weight_scheme': 'exponential', 'weight_clip_max': 5.0, 'weight_exponential_beta': 5.124407753064943}. Best is trial 16 with value: 0.2230252978147868.
2026-06-01 01:35:37 | INFO | src.nested_cv_avggrm_weighted_unified | Trial 20 | outer=8 | alpha=3.003e+05 n_pcs=4000 (pc_topk) weight_search=on
2026-06-01 01:35:37 | INFO | src.nested_cv_avggrm_weighted_unified | Trial 20 | outer=8 | weight={'name': 'exponential', 'floor': 1e-06, 'clip_max': 5.0, 'beta': 6.589285077096443}
[I 2026-06-01 01:35:42,768] Trial 20 finished with value: 0.22270829209237664 and parameters: {'alpha': 300298.03378528677, 'n_pcs': 4000, 'weight_scheme': 'exponential', 'weight_clip_max': 5.0, 'weight_exponential_beta': 6.589285077096443}. Best is trial 16 with value: 0.2230252978147868.
2026-06-01 01:35:42 | INFO | src.nested_cv_avggrm_weighted_unified | Trial 21 | outer=8 | alpha=2.529e+05 n_pcs=4000 (pc_topk) weight_search=on
2026-06-01 01:35:42 | INFO | src.nested_cv_avggrm_weighted_unified | Trial 21 | outer=8 | weight={'name': 'exponential', 'floor': 1e-06, 'clip_max': 5.0, 'beta': 6.399014959933055}
[I 2026-06-01 01:35:48,422] Trial 21 finished with value: 0.22291312695478016 and parameters: {'alpha': 252944.45213961488, 'n_pcs': 4000, 'weight_scheme': 'exponential', 'weight_clip_max': 5.0, 'weight_exponential_beta': 6.399014959933055}. Best is trial 16 with value: 0.2230252978147868.
2026-06-01 01:35:48 | INFO | src.nested_cv_avggrm_weighted_unified | Trial 22 | outer=8 | alpha=3.123e+05 n_pcs=4000 (pc_topk) weight_search=on
2026-06-01 01:35:48 | INFO | src.nested_cv_avggrm_weighted_unified | Trial 22 | outer=8 | weight={'name': 'exponential', 'floor': 1e-06, 'clip_max': 5.0, 'beta': 6.974422999094264}
[I 2026-06-01 01:35:54,245] Trial 22 finished with value: 0.22264068348702387 and parameters: {'alpha': 312318.8050715251, 'n_pcs': 4000, 'weight_scheme': 'exponential', 'weight_clip_max': 5.0, 'weight_exponential_beta': 6.974422999094264}. Best is trial 16 with value: 0.2230252978147868.
2026-06-01 01:35:54 | INFO | src.nested_cv_avggrm_weighted_unified | Trial 23 | outer=8 | alpha=1.902e+06 n_pcs=3500 (pc_topk) weight_search=on
2026-06-01 01:35:54 | INFO | src.nested_cv_avggrm_weighted_unified | Trial 23 | outer=8 | weight={'name': 'exponential', 'floor': 1e-06, 'clip_max': 5.0, 'beta': 7.170834769892776}
[I 2026-06-01 01:35:59,064] Trial 23 finished with value: 0.21495617246047222 and parameters: {'alpha': 1902283.3594080245, 'n_pcs': 3500, 'weight_scheme': 'exponential', 'weight_clip_max': 5.0, 'weight_exponential_beta': 7.170834769892776}. Best is trial 16 with value: 0.2230252978147868.
2026-06-01 01:35:59 | INFO | src.nested_cv_avggrm_weighted_unified | Trial 24 | outer=8 | alpha=3.268e+04 n_pcs=4500 (pc_topk) weight_search=on
2026-06-01 01:35:59 | INFO | src.nested_cv_avggrm_weighted_unified | Trial 24 | outer=8 | weight={'name': 'exponential', 'floor': 1e-06, 'clip_max': None, 'beta': 6.709237262606126}
[I 2026-06-01 01:36:05,938] Trial 24 finished with value: 0.21113433692825567 and parameters: {'alpha': 32677.972743044204, 'n_pcs': 4500, 'weight_scheme': 'exponential', 'weight_clip_max': None, 'weight_exponential_beta': 6.709237262606126}. Best is trial 16 with value: 0.2230252978147868.
2026-06-01 01:36:05 | INFO | src.nested_cv_avggrm_weighted_unified | Trial 25 | outer=8 | alpha=3.010e+05 n_pcs=3500 (pc_topk) weight_search=on
2026-06-01 01:36:05 | INFO | src.nested_cv_avggrm_weighted_unified | Trial 25 | outer=8 | weight={'name': 'exponential', 'floor': 1e-06, 'clip_max': 20.0, 'beta': 2.7286102892588895}
[I 2026-06-01 01:36:10,782] Trial 25 finished with value: 0.2136521442108219 and parameters: {'alpha': 300966.1356716839, 'n_pcs': 3500, 'weight_scheme': 'exponential', 'weight_clip_max': 20.0, 'weight_exponential_beta': 2.7286102892588895}. Best is trial 16 with value: 0.2230252978147868.
2026-06-01 01:36:10 | INFO | src.nested_cv_avggrm_weighted_unified | Trial 26 | outer=8 | alpha=7.658e+05 n_pcs=4500 (pc_topk) weight_search=on
2026-06-01 01:36:10 | INFO | src.nested_cv_avggrm_weighted_unified | Trial 26 | outer=8 | weight={'name': 'uniform', 'floor': 1e-06, 'clip_max': 5.0}
2026-06-01 01:36:13 | INFO | src.nested_cv_avggrm_weighted_unified | Trial 26 | outer=8 | pruned after 5/10 inner folds (mean r=0.1904)
[I 2026-06-01 01:36:13,814] Trial 26 pruned. 
2026-06-01 01:36:13 | INFO | src.nested_cv_avggrm_weighted_unified | Trial 27 | outer=8 | alpha=9.729e+04 n_pcs=4000 (pc_topk) weight_search=on
2026-06-01 01:36:13 | INFO | src.nested_cv_avggrm_weighted_unified | Trial 27 | outer=8 | weight={'name': 'exponential', 'floor': 1e-06, 'clip_max': 10.0, 'beta': 3.757780192784344}
[I 2026-06-01 01:36:19,559] Trial 27 finished with value: 0.21763090839037097 and parameters: {'alpha': 97287.3637987232, 'n_pcs': 4000, 'weight_scheme': 'exponential', 'weight_clip_max': 10.0, 'weight_exponential_beta': 3.757780192784344}. Best is trial 16 with value: 0.2230252978147868.
2026-06-01 01:36:19 | INFO | src.nested_cv_avggrm_weighted_unified | Trial 28 | outer=8 | alpha=1.228e+06 n_pcs=3500 (pc_topk) weight_search=on
2026-06-01 01:36:19 | INFO | src.nested_cv_avggrm_weighted_unified | Trial 28 | outer=8 | weight={'name': 'exponential', 'floor': 1e-06, 'clip_max': 5.0, 'beta': 8.298650354898447}
[I 2026-06-01 01:36:24,384] Trial 28 finished with value: 0.21770517185835975 and parameters: {'alpha': 1228313.2447262288, 'n_pcs': 3500, 'weight_scheme': 'exponential', 'weight_clip_max': 5.0, 'weight_exponential_beta': 8.298650354898447}. Best is trial 16 with value: 0.2230252978147868.
2026-06-01 01:36:24 | INFO | src.nested_cv_avggrm_weighted_unified | Trial 29 | outer=8 | alpha=3.271e+06 n_pcs=4500 (pc_topk) weight_search=on
2026-06-01 01:36:24 | INFO | src.nested_cv_avggrm_weighted_unified | Trial 29 | outer=8 | weight={'name': 'uniform', 'floor': 1e-06, 'clip_max': None}
2026-06-01 01:36:27 | INFO | src.nested_cv_avggrm_weighted_unified | Trial 29 | outer=8 | pruned after 5/10 inner folds (mean r=0.1788)
[I 2026-06-01 01:36:27,404] Trial 29 pruned. 
2026-06-01 01:36:27 | INFO | src.nested_cv_avggrm_weighted_unified | Trial 30 | outer=8 | alpha=1.067e+05 n_pcs=4000 (pc_topk) weight_search=on
2026-06-01 01:36:27 | INFO | src.nested_cv_avggrm_weighted_unified | Trial 30 | outer=8 | weight={'name': 'exponential', 'floor': 1e-06, 'clip_max': 5.0, 'beta': 5.728917938356823}
[I 2026-06-01 01:36:33,101] Trial 30 finished with value: 0.2224374107594525 and parameters: {'alpha': 106738.4352527964, 'n_pcs': 4000, 'weight_scheme': 'exponential', 'weight_clip_max': 5.0, 'weight_exponential_beta': 5.728917938356823}. Best is trial 16 with value: 0.2230252978147868.
2026-06-01 01:36:33 | INFO | src.nested_cv_avggrm_weighted_unified | Trial 31 | outer=8 | alpha=3.091e+05 n_pcs=4000 (pc_topk) weight_search=on
2026-06-01 01:36:33 | INFO | src.nested_cv_avggrm_weighted_unified | Trial 31 | outer=8 | weight={'name': 'exponential', 'floor': 1e-06, 'clip_max': 5.0, 'beta': 7.430641993254369}
