[I 2026-05-31 23:55:03,305] Trial 49 pruned. 
2026-05-31 23:55:03 | INFO | src.nested_cv_avggrm_weighted_unified | Trial 50 | outer=4 | alpha=2.852e+04 n_pcs=4500 (pc_topk) weight_search=on
2026-05-31 23:55:03 | INFO | src.nested_cv_avggrm_weighted_unified | Trial 50 | outer=4 | weight={'name': 'linear', 'floor': 1e-06, 'clip_max': 20.0, 'min_weight': 0.07746660983847886, 'max_weight': 2.8713982935271773}
2026-05-31 23:55:07 | INFO | src.nested_cv_avggrm_weighted_unified | Trial 50 | outer=4 | pruned after 6/10 inner folds (mean r=0.1899)
[I 2026-05-31 23:55:07,454] Trial 50 pruned. 
2026-05-31 23:55:07 | INFO | src.nested_cv_avggrm_weighted_unified | Trial 51 | outer=4 | alpha=5.002e+04 n_pcs=4000 (pc_topk) weight_search=on
2026-05-31 23:55:07 | INFO | src.nested_cv_avggrm_weighted_unified | Trial 51 | outer=4 | weight={'name': 'linear', 'floor': 1e-06, 'clip_max': None, 'min_weight': 0.3685323743412661, 'max_weight': 3.73969807766519}
2026-05-31 23:55:10 | INFO | src.nested_cv_avggrm_weighted_unified | Trial 51 | outer=4 | pruned after 6/10 inner folds (mean r=0.1980)
[I 2026-05-31 23:55:10,899] Trial 51 pruned. 
2026-05-31 23:55:10 | INFO | src.nested_cv_avggrm_weighted_unified | Trial 52 | outer=4 | alpha=8.995e+04 n_pcs=4500 (pc_topk) weight_search=on
2026-05-31 23:55:10 | INFO | src.nested_cv_avggrm_weighted_unified | Trial 52 | outer=4 | weight={'name': 'linear', 'floor': 1e-06, 'clip_max': None, 'min_weight': 0.5149564328514151, 'max_weight': 3.2339036050754766}
[I 2026-05-31 23:55:17,833] Trial 52 finished with value: 0.1976616630384743 and parameters: {'alpha': 89947.18833346067, 'n_pcs': 4500, 'weight_scheme': 'linear', 'weight_clip_max': None, 'weight_linear_min_weight': 0.5149564328514151, 'weight_linear_max_weight': 3.2339036050754766}. Best is trial 41 with value: 0.19810774778548906.
2026-05-31 23:55:17 | INFO | src.nested_cv_avggrm_weighted_unified | Trial 53 | outer=4 | alpha=1.790e+05 n_pcs=5000 (pc_topk) weight_search=on
2026-05-31 23:55:17 | INFO | src.nested_cv_avggrm_weighted_unified | Trial 53 | outer=4 | weight={'name': 'linear', 'floor': 1e-06, 'clip_max': None, 'min_weight': 0.5385274719680962, 'max_weight': 3.2556547951180526}
[I 2026-05-31 23:55:26,041] Trial 53 finished with value: 0.19305721227544148 and parameters: {'alpha': 179022.1167734289, 'n_pcs': 5000, 'weight_scheme': 'linear', 'weight_clip_max': None, 'weight_linear_min_weight': 0.5385274719680962, 'weight_linear_max_weight': 3.2556547951180526}. Best is trial 41 with value: 0.19810774778548906.
2026-05-31 23:55:26 | INFO | src.nested_cv_avggrm_weighted_unified | Trial 54 | outer=4 | alpha=1.310e+04 n_pcs=4500 (pc_topk) weight_search=on
2026-05-31 23:55:26 | INFO | src.nested_cv_avggrm_weighted_unified | Trial 54 | outer=4 | weight={'name': 'linear', 'floor': 1e-06, 'clip_max': None, 'min_weight': 0.4740578561645016, 'max_weight': 3.1625564540679827}
2026-05-31 23:55:30 | INFO | src.nested_cv_avggrm_weighted_unified | Trial 54 | outer=4 | pruned after 6/10 inner folds (mean r=0.1810)
[I 2026-05-31 23:55:30,253] Trial 54 pruned. 
2026-05-31 23:55:30 | INFO | src.nested_cv_avggrm_weighted_unified | Trial 55 | outer=4 | alpha=4.521e+04 n_pcs=500 (pc_topk) weight_search=on
2026-05-31 23:55:30 | INFO | src.nested_cv_avggrm_weighted_unified | Trial 55 | outer=4 | weight={'name': 'linear', 'floor': 1e-06, 'clip_max': 3.0, 'min_weight': 0.6332791078659199, 'max_weight': 3.4354878869819006}
2026-05-31 23:55:30 | INFO | src.nested_cv_avggrm_weighted_unified | Trial 55 | outer=4 | pruned after 5/10 inner folds (mean r=0.1249)
[I 2026-05-31 23:55:30,752] Trial 55 pruned. 
2026-05-31 23:55:30 | INFO | src.nested_cv_avggrm_weighted_unified | Trial 56 | outer=4 | alpha=8.919e+04 n_pcs=5000 (pc_topk) weight_search=on
2026-05-31 23:55:30 | INFO | src.nested_cv_avggrm_weighted_unified | Trial 56 | outer=4 | weight={'name': 'linear', 'floor': 1e-06, 'clip_max': None, 'min_weight': 0.5108285826635233, 'max_weight': 2.849497414769735}
[I 2026-05-31 23:55:38,993] Trial 56 finished with value: 0.19619904569591518 and parameters: {'alpha': 89185.33136958518, 'n_pcs': 5000, 'weight_scheme': 'linear', 'weight_clip_max': None, 'weight_linear_min_weight': 0.5108285826635233, 'weight_linear_max_weight': 2.849497414769735}. Best is trial 41 with value: 0.19810774778548906.
2026-05-31 23:55:38 | INFO | src.nested_cv_avggrm_weighted_unified | Trial 57 | outer=4 | alpha=2.969e+05 n_pcs=2000 (pc_topk) weight_search=on
2026-05-31 23:55:39 | INFO | src.nested_cv_avggrm_weighted_unified | Trial 57 | outer=4 | weight={'name': 'linear', 'floor': 1e-06, 'clip_max': 10.0, 'min_weight': 0.4385166181677847, 'max_weight': 4.274849094405738}
2026-05-31 23:55:40 | INFO | src.nested_cv_avggrm_weighted_unified | Trial 57 | outer=4 | pruned after 6/10 inner folds (mean r=0.2021)
[I 2026-05-31 23:55:40,326] Trial 57 pruned. 
2026-05-31 23:55:40 | INFO | src.nested_cv_avggrm_weighted_unified | Trial 58 | outer=4 | alpha=4.785e+05 n_pcs=4500 (pc_topk) weight_search=on
2026-05-31 23:55:40 | INFO | src.nested_cv_avggrm_weighted_unified | Trial 58 | outer=4 | weight={'name': 'uniform', 'floor': 1e-06, 'clip_max': None}
2026-05-31 23:55:43 | INFO | src.nested_cv_avggrm_weighted_unified | Trial 58 | outer=4 | pruned after 6/10 inner folds (mean r=0.1828)
[I 2026-05-31 23:55:43,941] Trial 58 pruned. 
2026-05-31 23:55:43 | INFO | src.nested_cv_avggrm_weighted_unified | Trial 59 | outer=4 | alpha=7.282e+04 n_pcs=3500 (pc_topk) weight_search=on
2026-05-31 23:55:43 | INFO | src.nested_cv_avggrm_weighted_unified | Trial 59 | outer=4 | weight={'name': 'linear', 'floor': 1e-06, 'clip_max': None, 'min_weight': 0.5969105433491435, 'max_weight': 3.6805629602608696}
2026-05-31 23:55:46 | INFO | src.nested_cv_avggrm_weighted_unified | Trial 59 | outer=4 | pruned after 6/10 inner folds (mean r=0.2027)
[I 2026-05-31 23:55:46,891] Trial 59 pruned. 
2026-05-31 23:55:46 | INFO | src.nested_cv_avggrm_weighted_unified | Trial 60 | outer=4 | alpha=1.753e+05 n_pcs=3000 (pc_topk) weight_search=on
2026-05-31 23:55:46 | INFO | src.nested_cv_avggrm_weighted_unified | Trial 60 | outer=4 | weight={'name': 'exponential', 'floor': 1e-06, 'clip_max': 20.0, 'beta': 3.3552587226022776}
[I 2026-05-31 23:55:50,666] Trial 60 finished with value: 0.19430588941335042 and parameters: {'alpha': 175345.4151699602, 'n_pcs': 3000, 'weight_scheme': 'exponential', 'weight_clip_max': 20.0, 'weight_exponential_beta': 3.3552587226022776}. Best is trial 41 with value: 0.19810774778548906.
2026-05-31 23:55:50 | INFO | src.nested_cv_avggrm_weighted_unified | Trial 61 | outer=4 | alpha=9.734e+04 n_pcs=4500 (pc_topk) weight_search=on
2026-05-31 23:55:50 | INFO | src.nested_cv_avggrm_weighted_unified | Trial 61 | outer=4 | weight={'name': 'linear', 'floor': 1e-06, 'clip_max': None, 'min_weight': 0.3565017304116175, 'max_weight': 2.965196044809653}
[I 2026-05-31 23:55:57,678] Trial 61 finished with value: 0.197712128285165 and parameters: {'alpha': 97341.87663301214, 'n_pcs': 4500, 'weight_scheme': 'linear', 'weight_clip_max': None, 'weight_linear_min_weight': 0.3565017304116175, 'weight_linear_max_weight': 2.965196044809653}. Best is trial 41 with value: 0.19810774778548906.
2026-05-31 23:55:57 | INFO | src.nested_cv_avggrm_weighted_unified | Trial 62 | outer=4 | alpha=4.131e+04 n_pcs=4500 (pc_topk) weight_search=on
2026-05-31 23:55:57 | INFO | src.nested_cv_avggrm_weighted_unified | Trial 62 | outer=4 | weight={'name': 'linear', 'floor': 1e-06, 'clip_max': None, 'min_weight': 0.3776034053504897, 'max_weight': 3.3668549167086024}
2026-05-31 23:56:01 | INFO | src.nested_cv_avggrm_weighted_unified | Trial 62 | outer=4 | pruned after 6/10 inner folds (mean r=0.1979)
[I 2026-05-31 23:56:01,897] Trial 62 pruned. 
2026-05-31 23:56:01 | INFO | src.nested_cv_avggrm_weighted_unified | Trial 63 | outer=4 | alpha=9.320e+04 n_pcs=5000 (pc_topk) weight_search=on
2026-05-31 23:56:01 | INFO | src.nested_cv_avggrm_weighted_unified | Trial 63 | outer=4 | weight={'name': 'linear', 'floor': 1e-06, 'clip_max': None, 'min_weight': 0.46381256569733503, 'max_weight': 3.024181803125281}
[I 2026-05-31 23:56:10,134] Trial 63 finished with value: 0.19630034201596314 and parameters: {'alpha': 93203.40270602384, 'n_pcs': 5000, 'weight_scheme': 'linear', 'weight_clip_max': None, 'weight_linear_min_weight': 0.46381256569733503, 'weight_linear_max_weight': 3.024181803125281}. Best is trial 41 with value: 0.19810774778548906.
2026-05-31 23:56:10 | INFO | src.nested_cv_avggrm_weighted_unified | Trial 64 | outer=4 | alpha=2.424e+04 n_pcs=4500 (pc_topk) weight_search=on
2026-05-31 23:56:10 | INFO | src.nested_cv_avggrm_weighted_unified | Trial 64 | outer=4 | weight={'name': 'linear', 'floor': 1e-06, 'clip_max': None, 'min_weight': 0.24155558957736753, 'max_weight': 2.911824881485906}
2026-05-31 23:56:14 | INFO | src.nested_cv_avggrm_weighted_unified | Trial 64 | outer=4 | pruned after 6/10 inner folds (mean r=0.1896)
[I 2026-05-31 23:56:14,343] Trial 64 pruned. 
2026-05-31 23:56:14 | INFO | src.nested_cv_avggrm_weighted_unified | Trial 65 | outer=4 | alpha=5.717e+04 n_pcs=4000 (pc_topk) weight_search=on
2026-05-31 23:56:14 | INFO | src.nested_cv_avggrm_weighted_unified | Trial 65 | outer=4 | weight={'name': 'linear', 'floor': 1e-06, 'clip_max': None, 'min_weight': 0.5133111298125341, 'max_weight': 3.1814643248424486}
2026-05-31 23:56:17 | INFO | src.nested_cv_avggrm_weighted_unified | Trial 65 | outer=4 | pruned after 6/10 inner folds (mean r=0.2004)
[I 2026-05-31 23:56:17,813] Trial 65 pruned. 
2026-05-31 23:56:17 | INFO | src.nested_cv_avggrm_weighted_unified | Trial 66 | outer=4 | alpha=1.175e+05 n_pcs=4500 (pc_topk) weight_search=on
2026-05-31 23:56:17 | INFO | src.nested_cv_avggrm_weighted_unified | Trial 66 | outer=4 | weight={'name': 'linear', 'floor': 1e-06, 'clip_max': 10.0, 'min_weight': 0.7279560227657752, 'max_weight': 3.732578466941511}
[I 2026-05-31 23:56:24,801] Trial 66 finished with value: 0.1962812610396987 and parameters: {'alpha': 117516.09002021565, 'n_pcs': 4500, 'weight_scheme': 'linear', 'weight_clip_max': 10.0, 'weight_linear_min_weight': 0.7279560227657752, 'weight_linear_max_weight': 3.732578466941511}. Best is trial 41 with value: 0.19810774778548906.
2026-05-31 23:56:24 | INFO | src.nested_cv_avggrm_weighted_unified | Trial 67 | outer=4 | alpha=1.736e+05 n_pcs=2500 (pc_topk) weight_search=on
2026-05-31 23:56:24 | INFO | src.nested_cv_avggrm_weighted_unified | Trial 67 | outer=4 | weight={'name': 'uniform', 'floor': 1e-06, 'clip_max': None}
2026-05-31 23:56:26 | INFO | src.nested_cv_avggrm_weighted_unified | Trial 67 | outer=4 | pruned after 6/10 inner folds (mean r=0.1963)
[I 2026-05-31 23:56:26,223] Trial 67 pruned. 
2026-05-31 23:56:26 | INFO | src.nested_cv_avggrm_weighted_unified | Trial 68 | outer=4 | alpha=7.435e+04 n_pcs=4000 (pc_topk) weight_search=on
2026-05-31 23:56:26 | INFO | src.nested_cv_avggrm_weighted_unified | Trial 68 | outer=4 | weight={'name': 'linear', 'floor': 1e-06, 'clip_max': None, 'min_weight': 0.1462173007818025, 'max_weight': 3.5062645202481035}
2026-05-31 23:56:29 | INFO | src.nested_cv_avggrm_weighted_unified | Trial 68 | outer=4 | pruned after 6/10 inner folds (mean r=0.2018)
[I 2026-05-31 23:56:29,684] Trial 68 pruned. 
2026-05-31 23:56:29 | INFO | src.nested_cv_avggrm_weighted_unified | Trial 69 | outer=4 | alpha=2.702e+05 n_pcs=4500 (pc_topk) weight_search=on
2026-05-31 23:56:29 | INFO | src.nested_cv_avggrm_weighted_unified | Trial 69 | outer=4 | weight={'name': 'linear', 'floor': 1e-06, 'clip_max': 5.0, 'min_weight': 0.34630420735224005, 'max_weight': 1.5281098547172267}
2026-05-31 23:56:33 | INFO | src.nested_cv_avggrm_weighted_unified | Trial 69 | outer=4 | pruned after 6/10 inner folds (mean r=0.2032)
[I 2026-05-31 23:56:33,864] Trial 69 pruned. 
2026-05-31 23:56:33 | INFO | src.nested_cv_avggrm_weighted_unified | Trial 70 | outer=4 | alpha=1.454e+04 n_pcs=5000 (pc_topk) weight_search=on
2026-05-31 23:56:33 | INFO | src.nested_cv_avggrm_weighted_unified | Trial 70 | outer=4 | weight={'name': 'linear', 'floor': 1e-06, 'clip_max': 3.0, 'min_weight': 0.4473086585366025, 'max_weight': 4.55060751982391}
2026-05-31 23:56:38 | INFO | src.nested_cv_avggrm_weighted_unified | Trial 70 | outer=4 | pruned after 6/10 inner folds (mean r=0.1800)
[I 2026-05-31 23:56:38,804] Trial 70 pruned. 
2026-05-31 23:56:38 | INFO | src.nested_cv_avggrm_weighted_unified | Trial 71 | outer=4 | alpha=1.038e+05 n_pcs=4000 (pc_topk) weight_search=on
2026-05-31 23:56:38 | INFO | src.nested_cv_avggrm_weighted_unified | Trial 71 | outer=4 | weight={'name': 'linear', 'floor': 1e-06, 'clip_max': None, 'min_weight': 0.34098518172455505, 'max_weight': 1.9378769562369362}
[I 2026-05-31 23:56:44,564] Trial 71 finished with value: 0.19615655331253842 and parameters: {'alpha': 103784.91819229309, 'n_pcs': 4000, 'weight_scheme': 'linear', 'weight_clip_max': None, 'weight_linear_min_weight': 0.34098518172455505, 'weight_linear_max_weight': 1.9378769562369362}. Best is trial 41 with value: 0.19810774778548906.
2026-05-31 23:56:44 | INFO | src.nested_cv_avggrm_weighted_unified | Trial 72 | outer=4 | alpha=1.006e+05 n_pcs=4000 (pc_topk) weight_search=on
2026-05-31 23:56:44 | INFO | src.nested_cv_avggrm_weighted_unified | Trial 72 | outer=4 | weight={'name': 'linear', 'floor': 1e-06, 'clip_max': None, 'min_weight': 0.3928568520367539, 'max_weight': 2.253191486047098}
[I 2026-05-31 23:56:50,328] Trial 72 finished with value: 0.1962528978359766 and parameters: {'alpha': 100599.14408417128, 'n_pcs': 4000, 'weight_scheme': 'linear', 'weight_clip_max': None, 'weight_linear_min_weight': 0.3928568520367539, 'weight_linear_max_weight': 2.253191486047098}. Best is trial 41 with value: 0.19810774778548906.
2026-05-31 23:56:50 | INFO | src.nested_cv_avggrm_weighted_unified | Trial 73 | outer=4 | alpha=4.523e+04 n_pcs=4500 (pc_topk) weight_search=on
2026-05-31 23:56:50 | INFO | src.nested_cv_avggrm_weighted_unified | Trial 73 | outer=4 | weight={'name': 'linear', 'floor': 1e-06, 'clip_max': None, 'min_weight': 0.2868069019226003, 'max_weight': 2.7847802424288144}
2026-05-31 23:56:54 | INFO | src.nested_cv_avggrm_weighted_unified | Trial 73 | outer=4 | pruned after 6/10 inner folds (mean r=0.1989)
[I 2026-05-31 23:56:54,538] Trial 73 pruned. 
2026-05-31 23:56:54 | INFO | src.nested_cv_avggrm_weighted_unified | Trial 74 | outer=4 | alpha=1.451e+05 n_pcs=4000 (pc_topk) weight_search=on
2026-05-31 23:56:54 | INFO | src.nested_cv_avggrm_weighted_unified | Trial 74 | outer=4 | weight={'name': 'linear', 'floor': 1e-06, 'clip_max': None, 'min_weight': 0.33933851541154003, 'max_weight': 3.043061910976231}
[I 2026-05-31 23:57:00,303] Trial 74 finished with value: 0.19572859551689253 and parameters: {'alpha': 145069.45264081418, 'n_pcs': 4000, 'weight_scheme': 'linear', 'weight_clip_max': None, 'weight_linear_min_weight': 0.33933851541154003, 'weight_linear_max_weight': 3.043061910976231}. Best is trial 41 with value: 0.19810774778548906.
2026-05-31 23:57:00 | INFO | src.nested_cv_avggrm_weighted_unified | Trial 75 | outer=4 | alpha=3.284e+04 n_pcs=4500 (pc_topk) weight_search=on
2026-05-31 23:57:00 | INFO | src.nested_cv_avggrm_weighted_unified | Trial 75 | outer=4 | weight={'name': 'linear', 'floor': 1e-06, 'clip_max': None, 'min_weight': 0.19696462474600962, 'max_weight': 2.7434008810089994}
2026-05-31 23:57:04 | INFO | src.nested_cv_avggrm_weighted_unified | Trial 75 | outer=4 | pruned after 6/10 inner folds (mean r=0.1938)
[I 2026-05-31 23:57:04,520] Trial 75 pruned. 
2026-05-31 23:57:04 | INFO | src.nested_cv_avggrm_weighted_unified | Trial 76 | outer=4 | alpha=6.329e+04 n_pcs=3500 (pc_topk) weight_search=on
2026-05-31 23:57:04 | INFO | src.nested_cv_avggrm_weighted_unified | Trial 76 | outer=4 | weight={'name': 'linear', 'floor': 1e-06, 'clip_max': 5.0, 'min_weight': 0.4913841622381345, 'max_weight': 3.307587290025379}
2026-05-31 23:57:07 | INFO | src.nested_cv_avggrm_weighted_unified | Trial 76 | outer=4 | pruned after 6/10 inner folds (mean r=0.2011)
[I 2026-05-31 23:57:07,467] Trial 76 pruned. 
2026-05-31 23:57:07 | INFO | src.nested_cv_avggrm_weighted_unified | Trial 77 | outer=4 | alpha=2.286e+05 n_pcs=4000 (pc_topk) weight_search=on
2026-05-31 23:57:07 | INFO | src.nested_cv_avggrm_weighted_unified | Trial 77 | outer=4 | weight={'name': 'linear', 'floor': 1e-06, 'clip_max': None, 'min_weight': 0.8310983993889376, 'max_weight': 1.8712047313392879}
2026-05-31 23:57:10 | INFO | src.nested_cv_avggrm_weighted_unified | Trial 77 | outer=4 | pruned after 6/10 inner folds (mean r=0.1984)
[I 2026-05-31 23:57:10,918] Trial 77 pruned. 
2026-05-31 23:57:10 | INFO | src.nested_cv_avggrm_weighted_unified | Trial 78 | outer=4 | alpha=4.473e+05 n_pcs=4500 (pc_topk) weight_search=on
2026-05-31 23:57:10 | INFO | src.nested_cv_avggrm_weighted_unified | Trial 78 | outer=4 | weight={'name': 'exponential', 'floor': 1e-06, 'clip_max': None, 'beta': 7.002364343998698}
2026-05-31 23:57:15 | INFO | src.nested_cv_avggrm_weighted_unified | Trial 78 | outer=4 | pruned after 6/10 inner folds (mean r=0.1950)
[I 2026-05-31 23:57:15,107] Trial 78 pruned. 
2026-05-31 23:57:15 | INFO | src.nested_cv_avggrm_weighted_unified | Trial 79 | outer=4 | alpha=1.405e+05 n_pcs=1000 (pc_topk) weight_search=on
2026-05-31 23:57:15 | INFO | src.nested_cv_avggrm_weighted_unified | Trial 79 | outer=4 | weight={'name': 'uniform', 'floor': 1e-06, 'clip_max': 10.0}
2026-05-31 23:57:15 | INFO | src.nested_cv_avggrm_weighted_unified | Trial 79 | outer=4 | pruned after 6/10 inner folds (mean r=0.1877)
[I 2026-05-31 23:57:15,860] Trial 79 pruned. 
2026-05-31 23:57:15 | INFO | src.nested_cv_avggrm_weighted_unified | Trial 80 | outer=4 | alpha=8.792e+04 n_pcs=5000 (pc_topk) weight_search=on
2026-05-31 23:57:15 | INFO | src.nested_cv_avggrm_weighted_unified | Trial 80 | outer=4 | weight={'name': 'linear', 'floor': 1e-06, 'clip_max': 20.0, 'min_weight': 0.2756395041689428, 'max_weight': 2.389195546331648}
2026-05-31 23:57:20 | INFO | src.nested_cv_avggrm_weighted_unified | Trial 80 | outer=4 | pruned after 6/10 inner folds (mean r=0.2039)
[I 2026-05-31 23:57:20,806] Trial 80 pruned. 
2026-05-31 23:57:20 | INFO | src.nested_cv_avggrm_weighted_unified | Trial 81 | outer=4 | alpha=9.937e+04 n_pcs=5000 (pc_topk) weight_search=on
2026-05-31 23:57:20 | INFO | src.nested_cv_avggrm_weighted_unified | Trial 81 | outer=4 | weight={'name': 'linear', 'floor': 1e-06, 'clip_max': None, 'min_weight': 0.44582177522973115, 'max_weight': 3.10135448571349}
[I 2026-05-31 23:57:29,047] Trial 81 finished with value: 0.19621133144523126 and parameters: {'alpha': 99372.72641269046, 'n_pcs': 5000, 'weight_scheme': 'linear', 'weight_clip_max': None, 'weight_linear_min_weight': 0.44582177522973115, 'weight_linear_max_weight': 3.10135448571349}. Best is trial 41 with value: 0.19810774778548906.
2026-05-31 23:57:29 | INFO | src.nested_cv_avggrm_weighted_unified | Trial 82 | outer=4 | alpha=7.194e+04 n_pcs=5000 (pc_topk) weight_search=on
2026-05-31 23:57:29 | INFO | src.nested_cv_avggrm_weighted_unified | Trial 82 | outer=4 | weight={'name': 'linear', 'floor': 1e-06, 'clip_max': None, 'min_weight': 0.9252491406428827, 'max_weight': 3.590477912085002}
2026-05-31 23:57:33 | INFO | src.nested_cv_avggrm_weighted_unified | Trial 82 | outer=4 | pruned after 6/10 inner folds (mean r=0.2021)
[I 2026-05-31 23:57:33,994] Trial 82 pruned. 
2026-05-31 23:57:34 | INFO | src.nested_cv_avggrm_weighted_unified | Trial 83 | outer=4 | alpha=5.187e+04 n_pcs=4500 (pc_topk) weight_search=on
2026-05-31 23:57:34 | INFO | src.nested_cv_avggrm_weighted_unified | Trial 83 | outer=4 | weight={'name': 'linear', 'floor': 1e-06, 'clip_max': None, 'min_weight': 0.4606971017967479, 'max_weight': 2.998876599754524}
2026-05-31 23:57:38 | INFO | src.nested_cv_avggrm_weighted_unified | Trial 83 | outer=4 | pruned after 6/10 inner folds (mean r=0.2011)
[I 2026-05-31 23:57:38,214] Trial 83 pruned. 
2026-05-31 23:57:38 | INFO | src.nested_cv_avggrm_weighted_unified | Trial 84 | outer=4 | alpha=1.120e+05 n_pcs=5000 (pc_topk) weight_search=on
2026-05-31 23:57:38 | INFO | src.nested_cv_avggrm_weighted_unified | Trial 84 | outer=4 | weight={'name': 'linear', 'floor': 1e-06, 'clip_max': None, 'min_weight': 0.5590756769163188, 'max_weight': 3.3132137971740963}
[I 2026-05-31 23:57:46,454] Trial 84 finished with value: 0.19555023630481877 and parameters: {'alpha': 111998.79899437232, 'n_pcs': 5000, 'weight_scheme': 'linear', 'weight_clip_max': None, 'weight_linear_min_weight': 0.5590756769163188, 'weight_linear_max_weight': 3.3132137971740963}. Best is trial 41 with value: 0.19810774778548906.
2026-05-31 23:57:46 | INFO | src.nested_cv_avggrm_weighted_unified | Trial 85 | outer=4 | alpha=1.882e+05 n_pcs=4500 (pc_topk) weight_search=on
2026-05-31 23:57:46 | INFO | src.nested_cv_avggrm_weighted_unified | Trial 85 | outer=4 | weight={'name': 'linear', 'floor': 1e-06, 'clip_max': None, 'min_weight': 0.40742877605261413, 'max_weight': 2.065074485072624}
[I 2026-05-31 23:57:53,436] Trial 85 finished with value: 0.19324114168189344 and parameters: {'alpha': 188245.63023151198, 'n_pcs': 4500, 'weight_scheme': 'linear', 'weight_clip_max': None, 'weight_linear_min_weight': 0.40742877605261413, 'weight_linear_max_weight': 2.065074485072624}. Best is trial 41 with value: 0.19810774778548906.
2026-05-31 23:57:53 | INFO | src.nested_cv_avggrm_weighted_unified | Trial 86 | outer=4 | alpha=3.579e+06 n_pcs=4000 (pc_topk) weight_search=on
2026-05-31 23:57:53 | INFO | src.nested_cv_avggrm_weighted_unified | Trial 86 | outer=4 | weight={'name': 'linear', 'floor': 1e-06, 'clip_max': 5.0, 'min_weight': 0.32599703871968866, 'max_weight': 3.019565359106227}
2026-05-31 23:57:56 | INFO | src.nested_cv_avggrm_weighted_unified | Trial 86 | outer=4 | pruned after 5/10 inner folds (mean r=0.1518)
