[I 2026-06-01 14:55:23,209] Trial 116 finished with value: -1.0 and parameters: {'alpha': 124149.46477262942, 'n_pcs': 3000, 'iw_method': 'pc_logistic', 'iw_clip_max': 12.0, 'iw_prob_clip': 0.011326847407140165, 'iw_n_components': 100, 'iw_logistic_c': 0.046603771143265034, 'iw_pca_fit': 'combined', 'iw_solver': 'lbfgs', 'iw_rho': 1.0}. Best is trial 98 with value: 0.242337307651093.
2026-06-01 14:55:23 | INFO | Trial 117 | outer=2 | alpha=5.106e+04 n_pcs=2000 (pc_topk) weight={'name': 'pc_logistic', 'floor': 1e-06, 'clip_max': 2.5, 'prob_clip': 0.014669211183779604, 'n_components': 80, 'logistic_c': 0.01889283308750017, 'pca_fit': 'combined', 'solver': 'lbfgs', 'max_iter': 2000, 'fit_intercept': True, 'standardize_with_source': True, 'rho': 0.7}
[I 2026-06-01 14:55:40,811] Trial 117 finished with value: 0.233501771556012 and parameters: {'alpha': 51060.04478148303, 'n_pcs': 2000, 'iw_method': 'pc_logistic', 'iw_clip_max': 2.5, 'iw_prob_clip': 0.014669211183779604, 'iw_n_components': 80, 'iw_logistic_c': 0.01889283308750017, 'iw_pca_fit': 'combined', 'iw_solver': 'lbfgs', 'iw_rho': 0.7}. Best is trial 98 with value: 0.242337307651093.
2026-06-01 14:55:40 | INFO | Trial 118 | outer=2 | alpha=2.797e+05 n_pcs=2500 (pc_topk) weight={'name': 'pc_logistic', 'floor': 1e-06, 'clip_max': 2.5, 'prob_clip': 0.011885310035038715, 'n_components': 80, 'logistic_c': 2.794330698303526, 'pca_fit': 'combined', 'solver': 'lbfgs', 'max_iter': 2000, 'fit_intercept': True, 'standardize_with_source': True, 'rho': 0.7}
[I 2026-06-01 14:56:01,099] Trial 118 finished with value: 0.23911012537123716 and parameters: {'alpha': 279671.2163991316, 'n_pcs': 2500, 'iw_method': 'pc_logistic', 'iw_clip_max': 2.5, 'iw_prob_clip': 0.011885310035038715, 'iw_n_components': 80, 'iw_logistic_c': 2.794330698303526, 'iw_pca_fit': 'combined', 'iw_solver': 'lbfgs', 'iw_rho': 0.7}. Best is trial 98 with value: 0.242337307651093.
2026-06-01 14:56:01 | INFO | Trial 119 | outer=2 | alpha=1.414e+05 n_pcs=3000 (pc_topk) weight={'name': 'pc_logistic', 'floor': 1e-06, 'clip_max': 2.5, 'prob_clip': 0.008868202530196203, 'n_components': 80, 'logistic_c': 1.58386175416925, 'pca_fit': 'combined', 'solver': 'lbfgs', 'max_iter': 2000, 'fit_intercept': True, 'standardize_with_source': True, 'rho': 0.7}
[I 2026-06-01 14:56:20,640] Trial 119 finished with value: 0.2416451905438139 and parameters: {'alpha': 141393.24392218457, 'n_pcs': 3000, 'iw_method': 'pc_logistic', 'iw_clip_max': 2.5, 'iw_prob_clip': 0.008868202530196203, 'iw_n_components': 80, 'iw_logistic_c': 1.58386175416925, 'iw_pca_fit': 'combined', 'iw_solver': 'lbfgs', 'iw_rho': 0.7}. Best is trial 98 with value: 0.242337307651093.
2026-06-01 14:56:20 | INFO | Trial 120 | outer=2 | alpha=1.766e+05 n_pcs=2500 (pc_topk) weight={'name': 'pc_logistic', 'floor': 1e-06, 'clip_max': 2.5, 'prob_clip': 0.008686661944098806, 'n_components': 80, 'logistic_c': 1.451675451862418, 'pca_fit': 'combined', 'solver': 'lbfgs', 'max_iter': 2000, 'fit_intercept': True, 'standardize_with_source': True, 'rho': 0.7}
[I 2026-06-01 14:56:37,618] Trial 120 finished with value: 0.23995068997906238 and parameters: {'alpha': 176628.64318102633, 'n_pcs': 2500, 'iw_method': 'pc_logistic', 'iw_clip_max': 2.5, 'iw_prob_clip': 0.008686661944098806, 'iw_n_components': 80, 'iw_logistic_c': 1.451675451862418, 'iw_pca_fit': 'combined', 'iw_solver': 'lbfgs', 'iw_rho': 0.7}. Best is trial 98 with value: 0.242337307651093.
2026-06-01 14:56:37 | INFO | Trial 121 | outer=2 | alpha=1.384e+05 n_pcs=3000 (pc_topk) weight={'name': 'pc_logistic', 'floor': 1e-06, 'clip_max': 2.5, 'prob_clip': 0.00970136315838581, 'n_components': 80, 'logistic_c': 4.872458877660638, 'pca_fit': 'combined', 'solver': 'lbfgs', 'max_iter': 2000, 'fit_intercept': True, 'standardize_with_source': True, 'rho': 0.7}
[I 2026-06-01 14:57:00,877] Trial 121 finished with value: 0.2415331139882791 and parameters: {'alpha': 138385.9265695016, 'n_pcs': 3000, 'iw_method': 'pc_logistic', 'iw_clip_max': 2.5, 'iw_prob_clip': 0.00970136315838581, 'iw_n_components': 80, 'iw_logistic_c': 4.872458877660638, 'iw_pca_fit': 'combined', 'iw_solver': 'lbfgs', 'iw_rho': 0.7}. Best is trial 98 with value: 0.242337307651093.
2026-06-01 14:57:00 | INFO | Trial 122 | outer=2 | alpha=1.489e+05 n_pcs=3000 (pc_topk) weight={'name': 'pc_logistic', 'floor': 1e-06, 'clip_max': 2.5, 'prob_clip': 0.010021946477029309, 'n_components': 80, 'logistic_c': 6.3466831515022815, 'pca_fit': 'combined', 'solver': 'lbfgs', 'max_iter': 2000, 'fit_intercept': True, 'standardize_with_source': True, 'rho': 0.7}
[I 2026-06-01 14:57:21,197] Trial 122 finished with value: 0.24160972610945453 and parameters: {'alpha': 148859.90800819042, 'n_pcs': 3000, 'iw_method': 'pc_logistic', 'iw_clip_max': 2.5, 'iw_prob_clip': 0.010021946477029309, 'iw_n_components': 80, 'iw_logistic_c': 6.3466831515022815, 'iw_pca_fit': 'combined', 'iw_solver': 'lbfgs', 'iw_rho': 0.7}. Best is trial 98 with value: 0.242337307651093.
2026-06-01 14:57:21 | INFO | Trial 123 | outer=2 | alpha=2.324e+05 n_pcs=3000 (pc_topk) weight={'name': 'pc_logistic', 'floor': 1e-06, 'clip_max': 2.5, 'prob_clip': 0.010153294442119272, 'n_components': 80, 'logistic_c': 5.621130202340643, 'pca_fit': 'combined', 'solver': 'lbfgs', 'max_iter': 2000, 'fit_intercept': True, 'standardize_with_source': True, 'rho': 0.7}
[I 2026-06-01 14:57:42,005] Trial 123 finished with value: 0.24103708493803389 and parameters: {'alpha': 232392.02207087926, 'n_pcs': 3000, 'iw_method': 'pc_logistic', 'iw_clip_max': 2.5, 'iw_prob_clip': 0.010153294442119272, 'iw_n_components': 80, 'iw_logistic_c': 5.621130202340643, 'iw_pca_fit': 'combined', 'iw_solver': 'lbfgs', 'iw_rho': 0.7}. Best is trial 98 with value: 0.242337307651093.
2026-06-01 14:57:42 | INFO | Trial 124 | outer=2 | alpha=1.470e+05 n_pcs=3000 (pc_topk) weight={'name': 'pc_logistic', 'floor': 1e-06, 'clip_max': 2.5, 'prob_clip': 0.008672997661179554, 'n_components': 80, 'logistic_c': 6.494969618449107, 'pca_fit': 'combined', 'solver': 'lbfgs', 'max_iter': 2000, 'fit_intercept': True, 'standardize_with_source': True, 'rho': 0.7}
[I 2026-06-01 14:57:59,636] Trial 124 finished with value: 0.24168549271453554 and parameters: {'alpha': 146990.22976237905, 'n_pcs': 3000, 'iw_method': 'pc_logistic', 'iw_clip_max': 2.5, 'iw_prob_clip': 0.008672997661179554, 'iw_n_components': 80, 'iw_logistic_c': 6.494969618449107, 'iw_pca_fit': 'combined', 'iw_solver': 'lbfgs', 'iw_rho': 0.7}. Best is trial 98 with value: 0.242337307651093.
2026-06-01 14:57:59 | INFO | Trial 125 | outer=2 | alpha=9.943e+04 n_pcs=3000 (pc_topk) weight={'name': 'pc_logistic', 'floor': 1e-06, 'clip_max': 2.5, 'prob_clip': 0.007008867851893448, 'n_components': 80, 'logistic_c': 8.98078214989527, 'pca_fit': 'combined', 'solver': 'lbfgs', 'max_iter': 2000, 'fit_intercept': True, 'standardize_with_source': True, 'rho': 0.7}
[I 2026-06-01 14:58:15,846] Trial 125 finished with value: 0.24134938458555705 and parameters: {'alpha': 99425.4647395026, 'n_pcs': 3000, 'iw_method': 'pc_logistic', 'iw_clip_max': 2.5, 'iw_prob_clip': 0.007008867851893448, 'iw_n_components': 80, 'iw_logistic_c': 8.98078214989527, 'iw_pca_fit': 'combined', 'iw_solver': 'lbfgs', 'iw_rho': 0.7}. Best is trial 98 with value: 0.242337307651093.
2026-06-01 14:58:15 | INFO | Trial 126 | outer=2 | alpha=1.441e+05 n_pcs=2500 (pc_topk) weight={'name': 'pc_logistic', 'floor': 1e-06, 'clip_max': 2.5, 'prob_clip': 0.007037211167413781, 'n_components': 80, 'logistic_c': 9.66335007403366, 'pca_fit': 'combined', 'solver': 'lbfgs', 'max_iter': 2000, 'fit_intercept': True, 'standardize_with_source': True, 'rho': 0.7}
[I 2026-06-01 14:58:32,925] Trial 126 finished with value: 0.2400312988764693 and parameters: {'alpha': 144060.11184383763, 'n_pcs': 2500, 'iw_method': 'pc_logistic', 'iw_clip_max': 2.5, 'iw_prob_clip': 0.007037211167413781, 'iw_n_components': 80, 'iw_logistic_c': 9.66335007403366, 'iw_pca_fit': 'combined', 'iw_solver': 'lbfgs', 'iw_rho': 0.7}. Best is trial 98 with value: 0.242337307651093.
2026-06-01 14:58:32 | INFO | Trial 127 | outer=2 | alpha=2.219e+05 n_pcs=3000 (pc_topk) weight={'name': 'pc_logistic', 'floor': 1e-06, 'clip_max': 2.5, 'prob_clip': 0.008657258502018437, 'n_components': 80, 'logistic_c': 6.410342151561809, 'pca_fit': 'combined', 'solver': 'lbfgs', 'max_iter': 2000, 'fit_intercept': True, 'standardize_with_source': True, 'rho': 0.7}
[I 2026-06-01 14:58:50,285] Trial 127 finished with value: 0.2412158356819616 and parameters: {'alpha': 221911.68440644984, 'n_pcs': 3000, 'iw_method': 'pc_logistic', 'iw_clip_max': 2.5, 'iw_prob_clip': 0.008657258502018437, 'iw_n_components': 80, 'iw_logistic_c': 6.410342151561809, 'iw_pca_fit': 'combined', 'iw_solver': 'lbfgs', 'iw_rho': 0.7}. Best is trial 98 with value: 0.242337307651093.
2026-06-01 14:58:50 | INFO | Trial 128 | outer=2 | alpha=2.100e+05 n_pcs=3000 (pc_topk) weight={'name': 'pc_logistic', 'floor': 1e-06, 'clip_max': 7.0, 'prob_clip': 0.008802984279403528, 'n_components': 80, 'logistic_c': 9.845395275164172, 'pca_fit': 'combined', 'solver': 'lbfgs', 'max_iter': 2000, 'fit_intercept': True, 'standardize_with_source': True, 'rho': 0.7}
[I 2026-06-01 14:59:07,646] Trial 128 finished with value: 0.23238017171037567 and parameters: {'alpha': 209950.9260978706, 'n_pcs': 3000, 'iw_method': 'pc_logistic', 'iw_clip_max': 7.0, 'iw_prob_clip': 0.008802984279403528, 'iw_n_components': 80, 'iw_logistic_c': 9.845395275164172, 'iw_pca_fit': 'combined', 'iw_solver': 'lbfgs', 'iw_rho': 0.7}. Best is trial 98 with value: 0.242337307651093.
2026-06-01 14:59:07 | INFO | Trial 129 | outer=2 | alpha=1.056e+05 n_pcs=3000 (pc_topk) weight={'name': 'pc_logistic', 'floor': 1e-06, 'clip_max': 2.5, 'prob_clip': 0.0054851244561969995, 'n_components': 80, 'logistic_c': 2.0289995735770265, 'pca_fit': 'combined', 'solver': 'lbfgs', 'max_iter': 2000, 'fit_intercept': True, 'standardize_with_source': True, 'rho': 0.7}
[I 2026-06-01 14:59:24,472] Trial 129 finished with value: 0.24151173264591322 and parameters: {'alpha': 105558.6592735987, 'n_pcs': 3000, 'iw_method': 'pc_logistic', 'iw_clip_max': 2.5, 'iw_prob_clip': 0.0054851244561969995, 'iw_n_components': 80, 'iw_logistic_c': 2.0289995735770265, 'iw_pca_fit': 'combined', 'iw_solver': 'lbfgs', 'iw_rho': 0.7}. Best is trial 98 with value: 0.242337307651093.
2026-06-01 14:59:24 | INFO | Trial 130 | outer=2 | alpha=1.033e+05 n_pcs=3000 (pc_topk) weight={'name': 'pc_logistic', 'floor': 1e-06, 'clip_max': 2.5, 'prob_clip': 0.006029245957963588, 'n_components': 80, 'logistic_c': 0.8033856360337334, 'pca_fit': 'combined', 'solver': 'lbfgs', 'max_iter': 2000, 'fit_intercept': True, 'standardize_with_source': True, 'rho': 0.7}
[I 2026-06-01 14:59:45,883] Trial 130 finished with value: 0.24139103097088146 and parameters: {'alpha': 103329.35342243918, 'n_pcs': 3000, 'iw_method': 'pc_logistic', 'iw_clip_max': 2.5, 'iw_prob_clip': 0.006029245957963588, 'iw_n_components': 80, 'iw_logistic_c': 0.8033856360337334, 'iw_pca_fit': 'combined', 'iw_solver': 'lbfgs', 'iw_rho': 0.7}. Best is trial 98 with value: 0.242337307651093.
2026-06-01 14:59:45 | INFO | Trial 131 | outer=2 | alpha=1.028e+05 n_pcs=3000 (pc_topk) weight={'name': 'pc_logistic', 'floor': 1e-06, 'clip_max': 2.5, 'prob_clip': 0.0060085972728996856, 'n_components': 80, 'logistic_c': 2.5846494547278924, 'pca_fit': 'combined', 'solver': 'lbfgs', 'max_iter': 2000, 'fit_intercept': True, 'standardize_with_source': True, 'rho': 0.7}
[I 2026-06-01 15:00:05,635] Trial 131 finished with value: 0.24143873165838162 and parameters: {'alpha': 102782.97765396458, 'n_pcs': 3000, 'iw_method': 'pc_logistic', 'iw_clip_max': 2.5, 'iw_prob_clip': 0.0060085972728996856, 'iw_n_components': 80, 'iw_logistic_c': 2.5846494547278924, 'iw_pca_fit': 'combined', 'iw_solver': 'lbfgs', 'iw_rho': 0.7}. Best is trial 98 with value: 0.242337307651093.
2026-06-01 15:00:05 | INFO | Trial 132 | outer=2 | alpha=1.022e+05 n_pcs=3000 (pc_topk) weight={'name': 'pc_logistic', 'floor': 1e-06, 'clip_max': 2.5, 'prob_clip': 0.005526178197863, 'n_components': 80, 'logistic_c': 2.1292227743216112, 'pca_fit': 'combined', 'solver': 'lbfgs', 'max_iter': 2000, 'fit_intercept': True, 'standardize_with_source': True, 'rho': 0.7}
[I 2026-06-01 15:00:26,656] Trial 132 finished with value: 0.2414132013020093 and parameters: {'alpha': 102157.12630744367, 'n_pcs': 3000, 'iw_method': 'pc_logistic', 'iw_clip_max': 2.5, 'iw_prob_clip': 0.005526178197863, 'iw_n_components': 80, 'iw_logistic_c': 2.1292227743216112, 'iw_pca_fit': 'combined', 'iw_solver': 'lbfgs', 'iw_rho': 0.7}. Best is trial 98 with value: 0.242337307651093.
2026-06-01 15:00:26 | INFO | Trial 133 | outer=2 | alpha=9.737e+06 n_pcs=3000 (pc_topk) weight={'name': 'pc_logistic', 'floor': 1e-06, 'clip_max': 2.5, 'prob_clip': 0.0055075306891476895, 'n_components': 80, 'logistic_c': 0.804067091851685, 'pca_fit': 'combined', 'solver': 'lbfgs', 'max_iter': 2000, 'fit_intercept': True, 'standardize_with_source': True, 'rho': 0.7}
[I 2026-06-01 15:00:49,380] Trial 133 finished with value: 0.22476324387762503 and parameters: {'alpha': 9737107.945261743, 'n_pcs': 3000, 'iw_method': 'pc_logistic', 'iw_clip_max': 2.5, 'iw_prob_clip': 0.0055075306891476895, 'iw_n_components': 80, 'iw_logistic_c': 0.804067091851685, 'iw_pca_fit': 'combined', 'iw_solver': 'lbfgs', 'iw_rho': 0.7}. Best is trial 98 with value: 0.242337307651093.
2026-06-01 15:00:49 | INFO | Trial 134 | outer=2 | alpha=1.317e+05 n_pcs=2500 (pc_topk) weight={'name': 'pc_logistic', 'floor': 1e-06, 'clip_max': 2.5, 'prob_clip': 0.004551881170100387, 'n_components': 80, 'logistic_c': 1.9514554528738495, 'pca_fit': 'combined', 'solver': 'lbfgs', 'max_iter': 2000, 'fit_intercept': True, 'standardize_with_source': True, 'rho': 0.5}
[I 2026-06-01 15:01:10,042] Trial 134 finished with value: 0.23972757749158852 and parameters: {'alpha': 131688.1833540573, 'n_pcs': 2500, 'iw_method': 'pc_logistic', 'iw_clip_max': 2.5, 'iw_prob_clip': 0.004551881170100387, 'iw_n_components': 80, 'iw_logistic_c': 1.9514554528738495, 'iw_pca_fit': 'combined', 'iw_solver': 'lbfgs', 'iw_rho': 0.5}. Best is trial 98 with value: 0.242337307651093.
2026-06-01 15:01:10 | INFO | Trial 135 | outer=2 | alpha=1.061e+05 n_pcs=3000 (pc_topk) weight={'name': 'pc_logistic', 'floor': 1e-06, 'clip_max': 2.5, 'prob_clip': 0.005394970409454133, 'n_components': 60, 'logistic_c': 0.8088595817155596, 'pca_fit': 'combined', 'solver': 'lbfgs', 'max_iter': 2000, 'fit_intercept': True, 'standardize_with_source': True, 'rho': 0.7}
[I 2026-06-01 15:01:28,758] Trial 135 finished with value: 0.23852845379240284 and parameters: {'alpha': 106146.32438917253, 'n_pcs': 3000, 'iw_method': 'pc_logistic', 'iw_clip_max': 2.5, 'iw_prob_clip': 0.005394970409454133, 'iw_n_components': 60, 'iw_logistic_c': 0.8088595817155596, 'iw_pca_fit': 'combined', 'iw_solver': 'lbfgs', 'iw_rho': 0.7}. Best is trial 98 with value: 0.242337307651093.
2026-06-01 15:01:28 | INFO | Trial 136 | outer=2 | alpha=6.719e+04 n_pcs=3500 (pc_topk) weight={'name': 'pc_logistic', 'floor': 1e-06, 'clip_max': 2.5, 'prob_clip': 0.006242659215076439, 'n_components': 80, 'logistic_c': 3.049225199806961, 'pca_fit': 'combined', 'solver': 'lbfgs', 'max_iter': 2000, 'fit_intercept': True, 'standardize_with_source': True, 'rho': 0.7}
[I 2026-06-01 15:01:50,010] Trial 136 finished with value: 0.24027682727088195 and parameters: {'alpha': 67189.28107851843, 'n_pcs': 3500, 'iw_method': 'pc_logistic', 'iw_clip_max': 2.5, 'iw_prob_clip': 0.006242659215076439, 'iw_n_components': 80, 'iw_logistic_c': 3.049225199806961, 'iw_pca_fit': 'combined', 'iw_solver': 'lbfgs', 'iw_rho': 0.7}. Best is trial 98 with value: 0.242337307651093.
2026-06-01 15:01:50 | INFO | Trial 137 | outer=2 | alpha=9.415e+04 n_pcs=3000 (pc_topk) weight={'name': 'pc_logistic', 'floor': 1e-06, 'clip_max': 2.5, 'prob_clip': 0.007939944535826597, 'n_components': 10, 'logistic_c': 0.22826014096256808, 'pca_fit': 'combined', 'solver': 'lbfgs', 'max_iter': 2000, 'fit_intercept': True, 'standardize_with_source': True, 'rho': 0.85}
[I 2026-06-01 15:02:01,819] Trial 137 finished with value: 0.2383691187373825 and parameters: {'alpha': 94153.77029475367, 'n_pcs': 3000, 'iw_method': 'pc_logistic', 'iw_clip_max': 2.5, 'iw_prob_clip': 0.007939944535826597, 'iw_n_components': 10, 'iw_logistic_c': 0.22826014096256808, 'iw_pca_fit': 'combined', 'iw_solver': 'lbfgs', 'iw_rho': 0.85}. Best is trial 98 with value: 0.242337307651093.
2026-06-01 15:02:01 | INFO | Trial 138 | outer=2 | alpha=1.446e+05 n_pcs=3500 (pc_topk) weight={'name': 'pc_logistic', 'floor': 1e-06, 'clip_max': 12.0, 'prob_clip': 0.006107762885322538, 'n_components': 20, 'logistic_c': 0.5154032010517482, 'pca_fit': 'combined', 'solver': 'lbfgs', 'max_iter': 2000, 'fit_intercept': True, 'standardize_with_source': True, 'rho': 0.7}
[I 2026-06-01 15:02:15,137] Trial 138 finished with value: 0.22565276158790054 and parameters: {'alpha': 144602.7745590447, 'n_pcs': 3500, 'iw_method': 'pc_logistic', 'iw_clip_max': 12.0, 'iw_prob_clip': 0.006107762885322538, 'iw_n_components': 20, 'iw_logistic_c': 0.5154032010517482, 'iw_pca_fit': 'combined', 'iw_solver': 'lbfgs', 'iw_rho': 0.7}. Best is trial 98 with value: 0.242337307651093.
2026-06-01 15:02:15 | INFO | Trial 139 | outer=2 | alpha=5.929e+04 n_pcs=2500 (pc_topk) weight={'name': 'pc_logistic', 'floor': 1e-06, 'clip_max': 2.5, 'prob_clip': 0.004576704788010813, 'n_components': 80, 'logistic_c': 0.25190425003068617, 'pca_fit': 'combined', 'solver': 'lbfgs', 'max_iter': 2000, 'fit_intercept': True, 'standardize_with_source': True, 'rho': 1.0}
[I 2026-06-01 15:02:30,280] Trial 139 finished with value: 0.2153523163379949 and parameters: {'alpha': 59291.953868721444, 'n_pcs': 2500, 'iw_method': 'pc_logistic', 'iw_clip_max': 2.5, 'iw_prob_clip': 0.004576704788010813, 'iw_n_components': 80, 'iw_logistic_c': 0.25190425003068617, 'iw_pca_fit': 'combined', 'iw_solver': 'lbfgs', 'iw_rho': 1.0}. Best is trial 98 with value: 0.242337307651093.
2026-06-01 15:02:30 | INFO | Trial 140 | outer=2 | alpha=1.159e+05 n_pcs=3000 (pc_topk) weight={'name': 'pc_logistic', 'floor': 1e-06, 'clip_max': 2.5, 'prob_clip': 0.007186757011610503, 'n_components': 100, 'logistic_c': 1.0678477511978006, 'pca_fit': 'combined', 'solver': 'lbfgs', 'max_iter': 2000, 'fit_intercept': True, 'standardize_with_source': True, 'rho': 0.7}
[I 2026-06-01 15:02:51,491] Trial 140 finished with value: 0.23996739432786357 and parameters: {'alpha': 115907.57618240861, 'n_pcs': 3000, 'iw_method': 'pc_logistic', 'iw_clip_max': 2.5, 'iw_prob_clip': 0.007186757011610503, 'iw_n_components': 100, 'iw_logistic_c': 1.0678477511978006, 'iw_pca_fit': 'combined', 'iw_solver': 'lbfgs', 'iw_rho': 0.7}. Best is trial 98 with value: 0.242337307651093.
2026-06-01 15:02:51 | INFO | Trial 141 | outer=2 | alpha=9.869e+04 n_pcs=3000 (pc_topk) weight={'name': 'pc_logistic', 'floor': 1e-06, 'clip_max': 2.5, 'prob_clip': 0.005357106146570252, 'n_components': 80, 'logistic_c': 2.0756231231279854, 'pca_fit': 'combined', 'solver': 'lbfgs', 'max_iter': 2000, 'fit_intercept': True, 'standardize_with_source': True, 'rho': 0.7}
[I 2026-06-01 15:03:11,428] Trial 141 finished with value: 0.24125658658432028 and parameters: {'alpha': 98687.92360845376, 'n_pcs': 3000, 'iw_method': 'pc_logistic', 'iw_clip_max': 2.5, 'iw_prob_clip': 0.005357106146570252, 'iw_n_components': 80, 'iw_logistic_c': 2.0756231231279854, 'iw_pca_fit': 'combined', 'iw_solver': 'lbfgs', 'iw_rho': 0.7}. Best is trial 98 with value: 0.242337307651093.
2026-06-01 15:03:11 | INFO | Trial 142 | outer=2 | alpha=8.415e+04 n_pcs=3000 (pc_topk) weight={'name': 'pc_logistic', 'floor': 1e-06, 'clip_max': 2.5, 'prob_clip': 0.006737561581953276, 'n_components': 80, 'logistic_c': 3.5518361972444805, 'pca_fit': 'combined', 'solver': 'lbfgs', 'max_iter': 2000, 'fit_intercept': True, 'standardize_with_source': True, 'rho': 0.7}
[I 2026-06-01 15:03:32,534] Trial 142 finished with value: 0.2406027357503701 and parameters: {'alpha': 84152.58342431586, 'n_pcs': 3000, 'iw_method': 'pc_logistic', 'iw_clip_max': 2.5, 'iw_prob_clip': 0.006737561581953276, 'iw_n_components': 80, 'iw_logistic_c': 3.5518361972444805, 'iw_pca_fit': 'combined', 'iw_solver': 'lbfgs', 'iw_rho': 0.7}. Best is trial 98 with value: 0.242337307651093.
2026-06-01 15:03:32 | INFO | Trial 143 | outer=2 | alpha=1.263e+05 n_pcs=3500 (pc_topk) weight={'name': 'pc_logistic', 'floor': 1e-06, 'clip_max': 2.5, 'prob_clip': 0.007467073061040786, 'n_components': 80, 'logistic_c': 5.316669443659916e-05, 'pca_fit': 'combined', 'solver': 'lbfgs', 'max_iter': 2000, 'fit_intercept': True, 'standardize_with_source': True, 'rho': 0.7}
[I 2026-06-01 15:03:43,797] Trial 143 finished with value: 0.24295547896077724 and parameters: {'alpha': 126311.35505660462, 'n_pcs': 3500, 'iw_method': 'pc_logistic', 'iw_clip_max': 2.5, 'iw_prob_clip': 0.007467073061040786, 'iw_n_components': 80, 'iw_logistic_c': 5.316669443659916e-05, 'iw_pca_fit': 'combined', 'iw_solver': 'lbfgs', 'iw_rho': 0.7}. Best is trial 143 with value: 0.24295547896077724.
2026-06-01 15:03:43 | INFO | Trial 144 | outer=2 | alpha=1.303e+05 n_pcs=3500 (pc_topk) weight={'name': 'pc_logistic', 'floor': 1e-06, 'clip_max': 2.5, 'prob_clip': 0.010005887773494072, 'n_components': 80, 'logistic_c': 4.217394384573704e-05, 'pca_fit': 'combined', 'solver': 'lbfgs', 'max_iter': 2000, 'fit_intercept': True, 'standardize_with_source': True, 'rho': 0.7}
