[I 2026-06-02 01:04:42,069] Trial 72 finished with value: 0.23568061178882563 and parameters: {'alpha': 167983.73966647984, 'n_pcs': 3500, 'iw_method': 'pc_logistic', 'iw_clip_max': 4.0, 'iw_prob_clip': 0.000642012700191552, 'iw_n_components': 100, 'iw_logistic_c': 0.00024768716085945755, 'iw_pca_fit': 'combined', 'iw_solver': 'lbfgs', 'iw_rho': 0.85}. Best is trial 71 with value: 0.23573846843134186.
2026-06-02 01:04:42 | INFO | Trial 73 | outer=10 | alpha=1.733e+05 n_pcs=3500 (pc_topk) weight={'name': 'pc_logistic', 'floor': 1e-06, 'clip_max': 4.0, 'prob_clip': 0.0006096282075474414, 'n_components': 100, 'logistic_c': 0.0002179362397225586, 'pca_fit': 'combined', 'solver': 'lbfgs', 'max_iter': 2000, 'fit_intercept': True, 'standardize_with_source': True, 'rho': 0.85}
[I 2026-06-02 01:04:55,681] Trial 73 finished with value: 0.23572018838578646 and parameters: {'alpha': 173301.9806213623, 'n_pcs': 3500, 'iw_method': 'pc_logistic', 'iw_clip_max': 4.0, 'iw_prob_clip': 0.0006096282075474414, 'iw_n_components': 100, 'iw_logistic_c': 0.0002179362397225586, 'iw_pca_fit': 'combined', 'iw_solver': 'lbfgs', 'iw_rho': 0.85}. Best is trial 71 with value: 0.23573846843134186.
2026-06-02 01:04:55 | INFO | Trial 74 | outer=10 | alpha=1.727e+05 n_pcs=3500 (pc_topk) weight={'name': 'pc_logistic', 'floor': 1e-06, 'clip_max': 4.0, 'prob_clip': 0.0006097620409078908, 'n_components': 100, 'logistic_c': 0.00020550962673250095, 'pca_fit': 'combined', 'solver': 'lbfgs', 'max_iter': 2000, 'fit_intercept': True, 'standardize_with_source': True, 'rho': 0.85}
[I 2026-06-02 01:05:08,683] Trial 74 finished with value: 0.23575054540636903 and parameters: {'alpha': 172705.97646650675, 'n_pcs': 3500, 'iw_method': 'pc_logistic', 'iw_clip_max': 4.0, 'iw_prob_clip': 0.0006097620409078908, 'iw_n_components': 100, 'iw_logistic_c': 0.00020550962673250095, 'iw_pca_fit': 'combined', 'iw_solver': 'lbfgs', 'iw_rho': 0.85}. Best is trial 74 with value: 0.23575054540636903.
2026-06-02 01:05:08 | INFO | Trial 75 | outer=10 | alpha=3.544e+05 n_pcs=4500 (pc_topk) weight={'name': 'pc_logistic', 'floor': 1e-06, 'clip_max': 4.0, 'prob_clip': 0.0007383628062112849, 'n_components': 100, 'logistic_c': 0.0002136864349747287, 'pca_fit': 'combined', 'solver': 'lbfgs', 'max_iter': 2000, 'fit_intercept': True, 'standardize_with_source': True, 'rho': 0.85}
[I 2026-06-02 01:05:25,804] Trial 75 finished with value: 0.23318208576488492 and parameters: {'alpha': 354351.2998013402, 'n_pcs': 4500, 'iw_method': 'pc_logistic', 'iw_clip_max': 4.0, 'iw_prob_clip': 0.0007383628062112849, 'iw_n_components': 100, 'iw_logistic_c': 0.0002136864349747287, 'iw_pca_fit': 'combined', 'iw_solver': 'lbfgs', 'iw_rho': 0.85}. Best is trial 74 with value: 0.23575054540636903.
2026-06-02 01:05:25 | INFO | Trial 76 | outer=10 | alpha=4.632e+05 n_pcs=3500 (pc_topk) weight={'name': 'pc_logistic', 'floor': 1e-06, 'clip_max': 4.0, 'prob_clip': 0.0011931478067576727, 'n_components': 100, 'logistic_c': 1.4991935890434646e-05, 'pca_fit': 'combined', 'solver': 'lbfgs', 'max_iter': 2000, 'fit_intercept': True, 'standardize_with_source': True, 'rho': 1.0}
[I 2026-06-02 01:05:36,672] Trial 76 finished with value: 0.22872664238208165 and parameters: {'alpha': 463211.0774779882, 'n_pcs': 3500, 'iw_method': 'pc_logistic', 'iw_clip_max': 4.0, 'iw_prob_clip': 0.0011931478067576727, 'iw_n_components': 100, 'iw_logistic_c': 1.4991935890434646e-05, 'iw_pca_fit': 'combined', 'iw_solver': 'lbfgs', 'iw_rho': 1.0}. Best is trial 74 with value: 0.23575054540636903.
2026-06-02 01:05:36 | INFO | Trial 77 | outer=10 | alpha=1.626e+05 n_pcs=4000 (pc_topk) weight={'name': 'pc_logistic', 'floor': 1e-06, 'clip_max': 4.0, 'prob_clip': 0.0005796409114947176, 'n_components': 100, 'logistic_c': 3.7407472309709426e-05, 'pca_fit': 'combined', 'solver': 'lbfgs', 'max_iter': 2000, 'fit_intercept': True, 'standardize_with_source': True, 'rho': 0.85}
[I 2026-06-02 01:05:50,902] Trial 77 finished with value: 0.23522458668641982 and parameters: {'alpha': 162628.3255825901, 'n_pcs': 4000, 'iw_method': 'pc_logistic', 'iw_clip_max': 4.0, 'iw_prob_clip': 0.0005796409114947176, 'iw_n_components': 100, 'iw_logistic_c': 3.7407472309709426e-05, 'iw_pca_fit': 'combined', 'iw_solver': 'lbfgs', 'iw_rho': 0.85}. Best is trial 74 with value: 0.23575054540636903.
2026-06-02 01:05:50 | INFO | Trial 78 | outer=10 | alpha=6.787e+05 n_pcs=4000 (pc_topk) weight={'name': 'pc_logistic', 'floor': 1e-06, 'clip_max': 4.0, 'prob_clip': 0.0005845527420702622, 'n_components': 100, 'logistic_c': 4.027844785635386e-05, 'pca_fit': 'combined', 'solver': 'lbfgs', 'max_iter': 2000, 'fit_intercept': True, 'standardize_with_source': True, 'rho': 0.85}
[I 2026-06-02 01:06:04,227] Trial 78 finished with value: 0.22686071895580148 and parameters: {'alpha': 678666.747734419, 'n_pcs': 4000, 'iw_method': 'pc_logistic', 'iw_clip_max': 4.0, 'iw_prob_clip': 0.0005845527420702622, 'iw_n_components': 100, 'iw_logistic_c': 4.027844785635386e-05, 'iw_pca_fit': 'combined', 'iw_solver': 'lbfgs', 'iw_rho': 0.85}. Best is trial 74 with value: 0.23575054540636903.
2026-06-02 01:06:04 | INFO | Trial 79 | outer=10 | alpha=2.639e+05 n_pcs=4000 (pc_topk) weight={'name': 'pc_logistic', 'floor': 1e-06, 'clip_max': 4.0, 'prob_clip': 0.000759698084354563, 'n_components': 100, 'logistic_c': 0.00017214736060289232, 'pca_fit': 'combined', 'solver': 'lbfgs', 'max_iter': 2000, 'fit_intercept': True, 'standardize_with_source': True, 'rho': 0.5}
[I 2026-06-02 01:06:19,611] Trial 79 finished with value: 0.23358468229816515 and parameters: {'alpha': 263859.61321228655, 'n_pcs': 4000, 'iw_method': 'pc_logistic', 'iw_clip_max': 4.0, 'iw_prob_clip': 0.000759698084354563, 'iw_n_components': 100, 'iw_logistic_c': 0.00017214736060289232, 'iw_pca_fit': 'combined', 'iw_solver': 'lbfgs', 'iw_rho': 0.5}. Best is trial 74 with value: 0.23575054540636903.
2026-06-02 01:06:19 | INFO | Trial 80 | outer=10 | alpha=1.677e+05 n_pcs=4500 (pc_topk) weight={'name': 'pc_logistic', 'floor': 1e-06, 'clip_max': 4.0, 'prob_clip': 0.000576107493366935, 'n_components': 20, 'logistic_c': 7.438582475842485e-05, 'pca_fit': 'combined', 'solver': 'lbfgs', 'max_iter': 2000, 'fit_intercept': True, 'standardize_with_source': True, 'rho': 0.85}
[I 2026-06-02 01:06:34,546] Trial 80 finished with value: 0.2329729712960135 and parameters: {'alpha': 167707.6992036408, 'n_pcs': 4500, 'iw_method': 'pc_logistic', 'iw_clip_max': 4.0, 'iw_prob_clip': 0.000576107493366935, 'iw_n_components': 20, 'iw_logistic_c': 7.438582475842485e-05, 'iw_pca_fit': 'combined', 'iw_solver': 'lbfgs', 'iw_rho': 0.85}. Best is trial 74 with value: 0.23575054540636903.
2026-06-02 01:06:34 | INFO | Trial 81 | outer=10 | alpha=1.398e+05 n_pcs=3500 (pc_topk) weight={'name': 'pc_logistic', 'floor': 1e-06, 'clip_max': 4.0, 'prob_clip': 0.0014039866357462654, 'n_components': 100, 'logistic_c': 0.00021932472632881113, 'pca_fit': 'combined', 'solver': 'lbfgs', 'max_iter': 2000, 'fit_intercept': True, 'standardize_with_source': True, 'rho': 0.85}
[I 2026-06-02 01:06:47,547] Trial 81 finished with value: 0.23573518599767432 and parameters: {'alpha': 139782.51768823803, 'n_pcs': 3500, 'iw_method': 'pc_logistic', 'iw_clip_max': 4.0, 'iw_prob_clip': 0.0014039866357462654, 'iw_n_components': 100, 'iw_logistic_c': 0.00021932472632881113, 'iw_pca_fit': 'combined', 'iw_solver': 'lbfgs', 'iw_rho': 0.85}. Best is trial 74 with value: 0.23575054540636903.
2026-06-02 01:06:47 | INFO | Trial 82 | outer=10 | alpha=7.767e+04 n_pcs=3500 (pc_topk) weight={'name': 'pc_logistic', 'floor': 1e-06, 'clip_max': 4.0, 'prob_clip': 0.0014731795676767522, 'n_components': 100, 'logistic_c': 9.037004658722997e-06, 'pca_fit': 'combined', 'solver': 'lbfgs', 'max_iter': 2000, 'fit_intercept': True, 'standardize_with_source': True, 'rho': 0.85}
[I 2026-06-02 01:06:58,342] Trial 82 finished with value: 0.23355332606220416 and parameters: {'alpha': 77668.71187460594, 'n_pcs': 3500, 'iw_method': 'pc_logistic', 'iw_clip_max': 4.0, 'iw_prob_clip': 0.0014731795676767522, 'iw_n_components': 100, 'iw_logistic_c': 9.037004658722997e-06, 'iw_pca_fit': 'combined', 'iw_solver': 'lbfgs', 'iw_rho': 0.85}. Best is trial 74 with value: 0.23575054540636903.
2026-06-02 01:06:58 | INFO | Trial 83 | outer=10 | alpha=2.393e+05 n_pcs=3500 (pc_topk) weight={'name': 'pc_logistic', 'floor': 1e-06, 'clip_max': 4.0, 'prob_clip': 0.0007785825421110462, 'n_components': 100, 'logistic_c': 0.00024431777286900753, 'pca_fit': 'combined', 'solver': 'lbfgs', 'max_iter': 2000, 'fit_intercept': True, 'standardize_with_source': True, 'rho': 0.85}
[I 2026-06-02 01:07:11,480] Trial 83 finished with value: 0.23496462072039762 and parameters: {'alpha': 239343.85030472788, 'n_pcs': 3500, 'iw_method': 'pc_logistic', 'iw_clip_max': 4.0, 'iw_prob_clip': 0.0007785825421110462, 'iw_n_components': 100, 'iw_logistic_c': 0.00024431777286900753, 'iw_pca_fit': 'combined', 'iw_solver': 'lbfgs', 'iw_rho': 0.85}. Best is trial 74 with value: 0.23575054540636903.
2026-06-02 01:07:11 | INFO | Trial 84 | outer=10 | alpha=1.090e+03 n_pcs=4000 (pc_topk) weight={'name': 'pc_logistic', 'floor': 1e-06, 'clip_max': 4.0, 'prob_clip': 0.0008060065142033111, 'n_components': 100, 'logistic_c': 3.441637390253173e-05, 'pca_fit': 'combined', 'solver': 'lbfgs', 'max_iter': 2000, 'fit_intercept': True, 'standardize_with_source': True, 'rho': 0.85}
[I 2026-06-02 01:07:24,923] Trial 84 finished with value: 0.10331935628629693 and parameters: {'alpha': 1089.5986621715542, 'n_pcs': 4000, 'iw_method': 'pc_logistic', 'iw_clip_max': 4.0, 'iw_prob_clip': 0.0008060065142033111, 'iw_n_components': 100, 'iw_logistic_c': 3.441637390253173e-05, 'iw_pca_fit': 'combined', 'iw_solver': 'lbfgs', 'iw_rho': 0.85}. Best is trial 74 with value: 0.23575054540636903.
2026-06-02 01:07:24 | INFO | Trial 85 | outer=10 | alpha=3.859e+05 n_pcs=3500 (pc_topk) weight={'name': 'pc_logistic', 'floor': 1e-06, 'clip_max': 4.0, 'prob_clip': 0.005087207528067212, 'n_components': 60, 'logistic_c': 0.00017492521889874465, 'pca_fit': 'combined', 'solver': 'lbfgs', 'max_iter': 2000, 'fit_intercept': True, 'standardize_with_source': True, 'rho': 0.85}
[I 2026-06-02 01:07:38,110] Trial 85 finished with value: 0.23072113953869358 and parameters: {'alpha': 385857.16461240733, 'n_pcs': 3500, 'iw_method': 'pc_logistic', 'iw_clip_max': 4.0, 'iw_prob_clip': 0.005087207528067212, 'iw_n_components': 60, 'iw_logistic_c': 0.00017492521889874465, 'iw_pca_fit': 'combined', 'iw_solver': 'lbfgs', 'iw_rho': 0.85}. Best is trial 74 with value: 0.23575054540636903.
2026-06-02 01:07:38 | INFO | Trial 86 | outer=10 | alpha=1.433e+05 n_pcs=4000 (pc_topk) weight={'name': 'pc_logistic', 'floor': 1e-06, 'clip_max': 12.0, 'prob_clip': 0.0018105576256943127, 'n_components': 100, 'logistic_c': 7.435895216976142e-05, 'pca_fit': 'combined', 'solver': 'lbfgs', 'max_iter': 2000, 'fit_intercept': True, 'standardize_with_source': True, 'rho': 0.85}
[I 2026-06-02 01:07:51,738] Trial 86 finished with value: 0.22958286976600667 and parameters: {'alpha': 143272.60597476593, 'n_pcs': 4000, 'iw_method': 'pc_logistic', 'iw_clip_max': 12.0, 'iw_prob_clip': 0.0018105576256943127, 'iw_n_components': 100, 'iw_logistic_c': 7.435895216976142e-05, 'iw_pca_fit': 'combined', 'iw_solver': 'lbfgs', 'iw_rho': 0.85}. Best is trial 74 with value: 0.23575054540636903.
2026-06-02 01:07:51 | INFO | Trial 87 | outer=10 | alpha=8.210e+06 n_pcs=3500 (pc_topk) weight={'name': 'pc_logistic', 'floor': 1e-06, 'clip_max': 4.0, 'prob_clip': 0.0005454295951478858, 'n_components': 40, 'logistic_c': 0.0002397333936585456, 'pca_fit': 'combined', 'solver': 'lbfgs', 'max_iter': 2000, 'fit_intercept': True, 'standardize_with_source': True, 'rho': 0.85}
[I 2026-06-02 01:08:04,820] Trial 87 finished with value: 0.20801821065767684 and parameters: {'alpha': 8209539.471326382, 'n_pcs': 3500, 'iw_method': 'pc_logistic', 'iw_clip_max': 4.0, 'iw_prob_clip': 0.0005454295951478858, 'iw_n_components': 40, 'iw_logistic_c': 0.0002397333936585456, 'iw_pca_fit': 'combined', 'iw_solver': 'lbfgs', 'iw_rho': 0.85}. Best is trial 74 with value: 0.23575054540636903.
2026-06-02 01:08:04 | INFO | Trial 88 | outer=10 | alpha=2.721e+05 n_pcs=500 (pc_topk) weight={'name': 'uniform'}
[I 2026-06-02 01:08:05,647] Trial 88 finished with value: 0.18386221196778652 and parameters: {'alpha': 272092.9919965213, 'n_pcs': 500, 'iw_method': 'uniform'}. Best is trial 74 with value: 0.23575054540636903.
2026-06-02 01:08:05 | INFO | Trial 89 | outer=10 | alpha=9.030e+04 n_pcs=3500 (pc_topk) weight={'name': 'pc_logistic', 'floor': 1e-06, 'clip_max': 4.0, 'prob_clip': 0.025572641308304483, 'n_components': 100, 'logistic_c': 2.1384631869933167e-05, 'pca_fit': 'combined', 'solver': 'lbfgs', 'max_iter': 2000, 'fit_intercept': True, 'standardize_with_source': True, 'rho': 0.7}
[I 2026-06-02 01:08:16,305] Trial 89 finished with value: 0.23647889619791398 and parameters: {'alpha': 90303.82864341038, 'n_pcs': 3500, 'iw_method': 'pc_logistic', 'iw_clip_max': 4.0, 'iw_prob_clip': 0.025572641308304483, 'iw_n_components': 100, 'iw_logistic_c': 2.1384631869933167e-05, 'iw_pca_fit': 'combined', 'iw_solver': 'lbfgs', 'iw_rho': 0.7}. Best is trial 89 with value: 0.23647889619791398.
2026-06-02 01:08:16 | INFO | Trial 90 | outer=10 | alpha=7.691e+04 n_pcs=3500 (pc_topk) weight={'name': 'pc_logistic', 'floor': 1e-06, 'clip_max': 1.5, 'prob_clip': 0.04618014704611272, 'n_components': 80, 'logistic_c': 2.5153741261410537e-05, 'pca_fit': 'combined', 'solver': 'lbfgs', 'max_iter': 2000, 'fit_intercept': True, 'standardize_with_source': True, 'rho': 0.7}
[I 2026-06-02 01:08:27,203] Trial 90 finished with value: 0.23188311822744737 and parameters: {'alpha': 76909.83874719124, 'n_pcs': 3500, 'iw_method': 'pc_logistic', 'iw_clip_max': 1.5, 'iw_prob_clip': 0.04618014704611272, 'iw_n_components': 80, 'iw_logistic_c': 2.5153741261410537e-05, 'iw_pca_fit': 'combined', 'iw_solver': 'lbfgs', 'iw_rho': 0.7}. Best is trial 89 with value: 0.23647889619791398.
2026-06-02 01:08:27 | INFO | Trial 91 | outer=10 | alpha=1.618e+05 n_pcs=3500 (pc_topk) weight={'name': 'pc_logistic', 'floor': 1e-06, 'clip_max': 4.0, 'prob_clip': 0.008588056589340672, 'n_components': 100, 'logistic_c': 8.281231309236937e-05, 'pca_fit': 'combined', 'solver': 'lbfgs', 'max_iter': 2000, 'fit_intercept': True, 'standardize_with_source': True, 'rho': 0.7}
[I 2026-06-02 01:08:39,352] Trial 91 finished with value: 0.23524491049958113 and parameters: {'alpha': 161849.98967450016, 'n_pcs': 3500, 'iw_method': 'pc_logistic', 'iw_clip_max': 4.0, 'iw_prob_clip': 0.008588056589340672, 'iw_n_components': 100, 'iw_logistic_c': 8.281231309236937e-05, 'iw_pca_fit': 'combined', 'iw_solver': 'lbfgs', 'iw_rho': 0.7}. Best is trial 89 with value: 0.23647889619791398.
2026-06-02 01:08:39 | INFO | Trial 92 | outer=10 | alpha=9.201e+04 n_pcs=3500 (pc_topk) weight={'name': 'pc_logistic', 'floor': 1e-06, 'clip_max': 4.0, 'prob_clip': 0.02161094001489248, 'n_components': 100, 'logistic_c': 0.00010307448787187479, 'pca_fit': 'combined', 'solver': 'lbfgs', 'max_iter': 2000, 'fit_intercept': True, 'standardize_with_source': True, 'rho': 0.7}
[I 2026-06-02 01:08:52,274] Trial 92 finished with value: 0.2365584516560904 and parameters: {'alpha': 92007.08248425512, 'n_pcs': 3500, 'iw_method': 'pc_logistic', 'iw_clip_max': 4.0, 'iw_prob_clip': 0.02161094001489248, 'iw_n_components': 100, 'iw_logistic_c': 0.00010307448787187479, 'iw_pca_fit': 'combined', 'iw_solver': 'lbfgs', 'iw_rho': 0.7}. Best is trial 92 with value: 0.2365584516560904.
2026-06-02 01:08:52 | INFO | Trial 93 | outer=10 | alpha=8.999e+04 n_pcs=3500 (pc_topk) weight={'name': 'pc_logistic', 'floor': 1e-06, 'clip_max': 4.0, 'prob_clip': 0.022100327311098948, 'n_components': 100, 'logistic_c': 9.77474592365622e-05, 'pca_fit': 'combined', 'solver': 'lbfgs', 'max_iter': 2000, 'fit_intercept': True, 'standardize_with_source': True, 'rho': 0.7}
[I 2026-06-02 01:09:04,813] Trial 93 finished with value: 0.23658233539278095 and parameters: {'alpha': 89986.09257020337, 'n_pcs': 3500, 'iw_method': 'pc_logistic', 'iw_clip_max': 4.0, 'iw_prob_clip': 0.022100327311098948, 'iw_n_components': 100, 'iw_logistic_c': 9.77474592365622e-05, 'iw_pca_fit': 'combined', 'iw_solver': 'lbfgs', 'iw_rho': 0.7}. Best is trial 93 with value: 0.23658233539278095.
2026-06-02 01:09:04 | INFO | Trial 94 | outer=10 | alpha=4.965e+04 n_pcs=3500 (pc_topk) weight={'name': 'pc_logistic', 'floor': 1e-06, 'clip_max': 4.0, 'prob_clip': 0.02369160389747823, 'n_components': 100, 'logistic_c': 9.977610471616218e-05, 'pca_fit': 'combined', 'solver': 'lbfgs', 'max_iter': 2000, 'fit_intercept': True, 'standardize_with_source': True, 'rho': 0.7}
[I 2026-06-02 01:09:17,544] Trial 94 finished with value: 0.2329643571428243 and parameters: {'alpha': 49653.43397124462, 'n_pcs': 3500, 'iw_method': 'pc_logistic', 'iw_clip_max': 4.0, 'iw_prob_clip': 0.02369160389747823, 'iw_n_components': 100, 'iw_logistic_c': 9.977610471616218e-05, 'iw_pca_fit': 'combined', 'iw_solver': 'lbfgs', 'iw_rho': 0.7}. Best is trial 93 with value: 0.23658233539278095.
2026-06-02 01:09:17 | INFO | Trial 95 | outer=10 | alpha=9.861e+04 n_pcs=3500 (pc_topk) weight={'name': 'pc_logistic', 'floor': 1e-06, 'clip_max': 4.0, 'prob_clip': 0.03509152865822904, 'n_components': 100, 'logistic_c': 1.0589657224140829e-05, 'pca_fit': 'combined', 'solver': 'lbfgs', 'max_iter': 2000, 'fit_intercept': True, 'standardize_with_source': True, 'rho': 0.7}
[I 2026-06-02 01:09:28,473] Trial 95 finished with value: 0.23290325271950518 and parameters: {'alpha': 98608.9332075412, 'n_pcs': 3500, 'iw_method': 'pc_logistic', 'iw_clip_max': 4.0, 'iw_prob_clip': 0.03509152865822904, 'iw_n_components': 100, 'iw_logistic_c': 1.0589657224140829e-05, 'iw_pca_fit': 'combined', 'iw_solver': 'lbfgs', 'iw_rho': 0.7}. Best is trial 93 with value: 0.23658233539278095.
2026-06-02 01:09:28 | INFO | Trial 96 | outer=10 | alpha=1.291e+05 n_pcs=4000 (pc_topk) weight={'name': 'pc_logistic', 'floor': 1e-06, 'clip_max': 4.0, 'prob_clip': 0.015927132449680765, 'n_components': 100, 'logistic_c': 2.8220009147592454e-05, 'pca_fit': 'combined', 'solver': 'lbfgs', 'max_iter': 2000, 'fit_intercept': True, 'standardize_with_source': True, 'rho': 0.7}
[I 2026-06-02 01:09:41,052] Trial 96 finished with value: 0.23629278927323627 and parameters: {'alpha': 129062.27192204824, 'n_pcs': 4000, 'iw_method': 'pc_logistic', 'iw_clip_max': 4.0, 'iw_prob_clip': 0.015927132449680765, 'iw_n_components': 100, 'iw_logistic_c': 2.8220009147592454e-05, 'iw_pca_fit': 'combined', 'iw_solver': 'lbfgs', 'iw_rho': 0.7}. Best is trial 93 with value: 0.23658233539278095.
2026-06-02 01:09:41 | INFO | Trial 97 | outer=10 | alpha=3.688e+04 n_pcs=3500 (pc_topk) weight={'name': 'pc_logistic', 'floor': 1e-06, 'clip_max': 7.0, 'prob_clip': 0.015558090228154362, 'n_components': 100, 'logistic_c': 0.00013207143448277356, 'pca_fit': 'combined', 'solver': 'lbfgs', 'max_iter': 2000, 'fit_intercept': True, 'standardize_with_source': True, 'rho': 0.7}
[I 2026-06-02 01:09:53,901] Trial 97 finished with value: 0.225141388722144 and parameters: {'alpha': 36876.37686127128, 'n_pcs': 3500, 'iw_method': 'pc_logistic', 'iw_clip_max': 7.0, 'iw_prob_clip': 0.015558090228154362, 'iw_n_components': 100, 'iw_logistic_c': 0.00013207143448277356, 'iw_pca_fit': 'combined', 'iw_solver': 'lbfgs', 'iw_rho': 0.7}. Best is trial 93 with value: 0.23658233539278095.
2026-06-02 01:09:53 | INFO | Trial 98 | outer=10 | alpha=7.662e+04 n_pcs=3500 (pc_topk) weight={'name': 'pc_logistic', 'floor': 1e-06, 'clip_max': 4.0, 'prob_clip': 0.02142754231755951, 'n_components': 100, 'logistic_c': 3.747974218525653e-06, 'pca_fit': 'combined', 'solver': 'lbfgs', 'max_iter': 2000, 'fit_intercept': True, 'standardize_with_source': True, 'rho': 0.7}
[I 2026-06-02 01:10:05,048] Trial 98 finished with value: 0.2291831758792365 and parameters: {'alpha': 76615.61453623758, 'n_pcs': 3500, 'iw_method': 'pc_logistic', 'iw_clip_max': 4.0, 'iw_prob_clip': 0.02142754231755951, 'iw_n_components': 100, 'iw_logistic_c': 3.747974218525653e-06, 'iw_pca_fit': 'combined', 'iw_solver': 'lbfgs', 'iw_rho': 0.7}. Best is trial 93 with value: 0.23658233539278095.
2026-06-02 01:10:05 | INFO | Trial 99 | outer=10 | alpha=1.168e+05 n_pcs=3500 (pc_topk) weight={'name': 'pc_logistic', 'floor': 1e-06, 'clip_max': 2.5, 'prob_clip': 0.01200346136696657, 'n_components': 100, 'logistic_c': 1.3766574142772586e-06, 'pca_fit': 'combined', 'solver': 'lbfgs', 'max_iter': 2000, 'fit_intercept': True, 'standardize_with_source': True, 'rho': 0.7}
[I 2026-06-02 01:10:16,457] Trial 99 finished with value: 0.22529161840416148 and parameters: {'alpha': 116819.37438623139, 'n_pcs': 3500, 'iw_method': 'pc_logistic', 'iw_clip_max': 2.5, 'iw_prob_clip': 0.01200346136696657, 'iw_n_components': 100, 'iw_logistic_c': 1.3766574142772586e-06, 'iw_pca_fit': 'combined', 'iw_solver': 'lbfgs', 'iw_rho': 0.7}. Best is trial 93 with value: 0.23658233539278095.
2026-06-02 01:10:16 | INFO | Trial 100 | outer=10 | alpha=5.209e+04 n_pcs=4000 (pc_topk) weight={'name': 'pc_logistic', 'floor': 1e-06, 'clip_max': 4.0, 'prob_clip': 0.02963980164426677, 'n_components': 100, 'logistic_c': 1.6306192988094143e-05, 'pca_fit': 'combined', 'solver': 'lbfgs', 'max_iter': 2000, 'fit_intercept': True, 'standardize_with_source': True, 'rho': 0.7}
