[I 2026-06-01 01:56:07,807] Trial 243 finished with value: 0.22312372713937 and parameters: {'alpha': 149358.37614951644, 'n_pcs': 4000, 'weight_scheme': 'exponential', 'weight_clip_max': 5.0, 'weight_exponential_beta': 5.195269593899662}. Best is trial 67 with value: 0.22356194409955688.
2026-06-01 01:56:07 | INFO | src.nested_cv_avggrm_weighted_unified | Trial 244 | outer=8 | alpha=1.465e+05 n_pcs=4000 (pc_topk) weight_search=on
2026-06-01 01:56:07 | INFO | src.nested_cv_avggrm_weighted_unified | Trial 244 | outer=8 | weight={'name': 'exponential', 'floor': 1e-06, 'clip_max': 5.0, 'beta': 4.93883510757274}
[I 2026-06-01 01:56:13,463] Trial 244 finished with value: 0.2230475936226075 and parameters: {'alpha': 146549.1977604926, 'n_pcs': 4000, 'weight_scheme': 'exponential', 'weight_clip_max': 5.0, 'weight_exponential_beta': 4.93883510757274}. Best is trial 67 with value: 0.22356194409955688.
2026-06-01 01:56:13 | INFO | src.nested_cv_avggrm_weighted_unified | Trial 245 | outer=8 | alpha=1.177e+05 n_pcs=4000 (pc_topk) weight_search=on
2026-06-01 01:56:13 | INFO | src.nested_cv_avggrm_weighted_unified | Trial 245 | outer=8 | weight={'name': 'exponential', 'floor': 1e-06, 'clip_max': 5.0, 'beta': 5.203817948052144}
[I 2026-06-01 01:56:19,161] Trial 245 finished with value: 0.22294561829786294 and parameters: {'alpha': 117723.01880689267, 'n_pcs': 4000, 'weight_scheme': 'exponential', 'weight_clip_max': 5.0, 'weight_exponential_beta': 5.203817948052144}. Best is trial 67 with value: 0.22356194409955688.
2026-06-01 01:56:19 | INFO | src.nested_cv_avggrm_weighted_unified | Trial 246 | outer=8 | alpha=1.376e+05 n_pcs=4000 (pc_topk) weight_search=on
2026-06-01 01:56:19 | INFO | src.nested_cv_avggrm_weighted_unified | Trial 246 | outer=8 | weight={'name': 'exponential', 'floor': 1e-06, 'clip_max': 5.0, 'beta': 5.333522433596725}
[I 2026-06-01 01:56:24,831] Trial 246 finished with value: 0.22305726288170438 and parameters: {'alpha': 137618.76955290622, 'n_pcs': 4000, 'weight_scheme': 'exponential', 'weight_clip_max': 5.0, 'weight_exponential_beta': 5.333522433596725}. Best is trial 67 with value: 0.22356194409955688.
2026-06-01 01:56:24 | INFO | src.nested_cv_avggrm_weighted_unified | Trial 247 | outer=8 | alpha=9.573e+04 n_pcs=4000 (pc_topk) weight_search=on
2026-06-01 01:56:24 | INFO | src.nested_cv_avggrm_weighted_unified | Trial 247 | outer=8 | weight={'name': 'exponential', 'floor': 1e-06, 'clip_max': 5.0, 'beta': 5.250895991686621}
[I 2026-06-01 01:56:30,459] Trial 247 finished with value: 0.22254197228132994 and parameters: {'alpha': 95734.3794310582, 'n_pcs': 4000, 'weight_scheme': 'exponential', 'weight_clip_max': 5.0, 'weight_exponential_beta': 5.250895991686621}. Best is trial 67 with value: 0.22356194409955688.
2026-06-01 01:56:30 | INFO | src.nested_cv_avggrm_weighted_unified | Trial 248 | outer=8 | alpha=1.346e+05 n_pcs=4000 (pc_topk) weight_search=on
2026-06-01 01:56:30 | INFO | src.nested_cv_avggrm_weighted_unified | Trial 248 | outer=8 | weight={'name': 'exponential', 'floor': 1e-06, 'clip_max': 5.0, 'beta': 4.9294144689890835}
[I 2026-06-01 01:56:36,095] Trial 248 finished with value: 0.22302997767814312 and parameters: {'alpha': 134605.05744945895, 'n_pcs': 4000, 'weight_scheme': 'exponential', 'weight_clip_max': 5.0, 'weight_exponential_beta': 4.9294144689890835}. Best is trial 67 with value: 0.22356194409955688.
2026-06-01 01:56:36 | INFO | src.nested_cv_avggrm_weighted_unified | Trial 249 | outer=8 | alpha=1.545e+05 n_pcs=4000 (pc_topk) weight_search=on
2026-06-01 01:56:36 | INFO | src.nested_cv_avggrm_weighted_unified | Trial 249 | outer=8 | weight={'name': 'exponential', 'floor': 1e-06, 'clip_max': 5.0, 'beta': 5.30148531988054}
[I 2026-06-01 01:56:41,756] Trial 249 finished with value: 0.223118991611573 and parameters: {'alpha': 154529.98431094456, 'n_pcs': 4000, 'weight_scheme': 'exponential', 'weight_clip_max': 5.0, 'weight_exponential_beta': 5.30148531988054}. Best is trial 67 with value: 0.22356194409955688.
2026-06-01 01:56:41 | INFO | src.nested_cv_avggrm_weighted_unified | Trial 250 | outer=8 | alpha=1.058e+05 n_pcs=4000 (pc_topk) weight_search=on
2026-06-01 01:56:41 | INFO | src.nested_cv_avggrm_weighted_unified | Trial 250 | outer=8 | weight={'name': 'exponential', 'floor': 1e-06, 'clip_max': 10.0, 'beta': 4.754991962794644}
[I 2026-06-01 01:56:47,430] Trial 250 finished with value: 0.2179388816223419 and parameters: {'alpha': 105772.50586215762, 'n_pcs': 4000, 'weight_scheme': 'exponential', 'weight_clip_max': 10.0, 'weight_exponential_beta': 4.754991962794644}. Best is trial 67 with value: 0.22356194409955688.
2026-06-01 01:56:47 | INFO | src.nested_cv_avggrm_weighted_unified | Trial 251 | outer=8 | alpha=1.500e+05 n_pcs=4000 (pc_topk) weight_search=on
2026-06-01 01:56:47 | INFO | src.nested_cv_avggrm_weighted_unified | Trial 251 | outer=8 | weight={'name': 'exponential', 'floor': 1e-06, 'clip_max': 5.0, 'beta': 5.360776891606417}
[I 2026-06-01 01:56:53,052] Trial 251 finished with value: 0.22309793971945732 and parameters: {'alpha': 150000.1164212751, 'n_pcs': 4000, 'weight_scheme': 'exponential', 'weight_clip_max': 5.0, 'weight_exponential_beta': 5.360776891606417}. Best is trial 67 with value: 0.22356194409955688.
2026-06-01 01:56:53 | INFO | src.nested_cv_avggrm_weighted_unified | Trial 252 | outer=8 | alpha=1.226e+05 n_pcs=4000 (pc_topk) weight_search=on
2026-06-01 01:56:53 | INFO | src.nested_cv_avggrm_weighted_unified | Trial 252 | outer=8 | weight={'name': 'exponential', 'floor': 1e-06, 'clip_max': 20.0, 'beta': 5.13683947679922}
[I 2026-06-01 01:56:58,841] Trial 252 finished with value: 0.21297339021528544 and parameters: {'alpha': 122553.11602229322, 'n_pcs': 4000, 'weight_scheme': 'exponential', 'weight_clip_max': 20.0, 'weight_exponential_beta': 5.13683947679922}. Best is trial 67 with value: 0.22356194409955688.
2026-06-01 01:56:58 | INFO | src.nested_cv_avggrm_weighted_unified | Trial 253 | outer=8 | alpha=1.463e+05 n_pcs=4000 (pc_topk) weight_search=on
2026-06-01 01:56:58 | INFO | src.nested_cv_avggrm_weighted_unified | Trial 253 | outer=8 | weight={'name': 'uniform', 'floor': 1e-06, 'clip_max': 5.0}
2026-06-01 01:57:01 | INFO | src.nested_cv_avggrm_weighted_unified | Trial 253 | outer=8 | pruned after 5/10 inner folds (mean r=0.2168)
[I 2026-06-01 01:57:01,483] Trial 253 pruned. 
2026-06-01 01:57:01 | INFO | src.nested_cv_avggrm_weighted_unified | Trial 254 | outer=8 | alpha=1.564e+05 n_pcs=3500 (pc_topk) weight_search=on
2026-06-01 01:57:01 | INFO | src.nested_cv_avggrm_weighted_unified | Trial 254 | outer=8 | weight={'name': 'exponential', 'floor': 1e-06, 'clip_max': 5.0, 'beta': 5.391397497819571}
[I 2026-06-01 01:57:06,302] Trial 254 finished with value: 0.22187375747633714 and parameters: {'alpha': 156435.768945033, 'n_pcs': 3500, 'weight_scheme': 'exponential', 'weight_clip_max': 5.0, 'weight_exponential_beta': 5.391397497819571}. Best is trial 67 with value: 0.22356194409955688.
2026-06-01 01:57:06 | INFO | src.nested_cv_avggrm_weighted_unified | Trial 255 | outer=8 | alpha=2.238e+05 n_pcs=4000 (pc_topk) weight_search=on
2026-06-01 01:57:06 | INFO | src.nested_cv_avggrm_weighted_unified | Trial 255 | outer=8 | weight={'name': 'exponential', 'floor': 1e-06, 'clip_max': 5.0, 'beta': 5.027560660152411}
[I 2026-06-01 01:57:12,084] Trial 255 finished with value: 0.2227336149310271 and parameters: {'alpha': 223775.62637027472, 'n_pcs': 4000, 'weight_scheme': 'exponential', 'weight_clip_max': 5.0, 'weight_exponential_beta': 5.027560660152411}. Best is trial 67 with value: 0.22356194409955688.
2026-06-01 01:57:12 | INFO | src.nested_cv_avggrm_weighted_unified | Trial 256 | outer=8 | alpha=1.234e+05 n_pcs=4000 (pc_topk) weight_search=on
2026-06-01 01:57:12 | INFO | src.nested_cv_avggrm_weighted_unified | Trial 256 | outer=8 | weight={'name': 'linear', 'floor': 1e-06, 'clip_max': 5.0, 'min_weight': 0.5701211282832376, 'max_weight': 4.115250080190721}
[I 2026-06-01 01:57:18,295] Trial 256 finished with value: 0.21901326290117135 and parameters: {'alpha': 123406.28336048406, 'n_pcs': 4000, 'weight_scheme': 'linear', 'weight_clip_max': 5.0, 'weight_linear_min_weight': 0.5701211282832376, 'weight_linear_max_weight': 4.115250080190721}. Best is trial 67 with value: 0.22356194409955688.
2026-06-01 01:57:18 | INFO | src.nested_cv_avggrm_weighted_unified | Trial 257 | outer=8 | alpha=1.420e+05 n_pcs=4500 (pc_topk) weight_search=on
2026-06-01 01:57:18 | INFO | src.nested_cv_avggrm_weighted_unified | Trial 257 | outer=8 | weight={'name': 'exponential', 'floor': 1e-06, 'clip_max': 3.0, 'beta': 5.35784156083329}
[I 2026-06-01 01:57:25,066] Trial 257 finished with value: 0.22235001924221973 and parameters: {'alpha': 142014.101327274, 'n_pcs': 4500, 'weight_scheme': 'exponential', 'weight_clip_max': 3.0, 'weight_exponential_beta': 5.35784156083329}. Best is trial 67 with value: 0.22356194409955688.
2026-06-01 01:57:25 | INFO | src.nested_cv_avggrm_weighted_unified | Trial 258 | outer=8 | alpha=1.584e+05 n_pcs=4000 (pc_topk) weight_search=on
2026-06-01 01:57:25 | INFO | src.nested_cv_avggrm_weighted_unified | Trial 258 | outer=8 | weight={'name': 'exponential', 'floor': 1e-06, 'clip_max': 5.0, 'beta': 5.210891082480257}
[I 2026-06-01 01:57:30,665] Trial 258 finished with value: 0.22312892708991822 and parameters: {'alpha': 158425.0554062262, 'n_pcs': 4000, 'weight_scheme': 'exponential', 'weight_clip_max': 5.0, 'weight_exponential_beta': 5.210891082480257}. Best is trial 67 with value: 0.22356194409955688.
2026-06-01 01:57:30 | INFO | src.nested_cv_avggrm_weighted_unified | Trial 259 | outer=8 | alpha=8.058e+03 n_pcs=4000 (pc_topk) weight_search=on
2026-06-01 01:57:30 | INFO | src.nested_cv_avggrm_weighted_unified | Trial 259 | outer=8 | weight={'name': 'exponential', 'floor': 1e-06, 'clip_max': 5.0, 'beta': 4.706212259558968}
2026-06-01 01:57:34 | INFO | src.nested_cv_avggrm_weighted_unified | Trial 259 | outer=8 | pruned after 7/10 inner folds (mean r=0.1980)
[I 2026-06-01 01:57:34,630] Trial 259 pruned. 
2026-06-01 01:57:34 | INFO | src.nested_cv_avggrm_weighted_unified | Trial 260 | outer=8 | alpha=9.834e+04 n_pcs=3500 (pc_topk) weight_search=on
2026-06-01 01:57:34 | INFO | src.nested_cv_avggrm_weighted_unified | Trial 260 | outer=8 | weight={'name': 'exponential', 'floor': 1e-06, 'clip_max': 5.0, 'beta': 4.307828077058468}
[I 2026-06-01 01:57:39,436] Trial 260 finished with value: 0.22094820076838118 and parameters: {'alpha': 98336.46947945337, 'n_pcs': 3500, 'weight_scheme': 'exponential', 'weight_clip_max': 5.0, 'weight_exponential_beta': 4.307828077058468}. Best is trial 67 with value: 0.22356194409955688.
2026-06-01 01:57:39 | INFO | src.nested_cv_avggrm_weighted_unified | Trial 261 | outer=8 | alpha=1.561e+05 n_pcs=4000 (pc_topk) weight_search=on
2026-06-01 01:57:39 | INFO | src.nested_cv_avggrm_weighted_unified | Trial 261 | outer=8 | weight={'name': 'exponential', 'floor': 1e-06, 'clip_max': 5.0, 'beta': 5.192473428820968}
[I 2026-06-01 01:57:45,070] Trial 261 finished with value: 0.2231273760759016 and parameters: {'alpha': 156105.782862531, 'n_pcs': 4000, 'weight_scheme': 'exponential', 'weight_clip_max': 5.0, 'weight_exponential_beta': 5.192473428820968}. Best is trial 67 with value: 0.22356194409955688.
2026-06-01 01:57:45 | INFO | src.nested_cv_avggrm_weighted_unified | Trial 262 | outer=8 | alpha=1.175e+05 n_pcs=4000 (pc_topk) weight_search=on
2026-06-01 01:57:45 | INFO | src.nested_cv_avggrm_weighted_unified | Trial 262 | outer=8 | weight={'name': 'exponential', 'floor': 1e-06, 'clip_max': 5.0, 'beta': 5.2906809617524475}
[I 2026-06-01 01:57:51,166] Trial 262 finished with value: 0.2229096327444086 and parameters: {'alpha': 117514.69005190535, 'n_pcs': 4000, 'weight_scheme': 'exponential', 'weight_clip_max': 5.0, 'weight_exponential_beta': 5.2906809617524475}. Best is trial 67 with value: 0.22356194409955688.
2026-06-01 01:57:51 | INFO | src.nested_cv_avggrm_weighted_unified | Trial 263 | outer=8 | alpha=1.544e+05 n_pcs=4000 (pc_topk) weight_search=on
2026-06-01 01:57:51 | INFO | src.nested_cv_avggrm_weighted_unified | Trial 263 | outer=8 | weight={'name': 'exponential', 'floor': 1e-06, 'clip_max': 5.0, 'beta': 4.921398720005951}
[I 2026-06-01 01:57:56,810] Trial 263 finished with value: 0.2230316374616545 and parameters: {'alpha': 154363.60192174272, 'n_pcs': 4000, 'weight_scheme': 'exponential', 'weight_clip_max': 5.0, 'weight_exponential_beta': 4.921398720005951}. Best is trial 67 with value: 0.22356194409955688.
2026-06-01 01:57:56 | INFO | src.nested_cv_avggrm_weighted_unified | Trial 264 | outer=8 | alpha=8.824e+04 n_pcs=4000 (pc_topk) weight_search=on
2026-06-01 01:57:56 | INFO | src.nested_cv_avggrm_weighted_unified | Trial 264 | outer=8 | weight={'name': 'exponential', 'floor': 1e-06, 'clip_max': 5.0, 'beta': 5.411061608415471}
[I 2026-06-01 01:58:02,469] Trial 264 finished with value: 0.22219230480590832 and parameters: {'alpha': 88236.20684866796, 'n_pcs': 4000, 'weight_scheme': 'exponential', 'weight_clip_max': 5.0, 'weight_exponential_beta': 5.411061608415471}. Best is trial 67 with value: 0.22356194409955688.
2026-06-01 01:58:02 | INFO | src.nested_cv_avggrm_weighted_unified | Trial 265 | outer=8 | alpha=2.234e+05 n_pcs=4000 (pc_topk) weight_search=on
2026-06-01 01:58:02 | INFO | src.nested_cv_avggrm_weighted_unified | Trial 265 | outer=8 | weight={'name': 'exponential', 'floor': 1e-06, 'clip_max': 5.0, 'beta': 5.206113987414881}
[I 2026-06-01 01:58:08,097] Trial 265 finished with value: 0.22285117472470312 and parameters: {'alpha': 223374.36461235274, 'n_pcs': 4000, 'weight_scheme': 'exponential', 'weight_clip_max': 5.0, 'weight_exponential_beta': 5.206113987414881}. Best is trial 67 with value: 0.22356194409955688.
2026-06-01 01:58:08 | INFO | src.nested_cv_avggrm_weighted_unified | Trial 266 | outer=8 | alpha=1.315e+05 n_pcs=4500 (pc_topk) weight_search=on
2026-06-01 01:58:08 | INFO | src.nested_cv_avggrm_weighted_unified | Trial 266 | outer=8 | weight={'name': 'exponential', 'floor': 1e-06, 'clip_max': 5.0, 'beta': 8.750825525534042}
[I 2026-06-01 01:58:14,833] Trial 266 finished with value: 0.21950806163481795 and parameters: {'alpha': 131457.22758746825, 'n_pcs': 4500, 'weight_scheme': 'exponential', 'weight_clip_max': 5.0, 'weight_exponential_beta': 8.750825525534042}. Best is trial 67 with value: 0.22356194409955688.
2026-06-01 01:58:14 | INFO | src.nested_cv_avggrm_weighted_unified | Trial 267 | outer=8 | alpha=1.540e+05 n_pcs=4000 (pc_topk) weight_search=on
2026-06-01 01:58:14 | INFO | src.nested_cv_avggrm_weighted_unified | Trial 267 | outer=8 | weight={'name': 'exponential', 'floor': 1e-06, 'clip_max': 5.0, 'beta': 5.012634130500257}
[I 2026-06-01 01:58:20,457] Trial 267 finished with value: 0.22307607532844154 and parameters: {'alpha': 154044.8760139296, 'n_pcs': 4000, 'weight_scheme': 'exponential', 'weight_clip_max': 5.0, 'weight_exponential_beta': 5.012634130500257}. Best is trial 67 with value: 0.22356194409955688.
2026-06-01 01:58:20 | INFO | src.nested_cv_avggrm_weighted_unified | Trial 268 | outer=8 | alpha=1.145e+05 n_pcs=4000 (pc_topk) weight_search=on
2026-06-01 01:58:20 | INFO | src.nested_cv_avggrm_weighted_unified | Trial 268 | outer=8 | weight={'name': 'exponential', 'floor': 1e-06, 'clip_max': 5.0, 'beta': 4.512634773634067}
[I 2026-06-01 01:58:26,057] Trial 268 finished with value: 0.22280909798606957 and parameters: {'alpha': 114527.17421869344, 'n_pcs': 4000, 'weight_scheme': 'exponential', 'weight_clip_max': 5.0, 'weight_exponential_beta': 4.512634773634067}. Best is trial 67 with value: 0.22356194409955688.
2026-06-01 01:58:26 | INFO | src.nested_cv_avggrm_weighted_unified | Trial 269 | outer=8 | alpha=1.515e+05 n_pcs=4000 (pc_topk) weight_search=on
2026-06-01 01:58:26 | INFO | src.nested_cv_avggrm_weighted_unified | Trial 269 | outer=8 | weight={'name': 'exponential', 'floor': 1e-06, 'clip_max': 5.0, 'beta': 4.911640924461672}
[I 2026-06-01 01:58:31,672] Trial 269 finished with value: 0.22303179429251235 and parameters: {'alpha': 151477.6195163537, 'n_pcs': 4000, 'weight_scheme': 'exponential', 'weight_clip_max': 5.0, 'weight_exponential_beta': 4.911640924461672}. Best is trial 67 with value: 0.22356194409955688.
2026-06-01 01:58:31 | INFO | src.nested_cv_avggrm_weighted_unified | Trial 270 | outer=8 | alpha=2.646e+05 n_pcs=4000 (pc_topk) weight_search=on
2026-06-01 01:58:31 | INFO | src.nested_cv_avggrm_weighted_unified | Trial 270 | outer=8 | weight={'name': 'exponential', 'floor': 1e-06, 'clip_max': 3.0, 'beta': 5.0745481727787976}
[I 2026-06-01 01:58:37,277] Trial 270 finished with value: 0.22101537145324418 and parameters: {'alpha': 264567.32225114503, 'n_pcs': 4000, 'weight_scheme': 'exponential', 'weight_clip_max': 3.0, 'weight_exponential_beta': 5.0745481727787976}. Best is trial 67 with value: 0.22356194409955688.
2026-06-01 01:58:37 | INFO | src.nested_cv_avggrm_weighted_unified | Trial 271 | outer=8 | alpha=2.224e+05 n_pcs=4000 (pc_topk) weight_search=on
2026-06-01 01:58:37 | INFO | src.nested_cv_avggrm_weighted_unified | Trial 271 | outer=8 | weight={'name': 'exponential', 'floor': 1e-06, 'clip_max': 5.0, 'beta': 5.383111898038016}
[I 2026-06-01 01:58:43,050] Trial 271 finished with value: 0.2229010778426662 and parameters: {'alpha': 222442.0056724215, 'n_pcs': 4000, 'weight_scheme': 'exponential', 'weight_clip_max': 5.0, 'weight_exponential_beta': 5.383111898038016}. Best is trial 67 with value: 0.22356194409955688.
2026-06-01 01:58:43 | INFO | src.nested_cv_avggrm_weighted_unified | Trial 272 | outer=8 | alpha=1.342e+05 n_pcs=3500 (pc_topk) weight_search=on
2026-06-01 01:58:43 | INFO | src.nested_cv_avggrm_weighted_unified | Trial 272 | outer=8 | weight={'name': 'exponential', 'floor': 1e-06, 'clip_max': None, 'beta': 5.17460287722641}
[I 2026-06-01 01:58:47,934] Trial 272 finished with value: 0.2100709169246509 and parameters: {'alpha': 134184.28384501993, 'n_pcs': 3500, 'weight_scheme': 'exponential', 'weight_clip_max': None, 'weight_exponential_beta': 5.17460287722641}. Best is trial 67 with value: 0.22356194409955688.
2026-06-01 01:58:47 | INFO | src.nested_cv_avggrm_weighted_unified | Trial 273 | outer=8 | alpha=1.009e+05 n_pcs=3000 (pc_topk) weight_search=on
2026-06-01 01:58:47 | INFO | src.nested_cv_avggrm_weighted_unified | Trial 273 | outer=8 | weight={'name': 'exponential', 'floor': 1e-06, 'clip_max': 5.0, 'beta': 4.6997868461797605}
[I 2026-06-01 01:58:51,814] Trial 273 finished with value: 0.22092948492430625 and parameters: {'alpha': 100889.62607660521, 'n_pcs': 3000, 'weight_scheme': 'exponential', 'weight_clip_max': 5.0, 'weight_exponential_beta': 4.6997868461797605}. Best is trial 67 with value: 0.22356194409955688.
2026-06-01 01:58:51 | INFO | src.nested_cv_avggrm_weighted_unified | Trial 274 | outer=8 | alpha=2.057e+05 n_pcs=4000 (pc_topk) weight_search=on
2026-06-01 01:58:51 | INFO | src.nested_cv_avggrm_weighted_unified | Trial 274 | outer=8 | weight={'name': 'exponential', 'floor': 1e-06, 'clip_max': 5.0, 'beta': 4.861213316991142}
[I 2026-06-01 01:58:57,402] Trial 274 finished with value: 0.22271552938886777 and parameters: {'alpha': 205650.42036129846, 'n_pcs': 4000, 'weight_scheme': 'exponential', 'weight_clip_max': 5.0, 'weight_exponential_beta': 4.861213316991142}. Best is trial 67 with value: 0.22356194409955688.
2026-06-01 01:58:57 | INFO | src.nested_cv_avggrm_weighted_unified | Trial 275 | outer=8 | alpha=1.580e+05 n_pcs=4000 (pc_topk) weight_search=on
2026-06-01 01:58:57 | INFO | src.nested_cv_avggrm_weighted_unified | Trial 275 | outer=8 | weight={'name': 'exponential', 'floor': 1e-06, 'clip_max': 5.0, 'beta': 5.4160931693867855}
[I 2026-06-01 01:59:03,265] Trial 275 finished with value: 0.22309963255576734 and parameters: {'alpha': 158018.00484543582, 'n_pcs': 4000, 'weight_scheme': 'exponential', 'weight_clip_max': 5.0, 'weight_exponential_beta': 5.4160931693867855}. Best is trial 67 with value: 0.22356194409955688.
2026-06-01 01:59:03 | INFO | src.nested_cv_avggrm_weighted_unified | Trial 276 | outer=8 | alpha=1.556e+05 n_pcs=4500 (pc_topk) weight_search=on
2026-06-01 01:59:03 | INFO | src.nested_cv_avggrm_weighted_unified | Trial 276 | outer=8 | weight={'name': 'exponential', 'floor': 1e-06, 'clip_max': 10.0, 'beta': 5.374386404194827}
[I 2026-06-01 01:59:10,170] Trial 276 finished with value: 0.21799836445067164 and parameters: {'alpha': 155620.89936458995, 'n_pcs': 4500, 'weight_scheme': 'exponential', 'weight_clip_max': 10.0, 'weight_exponential_beta': 5.374386404194827}. Best is trial 67 with value: 0.22356194409955688.
2026-06-01 01:59:10 | INFO | src.nested_cv_avggrm_weighted_unified | Trial 277 | outer=8 | alpha=1.251e+05 n_pcs=4000 (pc_topk) weight_search=on
2026-06-01 01:59:10 | INFO | src.nested_cv_avggrm_weighted_unified | Trial 277 | outer=8 | weight={'name': 'linear', 'floor': 1e-06, 'clip_max': 5.0, 'min_weight': 0.2223020491397792, 'max_weight': 2.6877347096591326}
[I 2026-06-01 01:59:15,818] Trial 277 finished with value: 0.21955149335355056 and parameters: {'alpha': 125121.2342769858, 'n_pcs': 4000, 'weight_scheme': 'linear', 'weight_clip_max': 5.0, 'weight_linear_min_weight': 0.2223020491397792, 'weight_linear_max_weight': 2.6877347096591326}. Best is trial 67 with value: 0.22356194409955688.
2026-06-01 01:59:15 | INFO | src.nested_cv_avggrm_weighted_unified | Trial 278 | outer=8 | alpha=1.557e+05 n_pcs=4000 (pc_topk) weight_search=on
2026-06-01 01:59:15 | INFO | src.nested_cv_avggrm_weighted_unified | Trial 278 | outer=8 | weight={'name': 'uniform', 'floor': 1e-06, 'clip_max': 20.0}
2026-06-01 01:59:18 | INFO | src.nested_cv_avggrm_weighted_unified | Trial 278 | outer=8 | pruned after 5/10 inner folds (mean r=0.2157)
