[I 2026-06-01 21:22:58,292] Trial 56 finished with value: 0.21044754385861247 and parameters: {'alpha': 25896.996274266796, 'n_pcs': 3000, 'iw_method': 'pc_logistic', 'iw_clip_max': 4.0, 'iw_prob_clip': 0.0034365332435714207, 'iw_n_components': 80, 'iw_logistic_c': 9.212471525459919e-05, 'iw_pca_fit': 'combined', 'iw_solver': 'lbfgs', 'iw_rho': 0.85}. Best is trial 42 with value: 0.22577512967465635.
2026-06-01 21:22:58 | INFO | Trial 57 | outer=7 | alpha=4.770e+04 n_pcs=4000 (pc_topk) weight={'name': 'pc_logistic', 'floor': 1e-06, 'clip_max': 1.5, 'prob_clip': 0.010425051794982433, 'n_components': 60, 'logistic_c': 0.001519116139631695, 'pca_fit': 'combined', 'solver': 'lbfgs', 'max_iter': 2000, 'fit_intercept': True, 'standardize_with_source': True, 'rho': 0.7}
[I 2026-06-01 21:23:16,580] Trial 57 finished with value: 0.2234617863309633 and parameters: {'alpha': 47696.13085190156, 'n_pcs': 4000, 'iw_method': 'pc_logistic', 'iw_clip_max': 1.5, 'iw_prob_clip': 0.010425051794982433, 'iw_n_components': 60, 'iw_logistic_c': 0.001519116139631695, 'iw_pca_fit': 'combined', 'iw_solver': 'lbfgs', 'iw_rho': 0.7}. Best is trial 42 with value: 0.22577512967465635.
2026-06-01 21:23:16 | INFO | Trial 58 | outer=7 | alpha=1.325e+05 n_pcs=3500 (pc_topk) weight={'name': 'pc_logistic', 'floor': 1e-06, 'clip_max': 2.5, 'prob_clip': 0.02283011596199722, 'n_components': 10, 'logistic_c': 4.728985559973643, 'pca_fit': 'combined', 'solver': 'lbfgs', 'max_iter': 2000, 'fit_intercept': True, 'standardize_with_source': True, 'rho': 1.0}
[I 2026-06-01 21:23:30,834] Trial 58 finished with value: 0.2178208294362937 and parameters: {'alpha': 132454.50868741944, 'n_pcs': 3500, 'iw_method': 'pc_logistic', 'iw_clip_max': 2.5, 'iw_prob_clip': 0.02283011596199722, 'iw_n_components': 10, 'iw_logistic_c': 4.728985559973643, 'iw_pca_fit': 'combined', 'iw_solver': 'lbfgs', 'iw_rho': 1.0}. Best is trial 42 with value: 0.22577512967465635.
2026-06-01 21:23:30 | INFO | Trial 59 | outer=7 | alpha=1.588e+04 n_pcs=3000 (pc_topk) weight={'name': 'pc_logistic', 'floor': 1e-06, 'clip_max': 7.0, 'prob_clip': 0.0016374866395664589, 'n_components': 40, 'logistic_c': 0.0002330948477363902, 'pca_fit': 'combined', 'solver': 'lbfgs', 'max_iter': 2000, 'fit_intercept': True, 'standardize_with_source': True, 'rho': 0.5}
[I 2026-06-01 21:23:43,051] Trial 59 finished with value: 0.19942769728824206 and parameters: {'alpha': 15882.135979078335, 'n_pcs': 3000, 'iw_method': 'pc_logistic', 'iw_clip_max': 7.0, 'iw_prob_clip': 0.0016374866395664589, 'iw_n_components': 40, 'iw_logistic_c': 0.0002330948477363902, 'iw_pca_fit': 'combined', 'iw_solver': 'lbfgs', 'iw_rho': 0.5}. Best is trial 42 with value: 0.22577512967465635.
2026-06-01 21:23:43 | INFO | Trial 60 | outer=7 | alpha=1.030e+04 n_pcs=500 (pc_topk) weight={'name': 'pc_logistic', 'floor': 1e-06, 'clip_max': 2.5, 'prob_clip': 0.0007383024404216891, 'n_components': 40, 'logistic_c': 1.3783257667694429e-05, 'pca_fit': 'combined', 'solver': 'lbfgs', 'max_iter': 2000, 'fit_intercept': True, 'standardize_with_source': True, 'rho': 0.5}
[I 2026-06-01 21:23:49,416] Trial 60 finished with value: 0.154794661073567 and parameters: {'alpha': 10301.154937099662, 'n_pcs': 500, 'iw_method': 'pc_logistic', 'iw_clip_max': 2.5, 'iw_prob_clip': 0.0007383024404216891, 'iw_n_components': 40, 'iw_logistic_c': 1.3783257667694429e-05, 'iw_pca_fit': 'combined', 'iw_solver': 'lbfgs', 'iw_rho': 0.5}. Best is trial 42 with value: 0.22577512967465635.
2026-06-01 21:23:49 | INFO | Trial 61 | outer=7 | alpha=4.457e+04 n_pcs=3000 (pc_topk) weight={'name': 'pc_logistic', 'floor': 1e-06, 'clip_max': 7.0, 'prob_clip': 0.015224310798681662, 'n_components': 40, 'logistic_c': 4.9780169335734326e-05, 'pca_fit': 'combined', 'solver': 'lbfgs', 'max_iter': 2000, 'fit_intercept': True, 'standardize_with_source': True, 'rho': 0.5}
[I 2026-06-01 21:23:59,700] Trial 61 finished with value: 0.22235616720468818 and parameters: {'alpha': 44568.74788849416, 'n_pcs': 3000, 'iw_method': 'pc_logistic', 'iw_clip_max': 7.0, 'iw_prob_clip': 0.015224310798681662, 'iw_n_components': 40, 'iw_logistic_c': 4.9780169335734326e-05, 'iw_pca_fit': 'combined', 'iw_solver': 'lbfgs', 'iw_rho': 0.5}. Best is trial 42 with value: 0.22577512967465635.
2026-06-01 21:23:59 | INFO | Trial 62 | outer=7 | alpha=6.504e+04 n_pcs=2500 (pc_topk) weight={'name': 'pc_logistic', 'floor': 1e-06, 'clip_max': 7.0, 'prob_clip': 0.01632940063418374, 'n_components': 40, 'logistic_c': 3.6524836198073354e-05, 'pca_fit': 'combined', 'solver': 'lbfgs', 'max_iter': 2000, 'fit_intercept': True, 'standardize_with_source': True, 'rho': 0.5}
[I 2026-06-01 21:24:08,694] Trial 62 finished with value: 0.21939738661042094 and parameters: {'alpha': 65044.88358205617, 'n_pcs': 2500, 'iw_method': 'pc_logistic', 'iw_clip_max': 7.0, 'iw_prob_clip': 0.01632940063418374, 'iw_n_components': 40, 'iw_logistic_c': 3.6524836198073354e-05, 'iw_pca_fit': 'combined', 'iw_solver': 'lbfgs', 'iw_rho': 0.5}. Best is trial 42 with value: 0.22577512967465635.
2026-06-01 21:24:08 | INFO | Trial 63 | outer=7 | alpha=1.752e+05 n_pcs=3000 (pc_topk) weight={'name': 'pc_logistic', 'floor': 1e-06, 'clip_max': 7.0, 'prob_clip': 0.03158955202165375, 'n_components': 100, 'logistic_c': 3.2397540560426922e-06, 'pca_fit': 'combined', 'solver': 'lbfgs', 'max_iter': 2000, 'fit_intercept': True, 'standardize_with_source': True, 'rho': 0.5}
[I 2026-06-01 21:24:18,930] Trial 63 finished with value: 0.21042294475798123 and parameters: {'alpha': 175237.16373883653, 'n_pcs': 3000, 'iw_method': 'pc_logistic', 'iw_clip_max': 7.0, 'iw_prob_clip': 0.03158955202165375, 'iw_n_components': 100, 'iw_logistic_c': 3.2397540560426922e-06, 'iw_pca_fit': 'combined', 'iw_solver': 'lbfgs', 'iw_rho': 0.5}. Best is trial 42 with value: 0.22577512967465635.
2026-06-01 21:24:18 | INFO | Trial 64 | outer=7 | alpha=2.897e+04 n_pcs=3500 (pc_topk) weight={'name': 'pc_logistic', 'floor': 1e-06, 'clip_max': 7.0, 'prob_clip': 0.047371111279013674, 'n_components': 40, 'logistic_c': 8.61662832304507e-06, 'pca_fit': 'combined', 'solver': 'lbfgs', 'max_iter': 2000, 'fit_intercept': True, 'standardize_with_source': True, 'rho': 0.5}
[I 2026-06-01 21:24:29,748] Trial 64 finished with value: 0.2172175884854138 and parameters: {'alpha': 28969.37811811034, 'n_pcs': 3500, 'iw_method': 'pc_logistic', 'iw_clip_max': 7.0, 'iw_prob_clip': 0.047371111279013674, 'iw_n_components': 40, 'iw_logistic_c': 8.61662832304507e-06, 'iw_pca_fit': 'combined', 'iw_solver': 'lbfgs', 'iw_rho': 0.5}. Best is trial 42 with value: 0.22577512967465635.
2026-06-01 21:24:29 | INFO | Trial 65 | outer=7 | alpha=4.712e+04 n_pcs=3000 (pc_topk) weight={'name': 'pc_logistic', 'floor': 1e-06, 'clip_max': 12.0, 'prob_clip': 0.013410673764819234, 'n_components': 40, 'logistic_c': 6.485750971564519e-05, 'pca_fit': 'combined', 'solver': 'lbfgs', 'max_iter': 2000, 'fit_intercept': True, 'standardize_with_source': True, 'rho': 0.7}
[I 2026-06-01 21:24:39,786] Trial 65 finished with value: 0.22034706123366013 and parameters: {'alpha': 47116.61578221071, 'n_pcs': 3000, 'iw_method': 'pc_logistic', 'iw_clip_max': 12.0, 'iw_prob_clip': 0.013410673764819234, 'iw_n_components': 40, 'iw_logistic_c': 6.485750971564519e-05, 'iw_pca_fit': 'combined', 'iw_solver': 'lbfgs', 'iw_rho': 0.7}. Best is trial 42 with value: 0.22577512967465635.
2026-06-01 21:24:39 | INFO | Trial 66 | outer=7 | alpha=6.673e+03 n_pcs=4000 (pc_topk) weight={'name': 'pc_logistic', 'floor': 1e-06, 'clip_max': 7.0, 'prob_clip': 0.020147364481655487, 'n_components': 40, 'logistic_c': 0.00031665951555371854, 'pca_fit': 'combined', 'solver': 'lbfgs', 'max_iter': 2000, 'fit_intercept': True, 'standardize_with_source': True, 'rho': 0.5}
[I 2026-06-01 21:24:53,817] Trial 66 finished with value: 0.1970198003732237 and parameters: {'alpha': 6673.440497941842, 'n_pcs': 4000, 'iw_method': 'pc_logistic', 'iw_clip_max': 7.0, 'iw_prob_clip': 0.020147364481655487, 'iw_n_components': 40, 'iw_logistic_c': 0.00031665951555371854, 'iw_pca_fit': 'combined', 'iw_solver': 'lbfgs', 'iw_rho': 0.5}. Best is trial 42 with value: 0.22577512967465635.
2026-06-01 21:24:53 | INFO | Trial 67 | outer=7 | alpha=2.605e+05 n_pcs=3500 (pc_topk) weight={'name': 'pc_logistic', 'floor': 1e-06, 'clip_max': 7.0, 'prob_clip': 0.013733240296191336, 'n_components': 40, 'logistic_c': 2.1022008303222506e-05, 'pca_fit': 'combined', 'solver': 'lbfgs', 'max_iter': 2000, 'fit_intercept': True, 'standardize_with_source': True, 'rho': 0.3}
[I 2026-06-01 21:25:04,385] Trial 67 finished with value: 0.2132124614068501 and parameters: {'alpha': 260527.5928657213, 'n_pcs': 3500, 'iw_method': 'pc_logistic', 'iw_clip_max': 7.0, 'iw_prob_clip': 0.013733240296191336, 'iw_n_components': 40, 'iw_logistic_c': 2.1022008303222506e-05, 'iw_pca_fit': 'combined', 'iw_solver': 'lbfgs', 'iw_rho': 0.3}. Best is trial 42 with value: 0.22577512967465635.
2026-06-01 21:25:04 | INFO | Trial 68 | outer=7 | alpha=1.244e+05 n_pcs=2500 (pc_topk) weight={'name': 'pc_logistic', 'floor': 1e-06, 'clip_max': 2.5, 'prob_clip': 0.017771362580821123, 'n_components': 20, 'logistic_c': 0.000168147433548055, 'pca_fit': 'combined', 'solver': 'lbfgs', 'max_iter': 2000, 'fit_intercept': True, 'standardize_with_source': True, 'rho': 0.5}
[I 2026-06-01 21:25:14,588] Trial 68 finished with value: 0.21894126449484816 and parameters: {'alpha': 124373.22993470942, 'n_pcs': 2500, 'iw_method': 'pc_logistic', 'iw_clip_max': 2.5, 'iw_prob_clip': 0.017771362580821123, 'iw_n_components': 20, 'iw_logistic_c': 0.000168147433548055, 'iw_pca_fit': 'combined', 'iw_solver': 'lbfgs', 'iw_rho': 0.5}. Best is trial 42 with value: 0.22577512967465635.
2026-06-01 21:25:14 | INFO | Trial 69 | outer=7 | alpha=9.206e+04 n_pcs=3500 (pc_topk) weight={'name': 'pc_logistic', 'floor': 1e-06, 'clip_max': 4.0, 'prob_clip': 0.0111102984922632, 'n_components': 40, 'logistic_c': 0.0007956460577969533, 'pca_fit': 'combined', 'solver': 'lbfgs', 'max_iter': 2000, 'fit_intercept': True, 'standardize_with_source': True, 'rho': 0.5}
[I 2026-06-01 21:25:29,576] Trial 69 finished with value: 0.2229779274756365 and parameters: {'alpha': 92058.73478734113, 'n_pcs': 3500, 'iw_method': 'pc_logistic', 'iw_clip_max': 4.0, 'iw_prob_clip': 0.0111102984922632, 'iw_n_components': 40, 'iw_logistic_c': 0.0007956460577969533, 'iw_pca_fit': 'combined', 'iw_solver': 'lbfgs', 'iw_rho': 0.5}. Best is trial 42 with value: 0.22577512967465635.
2026-06-01 21:25:29 | INFO | Trial 70 | outer=7 | alpha=1.382e+04 n_pcs=1000 (pc_topk) weight={'name': 'pc_logistic', 'floor': 1e-06, 'clip_max': 7.0, 'prob_clip': 0.008700518077980961, 'n_components': 80, 'logistic_c': 0.00963770533759663, 'pca_fit': 'combined', 'solver': 'lbfgs', 'max_iter': 2000, 'fit_intercept': True, 'standardize_with_source': True, 'rho': 1.0}
[I 2026-06-01 21:25:45,645] Trial 70 finished with value: 0.20093640405582933 and parameters: {'alpha': 13819.847887250884, 'n_pcs': 1000, 'iw_method': 'pc_logistic', 'iw_clip_max': 7.0, 'iw_prob_clip': 0.008700518077980961, 'iw_n_components': 80, 'iw_logistic_c': 0.00963770533759663, 'iw_pca_fit': 'combined', 'iw_solver': 'lbfgs', 'iw_rho': 1.0}. Best is trial 42 with value: 0.22577512967465635.
2026-06-01 21:25:45 | INFO | Trial 71 | outer=7 | alpha=5.596e+04 n_pcs=4000 (pc_topk) weight={'name': 'pc_logistic', 'floor': 1e-06, 'clip_max': 1.5, 'prob_clip': 0.009402916599531476, 'n_components': 60, 'logistic_c': 0.0012240985390161308, 'pca_fit': 'combined', 'solver': 'lbfgs', 'max_iter': 2000, 'fit_intercept': True, 'standardize_with_source': True, 'rho': 0.7}
[I 2026-06-01 21:26:01,799] Trial 71 finished with value: 0.22333900529585068 and parameters: {'alpha': 55959.941510520206, 'n_pcs': 4000, 'iw_method': 'pc_logistic', 'iw_clip_max': 1.5, 'iw_prob_clip': 0.009402916599531476, 'iw_n_components': 60, 'iw_logistic_c': 0.0012240985390161308, 'iw_pca_fit': 'combined', 'iw_solver': 'lbfgs', 'iw_rho': 0.7}. Best is trial 42 with value: 0.22577512967465635.
2026-06-01 21:26:01 | INFO | Trial 72 | outer=7 | alpha=4.739e+04 n_pcs=4000 (pc_topk) weight={'name': 'pc_logistic', 'floor': 1e-06, 'clip_max': 1.5, 'prob_clip': 0.006436079560233135, 'n_components': 60, 'logistic_c': 0.002128526764859376, 'pca_fit': 'combined', 'solver': 'lbfgs', 'max_iter': 2000, 'fit_intercept': True, 'standardize_with_source': True, 'rho': 0.7}
[I 2026-06-01 21:26:19,204] Trial 72 finished with value: 0.22295171211038908 and parameters: {'alpha': 47387.925559099385, 'n_pcs': 4000, 'iw_method': 'pc_logistic', 'iw_clip_max': 1.5, 'iw_prob_clip': 0.006436079560233135, 'iw_n_components': 60, 'iw_logistic_c': 0.002128526764859376, 'iw_pca_fit': 'combined', 'iw_solver': 'lbfgs', 'iw_rho': 0.7}. Best is trial 42 with value: 0.22577512967465635.
2026-06-01 21:26:19 | INFO | Trial 73 | outer=7 | alpha=3.497e+04 n_pcs=4500 (pc_topk) weight={'name': 'pc_logistic', 'floor': 1e-06, 'clip_max': 1.5, 'prob_clip': 0.011573115741083094, 'n_components': 60, 'logistic_c': 3.170088817311285e-05, 'pca_fit': 'combined', 'solver': 'lbfgs', 'max_iter': 2000, 'fit_intercept': True, 'standardize_with_source': True, 'rho': 0.7}
[I 2026-06-01 21:26:34,197] Trial 73 finished with value: 0.2248224823536527 and parameters: {'alpha': 34969.811622619214, 'n_pcs': 4500, 'iw_method': 'pc_logistic', 'iw_clip_max': 1.5, 'iw_prob_clip': 0.011573115741083094, 'iw_n_components': 60, 'iw_logistic_c': 3.170088817311285e-05, 'iw_pca_fit': 'combined', 'iw_solver': 'lbfgs', 'iw_rho': 0.7}. Best is trial 42 with value: 0.22577512967465635.
2026-06-01 21:26:34 | INFO | Trial 74 | outer=7 | alpha=7.673e+04 n_pcs=4500 (pc_topk) weight={'name': 'pc_logistic', 'floor': 1e-06, 'clip_max': 1.5, 'prob_clip': 0.01579844915138313, 'n_components': 60, 'logistic_c': 2.8890587899650046e-05, 'pca_fit': 'combined', 'solver': 'lbfgs', 'max_iter': 2000, 'fit_intercept': True, 'standardize_with_source': True, 'rho': 0.7}
[I 2026-06-01 21:26:49,684] Trial 74 finished with value: 0.22276714937166178 and parameters: {'alpha': 76731.71136486033, 'n_pcs': 4500, 'iw_method': 'pc_logistic', 'iw_clip_max': 1.5, 'iw_prob_clip': 0.01579844915138313, 'iw_n_components': 60, 'iw_logistic_c': 2.8890587899650046e-05, 'iw_pca_fit': 'combined', 'iw_solver': 'lbfgs', 'iw_rho': 0.7}. Best is trial 42 with value: 0.22577512967465635.
2026-06-01 21:26:49 | INFO | Trial 75 | outer=7 | alpha=3.128e+04 n_pcs=5000 (pc_topk) weight={'name': 'pc_logistic', 'floor': 1e-06, 'clip_max': 7.0, 'prob_clip': 0.024903035918452845, 'n_components': 40, 'logistic_c': 1.13827185818746e-05, 'pca_fit': 'combined', 'solver': 'lbfgs', 'max_iter': 2000, 'fit_intercept': True, 'standardize_with_source': True, 'rho': 0.5}
[I 2026-06-01 21:27:06,457] Trial 75 finished with value: 0.2240622407759271 and parameters: {'alpha': 31279.93451257031, 'n_pcs': 5000, 'iw_method': 'pc_logistic', 'iw_clip_max': 7.0, 'iw_prob_clip': 0.024903035918452845, 'iw_n_components': 40, 'iw_logistic_c': 1.13827185818746e-05, 'iw_pca_fit': 'combined', 'iw_solver': 'lbfgs', 'iw_rho': 0.5}. Best is trial 42 with value: 0.22577512967465635.
2026-06-01 21:27:06 | INFO | Trial 76 | outer=7 | alpha=2.649e+04 n_pcs=5000 (pc_topk) weight={'name': 'pc_logistic', 'floor': 1e-06, 'clip_max': 7.0, 'prob_clip': 0.030716162368577948, 'n_components': 10, 'logistic_c': 2.0369064042353755e-06, 'pca_fit': 'combined', 'solver': 'lbfgs', 'max_iter': 2000, 'fit_intercept': True, 'standardize_with_source': True, 'rho': 0.5}
[I 2026-06-01 21:27:22,634] Trial 76 finished with value: 0.22105193222222544 and parameters: {'alpha': 26485.287666019227, 'n_pcs': 5000, 'iw_method': 'pc_logistic', 'iw_clip_max': 7.0, 'iw_prob_clip': 0.030716162368577948, 'iw_n_components': 10, 'iw_logistic_c': 2.0369064042353755e-06, 'iw_pca_fit': 'combined', 'iw_solver': 'lbfgs', 'iw_rho': 0.5}. Best is trial 42 with value: 0.22577512967465635.
2026-06-01 21:27:22 | INFO | Trial 77 | outer=7 | alpha=3.176e+04 n_pcs=5000 (pc_topk) weight={'name': 'pc_logistic', 'floor': 1e-06, 'clip_max': 1.5, 'prob_clip': 0.022185287227424723, 'n_components': 40, 'logistic_c': 1.3546084601565664e-05, 'pca_fit': 'combined', 'solver': 'lbfgs', 'max_iter': 2000, 'fit_intercept': True, 'standardize_with_source': True, 'rho': 0.5}
[I 2026-06-01 21:27:39,294] Trial 77 finished with value: 0.22218383626943874 and parameters: {'alpha': 31764.21772411905, 'n_pcs': 5000, 'iw_method': 'pc_logistic', 'iw_clip_max': 1.5, 'iw_prob_clip': 0.022185287227424723, 'iw_n_components': 40, 'iw_logistic_c': 1.3546084601565664e-05, 'iw_pca_fit': 'combined', 'iw_solver': 'lbfgs', 'iw_rho': 0.5}. Best is trial 42 with value: 0.22577512967465635.
2026-06-01 21:27:39 | INFO | Trial 78 | outer=7 | alpha=1.821e+04 n_pcs=5000 (pc_topk) weight={'name': 'pc_logistic', 'floor': 1e-06, 'clip_max': 2.5, 'prob_clip': 0.024590558262757745, 'n_components': 100, 'logistic_c': 4.605425076582634e-06, 'pca_fit': 'combined', 'solver': 'lbfgs', 'max_iter': 2000, 'fit_intercept': True, 'standardize_with_source': True, 'rho': 0.85}
[I 2026-06-01 21:27:56,259] Trial 78 finished with value: 0.22101746926617843 and parameters: {'alpha': 18214.370946469207, 'n_pcs': 5000, 'iw_method': 'pc_logistic', 'iw_clip_max': 2.5, 'iw_prob_clip': 0.024590558262757745, 'iw_n_components': 100, 'iw_logistic_c': 4.605425076582634e-06, 'iw_pca_fit': 'combined', 'iw_solver': 'lbfgs', 'iw_rho': 0.85}. Best is trial 42 with value: 0.22577512967465635.
2026-06-01 21:27:56 | INFO | Trial 79 | outer=7 | alpha=4.074e+04 n_pcs=4500 (pc_topk) weight={'name': 'pc_logistic', 'floor': 1e-06, 'clip_max': 7.0, 'prob_clip': 0.012618585826687286, 'n_components': 40, 'logistic_c': 6.111743547786485e-07, 'pca_fit': 'combined', 'solver': 'lbfgs', 'max_iter': 2000, 'fit_intercept': True, 'standardize_with_source': True, 'rho': 0.5}
[I 2026-06-01 21:28:10,333] Trial 79 finished with value: 0.22082913584266262 and parameters: {'alpha': 40742.62763595365, 'n_pcs': 4500, 'iw_method': 'pc_logistic', 'iw_clip_max': 7.0, 'iw_prob_clip': 0.012618585826687286, 'iw_n_components': 40, 'iw_logistic_c': 6.111743547786485e-07, 'iw_pca_fit': 'combined', 'iw_solver': 'lbfgs', 'iw_rho': 0.5}. Best is trial 42 with value: 0.22577512967465635.
2026-06-01 21:28:10 | INFO | Trial 80 | outer=7 | alpha=7.645e+04 n_pcs=4500 (pc_topk) weight={'name': 'pc_logistic', 'floor': 1e-06, 'clip_max': 7.0, 'prob_clip': 0.03970652634349163, 'n_components': 60, 'logistic_c': 0.00014950746541807377, 'pca_fit': 'combined', 'solver': 'lbfgs', 'max_iter': 2000, 'fit_intercept': True, 'standardize_with_source': True, 'rho': 0.5}
[I 2026-06-01 21:28:26,687] Trial 80 finished with value: 0.22356461309014578 and parameters: {'alpha': 76451.70998983158, 'n_pcs': 4500, 'iw_method': 'pc_logistic', 'iw_clip_max': 7.0, 'iw_prob_clip': 0.03970652634349163, 'iw_n_components': 60, 'iw_logistic_c': 0.00014950746541807377, 'iw_pca_fit': 'combined', 'iw_solver': 'lbfgs', 'iw_rho': 0.5}. Best is trial 42 with value: 0.22577512967465635.
2026-06-01 21:28:26 | INFO | Trial 81 | outer=7 | alpha=3.380e+04 n_pcs=5000 (pc_topk) weight={'name': 'pc_logistic', 'floor': 1e-06, 'clip_max': 7.0, 'prob_clip': 0.015259742054625373, 'n_components': 40, 'logistic_c': 2.8742316759735324e-05, 'pca_fit': 'combined', 'solver': 'lbfgs', 'max_iter': 2000, 'fit_intercept': True, 'standardize_with_source': True, 'rho': 0.5}
[I 2026-06-01 21:28:43,901] Trial 81 finished with value: 0.226330319093424 and parameters: {'alpha': 33798.94324200342, 'n_pcs': 5000, 'iw_method': 'pc_logistic', 'iw_clip_max': 7.0, 'iw_prob_clip': 0.015259742054625373, 'iw_n_components': 40, 'iw_logistic_c': 2.8742316759735324e-05, 'iw_pca_fit': 'combined', 'iw_solver': 'lbfgs', 'iw_rho': 0.5}. Best is trial 81 with value: 0.226330319093424.
2026-06-01 21:28:43 | INFO | Trial 82 | outer=7 | alpha=2.204e+04 n_pcs=5000 (pc_topk) weight={'name': 'pc_logistic', 'floor': 1e-06, 'clip_max': 7.0, 'prob_clip': 0.00842217111630455, 'n_components': 40, 'logistic_c': 9.542160375636683e-06, 'pca_fit': 'combined', 'solver': 'lbfgs', 'max_iter': 2000, 'fit_intercept': True, 'standardize_with_source': True, 'rho': 0.5}
[I 2026-06-01 21:29:00,364] Trial 82 finished with value: 0.22267475324549885 and parameters: {'alpha': 22044.575562455586, 'n_pcs': 5000, 'iw_method': 'pc_logistic', 'iw_clip_max': 7.0, 'iw_prob_clip': 0.00842217111630455, 'iw_n_components': 40, 'iw_logistic_c': 9.542160375636683e-06, 'iw_pca_fit': 'combined', 'iw_solver': 'lbfgs', 'iw_rho': 0.5}. Best is trial 81 with value: 0.226330319093424.
2026-06-01 21:29:00 | INFO | Trial 83 | outer=7 | alpha=1.044e+05 n_pcs=5000 (pc_topk) weight={'name': 'pc_logistic', 'floor': 1e-06, 'clip_max': 7.0, 'prob_clip': 0.02009100378496976, 'n_components': 40, 'logistic_c': 2.7331303504026063e-05, 'pca_fit': 'combined', 'solver': 'lbfgs', 'max_iter': 2000, 'fit_intercept': True, 'standardize_with_source': True, 'rho': 0.5}
[I 2026-06-01 21:29:17,787] Trial 83 finished with value: 0.22295111871031842 and parameters: {'alpha': 104406.31952052517, 'n_pcs': 5000, 'iw_method': 'pc_logistic', 'iw_clip_max': 7.0, 'iw_prob_clip': 0.02009100378496976, 'iw_n_components': 40, 'iw_logistic_c': 2.7331303504026063e-05, 'iw_pca_fit': 'combined', 'iw_solver': 'lbfgs', 'iw_rho': 0.5}. Best is trial 81 with value: 0.226330319093424.
2026-06-01 21:29:17 | INFO | Trial 84 | outer=7 | alpha=3.333e+04 n_pcs=4500 (pc_topk) weight={'name': 'pc_logistic', 'floor': 1e-06, 'clip_max': 7.0, 'prob_clip': 0.029075876159245926, 'n_components': 40, 'logistic_c': 7.898477934061196e-05, 'pca_fit': 'combined', 'solver': 'lbfgs', 'max_iter': 2000, 'fit_intercept': True, 'standardize_with_source': True, 'rho': 0.5}
