[I 2026-05-31 23:17:31,647] Trial 116 finished with value: 0.2454218216754684 and parameters: {'alpha': 107421.81045339699, 'n_pcs': 4500, 'weight_scheme': 'exponential', 'weight_clip_max': 3.0, 'weight_exponential_beta': 9.247582859112883}. Best is trial 103 with value: 0.2497346971635756.
2026-05-31 23:17:31 | INFO | src.nested_cv_avggrm_weighted_unified | Trial 117 | outer=2 | alpha=2.201e+05 n_pcs=5000 (pc_topk) weight_search=on
2026-05-31 23:17:31 | INFO | src.nested_cv_avggrm_weighted_unified | Trial 117 | outer=2 | weight={'name': 'uniform', 'floor': 1e-06, 'clip_max': 3.0}
2026-05-31 23:17:35 | INFO | src.nested_cv_avggrm_weighted_unified | Trial 117 | outer=2 | pruned after 6/10 inner folds (mean r=0.2363)
[I 2026-05-31 23:17:35,933] Trial 117 pruned. 
2026-05-31 23:17:35 | INFO | src.nested_cv_avggrm_weighted_unified | Trial 118 | outer=2 | alpha=3.104e+05 n_pcs=4500 (pc_topk) weight_search=on
2026-05-31 23:17:35 | INFO | src.nested_cv_avggrm_weighted_unified | Trial 118 | outer=2 | weight={'name': 'exponential', 'floor': 1e-06, 'clip_max': 3.0, 'beta': 8.780638836955013}
[I 2026-05-31 23:17:42,903] Trial 118 finished with value: 0.24922354608005878 and parameters: {'alpha': 310384.53656185104, 'n_pcs': 4500, 'weight_scheme': 'exponential', 'weight_clip_max': 3.0, 'weight_exponential_beta': 8.780638836955013}. Best is trial 103 with value: 0.2497346971635756.
2026-05-31 23:17:42 | INFO | src.nested_cv_avggrm_weighted_unified | Trial 119 | outer=2 | alpha=2.924e+05 n_pcs=4500 (pc_topk) weight_search=on
2026-05-31 23:17:42 | INFO | src.nested_cv_avggrm_weighted_unified | Trial 119 | outer=2 | weight={'name': 'exponential', 'floor': 1e-06, 'clip_max': 3.0, 'beta': 8.793601696388292}
[I 2026-05-31 23:17:49,874] Trial 119 finished with value: 0.24924049141979737 and parameters: {'alpha': 292358.83928044647, 'n_pcs': 4500, 'weight_scheme': 'exponential', 'weight_clip_max': 3.0, 'weight_exponential_beta': 8.793601696388292}. Best is trial 103 with value: 0.2497346971635756.
2026-05-31 23:17:49 | INFO | src.nested_cv_avggrm_weighted_unified | Trial 120 | outer=2 | alpha=3.005e+05 n_pcs=4500 (pc_topk) weight_search=on
2026-05-31 23:17:49 | INFO | src.nested_cv_avggrm_weighted_unified | Trial 120 | outer=2 | weight={'name': 'linear', 'floor': 1e-06, 'clip_max': 3.0, 'min_weight': 0.9885323238895366, 'max_weight': 3.533707651555215}
2026-05-31 23:17:54 | INFO | src.nested_cv_avggrm_weighted_unified | Trial 120 | outer=2 | pruned after 7/10 inner folds (mean r=0.2712)
[I 2026-05-31 23:17:54,769] Trial 120 pruned. 
2026-05-31 23:17:54 | INFO | src.nested_cv_avggrm_weighted_unified | Trial 121 | outer=2 | alpha=2.136e+05 n_pcs=4500 (pc_topk) weight_search=on
2026-05-31 23:17:54 | INFO | src.nested_cv_avggrm_weighted_unified | Trial 121 | outer=2 | weight={'name': 'exponential', 'floor': 1e-06, 'clip_max': 3.0, 'beta': 8.756911230176884}
[I 2026-05-31 23:18:01,740] Trial 121 finished with value: 0.24892465690888183 and parameters: {'alpha': 213595.84149746297, 'n_pcs': 4500, 'weight_scheme': 'exponential', 'weight_clip_max': 3.0, 'weight_exponential_beta': 8.756911230176884}. Best is trial 103 with value: 0.2497346971635756.
2026-05-31 23:18:01 | INFO | src.nested_cv_avggrm_weighted_unified | Trial 122 | outer=2 | alpha=1.163e+05 n_pcs=5000 (pc_topk) weight_search=on
2026-05-31 23:18:01 | INFO | src.nested_cv_avggrm_weighted_unified | Trial 122 | outer=2 | weight={'name': 'exponential', 'floor': 1e-06, 'clip_max': 3.0, 'beta': 8.802432321105035}
[I 2026-05-31 23:18:09,922] Trial 122 finished with value: 0.245467227500624 and parameters: {'alpha': 116318.71376157666, 'n_pcs': 5000, 'weight_scheme': 'exponential', 'weight_clip_max': 3.0, 'weight_exponential_beta': 8.802432321105035}. Best is trial 103 with value: 0.2497346971635756.
2026-05-31 23:18:09 | INFO | src.nested_cv_avggrm_weighted_unified | Trial 123 | outer=2 | alpha=2.221e+05 n_pcs=4500 (pc_topk) weight_search=on
2026-05-31 23:18:09 | INFO | src.nested_cv_avggrm_weighted_unified | Trial 123 | outer=2 | weight={'name': 'exponential', 'floor': 1e-06, 'clip_max': 3.0, 'beta': 8.53724353094162}
[I 2026-05-31 23:18:16,891] Trial 123 finished with value: 0.24899903749725158 and parameters: {'alpha': 222121.15856682818, 'n_pcs': 4500, 'weight_scheme': 'exponential', 'weight_clip_max': 3.0, 'weight_exponential_beta': 8.53724353094162}. Best is trial 103 with value: 0.2497346971635756.
2026-05-31 23:18:16 | INFO | src.nested_cv_avggrm_weighted_unified | Trial 124 | outer=2 | alpha=1.562e+05 n_pcs=4500 (pc_topk) weight_search=on
2026-05-31 23:18:16 | INFO | src.nested_cv_avggrm_weighted_unified | Trial 124 | outer=2 | weight={'name': 'exponential', 'floor': 1e-06, 'clip_max': 3.0, 'beta': 8.554236356766802}
[I 2026-05-31 23:18:23,868] Trial 124 finished with value: 0.2480229088592812 and parameters: {'alpha': 156249.05540418238, 'n_pcs': 4500, 'weight_scheme': 'exponential', 'weight_clip_max': 3.0, 'weight_exponential_beta': 8.554236356766802}. Best is trial 103 with value: 0.2497346971635756.
2026-05-31 23:18:23 | INFO | src.nested_cv_avggrm_weighted_unified | Trial 125 | outer=2 | alpha=2.394e+05 n_pcs=5000 (pc_topk) weight_search=on
2026-05-31 23:18:23 | INFO | src.nested_cv_avggrm_weighted_unified | Trial 125 | outer=2 | weight={'name': 'exponential', 'floor': 1e-06, 'clip_max': 3.0, 'beta': 9.05119830797941}
[I 2026-05-31 23:18:32,038] Trial 125 finished with value: 0.24816200998361007 and parameters: {'alpha': 239388.2840633795, 'n_pcs': 5000, 'weight_scheme': 'exponential', 'weight_clip_max': 3.0, 'weight_exponential_beta': 9.05119830797941}. Best is trial 103 with value: 0.2497346971635756.
2026-05-31 23:18:32 | INFO | src.nested_cv_avggrm_weighted_unified | Trial 126 | outer=2 | alpha=3.105e+05 n_pcs=4500 (pc_topk) weight_search=on
2026-05-31 23:18:32 | INFO | src.nested_cv_avggrm_weighted_unified | Trial 126 | outer=2 | weight={'name': 'exponential', 'floor': 1e-06, 'clip_max': 3.0, 'beta': 8.483711255745591}
[I 2026-05-31 23:18:39,004] Trial 126 finished with value: 0.24912519757768575 and parameters: {'alpha': 310509.67808569095, 'n_pcs': 4500, 'weight_scheme': 'exponential', 'weight_clip_max': 3.0, 'weight_exponential_beta': 8.483711255745591}. Best is trial 103 with value: 0.2497346971635756.
2026-05-31 23:18:39 | INFO | src.nested_cv_avggrm_weighted_unified | Trial 127 | outer=2 | alpha=3.160e+05 n_pcs=4500 (pc_topk) weight_search=on
2026-05-31 23:18:39 | INFO | src.nested_cv_avggrm_weighted_unified | Trial 127 | outer=2 | weight={'name': 'exponential', 'floor': 1e-06, 'clip_max': None, 'beta': 8.526582143904971}
2026-05-31 23:18:43 | INFO | src.nested_cv_avggrm_weighted_unified | Trial 127 | outer=2 | pruned after 6/10 inner folds (mean r=0.2179)
[I 2026-05-31 23:18:43,197] Trial 127 pruned. 
2026-05-31 23:18:43 | INFO | src.nested_cv_avggrm_weighted_unified | Trial 128 | outer=2 | alpha=2.829e+05 n_pcs=4500 (pc_topk) weight_search=on
2026-05-31 23:18:43 | INFO | src.nested_cv_avggrm_weighted_unified | Trial 128 | outer=2 | weight={'name': 'exponential', 'floor': 1e-06, 'clip_max': 3.0, 'beta': 8.870332929113248}
[I 2026-05-31 23:18:50,161] Trial 128 finished with value: 0.24924262438154834 and parameters: {'alpha': 282903.2721626368, 'n_pcs': 4500, 'weight_scheme': 'exponential', 'weight_clip_max': 3.0, 'weight_exponential_beta': 8.870332929113248}. Best is trial 103 with value: 0.2497346971635756.
2026-05-31 23:18:50 | INFO | src.nested_cv_avggrm_weighted_unified | Trial 129 | outer=2 | alpha=3.053e+05 n_pcs=5000 (pc_topk) weight_search=on
2026-05-31 23:18:50 | INFO | src.nested_cv_avggrm_weighted_unified | Trial 129 | outer=2 | weight={'name': 'exponential', 'floor': 1e-06, 'clip_max': 3.0, 'beta': 8.84271701260775}
[I 2026-05-31 23:18:58,325] Trial 129 finished with value: 0.24843715906557992 and parameters: {'alpha': 305300.73747617455, 'n_pcs': 5000, 'weight_scheme': 'exponential', 'weight_clip_max': 3.0, 'weight_exponential_beta': 8.84271701260775}. Best is trial 103 with value: 0.2497346971635756.
2026-05-31 23:18:58 | INFO | src.nested_cv_avggrm_weighted_unified | Trial 130 | outer=2 | alpha=2.646e+05 n_pcs=4000 (pc_topk) weight_search=on
2026-05-31 23:18:58 | INFO | src.nested_cv_avggrm_weighted_unified | Trial 130 | outer=2 | weight={'name': 'exponential', 'floor': 1e-06, 'clip_max': 10.0, 'beta': 8.038429729342994}
[I 2026-05-31 23:19:04,076] Trial 130 finished with value: 0.24113680238925025 and parameters: {'alpha': 264615.87858874054, 'n_pcs': 4000, 'weight_scheme': 'exponential', 'weight_clip_max': 10.0, 'weight_exponential_beta': 8.038429729342994}. Best is trial 103 with value: 0.2497346971635756.
2026-05-31 23:19:04 | INFO | src.nested_cv_avggrm_weighted_unified | Trial 131 | outer=2 | alpha=1.706e+05 n_pcs=4500 (pc_topk) weight_search=on
2026-05-31 23:19:04 | INFO | src.nested_cv_avggrm_weighted_unified | Trial 131 | outer=2 | weight={'name': 'exponential', 'floor': 1e-06, 'clip_max': 3.0, 'beta': 9.155518002970783}
[I 2026-05-31 23:19:11,097] Trial 131 finished with value: 0.24801874314383077 and parameters: {'alpha': 170642.4586769236, 'n_pcs': 4500, 'weight_scheme': 'exponential', 'weight_clip_max': 3.0, 'weight_exponential_beta': 9.155518002970783}. Best is trial 103 with value: 0.2497346971635756.
2026-05-31 23:19:11 | INFO | src.nested_cv_avggrm_weighted_unified | Trial 132 | outer=2 | alpha=2.442e+05 n_pcs=4500 (pc_topk) weight_search=on
2026-05-31 23:19:11 | INFO | src.nested_cv_avggrm_weighted_unified | Trial 132 | outer=2 | weight={'name': 'exponential', 'floor': 1e-06, 'clip_max': 3.0, 'beta': 8.718424693502593}
[I 2026-05-31 23:19:18,062] Trial 132 finished with value: 0.2491389594260605 and parameters: {'alpha': 244241.77935772116, 'n_pcs': 4500, 'weight_scheme': 'exponential', 'weight_clip_max': 3.0, 'weight_exponential_beta': 8.718424693502593}. Best is trial 103 with value: 0.2497346971635756.
2026-05-31 23:19:18 | INFO | src.nested_cv_avggrm_weighted_unified | Trial 133 | outer=2 | alpha=3.426e+05 n_pcs=4500 (pc_topk) weight_search=on
2026-05-31 23:19:18 | INFO | src.nested_cv_avggrm_weighted_unified | Trial 133 | outer=2 | weight={'name': 'exponential', 'floor': 1e-06, 'clip_max': 3.0, 'beta': 8.658969199495255}
[I 2026-05-31 23:19:25,032] Trial 133 finished with value: 0.24910681517439276 and parameters: {'alpha': 342561.88792881963, 'n_pcs': 4500, 'weight_scheme': 'exponential', 'weight_clip_max': 3.0, 'weight_exponential_beta': 8.658969199495255}. Best is trial 103 with value: 0.2497346971635756.
2026-05-31 23:19:25 | INFO | src.nested_cv_avggrm_weighted_unified | Trial 134 | outer=2 | alpha=3.361e+05 n_pcs=4500 (pc_topk) weight_search=on
2026-05-31 23:19:25 | INFO | src.nested_cv_avggrm_weighted_unified | Trial 134 | outer=2 | weight={'name': 'exponential', 'floor': 1e-06, 'clip_max': 3.0, 'beta': 8.42931729734144}
[I 2026-05-31 23:19:31,997] Trial 134 finished with value: 0.24902036922499873 and parameters: {'alpha': 336110.51743773534, 'n_pcs': 4500, 'weight_scheme': 'exponential', 'weight_clip_max': 3.0, 'weight_exponential_beta': 8.42931729734144}. Best is trial 103 with value: 0.2497346971635756.
2026-05-31 23:19:32 | INFO | src.nested_cv_avggrm_weighted_unified | Trial 135 | outer=2 | alpha=3.320e+05 n_pcs=4500 (pc_topk) weight_search=on
2026-05-31 23:19:32 | INFO | src.nested_cv_avggrm_weighted_unified | Trial 135 | outer=2 | weight={'name': 'exponential', 'floor': 1e-06, 'clip_max': 3.0, 'beta': 8.540469475126462}
[I 2026-05-31 23:19:38,967] Trial 135 finished with value: 0.2490904039734228 and parameters: {'alpha': 331985.9396783104, 'n_pcs': 4500, 'weight_scheme': 'exponential', 'weight_clip_max': 3.0, 'weight_exponential_beta': 8.540469475126462}. Best is trial 103 with value: 0.2497346971635756.
2026-05-31 23:19:38 | INFO | src.nested_cv_avggrm_weighted_unified | Trial 136 | outer=2 | alpha=3.419e+05 n_pcs=5000 (pc_topk) weight_search=on
2026-05-31 23:19:38 | INFO | src.nested_cv_avggrm_weighted_unified | Trial 136 | outer=2 | weight={'name': 'exponential', 'floor': 1e-06, 'clip_max': 3.0, 'beta': 8.389580243042985}
[I 2026-05-31 23:19:47,131] Trial 136 finished with value: 0.2481993247730443 and parameters: {'alpha': 341936.613769504, 'n_pcs': 5000, 'weight_scheme': 'exponential', 'weight_clip_max': 3.0, 'weight_exponential_beta': 8.389580243042985}. Best is trial 103 with value: 0.2497346971635756.
2026-05-31 23:19:47 | INFO | src.nested_cv_avggrm_weighted_unified | Trial 137 | outer=2 | alpha=2.660e+05 n_pcs=4500 (pc_topk) weight_search=on
2026-05-31 23:19:47 | INFO | src.nested_cv_avggrm_weighted_unified | Trial 137 | outer=2 | weight={'name': 'exponential', 'floor': 1e-06, 'clip_max': 20.0, 'beta': 8.009308132016388}
2026-05-31 23:19:52 | INFO | src.nested_cv_avggrm_weighted_unified | Trial 137 | outer=2 | pruned after 7/10 inner folds (mean r=0.2621)
[I 2026-05-31 23:19:52,014] Trial 137 pruned. 
2026-05-31 23:19:52 | INFO | src.nested_cv_avggrm_weighted_unified | Trial 138 | outer=2 | alpha=1.326e+05 n_pcs=4500 (pc_topk) weight_search=on
2026-05-31 23:19:52 | INFO | src.nested_cv_avggrm_weighted_unified | Trial 138 | outer=2 | weight={'name': 'exponential', 'floor': 1e-06, 'clip_max': 3.0, 'beta': 8.668961274491297}
[I 2026-05-31 23:19:59,335] Trial 138 finished with value: 0.24723041921503236 and parameters: {'alpha': 132569.16441193875, 'n_pcs': 4500, 'weight_scheme': 'exponential', 'weight_clip_max': 3.0, 'weight_exponential_beta': 8.668961274491297}. Best is trial 103 with value: 0.2497346971635756.
2026-05-31 23:19:59 | INFO | src.nested_cv_avggrm_weighted_unified | Trial 139 | outer=2 | alpha=3.283e+05 n_pcs=4500 (pc_topk) weight_search=on
2026-05-31 23:19:59 | INFO | src.nested_cv_avggrm_weighted_unified | Trial 139 | outer=2 | weight={'name': 'exponential', 'floor': 1e-06, 'clip_max': 3.0, 'beta': 8.473880014789202}
[I 2026-05-31 23:20:06,306] Trial 139 finished with value: 0.2490706649379948 and parameters: {'alpha': 328280.9020167551, 'n_pcs': 4500, 'weight_scheme': 'exponential', 'weight_clip_max': 3.0, 'weight_exponential_beta': 8.473880014789202}. Best is trial 103 with value: 0.2497346971635756.
2026-05-31 23:20:06 | INFO | src.nested_cv_avggrm_weighted_unified | Trial 140 | outer=2 | alpha=3.242e+05 n_pcs=5000 (pc_topk) weight_search=on
2026-05-31 23:20:06 | INFO | src.nested_cv_avggrm_weighted_unified | Trial 140 | outer=2 | weight={'name': 'exponential', 'floor': 1e-06, 'clip_max': 3.0, 'beta': 2.7507525904947707}
2026-05-31 23:20:12 | INFO | src.nested_cv_avggrm_weighted_unified | Trial 140 | outer=2 | pruned after 7/10 inner folds (mean r=0.2769)
[I 2026-05-31 23:20:12,024] Trial 140 pruned. 
2026-05-31 23:20:12 | INFO | src.nested_cv_avggrm_weighted_unified | Trial 141 | outer=2 | alpha=2.635e+05 n_pcs=4500 (pc_topk) weight_search=on
2026-05-31 23:20:12 | INFO | src.nested_cv_avggrm_weighted_unified | Trial 141 | outer=2 | weight={'name': 'exponential', 'floor': 1e-06, 'clip_max': 3.0, 'beta': 8.511024608539179}
[I 2026-05-31 23:20:18,997] Trial 141 finished with value: 0.24916172904388784 and parameters: {'alpha': 263497.53559869743, 'n_pcs': 4500, 'weight_scheme': 'exponential', 'weight_clip_max': 3.0, 'weight_exponential_beta': 8.511024608539179}. Best is trial 103 with value: 0.2497346971635756.
2026-05-31 23:20:19 | INFO | src.nested_cv_avggrm_weighted_unified | Trial 142 | outer=2 | alpha=3.680e+05 n_pcs=4500 (pc_topk) weight_search=on
2026-05-31 23:20:19 | INFO | src.nested_cv_avggrm_weighted_unified | Trial 142 | outer=2 | weight={'name': 'exponential', 'floor': 1e-06, 'clip_max': 3.0, 'beta': 8.474899948199806}
[I 2026-05-31 23:20:25,957] Trial 142 finished with value: 0.24890817081416827 and parameters: {'alpha': 368024.4824075069, 'n_pcs': 4500, 'weight_scheme': 'exponential', 'weight_clip_max': 3.0, 'weight_exponential_beta': 8.474899948199806}. Best is trial 103 with value: 0.2497346971635756.
2026-05-31 23:20:25 | INFO | src.nested_cv_avggrm_weighted_unified | Trial 143 | outer=2 | alpha=2.773e+05 n_pcs=4500 (pc_topk) weight_search=on
2026-05-31 23:20:25 | INFO | src.nested_cv_avggrm_weighted_unified | Trial 143 | outer=2 | weight={'name': 'exponential', 'floor': 1e-06, 'clip_max': 3.0, 'beta': 8.568900986143195}
[I 2026-05-31 23:20:32,914] Trial 143 finished with value: 0.2491894395992995 and parameters: {'alpha': 277284.15546198096, 'n_pcs': 4500, 'weight_scheme': 'exponential', 'weight_clip_max': 3.0, 'weight_exponential_beta': 8.568900986143195}. Best is trial 103 with value: 0.2497346971635756.
2026-05-31 23:20:32 | INFO | src.nested_cv_avggrm_weighted_unified | Trial 144 | outer=2 | alpha=2.938e+05 n_pcs=4000 (pc_topk) weight_search=on
2026-05-31 23:20:32 | INFO | src.nested_cv_avggrm_weighted_unified | Trial 144 | outer=2 | weight={'name': 'exponential', 'floor': 1e-06, 'clip_max': 3.0, 'beta': 8.937240909696307}
[I 2026-05-31 23:20:38,622] Trial 144 finished with value: 0.24983212973228822 and parameters: {'alpha': 293785.5735066282, 'n_pcs': 4000, 'weight_scheme': 'exponential', 'weight_clip_max': 3.0, 'weight_exponential_beta': 8.937240909696307}. Best is trial 144 with value: 0.24983212973228822.
2026-05-31 23:20:38 | INFO | src.nested_cv_avggrm_weighted_unified | OUTER 2 | new best trial 144 (mean inner r=0.2498) saved to outputs/final_results/e6_pc_ridge_avggrm/thr_wing/e6_pc_ridge_avggrm_thr_wing_best_trials/split_02_best_trial.json
2026-05-31 23:20:38 | INFO | src.nested_cv_avggrm_weighted_unified | Trial 145 | outer=2 | alpha=2.619e+05 n_pcs=4000 (pc_topk) weight_search=on
2026-05-31 23:20:38 | INFO | src.nested_cv_avggrm_weighted_unified | Trial 145 | outer=2 | weight={'name': 'exponential', 'floor': 1e-06, 'clip_max': 3.0, 'beta': 8.961490476184002}
[I 2026-05-31 23:20:44,614] Trial 145 finished with value: 0.24970877281155213 and parameters: {'alpha': 261941.7920254552, 'n_pcs': 4000, 'weight_scheme': 'exponential', 'weight_clip_max': 3.0, 'weight_exponential_beta': 8.961490476184002}. Best is trial 144 with value: 0.24983212973228822.
2026-05-31 23:20:44 | INFO | src.nested_cv_avggrm_weighted_unified | Trial 146 | outer=2 | alpha=2.658e+05 n_pcs=4000 (pc_topk) weight_search=on
2026-05-31 23:20:44 | INFO | src.nested_cv_avggrm_weighted_unified | Trial 146 | outer=2 | weight={'name': 'uniform', 'floor': 1e-06, 'clip_max': 3.0}
2026-05-31 23:20:47 | INFO | src.nested_cv_avggrm_weighted_unified | Trial 146 | outer=2 | pruned after 6/10 inner folds (mean r=0.2357)
[I 2026-05-31 23:20:47,564] Trial 146 pruned. 
2026-05-31 23:20:47 | INFO | src.nested_cv_avggrm_weighted_unified | Trial 147 | outer=2 | alpha=1.591e+04 n_pcs=4000 (pc_topk) weight_search=on
2026-05-31 23:20:47 | INFO | src.nested_cv_avggrm_weighted_unified | Trial 147 | outer=2 | weight={'name': 'exponential', 'floor': 1e-06, 'clip_max': 3.0, 'beta': 8.95472683735107}
2026-05-31 23:20:51 | INFO | src.nested_cv_avggrm_weighted_unified | Trial 147 | outer=2 | pruned after 6/10 inner folds (mean r=0.2104)
[I 2026-05-31 23:20:51,046] Trial 147 pruned. 
2026-05-31 23:20:51 | INFO | src.nested_cv_avggrm_weighted_unified | Trial 148 | outer=2 | alpha=4.118e+05 n_pcs=4000 (pc_topk) weight_search=on
2026-05-31 23:20:51 | INFO | src.nested_cv_avggrm_weighted_unified | Trial 148 | outer=2 | weight={'name': 'exponential', 'floor': 1e-06, 'clip_max': 3.0, 'beta': 9.044638831695886}
[I 2026-05-31 23:20:56,789] Trial 148 finished with value: 0.24960962834624176 and parameters: {'alpha': 411838.7033446704, 'n_pcs': 4000, 'weight_scheme': 'exponential', 'weight_clip_max': 3.0, 'weight_exponential_beta': 9.044638831695886}. Best is trial 144 with value: 0.24983212973228822.
2026-05-31 23:20:56 | INFO | src.nested_cv_avggrm_weighted_unified | Trial 149 | outer=2 | alpha=4.347e+05 n_pcs=4000 (pc_topk) weight_search=on
2026-05-31 23:20:56 | INFO | src.nested_cv_avggrm_weighted_unified | Trial 149 | outer=2 | weight={'name': 'linear', 'floor': 1e-06, 'clip_max': None, 'min_weight': 0.2458666866613281, 'max_weight': 4.3131357117444855}
2026-05-31 23:21:00 | INFO | src.nested_cv_avggrm_weighted_unified | Trial 149 | outer=2 | pruned after 7/10 inner folds (mean r=0.2762)
[I 2026-05-31 23:21:00,830] Trial 149 pruned. 
2026-05-31 23:21:00 | INFO | src.nested_cv_avggrm_weighted_unified | Trial 150 | outer=2 | alpha=2.573e+05 n_pcs=4000 (pc_topk) weight_search=on
2026-05-31 23:21:00 | INFO | src.nested_cv_avggrm_weighted_unified | Trial 150 | outer=2 | weight={'name': 'exponential', 'floor': 1e-06, 'clip_max': 3.0, 'beta': 8.719617670133333}
[I 2026-05-31 23:21:06,599] Trial 150 finished with value: 0.2497290423495929 and parameters: {'alpha': 257336.8346893809, 'n_pcs': 4000, 'weight_scheme': 'exponential', 'weight_clip_max': 3.0, 'weight_exponential_beta': 8.719617670133333}. Best is trial 144 with value: 0.24983212973228822.
2026-05-31 23:21:06 | INFO | src.nested_cv_avggrm_weighted_unified | Trial 151 | outer=2 | alpha=2.506e+05 n_pcs=4000 (pc_topk) weight_search=on
2026-05-31 23:21:06 | INFO | src.nested_cv_avggrm_weighted_unified | Trial 151 | outer=2 | weight={'name': 'exponential', 'floor': 1e-06, 'clip_max': 3.0, 'beta': 8.727110193081787}
[I 2026-05-31 23:21:12,369] Trial 151 finished with value: 0.24969174698412896 and parameters: {'alpha': 250614.66600106668, 'n_pcs': 4000, 'weight_scheme': 'exponential', 'weight_clip_max': 3.0, 'weight_exponential_beta': 8.727110193081787}. Best is trial 144 with value: 0.24983212973228822.
2026-05-31 23:21:12 | INFO | src.nested_cv_avggrm_weighted_unified | Trial 152 | outer=2 | alpha=2.559e+05 n_pcs=4000 (pc_topk) weight_search=on
2026-05-31 23:21:12 | INFO | src.nested_cv_avggrm_weighted_unified | Trial 152 | outer=2 | weight={'name': 'exponential', 'floor': 1e-06, 'clip_max': 3.0, 'beta': 8.783679349906938}
