[I 2026-06-01 22:57:06,123] Trial 163 finished with value: 0.22458003452711636 and parameters: {'alpha': 80125.55688274685, 'n_pcs': 4500, 'iw_method': 'pc_logistic', 'iw_clip_max': 4.0, 'iw_prob_clip': 0.024211869573731976, 'iw_n_components': 100, 'iw_logistic_c': 0.0001181516845294959, 'iw_pca_fit': 'combined', 'iw_solver': 'lbfgs', 'iw_rho': 0.85}. Best is trial 108 with value: 0.22594023894922968.
2026-06-01 22:57:06 | INFO | Trial 164 | outer=8 | alpha=7.602e+04 n_pcs=4500 (pc_topk) weight={'name': 'pc_logistic', 'floor': 1e-06, 'clip_max': 4.0, 'prob_clip': 0.0260917073688973, 'n_components': 100, 'logistic_c': 0.00010882600766299798, 'pca_fit': 'combined', 'solver': 'lbfgs', 'max_iter': 2000, 'fit_intercept': True, 'standardize_with_source': True, 'rho': 0.85}
[I 2026-06-01 22:57:22,533] Trial 164 finished with value: 0.22459850824178992 and parameters: {'alpha': 76019.43920061698, 'n_pcs': 4500, 'iw_method': 'pc_logistic', 'iw_clip_max': 4.0, 'iw_prob_clip': 0.0260917073688973, 'iw_n_components': 100, 'iw_logistic_c': 0.00010882600766299798, 'iw_pca_fit': 'combined', 'iw_solver': 'lbfgs', 'iw_rho': 0.85}. Best is trial 108 with value: 0.22594023894922968.
2026-06-01 22:57:22 | INFO | Trial 165 | outer=8 | alpha=8.496e+04 n_pcs=4500 (pc_topk) weight={'name': 'pc_logistic', 'floor': 1e-06, 'clip_max': 4.0, 'prob_clip': 0.02387289245082955, 'n_components': 100, 'logistic_c': 5.289171925076147e-05, 'pca_fit': 'combined', 'solver': 'lbfgs', 'max_iter': 2000, 'fit_intercept': True, 'standardize_with_source': True, 'rho': 0.85}
[I 2026-06-01 22:57:37,694] Trial 165 finished with value: 0.22437587373623477 and parameters: {'alpha': 84958.05965217907, 'n_pcs': 4500, 'iw_method': 'pc_logistic', 'iw_clip_max': 4.0, 'iw_prob_clip': 0.02387289245082955, 'iw_n_components': 100, 'iw_logistic_c': 5.289171925076147e-05, 'iw_pca_fit': 'combined', 'iw_solver': 'lbfgs', 'iw_rho': 0.85}. Best is trial 108 with value: 0.22594023894922968.
2026-06-01 22:57:37 | INFO | Trial 166 | outer=8 | alpha=7.555e+04 n_pcs=5000 (pc_topk) weight={'name': 'pc_logistic', 'floor': 1e-06, 'clip_max': 4.0, 'prob_clip': 0.030154411957610917, 'n_components': 100, 'logistic_c': 5.6660031420342385e-05, 'pca_fit': 'combined', 'solver': 'lbfgs', 'max_iter': 2000, 'fit_intercept': True, 'standardize_with_source': True, 'rho': 0.85}
[I 2026-06-01 22:57:55,006] Trial 166 finished with value: 0.2226691706040374 and parameters: {'alpha': 75549.84051294292, 'n_pcs': 5000, 'iw_method': 'pc_logistic', 'iw_clip_max': 4.0, 'iw_prob_clip': 0.030154411957610917, 'iw_n_components': 100, 'iw_logistic_c': 5.6660031420342385e-05, 'iw_pca_fit': 'combined', 'iw_solver': 'lbfgs', 'iw_rho': 0.85}. Best is trial 108 with value: 0.22594023894922968.
2026-06-01 22:57:55 | INFO | Trial 167 | outer=8 | alpha=8.743e+04 n_pcs=4500 (pc_topk) weight={'name': 'pc_logistic', 'floor': 1e-06, 'clip_max': 4.0, 'prob_clip': 0.024732060490677367, 'n_components': 100, 'logistic_c': 8.905638579031733e-05, 'pca_fit': 'combined', 'solver': 'lbfgs', 'max_iter': 2000, 'fit_intercept': True, 'standardize_with_source': True, 'rho': 0.85}
[I 2026-06-01 22:58:11,167] Trial 167 finished with value: 0.22448597018870986 and parameters: {'alpha': 87428.18245311882, 'n_pcs': 4500, 'iw_method': 'pc_logistic', 'iw_clip_max': 4.0, 'iw_prob_clip': 0.024732060490677367, 'iw_n_components': 100, 'iw_logistic_c': 8.905638579031733e-05, 'iw_pca_fit': 'combined', 'iw_solver': 'lbfgs', 'iw_rho': 0.85}. Best is trial 108 with value: 0.22594023894922968.
2026-06-01 22:58:11 | INFO | Trial 168 | outer=8 | alpha=9.011e+04 n_pcs=4500 (pc_topk) weight={'name': 'pc_logistic', 'floor': 1e-06, 'clip_max': 4.0, 'prob_clip': 0.025879156005458363, 'n_components': 100, 'logistic_c': 3.686817483760865e-05, 'pca_fit': 'combined', 'solver': 'lbfgs', 'max_iter': 2000, 'fit_intercept': True, 'standardize_with_source': True, 'rho': 1.0}
[I 2026-06-01 22:58:26,748] Trial 168 finished with value: 0.22362448082341482 and parameters: {'alpha': 90107.48221374665, 'n_pcs': 4500, 'iw_method': 'pc_logistic', 'iw_clip_max': 4.0, 'iw_prob_clip': 0.025879156005458363, 'iw_n_components': 100, 'iw_logistic_c': 3.686817483760865e-05, 'iw_pca_fit': 'combined', 'iw_solver': 'lbfgs', 'iw_rho': 1.0}. Best is trial 108 with value: 0.22594023894922968.
2026-06-01 22:58:26 | INFO | Trial 169 | outer=8 | alpha=8.268e+04 n_pcs=4500 (pc_topk) weight={'name': 'pc_logistic', 'floor': 1e-06, 'clip_max': 4.0, 'prob_clip': 0.03494822047561523, 'n_components': 100, 'logistic_c': 2.5425378891073116e-05, 'pca_fit': 'combined', 'solver': 'lbfgs', 'max_iter': 2000, 'fit_intercept': True, 'standardize_with_source': True, 'rho': 1.0}
[I 2026-06-01 22:58:41,438] Trial 169 finished with value: 0.22259589301445554 and parameters: {'alpha': 82676.1436081319, 'n_pcs': 4500, 'iw_method': 'pc_logistic', 'iw_clip_max': 4.0, 'iw_prob_clip': 0.03494822047561523, 'iw_n_components': 100, 'iw_logistic_c': 2.5425378891073116e-05, 'iw_pca_fit': 'combined', 'iw_solver': 'lbfgs', 'iw_rho': 1.0}. Best is trial 108 with value: 0.22594023894922968.
2026-06-01 22:58:41 | INFO | Trial 170 | outer=8 | alpha=9.332e+04 n_pcs=4000 (pc_topk) weight={'name': 'pc_logistic', 'floor': 1e-06, 'clip_max': 4.0, 'prob_clip': 0.025780532550931226, 'n_components': 100, 'logistic_c': 3.89342020224702e-05, 'pca_fit': 'combined', 'solver': 'lbfgs', 'max_iter': 2000, 'fit_intercept': True, 'standardize_with_source': True, 'rho': 1.0}
[I 2026-06-01 22:58:54,895] Trial 170 finished with value: 0.22414843473444904 and parameters: {'alpha': 93322.53069653806, 'n_pcs': 4000, 'iw_method': 'pc_logistic', 'iw_clip_max': 4.0, 'iw_prob_clip': 0.025780532550931226, 'iw_n_components': 100, 'iw_logistic_c': 3.89342020224702e-05, 'iw_pca_fit': 'combined', 'iw_solver': 'lbfgs', 'iw_rho': 1.0}. Best is trial 108 with value: 0.22594023894922968.
2026-06-01 22:58:54 | INFO | Trial 171 | outer=8 | alpha=9.342e+04 n_pcs=4500 (pc_topk) weight={'name': 'pc_logistic', 'floor': 1e-06, 'clip_max': 4.0, 'prob_clip': 0.0258167420274643, 'n_components': 100, 'logistic_c': 3.5914631287153014e-05, 'pca_fit': 'combined', 'solver': 'lbfgs', 'max_iter': 2000, 'fit_intercept': True, 'standardize_with_source': True, 'rho': 1.0}
[I 2026-06-01 22:59:10,205] Trial 171 finished with value: 0.22347754571872303 and parameters: {'alpha': 93421.47835891681, 'n_pcs': 4500, 'iw_method': 'pc_logistic', 'iw_clip_max': 4.0, 'iw_prob_clip': 0.0258167420274643, 'iw_n_components': 100, 'iw_logistic_c': 3.5914631287153014e-05, 'iw_pca_fit': 'combined', 'iw_solver': 'lbfgs', 'iw_rho': 1.0}. Best is trial 108 with value: 0.22594023894922968.
2026-06-01 22:59:10 | INFO | Trial 172 | outer=8 | alpha=5.539e+04 n_pcs=4500 (pc_topk) weight={'name': 'pc_logistic', 'floor': 1e-06, 'clip_max': 4.0, 'prob_clip': 0.02832693769914099, 'n_components': 100, 'logistic_c': 1.7928652370511942e-05, 'pca_fit': 'combined', 'solver': 'lbfgs', 'max_iter': 2000, 'fit_intercept': True, 'standardize_with_source': True, 'rho': 1.0}
[I 2026-06-01 22:59:24,784] Trial 172 finished with value: 0.22374889132644976 and parameters: {'alpha': 55391.71157349938, 'n_pcs': 4500, 'iw_method': 'pc_logistic', 'iw_clip_max': 4.0, 'iw_prob_clip': 0.02832693769914099, 'iw_n_components': 100, 'iw_logistic_c': 1.7928652370511942e-05, 'iw_pca_fit': 'combined', 'iw_solver': 'lbfgs', 'iw_rho': 1.0}. Best is trial 108 with value: 0.22594023894922968.
2026-06-01 22:59:24 | INFO | Trial 173 | outer=8 | alpha=5.605e+04 n_pcs=4500 (pc_topk) weight={'name': 'pc_logistic', 'floor': 1e-06, 'clip_max': 4.0, 'prob_clip': 0.027433776262086096, 'n_components': 100, 'logistic_c': 1.0891094633903962e-05, 'pca_fit': 'combined', 'solver': 'lbfgs', 'max_iter': 2000, 'fit_intercept': True, 'standardize_with_source': True, 'rho': 1.0}
[I 2026-06-01 22:59:39,599] Trial 173 finished with value: 0.2235425590862307 and parameters: {'alpha': 56049.84306680753, 'n_pcs': 4500, 'iw_method': 'pc_logistic', 'iw_clip_max': 4.0, 'iw_prob_clip': 0.027433776262086096, 'iw_n_components': 100, 'iw_logistic_c': 1.0891094633903962e-05, 'iw_pca_fit': 'combined', 'iw_solver': 'lbfgs', 'iw_rho': 1.0}. Best is trial 108 with value: 0.22594023894922968.
2026-06-01 22:59:39 | INFO | Trial 174 | outer=8 | alpha=7.509e+04 n_pcs=4000 (pc_topk) weight={'name': 'pc_logistic', 'floor': 1e-06, 'clip_max': 4.0, 'prob_clip': 0.03189552944697017, 'n_components': 20, 'logistic_c': 1.2546218021180058e-05, 'pca_fit': 'combined', 'solver': 'lbfgs', 'max_iter': 2000, 'fit_intercept': True, 'standardize_with_source': True, 'rho': 1.0}
[I 2026-06-01 22:59:52,425] Trial 174 finished with value: 0.22276373364760965 and parameters: {'alpha': 75086.5171140686, 'n_pcs': 4000, 'iw_method': 'pc_logistic', 'iw_clip_max': 4.0, 'iw_prob_clip': 0.03189552944697017, 'iw_n_components': 20, 'iw_logistic_c': 1.2546218021180058e-05, 'iw_pca_fit': 'combined', 'iw_solver': 'lbfgs', 'iw_rho': 1.0}. Best is trial 108 with value: 0.22594023894922968.
2026-06-01 22:59:52 | INFO | Trial 175 | outer=8 | alpha=5.583e+04 n_pcs=5000 (pc_topk) weight={'name': 'pc_logistic', 'floor': 1e-06, 'clip_max': 4.0, 'prob_clip': 0.03835059854746714, 'n_components': 100, 'logistic_c': 6.444927492007411e-06, 'pca_fit': 'combined', 'solver': 'lbfgs', 'max_iter': 2000, 'fit_intercept': True, 'standardize_with_source': True, 'rho': 1.0}
[I 2026-06-01 23:00:09,152] Trial 175 finished with value: 0.2190780396881505 and parameters: {'alpha': 55826.39546876948, 'n_pcs': 5000, 'iw_method': 'pc_logistic', 'iw_clip_max': 4.0, 'iw_prob_clip': 0.03835059854746714, 'iw_n_components': 100, 'iw_logistic_c': 6.444927492007411e-06, 'iw_pca_fit': 'combined', 'iw_solver': 'lbfgs', 'iw_rho': 1.0}. Best is trial 108 with value: 0.22594023894922968.
2026-06-01 23:00:09 | INFO | Trial 176 | outer=8 | alpha=8.970e+04 n_pcs=4500 (pc_topk) weight={'name': 'pc_logistic', 'floor': 1e-06, 'clip_max': 4.0, 'prob_clip': 0.02912197232672411, 'n_components': 100, 'logistic_c': 1.8563661828463044e-05, 'pca_fit': 'combined', 'solver': 'lbfgs', 'max_iter': 2000, 'fit_intercept': True, 'standardize_with_source': True, 'rho': 1.0}
[I 2026-06-01 23:00:24,159] Trial 176 finished with value: 0.22252936798662265 and parameters: {'alpha': 89697.88856992075, 'n_pcs': 4500, 'iw_method': 'pc_logistic', 'iw_clip_max': 4.0, 'iw_prob_clip': 0.02912197232672411, 'iw_n_components': 100, 'iw_logistic_c': 1.8563661828463044e-05, 'iw_pca_fit': 'combined', 'iw_solver': 'lbfgs', 'iw_rho': 1.0}. Best is trial 108 with value: 0.22594023894922968.
2026-06-01 23:00:24 | INFO | Trial 177 | outer=8 | alpha=7.392e+04 n_pcs=4500 (pc_topk) weight={'name': 'uniform'}
[I 2026-06-01 23:00:32,850] Trial 177 finished with value: 0.21201631591084347 and parameters: {'alpha': 73920.26140354922, 'n_pcs': 4500, 'iw_method': 'uniform'}. Best is trial 108 with value: 0.22594023894922968.
2026-06-01 23:00:32 | INFO | Trial 178 | outer=8 | alpha=5.521e+04 n_pcs=4500 (pc_topk) weight={'name': 'pc_logistic', 'floor': 1e-06, 'clip_max': 4.0, 'prob_clip': 0.02421664817499028, 'n_components': 100, 'logistic_c': 5.204284111650892e-05, 'pca_fit': 'combined', 'solver': 'lbfgs', 'max_iter': 2000, 'fit_intercept': True, 'standardize_with_source': True, 'rho': 1.0}
[I 2026-06-01 23:00:47,776] Trial 178 finished with value: 0.22448169471832707 and parameters: {'alpha': 55207.73203665223, 'n_pcs': 4500, 'iw_method': 'pc_logistic', 'iw_clip_max': 4.0, 'iw_prob_clip': 0.02421664817499028, 'iw_n_components': 100, 'iw_logistic_c': 5.204284111650892e-05, 'iw_pca_fit': 'combined', 'iw_solver': 'lbfgs', 'iw_rho': 1.0}. Best is trial 108 with value: 0.22594023894922968.
2026-06-01 23:00:47 | INFO | Trial 179 | outer=8 | alpha=5.965e+04 n_pcs=4000 (pc_topk) weight={'name': 'pc_logistic', 'floor': 1e-06, 'clip_max': 12.0, 'prob_clip': 0.024849511386481025, 'n_components': 100, 'logistic_c': 7.3247685754651e-05, 'pca_fit': 'combined', 'solver': 'lbfgs', 'max_iter': 2000, 'fit_intercept': True, 'standardize_with_source': True, 'rho': 1.0}
[I 2026-06-01 23:01:01,197] Trial 179 finished with value: 0.21483864115533252 and parameters: {'alpha': 59648.04784587848, 'n_pcs': 4000, 'iw_method': 'pc_logistic', 'iw_clip_max': 12.0, 'iw_prob_clip': 0.024849511386481025, 'iw_n_components': 100, 'iw_logistic_c': 7.3247685754651e-05, 'iw_pca_fit': 'combined', 'iw_solver': 'lbfgs', 'iw_rho': 1.0}. Best is trial 108 with value: 0.22594023894922968.
2026-06-01 23:01:01 | INFO | Trial 180 | outer=8 | alpha=4.292e+04 n_pcs=5000 (pc_topk) weight={'name': 'pc_logistic', 'floor': 1e-06, 'clip_max': 4.0, 'prob_clip': 0.023293715978463626, 'n_components': 60, 'logistic_c': 4.5134197333567786e-05, 'pca_fit': 'combined', 'solver': 'lbfgs', 'max_iter': 2000, 'fit_intercept': True, 'standardize_with_source': True, 'rho': 1.0}
[I 2026-06-01 23:01:18,293] Trial 180 finished with value: 0.22098635232452998 and parameters: {'alpha': 42921.785174179226, 'n_pcs': 5000, 'iw_method': 'pc_logistic', 'iw_clip_max': 4.0, 'iw_prob_clip': 0.023293715978463626, 'iw_n_components': 60, 'iw_logistic_c': 4.5134197333567786e-05, 'iw_pca_fit': 'combined', 'iw_solver': 'lbfgs', 'iw_rho': 1.0}. Best is trial 108 with value: 0.22594023894922968.
2026-06-01 23:01:18 | INFO | Trial 181 | outer=8 | alpha=7.081e+04 n_pcs=4500 (pc_topk) weight={'name': 'pc_logistic', 'floor': 1e-06, 'clip_max': 4.0, 'prob_clip': 0.027471245168877386, 'n_components': 100, 'logistic_c': 2.8937349568164794e-05, 'pca_fit': 'combined', 'solver': 'lbfgs', 'max_iter': 2000, 'fit_intercept': True, 'standardize_with_source': True, 'rho': 1.0}
[I 2026-06-01 23:01:33,360] Trial 181 finished with value: 0.22377033801553098 and parameters: {'alpha': 70811.93128750255, 'n_pcs': 4500, 'iw_method': 'pc_logistic', 'iw_clip_max': 4.0, 'iw_prob_clip': 0.027471245168877386, 'iw_n_components': 100, 'iw_logistic_c': 2.8937349568164794e-05, 'iw_pca_fit': 'combined', 'iw_solver': 'lbfgs', 'iw_rho': 1.0}. Best is trial 108 with value: 0.22594023894922968.
2026-06-01 23:01:33 | INFO | Trial 182 | outer=8 | alpha=5.131e+04 n_pcs=4500 (pc_topk) weight={'name': 'pc_logistic', 'floor': 1e-06, 'clip_max': 4.0, 'prob_clip': 0.03295992887865742, 'n_components': 100, 'logistic_c': 2.0192745289538542e-05, 'pca_fit': 'combined', 'solver': 'lbfgs', 'max_iter': 2000, 'fit_intercept': True, 'standardize_with_source': True, 'rho': 1.0}
[I 2026-06-01 23:01:48,158] Trial 182 finished with value: 0.22382175417663275 and parameters: {'alpha': 51306.76997269136, 'n_pcs': 4500, 'iw_method': 'pc_logistic', 'iw_clip_max': 4.0, 'iw_prob_clip': 0.03295992887865742, 'iw_n_components': 100, 'iw_logistic_c': 2.0192745289538542e-05, 'iw_pca_fit': 'combined', 'iw_solver': 'lbfgs', 'iw_rho': 1.0}. Best is trial 108 with value: 0.22594023894922968.
2026-06-01 23:01:48 | INFO | Trial 183 | outer=8 | alpha=7.067e+04 n_pcs=4500 (pc_topk) weight={'name': 'pc_logistic', 'floor': 1e-06, 'clip_max': 4.0, 'prob_clip': 0.03336526496433496, 'n_components': 100, 'logistic_c': 5.6750713168593384e-05, 'pca_fit': 'combined', 'solver': 'lbfgs', 'max_iter': 2000, 'fit_intercept': True, 'standardize_with_source': True, 'rho': 1.0}
[I 2026-06-01 23:02:03,460] Trial 183 finished with value: 0.22352886278690995 and parameters: {'alpha': 70668.96065060448, 'n_pcs': 4500, 'iw_method': 'pc_logistic', 'iw_clip_max': 4.0, 'iw_prob_clip': 0.03336526496433496, 'iw_n_components': 100, 'iw_logistic_c': 5.6750713168593384e-05, 'iw_pca_fit': 'combined', 'iw_solver': 'lbfgs', 'iw_rho': 1.0}. Best is trial 108 with value: 0.22594023894922968.
2026-06-01 23:02:03 | INFO | Trial 184 | outer=8 | alpha=4.889e+04 n_pcs=4500 (pc_topk) weight={'name': 'pc_logistic', 'floor': 1e-06, 'clip_max': 4.0, 'prob_clip': 0.029981536275583937, 'n_components': 100, 'logistic_c': 2.3834175003874357e-05, 'pca_fit': 'combined', 'solver': 'lbfgs', 'max_iter': 2000, 'fit_intercept': True, 'standardize_with_source': True, 'rho': 1.0}
[I 2026-06-01 23:02:18,894] Trial 184 finished with value: 0.22423941957753582 and parameters: {'alpha': 48888.88851563327, 'n_pcs': 4500, 'iw_method': 'pc_logistic', 'iw_clip_max': 4.0, 'iw_prob_clip': 0.029981536275583937, 'iw_n_components': 100, 'iw_logistic_c': 2.3834175003874357e-05, 'iw_pca_fit': 'combined', 'iw_solver': 'lbfgs', 'iw_rho': 1.0}. Best is trial 108 with value: 0.22594023894922968.
2026-06-01 23:02:18 | INFO | Trial 185 | outer=8 | alpha=3.848e+04 n_pcs=4500 (pc_topk) weight={'name': 'pc_logistic', 'floor': 1e-06, 'clip_max': 2.5, 'prob_clip': 0.04598660863093318, 'n_components': 100, 'logistic_c': 8.933502688994064e-05, 'pca_fit': 'combined', 'solver': 'lbfgs', 'max_iter': 2000, 'fit_intercept': True, 'standardize_with_source': True, 'rho': 1.0}
[I 2026-06-01 23:02:34,563] Trial 185 finished with value: 0.22430814932312587 and parameters: {'alpha': 38477.226773127266, 'n_pcs': 4500, 'iw_method': 'pc_logistic', 'iw_clip_max': 2.5, 'iw_prob_clip': 0.04598660863093318, 'iw_n_components': 100, 'iw_logistic_c': 8.933502688994064e-05, 'iw_pca_fit': 'combined', 'iw_solver': 'lbfgs', 'iw_rho': 1.0}. Best is trial 108 with value: 0.22594023894922968.
2026-06-01 23:02:34 | INFO | Trial 186 | outer=8 | alpha=4.007e+04 n_pcs=4500 (pc_topk) weight={'name': 'pc_logistic', 'floor': 1e-06, 'clip_max': 2.5, 'prob_clip': 0.04011588625467711, 'n_components': 100, 'logistic_c': 0.0003096863569731021, 'pca_fit': 'combined', 'solver': 'lbfgs', 'max_iter': 2000, 'fit_intercept': True, 'standardize_with_source': True, 'rho': 0.85}
[I 2026-06-01 23:02:51,977] Trial 186 finished with value: 0.2240819327814383 and parameters: {'alpha': 40074.31399639879, 'n_pcs': 4500, 'iw_method': 'pc_logistic', 'iw_clip_max': 2.5, 'iw_prob_clip': 0.04011588625467711, 'iw_n_components': 100, 'iw_logistic_c': 0.0003096863569731021, 'iw_pca_fit': 'combined', 'iw_solver': 'lbfgs', 'iw_rho': 0.85}. Best is trial 108 with value: 0.22594023894922968.
2026-06-01 23:02:51 | INFO | Trial 187 | outer=8 | alpha=4.148e+04 n_pcs=4500 (pc_topk) weight={'name': 'pc_logistic', 'floor': 1e-06, 'clip_max': 2.5, 'prob_clip': 0.03993841828903813, 'n_components': 10, 'logistic_c': 8.321242185810916e-05, 'pca_fit': 'combined', 'solver': 'lbfgs', 'max_iter': 2000, 'fit_intercept': True, 'standardize_with_source': True, 'rho': 0.85}
[I 2026-06-01 23:03:07,748] Trial 187 finished with value: 0.22264491149833296 and parameters: {'alpha': 41475.08528331788, 'n_pcs': 4500, 'iw_method': 'pc_logistic', 'iw_clip_max': 2.5, 'iw_prob_clip': 0.03993841828903813, 'iw_n_components': 10, 'iw_logistic_c': 8.321242185810916e-05, 'iw_pca_fit': 'combined', 'iw_solver': 'lbfgs', 'iw_rho': 0.85}. Best is trial 108 with value: 0.22594023894922968.
2026-06-01 23:03:07 | INFO | Trial 188 | outer=8 | alpha=3.795e+04 n_pcs=4500 (pc_topk) weight={'name': 'pc_logistic', 'floor': 1e-06, 'clip_max': 2.5, 'prob_clip': 0.04314296983785757, 'n_components': 100, 'logistic_c': 0.0003057176449699591, 'pca_fit': 'combined', 'solver': 'lbfgs', 'max_iter': 2000, 'fit_intercept': True, 'standardize_with_source': True, 'rho': 0.85}
[I 2026-06-01 23:03:25,798] Trial 188 finished with value: 0.2236717240241281 and parameters: {'alpha': 37951.46475767482, 'n_pcs': 4500, 'iw_method': 'pc_logistic', 'iw_clip_max': 2.5, 'iw_prob_clip': 0.04314296983785757, 'iw_n_components': 100, 'iw_logistic_c': 0.0003057176449699591, 'iw_pca_fit': 'combined', 'iw_solver': 'lbfgs', 'iw_rho': 0.85}. Best is trial 108 with value: 0.22594023894922968.
2026-06-01 23:03:25 | INFO | Trial 189 | outer=8 | alpha=4.865e+04 n_pcs=4000 (pc_topk) weight={'name': 'pc_logistic', 'floor': 1e-06, 'clip_max': 2.5, 'prob_clip': 0.04367726164017764, 'n_components': 100, 'logistic_c': 9.504757552868191e-05, 'pca_fit': 'combined', 'solver': 'lbfgs', 'max_iter': 2000, 'fit_intercept': True, 'standardize_with_source': True, 'rho': 0.85}
[I 2026-06-01 23:03:39,875] Trial 189 finished with value: 0.22438215777534096 and parameters: {'alpha': 48645.36456569933, 'n_pcs': 4000, 'iw_method': 'pc_logistic', 'iw_clip_max': 2.5, 'iw_prob_clip': 0.04367726164017764, 'iw_n_components': 100, 'iw_logistic_c': 9.504757552868191e-05, 'iw_pca_fit': 'combined', 'iw_solver': 'lbfgs', 'iw_rho': 0.85}. Best is trial 108 with value: 0.22594023894922968.
2026-06-01 23:03:39 | INFO | Trial 190 | outer=8 | alpha=5.068e+04 n_pcs=4000 (pc_topk) weight={'name': 'pc_logistic', 'floor': 1e-06, 'clip_max': 2.5, 'prob_clip': 0.0460271100710181, 'n_components': 80, 'logistic_c': 9.08569438685675e-05, 'pca_fit': 'combined', 'solver': 'lbfgs', 'max_iter': 2000, 'fit_intercept': True, 'standardize_with_source': True, 'rho': 0.85}
[I 2026-06-01 23:03:53,980] Trial 190 finished with value: 0.22273498277043116 and parameters: {'alpha': 50683.60628833986, 'n_pcs': 4000, 'iw_method': 'pc_logistic', 'iw_clip_max': 2.5, 'iw_prob_clip': 0.0460271100710181, 'iw_n_components': 80, 'iw_logistic_c': 9.08569438685675e-05, 'iw_pca_fit': 'combined', 'iw_solver': 'lbfgs', 'iw_rho': 0.85}. Best is trial 108 with value: 0.22594023894922968.
2026-06-01 23:03:54 | INFO | Trial 191 | outer=8 | alpha=4.443e+04 n_pcs=4500 (pc_topk) weight={'name': 'pc_logistic', 'floor': 1e-06, 'clip_max': 2.5, 'prob_clip': 0.04978119685307903, 'n_components': 100, 'logistic_c': 5.029160106748324e-05, 'pca_fit': 'combined', 'solver': 'lbfgs', 'max_iter': 2000, 'fit_intercept': True, 'standardize_with_source': True, 'rho': 0.85}
