[I 2026-05-31 23:57:56,293] Trial 86 pruned. 
2026-05-31 23:57:56 | INFO | src.nested_cv_avggrm_weighted_unified | Trial 87 | outer=4 | alpha=2.571e+04 n_pcs=4500 (pc_topk) weight_search=on
2026-05-31 23:57:56 | INFO | src.nested_cv_avggrm_weighted_unified | Trial 87 | outer=4 | weight={'name': 'linear', 'floor': 1e-06, 'clip_max': None, 'min_weight': 0.47892828708293395, 'max_weight': 2.740869794161955}
2026-05-31 23:58:00 | INFO | src.nested_cv_avggrm_weighted_unified | Trial 87 | outer=4 | pruned after 6/10 inner folds (mean r=0.1925)
[I 2026-05-31 23:58:00,480] Trial 87 pruned. 
2026-05-31 23:58:00 | INFO | src.nested_cv_avggrm_weighted_unified | Trial 88 | outer=4 | alpha=3.738e+04 n_pcs=5000 (pc_topk) weight_search=on
2026-05-31 23:58:00 | INFO | src.nested_cv_avggrm_weighted_unified | Trial 88 | outer=4 | weight={'name': 'linear', 'floor': 1e-06, 'clip_max': None, 'min_weight': 0.37604559092366896, 'max_weight': 3.860305712318668}
2026-05-31 23:58:05 | INFO | src.nested_cv_avggrm_weighted_unified | Trial 88 | outer=4 | pruned after 6/10 inner folds (mean r=0.1947)
[I 2026-05-31 23:58:05,406] Trial 88 pruned. 
2026-05-31 23:58:05 | INFO | src.nested_cv_avggrm_weighted_unified | Trial 89 | outer=4 | alpha=7.959e+04 n_pcs=4500 (pc_topk) weight_search=on
2026-05-31 23:58:05 | INFO | src.nested_cv_avggrm_weighted_unified | Trial 89 | outer=4 | weight={'name': 'linear', 'floor': 1e-06, 'clip_max': 3.0, 'min_weight': 0.41597788015808723, 'max_weight': 3.458433997630362}
2026-05-31 23:58:09 | INFO | src.nested_cv_avggrm_weighted_unified | Trial 89 | outer=4 | pruned after 6/10 inner folds (mean r=0.2038)
[I 2026-05-31 23:58:09,622] Trial 89 pruned. 
2026-05-31 23:58:09 | INFO | src.nested_cv_avggrm_weighted_unified | Trial 90 | outer=4 | alpha=5.899e+04 n_pcs=4000 (pc_topk) weight_search=on
2026-05-31 23:58:09 | INFO | src.nested_cv_avggrm_weighted_unified | Trial 90 | outer=4 | weight={'name': 'linear', 'floor': 1e-06, 'clip_max': None, 'min_weight': 0.24151153419587454, 'max_weight': 3.174583987125519}
2026-05-31 23:58:13 | INFO | src.nested_cv_avggrm_weighted_unified | Trial 90 | outer=4 | pruned after 6/10 inner folds (mean r=0.1998)
[I 2026-05-31 23:58:13,086] Trial 90 pruned. 
2026-05-31 23:58:13 | INFO | src.nested_cv_avggrm_weighted_unified | Trial 91 | outer=4 | alpha=1.199e+05 n_pcs=4500 (pc_topk) weight_search=on
2026-05-31 23:58:13 | INFO | src.nested_cv_avggrm_weighted_unified | Trial 91 | outer=4 | weight={'name': 'linear', 'floor': 1e-06, 'clip_max': 10.0, 'min_weight': 0.7187184713543141, 'max_weight': 3.768451964706628}
[I 2026-05-31 23:58:20,062] Trial 91 finished with value: 0.19623182593752234 and parameters: {'alpha': 119937.33394225175, 'n_pcs': 4500, 'weight_scheme': 'linear', 'weight_clip_max': 10.0, 'weight_linear_min_weight': 0.7187184713543141, 'weight_linear_max_weight': 3.768451964706628}. Best is trial 41 with value: 0.19810774778548906.
2026-05-31 23:58:20 | INFO | src.nested_cv_avggrm_weighted_unified | Trial 92 | outer=4 | alpha=1.572e+05 n_pcs=4500 (pc_topk) weight_search=on
2026-05-31 23:58:20 | INFO | src.nested_cv_avggrm_weighted_unified | Trial 92 | outer=4 | weight={'name': 'linear', 'floor': 1e-06, 'clip_max': 10.0, 'min_weight': 0.7173158772533073, 'max_weight': 3.709931969684989}
[I 2026-05-31 23:58:27,055] Trial 92 finished with value: 0.1945910965733832 and parameters: {'alpha': 157175.23028423337, 'n_pcs': 4500, 'weight_scheme': 'linear', 'weight_clip_max': 10.0, 'weight_linear_min_weight': 0.7173158772533073, 'weight_linear_max_weight': 3.709931969684989}. Best is trial 41 with value: 0.19810774778548906.
2026-05-31 23:58:27 | INFO | src.nested_cv_avggrm_weighted_unified | Trial 93 | outer=4 | alpha=1.318e+05 n_pcs=5000 (pc_topk) weight_search=on
2026-05-31 23:58:27 | INFO | src.nested_cv_avggrm_weighted_unified | Trial 93 | outer=4 | weight={'name': 'linear', 'floor': 1e-06, 'clip_max': 10.0, 'min_weight': 0.7687849114081389, 'max_weight': 4.079753531705634}
[I 2026-05-31 23:58:35,300] Trial 93 finished with value: 0.19452322074749956 and parameters: {'alpha': 131838.43520516195, 'n_pcs': 5000, 'weight_scheme': 'linear', 'weight_clip_max': 10.0, 'weight_linear_min_weight': 0.7687849114081389, 'weight_linear_max_weight': 4.079753531705634}. Best is trial 41 with value: 0.19810774778548906.
2026-05-31 23:58:35 | INFO | src.nested_cv_avggrm_weighted_unified | Trial 94 | outer=4 | alpha=8.704e+04 n_pcs=4500 (pc_topk) weight_search=on
2026-05-31 23:58:35 | INFO | src.nested_cv_avggrm_weighted_unified | Trial 94 | outer=4 | weight={'name': 'linear', 'floor': 1e-06, 'clip_max': 10.0, 'min_weight': 0.6211578623347396, 'max_weight': 3.6201053086529495}
[I 2026-05-31 23:58:42,311] Trial 94 finished with value: 0.1976594578877763 and parameters: {'alpha': 87035.95513944257, 'n_pcs': 4500, 'weight_scheme': 'linear', 'weight_clip_max': 10.0, 'weight_linear_min_weight': 0.6211578623347396, 'weight_linear_max_weight': 3.6201053086529495}. Best is trial 41 with value: 0.19810774778548906.
2026-05-31 23:58:42 | INFO | src.nested_cv_avggrm_weighted_unified | Trial 95 | outer=4 | alpha=8.913e+04 n_pcs=4000 (pc_topk) weight_search=on
2026-05-31 23:58:42 | INFO | src.nested_cv_avggrm_weighted_unified | Trial 95 | outer=4 | weight={'name': 'linear', 'floor': 1e-06, 'clip_max': 10.0, 'min_weight': 0.6753085066720235, 'max_weight': 3.3805623808929446}
2026-05-31 23:58:45 | INFO | src.nested_cv_avggrm_weighted_unified | Trial 95 | outer=4 | pruned after 6/10 inner folds (mean r=0.2043)
[I 2026-05-31 23:58:45,775] Trial 95 pruned. 
2026-05-31 23:58:45 | INFO | src.nested_cv_avggrm_weighted_unified | Trial 96 | outer=4 | alpha=6.599e+04 n_pcs=4500 (pc_topk) weight_search=on
2026-05-31 23:58:45 | INFO | src.nested_cv_avggrm_weighted_unified | Trial 96 | outer=4 | weight={'name': 'linear', 'floor': 1e-06, 'clip_max': None, 'min_weight': 0.6099531199670999, 'max_weight': 3.6131156763551955}
2026-05-31 23:58:49 | INFO | src.nested_cv_avggrm_weighted_unified | Trial 96 | outer=4 | pruned after 6/10 inner folds (mean r=0.2034)
[I 2026-05-31 23:58:49,987] Trial 96 pruned. 
2026-05-31 23:58:49 | INFO | src.nested_cv_avggrm_weighted_unified | Trial 97 | outer=4 | alpha=4.546e+04 n_pcs=3500 (pc_topk) weight_search=on
2026-05-31 23:58:49 | INFO | src.nested_cv_avggrm_weighted_unified | Trial 97 | outer=4 | weight={'name': 'exponential', 'floor': 1e-06, 'clip_max': 5.0, 'beta': 3.213390506698156}
2026-05-31 23:58:52 | INFO | src.nested_cv_avggrm_weighted_unified | Trial 97 | outer=4 | pruned after 6/10 inner folds (mean r=0.1922)
[I 2026-05-31 23:58:52,943] Trial 97 pruned. 
2026-05-31 23:58:52 | INFO | src.nested_cv_avggrm_weighted_unified | Trial 98 | outer=4 | alpha=5.058e+04 n_pcs=5000 (pc_topk) weight_search=on
2026-05-31 23:58:52 | INFO | src.nested_cv_avggrm_weighted_unified | Trial 98 | outer=4 | weight={'name': 'linear', 'floor': 1e-06, 'clip_max': None, 'min_weight': 0.5052580034047519, 'max_weight': 1.6193439673712082}
2026-05-31 23:58:57 | INFO | src.nested_cv_avggrm_weighted_unified | Trial 98 | outer=4 | pruned after 6/10 inner folds (mean r=0.1994)
[I 2026-05-31 23:58:57,883] Trial 98 pruned. 
2026-05-31 23:58:57 | INFO | src.nested_cv_avggrm_weighted_unified | Trial 99 | outer=4 | alpha=2.166e+05 n_pcs=4500 (pc_topk) weight_search=on
2026-05-31 23:58:57 | INFO | src.nested_cv_avggrm_weighted_unified | Trial 99 | outer=4 | weight={'name': 'uniform', 'floor': 1e-06, 'clip_max': None}
2026-05-31 23:59:01 | INFO | src.nested_cv_avggrm_weighted_unified | Trial 99 | outer=4 | pruned after 6/10 inner folds (mean r=0.1903)
[I 2026-05-31 23:59:01,533] Trial 99 pruned. 
2026-05-31 23:59:01 | INFO | src.nested_cv_avggrm_weighted_unified | Trial 100 | outer=4 | alpha=2.924e+04 n_pcs=4000 (pc_topk) weight_search=on
2026-05-31 23:59:01 | INFO | src.nested_cv_avggrm_weighted_unified | Trial 100 | outer=4 | weight={'name': 'linear', 'floor': 1e-06, 'clip_max': 20.0, 'min_weight': 0.4353454739518741, 'max_weight': 3.2303611932998377}
2026-05-31 23:59:05 | INFO | src.nested_cv_avggrm_weighted_unified | Trial 100 | outer=4 | pruned after 6/10 inner folds (mean r=0.1895)
[I 2026-05-31 23:59:05,010] Trial 100 pruned. 
2026-05-31 23:59:05 | INFO | src.nested_cv_avggrm_weighted_unified | Trial 101 | outer=4 | alpha=8.914e+04 n_pcs=4500 (pc_topk) weight_search=on
2026-05-31 23:59:05 | INFO | src.nested_cv_avggrm_weighted_unified | Trial 101 | outer=4 | weight={'name': 'linear', 'floor': 1e-06, 'clip_max': 10.0, 'min_weight': 0.7713276394973164, 'max_weight': 3.8134796119131362}
[I 2026-05-31 23:59:11,985] Trial 101 finished with value: 0.19735103438199605 and parameters: {'alpha': 89136.30672931482, 'n_pcs': 4500, 'weight_scheme': 'linear', 'weight_clip_max': 10.0, 'weight_linear_min_weight': 0.7713276394973164, 'weight_linear_max_weight': 3.8134796119131362}. Best is trial 41 with value: 0.19810774778548906.
2026-05-31 23:59:11 | INFO | src.nested_cv_avggrm_weighted_unified | Trial 102 | outer=4 | alpha=8.934e+04 n_pcs=4500 (pc_topk) weight_search=on
2026-05-31 23:59:11 | INFO | src.nested_cv_avggrm_weighted_unified | Trial 102 | outer=4 | weight={'name': 'linear', 'floor': 1e-06, 'clip_max': 10.0, 'min_weight': 0.5312388853500095, 'max_weight': 3.8720863025906573}
[I 2026-05-31 23:59:18,968] Trial 102 finished with value: 0.19781507819520333 and parameters: {'alpha': 89336.50932671945, 'n_pcs': 4500, 'weight_scheme': 'linear', 'weight_clip_max': 10.0, 'weight_linear_min_weight': 0.5312388853500095, 'weight_linear_max_weight': 3.8720863025906573}. Best is trial 41 with value: 0.19810774778548906.
2026-05-31 23:59:18 | INFO | src.nested_cv_avggrm_weighted_unified | Trial 103 | outer=4 | alpha=7.996e+04 n_pcs=4500 (pc_topk) weight_search=on
2026-05-31 23:59:18 | INFO | src.nested_cv_avggrm_weighted_unified | Trial 103 | outer=4 | weight={'name': 'linear', 'floor': 1e-06, 'clip_max': 10.0, 'min_weight': 0.7779034021547802, 'max_weight': 3.868691857668949}
2026-05-31 23:59:23 | INFO | src.nested_cv_avggrm_weighted_unified | Trial 103 | outer=4 | pruned after 6/10 inner folds (mean r=0.2046)
[I 2026-05-31 23:59:23,175] Trial 103 pruned. 
2026-05-31 23:59:23 | INFO | src.nested_cv_avggrm_weighted_unified | Trial 104 | outer=4 | alpha=1.036e+05 n_pcs=4500 (pc_topk) weight_search=on
2026-05-31 23:59:23 | INFO | src.nested_cv_avggrm_weighted_unified | Trial 104 | outer=4 | weight={'name': 'linear', 'floor': 1e-06, 'clip_max': 10.0, 'min_weight': 0.551621533474667, 'max_weight': 3.5328561099744733}
[I 2026-05-31 23:59:30,173] Trial 104 finished with value: 0.19725193444122263 and parameters: {'alpha': 103570.58740148117, 'n_pcs': 4500, 'weight_scheme': 'linear', 'weight_clip_max': 10.0, 'weight_linear_min_weight': 0.551621533474667, 'weight_linear_max_weight': 3.5328561099744733}. Best is trial 41 with value: 0.19810774778548906.
2026-05-31 23:59:30 | INFO | src.nested_cv_avggrm_weighted_unified | Trial 105 | outer=4 | alpha=6.208e+04 n_pcs=4500 (pc_topk) weight_search=on
2026-05-31 23:59:30 | INFO | src.nested_cv_avggrm_weighted_unified | Trial 105 | outer=4 | weight={'name': 'linear', 'floor': 1e-06, 'clip_max': 10.0, 'min_weight': 0.542661228574767, 'max_weight': 3.510812654468847}
2026-05-31 23:59:34 | INFO | src.nested_cv_avggrm_weighted_unified | Trial 105 | outer=4 | pruned after 6/10 inner folds (mean r=0.2028)
[I 2026-05-31 23:59:34,390] Trial 105 pruned. 
2026-05-31 23:59:34 | INFO | src.nested_cv_avggrm_weighted_unified | Trial 106 | outer=4 | alpha=3.850e+04 n_pcs=4500 (pc_topk) weight_search=on
2026-05-31 23:59:34 | INFO | src.nested_cv_avggrm_weighted_unified | Trial 106 | outer=4 | weight={'name': 'linear', 'floor': 1e-06, 'clip_max': 10.0, 'min_weight': 0.5804660920350659, 'max_weight': 1.072687372714785}
2026-05-31 23:59:38 | INFO | src.nested_cv_avggrm_weighted_unified | Trial 106 | outer=4 | pruned after 6/10 inner folds (mean r=0.1982)
[I 2026-05-31 23:59:38,593] Trial 106 pruned. 
2026-05-31 23:59:38 | INFO | src.nested_cv_avggrm_weighted_unified | Trial 107 | outer=4 | alpha=1.569e+05 n_pcs=4500 (pc_topk) weight_search=on
2026-05-31 23:59:38 | INFO | src.nested_cv_avggrm_weighted_unified | Trial 107 | outer=4 | weight={'name': 'linear', 'floor': 1e-06, 'clip_max': 10.0, 'min_weight': 0.8394316344590229, 'max_weight': 3.9676764514487615}
[I 2026-05-31 23:59:45,569] Trial 107 finished with value: 0.1942988872417138 and parameters: {'alpha': 156913.07405133708, 'n_pcs': 4500, 'weight_scheme': 'linear', 'weight_clip_max': 10.0, 'weight_linear_min_weight': 0.8394316344590229, 'weight_linear_max_weight': 3.9676764514487615}. Best is trial 41 with value: 0.19810774778548906.
2026-05-31 23:59:45 | INFO | src.nested_cv_avggrm_weighted_unified | Trial 108 | outer=4 | alpha=1.092e+05 n_pcs=4500 (pc_topk) weight_search=on
2026-05-31 23:59:45 | INFO | src.nested_cv_avggrm_weighted_unified | Trial 108 | outer=4 | weight={'name': 'linear', 'floor': 1e-06, 'clip_max': 10.0, 'min_weight': 0.6506477409200141, 'max_weight': 4.098250224199352}
[I 2026-05-31 23:59:52,564] Trial 108 finished with value: 0.1970257301232279 and parameters: {'alpha': 109222.26791081433, 'n_pcs': 4500, 'weight_scheme': 'linear', 'weight_clip_max': 10.0, 'weight_linear_min_weight': 0.6506477409200141, 'weight_linear_max_weight': 4.098250224199352}. Best is trial 41 with value: 0.19810774778548906.
2026-05-31 23:59:52 | INFO | src.nested_cv_avggrm_weighted_unified | Trial 109 | outer=4 | alpha=1.037e+05 n_pcs=4500 (pc_topk) weight_search=on
2026-05-31 23:59:52 | INFO | src.nested_cv_avggrm_weighted_unified | Trial 109 | outer=4 | weight={'name': 'linear', 'floor': 1e-06, 'clip_max': 10.0, 'min_weight': 0.6091774004090036, 'max_weight': 4.2454433735202395}
[I 2026-05-31 23:59:59,567] Trial 109 finished with value: 0.19736053916211 and parameters: {'alpha': 103669.34014346237, 'n_pcs': 4500, 'weight_scheme': 'linear', 'weight_clip_max': 10.0, 'weight_linear_min_weight': 0.6091774004090036, 'weight_linear_max_weight': 4.2454433735202395}. Best is trial 41 with value: 0.19810774778548906.
2026-05-31 23:59:59 | INFO | src.nested_cv_avggrm_weighted_unified | Trial 110 | outer=4 | alpha=1.041e+05 n_pcs=4500 (pc_topk) weight_search=on
2026-05-31 23:59:59 | INFO | src.nested_cv_avggrm_weighted_unified | Trial 110 | outer=4 | weight={'name': 'linear', 'floor': 1e-06, 'clip_max': 10.0, 'min_weight': 0.631954857073709, 'max_weight': 4.363715764237658}
[I 2026-06-01 00:00:06,571] Trial 110 finished with value: 0.1973342381355911 and parameters: {'alpha': 104126.2318541307, 'n_pcs': 4500, 'weight_scheme': 'linear', 'weight_clip_max': 10.0, 'weight_linear_min_weight': 0.631954857073709, 'weight_linear_max_weight': 4.363715764237658}. Best is trial 41 with value: 0.19810774778548906.
2026-06-01 00:00:06 | INFO | src.nested_cv_avggrm_weighted_unified | Trial 111 | outer=4 | alpha=1.065e+05 n_pcs=4500 (pc_topk) weight_search=on
2026-06-01 00:00:06 | INFO | src.nested_cv_avggrm_weighted_unified | Trial 111 | outer=4 | weight={'name': 'linear', 'floor': 1e-06, 'clip_max': 10.0, 'min_weight': 0.6328040610171012, 'max_weight': 4.427017451363616}
[I 2026-06-01 00:00:13,582] Trial 111 finished with value: 0.19727227332539826 and parameters: {'alpha': 106503.50042863011, 'n_pcs': 4500, 'weight_scheme': 'linear', 'weight_clip_max': 10.0, 'weight_linear_min_weight': 0.6328040610171012, 'weight_linear_max_weight': 4.427017451363616}. Best is trial 41 with value: 0.19810774778548906.
2026-06-01 00:00:13 | INFO | src.nested_cv_avggrm_weighted_unified | Trial 112 | outer=4 | alpha=1.340e+05 n_pcs=4500 (pc_topk) weight_search=on
2026-06-01 00:00:13 | INFO | src.nested_cv_avggrm_weighted_unified | Trial 112 | outer=4 | weight={'name': 'linear', 'floor': 1e-06, 'clip_max': 10.0, 'min_weight': 0.6860626624239844, 'max_weight': 4.507209650733476}
[I 2026-06-01 00:00:20,549] Trial 112 finished with value: 0.19616019205040844 and parameters: {'alpha': 134038.25636107527, 'n_pcs': 4500, 'weight_scheme': 'linear', 'weight_clip_max': 10.0, 'weight_linear_min_weight': 0.6860626624239844, 'weight_linear_max_weight': 4.507209650733476}. Best is trial 41 with value: 0.19810774778548906.
2026-06-01 00:00:20 | INFO | src.nested_cv_avggrm_weighted_unified | Trial 113 | outer=4 | alpha=1.986e+05 n_pcs=4500 (pc_topk) weight_search=on
2026-06-01 00:00:20 | INFO | src.nested_cv_avggrm_weighted_unified | Trial 113 | outer=4 | weight={'name': 'linear', 'floor': 1e-06, 'clip_max': 10.0, 'min_weight': 0.6275578272452332, 'max_weight': 4.313479005065963}
[I 2026-06-01 00:00:27,522] Trial 113 finished with value: 0.19384997392787948 and parameters: {'alpha': 198643.60841735537, 'n_pcs': 4500, 'weight_scheme': 'linear', 'weight_clip_max': 10.0, 'weight_linear_min_weight': 0.6275578272452332, 'weight_linear_max_weight': 4.313479005065963}. Best is trial 41 with value: 0.19810774778548906.
2026-06-01 00:00:27 | INFO | src.nested_cv_avggrm_weighted_unified | Trial 114 | outer=4 | alpha=7.651e+04 n_pcs=4500 (pc_topk) weight_search=on
2026-06-01 00:00:27 | INFO | src.nested_cv_avggrm_weighted_unified | Trial 114 | outer=4 | weight={'name': 'linear', 'floor': 1e-06, 'clip_max': 10.0, 'min_weight': 0.5733462360107628, 'max_weight': 4.8171400437298395}
2026-06-01 00:00:31 | INFO | src.nested_cv_avggrm_weighted_unified | Trial 114 | outer=4 | pruned after 6/10 inner folds (mean r=0.2043)
[I 2026-06-01 00:00:31,736] Trial 114 pruned. 
2026-06-01 00:00:31 | INFO | src.nested_cv_avggrm_weighted_unified | Trial 115 | outer=4 | alpha=1.021e+05 n_pcs=4500 (pc_topk) weight_search=on
2026-06-01 00:00:31 | INFO | src.nested_cv_avggrm_weighted_unified | Trial 115 | outer=4 | weight={'name': 'linear', 'floor': 1e-06, 'clip_max': 10.0, 'min_weight': 0.6133335197922337, 'max_weight': 4.401683912467068}
[I 2026-06-01 00:00:38,731] Trial 115 finished with value: 0.1974452508376689 and parameters: {'alpha': 102082.33681464309, 'n_pcs': 4500, 'weight_scheme': 'linear', 'weight_clip_max': 10.0, 'weight_linear_min_weight': 0.6133335197922337, 'weight_linear_max_weight': 4.401683912467068}. Best is trial 41 with value: 0.19810774778548906.
2026-06-01 00:00:38 | INFO | src.nested_cv_avggrm_weighted_unified | Trial 116 | outer=4 | alpha=5.752e+04 n_pcs=5000 (pc_topk) weight_search=on
2026-06-01 00:00:38 | INFO | src.nested_cv_avggrm_weighted_unified | Trial 116 | outer=4 | weight={'name': 'linear', 'floor': 1e-06, 'clip_max': 10.0, 'min_weight': 0.6114236369613841, 'max_weight': 4.390881746027858}
2026-06-01 00:00:43 | INFO | src.nested_cv_avggrm_weighted_unified | Trial 116 | outer=4 | pruned after 6/10 inner folds (mean r=0.2005)
[I 2026-06-01 00:00:43,670] Trial 116 pruned. 
2026-06-01 00:00:43 | INFO | src.nested_cv_avggrm_weighted_unified | Trial 117 | outer=4 | alpha=2.802e+05 n_pcs=4500 (pc_topk) weight_search=on
2026-06-01 00:00:43 | INFO | src.nested_cv_avggrm_weighted_unified | Trial 117 | outer=4 | weight={'name': 'linear', 'floor': 1e-06, 'clip_max': 10.0, 'min_weight': 0.6955092600972272, 'max_weight': 4.665332104644145}
[I 2026-06-01 00:00:50,626] Trial 117 finished with value: 0.1911806234134212 and parameters: {'alpha': 280169.80340218876, 'n_pcs': 4500, 'weight_scheme': 'linear', 'weight_clip_max': 10.0, 'weight_linear_min_weight': 0.6955092600972272, 'weight_linear_max_weight': 4.665332104644145}. Best is trial 41 with value: 0.19810774778548906.
2026-06-01 00:00:50 | INFO | src.nested_cv_avggrm_weighted_unified | Trial 118 | outer=4 | alpha=4.713e+03 n_pcs=4000 (pc_topk) weight_search=on
2026-06-01 00:00:50 | INFO | src.nested_cv_avggrm_weighted_unified | Trial 118 | outer=4 | weight={'name': 'exponential', 'floor': 1e-06, 'clip_max': 10.0, 'beta': 6.86097509572839}
2026-06-01 00:00:53 | INFO | src.nested_cv_avggrm_weighted_unified | Trial 118 | outer=4 | pruned after 5/10 inner folds (mean r=0.1238)
[I 2026-06-01 00:00:53,485] Trial 118 pruned. 
2026-06-01 00:00:53 | INFO | src.nested_cv_avggrm_weighted_unified | Trial 119 | outer=4 | alpha=8.733e+04 n_pcs=4500 (pc_topk) weight_search=on
2026-06-01 00:00:53 | INFO | src.nested_cv_avggrm_weighted_unified | Trial 119 | outer=4 | weight={'name': 'linear', 'floor': 1e-06, 'clip_max': 10.0, 'min_weight': 0.6365960092059013, 'max_weight': 4.220120294064488}
[I 2026-06-01 00:01:00,479] Trial 119 finished with value: 0.19778633352570604 and parameters: {'alpha': 87333.06730920754, 'n_pcs': 4500, 'weight_scheme': 'linear', 'weight_clip_max': 10.0, 'weight_linear_min_weight': 0.6365960092059013, 'weight_linear_max_weight': 4.220120294064488}. Best is trial 41 with value: 0.19810774778548906.
2026-06-01 00:01:00 | INFO | src.nested_cv_avggrm_weighted_unified | Trial 120 | outer=4 | alpha=6.809e+04 n_pcs=2000 (pc_topk) weight_search=on
2026-06-01 00:01:00 | INFO | src.nested_cv_avggrm_weighted_unified | Trial 120 | outer=4 | weight={'name': 'uniform', 'floor': 1e-06, 'clip_max': 10.0}
2026-06-01 00:01:01 | INFO | src.nested_cv_avggrm_weighted_unified | Trial 120 | outer=4 | pruned after 6/10 inner folds (mean r=0.1827)
[I 2026-06-01 00:01:01,720] Trial 120 pruned. 
2026-06-01 00:01:01 | INFO | src.nested_cv_avggrm_weighted_unified | Trial 121 | outer=4 | alpha=8.555e+04 n_pcs=4500 (pc_topk) weight_search=on
2026-06-01 00:01:01 | INFO | src.nested_cv_avggrm_weighted_unified | Trial 121 | outer=4 | weight={'name': 'linear', 'floor': 1e-06, 'clip_max': 10.0, 'min_weight': 0.6228895455177852, 'max_weight': 4.21182694446208}
2026-06-01 00:01:05 | INFO | src.nested_cv_avggrm_weighted_unified | Trial 121 | outer=4 | pruned after 6/10 inner folds (mean r=0.2051)
[I 2026-06-01 00:01:05,915] Trial 121 pruned. 
2026-06-01 00:01:05 | INFO | src.nested_cv_avggrm_weighted_unified | Trial 122 | outer=4 | alpha=1.243e+05 n_pcs=4500 (pc_topk) weight_search=on
2026-06-01 00:01:05 | INFO | src.nested_cv_avggrm_weighted_unified | Trial 122 | outer=4 | weight={'name': 'linear', 'floor': 1e-06, 'clip_max': 10.0, 'min_weight': 0.6575135525145652, 'max_weight': 4.462509242826226}
