[I 2026-06-01 00:35:18,508] Trial 214 finished with value: 0.2598600247358653 and parameters: {'alpha': 112741.33409550274, 'n_pcs': 4500, 'weight_scheme': 'exponential', 'weight_clip_max': 5.0, 'weight_exponential_beta': 8.082904050046656}. Best is trial 140 with value: 0.25996359913458195.
2026-06-01 00:35:18 | INFO | src.nested_cv_avggrm_weighted_unified | Trial 215 | outer=5 | alpha=1.112e+05 n_pcs=4500 (pc_topk) weight_search=on
2026-06-01 00:35:18 | INFO | src.nested_cv_avggrm_weighted_unified | Trial 215 | outer=5 | weight={'name': 'exponential', 'floor': 1e-06, 'clip_max': 5.0, 'beta': 8.030636823408916}
[I 2026-06-01 00:35:25,246] Trial 215 finished with value: 0.2598620407890955 and parameters: {'alpha': 111182.54137791581, 'n_pcs': 4500, 'weight_scheme': 'exponential', 'weight_clip_max': 5.0, 'weight_exponential_beta': 8.030636823408916}. Best is trial 140 with value: 0.25996359913458195.
2026-06-01 00:35:25 | INFO | src.nested_cv_avggrm_weighted_unified | Trial 216 | outer=5 | alpha=1.444e+05 n_pcs=4500 (pc_topk) weight_search=on
2026-06-01 00:35:25 | INFO | src.nested_cv_avggrm_weighted_unified | Trial 216 | outer=5 | weight={'name': 'exponential', 'floor': 1e-06, 'clip_max': 5.0, 'beta': 8.232112662504127}
[I 2026-06-01 00:35:31,889] Trial 216 finished with value: 0.25952310588069066 and parameters: {'alpha': 144351.542554796, 'n_pcs': 4500, 'weight_scheme': 'exponential', 'weight_clip_max': 5.0, 'weight_exponential_beta': 8.232112662504127}. Best is trial 140 with value: 0.25996359913458195.
2026-06-01 00:35:31 | INFO | src.nested_cv_avggrm_weighted_unified | Trial 217 | outer=5 | alpha=1.168e+05 n_pcs=4500 (pc_topk) weight_search=on
2026-06-01 00:35:31 | INFO | src.nested_cv_avggrm_weighted_unified | Trial 217 | outer=5 | weight={'name': 'exponential', 'floor': 1e-06, 'clip_max': 5.0, 'beta': 8.012778409668453}
[I 2026-06-01 00:35:38,540] Trial 217 finished with value: 0.25981674452813397 and parameters: {'alpha': 116756.2734478581, 'n_pcs': 4500, 'weight_scheme': 'exponential', 'weight_clip_max': 5.0, 'weight_exponential_beta': 8.012778409668453}. Best is trial 140 with value: 0.25996359913458195.
2026-06-01 00:35:38 | INFO | src.nested_cv_avggrm_weighted_unified | Trial 218 | outer=5 | alpha=1.069e+05 n_pcs=4500 (pc_topk) weight_search=on
2026-06-01 00:35:38 | INFO | src.nested_cv_avggrm_weighted_unified | Trial 218 | outer=5 | weight={'name': 'exponential', 'floor': 1e-06, 'clip_max': 5.0, 'beta': 8.37144737273447}
[I 2026-06-01 00:35:45,183] Trial 218 finished with value: 0.25990117326819207 and parameters: {'alpha': 106875.06997858612, 'n_pcs': 4500, 'weight_scheme': 'exponential', 'weight_clip_max': 5.0, 'weight_exponential_beta': 8.37144737273447}. Best is trial 140 with value: 0.25996359913458195.
2026-06-01 00:35:45 | INFO | src.nested_cv_avggrm_weighted_unified | Trial 219 | outer=5 | alpha=1.756e+05 n_pcs=4500 (pc_topk) weight_search=on
2026-06-01 00:35:45 | INFO | src.nested_cv_avggrm_weighted_unified | Trial 219 | outer=5 | weight={'name': 'exponential', 'floor': 1e-06, 'clip_max': 5.0, 'beta': 8.35062854143859}
[I 2026-06-01 00:35:51,823] Trial 219 finished with value: 0.2590195397700213 and parameters: {'alpha': 175570.38040980743, 'n_pcs': 4500, 'weight_scheme': 'exponential', 'weight_clip_max': 5.0, 'weight_exponential_beta': 8.35062854143859}. Best is trial 140 with value: 0.25996359913458195.
2026-06-01 00:35:51 | INFO | src.nested_cv_avggrm_weighted_unified | Trial 220 | outer=5 | alpha=7.640e+04 n_pcs=5000 (pc_topk) weight_search=on
2026-06-01 00:35:51 | INFO | src.nested_cv_avggrm_weighted_unified | Trial 220 | outer=5 | weight={'name': 'uniform', 'floor': 1e-06, 'clip_max': 5.0}
2026-06-01 00:35:55 | INFO | src.nested_cv_avggrm_weighted_unified | Trial 220 | outer=5 | pruned after 5/10 inner folds (mean r=0.2386)
[I 2026-06-01 00:35:55,311] Trial 220 pruned. 
2026-06-01 00:35:55 | INFO | src.nested_cv_avggrm_weighted_unified | Trial 221 | outer=5 | alpha=1.076e+05 n_pcs=4500 (pc_topk) weight_search=on
2026-06-01 00:35:55 | INFO | src.nested_cv_avggrm_weighted_unified | Trial 221 | outer=5 | weight={'name': 'exponential', 'floor': 1e-06, 'clip_max': 5.0, 'beta': 8.77980823177993}
[I 2026-06-01 00:36:01,941] Trial 221 finished with value: 0.2598462473607224 and parameters: {'alpha': 107591.4115765148, 'n_pcs': 4500, 'weight_scheme': 'exponential', 'weight_clip_max': 5.0, 'weight_exponential_beta': 8.77980823177993}. Best is trial 140 with value: 0.25996359913458195.
2026-06-01 00:36:01 | INFO | src.nested_cv_avggrm_weighted_unified | Trial 222 | outer=5 | alpha=1.318e+05 n_pcs=4500 (pc_topk) weight_search=on
2026-06-01 00:36:01 | INFO | src.nested_cv_avggrm_weighted_unified | Trial 222 | outer=5 | weight={'name': 'exponential', 'floor': 1e-06, 'clip_max': 5.0, 'beta': 8.379613066590126}
[I 2026-06-01 00:36:08,588] Trial 222 finished with value: 0.2597185866931454 and parameters: {'alpha': 131789.71855873635, 'n_pcs': 4500, 'weight_scheme': 'exponential', 'weight_clip_max': 5.0, 'weight_exponential_beta': 8.379613066590126}. Best is trial 140 with value: 0.25996359913458195.
2026-06-01 00:36:08 | INFO | src.nested_cv_avggrm_weighted_unified | Trial 223 | outer=5 | alpha=1.046e+05 n_pcs=4500 (pc_topk) weight_search=on
2026-06-01 00:36:08 | INFO | src.nested_cv_avggrm_weighted_unified | Trial 223 | outer=5 | weight={'name': 'exponential', 'floor': 1e-06, 'clip_max': 5.0, 'beta': 8.055878628265404}
[I 2026-06-01 00:36:15,206] Trial 223 finished with value: 0.25989469232709866 and parameters: {'alpha': 104602.1137181242, 'n_pcs': 4500, 'weight_scheme': 'exponential', 'weight_clip_max': 5.0, 'weight_exponential_beta': 8.055878628265404}. Best is trial 140 with value: 0.25996359913458195.
2026-06-01 00:36:15 | INFO | src.nested_cv_avggrm_weighted_unified | Trial 224 | outer=5 | alpha=1.085e+05 n_pcs=4500 (pc_topk) weight_search=on
2026-06-01 00:36:15 | INFO | src.nested_cv_avggrm_weighted_unified | Trial 224 | outer=5 | weight={'name': 'exponential', 'floor': 1e-06, 'clip_max': 5.0, 'beta': 8.001098754396715}
[I 2026-06-01 00:36:21,909] Trial 224 finished with value: 0.2598724675510301 and parameters: {'alpha': 108544.56095421223, 'n_pcs': 4500, 'weight_scheme': 'exponential', 'weight_clip_max': 5.0, 'weight_exponential_beta': 8.001098754396715}. Best is trial 140 with value: 0.25996359913458195.
2026-06-01 00:36:21 | INFO | src.nested_cv_avggrm_weighted_unified | Trial 225 | outer=5 | alpha=1.534e+05 n_pcs=4500 (pc_topk) weight_search=on
2026-06-01 00:36:21 | INFO | src.nested_cv_avggrm_weighted_unified | Trial 225 | outer=5 | weight={'name': 'exponential', 'floor': 1e-06, 'clip_max': 5.0, 'beta': 7.977709012751601}
[I 2026-06-01 00:36:28,542] Trial 225 finished with value: 0.25929192337668877 and parameters: {'alpha': 153394.70402464538, 'n_pcs': 4500, 'weight_scheme': 'exponential', 'weight_clip_max': 5.0, 'weight_exponential_beta': 7.977709012751601}. Best is trial 140 with value: 0.25996359913458195.
2026-06-01 00:36:28 | INFO | src.nested_cv_avggrm_weighted_unified | Trial 226 | outer=5 | alpha=8.347e+04 n_pcs=4500 (pc_topk) weight_search=on
2026-06-01 00:36:28 | INFO | src.nested_cv_avggrm_weighted_unified | Trial 226 | outer=5 | weight={'name': 'exponential', 'floor': 1e-06, 'clip_max': 5.0, 'beta': 7.937163693141927}
2026-06-01 00:36:33 | INFO | src.nested_cv_avggrm_weighted_unified | Trial 226 | outer=5 | pruned after 7/10 inner folds (mean r=0.2940)
[I 2026-06-01 00:36:33,196] Trial 226 pruned. 
2026-06-01 00:36:33 | INFO | src.nested_cv_avggrm_weighted_unified | Trial 227 | outer=5 | alpha=1.049e+05 n_pcs=2500 (pc_topk) weight_search=on
2026-06-01 00:36:33 | INFO | src.nested_cv_avggrm_weighted_unified | Trial 227 | outer=5 | weight={'name': 'exponential', 'floor': 1e-06, 'clip_max': 5.0, 'beta': 8.150797670125016}
2026-06-01 00:36:35 | INFO | src.nested_cv_avggrm_weighted_unified | Trial 227 | outer=5 | pruned after 7/10 inner folds (mean r=0.2895)
[I 2026-06-01 00:36:35,174] Trial 227 pruned. 
2026-06-01 00:36:35 | INFO | src.nested_cv_avggrm_weighted_unified | Trial 228 | outer=5 | alpha=6.508e+04 n_pcs=4500 (pc_topk) weight_search=on
2026-06-01 00:36:35 | INFO | src.nested_cv_avggrm_weighted_unified | Trial 228 | outer=5 | weight={'name': 'exponential', 'floor': 1e-06, 'clip_max': 5.0, 'beta': 8.442837950714448}
2026-06-01 00:36:39 | INFO | src.nested_cv_avggrm_weighted_unified | Trial 228 | outer=5 | pruned after 7/10 inner folds (mean r=0.2920)
[I 2026-06-01 00:36:39,852] Trial 228 pruned. 
2026-06-01 00:36:39 | INFO | src.nested_cv_avggrm_weighted_unified | Trial 229 | outer=5 | alpha=1.319e+05 n_pcs=4500 (pc_topk) weight_search=on
2026-06-01 00:36:39 | INFO | src.nested_cv_avggrm_weighted_unified | Trial 229 | outer=5 | weight={'name': 'exponential', 'floor': 1e-06, 'clip_max': None, 'beta': 7.859853231025063}
2026-06-01 00:36:44 | INFO | src.nested_cv_avggrm_weighted_unified | Trial 229 | outer=5 | pruned after 7/10 inner folds (mean r=0.2920)
[I 2026-06-01 00:36:44,495] Trial 229 pruned. 
2026-06-01 00:36:44 | INFO | src.nested_cv_avggrm_weighted_unified | Trial 230 | outer=5 | alpha=7.980e+04 n_pcs=4500 (pc_topk) weight_search=on
2026-06-01 00:36:44 | INFO | src.nested_cv_avggrm_weighted_unified | Trial 230 | outer=5 | weight={'name': 'exponential', 'floor': 1e-06, 'clip_max': 5.0, 'beta': 8.229457575106263}
2026-06-01 00:36:49 | INFO | src.nested_cv_avggrm_weighted_unified | Trial 230 | outer=5 | pruned after 7/10 inner folds (mean r=0.2936)
[I 2026-06-01 00:36:49,136] Trial 230 pruned. 
2026-06-01 00:36:49 | INFO | src.nested_cv_avggrm_weighted_unified | Trial 231 | outer=5 | alpha=1.039e+05 n_pcs=4500 (pc_topk) weight_search=on
2026-06-01 00:36:49 | INFO | src.nested_cv_avggrm_weighted_unified | Trial 231 | outer=5 | weight={'name': 'exponential', 'floor': 1e-06, 'clip_max': 5.0, 'beta': 8.117624612566997}
[I 2026-06-01 00:36:55,821] Trial 231 finished with value: 0.25990202859822764 and parameters: {'alpha': 103906.28461898131, 'n_pcs': 4500, 'weight_scheme': 'exponential', 'weight_clip_max': 5.0, 'weight_exponential_beta': 8.117624612566997}. Best is trial 140 with value: 0.25996359913458195.
2026-06-01 00:36:55 | INFO | src.nested_cv_avggrm_weighted_unified | Trial 232 | outer=5 | alpha=1.060e+05 n_pcs=4500 (pc_topk) weight_search=on
2026-06-01 00:36:55 | INFO | src.nested_cv_avggrm_weighted_unified | Trial 232 | outer=5 | weight={'name': 'exponential', 'floor': 1e-06, 'clip_max': 5.0, 'beta': 8.008999898370881}
[I 2026-06-01 00:37:02,471] Trial 232 finished with value: 0.259884987560525 and parameters: {'alpha': 105982.6815944327, 'n_pcs': 4500, 'weight_scheme': 'exponential', 'weight_clip_max': 5.0, 'weight_exponential_beta': 8.008999898370881}. Best is trial 140 with value: 0.25996359913458195.
2026-06-01 00:37:02 | INFO | src.nested_cv_avggrm_weighted_unified | Trial 233 | outer=5 | alpha=1.023e+05 n_pcs=4500 (pc_topk) weight_search=on
2026-06-01 00:37:02 | INFO | src.nested_cv_avggrm_weighted_unified | Trial 233 | outer=5 | weight={'name': 'exponential', 'floor': 1e-06, 'clip_max': 5.0, 'beta': 7.844139703692601}
[I 2026-06-01 00:37:09,095] Trial 233 finished with value: 0.25987263859382465 and parameters: {'alpha': 102349.05067127106, 'n_pcs': 4500, 'weight_scheme': 'exponential', 'weight_clip_max': 5.0, 'weight_exponential_beta': 7.844139703692601}. Best is trial 140 with value: 0.25996359913458195.
2026-06-01 00:37:09 | INFO | src.nested_cv_avggrm_weighted_unified | Trial 234 | outer=5 | alpha=1.046e+05 n_pcs=4500 (pc_topk) weight_search=on
2026-06-01 00:37:09 | INFO | src.nested_cv_avggrm_weighted_unified | Trial 234 | outer=5 | weight={'name': 'exponential', 'floor': 1e-06, 'clip_max': 5.0, 'beta': 7.848600944539413}
[I 2026-06-01 00:37:15,765] Trial 234 finished with value: 0.25986565331102 and parameters: {'alpha': 104566.5008111071, 'n_pcs': 4500, 'weight_scheme': 'exponential', 'weight_clip_max': 5.0, 'weight_exponential_beta': 7.848600944539413}. Best is trial 140 with value: 0.25996359913458195.
2026-06-01 00:37:15 | INFO | src.nested_cv_avggrm_weighted_unified | Trial 235 | outer=5 | alpha=1.347e+05 n_pcs=4500 (pc_topk) weight_search=on
2026-06-01 00:37:15 | INFO | src.nested_cv_avggrm_weighted_unified | Trial 235 | outer=5 | weight={'name': 'exponential', 'floor': 1e-06, 'clip_max': 5.0, 'beta': 8.037697839092962}
[I 2026-06-01 00:37:22,382] Trial 235 finished with value: 0.25961301629779393 and parameters: {'alpha': 134719.57199450108, 'n_pcs': 4500, 'weight_scheme': 'exponential', 'weight_clip_max': 5.0, 'weight_exponential_beta': 8.037697839092962}. Best is trial 140 with value: 0.25996359913458195.
2026-06-01 00:37:22 | INFO | src.nested_cv_avggrm_weighted_unified | Trial 236 | outer=5 | alpha=3.547e+06 n_pcs=4500 (pc_topk) weight_search=on
2026-06-01 00:37:22 | INFO | src.nested_cv_avggrm_weighted_unified | Trial 236 | outer=5 | weight={'name': 'exponential', 'floor': 1e-06, 'clip_max': 5.0, 'beta': 8.366642338821062}
2026-06-01 00:37:25 | INFO | src.nested_cv_avggrm_weighted_unified | Trial 236 | outer=5 | pruned after 5/10 inner folds (mean r=0.2315)
[I 2026-06-01 00:37:25,668] Trial 236 pruned. 
2026-06-01 00:37:25 | INFO | src.nested_cv_avggrm_weighted_unified | Trial 237 | outer=5 | alpha=7.858e+04 n_pcs=4500 (pc_topk) weight_search=on
2026-06-01 00:37:25 | INFO | src.nested_cv_avggrm_weighted_unified | Trial 237 | outer=5 | weight={'name': 'exponential', 'floor': 1e-06, 'clip_max': 5.0, 'beta': 7.8107810977299446}
2026-06-01 00:37:30 | INFO | src.nested_cv_avggrm_weighted_unified | Trial 237 | outer=5 | pruned after 7/10 inner folds (mean r=0.2937)
[I 2026-06-01 00:37:30,309] Trial 237 pruned. 
2026-06-01 00:37:30 | INFO | src.nested_cv_avggrm_weighted_unified | Trial 238 | outer=5 | alpha=1.529e+05 n_pcs=4500 (pc_topk) weight_search=on
2026-06-01 00:37:30 | INFO | src.nested_cv_avggrm_weighted_unified | Trial 238 | outer=5 | weight={'name': 'exponential', 'floor': 1e-06, 'clip_max': 5.0, 'beta': 8.066093114863492}
[I 2026-06-01 00:37:36,933] Trial 238 finished with value: 0.25933450650845874 and parameters: {'alpha': 152900.7559663888, 'n_pcs': 4500, 'weight_scheme': 'exponential', 'weight_clip_max': 5.0, 'weight_exponential_beta': 8.066093114863492}. Best is trial 140 with value: 0.25996359913458195.
2026-06-01 00:37:36 | INFO | src.nested_cv_avggrm_weighted_unified | Trial 239 | outer=5 | alpha=1.054e+05 n_pcs=4500 (pc_topk) weight_search=on
2026-06-01 00:37:36 | INFO | src.nested_cv_avggrm_weighted_unified | Trial 239 | outer=5 | weight={'name': 'linear', 'floor': 1e-06, 'clip_max': 5.0, 'min_weight': 0.3703050914613359, 'max_weight': 2.7147336518141345}
2026-06-01 00:37:41 | INFO | src.nested_cv_avggrm_weighted_unified | Trial 239 | outer=5 | pruned after 7/10 inner folds (mean r=0.2872)
[I 2026-06-01 00:37:41,560] Trial 239 pruned. 
2026-06-01 00:37:41 | INFO | src.nested_cv_avggrm_weighted_unified | Trial 240 | outer=5 | alpha=1.235e+05 n_pcs=4500 (pc_topk) weight_search=on
2026-06-01 00:37:41 | INFO | src.nested_cv_avggrm_weighted_unified | Trial 240 | outer=5 | weight={'name': 'exponential', 'floor': 1e-06, 'clip_max': 5.0, 'beta': 8.450454655308539}
[I 2026-06-01 00:37:48,213] Trial 240 finished with value: 0.25980893195191457 and parameters: {'alpha': 123461.77277013096, 'n_pcs': 4500, 'weight_scheme': 'exponential', 'weight_clip_max': 5.0, 'weight_exponential_beta': 8.450454655308539}. Best is trial 140 with value: 0.25996359913458195.
2026-06-01 00:37:48 | INFO | src.nested_cv_avggrm_weighted_unified | Trial 241 | outer=5 | alpha=9.353e+04 n_pcs=4500 (pc_topk) weight_search=on
2026-06-01 00:37:48 | INFO | src.nested_cv_avggrm_weighted_unified | Trial 241 | outer=5 | weight={'name': 'exponential', 'floor': 1e-06, 'clip_max': 5.0, 'beta': 8.245432366562753}
2026-06-01 00:37:52 | INFO | src.nested_cv_avggrm_weighted_unified | Trial 241 | outer=5 | pruned after 7/10 inner folds (mean r=0.2944)
[I 2026-06-01 00:37:52,856] Trial 241 pruned. 
2026-06-01 00:37:52 | INFO | src.nested_cv_avggrm_weighted_unified | Trial 242 | outer=5 | alpha=8.691e+04 n_pcs=4500 (pc_topk) weight_search=on
2026-06-01 00:37:52 | INFO | src.nested_cv_avggrm_weighted_unified | Trial 242 | outer=5 | weight={'name': 'exponential', 'floor': 1e-06, 'clip_max': 5.0, 'beta': 8.08204947886486}
2026-06-01 00:37:57 | INFO | src.nested_cv_avggrm_weighted_unified | Trial 242 | outer=5 | pruned after 7/10 inner folds (mean r=0.2941)
[I 2026-06-01 00:37:57,899] Trial 242 pruned. 
2026-06-01 00:37:57 | INFO | src.nested_cv_avggrm_weighted_unified | Trial 243 | outer=5 | alpha=1.022e+05 n_pcs=4500 (pc_topk) weight_search=on
2026-06-01 00:37:57 | INFO | src.nested_cv_avggrm_weighted_unified | Trial 243 | outer=5 | weight={'name': 'exponential', 'floor': 1e-06, 'clip_max': 5.0, 'beta': 7.864916736362699}
[I 2026-06-01 00:38:04,532] Trial 243 finished with value: 0.2598762628578644 and parameters: {'alpha': 102222.47270330059, 'n_pcs': 4500, 'weight_scheme': 'exponential', 'weight_clip_max': 5.0, 'weight_exponential_beta': 7.864916736362699}. Best is trial 140 with value: 0.25996359913458195.
2026-06-01 00:38:04 | INFO | src.nested_cv_avggrm_weighted_unified | Trial 244 | outer=5 | alpha=1.008e+05 n_pcs=4500 (pc_topk) weight_search=on
2026-06-01 00:38:04 | INFO | src.nested_cv_avggrm_weighted_unified | Trial 244 | outer=5 | weight={'name': 'exponential', 'floor': 1e-06, 'clip_max': 5.0, 'beta': 7.766193522836786}
[I 2026-06-01 00:38:11,157] Trial 244 finished with value: 0.2598649234732189 and parameters: {'alpha': 100770.77567126774, 'n_pcs': 4500, 'weight_scheme': 'exponential', 'weight_clip_max': 5.0, 'weight_exponential_beta': 7.766193522836786}. Best is trial 140 with value: 0.25996359913458195.
2026-06-01 00:38:11 | INFO | src.nested_cv_avggrm_weighted_unified | Trial 245 | outer=5 | alpha=1.244e+05 n_pcs=4500 (pc_topk) weight_search=on
2026-06-01 00:38:11 | INFO | src.nested_cv_avggrm_weighted_unified | Trial 245 | outer=5 | weight={'name': 'exponential', 'floor': 1e-06, 'clip_max': 5.0, 'beta': 7.8484657277359275}
[I 2026-06-01 00:38:17,901] Trial 245 finished with value: 0.25969251246234276 and parameters: {'alpha': 124420.05086758912, 'n_pcs': 4500, 'weight_scheme': 'exponential', 'weight_clip_max': 5.0, 'weight_exponential_beta': 7.8484657277359275}. Best is trial 140 with value: 0.25996359913458195.
2026-06-01 00:38:17 | INFO | src.nested_cv_avggrm_weighted_unified | Trial 246 | outer=5 | alpha=7.366e+04 n_pcs=4500 (pc_topk) weight_search=on
2026-06-01 00:38:17 | INFO | src.nested_cv_avggrm_weighted_unified | Trial 246 | outer=5 | weight={'name': 'exponential', 'floor': 1e-06, 'clip_max': 5.0, 'beta': 7.956952547354593}
2026-06-01 00:38:22 | INFO | src.nested_cv_avggrm_weighted_unified | Trial 246 | outer=5 | pruned after 7/10 inner folds (mean r=0.2933)
[I 2026-06-01 00:38:22,544] Trial 246 pruned. 
2026-06-01 00:38:22 | INFO | src.nested_cv_avggrm_weighted_unified | Trial 247 | outer=5 | alpha=1.161e+05 n_pcs=4500 (pc_topk) weight_search=on
2026-06-01 00:38:22 | INFO | src.nested_cv_avggrm_weighted_unified | Trial 247 | outer=5 | weight={'name': 'exponential', 'floor': 1e-06, 'clip_max': 5.0, 'beta': 8.274567981886864}
[I 2026-06-01 00:38:29,189] Trial 247 finished with value: 0.2598581204657197 and parameters: {'alpha': 116052.93715217718, 'n_pcs': 4500, 'weight_scheme': 'exponential', 'weight_clip_max': 5.0, 'weight_exponential_beta': 8.274567981886864}. Best is trial 140 with value: 0.25996359913458195.
2026-06-01 00:38:29 | INFO | src.nested_cv_avggrm_weighted_unified | Trial 248 | outer=5 | alpha=1.009e+05 n_pcs=4500 (pc_topk) weight_search=on
2026-06-01 00:38:29 | INFO | src.nested_cv_avggrm_weighted_unified | Trial 248 | outer=5 | weight={'name': 'exponential', 'floor': 1e-06, 'clip_max': 5.0, 'beta': 8.468963221121939}
[I 2026-06-01 00:38:35,812] Trial 248 finished with value: 0.2598918993657662 and parameters: {'alpha': 100930.42379529691, 'n_pcs': 4500, 'weight_scheme': 'exponential', 'weight_clip_max': 5.0, 'weight_exponential_beta': 8.468963221121939}. Best is trial 140 with value: 0.25996359913458195.
2026-06-01 00:38:35 | INFO | src.nested_cv_avggrm_weighted_unified | Trial 249 | outer=5 | alpha=9.248e+04 n_pcs=4500 (pc_topk) weight_search=on
2026-06-01 00:38:35 | INFO | src.nested_cv_avggrm_weighted_unified | Trial 249 | outer=5 | weight={'name': 'exponential', 'floor': 1e-06, 'clip_max': 10.0, 'beta': 8.459001360590392}
2026-06-01 00:38:40 | INFO | src.nested_cv_avggrm_weighted_unified | Trial 249 | outer=5 | pruned after 7/10 inner folds (mean r=0.2942)
[I 2026-06-01 00:38:40,544] Trial 249 pruned. 
2026-06-01 00:38:40 | INFO | src.nested_cv_avggrm_weighted_unified | Trial 250 | outer=5 | alpha=1.514e+05 n_pcs=4500 (pc_topk) weight_search=on
2026-06-01 00:38:40 | INFO | src.nested_cv_avggrm_weighted_unified | Trial 250 | outer=5 | weight={'name': 'exponential', 'floor': 1e-06, 'clip_max': 5.0, 'beta': 7.752511962659238}
[I 2026-06-01 00:38:47,163] Trial 250 finished with value: 0.25922784767893636 and parameters: {'alpha': 151430.0840591648, 'n_pcs': 4500, 'weight_scheme': 'exponential', 'weight_clip_max': 5.0, 'weight_exponential_beta': 7.752511962659238}. Best is trial 140 with value: 0.25996359913458195.
2026-06-01 00:38:47 | INFO | src.nested_cv_avggrm_weighted_unified | Trial 251 | outer=5 | alpha=6.533e+04 n_pcs=4500 (pc_topk) weight_search=on
2026-06-01 00:38:47 | INFO | src.nested_cv_avggrm_weighted_unified | Trial 251 | outer=5 | weight={'name': 'exponential', 'floor': 1e-06, 'clip_max': 5.0, 'beta': 7.983792650854618}
2026-06-01 00:38:51 | INFO | src.nested_cv_avggrm_weighted_unified | Trial 251 | outer=5 | pruned after 7/10 inner folds (mean r=0.2924)
