[I 2026-06-01 02:52:22,109] Trial 82 finished with value: 0.22657496018261933 and parameters: {'alpha': 82789.15910138711, 'n_pcs': 3500, 'weight_scheme': 'linear', 'weight_clip_max': 3.0, 'weight_linear_min_weight': 0.18306937284894167, 'weight_linear_max_weight': 4.571240886008852}. Best is trial 58 with value: 0.2272202509741915.
2026-06-01 02:52:22 | INFO | src.nested_cv_avggrm_weighted_unified | Trial 83 | outer=11 | alpha=5.218e+04 n_pcs=3000 (pc_topk) weight_search=on
2026-06-01 02:52:22 | INFO | src.nested_cv_avggrm_weighted_unified | Trial 83 | outer=11 | weight={'name': 'linear', 'floor': 1e-06, 'clip_max': 3.0, 'min_weight': 0.14147109153075224, 'max_weight': 4.7702594006581345}
[I 2026-06-01 02:52:25,945] Trial 83 finished with value: 0.22451595511775704 and parameters: {'alpha': 52181.99183894522, 'n_pcs': 3000, 'weight_scheme': 'linear', 'weight_clip_max': 3.0, 'weight_linear_min_weight': 0.14147109153075224, 'weight_linear_max_weight': 4.7702594006581345}. Best is trial 58 with value: 0.2272202509741915.
2026-06-01 02:52:25 | INFO | src.nested_cv_avggrm_weighted_unified | Trial 84 | outer=11 | alpha=2.279e+04 n_pcs=3500 (pc_topk) weight_search=on
2026-06-01 02:52:25 | INFO | src.nested_cv_avggrm_weighted_unified | Trial 84 | outer=11 | weight={'name': 'linear', 'floor': 1e-06, 'clip_max': 3.0, 'min_weight': 0.20931726216133842, 'max_weight': 4.423483752147579}
[I 2026-06-01 02:52:31,107] Trial 84 finished with value: 0.21357723306824106 and parameters: {'alpha': 22788.085570564268, 'n_pcs': 3500, 'weight_scheme': 'linear', 'weight_clip_max': 3.0, 'weight_linear_min_weight': 0.20931726216133842, 'weight_linear_max_weight': 4.423483752147579}. Best is trial 58 with value: 0.2272202509741915.
2026-06-01 02:52:31 | INFO | src.nested_cv_avggrm_weighted_unified | Trial 85 | outer=11 | alpha=8.468e+04 n_pcs=3500 (pc_topk) weight_search=on
2026-06-01 02:52:31 | INFO | src.nested_cv_avggrm_weighted_unified | Trial 85 | outer=11 | weight={'name': 'linear', 'floor': 1e-06, 'clip_max': 3.0, 'min_weight': 0.29836557553775966, 'max_weight': 4.585488300195395}
[I 2026-06-01 02:52:36,139] Trial 85 finished with value: 0.2268049087386271 and parameters: {'alpha': 84678.10474722242, 'n_pcs': 3500, 'weight_scheme': 'linear', 'weight_clip_max': 3.0, 'weight_linear_min_weight': 0.29836557553775966, 'weight_linear_max_weight': 4.585488300195395}. Best is trial 58 with value: 0.2272202509741915.
2026-06-01 02:52:36 | INFO | src.nested_cv_avggrm_weighted_unified | Trial 86 | outer=11 | alpha=3.558e+04 n_pcs=3000 (pc_topk) weight_search=on
2026-06-01 02:52:36 | INFO | src.nested_cv_avggrm_weighted_unified | Trial 86 | outer=11 | weight={'name': 'linear', 'floor': 1e-06, 'clip_max': 3.0, 'min_weight': 0.3084808644437072, 'max_weight': 4.617052499716181}
[I 2026-06-01 02:52:40,011] Trial 86 finished with value: 0.22081474359893707 and parameters: {'alpha': 35583.16636419617, 'n_pcs': 3000, 'weight_scheme': 'linear', 'weight_clip_max': 3.0, 'weight_linear_min_weight': 0.3084808644437072, 'weight_linear_max_weight': 4.617052499716181}. Best is trial 58 with value: 0.2272202509741915.
2026-06-01 02:52:40 | INFO | src.nested_cv_avggrm_weighted_unified | Trial 87 | outer=11 | alpha=1.828e+05 n_pcs=3000 (pc_topk) weight_search=on
2026-06-01 02:52:40 | INFO | src.nested_cv_avggrm_weighted_unified | Trial 87 | outer=11 | weight={'name': 'linear', 'floor': 1e-06, 'clip_max': 3.0, 'min_weight': 0.23854718997060675, 'max_weight': 4.84317345222574}
[I 2026-06-01 02:52:43,873] Trial 87 finished with value: 0.22600391340039255 and parameters: {'alpha': 182797.7028797456, 'n_pcs': 3000, 'weight_scheme': 'linear', 'weight_clip_max': 3.0, 'weight_linear_min_weight': 0.23854718997060675, 'weight_linear_max_weight': 4.84317345222574}. Best is trial 58 with value: 0.2272202509741915.
2026-06-01 02:52:43 | INFO | src.nested_cv_avggrm_weighted_unified | Trial 88 | outer=11 | alpha=1.237e+05 n_pcs=3000 (pc_topk) weight_search=on
2026-06-01 02:52:43 | INFO | src.nested_cv_avggrm_weighted_unified | Trial 88 | outer=11 | weight={'name': 'linear', 'floor': 1e-06, 'clip_max': None, 'min_weight': 0.39857947158845264, 'max_weight': 4.373193111430659}
[I 2026-06-01 02:52:47,987] Trial 88 finished with value: 0.22655214344363223 and parameters: {'alpha': 123729.29152265706, 'n_pcs': 3000, 'weight_scheme': 'linear', 'weight_clip_max': None, 'weight_linear_min_weight': 0.39857947158845264, 'weight_linear_max_weight': 4.373193111430659}. Best is trial 58 with value: 0.2272202509741915.
2026-06-01 02:52:47 | INFO | src.nested_cv_avggrm_weighted_unified | Trial 89 | outer=11 | alpha=2.267e+05 n_pcs=3500 (pc_topk) weight_search=on
2026-06-01 02:52:48 | INFO | src.nested_cv_avggrm_weighted_unified | Trial 89 | outer=11 | weight={'name': 'linear', 'floor': 1e-06, 'clip_max': 3.0, 'min_weight': 0.13563402989220524, 'max_weight': 3.1745839871255197}
[I 2026-06-01 02:52:52,893] Trial 89 finished with value: 0.22410003184942112 and parameters: {'alpha': 226677.89307782796, 'n_pcs': 3500, 'weight_scheme': 'linear', 'weight_clip_max': 3.0, 'weight_linear_min_weight': 0.13563402989220524, 'weight_linear_max_weight': 3.1745839871255197}. Best is trial 58 with value: 0.2272202509741915.
2026-06-01 02:52:52 | INFO | src.nested_cv_avggrm_weighted_unified | Trial 90 | outer=11 | alpha=7.457e+04 n_pcs=3000 (pc_topk) weight_search=on
2026-06-01 02:52:52 | INFO | src.nested_cv_avggrm_weighted_unified | Trial 90 | outer=11 | weight={'name': 'uniform', 'floor': 1e-06, 'clip_max': 3.0}
[I 2026-06-01 02:52:56,322] Trial 90 finished with value: 0.2193764956986079 and parameters: {'alpha': 74571.79593966075, 'n_pcs': 3000, 'weight_scheme': 'uniform', 'weight_clip_max': 3.0}. Best is trial 58 with value: 0.2272202509741915.
2026-06-01 02:52:56 | INFO | src.nested_cv_avggrm_weighted_unified | Trial 91 | outer=11 | alpha=8.977e+04 n_pcs=3500 (pc_topk) weight_search=on
2026-06-01 02:52:56 | INFO | src.nested_cv_avggrm_weighted_unified | Trial 91 | outer=11 | weight={'name': 'linear', 'floor': 1e-06, 'clip_max': 3.0, 'min_weight': 0.16347807346755658, 'max_weight': 1.0401869931659624}
[I 2026-06-01 02:53:01,349] Trial 91 finished with value: 0.2262529336528349 and parameters: {'alpha': 89772.62185541769, 'n_pcs': 3500, 'weight_scheme': 'linear', 'weight_clip_max': 3.0, 'weight_linear_min_weight': 0.16347807346755658, 'weight_linear_max_weight': 1.0401869931659624}. Best is trial 58 with value: 0.2272202509741915.
2026-06-01 02:53:01 | INFO | src.nested_cv_avggrm_weighted_unified | Trial 92 | outer=11 | alpha=8.907e+04 n_pcs=4000 (pc_topk) weight_search=on
2026-06-01 02:53:01 | INFO | src.nested_cv_avggrm_weighted_unified | Trial 92 | outer=11 | weight={'name': 'linear', 'floor': 1e-06, 'clip_max': 3.0, 'min_weight': 0.3014027070037203, 'max_weight': 4.566294382301889}
[I 2026-06-01 02:53:07,292] Trial 92 finished with value: 0.22683301950101406 and parameters: {'alpha': 89074.94375578722, 'n_pcs': 4000, 'weight_scheme': 'linear', 'weight_clip_max': 3.0, 'weight_linear_min_weight': 0.3014027070037203, 'weight_linear_max_weight': 4.566294382301889}. Best is trial 58 with value: 0.2272202509741915.
2026-06-01 02:53:07 | INFO | src.nested_cv_avggrm_weighted_unified | Trial 93 | outer=11 | alpha=5.012e+04 n_pcs=4000 (pc_topk) weight_search=on
2026-06-01 02:53:07 | INFO | src.nested_cv_avggrm_weighted_unified | Trial 93 | outer=11 | weight={'name': 'linear', 'floor': 1e-06, 'clip_max': 3.0, 'min_weight': 0.3459796458154085, 'max_weight': 4.708469383269142}
[I 2026-06-01 02:53:13,087] Trial 93 finished with value: 0.22559464337645457 and parameters: {'alpha': 50117.010439487465, 'n_pcs': 4000, 'weight_scheme': 'linear', 'weight_clip_max': 3.0, 'weight_linear_min_weight': 0.3459796458154085, 'weight_linear_max_weight': 4.708469383269142}. Best is trial 58 with value: 0.2272202509741915.
2026-06-01 02:53:13 | INFO | src.nested_cv_avggrm_weighted_unified | Trial 94 | outer=11 | alpha=1.614e+05 n_pcs=4000 (pc_topk) weight_search=on
2026-06-01 02:53:13 | INFO | src.nested_cv_avggrm_weighted_unified | Trial 94 | outer=11 | weight={'name': 'linear', 'floor': 1e-06, 'clip_max': 10.0, 'min_weight': 0.18768395020003376, 'max_weight': 4.172869996639963}
[I 2026-06-01 02:53:18,929] Trial 94 finished with value: 0.22497916092821932 and parameters: {'alpha': 161442.99050197468, 'n_pcs': 4000, 'weight_scheme': 'linear', 'weight_clip_max': 10.0, 'weight_linear_min_weight': 0.18768395020003376, 'weight_linear_max_weight': 4.172869996639963}. Best is trial 58 with value: 0.2272202509741915.
2026-06-01 02:53:18 | INFO | src.nested_cv_avggrm_weighted_unified | Trial 95 | outer=11 | alpha=1.173e+05 n_pcs=2500 (pc_topk) weight_search=on
2026-06-01 02:53:18 | INFO | src.nested_cv_avggrm_weighted_unified | Trial 95 | outer=11 | weight={'name': 'linear', 'floor': 1e-06, 'clip_max': 3.0, 'min_weight': 0.43537833396367065, 'max_weight': 4.381828349433137}
[I 2026-06-01 02:53:22,871] Trial 95 finished with value: 0.22702468807556456 and parameters: {'alpha': 117297.31596308573, 'n_pcs': 2500, 'weight_scheme': 'linear', 'weight_clip_max': 3.0, 'weight_linear_min_weight': 0.43537833396367065, 'weight_linear_max_weight': 4.381828349433137}. Best is trial 58 with value: 0.2272202509741915.
2026-06-01 02:53:22 | INFO | src.nested_cv_avggrm_weighted_unified | Trial 96 | outer=11 | alpha=7.100e+04 n_pcs=4000 (pc_topk) weight_search=on
2026-06-01 02:53:22 | INFO | src.nested_cv_avggrm_weighted_unified | Trial 96 | outer=11 | weight={'name': 'linear', 'floor': 1e-06, 'clip_max': 3.0, 'min_weight': 0.4441023627818198, 'max_weight': 4.33729986633402}
[I 2026-06-01 02:53:28,654] Trial 96 finished with value: 0.2266296442263956 and parameters: {'alpha': 70995.78349371396, 'n_pcs': 4000, 'weight_scheme': 'linear', 'weight_clip_max': 3.0, 'weight_linear_min_weight': 0.4441023627818198, 'weight_linear_max_weight': 4.33729986633402}. Best is trial 58 with value: 0.2272202509741915.
2026-06-01 02:53:28 | INFO | src.nested_cv_avggrm_weighted_unified | Trial 97 | outer=11 | alpha=1.336e+05 n_pcs=3000 (pc_topk) weight_search=on
2026-06-01 02:53:28 | INFO | src.nested_cv_avggrm_weighted_unified | Trial 97 | outer=11 | weight={'name': 'exponential', 'floor': 1e-06, 'clip_max': 3.0, 'beta': 0.08411232638086652}
[I 2026-06-01 02:53:33,158] Trial 97 finished with value: 0.21702706688255913 and parameters: {'alpha': 133561.70125303217, 'n_pcs': 3000, 'weight_scheme': 'exponential', 'weight_clip_max': 3.0, 'weight_exponential_beta': 0.08411232638086652}. Best is trial 58 with value: 0.2272202509741915.
2026-06-01 02:53:33 | INFO | src.nested_cv_avggrm_weighted_unified | Trial 98 | outer=11 | alpha=5.477e+04 n_pcs=4500 (pc_topk) weight_search=on
2026-06-01 02:53:33 | INFO | src.nested_cv_avggrm_weighted_unified | Trial 98 | outer=11 | weight={'name': 'linear', 'floor': 1e-06, 'clip_max': 3.0, 'min_weight': 0.3236775629448852, 'max_weight': 4.610568245777811}
[I 2026-06-01 02:53:40,213] Trial 98 finished with value: 0.22746005657350396 and parameters: {'alpha': 54766.19766681652, 'n_pcs': 4500, 'weight_scheme': 'linear', 'weight_clip_max': 3.0, 'weight_linear_min_weight': 0.3236775629448852, 'weight_linear_max_weight': 4.610568245777811}. Best is trial 98 with value: 0.22746005657350396.
2026-06-01 02:53:40 | INFO | src.nested_cv_avggrm_weighted_unified | OUTER 11 | new best trial 98 (mean inner r=0.2275) saved to outputs/final_results/e6_pc_ridge_avggrm/thr_wing/e6_pc_ridge_avggrm_thr_wing_best_trials/split_11_best_trial.json
2026-06-01 02:53:40 | INFO | src.nested_cv_avggrm_weighted_unified | Trial 99 | outer=11 | alpha=3.680e+04 n_pcs=4500 (pc_topk) weight_search=on
2026-06-01 02:53:40 | INFO | src.nested_cv_avggrm_weighted_unified | Trial 99 | outer=11 | weight={'name': 'linear', 'floor': 1e-06, 'clip_max': 3.0, 'min_weight': 0.38019864914931534, 'max_weight': 4.384190152359654}
[I 2026-06-01 02:53:47,290] Trial 99 finished with value: 0.22592503396707592 and parameters: {'alpha': 36803.86502747243, 'n_pcs': 4500, 'weight_scheme': 'linear', 'weight_clip_max': 3.0, 'weight_linear_min_weight': 0.38019864914931534, 'weight_linear_max_weight': 4.384190152359654}. Best is trial 98 with value: 0.22746005657350396.
2026-06-01 02:53:47 | INFO | src.nested_cv_avggrm_weighted_unified | Trial 100 | outer=11 | alpha=2.481e+04 n_pcs=4500 (pc_topk) weight_search=on
2026-06-01 02:53:47 | INFO | src.nested_cv_avggrm_weighted_unified | Trial 100 | outer=11 | weight={'name': 'linear', 'floor': 1e-06, 'clip_max': 3.0, 'min_weight': 0.46582851061581515, 'max_weight': 4.8163957012016105}
[I 2026-06-01 02:53:54,340] Trial 100 finished with value: 0.22264586059243566 and parameters: {'alpha': 24810.766791841284, 'n_pcs': 4500, 'weight_scheme': 'linear', 'weight_clip_max': 3.0, 'weight_linear_min_weight': 0.46582851061581515, 'weight_linear_max_weight': 4.8163957012016105}. Best is trial 98 with value: 0.22746005657350396.
2026-06-01 02:53:54 | INFO | src.nested_cv_avggrm_weighted_unified | Trial 101 | outer=11 | alpha=5.161e+04 n_pcs=4500 (pc_topk) weight_search=on
2026-06-01 02:53:54 | INFO | src.nested_cv_avggrm_weighted_unified | Trial 101 | outer=11 | weight={'name': 'linear', 'floor': 1e-06, 'clip_max': 3.0, 'min_weight': 0.3005845530787131, 'max_weight': 4.648169889516855}
[I 2026-06-01 02:54:01,393] Trial 101 finished with value: 0.22727536360530393 and parameters: {'alpha': 51607.19113306671, 'n_pcs': 4500, 'weight_scheme': 'linear', 'weight_clip_max': 3.0, 'weight_linear_min_weight': 0.3005845530787131, 'weight_linear_max_weight': 4.648169889516855}. Best is trial 98 with value: 0.22746005657350396.
2026-06-01 02:54:01 | INFO | src.nested_cv_avggrm_weighted_unified | Trial 102 | outer=11 | alpha=5.187e+04 n_pcs=4500 (pc_topk) weight_search=on
2026-06-01 02:54:01 | INFO | src.nested_cv_avggrm_weighted_unified | Trial 102 | outer=11 | weight={'name': 'linear', 'floor': 1e-06, 'clip_max': 3.0, 'min_weight': 0.3482521738872988, 'max_weight': 4.657322687592412}
[I 2026-06-01 02:54:08,490] Trial 102 finished with value: 0.2273495504882565 and parameters: {'alpha': 51868.62916458079, 'n_pcs': 4500, 'weight_scheme': 'linear', 'weight_clip_max': 3.0, 'weight_linear_min_weight': 0.3482521738872988, 'weight_linear_max_weight': 4.657322687592412}. Best is trial 98 with value: 0.22746005657350396.
2026-06-01 02:54:08 | INFO | src.nested_cv_avggrm_weighted_unified | Trial 103 | outer=11 | alpha=1.820e+04 n_pcs=4500 (pc_topk) weight_search=on
2026-06-01 02:54:08 | INFO | src.nested_cv_avggrm_weighted_unified | Trial 103 | outer=11 | weight={'name': 'linear', 'floor': 1e-06, 'clip_max': 3.0, 'min_weight': 0.349524366844689, 'max_weight': 4.734392800524419}
[I 2026-06-01 02:54:15,599] Trial 103 finished with value: 0.2183925027549761 and parameters: {'alpha': 18195.3651405425, 'n_pcs': 4500, 'weight_scheme': 'linear', 'weight_clip_max': 3.0, 'weight_linear_min_weight': 0.349524366844689, 'weight_linear_max_weight': 4.734392800524419}. Best is trial 98 with value: 0.22746005657350396.
2026-06-01 02:54:15 | INFO | src.nested_cv_avggrm_weighted_unified | Trial 104 | outer=11 | alpha=5.369e+04 n_pcs=4500 (pc_topk) weight_search=on
2026-06-01 02:54:15 | INFO | src.nested_cv_avggrm_weighted_unified | Trial 104 | outer=11 | weight={'name': 'linear', 'floor': 1e-06, 'clip_max': 3.0, 'min_weight': 0.3805174849363344, 'max_weight': 4.651374947075258}
[I 2026-06-01 02:54:22,674] Trial 104 finished with value: 0.22745649077134558 and parameters: {'alpha': 53690.27908264319, 'n_pcs': 4500, 'weight_scheme': 'linear', 'weight_clip_max': 3.0, 'weight_linear_min_weight': 0.3805174849363344, 'weight_linear_max_weight': 4.651374947075258}. Best is trial 98 with value: 0.22746005657350396.
2026-06-01 02:54:22 | INFO | src.nested_cv_avggrm_weighted_unified | Trial 105 | outer=11 | alpha=5.228e+04 n_pcs=4500 (pc_topk) weight_search=on
2026-06-01 02:54:22 | INFO | src.nested_cv_avggrm_weighted_unified | Trial 105 | outer=11 | weight={'name': 'linear', 'floor': 1e-06, 'clip_max': 3.0, 'min_weight': 0.5394485100404929, 'max_weight': 4.875330657025906}
[I 2026-06-01 02:54:29,729] Trial 105 finished with value: 0.22726766961166608 and parameters: {'alpha': 52280.368412272124, 'n_pcs': 4500, 'weight_scheme': 'linear', 'weight_clip_max': 3.0, 'weight_linear_min_weight': 0.5394485100404929, 'weight_linear_max_weight': 4.875330657025906}. Best is trial 98 with value: 0.22746005657350396.
2026-06-01 02:54:29 | INFO | src.nested_cv_avggrm_weighted_unified | Trial 106 | outer=11 | alpha=5.398e+04 n_pcs=4500 (pc_topk) weight_search=on
2026-06-01 02:54:29 | INFO | src.nested_cv_avggrm_weighted_unified | Trial 106 | outer=11 | weight={'name': 'linear', 'floor': 1e-06, 'clip_max': None, 'min_weight': 0.41656202807668835, 'max_weight': 4.67317445324623}
[I 2026-06-01 02:54:36,901] Trial 106 finished with value: 0.22700903907051515 and parameters: {'alpha': 53984.79752420828, 'n_pcs': 4500, 'weight_scheme': 'linear', 'weight_clip_max': None, 'weight_linear_min_weight': 0.41656202807668835, 'weight_linear_max_weight': 4.67317445324623}. Best is trial 98 with value: 0.22746005657350396.
2026-06-01 02:54:36 | INFO | src.nested_cv_avggrm_weighted_unified | Trial 107 | outer=11 | alpha=3.179e+04 n_pcs=4500 (pc_topk) weight_search=on
2026-06-01 02:54:36 | INFO | src.nested_cv_avggrm_weighted_unified | Trial 107 | outer=11 | weight={'name': 'linear', 'floor': 1e-06, 'clip_max': 3.0, 'min_weight': 0.5339730152668202, 'max_weight': 4.890517024585667}
[I 2026-06-01 02:54:43,967] Trial 107 finished with value: 0.22492949262749445 and parameters: {'alpha': 31791.654719640377, 'n_pcs': 4500, 'weight_scheme': 'linear', 'weight_clip_max': 3.0, 'weight_linear_min_weight': 0.5339730152668202, 'weight_linear_max_weight': 4.890517024585667}. Best is trial 98 with value: 0.22746005657350396.
2026-06-01 02:54:43 | INFO | src.nested_cv_avggrm_weighted_unified | Trial 108 | outer=11 | alpha=1.829e+04 n_pcs=5000 (pc_topk) weight_search=on
2026-06-01 02:54:43 | INFO | src.nested_cv_avggrm_weighted_unified | Trial 108 | outer=11 | weight={'name': 'linear', 'floor': 1e-06, 'clip_max': 3.0, 'min_weight': 0.378220932598505, 'max_weight': 4.465227839169067}
[I 2026-06-01 02:54:52,280] Trial 108 finished with value: 0.21738511126319104 and parameters: {'alpha': 18294.60229201646, 'n_pcs': 5000, 'weight_scheme': 'linear', 'weight_clip_max': 3.0, 'weight_linear_min_weight': 0.378220932598505, 'weight_linear_max_weight': 4.465227839169067}. Best is trial 98 with value: 0.22746005657350396.
2026-06-01 02:54:52 | INFO | src.nested_cv_avggrm_weighted_unified | Trial 109 | outer=11 | alpha=4.203e+04 n_pcs=1000 (pc_topk) weight_search=on
2026-06-01 02:54:52 | INFO | src.nested_cv_avggrm_weighted_unified | Trial 109 | outer=11 | weight={'name': 'linear', 'floor': 1e-06, 'clip_max': 10.0, 'min_weight': 0.3329465394526288, 'max_weight': 2.046914250710636}
2026-06-01 02:54:53 | INFO | src.nested_cv_avggrm_weighted_unified | Trial 109 | outer=11 | pruned after 7/10 inner folds (mean r=0.2472)
[I 2026-06-01 02:54:53,402] Trial 109 pruned. 
2026-06-01 02:54:53 | INFO | src.nested_cv_avggrm_weighted_unified | Trial 110 | outer=11 | alpha=6.083e+04 n_pcs=4500 (pc_topk) weight_search=on
2026-06-01 02:54:53 | INFO | src.nested_cv_avggrm_weighted_unified | Trial 110 | outer=11 | weight={'name': 'linear', 'floor': 1e-06, 'clip_max': 3.0, 'min_weight': 0.47288568832784234, 'max_weight': 4.651709157043962}
[I 2026-06-01 02:55:00,473] Trial 110 finished with value: 0.22756108363208605 and parameters: {'alpha': 60827.09296937712, 'n_pcs': 4500, 'weight_scheme': 'linear', 'weight_clip_max': 3.0, 'weight_linear_min_weight': 0.47288568832784234, 'weight_linear_max_weight': 4.651709157043962}. Best is trial 110 with value: 0.22756108363208605.
2026-06-01 02:55:00 | INFO | src.nested_cv_avggrm_weighted_unified | OUTER 11 | new best trial 110 (mean inner r=0.2276) saved to outputs/final_results/e6_pc_ridge_avggrm/thr_wing/e6_pc_ridge_avggrm_thr_wing_best_trials/split_11_best_trial.json
2026-06-01 02:55:00 | INFO | src.nested_cv_avggrm_weighted_unified | Trial 111 | outer=11 | alpha=6.196e+04 n_pcs=4500 (pc_topk) weight_search=on
2026-06-01 02:55:00 | INFO | src.nested_cv_avggrm_weighted_unified | Trial 111 | outer=11 | weight={'name': 'linear', 'floor': 1e-06, 'clip_max': 3.0, 'min_weight': 0.47596710205024695, 'max_weight': 4.659423177992236}
[I 2026-06-01 02:55:07,554] Trial 111 finished with value: 0.22757049682419658 and parameters: {'alpha': 61964.03225613441, 'n_pcs': 4500, 'weight_scheme': 'linear', 'weight_clip_max': 3.0, 'weight_linear_min_weight': 0.47596710205024695, 'weight_linear_max_weight': 4.659423177992236}. Best is trial 111 with value: 0.22757049682419658.
2026-06-01 02:55:07 | INFO | src.nested_cv_avggrm_weighted_unified | OUTER 11 | new best trial 111 (mean inner r=0.2276) saved to outputs/final_results/e6_pc_ridge_avggrm/thr_wing/e6_pc_ridge_avggrm_thr_wing_best_trials/split_11_best_trial.json
2026-06-01 02:55:07 | INFO | src.nested_cv_avggrm_weighted_unified | Trial 112 | outer=11 | alpha=6.765e+04 n_pcs=4500 (pc_topk) weight_search=on
2026-06-01 02:55:07 | INFO | src.nested_cv_avggrm_weighted_unified | Trial 112 | outer=11 | weight={'name': 'linear', 'floor': 1e-06, 'clip_max': 3.0, 'min_weight': 0.49959960862605585, 'max_weight': 4.667394862692985}
