[I 2026-06-01 02:45:24,161] Trial 288 pruned. 
2026-06-01 02:45:24 | INFO | src.nested_cv_avggrm_weighted_unified | Trial 289 | outer=10 | alpha=1.246e+05 n_pcs=4000 (pc_topk) weight_search=on
2026-06-01 02:45:24 | INFO | src.nested_cv_avggrm_weighted_unified | Trial 289 | outer=10 | weight={'name': 'linear', 'floor': 1e-06, 'clip_max': None, 'min_weight': 0.08529139681677128, 'max_weight': 4.103942686063853}
[I 2026-06-01 02:45:29,945] Trial 289 finished with value: 0.23592033566468343 and parameters: {'alpha': 124576.15782728359, 'n_pcs': 4000, 'weight_scheme': 'linear', 'weight_clip_max': None, 'weight_linear_min_weight': 0.08529139681677128, 'weight_linear_max_weight': 4.103942686063853}. Best is trial 258 with value: 0.23592669608374228.
2026-06-01 02:45:29 | INFO | src.nested_cv_avggrm_weighted_unified | Trial 290 | outer=10 | alpha=2.008e+05 n_pcs=3000 (pc_topk) weight_search=on
2026-06-01 02:45:29 | INFO | src.nested_cv_avggrm_weighted_unified | Trial 290 | outer=10 | weight={'name': 'linear', 'floor': 1e-06, 'clip_max': None, 'min_weight': 0.08528037865011466, 'max_weight': 4.13236920040729}
[I 2026-06-01 02:45:34,083] Trial 290 finished with value: 0.23530918949809093 and parameters: {'alpha': 200784.93753494663, 'n_pcs': 3000, 'weight_scheme': 'linear', 'weight_clip_max': None, 'weight_linear_min_weight': 0.08528037865011466, 'weight_linear_max_weight': 4.13236920040729}. Best is trial 258 with value: 0.23592669608374228.
2026-06-01 02:45:34 | INFO | src.nested_cv_avggrm_weighted_unified | Trial 291 | outer=10 | alpha=1.347e+05 n_pcs=4000 (pc_topk) weight_search=on
2026-06-01 02:45:34 | INFO | src.nested_cv_avggrm_weighted_unified | Trial 291 | outer=10 | weight={'name': 'linear', 'floor': 1e-06, 'clip_max': None, 'min_weight': 0.05129124981330196, 'max_weight': 4.251887263395819}
[I 2026-06-01 02:45:39,934] Trial 291 finished with value: 0.2359113444912706 and parameters: {'alpha': 134738.19786079653, 'n_pcs': 4000, 'weight_scheme': 'linear', 'weight_clip_max': None, 'weight_linear_min_weight': 0.05129124981330196, 'weight_linear_max_weight': 4.251887263395819}. Best is trial 258 with value: 0.23592669608374228.
2026-06-01 02:45:39 | INFO | src.nested_cv_avggrm_weighted_unified | Trial 292 | outer=10 | alpha=2.543e+05 n_pcs=3500 (pc_topk) weight_search=on
2026-06-01 02:45:39 | INFO | src.nested_cv_avggrm_weighted_unified | Trial 292 | outer=10 | weight={'name': 'linear', 'floor': 1e-06, 'clip_max': None, 'min_weight': 0.06641267677448477, 'max_weight': 4.2580230815410935}
[I 2026-06-01 02:45:45,022] Trial 292 finished with value: 0.23399277902585935 and parameters: {'alpha': 254264.39087004823, 'n_pcs': 3500, 'weight_scheme': 'linear', 'weight_clip_max': None, 'weight_linear_min_weight': 0.06641267677448477, 'weight_linear_max_weight': 4.2580230815410935}. Best is trial 258 with value: 0.23592669608374228.
2026-06-01 02:45:45 | INFO | src.nested_cv_avggrm_weighted_unified | Trial 293 | outer=10 | alpha=1.452e+05 n_pcs=4000 (pc_topk) weight_search=on
2026-06-01 02:45:45 | INFO | src.nested_cv_avggrm_weighted_unified | Trial 293 | outer=10 | weight={'name': 'linear', 'floor': 1e-06, 'clip_max': None, 'min_weight': 0.061048316684033196, 'max_weight': 4.353126817182768}
[I 2026-06-01 02:45:50,837] Trial 293 finished with value: 0.23583643985618247 and parameters: {'alpha': 145196.80751637035, 'n_pcs': 4000, 'weight_scheme': 'linear', 'weight_clip_max': None, 'weight_linear_min_weight': 0.061048316684033196, 'weight_linear_max_weight': 4.353126817182768}. Best is trial 258 with value: 0.23592669608374228.
2026-06-01 02:45:50 | INFO | src.nested_cv_avggrm_weighted_unified | Trial 294 | outer=10 | alpha=1.339e+05 n_pcs=4000 (pc_topk) weight_search=on
2026-06-01 02:45:50 | INFO | src.nested_cv_avggrm_weighted_unified | Trial 294 | outer=10 | weight={'name': 'uniform', 'floor': 1e-06, 'clip_max': None}
2026-06-01 02:45:54 | INFO | src.nested_cv_avggrm_weighted_unified | Trial 294 | outer=10 | pruned after 7/10 inner folds (mean r=0.2310)
[I 2026-06-01 02:45:54,307] Trial 294 pruned. 
2026-06-01 02:45:54 | INFO | src.nested_cv_avggrm_weighted_unified | Trial 295 | outer=10 | alpha=7.472e+06 n_pcs=4000 (pc_topk) weight_search=on
2026-06-01 02:45:54 | INFO | src.nested_cv_avggrm_weighted_unified | Trial 295 | outer=10 | weight={'name': 'linear', 'floor': 1e-06, 'clip_max': None, 'min_weight': 0.05120104079462476, 'max_weight': 4.062912544796696}
2026-06-01 02:45:57 | INFO | src.nested_cv_avggrm_weighted_unified | Trial 295 | outer=10 | pruned after 5/10 inner folds (mean r=0.2196)
[I 2026-06-01 02:45:57,187] Trial 295 pruned. 
2026-06-01 02:45:57 | INFO | src.nested_cv_avggrm_weighted_unified | Trial 296 | outer=10 | alpha=1.720e+05 n_pcs=4000 (pc_topk) weight_search=on
2026-06-01 02:45:57 | INFO | src.nested_cv_avggrm_weighted_unified | Trial 296 | outer=10 | weight={'name': 'linear', 'floor': 1e-06, 'clip_max': None, 'min_weight': 0.050640405025701, 'max_weight': 4.2016966809026774}
[I 2026-06-01 02:46:02,975] Trial 296 finished with value: 0.23553878544230641 and parameters: {'alpha': 171983.60585685587, 'n_pcs': 4000, 'weight_scheme': 'linear', 'weight_clip_max': None, 'weight_linear_min_weight': 0.050640405025701, 'weight_linear_max_weight': 4.2016966809026774}. Best is trial 258 with value: 0.23592669608374228.
2026-06-01 02:46:02 | INFO | src.nested_cv_avggrm_weighted_unified | Trial 297 | outer=10 | alpha=9.938e+04 n_pcs=4500 (pc_topk) weight_search=on
2026-06-01 02:46:02 | INFO | src.nested_cv_avggrm_weighted_unified | Trial 297 | outer=10 | weight={'name': 'linear', 'floor': 1e-06, 'clip_max': None, 'min_weight': 0.4914446551904743, 'max_weight': 3.9965317184070788}
2026-06-01 02:46:08 | INFO | src.nested_cv_avggrm_weighted_unified | Trial 297 | outer=10 | pruned after 8/10 inner folds (mean r=0.2680)
[I 2026-06-01 02:46:08,593] Trial 297 pruned. 
2026-06-01 02:46:08 | INFO | src.nested_cv_avggrm_weighted_unified | Trial 298 | outer=10 | alpha=1.258e+05 n_pcs=1500 (pc_topk) weight_search=on
2026-06-01 02:46:08 | INFO | src.nested_cv_avggrm_weighted_unified | Trial 298 | outer=10 | weight={'name': 'linear', 'floor': 1e-06, 'clip_max': None, 'min_weight': 0.08349872168723387, 'max_weight': 4.099793775028134}
2026-06-01 02:46:10 | INFO | src.nested_cv_avggrm_weighted_unified | Trial 298 | outer=10 | pruned after 8/10 inner folds (mean r=0.2569)
[I 2026-06-01 02:46:10,779] Trial 298 pruned. 
2026-06-01 02:46:10 | INFO | src.nested_cv_avggrm_weighted_unified | Trial 299 | outer=10 | alpha=7.800e+04 n_pcs=4000 (pc_topk) weight_search=on
2026-06-01 02:46:10 | INFO | src.nested_cv_avggrm_weighted_unified | Trial 299 | outer=10 | weight={'name': 'linear', 'floor': 1e-06, 'clip_max': None, 'min_weight': 0.06911110011028013, 'max_weight': 4.256029839705191}
2026-06-01 02:46:15 | INFO | src.nested_cv_avggrm_weighted_unified | Trial 299 | outer=10 | pruned after 8/10 inner folds (mean r=0.2672)
[I 2026-06-01 02:46:15,547] Trial 299 pruned. 
2026-06-01 02:46:15 | INFO | src.nested_cv_avggrm_weighted_unified | OUTER 10 best (inner mean r=0.2359): {'model_type': 'pc_ridge', 'alpha': 123398.39120846806, 'n_pcs': 4000, 'use_snp_selection': True, 'num_snps': 4000, 'feature_mode': 'pc_topk', 'weighting': {'name': 'linear', 'floor': 1e-06, 'clip_max': None, 'min_weight': 0.07882055876966082, 'max_weight': 4.33844379048533}}
2026-06-01 02:46:16 | INFO | src.nested_cv_avggrm_weighted_unified | OUTER 10 TEST r = 0.1734
2026-06-01 02:46:16 | INFO | src.nested_cv_avggrm_weighted_unified | OUTER 10 incremental summary saved to outputs/final_results/e6_pc_ridge_avggrm/thr_wing/e6_pc_ridge_avggrm_thr_wing_results.json
2026-06-01 02:46:16 | INFO | src.nested_cv_avggrm_weighted_unified | OUTER 11: test_size=173 island=10 (Aldra)
2026-06-01 02:46:16 | INFO | src.nested_cv_avggrm_weighted_unified | OUTER 11: inner LOIO validation islands: 0(Nesøy), 1(Myken), 2(Træna), 3(Selvær), 4(Gjerøy), 5(Hestmannøy), 6(Indre Kvarøy), 7(Onøy og Lurøy), 8(Lovund), 9(Sleneset), 11(Leka), 12(Vega), 13(Vikna), 14(Lauvøya)
2026-06-01 02:46:16 | INFO | src.nested_cv_avggrm_weighted_unified | OUTER 11: using top 10 related inner validation islands for tuning: 4(Gjerøy, avgGRM=0.0011), 7(Onøy og Lurøy, avgGRM=0.0011), 0(Nesøy, avgGRM=-0.0006), 5(Hestmannøy, avgGRM=-0.0021), 6(Indre Kvarøy, avgGRM=-0.0026), 3(Selvær, avgGRM=-0.0035), 1(Myken, avgGRM=-0.0036), 8(Lovund, avgGRM=-0.0039), 12(Vega, avgGRM=-0.0048), 9(Sleneset, avgGRM=-0.0048)
[I 2026-06-01 02:46:16,188] A new study created in memory with name: ridge_inner_outer10
2026-06-01 02:46:16 | INFO | src.nested_cv_avggrm_weighted_unified | Trial 0 | outer=11 | alpha=1.137e+05 n_pcs=4000 (pc_topk) weight_search=on
2026-06-01 02:46:16 | INFO | src.nested_cv_avggrm_weighted_unified | Trial 0 | outer=11 | weight={'name': 'uniform', 'floor': 1e-06, 'clip_max': None}
[I 2026-06-01 02:46:21,203] Trial 0 finished with value: 0.2166419820620154 and parameters: {'alpha': 113703.38004442609, 'n_pcs': 4000, 'weight_scheme': 'uniform', 'weight_clip_max': None}. Best is trial 0 with value: 0.2166419820620154.
2026-06-01 02:46:21 | INFO | src.nested_cv_avggrm_weighted_unified | OUTER 11 | new best trial 0 (mean inner r=0.2166) saved to outputs/final_results/e6_pc_ridge_avggrm/thr_wing/e6_pc_ridge_avggrm_thr_wing_best_trials/split_11_best_trial.json
2026-06-01 02:46:21 | INFO | src.nested_cv_avggrm_weighted_unified | Trial 1 | outer=11 | alpha=1.682e+06 n_pcs=2000 (pc_topk) weight_search=on
2026-06-01 02:46:21 | INFO | src.nested_cv_avggrm_weighted_unified | Trial 1 | outer=11 | weight={'name': 'exponential', 'floor': 1e-06, 'clip_max': 3.0, 'beta': 8.711469579953913}
[I 2026-06-01 02:46:24,016] Trial 1 finished with value: 0.21813850441846747 and parameters: {'alpha': 1682385.170967095, 'n_pcs': 2000, 'weight_scheme': 'exponential', 'weight_clip_max': 3.0, 'weight_exponential_beta': 8.711469579953913}. Best is trial 1 with value: 0.21813850441846747.
2026-06-01 02:46:24 | INFO | src.nested_cv_avggrm_weighted_unified | OUTER 11 | new best trial 1 (mean inner r=0.2181) saved to outputs/final_results/e6_pc_ridge_avggrm/thr_wing/e6_pc_ridge_avggrm_thr_wing_best_trials/split_11_best_trial.json
2026-06-01 02:46:24 | INFO | src.nested_cv_avggrm_weighted_unified | Trial 2 | outer=11 | alpha=2.757e+03 n_pcs=2000 (pc_topk) weight_search=on
2026-06-01 02:46:24 | INFO | src.nested_cv_avggrm_weighted_unified | Trial 2 | outer=11 | weight={'name': 'linear', 'floor': 1e-06, 'clip_max': 20.0, 'min_weight': 0.12918170299726892, 'max_weight': 3.9862564805616327}
[I 2026-06-01 02:46:27,029] Trial 2 finished with value: 0.1573626833386112 and parameters: {'alpha': 2757.0504493185063, 'n_pcs': 2000, 'weight_scheme': 'linear', 'weight_clip_max': 20.0, 'weight_linear_min_weight': 0.12918170299726892, 'weight_linear_max_weight': 3.9862564805616327}. Best is trial 1 with value: 0.21813850441846747.
2026-06-01 02:46:27 | INFO | src.nested_cv_avggrm_weighted_unified | Trial 3 | outer=11 | alpha=1.776e+03 n_pcs=4000 (pc_topk) weight_search=on
2026-06-01 02:46:27 | INFO | src.nested_cv_avggrm_weighted_unified | Trial 3 | outer=11 | weight={'name': 'exponential', 'floor': 1e-06, 'clip_max': 10.0, 'beta': 0.563604612251006}
[I 2026-06-01 02:46:32,985] Trial 3 finished with value: 0.12802621125181607 and parameters: {'alpha': 1775.825123718637, 'n_pcs': 4000, 'weight_scheme': 'exponential', 'weight_clip_max': 10.0, 'weight_exponential_beta': 0.563604612251006}. Best is trial 1 with value: 0.21813850441846747.
2026-06-01 02:46:32 | INFO | src.nested_cv_avggrm_weighted_unified | Trial 4 | outer=11 | alpha=1.835e+04 n_pcs=5000 (pc_topk) weight_search=on
2026-06-01 02:46:32 | INFO | src.nested_cv_avggrm_weighted_unified | Trial 4 | outer=11 | weight={'name': 'exponential', 'floor': 1e-06, 'clip_max': None, 'beta': 9.957095048208117}
[I 2026-06-01 02:46:41,169] Trial 4 finished with value: 0.2089947622397291 and parameters: {'alpha': 18351.68801260339, 'n_pcs': 5000, 'weight_scheme': 'exponential', 'weight_clip_max': None, 'weight_exponential_beta': 9.957095048208117}. Best is trial 1 with value: 0.21813850441846747.
2026-06-01 02:46:41 | INFO | src.nested_cv_avggrm_weighted_unified | Trial 5 | outer=11 | alpha=9.696e+03 n_pcs=1000 (pc_topk) weight_search=on
2026-06-01 02:46:41 | INFO | src.nested_cv_avggrm_weighted_unified | Trial 5 | outer=11 | weight={'name': 'exponential', 'floor': 1e-06, 'clip_max': 3.0, 'beta': 1.5726039441128932}
2026-06-01 02:46:42 | INFO | src.nested_cv_avggrm_weighted_unified | Trial 5 | outer=11 | pruned after 7/10 inner folds (mean r=0.2167)
[I 2026-06-01 02:46:42,441] Trial 5 pruned. 
2026-06-01 02:46:42 | INFO | src.nested_cv_avggrm_weighted_unified | Trial 6 | outer=11 | alpha=6.320e+04 n_pcs=2500 (pc_topk) weight_search=on
2026-06-01 02:46:42 | INFO | src.nested_cv_avggrm_weighted_unified | Trial 6 | outer=11 | weight={'name': 'uniform', 'floor': 1e-06, 'clip_max': 10.0}
[I 2026-06-01 02:46:45,302] Trial 6 finished with value: 0.2211708184413518 and parameters: {'alpha': 63199.5851103866, 'n_pcs': 2500, 'weight_scheme': 'uniform', 'weight_clip_max': 10.0}. Best is trial 6 with value: 0.2211708184413518.
2026-06-01 02:46:45 | INFO | src.nested_cv_avggrm_weighted_unified | OUTER 11 | new best trial 6 (mean inner r=0.2212) saved to outputs/final_results/e6_pc_ridge_avggrm/thr_wing/e6_pc_ridge_avggrm_thr_wing_best_trials/split_11_best_trial.json
2026-06-01 02:46:45 | INFO | src.nested_cv_avggrm_weighted_unified | Trial 7 | outer=11 | alpha=4.681e+04 n_pcs=2500 (pc_topk) weight_search=on
2026-06-01 02:46:45 | INFO | src.nested_cv_avggrm_weighted_unified | Trial 7 | outer=11 | weight={'name': 'linear', 'floor': 1e-06, 'clip_max': 3.0, 'min_weight': 0.13798029304672477, 'max_weight': 3.0957974174373546}
[I 2026-06-01 02:46:48,675] Trial 7 finished with value: 0.22313329173604504 and parameters: {'alpha': 46806.97703257331, 'n_pcs': 2500, 'weight_scheme': 'linear', 'weight_clip_max': 3.0, 'weight_linear_min_weight': 0.13798029304672477, 'weight_linear_max_weight': 3.0957974174373546}. Best is trial 7 with value: 0.22313329173604504.
2026-06-01 02:46:48 | INFO | src.nested_cv_avggrm_weighted_unified | OUTER 11 | new best trial 7 (mean inner r=0.2231) saved to outputs/final_results/e6_pc_ridge_avggrm/thr_wing/e6_pc_ridge_avggrm_thr_wing_best_trials/split_11_best_trial.json
2026-06-01 02:46:48 | INFO | src.nested_cv_avggrm_weighted_unified | Trial 8 | outer=11 | alpha=5.456e+04 n_pcs=3000 (pc_topk) weight_search=on
2026-06-01 02:46:48 | INFO | src.nested_cv_avggrm_weighted_unified | Trial 8 | outer=11 | weight={'name': 'linear', 'floor': 1e-06, 'clip_max': 5.0, 'min_weight': 0.6690067570691431, 'max_weight': 4.8744640334054115}
[I 2026-06-01 02:46:52,607] Trial 8 finished with value: 0.22514969785457137 and parameters: {'alpha': 54559.68395210245, 'n_pcs': 3000, 'weight_scheme': 'linear', 'weight_clip_max': 5.0, 'weight_linear_min_weight': 0.6690067570691431, 'weight_linear_max_weight': 4.8744640334054115}. Best is trial 8 with value: 0.22514969785457137.
2026-06-01 02:46:52 | INFO | src.nested_cv_avggrm_weighted_unified | OUTER 11 | new best trial 8 (mean inner r=0.2251) saved to outputs/final_results/e6_pc_ridge_avggrm/thr_wing/e6_pc_ridge_avggrm_thr_wing_best_trials/split_11_best_trial.json
2026-06-01 02:46:52 | INFO | src.nested_cv_avggrm_weighted_unified | Trial 9 | outer=11 | alpha=8.868e+03 n_pcs=2000 (pc_topk) weight_search=on
2026-06-01 02:46:52 | INFO | src.nested_cv_avggrm_weighted_unified | Trial 9 | outer=11 | weight={'name': 'linear', 'floor': 1e-06, 'clip_max': 20.0, 'min_weight': 0.861124149305412, 'max_weight': 4.702809729786679}
2026-06-01 02:46:54 | INFO | src.nested_cv_avggrm_weighted_unified | Trial 9 | outer=11 | pruned after 6/10 inner folds (mean r=0.1821)
[I 2026-06-01 02:46:54,271] Trial 9 pruned. 
2026-06-01 02:46:54 | INFO | src.nested_cv_avggrm_weighted_unified | Trial 10 | outer=11 | alpha=5.986e+05 n_pcs=500 (pc_topk) weight_search=on
2026-06-01 02:46:54 | INFO | src.nested_cv_avggrm_weighted_unified | Trial 10 | outer=11 | weight={'name': 'linear', 'floor': 1e-06, 'clip_max': 5.0, 'min_weight': 0.6649918033453551, 'max_weight': 1.3005022441588598}
2026-06-01 02:46:54 | INFO | src.nested_cv_avggrm_weighted_unified | Trial 10 | outer=11 | pruned after 5/10 inner folds (mean r=0.1773)
[I 2026-06-01 02:46:54,780] Trial 10 pruned. 
2026-06-01 02:46:54 | INFO | src.nested_cv_avggrm_weighted_unified | Trial 11 | outer=11 | alpha=1.521e+05 n_pcs=3500 (pc_topk) weight_search=on
2026-06-01 02:46:54 | INFO | src.nested_cv_avggrm_weighted_unified | Trial 11 | outer=11 | weight={'name': 'linear', 'floor': 1e-06, 'clip_max': 5.0, 'min_weight': 0.21805052648556972, 'max_weight': 2.6186888191762083}
[I 2026-06-01 02:46:59,840] Trial 11 finished with value: 0.2253102040680785 and parameters: {'alpha': 152073.59892684163, 'n_pcs': 3500, 'weight_scheme': 'linear', 'weight_clip_max': 5.0, 'weight_linear_min_weight': 0.21805052648556972, 'weight_linear_max_weight': 2.6186888191762083}. Best is trial 11 with value: 0.2253102040680785.
2026-06-01 02:46:59 | INFO | src.nested_cv_avggrm_weighted_unified | OUTER 11 | new best trial 11 (mean inner r=0.2253) saved to outputs/final_results/e6_pc_ridge_avggrm/thr_wing/e6_pc_ridge_avggrm_thr_wing_best_trials/split_11_best_trial.json
2026-06-01 02:46:59 | INFO | src.nested_cv_avggrm_weighted_unified | Trial 12 | outer=11 | alpha=3.350e+05 n_pcs=3500 (pc_topk) weight_search=on
2026-06-01 02:46:59 | INFO | src.nested_cv_avggrm_weighted_unified | Trial 12 | outer=11 | weight={'name': 'linear', 'floor': 1e-06, 'clip_max': 5.0, 'min_weight': 0.441330407432163, 'max_weight': 2.2759309186672403}
[I 2026-06-01 02:47:05,027] Trial 12 finished with value: 0.2190871414093712 and parameters: {'alpha': 334975.35321501165, 'n_pcs': 3500, 'weight_scheme': 'linear', 'weight_clip_max': 5.0, 'weight_linear_min_weight': 0.441330407432163, 'weight_linear_max_weight': 2.2759309186672403}. Best is trial 11 with value: 0.2253102040680785.
2026-06-01 02:47:05 | INFO | src.nested_cv_avggrm_weighted_unified | Trial 13 | outer=11 | alpha=9.546e+06 n_pcs=3500 (pc_topk) weight_search=on
2026-06-01 02:47:05 | INFO | src.nested_cv_avggrm_weighted_unified | Trial 13 | outer=11 | weight={'name': 'linear', 'floor': 1e-06, 'clip_max': 5.0, 'min_weight': 0.4665545926042718, 'max_weight': 2.936524498434815}
2026-06-01 02:47:07 | INFO | src.nested_cv_avggrm_weighted_unified | Trial 13 | outer=11 | pruned after 6/10 inner folds (mean r=0.2352)
[I 2026-06-01 02:47:07,911] Trial 13 pruned. 
2026-06-01 02:47:07 | INFO | src.nested_cv_avggrm_weighted_unified | Trial 14 | outer=11 | alpha=1.274e+05 n_pcs=5000 (pc_topk) weight_search=on
2026-06-01 02:47:07 | INFO | src.nested_cv_avggrm_weighted_unified | Trial 14 | outer=11 | weight={'name': 'linear', 'floor': 1e-06, 'clip_max': 5.0, 'min_weight': 0.7048126363943998, 'max_weight': 4.923849368117419}
[I 2026-06-01 02:47:16,147] Trial 14 finished with value: 0.22420093414618517 and parameters: {'alpha': 127392.0944984584, 'n_pcs': 5000, 'weight_scheme': 'linear', 'weight_clip_max': 5.0, 'weight_linear_min_weight': 0.7048126363943998, 'weight_linear_max_weight': 4.923849368117419}. Best is trial 11 with value: 0.2253102040680785.
2026-06-01 02:47:16 | INFO | src.nested_cv_avggrm_weighted_unified | Trial 15 | outer=11 | alpha=1.424e+06 n_pcs=3500 (pc_topk) weight_search=on
2026-06-01 02:47:16 | INFO | src.nested_cv_avggrm_weighted_unified | Trial 15 | outer=11 | weight={'name': 'uniform', 'floor': 1e-06, 'clip_max': 5.0}
2026-06-01 02:47:18 | INFO | src.nested_cv_avggrm_weighted_unified | Trial 15 | outer=11 | pruned after 6/10 inner folds (mean r=0.2229)
[I 2026-06-01 02:47:18,721] Trial 15 pruned. 
2026-06-01 02:47:18 | INFO | src.nested_cv_avggrm_weighted_unified | Trial 16 | outer=11 | alpha=3.083e+05 n_pcs=4500 (pc_topk) weight_search=on
2026-06-01 02:47:18 | INFO | src.nested_cv_avggrm_weighted_unified | Trial 16 | outer=11 | weight={'name': 'linear', 'floor': 1e-06, 'clip_max': 5.0, 'min_weight': 0.35047568558884956, 'max_weight': 2.3401082502805832}
[I 2026-06-01 02:47:25,760] Trial 16 finished with value: 0.21972155156145967 and parameters: {'alpha': 308303.5352774592, 'n_pcs': 4500, 'weight_scheme': 'linear', 'weight_clip_max': 5.0, 'weight_linear_min_weight': 0.35047568558884956, 'weight_linear_max_weight': 2.3401082502805832}. Best is trial 11 with value: 0.2253102040680785.
2026-06-01 02:47:25 | INFO | src.nested_cv_avggrm_weighted_unified | Trial 17 | outer=11 | alpha=2.826e+04 n_pcs=3000 (pc_topk) weight_search=on
2026-06-01 02:47:25 | INFO | src.nested_cv_avggrm_weighted_unified | Trial 17 | outer=11 | weight={'name': 'linear', 'floor': 1e-06, 'clip_max': 5.0, 'min_weight': 0.26453365748575025, 'max_weight': 3.7166959348359123}
[I 2026-06-01 02:47:29,614] Trial 17 finished with value: 0.2163365756116331 and parameters: {'alpha': 28263.525974578948, 'n_pcs': 3000, 'weight_scheme': 'linear', 'weight_clip_max': 5.0, 'weight_linear_min_weight': 0.26453365748575025, 'weight_linear_max_weight': 3.7166959348359123}. Best is trial 11 with value: 0.2253102040680785.
2026-06-01 02:47:29 | INFO | src.nested_cv_avggrm_weighted_unified | Trial 18 | outer=11 | alpha=4.426e+03 n_pcs=3000 (pc_topk) weight_search=on
2026-06-01 02:47:29 | INFO | src.nested_cv_avggrm_weighted_unified | Trial 18 | outer=11 | weight={'name': 'linear', 'floor': 1e-06, 'clip_max': 5.0, 'min_weight': 0.992389344984786, 'max_weight': 1.4399777696564426}
2026-06-01 02:47:31 | INFO | src.nested_cv_avggrm_weighted_unified | Trial 18 | outer=11 | pruned after 6/10 inner folds (mean r=0.1767)
