[I 2026-06-01 17:29:53,049] Trial 104 finished with value: 0.19425325714372504 and parameters: {'alpha': 210106.93521917087, 'n_pcs': 4500, 'iw_method': 'pc_logistic', 'iw_clip_max': 4.0, 'iw_prob_clip': 0.011961969297685998, 'iw_n_components': 10, 'iw_logistic_c': 1.3959457876212045e-05, 'iw_pca_fit': 'combined', 'iw_solver': 'lbfgs', 'iw_rho': 0.7}. Best is trial 92 with value: 0.19905701409120344.
2026-06-01 17:29:53 | INFO | Trial 105 | outer=4 | alpha=1.079e+05 n_pcs=4500 (pc_topk) weight={'name': 'pc_logistic', 'floor': 1e-06, 'clip_max': 4.0, 'prob_clip': 0.017089172166851255, 'n_components': 10, 'logistic_c': 2.602555707295835e-05, 'pca_fit': 'combined', 'solver': 'lbfgs', 'max_iter': 2000, 'fit_intercept': True, 'standardize_with_source': True, 'rho': 0.7}
[I 2026-06-01 17:30:09,973] Trial 105 finished with value: 0.1984143720683784 and parameters: {'alpha': 107906.00187026782, 'n_pcs': 4500, 'iw_method': 'pc_logistic', 'iw_clip_max': 4.0, 'iw_prob_clip': 0.017089172166851255, 'iw_n_components': 10, 'iw_logistic_c': 2.602555707295835e-05, 'iw_pca_fit': 'combined', 'iw_solver': 'lbfgs', 'iw_rho': 0.7}. Best is trial 92 with value: 0.19905701409120344.
2026-06-01 17:30:09 | INFO | Trial 106 | outer=4 | alpha=4.455e+05 n_pcs=4000 (pc_topk) weight={'name': 'pc_logistic', 'floor': 1e-06, 'clip_max': 4.0, 'prob_clip': 0.026446705832497846, 'n_components': 10, 'logistic_c': 2.660777782577412e-05, 'pca_fit': 'combined', 'solver': 'lbfgs', 'max_iter': 2000, 'fit_intercept': True, 'standardize_with_source': True, 'rho': 0.7}
[I 2026-06-01 17:30:27,034] Trial 106 finished with value: 0.18829166743003894 and parameters: {'alpha': 445465.9783737992, 'n_pcs': 4000, 'iw_method': 'pc_logistic', 'iw_clip_max': 4.0, 'iw_prob_clip': 0.026446705832497846, 'iw_n_components': 10, 'iw_logistic_c': 2.660777782577412e-05, 'iw_pca_fit': 'combined', 'iw_solver': 'lbfgs', 'iw_rho': 0.7}. Best is trial 92 with value: 0.19905701409120344.
2026-06-01 17:30:27 | INFO | Trial 107 | outer=4 | alpha=1.024e+05 n_pcs=4500 (pc_topk) weight={'name': 'pc_logistic', 'floor': 1e-06, 'clip_max': 4.0, 'prob_clip': 0.022819960571811328, 'n_components': 10, 'logistic_c': 4.1290797206413946e-05, 'pca_fit': 'combined', 'solver': 'lbfgs', 'max_iter': 2000, 'fit_intercept': True, 'standardize_with_source': True, 'rho': 0.7}
[I 2026-06-01 17:30:42,946] Trial 107 finished with value: 0.19880940478572623 and parameters: {'alpha': 102441.34553769075, 'n_pcs': 4500, 'iw_method': 'pc_logistic', 'iw_clip_max': 4.0, 'iw_prob_clip': 0.022819960571811328, 'iw_n_components': 10, 'iw_logistic_c': 4.1290797206413946e-05, 'iw_pca_fit': 'combined', 'iw_solver': 'lbfgs', 'iw_rho': 0.7}. Best is trial 92 with value: 0.19905701409120344.
2026-06-01 17:30:42 | INFO | Trial 108 | outer=4 | alpha=1.075e+05 n_pcs=4500 (pc_topk) weight={'name': 'pc_logistic', 'floor': 1e-06, 'clip_max': 4.0, 'prob_clip': 0.024842622884030836, 'n_components': 10, 'logistic_c': 3.5890161131233e-06, 'pca_fit': 'combined', 'solver': 'lbfgs', 'max_iter': 2000, 'fit_intercept': True, 'standardize_with_source': True, 'rho': 0.7}
[I 2026-06-01 17:30:58,464] Trial 108 finished with value: 0.19340823225544893 and parameters: {'alpha': 107486.20392122133, 'n_pcs': 4500, 'iw_method': 'pc_logistic', 'iw_clip_max': 4.0, 'iw_prob_clip': 0.024842622884030836, 'iw_n_components': 10, 'iw_logistic_c': 3.5890161131233e-06, 'iw_pca_fit': 'combined', 'iw_solver': 'lbfgs', 'iw_rho': 0.7}. Best is trial 92 with value: 0.19905701409120344.
2026-06-01 17:30:58 | INFO | Trial 109 | outer=4 | alpha=1.410e+05 n_pcs=4000 (pc_topk) weight={'name': 'pc_logistic', 'floor': 1e-06, 'clip_max': 4.0, 'prob_clip': 0.00843478832109943, 'n_components': 10, 'logistic_c': 5.4634731146362e-05, 'pca_fit': 'combined', 'solver': 'lbfgs', 'max_iter': 2000, 'fit_intercept': True, 'standardize_with_source': True, 'rho': 0.7}
[I 2026-06-01 17:31:12,448] Trial 109 finished with value: 0.19686272358564608 and parameters: {'alpha': 141040.1625005142, 'n_pcs': 4000, 'iw_method': 'pc_logistic', 'iw_clip_max': 4.0, 'iw_prob_clip': 0.00843478832109943, 'iw_n_components': 10, 'iw_logistic_c': 5.4634731146362e-05, 'iw_pca_fit': 'combined', 'iw_solver': 'lbfgs', 'iw_rho': 0.7}. Best is trial 92 with value: 0.19905701409120344.
2026-06-01 17:31:12 | INFO | Trial 110 | outer=4 | alpha=9.728e+04 n_pcs=4500 (pc_topk) weight={'name': 'uniform'}
[I 2026-06-01 17:31:21,889] Trial 110 finished with value: 0.1893321417715306 and parameters: {'alpha': 97279.44832764882, 'n_pcs': 4500, 'iw_method': 'uniform'}. Best is trial 92 with value: 0.19905701409120344.
2026-06-01 17:31:21 | INFO | Trial 111 | outer=4 | alpha=6.207e+04 n_pcs=4500 (pc_topk) weight={'name': 'pc_logistic', 'floor': 1e-06, 'clip_max': 4.0, 'prob_clip': 0.01713790143963515, 'n_components': 10, 'logistic_c': 2.2473029816444774e-05, 'pca_fit': 'combined', 'solver': 'lbfgs', 'max_iter': 2000, 'fit_intercept': True, 'standardize_with_source': True, 'rho': 0.7}
[I 2026-06-01 17:31:36,390] Trial 111 finished with value: 0.19887250979251378 and parameters: {'alpha': 62069.69172502716, 'n_pcs': 4500, 'iw_method': 'pc_logistic', 'iw_clip_max': 4.0, 'iw_prob_clip': 0.01713790143963515, 'iw_n_components': 10, 'iw_logistic_c': 2.2473029816444774e-05, 'iw_pca_fit': 'combined', 'iw_solver': 'lbfgs', 'iw_rho': 0.7}. Best is trial 92 with value: 0.19905701409120344.
2026-06-01 17:31:36 | INFO | Trial 112 | outer=4 | alpha=1.624e+05 n_pcs=4500 (pc_topk) weight={'name': 'pc_logistic', 'floor': 1e-06, 'clip_max': 4.0, 'prob_clip': 0.01606687569276349, 'n_components': 10, 'logistic_c': 1.1907959083012288e-05, 'pca_fit': 'combined', 'solver': 'lbfgs', 'max_iter': 2000, 'fit_intercept': True, 'standardize_with_source': True, 'rho': 0.7}
[I 2026-06-01 17:31:51,418] Trial 112 finished with value: 0.19559026599192084 and parameters: {'alpha': 162400.0709048329, 'n_pcs': 4500, 'iw_method': 'pc_logistic', 'iw_clip_max': 4.0, 'iw_prob_clip': 0.01606687569276349, 'iw_n_components': 10, 'iw_logistic_c': 1.1907959083012288e-05, 'iw_pca_fit': 'combined', 'iw_solver': 'lbfgs', 'iw_rho': 0.7}. Best is trial 92 with value: 0.19905701409120344.
2026-06-01 17:31:51 | INFO | Trial 113 | outer=4 | alpha=6.522e+04 n_pcs=4500 (pc_topk) weight={'name': 'pc_logistic', 'floor': 1e-06, 'clip_max': 4.0, 'prob_clip': 0.022739972629718202, 'n_components': 10, 'logistic_c': 2.6152416205653092e-05, 'pca_fit': 'combined', 'solver': 'lbfgs', 'max_iter': 2000, 'fit_intercept': True, 'standardize_with_source': True, 'rho': 0.7}
[I 2026-06-01 17:32:06,153] Trial 113 finished with value: 0.19921246694301206 and parameters: {'alpha': 65224.63482136251, 'n_pcs': 4500, 'iw_method': 'pc_logistic', 'iw_clip_max': 4.0, 'iw_prob_clip': 0.022739972629718202, 'iw_n_components': 10, 'iw_logistic_c': 2.6152416205653092e-05, 'iw_pca_fit': 'combined', 'iw_solver': 'lbfgs', 'iw_rho': 0.7}. Best is trial 113 with value: 0.19921246694301206.
2026-06-01 17:32:06 | INFO | Trial 114 | outer=4 | alpha=1.251e+05 n_pcs=4500 (pc_topk) weight={'name': 'pc_logistic', 'floor': 1e-06, 'clip_max': 4.0, 'prob_clip': 0.022146884065013417, 'n_components': 10, 'logistic_c': 2.451774394779939e-05, 'pca_fit': 'combined', 'solver': 'lbfgs', 'max_iter': 2000, 'fit_intercept': True, 'standardize_with_source': True, 'rho': 0.7}
[I 2026-06-01 17:32:21,318] Trial 114 finished with value: 0.19788311758869498 and parameters: {'alpha': 125130.70168004141, 'n_pcs': 4500, 'iw_method': 'pc_logistic', 'iw_clip_max': 4.0, 'iw_prob_clip': 0.022146884065013417, 'iw_n_components': 10, 'iw_logistic_c': 2.451774394779939e-05, 'iw_pca_fit': 'combined', 'iw_solver': 'lbfgs', 'iw_rho': 0.7}. Best is trial 113 with value: 0.19921246694301206.
2026-06-01 17:32:21 | INFO | Trial 115 | outer=4 | alpha=1.256e+05 n_pcs=4500 (pc_topk) weight={'name': 'pc_logistic', 'floor': 1e-06, 'clip_max': 4.0, 'prob_clip': 0.02310723626519475, 'n_components': 10, 'logistic_c': 1.7704288262323816e-05, 'pca_fit': 'combined', 'solver': 'lbfgs', 'max_iter': 2000, 'fit_intercept': True, 'standardize_with_source': True, 'rho': 0.7}
[I 2026-06-01 17:32:36,927] Trial 115 finished with value: 0.19751244367743287 and parameters: {'alpha': 125585.5316103885, 'n_pcs': 4500, 'iw_method': 'pc_logistic', 'iw_clip_max': 4.0, 'iw_prob_clip': 0.02310723626519475, 'iw_n_components': 10, 'iw_logistic_c': 1.7704288262323816e-05, 'iw_pca_fit': 'combined', 'iw_solver': 'lbfgs', 'iw_rho': 0.7}. Best is trial 113 with value: 0.19921246694301206.
2026-06-01 17:32:36 | INFO | Trial 116 | outer=4 | alpha=3.408e+05 n_pcs=4500 (pc_topk) weight={'name': 'pc_logistic', 'floor': 1e-06, 'clip_max': 4.0, 'prob_clip': 0.028052874001734167, 'n_components': 10, 'logistic_c': 1.925586369938325e-06, 'pca_fit': 'combined', 'solver': 'lbfgs', 'max_iter': 2000, 'fit_intercept': True, 'standardize_with_source': True, 'rho': 0.7}
[I 2026-06-01 17:32:51,854] Trial 116 finished with value: 0.1799790994135512 and parameters: {'alpha': 340805.8505685858, 'n_pcs': 4500, 'iw_method': 'pc_logistic', 'iw_clip_max': 4.0, 'iw_prob_clip': 0.028052874001734167, 'iw_n_components': 10, 'iw_logistic_c': 1.925586369938325e-06, 'iw_pca_fit': 'combined', 'iw_solver': 'lbfgs', 'iw_rho': 0.7}. Best is trial 113 with value: 0.19921246694301206.
2026-06-01 17:32:51 | INFO | Trial 117 | outer=4 | alpha=5.941e+04 n_pcs=4500 (pc_topk) weight={'name': 'pc_logistic', 'floor': 1e-06, 'clip_max': 4.0, 'prob_clip': 0.03093948104223073, 'n_components': 10, 'logistic_c': 5.4886520385477916e-05, 'pca_fit': 'combined', 'solver': 'lbfgs', 'max_iter': 2000, 'fit_intercept': True, 'standardize_with_source': True, 'rho': 0.3}
[I 2026-06-01 17:33:07,901] Trial 117 finished with value: 0.1983015068453832 and parameters: {'alpha': 59409.64054690919, 'n_pcs': 4500, 'iw_method': 'pc_logistic', 'iw_clip_max': 4.0, 'iw_prob_clip': 0.03093948104223073, 'iw_n_components': 10, 'iw_logistic_c': 5.4886520385477916e-05, 'iw_pca_fit': 'combined', 'iw_solver': 'lbfgs', 'iw_rho': 0.3}. Best is trial 113 with value: 0.19921246694301206.
2026-06-01 17:33:07 | INFO | Trial 118 | outer=4 | alpha=2.323e+05 n_pcs=4500 (pc_topk) weight={'name': 'pc_logistic', 'floor': 1e-06, 'clip_max': 4.0, 'prob_clip': 0.04355599080829484, 'n_components': 10, 'logistic_c': 5.835271528871392e-05, 'pca_fit': 'combined', 'solver': 'lbfgs', 'max_iter': 2000, 'fit_intercept': True, 'standardize_with_source': True, 'rho': 0.3}
[I 2026-06-01 17:33:24,188] Trial 118 finished with value: 0.18847603920272496 and parameters: {'alpha': 232295.33025839683, 'n_pcs': 4500, 'iw_method': 'pc_logistic', 'iw_clip_max': 4.0, 'iw_prob_clip': 0.04355599080829484, 'iw_n_components': 10, 'iw_logistic_c': 5.835271528871392e-05, 'iw_pca_fit': 'combined', 'iw_solver': 'lbfgs', 'iw_rho': 0.3}. Best is trial 113 with value: 0.19921246694301206.
2026-06-01 17:33:24 | INFO | Trial 119 | outer=4 | alpha=1.061e+05 n_pcs=4500 (pc_topk) weight={'name': 'pc_logistic', 'floor': 1e-06, 'clip_max': 4.0, 'prob_clip': 0.032849357631397604, 'n_components': 10, 'logistic_c': 0.0002459570927475226, 'pca_fit': 'combined', 'solver': 'lbfgs', 'max_iter': 2000, 'fit_intercept': True, 'standardize_with_source': True, 'rho': 0.3}
[I 2026-06-01 17:33:43,803] Trial 119 finished with value: 0.19598518042417543 and parameters: {'alpha': 106104.78368740914, 'n_pcs': 4500, 'iw_method': 'pc_logistic', 'iw_clip_max': 4.0, 'iw_prob_clip': 0.032849357631397604, 'iw_n_components': 10, 'iw_logistic_c': 0.0002459570927475226, 'iw_pca_fit': 'combined', 'iw_solver': 'lbfgs', 'iw_rho': 0.3}. Best is trial 113 with value: 0.19921246694301206.
2026-06-01 17:33:43 | INFO | Trial 120 | outer=4 | alpha=3.523e+04 n_pcs=4500 (pc_topk) weight={'name': 'pc_logistic', 'floor': 1e-06, 'clip_max': 4.0, 'prob_clip': 0.024225883696832064, 'n_components': 10, 'logistic_c': 2.0700126305740374e-05, 'pca_fit': 'combined', 'solver': 'lbfgs', 'max_iter': 2000, 'fit_intercept': True, 'standardize_with_source': True, 'rho': 0.3}
[I 2026-06-01 17:33:59,177] Trial 120 finished with value: 0.19742482151476973 and parameters: {'alpha': 35229.86650054366, 'n_pcs': 4500, 'iw_method': 'pc_logistic', 'iw_clip_max': 4.0, 'iw_prob_clip': 0.024225883696832064, 'iw_n_components': 10, 'iw_logistic_c': 2.0700126305740374e-05, 'iw_pca_fit': 'combined', 'iw_solver': 'lbfgs', 'iw_rho': 0.3}. Best is trial 113 with value: 0.19921246694301206.
2026-06-01 17:33:59 | INFO | Trial 121 | outer=4 | alpha=5.661e+04 n_pcs=4500 (pc_topk) weight={'name': 'pc_logistic', 'floor': 1e-06, 'clip_max': 4.0, 'prob_clip': 0.021034677881709343, 'n_components': 80, 'logistic_c': 4.4942526825058985e-05, 'pca_fit': 'combined', 'solver': 'lbfgs', 'max_iter': 2000, 'fit_intercept': True, 'standardize_with_source': True, 'rho': 0.7}
[I 2026-06-01 17:34:16,311] Trial 121 finished with value: 0.1984811633303594 and parameters: {'alpha': 56610.45218365509, 'n_pcs': 4500, 'iw_method': 'pc_logistic', 'iw_clip_max': 4.0, 'iw_prob_clip': 0.021034677881709343, 'iw_n_components': 80, 'iw_logistic_c': 4.4942526825058985e-05, 'iw_pca_fit': 'combined', 'iw_solver': 'lbfgs', 'iw_rho': 0.7}. Best is trial 113 with value: 0.19921246694301206.
2026-06-01 17:34:16 | INFO | Trial 122 | outer=4 | alpha=5.730e+04 n_pcs=4500 (pc_topk) weight={'name': 'pc_logistic', 'floor': 1e-06, 'clip_max': 4.0, 'prob_clip': 0.021053005158012103, 'n_components': 80, 'logistic_c': 4.567394763636517e-05, 'pca_fit': 'combined', 'solver': 'lbfgs', 'max_iter': 2000, 'fit_intercept': True, 'standardize_with_source': True, 'rho': 0.3}
[I 2026-06-01 17:34:32,990] Trial 122 finished with value: 0.19850626169009197 and parameters: {'alpha': 57300.513559764426, 'n_pcs': 4500, 'iw_method': 'pc_logistic', 'iw_clip_max': 4.0, 'iw_prob_clip': 0.021053005158012103, 'iw_n_components': 80, 'iw_logistic_c': 4.567394763636517e-05, 'iw_pca_fit': 'combined', 'iw_solver': 'lbfgs', 'iw_rho': 0.3}. Best is trial 113 with value: 0.19921246694301206.
2026-06-01 17:34:33 | INFO | Trial 123 | outer=4 | alpha=5.256e+04 n_pcs=4500 (pc_topk) weight={'name': 'pc_logistic', 'floor': 1e-06, 'clip_max': 4.0, 'prob_clip': 0.014083936775589534, 'n_components': 80, 'logistic_c': 8.283694986008343e-05, 'pca_fit': 'combined', 'solver': 'lbfgs', 'max_iter': 2000, 'fit_intercept': True, 'standardize_with_source': True, 'rho': 0.3}
[I 2026-06-01 17:34:50,275] Trial 123 finished with value: 0.1977283698749689 and parameters: {'alpha': 52555.95501403436, 'n_pcs': 4500, 'iw_method': 'pc_logistic', 'iw_clip_max': 4.0, 'iw_prob_clip': 0.014083936775589534, 'iw_n_components': 80, 'iw_logistic_c': 8.283694986008343e-05, 'iw_pca_fit': 'combined', 'iw_solver': 'lbfgs', 'iw_rho': 0.3}. Best is trial 113 with value: 0.19921246694301206.
2026-06-01 17:34:50 | INFO | Trial 124 | outer=4 | alpha=2.782e+04 n_pcs=4000 (pc_topk) weight={'name': 'pc_logistic', 'floor': 1e-06, 'clip_max': 4.0, 'prob_clip': 0.029859122007583585, 'n_components': 80, 'logistic_c': 1.120622836217819e-05, 'pca_fit': 'combined', 'solver': 'lbfgs', 'max_iter': 2000, 'fit_intercept': True, 'standardize_with_source': True, 'rho': 0.3}
[I 2026-06-01 17:35:08,136] Trial 124 finished with value: 0.19228461193414098 and parameters: {'alpha': 27822.570338139354, 'n_pcs': 4000, 'iw_method': 'pc_logistic', 'iw_clip_max': 4.0, 'iw_prob_clip': 0.029859122007583585, 'iw_n_components': 80, 'iw_logistic_c': 1.120622836217819e-05, 'iw_pca_fit': 'combined', 'iw_solver': 'lbfgs', 'iw_rho': 0.3}. Best is trial 113 with value: 0.19921246694301206.
2026-06-01 17:35:08 | INFO | Trial 125 | outer=4 | alpha=4.588e+04 n_pcs=4500 (pc_topk) weight={'name': 'pc_logistic', 'floor': 1e-06, 'clip_max': 4.0, 'prob_clip': 0.016675208790367574, 'n_components': 80, 'logistic_c': 4.896287424499204e-05, 'pca_fit': 'combined', 'solver': 'lbfgs', 'max_iter': 2000, 'fit_intercept': True, 'standardize_with_source': True, 'rho': 0.3}
[I 2026-06-01 17:35:24,902] Trial 125 finished with value: 0.19792532442813626 and parameters: {'alpha': 45875.83409849731, 'n_pcs': 4500, 'iw_method': 'pc_logistic', 'iw_clip_max': 4.0, 'iw_prob_clip': 0.016675208790367574, 'iw_n_components': 80, 'iw_logistic_c': 4.896287424499204e-05, 'iw_pca_fit': 'combined', 'iw_solver': 'lbfgs', 'iw_rho': 0.3}. Best is trial 113 with value: 0.19921246694301206.
2026-06-01 17:35:24 | INFO | Trial 126 | outer=4 | alpha=4.460e+04 n_pcs=1500 (pc_topk) weight={'name': 'pc_logistic', 'floor': 1e-06, 'clip_max': 4.0, 'prob_clip': 0.015214435277384057, 'n_components': 80, 'logistic_c': 4.963741470698203e-05, 'pca_fit': 'combined', 'solver': 'lbfgs', 'max_iter': 2000, 'fit_intercept': True, 'standardize_with_source': True, 'rho': 0.3}
[I 2026-06-01 17:35:33,715] Trial 126 finished with value: 0.18580716093886687 and parameters: {'alpha': 44596.7612755272, 'n_pcs': 1500, 'iw_method': 'pc_logistic', 'iw_clip_max': 4.0, 'iw_prob_clip': 0.015214435277384057, 'iw_n_components': 80, 'iw_logistic_c': 4.963741470698203e-05, 'iw_pca_fit': 'combined', 'iw_solver': 'lbfgs', 'iw_rho': 0.3}. Best is trial 113 with value: 0.19921246694301206.
2026-06-01 17:35:33 | INFO | Trial 127 | outer=4 | alpha=2.126e+04 n_pcs=4500 (pc_topk) weight={'name': 'pc_logistic', 'floor': 1e-06, 'clip_max': 4.0, 'prob_clip': 0.01757317079000114, 'n_components': 80, 'logistic_c': 0.0001990790527589963, 'pca_fit': 'combined', 'solver': 'lbfgs', 'max_iter': 2000, 'fit_intercept': True, 'standardize_with_source': True, 'rho': 0.3}
[I 2026-06-01 17:35:49,485] Trial 127 finished with value: 0.19154882078421592 and parameters: {'alpha': 21258.85836763129, 'n_pcs': 4500, 'iw_method': 'pc_logistic', 'iw_clip_max': 4.0, 'iw_prob_clip': 0.01757317079000114, 'iw_n_components': 80, 'iw_logistic_c': 0.0001990790527589963, 'iw_pca_fit': 'combined', 'iw_solver': 'lbfgs', 'iw_rho': 0.3}. Best is trial 113 with value: 0.19921246694301206.
2026-06-01 17:35:49 | INFO | Trial 128 | outer=4 | alpha=5.864e+04 n_pcs=4000 (pc_topk) weight={'name': 'pc_logistic', 'floor': 1e-06, 'clip_max': 4.0, 'prob_clip': 0.006625291955391172, 'n_components': 80, 'logistic_c': 5.387869667663305e-06, 'pca_fit': 'combined', 'solver': 'lbfgs', 'max_iter': 2000, 'fit_intercept': True, 'standardize_with_source': True, 'rho': 0.3}
[I 2026-06-01 17:36:02,126] Trial 128 finished with value: 0.19410553514428103 and parameters: {'alpha': 58640.56723687049, 'n_pcs': 4000, 'iw_method': 'pc_logistic', 'iw_clip_max': 4.0, 'iw_prob_clip': 0.006625291955391172, 'iw_n_components': 80, 'iw_logistic_c': 5.387869667663305e-06, 'iw_pca_fit': 'combined', 'iw_solver': 'lbfgs', 'iw_rho': 0.3}. Best is trial 113 with value: 0.19921246694301206.
2026-06-01 17:36:02 | INFO | Trial 129 | outer=4 | alpha=3.412e+04 n_pcs=4500 (pc_topk) weight={'name': 'uniform'}
[I 2026-06-01 17:36:11,464] Trial 129 finished with value: 0.19438237379357712 and parameters: {'alpha': 34117.33823458496, 'n_pcs': 4500, 'iw_method': 'uniform'}. Best is trial 113 with value: 0.19921246694301206.
2026-06-01 17:36:11 | INFO | Trial 130 | outer=4 | alpha=4.749e+04 n_pcs=4500 (pc_topk) weight={'name': 'pc_logistic', 'floor': 1e-06, 'clip_max': 4.0, 'prob_clip': 0.016840429187643714, 'n_components': 80, 'logistic_c': 8.793241001002671e-05, 'pca_fit': 'combined', 'solver': 'lbfgs', 'max_iter': 2000, 'fit_intercept': True, 'standardize_with_source': True, 'rho': 0.3}
[I 2026-06-01 17:36:28,029] Trial 130 finished with value: 0.19756266521569005 and parameters: {'alpha': 47490.40441121378, 'n_pcs': 4500, 'iw_method': 'pc_logistic', 'iw_clip_max': 4.0, 'iw_prob_clip': 0.016840429187643714, 'iw_n_components': 80, 'iw_logistic_c': 8.793241001002671e-05, 'iw_pca_fit': 'combined', 'iw_solver': 'lbfgs', 'iw_rho': 0.3}. Best is trial 113 with value: 0.19921246694301206.
2026-06-01 17:36:28 | INFO | Trial 131 | outer=4 | alpha=8.650e+04 n_pcs=4500 (pc_topk) weight={'name': 'pc_logistic', 'floor': 1e-06, 'clip_max': 4.0, 'prob_clip': 0.02016403576317548, 'n_components': 80, 'logistic_c': 2.7348947583939015e-05, 'pca_fit': 'combined', 'solver': 'lbfgs', 'max_iter': 2000, 'fit_intercept': True, 'standardize_with_source': True, 'rho': 1.0}
[I 2026-06-01 17:36:44,321] Trial 131 finished with value: 0.19863594581960498 and parameters: {'alpha': 86502.24685296982, 'n_pcs': 4500, 'iw_method': 'pc_logistic', 'iw_clip_max': 4.0, 'iw_prob_clip': 0.02016403576317548, 'iw_n_components': 80, 'iw_logistic_c': 2.7348947583939015e-05, 'iw_pca_fit': 'combined', 'iw_solver': 'lbfgs', 'iw_rho': 1.0}. Best is trial 113 with value: 0.19921246694301206.
2026-06-01 17:36:44 | INFO | Trial 132 | outer=4 | alpha=9.305e+04 n_pcs=4500 (pc_topk) weight={'name': 'pc_logistic', 'floor': 1e-06, 'clip_max': 4.0, 'prob_clip': 0.01940791351137019, 'n_components': 80, 'logistic_c': 3.060637808998246e-05, 'pca_fit': 'combined', 'solver': 'lbfgs', 'max_iter': 2000, 'fit_intercept': True, 'standardize_with_source': True, 'rho': 1.0}
[I 2026-06-01 17:37:02,859] Trial 132 finished with value: 0.19840221850011058 and parameters: {'alpha': 93045.33926713614, 'n_pcs': 4500, 'iw_method': 'pc_logistic', 'iw_clip_max': 4.0, 'iw_prob_clip': 0.01940791351137019, 'iw_n_components': 80, 'iw_logistic_c': 3.060637808998246e-05, 'iw_pca_fit': 'combined', 'iw_solver': 'lbfgs', 'iw_rho': 1.0}. Best is trial 113 with value: 0.19921246694301206.
2026-06-01 17:37:02 | INFO | Trial 133 | outer=4 | alpha=7.882e+04 n_pcs=4500 (pc_topk) weight={'name': 'pc_logistic', 'floor': 1e-06, 'clip_max': 12.0, 'prob_clip': 0.020133517680213785, 'n_components': 80, 'logistic_c': 3.012698931986901e-05, 'pca_fit': 'combined', 'solver': 'lbfgs', 'max_iter': 2000, 'fit_intercept': True, 'standardize_with_source': True, 'rho': 1.0}
