[I 2026-06-01 01:59:18,275] Trial 278 pruned. 
2026-06-01 01:59:18 | INFO | src.nested_cv_avggrm_weighted_unified | Trial 279 | outer=8 | alpha=2.127e+05 n_pcs=4000 (pc_topk) weight_search=on
2026-06-01 01:59:18 | INFO | src.nested_cv_avggrm_weighted_unified | Trial 279 | outer=8 | weight={'name': 'exponential', 'floor': 1e-06, 'clip_max': 5.0, 'beta': 5.038436660199382}
[I 2026-06-01 01:59:23,948] Trial 279 finished with value: 0.2228232027127471 and parameters: {'alpha': 212706.6770385948, 'n_pcs': 4000, 'weight_scheme': 'exponential', 'weight_clip_max': 5.0, 'weight_exponential_beta': 5.038436660199382}. Best is trial 67 with value: 0.22356194409955688.
2026-06-01 01:59:23 | INFO | src.nested_cv_avggrm_weighted_unified | Trial 280 | outer=8 | alpha=3.160e+05 n_pcs=4500 (pc_topk) weight_search=on
2026-06-01 01:59:23 | INFO | src.nested_cv_avggrm_weighted_unified | Trial 280 | outer=8 | weight={'name': 'exponential', 'floor': 1e-06, 'clip_max': 5.0, 'beta': 7.93620556246524}
[I 2026-06-01 01:59:30,803] Trial 280 finished with value: 0.22149524883721164 and parameters: {'alpha': 315981.3348207895, 'n_pcs': 4500, 'weight_scheme': 'exponential', 'weight_clip_max': 5.0, 'weight_exponential_beta': 7.93620556246524}. Best is trial 67 with value: 0.22356194409955688.
2026-06-01 01:59:30 | INFO | src.nested_cv_avggrm_weighted_unified | Trial 281 | outer=8 | alpha=8.727e+04 n_pcs=5000 (pc_topk) weight_search=on
2026-06-01 01:59:30 | INFO | src.nested_cv_avggrm_weighted_unified | Trial 281 | outer=8 | weight={'name': 'exponential', 'floor': 1e-06, 'clip_max': 5.0, 'beta': 5.247110843244287}
[I 2026-06-01 01:59:38,867] Trial 281 finished with value: 0.22113058834964489 and parameters: {'alpha': 87273.65869901818, 'n_pcs': 5000, 'weight_scheme': 'exponential', 'weight_clip_max': 5.0, 'weight_exponential_beta': 5.247110843244287}. Best is trial 67 with value: 0.22356194409955688.
2026-06-01 01:59:38 | INFO | src.nested_cv_avggrm_weighted_unified | Trial 282 | outer=8 | alpha=1.085e+05 n_pcs=4000 (pc_topk) weight_search=on
2026-06-01 01:59:38 | INFO | src.nested_cv_avggrm_weighted_unified | Trial 282 | outer=8 | weight={'name': 'exponential', 'floor': 1e-06, 'clip_max': 5.0, 'beta': 5.405957277103798}
[I 2026-06-01 01:59:44,556] Trial 282 finished with value: 0.22270847816432235 and parameters: {'alpha': 108544.6775951518, 'n_pcs': 4000, 'weight_scheme': 'exponential', 'weight_clip_max': 5.0, 'weight_exponential_beta': 5.405957277103798}. Best is trial 67 with value: 0.22356194409955688.
2026-06-01 01:59:44 | INFO | src.nested_cv_avggrm_weighted_unified | Trial 283 | outer=8 | alpha=2.572e+05 n_pcs=1500 (pc_topk) weight_search=on
2026-06-01 01:59:44 | INFO | src.nested_cv_avggrm_weighted_unified | Trial 283 | outer=8 | weight={'name': 'exponential', 'floor': 1e-06, 'clip_max': 5.0, 'beta': 5.108966818819754}
[I 2026-06-01 01:59:46,260] Trial 283 finished with value: 0.21606799637555504 and parameters: {'alpha': 257204.56238449668, 'n_pcs': 1500, 'weight_scheme': 'exponential', 'weight_clip_max': 5.0, 'weight_exponential_beta': 5.108966818819754}. Best is trial 67 with value: 0.22356194409955688.
2026-06-01 01:59:46 | INFO | src.nested_cv_avggrm_weighted_unified | Trial 284 | outer=8 | alpha=1.558e+05 n_pcs=3500 (pc_topk) weight_search=on
2026-06-01 01:59:46 | INFO | src.nested_cv_avggrm_weighted_unified | Trial 284 | outer=8 | weight={'name': 'exponential', 'floor': 1e-06, 'clip_max': 5.0, 'beta': 4.764156249242611}
[I 2026-06-01 01:59:51,127] Trial 284 finished with value: 0.22181531020405282 and parameters: {'alpha': 155767.47714836456, 'n_pcs': 3500, 'weight_scheme': 'exponential', 'weight_clip_max': 5.0, 'weight_exponential_beta': 4.764156249242611}. Best is trial 67 with value: 0.22356194409955688.
2026-06-01 01:59:51 | INFO | src.nested_cv_avggrm_weighted_unified | Trial 285 | outer=8 | alpha=2.002e+05 n_pcs=4000 (pc_topk) weight_search=on
2026-06-01 01:59:51 | INFO | src.nested_cv_avggrm_weighted_unified | Trial 285 | outer=8 | weight={'name': 'exponential', 'floor': 1e-06, 'clip_max': 5.0, 'beta': 5.4602853838042575}
[I 2026-06-01 01:59:56,819] Trial 285 finished with value: 0.22302262488414124 and parameters: {'alpha': 200186.51067869237, 'n_pcs': 4000, 'weight_scheme': 'exponential', 'weight_clip_max': 5.0, 'weight_exponential_beta': 5.4602853838042575}. Best is trial 67 with value: 0.22356194409955688.
2026-06-01 01:59:56 | INFO | src.nested_cv_avggrm_weighted_unified | Trial 286 | outer=8 | alpha=1.322e+05 n_pcs=4000 (pc_topk) weight_search=on
2026-06-01 01:59:56 | INFO | src.nested_cv_avggrm_weighted_unified | Trial 286 | outer=8 | weight={'name': 'exponential', 'floor': 1e-06, 'clip_max': 3.0, 'beta': 5.228706014442122}
[I 2026-06-01 02:00:02,501] Trial 286 finished with value: 0.2228623703255211 and parameters: {'alpha': 132210.53094704868, 'n_pcs': 4000, 'weight_scheme': 'exponential', 'weight_clip_max': 3.0, 'weight_exponential_beta': 5.228706014442122}. Best is trial 67 with value: 0.22356194409955688.
2026-06-01 02:00:02 | INFO | src.nested_cv_avggrm_weighted_unified | Trial 287 | outer=8 | alpha=1.690e+05 n_pcs=4000 (pc_topk) weight_search=on
2026-06-01 02:00:02 | INFO | src.nested_cv_avggrm_weighted_unified | Trial 287 | outer=8 | weight={'name': 'exponential', 'floor': 1e-06, 'clip_max': 5.0, 'beta': 4.915466742949441}
[I 2026-06-01 02:00:08,198] Trial 287 finished with value: 0.22298523994202107 and parameters: {'alpha': 169003.92279878285, 'n_pcs': 4000, 'weight_scheme': 'exponential', 'weight_clip_max': 5.0, 'weight_exponential_beta': 4.915466742949441}. Best is trial 67 with value: 0.22356194409955688.
2026-06-01 02:00:08 | INFO | src.nested_cv_avggrm_weighted_unified | Trial 288 | outer=8 | alpha=2.049e+05 n_pcs=4000 (pc_topk) weight_search=on
2026-06-01 02:00:08 | INFO | src.nested_cv_avggrm_weighted_unified | Trial 288 | outer=8 | weight={'name': 'exponential', 'floor': 1e-06, 'clip_max': 5.0, 'beta': 5.4619024292983696}
[I 2026-06-01 02:00:13,904] Trial 288 finished with value: 0.22300267787581282 and parameters: {'alpha': 204934.9792086921, 'n_pcs': 4000, 'weight_scheme': 'exponential', 'weight_clip_max': 5.0, 'weight_exponential_beta': 5.4619024292983696}. Best is trial 67 with value: 0.22356194409955688.
2026-06-01 02:00:13 | INFO | src.nested_cv_avggrm_weighted_unified | Trial 289 | outer=8 | alpha=1.347e+05 n_pcs=4000 (pc_topk) weight_search=on
2026-06-01 02:00:13 | INFO | src.nested_cv_avggrm_weighted_unified | Trial 289 | outer=8 | weight={'name': 'exponential', 'floor': 1e-06, 'clip_max': 5.0, 'beta': 5.028445611803512}
[I 2026-06-01 02:00:19,614] Trial 289 finished with value: 0.22306011763211336 and parameters: {'alpha': 134668.61919548543, 'n_pcs': 4000, 'weight_scheme': 'exponential', 'weight_clip_max': 5.0, 'weight_exponential_beta': 5.028445611803512}. Best is trial 67 with value: 0.22356194409955688.
2026-06-01 02:00:19 | INFO | src.nested_cv_avggrm_weighted_unified | Trial 290 | outer=8 | alpha=1.061e+05 n_pcs=4000 (pc_topk) weight_search=on
2026-06-01 02:00:19 | INFO | src.nested_cv_avggrm_weighted_unified | Trial 290 | outer=8 | weight={'name': 'exponential', 'floor': 1e-06, 'clip_max': 5.0, 'beta': 4.950859960634334}
[I 2026-06-01 02:00:25,316] Trial 290 finished with value: 0.2228146796066528 and parameters: {'alpha': 106125.54497164242, 'n_pcs': 4000, 'weight_scheme': 'exponential', 'weight_clip_max': 5.0, 'weight_exponential_beta': 4.950859960634334}. Best is trial 67 with value: 0.22356194409955688.
2026-06-01 02:00:25 | INFO | src.nested_cv_avggrm_weighted_unified | Trial 291 | outer=8 | alpha=1.248e+05 n_pcs=4000 (pc_topk) weight_search=on
2026-06-01 02:00:25 | INFO | src.nested_cv_avggrm_weighted_unified | Trial 291 | outer=8 | weight={'name': 'exponential', 'floor': 1e-06, 'clip_max': 5.0, 'beta': 9.312821773340136}
[I 2026-06-01 02:00:30,969] Trial 291 finished with value: 0.21803634731064941 and parameters: {'alpha': 124780.1846063474, 'n_pcs': 4000, 'weight_scheme': 'exponential', 'weight_clip_max': 5.0, 'weight_exponential_beta': 9.312821773340136}. Best is trial 67 with value: 0.22356194409955688.
2026-06-01 02:00:30 | INFO | src.nested_cv_avggrm_weighted_unified | Trial 292 | outer=8 | alpha=1.426e+05 n_pcs=500 (pc_topk) weight_search=on
2026-06-01 02:00:30 | INFO | src.nested_cv_avggrm_weighted_unified | Trial 292 | outer=8 | weight={'name': 'exponential', 'floor': 1e-06, 'clip_max': 5.0, 'beta': 5.153868722624212}
2026-06-01 02:00:31 | INFO | src.nested_cv_avggrm_weighted_unified | Trial 292 | outer=8 | pruned after 5/10 inner folds (mean r=0.1889)
[I 2026-06-01 02:00:31,413] Trial 292 pruned. 
2026-06-01 02:00:31 | INFO | src.nested_cv_avggrm_weighted_unified | Trial 293 | outer=8 | alpha=8.329e+04 n_pcs=3500 (pc_topk) weight_search=on
2026-06-01 02:00:31 | INFO | src.nested_cv_avggrm_weighted_unified | Trial 293 | outer=8 | weight={'name': 'exponential', 'floor': 1e-06, 'clip_max': 5.0, 'beta': 5.0477784978926135}
[I 2026-06-01 02:00:36,753] Trial 293 finished with value: 0.22014243169779135 and parameters: {'alpha': 83294.84691911207, 'n_pcs': 3500, 'weight_scheme': 'exponential', 'weight_clip_max': 5.0, 'weight_exponential_beta': 5.0477784978926135}. Best is trial 67 with value: 0.22356194409955688.
2026-06-01 02:00:36 | INFO | src.nested_cv_avggrm_weighted_unified | Trial 294 | outer=8 | alpha=1.623e+05 n_pcs=4000 (pc_topk) weight_search=on
2026-06-01 02:00:36 | INFO | src.nested_cv_avggrm_weighted_unified | Trial 294 | outer=8 | weight={'name': 'exponential', 'floor': 1e-06, 'clip_max': 5.0, 'beta': 4.536641797551188}
[I 2026-06-01 02:00:42,460] Trial 294 finished with value: 0.2227411258247308 and parameters: {'alpha': 162313.17976712613, 'n_pcs': 4000, 'weight_scheme': 'exponential', 'weight_clip_max': 5.0, 'weight_exponential_beta': 4.536641797551188}. Best is trial 67 with value: 0.22356194409955688.
2026-06-01 02:00:42 | INFO | src.nested_cv_avggrm_weighted_unified | Trial 295 | outer=8 | alpha=2.568e+06 n_pcs=4000 (pc_topk) weight_search=on
2026-06-01 02:00:42 | INFO | src.nested_cv_avggrm_weighted_unified | Trial 295 | outer=8 | weight={'name': 'exponential', 'floor': 1e-06, 'clip_max': None, 'beta': 5.276174648214178}
2026-06-01 02:00:45 | INFO | src.nested_cv_avggrm_weighted_unified | Trial 295 | outer=8 | pruned after 5/10 inner folds (mean r=0.2024)
[I 2026-06-01 02:00:45,293] Trial 295 pruned. 
2026-06-01 02:00:45 | INFO | src.nested_cv_avggrm_weighted_unified | Trial 296 | outer=8 | alpha=1.163e+05 n_pcs=4000 (pc_topk) weight_search=on
2026-06-01 02:00:45 | INFO | src.nested_cv_avggrm_weighted_unified | Trial 296 | outer=8 | weight={'name': 'exponential', 'floor': 1e-06, 'clip_max': 5.0, 'beta': 4.74369466061601}
[I 2026-06-01 02:00:51,044] Trial 296 finished with value: 0.22288432454185753 and parameters: {'alpha': 116300.06478153881, 'n_pcs': 4000, 'weight_scheme': 'exponential', 'weight_clip_max': 5.0, 'weight_exponential_beta': 4.74369466061601}. Best is trial 67 with value: 0.22356194409955688.
2026-06-01 02:00:51 | INFO | src.nested_cv_avggrm_weighted_unified | Trial 297 | outer=8 | alpha=1.418e+05 n_pcs=4000 (pc_topk) weight_search=on
2026-06-01 02:00:51 | INFO | src.nested_cv_avggrm_weighted_unified | Trial 297 | outer=8 | weight={'name': 'exponential', 'floor': 1e-06, 'clip_max': 5.0, 'beta': 5.455746014641082}
[I 2026-06-01 02:00:57,307] Trial 297 finished with value: 0.2230389866300589 and parameters: {'alpha': 141833.1090294852, 'n_pcs': 4000, 'weight_scheme': 'exponential', 'weight_clip_max': 5.0, 'weight_exponential_beta': 5.455746014641082}. Best is trial 67 with value: 0.22356194409955688.
2026-06-01 02:00:57 | INFO | src.nested_cv_avggrm_weighted_unified | Trial 298 | outer=8 | alpha=2.464e+05 n_pcs=2500 (pc_topk) weight_search=on
2026-06-01 02:00:57 | INFO | src.nested_cv_avggrm_weighted_unified | Trial 298 | outer=8 | weight={'name': 'exponential', 'floor': 1e-06, 'clip_max': 5.0, 'beta': 5.250915607658217}
[I 2026-06-01 02:01:00,489] Trial 298 finished with value: 0.21967033215667198 and parameters: {'alpha': 246436.18032716613, 'n_pcs': 2500, 'weight_scheme': 'exponential', 'weight_clip_max': 5.0, 'weight_exponential_beta': 5.250915607658217}. Best is trial 67 with value: 0.22356194409955688.
2026-06-01 02:01:00 | INFO | src.nested_cv_avggrm_weighted_unified | Trial 299 | outer=8 | alpha=1.925e+05 n_pcs=4000 (pc_topk) weight_search=on
2026-06-01 02:01:00 | INFO | src.nested_cv_avggrm_weighted_unified | Trial 299 | outer=8 | weight={'name': 'uniform', 'floor': 1e-06, 'clip_max': 5.0}
2026-06-01 02:01:03 | INFO | src.nested_cv_avggrm_weighted_unified | Trial 299 | outer=8 | pruned after 5/10 inner folds (mean r=0.2119)
[I 2026-06-01 02:01:03,423] Trial 299 pruned. 
2026-06-01 02:01:03 | INFO | src.nested_cv_avggrm_weighted_unified | OUTER 8 best (inner mean r=0.2236): {'model_type': 'pc_ridge', 'alpha': 242708.89319664153, 'n_pcs': 4000, 'use_snp_selection': True, 'num_snps': 4000, 'feature_mode': 'pc_topk', 'weighting': {'name': 'exponential', 'floor': 1e-06, 'clip_max': 3.0, 'beta': 8.10058390652623}}
2026-06-01 02:01:03 | INFO | src.nested_cv_avggrm_weighted_unified | OUTER 8 TEST r = 0.4105
2026-06-01 02:01:03 | INFO | src.nested_cv_avggrm_weighted_unified | OUTER 8 incremental summary saved to outputs/final_results/e6_pc_ridge_avggrm/thr_wing/e6_pc_ridge_avggrm_thr_wing_results.json
2026-06-01 02:01:03 | INFO | src.nested_cv_avggrm_weighted_unified | OUTER 9: test_size=151 island=8 (Lovund)
2026-06-01 02:01:03 | INFO | src.nested_cv_avggrm_weighted_unified | OUTER 9: inner LOIO validation islands: 0(Nesøy), 1(Myken), 2(Træna), 3(Selvær), 4(Gjerøy), 5(Hestmannøy), 6(Indre Kvarøy), 7(Onøy og Lurøy), 9(Sleneset), 10(Aldra), 11(Leka), 12(Vega), 13(Vikna), 14(Lauvøya)
2026-06-01 02:01:04 | INFO | src.nested_cv_avggrm_weighted_unified | OUTER 9: using top 10 related inner validation islands for tuning: 9(Sleneset, avgGRM=0.0219), 2(Træna, avgGRM=0.0119), 3(Selvær, avgGRM=0.0087), 1(Myken, avgGRM=0.0084), 7(Onøy og Lurøy, avgGRM=0.0058), 0(Nesøy, avgGRM=0.0024), 6(Indre Kvarøy, avgGRM=0.0023), 5(Hestmannøy, avgGRM=-0.0006), 12(Vega, avgGRM=-0.0012), 4(Gjerøy, avgGRM=-0.0020)
[I 2026-06-01 02:01:04,024] A new study created in memory with name: ridge_inner_outer8
2026-06-01 02:01:04 | INFO | src.nested_cv_avggrm_weighted_unified | Trial 0 | outer=9 | alpha=1.137e+05 n_pcs=4000 (pc_topk) weight_search=on
2026-06-01 02:01:04 | INFO | src.nested_cv_avggrm_weighted_unified | Trial 0 | outer=9 | weight={'name': 'uniform', 'floor': 1e-06, 'clip_max': None}
[I 2026-06-01 02:01:09,804] Trial 0 finished with value: 0.2164865180001212 and parameters: {'alpha': 113703.38004442609, 'n_pcs': 4000, 'weight_scheme': 'uniform', 'weight_clip_max': None}. Best is trial 0 with value: 0.2164865180001212.
2026-06-01 02:01:09 | INFO | src.nested_cv_avggrm_weighted_unified | OUTER 9 | new best trial 0 (mean inner r=0.2165) saved to outputs/final_results/e6_pc_ridge_avggrm/thr_wing/e6_pc_ridge_avggrm_thr_wing_best_trials/split_09_best_trial.json
2026-06-01 02:01:09 | INFO | src.nested_cv_avggrm_weighted_unified | Trial 1 | outer=9 | alpha=1.682e+06 n_pcs=2000 (pc_topk) weight_search=on
2026-06-01 02:01:09 | INFO | src.nested_cv_avggrm_weighted_unified | Trial 1 | outer=9 | weight={'name': 'exponential', 'floor': 1e-06, 'clip_max': 3.0, 'beta': 8.711469579953913}
[I 2026-06-01 02:01:12,709] Trial 1 finished with value: 0.2225573938182938 and parameters: {'alpha': 1682385.170967095, 'n_pcs': 2000, 'weight_scheme': 'exponential', 'weight_clip_max': 3.0, 'weight_exponential_beta': 8.711469579953913}. Best is trial 1 with value: 0.2225573938182938.
2026-06-01 02:01:12 | INFO | src.nested_cv_avggrm_weighted_unified | OUTER 9 | new best trial 1 (mean inner r=0.2226) saved to outputs/final_results/e6_pc_ridge_avggrm/thr_wing/e6_pc_ridge_avggrm_thr_wing_best_trials/split_09_best_trial.json
2026-06-01 02:01:12 | INFO | src.nested_cv_avggrm_weighted_unified | Trial 2 | outer=9 | alpha=2.757e+03 n_pcs=2000 (pc_topk) weight_search=on
2026-06-01 02:01:12 | INFO | src.nested_cv_avggrm_weighted_unified | Trial 2 | outer=9 | weight={'name': 'linear', 'floor': 1e-06, 'clip_max': 20.0, 'min_weight': 0.12918170299726892, 'max_weight': 3.9862564805616327}
[I 2026-06-01 02:01:15,814] Trial 2 finished with value: 0.15585736365849695 and parameters: {'alpha': 2757.0504493185063, 'n_pcs': 2000, 'weight_scheme': 'linear', 'weight_clip_max': 20.0, 'weight_linear_min_weight': 0.12918170299726892, 'weight_linear_max_weight': 3.9862564805616327}. Best is trial 1 with value: 0.2225573938182938.
2026-06-01 02:01:15 | INFO | src.nested_cv_avggrm_weighted_unified | Trial 3 | outer=9 | alpha=1.776e+03 n_pcs=4000 (pc_topk) weight_search=on
2026-06-01 02:01:15 | INFO | src.nested_cv_avggrm_weighted_unified | Trial 3 | outer=9 | weight={'name': 'exponential', 'floor': 1e-06, 'clip_max': 10.0, 'beta': 0.563604612251006}
[I 2026-06-01 02:01:21,630] Trial 3 finished with value: 0.14010981210736678 and parameters: {'alpha': 1775.825123718637, 'n_pcs': 4000, 'weight_scheme': 'exponential', 'weight_clip_max': 10.0, 'weight_exponential_beta': 0.563604612251006}. Best is trial 1 with value: 0.2225573938182938.
2026-06-01 02:01:21 | INFO | src.nested_cv_avggrm_weighted_unified | Trial 4 | outer=9 | alpha=1.835e+04 n_pcs=5000 (pc_topk) weight_search=on
2026-06-01 02:01:21 | INFO | src.nested_cv_avggrm_weighted_unified | Trial 4 | outer=9 | weight={'name': 'exponential', 'floor': 1e-06, 'clip_max': None, 'beta': 9.957095048208117}
[I 2026-06-01 02:01:29,773] Trial 4 finished with value: 0.21827403876387388 and parameters: {'alpha': 18351.68801260339, 'n_pcs': 5000, 'weight_scheme': 'exponential', 'weight_clip_max': None, 'weight_exponential_beta': 9.957095048208117}. Best is trial 1 with value: 0.2225573938182938.
2026-06-01 02:01:29 | INFO | src.nested_cv_avggrm_weighted_unified | Trial 5 | outer=9 | alpha=9.696e+03 n_pcs=1000 (pc_topk) weight_search=on
2026-06-01 02:01:29 | INFO | src.nested_cv_avggrm_weighted_unified | Trial 5 | outer=9 | weight={'name': 'exponential', 'floor': 1e-06, 'clip_max': 3.0, 'beta': 1.5726039441128932}
2026-06-01 02:01:30 | INFO | src.nested_cv_avggrm_weighted_unified | Trial 5 | outer=9 | pruned after 7/10 inner folds (mean r=0.1937)
[I 2026-06-01 02:01:30,768] Trial 5 pruned. 
2026-06-01 02:01:30 | INFO | src.nested_cv_avggrm_weighted_unified | Trial 6 | outer=9 | alpha=6.320e+04 n_pcs=2500 (pc_topk) weight_search=on
2026-06-01 02:01:30 | INFO | src.nested_cv_avggrm_weighted_unified | Trial 6 | outer=9 | weight={'name': 'uniform', 'floor': 1e-06, 'clip_max': 10.0}
[I 2026-06-01 02:01:33,577] Trial 6 finished with value: 0.22272384385836172 and parameters: {'alpha': 63199.5851103866, 'n_pcs': 2500, 'weight_scheme': 'uniform', 'weight_clip_max': 10.0}. Best is trial 6 with value: 0.22272384385836172.
2026-06-01 02:01:33 | INFO | src.nested_cv_avggrm_weighted_unified | OUTER 9 | new best trial 6 (mean inner r=0.2227) saved to outputs/final_results/e6_pc_ridge_avggrm/thr_wing/e6_pc_ridge_avggrm_thr_wing_best_trials/split_09_best_trial.json
2026-06-01 02:01:33 | INFO | src.nested_cv_avggrm_weighted_unified | Trial 7 | outer=9 | alpha=4.681e+04 n_pcs=2500 (pc_topk) weight_search=on
2026-06-01 02:01:33 | INFO | src.nested_cv_avggrm_weighted_unified | Trial 7 | outer=9 | weight={'name': 'linear', 'floor': 1e-06, 'clip_max': 3.0, 'min_weight': 0.13798029304672477, 'max_weight': 3.0957974174373546}
[I 2026-06-01 02:01:36,831] Trial 7 finished with value: 0.2314062910020001 and parameters: {'alpha': 46806.97703257331, 'n_pcs': 2500, 'weight_scheme': 'linear', 'weight_clip_max': 3.0, 'weight_linear_min_weight': 0.13798029304672477, 'weight_linear_max_weight': 3.0957974174373546}. Best is trial 7 with value: 0.2314062910020001.
2026-06-01 02:01:36 | INFO | src.nested_cv_avggrm_weighted_unified | OUTER 9 | new best trial 7 (mean inner r=0.2314) saved to outputs/final_results/e6_pc_ridge_avggrm/thr_wing/e6_pc_ridge_avggrm_thr_wing_best_trials/split_09_best_trial.json
2026-06-01 02:01:36 | INFO | src.nested_cv_avggrm_weighted_unified | Trial 8 | outer=9 | alpha=5.456e+04 n_pcs=3000 (pc_topk) weight_search=on
2026-06-01 02:01:36 | INFO | src.nested_cv_avggrm_weighted_unified | Trial 8 | outer=9 | weight={'name': 'linear', 'floor': 1e-06, 'clip_max': 5.0, 'min_weight': 0.6690067570691431, 'max_weight': 4.8744640334054115}
[I 2026-06-01 02:01:40,671] Trial 8 finished with value: 0.23101314454605526 and parameters: {'alpha': 54559.68395210245, 'n_pcs': 3000, 'weight_scheme': 'linear', 'weight_clip_max': 5.0, 'weight_linear_min_weight': 0.6690067570691431, 'weight_linear_max_weight': 4.8744640334054115}. Best is trial 7 with value: 0.2314062910020001.
2026-06-01 02:01:40 | INFO | src.nested_cv_avggrm_weighted_unified | Trial 9 | outer=9 | alpha=8.868e+03 n_pcs=2000 (pc_topk) weight_search=on
2026-06-01 02:01:40 | INFO | src.nested_cv_avggrm_weighted_unified | Trial 9 | outer=9 | weight={'name': 'linear', 'floor': 1e-06, 'clip_max': 20.0, 'min_weight': 0.861124149305412, 'max_weight': 4.702809729786679}
2026-06-01 02:01:42 | INFO | src.nested_cv_avggrm_weighted_unified | Trial 9 | outer=9 | pruned after 7/10 inner folds (mean r=0.1876)
[I 2026-06-01 02:01:42,224] Trial 9 pruned. 
2026-06-01 02:01:42 | INFO | src.nested_cv_avggrm_weighted_unified | Trial 10 | outer=9 | alpha=9.030e+05 n_pcs=500 (pc_topk) weight_search=on
2026-06-01 02:01:42 | INFO | src.nested_cv_avggrm_weighted_unified | Trial 10 | outer=9 | weight={'name': 'linear', 'floor': 1e-06, 'clip_max': 3.0, 'min_weight': 0.0991072425056062, 'max_weight': 1.8686308389620547}
2026-06-01 02:01:42 | INFO | src.nested_cv_avggrm_weighted_unified | Trial 10 | outer=9 | pruned after 5/10 inner folds (mean r=0.1872)
