[I 2026-05-31 23:52:15,829] Trial 16 finished with value: 0.1931460467153642 and parameters: {'alpha': 37470.22521940033, 'n_pcs': 4000, 'weight_scheme': 'linear', 'weight_clip_max': 5.0, 'weight_linear_min_weight': 0.9670005988812563, 'weight_linear_max_weight': 1.740950480090981}. Best is trial 8 with value: 0.1950405969660607.
2026-05-31 23:52:15 | INFO | src.nested_cv_avggrm_weighted_unified | Trial 17 | outer=4 | alpha=5.005e+03 n_pcs=2500 (pc_topk) weight_search=on
2026-05-31 23:52:15 | INFO | src.nested_cv_avggrm_weighted_unified | Trial 17 | outer=4 | weight={'name': 'uniform', 'floor': 1e-06, 'clip_max': 5.0}
2026-05-31 23:52:17 | INFO | src.nested_cv_avggrm_weighted_unified | Trial 17 | outer=4 | pruned after 7/10 inner folds (mean r=0.1534)
[I 2026-05-31 23:52:17,480] Trial 17 pruned. 
2026-05-31 23:52:17 | INFO | src.nested_cv_avggrm_weighted_unified | Trial 18 | outer=4 | alpha=1.586e+06 n_pcs=3500 (pc_topk) weight_search=on
2026-05-31 23:52:17 | INFO | src.nested_cv_avggrm_weighted_unified | Trial 18 | outer=4 | weight={'name': 'uniform', 'floor': 1e-06, 'clip_max': 10.0}
2026-05-31 23:52:19 | INFO | src.nested_cv_avggrm_weighted_unified | Trial 18 | outer=4 | pruned after 6/10 inner folds (mean r=0.1746)
[I 2026-05-31 23:52:19,890] Trial 18 pruned. 
2026-05-31 23:52:19 | INFO | src.nested_cv_avggrm_weighted_unified | Trial 19 | outer=4 | alpha=9.307e+04 n_pcs=1500 (pc_topk) weight_search=on
2026-05-31 23:52:19 | INFO | src.nested_cv_avggrm_weighted_unified | Trial 19 | outer=4 | weight={'name': 'linear', 'floor': 1e-06, 'clip_max': None, 'min_weight': 0.4688030127239595, 'max_weight': 3.017045951297736}
2026-05-31 23:52:20 | INFO | src.nested_cv_avggrm_weighted_unified | Trial 19 | outer=4 | pruned after 6/10 inner folds (mean r=0.1901)
[I 2026-05-31 23:52:20,920] Trial 19 pruned. 
2026-05-31 23:52:20 | INFO | src.nested_cv_avggrm_weighted_unified | Trial 20 | outer=4 | alpha=1.916e+04 n_pcs=3500 (pc_topk) weight_search=on
2026-05-31 23:52:20 | INFO | src.nested_cv_avggrm_weighted_unified | Trial 20 | outer=4 | weight={'name': 'uniform', 'floor': 1e-06, 'clip_max': 20.0}
2026-05-31 23:52:23 | INFO | src.nested_cv_avggrm_weighted_unified | Trial 20 | outer=4 | pruned after 7/10 inner folds (mean r=0.2027)
[I 2026-05-31 23:52:23,772] Trial 20 pruned. 
2026-05-31 23:52:23 | INFO | src.nested_cv_avggrm_weighted_unified | Trial 21 | outer=4 | alpha=3.417e+04 n_pcs=4500 (pc_topk) weight_search=on
2026-05-31 23:52:23 | INFO | src.nested_cv_avggrm_weighted_unified | Trial 21 | outer=4 | weight={'name': 'linear', 'floor': 1e-06, 'clip_max': 5.0, 'min_weight': 0.9885120651924668, 'max_weight': 1.3199243947868382}
[I 2026-05-31 23:52:30,765] Trial 21 finished with value: 0.1952968898575519 and parameters: {'alpha': 34173.70386761644, 'n_pcs': 4500, 'weight_scheme': 'linear', 'weight_clip_max': 5.0, 'weight_linear_min_weight': 0.9885120651924668, 'weight_linear_max_weight': 1.3199243947868382}. Best is trial 21 with value: 0.1952968898575519.
2026-05-31 23:52:30 | INFO | src.nested_cv_avggrm_weighted_unified | OUTER 4 | new best trial 21 (mean inner r=0.1953) saved to outputs/final_results/e6_pc_ridge_avggrm/thr_wing/e6_pc_ridge_avggrm_thr_wing_best_trials/split_04_best_trial.json
2026-05-31 23:52:30 | INFO | src.nested_cv_avggrm_weighted_unified | Trial 22 | outer=4 | alpha=7.352e+04 n_pcs=4500 (pc_topk) weight_search=on
2026-05-31 23:52:30 | INFO | src.nested_cv_avggrm_weighted_unified | Trial 22 | outer=4 | weight={'name': 'linear', 'floor': 1e-06, 'clip_max': 5.0, 'min_weight': 0.7425093453777937, 'max_weight': 1.9944019060698135}
[I 2026-05-31 23:52:38,474] Trial 22 finished with value: 0.19651074587681916 and parameters: {'alpha': 73521.43747084115, 'n_pcs': 4500, 'weight_scheme': 'linear', 'weight_clip_max': 5.0, 'weight_linear_min_weight': 0.7425093453777937, 'weight_linear_max_weight': 1.9944019060698135}. Best is trial 22 with value: 0.19651074587681916.
2026-05-31 23:52:38 | INFO | src.nested_cv_avggrm_weighted_unified | OUTER 4 | new best trial 22 (mean inner r=0.1965) saved to outputs/final_results/e6_pc_ridge_avggrm/thr_wing/e6_pc_ridge_avggrm_thr_wing_best_trials/split_04_best_trial.json
2026-05-31 23:52:38 | INFO | src.nested_cv_avggrm_weighted_unified | Trial 23 | outer=4 | alpha=2.047e+05 n_pcs=4500 (pc_topk) weight_search=on
2026-05-31 23:52:38 | INFO | src.nested_cv_avggrm_weighted_unified | Trial 23 | outer=4 | weight={'name': 'linear', 'floor': 1e-06, 'clip_max': 5.0, 'min_weight': 0.7443645795781543, 'max_weight': 1.9688926665303215}
[I 2026-05-31 23:52:45,770] Trial 23 finished with value: 0.18919402223116935 and parameters: {'alpha': 204691.0579575516, 'n_pcs': 4500, 'weight_scheme': 'linear', 'weight_clip_max': 5.0, 'weight_linear_min_weight': 0.7443645795781543, 'weight_linear_max_weight': 1.9688926665303215}. Best is trial 22 with value: 0.19651074587681916.
2026-05-31 23:52:45 | INFO | src.nested_cv_avggrm_weighted_unified | Trial 24 | outer=4 | alpha=2.004e+04 n_pcs=4500 (pc_topk) weight_search=on
2026-05-31 23:52:45 | INFO | src.nested_cv_avggrm_weighted_unified | Trial 24 | outer=4 | weight={'name': 'linear', 'floor': 1e-06, 'clip_max': 5.0, 'min_weight': 0.6656351065007655, 'max_weight': 2.2014823161373274}
2026-05-31 23:52:50 | INFO | src.nested_cv_avggrm_weighted_unified | Trial 24 | outer=4 | pruned after 7/10 inner folds (mean r=0.2142)
[I 2026-05-31 23:52:50,582] Trial 24 pruned. 
2026-05-31 23:52:50 | INFO | src.nested_cv_avggrm_weighted_unified | Trial 25 | outer=4 | alpha=8.199e+03 n_pcs=4500 (pc_topk) weight_search=on
2026-05-31 23:52:50 | INFO | src.nested_cv_avggrm_weighted_unified | Trial 25 | outer=4 | weight={'name': 'linear', 'floor': 1e-06, 'clip_max': 5.0, 'min_weight': 0.9861998877788344, 'max_weight': 1.0279951997796262}
2026-05-31 23:52:54 | INFO | src.nested_cv_avggrm_weighted_unified | Trial 25 | outer=4 | pruned after 6/10 inner folds (mean r=0.1769)
[I 2026-05-31 23:52:54,713] Trial 25 pruned. 
2026-05-31 23:52:54 | INFO | src.nested_cv_avggrm_weighted_unified | Trial 26 | outer=4 | alpha=2.441e+05 n_pcs=5000 (pc_topk) weight_search=on
2026-05-31 23:52:54 | INFO | src.nested_cv_avggrm_weighted_unified | Trial 26 | outer=4 | weight={'name': 'linear', 'floor': 1e-06, 'clip_max': 5.0, 'min_weight': 0.802486151718609, 'max_weight': 2.5511123479422992}
[I 2026-05-31 23:53:02,796] Trial 26 finished with value: 0.1876389289182232 and parameters: {'alpha': 244056.14635421705, 'n_pcs': 5000, 'weight_scheme': 'linear', 'weight_clip_max': 5.0, 'weight_linear_min_weight': 0.802486151718609, 'weight_linear_max_weight': 2.5511123479422992}. Best is trial 22 with value: 0.19651074587681916.
2026-05-31 23:53:02 | INFO | src.nested_cv_avggrm_weighted_unified | Trial 27 | outer=4 | alpha=8.295e+05 n_pcs=4500 (pc_topk) weight_search=on
2026-05-31 23:53:02 | INFO | src.nested_cv_avggrm_weighted_unified | Trial 27 | outer=4 | weight={'name': 'linear', 'floor': 1e-06, 'clip_max': 5.0, 'min_weight': 0.5896650761474359, 'max_weight': 3.8672112377601113}
[I 2026-05-31 23:53:09,639] Trial 27 finished with value: 0.1824796091498379 and parameters: {'alpha': 829529.6371646487, 'n_pcs': 4500, 'weight_scheme': 'linear', 'weight_clip_max': 5.0, 'weight_linear_min_weight': 0.5896650761474359, 'weight_linear_max_weight': 3.8672112377601113}. Best is trial 22 with value: 0.19651074587681916.
2026-05-31 23:53:09 | INFO | src.nested_cv_avggrm_weighted_unified | Trial 28 | outer=4 | alpha=8.010e+04 n_pcs=3500 (pc_topk) weight_search=on
2026-05-31 23:53:09 | INFO | src.nested_cv_avggrm_weighted_unified | Trial 28 | outer=4 | weight={'name': 'linear', 'floor': 1e-06, 'clip_max': 5.0, 'min_weight': 0.8731222987612078, 'max_weight': 1.373334637005037}
[I 2026-05-31 23:53:14,340] Trial 28 finished with value: 0.19251299543586248 and parameters: {'alpha': 80103.73266850525, 'n_pcs': 3500, 'weight_scheme': 'linear', 'weight_clip_max': 5.0, 'weight_linear_min_weight': 0.8731222987612078, 'weight_linear_max_weight': 1.373334637005037}. Best is trial 22 with value: 0.19651074587681916.
2026-05-31 23:53:14 | INFO | src.nested_cv_avggrm_weighted_unified | Trial 29 | outer=4 | alpha=1.233e+05 n_pcs=4000 (pc_topk) weight_search=on
2026-05-31 23:53:14 | INFO | src.nested_cv_avggrm_weighted_unified | Trial 29 | outer=4 | weight={'name': 'linear', 'floor': 1e-06, 'clip_max': None, 'min_weight': 0.3675343786566586, 'max_weight': 2.6300449944717936}
[I 2026-05-31 23:53:19,993] Trial 29 finished with value: 0.19600371491807195 and parameters: {'alpha': 123301.99841926011, 'n_pcs': 4000, 'weight_scheme': 'linear', 'weight_clip_max': None, 'weight_linear_min_weight': 0.3675343786566586, 'weight_linear_max_weight': 2.6300449944717936}. Best is trial 22 with value: 0.19651074587681916.
2026-05-31 23:53:19 | INFO | src.nested_cv_avggrm_weighted_unified | Trial 30 | outer=4 | alpha=1.204e+05 n_pcs=4000 (pc_topk) weight_search=on
2026-05-31 23:53:20 | INFO | src.nested_cv_avggrm_weighted_unified | Trial 30 | outer=4 | weight={'name': 'linear', 'floor': 1e-06, 'clip_max': None, 'min_weight': 0.30988910682628873, 'max_weight': 2.501412800470131}
[I 2026-05-31 23:53:25,618] Trial 30 finished with value: 0.1962496503245385 and parameters: {'alpha': 120378.54007072526, 'n_pcs': 4000, 'weight_scheme': 'linear', 'weight_clip_max': None, 'weight_linear_min_weight': 0.30988910682628873, 'weight_linear_max_weight': 2.501412800470131}. Best is trial 22 with value: 0.19651074587681916.
2026-05-31 23:53:25 | INFO | src.nested_cv_avggrm_weighted_unified | Trial 31 | outer=4 | alpha=1.288e+05 n_pcs=4000 (pc_topk) weight_search=on
2026-05-31 23:53:25 | INFO | src.nested_cv_avggrm_weighted_unified | Trial 31 | outer=4 | weight={'name': 'linear', 'floor': 1e-06, 'clip_max': None, 'min_weight': 0.30824168827237697, 'max_weight': 2.511716639608921}
[I 2026-05-31 23:53:31,267] Trial 31 finished with value: 0.1960439868567236 and parameters: {'alpha': 128782.68000695365, 'n_pcs': 4000, 'weight_scheme': 'linear', 'weight_clip_max': None, 'weight_linear_min_weight': 0.30824168827237697, 'weight_linear_max_weight': 2.511716639608921}. Best is trial 22 with value: 0.19651074587681916.
2026-05-31 23:53:31 | INFO | src.nested_cv_avggrm_weighted_unified | Trial 32 | outer=4 | alpha=1.447e+05 n_pcs=4000 (pc_topk) weight_search=on
2026-05-31 23:53:31 | INFO | src.nested_cv_avggrm_weighted_unified | Trial 32 | outer=4 | weight={'name': 'linear', 'floor': 1e-06, 'clip_max': None, 'min_weight': 0.3082852370830506, 'max_weight': 2.5730911299416466}
[I 2026-05-31 23:53:36,892] Trial 32 finished with value: 0.19563213771062601 and parameters: {'alpha': 144668.3432482093, 'n_pcs': 4000, 'weight_scheme': 'linear', 'weight_clip_max': None, 'weight_linear_min_weight': 0.3082852370830506, 'weight_linear_max_weight': 2.5730911299416466}. Best is trial 22 with value: 0.19651074587681916.
2026-05-31 23:53:36 | INFO | src.nested_cv_avggrm_weighted_unified | Trial 33 | outer=4 | alpha=1.076e+05 n_pcs=4000 (pc_topk) weight_search=on
2026-05-31 23:53:36 | INFO | src.nested_cv_avggrm_weighted_unified | Trial 33 | outer=4 | weight={'name': 'linear', 'floor': 1e-06, 'clip_max': None, 'min_weight': 0.3365927668185914, 'max_weight': 2.50429522158328}
[I 2026-05-31 23:53:42,555] Trial 33 finished with value: 0.19644989146536135 and parameters: {'alpha': 107644.95568789456, 'n_pcs': 4000, 'weight_scheme': 'linear', 'weight_clip_max': None, 'weight_linear_min_weight': 0.3365927668185914, 'weight_linear_max_weight': 2.50429522158328}. Best is trial 22 with value: 0.19651074587681916.
2026-05-31 23:53:42 | INFO | src.nested_cv_avggrm_weighted_unified | Trial 34 | outer=4 | alpha=3.265e+05 n_pcs=4000 (pc_topk) weight_search=on
2026-05-31 23:53:42 | INFO | src.nested_cv_avggrm_weighted_unified | Trial 34 | outer=4 | weight={'name': 'exponential', 'floor': 1e-06, 'clip_max': None, 'beta': 5.209625526000252}
[I 2026-05-31 23:53:48,197] Trial 34 finished with value: 0.18445712479372162 and parameters: {'alpha': 326464.1211316872, 'n_pcs': 4000, 'weight_scheme': 'exponential', 'weight_clip_max': None, 'weight_exponential_beta': 5.209625526000252}. Best is trial 22 with value: 0.19651074587681916.
2026-05-31 23:53:48 | INFO | src.nested_cv_avggrm_weighted_unified | Trial 35 | outer=4 | alpha=6.308e+05 n_pcs=5000 (pc_topk) weight_search=on
2026-05-31 23:53:48 | INFO | src.nested_cv_avggrm_weighted_unified | Trial 35 | outer=4 | weight={'name': 'linear', 'floor': 1e-06, 'clip_max': None, 'min_weight': 0.27939704930804204, 'max_weight': 2.261122309313145}
[I 2026-05-31 23:53:56,216] Trial 35 finished with value: 0.18450518753080036 and parameters: {'alpha': 630842.2040325151, 'n_pcs': 5000, 'weight_scheme': 'linear', 'weight_clip_max': None, 'weight_linear_min_weight': 0.27939704930804204, 'weight_linear_max_weight': 2.261122309313145}. Best is trial 22 with value: 0.19651074587681916.
2026-05-31 23:53:56 | INFO | src.nested_cv_avggrm_weighted_unified | Trial 36 | outer=4 | alpha=1.526e+06 n_pcs=4000 (pc_topk) weight_search=on
2026-05-31 23:53:56 | INFO | src.nested_cv_avggrm_weighted_unified | Trial 36 | outer=4 | weight={'name': 'exponential', 'floor': 1e-06, 'clip_max': None, 'beta': 5.184690291943051}
2026-05-31 23:54:00 | INFO | src.nested_cv_avggrm_weighted_unified | Trial 36 | outer=4 | pruned after 7/10 inner folds (mean r=0.2256)
[I 2026-05-31 23:54:00,135] Trial 36 pruned. 
2026-05-31 23:54:00 | INFO | src.nested_cv_avggrm_weighted_unified | Trial 37 | outer=4 | alpha=9.240e+04 n_pcs=3500 (pc_topk) weight_search=on
2026-05-31 23:54:00 | INFO | src.nested_cv_avggrm_weighted_unified | Trial 37 | outer=4 | weight={'name': 'linear', 'floor': 1e-06, 'clip_max': None, 'min_weight': 0.23635516726539896, 'max_weight': 3.2968390613635257}
[I 2026-05-31 23:54:04,912] Trial 37 finished with value: 0.1967069001120701 and parameters: {'alpha': 92400.15504971323, 'n_pcs': 3500, 'weight_scheme': 'linear', 'weight_clip_max': None, 'weight_linear_min_weight': 0.23635516726539896, 'weight_linear_max_weight': 3.2968390613635257}. Best is trial 37 with value: 0.1967069001120701.
2026-05-31 23:54:04 | INFO | src.nested_cv_avggrm_weighted_unified | OUTER 4 | new best trial 37 (mean inner r=0.1967) saved to outputs/final_results/e6_pc_ridge_avggrm/thr_wing/e6_pc_ridge_avggrm_thr_wing_best_trials/split_04_best_trial.json
2026-05-31 23:54:04 | INFO | src.nested_cv_avggrm_weighted_unified | Trial 38 | outer=4 | alpha=2.433e+04 n_pcs=3500 (pc_topk) weight_search=on
2026-05-31 23:54:04 | INFO | src.nested_cv_avggrm_weighted_unified | Trial 38 | outer=4 | weight={'name': 'linear', 'floor': 1e-06, 'clip_max': None, 'min_weight': 0.21816606367455021, 'max_weight': 3.4312213196640657}
2026-05-31 23:54:07 | INFO | src.nested_cv_avggrm_weighted_unified | Trial 38 | outer=4 | pruned after 6/10 inner folds (mean r=0.1811)
[I 2026-05-31 23:54:07,788] Trial 38 pruned. 
2026-05-31 23:54:07 | INFO | src.nested_cv_avggrm_weighted_unified | Trial 39 | outer=4 | alpha=1.124e+03 n_pcs=3000 (pc_topk) weight_search=on
2026-05-31 23:54:07 | INFO | src.nested_cv_avggrm_weighted_unified | Trial 39 | outer=4 | weight={'name': 'exponential', 'floor': 1e-06, 'clip_max': 3.0, 'beta': 3.047622629146754}
2026-05-31 23:54:09 | INFO | src.nested_cv_avggrm_weighted_unified | Trial 39 | outer=4 | pruned after 5/10 inner folds (mean r=0.0900)
[I 2026-05-31 23:54:09,669] Trial 39 pruned. 
2026-05-31 23:54:09 | INFO | src.nested_cv_avggrm_weighted_unified | Trial 40 | outer=4 | alpha=7.711e+04 n_pcs=4500 (pc_topk) weight_search=on
2026-05-31 23:54:09 | INFO | src.nested_cv_avggrm_weighted_unified | Trial 40 | outer=4 | weight={'name': 'linear', 'floor': 1e-06, 'clip_max': None, 'min_weight': 0.4198712950271575, 'max_weight': 3.4119769813378666}
[I 2026-05-31 23:54:16,512] Trial 40 finished with value: 0.19807756907303165 and parameters: {'alpha': 77111.5853740576, 'n_pcs': 4500, 'weight_scheme': 'linear', 'weight_clip_max': None, 'weight_linear_min_weight': 0.4198712950271575, 'weight_linear_max_weight': 3.4119769813378666}. Best is trial 40 with value: 0.19807756907303165.
2026-05-31 23:54:16 | INFO | src.nested_cv_avggrm_weighted_unified | OUTER 4 | new best trial 40 (mean inner r=0.1981) saved to outputs/final_results/e6_pc_ridge_avggrm/thr_wing/e6_pc_ridge_avggrm_thr_wing_best_trials/split_04_best_trial.json
2026-05-31 23:54:16 | INFO | src.nested_cv_avggrm_weighted_unified | Trial 41 | outer=4 | alpha=7.258e+04 n_pcs=4500 (pc_topk) weight_search=on
2026-05-31 23:54:16 | INFO | src.nested_cv_avggrm_weighted_unified | Trial 41 | outer=4 | weight={'name': 'linear', 'floor': 1e-06, 'clip_max': None, 'min_weight': 0.4183155631713417, 'max_weight': 3.5222744063870994}
[I 2026-05-31 23:54:23,492] Trial 41 finished with value: 0.19810774778548906 and parameters: {'alpha': 72577.79002653851, 'n_pcs': 4500, 'weight_scheme': 'linear', 'weight_clip_max': None, 'weight_linear_min_weight': 0.4183155631713417, 'weight_linear_max_weight': 3.5222744063870994}. Best is trial 41 with value: 0.19810774778548906.
2026-05-31 23:54:23 | INFO | src.nested_cv_avggrm_weighted_unified | OUTER 4 | new best trial 41 (mean inner r=0.1981) saved to outputs/final_results/e6_pc_ridge_avggrm/thr_wing/e6_pc_ridge_avggrm_thr_wing_best_trials/split_04_best_trial.json
2026-05-31 23:54:23 | INFO | src.nested_cv_avggrm_weighted_unified | Trial 42 | outer=4 | alpha=6.593e+04 n_pcs=4500 (pc_topk) weight_search=on
2026-05-31 23:54:23 | INFO | src.nested_cv_avggrm_weighted_unified | Trial 42 | outer=4 | weight={'name': 'linear', 'floor': 1e-06, 'clip_max': None, 'min_weight': 0.38679531660544336, 'max_weight': 3.478273588450588}
[I 2026-05-31 23:54:30,504] Trial 42 finished with value: 0.19806775287580086 and parameters: {'alpha': 65934.8547016371, 'n_pcs': 4500, 'weight_scheme': 'linear', 'weight_clip_max': None, 'weight_linear_min_weight': 0.38679531660544336, 'weight_linear_max_weight': 3.478273588450588}. Best is trial 41 with value: 0.19810774778548906.
2026-05-31 23:54:30 | INFO | src.nested_cv_avggrm_weighted_unified | Trial 43 | outer=4 | alpha=5.784e+04 n_pcs=5000 (pc_topk) weight_search=on
2026-05-31 23:54:30 | INFO | src.nested_cv_avggrm_weighted_unified | Trial 43 | outer=4 | weight={'name': 'linear', 'floor': 1e-06, 'clip_max': None, 'min_weight': 0.42176216880273965, 'max_weight': 3.5655438056476116}
2026-05-31 23:54:35 | INFO | src.nested_cv_avggrm_weighted_unified | Trial 43 | outer=4 | pruned after 6/10 inner folds (mean r=0.2003)
[I 2026-05-31 23:54:35,407] Trial 43 pruned. 
2026-05-31 23:54:35 | INFO | src.nested_cv_avggrm_weighted_unified | Trial 44 | outer=4 | alpha=1.328e+04 n_pcs=4500 (pc_topk) weight_search=on
2026-05-31 23:54:35 | INFO | src.nested_cv_avggrm_weighted_unified | Trial 44 | outer=4 | weight={'name': 'linear', 'floor': 1e-06, 'clip_max': None, 'min_weight': 0.5592428532851935, 'max_weight': 3.571811093365834}
2026-05-31 23:54:39 | INFO | src.nested_cv_avggrm_weighted_unified | Trial 44 | outer=4 | pruned after 6/10 inner folds (mean r=0.1814)
[I 2026-05-31 23:54:39,584] Trial 44 pruned. 
2026-05-31 23:54:39 | INFO | src.nested_cv_avggrm_weighted_unified | Trial 45 | outer=4 | alpha=6.277e+04 n_pcs=5000 (pc_topk) weight_search=on
2026-05-31 23:54:39 | INFO | src.nested_cv_avggrm_weighted_unified | Trial 45 | outer=4 | weight={'name': 'linear', 'floor': 1e-06, 'clip_max': 20.0, 'min_weight': 0.41586091576290135, 'max_weight': 3.2649608150542266}
2026-05-31 23:54:44 | INFO | src.nested_cv_avggrm_weighted_unified | Trial 45 | outer=4 | pruned after 6/10 inner folds (mean r=0.2012)
[I 2026-05-31 23:54:44,429] Trial 45 pruned. 
2026-05-31 23:54:44 | INFO | src.nested_cv_avggrm_weighted_unified | Trial 46 | outer=4 | alpha=3.308e+04 n_pcs=4500 (pc_topk) weight_search=on
2026-05-31 23:54:44 | INFO | src.nested_cv_avggrm_weighted_unified | Trial 46 | outer=4 | weight={'name': 'linear', 'floor': 1e-06, 'clip_max': 3.0, 'min_weight': 0.24461115269349148, 'max_weight': 3.9280478368875973}
2026-05-31 23:54:48 | INFO | src.nested_cv_avggrm_weighted_unified | Trial 46 | outer=4 | pruned after 6/10 inner folds (mean r=0.1932)
[I 2026-05-31 23:54:48,617] Trial 46 pruned. 
2026-05-31 23:54:48 | INFO | src.nested_cv_avggrm_weighted_unified | Trial 47 | outer=4 | alpha=7.385e+04 n_pcs=4500 (pc_topk) weight_search=on
2026-05-31 23:54:48 | INFO | src.nested_cv_avggrm_weighted_unified | Trial 47 | outer=4 | weight={'name': 'exponential', 'floor': 1e-06, 'clip_max': None, 'beta': 7.181032301172857}
2026-05-31 23:54:52 | INFO | src.nested_cv_avggrm_weighted_unified | Trial 47 | outer=4 | pruned after 6/10 inner folds (mean r=0.1886)
[I 2026-05-31 23:54:52,774] Trial 47 pruned. 
2026-05-31 23:54:52 | INFO | src.nested_cv_avggrm_weighted_unified | Trial 48 | outer=4 | alpha=2.262e+05 n_pcs=5000 (pc_topk) weight_search=on
2026-05-31 23:54:52 | INFO | src.nested_cv_avggrm_weighted_unified | Trial 48 | outer=4 | weight={'name': 'linear', 'floor': 1e-06, 'clip_max': None, 'min_weight': 0.17454081826305817, 'max_weight': 4.117234581469175}
[I 2026-05-31 23:55:00,882] Trial 48 finished with value: 0.1939563294506143 and parameters: {'alpha': 226179.758056901, 'n_pcs': 5000, 'weight_scheme': 'linear', 'weight_clip_max': None, 'weight_linear_min_weight': 0.17454081826305817, 'weight_linear_max_weight': 4.117234581469175}. Best is trial 41 with value: 0.19810774778548906.
2026-05-31 23:55:00 | INFO | src.nested_cv_avggrm_weighted_unified | Trial 49 | outer=4 | alpha=7.733e+06 n_pcs=3500 (pc_topk) weight_search=on
2026-05-31 23:55:00 | INFO | src.nested_cv_avggrm_weighted_unified | Trial 49 | outer=4 | weight={'name': 'linear', 'floor': 1e-06, 'clip_max': None, 'min_weight': 0.405430270246306, 'max_weight': 4.260206516600164}
2026-05-31 23:55:03 | INFO | src.nested_cv_avggrm_weighted_unified | Trial 49 | outer=4 | pruned after 5/10 inner folds (mean r=0.1508)
