[I 2026-06-01 15:16:37,081] Trial 200 finished with value: 0.24317302237145935 and parameters: {'alpha': 325314.69541822036, 'n_pcs': 3500, 'iw_method': 'pc_logistic', 'iw_clip_max': 2.5, 'iw_prob_clip': 0.016560965827496544, 'iw_n_components': 60, 'iw_logistic_c': 9.526474499566752e-05, 'iw_pca_fit': 'combined', 'iw_solver': 'lbfgs', 'iw_rho': 1.0}. Best is trial 191 with value: 0.2449762364140197.
2026-06-01 15:16:37 | INFO | Trial 201 | outer=2 | alpha=2.335e+05 n_pcs=3500 (pc_topk) weight={'name': 'pc_logistic', 'floor': 1e-06, 'clip_max': 2.5, 'prob_clip': 0.014863785960810002, 'n_components': 60, 'logistic_c': 7.717985139277442e-05, 'pca_fit': 'combined', 'solver': 'lbfgs', 'max_iter': 2000, 'fit_intercept': True, 'standardize_with_source': True, 'rho': 1.0}
[I 2026-06-01 15:16:49,356] Trial 201 finished with value: 0.24448772158921464 and parameters: {'alpha': 233475.29479163844, 'n_pcs': 3500, 'iw_method': 'pc_logistic', 'iw_clip_max': 2.5, 'iw_prob_clip': 0.014863785960810002, 'iw_n_components': 60, 'iw_logistic_c': 7.717985139277442e-05, 'iw_pca_fit': 'combined', 'iw_solver': 'lbfgs', 'iw_rho': 1.0}. Best is trial 191 with value: 0.2449762364140197.
2026-06-01 15:16:49 | INFO | Trial 202 | outer=2 | alpha=2.434e+05 n_pcs=3500 (pc_topk) weight={'name': 'pc_logistic', 'floor': 1e-06, 'clip_max': 2.5, 'prob_clip': 0.015014227567111434, 'n_components': 60, 'logistic_c': 8.324086549009494e-05, 'pca_fit': 'combined', 'solver': 'lbfgs', 'max_iter': 2000, 'fit_intercept': True, 'standardize_with_source': True, 'rho': 1.0}
[I 2026-06-01 15:17:03,410] Trial 202 finished with value: 0.2442425625911286 and parameters: {'alpha': 243360.76432274852, 'n_pcs': 3500, 'iw_method': 'pc_logistic', 'iw_clip_max': 2.5, 'iw_prob_clip': 0.015014227567111434, 'iw_n_components': 60, 'iw_logistic_c': 8.324086549009494e-05, 'iw_pca_fit': 'combined', 'iw_solver': 'lbfgs', 'iw_rho': 1.0}. Best is trial 191 with value: 0.2449762364140197.
2026-06-01 15:17:03 | INFO | Trial 203 | outer=2 | alpha=2.776e+05 n_pcs=3500 (pc_topk) weight={'name': 'pc_logistic', 'floor': 1e-06, 'clip_max': 2.5, 'prob_clip': 0.014994929648991915, 'n_components': 60, 'logistic_c': 0.00012412212824708543, 'pca_fit': 'combined', 'solver': 'lbfgs', 'max_iter': 2000, 'fit_intercept': True, 'standardize_with_source': True, 'rho': 1.0}
[I 2026-06-01 15:17:23,266] Trial 203 finished with value: 0.24291549792456024 and parameters: {'alpha': 277563.13849000115, 'n_pcs': 3500, 'iw_method': 'pc_logistic', 'iw_clip_max': 2.5, 'iw_prob_clip': 0.014994929648991915, 'iw_n_components': 60, 'iw_logistic_c': 0.00012412212824708543, 'iw_pca_fit': 'combined', 'iw_solver': 'lbfgs', 'iw_rho': 1.0}. Best is trial 191 with value: 0.2449762364140197.
2026-06-01 15:17:23 | INFO | Trial 204 | outer=2 | alpha=2.351e+05 n_pcs=3500 (pc_topk) weight={'name': 'pc_logistic', 'floor': 1e-06, 'clip_max': 2.5, 'prob_clip': 0.017664848844233992, 'n_components': 60, 'logistic_c': 8.05255976626068e-05, 'pca_fit': 'combined', 'solver': 'lbfgs', 'max_iter': 2000, 'fit_intercept': True, 'standardize_with_source': True, 'rho': 1.0}
[I 2026-06-01 15:17:36,287] Trial 204 finished with value: 0.24421205159229614 and parameters: {'alpha': 235143.55860305738, 'n_pcs': 3500, 'iw_method': 'pc_logistic', 'iw_clip_max': 2.5, 'iw_prob_clip': 0.017664848844233992, 'iw_n_components': 60, 'iw_logistic_c': 8.05255976626068e-05, 'iw_pca_fit': 'combined', 'iw_solver': 'lbfgs', 'iw_rho': 1.0}. Best is trial 191 with value: 0.2449762364140197.
2026-06-01 15:17:36 | INFO | Trial 205 | outer=2 | alpha=2.418e+05 n_pcs=3500 (pc_topk) weight={'name': 'pc_logistic', 'floor': 1e-06, 'clip_max': 2.5, 'prob_clip': 0.0176424292877555, 'n_components': 60, 'logistic_c': 0.0002852264352677274, 'pca_fit': 'combined', 'solver': 'lbfgs', 'max_iter': 2000, 'fit_intercept': True, 'standardize_with_source': True, 'rho': 1.0}
[I 2026-06-01 15:17:48,394] Trial 205 finished with value: 0.24042569179076922 and parameters: {'alpha': 241768.47620110723, 'n_pcs': 3500, 'iw_method': 'pc_logistic', 'iw_clip_max': 2.5, 'iw_prob_clip': 0.0176424292877555, 'iw_n_components': 60, 'iw_logistic_c': 0.0002852264352677274, 'iw_pca_fit': 'combined', 'iw_solver': 'lbfgs', 'iw_rho': 1.0}. Best is trial 191 with value: 0.2449762364140197.
2026-06-01 15:17:48 | INFO | Trial 206 | outer=2 | alpha=3.631e+05 n_pcs=3500 (pc_topk) weight={'name': 'pc_logistic', 'floor': 1e-06, 'clip_max': 2.5, 'prob_clip': 0.01899862222164476, 'n_components': 60, 'logistic_c': 9.257746987554649e-05, 'pca_fit': 'combined', 'solver': 'lbfgs', 'max_iter': 2000, 'fit_intercept': True, 'standardize_with_source': True, 'rho': 1.0}
[I 2026-06-01 15:17:59,414] Trial 206 finished with value: 0.24260566764325095 and parameters: {'alpha': 363126.3062562292, 'n_pcs': 3500, 'iw_method': 'pc_logistic', 'iw_clip_max': 2.5, 'iw_prob_clip': 0.01899862222164476, 'iw_n_components': 60, 'iw_logistic_c': 9.257746987554649e-05, 'iw_pca_fit': 'combined', 'iw_solver': 'lbfgs', 'iw_rho': 1.0}. Best is trial 191 with value: 0.2449762364140197.
2026-06-01 15:17:59 | INFO | Trial 207 | outer=2 | alpha=2.975e+05 n_pcs=3500 (pc_topk) weight={'name': 'pc_logistic', 'floor': 1e-06, 'clip_max': 2.5, 'prob_clip': 0.015207926221375808, 'n_components': 60, 'logistic_c': 3.54734473470226e-05, 'pca_fit': 'combined', 'solver': 'lbfgs', 'max_iter': 2000, 'fit_intercept': True, 'standardize_with_source': True, 'rho': 1.0}
[I 2026-06-01 15:18:11,411] Trial 207 finished with value: 0.24439750553131828 and parameters: {'alpha': 297485.4419497826, 'n_pcs': 3500, 'iw_method': 'pc_logistic', 'iw_clip_max': 2.5, 'iw_prob_clip': 0.015207926221375808, 'iw_n_components': 60, 'iw_logistic_c': 3.54734473470226e-05, 'iw_pca_fit': 'combined', 'iw_solver': 'lbfgs', 'iw_rho': 1.0}. Best is trial 191 with value: 0.2449762364140197.
2026-06-01 15:18:11 | INFO | Trial 208 | outer=2 | alpha=3.049e+05 n_pcs=3500 (pc_topk) weight={'name': 'pc_logistic', 'floor': 1e-06, 'clip_max': 2.5, 'prob_clip': 0.01537464352516859, 'n_components': 60, 'logistic_c': 2.8805341430144e-05, 'pca_fit': 'combined', 'solver': 'lbfgs', 'max_iter': 2000, 'fit_intercept': True, 'standardize_with_source': True, 'rho': 1.0}
[I 2026-06-01 15:18:28,460] Trial 208 finished with value: 0.24383152744645806 and parameters: {'alpha': 304889.04203730705, 'n_pcs': 3500, 'iw_method': 'pc_logistic', 'iw_clip_max': 2.5, 'iw_prob_clip': 0.01537464352516859, 'iw_n_components': 60, 'iw_logistic_c': 2.8805341430144e-05, 'iw_pca_fit': 'combined', 'iw_solver': 'lbfgs', 'iw_rho': 1.0}. Best is trial 191 with value: 0.2449762364140197.
2026-06-01 15:18:28 | INFO | Trial 209 | outer=2 | alpha=4.568e+05 n_pcs=3500 (pc_topk) weight={'name': 'pc_logistic', 'floor': 1e-06, 'clip_max': 12.0, 'prob_clip': 0.021894227639012245, 'n_components': 60, 'logistic_c': 2.558755104352654e-05, 'pca_fit': 'combined', 'solver': 'lbfgs', 'max_iter': 2000, 'fit_intercept': True, 'standardize_with_source': True, 'rho': 1.0}
[I 2026-06-01 15:18:46,366] Trial 209 finished with value: 0.22914573085053788 and parameters: {'alpha': 456785.9703128332, 'n_pcs': 3500, 'iw_method': 'pc_logistic', 'iw_clip_max': 12.0, 'iw_prob_clip': 0.021894227639012245, 'iw_n_components': 60, 'iw_logistic_c': 2.558755104352654e-05, 'iw_pca_fit': 'combined', 'iw_solver': 'lbfgs', 'iw_rho': 1.0}. Best is trial 191 with value: 0.2449762364140197.
2026-06-01 15:18:46 | INFO | Trial 210 | outer=2 | alpha=3.347e+05 n_pcs=3500 (pc_topk) weight={'name': 'pc_logistic', 'floor': 1e-06, 'clip_max': 2.5, 'prob_clip': 0.015391219606524004, 'n_components': 60, 'logistic_c': 1.1948148600963447e-05, 'pca_fit': 'combined', 'solver': 'lbfgs', 'max_iter': 2000, 'fit_intercept': True, 'standardize_with_source': True, 'rho': 1.0}
[I 2026-06-01 15:18:57,898] Trial 210 finished with value: 0.24146707804350162 and parameters: {'alpha': 334691.228472631, 'n_pcs': 3500, 'iw_method': 'pc_logistic', 'iw_clip_max': 2.5, 'iw_prob_clip': 0.015391219606524004, 'iw_n_components': 60, 'iw_logistic_c': 1.1948148600963447e-05, 'iw_pca_fit': 'combined', 'iw_solver': 'lbfgs', 'iw_rho': 1.0}. Best is trial 191 with value: 0.2449762364140197.
2026-06-01 15:18:57 | INFO | Trial 211 | outer=2 | alpha=2.789e+05 n_pcs=3500 (pc_topk) weight={'name': 'pc_logistic', 'floor': 1e-06, 'clip_max': 2.5, 'prob_clip': 0.014289856949502213, 'n_components': 60, 'logistic_c': 3.980354146159175e-05, 'pca_fit': 'combined', 'solver': 'lbfgs', 'max_iter': 2000, 'fit_intercept': True, 'standardize_with_source': True, 'rho': 1.0}
[I 2026-06-01 15:19:19,742] Trial 211 finished with value: 0.24474270763677836 and parameters: {'alpha': 278867.6876974804, 'n_pcs': 3500, 'iw_method': 'pc_logistic', 'iw_clip_max': 2.5, 'iw_prob_clip': 0.014289856949502213, 'iw_n_components': 60, 'iw_logistic_c': 3.980354146159175e-05, 'iw_pca_fit': 'combined', 'iw_solver': 'lbfgs', 'iw_rho': 1.0}. Best is trial 191 with value: 0.2449762364140197.
2026-06-01 15:19:19 | INFO | Trial 212 | outer=2 | alpha=2.993e+05 n_pcs=3500 (pc_topk) weight={'name': 'pc_logistic', 'floor': 1e-06, 'clip_max': 2.5, 'prob_clip': 0.014060451798910623, 'n_components': 60, 'logistic_c': 3.769240210684967e-05, 'pca_fit': 'combined', 'solver': 'lbfgs', 'max_iter': 2000, 'fit_intercept': True, 'standardize_with_source': True, 'rho': 1.0}
[I 2026-06-01 15:19:35,578] Trial 212 finished with value: 0.24447667598170444 and parameters: {'alpha': 299307.7707719463, 'n_pcs': 3500, 'iw_method': 'pc_logistic', 'iw_clip_max': 2.5, 'iw_prob_clip': 0.014060451798910623, 'iw_n_components': 60, 'iw_logistic_c': 3.769240210684967e-05, 'iw_pca_fit': 'combined', 'iw_solver': 'lbfgs', 'iw_rho': 1.0}. Best is trial 191 with value: 0.2449762364140197.
2026-06-01 15:19:35 | INFO | Trial 213 | outer=2 | alpha=2.901e+05 n_pcs=3500 (pc_topk) weight={'name': 'pc_logistic', 'floor': 1e-06, 'clip_max': 2.5, 'prob_clip': 0.01695777381563639, 'n_components': 60, 'logistic_c': 3.7720940850932534e-05, 'pca_fit': 'combined', 'solver': 'lbfgs', 'max_iter': 2000, 'fit_intercept': True, 'standardize_with_source': True, 'rho': 1.0}
[I 2026-06-01 15:19:47,888] Trial 213 finished with value: 0.24461094252220894 and parameters: {'alpha': 290108.6562646946, 'n_pcs': 3500, 'iw_method': 'pc_logistic', 'iw_clip_max': 2.5, 'iw_prob_clip': 0.01695777381563639, 'iw_n_components': 60, 'iw_logistic_c': 3.7720940850932534e-05, 'iw_pca_fit': 'combined', 'iw_solver': 'lbfgs', 'iw_rho': 1.0}. Best is trial 191 with value: 0.2449762364140197.
2026-06-01 15:19:47 | INFO | Trial 214 | outer=2 | alpha=2.976e+05 n_pcs=3500 (pc_topk) weight={'name': 'pc_logistic', 'floor': 1e-06, 'clip_max': 2.5, 'prob_clip': 0.017172461337897866, 'n_components': 60, 'logistic_c': 4.099469543180129e-05, 'pca_fit': 'combined', 'solver': 'lbfgs', 'max_iter': 2000, 'fit_intercept': True, 'standardize_with_source': True, 'rho': 1.0}
[I 2026-06-01 15:19:59,996] Trial 214 finished with value: 0.2445778711897629 and parameters: {'alpha': 297570.16390823637, 'n_pcs': 3500, 'iw_method': 'pc_logistic', 'iw_clip_max': 2.5, 'iw_prob_clip': 0.017172461337897866, 'iw_n_components': 60, 'iw_logistic_c': 4.099469543180129e-05, 'iw_pca_fit': 'combined', 'iw_solver': 'lbfgs', 'iw_rho': 1.0}. Best is trial 191 with value: 0.2449762364140197.
2026-06-01 15:20:00 | INFO | Trial 215 | outer=2 | alpha=2.973e+05 n_pcs=3500 (pc_topk) weight={'name': 'pc_logistic', 'floor': 1e-06, 'clip_max': 2.5, 'prob_clip': 0.01862064976288289, 'n_components': 60, 'logistic_c': 3.640164210504923e-05, 'pca_fit': 'combined', 'solver': 'lbfgs', 'max_iter': 2000, 'fit_intercept': True, 'standardize_with_source': True, 'rho': 1.0}
[I 2026-06-01 15:20:17,007] Trial 215 finished with value: 0.24428100775066378 and parameters: {'alpha': 297330.19182434137, 'n_pcs': 3500, 'iw_method': 'pc_logistic', 'iw_clip_max': 2.5, 'iw_prob_clip': 0.01862064976288289, 'iw_n_components': 60, 'iw_logistic_c': 3.640164210504923e-05, 'iw_pca_fit': 'combined', 'iw_solver': 'lbfgs', 'iw_rho': 1.0}. Best is trial 191 with value: 0.2449762364140197.
2026-06-01 15:20:17 | INFO | Trial 216 | outer=2 | alpha=2.783e+05 n_pcs=3500 (pc_topk) weight={'name': 'pc_logistic', 'floor': 1e-06, 'clip_max': 2.5, 'prob_clip': 0.024669745797504364, 'n_components': 60, 'logistic_c': 1.9622436374357296e-05, 'pca_fit': 'combined', 'solver': 'lbfgs', 'max_iter': 2000, 'fit_intercept': True, 'standardize_with_source': True, 'rho': 1.0}
[I 2026-06-01 15:20:30,349] Trial 216 finished with value: 0.2440383816638422 and parameters: {'alpha': 278334.9419359044, 'n_pcs': 3500, 'iw_method': 'pc_logistic', 'iw_clip_max': 2.5, 'iw_prob_clip': 0.024669745797504364, 'iw_n_components': 60, 'iw_logistic_c': 1.9622436374357296e-05, 'iw_pca_fit': 'combined', 'iw_solver': 'lbfgs', 'iw_rho': 1.0}. Best is trial 191 with value: 0.2449762364140197.
2026-06-01 15:20:30 | INFO | Trial 217 | outer=2 | alpha=2.828e+05 n_pcs=4000 (pc_topk) weight={'name': 'pc_logistic', 'floor': 1e-06, 'clip_max': 2.5, 'prob_clip': 0.024998368473339153, 'n_components': 60, 'logistic_c': 3.475867145441119e-05, 'pca_fit': 'combined', 'solver': 'lbfgs', 'max_iter': 2000, 'fit_intercept': True, 'standardize_with_source': True, 'rho': 1.0}
[I 2026-06-01 15:20:52,210] Trial 217 finished with value: 0.2448906686664266 and parameters: {'alpha': 282785.82191241963, 'n_pcs': 4000, 'iw_method': 'pc_logistic', 'iw_clip_max': 2.5, 'iw_prob_clip': 0.024998368473339153, 'iw_n_components': 60, 'iw_logistic_c': 3.475867145441119e-05, 'iw_pca_fit': 'combined', 'iw_solver': 'lbfgs', 'iw_rho': 1.0}. Best is trial 191 with value: 0.2449762364140197.
2026-06-01 15:20:52 | INFO | Trial 218 | outer=2 | alpha=2.785e+05 n_pcs=4000 (pc_topk) weight={'name': 'pc_logistic', 'floor': 1e-06, 'clip_max': 2.5, 'prob_clip': 0.020217611339855678, 'n_components': 60, 'logistic_c': 1.9620076103222254e-05, 'pca_fit': 'combined', 'solver': 'lbfgs', 'max_iter': 2000, 'fit_intercept': True, 'standardize_with_source': True, 'rho': 1.0}
[I 2026-06-01 15:21:11,710] Trial 218 finished with value: 0.24446715551371406 and parameters: {'alpha': 278503.08202615584, 'n_pcs': 4000, 'iw_method': 'pc_logistic', 'iw_clip_max': 2.5, 'iw_prob_clip': 0.020217611339855678, 'iw_n_components': 60, 'iw_logistic_c': 1.9620076103222254e-05, 'iw_pca_fit': 'combined', 'iw_solver': 'lbfgs', 'iw_rho': 1.0}. Best is trial 191 with value: 0.2449762364140197.
2026-06-01 15:21:11 | INFO | Trial 219 | outer=2 | alpha=4.096e+05 n_pcs=4000 (pc_topk) weight={'name': 'pc_logistic', 'floor': 1e-06, 'clip_max': 2.5, 'prob_clip': 0.02017015784545863, 'n_components': 60, 'logistic_c': 1.7455473138779256e-05, 'pca_fit': 'combined', 'solver': 'lbfgs', 'max_iter': 2000, 'fit_intercept': True, 'standardize_with_source': True, 'rho': 1.0}
[I 2026-06-01 15:21:36,226] Trial 219 finished with value: 0.24253871544414668 and parameters: {'alpha': 409640.1525043304, 'n_pcs': 4000, 'iw_method': 'pc_logistic', 'iw_clip_max': 2.5, 'iw_prob_clip': 0.02017015784545863, 'iw_n_components': 60, 'iw_logistic_c': 1.7455473138779256e-05, 'iw_pca_fit': 'combined', 'iw_solver': 'lbfgs', 'iw_rho': 1.0}. Best is trial 191 with value: 0.2449762364140197.
2026-06-01 15:21:36 | INFO | Trial 220 | outer=2 | alpha=2.835e+05 n_pcs=4000 (pc_topk) weight={'name': 'pc_logistic', 'floor': 1e-06, 'clip_max': 2.5, 'prob_clip': 0.029253962162888128, 'n_components': 60, 'logistic_c': 9.849049355622745e-06, 'pca_fit': 'combined', 'solver': 'lbfgs', 'max_iter': 2000, 'fit_intercept': True, 'standardize_with_source': True, 'rho': 1.0}
[I 2026-06-01 15:21:50,024] Trial 220 finished with value: 0.24233379045013317 and parameters: {'alpha': 283514.2428911206, 'n_pcs': 4000, 'iw_method': 'pc_logistic', 'iw_clip_max': 2.5, 'iw_prob_clip': 0.029253962162888128, 'iw_n_components': 60, 'iw_logistic_c': 9.849049355622745e-06, 'iw_pca_fit': 'combined', 'iw_solver': 'lbfgs', 'iw_rho': 1.0}. Best is trial 191 with value: 0.2449762364140197.
2026-06-01 15:21:50 | INFO | Trial 221 | outer=2 | alpha=2.517e+05 n_pcs=4000 (pc_topk) weight={'name': 'pc_logistic', 'floor': 1e-06, 'clip_max': 2.5, 'prob_clip': 0.0253731269751183, 'n_components': 60, 'logistic_c': 2.5783080652478623e-05, 'pca_fit': 'combined', 'solver': 'lbfgs', 'max_iter': 2000, 'fit_intercept': True, 'standardize_with_source': True, 'rho': 1.0}
[I 2026-06-01 15:22:03,460] Trial 221 finished with value: 0.24516351463075842 and parameters: {'alpha': 251706.15745465606, 'n_pcs': 4000, 'iw_method': 'pc_logistic', 'iw_clip_max': 2.5, 'iw_prob_clip': 0.0253731269751183, 'iw_n_components': 60, 'iw_logistic_c': 2.5783080652478623e-05, 'iw_pca_fit': 'combined', 'iw_solver': 'lbfgs', 'iw_rho': 1.0}. Best is trial 221 with value: 0.24516351463075842.
2026-06-01 15:22:03 | INFO | Trial 222 | outer=2 | alpha=2.634e+05 n_pcs=4000 (pc_topk) weight={'name': 'pc_logistic', 'floor': 1e-06, 'clip_max': 2.5, 'prob_clip': 0.022232272231726982, 'n_components': 60, 'logistic_c': 2.646591754925618e-05, 'pca_fit': 'combined', 'solver': 'lbfgs', 'max_iter': 2000, 'fit_intercept': True, 'standardize_with_source': True, 'rho': 1.0}
[I 2026-06-01 15:22:16,870] Trial 222 finished with value: 0.24500847045666987 and parameters: {'alpha': 263432.1778005337, 'n_pcs': 4000, 'iw_method': 'pc_logistic', 'iw_clip_max': 2.5, 'iw_prob_clip': 0.022232272231726982, 'iw_n_components': 60, 'iw_logistic_c': 2.646591754925618e-05, 'iw_pca_fit': 'combined', 'iw_solver': 'lbfgs', 'iw_rho': 1.0}. Best is trial 221 with value: 0.24516351463075842.
2026-06-01 15:22:16 | INFO | Trial 223 | outer=2 | alpha=2.434e+05 n_pcs=4000 (pc_topk) weight={'name': 'pc_logistic', 'floor': 1e-06, 'clip_max': 2.5, 'prob_clip': 0.025294836614824755, 'n_components': 60, 'logistic_c': 2.246038457038599e-05, 'pca_fit': 'combined', 'solver': 'lbfgs', 'max_iter': 2000, 'fit_intercept': True, 'standardize_with_source': True, 'rho': 1.0}
[I 2026-06-01 15:22:30,131] Trial 223 finished with value: 0.2452487948773226 and parameters: {'alpha': 243359.25350075058, 'n_pcs': 4000, 'iw_method': 'pc_logistic', 'iw_clip_max': 2.5, 'iw_prob_clip': 0.025294836614824755, 'iw_n_components': 60, 'iw_logistic_c': 2.246038457038599e-05, 'iw_pca_fit': 'combined', 'iw_solver': 'lbfgs', 'iw_rho': 1.0}. Best is trial 223 with value: 0.2452487948773226.
2026-06-01 15:22:30 | INFO | Trial 224 | outer=2 | alpha=2.501e+05 n_pcs=4000 (pc_topk) weight={'name': 'pc_logistic', 'floor': 1e-06, 'clip_max': 2.5, 'prob_clip': 0.02561330900422679, 'n_components': 60, 'logistic_c': 1.6491408096022285e-05, 'pca_fit': 'combined', 'solver': 'lbfgs', 'max_iter': 2000, 'fit_intercept': True, 'standardize_with_source': True, 'rho': 1.0}
[I 2026-06-01 15:22:43,342] Trial 224 finished with value: 0.24474564967792628 and parameters: {'alpha': 250139.43174764144, 'n_pcs': 4000, 'iw_method': 'pc_logistic', 'iw_clip_max': 2.5, 'iw_prob_clip': 0.02561330900422679, 'iw_n_components': 60, 'iw_logistic_c': 1.6491408096022285e-05, 'iw_pca_fit': 'combined', 'iw_solver': 'lbfgs', 'iw_rho': 1.0}. Best is trial 223 with value: 0.2452487948773226.
2026-06-01 15:22:43 | INFO | Trial 225 | outer=2 | alpha=2.425e+05 n_pcs=4000 (pc_topk) weight={'name': 'pc_logistic', 'floor': 1e-06, 'clip_max': 2.5, 'prob_clip': 0.02556544120584012, 'n_components': 60, 'logistic_c': 1.7313849803896e-05, 'pca_fit': 'combined', 'solver': 'lbfgs', 'max_iter': 2000, 'fit_intercept': True, 'standardize_with_source': True, 'rho': 1.0}
[I 2026-06-01 15:22:56,855] Trial 225 finished with value: 0.24496433677244753 and parameters: {'alpha': 242536.70562781443, 'n_pcs': 4000, 'iw_method': 'pc_logistic', 'iw_clip_max': 2.5, 'iw_prob_clip': 0.02556544120584012, 'iw_n_components': 60, 'iw_logistic_c': 1.7313849803896e-05, 'iw_pca_fit': 'combined', 'iw_solver': 'lbfgs', 'iw_rho': 1.0}. Best is trial 223 with value: 0.2452487948773226.
2026-06-01 15:22:56 | INFO | Trial 226 | outer=2 | alpha=2.354e+05 n_pcs=4000 (pc_topk) weight={'name': 'pc_logistic', 'floor': 1e-06, 'clip_max': 4.0, 'prob_clip': 0.025810515767113282, 'n_components': 60, 'logistic_c': 4.18461607213921e-06, 'pca_fit': 'combined', 'solver': 'lbfgs', 'max_iter': 2000, 'fit_intercept': True, 'standardize_with_source': True, 'rho': 1.0}
[I 2026-06-01 15:23:10,556] Trial 226 finished with value: 0.237792912608298 and parameters: {'alpha': 235371.975421241, 'n_pcs': 4000, 'iw_method': 'pc_logistic', 'iw_clip_max': 4.0, 'iw_prob_clip': 0.025810515767113282, 'iw_n_components': 60, 'iw_logistic_c': 4.18461607213921e-06, 'iw_pca_fit': 'combined', 'iw_solver': 'lbfgs', 'iw_rho': 1.0}. Best is trial 223 with value: 0.2452487948773226.
2026-06-01 15:23:10 | INFO | Trial 227 | outer=2 | alpha=2.539e+05 n_pcs=4000 (pc_topk) weight={'name': 'uniform'}
[I 2026-06-01 15:23:29,247] Trial 227 finished with value: 0.22658919837682173 and parameters: {'alpha': 253942.2468119097, 'n_pcs': 4000, 'iw_method': 'uniform'}. Best is trial 223 with value: 0.2452487948773226.
2026-06-01 15:23:29 | INFO | Trial 228 | outer=2 | alpha=2.273e+05 n_pcs=4000 (pc_topk) weight={'name': 'pc_logistic', 'floor': 1e-06, 'clip_max': 2.5, 'prob_clip': 0.028915438740157996, 'n_components': 60, 'logistic_c': 1.2363239337420752e-05, 'pca_fit': 'combined', 'solver': 'lbfgs', 'max_iter': 2000, 'fit_intercept': True, 'standardize_with_source': True, 'rho': 1.0}
[I 2026-06-01 15:24:07,043] Trial 228 finished with value: 0.2439924458407634 and parameters: {'alpha': 227277.31545505722, 'n_pcs': 4000, 'iw_method': 'pc_logistic', 'iw_clip_max': 2.5, 'iw_prob_clip': 0.028915438740157996, 'iw_n_components': 60, 'iw_logistic_c': 1.2363239337420752e-05, 'iw_pca_fit': 'combined', 'iw_solver': 'lbfgs', 'iw_rho': 1.0}. Best is trial 223 with value: 0.2452487948773226.
2026-06-01 15:24:07 | INFO | Trial 229 | outer=2 | alpha=2.331e+05 n_pcs=4000 (pc_topk) weight={'name': 'pc_logistic', 'floor': 1e-06, 'clip_max': 7.0, 'prob_clip': 0.027939083042034272, 'n_components': 60, 'logistic_c': 3.745526650155258e-05, 'pca_fit': 'combined', 'solver': 'lbfgs', 'max_iter': 2000, 'fit_intercept': True, 'standardize_with_source': True, 'rho': 1.0}
