[I 2026-06-01 15:30:45,880] Trial 257 finished with value: 0.22762838342989702 and parameters: {'alpha': 218958.2616512132, 'n_pcs': 4000, 'iw_method': 'uniform'}. Best is trial 250 with value: 0.24563604517254056.
2026-06-01 15:30:45 | INFO | Trial 258 | outer=2 | alpha=3.345e+05 n_pcs=4000 (pc_topk) weight={'name': 'pc_logistic', 'floor': 1e-06, 'clip_max': 2.5, 'prob_clip': 0.023547844468062126, 'n_components': 60, 'logistic_c': 4.147595251518085e-05, 'pca_fit': 'combined', 'solver': 'lbfgs', 'max_iter': 2000, 'fit_intercept': True, 'standardize_with_source': True, 'rho': 1.0}
[I 2026-06-01 15:30:59,274] Trial 258 finished with value: 0.2443512844148402 and parameters: {'alpha': 334517.51323332806, 'n_pcs': 4000, 'iw_method': 'pc_logistic', 'iw_clip_max': 2.5, 'iw_prob_clip': 0.023547844468062126, 'iw_n_components': 60, 'iw_logistic_c': 4.147595251518085e-05, 'iw_pca_fit': 'combined', 'iw_solver': 'lbfgs', 'iw_rho': 1.0}. Best is trial 250 with value: 0.24563604517254056.
2026-06-01 15:30:59 | INFO | Trial 259 | outer=2 | alpha=2.941e+05 n_pcs=4000 (pc_topk) weight={'name': 'pc_logistic', 'floor': 1e-06, 'clip_max': 2.5, 'prob_clip': 0.025329613470197816, 'n_components': 100, 'logistic_c': 2.1722150583129692e-05, 'pca_fit': 'combined', 'solver': 'lbfgs', 'max_iter': 2000, 'fit_intercept': True, 'standardize_with_source': True, 'rho': 1.0}
[I 2026-06-01 15:31:12,591] Trial 259 finished with value: 0.2447964276259523 and parameters: {'alpha': 294105.32759407687, 'n_pcs': 4000, 'iw_method': 'pc_logistic', 'iw_clip_max': 2.5, 'iw_prob_clip': 0.025329613470197816, 'iw_n_components': 100, 'iw_logistic_c': 2.1722150583129692e-05, 'iw_pca_fit': 'combined', 'iw_solver': 'lbfgs', 'iw_rho': 1.0}. Best is trial 250 with value: 0.24563604517254056.
2026-06-01 15:31:12 | INFO | Trial 260 | outer=2 | alpha=4.702e+05 n_pcs=4500 (pc_topk) weight={'name': 'pc_logistic', 'floor': 1e-06, 'clip_max': 2.5, 'prob_clip': 0.0221469929973184, 'n_components': 100, 'logistic_c': 1.627467292929735e-05, 'pca_fit': 'combined', 'solver': 'lbfgs', 'max_iter': 2000, 'fit_intercept': True, 'standardize_with_source': True, 'rho': 1.0}
[I 2026-06-01 15:31:30,823] Trial 260 finished with value: 0.24079521170592083 and parameters: {'alpha': 470236.00844166224, 'n_pcs': 4500, 'iw_method': 'pc_logistic', 'iw_clip_max': 2.5, 'iw_prob_clip': 0.0221469929973184, 'iw_n_components': 100, 'iw_logistic_c': 1.627467292929735e-05, 'iw_pca_fit': 'combined', 'iw_solver': 'lbfgs', 'iw_rho': 1.0}. Best is trial 250 with value: 0.24563604517254056.
2026-06-01 15:31:30 | INFO | Trial 261 | outer=2 | alpha=2.190e+05 n_pcs=4000 (pc_topk) weight={'name': 'pc_logistic', 'floor': 1e-06, 'clip_max': 2.5, 'prob_clip': 0.024494134626170665, 'n_components': 60, 'logistic_c': 2.355438414852247e-05, 'pca_fit': 'combined', 'solver': 'lbfgs', 'max_iter': 2000, 'fit_intercept': True, 'standardize_with_source': True, 'rho': 1.0}
[I 2026-06-01 15:32:07,675] Trial 261 finished with value: 0.24554284050197386 and parameters: {'alpha': 219007.28891774762, 'n_pcs': 4000, 'iw_method': 'pc_logistic', 'iw_clip_max': 2.5, 'iw_prob_clip': 0.024494134626170665, 'iw_n_components': 60, 'iw_logistic_c': 2.355438414852247e-05, 'iw_pca_fit': 'combined', 'iw_solver': 'lbfgs', 'iw_rho': 1.0}. Best is trial 250 with value: 0.24563604517254056.
2026-06-01 15:32:07 | INFO | Trial 262 | outer=2 | alpha=2.073e+05 n_pcs=4000 (pc_topk) weight={'name': 'pc_logistic', 'floor': 1e-06, 'clip_max': 4.0, 'prob_clip': 0.0242594532051656, 'n_components': 10, 'logistic_c': 2.28231778661207e-05, 'pca_fit': 'combined', 'solver': 'lbfgs', 'max_iter': 2000, 'fit_intercept': True, 'standardize_with_source': True, 'rho': 1.0}
[I 2026-06-01 15:32:21,052] Trial 262 finished with value: 0.24226819039219719 and parameters: {'alpha': 207284.19443553803, 'n_pcs': 4000, 'iw_method': 'pc_logistic', 'iw_clip_max': 4.0, 'iw_prob_clip': 0.0242594532051656, 'iw_n_components': 10, 'iw_logistic_c': 2.28231778661207e-05, 'iw_pca_fit': 'combined', 'iw_solver': 'lbfgs', 'iw_rho': 1.0}. Best is trial 250 with value: 0.24563604517254056.
2026-06-01 15:32:21 | INFO | Trial 263 | outer=2 | alpha=3.927e+05 n_pcs=4000 (pc_topk) weight={'name': 'pc_logistic', 'floor': 1e-06, 'clip_max': 2.5, 'prob_clip': 0.021155016583006114, 'n_components': 100, 'logistic_c': 1.086601015086797e-05, 'pca_fit': 'combined', 'solver': 'lbfgs', 'max_iter': 2000, 'fit_intercept': True, 'standardize_with_source': True, 'rho': 1.0}
[I 2026-06-01 15:32:34,932] Trial 263 finished with value: 0.24028099436384523 and parameters: {'alpha': 392685.70265732, 'n_pcs': 4000, 'iw_method': 'pc_logistic', 'iw_clip_max': 2.5, 'iw_prob_clip': 0.021155016583006114, 'iw_n_components': 100, 'iw_logistic_c': 1.086601015086797e-05, 'iw_pca_fit': 'combined', 'iw_solver': 'lbfgs', 'iw_rho': 1.0}. Best is trial 250 with value: 0.24563604517254056.
2026-06-01 15:32:34 | INFO | Trial 264 | outer=2 | alpha=2.779e+05 n_pcs=4000 (pc_topk) weight={'name': 'pc_logistic', 'floor': 1e-06, 'clip_max': 2.5, 'prob_clip': 0.02629786276881432, 'n_components': 100, 'logistic_c': 2.5272634447706724e-05, 'pca_fit': 'combined', 'solver': 'lbfgs', 'max_iter': 2000, 'fit_intercept': True, 'standardize_with_source': True, 'rho': 1.0}
[I 2026-06-01 15:32:59,573] Trial 264 finished with value: 0.2452948526767325 and parameters: {'alpha': 277941.4198295099, 'n_pcs': 4000, 'iw_method': 'pc_logistic', 'iw_clip_max': 2.5, 'iw_prob_clip': 0.02629786276881432, 'iw_n_components': 100, 'iw_logistic_c': 2.5272634447706724e-05, 'iw_pca_fit': 'combined', 'iw_solver': 'lbfgs', 'iw_rho': 1.0}. Best is trial 250 with value: 0.24563604517254056.
2026-06-01 15:32:59 | INFO | Trial 265 | outer=2 | alpha=2.658e+05 n_pcs=4000 (pc_topk) weight={'name': 'pc_logistic', 'floor': 1e-06, 'clip_max': 2.5, 'prob_clip': 0.025311394932294957, 'n_components': 100, 'logistic_c': 7.108529584869408e-06, 'pca_fit': 'combined', 'solver': 'lbfgs', 'max_iter': 2000, 'fit_intercept': True, 'standardize_with_source': True, 'rho': 1.0}
[I 2026-06-01 15:33:12,982] Trial 265 finished with value: 0.24086871553062336 and parameters: {'alpha': 265791.21754849254, 'n_pcs': 4000, 'iw_method': 'pc_logistic', 'iw_clip_max': 2.5, 'iw_prob_clip': 0.025311394932294957, 'iw_n_components': 100, 'iw_logistic_c': 7.108529584869408e-06, 'iw_pca_fit': 'combined', 'iw_solver': 'lbfgs', 'iw_rho': 1.0}. Best is trial 250 with value: 0.24563604517254056.
2026-06-01 15:33:13 | INFO | Trial 266 | outer=2 | alpha=2.067e+05 n_pcs=4000 (pc_topk) weight={'name': 'pc_logistic', 'floor': 1e-06, 'clip_max': 1.5, 'prob_clip': 0.028148539167800538, 'n_components': 100, 'logistic_c': 2.144320764450337e-05, 'pca_fit': 'combined', 'solver': 'lbfgs', 'max_iter': 2000, 'fit_intercept': True, 'standardize_with_source': True, 'rho': 1.0}
[I 2026-06-01 15:33:28,826] Trial 266 finished with value: 0.24150216692053522 and parameters: {'alpha': 206734.0377929763, 'n_pcs': 4000, 'iw_method': 'pc_logistic', 'iw_clip_max': 1.5, 'iw_prob_clip': 0.028148539167800538, 'iw_n_components': 100, 'iw_logistic_c': 2.144320764450337e-05, 'iw_pca_fit': 'combined', 'iw_solver': 'lbfgs', 'iw_rho': 1.0}. Best is trial 250 with value: 0.24563604517254056.
2026-06-01 15:33:28 | INFO | Trial 267 | outer=2 | alpha=2.745e+05 n_pcs=4000 (pc_topk) weight={'name': 'pc_logistic', 'floor': 1e-06, 'clip_max': 7.0, 'prob_clip': 0.023561741154831374, 'n_components': 100, 'logistic_c': 1.3761629034785483e-05, 'pca_fit': 'combined', 'solver': 'lbfgs', 'max_iter': 2000, 'fit_intercept': True, 'standardize_with_source': True, 'rho': 1.0}
[I 2026-06-01 15:33:42,839] Trial 267 finished with value: 0.2381426909349365 and parameters: {'alpha': 274471.83229131694, 'n_pcs': 4000, 'iw_method': 'pc_logistic', 'iw_clip_max': 7.0, 'iw_prob_clip': 0.023561741154831374, 'iw_n_components': 100, 'iw_logistic_c': 1.3761629034785483e-05, 'iw_pca_fit': 'combined', 'iw_solver': 'lbfgs', 'iw_rho': 1.0}. Best is trial 250 with value: 0.24563604517254056.
2026-06-01 15:33:42 | INFO | Trial 268 | outer=2 | alpha=3.448e+05 n_pcs=4000 (pc_topk) weight={'name': 'pc_logistic', 'floor': 1e-06, 'clip_max': 2.5, 'prob_clip': 0.03255070056053768, 'n_components': 100, 'logistic_c': 2.512699595450824e-05, 'pca_fit': 'combined', 'solver': 'lbfgs', 'max_iter': 2000, 'fit_intercept': True, 'standardize_with_source': True, 'rho': 1.0}
[I 2026-06-01 15:33:55,910] Trial 268 finished with value: 0.24296337827293893 and parameters: {'alpha': 344844.3539602591, 'n_pcs': 4000, 'iw_method': 'pc_logistic', 'iw_clip_max': 2.5, 'iw_prob_clip': 0.03255070056053768, 'iw_n_components': 100, 'iw_logistic_c': 2.512699595450824e-05, 'iw_pca_fit': 'combined', 'iw_solver': 'lbfgs', 'iw_rho': 1.0}. Best is trial 250 with value: 0.24563604517254056.
2026-06-01 15:33:55 | INFO | Trial 269 | outer=2 | alpha=2.225e+05 n_pcs=4000 (pc_topk) weight={'name': 'pc_logistic', 'floor': 1e-06, 'clip_max': 2.5, 'prob_clip': 0.025424643300708868, 'n_components': 60, 'logistic_c': 3.0095811165836577e-05, 'pca_fit': 'combined', 'solver': 'lbfgs', 'max_iter': 2000, 'fit_intercept': True, 'standardize_with_source': True, 'rho': 1.0}
[I 2026-06-01 15:34:08,403] Trial 269 finished with value: 0.2455724042840303 and parameters: {'alpha': 222463.59863052674, 'n_pcs': 4000, 'iw_method': 'pc_logistic', 'iw_clip_max': 2.5, 'iw_prob_clip': 0.025424643300708868, 'iw_n_components': 60, 'iw_logistic_c': 3.0095811165836577e-05, 'iw_pca_fit': 'combined', 'iw_solver': 'lbfgs', 'iw_rho': 1.0}. Best is trial 250 with value: 0.24563604517254056.
2026-06-01 15:34:08 | INFO | Trial 270 | outer=2 | alpha=2.167e+05 n_pcs=4000 (pc_topk) weight={'name': 'pc_logistic', 'floor': 1e-06, 'clip_max': 2.5, 'prob_clip': 0.02741190074022014, 'n_components': 60, 'logistic_c': 1.7227001167785608e-05, 'pca_fit': 'combined', 'solver': 'lbfgs', 'max_iter': 2000, 'fit_intercept': True, 'standardize_with_source': True, 'rho': 1.0}
[I 2026-06-01 15:34:21,218] Trial 270 finished with value: 0.24524612357144188 and parameters: {'alpha': 216735.08707811826, 'n_pcs': 4000, 'iw_method': 'pc_logistic', 'iw_clip_max': 2.5, 'iw_prob_clip': 0.02741190074022014, 'iw_n_components': 60, 'iw_logistic_c': 1.7227001167785608e-05, 'iw_pca_fit': 'combined', 'iw_solver': 'lbfgs', 'iw_rho': 1.0}. Best is trial 250 with value: 0.24563604517254056.
2026-06-01 15:34:21 | INFO | Trial 271 | outer=2 | alpha=1.891e+05 n_pcs=4000 (pc_topk) weight={'name': 'pc_logistic', 'floor': 1e-06, 'clip_max': 2.5, 'prob_clip': 0.02795425310859114, 'n_components': 60, 'logistic_c': 1.399842054470896e-06, 'pca_fit': 'combined', 'solver': 'lbfgs', 'max_iter': 2000, 'fit_intercept': True, 'standardize_with_source': True, 'rho': 1.0}
[I 2026-06-01 15:34:34,403] Trial 271 finished with value: 0.2338581223809893 and parameters: {'alpha': 189062.33120258857, 'n_pcs': 4000, 'iw_method': 'pc_logistic', 'iw_clip_max': 2.5, 'iw_prob_clip': 0.02795425310859114, 'iw_n_components': 60, 'iw_logistic_c': 1.399842054470896e-06, 'iw_pca_fit': 'combined', 'iw_solver': 'lbfgs', 'iw_rho': 1.0}. Best is trial 250 with value: 0.24563604517254056.
2026-06-01 15:34:34 | INFO | Trial 272 | outer=2 | alpha=2.196e+05 n_pcs=4000 (pc_topk) weight={'name': 'pc_logistic', 'floor': 1e-06, 'clip_max': 2.5, 'prob_clip': 0.025315891700744296, 'n_components': 60, 'logistic_c': 1.6261947401243505e-05, 'pca_fit': 'combined', 'solver': 'lbfgs', 'max_iter': 2000, 'fit_intercept': True, 'standardize_with_source': True, 'rho': 1.0}
[I 2026-06-01 15:34:47,633] Trial 272 finished with value: 0.24513321089662474 and parameters: {'alpha': 219620.8098418078, 'n_pcs': 4000, 'iw_method': 'pc_logistic', 'iw_clip_max': 2.5, 'iw_prob_clip': 0.025315891700744296, 'iw_n_components': 60, 'iw_logistic_c': 1.6261947401243505e-05, 'iw_pca_fit': 'combined', 'iw_solver': 'lbfgs', 'iw_rho': 1.0}. Best is trial 250 with value: 0.24563604517254056.
2026-06-01 15:34:47 | INFO | Trial 273 | outer=2 | alpha=1.166e+03 n_pcs=4000 (pc_topk) weight={'name': 'pc_logistic', 'floor': 1e-06, 'clip_max': 2.5, 'prob_clip': 0.024850659041708353, 'n_components': 60, 'logistic_c': 1.8989525395040595e-05, 'pca_fit': 'combined', 'solver': 'lbfgs', 'max_iter': 2000, 'fit_intercept': True, 'standardize_with_source': True, 'rho': 0.5}
[I 2026-06-01 15:35:00,511] Trial 273 finished with value: 0.11488826142117917 and parameters: {'alpha': 1166.0747598761016, 'n_pcs': 4000, 'iw_method': 'pc_logistic', 'iw_clip_max': 2.5, 'iw_prob_clip': 0.024850659041708353, 'iw_n_components': 60, 'iw_logistic_c': 1.8989525395040595e-05, 'iw_pca_fit': 'combined', 'iw_solver': 'lbfgs', 'iw_rho': 0.5}. Best is trial 250 with value: 0.24563604517254056.
2026-06-01 15:35:00 | INFO | Trial 274 | outer=2 | alpha=2.527e+05 n_pcs=4500 (pc_topk) weight={'name': 'pc_logistic', 'floor': 1e-06, 'clip_max': 2.5, 'prob_clip': 0.021938203757255182, 'n_components': 60, 'logistic_c': 9.474718958163953e-06, 'pca_fit': 'combined', 'solver': 'lbfgs', 'max_iter': 2000, 'fit_intercept': True, 'standardize_with_source': True, 'rho': 1.0}
[I 2026-06-01 15:35:18,565] Trial 274 finished with value: 0.24181477517523886 and parameters: {'alpha': 252664.57752431981, 'n_pcs': 4500, 'iw_method': 'pc_logistic', 'iw_clip_max': 2.5, 'iw_prob_clip': 0.021938203757255182, 'iw_n_components': 60, 'iw_logistic_c': 9.474718958163953e-06, 'iw_pca_fit': 'combined', 'iw_solver': 'lbfgs', 'iw_rho': 1.0}. Best is trial 250 with value: 0.24563604517254056.
2026-06-01 15:35:18 | INFO | Trial 275 | outer=2 | alpha=4.085e+05 n_pcs=4000 (pc_topk) weight={'name': 'pc_logistic', 'floor': 1e-06, 'clip_max': 2.5, 'prob_clip': 0.037936259027184976, 'n_components': 60, 'logistic_c': 2.613678686870292e-05, 'pca_fit': 'combined', 'solver': 'lbfgs', 'max_iter': 2000, 'fit_intercept': True, 'standardize_with_source': True, 'rho': 0.85}
[I 2026-06-01 15:35:35,270] Trial 275 finished with value: 0.23996612820333407 and parameters: {'alpha': 408461.850543534, 'n_pcs': 4000, 'iw_method': 'pc_logistic', 'iw_clip_max': 2.5, 'iw_prob_clip': 0.037936259027184976, 'iw_n_components': 60, 'iw_logistic_c': 2.613678686870292e-05, 'iw_pca_fit': 'combined', 'iw_solver': 'lbfgs', 'iw_rho': 0.85}. Best is trial 250 with value: 0.24563604517254056.
2026-06-01 15:35:35 | INFO | Trial 276 | outer=2 | alpha=1.859e+05 n_pcs=4000 (pc_topk) weight={'name': 'pc_logistic', 'floor': 1e-06, 'clip_max': 2.5, 'prob_clip': 0.029402033530624986, 'n_components': 60, 'logistic_c': 2.9364346661351953e-05, 'pca_fit': 'combined', 'solver': 'lbfgs', 'max_iter': 2000, 'fit_intercept': True, 'standardize_with_source': True, 'rho': 1.0}
[I 2026-06-01 15:35:48,496] Trial 276 finished with value: 0.24580438788682182 and parameters: {'alpha': 185852.49339543382, 'n_pcs': 4000, 'iw_method': 'pc_logistic', 'iw_clip_max': 2.5, 'iw_prob_clip': 0.029402033530624986, 'iw_n_components': 60, 'iw_logistic_c': 2.9364346661351953e-05, 'iw_pca_fit': 'combined', 'iw_solver': 'lbfgs', 'iw_rho': 1.0}. Best is trial 276 with value: 0.24580438788682182.
2026-06-01 15:35:48 | INFO | Trial 277 | outer=2 | alpha=1.752e+05 n_pcs=4000 (pc_topk) weight={'name': 'uniform'}
[I 2026-06-01 15:35:55,568] Trial 277 finished with value: 0.22915592173623006 and parameters: {'alpha': 175184.76442362028, 'n_pcs': 4000, 'iw_method': 'uniform'}. Best is trial 276 with value: 0.24580438788682182.
2026-06-01 15:35:55 | INFO | Trial 278 | outer=2 | alpha=2.045e+05 n_pcs=4000 (pc_topk) weight={'name': 'pc_logistic', 'floor': 1e-06, 'clip_max': 2.5, 'prob_clip': 0.029671855426569967, 'n_components': 40, 'logistic_c': 1.9132707658144027e-05, 'pca_fit': 'combined', 'solver': 'lbfgs', 'max_iter': 2000, 'fit_intercept': True, 'standardize_with_source': True, 'rho': 1.0}
[I 2026-06-01 15:36:08,745] Trial 278 finished with value: 0.24524912685217162 and parameters: {'alpha': 204526.3637452358, 'n_pcs': 4000, 'iw_method': 'pc_logistic', 'iw_clip_max': 2.5, 'iw_prob_clip': 0.029671855426569967, 'iw_n_components': 40, 'iw_logistic_c': 1.9132707658144027e-05, 'iw_pca_fit': 'combined', 'iw_solver': 'lbfgs', 'iw_rho': 1.0}. Best is trial 276 with value: 0.24580438788682182.
2026-06-01 15:36:08 | INFO | Trial 279 | outer=2 | alpha=1.943e+05 n_pcs=4500 (pc_topk) weight={'name': 'pc_logistic', 'floor': 1e-06, 'clip_max': 2.5, 'prob_clip': 0.030839090955484785, 'n_components': 40, 'logistic_c': 1.607730054332127e-05, 'pca_fit': 'combined', 'solver': 'lbfgs', 'max_iter': 2000, 'fit_intercept': True, 'standardize_with_source': True, 'rho': 1.0}
[I 2026-06-01 15:36:27,551] Trial 279 finished with value: 0.24392044127324713 and parameters: {'alpha': 194267.62135684572, 'n_pcs': 4500, 'iw_method': 'pc_logistic', 'iw_clip_max': 2.5, 'iw_prob_clip': 0.030839090955484785, 'iw_n_components': 40, 'iw_logistic_c': 1.607730054332127e-05, 'iw_pca_fit': 'combined', 'iw_solver': 'lbfgs', 'iw_rho': 1.0}. Best is trial 276 with value: 0.24580438788682182.
2026-06-01 15:36:27 | INFO | Trial 280 | outer=2 | alpha=2.119e+05 n_pcs=4000 (pc_topk) weight={'name': 'pc_logistic', 'floor': 1e-06, 'clip_max': 2.5, 'prob_clip': 0.0297222621612737, 'n_components': 40, 'logistic_c': 5.184272376917181e-06, 'pca_fit': 'combined', 'solver': 'lbfgs', 'max_iter': 2000, 'fit_intercept': True, 'standardize_with_source': True, 'rho': 1.0}
[I 2026-06-01 15:36:40,826] Trial 280 finished with value: 0.23984736030596338 and parameters: {'alpha': 211862.13419075526, 'n_pcs': 4000, 'iw_method': 'pc_logistic', 'iw_clip_max': 2.5, 'iw_prob_clip': 0.0297222621612737, 'iw_n_components': 40, 'iw_logistic_c': 5.184272376917181e-06, 'iw_pca_fit': 'combined', 'iw_solver': 'lbfgs', 'iw_rho': 1.0}. Best is trial 276 with value: 0.24580438788682182.
2026-06-01 15:36:40 | INFO | Trial 281 | outer=2 | alpha=1.905e+05 n_pcs=4000 (pc_topk) weight={'name': 'pc_logistic', 'floor': 1e-06, 'clip_max': 2.5, 'prob_clip': 0.02318500943532338, 'n_components': 40, 'logistic_c': 1.0820589105363373e-05, 'pca_fit': 'combined', 'solver': 'lbfgs', 'max_iter': 2000, 'fit_intercept': True, 'standardize_with_source': True, 'rho': 1.0}
[I 2026-06-01 15:37:20,146] Trial 281 finished with value: 0.24385984746110445 and parameters: {'alpha': 190532.6883230898, 'n_pcs': 4000, 'iw_method': 'pc_logistic', 'iw_clip_max': 2.5, 'iw_prob_clip': 0.02318500943532338, 'iw_n_components': 40, 'iw_logistic_c': 1.0820589105363373e-05, 'iw_pca_fit': 'combined', 'iw_solver': 'lbfgs', 'iw_rho': 1.0}. Best is trial 276 with value: 0.24580438788682182.
2026-06-01 15:37:20 | INFO | Trial 282 | outer=2 | alpha=2.380e+05 n_pcs=4000 (pc_topk) weight={'name': 'pc_logistic', 'floor': 1e-06, 'clip_max': 12.0, 'prob_clip': 0.040001433756878486, 'n_components': 100, 'logistic_c': 1.987569954577767e-05, 'pca_fit': 'combined', 'solver': 'lbfgs', 'max_iter': 2000, 'fit_intercept': True, 'standardize_with_source': True, 'rho': 1.0}
[I 2026-06-01 15:37:33,957] Trial 282 finished with value: 0.2301628306213565 and parameters: {'alpha': 237956.80399138306, 'n_pcs': 4000, 'iw_method': 'pc_logistic', 'iw_clip_max': 12.0, 'iw_prob_clip': 0.040001433756878486, 'iw_n_components': 100, 'iw_logistic_c': 1.987569954577767e-05, 'iw_pca_fit': 'combined', 'iw_solver': 'lbfgs', 'iw_rho': 1.0}. Best is trial 276 with value: 0.24580438788682182.
2026-06-01 15:37:33 | INFO | Trial 283 | outer=2 | alpha=1.741e+05 n_pcs=4000 (pc_topk) weight={'name': 'pc_logistic', 'floor': 1e-06, 'clip_max': 2.5, 'prob_clip': 0.020518701714704442, 'n_components': 60, 'logistic_c': 2.56562666638586e-05, 'pca_fit': 'combined', 'solver': 'lbfgs', 'max_iter': 2000, 'fit_intercept': True, 'standardize_with_source': True, 'rho': 1.0}
[I 2026-06-01 15:37:53,648] Trial 283 finished with value: 0.2458449183362247 and parameters: {'alpha': 174085.29373783572, 'n_pcs': 4000, 'iw_method': 'pc_logistic', 'iw_clip_max': 2.5, 'iw_prob_clip': 0.020518701714704442, 'iw_n_components': 60, 'iw_logistic_c': 2.56562666638586e-05, 'iw_pca_fit': 'combined', 'iw_solver': 'lbfgs', 'iw_rho': 1.0}. Best is trial 283 with value: 0.2458449183362247.
2026-06-01 15:37:53 | INFO | Trial 284 | outer=2 | alpha=1.701e+05 n_pcs=4000 (pc_topk) weight={'name': 'pc_logistic', 'floor': 1e-06, 'clip_max': 2.5, 'prob_clip': 0.020309038639581615, 'n_components': 10, 'logistic_c': 1.3784944323881761e-05, 'pca_fit': 'combined', 'solver': 'lbfgs', 'max_iter': 2000, 'fit_intercept': True, 'standardize_with_source': True, 'rho': 1.0}
[I 2026-06-01 15:38:14,978] Trial 284 finished with value: 0.24236184147728052 and parameters: {'alpha': 170055.82927846594, 'n_pcs': 4000, 'iw_method': 'pc_logistic', 'iw_clip_max': 2.5, 'iw_prob_clip': 0.020309038639581615, 'iw_n_components': 10, 'iw_logistic_c': 1.3784944323881761e-05, 'iw_pca_fit': 'combined', 'iw_solver': 'lbfgs', 'iw_rho': 1.0}. Best is trial 283 with value: 0.2458449183362247.
2026-06-01 15:38:15 | INFO | Trial 285 | outer=2 | alpha=1.693e+05 n_pcs=4500 (pc_topk) weight={'name': 'pc_logistic', 'floor': 1e-06, 'clip_max': 2.5, 'prob_clip': 0.022180150459723786, 'n_components': 60, 'logistic_c': 1.9123706461175417e-05, 'pca_fit': 'combined', 'solver': 'lbfgs', 'max_iter': 2000, 'fit_intercept': True, 'standardize_with_source': True, 'rho': 1.0}
[I 2026-06-01 15:38:41,684] Trial 285 finished with value: 0.24504985655088457 and parameters: {'alpha': 169273.716031125, 'n_pcs': 4500, 'iw_method': 'pc_logistic', 'iw_clip_max': 2.5, 'iw_prob_clip': 0.022180150459723786, 'iw_n_components': 60, 'iw_logistic_c': 1.9123706461175417e-05, 'iw_pca_fit': 'combined', 'iw_solver': 'lbfgs', 'iw_rho': 1.0}. Best is trial 283 with value: 0.2458449183362247.
2026-06-01 15:38:41 | INFO | Trial 286 | outer=2 | alpha=1.735e+05 n_pcs=4500 (pc_topk) weight={'name': 'pc_logistic', 'floor': 1e-06, 'clip_max': 2.5, 'prob_clip': 0.019988779772983807, 'n_components': 40, 'logistic_c': 8.407751034810319e-06, 'pca_fit': 'combined', 'solver': 'lbfgs', 'max_iter': 2000, 'fit_intercept': True, 'standardize_with_source': True, 'rho': 1.0}
