[I 2026-05-31 23:42:32,069] Trial 132 finished with value: 0.20783657654685322 and parameters: {'alpha': 288040.10477705346, 'n_pcs': 3000, 'weight_scheme': 'exponential', 'weight_clip_max': 3.0, 'weight_exponential_beta': 3.319981773218114}. Best is trial 120 with value: 0.20839733917851877.
2026-05-31 23:42:32 | INFO | src.nested_cv_avggrm_weighted_unified | Trial 133 | outer=3 | alpha=2.574e+05 n_pcs=3000 (pc_topk) weight_search=on
2026-05-31 23:42:32 | INFO | src.nested_cv_avggrm_weighted_unified | Trial 133 | outer=3 | weight={'name': 'exponential', 'floor': 1e-06, 'clip_max': 3.0, 'beta': 3.3682067326726526}
[I 2026-05-31 23:42:35,945] Trial 133 finished with value: 0.2080895081899731 and parameters: {'alpha': 257355.67232675152, 'n_pcs': 3000, 'weight_scheme': 'exponential', 'weight_clip_max': 3.0, 'weight_exponential_beta': 3.3682067326726526}. Best is trial 120 with value: 0.20839733917851877.
2026-05-31 23:42:35 | INFO | src.nested_cv_avggrm_weighted_unified | Trial 134 | outer=3 | alpha=3.260e+05 n_pcs=3000 (pc_topk) weight_search=on
2026-05-31 23:42:35 | INFO | src.nested_cv_avggrm_weighted_unified | Trial 134 | outer=3 | weight={'name': 'exponential', 'floor': 1e-06, 'clip_max': 3.0, 'beta': 3.383418617252958}
[I 2026-05-31 23:42:39,785] Trial 134 finished with value: 0.2074800805883914 and parameters: {'alpha': 325953.4815726634, 'n_pcs': 3000, 'weight_scheme': 'exponential', 'weight_clip_max': 3.0, 'weight_exponential_beta': 3.383418617252958}. Best is trial 120 with value: 0.20839733917851877.
2026-05-31 23:42:39 | INFO | src.nested_cv_avggrm_weighted_unified | Trial 135 | outer=3 | alpha=3.103e+05 n_pcs=3000 (pc_topk) weight_search=on
2026-05-31 23:42:39 | INFO | src.nested_cv_avggrm_weighted_unified | Trial 135 | outer=3 | weight={'name': 'exponential', 'floor': 1e-06, 'clip_max': 3.0, 'beta': 3.2916334496594084}
[I 2026-05-31 23:42:43,613] Trial 135 finished with value: 0.20764652386891172 and parameters: {'alpha': 310281.888298114, 'n_pcs': 3000, 'weight_scheme': 'exponential', 'weight_clip_max': 3.0, 'weight_exponential_beta': 3.2916334496594084}. Best is trial 120 with value: 0.20839733917851877.
2026-05-31 23:42:43 | INFO | src.nested_cv_avggrm_weighted_unified | Trial 136 | outer=3 | alpha=2.476e+05 n_pcs=3000 (pc_topk) weight_search=on
2026-05-31 23:42:43 | INFO | src.nested_cv_avggrm_weighted_unified | Trial 136 | outer=3 | weight={'name': 'exponential', 'floor': 1e-06, 'clip_max': 3.0, 'beta': 3.094810843864682}
[I 2026-05-31 23:42:47,425] Trial 136 finished with value: 0.20813983486731624 and parameters: {'alpha': 247588.75029442133, 'n_pcs': 3000, 'weight_scheme': 'exponential', 'weight_clip_max': 3.0, 'weight_exponential_beta': 3.094810843864682}. Best is trial 120 with value: 0.20839733917851877.
2026-05-31 23:42:47 | INFO | src.nested_cv_avggrm_weighted_unified | Trial 137 | outer=3 | alpha=2.593e+05 n_pcs=3000 (pc_topk) weight_search=on
2026-05-31 23:42:47 | INFO | src.nested_cv_avggrm_weighted_unified | Trial 137 | outer=3 | weight={'name': 'exponential', 'floor': 1e-06, 'clip_max': 3.0, 'beta': 2.9098826466053747}
[I 2026-05-31 23:42:51,238] Trial 137 finished with value: 0.20783613179813226 and parameters: {'alpha': 259309.27145944056, 'n_pcs': 3000, 'weight_scheme': 'exponential', 'weight_clip_max': 3.0, 'weight_exponential_beta': 2.9098826466053747}. Best is trial 120 with value: 0.20839733917851877.
2026-05-31 23:42:51 | INFO | src.nested_cv_avggrm_weighted_unified | Trial 138 | outer=3 | alpha=2.483e+05 n_pcs=3000 (pc_topk) weight_search=on
2026-05-31 23:42:51 | INFO | src.nested_cv_avggrm_weighted_unified | Trial 138 | outer=3 | weight={'name': 'exponential', 'floor': 1e-06, 'clip_max': None, 'beta': 2.859340327562647}
2026-05-31 23:42:53 | INFO | src.nested_cv_avggrm_weighted_unified | Trial 138 | outer=3 | pruned after 6/10 inner folds (mean r=0.2212)
[I 2026-05-31 23:42:53,487] Trial 138 pruned. 
2026-05-31 23:42:53 | INFO | src.nested_cv_avggrm_weighted_unified | Trial 139 | outer=3 | alpha=1.829e+05 n_pcs=3000 (pc_topk) weight_search=on
2026-05-31 23:42:53 | INFO | src.nested_cv_avggrm_weighted_unified | Trial 139 | outer=3 | weight={'name': 'exponential', 'floor': 1e-06, 'clip_max': 3.0, 'beta': 2.973638066894972}
[I 2026-05-31 23:42:57,264] Trial 139 finished with value: 0.20845773819312136 and parameters: {'alpha': 182941.1841589177, 'n_pcs': 3000, 'weight_scheme': 'exponential', 'weight_clip_max': 3.0, 'weight_exponential_beta': 2.973638066894972}. Best is trial 139 with value: 0.20845773819312136.
2026-05-31 23:42:57 | INFO | src.nested_cv_avggrm_weighted_unified | OUTER 3 | new best trial 139 (mean inner r=0.2085) saved to outputs/final_results/e6_pc_ridge_avggrm/thr_wing/e6_pc_ridge_avggrm_thr_wing_best_trials/split_03_best_trial.json
2026-05-31 23:42:57 | INFO | src.nested_cv_avggrm_weighted_unified | Trial 140 | outer=3 | alpha=1.776e+05 n_pcs=3000 (pc_topk) weight_search=on
2026-05-31 23:42:57 | INFO | src.nested_cv_avggrm_weighted_unified | Trial 140 | outer=3 | weight={'name': 'exponential', 'floor': 1e-06, 'clip_max': 5.0, 'beta': 2.8680206558439245}
[I 2026-05-31 23:43:01,926] Trial 140 finished with value: 0.20551863340040252 and parameters: {'alpha': 177632.46563710584, 'n_pcs': 3000, 'weight_scheme': 'exponential', 'weight_clip_max': 5.0, 'weight_exponential_beta': 2.8680206558439245}. Best is trial 139 with value: 0.20845773819312136.
2026-05-31 23:43:01 | INFO | src.nested_cv_avggrm_weighted_unified | Trial 141 | outer=3 | alpha=2.579e+05 n_pcs=3000 (pc_topk) weight_search=on
2026-05-31 23:43:01 | INFO | src.nested_cv_avggrm_weighted_unified | Trial 141 | outer=3 | weight={'name': 'exponential', 'floor': 1e-06, 'clip_max': 3.0, 'beta': 2.486366634618832}
[I 2026-05-31 23:43:05,722] Trial 141 finished with value: 0.20741968223951046 and parameters: {'alpha': 257871.2082992745, 'n_pcs': 3000, 'weight_scheme': 'exponential', 'weight_clip_max': 3.0, 'weight_exponential_beta': 2.486366634618832}. Best is trial 139 with value: 0.20845773819312136.
2026-05-31 23:43:05 | INFO | src.nested_cv_avggrm_weighted_unified | Trial 142 | outer=3 | alpha=2.571e+05 n_pcs=3000 (pc_topk) weight_search=on
2026-05-31 23:43:05 | INFO | src.nested_cv_avggrm_weighted_unified | Trial 142 | outer=3 | weight={'name': 'exponential', 'floor': 1e-06, 'clip_max': 3.0, 'beta': 3.045676349977155}
[I 2026-05-31 23:43:09,507] Trial 142 finished with value: 0.2080163396744116 and parameters: {'alpha': 257120.31780205027, 'n_pcs': 3000, 'weight_scheme': 'exponential', 'weight_clip_max': 3.0, 'weight_exponential_beta': 3.045676349977155}. Best is trial 139 with value: 0.20845773819312136.
2026-05-31 23:43:09 | INFO | src.nested_cv_avggrm_weighted_unified | Trial 143 | outer=3 | alpha=1.765e+05 n_pcs=3000 (pc_topk) weight_search=on
2026-05-31 23:43:09 | INFO | src.nested_cv_avggrm_weighted_unified | Trial 143 | outer=3 | weight={'name': 'exponential', 'floor': 1e-06, 'clip_max': 3.0, 'beta': 3.00708702714595}
[I 2026-05-31 23:43:13,333] Trial 143 finished with value: 0.2085112925592692 and parameters: {'alpha': 176517.12369355187, 'n_pcs': 3000, 'weight_scheme': 'exponential', 'weight_clip_max': 3.0, 'weight_exponential_beta': 3.00708702714595}. Best is trial 143 with value: 0.2085112925592692.
2026-05-31 23:43:13 | INFO | src.nested_cv_avggrm_weighted_unified | OUTER 3 | new best trial 143 (mean inner r=0.2085) saved to outputs/final_results/e6_pc_ridge_avggrm/thr_wing/e6_pc_ridge_avggrm_thr_wing_best_trials/split_03_best_trial.json
2026-05-31 23:43:13 | INFO | src.nested_cv_avggrm_weighted_unified | Trial 144 | outer=3 | alpha=1.832e+05 n_pcs=3000 (pc_topk) weight_search=on
2026-05-31 23:43:13 | INFO | src.nested_cv_avggrm_weighted_unified | Trial 144 | outer=3 | weight={'name': 'exponential', 'floor': 1e-06, 'clip_max': 3.0, 'beta': 2.9802870360043103}
[I 2026-05-31 23:43:17,534] Trial 144 finished with value: 0.20846342267817963 and parameters: {'alpha': 183226.6110932345, 'n_pcs': 3000, 'weight_scheme': 'exponential', 'weight_clip_max': 3.0, 'weight_exponential_beta': 2.9802870360043103}. Best is trial 143 with value: 0.2085112925592692.
2026-05-31 23:43:17 | INFO | src.nested_cv_avggrm_weighted_unified | Trial 145 | outer=3 | alpha=1.785e+05 n_pcs=3000 (pc_topk) weight_search=on
2026-05-31 23:43:17 | INFO | src.nested_cv_avggrm_weighted_unified | Trial 145 | outer=3 | weight={'name': 'exponential', 'floor': 1e-06, 'clip_max': 3.0, 'beta': 2.9535862625757714}
[I 2026-05-31 23:43:21,389] Trial 145 finished with value: 0.208453807522546 and parameters: {'alpha': 178526.50364658487, 'n_pcs': 3000, 'weight_scheme': 'exponential', 'weight_clip_max': 3.0, 'weight_exponential_beta': 2.9535862625757714}. Best is trial 143 with value: 0.2085112925592692.
2026-05-31 23:43:21 | INFO | src.nested_cv_avggrm_weighted_unified | Trial 146 | outer=3 | alpha=1.798e+05 n_pcs=3500 (pc_topk) weight_search=on
2026-05-31 23:43:21 | INFO | src.nested_cv_avggrm_weighted_unified | Trial 146 | outer=3 | weight={'name': 'exponential', 'floor': 1e-06, 'clip_max': 3.0, 'beta': 2.445464763251284}
2026-05-31 23:43:24 | INFO | src.nested_cv_avggrm_weighted_unified | Trial 146 | outer=3 | pruned after 6/10 inner folds (mean r=0.2220)
[I 2026-05-31 23:43:24,315] Trial 146 pruned. 
2026-05-31 23:43:24 | INFO | src.nested_cv_avggrm_weighted_unified | Trial 147 | outer=3 | alpha=1.528e+05 n_pcs=3000 (pc_topk) weight_search=on
2026-05-31 23:43:24 | INFO | src.nested_cv_avggrm_weighted_unified | Trial 147 | outer=3 | weight={'name': 'exponential', 'floor': 1e-06, 'clip_max': 3.0, 'beta': 3.0573987142251675}
[I 2026-05-31 23:43:28,098] Trial 147 finished with value: 0.2085598910336853 and parameters: {'alpha': 152782.11943809307, 'n_pcs': 3000, 'weight_scheme': 'exponential', 'weight_clip_max': 3.0, 'weight_exponential_beta': 3.0573987142251675}. Best is trial 147 with value: 0.2085598910336853.
2026-05-31 23:43:28 | INFO | src.nested_cv_avggrm_weighted_unified | OUTER 3 | new best trial 147 (mean inner r=0.2086) saved to outputs/final_results/e6_pc_ridge_avggrm/thr_wing/e6_pc_ridge_avggrm_thr_wing_best_trials/split_03_best_trial.json
2026-05-31 23:43:28 | INFO | src.nested_cv_avggrm_weighted_unified | Trial 148 | outer=3 | alpha=1.684e+05 n_pcs=3000 (pc_topk) weight_search=on
2026-05-31 23:43:28 | INFO | src.nested_cv_avggrm_weighted_unified | Trial 148 | outer=3 | weight={'name': 'exponential', 'floor': 1e-06, 'clip_max': 3.0, 'beta': 3.0970051225204305}
[I 2026-05-31 23:43:32,313] Trial 148 finished with value: 0.20859388196438702 and parameters: {'alpha': 168401.24838127272, 'n_pcs': 3000, 'weight_scheme': 'exponential', 'weight_clip_max': 3.0, 'weight_exponential_beta': 3.0970051225204305}. Best is trial 148 with value: 0.20859388196438702.
2026-05-31 23:43:32 | INFO | src.nested_cv_avggrm_weighted_unified | OUTER 3 | new best trial 148 (mean inner r=0.2086) saved to outputs/final_results/e6_pc_ridge_avggrm/thr_wing/e6_pc_ridge_avggrm_thr_wing_best_trials/split_03_best_trial.json
2026-05-31 23:43:32 | INFO | src.nested_cv_avggrm_weighted_unified | Trial 149 | outer=3 | alpha=1.512e+05 n_pcs=3000 (pc_topk) weight_search=on
2026-05-31 23:43:32 | INFO | src.nested_cv_avggrm_weighted_unified | Trial 149 | outer=3 | weight={'name': 'exponential', 'floor': 1e-06, 'clip_max': 3.0, 'beta': 3.011685076131585}
[I 2026-05-31 23:43:36,762] Trial 149 finished with value: 0.20852648513099775 and parameters: {'alpha': 151153.27383803544, 'n_pcs': 3000, 'weight_scheme': 'exponential', 'weight_clip_max': 3.0, 'weight_exponential_beta': 3.011685076131585}. Best is trial 148 with value: 0.20859388196438702.
2026-05-31 23:43:36 | INFO | src.nested_cv_avggrm_weighted_unified | Trial 150 | outer=3 | alpha=1.489e+05 n_pcs=3500 (pc_topk) weight_search=on
2026-05-31 23:43:36 | INFO | src.nested_cv_avggrm_weighted_unified | Trial 150 | outer=3 | weight={'name': 'exponential', 'floor': 1e-06, 'clip_max': 3.0, 'beta': 3.1249505239906066}
2026-05-31 23:43:39 | INFO | src.nested_cv_avggrm_weighted_unified | Trial 150 | outer=3 | pruned after 6/10 inner folds (mean r=0.2203)
[I 2026-05-31 23:43:39,637] Trial 150 pruned. 
2026-05-31 23:43:39 | INFO | src.nested_cv_avggrm_weighted_unified | Trial 151 | outer=3 | alpha=1.837e+05 n_pcs=3000 (pc_topk) weight_search=on
2026-05-31 23:43:39 | INFO | src.nested_cv_avggrm_weighted_unified | Trial 151 | outer=3 | weight={'name': 'exponential', 'floor': 1e-06, 'clip_max': 3.0, 'beta': 2.942413939642124}
[I 2026-05-31 23:43:43,553] Trial 151 finished with value: 0.20842316112130513 and parameters: {'alpha': 183673.7208560493, 'n_pcs': 3000, 'weight_scheme': 'exponential', 'weight_clip_max': 3.0, 'weight_exponential_beta': 2.942413939642124}. Best is trial 148 with value: 0.20859388196438702.
2026-05-31 23:43:43 | INFO | src.nested_cv_avggrm_weighted_unified | Trial 152 | outer=3 | alpha=1.077e+05 n_pcs=3000 (pc_topk) weight_search=on
2026-05-31 23:43:43 | INFO | src.nested_cv_avggrm_weighted_unified | Trial 152 | outer=3 | weight={'name': 'exponential', 'floor': 1e-06, 'clip_max': 3.0, 'beta': 2.4261227759503665}
2026-05-31 23:43:46 | INFO | src.nested_cv_avggrm_weighted_unified | Trial 152 | outer=3 | pruned after 7/10 inner folds (mean r=0.2473)
[I 2026-05-31 23:43:46,436] Trial 152 pruned. 
2026-05-31 23:43:46 | INFO | src.nested_cv_avggrm_weighted_unified | Trial 153 | outer=3 | alpha=1.712e+05 n_pcs=3000 (pc_topk) weight_search=on
2026-05-31 23:43:46 | INFO | src.nested_cv_avggrm_weighted_unified | Trial 153 | outer=3 | weight={'name': 'exponential', 'floor': 1e-06, 'clip_max': 3.0, 'beta': 3.0672646081816723}
[I 2026-05-31 23:43:50,285] Trial 153 finished with value: 0.2085666114643631 and parameters: {'alpha': 171196.90051046075, 'n_pcs': 3000, 'weight_scheme': 'exponential', 'weight_clip_max': 3.0, 'weight_exponential_beta': 3.0672646081816723}. Best is trial 148 with value: 0.20859388196438702.
2026-05-31 23:43:50 | INFO | src.nested_cv_avggrm_weighted_unified | Trial 154 | outer=3 | alpha=1.613e+05 n_pcs=3000 (pc_topk) weight_search=on
2026-05-31 23:43:50 | INFO | src.nested_cv_avggrm_weighted_unified | Trial 154 | outer=3 | weight={'name': 'exponential', 'floor': 1e-06, 'clip_max': 3.0, 'beta': 3.0020365756349454}
[I 2026-05-31 23:43:54,074] Trial 154 finished with value: 0.20853122718873904 and parameters: {'alpha': 161337.04796962067, 'n_pcs': 3000, 'weight_scheme': 'exponential', 'weight_clip_max': 3.0, 'weight_exponential_beta': 3.0020365756349454}. Best is trial 148 with value: 0.20859388196438702.
2026-05-31 23:43:54 | INFO | src.nested_cv_avggrm_weighted_unified | Trial 155 | outer=3 | alpha=1.581e+05 n_pcs=3000 (pc_topk) weight_search=on
2026-05-31 23:43:54 | INFO | src.nested_cv_avggrm_weighted_unified | Trial 155 | outer=3 | weight={'name': 'exponential', 'floor': 1e-06, 'clip_max': 3.0, 'beta': 1.262082780783318}
2026-05-31 23:43:56 | INFO | src.nested_cv_avggrm_weighted_unified | Trial 155 | outer=3 | pruned after 6/10 inner folds (mean r=0.2227)
[I 2026-05-31 23:43:56,955] Trial 155 pruned. 
2026-05-31 23:43:56 | INFO | src.nested_cv_avggrm_weighted_unified | Trial 156 | outer=3 | alpha=1.995e+05 n_pcs=3000 (pc_topk) weight_search=on
2026-05-31 23:43:56 | INFO | src.nested_cv_avggrm_weighted_unified | Trial 156 | outer=3 | weight={'name': 'exponential', 'floor': 1e-06, 'clip_max': 3.0, 'beta': 2.510240945903824}
[I 2026-05-31 23:44:00,774] Trial 156 finished with value: 0.20796526936895132 and parameters: {'alpha': 199523.1172686912, 'n_pcs': 3000, 'weight_scheme': 'exponential', 'weight_clip_max': 3.0, 'weight_exponential_beta': 2.510240945903824}. Best is trial 148 with value: 0.20859388196438702.
2026-05-31 23:44:00 | INFO | src.nested_cv_avggrm_weighted_unified | Trial 157 | outer=3 | alpha=1.089e+05 n_pcs=3000 (pc_topk) weight_search=on
2026-05-31 23:44:00 | INFO | src.nested_cv_avggrm_weighted_unified | Trial 157 | outer=3 | weight={'name': 'exponential', 'floor': 1e-06, 'clip_max': 3.0, 'beta': 3.0074003473084665}
2026-05-31 23:44:03 | INFO | src.nested_cv_avggrm_weighted_unified | Trial 157 | outer=3 | pruned after 7/10 inner folds (mean r=0.2466)
[I 2026-05-31 23:44:03,452] Trial 157 pruned. 
2026-05-31 23:44:03 | INFO | src.nested_cv_avggrm_weighted_unified | Trial 158 | outer=3 | alpha=1.464e+05 n_pcs=3000 (pc_topk) weight_search=on
2026-05-31 23:44:03 | INFO | src.nested_cv_avggrm_weighted_unified | Trial 158 | outer=3 | weight={'name': 'exponential', 'floor': 1e-06, 'clip_max': 3.0, 'beta': 3.863306449628292}
2026-05-31 23:44:05 | INFO | src.nested_cv_avggrm_weighted_unified | Trial 158 | outer=3 | pruned after 6/10 inner folds (mean r=0.2228)
[I 2026-05-31 23:44:05,763] Trial 158 pruned. 
2026-05-31 23:44:05 | INFO | src.nested_cv_avggrm_weighted_unified | Trial 159 | outer=3 | alpha=1.813e+05 n_pcs=3500 (pc_topk) weight_search=on
2026-05-31 23:44:05 | INFO | src.nested_cv_avggrm_weighted_unified | Trial 159 | outer=3 | weight={'name': 'exponential', 'floor': 1e-06, 'clip_max': 3.0, 'beta': 2.691568895920711}
2026-05-31 23:44:08 | INFO | src.nested_cv_avggrm_weighted_unified | Trial 159 | outer=3 | pruned after 6/10 inner folds (mean r=0.2216)
[I 2026-05-31 23:44:08,652] Trial 159 pruned. 
2026-05-31 23:44:08 | INFO | src.nested_cv_avggrm_weighted_unified | Trial 160 | outer=3 | alpha=1.314e+05 n_pcs=3000 (pc_topk) weight_search=on
2026-05-31 23:44:08 | INFO | src.nested_cv_avggrm_weighted_unified | Trial 160 | outer=3 | weight={'name': 'exponential', 'floor': 1e-06, 'clip_max': 3.0, 'beta': 2.235218140541634}
[I 2026-05-31 23:44:12,688] Trial 160 finished with value: 0.20755751078525334 and parameters: {'alpha': 131438.24911356857, 'n_pcs': 3000, 'weight_scheme': 'exponential', 'weight_clip_max': 3.0, 'weight_exponential_beta': 2.235218140541634}. Best is trial 148 with value: 0.20859388196438702.
2026-05-31 23:44:12 | INFO | src.nested_cv_avggrm_weighted_unified | Trial 161 | outer=3 | alpha=1.925e+05 n_pcs=3000 (pc_topk) weight_search=on
2026-05-31 23:44:12 | INFO | src.nested_cv_avggrm_weighted_unified | Trial 161 | outer=3 | weight={'name': 'exponential', 'floor': 1e-06, 'clip_max': 3.0, 'beta': 3.0577210359354643}
[I 2026-05-31 23:44:16,511] Trial 161 finished with value: 0.2084876770083623 and parameters: {'alpha': 192525.00542805024, 'n_pcs': 3000, 'weight_scheme': 'exponential', 'weight_clip_max': 3.0, 'weight_exponential_beta': 3.0577210359354643}. Best is trial 148 with value: 0.20859388196438702.
2026-05-31 23:44:16 | INFO | src.nested_cv_avggrm_weighted_unified | Trial 162 | outer=3 | alpha=1.863e+05 n_pcs=3000 (pc_topk) weight_search=on
2026-05-31 23:44:16 | INFO | src.nested_cv_avggrm_weighted_unified | Trial 162 | outer=3 | weight={'name': 'exponential', 'floor': 1e-06, 'clip_max': 3.0, 'beta': 3.055655696907345}
[I 2026-05-31 23:44:20,399] Trial 162 finished with value: 0.20851469677468035 and parameters: {'alpha': 186273.65971806087, 'n_pcs': 3000, 'weight_scheme': 'exponential', 'weight_clip_max': 3.0, 'weight_exponential_beta': 3.055655696907345}. Best is trial 148 with value: 0.20859388196438702.
2026-05-31 23:44:20 | INFO | src.nested_cv_avggrm_weighted_unified | Trial 163 | outer=3 | alpha=1.718e+05 n_pcs=3000 (pc_topk) weight_search=on
2026-05-31 23:44:20 | INFO | src.nested_cv_avggrm_weighted_unified | Trial 163 | outer=3 | weight={'name': 'exponential', 'floor': 1e-06, 'clip_max': 3.0, 'beta': 3.029914325764772}
[I 2026-05-31 23:44:24,229] Trial 163 finished with value: 0.20854082598141166 and parameters: {'alpha': 171780.73942608907, 'n_pcs': 3000, 'weight_scheme': 'exponential', 'weight_clip_max': 3.0, 'weight_exponential_beta': 3.029914325764772}. Best is trial 148 with value: 0.20859388196438702.
2026-05-31 23:44:24 | INFO | src.nested_cv_avggrm_weighted_unified | Trial 164 | outer=3 | alpha=1.844e+05 n_pcs=3000 (pc_topk) weight_search=on
2026-05-31 23:44:24 | INFO | src.nested_cv_avggrm_weighted_unified | Trial 164 | outer=3 | weight={'name': 'exponential', 'floor': 1e-06, 'clip_max': None, 'beta': 3.020040570113089}
2026-05-31 23:44:26 | INFO | src.nested_cv_avggrm_weighted_unified | Trial 164 | outer=3 | pruned after 6/10 inner folds (mean r=0.2196)
[I 2026-05-31 23:44:26,534] Trial 164 pruned. 
2026-05-31 23:44:26 | INFO | src.nested_cv_avggrm_weighted_unified | Trial 165 | outer=3 | alpha=8.286e+04 n_pcs=3000 (pc_topk) weight_search=on
2026-05-31 23:44:26 | INFO | src.nested_cv_avggrm_weighted_unified | Trial 165 | outer=3 | weight={'name': 'exponential', 'floor': 1e-06, 'clip_max': 3.0, 'beta': 2.686570249261737}
2026-05-31 23:44:29 | INFO | src.nested_cv_avggrm_weighted_unified | Trial 165 | outer=3 | pruned after 7/10 inner folds (mean r=0.2443)
[I 2026-05-31 23:44:29,221] Trial 165 pruned. 
2026-05-31 23:44:29 | INFO | src.nested_cv_avggrm_weighted_unified | Trial 166 | outer=3 | alpha=1.524e+05 n_pcs=3000 (pc_topk) weight_search=on
2026-05-31 23:44:29 | INFO | src.nested_cv_avggrm_weighted_unified | Trial 166 | outer=3 | weight={'name': 'exponential', 'floor': 1e-06, 'clip_max': 3.0, 'beta': 3.078539866364612}
[I 2026-05-31 23:44:32,999] Trial 166 finished with value: 0.2085701552876849 and parameters: {'alpha': 152370.3520329973, 'n_pcs': 3000, 'weight_scheme': 'exponential', 'weight_clip_max': 3.0, 'weight_exponential_beta': 3.078539866364612}. Best is trial 148 with value: 0.20859388196438702.
2026-05-31 23:44:33 | INFO | src.nested_cv_avggrm_weighted_unified | Trial 167 | outer=3 | alpha=1.158e+05 n_pcs=3000 (pc_topk) weight_search=on
2026-05-31 23:44:33 | INFO | src.nested_cv_avggrm_weighted_unified | Trial 167 | outer=3 | weight={'name': 'exponential', 'floor': 1e-06, 'clip_max': 3.0, 'beta': 1.9077018503234033}
2026-05-31 23:44:35 | INFO | src.nested_cv_avggrm_weighted_unified | Trial 167 | outer=3 | pruned after 7/10 inner folds (mean r=0.2473)
