[I 2026-06-01 14:07:23,342] Trial 230 finished with value: 0.2543714888576467 and parameters: {'alpha': 52294.152774415656, 'n_pcs': 5000, 'iw_method': 'pc_logistic', 'iw_clip_max': 4.0, 'iw_prob_clip': 0.01473880282140444, 'iw_n_components': 100, 'iw_logistic_c': 3.673922946077961e-05, 'iw_pca_fit': 'combined', 'iw_solver': 'lbfgs', 'iw_rho': 0.85}. Best is trial 210 with value: 0.2556677849525829.
2026-06-01 14:07:23 | INFO | Trial 231 | outer=1 | alpha=4.113e+04 n_pcs=5000 (pc_topk) weight={'name': 'pc_logistic', 'floor': 1e-06, 'clip_max': 4.0, 'prob_clip': 0.016800652137536256, 'n_components': 100, 'logistic_c': 7.044611408034766e-05, 'pca_fit': 'combined', 'solver': 'lbfgs', 'max_iter': 2000, 'fit_intercept': True, 'standardize_with_source': True, 'rho': 0.85}
[I 2026-06-01 14:07:41,961] Trial 231 finished with value: 0.25437112918969074 and parameters: {'alpha': 41133.52370319015, 'n_pcs': 5000, 'iw_method': 'pc_logistic', 'iw_clip_max': 4.0, 'iw_prob_clip': 0.016800652137536256, 'iw_n_components': 100, 'iw_logistic_c': 7.044611408034766e-05, 'iw_pca_fit': 'combined', 'iw_solver': 'lbfgs', 'iw_rho': 0.85}. Best is trial 210 with value: 0.2556677849525829.
2026-06-01 14:07:42 | INFO | Trial 232 | outer=1 | alpha=5.293e+04 n_pcs=5000 (pc_topk) weight={'name': 'pc_logistic', 'floor': 1e-06, 'clip_max': 4.0, 'prob_clip': 0.015229009834609713, 'n_components': 100, 'logistic_c': 5.056857257523132e-05, 'pca_fit': 'combined', 'solver': 'lbfgs', 'max_iter': 2000, 'fit_intercept': True, 'standardize_with_source': True, 'rho': 0.85}
[I 2026-06-01 14:08:00,854] Trial 232 finished with value: 0.25499339675815896 and parameters: {'alpha': 52925.432187484286, 'n_pcs': 5000, 'iw_method': 'pc_logistic', 'iw_clip_max': 4.0, 'iw_prob_clip': 0.015229009834609713, 'iw_n_components': 100, 'iw_logistic_c': 5.056857257523132e-05, 'iw_pca_fit': 'combined', 'iw_solver': 'lbfgs', 'iw_rho': 0.85}. Best is trial 210 with value: 0.2556677849525829.
2026-06-01 14:08:00 | INFO | Trial 233 | outer=1 | alpha=5.417e+04 n_pcs=5000 (pc_topk) weight={'name': 'pc_logistic', 'floor': 1e-06, 'clip_max': 4.0, 'prob_clip': 0.021962706464217233, 'n_components': 100, 'logistic_c': 4.3791207328324615e-05, 'pca_fit': 'combined', 'solver': 'lbfgs', 'max_iter': 2000, 'fit_intercept': True, 'standardize_with_source': True, 'rho': 0.85}
[I 2026-06-01 14:08:18,799] Trial 233 finished with value: 0.2550889593824732 and parameters: {'alpha': 54173.99288097042, 'n_pcs': 5000, 'iw_method': 'pc_logistic', 'iw_clip_max': 4.0, 'iw_prob_clip': 0.021962706464217233, 'iw_n_components': 100, 'iw_logistic_c': 4.3791207328324615e-05, 'iw_pca_fit': 'combined', 'iw_solver': 'lbfgs', 'iw_rho': 0.85}. Best is trial 210 with value: 0.2556677849525829.
2026-06-01 14:08:18 | INFO | Trial 234 | outer=1 | alpha=5.557e+04 n_pcs=5000 (pc_topk) weight={'name': 'pc_logistic', 'floor': 1e-06, 'clip_max': 4.0, 'prob_clip': 0.021684486047410335, 'n_components': 100, 'logistic_c': 1.8008622856025736e-05, 'pca_fit': 'combined', 'solver': 'lbfgs', 'max_iter': 2000, 'fit_intercept': True, 'standardize_with_source': True, 'rho': 0.85}
[I 2026-06-01 14:08:35,665] Trial 234 finished with value: 0.2539944138338779 and parameters: {'alpha': 55569.91633378082, 'n_pcs': 5000, 'iw_method': 'pc_logistic', 'iw_clip_max': 4.0, 'iw_prob_clip': 0.021684486047410335, 'iw_n_components': 100, 'iw_logistic_c': 1.8008622856025736e-05, 'iw_pca_fit': 'combined', 'iw_solver': 'lbfgs', 'iw_rho': 0.85}. Best is trial 210 with value: 0.2556677849525829.
2026-06-01 14:08:35 | INFO | Trial 235 | outer=1 | alpha=4.151e+04 n_pcs=5000 (pc_topk) weight={'name': 'pc_logistic', 'floor': 1e-06, 'clip_max': 7.0, 'prob_clip': 0.018846530768781046, 'n_components': 100, 'logistic_c': 3.2511434791843656e-05, 'pca_fit': 'combined', 'solver': 'lbfgs', 'max_iter': 2000, 'fit_intercept': True, 'standardize_with_source': True, 'rho': 0.85}
[I 2026-06-01 14:08:52,628] Trial 235 finished with value: 0.25198715338707156 and parameters: {'alpha': 41508.17298064148, 'n_pcs': 5000, 'iw_method': 'pc_logistic', 'iw_clip_max': 7.0, 'iw_prob_clip': 0.018846530768781046, 'iw_n_components': 100, 'iw_logistic_c': 3.2511434791843656e-05, 'iw_pca_fit': 'combined', 'iw_solver': 'lbfgs', 'iw_rho': 0.85}. Best is trial 210 with value: 0.2556677849525829.
2026-06-01 14:08:52 | INFO | Trial 236 | outer=1 | alpha=5.425e+04 n_pcs=5000 (pc_topk) weight={'name': 'pc_logistic', 'floor': 1e-06, 'clip_max': 4.0, 'prob_clip': 0.014313729686804132, 'n_components': 100, 'logistic_c': 4.4132692576242684e-05, 'pca_fit': 'combined', 'solver': 'lbfgs', 'max_iter': 2000, 'fit_intercept': True, 'standardize_with_source': True, 'rho': 0.85}
[I 2026-06-01 14:09:10,159] Trial 236 finished with value: 0.25482369814802963 and parameters: {'alpha': 54249.88991379369, 'n_pcs': 5000, 'iw_method': 'pc_logistic', 'iw_clip_max': 4.0, 'iw_prob_clip': 0.014313729686804132, 'iw_n_components': 100, 'iw_logistic_c': 4.4132692576242684e-05, 'iw_pca_fit': 'combined', 'iw_solver': 'lbfgs', 'iw_rho': 0.85}. Best is trial 210 with value: 0.2556677849525829.
2026-06-01 14:09:10 | INFO | Trial 237 | outer=1 | alpha=3.243e+04 n_pcs=5000 (pc_topk) weight={'name': 'pc_logistic', 'floor': 1e-06, 'clip_max': 4.0, 'prob_clip': 0.02614191329804297, 'n_components': 100, 'logistic_c': 5.721003699364767, 'pca_fit': 'combined', 'solver': 'lbfgs', 'max_iter': 2000, 'fit_intercept': True, 'standardize_with_source': True, 'rho': 0.85}
[I 2026-06-01 14:09:47,297] Trial 237 finished with value: 0.2480180078325948 and parameters: {'alpha': 32430.137747958033, 'n_pcs': 5000, 'iw_method': 'pc_logistic', 'iw_clip_max': 4.0, 'iw_prob_clip': 0.02614191329804297, 'iw_n_components': 100, 'iw_logistic_c': 5.721003699364767, 'iw_pca_fit': 'combined', 'iw_solver': 'lbfgs', 'iw_rho': 0.85}. Best is trial 210 with value: 0.2556677849525829.
2026-06-01 14:09:47 | INFO | Trial 238 | outer=1 | alpha=4.253e+04 n_pcs=5000 (pc_topk) weight={'name': 'pc_logistic', 'floor': 1e-06, 'clip_max': 4.0, 'prob_clip': 0.015513739343300388, 'n_components': 80, 'logistic_c': 7.04870301227726e-05, 'pca_fit': 'combined', 'solver': 'lbfgs', 'max_iter': 2000, 'fit_intercept': True, 'standardize_with_source': True, 'rho': 0.85}
[I 2026-06-01 14:10:04,767] Trial 238 finished with value: 0.25384506852972594 and parameters: {'alpha': 42528.223513735415, 'n_pcs': 5000, 'iw_method': 'pc_logistic', 'iw_clip_max': 4.0, 'iw_prob_clip': 0.015513739343300388, 'iw_n_components': 80, 'iw_logistic_c': 7.04870301227726e-05, 'iw_pca_fit': 'combined', 'iw_solver': 'lbfgs', 'iw_rho': 0.85}. Best is trial 210 with value: 0.2556677849525829.
2026-06-01 14:10:04 | INFO | Trial 239 | outer=1 | alpha=5.545e+04 n_pcs=5000 (pc_topk) weight={'name': 'pc_logistic', 'floor': 1e-06, 'clip_max': 4.0, 'prob_clip': 0.023003645844453142, 'n_components': 20, 'logistic_c': 4.7335318926978624e-05, 'pca_fit': 'combined', 'solver': 'lbfgs', 'max_iter': 2000, 'fit_intercept': True, 'standardize_with_source': True, 'rho': 0.85}
[I 2026-06-01 14:10:23,260] Trial 239 finished with value: 0.25476313393395916 and parameters: {'alpha': 55451.81654909611, 'n_pcs': 5000, 'iw_method': 'pc_logistic', 'iw_clip_max': 4.0, 'iw_prob_clip': 0.023003645844453142, 'iw_n_components': 20, 'iw_logistic_c': 4.7335318926978624e-05, 'iw_pca_fit': 'combined', 'iw_solver': 'lbfgs', 'iw_rho': 0.85}. Best is trial 210 with value: 0.2556677849525829.
2026-06-01 14:10:23 | INFO | Trial 240 | outer=1 | alpha=1.022e+05 n_pcs=5000 (pc_topk) weight={'name': 'pc_logistic', 'floor': 1e-06, 'clip_max': 1.5, 'prob_clip': 0.01836249016284474, 'n_components': 100, 'logistic_c': 3.526499049075356e-05, 'pca_fit': 'combined', 'solver': 'lbfgs', 'max_iter': 2000, 'fit_intercept': True, 'standardize_with_source': True, 'rho': 0.85}
[I 2026-06-01 14:10:40,723] Trial 240 finished with value: 0.24720830830986004 and parameters: {'alpha': 102248.66191665456, 'n_pcs': 5000, 'iw_method': 'pc_logistic', 'iw_clip_max': 1.5, 'iw_prob_clip': 0.01836249016284474, 'iw_n_components': 100, 'iw_logistic_c': 3.526499049075356e-05, 'iw_pca_fit': 'combined', 'iw_solver': 'lbfgs', 'iw_rho': 0.85}. Best is trial 210 with value: 0.2556677849525829.
2026-06-01 14:10:40 | INFO | Trial 241 | outer=1 | alpha=6.302e+04 n_pcs=5000 (pc_topk) weight={'name': 'pc_logistic', 'floor': 1e-06, 'clip_max': 4.0, 'prob_clip': 0.01246870139280549, 'n_components': 100, 'logistic_c': 6.971878119992993e-05, 'pca_fit': 'combined', 'solver': 'lbfgs', 'max_iter': 2000, 'fit_intercept': True, 'standardize_with_source': True, 'rho': 0.85}
[I 2026-06-01 14:10:58,640] Trial 241 finished with value: 0.25518161140786 and parameters: {'alpha': 63015.18766521338, 'n_pcs': 5000, 'iw_method': 'pc_logistic', 'iw_clip_max': 4.0, 'iw_prob_clip': 0.01246870139280549, 'iw_n_components': 100, 'iw_logistic_c': 6.971878119992993e-05, 'iw_pca_fit': 'combined', 'iw_solver': 'lbfgs', 'iw_rho': 0.85}. Best is trial 210 with value: 0.2556677849525829.
2026-06-01 14:10:58 | INFO | Trial 242 | outer=1 | alpha=4.854e+04 n_pcs=5000 (pc_topk) weight={'name': 'pc_logistic', 'floor': 1e-06, 'clip_max': 4.0, 'prob_clip': 0.012906195858241855, 'n_components': 100, 'logistic_c': 7.103690493454154e-05, 'pca_fit': 'combined', 'solver': 'lbfgs', 'max_iter': 2000, 'fit_intercept': True, 'standardize_with_source': True, 'rho': 0.85}
[I 2026-06-01 14:11:16,782] Trial 242 finished with value: 0.2544846038821703 and parameters: {'alpha': 48541.22371067498, 'n_pcs': 5000, 'iw_method': 'pc_logistic', 'iw_clip_max': 4.0, 'iw_prob_clip': 0.012906195858241855, 'iw_n_components': 100, 'iw_logistic_c': 7.103690493454154e-05, 'iw_pca_fit': 'combined', 'iw_solver': 'lbfgs', 'iw_rho': 0.85}. Best is trial 210 with value: 0.2556677849525829.
2026-06-01 14:11:16 | INFO | Trial 243 | outer=1 | alpha=3.022e+06 n_pcs=5000 (pc_topk) weight={'name': 'pc_logistic', 'floor': 1e-06, 'clip_max': 4.0, 'prob_clip': 0.020672417119873, 'n_components': 100, 'logistic_c': 5.5146062623500044e-05, 'pca_fit': 'combined', 'solver': 'lbfgs', 'max_iter': 2000, 'fit_intercept': True, 'standardize_with_source': True, 'rho': 0.85}
[I 2026-06-01 14:11:35,128] Trial 243 finished with value: 0.22916814344707323 and parameters: {'alpha': 3021917.7846032116, 'n_pcs': 5000, 'iw_method': 'pc_logistic', 'iw_clip_max': 4.0, 'iw_prob_clip': 0.020672417119873, 'iw_n_components': 100, 'iw_logistic_c': 5.5146062623500044e-05, 'iw_pca_fit': 'combined', 'iw_solver': 'lbfgs', 'iw_rho': 0.85}. Best is trial 210 with value: 0.2556677849525829.
2026-06-01 14:11:35 | INFO | Trial 244 | outer=1 | alpha=5.805e+04 n_pcs=5000 (pc_topk) weight={'name': 'pc_logistic', 'floor': 1e-06, 'clip_max': 4.0, 'prob_clip': 0.015407281346681762, 'n_components': 100, 'logistic_c': 2.9220815290083445e-05, 'pca_fit': 'combined', 'solver': 'lbfgs', 'max_iter': 2000, 'fit_intercept': True, 'standardize_with_source': True, 'rho': 0.85}
[I 2026-06-01 14:11:52,766] Trial 244 finished with value: 0.254406124985257 and parameters: {'alpha': 58047.79270204642, 'n_pcs': 5000, 'iw_method': 'pc_logistic', 'iw_clip_max': 4.0, 'iw_prob_clip': 0.015407281346681762, 'iw_n_components': 100, 'iw_logistic_c': 2.9220815290083445e-05, 'iw_pca_fit': 'combined', 'iw_solver': 'lbfgs', 'iw_rho': 0.85}. Best is trial 210 with value: 0.2556677849525829.
2026-06-01 14:11:52 | INFO | Trial 245 | outer=1 | alpha=6.583e+04 n_pcs=5000 (pc_topk) weight={'name': 'pc_logistic', 'floor': 1e-06, 'clip_max': 4.0, 'prob_clip': 0.012769956710635586, 'n_components': 100, 'logistic_c': 7.68936181535756e-05, 'pca_fit': 'combined', 'solver': 'lbfgs', 'max_iter': 2000, 'fit_intercept': True, 'standardize_with_source': True, 'rho': 0.85}
[I 2026-06-01 14:12:11,075] Trial 245 finished with value: 0.2553346674385246 and parameters: {'alpha': 65828.32820633406, 'n_pcs': 5000, 'iw_method': 'pc_logistic', 'iw_clip_max': 4.0, 'iw_prob_clip': 0.012769956710635586, 'iw_n_components': 100, 'iw_logistic_c': 7.68936181535756e-05, 'iw_pca_fit': 'combined', 'iw_solver': 'lbfgs', 'iw_rho': 0.85}. Best is trial 210 with value: 0.2556677849525829.
2026-06-01 14:12:11 | INFO | Trial 246 | outer=1 | alpha=6.894e+04 n_pcs=5000 (pc_topk) weight={'name': 'pc_logistic', 'floor': 1e-06, 'clip_max': 4.0, 'prob_clip': 0.012868802071825221, 'n_components': 10, 'logistic_c': 7.803302911298729e-05, 'pca_fit': 'combined', 'solver': 'lbfgs', 'max_iter': 2000, 'fit_intercept': True, 'standardize_with_source': True, 'rho': 0.85}
[I 2026-06-01 14:12:28,372] Trial 246 finished with value: 0.25138501098816723 and parameters: {'alpha': 68941.84437917055, 'n_pcs': 5000, 'iw_method': 'pc_logistic', 'iw_clip_max': 4.0, 'iw_prob_clip': 0.012868802071825221, 'iw_n_components': 10, 'iw_logistic_c': 7.803302911298729e-05, 'iw_pca_fit': 'combined', 'iw_solver': 'lbfgs', 'iw_rho': 0.85}. Best is trial 210 with value: 0.2556677849525829.
2026-06-01 14:12:28 | INFO | Trial 247 | outer=1 | alpha=9.404e+04 n_pcs=5000 (pc_topk) weight={'name': 'pc_logistic', 'floor': 1e-06, 'clip_max': 4.0, 'prob_clip': 0.013965323034498014, 'n_components': 100, 'logistic_c': 0.00012446412696450436, 'pca_fit': 'combined', 'solver': 'lbfgs', 'max_iter': 2000, 'fit_intercept': True, 'standardize_with_source': True, 'rho': 0.85}
[I 2026-06-01 14:12:47,082] Trial 247 finished with value: 0.2551842527994957 and parameters: {'alpha': 94038.5502479181, 'n_pcs': 5000, 'iw_method': 'pc_logistic', 'iw_clip_max': 4.0, 'iw_prob_clip': 0.013965323034498014, 'iw_n_components': 100, 'iw_logistic_c': 0.00012446412696450436, 'iw_pca_fit': 'combined', 'iw_solver': 'lbfgs', 'iw_rho': 0.85}. Best is trial 210 with value: 0.2556677849525829.
2026-06-01 14:12:47 | INFO | Trial 248 | outer=1 | alpha=9.760e+04 n_pcs=5000 (pc_topk) weight={'name': 'pc_logistic', 'floor': 1e-06, 'clip_max': 4.0, 'prob_clip': 0.013980698770991062, 'n_components': 40, 'logistic_c': 0.00013324721694949647, 'pca_fit': 'combined', 'solver': 'lbfgs', 'max_iter': 2000, 'fit_intercept': True, 'standardize_with_source': True, 'rho': 0.85}
[I 2026-06-01 14:13:05,407] Trial 248 finished with value: 0.25218807061433635 and parameters: {'alpha': 97597.57385035772, 'n_pcs': 5000, 'iw_method': 'pc_logistic', 'iw_clip_max': 4.0, 'iw_prob_clip': 0.013980698770991062, 'iw_n_components': 40, 'iw_logistic_c': 0.00013324721694949647, 'iw_pca_fit': 'combined', 'iw_solver': 'lbfgs', 'iw_rho': 0.85}. Best is trial 210 with value: 0.2556677849525829.
2026-06-01 14:13:05 | INFO | Trial 249 | outer=1 | alpha=8.446e+04 n_pcs=5000 (pc_topk) weight={'name': 'pc_logistic', 'floor': 1e-06, 'clip_max': 4.0, 'prob_clip': 0.012230046473678176, 'n_components': 100, 'logistic_c': 5.3215487695740025e-05, 'pca_fit': 'combined', 'solver': 'lbfgs', 'max_iter': 2000, 'fit_intercept': True, 'standardize_with_source': True, 'rho': 0.3}
[I 2026-06-01 14:13:21,586] Trial 249 finished with value: 0.2512781699832186 and parameters: {'alpha': 84461.37588534328, 'n_pcs': 5000, 'iw_method': 'pc_logistic', 'iw_clip_max': 4.0, 'iw_prob_clip': 0.012230046473678176, 'iw_n_components': 100, 'iw_logistic_c': 5.3215487695740025e-05, 'iw_pca_fit': 'combined', 'iw_solver': 'lbfgs', 'iw_rho': 0.3}. Best is trial 210 with value: 0.2556677849525829.
2026-06-01 14:13:21 | INFO | Trial 250 | outer=1 | alpha=6.111e+04 n_pcs=5000 (pc_topk) weight={'name': 'pc_logistic', 'floor': 1e-06, 'clip_max': 4.0, 'prob_clip': 0.017086075159217864, 'n_components': 100, 'logistic_c': 7.238610044978154e-05, 'pca_fit': 'combined', 'solver': 'lbfgs', 'max_iter': 2000, 'fit_intercept': True, 'standardize_with_source': True, 'rho': 0.85}
[I 2026-06-01 14:13:38,570] Trial 250 finished with value: 0.2555657562785144 and parameters: {'alpha': 61110.78771553016, 'n_pcs': 5000, 'iw_method': 'pc_logistic', 'iw_clip_max': 4.0, 'iw_prob_clip': 0.017086075159217864, 'iw_n_components': 100, 'iw_logistic_c': 7.238610044978154e-05, 'iw_pca_fit': 'combined', 'iw_solver': 'lbfgs', 'iw_rho': 0.85}. Best is trial 210 with value: 0.2556677849525829.
2026-06-01 14:13:38 | INFO | Trial 251 | outer=1 | alpha=5.764e+04 n_pcs=5000 (pc_topk) weight={'name': 'pc_logistic', 'floor': 1e-06, 'clip_max': 2.5, 'prob_clip': 0.017337738429127655, 'n_components': 100, 'logistic_c': 7.360727486715257e-05, 'pca_fit': 'combined', 'solver': 'lbfgs', 'max_iter': 2000, 'fit_intercept': True, 'standardize_with_source': True, 'rho': 0.5}
[I 2026-06-01 14:13:55,231] Trial 251 finished with value: 0.25368148446909855 and parameters: {'alpha': 57639.93866443598, 'n_pcs': 5000, 'iw_method': 'pc_logistic', 'iw_clip_max': 2.5, 'iw_prob_clip': 0.017337738429127655, 'iw_n_components': 100, 'iw_logistic_c': 7.360727486715257e-05, 'iw_pca_fit': 'combined', 'iw_solver': 'lbfgs', 'iw_rho': 0.5}. Best is trial 210 with value: 0.2556677849525829.
2026-06-01 14:13:55 | INFO | Trial 252 | outer=1 | alpha=4.321e+04 n_pcs=5000 (pc_topk) weight={'name': 'pc_logistic', 'floor': 1e-06, 'clip_max': 4.0, 'prob_clip': 0.015190815706760489, 'n_components': 100, 'logistic_c': 4.787099691289989e-05, 'pca_fit': 'combined', 'solver': 'lbfgs', 'max_iter': 2000, 'fit_intercept': True, 'standardize_with_source': True, 'rho': 0.85}
[I 2026-06-01 14:14:12,061] Trial 252 finished with value: 0.2541325503999319 and parameters: {'alpha': 43206.230189367685, 'n_pcs': 5000, 'iw_method': 'pc_logistic', 'iw_clip_max': 4.0, 'iw_prob_clip': 0.015190815706760489, 'iw_n_components': 100, 'iw_logistic_c': 4.787099691289989e-05, 'iw_pca_fit': 'combined', 'iw_solver': 'lbfgs', 'iw_rho': 0.85}. Best is trial 210 with value: 0.2556677849525829.
2026-06-01 14:14:12 | INFO | Trial 253 | outer=1 | alpha=3.500e+04 n_pcs=5000 (pc_topk) weight={'name': 'pc_logistic', 'floor': 1e-06, 'clip_max': 4.0, 'prob_clip': 0.014121757882112009, 'n_components': 100, 'logistic_c': 2.0800221804228376e-05, 'pca_fit': 'combined', 'solver': 'lbfgs', 'max_iter': 2000, 'fit_intercept': True, 'standardize_with_source': True, 'rho': 0.85}
[I 2026-06-01 14:14:27,979] Trial 253 finished with value: 0.25234594883845896 and parameters: {'alpha': 34998.60105394844, 'n_pcs': 5000, 'iw_method': 'pc_logistic', 'iw_clip_max': 4.0, 'iw_prob_clip': 0.014121757882112009, 'iw_n_components': 100, 'iw_logistic_c': 2.0800221804228376e-05, 'iw_pca_fit': 'combined', 'iw_solver': 'lbfgs', 'iw_rho': 0.85}. Best is trial 210 with value: 0.2556677849525829.
2026-06-01 14:14:28 | INFO | Trial 254 | outer=1 | alpha=1.036e+05 n_pcs=5000 (pc_topk) weight={'name': 'pc_logistic', 'floor': 1e-06, 'clip_max': 4.0, 'prob_clip': 0.01643775008466245, 'n_components': 60, 'logistic_c': 6.954290385199919e-05, 'pca_fit': 'combined', 'solver': 'lbfgs', 'max_iter': 2000, 'fit_intercept': True, 'standardize_with_source': True, 'rho': 0.85}
[I 2026-06-01 14:14:44,210] Trial 254 finished with value: 0.2530876255494904 and parameters: {'alpha': 103579.39258249609, 'n_pcs': 5000, 'iw_method': 'pc_logistic', 'iw_clip_max': 4.0, 'iw_prob_clip': 0.01643775008466245, 'iw_n_components': 60, 'iw_logistic_c': 6.954290385199919e-05, 'iw_pca_fit': 'combined', 'iw_solver': 'lbfgs', 'iw_rho': 0.85}. Best is trial 210 with value: 0.2556677849525829.
2026-06-01 14:14:44 | INFO | Trial 255 | outer=1 | alpha=6.213e+04 n_pcs=5000 (pc_topk) weight={'name': 'pc_logistic', 'floor': 1e-06, 'clip_max': 4.0, 'prob_clip': 0.012562841522108197, 'n_components': 100, 'logistic_c': 3.162275664588527e-05, 'pca_fit': 'combined', 'solver': 'lbfgs', 'max_iter': 2000, 'fit_intercept': True, 'standardize_with_source': True, 'rho': 0.85}
[I 2026-06-01 14:15:01,970] Trial 255 finished with value: 0.25451974751676454 and parameters: {'alpha': 62133.433445972536, 'n_pcs': 5000, 'iw_method': 'pc_logistic', 'iw_clip_max': 4.0, 'iw_prob_clip': 0.012562841522108197, 'iw_n_components': 100, 'iw_logistic_c': 3.162275664588527e-05, 'iw_pca_fit': 'combined', 'iw_solver': 'lbfgs', 'iw_rho': 0.85}. Best is trial 210 with value: 0.2556677849525829.
2026-06-01 14:15:01 | INFO | Trial 256 | outer=1 | alpha=8.540e+04 n_pcs=5000 (pc_topk) weight={'name': 'pc_logistic', 'floor': 1e-06, 'clip_max': 12.0, 'prob_clip': 0.013412199884211669, 'n_components': 100, 'logistic_c': 0.0001348980518712781, 'pca_fit': 'combined', 'solver': 'lbfgs', 'max_iter': 2000, 'fit_intercept': True, 'standardize_with_source': True, 'rho': 0.85}
[I 2026-06-01 14:15:19,877] Trial 256 finished with value: 0.2488636729259394 and parameters: {'alpha': 85400.99509336188, 'n_pcs': 5000, 'iw_method': 'pc_logistic', 'iw_clip_max': 12.0, 'iw_prob_clip': 0.013412199884211669, 'iw_n_components': 100, 'iw_logistic_c': 0.0001348980518712781, 'iw_pca_fit': 'combined', 'iw_solver': 'lbfgs', 'iw_rho': 0.85}. Best is trial 210 with value: 0.2556677849525829.
2026-06-01 14:15:19 | INFO | Trial 257 | outer=1 | alpha=4.761e+04 n_pcs=5000 (pc_topk) weight={'name': 'uniform'}
[I 2026-06-01 14:15:30,265] Trial 257 finished with value: 0.24379073083681035 and parameters: {'alpha': 47609.398312108235, 'n_pcs': 5000, 'iw_method': 'uniform'}. Best is trial 210 with value: 0.2556677849525829.
2026-06-01 14:15:30 | INFO | Trial 258 | outer=1 | alpha=6.639e+04 n_pcs=5000 (pc_topk) weight={'name': 'pc_logistic', 'floor': 1e-06, 'clip_max': 4.0, 'prob_clip': 0.014770474638942026, 'n_components': 100, 'logistic_c': 5.0653597858403156e-05, 'pca_fit': 'combined', 'solver': 'lbfgs', 'max_iter': 2000, 'fit_intercept': True, 'standardize_with_source': True, 'rho': 0.85}
