[I 2026-06-01 01:52:50,544] Trial 208 finished with value: 0.22236508524010218 and parameters: {'alpha': 106478.10851055004, 'n_pcs': 4500, 'weight_scheme': 'exponential', 'weight_clip_max': 5.0, 'weight_exponential_beta': 5.657915081578271}. Best is trial 67 with value: 0.22356194409955688.
2026-06-01 01:52:50 | INFO | src.nested_cv_avggrm_weighted_unified | Trial 209 | outer=8 | alpha=1.762e+05 n_pcs=4000 (pc_topk) weight_search=on
2026-06-01 01:52:50 | INFO | src.nested_cv_avggrm_weighted_unified | Trial 209 | outer=8 | weight={'name': 'exponential', 'floor': 1e-06, 'clip_max': 5.0, 'beta': 9.933321596100065}
[I 2026-06-01 01:52:56,302] Trial 209 finished with value: 0.2174437872086342 and parameters: {'alpha': 176188.68531969123, 'n_pcs': 4000, 'weight_scheme': 'exponential', 'weight_clip_max': 5.0, 'weight_exponential_beta': 9.933321596100065}. Best is trial 67 with value: 0.22356194409955688.
2026-06-01 01:52:56 | INFO | src.nested_cv_avggrm_weighted_unified | Trial 210 | outer=8 | alpha=1.473e+05 n_pcs=4000 (pc_topk) weight_search=on
2026-06-01 01:52:56 | INFO | src.nested_cv_avggrm_weighted_unified | Trial 210 | outer=8 | weight={'name': 'uniform', 'floor': 1e-06, 'clip_max': 5.0}
2026-06-01 01:52:58 | INFO | src.nested_cv_avggrm_weighted_unified | Trial 210 | outer=8 | pruned after 5/10 inner folds (mean r=0.2167)
[I 2026-06-01 01:52:58,847] Trial 210 pruned. 
2026-06-01 01:52:58 | INFO | src.nested_cv_avggrm_weighted_unified | Trial 211 | outer=8 | alpha=2.386e+05 n_pcs=4000 (pc_topk) weight_search=on
2026-06-01 01:52:58 | INFO | src.nested_cv_avggrm_weighted_unified | Trial 211 | outer=8 | weight={'name': 'exponential', 'floor': 1e-06, 'clip_max': 5.0, 'beta': 5.456741931537635}
[I 2026-06-01 01:53:04,610] Trial 211 finished with value: 0.22281420011370465 and parameters: {'alpha': 238574.15611708842, 'n_pcs': 4000, 'weight_scheme': 'exponential', 'weight_clip_max': 5.0, 'weight_exponential_beta': 5.456741931537635}. Best is trial 67 with value: 0.22356194409955688.
2026-06-01 01:53:04 | INFO | src.nested_cv_avggrm_weighted_unified | Trial 212 | outer=8 | alpha=1.849e+05 n_pcs=4000 (pc_topk) weight_search=on
2026-06-01 01:53:04 | INFO | src.nested_cv_avggrm_weighted_unified | Trial 212 | outer=8 | weight={'name': 'exponential', 'floor': 1e-06, 'clip_max': 5.0, 'beta': 5.770749588591329}
[I 2026-06-01 01:53:10,313] Trial 212 finished with value: 0.22305422217218562 and parameters: {'alpha': 184912.80723022128, 'n_pcs': 4000, 'weight_scheme': 'exponential', 'weight_clip_max': 5.0, 'weight_exponential_beta': 5.770749588591329}. Best is trial 67 with value: 0.22356194409955688.
2026-06-01 01:53:10 | INFO | src.nested_cv_avggrm_weighted_unified | Trial 213 | outer=8 | alpha=1.672e+05 n_pcs=4000 (pc_topk) weight_search=on
2026-06-01 01:53:10 | INFO | src.nested_cv_avggrm_weighted_unified | Trial 213 | outer=8 | weight={'name': 'exponential', 'floor': 1e-06, 'clip_max': 5.0, 'beta': 5.7332348696129865}
[I 2026-06-01 01:53:16,109] Trial 213 finished with value: 0.22304327745930305 and parameters: {'alpha': 167238.77937251274, 'n_pcs': 4000, 'weight_scheme': 'exponential', 'weight_clip_max': 5.0, 'weight_exponential_beta': 5.7332348696129865}. Best is trial 67 with value: 0.22356194409955688.
2026-06-01 01:53:16 | INFO | src.nested_cv_avggrm_weighted_unified | Trial 214 | outer=8 | alpha=1.453e+05 n_pcs=4000 (pc_topk) weight_search=on
2026-06-01 01:53:16 | INFO | src.nested_cv_avggrm_weighted_unified | Trial 214 | outer=8 | weight={'name': 'exponential', 'floor': 1e-06, 'clip_max': 5.0, 'beta': 5.739938435848045}
[I 2026-06-01 01:53:22,187] Trial 214 finished with value: 0.22295296659885655 and parameters: {'alpha': 145322.771355778, 'n_pcs': 4000, 'weight_scheme': 'exponential', 'weight_clip_max': 5.0, 'weight_exponential_beta': 5.739938435848045}. Best is trial 67 with value: 0.22356194409955688.
2026-06-01 01:53:22 | INFO | src.nested_cv_avggrm_weighted_unified | Trial 215 | outer=8 | alpha=1.851e+05 n_pcs=4000 (pc_topk) weight_search=on
2026-06-01 01:53:22 | INFO | src.nested_cv_avggrm_weighted_unified | Trial 215 | outer=8 | weight={'name': 'exponential', 'floor': 1e-06, 'clip_max': 5.0, 'beta': 5.626486655529675}
[I 2026-06-01 01:53:27,918] Trial 215 finished with value: 0.2230527411688729 and parameters: {'alpha': 185071.95052931647, 'n_pcs': 4000, 'weight_scheme': 'exponential', 'weight_clip_max': 5.0, 'weight_exponential_beta': 5.626486655529675}. Best is trial 67 with value: 0.22356194409955688.
2026-06-01 01:53:27 | INFO | src.nested_cv_avggrm_weighted_unified | Trial 216 | outer=8 | alpha=2.751e+05 n_pcs=4000 (pc_topk) weight_search=on
2026-06-01 01:53:27 | INFO | src.nested_cv_avggrm_weighted_unified | Trial 216 | outer=8 | weight={'name': 'exponential', 'floor': 1e-06, 'clip_max': 3.0, 'beta': 5.541419040571508}
[I 2026-06-01 01:53:33,669] Trial 216 finished with value: 0.22119660383424605 and parameters: {'alpha': 275066.567295843, 'n_pcs': 4000, 'weight_scheme': 'exponential', 'weight_clip_max': 3.0, 'weight_exponential_beta': 5.541419040571508}. Best is trial 67 with value: 0.22356194409955688.
2026-06-01 01:53:33 | INFO | src.nested_cv_avggrm_weighted_unified | Trial 217 | outer=8 | alpha=1.808e+05 n_pcs=4000 (pc_topk) weight_search=on
2026-06-01 01:53:33 | INFO | src.nested_cv_avggrm_weighted_unified | Trial 217 | outer=8 | weight={'name': 'exponential', 'floor': 1e-06, 'clip_max': 5.0, 'beta': 5.142400027182378}
[I 2026-06-01 01:53:39,437] Trial 217 finished with value: 0.2230563385655004 and parameters: {'alpha': 180803.5340254437, 'n_pcs': 4000, 'weight_scheme': 'exponential', 'weight_clip_max': 5.0, 'weight_exponential_beta': 5.142400027182378}. Best is trial 67 with value: 0.22356194409955688.
2026-06-01 01:53:39 | INFO | src.nested_cv_avggrm_weighted_unified | Trial 218 | outer=8 | alpha=2.386e+05 n_pcs=4000 (pc_topk) weight_search=on
2026-06-01 01:53:39 | INFO | src.nested_cv_avggrm_weighted_unified | Trial 218 | outer=8 | weight={'name': 'exponential', 'floor': 1e-06, 'clip_max': 5.0, 'beta': 5.896773560984147}
[I 2026-06-01 01:53:45,378] Trial 218 finished with value: 0.22293742214480866 and parameters: {'alpha': 238591.62707741707, 'n_pcs': 4000, 'weight_scheme': 'exponential', 'weight_clip_max': 5.0, 'weight_exponential_beta': 5.896773560984147}. Best is trial 67 with value: 0.22356194409955688.
2026-06-01 01:53:45 | INFO | src.nested_cv_avggrm_weighted_unified | Trial 219 | outer=8 | alpha=1.809e+05 n_pcs=4000 (pc_topk) weight_search=on
2026-06-01 01:53:45 | INFO | src.nested_cv_avggrm_weighted_unified | Trial 219 | outer=8 | weight={'name': 'linear', 'floor': 1e-06, 'clip_max': 5.0, 'min_weight': 0.7866049584489785, 'max_weight': 1.710012511321527}
[I 2026-06-01 01:53:51,099] Trial 219 finished with value: 0.2102464034947701 and parameters: {'alpha': 180879.47726513422, 'n_pcs': 4000, 'weight_scheme': 'linear', 'weight_clip_max': 5.0, 'weight_linear_min_weight': 0.7866049584489785, 'weight_linear_max_weight': 1.710012511321527}. Best is trial 67 with value: 0.22356194409955688.
2026-06-01 01:53:51 | INFO | src.nested_cv_avggrm_weighted_unified | Trial 220 | outer=8 | alpha=2.168e+05 n_pcs=4000 (pc_topk) weight_search=on
2026-06-01 01:53:51 | INFO | src.nested_cv_avggrm_weighted_unified | Trial 220 | outer=8 | weight={'name': 'exponential', 'floor': 1e-06, 'clip_max': 5.0, 'beta': 5.4766149696624575}
[I 2026-06-01 01:53:56,820] Trial 220 finished with value: 0.22294682139100855 and parameters: {'alpha': 216825.14580567856, 'n_pcs': 4000, 'weight_scheme': 'exponential', 'weight_clip_max': 5.0, 'weight_exponential_beta': 5.4766149696624575}. Best is trial 67 with value: 0.22356194409955688.
2026-06-01 01:53:56 | INFO | src.nested_cv_avggrm_weighted_unified | Trial 221 | outer=8 | alpha=1.417e+05 n_pcs=4000 (pc_topk) weight_search=on
2026-06-01 01:53:56 | INFO | src.nested_cv_avggrm_weighted_unified | Trial 221 | outer=8 | weight={'name': 'exponential', 'floor': 1e-06, 'clip_max': 5.0, 'beta': 5.045106374272563}
[I 2026-06-01 01:54:02,503] Trial 221 finished with value: 0.22308324437420496 and parameters: {'alpha': 141744.56803296713, 'n_pcs': 4000, 'weight_scheme': 'exponential', 'weight_clip_max': 5.0, 'weight_exponential_beta': 5.045106374272563}. Best is trial 67 with value: 0.22356194409955688.
2026-06-01 01:54:02 | INFO | src.nested_cv_avggrm_weighted_unified | Trial 222 | outer=8 | alpha=1.759e+05 n_pcs=4000 (pc_topk) weight_search=on
2026-06-01 01:54:02 | INFO | src.nested_cv_avggrm_weighted_unified | Trial 222 | outer=8 | weight={'name': 'exponential', 'floor': 1e-06, 'clip_max': 5.0, 'beta': 5.107219677880502}
[I 2026-06-01 01:54:08,208] Trial 222 finished with value: 0.223059762511227 and parameters: {'alpha': 175862.2549705288, 'n_pcs': 4000, 'weight_scheme': 'exponential', 'weight_clip_max': 5.0, 'weight_exponential_beta': 5.107219677880502}. Best is trial 67 with value: 0.22356194409955688.
2026-06-01 01:54:08 | INFO | src.nested_cv_avggrm_weighted_unified | Trial 223 | outer=8 | alpha=1.590e+05 n_pcs=4000 (pc_topk) weight_search=on
2026-06-01 01:54:08 | INFO | src.nested_cv_avggrm_weighted_unified | Trial 223 | outer=8 | weight={'name': 'exponential', 'floor': 1e-06, 'clip_max': 5.0, 'beta': 4.891355241535549}
[I 2026-06-01 01:54:15,270] Trial 223 finished with value: 0.22300236696265072 and parameters: {'alpha': 158960.0494612969, 'n_pcs': 4000, 'weight_scheme': 'exponential', 'weight_clip_max': 5.0, 'weight_exponential_beta': 4.891355241535549}. Best is trial 67 with value: 0.22356194409955688.
2026-06-01 01:54:15 | INFO | src.nested_cv_avggrm_weighted_unified | Trial 224 | outer=8 | alpha=1.832e+05 n_pcs=4000 (pc_topk) weight_search=on
2026-06-01 01:54:15 | INFO | src.nested_cv_avggrm_weighted_unified | Trial 224 | outer=8 | weight={'name': 'exponential', 'floor': 1e-06, 'clip_max': 5.0, 'beta': 5.066119839392364}
[I 2026-06-01 01:54:21,035] Trial 224 finished with value: 0.2230145274795387 and parameters: {'alpha': 183159.17650959914, 'n_pcs': 4000, 'weight_scheme': 'exponential', 'weight_clip_max': 5.0, 'weight_exponential_beta': 5.066119839392364}. Best is trial 67 with value: 0.22356194409955688.
2026-06-01 01:54:21 | INFO | src.nested_cv_avggrm_weighted_unified | Trial 225 | outer=8 | alpha=1.459e+05 n_pcs=4000 (pc_topk) weight_search=on
2026-06-01 01:54:21 | INFO | src.nested_cv_avggrm_weighted_unified | Trial 225 | outer=8 | weight={'name': 'exponential', 'floor': 1e-06, 'clip_max': 5.0, 'beta': 1.7644190523854175}
[I 2026-06-01 01:54:26,783] Trial 225 finished with value: 0.21735280745193603 and parameters: {'alpha': 145890.44581248885, 'n_pcs': 4000, 'weight_scheme': 'exponential', 'weight_clip_max': 5.0, 'weight_exponential_beta': 1.7644190523854175}. Best is trial 67 with value: 0.22356194409955688.
2026-06-01 01:54:26 | INFO | src.nested_cv_avggrm_weighted_unified | Trial 226 | outer=8 | alpha=1.166e+05 n_pcs=4000 (pc_topk) weight_search=on
2026-06-01 01:54:26 | INFO | src.nested_cv_avggrm_weighted_unified | Trial 226 | outer=8 | weight={'name': 'exponential', 'floor': 1e-06, 'clip_max': 5.0, 'beta': 5.281928716088852}
[I 2026-06-01 01:54:32,442] Trial 226 finished with value: 0.22290329703599068 and parameters: {'alpha': 116623.2106165462, 'n_pcs': 4000, 'weight_scheme': 'exponential', 'weight_clip_max': 5.0, 'weight_exponential_beta': 5.281928716088852}. Best is trial 67 with value: 0.22356194409955688.
2026-06-01 01:54:32 | INFO | src.nested_cv_avggrm_weighted_unified | Trial 227 | outer=8 | alpha=1.753e+05 n_pcs=4000 (pc_topk) weight_search=on
2026-06-01 01:54:32 | INFO | src.nested_cv_avggrm_weighted_unified | Trial 227 | outer=8 | weight={'name': 'exponential', 'floor': 1e-06, 'clip_max': 5.0, 'beta': 4.595514311111537}
[I 2026-06-01 01:54:38,103] Trial 227 finished with value: 0.22270800207614797 and parameters: {'alpha': 175327.6867867927, 'n_pcs': 4000, 'weight_scheme': 'exponential', 'weight_clip_max': 5.0, 'weight_exponential_beta': 4.595514311111537}. Best is trial 67 with value: 0.22356194409955688.
2026-06-01 01:54:38 | INFO | src.nested_cv_avggrm_weighted_unified | Trial 228 | outer=8 | alpha=1.357e+05 n_pcs=4000 (pc_topk) weight_search=on
2026-06-01 01:54:38 | INFO | src.nested_cv_avggrm_weighted_unified | Trial 228 | outer=8 | weight={'name': 'exponential', 'floor': 1e-06, 'clip_max': 5.0, 'beta': 5.537539609047234}
[I 2026-06-01 01:54:43,752] Trial 228 finished with value: 0.22296195481369496 and parameters: {'alpha': 135684.52391510853, 'n_pcs': 4000, 'weight_scheme': 'exponential', 'weight_clip_max': 5.0, 'weight_exponential_beta': 5.537539609047234}. Best is trial 67 with value: 0.22356194409955688.
2026-06-01 01:54:43 | INFO | src.nested_cv_avggrm_weighted_unified | Trial 229 | outer=8 | alpha=2.312e+05 n_pcs=4000 (pc_topk) weight_search=on
2026-06-01 01:54:43 | INFO | src.nested_cv_avggrm_weighted_unified | Trial 229 | outer=8 | weight={'name': 'exponential', 'floor': 1e-06, 'clip_max': 5.0, 'beta': 5.118006873408042}
[I 2026-06-01 01:54:49,590] Trial 229 finished with value: 0.2227384420685119 and parameters: {'alpha': 231183.18383674114, 'n_pcs': 4000, 'weight_scheme': 'exponential', 'weight_clip_max': 5.0, 'weight_exponential_beta': 5.118006873408042}. Best is trial 67 with value: 0.22356194409955688.
2026-06-01 01:54:49 | INFO | src.nested_cv_avggrm_weighted_unified | Trial 230 | outer=8 | alpha=1.854e+05 n_pcs=4000 (pc_topk) weight_search=on
2026-06-01 01:54:49 | INFO | src.nested_cv_avggrm_weighted_unified | Trial 230 | outer=8 | weight={'name': 'exponential', 'floor': 1e-06, 'clip_max': 5.0, 'beta': 5.7460693634111975}
[I 2026-06-01 01:54:55,351] Trial 230 finished with value: 0.2230529372434083 and parameters: {'alpha': 185408.61563018808, 'n_pcs': 4000, 'weight_scheme': 'exponential', 'weight_clip_max': 5.0, 'weight_exponential_beta': 5.7460693634111975}. Best is trial 67 with value: 0.22356194409955688.
2026-06-01 01:54:55 | INFO | src.nested_cv_avggrm_weighted_unified | Trial 231 | outer=8 | alpha=1.832e+05 n_pcs=4000 (pc_topk) weight_search=on
2026-06-01 01:54:55 | INFO | src.nested_cv_avggrm_weighted_unified | Trial 231 | outer=8 | weight={'name': 'exponential', 'floor': 1e-06, 'clip_max': 5.0, 'beta': 5.645723754448251}
[I 2026-06-01 01:55:01,391] Trial 231 finished with value: 0.22305501294075342 and parameters: {'alpha': 183195.03114989572, 'n_pcs': 4000, 'weight_scheme': 'exponential', 'weight_clip_max': 5.0, 'weight_exponential_beta': 5.645723754448251}. Best is trial 67 with value: 0.22356194409955688.
2026-06-01 01:55:01 | INFO | src.nested_cv_avggrm_weighted_unified | Trial 232 | outer=8 | alpha=1.584e+05 n_pcs=2000 (pc_topk) weight_search=on
2026-06-01 01:55:01 | INFO | src.nested_cv_avggrm_weighted_unified | Trial 232 | outer=8 | weight={'name': 'exponential', 'floor': 1e-06, 'clip_max': 5.0, 'beta': 5.737349345129235}
[I 2026-06-01 01:55:04,506] Trial 232 finished with value: 0.21772376203335483 and parameters: {'alpha': 158430.70793337486, 'n_pcs': 2000, 'weight_scheme': 'exponential', 'weight_clip_max': 5.0, 'weight_exponential_beta': 5.737349345129235}. Best is trial 67 with value: 0.22356194409955688.
2026-06-01 01:55:04 | INFO | src.nested_cv_avggrm_weighted_unified | Trial 233 | outer=8 | alpha=1.804e+05 n_pcs=4000 (pc_topk) weight_search=on
2026-06-01 01:55:04 | INFO | src.nested_cv_avggrm_weighted_unified | Trial 233 | outer=8 | weight={'name': 'exponential', 'floor': 1e-06, 'clip_max': 5.0, 'beta': 5.672146464546498}
[I 2026-06-01 01:55:10,447] Trial 233 finished with value: 0.22305644503858515 and parameters: {'alpha': 180358.76935666884, 'n_pcs': 4000, 'weight_scheme': 'exponential', 'weight_clip_max': 5.0, 'weight_exponential_beta': 5.672146464546498}. Best is trial 67 with value: 0.22356194409955688.
2026-06-01 01:55:10 | INFO | src.nested_cv_avggrm_weighted_unified | Trial 234 | outer=8 | alpha=1.462e+05 n_pcs=4000 (pc_topk) weight_search=on
2026-06-01 01:55:10 | INFO | src.nested_cv_avggrm_weighted_unified | Trial 234 | outer=8 | weight={'name': 'exponential', 'floor': 1e-06, 'clip_max': 5.0, 'beta': 5.531276469191757}
[I 2026-06-01 01:55:16,144] Trial 234 finished with value: 0.22302917378471848 and parameters: {'alpha': 146221.04181948045, 'n_pcs': 4000, 'weight_scheme': 'exponential', 'weight_clip_max': 5.0, 'weight_exponential_beta': 5.531276469191757}. Best is trial 67 with value: 0.22356194409955688.
2026-06-01 01:55:16 | INFO | src.nested_cv_avggrm_weighted_unified | Trial 235 | outer=8 | alpha=1.131e+05 n_pcs=4000 (pc_topk) weight_search=on
2026-06-01 01:55:16 | INFO | src.nested_cv_avggrm_weighted_unified | Trial 235 | outer=8 | weight={'name': 'exponential', 'floor': 1e-06, 'clip_max': 5.0, 'beta': 5.875911002648433}
[I 2026-06-01 01:55:21,859] Trial 235 finished with value: 0.2225019807658534 and parameters: {'alpha': 113123.33181033893, 'n_pcs': 4000, 'weight_scheme': 'exponential', 'weight_clip_max': 5.0, 'weight_exponential_beta': 5.875911002648433}. Best is trial 67 with value: 0.22356194409955688.
2026-06-01 01:55:21 | INFO | src.nested_cv_avggrm_weighted_unified | Trial 236 | outer=8 | alpha=2.631e+05 n_pcs=4000 (pc_topk) weight_search=on
2026-06-01 01:55:21 | INFO | src.nested_cv_avggrm_weighted_unified | Trial 236 | outer=8 | weight={'name': 'exponential', 'floor': 1e-06, 'clip_max': 3.0, 'beta': 5.312260619846113}
[I 2026-06-01 01:55:27,541] Trial 236 finished with value: 0.2211836883635904 and parameters: {'alpha': 263104.41759717907, 'n_pcs': 4000, 'weight_scheme': 'exponential', 'weight_clip_max': 3.0, 'weight_exponential_beta': 5.312260619846113}. Best is trial 67 with value: 0.22356194409955688.
2026-06-01 01:55:27 | INFO | src.nested_cv_avggrm_weighted_unified | Trial 237 | outer=8 | alpha=1.747e+05 n_pcs=4000 (pc_topk) weight_search=on
2026-06-01 01:55:27 | INFO | src.nested_cv_avggrm_weighted_unified | Trial 237 | outer=8 | weight={'name': 'exponential', 'floor': 1e-06, 'clip_max': 5.0, 'beta': 5.631938580923917}
[I 2026-06-01 01:55:33,171] Trial 237 finished with value: 0.22306037772988452 and parameters: {'alpha': 174740.6607987762, 'n_pcs': 4000, 'weight_scheme': 'exponential', 'weight_clip_max': 5.0, 'weight_exponential_beta': 5.631938580923917}. Best is trial 67 with value: 0.22356194409955688.
2026-06-01 01:55:33 | INFO | src.nested_cv_avggrm_weighted_unified | Trial 238 | outer=8 | alpha=2.157e+05 n_pcs=4000 (pc_topk) weight_search=on
2026-06-01 01:55:33 | INFO | src.nested_cv_avggrm_weighted_unified | Trial 238 | outer=8 | weight={'name': 'exponential', 'floor': 1e-06, 'clip_max': None, 'beta': 5.042197221853444}
[I 2026-06-01 01:55:38,779] Trial 238 finished with value: 0.2089587242251849 and parameters: {'alpha': 215685.12830421445, 'n_pcs': 4000, 'weight_scheme': 'exponential', 'weight_clip_max': None, 'weight_exponential_beta': 5.042197221853444}. Best is trial 67 with value: 0.22356194409955688.
2026-06-01 01:55:38 | INFO | src.nested_cv_avggrm_weighted_unified | Trial 239 | outer=8 | alpha=1.363e+05 n_pcs=4000 (pc_topk) weight_search=on
2026-06-01 01:55:38 | INFO | src.nested_cv_avggrm_weighted_unified | Trial 239 | outer=8 | weight={'name': 'exponential', 'floor': 1e-06, 'clip_max': 5.0, 'beta': 5.579172317755754}
[I 2026-06-01 01:55:44,490] Trial 239 finished with value: 0.2229439563406425 and parameters: {'alpha': 136263.16838164575, 'n_pcs': 4000, 'weight_scheme': 'exponential', 'weight_clip_max': 5.0, 'weight_exponential_beta': 5.579172317755754}. Best is trial 67 with value: 0.22356194409955688.
2026-06-01 01:55:44 | INFO | src.nested_cv_avggrm_weighted_unified | Trial 240 | outer=8 | alpha=1.760e+05 n_pcs=4000 (pc_topk) weight_search=on
2026-06-01 01:55:44 | INFO | src.nested_cv_avggrm_weighted_unified | Trial 240 | outer=8 | weight={'name': 'exponential', 'floor': 1e-06, 'clip_max': 5.0, 'beta': 5.292767881561475}
[I 2026-06-01 01:55:50,144] Trial 240 finished with value: 0.22310325814795987 and parameters: {'alpha': 175996.14735914665, 'n_pcs': 4000, 'weight_scheme': 'exponential', 'weight_clip_max': 5.0, 'weight_exponential_beta': 5.292767881561475}. Best is trial 67 with value: 0.22356194409955688.
2026-06-01 01:55:50 | INFO | src.nested_cv_avggrm_weighted_unified | Trial 241 | outer=8 | alpha=1.730e+05 n_pcs=4000 (pc_topk) weight_search=on
2026-06-01 01:55:50 | INFO | src.nested_cv_avggrm_weighted_unified | Trial 241 | outer=8 | weight={'name': 'exponential', 'floor': 1e-06, 'clip_max': 5.0, 'beta': 5.348017870969221}
[I 2026-06-01 01:55:55,780] Trial 241 finished with value: 0.22310341044637613 and parameters: {'alpha': 172992.2641627304, 'n_pcs': 4000, 'weight_scheme': 'exponential', 'weight_clip_max': 5.0, 'weight_exponential_beta': 5.348017870969221}. Best is trial 67 with value: 0.22356194409955688.
2026-06-01 01:55:55 | INFO | src.nested_cv_avggrm_weighted_unified | Trial 242 | outer=8 | alpha=1.573e+05 n_pcs=4000 (pc_topk) weight_search=on
2026-06-01 01:55:55 | INFO | src.nested_cv_avggrm_weighted_unified | Trial 242 | outer=8 | weight={'name': 'exponential', 'floor': 1e-06, 'clip_max': 5.0, 'beta': 5.257316304997973}
[I 2026-06-01 01:56:01,712] Trial 242 finished with value: 0.22312816199062704 and parameters: {'alpha': 157294.02893017858, 'n_pcs': 4000, 'weight_scheme': 'exponential', 'weight_clip_max': 5.0, 'weight_exponential_beta': 5.257316304997973}. Best is trial 67 with value: 0.22356194409955688.
2026-06-01 01:56:01 | INFO | src.nested_cv_avggrm_weighted_unified | Trial 243 | outer=8 | alpha=1.494e+05 n_pcs=4000 (pc_topk) weight_search=on
2026-06-01 01:56:01 | INFO | src.nested_cv_avggrm_weighted_unified | Trial 243 | outer=8 | weight={'name': 'exponential', 'floor': 1e-06, 'clip_max': 5.0, 'beta': 5.195269593899662}
