[I 2026-06-01 14:15:47,482] Trial 258 finished with value: 0.25538264199094896 and parameters: {'alpha': 66385.80358743349, 'n_pcs': 5000, 'iw_method': 'pc_logistic', 'iw_clip_max': 4.0, 'iw_prob_clip': 0.014770474638942026, 'iw_n_components': 100, 'iw_logistic_c': 5.0653597858403156e-05, 'iw_pca_fit': 'combined', 'iw_solver': 'lbfgs', 'iw_rho': 0.85}. Best is trial 210 with value: 0.2556677849525829.
2026-06-01 14:15:47 | INFO | Trial 259 | outer=1 | alpha=5.919e+04 n_pcs=5000 (pc_topk) weight={'name': 'pc_logistic', 'floor': 1e-06, 'clip_max': 4.0, 'prob_clip': 0.015319307087870668, 'n_components': 100, 'logistic_c': 5.565211064835506e-05, 'pca_fit': 'combined', 'solver': 'lbfgs', 'max_iter': 2000, 'fit_intercept': True, 'standardize_with_source': True, 'rho': 0.85}
[I 2026-06-01 14:16:05,667] Trial 259 finished with value: 0.2553796639363199 and parameters: {'alpha': 59188.49774048748, 'n_pcs': 5000, 'iw_method': 'pc_logistic', 'iw_clip_max': 4.0, 'iw_prob_clip': 0.015319307087870668, 'iw_n_components': 100, 'iw_logistic_c': 5.565211064835506e-05, 'iw_pca_fit': 'combined', 'iw_solver': 'lbfgs', 'iw_rho': 0.85}. Best is trial 210 with value: 0.2556677849525829.
2026-06-01 14:16:05 | INFO | Trial 260 | outer=1 | alpha=6.190e+04 n_pcs=5000 (pc_topk) weight={'name': 'pc_logistic', 'floor': 1e-06, 'clip_max': 4.0, 'prob_clip': 0.016821553863169667, 'n_components': 100, 'logistic_c': 8.030016485388213e-05, 'pca_fit': 'combined', 'solver': 'lbfgs', 'max_iter': 2000, 'fit_intercept': True, 'standardize_with_source': True, 'rho': 0.85}
[I 2026-06-01 14:16:23,789] Trial 260 finished with value: 0.25561158706512066 and parameters: {'alpha': 61903.97399236683, 'n_pcs': 5000, 'iw_method': 'pc_logistic', 'iw_clip_max': 4.0, 'iw_prob_clip': 0.016821553863169667, 'iw_n_components': 100, 'iw_logistic_c': 8.030016485388213e-05, 'iw_pca_fit': 'combined', 'iw_solver': 'lbfgs', 'iw_rho': 0.85}. Best is trial 210 with value: 0.2556677849525829.
2026-06-01 14:16:23 | INFO | Trial 261 | outer=1 | alpha=6.398e+04 n_pcs=5000 (pc_topk) weight={'name': 'pc_logistic', 'floor': 1e-06, 'clip_max': 4.0, 'prob_clip': 0.017992886645881757, 'n_components': 100, 'logistic_c': 8.737809613528858e-05, 'pca_fit': 'combined', 'solver': 'lbfgs', 'max_iter': 2000, 'fit_intercept': True, 'standardize_with_source': True, 'rho': 1.0}
[I 2026-06-01 14:16:42,541] Trial 261 finished with value: 0.2546463727964853 and parameters: {'alpha': 63975.38456904928, 'n_pcs': 5000, 'iw_method': 'pc_logistic', 'iw_clip_max': 4.0, 'iw_prob_clip': 0.017992886645881757, 'iw_n_components': 100, 'iw_logistic_c': 8.737809613528858e-05, 'iw_pca_fit': 'combined', 'iw_solver': 'lbfgs', 'iw_rho': 1.0}. Best is trial 210 with value: 0.2556677849525829.
2026-06-01 14:16:42 | INFO | Trial 262 | outer=1 | alpha=8.780e+04 n_pcs=5000 (pc_topk) weight={'name': 'pc_logistic', 'floor': 1e-06, 'clip_max': 4.0, 'prob_clip': 0.015600112874932242, 'n_components': 100, 'logistic_c': 8.21292063837612e-05, 'pca_fit': 'combined', 'solver': 'lbfgs', 'max_iter': 2000, 'fit_intercept': True, 'standardize_with_source': True, 'rho': 0.85}
[I 2026-06-01 14:17:01,916] Trial 262 finished with value: 0.25550969133456924 and parameters: {'alpha': 87796.05405398972, 'n_pcs': 5000, 'iw_method': 'pc_logistic', 'iw_clip_max': 4.0, 'iw_prob_clip': 0.015600112874932242, 'iw_n_components': 100, 'iw_logistic_c': 8.21292063837612e-05, 'iw_pca_fit': 'combined', 'iw_solver': 'lbfgs', 'iw_rho': 0.85}. Best is trial 210 with value: 0.2556677849525829.
2026-06-01 14:17:01 | INFO | Trial 263 | outer=1 | alpha=9.706e+04 n_pcs=5000 (pc_topk) weight={'name': 'pc_logistic', 'floor': 1e-06, 'clip_max': 4.0, 'prob_clip': 0.0164395164120515, 'n_components': 100, 'logistic_c': 0.00013503132032994286, 'pca_fit': 'combined', 'solver': 'lbfgs', 'max_iter': 2000, 'fit_intercept': True, 'standardize_with_source': True, 'rho': 0.85}
[I 2026-06-01 14:17:20,983] Trial 263 finished with value: 0.2547115782108033 and parameters: {'alpha': 97057.95695964369, 'n_pcs': 5000, 'iw_method': 'pc_logistic', 'iw_clip_max': 4.0, 'iw_prob_clip': 0.0164395164120515, 'iw_n_components': 100, 'iw_logistic_c': 0.00013503132032994286, 'iw_pca_fit': 'combined', 'iw_solver': 'lbfgs', 'iw_rho': 0.85}. Best is trial 210 with value: 0.2556677849525829.
2026-06-01 14:17:21 | INFO | Trial 264 | outer=1 | alpha=8.092e+04 n_pcs=5000 (pc_topk) weight={'name': 'pc_logistic', 'floor': 1e-06, 'clip_max': 4.0, 'prob_clip': 0.014320807948719805, 'n_components': 100, 'logistic_c': 8.552873136056719e-05, 'pca_fit': 'combined', 'solver': 'lbfgs', 'max_iter': 2000, 'fit_intercept': True, 'standardize_with_source': True, 'rho': 0.85}
[I 2026-06-01 14:17:39,478] Trial 264 finished with value: 0.2556355365817711 and parameters: {'alpha': 80921.72516719393, 'n_pcs': 5000, 'iw_method': 'pc_logistic', 'iw_clip_max': 4.0, 'iw_prob_clip': 0.014320807948719805, 'iw_n_components': 100, 'iw_logistic_c': 8.552873136056719e-05, 'iw_pca_fit': 'combined', 'iw_solver': 'lbfgs', 'iw_rho': 0.85}. Best is trial 210 with value: 0.2556677849525829.
2026-06-01 14:17:39 | INFO | Trial 265 | outer=1 | alpha=8.326e+04 n_pcs=5000 (pc_topk) weight={'name': 'pc_logistic', 'floor': 1e-06, 'clip_max': 4.0, 'prob_clip': 0.013743455276275315, 'n_components': 100, 'logistic_c': 0.0001375997878774287, 'pca_fit': 'combined', 'solver': 'lbfgs', 'max_iter': 2000, 'fit_intercept': True, 'standardize_with_source': True, 'rho': 0.85}
[I 2026-06-01 14:17:57,842] Trial 265 finished with value: 0.2552886761725971 and parameters: {'alpha': 83256.6711560257, 'n_pcs': 5000, 'iw_method': 'pc_logistic', 'iw_clip_max': 4.0, 'iw_prob_clip': 0.013743455276275315, 'iw_n_components': 100, 'iw_logistic_c': 0.0001375997878774287, 'iw_pca_fit': 'combined', 'iw_solver': 'lbfgs', 'iw_rho': 0.85}. Best is trial 210 with value: 0.2556677849525829.
2026-06-01 14:17:57 | INFO | Trial 266 | outer=1 | alpha=1.024e+05 n_pcs=5000 (pc_topk) weight={'name': 'pc_logistic', 'floor': 1e-06, 'clip_max': 4.0, 'prob_clip': 0.014082098372913104, 'n_components': 100, 'logistic_c': 0.00013170154562109935, 'pca_fit': 'combined', 'solver': 'lbfgs', 'max_iter': 2000, 'fit_intercept': True, 'standardize_with_source': True, 'rho': 0.85}
[I 2026-06-01 14:18:15,393] Trial 266 finished with value: 0.25488025816233223 and parameters: {'alpha': 102432.26233073733, 'n_pcs': 5000, 'iw_method': 'pc_logistic', 'iw_clip_max': 4.0, 'iw_prob_clip': 0.014082098372913104, 'iw_n_components': 100, 'iw_logistic_c': 0.00013170154562109935, 'iw_pca_fit': 'combined', 'iw_solver': 'lbfgs', 'iw_rho': 0.85}. Best is trial 210 with value: 0.2556677849525829.
2026-06-01 14:18:15 | INFO | Trial 267 | outer=1 | alpha=8.625e+04 n_pcs=5000 (pc_topk) weight={'name': 'pc_logistic', 'floor': 1e-06, 'clip_max': 4.0, 'prob_clip': 0.013226964711176946, 'n_components': 100, 'logistic_c': 8.751684355912723e-05, 'pca_fit': 'combined', 'solver': 'lbfgs', 'max_iter': 2000, 'fit_intercept': True, 'standardize_with_source': True, 'rho': 0.85}
[I 2026-06-01 14:18:33,894] Trial 267 finished with value: 0.2554749785324858 and parameters: {'alpha': 86245.3095707021, 'n_pcs': 5000, 'iw_method': 'pc_logistic', 'iw_clip_max': 4.0, 'iw_prob_clip': 0.013226964711176946, 'iw_n_components': 100, 'iw_logistic_c': 8.751684355912723e-05, 'iw_pca_fit': 'combined', 'iw_solver': 'lbfgs', 'iw_rho': 0.85}. Best is trial 210 with value: 0.2556677849525829.
2026-06-01 14:18:33 | INFO | Trial 268 | outer=1 | alpha=1.126e+05 n_pcs=5000 (pc_topk) weight={'name': 'pc_logistic', 'floor': 1e-06, 'clip_max': 4.0, 'prob_clip': 0.014196535914660016, 'n_components': 100, 'logistic_c': 0.00011210597153294993, 'pca_fit': 'combined', 'solver': 'lbfgs', 'max_iter': 2000, 'fit_intercept': True, 'standardize_with_source': True, 'rho': 0.85}
[I 2026-06-01 14:18:53,156] Trial 268 finished with value: 0.25480720664019235 and parameters: {'alpha': 112568.61032888928, 'n_pcs': 5000, 'iw_method': 'pc_logistic', 'iw_clip_max': 4.0, 'iw_prob_clip': 0.014196535914660016, 'iw_n_components': 100, 'iw_logistic_c': 0.00011210597153294993, 'iw_pca_fit': 'combined', 'iw_solver': 'lbfgs', 'iw_rho': 0.85}. Best is trial 210 with value: 0.2556677849525829.
2026-06-01 14:18:53 | INFO | Trial 269 | outer=1 | alpha=8.697e+04 n_pcs=5000 (pc_topk) weight={'name': 'pc_logistic', 'floor': 1e-06, 'clip_max': 7.0, 'prob_clip': 0.012877318822300856, 'n_components': 100, 'logistic_c': 8.710983998059509e-05, 'pca_fit': 'combined', 'solver': 'lbfgs', 'max_iter': 2000, 'fit_intercept': True, 'standardize_with_source': True, 'rho': 0.85}
[I 2026-06-01 14:19:11,875] Trial 269 finished with value: 0.253142897098801 and parameters: {'alpha': 86968.58200077091, 'n_pcs': 5000, 'iw_method': 'pc_logistic', 'iw_clip_max': 7.0, 'iw_prob_clip': 0.012877318822300856, 'iw_n_components': 100, 'iw_logistic_c': 8.710983998059509e-05, 'iw_pca_fit': 'combined', 'iw_solver': 'lbfgs', 'iw_rho': 0.85}. Best is trial 210 with value: 0.2556677849525829.
2026-06-01 14:19:11 | INFO | Trial 270 | outer=1 | alpha=8.561e+04 n_pcs=5000 (pc_topk) weight={'name': 'pc_logistic', 'floor': 1e-06, 'clip_max': 4.0, 'prob_clip': 0.01697732221456249, 'n_components': 100, 'logistic_c': 0.00016617129830918143, 'pca_fit': 'combined', 'solver': 'lbfgs', 'max_iter': 2000, 'fit_intercept': True, 'standardize_with_source': True, 'rho': 0.85}
[I 2026-06-01 14:19:32,141] Trial 270 finished with value: 0.2546238688340704 and parameters: {'alpha': 85605.82303856366, 'n_pcs': 5000, 'iw_method': 'pc_logistic', 'iw_clip_max': 4.0, 'iw_prob_clip': 0.01697732221456249, 'iw_n_components': 100, 'iw_logistic_c': 0.00016617129830918143, 'iw_pca_fit': 'combined', 'iw_solver': 'lbfgs', 'iw_rho': 0.85}. Best is trial 210 with value: 0.2556677849525829.
2026-06-01 14:19:32 | INFO | Trial 271 | outer=1 | alpha=1.110e+05 n_pcs=5000 (pc_topk) weight={'name': 'pc_logistic', 'floor': 1e-06, 'clip_max': 4.0, 'prob_clip': 0.0006267219206266685, 'n_components': 100, 'logistic_c': 0.0002573127666171469, 'pca_fit': 'combined', 'solver': 'lbfgs', 'max_iter': 2000, 'fit_intercept': True, 'standardize_with_source': True, 'rho': 0.85}
[I 2026-06-01 14:19:52,125] Trial 271 finished with value: 0.2535643918745948 and parameters: {'alpha': 111010.88740186907, 'n_pcs': 5000, 'iw_method': 'pc_logistic', 'iw_clip_max': 4.0, 'iw_prob_clip': 0.0006267219206266685, 'iw_n_components': 100, 'iw_logistic_c': 0.0002573127666171469, 'iw_pca_fit': 'combined', 'iw_solver': 'lbfgs', 'iw_rho': 0.85}. Best is trial 210 with value: 0.2556677849525829.
2026-06-01 14:19:52 | INFO | Trial 272 | outer=1 | alpha=8.185e+04 n_pcs=5000 (pc_topk) weight={'name': 'pc_logistic', 'floor': 1e-06, 'clip_max': 1.5, 'prob_clip': 0.014803600560759524, 'n_components': 80, 'logistic_c': 7.660371189528167e-05, 'pca_fit': 'combined', 'solver': 'lbfgs', 'max_iter': 2000, 'fit_intercept': True, 'standardize_with_source': True, 'rho': 0.85}
[I 2026-06-01 14:20:10,017] Trial 272 finished with value: 0.24957644963226197 and parameters: {'alpha': 81847.44366477366, 'n_pcs': 5000, 'iw_method': 'pc_logistic', 'iw_clip_max': 1.5, 'iw_prob_clip': 0.014803600560759524, 'iw_n_components': 80, 'iw_logistic_c': 7.660371189528167e-05, 'iw_pca_fit': 'combined', 'iw_solver': 'lbfgs', 'iw_rho': 0.85}. Best is trial 210 with value: 0.2556677849525829.
2026-06-01 14:20:10 | INFO | Trial 273 | outer=1 | alpha=7.963e+04 n_pcs=5000 (pc_topk) weight={'name': 'pc_logistic', 'floor': 1e-06, 'clip_max': 4.0, 'prob_clip': 0.012414974497685001, 'n_components': 100, 'logistic_c': 0.00013493758681327377, 'pca_fit': 'combined', 'solver': 'lbfgs', 'max_iter': 2000, 'fit_intercept': True, 'standardize_with_source': True, 'rho': 0.85}
[I 2026-06-01 14:20:29,185] Trial 273 finished with value: 0.2552367469152054 and parameters: {'alpha': 79630.56116727632, 'n_pcs': 5000, 'iw_method': 'pc_logistic', 'iw_clip_max': 4.0, 'iw_prob_clip': 0.012414974497685001, 'iw_n_components': 100, 'iw_logistic_c': 0.00013493758681327377, 'iw_pca_fit': 'combined', 'iw_solver': 'lbfgs', 'iw_rho': 0.85}. Best is trial 210 with value: 0.2556677849525829.
2026-06-01 14:20:29 | INFO | Trial 274 | outer=1 | alpha=7.391e+04 n_pcs=500 (pc_topk) weight={'name': 'pc_logistic', 'floor': 1e-06, 'clip_max': 4.0, 'prob_clip': 0.012493567026953454, 'n_components': 20, 'logistic_c': 0.00014585224438999703, 'pca_fit': 'combined', 'solver': 'lbfgs', 'max_iter': 2000, 'fit_intercept': True, 'standardize_with_source': True, 'rho': 0.85}
[I 2026-06-01 14:20:36,311] Trial 274 finished with value: 0.2043550549142541 and parameters: {'alpha': 73905.68572950293, 'n_pcs': 500, 'iw_method': 'pc_logistic', 'iw_clip_max': 4.0, 'iw_prob_clip': 0.012493567026953454, 'iw_n_components': 20, 'iw_logistic_c': 0.00014585224438999703, 'iw_pca_fit': 'combined', 'iw_solver': 'lbfgs', 'iw_rho': 0.85}. Best is trial 210 with value: 0.2556677849525829.
2026-06-01 14:20:36 | INFO | Trial 275 | outer=1 | alpha=7.000e+04 n_pcs=5000 (pc_topk) weight={'name': 'pc_logistic', 'floor': 1e-06, 'clip_max': 4.0, 'prob_clip': 0.01789050516254543, 'n_components': 100, 'logistic_c': 0.00010152604827058683, 'pca_fit': 'combined', 'solver': 'lbfgs', 'max_iter': 2000, 'fit_intercept': True, 'standardize_with_source': True, 'rho': 0.3}
[I 2026-06-01 14:20:54,200] Trial 275 finished with value: 0.2514744605675472 and parameters: {'alpha': 69996.4205148709, 'n_pcs': 5000, 'iw_method': 'pc_logistic', 'iw_clip_max': 4.0, 'iw_prob_clip': 0.01789050516254543, 'iw_n_components': 100, 'iw_logistic_c': 0.00010152604827058683, 'iw_pca_fit': 'combined', 'iw_solver': 'lbfgs', 'iw_rho': 0.3}. Best is trial 210 with value: 0.2556677849525829.
2026-06-01 14:20:54 | INFO | Trial 276 | outer=1 | alpha=9.717e+04 n_pcs=5000 (pc_topk) weight={'name': 'pc_logistic', 'floor': 1e-06, 'clip_max': 4.0, 'prob_clip': 0.01563312826560983, 'n_components': 10, 'logistic_c': 0.00022222106887408085, 'pca_fit': 'combined', 'solver': 'lbfgs', 'max_iter': 2000, 'fit_intercept': True, 'standardize_with_source': True, 'rho': 0.85}
[I 2026-06-01 14:21:12,619] Trial 276 finished with value: 0.25107059996004283 and parameters: {'alpha': 97171.69014434061, 'n_pcs': 5000, 'iw_method': 'pc_logistic', 'iw_clip_max': 4.0, 'iw_prob_clip': 0.01563312826560983, 'iw_n_components': 10, 'iw_logistic_c': 0.00022222106887408085, 'iw_pca_fit': 'combined', 'iw_solver': 'lbfgs', 'iw_rho': 0.85}. Best is trial 210 with value: 0.2556677849525829.
2026-06-01 14:21:12 | INFO | Trial 277 | outer=1 | alpha=7.869e+04 n_pcs=5000 (pc_topk) weight={'name': 'uniform'}
[I 2026-06-01 14:21:22,891] Trial 277 finished with value: 0.24051955872001374 and parameters: {'alpha': 78691.86911670223, 'n_pcs': 5000, 'iw_method': 'uniform'}. Best is trial 210 with value: 0.2556677849525829.
2026-06-01 14:21:22 | INFO | Trial 278 | outer=1 | alpha=6.089e+04 n_pcs=5000 (pc_topk) weight={'name': 'pc_logistic', 'floor': 1e-06, 'clip_max': 4.0, 'prob_clip': 0.012079765383938497, 'n_components': 100, 'logistic_c': 0.0001193803213376403, 'pca_fit': 'combined', 'solver': 'lbfgs', 'max_iter': 2000, 'fit_intercept': True, 'standardize_with_source': True, 'rho': 0.85}
[I 2026-06-01 14:21:41,765] Trial 278 finished with value: 0.255077510844348 and parameters: {'alpha': 60892.748286470276, 'n_pcs': 5000, 'iw_method': 'pc_logistic', 'iw_clip_max': 4.0, 'iw_prob_clip': 0.012079765383938497, 'iw_n_components': 100, 'iw_logistic_c': 0.0001193803213376403, 'iw_pca_fit': 'combined', 'iw_solver': 'lbfgs', 'iw_rho': 0.85}. Best is trial 210 with value: 0.2556677849525829.
2026-06-01 14:21:41 | INFO | Trial 279 | outer=1 | alpha=1.203e+05 n_pcs=5000 (pc_topk) weight={'name': 'pc_logistic', 'floor': 1e-06, 'clip_max': 4.0, 'prob_clip': 0.037208218615669704, 'n_components': 40, 'logistic_c': 8.595725882225917e-05, 'pca_fit': 'combined', 'solver': 'lbfgs', 'max_iter': 2000, 'fit_intercept': True, 'standardize_with_source': True, 'rho': 0.5}
[I 2026-06-01 14:22:00,212] Trial 279 finished with value: 0.24721660021471684 and parameters: {'alpha': 120253.35550241971, 'n_pcs': 5000, 'iw_method': 'pc_logistic', 'iw_clip_max': 4.0, 'iw_prob_clip': 0.037208218615669704, 'iw_n_components': 40, 'iw_logistic_c': 8.595725882225917e-05, 'iw_pca_fit': 'combined', 'iw_solver': 'lbfgs', 'iw_rho': 0.5}. Best is trial 210 with value: 0.2556677849525829.
2026-06-01 14:22:00 | INFO | Trial 280 | outer=1 | alpha=6.493e+04 n_pcs=5000 (pc_topk) weight={'name': 'pc_logistic', 'floor': 1e-06, 'clip_max': 4.0, 'prob_clip': 0.013572497101530932, 'n_components': 100, 'logistic_c': 0.00016984195518305895, 'pca_fit': 'combined', 'solver': 'lbfgs', 'max_iter': 2000, 'fit_intercept': True, 'standardize_with_source': True, 'rho': 0.85}
[I 2026-06-01 14:22:19,830] Trial 280 finished with value: 0.2550891987352292 and parameters: {'alpha': 64928.80151359822, 'n_pcs': 5000, 'iw_method': 'pc_logistic', 'iw_clip_max': 4.0, 'iw_prob_clip': 0.013572497101530932, 'iw_n_components': 100, 'iw_logistic_c': 0.00016984195518305895, 'iw_pca_fit': 'combined', 'iw_solver': 'lbfgs', 'iw_rho': 0.85}. Best is trial 210 with value: 0.2556677849525829.
2026-06-01 14:22:19 | INFO | Trial 281 | outer=1 | alpha=8.324e+04 n_pcs=5000 (pc_topk) weight={'name': 'pc_logistic', 'floor': 1e-06, 'clip_max': 2.5, 'prob_clip': 0.016363580445832172, 'n_components': 100, 'logistic_c': 8.374030581306169e-05, 'pca_fit': 'combined', 'solver': 'lbfgs', 'max_iter': 2000, 'fit_intercept': True, 'standardize_with_source': True, 'rho': 0.85}
[I 2026-06-01 14:22:38,837] Trial 281 finished with value: 0.2551021596433914 and parameters: {'alpha': 83239.1870832463, 'n_pcs': 5000, 'iw_method': 'pc_logistic', 'iw_clip_max': 2.5, 'iw_prob_clip': 0.016363580445832172, 'iw_n_components': 100, 'iw_logistic_c': 8.374030581306169e-05, 'iw_pca_fit': 'combined', 'iw_solver': 'lbfgs', 'iw_rho': 0.85}. Best is trial 210 with value: 0.2556677849525829.
2026-06-01 14:22:38 | INFO | Trial 282 | outer=1 | alpha=6.403e+04 n_pcs=5000 (pc_topk) weight={'name': 'pc_logistic', 'floor': 1e-06, 'clip_max': 4.0, 'prob_clip': 0.015025179808454935, 'n_components': 100, 'logistic_c': 0.0001283766925625432, 'pca_fit': 'combined', 'solver': 'lbfgs', 'max_iter': 2000, 'fit_intercept': True, 'standardize_with_source': True, 'rho': 0.85}
[I 2026-06-01 14:22:58,681] Trial 282 finished with value: 0.2554213326112235 and parameters: {'alpha': 64030.18836226489, 'n_pcs': 5000, 'iw_method': 'pc_logistic', 'iw_clip_max': 4.0, 'iw_prob_clip': 0.015025179808454935, 'iw_n_components': 100, 'iw_logistic_c': 0.0001283766925625432, 'iw_pca_fit': 'combined', 'iw_solver': 'lbfgs', 'iw_rho': 0.85}. Best is trial 210 with value: 0.2556677849525829.
2026-06-01 14:22:58 | INFO | Trial 283 | outer=1 | alpha=5.992e+04 n_pcs=5000 (pc_topk) weight={'name': 'pc_logistic', 'floor': 1e-06, 'clip_max': 4.0, 'prob_clip': 0.014733783823927291, 'n_components': 100, 'logistic_c': 7.64599656059854e-07, 'pca_fit': 'combined', 'solver': 'lbfgs', 'max_iter': 2000, 'fit_intercept': True, 'standardize_with_source': True, 'rho': 0.85}
[I 2026-06-01 14:23:15,327] Trial 283 finished with value: 0.2444539801069136 and parameters: {'alpha': 59923.299520292785, 'n_pcs': 5000, 'iw_method': 'pc_logistic', 'iw_clip_max': 4.0, 'iw_prob_clip': 0.014733783823927291, 'iw_n_components': 100, 'iw_logistic_c': 7.64599656059854e-07, 'iw_pca_fit': 'combined', 'iw_solver': 'lbfgs', 'iw_rho': 0.85}. Best is trial 210 with value: 0.2556677849525829.
2026-06-01 14:23:15 | INFO | Trial 284 | outer=1 | alpha=6.618e+04 n_pcs=5000 (pc_topk) weight={'name': 'pc_logistic', 'floor': 1e-06, 'clip_max': 4.0, 'prob_clip': 0.0009197701401637022, 'n_components': 100, 'logistic_c': 0.0002169471686635336, 'pca_fit': 'combined', 'solver': 'lbfgs', 'max_iter': 2000, 'fit_intercept': True, 'standardize_with_source': True, 'rho': 0.85}
[I 2026-06-01 14:23:35,548] Trial 284 finished with value: 0.2534057467760625 and parameters: {'alpha': 66182.15220831419, 'n_pcs': 5000, 'iw_method': 'pc_logistic', 'iw_clip_max': 4.0, 'iw_prob_clip': 0.0009197701401637022, 'iw_n_components': 100, 'iw_logistic_c': 0.0002169471686635336, 'iw_pca_fit': 'combined', 'iw_solver': 'lbfgs', 'iw_rho': 0.85}. Best is trial 210 with value: 0.2556677849525829.
2026-06-01 14:23:35 | INFO | Trial 285 | outer=1 | alpha=7.258e+04 n_pcs=5000 (pc_topk) weight={'name': 'pc_logistic', 'floor': 1e-06, 'clip_max': 4.0, 'prob_clip': 0.018660475178522935, 'n_components': 60, 'logistic_c': 0.00012743753686387851, 'pca_fit': 'combined', 'solver': 'lbfgs', 'max_iter': 2000, 'fit_intercept': True, 'standardize_with_source': True, 'rho': 0.85}
[I 2026-06-01 14:23:54,140] Trial 285 finished with value: 0.25280625982712174 and parameters: {'alpha': 72581.36561667049, 'n_pcs': 5000, 'iw_method': 'pc_logistic', 'iw_clip_max': 4.0, 'iw_prob_clip': 0.018660475178522935, 'iw_n_components': 60, 'iw_logistic_c': 0.00012743753686387851, 'iw_pca_fit': 'combined', 'iw_solver': 'lbfgs', 'iw_rho': 0.85}. Best is trial 210 with value: 0.2556677849525829.
2026-06-01 14:23:54 | INFO | Trial 286 | outer=1 | alpha=3.960e+04 n_pcs=5000 (pc_topk) weight={'name': 'pc_logistic', 'floor': 1e-06, 'clip_max': 12.0, 'prob_clip': 0.0173551811417708, 'n_components': 100, 'logistic_c': 8.544003841261888e-05, 'pca_fit': 'combined', 'solver': 'lbfgs', 'max_iter': 2000, 'fit_intercept': True, 'standardize_with_source': True, 'rho': 0.85}
