[I 2026-06-01 01:39:43,524] Trial 67 finished with value: 0.22356194409955688 and parameters: {'alpha': 242708.89319664153, 'n_pcs': 4000, 'weight_scheme': 'exponential', 'weight_clip_max': 3.0, 'weight_exponential_beta': 8.10058390652623}. Best is trial 67 with value: 0.22356194409955688.
2026-06-01 01:39:43 | INFO | src.nested_cv_avggrm_weighted_unified | OUTER 8 | new best trial 67 (mean inner r=0.2236) saved to outputs/final_results/e6_pc_ridge_avggrm/thr_wing/e6_pc_ridge_avggrm_thr_wing_best_trials/split_08_best_trial.json
2026-06-01 01:39:43 | INFO | src.nested_cv_avggrm_weighted_unified | Trial 68 | outer=8 | alpha=2.196e+05 n_pcs=1000 (pc_topk) weight_search=on
2026-06-01 01:39:43 | INFO | src.nested_cv_avggrm_weighted_unified | Trial 68 | outer=8 | weight={'name': 'exponential', 'floor': 1e-06, 'clip_max': 3.0, 'beta': 8.060953789881166}
[I 2026-06-01 01:39:45,415] Trial 68 finished with value: 0.21849190519696088 and parameters: {'alpha': 219594.0375813369, 'n_pcs': 1000, 'weight_scheme': 'exponential', 'weight_clip_max': 3.0, 'weight_exponential_beta': 8.060953789881166}. Best is trial 67 with value: 0.22356194409955688.
2026-06-01 01:39:45 | INFO | src.nested_cv_avggrm_weighted_unified | Trial 69 | outer=8 | alpha=8.981e+04 n_pcs=4500 (pc_topk) weight_search=on
2026-06-01 01:39:45 | INFO | src.nested_cv_avggrm_weighted_unified | Trial 69 | outer=8 | weight={'name': 'exponential', 'floor': 1e-06, 'clip_max': 3.0, 'beta': 8.882095092515414}
[I 2026-06-01 01:39:52,313] Trial 69 finished with value: 0.2204957189858662 and parameters: {'alpha': 89805.98021439991, 'n_pcs': 4500, 'weight_scheme': 'exponential', 'weight_clip_max': 3.0, 'weight_exponential_beta': 8.882095092515414}. Best is trial 67 with value: 0.22356194409955688.
2026-06-01 01:39:52 | INFO | src.nested_cv_avggrm_weighted_unified | Trial 70 | outer=8 | alpha=1.201e+05 n_pcs=3500 (pc_topk) weight_search=on
2026-06-01 01:39:52 | INFO | src.nested_cv_avggrm_weighted_unified | Trial 70 | outer=8 | weight={'name': 'exponential', 'floor': 1e-06, 'clip_max': 3.0, 'beta': 1.279475046705457}
[I 2026-06-01 01:39:57,245] Trial 70 finished with value: 0.21612791571283033 and parameters: {'alpha': 120065.58094398255, 'n_pcs': 3500, 'weight_scheme': 'exponential', 'weight_clip_max': 3.0, 'weight_exponential_beta': 1.279475046705457}. Best is trial 67 with value: 0.22356194409955688.
2026-06-01 01:39:57 | INFO | src.nested_cv_avggrm_weighted_unified | Trial 71 | outer=8 | alpha=2.556e+05 n_pcs=4000 (pc_topk) weight_search=on
2026-06-01 01:39:57 | INFO | src.nested_cv_avggrm_weighted_unified | Trial 71 | outer=8 | weight={'name': 'exponential', 'floor': 1e-06, 'clip_max': 3.0, 'beta': 7.053654277915311}
[I 2026-06-01 01:40:03,198] Trial 71 finished with value: 0.2228290212225544 and parameters: {'alpha': 255585.56473732964, 'n_pcs': 4000, 'weight_scheme': 'exponential', 'weight_clip_max': 3.0, 'weight_exponential_beta': 7.053654277915311}. Best is trial 67 with value: 0.22356194409955688.
2026-06-01 01:40:03 | INFO | src.nested_cv_avggrm_weighted_unified | Trial 72 | outer=8 | alpha=2.540e+05 n_pcs=4000 (pc_topk) weight_search=on
2026-06-01 01:40:03 | INFO | src.nested_cv_avggrm_weighted_unified | Trial 72 | outer=8 | weight={'name': 'exponential', 'floor': 1e-06, 'clip_max': None, 'beta': 7.535719057043432}
2026-06-01 01:40:07 | INFO | src.nested_cv_avggrm_weighted_unified | Trial 72 | outer=8 | pruned after 7/10 inner folds (mean r=0.2229)
[I 2026-06-01 01:40:07,619] Trial 72 pruned. 
2026-06-01 01:40:07 | INFO | src.nested_cv_avggrm_weighted_unified | Trial 73 | outer=8 | alpha=1.828e+05 n_pcs=4000 (pc_topk) weight_search=on
2026-06-01 01:40:07 | INFO | src.nested_cv_avggrm_weighted_unified | Trial 73 | outer=8 | weight={'name': 'exponential', 'floor': 1e-06, 'clip_max': 3.0, 'beta': 9.738338102209394}
[I 2026-06-01 01:40:13,776] Trial 73 finished with value: 0.22161312952310697 and parameters: {'alpha': 182847.44790154474, 'n_pcs': 4000, 'weight_scheme': 'exponential', 'weight_clip_max': 3.0, 'weight_exponential_beta': 9.738338102209394}. Best is trial 67 with value: 0.22356194409955688.
2026-06-01 01:40:13 | INFO | src.nested_cv_avggrm_weighted_unified | Trial 74 | outer=8 | alpha=6.200e+05 n_pcs=4500 (pc_topk) weight_search=on
2026-06-01 01:40:13 | INFO | src.nested_cv_avggrm_weighted_unified | Trial 74 | outer=8 | weight={'name': 'exponential', 'floor': 1e-06, 'clip_max': 3.0, 'beta': 7.018438406201303}
[I 2026-06-01 01:40:20,669] Trial 74 finished with value: 0.2184916272541661 and parameters: {'alpha': 619995.4704599659, 'n_pcs': 4500, 'weight_scheme': 'exponential', 'weight_clip_max': 3.0, 'weight_exponential_beta': 7.018438406201303}. Best is trial 67 with value: 0.22356194409955688.
2026-06-01 01:40:20 | INFO | src.nested_cv_avggrm_weighted_unified | Trial 75 | outer=8 | alpha=4.114e+05 n_pcs=4000 (pc_topk) weight_search=on
2026-06-01 01:40:20 | INFO | src.nested_cv_avggrm_weighted_unified | Trial 75 | outer=8 | weight={'name': 'exponential', 'floor': 1e-06, 'clip_max': 3.0, 'beta': 4.748949133614008}
[I 2026-06-01 01:40:26,586] Trial 75 finished with value: 0.21851107779632906 and parameters: {'alpha': 411443.87009151146, 'n_pcs': 4000, 'weight_scheme': 'exponential', 'weight_clip_max': 3.0, 'weight_exponential_beta': 4.748949133614008}. Best is trial 67 with value: 0.22356194409955688.
2026-06-01 01:40:26 | INFO | src.nested_cv_avggrm_weighted_unified | Trial 76 | outer=8 | alpha=6.003e+04 n_pcs=3500 (pc_topk) weight_search=on
2026-06-01 01:40:26 | INFO | src.nested_cv_avggrm_weighted_unified | Trial 76 | outer=8 | weight={'name': 'exponential', 'floor': 1e-06, 'clip_max': 3.0, 'beta': 8.133424896111164}
[I 2026-06-01 01:40:31,406] Trial 76 finished with value: 0.21576216032041065 and parameters: {'alpha': 60032.39387683447, 'n_pcs': 3500, 'weight_scheme': 'exponential', 'weight_clip_max': 3.0, 'weight_exponential_beta': 8.133424896111164}. Best is trial 67 with value: 0.22356194409955688.
2026-06-01 01:40:31 | INFO | src.nested_cv_avggrm_weighted_unified | Trial 77 | outer=8 | alpha=2.699e+05 n_pcs=4000 (pc_topk) weight_search=on
2026-06-01 01:40:31 | INFO | src.nested_cv_avggrm_weighted_unified | Trial 77 | outer=8 | weight={'name': 'uniform', 'floor': 1e-06, 'clip_max': 3.0}
2026-06-01 01:40:34 | INFO | src.nested_cv_avggrm_weighted_unified | Trial 77 | outer=8 | pruned after 5/10 inner folds (mean r=0.2060)
[I 2026-06-01 01:40:34,048] Trial 77 pruned. 
2026-06-01 01:40:34 | INFO | src.nested_cv_avggrm_weighted_unified | Trial 78 | outer=8 | alpha=1.630e+05 n_pcs=4500 (pc_topk) weight_search=on
2026-06-01 01:40:34 | INFO | src.nested_cv_avggrm_weighted_unified | Trial 78 | outer=8 | weight={'name': 'exponential', 'floor': 1e-06, 'clip_max': 10.0, 'beta': 0.06373965518789237}
2026-06-01 01:40:38 | INFO | src.nested_cv_avggrm_weighted_unified | Trial 78 | outer=8 | pruned after 7/10 inner folds (mean r=0.2270)
[I 2026-06-01 01:40:38,869] Trial 78 pruned. 
2026-06-01 01:40:38 | INFO | src.nested_cv_avggrm_weighted_unified | Trial 79 | outer=8 | alpha=1.192e+05 n_pcs=3500 (pc_topk) weight_search=on
2026-06-01 01:40:38 | INFO | src.nested_cv_avggrm_weighted_unified | Trial 79 | outer=8 | weight={'name': 'linear', 'floor': 1e-06, 'clip_max': 20.0, 'min_weight': 0.7984437192776195, 'max_weight': 3.7690281093446596}
[I 2026-06-01 01:40:43,775] Trial 79 finished with value: 0.21746353483141734 and parameters: {'alpha': 119182.1364651068, 'n_pcs': 3500, 'weight_scheme': 'linear', 'weight_clip_max': 20.0, 'weight_linear_min_weight': 0.7984437192776195, 'weight_linear_max_weight': 3.7690281093446596}. Best is trial 67 with value: 0.22356194409955688.
2026-06-01 01:40:43 | INFO | src.nested_cv_avggrm_weighted_unified | Trial 80 | outer=8 | alpha=9.953e+05 n_pcs=4000 (pc_topk) weight_search=on
2026-06-01 01:40:43 | INFO | src.nested_cv_avggrm_weighted_unified | Trial 80 | outer=8 | weight={'name': 'exponential', 'floor': 1e-06, 'clip_max': 5.0, 'beta': 6.8597247533089725}
[I 2026-06-01 01:40:49,561] Trial 80 finished with value: 0.2184763854233956 and parameters: {'alpha': 995263.5821097785, 'n_pcs': 4000, 'weight_scheme': 'exponential', 'weight_clip_max': 5.0, 'weight_exponential_beta': 6.8597247533089725}. Best is trial 67 with value: 0.22356194409955688.
2026-06-01 01:40:49 | INFO | src.nested_cv_avggrm_weighted_unified | Trial 81 | outer=8 | alpha=3.202e+05 n_pcs=4000 (pc_topk) weight_search=on
2026-06-01 01:40:49 | INFO | src.nested_cv_avggrm_weighted_unified | Trial 81 | outer=8 | weight={'name': 'exponential', 'floor': 1e-06, 'clip_max': 5.0, 'beta': 6.053782753569125}
[I 2026-06-01 01:40:55,338] Trial 81 finished with value: 0.22250337478392684 and parameters: {'alpha': 320248.077810247, 'n_pcs': 4000, 'weight_scheme': 'exponential', 'weight_clip_max': 5.0, 'weight_exponential_beta': 6.053782753569125}. Best is trial 67 with value: 0.22356194409955688.
2026-06-01 01:40:55 | INFO | src.nested_cv_avggrm_weighted_unified | Trial 82 | outer=8 | alpha=2.116e+05 n_pcs=4000 (pc_topk) weight_search=on
2026-06-01 01:40:55 | INFO | src.nested_cv_avggrm_weighted_unified | Trial 82 | outer=8 | weight={'name': 'exponential', 'floor': 1e-06, 'clip_max': 5.0, 'beta': 5.494789829639829}
[I 2026-06-01 01:41:01,073] Trial 82 finished with value: 0.222973329511658 and parameters: {'alpha': 211598.91585396, 'n_pcs': 4000, 'weight_scheme': 'exponential', 'weight_clip_max': 5.0, 'weight_exponential_beta': 5.494789829639829}. Best is trial 67 with value: 0.22356194409955688.
2026-06-01 01:41:01 | INFO | src.nested_cv_avggrm_weighted_unified | Trial 83 | outer=8 | alpha=2.553e+05 n_pcs=4000 (pc_topk) weight_search=on
2026-06-01 01:41:01 | INFO | src.nested_cv_avggrm_weighted_unified | Trial 83 | outer=8 | weight={'name': 'exponential', 'floor': 1e-06, 'clip_max': 5.0, 'beta': 5.806752697157936}
[I 2026-06-01 01:41:06,837] Trial 83 finished with value: 0.22280728596241345 and parameters: {'alpha': 255324.35280780448, 'n_pcs': 4000, 'weight_scheme': 'exponential', 'weight_clip_max': 5.0, 'weight_exponential_beta': 5.806752697157936}. Best is trial 67 with value: 0.22356194409955688.
2026-06-01 01:41:06 | INFO | src.nested_cv_avggrm_weighted_unified | Trial 84 | outer=8 | alpha=2.383e+05 n_pcs=4500 (pc_topk) weight_search=on
2026-06-01 01:41:06 | INFO | src.nested_cv_avggrm_weighted_unified | Trial 84 | outer=8 | weight={'name': 'exponential', 'floor': 1e-06, 'clip_max': 5.0, 'beta': 5.610014488968217}
[I 2026-06-01 01:41:13,713] Trial 84 finished with value: 0.22210194552510387 and parameters: {'alpha': 238342.63048522957, 'n_pcs': 4500, 'weight_scheme': 'exponential', 'weight_clip_max': 5.0, 'weight_exponential_beta': 5.610014488968217}. Best is trial 67 with value: 0.22356194409955688.
2026-06-01 01:41:13 | INFO | src.nested_cv_avggrm_weighted_unified | Trial 85 | outer=8 | alpha=5.102e+05 n_pcs=4000 (pc_topk) weight_search=on
2026-06-01 01:41:13 | INFO | src.nested_cv_avggrm_weighted_unified | Trial 85 | outer=8 | weight={'name': 'exponential', 'floor': 1e-06, 'clip_max': 5.0, 'beta': 5.261831196991059}
[I 2026-06-01 01:41:19,390] Trial 85 finished with value: 0.22034213219870136 and parameters: {'alpha': 510171.633072955, 'n_pcs': 4000, 'weight_scheme': 'exponential', 'weight_clip_max': 5.0, 'weight_exponential_beta': 5.261831196991059}. Best is trial 67 with value: 0.22356194409955688.
2026-06-01 01:41:19 | INFO | src.nested_cv_avggrm_weighted_unified | Trial 86 | outer=8 | alpha=3.584e+05 n_pcs=2000 (pc_topk) weight_search=on
2026-06-01 01:41:19 | INFO | src.nested_cv_avggrm_weighted_unified | Trial 86 | outer=8 | weight={'name': 'exponential', 'floor': 1e-06, 'clip_max': 3.0, 'beta': 4.9716892038939}
[I 2026-06-01 01:41:22,402] Trial 86 finished with value: 0.21856836576827704 and parameters: {'alpha': 358351.5711523658, 'n_pcs': 2000, 'weight_scheme': 'exponential', 'weight_clip_max': 3.0, 'weight_exponential_beta': 4.9716892038939}. Best is trial 67 with value: 0.22356194409955688.
2026-06-01 01:41:22 | INFO | src.nested_cv_avggrm_weighted_unified | Trial 87 | outer=8 | alpha=1.975e+05 n_pcs=4000 (pc_topk) weight_search=on
2026-06-01 01:41:22 | INFO | src.nested_cv_avggrm_weighted_unified | Trial 87 | outer=8 | weight={'name': 'exponential', 'floor': 1e-06, 'clip_max': 5.0, 'beta': 8.416252912041848}
[I 2026-06-01 01:41:28,150] Trial 87 finished with value: 0.2214547504441347 and parameters: {'alpha': 197467.72127235192, 'n_pcs': 4000, 'weight_scheme': 'exponential', 'weight_clip_max': 5.0, 'weight_exponential_beta': 8.416252912041848}. Best is trial 67 with value: 0.22356194409955688.
2026-06-01 01:41:28 | INFO | src.nested_cv_avggrm_weighted_unified | Trial 88 | outer=8 | alpha=2.587e+05 n_pcs=3500 (pc_topk) weight_search=on
2026-06-01 01:41:28 | INFO | src.nested_cv_avggrm_weighted_unified | Trial 88 | outer=8 | weight={'name': 'exponential', 'floor': 1e-06, 'clip_max': 5.0, 'beta': 4.429162391755211}
[I 2026-06-01 01:41:32,988] Trial 88 finished with value: 0.22105105827210597 and parameters: {'alpha': 258731.7856407747, 'n_pcs': 3500, 'weight_scheme': 'exponential', 'weight_clip_max': 5.0, 'weight_exponential_beta': 4.429162391755211}. Best is trial 67 with value: 0.22356194409955688.
2026-06-01 01:41:32 | INFO | src.nested_cv_avggrm_weighted_unified | Trial 89 | outer=8 | alpha=1.015e+05 n_pcs=4500 (pc_topk) weight_search=on
2026-06-01 01:41:32 | INFO | src.nested_cv_avggrm_weighted_unified | Trial 89 | outer=8 | weight={'name': 'exponential', 'floor': 1e-06, 'clip_max': 5.0, 'beta': 6.57016739052057}
[I 2026-06-01 01:41:39,827] Trial 89 finished with value: 0.22161836242204536 and parameters: {'alpha': 101481.94725320047, 'n_pcs': 4500, 'weight_scheme': 'exponential', 'weight_clip_max': 5.0, 'weight_exponential_beta': 6.57016739052057}. Best is trial 67 with value: 0.22356194409955688.
2026-06-01 01:41:39 | INFO | src.nested_cv_avggrm_weighted_unified | Trial 90 | outer=8 | alpha=7.766e+04 n_pcs=4000 (pc_topk) weight_search=on
2026-06-01 01:41:39 | INFO | src.nested_cv_avggrm_weighted_unified | Trial 90 | outer=8 | weight={'name': 'exponential', 'floor': 1e-06, 'clip_max': 5.0, 'beta': 7.118109627035573}
[I 2026-06-01 01:41:45,497] Trial 90 finished with value: 0.2197826234634249 and parameters: {'alpha': 77660.87995230022, 'n_pcs': 4000, 'weight_scheme': 'exponential', 'weight_clip_max': 5.0, 'weight_exponential_beta': 7.118109627035573}. Best is trial 67 with value: 0.22356194409955688.
2026-06-01 01:41:45 | INFO | src.nested_cv_avggrm_weighted_unified | Trial 91 | outer=8 | alpha=1.468e+05 n_pcs=4000 (pc_topk) weight_search=on
2026-06-01 01:41:45 | INFO | src.nested_cv_avggrm_weighted_unified | Trial 91 | outer=8 | weight={'name': 'exponential', 'floor': 1e-06, 'clip_max': 5.0, 'beta': 6.04521621302544}
[I 2026-06-01 01:41:51,679] Trial 91 finished with value: 0.2228868023897022 and parameters: {'alpha': 146762.64065086495, 'n_pcs': 4000, 'weight_scheme': 'exponential', 'weight_clip_max': 5.0, 'weight_exponential_beta': 6.04521621302544}. Best is trial 67 with value: 0.22356194409955688.
2026-06-01 01:41:51 | INFO | src.nested_cv_avggrm_weighted_unified | Trial 92 | outer=8 | alpha=1.770e+05 n_pcs=4000 (pc_topk) weight_search=on
2026-06-01 01:41:51 | INFO | src.nested_cv_avggrm_weighted_unified | Trial 92 | outer=8 | weight={'name': 'exponential', 'floor': 1e-06, 'clip_max': 5.0, 'beta': 5.781721271412143}
[I 2026-06-01 01:41:57,696] Trial 92 finished with value: 0.22305376160901563 and parameters: {'alpha': 176985.57644404777, 'n_pcs': 4000, 'weight_scheme': 'exponential', 'weight_clip_max': 5.0, 'weight_exponential_beta': 5.781721271412143}. Best is trial 67 with value: 0.22356194409955688.
2026-06-01 01:41:57 | INFO | src.nested_cv_avggrm_weighted_unified | Trial 93 | outer=8 | alpha=1.735e+05 n_pcs=4000 (pc_topk) weight_search=on
2026-06-01 01:41:57 | INFO | src.nested_cv_avggrm_weighted_unified | Trial 93 | outer=8 | weight={'name': 'exponential', 'floor': 1e-06, 'clip_max': 5.0, 'beta': 5.517536794133221}
[I 2026-06-01 01:42:03,457] Trial 93 finished with value: 0.22308224625883497 and parameters: {'alpha': 173473.6122886035, 'n_pcs': 4000, 'weight_scheme': 'exponential', 'weight_clip_max': 5.0, 'weight_exponential_beta': 5.517536794133221}. Best is trial 67 with value: 0.22356194409955688.
2026-06-01 01:42:03 | INFO | src.nested_cv_avggrm_weighted_unified | Trial 94 | outer=8 | alpha=1.564e+05 n_pcs=3500 (pc_topk) weight_search=on
2026-06-01 01:42:03 | INFO | src.nested_cv_avggrm_weighted_unified | Trial 94 | outer=8 | weight={'name': 'exponential', 'floor': 1e-06, 'clip_max': None, 'beta': 5.704227527583239}
[I 2026-06-01 01:42:08,468] Trial 94 finished with value: 0.20718571550018766 and parameters: {'alpha': 156386.98480536448, 'n_pcs': 3500, 'weight_scheme': 'exponential', 'weight_clip_max': None, 'weight_exponential_beta': 5.704227527583239}. Best is trial 67 with value: 0.22356194409955688.
2026-06-01 01:42:08 | INFO | src.nested_cv_avggrm_weighted_unified | Trial 95 | outer=8 | alpha=1.799e+05 n_pcs=4500 (pc_topk) weight_search=on
2026-06-01 01:42:08 | INFO | src.nested_cv_avggrm_weighted_unified | Trial 95 | outer=8 | weight={'name': 'exponential', 'floor': 1e-06, 'clip_max': 5.0, 'beta': 5.410112235498641}
[I 2026-06-01 01:42:15,387] Trial 95 finished with value: 0.22248955177952578 and parameters: {'alpha': 179896.40142390385, 'n_pcs': 4500, 'weight_scheme': 'exponential', 'weight_clip_max': 5.0, 'weight_exponential_beta': 5.410112235498641}. Best is trial 67 with value: 0.22356194409955688.
2026-06-01 01:42:15 | INFO | src.nested_cv_avggrm_weighted_unified | Trial 96 | outer=8 | alpha=3.753e+05 n_pcs=4000 (pc_topk) weight_search=on
2026-06-01 01:42:15 | INFO | src.nested_cv_avggrm_weighted_unified | Trial 96 | outer=8 | weight={'name': 'uniform', 'floor': 1e-06, 'clip_max': 5.0}
2026-06-01 01:42:17 | INFO | src.nested_cv_avggrm_weighted_unified | Trial 96 | outer=8 | pruned after 5/10 inner folds (mean r=0.2004)
[I 2026-06-01 01:42:17,841] Trial 96 pruned. 
2026-06-01 01:42:17 | INFO | src.nested_cv_avggrm_weighted_unified | Trial 97 | outer=8 | alpha=9.315e+04 n_pcs=3500 (pc_topk) weight_search=on
2026-06-01 01:42:17 | INFO | src.nested_cv_avggrm_weighted_unified | Trial 97 | outer=8 | weight={'name': 'linear', 'floor': 1e-06, 'clip_max': 5.0, 'min_weight': 0.05127001405177356, 'max_weight': 1.0041292262574504}
[I 2026-06-01 01:42:22,825] Trial 97 finished with value: 0.21913927239198433 and parameters: {'alpha': 93150.15385042795, 'n_pcs': 3500, 'weight_scheme': 'linear', 'weight_clip_max': 5.0, 'weight_linear_min_weight': 0.05127001405177356, 'weight_linear_max_weight': 1.0041292262574504}. Best is trial 67 with value: 0.22356194409955688.
2026-06-01 01:42:22 | INFO | src.nested_cv_avggrm_weighted_unified | Trial 98 | outer=8 | alpha=1.340e+05 n_pcs=4000 (pc_topk) weight_search=on
2026-06-01 01:42:22 | INFO | src.nested_cv_avggrm_weighted_unified | Trial 98 | outer=8 | weight={'name': 'exponential', 'floor': 1e-06, 'clip_max': 10.0, 'beta': 5.976053719020243}
[I 2026-06-01 01:42:28,516] Trial 98 finished with value: 0.21809699637406293 and parameters: {'alpha': 134017.08087424032, 'n_pcs': 4000, 'weight_scheme': 'exponential', 'weight_clip_max': 10.0, 'weight_exponential_beta': 5.976053719020243}. Best is trial 67 with value: 0.22356194409955688.
2026-06-01 01:42:28 | INFO | src.nested_cv_avggrm_weighted_unified | Trial 99 | outer=8 | alpha=4.458e+04 n_pcs=4500 (pc_topk) weight_search=on
2026-06-01 01:42:28 | INFO | src.nested_cv_avggrm_weighted_unified | Trial 99 | outer=8 | weight={'name': 'exponential', 'floor': 1e-06, 'clip_max': 20.0, 'beta': 4.91349301657873}
[I 2026-06-01 01:42:35,468] Trial 99 finished with value: 0.21605871580921066 and parameters: {'alpha': 44579.2788150756, 'n_pcs': 4500, 'weight_scheme': 'exponential', 'weight_clip_max': 20.0, 'weight_exponential_beta': 4.91349301657873}. Best is trial 67 with value: 0.22356194409955688.
2026-06-01 01:42:35 | INFO | src.nested_cv_avggrm_weighted_unified | Trial 100 | outer=8 | alpha=1.783e+05 n_pcs=4000 (pc_topk) weight_search=on
2026-06-01 01:42:35 | INFO | src.nested_cv_avggrm_weighted_unified | Trial 100 | outer=8 | weight={'name': 'exponential', 'floor': 1e-06, 'clip_max': 5.0, 'beta': 6.441289712317199}
[I 2026-06-01 01:42:41,159] Trial 100 finished with value: 0.22291367226226902 and parameters: {'alpha': 178251.95218746204, 'n_pcs': 4000, 'weight_scheme': 'exponential', 'weight_clip_max': 5.0, 'weight_exponential_beta': 6.441289712317199}. Best is trial 67 with value: 0.22356194409955688.
2026-06-01 01:42:41 | INFO | src.nested_cv_avggrm_weighted_unified | Trial 101 | outer=8 | alpha=1.804e+05 n_pcs=4000 (pc_topk) weight_search=on
2026-06-01 01:42:41 | INFO | src.nested_cv_avggrm_weighted_unified | Trial 101 | outer=8 | weight={'name': 'exponential', 'floor': 1e-06, 'clip_max': 5.0, 'beta': 6.35898636726379}
[I 2026-06-01 01:42:47,500] Trial 101 finished with value: 0.22295896366337203 and parameters: {'alpha': 180445.68759913265, 'n_pcs': 4000, 'weight_scheme': 'exponential', 'weight_clip_max': 5.0, 'weight_exponential_beta': 6.35898636726379}. Best is trial 67 with value: 0.22356194409955688.
2026-06-01 01:42:47 | INFO | src.nested_cv_avggrm_weighted_unified | Trial 102 | outer=8 | alpha=6.925e+04 n_pcs=4000 (pc_topk) weight_search=on
2026-06-01 01:42:47 | INFO | src.nested_cv_avggrm_weighted_unified | Trial 102 | outer=8 | weight={'name': 'exponential', 'floor': 1e-06, 'clip_max': 5.0, 'beta': 6.322023326170087}
