[I 2026-06-01 22:01:24,052] Trial 227 finished with value: 0.2304329566834224 and parameters: {'alpha': 61746.54900513333, 'n_pcs': 4000, 'iw_method': 'pc_logistic', 'iw_clip_max': 4.0, 'iw_prob_clip': 0.015331600351973751, 'iw_n_components': 60, 'iw_logistic_c': 2.0954310946934636e-05, 'iw_pca_fit': 'combined', 'iw_solver': 'lbfgs', 'iw_rho': 1.0}. Best is trial 225 with value: 0.23044692688678342.
2026-06-01 22:01:24 | INFO | Trial 228 | outer=7 | alpha=5.954e+04 n_pcs=4000 (pc_topk) weight={'name': 'pc_logistic', 'floor': 1e-06, 'clip_max': 4.0, 'prob_clip': 0.013544906333208068, 'n_components': 60, 'logistic_c': 1.8551814201087654e-05, 'pca_fit': 'combined', 'solver': 'lbfgs', 'max_iter': 2000, 'fit_intercept': True, 'standardize_with_source': True, 'rho': 1.0}
[I 2026-06-01 22:01:36,767] Trial 228 finished with value: 0.23012977131562407 and parameters: {'alpha': 59540.818738514594, 'n_pcs': 4000, 'iw_method': 'pc_logistic', 'iw_clip_max': 4.0, 'iw_prob_clip': 0.013544906333208068, 'iw_n_components': 60, 'iw_logistic_c': 1.8551814201087654e-05, 'iw_pca_fit': 'combined', 'iw_solver': 'lbfgs', 'iw_rho': 1.0}. Best is trial 225 with value: 0.23044692688678342.
2026-06-01 22:01:36 | INFO | Trial 229 | outer=7 | alpha=6.045e+04 n_pcs=4000 (pc_topk) weight={'name': 'pc_logistic', 'floor': 1e-06, 'clip_max': 4.0, 'prob_clip': 0.015183395860360938, 'n_components': 60, 'logistic_c': 1.896327166249069e-05, 'pca_fit': 'combined', 'solver': 'lbfgs', 'max_iter': 2000, 'fit_intercept': True, 'standardize_with_source': True, 'rho': 1.0}
[I 2026-06-01 22:01:49,069] Trial 229 finished with value: 0.23038350863507637 and parameters: {'alpha': 60447.63503688149, 'n_pcs': 4000, 'iw_method': 'pc_logistic', 'iw_clip_max': 4.0, 'iw_prob_clip': 0.015183395860360938, 'iw_n_components': 60, 'iw_logistic_c': 1.896327166249069e-05, 'iw_pca_fit': 'combined', 'iw_solver': 'lbfgs', 'iw_rho': 1.0}. Best is trial 225 with value: 0.23044692688678342.
2026-06-01 22:01:49 | INFO | Trial 230 | outer=7 | alpha=5.864e+04 n_pcs=4000 (pc_topk) weight={'name': 'pc_logistic', 'floor': 1e-06, 'clip_max': 4.0, 'prob_clip': 0.015203915054003108, 'n_components': 60, 'logistic_c': 1.871540217744376e-05, 'pca_fit': 'combined', 'solver': 'lbfgs', 'max_iter': 2000, 'fit_intercept': True, 'standardize_with_source': True, 'rho': 1.0}
[I 2026-06-01 22:02:01,970] Trial 230 finished with value: 0.23036011027390285 and parameters: {'alpha': 58644.76165318162, 'n_pcs': 4000, 'iw_method': 'pc_logistic', 'iw_clip_max': 4.0, 'iw_prob_clip': 0.015203915054003108, 'iw_n_components': 60, 'iw_logistic_c': 1.871540217744376e-05, 'iw_pca_fit': 'combined', 'iw_solver': 'lbfgs', 'iw_rho': 1.0}. Best is trial 225 with value: 0.23044692688678342.
2026-06-01 22:02:01 | INFO | Trial 231 | outer=7 | alpha=5.744e+04 n_pcs=4000 (pc_topk) weight={'name': 'pc_logistic', 'floor': 1e-06, 'clip_max': 4.0, 'prob_clip': 0.01506757271437344, 'n_components': 60, 'logistic_c': 1.9644834820016342e-05, 'pca_fit': 'combined', 'solver': 'lbfgs', 'max_iter': 2000, 'fit_intercept': True, 'standardize_with_source': True, 'rho': 1.0}
[I 2026-06-01 22:02:15,387] Trial 231 finished with value: 0.23039278509319966 and parameters: {'alpha': 57441.851680694934, 'n_pcs': 4000, 'iw_method': 'pc_logistic', 'iw_clip_max': 4.0, 'iw_prob_clip': 0.01506757271437344, 'iw_n_components': 60, 'iw_logistic_c': 1.9644834820016342e-05, 'iw_pca_fit': 'combined', 'iw_solver': 'lbfgs', 'iw_rho': 1.0}. Best is trial 225 with value: 0.23044692688678342.
2026-06-01 22:02:15 | INFO | Trial 232 | outer=7 | alpha=5.942e+04 n_pcs=4000 (pc_topk) weight={'name': 'pc_logistic', 'floor': 1e-06, 'clip_max': 4.0, 'prob_clip': 0.014929495086330328, 'n_components': 60, 'logistic_c': 1.866762447488996e-05, 'pca_fit': 'combined', 'solver': 'lbfgs', 'max_iter': 2000, 'fit_intercept': True, 'standardize_with_source': True, 'rho': 1.0}
[I 2026-06-01 22:02:28,228] Trial 232 finished with value: 0.2303092748255356 and parameters: {'alpha': 59415.56596273631, 'n_pcs': 4000, 'iw_method': 'pc_logistic', 'iw_clip_max': 4.0, 'iw_prob_clip': 0.014929495086330328, 'iw_n_components': 60, 'iw_logistic_c': 1.866762447488996e-05, 'iw_pca_fit': 'combined', 'iw_solver': 'lbfgs', 'iw_rho': 1.0}. Best is trial 225 with value: 0.23044692688678342.
2026-06-01 22:02:28 | INFO | Trial 233 | outer=7 | alpha=5.505e+04 n_pcs=4000 (pc_topk) weight={'name': 'pc_logistic', 'floor': 1e-06, 'clip_max': 4.0, 'prob_clip': 0.01512031114900182, 'n_components': 60, 'logistic_c': 1.8033225417234556e-05, 'pca_fit': 'combined', 'solver': 'lbfgs', 'max_iter': 2000, 'fit_intercept': True, 'standardize_with_source': True, 'rho': 1.0}
[I 2026-06-01 22:02:40,694] Trial 233 finished with value: 0.2302503835186044 and parameters: {'alpha': 55049.09546081468, 'n_pcs': 4000, 'iw_method': 'pc_logistic', 'iw_clip_max': 4.0, 'iw_prob_clip': 0.01512031114900182, 'iw_n_components': 60, 'iw_logistic_c': 1.8033225417234556e-05, 'iw_pca_fit': 'combined', 'iw_solver': 'lbfgs', 'iw_rho': 1.0}. Best is trial 225 with value: 0.23044692688678342.
2026-06-01 22:02:40 | INFO | Trial 234 | outer=7 | alpha=5.773e+04 n_pcs=4000 (pc_topk) weight={'name': 'pc_logistic', 'floor': 1e-06, 'clip_max': 4.0, 'prob_clip': 0.015135341647177107, 'n_components': 60, 'logistic_c': 8.9197667141957e-06, 'pca_fit': 'combined', 'solver': 'lbfgs', 'max_iter': 2000, 'fit_intercept': True, 'standardize_with_source': True, 'rho': 1.0}
[I 2026-06-01 22:02:53,994] Trial 234 finished with value: 0.2285007832989609 and parameters: {'alpha': 57728.16131815631, 'n_pcs': 4000, 'iw_method': 'pc_logistic', 'iw_clip_max': 4.0, 'iw_prob_clip': 0.015135341647177107, 'iw_n_components': 60, 'iw_logistic_c': 8.9197667141957e-06, 'iw_pca_fit': 'combined', 'iw_solver': 'lbfgs', 'iw_rho': 1.0}. Best is trial 225 with value: 0.23044692688678342.
2026-06-01 22:02:54 | INFO | Trial 235 | outer=7 | alpha=5.691e+04 n_pcs=4000 (pc_topk) weight={'name': 'pc_logistic', 'floor': 1e-06, 'clip_max': 4.0, 'prob_clip': 0.014869379576919755, 'n_components': 60, 'logistic_c': 1.7680825351756876e-05, 'pca_fit': 'combined', 'solver': 'lbfgs', 'max_iter': 2000, 'fit_intercept': True, 'standardize_with_source': True, 'rho': 1.0}
[I 2026-06-01 22:03:06,214] Trial 235 finished with value: 0.23020389172374003 and parameters: {'alpha': 56909.56541470618, 'n_pcs': 4000, 'iw_method': 'pc_logistic', 'iw_clip_max': 4.0, 'iw_prob_clip': 0.014869379576919755, 'iw_n_components': 60, 'iw_logistic_c': 1.7680825351756876e-05, 'iw_pca_fit': 'combined', 'iw_solver': 'lbfgs', 'iw_rho': 1.0}. Best is trial 225 with value: 0.23044692688678342.
2026-06-01 22:03:06 | INFO | Trial 236 | outer=7 | alpha=5.724e+04 n_pcs=4000 (pc_topk) weight={'name': 'pc_logistic', 'floor': 1e-06, 'clip_max': 4.0, 'prob_clip': 0.01524750741375205, 'n_components': 60, 'logistic_c': 1.667974272877159e-05, 'pca_fit': 'combined', 'solver': 'lbfgs', 'max_iter': 2000, 'fit_intercept': True, 'standardize_with_source': True, 'rho': 1.0}
[I 2026-06-01 22:03:19,732] Trial 236 finished with value: 0.23016590337919865 and parameters: {'alpha': 57241.940397104925, 'n_pcs': 4000, 'iw_method': 'pc_logistic', 'iw_clip_max': 4.0, 'iw_prob_clip': 0.01524750741375205, 'iw_n_components': 60, 'iw_logistic_c': 1.667974272877159e-05, 'iw_pca_fit': 'combined', 'iw_solver': 'lbfgs', 'iw_rho': 1.0}. Best is trial 225 with value: 0.23044692688678342.
2026-06-01 22:03:19 | INFO | Trial 237 | outer=7 | alpha=5.670e+04 n_pcs=4000 (pc_topk) weight={'name': 'pc_logistic', 'floor': 1e-06, 'clip_max': 1.5, 'prob_clip': 0.015099959689024608, 'n_components': 60, 'logistic_c': 8.847330214720516e-06, 'pca_fit': 'combined', 'solver': 'lbfgs', 'max_iter': 2000, 'fit_intercept': True, 'standardize_with_source': True, 'rho': 0.7}
[I 2026-06-01 22:03:32,829] Trial 237 finished with value: 0.22369525035616547 and parameters: {'alpha': 56699.36935166471, 'n_pcs': 4000, 'iw_method': 'pc_logistic', 'iw_clip_max': 1.5, 'iw_prob_clip': 0.015099959689024608, 'iw_n_components': 60, 'iw_logistic_c': 8.847330214720516e-06, 'iw_pca_fit': 'combined', 'iw_solver': 'lbfgs', 'iw_rho': 0.7}. Best is trial 225 with value: 0.23044692688678342.
2026-06-01 22:03:32 | INFO | Trial 238 | outer=7 | alpha=5.239e+04 n_pcs=4000 (pc_topk) weight={'name': 'pc_logistic', 'floor': 1e-06, 'clip_max': 4.0, 'prob_clip': 0.0146292753373929, 'n_components': 60, 'logistic_c': 1.7179739867226336e-05, 'pca_fit': 'combined', 'solver': 'lbfgs', 'max_iter': 2000, 'fit_intercept': True, 'standardize_with_source': True, 'rho': 1.0}
[I 2026-06-01 22:03:46,013] Trial 238 finished with value: 0.23004411167088631 and parameters: {'alpha': 52393.77982236936, 'n_pcs': 4000, 'iw_method': 'pc_logistic', 'iw_clip_max': 4.0, 'iw_prob_clip': 0.0146292753373929, 'iw_n_components': 60, 'iw_logistic_c': 1.7179739867226336e-05, 'iw_pca_fit': 'combined', 'iw_solver': 'lbfgs', 'iw_rho': 1.0}. Best is trial 225 with value: 0.23044692688678342.
2026-06-01 22:03:46 | INFO | Trial 239 | outer=7 | alpha=5.279e+04 n_pcs=4000 (pc_topk) weight={'name': 'pc_logistic', 'floor': 1e-06, 'clip_max': 4.0, 'prob_clip': 0.014136149542007204, 'n_components': 60, 'logistic_c': 1.562567993391827e-05, 'pca_fit': 'combined', 'solver': 'lbfgs', 'max_iter': 2000, 'fit_intercept': True, 'standardize_with_source': True, 'rho': 1.0}
[I 2026-06-01 22:03:58,903] Trial 239 finished with value: 0.2299318122081743 and parameters: {'alpha': 52787.57912925485, 'n_pcs': 4000, 'iw_method': 'pc_logistic', 'iw_clip_max': 4.0, 'iw_prob_clip': 0.014136149542007204, 'iw_n_components': 60, 'iw_logistic_c': 1.562567993391827e-05, 'iw_pca_fit': 'combined', 'iw_solver': 'lbfgs', 'iw_rho': 1.0}. Best is trial 225 with value: 0.23044692688678342.
2026-06-01 22:03:58 | INFO | Trial 240 | outer=7 | alpha=5.386e+04 n_pcs=3500 (pc_topk) weight={'name': 'pc_logistic', 'floor': 1e-06, 'clip_max': 4.0, 'prob_clip': 0.013863272538986981, 'n_components': 60, 'logistic_c': 1.6446358149625023e-05, 'pca_fit': 'combined', 'solver': 'lbfgs', 'max_iter': 2000, 'fit_intercept': True, 'standardize_with_source': True, 'rho': 1.0}
[I 2026-06-01 22:04:10,383] Trial 240 finished with value: 0.22588621147563823 and parameters: {'alpha': 53858.343718166165, 'n_pcs': 3500, 'iw_method': 'pc_logistic', 'iw_clip_max': 4.0, 'iw_prob_clip': 0.013863272538986981, 'iw_n_components': 60, 'iw_logistic_c': 1.6446358149625023e-05, 'iw_pca_fit': 'combined', 'iw_solver': 'lbfgs', 'iw_rho': 1.0}. Best is trial 225 with value: 0.23044692688678342.
2026-06-01 22:04:10 | INFO | Trial 241 | outer=7 | alpha=5.838e+04 n_pcs=4000 (pc_topk) weight={'name': 'pc_logistic', 'floor': 1e-06, 'clip_max': 4.0, 'prob_clip': 0.01500132239090703, 'n_components': 60, 'logistic_c': 1.6508959269894077e-05, 'pca_fit': 'combined', 'solver': 'lbfgs', 'max_iter': 2000, 'fit_intercept': True, 'standardize_with_source': True, 'rho': 1.0}
[I 2026-06-01 22:04:23,137] Trial 241 finished with value: 0.23010191204812291 and parameters: {'alpha': 58377.88315352351, 'n_pcs': 4000, 'iw_method': 'pc_logistic', 'iw_clip_max': 4.0, 'iw_prob_clip': 0.01500132239090703, 'iw_n_components': 60, 'iw_logistic_c': 1.6508959269894077e-05, 'iw_pca_fit': 'combined', 'iw_solver': 'lbfgs', 'iw_rho': 1.0}. Best is trial 225 with value: 0.23044692688678342.
2026-06-01 22:04:23 | INFO | Trial 242 | outer=7 | alpha=5.418e+04 n_pcs=4000 (pc_topk) weight={'name': 'pc_logistic', 'floor': 1e-06, 'clip_max': 4.0, 'prob_clip': 0.01517281705583774, 'n_components': 60, 'logistic_c': 1.6489484639771515e-05, 'pca_fit': 'combined', 'solver': 'lbfgs', 'max_iter': 2000, 'fit_intercept': True, 'standardize_with_source': True, 'rho': 1.0}
[I 2026-06-01 22:04:36,812] Trial 242 finished with value: 0.23011087584915807 and parameters: {'alpha': 54181.61436191877, 'n_pcs': 4000, 'iw_method': 'pc_logistic', 'iw_clip_max': 4.0, 'iw_prob_clip': 0.01517281705583774, 'iw_n_components': 60, 'iw_logistic_c': 1.6489484639771515e-05, 'iw_pca_fit': 'combined', 'iw_solver': 'lbfgs', 'iw_rho': 1.0}. Best is trial 225 with value: 0.23044692688678342.
2026-06-01 22:04:36 | INFO | Trial 243 | outer=7 | alpha=5.291e+04 n_pcs=4000 (pc_topk) weight={'name': 'pc_logistic', 'floor': 1e-06, 'clip_max': 4.0, 'prob_clip': 0.01485822018254564, 'n_components': 60, 'logistic_c': 6.018248454860699e-06, 'pca_fit': 'combined', 'solver': 'lbfgs', 'max_iter': 2000, 'fit_intercept': True, 'standardize_with_source': True, 'rho': 1.0}
[I 2026-06-01 22:04:49,755] Trial 243 finished with value: 0.22681055179964044 and parameters: {'alpha': 52905.08880145439, 'n_pcs': 4000, 'iw_method': 'pc_logistic', 'iw_clip_max': 4.0, 'iw_prob_clip': 0.01485822018254564, 'iw_n_components': 60, 'iw_logistic_c': 6.018248454860699e-06, 'iw_pca_fit': 'combined', 'iw_solver': 'lbfgs', 'iw_rho': 1.0}. Best is trial 225 with value: 0.23044692688678342.
2026-06-01 22:04:49 | INFO | Trial 244 | outer=7 | alpha=5.781e+04 n_pcs=4000 (pc_topk) weight={'name': 'pc_logistic', 'floor': 1e-06, 'clip_max': 4.0, 'prob_clip': 0.01757268187626084, 'n_components': 60, 'logistic_c': 1.0877827050381662e-05, 'pca_fit': 'combined', 'solver': 'lbfgs', 'max_iter': 2000, 'fit_intercept': True, 'standardize_with_source': True, 'rho': 1.0}
[I 2026-06-01 22:05:02,238] Trial 244 finished with value: 0.22922276331230051 and parameters: {'alpha': 57812.50725832243, 'n_pcs': 4000, 'iw_method': 'pc_logistic', 'iw_clip_max': 4.0, 'iw_prob_clip': 0.01757268187626084, 'iw_n_components': 60, 'iw_logistic_c': 1.0877827050381662e-05, 'iw_pca_fit': 'combined', 'iw_solver': 'lbfgs', 'iw_rho': 1.0}. Best is trial 225 with value: 0.23044692688678342.
2026-06-01 22:05:02 | INFO | Trial 245 | outer=7 | alpha=5.108e+04 n_pcs=4000 (pc_topk) weight={'name': 'pc_logistic', 'floor': 1e-06, 'clip_max': 4.0, 'prob_clip': 0.014472633927687563, 'n_components': 60, 'logistic_c': 1.6250428569973626e-05, 'pca_fit': 'combined', 'solver': 'lbfgs', 'max_iter': 2000, 'fit_intercept': True, 'standardize_with_source': True, 'rho': 1.0}
[I 2026-06-01 22:05:14,989] Trial 245 finished with value: 0.22993993483172667 and parameters: {'alpha': 51084.728260808, 'n_pcs': 4000, 'iw_method': 'pc_logistic', 'iw_clip_max': 4.0, 'iw_prob_clip': 0.014472633927687563, 'iw_n_components': 60, 'iw_logistic_c': 1.6250428569973626e-05, 'iw_pca_fit': 'combined', 'iw_solver': 'lbfgs', 'iw_rho': 1.0}. Best is trial 225 with value: 0.23044692688678342.
2026-06-01 22:05:15 | INFO | Trial 246 | outer=7 | alpha=6.019e+04 n_pcs=4000 (pc_topk) weight={'name': 'pc_logistic', 'floor': 1e-06, 'clip_max': 2.5, 'prob_clip': 0.015270112840100918, 'n_components': 60, 'logistic_c': 1.399359427799515e-05, 'pca_fit': 'combined', 'solver': 'lbfgs', 'max_iter': 2000, 'fit_intercept': True, 'standardize_with_source': True, 'rho': 1.0}
[I 2026-06-01 22:05:27,540] Trial 246 finished with value: 0.22911478821510384 and parameters: {'alpha': 60187.206170782236, 'n_pcs': 4000, 'iw_method': 'pc_logistic', 'iw_clip_max': 2.5, 'iw_prob_clip': 0.015270112840100918, 'iw_n_components': 60, 'iw_logistic_c': 1.399359427799515e-05, 'iw_pca_fit': 'combined', 'iw_solver': 'lbfgs', 'iw_rho': 1.0}. Best is trial 225 with value: 0.23044692688678342.
2026-06-01 22:05:27 | INFO | Trial 247 | outer=7 | alpha=5.357e+04 n_pcs=4000 (pc_topk) weight={'name': 'pc_logistic', 'floor': 1e-06, 'clip_max': 4.0, 'prob_clip': 0.014159257728981554, 'n_components': 60, 'logistic_c': 8.2129850549485e-06, 'pca_fit': 'combined', 'solver': 'lbfgs', 'max_iter': 2000, 'fit_intercept': True, 'standardize_with_source': True, 'rho': 1.0}
[I 2026-06-01 22:05:40,654] Trial 247 finished with value: 0.2281051084438733 and parameters: {'alpha': 53566.47046838169, 'n_pcs': 4000, 'iw_method': 'pc_logistic', 'iw_clip_max': 4.0, 'iw_prob_clip': 0.014159257728981554, 'iw_n_components': 60, 'iw_logistic_c': 8.2129850549485e-06, 'iw_pca_fit': 'combined', 'iw_solver': 'lbfgs', 'iw_rho': 1.0}. Best is trial 225 with value: 0.23044692688678342.
2026-06-01 22:05:40 | INFO | Trial 248 | outer=7 | alpha=6.311e+04 n_pcs=4000 (pc_topk) weight={'name': 'pc_logistic', 'floor': 1e-06, 'clip_max': 4.0, 'prob_clip': 0.015278368411834761, 'n_components': 60, 'logistic_c': 1.733341406147508e-05, 'pca_fit': 'combined', 'solver': 'lbfgs', 'max_iter': 2000, 'fit_intercept': True, 'standardize_with_source': True, 'rho': 1.0}
[I 2026-06-01 22:05:54,402] Trial 248 finished with value: 0.2301963936106143 and parameters: {'alpha': 63106.01086865305, 'n_pcs': 4000, 'iw_method': 'pc_logistic', 'iw_clip_max': 4.0, 'iw_prob_clip': 0.015278368411834761, 'iw_n_components': 60, 'iw_logistic_c': 1.733341406147508e-05, 'iw_pca_fit': 'combined', 'iw_solver': 'lbfgs', 'iw_rho': 1.0}. Best is trial 225 with value: 0.23044692688678342.
2026-06-01 22:05:54 | INFO | Trial 249 | outer=7 | alpha=6.252e+04 n_pcs=4000 (pc_topk) weight={'name': 'pc_logistic', 'floor': 1e-06, 'clip_max': 4.0, 'prob_clip': 0.018201065437709142, 'n_components': 60, 'logistic_c': 1.61371870603398e-05, 'pca_fit': 'combined', 'solver': 'lbfgs', 'max_iter': 2000, 'fit_intercept': True, 'standardize_with_source': True, 'rho': 1.0}
[I 2026-06-01 22:06:07,316] Trial 249 finished with value: 0.23032837618300453 and parameters: {'alpha': 62518.21285242421, 'n_pcs': 4000, 'iw_method': 'pc_logistic', 'iw_clip_max': 4.0, 'iw_prob_clip': 0.018201065437709142, 'iw_n_components': 60, 'iw_logistic_c': 1.61371870603398e-05, 'iw_pca_fit': 'combined', 'iw_solver': 'lbfgs', 'iw_rho': 1.0}. Best is trial 225 with value: 0.23044692688678342.
2026-06-01 22:06:07 | INFO | Trial 250 | outer=7 | alpha=4.962e+04 n_pcs=4000 (pc_topk) weight={'name': 'pc_logistic', 'floor': 1e-06, 'clip_max': 4.0, 'prob_clip': 0.01714413737815316, 'n_components': 60, 'logistic_c': 1.5393731253049158e-05, 'pca_fit': 'combined', 'solver': 'lbfgs', 'max_iter': 2000, 'fit_intercept': True, 'standardize_with_source': True, 'rho': 1.0}
[I 2026-06-01 22:06:21,140] Trial 250 finished with value: 0.2302142176640783 and parameters: {'alpha': 49621.53950996726, 'n_pcs': 4000, 'iw_method': 'pc_logistic', 'iw_clip_max': 4.0, 'iw_prob_clip': 0.01714413737815316, 'iw_n_components': 60, 'iw_logistic_c': 1.5393731253049158e-05, 'iw_pca_fit': 'combined', 'iw_solver': 'lbfgs', 'iw_rho': 1.0}. Best is trial 225 with value: 0.23044692688678342.
2026-06-01 22:06:21 | INFO | Trial 251 | outer=7 | alpha=4.984e+04 n_pcs=4000 (pc_topk) weight={'name': 'uniform'}
[I 2026-06-01 22:06:28,046] Trial 251 finished with value: 0.2190559184785838 and parameters: {'alpha': 49843.375563556736, 'n_pcs': 4000, 'iw_method': 'uniform'}. Best is trial 225 with value: 0.23044692688678342.
2026-06-01 22:06:28 | INFO | Trial 252 | outer=7 | alpha=5.275e+04 n_pcs=4000 (pc_topk) weight={'name': 'pc_logistic', 'floor': 1e-06, 'clip_max': 4.0, 'prob_clip': 0.018708782091254893, 'n_components': 60, 'logistic_c': 1.1437710997633152e-05, 'pca_fit': 'combined', 'solver': 'lbfgs', 'max_iter': 2000, 'fit_intercept': True, 'standardize_with_source': True, 'rho': 0.3}
[I 2026-06-01 22:06:40,891] Trial 252 finished with value: 0.22543680186613108 and parameters: {'alpha': 52746.678188751925, 'n_pcs': 4000, 'iw_method': 'pc_logistic', 'iw_clip_max': 4.0, 'iw_prob_clip': 0.018708782091254893, 'iw_n_components': 60, 'iw_logistic_c': 1.1437710997633152e-05, 'iw_pca_fit': 'combined', 'iw_solver': 'lbfgs', 'iw_rho': 0.3}. Best is trial 225 with value: 0.23044692688678342.
2026-06-01 22:06:40 | INFO | Trial 253 | outer=7 | alpha=6.169e+04 n_pcs=4000 (pc_topk) weight={'name': 'pc_logistic', 'floor': 1e-06, 'clip_max': 4.0, 'prob_clip': 0.017031269087159247, 'n_components': 60, 'logistic_c': 1.4094662004603363e-05, 'pca_fit': 'combined', 'solver': 'lbfgs', 'max_iter': 2000, 'fit_intercept': True, 'standardize_with_source': True, 'rho': 1.0}
[I 2026-06-01 22:06:53,578] Trial 253 finished with value: 0.22992691678380295 and parameters: {'alpha': 61688.110690995265, 'n_pcs': 4000, 'iw_method': 'pc_logistic', 'iw_clip_max': 4.0, 'iw_prob_clip': 0.017031269087159247, 'iw_n_components': 60, 'iw_logistic_c': 1.4094662004603363e-05, 'iw_pca_fit': 'combined', 'iw_solver': 'lbfgs', 'iw_rho': 1.0}. Best is trial 225 with value: 0.23044692688678342.
2026-06-01 22:06:53 | INFO | Trial 254 | outer=7 | alpha=4.754e+04 n_pcs=4000 (pc_topk) weight={'name': 'pc_logistic', 'floor': 1e-06, 'clip_max': 4.0, 'prob_clip': 0.017555697151498434, 'n_components': 60, 'logistic_c': 1.5740037343138867e-05, 'pca_fit': 'combined', 'solver': 'lbfgs', 'max_iter': 2000, 'fit_intercept': True, 'standardize_with_source': True, 'rho': 1.0}
[I 2026-06-01 22:07:06,132] Trial 254 finished with value: 0.230190361569694 and parameters: {'alpha': 47538.363531796, 'n_pcs': 4000, 'iw_method': 'pc_logistic', 'iw_clip_max': 4.0, 'iw_prob_clip': 0.017555697151498434, 'iw_n_components': 60, 'iw_logistic_c': 1.5740037343138867e-05, 'iw_pca_fit': 'combined', 'iw_solver': 'lbfgs', 'iw_rho': 1.0}. Best is trial 225 with value: 0.23044692688678342.
2026-06-01 22:07:06 | INFO | Trial 255 | outer=7 | alpha=4.901e+04 n_pcs=4000 (pc_topk) weight={'name': 'pc_logistic', 'floor': 1e-06, 'clip_max': 4.0, 'prob_clip': 0.017707879924768483, 'n_components': 60, 'logistic_c': 6.597938449039568e-06, 'pca_fit': 'combined', 'solver': 'lbfgs', 'max_iter': 2000, 'fit_intercept': True, 'standardize_with_source': True, 'rho': 1.0}
