[I 2026-06-01 16:06:38,908] Trial 81 finished with value: 0.20339775497746948 and parameters: {'alpha': 44999.429708053256, 'n_pcs': 4000, 'iw_method': 'pc_logistic', 'iw_clip_max': 1.5, 'iw_prob_clip': 0.036810400146726624, 'iw_n_components': 10, 'iw_logistic_c': 0.0002924191548535461, 'iw_pca_fit': 'combined', 'iw_solver': 'lbfgs', 'iw_rho': 0.85}. Best is trial 59 with value: 0.20554775148526594.
2026-06-01 16:06:38 | INFO | Trial 82 | outer=3 | alpha=1.271e+05 n_pcs=4500 (pc_topk) weight={'name': 'pc_logistic', 'floor': 1e-06, 'clip_max': 1.5, 'prob_clip': 0.023133205178768178, 'n_components': 100, 'logistic_c': 0.0006593571481819673, 'pca_fit': 'combined', 'solver': 'lbfgs', 'max_iter': 2000, 'fit_intercept': True, 'standardize_with_source': True, 'rho': 0.85}
[I 2026-06-01 16:06:58,385] Trial 82 finished with value: 0.20406794093661462 and parameters: {'alpha': 127144.19311855035, 'n_pcs': 4500, 'iw_method': 'pc_logistic', 'iw_clip_max': 1.5, 'iw_prob_clip': 0.023133205178768178, 'iw_n_components': 100, 'iw_logistic_c': 0.0006593571481819673, 'iw_pca_fit': 'combined', 'iw_solver': 'lbfgs', 'iw_rho': 0.85}. Best is trial 59 with value: 0.20554775148526594.
2026-06-01 16:06:58 | INFO | Trial 83 | outer=3 | alpha=8.155e+04 n_pcs=4000 (pc_topk) weight={'name': 'pc_logistic', 'floor': 1e-06, 'clip_max': 1.5, 'prob_clip': 0.04404978625359377, 'n_components': 100, 'logistic_c': 0.0027627608599423287, 'pca_fit': 'combined', 'solver': 'lbfgs', 'max_iter': 2000, 'fit_intercept': True, 'standardize_with_source': True, 'rho': 0.85}
[I 2026-06-01 16:07:17,480] Trial 83 finished with value: 0.20483552282310097 and parameters: {'alpha': 81554.16661281543, 'n_pcs': 4000, 'iw_method': 'pc_logistic', 'iw_clip_max': 1.5, 'iw_prob_clip': 0.04404978625359377, 'iw_n_components': 100, 'iw_logistic_c': 0.0027627608599423287, 'iw_pca_fit': 'combined', 'iw_solver': 'lbfgs', 'iw_rho': 0.85}. Best is trial 59 with value: 0.20554775148526594.
2026-06-01 16:07:17 | INFO | Trial 84 | outer=3 | alpha=5.970e+04 n_pcs=3000 (pc_topk) weight={'name': 'pc_logistic', 'floor': 1e-06, 'clip_max': 1.5, 'prob_clip': 0.04791822540218926, 'n_components': 10, 'logistic_c': 0.004257995118855142, 'pca_fit': 'combined', 'solver': 'lbfgs', 'max_iter': 2000, 'fit_intercept': True, 'standardize_with_source': True, 'rho': 0.85}
[I 2026-06-01 16:07:30,391] Trial 84 finished with value: 0.20264376309623938 and parameters: {'alpha': 59701.69272804033, 'n_pcs': 3000, 'iw_method': 'pc_logistic', 'iw_clip_max': 1.5, 'iw_prob_clip': 0.04791822540218926, 'iw_n_components': 10, 'iw_logistic_c': 0.004257995118855142, 'iw_pca_fit': 'combined', 'iw_solver': 'lbfgs', 'iw_rho': 0.85}. Best is trial 59 with value: 0.20554775148526594.
2026-06-01 16:07:30 | INFO | Trial 85 | outer=3 | alpha=1.479e+05 n_pcs=3500 (pc_topk) weight={'name': 'pc_logistic', 'floor': 1e-06, 'clip_max': 1.5, 'prob_clip': 0.02869129602187568, 'n_components': 100, 'logistic_c': 6.926845118086392e-05, 'pca_fit': 'combined', 'solver': 'lbfgs', 'max_iter': 2000, 'fit_intercept': True, 'standardize_with_source': True, 'rho': 0.85}
[I 2026-06-01 16:07:47,241] Trial 85 finished with value: 0.2048950379545375 and parameters: {'alpha': 147916.3278143573, 'n_pcs': 3500, 'iw_method': 'pc_logistic', 'iw_clip_max': 1.5, 'iw_prob_clip': 0.02869129602187568, 'iw_n_components': 100, 'iw_logistic_c': 6.926845118086392e-05, 'iw_pca_fit': 'combined', 'iw_solver': 'lbfgs', 'iw_rho': 0.85}. Best is trial 59 with value: 0.20554775148526594.
2026-06-01 16:07:47 | INFO | Trial 86 | outer=3 | alpha=1.397e+03 n_pcs=3500 (pc_topk) weight={'name': 'pc_logistic', 'floor': 1e-06, 'clip_max': 1.5, 'prob_clip': 0.03974067174140822, 'n_components': 80, 'logistic_c': 6.788157477710705e-05, 'pca_fit': 'combined', 'solver': 'lbfgs', 'max_iter': 2000, 'fit_intercept': True, 'standardize_with_source': True, 'rho': 0.85}
[I 2026-06-01 16:07:59,379] Trial 86 finished with value: 0.10680441351557537 and parameters: {'alpha': 1396.5729357470073, 'n_pcs': 3500, 'iw_method': 'pc_logistic', 'iw_clip_max': 1.5, 'iw_prob_clip': 0.03974067174140822, 'iw_n_components': 80, 'iw_logistic_c': 6.788157477710705e-05, 'iw_pca_fit': 'combined', 'iw_solver': 'lbfgs', 'iw_rho': 0.85}. Best is trial 59 with value: 0.20554775148526594.
2026-06-01 16:07:59 | INFO | Trial 87 | outer=3 | alpha=1.541e+05 n_pcs=3500 (pc_topk) weight={'name': 'pc_logistic', 'floor': 1e-06, 'clip_max': 1.5, 'prob_clip': 0.029216516196410067, 'n_components': 100, 'logistic_c': 0.00017037841030703618, 'pca_fit': 'combined', 'solver': 'lbfgs', 'max_iter': 2000, 'fit_intercept': True, 'standardize_with_source': True, 'rho': 0.5}
[I 2026-06-01 16:08:11,488] Trial 87 finished with value: 0.2043899254514731 and parameters: {'alpha': 154149.83412211385, 'n_pcs': 3500, 'iw_method': 'pc_logistic', 'iw_clip_max': 1.5, 'iw_prob_clip': 0.029216516196410067, 'iw_n_components': 100, 'iw_logistic_c': 0.00017037841030703618, 'iw_pca_fit': 'combined', 'iw_solver': 'lbfgs', 'iw_rho': 0.5}. Best is trial 59 with value: 0.20554775148526594.
2026-06-01 16:08:11 | INFO | Trial 88 | outer=3 | alpha=3.037e+05 n_pcs=4500 (pc_topk) weight={'name': 'pc_logistic', 'floor': 1e-06, 'clip_max': 2.5, 'prob_clip': 0.042817753150425804, 'n_components': 60, 'logistic_c': 2.818724262503582e-05, 'pca_fit': 'combined', 'solver': 'lbfgs', 'max_iter': 2000, 'fit_intercept': True, 'standardize_with_source': True, 'rho': 0.85}
[I 2026-06-01 16:08:27,014] Trial 88 finished with value: 0.20558156460445579 and parameters: {'alpha': 303677.61535145575, 'n_pcs': 4500, 'iw_method': 'pc_logistic', 'iw_clip_max': 2.5, 'iw_prob_clip': 0.042817753150425804, 'iw_n_components': 60, 'iw_logistic_c': 2.818724262503582e-05, 'iw_pca_fit': 'combined', 'iw_solver': 'lbfgs', 'iw_rho': 0.85}. Best is trial 88 with value: 0.20558156460445579.
2026-06-01 16:08:27 | INFO | Trial 89 | outer=3 | alpha=6.201e+05 n_pcs=4500 (pc_topk) weight={'name': 'uniform'}
[I 2026-06-01 16:08:49,171] Trial 89 finished with value: 0.1884065700356745 and parameters: {'alpha': 620117.6006951579, 'n_pcs': 4500, 'iw_method': 'uniform'}. Best is trial 88 with value: 0.20558156460445579.
2026-06-01 16:08:49 | INFO | Trial 90 | outer=3 | alpha=3.328e+05 n_pcs=5000 (pc_topk) weight={'name': 'pc_logistic', 'floor': 1e-06, 'clip_max': 2.5, 'prob_clip': 0.043289188627743586, 'n_components': 60, 'logistic_c': 3.5158789859234134e-05, 'pca_fit': 'combined', 'solver': 'lbfgs', 'max_iter': 2000, 'fit_intercept': True, 'standardize_with_source': True, 'rho': 0.85}
[I 2026-06-01 16:09:06,365] Trial 90 finished with value: 0.2044061619896472 and parameters: {'alpha': 332772.07112976053, 'n_pcs': 5000, 'iw_method': 'pc_logistic', 'iw_clip_max': 2.5, 'iw_prob_clip': 0.043289188627743586, 'iw_n_components': 60, 'iw_logistic_c': 3.5158789859234134e-05, 'iw_pca_fit': 'combined', 'iw_solver': 'lbfgs', 'iw_rho': 0.85}. Best is trial 88 with value: 0.20558156460445579.
2026-06-01 16:09:06 | INFO | Trial 91 | outer=3 | alpha=2.054e+05 n_pcs=4000 (pc_topk) weight={'name': 'pc_logistic', 'floor': 1e-06, 'clip_max': 2.5, 'prob_clip': 0.03511981308055724, 'n_components': 60, 'logistic_c': 1.668491242905e-05, 'pca_fit': 'combined', 'solver': 'lbfgs', 'max_iter': 2000, 'fit_intercept': True, 'standardize_with_source': True, 'rho': 0.85}
[I 2026-06-01 16:09:33,382] Trial 91 finished with value: 0.2075271950999782 and parameters: {'alpha': 205434.38602774567, 'n_pcs': 4000, 'iw_method': 'pc_logistic', 'iw_clip_max': 2.5, 'iw_prob_clip': 0.03511981308055724, 'iw_n_components': 60, 'iw_logistic_c': 1.668491242905e-05, 'iw_pca_fit': 'combined', 'iw_solver': 'lbfgs', 'iw_rho': 0.85}. Best is trial 91 with value: 0.2075271950999782.
2026-06-01 16:09:33 | INFO | Trial 92 | outer=3 | alpha=2.054e+05 n_pcs=4500 (pc_topk) weight={'name': 'pc_logistic', 'floor': 1e-06, 'clip_max': 2.5, 'prob_clip': 0.04869443305672211, 'n_components': 60, 'logistic_c': 1.6411306743308077e-05, 'pca_fit': 'combined', 'solver': 'lbfgs', 'max_iter': 2000, 'fit_intercept': True, 'standardize_with_source': True, 'rho': 0.85}
[I 2026-06-01 16:09:48,450] Trial 92 finished with value: 0.20450002075733392 and parameters: {'alpha': 205376.52891537856, 'n_pcs': 4500, 'iw_method': 'pc_logistic', 'iw_clip_max': 2.5, 'iw_prob_clip': 0.04869443305672211, 'iw_n_components': 60, 'iw_logistic_c': 1.6411306743308077e-05, 'iw_pca_fit': 'combined', 'iw_solver': 'lbfgs', 'iw_rho': 0.85}. Best is trial 91 with value: 0.2075271950999782.
2026-06-01 16:09:48 | INFO | Trial 93 | outer=3 | alpha=2.648e+05 n_pcs=4000 (pc_topk) weight={'name': 'pc_logistic', 'floor': 1e-06, 'clip_max': 2.5, 'prob_clip': 0.0303033275259376, 'n_components': 60, 'logistic_c': 3.320409027193558e-05, 'pca_fit': 'combined', 'solver': 'lbfgs', 'max_iter': 2000, 'fit_intercept': True, 'standardize_with_source': True, 'rho': 0.85}
[I 2026-06-01 16:10:01,989] Trial 93 finished with value: 0.2073777756548622 and parameters: {'alpha': 264801.25317114306, 'n_pcs': 4000, 'iw_method': 'pc_logistic', 'iw_clip_max': 2.5, 'iw_prob_clip': 0.0303033275259376, 'iw_n_components': 60, 'iw_logistic_c': 3.320409027193558e-05, 'iw_pca_fit': 'combined', 'iw_solver': 'lbfgs', 'iw_rho': 0.85}. Best is trial 91 with value: 0.2075271950999782.
2026-06-01 16:10:02 | INFO | Trial 94 | outer=3 | alpha=3.797e+05 n_pcs=4000 (pc_topk) weight={'name': 'pc_logistic', 'floor': 1e-06, 'clip_max': 2.5, 'prob_clip': 0.029221179454878732, 'n_components': 60, 'logistic_c': 3.6321871402578635e-05, 'pca_fit': 'combined', 'solver': 'lbfgs', 'max_iter': 2000, 'fit_intercept': True, 'standardize_with_source': True, 'rho': 0.85}
[I 2026-06-01 16:10:15,212] Trial 94 finished with value: 0.20605232240090876 and parameters: {'alpha': 379673.29309577006, 'n_pcs': 4000, 'iw_method': 'pc_logistic', 'iw_clip_max': 2.5, 'iw_prob_clip': 0.029221179454878732, 'iw_n_components': 60, 'iw_logistic_c': 3.6321871402578635e-05, 'iw_pca_fit': 'combined', 'iw_solver': 'lbfgs', 'iw_rho': 0.85}. Best is trial 91 with value: 0.2075271950999782.
2026-06-01 16:10:15 | INFO | Trial 95 | outer=3 | alpha=2.665e+05 n_pcs=4000 (pc_topk) weight={'name': 'pc_logistic', 'floor': 1e-06, 'clip_max': 2.5, 'prob_clip': 0.0299312652425125, 'n_components': 60, 'logistic_c': 3.848470478446491e-05, 'pca_fit': 'combined', 'solver': 'lbfgs', 'max_iter': 2000, 'fit_intercept': True, 'standardize_with_source': True, 'rho': 0.7}
[I 2026-06-01 16:10:28,797] Trial 95 finished with value: 0.2066062279433445 and parameters: {'alpha': 266525.62748387567, 'n_pcs': 4000, 'iw_method': 'pc_logistic', 'iw_clip_max': 2.5, 'iw_prob_clip': 0.0299312652425125, 'iw_n_components': 60, 'iw_logistic_c': 3.848470478446491e-05, 'iw_pca_fit': 'combined', 'iw_solver': 'lbfgs', 'iw_rho': 0.7}. Best is trial 91 with value: 0.2075271950999782.
2026-06-01 16:10:28 | INFO | Trial 96 | outer=3 | alpha=6.073e+05 n_pcs=4000 (pc_topk) weight={'name': 'pc_logistic', 'floor': 1e-06, 'clip_max': 2.5, 'prob_clip': 0.028243246638932674, 'n_components': 60, 'logistic_c': 4.6541582614476215e-05, 'pca_fit': 'combined', 'solver': 'lbfgs', 'max_iter': 2000, 'fit_intercept': True, 'standardize_with_source': True, 'rho': 0.7}
[I 2026-06-01 16:10:44,437] Trial 96 finished with value: 0.20339076894530286 and parameters: {'alpha': 607259.7093852023, 'n_pcs': 4000, 'iw_method': 'pc_logistic', 'iw_clip_max': 2.5, 'iw_prob_clip': 0.028243246638932674, 'iw_n_components': 60, 'iw_logistic_c': 4.6541582614476215e-05, 'iw_pca_fit': 'combined', 'iw_solver': 'lbfgs', 'iw_rho': 0.7}. Best is trial 91 with value: 0.2075271950999782.
2026-06-01 16:10:44 | INFO | Trial 97 | outer=3 | alpha=3.743e+05 n_pcs=3500 (pc_topk) weight={'name': 'pc_logistic', 'floor': 1e-06, 'clip_max': 2.5, 'prob_clip': 0.01593754571217497, 'n_components': 60, 'logistic_c': 4.2148063541158485e-06, 'pca_fit': 'combined', 'solver': 'lbfgs', 'max_iter': 2000, 'fit_intercept': True, 'standardize_with_source': True, 'rho': 0.7}
[I 2026-06-01 16:10:54,766] Trial 97 finished with value: 0.1986934969688109 and parameters: {'alpha': 374297.69186324946, 'n_pcs': 3500, 'iw_method': 'pc_logistic', 'iw_clip_max': 2.5, 'iw_prob_clip': 0.01593754571217497, 'iw_n_components': 60, 'iw_logistic_c': 4.2148063541158485e-06, 'iw_pca_fit': 'combined', 'iw_solver': 'lbfgs', 'iw_rho': 0.7}. Best is trial 91 with value: 0.2075271950999782.
2026-06-01 16:10:54 | INFO | Trial 98 | outer=3 | alpha=2.684e+05 n_pcs=3500 (pc_topk) weight={'name': 'pc_logistic', 'floor': 1e-06, 'clip_max': 2.5, 'prob_clip': 0.0013561309558357427, 'n_components': 60, 'logistic_c': 1.9633918802753044e-05, 'pca_fit': 'combined', 'solver': 'lbfgs', 'max_iter': 2000, 'fit_intercept': True, 'standardize_with_source': True, 'rho': 0.7}
[I 2026-06-01 16:11:05,697] Trial 98 finished with value: 0.20542184176442943 and parameters: {'alpha': 268355.6748964009, 'n_pcs': 3500, 'iw_method': 'pc_logistic', 'iw_clip_max': 2.5, 'iw_prob_clip': 0.0013561309558357427, 'iw_n_components': 60, 'iw_logistic_c': 1.9633918802753044e-05, 'iw_pca_fit': 'combined', 'iw_solver': 'lbfgs', 'iw_rho': 0.7}. Best is trial 91 with value: 0.2075271950999782.
2026-06-01 16:11:05 | INFO | Trial 99 | outer=3 | alpha=1.471e+06 n_pcs=4000 (pc_topk) weight={'name': 'pc_logistic', 'floor': 1e-06, 'clip_max': 2.5, 'prob_clip': 0.0011463584127987668, 'n_components': 60, 'logistic_c': 1.8966640807158094e-05, 'pca_fit': 'combined', 'solver': 'lbfgs', 'max_iter': 2000, 'fit_intercept': True, 'standardize_with_source': True, 'rho': 0.7}
[I 2026-06-01 16:11:18,738] Trial 99 finished with value: 0.19777394836838394 and parameters: {'alpha': 1470557.3076356912, 'n_pcs': 4000, 'iw_method': 'pc_logistic', 'iw_clip_max': 2.5, 'iw_prob_clip': 0.0011463584127987668, 'iw_n_components': 60, 'iw_logistic_c': 1.8966640807158094e-05, 'iw_pca_fit': 'combined', 'iw_solver': 'lbfgs', 'iw_rho': 0.7}. Best is trial 91 with value: 0.2075271950999782.
2026-06-01 16:11:18 | INFO | Trial 100 | outer=3 | alpha=2.874e+05 n_pcs=3500 (pc_topk) weight={'name': 'uniform'}
[I 2026-06-01 16:11:24,569] Trial 100 finished with value: 0.19408641196878548 and parameters: {'alpha': 287434.7308116615, 'n_pcs': 3500, 'iw_method': 'uniform'}. Best is trial 91 with value: 0.2075271950999782.
2026-06-01 16:11:24 | INFO | Trial 101 | outer=3 | alpha=4.504e+05 n_pcs=3500 (pc_topk) weight={'name': 'pc_logistic', 'floor': 1e-06, 'clip_max': 2.5, 'prob_clip': 0.0015055019279507761, 'n_components': 60, 'logistic_c': 1.0346548457932603e-05, 'pca_fit': 'combined', 'solver': 'lbfgs', 'max_iter': 2000, 'fit_intercept': True, 'standardize_with_source': True, 'rho': 0.7}
[I 2026-06-01 16:11:35,872] Trial 101 finished with value: 0.2021315517976995 and parameters: {'alpha': 450407.1564851036, 'n_pcs': 3500, 'iw_method': 'pc_logistic', 'iw_clip_max': 2.5, 'iw_prob_clip': 0.0015055019279507761, 'iw_n_components': 60, 'iw_logistic_c': 1.0346548457932603e-05, 'iw_pca_fit': 'combined', 'iw_solver': 'lbfgs', 'iw_rho': 0.7}. Best is trial 91 with value: 0.2075271950999782.
2026-06-01 16:11:35 | INFO | Trial 102 | outer=3 | alpha=2.488e+05 n_pcs=4000 (pc_topk) weight={'name': 'pc_logistic', 'floor': 1e-06, 'clip_max': 2.5, 'prob_clip': 0.0009339548689833102, 'n_components': 60, 'logistic_c': 2.6057756712517772e-05, 'pca_fit': 'combined', 'solver': 'lbfgs', 'max_iter': 2000, 'fit_intercept': True, 'standardize_with_source': True, 'rho': 0.7}
[I 2026-06-01 16:11:48,632] Trial 102 finished with value: 0.2058579020752409 and parameters: {'alpha': 248781.33821422193, 'n_pcs': 4000, 'iw_method': 'pc_logistic', 'iw_clip_max': 2.5, 'iw_prob_clip': 0.0009339548689833102, 'iw_n_components': 60, 'iw_logistic_c': 2.6057756712517772e-05, 'iw_pca_fit': 'combined', 'iw_solver': 'lbfgs', 'iw_rho': 0.7}. Best is trial 91 with value: 0.2075271950999782.
2026-06-01 16:11:48 | INFO | Trial 103 | outer=3 | alpha=5.354e+05 n_pcs=4000 (pc_topk) weight={'name': 'pc_logistic', 'floor': 1e-06, 'clip_max': 2.5, 'prob_clip': 0.0014255502014114958, 'n_components': 60, 'logistic_c': 2.721418469647372e-05, 'pca_fit': 'combined', 'solver': 'lbfgs', 'max_iter': 2000, 'fit_intercept': True, 'standardize_with_source': True, 'rho': 0.7}
[I 2026-06-01 16:12:20,606] Trial 103 finished with value: 0.20271114634803072 and parameters: {'alpha': 535382.1935587781, 'n_pcs': 4000, 'iw_method': 'pc_logistic', 'iw_clip_max': 2.5, 'iw_prob_clip': 0.0014255502014114958, 'iw_n_components': 60, 'iw_logistic_c': 2.721418469647372e-05, 'iw_pca_fit': 'combined', 'iw_solver': 'lbfgs', 'iw_rho': 0.7}. Best is trial 91 with value: 0.2075271950999782.
2026-06-01 16:12:20 | INFO | Trial 104 | outer=3 | alpha=2.605e+05 n_pcs=4000 (pc_topk) weight={'name': 'pc_logistic', 'floor': 1e-06, 'clip_max': 2.5, 'prob_clip': 0.0008215233225172912, 'n_components': 60, 'logistic_c': 7.170298013663803e-06, 'pca_fit': 'combined', 'solver': 'lbfgs', 'max_iter': 2000, 'fit_intercept': True, 'standardize_with_source': True, 'rho': 0.7}
[I 2026-06-01 16:12:33,234] Trial 104 finished with value: 0.20304648271941678 and parameters: {'alpha': 260544.05589977215, 'n_pcs': 4000, 'iw_method': 'pc_logistic', 'iw_clip_max': 2.5, 'iw_prob_clip': 0.0008215233225172912, 'iw_n_components': 60, 'iw_logistic_c': 7.170298013663803e-06, 'iw_pca_fit': 'combined', 'iw_solver': 'lbfgs', 'iw_rho': 0.7}. Best is trial 91 with value: 0.2075271950999782.
2026-06-01 16:12:33 | INFO | Trial 105 | outer=3 | alpha=2.147e+05 n_pcs=4000 (pc_topk) weight={'name': 'pc_logistic', 'floor': 1e-06, 'clip_max': 2.5, 'prob_clip': 0.0008206823048040535, 'n_components': 60, 'logistic_c': 0.00013515247215230712, 'pca_fit': 'combined', 'solver': 'lbfgs', 'max_iter': 2000, 'fit_intercept': True, 'standardize_with_source': True, 'rho': 0.7}
[I 2026-06-01 16:12:54,811] Trial 105 finished with value: 0.20620786132775382 and parameters: {'alpha': 214727.58736100874, 'n_pcs': 4000, 'iw_method': 'pc_logistic', 'iw_clip_max': 2.5, 'iw_prob_clip': 0.0008206823048040535, 'iw_n_components': 60, 'iw_logistic_c': 0.00013515247215230712, 'iw_pca_fit': 'combined', 'iw_solver': 'lbfgs', 'iw_rho': 0.7}. Best is trial 91 with value: 0.2075271950999782.
2026-06-01 16:12:54 | INFO | Trial 106 | outer=3 | alpha=2.252e+05 n_pcs=4000 (pc_topk) weight={'name': 'pc_logistic', 'floor': 1e-06, 'clip_max': 2.5, 'prob_clip': 0.0009129383901128054, 'n_components': 60, 'logistic_c': 0.00015613093488336268, 'pca_fit': 'combined', 'solver': 'lbfgs', 'max_iter': 2000, 'fit_intercept': True, 'standardize_with_source': True, 'rho': 0.7}
[I 2026-06-01 16:13:11,842] Trial 106 finished with value: 0.20599189539060186 and parameters: {'alpha': 225244.60433258096, 'n_pcs': 4000, 'iw_method': 'pc_logistic', 'iw_clip_max': 2.5, 'iw_prob_clip': 0.0009129383901128054, 'iw_n_components': 60, 'iw_logistic_c': 0.00015613093488336268, 'iw_pca_fit': 'combined', 'iw_solver': 'lbfgs', 'iw_rho': 0.7}. Best is trial 91 with value: 0.2075271950999782.
2026-06-01 16:13:11 | INFO | Trial 107 | outer=3 | alpha=8.018e+05 n_pcs=4000 (pc_topk) weight={'name': 'pc_logistic', 'floor': 1e-06, 'clip_max': 2.5, 'prob_clip': 0.0008871967336493753, 'n_components': 60, 'logistic_c': 0.00017739531208169572, 'pca_fit': 'combined', 'solver': 'lbfgs', 'max_iter': 2000, 'fit_intercept': True, 'standardize_with_source': True, 'rho': 0.7}
[I 2026-06-01 16:13:45,978] Trial 107 finished with value: 0.200820883198673 and parameters: {'alpha': 801837.5297301927, 'n_pcs': 4000, 'iw_method': 'pc_logistic', 'iw_clip_max': 2.5, 'iw_prob_clip': 0.0008871967336493753, 'iw_n_components': 60, 'iw_logistic_c': 0.00017739531208169572, 'iw_pca_fit': 'combined', 'iw_solver': 'lbfgs', 'iw_rho': 0.7}. Best is trial 91 with value: 0.2075271950999782.
2026-06-01 16:13:45 | INFO | Trial 108 | outer=3 | alpha=2.210e+05 n_pcs=4500 (pc_topk) weight={'name': 'pc_logistic', 'floor': 1e-06, 'clip_max': 2.5, 'prob_clip': 0.0006162518409995036, 'n_components': 60, 'logistic_c': 8.693410800039963e-05, 'pca_fit': 'combined', 'solver': 'lbfgs', 'max_iter': 2000, 'fit_intercept': True, 'standardize_with_source': True, 'rho': 0.7}
[I 2026-06-01 16:14:02,338] Trial 108 finished with value: 0.20636568169063083 and parameters: {'alpha': 221038.1514994449, 'n_pcs': 4500, 'iw_method': 'pc_logistic', 'iw_clip_max': 2.5, 'iw_prob_clip': 0.0006162518409995036, 'iw_n_components': 60, 'iw_logistic_c': 8.693410800039963e-05, 'iw_pca_fit': 'combined', 'iw_solver': 'lbfgs', 'iw_rho': 0.7}. Best is trial 91 with value: 0.2075271950999782.
2026-06-01 16:14:02 | INFO | Trial 109 | outer=3 | alpha=2.183e+05 n_pcs=4500 (pc_topk) weight={'name': 'pc_logistic', 'floor': 1e-06, 'clip_max': 2.5, 'prob_clip': 0.0006184013932155361, 'n_components': 60, 'logistic_c': 0.00014498036721363817, 'pca_fit': 'combined', 'solver': 'lbfgs', 'max_iter': 2000, 'fit_intercept': True, 'standardize_with_source': True, 'rho': 0.7}
[I 2026-06-01 16:14:19,147] Trial 109 finished with value: 0.2062339916960354 and parameters: {'alpha': 218323.67978193457, 'n_pcs': 4500, 'iw_method': 'pc_logistic', 'iw_clip_max': 2.5, 'iw_prob_clip': 0.0006184013932155361, 'iw_n_components': 60, 'iw_logistic_c': 0.00014498036721363817, 'iw_pca_fit': 'combined', 'iw_solver': 'lbfgs', 'iw_rho': 0.7}. Best is trial 91 with value: 0.2075271950999782.
2026-06-01 16:14:19 | INFO | Trial 110 | outer=3 | alpha=2.145e+05 n_pcs=4500 (pc_topk) weight={'name': 'pc_logistic', 'floor': 1e-06, 'clip_max': 2.5, 'prob_clip': 0.0005794642369762632, 'n_components': 60, 'logistic_c': 0.00012135530022962467, 'pca_fit': 'combined', 'solver': 'lbfgs', 'max_iter': 2000, 'fit_intercept': True, 'standardize_with_source': True, 'rho': 0.7}
