[I 2026-05-31 23:14:17,082] Trial 82 finished with value: 0.24753953072368406 and parameters: {'alpha': 436000.6714760132, 'n_pcs': 3000, 'weight_scheme': 'exponential', 'weight_clip_max': 3.0, 'weight_exponential_beta': 8.225873840851554}. Best is trial 81 with value: 0.2477455676488017.
2026-05-31 23:14:17 | INFO | src.nested_cv_avggrm_weighted_unified | Trial 83 | outer=2 | alpha=4.074e+05 n_pcs=3000 (pc_topk) weight_search=on
2026-05-31 23:14:17 | INFO | src.nested_cv_avggrm_weighted_unified | Trial 83 | outer=2 | weight={'name': 'exponential', 'floor': 1e-06, 'clip_max': 3.0, 'beta': 8.246302110493618}
[I 2026-05-31 23:14:20,975] Trial 83 finished with value: 0.24765895711033167 and parameters: {'alpha': 407375.693481378, 'n_pcs': 3000, 'weight_scheme': 'exponential', 'weight_clip_max': 3.0, 'weight_exponential_beta': 8.246302110493618}. Best is trial 81 with value: 0.2477455676488017.
2026-05-31 23:14:20 | INFO | src.nested_cv_avggrm_weighted_unified | Trial 84 | outer=2 | alpha=4.036e+05 n_pcs=3000 (pc_topk) weight_search=on
2026-05-31 23:14:20 | INFO | src.nested_cv_avggrm_weighted_unified | Trial 84 | outer=2 | weight={'name': 'exponential', 'floor': 1e-06, 'clip_max': 3.0, 'beta': 8.209125920253923}
[I 2026-05-31 23:14:24,800] Trial 84 finished with value: 0.24763840600286727 and parameters: {'alpha': 403556.8255720218, 'n_pcs': 3000, 'weight_scheme': 'exponential', 'weight_clip_max': 3.0, 'weight_exponential_beta': 8.209125920253923}. Best is trial 81 with value: 0.2477455676488017.
2026-05-31 23:14:24 | INFO | src.nested_cv_avggrm_weighted_unified | Trial 85 | outer=2 | alpha=5.890e+05 n_pcs=3500 (pc_topk) weight_search=on
2026-05-31 23:14:24 | INFO | src.nested_cv_avggrm_weighted_unified | Trial 85 | outer=2 | weight={'name': 'exponential', 'floor': 1e-06, 'clip_max': 3.0, 'beta': 9.537303257497749}
[I 2026-05-31 23:14:29,688] Trial 85 finished with value: 0.2477981508135775 and parameters: {'alpha': 589034.735615936, 'n_pcs': 3500, 'weight_scheme': 'exponential', 'weight_clip_max': 3.0, 'weight_exponential_beta': 9.537303257497749}. Best is trial 85 with value: 0.2477981508135775.
2026-05-31 23:14:29 | INFO | src.nested_cv_avggrm_weighted_unified | OUTER 2 | new best trial 85 (mean inner r=0.2478) saved to outputs/final_results/e6_pc_ridge_avggrm/thr_wing/e6_pc_ridge_avggrm_thr_wing_best_trials/split_02_best_trial.json
2026-05-31 23:14:29 | INFO | src.nested_cv_avggrm_weighted_unified | Trial 86 | outer=2 | alpha=6.157e+05 n_pcs=3500 (pc_topk) weight_search=on
2026-05-31 23:14:29 | INFO | src.nested_cv_avggrm_weighted_unified | Trial 86 | outer=2 | weight={'name': 'exponential', 'floor': 1e-06, 'clip_max': 3.0, 'beta': 9.96301066635633}
[I 2026-05-31 23:14:34,662] Trial 86 finished with value: 0.24708892026121929 and parameters: {'alpha': 615743.7146655325, 'n_pcs': 3500, 'weight_scheme': 'exponential', 'weight_clip_max': 3.0, 'weight_exponential_beta': 9.96301066635633}. Best is trial 85 with value: 0.2477981508135775.
2026-05-31 23:14:34 | INFO | src.nested_cv_avggrm_weighted_unified | Trial 87 | outer=2 | alpha=9.791e+05 n_pcs=3500 (pc_topk) weight_search=on
2026-05-31 23:14:34 | INFO | src.nested_cv_avggrm_weighted_unified | Trial 87 | outer=2 | weight={'name': 'exponential', 'floor': 1e-06, 'clip_max': 3.0, 'beta': 9.595866626613715}
[I 2026-05-31 23:14:39,544] Trial 87 finished with value: 0.24572738986442105 and parameters: {'alpha': 979149.399781873, 'n_pcs': 3500, 'weight_scheme': 'exponential', 'weight_clip_max': 3.0, 'weight_exponential_beta': 9.595866626613715}. Best is trial 85 with value: 0.2477981508135775.
2026-05-31 23:14:39 | INFO | src.nested_cv_avggrm_weighted_unified | Trial 88 | outer=2 | alpha=6.346e+05 n_pcs=4000 (pc_topk) weight_search=on
2026-05-31 23:14:39 | INFO | src.nested_cv_avggrm_weighted_unified | Trial 88 | outer=2 | weight={'name': 'exponential', 'floor': 1e-06, 'clip_max': 3.0, 'beta': 9.896514810083891}
[I 2026-05-31 23:14:45,288] Trial 88 finished with value: 0.2478528381249697 and parameters: {'alpha': 634634.327840997, 'n_pcs': 4000, 'weight_scheme': 'exponential', 'weight_clip_max': 3.0, 'weight_exponential_beta': 9.896514810083891}. Best is trial 88 with value: 0.2478528381249697.
2026-05-31 23:14:45 | INFO | src.nested_cv_avggrm_weighted_unified | OUTER 2 | new best trial 88 (mean inner r=0.2479) saved to outputs/final_results/e6_pc_ridge_avggrm/thr_wing/e6_pc_ridge_avggrm_thr_wing_best_trials/split_02_best_trial.json
2026-05-31 23:14:45 | INFO | src.nested_cv_avggrm_weighted_unified | Trial 89 | outer=2 | alpha=6.183e+05 n_pcs=4000 (pc_topk) weight_search=on
2026-05-31 23:14:45 | INFO | src.nested_cv_avggrm_weighted_unified | Trial 89 | outer=2 | weight={'name': 'exponential', 'floor': 1e-06, 'clip_max': 3.0, 'beta': 9.504623769943244}
[I 2026-05-31 23:14:51,926] Trial 89 finished with value: 0.24835831657349247 and parameters: {'alpha': 618292.2918328628, 'n_pcs': 4000, 'weight_scheme': 'exponential', 'weight_clip_max': 3.0, 'weight_exponential_beta': 9.504623769943244}. Best is trial 89 with value: 0.24835831657349247.
2026-05-31 23:14:51 | INFO | src.nested_cv_avggrm_weighted_unified | OUTER 2 | new best trial 89 (mean inner r=0.2484) saved to outputs/final_results/e6_pc_ridge_avggrm/thr_wing/e6_pc_ridge_avggrm_thr_wing_best_trials/split_02_best_trial.json
2026-05-31 23:14:51 | INFO | src.nested_cv_avggrm_weighted_unified | Trial 90 | outer=2 | alpha=1.427e+06 n_pcs=4000 (pc_topk) weight_search=on
2026-05-31 23:14:51 | INFO | src.nested_cv_avggrm_weighted_unified | Trial 90 | outer=2 | weight={'name': 'exponential', 'floor': 1e-06, 'clip_max': 3.0, 'beta': 9.974774234805746}
[I 2026-05-31 23:14:58,421] Trial 90 finished with value: 0.24392660655401177 and parameters: {'alpha': 1426779.268957841, 'n_pcs': 4000, 'weight_scheme': 'exponential', 'weight_clip_max': 3.0, 'weight_exponential_beta': 9.974774234805746}. Best is trial 89 with value: 0.24835831657349247.
2026-05-31 23:14:58 | INFO | src.nested_cv_avggrm_weighted_unified | Trial 91 | outer=2 | alpha=6.304e+05 n_pcs=4000 (pc_topk) weight_search=on
2026-05-31 23:14:58 | INFO | src.nested_cv_avggrm_weighted_unified | Trial 91 | outer=2 | weight={'name': 'exponential', 'floor': 1e-06, 'clip_max': 3.0, 'beta': 9.528041159520791}
[I 2026-05-31 23:15:04,133] Trial 91 finished with value: 0.2482704488122983 and parameters: {'alpha': 630409.7540444818, 'n_pcs': 4000, 'weight_scheme': 'exponential', 'weight_clip_max': 3.0, 'weight_exponential_beta': 9.528041159520791}. Best is trial 89 with value: 0.24835831657349247.
2026-05-31 23:15:04 | INFO | src.nested_cv_avggrm_weighted_unified | Trial 92 | outer=2 | alpha=7.256e+05 n_pcs=4000 (pc_topk) weight_search=on
2026-05-31 23:15:04 | INFO | src.nested_cv_avggrm_weighted_unified | Trial 92 | outer=2 | weight={'name': 'exponential', 'floor': 1e-06, 'clip_max': 3.0, 'beta': 9.622467508067786}
[I 2026-05-31 23:15:09,877] Trial 92 finished with value: 0.24764653711042534 and parameters: {'alpha': 725550.681757228, 'n_pcs': 4000, 'weight_scheme': 'exponential', 'weight_clip_max': 3.0, 'weight_exponential_beta': 9.622467508067786}. Best is trial 89 with value: 0.24835831657349247.
2026-05-31 23:15:09 | INFO | src.nested_cv_avggrm_weighted_unified | Trial 93 | outer=2 | alpha=7.649e+05 n_pcs=4000 (pc_topk) weight_search=on
2026-05-31 23:15:09 | INFO | src.nested_cv_avggrm_weighted_unified | Trial 93 | outer=2 | weight={'name': 'exponential', 'floor': 1e-06, 'clip_max': 3.0, 'beta': 9.59035343378713}
[I 2026-05-31 23:15:15,609] Trial 93 finished with value: 0.24744484738923989 and parameters: {'alpha': 764895.4526740985, 'n_pcs': 4000, 'weight_scheme': 'exponential', 'weight_clip_max': 3.0, 'weight_exponential_beta': 9.59035343378713}. Best is trial 89 with value: 0.24835831657349247.
2026-05-31 23:15:15 | INFO | src.nested_cv_avggrm_weighted_unified | Trial 94 | outer=2 | alpha=4.941e+06 n_pcs=4000 (pc_topk) weight_search=on
2026-05-31 23:15:15 | INFO | src.nested_cv_avggrm_weighted_unified | Trial 94 | outer=2 | weight={'name': 'exponential', 'floor': 1e-06, 'clip_max': 3.0, 'beta': 9.498833617306797}
2026-05-31 23:15:19 | INFO | src.nested_cv_avggrm_weighted_unified | Trial 94 | outer=2 | pruned after 7/10 inner folds (mean r=0.2755)
[I 2026-05-31 23:15:19,609] Trial 94 pruned. 
2026-05-31 23:15:19 | INFO | src.nested_cv_avggrm_weighted_unified | Trial 95 | outer=2 | alpha=1.108e+06 n_pcs=4500 (pc_topk) weight_search=on
2026-05-31 23:15:19 | INFO | src.nested_cv_avggrm_weighted_unified | Trial 95 | outer=2 | weight={'name': 'exponential', 'floor': 1e-06, 'clip_max': 3.0, 'beta': 9.07778095638476}
[I 2026-05-31 23:15:26,566] Trial 95 finished with value: 0.2447482927601417 and parameters: {'alpha': 1108318.6825784494, 'n_pcs': 4500, 'weight_scheme': 'exponential', 'weight_clip_max': 3.0, 'weight_exponential_beta': 9.07778095638476}. Best is trial 89 with value: 0.24835831657349247.
2026-05-31 23:15:26 | INFO | src.nested_cv_avggrm_weighted_unified | Trial 96 | outer=2 | alpha=7.459e+05 n_pcs=4500 (pc_topk) weight_search=on
2026-05-31 23:15:26 | INFO | src.nested_cv_avggrm_weighted_unified | Trial 96 | outer=2 | weight={'name': 'uniform', 'floor': 1e-06, 'clip_max': 3.0}
2026-05-31 23:15:30 | INFO | src.nested_cv_avggrm_weighted_unified | Trial 96 | outer=2 | pruned after 6/10 inner folds (mean r=0.2322)
[I 2026-05-31 23:15:30,232] Trial 96 pruned. 
2026-05-31 23:15:30 | INFO | src.nested_cv_avggrm_weighted_unified | Trial 97 | outer=2 | alpha=5.182e+05 n_pcs=4000 (pc_topk) weight_search=on
2026-05-31 23:15:30 | INFO | src.nested_cv_avggrm_weighted_unified | Trial 97 | outer=2 | weight={'name': 'exponential', 'floor': 1e-06, 'clip_max': 3.0, 'beta': 9.655632972727306}
[I 2026-05-31 23:15:35,966] Trial 97 finished with value: 0.24875472823400374 and parameters: {'alpha': 518224.63300245855, 'n_pcs': 4000, 'weight_scheme': 'exponential', 'weight_clip_max': 3.0, 'weight_exponential_beta': 9.655632972727306}. Best is trial 97 with value: 0.24875472823400374.
2026-05-31 23:15:35 | INFO | src.nested_cv_avggrm_weighted_unified | OUTER 2 | new best trial 97 (mean inner r=0.2488) saved to outputs/final_results/e6_pc_ridge_avggrm/thr_wing/e6_pc_ridge_avggrm_thr_wing_best_trials/split_02_best_trial.json
2026-05-31 23:15:35 | INFO | src.nested_cv_avggrm_weighted_unified | Trial 98 | outer=2 | alpha=4.840e+05 n_pcs=3000 (pc_topk) weight_search=on
2026-05-31 23:15:35 | INFO | src.nested_cv_avggrm_weighted_unified | Trial 98 | outer=2 | weight={'name': 'exponential', 'floor': 1e-06, 'clip_max': 3.0, 'beta': 8.643459549265753}
[I 2026-05-31 23:15:40,305] Trial 98 finished with value: 0.24758184223700103 and parameters: {'alpha': 484001.47846466245, 'n_pcs': 3000, 'weight_scheme': 'exponential', 'weight_clip_max': 3.0, 'weight_exponential_beta': 8.643459549265753}. Best is trial 97 with value: 0.24875472823400374.
2026-05-31 23:15:40 | INFO | src.nested_cv_avggrm_weighted_unified | Trial 99 | outer=2 | alpha=4.996e+05 n_pcs=4000 (pc_topk) weight_search=on
2026-05-31 23:15:40 | INFO | src.nested_cv_avggrm_weighted_unified | Trial 99 | outer=2 | weight={'name': 'linear', 'floor': 1e-06, 'clip_max': 3.0, 'min_weight': 0.8251110297732567, 'max_weight': 2.1567696421941105}
2026-05-31 23:15:43 | INFO | src.nested_cv_avggrm_weighted_unified | Trial 99 | outer=2 | pruned after 6/10 inner folds (mean r=0.2455)
[I 2026-05-31 23:15:43,761] Trial 99 pruned. 
2026-05-31 23:15:43 | INFO | src.nested_cv_avggrm_weighted_unified | Trial 100 | outer=2 | alpha=1.694e+06 n_pcs=3500 (pc_topk) weight_search=on
2026-05-31 23:15:43 | INFO | src.nested_cv_avggrm_weighted_unified | Trial 100 | outer=2 | weight={'name': 'exponential', 'floor': 1e-06, 'clip_max': 3.0, 'beta': 8.763721291987753}
[I 2026-05-31 23:15:48,675] Trial 100 finished with value: 0.2426536715143941 and parameters: {'alpha': 1693617.6842773373, 'n_pcs': 3500, 'weight_scheme': 'exponential', 'weight_clip_max': 3.0, 'weight_exponential_beta': 8.763721291987753}. Best is trial 97 with value: 0.24875472823400374.
2026-05-31 23:15:48 | INFO | src.nested_cv_avggrm_weighted_unified | Trial 101 | outer=2 | alpha=5.074e+05 n_pcs=3000 (pc_topk) weight_search=on
2026-05-31 23:15:48 | INFO | src.nested_cv_avggrm_weighted_unified | Trial 101 | outer=2 | weight={'name': 'exponential', 'floor': 1e-06, 'clip_max': 3.0, 'beta': 8.316910079999573}
[I 2026-05-31 23:15:52,527] Trial 101 finished with value: 0.24729958519668366 and parameters: {'alpha': 507387.66633114644, 'n_pcs': 3000, 'weight_scheme': 'exponential', 'weight_clip_max': 3.0, 'weight_exponential_beta': 8.316910079999573}. Best is trial 97 with value: 0.24875472823400374.
2026-05-31 23:15:52 | INFO | src.nested_cv_avggrm_weighted_unified | Trial 102 | outer=2 | alpha=3.582e+05 n_pcs=3000 (pc_topk) weight_search=on
2026-05-31 23:15:52 | INFO | src.nested_cv_avggrm_weighted_unified | Trial 102 | outer=2 | weight={'name': 'exponential', 'floor': 1e-06, 'clip_max': 3.0, 'beta': 9.124334365549451}
[I 2026-05-31 23:15:56,354] Trial 102 finished with value: 0.2476864773034762 and parameters: {'alpha': 358237.831429293, 'n_pcs': 3000, 'weight_scheme': 'exponential', 'weight_clip_max': 3.0, 'weight_exponential_beta': 9.124334365549451}. Best is trial 97 with value: 0.24875472823400374.
2026-05-31 23:15:56 | INFO | src.nested_cv_avggrm_weighted_unified | Trial 103 | outer=2 | alpha=3.345e+05 n_pcs=4000 (pc_topk) weight_search=on
2026-05-31 23:15:56 | INFO | src.nested_cv_avggrm_weighted_unified | Trial 103 | outer=2 | weight={'name': 'exponential', 'floor': 1e-06, 'clip_max': 3.0, 'beta': 9.238526750277913}
[I 2026-05-31 23:16:02,114] Trial 103 finished with value: 0.2497346971635756 and parameters: {'alpha': 334483.462319964, 'n_pcs': 4000, 'weight_scheme': 'exponential', 'weight_clip_max': 3.0, 'weight_exponential_beta': 9.238526750277913}. Best is trial 103 with value: 0.2497346971635756.
2026-05-31 23:16:02 | INFO | src.nested_cv_avggrm_weighted_unified | OUTER 2 | new best trial 103 (mean inner r=0.2497) saved to outputs/final_results/e6_pc_ridge_avggrm/thr_wing/e6_pc_ridge_avggrm_thr_wing_best_trials/split_02_best_trial.json
2026-05-31 23:16:02 | INFO | src.nested_cv_avggrm_weighted_unified | Trial 104 | outer=2 | alpha=3.349e+05 n_pcs=4000 (pc_topk) weight_search=on
2026-05-31 23:16:02 | INFO | src.nested_cv_avggrm_weighted_unified | Trial 104 | outer=2 | weight={'name': 'exponential', 'floor': 1e-06, 'clip_max': 3.0, 'beta': 9.260209970194575}
[I 2026-05-31 23:16:07,925] Trial 104 finished with value: 0.2497194210197084 and parameters: {'alpha': 334883.4017478897, 'n_pcs': 4000, 'weight_scheme': 'exponential', 'weight_clip_max': 3.0, 'weight_exponential_beta': 9.260209970194575}. Best is trial 103 with value: 0.2497346971635756.
2026-05-31 23:16:07 | INFO | src.nested_cv_avggrm_weighted_unified | Trial 105 | outer=2 | alpha=3.354e+05 n_pcs=4000 (pc_topk) weight_search=on
2026-05-31 23:16:07 | INFO | src.nested_cv_avggrm_weighted_unified | Trial 105 | outer=2 | weight={'name': 'exponential', 'floor': 1e-06, 'clip_max': 3.0, 'beta': 9.251931444316835}
[I 2026-05-31 23:16:13,670] Trial 105 finished with value: 0.24972497938886357 and parameters: {'alpha': 335389.88397364935, 'n_pcs': 4000, 'weight_scheme': 'exponential', 'weight_clip_max': 3.0, 'weight_exponential_beta': 9.251931444316835}. Best is trial 103 with value: 0.2497346971635756.
2026-05-31 23:16:13 | INFO | src.nested_cv_avggrm_weighted_unified | Trial 106 | outer=2 | alpha=2.180e+05 n_pcs=4500 (pc_topk) weight_search=on
2026-05-31 23:16:13 | INFO | src.nested_cv_avggrm_weighted_unified | Trial 106 | outer=2 | weight={'name': 'exponential', 'floor': 1e-06, 'clip_max': 3.0, 'beta': 9.238763935451091}
[I 2026-05-31 23:16:20,640] Trial 106 finished with value: 0.2487086774377795 and parameters: {'alpha': 218010.84268008813, 'n_pcs': 4500, 'weight_scheme': 'exponential', 'weight_clip_max': 3.0, 'weight_exponential_beta': 9.238763935451091}. Best is trial 103 with value: 0.2497346971635756.
2026-05-31 23:16:20 | INFO | src.nested_cv_avggrm_weighted_unified | Trial 107 | outer=2 | alpha=3.303e+05 n_pcs=4500 (pc_topk) weight_search=on
2026-05-31 23:16:20 | INFO | src.nested_cv_avggrm_weighted_unified | Trial 107 | outer=2 | weight={'name': 'exponential', 'floor': 1e-06, 'clip_max': 3.0, 'beta': 9.246541562923113}
[I 2026-05-31 23:16:27,583] Trial 107 finished with value: 0.24908798551872144 and parameters: {'alpha': 330326.58789938746, 'n_pcs': 4500, 'weight_scheme': 'exponential', 'weight_clip_max': 3.0, 'weight_exponential_beta': 9.246541562923113}. Best is trial 103 with value: 0.2497346971635756.
2026-05-31 23:16:27 | INFO | src.nested_cv_avggrm_weighted_unified | Trial 108 | outer=2 | alpha=2.115e+05 n_pcs=4500 (pc_topk) weight_search=on
2026-05-31 23:16:27 | INFO | src.nested_cv_avggrm_weighted_unified | Trial 108 | outer=2 | weight={'name': 'exponential', 'floor': 1e-06, 'clip_max': 3.0, 'beta': 9.354627499198747}
[I 2026-05-31 23:16:34,611] Trial 108 finished with value: 0.24851312060206396 and parameters: {'alpha': 211460.17688384483, 'n_pcs': 4500, 'weight_scheme': 'exponential', 'weight_clip_max': 3.0, 'weight_exponential_beta': 9.354627499198747}. Best is trial 103 with value: 0.2497346971635756.
2026-05-31 23:16:34 | INFO | src.nested_cv_avggrm_weighted_unified | Trial 109 | outer=2 | alpha=1.853e+05 n_pcs=4500 (pc_topk) weight_search=on
2026-05-31 23:16:34 | INFO | src.nested_cv_avggrm_weighted_unified | Trial 109 | outer=2 | weight={'name': 'exponential', 'floor': 1e-06, 'clip_max': 3.0, 'beta': 9.330935143592633}
[I 2026-05-31 23:16:41,558] Trial 109 finished with value: 0.24813887636046497 and parameters: {'alpha': 185279.38089944088, 'n_pcs': 4500, 'weight_scheme': 'exponential', 'weight_clip_max': 3.0, 'weight_exponential_beta': 9.330935143592633}. Best is trial 103 with value: 0.2497346971635756.
2026-05-31 23:16:41 | INFO | src.nested_cv_avggrm_weighted_unified | Trial 110 | outer=2 | alpha=2.080e+05 n_pcs=4500 (pc_topk) weight_search=on
2026-05-31 23:16:41 | INFO | src.nested_cv_avggrm_weighted_unified | Trial 110 | outer=2 | weight={'name': 'exponential', 'floor': 1e-06, 'clip_max': 3.0, 'beta': 9.329500061827424}
[I 2026-05-31 23:16:48,531] Trial 110 finished with value: 0.248497721923243 and parameters: {'alpha': 207954.65727305232, 'n_pcs': 4500, 'weight_scheme': 'exponential', 'weight_clip_max': 3.0, 'weight_exponential_beta': 9.329500061827424}. Best is trial 103 with value: 0.2497346971635756.
2026-05-31 23:16:48 | INFO | src.nested_cv_avggrm_weighted_unified | Trial 111 | outer=2 | alpha=2.092e+05 n_pcs=4500 (pc_topk) weight_search=on
2026-05-31 23:16:48 | INFO | src.nested_cv_avggrm_weighted_unified | Trial 111 | outer=2 | weight={'name': 'exponential', 'floor': 1e-06, 'clip_max': 3.0, 'beta': 9.295057947213316}
[I 2026-05-31 23:16:55,529] Trial 111 finished with value: 0.24855201791214743 and parameters: {'alpha': 209247.59378141587, 'n_pcs': 4500, 'weight_scheme': 'exponential', 'weight_clip_max': 3.0, 'weight_exponential_beta': 9.295057947213316}. Best is trial 103 with value: 0.2497346971635756.
2026-05-31 23:16:55 | INFO | src.nested_cv_avggrm_weighted_unified | Trial 112 | outer=2 | alpha=1.878e+05 n_pcs=5000 (pc_topk) weight_search=on
2026-05-31 23:16:55 | INFO | src.nested_cv_avggrm_weighted_unified | Trial 112 | outer=2 | weight={'name': 'exponential', 'floor': 1e-06, 'clip_max': 3.0, 'beta': 9.308959273735475}
[I 2026-05-31 23:17:03,687] Trial 112 finished with value: 0.24731205580483842 and parameters: {'alpha': 187759.143516007, 'n_pcs': 5000, 'weight_scheme': 'exponential', 'weight_clip_max': 3.0, 'weight_exponential_beta': 9.308959273735475}. Best is trial 103 with value: 0.2497346971635756.
2026-05-31 23:17:03 | INFO | src.nested_cv_avggrm_weighted_unified | Trial 113 | outer=2 | alpha=2.096e+05 n_pcs=4500 (pc_topk) weight_search=on
2026-05-31 23:17:03 | INFO | src.nested_cv_avggrm_weighted_unified | Trial 113 | outer=2 | weight={'name': 'exponential', 'floor': 1e-06, 'clip_max': 3.0, 'beta': 8.930231643548636}
[I 2026-05-31 23:17:10,657] Trial 113 finished with value: 0.2488284535370071 and parameters: {'alpha': 209644.47255560395, 'n_pcs': 4500, 'weight_scheme': 'exponential', 'weight_clip_max': 3.0, 'weight_exponential_beta': 8.930231643548636}. Best is trial 103 with value: 0.2497346971635756.
2026-05-31 23:17:10 | INFO | src.nested_cv_avggrm_weighted_unified | Trial 114 | outer=2 | alpha=1.452e+05 n_pcs=4500 (pc_topk) weight_search=on
2026-05-31 23:17:10 | INFO | src.nested_cv_avggrm_weighted_unified | Trial 114 | outer=2 | weight={'name': 'exponential', 'floor': 1e-06, 'clip_max': 3.0, 'beta': 8.903898558043043}
[I 2026-05-31 23:17:17,634] Trial 114 finished with value: 0.24754082853611276 and parameters: {'alpha': 145173.6885890955, 'n_pcs': 4500, 'weight_scheme': 'exponential', 'weight_clip_max': 3.0, 'weight_exponential_beta': 8.903898558043043}. Best is trial 103 with value: 0.2497346971635756.
2026-05-31 23:17:17 | INFO | src.nested_cv_avggrm_weighted_unified | Trial 115 | outer=2 | alpha=7.195e+04 n_pcs=4500 (pc_topk) weight_search=on
2026-05-31 23:17:17 | INFO | src.nested_cv_avggrm_weighted_unified | Trial 115 | outer=2 | weight={'name': 'exponential', 'floor': 1e-06, 'clip_max': 3.0, 'beta': 9.772619424731653}
[I 2026-05-31 23:17:24,619] Trial 115 finished with value: 0.24126733973913378 and parameters: {'alpha': 71952.9384741954, 'n_pcs': 4500, 'weight_scheme': 'exponential', 'weight_clip_max': 3.0, 'weight_exponential_beta': 9.772619424731653}. Best is trial 103 with value: 0.2497346971635756.
2026-05-31 23:17:24 | INFO | src.nested_cv_avggrm_weighted_unified | Trial 116 | outer=2 | alpha=1.074e+05 n_pcs=4500 (pc_topk) weight_search=on
2026-05-31 23:17:24 | INFO | src.nested_cv_avggrm_weighted_unified | Trial 116 | outer=2 | weight={'name': 'exponential', 'floor': 1e-06, 'clip_max': 3.0, 'beta': 9.247582859112883}
