[I 2026-06-01 23:56:39,194] Trial 170 finished with value: 0.2304599817105951 and parameters: {'alpha': 93481.51739822618, 'n_pcs': 5000, 'iw_method': 'pc_logistic', 'iw_clip_max': 2.5, 'iw_prob_clip': 0.00816035288967187, 'iw_n_components': 60, 'iw_logistic_c': 0.7057344102582864, 'iw_pca_fit': 'combined', 'iw_solver': 'lbfgs', 'iw_rho': 0.7}. Best is trial 168 with value: 0.2310715410277358.
2026-06-01 23:56:39 | INFO | Trial 171 | outer=9 | alpha=9.048e+04 n_pcs=5000 (pc_topk) weight={'name': 'pc_logistic', 'floor': 1e-06, 'clip_max': 2.5, 'prob_clip': 0.007774910023146678, 'n_components': 60, 'logistic_c': 0.7647304555439723, 'pca_fit': 'combined', 'solver': 'lbfgs', 'max_iter': 2000, 'fit_intercept': True, 'standardize_with_source': True, 'rho': 0.7}
[I 2026-06-01 23:57:04,846] Trial 171 finished with value: 0.23042025684342698 and parameters: {'alpha': 90480.78195744328, 'n_pcs': 5000, 'iw_method': 'pc_logistic', 'iw_clip_max': 2.5, 'iw_prob_clip': 0.007774910023146678, 'iw_n_components': 60, 'iw_logistic_c': 0.7647304555439723, 'iw_pca_fit': 'combined', 'iw_solver': 'lbfgs', 'iw_rho': 0.7}. Best is trial 168 with value: 0.2310715410277358.
2026-06-01 23:57:04 | INFO | Trial 172 | outer=9 | alpha=9.700e+04 n_pcs=5000 (pc_topk) weight={'name': 'pc_logistic', 'floor': 1e-06, 'clip_max': 2.5, 'prob_clip': 0.007915523250675897, 'n_components': 60, 'logistic_c': 0.6437747718007949, 'pca_fit': 'combined', 'solver': 'lbfgs', 'max_iter': 2000, 'fit_intercept': True, 'standardize_with_source': True, 'rho': 0.7}
[I 2026-06-01 23:57:29,724] Trial 172 finished with value: 0.2302480573804823 and parameters: {'alpha': 97002.03264058186, 'n_pcs': 5000, 'iw_method': 'pc_logistic', 'iw_clip_max': 2.5, 'iw_prob_clip': 0.007915523250675897, 'iw_n_components': 60, 'iw_logistic_c': 0.6437747718007949, 'iw_pca_fit': 'combined', 'iw_solver': 'lbfgs', 'iw_rho': 0.7}. Best is trial 168 with value: 0.2310715410277358.
2026-06-01 23:57:29 | INFO | Trial 173 | outer=9 | alpha=1.611e+05 n_pcs=5000 (pc_topk) weight={'name': 'pc_logistic', 'floor': 1e-06, 'clip_max': 2.5, 'prob_clip': 0.008079582836874759, 'n_components': 60, 'logistic_c': 0.625512313260715, 'pca_fit': 'combined', 'solver': 'lbfgs', 'max_iter': 2000, 'fit_intercept': True, 'standardize_with_source': True, 'rho': 0.7}
[I 2026-06-01 23:57:54,158] Trial 173 finished with value: 0.22809751430182001 and parameters: {'alpha': 161067.8358446002, 'n_pcs': 5000, 'iw_method': 'pc_logistic', 'iw_clip_max': 2.5, 'iw_prob_clip': 0.008079582836874759, 'iw_n_components': 60, 'iw_logistic_c': 0.625512313260715, 'iw_pca_fit': 'combined', 'iw_solver': 'lbfgs', 'iw_rho': 0.7}. Best is trial 168 with value: 0.2310715410277358.
2026-06-01 23:57:54 | INFO | Trial 174 | outer=9 | alpha=1.578e+05 n_pcs=5000 (pc_topk) weight={'name': 'pc_logistic', 'floor': 1e-06, 'clip_max': 2.5, 'prob_clip': 0.008025353222602043, 'n_components': 60, 'logistic_c': 0.6854096196171559, 'pca_fit': 'combined', 'solver': 'lbfgs', 'max_iter': 2000, 'fit_intercept': True, 'standardize_with_source': True, 'rho': 0.7}
[I 2026-06-01 23:58:19,135] Trial 174 finished with value: 0.22822731587561074 and parameters: {'alpha': 157820.000685714, 'n_pcs': 5000, 'iw_method': 'pc_logistic', 'iw_clip_max': 2.5, 'iw_prob_clip': 0.008025353222602043, 'iw_n_components': 60, 'iw_logistic_c': 0.6854096196171559, 'iw_pca_fit': 'combined', 'iw_solver': 'lbfgs', 'iw_rho': 0.7}. Best is trial 168 with value: 0.2310715410277358.
2026-06-01 23:58:19 | INFO | Trial 175 | outer=9 | alpha=1.508e+05 n_pcs=5000 (pc_topk) weight={'name': 'pc_logistic', 'floor': 1e-06, 'clip_max': 2.5, 'prob_clip': 0.008137666388376166, 'n_components': 60, 'logistic_c': 0.7652129336185447, 'pca_fit': 'combined', 'solver': 'lbfgs', 'max_iter': 2000, 'fit_intercept': True, 'standardize_with_source': True, 'rho': 0.7}
[I 2026-06-01 23:58:45,030] Trial 175 finished with value: 0.22850727366319745 and parameters: {'alpha': 150784.85527549015, 'n_pcs': 5000, 'iw_method': 'pc_logistic', 'iw_clip_max': 2.5, 'iw_prob_clip': 0.008137666388376166, 'iw_n_components': 60, 'iw_logistic_c': 0.7652129336185447, 'iw_pca_fit': 'combined', 'iw_solver': 'lbfgs', 'iw_rho': 0.7}. Best is trial 168 with value: 0.2310715410277358.
2026-06-01 23:58:45 | INFO | Trial 176 | outer=9 | alpha=1.406e+05 n_pcs=5000 (pc_topk) weight={'name': 'pc_logistic', 'floor': 1e-06, 'clip_max': 2.5, 'prob_clip': 0.007933469098521377, 'n_components': 60, 'logistic_c': 0.6805558306479552, 'pca_fit': 'combined', 'solver': 'lbfgs', 'max_iter': 2000, 'fit_intercept': True, 'standardize_with_source': True, 'rho': 0.7}
[I 2026-06-01 23:59:09,451] Trial 176 finished with value: 0.22879915025969125 and parameters: {'alpha': 140644.72133811822, 'n_pcs': 5000, 'iw_method': 'pc_logistic', 'iw_clip_max': 2.5, 'iw_prob_clip': 0.007933469098521377, 'iw_n_components': 60, 'iw_logistic_c': 0.6805558306479552, 'iw_pca_fit': 'combined', 'iw_solver': 'lbfgs', 'iw_rho': 0.7}. Best is trial 168 with value: 0.2310715410277358.
2026-06-01 23:59:09 | INFO | Trial 177 | outer=9 | alpha=1.732e+05 n_pcs=5000 (pc_topk) weight={'name': 'pc_logistic', 'floor': 1e-06, 'clip_max': 2.5, 'prob_clip': 0.008048960445991333, 'n_components': 60, 'logistic_c': 0.6723360598966427, 'pca_fit': 'combined', 'solver': 'lbfgs', 'max_iter': 2000, 'fit_intercept': True, 'standardize_with_source': True, 'rho': 0.7}
[I 2026-06-01 23:59:32,886] Trial 177 finished with value: 0.22770886194928336 and parameters: {'alpha': 173156.77309522172, 'n_pcs': 5000, 'iw_method': 'pc_logistic', 'iw_clip_max': 2.5, 'iw_prob_clip': 0.008048960445991333, 'iw_n_components': 60, 'iw_logistic_c': 0.6723360598966427, 'iw_pca_fit': 'combined', 'iw_solver': 'lbfgs', 'iw_rho': 0.7}. Best is trial 168 with value: 0.2310715410277358.
2026-06-01 23:59:32 | INFO | Trial 178 | outer=9 | alpha=1.599e+05 n_pcs=5000 (pc_topk) weight={'name': 'pc_logistic', 'floor': 1e-06, 'clip_max': 2.5, 'prob_clip': 0.008028653371153712, 'n_components': 60, 'logistic_c': 0.6733767020077776, 'pca_fit': 'combined', 'solver': 'lbfgs', 'max_iter': 2000, 'fit_intercept': True, 'standardize_with_source': True, 'rho': 0.7}
[I 2026-06-01 23:59:58,218] Trial 178 finished with value: 0.2281546436859847 and parameters: {'alpha': 159923.28982762728, 'n_pcs': 5000, 'iw_method': 'pc_logistic', 'iw_clip_max': 2.5, 'iw_prob_clip': 0.008028653371153712, 'iw_n_components': 60, 'iw_logistic_c': 0.6733767020077776, 'iw_pca_fit': 'combined', 'iw_solver': 'lbfgs', 'iw_rho': 0.7}. Best is trial 168 with value: 0.2310715410277358.
2026-06-01 23:59:58 | INFO | Trial 179 | outer=9 | alpha=1.627e+05 n_pcs=5000 (pc_topk) weight={'name': 'pc_logistic', 'floor': 1e-06, 'clip_max': 2.5, 'prob_clip': 0.008046488234340614, 'n_components': 60, 'logistic_c': 0.6429421851239725, 'pca_fit': 'combined', 'solver': 'lbfgs', 'max_iter': 2000, 'fit_intercept': True, 'standardize_with_source': True, 'rho': 0.7}
[I 2026-06-02 00:00:23,343] Trial 179 finished with value: 0.22804568009224138 and parameters: {'alpha': 162726.52221927463, 'n_pcs': 5000, 'iw_method': 'pc_logistic', 'iw_clip_max': 2.5, 'iw_prob_clip': 0.008046488234340614, 'iw_n_components': 60, 'iw_logistic_c': 0.6429421851239725, 'iw_pca_fit': 'combined', 'iw_solver': 'lbfgs', 'iw_rho': 0.7}. Best is trial 168 with value: 0.2310715410277358.
2026-06-02 00:00:23 | INFO | Trial 180 | outer=9 | alpha=2.067e+05 n_pcs=5000 (pc_topk) weight={'name': 'pc_logistic', 'floor': 1e-06, 'clip_max': 2.5, 'prob_clip': 0.00769187101222776, 'n_components': 60, 'logistic_c': 0.6955332129082099, 'pca_fit': 'combined', 'solver': 'lbfgs', 'max_iter': 2000, 'fit_intercept': True, 'standardize_with_source': True, 'rho': 0.7}
[I 2026-06-02 00:00:49,696] Trial 180 finished with value: 0.22654149711159105 and parameters: {'alpha': 206691.42798809631, 'n_pcs': 5000, 'iw_method': 'pc_logistic', 'iw_clip_max': 2.5, 'iw_prob_clip': 0.00769187101222776, 'iw_n_components': 60, 'iw_logistic_c': 0.6955332129082099, 'iw_pca_fit': 'combined', 'iw_solver': 'lbfgs', 'iw_rho': 0.7}. Best is trial 168 with value: 0.2310715410277358.
2026-06-02 00:00:49 | INFO | Trial 181 | outer=9 | alpha=1.360e+05 n_pcs=5000 (pc_topk) weight={'name': 'pc_logistic', 'floor': 1e-06, 'clip_max': 2.5, 'prob_clip': 0.007914753081462783, 'n_components': 60, 'logistic_c': 0.6881610713200593, 'pca_fit': 'combined', 'solver': 'lbfgs', 'max_iter': 2000, 'fit_intercept': True, 'standardize_with_source': True, 'rho': 0.7}
[I 2026-06-02 00:01:16,165] Trial 181 finished with value: 0.22896040329946402 and parameters: {'alpha': 135951.9413448871, 'n_pcs': 5000, 'iw_method': 'pc_logistic', 'iw_clip_max': 2.5, 'iw_prob_clip': 0.007914753081462783, 'iw_n_components': 60, 'iw_logistic_c': 0.6881610713200593, 'iw_pca_fit': 'combined', 'iw_solver': 'lbfgs', 'iw_rho': 0.7}. Best is trial 168 with value: 0.2310715410277358.
2026-06-02 00:01:16 | INFO | Trial 182 | outer=9 | alpha=3.041e+05 n_pcs=5000 (pc_topk) weight={'name': 'pc_logistic', 'floor': 1e-06, 'clip_max': 2.5, 'prob_clip': 0.007748533491684464, 'n_components': 60, 'logistic_c': 0.710261207374156, 'pca_fit': 'combined', 'solver': 'lbfgs', 'max_iter': 2000, 'fit_intercept': True, 'standardize_with_source': True, 'rho': 0.7}
[I 2026-06-02 00:01:42,229] Trial 182 finished with value: 0.2238687000118879 and parameters: {'alpha': 304065.75652604614, 'n_pcs': 5000, 'iw_method': 'pc_logistic', 'iw_clip_max': 2.5, 'iw_prob_clip': 0.007748533491684464, 'iw_n_components': 60, 'iw_logistic_c': 0.710261207374156, 'iw_pca_fit': 'combined', 'iw_solver': 'lbfgs', 'iw_rho': 0.7}. Best is trial 168 with value: 0.2310715410277358.
2026-06-02 00:01:42 | INFO | Trial 183 | outer=9 | alpha=1.326e+05 n_pcs=5000 (pc_topk) weight={'name': 'pc_logistic', 'floor': 1e-06, 'clip_max': 2.5, 'prob_clip': 0.00728152692642542, 'n_components': 60, 'logistic_c': 0.7231801591379596, 'pca_fit': 'combined', 'solver': 'lbfgs', 'max_iter': 2000, 'fit_intercept': True, 'standardize_with_source': True, 'rho': 0.7}
[I 2026-06-02 00:02:07,990] Trial 183 finished with value: 0.22893262898754546 and parameters: {'alpha': 132558.92880464115, 'n_pcs': 5000, 'iw_method': 'pc_logistic', 'iw_clip_max': 2.5, 'iw_prob_clip': 0.00728152692642542, 'iw_n_components': 60, 'iw_logistic_c': 0.7231801591379596, 'iw_pca_fit': 'combined', 'iw_solver': 'lbfgs', 'iw_rho': 0.7}. Best is trial 168 with value: 0.2310715410277358.
2026-06-02 00:02:08 | INFO | Trial 184 | outer=9 | alpha=1.307e+05 n_pcs=5000 (pc_topk) weight={'name': 'pc_logistic', 'floor': 1e-06, 'clip_max': 2.5, 'prob_clip': 0.007272403738550488, 'n_components': 60, 'logistic_c': 0.9134431303413146, 'pca_fit': 'combined', 'solver': 'lbfgs', 'max_iter': 2000, 'fit_intercept': True, 'standardize_with_source': True, 'rho': 0.7}
[I 2026-06-02 00:02:34,502] Trial 184 finished with value: 0.22898656093374656 and parameters: {'alpha': 130671.29268087886, 'n_pcs': 5000, 'iw_method': 'pc_logistic', 'iw_clip_max': 2.5, 'iw_prob_clip': 0.007272403738550488, 'iw_n_components': 60, 'iw_logistic_c': 0.9134431303413146, 'iw_pca_fit': 'combined', 'iw_solver': 'lbfgs', 'iw_rho': 0.7}. Best is trial 168 with value: 0.2310715410277358.
2026-06-02 00:02:34 | INFO | Trial 185 | outer=9 | alpha=1.234e+05 n_pcs=5000 (pc_topk) weight={'name': 'pc_logistic', 'floor': 1e-06, 'clip_max': 2.5, 'prob_clip': 0.006790555735423459, 'n_components': 60, 'logistic_c': 1.3154264218817413, 'pca_fit': 'combined', 'solver': 'lbfgs', 'max_iter': 2000, 'fit_intercept': True, 'standardize_with_source': True, 'rho': 0.7}
[I 2026-06-02 00:02:59,812] Trial 185 finished with value: 0.2290745183013247 and parameters: {'alpha': 123403.37579132336, 'n_pcs': 5000, 'iw_method': 'pc_logistic', 'iw_clip_max': 2.5, 'iw_prob_clip': 0.006790555735423459, 'iw_n_components': 60, 'iw_logistic_c': 1.3154264218817413, 'iw_pca_fit': 'combined', 'iw_solver': 'lbfgs', 'iw_rho': 0.7}. Best is trial 168 with value: 0.2310715410277358.
2026-06-02 00:02:59 | INFO | Trial 186 | outer=9 | alpha=1.203e+05 n_pcs=5000 (pc_topk) weight={'name': 'pc_logistic', 'floor': 1e-06, 'clip_max': 2.5, 'prob_clip': 0.006363640369235882, 'n_components': 60, 'logistic_c': 1.7692969333554784, 'pca_fit': 'combined', 'solver': 'lbfgs', 'max_iter': 2000, 'fit_intercept': True, 'standardize_with_source': True, 'rho': 0.7}
[I 2026-06-02 00:03:24,335] Trial 186 finished with value: 0.22902922660489683 and parameters: {'alpha': 120292.01491337088, 'n_pcs': 5000, 'iw_method': 'pc_logistic', 'iw_clip_max': 2.5, 'iw_prob_clip': 0.006363640369235882, 'iw_n_components': 60, 'iw_logistic_c': 1.7692969333554784, 'iw_pca_fit': 'combined', 'iw_solver': 'lbfgs', 'iw_rho': 0.7}. Best is trial 168 with value: 0.2310715410277358.
2026-06-02 00:03:24 | INFO | Trial 187 | outer=9 | alpha=1.109e+05 n_pcs=5000 (pc_topk) weight={'name': 'pc_logistic', 'floor': 1e-06, 'clip_max': 2.5, 'prob_clip': 0.005937100326973274, 'n_components': 60, 'logistic_c': 2.011034961095683, 'pca_fit': 'combined', 'solver': 'lbfgs', 'max_iter': 2000, 'fit_intercept': True, 'standardize_with_source': True, 'rho': 0.7}
[I 2026-06-02 00:03:50,480] Trial 187 finished with value: 0.2291317712150537 and parameters: {'alpha': 110940.61761590709, 'n_pcs': 5000, 'iw_method': 'pc_logistic', 'iw_clip_max': 2.5, 'iw_prob_clip': 0.005937100326973274, 'iw_n_components': 60, 'iw_logistic_c': 2.011034961095683, 'iw_pca_fit': 'combined', 'iw_solver': 'lbfgs', 'iw_rho': 0.7}. Best is trial 168 with value: 0.2310715410277358.
2026-06-02 00:03:50 | INFO | Trial 188 | outer=9 | alpha=1.094e+05 n_pcs=5000 (pc_topk) weight={'name': 'pc_logistic', 'floor': 1e-06, 'clip_max': 2.5, 'prob_clip': 0.005869378094387055, 'n_components': 60, 'logistic_c': 2.797161429782196, 'pca_fit': 'combined', 'solver': 'lbfgs', 'max_iter': 2000, 'fit_intercept': True, 'standardize_with_source': True, 'rho': 0.7}
[I 2026-06-02 00:04:16,248] Trial 188 finished with value: 0.2291393840339951 and parameters: {'alpha': 109437.3796197122, 'n_pcs': 5000, 'iw_method': 'pc_logistic', 'iw_clip_max': 2.5, 'iw_prob_clip': 0.005869378094387055, 'iw_n_components': 60, 'iw_logistic_c': 2.797161429782196, 'iw_pca_fit': 'combined', 'iw_solver': 'lbfgs', 'iw_rho': 0.7}. Best is trial 168 with value: 0.2310715410277358.
2026-06-02 00:04:16 | INFO | Trial 189 | outer=9 | alpha=1.044e+05 n_pcs=5000 (pc_topk) weight={'name': 'pc_logistic', 'floor': 1e-06, 'clip_max': 2.5, 'prob_clip': 0.005623481267493226, 'n_components': 60, 'logistic_c': 2.7025961837600248, 'pca_fit': 'combined', 'solver': 'lbfgs', 'max_iter': 2000, 'fit_intercept': True, 'standardize_with_source': True, 'rho': 0.7}
[I 2026-06-02 00:04:41,976] Trial 189 finished with value: 0.22919126942388907 and parameters: {'alpha': 104441.28263760457, 'n_pcs': 5000, 'iw_method': 'pc_logistic', 'iw_clip_max': 2.5, 'iw_prob_clip': 0.005623481267493226, 'iw_n_components': 60, 'iw_logistic_c': 2.7025961837600248, 'iw_pca_fit': 'combined', 'iw_solver': 'lbfgs', 'iw_rho': 0.7}. Best is trial 168 with value: 0.2310715410277358.
2026-06-02 00:04:41 | INFO | Trial 190 | outer=9 | alpha=9.886e+04 n_pcs=5000 (pc_topk) weight={'name': 'pc_logistic', 'floor': 1e-06, 'clip_max': 2.5, 'prob_clip': 0.005735837103191046, 'n_components': 60, 'logistic_c': 2.5872921860828546, 'pca_fit': 'combined', 'solver': 'lbfgs', 'max_iter': 2000, 'fit_intercept': True, 'standardize_with_source': True, 'rho': 0.7}
[I 2026-06-02 00:05:07,883] Trial 190 finished with value: 0.22941802949478815 and parameters: {'alpha': 98863.24033375601, 'n_pcs': 5000, 'iw_method': 'pc_logistic', 'iw_clip_max': 2.5, 'iw_prob_clip': 0.005735837103191046, 'iw_n_components': 60, 'iw_logistic_c': 2.5872921860828546, 'iw_pca_fit': 'combined', 'iw_solver': 'lbfgs', 'iw_rho': 0.7}. Best is trial 168 with value: 0.2310715410277358.
2026-06-02 00:05:07 | INFO | Trial 191 | outer=9 | alpha=1.011e+05 n_pcs=5000 (pc_topk) weight={'name': 'pc_logistic', 'floor': 1e-06, 'clip_max': 2.5, 'prob_clip': 0.005701108442027389, 'n_components': 60, 'logistic_c': 3.0767480292804303, 'pca_fit': 'combined', 'solver': 'lbfgs', 'max_iter': 2000, 'fit_intercept': True, 'standardize_with_source': True, 'rho': 0.7}
[I 2026-06-02 00:05:32,717] Trial 191 finished with value: 0.22932123651411987 and parameters: {'alpha': 101110.85452096425, 'n_pcs': 5000, 'iw_method': 'pc_logistic', 'iw_clip_max': 2.5, 'iw_prob_clip': 0.005701108442027389, 'iw_n_components': 60, 'iw_logistic_c': 3.0767480292804303, 'iw_pca_fit': 'combined', 'iw_solver': 'lbfgs', 'iw_rho': 0.7}. Best is trial 168 with value: 0.2310715410277358.
2026-06-02 00:05:32 | INFO | Trial 192 | outer=9 | alpha=1.072e+05 n_pcs=5000 (pc_topk) weight={'name': 'pc_logistic', 'floor': 1e-06, 'clip_max': 2.5, 'prob_clip': 0.005485905205155571, 'n_components': 60, 'logistic_c': 3.0721832436796084, 'pca_fit': 'combined', 'solver': 'lbfgs', 'max_iter': 2000, 'fit_intercept': True, 'standardize_with_source': True, 'rho': 0.7}
[I 2026-06-02 00:05:57,045] Trial 192 finished with value: 0.22906821005074324 and parameters: {'alpha': 107247.84179933098, 'n_pcs': 5000, 'iw_method': 'pc_logistic', 'iw_clip_max': 2.5, 'iw_prob_clip': 0.005485905205155571, 'iw_n_components': 60, 'iw_logistic_c': 3.0721832436796084, 'iw_pca_fit': 'combined', 'iw_solver': 'lbfgs', 'iw_rho': 0.7}. Best is trial 168 with value: 0.2310715410277358.
2026-06-02 00:05:57 | INFO | Trial 193 | outer=9 | alpha=1.009e+05 n_pcs=5000 (pc_topk) weight={'name': 'pc_logistic', 'floor': 1e-06, 'clip_max': 2.5, 'prob_clip': 0.005645703486027238, 'n_components': 60, 'logistic_c': 3.5271763551161817, 'pca_fit': 'combined', 'solver': 'lbfgs', 'max_iter': 2000, 'fit_intercept': True, 'standardize_with_source': True, 'rho': 0.7}
[I 2026-06-02 00:06:22,581] Trial 193 finished with value: 0.2293079389982297 and parameters: {'alpha': 100859.2871870091, 'n_pcs': 5000, 'iw_method': 'pc_logistic', 'iw_clip_max': 2.5, 'iw_prob_clip': 0.005645703486027238, 'iw_n_components': 60, 'iw_logistic_c': 3.5271763551161817, 'iw_pca_fit': 'combined', 'iw_solver': 'lbfgs', 'iw_rho': 0.7}. Best is trial 168 with value: 0.2310715410277358.
2026-06-02 00:06:22 | INFO | Trial 194 | outer=9 | alpha=8.398e+04 n_pcs=5000 (pc_topk) weight={'name': 'pc_logistic', 'floor': 1e-06, 'clip_max': 2.5, 'prob_clip': 0.0054356888985134305, 'n_components': 60, 'logistic_c': 3.216545524702319, 'pca_fit': 'combined', 'solver': 'lbfgs', 'max_iter': 2000, 'fit_intercept': True, 'standardize_with_source': True, 'rho': 0.7}
[I 2026-06-02 00:06:46,681] Trial 194 finished with value: 0.22963499727710218 and parameters: {'alpha': 83982.3007115588, 'n_pcs': 5000, 'iw_method': 'pc_logistic', 'iw_clip_max': 2.5, 'iw_prob_clip': 0.0054356888985134305, 'iw_n_components': 60, 'iw_logistic_c': 3.216545524702319, 'iw_pca_fit': 'combined', 'iw_solver': 'lbfgs', 'iw_rho': 0.7}. Best is trial 168 with value: 0.2310715410277358.
2026-06-02 00:06:46 | INFO | Trial 195 | outer=9 | alpha=8.735e+04 n_pcs=5000 (pc_topk) weight={'name': 'pc_logistic', 'floor': 1e-06, 'clip_max': 2.5, 'prob_clip': 0.005242806684247772, 'n_components': 60, 'logistic_c': 3.365181481216019, 'pca_fit': 'combined', 'solver': 'lbfgs', 'max_iter': 2000, 'fit_intercept': True, 'standardize_with_source': True, 'rho': 0.7}
[I 2026-06-02 00:07:12,009] Trial 195 finished with value: 0.22947274521168382 and parameters: {'alpha': 87349.51213620583, 'n_pcs': 5000, 'iw_method': 'pc_logistic', 'iw_clip_max': 2.5, 'iw_prob_clip': 0.005242806684247772, 'iw_n_components': 60, 'iw_logistic_c': 3.365181481216019, 'iw_pca_fit': 'combined', 'iw_solver': 'lbfgs', 'iw_rho': 0.7}. Best is trial 168 with value: 0.2310715410277358.
2026-06-02 00:07:12 | INFO | Trial 196 | outer=9 | alpha=8.777e+04 n_pcs=5000 (pc_topk) weight={'name': 'pc_logistic', 'floor': 1e-06, 'clip_max': 2.5, 'prob_clip': 0.004609499519221234, 'n_components': 60, 'logistic_c': 4.357944089328414, 'pca_fit': 'combined', 'solver': 'lbfgs', 'max_iter': 2000, 'fit_intercept': True, 'standardize_with_source': True, 'rho': 0.7}
[I 2026-06-02 00:07:37,982] Trial 196 finished with value: 0.22912100318817474 and parameters: {'alpha': 87768.86940204077, 'n_pcs': 5000, 'iw_method': 'pc_logistic', 'iw_clip_max': 2.5, 'iw_prob_clip': 0.004609499519221234, 'iw_n_components': 60, 'iw_logistic_c': 4.357944089328414, 'iw_pca_fit': 'combined', 'iw_solver': 'lbfgs', 'iw_rho': 0.7}. Best is trial 168 with value: 0.2310715410277358.
2026-06-02 00:07:38 | INFO | Trial 197 | outer=9 | alpha=7.953e+04 n_pcs=5000 (pc_topk) weight={'name': 'pc_logistic', 'floor': 1e-06, 'clip_max': 2.5, 'prob_clip': 0.005466589754231359, 'n_components': 60, 'logistic_c': 0.25153222027185856, 'pca_fit': 'combined', 'solver': 'lbfgs', 'max_iter': 2000, 'fit_intercept': True, 'standardize_with_source': True, 'rho': 0.7}
[I 2026-06-02 00:08:03,160] Trial 197 finished with value: 0.22969676385245918 and parameters: {'alpha': 79534.48267229585, 'n_pcs': 5000, 'iw_method': 'pc_logistic', 'iw_clip_max': 2.5, 'iw_prob_clip': 0.005466589754231359, 'iw_n_components': 60, 'iw_logistic_c': 0.25153222027185856, 'iw_pca_fit': 'combined', 'iw_solver': 'lbfgs', 'iw_rho': 0.7}. Best is trial 168 with value: 0.2310715410277358.
2026-06-02 00:08:03 | INFO | Trial 198 | outer=9 | alpha=8.286e+04 n_pcs=5000 (pc_topk) weight={'name': 'pc_logistic', 'floor': 1e-06, 'clip_max': 2.5, 'prob_clip': 0.010929461612838661, 'n_components': 60, 'logistic_c': 0.23589699278262027, 'pca_fit': 'combined', 'solver': 'lbfgs', 'max_iter': 2000, 'fit_intercept': True, 'standardize_with_source': True, 'rho': 0.7}
