[I 2026-06-01 14:24:12,425] Trial 286 finished with value: 0.24989954202659584 and parameters: {'alpha': 39602.9735410437, 'n_pcs': 5000, 'iw_method': 'pc_logistic', 'iw_clip_max': 12.0, 'iw_prob_clip': 0.0173551811417708, 'iw_n_components': 100, 'iw_logistic_c': 8.544003841261888e-05, 'iw_pca_fit': 'combined', 'iw_solver': 'lbfgs', 'iw_rho': 0.85}. Best is trial 210 with value: 0.2556677849525829.
2026-06-01 14:24:12 | INFO | Trial 287 | outer=1 | alpha=5.898e+04 n_pcs=5000 (pc_topk) weight={'name': 'pc_logistic', 'floor': 1e-06, 'clip_max': 4.0, 'prob_clip': 0.012310222796465004, 'n_components': 100, 'logistic_c': 0.00016527432859844593, 'pca_fit': 'combined', 'solver': 'lbfgs', 'max_iter': 2000, 'fit_intercept': True, 'standardize_with_source': True, 'rho': 0.85}
[I 2026-06-01 14:24:31,905] Trial 287 finished with value: 0.2549010747992061 and parameters: {'alpha': 58981.241113295975, 'n_pcs': 5000, 'iw_method': 'pc_logistic', 'iw_clip_max': 4.0, 'iw_prob_clip': 0.012310222796465004, 'iw_n_components': 100, 'iw_logistic_c': 0.00016527432859844593, 'iw_pca_fit': 'combined', 'iw_solver': 'lbfgs', 'iw_rho': 0.85}. Best is trial 210 with value: 0.2556677849525829.
2026-06-01 14:24:31 | INFO | Trial 288 | outer=1 | alpha=9.416e+04 n_pcs=5000 (pc_topk) weight={'name': 'pc_logistic', 'floor': 1e-06, 'clip_max': 4.0, 'prob_clip': 0.015253313117299223, 'n_components': 100, 'logistic_c': 3.139727688734171e-06, 'pca_fit': 'combined', 'solver': 'lbfgs', 'max_iter': 2000, 'fit_intercept': True, 'standardize_with_source': True, 'rho': 0.85}
[I 2026-06-01 14:24:49,229] Trial 288 finished with value: 0.2453490216981268 and parameters: {'alpha': 94160.00394668568, 'n_pcs': 5000, 'iw_method': 'pc_logistic', 'iw_clip_max': 4.0, 'iw_prob_clip': 0.015253313117299223, 'iw_n_components': 100, 'iw_logistic_c': 3.139727688734171e-06, 'iw_pca_fit': 'combined', 'iw_solver': 'lbfgs', 'iw_rho': 0.85}. Best is trial 210 with value: 0.2556677849525829.
2026-06-01 14:24:49 | INFO | Trial 289 | outer=1 | alpha=7.595e+04 n_pcs=5000 (pc_topk) weight={'name': 'pc_logistic', 'floor': 1e-06, 'clip_max': 4.0, 'prob_clip': 0.01977759218031171, 'n_components': 100, 'logistic_c': 6.634676119691764e-05, 'pca_fit': 'combined', 'solver': 'lbfgs', 'max_iter': 2000, 'fit_intercept': True, 'standardize_with_source': True, 'rho': 1.0}
[I 2026-06-01 14:25:07,572] Trial 289 finished with value: 0.2549564988753174 and parameters: {'alpha': 75951.94004119717, 'n_pcs': 5000, 'iw_method': 'pc_logistic', 'iw_clip_max': 4.0, 'iw_prob_clip': 0.01977759218031171, 'iw_n_components': 100, 'iw_logistic_c': 6.634676119691764e-05, 'iw_pca_fit': 'combined', 'iw_solver': 'lbfgs', 'iw_rho': 1.0}. Best is trial 210 with value: 0.2556677849525829.
2026-06-01 14:25:07 | INFO | Trial 290 | outer=1 | alpha=5.879e+04 n_pcs=5000 (pc_topk) weight={'name': 'pc_logistic', 'floor': 1e-06, 'clip_max': 4.0, 'prob_clip': 0.012850544204005708, 'n_components': 100, 'logistic_c': 0.00012377186216339708, 'pca_fit': 'combined', 'solver': 'lbfgs', 'max_iter': 2000, 'fit_intercept': True, 'standardize_with_source': True, 'rho': 0.85}
[I 2026-06-01 14:25:26,550] Trial 290 finished with value: 0.2551648595139966 and parameters: {'alpha': 58789.58312572898, 'n_pcs': 5000, 'iw_method': 'pc_logistic', 'iw_clip_max': 4.0, 'iw_prob_clip': 0.012850544204005708, 'iw_n_components': 100, 'iw_logistic_c': 0.00012377186216339708, 'iw_pca_fit': 'combined', 'iw_solver': 'lbfgs', 'iw_rho': 0.85}. Best is trial 210 with value: 0.2556677849525829.
2026-06-01 14:25:26 | INFO | Trial 291 | outer=1 | alpha=4.839e+04 n_pcs=5000 (pc_topk) weight={'name': 'pc_logistic', 'floor': 1e-06, 'clip_max': 4.0, 'prob_clip': 0.013769347562921096, 'n_components': 100, 'logistic_c': 0.00029011532304280347, 'pca_fit': 'combined', 'solver': 'lbfgs', 'max_iter': 2000, 'fit_intercept': True, 'standardize_with_source': True, 'rho': 0.85}
[I 2026-06-01 14:25:46,268] Trial 291 finished with value: 0.25373969625770226 and parameters: {'alpha': 48388.826294325336, 'n_pcs': 5000, 'iw_method': 'pc_logistic', 'iw_clip_max': 4.0, 'iw_prob_clip': 0.013769347562921096, 'iw_n_components': 100, 'iw_logistic_c': 0.00029011532304280347, 'iw_pca_fit': 'combined', 'iw_solver': 'lbfgs', 'iw_rho': 0.85}. Best is trial 210 with value: 0.2556677849525829.
2026-06-01 14:25:46 | INFO | Trial 292 | outer=1 | alpha=5.690e+04 n_pcs=5000 (pc_topk) weight={'name': 'pc_logistic', 'floor': 1e-06, 'clip_max': 4.0, 'prob_clip': 0.012884423504751786, 'n_components': 100, 'logistic_c': 0.00012548961433423198, 'pca_fit': 'combined', 'solver': 'lbfgs', 'max_iter': 2000, 'fit_intercept': True, 'standardize_with_source': True, 'rho': 0.85}
[I 2026-06-01 14:26:05,095] Trial 292 finished with value: 0.2550972907731326 and parameters: {'alpha': 56895.92529212151, 'n_pcs': 5000, 'iw_method': 'pc_logistic', 'iw_clip_max': 4.0, 'iw_prob_clip': 0.012884423504751786, 'iw_n_components': 100, 'iw_logistic_c': 0.00012548961433423198, 'iw_pca_fit': 'combined', 'iw_solver': 'lbfgs', 'iw_rho': 0.85}. Best is trial 210 with value: 0.2556677849525829.
2026-06-01 14:26:05 | INFO | Trial 293 | outer=1 | alpha=4.314e+04 n_pcs=5000 (pc_topk) weight={'name': 'pc_logistic', 'floor': 1e-06, 'clip_max': 4.0, 'prob_clip': 0.015073329600674132, 'n_components': 100, 'logistic_c': 0.00021084335531761854, 'pca_fit': 'combined', 'solver': 'lbfgs', 'max_iter': 2000, 'fit_intercept': True, 'standardize_with_source': True, 'rho': 0.85}
[I 2026-06-01 14:26:24,107] Trial 293 finished with value: 0.25386046944879437 and parameters: {'alpha': 43141.603364754046, 'n_pcs': 5000, 'iw_method': 'pc_logistic', 'iw_clip_max': 4.0, 'iw_prob_clip': 0.015073329600674132, 'iw_n_components': 100, 'iw_logistic_c': 0.00021084335531761854, 'iw_pca_fit': 'combined', 'iw_solver': 'lbfgs', 'iw_rho': 0.85}. Best is trial 210 with value: 0.2556677849525829.
2026-06-01 14:26:24 | INFO | Trial 294 | outer=1 | alpha=6.079e+04 n_pcs=5000 (pc_topk) weight={'name': 'pc_logistic', 'floor': 1e-06, 'clip_max': 4.0, 'prob_clip': 0.01631356825036098, 'n_components': 100, 'logistic_c': 0.00010033304216975039, 'pca_fit': 'combined', 'solver': 'lbfgs', 'max_iter': 2000, 'fit_intercept': True, 'standardize_with_source': True, 'rho': 0.85}
[I 2026-06-01 14:26:42,455] Trial 294 finished with value: 0.2555370976559635 and parameters: {'alpha': 60792.14876892904, 'n_pcs': 5000, 'iw_method': 'pc_logistic', 'iw_clip_max': 4.0, 'iw_prob_clip': 0.01631356825036098, 'iw_n_components': 100, 'iw_logistic_c': 0.00010033304216975039, 'iw_pca_fit': 'combined', 'iw_solver': 'lbfgs', 'iw_rho': 0.85}. Best is trial 210 with value: 0.2556677849525829.
2026-06-01 14:26:42 | INFO | Trial 295 | outer=1 | alpha=4.538e+04 n_pcs=5000 (pc_topk) weight={'name': 'pc_logistic', 'floor': 1e-06, 'clip_max': 4.0, 'prob_clip': 0.016641161353121284, 'n_components': 100, 'logistic_c': 0.00013139048397114268, 'pca_fit': 'combined', 'solver': 'lbfgs', 'max_iter': 2000, 'fit_intercept': True, 'standardize_with_source': True, 'rho': 0.85}
[I 2026-06-01 14:27:01,505] Trial 295 finished with value: 0.25465767792837735 and parameters: {'alpha': 45379.4864591759, 'n_pcs': 5000, 'iw_method': 'pc_logistic', 'iw_clip_max': 4.0, 'iw_prob_clip': 0.016641161353121284, 'iw_n_components': 100, 'iw_logistic_c': 0.00013139048397114268, 'iw_pca_fit': 'combined', 'iw_solver': 'lbfgs', 'iw_rho': 0.85}. Best is trial 210 with value: 0.2556677849525829.
2026-06-01 14:27:01 | INFO | Trial 296 | outer=1 | alpha=5.843e+04 n_pcs=5000 (pc_topk) weight={'name': 'pc_logistic', 'floor': 1e-06, 'clip_max': 4.0, 'prob_clip': 0.016193185485767734, 'n_components': 100, 'logistic_c': 0.00010625112402727835, 'pca_fit': 'combined', 'solver': 'lbfgs', 'max_iter': 2000, 'fit_intercept': True, 'standardize_with_source': True, 'rho': 0.85}
[I 2026-06-01 14:27:20,298] Trial 296 finished with value: 0.25548701069294905 and parameters: {'alpha': 58430.86450714297, 'n_pcs': 5000, 'iw_method': 'pc_logistic', 'iw_clip_max': 4.0, 'iw_prob_clip': 0.016193185485767734, 'iw_n_components': 100, 'iw_logistic_c': 0.00010625112402727835, 'iw_pca_fit': 'combined', 'iw_solver': 'lbfgs', 'iw_rho': 0.85}. Best is trial 210 with value: 0.2556677849525829.
2026-06-01 14:27:20 | INFO | Trial 297 | outer=1 | alpha=3.256e+04 n_pcs=5000 (pc_topk) weight={'name': 'uniform'}
[I 2026-06-01 14:27:30,502] Trial 297 finished with value: 0.2444330184098385 and parameters: {'alpha': 32562.974392913162, 'n_pcs': 5000, 'iw_method': 'uniform'}. Best is trial 210 with value: 0.2556677849525829.
2026-06-01 14:27:30 | INFO | Trial 298 | outer=1 | alpha=5.503e+04 n_pcs=5000 (pc_topk) weight={'name': 'pc_logistic', 'floor': 1e-06, 'clip_max': 7.0, 'prob_clip': 0.017930149169979846, 'n_components': 100, 'logistic_c': 9.457450615908068e-05, 'pca_fit': 'combined', 'solver': 'lbfgs', 'max_iter': 2000, 'fit_intercept': True, 'standardize_with_source': True, 'rho': 0.85}
[I 2026-06-01 14:27:49,062] Trial 298 finished with value: 0.25317396506811674 and parameters: {'alpha': 55032.2824471292, 'n_pcs': 5000, 'iw_method': 'pc_logistic', 'iw_clip_max': 7.0, 'iw_prob_clip': 0.017930149169979846, 'iw_n_components': 100, 'iw_logistic_c': 9.457450615908068e-05, 'iw_pca_fit': 'combined', 'iw_solver': 'lbfgs', 'iw_rho': 0.85}. Best is trial 210 with value: 0.2556677849525829.
2026-06-01 14:27:49 | INFO | Trial 299 | outer=1 | alpha=9.947e+06 n_pcs=4500 (pc_topk) weight={'name': 'pc_logistic', 'floor': 1e-06, 'clip_max': 4.0, 'prob_clip': 0.016174510912217825, 'n_components': 100, 'logistic_c': 0.000184635699068559, 'pca_fit': 'combined', 'solver': 'lbfgs', 'max_iter': 2000, 'fit_intercept': True, 'standardize_with_source': True, 'rho': 0.85}
[I 2026-06-01 14:28:06,456] Trial 299 finished with value: 0.2288079233752221 and parameters: {'alpha': 9947378.560848834, 'n_pcs': 4500, 'iw_method': 'pc_logistic', 'iw_clip_max': 4.0, 'iw_prob_clip': 0.016174510912217825, 'iw_n_components': 100, 'iw_logistic_c': 0.000184635699068559, 'iw_pca_fit': 'combined', 'iw_solver': 'lbfgs', 'iw_rho': 0.85}. Best is trial 210 with value: 0.2556677849525829.
2026-06-01 14:28:06 | INFO | OUTER 1 best (inner mean r=0.2557): {'model_type': 'pc_ridge', 'alpha': 64568.82811537051, 'use_snp_selection': True, 'num_snps': 5000, 'n_pcs': 5000, 'weighting': {'name': 'pc_logistic', 'floor': 1e-06, 'clip_max': 4.0, 'prob_clip': 0.015007793630698575, 'n_components': 100, 'logistic_c': 0.00010328407742819704, 'pca_fit': 'combined', 'solver': 'lbfgs', 'max_iter': 2000, 'fit_intercept': True, 'standardize_with_source': True, 'rho': 0.85}, 'mean_inner_effective_sample_size': 3447.831200854964, 'mean_inner_effective_sample_size_threshold': 1037.68}
2026-06-01 14:28:08 | INFO | OUTER 1 TEST r = 0.1580
2026-06-01 14:28:08 | INFO | OUTER 1 incremental summary saved to outputs/final_results/e6_pc_ridge_importance/thr_wing/e6_pc_ridge_importance_thr_wing_results.json
2026-06-01 14:28:08 | INFO | OUTER 2: test_size=92 island=1 (Myken)
2026-06-01 14:28:08 | INFO | OUTER 2: using top 10 related inner validation islands for tuning: 3(Selvær, avgGRM=0.0212), 2(Træna, avgGRM=0.0152), 8(Lovund, avgGRM=0.0084), 0(Nesøy, avgGRM=0.0066), 9(Sleneset, avgGRM=0.0044), 7(Onøy og Lurøy, avgGRM=0.0024), 5(Hestmannøy, avgGRM=0.0014), 6(Indre Kvarøy, avgGRM=0.0009), 4(Gjerøy, avgGRM=-0.0004), 10(Aldra, avgGRM=-0.0036)
[I 2026-06-01 14:28:08,520] A new study created in memory with name: ridge_importance_inner_outer1
2026-06-01 14:28:08 | INFO | Trial 0 | outer=2 | alpha=1.137e+05 n_pcs=4000 (pc_topk) weight={'name': 'uniform'}
[I 2026-06-01 14:28:15,604] Trial 0 finished with value: 0.2317822974125432 and parameters: {'alpha': 113703.38004442609, 'n_pcs': 4000, 'iw_method': 'uniform'}. Best is trial 0 with value: 0.2317822974125432.
2026-06-01 14:28:15 | INFO | Trial 1 | outer=2 | alpha=1.734e+04 n_pcs=5000 (pc_topk) weight={'name': 'uniform'}
[I 2026-06-01 14:28:25,746] Trial 1 finished with value: 0.22851433980837382 and parameters: {'alpha': 17335.792577698634, 'n_pcs': 5000, 'iw_method': 'uniform'}. Best is trial 0 with value: 0.2317822974125432.
2026-06-01 14:28:25 | INFO | Trial 2 | outer=2 | alpha=1.435e+05 n_pcs=1500 (pc_topk) weight={'name': 'uniform'}
[I 2026-06-01 14:28:28,725] Trial 2 finished with value: 0.22158034718844544 and parameters: {'alpha': 143482.76912965564, 'n_pcs': 1500, 'iw_method': 'uniform'}. Best is trial 0 with value: 0.2317822974125432.
2026-06-01 14:28:28 | INFO | Trial 3 | outer=2 | alpha=1.431e+05 n_pcs=500 (pc_topk) weight={'name': 'uniform'}
[I 2026-06-01 14:28:29,619] Trial 3 finished with value: 0.18541227815364117 and parameters: {'alpha': 143072.2464444983, 'n_pcs': 500, 'iw_method': 'uniform'}. Best is trial 0 with value: 0.2317822974125432.
2026-06-01 14:28:29 | INFO | Trial 4 | outer=2 | alpha=5.373e+06 n_pcs=2000 (pc_topk) weight={'name': 'pc_logistic', 'floor': 1e-06, 'clip_max': 1.5, 'prob_clip': 0.001637400317167702, 'n_components': 80, 'logistic_c': 0.09386700500068379, 'pca_fit': 'combined', 'solver': 'lbfgs', 'max_iter': 2000, 'fit_intercept': True, 'standardize_with_source': True, 'rho': 1.0}
[I 2026-06-01 14:28:48,197] Trial 4 finished with value: 0.21202971065342582 and parameters: {'alpha': 5373167.4046281455, 'n_pcs': 2000, 'iw_method': 'pc_logistic', 'iw_clip_max': 1.5, 'iw_prob_clip': 0.001637400317167702, 'iw_n_components': 80, 'iw_logistic_c': 0.09386700500068379, 'iw_pca_fit': 'combined', 'iw_solver': 'lbfgs', 'iw_rho': 1.0}. Best is trial 0 with value: 0.2317822974125432.
2026-06-01 14:28:48 | INFO | Trial 5 | outer=2 | alpha=6.435e+04 n_pcs=1000 (pc_topk) weight={'name': 'pc_logistic', 'floor': 1e-06, 'clip_max': 7.0, 'prob_clip': 0.004193356127903791, 'n_components': 20, 'logistic_c': 9.236417519010976, 'pca_fit': 'combined', 'solver': 'lbfgs', 'max_iter': 2000, 'fit_intercept': True, 'standardize_with_source': True, 'rho': 1.0}
2026-06-01 14:29:00 | INFO | Trial 5 rejected by ESS guard: mean_ess=839.45 threshold=1042.36
[I 2026-06-01 14:29:00,443] Trial 5 finished with value: -1.0 and parameters: {'alpha': 64350.09539177312, 'n_pcs': 1000, 'iw_method': 'pc_logistic', 'iw_clip_max': 7.0, 'iw_prob_clip': 0.004193356127903791, 'iw_n_components': 20, 'iw_logistic_c': 9.236417519010976, 'iw_pca_fit': 'combined', 'iw_solver': 'lbfgs', 'iw_rho': 1.0}. Best is trial 0 with value: 0.2317822974125432.
2026-06-01 14:29:00 | INFO | Trial 6 | outer=2 | alpha=3.046e+05 n_pcs=3500 (pc_topk) weight={'name': 'pc_logistic', 'floor': 1e-06, 'clip_max': 12.0, 'prob_clip': 0.0007016380040663315, 'n_components': 80, 'logistic_c': 0.00021908930989278453, 'pca_fit': 'combined', 'solver': 'lbfgs', 'max_iter': 2000, 'fit_intercept': True, 'standardize_with_source': True, 'rho': 0.7}
[I 2026-06-01 14:29:12,995] Trial 6 finished with value: 0.22816675805706216 and parameters: {'alpha': 304631.0485153137, 'n_pcs': 3500, 'iw_method': 'pc_logistic', 'iw_clip_max': 12.0, 'iw_prob_clip': 0.0007016380040663315, 'iw_n_components': 80, 'iw_logistic_c': 0.00021908930989278453, 'iw_pca_fit': 'combined', 'iw_solver': 'lbfgs', 'iw_rho': 0.7}. Best is trial 0 with value: 0.2317822974125432.
2026-06-01 14:29:12 | INFO | Trial 7 | outer=2 | alpha=7.213e+06 n_pcs=500 (pc_topk) weight={'name': 'uniform'}
[I 2026-06-01 14:29:13,848] Trial 7 finished with value: 0.18696827094339136 and parameters: {'alpha': 7213019.60957054, 'n_pcs': 500, 'iw_method': 'uniform'}. Best is trial 0 with value: 0.2317822974125432.
2026-06-01 14:29:13 | INFO | Trial 8 | outer=2 | alpha=2.347e+03 n_pcs=3000 (pc_topk) weight={'name': 'pc_logistic', 'floor': 1e-06, 'clip_max': 2.5, 'prob_clip': 0.017782866059784724, 'n_components': 60, 'logistic_c': 4.584813955429537e-07, 'pca_fit': 'combined', 'solver': 'lbfgs', 'max_iter': 2000, 'fit_intercept': True, 'standardize_with_source': True, 'rho': 0.3}
[I 2026-06-01 14:29:23,901] Trial 8 finished with value: 0.13508599013835249 and parameters: {'alpha': 2346.6230871488538, 'n_pcs': 3000, 'iw_method': 'pc_logistic', 'iw_clip_max': 2.5, 'iw_prob_clip': 0.017782866059784724, 'iw_n_components': 60, 'iw_logistic_c': 4.584813955429537e-07, 'iw_pca_fit': 'combined', 'iw_solver': 'lbfgs', 'iw_rho': 0.3}. Best is trial 0 with value: 0.2317822974125432.
2026-06-01 14:29:23 | INFO | Trial 9 | outer=2 | alpha=1.067e+03 n_pcs=4000 (pc_topk) weight={'name': 'pc_logistic', 'floor': 1e-06, 'clip_max': 4.0, 'prob_clip': 0.003002704300062754, 'n_components': 10, 'logistic_c': 4.32601466983518e-06, 'pca_fit': 'combined', 'solver': 'lbfgs', 'max_iter': 2000, 'fit_intercept': True, 'standardize_with_source': True, 'rho': 1.0}
[I 2026-06-01 14:29:37,044] Trial 9 finished with value: 0.10906146415751747 and parameters: {'alpha': 1067.2105048492429, 'n_pcs': 4000, 'iw_method': 'pc_logistic', 'iw_clip_max': 4.0, 'iw_prob_clip': 0.003002704300062754, 'iw_n_components': 10, 'iw_logistic_c': 4.32601466983518e-06, 'iw_pca_fit': 'combined', 'iw_solver': 'lbfgs', 'iw_rho': 1.0}. Best is trial 0 with value: 0.2317822974125432.
2026-06-01 14:29:37 | INFO | Trial 10 | outer=2 | alpha=9.030e+05 n_pcs=5000 (pc_topk) weight={'name': 'uniform'}
[I 2026-06-01 14:29:47,232] Trial 10 finished with value: 0.21739184562646327 and parameters: {'alpha': 902970.0505273588, 'n_pcs': 5000, 'iw_method': 'uniform'}. Best is trial 0 with value: 0.2317822974125432.
2026-06-01 14:29:47 | INFO | Trial 11 | outer=2 | alpha=1.245e+04 n_pcs=5000 (pc_topk) weight={'name': 'uniform'}
[I 2026-06-01 14:29:57,441] Trial 11 finished with value: 0.2241759829821052 and parameters: {'alpha': 12451.817386682478, 'n_pcs': 5000, 'iw_method': 'uniform'}. Best is trial 0 with value: 0.2317822974125432.
2026-06-01 14:29:57 | INFO | Trial 12 | outer=2 | alpha=1.792e+04 n_pcs=4000 (pc_topk) weight={'name': 'uniform'}
[I 2026-06-01 14:30:04,625] Trial 12 finished with value: 0.2242418216916112 and parameters: {'alpha': 17922.511917924126, 'n_pcs': 4000, 'iw_method': 'uniform'}. Best is trial 0 with value: 0.2317822974125432.
2026-06-01 14:30:04 | INFO | Trial 13 | outer=2 | alpha=1.913e+04 n_pcs=4500 (pc_topk) weight={'name': 'uniform'}
[I 2026-06-01 14:30:13,512] Trial 13 finished with value: 0.22916876737439096 and parameters: {'alpha': 19132.13627882653, 'n_pcs': 4500, 'iw_method': 'uniform'}. Best is trial 0 with value: 0.2317822974125432.
2026-06-01 14:30:13 | INFO | Trial 14 | outer=2 | alpha=8.124e+05 n_pcs=4000 (pc_topk) weight={'name': 'uniform'}
[I 2026-06-01 14:30:20,561] Trial 14 finished with value: 0.2191571791827433 and parameters: {'alpha': 812435.5329230118, 'n_pcs': 4000, 'iw_method': 'uniform'}. Best is trial 0 with value: 0.2317822974125432.
2026-06-01 14:30:20 | INFO | Trial 15 | outer=2 | alpha=3.569e+04 n_pcs=2500 (pc_topk) weight={'name': 'uniform'}
[I 2026-06-01 14:30:24,897] Trial 15 finished with value: 0.22460902210566475 and parameters: {'alpha': 35688.940173379786, 'n_pcs': 2500, 'iw_method': 'uniform'}. Best is trial 0 with value: 0.2317822974125432.
2026-06-01 14:30:24 | INFO | Trial 16 | outer=2 | alpha=5.443e+03 n_pcs=4500 (pc_topk) weight={'name': 'uniform'}
[I 2026-06-01 14:30:33,928] Trial 16 finished with value: 0.2001912865520648 and parameters: {'alpha': 5443.00802406258, 'n_pcs': 4500, 'iw_method': 'uniform'}. Best is trial 0 with value: 0.2317822974125432.
2026-06-01 14:30:33 | INFO | Trial 17 | outer=2 | alpha=3.658e+05 n_pcs=3000 (pc_topk) weight={'name': 'uniform'}
[I 2026-06-01 14:30:39,030] Trial 17 finished with value: 0.22289971111238308 and parameters: {'alpha': 365759.5232064611, 'n_pcs': 3000, 'iw_method': 'uniform'}. Best is trial 0 with value: 0.2317822974125432.
2026-06-01 14:30:39 | INFO | Trial 18 | outer=2 | alpha=4.298e+03 n_pcs=3500 (pc_topk) weight={'name': 'uniform'}
[I 2026-06-01 14:30:44,920] Trial 18 finished with value: 0.16400314558373946 and parameters: {'alpha': 4297.891908049084, 'n_pcs': 3500, 'iw_method': 'uniform'}. Best is trial 0 with value: 0.2317822974125432.
2026-06-01 14:30:44 | INFO | Trial 19 | outer=2 | alpha=3.714e+04 n_pcs=4500 (pc_topk) weight={'name': 'uniform'}
[I 2026-06-01 14:30:53,737] Trial 19 finished with value: 0.23384075091798168 and parameters: {'alpha': 37135.95011052599, 'n_pcs': 4500, 'iw_method': 'uniform'}. Best is trial 19 with value: 0.23384075091798168.
2026-06-01 14:30:53 | INFO | Trial 20 | outer=2 | alpha=2.450e+06 n_pcs=3500 (pc_topk) weight={'name': 'uniform'}
[I 2026-06-01 14:30:59,695] Trial 20 finished with value: 0.21471259906000326 and parameters: {'alpha': 2449852.09368159, 'n_pcs': 3500, 'iw_method': 'uniform'}. Best is trial 19 with value: 0.23384075091798168.
2026-06-01 14:30:59 | INFO | Trial 21 | outer=2 | alpha=5.642e+04 n_pcs=4500 (pc_topk) weight={'name': 'uniform'}
[I 2026-06-01 14:31:08,506] Trial 21 finished with value: 0.2340882379619119 and parameters: {'alpha': 56423.51703014092, 'n_pcs': 4500, 'iw_method': 'uniform'}. Best is trial 21 with value: 0.2340882379619119.
2026-06-01 14:31:08 | INFO | Trial 22 | outer=2 | alpha=5.649e+04 n_pcs=4500 (pc_topk) weight={'name': 'uniform'}
[I 2026-06-01 14:31:17,351] Trial 22 finished with value: 0.23408643386435463 and parameters: {'alpha': 56494.901577378594, 'n_pcs': 4500, 'iw_method': 'uniform'}. Best is trial 21 with value: 0.2340882379619119.
2026-06-01 14:31:17 | INFO | Trial 23 | outer=2 | alpha=5.241e+04 n_pcs=4500 (pc_topk) weight={'name': 'uniform'}
[I 2026-06-01 14:31:26,121] Trial 23 finished with value: 0.2341686394044118 and parameters: {'alpha': 52414.50518039546, 'n_pcs': 4500, 'iw_method': 'uniform'}. Best is trial 23 with value: 0.2341686394044118.
2026-06-01 14:31:26 | INFO | Trial 24 | outer=2 | alpha=5.785e+04 n_pcs=5000 (pc_topk) weight={'name': 'uniform'}
[I 2026-06-01 14:31:36,271] Trial 24 finished with value: 0.23342107966570264 and parameters: {'alpha': 57853.487672630894, 'n_pcs': 5000, 'iw_method': 'uniform'}. Best is trial 23 with value: 0.2341686394044118.
2026-06-01 14:31:36 | INFO | Trial 25 | outer=2 | alpha=3.040e+05 n_pcs=4500 (pc_topk) weight={'name': 'uniform'}
