[I 2026-06-01 18:44:58,723] Trial 64 finished with value: 0.24907078413426936 and parameters: {'alpha': 21359.559777434588, 'n_pcs': 4000, 'iw_method': 'pc_logistic', 'iw_clip_max': 4.0, 'iw_prob_clip': 0.019282223647786447, 'iw_n_components': 80, 'iw_logistic_c': 8.729768989269247e-06, 'iw_pca_fit': 'combined', 'iw_solver': 'lbfgs', 'iw_rho': 0.7}. Best is trial 62 with value: 0.2563107245209508.
2026-06-01 18:44:58 | INFO | Trial 65 | outer=5 | alpha=3.985e+04 n_pcs=4500 (pc_topk) weight={'name': 'pc_logistic', 'floor': 1e-06, 'clip_max': 7.0, 'prob_clip': 0.03366996658518175, 'n_components': 80, 'logistic_c': 3.361423247476484e-05, 'pca_fit': 'combined', 'solver': 'lbfgs', 'max_iter': 2000, 'fit_intercept': True, 'standardize_with_source': True, 'rho': 0.7}
[I 2026-06-01 18:45:13,649] Trial 65 finished with value: 0.2571388249515015 and parameters: {'alpha': 39854.93118983786, 'n_pcs': 4500, 'iw_method': 'pc_logistic', 'iw_clip_max': 7.0, 'iw_prob_clip': 0.03366996658518175, 'iw_n_components': 80, 'iw_logistic_c': 3.361423247476484e-05, 'iw_pca_fit': 'combined', 'iw_solver': 'lbfgs', 'iw_rho': 0.7}. Best is trial 65 with value: 0.2571388249515015.
2026-06-01 18:45:13 | INFO | Trial 66 | outer=5 | alpha=4.165e+04 n_pcs=4500 (pc_topk) weight={'name': 'pc_logistic', 'floor': 1e-06, 'clip_max': 7.0, 'prob_clip': 0.0464041869135911, 'n_components': 80, 'logistic_c': 1.8196511496779333e-06, 'pca_fit': 'combined', 'solver': 'lbfgs', 'max_iter': 2000, 'fit_intercept': True, 'standardize_with_source': True, 'rho': 0.7}
[I 2026-06-01 18:45:28,248] Trial 66 finished with value: 0.24500567417336078 and parameters: {'alpha': 41648.49112523958, 'n_pcs': 4500, 'iw_method': 'pc_logistic', 'iw_clip_max': 7.0, 'iw_prob_clip': 0.0464041869135911, 'iw_n_components': 80, 'iw_logistic_c': 1.8196511496779333e-06, 'iw_pca_fit': 'combined', 'iw_solver': 'lbfgs', 'iw_rho': 0.7}. Best is trial 65 with value: 0.2571388249515015.
2026-06-01 18:45:28 | INFO | Trial 67 | outer=5 | alpha=3.694e+03 n_pcs=4500 (pc_topk) weight={'name': 'pc_logistic', 'floor': 1e-06, 'clip_max': 7.0, 'prob_clip': 0.032126503667803875, 'n_components': 80, 'logistic_c': 4.068456320698881e-05, 'pca_fit': 'combined', 'solver': 'lbfgs', 'max_iter': 2000, 'fit_intercept': True, 'standardize_with_source': True, 'rho': 0.7}
[I 2026-06-01 18:45:59,269] Trial 67 finished with value: 0.2100055174752939 and parameters: {'alpha': 3693.586420366415, 'n_pcs': 4500, 'iw_method': 'pc_logistic', 'iw_clip_max': 7.0, 'iw_prob_clip': 0.032126503667803875, 'iw_n_components': 80, 'iw_logistic_c': 4.068456320698881e-05, 'iw_pca_fit': 'combined', 'iw_solver': 'lbfgs', 'iw_rho': 0.7}. Best is trial 65 with value: 0.2571388249515015.
2026-06-01 18:45:59 | INFO | Trial 68 | outer=5 | alpha=1.398e+04 n_pcs=4000 (pc_topk) weight={'name': 'pc_logistic', 'floor': 1e-06, 'clip_max': 7.0, 'prob_clip': 0.02243514892531558, 'n_components': 80, 'logistic_c': 5.030508245021489e-07, 'pca_fit': 'combined', 'solver': 'lbfgs', 'max_iter': 2000, 'fit_intercept': True, 'standardize_with_source': True, 'rho': 0.85}
[I 2026-06-01 18:46:11,821] Trial 68 finished with value: 0.23711940899164402 and parameters: {'alpha': 13979.18091251857, 'n_pcs': 4000, 'iw_method': 'pc_logistic', 'iw_clip_max': 7.0, 'iw_prob_clip': 0.02243514892531558, 'iw_n_components': 80, 'iw_logistic_c': 5.030508245021489e-07, 'iw_pca_fit': 'combined', 'iw_solver': 'lbfgs', 'iw_rho': 0.85}. Best is trial 65 with value: 0.2571388249515015.
2026-06-01 18:46:11 | INFO | Trial 69 | outer=5 | alpha=9.755e+04 n_pcs=4500 (pc_topk) weight={'name': 'pc_logistic', 'floor': 1e-06, 'clip_max': 7.0, 'prob_clip': 0.03776380290743242, 'n_components': 80, 'logistic_c': 1.7439012190730982e-05, 'pca_fit': 'combined', 'solver': 'lbfgs', 'max_iter': 2000, 'fit_intercept': True, 'standardize_with_source': True, 'rho': 0.7}
[I 2026-06-01 18:46:26,602] Trial 69 finished with value: 0.2503311625567547 and parameters: {'alpha': 97549.3754359415, 'n_pcs': 4500, 'iw_method': 'pc_logistic', 'iw_clip_max': 7.0, 'iw_prob_clip': 0.03776380290743242, 'iw_n_components': 80, 'iw_logistic_c': 1.7439012190730982e-05, 'iw_pca_fit': 'combined', 'iw_solver': 'lbfgs', 'iw_rho': 0.7}. Best is trial 65 with value: 0.2571388249515015.
2026-06-01 18:46:26 | INFO | Trial 70 | outer=5 | alpha=8.619e+03 n_pcs=4500 (pc_topk) weight={'name': 'pc_logistic', 'floor': 1e-06, 'clip_max': 7.0, 'prob_clip': 0.03909026237748119, 'n_components': 20, 'logistic_c': 9.616228168945061e-06, 'pca_fit': 'combined', 'solver': 'lbfgs', 'max_iter': 2000, 'fit_intercept': True, 'standardize_with_source': True, 'rho': 0.7}
[I 2026-06-01 18:46:41,753] Trial 70 finished with value: 0.23635229011609793 and parameters: {'alpha': 8619.275434441091, 'n_pcs': 4500, 'iw_method': 'pc_logistic', 'iw_clip_max': 7.0, 'iw_prob_clip': 0.03909026237748119, 'iw_n_components': 20, 'iw_logistic_c': 9.616228168945061e-06, 'iw_pca_fit': 'combined', 'iw_solver': 'lbfgs', 'iw_rho': 0.7}. Best is trial 65 with value: 0.2571388249515015.
2026-06-01 18:46:41 | INFO | Trial 71 | outer=5 | alpha=2.811e+04 n_pcs=4000 (pc_topk) weight={'name': 'pc_logistic', 'floor': 1e-06, 'clip_max': 4.0, 'prob_clip': 0.049700778805963484, 'n_components': 80, 'logistic_c': 3.929093928742208e-05, 'pca_fit': 'combined', 'solver': 'lbfgs', 'max_iter': 2000, 'fit_intercept': True, 'standardize_with_source': True, 'rho': 0.3}
[I 2026-06-01 18:46:55,217] Trial 71 finished with value: 0.2498270656046364 and parameters: {'alpha': 28105.79134166346, 'n_pcs': 4000, 'iw_method': 'pc_logistic', 'iw_clip_max': 4.0, 'iw_prob_clip': 0.049700778805963484, 'iw_n_components': 80, 'iw_logistic_c': 3.929093928742208e-05, 'iw_pca_fit': 'combined', 'iw_solver': 'lbfgs', 'iw_rho': 0.3}. Best is trial 65 with value: 0.2571388249515015.
2026-06-01 18:46:55 | INFO | Trial 72 | outer=5 | alpha=4.045e+04 n_pcs=4000 (pc_topk) weight={'name': 'pc_logistic', 'floor': 1e-06, 'clip_max': 4.0, 'prob_clip': 0.026119421940609143, 'n_components': 100, 'logistic_c': 0.00014378016611234709, 'pca_fit': 'combined', 'solver': 'lbfgs', 'max_iter': 2000, 'fit_intercept': True, 'standardize_with_source': True, 'rho': 0.85}
[I 2026-06-01 18:47:10,228] Trial 72 finished with value: 0.2574547478381023 and parameters: {'alpha': 40447.738064394565, 'n_pcs': 4000, 'iw_method': 'pc_logistic', 'iw_clip_max': 4.0, 'iw_prob_clip': 0.026119421940609143, 'iw_n_components': 100, 'iw_logistic_c': 0.00014378016611234709, 'iw_pca_fit': 'combined', 'iw_solver': 'lbfgs', 'iw_rho': 0.85}. Best is trial 72 with value: 0.2574547478381023.
2026-06-01 18:47:10 | INFO | Trial 73 | outer=5 | alpha=4.233e+04 n_pcs=3500 (pc_topk) weight={'name': 'pc_logistic', 'floor': 1e-06, 'clip_max': 4.0, 'prob_clip': 0.025781828096777846, 'n_components': 100, 'logistic_c': 0.00016863472928628197, 'pca_fit': 'combined', 'solver': 'lbfgs', 'max_iter': 2000, 'fit_intercept': True, 'standardize_with_source': True, 'rho': 0.85}
[I 2026-06-01 18:47:23,354] Trial 73 finished with value: 0.2538465885770965 and parameters: {'alpha': 42332.73479514852, 'n_pcs': 3500, 'iw_method': 'pc_logistic', 'iw_clip_max': 4.0, 'iw_prob_clip': 0.025781828096777846, 'iw_n_components': 100, 'iw_logistic_c': 0.00016863472928628197, 'iw_pca_fit': 'combined', 'iw_solver': 'lbfgs', 'iw_rho': 0.85}. Best is trial 72 with value: 0.2574547478381023.
2026-06-01 18:47:23 | INFO | Trial 74 | outer=5 | alpha=2.016e+04 n_pcs=3500 (pc_topk) weight={'name': 'pc_logistic', 'floor': 1e-06, 'clip_max': 2.5, 'prob_clip': 0.026482590979842464, 'n_components': 100, 'logistic_c': 0.00020169359865282522, 'pca_fit': 'combined', 'solver': 'lbfgs', 'max_iter': 2000, 'fit_intercept': True, 'standardize_with_source': True, 'rho': 0.85}
[I 2026-06-01 18:47:41,915] Trial 74 finished with value: 0.24435871804718992 and parameters: {'alpha': 20158.60203037361, 'n_pcs': 3500, 'iw_method': 'pc_logistic', 'iw_clip_max': 2.5, 'iw_prob_clip': 0.026482590979842464, 'iw_n_components': 100, 'iw_logistic_c': 0.00020169359865282522, 'iw_pca_fit': 'combined', 'iw_solver': 'lbfgs', 'iw_rho': 0.85}. Best is trial 72 with value: 0.2574547478381023.
2026-06-01 18:47:41 | INFO | Trial 75 | outer=5 | alpha=3.165e+04 n_pcs=3000 (pc_topk) weight={'name': 'pc_logistic', 'floor': 1e-06, 'clip_max': 1.5, 'prob_clip': 0.032296713350642485, 'n_components': 100, 'logistic_c': 0.0003647950997431777, 'pca_fit': 'combined', 'solver': 'lbfgs', 'max_iter': 2000, 'fit_intercept': True, 'standardize_with_source': True, 'rho': 0.85}
[I 2026-06-01 18:47:58,199] Trial 75 finished with value: 0.2451473795907543 and parameters: {'alpha': 31646.46662368129, 'n_pcs': 3000, 'iw_method': 'pc_logistic', 'iw_clip_max': 1.5, 'iw_prob_clip': 0.032296713350642485, 'iw_n_components': 100, 'iw_logistic_c': 0.0003647950997431777, 'iw_pca_fit': 'combined', 'iw_solver': 'lbfgs', 'iw_rho': 0.85}. Best is trial 72 with value: 0.2574547478381023.
2026-06-01 18:47:58 | INFO | Trial 76 | outer=5 | alpha=4.448e+04 n_pcs=4000 (pc_topk) weight={'name': 'pc_logistic', 'floor': 1e-06, 'clip_max': 4.0, 'prob_clip': 0.01824412110658485, 'n_components': 100, 'logistic_c': 0.0001421324037208394, 'pca_fit': 'combined', 'solver': 'lbfgs', 'max_iter': 2000, 'fit_intercept': True, 'standardize_with_source': True, 'rho': 0.85}
[I 2026-06-01 18:48:16,684] Trial 76 finished with value: 0.25734978976835876 and parameters: {'alpha': 44481.18077174496, 'n_pcs': 4000, 'iw_method': 'pc_logistic', 'iw_clip_max': 4.0, 'iw_prob_clip': 0.01824412110658485, 'iw_n_components': 100, 'iw_logistic_c': 0.0001421324037208394, 'iw_pca_fit': 'combined', 'iw_solver': 'lbfgs', 'iw_rho': 0.85}. Best is trial 72 with value: 0.2574547478381023.
2026-06-01 18:48:16 | INFO | Trial 77 | outer=5 | alpha=8.251e+04 n_pcs=4000 (pc_topk) weight={'name': 'uniform'}
[I 2026-06-01 18:48:23,592] Trial 77 finished with value: 0.2365802224462512 and parameters: {'alpha': 82509.85591427896, 'n_pcs': 4000, 'iw_method': 'uniform'}. Best is trial 72 with value: 0.2574547478381023.
2026-06-01 18:48:23 | INFO | Trial 78 | outer=5 | alpha=4.402e+04 n_pcs=3500 (pc_topk) weight={'name': 'pc_logistic', 'floor': 1e-06, 'clip_max': 4.0, 'prob_clip': 0.017762610681101323, 'n_components': 100, 'logistic_c': 0.0001528324709046499, 'pca_fit': 'combined', 'solver': 'lbfgs', 'max_iter': 2000, 'fit_intercept': True, 'standardize_with_source': True, 'rho': 0.85}
[I 2026-06-01 18:48:36,075] Trial 78 finished with value: 0.25350602464466926 and parameters: {'alpha': 44023.49429753008, 'n_pcs': 3500, 'iw_method': 'pc_logistic', 'iw_clip_max': 4.0, 'iw_prob_clip': 0.017762610681101323, 'iw_n_components': 100, 'iw_logistic_c': 0.0001528324709046499, 'iw_pca_fit': 'combined', 'iw_solver': 'lbfgs', 'iw_rho': 0.85}. Best is trial 72 with value: 0.2574547478381023.
2026-06-01 18:48:36 | INFO | Trial 79 | outer=5 | alpha=1.794e+04 n_pcs=4000 (pc_topk) weight={'name': 'pc_logistic', 'floor': 1e-06, 'clip_max': 4.0, 'prob_clip': 0.02520952586665975, 'n_components': 100, 'logistic_c': 0.0007875676117301999, 'pca_fit': 'combined', 'solver': 'lbfgs', 'max_iter': 2000, 'fit_intercept': True, 'standardize_with_source': True, 'rho': 0.85}
[I 2026-06-01 18:48:53,796] Trial 79 finished with value: 0.24945498863659527 and parameters: {'alpha': 17943.712698170162, 'n_pcs': 4000, 'iw_method': 'pc_logistic', 'iw_clip_max': 4.0, 'iw_prob_clip': 0.02520952586665975, 'iw_n_components': 100, 'iw_logistic_c': 0.0007875676117301999, 'iw_pca_fit': 'combined', 'iw_solver': 'lbfgs', 'iw_rho': 0.85}. Best is trial 72 with value: 0.2574547478381023.
2026-06-01 18:48:53 | INFO | Trial 80 | outer=5 | alpha=1.197e+03 n_pcs=3500 (pc_topk) weight={'name': 'pc_logistic', 'floor': 1e-06, 'clip_max': 4.0, 'prob_clip': 0.02194937266594096, 'n_components': 100, 'logistic_c': 5.361818718190211e-05, 'pca_fit': 'combined', 'solver': 'lbfgs', 'max_iter': 2000, 'fit_intercept': True, 'standardize_with_source': True, 'rho': 0.85}
[I 2026-06-01 18:49:06,391] Trial 80 finished with value: 0.13021365767558007 and parameters: {'alpha': 1197.132962100518, 'n_pcs': 3500, 'iw_method': 'pc_logistic', 'iw_clip_max': 4.0, 'iw_prob_clip': 0.02194937266594096, 'iw_n_components': 100, 'iw_logistic_c': 5.361818718190211e-05, 'iw_pca_fit': 'combined', 'iw_solver': 'lbfgs', 'iw_rho': 0.85}. Best is trial 72 with value: 0.2574547478381023.
2026-06-01 18:49:06 | INFO | Trial 81 | outer=5 | alpha=4.667e+04 n_pcs=3500 (pc_topk) weight={'name': 'pc_logistic', 'floor': 1e-06, 'clip_max': 4.0, 'prob_clip': 0.01785236113554946, 'n_components': 100, 'logistic_c': 0.00011760894850790011, 'pca_fit': 'combined', 'solver': 'lbfgs', 'max_iter': 2000, 'fit_intercept': True, 'standardize_with_source': True, 'rho': 0.85}
[I 2026-06-01 18:49:18,852] Trial 81 finished with value: 0.2538031584323694 and parameters: {'alpha': 46665.32858565889, 'n_pcs': 3500, 'iw_method': 'pc_logistic', 'iw_clip_max': 4.0, 'iw_prob_clip': 0.01785236113554946, 'iw_n_components': 100, 'iw_logistic_c': 0.00011760894850790011, 'iw_pca_fit': 'combined', 'iw_solver': 'lbfgs', 'iw_rho': 0.85}. Best is trial 72 with value: 0.2574547478381023.
2026-06-01 18:49:18 | INFO | Trial 82 | outer=5 | alpha=5.692e+04 n_pcs=3000 (pc_topk) weight={'name': 'pc_logistic', 'floor': 1e-06, 'clip_max': 4.0, 'prob_clip': 0.028682557447031676, 'n_components': 100, 'logistic_c': 0.0008116639465782164, 'pca_fit': 'combined', 'solver': 'lbfgs', 'max_iter': 2000, 'fit_intercept': True, 'standardize_with_source': True, 'rho': 0.85}
[I 2026-06-01 18:49:37,950] Trial 82 finished with value: 0.25351169491207315 and parameters: {'alpha': 56924.944459886916, 'n_pcs': 3000, 'iw_method': 'pc_logistic', 'iw_clip_max': 4.0, 'iw_prob_clip': 0.028682557447031676, 'iw_n_components': 100, 'iw_logistic_c': 0.0008116639465782164, 'iw_pca_fit': 'combined', 'iw_solver': 'lbfgs', 'iw_rho': 0.85}. Best is trial 72 with value: 0.2574547478381023.
2026-06-01 18:49:37 | INFO | Trial 83 | outer=5 | alpha=1.313e+05 n_pcs=3500 (pc_topk) weight={'name': 'pc_logistic', 'floor': 1e-06, 'clip_max': 4.0, 'prob_clip': 0.01364333365395769, 'n_components': 100, 'logistic_c': 2.093979256274776e-05, 'pca_fit': 'combined', 'solver': 'lbfgs', 'max_iter': 2000, 'fit_intercept': True, 'standardize_with_source': True, 'rho': 0.85}
[I 2026-06-01 18:49:48,454] Trial 83 finished with value: 0.2506538711210507 and parameters: {'alpha': 131342.4981113582, 'n_pcs': 3500, 'iw_method': 'pc_logistic', 'iw_clip_max': 4.0, 'iw_prob_clip': 0.01364333365395769, 'iw_n_components': 100, 'iw_logistic_c': 2.093979256274776e-05, 'iw_pca_fit': 'combined', 'iw_solver': 'lbfgs', 'iw_rho': 0.85}. Best is trial 72 with value: 0.2574547478381023.
2026-06-01 18:49:48 | INFO | Trial 84 | outer=5 | alpha=3.735e+04 n_pcs=4000 (pc_topk) weight={'name': 'pc_logistic', 'floor': 1e-06, 'clip_max': 4.0, 'prob_clip': 0.018146703666499064, 'n_components': 100, 'logistic_c': 0.00011511094534560807, 'pca_fit': 'combined', 'solver': 'lbfgs', 'max_iter': 2000, 'fit_intercept': True, 'standardize_with_source': True, 'rho': 0.85}
[I 2026-06-01 18:50:03,087] Trial 84 finished with value: 0.2565270227619342 and parameters: {'alpha': 37353.20600978659, 'n_pcs': 4000, 'iw_method': 'pc_logistic', 'iw_clip_max': 4.0, 'iw_prob_clip': 0.018146703666499064, 'iw_n_components': 100, 'iw_logistic_c': 0.00011511094534560807, 'iw_pca_fit': 'combined', 'iw_solver': 'lbfgs', 'iw_rho': 0.85}. Best is trial 72 with value: 0.2574547478381023.
2026-06-01 18:50:03 | INFO | Trial 85 | outer=5 | alpha=3.821e+04 n_pcs=4000 (pc_topk) weight={'name': 'pc_logistic', 'floor': 1e-06, 'clip_max': 4.0, 'prob_clip': 0.018231006277569062, 'n_components': 100, 'logistic_c': 0.00011024185932878486, 'pca_fit': 'combined', 'solver': 'lbfgs', 'max_iter': 2000, 'fit_intercept': True, 'standardize_with_source': True, 'rho': 0.85}
[I 2026-06-01 18:50:17,688] Trial 85 finished with value: 0.2566438941924327 and parameters: {'alpha': 38211.107073743486, 'n_pcs': 4000, 'iw_method': 'pc_logistic', 'iw_clip_max': 4.0, 'iw_prob_clip': 0.018231006277569062, 'iw_n_components': 100, 'iw_logistic_c': 0.00011024185932878486, 'iw_pca_fit': 'combined', 'iw_solver': 'lbfgs', 'iw_rho': 0.85}. Best is trial 72 with value: 0.2574547478381023.
2026-06-01 18:50:17 | INFO | Trial 86 | outer=5 | alpha=3.589e+04 n_pcs=4000 (pc_topk) weight={'name': 'pc_logistic', 'floor': 1e-06, 'clip_max': 4.0, 'prob_clip': 0.02284157700175209, 'n_components': 100, 'logistic_c': 0.00044300505261298564, 'pca_fit': 'combined', 'solver': 'lbfgs', 'max_iter': 2000, 'fit_intercept': True, 'standardize_with_source': True, 'rho': 0.85}
[I 2026-06-01 18:50:33,183] Trial 86 finished with value: 0.25611332652954044 and parameters: {'alpha': 35887.765695600116, 'n_pcs': 4000, 'iw_method': 'pc_logistic', 'iw_clip_max': 4.0, 'iw_prob_clip': 0.02284157700175209, 'iw_n_components': 100, 'iw_logistic_c': 0.00044300505261298564, 'iw_pca_fit': 'combined', 'iw_solver': 'lbfgs', 'iw_rho': 0.85}. Best is trial 72 with value: 0.2574547478381023.
2026-06-01 18:50:33 | INFO | Trial 87 | outer=5 | alpha=6.396e+04 n_pcs=4000 (pc_topk) weight={'name': 'pc_logistic', 'floor': 1e-06, 'clip_max': 4.0, 'prob_clip': 0.012222393114318855, 'n_components': 100, 'logistic_c': 0.00048618685280084426, 'pca_fit': 'combined', 'solver': 'lbfgs', 'max_iter': 2000, 'fit_intercept': True, 'standardize_with_source': True, 'rho': 0.85}
[I 2026-06-01 18:50:49,821] Trial 87 finished with value: 0.25588461609506996 and parameters: {'alpha': 63962.108194803455, 'n_pcs': 4000, 'iw_method': 'pc_logistic', 'iw_clip_max': 4.0, 'iw_prob_clip': 0.012222393114318855, 'iw_n_components': 100, 'iw_logistic_c': 0.00048618685280084426, 'iw_pca_fit': 'combined', 'iw_solver': 'lbfgs', 'iw_rho': 0.85}. Best is trial 72 with value: 0.2574547478381023.
2026-06-01 18:50:49 | INFO | Trial 88 | outer=5 | alpha=6.995e+04 n_pcs=4000 (pc_topk) weight={'name': 'pc_logistic', 'floor': 1e-06, 'clip_max': 4.0, 'prob_clip': 0.012127807777721211, 'n_components': 100, 'logistic_c': 0.0004913305043490575, 'pca_fit': 'combined', 'solver': 'lbfgs', 'max_iter': 2000, 'fit_intercept': True, 'standardize_with_source': True, 'rho': 0.85}
[I 2026-06-01 18:51:06,411] Trial 88 finished with value: 0.255724092044565 and parameters: {'alpha': 69945.9818995077, 'n_pcs': 4000, 'iw_method': 'pc_logistic', 'iw_clip_max': 4.0, 'iw_prob_clip': 0.012127807777721211, 'iw_n_components': 100, 'iw_logistic_c': 0.0004913305043490575, 'iw_pca_fit': 'combined', 'iw_solver': 'lbfgs', 'iw_rho': 0.85}. Best is trial 72 with value: 0.2574547478381023.
2026-06-01 18:51:06 | INFO | Trial 89 | outer=5 | alpha=7.133e+04 n_pcs=4000 (pc_topk) weight={'name': 'pc_logistic', 'floor': 1e-06, 'clip_max': 4.0, 'prob_clip': 0.011399276087081668, 'n_components': 100, 'logistic_c': 0.0005840359402476341, 'pca_fit': 'combined', 'solver': 'lbfgs', 'max_iter': 2000, 'fit_intercept': True, 'standardize_with_source': True, 'rho': 0.85}
[I 2026-06-01 18:51:22,876] Trial 89 finished with value: 0.25546697827832526 and parameters: {'alpha': 71334.45363195737, 'n_pcs': 4000, 'iw_method': 'pc_logistic', 'iw_clip_max': 4.0, 'iw_prob_clip': 0.011399276087081668, 'iw_n_components': 100, 'iw_logistic_c': 0.0005840359402476341, 'iw_pca_fit': 'combined', 'iw_solver': 'lbfgs', 'iw_rho': 0.85}. Best is trial 72 with value: 0.2574547478381023.
2026-06-01 18:51:22 | INFO | Trial 90 | outer=5 | alpha=1.008e+05 n_pcs=4000 (pc_topk) weight={'name': 'uniform'}
[I 2026-06-01 18:51:29,970] Trial 90 finished with value: 0.2342968998033149 and parameters: {'alpha': 100794.87125321457, 'n_pcs': 4000, 'iw_method': 'uniform'}. Best is trial 72 with value: 0.2574547478381023.
2026-06-01 18:51:29 | INFO | Trial 91 | outer=5 | alpha=7.221e+04 n_pcs=4000 (pc_topk) weight={'name': 'pc_logistic', 'floor': 1e-06, 'clip_max': 4.0, 'prob_clip': 0.011835515049519104, 'n_components': 100, 'logistic_c': 0.0026673225446134075, 'pca_fit': 'combined', 'solver': 'lbfgs', 'max_iter': 2000, 'fit_intercept': True, 'standardize_with_source': True, 'rho': 0.85}
[I 2026-06-01 18:52:01,161] Trial 91 finished with value: 0.25357049438552676 and parameters: {'alpha': 72208.98910902237, 'n_pcs': 4000, 'iw_method': 'pc_logistic', 'iw_clip_max': 4.0, 'iw_prob_clip': 0.011835515049519104, 'iw_n_components': 100, 'iw_logistic_c': 0.0026673225446134075, 'iw_pca_fit': 'combined', 'iw_solver': 'lbfgs', 'iw_rho': 0.85}. Best is trial 72 with value: 0.2574547478381023.
2026-06-01 18:52:01 | INFO | Trial 92 | outer=5 | alpha=6.311e+04 n_pcs=4000 (pc_topk) weight={'name': 'pc_logistic', 'floor': 1e-06, 'clip_max': 4.0, 'prob_clip': 0.013370856366395447, 'n_components': 100, 'logistic_c': 0.0005843053067255942, 'pca_fit': 'combined', 'solver': 'lbfgs', 'max_iter': 2000, 'fit_intercept': True, 'standardize_with_source': True, 'rho': 0.85}
[I 2026-06-01 18:52:22,797] Trial 92 finished with value: 0.25580130730280093 and parameters: {'alpha': 63107.44009480386, 'n_pcs': 4000, 'iw_method': 'pc_logistic', 'iw_clip_max': 4.0, 'iw_prob_clip': 0.013370856366395447, 'iw_n_components': 100, 'iw_logistic_c': 0.0005843053067255942, 'iw_pca_fit': 'combined', 'iw_solver': 'lbfgs', 'iw_rho': 0.85}. Best is trial 72 with value: 0.2574547478381023.
2026-06-01 18:52:22 | INFO | Trial 93 | outer=5 | alpha=6.172e+04 n_pcs=4000 (pc_topk) weight={'name': 'pc_logistic', 'floor': 1e-06, 'clip_max': 4.0, 'prob_clip': 0.015513291638102143, 'n_components': 100, 'logistic_c': 0.0017921680507299205, 'pca_fit': 'combined', 'solver': 'lbfgs', 'max_iter': 2000, 'fit_intercept': True, 'standardize_with_source': True, 'rho': 0.85}
