[I 2026-06-01 23:04:08,497] Trial 191 finished with value: 0.22410098220801666 and parameters: {'alpha': 44430.26928657005, 'n_pcs': 4500, 'iw_method': 'pc_logistic', 'iw_clip_max': 2.5, 'iw_prob_clip': 0.04978119685307903, 'iw_n_components': 100, 'iw_logistic_c': 5.029160106748324e-05, 'iw_pca_fit': 'combined', 'iw_solver': 'lbfgs', 'iw_rho': 0.85}. Best is trial 108 with value: 0.22594023894922968.
2026-06-01 23:04:08 | INFO | Trial 192 | outer=8 | alpha=6.067e+04 n_pcs=4500 (pc_topk) weight={'name': 'pc_logistic', 'floor': 1e-06, 'clip_max': 2.5, 'prob_clip': 0.044340613732930266, 'n_components': 100, 'logistic_c': 4.930577511414424e-05, 'pca_fit': 'combined', 'solver': 'lbfgs', 'max_iter': 2000, 'fit_intercept': True, 'standardize_with_source': True, 'rho': 0.85}
[I 2026-06-01 23:04:23,150] Trial 192 finished with value: 0.22450386386912805 and parameters: {'alpha': 60672.6331144738, 'n_pcs': 4500, 'iw_method': 'pc_logistic', 'iw_clip_max': 2.5, 'iw_prob_clip': 0.044340613732930266, 'iw_n_components': 100, 'iw_logistic_c': 4.930577511414424e-05, 'iw_pca_fit': 'combined', 'iw_solver': 'lbfgs', 'iw_rho': 0.85}. Best is trial 108 with value: 0.22594023894922968.
2026-06-01 23:04:23 | INFO | Trial 193 | outer=8 | alpha=6.196e+04 n_pcs=4500 (pc_topk) weight={'name': 'pc_logistic', 'floor': 1e-06, 'clip_max': 2.5, 'prob_clip': 0.046680897068310946, 'n_components': 100, 'logistic_c': 4.681317239353577e-05, 'pca_fit': 'combined', 'solver': 'lbfgs', 'max_iter': 2000, 'fit_intercept': True, 'standardize_with_source': True, 'rho': 0.85}
[I 2026-06-01 23:04:37,955] Trial 193 finished with value: 0.22393848705169367 and parameters: {'alpha': 61961.34701650249, 'n_pcs': 4500, 'iw_method': 'pc_logistic', 'iw_clip_max': 2.5, 'iw_prob_clip': 0.046680897068310946, 'iw_n_components': 100, 'iw_logistic_c': 4.681317239353577e-05, 'iw_pca_fit': 'combined', 'iw_solver': 'lbfgs', 'iw_rho': 0.85}. Best is trial 108 with value: 0.22594023894922968.
2026-06-01 23:04:37 | INFO | Trial 194 | outer=8 | alpha=5.861e+04 n_pcs=4500 (pc_topk) weight={'name': 'pc_logistic', 'floor': 1e-06, 'clip_max': 2.5, 'prob_clip': 0.046034760753836355, 'n_components': 100, 'logistic_c': 6.639240922853302e-05, 'pca_fit': 'combined', 'solver': 'lbfgs', 'max_iter': 2000, 'fit_intercept': True, 'standardize_with_source': True, 'rho': 0.85}
[I 2026-06-01 23:04:53,332] Trial 194 finished with value: 0.22427789666847944 and parameters: {'alpha': 58606.136037438824, 'n_pcs': 4500, 'iw_method': 'pc_logistic', 'iw_clip_max': 2.5, 'iw_prob_clip': 0.046034760753836355, 'iw_n_components': 100, 'iw_logistic_c': 6.639240922853302e-05, 'iw_pca_fit': 'combined', 'iw_solver': 'lbfgs', 'iw_rho': 0.85}. Best is trial 108 with value: 0.22594023894922968.
2026-06-01 23:04:53 | INFO | Trial 195 | outer=8 | alpha=4.801e+04 n_pcs=4500 (pc_topk) weight={'name': 'pc_logistic', 'floor': 1e-06, 'clip_max': 2.5, 'prob_clip': 0.04705908966460959, 'n_components': 100, 'logistic_c': 6.268217441946839e-05, 'pca_fit': 'combined', 'solver': 'lbfgs', 'max_iter': 2000, 'fit_intercept': True, 'standardize_with_source': True, 'rho': 0.85}
[I 2026-06-01 23:05:08,631] Trial 195 finished with value: 0.22443256171377665 and parameters: {'alpha': 48006.824868138785, 'n_pcs': 4500, 'iw_method': 'pc_logistic', 'iw_clip_max': 2.5, 'iw_prob_clip': 0.04705908966460959, 'iw_n_components': 100, 'iw_logistic_c': 6.268217441946839e-05, 'iw_pca_fit': 'combined', 'iw_solver': 'lbfgs', 'iw_rho': 0.85}. Best is trial 108 with value: 0.22594023894922968.
2026-06-01 23:05:08 | INFO | Trial 196 | outer=8 | alpha=6.431e+04 n_pcs=4000 (pc_topk) weight={'name': 'pc_logistic', 'floor': 1e-06, 'clip_max': 2.5, 'prob_clip': 0.040966489755478515, 'n_components': 100, 'logistic_c': 8.905084659510326e-05, 'pca_fit': 'combined', 'solver': 'lbfgs', 'max_iter': 2000, 'fit_intercept': True, 'standardize_with_source': True, 'rho': 0.85}
[I 2026-06-01 23:05:22,597] Trial 196 finished with value: 0.2249006798599628 and parameters: {'alpha': 64308.2813540394, 'n_pcs': 4000, 'iw_method': 'pc_logistic', 'iw_clip_max': 2.5, 'iw_prob_clip': 0.040966489755478515, 'iw_n_components': 100, 'iw_logistic_c': 8.905084659510326e-05, 'iw_pca_fit': 'combined', 'iw_solver': 'lbfgs', 'iw_rho': 0.85}. Best is trial 108 with value: 0.22594023894922968.
2026-06-01 23:05:22 | INFO | Trial 197 | outer=8 | alpha=5.789e+04 n_pcs=4000 (pc_topk) weight={'name': 'pc_logistic', 'floor': 1e-06, 'clip_max': 2.5, 'prob_clip': 0.04438399894037994, 'n_components': 100, 'logistic_c': 6.672833866556813e-05, 'pca_fit': 'combined', 'solver': 'lbfgs', 'max_iter': 2000, 'fit_intercept': True, 'standardize_with_source': True, 'rho': 0.85}
[I 2026-06-01 23:05:36,056] Trial 197 finished with value: 0.22462413262732359 and parameters: {'alpha': 57887.32386144389, 'n_pcs': 4000, 'iw_method': 'pc_logistic', 'iw_clip_max': 2.5, 'iw_prob_clip': 0.04438399894037994, 'iw_n_components': 100, 'iw_logistic_c': 6.672833866556813e-05, 'iw_pca_fit': 'combined', 'iw_solver': 'lbfgs', 'iw_rho': 0.85}. Best is trial 108 with value: 0.22594023894922968.
2026-06-01 23:05:36 | INFO | Trial 198 | outer=8 | alpha=6.055e+04 n_pcs=4000 (pc_topk) weight={'name': 'pc_logistic', 'floor': 1e-06, 'clip_max': 1.5, 'prob_clip': 0.042607202510218094, 'n_components': 100, 'logistic_c': 6.87136760479993e-05, 'pca_fit': 'combined', 'solver': 'lbfgs', 'max_iter': 2000, 'fit_intercept': True, 'standardize_with_source': True, 'rho': 0.85}
[I 2026-06-01 23:05:49,790] Trial 198 finished with value: 0.22201236455656845 and parameters: {'alpha': 60548.73119376869, 'n_pcs': 4000, 'iw_method': 'pc_logistic', 'iw_clip_max': 1.5, 'iw_prob_clip': 0.042607202510218094, 'iw_n_components': 100, 'iw_logistic_c': 6.87136760479993e-05, 'iw_pca_fit': 'combined', 'iw_solver': 'lbfgs', 'iw_rho': 0.85}. Best is trial 108 with value: 0.22594023894922968.
2026-06-01 23:05:49 | INFO | Trial 199 | outer=8 | alpha=5.091e+04 n_pcs=4000 (pc_topk) weight={'name': 'pc_logistic', 'floor': 1e-06, 'clip_max': 2.5, 'prob_clip': 0.04924083091981455, 'n_components': 100, 'logistic_c': 9.916658366680969e-05, 'pca_fit': 'combined', 'solver': 'lbfgs', 'max_iter': 2000, 'fit_intercept': True, 'standardize_with_source': True, 'rho': 0.85}
[I 2026-06-01 23:06:02,855] Trial 199 finished with value: 0.2235559581853906 and parameters: {'alpha': 50909.90794959083, 'n_pcs': 4000, 'iw_method': 'pc_logistic', 'iw_clip_max': 2.5, 'iw_prob_clip': 0.04924083091981455, 'iw_n_components': 100, 'iw_logistic_c': 9.916658366680969e-05, 'iw_pca_fit': 'combined', 'iw_solver': 'lbfgs', 'iw_rho': 0.85}. Best is trial 108 with value: 0.22594023894922968.
2026-06-01 23:06:02 | INFO | Trial 200 | outer=8 | alpha=5.959e+04 n_pcs=4000 (pc_topk) weight={'name': 'pc_logistic', 'floor': 1e-06, 'clip_max': 2.5, 'prob_clip': 0.0444013898337444, 'n_components': 100, 'logistic_c': 3.0070330323366382e-05, 'pca_fit': 'combined', 'solver': 'lbfgs', 'max_iter': 2000, 'fit_intercept': True, 'standardize_with_source': True, 'rho': 0.85}
[I 2026-06-01 23:06:15,429] Trial 200 finished with value: 0.22378592647796242 and parameters: {'alpha': 59593.45166931006, 'n_pcs': 4000, 'iw_method': 'pc_logistic', 'iw_clip_max': 2.5, 'iw_prob_clip': 0.0444013898337444, 'iw_n_components': 100, 'iw_logistic_c': 3.0070330323366382e-05, 'iw_pca_fit': 'combined', 'iw_solver': 'lbfgs', 'iw_rho': 0.85}. Best is trial 108 with value: 0.22594023894922968.
2026-06-01 23:06:15 | INFO | Trial 201 | outer=8 | alpha=8.993e+04 n_pcs=4000 (pc_topk) weight={'name': 'pc_logistic', 'floor': 1e-06, 'clip_max': 2.5, 'prob_clip': 0.04534605599384869, 'n_components': 100, 'logistic_c': 6.353321604314143e-05, 'pca_fit': 'combined', 'solver': 'lbfgs', 'max_iter': 2000, 'fit_intercept': True, 'standardize_with_source': True, 'rho': 0.85}
[I 2026-06-01 23:06:27,831] Trial 201 finished with value: 0.22318376344726984 and parameters: {'alpha': 89929.21512436359, 'n_pcs': 4000, 'iw_method': 'pc_logistic', 'iw_clip_max': 2.5, 'iw_prob_clip': 0.04534605599384869, 'iw_n_components': 100, 'iw_logistic_c': 6.353321604314143e-05, 'iw_pca_fit': 'combined', 'iw_solver': 'lbfgs', 'iw_rho': 0.85}. Best is trial 108 with value: 0.22594023894922968.
2026-06-01 23:06:27 | INFO | Trial 202 | outer=8 | alpha=6.882e+04 n_pcs=4000 (pc_topk) weight={'name': 'pc_logistic', 'floor': 1e-06, 'clip_max': 2.5, 'prob_clip': 0.03755843651527167, 'n_components': 100, 'logistic_c': 9.39287113417572e-05, 'pca_fit': 'combined', 'solver': 'lbfgs', 'max_iter': 2000, 'fit_intercept': True, 'standardize_with_source': True, 'rho': 0.85}
[I 2026-06-01 23:06:41,901] Trial 202 finished with value: 0.2253376812159086 and parameters: {'alpha': 68824.82229207692, 'n_pcs': 4000, 'iw_method': 'pc_logistic', 'iw_clip_max': 2.5, 'iw_prob_clip': 0.03755843651527167, 'iw_n_components': 100, 'iw_logistic_c': 9.39287113417572e-05, 'iw_pca_fit': 'combined', 'iw_solver': 'lbfgs', 'iw_rho': 0.85}. Best is trial 108 with value: 0.22594023894922968.
2026-06-01 23:06:41 | INFO | Trial 203 | outer=8 | alpha=6.663e+04 n_pcs=4000 (pc_topk) weight={'name': 'pc_logistic', 'floor': 1e-06, 'clip_max': 2.5, 'prob_clip': 0.03753890568009668, 'n_components': 100, 'logistic_c': 9.386421072575258e-05, 'pca_fit': 'combined', 'solver': 'lbfgs', 'max_iter': 2000, 'fit_intercept': True, 'standardize_with_source': True, 'rho': 0.85}
[I 2026-06-01 23:06:56,005] Trial 203 finished with value: 0.2253829262503278 and parameters: {'alpha': 66626.02844623421, 'n_pcs': 4000, 'iw_method': 'pc_logistic', 'iw_clip_max': 2.5, 'iw_prob_clip': 0.03753890568009668, 'iw_n_components': 100, 'iw_logistic_c': 9.386421072575258e-05, 'iw_pca_fit': 'combined', 'iw_solver': 'lbfgs', 'iw_rho': 0.85}. Best is trial 108 with value: 0.22594023894922968.
2026-06-01 23:06:56 | INFO | Trial 204 | outer=8 | alpha=5.192e+04 n_pcs=4000 (pc_topk) weight={'name': 'pc_logistic', 'floor': 1e-06, 'clip_max': 2.5, 'prob_clip': 0.03731251992368734, 'n_components': 100, 'logistic_c': 0.00011283100575708431, 'pca_fit': 'combined', 'solver': 'lbfgs', 'max_iter': 2000, 'fit_intercept': True, 'standardize_with_source': True, 'rho': 0.85}
[I 2026-06-01 23:07:10,291] Trial 204 finished with value: 0.2251262010398858 and parameters: {'alpha': 51922.34049869202, 'n_pcs': 4000, 'iw_method': 'pc_logistic', 'iw_clip_max': 2.5, 'iw_prob_clip': 0.03731251992368734, 'iw_n_components': 100, 'iw_logistic_c': 0.00011283100575708431, 'iw_pca_fit': 'combined', 'iw_solver': 'lbfgs', 'iw_rho': 0.85}. Best is trial 108 with value: 0.22594023894922968.
2026-06-01 23:07:10 | INFO | Trial 205 | outer=8 | alpha=6.575e+04 n_pcs=4000 (pc_topk) weight={'name': 'pc_logistic', 'floor': 1e-06, 'clip_max': 2.5, 'prob_clip': 0.03802615955550774, 'n_components': 100, 'logistic_c': 0.0001066081320975563, 'pca_fit': 'combined', 'solver': 'lbfgs', 'max_iter': 2000, 'fit_intercept': True, 'standardize_with_source': True, 'rho': 0.85}
[I 2026-06-01 23:07:23,139] Trial 205 finished with value: 0.22515894009641585 and parameters: {'alpha': 65754.0390810327, 'n_pcs': 4000, 'iw_method': 'pc_logistic', 'iw_clip_max': 2.5, 'iw_prob_clip': 0.03802615955550774, 'iw_n_components': 100, 'iw_logistic_c': 0.0001066081320975563, 'iw_pca_fit': 'combined', 'iw_solver': 'lbfgs', 'iw_rho': 0.85}. Best is trial 108 with value: 0.22594023894922968.
2026-06-01 23:07:23 | INFO | Trial 206 | outer=8 | alpha=6.733e+04 n_pcs=4000 (pc_topk) weight={'name': 'pc_logistic', 'floor': 1e-06, 'clip_max': 2.5, 'prob_clip': 0.03878282207987514, 'n_components': 100, 'logistic_c': 0.00011201926980495531, 'pca_fit': 'combined', 'solver': 'lbfgs', 'max_iter': 2000, 'fit_intercept': True, 'standardize_with_source': True, 'rho': 0.85}
[I 2026-06-01 23:07:35,676] Trial 206 finished with value: 0.22494070416717832 and parameters: {'alpha': 67331.3873488956, 'n_pcs': 4000, 'iw_method': 'pc_logistic', 'iw_clip_max': 2.5, 'iw_prob_clip': 0.03878282207987514, 'iw_n_components': 100, 'iw_logistic_c': 0.00011201926980495531, 'iw_pca_fit': 'combined', 'iw_solver': 'lbfgs', 'iw_rho': 0.85}. Best is trial 108 with value: 0.22594023894922968.
2026-06-01 23:07:35 | INFO | Trial 207 | outer=8 | alpha=6.898e+04 n_pcs=4000 (pc_topk) weight={'name': 'pc_logistic', 'floor': 1e-06, 'clip_max': 2.5, 'prob_clip': 0.03822364383174948, 'n_components': 100, 'logistic_c': 0.00010995784425806459, 'pca_fit': 'combined', 'solver': 'lbfgs', 'max_iter': 2000, 'fit_intercept': True, 'standardize_with_source': True, 'rho': 0.85}
[I 2026-06-01 23:07:48,556] Trial 207 finished with value: 0.22502942427565845 and parameters: {'alpha': 68977.19705506132, 'n_pcs': 4000, 'iw_method': 'pc_logistic', 'iw_clip_max': 2.5, 'iw_prob_clip': 0.03822364383174948, 'iw_n_components': 100, 'iw_logistic_c': 0.00010995784425806459, 'iw_pca_fit': 'combined', 'iw_solver': 'lbfgs', 'iw_rho': 0.85}. Best is trial 108 with value: 0.22594023894922968.
2026-06-01 23:07:48 | INFO | Trial 208 | outer=8 | alpha=6.308e+04 n_pcs=4000 (pc_topk) weight={'name': 'pc_logistic', 'floor': 1e-06, 'clip_max': 2.5, 'prob_clip': 0.03874964255057621, 'n_components': 100, 'logistic_c': 9.711608675996463e-05, 'pca_fit': 'combined', 'solver': 'lbfgs', 'max_iter': 2000, 'fit_intercept': True, 'standardize_with_source': True, 'rho': 0.85}
[I 2026-06-01 23:08:01,590] Trial 208 finished with value: 0.22519864057765088 and parameters: {'alpha': 63082.154540058174, 'n_pcs': 4000, 'iw_method': 'pc_logistic', 'iw_clip_max': 2.5, 'iw_prob_clip': 0.03874964255057621, 'iw_n_components': 100, 'iw_logistic_c': 9.711608675996463e-05, 'iw_pca_fit': 'combined', 'iw_solver': 'lbfgs', 'iw_rho': 0.85}. Best is trial 108 with value: 0.22594023894922968.
2026-06-01 23:08:01 | INFO | Trial 209 | outer=8 | alpha=6.801e+04 n_pcs=4000 (pc_topk) weight={'name': 'pc_logistic', 'floor': 1e-06, 'clip_max': 2.5, 'prob_clip': 0.03764438492856602, 'n_components': 100, 'logistic_c': 0.00011694701036718114, 'pca_fit': 'combined', 'solver': 'lbfgs', 'max_iter': 2000, 'fit_intercept': True, 'standardize_with_source': True, 'rho': 0.85}
[I 2026-06-01 23:08:16,204] Trial 209 finished with value: 0.22505831305780832 and parameters: {'alpha': 68007.87682307014, 'n_pcs': 4000, 'iw_method': 'pc_logistic', 'iw_clip_max': 2.5, 'iw_prob_clip': 0.03764438492856602, 'iw_n_components': 100, 'iw_logistic_c': 0.00011694701036718114, 'iw_pca_fit': 'combined', 'iw_solver': 'lbfgs', 'iw_rho': 0.85}. Best is trial 108 with value: 0.22594023894922968.
2026-06-01 23:08:16 | INFO | Trial 210 | outer=8 | alpha=6.466e+04 n_pcs=4000 (pc_topk) weight={'name': 'uniform'}
[I 2026-06-01 23:08:23,284] Trial 210 finished with value: 0.212693425007404 and parameters: {'alpha': 64664.22413093223, 'n_pcs': 4000, 'iw_method': 'uniform'}. Best is trial 108 with value: 0.22594023894922968.
2026-06-01 23:08:23 | INFO | Trial 211 | outer=8 | alpha=7.250e+04 n_pcs=4000 (pc_topk) weight={'name': 'pc_logistic', 'floor': 1e-06, 'clip_max': 2.5, 'prob_clip': 0.03737015190736972, 'n_components': 100, 'logistic_c': 0.00013503291374441953, 'pca_fit': 'combined', 'solver': 'lbfgs', 'max_iter': 2000, 'fit_intercept': True, 'standardize_with_source': True, 'rho': 0.85}
[I 2026-06-01 23:08:38,480] Trial 211 finished with value: 0.2247996144181533 and parameters: {'alpha': 72500.80574186094, 'n_pcs': 4000, 'iw_method': 'pc_logistic', 'iw_clip_max': 2.5, 'iw_prob_clip': 0.03737015190736972, 'iw_n_components': 100, 'iw_logistic_c': 0.00013503291374441953, 'iw_pca_fit': 'combined', 'iw_solver': 'lbfgs', 'iw_rho': 0.85}. Best is trial 108 with value: 0.22594023894922968.
2026-06-01 23:08:38 | INFO | Trial 212 | outer=8 | alpha=7.033e+04 n_pcs=4000 (pc_topk) weight={'name': 'pc_logistic', 'floor': 1e-06, 'clip_max': 2.5, 'prob_clip': 0.037073060686993606, 'n_components': 100, 'logistic_c': 9.525209046167002e-05, 'pca_fit': 'combined', 'solver': 'lbfgs', 'max_iter': 2000, 'fit_intercept': True, 'standardize_with_source': True, 'rho': 0.85}
[I 2026-06-01 23:08:52,493] Trial 212 finished with value: 0.22533616629123893 and parameters: {'alpha': 70333.54606061525, 'n_pcs': 4000, 'iw_method': 'pc_logistic', 'iw_clip_max': 2.5, 'iw_prob_clip': 0.037073060686993606, 'iw_n_components': 100, 'iw_logistic_c': 9.525209046167002e-05, 'iw_pca_fit': 'combined', 'iw_solver': 'lbfgs', 'iw_rho': 0.85}. Best is trial 108 with value: 0.22594023894922968.
2026-06-01 23:08:52 | INFO | Trial 213 | outer=8 | alpha=6.908e+04 n_pcs=4000 (pc_topk) weight={'name': 'pc_logistic', 'floor': 1e-06, 'clip_max': 2.5, 'prob_clip': 0.03979798335110713, 'n_components': 100, 'logistic_c': 0.00013033360955907436, 'pca_fit': 'combined', 'solver': 'lbfgs', 'max_iter': 2000, 'fit_intercept': True, 'standardize_with_source': True, 'rho': 0.85}
[I 2026-06-01 23:09:07,340] Trial 213 finished with value: 0.22453792276499293 and parameters: {'alpha': 69080.11119423673, 'n_pcs': 4000, 'iw_method': 'pc_logistic', 'iw_clip_max': 2.5, 'iw_prob_clip': 0.03979798335110713, 'iw_n_components': 100, 'iw_logistic_c': 0.00013033360955907436, 'iw_pca_fit': 'combined', 'iw_solver': 'lbfgs', 'iw_rho': 0.85}. Best is trial 108 with value: 0.22594023894922968.
2026-06-01 23:09:07 | INFO | Trial 214 | outer=8 | alpha=7.206e+04 n_pcs=4000 (pc_topk) weight={'name': 'pc_logistic', 'floor': 1e-06, 'clip_max': 2.5, 'prob_clip': 0.037405822321498694, 'n_components': 100, 'logistic_c': 0.0001122991793849605, 'pca_fit': 'combined', 'solver': 'lbfgs', 'max_iter': 2000, 'fit_intercept': True, 'standardize_with_source': True, 'rho': 0.85}
[I 2026-06-01 23:09:21,748] Trial 214 finished with value: 0.2250566619171694 and parameters: {'alpha': 72059.78109663683, 'n_pcs': 4000, 'iw_method': 'pc_logistic', 'iw_clip_max': 2.5, 'iw_prob_clip': 0.037405822321498694, 'iw_n_components': 100, 'iw_logistic_c': 0.0001122991793849605, 'iw_pca_fit': 'combined', 'iw_solver': 'lbfgs', 'iw_rho': 0.85}. Best is trial 108 with value: 0.22594023894922968.
2026-06-01 23:09:21 | INFO | Trial 215 | outer=8 | alpha=6.916e+04 n_pcs=4000 (pc_topk) weight={'name': 'pc_logistic', 'floor': 1e-06, 'clip_max': 2.5, 'prob_clip': 0.03771101762746868, 'n_components': 100, 'logistic_c': 0.00011853229445464161, 'pca_fit': 'combined', 'solver': 'lbfgs', 'max_iter': 2000, 'fit_intercept': True, 'standardize_with_source': True, 'rho': 0.85}
[I 2026-06-01 23:09:35,920] Trial 215 finished with value: 0.22501591624876044 and parameters: {'alpha': 69159.25518322561, 'n_pcs': 4000, 'iw_method': 'pc_logistic', 'iw_clip_max': 2.5, 'iw_prob_clip': 0.03771101762746868, 'iw_n_components': 100, 'iw_logistic_c': 0.00011853229445464161, 'iw_pca_fit': 'combined', 'iw_solver': 'lbfgs', 'iw_rho': 0.85}. Best is trial 108 with value: 0.22594023894922968.
2026-06-01 23:09:35 | INFO | Trial 216 | outer=8 | alpha=7.784e+04 n_pcs=4000 (pc_topk) weight={'name': 'pc_logistic', 'floor': 1e-06, 'clip_max': 2.5, 'prob_clip': 0.036980126754422214, 'n_components': 100, 'logistic_c': 0.00010934712836598667, 'pca_fit': 'combined', 'solver': 'lbfgs', 'max_iter': 2000, 'fit_intercept': True, 'standardize_with_source': True, 'rho': 0.85}
[I 2026-06-01 23:09:48,673] Trial 216 finished with value: 0.22497617857166624 and parameters: {'alpha': 77836.38980238736, 'n_pcs': 4000, 'iw_method': 'pc_logistic', 'iw_clip_max': 2.5, 'iw_prob_clip': 0.036980126754422214, 'iw_n_components': 100, 'iw_logistic_c': 0.00010934712836598667, 'iw_pca_fit': 'combined', 'iw_solver': 'lbfgs', 'iw_rho': 0.85}. Best is trial 108 with value: 0.22594023894922968.
2026-06-01 23:09:48 | INFO | Trial 217 | outer=8 | alpha=7.639e+04 n_pcs=4000 (pc_topk) weight={'name': 'pc_logistic', 'floor': 1e-06, 'clip_max': 2.5, 'prob_clip': 0.03703773724872274, 'n_components': 100, 'logistic_c': 0.00011530030798206305, 'pca_fit': 'combined', 'solver': 'lbfgs', 'max_iter': 2000, 'fit_intercept': True, 'standardize_with_source': True, 'rho': 0.85}
[I 2026-06-01 23:10:02,212] Trial 217 finished with value: 0.22495254188465147 and parameters: {'alpha': 76388.17034230584, 'n_pcs': 4000, 'iw_method': 'pc_logistic', 'iw_clip_max': 2.5, 'iw_prob_clip': 0.03703773724872274, 'iw_n_components': 100, 'iw_logistic_c': 0.00011530030798206305, 'iw_pca_fit': 'combined', 'iw_solver': 'lbfgs', 'iw_rho': 0.85}. Best is trial 108 with value: 0.22594023894922968.
2026-06-01 23:10:02 | INFO | Trial 218 | outer=8 | alpha=1.012e+05 n_pcs=4000 (pc_topk) weight={'name': 'pc_logistic', 'floor': 1e-06, 'clip_max': 2.5, 'prob_clip': 0.03836041890622894, 'n_components': 20, 'logistic_c': 0.00019662639492537892, 'pca_fit': 'combined', 'solver': 'lbfgs', 'max_iter': 2000, 'fit_intercept': True, 'standardize_with_source': True, 'rho': 0.85}
[I 2026-06-01 23:10:17,225] Trial 218 finished with value: 0.22060514266922096 and parameters: {'alpha': 101196.58750269812, 'n_pcs': 4000, 'iw_method': 'pc_logistic', 'iw_clip_max': 2.5, 'iw_prob_clip': 0.03836041890622894, 'iw_n_components': 20, 'iw_logistic_c': 0.00019662639492537892, 'iw_pca_fit': 'combined', 'iw_solver': 'lbfgs', 'iw_rho': 0.85}. Best is trial 108 with value: 0.22594023894922968.
2026-06-01 23:10:17 | INFO | Trial 219 | outer=8 | alpha=7.283e+04 n_pcs=4000 (pc_topk) weight={'name': 'pc_logistic', 'floor': 1e-06, 'clip_max': 2.5, 'prob_clip': 0.03624040079625726, 'n_components': 100, 'logistic_c': 0.0001280504965278816, 'pca_fit': 'combined', 'solver': 'lbfgs', 'max_iter': 2000, 'fit_intercept': True, 'standardize_with_source': True, 'rho': 0.85}
