[I 2026-06-01 18:52:41,728] Trial 93 finished with value: 0.25511702818872484 and parameters: {'alpha': 61721.24983024407, 'n_pcs': 4000, 'iw_method': 'pc_logistic', 'iw_clip_max': 4.0, 'iw_prob_clip': 0.015513291638102143, 'iw_n_components': 100, 'iw_logistic_c': 0.0017921680507299205, 'iw_pca_fit': 'combined', 'iw_solver': 'lbfgs', 'iw_rho': 0.85}. Best is trial 72 with value: 0.2574547478381023.
2026-06-01 18:52:41 | INFO | Trial 94 | outer=5 | alpha=3.604e+04 n_pcs=4000 (pc_topk) weight={'name': 'pc_logistic', 'floor': 1e-06, 'clip_max': 4.0, 'prob_clip': 0.0097316174049802, 'n_components': 100, 'logistic_c': 0.00032022766030894047, 'pca_fit': 'combined', 'solver': 'lbfgs', 'max_iter': 2000, 'fit_intercept': True, 'standardize_with_source': True, 'rho': 0.85}
[I 2026-06-01 18:52:57,520] Trial 94 finished with value: 0.2539525516203004 and parameters: {'alpha': 36041.78539967706, 'n_pcs': 4000, 'iw_method': 'pc_logistic', 'iw_clip_max': 4.0, 'iw_prob_clip': 0.0097316174049802, 'iw_n_components': 100, 'iw_logistic_c': 0.00032022766030894047, 'iw_pca_fit': 'combined', 'iw_solver': 'lbfgs', 'iw_rho': 0.85}. Best is trial 72 with value: 0.2574547478381023.
2026-06-01 18:52:57 | INFO | Trial 95 | outer=5 | alpha=1.679e+05 n_pcs=4000 (pc_topk) weight={'name': 'pc_logistic', 'floor': 1e-06, 'clip_max': 1.5, 'prob_clip': 0.013117385237150458, 'n_components': 100, 'logistic_c': 0.0005117517183636351, 'pca_fit': 'combined', 'solver': 'lbfgs', 'max_iter': 2000, 'fit_intercept': True, 'standardize_with_source': True, 'rho': 0.85}
[I 2026-06-01 18:53:13,035] Trial 95 finished with value: 0.2414691532846492 and parameters: {'alpha': 167922.67518577262, 'n_pcs': 4000, 'iw_method': 'pc_logistic', 'iw_clip_max': 1.5, 'iw_prob_clip': 0.013117385237150458, 'iw_n_components': 100, 'iw_logistic_c': 0.0005117517183636351, 'iw_pca_fit': 'combined', 'iw_solver': 'lbfgs', 'iw_rho': 0.85}. Best is trial 72 with value: 0.2574547478381023.
2026-06-01 18:53:13 | INFO | Trial 96 | outer=5 | alpha=9.068e+04 n_pcs=4000 (pc_topk) weight={'name': 'pc_logistic', 'floor': 1e-06, 'clip_max': 4.0, 'prob_clip': 0.019955259189172698, 'n_components': 100, 'logistic_c': 7.259862821150778e-05, 'pca_fit': 'combined', 'solver': 'lbfgs', 'max_iter': 2000, 'fit_intercept': True, 'standardize_with_source': True, 'rho': 0.85}
[I 2026-06-01 18:53:36,643] Trial 96 finished with value: 0.2566316014282187 and parameters: {'alpha': 90675.60074039096, 'n_pcs': 4000, 'iw_method': 'pc_logistic', 'iw_clip_max': 4.0, 'iw_prob_clip': 0.019955259189172698, 'iw_n_components': 100, 'iw_logistic_c': 7.259862821150778e-05, 'iw_pca_fit': 'combined', 'iw_solver': 'lbfgs', 'iw_rho': 0.85}. Best is trial 72 with value: 0.2574547478381023.
2026-06-01 18:53:36 | INFO | Trial 97 | outer=5 | alpha=8.994e+04 n_pcs=3500 (pc_topk) weight={'name': 'pc_logistic', 'floor': 1e-06, 'clip_max': 2.5, 'prob_clip': 0.019156931543947205, 'n_components': 100, 'logistic_c': 6.419371479299499e-05, 'pca_fit': 'combined', 'solver': 'lbfgs', 'max_iter': 2000, 'fit_intercept': True, 'standardize_with_source': True, 'rho': 1.0}
[I 2026-06-01 18:53:47,546] Trial 97 finished with value: 0.25443264966461837 and parameters: {'alpha': 89937.37602561164, 'n_pcs': 3500, 'iw_method': 'pc_logistic', 'iw_clip_max': 2.5, 'iw_prob_clip': 0.019156931543947205, 'iw_n_components': 100, 'iw_logistic_c': 6.419371479299499e-05, 'iw_pca_fit': 'combined', 'iw_solver': 'lbfgs', 'iw_rho': 1.0}. Best is trial 72 with value: 0.2574547478381023.
2026-06-01 18:53:47 | INFO | Trial 98 | outer=5 | alpha=3.551e+04 n_pcs=4000 (pc_topk) weight={'name': 'pc_logistic', 'floor': 1e-06, 'clip_max': 4.0, 'prob_clip': 0.022235936657417014, 'n_components': 10, 'logistic_c': 0.0001083761023286571, 'pca_fit': 'combined', 'solver': 'lbfgs', 'max_iter': 2000, 'fit_intercept': True, 'standardize_with_source': True, 'rho': 0.85}
[I 2026-06-01 18:54:00,593] Trial 98 finished with value: 0.2503843710898834 and parameters: {'alpha': 35505.70942681637, 'n_pcs': 4000, 'iw_method': 'pc_logistic', 'iw_clip_max': 4.0, 'iw_prob_clip': 0.022235936657417014, 'iw_n_components': 10, 'iw_logistic_c': 0.0001083761023286571, 'iw_pca_fit': 'combined', 'iw_solver': 'lbfgs', 'iw_rho': 0.85}. Best is trial 72 with value: 0.2574547478381023.
2026-06-01 18:54:00 | INFO | Trial 99 | outer=5 | alpha=1.345e+05 n_pcs=3500 (pc_topk) weight={'name': 'pc_logistic', 'floor': 1e-06, 'clip_max': 4.0, 'prob_clip': 0.01642918826159364, 'n_components': 100, 'logistic_c': 0.0011127392340484455, 'pca_fit': 'combined', 'solver': 'lbfgs', 'max_iter': 2000, 'fit_intercept': True, 'standardize_with_source': True, 'rho': 0.85}
[I 2026-06-01 18:54:16,861] Trial 99 finished with value: 0.25014472491244133 and parameters: {'alpha': 134538.830103158, 'n_pcs': 3500, 'iw_method': 'pc_logistic', 'iw_clip_max': 4.0, 'iw_prob_clip': 0.01642918826159364, 'iw_n_components': 100, 'iw_logistic_c': 0.0011127392340484455, 'iw_pca_fit': 'combined', 'iw_solver': 'lbfgs', 'iw_rho': 0.85}. Best is trial 72 with value: 0.2574547478381023.
2026-06-01 18:54:16 | INFO | Trial 100 | outer=5 | alpha=3.248e+05 n_pcs=4000 (pc_topk) weight={'name': 'pc_logistic', 'floor': 1e-06, 'clip_max': 4.0, 'prob_clip': 0.02007502615037725, 'n_components': 100, 'logistic_c': 0.005131642651266471, 'pca_fit': 'combined', 'solver': 'lbfgs', 'max_iter': 2000, 'fit_intercept': True, 'standardize_with_source': True, 'rho': 0.85}
[I 2026-06-01 18:54:42,868] Trial 100 finished with value: 0.24399187430645292 and parameters: {'alpha': 324759.1249450467, 'n_pcs': 4000, 'iw_method': 'pc_logistic', 'iw_clip_max': 4.0, 'iw_prob_clip': 0.02007502615037725, 'iw_n_components': 100, 'iw_logistic_c': 0.005131642651266471, 'iw_pca_fit': 'combined', 'iw_solver': 'lbfgs', 'iw_rho': 0.85}. Best is trial 72 with value: 0.2574547478381023.
2026-06-01 18:54:42 | INFO | Trial 101 | outer=5 | alpha=6.306e+04 n_pcs=4000 (pc_topk) weight={'name': 'pc_logistic', 'floor': 1e-06, 'clip_max': 4.0, 'prob_clip': 0.013901523474445107, 'n_components': 100, 'logistic_c': 0.0004762825511084083, 'pca_fit': 'combined', 'solver': 'lbfgs', 'max_iter': 2000, 'fit_intercept': True, 'standardize_with_source': True, 'rho': 0.85}
[I 2026-06-01 18:54:59,058] Trial 101 finished with value: 0.2560685966751587 and parameters: {'alpha': 63061.27535122053, 'n_pcs': 4000, 'iw_method': 'pc_logistic', 'iw_clip_max': 4.0, 'iw_prob_clip': 0.013901523474445107, 'iw_n_components': 100, 'iw_logistic_c': 0.0004762825511084083, 'iw_pca_fit': 'combined', 'iw_solver': 'lbfgs', 'iw_rho': 0.85}. Best is trial 72 with value: 0.2574547478381023.
2026-06-01 18:54:59 | INFO | Trial 102 | outer=5 | alpha=5.798e+04 n_pcs=4000 (pc_topk) weight={'name': 'pc_logistic', 'floor': 1e-06, 'clip_max': 4.0, 'prob_clip': 0.023266191820477202, 'n_components': 100, 'logistic_c': 0.0002616420896026228, 'pca_fit': 'combined', 'solver': 'lbfgs', 'max_iter': 2000, 'fit_intercept': True, 'standardize_with_source': True, 'rho': 0.85}
[I 2026-06-01 18:55:14,689] Trial 102 finished with value: 0.2573357982531671 and parameters: {'alpha': 57983.03166245002, 'n_pcs': 4000, 'iw_method': 'pc_logistic', 'iw_clip_max': 4.0, 'iw_prob_clip': 0.023266191820477202, 'iw_n_components': 100, 'iw_logistic_c': 0.0002616420896026228, 'iw_pca_fit': 'combined', 'iw_solver': 'lbfgs', 'iw_rho': 0.85}. Best is trial 72 with value: 0.2574547478381023.
2026-06-01 18:55:14 | INFO | Trial 103 | outer=5 | alpha=1.109e+05 n_pcs=4000 (pc_topk) weight={'name': 'pc_logistic', 'floor': 1e-06, 'clip_max': 4.0, 'prob_clip': 0.023331793585522776, 'n_components': 100, 'logistic_c': 0.00021530732086968892, 'pca_fit': 'combined', 'solver': 'lbfgs', 'max_iter': 2000, 'fit_intercept': True, 'standardize_with_source': True, 'rho': 0.85}
[I 2026-06-01 18:55:29,632] Trial 103 finished with value: 0.2546598516827433 and parameters: {'alpha': 110857.0544196818, 'n_pcs': 4000, 'iw_method': 'pc_logistic', 'iw_clip_max': 4.0, 'iw_prob_clip': 0.023331793585522776, 'iw_n_components': 100, 'iw_logistic_c': 0.00021530732086968892, 'iw_pca_fit': 'combined', 'iw_solver': 'lbfgs', 'iw_rho': 0.85}. Best is trial 72 with value: 0.2574547478381023.
2026-06-01 18:55:29 | INFO | Trial 104 | outer=5 | alpha=2.297e+05 n_pcs=3500 (pc_topk) weight={'name': 'pc_logistic', 'floor': 1e-06, 'clip_max': 4.0, 'prob_clip': 0.028568705177933824, 'n_components': 100, 'logistic_c': 9.707555405015312e-05, 'pca_fit': 'combined', 'solver': 'lbfgs', 'max_iter': 2000, 'fit_intercept': True, 'standardize_with_source': True, 'rho': 0.85}
[I 2026-06-01 18:55:42,353] Trial 104 finished with value: 0.24694981890058637 and parameters: {'alpha': 229741.37804964712, 'n_pcs': 3500, 'iw_method': 'pc_logistic', 'iw_clip_max': 4.0, 'iw_prob_clip': 0.028568705177933824, 'iw_n_components': 100, 'iw_logistic_c': 9.707555405015312e-05, 'iw_pca_fit': 'combined', 'iw_solver': 'lbfgs', 'iw_rho': 0.85}. Best is trial 72 with value: 0.2574547478381023.
2026-06-01 18:55:42 | INFO | Trial 105 | outer=5 | alpha=5.346e+04 n_pcs=4000 (pc_topk) weight={'name': 'pc_logistic', 'floor': 1e-06, 'clip_max': 4.0, 'prob_clip': 0.01879063793213427, 'n_components': 100, 'logistic_c': 5.925364798532582e-05, 'pca_fit': 'combined', 'solver': 'lbfgs', 'max_iter': 2000, 'fit_intercept': True, 'standardize_with_source': True, 'rho': 0.85}
[I 2026-06-01 18:55:55,421] Trial 105 finished with value: 0.2576898995269994 and parameters: {'alpha': 53456.81112076476, 'n_pcs': 4000, 'iw_method': 'pc_logistic', 'iw_clip_max': 4.0, 'iw_prob_clip': 0.01879063793213427, 'iw_n_components': 100, 'iw_logistic_c': 5.925364798532582e-05, 'iw_pca_fit': 'combined', 'iw_solver': 'lbfgs', 'iw_rho': 0.85}. Best is trial 105 with value: 0.2576898995269994.
2026-06-01 18:55:55 | INFO | Trial 106 | outer=5 | alpha=3.097e+04 n_pcs=4500 (pc_topk) weight={'name': 'pc_logistic', 'floor': 1e-06, 'clip_max': 4.0, 'prob_clip': 0.018613259670109086, 'n_components': 20, 'logistic_c': 0.00029789503485661776, 'pca_fit': 'combined', 'solver': 'lbfgs', 'max_iter': 2000, 'fit_intercept': True, 'standardize_with_source': True, 'rho': 0.85}
[I 2026-06-01 18:56:11,646] Trial 106 finished with value: 0.2525321744729786 and parameters: {'alpha': 30967.43991234218, 'n_pcs': 4500, 'iw_method': 'pc_logistic', 'iw_clip_max': 4.0, 'iw_prob_clip': 0.018613259670109086, 'iw_n_components': 20, 'iw_logistic_c': 0.00029789503485661776, 'iw_pca_fit': 'combined', 'iw_solver': 'lbfgs', 'iw_rho': 0.85}. Best is trial 105 with value: 0.2576898995269994.
2026-06-01 18:56:11 | INFO | Trial 107 | outer=5 | alpha=5.396e+04 n_pcs=4000 (pc_topk) weight={'name': 'pc_logistic', 'floor': 1e-06, 'clip_max': 4.0, 'prob_clip': 0.016365486982291025, 'n_components': 100, 'logistic_c': 5.8089726062339014e-05, 'pca_fit': 'combined', 'solver': 'lbfgs', 'max_iter': 2000, 'fit_intercept': True, 'standardize_with_source': True, 'rho': 0.85}
[I 2026-06-01 18:56:25,326] Trial 107 finished with value: 0.2571390080391348 and parameters: {'alpha': 53962.05051189189, 'n_pcs': 4000, 'iw_method': 'pc_logistic', 'iw_clip_max': 4.0, 'iw_prob_clip': 0.016365486982291025, 'iw_n_components': 100, 'iw_logistic_c': 5.8089726062339014e-05, 'iw_pca_fit': 'combined', 'iw_solver': 'lbfgs', 'iw_rho': 0.85}. Best is trial 105 with value: 0.2576898995269994.
2026-06-01 18:56:25 | INFO | Trial 108 | outer=5 | alpha=2.378e+04 n_pcs=4000 (pc_topk) weight={'name': 'pc_logistic', 'floor': 1e-06, 'clip_max': 12.0, 'prob_clip': 0.029946021914412698, 'n_components': 100, 'logistic_c': 5.392531422027989e-05, 'pca_fit': 'combined', 'solver': 'lbfgs', 'max_iter': 2000, 'fit_intercept': True, 'standardize_with_source': True, 'rho': 1.0}
[I 2026-06-01 18:56:38,705] Trial 108 finished with value: 0.2534027180886638 and parameters: {'alpha': 23780.721521765776, 'n_pcs': 4000, 'iw_method': 'pc_logistic', 'iw_clip_max': 12.0, 'iw_prob_clip': 0.029946021914412698, 'iw_n_components': 100, 'iw_logistic_c': 5.392531422027989e-05, 'iw_pca_fit': 'combined', 'iw_solver': 'lbfgs', 'iw_rho': 1.0}. Best is trial 105 with value: 0.2576898995269994.
2026-06-01 18:56:38 | INFO | Trial 109 | outer=5 | alpha=5.311e+04 n_pcs=4500 (pc_topk) weight={'name': 'uniform'}
[I 2026-06-01 18:56:47,389] Trial 109 finished with value: 0.2405790975412024 and parameters: {'alpha': 53110.2649963172, 'n_pcs': 4500, 'iw_method': 'uniform'}. Best is trial 105 with value: 0.2576898995269994.
2026-06-01 18:56:47 | INFO | Trial 110 | outer=5 | alpha=3.719e+04 n_pcs=3500 (pc_topk) weight={'name': 'pc_logistic', 'floor': 1e-06, 'clip_max': 4.0, 'prob_clip': 0.016523581650946344, 'n_components': 100, 'logistic_c': 2.0606615777712226e-05, 'pca_fit': 'combined', 'solver': 'lbfgs', 'max_iter': 2000, 'fit_intercept': True, 'standardize_with_source': True, 'rho': 0.85}
[I 2026-06-01 18:56:58,787] Trial 110 finished with value: 0.2514994013966027 and parameters: {'alpha': 37189.608090036454, 'n_pcs': 3500, 'iw_method': 'pc_logistic', 'iw_clip_max': 4.0, 'iw_prob_clip': 0.016523581650946344, 'iw_n_components': 100, 'iw_logistic_c': 2.0606615777712226e-05, 'iw_pca_fit': 'combined', 'iw_solver': 'lbfgs', 'iw_rho': 0.85}. Best is trial 105 with value: 0.2576898995269994.
2026-06-01 18:56:58 | INFO | Trial 111 | outer=5 | alpha=8.511e+04 n_pcs=4000 (pc_topk) weight={'name': 'pc_logistic', 'floor': 1e-06, 'clip_max': 4.0, 'prob_clip': 0.02077214326162263, 'n_components': 100, 'logistic_c': 0.0001418277476615829, 'pca_fit': 'combined', 'solver': 'lbfgs', 'max_iter': 2000, 'fit_intercept': True, 'standardize_with_source': True, 'rho': 0.85}
[I 2026-06-01 18:57:13,554] Trial 111 finished with value: 0.2567096454069652 and parameters: {'alpha': 85105.21222139287, 'n_pcs': 4000, 'iw_method': 'pc_logistic', 'iw_clip_max': 4.0, 'iw_prob_clip': 0.02077214326162263, 'iw_n_components': 100, 'iw_logistic_c': 0.0001418277476615829, 'iw_pca_fit': 'combined', 'iw_solver': 'lbfgs', 'iw_rho': 0.85}. Best is trial 105 with value: 0.2576898995269994.
2026-06-01 18:57:13 | INFO | Trial 112 | outer=5 | alpha=4.028e+04 n_pcs=4000 (pc_topk) weight={'name': 'pc_logistic', 'floor': 1e-06, 'clip_max': 4.0, 'prob_clip': 0.023973335909396296, 'n_components': 100, 'logistic_c': 0.0001301860517398983, 'pca_fit': 'combined', 'solver': 'lbfgs', 'max_iter': 2000, 'fit_intercept': True, 'standardize_with_source': True, 'rho': 0.85}
[I 2026-06-01 18:57:27,623] Trial 112 finished with value: 0.25746952285884583 and parameters: {'alpha': 40276.7247024473, 'n_pcs': 4000, 'iw_method': 'pc_logistic', 'iw_clip_max': 4.0, 'iw_prob_clip': 0.023973335909396296, 'iw_n_components': 100, 'iw_logistic_c': 0.0001301860517398983, 'iw_pca_fit': 'combined', 'iw_solver': 'lbfgs', 'iw_rho': 0.85}. Best is trial 105 with value: 0.2576898995269994.
2026-06-01 18:57:27 | INFO | Trial 113 | outer=5 | alpha=8.782e+04 n_pcs=4000 (pc_topk) weight={'name': 'pc_logistic', 'floor': 1e-06, 'clip_max': 4.0, 'prob_clip': 0.016928060465945294, 'n_components': 100, 'logistic_c': 0.0001273670822892683, 'pca_fit': 'combined', 'solver': 'lbfgs', 'max_iter': 2000, 'fit_intercept': True, 'standardize_with_source': True, 'rho': 0.85}
[I 2026-06-01 18:57:41,960] Trial 113 finished with value: 0.25667955208269067 and parameters: {'alpha': 87820.88612947117, 'n_pcs': 4000, 'iw_method': 'pc_logistic', 'iw_clip_max': 4.0, 'iw_prob_clip': 0.016928060465945294, 'iw_n_components': 100, 'iw_logistic_c': 0.0001273670822892683, 'iw_pca_fit': 'combined', 'iw_solver': 'lbfgs', 'iw_rho': 0.85}. Best is trial 105 with value: 0.2576898995269994.
2026-06-01 18:57:41 | INFO | Trial 114 | outer=5 | alpha=8.776e+04 n_pcs=4000 (pc_topk) weight={'name': 'pc_logistic', 'floor': 1e-06, 'clip_max': 4.0, 'prob_clip': 0.01997054676472371, 'n_components': 100, 'logistic_c': 0.00011675730415321647, 'pca_fit': 'combined', 'solver': 'lbfgs', 'max_iter': 2000, 'fit_intercept': True, 'standardize_with_source': True, 'rho': 0.85}
[I 2026-06-01 18:57:55,762] Trial 114 finished with value: 0.256766115680786 and parameters: {'alpha': 87757.61322338704, 'n_pcs': 4000, 'iw_method': 'pc_logistic', 'iw_clip_max': 4.0, 'iw_prob_clip': 0.01997054676472371, 'iw_n_components': 100, 'iw_logistic_c': 0.00011675730415321647, 'iw_pca_fit': 'combined', 'iw_solver': 'lbfgs', 'iw_rho': 0.85}. Best is trial 105 with value: 0.2576898995269994.
2026-06-01 18:57:55 | INFO | Trial 115 | outer=5 | alpha=8.647e+04 n_pcs=4500 (pc_topk) weight={'name': 'pc_logistic', 'floor': 1e-06, 'clip_max': 4.0, 'prob_clip': 0.020704520614725653, 'n_components': 100, 'logistic_c': 7.237678977447359e-05, 'pca_fit': 'combined', 'solver': 'lbfgs', 'max_iter': 2000, 'fit_intercept': True, 'standardize_with_source': True, 'rho': 0.85}
[I 2026-06-01 18:58:11,140] Trial 115 finished with value: 0.2564152330339906 and parameters: {'alpha': 86472.42155399585, 'n_pcs': 4500, 'iw_method': 'pc_logistic', 'iw_clip_max': 4.0, 'iw_prob_clip': 0.020704520614725653, 'iw_n_components': 100, 'iw_logistic_c': 7.237678977447359e-05, 'iw_pca_fit': 'combined', 'iw_solver': 'lbfgs', 'iw_rho': 0.85}. Best is trial 105 with value: 0.2576898995269994.
2026-06-01 18:58:11 | INFO | Trial 116 | outer=5 | alpha=1.171e+05 n_pcs=3500 (pc_topk) weight={'name': 'pc_logistic', 'floor': 1e-06, 'clip_max': 4.0, 'prob_clip': 0.01569726782682808, 'n_components': 100, 'logistic_c': 0.00016635732073811758, 'pca_fit': 'combined', 'solver': 'lbfgs', 'max_iter': 2000, 'fit_intercept': True, 'standardize_with_source': True, 'rho': 0.85}
[I 2026-06-01 18:58:24,713] Trial 116 finished with value: 0.2535346659821913 and parameters: {'alpha': 117141.9276650138, 'n_pcs': 3500, 'iw_method': 'pc_logistic', 'iw_clip_max': 4.0, 'iw_prob_clip': 0.01569726782682808, 'iw_n_components': 100, 'iw_logistic_c': 0.00016635732073811758, 'iw_pca_fit': 'combined', 'iw_solver': 'lbfgs', 'iw_rho': 0.85}. Best is trial 105 with value: 0.2576898995269994.
2026-06-01 18:58:24 | INFO | Trial 117 | outer=5 | alpha=1.522e+05 n_pcs=500 (pc_topk) weight={'name': 'pc_logistic', 'floor': 1e-06, 'clip_max': 1.5, 'prob_clip': 0.02432513639032526, 'n_components': 100, 'logistic_c': 2.86699953495289e-05, 'pca_fit': 'combined', 'solver': 'lbfgs', 'max_iter': 2000, 'fit_intercept': True, 'standardize_with_source': True, 'rho': 0.85}
[I 2026-06-01 18:58:30,919] Trial 117 finished with value: 0.19612769082095757 and parameters: {'alpha': 152151.25018693524, 'n_pcs': 500, 'iw_method': 'pc_logistic', 'iw_clip_max': 1.5, 'iw_prob_clip': 0.02432513639032526, 'iw_n_components': 100, 'iw_logistic_c': 2.86699953495289e-05, 'iw_pca_fit': 'combined', 'iw_solver': 'lbfgs', 'iw_rho': 0.85}. Best is trial 105 with value: 0.2576898995269994.
2026-06-01 18:58:30 | INFO | Trial 118 | outer=5 | alpha=2.263e+05 n_pcs=4000 (pc_topk) weight={'name': 'pc_logistic', 'floor': 1e-06, 'clip_max': 4.0, 'prob_clip': 0.02013917197675131, 'n_components': 10, 'logistic_c': 6.873094470824802e-05, 'pca_fit': 'combined', 'solver': 'lbfgs', 'max_iter': 2000, 'fit_intercept': True, 'standardize_with_source': True, 'rho': 0.85}
[I 2026-06-01 18:58:43,438] Trial 118 finished with value: 0.24556468981401774 and parameters: {'alpha': 226326.28636684464, 'n_pcs': 4000, 'iw_method': 'pc_logistic', 'iw_clip_max': 4.0, 'iw_prob_clip': 0.02013917197675131, 'iw_n_components': 10, 'iw_logistic_c': 6.873094470824802e-05, 'iw_pca_fit': 'combined', 'iw_solver': 'lbfgs', 'iw_rho': 0.85}. Best is trial 105 with value: 0.2576898995269994.
2026-06-01 18:58:43 | INFO | Trial 119 | outer=5 | alpha=5.145e+04 n_pcs=2500 (pc_topk) weight={'name': 'pc_logistic', 'floor': 1e-06, 'clip_max': 2.5, 'prob_clip': 0.041152488464730644, 'n_components': 100, 'logistic_c': 1.171326183524349e-05, 'pca_fit': 'combined', 'solver': 'lbfgs', 'max_iter': 2000, 'fit_intercept': True, 'standardize_with_source': True, 'rho': 0.85}
[I 2026-06-01 18:58:52,645] Trial 119 finished with value: 0.24932931118612672 and parameters: {'alpha': 51446.594114192565, 'n_pcs': 2500, 'iw_method': 'pc_logistic', 'iw_clip_max': 2.5, 'iw_prob_clip': 0.041152488464730644, 'iw_n_components': 100, 'iw_logistic_c': 1.171326183524349e-05, 'iw_pca_fit': 'combined', 'iw_solver': 'lbfgs', 'iw_rho': 0.85}. Best is trial 105 with value: 0.2576898995269994.
2026-06-01 18:58:52 | INFO | Trial 120 | outer=5 | alpha=9.668e+04 n_pcs=4500 (pc_topk) weight={'name': 'pc_logistic', 'floor': 1e-06, 'clip_max': 4.0, 'prob_clip': 0.026811883959134458, 'n_components': 100, 'logistic_c': 0.00013755650509013483, 'pca_fit': 'combined', 'solver': 'lbfgs', 'max_iter': 2000, 'fit_intercept': True, 'standardize_with_source': True, 'rho': 0.85}
[I 2026-06-01 18:59:08,844] Trial 120 finished with value: 0.2547487460895595 and parameters: {'alpha': 96678.15142031705, 'n_pcs': 4500, 'iw_method': 'pc_logistic', 'iw_clip_max': 4.0, 'iw_prob_clip': 0.026811883959134458, 'iw_n_components': 100, 'iw_logistic_c': 0.00013755650509013483, 'iw_pca_fit': 'combined', 'iw_solver': 'lbfgs', 'iw_rho': 0.85}. Best is trial 105 with value: 0.2576898995269994.
2026-06-01 18:59:08 | INFO | Trial 121 | outer=5 | alpha=8.478e+04 n_pcs=4000 (pc_topk) weight={'name': 'pc_logistic', 'floor': 1e-06, 'clip_max': 4.0, 'prob_clip': 0.01836358281620227, 'n_components': 100, 'logistic_c': 0.00022127179416666425, 'pca_fit': 'combined', 'solver': 'lbfgs', 'max_iter': 2000, 'fit_intercept': True, 'standardize_with_source': True, 'rho': 0.85}
