[I 2026-06-01 00:58:08,227] Trial 214 finished with value: 0.23820836605236634 and parameters: {'alpha': 158033.2914189142, 'n_pcs': 4000, 'weight_scheme': 'exponential', 'weight_clip_max': 3.0, 'weight_exponential_beta': 3.709536208130616}. Best is trial 204 with value: 0.23823455832943674.
2026-06-01 00:58:08 | INFO | src.nested_cv_avggrm_weighted_unified | Trial 215 | outer=6 | alpha=8.589e+04 n_pcs=4000 (pc_topk) weight_search=on
2026-06-01 00:58:08 | INFO | src.nested_cv_avggrm_weighted_unified | Trial 215 | outer=6 | weight={'name': 'exponential', 'floor': 1e-06, 'clip_max': 3.0, 'beta': 3.7881559685027635}
2026-06-01 00:58:11 | INFO | src.nested_cv_avggrm_weighted_unified | Trial 215 | outer=6 | pruned after 7/10 inner folds (mean r=0.2602)
[I 2026-06-01 00:58:11,926] Trial 215 pruned. 
2026-06-01 00:58:11 | INFO | src.nested_cv_avggrm_weighted_unified | Trial 216 | outer=6 | alpha=1.218e+05 n_pcs=4000 (pc_topk) weight_search=on
2026-06-01 00:58:11 | INFO | src.nested_cv_avggrm_weighted_unified | Trial 216 | outer=6 | weight={'name': 'exponential', 'floor': 1e-06, 'clip_max': 3.0, 'beta': 3.58778943284093}
2026-06-01 00:58:15 | INFO | src.nested_cv_avggrm_weighted_unified | Trial 216 | outer=6 | pruned after 7/10 inner folds (mean r=0.2632)
[I 2026-06-01 00:58:15,541] Trial 216 pruned. 
2026-06-01 00:58:15 | INFO | src.nested_cv_avggrm_weighted_unified | Trial 217 | outer=6 | alpha=1.480e+05 n_pcs=4000 (pc_topk) weight_search=on
2026-06-01 00:58:15 | INFO | src.nested_cv_avggrm_weighted_unified | Trial 217 | outer=6 | weight={'name': 'exponential', 'floor': 1e-06, 'clip_max': 3.0, 'beta': 3.731672405780966}
2026-06-01 00:58:19 | INFO | src.nested_cv_avggrm_weighted_unified | Trial 217 | outer=6 | pruned after 7/10 inner folds (mean r=0.2646)
[I 2026-06-01 00:58:19,199] Trial 217 pruned. 
2026-06-01 00:58:19 | INFO | src.nested_cv_avggrm_weighted_unified | Trial 218 | outer=6 | alpha=1.669e+05 n_pcs=4000 (pc_topk) weight_search=on
2026-06-01 00:58:19 | INFO | src.nested_cv_avggrm_weighted_unified | Trial 218 | outer=6 | weight={'name': 'exponential', 'floor': 1e-06, 'clip_max': 3.0, 'beta': 3.3088086292616468}
[I 2026-06-01 00:58:24,346] Trial 218 finished with value: 0.23818218311968412 and parameters: {'alpha': 166895.0744198366, 'n_pcs': 4000, 'weight_scheme': 'exponential', 'weight_clip_max': 3.0, 'weight_exponential_beta': 3.3088086292616468}. Best is trial 204 with value: 0.23823455832943674.
2026-06-01 00:58:24 | INFO | src.nested_cv_avggrm_weighted_unified | Trial 219 | outer=6 | alpha=1.063e+05 n_pcs=4000 (pc_topk) weight_search=on
2026-06-01 00:58:24 | INFO | src.nested_cv_avggrm_weighted_unified | Trial 219 | outer=6 | weight={'name': 'linear', 'floor': 1e-06, 'clip_max': 3.0, 'min_weight': 0.5262840474416288, 'max_weight': 3.3097156118319724}
2026-06-01 00:58:28 | INFO | src.nested_cv_avggrm_weighted_unified | Trial 219 | outer=6 | pruned after 7/10 inner folds (mean r=0.2609)
[I 2026-06-01 00:58:28,093] Trial 219 pruned. 
2026-06-01 00:58:28 | INFO | src.nested_cv_avggrm_weighted_unified | Trial 220 | outer=6 | alpha=1.685e+05 n_pcs=4000 (pc_topk) weight_search=on
2026-06-01 00:58:28 | INFO | src.nested_cv_avggrm_weighted_unified | Trial 220 | outer=6 | weight={'name': 'exponential', 'floor': 1e-06, 'clip_max': 3.0, 'beta': 3.2820876403055568}
[I 2026-06-01 00:58:33,271] Trial 220 finished with value: 0.23816539968375655 and parameters: {'alpha': 168498.37081167725, 'n_pcs': 4000, 'weight_scheme': 'exponential', 'weight_clip_max': 3.0, 'weight_exponential_beta': 3.2820876403055568}. Best is trial 204 with value: 0.23823455832943674.
2026-06-01 00:58:33 | INFO | src.nested_cv_avggrm_weighted_unified | Trial 221 | outer=6 | alpha=1.603e+05 n_pcs=4000 (pc_topk) weight_search=on
2026-06-01 00:58:33 | INFO | src.nested_cv_avggrm_weighted_unified | Trial 221 | outer=6 | weight={'name': 'exponential', 'floor': 1e-06, 'clip_max': 3.0, 'beta': 3.3696861282147648}
2026-06-01 00:58:36 | INFO | src.nested_cv_avggrm_weighted_unified | Trial 221 | outer=6 | pruned after 7/10 inner folds (mean r=0.2648)
[I 2026-06-01 00:58:36,925] Trial 221 pruned. 
2026-06-01 00:58:36 | INFO | src.nested_cv_avggrm_weighted_unified | Trial 222 | outer=6 | alpha=1.332e+05 n_pcs=1000 (pc_topk) weight_search=on
2026-06-01 00:58:36 | INFO | src.nested_cv_avggrm_weighted_unified | Trial 222 | outer=6 | weight={'name': 'exponential', 'floor': 1e-06, 'clip_max': 3.0, 'beta': 3.2478705023567485}
2026-06-01 00:58:37 | INFO | src.nested_cv_avggrm_weighted_unified | Trial 222 | outer=6 | pruned after 6/10 inner folds (mean r=0.2421)
[I 2026-06-01 00:58:37,785] Trial 222 pruned. 
2026-06-01 00:58:37 | INFO | src.nested_cv_avggrm_weighted_unified | Trial 223 | outer=6 | alpha=2.292e+05 n_pcs=4000 (pc_topk) weight_search=on
2026-06-01 00:58:37 | INFO | src.nested_cv_avggrm_weighted_unified | Trial 223 | outer=6 | weight={'name': 'exponential', 'floor': 1e-06, 'clip_max': 3.0, 'beta': 3.4737553140245065}
[I 2026-06-01 00:58:43,549] Trial 223 finished with value: 0.2372796608214281 and parameters: {'alpha': 229225.28775408474, 'n_pcs': 4000, 'weight_scheme': 'exponential', 'weight_clip_max': 3.0, 'weight_exponential_beta': 3.4737553140245065}. Best is trial 204 with value: 0.23823455832943674.
2026-06-01 00:58:43 | INFO | src.nested_cv_avggrm_weighted_unified | Trial 224 | outer=6 | alpha=1.659e+05 n_pcs=4000 (pc_topk) weight_search=on
2026-06-01 00:58:43 | INFO | src.nested_cv_avggrm_weighted_unified | Trial 224 | outer=6 | weight={'name': 'exponential', 'floor': 1e-06, 'clip_max': 3.0, 'beta': 3.8706756644540095}
[I 2026-06-01 00:58:48,711] Trial 224 finished with value: 0.23818093953274203 and parameters: {'alpha': 165862.8387192798, 'n_pcs': 4000, 'weight_scheme': 'exponential', 'weight_clip_max': 3.0, 'weight_exponential_beta': 3.8706756644540095}. Best is trial 204 with value: 0.23823455832943674.
2026-06-01 00:58:48 | INFO | src.nested_cv_avggrm_weighted_unified | Trial 225 | outer=6 | alpha=1.691e+05 n_pcs=4000 (pc_topk) weight_search=on
2026-06-01 00:58:48 | INFO | src.nested_cv_avggrm_weighted_unified | Trial 225 | outer=6 | weight={'name': 'exponential', 'floor': 1e-06, 'clip_max': 3.0, 'beta': 3.93402193607779}
[I 2026-06-01 00:58:53,905] Trial 225 finished with value: 0.23815289595188274 and parameters: {'alpha': 169056.64793251487, 'n_pcs': 4000, 'weight_scheme': 'exponential', 'weight_clip_max': 3.0, 'weight_exponential_beta': 3.93402193607779}. Best is trial 204 with value: 0.23823455832943674.
2026-06-01 00:58:53 | INFO | src.nested_cv_avggrm_weighted_unified | Trial 226 | outer=6 | alpha=1.713e+05 n_pcs=4000 (pc_topk) weight_search=on
2026-06-01 00:58:53 | INFO | src.nested_cv_avggrm_weighted_unified | Trial 226 | outer=6 | weight={'name': 'exponential', 'floor': 1e-06, 'clip_max': 3.0, 'beta': 3.964947863635915}
[I 2026-06-01 00:58:59,061] Trial 226 finished with value: 0.23812593675769606 and parameters: {'alpha': 171300.89049063533, 'n_pcs': 4000, 'weight_scheme': 'exponential', 'weight_clip_max': 3.0, 'weight_exponential_beta': 3.964947863635915}. Best is trial 204 with value: 0.23823455832943674.
2026-06-01 00:58:59 | INFO | src.nested_cv_avggrm_weighted_unified | Trial 227 | outer=6 | alpha=1.407e+05 n_pcs=4000 (pc_topk) weight_search=on
2026-06-01 00:58:59 | INFO | src.nested_cv_avggrm_weighted_unified | Trial 227 | outer=6 | weight={'name': 'exponential', 'floor': 1e-06, 'clip_max': 3.0, 'beta': 3.9430086981912194}
2026-06-01 00:59:02 | INFO | src.nested_cv_avggrm_weighted_unified | Trial 227 | outer=6 | pruned after 7/10 inner folds (mean r=0.2645)
[I 2026-06-01 00:59:02,777] Trial 227 pruned. 
2026-06-01 00:59:02 | INFO | src.nested_cv_avggrm_weighted_unified | Trial 228 | outer=6 | alpha=1.718e+05 n_pcs=4000 (pc_topk) weight_search=on
2026-06-01 00:59:02 | INFO | src.nested_cv_avggrm_weighted_unified | Trial 228 | outer=6 | weight={'name': 'exponential', 'floor': 1e-06, 'clip_max': 3.0, 'beta': 3.8548325955670055}
[I 2026-06-01 00:59:07,952] Trial 228 finished with value: 0.23812513082861964 and parameters: {'alpha': 171833.0296417968, 'n_pcs': 4000, 'weight_scheme': 'exponential', 'weight_clip_max': 3.0, 'weight_exponential_beta': 3.8548325955670055}. Best is trial 204 with value: 0.23823455832943674.
2026-06-01 00:59:07 | INFO | src.nested_cv_avggrm_weighted_unified | Trial 229 | outer=6 | alpha=1.154e+05 n_pcs=4000 (pc_topk) weight_search=on
2026-06-01 00:59:07 | INFO | src.nested_cv_avggrm_weighted_unified | Trial 229 | outer=6 | weight={'name': 'exponential', 'floor': 1e-06, 'clip_max': None, 'beta': 3.865619791094546}
2026-06-01 00:59:11 | INFO | src.nested_cv_avggrm_weighted_unified | Trial 229 | outer=6 | pruned after 7/10 inner folds (mean r=0.2517)
[I 2026-06-01 00:59:11,616] Trial 229 pruned. 
2026-06-01 00:59:11 | INFO | src.nested_cv_avggrm_weighted_unified | Trial 230 | outer=6 | alpha=1.607e+05 n_pcs=4000 (pc_topk) weight_search=on
2026-06-01 00:59:11 | INFO | src.nested_cv_avggrm_weighted_unified | Trial 230 | outer=6 | weight={'name': 'exponential', 'floor': 1e-06, 'clip_max': 3.0, 'beta': 3.76134938121026}
[I 2026-06-01 00:59:16,818] Trial 230 finished with value: 0.2381987550060118 and parameters: {'alpha': 160703.12338518904, 'n_pcs': 4000, 'weight_scheme': 'exponential', 'weight_clip_max': 3.0, 'weight_exponential_beta': 3.76134938121026}. Best is trial 204 with value: 0.23823455832943674.
2026-06-01 00:59:16 | INFO | src.nested_cv_avggrm_weighted_unified | Trial 231 | outer=6 | alpha=1.625e+05 n_pcs=4000 (pc_topk) weight_search=on
2026-06-01 00:59:16 | INFO | src.nested_cv_avggrm_weighted_unified | Trial 231 | outer=6 | weight={'name': 'exponential', 'floor': 1e-06, 'clip_max': 3.0, 'beta': 4.0526694461492925}
[I 2026-06-01 00:59:21,985] Trial 231 finished with value: 0.23816096470852427 and parameters: {'alpha': 162476.12524205382, 'n_pcs': 4000, 'weight_scheme': 'exponential', 'weight_clip_max': 3.0, 'weight_exponential_beta': 4.0526694461492925}. Best is trial 204 with value: 0.23823455832943674.
2026-06-01 00:59:21 | INFO | src.nested_cv_avggrm_weighted_unified | Trial 232 | outer=6 | alpha=1.642e+05 n_pcs=4000 (pc_topk) weight_search=on
2026-06-01 00:59:22 | INFO | src.nested_cv_avggrm_weighted_unified | Trial 232 | outer=6 | weight={'name': 'exponential', 'floor': 1e-06, 'clip_max': 3.0, 'beta': 4.155735367698224}
[I 2026-06-01 00:59:27,172] Trial 232 finished with value: 0.2381234706959865 and parameters: {'alpha': 164162.79820678956, 'n_pcs': 4000, 'weight_scheme': 'exponential', 'weight_clip_max': 3.0, 'weight_exponential_beta': 4.155735367698224}. Best is trial 204 with value: 0.23823455832943674.
2026-06-01 00:59:27 | INFO | src.nested_cv_avggrm_weighted_unified | Trial 233 | outer=6 | alpha=1.603e+05 n_pcs=4000 (pc_topk) weight_search=on
2026-06-01 00:59:27 | INFO | src.nested_cv_avggrm_weighted_unified | Trial 233 | outer=6 | weight={'name': 'exponential', 'floor': 1e-06, 'clip_max': 3.0, 'beta': 4.075664862339951}
[I 2026-06-01 00:59:32,334] Trial 233 finished with value: 0.23816638150296723 and parameters: {'alpha': 160305.3536423451, 'n_pcs': 4000, 'weight_scheme': 'exponential', 'weight_clip_max': 3.0, 'weight_exponential_beta': 4.075664862339951}. Best is trial 204 with value: 0.23823455832943674.
2026-06-01 00:59:32 | INFO | src.nested_cv_avggrm_weighted_unified | Trial 234 | outer=6 | alpha=1.544e+05 n_pcs=4000 (pc_topk) weight_search=on
2026-06-01 00:59:32 | INFO | src.nested_cv_avggrm_weighted_unified | Trial 234 | outer=6 | weight={'name': 'exponential', 'floor': 1e-06, 'clip_max': 3.0, 'beta': 4.090442265798191}
[I 2026-06-01 00:59:37,635] Trial 234 finished with value: 0.2381955843706062 and parameters: {'alpha': 154418.6038996959, 'n_pcs': 4000, 'weight_scheme': 'exponential', 'weight_clip_max': 3.0, 'weight_exponential_beta': 4.090442265798191}. Best is trial 204 with value: 0.23823455832943674.
2026-06-01 00:59:37 | INFO | src.nested_cv_avggrm_weighted_unified | Trial 235 | outer=6 | alpha=9.626e+04 n_pcs=4000 (pc_topk) weight_search=on
2026-06-01 00:59:37 | INFO | src.nested_cv_avggrm_weighted_unified | Trial 235 | outer=6 | weight={'name': 'exponential', 'floor': 1e-06, 'clip_max': 3.0, 'beta': 4.045780646203746}
2026-06-01 00:59:41 | INFO | src.nested_cv_avggrm_weighted_unified | Trial 235 | outer=6 | pruned after 7/10 inner folds (mean r=0.2614)
[I 2026-06-01 00:59:41,248] Trial 235 pruned. 
2026-06-01 00:59:41 | INFO | src.nested_cv_avggrm_weighted_unified | Trial 236 | outer=6 | alpha=1.419e+05 n_pcs=4000 (pc_topk) weight_search=on
2026-06-01 00:59:41 | INFO | src.nested_cv_avggrm_weighted_unified | Trial 236 | outer=6 | weight={'name': 'exponential', 'floor': 1e-06, 'clip_max': 3.0, 'beta': 4.130020688243882}
2026-06-01 00:59:44 | INFO | src.nested_cv_avggrm_weighted_unified | Trial 236 | outer=6 | pruned after 7/10 inner folds (mean r=0.2646)
[I 2026-06-01 00:59:44,872] Trial 236 pruned. 
2026-06-01 00:59:44 | INFO | src.nested_cv_avggrm_weighted_unified | Trial 237 | outer=6 | alpha=1.556e+05 n_pcs=4000 (pc_topk) weight_search=on
2026-06-01 00:59:44 | INFO | src.nested_cv_avggrm_weighted_unified | Trial 237 | outer=6 | weight={'name': 'exponential', 'floor': 1e-06, 'clip_max': 3.0, 'beta': 3.8432398460779433}
[I 2026-06-01 00:59:50,456] Trial 237 finished with value: 0.23825365933560247 and parameters: {'alpha': 155631.1686378173, 'n_pcs': 4000, 'weight_scheme': 'exponential', 'weight_clip_max': 3.0, 'weight_exponential_beta': 3.8432398460779433}. Best is trial 237 with value: 0.23825365933560247.
2026-06-01 00:59:50 | INFO | src.nested_cv_avggrm_weighted_unified | OUTER 6 | new best trial 237 (mean inner r=0.2383) saved to outputs/final_results/e6_pc_ridge_avggrm/thr_wing/e6_pc_ridge_avggrm_thr_wing_best_trials/split_06_best_trial.json
2026-06-01 00:59:50 | INFO | src.nested_cv_avggrm_weighted_unified | Trial 238 | outer=6 | alpha=1.184e+05 n_pcs=4000 (pc_topk) weight_search=on
2026-06-01 00:59:50 | INFO | src.nested_cv_avggrm_weighted_unified | Trial 238 | outer=6 | weight={'name': 'exponential', 'floor': 1e-06, 'clip_max': 10.0, 'beta': 3.810223329346425}
2026-06-01 00:59:54 | INFO | src.nested_cv_avggrm_weighted_unified | Trial 238 | outer=6 | pruned after 7/10 inner folds (mean r=0.2541)
[I 2026-06-01 00:59:54,265] Trial 238 pruned. 
2026-06-01 00:59:54 | INFO | src.nested_cv_avggrm_weighted_unified | Trial 239 | outer=6 | alpha=1.445e+05 n_pcs=4000 (pc_topk) weight_search=on
2026-06-01 00:59:54 | INFO | src.nested_cv_avggrm_weighted_unified | Trial 239 | outer=6 | weight={'name': 'exponential', 'floor': 1e-06, 'clip_max': 3.0, 'beta': 4.141322902405846}
2026-06-01 00:59:57 | INFO | src.nested_cv_avggrm_weighted_unified | Trial 239 | outer=6 | pruned after 7/10 inner folds (mean r=0.2647)
[I 2026-06-01 00:59:57,866] Trial 239 pruned. 
2026-06-01 00:59:57 | INFO | src.nested_cv_avggrm_weighted_unified | Trial 240 | outer=6 | alpha=1.606e+05 n_pcs=4000 (pc_topk) weight_search=on
2026-06-01 00:59:57 | INFO | src.nested_cv_avggrm_weighted_unified | Trial 240 | outer=6 | weight={'name': 'exponential', 'floor': 1e-06, 'clip_max': 20.0, 'beta': 3.9758117623802605}
2026-06-01 01:00:01 | INFO | src.nested_cv_avggrm_weighted_unified | Trial 240 | outer=6 | pruned after 6/10 inner folds (mean r=0.2379)
[I 2026-06-01 01:00:01,038] Trial 240 pruned. 
2026-06-01 01:00:01 | INFO | src.nested_cv_avggrm_weighted_unified | Trial 241 | outer=6 | alpha=1.627e+05 n_pcs=4000 (pc_topk) weight_search=on
2026-06-01 01:00:01 | INFO | src.nested_cv_avggrm_weighted_unified | Trial 241 | outer=6 | weight={'name': 'exponential', 'floor': 1e-06, 'clip_max': 3.0, 'beta': 3.7751091533363716}
[I 2026-06-01 01:00:06,203] Trial 241 finished with value: 0.2381847509414523 and parameters: {'alpha': 162701.27825733437, 'n_pcs': 4000, 'weight_scheme': 'exponential', 'weight_clip_max': 3.0, 'weight_exponential_beta': 3.7751091533363716}. Best is trial 237 with value: 0.23825365933560247.
2026-06-01 01:00:06 | INFO | src.nested_cv_avggrm_weighted_unified | Trial 242 | outer=6 | alpha=1.269e+05 n_pcs=4000 (pc_topk) weight_search=on
2026-06-01 01:00:06 | INFO | src.nested_cv_avggrm_weighted_unified | Trial 242 | outer=6 | weight={'name': 'exponential', 'floor': 1e-06, 'clip_max': 3.0, 'beta': 3.7568220404475077}
2026-06-01 01:00:09 | INFO | src.nested_cv_avggrm_weighted_unified | Trial 242 | outer=6 | pruned after 7/10 inner folds (mean r=0.2637)
[I 2026-06-01 01:00:09,847] Trial 242 pruned. 
2026-06-01 01:00:09 | INFO | src.nested_cv_avggrm_weighted_unified | Trial 243 | outer=6 | alpha=1.643e+05 n_pcs=4000 (pc_topk) weight_search=on
2026-06-01 01:00:09 | INFO | src.nested_cv_avggrm_weighted_unified | Trial 243 | outer=6 | weight={'name': 'exponential', 'floor': 1e-06, 'clip_max': 3.0, 'beta': 4.235730838228965}
[I 2026-06-01 01:00:15,008] Trial 243 finished with value: 0.23808941555806357 and parameters: {'alpha': 164271.11855769812, 'n_pcs': 4000, 'weight_scheme': 'exponential', 'weight_clip_max': 3.0, 'weight_exponential_beta': 4.235730838228965}. Best is trial 237 with value: 0.23825365933560247.
2026-06-01 01:00:15 | INFO | src.nested_cv_avggrm_weighted_unified | Trial 244 | outer=6 | alpha=1.617e+05 n_pcs=4000 (pc_topk) weight_search=on
2026-06-01 01:00:15 | INFO | src.nested_cv_avggrm_weighted_unified | Trial 244 | outer=6 | weight={'name': 'exponential', 'floor': 1e-06, 'clip_max': 3.0, 'beta': 4.238205058772548}
[I 2026-06-01 01:00:20,385] Trial 244 finished with value: 0.23810334333651567 and parameters: {'alpha': 161683.79756932662, 'n_pcs': 4000, 'weight_scheme': 'exponential', 'weight_clip_max': 3.0, 'weight_exponential_beta': 4.238205058772548}. Best is trial 237 with value: 0.23825365933560247.
2026-06-01 01:00:20 | INFO | src.nested_cv_avggrm_weighted_unified | Trial 245 | outer=6 | alpha=1.554e+05 n_pcs=4000 (pc_topk) weight_search=on
2026-06-01 01:00:20 | INFO | src.nested_cv_avggrm_weighted_unified | Trial 245 | outer=6 | weight={'name': 'exponential', 'floor': 1e-06, 'clip_max': 3.0, 'beta': 4.316045263692745}
[I 2026-06-01 01:00:25,523] Trial 245 finished with value: 0.23809640200241158 and parameters: {'alpha': 155427.60905702793, 'n_pcs': 4000, 'weight_scheme': 'exponential', 'weight_clip_max': 3.0, 'weight_exponential_beta': 4.316045263692745}. Best is trial 237 with value: 0.23825365933560247.
2026-06-01 01:00:25 | INFO | src.nested_cv_avggrm_weighted_unified | Trial 246 | outer=6 | alpha=1.516e+05 n_pcs=4000 (pc_topk) weight_search=on
2026-06-01 01:00:25 | INFO | src.nested_cv_avggrm_weighted_unified | Trial 246 | outer=6 | weight={'name': 'exponential', 'floor': 1e-06, 'clip_max': 3.0, 'beta': 4.3012504638416695}
[I 2026-06-01 01:00:30,671] Trial 246 finished with value: 0.23811758608854267 and parameters: {'alpha': 151645.85506830554, 'n_pcs': 4000, 'weight_scheme': 'exponential', 'weight_clip_max': 3.0, 'weight_exponential_beta': 4.3012504638416695}. Best is trial 237 with value: 0.23825365933560247.
2026-06-01 01:00:30 | INFO | src.nested_cv_avggrm_weighted_unified | Trial 247 | outer=6 | alpha=1.155e+05 n_pcs=4000 (pc_topk) weight_search=on
2026-06-01 01:00:30 | INFO | src.nested_cv_avggrm_weighted_unified | Trial 247 | outer=6 | weight={'name': 'exponential', 'floor': 1e-06, 'clip_max': 3.0, 'beta': 4.33103228428398}
2026-06-01 01:00:34 | INFO | src.nested_cv_avggrm_weighted_unified | Trial 247 | outer=6 | pruned after 7/10 inner folds (mean r=0.2630)
[I 2026-06-01 01:00:34,353] Trial 247 pruned. 
2026-06-01 01:00:34 | INFO | src.nested_cv_avggrm_weighted_unified | Trial 248 | outer=6 | alpha=1.392e+05 n_pcs=4000 (pc_topk) weight_search=on
2026-06-01 01:00:34 | INFO | src.nested_cv_avggrm_weighted_unified | Trial 248 | outer=6 | weight={'name': 'exponential', 'floor': 1e-06, 'clip_max': 3.0, 'beta': 4.198252644798979}
2026-06-01 01:00:37 | INFO | src.nested_cv_avggrm_weighted_unified | Trial 248 | outer=6 | pruned after 7/10 inner folds (mean r=0.2645)
[I 2026-06-01 01:00:37,991] Trial 248 pruned. 
2026-06-01 01:00:37 | INFO | src.nested_cv_avggrm_weighted_unified | Trial 249 | outer=6 | alpha=9.334e+04 n_pcs=4000 (pc_topk) weight_search=on
2026-06-01 01:00:38 | INFO | src.nested_cv_avggrm_weighted_unified | Trial 249 | outer=6 | weight={'name': 'exponential', 'floor': 1e-06, 'clip_max': 3.0, 'beta': 3.9407987213131013}
2026-06-01 01:00:41 | INFO | src.nested_cv_avggrm_weighted_unified | Trial 249 | outer=6 | pruned after 7/10 inner folds (mean r=0.2611)
[I 2026-06-01 01:00:41,616] Trial 249 pruned. 
2026-06-01 01:00:41 | INFO | src.nested_cv_avggrm_weighted_unified | Trial 250 | outer=6 | alpha=1.594e+05 n_pcs=4000 (pc_topk) weight_search=on
2026-06-01 01:00:41 | INFO | src.nested_cv_avggrm_weighted_unified | Trial 250 | outer=6 | weight={'name': 'exponential', 'floor': 1e-06, 'clip_max': 3.0, 'beta': 4.303982422538819}
[I 2026-06-01 01:00:46,765] Trial 250 finished with value: 0.23808577769735403 and parameters: {'alpha': 159361.36699946044, 'n_pcs': 4000, 'weight_scheme': 'exponential', 'weight_clip_max': 3.0, 'weight_exponential_beta': 4.303982422538819}. Best is trial 237 with value: 0.23825365933560247.
2026-06-01 01:00:46 | INFO | src.nested_cv_avggrm_weighted_unified | Trial 251 | outer=6 | alpha=1.360e+05 n_pcs=4000 (pc_topk) weight_search=on
2026-06-01 01:00:46 | INFO | src.nested_cv_avggrm_weighted_unified | Trial 251 | outer=6 | weight={'name': 'exponential', 'floor': 1e-06, 'clip_max': 3.0, 'beta': 4.349016594097826}
2026-06-01 01:00:50 | INFO | src.nested_cv_avggrm_weighted_unified | Trial 251 | outer=6 | pruned after 7/10 inner folds (mean r=0.2643)
