[I 2026-06-01 02:03:42,860] Trial 45 finished with value: 0.2302787259183882 and parameters: {'alpha': 68822.91260899241, 'n_pcs': 3500, 'weight_scheme': 'exponential', 'weight_clip_max': 20.0, 'weight_exponential_beta': 3.0968036102727567}. Best is trial 28 with value: 0.2339384975360017.
2026-06-01 02:03:42 | INFO | src.nested_cv_avggrm_weighted_unified | Trial 46 | outer=9 | alpha=1.047e+04 n_pcs=3000 (pc_topk) weight_search=on
2026-06-01 02:03:42 | INFO | src.nested_cv_avggrm_weighted_unified | Trial 46 | outer=9 | weight={'name': 'exponential', 'floor': 1e-06, 'clip_max': 3.0, 'beta': 3.8495422094812684}
[I 2026-06-01 02:03:46,790] Trial 46 finished with value: 0.2007025650276178 and parameters: {'alpha': 10474.074588688654, 'n_pcs': 3000, 'weight_scheme': 'exponential', 'weight_clip_max': 3.0, 'weight_exponential_beta': 3.8495422094812684}. Best is trial 28 with value: 0.2339384975360017.
2026-06-01 02:03:46 | INFO | src.nested_cv_avggrm_weighted_unified | Trial 47 | outer=9 | alpha=6.952e+04 n_pcs=3000 (pc_topk) weight_search=on
2026-06-01 02:03:46 | INFO | src.nested_cv_avggrm_weighted_unified | Trial 47 | outer=9 | weight={'name': 'exponential', 'floor': 1e-06, 'clip_max': 3.0, 'beta': 2.467293241136536}
[I 2026-06-01 02:03:50,598] Trial 47 finished with value: 0.23335049658148505 and parameters: {'alpha': 69522.58415352218, 'n_pcs': 3000, 'weight_scheme': 'exponential', 'weight_clip_max': 3.0, 'weight_exponential_beta': 2.467293241136536}. Best is trial 28 with value: 0.2339384975360017.
2026-06-01 02:03:50 | INFO | src.nested_cv_avggrm_weighted_unified | Trial 48 | outer=9 | alpha=2.256e+04 n_pcs=3500 (pc_topk) weight_search=on
2026-06-01 02:03:50 | INFO | src.nested_cv_avggrm_weighted_unified | Trial 48 | outer=9 | weight={'name': 'uniform', 'floor': 1e-06, 'clip_max': None}
2026-06-01 02:03:53 | INFO | src.nested_cv_avggrm_weighted_unified | Trial 48 | outer=9 | pruned after 8/10 inner folds (mean r=0.2385)
[I 2026-06-01 02:03:53,897] Trial 48 pruned. 
2026-06-01 02:03:53 | INFO | src.nested_cv_avggrm_weighted_unified | Trial 49 | outer=9 | alpha=2.686e+03 n_pcs=4000 (pc_topk) weight_search=on
2026-06-01 02:03:53 | INFO | src.nested_cv_avggrm_weighted_unified | Trial 49 | outer=9 | weight={'name': 'exponential', 'floor': 1e-06, 'clip_max': 3.0, 'beta': 3.8106838973001222}
2026-06-01 02:03:57 | INFO | src.nested_cv_avggrm_weighted_unified | Trial 49 | outer=9 | pruned after 7/10 inner folds (mean r=0.1769)
[I 2026-06-01 02:03:57,902] Trial 49 pruned. 
2026-06-01 02:03:57 | INFO | src.nested_cv_avggrm_weighted_unified | Trial 50 | outer=9 | alpha=3.841e+05 n_pcs=4500 (pc_topk) weight_search=on
2026-06-01 02:03:57 | INFO | src.nested_cv_avggrm_weighted_unified | Trial 50 | outer=9 | weight={'name': 'exponential', 'floor': 1e-06, 'clip_max': 3.0, 'beta': 2.405550208716775}
[I 2026-06-01 02:04:04,879] Trial 50 finished with value: 0.22487772507578557 and parameters: {'alpha': 384096.77207873296, 'n_pcs': 4500, 'weight_scheme': 'exponential', 'weight_clip_max': 3.0, 'weight_exponential_beta': 2.405550208716775}. Best is trial 28 with value: 0.2339384975360017.
2026-06-01 02:04:04 | INFO | src.nested_cv_avggrm_weighted_unified | Trial 51 | outer=9 | alpha=1.126e+05 n_pcs=3000 (pc_topk) weight_search=on
2026-06-01 02:04:04 | INFO | src.nested_cv_avggrm_weighted_unified | Trial 51 | outer=9 | weight={'name': 'exponential', 'floor': 1e-06, 'clip_max': 3.0, 'beta': 4.0020440230672625}
[I 2026-06-01 02:04:08,689] Trial 51 finished with value: 0.23381840655880515 and parameters: {'alpha': 112603.85224172776, 'n_pcs': 3000, 'weight_scheme': 'exponential', 'weight_clip_max': 3.0, 'weight_exponential_beta': 4.0020440230672625}. Best is trial 28 with value: 0.2339384975360017.
2026-06-01 02:04:08 | INFO | src.nested_cv_avggrm_weighted_unified | Trial 52 | outer=9 | alpha=5.375e+04 n_pcs=3000 (pc_topk) weight_search=on
2026-06-01 02:04:08 | INFO | src.nested_cv_avggrm_weighted_unified | Trial 52 | outer=9 | weight={'name': 'exponential', 'floor': 1e-06, 'clip_max': 3.0, 'beta': 4.153034977793228}
[I 2026-06-01 02:04:12,592] Trial 52 finished with value: 0.23191273649803387 and parameters: {'alpha': 53747.17816794994, 'n_pcs': 3000, 'weight_scheme': 'exponential', 'weight_clip_max': 3.0, 'weight_exponential_beta': 4.153034977793228}. Best is trial 28 with value: 0.2339384975360017.
2026-06-01 02:04:12 | INFO | src.nested_cv_avggrm_weighted_unified | Trial 53 | outer=9 | alpha=1.111e+05 n_pcs=3000 (pc_topk) weight_search=on
2026-06-01 02:04:12 | INFO | src.nested_cv_avggrm_weighted_unified | Trial 53 | outer=9 | weight={'name': 'exponential', 'floor': 1e-06, 'clip_max': 3.0, 'beta': 3.0049576618331426}
[I 2026-06-01 02:04:16,432] Trial 53 finished with value: 0.23362366697152903 and parameters: {'alpha': 111138.71909061894, 'n_pcs': 3000, 'weight_scheme': 'exponential', 'weight_clip_max': 3.0, 'weight_exponential_beta': 3.0049576618331426}. Best is trial 28 with value: 0.2339384975360017.
2026-06-01 02:04:16 | INFO | src.nested_cv_avggrm_weighted_unified | Trial 54 | outer=9 | alpha=2.926e+05 n_pcs=3500 (pc_topk) weight_search=on
2026-06-01 02:04:16 | INFO | src.nested_cv_avggrm_weighted_unified | Trial 54 | outer=9 | weight={'name': 'exponential', 'floor': 1e-06, 'clip_max': 10.0, 'beta': 4.270270072742757}
[I 2026-06-01 02:04:22,088] Trial 54 finished with value: 0.22894214975277402 and parameters: {'alpha': 292552.9806088377, 'n_pcs': 3500, 'weight_scheme': 'exponential', 'weight_clip_max': 10.0, 'weight_exponential_beta': 4.270270072742757}. Best is trial 28 with value: 0.2339384975360017.
2026-06-01 02:04:22 | INFO | src.nested_cv_avggrm_weighted_unified | Trial 55 | outer=9 | alpha=4.050e+04 n_pcs=3000 (pc_topk) weight_search=on
2026-06-01 02:04:22 | INFO | src.nested_cv_avggrm_weighted_unified | Trial 55 | outer=9 | weight={'name': 'uniform', 'floor': 1e-06, 'clip_max': 20.0}
[I 2026-06-01 02:04:25,232] Trial 55 finished with value: 0.22103391479622791 and parameters: {'alpha': 40499.4423817621, 'n_pcs': 3000, 'weight_scheme': 'uniform', 'weight_clip_max': 20.0}. Best is trial 28 with value: 0.2339384975360017.
2026-06-01 02:04:25 | INFO | src.nested_cv_avggrm_weighted_unified | Trial 56 | outer=9 | alpha=1.349e+04 n_pcs=3000 (pc_topk) weight_search=on
2026-06-01 02:04:25 | INFO | src.nested_cv_avggrm_weighted_unified | Trial 56 | outer=9 | weight={'name': 'exponential', 'floor': 1e-06, 'clip_max': 3.0, 'beta': 1.424872287156411}
[I 2026-06-01 02:04:29,075] Trial 56 finished with value: 0.2104909443616756 and parameters: {'alpha': 13487.350546737334, 'n_pcs': 3000, 'weight_scheme': 'exponential', 'weight_clip_max': 3.0, 'weight_exponential_beta': 1.424872287156411}. Best is trial 28 with value: 0.2339384975360017.
2026-06-01 02:04:29 | INFO | src.nested_cv_avggrm_weighted_unified | Trial 57 | outer=9 | alpha=6.181e+04 n_pcs=3500 (pc_topk) weight_search=on
2026-06-01 02:04:29 | INFO | src.nested_cv_avggrm_weighted_unified | Trial 57 | outer=9 | weight={'name': 'exponential', 'floor': 1e-06, 'clip_max': 3.0, 'beta': 3.2812845950659186}
[I 2026-06-01 02:04:34,922] Trial 57 finished with value: 0.23222268705572616 and parameters: {'alpha': 61809.248458386, 'n_pcs': 3500, 'weight_scheme': 'exponential', 'weight_clip_max': 3.0, 'weight_exponential_beta': 3.2812845950659186}. Best is trial 28 with value: 0.2339384975360017.
2026-06-01 02:04:34 | INFO | src.nested_cv_avggrm_weighted_unified | Trial 58 | outer=9 | alpha=8.038e+04 n_pcs=3500 (pc_topk) weight_search=on
2026-06-01 02:04:34 | INFO | src.nested_cv_avggrm_weighted_unified | Trial 58 | outer=9 | weight={'name': 'exponential', 'floor': 1e-06, 'clip_max': 3.0, 'beta': 4.4088677529674705}
[I 2026-06-01 02:04:39,800] Trial 58 finished with value: 0.2326530601966131 and parameters: {'alpha': 80381.09057664902, 'n_pcs': 3500, 'weight_scheme': 'exponential', 'weight_clip_max': 3.0, 'weight_exponential_beta': 4.4088677529674705}. Best is trial 28 with value: 0.2339384975360017.
2026-06-01 02:04:39 | INFO | src.nested_cv_avggrm_weighted_unified | Trial 59 | outer=9 | alpha=1.269e+05 n_pcs=3000 (pc_topk) weight_search=on
2026-06-01 02:04:39 | INFO | src.nested_cv_avggrm_weighted_unified | Trial 59 | outer=9 | weight={'name': 'exponential', 'floor': 1e-06, 'clip_max': 3.0, 'beta': 2.7844698287425715}
[I 2026-06-01 02:04:43,865] Trial 59 finished with value: 0.23319514030012733 and parameters: {'alpha': 126873.11517837715, 'n_pcs': 3000, 'weight_scheme': 'exponential', 'weight_clip_max': 3.0, 'weight_exponential_beta': 2.7844698287425715}. Best is trial 28 with value: 0.2339384975360017.
2026-06-01 02:04:43 | INFO | src.nested_cv_avggrm_weighted_unified | Trial 60 | outer=9 | alpha=3.674e+04 n_pcs=2500 (pc_topk) weight_search=on
2026-06-01 02:04:43 | INFO | src.nested_cv_avggrm_weighted_unified | Trial 60 | outer=9 | weight={'name': 'uniform', 'floor': 1e-06, 'clip_max': 3.0}
[I 2026-06-01 02:04:46,236] Trial 60 finished with value: 0.22253564387434482 and parameters: {'alpha': 36744.7323661085, 'n_pcs': 2500, 'weight_scheme': 'uniform', 'weight_clip_max': 3.0}. Best is trial 28 with value: 0.2339384975360017.
2026-06-01 02:04:46 | INFO | src.nested_cv_avggrm_weighted_unified | Trial 61 | outer=9 | alpha=2.114e+05 n_pcs=3000 (pc_topk) weight_search=on
2026-06-01 02:04:46 | INFO | src.nested_cv_avggrm_weighted_unified | Trial 61 | outer=9 | weight={'name': 'exponential', 'floor': 1e-06, 'clip_max': 3.0, 'beta': 3.5134728640522837}
[I 2026-06-01 02:04:50,058] Trial 61 finished with value: 0.23144470466660333 and parameters: {'alpha': 211413.03079883146, 'n_pcs': 3000, 'weight_scheme': 'exponential', 'weight_clip_max': 3.0, 'weight_exponential_beta': 3.5134728640522837}. Best is trial 28 with value: 0.2339384975360017.
2026-06-01 02:04:50 | INFO | src.nested_cv_avggrm_weighted_unified | Trial 62 | outer=9 | alpha=1.156e+05 n_pcs=3000 (pc_topk) weight_search=on
2026-06-01 02:04:50 | INFO | src.nested_cv_avggrm_weighted_unified | Trial 62 | outer=9 | weight={'name': 'exponential', 'floor': 1e-06, 'clip_max': 3.0, 'beta': 1.769299701612388}
[I 2026-06-01 02:04:53,887] Trial 62 finished with value: 0.23058054212933632 and parameters: {'alpha': 115607.50892538518, 'n_pcs': 3000, 'weight_scheme': 'exponential', 'weight_clip_max': 3.0, 'weight_exponential_beta': 1.769299701612388}. Best is trial 28 with value: 0.2339384975360017.
2026-06-01 02:04:53 | INFO | src.nested_cv_avggrm_weighted_unified | Trial 63 | outer=9 | alpha=9.996e+04 n_pcs=3500 (pc_topk) weight_search=on
2026-06-01 02:04:53 | INFO | src.nested_cv_avggrm_weighted_unified | Trial 63 | outer=9 | weight={'name': 'exponential', 'floor': 1e-06, 'clip_max': None, 'beta': 3.162901096657684}
[I 2026-06-01 02:04:58,798] Trial 63 finished with value: 0.2304524118182906 and parameters: {'alpha': 99962.73763516522, 'n_pcs': 3500, 'weight_scheme': 'exponential', 'weight_clip_max': None, 'weight_exponential_beta': 3.162901096657684}. Best is trial 28 with value: 0.2339384975360017.
2026-06-01 02:04:58 | INFO | src.nested_cv_avggrm_weighted_unified | Trial 64 | outer=9 | alpha=4.922e+04 n_pcs=3000 (pc_topk) weight_search=on
2026-06-01 02:04:58 | INFO | src.nested_cv_avggrm_weighted_unified | Trial 64 | outer=9 | weight={'name': 'exponential', 'floor': 1e-06, 'clip_max': 3.0, 'beta': 2.8580038082888626}
[I 2026-06-01 02:05:02,654] Trial 64 finished with value: 0.23198304621913227 and parameters: {'alpha': 49224.91168208407, 'n_pcs': 3000, 'weight_scheme': 'exponential', 'weight_clip_max': 3.0, 'weight_exponential_beta': 2.8580038082888626}. Best is trial 28 with value: 0.2339384975360017.
2026-06-01 02:05:02 | INFO | src.nested_cv_avggrm_weighted_unified | Trial 65 | outer=9 | alpha=2.905e+04 n_pcs=2500 (pc_topk) weight_search=on
2026-06-01 02:05:02 | INFO | src.nested_cv_avggrm_weighted_unified | Trial 65 | outer=9 | weight={'name': 'exponential', 'floor': 1e-06, 'clip_max': 10.0, 'beta': 4.609397406351197}
[I 2026-06-01 02:05:05,635] Trial 65 finished with value: 0.22251204366110966 and parameters: {'alpha': 29052.947151723478, 'n_pcs': 2500, 'weight_scheme': 'exponential', 'weight_clip_max': 10.0, 'weight_exponential_beta': 4.609397406351197}. Best is trial 28 with value: 0.2339384975360017.
2026-06-01 02:05:05 | INFO | src.nested_cv_avggrm_weighted_unified | Trial 66 | outer=9 | alpha=3.191e+05 n_pcs=3000 (pc_topk) weight_search=on
2026-06-01 02:05:05 | INFO | src.nested_cv_avggrm_weighted_unified | Trial 66 | outer=9 | weight={'name': 'exponential', 'floor': 1e-06, 'clip_max': 20.0, 'beta': 1.9448600221211443}
[I 2026-06-01 02:05:09,467] Trial 66 finished with value: 0.22519821857248812 and parameters: {'alpha': 319130.58073941356, 'n_pcs': 3000, 'weight_scheme': 'exponential', 'weight_clip_max': 20.0, 'weight_exponential_beta': 1.9448600221211443}. Best is trial 28 with value: 0.2339384975360017.
2026-06-01 02:05:09 | INFO | src.nested_cv_avggrm_weighted_unified | Trial 67 | outer=9 | alpha=1.318e+05 n_pcs=2000 (pc_topk) weight_search=on
2026-06-01 02:05:09 | INFO | src.nested_cv_avggrm_weighted_unified | Trial 67 | outer=9 | weight={'name': 'exponential', 'floor': 1e-06, 'clip_max': 3.0, 'beta': 0.7847607700784134}
2026-06-01 02:05:11 | INFO | src.nested_cv_avggrm_weighted_unified | Trial 67 | outer=9 | pruned after 8/10 inner folds (mean r=0.2504)
[I 2026-06-01 02:05:11,256] Trial 67 pruned. 
2026-06-01 02:05:11 | INFO | src.nested_cv_avggrm_weighted_unified | Trial 68 | outer=9 | alpha=2.077e+05 n_pcs=2500 (pc_topk) weight_search=on
2026-06-01 02:05:11 | INFO | src.nested_cv_avggrm_weighted_unified | Trial 68 | outer=9 | weight={'name': 'exponential', 'floor': 1e-06, 'clip_max': 3.0, 'beta': 5.7990326888424}
[I 2026-06-01 02:05:14,228] Trial 68 finished with value: 0.23257613973643426 and parameters: {'alpha': 207701.80583471002, 'n_pcs': 2500, 'weight_scheme': 'exponential', 'weight_clip_max': 3.0, 'weight_exponential_beta': 5.7990326888424}. Best is trial 28 with value: 0.2339384975360017.
2026-06-01 02:05:14 | INFO | src.nested_cv_avggrm_weighted_unified | Trial 69 | outer=9 | alpha=8.846e+04 n_pcs=3000 (pc_topk) weight_search=on
2026-06-01 02:05:14 | INFO | src.nested_cv_avggrm_weighted_unified | Trial 69 | outer=9 | weight={'name': 'exponential', 'floor': 1e-06, 'clip_max': 3.0, 'beta': 3.6758926156683214}
[I 2026-06-01 02:05:18,070] Trial 69 finished with value: 0.23381380125202478 and parameters: {'alpha': 88459.63694618948, 'n_pcs': 3000, 'weight_scheme': 'exponential', 'weight_clip_max': 3.0, 'weight_exponential_beta': 3.6758926156683214}. Best is trial 28 with value: 0.2339384975360017.
2026-06-01 02:05:18 | INFO | src.nested_cv_avggrm_weighted_unified | Trial 70 | outer=9 | alpha=7.077e+05 n_pcs=3500 (pc_topk) weight_search=on
2026-06-01 02:05:18 | INFO | src.nested_cv_avggrm_weighted_unified | Trial 70 | outer=9 | weight={'name': 'exponential', 'floor': 1e-06, 'clip_max': 3.0, 'beta': 3.627069211359566}
2026-06-01 02:05:21 | INFO | src.nested_cv_avggrm_weighted_unified | Trial 70 | outer=9 | pruned after 7/10 inner folds (mean r=0.2400)
[I 2026-06-01 02:05:21,407] Trial 70 pruned. 
2026-06-01 02:05:21 | INFO | src.nested_cv_avggrm_weighted_unified | Trial 71 | outer=9 | alpha=8.071e+04 n_pcs=3000 (pc_topk) weight_search=on
2026-06-01 02:05:21 | INFO | src.nested_cv_avggrm_weighted_unified | Trial 71 | outer=9 | weight={'name': 'exponential', 'floor': 1e-06, 'clip_max': 3.0, 'beta': 3.893976042112807}
[I 2026-06-01 02:05:25,850] Trial 71 finished with value: 0.23371571201049673 and parameters: {'alpha': 80707.3905160977, 'n_pcs': 3000, 'weight_scheme': 'exponential', 'weight_clip_max': 3.0, 'weight_exponential_beta': 3.893976042112807}. Best is trial 28 with value: 0.2339384975360017.
2026-06-01 02:05:25 | INFO | src.nested_cv_avggrm_weighted_unified | Trial 72 | outer=9 | alpha=1.210e+03 n_pcs=2500 (pc_topk) weight_search=on
2026-06-01 02:05:25 | INFO | src.nested_cv_avggrm_weighted_unified | Trial 72 | outer=9 | weight={'name': 'exponential', 'floor': 1e-06, 'clip_max': 3.0, 'beta': 4.751211982005367}
2026-06-01 02:05:28 | INFO | src.nested_cv_avggrm_weighted_unified | Trial 72 | outer=9 | pruned after 5/10 inner folds (mean r=0.1925)
[I 2026-06-01 02:05:28,158] Trial 72 pruned. 
2026-06-01 02:05:28 | INFO | src.nested_cv_avggrm_weighted_unified | Trial 73 | outer=9 | alpha=8.179e+04 n_pcs=3000 (pc_topk) weight_search=on
2026-06-01 02:05:28 | INFO | src.nested_cv_avggrm_weighted_unified | Trial 73 | outer=9 | weight={'name': 'exponential', 'floor': 1e-06, 'clip_max': 3.0, 'beta': 3.9606731354657336}
[I 2026-06-01 02:05:31,995] Trial 73 finished with value: 0.23371945102290867 and parameters: {'alpha': 81794.65482089641, 'n_pcs': 3000, 'weight_scheme': 'exponential', 'weight_clip_max': 3.0, 'weight_exponential_beta': 3.9606731354657336}. Best is trial 28 with value: 0.2339384975360017.
2026-06-01 02:05:32 | INFO | src.nested_cv_avggrm_weighted_unified | Trial 74 | outer=9 | alpha=5.417e+04 n_pcs=3500 (pc_topk) weight_search=on
2026-06-01 02:05:32 | INFO | src.nested_cv_avggrm_weighted_unified | Trial 74 | outer=9 | weight={'name': 'exponential', 'floor': 1e-06, 'clip_max': 3.0, 'beta': 4.019626369624227}
[I 2026-06-01 02:05:37,037] Trial 74 finished with value: 0.23114888670748943 and parameters: {'alpha': 54166.807504342476, 'n_pcs': 3500, 'weight_scheme': 'exponential', 'weight_clip_max': 3.0, 'weight_exponential_beta': 4.019626369624227}. Best is trial 28 with value: 0.2339384975360017.
2026-06-01 02:05:37 | INFO | src.nested_cv_avggrm_weighted_unified | Trial 75 | outer=9 | alpha=1.490e+05 n_pcs=3000 (pc_topk) weight_search=on
2026-06-01 02:05:37 | INFO | src.nested_cv_avggrm_weighted_unified | Trial 75 | outer=9 | weight={'name': 'exponential', 'floor': 1e-06, 'clip_max': 3.0, 'beta': 6.011084963176097}
[I 2026-06-01 02:05:40,872] Trial 75 finished with value: 0.23369007531480884 and parameters: {'alpha': 149017.47581272866, 'n_pcs': 3000, 'weight_scheme': 'exponential', 'weight_clip_max': 3.0, 'weight_exponential_beta': 6.011084963176097}. Best is trial 28 with value: 0.2339384975360017.
2026-06-01 02:05:40 | INFO | src.nested_cv_avggrm_weighted_unified | Trial 76 | outer=9 | alpha=8.400e+04 n_pcs=2500 (pc_topk) weight_search=on
2026-06-01 02:05:40 | INFO | src.nested_cv_avggrm_weighted_unified | Trial 76 | outer=9 | weight={'name': 'uniform', 'floor': 1e-06, 'clip_max': None}
2026-06-01 02:05:43 | INFO | src.nested_cv_avggrm_weighted_unified | Trial 76 | outer=9 | pruned after 8/10 inner folds (mean r=0.2502)
[I 2026-06-01 02:05:43,015] Trial 76 pruned. 
2026-06-01 02:05:43 | INFO | src.nested_cv_avggrm_weighted_unified | Trial 77 | outer=9 | alpha=3.421e+04 n_pcs=3000 (pc_topk) weight_search=on
2026-06-01 02:05:43 | INFO | src.nested_cv_avggrm_weighted_unified | Trial 77 | outer=9 | weight={'name': 'exponential', 'floor': 1e-06, 'clip_max': 3.0, 'beta': 4.9315937018835765}
[I 2026-06-01 02:05:46,883] Trial 77 finished with value: 0.22677071016005504 and parameters: {'alpha': 34209.434453802314, 'n_pcs': 3000, 'weight_scheme': 'exponential', 'weight_clip_max': 3.0, 'weight_exponential_beta': 4.9315937018835765}. Best is trial 28 with value: 0.2339384975360017.
2026-06-01 02:05:46 | INFO | src.nested_cv_avggrm_weighted_unified | Trial 78 | outer=9 | alpha=6.351e+04 n_pcs=2500 (pc_topk) weight_search=on
2026-06-01 02:05:46 | INFO | src.nested_cv_avggrm_weighted_unified | Trial 78 | outer=9 | weight={'name': 'exponential', 'floor': 1e-06, 'clip_max': 10.0, 'beta': 9.95097947754474}
2026-06-01 02:05:49 | INFO | src.nested_cv_avggrm_weighted_unified | Trial 78 | outer=9 | pruned after 8/10 inner folds (mean r=0.2342)
[I 2026-06-01 02:05:49,270] Trial 78 pruned. 
2026-06-01 02:05:49 | INFO | src.nested_cv_avggrm_weighted_unified | Trial 79 | outer=9 | alpha=4.538e+04 n_pcs=3500 (pc_topk) weight_search=on
2026-06-01 02:05:49 | INFO | src.nested_cv_avggrm_weighted_unified | Trial 79 | outer=9 | weight={'name': 'exponential', 'floor': 1e-06, 'clip_max': 3.0, 'beta': 4.011107353668719}
[I 2026-06-01 02:05:54,147] Trial 79 finished with value: 0.2298599785429974 and parameters: {'alpha': 45384.10793777104, 'n_pcs': 3500, 'weight_scheme': 'exponential', 'weight_clip_max': 3.0, 'weight_exponential_beta': 4.011107353668719}. Best is trial 28 with value: 0.2339384975360017.
2026-06-01 02:05:54 | INFO | src.nested_cv_avggrm_weighted_unified | Trial 80 | outer=9 | alpha=1.909e+05 n_pcs=3000 (pc_topk) weight_search=on
2026-06-01 02:05:54 | INFO | src.nested_cv_avggrm_weighted_unified | Trial 80 | outer=9 | weight={'name': 'exponential', 'floor': 1e-06, 'clip_max': 3.0, 'beta': 3.497118584101458}
[I 2026-06-01 02:05:57,994] Trial 80 finished with value: 0.23195268162612193 and parameters: {'alpha': 190912.09439318697, 'n_pcs': 3000, 'weight_scheme': 'exponential', 'weight_clip_max': 3.0, 'weight_exponential_beta': 3.497118584101458}. Best is trial 28 with value: 0.2339384975360017.
2026-06-01 02:05:58 | INFO | src.nested_cv_avggrm_weighted_unified | Trial 81 | outer=9 | alpha=1.454e+05 n_pcs=3000 (pc_topk) weight_search=on
2026-06-01 02:05:58 | INFO | src.nested_cv_avggrm_weighted_unified | Trial 81 | outer=9 | weight={'name': 'exponential', 'floor': 1e-06, 'clip_max': 3.0, 'beta': 5.627746789942521}
[I 2026-06-01 02:06:01,831] Trial 81 finished with value: 0.23363483189115222 and parameters: {'alpha': 145396.4006808922, 'n_pcs': 3000, 'weight_scheme': 'exponential', 'weight_clip_max': 3.0, 'weight_exponential_beta': 5.627746789942521}. Best is trial 28 with value: 0.2339384975360017.
2026-06-01 02:06:01 | INFO | src.nested_cv_avggrm_weighted_unified | Trial 82 | outer=9 | alpha=9.443e+04 n_pcs=3000 (pc_topk) weight_search=on
2026-06-01 02:06:01 | INFO | src.nested_cv_avggrm_weighted_unified | Trial 82 | outer=9 | weight={'name': 'exponential', 'floor': 1e-06, 'clip_max': 3.0, 'beta': 6.198735742547631}
