[I 2026-06-01 17:37:21,302] Trial 133 finished with value: 0.19264504247920755 and parameters: {'alpha': 78820.51528174999, 'n_pcs': 4500, 'iw_method': 'pc_logistic', 'iw_clip_max': 12.0, 'iw_prob_clip': 0.020133517680213785, 'iw_n_components': 80, 'iw_logistic_c': 3.012698931986901e-05, 'iw_pca_fit': 'combined', 'iw_solver': 'lbfgs', 'iw_rho': 1.0}. Best is trial 113 with value: 0.19921246694301206.
2026-06-01 17:37:21 | INFO | Trial 134 | outer=4 | alpha=9.071e+04 n_pcs=4500 (pc_topk) weight={'name': 'pc_logistic', 'floor': 1e-06, 'clip_max': 4.0, 'prob_clip': 0.024996508797431226, 'n_components': 40, 'logistic_c': 1.9316840127928284e-05, 'pca_fit': 'combined', 'solver': 'lbfgs', 'max_iter': 2000, 'fit_intercept': True, 'standardize_with_source': True, 'rho': 1.0}
[I 2026-06-01 17:37:56,817] Trial 134 finished with value: 0.1996992750879212 and parameters: {'alpha': 90713.95268644739, 'n_pcs': 4500, 'iw_method': 'pc_logistic', 'iw_clip_max': 4.0, 'iw_prob_clip': 0.024996508797431226, 'iw_n_components': 40, 'iw_logistic_c': 1.9316840127928284e-05, 'iw_pca_fit': 'combined', 'iw_solver': 'lbfgs', 'iw_rho': 1.0}. Best is trial 134 with value: 0.1996992750879212.
2026-06-01 17:37:56 | INFO | Trial 135 | outer=4 | alpha=9.477e+04 n_pcs=4500 (pc_topk) weight={'name': 'pc_logistic', 'floor': 1e-06, 'clip_max': 4.0, 'prob_clip': 0.026492577924284923, 'n_components': 40, 'logistic_c': 1.7147717193428276e-05, 'pca_fit': 'combined', 'solver': 'lbfgs', 'max_iter': 2000, 'fit_intercept': True, 'standardize_with_source': True, 'rho': 1.0}
[I 2026-06-01 17:38:25,013] Trial 135 finished with value: 0.20012963278853163 and parameters: {'alpha': 94767.44160316324, 'n_pcs': 4500, 'iw_method': 'pc_logistic', 'iw_clip_max': 4.0, 'iw_prob_clip': 0.026492577924284923, 'iw_n_components': 40, 'iw_logistic_c': 1.7147717193428276e-05, 'iw_pca_fit': 'combined', 'iw_solver': 'lbfgs', 'iw_rho': 1.0}. Best is trial 135 with value: 0.20012963278853163.
2026-06-01 17:38:25 | INFO | Trial 136 | outer=4 | alpha=9.450e+04 n_pcs=4000 (pc_topk) weight={'name': 'pc_logistic', 'floor': 1e-06, 'clip_max': 4.0, 'prob_clip': 0.026083186516402335, 'n_components': 40, 'logistic_c': 9.992210784895494e-06, 'pca_fit': 'combined', 'solver': 'lbfgs', 'max_iter': 2000, 'fit_intercept': True, 'standardize_with_source': True, 'rho': 1.0}
[I 2026-06-01 17:38:38,581] Trial 136 finished with value: 0.1976296532160631 and parameters: {'alpha': 94503.43716841274, 'n_pcs': 4000, 'iw_method': 'pc_logistic', 'iw_clip_max': 4.0, 'iw_prob_clip': 0.026083186516402335, 'iw_n_components': 40, 'iw_logistic_c': 9.992210784895494e-06, 'iw_pca_fit': 'combined', 'iw_solver': 'lbfgs', 'iw_rho': 1.0}. Best is trial 135 with value: 0.20012963278853163.
2026-06-01 17:38:38 | INFO | Trial 137 | outer=4 | alpha=7.010e+04 n_pcs=4500 (pc_topk) weight={'name': 'pc_logistic', 'floor': 1e-06, 'clip_max': 4.0, 'prob_clip': 0.0234642706814384, 'n_components': 40, 'logistic_c': 1.846446803822705e-05, 'pca_fit': 'combined', 'solver': 'lbfgs', 'max_iter': 2000, 'fit_intercept': True, 'standardize_with_source': True, 'rho': 1.0}
[I 2026-06-01 17:39:08,293] Trial 137 finished with value: 0.19936245430086438 and parameters: {'alpha': 70100.39995008775, 'n_pcs': 4500, 'iw_method': 'pc_logistic', 'iw_clip_max': 4.0, 'iw_prob_clip': 0.0234642706814384, 'iw_n_components': 40, 'iw_logistic_c': 1.846446803822705e-05, 'iw_pca_fit': 'combined', 'iw_solver': 'lbfgs', 'iw_rho': 1.0}. Best is trial 135 with value: 0.20012963278853163.
2026-06-01 17:39:08 | INFO | Trial 138 | outer=4 | alpha=6.498e+04 n_pcs=4500 (pc_topk) weight={'name': 'pc_logistic', 'floor': 1e-06, 'clip_max': 4.0, 'prob_clip': 0.035351412487064825, 'n_components': 40, 'logistic_c': 4.523064890909182e-06, 'pca_fit': 'combined', 'solver': 'lbfgs', 'max_iter': 2000, 'fit_intercept': True, 'standardize_with_source': True, 'rho': 1.0}
[I 2026-06-01 17:39:24,300] Trial 138 finished with value: 0.19648954368125898 and parameters: {'alpha': 64981.600146563454, 'n_pcs': 4500, 'iw_method': 'pc_logistic', 'iw_clip_max': 4.0, 'iw_prob_clip': 0.035351412487064825, 'iw_n_components': 40, 'iw_logistic_c': 4.523064890909182e-06, 'iw_pca_fit': 'combined', 'iw_solver': 'lbfgs', 'iw_rho': 1.0}. Best is trial 135 with value: 0.20012963278853163.
2026-06-01 17:39:24 | INFO | Trial 139 | outer=4 | alpha=7.601e+04 n_pcs=4500 (pc_topk) weight={'name': 'pc_logistic', 'floor': 1e-06, 'clip_max': 4.0, 'prob_clip': 0.024199334843079283, 'n_components': 40, 'logistic_c': 1.5821743264211784e-05, 'pca_fit': 'combined', 'solver': 'lbfgs', 'max_iter': 2000, 'fit_intercept': True, 'standardize_with_source': True, 'rho': 1.0}
[I 2026-06-01 17:39:41,649] Trial 139 finished with value: 0.19979209892075483 and parameters: {'alpha': 76012.21974323071, 'n_pcs': 4500, 'iw_method': 'pc_logistic', 'iw_clip_max': 4.0, 'iw_prob_clip': 0.024199334843079283, 'iw_n_components': 40, 'iw_logistic_c': 1.5821743264211784e-05, 'iw_pca_fit': 'combined', 'iw_solver': 'lbfgs', 'iw_rho': 1.0}. Best is trial 135 with value: 0.20012963278853163.
2026-06-01 17:39:41 | INFO | Trial 140 | outer=4 | alpha=7.208e+04 n_pcs=4000 (pc_topk) weight={'name': 'pc_logistic', 'floor': 1e-06, 'clip_max': 4.0, 'prob_clip': 0.0235121899538689, 'n_components': 40, 'logistic_c': 9.651270142966663e-06, 'pca_fit': 'combined', 'solver': 'lbfgs', 'max_iter': 2000, 'fit_intercept': True, 'standardize_with_source': True, 'rho': 1.0}
[I 2026-06-01 17:39:57,843] Trial 140 finished with value: 0.19710420210695134 and parameters: {'alpha': 72078.40347441172, 'n_pcs': 4000, 'iw_method': 'pc_logistic', 'iw_clip_max': 4.0, 'iw_prob_clip': 0.0235121899538689, 'iw_n_components': 40, 'iw_logistic_c': 9.651270142966663e-06, 'iw_pca_fit': 'combined', 'iw_solver': 'lbfgs', 'iw_rho': 1.0}. Best is trial 135 with value: 0.20012963278853163.
2026-06-01 17:39:57 | INFO | Trial 141 | outer=4 | alpha=8.805e+04 n_pcs=4500 (pc_topk) weight={'name': 'pc_logistic', 'floor': 1e-06, 'clip_max': 4.0, 'prob_clip': 0.027125847554373275, 'n_components': 40, 'logistic_c': 1.8041391484360556e-05, 'pca_fit': 'combined', 'solver': 'lbfgs', 'max_iter': 2000, 'fit_intercept': True, 'standardize_with_source': True, 'rho': 1.0}
[I 2026-06-01 17:40:13,821] Trial 141 finished with value: 0.2002349661408674 and parameters: {'alpha': 88054.28729778122, 'n_pcs': 4500, 'iw_method': 'pc_logistic', 'iw_clip_max': 4.0, 'iw_prob_clip': 0.027125847554373275, 'iw_n_components': 40, 'iw_logistic_c': 1.8041391484360556e-05, 'iw_pca_fit': 'combined', 'iw_solver': 'lbfgs', 'iw_rho': 1.0}. Best is trial 141 with value: 0.2002349661408674.
2026-06-01 17:40:13 | INFO | Trial 142 | outer=4 | alpha=9.080e+04 n_pcs=4500 (pc_topk) weight={'name': 'pc_logistic', 'floor': 1e-06, 'clip_max': 4.0, 'prob_clip': 0.027043374770009572, 'n_components': 40, 'logistic_c': 1.6484573766824637e-05, 'pca_fit': 'combined', 'solver': 'lbfgs', 'max_iter': 2000, 'fit_intercept': True, 'standardize_with_source': True, 'rho': 1.0}
[I 2026-06-01 17:40:28,699] Trial 142 finished with value: 0.20017876539783713 and parameters: {'alpha': 90802.33312253535, 'n_pcs': 4500, 'iw_method': 'pc_logistic', 'iw_clip_max': 4.0, 'iw_prob_clip': 0.027043374770009572, 'iw_n_components': 40, 'iw_logistic_c': 1.6484573766824637e-05, 'iw_pca_fit': 'combined', 'iw_solver': 'lbfgs', 'iw_rho': 1.0}. Best is trial 141 with value: 0.2002349661408674.
2026-06-01 17:40:28 | INFO | Trial 143 | outer=4 | alpha=9.043e+04 n_pcs=4500 (pc_topk) weight={'name': 'pc_logistic', 'floor': 1e-06, 'clip_max': 4.0, 'prob_clip': 0.027389092209298343, 'n_components': 40, 'logistic_c': 1.7588217934033828e-05, 'pca_fit': 'combined', 'solver': 'lbfgs', 'max_iter': 2000, 'fit_intercept': True, 'standardize_with_source': True, 'rho': 1.0}
[I 2026-06-01 17:40:44,599] Trial 143 finished with value: 0.20029854348512285 and parameters: {'alpha': 90426.71204604855, 'n_pcs': 4500, 'iw_method': 'pc_logistic', 'iw_clip_max': 4.0, 'iw_prob_clip': 0.027389092209298343, 'iw_n_components': 40, 'iw_logistic_c': 1.7588217934033828e-05, 'iw_pca_fit': 'combined', 'iw_solver': 'lbfgs', 'iw_rho': 1.0}. Best is trial 143 with value: 0.20029854348512285.
2026-06-01 17:40:44 | INFO | Trial 144 | outer=4 | alpha=8.778e+04 n_pcs=4500 (pc_topk) weight={'name': 'pc_logistic', 'floor': 1e-06, 'clip_max': 4.0, 'prob_clip': 0.027573026827858848, 'n_components': 40, 'logistic_c': 1.8438060348605543e-05, 'pca_fit': 'combined', 'solver': 'lbfgs', 'max_iter': 2000, 'fit_intercept': True, 'standardize_with_source': True, 'rho': 1.0}
[I 2026-06-01 17:41:00,789] Trial 144 finished with value: 0.20027140836609708 and parameters: {'alpha': 87779.97412638666, 'n_pcs': 4500, 'iw_method': 'pc_logistic', 'iw_clip_max': 4.0, 'iw_prob_clip': 0.027573026827858848, 'iw_n_components': 40, 'iw_logistic_c': 1.8438060348605543e-05, 'iw_pca_fit': 'combined', 'iw_solver': 'lbfgs', 'iw_rho': 1.0}. Best is trial 143 with value: 0.20029854348512285.
2026-06-01 17:41:00 | INFO | Trial 145 | outer=4 | alpha=8.805e+04 n_pcs=4500 (pc_topk) weight={'name': 'pc_logistic', 'floor': 1e-06, 'clip_max': 4.0, 'prob_clip': 0.027541228037037718, 'n_components': 40, 'logistic_c': 1.566689224502809e-05, 'pca_fit': 'combined', 'solver': 'lbfgs', 'max_iter': 2000, 'fit_intercept': True, 'standardize_with_source': True, 'rho': 1.0}
[I 2026-06-01 17:41:33,037] Trial 145 finished with value: 0.20022407167635556 and parameters: {'alpha': 88049.9844352961, 'n_pcs': 4500, 'iw_method': 'pc_logistic', 'iw_clip_max': 4.0, 'iw_prob_clip': 0.027541228037037718, 'iw_n_components': 40, 'iw_logistic_c': 1.566689224502809e-05, 'iw_pca_fit': 'combined', 'iw_solver': 'lbfgs', 'iw_rho': 1.0}. Best is trial 143 with value: 0.20029854348512285.
2026-06-01 17:41:33 | INFO | Trial 146 | outer=4 | alpha=7.880e+04 n_pcs=4500 (pc_topk) weight={'name': 'pc_logistic', 'floor': 1e-06, 'clip_max': 7.0, 'prob_clip': 0.026704846082219586, 'n_components': 40, 'logistic_c': 1.7518011716548302e-05, 'pca_fit': 'combined', 'solver': 'lbfgs', 'max_iter': 2000, 'fit_intercept': True, 'standardize_with_source': True, 'rho': 1.0}
[I 2026-06-01 17:41:48,208] Trial 146 finished with value: 0.196938216375652 and parameters: {'alpha': 78797.02887472125, 'n_pcs': 4500, 'iw_method': 'pc_logistic', 'iw_clip_max': 7.0, 'iw_prob_clip': 0.026704846082219586, 'iw_n_components': 40, 'iw_logistic_c': 1.7518011716548302e-05, 'iw_pca_fit': 'combined', 'iw_solver': 'lbfgs', 'iw_rho': 1.0}. Best is trial 143 with value: 0.20029854348512285.
2026-06-01 17:41:48 | INFO | Trial 147 | outer=4 | alpha=1.783e+05 n_pcs=4500 (pc_topk) weight={'name': 'pc_logistic', 'floor': 1e-06, 'clip_max': 4.0, 'prob_clip': 0.03398607632983346, 'n_components': 40, 'logistic_c': 2.8843657722873972e-06, 'pca_fit': 'combined', 'solver': 'lbfgs', 'max_iter': 2000, 'fit_intercept': True, 'standardize_with_source': True, 'rho': 1.0}
[I 2026-06-01 17:42:02,960] Trial 147 finished with value: 0.18917037454912936 and parameters: {'alpha': 178286.43655969994, 'n_pcs': 4500, 'iw_method': 'pc_logistic', 'iw_clip_max': 4.0, 'iw_prob_clip': 0.03398607632983346, 'iw_n_components': 40, 'iw_logistic_c': 2.8843657722873972e-06, 'iw_pca_fit': 'combined', 'iw_solver': 'lbfgs', 'iw_rho': 1.0}. Best is trial 143 with value: 0.20029854348512285.
2026-06-01 17:42:02 | INFO | Trial 148 | outer=4 | alpha=1.275e+05 n_pcs=1000 (pc_topk) weight={'name': 'pc_logistic', 'floor': 1e-06, 'clip_max': 4.0, 'prob_clip': 0.038898333077454, 'n_components': 40, 'logistic_c': 8.255233613324989e-06, 'pca_fit': 'combined', 'solver': 'lbfgs', 'max_iter': 2000, 'fit_intercept': True, 'standardize_with_source': True, 'rho': 1.0}
[I 2026-06-01 17:42:10,117] Trial 148 finished with value: 0.19238379339394224 and parameters: {'alpha': 127508.06844054627, 'n_pcs': 1000, 'iw_method': 'pc_logistic', 'iw_clip_max': 4.0, 'iw_prob_clip': 0.038898333077454, 'iw_n_components': 40, 'iw_logistic_c': 8.255233613324989e-06, 'iw_pca_fit': 'combined', 'iw_solver': 'lbfgs', 'iw_rho': 1.0}. Best is trial 143 with value: 0.20029854348512285.
2026-06-01 17:42:10 | INFO | Trial 149 | outer=4 | alpha=8.750e+04 n_pcs=4500 (pc_topk) weight={'name': 'pc_logistic', 'floor': 1e-06, 'clip_max': 4.0, 'prob_clip': 0.02797730312987768, 'n_components': 40, 'logistic_c': 1.744293707587014e-05, 'pca_fit': 'combined', 'solver': 'lbfgs', 'max_iter': 2000, 'fit_intercept': True, 'standardize_with_source': True, 'rho': 1.0}
[I 2026-06-01 17:42:29,428] Trial 149 finished with value: 0.2004033680165615 and parameters: {'alpha': 87500.3527779044, 'n_pcs': 4500, 'iw_method': 'pc_logistic', 'iw_clip_max': 4.0, 'iw_prob_clip': 0.02797730312987768, 'iw_n_components': 40, 'iw_logistic_c': 1.744293707587014e-05, 'iw_pca_fit': 'combined', 'iw_solver': 'lbfgs', 'iw_rho': 1.0}. Best is trial 149 with value: 0.2004033680165615.
2026-06-01 17:42:29 | INFO | Trial 150 | outer=4 | alpha=7.057e+04 n_pcs=4000 (pc_topk) weight={'name': 'pc_logistic', 'floor': 1e-06, 'clip_max': 4.0, 'prob_clip': 0.025939128909690523, 'n_components': 40, 'logistic_c': 1.6862216725235596e-05, 'pca_fit': 'combined', 'solver': 'lbfgs', 'max_iter': 2000, 'fit_intercept': True, 'standardize_with_source': True, 'rho': 1.0}
[I 2026-06-01 17:42:54,550] Trial 150 finished with value: 0.1983870381211222 and parameters: {'alpha': 70565.60277637184, 'n_pcs': 4000, 'iw_method': 'pc_logistic', 'iw_clip_max': 4.0, 'iw_prob_clip': 0.025939128909690523, 'iw_n_components': 40, 'iw_logistic_c': 1.6862216725235596e-05, 'iw_pca_fit': 'combined', 'iw_solver': 'lbfgs', 'iw_rho': 1.0}. Best is trial 149 with value: 0.2004033680165615.
2026-06-01 17:42:54 | INFO | Trial 151 | outer=4 | alpha=9.388e+04 n_pcs=4500 (pc_topk) weight={'name': 'pc_logistic', 'floor': 1e-06, 'clip_max': 4.0, 'prob_clip': 0.029041332630963937, 'n_components': 40, 'logistic_c': 1.8844458497607334e-05, 'pca_fit': 'combined', 'solver': 'lbfgs', 'max_iter': 2000, 'fit_intercept': True, 'standardize_with_source': True, 'rho': 1.0}
[I 2026-06-01 17:43:10,348] Trial 151 finished with value: 0.20050890929972173 and parameters: {'alpha': 93884.38529879045, 'n_pcs': 4500, 'iw_method': 'pc_logistic', 'iw_clip_max': 4.0, 'iw_prob_clip': 0.029041332630963937, 'iw_n_components': 40, 'iw_logistic_c': 1.8844458497607334e-05, 'iw_pca_fit': 'combined', 'iw_solver': 'lbfgs', 'iw_rho': 1.0}. Best is trial 151 with value: 0.20050890929972173.
2026-06-01 17:43:10 | INFO | Trial 152 | outer=4 | alpha=8.479e+04 n_pcs=4500 (pc_topk) weight={'name': 'pc_logistic', 'floor': 1e-06, 'clip_max': 4.0, 'prob_clip': 0.02875023140491372, 'n_components': 40, 'logistic_c': 5.703660894084775e-06, 'pca_fit': 'combined', 'solver': 'lbfgs', 'max_iter': 2000, 'fit_intercept': True, 'standardize_with_source': True, 'rho': 1.0}
[I 2026-06-01 17:43:28,348] Trial 152 finished with value: 0.19698709632850667 and parameters: {'alpha': 84792.01009772196, 'n_pcs': 4500, 'iw_method': 'pc_logistic', 'iw_clip_max': 4.0, 'iw_prob_clip': 0.02875023140491372, 'iw_n_components': 40, 'iw_logistic_c': 5.703660894084775e-06, 'iw_pca_fit': 'combined', 'iw_solver': 'lbfgs', 'iw_rho': 1.0}. Best is trial 151 with value: 0.20050890929972173.
2026-06-01 17:43:28 | INFO | Trial 153 | outer=4 | alpha=1.258e+05 n_pcs=4500 (pc_topk) weight={'name': 'pc_logistic', 'floor': 1e-06, 'clip_max': 4.0, 'prob_clip': 0.02387587094214799, 'n_components': 40, 'logistic_c': 1.683069671529108e-05, 'pca_fit': 'combined', 'solver': 'lbfgs', 'max_iter': 2000, 'fit_intercept': True, 'standardize_with_source': True, 'rho': 1.0}
[I 2026-06-01 17:43:43,447] Trial 153 finished with value: 0.19946036992226138 and parameters: {'alpha': 125794.4385023826, 'n_pcs': 4500, 'iw_method': 'pc_logistic', 'iw_clip_max': 4.0, 'iw_prob_clip': 0.02387587094214799, 'iw_n_components': 40, 'iw_logistic_c': 1.683069671529108e-05, 'iw_pca_fit': 'combined', 'iw_solver': 'lbfgs', 'iw_rho': 1.0}. Best is trial 151 with value: 0.20050890929972173.
2026-06-01 17:43:43 | INFO | Trial 154 | outer=4 | alpha=1.421e+05 n_pcs=4500 (pc_topk) weight={'name': 'pc_logistic', 'floor': 1e-06, 'clip_max': 4.0, 'prob_clip': 0.03316313403372024, 'n_components': 40, 'logistic_c': 1.3059519746003043e-05, 'pca_fit': 'combined', 'solver': 'lbfgs', 'max_iter': 2000, 'fit_intercept': True, 'standardize_with_source': True, 'rho': 1.0}
[I 2026-06-01 17:44:00,645] Trial 154 finished with value: 0.19826217776915825 and parameters: {'alpha': 142091.77174542585, 'n_pcs': 4500, 'iw_method': 'pc_logistic', 'iw_clip_max': 4.0, 'iw_prob_clip': 0.03316313403372024, 'iw_n_components': 40, 'iw_logistic_c': 1.3059519746003043e-05, 'iw_pca_fit': 'combined', 'iw_solver': 'lbfgs', 'iw_rho': 1.0}. Best is trial 151 with value: 0.20050890929972173.
2026-06-01 17:44:00 | INFO | Trial 155 | outer=4 | alpha=1.220e+05 n_pcs=4500 (pc_topk) weight={'name': 'pc_logistic', 'floor': 1e-06, 'clip_max': 4.0, 'prob_clip': 0.025746686162929577, 'n_components': 40, 'logistic_c': 1.827315611608199e-05, 'pca_fit': 'combined', 'solver': 'lbfgs', 'max_iter': 2000, 'fit_intercept': True, 'standardize_with_source': True, 'rho': 1.0}
[I 2026-06-01 17:44:16,179] Trial 155 finished with value: 0.1996261975375856 and parameters: {'alpha': 122012.22202126014, 'n_pcs': 4500, 'iw_method': 'pc_logistic', 'iw_clip_max': 4.0, 'iw_prob_clip': 0.025746686162929577, 'iw_n_components': 40, 'iw_logistic_c': 1.827315611608199e-05, 'iw_pca_fit': 'combined', 'iw_solver': 'lbfgs', 'iw_rho': 1.0}. Best is trial 151 with value: 0.20050890929972173.
2026-06-01 17:44:16 | INFO | Trial 156 | outer=4 | alpha=1.612e+05 n_pcs=4500 (pc_topk) weight={'name': 'pc_logistic', 'floor': 1e-06, 'clip_max': 4.0, 'prob_clip': 0.027708021108568917, 'n_components': 40, 'logistic_c': 1.9219537846669278e-05, 'pca_fit': 'combined', 'solver': 'lbfgs', 'max_iter': 2000, 'fit_intercept': True, 'standardize_with_source': True, 'rho': 1.0}
[I 2026-06-01 17:44:31,921] Trial 156 finished with value: 0.19908729343443107 and parameters: {'alpha': 161155.2806239753, 'n_pcs': 4500, 'iw_method': 'pc_logistic', 'iw_clip_max': 4.0, 'iw_prob_clip': 0.027708021108568917, 'iw_n_components': 40, 'iw_logistic_c': 1.9219537846669278e-05, 'iw_pca_fit': 'combined', 'iw_solver': 'lbfgs', 'iw_rho': 1.0}. Best is trial 151 with value: 0.20050890929972173.
2026-06-01 17:44:31 | INFO | Trial 157 | outer=4 | alpha=1.826e+05 n_pcs=4500 (pc_topk) weight={'name': 'uniform'}
[I 2026-06-01 17:44:40,686] Trial 157 finished with value: 0.1827321474705152 and parameters: {'alpha': 182643.76191863007, 'n_pcs': 4500, 'iw_method': 'uniform'}. Best is trial 151 with value: 0.20050890929972173.
2026-06-01 17:44:40 | INFO | Trial 158 | outer=4 | alpha=1.508e+05 n_pcs=4500 (pc_topk) weight={'name': 'pc_logistic', 'floor': 1e-06, 'clip_max': 12.0, 'prob_clip': 0.02722942479029755, 'n_components': 40, 'logistic_c': 8.374522837726052e-06, 'pca_fit': 'combined', 'solver': 'lbfgs', 'max_iter': 2000, 'fit_intercept': True, 'standardize_with_source': True, 'rho': 1.0}
[I 2026-06-01 17:45:15,161] Trial 158 finished with value: 0.1937159666693153 and parameters: {'alpha': 150834.56359468136, 'n_pcs': 4500, 'iw_method': 'pc_logistic', 'iw_clip_max': 12.0, 'iw_prob_clip': 0.02722942479029755, 'iw_n_components': 40, 'iw_logistic_c': 8.374522837726052e-06, 'iw_pca_fit': 'combined', 'iw_solver': 'lbfgs', 'iw_rho': 1.0}. Best is trial 151 with value: 0.20050890929972173.
2026-06-01 17:45:15 | INFO | Trial 159 | outer=4 | alpha=2.120e+05 n_pcs=4500 (pc_topk) weight={'name': 'pc_logistic', 'floor': 1e-06, 'clip_max': 4.0, 'prob_clip': 0.038051051341226855, 'n_components': 40, 'logistic_c': 1.9032980086862078e-05, 'pca_fit': 'combined', 'solver': 'lbfgs', 'max_iter': 2000, 'fit_intercept': True, 'standardize_with_source': True, 'rho': 1.0}
[I 2026-06-01 17:45:34,179] Trial 159 finished with value: 0.1975277801621352 and parameters: {'alpha': 211987.64096734233, 'n_pcs': 4500, 'iw_method': 'pc_logistic', 'iw_clip_max': 4.0, 'iw_prob_clip': 0.038051051341226855, 'iw_n_components': 40, 'iw_logistic_c': 1.9032980086862078e-05, 'iw_pca_fit': 'combined', 'iw_solver': 'lbfgs', 'iw_rho': 1.0}. Best is trial 151 with value: 0.20050890929972173.
2026-06-01 17:45:34 | INFO | Trial 160 | outer=4 | alpha=1.181e+05 n_pcs=4000 (pc_topk) weight={'name': 'pc_logistic', 'floor': 1e-06, 'clip_max': 4.0, 'prob_clip': 0.03151836173232241, 'n_components': 40, 'logistic_c': 1.1411336007769674e-05, 'pca_fit': 'combined', 'solver': 'lbfgs', 'max_iter': 2000, 'fit_intercept': True, 'standardize_with_source': True, 'rho': 1.0}
[I 2026-06-01 17:45:47,974] Trial 160 finished with value: 0.19791412320029805 and parameters: {'alpha': 118105.23089045883, 'n_pcs': 4000, 'iw_method': 'pc_logistic', 'iw_clip_max': 4.0, 'iw_prob_clip': 0.03151836173232241, 'iw_n_components': 40, 'iw_logistic_c': 1.1411336007769674e-05, 'iw_pca_fit': 'combined', 'iw_solver': 'lbfgs', 'iw_rho': 1.0}. Best is trial 151 with value: 0.20050890929972173.
2026-06-01 17:45:47 | INFO | Trial 161 | outer=4 | alpha=8.937e+04 n_pcs=4500 (pc_topk) weight={'name': 'pc_logistic', 'floor': 1e-06, 'clip_max': 4.0, 'prob_clip': 0.025743856144983507, 'n_components': 40, 'logistic_c': 1.9236119042820093e-05, 'pca_fit': 'combined', 'solver': 'lbfgs', 'max_iter': 2000, 'fit_intercept': True, 'standardize_with_source': True, 'rho': 1.0}
