[I 2026-06-02 01:10:29,098] Trial 100 finished with value: 0.23416771724151425 and parameters: {'alpha': 52094.705830251136, 'n_pcs': 4000, 'iw_method': 'pc_logistic', 'iw_clip_max': 4.0, 'iw_prob_clip': 0.02963980164426677, 'iw_n_components': 100, 'iw_logistic_c': 1.6306192988094143e-05, 'iw_pca_fit': 'combined', 'iw_solver': 'lbfgs', 'iw_rho': 0.7}. Best is trial 93 with value: 0.23658233539278095.
2026-06-02 01:10:29 | INFO | Trial 101 | outer=10 | alpha=1.609e+05 n_pcs=4000 (pc_topk) weight={'name': 'pc_logistic', 'floor': 1e-06, 'clip_max': 4.0, 'prob_clip': 0.019391340634114206, 'n_components': 100, 'logistic_c': 3.6347750658141125e-05, 'pca_fit': 'combined', 'solver': 'lbfgs', 'max_iter': 2000, 'fit_intercept': True, 'standardize_with_source': True, 'rho': 0.7}
[I 2026-06-02 01:10:42,906] Trial 101 finished with value: 0.23652760836763237 and parameters: {'alpha': 160891.3782994266, 'n_pcs': 4000, 'iw_method': 'pc_logistic', 'iw_clip_max': 4.0, 'iw_prob_clip': 0.019391340634114206, 'iw_n_components': 100, 'iw_logistic_c': 3.6347750658141125e-05, 'iw_pca_fit': 'combined', 'iw_solver': 'lbfgs', 'iw_rho': 0.7}. Best is trial 93 with value: 0.23658233539278095.
2026-06-02 01:10:42 | INFO | Trial 102 | outer=10 | alpha=1.300e+05 n_pcs=4500 (pc_topk) weight={'name': 'pc_logistic', 'floor': 1e-06, 'clip_max': 4.0, 'prob_clip': 0.01858189223189272, 'n_components': 100, 'logistic_c': 8.18851430985327e-05, 'pca_fit': 'combined', 'solver': 'lbfgs', 'max_iter': 2000, 'fit_intercept': True, 'standardize_with_source': True, 'rho': 0.7}
[I 2026-06-02 01:10:58,656] Trial 102 finished with value: 0.23735008516690798 and parameters: {'alpha': 129986.41874341978, 'n_pcs': 4500, 'iw_method': 'pc_logistic', 'iw_clip_max': 4.0, 'iw_prob_clip': 0.01858189223189272, 'iw_n_components': 100, 'iw_logistic_c': 8.18851430985327e-05, 'iw_pca_fit': 'combined', 'iw_solver': 'lbfgs', 'iw_rho': 0.7}. Best is trial 102 with value: 0.23735008516690798.
2026-06-02 01:10:58 | INFO | Trial 103 | outer=10 | alpha=1.308e+05 n_pcs=4500 (pc_topk) weight={'name': 'pc_logistic', 'floor': 1e-06, 'clip_max': 4.0, 'prob_clip': 0.01926437196095909, 'n_components': 100, 'logistic_c': 0.0001425638286135398, 'pca_fit': 'combined', 'solver': 'lbfgs', 'max_iter': 2000, 'fit_intercept': True, 'standardize_with_source': True, 'rho': 0.7}
[I 2026-06-02 01:11:15,987] Trial 103 finished with value: 0.23724384220156375 and parameters: {'alpha': 130762.00477557557, 'n_pcs': 4500, 'iw_method': 'pc_logistic', 'iw_clip_max': 4.0, 'iw_prob_clip': 0.01926437196095909, 'iw_n_components': 100, 'iw_logistic_c': 0.0001425638286135398, 'iw_pca_fit': 'combined', 'iw_solver': 'lbfgs', 'iw_rho': 0.7}. Best is trial 102 with value: 0.23735008516690798.
2026-06-02 01:11:16 | INFO | Trial 104 | outer=10 | alpha=8.618e+04 n_pcs=4500 (pc_topk) weight={'name': 'pc_logistic', 'floor': 1e-06, 'clip_max': 4.0, 'prob_clip': 0.023006506137694005, 'n_components': 100, 'logistic_c': 2.9754853380005377e-05, 'pca_fit': 'combined', 'solver': 'lbfgs', 'max_iter': 2000, 'fit_intercept': True, 'standardize_with_source': True, 'rho': 0.7}
[I 2026-06-02 01:11:31,531] Trial 104 finished with value: 0.23760716125238956 and parameters: {'alpha': 86178.64605918183, 'n_pcs': 4500, 'iw_method': 'pc_logistic', 'iw_clip_max': 4.0, 'iw_prob_clip': 0.023006506137694005, 'iw_n_components': 100, 'iw_logistic_c': 2.9754853380005377e-05, 'iw_pca_fit': 'combined', 'iw_solver': 'lbfgs', 'iw_rho': 0.7}. Best is trial 104 with value: 0.23760716125238956.
2026-06-02 01:11:31 | INFO | Trial 105 | outer=10 | alpha=8.695e+04 n_pcs=4500 (pc_topk) weight={'name': 'pc_logistic', 'floor': 1e-06, 'clip_max': 4.0, 'prob_clip': 0.018942800008098157, 'n_components': 40, 'logistic_c': 2.4811645898268843e-05, 'pca_fit': 'combined', 'solver': 'lbfgs', 'max_iter': 2000, 'fit_intercept': True, 'standardize_with_source': True, 'rho': 0.7}
[I 2026-06-02 01:11:47,018] Trial 105 finished with value: 0.23566896808399976 and parameters: {'alpha': 86953.54330650182, 'n_pcs': 4500, 'iw_method': 'pc_logistic', 'iw_clip_max': 4.0, 'iw_prob_clip': 0.018942800008098157, 'iw_n_components': 40, 'iw_logistic_c': 2.4811645898268843e-05, 'iw_pca_fit': 'combined', 'iw_solver': 'lbfgs', 'iw_rho': 0.7}. Best is trial 104 with value: 0.23760716125238956.
2026-06-02 01:11:47 | INFO | Trial 106 | outer=10 | alpha=6.383e+04 n_pcs=5000 (pc_topk) weight={'name': 'pc_logistic', 'floor': 1e-06, 'clip_max': 4.0, 'prob_clip': 0.024086802927914076, 'n_components': 100, 'logistic_c': 4.064064320370802e-05, 'pca_fit': 'combined', 'solver': 'lbfgs', 'max_iter': 2000, 'fit_intercept': True, 'standardize_with_source': True, 'rho': 0.7}
[I 2026-06-02 01:12:03,800] Trial 106 finished with value: 0.23623455269870236 and parameters: {'alpha': 63832.30538938934, 'n_pcs': 5000, 'iw_method': 'pc_logistic', 'iw_clip_max': 4.0, 'iw_prob_clip': 0.024086802927914076, 'iw_n_components': 100, 'iw_logistic_c': 4.064064320370802e-05, 'iw_pca_fit': 'combined', 'iw_solver': 'lbfgs', 'iw_rho': 0.7}. Best is trial 104 with value: 0.23760716125238956.
2026-06-02 01:12:03 | INFO | Trial 107 | outer=10 | alpha=6.780e+04 n_pcs=5000 (pc_topk) weight={'name': 'uniform'}
[I 2026-06-02 01:12:14,050] Trial 107 finished with value: 0.2245019866120485 and parameters: {'alpha': 67801.7760759744, 'n_pcs': 5000, 'iw_method': 'uniform'}. Best is trial 104 with value: 0.23760716125238956.
2026-06-02 01:12:14 | INFO | Trial 108 | outer=10 | alpha=2.532e+04 n_pcs=5000 (pc_topk) weight={'name': 'pc_logistic', 'floor': 1e-06, 'clip_max': 12.0, 'prob_clip': 0.02471356305643091, 'n_components': 100, 'logistic_c': 6.944830226527829e-06, 'pca_fit': 'combined', 'solver': 'lbfgs', 'max_iter': 2000, 'fit_intercept': True, 'standardize_with_source': True, 'rho': 0.7}
[I 2026-06-02 01:12:30,451] Trial 108 finished with value: 0.22496945059569468 and parameters: {'alpha': 25322.90207443258, 'n_pcs': 5000, 'iw_method': 'pc_logistic', 'iw_clip_max': 12.0, 'iw_prob_clip': 0.02471356305643091, 'iw_n_components': 100, 'iw_logistic_c': 6.944830226527829e-06, 'iw_pca_fit': 'combined', 'iw_solver': 'lbfgs', 'iw_rho': 0.7}. Best is trial 104 with value: 0.23760716125238956.
2026-06-02 01:12:30 | INFO | Trial 109 | outer=10 | alpha=3.918e+04 n_pcs=4500 (pc_topk) weight={'name': 'pc_logistic', 'floor': 1e-06, 'clip_max': 4.0, 'prob_clip': 0.01739495203650217, 'n_components': 100, 'logistic_c': 3.9767808588942616e-05, 'pca_fit': 'combined', 'solver': 'lbfgs', 'max_iter': 2000, 'fit_intercept': True, 'standardize_with_source': True, 'rho': 0.7}
[I 2026-06-02 01:12:45,585] Trial 109 finished with value: 0.23311273004678398 and parameters: {'alpha': 39184.99457981975, 'n_pcs': 4500, 'iw_method': 'pc_logistic', 'iw_clip_max': 4.0, 'iw_prob_clip': 0.01739495203650217, 'iw_n_components': 100, 'iw_logistic_c': 3.9767808588942616e-05, 'iw_pca_fit': 'combined', 'iw_solver': 'lbfgs', 'iw_rho': 0.7}. Best is trial 104 with value: 0.23760716125238956.
2026-06-02 01:12:45 | INFO | Trial 110 | outer=10 | alpha=9.104e+04 n_pcs=4500 (pc_topk) weight={'name': 'pc_logistic', 'floor': 1e-06, 'clip_max': 4.0, 'prob_clip': 0.030273344117326156, 'n_components': 20, 'logistic_c': 1.3460110124757559e-05, 'pca_fit': 'combined', 'solver': 'lbfgs', 'max_iter': 2000, 'fit_intercept': True, 'standardize_with_source': True, 'rho': 0.7}
[I 2026-06-02 01:13:00,956] Trial 110 finished with value: 0.23475053065701315 and parameters: {'alpha': 91043.66336083502, 'n_pcs': 4500, 'iw_method': 'pc_logistic', 'iw_clip_max': 4.0, 'iw_prob_clip': 0.030273344117326156, 'iw_n_components': 20, 'iw_logistic_c': 1.3460110124757559e-05, 'iw_pca_fit': 'combined', 'iw_solver': 'lbfgs', 'iw_rho': 0.7}. Best is trial 104 with value: 0.23760716125238956.
2026-06-02 01:13:00 | INFO | Trial 111 | outer=10 | alpha=1.252e+05 n_pcs=5000 (pc_topk) weight={'name': 'pc_logistic', 'floor': 1e-06, 'clip_max': 4.0, 'prob_clip': 0.020837908430939658, 'n_components': 100, 'logistic_c': 2.3419582431831064e-05, 'pca_fit': 'combined', 'solver': 'lbfgs', 'max_iter': 2000, 'fit_intercept': True, 'standardize_with_source': True, 'rho': 0.7}
[I 2026-06-02 01:13:17,717] Trial 111 finished with value: 0.2351716151402902 and parameters: {'alpha': 125177.17950421768, 'n_pcs': 5000, 'iw_method': 'pc_logistic', 'iw_clip_max': 4.0, 'iw_prob_clip': 0.020837908430939658, 'iw_n_components': 100, 'iw_logistic_c': 2.3419582431831064e-05, 'iw_pca_fit': 'combined', 'iw_solver': 'lbfgs', 'iw_rho': 0.7}. Best is trial 104 with value: 0.23760716125238956.
2026-06-02 01:13:17 | INFO | Trial 112 | outer=10 | alpha=6.770e+04 n_pcs=5000 (pc_topk) weight={'name': 'pc_logistic', 'floor': 1e-06, 'clip_max': 4.0, 'prob_clip': 0.01422038220281207, 'n_components': 100, 'logistic_c': 5.355943986805054e-05, 'pca_fit': 'combined', 'solver': 'lbfgs', 'max_iter': 2000, 'fit_intercept': True, 'standardize_with_source': True, 'rho': 0.7}
[I 2026-06-02 01:13:35,192] Trial 112 finished with value: 0.23482473575019386 and parameters: {'alpha': 67697.14029807485, 'n_pcs': 5000, 'iw_method': 'pc_logistic', 'iw_clip_max': 4.0, 'iw_prob_clip': 0.01422038220281207, 'iw_n_components': 100, 'iw_logistic_c': 5.355943986805054e-05, 'iw_pca_fit': 'combined', 'iw_solver': 'lbfgs', 'iw_rho': 0.7}. Best is trial 104 with value: 0.23760716125238956.
2026-06-02 01:13:35 | INFO | Trial 113 | outer=10 | alpha=1.354e+05 n_pcs=4500 (pc_topk) weight={'name': 'pc_logistic', 'floor': 1e-06, 'clip_max': 4.0, 'prob_clip': 0.03488744278011136, 'n_components': 100, 'logistic_c': 0.00013652205678278066, 'pca_fit': 'combined', 'solver': 'lbfgs', 'max_iter': 2000, 'fit_intercept': True, 'standardize_with_source': True, 'rho': 0.7}
[I 2026-06-02 01:13:51,595] Trial 113 finished with value: 0.23547400990829645 and parameters: {'alpha': 135439.99209118495, 'n_pcs': 4500, 'iw_method': 'pc_logistic', 'iw_clip_max': 4.0, 'iw_prob_clip': 0.03488744278011136, 'iw_n_components': 100, 'iw_logistic_c': 0.00013652205678278066, 'iw_pca_fit': 'combined', 'iw_solver': 'lbfgs', 'iw_rho': 0.7}. Best is trial 104 with value: 0.23760716125238956.
2026-06-02 01:13:51 | INFO | Trial 114 | outer=10 | alpha=1.014e+05 n_pcs=4500 (pc_topk) weight={'name': 'pc_logistic', 'floor': 1e-06, 'clip_max': 4.0, 'prob_clip': 0.026008026367804655, 'n_components': 100, 'logistic_c': 9.025207659066177e-05, 'pca_fit': 'combined', 'solver': 'lbfgs', 'max_iter': 2000, 'fit_intercept': True, 'standardize_with_source': True, 'rho': 0.7}
[I 2026-06-02 01:14:07,420] Trial 114 finished with value: 0.23755878913935274 and parameters: {'alpha': 101395.25077381087, 'n_pcs': 4500, 'iw_method': 'pc_logistic', 'iw_clip_max': 4.0, 'iw_prob_clip': 0.026008026367804655, 'iw_n_components': 100, 'iw_logistic_c': 9.025207659066177e-05, 'iw_pca_fit': 'combined', 'iw_solver': 'lbfgs', 'iw_rho': 0.7}. Best is trial 104 with value: 0.23760716125238956.
2026-06-02 01:14:07 | INFO | Trial 115 | outer=10 | alpha=1.024e+05 n_pcs=4500 (pc_topk) weight={'name': 'pc_logistic', 'floor': 1e-06, 'clip_max': 4.0, 'prob_clip': 0.025366941435504435, 'n_components': 100, 'logistic_c': 5.8243317788976315e-06, 'pca_fit': 'combined', 'solver': 'lbfgs', 'max_iter': 2000, 'fit_intercept': True, 'standardize_with_source': True, 'rho': 0.7}
[I 2026-06-02 01:14:21,931] Trial 115 finished with value: 0.2306928606301389 and parameters: {'alpha': 102350.25353040714, 'n_pcs': 4500, 'iw_method': 'pc_logistic', 'iw_clip_max': 4.0, 'iw_prob_clip': 0.025366941435504435, 'iw_n_components': 100, 'iw_logistic_c': 5.8243317788976315e-06, 'iw_pca_fit': 'combined', 'iw_solver': 'lbfgs', 'iw_rho': 0.7}. Best is trial 104 with value: 0.23760716125238956.
2026-06-02 01:14:21 | INFO | Trial 116 | outer=10 | alpha=6.308e+04 n_pcs=4500 (pc_topk) weight={'name': 'pc_logistic', 'floor': 1e-06, 'clip_max': 4.0, 'prob_clip': 0.01719871073191179, 'n_components': 60, 'logistic_c': 8.585839892643772e-05, 'pca_fit': 'combined', 'solver': 'lbfgs', 'max_iter': 2000, 'fit_intercept': True, 'standardize_with_source': True, 'rho': 0.7}
[I 2026-06-02 01:14:37,313] Trial 116 finished with value: 0.2343288173377364 and parameters: {'alpha': 63084.89214187362, 'n_pcs': 4500, 'iw_method': 'pc_logistic', 'iw_clip_max': 4.0, 'iw_prob_clip': 0.01719871073191179, 'iw_n_components': 60, 'iw_logistic_c': 8.585839892643772e-05, 'iw_pca_fit': 'combined', 'iw_solver': 'lbfgs', 'iw_rho': 0.7}. Best is trial 104 with value: 0.23760716125238956.
2026-06-02 01:14:37 | INFO | Trial 117 | outer=10 | alpha=8.522e+04 n_pcs=4500 (pc_topk) weight={'name': 'pc_logistic', 'floor': 1e-06, 'clip_max': 1.5, 'prob_clip': 0.021122923453489734, 'n_components': 100, 'logistic_c': 4.2911141562159343e-05, 'pca_fit': 'combined', 'solver': 'lbfgs', 'max_iter': 2000, 'fit_intercept': True, 'standardize_with_source': True, 'rho': 0.7}
[I 2026-06-02 01:14:52,846] Trial 117 finished with value: 0.2324638597314836 and parameters: {'alpha': 85222.69634802762, 'n_pcs': 4500, 'iw_method': 'pc_logistic', 'iw_clip_max': 1.5, 'iw_prob_clip': 0.021122923453489734, 'iw_n_components': 100, 'iw_logistic_c': 4.2911141562159343e-05, 'iw_pca_fit': 'combined', 'iw_solver': 'lbfgs', 'iw_rho': 0.7}. Best is trial 104 with value: 0.23760716125238956.
2026-06-02 01:14:52 | INFO | Trial 118 | outer=10 | alpha=4.687e+04 n_pcs=5000 (pc_topk) weight={'name': 'pc_logistic', 'floor': 1e-06, 'clip_max': 4.0, 'prob_clip': 0.03285525248453062, 'n_components': 100, 'logistic_c': 2.0735278807681722e-05, 'pca_fit': 'combined', 'solver': 'lbfgs', 'max_iter': 2000, 'fit_intercept': True, 'standardize_with_source': True, 'rho': 0.7}
[I 2026-06-02 01:15:09,715] Trial 118 finished with value: 0.2340982420660181 and parameters: {'alpha': 46868.38508986647, 'n_pcs': 5000, 'iw_method': 'pc_logistic', 'iw_clip_max': 4.0, 'iw_prob_clip': 0.03285525248453062, 'iw_n_components': 100, 'iw_logistic_c': 2.0735278807681722e-05, 'iw_pca_fit': 'combined', 'iw_solver': 'lbfgs', 'iw_rho': 0.7}. Best is trial 104 with value: 0.23760716125238956.
2026-06-02 01:15:09 | INFO | Trial 119 | outer=10 | alpha=1.112e+05 n_pcs=5000 (pc_topk) weight={'name': 'pc_logistic', 'floor': 1e-06, 'clip_max': 4.0, 'prob_clip': 0.026948331746526905, 'n_components': 80, 'logistic_c': 1.171326183524349e-05, 'pca_fit': 'combined', 'solver': 'lbfgs', 'max_iter': 2000, 'fit_intercept': True, 'standardize_with_source': True, 'rho': 0.7}
[I 2026-06-02 01:15:26,192] Trial 119 finished with value: 0.2330593570257533 and parameters: {'alpha': 111198.87353722924, 'n_pcs': 5000, 'iw_method': 'pc_logistic', 'iw_clip_max': 4.0, 'iw_prob_clip': 0.026948331746526905, 'iw_n_components': 80, 'iw_logistic_c': 1.171326183524349e-05, 'iw_pca_fit': 'combined', 'iw_solver': 'lbfgs', 'iw_rho': 0.7}. Best is trial 104 with value: 0.23760716125238956.
2026-06-02 01:15:26 | INFO | Trial 120 | outer=10 | alpha=3.642e+04 n_pcs=4500 (pc_topk) weight={'name': 'pc_logistic', 'floor': 1e-06, 'clip_max': 2.5, 'prob_clip': 0.013133439057372133, 'n_components': 100, 'logistic_c': 2.809272854616364e-05, 'pca_fit': 'combined', 'solver': 'lbfgs', 'max_iter': 2000, 'fit_intercept': True, 'standardize_with_source': True, 'rho': 0.7}
[I 2026-06-02 01:15:41,259] Trial 120 finished with value: 0.2321316780589766 and parameters: {'alpha': 36416.73815392667, 'n_pcs': 4500, 'iw_method': 'pc_logistic', 'iw_clip_max': 2.5, 'iw_prob_clip': 0.013133439057372133, 'iw_n_components': 100, 'iw_logistic_c': 2.809272854616364e-05, 'iw_pca_fit': 'combined', 'iw_solver': 'lbfgs', 'iw_rho': 0.7}. Best is trial 104 with value: 0.23760716125238956.
2026-06-02 01:15:41 | INFO | Trial 121 | outer=10 | alpha=4.733e+06 n_pcs=4500 (pc_topk) weight={'name': 'pc_logistic', 'floor': 1e-06, 'clip_max': 4.0, 'prob_clip': 0.019123494993218665, 'n_components': 100, 'logistic_c': 0.00016664688390391358, 'pca_fit': 'combined', 'solver': 'lbfgs', 'max_iter': 2000, 'fit_intercept': True, 'standardize_with_source': True, 'rho': 0.7}
[I 2026-06-02 01:15:57,643] Trial 121 finished with value: 0.21778232059362462 and parameters: {'alpha': 4733165.094163896, 'n_pcs': 4500, 'iw_method': 'pc_logistic', 'iw_clip_max': 4.0, 'iw_prob_clip': 0.019123494993218665, 'iw_n_components': 100, 'iw_logistic_c': 0.00016664688390391358, 'iw_pca_fit': 'combined', 'iw_solver': 'lbfgs', 'iw_rho': 0.7}. Best is trial 104 with value: 0.23760716125238956.
2026-06-02 01:15:57 | INFO | Trial 122 | outer=10 | alpha=1.346e+05 n_pcs=4000 (pc_topk) weight={'name': 'pc_logistic', 'floor': 1e-06, 'clip_max': 4.0, 'prob_clip': 0.022679967102884915, 'n_components': 100, 'logistic_c': 7.562001206906033e-05, 'pca_fit': 'combined', 'solver': 'lbfgs', 'max_iter': 2000, 'fit_intercept': True, 'standardize_with_source': True, 'rho': 0.7}
[I 2026-06-02 01:16:10,827] Trial 122 finished with value: 0.23724976891900895 and parameters: {'alpha': 134594.36082723807, 'n_pcs': 4000, 'iw_method': 'pc_logistic', 'iw_clip_max': 4.0, 'iw_prob_clip': 0.022679967102884915, 'iw_n_components': 100, 'iw_logistic_c': 7.562001206906033e-05, 'iw_pca_fit': 'combined', 'iw_solver': 'lbfgs', 'iw_rho': 0.7}. Best is trial 104 with value: 0.23760716125238956.
2026-06-02 01:16:10 | INFO | Trial 123 | outer=10 | alpha=1.354e+05 n_pcs=4000 (pc_topk) weight={'name': 'pc_logistic', 'floor': 1e-06, 'clip_max': 4.0, 'prob_clip': 0.023126730957036948, 'n_components': 100, 'logistic_c': 7.186040413579385e-05, 'pca_fit': 'combined', 'solver': 'lbfgs', 'max_iter': 2000, 'fit_intercept': True, 'standardize_with_source': True, 'rho': 0.7}
[I 2026-06-02 01:16:24,552] Trial 123 finished with value: 0.23724759030591097 and parameters: {'alpha': 135413.0110745993, 'n_pcs': 4000, 'iw_method': 'pc_logistic', 'iw_clip_max': 4.0, 'iw_prob_clip': 0.023126730957036948, 'iw_n_components': 100, 'iw_logistic_c': 7.186040413579385e-05, 'iw_pca_fit': 'combined', 'iw_solver': 'lbfgs', 'iw_rho': 0.7}. Best is trial 104 with value: 0.23760716125238956.
2026-06-02 01:16:24 | INFO | Trial 124 | outer=10 | alpha=9.784e+04 n_pcs=4000 (pc_topk) weight={'name': 'pc_logistic', 'floor': 1e-06, 'clip_max': 4.0, 'prob_clip': 0.0231461040070971, 'n_components': 100, 'logistic_c': 6.808038793938564e-05, 'pca_fit': 'combined', 'solver': 'lbfgs', 'max_iter': 2000, 'fit_intercept': True, 'standardize_with_source': True, 'rho': 0.7}
[I 2026-06-02 01:16:37,673] Trial 124 finished with value: 0.23762407816748624 and parameters: {'alpha': 97841.9197009228, 'n_pcs': 4000, 'iw_method': 'pc_logistic', 'iw_clip_max': 4.0, 'iw_prob_clip': 0.0231461040070971, 'iw_n_components': 100, 'iw_logistic_c': 6.808038793938564e-05, 'iw_pca_fit': 'combined', 'iw_solver': 'lbfgs', 'iw_rho': 0.7}. Best is trial 124 with value: 0.23762407816748624.
2026-06-02 01:16:37 | INFO | Trial 125 | outer=10 | alpha=5.735e+04 n_pcs=4000 (pc_topk) weight={'name': 'pc_logistic', 'floor': 1e-06, 'clip_max': 7.0, 'prob_clip': 0.02225532761397508, 'n_components': 10, 'logistic_c': 7.921724031313555e-05, 'pca_fit': 'combined', 'solver': 'lbfgs', 'max_iter': 2000, 'fit_intercept': True, 'standardize_with_source': True, 'rho': 0.7}
[I 2026-06-02 01:16:50,466] Trial 125 finished with value: 0.22900419645079947 and parameters: {'alpha': 57350.30797613727, 'n_pcs': 4000, 'iw_method': 'pc_logistic', 'iw_clip_max': 7.0, 'iw_prob_clip': 0.02225532761397508, 'iw_n_components': 10, 'iw_logistic_c': 7.921724031313555e-05, 'iw_pca_fit': 'combined', 'iw_solver': 'lbfgs', 'iw_rho': 0.7}. Best is trial 124 with value: 0.23762407816748624.
2026-06-02 01:16:50 | INFO | Trial 126 | outer=10 | alpha=9.314e+04 n_pcs=4000 (pc_topk) weight={'name': 'pc_logistic', 'floor': 1e-06, 'clip_max': 4.0, 'prob_clip': 0.015786300794086168, 'n_components': 100, 'logistic_c': 5.096958422569482e-05, 'pca_fit': 'combined', 'solver': 'lbfgs', 'max_iter': 2000, 'fit_intercept': True, 'standardize_with_source': True, 'rho': 0.7}
