[I 2026-06-01 02:21:31,718] Trial 26 finished with value: 0.2294114768829764 and parameters: {'alpha': 397812.6758764028, 'n_pcs': 4000, 'weight_scheme': 'linear', 'weight_clip_max': 5.0, 'weight_linear_min_weight': 0.3938021390809069, 'weight_linear_max_weight': 4.268243576106276}. Best is trial 11 with value: 0.23481733561769147.
2026-06-01 02:21:31 | INFO | src.nested_cv_avggrm_weighted_unified | Trial 27 | outer=10 | alpha=2.302e+04 n_pcs=1500 (pc_topk) weight_search=on
2026-06-01 02:21:31 | INFO | src.nested_cv_avggrm_weighted_unified | Trial 27 | outer=10 | weight={'name': 'linear', 'floor': 1e-06, 'clip_max': 5.0, 'min_weight': 0.5255629030243263, 'max_weight': 1.6529809919593201}
2026-06-01 02:21:32 | INFO | src.nested_cv_avggrm_weighted_unified | Trial 27 | outer=10 | pruned after 5/10 inner folds (mean r=0.1905)
[I 2026-06-01 02:21:32,554] Trial 27 pruned. 
2026-06-01 02:21:32 | INFO | src.nested_cv_avggrm_weighted_unified | Trial 28 | outer=10 | alpha=8.001e+04 n_pcs=2500 (pc_topk) weight_search=on
2026-06-01 02:21:32 | INFO | src.nested_cv_avggrm_weighted_unified | Trial 28 | outer=10 | weight={'name': 'exponential', 'floor': 1e-06, 'clip_max': None, 'beta': 4.7891066221006735}
[I 2026-06-01 02:21:35,506] Trial 28 finished with value: 0.22456990054508022 and parameters: {'alpha': 80006.42697328527, 'n_pcs': 2500, 'weight_scheme': 'exponential', 'weight_clip_max': None, 'weight_exponential_beta': 4.7891066221006735}. Best is trial 11 with value: 0.23481733561769147.
2026-06-01 02:21:35 | INFO | src.nested_cv_avggrm_weighted_unified | Trial 29 | outer=10 | alpha=2.181e+05 n_pcs=4000 (pc_topk) weight_search=on
2026-06-01 02:21:35 | INFO | src.nested_cv_avggrm_weighted_unified | Trial 29 | outer=10 | weight={'name': 'uniform', 'floor': 1e-06, 'clip_max': None}
2026-06-01 02:21:38 | INFO | src.nested_cv_avggrm_weighted_unified | Trial 29 | outer=10 | pruned after 7/10 inner folds (mean r=0.2273)
[I 2026-06-01 02:21:38,906] Trial 29 pruned. 
2026-06-01 02:21:38 | INFO | src.nested_cv_avggrm_weighted_unified | Trial 30 | outer=10 | alpha=9.354e+04 n_pcs=4500 (pc_topk) weight_search=on
2026-06-01 02:21:38 | INFO | src.nested_cv_avggrm_weighted_unified | Trial 30 | outer=10 | weight={'name': 'uniform', 'floor': 1e-06, 'clip_max': 3.0}
2026-06-01 02:21:43 | INFO | src.nested_cv_avggrm_weighted_unified | Trial 30 | outer=10 | pruned after 8/10 inner folds (mean r=0.2539)
[I 2026-06-01 02:21:43,740] Trial 30 pruned. 
2026-06-01 02:21:43 | INFO | src.nested_cv_avggrm_weighted_unified | Trial 31 | outer=10 | alpha=2.364e+05 n_pcs=3000 (pc_topk) weight_search=on
2026-06-01 02:21:43 | INFO | src.nested_cv_avggrm_weighted_unified | Trial 31 | outer=10 | weight={'name': 'linear', 'floor': 1e-06, 'clip_max': None, 'min_weight': 0.2523948889140434, 'max_weight': 3.6109150154757543}
[I 2026-06-01 02:21:47,711] Trial 31 finished with value: 0.233839363950782 and parameters: {'alpha': 236437.0356438464, 'n_pcs': 3000, 'weight_scheme': 'linear', 'weight_clip_max': None, 'weight_linear_min_weight': 0.2523948889140434, 'weight_linear_max_weight': 3.6109150154757543}. Best is trial 11 with value: 0.23481733561769147.
2026-06-01 02:21:47 | INFO | src.nested_cv_avggrm_weighted_unified | Trial 32 | outer=10 | alpha=3.570e+04 n_pcs=3000 (pc_topk) weight_search=on
2026-06-01 02:21:47 | INFO | src.nested_cv_avggrm_weighted_unified | Trial 32 | outer=10 | weight={'name': 'linear', 'floor': 1e-06, 'clip_max': None, 'min_weight': 0.36014352412668715, 'max_weight': 3.258112516009661}
[I 2026-06-01 02:21:51,550] Trial 32 finished with value: 0.22639679510330604 and parameters: {'alpha': 35702.54583240127, 'n_pcs': 3000, 'weight_scheme': 'linear', 'weight_clip_max': None, 'weight_linear_min_weight': 0.36014352412668715, 'weight_linear_max_weight': 3.258112516009661}. Best is trial 11 with value: 0.23481733561769147.
2026-06-01 02:21:51 | INFO | src.nested_cv_avggrm_weighted_unified | Trial 33 | outer=10 | alpha=1.310e+05 n_pcs=3500 (pc_topk) weight_search=on
2026-06-01 02:21:51 | INFO | src.nested_cv_avggrm_weighted_unified | Trial 33 | outer=10 | weight={'name': 'linear', 'floor': 1e-06, 'clip_max': None, 'min_weight': 0.18714716029718503, 'max_weight': 2.7920288750897218}
[I 2026-06-01 02:21:56,551] Trial 33 finished with value: 0.2352810540594498 and parameters: {'alpha': 130984.43218324037, 'n_pcs': 3500, 'weight_scheme': 'linear', 'weight_clip_max': None, 'weight_linear_min_weight': 0.18714716029718503, 'weight_linear_max_weight': 2.7920288750897218}. Best is trial 33 with value: 0.2352810540594498.
2026-06-01 02:21:56 | INFO | src.nested_cv_avggrm_weighted_unified | OUTER 10 | new best trial 33 (mean inner r=0.2353) saved to outputs/final_results/e6_pc_ridge_avggrm/thr_wing/e6_pc_ridge_avggrm_thr_wing_best_trials/split_10_best_trial.json
2026-06-01 02:21:56 | INFO | src.nested_cv_avggrm_weighted_unified | Trial 34 | outer=10 | alpha=1.205e+05 n_pcs=3500 (pc_topk) weight_search=on
2026-06-01 02:21:56 | INFO | src.nested_cv_avggrm_weighted_unified | Trial 34 | outer=10 | weight={'name': 'linear', 'floor': 1e-06, 'clip_max': 20.0, 'min_weight': 0.17371639990802612, 'max_weight': 2.6452364010515224}
[I 2026-06-01 02:22:01,620] Trial 34 finished with value: 0.23534423279560449 and parameters: {'alpha': 120473.19803977096, 'n_pcs': 3500, 'weight_scheme': 'linear', 'weight_clip_max': 20.0, 'weight_linear_min_weight': 0.17371639990802612, 'weight_linear_max_weight': 2.6452364010515224}. Best is trial 34 with value: 0.23534423279560449.
2026-06-01 02:22:01 | INFO | src.nested_cv_avggrm_weighted_unified | OUTER 10 | new best trial 34 (mean inner r=0.2353) saved to outputs/final_results/e6_pc_ridge_avggrm/thr_wing/e6_pc_ridge_avggrm_thr_wing_best_trials/split_10_best_trial.json
2026-06-01 02:22:01 | INFO | src.nested_cv_avggrm_weighted_unified | Trial 35 | outer=10 | alpha=1.102e+05 n_pcs=3500 (pc_topk) weight_search=on
2026-06-01 02:22:01 | INFO | src.nested_cv_avggrm_weighted_unified | Trial 35 | outer=10 | weight={'name': 'exponential', 'floor': 1e-06, 'clip_max': 20.0, 'beta': 5.214460680276901}
[I 2026-06-01 02:22:06,785] Trial 35 finished with value: 0.2293712685973366 and parameters: {'alpha': 110152.15034069022, 'n_pcs': 3500, 'weight_scheme': 'exponential', 'weight_clip_max': 20.0, 'weight_exponential_beta': 5.214460680276901}. Best is trial 34 with value: 0.23534423279560449.
2026-06-01 02:22:06 | INFO | src.nested_cv_avggrm_weighted_unified | Trial 36 | outer=10 | alpha=5.982e+05 n_pcs=3500 (pc_topk) weight_search=on
2026-06-01 02:22:06 | INFO | src.nested_cv_avggrm_weighted_unified | Trial 36 | outer=10 | weight={'name': 'linear', 'floor': 1e-06, 'clip_max': 20.0, 'min_weight': 0.17666170710117327, 'max_weight': 2.723910053813859}
[I 2026-06-01 02:22:12,049] Trial 36 finished with value: 0.2275118116874856 and parameters: {'alpha': 598203.0546233227, 'n_pcs': 3500, 'weight_scheme': 'linear', 'weight_clip_max': 20.0, 'weight_linear_min_weight': 0.17666170710117327, 'weight_linear_max_weight': 2.723910053813859}. Best is trial 34 with value: 0.23534423279560449.
2026-06-01 02:22:12 | INFO | src.nested_cv_avggrm_weighted_unified | Trial 37 | outer=10 | alpha=7.610e+03 n_pcs=2000 (pc_topk) weight_search=on
2026-06-01 02:22:12 | INFO | src.nested_cv_avggrm_weighted_unified | Trial 37 | outer=10 | weight={'name': 'linear', 'floor': 1e-06, 'clip_max': 20.0, 'min_weight': 0.09982201651988751, 'max_weight': 2.14284288169965}
2026-06-01 02:22:13 | INFO | src.nested_cv_avggrm_weighted_unified | Trial 37 | outer=10 | pruned after 5/10 inner folds (mean r=0.1658)
[I 2026-06-01 02:22:13,620] Trial 37 pruned. 
2026-06-01 02:22:13 | INFO | src.nested_cv_avggrm_weighted_unified | Trial 38 | outer=10 | alpha=3.495e+04 n_pcs=2500 (pc_topk) weight_search=on
2026-06-01 02:22:13 | INFO | src.nested_cv_avggrm_weighted_unified | Trial 38 | outer=10 | weight={'name': 'exponential', 'floor': 1e-06, 'clip_max': 10.0, 'beta': 6.321606982380546}
2026-06-01 02:22:16 | INFO | src.nested_cv_avggrm_weighted_unified | Trial 38 | outer=10 | pruned after 8/10 inner folds (mean r=0.2358)
[I 2026-06-01 02:22:16,132] Trial 38 pruned. 
2026-06-01 02:22:16 | INFO | src.nested_cv_avggrm_weighted_unified | Trial 39 | outer=10 | alpha=4.832e+03 n_pcs=4000 (pc_topk) weight_search=on
2026-06-01 02:22:16 | INFO | src.nested_cv_avggrm_weighted_unified | Trial 39 | outer=10 | weight={'name': 'linear', 'floor': 1e-06, 'clip_max': 20.0, 'min_weight': 0.21388375098701415, 'max_weight': 1.9306709897288723}
2026-06-01 02:22:19 | INFO | src.nested_cv_avggrm_weighted_unified | Trial 39 | outer=10 | pruned after 5/10 inner folds (mean r=0.1934)
[I 2026-06-01 02:22:19,877] Trial 39 pruned. 
2026-06-01 02:22:19 | INFO | src.nested_cv_avggrm_weighted_unified | Trial 40 | outer=10 | alpha=6.615e+04 n_pcs=2500 (pc_topk) weight_search=on
2026-06-01 02:22:19 | INFO | src.nested_cv_avggrm_weighted_unified | Trial 40 | outer=10 | weight={'name': 'exponential', 'floor': 1e-06, 'clip_max': None, 'beta': 2.2720317738545}
[I 2026-06-01 02:22:25,208] Trial 40 finished with value: 0.2334702670650764 and parameters: {'alpha': 66150.40989739413, 'n_pcs': 2500, 'weight_scheme': 'exponential', 'weight_clip_max': None, 'weight_exponential_beta': 2.2720317738545}. Best is trial 34 with value: 0.23534423279560449.
2026-06-01 02:22:25 | INFO | src.nested_cv_avggrm_weighted_unified | Trial 41 | outer=10 | alpha=1.560e+05 n_pcs=4000 (pc_topk) weight_search=on
2026-06-01 02:22:25 | INFO | src.nested_cv_avggrm_weighted_unified | Trial 41 | outer=10 | weight={'name': 'linear', 'floor': 1e-06, 'clip_max': 20.0, 'min_weight': 0.22238933829311797, 'max_weight': 2.6762096109905156}
[I 2026-06-01 02:22:30,947] Trial 41 finished with value: 0.2348399629153594 and parameters: {'alpha': 156039.14710143107, 'n_pcs': 4000, 'weight_scheme': 'linear', 'weight_clip_max': 20.0, 'weight_linear_min_weight': 0.22238933829311797, 'weight_linear_max_weight': 2.6762096109905156}. Best is trial 34 with value: 0.23534423279560449.
2026-06-01 02:22:30 | INFO | src.nested_cv_avggrm_weighted_unified | Trial 42 | outer=10 | alpha=1.266e+05 n_pcs=4000 (pc_topk) weight_search=on
2026-06-01 02:22:30 | INFO | src.nested_cv_avggrm_weighted_unified | Trial 42 | outer=10 | weight={'name': 'linear', 'floor': 1e-06, 'clip_max': 20.0, 'min_weight': 0.20477698141735654, 'max_weight': 2.6866148478709846}
[I 2026-06-01 02:22:36,718] Trial 42 finished with value: 0.23544119340657949 and parameters: {'alpha': 126612.74711839082, 'n_pcs': 4000, 'weight_scheme': 'linear', 'weight_clip_max': 20.0, 'weight_linear_min_weight': 0.20477698141735654, 'weight_linear_max_weight': 2.6866148478709846}. Best is trial 42 with value: 0.23544119340657949.
2026-06-01 02:22:36 | INFO | src.nested_cv_avggrm_weighted_unified | OUTER 10 | new best trial 42 (mean inner r=0.2354) saved to outputs/final_results/e6_pc_ridge_avggrm/thr_wing/e6_pc_ridge_avggrm_thr_wing_best_trials/split_10_best_trial.json
2026-06-01 02:22:36 | INFO | src.nested_cv_avggrm_weighted_unified | Trial 43 | outer=10 | alpha=1.131e+05 n_pcs=4000 (pc_topk) weight_search=on
2026-06-01 02:22:36 | INFO | src.nested_cv_avggrm_weighted_unified | Trial 43 | outer=10 | weight={'name': 'linear', 'floor': 1e-06, 'clip_max': 20.0, 'min_weight': 0.06765165633954213, 'max_weight': 2.737865748949674}
[I 2026-06-01 02:22:43,901] Trial 43 finished with value: 0.23589421909037797 and parameters: {'alpha': 113141.29752227076, 'n_pcs': 4000, 'weight_scheme': 'linear', 'weight_clip_max': 20.0, 'weight_linear_min_weight': 0.06765165633954213, 'weight_linear_max_weight': 2.737865748949674}. Best is trial 43 with value: 0.23589421909037797.
2026-06-01 02:22:43 | INFO | src.nested_cv_avggrm_weighted_unified | OUTER 10 | new best trial 43 (mean inner r=0.2359) saved to outputs/final_results/e6_pc_ridge_avggrm/thr_wing/e6_pc_ridge_avggrm_thr_wing_best_trials/split_10_best_trial.json
2026-06-01 02:22:43 | INFO | src.nested_cv_avggrm_weighted_unified | Trial 44 | outer=10 | alpha=3.512e+04 n_pcs=4000 (pc_topk) weight_search=on
2026-06-01 02:22:43 | INFO | src.nested_cv_avggrm_weighted_unified | Trial 44 | outer=10 | weight={'name': 'linear', 'floor': 1e-06, 'clip_max': 20.0, 'min_weight': 0.06665721413127533, 'max_weight': 2.794459762698362}
[I 2026-06-01 02:22:50,566] Trial 44 finished with value: 0.22787946192805397 and parameters: {'alpha': 35121.32923013355, 'n_pcs': 4000, 'weight_scheme': 'linear', 'weight_clip_max': 20.0, 'weight_linear_min_weight': 0.06665721413127533, 'weight_linear_max_weight': 2.794459762698362}. Best is trial 43 with value: 0.23589421909037797.
2026-06-01 02:22:50 | INFO | src.nested_cv_avggrm_weighted_unified | Trial 45 | outer=10 | alpha=9.326e+04 n_pcs=4000 (pc_topk) weight_search=on
2026-06-01 02:22:50 | INFO | src.nested_cv_avggrm_weighted_unified | Trial 45 | outer=10 | weight={'name': 'linear', 'floor': 1e-06, 'clip_max': 20.0, 'min_weight': 0.15274228703237291, 'max_weight': 2.5953561767782993}
[I 2026-06-01 02:22:56,340] Trial 45 finished with value: 0.23559787303505697 and parameters: {'alpha': 93259.40694012782, 'n_pcs': 4000, 'weight_scheme': 'linear', 'weight_clip_max': 20.0, 'weight_linear_min_weight': 0.15274228703237291, 'weight_linear_max_weight': 2.5953561767782993}. Best is trial 43 with value: 0.23589421909037797.
2026-06-01 02:22:56 | INFO | src.nested_cv_avggrm_weighted_unified | Trial 46 | outer=10 | alpha=4.679e+04 n_pcs=4500 (pc_topk) weight_search=on
2026-06-01 02:22:56 | INFO | src.nested_cv_avggrm_weighted_unified | Trial 46 | outer=10 | weight={'name': 'linear', 'floor': 1e-06, 'clip_max': 20.0, 'min_weight': 0.13099288896643893, 'max_weight': 1.9525124228222541}
[I 2026-06-01 02:23:03,307] Trial 46 finished with value: 0.2332434420873834 and parameters: {'alpha': 46791.97349801992, 'n_pcs': 4500, 'weight_scheme': 'linear', 'weight_clip_max': 20.0, 'weight_linear_min_weight': 0.13099288896643893, 'weight_linear_max_weight': 1.9525124228222541}. Best is trial 43 with value: 0.23589421909037797.
2026-06-01 02:23:03 | INFO | src.nested_cv_avggrm_weighted_unified | Trial 47 | outer=10 | alpha=1.419e+03 n_pcs=4000 (pc_topk) weight_search=on
2026-06-01 02:23:03 | INFO | src.nested_cv_avggrm_weighted_unified | Trial 47 | outer=10 | weight={'name': 'linear', 'floor': 1e-06, 'clip_max': 20.0, 'min_weight': 0.13747725092315144, 'max_weight': 2.929918720824654}
2026-06-01 02:23:06 | INFO | src.nested_cv_avggrm_weighted_unified | Trial 47 | outer=10 | pruned after 5/10 inner folds (mean r=0.1527)
[I 2026-06-01 02:23:06,201] Trial 47 pruned. 
2026-06-01 02:23:06 | INFO | src.nested_cv_avggrm_weighted_unified | Trial 48 | outer=10 | alpha=1.587e+04 n_pcs=3500 (pc_topk) weight_search=on
2026-06-01 02:23:06 | INFO | src.nested_cv_avggrm_weighted_unified | Trial 48 | outer=10 | weight={'name': 'uniform', 'floor': 1e-06, 'clip_max': 20.0}
2026-06-01 02:23:09 | INFO | src.nested_cv_avggrm_weighted_unified | Trial 48 | outer=10 | pruned after 8/10 inner folds (mean r=0.2303)
[I 2026-06-01 02:23:09,560] Trial 48 pruned. 
2026-06-01 02:23:09 | INFO | src.nested_cv_avggrm_weighted_unified | Trial 49 | outer=10 | alpha=8.334e+04 n_pcs=5000 (pc_topk) weight_search=on
2026-06-01 02:23:09 | INFO | src.nested_cv_avggrm_weighted_unified | Trial 49 | outer=10 | weight={'name': 'linear', 'floor': 1e-06, 'clip_max': 20.0, 'min_weight': 0.1557507408507083, 'max_weight': 3.3237800778261315}
[I 2026-06-01 02:23:17,744] Trial 49 finished with value: 0.23442443125141538 and parameters: {'alpha': 83335.39764561241, 'n_pcs': 5000, 'weight_scheme': 'linear', 'weight_clip_max': 20.0, 'weight_linear_min_weight': 0.1557507408507083, 'weight_linear_max_weight': 3.3237800778261315}. Best is trial 43 with value: 0.23589421909037797.
2026-06-01 02:23:17 | INFO | src.nested_cv_avggrm_weighted_unified | Trial 50 | outer=10 | alpha=2.727e+05 n_pcs=3500 (pc_topk) weight_search=on
2026-06-01 02:23:17 | INFO | src.nested_cv_avggrm_weighted_unified | Trial 50 | outer=10 | weight={'name': 'linear', 'floor': 1e-06, 'clip_max': 3.0, 'min_weight': 0.10236065706589947, 'max_weight': 2.52459440311879}
[I 2026-06-01 02:23:22,753] Trial 50 finished with value: 0.23255135271624888 and parameters: {'alpha': 272746.5966436296, 'n_pcs': 3500, 'weight_scheme': 'linear', 'weight_clip_max': 3.0, 'weight_linear_min_weight': 0.10236065706589947, 'weight_linear_max_weight': 2.52459440311879}. Best is trial 43 with value: 0.23589421909037797.
2026-06-01 02:23:22 | INFO | src.nested_cv_avggrm_weighted_unified | Trial 51 | outer=10 | alpha=1.243e+05 n_pcs=4000 (pc_topk) weight_search=on
2026-06-01 02:23:22 | INFO | src.nested_cv_avggrm_weighted_unified | Trial 51 | outer=10 | weight={'name': 'linear', 'floor': 1e-06, 'clip_max': 20.0, 'min_weight': 0.22441946251561837, 'max_weight': 2.7221211276788657}
[I 2026-06-01 02:23:28,966] Trial 51 finished with value: 0.23538860519597674 and parameters: {'alpha': 124346.0601285684, 'n_pcs': 4000, 'weight_scheme': 'linear', 'weight_clip_max': 20.0, 'weight_linear_min_weight': 0.22441946251561837, 'weight_linear_max_weight': 2.7221211276788657}. Best is trial 43 with value: 0.23589421909037797.
2026-06-01 02:23:28 | INFO | src.nested_cv_avggrm_weighted_unified | Trial 52 | outer=10 | alpha=1.242e+05 n_pcs=4000 (pc_topk) weight_search=on
2026-06-01 02:23:28 | INFO | src.nested_cv_avggrm_weighted_unified | Trial 52 | outer=10 | weight={'name': 'linear', 'floor': 1e-06, 'clip_max': 20.0, 'min_weight': 0.17345650269713284, 'max_weight': 2.9931604087840546}
[I 2026-06-01 02:23:34,723] Trial 52 finished with value: 0.235673434270076 and parameters: {'alpha': 124245.62366636003, 'n_pcs': 4000, 'weight_scheme': 'linear', 'weight_clip_max': 20.0, 'weight_linear_min_weight': 0.17345650269713284, 'weight_linear_max_weight': 2.9931604087840546}. Best is trial 43 with value: 0.23589421909037797.
2026-06-01 02:23:34 | INFO | src.nested_cv_avggrm_weighted_unified | Trial 53 | outer=10 | alpha=5.585e+04 n_pcs=4500 (pc_topk) weight_search=on
2026-06-01 02:23:34 | INFO | src.nested_cv_avggrm_weighted_unified | Trial 53 | outer=10 | weight={'name': 'linear', 'floor': 1e-06, 'clip_max': 20.0, 'min_weight': 0.10787244634634165, 'max_weight': 2.985115504949333}
[I 2026-06-01 02:23:41,719] Trial 53 finished with value: 0.23411132607107327 and parameters: {'alpha': 55848.74582645742, 'n_pcs': 4500, 'weight_scheme': 'linear', 'weight_clip_max': 20.0, 'weight_linear_min_weight': 0.10787244634634165, 'weight_linear_max_weight': 2.985115504949333}. Best is trial 43 with value: 0.23589421909037797.
2026-06-01 02:23:41 | INFO | src.nested_cv_avggrm_weighted_unified | Trial 54 | outer=10 | alpha=4.475e+05 n_pcs=4000 (pc_topk) weight_search=on
2026-06-01 02:23:41 | INFO | src.nested_cv_avggrm_weighted_unified | Trial 54 | outer=10 | weight={'name': 'linear', 'floor': 1e-06, 'clip_max': 20.0, 'min_weight': 0.16432600321822302, 'max_weight': 2.2768783286427277}
[I 2026-06-01 02:23:47,448] Trial 54 finished with value: 0.22918060670074952 and parameters: {'alpha': 447458.8715589287, 'n_pcs': 4000, 'weight_scheme': 'linear', 'weight_clip_max': 20.0, 'weight_linear_min_weight': 0.16432600321822302, 'weight_linear_max_weight': 2.2768783286427277}. Best is trial 43 with value: 0.23589421909037797.
2026-06-01 02:23:47 | INFO | src.nested_cv_avggrm_weighted_unified | Trial 55 | outer=10 | alpha=1.042e+05 n_pcs=4500 (pc_topk) weight_search=on
2026-06-01 02:23:47 | INFO | src.nested_cv_avggrm_weighted_unified | Trial 55 | outer=10 | weight={'name': 'linear', 'floor': 1e-06, 'clip_max': 20.0, 'min_weight': 0.2538834391648894, 'max_weight': 2.521785834080949}
[I 2026-06-01 02:23:54,376] Trial 55 finished with value: 0.2354242708638732 and parameters: {'alpha': 104235.40320777817, 'n_pcs': 4500, 'weight_scheme': 'linear', 'weight_clip_max': 20.0, 'weight_linear_min_weight': 0.2538834391648894, 'weight_linear_max_weight': 2.521785834080949}. Best is trial 43 with value: 0.23589421909037797.
2026-06-01 02:23:54 | INFO | src.nested_cv_avggrm_weighted_unified | Trial 56 | outer=10 | alpha=3.046e+05 n_pcs=5000 (pc_topk) weight_search=on
2026-06-01 02:23:54 | INFO | src.nested_cv_avggrm_weighted_unified | Trial 56 | outer=10 | weight={'name': 'linear', 'floor': 1e-06, 'clip_max': 20.0, 'min_weight': 0.24421062308734234, 'max_weight': 2.058656349826085}
2026-06-01 02:24:00 | INFO | src.nested_cv_avggrm_weighted_unified | Trial 56 | outer=10 | pruned after 8/10 inner folds (mean r=0.2661)
[I 2026-06-01 02:24:00,851] Trial 56 pruned. 
2026-06-01 02:24:00 | INFO | src.nested_cv_avggrm_weighted_unified | Trial 57 | outer=10 | alpha=6.385e+04 n_pcs=4500 (pc_topk) weight_search=on
2026-06-01 02:24:00 | INFO | src.nested_cv_avggrm_weighted_unified | Trial 57 | outer=10 | weight={'name': 'linear', 'floor': 1e-06, 'clip_max': 20.0, 'min_weight': 0.05390864903254887, 'max_weight': 3.075885370093539}
[I 2026-06-01 02:24:08,189] Trial 57 finished with value: 0.23460135757469874 and parameters: {'alpha': 63848.78758529271, 'n_pcs': 4500, 'weight_scheme': 'linear', 'weight_clip_max': 20.0, 'weight_linear_min_weight': 0.05390864903254887, 'weight_linear_max_weight': 3.075885370093539}. Best is trial 43 with value: 0.23589421909037797.
2026-06-01 02:24:08 | INFO | src.nested_cv_avggrm_weighted_unified | Trial 58 | outer=10 | alpha=2.659e+04 n_pcs=4000 (pc_topk) weight_search=on
2026-06-01 02:24:08 | INFO | src.nested_cv_avggrm_weighted_unified | Trial 58 | outer=10 | weight={'name': 'linear', 'floor': 1e-06, 'clip_max': 20.0, 'min_weight': 0.5804206876387173, 'max_weight': 2.481203890951187}
2026-06-01 02:24:12 | INFO | src.nested_cv_avggrm_weighted_unified | Trial 58 | outer=10 | pruned after 8/10 inner folds (mean r=0.2511)
