[I 2026-06-02 00:58:20,033] Trial 42 finished with value: 0.23467539324875272 and parameters: {'alpha': 136411.65814508076, 'n_pcs': 3000, 'iw_method': 'pc_logistic', 'iw_clip_max': 4.0, 'iw_prob_clip': 0.0010136937847504937, 'iw_n_components': 100, 'iw_logistic_c': 0.0004744121162538082, 'iw_pca_fit': 'combined', 'iw_solver': 'lbfgs', 'iw_rho': 0.85}. Best is trial 42 with value: 0.23467539324875272.
2026-06-02 00:58:20 | INFO | Trial 43 | outer=10 | alpha=1.248e+05 n_pcs=3000 (pc_topk) weight={'name': 'pc_logistic', 'floor': 1e-06, 'clip_max': 4.0, 'prob_clip': 0.0010037780936972762, 'n_components': 100, 'logistic_c': 0.0006297437288352801, 'pca_fit': 'combined', 'solver': 'lbfgs', 'max_iter': 2000, 'fit_intercept': True, 'standardize_with_source': True, 'rho': 0.85}
[I 2026-06-02 00:58:34,611] Trial 43 finished with value: 0.2341753400696179 and parameters: {'alpha': 124818.47167634823, 'n_pcs': 3000, 'iw_method': 'pc_logistic', 'iw_clip_max': 4.0, 'iw_prob_clip': 0.0010037780936972762, 'iw_n_components': 100, 'iw_logistic_c': 0.0006297437288352801, 'iw_pca_fit': 'combined', 'iw_solver': 'lbfgs', 'iw_rho': 0.85}. Best is trial 42 with value: 0.23467539324875272.
2026-06-02 00:58:34 | INFO | Trial 44 | outer=10 | alpha=1.539e+05 n_pcs=3000 (pc_topk) weight={'name': 'pc_logistic', 'floor': 1e-06, 'clip_max': 7.0, 'prob_clip': 0.0009088117176913921, 'n_components': 100, 'logistic_c': 0.009274811147085126, 'pca_fit': 'combined', 'solver': 'lbfgs', 'max_iter': 2000, 'fit_intercept': True, 'standardize_with_source': True, 'rho': 0.85}
[I 2026-06-02 00:58:52,944] Trial 44 finished with value: 0.2317242902447083 and parameters: {'alpha': 153882.70654848806, 'n_pcs': 3000, 'iw_method': 'pc_logistic', 'iw_clip_max': 7.0, 'iw_prob_clip': 0.0009088117176913921, 'iw_n_components': 100, 'iw_logistic_c': 0.009274811147085126, 'iw_pca_fit': 'combined', 'iw_solver': 'lbfgs', 'iw_rho': 0.85}. Best is trial 42 with value: 0.23467539324875272.
2026-06-02 00:58:52 | INFO | Trial 45 | outer=10 | alpha=2.341e+04 n_pcs=3000 (pc_topk) weight={'name': 'pc_logistic', 'floor': 1e-06, 'clip_max': 4.0, 'prob_clip': 0.0008778266698837462, 'n_components': 100, 'logistic_c': 0.0006727554382930795, 'pca_fit': 'combined', 'solver': 'lbfgs', 'max_iter': 2000, 'fit_intercept': True, 'standardize_with_source': True, 'rho': 0.85}
[I 2026-06-02 00:59:07,306] Trial 45 finished with value: 0.21079194466580367 and parameters: {'alpha': 23411.359842346512, 'n_pcs': 3000, 'iw_method': 'pc_logistic', 'iw_clip_max': 4.0, 'iw_prob_clip': 0.0008778266698837462, 'iw_n_components': 100, 'iw_logistic_c': 0.0006727554382930795, 'iw_pca_fit': 'combined', 'iw_solver': 'lbfgs', 'iw_rho': 0.85}. Best is trial 42 with value: 0.23467539324875272.
2026-06-02 00:59:07 | INFO | Trial 46 | outer=10 | alpha=2.970e+05 n_pcs=3000 (pc_topk) weight={'name': 'pc_logistic', 'floor': 1e-06, 'clip_max': 4.0, 'prob_clip': 0.0011788830435761997, 'n_components': 100, 'logistic_c': 0.0008240137595679782, 'pca_fit': 'combined', 'solver': 'lbfgs', 'max_iter': 2000, 'fit_intercept': True, 'standardize_with_source': True, 'rho': 0.85}
[I 2026-06-02 00:59:20,193] Trial 46 finished with value: 0.23286627271774787 and parameters: {'alpha': 297039.0059768282, 'n_pcs': 3000, 'iw_method': 'pc_logistic', 'iw_clip_max': 4.0, 'iw_prob_clip': 0.0011788830435761997, 'iw_n_components': 100, 'iw_logistic_c': 0.0008240137595679782, 'iw_pca_fit': 'combined', 'iw_solver': 'lbfgs', 'iw_rho': 0.85}. Best is trial 42 with value: 0.23467539324875272.
2026-06-02 00:59:20 | INFO | Trial 47 | outer=10 | alpha=4.428e+04 n_pcs=4000 (pc_topk) weight={'name': 'uniform'}
[I 2026-06-02 00:59:27,505] Trial 47 finished with value: 0.22498396098306167 and parameters: {'alpha': 44280.93828854799, 'n_pcs': 4000, 'iw_method': 'uniform'}. Best is trial 42 with value: 0.23467539324875272.
2026-06-02 00:59:27 | INFO | Trial 48 | outer=10 | alpha=5.510e+05 n_pcs=3000 (pc_topk) weight={'name': 'pc_logistic', 'floor': 1e-06, 'clip_max': 2.5, 'prob_clip': 0.0007275653395697213, 'n_components': 100, 'logistic_c': 0.28055104993336605, 'pca_fit': 'combined', 'solver': 'lbfgs', 'max_iter': 2000, 'fit_intercept': True, 'standardize_with_source': True, 'rho': 0.85}
[I 2026-06-02 00:59:44,900] Trial 48 finished with value: 0.2305752144355219 and parameters: {'alpha': 550967.9003492254, 'n_pcs': 3000, 'iw_method': 'pc_logistic', 'iw_clip_max': 2.5, 'iw_prob_clip': 0.0007275653395697213, 'iw_n_components': 100, 'iw_logistic_c': 0.28055104993336605, 'iw_pca_fit': 'combined', 'iw_solver': 'lbfgs', 'iw_rho': 0.85}. Best is trial 42 with value: 0.23467539324875272.
2026-06-02 00:59:44 | INFO | Trial 49 | outer=10 | alpha=1.493e+06 n_pcs=3000 (pc_topk) weight={'name': 'pc_logistic', 'floor': 1e-06, 'clip_max': 4.0, 'prob_clip': 0.0005317407649822512, 'n_components': 100, 'logistic_c': 9.229017417339238, 'pca_fit': 'combined', 'solver': 'lbfgs', 'max_iter': 2000, 'fit_intercept': True, 'standardize_with_source': True, 'rho': 0.85}
[I 2026-06-02 01:00:02,953] Trial 49 finished with value: 0.22720937597743157 and parameters: {'alpha': 1492581.5799418022, 'n_pcs': 3000, 'iw_method': 'pc_logistic', 'iw_clip_max': 4.0, 'iw_prob_clip': 0.0005317407649822512, 'iw_n_components': 100, 'iw_logistic_c': 9.229017417339238, 'iw_pca_fit': 'combined', 'iw_solver': 'lbfgs', 'iw_rho': 0.85}. Best is trial 42 with value: 0.23467539324875272.
2026-06-02 01:00:02 | INFO | Trial 50 | outer=10 | alpha=1.489e+05 n_pcs=3500 (pc_topk) weight={'name': 'uniform'}
[I 2026-06-02 01:00:09,120] Trial 50 finished with value: 0.22010352622435522 and parameters: {'alpha': 148871.24071569464, 'n_pcs': 3500, 'iw_method': 'uniform'}. Best is trial 42 with value: 0.23467539324875272.
2026-06-02 01:00:09 | INFO | Trial 51 | outer=10 | alpha=5.638e+04 n_pcs=3000 (pc_topk) weight={'name': 'pc_logistic', 'floor': 1e-06, 'clip_max': 4.0, 'prob_clip': 0.0007830327510918798, 'n_components': 100, 'logistic_c': 0.0003344578025705189, 'pca_fit': 'combined', 'solver': 'lbfgs', 'max_iter': 2000, 'fit_intercept': True, 'standardize_with_source': True, 'rho': 0.85}
[I 2026-06-02 01:00:20,287] Trial 51 finished with value: 0.22907913487062004 and parameters: {'alpha': 56376.63958365815, 'n_pcs': 3000, 'iw_method': 'pc_logistic', 'iw_clip_max': 4.0, 'iw_prob_clip': 0.0007830327510918798, 'iw_n_components': 100, 'iw_logistic_c': 0.0003344578025705189, 'iw_pca_fit': 'combined', 'iw_solver': 'lbfgs', 'iw_rho': 0.85}. Best is trial 42 with value: 0.23467539324875272.
2026-06-02 01:00:20 | INFO | Trial 52 | outer=10 | alpha=1.202e+05 n_pcs=2500 (pc_topk) weight={'name': 'pc_logistic', 'floor': 1e-06, 'clip_max': 4.0, 'prob_clip': 0.0010688396364610345, 'n_components': 100, 'logistic_c': 0.0008772676869164155, 'pca_fit': 'combined', 'solver': 'lbfgs', 'max_iter': 2000, 'fit_intercept': True, 'standardize_with_source': True, 'rho': 0.85}
[I 2026-06-02 01:00:31,579] Trial 52 finished with value: 0.23190254166190344 and parameters: {'alpha': 120194.25174171996, 'n_pcs': 2500, 'iw_method': 'pc_logistic', 'iw_clip_max': 4.0, 'iw_prob_clip': 0.0010688396364610345, 'iw_n_components': 100, 'iw_logistic_c': 0.0008772676869164155, 'iw_pca_fit': 'combined', 'iw_solver': 'lbfgs', 'iw_rho': 0.85}. Best is trial 42 with value: 0.23467539324875272.
2026-06-02 01:00:31 | INFO | Trial 53 | outer=10 | alpha=3.167e+04 n_pcs=2000 (pc_topk) weight={'name': 'pc_logistic', 'floor': 1e-06, 'clip_max': 4.0, 'prob_clip': 0.0016700029425230183, 'n_components': 100, 'logistic_c': 5.798544518538179e-05, 'pca_fit': 'combined', 'solver': 'lbfgs', 'max_iter': 2000, 'fit_intercept': True, 'standardize_with_source': True, 'rho': 1.0}
[I 2026-06-02 01:00:39,745] Trial 53 finished with value: 0.20476322734994246 and parameters: {'alpha': 31667.79311779677, 'n_pcs': 2000, 'iw_method': 'pc_logistic', 'iw_clip_max': 4.0, 'iw_prob_clip': 0.0016700029425230183, 'iw_n_components': 100, 'iw_logistic_c': 5.798544518538179e-05, 'iw_pca_fit': 'combined', 'iw_solver': 'lbfgs', 'iw_rho': 1.0}. Best is trial 42 with value: 0.23467539324875272.
2026-06-02 01:00:39 | INFO | Trial 54 | outer=10 | alpha=1.087e+05 n_pcs=3000 (pc_topk) weight={'name': 'pc_logistic', 'floor': 1e-06, 'clip_max': 4.0, 'prob_clip': 0.0006523952969510954, 'n_components': 100, 'logistic_c': 0.00037202912397100226, 'pca_fit': 'combined', 'solver': 'lbfgs', 'max_iter': 2000, 'fit_intercept': True, 'standardize_with_source': True, 'rho': 0.85}
[I 2026-06-02 01:00:51,702] Trial 54 finished with value: 0.2343536093484171 and parameters: {'alpha': 108729.32734455557, 'n_pcs': 3000, 'iw_method': 'pc_logistic', 'iw_clip_max': 4.0, 'iw_prob_clip': 0.0006523952969510954, 'iw_n_components': 100, 'iw_logistic_c': 0.00037202912397100226, 'iw_pca_fit': 'combined', 'iw_solver': 'lbfgs', 'iw_rho': 0.85}. Best is trial 42 with value: 0.23467539324875272.
2026-06-02 01:00:51 | INFO | Trial 55 | outer=10 | alpha=2.327e+05 n_pcs=3500 (pc_topk) weight={'name': 'pc_logistic', 'floor': 1e-06, 'clip_max': 1.5, 'prob_clip': 0.0006939123374892206, 'n_components': 20, 'logistic_c': 0.007938184598082597, 'pca_fit': 'combined', 'solver': 'lbfgs', 'max_iter': 2000, 'fit_intercept': True, 'standardize_with_source': True, 'rho': 0.85}
[I 2026-06-02 01:01:05,625] Trial 55 finished with value: 0.2264408587469749 and parameters: {'alpha': 232687.3207314438, 'n_pcs': 3500, 'iw_method': 'pc_logistic', 'iw_clip_max': 1.5, 'iw_prob_clip': 0.0006939123374892206, 'iw_n_components': 20, 'iw_logistic_c': 0.007938184598082597, 'iw_pca_fit': 'combined', 'iw_solver': 'lbfgs', 'iw_rho': 0.85}. Best is trial 42 with value: 0.23467539324875272.
2026-06-02 01:01:05 | INFO | Trial 56 | outer=10 | alpha=6.381e+04 n_pcs=3000 (pc_topk) weight={'name': 'pc_logistic', 'floor': 1e-06, 'clip_max': 7.0, 'prob_clip': 0.0012900530962612175, 'n_components': 100, 'logistic_c': 0.0013004857625044592, 'pca_fit': 'combined', 'solver': 'lbfgs', 'max_iter': 2000, 'fit_intercept': True, 'standardize_with_source': True, 'rho': 0.85}
[I 2026-06-02 01:01:18,497] Trial 56 finished with value: 0.22568475313478933 and parameters: {'alpha': 63810.26929167067, 'n_pcs': 3000, 'iw_method': 'pc_logistic', 'iw_clip_max': 7.0, 'iw_prob_clip': 0.0012900530962612175, 'iw_n_components': 100, 'iw_logistic_c': 0.0013004857625044592, 'iw_pca_fit': 'combined', 'iw_solver': 'lbfgs', 'iw_rho': 0.85}. Best is trial 42 with value: 0.23467539324875272.
2026-06-02 01:01:18 | INFO | Trial 57 | outer=10 | alpha=1.427e+04 n_pcs=4000 (pc_topk) weight={'name': 'pc_logistic', 'floor': 1e-06, 'clip_max': 4.0, 'prob_clip': 0.0005388911460398828, 'n_components': 60, 'logistic_c': 0.00034278276233950535, 'pca_fit': 'combined', 'solver': 'lbfgs', 'max_iter': 2000, 'fit_intercept': True, 'standardize_with_source': True, 'rho': 0.85}
[I 2026-06-02 01:01:32,669] Trial 57 finished with value: 0.20049566821099854 and parameters: {'alpha': 14273.82565837581, 'n_pcs': 4000, 'iw_method': 'pc_logistic', 'iw_clip_max': 4.0, 'iw_prob_clip': 0.0005388911460398828, 'iw_n_components': 60, 'iw_logistic_c': 0.00034278276233950535, 'iw_pca_fit': 'combined', 'iw_solver': 'lbfgs', 'iw_rho': 0.85}. Best is trial 42 with value: 0.23467539324875272.
2026-06-02 01:01:32 | INFO | Trial 58 | outer=10 | alpha=3.343e+05 n_pcs=3500 (pc_topk) weight={'name': 'uniform'}
[I 2026-06-02 01:01:38,799] Trial 58 finished with value: 0.2124818387367621 and parameters: {'alpha': 334324.1338606633, 'n_pcs': 3500, 'iw_method': 'uniform'}. Best is trial 42 with value: 0.23467539324875272.
2026-06-02 01:01:38 | INFO | Trial 59 | outer=10 | alpha=8.761e+05 n_pcs=4000 (pc_topk) weight={'name': 'pc_logistic', 'floor': 1e-06, 'clip_max': 2.5, 'prob_clip': 0.0008756856286532377, 'n_components': 80, 'logistic_c': 7.761034316984829e-06, 'pca_fit': 'combined', 'solver': 'lbfgs', 'max_iter': 2000, 'fit_intercept': True, 'standardize_with_source': True, 'rho': 0.5}
[I 2026-06-02 01:01:51,502] Trial 59 finished with value: 0.21541658550643433 and parameters: {'alpha': 876104.0129723779, 'n_pcs': 4000, 'iw_method': 'pc_logistic', 'iw_clip_max': 2.5, 'iw_prob_clip': 0.0008756856286532377, 'iw_n_components': 80, 'iw_logistic_c': 7.761034316984829e-06, 'iw_pca_fit': 'combined', 'iw_solver': 'lbfgs', 'iw_rho': 0.5}. Best is trial 42 with value: 0.23467539324875272.
2026-06-02 01:01:51 | INFO | Trial 60 | outer=10 | alpha=2.034e+05 n_pcs=3500 (pc_topk) weight={'name': 'pc_logistic', 'floor': 1e-06, 'clip_max': 4.0, 'prob_clip': 0.0006583327416552446, 'n_components': 100, 'logistic_c': 0.00044606747032045866, 'pca_fit': 'combined', 'solver': 'lbfgs', 'max_iter': 2000, 'fit_intercept': True, 'standardize_with_source': True, 'rho': 0.85}
[I 2026-06-02 01:02:05,372] Trial 60 finished with value: 0.2347810432501991 and parameters: {'alpha': 203366.16665478575, 'n_pcs': 3500, 'iw_method': 'pc_logistic', 'iw_clip_max': 4.0, 'iw_prob_clip': 0.0006583327416552446, 'iw_n_components': 100, 'iw_logistic_c': 0.00044606747032045866, 'iw_pca_fit': 'combined', 'iw_solver': 'lbfgs', 'iw_rho': 0.85}. Best is trial 60 with value: 0.2347810432501991.
2026-06-02 01:02:05 | INFO | Trial 61 | outer=10 | alpha=1.880e+05 n_pcs=3500 (pc_topk) weight={'name': 'pc_logistic', 'floor': 1e-06, 'clip_max': 4.0, 'prob_clip': 0.000626354349453701, 'n_components': 100, 'logistic_c': 0.0005478611177026978, 'pca_fit': 'combined', 'solver': 'lbfgs', 'max_iter': 2000, 'fit_intercept': True, 'standardize_with_source': True, 'rho': 0.85}
[I 2026-06-02 01:02:19,332] Trial 61 finished with value: 0.2346549953140374 and parameters: {'alpha': 187987.0489335803, 'n_pcs': 3500, 'iw_method': 'pc_logistic', 'iw_clip_max': 4.0, 'iw_prob_clip': 0.000626354349453701, 'iw_n_components': 100, 'iw_logistic_c': 0.0005478611177026978, 'iw_pca_fit': 'combined', 'iw_solver': 'lbfgs', 'iw_rho': 0.85}. Best is trial 60 with value: 0.2347810432501991.
2026-06-02 01:02:19 | INFO | Trial 62 | outer=10 | alpha=2.017e+05 n_pcs=3500 (pc_topk) weight={'name': 'pc_logistic', 'floor': 1e-06, 'clip_max': 4.0, 'prob_clip': 0.0006464046155454265, 'n_components': 100, 'logistic_c': 0.0003284449865318771, 'pca_fit': 'combined', 'solver': 'lbfgs', 'max_iter': 2000, 'fit_intercept': True, 'standardize_with_source': True, 'rho': 0.85}
[I 2026-06-02 01:02:32,003] Trial 62 finished with value: 0.23521423507516417 and parameters: {'alpha': 201696.44020669413, 'n_pcs': 3500, 'iw_method': 'pc_logistic', 'iw_clip_max': 4.0, 'iw_prob_clip': 0.0006464046155454265, 'iw_n_components': 100, 'iw_logistic_c': 0.0003284449865318771, 'iw_pca_fit': 'combined', 'iw_solver': 'lbfgs', 'iw_rho': 0.85}. Best is trial 62 with value: 0.23521423507516417.
2026-06-02 01:02:32 | INFO | Trial 63 | outer=10 | alpha=5.940e+05 n_pcs=3500 (pc_topk) weight={'name': 'pc_logistic', 'floor': 1e-06, 'clip_max': 4.0, 'prob_clip': 0.0006195492512082963, 'n_components': 100, 'logistic_c': 0.0003087813084157812, 'pca_fit': 'combined', 'solver': 'lbfgs', 'max_iter': 2000, 'fit_intercept': True, 'standardize_with_source': True, 'rho': 1.0}
[I 2026-06-02 01:02:45,015] Trial 63 finished with value: 0.22434963000139777 and parameters: {'alpha': 593963.0619287156, 'n_pcs': 3500, 'iw_method': 'pc_logistic', 'iw_clip_max': 4.0, 'iw_prob_clip': 0.0006195492512082963, 'iw_n_components': 100, 'iw_logistic_c': 0.0003087813084157812, 'iw_pca_fit': 'combined', 'iw_solver': 'lbfgs', 'iw_rho': 1.0}. Best is trial 62 with value: 0.23521423507516417.
2026-06-02 01:02:45 | INFO | Trial 64 | outer=10 | alpha=1.968e+05 n_pcs=4000 (pc_topk) weight={'name': 'pc_logistic', 'floor': 1e-06, 'clip_max': 4.0, 'prob_clip': 0.000501075067956158, 'n_components': 100, 'logistic_c': 5.7239089043622965e-05, 'pca_fit': 'combined', 'solver': 'lbfgs', 'max_iter': 2000, 'fit_intercept': True, 'standardize_with_source': True, 'rho': 0.85}
[I 2026-06-02 01:02:58,103] Trial 64 finished with value: 0.234815428959309 and parameters: {'alpha': 196757.16718633298, 'n_pcs': 4000, 'iw_method': 'pc_logistic', 'iw_clip_max': 4.0, 'iw_prob_clip': 0.000501075067956158, 'iw_n_components': 100, 'iw_logistic_c': 5.7239089043622965e-05, 'iw_pca_fit': 'combined', 'iw_solver': 'lbfgs', 'iw_rho': 0.85}. Best is trial 62 with value: 0.23521423507516417.
2026-06-02 01:02:58 | INFO | Trial 65 | outer=10 | alpha=2.068e+05 n_pcs=4500 (pc_topk) weight={'name': 'pc_logistic', 'floor': 1e-06, 'clip_max': 4.0, 'prob_clip': 0.0006144496333330045, 'n_components': 100, 'logistic_c': 1.656724571494651e-05, 'pca_fit': 'combined', 'solver': 'lbfgs', 'max_iter': 2000, 'fit_intercept': True, 'standardize_with_source': True, 'rho': 0.85}
[I 2026-06-02 01:03:13,483] Trial 65 finished with value: 0.2333841347693221 and parameters: {'alpha': 206832.97500326327, 'n_pcs': 4500, 'iw_method': 'pc_logistic', 'iw_clip_max': 4.0, 'iw_prob_clip': 0.0006144496333330045, 'iw_n_components': 100, 'iw_logistic_c': 1.656724571494651e-05, 'iw_pca_fit': 'combined', 'iw_solver': 'lbfgs', 'iw_rho': 0.85}. Best is trial 62 with value: 0.23521423507516417.
2026-06-02 01:03:13 | INFO | Trial 66 | outer=10 | alpha=4.130e+05 n_pcs=4000 (pc_topk) weight={'name': 'pc_logistic', 'floor': 1e-06, 'clip_max': 1.5, 'prob_clip': 0.0005034935083569859, 'n_components': 20, 'logistic_c': 5.96934575056585e-05, 'pca_fit': 'combined', 'solver': 'lbfgs', 'max_iter': 2000, 'fit_intercept': True, 'standardize_with_source': True, 'rho': 0.85}
[I 2026-06-02 01:03:26,986] Trial 66 finished with value: 0.22123163273502136 and parameters: {'alpha': 412979.9628481202, 'n_pcs': 4000, 'iw_method': 'pc_logistic', 'iw_clip_max': 1.5, 'iw_prob_clip': 0.0005034935083569859, 'iw_n_components': 20, 'iw_logistic_c': 5.96934575056585e-05, 'iw_pca_fit': 'combined', 'iw_solver': 'lbfgs', 'iw_rho': 0.85}. Best is trial 62 with value: 0.23521423507516417.
2026-06-02 01:03:27 | INFO | Trial 67 | outer=10 | alpha=3.033e+05 n_pcs=5000 (pc_topk) weight={'name': 'pc_logistic', 'floor': 1e-06, 'clip_max': 4.0, 'prob_clip': 0.000656368927459762, 'n_components': 100, 'logistic_c': 5.331016410727631e-05, 'pca_fit': 'combined', 'solver': 'lbfgs', 'max_iter': 2000, 'fit_intercept': True, 'standardize_with_source': True, 'rho': 0.5}
[I 2026-06-02 01:03:43,643] Trial 67 finished with value: 0.22946030984788185 and parameters: {'alpha': 303305.8194097351, 'n_pcs': 5000, 'iw_method': 'pc_logistic', 'iw_clip_max': 4.0, 'iw_prob_clip': 0.000656368927459762, 'iw_n_components': 100, 'iw_logistic_c': 5.331016410727631e-05, 'iw_pca_fit': 'combined', 'iw_solver': 'lbfgs', 'iw_rho': 0.5}. Best is trial 62 with value: 0.23521423507516417.
2026-06-02 01:03:43 | INFO | Trial 68 | outer=10 | alpha=1.939e+05 n_pcs=3500 (pc_topk) weight={'name': 'uniform'}
[I 2026-06-02 01:03:49,696] Trial 68 finished with value: 0.21772804973720103 and parameters: {'alpha': 193923.41543344542, 'n_pcs': 3500, 'iw_method': 'uniform'}. Best is trial 62 with value: 0.23521423507516417.
2026-06-02 01:03:49 | INFO | Trial 69 | outer=10 | alpha=2.587e+05 n_pcs=4000 (pc_topk) weight={'name': 'pc_logistic', 'floor': 1e-06, 'clip_max': 2.5, 'prob_clip': 0.0007578307469071089, 'n_components': 60, 'logistic_c': 1.6018585714621467e-06, 'pca_fit': 'combined', 'solver': 'lbfgs', 'max_iter': 2000, 'fit_intercept': True, 'standardize_with_source': True, 'rho': 0.85}
[I 2026-06-02 01:04:01,126] Trial 69 finished with value: 0.21994118586714503 and parameters: {'alpha': 258707.5808535736, 'n_pcs': 4000, 'iw_method': 'pc_logistic', 'iw_clip_max': 2.5, 'iw_prob_clip': 0.0007578307469071089, 'iw_n_components': 60, 'iw_logistic_c': 1.6018585714621467e-06, 'iw_pca_fit': 'combined', 'iw_solver': 'lbfgs', 'iw_rho': 0.85}. Best is trial 62 with value: 0.23521423507516417.
2026-06-02 01:04:01 | INFO | Trial 70 | outer=10 | alpha=5.861e+04 n_pcs=4000 (pc_topk) weight={'name': 'pc_logistic', 'floor': 1e-06, 'clip_max': 7.0, 'prob_clip': 0.0005004495669209474, 'n_components': 80, 'logistic_c': 0.0013891305106254197, 'pca_fit': 'combined', 'solver': 'lbfgs', 'max_iter': 2000, 'fit_intercept': True, 'standardize_with_source': True, 'rho': 0.85}
[I 2026-06-02 01:04:16,584] Trial 70 finished with value: 0.22239321806316542 and parameters: {'alpha': 58610.3565171574, 'n_pcs': 4000, 'iw_method': 'pc_logistic', 'iw_clip_max': 7.0, 'iw_prob_clip': 0.0005004495669209474, 'iw_n_components': 80, 'iw_logistic_c': 0.0013891305106254197, 'iw_pca_fit': 'combined', 'iw_solver': 'lbfgs', 'iw_rho': 0.85}. Best is trial 62 with value: 0.23521423507516417.
2026-06-02 01:04:16 | INFO | Trial 71 | outer=10 | alpha=1.616e+05 n_pcs=3500 (pc_topk) weight={'name': 'pc_logistic', 'floor': 1e-06, 'clip_max': 4.0, 'prob_clip': 0.0011041354719080914, 'n_components': 100, 'logistic_c': 0.00023139557815340188, 'pca_fit': 'combined', 'solver': 'lbfgs', 'max_iter': 2000, 'fit_intercept': True, 'standardize_with_source': True, 'rho': 0.85}
[I 2026-06-02 01:04:28,939] Trial 71 finished with value: 0.23573846843134186 and parameters: {'alpha': 161643.9526552564, 'n_pcs': 3500, 'iw_method': 'pc_logistic', 'iw_clip_max': 4.0, 'iw_prob_clip': 0.0011041354719080914, 'iw_n_components': 100, 'iw_logistic_c': 0.00023139557815340188, 'iw_pca_fit': 'combined', 'iw_solver': 'lbfgs', 'iw_rho': 0.85}. Best is trial 71 with value: 0.23573846843134186.
2026-06-02 01:04:28 | INFO | Trial 72 | outer=10 | alpha=1.680e+05 n_pcs=3500 (pc_topk) weight={'name': 'pc_logistic', 'floor': 1e-06, 'clip_max': 4.0, 'prob_clip': 0.000642012700191552, 'n_components': 100, 'logistic_c': 0.00024768716085945755, 'pca_fit': 'combined', 'solver': 'lbfgs', 'max_iter': 2000, 'fit_intercept': True, 'standardize_with_source': True, 'rho': 0.85}
