[I 2026-06-01 02:17:09,255] Trial 259 finished with value: 0.23459437247105047 and parameters: {'alpha': 163800.84646957132, 'n_pcs': 3000, 'weight_scheme': 'exponential', 'weight_clip_max': 3.0, 'weight_exponential_beta': 8.612829726355935}. Best is trial 174 with value: 0.23469062114588263.
2026-06-01 02:17:09 | INFO | src.nested_cv_avggrm_weighted_unified | Trial 260 | outer=9 | alpha=1.867e+05 n_pcs=3000 (pc_topk) weight_search=on
2026-06-01 02:17:09 | INFO | src.nested_cv_avggrm_weighted_unified | Trial 260 | outer=9 | weight={'name': 'exponential', 'floor': 1e-06, 'clip_max': 3.0, 'beta': 8.409621840634777}
[I 2026-06-01 02:17:13,148] Trial 260 finished with value: 0.2346768770032322 and parameters: {'alpha': 186656.2207471734, 'n_pcs': 3000, 'weight_scheme': 'exponential', 'weight_clip_max': 3.0, 'weight_exponential_beta': 8.409621840634777}. Best is trial 174 with value: 0.23469062114588263.
2026-06-01 02:17:13 | INFO | src.nested_cv_avggrm_weighted_unified | Trial 261 | outer=9 | alpha=2.000e+05 n_pcs=2500 (pc_topk) weight_search=on
2026-06-01 02:17:13 | INFO | src.nested_cv_avggrm_weighted_unified | Trial 261 | outer=9 | weight={'name': 'exponential', 'floor': 1e-06, 'clip_max': 20.0, 'beta': 8.059616459840331}
2026-06-01 02:17:15 | INFO | src.nested_cv_avggrm_weighted_unified | Trial 261 | outer=9 | pruned after 8/10 inner folds (mean r=0.2505)
[I 2026-06-01 02:17:15,548] Trial 261 pruned. 
2026-06-01 02:17:15 | INFO | src.nested_cv_avggrm_weighted_unified | Trial 262 | outer=9 | alpha=2.551e+05 n_pcs=3000 (pc_topk) weight_search=on
2026-06-01 02:17:15 | INFO | src.nested_cv_avggrm_weighted_unified | Trial 262 | outer=9 | weight={'name': 'exponential', 'floor': 1e-06, 'clip_max': 3.0, 'beta': 8.33657188531435}
[I 2026-06-01 02:17:19,583] Trial 262 finished with value: 0.2342090626150509 and parameters: {'alpha': 255074.01683680623, 'n_pcs': 3000, 'weight_scheme': 'exponential', 'weight_clip_max': 3.0, 'weight_exponential_beta': 8.33657188531435}. Best is trial 174 with value: 0.23469062114588263.
2026-06-01 02:17:19 | INFO | src.nested_cv_avggrm_weighted_unified | Trial 263 | outer=9 | alpha=1.257e+05 n_pcs=3000 (pc_topk) weight_search=on
2026-06-01 02:17:19 | INFO | src.nested_cv_avggrm_weighted_unified | Trial 263 | outer=9 | weight={'name': 'exponential', 'floor': 1e-06, 'clip_max': 3.0, 'beta': 8.44307802556246}
[I 2026-06-01 02:17:23,466] Trial 263 finished with value: 0.23408344683850144 and parameters: {'alpha': 125735.70892031473, 'n_pcs': 3000, 'weight_scheme': 'exponential', 'weight_clip_max': 3.0, 'weight_exponential_beta': 8.44307802556246}. Best is trial 174 with value: 0.23469062114588263.
2026-06-01 02:17:23 | INFO | src.nested_cv_avggrm_weighted_unified | Trial 264 | outer=9 | alpha=1.866e+05 n_pcs=3000 (pc_topk) weight_search=on
2026-06-01 02:17:23 | INFO | src.nested_cv_avggrm_weighted_unified | Trial 264 | outer=9 | weight={'name': 'exponential', 'floor': 1e-06, 'clip_max': 3.0, 'beta': 8.185257388574986}
[I 2026-06-01 02:17:27,299] Trial 264 finished with value: 0.2346132924932353 and parameters: {'alpha': 186647.4354608651, 'n_pcs': 3000, 'weight_scheme': 'exponential', 'weight_clip_max': 3.0, 'weight_exponential_beta': 8.185257388574986}. Best is trial 174 with value: 0.23469062114588263.
2026-06-01 02:17:27 | INFO | src.nested_cv_avggrm_weighted_unified | Trial 265 | outer=9 | alpha=2.356e+05 n_pcs=3000 (pc_topk) weight_search=on
2026-06-01 02:17:27 | INFO | src.nested_cv_avggrm_weighted_unified | Trial 265 | outer=9 | weight={'name': 'linear', 'floor': 1e-06, 'clip_max': 3.0, 'min_weight': 0.3677913636358858, 'max_weight': 2.9759233410487256}
2026-06-01 02:17:30 | INFO | src.nested_cv_avggrm_weighted_unified | Trial 265 | outer=9 | pruned after 8/10 inner folds (mean r=0.2637)
[I 2026-06-01 02:17:30,388] Trial 265 pruned. 
2026-06-01 02:17:30 | INFO | src.nested_cv_avggrm_weighted_unified | Trial 266 | outer=9 | alpha=1.466e+05 n_pcs=3000 (pc_topk) weight_search=on
2026-06-01 02:17:30 | INFO | src.nested_cv_avggrm_weighted_unified | Trial 266 | outer=9 | weight={'name': 'exponential', 'floor': 1e-06, 'clip_max': 3.0, 'beta': 8.393162859146564}
[I 2026-06-01 02:17:34,727] Trial 266 finished with value: 0.23449242124452935 and parameters: {'alpha': 146598.2867538307, 'n_pcs': 3000, 'weight_scheme': 'exponential', 'weight_clip_max': 3.0, 'weight_exponential_beta': 8.393162859146564}. Best is trial 174 with value: 0.23469062114588263.
2026-06-01 02:17:34 | INFO | src.nested_cv_avggrm_weighted_unified | Trial 267 | outer=9 | alpha=3.213e+05 n_pcs=3000 (pc_topk) weight_search=on
2026-06-01 02:17:34 | INFO | src.nested_cv_avggrm_weighted_unified | Trial 267 | outer=9 | weight={'name': 'exponential', 'floor': 1e-06, 'clip_max': 3.0, 'beta': 8.667299707672631}
[I 2026-06-01 02:17:38,554] Trial 267 finished with value: 0.23376584860243468 and parameters: {'alpha': 321309.5920552279, 'n_pcs': 3000, 'weight_scheme': 'exponential', 'weight_clip_max': 3.0, 'weight_exponential_beta': 8.667299707672631}. Best is trial 174 with value: 0.23469062114588263.
2026-06-01 02:17:38 | INFO | src.nested_cv_avggrm_weighted_unified | Trial 268 | outer=9 | alpha=1.914e+05 n_pcs=3000 (pc_topk) weight_search=on
2026-06-01 02:17:38 | INFO | src.nested_cv_avggrm_weighted_unified | Trial 268 | outer=9 | weight={'name': 'exponential', 'floor': 1e-06, 'clip_max': 3.0, 'beta': 8.562163745268725}
[I 2026-06-01 02:17:42,450] Trial 268 finished with value: 0.23468219683703823 and parameters: {'alpha': 191441.7826306978, 'n_pcs': 3000, 'weight_scheme': 'exponential', 'weight_clip_max': 3.0, 'weight_exponential_beta': 8.562163745268725}. Best is trial 174 with value: 0.23469062114588263.
2026-06-01 02:17:42 | INFO | src.nested_cv_avggrm_weighted_unified | Trial 269 | outer=9 | alpha=1.516e+05 n_pcs=3500 (pc_topk) weight_search=on
2026-06-01 02:17:42 | INFO | src.nested_cv_avggrm_weighted_unified | Trial 269 | outer=9 | weight={'name': 'exponential', 'floor': 1e-06, 'clip_max': 5.0, 'beta': 8.061229900781042}
2026-06-01 02:17:46 | INFO | src.nested_cv_avggrm_weighted_unified | Trial 269 | outer=9 | pruned after 8/10 inner folds (mean r=0.2617)
[I 2026-06-01 02:17:46,571] Trial 269 pruned. 
2026-06-01 02:17:46 | INFO | src.nested_cv_avggrm_weighted_unified | Trial 270 | outer=9 | alpha=1.833e+05 n_pcs=2500 (pc_topk) weight_search=on
2026-06-01 02:17:46 | INFO | src.nested_cv_avggrm_weighted_unified | Trial 270 | outer=9 | weight={'name': 'exponential', 'floor': 1e-06, 'clip_max': 3.0, 'beta': 8.456041442331948}
2026-06-01 02:17:49 | INFO | src.nested_cv_avggrm_weighted_unified | Trial 270 | outer=9 | pruned after 8/10 inner folds (mean r=0.2642)
[I 2026-06-01 02:17:49,423] Trial 270 pruned. 
2026-06-01 02:17:49 | INFO | src.nested_cv_avggrm_weighted_unified | Trial 271 | outer=9 | alpha=1.134e+05 n_pcs=3000 (pc_topk) weight_search=on
2026-06-01 02:17:49 | INFO | src.nested_cv_avggrm_weighted_unified | Trial 271 | outer=9 | weight={'name': 'exponential', 'floor': 1e-06, 'clip_max': 3.0, 'beta': 8.560924104356808}
[I 2026-06-01 02:17:54,251] Trial 271 finished with value: 0.23358739972149217 and parameters: {'alpha': 113400.54033640084, 'n_pcs': 3000, 'weight_scheme': 'exponential', 'weight_clip_max': 3.0, 'weight_exponential_beta': 8.560924104356808}. Best is trial 174 with value: 0.23469062114588263.
2026-06-01 02:17:54 | INFO | src.nested_cv_avggrm_weighted_unified | Trial 272 | outer=9 | alpha=1.875e+05 n_pcs=3000 (pc_topk) weight_search=on
2026-06-01 02:17:54 | INFO | src.nested_cv_avggrm_weighted_unified | Trial 272 | outer=9 | weight={'name': 'exponential', 'floor': 1e-06, 'clip_max': 3.0, 'beta': 8.327806820104172}
[I 2026-06-01 02:17:58,106] Trial 272 finished with value: 0.23466636758902845 and parameters: {'alpha': 187476.2114317077, 'n_pcs': 3000, 'weight_scheme': 'exponential', 'weight_clip_max': 3.0, 'weight_exponential_beta': 8.327806820104172}. Best is trial 174 with value: 0.23469062114588263.
2026-06-01 02:17:58 | INFO | src.nested_cv_avggrm_weighted_unified | Trial 273 | outer=9 | alpha=2.748e+05 n_pcs=3000 (pc_topk) weight_search=on
2026-06-01 02:17:58 | INFO | src.nested_cv_avggrm_weighted_unified | Trial 273 | outer=9 | weight={'name': 'exponential', 'floor': 1e-06, 'clip_max': 3.0, 'beta': 8.213594158771299}
[I 2026-06-01 02:18:01,956] Trial 273 finished with value: 0.23388267753178993 and parameters: {'alpha': 274835.3443561594, 'n_pcs': 3000, 'weight_scheme': 'exponential', 'weight_clip_max': 3.0, 'weight_exponential_beta': 8.213594158771299}. Best is trial 174 with value: 0.23469062114588263.
2026-06-01 02:18:01 | INFO | src.nested_cv_avggrm_weighted_unified | Trial 274 | outer=9 | alpha=1.520e+05 n_pcs=3000 (pc_topk) weight_search=on
2026-06-01 02:18:01 | INFO | src.nested_cv_avggrm_weighted_unified | Trial 274 | outer=9 | weight={'name': 'exponential', 'floor': 1e-06, 'clip_max': 3.0, 'beta': 8.629674783908968}
[I 2026-06-01 02:18:05,804] Trial 274 finished with value: 0.234470945965987 and parameters: {'alpha': 151992.02192733056, 'n_pcs': 3000, 'weight_scheme': 'exponential', 'weight_clip_max': 3.0, 'weight_exponential_beta': 8.629674783908968}. Best is trial 174 with value: 0.23469062114588263.
2026-06-01 02:18:05 | INFO | src.nested_cv_avggrm_weighted_unified | Trial 275 | outer=9 | alpha=1.318e+05 n_pcs=3000 (pc_topk) weight_search=on
2026-06-01 02:18:05 | INFO | src.nested_cv_avggrm_weighted_unified | Trial 275 | outer=9 | weight={'name': 'exponential', 'floor': 1e-06, 'clip_max': 3.0, 'beta': 7.934301333734669}
[I 2026-06-01 02:18:09,726] Trial 275 finished with value: 0.23433865261137457 and parameters: {'alpha': 131802.54179896982, 'n_pcs': 3000, 'weight_scheme': 'exponential', 'weight_clip_max': 3.0, 'weight_exponential_beta': 7.934301333734669}. Best is trial 174 with value: 0.23469062114588263.
2026-06-01 02:18:09 | INFO | src.nested_cv_avggrm_weighted_unified | Trial 276 | outer=9 | alpha=1.841e+05 n_pcs=3000 (pc_topk) weight_search=on
2026-06-01 02:18:09 | INFO | src.nested_cv_avggrm_weighted_unified | Trial 276 | outer=9 | weight={'name': 'exponential', 'floor': 1e-06, 'clip_max': None, 'beta': 8.586885469549458}
2026-06-01 02:18:12 | INFO | src.nested_cv_avggrm_weighted_unified | Trial 276 | outer=9 | pruned after 8/10 inner folds (mean r=0.2415)
[I 2026-06-01 02:18:12,820] Trial 276 pruned. 
2026-06-01 02:18:12 | INFO | src.nested_cv_avggrm_weighted_unified | Trial 277 | outer=9 | alpha=2.252e+05 n_pcs=3000 (pc_topk) weight_search=on
2026-06-01 02:18:12 | INFO | src.nested_cv_avggrm_weighted_unified | Trial 277 | outer=9 | weight={'name': 'exponential', 'floor': 1e-06, 'clip_max': 3.0, 'beta': 8.266468491635555}
[I 2026-06-01 02:18:16,929] Trial 277 finished with value: 0.23443603849175237 and parameters: {'alpha': 225215.1723772482, 'n_pcs': 3000, 'weight_scheme': 'exponential', 'weight_clip_max': 3.0, 'weight_exponential_beta': 8.266468491635555}. Best is trial 174 with value: 0.23469062114588263.
2026-06-01 02:18:16 | INFO | src.nested_cv_avggrm_weighted_unified | Trial 278 | outer=9 | alpha=2.806e+05 n_pcs=3500 (pc_topk) weight_search=on
2026-06-01 02:18:16 | INFO | src.nested_cv_avggrm_weighted_unified | Trial 278 | outer=9 | weight={'name': 'uniform', 'floor': 1e-06, 'clip_max': 3.0}
2026-06-01 02:18:19 | INFO | src.nested_cv_avggrm_weighted_unified | Trial 278 | outer=9 | pruned after 5/10 inner folds (mean r=0.2044)
[I 2026-06-01 02:18:19,028] Trial 278 pruned. 
2026-06-01 02:18:19 | INFO | src.nested_cv_avggrm_weighted_unified | Trial 279 | outer=9 | alpha=1.649e+05 n_pcs=2500 (pc_topk) weight_search=on
2026-06-01 02:18:19 | INFO | src.nested_cv_avggrm_weighted_unified | Trial 279 | outer=9 | weight={'name': 'exponential', 'floor': 1e-06, 'clip_max': 3.0, 'beta': 8.704303917130865}
2026-06-01 02:18:21 | INFO | src.nested_cv_avggrm_weighted_unified | Trial 279 | outer=9 | pruned after 8/10 inner folds (mean r=0.2630)
[I 2026-06-01 02:18:21,421] Trial 279 pruned. 
2026-06-01 02:18:21 | INFO | src.nested_cv_avggrm_weighted_unified | Trial 280 | outer=9 | alpha=9.974e+04 n_pcs=3000 (pc_topk) weight_search=on
2026-06-01 02:18:21 | INFO | src.nested_cv_avggrm_weighted_unified | Trial 280 | outer=9 | weight={'name': 'exponential', 'floor': 1e-06, 'clip_max': 10.0, 'beta': 8.476768081927297}
[I 2026-06-01 02:18:25,322] Trial 280 finished with value: 0.22621920134881696 and parameters: {'alpha': 99742.20207794626, 'n_pcs': 3000, 'weight_scheme': 'exponential', 'weight_clip_max': 10.0, 'weight_exponential_beta': 8.476768081927297}. Best is trial 174 with value: 0.23469062114588263.
2026-06-01 02:18:25 | INFO | src.nested_cv_avggrm_weighted_unified | Trial 281 | outer=9 | alpha=2.008e+05 n_pcs=3000 (pc_topk) weight_search=on
2026-06-01 02:18:25 | INFO | src.nested_cv_avggrm_weighted_unified | Trial 281 | outer=9 | weight={'name': 'exponential', 'floor': 1e-06, 'clip_max': 3.0, 'beta': 8.771575759467163}
[I 2026-06-01 02:18:29,413] Trial 281 finished with value: 0.23468117469195024 and parameters: {'alpha': 200822.79142374737, 'n_pcs': 3000, 'weight_scheme': 'exponential', 'weight_clip_max': 3.0, 'weight_exponential_beta': 8.771575759467163}. Best is trial 174 with value: 0.23469062114588263.
2026-06-01 02:18:29 | INFO | src.nested_cv_avggrm_weighted_unified | Trial 282 | outer=9 | alpha=2.373e+05 n_pcs=3000 (pc_topk) weight_search=on
2026-06-01 02:18:29 | INFO | src.nested_cv_avggrm_weighted_unified | Trial 282 | outer=9 | weight={'name': 'exponential', 'floor': 1e-06, 'clip_max': 3.0, 'beta': 8.821611315954735}
[I 2026-06-01 02:18:33,332] Trial 282 finished with value: 0.23457037692092514 and parameters: {'alpha': 237304.8960112415, 'n_pcs': 3000, 'weight_scheme': 'exponential', 'weight_clip_max': 3.0, 'weight_exponential_beta': 8.821611315954735}. Best is trial 174 with value: 0.23469062114588263.
2026-06-01 02:18:33 | INFO | src.nested_cv_avggrm_weighted_unified | Trial 283 | outer=9 | alpha=1.355e+05 n_pcs=3000 (pc_topk) weight_search=on
2026-06-01 02:18:33 | INFO | src.nested_cv_avggrm_weighted_unified | Trial 283 | outer=9 | weight={'name': 'exponential', 'floor': 1e-06, 'clip_max': 3.0, 'beta': 8.672651981975164}
[I 2026-06-01 02:18:37,379] Trial 283 finished with value: 0.23416171973884659 and parameters: {'alpha': 135537.37201640854, 'n_pcs': 3000, 'weight_scheme': 'exponential', 'weight_clip_max': 3.0, 'weight_exponential_beta': 8.672651981975164}. Best is trial 174 with value: 0.23469062114588263.
2026-06-01 02:18:37 | INFO | src.nested_cv_avggrm_weighted_unified | Trial 284 | outer=9 | alpha=1.647e+05 n_pcs=3000 (pc_topk) weight_search=on
2026-06-01 02:18:37 | INFO | src.nested_cv_avggrm_weighted_unified | Trial 284 | outer=9 | weight={'name': 'exponential', 'floor': 1e-06, 'clip_max': 3.0, 'beta': 8.801066925627948}
[I 2026-06-01 02:18:41,224] Trial 284 finished with value: 0.2345238860766446 and parameters: {'alpha': 164662.9761365893, 'n_pcs': 3000, 'weight_scheme': 'exponential', 'weight_clip_max': 3.0, 'weight_exponential_beta': 8.801066925627948}. Best is trial 174 with value: 0.23469062114588263.
2026-06-01 02:18:41 | INFO | src.nested_cv_avggrm_weighted_unified | Trial 285 | outer=9 | alpha=2.989e+05 n_pcs=3000 (pc_topk) weight_search=on
2026-06-01 02:18:41 | INFO | src.nested_cv_avggrm_weighted_unified | Trial 285 | outer=9 | weight={'name': 'exponential', 'floor': 1e-06, 'clip_max': 3.0, 'beta': 5.411647720853208}
[I 2026-06-01 02:18:45,071] Trial 285 finished with value: 0.23054048517768413 and parameters: {'alpha': 298853.2602530074, 'n_pcs': 3000, 'weight_scheme': 'exponential', 'weight_clip_max': 3.0, 'weight_exponential_beta': 5.411647720853208}. Best is trial 174 with value: 0.23469062114588263.
2026-06-01 02:18:45 | INFO | src.nested_cv_avggrm_weighted_unified | Trial 286 | outer=9 | alpha=1.996e+05 n_pcs=3000 (pc_topk) weight_search=on
2026-06-01 02:18:45 | INFO | src.nested_cv_avggrm_weighted_unified | Trial 286 | outer=9 | weight={'name': 'exponential', 'floor': 1e-06, 'clip_max': 20.0, 'beta': 8.536484063890745}
[I 2026-06-01 02:18:48,945] Trial 286 finished with value: 0.2230623144123213 and parameters: {'alpha': 199637.54744470146, 'n_pcs': 3000, 'weight_scheme': 'exponential', 'weight_clip_max': 20.0, 'weight_exponential_beta': 8.536484063890745}. Best is trial 174 with value: 0.23469062114588263.
2026-06-01 02:18:48 | INFO | src.nested_cv_avggrm_weighted_unified | Trial 287 | outer=9 | alpha=2.345e+05 n_pcs=3000 (pc_topk) weight_search=on
2026-06-01 02:18:48 | INFO | src.nested_cv_avggrm_weighted_unified | Trial 287 | outer=9 | weight={'name': 'exponential', 'floor': 1e-06, 'clip_max': 3.0, 'beta': 9.186937880767289}
[I 2026-06-01 02:18:52,801] Trial 287 finished with value: 0.23448269369364 and parameters: {'alpha': 234533.31986662443, 'n_pcs': 3000, 'weight_scheme': 'exponential', 'weight_clip_max': 3.0, 'weight_exponential_beta': 9.186937880767289}. Best is trial 174 with value: 0.23469062114588263.
2026-06-01 02:18:52 | INFO | src.nested_cv_avggrm_weighted_unified | Trial 288 | outer=9 | alpha=3.508e+05 n_pcs=2500 (pc_topk) weight_search=on
2026-06-01 02:18:52 | INFO | src.nested_cv_avggrm_weighted_unified | Trial 288 | outer=9 | weight={'name': 'exponential', 'floor': 1e-06, 'clip_max': 3.0, 'beta': 8.822177036635253}
[I 2026-06-01 02:18:55,764] Trial 288 finished with value: 0.2328803793025087 and parameters: {'alpha': 350804.9747161472, 'n_pcs': 2500, 'weight_scheme': 'exponential', 'weight_clip_max': 3.0, 'weight_exponential_beta': 8.822177036635253}. Best is trial 174 with value: 0.23469062114588263.
2026-06-01 02:18:55 | INFO | src.nested_cv_avggrm_weighted_unified | Trial 289 | outer=9 | alpha=2.033e+03 n_pcs=3000 (pc_topk) weight_search=on
2026-06-01 02:18:55 | INFO | src.nested_cv_avggrm_weighted_unified | Trial 289 | outer=9 | weight={'name': 'linear', 'floor': 1e-06, 'clip_max': 3.0, 'min_weight': 0.5799856280612514, 'max_weight': 4.492839681645879}
2026-06-01 02:18:57 | INFO | src.nested_cv_avggrm_weighted_unified | Trial 289 | outer=9 | pruned after 5/10 inner folds (mean r=0.1899)
[I 2026-06-01 02:18:57,693] Trial 289 pruned. 
2026-06-01 02:18:57 | INFO | src.nested_cv_avggrm_weighted_unified | Trial 290 | outer=9 | alpha=1.722e+05 n_pcs=3500 (pc_topk) weight_search=on
2026-06-01 02:18:57 | INFO | src.nested_cv_avggrm_weighted_unified | Trial 290 | outer=9 | weight={'name': 'exponential', 'floor': 1e-06, 'clip_max': 3.0, 'beta': 8.177550877898712}
2026-06-01 02:19:01 | INFO | src.nested_cv_avggrm_weighted_unified | Trial 290 | outer=9 | pruned after 8/10 inner folds (mean r=0.2653)
[I 2026-06-01 02:19:01,669] Trial 290 pruned. 
2026-06-01 02:19:01 | INFO | src.nested_cv_avggrm_weighted_unified | Trial 291 | outer=9 | alpha=2.476e+05 n_pcs=3000 (pc_topk) weight_search=on
2026-06-01 02:19:01 | INFO | src.nested_cv_avggrm_weighted_unified | Trial 291 | outer=9 | weight={'name': 'exponential', 'floor': 1e-06, 'clip_max': 3.0, 'beta': 9.085707567987296}
[I 2026-06-01 02:19:05,514] Trial 291 finished with value: 0.23448933518341325 and parameters: {'alpha': 247599.9584151848, 'n_pcs': 3000, 'weight_scheme': 'exponential', 'weight_clip_max': 3.0, 'weight_exponential_beta': 9.085707567987296}. Best is trial 174 with value: 0.23469062114588263.
2026-06-01 02:19:05 | INFO | src.nested_cv_avggrm_weighted_unified | Trial 292 | outer=9 | alpha=1.297e+05 n_pcs=3000 (pc_topk) weight_search=on
2026-06-01 02:19:05 | INFO | src.nested_cv_avggrm_weighted_unified | Trial 292 | outer=9 | weight={'name': 'exponential', 'floor': 1e-06, 'clip_max': 3.0, 'beta': 8.542580172277484}
[I 2026-06-01 02:19:09,374] Trial 292 finished with value: 0.23411053724043313 and parameters: {'alpha': 129685.61064461553, 'n_pcs': 3000, 'weight_scheme': 'exponential', 'weight_clip_max': 3.0, 'weight_exponential_beta': 8.542580172277484}. Best is trial 174 with value: 0.23469062114588263.
2026-06-01 02:19:09 | INFO | src.nested_cv_avggrm_weighted_unified | Trial 293 | outer=9 | alpha=1.992e+05 n_pcs=3000 (pc_topk) weight_search=on
2026-06-01 02:19:09 | INFO | src.nested_cv_avggrm_weighted_unified | Trial 293 | outer=9 | weight={'name': 'exponential', 'floor': 1e-06, 'clip_max': 3.0, 'beta': 8.715228007324296}
[I 2026-06-01 02:19:13,223] Trial 293 finished with value: 0.2346867392693134 and parameters: {'alpha': 199232.4738166841, 'n_pcs': 3000, 'weight_scheme': 'exponential', 'weight_clip_max': 3.0, 'weight_exponential_beta': 8.715228007324296}. Best is trial 174 with value: 0.23469062114588263.
2026-06-01 02:19:13 | INFO | src.nested_cv_avggrm_weighted_unified | Trial 294 | outer=9 | alpha=1.636e+05 n_pcs=3000 (pc_topk) weight_search=on
2026-06-01 02:19:13 | INFO | src.nested_cv_avggrm_weighted_unified | Trial 294 | outer=9 | weight={'name': 'exponential', 'floor': 1e-06, 'clip_max': 3.0, 'beta': 8.381557470738946}
[I 2026-06-01 02:19:17,057] Trial 294 finished with value: 0.23463677302472016 and parameters: {'alpha': 163639.27017124437, 'n_pcs': 3000, 'weight_scheme': 'exponential', 'weight_clip_max': 3.0, 'weight_exponential_beta': 8.381557470738946}. Best is trial 174 with value: 0.23469062114588263.
2026-06-01 02:19:17 | INFO | src.nested_cv_avggrm_weighted_unified | Trial 295 | outer=9 | alpha=1.892e+05 n_pcs=3000 (pc_topk) weight_search=on
2026-06-01 02:19:17 | INFO | src.nested_cv_avggrm_weighted_unified | Trial 295 | outer=9 | weight={'name': 'uniform', 'floor': 1e-06, 'clip_max': 5.0}
2026-06-01 02:19:18 | INFO | src.nested_cv_avggrm_weighted_unified | Trial 295 | outer=9 | pruned after 5/10 inner folds (mean r=0.2127)
[I 2026-06-01 02:19:18,686] Trial 295 pruned. 
2026-06-01 02:19:18 | INFO | src.nested_cv_avggrm_weighted_unified | Trial 296 | outer=9 | alpha=1.377e+05 n_pcs=3000 (pc_topk) weight_search=on
2026-06-01 02:19:18 | INFO | src.nested_cv_avggrm_weighted_unified | Trial 296 | outer=9 | weight={'name': 'exponential', 'floor': 1e-06, 'clip_max': 3.0, 'beta': 8.730771256655164}
