[I 2026-06-01 16:24:44,272] Trial 138 finished with value: 0.20590031631891584 and parameters: {'alpha': 143495.14755131849, 'n_pcs': 5000, 'iw_method': 'pc_logistic', 'iw_clip_max': 2.5, 'iw_prob_clip': 0.0008572631051960411, 'iw_n_components': 60, 'iw_logistic_c': 7.55856536883437e-06, 'iw_pca_fit': 'combined', 'iw_solver': 'lbfgs', 'iw_rho': 1.0}. Best is trial 137 with value: 0.2075589796886786.
2026-06-01 16:24:44 | INFO | Trial 139 | outer=3 | alpha=1.861e+05 n_pcs=4500 (pc_topk) weight={'name': 'pc_logistic', 'floor': 1e-06, 'clip_max': 2.5, 'prob_clip': 0.0006787056347389139, 'n_components': 40, 'logistic_c': 3.2449829204497344e-06, 'pca_fit': 'combined', 'solver': 'lbfgs', 'max_iter': 2000, 'fit_intercept': True, 'standardize_with_source': True, 'rho': 0.7}
[I 2026-06-01 16:24:59,673] Trial 139 finished with value: 0.20145735029401785 and parameters: {'alpha': 186112.41475256337, 'n_pcs': 4500, 'iw_method': 'pc_logistic', 'iw_clip_max': 2.5, 'iw_prob_clip': 0.0006787056347389139, 'iw_n_components': 40, 'iw_logistic_c': 3.2449829204497344e-06, 'iw_pca_fit': 'combined', 'iw_solver': 'lbfgs', 'iw_rho': 0.7}. Best is trial 137 with value: 0.2075589796886786.
2026-06-01 16:24:59 | INFO | Trial 140 | outer=3 | alpha=1.262e+05 n_pcs=4500 (pc_topk) weight={'name': 'pc_logistic', 'floor': 1e-06, 'clip_max': 2.5, 'prob_clip': 0.0005495952041269808, 'n_components': 60, 'logistic_c': 5.571131164814342e-05, 'pca_fit': 'combined', 'solver': 'lbfgs', 'max_iter': 2000, 'fit_intercept': True, 'standardize_with_source': True, 'rho': 0.7}
[I 2026-06-01 16:25:33,785] Trial 140 finished with value: 0.20743355262229451 and parameters: {'alpha': 126223.18665561496, 'n_pcs': 4500, 'iw_method': 'pc_logistic', 'iw_clip_max': 2.5, 'iw_prob_clip': 0.0005495952041269808, 'iw_n_components': 60, 'iw_logistic_c': 5.571131164814342e-05, 'iw_pca_fit': 'combined', 'iw_solver': 'lbfgs', 'iw_rho': 0.7}. Best is trial 137 with value: 0.2075589796886786.
2026-06-01 16:25:33 | INFO | Trial 141 | outer=3 | alpha=1.171e+05 n_pcs=4500 (pc_topk) weight={'name': 'pc_logistic', 'floor': 1e-06, 'clip_max': 2.5, 'prob_clip': 0.0005508562935652575, 'n_components': 60, 'logistic_c': 5.4172442502937574e-05, 'pca_fit': 'combined', 'solver': 'lbfgs', 'max_iter': 2000, 'fit_intercept': True, 'standardize_with_source': True, 'rho': 0.7}
[I 2026-06-01 16:25:50,528] Trial 141 finished with value: 0.20747814760281483 and parameters: {'alpha': 117086.56339850719, 'n_pcs': 4500, 'iw_method': 'pc_logistic', 'iw_clip_max': 2.5, 'iw_prob_clip': 0.0005508562935652575, 'iw_n_components': 60, 'iw_logistic_c': 5.4172442502937574e-05, 'iw_pca_fit': 'combined', 'iw_solver': 'lbfgs', 'iw_rho': 0.7}. Best is trial 137 with value: 0.2075589796886786.
2026-06-01 16:25:50 | INFO | Trial 142 | outer=3 | alpha=1.152e+05 n_pcs=4500 (pc_topk) weight={'name': 'pc_logistic', 'floor': 1e-06, 'clip_max': 2.5, 'prob_clip': 0.0005462880981496485, 'n_components': 60, 'logistic_c': 2.3013972462919105e-05, 'pca_fit': 'combined', 'solver': 'lbfgs', 'max_iter': 2000, 'fit_intercept': True, 'standardize_with_source': True, 'rho': 0.7}
[I 2026-06-01 16:26:05,246] Trial 142 finished with value: 0.20776885641827203 and parameters: {'alpha': 115217.65663763921, 'n_pcs': 4500, 'iw_method': 'pc_logistic', 'iw_clip_max': 2.5, 'iw_prob_clip': 0.0005462880981496485, 'iw_n_components': 60, 'iw_logistic_c': 2.3013972462919105e-05, 'iw_pca_fit': 'combined', 'iw_solver': 'lbfgs', 'iw_rho': 0.7}. Best is trial 142 with value: 0.20776885641827203.
2026-06-01 16:26:05 | INFO | Trial 143 | outer=3 | alpha=1.114e+05 n_pcs=4500 (pc_topk) weight={'name': 'pc_logistic', 'floor': 1e-06, 'clip_max': 2.5, 'prob_clip': 0.0005266445826390251, 'n_components': 60, 'logistic_c': 2.245752499372843e-05, 'pca_fit': 'combined', 'solver': 'lbfgs', 'max_iter': 2000, 'fit_intercept': True, 'standardize_with_source': True, 'rho': 0.7}
[I 2026-06-01 16:26:26,162] Trial 143 finished with value: 0.20778956638960144 and parameters: {'alpha': 111425.42996635255, 'n_pcs': 4500, 'iw_method': 'pc_logistic', 'iw_clip_max': 2.5, 'iw_prob_clip': 0.0005266445826390251, 'iw_n_components': 60, 'iw_logistic_c': 2.245752499372843e-05, 'iw_pca_fit': 'combined', 'iw_solver': 'lbfgs', 'iw_rho': 0.7}. Best is trial 143 with value: 0.20778956638960144.
2026-06-01 16:26:26 | INFO | Trial 144 | outer=3 | alpha=9.921e+04 n_pcs=4500 (pc_topk) weight={'name': 'pc_logistic', 'floor': 1e-06, 'clip_max': 2.5, 'prob_clip': 0.0005417377767204088, 'n_components': 60, 'logistic_c': 2.587396314879722e-05, 'pca_fit': 'combined', 'solver': 'lbfgs', 'max_iter': 2000, 'fit_intercept': True, 'standardize_with_source': True, 'rho': 0.7}
[I 2026-06-01 16:26:42,515] Trial 144 finished with value: 0.20790406387774057 and parameters: {'alpha': 99209.8078548744, 'n_pcs': 4500, 'iw_method': 'pc_logistic', 'iw_clip_max': 2.5, 'iw_prob_clip': 0.0005417377767204088, 'iw_n_components': 60, 'iw_logistic_c': 2.587396314879722e-05, 'iw_pca_fit': 'combined', 'iw_solver': 'lbfgs', 'iw_rho': 0.7}. Best is trial 144 with value: 0.20790406387774057.
2026-06-01 16:26:42 | INFO | Trial 145 | outer=3 | alpha=1.092e+05 n_pcs=4500 (pc_topk) weight={'name': 'pc_logistic', 'floor': 1e-06, 'clip_max': 2.5, 'prob_clip': 0.0005619458379601733, 'n_components': 60, 'logistic_c': 2.266242518864283e-05, 'pca_fit': 'combined', 'solver': 'lbfgs', 'max_iter': 2000, 'fit_intercept': True, 'standardize_with_source': True, 'rho': 0.7}
[I 2026-06-01 16:26:58,106] Trial 145 finished with value: 0.20781079228803706 and parameters: {'alpha': 109192.91329190487, 'n_pcs': 4500, 'iw_method': 'pc_logistic', 'iw_clip_max': 2.5, 'iw_prob_clip': 0.0005619458379601733, 'iw_n_components': 60, 'iw_logistic_c': 2.266242518864283e-05, 'iw_pca_fit': 'combined', 'iw_solver': 'lbfgs', 'iw_rho': 0.7}. Best is trial 144 with value: 0.20790406387774057.
2026-06-01 16:26:58 | INFO | Trial 146 | outer=3 | alpha=1.021e+05 n_pcs=5000 (pc_topk) weight={'name': 'pc_logistic', 'floor': 1e-06, 'clip_max': 2.5, 'prob_clip': 0.0005173297091502464, 'n_components': 60, 'logistic_c': 2.2103633752287365e-05, 'pca_fit': 'combined', 'solver': 'lbfgs', 'max_iter': 2000, 'fit_intercept': True, 'standardize_with_source': True, 'rho': 0.7}
[I 2026-06-01 16:27:15,138] Trial 146 finished with value: 0.20666507494166658 and parameters: {'alpha': 102127.5195451189, 'n_pcs': 5000, 'iw_method': 'pc_logistic', 'iw_clip_max': 2.5, 'iw_prob_clip': 0.0005173297091502464, 'iw_n_components': 60, 'iw_logistic_c': 2.2103633752287365e-05, 'iw_pca_fit': 'combined', 'iw_solver': 'lbfgs', 'iw_rho': 0.7}. Best is trial 144 with value: 0.20790406387774057.
2026-06-01 16:27:15 | INFO | Trial 147 | outer=3 | alpha=1.207e+05 n_pcs=4500 (pc_topk) weight={'name': 'pc_logistic', 'floor': 1e-06, 'clip_max': 2.5, 'prob_clip': 0.0005582105060165052, 'n_components': 60, 'logistic_c': 2.8555569850593755e-05, 'pca_fit': 'combined', 'solver': 'lbfgs', 'max_iter': 2000, 'fit_intercept': True, 'standardize_with_source': True, 'rho': 0.7}
[I 2026-06-01 16:27:30,564] Trial 147 finished with value: 0.20780503403774753 and parameters: {'alpha': 120736.0135061482, 'n_pcs': 4500, 'iw_method': 'pc_logistic', 'iw_clip_max': 2.5, 'iw_prob_clip': 0.0005582105060165052, 'iw_n_components': 60, 'iw_logistic_c': 2.8555569850593755e-05, 'iw_pca_fit': 'combined', 'iw_solver': 'lbfgs', 'iw_rho': 0.7}. Best is trial 144 with value: 0.20790406387774057.
2026-06-01 16:27:30 | INFO | Trial 148 | outer=3 | alpha=1.248e+05 n_pcs=4500 (pc_topk) weight={'name': 'uniform'}
[I 2026-06-01 16:27:39,144] Trial 148 finished with value: 0.19953342428152226 and parameters: {'alpha': 124784.4124982752, 'n_pcs': 4500, 'iw_method': 'uniform'}. Best is trial 144 with value: 0.20790406387774057.
2026-06-01 16:27:39 | INFO | Trial 149 | outer=3 | alpha=1.023e+05 n_pcs=5000 (pc_topk) weight={'name': 'pc_logistic', 'floor': 1e-06, 'clip_max': 2.5, 'prob_clip': 0.0005588017200110483, 'n_components': 60, 'logistic_c': 1.4316220649793299e-05, 'pca_fit': 'combined', 'solver': 'lbfgs', 'max_iter': 2000, 'fit_intercept': True, 'standardize_with_source': True, 'rho': 0.7}
[I 2026-06-01 16:27:55,064] Trial 149 finished with value: 0.20663341216735062 and parameters: {'alpha': 102327.08892128243, 'n_pcs': 5000, 'iw_method': 'pc_logistic', 'iw_clip_max': 2.5, 'iw_prob_clip': 0.0005588017200110483, 'iw_n_components': 60, 'iw_logistic_c': 1.4316220649793299e-05, 'iw_pca_fit': 'combined', 'iw_solver': 'lbfgs', 'iw_rho': 0.7}. Best is trial 144 with value: 0.20790406387774057.
2026-06-01 16:27:55 | INFO | Trial 150 | outer=3 | alpha=8.989e+04 n_pcs=4500 (pc_topk) weight={'name': 'pc_logistic', 'floor': 1e-06, 'clip_max': 2.5, 'prob_clip': 0.0005590098746518699, 'n_components': 60, 'logistic_c': 2.8759242115255803e-05, 'pca_fit': 'combined', 'solver': 'lbfgs', 'max_iter': 2000, 'fit_intercept': True, 'standardize_with_source': True, 'rho': 0.5}
[I 2026-06-01 16:28:10,250] Trial 150 finished with value: 0.20749369110970667 and parameters: {'alpha': 89888.68528223857, 'n_pcs': 4500, 'iw_method': 'pc_logistic', 'iw_clip_max': 2.5, 'iw_prob_clip': 0.0005590098746518699, 'iw_n_components': 60, 'iw_logistic_c': 2.8759242115255803e-05, 'iw_pca_fit': 'combined', 'iw_solver': 'lbfgs', 'iw_rho': 0.5}. Best is trial 144 with value: 0.20790406387774057.
2026-06-01 16:28:10 | INFO | Trial 151 | outer=3 | alpha=6.701e+04 n_pcs=4500 (pc_topk) weight={'name': 'pc_logistic', 'floor': 1e-06, 'clip_max': 2.5, 'prob_clip': 0.0005650987450123165, 'n_components': 60, 'logistic_c': 3.101539594125552e-05, 'pca_fit': 'combined', 'solver': 'lbfgs', 'max_iter': 2000, 'fit_intercept': True, 'standardize_with_source': True, 'rho': 0.5}
[I 2026-06-01 16:28:31,848] Trial 151 finished with value: 0.207315329058201 and parameters: {'alpha': 67006.33979059805, 'n_pcs': 4500, 'iw_method': 'pc_logistic', 'iw_clip_max': 2.5, 'iw_prob_clip': 0.0005650987450123165, 'iw_n_components': 60, 'iw_logistic_c': 3.101539594125552e-05, 'iw_pca_fit': 'combined', 'iw_solver': 'lbfgs', 'iw_rho': 0.5}. Best is trial 144 with value: 0.20790406387774057.
2026-06-01 16:28:31 | INFO | Trial 152 | outer=3 | alpha=7.590e+04 n_pcs=4500 (pc_topk) weight={'name': 'pc_logistic', 'floor': 1e-06, 'clip_max': 2.5, 'prob_clip': 0.000565019647850482, 'n_components': 60, 'logistic_c': 2.8853257099906512e-05, 'pca_fit': 'combined', 'solver': 'lbfgs', 'max_iter': 2000, 'fit_intercept': True, 'standardize_with_source': True, 'rho': 0.5}
[I 2026-06-01 16:29:16,496] Trial 152 finished with value: 0.2074564740088273 and parameters: {'alpha': 75904.40177061563, 'n_pcs': 4500, 'iw_method': 'pc_logistic', 'iw_clip_max': 2.5, 'iw_prob_clip': 0.000565019647850482, 'iw_n_components': 60, 'iw_logistic_c': 2.8853257099906512e-05, 'iw_pca_fit': 'combined', 'iw_solver': 'lbfgs', 'iw_rho': 0.5}. Best is trial 144 with value: 0.20790406387774057.
2026-06-01 16:29:16 | INFO | Trial 153 | outer=3 | alpha=7.125e+04 n_pcs=4500 (pc_topk) weight={'name': 'pc_logistic', 'floor': 1e-06, 'clip_max': 2.5, 'prob_clip': 0.0005629050096046742, 'n_components': 60, 'logistic_c': 3.078928198473558e-05, 'pca_fit': 'combined', 'solver': 'lbfgs', 'max_iter': 2000, 'fit_intercept': True, 'standardize_with_source': True, 'rho': 0.5}
[I 2026-06-01 16:29:32,509] Trial 153 finished with value: 0.20740375258099605 and parameters: {'alpha': 71249.77902446465, 'n_pcs': 4500, 'iw_method': 'pc_logistic', 'iw_clip_max': 2.5, 'iw_prob_clip': 0.0005629050096046742, 'iw_n_components': 60, 'iw_logistic_c': 3.078928198473558e-05, 'iw_pca_fit': 'combined', 'iw_solver': 'lbfgs', 'iw_rho': 0.5}. Best is trial 144 with value: 0.20790406387774057.
2026-06-01 16:29:32 | INFO | Trial 154 | outer=3 | alpha=6.757e+04 n_pcs=4500 (pc_topk) weight={'name': 'pc_logistic', 'floor': 1e-06, 'clip_max': 7.0, 'prob_clip': 0.0005645980912407469, 'n_components': 60, 'logistic_c': 9.187685344600414e-06, 'pca_fit': 'combined', 'solver': 'lbfgs', 'max_iter': 2000, 'fit_intercept': True, 'standardize_with_source': True, 'rho': 0.5}
[I 2026-06-01 16:29:47,765] Trial 154 finished with value: 0.2041050747319364 and parameters: {'alpha': 67565.76561113779, 'n_pcs': 4500, 'iw_method': 'pc_logistic', 'iw_clip_max': 7.0, 'iw_prob_clip': 0.0005645980912407469, 'iw_n_components': 60, 'iw_logistic_c': 9.187685344600414e-06, 'iw_pca_fit': 'combined', 'iw_solver': 'lbfgs', 'iw_rho': 0.5}. Best is trial 144 with value: 0.20790406387774057.
2026-06-01 16:29:47 | INFO | Trial 155 | outer=3 | alpha=8.856e+04 n_pcs=4500 (pc_topk) weight={'name': 'pc_logistic', 'floor': 1e-06, 'clip_max': 2.5, 'prob_clip': 0.0005332107640828717, 'n_components': 60, 'logistic_c': 3.151535255422952e-05, 'pca_fit': 'combined', 'solver': 'lbfgs', 'max_iter': 2000, 'fit_intercept': True, 'standardize_with_source': True, 'rho': 0.5}
[I 2026-06-01 16:30:03,489] Trial 155 finished with value: 0.20752905420957526 and parameters: {'alpha': 88556.13624964423, 'n_pcs': 4500, 'iw_method': 'pc_logistic', 'iw_clip_max': 2.5, 'iw_prob_clip': 0.0005332107640828717, 'iw_n_components': 60, 'iw_logistic_c': 3.151535255422952e-05, 'iw_pca_fit': 'combined', 'iw_solver': 'lbfgs', 'iw_rho': 0.5}. Best is trial 144 with value: 0.20790406387774057.
2026-06-01 16:30:03 | INFO | Trial 156 | outer=3 | alpha=5.432e+04 n_pcs=5000 (pc_topk) weight={'name': 'pc_logistic', 'floor': 1e-06, 'clip_max': 2.5, 'prob_clip': 0.000509035136847839, 'n_components': 60, 'logistic_c': 2.872761474878896e-05, 'pca_fit': 'combined', 'solver': 'lbfgs', 'max_iter': 2000, 'fit_intercept': True, 'standardize_with_source': True, 'rho': 0.5}
[I 2026-06-01 16:30:49,913] Trial 156 finished with value: 0.20546147179762658 and parameters: {'alpha': 54316.112775797854, 'n_pcs': 5000, 'iw_method': 'pc_logistic', 'iw_clip_max': 2.5, 'iw_prob_clip': 0.000509035136847839, 'iw_n_components': 60, 'iw_logistic_c': 2.872761474878896e-05, 'iw_pca_fit': 'combined', 'iw_solver': 'lbfgs', 'iw_rho': 0.5}. Best is trial 144 with value: 0.20790406387774057.
2026-06-01 16:30:49 | INFO | Trial 157 | outer=3 | alpha=8.802e+04 n_pcs=4500 (pc_topk) weight={'name': 'pc_logistic', 'floor': 1e-06, 'clip_max': 2.5, 'prob_clip': 0.0005436560133321257, 'n_components': 60, 'logistic_c': 1.7695509593223497e-05, 'pca_fit': 'combined', 'solver': 'lbfgs', 'max_iter': 2000, 'fit_intercept': True, 'standardize_with_source': True, 'rho': 0.5}
[I 2026-06-01 16:31:05,123] Trial 157 finished with value: 0.20723049902466362 and parameters: {'alpha': 88023.7297341622, 'n_pcs': 4500, 'iw_method': 'pc_logistic', 'iw_clip_max': 2.5, 'iw_prob_clip': 0.0005436560133321257, 'iw_n_components': 60, 'iw_logistic_c': 1.7695509593223497e-05, 'iw_pca_fit': 'combined', 'iw_solver': 'lbfgs', 'iw_rho': 0.5}. Best is trial 144 with value: 0.20790406387774057.
2026-06-01 16:31:05 | INFO | Trial 158 | outer=3 | alpha=6.511e+04 n_pcs=4500 (pc_topk) weight={'name': 'pc_logistic', 'floor': 1e-06, 'clip_max': 4.0, 'prob_clip': 0.0005966519338230137, 'n_components': 20, 'logistic_c': 3.396717565559084e-05, 'pca_fit': 'combined', 'solver': 'lbfgs', 'max_iter': 2000, 'fit_intercept': True, 'standardize_with_source': True, 'rho': 0.5}
[I 2026-06-01 16:31:32,505] Trial 158 finished with value: 0.2063694017111803 and parameters: {'alpha': 65105.44635863716, 'n_pcs': 4500, 'iw_method': 'pc_logistic', 'iw_clip_max': 4.0, 'iw_prob_clip': 0.0005966519338230137, 'iw_n_components': 20, 'iw_logistic_c': 3.396717565559084e-05, 'iw_pca_fit': 'combined', 'iw_solver': 'lbfgs', 'iw_rho': 0.5}. Best is trial 144 with value: 0.20790406387774057.
2026-06-01 16:31:32 | INFO | Trial 159 | outer=3 | alpha=7.679e+04 n_pcs=4500 (pc_topk) weight={'name': 'pc_logistic', 'floor': 1e-06, 'clip_max': 12.0, 'prob_clip': 0.0005007653455466833, 'n_components': 60, 'logistic_c': 2.1410902174089324e-05, 'pca_fit': 'combined', 'solver': 'lbfgs', 'max_iter': 2000, 'fit_intercept': True, 'standardize_with_source': True, 'rho': 0.5}
[I 2026-06-01 16:31:47,515] Trial 159 finished with value: 0.20278046680567002 and parameters: {'alpha': 76792.11218315983, 'n_pcs': 4500, 'iw_method': 'pc_logistic', 'iw_clip_max': 12.0, 'iw_prob_clip': 0.0005007653455466833, 'iw_n_components': 60, 'iw_logistic_c': 2.1410902174089324e-05, 'iw_pca_fit': 'combined', 'iw_solver': 'lbfgs', 'iw_rho': 0.5}. Best is trial 144 with value: 0.20790406387774057.
2026-06-01 16:31:47 | INFO | Trial 160 | outer=3 | alpha=9.192e+04 n_pcs=4500 (pc_topk) weight={'name': 'pc_logistic', 'floor': 1e-06, 'clip_max': 2.5, 'prob_clip': 0.0005599896255098992, 'n_components': 60, 'logistic_c': 1.19109035534303e-05, 'pca_fit': 'combined', 'solver': 'lbfgs', 'max_iter': 2000, 'fit_intercept': True, 'standardize_with_source': True, 'rho': 0.5}
[I 2026-06-01 16:32:02,151] Trial 160 finished with value: 0.20700453540450145 and parameters: {'alpha': 91915.44873448816, 'n_pcs': 4500, 'iw_method': 'pc_logistic', 'iw_clip_max': 2.5, 'iw_prob_clip': 0.0005599896255098992, 'iw_n_components': 60, 'iw_logistic_c': 1.19109035534303e-05, 'iw_pca_fit': 'combined', 'iw_solver': 'lbfgs', 'iw_rho': 0.5}. Best is trial 144 with value: 0.20790406387774057.
2026-06-01 16:32:02 | INFO | Trial 161 | outer=3 | alpha=1.086e+05 n_pcs=4500 (pc_topk) weight={'name': 'pc_logistic', 'floor': 1e-06, 'clip_max': 2.5, 'prob_clip': 0.0006063515609407753, 'n_components': 60, 'logistic_c': 2.8657364247001817e-05, 'pca_fit': 'combined', 'solver': 'lbfgs', 'max_iter': 2000, 'fit_intercept': True, 'standardize_with_source': True, 'rho': 0.5}
[I 2026-06-01 16:32:17,726] Trial 161 finished with value: 0.20733310595220117 and parameters: {'alpha': 108613.66178264734, 'n_pcs': 4500, 'iw_method': 'pc_logistic', 'iw_clip_max': 2.5, 'iw_prob_clip': 0.0006063515609407753, 'iw_n_components': 60, 'iw_logistic_c': 2.8657364247001817e-05, 'iw_pca_fit': 'combined', 'iw_solver': 'lbfgs', 'iw_rho': 0.5}. Best is trial 144 with value: 0.20790406387774057.
2026-06-01 16:32:17 | INFO | Trial 162 | outer=3 | alpha=1.191e+05 n_pcs=4500 (pc_topk) weight={'name': 'pc_logistic', 'floor': 1e-06, 'clip_max': 2.5, 'prob_clip': 0.0006042538488789637, 'n_components': 60, 'logistic_c': 3.104062551187266e-05, 'pca_fit': 'combined', 'solver': 'lbfgs', 'max_iter': 2000, 'fit_intercept': True, 'standardize_with_source': True, 'rho': 0.5}
[I 2026-06-01 16:32:33,139] Trial 162 finished with value: 0.20723752638901227 and parameters: {'alpha': 119103.10347171225, 'n_pcs': 4500, 'iw_method': 'pc_logistic', 'iw_clip_max': 2.5, 'iw_prob_clip': 0.0006042538488789637, 'iw_n_components': 60, 'iw_logistic_c': 3.104062551187266e-05, 'iw_pca_fit': 'combined', 'iw_solver': 'lbfgs', 'iw_rho': 0.5}. Best is trial 144 with value: 0.20790406387774057.
2026-06-01 16:32:33 | INFO | Trial 163 | outer=3 | alpha=7.021e+04 n_pcs=4500 (pc_topk) weight={'name': 'pc_logistic', 'floor': 1e-06, 'clip_max': 2.5, 'prob_clip': 0.0005509199410801653, 'n_components': 60, 'logistic_c': 1.6985316789950376e-05, 'pca_fit': 'combined', 'solver': 'lbfgs', 'max_iter': 2000, 'fit_intercept': True, 'standardize_with_source': True, 'rho': 0.5}
[I 2026-06-01 16:32:48,801] Trial 163 finished with value: 0.20723023045111533 and parameters: {'alpha': 70208.1744663173, 'n_pcs': 4500, 'iw_method': 'pc_logistic', 'iw_clip_max': 2.5, 'iw_prob_clip': 0.0005509199410801653, 'iw_n_components': 60, 'iw_logistic_c': 1.6985316789950376e-05, 'iw_pca_fit': 'combined', 'iw_solver': 'lbfgs', 'iw_rho': 0.5}. Best is trial 144 with value: 0.20790406387774057.
2026-06-01 16:32:48 | INFO | Trial 164 | outer=3 | alpha=9.481e+04 n_pcs=4500 (pc_topk) weight={'name': 'pc_logistic', 'floor': 1e-06, 'clip_max': 2.5, 'prob_clip': 0.0006114534213279661, 'n_components': 60, 'logistic_c': 2.4181127848541782e-05, 'pca_fit': 'combined', 'solver': 'lbfgs', 'max_iter': 2000, 'fit_intercept': True, 'standardize_with_source': True, 'rho': 0.5}
[I 2026-06-01 16:33:04,120] Trial 164 finished with value: 0.2073367186924901 and parameters: {'alpha': 94807.93484093942, 'n_pcs': 4500, 'iw_method': 'pc_logistic', 'iw_clip_max': 2.5, 'iw_prob_clip': 0.0006114534213279661, 'iw_n_components': 60, 'iw_logistic_c': 2.4181127848541782e-05, 'iw_pca_fit': 'combined', 'iw_solver': 'lbfgs', 'iw_rho': 0.5}. Best is trial 144 with value: 0.20790406387774057.
2026-06-01 16:33:04 | INFO | Trial 165 | outer=3 | alpha=1.037e+05 n_pcs=4500 (pc_topk) weight={'name': 'pc_logistic', 'floor': 1e-06, 'clip_max': 2.5, 'prob_clip': 0.0006214267815950681, 'n_components': 60, 'logistic_c': 7.105674650386497e-06, 'pca_fit': 'combined', 'solver': 'lbfgs', 'max_iter': 2000, 'fit_intercept': True, 'standardize_with_source': True, 'rho': 0.5}
[I 2026-06-01 16:33:19,071] Trial 165 finished with value: 0.20564989647762366 and parameters: {'alpha': 103733.38473261092, 'n_pcs': 4500, 'iw_method': 'pc_logistic', 'iw_clip_max': 2.5, 'iw_prob_clip': 0.0006214267815950681, 'iw_n_components': 60, 'iw_logistic_c': 7.105674650386497e-06, 'iw_pca_fit': 'combined', 'iw_solver': 'lbfgs', 'iw_rho': 0.5}. Best is trial 144 with value: 0.20790406387774057.
2026-06-01 16:33:19 | INFO | Trial 166 | outer=3 | alpha=8.753e+04 n_pcs=5000 (pc_topk) weight={'name': 'pc_logistic', 'floor': 1e-06, 'clip_max': 2.5, 'prob_clip': 0.0006307719990856066, 'n_components': 60, 'logistic_c': 2.1544891737216426e-05, 'pca_fit': 'combined', 'solver': 'lbfgs', 'max_iter': 2000, 'fit_intercept': True, 'standardize_with_source': True, 'rho': 0.5}
