[I 2026-06-01 19:18:32,942] Trial 205 finished with value: 0.25808321859003797 and parameters: {'alpha': 49356.62554100445, 'n_pcs': 4000, 'iw_method': 'pc_logistic', 'iw_clip_max': 7.0, 'iw_prob_clip': 0.027919700737471402, 'iw_n_components': 100, 'iw_logistic_c': 4.1187712858707756e-05, 'iw_pca_fit': 'combined', 'iw_solver': 'lbfgs', 'iw_rho': 0.85}. Best is trial 147 with value: 0.25836214582968176.
2026-06-01 19:18:32 | INFO | Trial 206 | outer=5 | alpha=4.892e+04 n_pcs=4000 (pc_topk) weight={'name': 'pc_logistic', 'floor': 1e-06, 'clip_max': 7.0, 'prob_clip': 0.02808208039917848, 'n_components': 20, 'logistic_c': 3.866115534605159e-05, 'pca_fit': 'combined', 'solver': 'lbfgs', 'max_iter': 2000, 'fit_intercept': True, 'standardize_with_source': True, 'rho': 0.85}
[I 2026-06-01 19:18:45,739] Trial 206 finished with value: 0.2585867120593996 and parameters: {'alpha': 48919.89754551577, 'n_pcs': 4000, 'iw_method': 'pc_logistic', 'iw_clip_max': 7.0, 'iw_prob_clip': 0.02808208039917848, 'iw_n_components': 20, 'iw_logistic_c': 3.866115534605159e-05, 'iw_pca_fit': 'combined', 'iw_solver': 'lbfgs', 'iw_rho': 0.85}. Best is trial 206 with value: 0.2585867120593996.
2026-06-01 19:18:45 | INFO | Trial 207 | outer=5 | alpha=4.893e+04 n_pcs=4000 (pc_topk) weight={'name': 'pc_logistic', 'floor': 1e-06, 'clip_max': 7.0, 'prob_clip': 0.027218667248757603, 'n_components': 20, 'logistic_c': 3.872522590093989e-05, 'pca_fit': 'combined', 'solver': 'lbfgs', 'max_iter': 2000, 'fit_intercept': True, 'standardize_with_source': True, 'rho': 0.85}
[I 2026-06-01 19:18:57,919] Trial 207 finished with value: 0.25853715180898523 and parameters: {'alpha': 48934.18906086563, 'n_pcs': 4000, 'iw_method': 'pc_logistic', 'iw_clip_max': 7.0, 'iw_prob_clip': 0.027218667248757603, 'iw_n_components': 20, 'iw_logistic_c': 3.872522590093989e-05, 'iw_pca_fit': 'combined', 'iw_solver': 'lbfgs', 'iw_rho': 0.85}. Best is trial 206 with value: 0.2585867120593996.
2026-06-01 19:18:57 | INFO | Trial 208 | outer=5 | alpha=3.418e+04 n_pcs=4000 (pc_topk) weight={'name': 'pc_logistic', 'floor': 1e-06, 'clip_max': 7.0, 'prob_clip': 0.026969056277229612, 'n_components': 20, 'logistic_c': 4.2859009878713195e-05, 'pca_fit': 'combined', 'solver': 'lbfgs', 'max_iter': 2000, 'fit_intercept': True, 'standardize_with_source': True, 'rho': 0.85}
[I 2026-06-01 19:19:10,674] Trial 208 finished with value: 0.25720480137748136 and parameters: {'alpha': 34183.883101219166, 'n_pcs': 4000, 'iw_method': 'pc_logistic', 'iw_clip_max': 7.0, 'iw_prob_clip': 0.026969056277229612, 'iw_n_components': 20, 'iw_logistic_c': 4.2859009878713195e-05, 'iw_pca_fit': 'combined', 'iw_solver': 'lbfgs', 'iw_rho': 0.85}. Best is trial 206 with value: 0.2585867120593996.
2026-06-01 19:19:10 | INFO | Trial 209 | outer=5 | alpha=5.019e+04 n_pcs=4000 (pc_topk) weight={'name': 'pc_logistic', 'floor': 1e-06, 'clip_max': 7.0, 'prob_clip': 0.02749818596359045, 'n_components': 40, 'logistic_c': 3.483819171161791e-05, 'pca_fit': 'combined', 'solver': 'lbfgs', 'max_iter': 2000, 'fit_intercept': True, 'standardize_with_source': True, 'rho': 0.85}
[I 2026-06-01 19:19:22,907] Trial 209 finished with value: 0.2577157976615453 and parameters: {'alpha': 50188.08957809337, 'n_pcs': 4000, 'iw_method': 'pc_logistic', 'iw_clip_max': 7.0, 'iw_prob_clip': 0.02749818596359045, 'iw_n_components': 40, 'iw_logistic_c': 3.483819171161791e-05, 'iw_pca_fit': 'combined', 'iw_solver': 'lbfgs', 'iw_rho': 0.85}. Best is trial 206 with value: 0.2585867120593996.
2026-06-01 19:19:22 | INFO | Trial 210 | outer=5 | alpha=4.475e+04 n_pcs=4000 (pc_topk) weight={'name': 'pc_logistic', 'floor': 1e-06, 'clip_max': 7.0, 'prob_clip': 0.028490571688739884, 'n_components': 20, 'logistic_c': 3.334214277623614e-05, 'pca_fit': 'combined', 'solver': 'lbfgs', 'max_iter': 2000, 'fit_intercept': True, 'standardize_with_source': True, 'rho': 0.85}
[I 2026-06-01 19:19:35,054] Trial 210 finished with value: 0.2585553234752943 and parameters: {'alpha': 44751.52118382665, 'n_pcs': 4000, 'iw_method': 'pc_logistic', 'iw_clip_max': 7.0, 'iw_prob_clip': 0.028490571688739884, 'iw_n_components': 20, 'iw_logistic_c': 3.334214277623614e-05, 'iw_pca_fit': 'combined', 'iw_solver': 'lbfgs', 'iw_rho': 0.85}. Best is trial 206 with value: 0.2585867120593996.
2026-06-01 19:19:35 | INFO | Trial 211 | outer=5 | alpha=4.741e+04 n_pcs=4000 (pc_topk) weight={'name': 'pc_logistic', 'floor': 1e-06, 'clip_max': 7.0, 'prob_clip': 0.029987318573077435, 'n_components': 40, 'logistic_c': 3.299299841275343e-05, 'pca_fit': 'combined', 'solver': 'lbfgs', 'max_iter': 2000, 'fit_intercept': True, 'standardize_with_source': True, 'rho': 0.85}
[I 2026-06-01 19:19:47,765] Trial 211 finished with value: 0.25784119502810066 and parameters: {'alpha': 47411.94855677994, 'n_pcs': 4000, 'iw_method': 'pc_logistic', 'iw_clip_max': 7.0, 'iw_prob_clip': 0.029987318573077435, 'iw_n_components': 40, 'iw_logistic_c': 3.299299841275343e-05, 'iw_pca_fit': 'combined', 'iw_solver': 'lbfgs', 'iw_rho': 0.85}. Best is trial 206 with value: 0.2585867120593996.
2026-06-01 19:19:47 | INFO | Trial 212 | outer=5 | alpha=4.683e+04 n_pcs=4000 (pc_topk) weight={'name': 'pc_logistic', 'floor': 1e-06, 'clip_max': 7.0, 'prob_clip': 0.029020049622409484, 'n_components': 20, 'logistic_c': 3.138884187789119e-05, 'pca_fit': 'combined', 'solver': 'lbfgs', 'max_iter': 2000, 'fit_intercept': True, 'standardize_with_source': True, 'rho': 0.85}
[I 2026-06-01 19:20:00,753] Trial 212 finished with value: 0.2585674737349377 and parameters: {'alpha': 46831.54769505432, 'n_pcs': 4000, 'iw_method': 'pc_logistic', 'iw_clip_max': 7.0, 'iw_prob_clip': 0.029020049622409484, 'iw_n_components': 20, 'iw_logistic_c': 3.138884187789119e-05, 'iw_pca_fit': 'combined', 'iw_solver': 'lbfgs', 'iw_rho': 0.85}. Best is trial 206 with value: 0.2585867120593996.
2026-06-01 19:20:00 | INFO | Trial 213 | outer=5 | alpha=4.524e+04 n_pcs=4000 (pc_topk) weight={'name': 'pc_logistic', 'floor': 1e-06, 'clip_max': 7.0, 'prob_clip': 0.029890340900857414, 'n_components': 20, 'logistic_c': 1.7743041378614432e-05, 'pca_fit': 'combined', 'solver': 'lbfgs', 'max_iter': 2000, 'fit_intercept': True, 'standardize_with_source': True, 'rho': 0.85}
[I 2026-06-01 19:20:13,619] Trial 213 finished with value: 0.2560055098613979 and parameters: {'alpha': 45241.53830101923, 'n_pcs': 4000, 'iw_method': 'pc_logistic', 'iw_clip_max': 7.0, 'iw_prob_clip': 0.029890340900857414, 'iw_n_components': 20, 'iw_logistic_c': 1.7743041378614432e-05, 'iw_pca_fit': 'combined', 'iw_solver': 'lbfgs', 'iw_rho': 0.85}. Best is trial 206 with value: 0.2585867120593996.
2026-06-01 19:20:13 | INFO | Trial 214 | outer=5 | alpha=3.286e+04 n_pcs=4000 (pc_topk) weight={'name': 'pc_logistic', 'floor': 1e-06, 'clip_max': 7.0, 'prob_clip': 0.027354293554295455, 'n_components': 20, 'logistic_c': 3.379071574884918e-05, 'pca_fit': 'combined', 'solver': 'lbfgs', 'max_iter': 2000, 'fit_intercept': True, 'standardize_with_source': True, 'rho': 0.85}
[I 2026-06-01 19:20:25,712] Trial 214 finished with value: 0.25720756728363536 and parameters: {'alpha': 32855.88147725278, 'n_pcs': 4000, 'iw_method': 'pc_logistic', 'iw_clip_max': 7.0, 'iw_prob_clip': 0.027354293554295455, 'iw_n_components': 20, 'iw_logistic_c': 3.379071574884918e-05, 'iw_pca_fit': 'combined', 'iw_solver': 'lbfgs', 'iw_rho': 0.85}. Best is trial 206 with value: 0.2585867120593996.
2026-06-01 19:20:25 | INFO | Trial 215 | outer=5 | alpha=3.935e+04 n_pcs=4000 (pc_topk) weight={'name': 'pc_logistic', 'floor': 1e-06, 'clip_max': 7.0, 'prob_clip': 0.029148798971296005, 'n_components': 40, 'logistic_c': 2.553165567963218e-05, 'pca_fit': 'combined', 'solver': 'lbfgs', 'max_iter': 2000, 'fit_intercept': True, 'standardize_with_source': True, 'rho': 0.85}
[I 2026-06-01 19:20:38,211] Trial 215 finished with value: 0.257273318576789 and parameters: {'alpha': 39349.960087097286, 'n_pcs': 4000, 'iw_method': 'pc_logistic', 'iw_clip_max': 7.0, 'iw_prob_clip': 0.029148798971296005, 'iw_n_components': 40, 'iw_logistic_c': 2.553165567963218e-05, 'iw_pca_fit': 'combined', 'iw_solver': 'lbfgs', 'iw_rho': 0.85}. Best is trial 206 with value: 0.2585867120593996.
2026-06-01 19:20:38 | INFO | Trial 216 | outer=5 | alpha=4.986e+04 n_pcs=4000 (pc_topk) weight={'name': 'pc_logistic', 'floor': 1e-06, 'clip_max': 7.0, 'prob_clip': 0.032456386545715324, 'n_components': 20, 'logistic_c': 3.445293563248076e-05, 'pca_fit': 'combined', 'solver': 'lbfgs', 'max_iter': 2000, 'fit_intercept': True, 'standardize_with_source': True, 'rho': 0.85}
[I 2026-06-01 19:20:51,230] Trial 216 finished with value: 0.25859517736085086 and parameters: {'alpha': 49863.71334818811, 'n_pcs': 4000, 'iw_method': 'pc_logistic', 'iw_clip_max': 7.0, 'iw_prob_clip': 0.032456386545715324, 'iw_n_components': 20, 'iw_logistic_c': 3.445293563248076e-05, 'iw_pca_fit': 'combined', 'iw_solver': 'lbfgs', 'iw_rho': 0.85}. Best is trial 216 with value: 0.25859517736085086.
2026-06-01 19:20:51 | INFO | Trial 217 | outer=5 | alpha=4.509e+04 n_pcs=4000 (pc_topk) weight={'name': 'pc_logistic', 'floor': 1e-06, 'clip_max': 7.0, 'prob_clip': 0.031722180732434796, 'n_components': 20, 'logistic_c': 1.2161967302111996e-05, 'pca_fit': 'combined', 'solver': 'lbfgs', 'max_iter': 2000, 'fit_intercept': True, 'standardize_with_source': True, 'rho': 1.0}
[I 2026-06-01 19:21:03,889] Trial 217 finished with value: 0.25457301369614344 and parameters: {'alpha': 45088.247311031344, 'n_pcs': 4000, 'iw_method': 'pc_logistic', 'iw_clip_max': 7.0, 'iw_prob_clip': 0.031722180732434796, 'iw_n_components': 20, 'iw_logistic_c': 1.2161967302111996e-05, 'iw_pca_fit': 'combined', 'iw_solver': 'lbfgs', 'iw_rho': 1.0}. Best is trial 216 with value: 0.25859517736085086.
2026-06-01 19:21:03 | INFO | Trial 218 | outer=5 | alpha=3.466e+04 n_pcs=4000 (pc_topk) weight={'name': 'pc_logistic', 'floor': 1e-06, 'clip_max': 7.0, 'prob_clip': 0.02500651742421224, 'n_components': 20, 'logistic_c': 1.9676121381637695e-05, 'pca_fit': 'combined', 'solver': 'lbfgs', 'max_iter': 2000, 'fit_intercept': True, 'standardize_with_source': True, 'rho': 0.5}
[I 2026-06-01 19:21:16,655] Trial 218 finished with value: 0.2541970432840359 and parameters: {'alpha': 34661.85403451699, 'n_pcs': 4000, 'iw_method': 'pc_logistic', 'iw_clip_max': 7.0, 'iw_prob_clip': 0.02500651742421224, 'iw_n_components': 20, 'iw_logistic_c': 1.9676121381637695e-05, 'iw_pca_fit': 'combined', 'iw_solver': 'lbfgs', 'iw_rho': 0.5}. Best is trial 216 with value: 0.25859517736085086.
2026-06-01 19:21:16 | INFO | Trial 219 | outer=5 | alpha=4.814e+04 n_pcs=1500 (pc_topk) weight={'name': 'pc_logistic', 'floor': 1e-06, 'clip_max': 7.0, 'prob_clip': 0.034432217670804774, 'n_components': 20, 'logistic_c': 3.849491624196476e-05, 'pca_fit': 'combined', 'solver': 'lbfgs', 'max_iter': 2000, 'fit_intercept': True, 'standardize_with_source': True, 'rho': 0.85}
[I 2026-06-01 19:21:24,287] Trial 219 finished with value: 0.23928302560837872 and parameters: {'alpha': 48143.027105017354, 'n_pcs': 1500, 'iw_method': 'pc_logistic', 'iw_clip_max': 7.0, 'iw_prob_clip': 0.034432217670804774, 'iw_n_components': 20, 'iw_logistic_c': 3.849491624196476e-05, 'iw_pca_fit': 'combined', 'iw_solver': 'lbfgs', 'iw_rho': 0.85}. Best is trial 216 with value: 0.25859517736085086.
2026-06-01 19:21:24 | INFO | Trial 220 | outer=5 | alpha=2.852e+04 n_pcs=4000 (pc_topk) weight={'name': 'pc_logistic', 'floor': 1e-06, 'clip_max': 7.0, 'prob_clip': 0.038881321925121747, 'n_components': 20, 'logistic_c': 4.3442996576636164e-05, 'pca_fit': 'combined', 'solver': 'lbfgs', 'max_iter': 2000, 'fit_intercept': True, 'standardize_with_source': True, 'rho': 0.85}
[I 2026-06-01 19:21:37,438] Trial 220 finished with value: 0.25598038975416953 and parameters: {'alpha': 28519.63322410058, 'n_pcs': 4000, 'iw_method': 'pc_logistic', 'iw_clip_max': 7.0, 'iw_prob_clip': 0.038881321925121747, 'iw_n_components': 20, 'iw_logistic_c': 4.3442996576636164e-05, 'iw_pca_fit': 'combined', 'iw_solver': 'lbfgs', 'iw_rho': 0.85}. Best is trial 216 with value: 0.25859517736085086.
2026-06-01 19:21:37 | INFO | Trial 221 | outer=5 | alpha=5.100e+04 n_pcs=4000 (pc_topk) weight={'name': 'pc_logistic', 'floor': 1e-06, 'clip_max': 7.0, 'prob_clip': 0.02830446877477019, 'n_components': 40, 'logistic_c': 2.9850874649949693e-05, 'pca_fit': 'combined', 'solver': 'lbfgs', 'max_iter': 2000, 'fit_intercept': True, 'standardize_with_source': True, 'rho': 0.85}
[I 2026-06-01 19:21:49,836] Trial 221 finished with value: 0.2577150880851942 and parameters: {'alpha': 50995.02774654575, 'n_pcs': 4000, 'iw_method': 'pc_logistic', 'iw_clip_max': 7.0, 'iw_prob_clip': 0.02830446877477019, 'iw_n_components': 40, 'iw_logistic_c': 2.9850874649949693e-05, 'iw_pca_fit': 'combined', 'iw_solver': 'lbfgs', 'iw_rho': 0.85}. Best is trial 216 with value: 0.25859517736085086.
2026-06-01 19:21:49 | INFO | Trial 222 | outer=5 | alpha=4.108e+04 n_pcs=4000 (pc_topk) weight={'name': 'pc_logistic', 'floor': 1e-06, 'clip_max': 7.0, 'prob_clip': 0.02674841545292422, 'n_components': 20, 'logistic_c': 3.497736273447239e-05, 'pca_fit': 'combined', 'solver': 'lbfgs', 'max_iter': 2000, 'fit_intercept': True, 'standardize_with_source': True, 'rho': 0.85}
[I 2026-06-01 19:22:01,384] Trial 222 finished with value: 0.25827533586497453 and parameters: {'alpha': 41080.8432915479, 'n_pcs': 4000, 'iw_method': 'pc_logistic', 'iw_clip_max': 7.0, 'iw_prob_clip': 0.02674841545292422, 'iw_n_components': 20, 'iw_logistic_c': 3.497736273447239e-05, 'iw_pca_fit': 'combined', 'iw_solver': 'lbfgs', 'iw_rho': 0.85}. Best is trial 216 with value: 0.25859517736085086.
2026-06-01 19:22:01 | INFO | Trial 223 | outer=5 | alpha=3.739e+04 n_pcs=4000 (pc_topk) weight={'name': 'pc_logistic', 'floor': 1e-06, 'clip_max': 7.0, 'prob_clip': 0.025474293165189385, 'n_components': 20, 'logistic_c': 2.326433504374411e-05, 'pca_fit': 'combined', 'solver': 'lbfgs', 'max_iter': 2000, 'fit_intercept': True, 'standardize_with_source': True, 'rho': 0.85}
[I 2026-06-01 19:22:13,343] Trial 223 finished with value: 0.257158512804213 and parameters: {'alpha': 37394.91048615298, 'n_pcs': 4000, 'iw_method': 'pc_logistic', 'iw_clip_max': 7.0, 'iw_prob_clip': 0.025474293165189385, 'iw_n_components': 20, 'iw_logistic_c': 2.326433504374411e-05, 'iw_pca_fit': 'combined', 'iw_solver': 'lbfgs', 'iw_rho': 0.85}. Best is trial 216 with value: 0.25859517736085086.
2026-06-01 19:22:13 | INFO | Trial 224 | outer=5 | alpha=4.141e+04 n_pcs=4000 (pc_topk) weight={'name': 'pc_logistic', 'floor': 1e-06, 'clip_max': 12.0, 'prob_clip': 0.03162666930126297, 'n_components': 20, 'logistic_c': 4.60992632962103e-05, 'pca_fit': 'combined', 'solver': 'lbfgs', 'max_iter': 2000, 'fit_intercept': True, 'standardize_with_source': True, 'rho': 0.85}
[I 2026-06-01 19:22:25,620] Trial 224 finished with value: 0.2572195628404846 and parameters: {'alpha': 41407.29063221055, 'n_pcs': 4000, 'iw_method': 'pc_logistic', 'iw_clip_max': 12.0, 'iw_prob_clip': 0.03162666930126297, 'iw_n_components': 20, 'iw_logistic_c': 4.60992632962103e-05, 'iw_pca_fit': 'combined', 'iw_solver': 'lbfgs', 'iw_rho': 0.85}. Best is trial 216 with value: 0.25859517736085086.
2026-06-01 19:22:25 | INFO | Trial 225 | outer=5 | alpha=4.422e+04 n_pcs=4000 (pc_topk) weight={'name': 'pc_logistic', 'floor': 1e-06, 'clip_max': 7.0, 'prob_clip': 0.024772929313247774, 'n_components': 20, 'logistic_c': 1.582821189618685e-05, 'pca_fit': 'combined', 'solver': 'lbfgs', 'max_iter': 2000, 'fit_intercept': True, 'standardize_with_source': True, 'rho': 0.85}
[I 2026-06-01 19:22:38,957] Trial 225 finished with value: 0.2557762931995181 and parameters: {'alpha': 44222.93169373341, 'n_pcs': 4000, 'iw_method': 'pc_logistic', 'iw_clip_max': 7.0, 'iw_prob_clip': 0.024772929313247774, 'iw_n_components': 20, 'iw_logistic_c': 1.582821189618685e-05, 'iw_pca_fit': 'combined', 'iw_solver': 'lbfgs', 'iw_rho': 0.85}. Best is trial 216 with value: 0.25859517736085086.
2026-06-01 19:22:38 | INFO | Trial 226 | outer=5 | alpha=5.632e+04 n_pcs=4000 (pc_topk) weight={'name': 'pc_logistic', 'floor': 1e-06, 'clip_max': 7.0, 'prob_clip': 0.030518007102461477, 'n_components': 20, 'logistic_c': 3.780384958231828e-05, 'pca_fit': 'combined', 'solver': 'lbfgs', 'max_iter': 2000, 'fit_intercept': True, 'standardize_with_source': True, 'rho': 0.85}
[I 2026-06-01 19:22:52,299] Trial 226 finished with value: 0.25856585410693383 and parameters: {'alpha': 56318.65521088163, 'n_pcs': 4000, 'iw_method': 'pc_logistic', 'iw_clip_max': 7.0, 'iw_prob_clip': 0.030518007102461477, 'iw_n_components': 20, 'iw_logistic_c': 3.780384958231828e-05, 'iw_pca_fit': 'combined', 'iw_solver': 'lbfgs', 'iw_rho': 0.85}. Best is trial 216 with value: 0.25859517736085086.
2026-06-01 19:22:52 | INFO | Trial 227 | outer=5 | alpha=3.372e+04 n_pcs=4000 (pc_topk) weight={'name': 'pc_logistic', 'floor': 1e-06, 'clip_max': 7.0, 'prob_clip': 0.02998524859154479, 'n_components': 20, 'logistic_c': 3.312223304677842e-05, 'pca_fit': 'combined', 'solver': 'lbfgs', 'max_iter': 2000, 'fit_intercept': True, 'standardize_with_source': True, 'rho': 0.85}
[I 2026-06-01 19:23:04,709] Trial 227 finished with value: 0.257508051197762 and parameters: {'alpha': 33716.89117733891, 'n_pcs': 4000, 'iw_method': 'pc_logistic', 'iw_clip_max': 7.0, 'iw_prob_clip': 0.02998524859154479, 'iw_n_components': 20, 'iw_logistic_c': 3.312223304677842e-05, 'iw_pca_fit': 'combined', 'iw_solver': 'lbfgs', 'iw_rho': 0.85}. Best is trial 216 with value: 0.25859517736085086.
2026-06-01 19:23:04 | INFO | Trial 228 | outer=5 | alpha=5.202e+04 n_pcs=4000 (pc_topk) weight={'name': 'uniform'}
[I 2026-06-01 19:23:11,514] Trial 228 finished with value: 0.24070269347373108 and parameters: {'alpha': 52020.70372498109, 'n_pcs': 4000, 'iw_method': 'uniform'}. Best is trial 216 with value: 0.25859517736085086.
2026-06-01 19:23:11 | INFO | Trial 229 | outer=5 | alpha=3.822e+04 n_pcs=4000 (pc_topk) weight={'name': 'pc_logistic', 'floor': 1e-06, 'clip_max': 7.0, 'prob_clip': 0.037323805188803454, 'n_components': 20, 'logistic_c': 5.271424496732527e-05, 'pca_fit': 'combined', 'solver': 'lbfgs', 'max_iter': 2000, 'fit_intercept': True, 'standardize_with_source': True, 'rho': 0.85}
[I 2026-06-01 19:23:24,879] Trial 229 finished with value: 0.25745213213224255 and parameters: {'alpha': 38223.292345960734, 'n_pcs': 4000, 'iw_method': 'pc_logistic', 'iw_clip_max': 7.0, 'iw_prob_clip': 0.037323805188803454, 'iw_n_components': 20, 'iw_logistic_c': 5.271424496732527e-05, 'iw_pca_fit': 'combined', 'iw_solver': 'lbfgs', 'iw_rho': 0.85}. Best is trial 216 with value: 0.25859517736085086.
2026-06-01 19:23:24 | INFO | Trial 230 | outer=5 | alpha=2.833e+04 n_pcs=4000 (pc_topk) weight={'name': 'pc_logistic', 'floor': 1e-06, 'clip_max': 7.0, 'prob_clip': 0.03284614156133755, 'n_components': 20, 'logistic_c': 2.3697819508743073e-05, 'pca_fit': 'combined', 'solver': 'lbfgs', 'max_iter': 2000, 'fit_intercept': True, 'standardize_with_source': True, 'rho': 0.85}
[I 2026-06-01 19:23:37,332] Trial 230 finished with value: 0.2553665596021192 and parameters: {'alpha': 28325.115345427403, 'n_pcs': 4000, 'iw_method': 'pc_logistic', 'iw_clip_max': 7.0, 'iw_prob_clip': 0.03284614156133755, 'iw_n_components': 20, 'iw_logistic_c': 2.3697819508743073e-05, 'iw_pca_fit': 'combined', 'iw_solver': 'lbfgs', 'iw_rho': 0.85}. Best is trial 216 with value: 0.25859517736085086.
2026-06-01 19:23:37 | INFO | Trial 231 | outer=5 | alpha=5.858e+04 n_pcs=4000 (pc_topk) weight={'name': 'pc_logistic', 'floor': 1e-06, 'clip_max': 7.0, 'prob_clip': 0.027099477613576034, 'n_components': 20, 'logistic_c': 4.2914647198484335e-05, 'pca_fit': 'combined', 'solver': 'lbfgs', 'max_iter': 2000, 'fit_intercept': True, 'standardize_with_source': True, 'rho': 0.85}
[I 2026-06-01 19:23:50,362] Trial 231 finished with value: 0.25837076443525875 and parameters: {'alpha': 58584.08579982289, 'n_pcs': 4000, 'iw_method': 'pc_logistic', 'iw_clip_max': 7.0, 'iw_prob_clip': 0.027099477613576034, 'iw_n_components': 20, 'iw_logistic_c': 4.2914647198484335e-05, 'iw_pca_fit': 'combined', 'iw_solver': 'lbfgs', 'iw_rho': 0.85}. Best is trial 216 with value: 0.25859517736085086.
2026-06-01 19:23:50 | INFO | Trial 232 | outer=5 | alpha=5.482e+04 n_pcs=4000 (pc_topk) weight={'name': 'pc_logistic', 'floor': 1e-06, 'clip_max': 7.0, 'prob_clip': 0.02629695070597875, 'n_components': 20, 'logistic_c': 3.904979599410592e-05, 'pca_fit': 'combined', 'solver': 'lbfgs', 'max_iter': 2000, 'fit_intercept': True, 'standardize_with_source': True, 'rho': 0.85}
[I 2026-06-01 19:24:03,228] Trial 232 finished with value: 0.2585436417408117 and parameters: {'alpha': 54815.08749578641, 'n_pcs': 4000, 'iw_method': 'pc_logistic', 'iw_clip_max': 7.0, 'iw_prob_clip': 0.02629695070597875, 'iw_n_components': 20, 'iw_logistic_c': 3.904979599410592e-05, 'iw_pca_fit': 'combined', 'iw_solver': 'lbfgs', 'iw_rho': 0.85}. Best is trial 216 with value: 0.25859517736085086.
2026-06-01 19:24:03 | INFO | Trial 233 | outer=5 | alpha=4.472e+04 n_pcs=4000 (pc_topk) weight={'name': 'pc_logistic', 'floor': 1e-06, 'clip_max': 7.0, 'prob_clip': 0.027503652502465694, 'n_components': 20, 'logistic_c': 3.67629458073383e-05, 'pca_fit': 'combined', 'solver': 'lbfgs', 'max_iter': 2000, 'fit_intercept': True, 'standardize_with_source': True, 'rho': 0.85}
