[I 2026-06-01 15:24:20,829] Trial 229 finished with value: 0.23799840420312038 and parameters: {'alpha': 233132.15346676548, 'n_pcs': 4000, 'iw_method': 'pc_logistic', 'iw_clip_max': 7.0, 'iw_prob_clip': 0.027939083042034272, 'iw_n_components': 60, 'iw_logistic_c': 3.745526650155258e-05, 'iw_pca_fit': 'combined', 'iw_solver': 'lbfgs', 'iw_rho': 1.0}. Best is trial 223 with value: 0.2452487948773226.
2026-06-01 15:24:20 | INFO | Trial 230 | outer=2 | alpha=4.185e+05 n_pcs=4000 (pc_topk) weight={'name': 'pc_logistic', 'floor': 1e-06, 'clip_max': 2.5, 'prob_clip': 0.025225753022025697, 'n_components': 60, 'logistic_c': 6.322171609328831e-06, 'pca_fit': 'combined', 'solver': 'lbfgs', 'max_iter': 2000, 'fit_intercept': True, 'standardize_with_source': True, 'rho': 1.0}
[I 2026-06-01 15:24:34,772] Trial 230 finished with value: 0.23822766723588967 and parameters: {'alpha': 418492.66508480266, 'n_pcs': 4000, 'iw_method': 'pc_logistic', 'iw_clip_max': 2.5, 'iw_prob_clip': 0.025225753022025697, 'iw_n_components': 60, 'iw_logistic_c': 6.322171609328831e-06, 'iw_pca_fit': 'combined', 'iw_solver': 'lbfgs', 'iw_rho': 1.0}. Best is trial 223 with value: 0.2452487948773226.
2026-06-01 15:24:34 | INFO | Trial 231 | outer=2 | alpha=2.646e+05 n_pcs=4000 (pc_topk) weight={'name': 'pc_logistic', 'floor': 1e-06, 'clip_max': 2.5, 'prob_clip': 0.023899953992593564, 'n_components': 60, 'logistic_c': 2.3068482341775472e-05, 'pca_fit': 'combined', 'solver': 'lbfgs', 'max_iter': 2000, 'fit_intercept': True, 'standardize_with_source': True, 'rho': 1.0}
[I 2026-06-01 15:24:48,743] Trial 231 finished with value: 0.24495169765529323 and parameters: {'alpha': 264638.65753412, 'n_pcs': 4000, 'iw_method': 'pc_logistic', 'iw_clip_max': 2.5, 'iw_prob_clip': 0.023899953992593564, 'iw_n_components': 60, 'iw_logistic_c': 2.3068482341775472e-05, 'iw_pca_fit': 'combined', 'iw_solver': 'lbfgs', 'iw_rho': 1.0}. Best is trial 223 with value: 0.2452487948773226.
2026-06-01 15:24:48 | INFO | Trial 232 | outer=2 | alpha=2.564e+05 n_pcs=4000 (pc_topk) weight={'name': 'pc_logistic', 'floor': 1e-06, 'clip_max': 2.5, 'prob_clip': 0.03528425769906664, 'n_components': 60, 'logistic_c': 2.359828367454122e-05, 'pca_fit': 'combined', 'solver': 'lbfgs', 'max_iter': 2000, 'fit_intercept': True, 'standardize_with_source': True, 'rho': 1.0}
[I 2026-06-01 15:25:03,790] Trial 232 finished with value: 0.24367725201790563 and parameters: {'alpha': 256374.0419070078, 'n_pcs': 4000, 'iw_method': 'pc_logistic', 'iw_clip_max': 2.5, 'iw_prob_clip': 0.03528425769906664, 'iw_n_components': 60, 'iw_logistic_c': 2.359828367454122e-05, 'iw_pca_fit': 'combined', 'iw_solver': 'lbfgs', 'iw_rho': 1.0}. Best is trial 223 with value: 0.2452487948773226.
2026-06-01 15:25:03 | INFO | Trial 233 | outer=2 | alpha=3.794e+05 n_pcs=4000 (pc_topk) weight={'name': 'pc_logistic', 'floor': 1e-06, 'clip_max': 2.5, 'prob_clip': 0.034812495876769066, 'n_components': 60, 'logistic_c': 1.4768421996337317e-05, 'pca_fit': 'combined', 'solver': 'lbfgs', 'max_iter': 2000, 'fit_intercept': True, 'standardize_with_source': True, 'rho': 1.0}
[I 2026-06-01 15:25:17,096] Trial 233 finished with value: 0.2409790806767563 and parameters: {'alpha': 379350.40237358684, 'n_pcs': 4000, 'iw_method': 'pc_logistic', 'iw_clip_max': 2.5, 'iw_prob_clip': 0.034812495876769066, 'iw_n_components': 60, 'iw_logistic_c': 1.4768421996337317e-05, 'iw_pca_fit': 'combined', 'iw_solver': 'lbfgs', 'iw_rho': 1.0}. Best is trial 223 with value: 0.2452487948773226.
2026-06-01 15:25:17 | INFO | Trial 234 | outer=2 | alpha=2.707e+05 n_pcs=4000 (pc_topk) weight={'name': 'pc_logistic', 'floor': 1e-06, 'clip_max': 2.5, 'prob_clip': 0.02262312856944765, 'n_components': 60, 'logistic_c': 3.579966960827093e-05, 'pca_fit': 'combined', 'solver': 'lbfgs', 'max_iter': 2000, 'fit_intercept': True, 'standardize_with_source': True, 'rho': 1.0}
[I 2026-06-01 15:25:30,854] Trial 234 finished with value: 0.24508875361863564 and parameters: {'alpha': 270684.10548188526, 'n_pcs': 4000, 'iw_method': 'pc_logistic', 'iw_clip_max': 2.5, 'iw_prob_clip': 0.02262312856944765, 'iw_n_components': 60, 'iw_logistic_c': 3.579966960827093e-05, 'iw_pca_fit': 'combined', 'iw_solver': 'lbfgs', 'iw_rho': 1.0}. Best is trial 223 with value: 0.2452487948773226.
2026-06-01 15:25:30 | INFO | Trial 235 | outer=2 | alpha=2.844e+05 n_pcs=4000 (pc_topk) weight={'name': 'pc_logistic', 'floor': 1e-06, 'clip_max': 2.5, 'prob_clip': 0.023134320750983067, 'n_components': 60, 'logistic_c': 3.67823715494354e-05, 'pca_fit': 'combined', 'solver': 'lbfgs', 'max_iter': 2000, 'fit_intercept': True, 'standardize_with_source': True, 'rho': 1.0}
[I 2026-06-01 15:25:44,400] Trial 235 finished with value: 0.2449319466478995 and parameters: {'alpha': 284421.01349151606, 'n_pcs': 4000, 'iw_method': 'pc_logistic', 'iw_clip_max': 2.5, 'iw_prob_clip': 0.023134320750983067, 'iw_n_components': 60, 'iw_logistic_c': 3.67823715494354e-05, 'iw_pca_fit': 'combined', 'iw_solver': 'lbfgs', 'iw_rho': 1.0}. Best is trial 223 with value: 0.2452487948773226.
2026-06-01 15:25:44 | INFO | Trial 236 | outer=2 | alpha=2.874e+05 n_pcs=4000 (pc_topk) weight={'name': 'pc_logistic', 'floor': 1e-06, 'clip_max': 2.5, 'prob_clip': 0.022604737491432124, 'n_components': 60, 'logistic_c': 3.820423795001312e-05, 'pca_fit': 'combined', 'solver': 'lbfgs', 'max_iter': 2000, 'fit_intercept': True, 'standardize_with_source': True, 'rho': 1.0}
[I 2026-06-01 15:25:57,766] Trial 236 finished with value: 0.24494294460108076 and parameters: {'alpha': 287444.6756001824, 'n_pcs': 4000, 'iw_method': 'pc_logistic', 'iw_clip_max': 2.5, 'iw_prob_clip': 0.022604737491432124, 'iw_n_components': 60, 'iw_logistic_c': 3.820423795001312e-05, 'iw_pca_fit': 'combined', 'iw_solver': 'lbfgs', 'iw_rho': 1.0}. Best is trial 223 with value: 0.2452487948773226.
2026-06-01 15:25:57 | INFO | Trial 237 | outer=2 | alpha=2.863e+05 n_pcs=4000 (pc_topk) weight={'name': 'pc_logistic', 'floor': 1e-06, 'clip_max': 2.5, 'prob_clip': 0.021659087820195055, 'n_components': 60, 'logistic_c': 3.66884714990653e-05, 'pca_fit': 'combined', 'solver': 'lbfgs', 'max_iter': 2000, 'fit_intercept': True, 'standardize_with_source': True, 'rho': 1.0}
[I 2026-06-01 15:26:11,337] Trial 237 finished with value: 0.24494345868665218 and parameters: {'alpha': 286316.38492912747, 'n_pcs': 4000, 'iw_method': 'pc_logistic', 'iw_clip_max': 2.5, 'iw_prob_clip': 0.021659087820195055, 'iw_n_components': 60, 'iw_logistic_c': 3.66884714990653e-05, 'iw_pca_fit': 'combined', 'iw_solver': 'lbfgs', 'iw_rho': 1.0}. Best is trial 223 with value: 0.2452487948773226.
2026-06-01 15:26:11 | INFO | Trial 238 | outer=2 | alpha=3.642e+05 n_pcs=4000 (pc_topk) weight={'name': 'pc_logistic', 'floor': 1e-06, 'clip_max': 1.5, 'prob_clip': 0.021743285468837057, 'n_components': 60, 'logistic_c': 2.157353289361575e-05, 'pca_fit': 'combined', 'solver': 'lbfgs', 'max_iter': 2000, 'fit_intercept': True, 'standardize_with_source': True, 'rho': 1.0}
[I 2026-06-01 15:26:24,746] Trial 238 finished with value: 0.23851618403204716 and parameters: {'alpha': 364201.1468841846, 'n_pcs': 4000, 'iw_method': 'pc_logistic', 'iw_clip_max': 1.5, 'iw_prob_clip': 0.021743285468837057, 'iw_n_components': 60, 'iw_logistic_c': 2.157353289361575e-05, 'iw_pca_fit': 'combined', 'iw_solver': 'lbfgs', 'iw_rho': 1.0}. Best is trial 223 with value: 0.2452487948773226.
2026-06-01 15:26:24 | INFO | Trial 239 | outer=2 | alpha=2.867e+05 n_pcs=4000 (pc_topk) weight={'name': 'pc_logistic', 'floor': 1e-06, 'clip_max': 2.5, 'prob_clip': 0.026628454671109237, 'n_components': 60, 'logistic_c': 2.6935838129299476e-05, 'pca_fit': 'combined', 'solver': 'lbfgs', 'max_iter': 2000, 'fit_intercept': True, 'standardize_with_source': True, 'rho': 1.0}
[I 2026-06-01 15:26:38,256] Trial 239 finished with value: 0.24471893091604832 and parameters: {'alpha': 286657.31341139437, 'n_pcs': 4000, 'iw_method': 'pc_logistic', 'iw_clip_max': 2.5, 'iw_prob_clip': 0.026628454671109237, 'iw_n_components': 60, 'iw_logistic_c': 2.6935838129299476e-05, 'iw_pca_fit': 'combined', 'iw_solver': 'lbfgs', 'iw_rho': 1.0}. Best is trial 223 with value: 0.2452487948773226.
2026-06-01 15:26:38 | INFO | Trial 240 | outer=2 | alpha=4.567e+05 n_pcs=4000 (pc_topk) weight={'name': 'pc_logistic', 'floor': 1e-06, 'clip_max': 2.5, 'prob_clip': 0.023260507011266283, 'n_components': 60, 'logistic_c': 8.780437122259627e-06, 'pca_fit': 'combined', 'solver': 'lbfgs', 'max_iter': 2000, 'fit_intercept': True, 'standardize_with_source': True, 'rho': 1.0}
[I 2026-06-01 15:26:52,012] Trial 240 finished with value: 0.23934646920615013 and parameters: {'alpha': 456681.54094669264, 'n_pcs': 4000, 'iw_method': 'pc_logistic', 'iw_clip_max': 2.5, 'iw_prob_clip': 0.023260507011266283, 'iw_n_components': 60, 'iw_logistic_c': 8.780437122259627e-06, 'iw_pca_fit': 'combined', 'iw_solver': 'lbfgs', 'iw_rho': 1.0}. Best is trial 223 with value: 0.2452487948773226.
2026-06-01 15:26:52 | INFO | Trial 241 | outer=2 | alpha=2.902e+05 n_pcs=4000 (pc_topk) weight={'name': 'pc_logistic', 'floor': 1e-06, 'clip_max': 2.5, 'prob_clip': 0.025420324254379494, 'n_components': 60, 'logistic_c': 2.932365464787126e-05, 'pca_fit': 'combined', 'solver': 'lbfgs', 'max_iter': 2000, 'fit_intercept': True, 'standardize_with_source': True, 'rho': 1.0}
[I 2026-06-01 15:27:08,047] Trial 241 finished with value: 0.24470109575050283 and parameters: {'alpha': 290160.33744454535, 'n_pcs': 4000, 'iw_method': 'pc_logistic', 'iw_clip_max': 2.5, 'iw_prob_clip': 0.025420324254379494, 'iw_n_components': 60, 'iw_logistic_c': 2.932365464787126e-05, 'iw_pca_fit': 'combined', 'iw_solver': 'lbfgs', 'iw_rho': 1.0}. Best is trial 223 with value: 0.2452487948773226.
2026-06-01 15:27:08 | INFO | Trial 242 | outer=2 | alpha=3.016e+05 n_pcs=4000 (pc_topk) weight={'name': 'pc_logistic', 'floor': 1e-06, 'clip_max': 2.5, 'prob_clip': 0.026825681365374617, 'n_components': 60, 'logistic_c': 3.1561450527676396e-05, 'pca_fit': 'combined', 'solver': 'lbfgs', 'max_iter': 2000, 'fit_intercept': True, 'standardize_with_source': True, 'rho': 1.0}
[I 2026-06-01 15:27:22,186] Trial 242 finished with value: 0.24453581769066482 and parameters: {'alpha': 301572.62621677556, 'n_pcs': 4000, 'iw_method': 'pc_logistic', 'iw_clip_max': 2.5, 'iw_prob_clip': 0.026825681365374617, 'iw_n_components': 60, 'iw_logistic_c': 3.1561450527676396e-05, 'iw_pca_fit': 'combined', 'iw_solver': 'lbfgs', 'iw_rho': 1.0}. Best is trial 223 with value: 0.2452487948773226.
2026-06-01 15:27:22 | INFO | Trial 243 | outer=2 | alpha=3.241e+05 n_pcs=4000 (pc_topk) weight={'name': 'pc_logistic', 'floor': 1e-06, 'clip_max': 2.5, 'prob_clip': 0.026277194440009664, 'n_components': 60, 'logistic_c': 2.4255905610565614e-05, 'pca_fit': 'combined', 'solver': 'lbfgs', 'max_iter': 2000, 'fit_intercept': True, 'standardize_with_source': True, 'rho': 1.0}
[I 2026-06-01 15:27:36,086] Trial 243 finished with value: 0.24422495215956688 and parameters: {'alpha': 324112.4119673301, 'n_pcs': 4000, 'iw_method': 'pc_logistic', 'iw_clip_max': 2.5, 'iw_prob_clip': 0.026277194440009664, 'iw_n_components': 60, 'iw_logistic_c': 2.4255905610565614e-05, 'iw_pca_fit': 'combined', 'iw_solver': 'lbfgs', 'iw_rho': 1.0}. Best is trial 223 with value: 0.2452487948773226.
2026-06-01 15:27:36 | INFO | Trial 244 | outer=2 | alpha=2.961e+05 n_pcs=4000 (pc_topk) weight={'name': 'pc_logistic', 'floor': 1e-06, 'clip_max': 2.5, 'prob_clip': 0.034132062883103914, 'n_components': 60, 'logistic_c': 3.991710764142583e-05, 'pca_fit': 'combined', 'solver': 'lbfgs', 'max_iter': 2000, 'fit_intercept': True, 'standardize_with_source': True, 'rho': 1.0}
[I 2026-06-01 15:27:49,745] Trial 244 finished with value: 0.24330327379502928 and parameters: {'alpha': 296126.8848313482, 'n_pcs': 4000, 'iw_method': 'pc_logistic', 'iw_clip_max': 2.5, 'iw_prob_clip': 0.034132062883103914, 'iw_n_components': 60, 'iw_logistic_c': 3.991710764142583e-05, 'iw_pca_fit': 'combined', 'iw_solver': 'lbfgs', 'iw_rho': 1.0}. Best is trial 223 with value: 0.2452487948773226.
2026-06-01 15:27:49 | INFO | Trial 245 | outer=2 | alpha=3.792e+05 n_pcs=4000 (pc_topk) weight={'name': 'pc_logistic', 'floor': 1e-06, 'clip_max': 2.5, 'prob_clip': 0.02413920813214994, 'n_components': 60, 'logistic_c': 1.703283232887329e-05, 'pca_fit': 'combined', 'solver': 'lbfgs', 'max_iter': 2000, 'fit_intercept': True, 'standardize_with_source': True, 'rho': 1.0}
[I 2026-06-01 15:28:03,253] Trial 245 finished with value: 0.24316953079958664 and parameters: {'alpha': 379231.5753561416, 'n_pcs': 4000, 'iw_method': 'pc_logistic', 'iw_clip_max': 2.5, 'iw_prob_clip': 0.02413920813214994, 'iw_n_components': 60, 'iw_logistic_c': 1.703283232887329e-05, 'iw_pca_fit': 'combined', 'iw_solver': 'lbfgs', 'iw_rho': 1.0}. Best is trial 223 with value: 0.2452487948773226.
2026-06-01 15:28:03 | INFO | Trial 246 | outer=2 | alpha=5.296e+05 n_pcs=4000 (pc_topk) weight={'name': 'pc_logistic', 'floor': 1e-06, 'clip_max': 2.5, 'prob_clip': 0.03143794686277934, 'n_components': 60, 'logistic_c': 2.8944253705707904e-05, 'pca_fit': 'combined', 'solver': 'lbfgs', 'max_iter': 2000, 'fit_intercept': True, 'standardize_with_source': True, 'rho': 1.0}
[I 2026-06-01 15:28:16,709] Trial 246 finished with value: 0.24118836316908113 and parameters: {'alpha': 529583.0521280126, 'n_pcs': 4000, 'iw_method': 'pc_logistic', 'iw_clip_max': 2.5, 'iw_prob_clip': 0.03143794686277934, 'iw_n_components': 60, 'iw_logistic_c': 2.8944253705707904e-05, 'iw_pca_fit': 'combined', 'iw_solver': 'lbfgs', 'iw_rho': 1.0}. Best is trial 223 with value: 0.2452487948773226.
2026-06-01 15:28:16 | INFO | Trial 247 | outer=2 | alpha=2.855e+05 n_pcs=4000 (pc_topk) weight={'name': 'pc_logistic', 'floor': 1e-06, 'clip_max': 2.5, 'prob_clip': 0.026857456264190695, 'n_components': 60, 'logistic_c': 3.563002192023298e-05, 'pca_fit': 'combined', 'solver': 'lbfgs', 'max_iter': 2000, 'fit_intercept': True, 'standardize_with_source': True, 'rho': 1.0}
[I 2026-06-01 15:28:33,062] Trial 247 finished with value: 0.24470825839453955 and parameters: {'alpha': 285502.99668753013, 'n_pcs': 4000, 'iw_method': 'pc_logistic', 'iw_clip_max': 2.5, 'iw_prob_clip': 0.026857456264190695, 'iw_n_components': 60, 'iw_logistic_c': 3.563002192023298e-05, 'iw_pca_fit': 'combined', 'iw_solver': 'lbfgs', 'iw_rho': 1.0}. Best is trial 223 with value: 0.2452487948773226.
2026-06-01 15:28:33 | INFO | Trial 248 | outer=2 | alpha=3.619e+05 n_pcs=4000 (pc_topk) weight={'name': 'pc_logistic', 'floor': 1e-06, 'clip_max': 2.5, 'prob_clip': 0.02671851974190539, 'n_components': 60, 'logistic_c': 1.4127800593389745e-05, 'pca_fit': 'combined', 'solver': 'lbfgs', 'max_iter': 2000, 'fit_intercept': True, 'standardize_with_source': True, 'rho': 1.0}
[I 2026-06-01 15:28:49,460] Trial 248 finished with value: 0.24261722335348607 and parameters: {'alpha': 361873.5552375849, 'n_pcs': 4000, 'iw_method': 'pc_logistic', 'iw_clip_max': 2.5, 'iw_prob_clip': 0.02671851974190539, 'iw_n_components': 60, 'iw_logistic_c': 1.4127800593389745e-05, 'iw_pca_fit': 'combined', 'iw_solver': 'lbfgs', 'iw_rho': 1.0}. Best is trial 223 with value: 0.2452487948773226.
2026-06-01 15:28:49 | INFO | Trial 249 | outer=2 | alpha=2.817e+05 n_pcs=4000 (pc_topk) weight={'name': 'pc_logistic', 'floor': 1e-06, 'clip_max': 2.5, 'prob_clip': 0.021384105298574325, 'n_components': 60, 'logistic_c': 2.6416959784807023e-05, 'pca_fit': 'combined', 'solver': 'lbfgs', 'max_iter': 2000, 'fit_intercept': True, 'standardize_with_source': True, 'rho': 1.0}
[I 2026-06-01 15:29:02,700] Trial 249 finished with value: 0.24474393609833028 and parameters: {'alpha': 281666.2597695137, 'n_pcs': 4000, 'iw_method': 'pc_logistic', 'iw_clip_max': 2.5, 'iw_prob_clip': 0.021384105298574325, 'iw_n_components': 60, 'iw_logistic_c': 2.6416959784807023e-05, 'iw_pca_fit': 'combined', 'iw_solver': 'lbfgs', 'iw_rho': 1.0}. Best is trial 223 with value: 0.2452487948773226.
2026-06-01 15:29:02 | INFO | Trial 250 | outer=2 | alpha=2.127e+05 n_pcs=4000 (pc_topk) weight={'name': 'pc_logistic', 'floor': 1e-06, 'clip_max': 2.5, 'prob_clip': 0.022613403120150123, 'n_components': 60, 'logistic_c': 2.7861366818729363e-05, 'pca_fit': 'combined', 'solver': 'lbfgs', 'max_iter': 2000, 'fit_intercept': True, 'standardize_with_source': True, 'rho': 1.0}
[I 2026-06-01 15:29:18,063] Trial 250 finished with value: 0.24563604517254056 and parameters: {'alpha': 212749.1612965695, 'n_pcs': 4000, 'iw_method': 'pc_logistic', 'iw_clip_max': 2.5, 'iw_prob_clip': 0.022613403120150123, 'iw_n_components': 60, 'iw_logistic_c': 2.7861366818729363e-05, 'iw_pca_fit': 'combined', 'iw_solver': 'lbfgs', 'iw_rho': 1.0}. Best is trial 250 with value: 0.24563604517254056.
2026-06-01 15:29:18 | INFO | Trial 251 | outer=2 | alpha=2.090e+05 n_pcs=4000 (pc_topk) weight={'name': 'pc_logistic', 'floor': 1e-06, 'clip_max': 12.0, 'prob_clip': 0.02345506569473381, 'n_components': 60, 'logistic_c': 2.873054822070325e-05, 'pca_fit': 'combined', 'solver': 'lbfgs', 'max_iter': 2000, 'fit_intercept': True, 'standardize_with_source': True, 'rho': 1.0}
[I 2026-06-01 15:29:31,426] Trial 251 finished with value: 0.23323437726073068 and parameters: {'alpha': 208962.02383168513, 'n_pcs': 4000, 'iw_method': 'pc_logistic', 'iw_clip_max': 12.0, 'iw_prob_clip': 0.02345506569473381, 'iw_n_components': 60, 'iw_logistic_c': 2.873054822070325e-05, 'iw_pca_fit': 'combined', 'iw_solver': 'lbfgs', 'iw_rho': 1.0}. Best is trial 250 with value: 0.24563604517254056.
2026-06-01 15:29:31 | INFO | Trial 252 | outer=2 | alpha=2.174e+05 n_pcs=4000 (pc_topk) weight={'name': 'pc_logistic', 'floor': 1e-06, 'clip_max': 2.5, 'prob_clip': 0.021508581139186474, 'n_components': 60, 'logistic_c': 2.3661428931662994e-05, 'pca_fit': 'combined', 'solver': 'lbfgs', 'max_iter': 2000, 'fit_intercept': True, 'standardize_with_source': True, 'rho': 1.0}
[I 2026-06-01 15:29:45,072] Trial 252 finished with value: 0.24545190833137295 and parameters: {'alpha': 217445.28958282396, 'n_pcs': 4000, 'iw_method': 'pc_logistic', 'iw_clip_max': 2.5, 'iw_prob_clip': 0.021508581139186474, 'iw_n_components': 60, 'iw_logistic_c': 2.3661428931662994e-05, 'iw_pca_fit': 'combined', 'iw_solver': 'lbfgs', 'iw_rho': 1.0}. Best is trial 250 with value: 0.24563604517254056.
2026-06-01 15:29:45 | INFO | Trial 253 | outer=2 | alpha=3.523e+05 n_pcs=4000 (pc_topk) weight={'name': 'pc_logistic', 'floor': 1e-06, 'clip_max': 2.5, 'prob_clip': 0.021627168128950398, 'n_components': 60, 'logistic_c': 2.4413738988885457e-05, 'pca_fit': 'combined', 'solver': 'lbfgs', 'max_iter': 2000, 'fit_intercept': True, 'standardize_with_source': True, 'rho': 1.0}
[I 2026-06-01 15:29:58,681] Trial 253 finished with value: 0.24377786895120832 and parameters: {'alpha': 352275.2633937771, 'n_pcs': 4000, 'iw_method': 'pc_logistic', 'iw_clip_max': 2.5, 'iw_prob_clip': 0.021627168128950398, 'iw_n_components': 60, 'iw_logistic_c': 2.4413738988885457e-05, 'iw_pca_fit': 'combined', 'iw_solver': 'lbfgs', 'iw_rho': 1.0}. Best is trial 250 with value: 0.24563604517254056.
2026-06-01 15:29:58 | INFO | Trial 254 | outer=2 | alpha=2.184e+05 n_pcs=4000 (pc_topk) weight={'name': 'pc_logistic', 'floor': 1e-06, 'clip_max': 2.5, 'prob_clip': 0.026624627911701764, 'n_components': 60, 'logistic_c': 1.4344954862598753e-05, 'pca_fit': 'combined', 'solver': 'lbfgs', 'max_iter': 2000, 'fit_intercept': True, 'standardize_with_source': True, 'rho': 1.0}
[I 2026-06-01 15:30:11,714] Trial 254 finished with value: 0.2447002649292412 and parameters: {'alpha': 218407.87969899795, 'n_pcs': 4000, 'iw_method': 'pc_logistic', 'iw_clip_max': 2.5, 'iw_prob_clip': 0.026624627911701764, 'iw_n_components': 60, 'iw_logistic_c': 1.4344954862598753e-05, 'iw_pca_fit': 'combined', 'iw_solver': 'lbfgs', 'iw_rho': 1.0}. Best is trial 250 with value: 0.24563604517254056.
2026-06-01 15:30:11 | INFO | Trial 255 | outer=2 | alpha=2.138e+05 n_pcs=4000 (pc_topk) weight={'name': 'pc_logistic', 'floor': 1e-06, 'clip_max': 2.5, 'prob_clip': 0.026841913546265403, 'n_components': 60, 'logistic_c': 1.0901443490718443e-05, 'pca_fit': 'combined', 'solver': 'lbfgs', 'max_iter': 2000, 'fit_intercept': True, 'standardize_with_source': True, 'rho': 1.0}
[I 2026-06-01 15:30:25,367] Trial 255 finished with value: 0.24399916518620635 and parameters: {'alpha': 213794.41536737207, 'n_pcs': 4000, 'iw_method': 'pc_logistic', 'iw_clip_max': 2.5, 'iw_prob_clip': 0.026841913546265403, 'iw_n_components': 60, 'iw_logistic_c': 1.0901443490718443e-05, 'iw_pca_fit': 'combined', 'iw_solver': 'lbfgs', 'iw_rho': 1.0}. Best is trial 250 with value: 0.24563604517254056.
2026-06-01 15:30:25 | INFO | Trial 256 | outer=2 | alpha=2.731e+05 n_pcs=4000 (pc_topk) weight={'name': 'pc_logistic', 'floor': 1e-06, 'clip_max': 2.5, 'prob_clip': 0.031088426685326995, 'n_components': 60, 'logistic_c': 1.6322584393942753e-05, 'pca_fit': 'combined', 'solver': 'lbfgs', 'max_iter': 2000, 'fit_intercept': True, 'standardize_with_source': True, 'rho': 1.0}
[I 2026-06-01 15:30:38,411] Trial 256 finished with value: 0.2437721333701483 and parameters: {'alpha': 273134.53267419146, 'n_pcs': 4000, 'iw_method': 'pc_logistic', 'iw_clip_max': 2.5, 'iw_prob_clip': 0.031088426685326995, 'iw_n_components': 60, 'iw_logistic_c': 1.6322584393942753e-05, 'iw_pca_fit': 'combined', 'iw_solver': 'lbfgs', 'iw_rho': 1.0}. Best is trial 250 with value: 0.24563604517254056.
2026-06-01 15:30:38 | INFO | Trial 257 | outer=2 | alpha=2.190e+05 n_pcs=4000 (pc_topk) weight={'name': 'uniform'}
