[I 2026-05-31 23:46:39,718] Trial 205 finished with value: 0.20854193599208265 and parameters: {'alpha': 169682.34285002557, 'n_pcs': 3000, 'weight_scheme': 'exponential', 'weight_clip_max': 3.0, 'weight_exponential_beta': 3.477652030894648}. Best is trial 191 with value: 0.20863437636832166.
2026-05-31 23:46:39 | INFO | src.nested_cv_avggrm_weighted_unified | Trial 206 | outer=3 | alpha=1.448e+05 n_pcs=3000 (pc_topk) weight_search=on
2026-05-31 23:46:39 | INFO | src.nested_cv_avggrm_weighted_unified | Trial 206 | outer=3 | weight={'name': 'exponential', 'floor': 1e-06, 'clip_max': 3.0, 'beta': 3.6145451303623117}
2026-05-31 23:46:42 | INFO | src.nested_cv_avggrm_weighted_unified | Trial 206 | outer=3 | pruned after 6/10 inner folds (mean r=0.2230)
[I 2026-05-31 23:46:42,022] Trial 206 pruned. 
2026-05-31 23:46:42 | INFO | src.nested_cv_avggrm_weighted_unified | Trial 207 | outer=3 | alpha=1.257e+05 n_pcs=3000 (pc_topk) weight_search=on
2026-05-31 23:46:42 | INFO | src.nested_cv_avggrm_weighted_unified | Trial 207 | outer=3 | weight={'name': 'exponential', 'floor': 1e-06, 'clip_max': 3.0, 'beta': 3.3790749262665534}
2026-05-31 23:46:44 | INFO | src.nested_cv_avggrm_weighted_unified | Trial 207 | outer=3 | pruned after 6/10 inner folds (mean r=0.2224)
[I 2026-05-31 23:46:44,340] Trial 207 pruned. 
2026-05-31 23:46:44 | INFO | src.nested_cv_avggrm_weighted_unified | Trial 208 | outer=3 | alpha=9.513e+04 n_pcs=3500 (pc_topk) weight_search=on
2026-05-31 23:46:44 | INFO | src.nested_cv_avggrm_weighted_unified | Trial 208 | outer=3 | weight={'name': 'exponential', 'floor': 1e-06, 'clip_max': 3.0, 'beta': 3.1492070788182587}
2026-05-31 23:46:47 | INFO | src.nested_cv_avggrm_weighted_unified | Trial 208 | outer=3 | pruned after 6/10 inner folds (mean r=0.2170)
[I 2026-05-31 23:46:47,260] Trial 208 pruned. 
2026-05-31 23:46:47 | INFO | src.nested_cv_avggrm_weighted_unified | Trial 209 | outer=3 | alpha=2.135e+05 n_pcs=3000 (pc_topk) weight_search=on
2026-05-31 23:46:47 | INFO | src.nested_cv_avggrm_weighted_unified | Trial 209 | outer=3 | weight={'name': 'exponential', 'floor': 1e-06, 'clip_max': 3.0, 'beta': 3.4367400032150437}
[I 2026-05-31 23:46:51,211] Trial 209 finished with value: 0.20839404842818077 and parameters: {'alpha': 213458.29212338253, 'n_pcs': 3000, 'weight_scheme': 'exponential', 'weight_clip_max': 3.0, 'weight_exponential_beta': 3.4367400032150437}. Best is trial 191 with value: 0.20863437636832166.
2026-05-31 23:46:51 | INFO | src.nested_cv_avggrm_weighted_unified | Trial 210 | outer=3 | alpha=1.690e+05 n_pcs=3000 (pc_topk) weight_search=on
2026-05-31 23:46:51 | INFO | src.nested_cv_avggrm_weighted_unified | Trial 210 | outer=3 | weight={'name': 'exponential', 'floor': 1e-06, 'clip_max': 10.0, 'beta': 2.8520364395618323}
2026-05-31 23:46:53 | INFO | src.nested_cv_avggrm_weighted_unified | Trial 210 | outer=3 | pruned after 6/10 inner folds (mean r=0.2205)
[I 2026-05-31 23:46:53,511] Trial 210 pruned. 
2026-05-31 23:46:53 | INFO | src.nested_cv_avggrm_weighted_unified | Trial 211 | outer=3 | alpha=1.684e+05 n_pcs=3000 (pc_topk) weight_search=on
2026-05-31 23:46:53 | INFO | src.nested_cv_avggrm_weighted_unified | Trial 211 | outer=3 | weight={'name': 'exponential', 'floor': 1e-06, 'clip_max': 3.0, 'beta': 3.0715847231855054}
[I 2026-05-31 23:46:57,269] Trial 211 finished with value: 0.20857381564615518 and parameters: {'alpha': 168355.8265069294, 'n_pcs': 3000, 'weight_scheme': 'exponential', 'weight_clip_max': 3.0, 'weight_exponential_beta': 3.0715847231855054}. Best is trial 191 with value: 0.20863437636832166.
2026-05-31 23:46:57 | INFO | src.nested_cv_avggrm_weighted_unified | Trial 212 | outer=3 | alpha=1.698e+05 n_pcs=3000 (pc_topk) weight_search=on
2026-05-31 23:46:57 | INFO | src.nested_cv_avggrm_weighted_unified | Trial 212 | outer=3 | weight={'name': 'exponential', 'floor': 1e-06, 'clip_max': 3.0, 'beta': 3.150359083914653}
[I 2026-05-31 23:47:01,332] Trial 212 finished with value: 0.20862593351114733 and parameters: {'alpha': 169754.07643298808, 'n_pcs': 3000, 'weight_scheme': 'exponential', 'weight_clip_max': 3.0, 'weight_exponential_beta': 3.150359083914653}. Best is trial 191 with value: 0.20863437636832166.
2026-05-31 23:47:01 | INFO | src.nested_cv_avggrm_weighted_unified | Trial 213 | outer=3 | alpha=1.460e+05 n_pcs=3000 (pc_topk) weight_search=on
2026-05-31 23:47:01 | INFO | src.nested_cv_avggrm_weighted_unified | Trial 213 | outer=3 | weight={'name': 'exponential', 'floor': 1e-06, 'clip_max': 3.0, 'beta': 3.172448642572641}
2026-05-31 23:47:03 | INFO | src.nested_cv_avggrm_weighted_unified | Trial 213 | outer=3 | pruned after 6/10 inner folds (mean r=0.2234)
[I 2026-05-31 23:47:03,660] Trial 213 pruned. 
2026-05-31 23:47:03 | INFO | src.nested_cv_avggrm_weighted_unified | Trial 214 | outer=3 | alpha=1.182e+05 n_pcs=3000 (pc_topk) weight_search=on
2026-05-31 23:47:03 | INFO | src.nested_cv_avggrm_weighted_unified | Trial 214 | outer=3 | weight={'name': 'exponential', 'floor': 1e-06, 'clip_max': 3.0, 'beta': 3.334628673431716}
2026-05-31 23:47:06 | INFO | src.nested_cv_avggrm_weighted_unified | Trial 214 | outer=3 | pruned after 7/10 inner folds (mean r=0.2471)
[I 2026-05-31 23:47:06,328] Trial 214 pruned. 
2026-05-31 23:47:06 | INFO | src.nested_cv_avggrm_weighted_unified | Trial 215 | outer=3 | alpha=2.185e+05 n_pcs=3000 (pc_topk) weight_search=on
2026-05-31 23:47:06 | INFO | src.nested_cv_avggrm_weighted_unified | Trial 215 | outer=3 | weight={'name': 'exponential', 'floor': 1e-06, 'clip_max': 3.0, 'beta': 3.0690670731991188}
[I 2026-05-31 23:47:10,162] Trial 215 finished with value: 0.2083384910760912 and parameters: {'alpha': 218542.7070168129, 'n_pcs': 3000, 'weight_scheme': 'exponential', 'weight_clip_max': 3.0, 'weight_exponential_beta': 3.0690670731991188}. Best is trial 191 with value: 0.20863437636832166.
2026-05-31 23:47:10 | INFO | src.nested_cv_avggrm_weighted_unified | Trial 216 | outer=3 | alpha=1.640e+05 n_pcs=3000 (pc_topk) weight_search=on
2026-05-31 23:47:10 | INFO | src.nested_cv_avggrm_weighted_unified | Trial 216 | outer=3 | weight={'name': 'exponential', 'floor': 1e-06, 'clip_max': 3.0, 'beta': 2.7927917651784546}
[I 2026-05-31 23:47:13,974] Trial 216 finished with value: 0.20836075661575393 and parameters: {'alpha': 163993.777755679, 'n_pcs': 3000, 'weight_scheme': 'exponential', 'weight_clip_max': 3.0, 'weight_exponential_beta': 2.7927917651784546}. Best is trial 191 with value: 0.20863437636832166.
2026-05-31 23:47:13 | INFO | src.nested_cv_avggrm_weighted_unified | Trial 217 | outer=3 | alpha=1.360e+05 n_pcs=3000 (pc_topk) weight_search=on
2026-05-31 23:47:13 | INFO | src.nested_cv_avggrm_weighted_unified | Trial 217 | outer=3 | weight={'name': 'exponential', 'floor': 1e-06, 'clip_max': 3.0, 'beta': 3.5187562502608185}
2026-05-31 23:47:16 | INFO | src.nested_cv_avggrm_weighted_unified | Trial 217 | outer=3 | pruned after 6/10 inner folds (mean r=0.2227)
[I 2026-05-31 23:47:16,248] Trial 217 pruned. 
2026-05-31 23:47:16 | INFO | src.nested_cv_avggrm_weighted_unified | Trial 218 | outer=3 | alpha=1.799e+05 n_pcs=3000 (pc_topk) weight_search=on
2026-05-31 23:47:16 | INFO | src.nested_cv_avggrm_weighted_unified | Trial 218 | outer=3 | weight={'name': 'exponential', 'floor': 1e-06, 'clip_max': 3.0, 'beta': 2.4999247898247496}
[I 2026-05-31 23:47:20,040] Trial 218 finished with value: 0.20808041374593209 and parameters: {'alpha': 179863.65876787202, 'n_pcs': 3000, 'weight_scheme': 'exponential', 'weight_clip_max': 3.0, 'weight_exponential_beta': 2.4999247898247496}. Best is trial 191 with value: 0.20863437636832166.
2026-05-31 23:47:20 | INFO | src.nested_cv_avggrm_weighted_unified | Trial 219 | outer=3 | alpha=2.153e+05 n_pcs=3000 (pc_topk) weight_search=on
2026-05-31 23:47:20 | INFO | src.nested_cv_avggrm_weighted_unified | Trial 219 | outer=3 | weight={'name': 'exponential', 'floor': 1e-06, 'clip_max': 3.0, 'beta': 3.085540978261527}
[I 2026-05-31 23:47:23,880] Trial 219 finished with value: 0.20837438242494036 and parameters: {'alpha': 215283.5969298069, 'n_pcs': 3000, 'weight_scheme': 'exponential', 'weight_clip_max': 3.0, 'weight_exponential_beta': 3.085540978261527}. Best is trial 191 with value: 0.20863437636832166.
2026-05-31 23:47:23 | INFO | src.nested_cv_avggrm_weighted_unified | Trial 220 | outer=3 | alpha=1.096e+05 n_pcs=3000 (pc_topk) weight_search=on
2026-05-31 23:47:23 | INFO | src.nested_cv_avggrm_weighted_unified | Trial 220 | outer=3 | weight={'name': 'exponential', 'floor': 1e-06, 'clip_max': 3.0, 'beta': 3.2531650501183726}
2026-05-31 23:47:27 | INFO | src.nested_cv_avggrm_weighted_unified | Trial 220 | outer=3 | pruned after 7/10 inner folds (mean r=0.2466)
[I 2026-05-31 23:47:27,173] Trial 220 pruned. 
2026-05-31 23:47:27 | INFO | src.nested_cv_avggrm_weighted_unified | Trial 221 | outer=3 | alpha=1.638e+05 n_pcs=3000 (pc_topk) weight_search=on
2026-05-31 23:47:27 | INFO | src.nested_cv_avggrm_weighted_unified | Trial 221 | outer=3 | weight={'name': 'exponential', 'floor': 1e-06, 'clip_max': 3.0, 'beta': 2.9065413674570855}
[I 2026-05-31 23:47:30,954] Trial 221 finished with value: 0.20843802411025067 and parameters: {'alpha': 163763.67913271964, 'n_pcs': 3000, 'weight_scheme': 'exponential', 'weight_clip_max': 3.0, 'weight_exponential_beta': 2.9065413674570855}. Best is trial 191 with value: 0.20863437636832166.
2026-05-31 23:47:30 | INFO | src.nested_cv_avggrm_weighted_unified | Trial 222 | outer=3 | alpha=1.863e+05 n_pcs=3000 (pc_topk) weight_search=on
2026-05-31 23:47:30 | INFO | src.nested_cv_avggrm_weighted_unified | Trial 222 | outer=3 | weight={'name': 'exponential', 'floor': 1e-06, 'clip_max': 3.0, 'beta': 3.006437911992335}
[I 2026-05-31 23:47:34,731] Trial 222 finished with value: 0.20847550980422377 and parameters: {'alpha': 186274.19476613152, 'n_pcs': 3000, 'weight_scheme': 'exponential', 'weight_clip_max': 3.0, 'weight_exponential_beta': 3.006437911992335}. Best is trial 191 with value: 0.20863437636832166.
2026-05-31 23:47:34 | INFO | src.nested_cv_avggrm_weighted_unified | Trial 223 | outer=3 | alpha=1.383e+05 n_pcs=3000 (pc_topk) weight_search=on
2026-05-31 23:47:34 | INFO | src.nested_cv_avggrm_weighted_unified | Trial 223 | outer=3 | weight={'name': 'exponential', 'floor': 1e-06, 'clip_max': 3.0, 'beta': 2.6719531921382793}
2026-05-31 23:47:37 | INFO | src.nested_cv_avggrm_weighted_unified | Trial 223 | outer=3 | pruned after 7/10 inner folds (mean r=0.2486)
[I 2026-05-31 23:47:37,426] Trial 223 pruned. 
2026-05-31 23:47:37 | INFO | src.nested_cv_avggrm_weighted_unified | Trial 224 | outer=3 | alpha=1.952e+05 n_pcs=3000 (pc_topk) weight_search=on
2026-05-31 23:47:37 | INFO | src.nested_cv_avggrm_weighted_unified | Trial 224 | outer=3 | weight={'name': 'exponential', 'floor': 1e-06, 'clip_max': 3.0, 'beta': 3.054956268859982}
[I 2026-05-31 23:47:41,208] Trial 224 finished with value: 0.20847280734254733 and parameters: {'alpha': 195223.54426990662, 'n_pcs': 3000, 'weight_scheme': 'exponential', 'weight_clip_max': 3.0, 'weight_exponential_beta': 3.054956268859982}. Best is trial 191 with value: 0.20863437636832166.
2026-05-31 23:47:41 | INFO | src.nested_cv_avggrm_weighted_unified | Trial 225 | outer=3 | alpha=2.315e+05 n_pcs=3000 (pc_topk) weight_search=on
2026-05-31 23:47:41 | INFO | src.nested_cv_avggrm_weighted_unified | Trial 225 | outer=3 | weight={'name': 'exponential', 'floor': 1e-06, 'clip_max': 3.0, 'beta': 3.3439181109347595}
[I 2026-05-31 23:47:44,997] Trial 225 finished with value: 0.20830037021571188 and parameters: {'alpha': 231536.48067820224, 'n_pcs': 3000, 'weight_scheme': 'exponential', 'weight_clip_max': 3.0, 'weight_exponential_beta': 3.3439181109347595}. Best is trial 191 with value: 0.20863437636832166.
2026-05-31 23:47:45 | INFO | src.nested_cv_avggrm_weighted_unified | Trial 226 | outer=3 | alpha=1.638e+05 n_pcs=3000 (pc_topk) weight_search=on
2026-05-31 23:47:45 | INFO | src.nested_cv_avggrm_weighted_unified | Trial 226 | outer=3 | weight={'name': 'exponential', 'floor': 1e-06, 'clip_max': 3.0, 'beta': 2.9022076562190042}
[I 2026-05-31 23:47:49,242] Trial 226 finished with value: 0.20843530313258798 and parameters: {'alpha': 163812.38727286912, 'n_pcs': 3000, 'weight_scheme': 'exponential', 'weight_clip_max': 3.0, 'weight_exponential_beta': 2.9022076562190042}. Best is trial 191 with value: 0.20863437636832166.
2026-05-31 23:47:49 | INFO | src.nested_cv_avggrm_weighted_unified | Trial 227 | outer=3 | alpha=1.253e+05 n_pcs=3000 (pc_topk) weight_search=on
2026-05-31 23:47:49 | INFO | src.nested_cv_avggrm_weighted_unified | Trial 227 | outer=3 | weight={'name': 'exponential', 'floor': 1e-06, 'clip_max': 3.0, 'beta': 3.7073234640323456}
2026-05-31 23:47:51 | INFO | src.nested_cv_avggrm_weighted_unified | Trial 227 | outer=3 | pruned after 6/10 inner folds (mean r=0.2221)
[I 2026-05-31 23:47:51,557] Trial 227 pruned. 
2026-05-31 23:47:51 | INFO | src.nested_cv_avggrm_weighted_unified | Trial 228 | outer=3 | alpha=1.798e+05 n_pcs=3000 (pc_topk) weight_search=on
2026-05-31 23:47:51 | INFO | src.nested_cv_avggrm_weighted_unified | Trial 228 | outer=3 | weight={'name': 'exponential', 'floor': 1e-06, 'clip_max': 3.0, 'beta': 3.14599439665115}
[I 2026-05-31 23:47:55,384] Trial 228 finished with value: 0.20860237574422605 and parameters: {'alpha': 179809.8379459153, 'n_pcs': 3000, 'weight_scheme': 'exponential', 'weight_clip_max': 3.0, 'weight_exponential_beta': 3.14599439665115}. Best is trial 191 with value: 0.20863437636832166.
2026-05-31 23:47:55 | INFO | src.nested_cv_avggrm_weighted_unified | Trial 229 | outer=3 | alpha=1.521e+05 n_pcs=3000 (pc_topk) weight_search=on
2026-05-31 23:47:55 | INFO | src.nested_cv_avggrm_weighted_unified | Trial 229 | outer=3 | weight={'name': 'uniform', 'floor': 1e-06, 'clip_max': 3.0}
2026-05-31 23:47:57 | INFO | src.nested_cv_avggrm_weighted_unified | Trial 229 | outer=3 | pruned after 6/10 inner folds (mean r=0.2146)
[I 2026-05-31 23:47:57,261] Trial 229 pruned. 
2026-05-31 23:47:57 | INFO | src.nested_cv_avggrm_weighted_unified | Trial 230 | outer=3 | alpha=2.109e+05 n_pcs=3500 (pc_topk) weight_search=on
2026-05-31 23:47:57 | INFO | src.nested_cv_avggrm_weighted_unified | Trial 230 | outer=3 | weight={'name': 'exponential', 'floor': 1e-06, 'clip_max': 3.0, 'beta': 3.4882491268707496}
2026-05-31 23:48:00 | INFO | src.nested_cv_avggrm_weighted_unified | Trial 230 | outer=3 | pruned after 6/10 inner folds (mean r=0.2215)
[I 2026-05-31 23:48:00,149] Trial 230 pruned. 
2026-05-31 23:48:00 | INFO | src.nested_cv_avggrm_weighted_unified | Trial 231 | outer=3 | alpha=1.719e+05 n_pcs=3000 (pc_topk) weight_search=on
2026-05-31 23:48:00 | INFO | src.nested_cv_avggrm_weighted_unified | Trial 231 | outer=3 | weight={'name': 'exponential', 'floor': 1e-06, 'clip_max': 3.0, 'beta': 3.1362458676425313}
[I 2026-05-31 23:48:03,918] Trial 231 finished with value: 0.20861485607140495 and parameters: {'alpha': 171942.2035752485, 'n_pcs': 3000, 'weight_scheme': 'exponential', 'weight_clip_max': 3.0, 'weight_exponential_beta': 3.1362458676425313}. Best is trial 191 with value: 0.20863437636832166.
2026-05-31 23:48:03 | INFO | src.nested_cv_avggrm_weighted_unified | Trial 232 | outer=3 | alpha=1.675e+05 n_pcs=3000 (pc_topk) weight_search=on
2026-05-31 23:48:03 | INFO | src.nested_cv_avggrm_weighted_unified | Trial 232 | outer=3 | weight={'name': 'exponential', 'floor': 1e-06, 'clip_max': 3.0, 'beta': 3.178254887782525}
[I 2026-05-31 23:48:07,703] Trial 232 finished with value: 0.20863301980492702 and parameters: {'alpha': 167457.4334789273, 'n_pcs': 3000, 'weight_scheme': 'exponential', 'weight_clip_max': 3.0, 'weight_exponential_beta': 3.178254887782525}. Best is trial 191 with value: 0.20863437636832166.
2026-05-31 23:48:07 | INFO | src.nested_cv_avggrm_weighted_unified | Trial 233 | outer=3 | alpha=1.424e+05 n_pcs=3000 (pc_topk) weight_search=on
2026-05-31 23:48:07 | INFO | src.nested_cv_avggrm_weighted_unified | Trial 233 | outer=3 | weight={'name': 'exponential', 'floor': 1e-06, 'clip_max': 3.0, 'beta': 3.280514531603943}
2026-05-31 23:48:10 | INFO | src.nested_cv_avggrm_weighted_unified | Trial 233 | outer=3 | pruned after 6/10 inner folds (mean r=0.2232)
[I 2026-05-31 23:48:10,016] Trial 233 pruned. 
2026-05-31 23:48:10 | INFO | src.nested_cv_avggrm_weighted_unified | Trial 234 | outer=3 | alpha=1.661e+05 n_pcs=3000 (pc_topk) weight_search=on
2026-05-31 23:48:10 | INFO | src.nested_cv_avggrm_weighted_unified | Trial 234 | outer=3 | weight={'name': 'exponential', 'floor': 1e-06, 'clip_max': 3.0, 'beta': 3.1807133120321742}
2026-05-31 23:48:12 | INFO | src.nested_cv_avggrm_weighted_unified | Trial 234 | outer=3 | pruned after 6/10 inner folds (mean r=0.2240)
[I 2026-05-31 23:48:12,318] Trial 234 pruned. 
2026-05-31 23:48:12 | INFO | src.nested_cv_avggrm_weighted_unified | Trial 235 | outer=3 | alpha=9.786e+04 n_pcs=3000 (pc_topk) weight_search=on
2026-05-31 23:48:12 | INFO | src.nested_cv_avggrm_weighted_unified | Trial 235 | outer=3 | weight={'name': 'exponential', 'floor': 1e-06, 'clip_max': 3.0, 'beta': 2.7437855485856235}
2026-05-31 23:48:15 | INFO | src.nested_cv_avggrm_weighted_unified | Trial 235 | outer=3 | pruned after 7/10 inner folds (mean r=0.2460)
[I 2026-05-31 23:48:15,223] Trial 235 pruned. 
2026-05-31 23:48:15 | INFO | src.nested_cv_avggrm_weighted_unified | Trial 236 | outer=3 | alpha=1.214e+05 n_pcs=3000 (pc_topk) weight_search=on
2026-05-31 23:48:15 | INFO | src.nested_cv_avggrm_weighted_unified | Trial 236 | outer=3 | weight={'name': 'exponential', 'floor': 1e-06, 'clip_max': 3.0, 'beta': 3.44641963141206}
2026-05-31 23:48:17 | INFO | src.nested_cv_avggrm_weighted_unified | Trial 236 | outer=3 | pruned after 6/10 inner folds (mean r=0.2221)
[I 2026-05-31 23:48:17,536] Trial 236 pruned. 
2026-05-31 23:48:17 | INFO | src.nested_cv_avggrm_weighted_unified | Trial 237 | outer=3 | alpha=1.677e+05 n_pcs=3000 (pc_topk) weight_search=on
2026-05-31 23:48:17 | INFO | src.nested_cv_avggrm_weighted_unified | Trial 237 | outer=3 | weight={'name': 'exponential', 'floor': 1e-06, 'clip_max': 3.0, 'beta': 2.8641838150364767}
[I 2026-05-31 23:48:21,369] Trial 237 finished with value: 0.2083950275949454 and parameters: {'alpha': 167705.08405456066, 'n_pcs': 3000, 'weight_scheme': 'exponential', 'weight_clip_max': 3.0, 'weight_exponential_beta': 2.8641838150364767}. Best is trial 191 with value: 0.20863437636832166.
2026-05-31 23:48:21 | INFO | src.nested_cv_avggrm_weighted_unified | Trial 238 | outer=3 | alpha=2.161e+05 n_pcs=3000 (pc_topk) weight_search=on
2026-05-31 23:48:21 | INFO | src.nested_cv_avggrm_weighted_unified | Trial 238 | outer=3 | weight={'name': 'exponential', 'floor': 1e-06, 'clip_max': None, 'beta': 3.1452299522406335}
2026-05-31 23:48:23 | INFO | src.nested_cv_avggrm_weighted_unified | Trial 238 | outer=3 | pruned after 6/10 inner folds (mean r=0.2193)
[I 2026-05-31 23:48:23,660] Trial 238 pruned. 
2026-05-31 23:48:23 | INFO | src.nested_cv_avggrm_weighted_unified | Trial 239 | outer=3 | alpha=1.419e+05 n_pcs=3000 (pc_topk) weight_search=on
2026-05-31 23:48:23 | INFO | src.nested_cv_avggrm_weighted_unified | Trial 239 | outer=3 | weight={'name': 'exponential', 'floor': 1e-06, 'clip_max': 3.0, 'beta': 3.354240738090419}
2026-05-31 23:48:25 | INFO | src.nested_cv_avggrm_weighted_unified | Trial 239 | outer=3 | pruned after 6/10 inner folds (mean r=0.2231)
[I 2026-05-31 23:48:25,940] Trial 239 pruned. 
2026-05-31 23:48:25 | INFO | src.nested_cv_avggrm_weighted_unified | Trial 240 | outer=3 | alpha=1.140e+05 n_pcs=3000 (pc_topk) weight_search=on
2026-05-31 23:48:25 | INFO | src.nested_cv_avggrm_weighted_unified | Trial 240 | outer=3 | weight={'name': 'exponential', 'floor': 1e-06, 'clip_max': 3.0, 'beta': 3.012002554867572}
2026-05-31 23:48:28 | INFO | src.nested_cv_avggrm_weighted_unified | Trial 240 | outer=3 | pruned after 7/10 inner folds (mean r=0.2470)
[I 2026-05-31 23:48:28,616] Trial 240 pruned. 
2026-05-31 23:48:28 | INFO | src.nested_cv_avggrm_weighted_unified | Trial 241 | outer=3 | alpha=1.834e+05 n_pcs=3000 (pc_topk) weight_search=on
2026-05-31 23:48:28 | INFO | src.nested_cv_avggrm_weighted_unified | Trial 241 | outer=3 | weight={'name': 'exponential', 'floor': 1e-06, 'clip_max': 3.0, 'beta': 3.137759021033263}
[I 2026-05-31 23:48:32,431] Trial 241 finished with value: 0.20858591526158454 and parameters: {'alpha': 183405.73883536534, 'n_pcs': 3000, 'weight_scheme': 'exponential', 'weight_clip_max': 3.0, 'weight_exponential_beta': 3.137759021033263}. Best is trial 191 with value: 0.20863437636832166.
2026-05-31 23:48:32 | INFO | src.nested_cv_avggrm_weighted_unified | Trial 242 | outer=3 | alpha=1.734e+05 n_pcs=3000 (pc_topk) weight_search=on
2026-05-31 23:48:32 | INFO | src.nested_cv_avggrm_weighted_unified | Trial 242 | outer=3 | weight={'name': 'exponential', 'floor': 1e-06, 'clip_max': 3.0, 'beta': 3.1803809469525888}
[I 2026-05-31 23:48:36,283] Trial 242 finished with value: 0.20862543455951776 and parameters: {'alpha': 173415.56551825066, 'n_pcs': 3000, 'weight_scheme': 'exponential', 'weight_clip_max': 3.0, 'weight_exponential_beta': 3.1803809469525888}. Best is trial 191 with value: 0.20863437636832166.
2026-05-31 23:48:36 | INFO | src.nested_cv_avggrm_weighted_unified | Trial 243 | outer=3 | alpha=1.829e+05 n_pcs=3000 (pc_topk) weight_search=on
2026-05-31 23:48:36 | INFO | src.nested_cv_avggrm_weighted_unified | Trial 243 | outer=3 | weight={'name': 'exponential', 'floor': 1e-06, 'clip_max': 3.0, 'beta': 3.252120074250768}
