[I 2026-05-31 23:50:32,269] Trial 282 finished with value: 0.20813526543292396 and parameters: {'alpha': 236358.6898570054, 'n_pcs': 3000, 'weight_scheme': 'exponential', 'weight_clip_max': 3.0, 'weight_exponential_beta': 3.778740270542594}. Best is trial 191 with value: 0.20863437636832166.
2026-05-31 23:50:32 | INFO | src.nested_cv_avggrm_weighted_unified | Trial 283 | outer=3 | alpha=2.895e+05 n_pcs=3000 (pc_topk) weight_search=on
2026-05-31 23:50:32 | INFO | src.nested_cv_avggrm_weighted_unified | Trial 283 | outer=3 | weight={'name': 'exponential', 'floor': 1e-06, 'clip_max': 3.0, 'beta': 3.3358212936439777}
[I 2026-05-31 23:50:36,062] Trial 283 finished with value: 0.20782030226784137 and parameters: {'alpha': 289468.5242471557, 'n_pcs': 3000, 'weight_scheme': 'exponential', 'weight_clip_max': 3.0, 'weight_exponential_beta': 3.3358212936439777}. Best is trial 191 with value: 0.20863437636832166.
2026-05-31 23:50:36 | INFO | src.nested_cv_avggrm_weighted_unified | Trial 284 | outer=3 | alpha=1.944e+05 n_pcs=3000 (pc_topk) weight_search=on
2026-05-31 23:50:36 | INFO | src.nested_cv_avggrm_weighted_unified | Trial 284 | outer=3 | weight={'name': 'exponential', 'floor': 1e-06, 'clip_max': 3.0, 'beta': 3.2304132920061654}
[I 2026-05-31 23:50:39,818] Trial 284 finished with value: 0.20855780000819504 and parameters: {'alpha': 194400.3799518444, 'n_pcs': 3000, 'weight_scheme': 'exponential', 'weight_clip_max': 3.0, 'weight_exponential_beta': 3.2304132920061654}. Best is trial 191 with value: 0.20863437636832166.
2026-05-31 23:50:39 | INFO | src.nested_cv_avggrm_weighted_unified | Trial 285 | outer=3 | alpha=2.085e+05 n_pcs=3000 (pc_topk) weight_search=on
2026-05-31 23:50:39 | INFO | src.nested_cv_avggrm_weighted_unified | Trial 285 | outer=3 | weight={'name': 'exponential', 'floor': 1e-06, 'clip_max': 3.0, 'beta': 4.004743572416151}
[I 2026-05-31 23:50:43,593] Trial 285 finished with value: 0.20820341711574875 and parameters: {'alpha': 208535.40474816546, 'n_pcs': 3000, 'weight_scheme': 'exponential', 'weight_clip_max': 3.0, 'weight_exponential_beta': 4.004743572416151}. Best is trial 191 with value: 0.20863437636832166.
2026-05-31 23:50:43 | INFO | src.nested_cv_avggrm_weighted_unified | Trial 286 | outer=3 | alpha=1.816e+05 n_pcs=2500 (pc_topk) weight_search=on
2026-05-31 23:50:43 | INFO | src.nested_cv_avggrm_weighted_unified | Trial 286 | outer=3 | weight={'name': 'exponential', 'floor': 1e-06, 'clip_max': 3.0, 'beta': 3.5401397433607746}
2026-05-31 23:50:45 | INFO | src.nested_cv_avggrm_weighted_unified | Trial 286 | outer=3 | pruned after 6/10 inner folds (mean r=0.2230)
[I 2026-05-31 23:50:45,337] Trial 286 pruned. 
2026-05-31 23:50:45 | INFO | src.nested_cv_avggrm_weighted_unified | Trial 287 | outer=3 | alpha=1.270e+05 n_pcs=3500 (pc_topk) weight_search=on
2026-05-31 23:50:45 | INFO | src.nested_cv_avggrm_weighted_unified | Trial 287 | outer=3 | weight={'name': 'exponential', 'floor': 1e-06, 'clip_max': 3.0, 'beta': 3.2799813086103664}
2026-05-31 23:50:48 | INFO | src.nested_cv_avggrm_weighted_unified | Trial 287 | outer=3 | pruned after 6/10 inner folds (mean r=0.2192)
[I 2026-05-31 23:50:48,239] Trial 287 pruned. 
2026-05-31 23:50:48 | INFO | src.nested_cv_avggrm_weighted_unified | Trial 288 | outer=3 | alpha=2.311e+05 n_pcs=3000 (pc_topk) weight_search=on
2026-05-31 23:50:48 | INFO | src.nested_cv_avggrm_weighted_unified | Trial 288 | outer=3 | weight={'name': 'exponential', 'floor': 1e-06, 'clip_max': 3.0, 'beta': 3.162538728259837}
[I 2026-05-31 23:50:51,999] Trial 288 finished with value: 0.20832160210947187 and parameters: {'alpha': 231066.618657664, 'n_pcs': 3000, 'weight_scheme': 'exponential', 'weight_clip_max': 3.0, 'weight_exponential_beta': 3.162538728259837}. Best is trial 191 with value: 0.20863437636832166.
2026-05-31 23:50:52 | INFO | src.nested_cv_avggrm_weighted_unified | Trial 289 | outer=3 | alpha=1.502e+05 n_pcs=3000 (pc_topk) weight_search=on
2026-05-31 23:50:52 | INFO | src.nested_cv_avggrm_weighted_unified | Trial 289 | outer=3 | weight={'name': 'exponential', 'floor': 1e-06, 'clip_max': 3.0, 'beta': 2.827299271858042}
2026-05-31 23:50:54 | INFO | src.nested_cv_avggrm_weighted_unified | Trial 289 | outer=3 | pruned after 6/10 inner folds (mean r=0.2237)
[I 2026-05-31 23:50:54,234] Trial 289 pruned. 
2026-05-31 23:50:54 | INFO | src.nested_cv_avggrm_weighted_unified | Trial 290 | outer=3 | alpha=9.635e+04 n_pcs=3000 (pc_topk) weight_search=on
2026-05-31 23:50:54 | INFO | src.nested_cv_avggrm_weighted_unified | Trial 290 | outer=3 | weight={'name': 'exponential', 'floor': 1e-06, 'clip_max': 3.0, 'beta': 3.4230905931497455}
2026-05-31 23:50:56 | INFO | src.nested_cv_avggrm_weighted_unified | Trial 290 | outer=3 | pruned after 7/10 inner folds (mean r=0.2452)
[I 2026-05-31 23:50:56,852] Trial 290 pruned. 
2026-05-31 23:50:56 | INFO | src.nested_cv_avggrm_weighted_unified | Trial 291 | outer=3 | alpha=2.825e+05 n_pcs=3000 (pc_topk) weight_search=on
2026-05-31 23:50:56 | INFO | src.nested_cv_avggrm_weighted_unified | Trial 291 | outer=3 | weight={'name': 'exponential', 'floor': 1e-06, 'clip_max': 3.0, 'beta': 3.6919027687563775}
[I 2026-05-31 23:51:00,546] Trial 291 finished with value: 0.20778127036183394 and parameters: {'alpha': 282543.6975883254, 'n_pcs': 3000, 'weight_scheme': 'exponential', 'weight_clip_max': 3.0, 'weight_exponential_beta': 3.6919027687563775}. Best is trial 191 with value: 0.20863437636832166.
2026-05-31 23:51:00 | INFO | src.nested_cv_avggrm_weighted_unified | Trial 292 | outer=3 | alpha=1.983e+05 n_pcs=3000 (pc_topk) weight_search=on
2026-05-31 23:51:00 | INFO | src.nested_cv_avggrm_weighted_unified | Trial 292 | outer=3 | weight={'name': 'exponential', 'floor': 1e-06, 'clip_max': 3.0, 'beta': 2.578731423744146}
[I 2026-05-31 23:51:04,296] Trial 292 finished with value: 0.20803611483425605 and parameters: {'alpha': 198295.73824281714, 'n_pcs': 3000, 'weight_scheme': 'exponential', 'weight_clip_max': 3.0, 'weight_exponential_beta': 2.578731423744146}. Best is trial 191 with value: 0.20863437636832166.
2026-05-31 23:51:04 | INFO | src.nested_cv_avggrm_weighted_unified | Trial 293 | outer=3 | alpha=1.672e+05 n_pcs=3000 (pc_topk) weight_search=on
2026-05-31 23:51:04 | INFO | src.nested_cv_avggrm_weighted_unified | Trial 293 | outer=3 | weight={'name': 'exponential', 'floor': 1e-06, 'clip_max': 3.0, 'beta': 3.2085672163712986}
2026-05-31 23:51:06 | INFO | src.nested_cv_avggrm_weighted_unified | Trial 293 | outer=3 | pruned after 6/10 inner folds (mean r=0.2240)
[I 2026-05-31 23:51:06,592] Trial 293 pruned. 
2026-05-31 23:51:06 | INFO | src.nested_cv_avggrm_weighted_unified | Trial 294 | outer=3 | alpha=1.185e+05 n_pcs=3000 (pc_topk) weight_search=on
2026-05-31 23:51:06 | INFO | src.nested_cv_avggrm_weighted_unified | Trial 294 | outer=3 | weight={'name': 'exponential', 'floor': 1e-06, 'clip_max': None, 'beta': 2.9154976290860737}
2026-05-31 23:51:08 | INFO | src.nested_cv_avggrm_weighted_unified | Trial 294 | outer=3 | pruned after 6/10 inner folds (mean r=0.2181)
[I 2026-05-31 23:51:08,838] Trial 294 pruned. 
2026-05-31 23:51:08 | INFO | src.nested_cv_avggrm_weighted_unified | Trial 295 | outer=3 | alpha=1.423e+05 n_pcs=3000 (pc_topk) weight_search=on
2026-05-31 23:51:08 | INFO | src.nested_cv_avggrm_weighted_unified | Trial 295 | outer=3 | weight={'name': 'exponential', 'floor': 1e-06, 'clip_max': 3.0, 'beta': 3.4219735157041073}
2026-05-31 23:51:11 | INFO | src.nested_cv_avggrm_weighted_unified | Trial 295 | outer=3 | pruned after 6/10 inner folds (mean r=0.2230)
[I 2026-05-31 23:51:11,059] Trial 295 pruned. 
2026-05-31 23:51:11 | INFO | src.nested_cv_avggrm_weighted_unified | Trial 296 | outer=3 | alpha=2.038e+05 n_pcs=2500 (pc_topk) weight_search=on
2026-05-31 23:51:11 | INFO | src.nested_cv_avggrm_weighted_unified | Trial 296 | outer=3 | weight={'name': 'exponential', 'floor': 1e-06, 'clip_max': 3.0, 'beta': 3.1578034676939435}
2026-05-31 23:51:12 | INFO | src.nested_cv_avggrm_weighted_unified | Trial 296 | outer=3 | pruned after 6/10 inner folds (mean r=0.2238)
[I 2026-05-31 23:51:12,833] Trial 296 pruned. 
2026-05-31 23:51:12 | INFO | src.nested_cv_avggrm_weighted_unified | Trial 297 | outer=3 | alpha=1.755e+05 n_pcs=3500 (pc_topk) weight_search=on
2026-05-31 23:51:12 | INFO | src.nested_cv_avggrm_weighted_unified | Trial 297 | outer=3 | weight={'name': 'exponential', 'floor': 1e-06, 'clip_max': 3.0, 'beta': 2.9936533547455886}
2026-05-31 23:51:15 | INFO | src.nested_cv_avggrm_weighted_unified | Trial 297 | outer=3 | pruned after 6/10 inner folds (mean r=0.2212)
[I 2026-05-31 23:51:15,721] Trial 297 pruned. 
2026-05-31 23:51:15 | INFO | src.nested_cv_avggrm_weighted_unified | Trial 298 | outer=3 | alpha=2.524e+05 n_pcs=3000 (pc_topk) weight_search=on
2026-05-31 23:51:15 | INFO | src.nested_cv_avggrm_weighted_unified | Trial 298 | outer=3 | weight={'name': 'exponential', 'floor': 1e-06, 'clip_max': 3.0, 'beta': 7.787832802393284}
2026-05-31 23:51:18 | INFO | src.nested_cv_avggrm_weighted_unified | Trial 298 | outer=3 | pruned after 6/10 inner folds (mean r=0.2223)
[I 2026-05-31 23:51:18,033] Trial 298 pruned. 
2026-05-31 23:51:18 | INFO | src.nested_cv_avggrm_weighted_unified | Trial 299 | outer=3 | alpha=1.383e+05 n_pcs=3000 (pc_topk) weight_search=on
2026-05-31 23:51:18 | INFO | src.nested_cv_avggrm_weighted_unified | Trial 299 | outer=3 | weight={'name': 'exponential', 'floor': 1e-06, 'clip_max': 5.0, 'beta': 2.0375338879239804}
2026-05-31 23:51:20 | INFO | src.nested_cv_avggrm_weighted_unified | Trial 299 | outer=3 | pruned after 6/10 inner folds (mean r=0.2227)
[I 2026-05-31 23:51:20,273] Trial 299 pruned. 
2026-05-31 23:51:20 | INFO | src.nested_cv_avggrm_weighted_unified | OUTER 3 best (inner mean r=0.2086): {'model_type': 'pc_ridge', 'alpha': 161272.32061306835, 'n_pcs': 3000, 'use_snp_selection': True, 'num_snps': 3000, 'feature_mode': 'pc_topk', 'weighting': {'name': 'exponential', 'floor': 1e-06, 'clip_max': 3.0, 'beta': 3.196654210568803}}
2026-05-31 23:51:20 | INFO | src.nested_cv_avggrm_weighted_unified | OUTER 3 TEST r = 0.2848
2026-05-31 23:51:20 | INFO | src.nested_cv_avggrm_weighted_unified | OUTER 3 incremental summary saved to outputs/final_results/e6_pc_ridge_avggrm/thr_wing/e6_pc_ridge_avggrm_thr_wing_results.json
2026-05-31 23:51:20 | INFO | src.nested_cv_avggrm_weighted_unified | OUTER 4: test_size=191 island=3 (Selvær)
2026-05-31 23:51:20 | INFO | src.nested_cv_avggrm_weighted_unified | OUTER 4: inner LOIO validation islands: 0(Nesøy), 1(Myken), 2(Træna), 4(Gjerøy), 5(Hestmannøy), 6(Indre Kvarøy), 7(Onøy og Lurøy), 8(Lovund), 9(Sleneset), 10(Aldra), 11(Leka), 12(Vega), 13(Vikna), 14(Lauvøya)
2026-05-31 23:51:20 | INFO | src.nested_cv_avggrm_weighted_unified | OUTER 4: using top 10 related inner validation islands for tuning: 1(Myken, avgGRM=0.0212), 2(Træna, avgGRM=0.0194), 8(Lovund, avgGRM=0.0087), 9(Sleneset, avgGRM=0.0056), 0(Nesøy, avgGRM=0.0033), 7(Onøy og Lurøy, avgGRM=0.0018), 6(Indre Kvarøy, avgGRM=0.0005), 5(Hestmannøy, avgGRM=-0.0000), 4(Gjerøy, avgGRM=-0.0013), 12(Vega, avgGRM=-0.0030)
[I 2026-05-31 23:51:20,707] A new study created in memory with name: ridge_inner_outer3
2026-05-31 23:51:20 | INFO | src.nested_cv_avggrm_weighted_unified | Trial 0 | outer=4 | alpha=1.137e+05 n_pcs=4000 (pc_topk) weight_search=on
2026-05-31 23:51:20 | INFO | src.nested_cv_avggrm_weighted_unified | Trial 0 | outer=4 | weight={'name': 'uniform', 'floor': 1e-06, 'clip_max': None}
[I 2026-05-31 23:51:25,588] Trial 0 finished with value: 0.18683617426559637 and parameters: {'alpha': 113703.38004442609, 'n_pcs': 4000, 'weight_scheme': 'uniform', 'weight_clip_max': None}. Best is trial 0 with value: 0.18683617426559637.
2026-05-31 23:51:25 | INFO | src.nested_cv_avggrm_weighted_unified | OUTER 4 | new best trial 0 (mean inner r=0.1868) saved to outputs/final_results/e6_pc_ridge_avggrm/thr_wing/e6_pc_ridge_avggrm_thr_wing_best_trials/split_04_best_trial.json
2026-05-31 23:51:25 | INFO | src.nested_cv_avggrm_weighted_unified | Trial 1 | outer=4 | alpha=1.682e+06 n_pcs=2000 (pc_topk) weight_search=on
2026-05-31 23:51:25 | INFO | src.nested_cv_avggrm_weighted_unified | Trial 1 | outer=4 | weight={'name': 'exponential', 'floor': 1e-06, 'clip_max': 3.0, 'beta': 8.711469579953913}
[I 2026-05-31 23:51:28,050] Trial 1 finished with value: 0.191106704055447 and parameters: {'alpha': 1682385.170967095, 'n_pcs': 2000, 'weight_scheme': 'exponential', 'weight_clip_max': 3.0, 'weight_exponential_beta': 8.711469579953913}. Best is trial 1 with value: 0.191106704055447.
2026-05-31 23:51:28 | INFO | src.nested_cv_avggrm_weighted_unified | OUTER 4 | new best trial 1 (mean inner r=0.1911) saved to outputs/final_results/e6_pc_ridge_avggrm/thr_wing/e6_pc_ridge_avggrm_thr_wing_best_trials/split_04_best_trial.json
2026-05-31 23:51:28 | INFO | src.nested_cv_avggrm_weighted_unified | Trial 2 | outer=4 | alpha=2.757e+03 n_pcs=2000 (pc_topk) weight_search=on
2026-05-31 23:51:28 | INFO | src.nested_cv_avggrm_weighted_unified | Trial 2 | outer=4 | weight={'name': 'linear', 'floor': 1e-06, 'clip_max': 20.0, 'min_weight': 0.12918170299726892, 'max_weight': 3.9862564805616327}
[I 2026-05-31 23:51:31,664] Trial 2 finished with value: 0.12178658632298978 and parameters: {'alpha': 2757.0504493185063, 'n_pcs': 2000, 'weight_scheme': 'linear', 'weight_clip_max': 20.0, 'weight_linear_min_weight': 0.12918170299726892, 'weight_linear_max_weight': 3.9862564805616327}. Best is trial 1 with value: 0.191106704055447.
2026-05-31 23:51:31 | INFO | src.nested_cv_avggrm_weighted_unified | Trial 3 | outer=4 | alpha=1.776e+03 n_pcs=4000 (pc_topk) weight_search=on
2026-05-31 23:51:31 | INFO | src.nested_cv_avggrm_weighted_unified | Trial 3 | outer=4 | weight={'name': 'exponential', 'floor': 1e-06, 'clip_max': 10.0, 'beta': 0.563604612251006}
[I 2026-05-31 23:51:37,277] Trial 3 finished with value: 0.10607283400490994 and parameters: {'alpha': 1775.825123718637, 'n_pcs': 4000, 'weight_scheme': 'exponential', 'weight_clip_max': 10.0, 'weight_exponential_beta': 0.563604612251006}. Best is trial 1 with value: 0.191106704055447.
2026-05-31 23:51:37 | INFO | src.nested_cv_avggrm_weighted_unified | Trial 4 | outer=4 | alpha=1.835e+04 n_pcs=5000 (pc_topk) weight_search=on
2026-05-31 23:51:37 | INFO | src.nested_cv_avggrm_weighted_unified | Trial 4 | outer=4 | weight={'name': 'exponential', 'floor': 1e-06, 'clip_max': None, 'beta': 9.957095048208117}
[I 2026-05-31 23:51:45,336] Trial 4 finished with value: 0.17665241904112047 and parameters: {'alpha': 18351.68801260339, 'n_pcs': 5000, 'weight_scheme': 'exponential', 'weight_clip_max': None, 'weight_exponential_beta': 9.957095048208117}. Best is trial 1 with value: 0.191106704055447.
2026-05-31 23:51:45 | INFO | src.nested_cv_avggrm_weighted_unified | Trial 5 | outer=4 | alpha=9.696e+03 n_pcs=1000 (pc_topk) weight_search=on
2026-05-31 23:51:45 | INFO | src.nested_cv_avggrm_weighted_unified | Trial 5 | outer=4 | weight={'name': 'exponential', 'floor': 1e-06, 'clip_max': 3.0, 'beta': 1.5726039441128932}
2026-05-31 23:51:46 | INFO | src.nested_cv_avggrm_weighted_unified | Trial 5 | outer=4 | pruned after 6/10 inner folds (mean r=0.1437)
[I 2026-05-31 23:51:46,149] Trial 5 pruned. 
2026-05-31 23:51:46 | INFO | src.nested_cv_avggrm_weighted_unified | Trial 6 | outer=4 | alpha=6.320e+04 n_pcs=2500 (pc_topk) weight_search=on
2026-05-31 23:51:46 | INFO | src.nested_cv_avggrm_weighted_unified | Trial 6 | outer=4 | weight={'name': 'uniform', 'floor': 1e-06, 'clip_max': 10.0}
[I 2026-05-31 23:51:48,875] Trial 6 finished with value: 0.1935714442350478 and parameters: {'alpha': 63199.5851103866, 'n_pcs': 2500, 'weight_scheme': 'uniform', 'weight_clip_max': 10.0}. Best is trial 6 with value: 0.1935714442350478.
2026-05-31 23:51:48 | INFO | src.nested_cv_avggrm_weighted_unified | OUTER 4 | new best trial 6 (mean inner r=0.1936) saved to outputs/final_results/e6_pc_ridge_avggrm/thr_wing/e6_pc_ridge_avggrm_thr_wing_best_trials/split_04_best_trial.json
2026-05-31 23:51:48 | INFO | src.nested_cv_avggrm_weighted_unified | Trial 7 | outer=4 | alpha=4.681e+04 n_pcs=2500 (pc_topk) weight_search=on
2026-05-31 23:51:48 | INFO | src.nested_cv_avggrm_weighted_unified | Trial 7 | outer=4 | weight={'name': 'linear', 'floor': 1e-06, 'clip_max': 3.0, 'min_weight': 0.13798029304672477, 'max_weight': 3.0957974174373546}
[I 2026-05-31 23:51:52,448] Trial 7 finished with value: 0.19295332989152053 and parameters: {'alpha': 46806.97703257331, 'n_pcs': 2500, 'weight_scheme': 'linear', 'weight_clip_max': 3.0, 'weight_linear_min_weight': 0.13798029304672477, 'weight_linear_max_weight': 3.0957974174373546}. Best is trial 6 with value: 0.1935714442350478.
2026-05-31 23:51:52 | INFO | src.nested_cv_avggrm_weighted_unified | Trial 8 | outer=4 | alpha=5.456e+04 n_pcs=3000 (pc_topk) weight_search=on
2026-05-31 23:51:52 | INFO | src.nested_cv_avggrm_weighted_unified | Trial 8 | outer=4 | weight={'name': 'linear', 'floor': 1e-06, 'clip_max': 5.0, 'min_weight': 0.6690067570691431, 'max_weight': 4.8744640334054115}
[I 2026-05-31 23:51:56,189] Trial 8 finished with value: 0.1950405969660607 and parameters: {'alpha': 54559.68395210245, 'n_pcs': 3000, 'weight_scheme': 'linear', 'weight_clip_max': 5.0, 'weight_linear_min_weight': 0.6690067570691431, 'weight_linear_max_weight': 4.8744640334054115}. Best is trial 8 with value: 0.1950405969660607.
2026-05-31 23:51:56 | INFO | src.nested_cv_avggrm_weighted_unified | OUTER 4 | new best trial 8 (mean inner r=0.1950) saved to outputs/final_results/e6_pc_ridge_avggrm/thr_wing/e6_pc_ridge_avggrm_thr_wing_best_trials/split_04_best_trial.json
2026-05-31 23:51:56 | INFO | src.nested_cv_avggrm_weighted_unified | Trial 9 | outer=4 | alpha=8.868e+03 n_pcs=2000 (pc_topk) weight_search=on
2026-05-31 23:51:56 | INFO | src.nested_cv_avggrm_weighted_unified | Trial 9 | outer=4 | weight={'name': 'linear', 'floor': 1e-06, 'clip_max': 20.0, 'min_weight': 0.861124149305412, 'max_weight': 4.702809729786679}
2026-05-31 23:51:57 | INFO | src.nested_cv_avggrm_weighted_unified | Trial 9 | outer=4 | pruned after 5/10 inner folds (mean r=0.1099)
[I 2026-05-31 23:51:57,690] Trial 9 pruned. 
2026-05-31 23:51:57 | INFO | src.nested_cv_avggrm_weighted_unified | Trial 10 | outer=4 | alpha=5.986e+05 n_pcs=500 (pc_topk) weight_search=on
2026-05-31 23:51:57 | INFO | src.nested_cv_avggrm_weighted_unified | Trial 10 | outer=4 | weight={'name': 'linear', 'floor': 1e-06, 'clip_max': 5.0, 'min_weight': 0.6649918033453551, 'max_weight': 1.3005022441588598}
2026-05-31 23:51:58 | INFO | src.nested_cv_avggrm_weighted_unified | Trial 10 | outer=4 | pruned after 5/10 inner folds (mean r=0.1285)
[I 2026-05-31 23:51:58,189] Trial 10 pruned. 
2026-05-31 23:51:58 | INFO | src.nested_cv_avggrm_weighted_unified | Trial 11 | outer=4 | alpha=1.521e+05 n_pcs=3500 (pc_topk) weight_search=on
2026-05-31 23:51:58 | INFO | src.nested_cv_avggrm_weighted_unified | Trial 11 | outer=4 | weight={'name': 'uniform', 'floor': 1e-06, 'clip_max': 10.0}
2026-05-31 23:52:01 | INFO | src.nested_cv_avggrm_weighted_unified | Trial 11 | outer=4 | pruned after 6/10 inner folds (mean r=0.1931)
[I 2026-05-31 23:52:01,119] Trial 11 pruned. 
2026-05-31 23:52:01 | INFO | src.nested_cv_avggrm_weighted_unified | Trial 12 | outer=4 | alpha=5.861e+06 n_pcs=3000 (pc_topk) weight_search=on
2026-05-31 23:52:01 | INFO | src.nested_cv_avggrm_weighted_unified | Trial 12 | outer=4 | weight={'name': 'uniform', 'floor': 1e-06, 'clip_max': 5.0}
2026-05-31 23:52:02 | INFO | src.nested_cv_avggrm_weighted_unified | Trial 12 | outer=4 | pruned after 6/10 inner folds (mean r=0.1723)
[I 2026-05-31 23:52:02,948] Trial 12 pruned. 
2026-05-31 23:52:02 | INFO | src.nested_cv_avggrm_weighted_unified | Trial 13 | outer=4 | alpha=3.744e+05 n_pcs=3000 (pc_topk) weight_search=on
2026-05-31 23:52:02 | INFO | src.nested_cv_avggrm_weighted_unified | Trial 13 | outer=4 | weight={'name': 'uniform', 'floor': 1e-06, 'clip_max': 5.0}
2026-05-31 23:52:04 | INFO | src.nested_cv_avggrm_weighted_unified | Trial 13 | outer=4 | pruned after 6/10 inner folds (mean r=0.1874)
[I 2026-05-31 23:52:04,806] Trial 13 pruned. 
2026-05-31 23:52:04 | INFO | src.nested_cv_avggrm_weighted_unified | Trial 14 | outer=4 | alpha=3.831e+04 n_pcs=1500 (pc_topk) weight_search=on
2026-05-31 23:52:04 | INFO | src.nested_cv_avggrm_weighted_unified | Trial 14 | outer=4 | weight={'name': 'linear', 'floor': 1e-06, 'clip_max': 10.0, 'min_weight': 0.4875665326435763, 'max_weight': 4.907324246199112}
2026-05-31 23:52:05 | INFO | src.nested_cv_avggrm_weighted_unified | Trial 14 | outer=4 | pruned after 6/10 inner folds (mean r=0.1694)
[I 2026-05-31 23:52:05,831] Trial 14 pruned. 
2026-05-31 23:52:05 | INFO | src.nested_cv_avggrm_weighted_unified | Trial 15 | outer=4 | alpha=3.593e+05 n_pcs=5000 (pc_topk) weight_search=on
2026-05-31 23:52:05 | INFO | src.nested_cv_avggrm_weighted_unified | Trial 15 | outer=4 | weight={'name': 'uniform', 'floor': 1e-06, 'clip_max': 10.0}
2026-05-31 23:52:10 | INFO | src.nested_cv_avggrm_weighted_unified | Trial 15 | outer=4 | pruned after 6/10 inner folds (mean r=0.1843)
[I 2026-05-31 23:52:10,135] Trial 15 pruned. 
2026-05-31 23:52:10 | INFO | src.nested_cv_avggrm_weighted_unified | Trial 16 | outer=4 | alpha=3.747e+04 n_pcs=4000 (pc_topk) weight_search=on
2026-05-31 23:52:10 | INFO | src.nested_cv_avggrm_weighted_unified | Trial 16 | outer=4 | weight={'name': 'linear', 'floor': 1e-06, 'clip_max': 5.0, 'min_weight': 0.9670005988812563, 'max_weight': 1.740950480090981}
