[I 2026-06-01 02:50:33,268] Trial 50 finished with value: 0.22110228520141145 and parameters: {'alpha': 34427.2931435815, 'n_pcs': 2500, 'weight_scheme': 'linear', 'weight_clip_max': 20.0, 'weight_linear_min_weight': 0.639011011851647, 'weight_linear_max_weight': 3.408663574886434}. Best is trial 33 with value: 0.2271792215509159.
2026-06-01 02:50:33 | INFO | src.nested_cv_avggrm_weighted_unified | Trial 51 | outer=11 | alpha=5.835e+04 n_pcs=1500 (pc_topk) weight_search=on
2026-06-01 02:50:33 | INFO | src.nested_cv_avggrm_weighted_unified | Trial 51 | outer=11 | weight={'name': 'linear', 'floor': 1e-06, 'clip_max': 20.0, 'min_weight': 0.5098849803249904, 'max_weight': 4.098812999518504}
[I 2026-06-01 02:50:35,363] Trial 51 finished with value: 0.21918717166985352 and parameters: {'alpha': 58349.71679820334, 'n_pcs': 1500, 'weight_scheme': 'linear', 'weight_clip_max': 20.0, 'weight_linear_min_weight': 0.5098849803249904, 'weight_linear_max_weight': 4.098812999518504}. Best is trial 33 with value: 0.2271792215509159.
2026-06-01 02:50:35 | INFO | src.nested_cv_avggrm_weighted_unified | Trial 52 | outer=11 | alpha=5.816e+04 n_pcs=2000 (pc_topk) weight_search=on
2026-06-01 02:50:35 | INFO | src.nested_cv_avggrm_weighted_unified | Trial 52 | outer=11 | weight={'name': 'linear', 'floor': 1e-06, 'clip_max': 20.0, 'min_weight': 0.614055077193786, 'max_weight': 3.886507364633973}
[I 2026-06-01 02:50:38,122] Trial 52 finished with value: 0.22448804201983635 and parameters: {'alpha': 58158.59821591597, 'n_pcs': 2000, 'weight_scheme': 'linear', 'weight_clip_max': 20.0, 'weight_linear_min_weight': 0.614055077193786, 'weight_linear_max_weight': 3.886507364633973}. Best is trial 33 with value: 0.2271792215509159.
2026-06-01 02:50:38 | INFO | src.nested_cv_avggrm_weighted_unified | Trial 53 | outer=11 | alpha=1.098e+05 n_pcs=2500 (pc_topk) weight_search=on
2026-06-01 02:50:38 | INFO | src.nested_cv_avggrm_weighted_unified | Trial 53 | outer=11 | weight={'name': 'linear', 'floor': 1e-06, 'clip_max': 3.0, 'min_weight': 0.059851614989377466, 'max_weight': 4.211493273011934}
[I 2026-06-01 02:50:41,627] Trial 53 finished with value: 0.2263838591981274 and parameters: {'alpha': 109822.24814776696, 'n_pcs': 2500, 'weight_scheme': 'linear', 'weight_clip_max': 3.0, 'weight_linear_min_weight': 0.059851614989377466, 'weight_linear_max_weight': 4.211493273011934}. Best is trial 33 with value: 0.2271792215509159.
2026-06-01 02:50:41 | INFO | src.nested_cv_avggrm_weighted_unified | Trial 54 | outer=11 | alpha=1.122e+05 n_pcs=2500 (pc_topk) weight_search=on
2026-06-01 02:50:41 | INFO | src.nested_cv_avggrm_weighted_unified | Trial 54 | outer=11 | weight={'name': 'linear', 'floor': 1e-06, 'clip_max': 3.0, 'min_weight': 0.08590096931667976, 'max_weight': 4.297233997511992}
[I 2026-06-01 02:50:44,870] Trial 54 finished with value: 0.2265852060165514 and parameters: {'alpha': 112162.51075921764, 'n_pcs': 2500, 'weight_scheme': 'linear', 'weight_clip_max': 3.0, 'weight_linear_min_weight': 0.08590096931667976, 'weight_linear_max_weight': 4.297233997511992}. Best is trial 33 with value: 0.2271792215509159.
2026-06-01 02:50:44 | INFO | src.nested_cv_avggrm_weighted_unified | Trial 55 | outer=11 | alpha=1.096e+05 n_pcs=2500 (pc_topk) weight_search=on
2026-06-01 02:50:44 | INFO | src.nested_cv_avggrm_weighted_unified | Trial 55 | outer=11 | weight={'name': 'linear', 'floor': 1e-06, 'clip_max': 3.0, 'min_weight': 0.11282860701530883, 'max_weight': 4.126393058195413}
[I 2026-06-01 02:50:48,114] Trial 55 finished with value: 0.22679252206248104 and parameters: {'alpha': 109561.97515347584, 'n_pcs': 2500, 'weight_scheme': 'linear', 'weight_clip_max': 3.0, 'weight_linear_min_weight': 0.11282860701530883, 'weight_linear_max_weight': 4.126393058195413}. Best is trial 33 with value: 0.2271792215509159.
2026-06-01 02:50:48 | INFO | src.nested_cv_avggrm_weighted_unified | Trial 56 | outer=11 | alpha=3.950e+05 n_pcs=2500 (pc_topk) weight_search=on
2026-06-01 02:50:48 | INFO | src.nested_cv_avggrm_weighted_unified | Trial 56 | outer=11 | weight={'name': 'linear', 'floor': 1e-06, 'clip_max': 3.0, 'min_weight': 0.05379847612510987, 'max_weight': 4.246348158774576}
[I 2026-06-01 02:50:51,270] Trial 56 finished with value: 0.22143164237606555 and parameters: {'alpha': 394951.5658732659, 'n_pcs': 2500, 'weight_scheme': 'linear', 'weight_clip_max': 3.0, 'weight_linear_min_weight': 0.05379847612510987, 'weight_linear_max_weight': 4.246348158774576}. Best is trial 33 with value: 0.2271792215509159.
2026-06-01 02:50:51 | INFO | src.nested_cv_avggrm_weighted_unified | Trial 57 | outer=11 | alpha=1.903e+05 n_pcs=2500 (pc_topk) weight_search=on
2026-06-01 02:50:51 | INFO | src.nested_cv_avggrm_weighted_unified | Trial 57 | outer=11 | weight={'name': 'linear', 'floor': 1e-06, 'clip_max': 3.0, 'min_weight': 0.1417753120045103, 'max_weight': 3.5480586534341754}
[I 2026-06-01 02:50:54,479] Trial 57 finished with value: 0.2258137196072098 and parameters: {'alpha': 190253.2948825758, 'n_pcs': 2500, 'weight_scheme': 'linear', 'weight_clip_max': 3.0, 'weight_linear_min_weight': 0.1417753120045103, 'weight_linear_max_weight': 3.5480586534341754}. Best is trial 33 with value: 0.2271792215509159.
2026-06-01 02:50:54 | INFO | src.nested_cv_avggrm_weighted_unified | Trial 58 | outer=11 | alpha=9.716e+04 n_pcs=3000 (pc_topk) weight_search=on
2026-06-01 02:50:54 | INFO | src.nested_cv_avggrm_weighted_unified | Trial 58 | outer=11 | weight={'name': 'linear', 'floor': 1e-06, 'clip_max': 3.0, 'min_weight': 0.10656793532494854, 'max_weight': 3.913290115414932}
[I 2026-06-01 02:50:58,328] Trial 58 finished with value: 0.2272202509741915 and parameters: {'alpha': 97159.87400542584, 'n_pcs': 3000, 'weight_scheme': 'linear', 'weight_clip_max': 3.0, 'weight_linear_min_weight': 0.10656793532494854, 'weight_linear_max_weight': 3.913290115414932}. Best is trial 58 with value: 0.2272202509741915.
2026-06-01 02:50:58 | INFO | src.nested_cv_avggrm_weighted_unified | OUTER 11 | new best trial 58 (mean inner r=0.2272) saved to outputs/final_results/e6_pc_ridge_avggrm/thr_wing/e6_pc_ridge_avggrm_thr_wing_best_trials/split_11_best_trial.json
2026-06-01 02:50:58 | INFO | src.nested_cv_avggrm_weighted_unified | Trial 59 | outer=11 | alpha=8.951e+05 n_pcs=3000 (pc_topk) weight_search=on
2026-06-01 02:50:58 | INFO | src.nested_cv_avggrm_weighted_unified | Trial 59 | outer=11 | weight={'name': 'uniform', 'floor': 1e-06, 'clip_max': 3.0}
2026-06-01 02:51:00 | INFO | src.nested_cv_avggrm_weighted_unified | Trial 59 | outer=11 | pruned after 6/10 inner folds (mean r=0.2274)
[I 2026-06-01 02:51:00,295] Trial 59 pruned. 
2026-06-01 02:51:00 | INFO | src.nested_cv_avggrm_weighted_unified | Trial 60 | outer=11 | alpha=2.955e+05 n_pcs=3000 (pc_topk) weight_search=on
2026-06-01 02:51:00 | INFO | src.nested_cv_avggrm_weighted_unified | Trial 60 | outer=11 | weight={'name': 'exponential', 'floor': 1e-06, 'clip_max': 3.0, 'beta': 3.369316219106202}
[I 2026-06-01 02:51:04,178] Trial 60 finished with value: 0.22480199931818445 and parameters: {'alpha': 295537.0799996183, 'n_pcs': 3000, 'weight_scheme': 'exponential', 'weight_clip_max': 3.0, 'weight_exponential_beta': 3.369316219106202}. Best is trial 58 with value: 0.2272202509741915.
2026-06-01 02:51:04 | INFO | src.nested_cv_avggrm_weighted_unified | Trial 61 | outer=11 | alpha=1.011e+05 n_pcs=2000 (pc_topk) weight_search=on
2026-06-01 02:51:04 | INFO | src.nested_cv_avggrm_weighted_unified | Trial 61 | outer=11 | weight={'name': 'linear', 'floor': 1e-06, 'clip_max': 3.0, 'min_weight': 0.05029864298995791, 'max_weight': 3.8487680685474364}
[I 2026-06-01 02:51:07,344] Trial 61 finished with value: 0.22549749575626593 and parameters: {'alpha': 101084.13115430772, 'n_pcs': 2000, 'weight_scheme': 'linear', 'weight_clip_max': 3.0, 'weight_linear_min_weight': 0.05029864298995791, 'weight_linear_max_weight': 3.8487680685474364}. Best is trial 58 with value: 0.2272202509741915.
2026-06-01 02:51:07 | INFO | src.nested_cv_avggrm_weighted_unified | Trial 62 | outer=11 | alpha=1.299e+05 n_pcs=2500 (pc_topk) weight_search=on
2026-06-01 02:51:07 | INFO | src.nested_cv_avggrm_weighted_unified | Trial 62 | outer=11 | weight={'name': 'linear', 'floor': 1e-06, 'clip_max': 3.0, 'min_weight': 0.14695542793490418, 'max_weight': 4.21870672962503}
[I 2026-06-01 02:51:10,777] Trial 62 finished with value: 0.22682938460596933 and parameters: {'alpha': 129927.03726808706, 'n_pcs': 2500, 'weight_scheme': 'linear', 'weight_clip_max': 3.0, 'weight_linear_min_weight': 0.14695542793490418, 'weight_linear_max_weight': 4.21870672962503}. Best is trial 58 with value: 0.2272202509741915.
2026-06-01 02:51:10 | INFO | src.nested_cv_avggrm_weighted_unified | Trial 63 | outer=11 | alpha=1.492e+05 n_pcs=2500 (pc_topk) weight_search=on
2026-06-01 02:51:10 | INFO | src.nested_cv_avggrm_weighted_unified | Trial 63 | outer=11 | weight={'name': 'linear', 'floor': 1e-06, 'clip_max': 3.0, 'min_weight': 0.11576599383400014, 'max_weight': 4.244403612587093}
[I 2026-06-01 02:51:13,796] Trial 63 finished with value: 0.22646883083749195 and parameters: {'alpha': 149197.9783145747, 'n_pcs': 2500, 'weight_scheme': 'linear', 'weight_clip_max': 3.0, 'weight_linear_min_weight': 0.11576599383400014, 'weight_linear_max_weight': 4.244403612587093}. Best is trial 58 with value: 0.2272202509741915.
2026-06-01 02:51:13 | INFO | src.nested_cv_avggrm_weighted_unified | Trial 64 | outer=11 | alpha=1.666e+05 n_pcs=2000 (pc_topk) weight_search=on
2026-06-01 02:51:13 | INFO | src.nested_cv_avggrm_weighted_unified | Trial 64 | outer=11 | weight={'name': 'linear', 'floor': 1e-06, 'clip_max': 3.0, 'min_weight': 0.1617667886575262, 'max_weight': 4.232240994847001}
[I 2026-06-01 02:51:16,029] Trial 64 finished with value: 0.22583641036983235 and parameters: {'alpha': 166562.41836799105, 'n_pcs': 2000, 'weight_scheme': 'linear', 'weight_clip_max': 3.0, 'weight_linear_min_weight': 0.1617667886575262, 'weight_linear_max_weight': 4.232240994847001}. Best is trial 58 with value: 0.2272202509741915.
2026-06-01 02:51:16 | INFO | src.nested_cv_avggrm_weighted_unified | Trial 65 | outer=11 | alpha=1.011e+05 n_pcs=2500 (pc_topk) weight_search=on
2026-06-01 02:51:16 | INFO | src.nested_cv_avggrm_weighted_unified | Trial 65 | outer=11 | weight={'name': 'linear', 'floor': 1e-06, 'clip_max': 3.0, 'min_weight': 0.10094876769795108, 'max_weight': 4.768006356711072}
[I 2026-06-01 02:51:19,226] Trial 65 finished with value: 0.22655484745347532 and parameters: {'alpha': 101148.54608561346, 'n_pcs': 2500, 'weight_scheme': 'linear', 'weight_clip_max': 3.0, 'weight_linear_min_weight': 0.10094876769795108, 'weight_linear_max_weight': 4.768006356711072}. Best is trial 58 with value: 0.2272202509741915.
2026-06-01 02:51:19 | INFO | src.nested_cv_avggrm_weighted_unified | Trial 66 | outer=11 | alpha=3.933e+06 n_pcs=3000 (pc_topk) weight_search=on
2026-06-01 02:51:19 | INFO | src.nested_cv_avggrm_weighted_unified | Trial 66 | outer=11 | weight={'name': 'linear', 'floor': 1e-06, 'clip_max': 3.0, 'min_weight': 0.10067589542659912, 'max_weight': 4.8428892746084}
2026-06-01 02:51:21 | INFO | src.nested_cv_avggrm_weighted_unified | Trial 66 | outer=11 | pruned after 6/10 inner folds (mean r=0.2382)
[I 2026-06-01 02:51:21,548] Trial 66 pruned. 
2026-06-01 02:51:21 | INFO | src.nested_cv_avggrm_weighted_unified | Trial 67 | outer=11 | alpha=2.443e+05 n_pcs=2500 (pc_topk) weight_search=on
2026-06-01 02:51:21 | INFO | src.nested_cv_avggrm_weighted_unified | Trial 67 | outer=11 | weight={'name': 'linear', 'floor': 1e-06, 'clip_max': 3.0, 'min_weight': 0.19913320012317937, 'max_weight': 4.61811962868216}
[I 2026-06-01 02:51:25,174] Trial 67 finished with value: 0.22462224350455293 and parameters: {'alpha': 244256.8368054707, 'n_pcs': 2500, 'weight_scheme': 'linear', 'weight_clip_max': 3.0, 'weight_linear_min_weight': 0.19913320012317937, 'weight_linear_max_weight': 4.61811962868216}. Best is trial 58 with value: 0.2272202509741915.
2026-06-01 02:51:25 | INFO | src.nested_cv_avggrm_weighted_unified | Trial 68 | outer=11 | alpha=4.832e+05 n_pcs=2500 (pc_topk) weight_search=on
2026-06-01 02:51:25 | INFO | src.nested_cv_avggrm_weighted_unified | Trial 68 | outer=11 | weight={'name': 'linear', 'floor': 1e-06, 'clip_max': 3.0, 'min_weight': 0.1145244211246417, 'max_weight': 4.532652250014184}
[I 2026-06-01 02:51:28,288] Trial 68 finished with value: 0.2203084858293988 and parameters: {'alpha': 483161.0856761702, 'n_pcs': 2500, 'weight_scheme': 'linear', 'weight_clip_max': 3.0, 'weight_linear_min_weight': 0.1145244211246417, 'weight_linear_max_weight': 4.532652250014184}. Best is trial 58 with value: 0.2272202509741915.
2026-06-01 02:51:28 | INFO | src.nested_cv_avggrm_weighted_unified | Trial 69 | outer=11 | alpha=1.410e+05 n_pcs=3000 (pc_topk) weight_search=on
2026-06-01 02:51:28 | INFO | src.nested_cv_avggrm_weighted_unified | Trial 69 | outer=11 | weight={'name': 'linear', 'floor': 1e-06, 'clip_max': 3.0, 'min_weight': 0.18798546688812356, 'max_weight': 4.824878893125414}
[I 2026-06-01 02:51:32,186] Trial 69 finished with value: 0.2269857457031494 and parameters: {'alpha': 141021.72973219806, 'n_pcs': 3000, 'weight_scheme': 'linear', 'weight_clip_max': 3.0, 'weight_linear_min_weight': 0.18798546688812356, 'weight_linear_max_weight': 4.824878893125414}. Best is trial 58 with value: 0.2272202509741915.
2026-06-01 02:51:32 | INFO | src.nested_cv_avggrm_weighted_unified | Trial 70 | outer=11 | alpha=4.202e+04 n_pcs=3000 (pc_topk) weight_search=on
2026-06-01 02:51:32 | INFO | src.nested_cv_avggrm_weighted_unified | Trial 70 | outer=11 | weight={'name': 'linear', 'floor': 1e-06, 'clip_max': 3.0, 'min_weight': 0.18077080797208217, 'max_weight': 4.7796444299581875}
[I 2026-06-01 02:51:36,060] Trial 70 finished with value: 0.22252513981912087 and parameters: {'alpha': 42023.11048226216, 'n_pcs': 3000, 'weight_scheme': 'linear', 'weight_clip_max': 3.0, 'weight_linear_min_weight': 0.18077080797208217, 'weight_linear_max_weight': 4.7796444299581875}. Best is trial 58 with value: 0.2272202509741915.
2026-06-01 02:51:36 | INFO | src.nested_cv_avggrm_weighted_unified | Trial 71 | outer=11 | alpha=1.435e+05 n_pcs=3000 (pc_topk) weight_search=on
2026-06-01 02:51:36 | INFO | src.nested_cv_avggrm_weighted_unified | Trial 71 | outer=11 | weight={'name': 'linear', 'floor': 1e-06, 'clip_max': 3.0, 'min_weight': 0.0960057415015736, 'max_weight': 4.980293257304418}
[I 2026-06-01 02:51:39,940] Trial 71 finished with value: 0.22669685875952025 and parameters: {'alpha': 143485.5790382686, 'n_pcs': 3000, 'weight_scheme': 'linear', 'weight_clip_max': 3.0, 'weight_linear_min_weight': 0.0960057415015736, 'weight_linear_max_weight': 4.980293257304418}. Best is trial 58 with value: 0.2272202509741915.
2026-06-01 02:51:39 | INFO | src.nested_cv_avggrm_weighted_unified | Trial 72 | outer=11 | alpha=1.038e+05 n_pcs=3000 (pc_topk) weight_search=on
2026-06-01 02:51:39 | INFO | src.nested_cv_avggrm_weighted_unified | Trial 72 | outer=11 | weight={'name': 'linear', 'floor': 1e-06, 'clip_max': 3.0, 'min_weight': 0.09189882498180255, 'max_weight': 4.988701639912878}
[I 2026-06-01 02:51:43,738] Trial 72 finished with value: 0.22703879099411445 and parameters: {'alpha': 103780.81724170617, 'n_pcs': 3000, 'weight_scheme': 'linear', 'weight_clip_max': 3.0, 'weight_linear_min_weight': 0.09189882498180255, 'weight_linear_max_weight': 4.988701639912878}. Best is trial 58 with value: 0.2272202509741915.
2026-06-01 02:51:43 | INFO | src.nested_cv_avggrm_weighted_unified | Trial 73 | outer=11 | alpha=2.841e+05 n_pcs=3000 (pc_topk) weight_search=on
2026-06-01 02:51:43 | INFO | src.nested_cv_avggrm_weighted_unified | Trial 73 | outer=11 | weight={'name': 'linear', 'floor': 1e-06, 'clip_max': 3.0, 'min_weight': 0.15792076666093202, 'max_weight': 4.9327769226549085}
[I 2026-06-01 02:51:47,565] Trial 73 finished with value: 0.2237618322803651 and parameters: {'alpha': 284125.1462810525, 'n_pcs': 3000, 'weight_scheme': 'linear', 'weight_clip_max': 3.0, 'weight_linear_min_weight': 0.15792076666093202, 'weight_linear_max_weight': 4.9327769226549085}. Best is trial 58 with value: 0.2272202509741915.
2026-06-01 02:51:47 | INFO | src.nested_cv_avggrm_weighted_unified | Trial 74 | outer=11 | alpha=1.308e+05 n_pcs=500 (pc_topk) weight_search=on
2026-06-01 02:51:47 | INFO | src.nested_cv_avggrm_weighted_unified | Trial 74 | outer=11 | weight={'name': 'linear', 'floor': 1e-06, 'clip_max': 3.0, 'min_weight': 0.22349846327436004, 'max_weight': 4.956526598455341}
2026-06-01 02:51:48 | INFO | src.nested_cv_avggrm_weighted_unified | Trial 74 | outer=11 | pruned after 5/10 inner folds (mean r=0.1725)
[I 2026-06-01 02:51:48,058] Trial 74 pruned. 
2026-06-01 02:51:48 | INFO | src.nested_cv_avggrm_weighted_unified | Trial 75 | outer=11 | alpha=8.355e+04 n_pcs=3500 (pc_topk) weight_search=on
2026-06-01 02:51:48 | INFO | src.nested_cv_avggrm_weighted_unified | Trial 75 | outer=11 | weight={'name': 'linear', 'floor': 1e-06, 'clip_max': 3.0, 'min_weight': 0.2768941968381706, 'max_weight': 4.521472901524748}
[I 2026-06-01 02:51:53,541] Trial 75 finished with value: 0.22675854511690235 and parameters: {'alpha': 83553.68574822796, 'n_pcs': 3500, 'weight_scheme': 'linear', 'weight_clip_max': 3.0, 'weight_linear_min_weight': 0.2768941968381706, 'weight_linear_max_weight': 4.521472901524748}. Best is trial 58 with value: 0.2272202509741915.
2026-06-01 02:51:53 | INFO | src.nested_cv_avggrm_weighted_unified | Trial 76 | outer=11 | alpha=8.751e+04 n_pcs=3500 (pc_topk) weight_search=on
2026-06-01 02:51:53 | INFO | src.nested_cv_avggrm_weighted_unified | Trial 76 | outer=11 | weight={'name': 'uniform', 'floor': 1e-06, 'clip_max': 3.0}
[I 2026-06-01 02:51:57,817] Trial 76 finished with value: 0.21908060795351952 and parameters: {'alpha': 87508.56970139923, 'n_pcs': 3500, 'weight_scheme': 'uniform', 'weight_clip_max': 3.0}. Best is trial 58 with value: 0.2272202509741915.
2026-06-01 02:51:57 | INFO | src.nested_cv_avggrm_weighted_unified | Trial 77 | outer=11 | alpha=1.899e+05 n_pcs=3000 (pc_topk) weight_search=on
2026-06-01 02:51:57 | INFO | src.nested_cv_avggrm_weighted_unified | Trial 77 | outer=11 | weight={'name': 'linear', 'floor': 1e-06, 'clip_max': 3.0, 'min_weight': 0.2784234465900369, 'max_weight': 4.970153010947578}
[I 2026-06-01 02:52:02,033] Trial 77 finished with value: 0.2257952842086243 and parameters: {'alpha': 189945.7586435863, 'n_pcs': 3000, 'weight_scheme': 'linear', 'weight_clip_max': 3.0, 'weight_linear_min_weight': 0.2784234465900369, 'weight_linear_max_weight': 4.970153010947578}. Best is trial 58 with value: 0.2272202509741915.
2026-06-01 02:52:02 | INFO | src.nested_cv_avggrm_weighted_unified | Trial 78 | outer=11 | alpha=4.541e+04 n_pcs=3500 (pc_topk) weight_search=on
2026-06-01 02:52:02 | INFO | src.nested_cv_avggrm_weighted_unified | Trial 78 | outer=11 | weight={'name': 'exponential', 'floor': 1e-06, 'clip_max': None, 'beta': 7.231208696670262}
2026-06-01 02:52:05 | INFO | src.nested_cv_avggrm_weighted_unified | Trial 78 | outer=11 | pruned after 7/10 inner folds (mean r=0.2359)
[I 2026-06-01 02:52:05,543] Trial 78 pruned. 
2026-06-01 02:52:05 | INFO | src.nested_cv_avggrm_weighted_unified | Trial 79 | outer=11 | alpha=8.124e+04 n_pcs=3000 (pc_topk) weight_search=on
2026-06-01 02:52:05 | INFO | src.nested_cv_avggrm_weighted_unified | Trial 79 | outer=11 | weight={'name': 'linear', 'floor': 1e-06, 'clip_max': 3.0, 'min_weight': 0.19003726168380713, 'max_weight': 4.498255291611489}
[I 2026-06-01 02:52:09,395] Trial 79 finished with value: 0.2271294596762476 and parameters: {'alpha': 81235.47717486676, 'n_pcs': 3000, 'weight_scheme': 'linear', 'weight_clip_max': 3.0, 'weight_linear_min_weight': 0.19003726168380713, 'weight_linear_max_weight': 4.498255291611489}. Best is trial 58 with value: 0.2272202509741915.
2026-06-01 02:52:09 | INFO | src.nested_cv_avggrm_weighted_unified | Trial 80 | outer=11 | alpha=3.007e+04 n_pcs=3000 (pc_topk) weight_search=on
2026-06-01 02:52:09 | INFO | src.nested_cv_avggrm_weighted_unified | Trial 80 | outer=11 | weight={'name': 'linear', 'floor': 1e-06, 'clip_max': 10.0, 'min_weight': 0.2657410513598431, 'max_weight': 4.485462808037057}
[I 2026-06-01 02:52:13,222] Trial 80 finished with value: 0.2172024053713948 and parameters: {'alpha': 30072.39639115463, 'n_pcs': 3000, 'weight_scheme': 'linear', 'weight_clip_max': 10.0, 'weight_linear_min_weight': 0.2657410513598431, 'weight_linear_max_weight': 4.485462808037057}. Best is trial 58 with value: 0.2272202509741915.
2026-06-01 02:52:13 | INFO | src.nested_cv_avggrm_weighted_unified | Trial 81 | outer=11 | alpha=8.436e+04 n_pcs=3000 (pc_topk) weight_search=on
2026-06-01 02:52:13 | INFO | src.nested_cv_avggrm_weighted_unified | Trial 81 | outer=11 | weight={'name': 'linear', 'floor': 1e-06, 'clip_max': 3.0, 'min_weight': 0.17311656348356236, 'max_weight': 4.614661963715359}
[I 2026-06-01 02:52:17,076] Trial 81 finished with value: 0.22717512090380815 and parameters: {'alpha': 84356.28249283085, 'n_pcs': 3000, 'weight_scheme': 'linear', 'weight_clip_max': 3.0, 'weight_linear_min_weight': 0.17311656348356236, 'weight_linear_max_weight': 4.614661963715359}. Best is trial 58 with value: 0.2272202509741915.
2026-06-01 02:52:17 | INFO | src.nested_cv_avggrm_weighted_unified | Trial 82 | outer=11 | alpha=8.279e+04 n_pcs=3500 (pc_topk) weight_search=on
2026-06-01 02:52:17 | INFO | src.nested_cv_avggrm_weighted_unified | Trial 82 | outer=11 | weight={'name': 'linear', 'floor': 1e-06, 'clip_max': 3.0, 'min_weight': 0.18306937284894167, 'max_weight': 4.571240886008852}
