[I 2026-06-01 13:58:53,038] Trial 202 finished with value: 0.2549171096823905 and parameters: {'alpha': 68171.4485794851, 'n_pcs': 5000, 'iw_method': 'pc_logistic', 'iw_clip_max': 4.0, 'iw_prob_clip': 0.010202966337178885, 'iw_n_components': 100, 'iw_logistic_c': 0.00010216949562496295, 'iw_pca_fit': 'combined', 'iw_solver': 'lbfgs', 'iw_rho': 0.85}. Best is trial 160 with value: 0.2552976728977937.
2026-06-01 13:58:53 | INFO | Trial 203 | outer=1 | alpha=6.250e+04 n_pcs=5000 (pc_topk) weight={'name': 'pc_logistic', 'floor': 1e-06, 'clip_max': 4.0, 'prob_clip': 0.010163628588225511, 'n_components': 100, 'logistic_c': 0.00010407044463572811, 'pca_fit': 'combined', 'solver': 'lbfgs', 'max_iter': 2000, 'fit_intercept': True, 'standardize_with_source': True, 'rho': 0.85}
[I 2026-06-01 13:59:12,594] Trial 203 finished with value: 0.2547561582696951 and parameters: {'alpha': 62504.369975381174, 'n_pcs': 5000, 'iw_method': 'pc_logistic', 'iw_clip_max': 4.0, 'iw_prob_clip': 0.010163628588225511, 'iw_n_components': 100, 'iw_logistic_c': 0.00010407044463572811, 'iw_pca_fit': 'combined', 'iw_solver': 'lbfgs', 'iw_rho': 0.85}. Best is trial 160 with value: 0.2552976728977937.
2026-06-01 13:59:12 | INFO | Trial 204 | outer=1 | alpha=6.381e+04 n_pcs=5000 (pc_topk) weight={'name': 'pc_logistic', 'floor': 1e-06, 'clip_max': 4.0, 'prob_clip': 0.010339016870505662, 'n_components': 100, 'logistic_c': 0.00010570728417893799, 'pca_fit': 'combined', 'solver': 'lbfgs', 'max_iter': 2000, 'fit_intercept': True, 'standardize_with_source': True, 'rho': 0.85}
[I 2026-06-01 13:59:31,918] Trial 204 finished with value: 0.25480119383752686 and parameters: {'alpha': 63810.45228366632, 'n_pcs': 5000, 'iw_method': 'pc_logistic', 'iw_clip_max': 4.0, 'iw_prob_clip': 0.010339016870505662, 'iw_n_components': 100, 'iw_logistic_c': 0.00010570728417893799, 'iw_pca_fit': 'combined', 'iw_solver': 'lbfgs', 'iw_rho': 0.85}. Best is trial 160 with value: 0.2552976728977937.
2026-06-01 13:59:31 | INFO | Trial 205 | outer=1 | alpha=6.023e+04 n_pcs=5000 (pc_topk) weight={'name': 'pc_logistic', 'floor': 1e-06, 'clip_max': 4.0, 'prob_clip': 0.010304063707558259, 'n_components': 100, 'logistic_c': 9.387944298379482e-05, 'pca_fit': 'combined', 'solver': 'lbfgs', 'max_iter': 2000, 'fit_intercept': True, 'standardize_with_source': True, 'rho': 0.85}
[I 2026-06-01 13:59:51,115] Trial 205 finished with value: 0.2547351107547238 and parameters: {'alpha': 60231.07523735679, 'n_pcs': 5000, 'iw_method': 'pc_logistic', 'iw_clip_max': 4.0, 'iw_prob_clip': 0.010304063707558259, 'iw_n_components': 100, 'iw_logistic_c': 9.387944298379482e-05, 'iw_pca_fit': 'combined', 'iw_solver': 'lbfgs', 'iw_rho': 0.85}. Best is trial 160 with value: 0.2552976728977937.
2026-06-01 13:59:51 | INFO | Trial 206 | outer=1 | alpha=6.296e+04 n_pcs=5000 (pc_topk) weight={'name': 'pc_logistic', 'floor': 1e-06, 'clip_max': 4.0, 'prob_clip': 0.010479093220323678, 'n_components': 100, 'logistic_c': 0.0001008678578842477, 'pca_fit': 'combined', 'solver': 'lbfgs', 'max_iter': 2000, 'fit_intercept': True, 'standardize_with_source': True, 'rho': 0.3}
[I 2026-06-01 14:00:10,340] Trial 206 finished with value: 0.25242450960216745 and parameters: {'alpha': 62960.30395775431, 'n_pcs': 5000, 'iw_method': 'pc_logistic', 'iw_clip_max': 4.0, 'iw_prob_clip': 0.010479093220323678, 'iw_n_components': 100, 'iw_logistic_c': 0.0001008678578842477, 'iw_pca_fit': 'combined', 'iw_solver': 'lbfgs', 'iw_rho': 0.3}. Best is trial 160 with value: 0.2552976728977937.
2026-06-01 14:00:10 | INFO | Trial 207 | outer=1 | alpha=4.820e+04 n_pcs=5000 (pc_topk) weight={'name': 'pc_logistic', 'floor': 1e-06, 'clip_max': 4.0, 'prob_clip': 0.011995963582860973, 'n_components': 100, 'logistic_c': 8.955425877371795e-05, 'pca_fit': 'combined', 'solver': 'lbfgs', 'max_iter': 2000, 'fit_intercept': True, 'standardize_with_source': True, 'rho': 0.85}
[I 2026-06-01 14:00:29,058] Trial 207 finished with value: 0.2542995185623234 and parameters: {'alpha': 48204.7130833472, 'n_pcs': 5000, 'iw_method': 'pc_logistic', 'iw_clip_max': 4.0, 'iw_prob_clip': 0.011995963582860973, 'iw_n_components': 100, 'iw_logistic_c': 8.955425877371795e-05, 'iw_pca_fit': 'combined', 'iw_solver': 'lbfgs', 'iw_rho': 0.85}. Best is trial 160 with value: 0.2552976728977937.
2026-06-01 14:00:29 | INFO | Trial 208 | outer=1 | alpha=5.834e+04 n_pcs=5000 (pc_topk) weight={'name': 'pc_logistic', 'floor': 1e-06, 'clip_max': 4.0, 'prob_clip': 0.010212523219536888, 'n_components': 60, 'logistic_c': 4.2930812396200954e-05, 'pca_fit': 'combined', 'solver': 'lbfgs', 'max_iter': 2000, 'fit_intercept': True, 'standardize_with_source': True, 'rho': 0.85}
[I 2026-06-01 14:00:47,074] Trial 208 finished with value: 0.254308986386981 and parameters: {'alpha': 58343.99926363039, 'n_pcs': 5000, 'iw_method': 'pc_logistic', 'iw_clip_max': 4.0, 'iw_prob_clip': 0.010212523219536888, 'iw_n_components': 60, 'iw_logistic_c': 4.2930812396200954e-05, 'iw_pca_fit': 'combined', 'iw_solver': 'lbfgs', 'iw_rho': 0.85}. Best is trial 160 with value: 0.2552976728977937.
2026-06-01 14:00:47 | INFO | Trial 209 | outer=1 | alpha=4.416e+04 n_pcs=5000 (pc_topk) weight={'name': 'pc_logistic', 'floor': 1e-06, 'clip_max': 2.5, 'prob_clip': 0.01146623846727586, 'n_components': 100, 'logistic_c': 7.001281268660172e-05, 'pca_fit': 'combined', 'solver': 'lbfgs', 'max_iter': 2000, 'fit_intercept': True, 'standardize_with_source': True, 'rho': 0.5}
[I 2026-06-01 14:01:05,622] Trial 209 finished with value: 0.2529323146404813 and parameters: {'alpha': 44164.43878936041, 'n_pcs': 5000, 'iw_method': 'pc_logistic', 'iw_clip_max': 2.5, 'iw_prob_clip': 0.01146623846727586, 'iw_n_components': 100, 'iw_logistic_c': 7.001281268660172e-05, 'iw_pca_fit': 'combined', 'iw_solver': 'lbfgs', 'iw_rho': 0.5}. Best is trial 160 with value: 0.2552976728977937.
2026-06-01 14:01:05 | INFO | Trial 210 | outer=1 | alpha=6.457e+04 n_pcs=5000 (pc_topk) weight={'name': 'pc_logistic', 'floor': 1e-06, 'clip_max': 4.0, 'prob_clip': 0.015007793630698575, 'n_components': 100, 'logistic_c': 0.00010328407742819704, 'pca_fit': 'combined', 'solver': 'lbfgs', 'max_iter': 2000, 'fit_intercept': True, 'standardize_with_source': True, 'rho': 0.85}
[I 2026-06-01 14:01:24,951] Trial 210 finished with value: 0.2556677849525829 and parameters: {'alpha': 64568.82811537051, 'n_pcs': 5000, 'iw_method': 'pc_logistic', 'iw_clip_max': 4.0, 'iw_prob_clip': 0.015007793630698575, 'iw_n_components': 100, 'iw_logistic_c': 0.00010328407742819704, 'iw_pca_fit': 'combined', 'iw_solver': 'lbfgs', 'iw_rho': 0.85}. Best is trial 210 with value: 0.2556677849525829.
2026-06-01 14:01:24 | INFO | Trial 211 | outer=1 | alpha=6.261e+04 n_pcs=5000 (pc_topk) weight={'name': 'pc_logistic', 'floor': 1e-06, 'clip_max': 4.0, 'prob_clip': 0.012522787525639954, 'n_components': 100, 'logistic_c': 0.00010219846370779013, 'pca_fit': 'combined', 'solver': 'lbfgs', 'max_iter': 2000, 'fit_intercept': True, 'standardize_with_source': True, 'rho': 0.85}
[I 2026-06-01 14:01:44,184] Trial 211 finished with value: 0.25525109803737217 and parameters: {'alpha': 62612.416696674416, 'n_pcs': 5000, 'iw_method': 'pc_logistic', 'iw_clip_max': 4.0, 'iw_prob_clip': 0.012522787525639954, 'iw_n_components': 100, 'iw_logistic_c': 0.00010219846370779013, 'iw_pca_fit': 'combined', 'iw_solver': 'lbfgs', 'iw_rho': 0.85}. Best is trial 210 with value: 0.2556677849525829.
2026-06-01 14:01:44 | INFO | Trial 212 | outer=1 | alpha=5.325e+04 n_pcs=5000 (pc_topk) weight={'name': 'pc_logistic', 'floor': 1e-06, 'clip_max': 4.0, 'prob_clip': 0.015579384714841289, 'n_components': 100, 'logistic_c': 0.00011477862214286467, 'pca_fit': 'combined', 'solver': 'lbfgs', 'max_iter': 2000, 'fit_intercept': True, 'standardize_with_source': True, 'rho': 0.85}
[I 2026-06-01 14:02:02,969] Trial 212 finished with value: 0.25526738987329156 and parameters: {'alpha': 53254.335231824516, 'n_pcs': 5000, 'iw_method': 'pc_logistic', 'iw_clip_max': 4.0, 'iw_prob_clip': 0.015579384714841289, 'iw_n_components': 100, 'iw_logistic_c': 0.00011477862214286467, 'iw_pca_fit': 'combined', 'iw_solver': 'lbfgs', 'iw_rho': 0.85}. Best is trial 210 with value: 0.2556677849525829.
2026-06-01 14:02:02 | INFO | Trial 213 | outer=1 | alpha=4.833e+04 n_pcs=5000 (pc_topk) weight={'name': 'pc_logistic', 'floor': 1e-06, 'clip_max': 4.0, 'prob_clip': 0.01623896714096043, 'n_components': 100, 'logistic_c': 5.456863240812505e-05, 'pca_fit': 'combined', 'solver': 'lbfgs', 'max_iter': 2000, 'fit_intercept': True, 'standardize_with_source': True, 'rho': 0.85}
[I 2026-06-01 14:02:21,424] Trial 213 finished with value: 0.2549107519723356 and parameters: {'alpha': 48332.88755441016, 'n_pcs': 5000, 'iw_method': 'pc_logistic', 'iw_clip_max': 4.0, 'iw_prob_clip': 0.01623896714096043, 'iw_n_components': 100, 'iw_logistic_c': 5.456863240812505e-05, 'iw_pca_fit': 'combined', 'iw_solver': 'lbfgs', 'iw_rho': 0.85}. Best is trial 210 with value: 0.2556677849525829.
2026-06-01 14:02:21 | INFO | Trial 214 | outer=1 | alpha=3.711e+04 n_pcs=5000 (pc_topk) weight={'name': 'pc_logistic', 'floor': 1e-06, 'clip_max': 4.0, 'prob_clip': 0.014655201590247314, 'n_components': 100, 'logistic_c': 5.714659686947474e-05, 'pca_fit': 'combined', 'solver': 'lbfgs', 'max_iter': 2000, 'fit_intercept': True, 'standardize_with_source': True, 'rho': 0.85}
[I 2026-06-01 14:02:39,376] Trial 214 finished with value: 0.2532970326165572 and parameters: {'alpha': 37107.12191906528, 'n_pcs': 5000, 'iw_method': 'pc_logistic', 'iw_clip_max': 4.0, 'iw_prob_clip': 0.014655201590247314, 'iw_n_components': 100, 'iw_logistic_c': 5.714659686947474e-05, 'iw_pca_fit': 'combined', 'iw_solver': 'lbfgs', 'iw_rho': 0.85}. Best is trial 210 with value: 0.2556677849525829.
2026-06-01 14:02:39 | INFO | Trial 215 | outer=1 | alpha=5.296e+04 n_pcs=5000 (pc_topk) weight={'name': 'pc_logistic', 'floor': 1e-06, 'clip_max': 4.0, 'prob_clip': 0.019185824958299433, 'n_components': 100, 'logistic_c': 3.8809238941529134e-05, 'pca_fit': 'combined', 'solver': 'lbfgs', 'max_iter': 2000, 'fit_intercept': True, 'standardize_with_source': True, 'rho': 0.85}
[I 2026-06-01 14:02:56,714] Trial 215 finished with value: 0.25493903727434614 and parameters: {'alpha': 52964.82453022852, 'n_pcs': 5000, 'iw_method': 'pc_logistic', 'iw_clip_max': 4.0, 'iw_prob_clip': 0.019185824958299433, 'iw_n_components': 100, 'iw_logistic_c': 3.8809238941529134e-05, 'iw_pca_fit': 'combined', 'iw_solver': 'lbfgs', 'iw_rho': 0.85}. Best is trial 210 with value: 0.2556677849525829.
2026-06-01 14:02:56 | INFO | Trial 216 | outer=1 | alpha=5.088e+04 n_pcs=5000 (pc_topk) weight={'name': 'pc_logistic', 'floor': 1e-06, 'clip_max': 12.0, 'prob_clip': 0.020629138315953224, 'n_components': 100, 'logistic_c': 1.446724801955355e-05, 'pca_fit': 'combined', 'solver': 'lbfgs', 'max_iter': 2000, 'fit_intercept': True, 'standardize_with_source': True, 'rho': 0.85}
[I 2026-06-01 14:03:14,733] Trial 216 finished with value: 0.24979733447626007 and parameters: {'alpha': 50875.83853437464, 'n_pcs': 5000, 'iw_method': 'pc_logistic', 'iw_clip_max': 12.0, 'iw_prob_clip': 0.020629138315953224, 'iw_n_components': 100, 'iw_logistic_c': 1.446724801955355e-05, 'iw_pca_fit': 'combined', 'iw_solver': 'lbfgs', 'iw_rho': 0.85}. Best is trial 210 with value: 0.2556677849525829.
2026-06-01 14:03:14 | INFO | Trial 217 | outer=1 | alpha=4.300e+04 n_pcs=5000 (pc_topk) weight={'name': 'pc_logistic', 'floor': 1e-06, 'clip_max': 4.0, 'prob_clip': 0.016551633367651343, 'n_components': 100, 'logistic_c': 4.231000262598962e-05, 'pca_fit': 'combined', 'solver': 'lbfgs', 'max_iter': 2000, 'fit_intercept': True, 'standardize_with_source': True, 'rho': 0.85}
[I 2026-06-01 14:03:33,274] Trial 217 finished with value: 0.25411102038136507 and parameters: {'alpha': 42996.06513286332, 'n_pcs': 5000, 'iw_method': 'pc_logistic', 'iw_clip_max': 4.0, 'iw_prob_clip': 0.016551633367651343, 'iw_n_components': 100, 'iw_logistic_c': 4.231000262598962e-05, 'iw_pca_fit': 'combined', 'iw_solver': 'lbfgs', 'iw_rho': 0.85}. Best is trial 210 with value: 0.2556677849525829.
2026-06-01 14:03:33 | INFO | Trial 218 | outer=1 | alpha=5.276e+04 n_pcs=5000 (pc_topk) weight={'name': 'pc_logistic', 'floor': 1e-06, 'clip_max': 4.0, 'prob_clip': 0.018749373513949834, 'n_components': 100, 'logistic_c': 5.539552574790339e-05, 'pca_fit': 'combined', 'solver': 'lbfgs', 'max_iter': 2000, 'fit_intercept': True, 'standardize_with_source': True, 'rho': 0.85}
[I 2026-06-01 14:03:52,077] Trial 218 finished with value: 0.255253606613002 and parameters: {'alpha': 52759.065212297304, 'n_pcs': 5000, 'iw_method': 'pc_logistic', 'iw_clip_max': 4.0, 'iw_prob_clip': 0.018749373513949834, 'iw_n_components': 100, 'iw_logistic_c': 5.539552574790339e-05, 'iw_pca_fit': 'combined', 'iw_solver': 'lbfgs', 'iw_rho': 0.85}. Best is trial 210 with value: 0.2556677849525829.
2026-06-01 14:03:52 | INFO | Trial 219 | outer=1 | alpha=4.957e+04 n_pcs=5000 (pc_topk) weight={'name': 'pc_logistic', 'floor': 1e-06, 'clip_max': 4.0, 'prob_clip': 0.023285342704642345, 'n_components': 100, 'logistic_c': 6.570231913216057e-05, 'pca_fit': 'combined', 'solver': 'lbfgs', 'max_iter': 2000, 'fit_intercept': True, 'standardize_with_source': True, 'rho': 0.85}
[I 2026-06-01 14:04:10,132] Trial 219 finished with value: 0.2550152710394502 and parameters: {'alpha': 49573.87367416625, 'n_pcs': 5000, 'iw_method': 'pc_logistic', 'iw_clip_max': 4.0, 'iw_prob_clip': 0.023285342704642345, 'iw_n_components': 100, 'iw_logistic_c': 6.570231913216057e-05, 'iw_pca_fit': 'combined', 'iw_solver': 'lbfgs', 'iw_rho': 0.85}. Best is trial 210 with value: 0.2556677849525829.
2026-06-01 14:04:10 | INFO | Trial 220 | outer=1 | alpha=5.014e+04 n_pcs=5000 (pc_topk) weight={'name': 'pc_logistic', 'floor': 1e-06, 'clip_max': 4.0, 'prob_clip': 0.015485556032117072, 'n_components': 100, 'logistic_c': 6.261111464395304e-05, 'pca_fit': 'combined', 'solver': 'lbfgs', 'max_iter': 2000, 'fit_intercept': True, 'standardize_with_source': True, 'rho': 0.85}
[I 2026-06-01 14:04:28,458] Trial 220 finished with value: 0.25506528342491036 and parameters: {'alpha': 50135.155276666585, 'n_pcs': 5000, 'iw_method': 'pc_logistic', 'iw_clip_max': 4.0, 'iw_prob_clip': 0.015485556032117072, 'iw_n_components': 100, 'iw_logistic_c': 6.261111464395304e-05, 'iw_pca_fit': 'combined', 'iw_solver': 'lbfgs', 'iw_rho': 0.85}. Best is trial 210 with value: 0.2556677849525829.
2026-06-01 14:04:28 | INFO | Trial 221 | outer=1 | alpha=5.226e+04 n_pcs=5000 (pc_topk) weight={'name': 'pc_logistic', 'floor': 1e-06, 'clip_max': 4.0, 'prob_clip': 0.018156245331049786, 'n_components': 100, 'logistic_c': 6.466375662029916e-05, 'pca_fit': 'combined', 'solver': 'lbfgs', 'max_iter': 2000, 'fit_intercept': True, 'standardize_with_source': True, 'rho': 0.85}
[I 2026-06-01 14:04:46,471] Trial 221 finished with value: 0.2552616459549528 and parameters: {'alpha': 52259.11600906704, 'n_pcs': 5000, 'iw_method': 'pc_logistic', 'iw_clip_max': 4.0, 'iw_prob_clip': 0.018156245331049786, 'iw_n_components': 100, 'iw_logistic_c': 6.466375662029916e-05, 'iw_pca_fit': 'combined', 'iw_solver': 'lbfgs', 'iw_rho': 0.85}. Best is trial 210 with value: 0.2556677849525829.
2026-06-01 14:04:46 | INFO | Trial 222 | outer=1 | alpha=5.017e+04 n_pcs=5000 (pc_topk) weight={'name': 'pc_logistic', 'floor': 1e-06, 'clip_max': 4.0, 'prob_clip': 0.019142444092596297, 'n_components': 100, 'logistic_c': 6.281424154142134e-05, 'pca_fit': 'combined', 'solver': 'lbfgs', 'max_iter': 2000, 'fit_intercept': True, 'standardize_with_source': True, 'rho': 0.85}
[I 2026-06-01 14:05:05,039] Trial 222 finished with value: 0.2551689397091788 and parameters: {'alpha': 50172.94314849097, 'n_pcs': 5000, 'iw_method': 'pc_logistic', 'iw_clip_max': 4.0, 'iw_prob_clip': 0.019142444092596297, 'iw_n_components': 100, 'iw_logistic_c': 6.281424154142134e-05, 'iw_pca_fit': 'combined', 'iw_solver': 'lbfgs', 'iw_rho': 0.85}. Best is trial 210 with value: 0.2556677849525829.
2026-06-01 14:05:05 | INFO | Trial 223 | outer=1 | alpha=3.570e+04 n_pcs=5000 (pc_topk) weight={'name': 'pc_logistic', 'floor': 1e-06, 'clip_max': 4.0, 'prob_clip': 0.022603138697502214, 'n_components': 100, 'logistic_c': 6.0920837523716333e-05, 'pca_fit': 'combined', 'solver': 'lbfgs', 'max_iter': 2000, 'fit_intercept': True, 'standardize_with_source': True, 'rho': 0.85}
[I 2026-06-01 14:05:23,693] Trial 223 finished with value: 0.25385846863149397 and parameters: {'alpha': 35699.90397407987, 'n_pcs': 5000, 'iw_method': 'pc_logistic', 'iw_clip_max': 4.0, 'iw_prob_clip': 0.022603138697502214, 'iw_n_components': 100, 'iw_logistic_c': 6.0920837523716333e-05, 'iw_pca_fit': 'combined', 'iw_solver': 'lbfgs', 'iw_rho': 0.85}. Best is trial 210 with value: 0.2556677849525829.
2026-06-01 14:05:23 | INFO | Trial 224 | outer=1 | alpha=5.072e+04 n_pcs=5000 (pc_topk) weight={'name': 'pc_logistic', 'floor': 1e-06, 'clip_max': 4.0, 'prob_clip': 0.024098529831150944, 'n_components': 100, 'logistic_c': 6.264409565363737e-05, 'pca_fit': 'combined', 'solver': 'lbfgs', 'max_iter': 2000, 'fit_intercept': True, 'standardize_with_source': True, 'rho': 1.0}
[I 2026-06-01 14:05:42,050] Trial 224 finished with value: 0.25473655039508536 and parameters: {'alpha': 50722.78476418521, 'n_pcs': 5000, 'iw_method': 'pc_logistic', 'iw_clip_max': 4.0, 'iw_prob_clip': 0.024098529831150944, 'iw_n_components': 100, 'iw_logistic_c': 6.264409565363737e-05, 'iw_pca_fit': 'combined', 'iw_solver': 'lbfgs', 'iw_rho': 1.0}. Best is trial 210 with value: 0.2556677849525829.
2026-06-01 14:05:42 | INFO | Trial 225 | outer=1 | alpha=2.963e+04 n_pcs=5000 (pc_topk) weight={'name': 'pc_logistic', 'floor': 1e-06, 'clip_max': 4.0, 'prob_clip': 0.019573690379465682, 'n_components': 100, 'logistic_c': 5.1568581815764415e-05, 'pca_fit': 'combined', 'solver': 'lbfgs', 'max_iter': 2000, 'fit_intercept': True, 'standardize_with_source': True, 'rho': 0.85}
[I 2026-06-01 14:06:00,247] Trial 225 finished with value: 0.25221899303011586 and parameters: {'alpha': 29627.24539255824, 'n_pcs': 5000, 'iw_method': 'pc_logistic', 'iw_clip_max': 4.0, 'iw_prob_clip': 0.019573690379465682, 'iw_n_components': 100, 'iw_logistic_c': 5.1568581815764415e-05, 'iw_pca_fit': 'combined', 'iw_solver': 'lbfgs', 'iw_rho': 0.85}. Best is trial 210 with value: 0.2556677849525829.
2026-06-01 14:06:00 | INFO | Trial 226 | outer=1 | alpha=4.592e+04 n_pcs=5000 (pc_topk) weight={'name': 'pc_logistic', 'floor': 1e-06, 'clip_max': 4.0, 'prob_clip': 0.019003109432377076, 'n_components': 100, 'logistic_c': 3.4349837862617394e-05, 'pca_fit': 'combined', 'solver': 'lbfgs', 'max_iter': 2000, 'fit_intercept': True, 'standardize_with_source': True, 'rho': 0.85}
[I 2026-06-01 14:06:17,871] Trial 226 finished with value: 0.25433968214676894 and parameters: {'alpha': 45916.10913449741, 'n_pcs': 5000, 'iw_method': 'pc_logistic', 'iw_clip_max': 4.0, 'iw_prob_clip': 0.019003109432377076, 'iw_n_components': 100, 'iw_logistic_c': 3.4349837862617394e-05, 'iw_pca_fit': 'combined', 'iw_solver': 'lbfgs', 'iw_rho': 0.85}. Best is trial 210 with value: 0.2556677849525829.
2026-06-01 14:06:17 | INFO | Trial 227 | outer=1 | alpha=3.978e+04 n_pcs=5000 (pc_topk) weight={'name': 'uniform'}
[I 2026-06-01 14:06:28,042] Trial 227 finished with value: 0.244315914170107 and parameters: {'alpha': 39784.073382869574, 'n_pcs': 5000, 'iw_method': 'uniform'}. Best is trial 210 with value: 0.2556677849525829.
2026-06-01 14:06:28 | INFO | Trial 228 | outer=1 | alpha=5.281e+04 n_pcs=5000 (pc_topk) weight={'name': 'pc_logistic', 'floor': 1e-06, 'clip_max': 4.0, 'prob_clip': 0.01526244386585175, 'n_components': 100, 'logistic_c': 6.44513316555899e-05, 'pca_fit': 'combined', 'solver': 'lbfgs', 'max_iter': 2000, 'fit_intercept': True, 'standardize_with_source': True, 'rho': 0.85}
[I 2026-06-01 14:06:46,744] Trial 228 finished with value: 0.25521600112169646 and parameters: {'alpha': 52814.8159804755, 'n_pcs': 5000, 'iw_method': 'pc_logistic', 'iw_clip_max': 4.0, 'iw_prob_clip': 0.01526244386585175, 'iw_n_components': 100, 'iw_logistic_c': 6.44513316555899e-05, 'iw_pca_fit': 'combined', 'iw_solver': 'lbfgs', 'iw_rho': 0.85}. Best is trial 210 with value: 0.2556677849525829.
2026-06-01 14:06:46 | INFO | Trial 229 | outer=1 | alpha=5.331e+04 n_pcs=5000 (pc_topk) weight={'name': 'pc_logistic', 'floor': 1e-06, 'clip_max': 4.0, 'prob_clip': 0.029379134891836356, 'n_components': 100, 'logistic_c': 7.415733773228569e-05, 'pca_fit': 'combined', 'solver': 'lbfgs', 'max_iter': 2000, 'fit_intercept': True, 'standardize_with_source': True, 'rho': 0.85}
[I 2026-06-01 14:07:05,348] Trial 229 finished with value: 0.25407353771216573 and parameters: {'alpha': 53310.45345616485, 'n_pcs': 5000, 'iw_method': 'pc_logistic', 'iw_clip_max': 4.0, 'iw_prob_clip': 0.029379134891836356, 'iw_n_components': 100, 'iw_logistic_c': 7.415733773228569e-05, 'iw_pca_fit': 'combined', 'iw_solver': 'lbfgs', 'iw_rho': 0.85}. Best is trial 210 with value: 0.2556677849525829.
2026-06-01 14:07:05 | INFO | Trial 230 | outer=1 | alpha=5.229e+04 n_pcs=5000 (pc_topk) weight={'name': 'pc_logistic', 'floor': 1e-06, 'clip_max': 4.0, 'prob_clip': 0.01473880282140444, 'n_components': 100, 'logistic_c': 3.673922946077961e-05, 'pca_fit': 'combined', 'solver': 'lbfgs', 'max_iter': 2000, 'fit_intercept': True, 'standardize_with_source': True, 'rho': 0.85}
