[I 2026-06-01 20:34:08,686] Trial 206 finished with value: 0.2362336917883639 and parameters: {'alpha': 50974.13357588456, 'n_pcs': 4000, 'iw_method': 'pc_logistic', 'iw_clip_max': 1.5, 'iw_prob_clip': 0.011485544411084894, 'iw_n_components': 80, 'iw_logistic_c': 0.17321614898367205, 'iw_pca_fit': 'combined', 'iw_solver': 'lbfgs', 'iw_rho': 0.85}. Best is trial 163 with value: 0.23699875400639323.
2026-06-01 20:34:08 | INFO | Trial 207 | outer=6 | alpha=5.199e+04 n_pcs=4000 (pc_topk) weight={'name': 'pc_logistic', 'floor': 1e-06, 'clip_max': 7.0, 'prob_clip': 0.01197900132307176, 'n_components': 20, 'logistic_c': 0.19182309559672056, 'pca_fit': 'combined', 'solver': 'lbfgs', 'max_iter': 2000, 'fit_intercept': True, 'standardize_with_source': True, 'rho': 0.85}
[I 2026-06-01 20:34:26,440] Trial 207 finished with value: 0.2253514338137065 and parameters: {'alpha': 51993.15391592682, 'n_pcs': 4000, 'iw_method': 'pc_logistic', 'iw_clip_max': 7.0, 'iw_prob_clip': 0.01197900132307176, 'iw_n_components': 20, 'iw_logistic_c': 0.19182309559672056, 'iw_pca_fit': 'combined', 'iw_solver': 'lbfgs', 'iw_rho': 0.85}. Best is trial 163 with value: 0.23699875400639323.
2026-06-01 20:34:26 | INFO | Trial 208 | outer=6 | alpha=3.278e+04 n_pcs=4000 (pc_topk) weight={'name': 'pc_logistic', 'floor': 1e-06, 'clip_max': 1.5, 'prob_clip': 0.010295136155482575, 'n_components': 100, 'logistic_c': 0.2845277614028697, 'pca_fit': 'combined', 'solver': 'lbfgs', 'max_iter': 2000, 'fit_intercept': True, 'standardize_with_source': True, 'rho': 0.85}
[I 2026-06-01 20:34:53,703] Trial 208 finished with value: 0.23287900060673836 and parameters: {'alpha': 32779.931180678985, 'n_pcs': 4000, 'iw_method': 'pc_logistic', 'iw_clip_max': 1.5, 'iw_prob_clip': 0.010295136155482575, 'iw_n_components': 100, 'iw_logistic_c': 0.2845277614028697, 'iw_pca_fit': 'combined', 'iw_solver': 'lbfgs', 'iw_rho': 0.85}. Best is trial 163 with value: 0.23699875400639323.
2026-06-01 20:34:53 | INFO | Trial 209 | outer=6 | alpha=5.428e+04 n_pcs=4000 (pc_topk) weight={'name': 'pc_logistic', 'floor': 1e-06, 'clip_max': 12.0, 'prob_clip': 0.007648711283167366, 'n_components': 80, 'logistic_c': 0.11863662482511003, 'pca_fit': 'combined', 'solver': 'lbfgs', 'max_iter': 2000, 'fit_intercept': True, 'standardize_with_source': True, 'rho': 0.85}
[I 2026-06-01 20:35:19,262] Trial 209 finished with value: 0.21921544952445676 and parameters: {'alpha': 54284.203362834654, 'n_pcs': 4000, 'iw_method': 'pc_logistic', 'iw_clip_max': 12.0, 'iw_prob_clip': 0.007648711283167366, 'iw_n_components': 80, 'iw_logistic_c': 0.11863662482511003, 'iw_pca_fit': 'combined', 'iw_solver': 'lbfgs', 'iw_rho': 0.85}. Best is trial 163 with value: 0.23699875400639323.
2026-06-01 20:35:19 | INFO | Trial 210 | outer=6 | alpha=3.608e+04 n_pcs=4000 (pc_topk) weight={'name': 'pc_logistic', 'floor': 1e-06, 'clip_max': 1.5, 'prob_clip': 0.011655824723337163, 'n_components': 80, 'logistic_c': 0.0003227326691014257, 'pca_fit': 'combined', 'solver': 'lbfgs', 'max_iter': 2000, 'fit_intercept': True, 'standardize_with_source': True, 'rho': 0.85}
[I 2026-06-01 20:35:34,228] Trial 210 finished with value: 0.23110219093173634 and parameters: {'alpha': 36084.44454595351, 'n_pcs': 4000, 'iw_method': 'pc_logistic', 'iw_clip_max': 1.5, 'iw_prob_clip': 0.011655824723337163, 'iw_n_components': 80, 'iw_logistic_c': 0.0003227326691014257, 'iw_pca_fit': 'combined', 'iw_solver': 'lbfgs', 'iw_rho': 0.85}. Best is trial 163 with value: 0.23699875400639323.
2026-06-01 20:35:34 | INFO | Trial 211 | outer=6 | alpha=5.329e+04 n_pcs=4000 (pc_topk) weight={'name': 'pc_logistic', 'floor': 1e-06, 'clip_max': 1.5, 'prob_clip': 0.013035272282925715, 'n_components': 80, 'logistic_c': 0.20067805300624983, 'pca_fit': 'combined', 'solver': 'lbfgs', 'max_iter': 2000, 'fit_intercept': True, 'standardize_with_source': True, 'rho': 0.85}
[I 2026-06-01 20:36:00,611] Trial 211 finished with value: 0.23643893364016436 and parameters: {'alpha': 53290.024886072795, 'n_pcs': 4000, 'iw_method': 'pc_logistic', 'iw_clip_max': 1.5, 'iw_prob_clip': 0.013035272282925715, 'iw_n_components': 80, 'iw_logistic_c': 0.20067805300624983, 'iw_pca_fit': 'combined', 'iw_solver': 'lbfgs', 'iw_rho': 0.85}. Best is trial 163 with value: 0.23699875400639323.
2026-06-01 20:36:00 | INFO | Trial 212 | outer=6 | alpha=5.011e+04 n_pcs=4000 (pc_topk) weight={'name': 'pc_logistic', 'floor': 1e-06, 'clip_max': 1.5, 'prob_clip': 0.012816566232337581, 'n_components': 80, 'logistic_c': 0.3270772260656489, 'pca_fit': 'combined', 'solver': 'lbfgs', 'max_iter': 2000, 'fit_intercept': True, 'standardize_with_source': True, 'rho': 0.85}
[I 2026-06-01 20:36:25,754] Trial 212 finished with value: 0.23637196821145143 and parameters: {'alpha': 50111.7543934831, 'n_pcs': 4000, 'iw_method': 'pc_logistic', 'iw_clip_max': 1.5, 'iw_prob_clip': 0.012816566232337581, 'iw_n_components': 80, 'iw_logistic_c': 0.3270772260656489, 'iw_pca_fit': 'combined', 'iw_solver': 'lbfgs', 'iw_rho': 0.85}. Best is trial 163 with value: 0.23699875400639323.
2026-06-01 20:36:25 | INFO | Trial 213 | outer=6 | alpha=5.127e+04 n_pcs=4000 (pc_topk) weight={'name': 'pc_logistic', 'floor': 1e-06, 'clip_max': 1.5, 'prob_clip': 0.01461410580995084, 'n_components': 80, 'logistic_c': 0.3446652268895754, 'pca_fit': 'combined', 'solver': 'lbfgs', 'max_iter': 2000, 'fit_intercept': True, 'standardize_with_source': True, 'rho': 0.85}
[I 2026-06-01 20:36:51,681] Trial 213 finished with value: 0.23664263124834703 and parameters: {'alpha': 51273.77326680149, 'n_pcs': 4000, 'iw_method': 'pc_logistic', 'iw_clip_max': 1.5, 'iw_prob_clip': 0.01461410580995084, 'iw_n_components': 80, 'iw_logistic_c': 0.3446652268895754, 'iw_pca_fit': 'combined', 'iw_solver': 'lbfgs', 'iw_rho': 0.85}. Best is trial 163 with value: 0.23699875400639323.
2026-06-01 20:36:51 | INFO | Trial 214 | outer=6 | alpha=5.221e+04 n_pcs=4000 (pc_topk) weight={'name': 'pc_logistic', 'floor': 1e-06, 'clip_max': 1.5, 'prob_clip': 0.015020511897368973, 'n_components': 80, 'logistic_c': 0.36998336425611955, 'pca_fit': 'combined', 'solver': 'lbfgs', 'max_iter': 2000, 'fit_intercept': True, 'standardize_with_source': True, 'rho': 0.85}
[I 2026-06-01 20:37:18,090] Trial 214 finished with value: 0.23679073427961805 and parameters: {'alpha': 52210.00691686829, 'n_pcs': 4000, 'iw_method': 'pc_logistic', 'iw_clip_max': 1.5, 'iw_prob_clip': 0.015020511897368973, 'iw_n_components': 80, 'iw_logistic_c': 0.36998336425611955, 'iw_pca_fit': 'combined', 'iw_solver': 'lbfgs', 'iw_rho': 0.85}. Best is trial 163 with value: 0.23699875400639323.
2026-06-01 20:37:18 | INFO | Trial 215 | outer=6 | alpha=5.185e+04 n_pcs=4000 (pc_topk) weight={'name': 'pc_logistic', 'floor': 1e-06, 'clip_max': 1.5, 'prob_clip': 0.014657872089322241, 'n_components': 80, 'logistic_c': 0.346751040915567, 'pca_fit': 'combined', 'solver': 'lbfgs', 'max_iter': 2000, 'fit_intercept': True, 'standardize_with_source': True, 'rho': 0.85}
[I 2026-06-01 20:37:43,579] Trial 215 finished with value: 0.23672562591995927 and parameters: {'alpha': 51848.17854611306, 'n_pcs': 4000, 'iw_method': 'pc_logistic', 'iw_clip_max': 1.5, 'iw_prob_clip': 0.014657872089322241, 'iw_n_components': 80, 'iw_logistic_c': 0.346751040915567, 'iw_pca_fit': 'combined', 'iw_solver': 'lbfgs', 'iw_rho': 0.85}. Best is trial 163 with value: 0.23699875400639323.
2026-06-01 20:37:43 | INFO | Trial 216 | outer=6 | alpha=5.533e+04 n_pcs=4000 (pc_topk) weight={'name': 'pc_logistic', 'floor': 1e-06, 'clip_max': 1.5, 'prob_clip': 0.013328371773086906, 'n_components': 80, 'logistic_c': 0.3527559280072476, 'pca_fit': 'combined', 'solver': 'lbfgs', 'max_iter': 2000, 'fit_intercept': True, 'standardize_with_source': True, 'rho': 0.85}
[I 2026-06-01 20:38:10,330] Trial 216 finished with value: 0.23666280752890353 and parameters: {'alpha': 55327.37884001376, 'n_pcs': 4000, 'iw_method': 'pc_logistic', 'iw_clip_max': 1.5, 'iw_prob_clip': 0.013328371773086906, 'iw_n_components': 80, 'iw_logistic_c': 0.3527559280072476, 'iw_pca_fit': 'combined', 'iw_solver': 'lbfgs', 'iw_rho': 0.85}. Best is trial 163 with value: 0.23699875400639323.
2026-06-01 20:38:10 | INFO | Trial 217 | outer=6 | alpha=5.177e+04 n_pcs=4000 (pc_topk) weight={'name': 'pc_logistic', 'floor': 1e-06, 'clip_max': 2.5, 'prob_clip': 0.01299815418022596, 'n_components': 80, 'logistic_c': 0.34768354696909787, 'pca_fit': 'combined', 'solver': 'lbfgs', 'max_iter': 2000, 'fit_intercept': True, 'standardize_with_source': True, 'rho': 0.85}
[I 2026-06-01 20:38:36,762] Trial 217 finished with value: 0.23537628843585984 and parameters: {'alpha': 51765.112500755684, 'n_pcs': 4000, 'iw_method': 'pc_logistic', 'iw_clip_max': 2.5, 'iw_prob_clip': 0.01299815418022596, 'iw_n_components': 80, 'iw_logistic_c': 0.34768354696909787, 'iw_pca_fit': 'combined', 'iw_solver': 'lbfgs', 'iw_rho': 0.85}. Best is trial 163 with value: 0.23699875400639323.
2026-06-01 20:38:36 | INFO | Trial 218 | outer=6 | alpha=5.317e+04 n_pcs=4000 (pc_topk) weight={'name': 'pc_logistic', 'floor': 1e-06, 'clip_max': 1.5, 'prob_clip': 0.01622345798474752, 'n_components': 80, 'logistic_c': 0.2381039401685057, 'pca_fit': 'combined', 'solver': 'lbfgs', 'max_iter': 2000, 'fit_intercept': True, 'standardize_with_source': True, 'rho': 0.85}
[I 2026-06-01 20:39:02,649] Trial 218 finished with value: 0.23682630769568663 and parameters: {'alpha': 53170.84842830362, 'n_pcs': 4000, 'iw_method': 'pc_logistic', 'iw_clip_max': 1.5, 'iw_prob_clip': 0.01622345798474752, 'iw_n_components': 80, 'iw_logistic_c': 0.2381039401685057, 'iw_pca_fit': 'combined', 'iw_solver': 'lbfgs', 'iw_rho': 0.85}. Best is trial 163 with value: 0.23699875400639323.
2026-06-01 20:39:02 | INFO | Trial 219 | outer=6 | alpha=5.119e+04 n_pcs=4000 (pc_topk) weight={'name': 'pc_logistic', 'floor': 1e-06, 'clip_max': 1.5, 'prob_clip': 0.014212067219085188, 'n_components': 80, 'logistic_c': 0.23035421345317883, 'pca_fit': 'combined', 'solver': 'lbfgs', 'max_iter': 2000, 'fit_intercept': True, 'standardize_with_source': True, 'rho': 0.85}
[I 2026-06-01 20:39:29,338] Trial 219 finished with value: 0.2364817700846245 and parameters: {'alpha': 51189.16742671866, 'n_pcs': 4000, 'iw_method': 'pc_logistic', 'iw_clip_max': 1.5, 'iw_prob_clip': 0.014212067219085188, 'iw_n_components': 80, 'iw_logistic_c': 0.23035421345317883, 'iw_pca_fit': 'combined', 'iw_solver': 'lbfgs', 'iw_rho': 0.85}. Best is trial 163 with value: 0.23699875400639323.
2026-06-01 20:39:29 | INFO | Trial 220 | outer=6 | alpha=5.327e+04 n_pcs=4000 (pc_topk) weight={'name': 'pc_logistic', 'floor': 1e-06, 'clip_max': 1.5, 'prob_clip': 0.016644722640328347, 'n_components': 80, 'logistic_c': 0.33339214960905605, 'pca_fit': 'combined', 'solver': 'lbfgs', 'max_iter': 2000, 'fit_intercept': True, 'standardize_with_source': True, 'rho': 0.85}
[I 2026-06-01 20:39:55,740] Trial 220 finished with value: 0.23691854605439855 and parameters: {'alpha': 53270.966031992866, 'n_pcs': 4000, 'iw_method': 'pc_logistic', 'iw_clip_max': 1.5, 'iw_prob_clip': 0.016644722640328347, 'iw_n_components': 80, 'iw_logistic_c': 0.33339214960905605, 'iw_pca_fit': 'combined', 'iw_solver': 'lbfgs', 'iw_rho': 0.85}. Best is trial 163 with value: 0.23699875400639323.
2026-06-01 20:39:55 | INFO | Trial 221 | outer=6 | alpha=5.596e+04 n_pcs=4000 (pc_topk) weight={'name': 'pc_logistic', 'floor': 1e-06, 'clip_max': 1.5, 'prob_clip': 0.016419846172557304, 'n_components': 80, 'logistic_c': 0.3025961502036564, 'pca_fit': 'combined', 'solver': 'lbfgs', 'max_iter': 2000, 'fit_intercept': True, 'standardize_with_source': True, 'rho': 0.85}
[I 2026-06-01 20:40:21,888] Trial 221 finished with value: 0.23699902626348385 and parameters: {'alpha': 55956.275201693796, 'n_pcs': 4000, 'iw_method': 'pc_logistic', 'iw_clip_max': 1.5, 'iw_prob_clip': 0.016419846172557304, 'iw_n_components': 80, 'iw_logistic_c': 0.3025961502036564, 'iw_pca_fit': 'combined', 'iw_solver': 'lbfgs', 'iw_rho': 0.85}. Best is trial 221 with value: 0.23699902626348385.
2026-06-01 20:40:21 | INFO | Trial 222 | outer=6 | alpha=5.599e+04 n_pcs=4000 (pc_topk) weight={'name': 'pc_logistic', 'floor': 1e-06, 'clip_max': 1.5, 'prob_clip': 0.016148895326237537, 'n_components': 80, 'logistic_c': 0.33932219729534113, 'pca_fit': 'combined', 'solver': 'lbfgs', 'max_iter': 2000, 'fit_intercept': True, 'standardize_with_source': True, 'rho': 0.85}
[I 2026-06-01 20:40:48,299] Trial 222 finished with value: 0.23698957151481412 and parameters: {'alpha': 55990.35129637779, 'n_pcs': 4000, 'iw_method': 'pc_logistic', 'iw_clip_max': 1.5, 'iw_prob_clip': 0.016148895326237537, 'iw_n_components': 80, 'iw_logistic_c': 0.33932219729534113, 'iw_pca_fit': 'combined', 'iw_solver': 'lbfgs', 'iw_rho': 0.85}. Best is trial 221 with value: 0.23699902626348385.
2026-06-01 20:40:48 | INFO | Trial 223 | outer=6 | alpha=5.706e+04 n_pcs=4000 (pc_topk) weight={'name': 'pc_logistic', 'floor': 1e-06, 'clip_max': 1.5, 'prob_clip': 0.015959449343063432, 'n_components': 80, 'logistic_c': 0.34561732481429136, 'pca_fit': 'combined', 'solver': 'lbfgs', 'max_iter': 2000, 'fit_intercept': True, 'standardize_with_source': True, 'rho': 0.85}
[I 2026-06-01 20:41:14,545] Trial 223 finished with value: 0.23705194687121506 and parameters: {'alpha': 57060.76418723017, 'n_pcs': 4000, 'iw_method': 'pc_logistic', 'iw_clip_max': 1.5, 'iw_prob_clip': 0.015959449343063432, 'iw_n_components': 80, 'iw_logistic_c': 0.34561732481429136, 'iw_pca_fit': 'combined', 'iw_solver': 'lbfgs', 'iw_rho': 0.85}. Best is trial 223 with value: 0.23705194687121506.
2026-06-01 20:41:14 | INFO | Trial 224 | outer=6 | alpha=5.585e+04 n_pcs=4000 (pc_topk) weight={'name': 'pc_logistic', 'floor': 1e-06, 'clip_max': 1.5, 'prob_clip': 0.015986281078613572, 'n_components': 80, 'logistic_c': 0.33912140899483584, 'pca_fit': 'combined', 'solver': 'lbfgs', 'max_iter': 2000, 'fit_intercept': True, 'standardize_with_source': True, 'rho': 0.85}
[I 2026-06-01 20:41:35,879] Trial 224 finished with value: 0.2369872087571781 and parameters: {'alpha': 55851.31068107547, 'n_pcs': 4000, 'iw_method': 'pc_logistic', 'iw_clip_max': 1.5, 'iw_prob_clip': 0.015986281078613572, 'iw_n_components': 80, 'iw_logistic_c': 0.33912140899483584, 'iw_pca_fit': 'combined', 'iw_solver': 'lbfgs', 'iw_rho': 0.85}. Best is trial 223 with value: 0.23705194687121506.
2026-06-01 20:41:35 | INFO | Trial 225 | outer=6 | alpha=5.660e+04 n_pcs=4000 (pc_topk) weight={'name': 'pc_logistic', 'floor': 1e-06, 'clip_max': 1.5, 'prob_clip': 0.015891053536994625, 'n_components': 80, 'logistic_c': 0.34540332702642895, 'pca_fit': 'combined', 'solver': 'lbfgs', 'max_iter': 2000, 'fit_intercept': True, 'standardize_with_source': True, 'rho': 0.85}
[I 2026-06-01 20:42:00,070] Trial 225 finished with value: 0.2370235197558213 and parameters: {'alpha': 56597.357917701804, 'n_pcs': 4000, 'iw_method': 'pc_logistic', 'iw_clip_max': 1.5, 'iw_prob_clip': 0.015891053536994625, 'iw_n_components': 80, 'iw_logistic_c': 0.34540332702642895, 'iw_pca_fit': 'combined', 'iw_solver': 'lbfgs', 'iw_rho': 0.85}. Best is trial 223 with value: 0.23705194687121506.
2026-06-01 20:42:00 | INFO | Trial 226 | outer=6 | alpha=5.701e+04 n_pcs=4000 (pc_topk) weight={'name': 'pc_logistic', 'floor': 1e-06, 'clip_max': 1.5, 'prob_clip': 0.016173773875386502, 'n_components': 10, 'logistic_c': 0.3837195340728927, 'pca_fit': 'combined', 'solver': 'lbfgs', 'max_iter': 2000, 'fit_intercept': True, 'standardize_with_source': True, 'rho': 0.85}
[I 2026-06-01 20:42:17,027] Trial 226 finished with value: 0.23251902967326635 and parameters: {'alpha': 57014.306159712345, 'n_pcs': 4000, 'iw_method': 'pc_logistic', 'iw_clip_max': 1.5, 'iw_prob_clip': 0.016173773875386502, 'iw_n_components': 10, 'iw_logistic_c': 0.3837195340728927, 'iw_pca_fit': 'combined', 'iw_solver': 'lbfgs', 'iw_rho': 0.85}. Best is trial 223 with value: 0.23705194687121506.
2026-06-01 20:42:17 | INFO | Trial 227 | outer=6 | alpha=8.612e+04 n_pcs=4000 (pc_topk) weight={'name': 'pc_logistic', 'floor': 1e-06, 'clip_max': 1.5, 'prob_clip': 0.016185401303921643, 'n_components': 80, 'logistic_c': 0.355045845200987, 'pca_fit': 'combined', 'solver': 'lbfgs', 'max_iter': 2000, 'fit_intercept': True, 'standardize_with_source': True, 'rho': 0.85}
[I 2026-06-01 20:42:42,876] Trial 227 finished with value: 0.23685562151748685 and parameters: {'alpha': 86118.06724294668, 'n_pcs': 4000, 'iw_method': 'pc_logistic', 'iw_clip_max': 1.5, 'iw_prob_clip': 0.016185401303921643, 'iw_n_components': 80, 'iw_logistic_c': 0.355045845200987, 'iw_pca_fit': 'combined', 'iw_solver': 'lbfgs', 'iw_rho': 0.85}. Best is trial 223 with value: 0.23705194687121506.
2026-06-01 20:42:42 | INFO | Trial 228 | outer=6 | alpha=8.593e+04 n_pcs=4000 (pc_topk) weight={'name': 'pc_logistic', 'floor': 1e-06, 'clip_max': 4.0, 'prob_clip': 0.0163649163992173, 'n_components': 80, 'logistic_c': 0.358790552171547, 'pca_fit': 'combined', 'solver': 'lbfgs', 'max_iter': 2000, 'fit_intercept': True, 'standardize_with_source': True, 'rho': 0.85}
[I 2026-06-01 20:43:09,101] Trial 228 finished with value: 0.23191147164045703 and parameters: {'alpha': 85932.2964969218, 'n_pcs': 4000, 'iw_method': 'pc_logistic', 'iw_clip_max': 4.0, 'iw_prob_clip': 0.0163649163992173, 'iw_n_components': 80, 'iw_logistic_c': 0.358790552171547, 'iw_pca_fit': 'combined', 'iw_solver': 'lbfgs', 'iw_rho': 0.85}. Best is trial 223 with value: 0.23705194687121506.
2026-06-01 20:43:09 | INFO | Trial 229 | outer=6 | alpha=8.468e+04 n_pcs=4000 (pc_topk) weight={'name': 'pc_logistic', 'floor': 1e-06, 'clip_max': 1.5, 'prob_clip': 0.014682212540610813, 'n_components': 80, 'logistic_c': 0.32435969025342837, 'pca_fit': 'combined', 'solver': 'lbfgs', 'max_iter': 2000, 'fit_intercept': True, 'standardize_with_source': True, 'rho': 0.85}
[I 2026-06-01 20:43:36,242] Trial 229 finished with value: 0.23669425744453704 and parameters: {'alpha': 84675.30102008181, 'n_pcs': 4000, 'iw_method': 'pc_logistic', 'iw_clip_max': 1.5, 'iw_prob_clip': 0.014682212540610813, 'iw_n_components': 80, 'iw_logistic_c': 0.32435969025342837, 'iw_pca_fit': 'combined', 'iw_solver': 'lbfgs', 'iw_rho': 0.85}. Best is trial 223 with value: 0.23705194687121506.
2026-06-01 20:43:36 | INFO | Trial 230 | outer=6 | alpha=9.085e+04 n_pcs=4000 (pc_topk) weight={'name': 'pc_logistic', 'floor': 1e-06, 'clip_max': 1.5, 'prob_clip': 0.014609795406732259, 'n_components': 80, 'logistic_c': 0.3430188046573091, 'pca_fit': 'combined', 'solver': 'lbfgs', 'max_iter': 2000, 'fit_intercept': True, 'standardize_with_source': True, 'rho': 0.85}
[I 2026-06-01 20:44:01,885] Trial 230 finished with value: 0.23656774429711955 and parameters: {'alpha': 90852.28458877165, 'n_pcs': 4000, 'iw_method': 'pc_logistic', 'iw_clip_max': 1.5, 'iw_prob_clip': 0.014609795406732259, 'iw_n_components': 80, 'iw_logistic_c': 0.3430188046573091, 'iw_pca_fit': 'combined', 'iw_solver': 'lbfgs', 'iw_rho': 0.85}. Best is trial 223 with value: 0.23705194687121506.
2026-06-01 20:44:01 | INFO | Trial 231 | outer=6 | alpha=8.870e+04 n_pcs=4000 (pc_topk) weight={'name': 'pc_logistic', 'floor': 1e-06, 'clip_max': 1.5, 'prob_clip': 0.014754032469921323, 'n_components': 80, 'logistic_c': 0.34028610182144103, 'pca_fit': 'combined', 'solver': 'lbfgs', 'max_iter': 2000, 'fit_intercept': True, 'standardize_with_source': True, 'rho': 0.85}
[I 2026-06-01 20:44:28,778] Trial 231 finished with value: 0.23663151238060368 and parameters: {'alpha': 88704.21873234177, 'n_pcs': 4000, 'iw_method': 'pc_logistic', 'iw_clip_max': 1.5, 'iw_prob_clip': 0.014754032469921323, 'iw_n_components': 80, 'iw_logistic_c': 0.34028610182144103, 'iw_pca_fit': 'combined', 'iw_solver': 'lbfgs', 'iw_rho': 0.85}. Best is trial 223 with value: 0.23705194687121506.
2026-06-01 20:44:28 | INFO | Trial 232 | outer=6 | alpha=9.224e+04 n_pcs=4000 (pc_topk) weight={'name': 'pc_logistic', 'floor': 1e-06, 'clip_max': 1.5, 'prob_clip': 0.014658429725426378, 'n_components': 80, 'logistic_c': 0.5754712594186082, 'pca_fit': 'combined', 'solver': 'lbfgs', 'max_iter': 2000, 'fit_intercept': True, 'standardize_with_source': True, 'rho': 0.85}
[I 2026-06-01 20:44:57,846] Trial 232 finished with value: 0.2364715933333225 and parameters: {'alpha': 92244.04602939522, 'n_pcs': 4000, 'iw_method': 'pc_logistic', 'iw_clip_max': 1.5, 'iw_prob_clip': 0.014658429725426378, 'iw_n_components': 80, 'iw_logistic_c': 0.5754712594186082, 'iw_pca_fit': 'combined', 'iw_solver': 'lbfgs', 'iw_rho': 0.85}. Best is trial 223 with value: 0.23705194687121506.
2026-06-01 20:44:57 | INFO | Trial 233 | outer=6 | alpha=8.705e+04 n_pcs=4000 (pc_topk) weight={'name': 'pc_logistic', 'floor': 1e-06, 'clip_max': 1.5, 'prob_clip': 0.0149156991560576, 'n_components': 80, 'logistic_c': 0.5981566074694096, 'pca_fit': 'combined', 'solver': 'lbfgs', 'max_iter': 2000, 'fit_intercept': True, 'standardize_with_source': True, 'rho': 0.85}
[I 2026-06-01 20:45:24,748] Trial 233 finished with value: 0.23663879866626591 and parameters: {'alpha': 87046.24427751554, 'n_pcs': 4000, 'iw_method': 'pc_logistic', 'iw_clip_max': 1.5, 'iw_prob_clip': 0.0149156991560576, 'iw_n_components': 80, 'iw_logistic_c': 0.5981566074694096, 'iw_pca_fit': 'combined', 'iw_solver': 'lbfgs', 'iw_rho': 0.85}. Best is trial 223 with value: 0.23705194687121506.
2026-06-01 20:45:24 | INFO | Trial 234 | outer=6 | alpha=8.422e+04 n_pcs=4000 (pc_topk) weight={'name': 'pc_logistic', 'floor': 1e-06, 'clip_max': 1.5, 'prob_clip': 0.01523122227066132, 'n_components': 80, 'logistic_c': 0.5997143692544471, 'pca_fit': 'combined', 'solver': 'lbfgs', 'max_iter': 2000, 'fit_intercept': True, 'standardize_with_source': True, 'rho': 0.85}
