[I 2026-05-31 22:52:12,151] Trial 102 finished with value: 0.25967948008084585 and parameters: {'alpha': 191576.34180886258, 'n_pcs': 4500, 'weight_scheme': 'exponential', 'weight_clip_max': 3.0, 'weight_exponential_beta': 9.779063354264547}. Best is trial 88 with value: 0.2601238911726941.
2026-05-31 22:52:12 | INFO | src.nested_cv_avggrm_weighted_unified | Trial 103 | outer=1 | alpha=1.517e+05 n_pcs=4500 (pc_topk) weight_search=on
2026-05-31 22:52:12 | INFO | src.nested_cv_avggrm_weighted_unified | Trial 103 | outer=1 | weight={'name': 'exponential', 'floor': 1e-06, 'clip_max': 3.0, 'beta': 9.887834542485196}
[I 2026-05-31 22:52:19,100] Trial 103 finished with value: 0.2597946470505686 and parameters: {'alpha': 151747.5492196881, 'n_pcs': 4500, 'weight_scheme': 'exponential', 'weight_clip_max': 3.0, 'weight_exponential_beta': 9.887834542485196}. Best is trial 88 with value: 0.2601238911726941.
2026-05-31 22:52:19 | INFO | src.nested_cv_avggrm_weighted_unified | Trial 104 | outer=1 | alpha=1.380e+05 n_pcs=4500 (pc_topk) weight_search=on
2026-05-31 22:52:19 | INFO | src.nested_cv_avggrm_weighted_unified | Trial 104 | outer=1 | weight={'name': 'exponential', 'floor': 1e-06, 'clip_max': 3.0, 'beta': 9.958497735962412}
[I 2026-05-31 22:52:26,022] Trial 104 finished with value: 0.2596914174222834 and parameters: {'alpha': 138046.6284930177, 'n_pcs': 4500, 'weight_scheme': 'exponential', 'weight_clip_max': 3.0, 'weight_exponential_beta': 9.958497735962412}. Best is trial 88 with value: 0.2601238911726941.
2026-05-31 22:52:26 | INFO | src.nested_cv_avggrm_weighted_unified | Trial 105 | outer=1 | alpha=1.419e+05 n_pcs=5000 (pc_topk) weight_search=on
2026-05-31 22:52:26 | INFO | src.nested_cv_avggrm_weighted_unified | Trial 105 | outer=1 | weight={'name': 'exponential', 'floor': 1e-06, 'clip_max': 3.0, 'beta': 9.353211774602135}
[I 2026-05-31 22:52:34,148] Trial 105 finished with value: 0.2588355694870157 and parameters: {'alpha': 141941.40494068636, 'n_pcs': 5000, 'weight_scheme': 'exponential', 'weight_clip_max': 3.0, 'weight_exponential_beta': 9.353211774602135}. Best is trial 88 with value: 0.2601238911726941.
2026-05-31 22:52:34 | INFO | src.nested_cv_avggrm_weighted_unified | Trial 106 | outer=1 | alpha=1.503e+05 n_pcs=4500 (pc_topk) weight_search=on
2026-05-31 22:52:34 | INFO | src.nested_cv_avggrm_weighted_unified | Trial 106 | outer=1 | weight={'name': 'exponential', 'floor': 1e-06, 'clip_max': 3.0, 'beta': 9.872432155119435}
[I 2026-05-31 22:52:41,069] Trial 106 finished with value: 0.25980307389987073 and parameters: {'alpha': 150304.72615436983, 'n_pcs': 4500, 'weight_scheme': 'exponential', 'weight_clip_max': 3.0, 'weight_exponential_beta': 9.872432155119435}. Best is trial 88 with value: 0.2601238911726941.
2026-05-31 22:52:41 | INFO | src.nested_cv_avggrm_weighted_unified | Trial 107 | outer=1 | alpha=2.499e+05 n_pcs=4500 (pc_topk) weight_search=on
2026-05-31 22:52:41 | INFO | src.nested_cv_avggrm_weighted_unified | Trial 107 | outer=1 | weight={'name': 'exponential', 'floor': 1e-06, 'clip_max': 3.0, 'beta': 9.905636652104313}
[I 2026-05-31 22:52:47,987] Trial 107 finished with value: 0.2589893011264324 and parameters: {'alpha': 249943.49290597395, 'n_pcs': 4500, 'weight_scheme': 'exponential', 'weight_clip_max': 3.0, 'weight_exponential_beta': 9.905636652104313}. Best is trial 88 with value: 0.2601238911726941.
2026-05-31 22:52:47 | INFO | src.nested_cv_avggrm_weighted_unified | Trial 108 | outer=1 | alpha=1.509e+05 n_pcs=5000 (pc_topk) weight_search=on
2026-05-31 22:52:47 | INFO | src.nested_cv_avggrm_weighted_unified | Trial 108 | outer=1 | weight={'name': 'exponential', 'floor': 1e-06, 'clip_max': 3.0, 'beta': 9.14638019312418}
[I 2026-05-31 22:52:56,108] Trial 108 finished with value: 0.2587652856019874 and parameters: {'alpha': 150924.39963938782, 'n_pcs': 5000, 'weight_scheme': 'exponential', 'weight_clip_max': 3.0, 'weight_exponential_beta': 9.14638019312418}. Best is trial 88 with value: 0.2601238911726941.
2026-05-31 22:52:56 | INFO | src.nested_cv_avggrm_weighted_unified | Trial 109 | outer=1 | alpha=1.419e+05 n_pcs=4500 (pc_topk) weight_search=on
2026-05-31 22:52:56 | INFO | src.nested_cv_avggrm_weighted_unified | Trial 109 | outer=1 | weight={'name': 'exponential', 'floor': 1e-06, 'clip_max': 3.0, 'beta': 9.486295122904393}
[I 2026-05-31 22:53:03,024] Trial 109 finished with value: 0.25987947706829706 and parameters: {'alpha': 141940.4355721305, 'n_pcs': 4500, 'weight_scheme': 'exponential', 'weight_clip_max': 3.0, 'weight_exponential_beta': 9.486295122904393}. Best is trial 88 with value: 0.2601238911726941.
2026-05-31 22:53:03 | INFO | src.nested_cv_avggrm_weighted_unified | Trial 110 | outer=1 | alpha=7.790e+04 n_pcs=4500 (pc_topk) weight_search=on
2026-05-31 22:53:03 | INFO | src.nested_cv_avggrm_weighted_unified | Trial 110 | outer=1 | weight={'name': 'exponential', 'floor': 1e-06, 'clip_max': 3.0, 'beta': 9.38183216472625}
[I 2026-05-31 22:53:09,961] Trial 110 finished with value: 0.2582398181071929 and parameters: {'alpha': 77900.45786632683, 'n_pcs': 4500, 'weight_scheme': 'exponential', 'weight_clip_max': 3.0, 'weight_exponential_beta': 9.38183216472625}. Best is trial 88 with value: 0.2601238911726941.
2026-05-31 22:53:09 | INFO | src.nested_cv_avggrm_weighted_unified | Trial 111 | outer=1 | alpha=1.337e+05 n_pcs=4500 (pc_topk) weight_search=on
2026-05-31 22:53:09 | INFO | src.nested_cv_avggrm_weighted_unified | Trial 111 | outer=1 | weight={'name': 'exponential', 'floor': 1e-06, 'clip_max': 3.0, 'beta': 9.506916887862621}
[I 2026-05-31 22:53:16,888] Trial 111 finished with value: 0.25984006276564353 and parameters: {'alpha': 133684.16600562388, 'n_pcs': 4500, 'weight_scheme': 'exponential', 'weight_clip_max': 3.0, 'weight_exponential_beta': 9.506916887862621}. Best is trial 88 with value: 0.2601238911726941.
2026-05-31 22:53:16 | INFO | src.nested_cv_avggrm_weighted_unified | Trial 112 | outer=1 | alpha=1.302e+05 n_pcs=4500 (pc_topk) weight_search=on
2026-05-31 22:53:16 | INFO | src.nested_cv_avggrm_weighted_unified | Trial 112 | outer=1 | weight={'name': 'exponential', 'floor': 1e-06, 'clip_max': 3.0, 'beta': 8.941762776221903}
[I 2026-05-31 22:53:23,872] Trial 112 finished with value: 0.25967354857654795 and parameters: {'alpha': 130199.4194489255, 'n_pcs': 4500, 'weight_scheme': 'exponential', 'weight_clip_max': 3.0, 'weight_exponential_beta': 8.941762776221903}. Best is trial 88 with value: 0.2601238911726941.
2026-05-31 22:53:23 | INFO | src.nested_cv_avggrm_weighted_unified | Trial 113 | outer=1 | alpha=1.552e+05 n_pcs=4500 (pc_topk) weight_search=on
2026-05-31 22:53:23 | INFO | src.nested_cv_avggrm_weighted_unified | Trial 113 | outer=1 | weight={'name': 'exponential', 'floor': 1e-06, 'clip_max': 3.0, 'beta': 9.524372803217092}
[I 2026-05-31 22:53:30,769] Trial 113 finished with value: 0.2598927267319781 and parameters: {'alpha': 155224.85173737255, 'n_pcs': 4500, 'weight_scheme': 'exponential', 'weight_clip_max': 3.0, 'weight_exponential_beta': 9.524372803217092}. Best is trial 88 with value: 0.2601238911726941.
2026-05-31 22:53:30 | INFO | src.nested_cv_avggrm_weighted_unified | Trial 114 | outer=1 | alpha=3.551e+05 n_pcs=5000 (pc_topk) weight_search=on
2026-05-31 22:53:30 | INFO | src.nested_cv_avggrm_weighted_unified | Trial 114 | outer=1 | weight={'name': 'exponential', 'floor': 1e-06, 'clip_max': 3.0, 'beta': 9.993936309584663}
[I 2026-05-31 22:53:38,888] Trial 114 finished with value: 0.25652192509542704 and parameters: {'alpha': 355092.4202025763, 'n_pcs': 5000, 'weight_scheme': 'exponential', 'weight_clip_max': 3.0, 'weight_exponential_beta': 9.993936309584663}. Best is trial 88 with value: 0.2601238911726941.
2026-05-31 22:53:38 | INFO | src.nested_cv_avggrm_weighted_unified | Trial 115 | outer=1 | alpha=1.517e+05 n_pcs=4500 (pc_topk) weight_search=on
2026-05-31 22:53:38 | INFO | src.nested_cv_avggrm_weighted_unified | Trial 115 | outer=1 | weight={'name': 'exponential', 'floor': 1e-06, 'clip_max': 3.0, 'beta': 9.394604333530339}
[I 2026-05-31 22:53:45,818] Trial 115 finished with value: 0.2598826922267384 and parameters: {'alpha': 151730.09398724133, 'n_pcs': 4500, 'weight_scheme': 'exponential', 'weight_clip_max': 3.0, 'weight_exponential_beta': 9.394604333530339}. Best is trial 88 with value: 0.2601238911726941.
2026-05-31 22:53:45 | INFO | src.nested_cv_avggrm_weighted_unified | Trial 116 | outer=1 | alpha=1.578e+05 n_pcs=4500 (pc_topk) weight_search=on
2026-05-31 22:53:45 | INFO | src.nested_cv_avggrm_weighted_unified | Trial 116 | outer=1 | weight={'name': 'exponential', 'floor': 1e-06, 'clip_max': 3.0, 'beta': 9.508005351546904}
[I 2026-05-31 22:53:52,793] Trial 116 finished with value: 0.25988648022750493 and parameters: {'alpha': 157810.51012354525, 'n_pcs': 4500, 'weight_scheme': 'exponential', 'weight_clip_max': 3.0, 'weight_exponential_beta': 9.508005351546904}. Best is trial 88 with value: 0.2601238911726941.
2026-05-31 22:53:52 | INFO | src.nested_cv_avggrm_weighted_unified | Trial 117 | outer=1 | alpha=1.615e+05 n_pcs=4500 (pc_topk) weight_search=on
2026-05-31 22:53:52 | INFO | src.nested_cv_avggrm_weighted_unified | Trial 117 | outer=1 | weight={'name': 'exponential', 'floor': 1e-06, 'clip_max': 3.0, 'beta': 9.544504601874891}
[I 2026-05-31 22:53:59,720] Trial 117 finished with value: 0.2598811106876805 and parameters: {'alpha': 161481.4731403403, 'n_pcs': 4500, 'weight_scheme': 'exponential', 'weight_clip_max': 3.0, 'weight_exponential_beta': 9.544504601874891}. Best is trial 88 with value: 0.2601238911726941.
2026-05-31 22:53:59 | INFO | src.nested_cv_avggrm_weighted_unified | Trial 118 | outer=1 | alpha=2.637e+05 n_pcs=4500 (pc_topk) weight_search=on
2026-05-31 22:53:59 | INFO | src.nested_cv_avggrm_weighted_unified | Trial 118 | outer=1 | weight={'name': 'linear', 'floor': 1e-06, 'clip_max': 3.0, 'min_weight': 0.2874336527848576, 'max_weight': 1.1011976432972448}
2026-05-31 22:54:04 | INFO | src.nested_cv_avggrm_weighted_unified | Trial 118 | outer=1 | pruned after 7/10 inner folds (mean r=0.2796)
[I 2026-05-31 22:54:04,556] Trial 118 pruned. 
2026-05-31 22:54:04 | INFO | src.nested_cv_avggrm_weighted_unified | Trial 119 | outer=1 | alpha=1.454e+05 n_pcs=5000 (pc_topk) weight_search=on
2026-05-31 22:54:04 | INFO | src.nested_cv_avggrm_weighted_unified | Trial 119 | outer=1 | weight={'name': 'exponential', 'floor': 1e-06, 'clip_max': 3.0, 'beta': 9.550004493033606}
[I 2026-05-31 22:54:12,684] Trial 119 finished with value: 0.25886306289072886 and parameters: {'alpha': 145433.3169762744, 'n_pcs': 5000, 'weight_scheme': 'exponential', 'weight_clip_max': 3.0, 'weight_exponential_beta': 9.550004493033606}. Best is trial 88 with value: 0.2601238911726941.
2026-05-31 22:54:12 | INFO | src.nested_cv_avggrm_weighted_unified | Trial 120 | outer=1 | alpha=8.292e+04 n_pcs=4500 (pc_topk) weight_search=on
2026-05-31 22:54:12 | INFO | src.nested_cv_avggrm_weighted_unified | Trial 120 | outer=1 | weight={'name': 'uniform', 'floor': 1e-06, 'clip_max': 3.0}
2026-05-31 22:54:16 | INFO | src.nested_cv_avggrm_weighted_unified | Trial 120 | outer=1 | pruned after 7/10 inner folds (mean r=0.2714)
[I 2026-05-31 22:54:16,924] Trial 120 pruned. 
2026-05-31 22:54:16 | INFO | src.nested_cv_avggrm_weighted_unified | Trial 121 | outer=1 | alpha=1.715e+05 n_pcs=4500 (pc_topk) weight_search=on
2026-05-31 22:54:16 | INFO | src.nested_cv_avggrm_weighted_unified | Trial 121 | outer=1 | weight={'name': 'exponential', 'floor': 1e-06, 'clip_max': 3.0, 'beta': 9.18054298083752}
[I 2026-05-31 22:54:23,839] Trial 121 finished with value: 0.25972437641062407 and parameters: {'alpha': 171463.90185871354, 'n_pcs': 4500, 'weight_scheme': 'exponential', 'weight_clip_max': 3.0, 'weight_exponential_beta': 9.18054298083752}. Best is trial 88 with value: 0.2601238911726941.
2026-05-31 22:54:23 | INFO | src.nested_cv_avggrm_weighted_unified | Trial 122 | outer=1 | alpha=1.169e+05 n_pcs=4500 (pc_topk) weight_search=on
2026-05-31 22:54:23 | INFO | src.nested_cv_avggrm_weighted_unified | Trial 122 | outer=1 | weight={'name': 'exponential', 'floor': 1e-06, 'clip_max': 3.0, 'beta': 9.020699806719271}
[I 2026-05-31 22:54:30,769] Trial 122 finished with value: 0.2595669691987388 and parameters: {'alpha': 116917.73633998074, 'n_pcs': 4500, 'weight_scheme': 'exponential', 'weight_clip_max': 3.0, 'weight_exponential_beta': 9.020699806719271}. Best is trial 88 with value: 0.2601238911726941.
2026-05-31 22:54:30 | INFO | src.nested_cv_avggrm_weighted_unified | Trial 123 | outer=1 | alpha=2.388e+05 n_pcs=5000 (pc_topk) weight_search=on
2026-05-31 22:54:30 | INFO | src.nested_cv_avggrm_weighted_unified | Trial 123 | outer=1 | weight={'name': 'exponential', 'floor': 1e-06, 'clip_max': 3.0, 'beta': 9.50264303233918}
[I 2026-05-31 22:54:38,893] Trial 123 finished with value: 0.25816894668386786 and parameters: {'alpha': 238792.3464088706, 'n_pcs': 5000, 'weight_scheme': 'exponential', 'weight_clip_max': 3.0, 'weight_exponential_beta': 9.50264303233918}. Best is trial 88 with value: 0.2601238911726941.
2026-05-31 22:54:38 | INFO | src.nested_cv_avggrm_weighted_unified | Trial 124 | outer=1 | alpha=6.812e+04 n_pcs=4500 (pc_topk) weight_search=on
2026-05-31 22:54:38 | INFO | src.nested_cv_avggrm_weighted_unified | Trial 124 | outer=1 | weight={'name': 'exponential', 'floor': 1e-06, 'clip_max': 3.0, 'beta': 8.895829114492631}
[I 2026-05-31 22:54:45,806] Trial 124 finished with value: 0.2575577745675781 and parameters: {'alpha': 68117.11526608218, 'n_pcs': 4500, 'weight_scheme': 'exponential', 'weight_clip_max': 3.0, 'weight_exponential_beta': 8.895829114492631}. Best is trial 88 with value: 0.2601238911726941.
2026-05-31 22:54:45 | INFO | src.nested_cv_avggrm_weighted_unified | Trial 125 | outer=1 | alpha=1.618e+05 n_pcs=4500 (pc_topk) weight_search=on
2026-05-31 22:54:45 | INFO | src.nested_cv_avggrm_weighted_unified | Trial 125 | outer=1 | weight={'name': 'exponential', 'floor': 1e-06, 'clip_max': 3.0, 'beta': 8.367987384371824}
[I 2026-05-31 22:54:52,999] Trial 125 finished with value: 0.25935804817034996 and parameters: {'alpha': 161777.95009120365, 'n_pcs': 4500, 'weight_scheme': 'exponential', 'weight_clip_max': 3.0, 'weight_exponential_beta': 8.367987384371824}. Best is trial 88 with value: 0.2601238911726941.
2026-05-31 22:54:53 | INFO | src.nested_cv_avggrm_weighted_unified | Trial 126 | outer=1 | alpha=3.042e+05 n_pcs=4500 (pc_topk) weight_search=on
2026-05-31 22:54:53 | INFO | src.nested_cv_avggrm_weighted_unified | Trial 126 | outer=1 | weight={'name': 'exponential', 'floor': 1e-06, 'clip_max': 3.0, 'beta': 9.265698494850419}
[I 2026-05-31 22:54:59,915] Trial 126 finished with value: 0.2580951703326778 and parameters: {'alpha': 304222.67339471023, 'n_pcs': 4500, 'weight_scheme': 'exponential', 'weight_clip_max': 3.0, 'weight_exponential_beta': 9.265698494850419}. Best is trial 88 with value: 0.2601238911726941.
2026-05-31 22:54:59 | INFO | src.nested_cv_avggrm_weighted_unified | Trial 127 | outer=1 | alpha=1.154e+05 n_pcs=5000 (pc_topk) weight_search=on
2026-05-31 22:54:59 | INFO | src.nested_cv_avggrm_weighted_unified | Trial 127 | outer=1 | weight={'name': 'exponential', 'floor': 1e-06, 'clip_max': 3.0, 'beta': 9.523077929656123}
[I 2026-05-31 22:55:08,043] Trial 127 finished with value: 0.25859985165643595 and parameters: {'alpha': 115355.69921853881, 'n_pcs': 5000, 'weight_scheme': 'exponential', 'weight_clip_max': 3.0, 'weight_exponential_beta': 9.523077929656123}. Best is trial 88 with value: 0.2601238911726941.
2026-05-31 22:55:08 | INFO | src.nested_cv_avggrm_weighted_unified | Trial 128 | outer=1 | alpha=8.454e+04 n_pcs=4500 (pc_topk) weight_search=on
2026-05-31 22:55:08 | INFO | src.nested_cv_avggrm_weighted_unified | Trial 128 | outer=1 | weight={'name': 'exponential', 'floor': 1e-06, 'clip_max': 3.0, 'beta': 9.811290367466663}
[I 2026-05-31 22:55:15,030] Trial 128 finished with value: 0.2584398294801805 and parameters: {'alpha': 84538.56860155387, 'n_pcs': 4500, 'weight_scheme': 'exponential', 'weight_clip_max': 3.0, 'weight_exponential_beta': 9.811290367466663}. Best is trial 88 with value: 0.2601238911726941.
2026-05-31 22:55:15 | INFO | src.nested_cv_avggrm_weighted_unified | Trial 129 | outer=1 | alpha=4.266e+05 n_pcs=4500 (pc_topk) weight_search=on
2026-05-31 22:55:15 | INFO | src.nested_cv_avggrm_weighted_unified | Trial 129 | outer=1 | weight={'name': 'exponential', 'floor': 1e-06, 'clip_max': 3.0, 'beta': 3.2181716302133516}
2026-05-31 22:55:19 | INFO | src.nested_cv_avggrm_weighted_unified | Trial 129 | outer=1 | pruned after 7/10 inner folds (mean r=0.2840)
[I 2026-05-31 22:55:19,880] Trial 129 pruned. 
2026-05-31 22:55:19 | INFO | src.nested_cv_avggrm_weighted_unified | Trial 130 | outer=1 | alpha=1.507e+05 n_pcs=4500 (pc_topk) weight_search=on
2026-05-31 22:55:19 | INFO | src.nested_cv_avggrm_weighted_unified | Trial 130 | outer=1 | weight={'name': 'exponential', 'floor': 1e-06, 'clip_max': 3.0, 'beta': 8.783372697944717}
[I 2026-05-31 22:55:26,814] Trial 130 finished with value: 0.25964506899272516 and parameters: {'alpha': 150712.62091885222, 'n_pcs': 4500, 'weight_scheme': 'exponential', 'weight_clip_max': 3.0, 'weight_exponential_beta': 8.783372697944717}. Best is trial 88 with value: 0.2601238911726941.
2026-05-31 22:55:26 | INFO | src.nested_cv_avggrm_weighted_unified | Trial 131 | outer=1 | alpha=1.853e+05 n_pcs=4500 (pc_topk) weight_search=on
2026-05-31 22:55:26 | INFO | src.nested_cv_avggrm_weighted_unified | Trial 131 | outer=1 | weight={'name': 'exponential', 'floor': 1e-06, 'clip_max': 3.0, 'beta': 9.164060118364784}
[I 2026-05-31 22:55:33,746] Trial 131 finished with value: 0.2596055503604897 and parameters: {'alpha': 185265.86213132713, 'n_pcs': 4500, 'weight_scheme': 'exponential', 'weight_clip_max': 3.0, 'weight_exponential_beta': 9.164060118364784}. Best is trial 88 with value: 0.2601238911726941.
2026-05-31 22:55:33 | INFO | src.nested_cv_avggrm_weighted_unified | Trial 132 | outer=1 | alpha=1.555e+05 n_pcs=1500 (pc_topk) weight_search=on
2026-05-31 22:55:33 | INFO | src.nested_cv_avggrm_weighted_unified | Trial 132 | outer=1 | weight={'name': 'exponential', 'floor': 1e-06, 'clip_max': 3.0, 'beta': 9.187614684055776}
[I 2026-05-31 22:55:35,460] Trial 132 finished with value: 0.2519953392505262 and parameters: {'alpha': 155519.00439514258, 'n_pcs': 1500, 'weight_scheme': 'exponential', 'weight_clip_max': 3.0, 'weight_exponential_beta': 9.187614684055776}. Best is trial 88 with value: 0.2601238911726941.
2026-05-31 22:55:35 | INFO | src.nested_cv_avggrm_weighted_unified | Trial 133 | outer=1 | alpha=2.372e+05 n_pcs=4500 (pc_topk) weight_search=on
2026-05-31 22:55:35 | INFO | src.nested_cv_avggrm_weighted_unified | Trial 133 | outer=1 | weight={'name': 'exponential', 'floor': 1e-06, 'clip_max': 3.0, 'beta': 8.519360678133186}
[I 2026-05-31 22:55:42,386] Trial 133 finished with value: 0.2585202462916819 and parameters: {'alpha': 237211.0237773065, 'n_pcs': 4500, 'weight_scheme': 'exponential', 'weight_clip_max': 3.0, 'weight_exponential_beta': 8.519360678133186}. Best is trial 88 with value: 0.2601238911726941.
2026-05-31 22:55:42 | INFO | src.nested_cv_avggrm_weighted_unified | Trial 134 | outer=1 | alpha=1.220e+05 n_pcs=4500 (pc_topk) weight_search=on
2026-05-31 22:55:42 | INFO | src.nested_cv_avggrm_weighted_unified | Trial 134 | outer=1 | weight={'name': 'exponential', 'floor': 1e-06, 'clip_max': None, 'beta': 9.523755214209944}
[I 2026-05-31 22:55:49,342] Trial 134 finished with value: 0.23739475337587876 and parameters: {'alpha': 122040.14340251294, 'n_pcs': 4500, 'weight_scheme': 'exponential', 'weight_clip_max': None, 'weight_exponential_beta': 9.523755214209944}. Best is trial 88 with value: 0.2601238911726941.
2026-05-31 22:55:49 | INFO | src.nested_cv_avggrm_weighted_unified | Trial 135 | outer=1 | alpha=4.599e+03 n_pcs=5000 (pc_topk) weight_search=on
2026-05-31 22:55:49 | INFO | src.nested_cv_avggrm_weighted_unified | Trial 135 | outer=1 | weight={'name': 'exponential', 'floor': 1e-06, 'clip_max': 3.0, 'beta': 9.270051454621925}
[I 2026-05-31 22:55:57,495] Trial 135 finished with value: 0.21354760695272304 and parameters: {'alpha': 4599.2806817842675, 'n_pcs': 5000, 'weight_scheme': 'exponential', 'weight_clip_max': 3.0, 'weight_exponential_beta': 9.270051454621925}. Best is trial 88 with value: 0.2601238911726941.
2026-05-31 22:55:57 | INFO | src.nested_cv_avggrm_weighted_unified | Trial 136 | outer=1 | alpha=1.744e+05 n_pcs=4500 (pc_topk) weight_search=on
2026-05-31 22:55:57 | INFO | src.nested_cv_avggrm_weighted_unified | Trial 136 | outer=1 | weight={'name': 'exponential', 'floor': 1e-06, 'clip_max': 3.0, 'beta': 8.84442443292182}
[I 2026-05-31 22:56:04,423] Trial 136 finished with value: 0.2595313526142917 and parameters: {'alpha': 174393.02043625456, 'n_pcs': 4500, 'weight_scheme': 'exponential', 'weight_clip_max': 3.0, 'weight_exponential_beta': 8.84442443292182}. Best is trial 88 with value: 0.2601238911726941.
2026-05-31 22:56:04 | INFO | src.nested_cv_avggrm_weighted_unified | Trial 137 | outer=1 | alpha=1.069e+05 n_pcs=4500 (pc_topk) weight_search=on
2026-05-31 22:56:04 | INFO | src.nested_cv_avggrm_weighted_unified | Trial 137 | outer=1 | weight={'name': 'exponential', 'floor': 1e-06, 'clip_max': 10.0, 'beta': 9.644282548597404}
