[I 2026-06-01 22:43:24,162] Trial 107 finished with value: 0.222319831337581 and parameters: {'alpha': 52065.393026475795, 'n_pcs': 3000, 'iw_method': 'pc_logistic', 'iw_clip_max': 2.5, 'iw_prob_clip': 0.019071197588500476, 'iw_n_components': 100, 'iw_logistic_c': 0.00012990611517965488, 'iw_pca_fit': 'combined', 'iw_solver': 'lbfgs', 'iw_rho': 0.85}. Best is trial 92 with value: 0.22386962853002085.
2026-06-01 22:43:24 | INFO | Trial 108 | outer=8 | alpha=5.093e+04 n_pcs=4500 (pc_topk) weight={'name': 'pc_logistic', 'floor': 1e-06, 'clip_max': 2.5, 'prob_clip': 0.018920538529028964, 'n_components': 100, 'logistic_c': 0.00011968203018468946, 'pca_fit': 'combined', 'solver': 'lbfgs', 'max_iter': 2000, 'fit_intercept': True, 'standardize_with_source': True, 'rho': 0.85}
[I 2026-06-01 22:43:40,572] Trial 108 finished with value: 0.22594023894922968 and parameters: {'alpha': 50934.9675945677, 'n_pcs': 4500, 'iw_method': 'pc_logistic', 'iw_clip_max': 2.5, 'iw_prob_clip': 0.018920538529028964, 'iw_n_components': 100, 'iw_logistic_c': 0.00011968203018468946, 'iw_pca_fit': 'combined', 'iw_solver': 'lbfgs', 'iw_rho': 0.85}. Best is trial 108 with value: 0.22594023894922968.
2026-06-01 22:43:40 | INFO | Trial 109 | outer=8 | alpha=1.062e+05 n_pcs=2000 (pc_topk) weight={'name': 'pc_logistic', 'floor': 1e-06, 'clip_max': 2.5, 'prob_clip': 0.014989613868632836, 'n_components': 100, 'logistic_c': 6.180535295269395e-05, 'pca_fit': 'combined', 'solver': 'lbfgs', 'max_iter': 2000, 'fit_intercept': True, 'standardize_with_source': True, 'rho': 0.85}
[I 2026-06-01 22:43:49,944] Trial 109 finished with value: 0.21967628973890566 and parameters: {'alpha': 106186.22666174595, 'n_pcs': 2000, 'iw_method': 'pc_logistic', 'iw_clip_max': 2.5, 'iw_prob_clip': 0.014989613868632836, 'iw_n_components': 100, 'iw_logistic_c': 6.180535295269395e-05, 'iw_pca_fit': 'combined', 'iw_solver': 'lbfgs', 'iw_rho': 0.85}. Best is trial 108 with value: 0.22594023894922968.
2026-06-01 22:43:49 | INFO | Trial 110 | outer=8 | alpha=6.513e+04 n_pcs=3000 (pc_topk) weight={'name': 'pc_logistic', 'floor': 1e-06, 'clip_max': 2.5, 'prob_clip': 0.018807401352303313, 'n_components': 100, 'logistic_c': 0.00011938590919333208, 'pca_fit': 'combined', 'solver': 'lbfgs', 'max_iter': 2000, 'fit_intercept': True, 'standardize_with_source': True, 'rho': 0.85}
[I 2026-06-01 22:44:01,976] Trial 110 finished with value: 0.22349939367748 and parameters: {'alpha': 65132.35726885963, 'n_pcs': 3000, 'iw_method': 'pc_logistic', 'iw_clip_max': 2.5, 'iw_prob_clip': 0.018807401352303313, 'iw_n_components': 100, 'iw_logistic_c': 0.00011938590919333208, 'iw_pca_fit': 'combined', 'iw_solver': 'lbfgs', 'iw_rho': 0.85}. Best is trial 108 with value: 0.22594023894922968.
2026-06-01 22:44:01 | INFO | Trial 111 | outer=8 | alpha=5.243e+04 n_pcs=2500 (pc_topk) weight={'name': 'pc_logistic', 'floor': 1e-06, 'clip_max': 2.5, 'prob_clip': 0.020173428240758868, 'n_components': 100, 'logistic_c': 0.00012239636897498933, 'pca_fit': 'combined', 'solver': 'lbfgs', 'max_iter': 2000, 'fit_intercept': True, 'standardize_with_source': True, 'rho': 0.85}
[I 2026-06-01 22:44:13,392] Trial 111 finished with value: 0.2192060051218175 and parameters: {'alpha': 52434.910581224845, 'n_pcs': 2500, 'iw_method': 'pc_logistic', 'iw_clip_max': 2.5, 'iw_prob_clip': 0.020173428240758868, 'iw_n_components': 100, 'iw_logistic_c': 0.00012239636897498933, 'iw_pca_fit': 'combined', 'iw_solver': 'lbfgs', 'iw_rho': 0.85}. Best is trial 108 with value: 0.22594023894922968.
2026-06-01 22:44:13 | INFO | Trial 112 | outer=8 | alpha=6.570e+04 n_pcs=3000 (pc_topk) weight={'name': 'pc_logistic', 'floor': 1e-06, 'clip_max': 2.5, 'prob_clip': 0.01821747399056793, 'n_components': 100, 'logistic_c': 0.00022163127459806872, 'pca_fit': 'combined', 'solver': 'lbfgs', 'max_iter': 2000, 'fit_intercept': True, 'standardize_with_source': True, 'rho': 0.85}
[I 2026-06-01 22:44:26,402] Trial 112 finished with value: 0.22293531887066012 and parameters: {'alpha': 65703.78293976151, 'n_pcs': 3000, 'iw_method': 'pc_logistic', 'iw_clip_max': 2.5, 'iw_prob_clip': 0.01821747399056793, 'iw_n_components': 100, 'iw_logistic_c': 0.00022163127459806872, 'iw_pca_fit': 'combined', 'iw_solver': 'lbfgs', 'iw_rho': 0.85}. Best is trial 108 with value: 0.22594023894922968.
2026-06-01 22:44:26 | INFO | Trial 113 | outer=8 | alpha=6.613e+04 n_pcs=3000 (pc_topk) weight={'name': 'pc_logistic', 'floor': 1e-06, 'clip_max': 2.5, 'prob_clip': 0.02326541491609127, 'n_components': 100, 'logistic_c': 0.00023940405892932044, 'pca_fit': 'combined', 'solver': 'lbfgs', 'max_iter': 2000, 'fit_intercept': True, 'standardize_with_source': True, 'rho': 0.85}
[I 2026-06-01 22:44:38,912] Trial 113 finished with value: 0.22319948710657928 and parameters: {'alpha': 66131.591045033, 'n_pcs': 3000, 'iw_method': 'pc_logistic', 'iw_clip_max': 2.5, 'iw_prob_clip': 0.02326541491609127, 'iw_n_components': 100, 'iw_logistic_c': 0.00023940405892932044, 'iw_pca_fit': 'combined', 'iw_solver': 'lbfgs', 'iw_rho': 0.85}. Best is trial 108 with value: 0.22594023894922968.
2026-06-01 22:44:38 | INFO | Trial 114 | outer=8 | alpha=6.553e+04 n_pcs=3000 (pc_topk) weight={'name': 'pc_logistic', 'floor': 1e-06, 'clip_max': 2.5, 'prob_clip': 0.01674124646319867, 'n_components': 100, 'logistic_c': 0.00029159529351070165, 'pca_fit': 'combined', 'solver': 'lbfgs', 'max_iter': 2000, 'fit_intercept': True, 'standardize_with_source': True, 'rho': 0.85}
[I 2026-06-01 22:44:49,716] Trial 114 finished with value: 0.22244673139577711 and parameters: {'alpha': 65531.28812452077, 'n_pcs': 3000, 'iw_method': 'pc_logistic', 'iw_clip_max': 2.5, 'iw_prob_clip': 0.01674124646319867, 'iw_n_components': 100, 'iw_logistic_c': 0.00029159529351070165, 'iw_pca_fit': 'combined', 'iw_solver': 'lbfgs', 'iw_rho': 0.85}. Best is trial 108 with value: 0.22594023894922968.
2026-06-01 22:44:49 | INFO | Trial 115 | outer=8 | alpha=1.271e+05 n_pcs=3000 (pc_topk) weight={'name': 'pc_logistic', 'floor': 1e-06, 'clip_max': 4.0, 'prob_clip': 0.017587444031979652, 'n_components': 100, 'logistic_c': 0.0002966731873266542, 'pca_fit': 'combined', 'solver': 'lbfgs', 'max_iter': 2000, 'fit_intercept': True, 'standardize_with_source': True, 'rho': 0.85}
[I 2026-06-01 22:45:02,888] Trial 115 finished with value: 0.2217537112161084 and parameters: {'alpha': 127120.50045074207, 'n_pcs': 3000, 'iw_method': 'pc_logistic', 'iw_clip_max': 4.0, 'iw_prob_clip': 0.017587444031979652, 'iw_n_components': 100, 'iw_logistic_c': 0.0002966731873266542, 'iw_pca_fit': 'combined', 'iw_solver': 'lbfgs', 'iw_rho': 0.85}. Best is trial 108 with value: 0.22594023894922968.
2026-06-01 22:45:02 | INFO | Trial 116 | outer=8 | alpha=6.552e+04 n_pcs=3000 (pc_topk) weight={'name': 'pc_logistic', 'floor': 1e-06, 'clip_max': 12.0, 'prob_clip': 0.01386663321412335, 'n_components': 60, 'logistic_c': 0.00021227802260771368, 'pca_fit': 'combined', 'solver': 'lbfgs', 'max_iter': 2000, 'fit_intercept': True, 'standardize_with_source': True, 'rho': 0.85}
[I 2026-06-01 22:45:15,374] Trial 116 finished with value: 0.20571181891044935 and parameters: {'alpha': 65523.46512869452, 'n_pcs': 3000, 'iw_method': 'pc_logistic', 'iw_clip_max': 12.0, 'iw_prob_clip': 0.01386663321412335, 'iw_n_components': 60, 'iw_logistic_c': 0.00021227802260771368, 'iw_pca_fit': 'combined', 'iw_solver': 'lbfgs', 'iw_rho': 0.85}. Best is trial 108 with value: 0.22594023894922968.
2026-06-01 22:45:15 | INFO | Trial 117 | outer=8 | alpha=8.774e+04 n_pcs=3000 (pc_topk) weight={'name': 'pc_logistic', 'floor': 1e-06, 'clip_max': 2.5, 'prob_clip': 0.006386124043981671, 'n_components': 100, 'logistic_c': 4.3092663389398814e-05, 'pca_fit': 'combined', 'solver': 'lbfgs', 'max_iter': 2000, 'fit_intercept': True, 'standardize_with_source': True, 'rho': 0.85}
[I 2026-06-01 22:45:25,728] Trial 117 finished with value: 0.22045967670817115 and parameters: {'alpha': 87741.60974555819, 'n_pcs': 3000, 'iw_method': 'pc_logistic', 'iw_clip_max': 2.5, 'iw_prob_clip': 0.006386124043981671, 'iw_n_components': 100, 'iw_logistic_c': 4.3092663389398814e-05, 'iw_pca_fit': 'combined', 'iw_solver': 'lbfgs', 'iw_rho': 0.85}. Best is trial 108 with value: 0.22594023894922968.
2026-06-01 22:45:25 | INFO | Trial 118 | outer=8 | alpha=1.033e+05 n_pcs=2500 (pc_topk) weight={'name': 'pc_logistic', 'floor': 1e-06, 'clip_max': 2.5, 'prob_clip': 0.002160512794700063, 'n_components': 10, 'logistic_c': 0.00016768664115378385, 'pca_fit': 'combined', 'solver': 'lbfgs', 'max_iter': 2000, 'fit_intercept': True, 'standardize_with_source': True, 'rho': 0.85}
[I 2026-06-01 22:45:36,231] Trial 118 finished with value: 0.2152327344014487 and parameters: {'alpha': 103290.10343618257, 'n_pcs': 2500, 'iw_method': 'pc_logistic', 'iw_clip_max': 2.5, 'iw_prob_clip': 0.002160512794700063, 'iw_n_components': 10, 'iw_logistic_c': 0.00016768664115378385, 'iw_pca_fit': 'combined', 'iw_solver': 'lbfgs', 'iw_rho': 0.85}. Best is trial 108 with value: 0.22594023894922968.
2026-06-01 22:45:36 | INFO | Trial 119 | outer=8 | alpha=6.514e+04 n_pcs=3000 (pc_topk) weight={'name': 'pc_logistic', 'floor': 1e-06, 'clip_max': 2.5, 'prob_clip': 0.023045426978982833, 'n_components': 80, 'logistic_c': 9.487439754528261e-05, 'pca_fit': 'combined', 'solver': 'lbfgs', 'max_iter': 2000, 'fit_intercept': True, 'standardize_with_source': True, 'rho': 0.85}
[I 2026-06-01 22:45:47,331] Trial 119 finished with value: 0.22210984746641915 and parameters: {'alpha': 65136.12232916908, 'n_pcs': 3000, 'iw_method': 'pc_logistic', 'iw_clip_max': 2.5, 'iw_prob_clip': 0.023045426978982833, 'iw_n_components': 80, 'iw_logistic_c': 9.487439754528261e-05, 'iw_pca_fit': 'combined', 'iw_solver': 'lbfgs', 'iw_rho': 0.85}. Best is trial 108 with value: 0.22594023894922968.
2026-06-01 22:45:47 | INFO | Trial 120 | outer=8 | alpha=3.990e+04 n_pcs=3000 (pc_topk) weight={'name': 'pc_logistic', 'floor': 1e-06, 'clip_max': 2.5, 'prob_clip': 0.016197320602450133, 'n_components': 100, 'logistic_c': 0.0003589128707200628, 'pca_fit': 'combined', 'solver': 'lbfgs', 'max_iter': 2000, 'fit_intercept': True, 'standardize_with_source': True, 'rho': 0.85}
[I 2026-06-01 22:46:00,518] Trial 120 finished with value: 0.21890533312519608 and parameters: {'alpha': 39900.66650713335, 'n_pcs': 3000, 'iw_method': 'pc_logistic', 'iw_clip_max': 2.5, 'iw_prob_clip': 0.016197320602450133, 'iw_n_components': 100, 'iw_logistic_c': 0.0003589128707200628, 'iw_pca_fit': 'combined', 'iw_solver': 'lbfgs', 'iw_rho': 0.85}. Best is trial 108 with value: 0.22594023894922968.
2026-06-01 22:46:00 | INFO | Trial 121 | outer=8 | alpha=4.718e+04 n_pcs=3000 (pc_topk) weight={'name': 'pc_logistic', 'floor': 1e-06, 'clip_max': 2.5, 'prob_clip': 0.025916872269587988, 'n_components': 100, 'logistic_c': 0.001245775143984379, 'pca_fit': 'combined', 'solver': 'lbfgs', 'max_iter': 2000, 'fit_intercept': True, 'standardize_with_source': True, 'rho': 0.85}
[I 2026-06-01 22:46:14,730] Trial 121 finished with value: 0.21880618421850156 and parameters: {'alpha': 47180.78764953682, 'n_pcs': 3000, 'iw_method': 'pc_logistic', 'iw_clip_max': 2.5, 'iw_prob_clip': 0.025916872269587988, 'iw_n_components': 100, 'iw_logistic_c': 0.001245775143984379, 'iw_pca_fit': 'combined', 'iw_solver': 'lbfgs', 'iw_rho': 0.85}. Best is trial 108 with value: 0.22594023894922968.
2026-06-01 22:46:14 | INFO | Trial 122 | outer=8 | alpha=6.687e+04 n_pcs=3500 (pc_topk) weight={'name': 'pc_logistic', 'floor': 1e-06, 'clip_max': 2.5, 'prob_clip': 0.01925305141627547, 'n_components': 100, 'logistic_c': 0.00022415623721151173, 'pca_fit': 'combined', 'solver': 'lbfgs', 'max_iter': 2000, 'fit_intercept': True, 'standardize_with_source': True, 'rho': 0.85}
[I 2026-06-01 22:46:26,717] Trial 122 finished with value: 0.22317324698649924 and parameters: {'alpha': 66872.81472068158, 'n_pcs': 3500, 'iw_method': 'pc_logistic', 'iw_clip_max': 2.5, 'iw_prob_clip': 0.01925305141627547, 'iw_n_components': 100, 'iw_logistic_c': 0.00022415623721151173, 'iw_pca_fit': 'combined', 'iw_solver': 'lbfgs', 'iw_rho': 0.85}. Best is trial 108 with value: 0.22594023894922968.
2026-06-01 22:46:26 | INFO | Trial 123 | outer=8 | alpha=6.822e+04 n_pcs=3000 (pc_topk) weight={'name': 'pc_logistic', 'floor': 1e-06, 'clip_max': 1.5, 'prob_clip': 0.018784985603923714, 'n_components': 100, 'logistic_c': 0.00023356055013314426, 'pca_fit': 'combined', 'solver': 'lbfgs', 'max_iter': 2000, 'fit_intercept': True, 'standardize_with_source': True, 'rho': 0.85}
[I 2026-06-01 22:46:38,720] Trial 123 finished with value: 0.2190029304813325 and parameters: {'alpha': 68217.68642765033, 'n_pcs': 3000, 'iw_method': 'pc_logistic', 'iw_clip_max': 1.5, 'iw_prob_clip': 0.018784985603923714, 'iw_n_components': 100, 'iw_logistic_c': 0.00023356055013314426, 'iw_pca_fit': 'combined', 'iw_solver': 'lbfgs', 'iw_rho': 0.85}. Best is trial 108 with value: 0.22594023894922968.
2026-06-01 22:46:38 | INFO | Trial 124 | outer=8 | alpha=5.950e+04 n_pcs=3500 (pc_topk) weight={'name': 'pc_logistic', 'floor': 1e-06, 'clip_max': 2.5, 'prob_clip': 0.012247422674581076, 'n_components': 100, 'logistic_c': 0.0003776208513974383, 'pca_fit': 'combined', 'solver': 'lbfgs', 'max_iter': 2000, 'fit_intercept': True, 'standardize_with_source': True, 'rho': 0.85}
[I 2026-06-01 22:46:52,686] Trial 124 finished with value: 0.22107188961802265 and parameters: {'alpha': 59497.003018391966, 'n_pcs': 3500, 'iw_method': 'pc_logistic', 'iw_clip_max': 2.5, 'iw_prob_clip': 0.012247422674581076, 'iw_n_components': 100, 'iw_logistic_c': 0.0003776208513974383, 'iw_pca_fit': 'combined', 'iw_solver': 'lbfgs', 'iw_rho': 0.85}. Best is trial 108 with value: 0.22594023894922968.
2026-06-01 22:46:52 | INFO | Trial 125 | outer=8 | alpha=8.724e+04 n_pcs=2500 (pc_topk) weight={'name': 'uniform'}
[I 2026-06-01 22:46:57,260] Trial 125 finished with value: 0.2093763570007614 and parameters: {'alpha': 87240.88636554398, 'n_pcs': 2500, 'iw_method': 'uniform'}. Best is trial 108 with value: 0.22594023894922968.
2026-06-01 22:46:57 | INFO | Trial 126 | outer=8 | alpha=4.733e+06 n_pcs=3000 (pc_topk) weight={'name': 'pc_logistic', 'floor': 1e-06, 'clip_max': 2.5, 'prob_clip': 0.0008013091114785738, 'n_components': 100, 'logistic_c': 0.00015398742186440876, 'pca_fit': 'combined', 'solver': 'lbfgs', 'max_iter': 2000, 'fit_intercept': True, 'standardize_with_source': True, 'rho': 0.85}
[I 2026-06-01 22:47:08,843] Trial 126 finished with value: 0.19995086477677634 and parameters: {'alpha': 4733165.094163896, 'n_pcs': 3000, 'iw_method': 'pc_logistic', 'iw_clip_max': 2.5, 'iw_prob_clip': 0.0008013091114785738, 'iw_n_components': 100, 'iw_logistic_c': 0.00015398742186440876, 'iw_pca_fit': 'combined', 'iw_solver': 'lbfgs', 'iw_rho': 0.85}. Best is trial 108 with value: 0.22594023894922968.
2026-06-01 22:47:08 | INFO | Trial 127 | outer=8 | alpha=3.997e+04 n_pcs=3500 (pc_topk) weight={'name': 'pc_logistic', 'floor': 1e-06, 'clip_max': 2.5, 'prob_clip': 0.014425483616819102, 'n_components': 100, 'logistic_c': 2.1692805387478593e-05, 'pca_fit': 'combined', 'solver': 'lbfgs', 'max_iter': 2000, 'fit_intercept': True, 'standardize_with_source': True, 'rho': 0.85}
[I 2026-06-01 22:47:20,622] Trial 127 finished with value: 0.21825580530261038 and parameters: {'alpha': 39967.43655536703, 'n_pcs': 3500, 'iw_method': 'pc_logistic', 'iw_clip_max': 2.5, 'iw_prob_clip': 0.014425483616819102, 'iw_n_components': 100, 'iw_logistic_c': 2.1692805387478593e-05, 'iw_pca_fit': 'combined', 'iw_solver': 'lbfgs', 'iw_rho': 0.85}. Best is trial 108 with value: 0.22594023894922968.
2026-06-01 22:47:20 | INFO | Trial 128 | outer=8 | alpha=1.787e+03 n_pcs=3000 (pc_topk) weight={'name': 'pc_logistic', 'floor': 1e-06, 'clip_max': 2.5, 'prob_clip': 0.017387428867811663, 'n_components': 100, 'logistic_c': 9.177488211106761e-05, 'pca_fit': 'combined', 'solver': 'lbfgs', 'max_iter': 2000, 'fit_intercept': True, 'standardize_with_source': True, 'rho': 0.85}
[I 2026-06-01 22:47:31,689] Trial 128 finished with value: 0.12961865287463428 and parameters: {'alpha': 1787.1039932134142, 'n_pcs': 3000, 'iw_method': 'pc_logistic', 'iw_clip_max': 2.5, 'iw_prob_clip': 0.017387428867811663, 'iw_n_components': 100, 'iw_logistic_c': 9.177488211106761e-05, 'iw_pca_fit': 'combined', 'iw_solver': 'lbfgs', 'iw_rho': 0.85}. Best is trial 108 with value: 0.22594023894922968.
2026-06-01 22:47:31 | INFO | Trial 129 | outer=8 | alpha=1.092e+05 n_pcs=2500 (pc_topk) weight={'name': 'pc_logistic', 'floor': 1e-06, 'clip_max': 2.5, 'prob_clip': 0.030005601134507932, 'n_components': 100, 'logistic_c': 4.7121131764739593e-05, 'pca_fit': 'combined', 'solver': 'lbfgs', 'max_iter': 2000, 'fit_intercept': True, 'standardize_with_source': True, 'rho': 0.85}
[I 2026-06-01 22:47:42,060] Trial 129 finished with value: 0.2223422607532962 and parameters: {'alpha': 109242.83473003072, 'n_pcs': 2500, 'iw_method': 'pc_logistic', 'iw_clip_max': 2.5, 'iw_prob_clip': 0.030005601134507932, 'iw_n_components': 100, 'iw_logistic_c': 4.7121131764739593e-05, 'iw_pca_fit': 'combined', 'iw_solver': 'lbfgs', 'iw_rho': 0.85}. Best is trial 108 with value: 0.22594023894922968.
2026-06-01 22:47:42 | INFO | Trial 130 | outer=8 | alpha=1.712e+05 n_pcs=3500 (pc_topk) weight={'name': 'pc_logistic', 'floor': 1e-06, 'clip_max': 2.5, 'prob_clip': 0.01938787216593958, 'n_components': 100, 'logistic_c': 0.0006306048918715995, 'pca_fit': 'combined', 'solver': 'lbfgs', 'max_iter': 2000, 'fit_intercept': True, 'standardize_with_source': True, 'rho': 0.5}
[I 2026-06-01 22:47:56,712] Trial 130 finished with value: 0.21858264590822415 and parameters: {'alpha': 171196.33042150596, 'n_pcs': 3500, 'iw_method': 'pc_logistic', 'iw_clip_max': 2.5, 'iw_prob_clip': 0.01938787216593958, 'iw_n_components': 100, 'iw_logistic_c': 0.0006306048918715995, 'iw_pca_fit': 'combined', 'iw_solver': 'lbfgs', 'iw_rho': 0.5}. Best is trial 108 with value: 0.22594023894922968.
2026-06-01 22:47:56 | INFO | Trial 131 | outer=8 | alpha=4.824e+04 n_pcs=3500 (pc_topk) weight={'name': 'pc_logistic', 'floor': 1e-06, 'clip_max': 2.5, 'prob_clip': 0.023308472166695512, 'n_components': 100, 'logistic_c': 0.0002597245434297674, 'pca_fit': 'combined', 'solver': 'lbfgs', 'max_iter': 2000, 'fit_intercept': True, 'standardize_with_source': True, 'rho': 0.85}
[I 2026-06-01 22:48:10,743] Trial 131 finished with value: 0.2222862420914896 and parameters: {'alpha': 48238.39276029263, 'n_pcs': 3500, 'iw_method': 'pc_logistic', 'iw_clip_max': 2.5, 'iw_prob_clip': 0.023308472166695512, 'iw_n_components': 100, 'iw_logistic_c': 0.0002597245434297674, 'iw_pca_fit': 'combined', 'iw_solver': 'lbfgs', 'iw_rho': 0.85}. Best is trial 108 with value: 0.22594023894922968.
2026-06-01 22:48:10 | INFO | Trial 132 | outer=8 | alpha=7.366e+04 n_pcs=4500 (pc_topk) weight={'name': 'pc_logistic', 'floor': 1e-06, 'clip_max': 2.5, 'prob_clip': 0.021362028454452377, 'n_components': 100, 'logistic_c': 0.0004237092279321613, 'pca_fit': 'combined', 'solver': 'lbfgs', 'max_iter': 2000, 'fit_intercept': True, 'standardize_with_source': True, 'rho': 0.85}
[I 2026-06-01 22:48:28,419] Trial 132 finished with value: 0.22414521190510253 and parameters: {'alpha': 73659.83978999109, 'n_pcs': 4500, 'iw_method': 'pc_logistic', 'iw_clip_max': 2.5, 'iw_prob_clip': 0.021362028454452377, 'iw_n_components': 100, 'iw_logistic_c': 0.0004237092279321613, 'iw_pca_fit': 'combined', 'iw_solver': 'lbfgs', 'iw_rho': 0.85}. Best is trial 108 with value: 0.22594023894922968.
2026-06-01 22:48:28 | INFO | Trial 133 | outer=8 | alpha=7.125e+04 n_pcs=4500 (pc_topk) weight={'name': 'pc_logistic', 'floor': 1e-06, 'clip_max': 2.5, 'prob_clip': 0.02707082571960126, 'n_components': 100, 'logistic_c': 0.0004273156148382178, 'pca_fit': 'combined', 'solver': 'lbfgs', 'max_iter': 2000, 'fit_intercept': True, 'standardize_with_source': True, 'rho': 0.85}
[I 2026-06-01 22:48:45,468] Trial 133 finished with value: 0.2244262062237578 and parameters: {'alpha': 71253.22564797138, 'n_pcs': 4500, 'iw_method': 'pc_logistic', 'iw_clip_max': 2.5, 'iw_prob_clip': 0.02707082571960126, 'iw_n_components': 100, 'iw_logistic_c': 0.0004273156148382178, 'iw_pca_fit': 'combined', 'iw_solver': 'lbfgs', 'iw_rho': 0.85}. Best is trial 108 with value: 0.22594023894922968.
2026-06-01 22:48:45 | INFO | Trial 134 | outer=8 | alpha=7.994e+04 n_pcs=4500 (pc_topk) weight={'name': 'pc_logistic', 'floor': 1e-06, 'clip_max': 2.5, 'prob_clip': 0.02717773723694639, 'n_components': 100, 'logistic_c': 0.0004517824215389755, 'pca_fit': 'combined', 'solver': 'lbfgs', 'max_iter': 2000, 'fit_intercept': True, 'standardize_with_source': True, 'rho': 0.85}
[I 2026-06-01 22:49:03,240] Trial 134 finished with value: 0.22396325377424034 and parameters: {'alpha': 79936.82767545321, 'n_pcs': 4500, 'iw_method': 'pc_logistic', 'iw_clip_max': 2.5, 'iw_prob_clip': 0.02717773723694639, 'iw_n_components': 100, 'iw_logistic_c': 0.0004517824215389755, 'iw_pca_fit': 'combined', 'iw_solver': 'lbfgs', 'iw_rho': 0.85}. Best is trial 108 with value: 0.22594023894922968.
2026-06-01 22:49:03 | INFO | Trial 135 | outer=8 | alpha=9.389e+04 n_pcs=4500 (pc_topk) weight={'name': 'pc_logistic', 'floor': 1e-06, 'clip_max': 2.5, 'prob_clip': 0.022938898954428837, 'n_components': 100, 'logistic_c': 0.0016926872166811685, 'pca_fit': 'combined', 'solver': 'lbfgs', 'max_iter': 2000, 'fit_intercept': True, 'standardize_with_source': True, 'rho': 0.85}
