[I 2026-06-01 13:16:21,901] Trial 61 finished with value: 0.247095452626008 and parameters: {'alpha': 122863.73449984095, 'n_pcs': 2000, 'iw_method': 'pc_logistic', 'iw_clip_max': 4.0, 'iw_prob_clip': 0.01819462559337623, 'iw_n_components': 80, 'iw_logistic_c': 0.00028722409299716085, 'iw_pca_fit': 'combined', 'iw_solver': 'lbfgs', 'iw_rho': 0.7}. Best is trial 33 with value: 0.25137294449925773.
2026-06-01 13:16:21 | INFO | Trial 62 | outer=1 | alpha=8.787e+04 n_pcs=2000 (pc_topk) weight={'name': 'pc_logistic', 'floor': 1e-06, 'clip_max': 4.0, 'prob_clip': 0.009896600443983094, 'n_components': 80, 'logistic_c': 0.00014430159627862608, 'pca_fit': 'combined', 'solver': 'lbfgs', 'max_iter': 2000, 'fit_intercept': True, 'standardize_with_source': True, 'rho': 0.7}
[I 2026-06-01 13:16:31,689] Trial 62 finished with value: 0.24956565479028123 and parameters: {'alpha': 87867.0145905561, 'n_pcs': 2000, 'iw_method': 'pc_logistic', 'iw_clip_max': 4.0, 'iw_prob_clip': 0.009896600443983094, 'iw_n_components': 80, 'iw_logistic_c': 0.00014430159627862608, 'iw_pca_fit': 'combined', 'iw_solver': 'lbfgs', 'iw_rho': 0.7}. Best is trial 33 with value: 0.25137294449925773.
2026-06-01 13:16:31 | INFO | Trial 63 | outer=1 | alpha=1.519e+05 n_pcs=2500 (pc_topk) weight={'name': 'pc_logistic', 'floor': 1e-06, 'clip_max': 4.0, 'prob_clip': 0.007788735645802139, 'n_components': 80, 'logistic_c': 0.0010876621084105233, 'pca_fit': 'combined', 'solver': 'lbfgs', 'max_iter': 2000, 'fit_intercept': True, 'standardize_with_source': True, 'rho': 0.7}
[I 2026-06-01 13:16:47,375] Trial 63 finished with value: 0.2475124657225442 and parameters: {'alpha': 151876.77245087636, 'n_pcs': 2500, 'iw_method': 'pc_logistic', 'iw_clip_max': 4.0, 'iw_prob_clip': 0.007788735645802139, 'iw_n_components': 80, 'iw_logistic_c': 0.0010876621084105233, 'iw_pca_fit': 'combined', 'iw_solver': 'lbfgs', 'iw_rho': 0.7}. Best is trial 33 with value: 0.25137294449925773.
2026-06-01 13:16:47 | INFO | Trial 64 | outer=1 | alpha=2.319e+05 n_pcs=1500 (pc_topk) weight={'name': 'pc_logistic', 'floor': 1e-06, 'clip_max': 4.0, 'prob_clip': 0.007093629871804629, 'n_components': 80, 'logistic_c': 3.5928376332182646e-05, 'pca_fit': 'combined', 'solver': 'lbfgs', 'max_iter': 2000, 'fit_intercept': True, 'standardize_with_source': True, 'rho': 0.7}
[I 2026-06-01 13:16:55,040] Trial 64 finished with value: 0.2435459158267713 and parameters: {'alpha': 231852.41362280014, 'n_pcs': 1500, 'iw_method': 'pc_logistic', 'iw_clip_max': 4.0, 'iw_prob_clip': 0.007093629871804629, 'iw_n_components': 80, 'iw_logistic_c': 3.5928376332182646e-05, 'iw_pca_fit': 'combined', 'iw_solver': 'lbfgs', 'iw_rho': 0.7}. Best is trial 33 with value: 0.25137294449925773.
2026-06-01 13:16:55 | INFO | Trial 65 | outer=1 | alpha=4.874e+04 n_pcs=2000 (pc_topk) weight={'name': 'pc_logistic', 'floor': 1e-06, 'clip_max': 7.0, 'prob_clip': 0.004767924660509511, 'n_components': 100, 'logistic_c': 8.300072551559009e-06, 'pca_fit': 'combined', 'solver': 'lbfgs', 'max_iter': 2000, 'fit_intercept': True, 'standardize_with_source': True, 'rho': 0.7}
[I 2026-06-01 13:17:03,912] Trial 65 finished with value: 0.24195688432214899 and parameters: {'alpha': 48735.596769532, 'n_pcs': 2000, 'iw_method': 'pc_logistic', 'iw_clip_max': 7.0, 'iw_prob_clip': 0.004767924660509511, 'iw_n_components': 100, 'iw_logistic_c': 8.300072551559009e-06, 'iw_pca_fit': 'combined', 'iw_solver': 'lbfgs', 'iw_rho': 0.7}. Best is trial 33 with value: 0.25137294449925773.
2026-06-01 13:17:03 | INFO | Trial 66 | outer=1 | alpha=3.603e+05 n_pcs=2500 (pc_topk) weight={'name': 'pc_logistic', 'floor': 1e-06, 'clip_max': 2.5, 'prob_clip': 0.009100942144498837, 'n_components': 10, 'logistic_c': 0.00010833207111947415, 'pca_fit': 'combined', 'solver': 'lbfgs', 'max_iter': 2000, 'fit_intercept': True, 'standardize_with_source': True, 'rho': 0.7}
[I 2026-06-01 13:17:13,856] Trial 66 finished with value: 0.24372095025555424 and parameters: {'alpha': 360301.26972171554, 'n_pcs': 2500, 'iw_method': 'pc_logistic', 'iw_clip_max': 2.5, 'iw_prob_clip': 0.009100942144498837, 'iw_n_components': 10, 'iw_logistic_c': 0.00010833207111947415, 'iw_pca_fit': 'combined', 'iw_solver': 'lbfgs', 'iw_rho': 0.7}. Best is trial 33 with value: 0.25137294449925773.
2026-06-01 13:17:13 | INFO | Trial 67 | outer=1 | alpha=8.107e+04 n_pcs=3000 (pc_topk) weight={'name': 'pc_logistic', 'floor': 1e-06, 'clip_max': 4.0, 'prob_clip': 0.011980747146435778, 'n_components': 40, 'logistic_c': 1.1449115142508929e-07, 'pca_fit': 'combined', 'solver': 'lbfgs', 'max_iter': 2000, 'fit_intercept': True, 'standardize_with_source': True, 'rho': 0.7}
[I 2026-06-01 13:17:23,607] Trial 67 finished with value: 0.23913866954123947 and parameters: {'alpha': 81072.21736146923, 'n_pcs': 3000, 'iw_method': 'pc_logistic', 'iw_clip_max': 4.0, 'iw_prob_clip': 0.011980747146435778, 'iw_n_components': 40, 'iw_logistic_c': 1.1449115142508929e-07, 'iw_pca_fit': 'combined', 'iw_solver': 'lbfgs', 'iw_rho': 0.7}. Best is trial 33 with value: 0.25137294449925773.
2026-06-01 13:17:23 | INFO | Trial 68 | outer=1 | alpha=3.248e+04 n_pcs=2000 (pc_topk) weight={'name': 'pc_logistic', 'floor': 1e-06, 'clip_max': 1.5, 'prob_clip': 0.020055039709847955, 'n_components': 100, 'logistic_c': 0.0005505386857292586, 'pca_fit': 'combined', 'solver': 'lbfgs', 'max_iter': 2000, 'fit_intercept': True, 'standardize_with_source': True, 'rho': 0.85}
[I 2026-06-01 13:17:35,998] Trial 68 finished with value: 0.2377052247831682 and parameters: {'alpha': 32479.58051142291, 'n_pcs': 2000, 'iw_method': 'pc_logistic', 'iw_clip_max': 1.5, 'iw_prob_clip': 0.020055039709847955, 'iw_n_components': 100, 'iw_logistic_c': 0.0005505386857292586, 'iw_pca_fit': 'combined', 'iw_solver': 'lbfgs', 'iw_rho': 0.85}. Best is trial 33 with value: 0.25137294449925773.
2026-06-01 13:17:36 | INFO | Trial 69 | outer=1 | alpha=1.156e+05 n_pcs=1500 (pc_topk) weight={'name': 'pc_logistic', 'floor': 1e-06, 'clip_max': 4.0, 'prob_clip': 0.027672250421258, 'n_components': 80, 'logistic_c': 1.87837165287784e-05, 'pca_fit': 'combined', 'solver': 'lbfgs', 'max_iter': 2000, 'fit_intercept': True, 'standardize_with_source': True, 'rho': 0.7}
[I 2026-06-01 13:17:43,550] Trial 69 finished with value: 0.2407711846482754 and parameters: {'alpha': 115634.90239925371, 'n_pcs': 1500, 'iw_method': 'pc_logistic', 'iw_clip_max': 4.0, 'iw_prob_clip': 0.027672250421258, 'iw_n_components': 80, 'iw_logistic_c': 1.87837165287784e-05, 'iw_pca_fit': 'combined', 'iw_solver': 'lbfgs', 'iw_rho': 0.7}. Best is trial 33 with value: 0.25137294449925773.
2026-06-01 13:17:43 | INFO | Trial 70 | outer=1 | alpha=1.947e+05 n_pcs=2500 (pc_topk) weight={'name': 'pc_logistic', 'floor': 1e-06, 'clip_max': 2.5, 'prob_clip': 0.015654527162164006, 'n_components': 40, 'logistic_c': 4.595476546964435e-05, 'pca_fit': 'combined', 'solver': 'lbfgs', 'max_iter': 2000, 'fit_intercept': True, 'standardize_with_source': True, 'rho': 0.3}
[I 2026-06-01 13:17:53,196] Trial 70 finished with value: 0.24254629847773113 and parameters: {'alpha': 194691.55943633174, 'n_pcs': 2500, 'iw_method': 'pc_logistic', 'iw_clip_max': 2.5, 'iw_prob_clip': 0.015654527162164006, 'iw_n_components': 40, 'iw_logistic_c': 4.595476546964435e-05, 'iw_pca_fit': 'combined', 'iw_solver': 'lbfgs', 'iw_rho': 0.3}. Best is trial 33 with value: 0.25137294449925773.
2026-06-01 13:17:53 | INFO | Trial 71 | outer=1 | alpha=9.173e+04 n_pcs=2000 (pc_topk) weight={'name': 'pc_logistic', 'floor': 1e-06, 'clip_max': 4.0, 'prob_clip': 0.009724208519523105, 'n_components': 80, 'logistic_c': 0.000178049196724926, 'pca_fit': 'combined', 'solver': 'lbfgs', 'max_iter': 2000, 'fit_intercept': True, 'standardize_with_source': True, 'rho': 0.7}
[I 2026-06-01 13:18:04,215] Trial 71 finished with value: 0.24959724478446757 and parameters: {'alpha': 91732.94433584821, 'n_pcs': 2000, 'iw_method': 'pc_logistic', 'iw_clip_max': 4.0, 'iw_prob_clip': 0.009724208519523105, 'iw_n_components': 80, 'iw_logistic_c': 0.000178049196724926, 'iw_pca_fit': 'combined', 'iw_solver': 'lbfgs', 'iw_rho': 0.7}. Best is trial 33 with value: 0.25137294449925773.
2026-06-01 13:18:04 | INFO | Trial 72 | outer=1 | alpha=1.424e+05 n_pcs=2000 (pc_topk) weight={'name': 'pc_logistic', 'floor': 1e-06, 'clip_max': 4.0, 'prob_clip': 0.011711143532145503, 'n_components': 80, 'logistic_c': 0.0002892996392487908, 'pca_fit': 'combined', 'solver': 'lbfgs', 'max_iter': 2000, 'fit_intercept': True, 'standardize_with_source': True, 'rho': 0.7}
[I 2026-06-01 13:18:15,152] Trial 72 finished with value: 0.24881267503708285 and parameters: {'alpha': 142354.59927705664, 'n_pcs': 2000, 'iw_method': 'pc_logistic', 'iw_clip_max': 4.0, 'iw_prob_clip': 0.011711143532145503, 'iw_n_components': 80, 'iw_logistic_c': 0.0002892996392487908, 'iw_pca_fit': 'combined', 'iw_solver': 'lbfgs', 'iw_rho': 0.7}. Best is trial 33 with value: 0.25137294449925773.
2026-06-01 13:18:15 | INFO | Trial 73 | outer=1 | alpha=6.640e+04 n_pcs=2000 (pc_topk) weight={'name': 'pc_logistic', 'floor': 1e-06, 'clip_max': 4.0, 'prob_clip': 0.007013315061508024, 'n_components': 80, 'logistic_c': 0.00011611909731794949, 'pca_fit': 'combined', 'solver': 'lbfgs', 'max_iter': 2000, 'fit_intercept': True, 'standardize_with_source': True, 'rho': 0.7}
[I 2026-06-01 13:18:25,438] Trial 73 finished with value: 0.24776814309738787 and parameters: {'alpha': 66397.46713684053, 'n_pcs': 2000, 'iw_method': 'pc_logistic', 'iw_clip_max': 4.0, 'iw_prob_clip': 0.007013315061508024, 'iw_n_components': 80, 'iw_logistic_c': 0.00011611909731794949, 'iw_pca_fit': 'combined', 'iw_solver': 'lbfgs', 'iw_rho': 0.7}. Best is trial 33 with value: 0.25137294449925773.
2026-06-01 13:18:25 | INFO | Trial 74 | outer=1 | alpha=1.050e+05 n_pcs=1500 (pc_topk) weight={'name': 'pc_logistic', 'floor': 1e-06, 'clip_max': 4.0, 'prob_clip': 0.009126515829242187, 'n_components': 100, 'logistic_c': 6.998448515436755e-05, 'pca_fit': 'combined', 'solver': 'lbfgs', 'max_iter': 2000, 'fit_intercept': True, 'standardize_with_source': True, 'rho': 0.7}
[I 2026-06-01 13:18:33,599] Trial 74 finished with value: 0.24573733008822846 and parameters: {'alpha': 105003.14936196448, 'n_pcs': 1500, 'iw_method': 'pc_logistic', 'iw_clip_max': 4.0, 'iw_prob_clip': 0.009126515829242187, 'iw_n_components': 100, 'iw_logistic_c': 6.998448515436755e-05, 'iw_pca_fit': 'combined', 'iw_solver': 'lbfgs', 'iw_rho': 0.7}. Best is trial 33 with value: 0.25137294449925773.
2026-06-01 13:18:33 | INFO | Trial 75 | outer=1 | alpha=4.857e+04 n_pcs=2000 (pc_topk) weight={'name': 'pc_logistic', 'floor': 1e-06, 'clip_max': 4.0, 'prob_clip': 0.005404481678950455, 'n_components': 80, 'logistic_c': 0.00024765077658059543, 'pca_fit': 'combined', 'solver': 'lbfgs', 'max_iter': 2000, 'fit_intercept': True, 'standardize_with_source': True, 'rho': 0.7}
[I 2026-06-01 13:18:43,894] Trial 75 finished with value: 0.2433527511200607 and parameters: {'alpha': 48570.744238946754, 'n_pcs': 2000, 'iw_method': 'pc_logistic', 'iw_clip_max': 4.0, 'iw_prob_clip': 0.005404481678950455, 'iw_n_components': 80, 'iw_logistic_c': 0.00024765077658059543, 'iw_pca_fit': 'combined', 'iw_solver': 'lbfgs', 'iw_rho': 0.7}. Best is trial 33 with value: 0.25137294449925773.
2026-06-01 13:18:43 | INFO | Trial 76 | outer=1 | alpha=1.786e+05 n_pcs=2500 (pc_topk) weight={'name': 'uniform'}
[I 2026-06-01 13:18:47,941] Trial 76 finished with value: 0.23164370196017642 and parameters: {'alpha': 178612.84251138582, 'n_pcs': 2500, 'iw_method': 'uniform'}. Best is trial 33 with value: 0.25137294449925773.
2026-06-01 13:18:47 | INFO | Trial 77 | outer=1 | alpha=1.302e+04 n_pcs=1500 (pc_topk) weight={'name': 'pc_logistic', 'floor': 1e-06, 'clip_max': 12.0, 'prob_clip': 0.013313732517446655, 'n_components': 100, 'logistic_c': 0.0012785416856563934, 'pca_fit': 'combined', 'solver': 'lbfgs', 'max_iter': 2000, 'fit_intercept': True, 'standardize_with_source': True, 'rho': 0.5}
[I 2026-06-01 13:18:59,401] Trial 77 finished with value: 0.21119488864954422 and parameters: {'alpha': 13018.104932854581, 'n_pcs': 1500, 'iw_method': 'pc_logistic', 'iw_clip_max': 12.0, 'iw_prob_clip': 0.013313732517446655, 'iw_n_components': 100, 'iw_logistic_c': 0.0012785416856563934, 'iw_pca_fit': 'combined', 'iw_solver': 'lbfgs', 'iw_rho': 0.5}. Best is trial 33 with value: 0.25137294449925773.
2026-06-01 13:18:59 | INFO | Trial 78 | outer=1 | alpha=3.369e+05 n_pcs=2000 (pc_topk) weight={'name': 'pc_logistic', 'floor': 1e-06, 'clip_max': 4.0, 'prob_clip': 0.00324908383055222, 'n_components': 40, 'logistic_c': 0.008456947590931352, 'pca_fit': 'combined', 'solver': 'lbfgs', 'max_iter': 2000, 'fit_intercept': True, 'standardize_with_source': True, 'rho': 0.7}
[I 2026-06-01 13:19:12,715] Trial 78 finished with value: 0.24306547142408003 and parameters: {'alpha': 336911.13349516265, 'n_pcs': 2000, 'iw_method': 'pc_logistic', 'iw_clip_max': 4.0, 'iw_prob_clip': 0.00324908383055222, 'iw_n_components': 40, 'iw_logistic_c': 0.008456947590931352, 'iw_pca_fit': 'combined', 'iw_solver': 'lbfgs', 'iw_rho': 0.7}. Best is trial 33 with value: 0.25137294449925773.
2026-06-01 13:19:12 | INFO | Trial 79 | outer=1 | alpha=8.390e+04 n_pcs=3500 (pc_topk) weight={'name': 'pc_logistic', 'floor': 1e-06, 'clip_max': 4.0, 'prob_clip': 0.004637150128914821, 'n_components': 100, 'logistic_c': 0.001992716345684664, 'pca_fit': 'combined', 'solver': 'lbfgs', 'max_iter': 2000, 'fit_intercept': True, 'standardize_with_source': True, 'rho': 0.7}
[I 2026-06-01 13:19:32,193] Trial 79 finished with value: 0.2504016819466834 and parameters: {'alpha': 83895.03852816008, 'n_pcs': 3500, 'iw_method': 'pc_logistic', 'iw_clip_max': 4.0, 'iw_prob_clip': 0.004637150128914821, 'iw_n_components': 100, 'iw_logistic_c': 0.001992716345684664, 'iw_pca_fit': 'combined', 'iw_solver': 'lbfgs', 'iw_rho': 0.7}. Best is trial 33 with value: 0.25137294449925773.
2026-06-01 13:19:32 | INFO | Trial 80 | outer=1 | alpha=1.197e+03 n_pcs=3500 (pc_topk) weight={'name': 'pc_logistic', 'floor': 1e-06, 'clip_max': 2.5, 'prob_clip': 0.0025748514458051575, 'n_components': 100, 'logistic_c': 0.002802806208466303, 'pca_fit': 'combined', 'solver': 'lbfgs', 'max_iter': 2000, 'fit_intercept': True, 'standardize_with_source': True, 'rho': 0.85}
[I 2026-06-01 13:19:51,344] Trial 80 finished with value: 0.1220107647655088 and parameters: {'alpha': 1197.132962100518, 'n_pcs': 3500, 'iw_method': 'pc_logistic', 'iw_clip_max': 2.5, 'iw_prob_clip': 0.0025748514458051575, 'iw_n_components': 100, 'iw_logistic_c': 0.002802806208466303, 'iw_pca_fit': 'combined', 'iw_solver': 'lbfgs', 'iw_rho': 0.85}. Best is trial 33 with value: 0.25137294449925773.
2026-06-01 13:19:51 | INFO | Trial 81 | outer=1 | alpha=8.377e+04 n_pcs=4000 (pc_topk) weight={'name': 'pc_logistic', 'floor': 1e-06, 'clip_max': 4.0, 'prob_clip': 0.004618547192768236, 'n_components': 100, 'logistic_c': 0.0005669595726694535, 'pca_fit': 'combined', 'solver': 'lbfgs', 'max_iter': 2000, 'fit_intercept': True, 'standardize_with_source': True, 'rho': 0.7}
[I 2026-06-01 13:20:09,134] Trial 81 finished with value: 0.25357534381681857 and parameters: {'alpha': 83767.54954670998, 'n_pcs': 4000, 'iw_method': 'pc_logistic', 'iw_clip_max': 4.0, 'iw_prob_clip': 0.004618547192768236, 'iw_n_components': 100, 'iw_logistic_c': 0.0005669595726694535, 'iw_pca_fit': 'combined', 'iw_solver': 'lbfgs', 'iw_rho': 0.7}. Best is trial 81 with value: 0.25357534381681857.
2026-06-01 13:20:09 | INFO | Trial 82 | outer=1 | alpha=7.237e+04 n_pcs=4000 (pc_topk) weight={'name': 'pc_logistic', 'floor': 1e-06, 'clip_max': 4.0, 'prob_clip': 0.004541547587110404, 'n_components': 100, 'logistic_c': 0.00048093764843236295, 'pca_fit': 'combined', 'solver': 'lbfgs', 'max_iter': 2000, 'fit_intercept': True, 'standardize_with_source': True, 'rho': 0.7}
[I 2026-06-01 13:20:26,236] Trial 82 finished with value: 0.2535545157379987 and parameters: {'alpha': 72371.28581726637, 'n_pcs': 4000, 'iw_method': 'pc_logistic', 'iw_clip_max': 4.0, 'iw_prob_clip': 0.004541547587110404, 'iw_n_components': 100, 'iw_logistic_c': 0.00048093764843236295, 'iw_pca_fit': 'combined', 'iw_solver': 'lbfgs', 'iw_rho': 0.7}. Best is trial 81 with value: 0.25357534381681857.
2026-06-01 13:20:26 | INFO | Trial 83 | outer=1 | alpha=7.285e+04 n_pcs=4000 (pc_topk) weight={'name': 'pc_logistic', 'floor': 1e-06, 'clip_max': 4.0, 'prob_clip': 0.004553971649900359, 'n_components': 100, 'logistic_c': 0.001824742641543396, 'pca_fit': 'combined', 'solver': 'lbfgs', 'max_iter': 2000, 'fit_intercept': True, 'standardize_with_source': True, 'rho': 0.7}
[I 2026-06-01 13:20:46,838] Trial 83 finished with value: 0.2518879173761397 and parameters: {'alpha': 72846.27632211805, 'n_pcs': 4000, 'iw_method': 'pc_logistic', 'iw_clip_max': 4.0, 'iw_prob_clip': 0.004553971649900359, 'iw_n_components': 100, 'iw_logistic_c': 0.001824742641543396, 'iw_pca_fit': 'combined', 'iw_solver': 'lbfgs', 'iw_rho': 0.7}. Best is trial 81 with value: 0.25357534381681857.
2026-06-01 13:20:46 | INFO | Trial 84 | outer=1 | alpha=7.427e+04 n_pcs=4000 (pc_topk) weight={'name': 'pc_logistic', 'floor': 1e-06, 'clip_max': 4.0, 'prob_clip': 0.0044927644767590365, 'n_components': 100, 'logistic_c': 0.005843812559967763, 'pca_fit': 'combined', 'solver': 'lbfgs', 'max_iter': 2000, 'fit_intercept': True, 'standardize_with_source': True, 'rho': 0.7}
[I 2026-06-01 13:21:10,537] Trial 84 finished with value: 0.250878382884395 and parameters: {'alpha': 74273.30567943121, 'n_pcs': 4000, 'iw_method': 'pc_logistic', 'iw_clip_max': 4.0, 'iw_prob_clip': 0.0044927644767590365, 'iw_n_components': 100, 'iw_logistic_c': 0.005843812559967763, 'iw_pca_fit': 'combined', 'iw_solver': 'lbfgs', 'iw_rho': 0.7}. Best is trial 81 with value: 0.25357534381681857.
2026-06-01 13:21:10 | INFO | Trial 85 | outer=1 | alpha=7.343e+04 n_pcs=4000 (pc_topk) weight={'name': 'pc_logistic', 'floor': 1e-06, 'clip_max': 4.0, 'prob_clip': 0.0045575413786965386, 'n_components': 100, 'logistic_c': 0.006553542502267498, 'pca_fit': 'combined', 'solver': 'lbfgs', 'max_iter': 2000, 'fit_intercept': True, 'standardize_with_source': True, 'rho': 0.7}
[I 2026-06-01 13:21:32,470] Trial 85 finished with value: 0.2508959725581183 and parameters: {'alpha': 73429.53297304007, 'n_pcs': 4000, 'iw_method': 'pc_logistic', 'iw_clip_max': 4.0, 'iw_prob_clip': 0.0045575413786965386, 'iw_n_components': 100, 'iw_logistic_c': 0.006553542502267498, 'iw_pca_fit': 'combined', 'iw_solver': 'lbfgs', 'iw_rho': 0.7}. Best is trial 81 with value: 0.25357534381681857.
2026-06-01 13:21:32 | INFO | Trial 86 | outer=1 | alpha=3.533e+04 n_pcs=4000 (pc_topk) weight={'name': 'pc_logistic', 'floor': 1e-06, 'clip_max': 4.0, 'prob_clip': 0.0036947724154630032, 'n_components': 100, 'logistic_c': 0.003697387681389459, 'pca_fit': 'combined', 'solver': 'lbfgs', 'max_iter': 2000, 'fit_intercept': True, 'standardize_with_source': True, 'rho': 1.0}
[I 2026-06-01 13:21:52,322] Trial 86 finished with value: 0.24028285372499156 and parameters: {'alpha': 35333.4264839636, 'n_pcs': 4000, 'iw_method': 'pc_logistic', 'iw_clip_max': 4.0, 'iw_prob_clip': 0.0036947724154630032, 'iw_n_components': 100, 'iw_logistic_c': 0.003697387681389459, 'iw_pca_fit': 'combined', 'iw_solver': 'lbfgs', 'iw_rho': 1.0}. Best is trial 81 with value: 0.25357534381681857.
2026-06-01 13:21:52 | INFO | Trial 87 | outer=1 | alpha=6.940e+04 n_pcs=4500 (pc_topk) weight={'name': 'pc_logistic', 'floor': 1e-06, 'clip_max': 4.0, 'prob_clip': 0.0041497704608031705, 'n_components': 100, 'logistic_c': 0.03374626418100614, 'pca_fit': 'combined', 'solver': 'lbfgs', 'max_iter': 2000, 'fit_intercept': True, 'standardize_with_source': True, 'rho': 0.7}
[I 2026-06-01 13:22:19,592] Trial 87 finished with value: 0.25088021960109685 and parameters: {'alpha': 69397.98819570425, 'n_pcs': 4500, 'iw_method': 'pc_logistic', 'iw_clip_max': 4.0, 'iw_prob_clip': 0.0041497704608031705, 'iw_n_components': 100, 'iw_logistic_c': 0.03374626418100614, 'iw_pca_fit': 'combined', 'iw_solver': 'lbfgs', 'iw_rho': 0.7}. Best is trial 81 with value: 0.25357534381681857.
2026-06-01 13:22:19 | INFO | Trial 88 | outer=1 | alpha=6.389e+04 n_pcs=4500 (pc_topk) weight={'name': 'pc_logistic', 'floor': 1e-06, 'clip_max': 4.0, 'prob_clip': 0.002825995010935512, 'n_components': 100, 'logistic_c': 0.030995772481367673, 'pca_fit': 'combined', 'solver': 'lbfgs', 'max_iter': 2000, 'fit_intercept': True, 'standardize_with_source': True, 'rho': 0.7}
[I 2026-06-01 13:22:50,848] Trial 88 finished with value: 0.25075463573761697 and parameters: {'alpha': 63886.469149359684, 'n_pcs': 4500, 'iw_method': 'pc_logistic', 'iw_clip_max': 4.0, 'iw_prob_clip': 0.002825995010935512, 'iw_n_components': 100, 'iw_logistic_c': 0.030995772481367673, 'iw_pca_fit': 'combined', 'iw_solver': 'lbfgs', 'iw_rho': 0.7}. Best is trial 81 with value: 0.25357534381681857.
2026-06-01 13:22:50 | INFO | Trial 89 | outer=1 | alpha=1.906e+04 n_pcs=4000 (pc_topk) weight={'name': 'uniform'}
[I 2026-06-01 13:22:57,877] Trial 89 finished with value: 0.2412263100978663 and parameters: {'alpha': 19057.87690875678, 'n_pcs': 4000, 'iw_method': 'uniform'}. Best is trial 81 with value: 0.25357534381681857.
2026-06-01 13:22:57 | INFO | Trial 90 | outer=1 | alpha=4.312e+04 n_pcs=4000 (pc_topk) weight={'name': 'pc_logistic', 'floor': 1e-06, 'clip_max': 4.0, 'prob_clip': 0.0034004593683511974, 'n_components': 100, 'logistic_c': 0.08121274358342116, 'pca_fit': 'combined', 'solver': 'lbfgs', 'max_iter': 2000, 'fit_intercept': True, 'standardize_with_source': True, 'rho': 0.7}
