[I 2026-06-01 19:24:15,760] Trial 233 finished with value: 0.2584728052289166 and parameters: {'alpha': 44718.41901904432, 'n_pcs': 4000, 'iw_method': 'pc_logistic', 'iw_clip_max': 7.0, 'iw_prob_clip': 0.027503652502465694, 'iw_n_components': 20, 'iw_logistic_c': 3.67629458073383e-05, 'iw_pca_fit': 'combined', 'iw_solver': 'lbfgs', 'iw_rho': 0.85}. Best is trial 216 with value: 0.25859517736085086.
2026-06-01 19:24:15 | INFO | Trial 234 | outer=5 | alpha=4.442e+04 n_pcs=4000 (pc_topk) weight={'name': 'pc_logistic', 'floor': 1e-06, 'clip_max': 7.0, 'prob_clip': 0.028953508848413127, 'n_components': 20, 'logistic_c': 3.4513700968362334e-05, 'pca_fit': 'combined', 'solver': 'lbfgs', 'max_iter': 2000, 'fit_intercept': True, 'standardize_with_source': True, 'rho': 0.85}
[I 2026-06-01 19:24:28,034] Trial 234 finished with value: 0.2585693077909343 and parameters: {'alpha': 44415.098624831815, 'n_pcs': 4000, 'iw_method': 'pc_logistic', 'iw_clip_max': 7.0, 'iw_prob_clip': 0.028953508848413127, 'iw_n_components': 20, 'iw_logistic_c': 3.4513700968362334e-05, 'iw_pca_fit': 'combined', 'iw_solver': 'lbfgs', 'iw_rho': 0.85}. Best is trial 216 with value: 0.25859517736085086.
2026-06-01 19:24:28 | INFO | Trial 235 | outer=5 | alpha=4.185e+04 n_pcs=4000 (pc_topk) weight={'name': 'pc_logistic', 'floor': 1e-06, 'clip_max': 7.0, 'prob_clip': 0.026313712596983698, 'n_components': 20, 'logistic_c': 2.922512108210092e-05, 'pca_fit': 'combined', 'solver': 'lbfgs', 'max_iter': 2000, 'fit_intercept': True, 'standardize_with_source': True, 'rho': 0.85}
[I 2026-06-01 19:24:39,907] Trial 235 finished with value: 0.2582709820371846 and parameters: {'alpha': 41846.78644602819, 'n_pcs': 4000, 'iw_method': 'pc_logistic', 'iw_clip_max': 7.0, 'iw_prob_clip': 0.026313712596983698, 'iw_n_components': 20, 'iw_logistic_c': 2.922512108210092e-05, 'iw_pca_fit': 'combined', 'iw_solver': 'lbfgs', 'iw_rho': 0.85}. Best is trial 216 with value: 0.25859517736085086.
2026-06-01 19:24:39 | INFO | Trial 236 | outer=5 | alpha=4.412e+04 n_pcs=4000 (pc_topk) weight={'name': 'pc_logistic', 'floor': 1e-06, 'clip_max': 7.0, 'prob_clip': 0.02682412563525878, 'n_components': 20, 'logistic_c': 3.049272988861533e-05, 'pca_fit': 'combined', 'solver': 'lbfgs', 'max_iter': 2000, 'fit_intercept': True, 'standardize_with_source': True, 'rho': 0.85}
[I 2026-06-01 19:24:52,687] Trial 236 finished with value: 0.258447871374237 and parameters: {'alpha': 44122.10793367389, 'n_pcs': 4000, 'iw_method': 'pc_logistic', 'iw_clip_max': 7.0, 'iw_prob_clip': 0.02682412563525878, 'iw_n_components': 20, 'iw_logistic_c': 3.049272988861533e-05, 'iw_pca_fit': 'combined', 'iw_solver': 'lbfgs', 'iw_rho': 0.85}. Best is trial 216 with value: 0.25859517736085086.
2026-06-01 19:24:52 | INFO | Trial 237 | outer=5 | alpha=4.168e+04 n_pcs=4000 (pc_topk) weight={'name': 'pc_logistic', 'floor': 1e-06, 'clip_max': 7.0, 'prob_clip': 0.03182737939282483, 'n_components': 20, 'logistic_c': 1.6741801189898423e-05, 'pca_fit': 'combined', 'solver': 'lbfgs', 'max_iter': 2000, 'fit_intercept': True, 'standardize_with_source': True, 'rho': 0.3}
[I 2026-06-01 19:25:05,133] Trial 237 finished with value: 0.25035698831245834 and parameters: {'alpha': 41679.78466423682, 'n_pcs': 4000, 'iw_method': 'pc_logistic', 'iw_clip_max': 7.0, 'iw_prob_clip': 0.03182737939282483, 'iw_n_components': 20, 'iw_logistic_c': 1.6741801189898423e-05, 'iw_pca_fit': 'combined', 'iw_solver': 'lbfgs', 'iw_rho': 0.3}. Best is trial 216 with value: 0.25859517736085086.
2026-06-01 19:25:05 | INFO | Trial 238 | outer=5 | alpha=3.332e+04 n_pcs=4000 (pc_topk) weight={'name': 'pc_logistic', 'floor': 1e-06, 'clip_max': 7.0, 'prob_clip': 0.0261859185949946, 'n_components': 20, 'logistic_c': 3.150102499068575e-05, 'pca_fit': 'combined', 'solver': 'lbfgs', 'max_iter': 2000, 'fit_intercept': True, 'standardize_with_source': True, 'rho': 0.85}
[I 2026-06-01 19:25:17,377] Trial 238 finished with value: 0.2572590943033072 and parameters: {'alpha': 33317.20832797076, 'n_pcs': 4000, 'iw_method': 'pc_logistic', 'iw_clip_max': 7.0, 'iw_prob_clip': 0.0261859185949946, 'iw_n_components': 20, 'iw_logistic_c': 3.150102499068575e-05, 'iw_pca_fit': 'combined', 'iw_solver': 'lbfgs', 'iw_rho': 0.85}. Best is trial 216 with value: 0.25859517736085086.
2026-06-01 19:25:17 | INFO | Trial 239 | outer=5 | alpha=4.070e+04 n_pcs=3500 (pc_topk) weight={'name': 'pc_logistic', 'floor': 1e-06, 'clip_max': 7.0, 'prob_clip': 0.029577912234030248, 'n_components': 20, 'logistic_c': 9.42345498739201e-06, 'pca_fit': 'combined', 'solver': 'lbfgs', 'max_iter': 2000, 'fit_intercept': True, 'standardize_with_source': True, 'rho': 0.85}
[I 2026-06-01 19:25:28,646] Trial 239 finished with value: 0.2487282210796593 and parameters: {'alpha': 40704.50951089961, 'n_pcs': 3500, 'iw_method': 'pc_logistic', 'iw_clip_max': 7.0, 'iw_prob_clip': 0.029577912234030248, 'iw_n_components': 20, 'iw_logistic_c': 9.42345498739201e-06, 'iw_pca_fit': 'combined', 'iw_solver': 'lbfgs', 'iw_rho': 0.85}. Best is trial 216 with value: 0.25859517736085086.
2026-06-01 19:25:28 | INFO | Trial 240 | outer=5 | alpha=4.273e+04 n_pcs=4000 (pc_topk) weight={'name': 'pc_logistic', 'floor': 1e-06, 'clip_max': 1.5, 'prob_clip': 0.004596599932753694, 'n_components': 20, 'logistic_c': 2.4151522042366844e-05, 'pca_fit': 'combined', 'solver': 'lbfgs', 'max_iter': 2000, 'fit_intercept': True, 'standardize_with_source': True, 'rho': 0.85}
[I 2026-06-01 19:25:41,028] Trial 240 finished with value: 0.24821711262695664 and parameters: {'alpha': 42727.901434385065, 'n_pcs': 4000, 'iw_method': 'pc_logistic', 'iw_clip_max': 1.5, 'iw_prob_clip': 0.004596599932753694, 'iw_n_components': 20, 'iw_logistic_c': 2.4151522042366844e-05, 'iw_pca_fit': 'combined', 'iw_solver': 'lbfgs', 'iw_rho': 0.85}. Best is trial 216 with value: 0.25859517736085086.
2026-06-01 19:25:41 | INFO | Trial 241 | outer=5 | alpha=4.395e+04 n_pcs=4000 (pc_topk) weight={'name': 'pc_logistic', 'floor': 1e-06, 'clip_max': 7.0, 'prob_clip': 0.027175578715487547, 'n_components': 20, 'logistic_c': 3.518502439095643e-05, 'pca_fit': 'combined', 'solver': 'lbfgs', 'max_iter': 2000, 'fit_intercept': True, 'standardize_with_source': True, 'rho': 0.85}
[I 2026-06-01 19:25:53,722] Trial 241 finished with value: 0.2584629697153707 and parameters: {'alpha': 43952.927979592496, 'n_pcs': 4000, 'iw_method': 'pc_logistic', 'iw_clip_max': 7.0, 'iw_prob_clip': 0.027175578715487547, 'iw_n_components': 20, 'iw_logistic_c': 3.518502439095643e-05, 'iw_pca_fit': 'combined', 'iw_solver': 'lbfgs', 'iw_rho': 0.85}. Best is trial 216 with value: 0.25859517736085086.
2026-06-01 19:25:53 | INFO | Trial 242 | outer=5 | alpha=3.549e+04 n_pcs=4000 (pc_topk) weight={'name': 'pc_logistic', 'floor': 1e-06, 'clip_max': 7.0, 'prob_clip': 0.02628839080325562, 'n_components': 20, 'logistic_c': 3.22288980266893e-05, 'pca_fit': 'combined', 'solver': 'lbfgs', 'max_iter': 2000, 'fit_intercept': True, 'standardize_with_source': True, 'rho': 0.85}
[I 2026-06-01 19:26:06,344] Trial 242 finished with value: 0.25765102355191255 and parameters: {'alpha': 35494.148626847025, 'n_pcs': 4000, 'iw_method': 'pc_logistic', 'iw_clip_max': 7.0, 'iw_prob_clip': 0.02628839080325562, 'iw_n_components': 20, 'iw_logistic_c': 3.22288980266893e-05, 'iw_pca_fit': 'combined', 'iw_solver': 'lbfgs', 'iw_rho': 0.85}. Best is trial 216 with value: 0.25859517736085086.
2026-06-01 19:26:06 | INFO | Trial 243 | outer=5 | alpha=4.447e+04 n_pcs=4000 (pc_topk) weight={'name': 'pc_logistic', 'floor': 1e-06, 'clip_max': 7.0, 'prob_clip': 0.024555684930495033, 'n_components': 20, 'logistic_c': 2.1366606593276523e-05, 'pca_fit': 'combined', 'solver': 'lbfgs', 'max_iter': 2000, 'fit_intercept': True, 'standardize_with_source': True, 'rho': 0.85}
[I 2026-06-01 19:26:19,260] Trial 243 finished with value: 0.2574352478877316 and parameters: {'alpha': 44471.24869888148, 'n_pcs': 4000, 'iw_method': 'pc_logistic', 'iw_clip_max': 7.0, 'iw_prob_clip': 0.024555684930495033, 'iw_n_components': 20, 'iw_logistic_c': 2.1366606593276523e-05, 'iw_pca_fit': 'combined', 'iw_solver': 'lbfgs', 'iw_rho': 0.85}. Best is trial 216 with value: 0.25859517736085086.
2026-06-01 19:26:19 | INFO | Trial 244 | outer=5 | alpha=2.915e+04 n_pcs=4000 (pc_topk) weight={'name': 'pc_logistic', 'floor': 1e-06, 'clip_max': 7.0, 'prob_clip': 0.028360694857244177, 'n_components': 20, 'logistic_c': 3.617446441319866e-05, 'pca_fit': 'combined', 'solver': 'lbfgs', 'max_iter': 2000, 'fit_intercept': True, 'standardize_with_source': True, 'rho': 0.85}
[I 2026-06-01 19:26:31,886] Trial 244 finished with value: 0.25634492709650414 and parameters: {'alpha': 29153.891869669813, 'n_pcs': 4000, 'iw_method': 'pc_logistic', 'iw_clip_max': 7.0, 'iw_prob_clip': 0.028360694857244177, 'iw_n_components': 20, 'iw_logistic_c': 3.617446441319866e-05, 'iw_pca_fit': 'combined', 'iw_solver': 'lbfgs', 'iw_rho': 0.85}. Best is trial 216 with value: 0.25859517736085086.
2026-06-01 19:26:31 | INFO | Trial 245 | outer=5 | alpha=4.660e+04 n_pcs=4000 (pc_topk) weight={'name': 'pc_logistic', 'floor': 1e-06, 'clip_max': 7.0, 'prob_clip': 0.03451474380932471, 'n_components': 20, 'logistic_c': 1.467064420498946e-05, 'pca_fit': 'combined', 'solver': 'lbfgs', 'max_iter': 2000, 'fit_intercept': True, 'standardize_with_source': True, 'rho': 0.85}
[I 2026-06-01 19:26:44,818] Trial 245 finished with value: 0.2544965167607459 and parameters: {'alpha': 46600.63456122164, 'n_pcs': 4000, 'iw_method': 'pc_logistic', 'iw_clip_max': 7.0, 'iw_prob_clip': 0.03451474380932471, 'iw_n_components': 20, 'iw_logistic_c': 1.467064420498946e-05, 'iw_pca_fit': 'combined', 'iw_solver': 'lbfgs', 'iw_rho': 0.85}. Best is trial 216 with value: 0.25859517736085086.
2026-06-01 19:26:44 | INFO | Trial 246 | outer=5 | alpha=3.784e+04 n_pcs=4000 (pc_topk) weight={'name': 'pc_logistic', 'floor': 1e-06, 'clip_max': 7.0, 'prob_clip': 0.0266674220229997, 'n_components': 20, 'logistic_c': 4.2431760753282554e-05, 'pca_fit': 'combined', 'solver': 'lbfgs', 'max_iter': 2000, 'fit_intercept': True, 'standardize_with_source': True, 'rho': 0.85}
[I 2026-06-01 19:26:57,693] Trial 246 finished with value: 0.25774935017091327 and parameters: {'alpha': 37844.66183939963, 'n_pcs': 4000, 'iw_method': 'pc_logistic', 'iw_clip_max': 7.0, 'iw_prob_clip': 0.0266674220229997, 'iw_n_components': 20, 'iw_logistic_c': 4.2431760753282554e-05, 'iw_pca_fit': 'combined', 'iw_solver': 'lbfgs', 'iw_rho': 0.85}. Best is trial 216 with value: 0.25859517736085086.
2026-06-01 19:26:57 | INFO | Trial 247 | outer=5 | alpha=4.740e+04 n_pcs=4000 (pc_topk) weight={'name': 'pc_logistic', 'floor': 1e-06, 'clip_max': 2.5, 'prob_clip': 0.03059214580895077, 'n_components': 20, 'logistic_c': 2.7087086419775565e-05, 'pca_fit': 'combined', 'solver': 'lbfgs', 'max_iter': 2000, 'fit_intercept': True, 'standardize_with_source': True, 'rho': 0.85}
[I 2026-06-01 19:27:10,160] Trial 247 finished with value: 0.2557145020805125 and parameters: {'alpha': 47397.22364857114, 'n_pcs': 4000, 'iw_method': 'pc_logistic', 'iw_clip_max': 2.5, 'iw_prob_clip': 0.03059214580895077, 'iw_n_components': 20, 'iw_logistic_c': 2.7087086419775565e-05, 'iw_pca_fit': 'combined', 'iw_solver': 'lbfgs', 'iw_rho': 0.85}. Best is trial 216 with value: 0.25859517736085086.
2026-06-01 19:27:10 | INFO | Trial 248 | outer=5 | alpha=3.433e+04 n_pcs=4000 (pc_topk) weight={'name': 'pc_logistic', 'floor': 1e-06, 'clip_max': 7.0, 'prob_clip': 0.023806464174614312, 'n_components': 20, 'logistic_c': 4.19302448518567e-05, 'pca_fit': 'combined', 'solver': 'lbfgs', 'max_iter': 2000, 'fit_intercept': True, 'standardize_with_source': True, 'rho': 0.85}
[I 2026-06-01 19:27:23,254] Trial 248 finished with value: 0.25708060210277484 and parameters: {'alpha': 34330.91743948203, 'n_pcs': 4000, 'iw_method': 'pc_logistic', 'iw_clip_max': 7.0, 'iw_prob_clip': 0.023806464174614312, 'iw_n_components': 20, 'iw_logistic_c': 4.19302448518567e-05, 'iw_pca_fit': 'combined', 'iw_solver': 'lbfgs', 'iw_rho': 0.85}. Best is trial 216 with value: 0.25859517736085086.
2026-06-01 19:27:23 | INFO | Trial 249 | outer=5 | alpha=5.287e+04 n_pcs=4000 (pc_topk) weight={'name': 'pc_logistic', 'floor': 1e-06, 'clip_max': 7.0, 'prob_clip': 0.026767687272018788, 'n_components': 20, 'logistic_c': 2.0019147873510314e-05, 'pca_fit': 'combined', 'solver': 'lbfgs', 'max_iter': 2000, 'fit_intercept': True, 'standardize_with_source': True, 'rho': 0.85}
[I 2026-06-01 19:27:35,492] Trial 249 finished with value: 0.2568412264987 and parameters: {'alpha': 52867.89207583761, 'n_pcs': 4000, 'iw_method': 'pc_logistic', 'iw_clip_max': 7.0, 'iw_prob_clip': 0.026767687272018788, 'iw_n_components': 20, 'iw_logistic_c': 2.0019147873510314e-05, 'iw_pca_fit': 'combined', 'iw_solver': 'lbfgs', 'iw_rho': 0.85}. Best is trial 216 with value: 0.25859517736085086.
2026-06-01 19:27:35 | INFO | Trial 250 | outer=5 | alpha=4.058e+04 n_pcs=4500 (pc_topk) weight={'name': 'pc_logistic', 'floor': 1e-06, 'clip_max': 7.0, 'prob_clip': 0.03287178222374177, 'n_components': 20, 'logistic_c': 2.8992286264991915e-05, 'pca_fit': 'combined', 'solver': 'lbfgs', 'max_iter': 2000, 'fit_intercept': True, 'standardize_with_source': True, 'rho': 0.85}
[I 2026-06-01 19:27:50,374] Trial 250 finished with value: 0.25818467599105865 and parameters: {'alpha': 40582.122783902596, 'n_pcs': 4500, 'iw_method': 'pc_logistic', 'iw_clip_max': 7.0, 'iw_prob_clip': 0.03287178222374177, 'iw_n_components': 20, 'iw_logistic_c': 2.8992286264991915e-05, 'iw_pca_fit': 'combined', 'iw_solver': 'lbfgs', 'iw_rho': 0.85}. Best is trial 216 with value: 0.25859517736085086.
2026-06-01 19:27:50 | INFO | Trial 251 | outer=5 | alpha=2.652e+04 n_pcs=4500 (pc_topk) weight={'name': 'pc_logistic', 'floor': 1e-06, 'clip_max': 7.0, 'prob_clip': 0.033869797751963256, 'n_components': 20, 'logistic_c': 5.114323882630367e-05, 'pca_fit': 'combined', 'solver': 'lbfgs', 'max_iter': 2000, 'fit_intercept': True, 'standardize_with_source': True, 'rho': 0.85}
[I 2026-06-01 19:28:05,327] Trial 251 finished with value: 0.25680807957114465 and parameters: {'alpha': 26515.668832391977, 'n_pcs': 4500, 'iw_method': 'pc_logistic', 'iw_clip_max': 7.0, 'iw_prob_clip': 0.033869797751963256, 'iw_n_components': 20, 'iw_logistic_c': 5.114323882630367e-05, 'iw_pca_fit': 'combined', 'iw_solver': 'lbfgs', 'iw_rho': 0.85}. Best is trial 216 with value: 0.25859517736085086.
2026-06-01 19:28:05 | INFO | Trial 252 | outer=5 | alpha=4.044e+04 n_pcs=4500 (pc_topk) weight={'name': 'pc_logistic', 'floor': 1e-06, 'clip_max': 7.0, 'prob_clip': 0.0011365512104070654, 'n_components': 20, 'logistic_c': 2.4959989346051216e-05, 'pca_fit': 'combined', 'solver': 'lbfgs', 'max_iter': 2000, 'fit_intercept': True, 'standardize_with_source': True, 'rho': 0.85}
[I 2026-06-01 19:28:19,838] Trial 252 finished with value: 0.2567723008004646 and parameters: {'alpha': 40438.972644368674, 'n_pcs': 4500, 'iw_method': 'pc_logistic', 'iw_clip_max': 7.0, 'iw_prob_clip': 0.0011365512104070654, 'iw_n_components': 20, 'iw_logistic_c': 2.4959989346051216e-05, 'iw_pca_fit': 'combined', 'iw_solver': 'lbfgs', 'iw_rho': 0.85}. Best is trial 216 with value: 0.25859517736085086.
2026-06-01 19:28:19 | INFO | Trial 253 | outer=5 | alpha=6.206e+04 n_pcs=4500 (pc_topk) weight={'name': 'pc_logistic', 'floor': 1e-06, 'clip_max': 7.0, 'prob_clip': 0.025481831822103902, 'n_components': 20, 'logistic_c': 1.2788625031900599e-05, 'pca_fit': 'combined', 'solver': 'lbfgs', 'max_iter': 2000, 'fit_intercept': True, 'standardize_with_source': True, 'rho': 0.85}
[I 2026-06-01 19:28:34,351] Trial 253 finished with value: 0.25351634012816693 and parameters: {'alpha': 62063.1825420942, 'n_pcs': 4500, 'iw_method': 'pc_logistic', 'iw_clip_max': 7.0, 'iw_prob_clip': 0.025481831822103902, 'iw_n_components': 20, 'iw_logistic_c': 1.2788625031900599e-05, 'iw_pca_fit': 'combined', 'iw_solver': 'lbfgs', 'iw_rho': 0.85}. Best is trial 216 with value: 0.25859517736085086.
2026-06-01 19:28:34 | INFO | Trial 254 | outer=5 | alpha=3.201e+04 n_pcs=4500 (pc_topk) weight={'name': 'pc_logistic', 'floor': 1e-06, 'clip_max': 7.0, 'prob_clip': 0.03199495441393347, 'n_components': 20, 'logistic_c': 5.643281288988021e-05, 'pca_fit': 'combined', 'solver': 'lbfgs', 'max_iter': 2000, 'fit_intercept': True, 'standardize_with_source': True, 'rho': 1.0}
[I 2026-06-01 19:28:48,402] Trial 254 finished with value: 0.25768644283689474 and parameters: {'alpha': 32014.39075246444, 'n_pcs': 4500, 'iw_method': 'pc_logistic', 'iw_clip_max': 7.0, 'iw_prob_clip': 0.03199495441393347, 'iw_n_components': 20, 'iw_logistic_c': 5.643281288988021e-05, 'iw_pca_fit': 'combined', 'iw_solver': 'lbfgs', 'iw_rho': 1.0}. Best is trial 216 with value: 0.25859517736085086.
2026-06-01 19:28:48 | INFO | Trial 255 | outer=5 | alpha=3.943e+04 n_pcs=3500 (pc_topk) weight={'name': 'pc_logistic', 'floor': 1e-06, 'clip_max': 7.0, 'prob_clip': 0.023595783473323605, 'n_components': 20, 'logistic_c': 3.1781227607655474e-05, 'pca_fit': 'combined', 'solver': 'lbfgs', 'max_iter': 2000, 'fit_intercept': True, 'standardize_with_source': True, 'rho': 0.85}
[I 2026-06-01 19:28:58,111] Trial 255 finished with value: 0.2534180377067037 and parameters: {'alpha': 39430.048161283856, 'n_pcs': 3500, 'iw_method': 'pc_logistic', 'iw_clip_max': 7.0, 'iw_prob_clip': 0.023595783473323605, 'iw_n_components': 20, 'iw_logistic_c': 3.1781227607655474e-05, 'iw_pca_fit': 'combined', 'iw_solver': 'lbfgs', 'iw_rho': 0.85}. Best is trial 216 with value: 0.25859517736085086.
2026-06-01 19:28:58 | INFO | Trial 256 | outer=5 | alpha=7.496e+04 n_pcs=4500 (pc_topk) weight={'name': 'pc_logistic', 'floor': 1e-06, 'clip_max': 7.0, 'prob_clip': 0.028359590969710285, 'n_components': 20, 'logistic_c': 1.6766618609232217e-05, 'pca_fit': 'combined', 'solver': 'lbfgs', 'max_iter': 2000, 'fit_intercept': True, 'standardize_with_source': True, 'rho': 0.85}
[I 2026-06-01 19:29:13,071] Trial 256 finished with value: 0.25386621892489514 and parameters: {'alpha': 74960.6594708225, 'n_pcs': 4500, 'iw_method': 'pc_logistic', 'iw_clip_max': 7.0, 'iw_prob_clip': 0.028359590969710285, 'iw_n_components': 20, 'iw_logistic_c': 1.6766618609232217e-05, 'iw_pca_fit': 'combined', 'iw_solver': 'lbfgs', 'iw_rho': 0.85}. Best is trial 216 with value: 0.25859517736085086.
2026-06-01 19:29:13 | INFO | Trial 257 | outer=5 | alpha=5.525e+04 n_pcs=4500 (pc_topk) weight={'name': 'pc_logistic', 'floor': 1e-06, 'clip_max': 7.0, 'prob_clip': 0.03596946759682078, 'n_components': 20, 'logistic_c': 4.2064931603039946e-05, 'pca_fit': 'combined', 'solver': 'lbfgs', 'max_iter': 2000, 'fit_intercept': True, 'standardize_with_source': True, 'rho': 0.5}
[I 2026-06-01 19:29:28,195] Trial 257 finished with value: 0.2554985751100105 and parameters: {'alpha': 55245.99153713195, 'n_pcs': 4500, 'iw_method': 'pc_logistic', 'iw_clip_max': 7.0, 'iw_prob_clip': 0.03596946759682078, 'iw_n_components': 20, 'iw_logistic_c': 4.2064931603039946e-05, 'iw_pca_fit': 'combined', 'iw_solver': 'lbfgs', 'iw_rho': 0.5}. Best is trial 216 with value: 0.25859517736085086.
2026-06-01 19:29:28 | INFO | Trial 258 | outer=5 | alpha=4.373e+04 n_pcs=4000 (pc_topk) weight={'name': 'uniform'}
[I 2026-06-01 19:29:34,902] Trial 258 finished with value: 0.24169931032914554 and parameters: {'alpha': 43730.5159262437, 'n_pcs': 4000, 'iw_method': 'uniform'}. Best is trial 216 with value: 0.25859517736085086.
2026-06-01 19:29:34 | INFO | Trial 259 | outer=5 | alpha=6.565e+04 n_pcs=4000 (pc_topk) weight={'name': 'pc_logistic', 'floor': 1e-06, 'clip_max': 7.0, 'prob_clip': 0.02619878760054409, 'n_components': 20, 'logistic_c': 6.799015199530032e-06, 'pca_fit': 'combined', 'solver': 'lbfgs', 'max_iter': 2000, 'fit_intercept': True, 'standardize_with_source': True, 'rho': 0.85}
[I 2026-06-01 19:29:48,130] Trial 259 finished with value: 0.24970624246852674 and parameters: {'alpha': 65654.00192387689, 'n_pcs': 4000, 'iw_method': 'pc_logistic', 'iw_clip_max': 7.0, 'iw_prob_clip': 0.02619878760054409, 'iw_n_components': 20, 'iw_logistic_c': 6.799015199530032e-06, 'iw_pca_fit': 'combined', 'iw_solver': 'lbfgs', 'iw_rho': 0.85}. Best is trial 216 with value: 0.25859517736085086.
2026-06-01 19:29:48 | INFO | Trial 260 | outer=5 | alpha=5.108e+04 n_pcs=4000 (pc_topk) weight={'name': 'pc_logistic', 'floor': 1e-06, 'clip_max': 7.0, 'prob_clip': 0.029575463737676312, 'n_components': 20, 'logistic_c': 2.423714498996172e-05, 'pca_fit': 'combined', 'solver': 'lbfgs', 'max_iter': 2000, 'fit_intercept': True, 'standardize_with_source': True, 'rho': 0.85}
[I 2026-06-01 19:30:00,679] Trial 260 finished with value: 0.25758610307903107 and parameters: {'alpha': 51077.39714072424, 'n_pcs': 4000, 'iw_method': 'pc_logistic', 'iw_clip_max': 7.0, 'iw_prob_clip': 0.029575463737676312, 'iw_n_components': 20, 'iw_logistic_c': 2.423714498996172e-05, 'iw_pca_fit': 'combined', 'iw_solver': 'lbfgs', 'iw_rho': 0.85}. Best is trial 216 with value: 0.25859517736085086.
2026-06-01 19:30:00 | INFO | Trial 261 | outer=5 | alpha=3.250e+04 n_pcs=2000 (pc_topk) weight={'name': 'pc_logistic', 'floor': 1e-06, 'clip_max': 7.0, 'prob_clip': 0.0023254553392048007, 'n_components': 20, 'logistic_c': 5.72454139321511e-05, 'pca_fit': 'combined', 'solver': 'lbfgs', 'max_iter': 2000, 'fit_intercept': True, 'standardize_with_source': True, 'rho': 0.85}
