[I 2026-06-01 23:28:48,064] Trial 5 finished with value: -1.0 and parameters: {'alpha': 64350.09539177312, 'n_pcs': 1000, 'iw_method': 'pc_logistic', 'iw_clip_max': 7.0, 'iw_prob_clip': 0.004193356127903791, 'iw_n_components': 20, 'iw_logistic_c': 9.236417519010976, 'iw_pca_fit': 'combined', 'iw_solver': 'lbfgs', 'iw_rho': 1.0}. Best is trial 1 with value: 0.2215883419681996.
2026-06-01 23:28:48 | INFO | Trial 6 | outer=9 | alpha=3.046e+05 n_pcs=3500 (pc_topk) weight={'name': 'pc_logistic', 'floor': 1e-06, 'clip_max': 12.0, 'prob_clip': 0.0007016380040663315, 'n_components': 80, 'logistic_c': 0.00021908930989278453, 'pca_fit': 'combined', 'solver': 'lbfgs', 'max_iter': 2000, 'fit_intercept': True, 'standardize_with_source': True, 'rho': 0.7}
[I 2026-06-01 23:29:00,531] Trial 6 finished with value: 0.21838975161567747 and parameters: {'alpha': 304631.0485153137, 'n_pcs': 3500, 'iw_method': 'pc_logistic', 'iw_clip_max': 12.0, 'iw_prob_clip': 0.0007016380040663315, 'iw_n_components': 80, 'iw_logistic_c': 0.00021908930989278453, 'iw_pca_fit': 'combined', 'iw_solver': 'lbfgs', 'iw_rho': 0.7}. Best is trial 1 with value: 0.2215883419681996.
2026-06-01 23:29:00 | INFO | Trial 7 | outer=9 | alpha=7.213e+06 n_pcs=500 (pc_topk) weight={'name': 'uniform'}
[I 2026-06-01 23:29:01,781] Trial 7 finished with value: 0.1707144748677349 and parameters: {'alpha': 7213019.60957054, 'n_pcs': 500, 'iw_method': 'uniform'}. Best is trial 1 with value: 0.2215883419681996.
2026-06-01 23:29:01 | INFO | Trial 8 | outer=9 | alpha=2.347e+03 n_pcs=3000 (pc_topk) weight={'name': 'pc_logistic', 'floor': 1e-06, 'clip_max': 2.5, 'prob_clip': 0.017782866059784724, 'n_components': 60, 'logistic_c': 4.584813955429537e-07, 'pca_fit': 'combined', 'solver': 'lbfgs', 'max_iter': 2000, 'fit_intercept': True, 'standardize_with_source': True, 'rho': 0.3}
[I 2026-06-01 23:29:11,349] Trial 8 finished with value: 0.15195466561065032 and parameters: {'alpha': 2346.6230871488538, 'n_pcs': 3000, 'iw_method': 'pc_logistic', 'iw_clip_max': 2.5, 'iw_prob_clip': 0.017782866059784724, 'iw_n_components': 60, 'iw_logistic_c': 4.584813955429537e-07, 'iw_pca_fit': 'combined', 'iw_solver': 'lbfgs', 'iw_rho': 0.3}. Best is trial 1 with value: 0.2215883419681996.
2026-06-01 23:29:11 | INFO | Trial 9 | outer=9 | alpha=1.067e+03 n_pcs=4000 (pc_topk) weight={'name': 'pc_logistic', 'floor': 1e-06, 'clip_max': 4.0, 'prob_clip': 0.003002704300062754, 'n_components': 10, 'logistic_c': 4.32601466983518e-06, 'pca_fit': 'combined', 'solver': 'lbfgs', 'max_iter': 2000, 'fit_intercept': True, 'standardize_with_source': True, 'rho': 1.0}
[I 2026-06-01 23:29:24,123] Trial 9 finished with value: 0.11787013260180008 and parameters: {'alpha': 1067.2105048492429, 'n_pcs': 4000, 'iw_method': 'pc_logistic', 'iw_clip_max': 4.0, 'iw_prob_clip': 0.003002704300062754, 'iw_n_components': 10, 'iw_logistic_c': 4.32601466983518e-06, 'iw_pca_fit': 'combined', 'iw_solver': 'lbfgs', 'iw_rho': 1.0}. Best is trial 1 with value: 0.2215883419681996.
2026-06-01 23:29:24 | INFO | Trial 10 | outer=9 | alpha=1.150e+04 n_pcs=5000 (pc_topk) weight={'name': 'uniform'}
[I 2026-06-01 23:29:34,725] Trial 10 finished with value: 0.218031794897803 and parameters: {'alpha': 11501.099698953694, 'n_pcs': 5000, 'iw_method': 'uniform'}. Best is trial 1 with value: 0.2215883419681996.
2026-06-01 23:29:34 | INFO | Trial 11 | outer=9 | alpha=1.199e+06 n_pcs=5000 (pc_topk) weight={'name': 'pc_logistic', 'floor': 1e-06, 'clip_max': 12.0, 'prob_clip': 0.0007158490266448297, 'n_components': 80, 'logistic_c': 0.00047345791522711923, 'pca_fit': 'combined', 'solver': 'lbfgs', 'max_iter': 2000, 'fit_intercept': True, 'standardize_with_source': True, 'rho': 0.7}
[I 2026-06-01 23:29:52,940] Trial 11 finished with value: 0.20829541433391596 and parameters: {'alpha': 1199098.4863751335, 'n_pcs': 5000, 'iw_method': 'pc_logistic', 'iw_clip_max': 12.0, 'iw_prob_clip': 0.0007158490266448297, 'iw_n_components': 80, 'iw_logistic_c': 0.00047345791522711923, 'iw_pca_fit': 'combined', 'iw_solver': 'lbfgs', 'iw_rho': 0.7}. Best is trial 1 with value: 0.2215883419681996.
2026-06-01 23:29:52 | INFO | Trial 12 | outer=9 | alpha=1.651e+04 n_pcs=3500 (pc_topk) weight={'name': 'pc_logistic', 'floor': 1e-06, 'clip_max': 12.0, 'prob_clip': 0.0005593063313063697, 'n_components': 100, 'logistic_c': 0.00045106102832414717, 'pca_fit': 'combined', 'solver': 'lbfgs', 'max_iter': 2000, 'fit_intercept': True, 'standardize_with_source': True, 'rho': 0.5}
[I 2026-06-01 23:30:06,194] Trial 12 finished with value: 0.20484241569533862 and parameters: {'alpha': 16513.01867784095, 'n_pcs': 3500, 'iw_method': 'pc_logistic', 'iw_clip_max': 12.0, 'iw_prob_clip': 0.0005593063313063697, 'iw_n_components': 100, 'iw_logistic_c': 0.00045106102832414717, 'iw_pca_fit': 'combined', 'iw_solver': 'lbfgs', 'iw_rho': 0.5}. Best is trial 1 with value: 0.2215883419681996.
2026-06-01 23:30:06 | INFO | Trial 13 | outer=9 | alpha=7.725e+05 n_pcs=2500 (pc_topk) weight={'name': 'uniform'}
[I 2026-06-01 23:30:11,078] Trial 13 finished with value: 0.20200743891389705 and parameters: {'alpha': 772521.7668112898, 'n_pcs': 2500, 'iw_method': 'uniform'}. Best is trial 1 with value: 0.2215883419681996.
2026-06-01 23:30:11 | INFO | Trial 14 | outer=9 | alpha=1.792e+04 n_pcs=4500 (pc_topk) weight={'name': 'pc_logistic', 'floor': 1e-06, 'clip_max': 12.0, 'prob_clip': 0.01473817737520998, 'n_components': 40, 'logistic_c': 3.191202215750811e-05, 'pca_fit': 'combined', 'solver': 'lbfgs', 'max_iter': 2000, 'fit_intercept': True, 'standardize_with_source': True, 'rho': 0.7}
[I 2026-06-01 23:30:25,797] Trial 14 finished with value: 0.21969537916376153 and parameters: {'alpha': 17920.618967560844, 'n_pcs': 4500, 'iw_method': 'pc_logistic', 'iw_clip_max': 12.0, 'iw_prob_clip': 0.01473817737520998, 'iw_n_components': 40, 'iw_logistic_c': 3.191202215750811e-05, 'iw_pca_fit': 'combined', 'iw_solver': 'lbfgs', 'iw_rho': 0.7}. Best is trial 1 with value: 0.2215883419681996.
2026-06-01 23:30:25 | INFO | Trial 15 | outer=9 | alpha=1.723e+04 n_pcs=4500 (pc_topk) weight={'name': 'uniform'}
[I 2026-06-01 23:30:34,937] Trial 15 finished with value: 0.22233743138239537 and parameters: {'alpha': 17228.29982979997, 'n_pcs': 4500, 'iw_method': 'uniform'}. Best is trial 15 with value: 0.22233743138239537.
2026-06-01 23:30:34 | INFO | Trial 16 | outer=9 | alpha=5.637e+03 n_pcs=4500 (pc_topk) weight={'name': 'uniform'}
[I 2026-06-01 23:30:44,215] Trial 16 finished with value: 0.2036912677044672 and parameters: {'alpha': 5636.553639398155, 'n_pcs': 4500, 'iw_method': 'uniform'}. Best is trial 15 with value: 0.22233743138239537.
2026-06-01 23:30:44 | INFO | Trial 17 | outer=9 | alpha=3.548e+04 n_pcs=5000 (pc_topk) weight={'name': 'uniform'}
[I 2026-06-01 23:30:54,816] Trial 17 finished with value: 0.22310740686888225 and parameters: {'alpha': 35478.18697295388, 'n_pcs': 5000, 'iw_method': 'uniform'}. Best is trial 17 with value: 0.22310740686888225.
2026-06-01 23:30:54 | INFO | Trial 18 | outer=9 | alpha=4.457e+04 n_pcs=4000 (pc_topk) weight={'name': 'uniform'}
[I 2026-06-01 23:31:01,997] Trial 18 finished with value: 0.22111526157659855 and parameters: {'alpha': 44565.82100048908, 'n_pcs': 4000, 'iw_method': 'uniform'}. Best is trial 17 with value: 0.22310740686888225.
2026-06-01 23:31:02 | INFO | Trial 19 | outer=9 | alpha=4.349e+03 n_pcs=4500 (pc_topk) weight={'name': 'uniform'}
[I 2026-06-01 23:31:10,961] Trial 19 finished with value: 0.19593305054304672 and parameters: {'alpha': 4348.882934927076, 'n_pcs': 4500, 'iw_method': 'uniform'}. Best is trial 17 with value: 0.22310740686888225.
2026-06-01 23:31:10 | INFO | Trial 20 | outer=9 | alpha=3.436e+04 n_pcs=3000 (pc_topk) weight={'name': 'uniform'}
[I 2026-06-01 23:31:16,096] Trial 20 finished with value: 0.22030871714360742 and parameters: {'alpha': 34361.33105774025, 'n_pcs': 3000, 'iw_method': 'uniform'}. Best is trial 17 with value: 0.22310740686888225.
2026-06-01 23:31:16 | INFO | Trial 21 | outer=9 | alpha=1.134e+04 n_pcs=5000 (pc_topk) weight={'name': 'uniform'}
[I 2026-06-01 23:31:26,696] Trial 21 finished with value: 0.21787282745314357 and parameters: {'alpha': 11342.968380008224, 'n_pcs': 5000, 'iw_method': 'uniform'}. Best is trial 17 with value: 0.22310740686888225.
2026-06-01 23:31:26 | INFO | Trial 22 | outer=9 | alpha=3.156e+04 n_pcs=5000 (pc_topk) weight={'name': 'uniform'}
[I 2026-06-01 23:31:38,027] Trial 22 finished with value: 0.22321703505238863 and parameters: {'alpha': 31562.505031700166, 'n_pcs': 5000, 'iw_method': 'uniform'}. Best is trial 22 with value: 0.22321703505238863.
2026-06-01 23:31:38 | INFO | Trial 23 | outer=9 | alpha=3.942e+04 n_pcs=4500 (pc_topk) weight={'name': 'uniform'}
[I 2026-06-01 23:31:47,256] Trial 23 finished with value: 0.22402214054988262 and parameters: {'alpha': 39419.32259731964, 'n_pcs': 4500, 'iw_method': 'uniform'}. Best is trial 23 with value: 0.22402214054988262.
2026-06-01 23:31:47 | INFO | Trial 24 | outer=9 | alpha=4.305e+05 n_pcs=3500 (pc_topk) weight={'name': 'uniform'}
[I 2026-06-01 23:31:53,094] Trial 24 finished with value: 0.20509952997405184 and parameters: {'alpha': 430472.7448491798, 'n_pcs': 3500, 'iw_method': 'uniform'}. Best is trial 23 with value: 0.22402214054988262.
2026-06-01 23:31:53 | INFO | Trial 25 | outer=9 | alpha=4.030e+04 n_pcs=5000 (pc_topk) weight={'name': 'uniform'}
[I 2026-06-01 23:32:03,563] Trial 25 finished with value: 0.22284745309831394 and parameters: {'alpha': 40303.944952834776, 'n_pcs': 5000, 'iw_method': 'uniform'}. Best is trial 23 with value: 0.22402214054988262.
2026-06-01 23:32:03 | INFO | Trial 26 | outer=9 | alpha=7.611e+04 n_pcs=4000 (pc_topk) weight={'name': 'uniform'}
[I 2026-06-01 23:32:10,689] Trial 26 finished with value: 0.21929500114339442 and parameters: {'alpha': 76113.59934767261, 'n_pcs': 4000, 'iw_method': 'uniform'}. Best is trial 23 with value: 0.22402214054988262.
2026-06-01 23:32:10 | INFO | Trial 27 | outer=9 | alpha=2.211e+05 n_pcs=4500 (pc_topk) weight={'name': 'uniform'}
[I 2026-06-01 23:32:19,432] Trial 27 finished with value: 0.21084858189787722 and parameters: {'alpha': 221099.0963541209, 'n_pcs': 4500, 'iw_method': 'uniform'}. Best is trial 23 with value: 0.22402214054988262.
2026-06-01 23:32:19 | INFO | Trial 28 | outer=9 | alpha=4.754e+03 n_pcs=5000 (pc_topk) weight={'name': 'uniform'}
[I 2026-06-01 23:32:29,786] Trial 28 finished with value: 0.20187919302207674 and parameters: {'alpha': 4753.932104488932, 'n_pcs': 5000, 'iw_method': 'uniform'}. Best is trial 23 with value: 0.22402214054988262.
2026-06-01 23:32:29 | INFO | Trial 29 | outer=9 | alpha=3.085e+04 n_pcs=4000 (pc_topk) weight={'name': 'uniform'}
[I 2026-06-01 23:32:36,759] Trial 29 finished with value: 0.220540445279995 and parameters: {'alpha': 30851.87591196734, 'n_pcs': 4000, 'iw_method': 'uniform'}. Best is trial 23 with value: 0.22402214054988262.
2026-06-01 23:32:36 | INFO | Trial 30 | outer=9 | alpha=9.055e+04 n_pcs=4500 (pc_topk) weight={'name': 'uniform'}
[I 2026-06-01 23:32:45,539] Trial 30 finished with value: 0.21937206708472826 and parameters: {'alpha': 90550.66179778842, 'n_pcs': 4500, 'iw_method': 'uniform'}. Best is trial 23 with value: 0.22402214054988262.
2026-06-01 23:32:45 | INFO | Trial 31 | outer=9 | alpha=3.898e+04 n_pcs=5000 (pc_topk) weight={'name': 'uniform'}
[I 2026-06-01 23:32:55,707] Trial 31 finished with value: 0.2229289982528811 and parameters: {'alpha': 38983.19804605277, 'n_pcs': 5000, 'iw_method': 'uniform'}. Best is trial 23 with value: 0.22402214054988262.
2026-06-01 23:32:55 | INFO | Trial 32 | outer=9 | alpha=3.182e+04 n_pcs=5000 (pc_topk) weight={'name': 'uniform'}
[I 2026-06-01 23:33:05,871] Trial 32 finished with value: 0.22321367180688148 and parameters: {'alpha': 31816.120386894538, 'n_pcs': 5000, 'iw_method': 'uniform'}. Best is trial 23 with value: 0.22402214054988262.
2026-06-01 23:33:05 | INFO | Trial 33 | outer=9 | alpha=8.255e+03 n_pcs=5000 (pc_topk) weight={'name': 'uniform'}
[I 2026-06-01 23:33:16,048] Trial 33 finished with value: 0.21346013990750773 and parameters: {'alpha': 8255.47957572399, 'n_pcs': 5000, 'iw_method': 'uniform'}. Best is trial 23 with value: 0.22402214054988262.
2026-06-01 23:33:16 | INFO | Trial 34 | outer=9 | alpha=2.380e+04 n_pcs=4500 (pc_topk) weight={'name': 'uniform'}
[I 2026-06-01 23:33:24,783] Trial 34 finished with value: 0.22396025921267132 and parameters: {'alpha': 23801.031900598424, 'n_pcs': 4500, 'iw_method': 'uniform'}. Best is trial 23 with value: 0.22402214054988262.
2026-06-01 23:33:24 | INFO | Trial 35 | outer=9 | alpha=1.387e+05 n_pcs=4000 (pc_topk) weight={'name': 'uniform'}
[I 2026-06-01 23:33:31,760] Trial 35 finished with value: 0.21479563630447282 and parameters: {'alpha': 138659.24051701569, 'n_pcs': 4000, 'iw_method': 'uniform'}. Best is trial 23 with value: 0.22402214054988262.
2026-06-01 23:33:31 | INFO | Trial 36 | outer=9 | alpha=6.558e+04 n_pcs=4500 (pc_topk) weight={'name': 'uniform'}
[I 2026-06-01 23:33:40,507] Trial 36 finished with value: 0.22172549485389773 and parameters: {'alpha': 65575.77284370648, 'n_pcs': 4500, 'iw_method': 'uniform'}. Best is trial 23 with value: 0.22402214054988262.
2026-06-01 23:33:40 | INFO | Trial 37 | outer=9 | alpha=1.867e+04 n_pcs=1500 (pc_topk) weight={'name': 'uniform'}
[I 2026-06-01 23:33:43,497] Trial 37 finished with value: 0.19056806705435347 and parameters: {'alpha': 18665.210803295096, 'n_pcs': 1500, 'iw_method': 'uniform'}. Best is trial 23 with value: 0.22402214054988262.
2026-06-01 23:33:43 | INFO | Trial 38 | outer=9 | alpha=2.800e+03 n_pcs=3500 (pc_topk) weight={'name': 'uniform'}
[I 2026-06-01 23:33:49,518] Trial 38 finished with value: 0.15825761857049686 and parameters: {'alpha': 2800.2598024046097, 'n_pcs': 3500, 'iw_method': 'uniform'}. Best is trial 23 with value: 0.22402214054988262.
2026-06-01 23:33:49 | INFO | Trial 39 | outer=9 | alpha=2.341e+05 n_pcs=2500 (pc_topk) weight={'name': 'uniform'}
[I 2026-06-01 23:33:54,150] Trial 39 finished with value: 0.21299807994734876 and parameters: {'alpha': 234076.27627449523, 'n_pcs': 2500, 'iw_method': 'uniform'}. Best is trial 23 with value: 0.22402214054988262.
2026-06-01 23:33:54 | INFO | Trial 40 | outer=9 | alpha=1.110e+05 n_pcs=4000 (pc_topk) weight={'name': 'uniform'}
[I 2026-06-01 23:34:01,518] Trial 40 finished with value: 0.21667998488662416 and parameters: {'alpha': 111001.30409647123, 'n_pcs': 4000, 'iw_method': 'uniform'}. Best is trial 23 with value: 0.22402214054988262.
2026-06-01 23:34:01 | INFO | Trial 41 | outer=9 | alpha=2.931e+04 n_pcs=5000 (pc_topk) weight={'name': 'uniform'}
[I 2026-06-01 23:34:11,857] Trial 41 finished with value: 0.22321959435236685 and parameters: {'alpha': 29311.97574685252, 'n_pcs': 5000, 'iw_method': 'uniform'}. Best is trial 23 with value: 0.22402214054988262.
2026-06-01 23:34:11 | INFO | Trial 42 | outer=9 | alpha=2.538e+04 n_pcs=4500 (pc_topk) weight={'name': 'uniform'}
[I 2026-06-01 23:34:20,624] Trial 42 finished with value: 0.22412397147737737 and parameters: {'alpha': 25381.96012777629, 'n_pcs': 4500, 'iw_method': 'uniform'}. Best is trial 42 with value: 0.22412397147737737.
2026-06-01 23:34:20 | INFO | Trial 43 | outer=9 | alpha=9.082e+03 n_pcs=4500 (pc_topk) weight={'name': 'uniform'}
[I 2026-06-01 23:34:29,421] Trial 43 finished with value: 0.21445018252283515 and parameters: {'alpha': 9082.444927152179, 'n_pcs': 4500, 'iw_method': 'uniform'}. Best is trial 42 with value: 0.22412397147737737.
2026-06-01 23:34:29 | INFO | Trial 44 | outer=9 | alpha=2.352e+04 n_pcs=4500 (pc_topk) weight={'name': 'uniform'}
[I 2026-06-01 23:34:38,337] Trial 44 finished with value: 0.22392467406095876 and parameters: {'alpha': 23521.586730575396, 'n_pcs': 4500, 'iw_method': 'uniform'}. Best is trial 42 with value: 0.22412397147737737.
2026-06-01 23:34:38 | INFO | Trial 45 | outer=9 | alpha=2.124e+04 n_pcs=4000 (pc_topk) weight={'name': 'pc_logistic', 'floor': 1e-06, 'clip_max': 7.0, 'prob_clip': 0.04224112740090698, 'n_components': 60, 'logistic_c': 0.045295849796393076, 'pca_fit': 'combined', 'solver': 'lbfgs', 'max_iter': 2000, 'fit_intercept': True, 'standardize_with_source': True, 'rho': 0.85}
[I 2026-06-01 23:34:59,683] Trial 45 finished with value: 0.21533019389930166 and parameters: {'alpha': 21237.501336725916, 'n_pcs': 4000, 'iw_method': 'pc_logistic', 'iw_clip_max': 7.0, 'iw_prob_clip': 0.04224112740090698, 'iw_n_components': 60, 'iw_logistic_c': 0.045295849796393076, 'iw_pca_fit': 'combined', 'iw_solver': 'lbfgs', 'iw_rho': 0.85}. Best is trial 42 with value: 0.22412397147737737.
2026-06-01 23:34:59 | INFO | Trial 46 | outer=9 | alpha=5.619e+04 n_pcs=3500 (pc_topk) weight={'name': 'uniform'}
[I 2026-06-01 23:35:06,027] Trial 46 finished with value: 0.2218640679402891 and parameters: {'alpha': 56193.62384052709, 'n_pcs': 3500, 'iw_method': 'uniform'}. Best is trial 42 with value: 0.22412397147737737.
2026-06-01 23:35:06 | INFO | Trial 47 | outer=9 | alpha=2.873e+06 n_pcs=4500 (pc_topk) weight={'name': 'pc_logistic', 'floor': 1e-06, 'clip_max': 2.5, 'prob_clip': 0.010313737636672335, 'n_components': 40, 'logistic_c': 6.997300377953636, 'pca_fit': 'combined', 'solver': 'lbfgs', 'max_iter': 2000, 'fit_intercept': True, 'standardize_with_source': True, 'rho': 0.5}
[I 2026-06-01 23:35:27,638] Trial 47 finished with value: 0.2069589301183446 and parameters: {'alpha': 2872702.3699498684, 'n_pcs': 4500, 'iw_method': 'pc_logistic', 'iw_clip_max': 2.5, 'iw_prob_clip': 0.010313737636672335, 'iw_n_components': 40, 'iw_logistic_c': 6.997300377953636, 'iw_pca_fit': 'combined', 'iw_solver': 'lbfgs', 'iw_rho': 0.5}. Best is trial 42 with value: 0.22412397147737737.
2026-06-01 23:35:27 | INFO | Trial 48 | outer=9 | alpha=2.359e+04 n_pcs=2000 (pc_topk) weight={'name': 'uniform'}
[I 2026-06-01 23:35:31,564] Trial 48 finished with value: 0.2065502440052786 and parameters: {'alpha': 23586.22558077406, 'n_pcs': 2000, 'iw_method': 'uniform'}. Best is trial 42 with value: 0.22412397147737737.
2026-06-01 23:35:31 | INFO | Trial 49 | outer=9 | alpha=1.190e+04 n_pcs=4500 (pc_topk) weight={'name': 'uniform'}
[I 2026-06-01 23:35:40,542] Trial 49 finished with value: 0.21861528974764016 and parameters: {'alpha': 11897.524661393536, 'n_pcs': 4500, 'iw_method': 'uniform'}. Best is trial 42 with value: 0.22412397147737737.
2026-06-01 23:35:40 | INFO | Trial 50 | outer=9 | alpha=7.814e+03 n_pcs=4000 (pc_topk) weight={'name': 'pc_logistic', 'floor': 1e-06, 'clip_max': 4.0, 'prob_clip': 0.03589595231280895, 'n_components': 100, 'logistic_c': 1.0521084899151336e-07, 'pca_fit': 'combined', 'solver': 'lbfgs', 'max_iter': 2000, 'fit_intercept': True, 'standardize_with_source': True, 'rho': 0.85}
[I 2026-06-01 23:35:52,658] Trial 50 finished with value: 0.19796978289463768 and parameters: {'alpha': 7814.239157390958, 'n_pcs': 4000, 'iw_method': 'pc_logistic', 'iw_clip_max': 4.0, 'iw_prob_clip': 0.03589595231280895, 'iw_n_components': 100, 'iw_logistic_c': 1.0521084899151336e-07, 'iw_pca_fit': 'combined', 'iw_solver': 'lbfgs', 'iw_rho': 0.85}. Best is trial 42 with value: 0.22412397147737737.
2026-06-01 23:35:52 | INFO | Trial 51 | outer=9 | alpha=5.721e+04 n_pcs=5000 (pc_topk) weight={'name': 'uniform'}
[I 2026-06-01 23:36:03,063] Trial 51 finished with value: 0.2214534648765131 and parameters: {'alpha': 57213.7214520865, 'n_pcs': 5000, 'iw_method': 'uniform'}. Best is trial 42 with value: 0.22412397147737737.
2026-06-01 23:36:03 | INFO | Trial 52 | outer=9 | alpha=2.506e+04 n_pcs=4500 (pc_topk) weight={'name': 'uniform'}
[I 2026-06-01 23:36:11,824] Trial 52 finished with value: 0.2240952120531272 and parameters: {'alpha': 25057.89202541547, 'n_pcs': 4500, 'iw_method': 'uniform'}. Best is trial 42 with value: 0.22412397147737737.
2026-06-01 23:36:11 | INFO | Trial 53 | outer=9 | alpha=1.266e+04 n_pcs=4500 (pc_topk) weight={'name': 'uniform'}
[I 2026-06-01 23:36:20,706] Trial 53 finished with value: 0.21939527764273703 and parameters: {'alpha': 12662.401935276488, 'n_pcs': 4500, 'iw_method': 'uniform'}. Best is trial 42 with value: 0.22412397147737737.
2026-06-01 23:36:20 | INFO | Trial 54 | outer=9 | alpha=2.166e+04 n_pcs=4500 (pc_topk) weight={'name': 'uniform'}
[I 2026-06-01 23:36:29,507] Trial 54 finished with value: 0.2236293554232835 and parameters: {'alpha': 21664.442066285093, 'n_pcs': 4500, 'iw_method': 'uniform'}. Best is trial 42 with value: 0.22412397147737737.
2026-06-01 23:36:29 | INFO | Trial 55 | outer=9 | alpha=6.286e+03 n_pcs=4000 (pc_topk) weight={'name': 'uniform'}
[I 2026-06-01 23:36:36,608] Trial 55 finished with value: 0.19104262852277448 and parameters: {'alpha': 6286.444939340211, 'n_pcs': 4000, 'iw_method': 'uniform'}. Best is trial 42 with value: 0.22412397147737737.
2026-06-01 23:36:36 | INFO | Trial 56 | outer=9 | alpha=1.391e+04 n_pcs=4500 (pc_topk) weight={'name': 'uniform'}
[I 2026-06-01 23:36:45,435] Trial 56 finished with value: 0.2204522829796005 and parameters: {'alpha': 13912.657918875027, 'n_pcs': 4500, 'iw_method': 'uniform'}. Best is trial 42 with value: 0.22412397147737737.
2026-06-01 23:36:45 | INFO | Trial 57 | outer=9 | alpha=2.311e+04 n_pcs=3500 (pc_topk) weight={'name': 'uniform'}
[I 2026-06-01 23:36:51,630] Trial 57 finished with value: 0.21887503872424324 and parameters: {'alpha': 23114.565850221436, 'n_pcs': 3500, 'iw_method': 'uniform'}. Best is trial 42 with value: 0.22412397147737737.
2026-06-01 23:36:51 | INFO | Trial 58 | outer=9 | alpha=4.949e+04 n_pcs=3000 (pc_topk) weight={'name': 'uniform'}
