[I 2026-06-01 19:30:09,175] Trial 261 finished with value: 0.23472705991230863 and parameters: {'alpha': 32499.88785578934, 'n_pcs': 2000, 'iw_method': 'pc_logistic', 'iw_clip_max': 7.0, 'iw_prob_clip': 0.0023254553392048007, 'iw_n_components': 20, 'iw_logistic_c': 5.72454139321511e-05, 'iw_pca_fit': 'combined', 'iw_solver': 'lbfgs', 'iw_rho': 0.85}. Best is trial 216 with value: 0.25859517736085086.
2026-06-01 19:30:09 | INFO | Trial 262 | outer=5 | alpha=3.727e+04 n_pcs=4000 (pc_topk) weight={'name': 'pc_logistic', 'floor': 1e-06, 'clip_max': 7.0, 'prob_clip': 0.023630402827352192, 'n_components': 20, 'logistic_c': 3.635995700227061e-05, 'pca_fit': 'combined', 'solver': 'lbfgs', 'max_iter': 2000, 'fit_intercept': True, 'standardize_with_source': True, 'rho': 0.85}
[I 2026-06-01 19:30:21,802] Trial 262 finished with value: 0.2577248623967834 and parameters: {'alpha': 37268.52921331063, 'n_pcs': 4000, 'iw_method': 'pc_logistic', 'iw_clip_max': 7.0, 'iw_prob_clip': 0.023630402827352192, 'iw_n_components': 20, 'iw_logistic_c': 3.635995700227061e-05, 'iw_pca_fit': 'combined', 'iw_solver': 'lbfgs', 'iw_rho': 0.85}. Best is trial 216 with value: 0.25859517736085086.
2026-06-01 19:30:21 | INFO | Trial 263 | outer=5 | alpha=5.966e+04 n_pcs=4000 (pc_topk) weight={'name': 'pc_logistic', 'floor': 1e-06, 'clip_max': 7.0, 'prob_clip': 0.032092791772337446, 'n_components': 20, 'logistic_c': 5.861566384047269e-05, 'pca_fit': 'combined', 'solver': 'lbfgs', 'max_iter': 2000, 'fit_intercept': True, 'standardize_with_source': True, 'rho': 0.85}
[I 2026-06-01 19:30:35,065] Trial 263 finished with value: 0.2576960928379371 and parameters: {'alpha': 59655.92280551234, 'n_pcs': 4000, 'iw_method': 'pc_logistic', 'iw_clip_max': 7.0, 'iw_prob_clip': 0.032092791772337446, 'iw_n_components': 20, 'iw_logistic_c': 5.861566384047269e-05, 'iw_pca_fit': 'combined', 'iw_solver': 'lbfgs', 'iw_rho': 0.85}. Best is trial 216 with value: 0.25859517736085086.
2026-06-01 19:30:35 | INFO | Trial 264 | outer=5 | alpha=4.592e+04 n_pcs=2500 (pc_topk) weight={'name': 'pc_logistic', 'floor': 1e-06, 'clip_max': 12.0, 'prob_clip': 0.02861212956818056, 'n_components': 20, 'logistic_c': 2.6561929737125526e-05, 'pca_fit': 'combined', 'solver': 'lbfgs', 'max_iter': 2000, 'fit_intercept': True, 'standardize_with_source': True, 'rho': 0.85}
[I 2026-06-01 19:30:44,242] Trial 264 finished with value: 0.2492541702161882 and parameters: {'alpha': 45919.731102791346, 'n_pcs': 2500, 'iw_method': 'pc_logistic', 'iw_clip_max': 12.0, 'iw_prob_clip': 0.02861212956818056, 'iw_n_components': 20, 'iw_logistic_c': 2.6561929737125526e-05, 'iw_pca_fit': 'combined', 'iw_solver': 'lbfgs', 'iw_rho': 0.85}. Best is trial 216 with value: 0.25859517736085086.
2026-06-01 19:30:44 | INFO | Trial 265 | outer=5 | alpha=2.416e+04 n_pcs=4500 (pc_topk) weight={'name': 'pc_logistic', 'floor': 1e-06, 'clip_max': 7.0, 'prob_clip': 0.02552701465174411, 'n_components': 20, 'logistic_c': 1.751938338121579e-05, 'pca_fit': 'combined', 'solver': 'lbfgs', 'max_iter': 2000, 'fit_intercept': True, 'standardize_with_source': True, 'rho': 0.85}
[I 2026-06-01 19:30:59,262] Trial 265 finished with value: 0.25453272770777674 and parameters: {'alpha': 24161.91244008761, 'n_pcs': 4500, 'iw_method': 'pc_logistic', 'iw_clip_max': 7.0, 'iw_prob_clip': 0.02552701465174411, 'iw_n_components': 20, 'iw_logistic_c': 1.751938338121579e-05, 'iw_pca_fit': 'combined', 'iw_solver': 'lbfgs', 'iw_rho': 0.85}. Best is trial 216 with value: 0.25859517736085086.
2026-06-01 19:30:59 | INFO | Trial 266 | outer=5 | alpha=7.252e+04 n_pcs=4000 (pc_topk) weight={'name': 'pc_logistic', 'floor': 1e-06, 'clip_max': 7.0, 'prob_clip': 0.04241179106758069, 'n_components': 20, 'logistic_c': 4.1457274920010225e-05, 'pca_fit': 'combined', 'solver': 'lbfgs', 'max_iter': 2000, 'fit_intercept': True, 'standardize_with_source': True, 'rho': 0.85}
[I 2026-06-01 19:31:12,681] Trial 266 finished with value: 0.2559462000213776 and parameters: {'alpha': 72521.47771369983, 'n_pcs': 4000, 'iw_method': 'pc_logistic', 'iw_clip_max': 7.0, 'iw_prob_clip': 0.04241179106758069, 'iw_n_components': 20, 'iw_logistic_c': 4.1457274920010225e-05, 'iw_pca_fit': 'combined', 'iw_solver': 'lbfgs', 'iw_rho': 0.85}. Best is trial 216 with value: 0.25859517736085086.
2026-06-01 19:31:12 | INFO | Trial 267 | outer=5 | alpha=5.355e+05 n_pcs=4000 (pc_topk) weight={'name': 'pc_logistic', 'floor': 1e-06, 'clip_max': 7.0, 'prob_clip': 0.026935935908190874, 'n_components': 20, 'logistic_c': 6.49069461370194e-05, 'pca_fit': 'combined', 'solver': 'lbfgs', 'max_iter': 2000, 'fit_intercept': True, 'standardize_with_source': True, 'rho': 0.85}
[I 2026-06-01 19:31:25,596] Trial 267 finished with value: 0.23800575243539282 and parameters: {'alpha': 535547.0814065518, 'n_pcs': 4000, 'iw_method': 'pc_logistic', 'iw_clip_max': 7.0, 'iw_prob_clip': 0.026935935908190874, 'iw_n_components': 20, 'iw_logistic_c': 6.49069461370194e-05, 'iw_pca_fit': 'combined', 'iw_solver': 'lbfgs', 'iw_rho': 0.85}. Best is trial 216 with value: 0.25859517736085086.
2026-06-01 19:31:25 | INFO | Trial 268 | outer=5 | alpha=5.211e+04 n_pcs=4500 (pc_topk) weight={'name': 'pc_logistic', 'floor': 1e-06, 'clip_max': 7.0, 'prob_clip': 0.023318583467654568, 'n_components': 20, 'logistic_c': 3.256194798869524e-05, 'pca_fit': 'combined', 'solver': 'lbfgs', 'max_iter': 2000, 'fit_intercept': True, 'standardize_with_source': True, 'rho': 0.85}
[I 2026-06-01 19:31:40,996] Trial 268 finished with value: 0.2587260526062522 and parameters: {'alpha': 52108.610536557535, 'n_pcs': 4500, 'iw_method': 'pc_logistic', 'iw_clip_max': 7.0, 'iw_prob_clip': 0.023318583467654568, 'iw_n_components': 20, 'iw_logistic_c': 3.256194798869524e-05, 'iw_pca_fit': 'combined', 'iw_solver': 'lbfgs', 'iw_rho': 0.85}. Best is trial 268 with value: 0.2587260526062522.
2026-06-01 19:31:41 | INFO | Trial 269 | outer=5 | alpha=2.887e+04 n_pcs=4500 (pc_topk) weight={'name': 'pc_logistic', 'floor': 1e-06, 'clip_max': 7.0, 'prob_clip': 0.030765453074079595, 'n_components': 20, 'logistic_c': 2.4994240257150588e-05, 'pca_fit': 'combined', 'solver': 'lbfgs', 'max_iter': 2000, 'fit_intercept': True, 'standardize_with_source': True, 'rho': 0.3}
[I 2026-06-01 19:31:54,626] Trial 269 finished with value: 0.25259559787819164 and parameters: {'alpha': 28865.102186119504, 'n_pcs': 4500, 'iw_method': 'pc_logistic', 'iw_clip_max': 7.0, 'iw_prob_clip': 0.030765453074079595, 'iw_n_components': 20, 'iw_logistic_c': 2.4994240257150588e-05, 'iw_pca_fit': 'combined', 'iw_solver': 'lbfgs', 'iw_rho': 0.3}. Best is trial 268 with value: 0.2587260526062522.
2026-06-01 19:31:54 | INFO | Trial 270 | outer=5 | alpha=4.826e+04 n_pcs=4500 (pc_topk) weight={'name': 'pc_logistic', 'floor': 1e-06, 'clip_max': 7.0, 'prob_clip': 0.035765903823625024, 'n_components': 20, 'logistic_c': 1.1216906901149686e-05, 'pca_fit': 'combined', 'solver': 'lbfgs', 'max_iter': 2000, 'fit_intercept': True, 'standardize_with_source': True, 'rho': 0.85}
[I 2026-06-01 19:32:08,460] Trial 270 finished with value: 0.25298389047052516 and parameters: {'alpha': 48263.14706710022, 'n_pcs': 4500, 'iw_method': 'pc_logistic', 'iw_clip_max': 7.0, 'iw_prob_clip': 0.035765903823625024, 'iw_n_components': 20, 'iw_logistic_c': 1.1216906901149686e-05, 'iw_pca_fit': 'combined', 'iw_solver': 'lbfgs', 'iw_rho': 0.85}. Best is trial 268 with value: 0.2587260526062522.
2026-06-01 19:32:08 | INFO | Trial 271 | outer=5 | alpha=3.679e+04 n_pcs=4500 (pc_topk) weight={'name': 'pc_logistic', 'floor': 1e-06, 'clip_max': 1.5, 'prob_clip': 0.02441832460414005, 'n_components': 20, 'logistic_c': 3.4114286579305505e-05, 'pca_fit': 'combined', 'solver': 'lbfgs', 'max_iter': 2000, 'fit_intercept': True, 'standardize_with_source': True, 'rho': 0.85}
[I 2026-06-01 19:32:22,367] Trial 271 finished with value: 0.25054669478469327 and parameters: {'alpha': 36790.650810100735, 'n_pcs': 4500, 'iw_method': 'pc_logistic', 'iw_clip_max': 1.5, 'iw_prob_clip': 0.02441832460414005, 'iw_n_components': 20, 'iw_logistic_c': 3.4114286579305505e-05, 'iw_pca_fit': 'combined', 'iw_solver': 'lbfgs', 'iw_rho': 0.85}. Best is trial 268 with value: 0.2587260526062522.
2026-06-01 19:32:22 | INFO | Trial 272 | outer=5 | alpha=4.221e+04 n_pcs=4500 (pc_topk) weight={'name': 'pc_logistic', 'floor': 1e-06, 'clip_max': 7.0, 'prob_clip': 0.02734843604147649, 'n_components': 20, 'logistic_c': 1.858955805602822e-05, 'pca_fit': 'combined', 'solver': 'lbfgs', 'max_iter': 2000, 'fit_intercept': True, 'standardize_with_source': True, 'rho': 0.85}
[I 2026-06-01 19:32:36,700] Trial 272 finished with value: 0.25663791616630066 and parameters: {'alpha': 42213.00138516561, 'n_pcs': 4500, 'iw_method': 'pc_logistic', 'iw_clip_max': 7.0, 'iw_prob_clip': 0.02734843604147649, 'iw_n_components': 20, 'iw_logistic_c': 1.858955805602822e-05, 'iw_pca_fit': 'combined', 'iw_solver': 'lbfgs', 'iw_rho': 0.85}. Best is trial 268 with value: 0.2587260526062522.
2026-06-01 19:32:36 | INFO | Trial 273 | outer=5 | alpha=5.263e+04 n_pcs=3000 (pc_topk) weight={'name': 'pc_logistic', 'floor': 1e-06, 'clip_max': 7.0, 'prob_clip': 0.029209585774856217, 'n_components': 60, 'logistic_c': 2.9513221310214597e-05, 'pca_fit': 'combined', 'solver': 'lbfgs', 'max_iter': 2000, 'fit_intercept': True, 'standardize_with_source': True, 'rho': 0.85}
[I 2026-06-01 19:32:47,909] Trial 273 finished with value: 0.25455295973329745 and parameters: {'alpha': 52631.80446036949, 'n_pcs': 3000, 'iw_method': 'pc_logistic', 'iw_clip_max': 7.0, 'iw_prob_clip': 0.029209585774856217, 'iw_n_components': 60, 'iw_logistic_c': 2.9513221310214597e-05, 'iw_pca_fit': 'combined', 'iw_solver': 'lbfgs', 'iw_rho': 0.85}. Best is trial 268 with value: 0.2587260526062522.
2026-06-01 19:32:47 | INFO | Trial 274 | outer=5 | alpha=3.817e+04 n_pcs=4500 (pc_topk) weight={'name': 'pc_logistic', 'floor': 1e-06, 'clip_max': 2.5, 'prob_clip': 0.03362341841199252, 'n_components': 20, 'logistic_c': 4.150408842785236e-05, 'pca_fit': 'combined', 'solver': 'lbfgs', 'max_iter': 2000, 'fit_intercept': True, 'standardize_with_source': True, 'rho': 0.85}
[I 2026-06-01 19:33:02,140] Trial 274 finished with value: 0.25571211334307126 and parameters: {'alpha': 38172.474875892185, 'n_pcs': 4500, 'iw_method': 'pc_logistic', 'iw_clip_max': 2.5, 'iw_prob_clip': 0.03362341841199252, 'iw_n_components': 20, 'iw_logistic_c': 4.150408842785236e-05, 'iw_pca_fit': 'combined', 'iw_solver': 'lbfgs', 'iw_rho': 0.85}. Best is trial 268 with value: 0.2587260526062522.
2026-06-01 19:33:02 | INFO | Trial 275 | outer=5 | alpha=5.498e+04 n_pcs=3500 (pc_topk) weight={'name': 'pc_logistic', 'floor': 1e-06, 'clip_max': 7.0, 'prob_clip': 0.02298185852678023, 'n_components': 20, 'logistic_c': 6.712826687632144e-05, 'pca_fit': 'combined', 'solver': 'lbfgs', 'max_iter': 2000, 'fit_intercept': True, 'standardize_with_source': True, 'rho': 0.85}
[I 2026-06-01 19:33:12,145] Trial 275 finished with value: 0.2535979643922598 and parameters: {'alpha': 54984.28320772216, 'n_pcs': 3500, 'iw_method': 'pc_logistic', 'iw_clip_max': 7.0, 'iw_prob_clip': 0.02298185852678023, 'iw_n_components': 20, 'iw_logistic_c': 6.712826687632144e-05, 'iw_pca_fit': 'combined', 'iw_solver': 'lbfgs', 'iw_rho': 0.85}. Best is trial 268 with value: 0.2587260526062522.
2026-06-01 19:33:12 | INFO | Trial 276 | outer=5 | alpha=7.737e+04 n_pcs=4500 (pc_topk) weight={'name': 'pc_logistic', 'floor': 1e-06, 'clip_max': 7.0, 'prob_clip': 0.02546739116053065, 'n_components': 20, 'logistic_c': 1.9814035501631146e-05, 'pca_fit': 'combined', 'solver': 'lbfgs', 'max_iter': 2000, 'fit_intercept': True, 'standardize_with_source': True, 'rho': 0.85}
[I 2026-06-01 19:33:26,775] Trial 276 finished with value: 0.2552274275797977 and parameters: {'alpha': 77373.65029043554, 'n_pcs': 4500, 'iw_method': 'pc_logistic', 'iw_clip_max': 7.0, 'iw_prob_clip': 0.02546739116053065, 'iw_n_components': 20, 'iw_logistic_c': 1.9814035501631146e-05, 'iw_pca_fit': 'combined', 'iw_solver': 'lbfgs', 'iw_rho': 0.85}. Best is trial 268 with value: 0.2587260526062522.
2026-06-01 19:33:26 | INFO | Trial 277 | outer=5 | alpha=4.583e+04 n_pcs=5000 (pc_topk) weight={'name': 'uniform'}
[I 2026-06-01 19:33:36,981] Trial 277 finished with value: 0.24022422769822663 and parameters: {'alpha': 45828.447129472086, 'n_pcs': 5000, 'iw_method': 'uniform'}. Best is trial 268 with value: 0.2587260526062522.
2026-06-01 19:33:37 | INFO | Trial 278 | outer=5 | alpha=3.341e+04 n_pcs=4000 (pc_topk) weight={'name': 'pc_logistic', 'floor': 1e-06, 'clip_max': 7.0, 'prob_clip': 0.03141105413089007, 'n_components': 20, 'logistic_c': 3.176866432675904e-05, 'pca_fit': 'combined', 'solver': 'lbfgs', 'max_iter': 2000, 'fit_intercept': True, 'standardize_with_source': True, 'rho': 0.85}
[I 2026-06-01 19:33:49,081] Trial 278 finished with value: 0.2574181954439216 and parameters: {'alpha': 33405.40752138004, 'n_pcs': 4000, 'iw_method': 'pc_logistic', 'iw_clip_max': 7.0, 'iw_prob_clip': 0.03141105413089007, 'iw_n_components': 20, 'iw_logistic_c': 3.176866432675904e-05, 'iw_pca_fit': 'combined', 'iw_solver': 'lbfgs', 'iw_rho': 0.85}. Best is trial 268 with value: 0.2587260526062522.
2026-06-01 19:33:49 | INFO | Trial 279 | outer=5 | alpha=6.432e+04 n_pcs=4000 (pc_topk) weight={'name': 'pc_logistic', 'floor': 1e-06, 'clip_max': 7.0, 'prob_clip': 0.027779676549444996, 'n_components': 10, 'logistic_c': 4.177132915673001e-05, 'pca_fit': 'combined', 'solver': 'lbfgs', 'max_iter': 2000, 'fit_intercept': True, 'standardize_with_source': True, 'rho': 0.85}
[I 2026-06-01 19:34:01,963] Trial 279 finished with value: 0.25170087795549556 and parameters: {'alpha': 64320.36842670181, 'n_pcs': 4000, 'iw_method': 'pc_logistic', 'iw_clip_max': 7.0, 'iw_prob_clip': 0.027779676549444996, 'iw_n_components': 10, 'iw_logistic_c': 4.177132915673001e-05, 'iw_pca_fit': 'combined', 'iw_solver': 'lbfgs', 'iw_rho': 0.85}. Best is trial 268 with value: 0.2587260526062522.
2026-06-01 19:34:02 | INFO | Trial 280 | outer=5 | alpha=4.291e+04 n_pcs=4500 (pc_topk) weight={'name': 'pc_logistic', 'floor': 1e-06, 'clip_max': 7.0, 'prob_clip': 0.02296000976056522, 'n_components': 20, 'logistic_c': 0.046210543784097016, 'pca_fit': 'combined', 'solver': 'lbfgs', 'max_iter': 2000, 'fit_intercept': True, 'standardize_with_source': True, 'rho': 0.85}
[I 2026-06-01 19:34:21,043] Trial 280 finished with value: 0.2513918386055961 and parameters: {'alpha': 42912.575119618414, 'n_pcs': 4500, 'iw_method': 'pc_logistic', 'iw_clip_max': 7.0, 'iw_prob_clip': 0.02296000976056522, 'iw_n_components': 20, 'iw_logistic_c': 0.046210543784097016, 'iw_pca_fit': 'combined', 'iw_solver': 'lbfgs', 'iw_rho': 0.85}. Best is trial 268 with value: 0.2587260526062522.
2026-06-01 19:34:21 | INFO | Trial 281 | outer=5 | alpha=5.281e+04 n_pcs=4000 (pc_topk) weight={'name': 'pc_logistic', 'floor': 1e-06, 'clip_max': 7.0, 'prob_clip': 0.029384921065876153, 'n_components': 20, 'logistic_c': 2.6805914177535604e-05, 'pca_fit': 'combined', 'solver': 'lbfgs', 'max_iter': 2000, 'fit_intercept': True, 'standardize_with_source': True, 'rho': 0.85}
[I 2026-06-01 19:34:33,745] Trial 281 finished with value: 0.25801292966834116 and parameters: {'alpha': 52814.166629277264, 'n_pcs': 4000, 'iw_method': 'pc_logistic', 'iw_clip_max': 7.0, 'iw_prob_clip': 0.029384921065876153, 'iw_n_components': 20, 'iw_logistic_c': 2.6805914177535604e-05, 'iw_pca_fit': 'combined', 'iw_solver': 'lbfgs', 'iw_rho': 0.85}. Best is trial 268 with value: 0.2587260526062522.
2026-06-01 19:34:33 | INFO | Trial 282 | outer=5 | alpha=2.769e+04 n_pcs=4000 (pc_topk) weight={'name': 'pc_logistic', 'floor': 1e-06, 'clip_max': 7.0, 'prob_clip': 0.037642948925072514, 'n_components': 20, 'logistic_c': 4.023216033257952e-06, 'pca_fit': 'combined', 'solver': 'lbfgs', 'max_iter': 2000, 'fit_intercept': True, 'standardize_with_source': True, 'rho': 1.0}
[I 2026-06-01 19:34:46,028] Trial 282 finished with value: 0.247996966773509 and parameters: {'alpha': 27687.91263760745, 'n_pcs': 4000, 'iw_method': 'pc_logistic', 'iw_clip_max': 7.0, 'iw_prob_clip': 0.037642948925072514, 'iw_n_components': 20, 'iw_logistic_c': 4.023216033257952e-06, 'iw_pca_fit': 'combined', 'iw_solver': 'lbfgs', 'iw_rho': 1.0}. Best is trial 268 with value: 0.2587260526062522.
2026-06-01 19:34:46 | INFO | Trial 283 | outer=5 | alpha=3.759e+04 n_pcs=4000 (pc_topk) weight={'name': 'pc_logistic', 'floor': 1e-06, 'clip_max': 7.0, 'prob_clip': 0.007218304679377469, 'n_components': 20, 'logistic_c': 7.64599656059854e-07, 'pca_fit': 'combined', 'solver': 'lbfgs', 'max_iter': 2000, 'fit_intercept': True, 'standardize_with_source': True, 'rho': 0.85}
[I 2026-06-01 19:34:58,862] Trial 283 finished with value: 0.24434689913155766 and parameters: {'alpha': 37585.07648559163, 'n_pcs': 4000, 'iw_method': 'pc_logistic', 'iw_clip_max': 7.0, 'iw_prob_clip': 0.007218304679377469, 'iw_n_components': 20, 'iw_logistic_c': 7.64599656059854e-07, 'iw_pca_fit': 'combined', 'iw_solver': 'lbfgs', 'iw_rho': 0.85}. Best is trial 268 with value: 0.2587260526062522.
2026-06-01 19:34:58 | INFO | Trial 284 | outer=5 | alpha=5.149e+04 n_pcs=4000 (pc_topk) weight={'name': 'pc_logistic', 'floor': 1e-06, 'clip_max': 7.0, 'prob_clip': 0.03208454109290524, 'n_components': 20, 'logistic_c': 1.5538107526255457e-05, 'pca_fit': 'combined', 'solver': 'lbfgs', 'max_iter': 2000, 'fit_intercept': True, 'standardize_with_source': True, 'rho': 0.85}
[I 2026-06-01 19:35:11,373] Trial 284 finished with value: 0.2549857261222215 and parameters: {'alpha': 51488.4489176348, 'n_pcs': 4000, 'iw_method': 'pc_logistic', 'iw_clip_max': 7.0, 'iw_prob_clip': 0.03208454109290524, 'iw_n_components': 20, 'iw_logistic_c': 1.5538107526255457e-05, 'iw_pca_fit': 'combined', 'iw_solver': 'lbfgs', 'iw_rho': 0.85}. Best is trial 268 with value: 0.2587260526062522.
2026-06-01 19:35:11 | INFO | Trial 285 | outer=5 | alpha=6.669e+04 n_pcs=4000 (pc_topk) weight={'name': 'pc_logistic', 'floor': 1e-06, 'clip_max': 7.0, 'prob_clip': 0.028898973904083657, 'n_components': 20, 'logistic_c': 2.5494998907070555e-05, 'pca_fit': 'combined', 'solver': 'lbfgs', 'max_iter': 2000, 'fit_intercept': True, 'standardize_with_source': True, 'rho': 0.5}
[I 2026-06-01 19:35:24,398] Trial 285 finished with value: 0.25436562233288096 and parameters: {'alpha': 66685.20791961148, 'n_pcs': 4000, 'iw_method': 'pc_logistic', 'iw_clip_max': 7.0, 'iw_prob_clip': 0.028898973904083657, 'iw_n_components': 20, 'iw_logistic_c': 2.5494998907070555e-05, 'iw_pca_fit': 'combined', 'iw_solver': 'lbfgs', 'iw_rho': 0.5}. Best is trial 268 with value: 0.2587260526062522.
2026-06-01 19:35:24 | INFO | Trial 286 | outer=5 | alpha=3.202e+04 n_pcs=3500 (pc_topk) weight={'name': 'pc_logistic', 'floor': 1e-06, 'clip_max': 7.0, 'prob_clip': 0.025376847365919122, 'n_components': 20, 'logistic_c': 1.2294007716649383e-05, 'pca_fit': 'combined', 'solver': 'lbfgs', 'max_iter': 2000, 'fit_intercept': True, 'standardize_with_source': True, 'rho': 0.85}
[I 2026-06-01 19:35:36,388] Trial 286 finished with value: 0.24808592629537438 and parameters: {'alpha': 32020.681384165604, 'n_pcs': 3500, 'iw_method': 'pc_logistic', 'iw_clip_max': 7.0, 'iw_prob_clip': 0.025376847365919122, 'iw_n_components': 20, 'iw_logistic_c': 1.2294007716649383e-05, 'iw_pca_fit': 'combined', 'iw_solver': 'lbfgs', 'iw_rho': 0.85}. Best is trial 268 with value: 0.2587260526062522.
2026-06-01 19:35:36 | INFO | Trial 287 | outer=5 | alpha=4.335e+04 n_pcs=4000 (pc_topk) weight={'name': 'pc_logistic', 'floor': 1e-06, 'clip_max': 7.0, 'prob_clip': 0.03138410054957903, 'n_components': 20, 'logistic_c': 2.3368672960956906e-05, 'pca_fit': 'combined', 'solver': 'lbfgs', 'max_iter': 2000, 'fit_intercept': True, 'standardize_with_source': True, 'rho': 0.85}
[I 2026-06-01 19:35:48,814] Trial 287 finished with value: 0.25726157070713657 and parameters: {'alpha': 43347.018732357974, 'n_pcs': 4000, 'iw_method': 'pc_logistic', 'iw_clip_max': 7.0, 'iw_prob_clip': 0.03138410054957903, 'iw_n_components': 20, 'iw_logistic_c': 2.3368672960956906e-05, 'iw_pca_fit': 'combined', 'iw_solver': 'lbfgs', 'iw_rho': 0.85}. Best is trial 268 with value: 0.2587260526062522.
2026-06-01 19:35:48 | INFO | Trial 288 | outer=5 | alpha=8.718e+04 n_pcs=4500 (pc_topk) weight={'name': 'pc_logistic', 'floor': 1e-06, 'clip_max': 12.0, 'prob_clip': 0.03466193660767975, 'n_components': 20, 'logistic_c': 4.093002574339146e-05, 'pca_fit': 'combined', 'solver': 'lbfgs', 'max_iter': 2000, 'fit_intercept': True, 'standardize_with_source': True, 'rho': 0.85}
[I 2026-06-01 19:36:03,559] Trial 288 finished with value: 0.2537954328043258 and parameters: {'alpha': 87182.02223404279, 'n_pcs': 4500, 'iw_method': 'pc_logistic', 'iw_clip_max': 12.0, 'iw_prob_clip': 0.03466193660767975, 'iw_n_components': 20, 'iw_logistic_c': 4.093002574339146e-05, 'iw_pca_fit': 'combined', 'iw_solver': 'lbfgs', 'iw_rho': 0.85}. Best is trial 268 with value: 0.2587260526062522.
2026-06-01 19:36:03 | INFO | Trial 289 | outer=5 | alpha=5.961e+04 n_pcs=4000 (pc_topk) weight={'name': 'pc_logistic', 'floor': 1e-06, 'clip_max': 7.0, 'prob_clip': 0.029145091608899776, 'n_components': 20, 'logistic_c': 3.051243333819714e-05, 'pca_fit': 'combined', 'solver': 'lbfgs', 'max_iter': 2000, 'fit_intercept': True, 'standardize_with_source': True, 'rho': 0.85}
