[I 2026-05-31 23:06:00,413] Trial 242 finished with value: 0.2607471673613224 and parameters: {'alpha': 159950.03032992428, 'n_pcs': 4000, 'weight_scheme': 'exponential', 'weight_clip_max': 3.0, 'weight_exponential_beta': 9.458540325294148}. Best is trial 232 with value: 0.2607490501447128.
2026-05-31 23:06:00 | INFO | src.nested_cv_avggrm_weighted_unified | Trial 243 | outer=1 | alpha=2.016e+05 n_pcs=4000 (pc_topk) weight_search=on
2026-05-31 23:06:00 | INFO | src.nested_cv_avggrm_weighted_unified | Trial 243 | outer=1 | weight={'name': 'exponential', 'floor': 1e-06, 'clip_max': 3.0, 'beta': 9.442650786557618}
[I 2026-05-31 23:06:06,138] Trial 243 finished with value: 0.2605730664271589 and parameters: {'alpha': 201622.97435806144, 'n_pcs': 4000, 'weight_scheme': 'exponential', 'weight_clip_max': 3.0, 'weight_exponential_beta': 9.442650786557618}. Best is trial 232 with value: 0.2607490501447128.
2026-05-31 23:06:06 | INFO | src.nested_cv_avggrm_weighted_unified | Trial 244 | outer=1 | alpha=1.291e+05 n_pcs=4000 (pc_topk) weight_search=on
2026-05-31 23:06:06 | INFO | src.nested_cv_avggrm_weighted_unified | Trial 244 | outer=1 | weight={'name': 'exponential', 'floor': 1e-06, 'clip_max': 3.0, 'beta': 9.590262004967748}
[I 2026-05-31 23:06:11,852] Trial 244 finished with value: 0.2604954328994637 and parameters: {'alpha': 129094.95347249776, 'n_pcs': 4000, 'weight_scheme': 'exponential', 'weight_clip_max': 3.0, 'weight_exponential_beta': 9.590262004967748}. Best is trial 232 with value: 0.2607490501447128.
2026-05-31 23:06:11 | INFO | src.nested_cv_avggrm_weighted_unified | Trial 245 | outer=1 | alpha=1.687e+05 n_pcs=4000 (pc_topk) weight_search=on
2026-05-31 23:06:11 | INFO | src.nested_cv_avggrm_weighted_unified | Trial 245 | outer=1 | weight={'name': 'exponential', 'floor': 1e-06, 'clip_max': None, 'beta': 9.427513998136646}
[I 2026-05-31 23:06:17,547] Trial 245 finished with value: 0.2316404304606471 and parameters: {'alpha': 168715.20843935548, 'n_pcs': 4000, 'weight_scheme': 'exponential', 'weight_clip_max': None, 'weight_exponential_beta': 9.427513998136646}. Best is trial 232 with value: 0.2607490501447128.
2026-05-31 23:06:17 | INFO | src.nested_cv_avggrm_weighted_unified | Trial 246 | outer=1 | alpha=2.079e+05 n_pcs=2500 (pc_topk) weight_search=on
2026-05-31 23:06:17 | INFO | src.nested_cv_avggrm_weighted_unified | Trial 246 | outer=1 | weight={'name': 'exponential', 'floor': 1e-06, 'clip_max': 3.0, 'beta': 9.840483499116441}
[I 2026-05-31 23:06:20,484] Trial 246 finished with value: 0.25531611272424526 and parameters: {'alpha': 207858.3163336981, 'n_pcs': 2500, 'weight_scheme': 'exponential', 'weight_clip_max': 3.0, 'weight_exponential_beta': 9.840483499116441}. Best is trial 232 with value: 0.2607490501447128.
2026-05-31 23:06:20 | INFO | src.nested_cv_avggrm_weighted_unified | Trial 247 | outer=1 | alpha=1.431e+05 n_pcs=4000 (pc_topk) weight_search=on
2026-05-31 23:06:20 | INFO | src.nested_cv_avggrm_weighted_unified | Trial 247 | outer=1 | weight={'name': 'exponential', 'floor': 1e-06, 'clip_max': 3.0, 'beta': 9.597044234870296}
[I 2026-05-31 23:06:26,214] Trial 247 finished with value: 0.26066009713846056 and parameters: {'alpha': 143076.334210929, 'n_pcs': 4000, 'weight_scheme': 'exponential', 'weight_clip_max': 3.0, 'weight_exponential_beta': 9.597044234870296}. Best is trial 232 with value: 0.2607490501447128.
2026-05-31 23:06:26 | INFO | src.nested_cv_avggrm_weighted_unified | Trial 248 | outer=1 | alpha=1.159e+05 n_pcs=4000 (pc_topk) weight_search=on
2026-05-31 23:06:26 | INFO | src.nested_cv_avggrm_weighted_unified | Trial 248 | outer=1 | weight={'name': 'exponential', 'floor': 1e-06, 'clip_max': 3.0, 'beta': 9.118036221456126}
[I 2026-05-31 23:06:31,954] Trial 248 finished with value: 0.26025157942366334 and parameters: {'alpha': 115863.19730735983, 'n_pcs': 4000, 'weight_scheme': 'exponential', 'weight_clip_max': 3.0, 'weight_exponential_beta': 9.118036221456126}. Best is trial 232 with value: 0.2607490501447128.
2026-05-31 23:06:31 | INFO | src.nested_cv_avggrm_weighted_unified | Trial 249 | outer=1 | alpha=1.796e+05 n_pcs=4000 (pc_topk) weight_search=on
2026-05-31 23:06:31 | INFO | src.nested_cv_avggrm_weighted_unified | Trial 249 | outer=1 | weight={'name': 'exponential', 'floor': 1e-06, 'clip_max': 3.0, 'beta': 9.455514409445678}
[I 2026-05-31 23:06:37,683] Trial 249 finished with value: 0.26071254333266614 and parameters: {'alpha': 179605.41107669228, 'n_pcs': 4000, 'weight_scheme': 'exponential', 'weight_clip_max': 3.0, 'weight_exponential_beta': 9.455514409445678}. Best is trial 232 with value: 0.2607490501447128.
2026-05-31 23:06:37 | INFO | src.nested_cv_avggrm_weighted_unified | Trial 250 | outer=1 | alpha=1.541e+05 n_pcs=4000 (pc_topk) weight_search=on
2026-05-31 23:06:37 | INFO | src.nested_cv_avggrm_weighted_unified | Trial 250 | outer=1 | weight={'name': 'exponential', 'floor': 1e-06, 'clip_max': 10.0, 'beta': 9.419422390653281}
[I 2026-05-31 23:06:43,412] Trial 250 finished with value: 0.25386557429899825 and parameters: {'alpha': 154082.2841049678, 'n_pcs': 4000, 'weight_scheme': 'exponential', 'weight_clip_max': 10.0, 'weight_exponential_beta': 9.419422390653281}. Best is trial 232 with value: 0.2607490501447128.
2026-05-31 23:06:43 | INFO | src.nested_cv_avggrm_weighted_unified | Trial 251 | outer=1 | alpha=2.138e+05 n_pcs=4000 (pc_topk) weight_search=on
2026-05-31 23:06:43 | INFO | src.nested_cv_avggrm_weighted_unified | Trial 251 | outer=1 | weight={'name': 'exponential', 'floor': 1e-06, 'clip_max': 3.0, 'beta': 9.99624300816106}
[I 2026-05-31 23:06:49,133] Trial 251 finished with value: 0.26032251299732145 and parameters: {'alpha': 213789.2622162002, 'n_pcs': 4000, 'weight_scheme': 'exponential', 'weight_clip_max': 3.0, 'weight_exponential_beta': 9.99624300816106}. Best is trial 232 with value: 0.2607490501447128.
2026-05-31 23:06:49 | INFO | src.nested_cv_avggrm_weighted_unified | Trial 252 | outer=1 | alpha=2.473e+05 n_pcs=4000 (pc_topk) weight_search=on
2026-05-31 23:06:49 | INFO | src.nested_cv_avggrm_weighted_unified | Trial 252 | outer=1 | weight={'name': 'exponential', 'floor': 1e-06, 'clip_max': 3.0, 'beta': 2.2349930663633417}
2026-05-31 23:06:53 | INFO | src.nested_cv_avggrm_weighted_unified | Trial 252 | outer=1 | pruned after 7/10 inner folds (mean r=0.2860)
[I 2026-05-31 23:06:53,157] Trial 252 pruned. 
2026-05-31 23:06:53 | INFO | src.nested_cv_avggrm_weighted_unified | Trial 253 | outer=1 | alpha=8.859e+04 n_pcs=4000 (pc_topk) weight_search=on
2026-05-31 23:06:53 | INFO | src.nested_cv_avggrm_weighted_unified | Trial 253 | outer=1 | weight={'name': 'exponential', 'floor': 1e-06, 'clip_max': 20.0, 'beta': 9.42168810289871}
[I 2026-05-31 23:06:58,880] Trial 253 finished with value: 0.2483939501671178 and parameters: {'alpha': 88586.69452751012, 'n_pcs': 4000, 'weight_scheme': 'exponential', 'weight_clip_max': 20.0, 'weight_exponential_beta': 9.42168810289871}. Best is trial 232 with value: 0.2607490501447128.
2026-05-31 23:06:58 | INFO | src.nested_cv_avggrm_weighted_unified | Trial 254 | outer=1 | alpha=1.760e+05 n_pcs=4000 (pc_topk) weight_search=on
2026-05-31 23:06:58 | INFO | src.nested_cv_avggrm_weighted_unified | Trial 254 | outer=1 | weight={'name': 'exponential', 'floor': 1e-06, 'clip_max': 3.0, 'beta': 9.105934394553843}
[I 2026-05-31 23:07:04,606] Trial 254 finished with value: 0.2606050931785244 and parameters: {'alpha': 175997.04978687048, 'n_pcs': 4000, 'weight_scheme': 'exponential', 'weight_clip_max': 3.0, 'weight_exponential_beta': 9.105934394553843}. Best is trial 232 with value: 0.2607490501447128.
2026-05-31 23:07:04 | INFO | src.nested_cv_avggrm_weighted_unified | Trial 255 | outer=1 | alpha=1.229e+05 n_pcs=4000 (pc_topk) weight_search=on
2026-05-31 23:07:04 | INFO | src.nested_cv_avggrm_weighted_unified | Trial 255 | outer=1 | weight={'name': 'exponential', 'floor': 1e-06, 'clip_max': 3.0, 'beta': 9.630264053295262}
[I 2026-05-31 23:07:10,332] Trial 255 finished with value: 0.26036661451600435 and parameters: {'alpha': 122851.82401006129, 'n_pcs': 4000, 'weight_scheme': 'exponential', 'weight_clip_max': 3.0, 'weight_exponential_beta': 9.630264053295262}. Best is trial 232 with value: 0.2607490501447128.
2026-05-31 23:07:10 | INFO | src.nested_cv_avggrm_weighted_unified | Trial 256 | outer=1 | alpha=1.460e+05 n_pcs=3500 (pc_topk) weight_search=on
2026-05-31 23:07:10 | INFO | src.nested_cv_avggrm_weighted_unified | Trial 256 | outer=1 | weight={'name': 'linear', 'floor': 1e-06, 'clip_max': 3.0, 'min_weight': 0.2197877666830491, 'max_weight': 4.276305486270456}
[I 2026-05-31 23:07:15,225] Trial 256 finished with value: 0.25338701528769747 and parameters: {'alpha': 145992.60534789966, 'n_pcs': 3500, 'weight_scheme': 'linear', 'weight_clip_max': 3.0, 'weight_linear_min_weight': 0.2197877666830491, 'weight_linear_max_weight': 4.276305486270456}. Best is trial 232 with value: 0.2607490501447128.
2026-05-31 23:07:15 | INFO | src.nested_cv_avggrm_weighted_unified | Trial 257 | outer=1 | alpha=2.051e+05 n_pcs=4000 (pc_topk) weight_search=on
2026-05-31 23:07:15 | INFO | src.nested_cv_avggrm_weighted_unified | Trial 257 | outer=1 | weight={'name': 'exponential', 'floor': 1e-06, 'clip_max': 3.0, 'beta': 9.636908888948772}
[I 2026-05-31 23:07:20,971] Trial 257 finished with value: 0.2605589272657673 and parameters: {'alpha': 205079.5481086545, 'n_pcs': 4000, 'weight_scheme': 'exponential', 'weight_clip_max': 3.0, 'weight_exponential_beta': 9.636908888948772}. Best is trial 232 with value: 0.2607490501447128.
2026-05-31 23:07:20 | INFO | src.nested_cv_avggrm_weighted_unified | Trial 258 | outer=1 | alpha=1.634e+05 n_pcs=4000 (pc_topk) weight_search=on
2026-05-31 23:07:20 | INFO | src.nested_cv_avggrm_weighted_unified | Trial 258 | outer=1 | weight={'name': 'uniform', 'floor': 1e-06, 'clip_max': 3.0}
2026-05-31 23:07:23 | INFO | src.nested_cv_avggrm_weighted_unified | Trial 258 | outer=1 | pruned after 6/10 inner folds (mean r=0.2430)
[I 2026-05-31 23:07:23,910] Trial 258 pruned. 
2026-05-31 23:07:23 | INFO | src.nested_cv_avggrm_weighted_unified | Trial 259 | outer=1 | alpha=2.506e+05 n_pcs=4000 (pc_topk) weight_search=on
2026-05-31 23:07:23 | INFO | src.nested_cv_avggrm_weighted_unified | Trial 259 | outer=1 | weight={'name': 'exponential', 'floor': 1e-06, 'clip_max': 3.0, 'beta': 9.408756201236146}
[I 2026-05-31 23:07:29,632] Trial 259 finished with value: 0.2600426720736002 and parameters: {'alpha': 250562.1695824391, 'n_pcs': 4000, 'weight_scheme': 'exponential', 'weight_clip_max': 3.0, 'weight_exponential_beta': 9.408756201236146}. Best is trial 232 with value: 0.2607490501447128.
2026-05-31 23:07:29 | INFO | src.nested_cv_avggrm_weighted_unified | Trial 260 | outer=1 | alpha=1.050e+05 n_pcs=4000 (pc_topk) weight_search=on
2026-05-31 23:07:29 | INFO | src.nested_cv_avggrm_weighted_unified | Trial 260 | outer=1 | weight={'name': 'exponential', 'floor': 1e-06, 'clip_max': 3.0, 'beta': 9.848715691944804}
[I 2026-05-31 23:07:35,376] Trial 260 finished with value: 0.25970893705156495 and parameters: {'alpha': 105047.81707934997, 'n_pcs': 4000, 'weight_scheme': 'exponential', 'weight_clip_max': 3.0, 'weight_exponential_beta': 9.848715691944804}. Best is trial 232 with value: 0.2607490501447128.
2026-05-31 23:07:35 | INFO | src.nested_cv_avggrm_weighted_unified | Trial 261 | outer=1 | alpha=1.955e+05 n_pcs=4000 (pc_topk) weight_search=on
2026-05-31 23:07:35 | INFO | src.nested_cv_avggrm_weighted_unified | Trial 261 | outer=1 | weight={'name': 'exponential', 'floor': 1e-06, 'clip_max': 3.0, 'beta': 9.595966987202688}
[I 2026-05-31 23:07:41,108] Trial 261 finished with value: 0.2606326105873305 and parameters: {'alpha': 195509.97581868348, 'n_pcs': 4000, 'weight_scheme': 'exponential', 'weight_clip_max': 3.0, 'weight_exponential_beta': 9.595966987202688}. Best is trial 232 with value: 0.2607490501447128.
2026-05-31 23:07:41 | INFO | src.nested_cv_avggrm_weighted_unified | Trial 262 | outer=1 | alpha=1.344e+05 n_pcs=4000 (pc_topk) weight_search=on
2026-05-31 23:07:41 | INFO | src.nested_cv_avggrm_weighted_unified | Trial 262 | outer=1 | weight={'name': 'exponential', 'floor': 1e-06, 'clip_max': 3.0, 'beta': 9.222560675043022}
[I 2026-05-31 23:07:46,842] Trial 262 finished with value: 0.2605792312090298 and parameters: {'alpha': 134366.5607426534, 'n_pcs': 4000, 'weight_scheme': 'exponential', 'weight_clip_max': 3.0, 'weight_exponential_beta': 9.222560675043022}. Best is trial 232 with value: 0.2607490501447128.
2026-05-31 23:07:46 | INFO | src.nested_cv_avggrm_weighted_unified | Trial 263 | outer=1 | alpha=1.713e+05 n_pcs=3500 (pc_topk) weight_search=on
2026-05-31 23:07:46 | INFO | src.nested_cv_avggrm_weighted_unified | Trial 263 | outer=1 | weight={'name': 'exponential', 'floor': 1e-06, 'clip_max': 3.0, 'beta': 9.820220452098106}
[I 2026-05-31 23:07:51,736] Trial 263 finished with value: 0.25916239867211865 and parameters: {'alpha': 171314.57610185782, 'n_pcs': 3500, 'weight_scheme': 'exponential', 'weight_clip_max': 3.0, 'weight_exponential_beta': 9.820220452098106}. Best is trial 232 with value: 0.2607490501447128.
2026-05-31 23:07:51 | INFO | src.nested_cv_avggrm_weighted_unified | Trial 264 | outer=1 | alpha=2.098e+05 n_pcs=4000 (pc_topk) weight_search=on
2026-05-31 23:07:51 | INFO | src.nested_cv_avggrm_weighted_unified | Trial 264 | outer=1 | weight={'name': 'exponential', 'floor': 1e-06, 'clip_max': 3.0, 'beta': 9.384272826255941}
[I 2026-05-31 23:07:57,464] Trial 264 finished with value: 0.26048883350455776 and parameters: {'alpha': 209799.62473302154, 'n_pcs': 4000, 'weight_scheme': 'exponential', 'weight_clip_max': 3.0, 'weight_exponential_beta': 9.384272826255941}. Best is trial 232 with value: 0.2607490501447128.
2026-05-31 23:07:57 | INFO | src.nested_cv_avggrm_weighted_unified | Trial 265 | outer=1 | alpha=1.476e+05 n_pcs=4000 (pc_topk) weight_search=on
2026-05-31 23:07:57 | INFO | src.nested_cv_avggrm_weighted_unified | Trial 265 | outer=1 | weight={'name': 'exponential', 'floor': 1e-06, 'clip_max': 3.0, 'beta': 9.644949806108638}
[I 2026-05-31 23:08:03,201] Trial 265 finished with value: 0.2606794440780048 and parameters: {'alpha': 147588.5031484739, 'n_pcs': 4000, 'weight_scheme': 'exponential', 'weight_clip_max': 3.0, 'weight_exponential_beta': 9.644949806108638}. Best is trial 232 with value: 0.2607490501447128.
2026-05-31 23:08:03 | INFO | src.nested_cv_avggrm_weighted_unified | Trial 266 | outer=1 | alpha=1.212e+05 n_pcs=4000 (pc_topk) weight_search=on
2026-05-31 23:08:03 | INFO | src.nested_cv_avggrm_weighted_unified | Trial 266 | outer=1 | weight={'name': 'exponential', 'floor': 1e-06, 'clip_max': 3.0, 'beta': 9.019382114357391}
[I 2026-05-31 23:08:08,938] Trial 266 finished with value: 0.26033729672968475 and parameters: {'alpha': 121186.66043699034, 'n_pcs': 4000, 'weight_scheme': 'exponential', 'weight_clip_max': 3.0, 'weight_exponential_beta': 9.019382114357391}. Best is trial 232 with value: 0.2607490501447128.
2026-05-31 23:08:08 | INFO | src.nested_cv_avggrm_weighted_unified | Trial 267 | outer=1 | alpha=1.445e+05 n_pcs=4000 (pc_topk) weight_search=on
2026-05-31 23:08:08 | INFO | src.nested_cv_avggrm_weighted_unified | Trial 267 | outer=1 | weight={'name': 'exponential', 'floor': 1e-06, 'clip_max': 3.0, 'beta': 9.990405987742395}
[I 2026-05-31 23:08:14,679] Trial 267 finished with value: 0.26042578030351443 and parameters: {'alpha': 144456.78713599878, 'n_pcs': 4000, 'weight_scheme': 'exponential', 'weight_clip_max': 3.0, 'weight_exponential_beta': 9.990405987742395}. Best is trial 232 with value: 0.2607490501447128.
2026-05-31 23:08:14 | INFO | src.nested_cv_avggrm_weighted_unified | Trial 268 | outer=1 | alpha=1.016e+05 n_pcs=4000 (pc_topk) weight_search=on
2026-05-31 23:08:14 | INFO | src.nested_cv_avggrm_weighted_unified | Trial 268 | outer=1 | weight={'name': 'exponential', 'floor': 1e-06, 'clip_max': 3.0, 'beta': 9.592614904688238}
[I 2026-05-31 23:08:20,406] Trial 268 finished with value: 0.25974566817184275 and parameters: {'alpha': 101631.30014977309, 'n_pcs': 4000, 'weight_scheme': 'exponential', 'weight_clip_max': 3.0, 'weight_exponential_beta': 9.592614904688238}. Best is trial 232 with value: 0.2607490501447128.
2026-05-31 23:08:20 | INFO | src.nested_cv_avggrm_weighted_unified | Trial 269 | outer=1 | alpha=1.533e+05 n_pcs=4000 (pc_topk) weight_search=on
2026-05-31 23:08:20 | INFO | src.nested_cv_avggrm_weighted_unified | Trial 269 | outer=1 | weight={'name': 'exponential', 'floor': 1e-06, 'clip_max': 3.0, 'beta': 9.38926302531522}
[I 2026-05-31 23:08:26,130] Trial 269 finished with value: 0.2607318866861064 and parameters: {'alpha': 153283.43543975314, 'n_pcs': 4000, 'weight_scheme': 'exponential', 'weight_clip_max': 3.0, 'weight_exponential_beta': 9.38926302531522}. Best is trial 232 with value: 0.2607490501447128.
2026-05-31 23:08:26 | INFO | src.nested_cv_avggrm_weighted_unified | Trial 270 | outer=1 | alpha=1.661e+05 n_pcs=4000 (pc_topk) weight_search=on
2026-05-31 23:08:26 | INFO | src.nested_cv_avggrm_weighted_unified | Trial 270 | outer=1 | weight={'name': 'exponential', 'floor': 1e-06, 'clip_max': 3.0, 'beta': 9.350244832841913}
[I 2026-05-31 23:08:31,863] Trial 270 finished with value: 0.26073511300032504 and parameters: {'alpha': 166098.8536941147, 'n_pcs': 4000, 'weight_scheme': 'exponential', 'weight_clip_max': 3.0, 'weight_exponential_beta': 9.350244832841913}. Best is trial 232 with value: 0.2607490501447128.
2026-05-31 23:08:31 | INFO | src.nested_cv_avggrm_weighted_unified | Trial 271 | outer=1 | alpha=1.592e+05 n_pcs=4000 (pc_topk) weight_search=on
2026-05-31 23:08:31 | INFO | src.nested_cv_avggrm_weighted_unified | Trial 271 | outer=1 | weight={'name': 'exponential', 'floor': 1e-06, 'clip_max': 3.0, 'beta': 9.163003916729535}
[I 2026-05-31 23:08:37,589] Trial 271 finished with value: 0.26067555752816596 and parameters: {'alpha': 159243.43606678466, 'n_pcs': 4000, 'weight_scheme': 'exponential', 'weight_clip_max': 3.0, 'weight_exponential_beta': 9.163003916729535}. Best is trial 232 with value: 0.2607490501447128.
2026-05-31 23:08:37 | INFO | src.nested_cv_avggrm_weighted_unified | Trial 272 | outer=1 | alpha=1.233e+05 n_pcs=4000 (pc_topk) weight_search=on
2026-05-31 23:08:37 | INFO | src.nested_cv_avggrm_weighted_unified | Trial 272 | outer=1 | weight={'name': 'exponential', 'floor': 1e-06, 'clip_max': None, 'beta': 9.411112953573777}
[I 2026-05-31 23:08:43,292] Trial 272 finished with value: 0.2362024697048067 and parameters: {'alpha': 123264.69180079336, 'n_pcs': 4000, 'weight_scheme': 'exponential', 'weight_clip_max': None, 'weight_exponential_beta': 9.411112953573777}. Best is trial 232 with value: 0.2607490501447128.
2026-05-31 23:08:43 | INFO | src.nested_cv_avggrm_weighted_unified | Trial 273 | outer=1 | alpha=2.718e+05 n_pcs=2000 (pc_topk) weight_search=on
2026-05-31 23:08:43 | INFO | src.nested_cv_avggrm_weighted_unified | Trial 273 | outer=1 | weight={'name': 'exponential', 'floor': 1e-06, 'clip_max': 3.0, 'beta': 9.286193925263857}
[I 2026-05-31 23:08:45,509] Trial 273 finished with value: 0.25579131154500323 and parameters: {'alpha': 271841.5986823645, 'n_pcs': 2000, 'weight_scheme': 'exponential', 'weight_clip_max': 3.0, 'weight_exponential_beta': 9.286193925263857}. Best is trial 232 with value: 0.2607490501447128.
2026-05-31 23:08:45 | INFO | src.nested_cv_avggrm_weighted_unified | Trial 274 | outer=1 | alpha=1.554e+06 n_pcs=4000 (pc_topk) weight_search=on
2026-05-31 23:08:45 | INFO | src.nested_cv_avggrm_weighted_unified | Trial 274 | outer=1 | weight={'name': 'exponential', 'floor': 1e-06, 'clip_max': 3.0, 'beta': 9.432541235154364}
[I 2026-05-31 23:08:51,194] Trial 274 finished with value: 0.24789931876404533 and parameters: {'alpha': 1553690.7813351892, 'n_pcs': 4000, 'weight_scheme': 'exponential', 'weight_clip_max': 3.0, 'weight_exponential_beta': 9.432541235154364}. Best is trial 232 with value: 0.2607490501447128.
2026-05-31 23:08:51 | INFO | src.nested_cv_avggrm_weighted_unified | Trial 275 | outer=1 | alpha=8.655e+04 n_pcs=4000 (pc_topk) weight_search=on
2026-05-31 23:08:51 | INFO | src.nested_cv_avggrm_weighted_unified | Trial 275 | outer=1 | weight={'name': 'exponential', 'floor': 1e-06, 'clip_max': 3.0, 'beta': 4.178693983056443}
[I 2026-05-31 23:08:56,910] Trial 275 finished with value: 0.2580488102474892 and parameters: {'alpha': 86551.3143933555, 'n_pcs': 4000, 'weight_scheme': 'exponential', 'weight_clip_max': 3.0, 'weight_exponential_beta': 4.178693983056443}. Best is trial 232 with value: 0.2607490501447128.
2026-05-31 23:08:56 | INFO | src.nested_cv_avggrm_weighted_unified | Trial 276 | outer=1 | alpha=2.277e+05 n_pcs=4000 (pc_topk) weight_search=on
2026-05-31 23:08:56 | INFO | src.nested_cv_avggrm_weighted_unified | Trial 276 | outer=1 | weight={'name': 'exponential', 'floor': 1e-06, 'clip_max': 10.0, 'beta': 8.911280748616777}
[I 2026-05-31 23:09:02,630] Trial 276 finished with value: 0.25400915224597337 and parameters: {'alpha': 227697.1409057152, 'n_pcs': 4000, 'weight_scheme': 'exponential', 'weight_clip_max': 10.0, 'weight_exponential_beta': 8.911280748616777}. Best is trial 232 with value: 0.2607490501447128.
2026-05-31 23:09:02 | INFO | src.nested_cv_avggrm_weighted_unified | Trial 277 | outer=1 | alpha=1.395e+05 n_pcs=4000 (pc_topk) weight_search=on
2026-05-31 23:09:02 | INFO | src.nested_cv_avggrm_weighted_unified | Trial 277 | outer=1 | weight={'name': 'exponential', 'floor': 1e-06, 'clip_max': 3.0, 'beta': 9.219782342942956}
