[I 2026-06-01 00:52:17,804] Trial 140 pruned. 
2026-06-01 00:52:17 | INFO | src.nested_cv_avggrm_weighted_unified | Trial 141 | outer=6 | alpha=3.181e+05 n_pcs=4000 (pc_topk) weight_search=on
2026-06-01 00:52:17 | INFO | src.nested_cv_avggrm_weighted_unified | Trial 141 | outer=6 | weight={'name': 'exponential', 'floor': 1e-06, 'clip_max': 3.0, 'beta': 3.953725359889021}
[I 2026-06-01 00:52:22,965] Trial 141 finished with value: 0.2362593805797005 and parameters: {'alpha': 318100.30388484773, 'n_pcs': 4000, 'weight_scheme': 'exponential', 'weight_clip_max': 3.0, 'weight_exponential_beta': 3.953725359889021}. Best is trial 57 with value: 0.23745149892178968.
2026-06-01 00:52:22 | INFO | src.nested_cv_avggrm_weighted_unified | Trial 142 | outer=6 | alpha=1.785e+05 n_pcs=4000 (pc_topk) weight_search=on
2026-06-01 00:52:22 | INFO | src.nested_cv_avggrm_weighted_unified | Trial 142 | outer=6 | weight={'name': 'exponential', 'floor': 1e-06, 'clip_max': 5.0, 'beta': 4.7335038259170545}
2026-06-01 00:52:26 | INFO | src.nested_cv_avggrm_weighted_unified | Trial 142 | outer=6 | pruned after 7/10 inner folds (mean r=0.2631)
[I 2026-06-01 00:52:26,592] Trial 142 pruned. 
2026-06-01 00:52:26 | INFO | src.nested_cv_avggrm_weighted_unified | Trial 143 | outer=6 | alpha=2.455e+05 n_pcs=4000 (pc_topk) weight_search=on
2026-06-01 00:52:26 | INFO | src.nested_cv_avggrm_weighted_unified | Trial 143 | outer=6 | weight={'name': 'exponential', 'floor': 1e-06, 'clip_max': 3.0, 'beta': 3.8518998845992014}
[I 2026-06-01 00:52:31,775] Trial 143 finished with value: 0.23722380701883133 and parameters: {'alpha': 245529.6895113586, 'n_pcs': 4000, 'weight_scheme': 'exponential', 'weight_clip_max': 3.0, 'weight_exponential_beta': 3.8518998845992014}. Best is trial 57 with value: 0.23745149892178968.
2026-06-01 00:52:31 | INFO | src.nested_cv_avggrm_weighted_unified | Trial 144 | outer=6 | alpha=2.425e+05 n_pcs=4000 (pc_topk) weight_search=on
2026-06-01 00:52:31 | INFO | src.nested_cv_avggrm_weighted_unified | Trial 144 | outer=6 | weight={'name': 'exponential', 'floor': 1e-06, 'clip_max': 3.0, 'beta': 3.6351870797587447}
[I 2026-06-01 00:52:36,940] Trial 144 finished with value: 0.23712951480844557 and parameters: {'alpha': 242481.19794725213, 'n_pcs': 4000, 'weight_scheme': 'exponential', 'weight_clip_max': 3.0, 'weight_exponential_beta': 3.6351870797587447}. Best is trial 57 with value: 0.23745149892178968.
2026-06-01 00:52:36 | INFO | src.nested_cv_avggrm_weighted_unified | Trial 145 | outer=6 | alpha=2.217e+05 n_pcs=4000 (pc_topk) weight_search=on
2026-06-01 00:52:36 | INFO | src.nested_cv_avggrm_weighted_unified | Trial 145 | outer=6 | weight={'name': 'exponential', 'floor': 1e-06, 'clip_max': 3.0, 'beta': 3.122283989259191}
[I 2026-06-01 00:52:42,120] Trial 145 finished with value: 0.2373228991732188 and parameters: {'alpha': 221712.86925711323, 'n_pcs': 4000, 'weight_scheme': 'exponential', 'weight_clip_max': 3.0, 'weight_exponential_beta': 3.122283989259191}. Best is trial 57 with value: 0.23745149892178968.
2026-06-01 00:52:42 | INFO | src.nested_cv_avggrm_weighted_unified | Trial 146 | outer=6 | alpha=1.348e+05 n_pcs=4000 (pc_topk) weight_search=on
2026-06-01 00:52:42 | INFO | src.nested_cv_avggrm_weighted_unified | Trial 146 | outer=6 | weight={'name': 'linear', 'floor': 1e-06, 'clip_max': 3.0, 'min_weight': 0.2721380452148614, 'max_weight': 2.644942953333024}
2026-06-01 00:52:45 | INFO | src.nested_cv_avggrm_weighted_unified | Trial 146 | outer=6 | pruned after 7/10 inner folds (mean r=0.2625)
[I 2026-06-01 00:52:45,765] Trial 146 pruned. 
2026-06-01 00:52:45 | INFO | src.nested_cv_avggrm_weighted_unified | Trial 147 | outer=6 | alpha=2.031e+05 n_pcs=3500 (pc_topk) weight_search=on
2026-06-01 00:52:45 | INFO | src.nested_cv_avggrm_weighted_unified | Trial 147 | outer=6 | weight={'name': 'exponential', 'floor': 1e-06, 'clip_max': 3.0, 'beta': 3.0926794766931343}
[I 2026-06-01 00:52:50,824] Trial 147 finished with value: 0.2366534210026468 and parameters: {'alpha': 203089.065756411, 'n_pcs': 3500, 'weight_scheme': 'exponential', 'weight_clip_max': 3.0, 'weight_exponential_beta': 3.0926794766931343}. Best is trial 57 with value: 0.23745149892178968.
2026-06-01 00:52:50 | INFO | src.nested_cv_avggrm_weighted_unified | Trial 148 | outer=6 | alpha=2.277e+05 n_pcs=4500 (pc_topk) weight_search=on
2026-06-01 00:52:50 | INFO | src.nested_cv_avggrm_weighted_unified | Trial 148 | outer=6 | weight={'name': 'exponential', 'floor': 1e-06, 'clip_max': 3.0, 'beta': 3.680603960492367}
[I 2026-06-01 00:52:57,284] Trial 148 finished with value: 0.23663899116960022 and parameters: {'alpha': 227733.57291231496, 'n_pcs': 4500, 'weight_scheme': 'exponential', 'weight_clip_max': 3.0, 'weight_exponential_beta': 3.680603960492367}. Best is trial 57 with value: 0.23745149892178968.
2026-06-01 00:52:57 | INFO | src.nested_cv_avggrm_weighted_unified | Trial 149 | outer=6 | alpha=1.760e+05 n_pcs=4000 (pc_topk) weight_search=on
2026-06-01 00:52:57 | INFO | src.nested_cv_avggrm_weighted_unified | Trial 149 | outer=6 | weight={'name': 'exponential', 'floor': 1e-06, 'clip_max': 3.0, 'beta': 2.486175128872215}
[I 2026-06-01 00:53:02,489] Trial 149 finished with value: 0.23735792563461766 and parameters: {'alpha': 175982.04276243687, 'n_pcs': 4000, 'weight_scheme': 'exponential', 'weight_clip_max': 3.0, 'weight_exponential_beta': 2.486175128872215}. Best is trial 57 with value: 0.23745149892178968.
2026-06-01 00:53:02 | INFO | src.nested_cv_avggrm_weighted_unified | Trial 150 | outer=6 | alpha=1.012e+05 n_pcs=4000 (pc_topk) weight_search=on
2026-06-01 00:53:02 | INFO | src.nested_cv_avggrm_weighted_unified | Trial 150 | outer=6 | weight={'name': 'exponential', 'floor': 1e-06, 'clip_max': 3.0, 'beta': 2.3437858775391502}
2026-06-01 00:53:06 | INFO | src.nested_cv_avggrm_weighted_unified | Trial 150 | outer=6 | pruned after 7/10 inner folds (mean r=0.2620)
[I 2026-06-01 00:53:06,173] Trial 150 pruned. 
2026-06-01 00:53:06 | INFO | src.nested_cv_avggrm_weighted_unified | Trial 151 | outer=6 | alpha=1.784e+05 n_pcs=4000 (pc_topk) weight_search=on
2026-06-01 00:53:06 | INFO | src.nested_cv_avggrm_weighted_unified | Trial 151 | outer=6 | weight={'name': 'exponential', 'floor': 1e-06, 'clip_max': 3.0, 'beta': 2.5123532226528296}
[I 2026-06-01 00:53:11,454] Trial 151 finished with value: 0.2373844700199112 and parameters: {'alpha': 178414.57834786738, 'n_pcs': 4000, 'weight_scheme': 'exponential', 'weight_clip_max': 3.0, 'weight_exponential_beta': 2.5123532226528296}. Best is trial 57 with value: 0.23745149892178968.
2026-06-01 00:53:11 | INFO | src.nested_cv_avggrm_weighted_unified | Trial 152 | outer=6 | alpha=1.734e+05 n_pcs=4000 (pc_topk) weight_search=on
2026-06-01 00:53:11 | INFO | src.nested_cv_avggrm_weighted_unified | Trial 152 | outer=6 | weight={'name': 'exponential', 'floor': 1e-06, 'clip_max': 3.0, 'beta': 3.1518141810811517}
[I 2026-06-01 00:53:16,694] Trial 152 finished with value: 0.23807568909916635 and parameters: {'alpha': 173403.043261814, 'n_pcs': 4000, 'weight_scheme': 'exponential', 'weight_clip_max': 3.0, 'weight_exponential_beta': 3.1518141810811517}. Best is trial 152 with value: 0.23807568909916635.
2026-06-01 00:53:16 | INFO | src.nested_cv_avggrm_weighted_unified | OUTER 6 | new best trial 152 (mean inner r=0.2381) saved to outputs/final_results/e6_pc_ridge_avggrm/thr_wing/e6_pc_ridge_avggrm_thr_wing_best_trials/split_06_best_trial.json
2026-06-01 00:53:16 | INFO | src.nested_cv_avggrm_weighted_unified | Trial 153 | outer=6 | alpha=1.683e+05 n_pcs=4000 (pc_topk) weight_search=on
2026-06-01 00:53:16 | INFO | src.nested_cv_avggrm_weighted_unified | Trial 153 | outer=6 | weight={'name': 'exponential', 'floor': 1e-06, 'clip_max': 3.0, 'beta': 2.3066952618767966}
2026-06-01 00:53:21 | INFO | src.nested_cv_avggrm_weighted_unified | Trial 153 | outer=6 | pruned after 7/10 inner folds (mean r=0.2643)
[I 2026-06-01 00:53:21,419] Trial 153 pruned. 
2026-06-01 00:53:21 | INFO | src.nested_cv_avggrm_weighted_unified | Trial 154 | outer=6 | alpha=1.402e+05 n_pcs=4000 (pc_topk) weight_search=on
2026-06-01 00:53:21 | INFO | src.nested_cv_avggrm_weighted_unified | Trial 154 | outer=6 | weight={'name': 'exponential', 'floor': 1e-06, 'clip_max': 3.0, 'beta': 2.45819850889736}
2026-06-01 00:53:25 | INFO | src.nested_cv_avggrm_weighted_unified | Trial 154 | outer=6 | pruned after 7/10 inner folds (mean r=0.2641)
[I 2026-06-01 00:53:25,124] Trial 154 pruned. 
2026-06-01 00:53:25 | INFO | src.nested_cv_avggrm_weighted_unified | Trial 155 | outer=6 | alpha=1.180e+05 n_pcs=4000 (pc_topk) weight_search=on
2026-06-01 00:53:25 | INFO | src.nested_cv_avggrm_weighted_unified | Trial 155 | outer=6 | weight={'name': 'exponential', 'floor': 1e-06, 'clip_max': 3.0, 'beta': 1.794465145727894}
2026-06-01 00:53:28 | INFO | src.nested_cv_avggrm_weighted_unified | Trial 155 | outer=6 | pruned after 7/10 inner folds (mean r=0.2615)
[I 2026-06-01 00:53:28,735] Trial 155 pruned. 
2026-06-01 00:53:28 | INFO | src.nested_cv_avggrm_weighted_unified | Trial 156 | outer=6 | alpha=1.848e+05 n_pcs=4000 (pc_topk) weight_search=on
2026-06-01 00:53:28 | INFO | src.nested_cv_avggrm_weighted_unified | Trial 156 | outer=6 | weight={'name': 'exponential', 'floor': 1e-06, 'clip_max': 3.0, 'beta': 3.0362448503707293}
[I 2026-06-01 00:53:33,992] Trial 156 finished with value: 0.23785566606116176 and parameters: {'alpha': 184753.0862614943, 'n_pcs': 4000, 'weight_scheme': 'exponential', 'weight_clip_max': 3.0, 'weight_exponential_beta': 3.0362448503707293}. Best is trial 152 with value: 0.23807568909916635.
2026-06-01 00:53:33 | INFO | src.nested_cv_avggrm_weighted_unified | Trial 157 | outer=6 | alpha=8.251e+04 n_pcs=3500 (pc_topk) weight_search=on
2026-06-01 00:53:34 | INFO | src.nested_cv_avggrm_weighted_unified | Trial 157 | outer=6 | weight={'name': 'exponential', 'floor': 1e-06, 'clip_max': 3.0, 'beta': 2.6255538566594434}
2026-06-01 00:53:37 | INFO | src.nested_cv_avggrm_weighted_unified | Trial 157 | outer=6 | pruned after 7/10 inner folds (mean r=0.2590)
[I 2026-06-01 00:53:37,131] Trial 157 pruned. 
2026-06-01 00:53:37 | INFO | src.nested_cv_avggrm_weighted_unified | Trial 158 | outer=6 | alpha=1.816e+05 n_pcs=4500 (pc_topk) weight_search=on
2026-06-01 00:53:37 | INFO | src.nested_cv_avggrm_weighted_unified | Trial 158 | outer=6 | weight={'name': 'exponential', 'floor': 1e-06, 'clip_max': 3.0, 'beta': 2.9610443140531717}
[I 2026-06-01 00:53:43,577] Trial 158 finished with value: 0.23718486886230167 and parameters: {'alpha': 181644.4988005579, 'n_pcs': 4500, 'weight_scheme': 'exponential', 'weight_clip_max': 3.0, 'weight_exponential_beta': 2.9610443140531717}. Best is trial 152 with value: 0.23807568909916635.
2026-06-01 00:53:43 | INFO | src.nested_cv_avggrm_weighted_unified | Trial 159 | outer=6 | alpha=1.730e+05 n_pcs=4500 (pc_topk) weight_search=on
2026-06-01 00:53:43 | INFO | src.nested_cv_avggrm_weighted_unified | Trial 159 | outer=6 | weight={'name': 'exponential', 'floor': 1e-06, 'clip_max': 3.0, 'beta': 2.8138584686065955}
[I 2026-06-01 00:53:50,024] Trial 159 finished with value: 0.2371963836046525 and parameters: {'alpha': 172981.02072576154, 'n_pcs': 4500, 'weight_scheme': 'exponential', 'weight_clip_max': 3.0, 'weight_exponential_beta': 2.8138584686065955}. Best is trial 152 with value: 0.23807568909916635.
2026-06-01 00:53:50 | INFO | src.nested_cv_avggrm_weighted_unified | Trial 160 | outer=6 | alpha=1.320e+05 n_pcs=4500 (pc_topk) weight_search=on
2026-06-01 00:53:50 | INFO | src.nested_cv_avggrm_weighted_unified | Trial 160 | outer=6 | weight={'name': 'exponential', 'floor': 1e-06, 'clip_max': 3.0, 'beta': 2.095462676141536}
2026-06-01 00:53:54 | INFO | src.nested_cv_avggrm_weighted_unified | Trial 160 | outer=6 | pruned after 7/10 inner folds (mean r=0.2633)
[I 2026-06-01 00:53:54,463] Trial 160 pruned. 
2026-06-01 00:53:54 | INFO | src.nested_cv_avggrm_weighted_unified | Trial 161 | outer=6 | alpha=1.587e+05 n_pcs=4500 (pc_topk) weight_search=on
2026-06-01 00:53:54 | INFO | src.nested_cv_avggrm_weighted_unified | Trial 161 | outer=6 | weight={'name': 'exponential', 'floor': 1e-06, 'clip_max': 3.0, 'beta': 2.908232913509489}
[I 2026-06-01 00:54:00,902] Trial 161 finished with value: 0.23753803862567638 and parameters: {'alpha': 158690.61566171926, 'n_pcs': 4500, 'weight_scheme': 'exponential', 'weight_clip_max': 3.0, 'weight_exponential_beta': 2.908232913509489}. Best is trial 152 with value: 0.23807568909916635.
2026-06-01 00:54:00 | INFO | src.nested_cv_avggrm_weighted_unified | Trial 162 | outer=6 | alpha=1.601e+05 n_pcs=4500 (pc_topk) weight_search=on
2026-06-01 00:54:00 | INFO | src.nested_cv_avggrm_weighted_unified | Trial 162 | outer=6 | weight={'name': 'exponential', 'floor': 1e-06, 'clip_max': 3.0, 'beta': 3.128876239677488}
[I 2026-06-01 00:54:07,358] Trial 162 finished with value: 0.23763364044092206 and parameters: {'alpha': 160115.84466141323, 'n_pcs': 4500, 'weight_scheme': 'exponential', 'weight_clip_max': 3.0, 'weight_exponential_beta': 3.128876239677488}. Best is trial 152 with value: 0.23807568909916635.
2026-06-01 00:54:07 | INFO | src.nested_cv_avggrm_weighted_unified | Trial 163 | outer=6 | alpha=1.091e+05 n_pcs=4500 (pc_topk) weight_search=on
2026-06-01 00:54:07 | INFO | src.nested_cv_avggrm_weighted_unified | Trial 163 | outer=6 | weight={'name': 'exponential', 'floor': 1e-06, 'clip_max': 3.0, 'beta': 3.1438907632001056}
2026-06-01 00:54:11 | INFO | src.nested_cv_avggrm_weighted_unified | Trial 163 | outer=6 | pruned after 7/10 inner folds (mean r=0.2628)
[I 2026-06-01 00:54:11,798] Trial 163 pruned. 
2026-06-01 00:54:11 | INFO | src.nested_cv_avggrm_weighted_unified | Trial 164 | outer=6 | alpha=1.501e+05 n_pcs=5000 (pc_topk) weight_search=on
2026-06-01 00:54:11 | INFO | src.nested_cv_avggrm_weighted_unified | Trial 164 | outer=6 | weight={'name': 'exponential', 'floor': 1e-06, 'clip_max': 3.0, 'beta': 2.678597660335228}
2026-06-01 00:54:16 | INFO | src.nested_cv_avggrm_weighted_unified | Trial 164 | outer=6 | pruned after 7/10 inner folds (mean r=0.2640)
[I 2026-06-01 00:54:16,461] Trial 164 pruned. 
2026-06-01 00:54:16 | INFO | src.nested_cv_avggrm_weighted_unified | Trial 165 | outer=6 | alpha=2.041e+05 n_pcs=4000 (pc_topk) weight_search=on
2026-06-01 00:54:16 | INFO | src.nested_cv_avggrm_weighted_unified | Trial 165 | outer=6 | weight={'name': 'exponential', 'floor': 1e-06, 'clip_max': 3.0, 'beta': 3.2773318515725185}
[I 2026-06-01 00:54:21,814] Trial 165 finished with value: 0.23766456963742652 and parameters: {'alpha': 204147.7137146633, 'n_pcs': 4000, 'weight_scheme': 'exponential', 'weight_clip_max': 3.0, 'weight_exponential_beta': 3.2773318515725185}. Best is trial 152 with value: 0.23807568909916635.
2026-06-01 00:54:21 | INFO | src.nested_cv_avggrm_weighted_unified | Trial 166 | outer=6 | alpha=1.973e+05 n_pcs=4500 (pc_topk) weight_search=on
2026-06-01 00:54:21 | INFO | src.nested_cv_avggrm_weighted_unified | Trial 166 | outer=6 | weight={'name': 'exponential', 'floor': 1e-06, 'clip_max': 3.0, 'beta': 3.343366717378807}
[I 2026-06-01 00:54:28,247] Trial 166 finished with value: 0.23708452767918703 and parameters: {'alpha': 197342.84719140606, 'n_pcs': 4500, 'weight_scheme': 'exponential', 'weight_clip_max': 3.0, 'weight_exponential_beta': 3.343366717378807}. Best is trial 152 with value: 0.23807568909916635.
2026-06-01 00:54:28 | INFO | src.nested_cv_avggrm_weighted_unified | Trial 167 | outer=6 | alpha=1.510e+05 n_pcs=4500 (pc_topk) weight_search=on
2026-06-01 00:54:28 | INFO | src.nested_cv_avggrm_weighted_unified | Trial 167 | outer=6 | weight={'name': 'exponential', 'floor': 1e-06, 'clip_max': 3.0, 'beta': 3.1038186156193084}
2026-06-01 00:54:32 | INFO | src.nested_cv_avggrm_weighted_unified | Trial 167 | outer=6 | pruned after 7/10 inner folds (mean r=0.2646)
[I 2026-06-01 00:54:32,736] Trial 167 pruned. 
2026-06-01 00:54:32 | INFO | src.nested_cv_avggrm_weighted_unified | Trial 168 | outer=6 | alpha=1.956e+05 n_pcs=4000 (pc_topk) weight_search=on
2026-06-01 00:54:32 | INFO | src.nested_cv_avggrm_weighted_unified | Trial 168 | outer=6 | weight={'name': 'exponential', 'floor': 1e-06, 'clip_max': 3.0, 'beta': 2.926222545944488}
[I 2026-06-01 00:54:37,926] Trial 168 finished with value: 0.23758934700364248 and parameters: {'alpha': 195622.7031749705, 'n_pcs': 4000, 'weight_scheme': 'exponential', 'weight_clip_max': 3.0, 'weight_exponential_beta': 2.926222545944488}. Best is trial 152 with value: 0.23807568909916635.
2026-06-01 00:54:37 | INFO | src.nested_cv_avggrm_weighted_unified | Trial 169 | outer=6 | alpha=1.229e+05 n_pcs=4000 (pc_topk) weight_search=on
2026-06-01 00:54:37 | INFO | src.nested_cv_avggrm_weighted_unified | Trial 169 | outer=6 | weight={'name': 'uniform', 'floor': 1e-06, 'clip_max': 3.0}
2026-06-01 00:54:40 | INFO | src.nested_cv_avggrm_weighted_unified | Trial 169 | outer=6 | pruned after 6/10 inner folds (mean r=0.2415)
[I 2026-06-01 00:54:40,756] Trial 169 pruned. 
2026-06-01 00:54:40 | INFO | src.nested_cv_avggrm_weighted_unified | Trial 170 | outer=6 | alpha=6.683e+04 n_pcs=4000 (pc_topk) weight_search=on
2026-06-01 00:54:40 | INFO | src.nested_cv_avggrm_weighted_unified | Trial 170 | outer=6 | weight={'name': 'exponential', 'floor': 1e-06, 'clip_max': 3.0, 'beta': 3.2008225028813917}
2026-06-01 00:54:44 | INFO | src.nested_cv_avggrm_weighted_unified | Trial 170 | outer=6 | pruned after 7/10 inner folds (mean r=0.2575)
[I 2026-06-01 00:54:44,386] Trial 170 pruned. 
2026-06-01 00:54:44 | INFO | src.nested_cv_avggrm_weighted_unified | Trial 171 | outer=6 | alpha=1.942e+05 n_pcs=4000 (pc_topk) weight_search=on
2026-06-01 00:54:44 | INFO | src.nested_cv_avggrm_weighted_unified | Trial 171 | outer=6 | weight={'name': 'exponential', 'floor': 1e-06, 'clip_max': 3.0, 'beta': 2.8803676101452567}
[I 2026-06-01 00:54:49,656] Trial 171 finished with value: 0.23755963726501758 and parameters: {'alpha': 194216.03469626379, 'n_pcs': 4000, 'weight_scheme': 'exponential', 'weight_clip_max': 3.0, 'weight_exponential_beta': 2.8803676101452567}. Best is trial 152 with value: 0.23807568909916635.
2026-06-01 00:54:49 | INFO | src.nested_cv_avggrm_weighted_unified | Trial 172 | outer=6 | alpha=1.981e+05 n_pcs=4000 (pc_topk) weight_search=on
2026-06-01 00:54:49 | INFO | src.nested_cv_avggrm_weighted_unified | Trial 172 | outer=6 | weight={'name': 'exponential', 'floor': 1e-06, 'clip_max': 3.0, 'beta': 2.9245719652371367}
[I 2026-06-01 00:54:54,873] Trial 172 finished with value: 0.23754579670111972 and parameters: {'alpha': 198138.1603701624, 'n_pcs': 4000, 'weight_scheme': 'exponential', 'weight_clip_max': 3.0, 'weight_exponential_beta': 2.9245719652371367}. Best is trial 152 with value: 0.23807568909916635.
2026-06-01 00:54:54 | INFO | src.nested_cv_avggrm_weighted_unified | Trial 173 | outer=6 | alpha=1.954e+05 n_pcs=4000 (pc_topk) weight_search=on
2026-06-01 00:54:54 | INFO | src.nested_cv_avggrm_weighted_unified | Trial 173 | outer=6 | weight={'name': 'exponential', 'floor': 1e-06, 'clip_max': 3.0, 'beta': 2.8852407268174343}
[I 2026-06-01 00:55:00,058] Trial 173 finished with value: 0.23754621262430967 and parameters: {'alpha': 195402.05124435862, 'n_pcs': 4000, 'weight_scheme': 'exponential', 'weight_clip_max': 3.0, 'weight_exponential_beta': 2.8852407268174343}. Best is trial 152 with value: 0.23807568909916635.
2026-06-01 00:55:00 | INFO | src.nested_cv_avggrm_weighted_unified | Trial 174 | outer=6 | alpha=1.912e+05 n_pcs=4000 (pc_topk) weight_search=on
2026-06-01 00:55:00 | INFO | src.nested_cv_avggrm_weighted_unified | Trial 174 | outer=6 | weight={'name': 'exponential', 'floor': 1e-06, 'clip_max': 3.0, 'beta': 2.903910595121849}
[I 2026-06-01 00:55:05,277] Trial 174 finished with value: 0.23764020072856623 and parameters: {'alpha': 191191.34735750646, 'n_pcs': 4000, 'weight_scheme': 'exponential', 'weight_clip_max': 3.0, 'weight_exponential_beta': 2.903910595121849}. Best is trial 152 with value: 0.23807568909916635.
2026-06-01 00:55:05 | INFO | src.nested_cv_avggrm_weighted_unified | Trial 175 | outer=6 | alpha=1.813e+05 n_pcs=4000 (pc_topk) weight_search=on
2026-06-01 00:55:05 | INFO | src.nested_cv_avggrm_weighted_unified | Trial 175 | outer=6 | weight={'name': 'exponential', 'floor': 1e-06, 'clip_max': 3.0, 'beta': 2.908215856473202}
[I 2026-06-01 00:55:10,554] Trial 175 finished with value: 0.23780575400490508 and parameters: {'alpha': 181284.47079979745, 'n_pcs': 4000, 'weight_scheme': 'exponential', 'weight_clip_max': 3.0, 'weight_exponential_beta': 2.908215856473202}. Best is trial 152 with value: 0.23807568909916635.
2026-06-01 00:55:10 | INFO | src.nested_cv_avggrm_weighted_unified | Trial 176 | outer=6 | alpha=1.918e+05 n_pcs=4000 (pc_topk) weight_search=on
2026-06-01 00:55:10 | INFO | src.nested_cv_avggrm_weighted_unified | Trial 176 | outer=6 | weight={'name': 'exponential', 'floor': 1e-06, 'clip_max': 3.0, 'beta': 2.9050209706748666}
[I 2026-06-01 00:55:15,837] Trial 176 finished with value: 0.23763177611127667 and parameters: {'alpha': 191778.9274304801, 'n_pcs': 4000, 'weight_scheme': 'exponential', 'weight_clip_max': 3.0, 'weight_exponential_beta': 2.9050209706748666}. Best is trial 152 with value: 0.23807568909916635.
2026-06-01 00:55:15 | INFO | src.nested_cv_avggrm_weighted_unified | Trial 177 | outer=6 | alpha=1.712e+05 n_pcs=4000 (pc_topk) weight_search=on
2026-06-01 00:55:15 | INFO | src.nested_cv_avggrm_weighted_unified | Trial 177 | outer=6 | weight={'name': 'exponential', 'floor': 1e-06, 'clip_max': 3.0, 'beta': 2.888935467628807}
