[I 2026-06-01 01:17:23,748] Trial 146 finished with value: 0.22590774453344165 and parameters: {'alpha': 29756.849406992358, 'n_pcs': 4000, 'weight_scheme': 'linear', 'weight_clip_max': 3.0, 'weight_linear_min_weight': 0.2948682974487646, 'weight_linear_max_weight': 3.97785690358068}. Best is trial 86 with value: 0.22876955329088525.
2026-06-01 01:17:23 | INFO | src.nested_cv_avggrm_weighted_unified | Trial 147 | outer=7 | alpha=7.870e+04 n_pcs=4500 (pc_topk) weight_search=on
2026-06-01 01:17:23 | INFO | src.nested_cv_avggrm_weighted_unified | Trial 147 | outer=7 | weight={'name': 'linear', 'floor': 1e-06, 'clip_max': 20.0, 'min_weight': 0.5413224188207, 'max_weight': 4.104181392863243}
[I 2026-06-01 01:17:30,573] Trial 147 finished with value: 0.2270403364064048 and parameters: {'alpha': 78695.9079972113, 'n_pcs': 4500, 'weight_scheme': 'linear', 'weight_clip_max': 20.0, 'weight_linear_min_weight': 0.5413224188207, 'weight_linear_max_weight': 4.104181392863243}. Best is trial 86 with value: 0.22876955329088525.
2026-06-01 01:17:30 | INFO | src.nested_cv_avggrm_weighted_unified | Trial 148 | outer=7 | alpha=6.225e+04 n_pcs=4000 (pc_topk) weight_search=on
2026-06-01 01:17:30 | INFO | src.nested_cv_avggrm_weighted_unified | Trial 148 | outer=7 | weight={'name': 'uniform', 'floor': 1e-06, 'clip_max': 20.0}
[I 2026-06-01 01:17:35,505] Trial 148 finished with value: 0.21769823531566973 and parameters: {'alpha': 62245.78994426561, 'n_pcs': 4000, 'weight_scheme': 'uniform', 'weight_clip_max': 20.0}. Best is trial 86 with value: 0.22876955329088525.
2026-06-01 01:17:35 | INFO | src.nested_cv_avggrm_weighted_unified | Trial 149 | outer=7 | alpha=1.108e+05 n_pcs=4500 (pc_topk) weight_search=on
2026-06-01 01:17:35 | INFO | src.nested_cv_avggrm_weighted_unified | Trial 149 | outer=7 | weight={'name': 'linear', 'floor': 1e-06, 'clip_max': 10.0, 'min_weight': 0.2683517997220463, 'max_weight': 2.922035399934296}
[I 2026-06-01 01:17:42,324] Trial 149 finished with value: 0.2257548184012142 and parameters: {'alpha': 110814.33703675692, 'n_pcs': 4500, 'weight_scheme': 'linear', 'weight_clip_max': 10.0, 'weight_linear_min_weight': 0.2683517997220463, 'weight_linear_max_weight': 2.922035399934296}. Best is trial 86 with value: 0.22876955329088525.
2026-06-01 01:17:42 | INFO | src.nested_cv_avggrm_weighted_unified | Trial 150 | outer=7 | alpha=4.683e+04 n_pcs=3500 (pc_topk) weight_search=on
2026-06-01 01:17:42 | INFO | src.nested_cv_avggrm_weighted_unified | Trial 150 | outer=7 | weight={'name': 'linear', 'floor': 1e-06, 'clip_max': 20.0, 'min_weight': 0.31561880083532734, 'max_weight': 4.170991944819559}
[I 2026-06-01 01:17:47,072] Trial 150 finished with value: 0.2243848449351741 and parameters: {'alpha': 46827.630688674224, 'n_pcs': 3500, 'weight_scheme': 'linear', 'weight_clip_max': 20.0, 'weight_linear_min_weight': 0.31561880083532734, 'weight_linear_max_weight': 4.170991944819559}. Best is trial 86 with value: 0.22876955329088525.
2026-06-01 01:17:47 | INFO | src.nested_cv_avggrm_weighted_unified | Trial 151 | outer=7 | alpha=5.480e+04 n_pcs=4000 (pc_topk) weight_search=on
2026-06-01 01:17:47 | INFO | src.nested_cv_avggrm_weighted_unified | Trial 151 | outer=7 | weight={'name': 'linear', 'floor': 1e-06, 'clip_max': 20.0, 'min_weight': 0.9933332187705171, 'max_weight': 4.993880545783264}
[I 2026-06-01 01:17:52,700] Trial 151 finished with value: 0.2277000633932361 and parameters: {'alpha': 54803.825924088305, 'n_pcs': 4000, 'weight_scheme': 'linear', 'weight_clip_max': 20.0, 'weight_linear_min_weight': 0.9933332187705171, 'weight_linear_max_weight': 4.993880545783264}. Best is trial 86 with value: 0.22876955329088525.
2026-06-01 01:17:52 | INFO | src.nested_cv_avggrm_weighted_unified | Trial 152 | outer=7 | alpha=3.965e+04 n_pcs=4000 (pc_topk) weight_search=on
2026-06-01 01:17:52 | INFO | src.nested_cv_avggrm_weighted_unified | Trial 152 | outer=7 | weight={'name': 'linear', 'floor': 1e-06, 'clip_max': 20.0, 'min_weight': 0.29581607743255417, 'max_weight': 4.7346439582808335}
[I 2026-06-01 01:17:58,321] Trial 152 finished with value: 0.22775425210129346 and parameters: {'alpha': 39652.61801736899, 'n_pcs': 4000, 'weight_scheme': 'linear', 'weight_clip_max': 20.0, 'weight_linear_min_weight': 0.29581607743255417, 'weight_linear_max_weight': 4.7346439582808335}. Best is trial 86 with value: 0.22876955329088525.
2026-06-01 01:17:58 | INFO | src.nested_cv_avggrm_weighted_unified | Trial 153 | outer=7 | alpha=7.017e+04 n_pcs=4000 (pc_topk) weight_search=on
2026-06-01 01:17:58 | INFO | src.nested_cv_avggrm_weighted_unified | Trial 153 | outer=7 | weight={'name': 'linear', 'floor': 1e-06, 'clip_max': 20.0, 'min_weight': 0.25283235107526064, 'max_weight': 4.8304431060060775}
[I 2026-06-01 01:18:03,934] Trial 153 finished with value: 0.22860986529242028 and parameters: {'alpha': 70166.39682947916, 'n_pcs': 4000, 'weight_scheme': 'linear', 'weight_clip_max': 20.0, 'weight_linear_min_weight': 0.25283235107526064, 'weight_linear_max_weight': 4.8304431060060775}. Best is trial 86 with value: 0.22876955329088525.
2026-06-01 01:18:03 | INFO | src.nested_cv_avggrm_weighted_unified | Trial 154 | outer=7 | alpha=5.198e+04 n_pcs=4000 (pc_topk) weight_search=on
2026-06-01 01:18:03 | INFO | src.nested_cv_avggrm_weighted_unified | Trial 154 | outer=7 | weight={'name': 'linear', 'floor': 1e-06, 'clip_max': 20.0, 'min_weight': 0.20486699951680448, 'max_weight': 4.316739628496239}
[I 2026-06-01 01:18:09,548] Trial 154 finished with value: 0.22854789927863634 and parameters: {'alpha': 51982.289765009366, 'n_pcs': 4000, 'weight_scheme': 'linear', 'weight_clip_max': 20.0, 'weight_linear_min_weight': 0.20486699951680448, 'weight_linear_max_weight': 4.316739628496239}. Best is trial 86 with value: 0.22876955329088525.
2026-06-01 01:18:09 | INFO | src.nested_cv_avggrm_weighted_unified | Trial 155 | outer=7 | alpha=9.214e+04 n_pcs=4000 (pc_topk) weight_search=on
2026-06-01 01:18:09 | INFO | src.nested_cv_avggrm_weighted_unified | Trial 155 | outer=7 | weight={'name': 'exponential', 'floor': 1e-06, 'clip_max': 20.0, 'beta': 2.0907931297703124}
[I 2026-06-01 01:18:15,170] Trial 155 finished with value: 0.22720197744152965 and parameters: {'alpha': 92139.57569187952, 'n_pcs': 4000, 'weight_scheme': 'exponential', 'weight_clip_max': 20.0, 'weight_exponential_beta': 2.0907931297703124}. Best is trial 86 with value: 0.22876955329088525.
2026-06-01 01:18:15 | INFO | src.nested_cv_avggrm_weighted_unified | Trial 156 | outer=7 | alpha=5.580e+04 n_pcs=4000 (pc_topk) weight_search=on
2026-06-01 01:18:15 | INFO | src.nested_cv_avggrm_weighted_unified | Trial 156 | outer=7 | weight={'name': 'linear', 'floor': 1e-06, 'clip_max': 20.0, 'min_weight': 0.6901994969974663, 'max_weight': 4.4843024904560345}
[I 2026-06-01 01:18:20,832] Trial 156 finished with value: 0.22816017882325648 and parameters: {'alpha': 55797.39682302822, 'n_pcs': 4000, 'weight_scheme': 'linear', 'weight_clip_max': 20.0, 'weight_linear_min_weight': 0.6901994969974663, 'weight_linear_max_weight': 4.4843024904560345}. Best is trial 86 with value: 0.22876955329088525.
2026-06-01 01:18:20 | INFO | src.nested_cv_avggrm_weighted_unified | Trial 157 | outer=7 | alpha=3.642e+04 n_pcs=4500 (pc_topk) weight_search=on
2026-06-01 01:18:20 | INFO | src.nested_cv_avggrm_weighted_unified | Trial 157 | outer=7 | weight={'name': 'linear', 'floor': 1e-06, 'clip_max': 20.0, 'min_weight': 0.23077956657384918, 'max_weight': 4.5993628672906475}
[I 2026-06-01 01:18:27,614] Trial 157 finished with value: 0.22820750221620562 and parameters: {'alpha': 36416.5515774638, 'n_pcs': 4500, 'weight_scheme': 'linear', 'weight_clip_max': 20.0, 'weight_linear_min_weight': 0.23077956657384918, 'weight_linear_max_weight': 4.5993628672906475}. Best is trial 86 with value: 0.22876955329088525.
2026-06-01 01:18:27 | INFO | src.nested_cv_avggrm_weighted_unified | Trial 158 | outer=7 | alpha=7.374e+04 n_pcs=4000 (pc_topk) weight_search=on
2026-06-01 01:18:27 | INFO | src.nested_cv_avggrm_weighted_unified | Trial 158 | outer=7 | weight={'name': 'linear', 'floor': 1e-06, 'clip_max': 20.0, 'min_weight': 0.3038459638219659, 'max_weight': 4.1427686116435725}
[I 2026-06-01 01:18:33,198] Trial 158 finished with value: 0.2284198746115335 and parameters: {'alpha': 73742.88424967806, 'n_pcs': 4000, 'weight_scheme': 'linear', 'weight_clip_max': 20.0, 'weight_linear_min_weight': 0.3038459638219659, 'weight_linear_max_weight': 4.1427686116435725}. Best is trial 86 with value: 0.22876955329088525.
2026-06-01 01:18:33 | INFO | src.nested_cv_avggrm_weighted_unified | Trial 159 | outer=7 | alpha=4.526e+04 n_pcs=4000 (pc_topk) weight_search=on
2026-06-01 01:18:33 | INFO | src.nested_cv_avggrm_weighted_unified | Trial 159 | outer=7 | weight={'name': 'linear', 'floor': 1e-06, 'clip_max': 20.0, 'min_weight': 0.27953702800377295, 'max_weight': 4.924153496028526}
[I 2026-06-01 01:18:38,769] Trial 159 finished with value: 0.22824990291270847 and parameters: {'alpha': 45255.1630254036, 'n_pcs': 4000, 'weight_scheme': 'linear', 'weight_clip_max': 20.0, 'weight_linear_min_weight': 0.27953702800377295, 'weight_linear_max_weight': 4.924153496028526}. Best is trial 86 with value: 0.22876955329088525.
2026-06-01 01:18:38 | INFO | src.nested_cv_avggrm_weighted_unified | Trial 160 | outer=7 | alpha=5.938e+04 n_pcs=3500 (pc_topk) weight_search=on
2026-06-01 01:18:38 | INFO | src.nested_cv_avggrm_weighted_unified | Trial 160 | outer=7 | weight={'name': 'linear', 'floor': 1e-06, 'clip_max': 5.0, 'min_weight': 0.32217274360721426, 'max_weight': 4.029118698481575}
[I 2026-06-01 01:18:43,533] Trial 160 finished with value: 0.2255026500335587 and parameters: {'alpha': 59380.72631073162, 'n_pcs': 3500, 'weight_scheme': 'linear', 'weight_clip_max': 5.0, 'weight_linear_min_weight': 0.32217274360721426, 'weight_linear_max_weight': 4.029118698481575}. Best is trial 86 with value: 0.22876955329088525.
2026-06-01 01:18:43 | INFO | src.nested_cv_avggrm_weighted_unified | Trial 161 | outer=7 | alpha=6.524e+04 n_pcs=4500 (pc_topk) weight_search=on
2026-06-01 01:18:43 | INFO | src.nested_cv_avggrm_weighted_unified | Trial 161 | outer=7 | weight={'name': 'linear', 'floor': 1e-06, 'clip_max': 20.0, 'min_weight': 0.20476165145500214, 'max_weight': 3.6425482133572435}
[I 2026-06-01 01:18:50,291] Trial 161 finished with value: 0.22850793966972577 and parameters: {'alpha': 65244.73632609754, 'n_pcs': 4500, 'weight_scheme': 'linear', 'weight_clip_max': 20.0, 'weight_linear_min_weight': 0.20476165145500214, 'weight_linear_max_weight': 3.6425482133572435}. Best is trial 86 with value: 0.22876955329088525.
2026-06-01 01:18:50 | INFO | src.nested_cv_avggrm_weighted_unified | Trial 162 | outer=7 | alpha=8.063e+04 n_pcs=4500 (pc_topk) weight_search=on
2026-06-01 01:18:50 | INFO | src.nested_cv_avggrm_weighted_unified | Trial 162 | outer=7 | weight={'name': 'linear', 'floor': 1e-06, 'clip_max': 20.0, 'min_weight': 0.23353954248787748, 'max_weight': 3.777154807488907}
[I 2026-06-01 01:18:57,007] Trial 162 finished with value: 0.22782713865918636 and parameters: {'alpha': 80625.16239255262, 'n_pcs': 4500, 'weight_scheme': 'linear', 'weight_clip_max': 20.0, 'weight_linear_min_weight': 0.23353954248787748, 'weight_linear_max_weight': 3.777154807488907}. Best is trial 86 with value: 0.22876955329088525.
2026-06-01 01:18:57 | INFO | src.nested_cv_avggrm_weighted_unified | Trial 163 | outer=7 | alpha=5.815e+04 n_pcs=5000 (pc_topk) weight_search=on
2026-06-01 01:18:57 | INFO | src.nested_cv_avggrm_weighted_unified | Trial 163 | outer=7 | weight={'name': 'linear', 'floor': 1e-06, 'clip_max': 20.0, 'min_weight': 0.8009751270135814, 'max_weight': 3.706021270667772}
[I 2026-06-01 01:19:04,968] Trial 163 finished with value: 0.22537716081448952 and parameters: {'alpha': 58150.64691401434, 'n_pcs': 5000, 'weight_scheme': 'linear', 'weight_clip_max': 20.0, 'weight_linear_min_weight': 0.8009751270135814, 'weight_linear_max_weight': 3.706021270667772}. Best is trial 86 with value: 0.22876955329088525.
2026-06-01 01:19:04 | INFO | src.nested_cv_avggrm_weighted_unified | Trial 164 | outer=7 | alpha=4.778e+04 n_pcs=4500 (pc_topk) weight_search=on
2026-06-01 01:19:04 | INFO | src.nested_cv_avggrm_weighted_unified | Trial 164 | outer=7 | weight={'name': 'linear', 'floor': 1e-06, 'clip_max': 20.0, 'min_weight': 0.17577114932798227, 'max_weight': 2.5654076279051377}
[I 2026-06-01 01:19:11,707] Trial 164 finished with value: 0.2287618178476945 and parameters: {'alpha': 47784.32300074589, 'n_pcs': 4500, 'weight_scheme': 'linear', 'weight_clip_max': 20.0, 'weight_linear_min_weight': 0.17577114932798227, 'weight_linear_max_weight': 2.5654076279051377}. Best is trial 86 with value: 0.22876955329088525.
2026-06-01 01:19:11 | INFO | src.nested_cv_avggrm_weighted_unified | Trial 165 | outer=7 | alpha=4.942e+04 n_pcs=4000 (pc_topk) weight_search=on
2026-06-01 01:19:11 | INFO | src.nested_cv_avggrm_weighted_unified | Trial 165 | outer=7 | weight={'name': 'linear', 'floor': 1e-06, 'clip_max': 20.0, 'min_weight': 0.4951247504355443, 'max_weight': 2.642669036183317}
[I 2026-06-01 01:19:17,237] Trial 165 finished with value: 0.22786315249869973 and parameters: {'alpha': 49421.38151023788, 'n_pcs': 4000, 'weight_scheme': 'linear', 'weight_clip_max': 20.0, 'weight_linear_min_weight': 0.4951247504355443, 'weight_linear_max_weight': 2.642669036183317}. Best is trial 86 with value: 0.22876955329088525.
2026-06-01 01:19:17 | INFO | src.nested_cv_avggrm_weighted_unified | Trial 166 | outer=7 | alpha=3.140e+04 n_pcs=4500 (pc_topk) weight_search=on
2026-06-01 01:19:17 | INFO | src.nested_cv_avggrm_weighted_unified | Trial 166 | outer=7 | weight={'name': 'linear', 'floor': 1e-06, 'clip_max': 20.0, 'min_weight': 0.17312952299778506, 'max_weight': 2.585717858972268}
[I 2026-06-01 01:19:23,937] Trial 166 finished with value: 0.22770727227652876 and parameters: {'alpha': 31401.749798847104, 'n_pcs': 4500, 'weight_scheme': 'linear', 'weight_clip_max': 20.0, 'weight_linear_min_weight': 0.17312952299778506, 'weight_linear_max_weight': 2.585717858972268}. Best is trial 86 with value: 0.22876955329088525.
2026-06-01 01:19:23 | INFO | src.nested_cv_avggrm_weighted_unified | Trial 167 | outer=7 | alpha=4.092e+04 n_pcs=4500 (pc_topk) weight_search=on
2026-06-01 01:19:23 | INFO | src.nested_cv_avggrm_weighted_unified | Trial 167 | outer=7 | weight={'name': 'linear', 'floor': 1e-06, 'clip_max': 20.0, 'min_weight': 0.26521556245095607, 'max_weight': 4.813601160897919}
[I 2026-06-01 01:19:30,733] Trial 167 finished with value: 0.22855311085825902 and parameters: {'alpha': 40918.30668700767, 'n_pcs': 4500, 'weight_scheme': 'linear', 'weight_clip_max': 20.0, 'weight_linear_min_weight': 0.26521556245095607, 'weight_linear_max_weight': 4.813601160897919}. Best is trial 86 with value: 0.22876955329088525.
2026-06-01 01:19:30 | INFO | src.nested_cv_avggrm_weighted_unified | Trial 168 | outer=7 | alpha=9.676e+04 n_pcs=4000 (pc_topk) weight_search=on
2026-06-01 01:19:30 | INFO | src.nested_cv_avggrm_weighted_unified | Trial 168 | outer=7 | weight={'name': 'linear', 'floor': 1e-06, 'clip_max': 20.0, 'min_weight': 0.3442418405705403, 'max_weight': 2.8663618652745297}
[I 2026-06-01 01:19:36,324] Trial 168 finished with value: 0.22682294617543733 and parameters: {'alpha': 96762.92155662736, 'n_pcs': 4000, 'weight_scheme': 'linear', 'weight_clip_max': 20.0, 'weight_linear_min_weight': 0.3442418405705403, 'weight_linear_max_weight': 2.8663618652745297}. Best is trial 86 with value: 0.22876955329088525.
2026-06-01 01:19:36 | INFO | src.nested_cv_avggrm_weighted_unified | Trial 169 | outer=7 | alpha=2.132e+04 n_pcs=4000 (pc_topk) weight_search=on
2026-06-01 01:19:36 | INFO | src.nested_cv_avggrm_weighted_unified | Trial 169 | outer=7 | weight={'name': 'linear', 'floor': 1e-06, 'clip_max': 20.0, 'min_weight': 0.16759575420833997, 'max_weight': 4.746749911589214}
[I 2026-06-01 01:19:42,085] Trial 169 finished with value: 0.22156515907509083 and parameters: {'alpha': 21324.76693593025, 'n_pcs': 4000, 'weight_scheme': 'linear', 'weight_clip_max': 20.0, 'weight_linear_min_weight': 0.16759575420833997, 'weight_linear_max_weight': 4.746749911589214}. Best is trial 86 with value: 0.22876955329088525.
2026-06-01 01:19:42 | INFO | src.nested_cv_avggrm_weighted_unified | Trial 170 | outer=7 | alpha=4.598e+04 n_pcs=4500 (pc_topk) weight_search=on
2026-06-01 01:19:42 | INFO | src.nested_cv_avggrm_weighted_unified | Trial 170 | outer=7 | weight={'name': 'linear', 'floor': 1e-06, 'clip_max': 20.0, 'min_weight': 0.3828983206676756, 'max_weight': 4.3746308444699284}
[I 2026-06-01 01:19:48,850] Trial 170 finished with value: 0.2287003149023111 and parameters: {'alpha': 45984.56789673448, 'n_pcs': 4500, 'weight_scheme': 'linear', 'weight_clip_max': 20.0, 'weight_linear_min_weight': 0.3828983206676756, 'weight_linear_max_weight': 4.3746308444699284}. Best is trial 86 with value: 0.22876955329088525.
2026-06-01 01:19:48 | INFO | src.nested_cv_avggrm_weighted_unified | Trial 171 | outer=7 | alpha=5.133e+04 n_pcs=4500 (pc_topk) weight_search=on
2026-06-01 01:19:48 | INFO | src.nested_cv_avggrm_weighted_unified | Trial 171 | outer=7 | weight={'name': 'linear', 'floor': 1e-06, 'clip_max': 20.0, 'min_weight': 0.3947105622606705, 'max_weight': 4.379559355271279}
[I 2026-06-01 01:19:55,597] Trial 171 finished with value: 0.22867818466576306 and parameters: {'alpha': 51332.930564772316, 'n_pcs': 4500, 'weight_scheme': 'linear', 'weight_clip_max': 20.0, 'weight_linear_min_weight': 0.3947105622606705, 'weight_linear_max_weight': 4.379559355271279}. Best is trial 86 with value: 0.22876955329088525.
2026-06-01 01:19:55 | INFO | src.nested_cv_avggrm_weighted_unified | Trial 172 | outer=7 | alpha=4.753e+04 n_pcs=4500 (pc_topk) weight_search=on
2026-06-01 01:19:55 | INFO | src.nested_cv_avggrm_weighted_unified | Trial 172 | outer=7 | weight={'name': 'linear', 'floor': 1e-06, 'clip_max': 20.0, 'min_weight': 0.39548119869238046, 'max_weight': 4.37731605039038}
[I 2026-06-01 01:20:02,318] Trial 172 finished with value: 0.22869847878121696 and parameters: {'alpha': 47526.65524268497, 'n_pcs': 4500, 'weight_scheme': 'linear', 'weight_clip_max': 20.0, 'weight_linear_min_weight': 0.39548119869238046, 'weight_linear_max_weight': 4.37731605039038}. Best is trial 86 with value: 0.22876955329088525.
2026-06-01 01:20:02 | INFO | src.nested_cv_avggrm_weighted_unified | Trial 173 | outer=7 | alpha=4.497e+04 n_pcs=4500 (pc_topk) weight_search=on
2026-06-01 01:20:02 | INFO | src.nested_cv_avggrm_weighted_unified | Trial 173 | outer=7 | weight={'name': 'linear', 'floor': 1e-06, 'clip_max': 20.0, 'min_weight': 0.42042678935704575, 'max_weight': 4.392265581584462}
[I 2026-06-01 01:20:09,098] Trial 173 finished with value: 0.2286580509019757 and parameters: {'alpha': 44973.77077451754, 'n_pcs': 4500, 'weight_scheme': 'linear', 'weight_clip_max': 20.0, 'weight_linear_min_weight': 0.42042678935704575, 'weight_linear_max_weight': 4.392265581584462}. Best is trial 86 with value: 0.22876955329088525.
2026-06-01 01:20:09 | INFO | src.nested_cv_avggrm_weighted_unified | Trial 174 | outer=7 | alpha=3.537e+04 n_pcs=4500 (pc_topk) weight_search=on
2026-06-01 01:20:09 | INFO | src.nested_cv_avggrm_weighted_unified | Trial 174 | outer=7 | weight={'name': 'linear', 'floor': 1e-06, 'clip_max': 20.0, 'min_weight': 0.415034063884191, 'max_weight': 4.364452384112264}
[I 2026-06-01 01:20:15,909] Trial 174 finished with value: 0.2282258092148332 and parameters: {'alpha': 35368.12786893614, 'n_pcs': 4500, 'weight_scheme': 'linear', 'weight_clip_max': 20.0, 'weight_linear_min_weight': 0.415034063884191, 'weight_linear_max_weight': 4.364452384112264}. Best is trial 86 with value: 0.22876955329088525.
2026-06-01 01:20:15 | INFO | src.nested_cv_avggrm_weighted_unified | Trial 175 | outer=7 | alpha=4.393e+04 n_pcs=4500 (pc_topk) weight_search=on
2026-06-01 01:20:15 | INFO | src.nested_cv_avggrm_weighted_unified | Trial 175 | outer=7 | weight={'name': 'linear', 'floor': 1e-06, 'clip_max': 20.0, 'min_weight': 0.38716949023451286, 'max_weight': 4.291762863436944}
[I 2026-06-01 01:20:22,689] Trial 175 finished with value: 0.22866126980831888 and parameters: {'alpha': 43932.425060990565, 'n_pcs': 4500, 'weight_scheme': 'linear', 'weight_clip_max': 20.0, 'weight_linear_min_weight': 0.38716949023451286, 'weight_linear_max_weight': 4.291762863436944}. Best is trial 86 with value: 0.22876955329088525.
2026-06-01 01:20:22 | INFO | src.nested_cv_avggrm_weighted_unified | Trial 176 | outer=7 | alpha=4.025e+04 n_pcs=4500 (pc_topk) weight_search=on
2026-06-01 01:20:22 | INFO | src.nested_cv_avggrm_weighted_unified | Trial 176 | outer=7 | weight={'name': 'linear', 'floor': 1e-06, 'clip_max': 20.0, 'min_weight': 0.3846309248337325, 'max_weight': 4.29772852095399}
[I 2026-06-01 01:20:29,425] Trial 176 finished with value: 0.22854733698444724 and parameters: {'alpha': 40249.434049796946, 'n_pcs': 4500, 'weight_scheme': 'linear', 'weight_clip_max': 20.0, 'weight_linear_min_weight': 0.3846309248337325, 'weight_linear_max_weight': 4.29772852095399}. Best is trial 86 with value: 0.22876955329088525.
2026-06-01 01:20:29 | INFO | src.nested_cv_avggrm_weighted_unified | Trial 177 | outer=7 | alpha=2.736e+04 n_pcs=4500 (pc_topk) weight_search=on
2026-06-01 01:20:29 | INFO | src.nested_cv_avggrm_weighted_unified | Trial 177 | outer=7 | weight={'name': 'linear', 'floor': 1e-06, 'clip_max': 20.0, 'min_weight': 0.3701330115428419, 'max_weight': 4.514413280885417}
