[I 2026-06-01 01:23:58,286] Trial 208 finished with value: 0.22680765510503437 and parameters: {'alpha': 46415.53887763525, 'n_pcs': 5000, 'weight_scheme': 'linear', 'weight_clip_max': 10.0, 'weight_linear_min_weight': 0.2682704426786563, 'weight_linear_max_weight': 4.103294498436975}. Best is trial 86 with value: 0.22876955329088525.
2026-06-01 01:23:58 | INFO | src.nested_cv_avggrm_weighted_unified | Trial 209 | outer=7 | alpha=2.336e+04 n_pcs=4500 (pc_topk) weight_search=on
2026-06-01 01:23:58 | INFO | src.nested_cv_avggrm_weighted_unified | Trial 209 | outer=7 | weight={'name': 'linear', 'floor': 1e-06, 'clip_max': 10.0, 'min_weight': 0.3024263622873361, 'max_weight': 2.444045237309563}
[I 2026-06-01 01:24:05,057] Trial 209 finished with value: 0.2260004835426413 and parameters: {'alpha': 23363.496818979824, 'n_pcs': 4500, 'weight_scheme': 'linear', 'weight_clip_max': 10.0, 'weight_linear_min_weight': 0.3024263622873361, 'weight_linear_max_weight': 2.444045237309563}. Best is trial 86 with value: 0.22876955329088525.
2026-06-01 01:24:05 | INFO | src.nested_cv_avggrm_weighted_unified | Trial 210 | outer=7 | alpha=7.667e+04 n_pcs=4500 (pc_topk) weight_search=on
2026-06-01 01:24:05 | INFO | src.nested_cv_avggrm_weighted_unified | Trial 210 | outer=7 | weight={'name': 'linear', 'floor': 1e-06, 'clip_max': 10.0, 'min_weight': 0.2509156182159844, 'max_weight': 4.680799352774665}
[I 2026-06-01 01:24:11,808] Trial 210 finished with value: 0.22807885751440393 and parameters: {'alpha': 76672.43965214248, 'n_pcs': 4500, 'weight_scheme': 'linear', 'weight_clip_max': 10.0, 'weight_linear_min_weight': 0.2509156182159844, 'weight_linear_max_weight': 4.680799352774665}. Best is trial 86 with value: 0.22876955329088525.
2026-06-01 01:24:11 | INFO | src.nested_cv_avggrm_weighted_unified | Trial 211 | outer=7 | alpha=4.657e+04 n_pcs=4500 (pc_topk) weight_search=on
2026-06-01 01:24:11 | INFO | src.nested_cv_avggrm_weighted_unified | Trial 211 | outer=7 | weight={'name': 'linear', 'floor': 1e-06, 'clip_max': 10.0, 'min_weight': 0.31461473326192313, 'max_weight': 3.97299943605565}
[I 2026-06-01 01:24:18,681] Trial 211 finished with value: 0.2287309644588123 and parameters: {'alpha': 46568.043682167336, 'n_pcs': 4500, 'weight_scheme': 'linear', 'weight_clip_max': 10.0, 'weight_linear_min_weight': 0.31461473326192313, 'weight_linear_max_weight': 3.97299943605565}. Best is trial 86 with value: 0.22876955329088525.
2026-06-01 01:24:18 | INFO | src.nested_cv_avggrm_weighted_unified | Trial 212 | outer=7 | alpha=4.020e+04 n_pcs=4500 (pc_topk) weight_search=on
2026-06-01 01:24:18 | INFO | src.nested_cv_avggrm_weighted_unified | Trial 212 | outer=7 | weight={'name': 'linear', 'floor': 1e-06, 'clip_max': 10.0, 'min_weight': 0.3155080014125092, 'max_weight': 3.8484174839830407}
[I 2026-06-01 01:24:25,542] Trial 212 finished with value: 0.22855493719175995 and parameters: {'alpha': 40198.21287802836, 'n_pcs': 4500, 'weight_scheme': 'linear', 'weight_clip_max': 10.0, 'weight_linear_min_weight': 0.3155080014125092, 'weight_linear_max_weight': 3.8484174839830407}. Best is trial 86 with value: 0.22876955329088525.
2026-06-01 01:24:25 | INFO | src.nested_cv_avggrm_weighted_unified | Trial 213 | outer=7 | alpha=4.903e+04 n_pcs=4500 (pc_topk) weight_search=on
2026-06-01 01:24:25 | INFO | src.nested_cv_avggrm_weighted_unified | Trial 213 | outer=7 | weight={'name': 'linear', 'floor': 1e-06, 'clip_max': 10.0, 'min_weight': 0.30038189413126787, 'max_weight': 3.9855702160365474}
[I 2026-06-01 01:24:32,300] Trial 213 finished with value: 0.2287531731600708 and parameters: {'alpha': 49034.33645941947, 'n_pcs': 4500, 'weight_scheme': 'linear', 'weight_clip_max': 10.0, 'weight_linear_min_weight': 0.30038189413126787, 'weight_linear_max_weight': 3.9855702160365474}. Best is trial 86 with value: 0.22876955329088525.
2026-06-01 01:24:32 | INFO | src.nested_cv_avggrm_weighted_unified | Trial 214 | outer=7 | alpha=4.813e+04 n_pcs=4500 (pc_topk) weight_search=on
2026-06-01 01:24:32 | INFO | src.nested_cv_avggrm_weighted_unified | Trial 214 | outer=7 | weight={'name': 'linear', 'floor': 1e-06, 'clip_max': 10.0, 'min_weight': 0.28121577132292147, 'max_weight': 4.0421971921241475}
[I 2026-06-01 01:24:39,051] Trial 214 finished with value: 0.22876271190241693 and parameters: {'alpha': 48127.431174803605, 'n_pcs': 4500, 'weight_scheme': 'linear', 'weight_clip_max': 10.0, 'weight_linear_min_weight': 0.28121577132292147, 'weight_linear_max_weight': 4.0421971921241475}. Best is trial 86 with value: 0.22876955329088525.
2026-06-01 01:24:39 | INFO | src.nested_cv_avggrm_weighted_unified | Trial 215 | outer=7 | alpha=4.725e+04 n_pcs=4500 (pc_topk) weight_search=on
2026-06-01 01:24:39 | INFO | src.nested_cv_avggrm_weighted_unified | Trial 215 | outer=7 | weight={'name': 'linear', 'floor': 1e-06, 'clip_max': 10.0, 'min_weight': 0.27279354188867466, 'max_weight': 4.02468833145667}
[I 2026-06-01 01:24:46,300] Trial 215 finished with value: 0.22875771359605523 and parameters: {'alpha': 47253.69773548351, 'n_pcs': 4500, 'weight_scheme': 'linear', 'weight_clip_max': 10.0, 'weight_linear_min_weight': 0.27279354188867466, 'weight_linear_max_weight': 4.02468833145667}. Best is trial 86 with value: 0.22876955329088525.
2026-06-01 01:24:46 | INFO | src.nested_cv_avggrm_weighted_unified | Trial 216 | outer=7 | alpha=3.508e+04 n_pcs=4500 (pc_topk) weight_search=on
2026-06-01 01:24:46 | INFO | src.nested_cv_avggrm_weighted_unified | Trial 216 | outer=7 | weight={'name': 'linear', 'floor': 1e-06, 'clip_max': 10.0, 'min_weight': 0.23572521321460457, 'max_weight': 4.070622611043242}
[I 2026-06-01 01:24:53,038] Trial 216 finished with value: 0.2281241260797881 and parameters: {'alpha': 35081.442490653826, 'n_pcs': 4500, 'weight_scheme': 'linear', 'weight_clip_max': 10.0, 'weight_linear_min_weight': 0.23572521321460457, 'weight_linear_max_weight': 4.070622611043242}. Best is trial 86 with value: 0.22876955329088525.
2026-06-01 01:24:53 | INFO | src.nested_cv_avggrm_weighted_unified | Trial 217 | outer=7 | alpha=4.515e+04 n_pcs=4500 (pc_topk) weight_search=on
2026-06-01 01:24:53 | INFO | src.nested_cv_avggrm_weighted_unified | Trial 217 | outer=7 | weight={'name': 'linear', 'floor': 1e-06, 'clip_max': 10.0, 'min_weight': 0.2699382802027054, 'max_weight': 4.0174255526943785}
[I 2026-06-01 01:24:59,792] Trial 217 finished with value: 0.22872536082248737 and parameters: {'alpha': 45149.02387960738, 'n_pcs': 4500, 'weight_scheme': 'linear', 'weight_clip_max': 10.0, 'weight_linear_min_weight': 0.2699382802027054, 'weight_linear_max_weight': 4.0174255526943785}. Best is trial 86 with value: 0.22876955329088525.
2026-06-01 01:24:59 | INFO | src.nested_cv_avggrm_weighted_unified | Trial 218 | outer=7 | alpha=3.921e+04 n_pcs=4500 (pc_topk) weight_search=on
2026-06-01 01:24:59 | INFO | src.nested_cv_avggrm_weighted_unified | Trial 218 | outer=7 | weight={'name': 'linear', 'floor': 1e-06, 'clip_max': 10.0, 'min_weight': 0.2876756829831975, 'max_weight': 4.0170521429615755}
[I 2026-06-01 01:25:06,998] Trial 218 finished with value: 0.22850091017772717 and parameters: {'alpha': 39213.94998639295, 'n_pcs': 4500, 'weight_scheme': 'linear', 'weight_clip_max': 10.0, 'weight_linear_min_weight': 0.2876756829831975, 'weight_linear_max_weight': 4.0170521429615755}. Best is trial 86 with value: 0.22876955329088525.
2026-06-01 01:25:07 | INFO | src.nested_cv_avggrm_weighted_unified | Trial 219 | outer=7 | alpha=2.937e+04 n_pcs=4500 (pc_topk) weight_search=on
2026-06-01 01:25:07 | INFO | src.nested_cv_avggrm_weighted_unified | Trial 219 | outer=7 | weight={'name': 'uniform', 'floor': 1e-06, 'clip_max': 10.0}
[I 2026-06-01 01:25:12,949] Trial 219 finished with value: 0.2206759538518442 and parameters: {'alpha': 29372.19572657477, 'n_pcs': 4500, 'weight_scheme': 'uniform', 'weight_clip_max': 10.0}. Best is trial 86 with value: 0.22876955329088525.
2026-06-01 01:25:12 | INFO | src.nested_cv_avggrm_weighted_unified | Trial 220 | outer=7 | alpha=4.674e+04 n_pcs=4500 (pc_topk) weight_search=on
2026-06-01 01:25:12 | INFO | src.nested_cv_avggrm_weighted_unified | Trial 220 | outer=7 | weight={'name': 'linear', 'floor': 1e-06, 'clip_max': 10.0, 'min_weight': 0.252068595776158, 'max_weight': 4.1683527414679675}
[I 2026-06-01 01:25:19,723] Trial 220 finished with value: 0.2287524340502945 and parameters: {'alpha': 46736.76095949715, 'n_pcs': 4500, 'weight_scheme': 'linear', 'weight_clip_max': 10.0, 'weight_linear_min_weight': 0.252068595776158, 'weight_linear_max_weight': 4.1683527414679675}. Best is trial 86 with value: 0.22876955329088525.
2026-06-01 01:25:19 | INFO | src.nested_cv_avggrm_weighted_unified | Trial 221 | outer=7 | alpha=4.457e+04 n_pcs=4500 (pc_topk) weight_search=on
2026-06-01 01:25:19 | INFO | src.nested_cv_avggrm_weighted_unified | Trial 221 | outer=7 | weight={'name': 'linear', 'floor': 1e-06, 'clip_max': 10.0, 'min_weight': 0.26436930318101887, 'max_weight': 3.9926585212912773}
[I 2026-06-01 01:25:26,541] Trial 221 finished with value: 0.2287120855735461 and parameters: {'alpha': 44565.36252660468, 'n_pcs': 4500, 'weight_scheme': 'linear', 'weight_clip_max': 10.0, 'weight_linear_min_weight': 0.26436930318101887, 'weight_linear_max_weight': 3.9926585212912773}. Best is trial 86 with value: 0.22876955329088525.
2026-06-01 01:25:26 | INFO | src.nested_cv_avggrm_weighted_unified | Trial 222 | outer=7 | alpha=4.627e+04 n_pcs=4500 (pc_topk) weight_search=on
2026-06-01 01:25:26 | INFO | src.nested_cv_avggrm_weighted_unified | Trial 222 | outer=7 | weight={'name': 'linear', 'floor': 1e-06, 'clip_max': 10.0, 'min_weight': 0.2685793618444599, 'max_weight': 3.989781057901639}
[I 2026-06-01 01:25:33,308] Trial 222 finished with value: 0.22874549570533373 and parameters: {'alpha': 46269.647284343846, 'n_pcs': 4500, 'weight_scheme': 'linear', 'weight_clip_max': 10.0, 'weight_linear_min_weight': 0.2685793618444599, 'weight_linear_max_weight': 3.989781057901639}. Best is trial 86 with value: 0.22876955329088525.
2026-06-01 01:25:33 | INFO | src.nested_cv_avggrm_weighted_unified | Trial 223 | outer=7 | alpha=3.647e+04 n_pcs=4500 (pc_topk) weight_search=on
2026-06-01 01:25:33 | INFO | src.nested_cv_avggrm_weighted_unified | Trial 223 | outer=7 | weight={'name': 'linear', 'floor': 1e-06, 'clip_max': 10.0, 'min_weight': 0.2692485284590553, 'max_weight': 4.0315649441446135}
[I 2026-06-01 01:25:40,115] Trial 223 finished with value: 0.22829380712924446 and parameters: {'alpha': 36467.91876485444, 'n_pcs': 4500, 'weight_scheme': 'linear', 'weight_clip_max': 10.0, 'weight_linear_min_weight': 0.2692485284590553, 'weight_linear_max_weight': 4.0315649441446135}. Best is trial 86 with value: 0.22876955329088525.
2026-06-01 01:25:40 | INFO | src.nested_cv_avggrm_weighted_unified | Trial 224 | outer=7 | alpha=7.220e+06 n_pcs=4500 (pc_topk) weight_search=on
2026-06-01 01:25:40 | INFO | src.nested_cv_avggrm_weighted_unified | Trial 224 | outer=7 | weight={'name': 'linear', 'floor': 1e-06, 'clip_max': 10.0, 'min_weight': 0.24238342895661782, 'max_weight': 3.981437282638909}
[I 2026-06-01 01:25:46,915] Trial 224 finished with value: 0.19787517013235117 and parameters: {'alpha': 7220250.280479653, 'n_pcs': 4500, 'weight_scheme': 'linear', 'weight_clip_max': 10.0, 'weight_linear_min_weight': 0.24238342895661782, 'weight_linear_max_weight': 3.981437282638909}. Best is trial 86 with value: 0.22876955329088525.
2026-06-01 01:25:46 | INFO | src.nested_cv_avggrm_weighted_unified | Trial 225 | outer=7 | alpha=5.065e+04 n_pcs=4500 (pc_topk) weight_search=on
2026-06-01 01:25:46 | INFO | src.nested_cv_avggrm_weighted_unified | Trial 225 | outer=7 | weight={'name': 'linear', 'floor': 1e-06, 'clip_max': 10.0, 'min_weight': 0.27143722525609115, 'max_weight': 3.82345519570034}
[I 2026-06-01 01:25:53,710] Trial 225 finished with value: 0.22876163494944007 and parameters: {'alpha': 50652.45584939307, 'n_pcs': 4500, 'weight_scheme': 'linear', 'weight_clip_max': 10.0, 'weight_linear_min_weight': 0.27143722525609115, 'weight_linear_max_weight': 3.82345519570034}. Best is trial 86 with value: 0.22876955329088525.
2026-06-01 01:25:53 | INFO | src.nested_cv_avggrm_weighted_unified | Trial 226 | outer=7 | alpha=4.390e+04 n_pcs=4500 (pc_topk) weight_search=on
2026-06-01 01:25:53 | INFO | src.nested_cv_avggrm_weighted_unified | Trial 226 | outer=7 | weight={'name': 'linear', 'floor': 1e-06, 'clip_max': 10.0, 'min_weight': 0.26469540619162973, 'max_weight': 3.8736487859754214}
[I 2026-06-01 01:26:00,448] Trial 226 finished with value: 0.22869524840246486 and parameters: {'alpha': 43895.74421087495, 'n_pcs': 4500, 'weight_scheme': 'linear', 'weight_clip_max': 10.0, 'weight_linear_min_weight': 0.26469540619162973, 'weight_linear_max_weight': 3.8736487859754214}. Best is trial 86 with value: 0.22876955329088525.
2026-06-01 01:26:00 | INFO | src.nested_cv_avggrm_weighted_unified | Trial 227 | outer=7 | alpha=3.350e+04 n_pcs=4500 (pc_topk) weight_search=on
2026-06-01 01:26:00 | INFO | src.nested_cv_avggrm_weighted_unified | Trial 227 | outer=7 | weight={'name': 'linear', 'floor': 1e-06, 'clip_max': 10.0, 'min_weight': 0.22215297654538962, 'max_weight': 4.135581661056094}
[I 2026-06-01 01:26:07,213] Trial 227 finished with value: 0.2279165174153191 and parameters: {'alpha': 33501.42055477082, 'n_pcs': 4500, 'weight_scheme': 'linear', 'weight_clip_max': 10.0, 'weight_linear_min_weight': 0.22215297654538962, 'weight_linear_max_weight': 4.135581661056094}. Best is trial 86 with value: 0.22876955329088525.
2026-06-01 01:26:07 | INFO | src.nested_cv_avggrm_weighted_unified | Trial 228 | outer=7 | alpha=5.077e+04 n_pcs=4500 (pc_topk) weight_search=on
2026-06-01 01:26:07 | INFO | src.nested_cv_avggrm_weighted_unified | Trial 228 | outer=7 | weight={'name': 'linear', 'floor': 1e-06, 'clip_max': 10.0, 'min_weight': 0.2773005561890415, 'max_weight': 3.9856427383947484}
[I 2026-06-01 01:26:13,982] Trial 228 finished with value: 0.2287647160865754 and parameters: {'alpha': 50770.422306074826, 'n_pcs': 4500, 'weight_scheme': 'linear', 'weight_clip_max': 10.0, 'weight_linear_min_weight': 0.2773005561890415, 'weight_linear_max_weight': 3.9856427383947484}. Best is trial 86 with value: 0.22876955329088525.
2026-06-01 01:26:13 | INFO | src.nested_cv_avggrm_weighted_unified | Trial 229 | outer=7 | alpha=5.048e+04 n_pcs=4500 (pc_topk) weight_search=on
2026-06-01 01:26:13 | INFO | src.nested_cv_avggrm_weighted_unified | Trial 229 | outer=7 | weight={'name': 'exponential', 'floor': 1e-06, 'clip_max': 10.0, 'beta': 8.399913421517638}
[I 2026-06-01 01:26:20,735] Trial 229 finished with value: 0.22665690992002113 and parameters: {'alpha': 50480.45719324364, 'n_pcs': 4500, 'weight_scheme': 'exponential', 'weight_clip_max': 10.0, 'weight_exponential_beta': 8.399913421517638}. Best is trial 86 with value: 0.22876955329088525.
2026-06-01 01:26:20 | INFO | src.nested_cv_avggrm_weighted_unified | Trial 230 | outer=7 | alpha=6.764e+04 n_pcs=4500 (pc_topk) weight_search=on
2026-06-01 01:26:20 | INFO | src.nested_cv_avggrm_weighted_unified | Trial 230 | outer=7 | weight={'name': 'linear', 'floor': 1e-06, 'clip_max': 10.0, 'min_weight': 0.27511451426608335, 'max_weight': 3.7912842752255775}
[I 2026-06-01 01:26:27,562] Trial 230 finished with value: 0.2283164937208463 and parameters: {'alpha': 67637.59771299054, 'n_pcs': 4500, 'weight_scheme': 'linear', 'weight_clip_max': 10.0, 'weight_linear_min_weight': 0.27511451426608335, 'weight_linear_max_weight': 3.7912842752255775}. Best is trial 86 with value: 0.22876955329088525.
2026-06-01 01:26:27 | INFO | src.nested_cv_avggrm_weighted_unified | Trial 231 | outer=7 | alpha=4.075e+04 n_pcs=4500 (pc_topk) weight_search=on
2026-06-01 01:26:27 | INFO | src.nested_cv_avggrm_weighted_unified | Trial 231 | outer=7 | weight={'name': 'linear', 'floor': 1e-06, 'clip_max': 10.0, 'min_weight': 0.2531035458290877, 'max_weight': 4.0317751580171555}
[I 2026-06-01 01:26:34,362] Trial 231 finished with value: 0.2285685705936551 and parameters: {'alpha': 40753.98706975713, 'n_pcs': 4500, 'weight_scheme': 'linear', 'weight_clip_max': 10.0, 'weight_linear_min_weight': 0.2531035458290877, 'weight_linear_max_weight': 4.0317751580171555}. Best is trial 86 with value: 0.22876955329088525.
2026-06-01 01:26:34 | INFO | src.nested_cv_avggrm_weighted_unified | Trial 232 | outer=7 | alpha=4.950e+04 n_pcs=4500 (pc_topk) weight_search=on
2026-06-01 01:26:34 | INFO | src.nested_cv_avggrm_weighted_unified | Trial 232 | outer=7 | weight={'name': 'linear', 'floor': 1e-06, 'clip_max': 10.0, 'min_weight': 0.28520684293045245, 'max_weight': 3.9397133184968487}
[I 2026-06-01 01:26:41,175] Trial 232 finished with value: 0.2287608549364899 and parameters: {'alpha': 49498.679427742434, 'n_pcs': 4500, 'weight_scheme': 'linear', 'weight_clip_max': 10.0, 'weight_linear_min_weight': 0.28520684293045245, 'weight_linear_max_weight': 3.9397133184968487}. Best is trial 86 with value: 0.22876955329088525.
2026-06-01 01:26:41 | INFO | src.nested_cv_avggrm_weighted_unified | Trial 233 | outer=7 | alpha=5.311e+04 n_pcs=4500 (pc_topk) weight_search=on
2026-06-01 01:26:41 | INFO | src.nested_cv_avggrm_weighted_unified | Trial 233 | outer=7 | weight={'name': 'linear', 'floor': 1e-06, 'clip_max': 10.0, 'min_weight': 0.27533205258390253, 'max_weight': 3.901223382697453}
[I 2026-06-01 01:26:47,970] Trial 233 finished with value: 0.22874245865944814 and parameters: {'alpha': 53111.94741218249, 'n_pcs': 4500, 'weight_scheme': 'linear', 'weight_clip_max': 10.0, 'weight_linear_min_weight': 0.27533205258390253, 'weight_linear_max_weight': 3.901223382697453}. Best is trial 86 with value: 0.22876955329088525.
2026-06-01 01:26:47 | INFO | src.nested_cv_avggrm_weighted_unified | Trial 234 | outer=7 | alpha=5.456e+04 n_pcs=4500 (pc_topk) weight_search=on
2026-06-01 01:26:47 | INFO | src.nested_cv_avggrm_weighted_unified | Trial 234 | outer=7 | weight={'name': 'linear', 'floor': 1e-06, 'clip_max': 10.0, 'min_weight': 0.2833859851831536, 'max_weight': 3.9614127070430634}
[I 2026-06-01 01:26:54,763] Trial 234 finished with value: 0.2287181109088987 and parameters: {'alpha': 54563.24135720811, 'n_pcs': 4500, 'weight_scheme': 'linear', 'weight_clip_max': 10.0, 'weight_linear_min_weight': 0.2833859851831536, 'weight_linear_max_weight': 3.9614127070430634}. Best is trial 86 with value: 0.22876955329088525.
2026-06-01 01:26:54 | INFO | src.nested_cv_avggrm_weighted_unified | Trial 235 | outer=7 | alpha=5.484e+04 n_pcs=4500 (pc_topk) weight_search=on
2026-06-01 01:26:54 | INFO | src.nested_cv_avggrm_weighted_unified | Trial 235 | outer=7 | weight={'name': 'linear', 'floor': 1e-06, 'clip_max': 10.0, 'min_weight': 0.2754849019135389, 'max_weight': 3.8141239512462377}
[I 2026-06-01 01:27:01,544] Trial 235 finished with value: 0.22871051273878437 and parameters: {'alpha': 54844.98631295838, 'n_pcs': 4500, 'weight_scheme': 'linear', 'weight_clip_max': 10.0, 'weight_linear_min_weight': 0.2754849019135389, 'weight_linear_max_weight': 3.8141239512462377}. Best is trial 86 with value: 0.22876955329088525.
2026-06-01 01:27:01 | INFO | src.nested_cv_avggrm_weighted_unified | Trial 236 | outer=7 | alpha=5.274e+04 n_pcs=4500 (pc_topk) weight_search=on
2026-06-01 01:27:01 | INFO | src.nested_cv_avggrm_weighted_unified | Trial 236 | outer=7 | weight={'name': 'linear', 'floor': 1e-06, 'clip_max': 10.0, 'min_weight': 0.2855434563326541, 'max_weight': 3.8244191610891742}
[I 2026-06-01 01:27:08,374] Trial 236 finished with value: 0.22873250264001163 and parameters: {'alpha': 52736.741813609515, 'n_pcs': 4500, 'weight_scheme': 'linear', 'weight_clip_max': 10.0, 'weight_linear_min_weight': 0.2855434563326541, 'weight_linear_max_weight': 3.8244191610891742}. Best is trial 86 with value: 0.22876955329088525.
2026-06-01 01:27:08 | INFO | src.nested_cv_avggrm_weighted_unified | Trial 237 | outer=7 | alpha=5.151e+04 n_pcs=4500 (pc_topk) weight_search=on
2026-06-01 01:27:08 | INFO | src.nested_cv_avggrm_weighted_unified | Trial 237 | outer=7 | weight={'name': 'linear', 'floor': 1e-06, 'clip_max': 10.0, 'min_weight': 0.28427248973556835, 'max_weight': 3.8168385046228654}
[I 2026-06-01 01:27:15,134] Trial 237 finished with value: 0.22874579558961078 and parameters: {'alpha': 51510.71726115314, 'n_pcs': 4500, 'weight_scheme': 'linear', 'weight_clip_max': 10.0, 'weight_linear_min_weight': 0.28427248973556835, 'weight_linear_max_weight': 3.8168385046228654}. Best is trial 86 with value: 0.22876955329088525.
2026-06-01 01:27:15 | INFO | src.nested_cv_avggrm_weighted_unified | Trial 238 | outer=7 | alpha=3.751e+04 n_pcs=4500 (pc_topk) weight_search=on
2026-06-01 01:27:15 | INFO | src.nested_cv_avggrm_weighted_unified | Trial 238 | outer=7 | weight={'name': 'linear', 'floor': 1e-06, 'clip_max': 10.0, 'min_weight': 0.2861745865456185, 'max_weight': 3.9004870980337314}
[I 2026-06-01 01:27:21,914] Trial 238 finished with value: 0.22839166398805388 and parameters: {'alpha': 37510.532902228486, 'n_pcs': 4500, 'weight_scheme': 'linear', 'weight_clip_max': 10.0, 'weight_linear_min_weight': 0.2861745865456185, 'weight_linear_max_weight': 3.9004870980337314}. Best is trial 86 with value: 0.22876955329088525.
2026-06-01 01:27:21 | INFO | src.nested_cv_avggrm_weighted_unified | Trial 239 | outer=7 | alpha=5.262e+04 n_pcs=4500 (pc_topk) weight_search=on
2026-06-01 01:27:21 | INFO | src.nested_cv_avggrm_weighted_unified | Trial 239 | outer=7 | weight={'name': 'linear', 'floor': 1e-06, 'clip_max': 10.0, 'min_weight': 0.26649603034940783, 'max_weight': 3.8993601681571266}
