[I 2026-06-01 19:12:54,337] Trial 177 finished with value: 0.25661093936175516 and parameters: {'alpha': 71295.93202594893, 'n_pcs': 4000, 'iw_method': 'pc_logistic', 'iw_clip_max': 7.0, 'iw_prob_clip': 0.023767501612785995, 'iw_n_components': 100, 'iw_logistic_c': 0.00013563110011509348, 'iw_pca_fit': 'combined', 'iw_solver': 'lbfgs', 'iw_rho': 0.85}. Best is trial 147 with value: 0.25836214582968176.
2026-06-01 19:12:54 | INFO | Trial 178 | outer=5 | alpha=1.258e+05 n_pcs=4000 (pc_topk) weight={'name': 'pc_logistic', 'floor': 1e-06, 'clip_max': 7.0, 'prob_clip': 0.017303765539561495, 'n_components': 40, 'logistic_c': 8.031030645968983e-05, 'pca_fit': 'combined', 'solver': 'lbfgs', 'max_iter': 2000, 'fit_intercept': True, 'standardize_with_source': True, 'rho': 0.5}
[I 2026-06-01 19:13:06,256] Trial 178 finished with value: 0.2511435547234167 and parameters: {'alpha': 125781.84687434245, 'n_pcs': 4000, 'iw_method': 'pc_logistic', 'iw_clip_max': 7.0, 'iw_prob_clip': 0.017303765539561495, 'iw_n_components': 40, 'iw_logistic_c': 8.031030645968983e-05, 'iw_pca_fit': 'combined', 'iw_solver': 'lbfgs', 'iw_rho': 0.5}. Best is trial 147 with value: 0.25836214582968176.
2026-06-01 19:13:06 | INFO | Trial 179 | outer=5 | alpha=7.930e+04 n_pcs=4000 (pc_topk) weight={'name': 'pc_logistic', 'floor': 1e-06, 'clip_max': 2.5, 'prob_clip': 0.015296383708059353, 'n_components': 100, 'logistic_c': 0.00012393376859820972, 'pca_fit': 'combined', 'solver': 'lbfgs', 'max_iter': 2000, 'fit_intercept': True, 'standardize_with_source': True, 'rho': 0.85}
[I 2026-06-01 19:13:19,776] Trial 179 finished with value: 0.25504268462510243 and parameters: {'alpha': 79302.79887443958, 'n_pcs': 4000, 'iw_method': 'pc_logistic', 'iw_clip_max': 2.5, 'iw_prob_clip': 0.015296383708059353, 'iw_n_components': 100, 'iw_logistic_c': 0.00012393376859820972, 'iw_pca_fit': 'combined', 'iw_solver': 'lbfgs', 'iw_rho': 0.85}. Best is trial 147 with value: 0.25836214582968176.
2026-06-01 19:13:19 | INFO | Trial 180 | outer=5 | alpha=1.065e+05 n_pcs=3500 (pc_topk) weight={'name': 'pc_logistic', 'floor': 1e-06, 'clip_max': 7.0, 'prob_clip': 0.020845897605399153, 'n_components': 100, 'logistic_c': 5.465052211659791e-05, 'pca_fit': 'combined', 'solver': 'lbfgs', 'max_iter': 2000, 'fit_intercept': True, 'standardize_with_source': True, 'rho': 0.85}
[I 2026-06-01 19:13:29,974] Trial 180 finished with value: 0.2531595689423327 and parameters: {'alpha': 106495.61837594787, 'n_pcs': 3500, 'iw_method': 'pc_logistic', 'iw_clip_max': 7.0, 'iw_prob_clip': 0.020845897605399153, 'iw_n_components': 100, 'iw_logistic_c': 5.465052211659791e-05, 'iw_pca_fit': 'combined', 'iw_solver': 'lbfgs', 'iw_rho': 0.85}. Best is trial 147 with value: 0.25836214582968176.
2026-06-01 19:13:30 | INFO | Trial 181 | outer=5 | alpha=6.397e+04 n_pcs=4000 (pc_topk) weight={'name': 'pc_logistic', 'floor': 1e-06, 'clip_max': 7.0, 'prob_clip': 0.020503843930717462, 'n_components': 100, 'logistic_c': 7.978646848347802e-05, 'pca_fit': 'combined', 'solver': 'lbfgs', 'max_iter': 2000, 'fit_intercept': True, 'standardize_with_source': True, 'rho': 0.85}
[I 2026-06-01 19:13:42,473] Trial 181 finished with value: 0.25772245126014537 and parameters: {'alpha': 63968.991049331584, 'n_pcs': 4000, 'iw_method': 'pc_logistic', 'iw_clip_max': 7.0, 'iw_prob_clip': 0.020503843930717462, 'iw_n_components': 100, 'iw_logistic_c': 7.978646848347802e-05, 'iw_pca_fit': 'combined', 'iw_solver': 'lbfgs', 'iw_rho': 0.85}. Best is trial 147 with value: 0.25836214582968176.
2026-06-01 19:13:42 | INFO | Trial 182 | outer=5 | alpha=5.866e+04 n_pcs=4000 (pc_topk) weight={'name': 'pc_logistic', 'floor': 1e-06, 'clip_max': 7.0, 'prob_clip': 0.02246506128745984, 'n_components': 100, 'logistic_c': 8.910067562105121e-05, 'pca_fit': 'combined', 'solver': 'lbfgs', 'max_iter': 2000, 'fit_intercept': True, 'standardize_with_source': True, 'rho': 0.85}
[I 2026-06-01 19:13:55,261] Trial 182 finished with value: 0.2577749817990651 and parameters: {'alpha': 58660.79532871739, 'n_pcs': 4000, 'iw_method': 'pc_logistic', 'iw_clip_max': 7.0, 'iw_prob_clip': 0.02246506128745984, 'iw_n_components': 100, 'iw_logistic_c': 8.910067562105121e-05, 'iw_pca_fit': 'combined', 'iw_solver': 'lbfgs', 'iw_rho': 0.85}. Best is trial 147 with value: 0.25836214582968176.
2026-06-01 19:13:55 | INFO | Trial 183 | outer=5 | alpha=5.716e+04 n_pcs=4000 (pc_topk) weight={'name': 'pc_logistic', 'floor': 1e-06, 'clip_max': 7.0, 'prob_clip': 0.025551197894137165, 'n_components': 100, 'logistic_c': 0.00014741350300949917, 'pca_fit': 'combined', 'solver': 'lbfgs', 'max_iter': 2000, 'fit_intercept': True, 'standardize_with_source': True, 'rho': 0.85}
[I 2026-06-01 19:14:07,867] Trial 183 finished with value: 0.2570205763811278 and parameters: {'alpha': 57157.77696659643, 'n_pcs': 4000, 'iw_method': 'pc_logistic', 'iw_clip_max': 7.0, 'iw_prob_clip': 0.025551197894137165, 'iw_n_components': 100, 'iw_logistic_c': 0.00014741350300949917, 'iw_pca_fit': 'combined', 'iw_solver': 'lbfgs', 'iw_rho': 0.85}. Best is trial 147 with value: 0.25836214582968176.
2026-06-01 19:14:07 | INFO | Trial 184 | outer=5 | alpha=5.205e+04 n_pcs=4000 (pc_topk) weight={'name': 'pc_logistic', 'floor': 1e-06, 'clip_max': 7.0, 'prob_clip': 0.018439625815661324, 'n_components': 100, 'logistic_c': 6.577050972552198e-05, 'pca_fit': 'combined', 'solver': 'lbfgs', 'max_iter': 2000, 'fit_intercept': True, 'standardize_with_source': True, 'rho': 0.85}
[I 2026-06-01 19:14:20,266] Trial 184 finished with value: 0.257752874070621 and parameters: {'alpha': 52052.79826562736, 'n_pcs': 4000, 'iw_method': 'pc_logistic', 'iw_clip_max': 7.0, 'iw_prob_clip': 0.018439625815661324, 'iw_n_components': 100, 'iw_logistic_c': 6.577050972552198e-05, 'iw_pca_fit': 'combined', 'iw_solver': 'lbfgs', 'iw_rho': 0.85}. Best is trial 147 with value: 0.25836214582968176.
2026-06-01 19:14:20 | INFO | Trial 185 | outer=5 | alpha=6.066e+04 n_pcs=4000 (pc_topk) weight={'name': 'pc_logistic', 'floor': 1e-06, 'clip_max': 7.0, 'prob_clip': 0.02310113350638227, 'n_components': 100, 'logistic_c': 5.383585668561606e-05, 'pca_fit': 'combined', 'solver': 'lbfgs', 'max_iter': 2000, 'fit_intercept': True, 'standardize_with_source': True, 'rho': 0.85}
[I 2026-06-01 19:14:33,031] Trial 185 finished with value: 0.25786100856976735 and parameters: {'alpha': 60657.57119534569, 'n_pcs': 4000, 'iw_method': 'pc_logistic', 'iw_clip_max': 7.0, 'iw_prob_clip': 0.02310113350638227, 'iw_n_components': 100, 'iw_logistic_c': 5.383585668561606e-05, 'iw_pca_fit': 'combined', 'iw_solver': 'lbfgs', 'iw_rho': 0.85}. Best is trial 147 with value: 0.25836214582968176.
2026-06-01 19:14:33 | INFO | Trial 186 | outer=5 | alpha=5.576e+04 n_pcs=4000 (pc_topk) weight={'name': 'pc_logistic', 'floor': 1e-06, 'clip_max': 7.0, 'prob_clip': 0.023460077656273098, 'n_components': 10, 'logistic_c': 4.793159120555606e-05, 'pca_fit': 'combined', 'solver': 'lbfgs', 'max_iter': 2000, 'fit_intercept': True, 'standardize_with_source': True, 'rho': 0.85}
[I 2026-06-01 19:14:46,110] Trial 186 finished with value: 0.25208896984598816 and parameters: {'alpha': 55758.18219932984, 'n_pcs': 4000, 'iw_method': 'pc_logistic', 'iw_clip_max': 7.0, 'iw_prob_clip': 0.023460077656273098, 'iw_n_components': 10, 'iw_logistic_c': 4.793159120555606e-05, 'iw_pca_fit': 'combined', 'iw_solver': 'lbfgs', 'iw_rho': 0.85}. Best is trial 147 with value: 0.25836214582968176.
2026-06-01 19:14:46 | INFO | Trial 187 | outer=5 | alpha=4.996e+04 n_pcs=4000 (pc_topk) weight={'name': 'pc_logistic', 'floor': 1e-06, 'clip_max': 7.0, 'prob_clip': 0.03015410834240616, 'n_components': 100, 'logistic_c': 6.028571545760955e-05, 'pca_fit': 'combined', 'solver': 'lbfgs', 'max_iter': 2000, 'fit_intercept': True, 'standardize_with_source': True, 'rho': 0.85}
[I 2026-06-01 19:14:59,406] Trial 187 finished with value: 0.2575704423865142 and parameters: {'alpha': 49958.15195769235, 'n_pcs': 4000, 'iw_method': 'pc_logistic', 'iw_clip_max': 7.0, 'iw_prob_clip': 0.03015410834240616, 'iw_n_components': 100, 'iw_logistic_c': 6.028571545760955e-05, 'iw_pca_fit': 'combined', 'iw_solver': 'lbfgs', 'iw_rho': 0.85}. Best is trial 147 with value: 0.25836214582968176.
2026-06-01 19:14:59 | INFO | Trial 188 | outer=5 | alpha=4.753e+04 n_pcs=1000 (pc_topk) weight={'name': 'uniform'}
[I 2026-06-01 19:15:01,905] Trial 188 finished with value: 0.2271078877573967 and parameters: {'alpha': 47531.53411432212, 'n_pcs': 1000, 'iw_method': 'uniform'}. Best is trial 147 with value: 0.25836214582968176.
2026-06-01 19:15:01 | INFO | Trial 189 | outer=5 | alpha=5.084e+04 n_pcs=4000 (pc_topk) weight={'name': 'pc_logistic', 'floor': 1e-06, 'clip_max': 7.0, 'prob_clip': 0.02794479118556417, 'n_components': 100, 'logistic_c': 5.428920374077497e-05, 'pca_fit': 'combined', 'solver': 'lbfgs', 'max_iter': 2000, 'fit_intercept': True, 'standardize_with_source': True, 'rho': 0.85}
[I 2026-06-01 19:15:13,639] Trial 189 finished with value: 0.25783145993080375 and parameters: {'alpha': 50843.802540215445, 'n_pcs': 4000, 'iw_method': 'pc_logistic', 'iw_clip_max': 7.0, 'iw_prob_clip': 0.02794479118556417, 'iw_n_components': 100, 'iw_logistic_c': 5.428920374077497e-05, 'iw_pca_fit': 'combined', 'iw_solver': 'lbfgs', 'iw_rho': 0.85}. Best is trial 147 with value: 0.25836214582968176.
2026-06-01 19:15:13 | INFO | Trial 190 | outer=5 | alpha=4.835e+04 n_pcs=3500 (pc_topk) weight={'name': 'pc_logistic', 'floor': 1e-06, 'clip_max': 7.0, 'prob_clip': 0.029658118949038286, 'n_components': 100, 'logistic_c': 2.2815770063769086e-05, 'pca_fit': 'combined', 'solver': 'lbfgs', 'max_iter': 2000, 'fit_intercept': True, 'standardize_with_source': True, 'rho': 0.3}
[I 2026-06-01 19:15:23,742] Trial 190 finished with value: 0.24992593177307515 and parameters: {'alpha': 48354.00946827177, 'n_pcs': 3500, 'iw_method': 'pc_logistic', 'iw_clip_max': 7.0, 'iw_prob_clip': 0.029658118949038286, 'iw_n_components': 100, 'iw_logistic_c': 2.2815770063769086e-05, 'iw_pca_fit': 'combined', 'iw_solver': 'lbfgs', 'iw_rho': 0.3}. Best is trial 147 with value: 0.25836214582968176.
2026-06-01 19:15:23 | INFO | Trial 191 | outer=5 | alpha=6.003e+04 n_pcs=4000 (pc_topk) weight={'name': 'pc_logistic', 'floor': 1e-06, 'clip_max': 7.0, 'prob_clip': 0.02697353482561879, 'n_components': 100, 'logistic_c': 5.4636345107863744e-05, 'pca_fit': 'combined', 'solver': 'lbfgs', 'max_iter': 2000, 'fit_intercept': True, 'standardize_with_source': True, 'rho': 0.85}
[I 2026-06-01 19:15:36,919] Trial 191 finished with value: 0.2576096485630052 and parameters: {'alpha': 60031.63939078571, 'n_pcs': 4000, 'iw_method': 'pc_logistic', 'iw_clip_max': 7.0, 'iw_prob_clip': 0.02697353482561879, 'iw_n_components': 100, 'iw_logistic_c': 5.4636345107863744e-05, 'iw_pca_fit': 'combined', 'iw_solver': 'lbfgs', 'iw_rho': 0.85}. Best is trial 147 with value: 0.25836214582968176.
2026-06-01 19:15:36 | INFO | Trial 192 | outer=5 | alpha=3.513e+04 n_pcs=4000 (pc_topk) weight={'name': 'pc_logistic', 'floor': 1e-06, 'clip_max': 7.0, 'prob_clip': 0.028030955506483476, 'n_components': 100, 'logistic_c': 4.839327039056537e-05, 'pca_fit': 'combined', 'solver': 'lbfgs', 'max_iter': 2000, 'fit_intercept': True, 'standardize_with_source': True, 'rho': 0.85}
[I 2026-06-01 19:15:49,912] Trial 192 finished with value: 0.2571938927761917 and parameters: {'alpha': 35126.60161283345, 'n_pcs': 4000, 'iw_method': 'pc_logistic', 'iw_clip_max': 7.0, 'iw_prob_clip': 0.028030955506483476, 'iw_n_components': 100, 'iw_logistic_c': 4.839327039056537e-05, 'iw_pca_fit': 'combined', 'iw_solver': 'lbfgs', 'iw_rho': 0.85}. Best is trial 147 with value: 0.25836214582968176.
2026-06-01 19:15:49 | INFO | Trial 193 | outer=5 | alpha=5.349e+04 n_pcs=4000 (pc_topk) weight={'name': 'pc_logistic', 'floor': 1e-06, 'clip_max': 7.0, 'prob_clip': 0.026532067036458776, 'n_components': 100, 'logistic_c': 6.057731783530732e-05, 'pca_fit': 'combined', 'solver': 'lbfgs', 'max_iter': 2000, 'fit_intercept': True, 'standardize_with_source': True, 'rho': 0.85}
[I 2026-06-01 19:16:03,245] Trial 193 finished with value: 0.2578637540801331 and parameters: {'alpha': 53490.72537782475, 'n_pcs': 4000, 'iw_method': 'pc_logistic', 'iw_clip_max': 7.0, 'iw_prob_clip': 0.026532067036458776, 'iw_n_components': 100, 'iw_logistic_c': 6.057731783530732e-05, 'iw_pca_fit': 'combined', 'iw_solver': 'lbfgs', 'iw_rho': 0.85}. Best is trial 147 with value: 0.25836214582968176.
2026-06-01 19:16:03 | INFO | Trial 194 | outer=5 | alpha=5.719e+04 n_pcs=4000 (pc_topk) weight={'name': 'pc_logistic', 'floor': 1e-06, 'clip_max': 7.0, 'prob_clip': 0.03138689280855448, 'n_components': 100, 'logistic_c': 6.547059260308067e-05, 'pca_fit': 'combined', 'solver': 'lbfgs', 'max_iter': 2000, 'fit_intercept': True, 'standardize_with_source': True, 'rho': 0.85}
[I 2026-06-01 19:16:16,766] Trial 194 finished with value: 0.2570736195061339 and parameters: {'alpha': 57193.372217140335, 'n_pcs': 4000, 'iw_method': 'pc_logistic', 'iw_clip_max': 7.0, 'iw_prob_clip': 0.03138689280855448, 'iw_n_components': 100, 'iw_logistic_c': 6.547059260308067e-05, 'iw_pca_fit': 'combined', 'iw_solver': 'lbfgs', 'iw_rho': 0.85}. Best is trial 147 with value: 0.25836214582968176.
2026-06-01 19:16:16 | INFO | Trial 195 | outer=5 | alpha=5.523e+04 n_pcs=4000 (pc_topk) weight={'name': 'pc_logistic', 'floor': 1e-06, 'clip_max': 7.0, 'prob_clip': 0.02635845028401315, 'n_components': 100, 'logistic_c': 3.5583697279002524e-05, 'pca_fit': 'combined', 'solver': 'lbfgs', 'max_iter': 2000, 'fit_intercept': True, 'standardize_with_source': True, 'rho': 0.85}
[I 2026-06-01 19:16:29,305] Trial 195 finished with value: 0.258173173679933 and parameters: {'alpha': 55230.111534590666, 'n_pcs': 4000, 'iw_method': 'pc_logistic', 'iw_clip_max': 7.0, 'iw_prob_clip': 0.02635845028401315, 'iw_n_components': 100, 'iw_logistic_c': 3.5583697279002524e-05, 'iw_pca_fit': 'combined', 'iw_solver': 'lbfgs', 'iw_rho': 0.85}. Best is trial 147 with value: 0.25836214582968176.
2026-06-01 19:16:29 | INFO | Trial 196 | outer=5 | alpha=4.963e+04 n_pcs=4000 (pc_topk) weight={'name': 'pc_logistic', 'floor': 1e-06, 'clip_max': 7.0, 'prob_clip': 0.02705107703789215, 'n_components': 100, 'logistic_c': 3.659478141740615e-05, 'pca_fit': 'combined', 'solver': 'lbfgs', 'max_iter': 2000, 'fit_intercept': True, 'standardize_with_source': True, 'rho': 0.85}
[I 2026-06-01 19:16:41,828] Trial 196 finished with value: 0.2582291686838769 and parameters: {'alpha': 49633.96378963162, 'n_pcs': 4000, 'iw_method': 'pc_logistic', 'iw_clip_max': 7.0, 'iw_prob_clip': 0.02705107703789215, 'iw_n_components': 100, 'iw_logistic_c': 3.659478141740615e-05, 'iw_pca_fit': 'combined', 'iw_solver': 'lbfgs', 'iw_rho': 0.85}. Best is trial 147 with value: 0.25836214582968176.
2026-06-01 19:16:41 | INFO | Trial 197 | outer=5 | alpha=5.005e+04 n_pcs=4000 (pc_topk) weight={'name': 'pc_logistic', 'floor': 1e-06, 'clip_max': 7.0, 'prob_clip': 0.03549402487356536, 'n_components': 100, 'logistic_c': 2.0899565636060045e-05, 'pca_fit': 'combined', 'solver': 'lbfgs', 'max_iter': 2000, 'fit_intercept': True, 'standardize_with_source': True, 'rho': 0.85}
[I 2026-06-01 19:16:53,590] Trial 197 finished with value: 0.2574950843980154 and parameters: {'alpha': 50052.95611426866, 'n_pcs': 4000, 'iw_method': 'pc_logistic', 'iw_clip_max': 7.0, 'iw_prob_clip': 0.03549402487356536, 'iw_n_components': 100, 'iw_logistic_c': 2.0899565636060045e-05, 'iw_pca_fit': 'combined', 'iw_solver': 'lbfgs', 'iw_rho': 0.85}. Best is trial 147 with value: 0.25836214582968176.
2026-06-01 19:16:53 | INFO | Trial 198 | outer=5 | alpha=5.758e+04 n_pcs=4000 (pc_topk) weight={'name': 'pc_logistic', 'floor': 1e-06, 'clip_max': 7.0, 'prob_clip': 0.02863070554237637, 'n_components': 100, 'logistic_c': 4.3266477577103354e-05, 'pca_fit': 'combined', 'solver': 'lbfgs', 'max_iter': 2000, 'fit_intercept': True, 'standardize_with_source': True, 'rho': 0.85}
[I 2026-06-01 19:17:06,434] Trial 198 finished with value: 0.2577908692049403 and parameters: {'alpha': 57584.302053699015, 'n_pcs': 4000, 'iw_method': 'pc_logistic', 'iw_clip_max': 7.0, 'iw_prob_clip': 0.02863070554237637, 'iw_n_components': 100, 'iw_logistic_c': 4.3266477577103354e-05, 'iw_pca_fit': 'combined', 'iw_solver': 'lbfgs', 'iw_rho': 0.85}. Best is trial 147 with value: 0.25836214582968176.
2026-06-01 19:17:06 | INFO | Trial 199 | outer=5 | alpha=5.944e+04 n_pcs=4000 (pc_topk) weight={'name': 'pc_logistic', 'floor': 1e-06, 'clip_max': 7.0, 'prob_clip': 0.02930663752313718, 'n_components': 100, 'logistic_c': 3.602413505351842e-05, 'pca_fit': 'combined', 'solver': 'lbfgs', 'max_iter': 2000, 'fit_intercept': True, 'standardize_with_source': True, 'rho': 0.85}
[I 2026-06-01 19:17:19,001] Trial 199 finished with value: 0.25788815930692416 and parameters: {'alpha': 59444.11131605322, 'n_pcs': 4000, 'iw_method': 'pc_logistic', 'iw_clip_max': 7.0, 'iw_prob_clip': 0.02930663752313718, 'iw_n_components': 100, 'iw_logistic_c': 3.602413505351842e-05, 'iw_pca_fit': 'combined', 'iw_solver': 'lbfgs', 'iw_rho': 0.85}. Best is trial 147 with value: 0.25836214582968176.
2026-06-01 19:17:19 | INFO | Trial 200 | outer=5 | alpha=8.444e+04 n_pcs=3500 (pc_topk) weight={'name': 'pc_logistic', 'floor': 1e-06, 'clip_max': 7.0, 'prob_clip': 0.02951599350148691, 'n_components': 100, 'logistic_c': 3.658841094773515e-05, 'pca_fit': 'combined', 'solver': 'lbfgs', 'max_iter': 2000, 'fit_intercept': True, 'standardize_with_source': True, 'rho': 0.85}
[I 2026-06-01 19:17:30,124] Trial 200 finished with value: 0.2540658766891723 and parameters: {'alpha': 84442.15992324788, 'n_pcs': 3500, 'iw_method': 'pc_logistic', 'iw_clip_max': 7.0, 'iw_prob_clip': 0.02951599350148691, 'iw_n_components': 100, 'iw_logistic_c': 3.658841094773515e-05, 'iw_pca_fit': 'combined', 'iw_solver': 'lbfgs', 'iw_rho': 0.85}. Best is trial 147 with value: 0.25836214582968176.
2026-06-01 19:17:30 | INFO | Trial 201 | outer=5 | alpha=6.171e+04 n_pcs=4000 (pc_topk) weight={'name': 'pc_logistic', 'floor': 1e-06, 'clip_max': 7.0, 'prob_clip': 0.03390264303255723, 'n_components': 100, 'logistic_c': 2.49332595785845e-05, 'pca_fit': 'combined', 'solver': 'lbfgs', 'max_iter': 2000, 'fit_intercept': True, 'standardize_with_source': True, 'rho': 0.85}
[I 2026-06-01 19:17:42,540] Trial 201 finished with value: 0.25756465747038326 and parameters: {'alpha': 61714.90272847296, 'n_pcs': 4000, 'iw_method': 'pc_logistic', 'iw_clip_max': 7.0, 'iw_prob_clip': 0.03390264303255723, 'iw_n_components': 100, 'iw_logistic_c': 2.49332595785845e-05, 'iw_pca_fit': 'combined', 'iw_solver': 'lbfgs', 'iw_rho': 0.85}. Best is trial 147 with value: 0.25836214582968176.
2026-06-01 19:17:42 | INFO | Trial 202 | outer=5 | alpha=5.912e+04 n_pcs=4000 (pc_topk) weight={'name': 'pc_logistic', 'floor': 1e-06, 'clip_max': 7.0, 'prob_clip': 0.034882614610752885, 'n_components': 100, 'logistic_c': 1.0896606816212217e-05, 'pca_fit': 'combined', 'solver': 'lbfgs', 'max_iter': 2000, 'fit_intercept': True, 'standardize_with_source': True, 'rho': 0.85}
[I 2026-06-01 19:17:54,669] Trial 202 finished with value: 0.25400193612263183 and parameters: {'alpha': 59123.168751376, 'n_pcs': 4000, 'iw_method': 'pc_logistic', 'iw_clip_max': 7.0, 'iw_prob_clip': 0.034882614610752885, 'iw_n_components': 100, 'iw_logistic_c': 1.0896606816212217e-05, 'iw_pca_fit': 'combined', 'iw_solver': 'lbfgs', 'iw_rho': 0.85}. Best is trial 147 with value: 0.25836214582968176.
2026-06-01 19:17:54 | INFO | Trial 203 | outer=5 | alpha=6.245e+04 n_pcs=4000 (pc_topk) weight={'name': 'pc_logistic', 'floor': 1e-06, 'clip_max': 7.0, 'prob_clip': 0.039928977234839, 'n_components': 100, 'logistic_c': 1.6175502281133166e-05, 'pca_fit': 'combined', 'solver': 'lbfgs', 'max_iter': 2000, 'fit_intercept': True, 'standardize_with_source': True, 'rho': 0.85}
[I 2026-06-01 19:18:07,640] Trial 203 finished with value: 0.2546678408193391 and parameters: {'alpha': 62450.55719573515, 'n_pcs': 4000, 'iw_method': 'pc_logistic', 'iw_clip_max': 7.0, 'iw_prob_clip': 0.039928977234839, 'iw_n_components': 100, 'iw_logistic_c': 1.6175502281133166e-05, 'iw_pca_fit': 'combined', 'iw_solver': 'lbfgs', 'iw_rho': 0.85}. Best is trial 147 with value: 0.25836214582968176.
2026-06-01 19:18:07 | INFO | Trial 204 | outer=5 | alpha=8.096e+04 n_pcs=4000 (pc_topk) weight={'name': 'pc_logistic', 'floor': 1e-06, 'clip_max': 7.0, 'prob_clip': 0.031976931450357085, 'n_components': 100, 'logistic_c': 2.7273273441356558e-05, 'pca_fit': 'combined', 'solver': 'lbfgs', 'max_iter': 2000, 'fit_intercept': True, 'standardize_with_source': True, 'rho': 0.85}
[I 2026-06-01 19:18:20,299] Trial 204 finished with value: 0.2564093613673755 and parameters: {'alpha': 80960.48692439389, 'n_pcs': 4000, 'iw_method': 'pc_logistic', 'iw_clip_max': 7.0, 'iw_prob_clip': 0.031976931450357085, 'iw_n_components': 100, 'iw_logistic_c': 2.7273273441356558e-05, 'iw_pca_fit': 'combined', 'iw_solver': 'lbfgs', 'iw_rho': 0.85}. Best is trial 147 with value: 0.25836214582968176.
2026-06-01 19:18:20 | INFO | Trial 205 | outer=5 | alpha=4.936e+04 n_pcs=4000 (pc_topk) weight={'name': 'pc_logistic', 'floor': 1e-06, 'clip_max': 7.0, 'prob_clip': 0.027919700737471402, 'n_components': 100, 'logistic_c': 4.1187712858707756e-05, 'pca_fit': 'combined', 'solver': 'lbfgs', 'max_iter': 2000, 'fit_intercept': True, 'standardize_with_source': True, 'rho': 0.85}
