[I 2026-06-01 16:49:00,266] Trial 222 finished with value: 0.20845045197237097 and parameters: {'alpha': 96161.66267725617, 'n_pcs': 2000, 'iw_method': 'pc_logistic', 'iw_clip_max': 2.5, 'iw_prob_clip': 0.006758844311876246, 'iw_n_components': 80, 'iw_logistic_c': 1.5269811632855904e-05, 'iw_pca_fit': 'combined', 'iw_solver': 'lbfgs', 'iw_rho': 1.0}. Best is trial 217 with value: 0.20866809896703806.
2026-06-01 16:49:00 | INFO | Trial 223 | outer=3 | alpha=9.595e+04 n_pcs=2000 (pc_topk) weight={'name': 'pc_logistic', 'floor': 1e-06, 'clip_max': 2.5, 'prob_clip': 0.006876316683142332, 'n_components': 80, 'logistic_c': 1.6535216218211263e-05, 'pca_fit': 'combined', 'solver': 'lbfgs', 'max_iter': 2000, 'fit_intercept': True, 'standardize_with_source': True, 'rho': 1.0}
[I 2026-06-01 16:49:15,139] Trial 223 finished with value: 0.20827237600162415 and parameters: {'alpha': 95947.10712679605, 'n_pcs': 2000, 'iw_method': 'pc_logistic', 'iw_clip_max': 2.5, 'iw_prob_clip': 0.006876316683142332, 'iw_n_components': 80, 'iw_logistic_c': 1.6535216218211263e-05, 'iw_pca_fit': 'combined', 'iw_solver': 'lbfgs', 'iw_rho': 1.0}. Best is trial 217 with value: 0.20866809896703806.
2026-06-01 16:49:15 | INFO | Trial 224 | outer=3 | alpha=3.852e+03 n_pcs=2000 (pc_topk) weight={'name': 'pc_logistic', 'floor': 1e-06, 'clip_max': 2.5, 'prob_clip': 0.0064777450100830455, 'n_components': 80, 'logistic_c': 1.726368807164517e-05, 'pca_fit': 'combined', 'solver': 'lbfgs', 'max_iter': 2000, 'fit_intercept': True, 'standardize_with_source': True, 'rho': 1.0}
[I 2026-06-01 16:49:23,420] Trial 224 finished with value: 0.15052149721274297 and parameters: {'alpha': 3852.08944540867, 'n_pcs': 2000, 'iw_method': 'pc_logistic', 'iw_clip_max': 2.5, 'iw_prob_clip': 0.0064777450100830455, 'iw_n_components': 80, 'iw_logistic_c': 1.726368807164517e-05, 'iw_pca_fit': 'combined', 'iw_solver': 'lbfgs', 'iw_rho': 1.0}. Best is trial 217 with value: 0.20866809896703806.
2026-06-01 16:49:23 | INFO | Trial 225 | outer=3 | alpha=8.049e+04 n_pcs=2000 (pc_topk) weight={'name': 'pc_logistic', 'floor': 1e-06, 'clip_max': 2.5, 'prob_clip': 0.008637492672351277, 'n_components': 80, 'logistic_c': 1.61646227380421e-05, 'pca_fit': 'combined', 'solver': 'lbfgs', 'max_iter': 2000, 'fit_intercept': True, 'standardize_with_source': True, 'rho': 1.0}
[I 2026-06-01 16:49:32,189] Trial 225 finished with value: 0.2074591380140663 and parameters: {'alpha': 80489.93338404913, 'n_pcs': 2000, 'iw_method': 'pc_logistic', 'iw_clip_max': 2.5, 'iw_prob_clip': 0.008637492672351277, 'iw_n_components': 80, 'iw_logistic_c': 1.61646227380421e-05, 'iw_pca_fit': 'combined', 'iw_solver': 'lbfgs', 'iw_rho': 1.0}. Best is trial 217 with value: 0.20866809896703806.
2026-06-01 16:49:32 | INFO | Trial 226 | outer=3 | alpha=9.622e+04 n_pcs=1500 (pc_topk) weight={'name': 'pc_logistic', 'floor': 1e-06, 'clip_max': 2.5, 'prob_clip': 0.007000607864887643, 'n_components': 80, 'logistic_c': 1.0675286387683827e-05, 'pca_fit': 'combined', 'solver': 'lbfgs', 'max_iter': 2000, 'fit_intercept': True, 'standardize_with_source': True, 'rho': 1.0}
[I 2026-06-01 16:49:42,999] Trial 226 finished with value: 0.19819104137167864 and parameters: {'alpha': 96215.52360774779, 'n_pcs': 1500, 'iw_method': 'pc_logistic', 'iw_clip_max': 2.5, 'iw_prob_clip': 0.007000607864887643, 'iw_n_components': 80, 'iw_logistic_c': 1.0675286387683827e-05, 'iw_pca_fit': 'combined', 'iw_solver': 'lbfgs', 'iw_rho': 1.0}. Best is trial 217 with value: 0.20866809896703806.
2026-06-01 16:49:43 | INFO | Trial 227 | outer=3 | alpha=7.554e+04 n_pcs=2000 (pc_topk) weight={'name': 'pc_logistic', 'floor': 1e-06, 'clip_max': 2.5, 'prob_clip': 0.008143296513960436, 'n_components': 80, 'logistic_c': 1.4933303059430269e-05, 'pca_fit': 'combined', 'solver': 'lbfgs', 'max_iter': 2000, 'fit_intercept': True, 'standardize_with_source': True, 'rho': 1.0}
[I 2026-06-01 16:49:55,273] Trial 227 finished with value: 0.2072770164603861 and parameters: {'alpha': 75540.51290601188, 'n_pcs': 2000, 'iw_method': 'pc_logistic', 'iw_clip_max': 2.5, 'iw_prob_clip': 0.008143296513960436, 'iw_n_components': 80, 'iw_logistic_c': 1.4933303059430269e-05, 'iw_pca_fit': 'combined', 'iw_solver': 'lbfgs', 'iw_rho': 1.0}. Best is trial 217 with value: 0.20866809896703806.
2026-06-01 16:49:55 | INFO | Trial 228 | outer=3 | alpha=1.013e+05 n_pcs=1500 (pc_topk) weight={'name': 'pc_logistic', 'floor': 1e-06, 'clip_max': 7.0, 'prob_clip': 0.010307237667920507, 'n_components': 80, 'logistic_c': 7.197871553560751e-06, 'pca_fit': 'combined', 'solver': 'lbfgs', 'max_iter': 2000, 'fit_intercept': True, 'standardize_with_source': True, 'rho': 1.0}
[I 2026-06-01 16:50:04,126] Trial 228 finished with value: 0.1946937210800344 and parameters: {'alpha': 101318.97199578347, 'n_pcs': 1500, 'iw_method': 'pc_logistic', 'iw_clip_max': 7.0, 'iw_prob_clip': 0.010307237667920507, 'iw_n_components': 80, 'iw_logistic_c': 7.197871553560751e-06, 'iw_pca_fit': 'combined', 'iw_solver': 'lbfgs', 'iw_rho': 1.0}. Best is trial 217 with value: 0.20866809896703806.
2026-06-01 16:50:04 | INFO | Trial 229 | outer=3 | alpha=8.447e+04 n_pcs=2000 (pc_topk) weight={'name': 'pc_logistic', 'floor': 1e-06, 'clip_max': 2.5, 'prob_clip': 0.005832844884788604, 'n_components': 80, 'logistic_c': 1.6415596315091633e-05, 'pca_fit': 'combined', 'solver': 'lbfgs', 'max_iter': 2000, 'fit_intercept': True, 'standardize_with_source': True, 'rho': 1.0}
[I 2026-06-01 16:50:12,558] Trial 229 finished with value: 0.20768909304279579 and parameters: {'alpha': 84471.10988025993, 'n_pcs': 2000, 'iw_method': 'pc_logistic', 'iw_clip_max': 2.5, 'iw_prob_clip': 0.005832844884788604, 'iw_n_components': 80, 'iw_logistic_c': 1.6415596315091633e-05, 'iw_pca_fit': 'combined', 'iw_solver': 'lbfgs', 'iw_rho': 1.0}. Best is trial 217 with value: 0.20866809896703806.
2026-06-01 16:50:12 | INFO | Trial 230 | outer=3 | alpha=1.017e+05 n_pcs=2000 (pc_topk) weight={'name': 'pc_logistic', 'floor': 1e-06, 'clip_max': 2.5, 'prob_clip': 0.00887016924969883, 'n_components': 80, 'logistic_c': 1.0224438673755289e-05, 'pca_fit': 'combined', 'solver': 'lbfgs', 'max_iter': 2000, 'fit_intercept': True, 'standardize_with_source': True, 'rho': 1.0}
[I 2026-06-01 16:50:21,133] Trial 230 finished with value: 0.20921080748704607 and parameters: {'alpha': 101665.45647621459, 'n_pcs': 2000, 'iw_method': 'pc_logistic', 'iw_clip_max': 2.5, 'iw_prob_clip': 0.00887016924969883, 'iw_n_components': 80, 'iw_logistic_c': 1.0224438673755289e-05, 'iw_pca_fit': 'combined', 'iw_solver': 'lbfgs', 'iw_rho': 1.0}. Best is trial 230 with value: 0.20921080748704607.
2026-06-01 16:50:21 | INFO | Trial 231 | outer=3 | alpha=1.045e+05 n_pcs=2000 (pc_topk) weight={'name': 'pc_logistic', 'floor': 1e-06, 'clip_max': 2.5, 'prob_clip': 0.009100168260069721, 'n_components': 80, 'logistic_c': 1.0047293877096534e-05, 'pca_fit': 'combined', 'solver': 'lbfgs', 'max_iter': 2000, 'fit_intercept': True, 'standardize_with_source': True, 'rho': 1.0}
[I 2026-06-01 16:50:30,399] Trial 231 finished with value: 0.2092611648404587 and parameters: {'alpha': 104542.2545522225, 'n_pcs': 2000, 'iw_method': 'pc_logistic', 'iw_clip_max': 2.5, 'iw_prob_clip': 0.009100168260069721, 'iw_n_components': 80, 'iw_logistic_c': 1.0047293877096534e-05, 'iw_pca_fit': 'combined', 'iw_solver': 'lbfgs', 'iw_rho': 1.0}. Best is trial 231 with value: 0.2092611648404587.
2026-06-01 16:50:30 | INFO | Trial 232 | outer=3 | alpha=7.405e+04 n_pcs=1500 (pc_topk) weight={'name': 'pc_logistic', 'floor': 1e-06, 'clip_max': 2.5, 'prob_clip': 0.009222257512516907, 'n_components': 80, 'logistic_c': 1.5864644706779322e-07, 'pca_fit': 'combined', 'solver': 'lbfgs', 'max_iter': 2000, 'fit_intercept': True, 'standardize_with_source': True, 'rho': 1.0}
[I 2026-06-01 16:50:37,597] Trial 232 finished with value: 0.19060543985657288 and parameters: {'alpha': 74050.91164672752, 'n_pcs': 1500, 'iw_method': 'pc_logistic', 'iw_clip_max': 2.5, 'iw_prob_clip': 0.009222257512516907, 'iw_n_components': 80, 'iw_logistic_c': 1.5864644706779322e-07, 'iw_pca_fit': 'combined', 'iw_solver': 'lbfgs', 'iw_rho': 1.0}. Best is trial 231 with value: 0.2092611648404587.
2026-06-01 16:50:37 | INFO | Trial 233 | outer=3 | alpha=1.088e+05 n_pcs=2000 (pc_topk) weight={'name': 'pc_logistic', 'floor': 1e-06, 'clip_max': 2.5, 'prob_clip': 0.0075108050103381355, 'n_components': 80, 'logistic_c': 9.588158328347468e-06, 'pca_fit': 'combined', 'solver': 'lbfgs', 'max_iter': 2000, 'fit_intercept': True, 'standardize_with_source': True, 'rho': 1.0}
[I 2026-06-01 16:50:46,227] Trial 233 finished with value: 0.20922498006693085 and parameters: {'alpha': 108835.07442600284, 'n_pcs': 2000, 'iw_method': 'pc_logistic', 'iw_clip_max': 2.5, 'iw_prob_clip': 0.0075108050103381355, 'iw_n_components': 80, 'iw_logistic_c': 9.588158328347468e-06, 'iw_pca_fit': 'combined', 'iw_solver': 'lbfgs', 'iw_rho': 1.0}. Best is trial 231 with value: 0.2092611648404587.
2026-06-01 16:50:46 | INFO | Trial 234 | outer=3 | alpha=1.152e+05 n_pcs=2000 (pc_topk) weight={'name': 'pc_logistic', 'floor': 1e-06, 'clip_max': 2.5, 'prob_clip': 0.007345703114646151, 'n_components': 80, 'logistic_c': 9.540249027056151e-06, 'pca_fit': 'combined', 'solver': 'lbfgs', 'max_iter': 2000, 'fit_intercept': True, 'standardize_with_source': True, 'rho': 1.0}
[I 2026-06-01 16:50:53,934] Trial 234 finished with value: 0.20928839067708963 and parameters: {'alpha': 115245.8193094507, 'n_pcs': 2000, 'iw_method': 'pc_logistic', 'iw_clip_max': 2.5, 'iw_prob_clip': 0.007345703114646151, 'iw_n_components': 80, 'iw_logistic_c': 9.540249027056151e-06, 'iw_pca_fit': 'combined', 'iw_solver': 'lbfgs', 'iw_rho': 1.0}. Best is trial 234 with value: 0.20928839067708963.
2026-06-01 16:50:53 | INFO | Trial 235 | outer=3 | alpha=1.150e+05 n_pcs=2000 (pc_topk) weight={'name': 'pc_logistic', 'floor': 1e-06, 'clip_max': 2.5, 'prob_clip': 0.00707005508271535, 'n_components': 80, 'logistic_c': 9.151905022133257e-06, 'pca_fit': 'combined', 'solver': 'lbfgs', 'max_iter': 2000, 'fit_intercept': True, 'standardize_with_source': True, 'rho': 1.0}
[I 2026-06-01 16:51:02,520] Trial 235 finished with value: 0.20912005015919832 and parameters: {'alpha': 114992.74873436443, 'n_pcs': 2000, 'iw_method': 'pc_logistic', 'iw_clip_max': 2.5, 'iw_prob_clip': 0.00707005508271535, 'iw_n_components': 80, 'iw_logistic_c': 9.151905022133257e-06, 'iw_pca_fit': 'combined', 'iw_solver': 'lbfgs', 'iw_rho': 1.0}. Best is trial 234 with value: 0.20928839067708963.
2026-06-01 16:51:02 | INFO | Trial 236 | outer=3 | alpha=1.176e+05 n_pcs=2000 (pc_topk) weight={'name': 'pc_logistic', 'floor': 1e-06, 'clip_max': 2.5, 'prob_clip': 0.0071207166807494525, 'n_components': 80, 'logistic_c': 7.1772946499880515e-06, 'pca_fit': 'combined', 'solver': 'lbfgs', 'max_iter': 2000, 'fit_intercept': True, 'standardize_with_source': True, 'rho': 1.0}
[I 2026-06-01 16:51:09,763] Trial 236 finished with value: 0.20871778909396427 and parameters: {'alpha': 117601.78869194511, 'n_pcs': 2000, 'iw_method': 'pc_logistic', 'iw_clip_max': 2.5, 'iw_prob_clip': 0.0071207166807494525, 'iw_n_components': 80, 'iw_logistic_c': 7.1772946499880515e-06, 'iw_pca_fit': 'combined', 'iw_solver': 'lbfgs', 'iw_rho': 1.0}. Best is trial 234 with value: 0.20928839067708963.
2026-06-01 16:51:09 | INFO | Trial 237 | outer=3 | alpha=1.202e+05 n_pcs=2000 (pc_topk) weight={'name': 'pc_logistic', 'floor': 1e-06, 'clip_max': 12.0, 'prob_clip': 0.00692260724416455, 'n_components': 80, 'logistic_c': 7.215629581141981e-06, 'pca_fit': 'combined', 'solver': 'lbfgs', 'max_iter': 2000, 'fit_intercept': True, 'standardize_with_source': True, 'rho': 1.0}
[I 2026-06-01 16:51:18,294] Trial 237 finished with value: 0.20427709006072364 and parameters: {'alpha': 120194.35094341806, 'n_pcs': 2000, 'iw_method': 'pc_logistic', 'iw_clip_max': 12.0, 'iw_prob_clip': 0.00692260724416455, 'iw_n_components': 80, 'iw_logistic_c': 7.215629581141981e-06, 'iw_pca_fit': 'combined', 'iw_solver': 'lbfgs', 'iw_rho': 1.0}. Best is trial 234 with value: 0.20928839067708963.
2026-06-01 16:51:18 | INFO | Trial 238 | outer=3 | alpha=1.214e+05 n_pcs=2000 (pc_topk) weight={'name': 'pc_logistic', 'floor': 1e-06, 'clip_max': 4.0, 'prob_clip': 0.0051603872038373, 'n_components': 80, 'logistic_c': 3.809853161328309e-06, 'pca_fit': 'combined', 'solver': 'lbfgs', 'max_iter': 2000, 'fit_intercept': True, 'standardize_with_source': True, 'rho': 1.0}
[I 2026-06-01 16:51:27,190] Trial 238 finished with value: 0.20643579556395522 and parameters: {'alpha': 121425.95561307731, 'n_pcs': 2000, 'iw_method': 'pc_logistic', 'iw_clip_max': 4.0, 'iw_prob_clip': 0.0051603872038373, 'iw_n_components': 80, 'iw_logistic_c': 3.809853161328309e-06, 'iw_pca_fit': 'combined', 'iw_solver': 'lbfgs', 'iw_rho': 1.0}. Best is trial 234 with value: 0.20928839067708963.
2026-06-01 16:51:27 | INFO | Trial 239 | outer=3 | alpha=1.541e+05 n_pcs=2500 (pc_topk) weight={'name': 'pc_logistic', 'floor': 1e-06, 'clip_max': 2.5, 'prob_clip': 0.009547438107728269, 'n_components': 80, 'logistic_c': 9.159801126232162e-06, 'pca_fit': 'combined', 'solver': 'lbfgs', 'max_iter': 2000, 'fit_intercept': True, 'standardize_with_source': True, 'rho': 1.0}
[I 2026-06-01 16:51:36,327] Trial 239 finished with value: 0.2086984415330861 and parameters: {'alpha': 154113.56878581704, 'n_pcs': 2500, 'iw_method': 'pc_logistic', 'iw_clip_max': 2.5, 'iw_prob_clip': 0.009547438107728269, 'iw_n_components': 80, 'iw_logistic_c': 9.159801126232162e-06, 'iw_pca_fit': 'combined', 'iw_solver': 'lbfgs', 'iw_rho': 1.0}. Best is trial 234 with value: 0.20928839067708963.
2026-06-01 16:51:36 | INFO | Trial 240 | outer=3 | alpha=1.394e+05 n_pcs=2500 (pc_topk) weight={'name': 'pc_logistic', 'floor': 1e-06, 'clip_max': 2.5, 'prob_clip': 0.009402902006472563, 'n_components': 80, 'logistic_c': 2.0465658511076523e-06, 'pca_fit': 'combined', 'solver': 'lbfgs', 'max_iter': 2000, 'fit_intercept': True, 'standardize_with_source': True, 'rho': 1.0}
[I 2026-06-01 16:51:47,000] Trial 240 finished with value: 0.20497873613967207 and parameters: {'alpha': 139409.62278761377, 'n_pcs': 2500, 'iw_method': 'pc_logistic', 'iw_clip_max': 2.5, 'iw_prob_clip': 0.009402902006472563, 'iw_n_components': 80, 'iw_logistic_c': 2.0465658511076523e-06, 'iw_pca_fit': 'combined', 'iw_solver': 'lbfgs', 'iw_rho': 1.0}. Best is trial 234 with value: 0.20928839067708963.
2026-06-01 16:51:47 | INFO | Trial 241 | outer=3 | alpha=1.202e+05 n_pcs=2000 (pc_topk) weight={'name': 'pc_logistic', 'floor': 1e-06, 'clip_max': 2.5, 'prob_clip': 0.007235374815981054, 'n_components': 80, 'logistic_c': 9.519428662639181e-06, 'pca_fit': 'combined', 'solver': 'lbfgs', 'max_iter': 2000, 'fit_intercept': True, 'standardize_with_source': True, 'rho': 1.0}
[I 2026-06-01 16:51:55,631] Trial 241 finished with value: 0.20932368732848952 and parameters: {'alpha': 120185.96238612424, 'n_pcs': 2000, 'iw_method': 'pc_logistic', 'iw_clip_max': 2.5, 'iw_prob_clip': 0.007235374815981054, 'iw_n_components': 80, 'iw_logistic_c': 9.519428662639181e-06, 'iw_pca_fit': 'combined', 'iw_solver': 'lbfgs', 'iw_rho': 1.0}. Best is trial 241 with value: 0.20932368732848952.
2026-06-01 16:51:55 | INFO | Trial 242 | outer=3 | alpha=3.731e+06 n_pcs=2000 (pc_topk) weight={'name': 'pc_logistic', 'floor': 1e-06, 'clip_max': 2.5, 'prob_clip': 0.0062737903587509495, 'n_components': 80, 'logistic_c': 9.220882388676917e-06, 'pca_fit': 'combined', 'solver': 'lbfgs', 'max_iter': 2000, 'fit_intercept': True, 'standardize_with_source': True, 'rho': 1.0}
[I 2026-06-01 16:52:06,702] Trial 242 finished with value: 0.19844119984292244 and parameters: {'alpha': 3730855.707283883, 'n_pcs': 2000, 'iw_method': 'pc_logistic', 'iw_clip_max': 2.5, 'iw_prob_clip': 0.0062737903587509495, 'iw_n_components': 80, 'iw_logistic_c': 9.220882388676917e-06, 'iw_pca_fit': 'combined', 'iw_solver': 'lbfgs', 'iw_rho': 1.0}. Best is trial 241 with value: 0.20932368732848952.
2026-06-01 16:52:06 | INFO | Trial 243 | outer=3 | alpha=1.549e+05 n_pcs=2000 (pc_topk) weight={'name': 'pc_logistic', 'floor': 1e-06, 'clip_max': 2.5, 'prob_clip': 0.007476470955232412, 'n_components': 80, 'logistic_c': 6.8605856345189875e-06, 'pca_fit': 'combined', 'solver': 'lbfgs', 'max_iter': 2000, 'fit_intercept': True, 'standardize_with_source': True, 'rho': 1.0}
[I 2026-06-01 16:52:18,455] Trial 243 finished with value: 0.20835540662911325 and parameters: {'alpha': 154874.45633653077, 'n_pcs': 2000, 'iw_method': 'pc_logistic', 'iw_clip_max': 2.5, 'iw_prob_clip': 0.007476470955232412, 'iw_n_components': 80, 'iw_logistic_c': 6.8605856345189875e-06, 'iw_pca_fit': 'combined', 'iw_solver': 'lbfgs', 'iw_rho': 1.0}. Best is trial 241 with value: 0.20932368732848952.
2026-06-01 16:52:18 | INFO | Trial 244 | outer=3 | alpha=1.517e+05 n_pcs=2000 (pc_topk) weight={'name': 'pc_logistic', 'floor': 1e-06, 'clip_max': 2.5, 'prob_clip': 0.007284843255051435, 'n_components': 80, 'logistic_c': 5.854667007462025e-06, 'pca_fit': 'combined', 'solver': 'lbfgs', 'max_iter': 2000, 'fit_intercept': True, 'standardize_with_source': True, 'rho': 1.0}
[I 2026-06-01 16:52:26,933] Trial 244 finished with value: 0.2080546642040797 and parameters: {'alpha': 151653.51837009823, 'n_pcs': 2000, 'iw_method': 'pc_logistic', 'iw_clip_max': 2.5, 'iw_prob_clip': 0.007284843255051435, 'iw_n_components': 80, 'iw_logistic_c': 5.854667007462025e-06, 'iw_pca_fit': 'combined', 'iw_solver': 'lbfgs', 'iw_rho': 1.0}. Best is trial 241 with value: 0.20932368732848952.
2026-06-01 16:52:27 | INFO | Trial 245 | outer=3 | alpha=1.544e+05 n_pcs=2000 (pc_topk) weight={'name': 'pc_logistic', 'floor': 1e-06, 'clip_max': 2.5, 'prob_clip': 0.007404469464038153, 'n_components': 80, 'logistic_c': 9.086957652706991e-06, 'pca_fit': 'combined', 'solver': 'lbfgs', 'max_iter': 2000, 'fit_intercept': True, 'standardize_with_source': True, 'rho': 1.0}
[I 2026-06-01 16:52:35,473] Trial 245 finished with value: 0.2091124974301784 and parameters: {'alpha': 154407.44204418838, 'n_pcs': 2000, 'iw_method': 'pc_logistic', 'iw_clip_max': 2.5, 'iw_prob_clip': 0.007404469464038153, 'iw_n_components': 80, 'iw_logistic_c': 9.086957652706991e-06, 'iw_pca_fit': 'combined', 'iw_solver': 'lbfgs', 'iw_rho': 1.0}. Best is trial 241 with value: 0.20932368732848952.
2026-06-01 16:52:35 | INFO | Trial 246 | outer=3 | alpha=1.467e+05 n_pcs=2000 (pc_topk) weight={'name': 'pc_logistic', 'floor': 1e-06, 'clip_max': 2.5, 'prob_clip': 0.0071858861652314785, 'n_components': 80, 'logistic_c': 8.145745292037311e-06, 'pca_fit': 'combined', 'solver': 'lbfgs', 'max_iter': 2000, 'fit_intercept': True, 'standardize_with_source': True, 'rho': 1.0}
[I 2026-06-01 16:52:49,862] Trial 246 finished with value: 0.20890170623841672 and parameters: {'alpha': 146671.31949089826, 'n_pcs': 2000, 'iw_method': 'pc_logistic', 'iw_clip_max': 2.5, 'iw_prob_clip': 0.0071858861652314785, 'iw_n_components': 80, 'iw_logistic_c': 8.145745292037311e-06, 'iw_pca_fit': 'combined', 'iw_solver': 'lbfgs', 'iw_rho': 1.0}. Best is trial 241 with value: 0.20932368732848952.
2026-06-01 16:52:49 | INFO | Trial 247 | outer=3 | alpha=1.582e+05 n_pcs=2000 (pc_topk) weight={'name': 'pc_logistic', 'floor': 1e-06, 'clip_max': 2.5, 'prob_clip': 0.005584174604946747, 'n_components': 80, 'logistic_c': 4.910716780935783e-06, 'pca_fit': 'combined', 'solver': 'lbfgs', 'max_iter': 2000, 'fit_intercept': True, 'standardize_with_source': True, 'rho': 1.0}
[I 2026-06-01 16:52:58,599] Trial 247 finished with value: 0.20733518329969658 and parameters: {'alpha': 158195.2143304421, 'n_pcs': 2000, 'iw_method': 'pc_logistic', 'iw_clip_max': 2.5, 'iw_prob_clip': 0.005584174604946747, 'iw_n_components': 80, 'iw_logistic_c': 4.910716780935783e-06, 'iw_pca_fit': 'combined', 'iw_solver': 'lbfgs', 'iw_rho': 1.0}. Best is trial 241 with value: 0.20932368732848952.
2026-06-01 16:52:58 | INFO | Trial 248 | outer=3 | alpha=1.586e+05 n_pcs=2000 (pc_topk) weight={'name': 'pc_logistic', 'floor': 1e-06, 'clip_max': 2.5, 'prob_clip': 0.0073583725754801715, 'n_components': 80, 'logistic_c': 9.24173630515916e-06, 'pca_fit': 'combined', 'solver': 'lbfgs', 'max_iter': 2000, 'fit_intercept': True, 'standardize_with_source': True, 'rho': 1.0}
[I 2026-06-01 16:53:07,233] Trial 248 finished with value: 0.20915668541840238 and parameters: {'alpha': 158579.5939474418, 'n_pcs': 2000, 'iw_method': 'pc_logistic', 'iw_clip_max': 2.5, 'iw_prob_clip': 0.0073583725754801715, 'iw_n_components': 80, 'iw_logistic_c': 9.24173630515916e-06, 'iw_pca_fit': 'combined', 'iw_solver': 'lbfgs', 'iw_rho': 1.0}. Best is trial 241 with value: 0.20932368732848952.
2026-06-01 16:53:07 | INFO | Trial 249 | outer=3 | alpha=1.514e+05 n_pcs=2000 (pc_topk) weight={'name': 'pc_logistic', 'floor': 1e-06, 'clip_max': 2.5, 'prob_clip': 0.007202683594102386, 'n_components': 80, 'logistic_c': 7.522135102358964e-06, 'pca_fit': 'combined', 'solver': 'lbfgs', 'max_iter': 2000, 'fit_intercept': True, 'standardize_with_source': True, 'rho': 1.0}
[I 2026-06-01 16:53:16,120] Trial 249 finished with value: 0.20879646519132256 and parameters: {'alpha': 151365.7611612972, 'n_pcs': 2000, 'iw_method': 'pc_logistic', 'iw_clip_max': 2.5, 'iw_prob_clip': 0.007202683594102386, 'iw_n_components': 80, 'iw_logistic_c': 7.522135102358964e-06, 'iw_pca_fit': 'combined', 'iw_solver': 'lbfgs', 'iw_rho': 1.0}. Best is trial 241 with value: 0.20932368732848952.
2026-06-01 16:53:16 | INFO | Trial 250 | outer=3 | alpha=1.552e+05 n_pcs=2000 (pc_topk) weight={'name': 'pc_logistic', 'floor': 1e-06, 'clip_max': 2.5, 'prob_clip': 0.007057079385217098, 'n_components': 80, 'logistic_c': 7.374981107738341e-06, 'pca_fit': 'combined', 'solver': 'lbfgs', 'max_iter': 2000, 'fit_intercept': True, 'standardize_with_source': True, 'rho': 1.0}
