[I 2026-06-01 21:29:33,135] Trial 84 finished with value: 0.2289525216150688 and parameters: {'alpha': 33330.852725894554, 'n_pcs': 4500, 'iw_method': 'pc_logistic', 'iw_clip_max': 7.0, 'iw_prob_clip': 0.029075876159245926, 'iw_n_components': 40, 'iw_logistic_c': 7.898477934061196e-05, 'iw_pca_fit': 'combined', 'iw_solver': 'lbfgs', 'iw_rho': 0.5}. Best is trial 84 with value: 0.2289525216150688.
2026-06-01 21:29:33 | INFO | Trial 85 | outer=7 | alpha=3.463e+04 n_pcs=4500 (pc_topk) weight={'name': 'pc_logistic', 'floor': 1e-06, 'clip_max': 12.0, 'prob_clip': 0.04869617567326469, 'n_components': 40, 'logistic_c': 0.00011928351976358275, 'pca_fit': 'combined', 'solver': 'lbfgs', 'max_iter': 2000, 'fit_intercept': True, 'standardize_with_source': True, 'rho': 0.5}
[I 2026-06-01 21:29:47,671] Trial 85 finished with value: 0.2253832514014152 and parameters: {'alpha': 34633.13828596312, 'n_pcs': 4500, 'iw_method': 'pc_logistic', 'iw_clip_max': 12.0, 'iw_prob_clip': 0.04869617567326469, 'iw_n_components': 40, 'iw_logistic_c': 0.00011928351976358275, 'iw_pca_fit': 'combined', 'iw_solver': 'lbfgs', 'iw_rho': 0.5}. Best is trial 84 with value: 0.2289525216150688.
2026-06-01 21:29:47 | INFO | Trial 86 | outer=7 | alpha=3.444e+04 n_pcs=4500 (pc_topk) weight={'name': 'pc_logistic', 'floor': 1e-06, 'clip_max': 12.0, 'prob_clip': 0.04841376226156099, 'n_components': 40, 'logistic_c': 8.433207807709895e-05, 'pca_fit': 'combined', 'solver': 'lbfgs', 'max_iter': 2000, 'fit_intercept': True, 'standardize_with_source': True, 'rho': 0.5}
[I 2026-06-01 21:30:01,887] Trial 86 finished with value: 0.22530308916693773 and parameters: {'alpha': 34439.80334028933, 'n_pcs': 4500, 'iw_method': 'pc_logistic', 'iw_clip_max': 12.0, 'iw_prob_clip': 0.04841376226156099, 'iw_n_components': 40, 'iw_logistic_c': 8.433207807709895e-05, 'iw_pca_fit': 'combined', 'iw_solver': 'lbfgs', 'iw_rho': 0.5}. Best is trial 84 with value: 0.2289525216150688.
2026-06-01 21:30:01 | INFO | Trial 87 | outer=7 | alpha=1.140e+04 n_pcs=4500 (pc_topk) weight={'name': 'pc_logistic', 'floor': 1e-06, 'clip_max': 12.0, 'prob_clip': 0.04692885356225965, 'n_components': 40, 'logistic_c': 0.00021580206350032023, 'pca_fit': 'combined', 'solver': 'lbfgs', 'max_iter': 2000, 'fit_intercept': True, 'standardize_with_source': True, 'rho': 0.7}
[I 2026-06-01 21:30:17,372] Trial 87 finished with value: 0.2179495886372894 and parameters: {'alpha': 11400.05185367657, 'n_pcs': 4500, 'iw_method': 'pc_logistic', 'iw_clip_max': 12.0, 'iw_prob_clip': 0.04692885356225965, 'iw_n_components': 40, 'iw_logistic_c': 0.00021580206350032023, 'iw_pca_fit': 'combined', 'iw_solver': 'lbfgs', 'iw_rho': 0.7}. Best is trial 84 with value: 0.2289525216150688.
2026-06-01 21:30:17 | INFO | Trial 88 | outer=7 | alpha=3.375e+04 n_pcs=4500 (pc_topk) weight={'name': 'pc_logistic', 'floor': 1e-06, 'clip_max': 12.0, 'prob_clip': 0.041487324929887916, 'n_components': 40, 'logistic_c': 9.400072639561629e-05, 'pca_fit': 'combined', 'solver': 'lbfgs', 'max_iter': 2000, 'fit_intercept': True, 'standardize_with_source': True, 'rho': 0.5}
[I 2026-06-01 21:30:32,591] Trial 88 finished with value: 0.22626716740342911 and parameters: {'alpha': 33751.864842926174, 'n_pcs': 4500, 'iw_method': 'pc_logistic', 'iw_clip_max': 12.0, 'iw_prob_clip': 0.041487324929887916, 'iw_n_components': 40, 'iw_logistic_c': 9.400072639561629e-05, 'iw_pca_fit': 'combined', 'iw_solver': 'lbfgs', 'iw_rho': 0.5}. Best is trial 84 with value: 0.2289525216150688.
2026-06-01 21:30:32 | INFO | Trial 89 | outer=7 | alpha=3.601e+04 n_pcs=4500 (pc_topk) weight={'name': 'uniform'}
[I 2026-06-01 21:30:41,631] Trial 89 finished with value: 0.22040467517296253 and parameters: {'alpha': 36006.19577501785, 'n_pcs': 4500, 'iw_method': 'uniform'}. Best is trial 84 with value: 0.2289525216150688.
2026-06-01 21:30:41 | INFO | Trial 90 | outer=7 | alpha=1.535e+04 n_pcs=4500 (pc_topk) weight={'name': 'pc_logistic', 'floor': 1e-06, 'clip_max': 12.0, 'prob_clip': 0.04220966599492944, 'n_components': 40, 'logistic_c': 9.457042618143386e-05, 'pca_fit': 'combined', 'solver': 'lbfgs', 'max_iter': 2000, 'fit_intercept': True, 'standardize_with_source': True, 'rho': 0.3}
[I 2026-06-01 21:30:57,215] Trial 90 finished with value: 0.221607983020442 and parameters: {'alpha': 15352.140794034254, 'n_pcs': 4500, 'iw_method': 'pc_logistic', 'iw_clip_max': 12.0, 'iw_prob_clip': 0.04220966599492944, 'iw_n_components': 40, 'iw_logistic_c': 9.457042618143386e-05, 'iw_pca_fit': 'combined', 'iw_solver': 'lbfgs', 'iw_rho': 0.3}. Best is trial 84 with value: 0.2289525216150688.
2026-06-01 21:30:57 | INFO | Trial 91 | outer=7 | alpha=2.297e+04 n_pcs=5000 (pc_topk) weight={'name': 'pc_logistic', 'floor': 1e-06, 'clip_max': 12.0, 'prob_clip': 0.03132304739876665, 'n_components': 40, 'logistic_c': 7.154519243710186e-05, 'pca_fit': 'combined', 'solver': 'lbfgs', 'max_iter': 2000, 'fit_intercept': True, 'standardize_with_source': True, 'rho': 0.5}
[I 2026-06-01 21:31:14,339] Trial 91 finished with value: 0.22472052526546427 and parameters: {'alpha': 22971.087164270713, 'n_pcs': 5000, 'iw_method': 'pc_logistic', 'iw_clip_max': 12.0, 'iw_prob_clip': 0.03132304739876665, 'iw_n_components': 40, 'iw_logistic_c': 7.154519243710186e-05, 'iw_pca_fit': 'combined', 'iw_solver': 'lbfgs', 'iw_rho': 0.5}. Best is trial 84 with value: 0.2289525216150688.
2026-06-01 21:31:14 | INFO | Trial 92 | outer=7 | alpha=2.288e+04 n_pcs=4500 (pc_topk) weight={'name': 'pc_logistic', 'floor': 1e-06, 'clip_max': 12.0, 'prob_clip': 0.030097504168877878, 'n_components': 40, 'logistic_c': 7.031466991714803e-05, 'pca_fit': 'combined', 'solver': 'lbfgs', 'max_iter': 2000, 'fit_intercept': True, 'standardize_with_source': True, 'rho': 0.5}
[I 2026-06-01 21:31:30,285] Trial 92 finished with value: 0.22655331929343475 and parameters: {'alpha': 22876.835661963563, 'n_pcs': 4500, 'iw_method': 'pc_logistic', 'iw_clip_max': 12.0, 'iw_prob_clip': 0.030097504168877878, 'iw_n_components': 40, 'iw_logistic_c': 7.031466991714803e-05, 'iw_pca_fit': 'combined', 'iw_solver': 'lbfgs', 'iw_rho': 0.5}. Best is trial 84 with value: 0.2289525216150688.
2026-06-01 21:31:30 | INFO | Trial 93 | outer=7 | alpha=2.379e+04 n_pcs=4500 (pc_topk) weight={'name': 'pc_logistic', 'floor': 1e-06, 'clip_max': 12.0, 'prob_clip': 0.03204512923317004, 'n_components': 40, 'logistic_c': 7.158306648927242e-05, 'pca_fit': 'combined', 'solver': 'lbfgs', 'max_iter': 2000, 'fit_intercept': True, 'standardize_with_source': True, 'rho': 0.5}
[I 2026-06-01 21:31:45,794] Trial 93 finished with value: 0.226606158474928 and parameters: {'alpha': 23785.20550837745, 'n_pcs': 4500, 'iw_method': 'pc_logistic', 'iw_clip_max': 12.0, 'iw_prob_clip': 0.03204512923317004, 'iw_n_components': 40, 'iw_logistic_c': 7.158306648927242e-05, 'iw_pca_fit': 'combined', 'iw_solver': 'lbfgs', 'iw_rho': 0.5}. Best is trial 84 with value: 0.2289525216150688.
2026-06-01 21:31:45 | INFO | Trial 94 | outer=7 | alpha=1.858e+04 n_pcs=4500 (pc_topk) weight={'name': 'pc_logistic', 'floor': 1e-06, 'clip_max': 12.0, 'prob_clip': 0.035795550329194674, 'n_components': 40, 'logistic_c': 0.00013149063692362056, 'pca_fit': 'combined', 'solver': 'lbfgs', 'max_iter': 2000, 'fit_intercept': True, 'standardize_with_source': True, 'rho': 0.5}
[I 2026-06-01 21:32:01,710] Trial 94 finished with value: 0.22451237984780703 and parameters: {'alpha': 18576.221596119405, 'n_pcs': 4500, 'iw_method': 'pc_logistic', 'iw_clip_max': 12.0, 'iw_prob_clip': 0.035795550329194674, 'iw_n_components': 40, 'iw_logistic_c': 0.00013149063692362056, 'iw_pca_fit': 'combined', 'iw_solver': 'lbfgs', 'iw_rho': 0.5}. Best is trial 84 with value: 0.2289525216150688.
2026-06-01 21:32:01 | INFO | Trial 95 | outer=7 | alpha=8.176e+03 n_pcs=4500 (pc_topk) weight={'name': 'pc_logistic', 'floor': 1e-06, 'clip_max': 12.0, 'prob_clip': 0.04183143421661209, 'n_components': 20, 'logistic_c': 0.00043157022563916343, 'pca_fit': 'combined', 'solver': 'lbfgs', 'max_iter': 2000, 'fit_intercept': True, 'standardize_with_source': True, 'rho': 0.5}
[I 2026-06-01 21:32:18,678] Trial 95 finished with value: 0.21137511918106208 and parameters: {'alpha': 8175.768011663678, 'n_pcs': 4500, 'iw_method': 'pc_logistic', 'iw_clip_max': 12.0, 'iw_prob_clip': 0.04183143421661209, 'iw_n_components': 20, 'iw_logistic_c': 0.00043157022563916343, 'iw_pca_fit': 'combined', 'iw_solver': 'lbfgs', 'iw_rho': 0.5}. Best is trial 84 with value: 0.2289525216150688.
2026-06-01 21:32:18 | INFO | Trial 96 | outer=7 | alpha=3.830e+04 n_pcs=4500 (pc_topk) weight={'name': 'pc_logistic', 'floor': 1e-06, 'clip_max': 12.0, 'prob_clip': 0.030073114623132384, 'n_components': 40, 'logistic_c': 0.0047549873254332355, 'pca_fit': 'combined', 'solver': 'lbfgs', 'max_iter': 2000, 'fit_intercept': True, 'standardize_with_source': True, 'rho': 0.85}
[I 2026-06-01 21:32:38,638] Trial 96 finished with value: 0.2257481793722925 and parameters: {'alpha': 38296.40744521655, 'n_pcs': 4500, 'iw_method': 'pc_logistic', 'iw_clip_max': 12.0, 'iw_prob_clip': 0.030073114623132384, 'iw_n_components': 40, 'iw_logistic_c': 0.0047549873254332355, 'iw_pca_fit': 'combined', 'iw_solver': 'lbfgs', 'iw_rho': 0.85}. Best is trial 84 with value: 0.2289525216150688.
2026-06-01 21:32:38 | INFO | Trial 97 | outer=7 | alpha=1.381e+04 n_pcs=4500 (pc_topk) weight={'name': 'pc_logistic', 'floor': 1e-06, 'clip_max': 12.0, 'prob_clip': 0.029041694770051706, 'n_components': 40, 'logistic_c': 0.004439313886546398, 'pca_fit': 'combined', 'solver': 'lbfgs', 'max_iter': 2000, 'fit_intercept': True, 'standardize_with_source': True, 'rho': 0.85}
[I 2026-06-01 21:32:58,763] Trial 97 finished with value: 0.21940625451632173 and parameters: {'alpha': 13807.599787010533, 'n_pcs': 4500, 'iw_method': 'pc_logistic', 'iw_clip_max': 12.0, 'iw_prob_clip': 0.029041694770051706, 'iw_n_components': 40, 'iw_logistic_c': 0.004439313886546398, 'iw_pca_fit': 'combined', 'iw_solver': 'lbfgs', 'iw_rho': 0.85}. Best is trial 84 with value: 0.2289525216150688.
2026-06-01 21:32:58 | INFO | Trial 98 | outer=7 | alpha=2.724e+04 n_pcs=4000 (pc_topk) weight={'name': 'pc_logistic', 'floor': 1e-06, 'clip_max': 12.0, 'prob_clip': 0.035090587122538715, 'n_components': 40, 'logistic_c': 0.009360664824458876, 'pca_fit': 'combined', 'solver': 'lbfgs', 'max_iter': 2000, 'fit_intercept': True, 'standardize_with_source': True, 'rho': 0.85}
[I 2026-06-01 21:33:17,620] Trial 98 finished with value: 0.22412415583213563 and parameters: {'alpha': 27241.0018699122, 'n_pcs': 4000, 'iw_method': 'pc_logistic', 'iw_clip_max': 12.0, 'iw_prob_clip': 0.035090587122538715, 'iw_n_components': 40, 'iw_logistic_c': 0.009360664824458876, 'iw_pca_fit': 'combined', 'iw_solver': 'lbfgs', 'iw_rho': 0.85}. Best is trial 84 with value: 0.2289525216150688.
2026-06-01 21:33:17 | INFO | Trial 99 | outer=7 | alpha=2.272e+04 n_pcs=4500 (pc_topk) weight={'name': 'pc_logistic', 'floor': 1e-06, 'clip_max': 12.0, 'prob_clip': 0.04424879692462798, 'n_components': 40, 'logistic_c': 0.0002841649084990639, 'pca_fit': 'combined', 'solver': 'lbfgs', 'max_iter': 2000, 'fit_intercept': True, 'standardize_with_source': True, 'rho': 0.85}
[I 2026-06-01 21:33:34,173] Trial 99 finished with value: 0.22481053341953885 and parameters: {'alpha': 22717.48959992192, 'n_pcs': 4500, 'iw_method': 'pc_logistic', 'iw_clip_max': 12.0, 'iw_prob_clip': 0.04424879692462798, 'iw_n_components': 40, 'iw_logistic_c': 0.0002841649084990639, 'iw_pca_fit': 'combined', 'iw_solver': 'lbfgs', 'iw_rho': 0.85}. Best is trial 84 with value: 0.2289525216150688.
2026-06-01 21:33:34 | INFO | Trial 100 | outer=7 | alpha=4.184e+04 n_pcs=5000 (pc_topk) weight={'name': 'uniform'}
[I 2026-06-01 21:33:44,247] Trial 100 finished with value: 0.218427883553799 and parameters: {'alpha': 41838.74589320215, 'n_pcs': 5000, 'iw_method': 'uniform'}. Best is trial 84 with value: 0.2289525216150688.
2026-06-01 21:33:44 | INFO | Trial 101 | outer=7 | alpha=3.848e+04 n_pcs=4500 (pc_topk) weight={'name': 'pc_logistic', 'floor': 1e-06, 'clip_max': 12.0, 'prob_clip': 0.04907976906857668, 'n_components': 40, 'logistic_c': 5.343616592362651e-05, 'pca_fit': 'combined', 'solver': 'lbfgs', 'max_iter': 2000, 'fit_intercept': True, 'standardize_with_source': True, 'rho': 0.5}
[I 2026-06-01 21:33:58,987] Trial 101 finished with value: 0.22486349282535448 and parameters: {'alpha': 38483.28312047049, 'n_pcs': 4500, 'iw_method': 'pc_logistic', 'iw_clip_max': 12.0, 'iw_prob_clip': 0.04907976906857668, 'iw_n_components': 40, 'iw_logistic_c': 5.343616592362651e-05, 'iw_pca_fit': 'combined', 'iw_solver': 'lbfgs', 'iw_rho': 0.5}. Best is trial 84 with value: 0.2289525216150688.
2026-06-01 21:33:59 | INFO | Trial 102 | outer=7 | alpha=1.064e+03 n_pcs=4500 (pc_topk) weight={'name': 'pc_logistic', 'floor': 1e-06, 'clip_max': 12.0, 'prob_clip': 0.04930844465494626, 'n_components': 40, 'logistic_c': 6.44928139710685e-05, 'pca_fit': 'combined', 'solver': 'lbfgs', 'max_iter': 2000, 'fit_intercept': True, 'standardize_with_source': True, 'rho': 0.5}
[I 2026-06-01 21:34:14,654] Trial 102 finished with value: 0.13756732929496288 and parameters: {'alpha': 1063.614641640196, 'n_pcs': 4500, 'iw_method': 'pc_logistic', 'iw_clip_max': 12.0, 'iw_prob_clip': 0.04930844465494626, 'iw_n_components': 40, 'iw_logistic_c': 6.44928139710685e-05, 'iw_pca_fit': 'combined', 'iw_solver': 'lbfgs', 'iw_rho': 0.5}. Best is trial 84 with value: 0.2289525216150688.
2026-06-01 21:34:14 | INFO | Trial 103 | outer=7 | alpha=1.805e+04 n_pcs=4000 (pc_topk) weight={'name': 'pc_logistic', 'floor': 1e-06, 'clip_max': 12.0, 'prob_clip': 0.03976618914902524, 'n_components': 40, 'logistic_c': 0.0006981973256908376, 'pca_fit': 'combined', 'solver': 'lbfgs', 'max_iter': 2000, 'fit_intercept': True, 'standardize_with_source': True, 'rho': 0.5}
[I 2026-06-01 21:34:30,405] Trial 103 finished with value: 0.22138815256340397 and parameters: {'alpha': 18054.107204346976, 'n_pcs': 4000, 'iw_method': 'pc_logistic', 'iw_clip_max': 12.0, 'iw_prob_clip': 0.03976618914902524, 'iw_n_components': 40, 'iw_logistic_c': 0.0006981973256908376, 'iw_pca_fit': 'combined', 'iw_solver': 'lbfgs', 'iw_rho': 0.5}. Best is trial 84 with value: 0.2289525216150688.
2026-06-01 21:34:30 | INFO | Trial 104 | outer=7 | alpha=3.592e+04 n_pcs=4500 (pc_topk) weight={'name': 'pc_logistic', 'floor': 1e-06, 'clip_max': 12.0, 'prob_clip': 0.03520265738775769, 'n_components': 40, 'logistic_c': 0.00012438024861710303, 'pca_fit': 'combined', 'solver': 'lbfgs', 'max_iter': 2000, 'fit_intercept': True, 'standardize_with_source': True, 'rho': 0.5}
[I 2026-06-01 21:34:45,743] Trial 104 finished with value: 0.22711289762589507 and parameters: {'alpha': 35916.61231895825, 'n_pcs': 4500, 'iw_method': 'pc_logistic', 'iw_clip_max': 12.0, 'iw_prob_clip': 0.03520265738775769, 'iw_n_components': 40, 'iw_logistic_c': 0.00012438024861710303, 'iw_pca_fit': 'combined', 'iw_solver': 'lbfgs', 'iw_rho': 0.5}. Best is trial 84 with value: 0.2289525216150688.
2026-06-01 21:34:45 | INFO | Trial 105 | outer=7 | alpha=2.557e+04 n_pcs=4500 (pc_topk) weight={'name': 'pc_logistic', 'floor': 1e-06, 'clip_max': 12.0, 'prob_clip': 0.03444329735515055, 'n_components': 40, 'logistic_c': 0.00012015439213255803, 'pca_fit': 'combined', 'solver': 'lbfgs', 'max_iter': 2000, 'fit_intercept': True, 'standardize_with_source': True, 'rho': 0.5}
[I 2026-06-01 21:35:01,869] Trial 105 finished with value: 0.226678943988115 and parameters: {'alpha': 25573.397622264045, 'n_pcs': 4500, 'iw_method': 'pc_logistic', 'iw_clip_max': 12.0, 'iw_prob_clip': 0.03444329735515055, 'iw_n_components': 40, 'iw_logistic_c': 0.00012015439213255803, 'iw_pca_fit': 'combined', 'iw_solver': 'lbfgs', 'iw_rho': 0.5}. Best is trial 84 with value: 0.2289525216150688.
2026-06-01 21:35:01 | INFO | Trial 106 | outer=7 | alpha=3.028e+04 n_pcs=4000 (pc_topk) weight={'name': 'pc_logistic', 'floor': 1e-06, 'clip_max': 12.0, 'prob_clip': 0.028031850931172095, 'n_components': 40, 'logistic_c': 0.00011950278445488252, 'pca_fit': 'combined', 'solver': 'lbfgs', 'max_iter': 2000, 'fit_intercept': True, 'standardize_with_source': True, 'rho': 0.5}
[I 2026-06-01 21:35:16,246] Trial 106 finished with value: 0.22730090960571955 and parameters: {'alpha': 30280.387893642514, 'n_pcs': 4000, 'iw_method': 'pc_logistic', 'iw_clip_max': 12.0, 'iw_prob_clip': 0.028031850931172095, 'iw_n_components': 40, 'iw_logistic_c': 0.00011950278445488252, 'iw_pca_fit': 'combined', 'iw_solver': 'lbfgs', 'iw_rho': 0.5}. Best is trial 84 with value: 0.2289525216150688.
2026-06-01 21:35:16 | INFO | Trial 107 | outer=7 | alpha=5.788e+04 n_pcs=4000 (pc_topk) weight={'name': 'pc_logistic', 'floor': 1e-06, 'clip_max': 12.0, 'prob_clip': 0.02908201921720205, 'n_components': 40, 'logistic_c': 0.00015770950226829747, 'pca_fit': 'combined', 'solver': 'lbfgs', 'max_iter': 2000, 'fit_intercept': True, 'standardize_with_source': True, 'rho': 0.5}
[I 2026-06-01 21:35:30,752] Trial 107 finished with value: 0.22671381906974294 and parameters: {'alpha': 57879.26181538251, 'n_pcs': 4000, 'iw_method': 'pc_logistic', 'iw_clip_max': 12.0, 'iw_prob_clip': 0.02908201921720205, 'iw_n_components': 40, 'iw_logistic_c': 0.00015770950226829747, 'iw_pca_fit': 'combined', 'iw_solver': 'lbfgs', 'iw_rho': 0.5}. Best is trial 84 with value: 0.2289525216150688.
2026-06-01 21:35:30 | INFO | Trial 108 | outer=7 | alpha=5.323e+04 n_pcs=4000 (pc_topk) weight={'name': 'pc_logistic', 'floor': 1e-06, 'clip_max': 12.0, 'prob_clip': 0.02762904823223152, 'n_components': 10, 'logistic_c': 0.0005506764545613934, 'pca_fit': 'combined', 'solver': 'lbfgs', 'max_iter': 2000, 'fit_intercept': True, 'standardize_with_source': True, 'rho': 0.85}
[I 2026-06-01 21:35:44,363] Trial 108 finished with value: 0.22201130524233853 and parameters: {'alpha': 53230.70103298564, 'n_pcs': 4000, 'iw_method': 'pc_logistic', 'iw_clip_max': 12.0, 'iw_prob_clip': 0.02762904823223152, 'iw_n_components': 10, 'iw_logistic_c': 0.0005506764545613934, 'iw_pca_fit': 'combined', 'iw_solver': 'lbfgs', 'iw_rho': 0.85}. Best is trial 84 with value: 0.2289525216150688.
2026-06-01 21:35:44 | INFO | Trial 109 | outer=7 | alpha=2.891e+04 n_pcs=4000 (pc_topk) weight={'name': 'pc_logistic', 'floor': 1e-06, 'clip_max': 12.0, 'prob_clip': 0.03356219205265309, 'n_components': 80, 'logistic_c': 0.00019993208448798244, 'pca_fit': 'combined', 'solver': 'lbfgs', 'max_iter': 2000, 'fit_intercept': True, 'standardize_with_source': True, 'rho': 1.0}
[I 2026-06-01 21:35:59,247] Trial 109 finished with value: 0.22475988630588445 and parameters: {'alpha': 28911.134532895707, 'n_pcs': 4000, 'iw_method': 'pc_logistic', 'iw_clip_max': 12.0, 'iw_prob_clip': 0.03356219205265309, 'iw_n_components': 80, 'iw_logistic_c': 0.00019993208448798244, 'iw_pca_fit': 'combined', 'iw_solver': 'lbfgs', 'iw_rho': 1.0}. Best is trial 84 with value: 0.2289525216150688.
2026-06-01 21:35:59 | INFO | Trial 110 | outer=7 | alpha=6.191e+04 n_pcs=4000 (pc_topk) weight={'name': 'pc_logistic', 'floor': 1e-06, 'clip_max': 12.0, 'prob_clip': 0.02806326869093825, 'n_components': 40, 'logistic_c': 0.0003082154587102283, 'pca_fit': 'combined', 'solver': 'lbfgs', 'max_iter': 2000, 'fit_intercept': True, 'standardize_with_source': True, 'rho': 0.5}
[I 2026-06-01 21:36:14,455] Trial 110 finished with value: 0.22584122721574612 and parameters: {'alpha': 61913.8492516429, 'n_pcs': 4000, 'iw_method': 'pc_logistic', 'iw_clip_max': 12.0, 'iw_prob_clip': 0.02806326869093825, 'iw_n_components': 40, 'iw_logistic_c': 0.0003082154587102283, 'iw_pca_fit': 'combined', 'iw_solver': 'lbfgs', 'iw_rho': 0.5}. Best is trial 84 with value: 0.2289525216150688.
2026-06-01 21:36:14 | INFO | Trial 111 | outer=7 | alpha=6.125e+04 n_pcs=4000 (pc_topk) weight={'name': 'pc_logistic', 'floor': 1e-06, 'clip_max': 12.0, 'prob_clip': 0.026107996944777046, 'n_components': 40, 'logistic_c': 0.0003385804429184396, 'pca_fit': 'combined', 'solver': 'lbfgs', 'max_iter': 2000, 'fit_intercept': True, 'standardize_with_source': True, 'rho': 0.5}
[I 2026-06-01 21:36:29,660] Trial 111 finished with value: 0.22604258237465452 and parameters: {'alpha': 61248.78521310349, 'n_pcs': 4000, 'iw_method': 'pc_logistic', 'iw_clip_max': 12.0, 'iw_prob_clip': 0.026107996944777046, 'iw_n_components': 40, 'iw_logistic_c': 0.0003385804429184396, 'iw_pca_fit': 'combined', 'iw_solver': 'lbfgs', 'iw_rho': 0.5}. Best is trial 84 with value: 0.2289525216150688.
2026-06-01 21:36:29 | INFO | Trial 112 | outer=7 | alpha=6.492e+04 n_pcs=4000 (pc_topk) weight={'name': 'pc_logistic', 'floor': 1e-06, 'clip_max': 12.0, 'prob_clip': 0.025763508528811624, 'n_components': 40, 'logistic_c': 0.0001423546840628493, 'pca_fit': 'combined', 'solver': 'lbfgs', 'max_iter': 2000, 'fit_intercept': True, 'standardize_with_source': True, 'rho': 0.5}
[I 2026-06-01 21:36:43,592] Trial 112 finished with value: 0.22660351437805626 and parameters: {'alpha': 64918.38731720701, 'n_pcs': 4000, 'iw_method': 'pc_logistic', 'iw_clip_max': 12.0, 'iw_prob_clip': 0.025763508528811624, 'iw_n_components': 40, 'iw_logistic_c': 0.0001423546840628493, 'iw_pca_fit': 'combined', 'iw_solver': 'lbfgs', 'iw_rho': 0.5}. Best is trial 84 with value: 0.2289525216150688.
2026-06-01 21:36:43 | INFO | Trial 113 | outer=7 | alpha=6.258e+04 n_pcs=4000 (pc_topk) weight={'name': 'pc_logistic', 'floor': 1e-06, 'clip_max': 12.0, 'prob_clip': 0.025854134940410316, 'n_components': 40, 'logistic_c': 0.00037801050835785404, 'pca_fit': 'combined', 'solver': 'lbfgs', 'max_iter': 2000, 'fit_intercept': True, 'standardize_with_source': True, 'rho': 0.5}
