[I 2026-06-01 21:55:30,727] Trial 199 finished with value: 0.2284708937657199 and parameters: {'alpha': 101467.08162560352, 'n_pcs': 4000, 'iw_method': 'pc_logistic', 'iw_clip_max': 4.0, 'iw_prob_clip': 0.008958235809496194, 'iw_n_components': 60, 'iw_logistic_c': 3.502522785800545e-05, 'iw_pca_fit': 'combined', 'iw_solver': 'lbfgs', 'iw_rho': 1.0}. Best is trial 182 with value: 0.23026227017778916.
2026-06-01 21:55:30 | INFO | Trial 200 | outer=7 | alpha=7.481e+04 n_pcs=4000 (pc_topk) weight={'name': 'pc_logistic', 'floor': 1e-06, 'clip_max': 4.0, 'prob_clip': 0.007852540285528991, 'n_components': 60, 'logistic_c': 3.212598956556793e-05, 'pca_fit': 'combined', 'solver': 'lbfgs', 'max_iter': 2000, 'fit_intercept': True, 'standardize_with_source': True, 'rho': 1.0}
[I 2026-06-01 21:55:44,187] Trial 200 finished with value: 0.22918735344337607 and parameters: {'alpha': 74805.15835436173, 'n_pcs': 4000, 'iw_method': 'pc_logistic', 'iw_clip_max': 4.0, 'iw_prob_clip': 0.007852540285528991, 'iw_n_components': 60, 'iw_logistic_c': 3.212598956556793e-05, 'iw_pca_fit': 'combined', 'iw_solver': 'lbfgs', 'iw_rho': 1.0}. Best is trial 182 with value: 0.23026227017778916.
2026-06-01 21:55:44 | INFO | Trial 201 | outer=7 | alpha=7.124e+04 n_pcs=4000 (pc_topk) weight={'name': 'pc_logistic', 'floor': 1e-06, 'clip_max': 4.0, 'prob_clip': 0.0076472990418460325, 'n_components': 60, 'logistic_c': 4.0738952835146994e-05, 'pca_fit': 'combined', 'solver': 'lbfgs', 'max_iter': 2000, 'fit_intercept': True, 'standardize_with_source': True, 'rho': 1.0}
[I 2026-06-01 21:55:57,359] Trial 201 finished with value: 0.2286556569931503 and parameters: {'alpha': 71241.83548006699, 'n_pcs': 4000, 'iw_method': 'pc_logistic', 'iw_clip_max': 4.0, 'iw_prob_clip': 0.0076472990418460325, 'iw_n_components': 60, 'iw_logistic_c': 4.0738952835146994e-05, 'iw_pca_fit': 'combined', 'iw_solver': 'lbfgs', 'iw_rho': 1.0}. Best is trial 182 with value: 0.23026227017778916.
2026-06-01 21:55:57 | INFO | Trial 202 | outer=7 | alpha=7.955e+04 n_pcs=4000 (pc_topk) weight={'name': 'pc_logistic', 'floor': 1e-06, 'clip_max': 4.0, 'prob_clip': 0.011042630275250463, 'n_components': 60, 'logistic_c': 2.718236546134545e-05, 'pca_fit': 'combined', 'solver': 'lbfgs', 'max_iter': 2000, 'fit_intercept': True, 'standardize_with_source': True, 'rho': 1.0}
[I 2026-06-01 21:56:10,513] Trial 202 finished with value: 0.22939078979587432 and parameters: {'alpha': 79551.61635634323, 'n_pcs': 4000, 'iw_method': 'pc_logistic', 'iw_clip_max': 4.0, 'iw_prob_clip': 0.011042630275250463, 'iw_n_components': 60, 'iw_logistic_c': 2.718236546134545e-05, 'iw_pca_fit': 'combined', 'iw_solver': 'lbfgs', 'iw_rho': 1.0}. Best is trial 182 with value: 0.23026227017778916.
2026-06-01 21:56:10 | INFO | Trial 203 | outer=7 | alpha=1.236e+05 n_pcs=4000 (pc_topk) weight={'name': 'pc_logistic', 'floor': 1e-06, 'clip_max': 4.0, 'prob_clip': 0.01174205843361522, 'n_components': 60, 'logistic_c': 2.5019761981062437e-05, 'pca_fit': 'combined', 'solver': 'lbfgs', 'max_iter': 2000, 'fit_intercept': True, 'standardize_with_source': True, 'rho': 1.0}
[I 2026-06-01 21:56:23,384] Trial 203 finished with value: 0.2277688742563809 and parameters: {'alpha': 123585.92022985032, 'n_pcs': 4000, 'iw_method': 'pc_logistic', 'iw_clip_max': 4.0, 'iw_prob_clip': 0.01174205843361522, 'iw_n_components': 60, 'iw_logistic_c': 2.5019761981062437e-05, 'iw_pca_fit': 'combined', 'iw_solver': 'lbfgs', 'iw_rho': 1.0}. Best is trial 182 with value: 0.23026227017778916.
2026-06-01 21:56:23 | INFO | Trial 204 | outer=7 | alpha=9.453e+04 n_pcs=4000 (pc_topk) weight={'name': 'pc_logistic', 'floor': 1e-06, 'clip_max': 4.0, 'prob_clip': 0.011013336466883012, 'n_components': 60, 'logistic_c': 2.6835750565317176e-05, 'pca_fit': 'combined', 'solver': 'lbfgs', 'max_iter': 2000, 'fit_intercept': True, 'standardize_with_source': True, 'rho': 1.0}
[I 2026-06-01 21:56:36,357] Trial 204 finished with value: 0.22894568204648844 and parameters: {'alpha': 94527.48594656146, 'n_pcs': 4000, 'iw_method': 'pc_logistic', 'iw_clip_max': 4.0, 'iw_prob_clip': 0.011013336466883012, 'iw_n_components': 60, 'iw_logistic_c': 2.6835750565317176e-05, 'iw_pca_fit': 'combined', 'iw_solver': 'lbfgs', 'iw_rho': 1.0}. Best is trial 182 with value: 0.23026227017778916.
2026-06-01 21:56:36 | INFO | Trial 205 | outer=7 | alpha=7.020e+04 n_pcs=4000 (pc_topk) weight={'name': 'pc_logistic', 'floor': 1e-06, 'clip_max': 4.0, 'prob_clip': 0.012695834377291795, 'n_components': 60, 'logistic_c': 5.216438612006052e-05, 'pca_fit': 'combined', 'solver': 'lbfgs', 'max_iter': 2000, 'fit_intercept': True, 'standardize_with_source': True, 'rho': 1.0}
[I 2026-06-01 21:56:49,227] Trial 205 finished with value: 0.22886574141176202 and parameters: {'alpha': 70201.19627183021, 'n_pcs': 4000, 'iw_method': 'pc_logistic', 'iw_clip_max': 4.0, 'iw_prob_clip': 0.012695834377291795, 'iw_n_components': 60, 'iw_logistic_c': 5.216438612006052e-05, 'iw_pca_fit': 'combined', 'iw_solver': 'lbfgs', 'iw_rho': 1.0}. Best is trial 182 with value: 0.23026227017778916.
2026-06-01 21:56:49 | INFO | Trial 206 | outer=7 | alpha=8.061e+04 n_pcs=1000 (pc_topk) weight={'name': 'pc_logistic', 'floor': 1e-06, 'clip_max': 4.0, 'prob_clip': 0.01133287041889158, 'n_components': 60, 'logistic_c': 3.26780357547119e-05, 'pca_fit': 'combined', 'solver': 'lbfgs', 'max_iter': 2000, 'fit_intercept': True, 'standardize_with_source': True, 'rho': 1.0}
[I 2026-06-01 21:56:56,959] Trial 206 finished with value: 0.22000813599496422 and parameters: {'alpha': 80605.08022608841, 'n_pcs': 1000, 'iw_method': 'pc_logistic', 'iw_clip_max': 4.0, 'iw_prob_clip': 0.01133287041889158, 'iw_n_components': 60, 'iw_logistic_c': 3.26780357547119e-05, 'iw_pca_fit': 'combined', 'iw_solver': 'lbfgs', 'iw_rho': 1.0}. Best is trial 182 with value: 0.23026227017778916.
2026-06-01 21:56:57 | INFO | Trial 207 | outer=7 | alpha=1.090e+05 n_pcs=4000 (pc_topk) weight={'name': 'pc_logistic', 'floor': 1e-06, 'clip_max': 4.0, 'prob_clip': 0.009651798303997915, 'n_components': 60, 'logistic_c': 2.0661180401003476e-05, 'pca_fit': 'combined', 'solver': 'lbfgs', 'max_iter': 2000, 'fit_intercept': True, 'standardize_with_source': True, 'rho': 1.0}
[I 2026-06-01 21:57:10,087] Trial 207 finished with value: 0.22830981140833168 and parameters: {'alpha': 108951.23462419628, 'n_pcs': 4000, 'iw_method': 'pc_logistic', 'iw_clip_max': 4.0, 'iw_prob_clip': 0.009651798303997915, 'iw_n_components': 60, 'iw_logistic_c': 2.0661180401003476e-05, 'iw_pca_fit': 'combined', 'iw_solver': 'lbfgs', 'iw_rho': 1.0}. Best is trial 182 with value: 0.23026227017778916.
2026-06-01 21:57:10 | INFO | Trial 208 | outer=7 | alpha=6.822e+04 n_pcs=4000 (pc_topk) weight={'name': 'pc_logistic', 'floor': 1e-06, 'clip_max': 4.0, 'prob_clip': 0.00835879140357977, 'n_components': 60, 'logistic_c': 4.505162006770346e-05, 'pca_fit': 'combined', 'solver': 'lbfgs', 'max_iter': 2000, 'fit_intercept': True, 'standardize_with_source': True, 'rho': 1.0}
[I 2026-06-01 21:57:22,863] Trial 208 finished with value: 0.2283610619042839 and parameters: {'alpha': 68222.75599828603, 'n_pcs': 4000, 'iw_method': 'pc_logistic', 'iw_clip_max': 4.0, 'iw_prob_clip': 0.00835879140357977, 'iw_n_components': 60, 'iw_logistic_c': 4.505162006770346e-05, 'iw_pca_fit': 'combined', 'iw_solver': 'lbfgs', 'iw_rho': 1.0}. Best is trial 182 with value: 0.23026227017778916.
2026-06-01 21:57:22 | INFO | Trial 209 | outer=7 | alpha=1.756e+05 n_pcs=4000 (pc_topk) weight={'name': 'pc_logistic', 'floor': 1e-06, 'clip_max': 4.0, 'prob_clip': 0.013033457285500859, 'n_components': 60, 'logistic_c': 2.5041551109447733e-05, 'pca_fit': 'combined', 'solver': 'lbfgs', 'max_iter': 2000, 'fit_intercept': True, 'standardize_with_source': True, 'rho': 1.0}
[I 2026-06-01 21:57:35,688] Trial 209 finished with value: 0.2255796314229117 and parameters: {'alpha': 175587.93943608075, 'n_pcs': 4000, 'iw_method': 'pc_logistic', 'iw_clip_max': 4.0, 'iw_prob_clip': 0.013033457285500859, 'iw_n_components': 60, 'iw_logistic_c': 2.5041551109447733e-05, 'iw_pca_fit': 'combined', 'iw_solver': 'lbfgs', 'iw_rho': 1.0}. Best is trial 182 with value: 0.23026227017778916.
2026-06-01 21:57:35 | INFO | Trial 210 | outer=7 | alpha=9.060e+04 n_pcs=4000 (pc_topk) weight={'name': 'uniform'}
[I 2026-06-01 21:57:42,573] Trial 210 finished with value: 0.21428390578765963 and parameters: {'alpha': 90597.7478027685, 'n_pcs': 4000, 'iw_method': 'uniform'}. Best is trial 182 with value: 0.23026227017778916.
2026-06-01 21:57:42 | INFO | Trial 211 | outer=7 | alpha=7.515e+04 n_pcs=4000 (pc_topk) weight={'name': 'pc_logistic', 'floor': 1e-06, 'clip_max': 4.0, 'prob_clip': 0.010974710648884273, 'n_components': 60, 'logistic_c': 3.660059784245014e-05, 'pca_fit': 'combined', 'solver': 'lbfgs', 'max_iter': 2000, 'fit_intercept': True, 'standardize_with_source': True, 'rho': 1.0}
[I 2026-06-01 21:57:55,692] Trial 211 finished with value: 0.22929638650722795 and parameters: {'alpha': 75151.0266208995, 'n_pcs': 4000, 'iw_method': 'pc_logistic', 'iw_clip_max': 4.0, 'iw_prob_clip': 0.010974710648884273, 'iw_n_components': 60, 'iw_logistic_c': 3.660059784245014e-05, 'iw_pca_fit': 'combined', 'iw_solver': 'lbfgs', 'iw_rho': 1.0}. Best is trial 182 with value: 0.23026227017778916.
2026-06-01 21:57:55 | INFO | Trial 212 | outer=7 | alpha=6.513e+04 n_pcs=4000 (pc_topk) weight={'name': 'pc_logistic', 'floor': 1e-06, 'clip_max': 4.0, 'prob_clip': 0.010257930501147728, 'n_components': 60, 'logistic_c': 3.192611221919757e-05, 'pca_fit': 'combined', 'solver': 'lbfgs', 'max_iter': 2000, 'fit_intercept': True, 'standardize_with_source': True, 'rho': 1.0}
[I 2026-06-01 21:58:09,070] Trial 212 finished with value: 0.22928935549850915 and parameters: {'alpha': 65125.95910192105, 'n_pcs': 4000, 'iw_method': 'pc_logistic', 'iw_clip_max': 4.0, 'iw_prob_clip': 0.010257930501147728, 'iw_n_components': 60, 'iw_logistic_c': 3.192611221919757e-05, 'iw_pca_fit': 'combined', 'iw_solver': 'lbfgs', 'iw_rho': 1.0}. Best is trial 182 with value: 0.23026227017778916.
2026-06-01 21:58:09 | INFO | Trial 213 | outer=7 | alpha=6.832e+04 n_pcs=4000 (pc_topk) weight={'name': 'pc_logistic', 'floor': 1e-06, 'clip_max': 4.0, 'prob_clip': 0.010495221483666772, 'n_components': 60, 'logistic_c': 5.809790048140434e-05, 'pca_fit': 'combined', 'solver': 'lbfgs', 'max_iter': 2000, 'fit_intercept': True, 'standardize_with_source': True, 'rho': 1.0}
[I 2026-06-01 21:58:22,384] Trial 213 finished with value: 0.22827973406831187 and parameters: {'alpha': 68321.49386448269, 'n_pcs': 4000, 'iw_method': 'pc_logistic', 'iw_clip_max': 4.0, 'iw_prob_clip': 0.010495221483666772, 'iw_n_components': 60, 'iw_logistic_c': 5.809790048140434e-05, 'iw_pca_fit': 'combined', 'iw_solver': 'lbfgs', 'iw_rho': 1.0}. Best is trial 182 with value: 0.23026227017778916.
2026-06-01 21:58:22 | INFO | Trial 214 | outer=7 | alpha=9.920e+04 n_pcs=4000 (pc_topk) weight={'name': 'pc_logistic', 'floor': 1e-06, 'clip_max': 4.0, 'prob_clip': 0.011832833483646629, 'n_components': 60, 'logistic_c': 2.1734183162971558e-05, 'pca_fit': 'combined', 'solver': 'lbfgs', 'max_iter': 2000, 'fit_intercept': True, 'standardize_with_source': True, 'rho': 1.0}
[I 2026-06-01 21:58:35,260] Trial 214 finished with value: 0.22876707100813204 and parameters: {'alpha': 99201.73590180372, 'n_pcs': 4000, 'iw_method': 'pc_logistic', 'iw_clip_max': 4.0, 'iw_prob_clip': 0.011832833483646629, 'iw_n_components': 60, 'iw_logistic_c': 2.1734183162971558e-05, 'iw_pca_fit': 'combined', 'iw_solver': 'lbfgs', 'iw_rho': 1.0}. Best is trial 182 with value: 0.23026227017778916.
2026-06-01 21:58:35 | INFO | Trial 215 | outer=7 | alpha=6.225e+04 n_pcs=4000 (pc_topk) weight={'name': 'pc_logistic', 'floor': 1e-06, 'clip_max': 4.0, 'prob_clip': 0.013304697554383488, 'n_components': 60, 'logistic_c': 3.66353035255402e-05, 'pca_fit': 'combined', 'solver': 'lbfgs', 'max_iter': 2000, 'fit_intercept': True, 'standardize_with_source': True, 'rho': 1.0}
[I 2026-06-01 21:58:49,318] Trial 215 finished with value: 0.22965730387469266 and parameters: {'alpha': 62249.524972982166, 'n_pcs': 4000, 'iw_method': 'pc_logistic', 'iw_clip_max': 4.0, 'iw_prob_clip': 0.013304697554383488, 'iw_n_components': 60, 'iw_logistic_c': 3.66353035255402e-05, 'iw_pca_fit': 'combined', 'iw_solver': 'lbfgs', 'iw_rho': 1.0}. Best is trial 182 with value: 0.23026227017778916.
2026-06-01 21:58:49 | INFO | Trial 216 | outer=7 | alpha=6.100e+04 n_pcs=4000 (pc_topk) weight={'name': 'pc_logistic', 'floor': 1e-06, 'clip_max': 4.0, 'prob_clip': 0.013335385853593012, 'n_components': 60, 'logistic_c': 5.104373596056638e-05, 'pca_fit': 'combined', 'solver': 'lbfgs', 'max_iter': 2000, 'fit_intercept': True, 'standardize_with_source': True, 'rho': 1.0}
[I 2026-06-01 21:59:02,675] Trial 216 finished with value: 0.22880443374772746 and parameters: {'alpha': 61004.30924423094, 'n_pcs': 4000, 'iw_method': 'pc_logistic', 'iw_clip_max': 4.0, 'iw_prob_clip': 0.013335385853593012, 'iw_n_components': 60, 'iw_logistic_c': 5.104373596056638e-05, 'iw_pca_fit': 'combined', 'iw_solver': 'lbfgs', 'iw_rho': 1.0}. Best is trial 182 with value: 0.23026227017778916.
2026-06-01 21:59:02 | INFO | Trial 217 | outer=7 | alpha=1.138e+05 n_pcs=4000 (pc_topk) weight={'name': 'pc_logistic', 'floor': 1e-06, 'clip_max': 4.0, 'prob_clip': 0.012297771437297229, 'n_components': 60, 'logistic_c': 2.161939769268429e-05, 'pca_fit': 'combined', 'solver': 'lbfgs', 'max_iter': 2000, 'fit_intercept': True, 'standardize_with_source': True, 'rho': 1.0}
[I 2026-06-01 21:59:15,923] Trial 217 finished with value: 0.2281616042157811 and parameters: {'alpha': 113823.32332449855, 'n_pcs': 4000, 'iw_method': 'pc_logistic', 'iw_clip_max': 4.0, 'iw_prob_clip': 0.012297771437297229, 'iw_n_components': 60, 'iw_logistic_c': 2.161939769268429e-05, 'iw_pca_fit': 'combined', 'iw_solver': 'lbfgs', 'iw_rho': 1.0}. Best is trial 182 with value: 0.23026227017778916.
2026-06-01 21:59:15 | INFO | Trial 218 | outer=7 | alpha=6.298e+04 n_pcs=4000 (pc_topk) weight={'name': 'pc_logistic', 'floor': 1e-06, 'clip_max': 4.0, 'prob_clip': 0.013089917716208054, 'n_components': 60, 'logistic_c': 8.279565207866827e-05, 'pca_fit': 'combined', 'solver': 'lbfgs', 'max_iter': 2000, 'fit_intercept': True, 'standardize_with_source': True, 'rho': 0.3}
[I 2026-06-01 21:59:29,535] Trial 218 finished with value: 0.22744967335105648 and parameters: {'alpha': 62982.34072006234, 'n_pcs': 4000, 'iw_method': 'pc_logistic', 'iw_clip_max': 4.0, 'iw_prob_clip': 0.013089917716208054, 'iw_n_components': 60, 'iw_logistic_c': 8.279565207866827e-05, 'iw_pca_fit': 'combined', 'iw_solver': 'lbfgs', 'iw_rho': 0.3}. Best is trial 182 with value: 0.23026227017778916.
2026-06-01 21:59:29 | INFO | Trial 219 | outer=7 | alpha=1.396e+05 n_pcs=4000 (pc_topk) weight={'name': 'pc_logistic', 'floor': 1e-06, 'clip_max': 4.0, 'prob_clip': 0.009292287403377552, 'n_components': 60, 'logistic_c': 3.7386939949534816e-05, 'pca_fit': 'combined', 'solver': 'lbfgs', 'max_iter': 2000, 'fit_intercept': True, 'standardize_with_source': True, 'rho': 1.0}
[I 2026-06-01 21:59:42,163] Trial 219 finished with value: 0.22706250502541353 and parameters: {'alpha': 139588.13123967376, 'n_pcs': 4000, 'iw_method': 'pc_logistic', 'iw_clip_max': 4.0, 'iw_prob_clip': 0.009292287403377552, 'iw_n_components': 60, 'iw_logistic_c': 3.7386939949534816e-05, 'iw_pca_fit': 'combined', 'iw_solver': 'lbfgs', 'iw_rho': 1.0}. Best is trial 182 with value: 0.23026227017778916.
2026-06-01 21:59:42 | INFO | Trial 220 | outer=7 | alpha=8.612e+04 n_pcs=3500 (pc_topk) weight={'name': 'pc_logistic', 'floor': 1e-06, 'clip_max': 4.0, 'prob_clip': 0.011387846160066573, 'n_components': 60, 'logistic_c': 2.4706045027261657e-05, 'pca_fit': 'combined', 'solver': 'lbfgs', 'max_iter': 2000, 'fit_intercept': True, 'standardize_with_source': True, 'rho': 1.0}
[I 2026-06-01 21:59:53,861] Trial 220 finished with value: 0.22621871123296425 and parameters: {'alpha': 86115.83203270235, 'n_pcs': 3500, 'iw_method': 'pc_logistic', 'iw_clip_max': 4.0, 'iw_prob_clip': 0.011387846160066573, 'iw_n_components': 60, 'iw_logistic_c': 2.4706045027261657e-05, 'iw_pca_fit': 'combined', 'iw_solver': 'lbfgs', 'iw_rho': 1.0}. Best is trial 182 with value: 0.23026227017778916.
2026-06-01 21:59:53 | INFO | Trial 221 | outer=7 | alpha=7.751e+04 n_pcs=4000 (pc_topk) weight={'name': 'pc_logistic', 'floor': 1e-06, 'clip_max': 4.0, 'prob_clip': 0.010558665632074084, 'n_components': 60, 'logistic_c': 3.429554782235763e-05, 'pca_fit': 'combined', 'solver': 'lbfgs', 'max_iter': 2000, 'fit_intercept': True, 'standardize_with_source': True, 'rho': 1.0}
[I 2026-06-01 22:00:06,821] Trial 221 finished with value: 0.22923917740975544 and parameters: {'alpha': 77514.85489522532, 'n_pcs': 4000, 'iw_method': 'pc_logistic', 'iw_clip_max': 4.0, 'iw_prob_clip': 0.010558665632074084, 'iw_n_components': 60, 'iw_logistic_c': 3.429554782235763e-05, 'iw_pca_fit': 'combined', 'iw_solver': 'lbfgs', 'iw_rho': 1.0}. Best is trial 182 with value: 0.23026227017778916.
2026-06-01 22:00:06 | INFO | Trial 222 | outer=7 | alpha=6.654e+04 n_pcs=4000 (pc_topk) weight={'name': 'pc_logistic', 'floor': 1e-06, 'clip_max': 4.0, 'prob_clip': 0.01334295895793634, 'n_components': 60, 'logistic_c': 4.4616950491118634e-05, 'pca_fit': 'combined', 'solver': 'lbfgs', 'max_iter': 2000, 'fit_intercept': True, 'standardize_with_source': True, 'rho': 1.0}
[I 2026-06-01 22:00:19,606] Trial 222 finished with value: 0.22931826777443082 and parameters: {'alpha': 66539.6102026536, 'n_pcs': 4000, 'iw_method': 'pc_logistic', 'iw_clip_max': 4.0, 'iw_prob_clip': 0.01334295895793634, 'iw_n_components': 60, 'iw_logistic_c': 4.4616950491118634e-05, 'iw_pca_fit': 'combined', 'iw_solver': 'lbfgs', 'iw_rho': 1.0}. Best is trial 182 with value: 0.23026227017778916.
2026-06-01 22:00:19 | INFO | Trial 223 | outer=7 | alpha=7.063e+04 n_pcs=4000 (pc_topk) weight={'name': 'pc_logistic', 'floor': 1e-06, 'clip_max': 4.0, 'prob_clip': 0.013839677443074704, 'n_components': 60, 'logistic_c': 5.118859975443118e-05, 'pca_fit': 'combined', 'solver': 'lbfgs', 'max_iter': 2000, 'fit_intercept': True, 'standardize_with_source': True, 'rho': 1.0}
[I 2026-06-01 22:00:32,560] Trial 223 finished with value: 0.22900823303554133 and parameters: {'alpha': 70627.94266343939, 'n_pcs': 4000, 'iw_method': 'pc_logistic', 'iw_clip_max': 4.0, 'iw_prob_clip': 0.013839677443074704, 'iw_n_components': 60, 'iw_logistic_c': 5.118859975443118e-05, 'iw_pca_fit': 'combined', 'iw_solver': 'lbfgs', 'iw_rho': 1.0}. Best is trial 182 with value: 0.23026227017778916.
2026-06-01 22:00:32 | INFO | Trial 224 | outer=7 | alpha=6.306e+04 n_pcs=4000 (pc_topk) weight={'name': 'pc_logistic', 'floor': 1e-06, 'clip_max': 4.0, 'prob_clip': 0.012191037934047279, 'n_components': 60, 'logistic_c': 2.275187166571259e-05, 'pca_fit': 'combined', 'solver': 'lbfgs', 'max_iter': 2000, 'fit_intercept': True, 'standardize_with_source': True, 'rho': 1.0}
[I 2026-06-01 22:00:45,380] Trial 224 finished with value: 0.22980494302928078 and parameters: {'alpha': 63063.68101257917, 'n_pcs': 4000, 'iw_method': 'pc_logistic', 'iw_clip_max': 4.0, 'iw_prob_clip': 0.012191037934047279, 'iw_n_components': 60, 'iw_logistic_c': 2.275187166571259e-05, 'iw_pca_fit': 'combined', 'iw_solver': 'lbfgs', 'iw_rho': 1.0}. Best is trial 182 with value: 0.23026227017778916.
2026-06-01 22:00:45 | INFO | Trial 225 | outer=7 | alpha=6.054e+04 n_pcs=4000 (pc_topk) weight={'name': 'pc_logistic', 'floor': 1e-06, 'clip_max': 4.0, 'prob_clip': 0.015276048326115054, 'n_components': 60, 'logistic_c': 2.0026039877261196e-05, 'pca_fit': 'combined', 'solver': 'lbfgs', 'max_iter': 2000, 'fit_intercept': True, 'standardize_with_source': True, 'rho': 1.0}
[I 2026-06-01 22:00:58,294] Trial 225 finished with value: 0.23044692688678342 and parameters: {'alpha': 60543.093290133926, 'n_pcs': 4000, 'iw_method': 'pc_logistic', 'iw_clip_max': 4.0, 'iw_prob_clip': 0.015276048326115054, 'iw_n_components': 60, 'iw_logistic_c': 2.0026039877261196e-05, 'iw_pca_fit': 'combined', 'iw_solver': 'lbfgs', 'iw_rho': 1.0}. Best is trial 225 with value: 0.23044692688678342.
2026-06-01 22:00:58 | INFO | Trial 226 | outer=7 | alpha=6.142e+04 n_pcs=4000 (pc_topk) weight={'name': 'pc_logistic', 'floor': 1e-06, 'clip_max': 4.0, 'prob_clip': 0.015082606240262962, 'n_components': 60, 'logistic_c': 1.7578177231000563e-05, 'pca_fit': 'combined', 'solver': 'lbfgs', 'max_iter': 2000, 'fit_intercept': True, 'standardize_with_source': True, 'rho': 1.0}
[I 2026-06-01 22:01:10,724] Trial 226 finished with value: 0.2302178471372931 and parameters: {'alpha': 61420.10619171884, 'n_pcs': 4000, 'iw_method': 'pc_logistic', 'iw_clip_max': 4.0, 'iw_prob_clip': 0.015082606240262962, 'iw_n_components': 60, 'iw_logistic_c': 1.7578177231000563e-05, 'iw_pca_fit': 'combined', 'iw_solver': 'lbfgs', 'iw_rho': 1.0}. Best is trial 225 with value: 0.23044692688678342.
2026-06-01 22:01:10 | INFO | Trial 227 | outer=7 | alpha=6.175e+04 n_pcs=4000 (pc_topk) weight={'name': 'pc_logistic', 'floor': 1e-06, 'clip_max': 4.0, 'prob_clip': 0.015331600351973751, 'n_components': 60, 'logistic_c': 2.0954310946934636e-05, 'pca_fit': 'combined', 'solver': 'lbfgs', 'max_iter': 2000, 'fit_intercept': True, 'standardize_with_source': True, 'rho': 1.0}
