[I 2026-06-01 15:57:04,611] Trial 53 finished with value: 0.20484356850995877 and parameters: {'alpha': 66323.85734284569, 'n_pcs': 4000, 'iw_method': 'pc_logistic', 'iw_clip_max': 1.5, 'iw_prob_clip': 0.035159659036539934, 'iw_n_components': 80, 'iw_logistic_c': 0.07750156081661802, 'iw_pca_fit': 'combined', 'iw_solver': 'lbfgs', 'iw_rho': 0.85}. Best is trial 42 with value: 0.20484949333358043.
2026-06-01 15:57:04 | INFO | Trial 54 | outer=3 | alpha=6.492e+04 n_pcs=4000 (pc_topk) weight={'name': 'pc_logistic', 'floor': 1e-06, 'clip_max': 1.5, 'prob_clip': 0.030528925805226526, 'n_components': 80, 'logistic_c': 0.09557252017371858, 'pca_fit': 'combined', 'solver': 'lbfgs', 'max_iter': 2000, 'fit_intercept': True, 'standardize_with_source': True, 'rho': 0.85}
[I 2026-06-01 15:58:16,206] Trial 54 finished with value: 0.2043549853059592 and parameters: {'alpha': 64921.23436914361, 'n_pcs': 4000, 'iw_method': 'pc_logistic', 'iw_clip_max': 1.5, 'iw_prob_clip': 0.030528925805226526, 'iw_n_components': 80, 'iw_logistic_c': 0.09557252017371858, 'iw_pca_fit': 'combined', 'iw_solver': 'lbfgs', 'iw_rho': 0.85}. Best is trial 42 with value: 0.20484949333358043.
2026-06-01 15:58:16 | INFO | Trial 55 | outer=3 | alpha=2.456e+04 n_pcs=3000 (pc_topk) weight={'name': 'pc_logistic', 'floor': 1e-06, 'clip_max': 7.0, 'prob_clip': 0.03424876365382795, 'n_components': 80, 'logistic_c': 4.085978303428253, 'pca_fit': 'combined', 'solver': 'lbfgs', 'max_iter': 2000, 'fit_intercept': True, 'standardize_with_source': True, 'rho': 1.0}
[I 2026-06-01 15:58:36,104] Trial 55 finished with value: 0.18300512145211115 and parameters: {'alpha': 24557.28227564959, 'n_pcs': 3000, 'iw_method': 'pc_logistic', 'iw_clip_max': 7.0, 'iw_prob_clip': 0.03424876365382795, 'iw_n_components': 80, 'iw_logistic_c': 4.085978303428253, 'iw_pca_fit': 'combined', 'iw_solver': 'lbfgs', 'iw_rho': 1.0}. Best is trial 42 with value: 0.20484949333358043.
2026-06-01 15:58:36 | INFO | Trial 56 | outer=3 | alpha=4.030e+04 n_pcs=4000 (pc_topk) weight={'name': 'pc_logistic', 'floor': 1e-06, 'clip_max': 1.5, 'prob_clip': 0.019474844159816772, 'n_components': 80, 'logistic_c': 0.1118375897428748, 'pca_fit': 'combined', 'solver': 'lbfgs', 'max_iter': 2000, 'fit_intercept': True, 'standardize_with_source': True, 'rho': 0.3}
[I 2026-06-01 15:59:06,913] Trial 56 finished with value: 0.20190629378138394 and parameters: {'alpha': 40299.377217749905, 'n_pcs': 4000, 'iw_method': 'pc_logistic', 'iw_clip_max': 1.5, 'iw_prob_clip': 0.019474844159816772, 'iw_n_components': 80, 'iw_logistic_c': 0.1118375897428748, 'iw_pca_fit': 'combined', 'iw_solver': 'lbfgs', 'iw_rho': 0.3}. Best is trial 42 with value: 0.20484949333358043.
2026-06-01 15:59:06 | INFO | Trial 57 | outer=3 | alpha=1.381e+04 n_pcs=3500 (pc_topk) weight={'name': 'pc_logistic', 'floor': 1e-06, 'clip_max': 12.0, 'prob_clip': 0.0007590906261201476, 'n_components': 20, 'logistic_c': 0.6293686608046967, 'pca_fit': 'combined', 'solver': 'lbfgs', 'max_iter': 2000, 'fit_intercept': True, 'standardize_with_source': True, 'rho': 0.7}
[I 2026-06-01 15:59:29,493] Trial 57 finished with value: 0.15612452851780295 and parameters: {'alpha': 13807.574227827425, 'n_pcs': 3500, 'iw_method': 'pc_logistic', 'iw_clip_max': 12.0, 'iw_prob_clip': 0.0007590906261201476, 'iw_n_components': 20, 'iw_logistic_c': 0.6293686608046967, 'iw_pca_fit': 'combined', 'iw_solver': 'lbfgs', 'iw_rho': 0.7}. Best is trial 42 with value: 0.20484949333358043.
2026-06-01 15:59:29 | INFO | Trial 58 | outer=3 | alpha=4.666e+04 n_pcs=3000 (pc_topk) weight={'name': 'pc_logistic', 'floor': 1e-06, 'clip_max': 4.0, 'prob_clip': 0.004517336524653125, 'n_components': 80, 'logistic_c': 2.7371117654968407, 'pca_fit': 'combined', 'solver': 'lbfgs', 'max_iter': 2000, 'fit_intercept': True, 'standardize_with_source': True, 'rho': 1.0}
2026-06-01 15:59:50 | INFO | Trial 58 rejected by ESS guard: mean_ess=872.72 threshold=1002.96
[I 2026-06-01 15:59:50,154] Trial 58 finished with value: -1.0 and parameters: {'alpha': 46662.13360935912, 'n_pcs': 3000, 'iw_method': 'pc_logistic', 'iw_clip_max': 4.0, 'iw_prob_clip': 0.004517336524653125, 'iw_n_components': 80, 'iw_logistic_c': 2.7371117654968407, 'iw_pca_fit': 'combined', 'iw_solver': 'lbfgs', 'iw_rho': 1.0}. Best is trial 42 with value: 0.20484949333358043.
2026-06-01 15:59:50 | INFO | Trial 59 | outer=3 | alpha=7.859e+04 n_pcs=4000 (pc_topk) weight={'name': 'pc_logistic', 'floor': 1e-06, 'clip_max': 1.5, 'prob_clip': 0.0016374866395664589, 'n_components': 60, 'logistic_c': 2.537632515798966e-05, 'pca_fit': 'combined', 'solver': 'lbfgs', 'max_iter': 2000, 'fit_intercept': True, 'standardize_with_source': True, 'rho': 0.85}
[I 2026-06-01 16:00:03,739] Trial 59 finished with value: 0.20554775148526594 and parameters: {'alpha': 78591.1643208593, 'n_pcs': 4000, 'iw_method': 'pc_logistic', 'iw_clip_max': 1.5, 'iw_prob_clip': 0.0016374866395664589, 'iw_n_components': 60, 'iw_logistic_c': 2.537632515798966e-05, 'iw_pca_fit': 'combined', 'iw_solver': 'lbfgs', 'iw_rho': 0.85}. Best is trial 59 with value: 0.20554775148526594.
2026-06-01 16:00:03 | INFO | Trial 60 | outer=3 | alpha=7.070e+04 n_pcs=500 (pc_topk) weight={'name': 'pc_logistic', 'floor': 1e-06, 'clip_max': 7.0, 'prob_clip': 0.0019380300787471428, 'n_components': 60, 'logistic_c': 9.587942784046323e-05, 'pca_fit': 'combined', 'solver': 'lbfgs', 'max_iter': 2000, 'fit_intercept': True, 'standardize_with_source': True, 'rho': 0.85}
[I 2026-06-01 16:00:11,282] Trial 60 finished with value: 0.14705184686961306 and parameters: {'alpha': 70696.89159256105, 'n_pcs': 500, 'iw_method': 'pc_logistic', 'iw_clip_max': 7.0, 'iw_prob_clip': 0.0019380300787471428, 'iw_n_components': 60, 'iw_logistic_c': 9.587942784046323e-05, 'iw_pca_fit': 'combined', 'iw_solver': 'lbfgs', 'iw_rho': 0.85}. Best is trial 59 with value: 0.20554775148526594.
2026-06-01 16:00:11 | INFO | Trial 61 | outer=3 | alpha=8.184e+04 n_pcs=4000 (pc_topk) weight={'name': 'pc_logistic', 'floor': 1e-06, 'clip_max': 1.5, 'prob_clip': 0.001371247755904622, 'n_components': 60, 'logistic_c': 4.961200645109247e-06, 'pca_fit': 'combined', 'solver': 'lbfgs', 'max_iter': 2000, 'fit_intercept': True, 'standardize_with_source': True, 'rho': 0.85}
[I 2026-06-01 16:00:29,225] Trial 61 finished with value: 0.20517200848396286 and parameters: {'alpha': 81841.16784062798, 'n_pcs': 4000, 'iw_method': 'pc_logistic', 'iw_clip_max': 1.5, 'iw_prob_clip': 0.001371247755904622, 'iw_n_components': 60, 'iw_logistic_c': 4.961200645109247e-06, 'iw_pca_fit': 'combined', 'iw_solver': 'lbfgs', 'iw_rho': 0.85}. Best is trial 59 with value: 0.20554775148526594.
2026-06-01 16:00:29 | INFO | Trial 62 | outer=3 | alpha=3.447e+04 n_pcs=4000 (pc_topk) weight={'name': 'pc_logistic', 'floor': 1e-06, 'clip_max': 1.5, 'prob_clip': 0.0010355522940237204, 'n_components': 60, 'logistic_c': 5.79691987937124e-06, 'pca_fit': 'combined', 'solver': 'lbfgs', 'max_iter': 2000, 'fit_intercept': True, 'standardize_with_source': True, 'rho': 0.85}
[I 2026-06-01 16:00:48,762] Trial 62 finished with value: 0.20200241940298488 and parameters: {'alpha': 34466.181725669696, 'n_pcs': 4000, 'iw_method': 'pc_logistic', 'iw_clip_max': 1.5, 'iw_prob_clip': 0.0010355522940237204, 'iw_n_components': 60, 'iw_logistic_c': 5.79691987937124e-06, 'iw_pca_fit': 'combined', 'iw_solver': 'lbfgs', 'iw_rho': 0.85}. Best is trial 59 with value: 0.20554775148526594.
2026-06-01 16:00:48 | INFO | Trial 63 | outer=3 | alpha=7.177e+04 n_pcs=5000 (pc_topk) weight={'name': 'pc_logistic', 'floor': 1e-06, 'clip_max': 1.5, 'prob_clip': 0.0017416665366411527, 'n_components': 60, 'logistic_c': 1.0161913274648442e-05, 'pca_fit': 'combined', 'solver': 'lbfgs', 'max_iter': 2000, 'fit_intercept': True, 'standardize_with_source': True, 'rho': 0.5}
[I 2026-06-01 16:01:05,636] Trial 63 finished with value: 0.20382690774468762 and parameters: {'alpha': 71767.61183107323, 'n_pcs': 5000, 'iw_method': 'pc_logistic', 'iw_clip_max': 1.5, 'iw_prob_clip': 0.0017416665366411527, 'iw_n_components': 60, 'iw_logistic_c': 1.0161913274648442e-05, 'iw_pca_fit': 'combined', 'iw_solver': 'lbfgs', 'iw_rho': 0.5}. Best is trial 59 with value: 0.20554775148526594.
2026-06-01 16:01:05 | INFO | Trial 64 | outer=3 | alpha=5.697e+04 n_pcs=4500 (pc_topk) weight={'name': 'pc_logistic', 'floor': 1e-06, 'clip_max': 1.5, 'prob_clip': 0.0012587962180844639, 'n_components': 60, 'logistic_c': 9.315534248908519e-07, 'pca_fit': 'combined', 'solver': 'lbfgs', 'max_iter': 2000, 'fit_intercept': True, 'standardize_with_source': True, 'rho': 0.85}
[I 2026-06-01 16:01:27,943] Trial 64 finished with value: 0.20357482265426657 and parameters: {'alpha': 56971.56878908442, 'n_pcs': 4500, 'iw_method': 'pc_logistic', 'iw_clip_max': 1.5, 'iw_prob_clip': 0.0012587962180844639, 'iw_n_components': 60, 'iw_logistic_c': 9.315534248908519e-07, 'iw_pca_fit': 'combined', 'iw_solver': 'lbfgs', 'iw_rho': 0.85}. Best is trial 59 with value: 0.20554775148526594.
2026-06-01 16:01:27 | INFO | Trial 65 | outer=3 | alpha=2.057e+05 n_pcs=4500 (pc_topk) weight={'name': 'pc_logistic', 'floor': 1e-06, 'clip_max': 12.0, 'prob_clip': 0.0034843942795379007, 'n_components': 60, 'logistic_c': 9.914162168917721e-05, 'pca_fit': 'combined', 'solver': 'lbfgs', 'max_iter': 2000, 'fit_intercept': True, 'standardize_with_source': True, 'rho': 0.7}
[I 2026-06-01 16:01:45,669] Trial 65 finished with value: 0.1975069162045818 and parameters: {'alpha': 205731.41023969714, 'n_pcs': 4500, 'iw_method': 'pc_logistic', 'iw_clip_max': 12.0, 'iw_prob_clip': 0.0034843942795379007, 'iw_n_components': 60, 'iw_logistic_c': 9.914162168917721e-05, 'iw_pca_fit': 'combined', 'iw_solver': 'lbfgs', 'iw_rho': 0.7}. Best is trial 59 with value: 0.20554775148526594.
2026-06-01 16:01:45 | INFO | Trial 66 | outer=3 | alpha=8.660e+04 n_pcs=1000 (pc_topk) weight={'name': 'pc_logistic', 'floor': 1e-06, 'clip_max': 2.5, 'prob_clip': 0.0022800197005143877, 'n_components': 10, 'logistic_c': 1.8211479493493053e-05, 'pca_fit': 'combined', 'solver': 'lbfgs', 'max_iter': 2000, 'fit_intercept': True, 'standardize_with_source': True, 'rho': 0.85}
[I 2026-06-01 16:01:52,538] Trial 66 finished with value: 0.19248296827038275 and parameters: {'alpha': 86599.72220686304, 'n_pcs': 1000, 'iw_method': 'pc_logistic', 'iw_clip_max': 2.5, 'iw_prob_clip': 0.0022800197005143877, 'iw_n_components': 10, 'iw_logistic_c': 1.8211479493493053e-05, 'iw_pca_fit': 'combined', 'iw_solver': 'lbfgs', 'iw_rho': 0.85}. Best is trial 59 with value: 0.20554775148526594.
2026-06-01 16:01:52 | INFO | Trial 67 | outer=3 | alpha=4.892e+04 n_pcs=4000 (pc_topk) weight={'name': 'pc_logistic', 'floor': 1e-06, 'clip_max': 1.5, 'prob_clip': 0.0005765709809737616, 'n_components': 40, 'logistic_c': 5.980193976673837e-07, 'pca_fit': 'combined', 'solver': 'lbfgs', 'max_iter': 2000, 'fit_intercept': True, 'standardize_with_source': True, 'rho': 0.3}
[I 2026-06-01 16:02:05,280] Trial 67 finished with value: 0.20112006520181502 and parameters: {'alpha': 48923.26930949636, 'n_pcs': 4000, 'iw_method': 'pc_logistic', 'iw_clip_max': 1.5, 'iw_prob_clip': 0.0005765709809737616, 'iw_n_components': 40, 'iw_logistic_c': 5.980193976673837e-07, 'iw_pca_fit': 'combined', 'iw_solver': 'lbfgs', 'iw_rho': 0.3}. Best is trial 59 with value: 0.20554775148526594.
2026-06-01 16:02:05 | INFO | Trial 68 | outer=3 | alpha=4.127e+05 n_pcs=4000 (pc_topk) weight={'name': 'pc_logistic', 'floor': 1e-06, 'clip_max': 1.5, 'prob_clip': 0.0012699361034360893, 'n_components': 60, 'logistic_c': 1.603491745589862e-07, 'pca_fit': 'combined', 'solver': 'lbfgs', 'max_iter': 2000, 'fit_intercept': True, 'standardize_with_source': True, 'rho': 0.85}
[I 2026-06-01 16:02:17,769] Trial 68 finished with value: 0.19162698928733873 and parameters: {'alpha': 412726.3421031239, 'n_pcs': 4000, 'iw_method': 'pc_logistic', 'iw_clip_max': 1.5, 'iw_prob_clip': 0.0012699361034360893, 'iw_n_components': 60, 'iw_logistic_c': 1.603491745589862e-07, 'iw_pca_fit': 'combined', 'iw_solver': 'lbfgs', 'iw_rho': 0.85}. Best is trial 59 with value: 0.20554775148526594.
2026-06-01 16:02:17 | INFO | Trial 69 | outer=3 | alpha=2.136e+04 n_pcs=5000 (pc_topk) weight={'name': 'pc_logistic', 'floor': 1e-06, 'clip_max': 4.0, 'prob_clip': 0.03769814310355246, 'n_components': 80, 'logistic_c': 2.1411793934382744e-06, 'pca_fit': 'combined', 'solver': 'lbfgs', 'max_iter': 2000, 'fit_intercept': True, 'standardize_with_source': True, 'rho': 0.5}
[I 2026-06-01 16:02:47,366] Trial 69 finished with value: 0.1977731938499405 and parameters: {'alpha': 21355.13317101419, 'n_pcs': 5000, 'iw_method': 'pc_logistic', 'iw_clip_max': 4.0, 'iw_prob_clip': 0.03769814310355246, 'iw_n_components': 80, 'iw_logistic_c': 2.1411793934382744e-06, 'iw_pca_fit': 'combined', 'iw_solver': 'lbfgs', 'iw_rho': 0.5}. Best is trial 59 with value: 0.20554775148526594.
2026-06-01 16:02:47 | INFO | Trial 70 | outer=3 | alpha=3.459e+04 n_pcs=2500 (pc_topk) weight={'name': 'pc_logistic', 'floor': 1e-06, 'clip_max': 1.5, 'prob_clip': 0.0026885993974987365, 'n_components': 60, 'logistic_c': 3.572826733680353e-05, 'pca_fit': 'combined', 'solver': 'lbfgs', 'max_iter': 2000, 'fit_intercept': True, 'standardize_with_source': True, 'rho': 0.85}
[I 2026-06-01 16:02:57,718] Trial 70 finished with value: 0.20174146043273095 and parameters: {'alpha': 34592.56830773815, 'n_pcs': 2500, 'iw_method': 'pc_logistic', 'iw_clip_max': 1.5, 'iw_prob_clip': 0.0026885993974987365, 'iw_n_components': 60, 'iw_logistic_c': 3.572826733680353e-05, 'iw_pca_fit': 'combined', 'iw_solver': 'lbfgs', 'iw_rho': 0.85}. Best is trial 59 with value: 0.20554775148526594.
2026-06-01 16:02:57 | INFO | Trial 71 | outer=3 | alpha=9.864e+04 n_pcs=3500 (pc_topk) weight={'name': 'pc_logistic', 'floor': 1e-06, 'clip_max': 1.5, 'prob_clip': 0.021231885991900106, 'n_components': 100, 'logistic_c': 0.0014436183657025408, 'pca_fit': 'combined', 'solver': 'lbfgs', 'max_iter': 2000, 'fit_intercept': True, 'standardize_with_source': True, 'rho': 0.85}
[I 2026-06-01 16:03:12,416] Trial 71 finished with value: 0.204322744219944 and parameters: {'alpha': 98638.54264472667, 'n_pcs': 3500, 'iw_method': 'pc_logistic', 'iw_clip_max': 1.5, 'iw_prob_clip': 0.021231885991900106, 'iw_n_components': 100, 'iw_logistic_c': 0.0014436183657025408, 'iw_pca_fit': 'combined', 'iw_solver': 'lbfgs', 'iw_rho': 0.85}. Best is trial 59 with value: 0.20554775148526594.
2026-06-01 16:03:12 | INFO | Trial 72 | outer=3 | alpha=1.329e+05 n_pcs=3000 (pc_topk) weight={'name': 'pc_logistic', 'floor': 1e-06, 'clip_max': 1.5, 'prob_clip': 0.01472462210883637, 'n_components': 100, 'logistic_c': 0.21908586459032536, 'pca_fit': 'combined', 'solver': 'lbfgs', 'max_iter': 2000, 'fit_intercept': True, 'standardize_with_source': True, 'rho': 0.85}
[I 2026-06-01 16:03:36,401] Trial 72 finished with value: 0.20363339801954292 and parameters: {'alpha': 132936.43881206997, 'n_pcs': 3000, 'iw_method': 'pc_logistic', 'iw_clip_max': 1.5, 'iw_prob_clip': 0.01472462210883637, 'iw_n_components': 100, 'iw_logistic_c': 0.21908586459032536, 'iw_pca_fit': 'combined', 'iw_solver': 'lbfgs', 'iw_rho': 0.85}. Best is trial 59 with value: 0.20554775148526594.
2026-06-01 16:03:36 | INFO | Trial 73 | outer=3 | alpha=1.773e+05 n_pcs=3500 (pc_topk) weight={'name': 'pc_logistic', 'floor': 1e-06, 'clip_max': 1.5, 'prob_clip': 0.03923340123051636, 'n_components': 40, 'logistic_c': 0.009716641714514071, 'pca_fit': 'combined', 'solver': 'lbfgs', 'max_iter': 2000, 'fit_intercept': True, 'standardize_with_source': True, 'rho': 0.85}
[I 2026-06-01 16:03:52,252] Trial 73 finished with value: 0.20256415740937697 and parameters: {'alpha': 177334.98241224405, 'n_pcs': 3500, 'iw_method': 'pc_logistic', 'iw_clip_max': 1.5, 'iw_prob_clip': 0.03923340123051636, 'iw_n_components': 40, 'iw_logistic_c': 0.009716641714514071, 'iw_pca_fit': 'combined', 'iw_solver': 'lbfgs', 'iw_rho': 0.85}. Best is trial 59 with value: 0.20554775148526594.
2026-06-01 16:03:52 | INFO | Trial 74 | outer=3 | alpha=5.848e+04 n_pcs=4000 (pc_topk) weight={'name': 'pc_logistic', 'floor': 1e-06, 'clip_max': 2.5, 'prob_clip': 0.048553858942351986, 'n_components': 100, 'logistic_c': 1.0618489534140587, 'pca_fit': 'combined', 'solver': 'lbfgs', 'max_iter': 2000, 'fit_intercept': True, 'standardize_with_source': True, 'rho': 0.85}
[I 2026-06-01 16:04:16,381] Trial 74 finished with value: 0.2034435562523142 and parameters: {'alpha': 58484.59252991229, 'n_pcs': 4000, 'iw_method': 'pc_logistic', 'iw_clip_max': 2.5, 'iw_prob_clip': 0.048553858942351986, 'iw_n_components': 100, 'iw_logistic_c': 1.0618489534140587, 'iw_pca_fit': 'combined', 'iw_solver': 'lbfgs', 'iw_rho': 0.85}. Best is trial 59 with value: 0.20554775148526594.
2026-06-01 16:04:16 | INFO | Trial 75 | outer=3 | alpha=2.415e+05 n_pcs=3500 (pc_topk) weight={'name': 'pc_logistic', 'floor': 1e-06, 'clip_max': 1.5, 'prob_clip': 0.006618336732031932, 'n_components': 20, 'logistic_c': 0.22015744981428328, 'pca_fit': 'combined', 'solver': 'lbfgs', 'max_iter': 2000, 'fit_intercept': True, 'standardize_with_source': True, 'rho': 0.85}
[I 2026-06-01 16:04:32,511] Trial 75 finished with value: 0.20000572939637773 and parameters: {'alpha': 241474.40143952315, 'n_pcs': 3500, 'iw_method': 'pc_logistic', 'iw_clip_max': 1.5, 'iw_prob_clip': 0.006618336732031932, 'iw_n_components': 20, 'iw_logistic_c': 0.22015744981428328, 'iw_pca_fit': 'combined', 'iw_solver': 'lbfgs', 'iw_rho': 0.85}. Best is trial 59 with value: 0.20554775148526594.
2026-06-01 16:04:32 | INFO | Trial 76 | outer=3 | alpha=9.307e+04 n_pcs=4000 (pc_topk) weight={'name': 'pc_logistic', 'floor': 1e-06, 'clip_max': 1.5, 'prob_clip': 0.021070200681466977, 'n_components': 100, 'logistic_c': 0.5014805990656802, 'pca_fit': 'combined', 'solver': 'lbfgs', 'max_iter': 2000, 'fit_intercept': True, 'standardize_with_source': True, 'rho': 1.0}
[I 2026-06-01 16:04:59,194] Trial 76 finished with value: 0.20143188572629467 and parameters: {'alpha': 93069.11672312224, 'n_pcs': 4000, 'iw_method': 'pc_logistic', 'iw_clip_max': 1.5, 'iw_prob_clip': 0.021070200681466977, 'iw_n_components': 100, 'iw_logistic_c': 0.5014805990656802, 'iw_pca_fit': 'combined', 'iw_solver': 'lbfgs', 'iw_rho': 1.0}. Best is trial 59 with value: 0.20554775148526594.
2026-06-01 16:04:59 | INFO | Trial 77 | outer=3 | alpha=1.190e+05 n_pcs=3500 (pc_topk) weight={'name': 'pc_logistic', 'floor': 1e-06, 'clip_max': 1.5, 'prob_clip': 0.03633738384426869, 'n_components': 100, 'logistic_c': 0.00048604750242705024, 'pca_fit': 'combined', 'solver': 'lbfgs', 'max_iter': 2000, 'fit_intercept': True, 'standardize_with_source': True, 'rho': 0.85}
[I 2026-06-01 16:05:15,487] Trial 77 finished with value: 0.20524705081824948 and parameters: {'alpha': 118978.31453081004, 'n_pcs': 3500, 'iw_method': 'pc_logistic', 'iw_clip_max': 1.5, 'iw_prob_clip': 0.03633738384426869, 'iw_n_components': 100, 'iw_logistic_c': 0.00048604750242705024, 'iw_pca_fit': 'combined', 'iw_solver': 'lbfgs', 'iw_rho': 0.85}. Best is trial 59 with value: 0.20554775148526594.
2026-06-01 16:05:15 | INFO | Trial 78 | outer=3 | alpha=4.262e+04 n_pcs=4500 (pc_topk) weight={'name': 'pc_logistic', 'floor': 1e-06, 'clip_max': 1.5, 'prob_clip': 0.03882511457026716, 'n_components': 10, 'logistic_c': 0.000593850135725992, 'pca_fit': 'combined', 'solver': 'lbfgs', 'max_iter': 2000, 'fit_intercept': True, 'standardize_with_source': True, 'rho': 0.85}
[I 2026-06-01 16:05:32,246] Trial 78 finished with value: 0.20482284226020156 and parameters: {'alpha': 42622.388671637134, 'n_pcs': 4500, 'iw_method': 'pc_logistic', 'iw_clip_max': 1.5, 'iw_prob_clip': 0.03882511457026716, 'iw_n_components': 10, 'iw_logistic_c': 0.000593850135725992, 'iw_pca_fit': 'combined', 'iw_solver': 'lbfgs', 'iw_rho': 0.85}. Best is trial 59 with value: 0.20554775148526594.
2026-06-01 16:05:32 | INFO | Trial 79 | outer=3 | alpha=1.814e+04 n_pcs=4500 (pc_topk) weight={'name': 'pc_logistic', 'floor': 1e-06, 'clip_max': 1.5, 'prob_clip': 0.03861936852783707, 'n_components': 10, 'logistic_c': 0.00037602442663019664, 'pca_fit': 'combined', 'solver': 'lbfgs', 'max_iter': 2000, 'fit_intercept': True, 'standardize_with_source': True, 'rho': 0.85}
[I 2026-06-01 16:05:48,924] Trial 79 finished with value: 0.19802348679405393 and parameters: {'alpha': 18137.45239433726, 'n_pcs': 4500, 'iw_method': 'pc_logistic', 'iw_clip_max': 1.5, 'iw_prob_clip': 0.03861936852783707, 'iw_n_components': 10, 'iw_logistic_c': 0.00037602442663019664, 'iw_pca_fit': 'combined', 'iw_solver': 'lbfgs', 'iw_rho': 0.85}. Best is trial 59 with value: 0.20554775148526594.
2026-06-01 16:05:48 | INFO | Trial 80 | outer=3 | alpha=3.186e+04 n_pcs=4500 (pc_topk) weight={'name': 'pc_logistic', 'floor': 1e-06, 'clip_max': 1.5, 'prob_clip': 0.031573219805550896, 'n_components': 10, 'logistic_c': 0.0012929881523424589, 'pca_fit': 'combined', 'solver': 'lbfgs', 'max_iter': 2000, 'fit_intercept': True, 'standardize_with_source': True, 'rho': 0.85}
[I 2026-06-01 16:06:11,098] Trial 80 finished with value: 0.2030299879203902 and parameters: {'alpha': 31862.965706537507, 'n_pcs': 4500, 'iw_method': 'pc_logistic', 'iw_clip_max': 1.5, 'iw_prob_clip': 0.031573219805550896, 'iw_n_components': 10, 'iw_logistic_c': 0.0012929881523424589, 'iw_pca_fit': 'combined', 'iw_solver': 'lbfgs', 'iw_rho': 0.85}. Best is trial 59 with value: 0.20554775148526594.
2026-06-01 16:06:11 | INFO | Trial 81 | outer=3 | alpha=4.500e+04 n_pcs=4000 (pc_topk) weight={'name': 'pc_logistic', 'floor': 1e-06, 'clip_max': 1.5, 'prob_clip': 0.036810400146726624, 'n_components': 10, 'logistic_c': 0.0002924191548535461, 'pca_fit': 'combined', 'solver': 'lbfgs', 'max_iter': 2000, 'fit_intercept': True, 'standardize_with_source': True, 'rho': 0.85}
