[I 2026-06-01 18:08:37,391] Trial 245 finished with value: 0.20029698857423472 and parameters: {'alpha': 46330.91021774722, 'n_pcs': 4500, 'iw_method': 'pc_logistic', 'iw_clip_max': 4.0, 'iw_prob_clip': 0.036299052338606384, 'iw_n_components': 100, 'iw_logistic_c': 1.669006562233383e-05, 'iw_pca_fit': 'combined', 'iw_solver': 'lbfgs', 'iw_rho': 1.0}. Best is trial 203 with value: 0.20096057737722944.
2026-06-01 18:08:37 | INFO | Trial 246 | outer=4 | alpha=4.043e+04 n_pcs=4500 (pc_topk) weight={'name': 'pc_logistic', 'floor': 1e-06, 'clip_max': 4.0, 'prob_clip': 0.03545275868434596, 'n_components': 100, 'logistic_c': 1.0077026530707937e-05, 'pca_fit': 'combined', 'solver': 'lbfgs', 'max_iter': 2000, 'fit_intercept': True, 'standardize_with_source': True, 'rho': 1.0}
[I 2026-06-01 18:08:53,151] Trial 246 finished with value: 0.19830744085435675 and parameters: {'alpha': 40426.73952399167, 'n_pcs': 4500, 'iw_method': 'pc_logistic', 'iw_clip_max': 4.0, 'iw_prob_clip': 0.03545275868434596, 'iw_n_components': 100, 'iw_logistic_c': 1.0077026530707937e-05, 'iw_pca_fit': 'combined', 'iw_solver': 'lbfgs', 'iw_rho': 1.0}. Best is trial 203 with value: 0.20096057737722944.
2026-06-01 18:08:53 | INFO | Trial 247 | outer=4 | alpha=5.151e+04 n_pcs=4500 (pc_topk) weight={'name': 'pc_logistic', 'floor': 1e-06, 'clip_max': 4.0, 'prob_clip': 0.0350643611585292, 'n_components': 100, 'logistic_c': 3.155761892770555e-05, 'pca_fit': 'combined', 'solver': 'lbfgs', 'max_iter': 2000, 'fit_intercept': True, 'standardize_with_source': True, 'rho': 1.0}
[I 2026-06-01 18:09:08,685] Trial 247 finished with value: 0.19947280378858953 and parameters: {'alpha': 51512.5161224656, 'n_pcs': 4500, 'iw_method': 'pc_logistic', 'iw_clip_max': 4.0, 'iw_prob_clip': 0.0350643611585292, 'iw_n_components': 100, 'iw_logistic_c': 3.155761892770555e-05, 'iw_pca_fit': 'combined', 'iw_solver': 'lbfgs', 'iw_rho': 1.0}. Best is trial 203 with value: 0.20096057737722944.
2026-06-01 18:09:08 | INFO | Trial 248 | outer=4 | alpha=3.300e+04 n_pcs=4500 (pc_topk) weight={'name': 'pc_logistic', 'floor': 1e-06, 'clip_max': 4.0, 'prob_clip': 0.041342357586857316, 'n_components': 100, 'logistic_c': 1.8162413572031707e-05, 'pca_fit': 'combined', 'solver': 'lbfgs', 'max_iter': 2000, 'fit_intercept': True, 'standardize_with_source': True, 'rho': 1.0}
[I 2026-06-01 18:09:25,560] Trial 248 finished with value: 0.1983348507232552 and parameters: {'alpha': 32998.080423894724, 'n_pcs': 4500, 'iw_method': 'pc_logistic', 'iw_clip_max': 4.0, 'iw_prob_clip': 0.041342357586857316, 'iw_n_components': 100, 'iw_logistic_c': 1.8162413572031707e-05, 'iw_pca_fit': 'combined', 'iw_solver': 'lbfgs', 'iw_rho': 1.0}. Best is trial 203 with value: 0.20096057737722944.
2026-06-01 18:09:25 | INFO | Trial 249 | outer=4 | alpha=4.721e+04 n_pcs=4500 (pc_topk) weight={'name': 'pc_logistic', 'floor': 1e-06, 'clip_max': 4.0, 'prob_clip': 0.033295757250387505, 'n_components': 100, 'logistic_c': 8.967658658318603e-06, 'pca_fit': 'combined', 'solver': 'lbfgs', 'max_iter': 2000, 'fit_intercept': True, 'standardize_with_source': True, 'rho': 1.0}
[I 2026-06-01 18:09:42,263] Trial 249 finished with value: 0.19876768584317092 and parameters: {'alpha': 47209.556471314114, 'n_pcs': 4500, 'iw_method': 'pc_logistic', 'iw_clip_max': 4.0, 'iw_prob_clip': 0.033295757250387505, 'iw_n_components': 100, 'iw_logistic_c': 8.967658658318603e-06, 'iw_pca_fit': 'combined', 'iw_solver': 'lbfgs', 'iw_rho': 1.0}. Best is trial 203 with value: 0.20096057737722944.
2026-06-01 18:09:42 | INFO | Trial 250 | outer=4 | alpha=6.879e+04 n_pcs=4500 (pc_topk) weight={'name': 'pc_logistic', 'floor': 1e-06, 'clip_max': 4.0, 'prob_clip': 0.03723576842821793, 'n_components': 100, 'logistic_c': 2.523826055242875e-05, 'pca_fit': 'combined', 'solver': 'lbfgs', 'max_iter': 2000, 'fit_intercept': True, 'standardize_with_source': True, 'rho': 1.0}
[I 2026-06-01 18:09:58,149] Trial 250 finished with value: 0.20028918153491954 and parameters: {'alpha': 68785.88462590262, 'n_pcs': 4500, 'iw_method': 'pc_logistic', 'iw_clip_max': 4.0, 'iw_prob_clip': 0.03723576842821793, 'iw_n_components': 100, 'iw_logistic_c': 2.523826055242875e-05, 'iw_pca_fit': 'combined', 'iw_solver': 'lbfgs', 'iw_rho': 1.0}. Best is trial 203 with value: 0.20096057737722944.
2026-06-01 18:09:58 | INFO | Trial 251 | outer=4 | alpha=6.814e+04 n_pcs=4500 (pc_topk) weight={'name': 'pc_logistic', 'floor': 1e-06, 'clip_max': 4.0, 'prob_clip': 0.032423923658846214, 'n_components': 100, 'logistic_c': 3.509272822199215e-05, 'pca_fit': 'combined', 'solver': 'lbfgs', 'max_iter': 2000, 'fit_intercept': True, 'standardize_with_source': True, 'rho': 1.0}
[I 2026-06-01 18:10:14,040] Trial 251 finished with value: 0.19994613438967737 and parameters: {'alpha': 68143.72791387193, 'n_pcs': 4500, 'iw_method': 'pc_logistic', 'iw_clip_max': 4.0, 'iw_prob_clip': 0.032423923658846214, 'iw_n_components': 100, 'iw_logistic_c': 3.509272822199215e-05, 'iw_pca_fit': 'combined', 'iw_solver': 'lbfgs', 'iw_rho': 1.0}. Best is trial 203 with value: 0.20096057737722944.
2026-06-01 18:10:14 | INFO | Trial 252 | outer=4 | alpha=6.421e+04 n_pcs=4500 (pc_topk) weight={'name': 'pc_logistic', 'floor': 1e-06, 'clip_max': 7.0, 'prob_clip': 0.03836315775104974, 'n_components': 100, 'logistic_c': 2.4569254259070217e-05, 'pca_fit': 'combined', 'solver': 'lbfgs', 'max_iter': 2000, 'fit_intercept': True, 'standardize_with_source': True, 'rho': 1.0}
[I 2026-06-01 18:10:31,766] Trial 252 finished with value: 0.19745241165507163 and parameters: {'alpha': 64208.80150800824, 'n_pcs': 4500, 'iw_method': 'pc_logistic', 'iw_clip_max': 7.0, 'iw_prob_clip': 0.03836315775104974, 'iw_n_components': 100, 'iw_logistic_c': 2.4569254259070217e-05, 'iw_pca_fit': 'combined', 'iw_solver': 'lbfgs', 'iw_rho': 1.0}. Best is trial 203 with value: 0.20096057737722944.
2026-06-01 18:10:31 | INFO | Trial 253 | outer=4 | alpha=7.074e+04 n_pcs=4500 (pc_topk) weight={'name': 'pc_logistic', 'floor': 1e-06, 'clip_max': 4.0, 'prob_clip': 0.04239778385397662, 'n_components': 100, 'logistic_c': 5.19000661549115e-05, 'pca_fit': 'combined', 'solver': 'lbfgs', 'max_iter': 2000, 'fit_intercept': True, 'standardize_with_source': True, 'rho': 1.0}
[I 2026-06-01 18:10:49,101] Trial 253 finished with value: 0.19778309559627952 and parameters: {'alpha': 70740.20266582472, 'n_pcs': 4500, 'iw_method': 'pc_logistic', 'iw_clip_max': 4.0, 'iw_prob_clip': 0.04239778385397662, 'iw_n_components': 100, 'iw_logistic_c': 5.19000661549115e-05, 'iw_pca_fit': 'combined', 'iw_solver': 'lbfgs', 'iw_rho': 1.0}. Best is trial 203 with value: 0.20096057737722944.
2026-06-01 18:10:49 | INFO | Trial 254 | outer=4 | alpha=5.744e+04 n_pcs=4500 (pc_topk) weight={'name': 'pc_logistic', 'floor': 1e-06, 'clip_max': 4.0, 'prob_clip': 0.03686279487670224, 'n_components': 100, 'logistic_c': 2.1181501375560358e-05, 'pca_fit': 'combined', 'solver': 'lbfgs', 'max_iter': 2000, 'fit_intercept': True, 'standardize_with_source': True, 'rho': 1.0}
[I 2026-06-01 18:11:04,346] Trial 254 finished with value: 0.20037154874294788 and parameters: {'alpha': 57444.57662639517, 'n_pcs': 4500, 'iw_method': 'pc_logistic', 'iw_clip_max': 4.0, 'iw_prob_clip': 0.03686279487670224, 'iw_n_components': 100, 'iw_logistic_c': 2.1181501375560358e-05, 'iw_pca_fit': 'combined', 'iw_solver': 'lbfgs', 'iw_rho': 1.0}. Best is trial 203 with value: 0.20096057737722944.
2026-06-01 18:11:04 | INFO | Trial 255 | outer=4 | alpha=5.741e+04 n_pcs=4000 (pc_topk) weight={'name': 'pc_logistic', 'floor': 1e-06, 'clip_max': 4.0, 'prob_clip': 0.036763029173202205, 'n_components': 100, 'logistic_c': 1.1745271919548071e-05, 'pca_fit': 'combined', 'solver': 'lbfgs', 'max_iter': 2000, 'fit_intercept': True, 'standardize_with_source': True, 'rho': 1.0}
[I 2026-06-01 18:11:17,962] Trial 255 finished with value: 0.1980220135862245 and parameters: {'alpha': 57411.35048581932, 'n_pcs': 4000, 'iw_method': 'pc_logistic', 'iw_clip_max': 4.0, 'iw_prob_clip': 0.036763029173202205, 'iw_n_components': 100, 'iw_logistic_c': 1.1745271919548071e-05, 'iw_pca_fit': 'combined', 'iw_solver': 'lbfgs', 'iw_rho': 1.0}. Best is trial 203 with value: 0.20096057737722944.
2026-06-01 18:11:17 | INFO | Trial 256 | outer=4 | alpha=5.569e+04 n_pcs=4500 (pc_topk) weight={'name': 'uniform'}
[I 2026-06-01 18:11:30,659] Trial 256 finished with value: 0.19331777499136066 and parameters: {'alpha': 55687.00681810364, 'n_pcs': 4500, 'iw_method': 'uniform'}. Best is trial 203 with value: 0.20096057737722944.
2026-06-01 18:11:30 | INFO | Trial 257 | outer=4 | alpha=6.710e+04 n_pcs=4500 (pc_topk) weight={'name': 'pc_logistic', 'floor': 1e-06, 'clip_max': 4.0, 'prob_clip': 0.04516081042019293, 'n_components': 100, 'logistic_c': 2.4595900215739423e-05, 'pca_fit': 'combined', 'solver': 'lbfgs', 'max_iter': 2000, 'fit_intercept': True, 'standardize_with_source': True, 'rho': 1.0}
[I 2026-06-01 18:11:50,262] Trial 257 finished with value: 0.19935293531201875 and parameters: {'alpha': 67096.82667336041, 'n_pcs': 4500, 'iw_method': 'pc_logistic', 'iw_clip_max': 4.0, 'iw_prob_clip': 0.04516081042019293, 'iw_n_components': 100, 'iw_logistic_c': 2.4595900215739423e-05, 'iw_pca_fit': 'combined', 'iw_solver': 'lbfgs', 'iw_rho': 1.0}. Best is trial 203 with value: 0.20096057737722944.
2026-06-01 18:11:50 | INFO | Trial 258 | outer=4 | alpha=4.699e+04 n_pcs=4500 (pc_topk) weight={'name': 'pc_logistic', 'floor': 1e-06, 'clip_max': 4.0, 'prob_clip': 0.039612269349012436, 'n_components': 100, 'logistic_c': 6.48932937501106e-06, 'pca_fit': 'combined', 'solver': 'lbfgs', 'max_iter': 2000, 'fit_intercept': True, 'standardize_with_source': True, 'rho': 1.0}
[I 2026-06-01 18:12:08,446] Trial 258 finished with value: 0.19722626124200243 and parameters: {'alpha': 46988.46503989188, 'n_pcs': 4500, 'iw_method': 'pc_logistic', 'iw_clip_max': 4.0, 'iw_prob_clip': 0.039612269349012436, 'iw_n_components': 100, 'iw_logistic_c': 6.48932937501106e-06, 'iw_pca_fit': 'combined', 'iw_solver': 'lbfgs', 'iw_rho': 1.0}. Best is trial 203 with value: 0.20096057737722944.
2026-06-01 18:12:08 | INFO | Trial 259 | outer=4 | alpha=3.851e+04 n_pcs=4500 (pc_topk) weight={'name': 'pc_logistic', 'floor': 1e-06, 'clip_max': 1.5, 'prob_clip': 0.031797444227718255, 'n_components': 100, 'logistic_c': 1.6068437915452672e-05, 'pca_fit': 'combined', 'solver': 'lbfgs', 'max_iter': 2000, 'fit_intercept': True, 'standardize_with_source': True, 'rho': 1.0}
[I 2026-06-01 18:12:42,485] Trial 259 finished with value: 0.1991255617695144 and parameters: {'alpha': 38514.111775930774, 'n_pcs': 4500, 'iw_method': 'pc_logistic', 'iw_clip_max': 1.5, 'iw_prob_clip': 0.031797444227718255, 'iw_n_components': 100, 'iw_logistic_c': 1.6068437915452672e-05, 'iw_pca_fit': 'combined', 'iw_solver': 'lbfgs', 'iw_rho': 1.0}. Best is trial 203 with value: 0.20096057737722944.
2026-06-01 18:12:42 | INFO | Trial 260 | outer=4 | alpha=5.918e+04 n_pcs=4000 (pc_topk) weight={'name': 'pc_logistic', 'floor': 1e-06, 'clip_max': 4.0, 'prob_clip': 0.03430130971209861, 'n_components': 100, 'logistic_c': 3.174718103911503e-05, 'pca_fit': 'combined', 'solver': 'lbfgs', 'max_iter': 2000, 'fit_intercept': True, 'standardize_with_source': True, 'rho': 1.0}
[I 2026-06-01 18:12:55,930] Trial 260 finished with value: 0.1980168732544573 and parameters: {'alpha': 59176.566260070955, 'n_pcs': 4000, 'iw_method': 'pc_logistic', 'iw_clip_max': 4.0, 'iw_prob_clip': 0.03430130971209861, 'iw_n_components': 100, 'iw_logistic_c': 3.174718103911503e-05, 'iw_pca_fit': 'combined', 'iw_solver': 'lbfgs', 'iw_rho': 1.0}. Best is trial 203 with value: 0.20096057737722944.
2026-06-01 18:12:55 | INFO | Trial 261 | outer=4 | alpha=1.993e+06 n_pcs=4500 (pc_topk) weight={'name': 'pc_logistic', 'floor': 1e-06, 'clip_max': 4.0, 'prob_clip': 0.03666951317419476, 'n_components': 100, 'logistic_c': 9.579246919071123e-06, 'pca_fit': 'combined', 'solver': 'lbfgs', 'max_iter': 2000, 'fit_intercept': True, 'standardize_with_source': True, 'rho': 0.5}
[I 2026-06-01 18:13:10,677] Trial 261 finished with value: 0.17459801800974323 and parameters: {'alpha': 1992515.8685729317, 'n_pcs': 4500, 'iw_method': 'pc_logistic', 'iw_clip_max': 4.0, 'iw_prob_clip': 0.03666951317419476, 'iw_n_components': 100, 'iw_logistic_c': 9.579246919071123e-06, 'iw_pca_fit': 'combined', 'iw_solver': 'lbfgs', 'iw_rho': 0.5}. Best is trial 203 with value: 0.20096057737722944.
2026-06-01 18:13:10 | INFO | Trial 262 | outer=4 | alpha=7.551e+04 n_pcs=4500 (pc_topk) weight={'name': 'pc_logistic', 'floor': 1e-06, 'clip_max': 4.0, 'prob_clip': 0.03163163844009466, 'n_components': 100, 'logistic_c': 2.0740621663993573e-05, 'pca_fit': 'combined', 'solver': 'lbfgs', 'max_iter': 2000, 'fit_intercept': True, 'standardize_with_source': True, 'rho': 1.0}
[I 2026-06-01 18:13:31,460] Trial 262 finished with value: 0.20076159128503573 and parameters: {'alpha': 75511.21869417804, 'n_pcs': 4500, 'iw_method': 'pc_logistic', 'iw_clip_max': 4.0, 'iw_prob_clip': 0.03163163844009466, 'iw_n_components': 100, 'iw_logistic_c': 2.0740621663993573e-05, 'iw_pca_fit': 'combined', 'iw_solver': 'lbfgs', 'iw_rho': 1.0}. Best is trial 203 with value: 0.20096057737722944.
2026-06-01 18:13:31 | INFO | Trial 263 | outer=4 | alpha=6.967e+04 n_pcs=4500 (pc_topk) weight={'name': 'pc_logistic', 'floor': 1e-06, 'clip_max': 4.0, 'prob_clip': 0.031736343962704264, 'n_components': 100, 'logistic_c': 4.925559635911692e-06, 'pca_fit': 'combined', 'solver': 'lbfgs', 'max_iter': 2000, 'fit_intercept': True, 'standardize_with_source': True, 'rho': 1.0}
[I 2026-06-01 18:13:53,476] Trial 263 finished with value: 0.19675270708491127 and parameters: {'alpha': 69667.49622002842, 'n_pcs': 4500, 'iw_method': 'pc_logistic', 'iw_clip_max': 4.0, 'iw_prob_clip': 0.031736343962704264, 'iw_n_components': 100, 'iw_logistic_c': 4.925559635911692e-06, 'iw_pca_fit': 'combined', 'iw_solver': 'lbfgs', 'iw_rho': 1.0}. Best is trial 203 with value: 0.20096057737722944.
2026-06-01 18:13:53 | INFO | Trial 264 | outer=4 | alpha=5.057e+04 n_pcs=4500 (pc_topk) weight={'name': 'pc_logistic', 'floor': 1e-06, 'clip_max': 4.0, 'prob_clip': 0.038929015549059774, 'n_components': 100, 'logistic_c': 4.749323468312892e-05, 'pca_fit': 'combined', 'solver': 'lbfgs', 'max_iter': 2000, 'fit_intercept': True, 'standardize_with_source': True, 'rho': 1.0}
[I 2026-06-01 18:14:09,667] Trial 264 finished with value: 0.19828367239731334 and parameters: {'alpha': 50569.18524109326, 'n_pcs': 4500, 'iw_method': 'pc_logistic', 'iw_clip_max': 4.0, 'iw_prob_clip': 0.038929015549059774, 'iw_n_components': 100, 'iw_logistic_c': 4.749323468312892e-05, 'iw_pca_fit': 'combined', 'iw_solver': 'lbfgs', 'iw_rho': 1.0}. Best is trial 203 with value: 0.20096057737722944.
2026-06-01 18:14:09 | INFO | Trial 265 | outer=4 | alpha=6.831e+04 n_pcs=4500 (pc_topk) weight={'name': 'pc_logistic', 'floor': 1e-06, 'clip_max': 4.0, 'prob_clip': 0.034495457285167765, 'n_components': 100, 'logistic_c': 2.1080221533358113e-05, 'pca_fit': 'combined', 'solver': 'lbfgs', 'max_iter': 2000, 'fit_intercept': True, 'standardize_with_source': True, 'rho': 1.0}
[I 2026-06-01 18:14:42,918] Trial 265 finished with value: 0.20067861509538304 and parameters: {'alpha': 68310.5884414538, 'n_pcs': 4500, 'iw_method': 'pc_logistic', 'iw_clip_max': 4.0, 'iw_prob_clip': 0.034495457285167765, 'iw_n_components': 100, 'iw_logistic_c': 2.1080221533358113e-05, 'iw_pca_fit': 'combined', 'iw_solver': 'lbfgs', 'iw_rho': 1.0}. Best is trial 203 with value: 0.20096057737722944.
2026-06-01 18:14:42 | INFO | Trial 266 | outer=4 | alpha=5.940e+04 n_pcs=4500 (pc_topk) weight={'name': 'pc_logistic', 'floor': 1e-06, 'clip_max': 4.0, 'prob_clip': 0.03323202566517612, 'n_components': 100, 'logistic_c': 1.1846693512570533e-05, 'pca_fit': 'combined', 'solver': 'lbfgs', 'max_iter': 2000, 'fit_intercept': True, 'standardize_with_source': True, 'rho': 1.0}
[I 2026-06-01 18:14:58,034] Trial 266 finished with value: 0.20045894833973948 and parameters: {'alpha': 59396.647271251226, 'n_pcs': 4500, 'iw_method': 'pc_logistic', 'iw_clip_max': 4.0, 'iw_prob_clip': 0.03323202566517612, 'iw_n_components': 100, 'iw_logistic_c': 1.1846693512570533e-05, 'iw_pca_fit': 'combined', 'iw_solver': 'lbfgs', 'iw_rho': 1.0}. Best is trial 203 with value: 0.20096057737722944.
2026-06-01 18:14:58 | INFO | Trial 267 | outer=4 | alpha=7.776e+04 n_pcs=4500 (pc_topk) weight={'name': 'pc_logistic', 'floor': 1e-06, 'clip_max': 4.0, 'prob_clip': 0.03047666911380543, 'n_components': 100, 'logistic_c': 8.228430267752454e-06, 'pca_fit': 'combined', 'solver': 'lbfgs', 'max_iter': 2000, 'fit_intercept': True, 'standardize_with_source': True, 'rho': 1.0}
[I 2026-06-01 18:15:19,988] Trial 267 finished with value: 0.19895984578880324 and parameters: {'alpha': 77758.06708841329, 'n_pcs': 4500, 'iw_method': 'pc_logistic', 'iw_clip_max': 4.0, 'iw_prob_clip': 0.03047666911380543, 'iw_n_components': 100, 'iw_logistic_c': 8.228430267752454e-06, 'iw_pca_fit': 'combined', 'iw_solver': 'lbfgs', 'iw_rho': 1.0}. Best is trial 203 with value: 0.20096057737722944.
2026-06-01 18:15:20 | INFO | Trial 268 | outer=4 | alpha=6.094e+04 n_pcs=4500 (pc_topk) weight={'name': 'pc_logistic', 'floor': 1e-06, 'clip_max': 4.0, 'prob_clip': 0.03321493103045768, 'n_components': 100, 'logistic_c': 1.194159346406616e-05, 'pca_fit': 'combined', 'solver': 'lbfgs', 'max_iter': 2000, 'fit_intercept': True, 'standardize_with_source': True, 'rho': 1.0}
[I 2026-06-01 18:15:42,890] Trial 268 finished with value: 0.2005313469020408 and parameters: {'alpha': 60943.02124015075, 'n_pcs': 4500, 'iw_method': 'pc_logistic', 'iw_clip_max': 4.0, 'iw_prob_clip': 0.03321493103045768, 'iw_n_components': 100, 'iw_logistic_c': 1.194159346406616e-05, 'iw_pca_fit': 'combined', 'iw_solver': 'lbfgs', 'iw_rho': 1.0}. Best is trial 203 with value: 0.20096057737722944.
2026-06-01 18:15:42 | INFO | Trial 269 | outer=4 | alpha=5.788e+04 n_pcs=4500 (pc_topk) weight={'name': 'pc_logistic', 'floor': 1e-06, 'clip_max': 4.0, 'prob_clip': 0.03378053320326215, 'n_components': 100, 'logistic_c': 1.1637840742151488e-05, 'pca_fit': 'combined', 'solver': 'lbfgs', 'max_iter': 2000, 'fit_intercept': True, 'standardize_with_source': True, 'rho': 0.85}
[I 2026-06-01 18:15:59,604] Trial 269 finished with value: 0.20010901857238128 and parameters: {'alpha': 57877.12575199122, 'n_pcs': 4500, 'iw_method': 'pc_logistic', 'iw_clip_max': 4.0, 'iw_prob_clip': 0.03378053320326215, 'iw_n_components': 100, 'iw_logistic_c': 1.1637840742151488e-05, 'iw_pca_fit': 'combined', 'iw_solver': 'lbfgs', 'iw_rho': 0.85}. Best is trial 203 with value: 0.20096057737722944.
2026-06-01 18:15:59 | INFO | Trial 270 | outer=4 | alpha=6.210e+04 n_pcs=4500 (pc_topk) weight={'name': 'pc_logistic', 'floor': 1e-06, 'clip_max': 12.0, 'prob_clip': 0.031511748710207496, 'n_components': 100, 'logistic_c': 3.7354756864576855e-06, 'pca_fit': 'combined', 'solver': 'lbfgs', 'max_iter': 2000, 'fit_intercept': True, 'standardize_with_source': True, 'rho': 1.0}
[I 2026-06-01 18:16:14,550] Trial 270 finished with value: 0.1961717698327776 and parameters: {'alpha': 62099.78069213556, 'n_pcs': 4500, 'iw_method': 'pc_logistic', 'iw_clip_max': 12.0, 'iw_prob_clip': 0.031511748710207496, 'iw_n_components': 100, 'iw_logistic_c': 3.7354756864576855e-06, 'iw_pca_fit': 'combined', 'iw_solver': 'lbfgs', 'iw_rho': 1.0}. Best is trial 203 with value: 0.20096057737722944.
2026-06-01 18:16:14 | INFO | Trial 271 | outer=4 | alpha=7.523e+04 n_pcs=4000 (pc_topk) weight={'name': 'pc_logistic', 'floor': 1e-06, 'clip_max': 4.0, 'prob_clip': 0.005607299957626255, 'n_components': 100, 'logistic_c': 5.976391084414582e-06, 'pca_fit': 'combined', 'solver': 'lbfgs', 'max_iter': 2000, 'fit_intercept': True, 'standardize_with_source': True, 'rho': 1.0}
[I 2026-06-01 18:16:27,309] Trial 271 finished with value: 0.1961379520038517 and parameters: {'alpha': 75232.69489258406, 'n_pcs': 4000, 'iw_method': 'pc_logistic', 'iw_clip_max': 4.0, 'iw_prob_clip': 0.005607299957626255, 'iw_n_components': 100, 'iw_logistic_c': 5.976391084414582e-06, 'iw_pca_fit': 'combined', 'iw_solver': 'lbfgs', 'iw_rho': 1.0}. Best is trial 203 with value: 0.20096057737722944.
2026-06-01 18:16:27 | INFO | Trial 272 | outer=4 | alpha=5.372e+04 n_pcs=4500 (pc_topk) weight={'name': 'pc_logistic', 'floor': 1e-06, 'clip_max': 4.0, 'prob_clip': 0.03284086879328754, 'n_components': 100, 'logistic_c': 1.1076347329652753e-05, 'pca_fit': 'combined', 'solver': 'lbfgs', 'max_iter': 2000, 'fit_intercept': True, 'standardize_with_source': True, 'rho': 1.0}
[I 2026-06-01 18:16:42,394] Trial 272 finished with value: 0.19997365969715272 and parameters: {'alpha': 53723.48413769247, 'n_pcs': 4500, 'iw_method': 'pc_logistic', 'iw_clip_max': 4.0, 'iw_prob_clip': 0.03284086879328754, 'iw_n_components': 100, 'iw_logistic_c': 1.1076347329652753e-05, 'iw_pca_fit': 'combined', 'iw_solver': 'lbfgs', 'iw_rho': 1.0}. Best is trial 203 with value: 0.20096057737722944.
2026-06-01 18:16:42 | INFO | Trial 273 | outer=4 | alpha=7.371e+04 n_pcs=4500 (pc_topk) weight={'name': 'pc_logistic', 'floor': 1e-06, 'clip_max': 4.0, 'prob_clip': 0.029204642419847993, 'n_components': 100, 'logistic_c': 2.1615572635332207e-05, 'pca_fit': 'combined', 'solver': 'lbfgs', 'max_iter': 2000, 'fit_intercept': True, 'standardize_with_source': True, 'rho': 1.0}
