[I 2026-06-01 22:19:20,765] Trial 18 finished with value: 0.1882047927059716 and parameters: {'alpha': 714694.6799037684, 'n_pcs': 3000, 'iw_method': 'uniform'}. Best is trial 16 with value: 0.21477752273540457.
2026-06-01 22:19:20 | INFO | Trial 19 | outer=8 | alpha=4.665e+03 n_pcs=4000 (pc_topk) weight={'name': 'uniform'}
[I 2026-06-01 22:19:27,922] Trial 19 finished with value: 0.17576103031343773 and parameters: {'alpha': 4664.983445930532, 'n_pcs': 4000, 'iw_method': 'uniform'}. Best is trial 16 with value: 0.21477752273540457.
2026-06-01 22:19:27 | INFO | Trial 20 | outer=8 | alpha=3.786e+04 n_pcs=3500 (pc_topk) weight={'name': 'uniform'}
[I 2026-06-01 22:19:33,788] Trial 20 finished with value: 0.21214163987445422 and parameters: {'alpha': 37855.51033082005, 'n_pcs': 3500, 'iw_method': 'uniform'}. Best is trial 16 with value: 0.21477752273540457.
2026-06-01 22:19:33 | INFO | Trial 21 | outer=8 | alpha=3.300e+04 n_pcs=4500 (pc_topk) weight={'name': 'uniform'}
[I 2026-06-01 22:19:42,704] Trial 21 finished with value: 0.2170381611660081 and parameters: {'alpha': 33004.39036663558, 'n_pcs': 4500, 'iw_method': 'uniform'}. Best is trial 21 with value: 0.2170381611660081.
2026-06-01 22:19:42 | INFO | Trial 22 | outer=8 | alpha=3.431e+04 n_pcs=4500 (pc_topk) weight={'name': 'uniform'}
[I 2026-06-01 22:19:51,798] Trial 22 finished with value: 0.21694873760678074 and parameters: {'alpha': 34306.136877271674, 'n_pcs': 4500, 'iw_method': 'uniform'}. Best is trial 21 with value: 0.2170381611660081.
2026-06-01 22:19:51 | INFO | Trial 23 | outer=8 | alpha=3.259e+05 n_pcs=4500 (pc_topk) weight={'name': 'uniform'}
[I 2026-06-01 22:20:00,923] Trial 23 finished with value: 0.1946162377199561 and parameters: {'alpha': 325858.95183422806, 'n_pcs': 4500, 'iw_method': 'uniform'}. Best is trial 21 with value: 0.2170381611660081.
2026-06-01 22:20:00 | INFO | Trial 24 | outer=8 | alpha=4.499e+03 n_pcs=4000 (pc_topk) weight={'name': 'uniform'}
[I 2026-06-01 22:20:08,000] Trial 24 finished with value: 0.17438537664562168 and parameters: {'alpha': 4498.781011896854, 'n_pcs': 4000, 'iw_method': 'uniform'}. Best is trial 21 with value: 0.2170381611660081.
2026-06-01 22:20:08 | INFO | Trial 25 | outer=8 | alpha=3.065e+04 n_pcs=4500 (pc_topk) weight={'name': 'uniform'}
[I 2026-06-01 22:20:16,603] Trial 25 finished with value: 0.2171599093558755 and parameters: {'alpha': 30646.422704798224, 'n_pcs': 4500, 'iw_method': 'uniform'}. Best is trial 25 with value: 0.2171599093558755.
2026-06-01 22:20:16 | INFO | Trial 26 | outer=8 | alpha=2.547e+04 n_pcs=4500 (pc_topk) weight={'name': 'pc_logistic', 'floor': 1e-06, 'clip_max': 2.5, 'prob_clip': 0.04783268173298191, 'n_components': 40, 'logistic_c': 0.0034285114017368, 'pca_fit': 'combined', 'solver': 'lbfgs', 'max_iter': 2000, 'fit_intercept': True, 'standardize_with_source': True, 'rho': 0.5}
[I 2026-06-01 22:20:36,435] Trial 26 finished with value: 0.21806828265683445 and parameters: {'alpha': 25474.059335164024, 'n_pcs': 4500, 'iw_method': 'pc_logistic', 'iw_clip_max': 2.5, 'iw_prob_clip': 0.04783268173298191, 'iw_n_components': 40, 'iw_logistic_c': 0.0034285114017368, 'iw_pca_fit': 'combined', 'iw_solver': 'lbfgs', 'iw_rho': 0.5}. Best is trial 26 with value: 0.21806828265683445.
2026-06-01 22:20:36 | INFO | Trial 27 | outer=8 | alpha=4.810e+03 n_pcs=4500 (pc_topk) weight={'name': 'pc_logistic', 'floor': 1e-06, 'clip_max': 2.5, 'prob_clip': 0.04068282884065535, 'n_components': 40, 'logistic_c': 0.004144301940152981, 'pca_fit': 'combined', 'solver': 'lbfgs', 'max_iter': 2000, 'fit_intercept': True, 'standardize_with_source': True, 'rho': 0.5}
[I 2026-06-01 22:20:56,727] Trial 27 finished with value: 0.19329904572872483 and parameters: {'alpha': 4809.607228025614, 'n_pcs': 4500, 'iw_method': 'pc_logistic', 'iw_clip_max': 2.5, 'iw_prob_clip': 0.04068282884065535, 'iw_n_components': 40, 'iw_logistic_c': 0.004144301940152981, 'iw_pca_fit': 'combined', 'iw_solver': 'lbfgs', 'iw_rho': 0.5}. Best is trial 26 with value: 0.21806828265683445.
2026-06-01 22:20:56 | INFO | Trial 28 | outer=8 | alpha=2.150e+04 n_pcs=2500 (pc_topk) weight={'name': 'pc_logistic', 'floor': 1e-06, 'clip_max': 2.5, 'prob_clip': 0.016572379481429717, 'n_components': 40, 'logistic_c': 0.0007021133098376147, 'pca_fit': 'combined', 'solver': 'lbfgs', 'max_iter': 2000, 'fit_intercept': True, 'standardize_with_source': True, 'rho': 0.5}
[I 2026-06-01 22:21:09,564] Trial 28 finished with value: 0.20100152320476639 and parameters: {'alpha': 21495.428945950072, 'n_pcs': 2500, 'iw_method': 'pc_logistic', 'iw_clip_max': 2.5, 'iw_prob_clip': 0.016572379481429717, 'iw_n_components': 40, 'iw_logistic_c': 0.0007021133098376147, 'iw_pca_fit': 'combined', 'iw_solver': 'lbfgs', 'iw_rho': 0.5}. Best is trial 26 with value: 0.21806828265683445.
2026-06-01 22:21:09 | INFO | Trial 29 | outer=8 | alpha=2.135e+05 n_pcs=4500 (pc_topk) weight={'name': 'pc_logistic', 'floor': 1e-06, 'clip_max': 1.5, 'prob_clip': 0.04937079087391629, 'n_components': 100, 'logistic_c': 0.16854017434312787, 'pca_fit': 'combined', 'solver': 'lbfgs', 'max_iter': 2000, 'fit_intercept': True, 'standardize_with_source': True, 'rho': 0.85}
[I 2026-06-01 22:21:37,376] Trial 29 finished with value: 0.21041922633360638 and parameters: {'alpha': 213522.80414088359, 'n_pcs': 4500, 'iw_method': 'pc_logistic', 'iw_clip_max': 1.5, 'iw_prob_clip': 0.04937079087391629, 'iw_n_components': 100, 'iw_logistic_c': 0.16854017434312787, 'iw_pca_fit': 'combined', 'iw_solver': 'lbfgs', 'iw_rho': 0.85}. Best is trial 26 with value: 0.21806828265683445.
2026-06-01 22:21:37 | INFO | Trial 30 | outer=8 | alpha=8.400e+04 n_pcs=3500 (pc_topk) weight={'name': 'pc_logistic', 'floor': 1e-06, 'clip_max': 7.0, 'prob_clip': 0.013020675682074805, 'n_components': 40, 'logistic_c': 2.5444813470676852e-05, 'pca_fit': 'combined', 'solver': 'lbfgs', 'max_iter': 2000, 'fit_intercept': True, 'standardize_with_source': True, 'rho': 0.5}
[I 2026-06-01 22:21:48,351] Trial 30 finished with value: 0.2181020191563119 and parameters: {'alpha': 84000.70039537566, 'n_pcs': 3500, 'iw_method': 'pc_logistic', 'iw_clip_max': 7.0, 'iw_prob_clip': 0.013020675682074805, 'iw_n_components': 40, 'iw_logistic_c': 2.5444813470676852e-05, 'iw_pca_fit': 'combined', 'iw_solver': 'lbfgs', 'iw_rho': 0.5}. Best is trial 30 with value: 0.2181020191563119.
2026-06-01 22:21:48 | INFO | Trial 31 | outer=8 | alpha=8.682e+04 n_pcs=3500 (pc_topk) weight={'name': 'pc_logistic', 'floor': 1e-06, 'clip_max': 7.0, 'prob_clip': 0.014184394404565212, 'n_components': 40, 'logistic_c': 1.4305234579210648e-05, 'pca_fit': 'combined', 'solver': 'lbfgs', 'max_iter': 2000, 'fit_intercept': True, 'standardize_with_source': True, 'rho': 0.5}
[I 2026-06-01 22:21:59,296] Trial 31 finished with value: 0.21625139131313795 and parameters: {'alpha': 86822.6092100292, 'n_pcs': 3500, 'iw_method': 'pc_logistic', 'iw_clip_max': 7.0, 'iw_prob_clip': 0.014184394404565212, 'iw_n_components': 40, 'iw_logistic_c': 1.4305234579210648e-05, 'iw_pca_fit': 'combined', 'iw_solver': 'lbfgs', 'iw_rho': 0.5}. Best is trial 30 with value: 0.2181020191563119.
2026-06-01 22:21:59 | INFO | Trial 32 | outer=8 | alpha=7.004e+04 n_pcs=5000 (pc_topk) weight={'name': 'pc_logistic', 'floor': 1e-06, 'clip_max': 7.0, 'prob_clip': 0.007668068625977022, 'n_components': 40, 'logistic_c': 5.1487386983144846e-05, 'pca_fit': 'combined', 'solver': 'lbfgs', 'max_iter': 2000, 'fit_intercept': True, 'standardize_with_source': True, 'rho': 0.5}
[I 2026-06-01 22:22:16,003] Trial 32 finished with value: 0.21829448272492544 and parameters: {'alpha': 70037.37837918256, 'n_pcs': 5000, 'iw_method': 'pc_logistic', 'iw_clip_max': 7.0, 'iw_prob_clip': 0.007668068625977022, 'iw_n_components': 40, 'iw_logistic_c': 5.1487386983144846e-05, 'iw_pca_fit': 'combined', 'iw_solver': 'lbfgs', 'iw_rho': 0.5}. Best is trial 32 with value: 0.21829448272492544.
2026-06-01 22:22:16 | INFO | Trial 33 | outer=8 | alpha=7.486e+04 n_pcs=5000 (pc_topk) weight={'name': 'pc_logistic', 'floor': 1e-06, 'clip_max': 7.0, 'prob_clip': 0.009100414212844509, 'n_components': 40, 'logistic_c': 5.1591733127396255e-05, 'pca_fit': 'combined', 'solver': 'lbfgs', 'max_iter': 2000, 'fit_intercept': True, 'standardize_with_source': True, 'rho': 0.5}
[I 2026-06-01 22:22:32,292] Trial 33 finished with value: 0.21836539887999024 and parameters: {'alpha': 74855.5757590295, 'n_pcs': 5000, 'iw_method': 'pc_logistic', 'iw_clip_max': 7.0, 'iw_prob_clip': 0.009100414212844509, 'iw_n_components': 40, 'iw_logistic_c': 5.1591733127396255e-05, 'iw_pca_fit': 'combined', 'iw_solver': 'lbfgs', 'iw_rho': 0.5}. Best is trial 33 with value: 0.21836539887999024.
2026-06-01 22:22:32 | INFO | Trial 34 | outer=8 | alpha=8.153e+04 n_pcs=5000 (pc_topk) weight={'name': 'pc_logistic', 'floor': 1e-06, 'clip_max': 7.0, 'prob_clip': 0.00726005904487511, 'n_components': 40, 'logistic_c': 2.988606628580643e-05, 'pca_fit': 'combined', 'solver': 'lbfgs', 'max_iter': 2000, 'fit_intercept': True, 'standardize_with_source': True, 'rho': 0.5}
[I 2026-06-01 22:22:48,698] Trial 34 finished with value: 0.21851148895743658 and parameters: {'alpha': 81530.5718310303, 'n_pcs': 5000, 'iw_method': 'pc_logistic', 'iw_clip_max': 7.0, 'iw_prob_clip': 0.00726005904487511, 'iw_n_components': 40, 'iw_logistic_c': 2.988606628580643e-05, 'iw_pca_fit': 'combined', 'iw_solver': 'lbfgs', 'iw_rho': 0.5}. Best is trial 34 with value: 0.21851148895743658.
2026-06-01 22:22:48 | INFO | Trial 35 | outer=8 | alpha=7.540e+04 n_pcs=5000 (pc_topk) weight={'name': 'pc_logistic', 'floor': 1e-06, 'clip_max': 7.0, 'prob_clip': 0.00834520545539007, 'n_components': 40, 'logistic_c': 3.422266101533154e-05, 'pca_fit': 'combined', 'solver': 'lbfgs', 'max_iter': 2000, 'fit_intercept': True, 'standardize_with_source': True, 'rho': 0.5}
[I 2026-06-01 22:23:04,807] Trial 35 finished with value: 0.2185976392563048 and parameters: {'alpha': 75398.63116762576, 'n_pcs': 5000, 'iw_method': 'pc_logistic', 'iw_clip_max': 7.0, 'iw_prob_clip': 0.00834520545539007, 'iw_n_components': 40, 'iw_logistic_c': 3.422266101533154e-05, 'iw_pca_fit': 'combined', 'iw_solver': 'lbfgs', 'iw_rho': 0.5}. Best is trial 35 with value: 0.2185976392563048.
2026-06-01 22:23:04 | INFO | Trial 36 | outer=8 | alpha=6.842e+05 n_pcs=5000 (pc_topk) weight={'name': 'pc_logistic', 'floor': 1e-06, 'clip_max': 7.0, 'prob_clip': 0.0071766369858942605, 'n_components': 40, 'logistic_c': 7.312255697591172e-05, 'pca_fit': 'combined', 'solver': 'lbfgs', 'max_iter': 2000, 'fit_intercept': True, 'standardize_with_source': True, 'rho': 0.5}
[I 2026-06-01 22:23:21,442] Trial 36 finished with value: 0.20775078774976902 and parameters: {'alpha': 684179.0409043691, 'n_pcs': 5000, 'iw_method': 'pc_logistic', 'iw_clip_max': 7.0, 'iw_prob_clip': 0.0071766369858942605, 'iw_n_components': 40, 'iw_logistic_c': 7.312255697591172e-05, 'iw_pca_fit': 'combined', 'iw_solver': 'lbfgs', 'iw_rho': 0.5}. Best is trial 35 with value: 0.2185976392563048.
2026-06-01 22:23:21 | INFO | Trial 37 | outer=8 | alpha=1.187e+05 n_pcs=5000 (pc_topk) weight={'name': 'pc_logistic', 'floor': 1e-06, 'clip_max': 7.0, 'prob_clip': 0.007067453120420741, 'n_components': 40, 'logistic_c': 2.781659484754369e-06, 'pca_fit': 'combined', 'solver': 'lbfgs', 'max_iter': 2000, 'fit_intercept': True, 'standardize_with_source': True, 'rho': 0.5}
[I 2026-06-01 22:23:37,125] Trial 37 finished with value: 0.21000163582809125 and parameters: {'alpha': 118708.75577904037, 'n_pcs': 5000, 'iw_method': 'pc_logistic', 'iw_clip_max': 7.0, 'iw_prob_clip': 0.007067453120420741, 'iw_n_components': 40, 'iw_logistic_c': 2.781659484754369e-06, 'iw_pca_fit': 'combined', 'iw_solver': 'lbfgs', 'iw_rho': 0.5}. Best is trial 35 with value: 0.2185976392563048.
2026-06-01 22:23:37 | INFO | Trial 38 | outer=8 | alpha=2.154e+05 n_pcs=5000 (pc_topk) weight={'name': 'pc_logistic', 'floor': 1e-06, 'clip_max': 7.0, 'prob_clip': 0.007598238493347924, 'n_components': 40, 'logistic_c': 9.762225969070031e-05, 'pca_fit': 'combined', 'solver': 'lbfgs', 'max_iter': 2000, 'fit_intercept': True, 'standardize_with_source': True, 'rho': 0.5}
[I 2026-06-01 22:23:54,473] Trial 38 finished with value: 0.21454945667523048 and parameters: {'alpha': 215376.19062906655, 'n_pcs': 5000, 'iw_method': 'pc_logistic', 'iw_clip_max': 7.0, 'iw_prob_clip': 0.007598238493347924, 'iw_n_components': 40, 'iw_logistic_c': 9.762225969070031e-05, 'iw_pca_fit': 'combined', 'iw_solver': 'lbfgs', 'iw_rho': 0.5}. Best is trial 35 with value: 0.2185976392563048.
2026-06-01 22:23:54 | INFO | Trial 39 | outer=8 | alpha=2.382e+06 n_pcs=1500 (pc_topk) weight={'name': 'pc_logistic', 'floor': 1e-06, 'clip_max': 7.0, 'prob_clip': 0.009270477578650977, 'n_components': 40, 'logistic_c': 5.938415223089e-07, 'pca_fit': 'combined', 'solver': 'lbfgs', 'max_iter': 2000, 'fit_intercept': True, 'standardize_with_source': True, 'rho': 0.5}
[I 2026-06-01 22:24:01,797] Trial 39 finished with value: 0.17916283829059265 and parameters: {'alpha': 2381584.253827562, 'n_pcs': 1500, 'iw_method': 'pc_logistic', 'iw_clip_max': 7.0, 'iw_prob_clip': 0.009270477578650977, 'iw_n_components': 40, 'iw_logistic_c': 5.938415223089e-07, 'iw_pca_fit': 'combined', 'iw_solver': 'lbfgs', 'iw_rho': 0.5}. Best is trial 35 with value: 0.2185976392563048.
2026-06-01 22:24:01 | INFO | Trial 40 | outer=8 | alpha=6.303e+04 n_pcs=5000 (pc_topk) weight={'name': 'pc_logistic', 'floor': 1e-06, 'clip_max': 7.0, 'prob_clip': 0.0038549672721680337, 'n_components': 20, 'logistic_c': 8.69289012775156e-06, 'pca_fit': 'combined', 'solver': 'lbfgs', 'max_iter': 2000, 'fit_intercept': True, 'standardize_with_source': True, 'rho': 0.7}
[I 2026-06-01 22:24:17,911] Trial 40 finished with value: 0.21765060634479744 and parameters: {'alpha': 63029.96772476318, 'n_pcs': 5000, 'iw_method': 'pc_logistic', 'iw_clip_max': 7.0, 'iw_prob_clip': 0.0038549672721680337, 'iw_n_components': 20, 'iw_logistic_c': 8.69289012775156e-06, 'iw_pca_fit': 'combined', 'iw_solver': 'lbfgs', 'iw_rho': 0.7}. Best is trial 35 with value: 0.2185976392563048.
2026-06-01 22:24:17 | INFO | Trial 41 | outer=8 | alpha=7.705e+04 n_pcs=5000 (pc_topk) weight={'name': 'pc_logistic', 'floor': 1e-06, 'clip_max': 7.0, 'prob_clip': 0.011444392692387778, 'n_components': 40, 'logistic_c': 2.6749888368424126e-05, 'pca_fit': 'combined', 'solver': 'lbfgs', 'max_iter': 2000, 'fit_intercept': True, 'standardize_with_source': True, 'rho': 0.5}
[I 2026-06-01 22:24:34,742] Trial 41 finished with value: 0.218575544101877 and parameters: {'alpha': 77053.72788078593, 'n_pcs': 5000, 'iw_method': 'pc_logistic', 'iw_clip_max': 7.0, 'iw_prob_clip': 0.011444392692387778, 'iw_n_components': 40, 'iw_logistic_c': 2.6749888368424126e-05, 'iw_pca_fit': 'combined', 'iw_solver': 'lbfgs', 'iw_rho': 0.5}. Best is trial 35 with value: 0.2185976392563048.
2026-06-01 22:24:34 | INFO | Trial 42 | outer=8 | alpha=1.612e+05 n_pcs=5000 (pc_topk) weight={'name': 'pc_logistic', 'floor': 1e-06, 'clip_max': 7.0, 'prob_clip': 0.010220444721128838, 'n_components': 40, 'logistic_c': 9.217853173179463e-05, 'pca_fit': 'combined', 'solver': 'lbfgs', 'max_iter': 2000, 'fit_intercept': True, 'standardize_with_source': True, 'rho': 0.5}
[I 2026-06-01 22:24:51,566] Trial 42 finished with value: 0.21571304387256568 and parameters: {'alpha': 161163.1185880623, 'n_pcs': 5000, 'iw_method': 'pc_logistic', 'iw_clip_max': 7.0, 'iw_prob_clip': 0.010220444721128838, 'iw_n_components': 40, 'iw_logistic_c': 9.217853173179463e-05, 'iw_pca_fit': 'combined', 'iw_solver': 'lbfgs', 'iw_rho': 0.5}. Best is trial 35 with value: 0.2185976392563048.
2026-06-01 22:24:51 | INFO | Trial 43 | outer=8 | alpha=6.494e+04 n_pcs=5000 (pc_topk) weight={'name': 'pc_logistic', 'floor': 1e-06, 'clip_max': 7.0, 'prob_clip': 0.02455664473320029, 'n_components': 40, 'logistic_c': 0.00046252103516749297, 'pca_fit': 'combined', 'solver': 'lbfgs', 'max_iter': 2000, 'fit_intercept': True, 'standardize_with_source': True, 'rho': 0.5}
[I 2026-06-01 22:25:09,919] Trial 43 finished with value: 0.2158379132613514 and parameters: {'alpha': 64943.345679269405, 'n_pcs': 5000, 'iw_method': 'pc_logistic', 'iw_clip_max': 7.0, 'iw_prob_clip': 0.02455664473320029, 'iw_n_components': 40, 'iw_logistic_c': 0.00046252103516749297, 'iw_pca_fit': 'combined', 'iw_solver': 'lbfgs', 'iw_rho': 0.5}. Best is trial 35 with value: 0.2185976392563048.
2026-06-01 22:25:09 | INFO | Trial 44 | outer=8 | alpha=2.937e+05 n_pcs=5000 (pc_topk) weight={'name': 'pc_logistic', 'floor': 1e-06, 'clip_max': 7.0, 'prob_clip': 0.005596164620870987, 'n_components': 60, 'logistic_c': 3.109625922282251e-05, 'pca_fit': 'combined', 'solver': 'lbfgs', 'max_iter': 2000, 'fit_intercept': True, 'standardize_with_source': True, 'rho': 0.85}
[I 2026-06-01 22:25:26,912] Trial 44 finished with value: 0.21325400695769886 and parameters: {'alpha': 293731.75351458014, 'n_pcs': 5000, 'iw_method': 'pc_logistic', 'iw_clip_max': 7.0, 'iw_prob_clip': 0.005596164620870987, 'iw_n_components': 60, 'iw_logistic_c': 3.109625922282251e-05, 'iw_pca_fit': 'combined', 'iw_solver': 'lbfgs', 'iw_rho': 0.85}. Best is trial 35 with value: 0.2185976392563048.
2026-06-01 22:25:26 | INFO | Trial 45 | outer=8 | alpha=1.187e+05 n_pcs=4500 (pc_topk) weight={'name': 'pc_logistic', 'floor': 1e-06, 'clip_max': 4.0, 'prob_clip': 0.010437282425824352, 'n_components': 10, 'logistic_c': 1.8922146045297258e-06, 'pca_fit': 'combined', 'solver': 'lbfgs', 'max_iter': 2000, 'fit_intercept': True, 'standardize_with_source': True, 'rho': 0.3}
[I 2026-06-01 22:25:41,486] Trial 45 finished with value: 0.20894244770272286 and parameters: {'alpha': 118720.25601275306, 'n_pcs': 4500, 'iw_method': 'pc_logistic', 'iw_clip_max': 4.0, 'iw_prob_clip': 0.010437282425824352, 'iw_n_components': 10, 'iw_logistic_c': 1.8922146045297258e-06, 'iw_pca_fit': 'combined', 'iw_solver': 'lbfgs', 'iw_rho': 0.3}. Best is trial 35 with value: 0.2185976392563048.
2026-06-01 22:25:41 | INFO | Trial 46 | outer=8 | alpha=5.774e+04 n_pcs=5000 (pc_topk) weight={'name': 'pc_logistic', 'floor': 1e-06, 'clip_max': 12.0, 'prob_clip': 0.005371502502565161, 'n_components': 100, 'logistic_c': 1.4971231882372759e-05, 'pca_fit': 'combined', 'solver': 'lbfgs', 'max_iter': 2000, 'fit_intercept': True, 'standardize_with_source': True, 'rho': 0.5}
[I 2026-06-01 22:25:57,999] Trial 46 finished with value: 0.21708526638039333 and parameters: {'alpha': 57739.184300674504, 'n_pcs': 5000, 'iw_method': 'pc_logistic', 'iw_clip_max': 12.0, 'iw_prob_clip': 0.005371502502565161, 'iw_n_components': 100, 'iw_logistic_c': 1.4971231882372759e-05, 'iw_pca_fit': 'combined', 'iw_solver': 'lbfgs', 'iw_rho': 0.5}. Best is trial 35 with value: 0.2185976392563048.
2026-06-01 22:25:58 | INFO | Trial 47 | outer=8 | alpha=1.821e+05 n_pcs=4000 (pc_topk) weight={'name': 'pc_logistic', 'floor': 1e-06, 'clip_max': 7.0, 'prob_clip': 0.023988406498670754, 'n_components': 40, 'logistic_c': 0.0018125693818678674, 'pca_fit': 'combined', 'solver': 'lbfgs', 'max_iter': 2000, 'fit_intercept': True, 'standardize_with_source': True, 'rho': 0.5}
[I 2026-06-01 22:26:14,807] Trial 47 finished with value: 0.21278121099124667 and parameters: {'alpha': 182057.04262580056, 'n_pcs': 4000, 'iw_method': 'pc_logistic', 'iw_clip_max': 7.0, 'iw_prob_clip': 0.023988406498670754, 'iw_n_components': 40, 'iw_logistic_c': 0.0018125693818678674, 'iw_pca_fit': 'combined', 'iw_solver': 'lbfgs', 'iw_rho': 0.5}. Best is trial 35 with value: 0.2185976392563048.
2026-06-01 22:26:14 | INFO | Trial 48 | outer=8 | alpha=4.343e+05 n_pcs=4500 (pc_topk) weight={'name': 'pc_logistic', 'floor': 1e-06, 'clip_max': 7.0, 'prob_clip': 0.002700655155897982, 'n_components': 40, 'logistic_c': 0.00018589206948524137, 'pca_fit': 'combined', 'solver': 'lbfgs', 'max_iter': 2000, 'fit_intercept': True, 'standardize_with_source': True, 'rho': 0.5}
[I 2026-06-01 22:26:30,891] Trial 48 finished with value: 0.21178130197271958 and parameters: {'alpha': 434297.609793957, 'n_pcs': 4500, 'iw_method': 'pc_logistic', 'iw_clip_max': 7.0, 'iw_prob_clip': 0.002700655155897982, 'iw_n_components': 40, 'iw_logistic_c': 0.00018589206948524137, 'iw_pca_fit': 'combined', 'iw_solver': 'lbfgs', 'iw_rho': 0.5}. Best is trial 35 with value: 0.2185976392563048.
2026-06-01 22:26:30 | INFO | Trial 49 | outer=8 | alpha=1.719e+04 n_pcs=1500 (pc_topk) weight={'name': 'pc_logistic', 'floor': 1e-06, 'clip_max': 7.0, 'prob_clip': 0.010783355494229839, 'n_components': 40, 'logistic_c': 3.9777758522076586e-05, 'pca_fit': 'combined', 'solver': 'lbfgs', 'max_iter': 2000, 'fit_intercept': True, 'standardize_with_source': True, 'rho': 0.5}
[I 2026-06-01 22:26:39,324] Trial 49 finished with value: 0.18868125928187002 and parameters: {'alpha': 17193.115567670862, 'n_pcs': 1500, 'iw_method': 'pc_logistic', 'iw_clip_max': 7.0, 'iw_prob_clip': 0.010783355494229839, 'iw_n_components': 40, 'iw_logistic_c': 3.9777758522076586e-05, 'iw_pca_fit': 'combined', 'iw_solver': 'lbfgs', 'iw_rho': 0.5}. Best is trial 35 with value: 0.2185976392563048.
2026-06-01 22:26:39 | INFO | Trial 50 | outer=8 | alpha=9.621e+04 n_pcs=5000 (pc_topk) weight={'name': 'pc_logistic', 'floor': 1e-06, 'clip_max': 7.0, 'prob_clip': 0.005783285146011804, 'n_components': 40, 'logistic_c': 1.0385489484486191e-07, 'pca_fit': 'combined', 'solver': 'lbfgs', 'max_iter': 2000, 'fit_intercept': True, 'standardize_with_source': True, 'rho': 0.5}
