[I 2026-06-01 17:46:06,532] Trial 161 finished with value: 0.19981648160224386 and parameters: {'alpha': 89369.6070483935, 'n_pcs': 4500, 'iw_method': 'pc_logistic', 'iw_clip_max': 4.0, 'iw_prob_clip': 0.025743856144983507, 'iw_n_components': 40, 'iw_logistic_c': 1.9236119042820093e-05, 'iw_pca_fit': 'combined', 'iw_solver': 'lbfgs', 'iw_rho': 1.0}. Best is trial 151 with value: 0.20050890929972173.
2026-06-01 17:46:06 | INFO | Trial 162 | outer=4 | alpha=8.744e+04 n_pcs=4500 (pc_topk) weight={'name': 'pc_logistic', 'floor': 1e-06, 'clip_max': 4.0, 'prob_clip': 0.02506458938877271, 'n_components': 40, 'logistic_c': 1.769273074410829e-05, 'pca_fit': 'combined', 'solver': 'lbfgs', 'max_iter': 2000, 'fit_intercept': True, 'standardize_with_source': True, 'rho': 1.0}
[I 2026-06-01 17:46:23,330] Trial 162 finished with value: 0.19989866134158243 and parameters: {'alpha': 87444.78397413687, 'n_pcs': 4500, 'iw_method': 'pc_logistic', 'iw_clip_max': 4.0, 'iw_prob_clip': 0.02506458938877271, 'iw_n_components': 40, 'iw_logistic_c': 1.769273074410829e-05, 'iw_pca_fit': 'combined', 'iw_solver': 'lbfgs', 'iw_rho': 1.0}. Best is trial 151 with value: 0.20050890929972173.
2026-06-01 17:46:23 | INFO | Trial 163 | outer=4 | alpha=8.517e+04 n_pcs=4500 (pc_topk) weight={'name': 'pc_logistic', 'floor': 1e-06, 'clip_max': 4.0, 'prob_clip': 0.028874508184415865, 'n_components': 40, 'logistic_c': 1.6682288728189077e-05, 'pca_fit': 'combined', 'solver': 'lbfgs', 'max_iter': 2000, 'fit_intercept': True, 'standardize_with_source': True, 'rho': 1.0}
[I 2026-06-01 17:46:38,165] Trial 163 finished with value: 0.20050250430332617 and parameters: {'alpha': 85167.76705334397, 'n_pcs': 4500, 'iw_method': 'pc_logistic', 'iw_clip_max': 4.0, 'iw_prob_clip': 0.028874508184415865, 'iw_n_components': 40, 'iw_logistic_c': 1.6682288728189077e-05, 'iw_pca_fit': 'combined', 'iw_solver': 'lbfgs', 'iw_rho': 1.0}. Best is trial 151 with value: 0.20050890929972173.
2026-06-01 17:46:38 | INFO | Trial 164 | outer=4 | alpha=8.820e+04 n_pcs=4500 (pc_topk) weight={'name': 'pc_logistic', 'floor': 1e-06, 'clip_max': 4.0, 'prob_clip': 0.024702012488545325, 'n_components': 40, 'logistic_c': 6.254706519160517e-06, 'pca_fit': 'combined', 'solver': 'lbfgs', 'max_iter': 2000, 'fit_intercept': True, 'standardize_with_source': True, 'rho': 1.0}
[I 2026-06-01 17:47:00,083] Trial 164 finished with value: 0.1969650674465679 and parameters: {'alpha': 88199.77471449757, 'n_pcs': 4500, 'iw_method': 'pc_logistic', 'iw_clip_max': 4.0, 'iw_prob_clip': 0.024702012488545325, 'iw_n_components': 40, 'iw_logistic_c': 6.254706519160517e-06, 'iw_pca_fit': 'combined', 'iw_solver': 'lbfgs', 'iw_rho': 1.0}. Best is trial 151 with value: 0.20050890929972173.
2026-06-01 17:47:00 | INFO | Trial 165 | outer=4 | alpha=6.983e+04 n_pcs=4500 (pc_topk) weight={'name': 'pc_logistic', 'floor': 1e-06, 'clip_max': 4.0, 'prob_clip': 0.029739458471948928, 'n_components': 40, 'logistic_c': 1.4135737234357152e-05, 'pca_fit': 'combined', 'solver': 'lbfgs', 'max_iter': 2000, 'fit_intercept': True, 'standardize_with_source': True, 'rho': 1.0}
[I 2026-06-01 17:47:15,067] Trial 165 finished with value: 0.2000528224316048 and parameters: {'alpha': 69833.75675794456, 'n_pcs': 4500, 'iw_method': 'pc_logistic', 'iw_clip_max': 4.0, 'iw_prob_clip': 0.029739458471948928, 'iw_n_components': 40, 'iw_logistic_c': 1.4135737234357152e-05, 'iw_pca_fit': 'combined', 'iw_solver': 'lbfgs', 'iw_rho': 1.0}. Best is trial 151 with value: 0.20050890929972173.
2026-06-01 17:47:15 | INFO | Trial 166 | outer=4 | alpha=7.808e+04 n_pcs=4500 (pc_topk) weight={'name': 'pc_logistic', 'floor': 1e-06, 'clip_max': 4.0, 'prob_clip': 0.029379389971352806, 'n_components': 40, 'logistic_c': 4.546868831174634e-06, 'pca_fit': 'combined', 'solver': 'lbfgs', 'max_iter': 2000, 'fit_intercept': True, 'standardize_with_source': True, 'rho': 1.0}
[I 2026-06-01 17:47:37,569] Trial 166 finished with value: 0.196327583432017 and parameters: {'alpha': 78079.79637872662, 'n_pcs': 4500, 'iw_method': 'pc_logistic', 'iw_clip_max': 4.0, 'iw_prob_clip': 0.029379389971352806, 'iw_n_components': 40, 'iw_logistic_c': 4.546868831174634e-06, 'iw_pca_fit': 'combined', 'iw_solver': 'lbfgs', 'iw_rho': 1.0}. Best is trial 151 with value: 0.20050890929972173.
2026-06-01 17:47:37 | INFO | Trial 167 | outer=4 | alpha=1.262e+05 n_pcs=4500 (pc_topk) weight={'name': 'pc_logistic', 'floor': 1e-06, 'clip_max': 4.0, 'prob_clip': 0.03510022799309237, 'n_components': 40, 'logistic_c': 1.4477342147125868e-05, 'pca_fit': 'combined', 'solver': 'lbfgs', 'max_iter': 2000, 'fit_intercept': True, 'standardize_with_source': True, 'rho': 1.0}
[I 2026-06-01 17:48:05,983] Trial 167 finished with value: 0.19892376965373537 and parameters: {'alpha': 126222.46769820413, 'n_pcs': 4500, 'iw_method': 'pc_logistic', 'iw_clip_max': 4.0, 'iw_prob_clip': 0.03510022799309237, 'iw_n_components': 40, 'iw_logistic_c': 1.4477342147125868e-05, 'iw_pca_fit': 'combined', 'iw_solver': 'lbfgs', 'iw_rho': 1.0}. Best is trial 151 with value: 0.20050890929972173.
2026-06-01 17:48:06 | INFO | Trial 168 | outer=4 | alpha=7.476e+04 n_pcs=4500 (pc_topk) weight={'name': 'pc_logistic', 'floor': 1e-06, 'clip_max': 4.0, 'prob_clip': 0.030774714158536273, 'n_components': 40, 'logistic_c': 2.6826121537664372e-06, 'pca_fit': 'combined', 'solver': 'lbfgs', 'max_iter': 2000, 'fit_intercept': True, 'standardize_with_source': True, 'rho': 1.0}
[I 2026-06-01 17:48:21,992] Trial 168 finished with value: 0.19559824250399632 and parameters: {'alpha': 74759.68026261395, 'n_pcs': 4500, 'iw_method': 'pc_logistic', 'iw_clip_max': 4.0, 'iw_prob_clip': 0.030774714158536273, 'iw_n_components': 40, 'iw_logistic_c': 2.6826121537664372e-06, 'iw_pca_fit': 'combined', 'iw_solver': 'lbfgs', 'iw_rho': 1.0}. Best is trial 151 with value: 0.20050890929972173.
2026-06-01 17:48:22 | INFO | Trial 169 | outer=4 | alpha=9.325e+04 n_pcs=5000 (pc_topk) weight={'name': 'pc_logistic', 'floor': 1e-06, 'clip_max': 4.0, 'prob_clip': 0.025325474241648264, 'n_components': 40, 'logistic_c': 9.800811131600617e-06, 'pca_fit': 'combined', 'solver': 'lbfgs', 'max_iter': 2000, 'fit_intercept': True, 'standardize_with_source': True, 'rho': 1.0}
[I 2026-06-01 17:48:47,585] Trial 169 finished with value: 0.1973004603978355 and parameters: {'alpha': 93247.03813522337, 'n_pcs': 5000, 'iw_method': 'pc_logistic', 'iw_clip_max': 4.0, 'iw_prob_clip': 0.025325474241648264, 'iw_n_components': 40, 'iw_logistic_c': 9.800811131600617e-06, 'iw_pca_fit': 'combined', 'iw_solver': 'lbfgs', 'iw_rho': 1.0}. Best is trial 151 with value: 0.20050890929972173.
2026-06-01 17:48:47 | INFO | Trial 170 | outer=4 | alpha=1.136e+05 n_pcs=4500 (pc_topk) weight={'name': 'pc_logistic', 'floor': 1e-06, 'clip_max': 7.0, 'prob_clip': 0.000559231339197286, 'n_components': 40, 'logistic_c': 1.496973826326408e-05, 'pca_fit': 'combined', 'solver': 'lbfgs', 'max_iter': 2000, 'fit_intercept': True, 'standardize_with_source': True, 'rho': 1.0}
[I 2026-06-01 17:49:03,187] Trial 170 finished with value: 0.19593477804738307 and parameters: {'alpha': 113633.10692938461, 'n_pcs': 4500, 'iw_method': 'pc_logistic', 'iw_clip_max': 7.0, 'iw_prob_clip': 0.000559231339197286, 'iw_n_components': 40, 'iw_logistic_c': 1.496973826326408e-05, 'iw_pca_fit': 'combined', 'iw_solver': 'lbfgs', 'iw_rho': 1.0}. Best is trial 151 with value: 0.20050890929972173.
2026-06-01 17:49:03 | INFO | Trial 171 | outer=4 | alpha=6.609e+04 n_pcs=4500 (pc_topk) weight={'name': 'pc_logistic', 'floor': 1e-06, 'clip_max': 4.0, 'prob_clip': 0.001326698903597244, 'n_components': 40, 'logistic_c': 2.410738586754628e-05, 'pca_fit': 'combined', 'solver': 'lbfgs', 'max_iter': 2000, 'fit_intercept': True, 'standardize_with_source': True, 'rho': 1.0}
[I 2026-06-01 17:49:18,271] Trial 171 finished with value: 0.19591924051797954 and parameters: {'alpha': 66088.83238394956, 'n_pcs': 4500, 'iw_method': 'pc_logistic', 'iw_clip_max': 4.0, 'iw_prob_clip': 0.001326698903597244, 'iw_n_components': 40, 'iw_logistic_c': 2.410738586754628e-05, 'iw_pca_fit': 'combined', 'iw_solver': 'lbfgs', 'iw_rho': 1.0}. Best is trial 151 with value: 0.20050890929972173.
2026-06-01 17:49:18 | INFO | Trial 172 | outer=4 | alpha=9.121e+04 n_pcs=2500 (pc_topk) weight={'name': 'pc_logistic', 'floor': 1e-06, 'clip_max': 4.0, 'prob_clip': 0.02402770876055284, 'n_components': 40, 'logistic_c': 7.5216197063069065e-06, 'pca_fit': 'combined', 'solver': 'lbfgs', 'max_iter': 2000, 'fit_intercept': True, 'standardize_with_source': True, 'rho': 1.0}
[I 2026-06-01 17:49:30,146] Trial 172 finished with value: 0.19821941825271833 and parameters: {'alpha': 91209.92537858087, 'n_pcs': 2500, 'iw_method': 'pc_logistic', 'iw_clip_max': 4.0, 'iw_prob_clip': 0.02402770876055284, 'iw_n_components': 40, 'iw_logistic_c': 7.5216197063069065e-06, 'iw_pca_fit': 'combined', 'iw_solver': 'lbfgs', 'iw_rho': 1.0}. Best is trial 151 with value: 0.20050890929972173.
2026-06-01 17:49:30 | INFO | Trial 173 | outer=4 | alpha=7.454e+04 n_pcs=4500 (pc_topk) weight={'name': 'pc_logistic', 'floor': 1e-06, 'clip_max': 4.0, 'prob_clip': 0.028421991966032685, 'n_components': 40, 'logistic_c': 1.9329615776364985e-05, 'pca_fit': 'combined', 'solver': 'lbfgs', 'max_iter': 2000, 'fit_intercept': True, 'standardize_with_source': True, 'rho': 1.0}
[I 2026-06-01 17:49:45,708] Trial 173 finished with value: 0.20026094741349057 and parameters: {'alpha': 74541.10593321537, 'n_pcs': 4500, 'iw_method': 'pc_logistic', 'iw_clip_max': 4.0, 'iw_prob_clip': 0.028421991966032685, 'iw_n_components': 40, 'iw_logistic_c': 1.9329615776364985e-05, 'iw_pca_fit': 'combined', 'iw_solver': 'lbfgs', 'iw_rho': 1.0}. Best is trial 151 with value: 0.20050890929972173.
2026-06-01 17:49:45 | INFO | Trial 174 | outer=4 | alpha=7.882e+04 n_pcs=4500 (pc_topk) weight={'name': 'pc_logistic', 'floor': 1e-06, 'clip_max': 4.0, 'prob_clip': 0.02865057168014198, 'n_components': 40, 'logistic_c': 1.2022496957880986e-05, 'pca_fit': 'combined', 'solver': 'lbfgs', 'max_iter': 2000, 'fit_intercept': True, 'standardize_with_source': True, 'rho': 1.0}
[I 2026-06-01 17:50:00,873] Trial 174 finished with value: 0.19965003498502468 and parameters: {'alpha': 78816.01273592911, 'n_pcs': 4500, 'iw_method': 'pc_logistic', 'iw_clip_max': 4.0, 'iw_prob_clip': 0.02865057168014198, 'iw_n_components': 40, 'iw_logistic_c': 1.2022496957880986e-05, 'iw_pca_fit': 'combined', 'iw_solver': 'lbfgs', 'iw_rho': 1.0}. Best is trial 151 with value: 0.20050890929972173.
2026-06-01 17:50:00 | INFO | Trial 175 | outer=4 | alpha=1.212e+05 n_pcs=4500 (pc_topk) weight={'name': 'pc_logistic', 'floor': 1e-06, 'clip_max': 4.0, 'prob_clip': 0.028559794576033182, 'n_components': 40, 'logistic_c': 1.0066148394837393e-05, 'pca_fit': 'combined', 'solver': 'lbfgs', 'max_iter': 2000, 'fit_intercept': True, 'standardize_with_source': True, 'rho': 1.0}
[I 2026-06-01 17:50:16,649] Trial 175 finished with value: 0.19797211242678686 and parameters: {'alpha': 121165.52206610536, 'n_pcs': 4500, 'iw_method': 'pc_logistic', 'iw_clip_max': 4.0, 'iw_prob_clip': 0.028559794576033182, 'iw_n_components': 40, 'iw_logistic_c': 1.0066148394837393e-05, 'iw_pca_fit': 'combined', 'iw_solver': 'lbfgs', 'iw_rho': 1.0}. Best is trial 151 with value: 0.20050890929972173.
2026-06-01 17:50:16 | INFO | Trial 176 | outer=4 | alpha=8.745e+04 n_pcs=4500 (pc_topk) weight={'name': 'pc_logistic', 'floor': 1e-06, 'clip_max': 4.0, 'prob_clip': 0.032445904421526034, 'n_components': 40, 'logistic_c': 1.2439341419015534e-05, 'pca_fit': 'combined', 'solver': 'lbfgs', 'max_iter': 2000, 'fit_intercept': True, 'standardize_with_source': True, 'rho': 1.0}
[I 2026-06-01 17:50:32,113] Trial 176 finished with value: 0.19966170372811215 and parameters: {'alpha': 87446.62873539841, 'n_pcs': 4500, 'iw_method': 'pc_logistic', 'iw_clip_max': 4.0, 'iw_prob_clip': 0.032445904421526034, 'iw_n_components': 40, 'iw_logistic_c': 1.2439341419015534e-05, 'iw_pca_fit': 'combined', 'iw_solver': 'lbfgs', 'iw_rho': 1.0}. Best is trial 151 with value: 0.20050890929972173.
2026-06-01 17:50:32 | INFO | Trial 177 | outer=4 | alpha=8.430e+04 n_pcs=4000 (pc_topk) weight={'name': 'pc_logistic', 'floor': 1e-06, 'clip_max': 4.0, 'prob_clip': 0.03309308107370735, 'n_components': 40, 'logistic_c': 1.2593609244604598e-05, 'pca_fit': 'combined', 'solver': 'lbfgs', 'max_iter': 2000, 'fit_intercept': True, 'standardize_with_source': True, 'rho': 1.0}
[I 2026-06-01 17:50:45,691] Trial 177 finished with value: 0.19860780586166626 and parameters: {'alpha': 84298.94938298721, 'n_pcs': 4000, 'iw_method': 'pc_logistic', 'iw_clip_max': 4.0, 'iw_prob_clip': 0.03309308107370735, 'iw_n_components': 40, 'iw_logistic_c': 1.2593609244604598e-05, 'iw_pca_fit': 'combined', 'iw_solver': 'lbfgs', 'iw_rho': 1.0}. Best is trial 151 with value: 0.20050890929972173.
2026-06-01 17:50:45 | INFO | Trial 178 | outer=4 | alpha=5.129e+04 n_pcs=4500 (pc_topk) weight={'name': 'pc_logistic', 'floor': 1e-06, 'clip_max': 4.0, 'prob_clip': 0.04045608060879943, 'n_components': 40, 'logistic_c': 6.352771183029312e-06, 'pca_fit': 'combined', 'solver': 'lbfgs', 'max_iter': 2000, 'fit_intercept': True, 'standardize_with_source': True, 'rho': 1.0}
[I 2026-06-01 17:51:01,471] Trial 178 finished with value: 0.1970179195972856 and parameters: {'alpha': 51286.2338848891, 'n_pcs': 4500, 'iw_method': 'pc_logistic', 'iw_clip_max': 4.0, 'iw_prob_clip': 0.04045608060879943, 'iw_n_components': 40, 'iw_logistic_c': 6.352771183029312e-06, 'iw_pca_fit': 'combined', 'iw_solver': 'lbfgs', 'iw_rho': 1.0}. Best is trial 151 with value: 0.20050890929972173.
2026-06-01 17:51:01 | INFO | Trial 179 | outer=4 | alpha=1.006e+05 n_pcs=4500 (pc_topk) weight={'name': 'pc_logistic', 'floor': 1e-06, 'clip_max': 4.0, 'prob_clip': 0.031258258348776484, 'n_components': 40, 'logistic_c': 4.3544903531960835e-06, 'pca_fit': 'combined', 'solver': 'lbfgs', 'max_iter': 2000, 'fit_intercept': True, 'standardize_with_source': True, 'rho': 1.0}
[I 2026-06-01 17:51:16,929] Trial 179 finished with value: 0.19489489228634096 and parameters: {'alpha': 100648.86541824501, 'n_pcs': 4500, 'iw_method': 'pc_logistic', 'iw_clip_max': 4.0, 'iw_prob_clip': 0.031258258348776484, 'iw_n_components': 40, 'iw_logistic_c': 4.3544903531960835e-06, 'iw_pca_fit': 'combined', 'iw_solver': 'lbfgs', 'iw_rho': 1.0}. Best is trial 151 with value: 0.20050890929972173.
2026-06-01 17:51:16 | INFO | Trial 180 | outer=4 | alpha=8.448e+04 n_pcs=4500 (pc_topk) weight={'name': 'pc_logistic', 'floor': 1e-06, 'clip_max': 1.5, 'prob_clip': 0.027496448616699597, 'n_components': 40, 'logistic_c': 2.6695349792455974e-05, 'pca_fit': 'combined', 'solver': 'lbfgs', 'max_iter': 2000, 'fit_intercept': True, 'standardize_with_source': True, 'rho': 1.0}
[I 2026-06-01 17:51:32,763] Trial 180 finished with value: 0.19709501578667496 and parameters: {'alpha': 84481.55862606262, 'n_pcs': 4500, 'iw_method': 'pc_logistic', 'iw_clip_max': 1.5, 'iw_prob_clip': 0.027496448616699597, 'iw_n_components': 40, 'iw_logistic_c': 2.6695349792455974e-05, 'iw_pca_fit': 'combined', 'iw_solver': 'lbfgs', 'iw_rho': 1.0}. Best is trial 151 with value: 0.20050890929972173.
2026-06-01 17:51:32 | INFO | Trial 181 | outer=4 | alpha=1.100e+03 n_pcs=4500 (pc_topk) weight={'name': 'pc_logistic', 'floor': 1e-06, 'clip_max': 4.0, 'prob_clip': 0.0262369823957237, 'n_components': 40, 'logistic_c': 1.568532722781876e-05, 'pca_fit': 'combined', 'solver': 'lbfgs', 'max_iter': 2000, 'fit_intercept': True, 'standardize_with_source': True, 'rho': 1.0}
[I 2026-06-01 17:51:47,714] Trial 181 finished with value: 0.11180908954944908 and parameters: {'alpha': 1099.5453604361526, 'n_pcs': 4500, 'iw_method': 'pc_logistic', 'iw_clip_max': 4.0, 'iw_prob_clip': 0.0262369823957237, 'iw_n_components': 40, 'iw_logistic_c': 1.568532722781876e-05, 'iw_pca_fit': 'combined', 'iw_solver': 'lbfgs', 'iw_rho': 1.0}. Best is trial 151 with value: 0.20050890929972173.
2026-06-01 17:51:47 | INFO | Trial 182 | outer=4 | alpha=1.373e+05 n_pcs=4500 (pc_topk) weight={'name': 'pc_logistic', 'floor': 1e-06, 'clip_max': 4.0, 'prob_clip': 0.03010868302868346, 'n_components': 40, 'logistic_c': 2.00392029404493e-05, 'pca_fit': 'combined', 'solver': 'lbfgs', 'max_iter': 2000, 'fit_intercept': True, 'standardize_with_source': True, 'rho': 1.0}
[I 2026-06-01 17:52:02,869] Trial 182 finished with value: 0.19988165355871484 and parameters: {'alpha': 137317.73959218184, 'n_pcs': 4500, 'iw_method': 'pc_logistic', 'iw_clip_max': 4.0, 'iw_prob_clip': 0.03010868302868346, 'iw_n_components': 40, 'iw_logistic_c': 2.00392029404493e-05, 'iw_pca_fit': 'combined', 'iw_solver': 'lbfgs', 'iw_rho': 1.0}. Best is trial 151 with value: 0.20050890929972173.
2026-06-01 17:52:02 | INFO | Trial 183 | outer=4 | alpha=7.154e+04 n_pcs=4500 (pc_topk) weight={'name': 'pc_logistic', 'floor': 1e-06, 'clip_max': 4.0, 'prob_clip': 0.03631324945644325, 'n_components': 40, 'logistic_c': 3.215546570859933e-05, 'pca_fit': 'combined', 'solver': 'lbfgs', 'max_iter': 2000, 'fit_intercept': True, 'standardize_with_source': True, 'rho': 1.0}
[I 2026-06-01 17:52:19,288] Trial 183 finished with value: 0.19991449536036038 and parameters: {'alpha': 71543.53704673202, 'n_pcs': 4500, 'iw_method': 'pc_logistic', 'iw_clip_max': 4.0, 'iw_prob_clip': 0.03631324945644325, 'iw_n_components': 40, 'iw_logistic_c': 3.215546570859933e-05, 'iw_pca_fit': 'combined', 'iw_solver': 'lbfgs', 'iw_rho': 1.0}. Best is trial 151 with value: 0.20050890929972173.
2026-06-01 17:52:19 | INFO | Trial 184 | outer=4 | alpha=5.982e+04 n_pcs=4500 (pc_topk) weight={'name': 'pc_logistic', 'floor': 1e-06, 'clip_max': 4.0, 'prob_clip': 0.03611576179217092, 'n_components': 40, 'logistic_c': 3.318148109183356e-05, 'pca_fit': 'combined', 'solver': 'lbfgs', 'max_iter': 2000, 'fit_intercept': True, 'standardize_with_source': True, 'rho': 1.0}
[I 2026-06-01 17:52:34,388] Trial 184 finished with value: 0.1995209921933781 and parameters: {'alpha': 59818.649071604195, 'n_pcs': 4500, 'iw_method': 'pc_logistic', 'iw_clip_max': 4.0, 'iw_prob_clip': 0.03611576179217092, 'iw_n_components': 40, 'iw_logistic_c': 3.318148109183356e-05, 'iw_pca_fit': 'combined', 'iw_solver': 'lbfgs', 'iw_rho': 1.0}. Best is trial 151 with value: 0.20050890929972173.
2026-06-01 17:52:34 | INFO | Trial 185 | outer=4 | alpha=7.257e+04 n_pcs=4500 (pc_topk) weight={'name': 'pc_logistic', 'floor': 1e-06, 'clip_max': 4.0, 'prob_clip': 0.04543979263026094, 'n_components': 40, 'logistic_c': 1.0021944808595646e-05, 'pca_fit': 'combined', 'solver': 'lbfgs', 'max_iter': 2000, 'fit_intercept': True, 'standardize_with_source': True, 'rho': 1.0}
[I 2026-06-01 17:52:50,651] Trial 185 finished with value: 0.19778604971471894 and parameters: {'alpha': 72567.28219628758, 'n_pcs': 4500, 'iw_method': 'pc_logistic', 'iw_clip_max': 4.0, 'iw_prob_clip': 0.04543979263026094, 'iw_n_components': 40, 'iw_logistic_c': 1.0021944808595646e-05, 'iw_pca_fit': 'combined', 'iw_solver': 'lbfgs', 'iw_rho': 1.0}. Best is trial 151 with value: 0.20050890929972173.
2026-06-01 17:52:50 | INFO | Trial 186 | outer=4 | alpha=9.708e+04 n_pcs=4500 (pc_topk) weight={'name': 'pc_logistic', 'floor': 1e-06, 'clip_max': 4.0, 'prob_clip': 0.03131773795767423, 'n_components': 40, 'logistic_c': 2.4319934737745413e-05, 'pca_fit': 'combined', 'solver': 'lbfgs', 'max_iter': 2000, 'fit_intercept': True, 'standardize_with_source': True, 'rho': 1.0}
[I 2026-06-01 17:53:05,464] Trial 186 finished with value: 0.20018430694910058 and parameters: {'alpha': 97084.83498495235, 'n_pcs': 4500, 'iw_method': 'pc_logistic', 'iw_clip_max': 4.0, 'iw_prob_clip': 0.03131773795767423, 'iw_n_components': 40, 'iw_logistic_c': 2.4319934737745413e-05, 'iw_pca_fit': 'combined', 'iw_solver': 'lbfgs', 'iw_rho': 1.0}. Best is trial 151 with value: 0.20050890929972173.
2026-06-01 17:53:05 | INFO | Trial 187 | outer=4 | alpha=1.006e+05 n_pcs=5000 (pc_topk) weight={'name': 'pc_logistic', 'floor': 1e-06, 'clip_max': 4.0, 'prob_clip': 0.03276447736717173, 'n_components': 20, 'logistic_c': 2.3518834354840972e-05, 'pca_fit': 'combined', 'solver': 'lbfgs', 'max_iter': 2000, 'fit_intercept': True, 'standardize_with_source': True, 'rho': 1.0}
[I 2026-06-01 17:53:22,002] Trial 187 finished with value: 0.199765163879027 and parameters: {'alpha': 100613.95602523685, 'n_pcs': 5000, 'iw_method': 'pc_logistic', 'iw_clip_max': 4.0, 'iw_prob_clip': 0.03276447736717173, 'iw_n_components': 20, 'iw_logistic_c': 2.3518834354840972e-05, 'iw_pca_fit': 'combined', 'iw_solver': 'lbfgs', 'iw_rho': 1.0}. Best is trial 151 with value: 0.20050890929972173.
2026-06-01 17:53:22 | INFO | Trial 188 | outer=4 | alpha=1.037e+05 n_pcs=5000 (pc_topk) weight={'name': 'uniform'}
[I 2026-06-01 17:53:33,251] Trial 188 finished with value: 0.1873841111183583 and parameters: {'alpha': 103672.09774886355, 'n_pcs': 5000, 'iw_method': 'uniform'}. Best is trial 151 with value: 0.20050890929972173.
2026-06-01 17:53:33 | INFO | Trial 189 | outer=4 | alpha=5.069e+04 n_pcs=5000 (pc_topk) weight={'name': 'pc_logistic', 'floor': 1e-06, 'clip_max': 4.0, 'prob_clip': 0.03610752377141781, 'n_components': 20, 'logistic_c': 3.036203880262438e-05, 'pca_fit': 'combined', 'solver': 'lbfgs', 'max_iter': 2000, 'fit_intercept': True, 'standardize_with_source': True, 'rho': 1.0}
