[I 2026-06-01 13:42:07,406] Trial 146 finished with value: 0.25185485210820485 and parameters: {'alpha': 44130.88214944185, 'n_pcs': 4500, 'iw_method': 'pc_logistic', 'iw_clip_max': 4.0, 'iw_prob_clip': 0.0037837439540102744, 'iw_n_components': 100, 'iw_logistic_c': 0.00044138977807534464, 'iw_pca_fit': 'combined', 'iw_solver': 'lbfgs', 'iw_rho': 0.85}. Best is trial 81 with value: 0.25357534381681857.
2026-06-01 13:42:07 | INFO | Trial 147 | outer=1 | alpha=3.294e+04 n_pcs=4500 (pc_topk) weight={'name': 'pc_logistic', 'floor': 1e-06, 'clip_max': 7.0, 'prob_clip': 0.004327360075304995, 'n_components': 100, 'logistic_c': 0.0006986740656388235, 'pca_fit': 'combined', 'solver': 'lbfgs', 'max_iter': 2000, 'fit_intercept': True, 'standardize_with_source': True, 'rho': 0.85}
[I 2026-06-01 13:42:25,964] Trial 147 finished with value: 0.2462789431635679 and parameters: {'alpha': 32942.13789852475, 'n_pcs': 4500, 'iw_method': 'pc_logistic', 'iw_clip_max': 7.0, 'iw_prob_clip': 0.004327360075304995, 'iw_n_components': 100, 'iw_logistic_c': 0.0006986740656388235, 'iw_pca_fit': 'combined', 'iw_solver': 'lbfgs', 'iw_rho': 0.85}. Best is trial 81 with value: 0.25357534381681857.
2026-06-01 13:42:25 | INFO | Trial 148 | outer=1 | alpha=7.762e+04 n_pcs=5000 (pc_topk) weight={'name': 'pc_logistic', 'floor': 1e-06, 'clip_max': 4.0, 'prob_clip': 0.008377605747119573, 'n_components': 100, 'logistic_c': 0.0002442747851021624, 'pca_fit': 'combined', 'solver': 'lbfgs', 'max_iter': 2000, 'fit_intercept': True, 'standardize_with_source': True, 'rho': 0.85}
[I 2026-06-01 13:42:46,190] Trial 148 finished with value: 0.2544308223289634 and parameters: {'alpha': 77615.76629777472, 'n_pcs': 5000, 'iw_method': 'pc_logistic', 'iw_clip_max': 4.0, 'iw_prob_clip': 0.008377605747119573, 'iw_n_components': 100, 'iw_logistic_c': 0.0002442747851021624, 'iw_pca_fit': 'combined', 'iw_solver': 'lbfgs', 'iw_rho': 0.85}. Best is trial 148 with value: 0.2544308223289634.
2026-06-01 13:42:46 | INFO | Trial 149 | outer=1 | alpha=7.602e+04 n_pcs=5000 (pc_topk) weight={'name': 'pc_logistic', 'floor': 1e-06, 'clip_max': 4.0, 'prob_clip': 0.006770133391999558, 'n_components': 100, 'logistic_c': 0.00022541370812404683, 'pca_fit': 'combined', 'solver': 'lbfgs', 'max_iter': 2000, 'fit_intercept': True, 'standardize_with_source': True, 'rho': 0.85}
[I 2026-06-01 13:43:05,992] Trial 149 finished with value: 0.2543102295304932 and parameters: {'alpha': 76022.2913485917, 'n_pcs': 5000, 'iw_method': 'pc_logistic', 'iw_clip_max': 4.0, 'iw_prob_clip': 0.006770133391999558, 'iw_n_components': 100, 'iw_logistic_c': 0.00022541370812404683, 'iw_pca_fit': 'combined', 'iw_solver': 'lbfgs', 'iw_rho': 0.85}. Best is trial 148 with value: 0.2544308223289634.
2026-06-01 13:43:06 | INFO | Trial 150 | outer=1 | alpha=7.934e+04 n_pcs=5000 (pc_topk) weight={'name': 'pc_logistic', 'floor': 1e-06, 'clip_max': 4.0, 'prob_clip': 0.008927526183452793, 'n_components': 100, 'logistic_c': 0.0002539355479110731, 'pca_fit': 'combined', 'solver': 'lbfgs', 'max_iter': 2000, 'fit_intercept': True, 'standardize_with_source': True, 'rho': 0.85}
[I 2026-06-01 13:43:27,070] Trial 150 finished with value: 0.2544651994179651 and parameters: {'alpha': 79337.06082375743, 'n_pcs': 5000, 'iw_method': 'pc_logistic', 'iw_clip_max': 4.0, 'iw_prob_clip': 0.008927526183452793, 'iw_n_components': 100, 'iw_logistic_c': 0.0002539355479110731, 'iw_pca_fit': 'combined', 'iw_solver': 'lbfgs', 'iw_rho': 0.85}. Best is trial 150 with value: 0.2544651994179651.
2026-06-01 13:43:27 | INFO | Trial 151 | outer=1 | alpha=7.900e+04 n_pcs=5000 (pc_topk) weight={'name': 'pc_logistic', 'floor': 1e-06, 'clip_max': 4.0, 'prob_clip': 0.008859711268859862, 'n_components': 100, 'logistic_c': 0.0001985351973228233, 'pca_fit': 'combined', 'solver': 'lbfgs', 'max_iter': 2000, 'fit_intercept': True, 'standardize_with_source': True, 'rho': 0.85}
[I 2026-06-01 13:43:46,299] Trial 151 finished with value: 0.25462305631367477 and parameters: {'alpha': 78998.40351076215, 'n_pcs': 5000, 'iw_method': 'pc_logistic', 'iw_clip_max': 4.0, 'iw_prob_clip': 0.008859711268859862, 'iw_n_components': 100, 'iw_logistic_c': 0.0001985351973228233, 'iw_pca_fit': 'combined', 'iw_solver': 'lbfgs', 'iw_rho': 0.85}. Best is trial 151 with value: 0.25462305631367477.
2026-06-01 13:43:46 | INFO | Trial 152 | outer=1 | alpha=7.550e+04 n_pcs=5000 (pc_topk) weight={'name': 'pc_logistic', 'floor': 1e-06, 'clip_max': 4.0, 'prob_clip': 0.00906043608690939, 'n_components': 100, 'logistic_c': 0.00018517183149478034, 'pca_fit': 'combined', 'solver': 'lbfgs', 'max_iter': 2000, 'fit_intercept': True, 'standardize_with_source': True, 'rho': 0.85}
[I 2026-06-01 13:44:05,510] Trial 152 finished with value: 0.25467847213996836 and parameters: {'alpha': 75496.65813081225, 'n_pcs': 5000, 'iw_method': 'pc_logistic', 'iw_clip_max': 4.0, 'iw_prob_clip': 0.00906043608690939, 'iw_n_components': 100, 'iw_logistic_c': 0.00018517183149478034, 'iw_pca_fit': 'combined', 'iw_solver': 'lbfgs', 'iw_rho': 0.85}. Best is trial 152 with value: 0.25467847213996836.
2026-06-01 13:44:05 | INFO | Trial 153 | outer=1 | alpha=7.785e+04 n_pcs=5000 (pc_topk) weight={'name': 'pc_logistic', 'floor': 1e-06, 'clip_max': 4.0, 'prob_clip': 0.00875296813226802, 'n_components': 100, 'logistic_c': 0.00016863191770855534, 'pca_fit': 'combined', 'solver': 'lbfgs', 'max_iter': 2000, 'fit_intercept': True, 'standardize_with_source': True, 'rho': 0.85}
[I 2026-06-01 13:44:24,545] Trial 153 finished with value: 0.2546938376856621 and parameters: {'alpha': 77852.93171218704, 'n_pcs': 5000, 'iw_method': 'pc_logistic', 'iw_clip_max': 4.0, 'iw_prob_clip': 0.00875296813226802, 'iw_n_components': 100, 'iw_logistic_c': 0.00016863191770855534, 'iw_pca_fit': 'combined', 'iw_solver': 'lbfgs', 'iw_rho': 0.85}. Best is trial 153 with value: 0.2546938376856621.
2026-06-01 13:44:24 | INFO | Trial 154 | outer=1 | alpha=7.606e+04 n_pcs=5000 (pc_topk) weight={'name': 'pc_logistic', 'floor': 1e-06, 'clip_max': 4.0, 'prob_clip': 0.008553663261563057, 'n_components': 100, 'logistic_c': 0.00016905638228605795, 'pca_fit': 'combined', 'solver': 'lbfgs', 'max_iter': 2000, 'fit_intercept': True, 'standardize_with_source': True, 'rho': 0.85}
[I 2026-06-01 13:44:42,968] Trial 154 finished with value: 0.25466696812895306 and parameters: {'alpha': 76062.86455971138, 'n_pcs': 5000, 'iw_method': 'pc_logistic', 'iw_clip_max': 4.0, 'iw_prob_clip': 0.008553663261563057, 'iw_n_components': 100, 'iw_logistic_c': 0.00016905638228605795, 'iw_pca_fit': 'combined', 'iw_solver': 'lbfgs', 'iw_rho': 0.85}. Best is trial 153 with value: 0.2546938376856621.
2026-06-01 13:44:42 | INFO | Trial 155 | outer=1 | alpha=7.887e+04 n_pcs=5000 (pc_topk) weight={'name': 'pc_logistic', 'floor': 1e-06, 'clip_max': 1.5, 'prob_clip': 0.009400650384479545, 'n_components': 100, 'logistic_c': 8.998366965823744e-05, 'pca_fit': 'combined', 'solver': 'lbfgs', 'max_iter': 2000, 'fit_intercept': True, 'standardize_with_source': True, 'rho': 0.85}
[I 2026-06-01 13:45:01,653] Trial 155 finished with value: 0.2487461830535652 and parameters: {'alpha': 78874.67513742065, 'n_pcs': 5000, 'iw_method': 'pc_logistic', 'iw_clip_max': 1.5, 'iw_prob_clip': 0.009400650384479545, 'iw_n_components': 100, 'iw_logistic_c': 8.998366965823744e-05, 'iw_pca_fit': 'combined', 'iw_solver': 'lbfgs', 'iw_rho': 0.85}. Best is trial 153 with value: 0.2546938376856621.
2026-06-01 13:45:01 | INFO | Trial 156 | outer=1 | alpha=8.400e+04 n_pcs=5000 (pc_topk) weight={'name': 'pc_logistic', 'floor': 1e-06, 'clip_max': 4.0, 'prob_clip': 0.008568583083229754, 'n_components': 100, 'logistic_c': 0.00017216290620269964, 'pca_fit': 'combined', 'solver': 'lbfgs', 'max_iter': 2000, 'fit_intercept': True, 'standardize_with_source': True, 'rho': 0.85}
[I 2026-06-01 13:45:20,859] Trial 156 finished with value: 0.2546665351707723 and parameters: {'alpha': 84004.72237832731, 'n_pcs': 5000, 'iw_method': 'pc_logistic', 'iw_clip_max': 4.0, 'iw_prob_clip': 0.008568583083229754, 'iw_n_components': 100, 'iw_logistic_c': 0.00017216290620269964, 'iw_pca_fit': 'combined', 'iw_solver': 'lbfgs', 'iw_rho': 0.85}. Best is trial 153 with value: 0.2546938376856621.
2026-06-01 13:45:20 | INFO | Trial 157 | outer=1 | alpha=7.826e+04 n_pcs=5000 (pc_topk) weight={'name': 'pc_logistic', 'floor': 1e-06, 'clip_max': 4.0, 'prob_clip': 0.008694205289808878, 'n_components': 20, 'logistic_c': 0.0001901763480366946, 'pca_fit': 'combined', 'solver': 'lbfgs', 'max_iter': 2000, 'fit_intercept': True, 'standardize_with_source': True, 'rho': 0.85}
[I 2026-06-01 13:45:39,670] Trial 157 finished with value: 0.25242826352658454 and parameters: {'alpha': 78261.99417400632, 'n_pcs': 5000, 'iw_method': 'pc_logistic', 'iw_clip_max': 4.0, 'iw_prob_clip': 0.008694205289808878, 'iw_n_components': 20, 'iw_logistic_c': 0.0001901763480366946, 'iw_pca_fit': 'combined', 'iw_solver': 'lbfgs', 'iw_rho': 0.85}. Best is trial 153 with value: 0.2546938376856621.
2026-06-01 13:45:39 | INFO | Trial 158 | outer=1 | alpha=7.648e+04 n_pcs=5000 (pc_topk) weight={'name': 'uniform'}
[I 2026-06-01 13:45:49,768] Trial 158 finished with value: 0.2407658914903183 and parameters: {'alpha': 76479.17011036894, 'n_pcs': 5000, 'iw_method': 'uniform'}. Best is trial 153 with value: 0.2546938376856621.
2026-06-01 13:45:49 | INFO | Trial 159 | outer=1 | alpha=3.994e+04 n_pcs=5000 (pc_topk) weight={'name': 'pc_logistic', 'floor': 1e-06, 'clip_max': 4.0, 'prob_clip': 0.01053738131568645, 'n_components': 100, 'logistic_c': 0.0001367402603610818, 'pca_fit': 'combined', 'solver': 'lbfgs', 'max_iter': 2000, 'fit_intercept': True, 'standardize_with_source': True, 'rho': 0.85}
[I 2026-06-01 13:46:09,398] Trial 159 finished with value: 0.2530090046300722 and parameters: {'alpha': 39943.16676387957, 'n_pcs': 5000, 'iw_method': 'pc_logistic', 'iw_clip_max': 4.0, 'iw_prob_clip': 0.01053738131568645, 'iw_n_components': 100, 'iw_logistic_c': 0.0001367402603610818, 'iw_pca_fit': 'combined', 'iw_solver': 'lbfgs', 'iw_rho': 0.85}. Best is trial 153 with value: 0.2546938376856621.
2026-06-01 13:46:09 | INFO | Trial 160 | outer=1 | alpha=6.880e+04 n_pcs=5000 (pc_topk) weight={'name': 'pc_logistic', 'floor': 1e-06, 'clip_max': 4.0, 'prob_clip': 0.012394312266984602, 'n_components': 100, 'logistic_c': 6.45366669070691e-05, 'pca_fit': 'combined', 'solver': 'lbfgs', 'max_iter': 2000, 'fit_intercept': True, 'standardize_with_source': True, 'rho': 0.85}
[I 2026-06-01 13:46:27,875] Trial 160 finished with value: 0.2552976728977937 and parameters: {'alpha': 68799.34843780396, 'n_pcs': 5000, 'iw_method': 'pc_logistic', 'iw_clip_max': 4.0, 'iw_prob_clip': 0.012394312266984602, 'iw_n_components': 100, 'iw_logistic_c': 6.45366669070691e-05, 'iw_pca_fit': 'combined', 'iw_solver': 'lbfgs', 'iw_rho': 0.85}. Best is trial 160 with value: 0.2552976728977937.
2026-06-01 13:46:27 | INFO | Trial 161 | outer=1 | alpha=6.564e+04 n_pcs=5000 (pc_topk) weight={'name': 'pc_logistic', 'floor': 1e-06, 'clip_max': 4.0, 'prob_clip': 0.010655927824858297, 'n_components': 100, 'logistic_c': 5.776722368518717e-05, 'pca_fit': 'combined', 'solver': 'lbfgs', 'max_iter': 2000, 'fit_intercept': True, 'standardize_with_source': True, 'rho': 0.85}
[I 2026-06-01 13:46:46,972] Trial 161 finished with value: 0.2551139152838673 and parameters: {'alpha': 65635.68216105925, 'n_pcs': 5000, 'iw_method': 'pc_logistic', 'iw_clip_max': 4.0, 'iw_prob_clip': 0.010655927824858297, 'iw_n_components': 100, 'iw_logistic_c': 5.776722368518717e-05, 'iw_pca_fit': 'combined', 'iw_solver': 'lbfgs', 'iw_rho': 0.85}. Best is trial 160 with value: 0.2552976728977937.
2026-06-01 13:46:46 | INFO | Trial 162 | outer=1 | alpha=8.358e+04 n_pcs=5000 (pc_topk) weight={'name': 'pc_logistic', 'floor': 1e-06, 'clip_max': 4.0, 'prob_clip': 0.010524426987745262, 'n_components': 100, 'logistic_c': 6.597574901594229e-05, 'pca_fit': 'combined', 'solver': 'lbfgs', 'max_iter': 2000, 'fit_intercept': True, 'standardize_with_source': True, 'rho': 0.85}
[I 2026-06-01 13:47:05,228] Trial 162 finished with value: 0.25524489159087804 and parameters: {'alpha': 83583.99269016761, 'n_pcs': 5000, 'iw_method': 'pc_logistic', 'iw_clip_max': 4.0, 'iw_prob_clip': 0.010524426987745262, 'iw_n_components': 100, 'iw_logistic_c': 6.597574901594229e-05, 'iw_pca_fit': 'combined', 'iw_solver': 'lbfgs', 'iw_rho': 0.85}. Best is trial 160 with value: 0.2552976728977937.
2026-06-01 13:47:05 | INFO | Trial 163 | outer=1 | alpha=1.326e+05 n_pcs=5000 (pc_topk) weight={'name': 'pc_logistic', 'floor': 1e-06, 'clip_max': 4.0, 'prob_clip': 0.011221061879691881, 'n_components': 100, 'logistic_c': 5.5993298040784886e-05, 'pca_fit': 'combined', 'solver': 'lbfgs', 'max_iter': 2000, 'fit_intercept': True, 'standardize_with_source': True, 'rho': 0.85}
[I 2026-06-01 13:47:22,121] Trial 163 finished with value: 0.25422568875410045 and parameters: {'alpha': 132621.96498784394, 'n_pcs': 5000, 'iw_method': 'pc_logistic', 'iw_clip_max': 4.0, 'iw_prob_clip': 0.011221061879691881, 'iw_n_components': 100, 'iw_logistic_c': 5.5993298040784886e-05, 'iw_pca_fit': 'combined', 'iw_solver': 'lbfgs', 'iw_rho': 0.85}. Best is trial 160 with value: 0.2552976728977937.
2026-06-01 13:47:22 | INFO | Trial 164 | outer=1 | alpha=1.332e+05 n_pcs=5000 (pc_topk) weight={'name': 'pc_logistic', 'floor': 1e-06, 'clip_max': 4.0, 'prob_clip': 0.011298508771532382, 'n_components': 100, 'logistic_c': 6.881680538977806e-05, 'pca_fit': 'combined', 'solver': 'lbfgs', 'max_iter': 2000, 'fit_intercept': True, 'standardize_with_source': True, 'rho': 0.85}
[I 2026-06-01 13:47:40,058] Trial 164 finished with value: 0.254290075286778 and parameters: {'alpha': 133187.80148956281, 'n_pcs': 5000, 'iw_method': 'pc_logistic', 'iw_clip_max': 4.0, 'iw_prob_clip': 0.011298508771532382, 'iw_n_components': 100, 'iw_logistic_c': 6.881680538977806e-05, 'iw_pca_fit': 'combined', 'iw_solver': 'lbfgs', 'iw_rho': 0.85}. Best is trial 160 with value: 0.2552976728977937.
2026-06-01 13:47:40 | INFO | Trial 165 | outer=1 | alpha=1.422e+05 n_pcs=5000 (pc_topk) weight={'name': 'pc_logistic', 'floor': 1e-06, 'clip_max': 4.0, 'prob_clip': 0.013315369418853163, 'n_components': 100, 'logistic_c': 5.121496363519623e-05, 'pca_fit': 'combined', 'solver': 'lbfgs', 'max_iter': 2000, 'fit_intercept': True, 'standardize_with_source': True, 'rho': 0.85}
[I 2026-06-01 13:47:58,796] Trial 165 finished with value: 0.2537172689044522 and parameters: {'alpha': 142225.11183715626, 'n_pcs': 5000, 'iw_method': 'pc_logistic', 'iw_clip_max': 4.0, 'iw_prob_clip': 0.013315369418853163, 'iw_n_components': 100, 'iw_logistic_c': 5.121496363519623e-05, 'iw_pca_fit': 'combined', 'iw_solver': 'lbfgs', 'iw_rho': 0.85}. Best is trial 160 with value: 0.2552976728977937.
2026-06-01 13:47:58 | INFO | Trial 166 | outer=1 | alpha=1.338e+05 n_pcs=5000 (pc_topk) weight={'name': 'pc_logistic', 'floor': 1e-06, 'clip_max': 2.5, 'prob_clip': 0.012473677524523899, 'n_components': 40, 'logistic_c': 7.034242405407552e-05, 'pca_fit': 'combined', 'solver': 'lbfgs', 'max_iter': 2000, 'fit_intercept': True, 'standardize_with_source': True, 'rho': 0.85}
[I 2026-06-01 13:48:16,014] Trial 166 finished with value: 0.25119820954918354 and parameters: {'alpha': 133800.0546737722, 'n_pcs': 5000, 'iw_method': 'pc_logistic', 'iw_clip_max': 2.5, 'iw_prob_clip': 0.012473677524523899, 'iw_n_components': 40, 'iw_logistic_c': 7.034242405407552e-05, 'iw_pca_fit': 'combined', 'iw_solver': 'lbfgs', 'iw_rho': 0.85}. Best is trial 160 with value: 0.2552976728977937.
2026-06-01 13:48:16 | INFO | Trial 167 | outer=1 | alpha=1.269e+05 n_pcs=5000 (pc_topk) weight={'name': 'pc_logistic', 'floor': 1e-06, 'clip_max': 4.0, 'prob_clip': 0.015361400179160956, 'n_components': 100, 'logistic_c': 5.063942615932707e-05, 'pca_fit': 'combined', 'solver': 'lbfgs', 'max_iter': 2000, 'fit_intercept': True, 'standardize_with_source': True, 'rho': 0.3}
[I 2026-06-01 13:48:33,735] Trial 167 finished with value: 0.2484285516925296 and parameters: {'alpha': 126949.8434393179, 'n_pcs': 5000, 'iw_method': 'pc_logistic', 'iw_clip_max': 4.0, 'iw_prob_clip': 0.015361400179160956, 'iw_n_components': 100, 'iw_logistic_c': 5.063942615932707e-05, 'iw_pca_fit': 'combined', 'iw_solver': 'lbfgs', 'iw_rho': 0.3}. Best is trial 160 with value: 0.2552976728977937.
2026-06-01 13:48:33 | INFO | Trial 168 | outer=1 | alpha=1.685e+05 n_pcs=5000 (pc_topk) weight={'name': 'pc_logistic', 'floor': 1e-06, 'clip_max': 4.0, 'prob_clip': 0.011267007705582085, 'n_components': 60, 'logistic_c': 7.650550421527508e-05, 'pca_fit': 'combined', 'solver': 'lbfgs', 'max_iter': 2000, 'fit_intercept': True, 'standardize_with_source': True, 'rho': 0.5}
[I 2026-06-01 13:48:50,766] Trial 168 finished with value: 0.24945276392606391 and parameters: {'alpha': 168454.14708977097, 'n_pcs': 5000, 'iw_method': 'pc_logistic', 'iw_clip_max': 4.0, 'iw_prob_clip': 0.011267007705582085, 'iw_n_components': 60, 'iw_logistic_c': 7.650550421527508e-05, 'iw_pca_fit': 'combined', 'iw_solver': 'lbfgs', 'iw_rho': 0.5}. Best is trial 160 with value: 0.2552976728977937.
2026-06-01 13:48:50 | INFO | Trial 169 | outer=1 | alpha=8.725e+04 n_pcs=5000 (pc_topk) weight={'name': 'pc_logistic', 'floor': 1e-06, 'clip_max': 4.0, 'prob_clip': 0.01372268871593489, 'n_components': 100, 'logistic_c': 4.593381366065331e-05, 'pca_fit': 'combined', 'solver': 'lbfgs', 'max_iter': 2000, 'fit_intercept': True, 'standardize_with_source': True, 'rho': 0.85}
[I 2026-06-01 13:49:08,535] Trial 169 finished with value: 0.2551209139070481 and parameters: {'alpha': 87248.91408830552, 'n_pcs': 5000, 'iw_method': 'pc_logistic', 'iw_clip_max': 4.0, 'iw_prob_clip': 0.01372268871593489, 'iw_n_components': 100, 'iw_logistic_c': 4.593381366065331e-05, 'iw_pca_fit': 'combined', 'iw_solver': 'lbfgs', 'iw_rho': 0.85}. Best is trial 160 with value: 0.2552976728977937.
2026-06-01 13:49:08 | INFO | Trial 170 | outer=1 | alpha=1.231e+05 n_pcs=5000 (pc_topk) weight={'name': 'pc_logistic', 'floor': 1e-06, 'clip_max': 12.0, 'prob_clip': 0.010688805866815912, 'n_components': 100, 'logistic_c': 3.5664277686416155e-05, 'pca_fit': 'combined', 'solver': 'lbfgs', 'max_iter': 2000, 'fit_intercept': True, 'standardize_with_source': True, 'rho': 0.85}
[I 2026-06-01 13:49:25,750] Trial 170 finished with value: 0.24792821009992375 and parameters: {'alpha': 123087.95586834304, 'n_pcs': 5000, 'iw_method': 'pc_logistic', 'iw_clip_max': 12.0, 'iw_prob_clip': 0.010688805866815912, 'iw_n_components': 100, 'iw_logistic_c': 3.5664277686416155e-05, 'iw_pca_fit': 'combined', 'iw_solver': 'lbfgs', 'iw_rho': 0.85}. Best is trial 160 with value: 0.2552976728977937.
2026-06-01 13:49:25 | INFO | Trial 171 | outer=1 | alpha=8.766e+04 n_pcs=5000 (pc_topk) weight={'name': 'pc_logistic', 'floor': 1e-06, 'clip_max': 4.0, 'prob_clip': 0.013614333175431446, 'n_components': 100, 'logistic_c': 2.427588111713577e-05, 'pca_fit': 'combined', 'solver': 'lbfgs', 'max_iter': 2000, 'fit_intercept': True, 'standardize_with_source': True, 'rho': 0.85}
[I 2026-06-01 13:49:43,082] Trial 171 finished with value: 0.2541265882843263 and parameters: {'alpha': 87658.51393904728, 'n_pcs': 5000, 'iw_method': 'pc_logistic', 'iw_clip_max': 4.0, 'iw_prob_clip': 0.013614333175431446, 'iw_n_components': 100, 'iw_logistic_c': 2.427588111713577e-05, 'iw_pca_fit': 'combined', 'iw_solver': 'lbfgs', 'iw_rho': 0.85}. Best is trial 160 with value: 0.2552976728977937.
2026-06-01 13:49:43 | INFO | Trial 172 | outer=1 | alpha=8.737e+04 n_pcs=5000 (pc_topk) weight={'name': 'pc_logistic', 'floor': 1e-06, 'clip_max': 4.0, 'prob_clip': 0.013073272519495475, 'n_components': 100, 'logistic_c': 2.3806638305883107e-05, 'pca_fit': 'combined', 'solver': 'lbfgs', 'max_iter': 2000, 'fit_intercept': True, 'standardize_with_source': True, 'rho': 0.85}
[I 2026-06-01 13:50:00,138] Trial 172 finished with value: 0.2540898764900158 and parameters: {'alpha': 87365.89181899473, 'n_pcs': 5000, 'iw_method': 'pc_logistic', 'iw_clip_max': 4.0, 'iw_prob_clip': 0.013073272519495475, 'iw_n_components': 100, 'iw_logistic_c': 2.3806638305883107e-05, 'iw_pca_fit': 'combined', 'iw_solver': 'lbfgs', 'iw_rho': 0.85}. Best is trial 160 with value: 0.2552976728977937.
2026-06-01 13:50:00 | INFO | Trial 173 | outer=1 | alpha=8.978e+04 n_pcs=5000 (pc_topk) weight={'name': 'pc_logistic', 'floor': 1e-06, 'clip_max': 4.0, 'prob_clip': 0.013658325029507607, 'n_components': 100, 'logistic_c': 4.778357824973384e-05, 'pca_fit': 'combined', 'solver': 'lbfgs', 'max_iter': 2000, 'fit_intercept': True, 'standardize_with_source': True, 'rho': 0.85}
[I 2026-06-01 13:50:17,927] Trial 173 finished with value: 0.2551199387962427 and parameters: {'alpha': 89775.10041480725, 'n_pcs': 5000, 'iw_method': 'pc_logistic', 'iw_clip_max': 4.0, 'iw_prob_clip': 0.013658325029507607, 'iw_n_components': 100, 'iw_logistic_c': 4.778357824973384e-05, 'iw_pca_fit': 'combined', 'iw_solver': 'lbfgs', 'iw_rho': 0.85}. Best is trial 160 with value: 0.2552976728977937.
2026-06-01 13:50:17 | INFO | Trial 174 | outer=1 | alpha=9.508e+04 n_pcs=5000 (pc_topk) weight={'name': 'pc_logistic', 'floor': 1e-06, 'clip_max': 4.0, 'prob_clip': 0.01367725674874494, 'n_components': 100, 'logistic_c': 2.5325451949281008e-05, 'pca_fit': 'combined', 'solver': 'lbfgs', 'max_iter': 2000, 'fit_intercept': True, 'standardize_with_source': True, 'rho': 0.85}
