[I 2026-06-01 03:02:19,689] Trial 173 finished with value: 0.22740099510154893 and parameters: {'alpha': 90317.51233176376, 'n_pcs': 4500, 'weight_scheme': 'linear', 'weight_clip_max': 3.0, 'weight_linear_min_weight': 0.4396040739962076, 'weight_linear_max_weight': 4.910184337416408}. Best is trial 157 with value: 0.2276608592360967.
2026-06-01 03:02:19 | INFO | src.nested_cv_avggrm_weighted_unified | Trial 174 | outer=11 | alpha=7.597e+04 n_pcs=4500 (pc_topk) weight_search=on
2026-06-01 03:02:19 | INFO | src.nested_cv_avggrm_weighted_unified | Trial 174 | outer=11 | weight={'name': 'linear', 'floor': 1e-06, 'clip_max': 3.0, 'min_weight': 0.46436581956023815, 'max_weight': 4.842664360012537}
[I 2026-06-01 03:02:26,701] Trial 174 finished with value: 0.22760490938416816 and parameters: {'alpha': 75972.45968905701, 'n_pcs': 4500, 'weight_scheme': 'linear', 'weight_clip_max': 3.0, 'weight_linear_min_weight': 0.46436581956023815, 'weight_linear_max_weight': 4.842664360012537}. Best is trial 157 with value: 0.2276608592360967.
2026-06-01 03:02:26 | INFO | src.nested_cv_avggrm_weighted_unified | Trial 175 | outer=11 | alpha=4.746e+04 n_pcs=4500 (pc_topk) weight_search=on
2026-06-01 03:02:26 | INFO | src.nested_cv_avggrm_weighted_unified | Trial 175 | outer=11 | weight={'name': 'linear', 'floor': 1e-06, 'clip_max': 3.0, 'min_weight': 0.4016056237030454, 'max_weight': 4.837302003820468}
[I 2026-06-01 03:02:33,731] Trial 175 finished with value: 0.2271131351340995 and parameters: {'alpha': 47460.104815037485, 'n_pcs': 4500, 'weight_scheme': 'linear', 'weight_clip_max': 3.0, 'weight_linear_min_weight': 0.4016056237030454, 'weight_linear_max_weight': 4.837302003820468}. Best is trial 157 with value: 0.2276608592360967.
2026-06-01 03:02:33 | INFO | src.nested_cv_avggrm_weighted_unified | Trial 176 | outer=11 | alpha=7.326e+04 n_pcs=4500 (pc_topk) weight_search=on
2026-06-01 03:02:33 | INFO | src.nested_cv_avggrm_weighted_unified | Trial 176 | outer=11 | weight={'name': 'linear', 'floor': 1e-06, 'clip_max': 20.0, 'min_weight': 0.46028877762822135, 'max_weight': 4.740436220977371}
[I 2026-06-01 03:02:40,778] Trial 176 finished with value: 0.22723470412388874 and parameters: {'alpha': 73263.17730427327, 'n_pcs': 4500, 'weight_scheme': 'linear', 'weight_clip_max': 20.0, 'weight_linear_min_weight': 0.46028877762822135, 'weight_linear_max_weight': 4.740436220977371}. Best is trial 157 with value: 0.2276608592360967.
2026-06-01 03:02:40 | INFO | src.nested_cv_avggrm_weighted_unified | Trial 177 | outer=11 | alpha=1.350e+05 n_pcs=4500 (pc_topk) weight_search=on
2026-06-01 03:02:40 | INFO | src.nested_cv_avggrm_weighted_unified | Trial 177 | outer=11 | weight={'name': 'linear', 'floor': 1e-06, 'clip_max': 3.0, 'min_weight': 0.5232892003249712, 'max_weight': 4.9975039238353975}
[I 2026-06-01 03:02:47,822] Trial 177 finished with value: 0.22580817946951037 and parameters: {'alpha': 134976.7175143588, 'n_pcs': 4500, 'weight_scheme': 'linear', 'weight_clip_max': 3.0, 'weight_linear_min_weight': 0.5232892003249712, 'weight_linear_max_weight': 4.9975039238353975}. Best is trial 157 with value: 0.2276608592360967.
2026-06-01 03:02:47 | INFO | src.nested_cv_avggrm_weighted_unified | Trial 178 | outer=11 | alpha=1.061e+05 n_pcs=4500 (pc_topk) weight_search=on
2026-06-01 03:02:47 | INFO | src.nested_cv_avggrm_weighted_unified | Trial 178 | outer=11 | weight={'name': 'exponential', 'floor': 1e-06, 'clip_max': 10.0, 'beta': 9.81580900481442}
2026-06-01 03:02:52 | INFO | src.nested_cv_avggrm_weighted_unified | Trial 178 | outer=11 | pruned after 7/10 inner folds (mean r=0.2526)
[I 2026-06-01 03:02:52,755] Trial 178 pruned. 
2026-06-01 03:02:52 | INFO | src.nested_cv_avggrm_weighted_unified | Trial 179 | outer=11 | alpha=9.400e+04 n_pcs=5000 (pc_topk) weight_search=on
2026-06-01 03:02:52 | INFO | src.nested_cv_avggrm_weighted_unified | Trial 179 | outer=11 | weight={'name': 'linear', 'floor': 1e-06, 'clip_max': 3.0, 'min_weight': 0.9032670218707702, 'max_weight': 4.845622194073037}
[I 2026-06-01 03:03:01,035] Trial 179 finished with value: 0.22490254109402064 and parameters: {'alpha': 94004.35473589024, 'n_pcs': 5000, 'weight_scheme': 'linear', 'weight_clip_max': 3.0, 'weight_linear_min_weight': 0.9032670218707702, 'weight_linear_max_weight': 4.845622194073037}. Best is trial 157 with value: 0.2276608592360967.
2026-06-01 03:03:01 | INFO | src.nested_cv_avggrm_weighted_unified | Trial 180 | outer=11 | alpha=6.805e+04 n_pcs=4500 (pc_topk) weight_search=on
2026-06-01 03:03:01 | INFO | src.nested_cv_avggrm_weighted_unified | Trial 180 | outer=11 | weight={'name': 'linear', 'floor': 1e-06, 'clip_max': 3.0, 'min_weight': 0.484028809360894, 'max_weight': 4.75276703229412}
[I 2026-06-01 03:03:08,073] Trial 180 finished with value: 0.2275987795448481 and parameters: {'alpha': 68052.81128474785, 'n_pcs': 4500, 'weight_scheme': 'linear', 'weight_clip_max': 3.0, 'weight_linear_min_weight': 0.484028809360894, 'weight_linear_max_weight': 4.75276703229412}. Best is trial 157 with value: 0.2276608592360967.
2026-06-01 03:03:08 | INFO | src.nested_cv_avggrm_weighted_unified | Trial 181 | outer=11 | alpha=6.799e+04 n_pcs=4500 (pc_topk) weight_search=on
2026-06-01 03:03:08 | INFO | src.nested_cv_avggrm_weighted_unified | Trial 181 | outer=11 | weight={'name': 'linear', 'floor': 1e-06, 'clip_max': 3.0, 'min_weight': 0.4941983593227437, 'max_weight': 4.80906583197188}
[I 2026-06-01 03:03:15,110] Trial 181 finished with value: 0.2275889973920402 and parameters: {'alpha': 67990.08947934053, 'n_pcs': 4500, 'weight_scheme': 'linear', 'weight_clip_max': 3.0, 'weight_linear_min_weight': 0.4941983593227437, 'weight_linear_max_weight': 4.80906583197188}. Best is trial 157 with value: 0.2276608592360967.
2026-06-01 03:03:15 | INFO | src.nested_cv_avggrm_weighted_unified | Trial 182 | outer=11 | alpha=8.297e+04 n_pcs=4500 (pc_topk) weight_search=on
2026-06-01 03:03:15 | INFO | src.nested_cv_avggrm_weighted_unified | Trial 182 | outer=11 | weight={'name': 'linear', 'floor': 1e-06, 'clip_max': 3.0, 'min_weight': 0.5035880889487784, 'max_weight': 1.525006479727221}
[I 2026-06-01 03:03:22,168] Trial 182 finished with value: 0.22524088402308612 and parameters: {'alpha': 82966.66130726456, 'n_pcs': 4500, 'weight_scheme': 'linear', 'weight_clip_max': 3.0, 'weight_linear_min_weight': 0.5035880889487784, 'weight_linear_max_weight': 1.525006479727221}. Best is trial 157 with value: 0.2276608592360967.
2026-06-01 03:03:22 | INFO | src.nested_cv_avggrm_weighted_unified | Trial 183 | outer=11 | alpha=6.898e+04 n_pcs=4500 (pc_topk) weight_search=on
2026-06-01 03:03:22 | INFO | src.nested_cv_avggrm_weighted_unified | Trial 183 | outer=11 | weight={'name': 'linear', 'floor': 1e-06, 'clip_max': 3.0, 'min_weight': 0.4374098440731787, 'max_weight': 4.825856229657137}
[I 2026-06-01 03:03:29,216] Trial 183 finished with value: 0.22769203531261625 and parameters: {'alpha': 68982.6762028851, 'n_pcs': 4500, 'weight_scheme': 'linear', 'weight_clip_max': 3.0, 'weight_linear_min_weight': 0.4374098440731787, 'weight_linear_max_weight': 4.825856229657137}. Best is trial 183 with value: 0.22769203531261625.
2026-06-01 03:03:29 | INFO | src.nested_cv_avggrm_weighted_unified | OUTER 11 | new best trial 183 (mean inner r=0.2277) saved to outputs/final_results/e6_pc_ridge_avggrm/thr_wing/e6_pc_ridge_avggrm_thr_wing_best_trials/split_11_best_trial.json
2026-06-01 03:03:29 | INFO | src.nested_cv_avggrm_weighted_unified | Trial 184 | outer=11 | alpha=7.057e+04 n_pcs=4500 (pc_topk) weight_search=on
2026-06-01 03:03:29 | INFO | src.nested_cv_avggrm_weighted_unified | Trial 184 | outer=11 | weight={'name': 'linear', 'floor': 1e-06, 'clip_max': 3.0, 'min_weight': 0.4382944191216967, 'max_weight': 4.833881961630774}
[I 2026-06-01 03:03:36,339] Trial 184 finished with value: 0.22768769655862836 and parameters: {'alpha': 70565.12110930581, 'n_pcs': 4500, 'weight_scheme': 'linear', 'weight_clip_max': 3.0, 'weight_linear_min_weight': 0.4382944191216967, 'weight_linear_max_weight': 4.833881961630774}. Best is trial 183 with value: 0.22769203531261625.
2026-06-01 03:03:36 | INFO | src.nested_cv_avggrm_weighted_unified | Trial 185 | outer=11 | alpha=5.059e+04 n_pcs=4500 (pc_topk) weight_search=on
2026-06-01 03:03:36 | INFO | src.nested_cv_avggrm_weighted_unified | Trial 185 | outer=11 | weight={'name': 'linear', 'floor': 1e-06, 'clip_max': 3.0, 'min_weight': 0.4440728751122763, 'max_weight': 4.800036137474522}
[I 2026-06-01 03:03:43,425] Trial 185 finished with value: 0.22729901608913802 and parameters: {'alpha': 50588.647606328275, 'n_pcs': 4500, 'weight_scheme': 'linear', 'weight_clip_max': 3.0, 'weight_linear_min_weight': 0.4440728751122763, 'weight_linear_max_weight': 4.800036137474522}. Best is trial 183 with value: 0.22769203531261625.
2026-06-01 03:03:43 | INFO | src.nested_cv_avggrm_weighted_unified | Trial 186 | outer=11 | alpha=7.085e+04 n_pcs=4500 (pc_topk) weight_search=on
2026-06-01 03:03:43 | INFO | src.nested_cv_avggrm_weighted_unified | Trial 186 | outer=11 | weight={'name': 'linear', 'floor': 1e-06, 'clip_max': 3.0, 'min_weight': 0.41152194383145696, 'max_weight': 4.837639830090613}
[I 2026-06-01 03:03:50,466] Trial 186 finished with value: 0.22771734339505842 and parameters: {'alpha': 70852.53069307601, 'n_pcs': 4500, 'weight_scheme': 'linear', 'weight_clip_max': 3.0, 'weight_linear_min_weight': 0.41152194383145696, 'weight_linear_max_weight': 4.837639830090613}. Best is trial 186 with value: 0.22771734339505842.
2026-06-01 03:03:50 | INFO | src.nested_cv_avggrm_weighted_unified | OUTER 11 | new best trial 186 (mean inner r=0.2277) saved to outputs/final_results/e6_pc_ridge_avggrm/thr_wing/e6_pc_ridge_avggrm_thr_wing_best_trials/split_11_best_trial.json
2026-06-01 03:03:50 | INFO | src.nested_cv_avggrm_weighted_unified | Trial 187 | outer=11 | alpha=6.782e+04 n_pcs=4500 (pc_topk) weight_search=on
