[I 2026-05-31 23:24:28,666] Trial 187 finished with value: 0.24984670117714441 and parameters: {'alpha': 290177.4100423962, 'n_pcs': 4000, 'weight_scheme': 'exponential', 'weight_clip_max': 3.0, 'weight_exponential_beta': 8.871329136841636}. Best is trial 187 with value: 0.24984670117714441.
2026-05-31 23:24:28 | INFO | src.nested_cv_avggrm_weighted_unified | OUTER 2 | new best trial 187 (mean inner r=0.2498) saved to outputs/final_results/e6_pc_ridge_avggrm/thr_wing/e6_pc_ridge_avggrm_thr_wing_best_trials/split_02_best_trial.json
2026-05-31 23:24:28 | INFO | src.nested_cv_avggrm_weighted_unified | Trial 188 | outer=2 | alpha=2.759e+05 n_pcs=4000 (pc_topk) weight_search=on
2026-05-31 23:24:28 | INFO | src.nested_cv_avggrm_weighted_unified | Trial 188 | outer=2 | weight={'name': 'exponential', 'floor': 1e-06, 'clip_max': 3.0, 'beta': 8.726381980546527}
[I 2026-05-31 23:24:34,897] Trial 188 finished with value: 0.2498033824895634 and parameters: {'alpha': 275912.8035046721, 'n_pcs': 4000, 'weight_scheme': 'exponential', 'weight_clip_max': 3.0, 'weight_exponential_beta': 8.726381980546527}. Best is trial 187 with value: 0.24984670117714441.
2026-05-31 23:24:34 | INFO | src.nested_cv_avggrm_weighted_unified | Trial 189 | outer=2 | alpha=2.890e+05 n_pcs=3500 (pc_topk) weight_search=on
2026-05-31 23:24:34 | INFO | src.nested_cv_avggrm_weighted_unified | Trial 189 | outer=2 | weight={'name': 'exponential', 'floor': 1e-06, 'clip_max': 10.0, 'beta': 8.764803829503833}
2026-05-31 23:24:38 | INFO | src.nested_cv_avggrm_weighted_unified | Trial 189 | outer=2 | pruned after 7/10 inner folds (mean r=0.2675)
[I 2026-05-31 23:24:38,358] Trial 189 pruned. 
2026-05-31 23:24:38 | INFO | src.nested_cv_avggrm_weighted_unified | Trial 190 | outer=2 | alpha=2.483e+05 n_pcs=4000 (pc_topk) weight_search=on
2026-05-31 23:24:38 | INFO | src.nested_cv_avggrm_weighted_unified | Trial 190 | outer=2 | weight={'name': 'exponential', 'floor': 1e-06, 'clip_max': 3.0, 'beta': 8.276178484848996}
[I 2026-05-31 23:24:44,134] Trial 190 finished with value: 0.24957501876053884 and parameters: {'alpha': 248280.52253381166, 'n_pcs': 4000, 'weight_scheme': 'exponential', 'weight_clip_max': 3.0, 'weight_exponential_beta': 8.276178484848996}. Best is trial 187 with value: 0.24984670117714441.
2026-05-31 23:24:44 | INFO | src.nested_cv_avggrm_weighted_unified | Trial 191 | outer=2 | alpha=3.023e+05 n_pcs=4000 (pc_topk) weight_search=on
2026-05-31 23:24:44 | INFO | src.nested_cv_avggrm_weighted_unified | Trial 191 | outer=2 | weight={'name': 'exponential', 'floor': 1e-06, 'clip_max': 3.0, 'beta': 8.890359409634442}
[I 2026-05-31 23:24:49,878] Trial 191 finished with value: 0.24986034618866926 and parameters: {'alpha': 302322.5544443413, 'n_pcs': 4000, 'weight_scheme': 'exponential', 'weight_clip_max': 3.0, 'weight_exponential_beta': 8.890359409634442}. Best is trial 191 with value: 0.24986034618866926.
2026-05-31 23:24:49 | INFO | src.nested_cv_avggrm_weighted_unified | OUTER 2 | new best trial 191 (mean inner r=0.2499) saved to outputs/final_results/e6_pc_ridge_avggrm/thr_wing/e6_pc_ridge_avggrm_thr_wing_best_trials/split_02_best_trial.json
2026-05-31 23:24:49 | INFO | src.nested_cv_avggrm_weighted_unified | Trial 192 | outer=2 | alpha=2.007e+05 n_pcs=4000 (pc_topk) weight_search=on
2026-05-31 23:24:49 | INFO | src.nested_cv_avggrm_weighted_unified | Trial 192 | outer=2 | weight={'name': 'exponential', 'floor': 1e-06, 'clip_max': 3.0, 'beta': 8.886607608591424}
[I 2026-05-31 23:24:56,118] Trial 192 finished with value: 0.24911433188778628 and parameters: {'alpha': 200672.664941205, 'n_pcs': 4000, 'weight_scheme': 'exponential', 'weight_clip_max': 3.0, 'weight_exponential_beta': 8.886607608591424}. Best is trial 191 with value: 0.24986034618866926.
2026-05-31 23:24:56 | INFO | src.nested_cv_avggrm_weighted_unified | Trial 193 | outer=2 | alpha=2.997e+05 n_pcs=4000 (pc_topk) weight_search=on
2026-05-31 23:24:56 | INFO | src.nested_cv_avggrm_weighted_unified | Trial 193 | outer=2 | weight={'name': 'exponential', 'floor': 1e-06, 'clip_max': 3.0, 'beta': 8.677272091671139}
[I 2026-05-31 23:25:01,944] Trial 193 finished with value: 0.2498323442501485 and parameters: {'alpha': 299732.2843578704, 'n_pcs': 4000, 'weight_scheme': 'exponential', 'weight_clip_max': 3.0, 'weight_exponential_beta': 8.677272091671139}. Best is trial 191 with value: 0.24986034618866926.
2026-05-31 23:25:01 | INFO | src.nested_cv_avggrm_weighted_unified | Trial 194 | outer=2 | alpha=2.945e+05 n_pcs=4000 (pc_topk) weight_search=on
2026-05-31 23:25:01 | INFO | src.nested_cv_avggrm_weighted_unified | Trial 194 | outer=2 | weight={'name': 'exponential', 'floor': 1e-06, 'clip_max': 3.0, 'beta': 8.68420501647092}
[I 2026-05-31 23:25:07,767] Trial 194 finished with value: 0.2498304522884176 and parameters: {'alpha': 294472.3726943266, 'n_pcs': 4000, 'weight_scheme': 'exponential', 'weight_clip_max': 3.0, 'weight_exponential_beta': 8.68420501647092}. Best is trial 191 with value: 0.24986034618866926.
2026-05-31 23:25:07 | INFO | src.nested_cv_avggrm_weighted_unified | Trial 195 | outer=2 | alpha=2.945e+05 n_pcs=4000 (pc_topk) weight_search=on
2026-05-31 23:25:07 | INFO | src.nested_cv_avggrm_weighted_unified | Trial 195 | outer=2 | weight={'name': 'exponential', 'floor': 1e-06, 'clip_max': 3.0, 'beta': 8.687952623841525}
[I 2026-05-31 23:25:13,581] Trial 195 finished with value: 0.24983151604569379 and parameters: {'alpha': 294483.8723183308, 'n_pcs': 4000, 'weight_scheme': 'exponential', 'weight_clip_max': 3.0, 'weight_exponential_beta': 8.687952623841525}. Best is trial 191 with value: 0.24986034618866926.
2026-05-31 23:25:13 | INFO | src.nested_cv_avggrm_weighted_unified | Trial 196 | outer=2 | alpha=2.877e+05 n_pcs=4000 (pc_topk) weight_search=on
2026-05-31 23:25:13 | INFO | src.nested_cv_avggrm_weighted_unified | Trial 196 | outer=2 | weight={'name': 'exponential', 'floor': 1e-06, 'clip_max': 3.0, 'beta': 8.688197525738438}
[I 2026-05-31 23:25:19,352] Trial 196 finished with value: 0.24982281978751453 and parameters: {'alpha': 287704.56152728444, 'n_pcs': 4000, 'weight_scheme': 'exponential', 'weight_clip_max': 3.0, 'weight_exponential_beta': 8.688197525738438}. Best is trial 191 with value: 0.24986034618866926.
2026-05-31 23:25:19 | INFO | src.nested_cv_avggrm_weighted_unified | Trial 197 | outer=2 | alpha=2.977e+05 n_pcs=4000 (pc_topk) weight_search=on
2026-05-31 23:25:19 | INFO | src.nested_cv_avggrm_weighted_unified | Trial 197 | outer=2 | weight={'name': 'exponential', 'floor': 1e-06, 'clip_max': 3.0, 'beta': 8.306761588601795}
[I 2026-05-31 23:25:25,112] Trial 197 finished with value: 0.249679235292437 and parameters: {'alpha': 297744.9434072443, 'n_pcs': 4000, 'weight_scheme': 'exponential', 'weight_clip_max': 3.0, 'weight_exponential_beta': 8.306761588601795}. Best is trial 191 with value: 0.24986034618866926.
2026-05-31 23:25:25 | INFO | src.nested_cv_avggrm_weighted_unified | Trial 198 | outer=2 | alpha=2.020e+05 n_pcs=4000 (pc_topk) weight_search=on
2026-05-31 23:25:25 | INFO | src.nested_cv_avggrm_weighted_unified | Trial 198 | outer=2 | weight={'name': 'exponential', 'floor': 1e-06, 'clip_max': 20.0, 'beta': 8.70199713532778}
2026-05-31 23:25:29 | INFO | src.nested_cv_avggrm_weighted_unified | Trial 198 | outer=2 | pruned after 7/10 inner folds (mean r=0.2581)
[I 2026-05-31 23:25:29,154] Trial 198 pruned. 
2026-05-31 23:25:29 | INFO | src.nested_cv_avggrm_weighted_unified | Trial 199 | outer=2 | alpha=2.841e+05 n_pcs=4000 (pc_topk) weight_search=on
2026-05-31 23:25:29 | INFO | src.nested_cv_avggrm_weighted_unified | Trial 199 | outer=2 | weight={'name': 'exponential', 'floor': 1e-06, 'clip_max': 3.0, 'beta': 8.923079741123932}
[I 2026-05-31 23:25:34,905] Trial 199 finished with value: 0.24981511845687138 and parameters: {'alpha': 284079.7465895795, 'n_pcs': 4000, 'weight_scheme': 'exponential', 'weight_clip_max': 3.0, 'weight_exponential_beta': 8.923079741123932}. Best is trial 191 with value: 0.24986034618866926.
2026-05-31 23:25:34 | INFO | src.nested_cv_avggrm_weighted_unified | Trial 200 | outer=2 | alpha=1.519e+05 n_pcs=4000 (pc_topk) weight_search=on
2026-05-31 23:25:34 | INFO | src.nested_cv_avggrm_weighted_unified | Trial 200 | outer=2 | weight={'name': 'exponential', 'floor': 1e-06, 'clip_max': 3.0, 'beta': 8.662494206952147}
[I 2026-05-31 23:25:40,662] Trial 200 finished with value: 0.24800010440886094 and parameters: {'alpha': 151910.26004435864, 'n_pcs': 4000, 'weight_scheme': 'exponential', 'weight_clip_max': 3.0, 'weight_exponential_beta': 8.662494206952147}. Best is trial 191 with value: 0.24986034618866926.
2026-05-31 23:25:40 | INFO | src.nested_cv_avggrm_weighted_unified | Trial 201 | outer=2 | alpha=2.868e+05 n_pcs=4000 (pc_topk) weight_search=on
2026-05-31 23:25:40 | INFO | src.nested_cv_avggrm_weighted_unified | Trial 201 | outer=2 | weight={'name': 'exponential', 'floor': 1e-06, 'clip_max': 3.0, 'beta': 8.936840900064075}
[I 2026-05-31 23:25:46,434] Trial 201 finished with value: 0.24981691418694596 and parameters: {'alpha': 286795.0834158512, 'n_pcs': 4000, 'weight_scheme': 'exponential', 'weight_clip_max': 3.0, 'weight_exponential_beta': 8.936840900064075}. Best is trial 191 with value: 0.24986034618866926.
2026-05-31 23:25:46 | INFO | src.nested_cv_avggrm_weighted_unified | Trial 202 | outer=2 | alpha=2.806e+05 n_pcs=4000 (pc_topk) weight_search=on
2026-05-31 23:25:46 | INFO | src.nested_cv_avggrm_weighted_unified | Trial 202 | outer=2 | weight={'name': 'exponential', 'floor': 1e-06, 'clip_max': 3.0, 'beta': 8.920076489321936}
[I 2026-05-31 23:25:52,197] Trial 202 finished with value: 0.24980596646171732 and parameters: {'alpha': 280569.6292226272, 'n_pcs': 4000, 'weight_scheme': 'exponential', 'weight_clip_max': 3.0, 'weight_exponential_beta': 8.920076489321936}. Best is trial 191 with value: 0.24986034618866926.
2026-05-31 23:25:52 | INFO | src.nested_cv_avggrm_weighted_unified | Trial 203 | outer=2 | alpha=2.957e+05 n_pcs=4000 (pc_topk) weight_search=on
2026-05-31 23:25:52 | INFO | src.nested_cv_avggrm_weighted_unified | Trial 203 | outer=2 | weight={'name': 'exponential', 'floor': 1e-06, 'clip_max': 3.0, 'beta': 8.799195442134495}
[I 2026-05-31 23:25:57,965] Trial 203 finished with value: 0.24985171876247003 and parameters: {'alpha': 295696.7220229275, 'n_pcs': 4000, 'weight_scheme': 'exponential', 'weight_clip_max': 3.0, 'weight_exponential_beta': 8.799195442134495}. Best is trial 191 with value: 0.24986034618866926.
2026-05-31 23:25:57 | INFO | src.nested_cv_avggrm_weighted_unified | Trial 204 | outer=2 | alpha=3.046e+05 n_pcs=4000 (pc_topk) weight_search=on
2026-05-31 23:25:57 | INFO | src.nested_cv_avggrm_weighted_unified | Trial 204 | outer=2 | weight={'name': 'exponential', 'floor': 1e-06, 'clip_max': 3.0, 'beta': 8.34345602030744}
[I 2026-05-31 23:26:03,750] Trial 204 finished with value: 0.24969903535606455 and parameters: {'alpha': 304625.457024799, 'n_pcs': 4000, 'weight_scheme': 'exponential', 'weight_clip_max': 3.0, 'weight_exponential_beta': 8.34345602030744}. Best is trial 191 with value: 0.24986034618866926.
2026-05-31 23:26:03 | INFO | src.nested_cv_avggrm_weighted_unified | Trial 205 | outer=2 | alpha=2.237e+05 n_pcs=4000 (pc_topk) weight_search=on
2026-05-31 23:26:03 | INFO | src.nested_cv_avggrm_weighted_unified | Trial 205 | outer=2 | weight={'name': 'exponential', 'floor': 1e-06, 'clip_max': 3.0, 'beta': 8.725016049919942}
[I 2026-05-31 23:26:09,534] Trial 205 finished with value: 0.24947044718725309 and parameters: {'alpha': 223687.42556998934, 'n_pcs': 4000, 'weight_scheme': 'exponential', 'weight_clip_max': 3.0, 'weight_exponential_beta': 8.725016049919942}. Best is trial 191 with value: 0.24986034618866926.
2026-05-31 23:26:09 | INFO | src.nested_cv_avggrm_weighted_unified | Trial 206 | outer=2 | alpha=3.051e+05 n_pcs=4000 (pc_topk) weight_search=on
2026-05-31 23:26:09 | INFO | src.nested_cv_avggrm_weighted_unified | Trial 206 | outer=2 | weight={'name': 'exponential', 'floor': 1e-06, 'clip_max': 3.0, 'beta': 8.866157479245762}
[I 2026-05-31 23:26:15,314] Trial 206 finished with value: 0.24986778068497437 and parameters: {'alpha': 305117.61212894233, 'n_pcs': 4000, 'weight_scheme': 'exponential', 'weight_clip_max': 3.0, 'weight_exponential_beta': 8.866157479245762}. Best is trial 206 with value: 0.24986778068497437.
2026-05-31 23:26:15 | INFO | src.nested_cv_avggrm_weighted_unified | OUTER 2 | new best trial 206 (mean inner r=0.2499) saved to outputs/final_results/e6_pc_ridge_avggrm/thr_wing/e6_pc_ridge_avggrm_thr_wing_best_trials/split_02_best_trial.json
2026-05-31 23:26:15 | INFO | src.nested_cv_avggrm_weighted_unified | Trial 207 | outer=2 | alpha=2.923e+05 n_pcs=3500 (pc_topk) weight_search=on
2026-05-31 23:26:15 | INFO | src.nested_cv_avggrm_weighted_unified | Trial 207 | outer=2 | weight={'name': 'exponential', 'floor': 1e-06, 'clip_max': 3.0, 'beta': 8.585719082271147}
[I 2026-05-31 23:26:20,335] Trial 207 finished with value: 0.24890986428600687 and parameters: {'alpha': 292298.5314935142, 'n_pcs': 3500, 'weight_scheme': 'exponential', 'weight_clip_max': 3.0, 'weight_exponential_beta': 8.585719082271147}. Best is trial 206 with value: 0.24986778068497437.
2026-05-31 23:26:20 | INFO | src.nested_cv_avggrm_weighted_unified | Trial 208 | outer=2 | alpha=2.033e+05 n_pcs=4000 (pc_topk) weight_search=on
2026-05-31 23:26:20 | INFO | src.nested_cv_avggrm_weighted_unified | Trial 208 | outer=2 | weight={'name': 'exponential', 'floor': 1e-06, 'clip_max': 3.0, 'beta': 1.1059200738581416}
2026-05-31 23:26:24 | INFO | src.nested_cv_avggrm_weighted_unified | Trial 208 | outer=2 | pruned after 7/10 inner folds (mean r=0.2697)
[I 2026-05-31 23:26:24,394] Trial 208 pruned. 
2026-05-31 23:26:24 | INFO | src.nested_cv_avggrm_weighted_unified | Trial 209 | outer=2 | alpha=2.370e+05 n_pcs=4000 (pc_topk) weight_search=on
2026-05-31 23:26:24 | INFO | src.nested_cv_avggrm_weighted_unified | Trial 209 | outer=2 | weight={'name': 'exponential', 'floor': 1e-06, 'clip_max': 3.0, 'beta': 3.794195474850971}
[I 2026-05-31 23:26:30,176] Trial 209 finished with value: 0.24611769780647327 and parameters: {'alpha': 236988.85598382994, 'n_pcs': 4000, 'weight_scheme': 'exponential', 'weight_clip_max': 3.0, 'weight_exponential_beta': 3.794195474850971}. Best is trial 206 with value: 0.24986778068497437.
2026-05-31 23:26:30 | INFO | src.nested_cv_avggrm_weighted_unified | Trial 210 | outer=2 | alpha=2.953e+05 n_pcs=4000 (pc_topk) weight_search=on
2026-05-31 23:26:30 | INFO | src.nested_cv_avggrm_weighted_unified | Trial 210 | outer=2 | weight={'name': 'uniform', 'floor': 1e-06, 'clip_max': 3.0}
2026-05-31 23:26:33 | INFO | src.nested_cv_avggrm_weighted_unified | Trial 210 | outer=2 | pruned after 6/10 inner folds (mean r=0.2354)
[I 2026-05-31 23:26:33,137] Trial 210 pruned. 
2026-05-31 23:26:33 | INFO | src.nested_cv_avggrm_weighted_unified | Trial 211 | outer=2 | alpha=3.161e+05 n_pcs=4000 (pc_topk) weight_search=on
2026-05-31 23:26:33 | INFO | src.nested_cv_avggrm_weighted_unified | Trial 211 | outer=2 | weight={'name': 'exponential', 'floor': 1e-06, 'clip_max': 3.0, 'beta': 8.881671862125316}
[I 2026-05-31 23:26:38,909] Trial 211 finished with value: 0.24986823518115941 and parameters: {'alpha': 316069.7098325627, 'n_pcs': 4000, 'weight_scheme': 'exponential', 'weight_clip_max': 3.0, 'weight_exponential_beta': 8.881671862125316}. Best is trial 211 with value: 0.24986823518115941.
2026-05-31 23:26:38 | INFO | src.nested_cv_avggrm_weighted_unified | OUTER 2 | new best trial 211 (mean inner r=0.2499) saved to outputs/final_results/e6_pc_ridge_avggrm/thr_wing/e6_pc_ridge_avggrm_thr_wing_best_trials/split_02_best_trial.json
2026-05-31 23:26:38 | INFO | src.nested_cv_avggrm_weighted_unified | Trial 212 | outer=2 | alpha=3.073e+05 n_pcs=4000 (pc_topk) weight_search=on
2026-05-31 23:26:38 | INFO | src.nested_cv_avggrm_weighted_unified | Trial 212 | outer=2 | weight={'name': 'exponential', 'floor': 1e-06, 'clip_max': 3.0, 'beta': 8.869278788229755}
[I 2026-05-31 23:26:45,169] Trial 212 finished with value: 0.24986849724061258 and parameters: {'alpha': 307289.6210916902, 'n_pcs': 4000, 'weight_scheme': 'exponential', 'weight_clip_max': 3.0, 'weight_exponential_beta': 8.869278788229755}. Best is trial 212 with value: 0.24986849724061258.
2026-05-31 23:26:45 | INFO | src.nested_cv_avggrm_weighted_unified | OUTER 2 | new best trial 212 (mean inner r=0.2499) saved to outputs/final_results/e6_pc_ridge_avggrm/thr_wing/e6_pc_ridge_avggrm_thr_wing_best_trials/split_02_best_trial.json
2026-05-31 23:26:45 | INFO | src.nested_cv_avggrm_weighted_unified | Trial 213 | outer=2 | alpha=3.032e+05 n_pcs=4000 (pc_topk) weight_search=on
2026-05-31 23:26:45 | INFO | src.nested_cv_avggrm_weighted_unified | Trial 213 | outer=2 | weight={'name': 'exponential', 'floor': 1e-06, 'clip_max': 3.0, 'beta': 8.895793080231646}
[I 2026-05-31 23:26:51,493] Trial 213 finished with value: 0.24985971512942995 and parameters: {'alpha': 303171.2575740346, 'n_pcs': 4000, 'weight_scheme': 'exponential', 'weight_clip_max': 3.0, 'weight_exponential_beta': 8.895793080231646}. Best is trial 212 with value: 0.24986849724061258.
2026-05-31 23:26:51 | INFO | src.nested_cv_avggrm_weighted_unified | Trial 214 | outer=2 | alpha=3.099e+05 n_pcs=4000 (pc_topk) weight_search=on
2026-05-31 23:26:51 | INFO | src.nested_cv_avggrm_weighted_unified | Trial 214 | outer=2 | weight={'name': 'exponential', 'floor': 1e-06, 'clip_max': 3.0, 'beta': 8.844734399290092}
[I 2026-05-31 23:26:57,246] Trial 214 finished with value: 0.2498688542015699 and parameters: {'alpha': 309905.94186257705, 'n_pcs': 4000, 'weight_scheme': 'exponential', 'weight_clip_max': 3.0, 'weight_exponential_beta': 8.844734399290092}. Best is trial 214 with value: 0.2498688542015699.
2026-05-31 23:26:57 | INFO | src.nested_cv_avggrm_weighted_unified | OUTER 2 | new best trial 214 (mean inner r=0.2499) saved to outputs/final_results/e6_pc_ridge_avggrm/thr_wing/e6_pc_ridge_avggrm_thr_wing_best_trials/split_02_best_trial.json
2026-05-31 23:26:57 | INFO | src.nested_cv_avggrm_weighted_unified | Trial 215 | outer=2 | alpha=3.093e+05 n_pcs=4000 (pc_topk) weight_search=on
2026-05-31 23:26:57 | INFO | src.nested_cv_avggrm_weighted_unified | Trial 215 | outer=2 | weight={'name': 'exponential', 'floor': 1e-06, 'clip_max': 3.0, 'beta': 8.909727469162998}
[I 2026-05-31 23:27:03,057] Trial 215 finished with value: 0.24985984248146642 and parameters: {'alpha': 309264.73888468364, 'n_pcs': 4000, 'weight_scheme': 'exponential', 'weight_clip_max': 3.0, 'weight_exponential_beta': 8.909727469162998}. Best is trial 214 with value: 0.2498688542015699.
2026-05-31 23:27:03 | INFO | src.nested_cv_avggrm_weighted_unified | Trial 216 | outer=2 | alpha=3.082e+05 n_pcs=4000 (pc_topk) weight_search=on
2026-05-31 23:27:03 | INFO | src.nested_cv_avggrm_weighted_unified | Trial 216 | outer=2 | weight={'name': 'exponential', 'floor': 1e-06, 'clip_max': 3.0, 'beta': 8.902547877635309}
[I 2026-05-31 23:27:08,801] Trial 216 finished with value: 0.24986157066563894 and parameters: {'alpha': 308248.76847923227, 'n_pcs': 4000, 'weight_scheme': 'exponential', 'weight_clip_max': 3.0, 'weight_exponential_beta': 8.902547877635309}. Best is trial 214 with value: 0.2498688542015699.
2026-05-31 23:27:08 | INFO | src.nested_cv_avggrm_weighted_unified | Trial 217 | outer=2 | alpha=3.093e+05 n_pcs=4000 (pc_topk) weight_search=on
2026-05-31 23:27:08 | INFO | src.nested_cv_avggrm_weighted_unified | Trial 217 | outer=2 | weight={'name': 'exponential', 'floor': 1e-06, 'clip_max': 3.0, 'beta': 8.418953842000535}
[I 2026-05-31 23:27:14,550] Trial 217 finished with value: 0.2497355351377717 and parameters: {'alpha': 309340.0069477764, 'n_pcs': 4000, 'weight_scheme': 'exponential', 'weight_clip_max': 3.0, 'weight_exponential_beta': 8.418953842000535}. Best is trial 214 with value: 0.2498688542015699.
2026-05-31 23:27:14 | INFO | src.nested_cv_avggrm_weighted_unified | Trial 218 | outer=2 | alpha=2.037e+05 n_pcs=3500 (pc_topk) weight_search=on
2026-05-31 23:27:14 | INFO | src.nested_cv_avggrm_weighted_unified | Trial 218 | outer=2 | weight={'name': 'exponential', 'floor': 1e-06, 'clip_max': 3.0, 'beta': 8.91990865681859}
[I 2026-05-31 23:27:19,474] Trial 218 finished with value: 0.24789998690918208 and parameters: {'alpha': 203690.0334383494, 'n_pcs': 3500, 'weight_scheme': 'exponential', 'weight_clip_max': 3.0, 'weight_exponential_beta': 8.91990865681859}. Best is trial 214 with value: 0.2498688542015699.
2026-05-31 23:27:19 | INFO | src.nested_cv_avggrm_weighted_unified | Trial 219 | outer=2 | alpha=3.167e+05 n_pcs=4000 (pc_topk) weight_search=on
2026-05-31 23:27:19 | INFO | src.nested_cv_avggrm_weighted_unified | Trial 219 | outer=2 | weight={'name': 'exponential', 'floor': 1e-06, 'clip_max': 3.0, 'beta': 8.59647761433745}
[I 2026-05-31 23:27:25,242] Trial 219 finished with value: 0.24980168162892133 and parameters: {'alpha': 316657.85264877573, 'n_pcs': 4000, 'weight_scheme': 'exponential', 'weight_clip_max': 3.0, 'weight_exponential_beta': 8.59647761433745}. Best is trial 214 with value: 0.2498688542015699.
2026-05-31 23:27:25 | INFO | src.nested_cv_avggrm_weighted_unified | Trial 220 | outer=2 | alpha=3.205e+05 n_pcs=4000 (pc_topk) weight_search=on
2026-05-31 23:27:25 | INFO | src.nested_cv_avggrm_weighted_unified | Trial 220 | outer=2 | weight={'name': 'exponential', 'floor': 1e-06, 'clip_max': 3.0, 'beta': 8.571993087002406}
