[I 2026-06-01 23:17:04,560] Trial 247 finished with value: 0.22574873114477412 and parameters: {'alpha': 41359.43928346648, 'n_pcs': 4000, 'iw_method': 'pc_logistic', 'iw_clip_max': 2.5, 'iw_prob_clip': 0.033496586139214, 'iw_n_components': 100, 'iw_logistic_c': 4.598361265222778e-05, 'iw_pca_fit': 'combined', 'iw_solver': 'lbfgs', 'iw_rho': 0.85}. Best is trial 246 with value: 0.2259764472647919.
2026-06-01 23:17:04 | INFO | Trial 248 | outer=8 | alpha=3.343e+04 n_pcs=4000 (pc_topk) weight={'name': 'pc_logistic', 'floor': 1e-06, 'clip_max': 2.5, 'prob_clip': 0.03332445515530412, 'n_components': 100, 'logistic_c': 4.012982647823167e-05, 'pca_fit': 'combined', 'solver': 'lbfgs', 'max_iter': 2000, 'fit_intercept': True, 'standardize_with_source': True, 'rho': 0.85}
[I 2026-06-01 23:17:18,196] Trial 248 finished with value: 0.22465048696802148 and parameters: {'alpha': 33429.58131286252, 'n_pcs': 4000, 'iw_method': 'pc_logistic', 'iw_clip_max': 2.5, 'iw_prob_clip': 0.03332445515530412, 'iw_n_components': 100, 'iw_logistic_c': 4.012982647823167e-05, 'iw_pca_fit': 'combined', 'iw_solver': 'lbfgs', 'iw_rho': 0.85}. Best is trial 246 with value: 0.2259764472647919.
2026-06-01 23:17:18 | INFO | Trial 249 | outer=8 | alpha=4.091e+04 n_pcs=4000 (pc_topk) weight={'name': 'pc_logistic', 'floor': 1e-06, 'clip_max': 2.5, 'prob_clip': 0.03270246548704989, 'n_components': 100, 'logistic_c': 4.939487018926594e-05, 'pca_fit': 'combined', 'solver': 'lbfgs', 'max_iter': 2000, 'fit_intercept': True, 'standardize_with_source': True, 'rho': 0.85}
[I 2026-06-01 23:17:31,074] Trial 249 finished with value: 0.22567357447358982 and parameters: {'alpha': 40905.40334621007, 'n_pcs': 4000, 'iw_method': 'pc_logistic', 'iw_clip_max': 2.5, 'iw_prob_clip': 0.03270246548704989, 'iw_n_components': 100, 'iw_logistic_c': 4.939487018926594e-05, 'iw_pca_fit': 'combined', 'iw_solver': 'lbfgs', 'iw_rho': 0.85}. Best is trial 246 with value: 0.2259764472647919.
2026-06-01 23:17:31 | INFO | Trial 250 | outer=8 | alpha=3.513e+04 n_pcs=4000 (pc_topk) weight={'name': 'uniform'}
[I 2026-06-01 23:17:38,066] Trial 250 finished with value: 0.21484961615720416 and parameters: {'alpha': 35125.7299082236, 'n_pcs': 4000, 'iw_method': 'uniform'}. Best is trial 246 with value: 0.2259764472647919.
2026-06-01 23:17:38 | INFO | Trial 251 | outer=8 | alpha=4.093e+04 n_pcs=3500 (pc_topk) weight={'name': 'pc_logistic', 'floor': 1e-06, 'clip_max': 2.5, 'prob_clip': 0.031337428635952756, 'n_components': 100, 'logistic_c': 4.2226822227522517e-05, 'pca_fit': 'combined', 'solver': 'lbfgs', 'max_iter': 2000, 'fit_intercept': True, 'standardize_with_source': True, 'rho': 0.85}
[I 2026-06-01 23:17:49,881] Trial 251 finished with value: 0.22253244304982905 and parameters: {'alpha': 40931.42085859605, 'n_pcs': 3500, 'iw_method': 'pc_logistic', 'iw_clip_max': 2.5, 'iw_prob_clip': 0.031337428635952756, 'iw_n_components': 100, 'iw_logistic_c': 4.2226822227522517e-05, 'iw_pca_fit': 'combined', 'iw_solver': 'lbfgs', 'iw_rho': 0.85}. Best is trial 246 with value: 0.2259764472647919.
2026-06-01 23:17:49 | INFO | Trial 252 | outer=8 | alpha=4.616e+04 n_pcs=4000 (pc_topk) weight={'name': 'pc_logistic', 'floor': 1e-06, 'clip_max': 2.5, 'prob_clip': 0.030680780633065105, 'n_components': 100, 'logistic_c': 6.187193442154412e-05, 'pca_fit': 'combined', 'solver': 'lbfgs', 'max_iter': 2000, 'fit_intercept': True, 'standardize_with_source': True, 'rho': 0.85}
[I 2026-06-01 23:18:03,468] Trial 252 finished with value: 0.22588048104324 and parameters: {'alpha': 46155.632118524794, 'n_pcs': 4000, 'iw_method': 'pc_logistic', 'iw_clip_max': 2.5, 'iw_prob_clip': 0.030680780633065105, 'iw_n_components': 100, 'iw_logistic_c': 6.187193442154412e-05, 'iw_pca_fit': 'combined', 'iw_solver': 'lbfgs', 'iw_rho': 0.85}. Best is trial 246 with value: 0.2259764472647919.
2026-06-01 23:18:03 | INFO | Trial 253 | outer=8 | alpha=3.007e+04 n_pcs=4000 (pc_topk) weight={'name': 'pc_logistic', 'floor': 1e-06, 'clip_max': 2.5, 'prob_clip': 0.03322164062907423, 'n_components': 100, 'logistic_c': 5.0370680592384486e-05, 'pca_fit': 'combined', 'solver': 'lbfgs', 'max_iter': 2000, 'fit_intercept': True, 'standardize_with_source': True, 'rho': 0.85}
[I 2026-06-01 23:18:16,580] Trial 253 finished with value: 0.22363694743523327 and parameters: {'alpha': 30069.9678102059, 'n_pcs': 4000, 'iw_method': 'pc_logistic', 'iw_clip_max': 2.5, 'iw_prob_clip': 0.03322164062907423, 'iw_n_components': 100, 'iw_logistic_c': 5.0370680592384486e-05, 'iw_pca_fit': 'combined', 'iw_solver': 'lbfgs', 'iw_rho': 0.85}. Best is trial 246 with value: 0.2259764472647919.
2026-06-01 23:18:16 | INFO | Trial 254 | outer=8 | alpha=4.390e+04 n_pcs=4000 (pc_topk) weight={'name': 'pc_logistic', 'floor': 1e-06, 'clip_max': 2.5, 'prob_clip': 0.030545480198616016, 'n_components': 100, 'logistic_c': 6.564238962749016e-05, 'pca_fit': 'combined', 'solver': 'lbfgs', 'max_iter': 2000, 'fit_intercept': True, 'standardize_with_source': True, 'rho': 0.85}
[I 2026-06-01 23:18:29,989] Trial 254 finished with value: 0.22561729363014807 and parameters: {'alpha': 43896.370801504185, 'n_pcs': 4000, 'iw_method': 'pc_logistic', 'iw_clip_max': 2.5, 'iw_prob_clip': 0.030545480198616016, 'iw_n_components': 100, 'iw_logistic_c': 6.564238962749016e-05, 'iw_pca_fit': 'combined', 'iw_solver': 'lbfgs', 'iw_rho': 0.85}. Best is trial 246 with value: 0.2259764472647919.
2026-06-01 23:18:30 | INFO | Trial 255 | outer=8 | alpha=4.599e+04 n_pcs=4000 (pc_topk) weight={'name': 'pc_logistic', 'floor': 1e-06, 'clip_max': 2.5, 'prob_clip': 0.02955261707658076, 'n_components': 100, 'logistic_c': 3.32241803904388e-05, 'pca_fit': 'combined', 'solver': 'lbfgs', 'max_iter': 2000, 'fit_intercept': True, 'standardize_with_source': True, 'rho': 0.85}
[I 2026-06-01 23:18:42,704] Trial 255 finished with value: 0.22609976769205492 and parameters: {'alpha': 45993.342919848525, 'n_pcs': 4000, 'iw_method': 'pc_logistic', 'iw_clip_max': 2.5, 'iw_prob_clip': 0.02955261707658076, 'iw_n_components': 100, 'iw_logistic_c': 3.32241803904388e-05, 'iw_pca_fit': 'combined', 'iw_solver': 'lbfgs', 'iw_rho': 0.85}. Best is trial 255 with value: 0.22609976769205492.
2026-06-01 23:18:42 | INFO | Trial 256 | outer=8 | alpha=4.723e+04 n_pcs=4000 (pc_topk) weight={'name': 'pc_logistic', 'floor': 1e-06, 'clip_max': 2.5, 'prob_clip': 0.030472226152919665, 'n_components': 100, 'logistic_c': 2.9193410046858264e-05, 'pca_fit': 'combined', 'solver': 'lbfgs', 'max_iter': 2000, 'fit_intercept': True, 'standardize_with_source': True, 'rho': 0.85}
[I 2026-06-01 23:18:55,809] Trial 256 finished with value: 0.2261404128539585 and parameters: {'alpha': 47230.797610154004, 'n_pcs': 4000, 'iw_method': 'pc_logistic', 'iw_clip_max': 2.5, 'iw_prob_clip': 0.030472226152919665, 'iw_n_components': 100, 'iw_logistic_c': 2.9193410046858264e-05, 'iw_pca_fit': 'combined', 'iw_solver': 'lbfgs', 'iw_rho': 0.85}. Best is trial 256 with value: 0.2261404128539585.
2026-06-01 23:18:55 | INFO | Trial 257 | outer=8 | alpha=4.659e+04 n_pcs=4000 (pc_topk) weight={'name': 'pc_logistic', 'floor': 1e-06, 'clip_max': 2.5, 'prob_clip': 0.03061037312636567, 'n_components': 100, 'logistic_c': 2.9137638124640615e-05, 'pca_fit': 'combined', 'solver': 'lbfgs', 'max_iter': 2000, 'fit_intercept': True, 'standardize_with_source': True, 'rho': 0.85}
[I 2026-06-01 23:19:09,216] Trial 257 finished with value: 0.22610167233707895 and parameters: {'alpha': 46591.34532103401, 'n_pcs': 4000, 'iw_method': 'pc_logistic', 'iw_clip_max': 2.5, 'iw_prob_clip': 0.03061037312636567, 'iw_n_components': 100, 'iw_logistic_c': 2.9137638124640615e-05, 'iw_pca_fit': 'combined', 'iw_solver': 'lbfgs', 'iw_rho': 0.85}. Best is trial 256 with value: 0.2261404128539585.
2026-06-01 23:19:09 | INFO | Trial 258 | outer=8 | alpha=4.525e+04 n_pcs=4000 (pc_topk) weight={'name': 'pc_logistic', 'floor': 1e-06, 'clip_max': 12.0, 'prob_clip': 0.029907110728743535, 'n_components': 100, 'logistic_c': 2.87244629298742e-05, 'pca_fit': 'combined', 'solver': 'lbfgs', 'max_iter': 2000, 'fit_intercept': True, 'standardize_with_source': True, 'rho': 0.85}
[I 2026-06-01 23:19:23,041] Trial 258 finished with value: 0.21852910919940277 and parameters: {'alpha': 45254.68474905802, 'n_pcs': 4000, 'iw_method': 'pc_logistic', 'iw_clip_max': 12.0, 'iw_prob_clip': 0.029907110728743535, 'iw_n_components': 100, 'iw_logistic_c': 2.87244629298742e-05, 'iw_pca_fit': 'combined', 'iw_solver': 'lbfgs', 'iw_rho': 0.85}. Best is trial 256 with value: 0.2261404128539585.
2026-06-01 23:19:23 | INFO | Trial 259 | outer=8 | alpha=3.770e+04 n_pcs=4000 (pc_topk) weight={'name': 'pc_logistic', 'floor': 1e-06, 'clip_max': 2.5, 'prob_clip': 0.028768870051350624, 'n_components': 20, 'logistic_c': 3.911834637998558e-05, 'pca_fit': 'combined', 'solver': 'lbfgs', 'max_iter': 2000, 'fit_intercept': True, 'standardize_with_source': True, 'rho': 0.85}
[I 2026-06-01 23:19:35,981] Trial 259 finished with value: 0.22300346411687216 and parameters: {'alpha': 37700.41382328712, 'n_pcs': 4000, 'iw_method': 'pc_logistic', 'iw_clip_max': 2.5, 'iw_prob_clip': 0.028768870051350624, 'iw_n_components': 20, 'iw_logistic_c': 3.911834637998558e-05, 'iw_pca_fit': 'combined', 'iw_solver': 'lbfgs', 'iw_rho': 0.85}. Best is trial 256 with value: 0.2261404128539585.
2026-06-01 23:19:36 | INFO | Trial 260 | outer=8 | alpha=3.322e+04 n_pcs=4000 (pc_topk) weight={'name': 'pc_logistic', 'floor': 1e-06, 'clip_max': 2.5, 'prob_clip': 0.03070959104760304, 'n_components': 100, 'logistic_c': 2.8061976811875284e-05, 'pca_fit': 'combined', 'solver': 'lbfgs', 'max_iter': 2000, 'fit_intercept': True, 'standardize_with_source': True, 'rho': 0.85}
[I 2026-06-01 23:19:49,168] Trial 260 finished with value: 0.22442518881509727 and parameters: {'alpha': 33222.95451595747, 'n_pcs': 4000, 'iw_method': 'pc_logistic', 'iw_clip_max': 2.5, 'iw_prob_clip': 0.03070959104760304, 'iw_n_components': 100, 'iw_logistic_c': 2.8061976811875284e-05, 'iw_pca_fit': 'combined', 'iw_solver': 'lbfgs', 'iw_rho': 0.85}. Best is trial 256 with value: 0.2261404128539585.
2026-06-01 23:19:49 | INFO | Trial 261 | outer=8 | alpha=4.997e+04 n_pcs=4000 (pc_topk) weight={'name': 'pc_logistic', 'floor': 1e-06, 'clip_max': 2.5, 'prob_clip': 0.030547622362027477, 'n_components': 100, 'logistic_c': 3.466926883251038e-05, 'pca_fit': 'combined', 'solver': 'lbfgs', 'max_iter': 2000, 'fit_intercept': True, 'standardize_with_source': True, 'rho': 0.85}
[I 2026-06-01 23:20:02,550] Trial 261 finished with value: 0.22642856853149448 and parameters: {'alpha': 49972.20562664418, 'n_pcs': 4000, 'iw_method': 'pc_logistic', 'iw_clip_max': 2.5, 'iw_prob_clip': 0.030547622362027477, 'iw_n_components': 100, 'iw_logistic_c': 3.466926883251038e-05, 'iw_pca_fit': 'combined', 'iw_solver': 'lbfgs', 'iw_rho': 0.85}. Best is trial 261 with value: 0.22642856853149448.
2026-06-01 23:20:02 | INFO | Trial 262 | outer=8 | alpha=4.901e+04 n_pcs=4000 (pc_topk) weight={'name': 'pc_logistic', 'floor': 1e-06, 'clip_max': 2.5, 'prob_clip': 0.03006475069987166, 'n_components': 100, 'logistic_c': 3.365756910208621e-05, 'pca_fit': 'combined', 'solver': 'lbfgs', 'max_iter': 2000, 'fit_intercept': True, 'standardize_with_source': True, 'rho': 0.85}
[I 2026-06-01 23:20:15,939] Trial 262 finished with value: 0.22633132011982787 and parameters: {'alpha': 49014.95008981334, 'n_pcs': 4000, 'iw_method': 'pc_logistic', 'iw_clip_max': 2.5, 'iw_prob_clip': 0.03006475069987166, 'iw_n_components': 100, 'iw_logistic_c': 3.365756910208621e-05, 'iw_pca_fit': 'combined', 'iw_solver': 'lbfgs', 'iw_rho': 0.85}. Best is trial 261 with value: 0.22642856853149448.
2026-06-01 23:20:15 | INFO | Trial 263 | outer=8 | alpha=4.679e+04 n_pcs=4000 (pc_topk) weight={'name': 'pc_logistic', 'floor': 1e-06, 'clip_max': 2.5, 'prob_clip': 0.030407628909490957, 'n_components': 100, 'logistic_c': 1.418467968222532e-05, 'pca_fit': 'combined', 'solver': 'lbfgs', 'max_iter': 2000, 'fit_intercept': True, 'standardize_with_source': True, 'rho': 0.85}
[I 2026-06-01 23:20:28,553] Trial 263 finished with value: 0.2238511226962739 and parameters: {'alpha': 46794.88299084564, 'n_pcs': 4000, 'iw_method': 'pc_logistic', 'iw_clip_max': 2.5, 'iw_prob_clip': 0.030407628909490957, 'iw_n_components': 100, 'iw_logistic_c': 1.418467968222532e-05, 'iw_pca_fit': 'combined', 'iw_solver': 'lbfgs', 'iw_rho': 0.85}. Best is trial 261 with value: 0.22642856853149448.
2026-06-01 23:20:28 | INFO | Trial 264 | outer=8 | alpha=3.903e+04 n_pcs=4000 (pc_topk) weight={'name': 'pc_logistic', 'floor': 1e-06, 'clip_max': 2.5, 'prob_clip': 0.029635149574252492, 'n_components': 100, 'logistic_c': 3.1187625269265914e-05, 'pca_fit': 'combined', 'solver': 'lbfgs', 'max_iter': 2000, 'fit_intercept': True, 'standardize_with_source': True, 'rho': 0.85}
[I 2026-06-01 23:20:41,098] Trial 264 finished with value: 0.22542672323060264 and parameters: {'alpha': 39030.87727735506, 'n_pcs': 4000, 'iw_method': 'pc_logistic', 'iw_clip_max': 2.5, 'iw_prob_clip': 0.029635149574252492, 'iw_n_components': 100, 'iw_logistic_c': 3.1187625269265914e-05, 'iw_pca_fit': 'combined', 'iw_solver': 'lbfgs', 'iw_rho': 0.85}. Best is trial 261 with value: 0.22642856853149448.
2026-06-01 23:20:41 | INFO | Trial 265 | outer=8 | alpha=3.079e+04 n_pcs=4000 (pc_topk) weight={'name': 'pc_logistic', 'floor': 1e-06, 'clip_max': 2.5, 'prob_clip': 0.029942788675858024, 'n_components': 40, 'logistic_c': 2.3556785088251784e-05, 'pca_fit': 'combined', 'solver': 'lbfgs', 'max_iter': 2000, 'fit_intercept': True, 'standardize_with_source': True, 'rho': 0.85}
[I 2026-06-01 23:20:54,406] Trial 265 finished with value: 0.2230407449857354 and parameters: {'alpha': 30788.645700841138, 'n_pcs': 4000, 'iw_method': 'pc_logistic', 'iw_clip_max': 2.5, 'iw_prob_clip': 0.029942788675858024, 'iw_n_components': 40, 'iw_logistic_c': 2.3556785088251784e-05, 'iw_pca_fit': 'combined', 'iw_solver': 'lbfgs', 'iw_rho': 0.85}. Best is trial 261 with value: 0.22642856853149448.
2026-06-01 23:20:54 | INFO | Trial 266 | outer=8 | alpha=3.702e+04 n_pcs=4000 (pc_topk) weight={'name': 'pc_logistic', 'floor': 1e-06, 'clip_max': 2.5, 'prob_clip': 0.030696166043519015, 'n_components': 100, 'logistic_c': 3.410775163690531e-05, 'pca_fit': 'combined', 'solver': 'lbfgs', 'max_iter': 2000, 'fit_intercept': True, 'standardize_with_source': True, 'rho': 0.85}
[I 2026-06-01 23:21:07,378] Trial 266 finished with value: 0.22528326454368286 and parameters: {'alpha': 37022.295099492105, 'n_pcs': 4000, 'iw_method': 'pc_logistic', 'iw_clip_max': 2.5, 'iw_prob_clip': 0.030696166043519015, 'iw_n_components': 100, 'iw_logistic_c': 3.410775163690531e-05, 'iw_pca_fit': 'combined', 'iw_solver': 'lbfgs', 'iw_rho': 0.85}. Best is trial 261 with value: 0.22642856853149448.
2026-06-01 23:21:07 | INFO | Trial 267 | outer=8 | alpha=2.792e+04 n_pcs=3500 (pc_topk) weight={'name': 'pc_logistic', 'floor': 1e-06, 'clip_max': 2.5, 'prob_clip': 0.028658697845211172, 'n_components': 60, 'logistic_c': 2.0636942228051617e-05, 'pca_fit': 'combined', 'solver': 'lbfgs', 'max_iter': 2000, 'fit_intercept': True, 'standardize_with_source': True, 'rho': 0.85}
[I 2026-06-01 23:21:18,978] Trial 267 finished with value: 0.21785912840883898 and parameters: {'alpha': 27917.75938065414, 'n_pcs': 3500, 'iw_method': 'pc_logistic', 'iw_clip_max': 2.5, 'iw_prob_clip': 0.028658697845211172, 'iw_n_components': 60, 'iw_logistic_c': 2.0636942228051617e-05, 'iw_pca_fit': 'combined', 'iw_solver': 'lbfgs', 'iw_rho': 0.85}. Best is trial 261 with value: 0.22642856853149448.
2026-06-01 23:21:19 | INFO | Trial 268 | outer=8 | alpha=4.308e+04 n_pcs=4000 (pc_topk) weight={'name': 'pc_logistic', 'floor': 1e-06, 'clip_max': 1.5, 'prob_clip': 0.03224820865050107, 'n_components': 100, 'logistic_c': 3.8851764992355694e-05, 'pca_fit': 'combined', 'solver': 'lbfgs', 'max_iter': 2000, 'fit_intercept': True, 'standardize_with_source': True, 'rho': 0.85}
[I 2026-06-01 23:21:33,138] Trial 268 finished with value: 0.22214804759397272 and parameters: {'alpha': 43080.18019721288, 'n_pcs': 4000, 'iw_method': 'pc_logistic', 'iw_clip_max': 1.5, 'iw_prob_clip': 0.03224820865050107, 'iw_n_components': 100, 'iw_logistic_c': 3.8851764992355694e-05, 'iw_pca_fit': 'combined', 'iw_solver': 'lbfgs', 'iw_rho': 0.85}. Best is trial 261 with value: 0.22642856853149448.
2026-06-01 23:21:33 | INFO | Trial 269 | outer=8 | alpha=4.869e+04 n_pcs=4000 (pc_topk) weight={'name': 'uniform'}
[I 2026-06-01 23:21:40,672] Trial 269 finished with value: 0.21427908273172505 and parameters: {'alpha': 48692.668565499764, 'n_pcs': 4000, 'iw_method': 'uniform'}. Best is trial 261 with value: 0.22642856853149448.
2026-06-01 23:21:40 | INFO | Trial 270 | outer=8 | alpha=3.684e+04 n_pcs=4000 (pc_topk) weight={'name': 'pc_logistic', 'floor': 1e-06, 'clip_max': 2.5, 'prob_clip': 0.029321799064838852, 'n_components': 100, 'logistic_c': 5.133821701608608e-05, 'pca_fit': 'combined', 'solver': 'lbfgs', 'max_iter': 2000, 'fit_intercept': True, 'standardize_with_source': True, 'rho': 0.85}
[I 2026-06-01 23:21:53,629] Trial 270 finished with value: 0.22497885563294623 and parameters: {'alpha': 36841.807905187314, 'n_pcs': 4000, 'iw_method': 'pc_logistic', 'iw_clip_max': 2.5, 'iw_prob_clip': 0.029321799064838852, 'iw_n_components': 100, 'iw_logistic_c': 5.133821701608608e-05, 'iw_pca_fit': 'combined', 'iw_solver': 'lbfgs', 'iw_rho': 0.85}. Best is trial 261 with value: 0.22642856853149448.
2026-06-01 23:21:53 | INFO | Trial 271 | outer=8 | alpha=4.943e+04 n_pcs=3500 (pc_topk) weight={'name': 'pc_logistic', 'floor': 1e-06, 'clip_max': 2.5, 'prob_clip': 0.03251034435655434, 'n_components': 100, 'logistic_c': 3.0132591646378268e-05, 'pca_fit': 'combined', 'solver': 'lbfgs', 'max_iter': 2000, 'fit_intercept': True, 'standardize_with_source': True, 'rho': 0.85}
[I 2026-06-01 23:22:04,807] Trial 271 finished with value: 0.22360349112701555 and parameters: {'alpha': 49428.85059221138, 'n_pcs': 3500, 'iw_method': 'pc_logistic', 'iw_clip_max': 2.5, 'iw_prob_clip': 0.03251034435655434, 'iw_n_components': 100, 'iw_logistic_c': 3.0132591646378268e-05, 'iw_pca_fit': 'combined', 'iw_solver': 'lbfgs', 'iw_rho': 0.85}. Best is trial 261 with value: 0.22642856853149448.
2026-06-01 23:22:04 | INFO | Trial 272 | outer=8 | alpha=4.225e+04 n_pcs=4000 (pc_topk) weight={'name': 'pc_logistic', 'floor': 1e-06, 'clip_max': 2.5, 'prob_clip': 0.028367091355150514, 'n_components': 100, 'logistic_c': 5.8909297369260815e-05, 'pca_fit': 'combined', 'solver': 'lbfgs', 'max_iter': 2000, 'fit_intercept': True, 'standardize_with_source': True, 'rho': 0.85}
[I 2026-06-01 23:22:17,942] Trial 272 finished with value: 0.2254967518237781 and parameters: {'alpha': 42246.8516151521, 'n_pcs': 4000, 'iw_method': 'pc_logistic', 'iw_clip_max': 2.5, 'iw_prob_clip': 0.028367091355150514, 'iw_n_components': 100, 'iw_logistic_c': 5.8909297369260815e-05, 'iw_pca_fit': 'combined', 'iw_solver': 'lbfgs', 'iw_rho': 0.85}. Best is trial 261 with value: 0.22642856853149448.
2026-06-01 23:22:17 | INFO | Trial 273 | outer=8 | alpha=4.074e+04 n_pcs=4000 (pc_topk) weight={'name': 'pc_logistic', 'floor': 1e-06, 'clip_max': 2.5, 'prob_clip': 0.028411669635231278, 'n_components': 10, 'logistic_c': 1.1554807022055094e-07, 'pca_fit': 'combined', 'solver': 'lbfgs', 'max_iter': 2000, 'fit_intercept': True, 'standardize_with_source': True, 'rho': 0.85}
[I 2026-06-01 23:22:29,338] Trial 273 finished with value: 0.21502101087658007 and parameters: {'alpha': 40742.91320841327, 'n_pcs': 4000, 'iw_method': 'pc_logistic', 'iw_clip_max': 2.5, 'iw_prob_clip': 0.028411669635231278, 'iw_n_components': 10, 'iw_logistic_c': 1.1554807022055094e-07, 'iw_pca_fit': 'combined', 'iw_solver': 'lbfgs', 'iw_rho': 0.85}. Best is trial 261 with value: 0.22642856853149448.
2026-06-01 23:22:29 | INFO | Trial 274 | outer=8 | alpha=2.468e+04 n_pcs=4000 (pc_topk) weight={'name': 'pc_logistic', 'floor': 1e-06, 'clip_max': 2.5, 'prob_clip': 0.03202761141766437, 'n_components': 100, 'logistic_c': 1.5545626971072127e-05, 'pca_fit': 'combined', 'solver': 'lbfgs', 'max_iter': 2000, 'fit_intercept': True, 'standardize_with_source': True, 'rho': 0.85}
[I 2026-06-01 23:22:41,963] Trial 274 finished with value: 0.22044770777878647 and parameters: {'alpha': 24677.41781752973, 'n_pcs': 4000, 'iw_method': 'pc_logistic', 'iw_clip_max': 2.5, 'iw_prob_clip': 0.03202761141766437, 'iw_n_components': 100, 'iw_logistic_c': 1.5545626971072127e-05, 'iw_pca_fit': 'combined', 'iw_solver': 'lbfgs', 'iw_rho': 0.85}. Best is trial 261 with value: 0.22642856853149448.
2026-06-01 23:22:41 | INFO | Trial 275 | outer=8 | alpha=1.408e+06 n_pcs=4000 (pc_topk) weight={'name': 'pc_logistic', 'floor': 1e-06, 'clip_max': 2.5, 'prob_clip': 0.0009755754958622285, 'n_components': 80, 'logistic_c': 5.6022740190400976e-05, 'pca_fit': 'combined', 'solver': 'lbfgs', 'max_iter': 2000, 'fit_intercept': True, 'standardize_with_source': True, 'rho': 0.85}
[I 2026-06-01 23:22:55,821] Trial 275 finished with value: 0.20651442953529506 and parameters: {'alpha': 1408144.6522598297, 'n_pcs': 4000, 'iw_method': 'pc_logistic', 'iw_clip_max': 2.5, 'iw_prob_clip': 0.0009755754958622285, 'iw_n_components': 80, 'iw_logistic_c': 5.6022740190400976e-05, 'iw_pca_fit': 'combined', 'iw_solver': 'lbfgs', 'iw_rho': 0.85}. Best is trial 261 with value: 0.22642856853149448.
2026-06-01 23:22:55 | INFO | Trial 276 | outer=8 | alpha=3.360e+04 n_pcs=4000 (pc_topk) weight={'name': 'pc_logistic', 'floor': 1e-06, 'clip_max': 2.5, 'prob_clip': 0.028812164070782683, 'n_components': 100, 'logistic_c': 3.961674454075278e-05, 'pca_fit': 'combined', 'solver': 'lbfgs', 'max_iter': 2000, 'fit_intercept': True, 'standardize_with_source': True, 'rho': 0.85}
