[I 2026-06-01 14:46:46,596] Trial 88 finished with value: 0.24145873651620814 and parameters: {'alpha': 75920.6240508635, 'n_pcs': 4000, 'iw_method': 'pc_logistic', 'iw_clip_max': 2.5, 'iw_prob_clip': 0.005165966555322641, 'iw_n_components': 80, 'iw_logistic_c': 0.528108891817114, 'iw_pca_fit': 'combined', 'iw_solver': 'lbfgs', 'iw_rho': 0.7}. Best is trial 86 with value: 0.2421509335753262.
2026-06-01 14:46:46 | INFO | Trial 89 | outer=2 | alpha=3.038e+04 n_pcs=4000 (pc_topk) weight={'name': 'pc_logistic', 'floor': 1e-06, 'clip_max': 2.5, 'prob_clip': 0.0049392737709759325, 'n_components': 60, 'logistic_c': 2.4806356079263843, 'pca_fit': 'combined', 'solver': 'lbfgs', 'max_iter': 2000, 'fit_intercept': True, 'standardize_with_source': True, 'rho': 0.7}
[I 2026-06-01 14:47:10,039] Trial 89 finished with value: 0.2302187682423556 and parameters: {'alpha': 30378.62338717819, 'n_pcs': 4000, 'iw_method': 'pc_logistic', 'iw_clip_max': 2.5, 'iw_prob_clip': 0.0049392737709759325, 'iw_n_components': 60, 'iw_logistic_c': 2.4806356079263843, 'iw_pca_fit': 'combined', 'iw_solver': 'lbfgs', 'iw_rho': 0.7}. Best is trial 86 with value: 0.2421509335753262.
2026-06-01 14:47:10 | INFO | Trial 90 | outer=2 | alpha=2.280e+04 n_pcs=4000 (pc_topk) weight={'name': 'pc_logistic', 'floor': 1e-06, 'clip_max': 12.0, 'prob_clip': 0.0035976850438819317, 'n_components': 80, 'logistic_c': 0.0846289504929387, 'pca_fit': 'combined', 'solver': 'lbfgs', 'max_iter': 2000, 'fit_intercept': True, 'standardize_with_source': True, 'rho': 0.7}
[I 2026-06-01 14:47:34,185] Trial 90 finished with value: 0.2156700801917669 and parameters: {'alpha': 22803.779662233763, 'n_pcs': 4000, 'iw_method': 'pc_logistic', 'iw_clip_max': 12.0, 'iw_prob_clip': 0.0035976850438819317, 'iw_n_components': 80, 'iw_logistic_c': 0.0846289504929387, 'iw_pca_fit': 'combined', 'iw_solver': 'lbfgs', 'iw_rho': 0.7}. Best is trial 86 with value: 0.2421509335753262.
2026-06-01 14:47:34 | INFO | Trial 91 | outer=2 | alpha=7.399e+04 n_pcs=3500 (pc_topk) weight={'name': 'pc_logistic', 'floor': 1e-06, 'clip_max': 2.5, 'prob_clip': 0.006565582371535208, 'n_components': 80, 'logistic_c': 0.00019449143319938612, 'pca_fit': 'combined', 'solver': 'lbfgs', 'max_iter': 2000, 'fit_intercept': True, 'standardize_with_source': True, 'rho': 0.7}
[I 2026-06-01 14:47:46,921] Trial 91 finished with value: 0.2402469316364102 and parameters: {'alpha': 73989.73543129925, 'n_pcs': 3500, 'iw_method': 'pc_logistic', 'iw_clip_max': 2.5, 'iw_prob_clip': 0.006565582371535208, 'iw_n_components': 80, 'iw_logistic_c': 0.00019449143319938612, 'iw_pca_fit': 'combined', 'iw_solver': 'lbfgs', 'iw_rho': 0.7}. Best is trial 86 with value: 0.2421509335753262.
2026-06-01 14:47:46 | INFO | Trial 92 | outer=2 | alpha=8.752e+04 n_pcs=4000 (pc_topk) weight={'name': 'pc_logistic', 'floor': 1e-06, 'clip_max': 2.5, 'prob_clip': 0.0026076355648749923, 'n_components': 80, 'logistic_c': 1.504042643700574, 'pca_fit': 'combined', 'solver': 'lbfgs', 'max_iter': 2000, 'fit_intercept': True, 'standardize_with_source': True, 'rho': 0.7}
[I 2026-06-01 14:48:12,046] Trial 92 finished with value: 0.24097420793002694 and parameters: {'alpha': 87516.27609898588, 'n_pcs': 4000, 'iw_method': 'pc_logistic', 'iw_clip_max': 2.5, 'iw_prob_clip': 0.0026076355648749923, 'iw_n_components': 80, 'iw_logistic_c': 1.504042643700574, 'iw_pca_fit': 'combined', 'iw_solver': 'lbfgs', 'iw_rho': 0.7}. Best is trial 86 with value: 0.2421509335753262.
2026-06-01 14:48:12 | INFO | Trial 93 | outer=2 | alpha=7.770e+04 n_pcs=3500 (pc_topk) weight={'name': 'pc_logistic', 'floor': 1e-06, 'clip_max': 2.5, 'prob_clip': 0.002230991719667095, 'n_components': 10, 'logistic_c': 1.1613428391879115, 'pca_fit': 'combined', 'solver': 'lbfgs', 'max_iter': 2000, 'fit_intercept': True, 'standardize_with_source': True, 'rho': 0.7}
[I 2026-06-01 14:48:25,107] Trial 93 finished with value: 0.23570406566907148 and parameters: {'alpha': 77702.6305075983, 'n_pcs': 3500, 'iw_method': 'pc_logistic', 'iw_clip_max': 2.5, 'iw_prob_clip': 0.002230991719667095, 'iw_n_components': 10, 'iw_logistic_c': 1.1613428391879115, 'iw_pca_fit': 'combined', 'iw_solver': 'lbfgs', 'iw_rho': 0.7}. Best is trial 86 with value: 0.2421509335753262.
2026-06-01 14:48:25 | INFO | Trial 94 | outer=2 | alpha=5.483e+04 n_pcs=4000 (pc_topk) weight={'name': 'pc_logistic', 'floor': 1e-06, 'clip_max': 2.5, 'prob_clip': 0.002679290206527492, 'n_components': 80, 'logistic_c': 1.6665099931357792, 'pca_fit': 'combined', 'solver': 'lbfgs', 'max_iter': 2000, 'fit_intercept': True, 'standardize_with_source': True, 'rho': 0.5}
[I 2026-06-01 14:48:51,558] Trial 94 finished with value: 0.23955661961584807 and parameters: {'alpha': 54826.454091948646, 'n_pcs': 4000, 'iw_method': 'pc_logistic', 'iw_clip_max': 2.5, 'iw_prob_clip': 0.002679290206527492, 'iw_n_components': 80, 'iw_logistic_c': 1.6665099931357792, 'iw_pca_fit': 'combined', 'iw_solver': 'lbfgs', 'iw_rho': 0.5}. Best is trial 86 with value: 0.2421509335753262.
2026-06-01 14:48:51 | INFO | Trial 95 | outer=2 | alpha=8.982e+04 n_pcs=4000 (pc_topk) weight={'name': 'pc_logistic', 'floor': 1e-06, 'clip_max': 2.5, 'prob_clip': 0.004893079381866872, 'n_components': 20, 'logistic_c': 0.44112271114036194, 'pca_fit': 'combined', 'solver': 'lbfgs', 'max_iter': 2000, 'fit_intercept': True, 'standardize_with_source': True, 'rho': 0.85}
[I 2026-06-01 14:49:10,559] Trial 95 finished with value: 0.23716344843750664 and parameters: {'alpha': 89819.88730188075, 'n_pcs': 4000, 'iw_method': 'pc_logistic', 'iw_clip_max': 2.5, 'iw_prob_clip': 0.004893079381866872, 'iw_n_components': 20, 'iw_logistic_c': 0.44112271114036194, 'iw_pca_fit': 'combined', 'iw_solver': 'lbfgs', 'iw_rho': 0.85}. Best is trial 86 with value: 0.2421509335753262.
2026-06-01 14:49:10 | INFO | Trial 96 | outer=2 | alpha=4.058e+04 n_pcs=3500 (pc_topk) weight={'name': 'pc_logistic', 'floor': 1e-06, 'clip_max': 2.5, 'prob_clip': 0.01356037249197732, 'n_components': 100, 'logistic_c': 0.4586550569497605, 'pca_fit': 'combined', 'solver': 'lbfgs', 'max_iter': 2000, 'fit_intercept': True, 'standardize_with_source': True, 'rho': 1.0}
[I 2026-06-01 14:49:33,888] Trial 96 finished with value: 0.2276625899567978 and parameters: {'alpha': 40575.41737493308, 'n_pcs': 3500, 'iw_method': 'pc_logistic', 'iw_clip_max': 2.5, 'iw_prob_clip': 0.01356037249197732, 'iw_n_components': 100, 'iw_logistic_c': 0.4586550569497605, 'iw_pca_fit': 'combined', 'iw_solver': 'lbfgs', 'iw_rho': 1.0}. Best is trial 86 with value: 0.2421509335753262.
2026-06-01 14:49:33 | INFO | Trial 97 | outer=2 | alpha=1.134e+05 n_pcs=3000 (pc_topk) weight={'name': 'pc_logistic', 'floor': 1e-06, 'clip_max': 2.5, 'prob_clip': 0.009588909462586446, 'n_components': 80, 'logistic_c': 0.00038684712391789965, 'pca_fit': 'combined', 'solver': 'lbfgs', 'max_iter': 2000, 'fit_intercept': True, 'standardize_with_source': True, 'rho': 0.7}
[I 2026-06-01 14:49:46,223] Trial 97 finished with value: 0.24196119050063286 and parameters: {'alpha': 113448.54871044688, 'n_pcs': 3000, 'iw_method': 'pc_logistic', 'iw_clip_max': 2.5, 'iw_prob_clip': 0.009588909462586446, 'iw_n_components': 80, 'iw_logistic_c': 0.00038684712391789965, 'iw_pca_fit': 'combined', 'iw_solver': 'lbfgs', 'iw_rho': 0.7}. Best is trial 86 with value: 0.2421509335753262.
2026-06-01 14:49:46 | INFO | Trial 98 | outer=2 | alpha=1.272e+05 n_pcs=3000 (pc_topk) weight={'name': 'pc_logistic', 'floor': 1e-06, 'clip_max': 2.5, 'prob_clip': 0.010091930701700601, 'n_components': 80, 'logistic_c': 0.0004440828731151606, 'pca_fit': 'combined', 'solver': 'lbfgs', 'max_iter': 2000, 'fit_intercept': True, 'standardize_with_source': True, 'rho': 0.7}
[I 2026-06-01 14:49:57,755] Trial 98 finished with value: 0.242337307651093 and parameters: {'alpha': 127169.12814771719, 'n_pcs': 3000, 'iw_method': 'pc_logistic', 'iw_clip_max': 2.5, 'iw_prob_clip': 0.010091930701700601, 'iw_n_components': 80, 'iw_logistic_c': 0.0004440828731151606, 'iw_pca_fit': 'combined', 'iw_solver': 'lbfgs', 'iw_rho': 0.7}. Best is trial 98 with value: 0.242337307651093.
2026-06-01 14:49:57 | INFO | Trial 99 | outer=2 | alpha=1.680e+05 n_pcs=3000 (pc_topk) weight={'name': 'pc_logistic', 'floor': 1e-06, 'clip_max': 2.5, 'prob_clip': 0.010757506529027861, 'n_components': 80, 'logistic_c': 0.001431004462267729, 'pca_fit': 'combined', 'solver': 'lbfgs', 'max_iter': 2000, 'fit_intercept': True, 'standardize_with_source': True, 'rho': 0.7}
[I 2026-06-01 14:50:11,223] Trial 99 finished with value: 0.2420132789069483 and parameters: {'alpha': 168009.46804031637, 'n_pcs': 3000, 'iw_method': 'pc_logistic', 'iw_clip_max': 2.5, 'iw_prob_clip': 0.010757506529027861, 'iw_n_components': 80, 'iw_logistic_c': 0.001431004462267729, 'iw_pca_fit': 'combined', 'iw_solver': 'lbfgs', 'iw_rho': 0.7}. Best is trial 98 with value: 0.242337307651093.
2026-06-01 14:50:11 | INFO | Trial 100 | outer=2 | alpha=2.592e+05 n_pcs=3000 (pc_topk) weight={'name': 'pc_logistic', 'floor': 1e-06, 'clip_max': 2.5, 'prob_clip': 0.011020372319840703, 'n_components': 80, 'logistic_c': 5.472141602269965, 'pca_fit': 'combined', 'solver': 'lbfgs', 'max_iter': 2000, 'fit_intercept': True, 'standardize_with_source': True, 'rho': 0.7}
[I 2026-06-01 14:50:30,414] Trial 100 finished with value: 0.24062368270294 and parameters: {'alpha': 259228.91945807816, 'n_pcs': 3000, 'iw_method': 'pc_logistic', 'iw_clip_max': 2.5, 'iw_prob_clip': 0.011020372319840703, 'iw_n_components': 80, 'iw_logistic_c': 5.472141602269965, 'iw_pca_fit': 'combined', 'iw_solver': 'lbfgs', 'iw_rho': 0.7}. Best is trial 98 with value: 0.242337307651093.
2026-06-01 14:50:30 | INFO | Trial 101 | outer=2 | alpha=2.466e+05 n_pcs=2500 (pc_topk) weight={'name': 'pc_logistic', 'floor': 1e-06, 'clip_max': 2.5, 'prob_clip': 0.010852929683313656, 'n_components': 80, 'logistic_c': 8.595784390396643, 'pca_fit': 'combined', 'solver': 'lbfgs', 'max_iter': 2000, 'fit_intercept': True, 'standardize_with_source': True, 'rho': 0.7}
[I 2026-06-01 14:50:51,989] Trial 101 finished with value: 0.2394635728817501 and parameters: {'alpha': 246600.88135248882, 'n_pcs': 2500, 'iw_method': 'pc_logistic', 'iw_clip_max': 2.5, 'iw_prob_clip': 0.010852929683313656, 'iw_n_components': 80, 'iw_logistic_c': 8.595784390396643, 'iw_pca_fit': 'combined', 'iw_solver': 'lbfgs', 'iw_rho': 0.7}. Best is trial 98 with value: 0.242337307651093.
2026-06-01 14:50:52 | INFO | Trial 102 | outer=2 | alpha=1.695e+05 n_pcs=3000 (pc_topk) weight={'name': 'pc_logistic', 'floor': 1e-06, 'clip_max': 2.5, 'prob_clip': 0.014820167646242352, 'n_components': 80, 'logistic_c': 3.5654078708376904, 'pca_fit': 'combined', 'solver': 'lbfgs', 'max_iter': 2000, 'fit_intercept': True, 'standardize_with_source': True, 'rho': 0.7}
[I 2026-06-01 14:51:12,083] Trial 102 finished with value: 0.24086645048587502 and parameters: {'alpha': 169450.32891545832, 'n_pcs': 3000, 'iw_method': 'pc_logistic', 'iw_clip_max': 2.5, 'iw_prob_clip': 0.014820167646242352, 'iw_n_components': 80, 'iw_logistic_c': 3.5654078708376904, 'iw_pca_fit': 'combined', 'iw_solver': 'lbfgs', 'iw_rho': 0.7}. Best is trial 98 with value: 0.242337307651093.
2026-06-01 14:51:12 | INFO | Trial 103 | outer=2 | alpha=1.623e+05 n_pcs=3000 (pc_topk) weight={'name': 'pc_logistic', 'floor': 1e-06, 'clip_max': 2.5, 'prob_clip': 0.02045973801323442, 'n_components': 80, 'logistic_c': 7.430147683432824, 'pca_fit': 'combined', 'solver': 'lbfgs', 'max_iter': 2000, 'fit_intercept': True, 'standardize_with_source': True, 'rho': 0.7}
[I 2026-06-01 14:51:31,917] Trial 103 finished with value: 0.24006446535836862 and parameters: {'alpha': 162275.09823902263, 'n_pcs': 3000, 'iw_method': 'pc_logistic', 'iw_clip_max': 2.5, 'iw_prob_clip': 0.02045973801323442, 'iw_n_components': 80, 'iw_logistic_c': 7.430147683432824, 'iw_pca_fit': 'combined', 'iw_solver': 'lbfgs', 'iw_rho': 0.7}. Best is trial 98 with value: 0.242337307651093.
2026-06-01 14:51:31 | INFO | Trial 104 | outer=2 | alpha=2.787e+05 n_pcs=2500 (pc_topk) weight={'name': 'pc_logistic', 'floor': 1e-06, 'clip_max': 2.5, 'prob_clip': 0.016684387658434684, 'n_components': 80, 'logistic_c': 0.6781981900836062, 'pca_fit': 'combined', 'solver': 'lbfgs', 'max_iter': 2000, 'fit_intercept': True, 'standardize_with_source': True, 'rho': 0.7}
[I 2026-06-01 14:51:49,520] Trial 104 finished with value: 0.23854557192583595 and parameters: {'alpha': 278747.05636100116, 'n_pcs': 2500, 'iw_method': 'pc_logistic', 'iw_clip_max': 2.5, 'iw_prob_clip': 0.016684387658434684, 'iw_n_components': 80, 'iw_logistic_c': 0.6781981900836062, 'iw_pca_fit': 'combined', 'iw_solver': 'lbfgs', 'iw_rho': 0.7}. Best is trial 98 with value: 0.242337307651093.
2026-06-01 14:51:49 | INFO | Trial 105 | outer=2 | alpha=3.473e+05 n_pcs=3000 (pc_topk) weight={'name': 'pc_logistic', 'floor': 1e-06, 'clip_max': 2.5, 'prob_clip': 0.009665836099994765, 'n_components': 80, 'logistic_c': 3.7930348041243187, 'pca_fit': 'combined', 'solver': 'lbfgs', 'max_iter': 2000, 'fit_intercept': True, 'standardize_with_source': True, 'rho': 0.7}
[I 2026-06-01 14:52:08,627] Trial 105 finished with value: 0.2395414642013502 and parameters: {'alpha': 347324.28602498653, 'n_pcs': 3000, 'iw_method': 'pc_logistic', 'iw_clip_max': 2.5, 'iw_prob_clip': 0.009665836099994765, 'iw_n_components': 80, 'iw_logistic_c': 3.7930348041243187, 'iw_pca_fit': 'combined', 'iw_solver': 'lbfgs', 'iw_rho': 0.7}. Best is trial 98 with value: 0.242337307651093.
2026-06-01 14:52:08 | INFO | Trial 106 | outer=2 | alpha=8.438e+04 n_pcs=3000 (pc_topk) weight={'name': 'pc_logistic', 'floor': 1e-06, 'clip_max': 2.5, 'prob_clip': 0.015168823604673306, 'n_components': 80, 'logistic_c': 0.23414820332653805, 'pca_fit': 'combined', 'solver': 'lbfgs', 'max_iter': 2000, 'fit_intercept': True, 'standardize_with_source': True, 'rho': 0.7}
[I 2026-06-01 14:52:28,022] Trial 106 finished with value: 0.23888131580796684 and parameters: {'alpha': 84383.7558347037, 'n_pcs': 3000, 'iw_method': 'pc_logistic', 'iw_clip_max': 2.5, 'iw_prob_clip': 0.015168823604673306, 'iw_n_components': 80, 'iw_logistic_c': 0.23414820332653805, 'iw_pca_fit': 'combined', 'iw_solver': 'lbfgs', 'iw_rho': 0.7}. Best is trial 98 with value: 0.242337307651093.
2026-06-01 14:52:28 | INFO | Trial 107 | outer=2 | alpha=1.700e+05 n_pcs=3000 (pc_topk) weight={'name': 'pc_logistic', 'floor': 1e-06, 'clip_max': 2.5, 'prob_clip': 0.019638982214210954, 'n_components': 80, 'logistic_c': 5.093774392318524, 'pca_fit': 'combined', 'solver': 'lbfgs', 'max_iter': 2000, 'fit_intercept': True, 'standardize_with_source': True, 'rho': 0.7}
[I 2026-06-01 14:52:45,609] Trial 107 finished with value: 0.24019005584878889 and parameters: {'alpha': 170031.7041287169, 'n_pcs': 3000, 'iw_method': 'pc_logistic', 'iw_clip_max': 2.5, 'iw_prob_clip': 0.019638982214210954, 'iw_n_components': 80, 'iw_logistic_c': 5.093774392318524, 'iw_pca_fit': 'combined', 'iw_solver': 'lbfgs', 'iw_rho': 0.7}. Best is trial 98 with value: 0.242337307651093.
2026-06-01 14:52:45 | INFO | Trial 108 | outer=2 | alpha=2.372e+05 n_pcs=2500 (pc_topk) weight={'name': 'pc_logistic', 'floor': 1e-06, 'clip_max': 7.0, 'prob_clip': 0.009373081446155259, 'n_components': 80, 'logistic_c': 2.394948025766569, 'pca_fit': 'combined', 'solver': 'lbfgs', 'max_iter': 2000, 'fit_intercept': True, 'standardize_with_source': True, 'rho': 0.5}
[I 2026-06-01 14:53:03,617] Trial 108 finished with value: 0.22945475567616996 and parameters: {'alpha': 237216.84710523006, 'n_pcs': 2500, 'iw_method': 'pc_logistic', 'iw_clip_max': 7.0, 'iw_prob_clip': 0.009373081446155259, 'iw_n_components': 80, 'iw_logistic_c': 2.394948025766569, 'iw_pca_fit': 'combined', 'iw_solver': 'lbfgs', 'iw_rho': 0.5}. Best is trial 98 with value: 0.242337307651093.
2026-06-01 14:53:03 | INFO | Trial 109 | outer=2 | alpha=2.144e+03 n_pcs=3000 (pc_topk) weight={'name': 'pc_logistic', 'floor': 1e-06, 'clip_max': 2.5, 'prob_clip': 0.013108873219912047, 'n_components': 80, 'logistic_c': 0.001773182272435364, 'pca_fit': 'combined', 'solver': 'lbfgs', 'max_iter': 2000, 'fit_intercept': True, 'standardize_with_source': True, 'rho': 0.7}
[I 2026-06-01 14:53:18,442] Trial 109 finished with value: 0.13403022167372064 and parameters: {'alpha': 2144.326179774464, 'n_pcs': 3000, 'iw_method': 'pc_logistic', 'iw_clip_max': 2.5, 'iw_prob_clip': 0.013108873219912047, 'iw_n_components': 80, 'iw_logistic_c': 0.001773182272435364, 'iw_pca_fit': 'combined', 'iw_solver': 'lbfgs', 'iw_rho': 0.7}. Best is trial 98 with value: 0.242337307651093.
2026-06-01 14:53:18 | INFO | Trial 110 | outer=2 | alpha=1.329e+05 n_pcs=2500 (pc_topk) weight={'name': 'pc_logistic', 'floor': 1e-06, 'clip_max': 2.5, 'prob_clip': 0.006780847166629844, 'n_components': 60, 'logistic_c': 0.005175355156382008, 'pca_fit': 'combined', 'solver': 'lbfgs', 'max_iter': 2000, 'fit_intercept': True, 'standardize_with_source': True, 'rho': 0.85}
[I 2026-06-01 14:53:33,971] Trial 110 finished with value: 0.23660665290891317 and parameters: {'alpha': 132860.4324072618, 'n_pcs': 2500, 'iw_method': 'pc_logistic', 'iw_clip_max': 2.5, 'iw_prob_clip': 0.006780847166629844, 'iw_n_components': 60, 'iw_logistic_c': 0.005175355156382008, 'iw_pca_fit': 'combined', 'iw_solver': 'lbfgs', 'iw_rho': 0.85}. Best is trial 98 with value: 0.242337307651093.
2026-06-01 14:53:34 | INFO | Trial 111 | outer=2 | alpha=1.770e+05 n_pcs=3000 (pc_topk) weight={'name': 'pc_logistic', 'floor': 1e-06, 'clip_max': 2.5, 'prob_clip': 0.023381702187890555, 'n_components': 80, 'logistic_c': 4.346104800543846, 'pca_fit': 'combined', 'solver': 'lbfgs', 'max_iter': 2000, 'fit_intercept': True, 'standardize_with_source': True, 'rho': 0.7}
[I 2026-06-01 14:53:55,876] Trial 111 finished with value: 0.23955005700124024 and parameters: {'alpha': 177011.13081127882, 'n_pcs': 3000, 'iw_method': 'pc_logistic', 'iw_clip_max': 2.5, 'iw_prob_clip': 0.023381702187890555, 'iw_n_components': 80, 'iw_logistic_c': 4.346104800543846, 'iw_pca_fit': 'combined', 'iw_solver': 'lbfgs', 'iw_rho': 0.7}. Best is trial 98 with value: 0.242337307651093.
2026-06-01 14:53:55 | INFO | Trial 112 | outer=2 | alpha=1.732e+05 n_pcs=3000 (pc_topk) weight={'name': 'pc_logistic', 'floor': 1e-06, 'clip_max': 2.5, 'prob_clip': 0.01148345560622276, 'n_components': 80, 'logistic_c': 5.312140897238165, 'pca_fit': 'combined', 'solver': 'lbfgs', 'max_iter': 2000, 'fit_intercept': True, 'standardize_with_source': True, 'rho': 0.7}
[I 2026-06-01 14:54:20,062] Trial 112 finished with value: 0.24134709708747235 and parameters: {'alpha': 173201.20946326578, 'n_pcs': 3000, 'iw_method': 'pc_logistic', 'iw_clip_max': 2.5, 'iw_prob_clip': 0.01148345560622276, 'iw_n_components': 80, 'iw_logistic_c': 5.312140897238165, 'iw_pca_fit': 'combined', 'iw_solver': 'lbfgs', 'iw_rho': 0.7}. Best is trial 98 with value: 0.242337307651093.
2026-06-01 14:54:20 | INFO | Trial 113 | outer=2 | alpha=9.704e+04 n_pcs=3000 (pc_topk) weight={'name': 'pc_logistic', 'floor': 1e-06, 'clip_max': 2.5, 'prob_clip': 0.01216320736885374, 'n_components': 80, 'logistic_c': 0.09847985525998981, 'pca_fit': 'combined', 'solver': 'lbfgs', 'max_iter': 2000, 'fit_intercept': True, 'standardize_with_source': True, 'rho': 0.7}
[I 2026-06-01 14:54:38,189] Trial 113 finished with value: 0.23986849340481298 and parameters: {'alpha': 97041.60476299713, 'n_pcs': 3000, 'iw_method': 'pc_logistic', 'iw_clip_max': 2.5, 'iw_prob_clip': 0.01216320736885374, 'iw_n_components': 80, 'iw_logistic_c': 0.09847985525998981, 'iw_pca_fit': 'combined', 'iw_solver': 'lbfgs', 'iw_rho': 0.7}. Best is trial 98 with value: 0.242337307651093.
2026-06-01 14:54:38 | INFO | Trial 114 | outer=2 | alpha=4.293e+05 n_pcs=3000 (pc_topk) weight={'name': 'pc_logistic', 'floor': 1e-06, 'clip_max': 2.5, 'prob_clip': 0.009265483773016493, 'n_components': 10, 'logistic_c': 1.1363349668519644, 'pca_fit': 'combined', 'solver': 'lbfgs', 'max_iter': 2000, 'fit_intercept': True, 'standardize_with_source': True, 'rho': 0.7}
[I 2026-06-01 14:54:49,311] Trial 114 finished with value: 0.2397910713434165 and parameters: {'alpha': 429325.95919047046, 'n_pcs': 3000, 'iw_method': 'pc_logistic', 'iw_clip_max': 2.5, 'iw_prob_clip': 0.009265483773016493, 'iw_n_components': 10, 'iw_logistic_c': 1.1363349668519644, 'iw_pca_fit': 'combined', 'iw_solver': 'lbfgs', 'iw_rho': 0.7}. Best is trial 98 with value: 0.242337307651093.
2026-06-01 14:54:49 | INFO | Trial 115 | outer=2 | alpha=1.243e+05 n_pcs=3000 (pc_topk) weight={'name': 'pc_logistic', 'floor': 1e-06, 'clip_max': 2.5, 'prob_clip': 0.011639647670591278, 'n_components': 80, 'logistic_c': 0.02099374134911304, 'pca_fit': 'combined', 'solver': 'lbfgs', 'max_iter': 2000, 'fit_intercept': True, 'standardize_with_source': True, 'rho': 0.7}
[I 2026-06-01 14:55:05,430] Trial 115 finished with value: 0.2405421514271072 and parameters: {'alpha': 124348.83009043822, 'n_pcs': 3000, 'iw_method': 'pc_logistic', 'iw_clip_max': 2.5, 'iw_prob_clip': 0.011639647670591278, 'iw_n_components': 80, 'iw_logistic_c': 0.02099374134911304, 'iw_pca_fit': 'combined', 'iw_solver': 'lbfgs', 'iw_rho': 0.7}. Best is trial 98 with value: 0.242337307651093.
2026-06-01 14:55:05 | INFO | Trial 116 | outer=2 | alpha=1.241e+05 n_pcs=3000 (pc_topk) weight={'name': 'pc_logistic', 'floor': 1e-06, 'clip_max': 12.0, 'prob_clip': 0.011326847407140165, 'n_components': 100, 'logistic_c': 0.046603771143265034, 'pca_fit': 'combined', 'solver': 'lbfgs', 'max_iter': 2000, 'fit_intercept': True, 'standardize_with_source': True, 'rho': 1.0}
2026-06-01 14:55:23 | INFO | Trial 116 rejected by ESS guard: mean_ess=922.20 threshold=1042.36
