[I 2026-06-01 19:42:50,642] Trial 30 finished with value: 0.21859754549593413 and parameters: {'alpha': 9389.19594146033, 'n_pcs': 5000, 'iw_method': 'uniform'}. Best is trial 23 with value: 0.2324619820588727.
2026-06-01 19:42:50 | INFO | Trial 31 | outer=6 | alpha=2.718e+04 n_pcs=4500 (pc_topk) weight={'name': 'uniform'}
[I 2026-06-01 19:42:58,736] Trial 31 finished with value: 0.2308234537530182 and parameters: {'alpha': 27178.160980055276, 'n_pcs': 4500, 'iw_method': 'uniform'}. Best is trial 23 with value: 0.2324619820588727.
2026-06-01 19:42:58 | INFO | Trial 32 | outer=6 | alpha=5.029e+04 n_pcs=4000 (pc_topk) weight={'name': 'uniform'}
[I 2026-06-01 19:43:05,005] Trial 32 finished with value: 0.23210665831410457 and parameters: {'alpha': 50289.26800820176, 'n_pcs': 4000, 'iw_method': 'uniform'}. Best is trial 23 with value: 0.2324619820588727.
2026-06-01 19:43:05 | INFO | Trial 33 | outer=6 | alpha=9.756e+04 n_pcs=4500 (pc_topk) weight={'name': 'uniform'}
[I 2026-06-01 19:43:12,920] Trial 33 finished with value: 0.2297390830970397 and parameters: {'alpha': 97556.7866170716, 'n_pcs': 4500, 'iw_method': 'uniform'}. Best is trial 23 with value: 0.2324619820588727.
2026-06-01 19:43:12 | INFO | Trial 34 | outer=6 | alpha=1.996e+05 n_pcs=5000 (pc_topk) weight={'name': 'uniform'}
[I 2026-06-01 19:43:21,311] Trial 34 finished with value: 0.2225403427577266 and parameters: {'alpha': 199597.27910878378, 'n_pcs': 5000, 'iw_method': 'uniform'}. Best is trial 23 with value: 0.2324619820588727.
2026-06-01 19:43:21 | INFO | Trial 35 | outer=6 | alpha=2.806e+04 n_pcs=4000 (pc_topk) weight={'name': 'uniform'}
[I 2026-06-01 19:43:27,638] Trial 35 finished with value: 0.22956102763762218 and parameters: {'alpha': 28056.61813333484, 'n_pcs': 4000, 'iw_method': 'uniform'}. Best is trial 23 with value: 0.2324619820588727.
2026-06-01 19:43:27 | INFO | Trial 36 | outer=6 | alpha=6.241e+05 n_pcs=4500 (pc_topk) weight={'name': 'uniform'}
[I 2026-06-01 19:43:35,551] Trial 36 finished with value: 0.21305778864552688 and parameters: {'alpha': 624125.6583528126, 'n_pcs': 4500, 'iw_method': 'uniform'}. Best is trial 23 with value: 0.2324619820588727.
2026-06-01 19:43:35 | INFO | Trial 37 | outer=6 | alpha=1.268e+05 n_pcs=2000 (pc_topk) weight={'name': 'pc_logistic', 'floor': 1e-06, 'clip_max': 7.0, 'prob_clip': 0.012848620177464912, 'n_components': 100, 'logistic_c': 3.898259261647804, 'pca_fit': 'combined', 'solver': 'lbfgs', 'max_iter': 2000, 'fit_intercept': True, 'standardize_with_source': True, 'rho': 0.85}
[I 2026-06-01 19:43:56,868] Trial 37 finished with value: 0.20965694111195976 and parameters: {'alpha': 126834.44383845944, 'n_pcs': 2000, 'iw_method': 'pc_logistic', 'iw_clip_max': 7.0, 'iw_prob_clip': 0.012848620177464912, 'iw_n_components': 100, 'iw_logistic_c': 3.898259261647804, 'iw_pca_fit': 'combined', 'iw_solver': 'lbfgs', 'iw_rho': 0.85}. Best is trial 23 with value: 0.2324619820588727.
2026-06-01 19:43:56 | INFO | Trial 38 | outer=6 | alpha=7.668e+04 n_pcs=3500 (pc_topk) weight={'name': 'uniform'}
[I 2026-06-01 19:44:02,359] Trial 38 finished with value: 0.22896209912879834 and parameters: {'alpha': 76682.79590864351, 'n_pcs': 3500, 'iw_method': 'uniform'}. Best is trial 23 with value: 0.2324619820588727.
2026-06-01 19:44:02 | INFO | Trial 39 | outer=6 | alpha=1.986e+05 n_pcs=5000 (pc_topk) weight={'name': 'pc_logistic', 'floor': 1e-06, 'clip_max': 4.0, 'prob_clip': 0.0005052693826348058, 'n_components': 40, 'logistic_c': 4.248710782266651e-05, 'pca_fit': 'combined', 'solver': 'lbfgs', 'max_iter': 2000, 'fit_intercept': True, 'standardize_with_source': True, 'rho': 0.3}
[I 2026-06-01 19:44:17,160] Trial 39 finished with value: 0.23075135726117094 and parameters: {'alpha': 198584.10059466373, 'n_pcs': 5000, 'iw_method': 'pc_logistic', 'iw_clip_max': 4.0, 'iw_prob_clip': 0.0005052693826348058, 'iw_n_components': 40, 'iw_logistic_c': 4.248710782266651e-05, 'iw_pca_fit': 'combined', 'iw_solver': 'lbfgs', 'iw_rho': 0.3}. Best is trial 23 with value: 0.2324619820588727.
2026-06-01 19:44:17 | INFO | Trial 40 | outer=6 | alpha=1.348e+04 n_pcs=4000 (pc_topk) weight={'name': 'uniform'}
[I 2026-06-01 19:44:23,670] Trial 40 finished with value: 0.21880429327126488 and parameters: {'alpha': 13476.865466835658, 'n_pcs': 4000, 'iw_method': 'uniform'}. Best is trial 23 with value: 0.2324619820588727.
2026-06-01 19:44:23 | INFO | Trial 41 | outer=6 | alpha=3.207e+04 n_pcs=4500 (pc_topk) weight={'name': 'uniform'}
[I 2026-06-01 19:44:31,920] Trial 41 finished with value: 0.2317429257001966 and parameters: {'alpha': 32071.60167661266, 'n_pcs': 4500, 'iw_method': 'uniform'}. Best is trial 23 with value: 0.2324619820588727.
2026-06-01 19:44:31 | INFO | Trial 42 | outer=6 | alpha=4.479e+04 n_pcs=4500 (pc_topk) weight={'name': 'uniform'}
[I 2026-06-01 19:44:40,311] Trial 42 finished with value: 0.23254247196801853 and parameters: {'alpha': 44793.874421778186, 'n_pcs': 4500, 'iw_method': 'uniform'}. Best is trial 42 with value: 0.23254247196801853.
2026-06-01 19:44:40 | INFO | Trial 43 | outer=6 | alpha=5.747e+04 n_pcs=5000 (pc_topk) weight={'name': 'uniform'}
[I 2026-06-01 19:44:49,026] Trial 43 finished with value: 0.23131677031522818 and parameters: {'alpha': 57471.11968977215, 'n_pcs': 5000, 'iw_method': 'uniform'}. Best is trial 42 with value: 0.23254247196801853.
2026-06-01 19:44:49 | INFO | Trial 44 | outer=6 | alpha=2.141e+04 n_pcs=4500 (pc_topk) weight={'name': 'uniform'}
[I 2026-06-01 19:44:57,249] Trial 44 finished with value: 0.2288535916059212 and parameters: {'alpha': 21414.962393845854, 'n_pcs': 4500, 'iw_method': 'uniform'}. Best is trial 42 with value: 0.23254247196801853.
2026-06-01 19:44:57 | INFO | Trial 45 | outer=6 | alpha=9.743e+04 n_pcs=3000 (pc_topk) weight={'name': 'uniform'}
[I 2026-06-01 19:45:01,747] Trial 45 finished with value: 0.22824764745809537 and parameters: {'alpha': 97427.66688273898, 'n_pcs': 3000, 'iw_method': 'uniform'}. Best is trial 42 with value: 0.23254247196801853.
2026-06-01 19:45:01 | INFO | Trial 46 | outer=6 | alpha=4.233e+04 n_pcs=1000 (pc_topk) weight={'name': 'pc_logistic', 'floor': 1e-06, 'clip_max': 12.0, 'prob_clip': 0.011013991625266045, 'n_components': 10, 'logistic_c': 0.011035215134000029, 'pca_fit': 'combined', 'solver': 'lbfgs', 'max_iter': 2000, 'fit_intercept': True, 'standardize_with_source': True, 'rho': 0.7}
[I 2026-06-01 19:45:12,374] Trial 46 finished with value: 0.21213134510952653 and parameters: {'alpha': 42331.155518551735, 'n_pcs': 1000, 'iw_method': 'pc_logistic', 'iw_clip_max': 12.0, 'iw_prob_clip': 0.011013991625266045, 'iw_n_components': 10, 'iw_logistic_c': 0.011035215134000029, 'iw_pca_fit': 'combined', 'iw_solver': 'lbfgs', 'iw_rho': 0.7}. Best is trial 42 with value: 0.23254247196801853.
2026-06-01 19:45:12 | INFO | Trial 47 | outer=6 | alpha=9.253e+03 n_pcs=4000 (pc_topk) weight={'name': 'uniform'}
[I 2026-06-01 19:45:19,062] Trial 47 finished with value: 0.2095611167956711 and parameters: {'alpha': 9253.36474216079, 'n_pcs': 4000, 'iw_method': 'uniform'}. Best is trial 42 with value: 0.23254247196801853.
2026-06-01 19:45:19 | INFO | Trial 48 | outer=6 | alpha=2.008e+05 n_pcs=4500 (pc_topk) weight={'name': 'uniform'}
[I 2026-06-01 19:45:27,266] Trial 48 finished with value: 0.22345471163324798 and parameters: {'alpha': 200799.03567184083, 'n_pcs': 4500, 'iw_method': 'uniform'}. Best is trial 42 with value: 0.23254247196801853.
2026-06-01 19:45:27 | INFO | Trial 49 | outer=6 | alpha=1.465e+04 n_pcs=5000 (pc_topk) weight={'name': 'uniform'}
[I 2026-06-01 19:45:36,019] Trial 49 finished with value: 0.22501467415536575 and parameters: {'alpha': 14650.708410873094, 'n_pcs': 5000, 'iw_method': 'uniform'}. Best is trial 42 with value: 0.23254247196801853.
2026-06-01 19:45:36 | INFO | Trial 50 | outer=6 | alpha=3.274e+03 n_pcs=3500 (pc_topk) weight={'name': 'pc_logistic', 'floor': 1e-06, 'clip_max': 1.5, 'prob_clip': 0.046241509656635975, 'n_components': 60, 'logistic_c': 0.12229879677979144, 'pca_fit': 'combined', 'solver': 'lbfgs', 'max_iter': 2000, 'fit_intercept': True, 'standardize_with_source': True, 'rho': 0.5}
[I 2026-06-01 19:45:56,630] Trial 50 finished with value: 0.1544380063639042 and parameters: {'alpha': 3273.9202551948442, 'n_pcs': 3500, 'iw_method': 'pc_logistic', 'iw_clip_max': 1.5, 'iw_prob_clip': 0.046241509656635975, 'iw_n_components': 60, 'iw_logistic_c': 0.12229879677979144, 'iw_pca_fit': 'combined', 'iw_solver': 'lbfgs', 'iw_rho': 0.5}. Best is trial 42 with value: 0.23254247196801853.
2026-06-01 19:45:56 | INFO | Trial 51 | outer=6 | alpha=4.029e+04 n_pcs=4500 (pc_topk) weight={'name': 'uniform'}
[I 2026-06-01 19:46:05,014] Trial 51 finished with value: 0.23243634114392822 and parameters: {'alpha': 40293.222301594, 'n_pcs': 4500, 'iw_method': 'uniform'}. Best is trial 42 with value: 0.23254247196801853.
2026-06-01 19:46:05 | INFO | Trial 52 | outer=6 | alpha=2.241e+04 n_pcs=4000 (pc_topk) weight={'name': 'uniform'}
[I 2026-06-01 19:46:11,385] Trial 52 finished with value: 0.22722682318217405 and parameters: {'alpha': 22409.920069332577, 'n_pcs': 4000, 'iw_method': 'uniform'}. Best is trial 42 with value: 0.23254247196801853.
2026-06-01 19:46:11 | INFO | Trial 53 | outer=6 | alpha=4.416e+04 n_pcs=4500 (pc_topk) weight={'name': 'uniform'}
[I 2026-06-01 19:46:19,287] Trial 53 finished with value: 0.23253596834983936 and parameters: {'alpha': 44164.49286005219, 'n_pcs': 4500, 'iw_method': 'uniform'}. Best is trial 42 with value: 0.23254247196801853.
2026-06-01 19:46:19 | INFO | Trial 54 | outer=6 | alpha=7.968e+04 n_pcs=5000 (pc_topk) weight={'name': 'uniform'}
[I 2026-06-01 19:46:27,576] Trial 54 finished with value: 0.22997365869374656 and parameters: {'alpha': 79682.41108620766, 'n_pcs': 5000, 'iw_method': 'uniform'}. Best is trial 42 with value: 0.23254247196801853.
2026-06-01 19:46:27 | INFO | Trial 55 | outer=6 | alpha=4.682e+04 n_pcs=4500 (pc_topk) weight={'name': 'uniform'}
[I 2026-06-01 19:46:35,834] Trial 55 finished with value: 0.23254803331336396 and parameters: {'alpha': 46822.91309892988, 'n_pcs': 4500, 'iw_method': 'uniform'}. Best is trial 55 with value: 0.23254803331336396.
2026-06-01 19:46:35 | INFO | Trial 56 | outer=6 | alpha=4.563e+04 n_pcs=4000 (pc_topk) weight={'name': 'uniform'}
[I 2026-06-01 19:46:42,152] Trial 56 finished with value: 0.2320072816843012 and parameters: {'alpha': 45633.67078529831, 'n_pcs': 4000, 'iw_method': 'uniform'}. Best is trial 55 with value: 0.23254803331336396.
2026-06-01 19:46:42 | INFO | Trial 57 | outer=6 | alpha=1.103e+05 n_pcs=5000 (pc_topk) weight={'name': 'uniform'}
[I 2026-06-01 19:46:50,429] Trial 57 finished with value: 0.2278098450514559 and parameters: {'alpha': 110304.82972453177, 'n_pcs': 5000, 'iw_method': 'uniform'}. Best is trial 55 with value: 0.23254803331336396.
2026-06-01 19:46:50 | INFO | Trial 58 | outer=6 | alpha=2.356e+04 n_pcs=4500 (pc_topk) weight={'name': 'uniform'}
[I 2026-06-01 19:46:58,467] Trial 58 finished with value: 0.22973726904245603 and parameters: {'alpha': 23562.9978363361, 'n_pcs': 4500, 'iw_method': 'uniform'}. Best is trial 55 with value: 0.23254803331336396.
2026-06-01 19:46:58 | INFO | Trial 59 | outer=6 | alpha=8.750e+03 n_pcs=4000 (pc_topk) weight={'name': 'uniform'}
[I 2026-06-01 19:47:05,083] Trial 59 finished with value: 0.20796007362204155 and parameters: {'alpha': 8750.484867812494, 'n_pcs': 4000, 'iw_method': 'uniform'}. Best is trial 55 with value: 0.23254803331336396.
2026-06-01 19:47:05 | INFO | Trial 60 | outer=6 | alpha=2.818e+05 n_pcs=4500 (pc_topk) weight={'name': 'uniform'}
[I 2026-06-01 19:47:13,396] Trial 60 finished with value: 0.2201320882792986 and parameters: {'alpha': 281757.320756056, 'n_pcs': 4500, 'iw_method': 'uniform'}. Best is trial 55 with value: 0.23254803331336396.
2026-06-01 19:47:13 | INFO | Trial 61 | outer=6 | alpha=6.298e+04 n_pcs=4500 (pc_topk) weight={'name': 'uniform'}
[I 2026-06-01 19:47:21,694] Trial 61 finished with value: 0.23202991217828398 and parameters: {'alpha': 62979.95002052332, 'n_pcs': 4500, 'iw_method': 'uniform'}. Best is trial 55 with value: 0.23254803331336396.
2026-06-01 19:47:21 | INFO | Trial 62 | outer=6 | alpha=4.681e+04 n_pcs=4500 (pc_topk) weight={'name': 'uniform'}
[I 2026-06-01 19:47:30,004] Trial 62 finished with value: 0.2325481020969798 and parameters: {'alpha': 46807.423231852794, 'n_pcs': 4500, 'iw_method': 'uniform'}. Best is trial 62 with value: 0.2325481020969798.
2026-06-01 19:47:30 | INFO | Trial 63 | outer=6 | alpha=1.681e+04 n_pcs=5000 (pc_topk) weight={'name': 'uniform'}
[I 2026-06-01 19:47:38,401] Trial 63 finished with value: 0.22656955242233684 and parameters: {'alpha': 16810.445282229502, 'n_pcs': 5000, 'iw_method': 'uniform'}. Best is trial 62 with value: 0.2325481020969798.
2026-06-01 19:47:38 | INFO | Trial 64 | outer=6 | alpha=3.417e+04 n_pcs=4500 (pc_topk) weight={'name': 'uniform'}
[I 2026-06-01 19:47:46,638] Trial 64 finished with value: 0.2320010537200014 and parameters: {'alpha': 34171.33449818329, 'n_pcs': 4500, 'iw_method': 'uniform'}. Best is trial 62 with value: 0.2325481020969798.
2026-06-01 19:47:46 | INFO | Trial 65 | outer=6 | alpha=4.546e+04 n_pcs=4000 (pc_topk) weight={'name': 'uniform'}
[I 2026-06-01 19:47:52,989] Trial 65 finished with value: 0.2320009849771274 and parameters: {'alpha': 45462.344268028886, 'n_pcs': 4000, 'iw_method': 'uniform'}. Best is trial 62 with value: 0.2325481020969798.
2026-06-01 19:47:52 | INFO | Trial 66 | outer=6 | alpha=8.351e+04 n_pcs=5000 (pc_topk) weight={'name': 'uniform'}
[I 2026-06-01 19:48:01,421] Trial 66 finished with value: 0.2297073725534166 and parameters: {'alpha': 83508.87695948797, 'n_pcs': 5000, 'iw_method': 'uniform'}. Best is trial 62 with value: 0.2325481020969798.
2026-06-01 19:48:01 | INFO | Trial 67 | outer=6 | alpha=1.592e+05 n_pcs=4500 (pc_topk) weight={'name': 'uniform'}
[I 2026-06-01 19:48:09,488] Trial 67 finished with value: 0.2256746467947183 and parameters: {'alpha': 159223.66394946168, 'n_pcs': 4500, 'iw_method': 'uniform'}. Best is trial 62 with value: 0.2325481020969798.
2026-06-01 19:48:09 | INFO | Trial 68 | outer=6 | alpha=2.815e+04 n_pcs=4000 (pc_topk) weight={'name': 'uniform'}
[I 2026-06-01 19:48:15,966] Trial 68 finished with value: 0.22958974182561503 and parameters: {'alpha': 28150.588535807805, 'n_pcs': 4000, 'iw_method': 'uniform'}. Best is trial 62 with value: 0.2325481020969798.
2026-06-01 19:48:15 | INFO | Trial 69 | outer=6 | alpha=5.763e+04 n_pcs=4500 (pc_topk) weight={'name': 'uniform'}
[I 2026-06-01 19:48:23,896] Trial 69 finished with value: 0.23228224777173262 and parameters: {'alpha': 57632.56667963925, 'n_pcs': 4500, 'iw_method': 'uniform'}. Best is trial 62 with value: 0.2325481020969798.
2026-06-01 19:48:23 | INFO | Trial 70 | outer=6 | alpha=1.948e+04 n_pcs=3500 (pc_topk) weight={'name': 'pc_logistic', 'floor': 1e-06, 'clip_max': 12.0, 'prob_clip': 0.0013952066117696054, 'n_components': 20, 'logistic_c': 1.335994404806016e-06, 'pca_fit': 'combined', 'solver': 'lbfgs', 'max_iter': 2000, 'fit_intercept': True, 'standardize_with_source': True, 'rho': 0.85}
[I 2026-06-01 19:48:34,233] Trial 70 finished with value: 0.21820723534628567 and parameters: {'alpha': 19480.155577869355, 'n_pcs': 3500, 'iw_method': 'pc_logistic', 'iw_clip_max': 12.0, 'iw_prob_clip': 0.0013952066117696054, 'iw_n_components': 20, 'iw_logistic_c': 1.335994404806016e-06, 'iw_pca_fit': 'combined', 'iw_solver': 'lbfgs', 'iw_rho': 0.85}. Best is trial 62 with value: 0.2325481020969798.
2026-06-01 19:48:34 | INFO | Trial 71 | outer=6 | alpha=6.832e+04 n_pcs=4500 (pc_topk) weight={'name': 'uniform'}
[I 2026-06-01 19:48:42,286] Trial 71 finished with value: 0.23173040847551712 and parameters: {'alpha': 68315.70602758342, 'n_pcs': 4500, 'iw_method': 'uniform'}. Best is trial 62 with value: 0.2325481020969798.
2026-06-01 19:48:42 | INFO | Trial 72 | outer=6 | alpha=4.059e+04 n_pcs=4500 (pc_topk) weight={'name': 'uniform'}
[I 2026-06-01 19:48:50,202] Trial 72 finished with value: 0.23244811849596303 and parameters: {'alpha': 40591.07793979385, 'n_pcs': 4500, 'iw_method': 'uniform'}. Best is trial 62 with value: 0.2325481020969798.
2026-06-01 19:48:50 | INFO | Trial 73 | outer=6 | alpha=3.978e+04 n_pcs=4500 (pc_topk) weight={'name': 'uniform'}
[I 2026-06-01 19:48:58,233] Trial 73 finished with value: 0.23241442444778487 and parameters: {'alpha': 39779.61349158859, 'n_pcs': 4500, 'iw_method': 'uniform'}. Best is trial 62 with value: 0.2325481020969798.
2026-06-01 19:48:58 | INFO | Trial 74 | outer=6 | alpha=3.711e+04 n_pcs=5000 (pc_topk) weight={'name': 'uniform'}
[I 2026-06-01 19:49:06,569] Trial 74 finished with value: 0.23150100060455228 and parameters: {'alpha': 37110.92583792574, 'n_pcs': 5000, 'iw_method': 'uniform'}. Best is trial 62 with value: 0.2325481020969798.
2026-06-01 19:49:06 | INFO | Trial 75 | outer=6 | alpha=1.234e+04 n_pcs=4500 (pc_topk) weight={'name': 'uniform'}
[I 2026-06-01 19:49:14,627] Trial 75 finished with value: 0.22117911536288948 and parameters: {'alpha': 12339.9787643194, 'n_pcs': 4500, 'iw_method': 'uniform'}. Best is trial 62 with value: 0.2325481020969798.
2026-06-01 19:49:14 | INFO | Trial 76 | outer=6 | alpha=2.586e+04 n_pcs=2000 (pc_topk) weight={'name': 'uniform'}
[I 2026-06-01 19:49:18,357] Trial 76 finished with value: 0.22083622986717413 and parameters: {'alpha': 25858.97777545754, 'n_pcs': 2000, 'iw_method': 'uniform'}. Best is trial 62 with value: 0.2325481020969798.
2026-06-01 19:49:18 | INFO | Trial 77 | outer=6 | alpha=1.019e+05 n_pcs=4000 (pc_topk) weight={'name': 'uniform'}
[I 2026-06-01 19:49:25,000] Trial 77 finished with value: 0.22968515039172507 and parameters: {'alpha': 101934.9048444214, 'n_pcs': 4000, 'iw_method': 'uniform'}. Best is trial 62 with value: 0.2325481020969798.
2026-06-01 19:49:25 | INFO | Trial 78 | outer=6 | alpha=4.322e+04 n_pcs=5000 (pc_topk) weight={'name': 'uniform'}
[I 2026-06-01 19:49:33,611] Trial 78 finished with value: 0.2316625928739766 and parameters: {'alpha': 43224.02533141631, 'n_pcs': 5000, 'iw_method': 'uniform'}. Best is trial 62 with value: 0.2325481020969798.
2026-06-01 19:49:33 | INFO | Trial 79 | outer=6 | alpha=3.087e+04 n_pcs=4500 (pc_topk) weight={'name': 'uniform'}
[I 2026-06-01 19:49:42,140] Trial 79 finished with value: 0.23156225204022213 and parameters: {'alpha': 30867.701058172133, 'n_pcs': 4500, 'iw_method': 'uniform'}. Best is trial 62 with value: 0.2325481020969798.
2026-06-01 19:49:42 | INFO | Trial 80 | outer=6 | alpha=3.895e+06 n_pcs=4000 (pc_topk) weight={'name': 'uniform'}
[I 2026-06-01 19:49:48,581] Trial 80 finished with value: 0.20493166300682422 and parameters: {'alpha': 3894851.729939354, 'n_pcs': 4000, 'iw_method': 'uniform'}. Best is trial 62 with value: 0.2325481020969798.
2026-06-01 19:49:48 | INFO | Trial 81 | outer=6 | alpha=5.165e+04 n_pcs=4500 (pc_topk) weight={'name': 'uniform'}
[I 2026-06-01 19:49:56,842] Trial 81 finished with value: 0.23248104918414775 and parameters: {'alpha': 51653.46503464551, 'n_pcs': 4500, 'iw_method': 'uniform'}. Best is trial 62 with value: 0.2325481020969798.
2026-06-01 19:49:56 | INFO | Trial 82 | outer=6 | alpha=4.900e+04 n_pcs=4500 (pc_topk) weight={'name': 'uniform'}
[I 2026-06-01 19:50:05,153] Trial 82 finished with value: 0.2325304665479774 and parameters: {'alpha': 48999.12406420924, 'n_pcs': 4500, 'iw_method': 'uniform'}. Best is trial 62 with value: 0.2325481020969798.
2026-06-01 19:50:05 | INFO | Trial 83 | outer=6 | alpha=5.228e+04 n_pcs=4500 (pc_topk) weight={'name': 'uniform'}
[I 2026-06-01 19:50:13,364] Trial 83 finished with value: 0.23246551173926816 and parameters: {'alpha': 52279.784154372814, 'n_pcs': 4500, 'iw_method': 'uniform'}. Best is trial 62 with value: 0.2325481020969798.
2026-06-01 19:50:13 | INFO | Trial 84 | outer=6 | alpha=7.031e+04 n_pcs=5000 (pc_topk) weight={'name': 'uniform'}
[I 2026-06-01 19:50:22,111] Trial 84 finished with value: 0.23059797293479 and parameters: {'alpha': 70309.70812862557, 'n_pcs': 5000, 'iw_method': 'uniform'}. Best is trial 62 with value: 0.2325481020969798.
2026-06-01 19:50:22 | INFO | Trial 85 | outer=6 | alpha=1.478e+05 n_pcs=4500 (pc_topk) weight={'name': 'uniform'}
[I 2026-06-01 19:50:30,572] Trial 85 finished with value: 0.22636198107359834 and parameters: {'alpha': 147760.41662949492, 'n_pcs': 4500, 'iw_method': 'uniform'}. Best is trial 62 with value: 0.2325481020969798.
2026-06-01 19:50:30 | INFO | Trial 86 | outer=6 | alpha=5.404e+04 n_pcs=1500 (pc_topk) weight={'name': 'uniform'}
[I 2026-06-01 19:50:34,017] Trial 86 finished with value: 0.21562476638686187 and parameters: {'alpha': 54039.593000248824, 'n_pcs': 1500, 'iw_method': 'uniform'}. Best is trial 62 with value: 0.2325481020969798.
2026-06-01 19:50:34 | INFO | Trial 87 | outer=6 | alpha=8.916e+04 n_pcs=4000 (pc_topk) weight={'name': 'pc_logistic', 'floor': 1e-06, 'clip_max': 7.0, 'prob_clip': 0.007478701689838295, 'n_components': 100, 'logistic_c': 2.0302184933828308e-05, 'pca_fit': 'combined', 'solver': 'lbfgs', 'max_iter': 2000, 'fit_intercept': True, 'standardize_with_source': True, 'rho': 0.85}
[I 2026-06-01 19:50:45,664] Trial 87 finished with value: 0.23196349807618435 and parameters: {'alpha': 89164.88824521338, 'n_pcs': 4000, 'iw_method': 'pc_logistic', 'iw_clip_max': 7.0, 'iw_prob_clip': 0.007478701689838295, 'iw_n_components': 100, 'iw_logistic_c': 2.0302184933828308e-05, 'iw_pca_fit': 'combined', 'iw_solver': 'lbfgs', 'iw_rho': 0.85}. Best is trial 62 with value: 0.2325481020969798.
2026-06-01 19:50:45 | INFO | Trial 88 | outer=6 | alpha=1.760e+04 n_pcs=4500 (pc_topk) weight={'name': 'uniform'}
[I 2026-06-01 19:50:53,991] Trial 88 finished with value: 0.2266350792126127 and parameters: {'alpha': 17599.641214077485, 'n_pcs': 4500, 'iw_method': 'uniform'}. Best is trial 62 with value: 0.2325481020969798.
2026-06-01 19:50:53 | INFO | Trial 89 | outer=6 | alpha=1.131e+05 n_pcs=5000 (pc_topk) weight={'name': 'uniform'}
