[I 2026-05-31 22:45:40,032] Trial 31 finished with value: 0.25928762301815245 and parameters: {'alpha': 92929.80179191145, 'n_pcs': 4000, 'weight_scheme': 'exponential', 'weight_clip_max': 5.0, 'weight_exponential_beta': 7.049245062440757}. Best is trial 31 with value: 0.25928762301815245.
2026-05-31 22:45:40 | INFO | src.nested_cv_avggrm_weighted_unified | OUTER 1 | new best trial 31 (mean inner r=0.2593) saved to outputs/final_results/e6_pc_ridge_avggrm/thr_wing/e6_pc_ridge_avggrm_thr_wing_best_trials/split_01_best_trial.json
2026-05-31 22:45:40 | INFO | src.nested_cv_avggrm_weighted_unified | Trial 32 | outer=1 | alpha=9.906e+04 n_pcs=4000 (pc_topk) weight_search=on
2026-05-31 22:45:40 | INFO | src.nested_cv_avggrm_weighted_unified | Trial 32 | outer=1 | weight={'name': 'exponential', 'floor': 1e-06, 'clip_max': 5.0, 'beta': 7.940669685592377}
[I 2026-05-31 22:45:46,312] Trial 32 finished with value: 0.2593088350093279 and parameters: {'alpha': 99058.30930151325, 'n_pcs': 4000, 'weight_scheme': 'exponential', 'weight_clip_max': 5.0, 'weight_exponential_beta': 7.940669685592377}. Best is trial 32 with value: 0.2593088350093279.
2026-05-31 22:45:46 | INFO | src.nested_cv_avggrm_weighted_unified | OUTER 1 | new best trial 32 (mean inner r=0.2593) saved to outputs/final_results/e6_pc_ridge_avggrm/thr_wing/e6_pc_ridge_avggrm_thr_wing_best_trials/split_01_best_trial.json
2026-05-31 22:45:46 | INFO | src.nested_cv_avggrm_weighted_unified | Trial 33 | outer=1 | alpha=9.065e+04 n_pcs=4000 (pc_topk) weight_search=on
2026-05-31 22:45:46 | INFO | src.nested_cv_avggrm_weighted_unified | Trial 33 | outer=1 | weight={'name': 'exponential', 'floor': 1e-06, 'clip_max': 5.0, 'beta': 8.156049596685515}
[I 2026-05-31 22:45:52,064] Trial 33 finished with value: 0.2588959931038476 and parameters: {'alpha': 90648.05914680382, 'n_pcs': 4000, 'weight_scheme': 'exponential', 'weight_clip_max': 5.0, 'weight_exponential_beta': 8.156049596685515}. Best is trial 32 with value: 0.2593088350093279.
2026-05-31 22:45:52 | INFO | src.nested_cv_avggrm_weighted_unified | Trial 34 | outer=1 | alpha=1.084e+04 n_pcs=4000 (pc_topk) weight_search=on
2026-05-31 22:45:52 | INFO | src.nested_cv_avggrm_weighted_unified | Trial 34 | outer=1 | weight={'name': 'exponential', 'floor': 1e-06, 'clip_max': 20.0, 'beta': 7.926817223915992}
[I 2026-05-31 22:45:57,814] Trial 34 finished with value: 0.22530924723325985 and parameters: {'alpha': 10843.825136791156, 'n_pcs': 4000, 'weight_scheme': 'exponential', 'weight_clip_max': 20.0, 'weight_exponential_beta': 7.926817223915992}. Best is trial 32 with value: 0.2593088350093279.
2026-05-31 22:45:57 | INFO | src.nested_cv_avggrm_weighted_unified | Trial 35 | outer=1 | alpha=9.268e+04 n_pcs=3500 (pc_topk) weight_search=on
2026-05-31 22:45:57 | INFO | src.nested_cv_avggrm_weighted_unified | Trial 35 | outer=1 | weight={'name': 'exponential', 'floor': 1e-06, 'clip_max': 5.0, 'beta': 9.695521123174931}
[I 2026-05-31 22:46:02,690] Trial 35 finished with value: 0.2547574110200117 and parameters: {'alpha': 92680.35800188646, 'n_pcs': 3500, 'weight_scheme': 'exponential', 'weight_clip_max': 5.0, 'weight_exponential_beta': 9.695521123174931}. Best is trial 32 with value: 0.2593088350093279.
2026-05-31 22:46:02 | INFO | src.nested_cv_avggrm_weighted_unified | Trial 36 | outer=1 | alpha=4.244e+04 n_pcs=4000 (pc_topk) weight_search=on
2026-05-31 22:46:02 | INFO | src.nested_cv_avggrm_weighted_unified | Trial 36 | outer=1 | weight={'name': 'exponential', 'floor': 1e-06, 'clip_max': 10.0, 'beta': 6.211639805036061}
[I 2026-05-31 22:46:08,444] Trial 36 finished with value: 0.2521036363724476 and parameters: {'alpha': 42441.10328483423, 'n_pcs': 4000, 'weight_scheme': 'exponential', 'weight_clip_max': 10.0, 'weight_exponential_beta': 6.211639805036061}. Best is trial 32 with value: 0.2593088350093279.
2026-05-31 22:46:08 | INFO | src.nested_cv_avggrm_weighted_unified | Trial 37 | outer=1 | alpha=3.439e+03 n_pcs=3500 (pc_topk) weight_search=on
2026-05-31 22:46:08 | INFO | src.nested_cv_avggrm_weighted_unified | Trial 37 | outer=1 | weight={'name': 'exponential', 'floor': 1e-06, 'clip_max': None, 'beta': 5.446374609811511}
[I 2026-05-31 22:46:13,335] Trial 37 finished with value: 0.16908486624522961 and parameters: {'alpha': 3439.1039826539277, 'n_pcs': 3500, 'weight_scheme': 'exponential', 'weight_clip_max': None, 'weight_exponential_beta': 5.446374609811511}. Best is trial 32 with value: 0.2593088350093279.
2026-05-31 22:46:13 | INFO | src.nested_cv_avggrm_weighted_unified | Trial 38 | outer=1 | alpha=1.180e+05 n_pcs=4000 (pc_topk) weight_search=on
2026-05-31 22:46:13 | INFO | src.nested_cv_avggrm_weighted_unified | Trial 38 | outer=1 | weight={'name': 'uniform', 'floor': 1e-06, 'clip_max': 5.0}
2026-05-31 22:46:16 | INFO | src.nested_cv_avggrm_weighted_unified | Trial 38 | outer=1 | pruned after 7/10 inner folds (mean r=0.2696)
[I 2026-05-31 22:46:16,773] Trial 38 pruned. 
2026-05-31 22:46:16 | INFO | src.nested_cv_avggrm_weighted_unified | Trial 39 | outer=1 | alpha=3.281e+04 n_pcs=2500 (pc_topk) weight_search=on
2026-05-31 22:46:16 | INFO | src.nested_cv_avggrm_weighted_unified | Trial 39 | outer=1 | weight={'name': 'exponential', 'floor': 1e-06, 'clip_max': 10.0, 'beta': 7.811797121217765}
[I 2026-05-31 22:46:19,746] Trial 39 finished with value: 0.23194312568753053 and parameters: {'alpha': 32812.98495372143, 'n_pcs': 2500, 'weight_scheme': 'exponential', 'weight_clip_max': 10.0, 'weight_exponential_beta': 7.811797121217765}. Best is trial 32 with value: 0.2593088350093279.
2026-05-31 22:46:19 | INFO | src.nested_cv_avggrm_weighted_unified | Trial 40 | outer=1 | alpha=7.415e+04 n_pcs=3000 (pc_topk) weight_search=on
2026-05-31 22:46:19 | INFO | src.nested_cv_avggrm_weighted_unified | Trial 40 | outer=1 | weight={'name': 'exponential', 'floor': 1e-06, 'clip_max': 5.0, 'beta': 8.909897882587188}
[I 2026-05-31 22:46:23,563] Trial 40 finished with value: 0.2531121102854043 and parameters: {'alpha': 74149.96328796606, 'n_pcs': 3000, 'weight_scheme': 'exponential', 'weight_clip_max': 5.0, 'weight_exponential_beta': 8.909897882587188}. Best is trial 32 with value: 0.2593088350093279.
2026-05-31 22:46:23 | INFO | src.nested_cv_avggrm_weighted_unified | Trial 41 | outer=1 | alpha=1.779e+04 n_pcs=4000 (pc_topk) weight_search=on
2026-05-31 22:46:23 | INFO | src.nested_cv_avggrm_weighted_unified | Trial 41 | outer=1 | weight={'name': 'exponential', 'floor': 1e-06, 'clip_max': 5.0, 'beta': 8.487677577684876}
[I 2026-05-31 22:46:29,329] Trial 41 finished with value: 0.23752373414441222 and parameters: {'alpha': 17792.066235904334, 'n_pcs': 4000, 'weight_scheme': 'exponential', 'weight_clip_max': 5.0, 'weight_exponential_beta': 8.487677577684876}. Best is trial 32 with value: 0.2593088350093279.
2026-05-31 22:46:29 | INFO | src.nested_cv_avggrm_weighted_unified | Trial 42 | outer=1 | alpha=6.208e+04 n_pcs=4500 (pc_topk) weight_search=on
2026-05-31 22:46:29 | INFO | src.nested_cv_avggrm_weighted_unified | Trial 42 | outer=1 | weight={'name': 'exponential', 'floor': 1e-06, 'clip_max': 5.0, 'beta': 9.30504470672199}
[I 2026-05-31 22:46:36,283] Trial 42 finished with value: 0.255909984559631 and parameters: {'alpha': 62075.23596379419, 'n_pcs': 4500, 'weight_scheme': 'exponential', 'weight_clip_max': 5.0, 'weight_exponential_beta': 9.30504470672199}. Best is trial 32 with value: 0.2593088350093279.
2026-05-31 22:46:36 | INFO | src.nested_cv_avggrm_weighted_unified | Trial 43 | outer=1 | alpha=1.377e+05 n_pcs=4000 (pc_topk) weight_search=on
2026-05-31 22:46:36 | INFO | src.nested_cv_avggrm_weighted_unified | Trial 43 | outer=1 | weight={'name': 'exponential', 'floor': 1e-06, 'clip_max': 5.0, 'beta': 8.001942236834957}
[I 2026-05-31 22:46:42,007] Trial 43 finished with value: 0.25987350859233793 and parameters: {'alpha': 137734.65981853943, 'n_pcs': 4000, 'weight_scheme': 'exponential', 'weight_clip_max': 5.0, 'weight_exponential_beta': 8.001942236834957}. Best is trial 43 with value: 0.25987350859233793.
2026-05-31 22:46:42 | INFO | src.nested_cv_avggrm_weighted_unified | OUTER 1 | new best trial 43 (mean inner r=0.2599) saved to outputs/final_results/e6_pc_ridge_avggrm/thr_wing/e6_pc_ridge_avggrm_thr_wing_best_trials/split_01_best_trial.json
2026-05-31 22:46:42 | INFO | src.nested_cv_avggrm_weighted_unified | Trial 44 | outer=1 | alpha=1.538e+05 n_pcs=3500 (pc_topk) weight_search=on
2026-05-31 22:46:42 | INFO | src.nested_cv_avggrm_weighted_unified | Trial 44 | outer=1 | weight={'name': 'exponential', 'floor': 1e-06, 'clip_max': 20.0, 'beta': 7.758807303699044}
[I 2026-05-31 22:46:47,292] Trial 44 finished with value: 0.2484783588337482 and parameters: {'alpha': 153807.9246439467, 'n_pcs': 3500, 'weight_scheme': 'exponential', 'weight_clip_max': 20.0, 'weight_exponential_beta': 7.758807303699044}. Best is trial 43 with value: 0.25987350859233793.
2026-05-31 22:46:47 | INFO | src.nested_cv_avggrm_weighted_unified | Trial 45 | outer=1 | alpha=6.261e+05 n_pcs=4500 (pc_topk) weight_search=on
2026-05-31 22:46:47 | INFO | src.nested_cv_avggrm_weighted_unified | Trial 45 | outer=1 | weight={'name': 'exponential', 'floor': 1e-06, 'clip_max': 3.0, 'beta': 6.449446163502196}
[I 2026-05-31 22:46:54,200] Trial 45 finished with value: 0.24899971318859387 and parameters: {'alpha': 626058.5895782404, 'n_pcs': 4500, 'weight_scheme': 'exponential', 'weight_clip_max': 3.0, 'weight_exponential_beta': 6.449446163502196}. Best is trial 43 with value: 0.25987350859233793.
2026-05-31 22:46:54 | INFO | src.nested_cv_avggrm_weighted_unified | Trial 46 | outer=1 | alpha=4.745e+04 n_pcs=5000 (pc_topk) weight_search=on
2026-05-31 22:46:54 | INFO | src.nested_cv_avggrm_weighted_unified | Trial 46 | outer=1 | weight={'name': 'exponential', 'floor': 1e-06, 'clip_max': 5.0, 'beta': 7.348965931295861}
[I 2026-05-31 22:47:02,350] Trial 46 finished with value: 0.25444463596583344 and parameters: {'alpha': 47447.09320449007, 'n_pcs': 5000, 'weight_scheme': 'exponential', 'weight_clip_max': 5.0, 'weight_exponential_beta': 7.348965931295861}. Best is trial 43 with value: 0.25987350859233793.
2026-05-31 22:47:02 | INFO | src.nested_cv_avggrm_weighted_unified | Trial 47 | outer=1 | alpha=4.447e+05 n_pcs=3000 (pc_topk) weight_search=on
2026-05-31 22:47:02 | INFO | src.nested_cv_avggrm_weighted_unified | Trial 47 | outer=1 | weight={'name': 'linear', 'floor': 1e-06, 'clip_max': 5.0, 'min_weight': 0.3629512657579377, 'max_weight': 2.399446156454588}
[I 2026-05-31 22:47:06,167] Trial 47 finished with value: 0.24265545429289262 and parameters: {'alpha': 444735.41588550596, 'n_pcs': 3000, 'weight_scheme': 'linear', 'weight_clip_max': 5.0, 'weight_linear_min_weight': 0.3629512657579377, 'weight_linear_max_weight': 2.399446156454588}. Best is trial 43 with value: 0.25987350859233793.
2026-05-31 22:47:06 | INFO | src.nested_cv_avggrm_weighted_unified | Trial 48 | outer=1 | alpha=1.241e+05 n_pcs=4000 (pc_topk) weight_search=on
2026-05-31 22:47:06 | INFO | src.nested_cv_avggrm_weighted_unified | Trial 48 | outer=1 | weight={'name': 'uniform', 'floor': 1e-06, 'clip_max': 5.0}
2026-05-31 22:47:09 | INFO | src.nested_cv_avggrm_weighted_unified | Trial 48 | outer=1 | pruned after 7/10 inner folds (mean r=0.2692)
[I 2026-05-31 22:47:09,592] Trial 48 pruned. 
2026-05-31 22:47:09 | INFO | src.nested_cv_avggrm_weighted_unified | Trial 49 | outer=1 | alpha=9.602e+05 n_pcs=4000 (pc_topk) weight_search=on
2026-05-31 22:47:09 | INFO | src.nested_cv_avggrm_weighted_unified | Trial 49 | outer=1 | weight={'name': 'exponential', 'floor': 1e-06, 'clip_max': 5.0, 'beta': 8.07777344766517}
[I 2026-05-31 22:47:15,269] Trial 49 finished with value: 0.25010639413158225 and parameters: {'alpha': 960248.6612966019, 'n_pcs': 4000, 'weight_scheme': 'exponential', 'weight_clip_max': 5.0, 'weight_exponential_beta': 8.07777344766517}. Best is trial 43 with value: 0.25987350859233793.
2026-05-31 22:47:15 | INFO | src.nested_cv_avggrm_weighted_unified | Trial 50 | outer=1 | alpha=2.195e+05 n_pcs=2500 (pc_topk) weight_search=on
2026-05-31 22:47:15 | INFO | src.nested_cv_avggrm_weighted_unified | Trial 50 | outer=1 | weight={'name': 'linear', 'floor': 1e-06, 'clip_max': 3.0, 'min_weight': 0.31994018115236955, 'max_weight': 3.4117078324545704}
[I 2026-05-31 22:47:18,241] Trial 50 finished with value: 0.24886243708458083 and parameters: {'alpha': 219499.6226024299, 'n_pcs': 2500, 'weight_scheme': 'linear', 'weight_clip_max': 3.0, 'weight_linear_min_weight': 0.31994018115236955, 'weight_linear_max_weight': 3.4117078324545704}. Best is trial 43 with value: 0.25987350859233793.
2026-05-31 22:47:18 | INFO | src.nested_cv_avggrm_weighted_unified | Trial 51 | outer=1 | alpha=8.198e+04 n_pcs=4000 (pc_topk) weight_search=on
2026-05-31 22:47:18 | INFO | src.nested_cv_avggrm_weighted_unified | Trial 51 | outer=1 | weight={'name': 'exponential', 'floor': 1e-06, 'clip_max': 5.0, 'beta': 8.536492216071743}
[I 2026-05-31 22:47:23,963] Trial 51 finished with value: 0.25818924139046195 and parameters: {'alpha': 81979.57899868369, 'n_pcs': 4000, 'weight_scheme': 'exponential', 'weight_clip_max': 5.0, 'weight_exponential_beta': 8.536492216071743}. Best is trial 43 with value: 0.25987350859233793.
2026-05-31 22:47:23 | INFO | src.nested_cv_avggrm_weighted_unified | Trial 52 | outer=1 | alpha=7.180e+04 n_pcs=3500 (pc_topk) weight_search=on
2026-05-31 22:47:23 | INFO | src.nested_cv_avggrm_weighted_unified | Trial 52 | outer=1 | weight={'name': 'exponential', 'floor': 1e-06, 'clip_max': 5.0, 'beta': 8.76359479387387}
[I 2026-05-31 22:47:28,848] Trial 52 finished with value: 0.2540646959047741 and parameters: {'alpha': 71798.64014518193, 'n_pcs': 3500, 'weight_scheme': 'exponential', 'weight_clip_max': 5.0, 'weight_exponential_beta': 8.76359479387387}. Best is trial 43 with value: 0.25987350859233793.
2026-05-31 22:47:28 | INFO | src.nested_cv_avggrm_weighted_unified | Trial 53 | outer=1 | alpha=4.064e+04 n_pcs=4500 (pc_topk) weight_search=on
2026-05-31 22:47:28 | INFO | src.nested_cv_avggrm_weighted_unified | Trial 53 | outer=1 | weight={'name': 'exponential', 'floor': 1e-06, 'clip_max': 5.0, 'beta': 9.321579694802612}
[I 2026-05-31 22:47:35,836] Trial 53 finished with value: 0.25226562197392666 and parameters: {'alpha': 40635.79056843829, 'n_pcs': 4500, 'weight_scheme': 'exponential', 'weight_clip_max': 5.0, 'weight_exponential_beta': 9.321579694802612}. Best is trial 43 with value: 0.25987350859233793.
2026-05-31 22:47:35 | INFO | src.nested_cv_avggrm_weighted_unified | Trial 54 | outer=1 | alpha=1.562e+05 n_pcs=4500 (pc_topk) weight_search=on
2026-05-31 22:47:35 | INFO | src.nested_cv_avggrm_weighted_unified | Trial 54 | outer=1 | weight={'name': 'exponential', 'floor': 1e-06, 'clip_max': 5.0, 'beta': 7.40569855294745}
[I 2026-05-31 22:47:42,740] Trial 54 finished with value: 0.25893146962179847 and parameters: {'alpha': 156200.28004467156, 'n_pcs': 4500, 'weight_scheme': 'exponential', 'weight_clip_max': 5.0, 'weight_exponential_beta': 7.40569855294745}. Best is trial 43 with value: 0.25987350859233793.
2026-05-31 22:47:42 | INFO | src.nested_cv_avggrm_weighted_unified | Trial 55 | outer=1 | alpha=1.730e+05 n_pcs=5000 (pc_topk) weight_search=on
2026-05-31 22:47:42 | INFO | src.nested_cv_avggrm_weighted_unified | Trial 55 | outer=1 | weight={'name': 'exponential', 'floor': 1e-06, 'clip_max': 5.0, 'beta': 7.157142695637666}
[I 2026-05-31 22:47:50,870] Trial 55 finished with value: 0.25758348884089577 and parameters: {'alpha': 172992.5810669785, 'n_pcs': 5000, 'weight_scheme': 'exponential', 'weight_clip_max': 5.0, 'weight_exponential_beta': 7.157142695637666}. Best is trial 43 with value: 0.25987350859233793.
2026-05-31 22:47:50 | INFO | src.nested_cv_avggrm_weighted_unified | Trial 56 | outer=1 | alpha=2.039e+04 n_pcs=4500 (pc_topk) weight_search=on
2026-05-31 22:47:50 | INFO | src.nested_cv_avggrm_weighted_unified | Trial 56 | outer=1 | weight={'name': 'exponential', 'floor': 1e-06, 'clip_max': 5.0, 'beta': 3.92742497242301}
[I 2026-05-31 22:47:57,830] Trial 56 finished with value: 0.24702196533878135 and parameters: {'alpha': 20392.920195604274, 'n_pcs': 4500, 'weight_scheme': 'exponential', 'weight_clip_max': 5.0, 'weight_exponential_beta': 3.92742497242301}. Best is trial 43 with value: 0.25987350859233793.
2026-05-31 22:47:57 | INFO | src.nested_cv_avggrm_weighted_unified | Trial 57 | outer=1 | alpha=1.304e+05 n_pcs=4500 (pc_topk) weight_search=on
2026-05-31 22:47:57 | INFO | src.nested_cv_avggrm_weighted_unified | Trial 57 | outer=1 | weight={'name': 'exponential', 'floor': 1e-06, 'clip_max': None, 'beta': 0.5815214640184019}
2026-05-31 22:48:02 | INFO | src.nested_cv_avggrm_weighted_unified | Trial 57 | outer=1 | pruned after 7/10 inner folds (mean r=0.2760)
[I 2026-05-31 22:48:02,687] Trial 57 pruned. 
2026-05-31 22:48:02 | INFO | src.nested_cv_avggrm_weighted_unified | Trial 58 | outer=1 | alpha=2.303e+05 n_pcs=5000 (pc_topk) weight_search=on
2026-05-31 22:48:02 | INFO | src.nested_cv_avggrm_weighted_unified | Trial 58 | outer=1 | weight={'name': 'exponential', 'floor': 1e-06, 'clip_max': 5.0, 'beta': 5.745734298617629}
[I 2026-05-31 22:48:10,810] Trial 58 finished with value: 0.255738057440403 and parameters: {'alpha': 230313.35139564733, 'n_pcs': 5000, 'weight_scheme': 'exponential', 'weight_clip_max': 5.0, 'weight_exponential_beta': 5.745734298617629}. Best is trial 43 with value: 0.25987350859233793.
2026-05-31 22:48:10 | INFO | src.nested_cv_avggrm_weighted_unified | Trial 59 | outer=1 | alpha=4.287e+05 n_pcs=4000 (pc_topk) weight_search=on
2026-05-31 22:48:10 | INFO | src.nested_cv_avggrm_weighted_unified | Trial 59 | outer=1 | weight={'name': 'linear', 'floor': 1e-06, 'clip_max': 10.0, 'min_weight': 0.6453295675053757, 'max_weight': 2.2885197165382296}
2026-05-31 22:48:14 | INFO | src.nested_cv_avggrm_weighted_unified | Trial 59 | outer=1 | pruned after 7/10 inner folds (mean r=0.2755)
[I 2026-05-31 22:48:14,834] Trial 59 pruned. 
2026-05-31 22:48:14 | INFO | src.nested_cv_avggrm_weighted_unified | Trial 60 | outer=1 | alpha=1.217e+04 n_pcs=3000 (pc_topk) weight_search=on
2026-05-31 22:48:14 | INFO | src.nested_cv_avggrm_weighted_unified | Trial 60 | outer=1 | weight={'name': 'exponential', 'floor': 1e-06, 'clip_max': 20.0, 'beta': 6.647421467416009}
[I 2026-05-31 22:48:18,733] Trial 60 finished with value: 0.21550435231777504 and parameters: {'alpha': 12168.173864979455, 'n_pcs': 3000, 'weight_scheme': 'exponential', 'weight_clip_max': 20.0, 'weight_exponential_beta': 6.647421467416009}. Best is trial 43 with value: 0.25987350859233793.
2026-05-31 22:48:18 | INFO | src.nested_cv_avggrm_weighted_unified | Trial 61 | outer=1 | alpha=9.360e+04 n_pcs=4000 (pc_topk) weight_search=on
2026-05-31 22:48:18 | INFO | src.nested_cv_avggrm_weighted_unified | Trial 61 | outer=1 | weight={'name': 'exponential', 'floor': 1e-06, 'clip_max': 5.0, 'beta': 7.986985775534848}
[I 2026-05-31 22:48:24,462] Trial 61 finished with value: 0.2590965600533713 and parameters: {'alpha': 93602.83487590829, 'n_pcs': 4000, 'weight_scheme': 'exponential', 'weight_clip_max': 5.0, 'weight_exponential_beta': 7.986985775534848}. Best is trial 43 with value: 0.25987350859233793.
2026-05-31 22:48:24 | INFO | src.nested_cv_avggrm_weighted_unified | Trial 62 | outer=1 | alpha=9.895e+04 n_pcs=3500 (pc_topk) weight_search=on
2026-05-31 22:48:24 | INFO | src.nested_cv_avggrm_weighted_unified | Trial 62 | outer=1 | weight={'name': 'exponential', 'floor': 1e-06, 'clip_max': 5.0, 'beta': 7.571095002135324}
[I 2026-05-31 22:48:29,333] Trial 62 finished with value: 0.25706732737330956 and parameters: {'alpha': 98949.30567912817, 'n_pcs': 3500, 'weight_scheme': 'exponential', 'weight_clip_max': 5.0, 'weight_exponential_beta': 7.571095002135324}. Best is trial 43 with value: 0.25987350859233793.
2026-05-31 22:48:29 | INFO | src.nested_cv_avggrm_weighted_unified | Trial 63 | outer=1 | alpha=5.352e+04 n_pcs=4000 (pc_topk) weight_search=on
2026-05-31 22:48:29 | INFO | src.nested_cv_avggrm_weighted_unified | Trial 63 | outer=1 | weight={'name': 'exponential', 'floor': 1e-06, 'clip_max': 5.0, 'beta': 8.137801644225167}
[I 2026-05-31 22:48:35,075] Trial 63 finished with value: 0.2553493402926933 and parameters: {'alpha': 53521.24783409578, 'n_pcs': 4000, 'weight_scheme': 'exponential', 'weight_clip_max': 5.0, 'weight_exponential_beta': 8.137801644225167}. Best is trial 43 with value: 0.25987350859233793.
2026-05-31 22:48:35 | INFO | src.nested_cv_avggrm_weighted_unified | Trial 64 | outer=1 | alpha=1.628e+05 n_pcs=4500 (pc_topk) weight_search=on
2026-05-31 22:48:35 | INFO | src.nested_cv_avggrm_weighted_unified | Trial 64 | outer=1 | weight={'name': 'exponential', 'floor': 1e-06, 'clip_max': 5.0, 'beta': 7.0916798512408965}
[I 2026-05-31 22:48:42,010] Trial 64 finished with value: 0.2587466938999584 and parameters: {'alpha': 162849.10179445136, 'n_pcs': 4500, 'weight_scheme': 'exponential', 'weight_clip_max': 5.0, 'weight_exponential_beta': 7.0916798512408965}. Best is trial 43 with value: 0.25987350859233793.
2026-05-31 22:48:42 | INFO | src.nested_cv_avggrm_weighted_unified | Trial 65 | outer=1 | alpha=2.987e+04 n_pcs=500 (pc_topk) weight_search=on
2026-05-31 22:48:42 | INFO | src.nested_cv_avggrm_weighted_unified | Trial 65 | outer=1 | weight={'name': 'exponential', 'floor': 1e-06, 'clip_max': 5.0, 'beta': 6.381701365933873}
2026-05-31 22:48:42 | INFO | src.nested_cv_avggrm_weighted_unified | Trial 65 | outer=1 | pruned after 6/10 inner folds (mean r=0.2103)
[I 2026-05-31 22:48:42,583] Trial 65 pruned. 
2026-05-31 22:48:42 | INFO | src.nested_cv_avggrm_weighted_unified | Trial 66 | outer=1 | alpha=2.933e+05 n_pcs=4500 (pc_topk) weight_search=on
2026-05-31 22:48:42 | INFO | src.nested_cv_avggrm_weighted_unified | Trial 66 | outer=1 | weight={'name': 'uniform', 'floor': 1e-06, 'clip_max': 5.0}
2026-05-31 22:48:46 | INFO | src.nested_cv_avggrm_weighted_unified | Trial 66 | outer=1 | pruned after 6/10 inner folds (mean r=0.2358)
