[I 2026-06-01 13:11:16,593] Trial 31 finished with value: 0.25130556432521256 and parameters: {'alpha': 121090.93715545547, 'n_pcs': 2000, 'iw_method': 'pc_logistic', 'iw_clip_max': 4.0, 'iw_prob_clip': 0.007159763669426219, 'iw_n_components': 100, 'iw_logistic_c': 0.00011481830887254837, 'iw_pca_fit': 'combined', 'iw_solver': 'lbfgs', 'iw_rho': 0.7}. Best is trial 31 with value: 0.25130556432521256.
2026-06-01 13:11:16 | INFO | Trial 32 | outer=1 | alpha=8.153e+05 n_pcs=1500 (pc_topk) weight={'name': 'pc_logistic', 'floor': 1e-06, 'clip_max': 4.0, 'prob_clip': 0.004802830940126756, 'n_components': 100, 'logistic_c': 0.002392838136433322, 'pca_fit': 'combined', 'solver': 'lbfgs', 'max_iter': 2000, 'fit_intercept': True, 'standardize_with_source': True, 'rho': 0.7}
[I 2026-06-01 13:11:30,451] Trial 32 finished with value: 0.23565770517979895 and parameters: {'alpha': 815261.3240144432, 'n_pcs': 1500, 'iw_method': 'pc_logistic', 'iw_clip_max': 4.0, 'iw_prob_clip': 0.004802830940126756, 'iw_n_components': 100, 'iw_logistic_c': 0.002392838136433322, 'iw_pca_fit': 'combined', 'iw_solver': 'lbfgs', 'iw_rho': 0.7}. Best is trial 31 with value: 0.25130556432521256.
2026-06-01 13:11:30 | INFO | Trial 33 | outer=1 | alpha=1.542e+05 n_pcs=2000 (pc_topk) weight={'name': 'pc_logistic', 'floor': 1e-06, 'clip_max': 4.0, 'prob_clip': 0.0028732505671215146, 'n_components': 100, 'logistic_c': 0.0001236164795040654, 'pca_fit': 'combined', 'solver': 'lbfgs', 'max_iter': 2000, 'fit_intercept': True, 'standardize_with_source': True, 'rho': 0.7}
[I 2026-06-01 13:11:40,545] Trial 33 finished with value: 0.25137294449925773 and parameters: {'alpha': 154208.8062130731, 'n_pcs': 2000, 'iw_method': 'pc_logistic', 'iw_clip_max': 4.0, 'iw_prob_clip': 0.0028732505671215146, 'iw_n_components': 100, 'iw_logistic_c': 0.0001236164795040654, 'iw_pca_fit': 'combined', 'iw_solver': 'lbfgs', 'iw_rho': 0.7}. Best is trial 33 with value: 0.25137294449925773.
2026-06-01 13:11:40 | INFO | Trial 34 | outer=1 | alpha=1.602e+05 n_pcs=1500 (pc_topk) weight={'name': 'pc_logistic', 'floor': 1e-06, 'clip_max': 4.0, 'prob_clip': 0.0024862181110518414, 'n_components': 100, 'logistic_c': 0.0002090629732624516, 'pca_fit': 'combined', 'solver': 'lbfgs', 'max_iter': 2000, 'fit_intercept': True, 'standardize_with_source': True, 'rho': 0.7}
[I 2026-06-01 13:11:50,136] Trial 34 finished with value: 0.24697859514004822 and parameters: {'alpha': 160164.03301541304, 'n_pcs': 1500, 'iw_method': 'pc_logistic', 'iw_clip_max': 4.0, 'iw_prob_clip': 0.0024862181110518414, 'iw_n_components': 100, 'iw_logistic_c': 0.0002090629732624516, 'iw_pca_fit': 'combined', 'iw_solver': 'lbfgs', 'iw_rho': 0.7}. Best is trial 33 with value: 0.25137294449925773.
2026-06-01 13:11:50 | INFO | Trial 35 | outer=1 | alpha=1.154e+05 n_pcs=2000 (pc_topk) weight={'name': 'pc_logistic', 'floor': 1e-06, 'clip_max': 4.0, 'prob_clip': 0.006239860461053019, 'n_components': 100, 'logistic_c': 0.001541460539899401, 'pca_fit': 'combined', 'solver': 'lbfgs', 'max_iter': 2000, 'fit_intercept': True, 'standardize_with_source': True, 'rho': 0.7}
[I 2026-06-01 13:12:03,947] Trial 35 finished with value: 0.24669060239168408 and parameters: {'alpha': 115437.87952013928, 'n_pcs': 2000, 'iw_method': 'pc_logistic', 'iw_clip_max': 4.0, 'iw_prob_clip': 0.006239860461053019, 'iw_n_components': 100, 'iw_logistic_c': 0.001541460539899401, 'iw_pca_fit': 'combined', 'iw_solver': 'lbfgs', 'iw_rho': 0.7}. Best is trial 33 with value: 0.25137294449925773.
2026-06-01 13:12:03 | INFO | Trial 36 | outer=1 | alpha=1.939e+05 n_pcs=1500 (pc_topk) weight={'name': 'pc_logistic', 'floor': 1e-06, 'clip_max': 4.0, 'prob_clip': 0.003325005158371355, 'n_components': 100, 'logistic_c': 0.011777331394323218, 'pca_fit': 'combined', 'solver': 'lbfgs', 'max_iter': 2000, 'fit_intercept': True, 'standardize_with_source': True, 'rho': 0.7}
[I 2026-06-01 13:12:19,428] Trial 36 finished with value: 0.23933878935777372 and parameters: {'alpha': 193924.2589574872, 'n_pcs': 1500, 'iw_method': 'pc_logistic', 'iw_clip_max': 4.0, 'iw_prob_clip': 0.003325005158371355, 'iw_n_components': 100, 'iw_logistic_c': 0.011777331394323218, 'iw_pca_fit': 'combined', 'iw_solver': 'lbfgs', 'iw_rho': 0.7}. Best is trial 33 with value: 0.25137294449925773.
2026-06-01 13:12:19 | INFO | Trial 37 | outer=1 | alpha=4.825e+05 n_pcs=1000 (pc_topk) weight={'name': 'pc_logistic', 'floor': 1e-06, 'clip_max': 4.0, 'prob_clip': 0.0016669148192662248, 'n_components': 100, 'logistic_c': 0.00012633727752749366, 'pca_fit': 'combined', 'solver': 'lbfgs', 'max_iter': 2000, 'fit_intercept': True, 'standardize_with_source': True, 'rho': 0.7}
[I 2026-06-01 13:12:28,231] Trial 37 finished with value: 0.2421908396384677 and parameters: {'alpha': 482489.62960713357, 'n_pcs': 1000, 'iw_method': 'pc_logistic', 'iw_clip_max': 4.0, 'iw_prob_clip': 0.0016669148192662248, 'iw_n_components': 100, 'iw_logistic_c': 0.00012633727752749366, 'iw_pca_fit': 'combined', 'iw_solver': 'lbfgs', 'iw_rho': 0.7}. Best is trial 33 with value: 0.25137294449925773.
2026-06-01 13:12:28 | INFO | Trial 38 | outer=1 | alpha=9.312e+04 n_pcs=2000 (pc_topk) weight={'name': 'pc_logistic', 'floor': 1e-06, 'clip_max': 4.0, 'prob_clip': 0.010278151338816446, 'n_components': 100, 'logistic_c': 0.0007369895805073686, 'pca_fit': 'combined', 'solver': 'lbfgs', 'max_iter': 2000, 'fit_intercept': True, 'standardize_with_source': True, 'rho': 0.5}
[I 2026-06-01 13:12:40,438] Trial 38 finished with value: 0.24731976333734013 and parameters: {'alpha': 93122.31643209967, 'n_pcs': 2000, 'iw_method': 'pc_logistic', 'iw_clip_max': 4.0, 'iw_prob_clip': 0.010278151338816446, 'iw_n_components': 100, 'iw_logistic_c': 0.0007369895805073686, 'iw_pca_fit': 'combined', 'iw_solver': 'lbfgs', 'iw_rho': 0.5}. Best is trial 33 with value: 0.25137294449925773.
2026-06-01 13:12:40 | INFO | Trial 39 | outer=1 | alpha=2.032e+06 n_pcs=1000 (pc_topk) weight={'name': 'uniform'}
[I 2026-06-01 13:12:43,195] Trial 39 finished with value: 0.2093813201421706 and parameters: {'alpha': 2032350.0764599193, 'n_pcs': 1000, 'iw_method': 'uniform'}. Best is trial 33 with value: 0.25137294449925773.
2026-06-01 13:12:43 | INFO | Trial 40 | outer=1 | alpha=1.913e+05 n_pcs=2000 (pc_topk) weight={'name': 'pc_logistic', 'floor': 1e-06, 'clip_max': 1.5, 'prob_clip': 0.001943316978324795, 'n_components': 60, 'logistic_c': 0.21978201409127646, 'pca_fit': 'combined', 'solver': 'lbfgs', 'max_iter': 2000, 'fit_intercept': True, 'standardize_with_source': True, 'rho': 0.3}
[I 2026-06-01 13:13:00,309] Trial 40 finished with value: 0.24022580902618315 and parameters: {'alpha': 191282.6291294479, 'n_pcs': 2000, 'iw_method': 'pc_logistic', 'iw_clip_max': 1.5, 'iw_prob_clip': 0.001943316978324795, 'iw_n_components': 60, 'iw_logistic_c': 0.21978201409127646, 'iw_pca_fit': 'combined', 'iw_solver': 'lbfgs', 'iw_rho': 0.3}. Best is trial 33 with value: 0.25137294449925773.
2026-06-01 13:13:00 | INFO | Trial 41 | outer=1 | alpha=8.988e+04 n_pcs=1500 (pc_topk) weight={'name': 'pc_logistic', 'floor': 1e-06, 'clip_max': 4.0, 'prob_clip': 0.0011918786102997616, 'n_components': 10, 'logistic_c': 7.348431678910632e-05, 'pca_fit': 'combined', 'solver': 'lbfgs', 'max_iter': 2000, 'fit_intercept': True, 'standardize_with_source': True, 'rho': 0.7}
[I 2026-06-01 13:13:08,409] Trial 41 finished with value: 0.23928844962301993 and parameters: {'alpha': 89881.2820975461, 'n_pcs': 1500, 'iw_method': 'pc_logistic', 'iw_clip_max': 4.0, 'iw_prob_clip': 0.0011918786102997616, 'iw_n_components': 10, 'iw_logistic_c': 7.348431678910632e-05, 'iw_pca_fit': 'combined', 'iw_solver': 'lbfgs', 'iw_rho': 0.7}. Best is trial 33 with value: 0.25137294449925773.
2026-06-01 13:13:08 | INFO | Trial 42 | outer=1 | alpha=2.562e+05 n_pcs=2000 (pc_topk) weight={'name': 'pc_logistic', 'floor': 1e-06, 'clip_max': 4.0, 'prob_clip': 0.0056539218585880905, 'n_components': 100, 'logistic_c': 0.00014165867277381565, 'pca_fit': 'combined', 'solver': 'lbfgs', 'max_iter': 2000, 'fit_intercept': True, 'standardize_with_source': True, 'rho': 0.7}
[I 2026-06-01 13:13:16,562] Trial 42 finished with value: 0.25026842943100536 and parameters: {'alpha': 256249.82347421005, 'n_pcs': 2000, 'iw_method': 'pc_logistic', 'iw_clip_max': 4.0, 'iw_prob_clip': 0.0056539218585880905, 'iw_n_components': 100, 'iw_logistic_c': 0.00014165867277381565, 'iw_pca_fit': 'combined', 'iw_solver': 'lbfgs', 'iw_rho': 0.7}. Best is trial 33 with value: 0.25137294449925773.
2026-06-01 13:13:16 | INFO | Trial 43 | outer=1 | alpha=2.641e+05 n_pcs=2000 (pc_topk) weight={'name': 'pc_logistic', 'floor': 1e-06, 'clip_max': 4.0, 'prob_clip': 0.006018190256681869, 'n_components': 100, 'logistic_c': 0.0002346896595509143, 'pca_fit': 'combined', 'solver': 'lbfgs', 'max_iter': 2000, 'fit_intercept': True, 'standardize_with_source': True, 'rho': 1.0}
[I 2026-06-01 13:13:25,192] Trial 43 finished with value: 0.24486019629610803 and parameters: {'alpha': 264069.087472414, 'n_pcs': 2000, 'iw_method': 'pc_logistic', 'iw_clip_max': 4.0, 'iw_prob_clip': 0.006018190256681869, 'iw_n_components': 100, 'iw_logistic_c': 0.0002346896595509143, 'iw_pca_fit': 'combined', 'iw_solver': 'lbfgs', 'iw_rho': 1.0}. Best is trial 33 with value: 0.25137294449925773.
2026-06-01 13:13:25 | INFO | Trial 44 | outer=1 | alpha=3.871e+05 n_pcs=1500 (pc_topk) weight={'name': 'pc_logistic', 'floor': 1e-06, 'clip_max': 4.0, 'prob_clip': 0.004349859699508064, 'n_components': 100, 'logistic_c': 0.0008906812946689453, 'pca_fit': 'combined', 'solver': 'lbfgs', 'max_iter': 2000, 'fit_intercept': True, 'standardize_with_source': True, 'rho': 0.7}
[I 2026-06-01 13:13:35,206] Trial 44 finished with value: 0.24258377508800488 and parameters: {'alpha': 387061.51974866353, 'n_pcs': 1500, 'iw_method': 'pc_logistic', 'iw_clip_max': 4.0, 'iw_prob_clip': 0.004349859699508064, 'iw_n_components': 100, 'iw_logistic_c': 0.0008906812946689453, 'iw_pca_fit': 'combined', 'iw_solver': 'lbfgs', 'iw_rho': 0.7}. Best is trial 33 with value: 0.25137294449925773.
2026-06-01 13:13:35 | INFO | Trial 45 | outer=1 | alpha=6.604e+05 n_pcs=1000 (pc_topk) weight={'name': 'pc_logistic', 'floor': 1e-06, 'clip_max': 4.0, 'prob_clip': 0.0058176599377468274, 'n_components': 100, 'logistic_c': 6.564968281657198, 'pca_fit': 'combined', 'solver': 'lbfgs', 'max_iter': 2000, 'fit_intercept': True, 'standardize_with_source': True, 'rho': 0.7}
[I 2026-06-01 13:13:57,823] Trial 45 finished with value: 0.2349179124292912 and parameters: {'alpha': 660400.269406145, 'n_pcs': 1000, 'iw_method': 'pc_logistic', 'iw_clip_max': 4.0, 'iw_prob_clip': 0.0058176599377468274, 'iw_n_components': 100, 'iw_logistic_c': 6.564968281657198, 'iw_pca_fit': 'combined', 'iw_solver': 'lbfgs', 'iw_rho': 0.7}. Best is trial 33 with value: 0.25137294449925773.
2026-06-01 13:13:57 | INFO | Trial 46 | outer=1 | alpha=1.873e+06 n_pcs=2000 (pc_topk) weight={'name': 'pc_logistic', 'floor': 1e-06, 'clip_max': 4.0, 'prob_clip': 0.0038076829098568393, 'n_components': 20, 'logistic_c': 1.3188638429042457e-06, 'pca_fit': 'combined', 'solver': 'lbfgs', 'max_iter': 2000, 'fit_intercept': True, 'standardize_with_source': True, 'rho': 1.0}
[I 2026-06-01 13:14:05,590] Trial 46 finished with value: 0.21816995544717618 and parameters: {'alpha': 1873455.5525825247, 'n_pcs': 2000, 'iw_method': 'pc_logistic', 'iw_clip_max': 4.0, 'iw_prob_clip': 0.0038076829098568393, 'iw_n_components': 20, 'iw_logistic_c': 1.3188638429042457e-06, 'iw_pca_fit': 'combined', 'iw_solver': 'lbfgs', 'iw_rho': 1.0}. Best is trial 33 with value: 0.25137294449925773.
2026-06-01 13:14:05 | INFO | Trial 47 | outer=1 | alpha=1.535e+05 n_pcs=2500 (pc_topk) weight={'name': 'uniform'}
[I 2026-06-01 13:14:09,720] Trial 47 finished with value: 0.23309649172571736 and parameters: {'alpha': 153477.26438623437, 'n_pcs': 2500, 'iw_method': 'uniform'}. Best is trial 33 with value: 0.25137294449925773.
2026-06-01 13:14:09 | INFO | Trial 48 | outer=1 | alpha=1.161e+05 n_pcs=2000 (pc_topk) weight={'name': 'pc_logistic', 'floor': 1e-06, 'clip_max': 4.0, 'prob_clip': 0.010736088257108081, 'n_components': 80, 'logistic_c': 0.00020578199774358357, 'pca_fit': 'combined', 'solver': 'lbfgs', 'max_iter': 2000, 'fit_intercept': True, 'standardize_with_source': True, 'rho': 0.7}
[I 2026-06-01 13:14:19,887] Trial 48 finished with value: 0.24992876213957463 and parameters: {'alpha': 116114.30230534269, 'n_pcs': 2000, 'iw_method': 'pc_logistic', 'iw_clip_max': 4.0, 'iw_prob_clip': 0.010736088257108081, 'iw_n_components': 80, 'iw_logistic_c': 0.00020578199774358357, 'iw_pca_fit': 'combined', 'iw_solver': 'lbfgs', 'iw_rho': 0.7}. Best is trial 33 with value: 0.25137294449925773.
2026-06-01 13:14:19 | INFO | Trial 49 | outer=1 | alpha=2.479e+04 n_pcs=500 (pc_topk) weight={'name': 'pc_logistic', 'floor': 1e-06, 'clip_max': 4.0, 'prob_clip': 0.0029423725846507475, 'n_components': 100, 'logistic_c': 0.0031632626035444046, 'pca_fit': 'combined', 'solver': 'lbfgs', 'max_iter': 2000, 'fit_intercept': True, 'standardize_with_source': True, 'rho': 0.7}
[I 2026-06-01 13:14:34,136] Trial 49 finished with value: 0.1889180326721982 and parameters: {'alpha': 24792.509286027438, 'n_pcs': 500, 'iw_method': 'pc_logistic', 'iw_clip_max': 4.0, 'iw_prob_clip': 0.0029423725846507475, 'iw_n_components': 100, 'iw_logistic_c': 0.0031632626035444046, 'iw_pca_fit': 'combined', 'iw_solver': 'lbfgs', 'iw_rho': 0.7}. Best is trial 33 with value: 0.25137294449925773.
2026-06-01 13:14:34 | INFO | Trial 50 | outer=1 | alpha=2.196e+05 n_pcs=1500 (pc_topk) weight={'name': 'uniform'}
[I 2026-06-01 13:14:37,668] Trial 50 finished with value: 0.22383242675043843 and parameters: {'alpha': 219594.0375813369, 'n_pcs': 1500, 'iw_method': 'uniform'}. Best is trial 33 with value: 0.25137294449925773.
2026-06-01 13:14:37 | INFO | Trial 51 | outer=1 | alpha=7.065e+04 n_pcs=3000 (pc_topk) weight={'name': 'pc_logistic', 'floor': 1e-06, 'clip_max': 1.5, 'prob_clip': 0.002332932997242543, 'n_components': 60, 'logistic_c': 6.030566745957561e-05, 'pca_fit': 'combined', 'solver': 'lbfgs', 'max_iter': 2000, 'fit_intercept': True, 'standardize_with_source': True, 'rho': 0.7}
[I 2026-06-01 13:14:49,295] Trial 51 finished with value: 0.24921979724929494 and parameters: {'alpha': 70653.31242002596, 'n_pcs': 3000, 'iw_method': 'pc_logistic', 'iw_clip_max': 1.5, 'iw_prob_clip': 0.002332932997242543, 'iw_n_components': 60, 'iw_logistic_c': 6.030566745957561e-05, 'iw_pca_fit': 'combined', 'iw_solver': 'lbfgs', 'iw_rho': 0.7}. Best is trial 33 with value: 0.25137294449925773.
2026-06-01 13:14:49 | INFO | Trial 52 | outer=1 | alpha=5.231e+05 n_pcs=2500 (pc_topk) weight={'name': 'pc_logistic', 'floor': 1e-06, 'clip_max': 4.0, 'prob_clip': 0.021352610502460654, 'n_components': 10, 'logistic_c': 0.0003861922157056987, 'pca_fit': 'combined', 'solver': 'lbfgs', 'max_iter': 2000, 'fit_intercept': True, 'standardize_with_source': True, 'rho': 0.7}
[I 2026-06-01 13:14:58,380] Trial 52 finished with value: 0.23878099856244903 and parameters: {'alpha': 523067.37710912136, 'n_pcs': 2500, 'iw_method': 'pc_logistic', 'iw_clip_max': 4.0, 'iw_prob_clip': 0.021352610502460654, 'iw_n_components': 10, 'iw_logistic_c': 0.0003861922157056987, 'iw_pca_fit': 'combined', 'iw_solver': 'lbfgs', 'iw_rho': 0.7}. Best is trial 33 with value: 0.25137294449925773.
2026-06-01 13:14:58 | INFO | Trial 53 | outer=1 | alpha=5.652e+04 n_pcs=3000 (pc_topk) weight={'name': 'pc_logistic', 'floor': 1e-06, 'clip_max': 12.0, 'prob_clip': 0.005359753544551814, 'n_components': 100, 'logistic_c': 0.00010002627109265702, 'pca_fit': 'combined', 'solver': 'lbfgs', 'max_iter': 2000, 'fit_intercept': True, 'standardize_with_source': True, 'rho': 0.7}
[I 2026-06-01 13:15:09,576] Trial 53 finished with value: 0.24436164336779848 and parameters: {'alpha': 56515.01734370652, 'n_pcs': 3000, 'iw_method': 'pc_logistic', 'iw_clip_max': 12.0, 'iw_prob_clip': 0.005359753544551814, 'iw_n_components': 100, 'iw_logistic_c': 0.00010002627109265702, 'iw_pca_fit': 'combined', 'iw_solver': 'lbfgs', 'iw_rho': 0.7}. Best is trial 33 with value: 0.25137294449925773.
2026-06-01 13:15:09 | INFO | Trial 54 | outer=1 | alpha=2.371e+04 n_pcs=2500 (pc_topk) weight={'name': 'pc_logistic', 'floor': 1e-06, 'clip_max': 4.0, 'prob_clip': 0.04904117490342626, 'n_components': 100, 'logistic_c': 3.516747528798814e-05, 'pca_fit': 'combined', 'solver': 'lbfgs', 'max_iter': 2000, 'fit_intercept': True, 'standardize_with_source': True, 'rho': 0.7}
[I 2026-06-01 13:15:19,474] Trial 54 finished with value: 0.23279195149812262 and parameters: {'alpha': 23709.82827427058, 'n_pcs': 2500, 'iw_method': 'pc_logistic', 'iw_clip_max': 4.0, 'iw_prob_clip': 0.04904117490342626, 'iw_n_components': 100, 'iw_logistic_c': 3.516747528798814e-05, 'iw_pca_fit': 'combined', 'iw_solver': 'lbfgs', 'iw_rho': 0.7}. Best is trial 33 with value: 0.25137294449925773.
2026-06-01 13:15:19 | INFO | Trial 55 | outer=1 | alpha=1.157e+05 n_pcs=2000 (pc_topk) weight={'name': 'pc_logistic', 'floor': 1e-06, 'clip_max': 2.5, 'prob_clip': 0.010461558731643488, 'n_components': 80, 'logistic_c': 3.5959152138614844e-06, 'pca_fit': 'combined', 'solver': 'lbfgs', 'max_iter': 2000, 'fit_intercept': True, 'standardize_with_source': True, 'rho': 0.3}
[I 2026-06-01 13:15:27,885] Trial 55 finished with value: 0.2389518822045614 and parameters: {'alpha': 115692.48144445004, 'n_pcs': 2000, 'iw_method': 'pc_logistic', 'iw_clip_max': 2.5, 'iw_prob_clip': 0.010461558731643488, 'iw_n_components': 80, 'iw_logistic_c': 3.5959152138614844e-06, 'iw_pca_fit': 'combined', 'iw_solver': 'lbfgs', 'iw_rho': 0.3}. Best is trial 33 with value: 0.25137294449925773.
2026-06-01 13:15:27 | INFO | Trial 56 | outer=1 | alpha=1.113e+06 n_pcs=2500 (pc_topk) weight={'name': 'pc_logistic', 'floor': 1e-06, 'clip_max': 7.0, 'prob_clip': 0.0012333004206520177, 'n_components': 100, 'logistic_c': 0.0004995653960915858, 'pca_fit': 'combined', 'solver': 'lbfgs', 'max_iter': 2000, 'fit_intercept': True, 'standardize_with_source': True, 'rho': 0.7}
[I 2026-06-01 13:15:40,332] Trial 56 finished with value: 0.2358286882160896 and parameters: {'alpha': 1113352.011962861, 'n_pcs': 2500, 'iw_method': 'pc_logistic', 'iw_clip_max': 7.0, 'iw_prob_clip': 0.0012333004206520177, 'iw_n_components': 100, 'iw_logistic_c': 0.0004995653960915858, 'iw_pca_fit': 'combined', 'iw_solver': 'lbfgs', 'iw_rho': 0.7}. Best is trial 33 with value: 0.25137294449925773.
2026-06-01 13:15:40 | INFO | Trial 57 | outer=1 | alpha=2.769e+05 n_pcs=2000 (pc_topk) weight={'name': 'pc_logistic', 'floor': 1e-06, 'clip_max': 4.0, 'prob_clip': 0.006671830573621899, 'n_components': 20, 'logistic_c': 1.2153674925281049e-05, 'pca_fit': 'combined', 'solver': 'lbfgs', 'max_iter': 2000, 'fit_intercept': True, 'standardize_with_source': True, 'rho': 0.7}
[I 2026-06-01 13:15:49,223] Trial 57 finished with value: 0.24407255588392443 and parameters: {'alpha': 276913.65541227773, 'n_pcs': 2000, 'iw_method': 'pc_logistic', 'iw_clip_max': 4.0, 'iw_prob_clip': 0.006671830573621899, 'iw_n_components': 20, 'iw_logistic_c': 1.2153674925281049e-05, 'iw_pca_fit': 'combined', 'iw_solver': 'lbfgs', 'iw_rho': 0.7}. Best is trial 33 with value: 0.25137294449925773.
2026-06-01 13:15:49 | INFO | Trial 58 | outer=1 | alpha=2.832e+04 n_pcs=1500 (pc_topk) weight={'name': 'pc_logistic', 'floor': 1e-06, 'clip_max': 12.0, 'prob_clip': 0.003923090361158021, 'n_components': 100, 'logistic_c': 2.4999883714697827e-05, 'pca_fit': 'combined', 'solver': 'lbfgs', 'max_iter': 2000, 'fit_intercept': True, 'standardize_with_source': True, 'rho': 1.0}
[I 2026-06-01 13:15:57,204] Trial 58 finished with value: 0.22564689428890064 and parameters: {'alpha': 28321.75725596766, 'n_pcs': 1500, 'iw_method': 'pc_logistic', 'iw_clip_max': 12.0, 'iw_prob_clip': 0.003923090361158021, 'iw_n_components': 100, 'iw_logistic_c': 2.4999883714697827e-05, 'iw_pca_fit': 'combined', 'iw_solver': 'lbfgs', 'iw_rho': 1.0}. Best is trial 33 with value: 0.25137294449925773.
2026-06-01 13:15:57 | INFO | Trial 59 | outer=1 | alpha=8.595e+03 n_pcs=1000 (pc_topk) weight={'name': 'uniform'}
[I 2026-06-01 13:15:59,265] Trial 59 finished with value: 0.21842512526994215 and parameters: {'alpha': 8594.882820808447, 'n_pcs': 1000, 'iw_method': 'uniform'}. Best is trial 33 with value: 0.25137294449925773.
2026-06-01 13:15:59 | INFO | Trial 60 | outer=1 | alpha=5.520e+04 n_pcs=3000 (pc_topk) weight={'name': 'pc_logistic', 'floor': 1e-06, 'clip_max': 2.5, 'prob_clip': 0.012139391702470175, 'n_components': 60, 'logistic_c': 0.0001715696312780576, 'pca_fit': 'combined', 'solver': 'lbfgs', 'max_iter': 2000, 'fit_intercept': True, 'standardize_with_source': True, 'rho': 0.5}
[I 2026-06-01 13:16:10,765] Trial 60 finished with value: 0.24933584138726203 and parameters: {'alpha': 55197.89478803935, 'n_pcs': 3000, 'iw_method': 'pc_logistic', 'iw_clip_max': 2.5, 'iw_prob_clip': 0.012139391702470175, 'iw_n_components': 60, 'iw_logistic_c': 0.0001715696312780576, 'iw_pca_fit': 'combined', 'iw_solver': 'lbfgs', 'iw_rho': 0.5}. Best is trial 33 with value: 0.25137294449925773.
2026-06-01 13:16:10 | INFO | Trial 61 | outer=1 | alpha=1.229e+05 n_pcs=2000 (pc_topk) weight={'name': 'pc_logistic', 'floor': 1e-06, 'clip_max': 4.0, 'prob_clip': 0.01819462559337623, 'n_components': 80, 'logistic_c': 0.00028722409299716085, 'pca_fit': 'combined', 'solver': 'lbfgs', 'max_iter': 2000, 'fit_intercept': True, 'standardize_with_source': True, 'rho': 0.7}
