[I 2026-06-01 02:27:40,123] Trial 93 finished with value: 0.2344038141199975 and parameters: {'alpha': 56070.202562076454, 'n_pcs': 4500, 'weight_scheme': 'linear', 'weight_clip_max': 20.0, 'weight_linear_min_weight': 0.18388743555773657, 'weight_linear_max_weight': 2.273803578951843}. Best is trial 43 with value: 0.23589421909037797.
2026-06-01 02:27:40 | INFO | src.nested_cv_avggrm_weighted_unified | Trial 94 | outer=10 | alpha=7.858e+04 n_pcs=4500 (pc_topk) weight_search=on
2026-06-01 02:27:40 | INFO | src.nested_cv_avggrm_weighted_unified | Trial 94 | outer=10 | weight={'name': 'linear', 'floor': 1e-06, 'clip_max': 20.0, 'min_weight': 0.17434085323688733, 'max_weight': 2.3750466564669988}
[I 2026-06-01 02:27:47,057] Trial 94 finished with value: 0.23554816370411755 and parameters: {'alpha': 78575.67659130348, 'n_pcs': 4500, 'weight_scheme': 'linear', 'weight_clip_max': 20.0, 'weight_linear_min_weight': 0.17434085323688733, 'weight_linear_max_weight': 2.3750466564669988}. Best is trial 43 with value: 0.23589421909037797.
2026-06-01 02:27:47 | INFO | src.nested_cv_avggrm_weighted_unified | Trial 95 | outer=10 | alpha=8.991e+04 n_pcs=5000 (pc_topk) weight_search=on
2026-06-01 02:27:47 | INFO | src.nested_cv_avggrm_weighted_unified | Trial 95 | outer=10 | weight={'name': 'linear', 'floor': 1e-06, 'clip_max': 20.0, 'min_weight': 0.21003666607468302, 'max_weight': 2.392829870709387}
2026-06-01 02:27:53 | INFO | src.nested_cv_avggrm_weighted_unified | Trial 95 | outer=10 | pruned after 8/10 inner folds (mean r=0.2669)
[I 2026-06-01 02:27:53,538] Trial 95 pruned. 
2026-06-01 02:27:53 | INFO | src.nested_cv_avggrm_weighted_unified | Trial 96 | outer=10 | alpha=3.841e+04 n_pcs=4500 (pc_topk) weight_search=on
2026-06-01 02:27:53 | INFO | src.nested_cv_avggrm_weighted_unified | Trial 96 | outer=10 | weight={'name': 'linear', 'floor': 1e-06, 'clip_max': 20.0, 'min_weight': 0.24395907921911927, 'max_weight': 2.1212387161674893}
[I 2026-06-01 02:28:00,539] Trial 96 finished with value: 0.23193799187671688 and parameters: {'alpha': 38409.97059466086, 'n_pcs': 4500, 'weight_scheme': 'linear', 'weight_clip_max': 20.0, 'weight_linear_min_weight': 0.24395907921911927, 'weight_linear_max_weight': 2.1212387161674893}. Best is trial 43 with value: 0.23589421909037797.
2026-06-01 02:28:00 | INFO | src.nested_cv_avggrm_weighted_unified | Trial 97 | outer=10 | alpha=2.918e+05 n_pcs=3500 (pc_topk) weight_search=on
2026-06-01 02:28:00 | INFO | src.nested_cv_avggrm_weighted_unified | Trial 97 | outer=10 | weight={'name': 'exponential', 'floor': 1e-06, 'clip_max': 20.0, 'beta': 0.08411232638086652}
2026-06-01 02:28:02 | INFO | src.nested_cv_avggrm_weighted_unified | Trial 97 | outer=10 | pruned after 5/10 inner folds (mean r=0.2101)
[I 2026-06-01 02:28:02,961] Trial 97 pruned. 
2026-06-01 02:28:02 | INFO | src.nested_cv_avggrm_weighted_unified | Trial 98 | outer=10 | alpha=2.781e+04 n_pcs=4500 (pc_topk) weight_search=on
2026-06-01 02:28:02 | INFO | src.nested_cv_avggrm_weighted_unified | Trial 98 | outer=10 | weight={'name': 'linear', 'floor': 1e-06, 'clip_max': 5.0, 'min_weight': 0.1211569262149404, 'max_weight': 2.58911632924837}
[I 2026-06-01 02:28:09,953] Trial 98 finished with value: 0.22762495246854195 and parameters: {'alpha': 27811.892292765282, 'n_pcs': 4500, 'weight_scheme': 'linear', 'weight_clip_max': 5.0, 'weight_linear_min_weight': 0.1211569262149404, 'weight_linear_max_weight': 2.58911632924837}. Best is trial 43 with value: 0.23589421909037797.
2026-06-01 02:28:09 | INFO | src.nested_cv_avggrm_weighted_unified | Trial 99 | outer=10 | alpha=2.104e+05 n_pcs=4000 (pc_topk) weight_search=on
2026-06-01 02:28:09 | INFO | src.nested_cv_avggrm_weighted_unified | Trial 99 | outer=10 | weight={'name': 'linear', 'floor': 1e-06, 'clip_max': 20.0, 'min_weight': 0.08132658381733023, 'max_weight': 1.9867442628899685}
[I 2026-06-01 02:28:15,726] Trial 99 finished with value: 0.23445913700436588 and parameters: {'alpha': 210440.93494159693, 'n_pcs': 4000, 'weight_scheme': 'linear', 'weight_clip_max': 20.0, 'weight_linear_min_weight': 0.08132658381733023, 'weight_linear_max_weight': 1.9867442628899685}. Best is trial 43 with value: 0.23589421909037797.
2026-06-01 02:28:15 | INFO | src.nested_cv_avggrm_weighted_unified | Trial 100 | outer=10 | alpha=1.269e+05 n_pcs=5000 (pc_topk) weight_search=on
2026-06-01 02:28:15 | INFO | src.nested_cv_avggrm_weighted_unified | Trial 100 | outer=10 | weight={'name': 'linear', 'floor': 1e-06, 'clip_max': 20.0, 'min_weight': 0.48787917769995215, 'max_weight': 4.580415639310876}
[I 2026-06-01 02:28:23,897] Trial 100 finished with value: 0.2337573099712717 and parameters: {'alpha': 126920.4082273115, 'n_pcs': 5000, 'weight_scheme': 'linear', 'weight_clip_max': 20.0, 'weight_linear_min_weight': 0.48787917769995215, 'weight_linear_max_weight': 4.580415639310876}. Best is trial 43 with value: 0.23589421909037797.
2026-06-01 02:28:23 | INFO | src.nested_cv_avggrm_weighted_unified | Trial 101 | outer=10 | alpha=7.119e+04 n_pcs=4500 (pc_topk) weight_search=on
2026-06-01 02:28:23 | INFO | src.nested_cv_avggrm_weighted_unified | Trial 101 | outer=10 | weight={'name': 'linear', 'floor': 1e-06, 'clip_max': 20.0, 'min_weight': 0.17358477185480914, 'max_weight': 1.8120472086612436}
[I 2026-06-01 02:28:30,884] Trial 101 finished with value: 0.23525175611150914 and parameters: {'alpha': 71191.73806989279, 'n_pcs': 4500, 'weight_scheme': 'linear', 'weight_clip_max': 20.0, 'weight_linear_min_weight': 0.17358477185480914, 'weight_linear_max_weight': 1.8120472086612436}. Best is trial 43 with value: 0.23589421909037797.
2026-06-01 02:28:30 | INFO | src.nested_cv_avggrm_weighted_unified | Trial 102 | outer=10 | alpha=7.523e+04 n_pcs=4500 (pc_topk) weight_search=on
2026-06-01 02:28:30 | INFO | src.nested_cv_avggrm_weighted_unified | Trial 102 | outer=10 | weight={'name': 'linear', 'floor': 1e-06, 'clip_max': 20.0, 'min_weight': 0.15253455259707513, 'max_weight': 2.936613050878507}
[I 2026-06-01 02:28:37,867] Trial 102 finished with value: 0.23548023264753176 and parameters: {'alpha': 75234.4362658391, 'n_pcs': 4500, 'weight_scheme': 'linear', 'weight_clip_max': 20.0, 'weight_linear_min_weight': 0.15253455259707513, 'weight_linear_max_weight': 2.936613050878507}. Best is trial 43 with value: 0.23589421909037797.
2026-06-01 02:28:37 | INFO | src.nested_cv_avggrm_weighted_unified | Trial 103 | outer=10 | alpha=9.700e+04 n_pcs=4500 (pc_topk) weight_search=on
2026-06-01 02:28:37 | INFO | src.nested_cv_avggrm_weighted_unified | Trial 103 | outer=10 | weight={'name': 'linear', 'floor': 1e-06, 'clip_max': 20.0, 'min_weight': 0.12466901255915155, 'max_weight': 2.912730277350371}
[I 2026-06-01 02:28:44,844] Trial 103 finished with value: 0.23589806397548324 and parameters: {'alpha': 97003.4629007477, 'n_pcs': 4500, 'weight_scheme': 'linear', 'weight_clip_max': 20.0, 'weight_linear_min_weight': 0.12466901255915155, 'weight_linear_max_weight': 2.912730277350371}. Best is trial 103 with value: 0.23589806397548324.
2026-06-01 02:28:44 | INFO | src.nested_cv_avggrm_weighted_unified | OUTER 10 | new best trial 103 (mean inner r=0.2359) saved to outputs/final_results/e6_pc_ridge_avggrm/thr_wing/e6_pc_ridge_avggrm_thr_wing_best_trials/split_10_best_trial.json
2026-06-01 02:28:44 | INFO | src.nested_cv_avggrm_weighted_unified | Trial 104 | outer=10 | alpha=5.653e+04 n_pcs=4000 (pc_topk) weight_search=on
2026-06-01 02:28:44 | INFO | src.nested_cv_avggrm_weighted_unified | Trial 104 | outer=10 | weight={'name': 'linear', 'floor': 1e-06, 'clip_max': 20.0, 'min_weight': 0.12894038417895065, 'max_weight': 2.9143395372951573}
[I 2026-06-01 02:28:51,528] Trial 104 finished with value: 0.23335929139558412 and parameters: {'alpha': 56528.421435781645, 'n_pcs': 4000, 'weight_scheme': 'linear', 'weight_clip_max': 20.0, 'weight_linear_min_weight': 0.12894038417895065, 'weight_linear_max_weight': 2.9143395372951573}. Best is trial 103 with value: 0.23589806397548324.
2026-06-01 02:28:51 | INFO | src.nested_cv_avggrm_weighted_unified | Trial 105 | outer=10 | alpha=1.536e+05 n_pcs=4500 (pc_topk) weight_search=on
2026-06-01 02:28:51 | INFO | src.nested_cv_avggrm_weighted_unified | Trial 105 | outer=10 | weight={'name': 'linear', 'floor': 1e-06, 'clip_max': 20.0, 'min_weight': 0.10304494427428366, 'max_weight': 3.1751031902270133}
[I 2026-06-01 02:28:58,546] Trial 105 finished with value: 0.2354741084214247 and parameters: {'alpha': 153589.3845418527, 'n_pcs': 4500, 'weight_scheme': 'linear', 'weight_clip_max': 20.0, 'weight_linear_min_weight': 0.10304494427428366, 'weight_linear_max_weight': 3.1751031902270133}. Best is trial 103 with value: 0.23589806397548324.
2026-06-01 02:28:58 | INFO | src.nested_cv_avggrm_weighted_unified | Trial 106 | outer=10 | alpha=1.662e+05 n_pcs=4500 (pc_topk) weight_search=on
2026-06-01 02:28:58 | INFO | src.nested_cv_avggrm_weighted_unified | Trial 106 | outer=10 | weight={'name': 'linear', 'floor': 1e-06, 'clip_max': 20.0, 'min_weight': 0.06784515724857651, 'max_weight': 3.1639227966157946}
[I 2026-06-01 02:29:05,526] Trial 106 finished with value: 0.23537556347111416 and parameters: {'alpha': 166161.83552536278, 'n_pcs': 4500, 'weight_scheme': 'linear', 'weight_clip_max': 20.0, 'weight_linear_min_weight': 0.06784515724857651, 'weight_linear_max_weight': 3.1639227966157946}. Best is trial 103 with value: 0.23589806397548324.
2026-06-01 02:29:05 | INFO | src.nested_cv_avggrm_weighted_unified | Trial 107 | outer=10 | alpha=7.904e+04 n_pcs=4500 (pc_topk) weight_search=on
2026-06-01 02:29:05 | INFO | src.nested_cv_avggrm_weighted_unified | Trial 107 | outer=10 | weight={'name': 'linear', 'floor': 1e-06, 'clip_max': 20.0, 'min_weight': 0.08870424813532503, 'max_weight': 2.9743687689941187}
[I 2026-06-01 02:29:12,485] Trial 107 finished with value: 0.23554619034156282 and parameters: {'alpha': 79044.53302837005, 'n_pcs': 4500, 'weight_scheme': 'linear', 'weight_clip_max': 20.0, 'weight_linear_min_weight': 0.08870424813532503, 'weight_linear_max_weight': 2.9743687689941187}. Best is trial 103 with value: 0.23589806397548324.
2026-06-01 02:29:12 | INFO | src.nested_cv_avggrm_weighted_unified | Trial 108 | outer=10 | alpha=1.043e+05 n_pcs=5000 (pc_topk) weight_search=on
2026-06-01 02:29:12 | INFO | src.nested_cv_avggrm_weighted_unified | Trial 108 | outer=10 | weight={'name': 'linear', 'floor': 1e-06, 'clip_max': 20.0, 'min_weight': 0.09885270618153266, 'max_weight': 3.0060068099431203}
[I 2026-06-01 02:29:20,663] Trial 108 finished with value: 0.23468921165404674 and parameters: {'alpha': 104265.34976616192, 'n_pcs': 5000, 'weight_scheme': 'linear', 'weight_clip_max': 20.0, 'weight_linear_min_weight': 0.09885270618153266, 'weight_linear_max_weight': 3.0060068099431203}. Best is trial 103 with value: 0.23589806397548324.
2026-06-01 02:29:20 | INFO | src.nested_cv_avggrm_weighted_unified | Trial 109 | outer=10 | alpha=4.035e+06 n_pcs=4500 (pc_topk) weight_search=on
2026-06-01 02:29:20 | INFO | src.nested_cv_avggrm_weighted_unified | Trial 109 | outer=10 | weight={'name': 'linear', 'floor': 1e-06, 'clip_max': 20.0, 'min_weight': 0.07965514143627377, 'max_weight': 3.286020742739452}
2026-06-01 02:29:24 | INFO | src.nested_cv_avggrm_weighted_unified | Trial 109 | outer=10 | pruned after 5/10 inner folds (mean r=0.2198)
[I 2026-06-01 02:29:24,132] Trial 109 pruned. 
2026-06-01 02:29:24 | INFO | src.nested_cv_avggrm_weighted_unified | Trial 110 | outer=10 | alpha=1.514e+05 n_pcs=5000 (pc_topk) weight_search=on
2026-06-01 02:29:24 | INFO | src.nested_cv_avggrm_weighted_unified | Trial 110 | outer=10 | weight={'name': 'uniform', 'floor': 1e-06, 'clip_max': 20.0}
2026-06-01 02:29:29 | INFO | src.nested_cv_avggrm_weighted_unified | Trial 110 | outer=10 | pruned after 7/10 inner folds (mean r=0.2294)
[I 2026-06-01 02:29:29,105] Trial 110 pruned. 
2026-06-01 02:29:29 | INFO | src.nested_cv_avggrm_weighted_unified | Trial 111 | outer=10 | alpha=7.809e+04 n_pcs=4500 (pc_topk) weight_search=on
2026-06-01 02:29:29 | INFO | src.nested_cv_avggrm_weighted_unified | Trial 111 | outer=10 | weight={'name': 'linear', 'floor': 1e-06, 'clip_max': 20.0, 'min_weight': 0.12822013299132234, 'max_weight': 2.8489261094555203}
[I 2026-06-01 02:29:36,097] Trial 111 finished with value: 0.23556639525004747 and parameters: {'alpha': 78089.87371074666, 'n_pcs': 4500, 'weight_scheme': 'linear', 'weight_clip_max': 20.0, 'weight_linear_min_weight': 0.12822013299132234, 'weight_linear_max_weight': 2.8489261094555203}. Best is trial 103 with value: 0.23589806397548324.
2026-06-01 02:29:36 | INFO | src.nested_cv_avggrm_weighted_unified | Trial 112 | outer=10 | alpha=8.671e+04 n_pcs=4500 (pc_topk) weight_search=on
2026-06-01 02:29:36 | INFO | src.nested_cv_avggrm_weighted_unified | Trial 112 | outer=10 | weight={'name': 'linear', 'floor': 1e-06, 'clip_max': 20.0, 'min_weight': 0.1268584197259976, 'max_weight': 2.858938466121417}
[I 2026-06-01 02:29:43,078] Trial 112 finished with value: 0.2357755764251967 and parameters: {'alpha': 86710.03502945151, 'n_pcs': 4500, 'weight_scheme': 'linear', 'weight_clip_max': 20.0, 'weight_linear_min_weight': 0.1268584197259976, 'weight_linear_max_weight': 2.858938466121417}. Best is trial 103 with value: 0.23589806397548324.
2026-06-01 02:29:43 | INFO | src.nested_cv_avggrm_weighted_unified | Trial 113 | outer=10 | alpha=8.759e+04 n_pcs=4500 (pc_topk) weight_search=on
2026-06-01 02:29:43 | INFO | src.nested_cv_avggrm_weighted_unified | Trial 113 | outer=10 | weight={'name': 'linear', 'floor': 1e-06, 'clip_max': 20.0, 'min_weight': 0.13395263282307412, 'max_weight': 2.8550869530386644}
[I 2026-06-01 02:29:50,058] Trial 113 finished with value: 0.235788204900095 and parameters: {'alpha': 87591.98545600421, 'n_pcs': 4500, 'weight_scheme': 'linear', 'weight_clip_max': 20.0, 'weight_linear_min_weight': 0.13395263282307412, 'weight_linear_max_weight': 2.8550869530386644}. Best is trial 103 with value: 0.23589806397548324.
2026-06-01 02:29:50 | INFO | src.nested_cv_avggrm_weighted_unified | Trial 114 | outer=10 | alpha=4.634e+04 n_pcs=5000 (pc_topk) weight_search=on
2026-06-01 02:29:50 | INFO | src.nested_cv_avggrm_weighted_unified | Trial 114 | outer=10 | weight={'name': 'linear', 'floor': 1e-06, 'clip_max': 20.0, 'min_weight': 0.13272860775762654, 'max_weight': 2.84117306113671}
2026-06-01 02:29:56 | INFO | src.nested_cv_avggrm_weighted_unified | Trial 114 | outer=10 | pruned after 8/10 inner folds (mean r=0.2608)
[I 2026-06-01 02:29:56,586] Trial 114 pruned. 
2026-06-01 02:29:56 | INFO | src.nested_cv_avggrm_weighted_unified | Trial 115 | outer=10 | alpha=8.865e+04 n_pcs=4500 (pc_topk) weight_search=on
2026-06-01 02:29:56 | INFO | src.nested_cv_avggrm_weighted_unified | Trial 115 | outer=10 | weight={'name': 'linear', 'floor': 1e-06, 'clip_max': 20.0, 'min_weight': 0.051444943940075594, 'max_weight': 2.7915171393709137}
[I 2026-06-01 02:30:03,630] Trial 115 finished with value: 0.2357506879651902 and parameters: {'alpha': 88646.31040171026, 'n_pcs': 4500, 'weight_scheme': 'linear', 'weight_clip_max': 20.0, 'weight_linear_min_weight': 0.051444943940075594, 'weight_linear_max_weight': 2.7915171393709137}. Best is trial 103 with value: 0.23589806397548324.
2026-06-01 02:30:03 | INFO | src.nested_cv_avggrm_weighted_unified | Trial 116 | outer=10 | alpha=9.400e+04 n_pcs=4000 (pc_topk) weight_search=on
2026-06-01 02:30:03 | INFO | src.nested_cv_avggrm_weighted_unified | Trial 116 | outer=10 | weight={'name': 'linear', 'floor': 1e-06, 'clip_max': 10.0, 'min_weight': 0.050896945789489195, 'max_weight': 2.7766079384438775}
[I 2026-06-01 02:30:09,399] Trial 116 finished with value: 0.23560172826648262 and parameters: {'alpha': 93998.65517247058, 'n_pcs': 4000, 'weight_scheme': 'linear', 'weight_clip_max': 10.0, 'weight_linear_min_weight': 0.050896945789489195, 'weight_linear_max_weight': 2.7766079384438775}. Best is trial 103 with value: 0.23589806397548324.
2026-06-01 02:30:09 | INFO | src.nested_cv_avggrm_weighted_unified | Trial 117 | outer=10 | alpha=1.130e+05 n_pcs=4000 (pc_topk) weight_search=on
2026-06-01 02:30:09 | INFO | src.nested_cv_avggrm_weighted_unified | Trial 117 | outer=10 | weight={'name': 'linear', 'floor': 1e-06, 'clip_max': 10.0, 'min_weight': 0.05505828760850227, 'max_weight': 2.762004770000976}
[I 2026-06-01 02:30:15,175] Trial 117 finished with value: 0.2358960486274516 and parameters: {'alpha': 113043.76622460056, 'n_pcs': 4000, 'weight_scheme': 'linear', 'weight_clip_max': 10.0, 'weight_linear_min_weight': 0.05505828760850227, 'weight_linear_max_weight': 2.762004770000976}. Best is trial 103 with value: 0.23589806397548324.
2026-06-01 02:30:15 | INFO | src.nested_cv_avggrm_weighted_unified | Trial 118 | outer=10 | alpha=1.215e+05 n_pcs=4000 (pc_topk) weight_search=on
2026-06-01 02:30:15 | INFO | src.nested_cv_avggrm_weighted_unified | Trial 118 | outer=10 | weight={'name': 'exponential', 'floor': 1e-06, 'clip_max': 10.0, 'beta': 7.40753846177061}
[I 2026-06-01 02:30:21,068] Trial 118 finished with value: 0.23241189313642682 and parameters: {'alpha': 121465.03788841283, 'n_pcs': 4000, 'weight_scheme': 'exponential', 'weight_clip_max': 10.0, 'weight_exponential_beta': 7.40753846177061}. Best is trial 103 with value: 0.23589806397548324.
2026-06-01 02:30:21 | INFO | src.nested_cv_avggrm_weighted_unified | Trial 119 | outer=10 | alpha=9.734e+04 n_pcs=4000 (pc_topk) weight_search=on
2026-06-01 02:30:21 | INFO | src.nested_cv_avggrm_weighted_unified | Trial 119 | outer=10 | weight={'name': 'linear', 'floor': 1e-06, 'clip_max': 10.0, 'min_weight': 0.05681628083226671, 'max_weight': 2.754671110072147}
[I 2026-06-01 02:30:26,822] Trial 119 finished with value: 0.2356919731222707 and parameters: {'alpha': 97336.80069487376, 'n_pcs': 4000, 'weight_scheme': 'linear', 'weight_clip_max': 10.0, 'weight_linear_min_weight': 0.05681628083226671, 'weight_linear_max_weight': 2.754671110072147}. Best is trial 103 with value: 0.23589806397548324.
2026-06-01 02:30:26 | INFO | src.nested_cv_avggrm_weighted_unified | Trial 120 | outer=10 | alpha=1.966e+05 n_pcs=3500 (pc_topk) weight_search=on
2026-06-01 02:30:26 | INFO | src.nested_cv_avggrm_weighted_unified | Trial 120 | outer=10 | weight={'name': 'linear', 'floor': 1e-06, 'clip_max': 10.0, 'min_weight': 0.057795597208495676, 'max_weight': 2.7609375411314865}
[I 2026-06-01 02:30:31,752] Trial 120 finished with value: 0.23489472252988247 and parameters: {'alpha': 196550.68104821953, 'n_pcs': 3500, 'weight_scheme': 'linear', 'weight_clip_max': 10.0, 'weight_linear_min_weight': 0.057795597208495676, 'weight_linear_max_weight': 2.7609375411314865}. Best is trial 103 with value: 0.23589806397548324.
2026-06-01 02:30:31 | INFO | src.nested_cv_avggrm_weighted_unified | Trial 121 | outer=10 | alpha=9.973e+04 n_pcs=4000 (pc_topk) weight_search=on
2026-06-01 02:30:31 | INFO | src.nested_cv_avggrm_weighted_unified | Trial 121 | outer=10 | weight={'name': 'linear', 'floor': 1e-06, 'clip_max': 10.0, 'min_weight': 0.07227344995769233, 'max_weight': 2.6572573746495007}
[I 2026-06-01 02:30:37,510] Trial 121 finished with value: 0.23575472489065347 and parameters: {'alpha': 99726.30695096232, 'n_pcs': 4000, 'weight_scheme': 'linear', 'weight_clip_max': 10.0, 'weight_linear_min_weight': 0.07227344995769233, 'weight_linear_max_weight': 2.6572573746495007}. Best is trial 103 with value: 0.23589806397548324.
2026-06-01 02:30:37 | INFO | src.nested_cv_avggrm_weighted_unified | Trial 122 | outer=10 | alpha=1.055e+05 n_pcs=4000 (pc_topk) weight_search=on
2026-06-01 02:30:37 | INFO | src.nested_cv_avggrm_weighted_unified | Trial 122 | outer=10 | weight={'name': 'linear', 'floor': 1e-06, 'clip_max': 10.0, 'min_weight': 0.07043054672571185, 'max_weight': 2.742010916003297}
[I 2026-06-01 02:30:43,746] Trial 122 finished with value: 0.23583328654482746 and parameters: {'alpha': 105510.75645146202, 'n_pcs': 4000, 'weight_scheme': 'linear', 'weight_clip_max': 10.0, 'weight_linear_min_weight': 0.07043054672571185, 'weight_linear_max_weight': 2.742010916003297}. Best is trial 103 with value: 0.23589806397548324.
2026-06-01 02:30:43 | INFO | src.nested_cv_avggrm_weighted_unified | Trial 123 | outer=10 | alpha=1.192e+05 n_pcs=4000 (pc_topk) weight_search=on
2026-06-01 02:30:43 | INFO | src.nested_cv_avggrm_weighted_unified | Trial 123 | outer=10 | weight={'name': 'linear', 'floor': 1e-06, 'clip_max': 10.0, 'min_weight': 0.07523078844575891, 'max_weight': 2.660429828089312}
[I 2026-06-01 02:30:49,507] Trial 123 finished with value: 0.2359010661619468 and parameters: {'alpha': 119213.30450108594, 'n_pcs': 4000, 'weight_scheme': 'linear', 'weight_clip_max': 10.0, 'weight_linear_min_weight': 0.07523078844575891, 'weight_linear_max_weight': 2.660429828089312}. Best is trial 123 with value: 0.2359010661619468.
2026-06-01 02:30:49 | INFO | src.nested_cv_avggrm_weighted_unified | OUTER 10 | new best trial 123 (mean inner r=0.2359) saved to outputs/final_results/e6_pc_ridge_avggrm/thr_wing/e6_pc_ridge_avggrm_thr_wing_best_trials/split_10_best_trial.json
2026-06-01 02:30:49 | INFO | src.nested_cv_avggrm_weighted_unified | Trial 124 | outer=10 | alpha=9.709e+04 n_pcs=4000 (pc_topk) weight_search=on
2026-06-01 02:30:49 | INFO | src.nested_cv_avggrm_weighted_unified | Trial 124 | outer=10 | weight={'name': 'linear', 'floor': 1e-06, 'clip_max': 10.0, 'min_weight': 0.07248183257587185, 'max_weight': 2.6759004087593845}
