[I 2026-06-02 00:44:07,366] Trial 282 finished with value: 0.23285369974766637 and parameters: {'alpha': 37929.63487520336, 'n_pcs': 5000, 'iw_method': 'pc_logistic', 'iw_clip_max': 4.0, 'iw_prob_clip': 0.010392319478130015, 'iw_n_components': 100, 'iw_logistic_c': 1.4945347120109982, 'iw_pca_fit': 'combined', 'iw_solver': 'lbfgs', 'iw_rho': 0.85}. Best is trial 267 with value: 0.23317321415284004.
2026-06-02 00:44:07 | INFO | Trial 283 | outer=9 | alpha=3.817e+04 n_pcs=5000 (pc_topk) weight={'name': 'pc_logistic', 'floor': 1e-06, 'clip_max': 4.0, 'prob_clip': 0.010045461951878954, 'n_components': 100, 'logistic_c': 1.4757493649391902, 'pca_fit': 'combined', 'solver': 'lbfgs', 'max_iter': 2000, 'fit_intercept': True, 'standardize_with_source': True, 'rho': 0.85}
[I 2026-06-02 00:44:33,394] Trial 283 finished with value: 0.23286386796825664 and parameters: {'alpha': 38172.32040640571, 'n_pcs': 5000, 'iw_method': 'pc_logistic', 'iw_clip_max': 4.0, 'iw_prob_clip': 0.010045461951878954, 'iw_n_components': 100, 'iw_logistic_c': 1.4757493649391902, 'iw_pca_fit': 'combined', 'iw_solver': 'lbfgs', 'iw_rho': 0.85}. Best is trial 267 with value: 0.23317321415284004.
2026-06-02 00:44:33 | INFO | Trial 284 | outer=9 | alpha=3.924e+04 n_pcs=5000 (pc_topk) weight={'name': 'pc_logistic', 'floor': 1e-06, 'clip_max': 4.0, 'prob_clip': 0.008625242672733855, 'n_components': 100, 'logistic_c': 1.2402274625225604, 'pca_fit': 'combined', 'solver': 'lbfgs', 'max_iter': 2000, 'fit_intercept': True, 'standardize_with_source': True, 'rho': 0.85}
[I 2026-06-02 00:45:00,715] Trial 284 finished with value: 0.23288119934802323 and parameters: {'alpha': 39235.58396840014, 'n_pcs': 5000, 'iw_method': 'pc_logistic', 'iw_clip_max': 4.0, 'iw_prob_clip': 0.008625242672733855, 'iw_n_components': 100, 'iw_logistic_c': 1.2402274625225604, 'iw_pca_fit': 'combined', 'iw_solver': 'lbfgs', 'iw_rho': 0.85}. Best is trial 267 with value: 0.23317321415284004.
2026-06-02 00:45:00 | INFO | Trial 285 | outer=9 | alpha=3.967e+04 n_pcs=5000 (pc_topk) weight={'name': 'pc_logistic', 'floor': 1e-06, 'clip_max': 4.0, 'prob_clip': 0.003581002886214026, 'n_components': 100, 'logistic_c': 1.1443392333412765, 'pca_fit': 'combined', 'solver': 'lbfgs', 'max_iter': 2000, 'fit_intercept': True, 'standardize_with_source': True, 'rho': 0.85}
[I 2026-06-02 00:45:28,832] Trial 285 finished with value: 0.23268535795655088 and parameters: {'alpha': 39665.865116654466, 'n_pcs': 5000, 'iw_method': 'pc_logistic', 'iw_clip_max': 4.0, 'iw_prob_clip': 0.003581002886214026, 'iw_n_components': 100, 'iw_logistic_c': 1.1443392333412765, 'iw_pca_fit': 'combined', 'iw_solver': 'lbfgs', 'iw_rho': 0.85}. Best is trial 267 with value: 0.23317321415284004.
2026-06-02 00:45:28 | INFO | Trial 286 | outer=9 | alpha=4.297e+04 n_pcs=5000 (pc_topk) weight={'name': 'pc_logistic', 'floor': 1e-06, 'clip_max': 4.0, 'prob_clip': 0.00988823717020215, 'n_components': 100, 'logistic_c': 1.5219791800432438, 'pca_fit': 'combined', 'solver': 'lbfgs', 'max_iter': 2000, 'fit_intercept': True, 'standardize_with_source': True, 'rho': 0.85}
[I 2026-06-02 00:45:56,763] Trial 286 finished with value: 0.23313120669629747 and parameters: {'alpha': 42973.931043433935, 'n_pcs': 5000, 'iw_method': 'pc_logistic', 'iw_clip_max': 4.0, 'iw_prob_clip': 0.00988823717020215, 'iw_n_components': 100, 'iw_logistic_c': 1.5219791800432438, 'iw_pca_fit': 'combined', 'iw_solver': 'lbfgs', 'iw_rho': 0.85}. Best is trial 267 with value: 0.23317321415284004.
2026-06-02 00:45:56 | INFO | Trial 287 | outer=9 | alpha=4.362e+04 n_pcs=5000 (pc_topk) weight={'name': 'pc_logistic', 'floor': 1e-06, 'clip_max': 4.0, 'prob_clip': 0.008561057164750297, 'n_components': 100, 'logistic_c': 0.004510587035104241, 'pca_fit': 'combined', 'solver': 'lbfgs', 'max_iter': 2000, 'fit_intercept': True, 'standardize_with_source': True, 'rho': 0.85}
[I 2026-06-02 00:46:20,528] Trial 287 finished with value: 0.23303152151358258 and parameters: {'alpha': 43617.37287379636, 'n_pcs': 5000, 'iw_method': 'pc_logistic', 'iw_clip_max': 4.0, 'iw_prob_clip': 0.008561057164750297, 'iw_n_components': 100, 'iw_logistic_c': 0.004510587035104241, 'iw_pca_fit': 'combined', 'iw_solver': 'lbfgs', 'iw_rho': 0.85}. Best is trial 267 with value: 0.23317321415284004.
2026-06-02 00:46:20 | INFO | Trial 288 | outer=9 | alpha=4.342e+04 n_pcs=5000 (pc_topk) weight={'name': 'pc_logistic', 'floor': 1e-06, 'clip_max': 4.0, 'prob_clip': 0.00687765928765041, 'n_components': 100, 'logistic_c': 0.002405366376622541, 'pca_fit': 'combined', 'solver': 'lbfgs', 'max_iter': 2000, 'fit_intercept': True, 'standardize_with_source': True, 'rho': 0.85}
[I 2026-06-02 00:46:42,100] Trial 288 finished with value: 0.23315043125916324 and parameters: {'alpha': 43422.28752167418, 'n_pcs': 5000, 'iw_method': 'pc_logistic', 'iw_clip_max': 4.0, 'iw_prob_clip': 0.00687765928765041, 'iw_n_components': 100, 'iw_logistic_c': 0.002405366376622541, 'iw_pca_fit': 'combined', 'iw_solver': 'lbfgs', 'iw_rho': 0.85}. Best is trial 267 with value: 0.23317321415284004.
2026-06-02 00:46:42 | INFO | Trial 289 | outer=9 | alpha=4.395e+04 n_pcs=2500 (pc_topk) weight={'name': 'pc_logistic', 'floor': 1e-06, 'clip_max': 4.0, 'prob_clip': 0.006752133024366613, 'n_components': 100, 'logistic_c': 0.002796406985133178, 'pca_fit': 'combined', 'solver': 'lbfgs', 'max_iter': 2000, 'fit_intercept': True, 'standardize_with_source': True, 'rho': 0.85}
[I 2026-06-02 00:46:56,670] Trial 289 finished with value: 0.2294368201481943 and parameters: {'alpha': 43947.766235298535, 'n_pcs': 2500, 'iw_method': 'pc_logistic', 'iw_clip_max': 4.0, 'iw_prob_clip': 0.006752133024366613, 'iw_n_components': 100, 'iw_logistic_c': 0.002796406985133178, 'iw_pca_fit': 'combined', 'iw_solver': 'lbfgs', 'iw_rho': 0.85}. Best is trial 267 with value: 0.23317321415284004.
2026-06-02 00:46:56 | INFO | Trial 290 | outer=9 | alpha=4.054e+04 n_pcs=5000 (pc_topk) weight={'name': 'pc_logistic', 'floor': 1e-06, 'clip_max': 4.0, 'prob_clip': 0.008824896083229703, 'n_components': 100, 'logistic_c': 0.00833804791380609, 'pca_fit': 'combined', 'solver': 'lbfgs', 'max_iter': 2000, 'fit_intercept': True, 'standardize_with_source': True, 'rho': 0.85}
[I 2026-06-02 00:47:21,192] Trial 290 finished with value: 0.23285786908427006 and parameters: {'alpha': 40539.46778288579, 'n_pcs': 5000, 'iw_method': 'pc_logistic', 'iw_clip_max': 4.0, 'iw_prob_clip': 0.008824896083229703, 'iw_n_components': 100, 'iw_logistic_c': 0.00833804791380609, 'iw_pca_fit': 'combined', 'iw_solver': 'lbfgs', 'iw_rho': 0.85}. Best is trial 267 with value: 0.23317321415284004.
2026-06-02 00:47:21 | INFO | Trial 291 | outer=9 | alpha=4.273e+04 n_pcs=3000 (pc_topk) weight={'name': 'pc_logistic', 'floor': 1e-06, 'clip_max': 4.0, 'prob_clip': 0.008525316856904238, 'n_components': 100, 'logistic_c': 0.002408880283745326, 'pca_fit': 'combined', 'solver': 'lbfgs', 'max_iter': 2000, 'fit_intercept': True, 'standardize_with_source': True, 'rho': 0.85}
[I 2026-06-02 00:47:35,600] Trial 291 finished with value: 0.2298087301557538 and parameters: {'alpha': 42726.685925502745, 'n_pcs': 3000, 'iw_method': 'pc_logistic', 'iw_clip_max': 4.0, 'iw_prob_clip': 0.008525316856904238, 'iw_n_components': 100, 'iw_logistic_c': 0.002408880283745326, 'iw_pca_fit': 'combined', 'iw_solver': 'lbfgs', 'iw_rho': 0.85}. Best is trial 267 with value: 0.23317321415284004.
2026-06-02 00:47:35 | INFO | Trial 292 | outer=9 | alpha=3.506e+04 n_pcs=5000 (pc_topk) weight={'name': 'pc_logistic', 'floor': 1e-06, 'clip_max': 4.0, 'prob_clip': 0.007317943148006475, 'n_components': 100, 'logistic_c': 0.0004981589606825841, 'pca_fit': 'combined', 'solver': 'lbfgs', 'max_iter': 2000, 'fit_intercept': True, 'standardize_with_source': True, 'rho': 0.85}
[I 2026-06-02 00:47:54,485] Trial 292 finished with value: 0.23210670343553735 and parameters: {'alpha': 35058.71356714932, 'n_pcs': 5000, 'iw_method': 'pc_logistic', 'iw_clip_max': 4.0, 'iw_prob_clip': 0.007317943148006475, 'iw_n_components': 100, 'iw_logistic_c': 0.0004981589606825841, 'iw_pca_fit': 'combined', 'iw_solver': 'lbfgs', 'iw_rho': 0.85}. Best is trial 267 with value: 0.23317321415284004.
2026-06-02 00:47:54 | INFO | Trial 293 | outer=9 | alpha=4.538e+04 n_pcs=500 (pc_topk) weight={'name': 'pc_logistic', 'floor': 1e-06, 'clip_max': 4.0, 'prob_clip': 0.009676127690291103, 'n_components': 100, 'logistic_c': 0.992258440349981, 'pca_fit': 'combined', 'solver': 'lbfgs', 'max_iter': 2000, 'fit_intercept': True, 'standardize_with_source': True, 'rho': 1.0}
[I 2026-06-02 00:48:09,195] Trial 293 finished with value: 0.1676777955462714 and parameters: {'alpha': 45375.16284899046, 'n_pcs': 500, 'iw_method': 'pc_logistic', 'iw_clip_max': 4.0, 'iw_prob_clip': 0.009676127690291103, 'iw_n_components': 100, 'iw_logistic_c': 0.992258440349981, 'iw_pca_fit': 'combined', 'iw_solver': 'lbfgs', 'iw_rho': 1.0}. Best is trial 267 with value: 0.23317321415284004.
2026-06-02 00:48:09 | INFO | Trial 294 | outer=9 | alpha=3.559e+04 n_pcs=5000 (pc_topk) weight={'name': 'pc_logistic', 'floor': 1e-06, 'clip_max': 4.0, 'prob_clip': 0.008413444411849887, 'n_components': 100, 'logistic_c': 0.007684146011909981, 'pca_fit': 'combined', 'solver': 'lbfgs', 'max_iter': 2000, 'fit_intercept': True, 'standardize_with_source': True, 'rho': 0.85}
[I 2026-06-02 00:48:32,643] Trial 294 finished with value: 0.23255800514615443 and parameters: {'alpha': 35588.48811957532, 'n_pcs': 5000, 'iw_method': 'pc_logistic', 'iw_clip_max': 4.0, 'iw_prob_clip': 0.008413444411849887, 'iw_n_components': 100, 'iw_logistic_c': 0.007684146011909981, 'iw_pca_fit': 'combined', 'iw_solver': 'lbfgs', 'iw_rho': 0.85}. Best is trial 267 with value: 0.23317321415284004.
2026-06-02 00:48:32 | INFO | Trial 295 | outer=9 | alpha=4.361e+04 n_pcs=5000 (pc_topk) weight={'name': 'pc_logistic', 'floor': 1e-06, 'clip_max': 4.0, 'prob_clip': 0.00953257418812499, 'n_components': 100, 'logistic_c': 0.5029728529224524, 'pca_fit': 'combined', 'solver': 'lbfgs', 'max_iter': 2000, 'fit_intercept': True, 'standardize_with_source': True, 'rho': 0.85}
[I 2026-06-02 00:48:58,896] Trial 295 finished with value: 0.23312195736179878 and parameters: {'alpha': 43607.62476242808, 'n_pcs': 5000, 'iw_method': 'pc_logistic', 'iw_clip_max': 4.0, 'iw_prob_clip': 0.00953257418812499, 'iw_n_components': 100, 'iw_logistic_c': 0.5029728529224524, 'iw_pca_fit': 'combined', 'iw_solver': 'lbfgs', 'iw_rho': 0.85}. Best is trial 267 with value: 0.23317321415284004.
2026-06-02 00:48:58 | INFO | Trial 296 | outer=9 | alpha=4.578e+04 n_pcs=5000 (pc_topk) weight={'name': 'pc_logistic', 'floor': 1e-06, 'clip_max': 4.0, 'prob_clip': 0.010589395335206708, 'n_components': 100, 'logistic_c': 0.5489601880100865, 'pca_fit': 'combined', 'solver': 'lbfgs', 'max_iter': 2000, 'fit_intercept': True, 'standardize_with_source': True, 'rho': 0.3}
[I 2026-06-02 00:49:25,531] Trial 296 finished with value: 0.23212787683295383 and parameters: {'alpha': 45777.340973977465, 'n_pcs': 5000, 'iw_method': 'pc_logistic', 'iw_clip_max': 4.0, 'iw_prob_clip': 0.010589395335206708, 'iw_n_components': 100, 'iw_logistic_c': 0.5489601880100865, 'iw_pca_fit': 'combined', 'iw_solver': 'lbfgs', 'iw_rho': 0.3}. Best is trial 267 with value: 0.23317321415284004.
2026-06-02 00:49:25 | INFO | Trial 297 | outer=9 | alpha=4.441e+04 n_pcs=5000 (pc_topk) weight={'name': 'pc_logistic', 'floor': 1e-06, 'clip_max': 4.0, 'prob_clip': 0.009553615408191463, 'n_components': 100, 'logistic_c': 0.0015978045597069906, 'pca_fit': 'combined', 'solver': 'lbfgs', 'max_iter': 2000, 'fit_intercept': True, 'standardize_with_source': True, 'rho': 0.85}
[I 2026-06-02 00:49:46,423] Trial 297 finished with value: 0.23284171974886386 and parameters: {'alpha': 44412.96801298622, 'n_pcs': 5000, 'iw_method': 'pc_logistic', 'iw_clip_max': 4.0, 'iw_prob_clip': 0.009553615408191463, 'iw_n_components': 100, 'iw_logistic_c': 0.0015978045597069906, 'iw_pca_fit': 'combined', 'iw_solver': 'lbfgs', 'iw_rho': 0.85}. Best is trial 267 with value: 0.23317321415284004.
2026-06-02 00:49:46 | INFO | Trial 298 | outer=9 | alpha=3.504e+04 n_pcs=5000 (pc_topk) weight={'name': 'pc_logistic', 'floor': 1e-06, 'clip_max': 4.0, 'prob_clip': 0.010543041150593862, 'n_components': 100, 'logistic_c': 0.4577039871898036, 'pca_fit': 'combined', 'solver': 'lbfgs', 'max_iter': 2000, 'fit_intercept': True, 'standardize_with_source': True, 'rho': 0.85}
[I 2026-06-02 00:50:11,853] Trial 298 finished with value: 0.23261835186611074 and parameters: {'alpha': 35040.20155551477, 'n_pcs': 5000, 'iw_method': 'pc_logistic', 'iw_clip_max': 4.0, 'iw_prob_clip': 0.010543041150593862, 'iw_n_components': 100, 'iw_logistic_c': 0.4577039871898036, 'iw_pca_fit': 'combined', 'iw_solver': 'lbfgs', 'iw_rho': 0.85}. Best is trial 267 with value: 0.23317321415284004.
2026-06-02 00:50:11 | INFO | Trial 299 | outer=9 | alpha=4.527e+04 n_pcs=5000 (pc_topk) weight={'name': 'pc_logistic', 'floor': 1e-06, 'clip_max': 4.0, 'prob_clip': 0.00962292992838305, 'n_components': 100, 'logistic_c': 0.4908752919960539, 'pca_fit': 'combined', 'solver': 'lbfgs', 'max_iter': 2000, 'fit_intercept': True, 'standardize_with_source': True, 'rho': 0.5}
[I 2026-06-02 00:50:39,179] Trial 299 finished with value: 0.23282503429235382 and parameters: {'alpha': 45266.65775087601, 'n_pcs': 5000, 'iw_method': 'pc_logistic', 'iw_clip_max': 4.0, 'iw_prob_clip': 0.00962292992838305, 'iw_n_components': 100, 'iw_logistic_c': 0.4908752919960539, 'iw_pca_fit': 'combined', 'iw_solver': 'lbfgs', 'iw_rho': 0.5}. Best is trial 267 with value: 0.23317321415284004.
2026-06-02 00:50:39 | INFO | OUTER 9 best (inner mean r=0.2332): {'model_type': 'pc_ridge', 'alpha': 45332.57041526585, 'use_snp_selection': True, 'num_snps': 5000, 'n_pcs': 5000, 'weighting': {'name': 'pc_logistic', 'floor': 1e-06, 'clip_max': 4.0, 'prob_clip': 0.00904812465025861, 'n_components': 100, 'logistic_c': 0.3695128691579902, 'pca_fit': 'combined', 'solver': 'lbfgs', 'max_iter': 2000, 'fit_intercept': True, 'standardize_with_source': True, 'rho': 0.85}, 'mean_inner_effective_sample_size': 2779.7506606831944, 'mean_inner_effective_sample_size_threshold': 1027.26}
2026-06-02 00:50:42 | INFO | OUTER 9 TEST r = 0.1681
2026-06-02 00:50:42 | INFO | OUTER 9 incremental summary saved to outputs/final_results/e6_pc_ridge_importance/thr_wing/e6_pc_ridge_importance_thr_wing_results.json
2026-06-02 00:50:42 | INFO | OUTER 10: test_size=160 island=9 (Sleneset)
2026-06-02 00:50:42 | INFO | OUTER 10: using top 10 related inner validation islands for tuning: 8(Lovund, avgGRM=0.0219), 7(Onøy og Lurøy, avgGRM=0.0092), 2(Træna, avgGRM=0.0084), 3(Selvær, avgGRM=0.0056), 1(Myken, avgGRM=0.0044), 6(Indre Kvarøy, avgGRM=0.0038), 0(Nesøy, avgGRM=0.0013), 5(Hestmannøy, avgGRM=-0.0009), 4(Gjerøy, avgGRM=-0.0024), 12(Vega, avgGRM=-0.0042)
[I 2026-06-02 00:50:43,035] A new study created in memory with name: ridge_importance_inner_outer9
2026-06-02 00:50:43 | INFO | Trial 0 | outer=10 | alpha=1.137e+05 n_pcs=4000 (pc_topk) weight={'name': 'uniform'}
[I 2026-06-02 00:50:49,947] Trial 0 finished with value: 0.22202998330402232 and parameters: {'alpha': 113703.38004442609, 'n_pcs': 4000, 'iw_method': 'uniform'}. Best is trial 0 with value: 0.22202998330402232.
2026-06-02 00:50:49 | INFO | Trial 1 | outer=10 | alpha=1.734e+04 n_pcs=5000 (pc_topk) weight={'name': 'uniform'}
[I 2026-06-02 00:50:59,919] Trial 1 finished with value: 0.2203107889543216 and parameters: {'alpha': 17335.792577698634, 'n_pcs': 5000, 'iw_method': 'uniform'}. Best is trial 0 with value: 0.22202998330402232.
2026-06-02 00:50:59 | INFO | Trial 2 | outer=10 | alpha=1.435e+05 n_pcs=1500 (pc_topk) weight={'name': 'uniform'}
[I 2026-06-02 00:51:02,977] Trial 2 finished with value: 0.21248332476910314 and parameters: {'alpha': 143482.76912965564, 'n_pcs': 1500, 'iw_method': 'uniform'}. Best is trial 0 with value: 0.22202998330402232.
2026-06-02 00:51:02 | INFO | Trial 3 | outer=10 | alpha=1.431e+05 n_pcs=500 (pc_topk) weight={'name': 'uniform'}
[I 2026-06-02 00:51:04,422] Trial 3 finished with value: 0.18430009389395935 and parameters: {'alpha': 143072.2464444983, 'n_pcs': 500, 'iw_method': 'uniform'}. Best is trial 0 with value: 0.22202998330402232.
2026-06-02 00:51:04 | INFO | Trial 4 | outer=10 | alpha=5.373e+06 n_pcs=2000 (pc_topk) weight={'name': 'pc_logistic', 'floor': 1e-06, 'clip_max': 1.5, 'prob_clip': 0.001637400317167702, 'n_components': 80, 'logistic_c': 0.09386700500068379, 'pca_fit': 'combined', 'solver': 'lbfgs', 'max_iter': 2000, 'fit_intercept': True, 'standardize_with_source': True, 'rho': 1.0}
[I 2026-06-02 00:51:22,958] Trial 4 finished with value: 0.2046706421470918 and parameters: {'alpha': 5373167.4046281455, 'n_pcs': 2000, 'iw_method': 'pc_logistic', 'iw_clip_max': 1.5, 'iw_prob_clip': 0.001637400317167702, 'iw_n_components': 80, 'iw_logistic_c': 0.09386700500068379, 'iw_pca_fit': 'combined', 'iw_solver': 'lbfgs', 'iw_rho': 1.0}. Best is trial 0 with value: 0.22202998330402232.
2026-06-02 00:51:22 | INFO | Trial 5 | outer=10 | alpha=6.435e+04 n_pcs=1000 (pc_topk) weight={'name': 'pc_logistic', 'floor': 1e-06, 'clip_max': 7.0, 'prob_clip': 0.004193356127903791, 'n_components': 20, 'logistic_c': 9.236417519010976, 'pca_fit': 'combined', 'solver': 'lbfgs', 'max_iter': 2000, 'fit_intercept': True, 'standardize_with_source': True, 'rho': 1.0}
2026-06-02 00:51:35 | INFO | Trial 5 rejected by ESS guard: mean_ess=699.27 threshold=1025.64
[I 2026-06-02 00:51:35,456] Trial 5 finished with value: -1.0 and parameters: {'alpha': 64350.09539177312, 'n_pcs': 1000, 'iw_method': 'pc_logistic', 'iw_clip_max': 7.0, 'iw_prob_clip': 0.004193356127903791, 'iw_n_components': 20, 'iw_logistic_c': 9.236417519010976, 'iw_pca_fit': 'combined', 'iw_solver': 'lbfgs', 'iw_rho': 1.0}. Best is trial 0 with value: 0.22202998330402232.
2026-06-02 00:51:35 | INFO | Trial 6 | outer=10 | alpha=3.046e+05 n_pcs=3500 (pc_topk) weight={'name': 'pc_logistic', 'floor': 1e-06, 'clip_max': 12.0, 'prob_clip': 0.0007016380040663315, 'n_components': 80, 'logistic_c': 0.00021908930989278453, 'pca_fit': 'combined', 'solver': 'lbfgs', 'max_iter': 2000, 'fit_intercept': True, 'standardize_with_source': True, 'rho': 0.7}
[I 2026-06-02 00:51:48,904] Trial 6 finished with value: 0.22291687974144064 and parameters: {'alpha': 304631.0485153137, 'n_pcs': 3500, 'iw_method': 'pc_logistic', 'iw_clip_max': 12.0, 'iw_prob_clip': 0.0007016380040663315, 'iw_n_components': 80, 'iw_logistic_c': 0.00021908930989278453, 'iw_pca_fit': 'combined', 'iw_solver': 'lbfgs', 'iw_rho': 0.7}. Best is trial 6 with value: 0.22291687974144064.
2026-06-02 00:51:48 | INFO | Trial 7 | outer=10 | alpha=7.213e+06 n_pcs=500 (pc_topk) weight={'name': 'uniform'}
[I 2026-06-02 00:51:49,669] Trial 7 finished with value: 0.1756490139229539 and parameters: {'alpha': 7213019.60957054, 'n_pcs': 500, 'iw_method': 'uniform'}. Best is trial 6 with value: 0.22291687974144064.
2026-06-02 00:51:49 | INFO | Trial 8 | outer=10 | alpha=2.347e+03 n_pcs=3000 (pc_topk) weight={'name': 'pc_logistic', 'floor': 1e-06, 'clip_max': 2.5, 'prob_clip': 0.017782866059784724, 'n_components': 60, 'logistic_c': 4.584813955429537e-07, 'pca_fit': 'combined', 'solver': 'lbfgs', 'max_iter': 2000, 'fit_intercept': True, 'standardize_with_source': True, 'rho': 0.3}
[I 2026-06-02 00:51:58,064] Trial 8 finished with value: 0.1361816225368564 and parameters: {'alpha': 2346.6230871488538, 'n_pcs': 3000, 'iw_method': 'pc_logistic', 'iw_clip_max': 2.5, 'iw_prob_clip': 0.017782866059784724, 'iw_n_components': 60, 'iw_logistic_c': 4.584813955429537e-07, 'iw_pca_fit': 'combined', 'iw_solver': 'lbfgs', 'iw_rho': 0.3}. Best is trial 6 with value: 0.22291687974144064.
2026-06-02 00:51:58 | INFO | Trial 9 | outer=10 | alpha=1.067e+03 n_pcs=4000 (pc_topk) weight={'name': 'pc_logistic', 'floor': 1e-06, 'clip_max': 4.0, 'prob_clip': 0.003002704300062754, 'n_components': 10, 'logistic_c': 4.32601466983518e-06, 'pca_fit': 'combined', 'solver': 'lbfgs', 'max_iter': 2000, 'fit_intercept': True, 'standardize_with_source': True, 'rho': 1.0}
[I 2026-06-02 00:52:09,669] Trial 9 finished with value: 0.10287848827963467 and parameters: {'alpha': 1067.2105048492429, 'n_pcs': 4000, 'iw_method': 'pc_logistic', 'iw_clip_max': 4.0, 'iw_prob_clip': 0.003002704300062754, 'iw_n_components': 10, 'iw_logistic_c': 4.32601466983518e-06, 'iw_pca_fit': 'combined', 'iw_solver': 'lbfgs', 'iw_rho': 1.0}. Best is trial 6 with value: 0.22291687974144064.
2026-06-02 00:52:09 | INFO | Trial 10 | outer=10 | alpha=1.043e+06 n_pcs=3000 (pc_topk) weight={'name': 'pc_logistic', 'floor': 1e-06, 'clip_max': 12.0, 'prob_clip': 0.0006339528592388323, 'n_components': 80, 'logistic_c': 0.0003955644383080804, 'pca_fit': 'combined', 'solver': 'lbfgs', 'max_iter': 2000, 'fit_intercept': True, 'standardize_with_source': True, 'rho': 0.7}
[I 2026-06-02 00:52:21,677] Trial 10 finished with value: 0.21374290044774719 and parameters: {'alpha': 1042700.9089917552, 'n_pcs': 3000, 'iw_method': 'pc_logistic', 'iw_clip_max': 12.0, 'iw_prob_clip': 0.0006339528592388323, 'iw_n_components': 80, 'iw_logistic_c': 0.0003955644383080804, 'iw_pca_fit': 'combined', 'iw_solver': 'lbfgs', 'iw_rho': 0.7}. Best is trial 6 with value: 0.22291687974144064.
2026-06-02 00:52:21 | INFO | Trial 11 | outer=10 | alpha=7.333e+05 n_pcs=4000 (pc_topk) weight={'name': 'uniform'}
[I 2026-06-02 00:52:29,117] Trial 11 finished with value: 0.20526452600020959 and parameters: {'alpha': 733319.012080955, 'n_pcs': 4000, 'iw_method': 'uniform'}. Best is trial 6 with value: 0.22291687974144064.
2026-06-02 00:52:29 | INFO | Trial 12 | outer=10 | alpha=1.991e+04 n_pcs=4000 (pc_topk) weight={'name': 'pc_logistic', 'floor': 1e-06, 'clip_max': 12.0, 'prob_clip': 0.0005593063313063697, 'n_components': 100, 'logistic_c': 0.00045106102832414717, 'pca_fit': 'combined', 'solver': 'lbfgs', 'max_iter': 2000, 'fit_intercept': True, 'standardize_with_source': True, 'rho': 0.5}
