[I 2026-06-01 00:38:51,813] Trial 251 pruned. 
2026-06-01 00:38:51 | INFO | src.nested_cv_avggrm_weighted_unified | Trial 252 | outer=5 | alpha=8.334e+04 n_pcs=5000 (pc_topk) weight_search=on
2026-06-01 00:38:51 | INFO | src.nested_cv_avggrm_weighted_unified | Trial 252 | outer=5 | weight={'name': 'exponential', 'floor': 1e-06, 'clip_max': 5.0, 'beta': 8.370289866211056}
2026-06-01 00:38:57 | INFO | src.nested_cv_avggrm_weighted_unified | Trial 252 | outer=5 | pruned after 7/10 inner folds (mean r=0.2927)
[I 2026-06-01 00:38:57,318] Trial 252 pruned. 
2026-06-01 00:38:57 | INFO | src.nested_cv_avggrm_weighted_unified | Trial 253 | outer=5 | alpha=1.917e+05 n_pcs=4500 (pc_topk) weight_search=on
2026-06-01 00:38:57 | INFO | src.nested_cv_avggrm_weighted_unified | Trial 253 | outer=5 | weight={'name': 'exponential', 'floor': 1e-06, 'clip_max': 3.0, 'beta': 1.542731207677139}
2026-06-01 00:39:01 | INFO | src.nested_cv_avggrm_weighted_unified | Trial 253 | outer=5 | pruned after 6/10 inner folds (mean r=0.2593)
[I 2026-06-01 00:39:01,276] Trial 253 pruned. 
2026-06-01 00:39:01 | INFO | src.nested_cv_avggrm_weighted_unified | Trial 254 | outer=5 | alpha=9.937e+04 n_pcs=4500 (pc_topk) weight_search=on
2026-06-01 00:39:01 | INFO | src.nested_cv_avggrm_weighted_unified | Trial 254 | outer=5 | weight={'name': 'exponential', 'floor': 1e-06, 'clip_max': 5.0, 'beta': 8.807498606831421}
2026-06-01 00:39:05 | INFO | src.nested_cv_avggrm_weighted_unified | Trial 254 | outer=5 | pruned after 7/10 inner folds (mean r=0.2943)
[I 2026-06-01 00:39:05,911] Trial 254 pruned. 
2026-06-01 00:39:05 | INFO | src.nested_cv_avggrm_weighted_unified | Trial 255 | outer=5 | alpha=1.373e+05 n_pcs=4500 (pc_topk) weight_search=on
2026-06-01 00:39:05 | INFO | src.nested_cv_avggrm_weighted_unified | Trial 255 | outer=5 | weight={'name': 'exponential', 'floor': 1e-06, 'clip_max': 5.0, 'beta': 8.60034549348074}
[I 2026-06-01 00:39:12,517] Trial 255 finished with value: 0.25966600978731924 and parameters: {'alpha': 137291.67649903498, 'n_pcs': 4500, 'weight_scheme': 'exponential', 'weight_clip_max': 5.0, 'weight_exponential_beta': 8.60034549348074}. Best is trial 140 with value: 0.25996359913458195.
2026-06-01 00:39:12 | INFO | src.nested_cv_avggrm_weighted_unified | Trial 256 | outer=5 | alpha=7.909e+04 n_pcs=4500 (pc_topk) weight_search=on
2026-06-01 00:39:12 | INFO | src.nested_cv_avggrm_weighted_unified | Trial 256 | outer=5 | weight={'name': 'exponential', 'floor': 1e-06, 'clip_max': 5.0, 'beta': 8.203373126544216}
2026-06-01 00:39:17 | INFO | src.nested_cv_avggrm_weighted_unified | Trial 256 | outer=5 | pruned after 7/10 inner folds (mean r=0.2935)
[I 2026-06-01 00:39:17,161] Trial 256 pruned. 
2026-06-01 00:39:17 | INFO | src.nested_cv_avggrm_weighted_unified | Trial 257 | outer=5 | alpha=1.040e+05 n_pcs=4500 (pc_topk) weight_search=on
2026-06-01 00:39:17 | INFO | src.nested_cv_avggrm_weighted_unified | Trial 257 | outer=5 | weight={'name': 'exponential', 'floor': 1e-06, 'clip_max': 5.0, 'beta': 7.9316658207566775}
[I 2026-06-01 00:39:23,835] Trial 257 finished with value: 0.25988121039434203 and parameters: {'alpha': 103978.51644815705, 'n_pcs': 4500, 'weight_scheme': 'exponential', 'weight_clip_max': 5.0, 'weight_exponential_beta': 7.9316658207566775}. Best is trial 140 with value: 0.25996359913458195.
2026-06-01 00:39:23 | INFO | src.nested_cv_avggrm_weighted_unified | Trial 258 | outer=5 | alpha=5.815e+04 n_pcs=4500 (pc_topk) weight_search=on
2026-06-01 00:39:23 | INFO | src.nested_cv_avggrm_weighted_unified | Trial 258 | outer=5 | weight={'name': 'uniform', 'floor': 1e-06, 'clip_max': 5.0}
2026-06-01 00:39:27 | INFO | src.nested_cv_avggrm_weighted_unified | Trial 258 | outer=5 | pruned after 6/10 inner folds (mean r=0.2496)
[I 2026-06-01 00:39:27,435] Trial 258 pruned. 
2026-06-01 00:39:27 | INFO | src.nested_cv_avggrm_weighted_unified | Trial 259 | outer=5 | alpha=1.262e+05 n_pcs=5000 (pc_topk) weight_search=on
2026-06-01 00:39:27 | INFO | src.nested_cv_avggrm_weighted_unified | Trial 259 | outer=5 | weight={'name': 'exponential', 'floor': 1e-06, 'clip_max': 5.0, 'beta': 7.737474777982416}
2026-06-01 00:39:33 | INFO | src.nested_cv_avggrm_weighted_unified | Trial 259 | outer=5 | pruned after 7/10 inner folds (mean r=0.2939)
[I 2026-06-01 00:39:33,081] Trial 259 pruned. 
2026-06-01 00:39:33 | INFO | src.nested_cv_avggrm_weighted_unified | Trial 260 | outer=5 | alpha=9.547e+04 n_pcs=4500 (pc_topk) weight_search=on
2026-06-01 00:39:33 | INFO | src.nested_cv_avggrm_weighted_unified | Trial 260 | outer=5 | weight={'name': 'exponential', 'floor': 1e-06, 'clip_max': 5.0, 'beta': 8.504617755317849}
2026-06-01 00:39:37 | INFO | src.nested_cv_avggrm_weighted_unified | Trial 260 | outer=5 | pruned after 7/10 inner folds (mean r=0.2943)
[I 2026-06-01 00:39:37,747] Trial 260 pruned. 
2026-06-01 00:39:37 | INFO | src.nested_cv_avggrm_weighted_unified | Trial 261 | outer=5 | alpha=7.054e+04 n_pcs=4500 (pc_topk) weight_search=on
2026-06-01 00:39:37 | INFO | src.nested_cv_avggrm_weighted_unified | Trial 261 | outer=5 | weight={'name': 'exponential', 'floor': 1e-06, 'clip_max': 5.0, 'beta': 8.290287031347287}
2026-06-01 00:39:42 | INFO | src.nested_cv_avggrm_weighted_unified | Trial 261 | outer=5 | pruned after 7/10 inner folds (mean r=0.2927)
[I 2026-06-01 00:39:42,407] Trial 261 pruned. 
2026-06-01 00:39:42 | INFO | src.nested_cv_avggrm_weighted_unified | Trial 262 | outer=5 | alpha=1.580e+05 n_pcs=4500 (pc_topk) weight_search=on
2026-06-01 00:39:42 | INFO | src.nested_cv_avggrm_weighted_unified | Trial 262 | outer=5 | weight={'name': 'exponential', 'floor': 1e-06, 'clip_max': 5.0, 'beta': 7.907252272612251}
[I 2026-06-01 00:39:49,061] Trial 262 finished with value: 0.25917829980963764 and parameters: {'alpha': 157988.6023112897, 'n_pcs': 4500, 'weight_scheme': 'exponential', 'weight_clip_max': 5.0, 'weight_exponential_beta': 7.907252272612251}. Best is trial 140 with value: 0.25996359913458195.
2026-06-01 00:39:49 | INFO | src.nested_cv_avggrm_weighted_unified | Trial 263 | outer=5 | alpha=8.299e+04 n_pcs=4500 (pc_topk) weight_search=on
2026-06-01 00:39:49 | INFO | src.nested_cv_avggrm_weighted_unified | Trial 263 | outer=5 | weight={'name': 'exponential', 'floor': 1e-06, 'clip_max': 5.0, 'beta': 7.6556931626890155}
2026-06-01 00:39:53 | INFO | src.nested_cv_avggrm_weighted_unified | Trial 263 | outer=5 | pruned after 7/10 inner folds (mean r=0.2941)
[I 2026-06-01 00:39:53,723] Trial 263 pruned. 
2026-06-01 00:39:53 | INFO | src.nested_cv_avggrm_weighted_unified | Trial 264 | outer=5 | alpha=1.063e+05 n_pcs=4500 (pc_topk) weight_search=on
2026-06-01 00:39:53 | INFO | src.nested_cv_avggrm_weighted_unified | Trial 264 | outer=5 | weight={'name': 'exponential', 'floor': 1e-06, 'clip_max': 5.0, 'beta': 8.11888315427444}
[I 2026-06-01 00:40:00,369] Trial 264 finished with value: 0.2598961618300403 and parameters: {'alpha': 106342.64424969979, 'n_pcs': 4500, 'weight_scheme': 'exponential', 'weight_clip_max': 5.0, 'weight_exponential_beta': 8.11888315427444}. Best is trial 140 with value: 0.25996359913458195.
2026-06-01 00:40:00 | INFO | src.nested_cv_avggrm_weighted_unified | Trial 265 | outer=5 | alpha=1.274e+05 n_pcs=3000 (pc_topk) weight_search=on
2026-06-01 00:40:00 | INFO | src.nested_cv_avggrm_weighted_unified | Trial 265 | outer=5 | weight={'name': 'linear', 'floor': 1e-06, 'clip_max': 5.0, 'min_weight': 0.19572042282419888, 'max_weight': 4.192132905904803}
2026-06-01 00:40:02 | INFO | src.nested_cv_avggrm_weighted_unified | Trial 265 | outer=5 | pruned after 7/10 inner folds (mean r=0.2912)
[I 2026-06-01 00:40:02,959] Trial 265 pruned. 
2026-06-01 00:40:02 | INFO | src.nested_cv_avggrm_weighted_unified | Trial 266 | outer=5 | alpha=1.063e+05 n_pcs=4500 (pc_topk) weight_search=on
2026-06-01 00:40:02 | INFO | src.nested_cv_avggrm_weighted_unified | Trial 266 | outer=5 | weight={'name': 'exponential', 'floor': 1e-06, 'clip_max': None, 'beta': 8.086519453026133}
2026-06-01 00:40:07 | INFO | src.nested_cv_avggrm_weighted_unified | Trial 266 | outer=5 | pruned after 7/10 inner folds (mean r=0.2922)
[I 2026-06-01 00:40:07,636] Trial 266 pruned. 
2026-06-01 00:40:07 | INFO | src.nested_cv_avggrm_weighted_unified | Trial 267 | outer=5 | alpha=8.468e+04 n_pcs=5000 (pc_topk) weight_search=on
2026-06-01 00:40:07 | INFO | src.nested_cv_avggrm_weighted_unified | Trial 267 | outer=5 | weight={'name': 'exponential', 'floor': 1e-06, 'clip_max': 5.0, 'beta': 8.315717162929124}
2026-06-01 00:40:13 | INFO | src.nested_cv_avggrm_weighted_unified | Trial 267 | outer=5 | pruned after 7/10 inner folds (mean r=0.2928)
[I 2026-06-01 00:40:13,167] Trial 267 pruned. 
2026-06-01 00:40:13 | INFO | src.nested_cv_avggrm_weighted_unified | Trial 268 | outer=5 | alpha=1.377e+05 n_pcs=4500 (pc_topk) weight_search=on
2026-06-01 00:40:13 | INFO | src.nested_cv_avggrm_weighted_unified | Trial 268 | outer=5 | weight={'name': 'exponential', 'floor': 1e-06, 'clip_max': 5.0, 'beta': 8.528242119872829}
[I 2026-06-01 00:40:19,813] Trial 268 finished with value: 0.259658970978213 and parameters: {'alpha': 137653.65425793634, 'n_pcs': 4500, 'weight_scheme': 'exponential', 'weight_clip_max': 5.0, 'weight_exponential_beta': 8.528242119872829}. Best is trial 140 with value: 0.25996359913458195.
2026-06-01 00:40:19 | INFO | src.nested_cv_avggrm_weighted_unified | Trial 269 | outer=5 | alpha=1.182e+05 n_pcs=4500 (pc_topk) weight_search=on
2026-06-01 00:40:19 | INFO | src.nested_cv_avggrm_weighted_unified | Trial 269 | outer=5 | weight={'name': 'exponential', 'floor': 1e-06, 'clip_max': 5.0, 'beta': 8.138853330230269}
[I 2026-06-01 00:40:26,461] Trial 269 finished with value: 0.2598271350244456 and parameters: {'alpha': 118244.79579377646, 'n_pcs': 4500, 'weight_scheme': 'exponential', 'weight_clip_max': 5.0, 'weight_exponential_beta': 8.138853330230269}. Best is trial 140 with value: 0.25996359913458195.
2026-06-01 00:40:26 | INFO | src.nested_cv_avggrm_weighted_unified | Trial 270 | outer=5 | alpha=7.328e+04 n_pcs=4500 (pc_topk) weight_search=on
2026-06-01 00:40:26 | INFO | src.nested_cv_avggrm_weighted_unified | Trial 270 | outer=5 | weight={'name': 'exponential', 'floor': 1e-06, 'clip_max': 5.0, 'beta': 8.078596790124166}
2026-06-01 00:40:31 | INFO | src.nested_cv_avggrm_weighted_unified | Trial 270 | outer=5 | pruned after 7/10 inner folds (mean r=0.2931)
[I 2026-06-01 00:40:31,122] Trial 270 pruned. 
2026-06-01 00:40:31 | INFO | src.nested_cv_avggrm_weighted_unified | Trial 271 | outer=5 | alpha=1.647e+05 n_pcs=4500 (pc_topk) weight_search=on
2026-06-01 00:40:31 | INFO | src.nested_cv_avggrm_weighted_unified | Trial 271 | outer=5 | weight={'name': 'exponential', 'floor': 1e-06, 'clip_max': 5.0, 'beta': 8.746090625101656}
[I 2026-06-01 00:40:37,805] Trial 271 finished with value: 0.2592691507223683 and parameters: {'alpha': 164654.1857773818, 'n_pcs': 4500, 'weight_scheme': 'exponential', 'weight_clip_max': 5.0, 'weight_exponential_beta': 8.746090625101656}. Best is trial 140 with value: 0.25996359913458195.
2026-06-01 00:40:37 | INFO | src.nested_cv_avggrm_weighted_unified | Trial 272 | outer=5 | alpha=1.408e+03 n_pcs=4500 (pc_topk) weight_search=on
2026-06-01 00:40:37 | INFO | src.nested_cv_avggrm_weighted_unified | Trial 272 | outer=5 | weight={'name': 'exponential', 'floor': 1e-06, 'clip_max': 10.0, 'beta': 8.40445915033152}
2026-06-01 00:40:41 | INFO | src.nested_cv_avggrm_weighted_unified | Trial 272 | outer=5 | pruned after 5/10 inner folds (mean r=0.1935)
[I 2026-06-01 00:40:41,121] Trial 272 pruned. 
2026-06-01 00:40:41 | INFO | src.nested_cv_avggrm_weighted_unified | Trial 273 | outer=5 | alpha=9.615e+04 n_pcs=4500 (pc_topk) weight_search=on
2026-06-01 00:40:41 | INFO | src.nested_cv_avggrm_weighted_unified | Trial 273 | outer=5 | weight={'name': 'exponential', 'floor': 1e-06, 'clip_max': 5.0, 'beta': 7.935404169944739}
[I 2026-06-01 00:40:47,774] Trial 273 finished with value: 0.2598866701675338 and parameters: {'alpha': 96145.14550623817, 'n_pcs': 4500, 'weight_scheme': 'exponential', 'weight_clip_max': 5.0, 'weight_exponential_beta': 7.935404169944739}. Best is trial 140 with value: 0.25996359913458195.
2026-06-01 00:40:47 | INFO | src.nested_cv_avggrm_weighted_unified | Trial 274 | outer=5 | alpha=9.302e+04 n_pcs=4500 (pc_topk) weight_search=on
2026-06-01 00:40:47 | INFO | src.nested_cv_avggrm_weighted_unified | Trial 274 | outer=5 | weight={'name': 'exponential', 'floor': 1e-06, 'clip_max': 5.0, 'beta': 8.225222895547079}
2026-06-01 00:40:52 | INFO | src.nested_cv_avggrm_weighted_unified | Trial 274 | outer=5 | pruned after 7/10 inner folds (mean r=0.2943)
[I 2026-06-01 00:40:52,449] Trial 274 pruned. 
2026-06-01 00:40:52 | INFO | src.nested_cv_avggrm_weighted_unified | Trial 275 | outer=5 | alpha=6.326e+04 n_pcs=5000 (pc_topk) weight_search=on
2026-06-01 00:40:52 | INFO | src.nested_cv_avggrm_weighted_unified | Trial 275 | outer=5 | weight={'name': 'exponential', 'floor': 1e-06, 'clip_max': 5.0, 'beta': 7.973835987947872}
2026-06-01 00:40:57 | INFO | src.nested_cv_avggrm_weighted_unified | Trial 275 | outer=5 | pruned after 7/10 inner folds (mean r=0.2912)
[I 2026-06-01 00:40:57,975] Trial 275 pruned. 
2026-06-01 00:40:57 | INFO | src.nested_cv_avggrm_weighted_unified | Trial 276 | outer=5 | alpha=1.174e+05 n_pcs=4500 (pc_topk) weight_search=on
2026-06-01 00:40:57 | INFO | src.nested_cv_avggrm_weighted_unified | Trial 276 | outer=5 | weight={'name': 'exponential', 'floor': 1e-06, 'clip_max': 5.0, 'beta': 7.6126435541880975}
[I 2026-06-01 00:41:04,655] Trial 276 finished with value: 0.2597048484303628 and parameters: {'alpha': 117393.38880819842, 'n_pcs': 4500, 'weight_scheme': 'exponential', 'weight_clip_max': 5.0, 'weight_exponential_beta': 7.6126435541880975}. Best is trial 140 with value: 0.25996359913458195.
2026-06-01 00:41:04 | INFO | src.nested_cv_avggrm_weighted_unified | Trial 277 | outer=5 | alpha=8.246e+04 n_pcs=4500 (pc_topk) weight_search=on
2026-06-01 00:41:04 | INFO | src.nested_cv_avggrm_weighted_unified | Trial 277 | outer=5 | weight={'name': 'exponential', 'floor': 1e-06, 'clip_max': 5.0, 'beta': 8.531981646033083}
2026-06-01 00:41:09 | INFO | src.nested_cv_avggrm_weighted_unified | Trial 277 | outer=5 | pruned after 7/10 inner folds (mean r=0.2936)
[I 2026-06-01 00:41:09,312] Trial 277 pruned. 
2026-06-01 00:41:09 | INFO | src.nested_cv_avggrm_weighted_unified | Trial 278 | outer=5 | alpha=1.933e+05 n_pcs=4500 (pc_topk) weight_search=on
2026-06-01 00:41:09 | INFO | src.nested_cv_avggrm_weighted_unified | Trial 278 | outer=5 | weight={'name': 'exponential', 'floor': 1e-06, 'clip_max': 5.0, 'beta': 8.268345495818199}
[I 2026-06-01 00:41:15,960] Trial 278 finished with value: 0.2586524762296331 and parameters: {'alpha': 193256.93613877692, 'n_pcs': 4500, 'weight_scheme': 'exponential', 'weight_clip_max': 5.0, 'weight_exponential_beta': 8.268345495818199}. Best is trial 140 with value: 0.25996359913458195.
2026-06-01 00:41:15 | INFO | src.nested_cv_avggrm_weighted_unified | Trial 279 | outer=5 | alpha=1.421e+05 n_pcs=4500 (pc_topk) weight_search=on
2026-06-01 00:41:15 | INFO | src.nested_cv_avggrm_weighted_unified | Trial 279 | outer=5 | weight={'name': 'uniform', 'floor': 1e-06, 'clip_max': 5.0}
2026-06-01 00:41:18 | INFO | src.nested_cv_avggrm_weighted_unified | Trial 279 | outer=5 | pruned after 5/10 inner folds (mean r=0.2301)
[I 2026-06-01 00:41:18,860] Trial 279 pruned. 
2026-06-01 00:41:18 | INFO | src.nested_cv_avggrm_weighted_unified | Trial 280 | outer=5 | alpha=1.023e+05 n_pcs=4500 (pc_topk) weight_search=on
2026-06-01 00:41:18 | INFO | src.nested_cv_avggrm_weighted_unified | Trial 280 | outer=5 | weight={'name': 'exponential', 'floor': 1e-06, 'clip_max': 5.0, 'beta': 7.961163471117284}
[I 2026-06-01 00:41:25,506] Trial 280 finished with value: 0.2598893845134887 and parameters: {'alpha': 102286.19782467681, 'n_pcs': 4500, 'weight_scheme': 'exponential', 'weight_clip_max': 5.0, 'weight_exponential_beta': 7.961163471117284}. Best is trial 140 with value: 0.25996359913458195.
2026-06-01 00:41:25 | INFO | src.nested_cv_avggrm_weighted_unified | Trial 281 | outer=5 | alpha=8.570e+04 n_pcs=4500 (pc_topk) weight_search=on
2026-06-01 00:41:25 | INFO | src.nested_cv_avggrm_weighted_unified | Trial 281 | outer=5 | weight={'name': 'exponential', 'floor': 1e-06, 'clip_max': 3.0, 'beta': 8.130479550835151}
2026-06-01 00:41:30 | INFO | src.nested_cv_avggrm_weighted_unified | Trial 281 | outer=5 | pruned after 7/10 inner folds (mean r=0.2931)
[I 2026-06-01 00:41:30,158] Trial 281 pruned. 
2026-06-01 00:41:30 | INFO | src.nested_cv_avggrm_weighted_unified | Trial 282 | outer=5 | alpha=1.230e+05 n_pcs=4500 (pc_topk) weight_search=on
2026-06-01 00:41:30 | INFO | src.nested_cv_avggrm_weighted_unified | Trial 282 | outer=5 | weight={'name': 'exponential', 'floor': 1e-06, 'clip_max': 5.0, 'beta': 8.395872829130642}
[I 2026-06-01 00:41:36,840] Trial 282 finished with value: 0.2598105341808859 and parameters: {'alpha': 123037.76045209508, 'n_pcs': 4500, 'weight_scheme': 'exponential', 'weight_clip_max': 5.0, 'weight_exponential_beta': 8.395872829130642}. Best is trial 140 with value: 0.25996359913458195.
2026-06-01 00:41:36 | INFO | src.nested_cv_avggrm_weighted_unified | Trial 283 | outer=5 | alpha=7.063e+04 n_pcs=4500 (pc_topk) weight_search=on
2026-06-01 00:41:36 | INFO | src.nested_cv_avggrm_weighted_unified | Trial 283 | outer=5 | weight={'name': 'exponential', 'floor': 1e-06, 'clip_max': 5.0, 'beta': 8.044687858685382}
2026-06-01 00:41:41 | INFO | src.nested_cv_avggrm_weighted_unified | Trial 283 | outer=5 | pruned after 7/10 inner folds (mean r=0.2929)
[I 2026-06-01 00:41:41,504] Trial 283 pruned. 
2026-06-01 00:41:41 | INFO | src.nested_cv_avggrm_weighted_unified | Trial 284 | outer=5 | alpha=1.024e+05 n_pcs=4500 (pc_topk) weight_search=on
2026-06-01 00:41:41 | INFO | src.nested_cv_avggrm_weighted_unified | Trial 284 | outer=5 | weight={'name': 'exponential', 'floor': 1e-06, 'clip_max': 5.0, 'beta': 8.557785120967424}
[I 2026-06-01 00:41:48,187] Trial 284 finished with value: 0.25988376037780136 and parameters: {'alpha': 102409.5883795752, 'n_pcs': 4500, 'weight_scheme': 'exponential', 'weight_clip_max': 5.0, 'weight_exponential_beta': 8.557785120967424}. Best is trial 140 with value: 0.25996359913458195.
2026-06-01 00:41:48 | INFO | src.nested_cv_avggrm_weighted_unified | Trial 285 | outer=5 | alpha=1.593e+05 n_pcs=5000 (pc_topk) weight_search=on
2026-06-01 00:41:48 | INFO | src.nested_cv_avggrm_weighted_unified | Trial 285 | outer=5 | weight={'name': 'exponential', 'floor': 1e-06, 'clip_max': 5.0, 'beta': 8.914892878574038}
2026-06-01 00:41:53 | INFO | src.nested_cv_avggrm_weighted_unified | Trial 285 | outer=5 | pruned after 7/10 inner folds (mean r=0.2938)
[I 2026-06-01 00:41:53,687] Trial 285 pruned. 
2026-06-01 00:41:53 | INFO | src.nested_cv_avggrm_weighted_unified | Trial 286 | outer=5 | alpha=1.072e+05 n_pcs=4500 (pc_topk) weight_search=on
2026-06-01 00:41:53 | INFO | src.nested_cv_avggrm_weighted_unified | Trial 286 | outer=5 | weight={'name': 'exponential', 'floor': 1e-06, 'clip_max': 5.0, 'beta': 8.595253229732307}
[I 2026-06-01 00:42:00,328] Trial 286 finished with value: 0.25988230288036457 and parameters: {'alpha': 107172.55714099962, 'n_pcs': 4500, 'weight_scheme': 'exponential', 'weight_clip_max': 5.0, 'weight_exponential_beta': 8.595253229732307}. Best is trial 140 with value: 0.25996359913458195.
2026-06-01 00:42:00 | INFO | src.nested_cv_avggrm_weighted_unified | Trial 287 | outer=5 | alpha=1.310e+05 n_pcs=4500 (pc_topk) weight_search=on
2026-06-01 00:42:00 | INFO | src.nested_cv_avggrm_weighted_unified | Trial 287 | outer=5 | weight={'name': 'exponential', 'floor': 1e-06, 'clip_max': 5.0, 'beta': 6.05817037862885}
[I 2026-06-01 00:42:06,981] Trial 287 finished with value: 0.2588027011098067 and parameters: {'alpha': 131002.01938828686, 'n_pcs': 4500, 'weight_scheme': 'exponential', 'weight_clip_max': 5.0, 'weight_exponential_beta': 6.05817037862885}. Best is trial 140 with value: 0.25996359913458195.
2026-06-01 00:42:06 | INFO | src.nested_cv_avggrm_weighted_unified | Trial 288 | outer=5 | alpha=8.642e+04 n_pcs=4500 (pc_topk) weight_search=on
2026-06-01 00:42:06 | INFO | src.nested_cv_avggrm_weighted_unified | Trial 288 | outer=5 | weight={'name': 'exponential', 'floor': 1e-06, 'clip_max': 5.0, 'beta': 8.74797382148218}
2026-06-01 00:42:11 | INFO | src.nested_cv_avggrm_weighted_unified | Trial 288 | outer=5 | pruned after 7/10 inner folds (mean r=0.2937)
[I 2026-06-01 00:42:11,640] Trial 288 pruned. 
2026-06-01 00:42:11 | INFO | src.nested_cv_avggrm_weighted_unified | Trial 289 | outer=5 | alpha=5.599e+04 n_pcs=4500 (pc_topk) weight_search=on
2026-06-01 00:42:11 | INFO | src.nested_cv_avggrm_weighted_unified | Trial 289 | outer=5 | weight={'name': 'exponential', 'floor': 1e-06, 'clip_max': None, 'beta': 9.028072821138618}
2026-06-01 00:42:16 | INFO | src.nested_cv_avggrm_weighted_unified | Trial 289 | outer=5 | pruned after 7/10 inner folds (mean r=0.2901)
[I 2026-06-01 00:42:16,263] Trial 289 pruned. 
2026-06-01 00:42:16 | INFO | src.nested_cv_avggrm_weighted_unified | Trial 290 | outer=5 | alpha=1.103e+05 n_pcs=500 (pc_topk) weight_search=on
2026-06-01 00:42:16 | INFO | src.nested_cv_avggrm_weighted_unified | Trial 290 | outer=5 | weight={'name': 'linear', 'floor': 1e-06, 'clip_max': 5.0, 'min_weight': 0.7763717472874113, 'max_weight': 1.0111237913335325}
2026-06-01 00:42:16 | INFO | src.nested_cv_avggrm_weighted_unified | Trial 290 | outer=5 | pruned after 5/10 inner folds (mean r=0.1797)
