[I 2026-06-01 02:30:55,932] Trial 124 finished with value: 0.23570646376947005 and parameters: {'alpha': 97086.1732917827, 'n_pcs': 4000, 'weight_scheme': 'linear', 'weight_clip_max': 10.0, 'weight_linear_min_weight': 0.07248183257587185, 'weight_linear_max_weight': 2.6759004087593845}. Best is trial 123 with value: 0.2359010661619468.
2026-06-01 02:30:55 | INFO | src.nested_cv_avggrm_weighted_unified | Trial 125 | outer=10 | alpha=6.175e+04 n_pcs=1500 (pc_topk) weight_search=on
2026-06-01 02:30:55 | INFO | src.nested_cv_avggrm_weighted_unified | Trial 125 | outer=10 | weight={'name': 'linear', 'floor': 1e-06, 'clip_max': 10.0, 'min_weight': 0.07932454370495623, 'max_weight': 2.4975955248778354}
2026-06-01 02:30:57 | INFO | src.nested_cv_avggrm_weighted_unified | Trial 125 | outer=10 | pruned after 7/10 inner folds (mean r=0.2216)
[I 2026-06-01 02:30:57,355] Trial 125 pruned. 
2026-06-01 02:30:57 | INFO | src.nested_cv_avggrm_weighted_unified | Trial 126 | outer=10 | alpha=1.128e+05 n_pcs=4000 (pc_topk) weight_search=on
2026-06-01 02:30:57 | INFO | src.nested_cv_avggrm_weighted_unified | Trial 126 | outer=10 | weight={'name': 'linear', 'floor': 1e-06, 'clip_max': 10.0, 'min_weight': 0.10686100458385835, 'max_weight': 2.6469946998834146}
[I 2026-06-01 02:31:03,132] Trial 126 finished with value: 0.23584501224574264 and parameters: {'alpha': 112838.3473282901, 'n_pcs': 4000, 'weight_scheme': 'linear', 'weight_clip_max': 10.0, 'weight_linear_min_weight': 0.10686100458385835, 'weight_linear_max_weight': 2.6469946998834146}. Best is trial 123 with value: 0.2359010661619468.
2026-06-01 02:31:03 | INFO | src.nested_cv_avggrm_weighted_unified | Trial 127 | outer=10 | alpha=1.664e+05 n_pcs=3500 (pc_topk) weight_search=on
2026-06-01 02:31:03 | INFO | src.nested_cv_avggrm_weighted_unified | Trial 127 | outer=10 | weight={'name': 'linear', 'floor': 1e-06, 'clip_max': 10.0, 'min_weight': 0.10969153550558433, 'max_weight': 2.663219551444312}
[I 2026-06-01 02:31:08,674] Trial 127 finished with value: 0.23513219408820768 and parameters: {'alpha': 166391.30385657534, 'n_pcs': 3500, 'weight_scheme': 'linear', 'weight_clip_max': 10.0, 'weight_linear_min_weight': 0.10969153550558433, 'weight_linear_max_weight': 2.663219551444312}. Best is trial 123 with value: 0.2359010661619468.
2026-06-01 02:31:08 | INFO | src.nested_cv_avggrm_weighted_unified | Trial 128 | outer=10 | alpha=1.287e+05 n_pcs=4000 (pc_topk) weight_search=on
2026-06-01 02:31:08 | INFO | src.nested_cv_avggrm_weighted_unified | Trial 128 | outer=10 | weight={'name': 'linear', 'floor': 1e-06, 'clip_max': 10.0, 'min_weight': 0.07141404232481222, 'max_weight': 3.086667625532673}
[I 2026-06-01 02:31:14,431] Trial 128 finished with value: 0.23590165924304424 and parameters: {'alpha': 128651.73534028155, 'n_pcs': 4000, 'weight_scheme': 'linear', 'weight_clip_max': 10.0, 'weight_linear_min_weight': 0.07141404232481222, 'weight_linear_max_weight': 3.086667625532673}. Best is trial 128 with value: 0.23590165924304424.
2026-06-01 02:31:14 | INFO | src.nested_cv_avggrm_weighted_unified | OUTER 10 | new best trial 128 (mean inner r=0.2359) saved to outputs/final_results/e6_pc_ridge_avggrm/thr_wing/e6_pc_ridge_avggrm_thr_wing_best_trials/split_10_best_trial.json
2026-06-01 02:31:14 | INFO | src.nested_cv_avggrm_weighted_unified | Trial 129 | outer=10 | alpha=2.285e+05 n_pcs=4000 (pc_topk) weight_search=on
2026-06-01 02:31:14 | INFO | src.nested_cv_avggrm_weighted_unified | Trial 129 | outer=10 | weight={'name': 'linear', 'floor': 1e-06, 'clip_max': 10.0, 'min_weight': 0.10209361319352657, 'max_weight': 3.042291233179019}
[I 2026-06-01 02:31:20,595] Trial 129 finished with value: 0.23423073161369068 and parameters: {'alpha': 228496.30963254638, 'n_pcs': 4000, 'weight_scheme': 'linear', 'weight_clip_max': 10.0, 'weight_linear_min_weight': 0.10209361319352657, 'weight_linear_max_weight': 3.042291233179019}. Best is trial 128 with value: 0.23590165924304424.
2026-06-01 02:31:20 | INFO | src.nested_cv_avggrm_weighted_unified | Trial 130 | outer=10 | alpha=1.410e+05 n_pcs=4000 (pc_topk) weight_search=on
2026-06-01 02:31:20 | INFO | src.nested_cv_avggrm_weighted_unified | Trial 130 | outer=10 | weight={'name': 'linear', 'floor': 1e-06, 'clip_max': 10.0, 'min_weight': 0.07743589109045566, 'max_weight': 2.9097882259582195}
[I 2026-06-01 02:31:26,325] Trial 130 finished with value: 0.23579859290478353 and parameters: {'alpha': 140993.50680826936, 'n_pcs': 4000, 'weight_scheme': 'linear', 'weight_clip_max': 10.0, 'weight_linear_min_weight': 0.07743589109045566, 'weight_linear_max_weight': 2.9097882259582195}. Best is trial 128 with value: 0.23590165924304424.
2026-06-01 02:31:26 | INFO | src.nested_cv_avggrm_weighted_unified | Trial 131 | outer=10 | alpha=1.334e+05 n_pcs=4000 (pc_topk) weight_search=on
2026-06-01 02:31:26 | INFO | src.nested_cv_avggrm_weighted_unified | Trial 131 | outer=10 | weight={'name': 'linear', 'floor': 1e-06, 'clip_max': 10.0, 'min_weight': 0.07235886572786555, 'max_weight': 2.8981981125344802}
[I 2026-06-01 02:31:32,163] Trial 131 finished with value: 0.23586889170208317 and parameters: {'alpha': 133380.73934125085, 'n_pcs': 4000, 'weight_scheme': 'linear', 'weight_clip_max': 10.0, 'weight_linear_min_weight': 0.07235886572786555, 'weight_linear_max_weight': 2.8981981125344802}. Best is trial 128 with value: 0.23590165924304424.
2026-06-01 02:31:32 | INFO | src.nested_cv_avggrm_weighted_unified | Trial 132 | outer=10 | alpha=1.307e+05 n_pcs=4000 (pc_topk) weight_search=on
2026-06-01 02:31:32 | INFO | src.nested_cv_avggrm_weighted_unified | Trial 132 | outer=10 | weight={'name': 'linear', 'floor': 1e-06, 'clip_max': 10.0, 'min_weight': 0.07672283081350208, 'max_weight': 2.881176462206483}
[I 2026-06-01 02:31:38,398] Trial 132 finished with value: 0.23587588506885598 and parameters: {'alpha': 130678.67041404717, 'n_pcs': 4000, 'weight_scheme': 'linear', 'weight_clip_max': 10.0, 'weight_linear_min_weight': 0.07672283081350208, 'weight_linear_max_weight': 2.881176462206483}. Best is trial 128 with value: 0.23590165924304424.
2026-06-01 02:31:38 | INFO | src.nested_cv_avggrm_weighted_unified | Trial 133 | outer=10 | alpha=1.401e+05 n_pcs=3500 (pc_topk) weight_search=on
2026-06-01 02:31:38 | INFO | src.nested_cv_avggrm_weighted_unified | Trial 133 | outer=10 | weight={'name': 'linear', 'floor': 1e-06, 'clip_max': 10.0, 'min_weight': 0.0948393765963354, 'max_weight': 3.0901241197583236}
[I 2026-06-01 02:31:43,388] Trial 133 finished with value: 0.23547837797236554 and parameters: {'alpha': 140077.43640407769, 'n_pcs': 3500, 'weight_scheme': 'linear', 'weight_clip_max': 10.0, 'weight_linear_min_weight': 0.0948393765963354, 'weight_linear_max_weight': 3.0901241197583236}. Best is trial 128 with value: 0.23590165924304424.
2026-06-01 02:31:43 | INFO | src.nested_cv_avggrm_weighted_unified | Trial 134 | outer=10 | alpha=1.207e+05 n_pcs=4000 (pc_topk) weight_search=on
2026-06-01 02:31:43 | INFO | src.nested_cv_avggrm_weighted_unified | Trial 134 | outer=10 | weight={'name': 'linear', 'floor': 1e-06, 'clip_max': 10.0, 'min_weight': 0.11041283804591595, 'max_weight': 2.900653025429316}
[I 2026-06-01 02:31:49,867] Trial 134 finished with value: 0.23585317339943734 and parameters: {'alpha': 120677.5833093303, 'n_pcs': 4000, 'weight_scheme': 'linear', 'weight_clip_max': 10.0, 'weight_linear_min_weight': 0.11041283804591595, 'weight_linear_max_weight': 2.900653025429316}. Best is trial 128 with value: 0.23590165924304424.
2026-06-01 02:31:49 | INFO | src.nested_cv_avggrm_weighted_unified | Trial 135 | outer=10 | alpha=1.822e+05 n_pcs=4000 (pc_topk) weight_search=on
2026-06-01 02:31:49 | INFO | src.nested_cv_avggrm_weighted_unified | Trial 135 | outer=10 | weight={'name': 'linear', 'floor': 1e-06, 'clip_max': 10.0, 'min_weight': 0.1167386345041415, 'max_weight': 2.892876602583356}
[I 2026-06-01 02:31:56,108] Trial 135 finished with value: 0.23502535974384192 and parameters: {'alpha': 182171.7536325312, 'n_pcs': 4000, 'weight_scheme': 'linear', 'weight_clip_max': 10.0, 'weight_linear_min_weight': 0.1167386345041415, 'weight_linear_max_weight': 2.892876602583356}. Best is trial 128 with value: 0.23590165924304424.
2026-06-01 02:31:56 | INFO | src.nested_cv_avggrm_weighted_unified | Trial 136 | outer=10 | alpha=2.723e+05 n_pcs=4000 (pc_topk) weight_search=on
2026-06-01 02:31:56 | INFO | src.nested_cv_avggrm_weighted_unified | Trial 136 | outer=10 | weight={'name': 'linear', 'floor': 1e-06, 'clip_max': 10.0, 'min_weight': 0.07154896631768708, 'max_weight': 2.8814869223564843}
[I 2026-06-01 02:32:02,306] Trial 136 finished with value: 0.2335411227902669 and parameters: {'alpha': 272296.9630516739, 'n_pcs': 4000, 'weight_scheme': 'linear', 'weight_clip_max': 10.0, 'weight_linear_min_weight': 0.07154896631768708, 'weight_linear_max_weight': 2.8814869223564843}. Best is trial 128 with value: 0.23590165924304424.
2026-06-01 02:32:02 | INFO | src.nested_cv_avggrm_weighted_unified | Trial 137 | outer=10 | alpha=1.201e+05 n_pcs=4000 (pc_topk) weight_search=on
2026-06-01 02:32:02 | INFO | src.nested_cv_avggrm_weighted_unified | Trial 137 | outer=10 | weight={'name': 'linear', 'floor': 1e-06, 'clip_max': 10.0, 'min_weight': 0.09047618019431655, 'max_weight': 2.9721250725160364}
[I 2026-06-01 02:32:08,005] Trial 137 finished with value: 0.23589256964491662 and parameters: {'alpha': 120086.52050270823, 'n_pcs': 4000, 'weight_scheme': 'linear', 'weight_clip_max': 10.0, 'weight_linear_min_weight': 0.09047618019431655, 'weight_linear_max_weight': 2.9721250725160364}. Best is trial 128 with value: 0.23590165924304424.
2026-06-01 02:32:08 | INFO | src.nested_cv_avggrm_weighted_unified | Trial 138 | outer=10 | alpha=1.266e+05 n_pcs=3500 (pc_topk) weight_search=on
2026-06-01 02:32:08 | INFO | src.nested_cv_avggrm_weighted_unified | Trial 138 | outer=10 | weight={'name': 'uniform', 'floor': 1e-06, 'clip_max': 10.0}
2026-06-01 02:32:10 | INFO | src.nested_cv_avggrm_weighted_unified | Trial 138 | outer=10 | pruned after 7/10 inner folds (mean r=0.2321)
[I 2026-06-01 02:32:10,912] Trial 138 pruned. 
2026-06-01 02:32:10 | INFO | src.nested_cv_avggrm_weighted_unified | Trial 139 | outer=10 | alpha=2.088e+05 n_pcs=4000 (pc_topk) weight_search=on
2026-06-01 02:32:10 | INFO | src.nested_cv_avggrm_weighted_unified | Trial 139 | outer=10 | weight={'name': 'linear', 'floor': 1e-06, 'clip_max': 10.0, 'min_weight': 0.0929344522582211, 'max_weight': 2.9767417492646504}
[I 2026-06-01 02:32:16,617] Trial 139 finished with value: 0.23466165386460566 and parameters: {'alpha': 208756.89130353124, 'n_pcs': 4000, 'weight_scheme': 'linear', 'weight_clip_max': 10.0, 'weight_linear_min_weight': 0.0929344522582211, 'weight_linear_max_weight': 2.9767417492646504}. Best is trial 128 with value: 0.23590165924304424.
2026-06-01 02:32:16 | INFO | src.nested_cv_avggrm_weighted_unified | Trial 140 | outer=10 | alpha=1.605e+05 n_pcs=4000 (pc_topk) weight_search=on
2026-06-01 02:32:16 | INFO | src.nested_cv_avggrm_weighted_unified | Trial 140 | outer=10 | weight={'name': 'linear', 'floor': 1e-06, 'clip_max': 10.0, 'min_weight': 0.14202731231726987, 'max_weight': 3.047341587674118}
[I 2026-06-01 02:32:22,350] Trial 140 finished with value: 0.23532383908896026 and parameters: {'alpha': 160518.0535533613, 'n_pcs': 4000, 'weight_scheme': 'linear', 'weight_clip_max': 10.0, 'weight_linear_min_weight': 0.14202731231726987, 'weight_linear_max_weight': 3.047341587674118}. Best is trial 128 with value: 0.23590165924304424.
2026-06-01 02:32:22 | INFO | src.nested_cv_avggrm_weighted_unified | Trial 141 | outer=10 | alpha=1.181e+05 n_pcs=4000 (pc_topk) weight_search=on
2026-06-01 02:32:22 | INFO | src.nested_cv_avggrm_weighted_unified | Trial 141 | outer=10 | weight={'name': 'linear', 'floor': 1e-06, 'clip_max': 10.0, 'min_weight': 0.11300930858542235, 'max_weight': 2.8833428068399813}
[I 2026-06-01 02:32:28,034] Trial 141 finished with value: 0.2358520081796808 and parameters: {'alpha': 118090.29322290656, 'n_pcs': 4000, 'weight_scheme': 'linear', 'weight_clip_max': 10.0, 'weight_linear_min_weight': 0.11300930858542235, 'weight_linear_max_weight': 2.8833428068399813}. Best is trial 128 with value: 0.23590165924304424.
2026-06-01 02:32:28 | INFO | src.nested_cv_avggrm_weighted_unified | Trial 142 | outer=10 | alpha=1.199e+05 n_pcs=4000 (pc_topk) weight_search=on
2026-06-01 02:32:28 | INFO | src.nested_cv_avggrm_weighted_unified | Trial 142 | outer=10 | weight={'name': 'linear', 'floor': 1e-06, 'clip_max': 10.0, 'min_weight': 0.1079141071512831, 'max_weight': 2.7142863911670068}
[I 2026-06-01 02:32:33,769] Trial 142 finished with value: 0.23584499351976868 and parameters: {'alpha': 119932.42953927856, 'n_pcs': 4000, 'weight_scheme': 'linear', 'weight_clip_max': 10.0, 'weight_linear_min_weight': 0.1079141071512831, 'weight_linear_max_weight': 2.7142863911670068}. Best is trial 128 with value: 0.23590165924304424.
2026-06-01 02:32:33 | INFO | src.nested_cv_avggrm_weighted_unified | Trial 143 | outer=10 | alpha=1.219e+05 n_pcs=4000 (pc_topk) weight_search=on
2026-06-01 02:32:33 | INFO | src.nested_cv_avggrm_weighted_unified | Trial 143 | outer=10 | weight={'name': 'linear', 'floor': 1e-06, 'clip_max': 10.0, 'min_weight': 0.11064217368949907, 'max_weight': 2.7211205893112886}
[I 2026-06-01 02:32:39,473] Trial 143 finished with value: 0.23583289252319878 and parameters: {'alpha': 121896.84261247766, 'n_pcs': 4000, 'weight_scheme': 'linear', 'weight_clip_max': 10.0, 'weight_linear_min_weight': 0.11064217368949907, 'weight_linear_max_weight': 2.7211205893112886}. Best is trial 128 with value: 0.23590165924304424.
2026-06-01 02:32:39 | INFO | src.nested_cv_avggrm_weighted_unified | Trial 144 | outer=10 | alpha=1.174e+05 n_pcs=4000 (pc_topk) weight_search=on
2026-06-01 02:32:39 | INFO | src.nested_cv_avggrm_weighted_unified | Trial 144 | outer=10 | weight={'name': 'linear', 'floor': 1e-06, 'clip_max': 10.0, 'min_weight': 0.10742974113059023, 'max_weight': 2.5401663147792894}
[I 2026-06-01 02:32:45,168] Trial 144 finished with value: 0.2358347537459803 and parameters: {'alpha': 117413.34185162035, 'n_pcs': 4000, 'weight_scheme': 'linear', 'weight_clip_max': 10.0, 'weight_linear_min_weight': 0.10742974113059023, 'weight_linear_max_weight': 2.5401663147792894}. Best is trial 128 with value: 0.23590165924304424.
2026-06-01 02:32:45 | INFO | src.nested_cv_avggrm_weighted_unified | Trial 145 | outer=10 | alpha=1.173e+05 n_pcs=4000 (pc_topk) weight_search=on
2026-06-01 02:32:45 | INFO | src.nested_cv_avggrm_weighted_unified | Trial 145 | outer=10 | weight={'name': 'linear', 'floor': 1e-06, 'clip_max': 10.0, 'min_weight': 0.10673455310325991, 'max_weight': 2.569872303766775}
[I 2026-06-01 02:32:50,856] Trial 145 finished with value: 0.23583959056659923 and parameters: {'alpha': 117283.78696420643, 'n_pcs': 4000, 'weight_scheme': 'linear', 'weight_clip_max': 10.0, 'weight_linear_min_weight': 0.10673455310325991, 'weight_linear_max_weight': 2.569872303766775}. Best is trial 128 with value: 0.23590165924304424.
2026-06-01 02:32:50 | INFO | src.nested_cv_avggrm_weighted_unified | Trial 146 | outer=10 | alpha=1.838e+05 n_pcs=4000 (pc_topk) weight_search=on
2026-06-01 02:32:50 | INFO | src.nested_cv_avggrm_weighted_unified | Trial 146 | outer=10 | weight={'name': 'linear', 'floor': 1e-06, 'clip_max': 10.0, 'min_weight': 0.09070666637122156, 'max_weight': 2.546537129605673}
[I 2026-06-01 02:32:56,563] Trial 146 finished with value: 0.2350656867714022 and parameters: {'alpha': 183826.47081503275, 'n_pcs': 4000, 'weight_scheme': 'linear', 'weight_clip_max': 10.0, 'weight_linear_min_weight': 0.09070666637122156, 'weight_linear_max_weight': 2.546537129605673}. Best is trial 128 with value: 0.23590165924304424.
2026-06-01 02:32:56 | INFO | src.nested_cv_avggrm_weighted_unified | Trial 147 | outer=10 | alpha=1.203e+05 n_pcs=3500 (pc_topk) weight_search=on
2026-06-01 02:32:56 | INFO | src.nested_cv_avggrm_weighted_unified | Trial 147 | outer=10 | weight={'name': 'exponential', 'floor': 1e-06, 'clip_max': 10.0, 'beta': 4.002808068404107}
[I 2026-06-01 02:33:01,411] Trial 147 finished with value: 0.2338610877537642 and parameters: {'alpha': 120298.19651141949, 'n_pcs': 3500, 'weight_scheme': 'exponential', 'weight_clip_max': 10.0, 'weight_exponential_beta': 4.002808068404107}. Best is trial 128 with value: 0.23590165924304424.
2026-06-01 02:33:01 | INFO | src.nested_cv_avggrm_weighted_unified | Trial 148 | outer=10 | alpha=1.437e+05 n_pcs=4000 (pc_topk) weight_search=on
2026-06-01 02:33:01 | INFO | src.nested_cv_avggrm_weighted_unified | Trial 148 | outer=10 | weight={'name': 'linear', 'floor': 1e-06, 'clip_max': 10.0, 'min_weight': 0.6167420438898816, 'max_weight': 2.586171193342656}
2026-06-01 02:33:06 | INFO | src.nested_cv_avggrm_weighted_unified | Trial 148 | outer=10 | pruned after 8/10 inner folds (mean r=0.2665)
[I 2026-06-01 02:33:06,006] Trial 148 pruned. 
2026-06-01 02:33:06 | INFO | src.nested_cv_avggrm_weighted_unified | Trial 149 | outer=10 | alpha=6.388e+04 n_pcs=4000 (pc_topk) weight_search=on
2026-06-01 02:33:06 | INFO | src.nested_cv_avggrm_weighted_unified | Trial 149 | outer=10 | weight={'name': 'linear', 'floor': 1e-06, 'clip_max': 10.0, 'min_weight': 0.07071635920166604, 'max_weight': 2.4476701172488955}
[I 2026-06-01 02:33:11,756] Trial 149 finished with value: 0.23402297158375368 and parameters: {'alpha': 63879.26039984726, 'n_pcs': 4000, 'weight_scheme': 'linear', 'weight_clip_max': 10.0, 'weight_linear_min_weight': 0.07071635920166604, 'weight_linear_max_weight': 2.4476701172488955}. Best is trial 128 with value: 0.23590165924304424.
2026-06-01 02:33:11 | INFO | src.nested_cv_avggrm_weighted_unified | Trial 150 | outer=10 | alpha=3.190e+05 n_pcs=3500 (pc_topk) weight_search=on
2026-06-01 02:33:11 | INFO | src.nested_cv_avggrm_weighted_unified | Trial 150 | outer=10 | weight={'name': 'linear', 'floor': 1e-06, 'clip_max': 10.0, 'min_weight': 0.1079511276267224, 'max_weight': 3.372915688263183}
[I 2026-06-01 02:33:16,620] Trial 150 finished with value: 0.23252596957059685 and parameters: {'alpha': 319038.69028707815, 'n_pcs': 3500, 'weight_scheme': 'linear', 'weight_clip_max': 10.0, 'weight_linear_min_weight': 0.1079511276267224, 'weight_linear_max_weight': 3.372915688263183}. Best is trial 128 with value: 0.23590165924304424.
2026-06-01 02:33:16 | INFO | src.nested_cv_avggrm_weighted_unified | Trial 151 | outer=10 | alpha=1.077e+05 n_pcs=4000 (pc_topk) weight_search=on
2026-06-01 02:33:16 | INFO | src.nested_cv_avggrm_weighted_unified | Trial 151 | outer=10 | weight={'name': 'linear', 'floor': 1e-06, 'clip_max': 10.0, 'min_weight': 0.10816926149461052, 'max_weight': 2.710936641263542}
[I 2026-06-01 02:33:22,356] Trial 151 finished with value: 0.23582758959890912 and parameters: {'alpha': 107717.75932110265, 'n_pcs': 4000, 'weight_scheme': 'linear', 'weight_clip_max': 10.0, 'weight_linear_min_weight': 0.10816926149461052, 'weight_linear_max_weight': 2.710936641263542}. Best is trial 128 with value: 0.23590165924304424.
2026-06-01 02:33:22 | INFO | src.nested_cv_avggrm_weighted_unified | Trial 152 | outer=10 | alpha=1.189e+05 n_pcs=4000 (pc_topk) weight_search=on
2026-06-01 02:33:22 | INFO | src.nested_cv_avggrm_weighted_unified | Trial 152 | outer=10 | weight={'name': 'linear', 'floor': 1e-06, 'clip_max': 10.0, 'min_weight': 0.08955547377624758, 'max_weight': 2.7419964539772046}
[I 2026-06-01 02:33:28,102] Trial 152 finished with value: 0.23588398500688532 and parameters: {'alpha': 118948.0830292261, 'n_pcs': 4000, 'weight_scheme': 'linear', 'weight_clip_max': 10.0, 'weight_linear_min_weight': 0.08955547377624758, 'weight_linear_max_weight': 2.7419964539772046}. Best is trial 128 with value: 0.23590165924304424.
2026-06-01 02:33:28 | INFO | src.nested_cv_avggrm_weighted_unified | Trial 153 | outer=10 | alpha=1.684e+05 n_pcs=4000 (pc_topk) weight_search=on
2026-06-01 02:33:28 | INFO | src.nested_cv_avggrm_weighted_unified | Trial 153 | outer=10 | weight={'name': 'linear', 'floor': 1e-06, 'clip_max': 10.0, 'min_weight': 0.08768892593238968, 'max_weight': 2.777254857195552}
[I 2026-06-01 02:33:33,847] Trial 153 finished with value: 0.23538887978098547 and parameters: {'alpha': 168365.15471867163, 'n_pcs': 4000, 'weight_scheme': 'linear', 'weight_clip_max': 10.0, 'weight_linear_min_weight': 0.08768892593238968, 'weight_linear_max_weight': 2.777254857195552}. Best is trial 128 with value: 0.23590165924304424.
2026-06-01 02:33:33 | INFO | src.nested_cv_avggrm_weighted_unified | Trial 154 | outer=10 | alpha=2.390e+05 n_pcs=4000 (pc_topk) weight_search=on
2026-06-01 02:33:33 | INFO | src.nested_cv_avggrm_weighted_unified | Trial 154 | outer=10 | weight={'name': 'linear', 'floor': 1e-06, 'clip_max': 10.0, 'min_weight': 0.06399443130654223, 'max_weight': 2.467359891587993}
[I 2026-06-01 02:33:39,581] Trial 154 finished with value: 0.23416551864542834 and parameters: {'alpha': 238960.98405822433, 'n_pcs': 4000, 'weight_scheme': 'linear', 'weight_clip_max': 10.0, 'weight_linear_min_weight': 0.06399443130654223, 'weight_linear_max_weight': 2.467359891587993}. Best is trial 128 with value: 0.23590165924304424.
2026-06-01 02:33:39 | INFO | src.nested_cv_avggrm_weighted_unified | Trial 155 | outer=10 | alpha=1.183e+05 n_pcs=4000 (pc_topk) weight_search=on
2026-06-01 02:33:39 | INFO | src.nested_cv_avggrm_weighted_unified | Trial 155 | outer=10 | weight={'name': 'linear', 'floor': 1e-06, 'clip_max': 10.0, 'min_weight': 0.14369594804572514, 'max_weight': 2.633072140172513}
