[I 2026-06-01 00:44:31,884] Trial 23 finished with value: 0.22876144044552332 and parameters: {'alpha': 1902283.3594080245, 'n_pcs': 3500, 'weight_scheme': 'exponential', 'weight_clip_max': 5.0, 'weight_exponential_beta': 7.170834769892776}. Best is trial 16 with value: 0.23733190345414826.
2026-06-01 00:44:31 | INFO | src.nested_cv_avggrm_weighted_unified | Trial 24 | outer=6 | alpha=3.268e+04 n_pcs=4500 (pc_topk) weight_search=on
2026-06-01 00:44:31 | INFO | src.nested_cv_avggrm_weighted_unified | Trial 24 | outer=6 | weight={'name': 'exponential', 'floor': 1e-06, 'clip_max': None, 'beta': 6.709237262606126}
2026-06-01 00:44:36 | INFO | src.nested_cv_avggrm_weighted_unified | Trial 24 | outer=6 | pruned after 7/10 inner folds (mean r=0.2335)
[I 2026-06-01 00:44:36,315] Trial 24 pruned. 
2026-06-01 00:44:36 | INFO | src.nested_cv_avggrm_weighted_unified | Trial 25 | outer=6 | alpha=3.010e+05 n_pcs=3500 (pc_topk) weight_search=on
2026-06-01 00:44:36 | INFO | src.nested_cv_avggrm_weighted_unified | Trial 25 | outer=6 | weight={'name': 'exponential', 'floor': 1e-06, 'clip_max': 20.0, 'beta': 2.7286102892588895}
2026-06-01 00:44:39 | INFO | src.nested_cv_avggrm_weighted_unified | Trial 25 | outer=6 | pruned after 7/10 inner folds (mean r=0.2593)
[I 2026-06-01 00:44:39,485] Trial 25 pruned. 
2026-06-01 00:44:39 | INFO | src.nested_cv_avggrm_weighted_unified | Trial 26 | outer=6 | alpha=7.658e+05 n_pcs=4500 (pc_topk) weight_search=on
2026-06-01 00:44:39 | INFO | src.nested_cv_avggrm_weighted_unified | Trial 26 | outer=6 | weight={'name': 'uniform', 'floor': 1e-06, 'clip_max': 5.0}
2026-06-01 00:44:42 | INFO | src.nested_cv_avggrm_weighted_unified | Trial 26 | outer=6 | pruned after 5/10 inner folds (mean r=0.2064)
[I 2026-06-01 00:44:42,319] Trial 26 pruned. 
2026-06-01 00:44:42 | INFO | src.nested_cv_avggrm_weighted_unified | Trial 27 | outer=6 | alpha=9.729e+04 n_pcs=4000 (pc_topk) weight_search=on
2026-06-01 00:44:42 | INFO | src.nested_cv_avggrm_weighted_unified | Trial 27 | outer=6 | weight={'name': 'exponential', 'floor': 1e-06, 'clip_max': 10.0, 'beta': 3.757780192784344}
2026-06-01 00:44:45 | INFO | src.nested_cv_avggrm_weighted_unified | Trial 27 | outer=6 | pruned after 7/10 inner folds (mean r=0.2530)
[I 2026-06-01 00:44:45,895] Trial 27 pruned. 
2026-06-01 00:44:45 | INFO | src.nested_cv_avggrm_weighted_unified | Trial 28 | outer=6 | alpha=1.228e+06 n_pcs=3500 (pc_topk) weight_search=on
2026-06-01 00:44:45 | INFO | src.nested_cv_avggrm_weighted_unified | Trial 28 | outer=6 | weight={'name': 'exponential', 'floor': 1e-06, 'clip_max': 5.0, 'beta': 8.298650354898447}
[I 2026-06-01 00:44:50,239] Trial 28 finished with value: 0.23041847823747777 and parameters: {'alpha': 1228313.2447262288, 'n_pcs': 3500, 'weight_scheme': 'exponential', 'weight_clip_max': 5.0, 'weight_exponential_beta': 8.298650354898447}. Best is trial 16 with value: 0.23733190345414826.
2026-06-01 00:44:50 | INFO | src.nested_cv_avggrm_weighted_unified | Trial 29 | outer=6 | alpha=3.271e+06 n_pcs=4500 (pc_topk) weight_search=on
2026-06-01 00:44:50 | INFO | src.nested_cv_avggrm_weighted_unified | Trial 29 | outer=6 | weight={'name': 'uniform', 'floor': 1e-06, 'clip_max': None}
2026-06-01 00:44:53 | INFO | src.nested_cv_avggrm_weighted_unified | Trial 29 | outer=6 | pruned after 5/10 inner folds (mean r=0.1986)
[I 2026-06-01 00:44:53,043] Trial 29 pruned. 
2026-06-01 00:44:53 | INFO | src.nested_cv_avggrm_weighted_unified | Trial 30 | outer=6 | alpha=1.067e+05 n_pcs=4000 (pc_topk) weight_search=on
2026-06-01 00:44:53 | INFO | src.nested_cv_avggrm_weighted_unified | Trial 30 | outer=6 | weight={'name': 'exponential', 'floor': 1e-06, 'clip_max': 5.0, 'beta': 5.728917938356823}
2026-06-01 00:44:56 | INFO | src.nested_cv_avggrm_weighted_unified | Trial 30 | outer=6 | pruned after 7/10 inner folds (mean r=0.2579)
[I 2026-06-01 00:44:56,653] Trial 30 pruned. 
2026-06-01 00:44:56 | INFO | src.nested_cv_avggrm_weighted_unified | Trial 31 | outer=6 | alpha=3.091e+05 n_pcs=4000 (pc_topk) weight_search=on
2026-06-01 00:44:56 | INFO | src.nested_cv_avggrm_weighted_unified | Trial 31 | outer=6 | weight={'name': 'exponential', 'floor': 1e-06, 'clip_max': 5.0, 'beta': 7.430641993254369}
[I 2026-06-01 00:45:01,811] Trial 31 finished with value: 0.23636822782534658 and parameters: {'alpha': 309147.05806210305, 'n_pcs': 4000, 'weight_scheme': 'exponential', 'weight_clip_max': 5.0, 'weight_exponential_beta': 7.430641993254369}. Best is trial 16 with value: 0.23733190345414826.
2026-06-01 00:45:01 | INFO | src.nested_cv_avggrm_weighted_unified | Trial 32 | outer=6 | alpha=3.504e+05 n_pcs=4000 (pc_topk) weight_search=on
2026-06-01 00:45:01 | INFO | src.nested_cv_avggrm_weighted_unified | Trial 32 | outer=6 | weight={'name': 'exponential', 'floor': 1e-06, 'clip_max': 5.0, 'beta': 6.567156513841621}
[I 2026-06-01 00:45:06,973] Trial 32 finished with value: 0.23663356745626665 and parameters: {'alpha': 350377.4185720809, 'n_pcs': 4000, 'weight_scheme': 'exponential', 'weight_clip_max': 5.0, 'weight_exponential_beta': 6.567156513841621}. Best is trial 16 with value: 0.23733190345414826.
2026-06-01 00:45:06 | INFO | src.nested_cv_avggrm_weighted_unified | Trial 33 | outer=6 | alpha=2.026e+05 n_pcs=3500 (pc_topk) weight_search=on
2026-06-01 00:45:06 | INFO | src.nested_cv_avggrm_weighted_unified | Trial 33 | outer=6 | weight={'name': 'exponential', 'floor': 1e-06, 'clip_max': 5.0, 'beta': 7.758858664061094}
2026-06-01 00:45:09 | INFO | src.nested_cv_avggrm_weighted_unified | Trial 33 | outer=6 | pruned after 6/10 inner folds (mean r=0.2482)
[I 2026-06-01 00:45:09,696] Trial 33 pruned. 
2026-06-01 00:45:09 | INFO | src.nested_cv_avggrm_weighted_unified | Trial 34 | outer=6 | alpha=4.435e+05 n_pcs=4500 (pc_topk) weight_search=on
2026-06-01 00:45:09 | INFO | src.nested_cv_avggrm_weighted_unified | Trial 34 | outer=6 | weight={'name': 'exponential', 'floor': 1e-06, 'clip_max': 20.0, 'beta': 5.861319868442756}
2026-06-01 00:45:13 | INFO | src.nested_cv_avggrm_weighted_unified | Trial 34 | outer=6 | pruned after 6/10 inner folds (mean r=0.2320)
[I 2026-06-01 00:45:13,556] Trial 34 pruned. 
2026-06-01 00:45:13 | INFO | src.nested_cv_avggrm_weighted_unified | Trial 35 | outer=6 | alpha=1.059e+06 n_pcs=4000 (pc_topk) weight_search=on
2026-06-01 00:45:13 | INFO | src.nested_cv_avggrm_weighted_unified | Trial 35 | outer=6 | weight={'name': 'exponential', 'floor': 1e-06, 'clip_max': 5.0, 'beta': 6.862042428225406}
[I 2026-06-01 00:45:19,234] Trial 35 finished with value: 0.23212814395621756 and parameters: {'alpha': 1058669.212173339, 'n_pcs': 4000, 'weight_scheme': 'exponential', 'weight_clip_max': 5.0, 'weight_exponential_beta': 6.862042428225406}. Best is trial 16 with value: 0.23733190345414826.
2026-06-01 00:45:19 | INFO | src.nested_cv_avggrm_weighted_unified | Trial 36 | outer=6 | alpha=1.075e+05 n_pcs=5000 (pc_topk) weight_search=on
2026-06-01 00:45:19 | INFO | src.nested_cv_avggrm_weighted_unified | Trial 36 | outer=6 | weight={'name': 'exponential', 'floor': 1e-06, 'clip_max': 10.0, 'beta': 7.926767222727194}
2026-06-01 00:45:23 | INFO | src.nested_cv_avggrm_weighted_unified | Trial 36 | outer=6 | pruned after 6/10 inner folds (mean r=0.2382)
[I 2026-06-01 00:45:23,216] Trial 36 pruned. 
2026-06-01 00:45:23 | INFO | src.nested_cv_avggrm_weighted_unified | Trial 37 | outer=6 | alpha=1.879e+04 n_pcs=3500 (pc_topk) weight_search=on
2026-06-01 00:45:23 | INFO | src.nested_cv_avggrm_weighted_unified | Trial 37 | outer=6 | weight={'name': 'exponential', 'floor': 1e-06, 'clip_max': None, 'beta': 6.230545960135118}
2026-06-01 00:45:25 | INFO | src.nested_cv_avggrm_weighted_unified | Trial 37 | outer=6 | pruned after 6/10 inner folds (mean r=0.2125)
[I 2026-06-01 00:45:25,853] Trial 37 pruned. 
2026-06-01 00:45:25 | INFO | src.nested_cv_avggrm_weighted_unified | Trial 38 | outer=6 | alpha=1.913e+05 n_pcs=4000 (pc_topk) weight_search=on
2026-06-01 00:45:25 | INFO | src.nested_cv_avggrm_weighted_unified | Trial 38 | outer=6 | weight={'name': 'uniform', 'floor': 1e-06, 'clip_max': 5.0}
2026-06-01 00:45:28 | INFO | src.nested_cv_avggrm_weighted_unified | Trial 38 | outer=6 | pruned after 6/10 inner folds (mean r=0.2389)
[I 2026-06-01 00:45:28,561] Trial 38 pruned. 
2026-06-01 00:45:28 | INFO | src.nested_cv_avggrm_weighted_unified | Trial 39 | outer=6 | alpha=7.338e+04 n_pcs=2500 (pc_topk) weight_search=on
2026-06-01 00:45:28 | INFO | src.nested_cv_avggrm_weighted_unified | Trial 39 | outer=6 | weight={'name': 'exponential', 'floor': 1e-06, 'clip_max': 10.0, 'beta': 5.320636793341021}
2026-06-01 00:45:30 | INFO | src.nested_cv_avggrm_weighted_unified | Trial 39 | outer=6 | pruned after 6/10 inner folds (mean r=0.2310)
[I 2026-06-01 00:45:30,130] Trial 39 pruned. 
2026-06-01 00:45:30 | INFO | src.nested_cv_avggrm_weighted_unified | Trial 40 | outer=6 | alpha=3.269e+04 n_pcs=3000 (pc_topk) weight_search=on
2026-06-01 00:45:30 | INFO | src.nested_cv_avggrm_weighted_unified | Trial 40 | outer=6 | weight={'name': 'exponential', 'floor': 1e-06, 'clip_max': 5.0, 'beta': 3.7649704708049914}
2026-06-01 00:45:32 | INFO | src.nested_cv_avggrm_weighted_unified | Trial 40 | outer=6 | pruned after 7/10 inner folds (mean r=0.2374)
[I 2026-06-01 00:45:32,500] Trial 40 pruned. 
2026-06-01 00:45:32 | INFO | src.nested_cv_avggrm_weighted_unified | Trial 41 | outer=6 | alpha=4.064e+05 n_pcs=4000 (pc_topk) weight_search=on
2026-06-01 00:45:32 | INFO | src.nested_cv_avggrm_weighted_unified | Trial 41 | outer=6 | weight={'name': 'exponential', 'floor': 1e-06, 'clip_max': 5.0, 'beta': 6.611875285376952}
[I 2026-06-01 00:45:37,622] Trial 41 finished with value: 0.23623836902986892 and parameters: {'alpha': 406369.8095935044, 'n_pcs': 4000, 'weight_scheme': 'exponential', 'weight_clip_max': 5.0, 'weight_exponential_beta': 6.611875285376952}. Best is trial 16 with value: 0.23733190345414826.
2026-06-01 00:45:37 | INFO | src.nested_cv_avggrm_weighted_unified | Trial 42 | outer=6 | alpha=5.367e+05 n_pcs=4500 (pc_topk) weight_search=on
2026-06-01 00:45:37 | INFO | src.nested_cv_avggrm_weighted_unified | Trial 42 | outer=6 | weight={'name': 'exponential', 'floor': 1e-06, 'clip_max': 5.0, 'beta': 6.5992443084920405}
[I 2026-06-01 00:45:43,983] Trial 42 finished with value: 0.2344610859853496 and parameters: {'alpha': 536657.9324121705, 'n_pcs': 4500, 'weight_scheme': 'exponential', 'weight_clip_max': 5.0, 'weight_exponential_beta': 6.5992443084920405}. Best is trial 16 with value: 0.23733190345414826.
2026-06-01 00:45:43 | INFO | src.nested_cv_avggrm_weighted_unified | Trial 43 | outer=6 | alpha=2.310e+05 n_pcs=3500 (pc_topk) weight_search=on
2026-06-01 00:45:43 | INFO | src.nested_cv_avggrm_weighted_unified | Trial 43 | outer=6 | weight={'name': 'exponential', 'floor': 1e-06, 'clip_max': 5.0, 'beta': 7.406542947148352}
2026-06-01 00:45:47 | INFO | src.nested_cv_avggrm_weighted_unified | Trial 43 | outer=6 | pruned after 7/10 inner folds (mean r=0.2608)
[I 2026-06-01 00:45:47,064] Trial 43 pruned. 
2026-06-01 00:45:47 | INFO | src.nested_cv_avggrm_weighted_unified | Trial 44 | outer=6 | alpha=3.879e+05 n_pcs=4500 (pc_topk) weight_search=on
2026-06-01 00:45:47 | INFO | src.nested_cv_avggrm_weighted_unified | Trial 44 | outer=6 | weight={'name': 'exponential', 'floor': 1e-06, 'clip_max': 20.0, 'beta': 8.967853627853852}
2026-06-01 00:45:50 | INFO | src.nested_cv_avggrm_weighted_unified | Trial 44 | outer=6 | pruned after 6/10 inner folds (mean r=0.2310)
[I 2026-06-01 00:45:50,880] Trial 44 pruned. 
2026-06-01 00:45:50 | INFO | src.nested_cv_avggrm_weighted_unified | Trial 45 | outer=6 | alpha=1.342e+06 n_pcs=4000 (pc_topk) weight_search=on
2026-06-01 00:45:50 | INFO | src.nested_cv_avggrm_weighted_unified | Trial 45 | outer=6 | weight={'name': 'exponential', 'floor': 1e-06, 'clip_max': 3.0, 'beta': 4.1966380782462505}
[I 2026-06-01 00:45:56,017] Trial 45 finished with value: 0.22837745718455255 and parameters: {'alpha': 1342449.309281316, 'n_pcs': 4000, 'weight_scheme': 'exponential', 'weight_clip_max': 3.0, 'weight_exponential_beta': 4.1966380782462505}. Best is trial 16 with value: 0.23733190345414826.
2026-06-01 00:45:56 | INFO | src.nested_cv_avggrm_weighted_unified | Trial 46 | outer=6 | alpha=4.020e+03 n_pcs=4000 (pc_topk) weight_search=on
2026-06-01 00:45:56 | INFO | src.nested_cv_avggrm_weighted_unified | Trial 46 | outer=6 | weight={'name': 'exponential', 'floor': 1e-06, 'clip_max': 5.0, 'beta': 6.232440451764499}
2026-06-01 00:45:58 | INFO | src.nested_cv_avggrm_weighted_unified | Trial 46 | outer=6 | pruned after 5/10 inner folds (mean r=0.1760)
[I 2026-06-01 00:45:58,603] Trial 46 pruned. 
2026-06-01 00:45:58 | INFO | src.nested_cv_avggrm_weighted_unified | Trial 47 | outer=6 | alpha=7.031e+04 n_pcs=3000 (pc_topk) weight_search=on
2026-06-01 00:45:58 | INFO | src.nested_cv_avggrm_weighted_unified | Trial 47 | outer=6 | weight={'name': 'linear', 'floor': 1e-06, 'clip_max': 5.0, 'min_weight': 0.3629512657579377, 'max_weight': 2.399446156454588}
[I 2026-06-01 00:46:02,030] Trial 47 finished with value: 0.23358071343076364 and parameters: {'alpha': 70310.80176910739, 'n_pcs': 3000, 'weight_scheme': 'linear', 'weight_clip_max': 5.0, 'weight_linear_min_weight': 0.3629512657579377, 'weight_linear_max_weight': 2.399446156454588}. Best is trial 16 with value: 0.23733190345414826.
2026-06-01 00:46:02 | INFO | src.nested_cv_avggrm_weighted_unified | Trial 48 | outer=6 | alpha=7.712e+05 n_pcs=5000 (pc_topk) weight_search=on
2026-06-01 00:46:02 | INFO | src.nested_cv_avggrm_weighted_unified | Trial 48 | outer=6 | weight={'name': 'uniform', 'floor': 1e-06, 'clip_max': 5.0}
2026-06-01 00:46:04 | INFO | src.nested_cv_avggrm_weighted_unified | Trial 48 | outer=6 | pruned after 5/10 inner folds (mean r=0.2055)
[I 2026-06-01 00:46:04,977] Trial 48 pruned. 
2026-06-01 00:46:04 | INFO | src.nested_cv_avggrm_weighted_unified | Trial 49 | outer=6 | alpha=1.359e+05 n_pcs=4000 (pc_topk) weight_search=on
2026-06-01 00:46:04 | INFO | src.nested_cv_avggrm_weighted_unified | Trial 49 | outer=6 | weight={'name': 'exponential', 'floor': 1e-06, 'clip_max': 5.0, 'beta': 8.329895564664584}
2026-06-01 00:46:08 | INFO | src.nested_cv_avggrm_weighted_unified | Trial 49 | outer=6 | pruned after 6/10 inner folds (mean r=0.2436)
[I 2026-06-01 00:46:08,079] Trial 49 pruned. 
2026-06-01 00:46:08 | INFO | src.nested_cv_avggrm_weighted_unified | Trial 50 | outer=6 | alpha=4.115e+04 n_pcs=2500 (pc_topk) weight_search=on
2026-06-01 00:46:08 | INFO | src.nested_cv_avggrm_weighted_unified | Trial 50 | outer=6 | weight={'name': 'linear', 'floor': 1e-06, 'clip_max': 3.0, 'min_weight': 0.31994018115236955, 'max_weight': 3.4117078324545704}
2026-06-01 00:46:09 | INFO | src.nested_cv_avggrm_weighted_unified | Trial 50 | outer=6 | pruned after 7/10 inner folds (mean r=0.2402)
[I 2026-06-01 00:46:09,908] Trial 50 pruned. 
2026-06-01 00:46:09 | INFO | src.nested_cv_avggrm_weighted_unified | Trial 51 | outer=6 | alpha=2.824e+05 n_pcs=4500 (pc_topk) weight_search=on
2026-06-01 00:46:09 | INFO | src.nested_cv_avggrm_weighted_unified | Trial 51 | outer=6 | weight={'name': 'exponential', 'floor': 1e-06, 'clip_max': 5.0, 'beta': 5.251297535889427}
[I 2026-06-01 00:46:16,399] Trial 51 finished with value: 0.23635837947966282 and parameters: {'alpha': 282426.8291770981, 'n_pcs': 4500, 'weight_scheme': 'exponential', 'weight_clip_max': 5.0, 'weight_exponential_beta': 5.251297535889427}. Best is trial 16 with value: 0.23733190345414826.
2026-06-01 00:46:16 | INFO | src.nested_cv_avggrm_weighted_unified | Trial 52 | outer=6 | alpha=2.118e+05 n_pcs=4500 (pc_topk) weight_search=on
2026-06-01 00:46:16 | INFO | src.nested_cv_avggrm_weighted_unified | Trial 52 | outer=6 | weight={'name': 'exponential', 'floor': 1e-06, 'clip_max': 5.0, 'beta': 5.536953585513993}
[I 2026-06-01 00:46:22,833] Trial 52 finished with value: 0.23685424719953976 and parameters: {'alpha': 211849.4056034599, 'n_pcs': 4500, 'weight_scheme': 'exponential', 'weight_clip_max': 5.0, 'weight_exponential_beta': 5.536953585513993}. Best is trial 16 with value: 0.23733190345414826.
2026-06-01 00:46:22 | INFO | src.nested_cv_avggrm_weighted_unified | Trial 53 | outer=6 | alpha=1.584e+05 n_pcs=5000 (pc_topk) weight_search=on
2026-06-01 00:46:22 | INFO | src.nested_cv_avggrm_weighted_unified | Trial 53 | outer=6 | weight={'name': 'exponential', 'floor': 1e-06, 'clip_max': 5.0, 'beta': 5.555942996887659}
2026-06-01 00:46:27 | INFO | src.nested_cv_avggrm_weighted_unified | Trial 53 | outer=6 | pruned after 7/10 inner folds (mean r=0.2612)
[I 2026-06-01 00:46:27,495] Trial 53 pruned. 
2026-06-01 00:46:27 | INFO | src.nested_cv_avggrm_weighted_unified | Trial 54 | outer=6 | alpha=4.648e+05 n_pcs=4500 (pc_topk) weight_search=on
2026-06-01 00:46:27 | INFO | src.nested_cv_avggrm_weighted_unified | Trial 54 | outer=6 | weight={'name': 'exponential', 'floor': 1e-06, 'clip_max': 5.0, 'beta': 6.99723500538261}
[I 2026-06-01 00:46:33,928] Trial 54 finished with value: 0.23489833448692501 and parameters: {'alpha': 464783.1190750175, 'n_pcs': 4500, 'weight_scheme': 'exponential', 'weight_clip_max': 5.0, 'weight_exponential_beta': 6.99723500538261}. Best is trial 16 with value: 0.23733190345414826.
2026-06-01 00:46:33 | INFO | src.nested_cv_avggrm_weighted_unified | Trial 55 | outer=6 | alpha=7.255e+05 n_pcs=3500 (pc_topk) weight_search=on
2026-06-01 00:46:33 | INFO | src.nested_cv_avggrm_weighted_unified | Trial 55 | outer=6 | weight={'name': 'exponential', 'floor': 1e-06, 'clip_max': None, 'beta': 6.171059409419158}
2026-06-01 00:46:36 | INFO | src.nested_cv_avggrm_weighted_unified | Trial 55 | outer=6 | pruned after 5/10 inner folds (mean r=0.1830)
[I 2026-06-01 00:46:36,116] Trial 55 pruned. 
2026-06-01 00:46:36 | INFO | src.nested_cv_avggrm_weighted_unified | Trial 56 | outer=6 | alpha=8.476e+04 n_pcs=500 (pc_topk) weight_search=on
2026-06-01 00:46:36 | INFO | src.nested_cv_avggrm_weighted_unified | Trial 56 | outer=6 | weight={'name': 'exponential', 'floor': 1e-06, 'clip_max': 5.0, 'beta': 0.5332865149704409}
2026-06-01 00:46:36 | INFO | src.nested_cv_avggrm_weighted_unified | Trial 56 | outer=6 | pruned after 5/10 inner folds (mean r=0.1820)
[I 2026-06-01 00:46:36,508] Trial 56 pruned. 
2026-06-01 00:46:36 | INFO | src.nested_cv_avggrm_weighted_unified | Trial 57 | outer=6 | alpha=2.317e+05 n_pcs=4000 (pc_topk) weight_search=on
2026-06-01 00:46:36 | INFO | src.nested_cv_avggrm_weighted_unified | Trial 57 | outer=6 | weight={'name': 'exponential', 'floor': 1e-06, 'clip_max': 5.0, 'beta': 4.61954947796757}
[I 2026-06-01 00:46:42,325] Trial 57 finished with value: 0.23745149892178968 and parameters: {'alpha': 231707.65590842374, 'n_pcs': 4000, 'weight_scheme': 'exponential', 'weight_clip_max': 5.0, 'weight_exponential_beta': 4.61954947796757}. Best is trial 57 with value: 0.23745149892178968.
2026-06-01 00:46:42 | INFO | src.nested_cv_avggrm_weighted_unified | OUTER 6 | new best trial 57 (mean inner r=0.2375) saved to outputs/final_results/e6_pc_ridge_avggrm/thr_wing/e6_pc_ridge_avggrm_thr_wing_best_trials/split_06_best_trial.json
2026-06-01 00:46:42 | INFO | src.nested_cv_avggrm_weighted_unified | Trial 58 | outer=6 | alpha=1.419e+05 n_pcs=3500 (pc_topk) weight_search=on
2026-06-01 00:46:42 | INFO | src.nested_cv_avggrm_weighted_unified | Trial 58 | outer=6 | weight={'name': 'exponential', 'floor': 1e-06, 'clip_max': 20.0, 'beta': 4.371096085020743}
2026-06-01 00:46:45 | INFO | src.nested_cv_avggrm_weighted_unified | Trial 58 | outer=6 | pruned after 6/10 inner folds (mean r=0.2349)
[I 2026-06-01 00:46:45,072] Trial 58 pruned. 
2026-06-01 00:46:45 | INFO | src.nested_cv_avggrm_weighted_unified | Trial 59 | outer=6 | alpha=2.382e+05 n_pcs=4500 (pc_topk) weight_search=on
2026-06-01 00:46:45 | INFO | src.nested_cv_avggrm_weighted_unified | Trial 59 | outer=6 | weight={'name': 'linear', 'floor': 1e-06, 'clip_max': 10.0, 'min_weight': 0.6453295675053757, 'max_weight': 2.2885197165382296}
2026-06-01 00:46:48 | INFO | src.nested_cv_avggrm_weighted_unified | Trial 59 | outer=6 | pruned after 6/10 inner folds (mean r=0.2497)
[I 2026-06-01 00:46:48,882] Trial 59 pruned. 
2026-06-01 00:46:48 | INFO | src.nested_cv_avggrm_weighted_unified | Trial 60 | outer=6 | alpha=1.892e+05 n_pcs=5000 (pc_topk) weight_search=on
2026-06-01 00:46:48 | INFO | src.nested_cv_avggrm_weighted_unified | Trial 60 | outer=6 | weight={'name': 'uniform', 'floor': 1e-06, 'clip_max': 5.0}
2026-06-01 00:46:52 | INFO | src.nested_cv_avggrm_weighted_unified | Trial 60 | outer=6 | pruned after 6/10 inner folds (mean r=0.2391)
[I 2026-06-01 00:46:52,380] Trial 60 pruned. 
2026-06-01 00:46:52 | INFO | src.nested_cv_avggrm_weighted_unified | Trial 61 | outer=6 | alpha=3.400e+05 n_pcs=4000 (pc_topk) weight_search=on
2026-06-01 00:46:52 | INFO | src.nested_cv_avggrm_weighted_unified | Trial 61 | outer=6 | weight={'name': 'exponential', 'floor': 1e-06, 'clip_max': 5.0, 'beta': 6.177719025991217}
[I 2026-06-01 00:46:57,598] Trial 61 finished with value: 0.2367685699103539 and parameters: {'alpha': 339978.0011620439, 'n_pcs': 4000, 'weight_scheme': 'exponential', 'weight_clip_max': 5.0, 'weight_exponential_beta': 6.177719025991217}. Best is trial 57 with value: 0.23745149892178968.
2026-06-01 00:46:57 | INFO | src.nested_cv_avggrm_weighted_unified | Trial 62 | outer=6 | alpha=5.934e+05 n_pcs=4000 (pc_topk) weight_search=on
2026-06-01 00:46:57 | INFO | src.nested_cv_avggrm_weighted_unified | Trial 62 | outer=6 | weight={'name': 'exponential', 'floor': 1e-06, 'clip_max': 5.0, 'beta': 4.8588777651490505}
