[I 2026-06-01 02:47:31,965] Trial 18 pruned. 
2026-06-01 02:47:31 | INFO | src.nested_cv_avggrm_weighted_unified | Trial 19 | outer=11 | alpha=7.930e+06 n_pcs=1500 (pc_topk) weight_search=on
2026-06-01 02:47:31 | INFO | src.nested_cv_avggrm_weighted_unified | Trial 19 | outer=11 | weight={'name': 'uniform', 'floor': 1e-06, 'clip_max': 10.0}
2026-06-01 02:47:32 | INFO | src.nested_cv_avggrm_weighted_unified | Trial 19 | outer=11 | pruned after 5/10 inner folds (mean r=0.1821)
[I 2026-06-01 02:47:32,989] Trial 19 pruned. 
2026-06-01 02:47:32 | INFO | src.nested_cv_avggrm_weighted_unified | Trial 20 | outer=11 | alpha=2.250e+05 n_pcs=4000 (pc_topk) weight_search=on
2026-06-01 02:47:33 | INFO | src.nested_cv_avggrm_weighted_unified | Trial 20 | outer=11 | weight={'name': 'linear', 'floor': 1e-06, 'clip_max': None, 'min_weight': 0.6577837330614269, 'max_weight': 4.0895337242523135}
[I 2026-06-01 02:47:39,018] Trial 20 finished with value: 0.22184637493530546 and parameters: {'alpha': 225016.0639221979, 'n_pcs': 4000, 'weight_scheme': 'linear', 'weight_clip_max': None, 'weight_linear_min_weight': 0.6577837330614269, 'weight_linear_max_weight': 4.0895337242523135}. Best is trial 11 with value: 0.2253102040680785.
2026-06-01 02:47:39 | INFO | src.nested_cv_avggrm_weighted_unified | Trial 21 | outer=11 | alpha=1.042e+05 n_pcs=5000 (pc_topk) weight_search=on
2026-06-01 02:47:39 | INFO | src.nested_cv_avggrm_weighted_unified | Trial 21 | outer=11 | weight={'name': 'linear', 'floor': 1e-06, 'clip_max': 5.0, 'min_weight': 0.6646483078934308, 'max_weight': 4.946955986326245}
[I 2026-06-01 02:47:47,250] Trial 21 finished with value: 0.22503482911509534 and parameters: {'alpha': 104179.90210804253, 'n_pcs': 5000, 'weight_scheme': 'linear', 'weight_clip_max': 5.0, 'weight_linear_min_weight': 0.6646483078934308, 'weight_linear_max_weight': 4.946955986326245}. Best is trial 11 with value: 0.2253102040680785.
2026-06-01 02:47:47 | INFO | src.nested_cv_avggrm_weighted_unified | Trial 22 | outer=11 | alpha=4.477e+04 n_pcs=5000 (pc_topk) weight_search=on
2026-06-01 02:47:47 | INFO | src.nested_cv_avggrm_weighted_unified | Trial 22 | outer=11 | weight={'name': 'linear', 'floor': 1e-06, 'clip_max': 5.0, 'min_weight': 0.6002796511279526, 'max_weight': 4.488623330571066}
[I 2026-06-01 02:47:55,495] Trial 22 finished with value: 0.22507061247976243 and parameters: {'alpha': 44770.40398086098, 'n_pcs': 5000, 'weight_scheme': 'linear', 'weight_clip_max': 5.0, 'weight_linear_min_weight': 0.6002796511279526, 'weight_linear_max_weight': 4.488623330571066}. Best is trial 11 with value: 0.2253102040680785.
2026-06-01 02:47:55 | INFO | src.nested_cv_avggrm_weighted_unified | Trial 23 | outer=11 | alpha=3.573e+04 n_pcs=4500 (pc_topk) weight_search=on
2026-06-01 02:47:55 | INFO | src.nested_cv_avggrm_weighted_unified | Trial 23 | outer=11 | weight={'name': 'linear', 'floor': 1e-06, 'clip_max': 5.0, 'min_weight': 0.57657312221409, 'max_weight': 4.391406620514107}
[I 2026-06-01 02:48:02,499] Trial 23 finished with value: 0.2254888301284211 and parameters: {'alpha': 35727.994891844224, 'n_pcs': 4500, 'weight_scheme': 'linear', 'weight_clip_max': 5.0, 'weight_linear_min_weight': 0.57657312221409, 'weight_linear_max_weight': 4.391406620514107}. Best is trial 23 with value: 0.2254888301284211.
2026-06-01 02:48:02 | INFO | src.nested_cv_avggrm_weighted_unified | OUTER 11 | new best trial 23 (mean inner r=0.2255) saved to outputs/final_results/e6_pc_ridge_avggrm/thr_wing/e6_pc_ridge_avggrm_thr_wing_best_trials/split_11_best_trial.json
2026-06-01 02:48:02 | INFO | src.nested_cv_avggrm_weighted_unified | Trial 24 | outer=11 | alpha=1.888e+04 n_pcs=4500 (pc_topk) weight_search=on
2026-06-01 02:48:02 | INFO | src.nested_cv_avggrm_weighted_unified | Trial 24 | outer=11 | weight={'name': 'linear', 'floor': 1e-06, 'clip_max': 5.0, 'min_weight': 0.8099160250584129, 'max_weight': 3.3485228391175275}
[I 2026-06-01 02:48:09,561] Trial 24 finished with value: 0.21959367454579057 and parameters: {'alpha': 18876.000956991564, 'n_pcs': 4500, 'weight_scheme': 'linear', 'weight_clip_max': 5.0, 'weight_linear_min_weight': 0.8099160250584129, 'weight_linear_max_weight': 3.3485228391175275}. Best is trial 23 with value: 0.2254888301284211.
2026-06-01 02:48:09 | INFO | src.nested_cv_avggrm_weighted_unified | Trial 25 | outer=11 | alpha=6.664e+05 n_pcs=3000 (pc_topk) weight_search=on
2026-06-01 02:48:09 | INFO | src.nested_cv_avggrm_weighted_unified | Trial 25 | outer=11 | weight={'name': 'linear', 'floor': 1e-06, 'clip_max': 20.0, 'min_weight': 0.49961433571049974, 'max_weight': 4.311745109520975}
[I 2026-06-01 02:48:13,420] Trial 25 finished with value: 0.21631872591412526 and parameters: {'alpha': 666435.5363467848, 'n_pcs': 3000, 'weight_scheme': 'linear', 'weight_clip_max': 20.0, 'weight_linear_min_weight': 0.49961433571049974, 'weight_linear_max_weight': 4.311745109520975}. Best is trial 23 with value: 0.2254888301284211.
2026-06-01 02:48:13 | INFO | src.nested_cv_avggrm_weighted_unified | Trial 26 | outer=11 | alpha=9.881e+03 n_pcs=4500 (pc_topk) weight_search=on
2026-06-01 02:48:13 | INFO | src.nested_cv_avggrm_weighted_unified | Trial 26 | outer=11 | weight={'name': 'linear', 'floor': 1e-06, 'clip_max': 5.0, 'min_weight': 0.31546311578975467, 'max_weight': 2.3398841478379286}
[I 2026-06-01 02:48:20,491] Trial 26 finished with value: 0.20648029783484706 and parameters: {'alpha': 9881.336403243666, 'n_pcs': 4500, 'weight_scheme': 'linear', 'weight_clip_max': 5.0, 'weight_linear_min_weight': 0.31546311578975467, 'weight_linear_max_weight': 2.3398841478379286}. Best is trial 23 with value: 0.2254888301284211.
2026-06-01 02:48:20 | INFO | src.nested_cv_avggrm_weighted_unified | Trial 27 | outer=11 | alpha=2.741e+04 n_pcs=3500 (pc_topk) weight_search=on
2026-06-01 02:48:20 | INFO | src.nested_cv_avggrm_weighted_unified | Trial 27 | outer=11 | weight={'name': 'linear', 'floor': 1e-06, 'clip_max': 5.0, 'min_weight': 0.7828595078376374, 'max_weight': 1.8743482911627287}
[I 2026-06-01 02:48:25,546] Trial 27 finished with value: 0.2190757537855749 and parameters: {'alpha': 27405.365431397346, 'n_pcs': 3500, 'weight_scheme': 'linear', 'weight_clip_max': 5.0, 'weight_linear_min_weight': 0.7828595078376374, 'weight_linear_max_weight': 1.8743482911627287}. Best is trial 23 with value: 0.2254888301284211.
2026-06-01 02:48:25 | INFO | src.nested_cv_avggrm_weighted_unified | Trial 28 | outer=11 | alpha=1.007e+03 n_pcs=4000 (pc_topk) weight_search=on
2026-06-01 02:48:25 | INFO | src.nested_cv_avggrm_weighted_unified | Trial 28 | outer=11 | weight={'name': 'exponential', 'floor': 1e-06, 'clip_max': 5.0, 'beta': 4.7891066221006735}
2026-06-01 02:48:28 | INFO | src.nested_cv_avggrm_weighted_unified | Trial 28 | outer=11 | pruned after 5/10 inner folds (mean r=0.1429)
[I 2026-06-01 02:48:28,449] Trial 28 pruned. 
2026-06-01 02:48:28 | INFO | src.nested_cv_avggrm_weighted_unified | Trial 29 | outer=11 | alpha=9.717e+04 n_pcs=4500 (pc_topk) weight_search=on
2026-06-01 02:48:28 | INFO | src.nested_cv_avggrm_weighted_unified | Trial 29 | outer=11 | weight={'name': 'uniform', 'floor': 1e-06, 'clip_max': None}
[I 2026-06-01 02:48:34,585] Trial 29 finished with value: 0.21820134278969686 and parameters: {'alpha': 97174.88831074607, 'n_pcs': 4500, 'weight_scheme': 'uniform', 'weight_clip_max': None}. Best is trial 23 with value: 0.2254888301284211.
2026-06-01 02:48:34 | INFO | src.nested_cv_avggrm_weighted_unified | Trial 30 | outer=11 | alpha=1.602e+05 n_pcs=2500 (pc_topk) weight_search=on
2026-06-01 02:48:34 | INFO | src.nested_cv_avggrm_weighted_unified | Trial 30 | outer=11 | weight={'name': 'uniform', 'floor': 1e-06, 'clip_max': 3.0}
[I 2026-06-01 02:48:37,131] Trial 30 finished with value: 0.2165183807260735 and parameters: {'alpha': 160202.26351819522, 'n_pcs': 2500, 'weight_scheme': 'uniform', 'weight_clip_max': 3.0}. Best is trial 23 with value: 0.2254888301284211.
2026-06-01 02:48:37 | INFO | src.nested_cv_avggrm_weighted_unified | Trial 31 | outer=11 | alpha=6.144e+04 n_pcs=5000 (pc_topk) weight_search=on
2026-06-01 02:48:37 | INFO | src.nested_cv_avggrm_weighted_unified | Trial 31 | outer=11 | weight={'name': 'linear', 'floor': 1e-06, 'clip_max': 5.0, 'min_weight': 0.5834779622002038, 'max_weight': 4.447587601601483}
[I 2026-06-01 02:48:45,401] Trial 31 finished with value: 0.2257445478714155 and parameters: {'alpha': 61443.16691487875, 'n_pcs': 5000, 'weight_scheme': 'linear', 'weight_clip_max': 5.0, 'weight_linear_min_weight': 0.5834779622002038, 'weight_linear_max_weight': 4.447587601601483}. Best is trial 31 with value: 0.2257445478714155.
2026-06-01 02:48:45 | INFO | src.nested_cv_avggrm_weighted_unified | OUTER 11 | new best trial 31 (mean inner r=0.2257) saved to outputs/final_results/e6_pc_ridge_avggrm/thr_wing/e6_pc_ridge_avggrm_thr_wing_best_trials/split_11_best_trial.json
2026-06-01 02:48:45 | INFO | src.nested_cv_avggrm_weighted_unified | Trial 32 | outer=11 | alpha=4.197e+04 n_pcs=4000 (pc_topk) weight_search=on
2026-06-01 02:48:45 | INFO | src.nested_cv_avggrm_weighted_unified | Trial 32 | outer=11 | weight={'name': 'linear', 'floor': 1e-06, 'clip_max': 5.0, 'min_weight': 0.5559129166433044, 'max_weight': 3.625336409164992}
[I 2026-06-01 02:48:51,280] Trial 32 finished with value: 0.22438344432141624 and parameters: {'alpha': 41967.688703113294, 'n_pcs': 4000, 'weight_scheme': 'linear', 'weight_clip_max': 5.0, 'weight_linear_min_weight': 0.5559129166433044, 'weight_linear_max_weight': 3.625336409164992}. Best is trial 31 with value: 0.2257445478714155.
2026-06-01 02:48:51 | INFO | src.nested_cv_avggrm_weighted_unified | Trial 33 | outer=11 | alpha=6.999e+04 n_pcs=4500 (pc_topk) weight_search=on
2026-06-01 02:48:51 | INFO | src.nested_cv_avggrm_weighted_unified | Trial 33 | outer=11 | weight={'name': 'linear', 'floor': 1e-06, 'clip_max': 5.0, 'min_weight': 0.5764759515696637, 'max_weight': 4.507150705687468}
[I 2026-06-01 02:48:58,315] Trial 33 finished with value: 0.2271792215509159 and parameters: {'alpha': 69990.4661784538, 'n_pcs': 4500, 'weight_scheme': 'linear', 'weight_clip_max': 5.0, 'weight_linear_min_weight': 0.5764759515696637, 'weight_linear_max_weight': 4.507150705687468}. Best is trial 33 with value: 0.2271792215509159.
2026-06-01 02:48:58 | INFO | src.nested_cv_avggrm_weighted_unified | OUTER 11 | new best trial 33 (mean inner r=0.2272) saved to outputs/final_results/e6_pc_ridge_avggrm/thr_wing/e6_pc_ridge_avggrm_thr_wing_best_trials/split_11_best_trial.json
2026-06-01 02:48:58 | INFO | src.nested_cv_avggrm_weighted_unified | Trial 34 | outer=11 | alpha=6.392e+05 n_pcs=4500 (pc_topk) weight_search=on
2026-06-01 02:48:58 | INFO | src.nested_cv_avggrm_weighted_unified | Trial 34 | outer=11 | weight={'name': 'linear', 'floor': 1e-06, 'clip_max': 20.0, 'min_weight': 0.4028678888862406, 'max_weight': 4.337468575101497}
[I 2026-06-01 02:49:05,380] Trial 34 finished with value: 0.21542769271929046 and parameters: {'alpha': 639165.4977132153, 'n_pcs': 4500, 'weight_scheme': 'linear', 'weight_clip_max': 20.0, 'weight_linear_min_weight': 0.4028678888862406, 'weight_linear_max_weight': 4.337468575101497}. Best is trial 33 with value: 0.2271792215509159.
2026-06-01 02:49:05 | INFO | src.nested_cv_avggrm_weighted_unified | Trial 35 | outer=11 | alpha=8.008e+04 n_pcs=5000 (pc_topk) weight_search=on
2026-06-01 02:49:05 | INFO | src.nested_cv_avggrm_weighted_unified | Trial 35 | outer=11 | weight={'name': 'exponential', 'floor': 1e-06, 'clip_max': 10.0, 'beta': 5.214460680276901}
[I 2026-06-01 02:49:13,632] Trial 35 finished with value: 0.22345201728725952 and parameters: {'alpha': 80084.00009443279, 'n_pcs': 5000, 'weight_scheme': 'exponential', 'weight_clip_max': 10.0, 'weight_exponential_beta': 5.214460680276901}. Best is trial 33 with value: 0.2271792215509159.
2026-06-01 02:49:13 | INFO | src.nested_cv_avggrm_weighted_unified | Trial 36 | outer=11 | alpha=2.024e+05 n_pcs=4500 (pc_topk) weight_search=on
2026-06-01 02:49:13 | INFO | src.nested_cv_avggrm_weighted_unified | Trial 36 | outer=11 | weight={'name': 'linear', 'floor': 1e-06, 'clip_max': None, 'min_weight': 0.5625018454498885, 'max_weight': 2.723910053813859}
[I 2026-06-01 02:49:20,652] Trial 36 finished with value: 0.22182486360016784 and parameters: {'alpha': 202369.450200916, 'n_pcs': 4500, 'weight_scheme': 'linear', 'weight_clip_max': None, 'weight_linear_min_weight': 0.5625018454498885, 'weight_linear_max_weight': 2.723910053813859}. Best is trial 33 with value: 0.2271792215509159.
2026-06-01 02:49:20 | INFO | src.nested_cv_avggrm_weighted_unified | Trial 37 | outer=11 | alpha=2.234e+04 n_pcs=4000 (pc_topk) weight_search=on
2026-06-01 02:49:20 | INFO | src.nested_cv_avggrm_weighted_unified | Trial 37 | outer=11 | weight={'name': 'linear', 'floor': 1e-06, 'clip_max': 5.0, 'min_weight': 0.23983308054230187, 'max_weight': 3.725150001382462}
[I 2026-06-01 02:49:26,529] Trial 37 finished with value: 0.21605983237285745 and parameters: {'alpha': 22341.08904653709, 'n_pcs': 4000, 'weight_scheme': 'linear', 'weight_clip_max': 5.0, 'weight_linear_min_weight': 0.23983308054230187, 'weight_linear_max_weight': 3.725150001382462}. Best is trial 33 with value: 0.2271792215509159.
2026-06-01 02:49:26 | INFO | src.nested_cv_avggrm_weighted_unified | Trial 38 | outer=11 | alpha=6.845e+03 n_pcs=5000 (pc_topk) weight_search=on
2026-06-01 02:49:26 | INFO | src.nested_cv_avggrm_weighted_unified | Trial 38 | outer=11 | weight={'name': 'exponential', 'floor': 1e-06, 'clip_max': 3.0, 'beta': 6.321606982380546}
[I 2026-06-01 02:49:34,798] Trial 38 finished with value: 0.19565377691406222 and parameters: {'alpha': 6845.387809797455, 'n_pcs': 5000, 'weight_scheme': 'exponential', 'weight_clip_max': 3.0, 'weight_exponential_beta': 6.321606982380546}. Best is trial 33 with value: 0.2271792215509159.
2026-06-01 02:49:34 | INFO | src.nested_cv_avggrm_weighted_unified | Trial 39 | outer=11 | alpha=4.049e+05 n_pcs=4500 (pc_topk) weight_search=on
2026-06-01 02:49:34 | INFO | src.nested_cv_avggrm_weighted_unified | Trial 39 | outer=11 | weight={'name': 'linear', 'floor': 1e-06, 'clip_max': 10.0, 'min_weight': 0.5147011372989341, 'max_weight': 4.482287811383726}
[I 2026-06-01 02:49:41,806] Trial 39 finished with value: 0.21833294121142002 and parameters: {'alpha': 404876.49522537447, 'n_pcs': 4500, 'weight_scheme': 'linear', 'weight_clip_max': 10.0, 'weight_linear_min_weight': 0.5147011372989341, 'weight_linear_max_weight': 4.482287811383726}. Best is trial 33 with value: 0.2271792215509159.
2026-06-01 02:49:41 | INFO | src.nested_cv_avggrm_weighted_unified | Trial 40 | outer=11 | alpha=1.641e+06 n_pcs=4000 (pc_topk) weight_search=on
2026-06-01 02:49:41 | INFO | src.nested_cv_avggrm_weighted_unified | Trial 40 | outer=11 | weight={'name': 'exponential', 'floor': 1e-06, 'clip_max': 5.0, 'beta': 2.2720317738545}
[I 2026-06-01 02:49:47,591] Trial 40 finished with value: 0.21030564586274939 and parameters: {'alpha': 1640773.6098312896, 'n_pcs': 4000, 'weight_scheme': 'exponential', 'weight_clip_max': 5.0, 'weight_exponential_beta': 2.2720317738545}. Best is trial 33 with value: 0.2271792215509159.
2026-06-01 02:49:47 | INFO | src.nested_cv_avggrm_weighted_unified | Trial 41 | outer=11 | alpha=6.030e+04 n_pcs=3500 (pc_topk) weight_search=on
2026-06-01 02:49:47 | INFO | src.nested_cv_avggrm_weighted_unified | Trial 41 | outer=11 | weight={'name': 'linear', 'floor': 1e-06, 'clip_max': 5.0, 'min_weight': 0.6007467264517105, 'max_weight': 4.7124147865129205}
[I 2026-06-01 02:49:52,673] Trial 41 finished with value: 0.22573650038216372 and parameters: {'alpha': 60298.884623562495, 'n_pcs': 3500, 'weight_scheme': 'linear', 'weight_clip_max': 5.0, 'weight_linear_min_weight': 0.6007467264517105, 'weight_linear_max_weight': 4.7124147865129205}. Best is trial 33 with value: 0.2271792215509159.
2026-06-01 02:49:52 | INFO | src.nested_cv_avggrm_weighted_unified | Trial 42 | outer=11 | alpha=7.009e+04 n_pcs=3500 (pc_topk) weight_search=on
2026-06-01 02:49:52 | INFO | src.nested_cv_avggrm_weighted_unified | Trial 42 | outer=11 | weight={'name': 'linear', 'floor': 1e-06, 'clip_max': 5.0, 'min_weight': 0.575691871520343, 'max_weight': 4.085899618191661}
[I 2026-06-01 02:49:57,658] Trial 42 finished with value: 0.2261750590525729 and parameters: {'alpha': 70090.60553263906, 'n_pcs': 3500, 'weight_scheme': 'linear', 'weight_clip_max': 5.0, 'weight_linear_min_weight': 0.575691871520343, 'weight_linear_max_weight': 4.085899618191661}. Best is trial 33 with value: 0.2271792215509159.
2026-06-01 02:49:57 | INFO | src.nested_cv_avggrm_weighted_unified | Trial 43 | outer=11 | alpha=1.339e+04 n_pcs=4000 (pc_topk) weight_search=on
2026-06-01 02:49:57 | INFO | src.nested_cv_avggrm_weighted_unified | Trial 43 | outer=11 | weight={'name': 'linear', 'floor': 1e-06, 'clip_max': 5.0, 'min_weight': 0.5995824657326857, 'max_weight': 4.096375297834309}
[I 2026-06-01 02:50:03,412] Trial 43 finished with value: 0.20618009394441877 and parameters: {'alpha': 13394.937984256567, 'n_pcs': 4000, 'weight_scheme': 'linear', 'weight_clip_max': 5.0, 'weight_linear_min_weight': 0.5995824657326857, 'weight_linear_max_weight': 4.096375297834309}. Best is trial 33 with value: 0.2271792215509159.
2026-06-01 02:50:03 | INFO | src.nested_cv_avggrm_weighted_unified | Trial 44 | outer=11 | alpha=6.826e+04 n_pcs=5000 (pc_topk) weight_search=on
2026-06-01 02:50:03 | INFO | src.nested_cv_avggrm_weighted_unified | Trial 44 | outer=11 | weight={'name': 'linear', 'floor': 1e-06, 'clip_max': 20.0, 'min_weight': 0.7541971083495003, 'max_weight': 4.650889319679123}
[I 2026-06-01 02:50:11,656] Trial 44 finished with value: 0.22565318587804337 and parameters: {'alpha': 68259.71416200165, 'n_pcs': 5000, 'weight_scheme': 'linear', 'weight_clip_max': 20.0, 'weight_linear_min_weight': 0.7541971083495003, 'weight_linear_max_weight': 4.650889319679123}. Best is trial 33 with value: 0.2271792215509159.
2026-06-01 02:50:11 | INFO | src.nested_cv_avggrm_weighted_unified | Trial 45 | outer=11 | alpha=7.782e+04 n_pcs=5000 (pc_topk) weight_search=on
2026-06-01 02:50:11 | INFO | src.nested_cv_avggrm_weighted_unified | Trial 45 | outer=11 | weight={'name': 'linear', 'floor': 1e-06, 'clip_max': 20.0, 'min_weight': 0.8180048104929678, 'max_weight': 4.681678125746929}
[I 2026-06-01 02:50:19,906] Trial 45 finished with value: 0.22544895870756312 and parameters: {'alpha': 77823.30727587262, 'n_pcs': 5000, 'weight_scheme': 'linear', 'weight_clip_max': 20.0, 'weight_linear_min_weight': 0.8180048104929678, 'weight_linear_max_weight': 4.681678125746929}. Best is trial 33 with value: 0.2271792215509159.
2026-06-01 02:50:19 | INFO | src.nested_cv_avggrm_weighted_unified | Trial 46 | outer=11 | alpha=6.539e+04 n_pcs=2500 (pc_topk) weight_search=on
2026-06-01 02:50:19 | INFO | src.nested_cv_avggrm_weighted_unified | Trial 46 | outer=11 | weight={'name': 'linear', 'floor': 1e-06, 'clip_max': 20.0, 'min_weight': 0.7504429113425298, 'max_weight': 3.9310797934091317}
[I 2026-06-01 02:50:23,370] Trial 46 finished with value: 0.22620726900620083 and parameters: {'alpha': 65390.72037370599, 'n_pcs': 2500, 'weight_scheme': 'linear', 'weight_clip_max': 20.0, 'weight_linear_min_weight': 0.7504429113425298, 'weight_linear_max_weight': 3.9310797934091317}. Best is trial 33 with value: 0.2271792215509159.
2026-06-01 02:50:23 | INFO | src.nested_cv_avggrm_weighted_unified | Trial 47 | outer=11 | alpha=1.203e+05 n_pcs=2000 (pc_topk) weight_search=on
2026-06-01 02:50:23 | INFO | src.nested_cv_avggrm_weighted_unified | Trial 47 | outer=11 | weight={'name': 'linear', 'floor': 1e-06, 'clip_max': 20.0, 'min_weight': 0.6034146108908494, 'max_weight': 4.038727347174432}
[I 2026-06-01 02:50:26,769] Trial 47 finished with value: 0.22579970296815693 and parameters: {'alpha': 120251.89580314256, 'n_pcs': 2000, 'weight_scheme': 'linear', 'weight_clip_max': 20.0, 'weight_linear_min_weight': 0.6034146108908494, 'weight_linear_max_weight': 4.038727347174432}. Best is trial 33 with value: 0.2271792215509159.
2026-06-01 02:50:26 | INFO | src.nested_cv_avggrm_weighted_unified | Trial 48 | outer=11 | alpha=1.429e+05 n_pcs=2000 (pc_topk) weight_search=on
2026-06-01 02:50:26 | INFO | src.nested_cv_avggrm_weighted_unified | Trial 48 | outer=11 | weight={'name': 'uniform', 'floor': 1e-06, 'clip_max': 20.0}
2026-06-01 02:50:28 | INFO | src.nested_cv_avggrm_weighted_unified | Trial 48 | outer=11 | pruned after 7/10 inner folds (mean r=0.2553)
[I 2026-06-01 02:50:28,094] Trial 48 pruned. 
2026-06-01 02:50:28 | INFO | src.nested_cv_avggrm_weighted_unified | Trial 49 | outer=11 | alpha=2.422e+05 n_pcs=1500 (pc_topk) weight_search=on
2026-06-01 02:50:28 | INFO | src.nested_cv_avggrm_weighted_unified | Trial 49 | outer=11 | weight={'name': 'linear', 'floor': 1e-06, 'clip_max': 20.0, 'min_weight': 0.7187838742999055, 'max_weight': 3.9457254159920403}
[I 2026-06-01 02:50:30,014] Trial 49 finished with value: 0.21939461298445978 and parameters: {'alpha': 242205.81501423457, 'n_pcs': 1500, 'weight_scheme': 'linear', 'weight_clip_max': 20.0, 'weight_linear_min_weight': 0.7187838742999055, 'weight_linear_max_weight': 3.9457254159920403}. Best is trial 33 with value: 0.2271792215509159.
2026-06-01 02:50:30 | INFO | src.nested_cv_avggrm_weighted_unified | Trial 50 | outer=11 | alpha=3.443e+04 n_pcs=2500 (pc_topk) weight_search=on
2026-06-01 02:50:30 | INFO | src.nested_cv_avggrm_weighted_unified | Trial 50 | outer=11 | weight={'name': 'linear', 'floor': 1e-06, 'clip_max': 20.0, 'min_weight': 0.639011011851647, 'max_weight': 3.408663574886434}
