[I 2026-06-01 18:16:57,838] Trial 273 finished with value: 0.20046470458954527 and parameters: {'alpha': 73707.81723482136, 'n_pcs': 4500, 'iw_method': 'pc_logistic', 'iw_clip_max': 4.0, 'iw_prob_clip': 0.029204642419847993, 'iw_n_components': 100, 'iw_logistic_c': 2.1615572635332207e-05, 'iw_pca_fit': 'combined', 'iw_solver': 'lbfgs', 'iw_rho': 1.0}. Best is trial 203 with value: 0.20096057737722944.
2026-06-01 18:16:57 | INFO | Trial 274 | outer=4 | alpha=7.473e+04 n_pcs=4500 (pc_topk) weight={'name': 'pc_logistic', 'floor': 1e-06, 'clip_max': 4.0, 'prob_clip': 0.02949871240043375, 'n_components': 100, 'logistic_c': 7.2333383168248165e-06, 'pca_fit': 'combined', 'solver': 'lbfgs', 'max_iter': 2000, 'fit_intercept': True, 'standardize_with_source': True, 'rho': 1.0}
[I 2026-06-01 18:17:13,194] Trial 274 finished with value: 0.19849685111810617 and parameters: {'alpha': 74726.49240669032, 'n_pcs': 4500, 'iw_method': 'pc_logistic', 'iw_clip_max': 4.0, 'iw_prob_clip': 0.02949871240043375, 'iw_n_components': 100, 'iw_logistic_c': 7.2333383168248165e-06, 'iw_pca_fit': 'combined', 'iw_solver': 'lbfgs', 'iw_rho': 1.0}. Best is trial 203 with value: 0.20096057737722944.
2026-06-01 18:17:13 | INFO | Trial 275 | outer=4 | alpha=6.603e+04 n_pcs=4500 (pc_topk) weight={'name': 'uniform'}
[I 2026-06-01 18:17:22,220] Trial 275 finished with value: 0.19236935570380076 and parameters: {'alpha': 66034.9347080246, 'n_pcs': 4500, 'iw_method': 'uniform'}. Best is trial 203 with value: 0.20096057737722944.
2026-06-01 18:17:22 | INFO | Trial 276 | outer=4 | alpha=8.304e+04 n_pcs=4500 (pc_topk) weight={'name': 'pc_logistic', 'floor': 1e-06, 'clip_max': 4.0, 'prob_clip': 0.029792292844399278, 'n_components': 100, 'logistic_c': 1.4363231502049721e-05, 'pca_fit': 'combined', 'solver': 'lbfgs', 'max_iter': 2000, 'fit_intercept': True, 'standardize_with_source': True, 'rho': 1.0}
[I 2026-06-01 18:17:37,456] Trial 276 finished with value: 0.20098544878699612 and parameters: {'alpha': 83037.81169697603, 'n_pcs': 4500, 'iw_method': 'pc_logistic', 'iw_clip_max': 4.0, 'iw_prob_clip': 0.029792292844399278, 'iw_n_components': 100, 'iw_logistic_c': 1.4363231502049721e-05, 'iw_pca_fit': 'combined', 'iw_solver': 'lbfgs', 'iw_rho': 1.0}. Best is trial 276 with value: 0.20098544878699612.
2026-06-01 18:17:37 | INFO | Trial 277 | outer=4 | alpha=7.469e+04 n_pcs=4000 (pc_topk) weight={'name': 'pc_logistic', 'floor': 1e-06, 'clip_max': 4.0, 'prob_clip': 0.029951672066077725, 'n_components': 100, 'logistic_c': 3.5459699417983925e-05, 'pca_fit': 'combined', 'solver': 'lbfgs', 'max_iter': 2000, 'fit_intercept': True, 'standardize_with_source': True, 'rho': 1.0}
[I 2026-06-01 18:17:50,794] Trial 277 finished with value: 0.1986649114210532 and parameters: {'alpha': 74685.90871074404, 'n_pcs': 4000, 'iw_method': 'pc_logistic', 'iw_clip_max': 4.0, 'iw_prob_clip': 0.029951672066077725, 'iw_n_components': 100, 'iw_logistic_c': 3.5459699417983925e-05, 'iw_pca_fit': 'combined', 'iw_solver': 'lbfgs', 'iw_rho': 1.0}. Best is trial 276 with value: 0.20098544878699612.
2026-06-01 18:17:50 | INFO | Trial 278 | outer=4 | alpha=6.279e+04 n_pcs=4500 (pc_topk) weight={'name': 'pc_logistic', 'floor': 1e-06, 'clip_max': 4.0, 'prob_clip': 0.04376506510460244, 'n_components': 100, 'logistic_c': 1.589463664262728e-05, 'pca_fit': 'combined', 'solver': 'lbfgs', 'max_iter': 2000, 'fit_intercept': True, 'standardize_with_source': True, 'rho': 1.0}
[I 2026-06-01 18:18:06,372] Trial 278 finished with value: 0.20036356554345086 and parameters: {'alpha': 62789.271084676846, 'n_pcs': 4500, 'iw_method': 'pc_logistic', 'iw_clip_max': 4.0, 'iw_prob_clip': 0.04376506510460244, 'iw_n_components': 100, 'iw_logistic_c': 1.589463664262728e-05, 'iw_pca_fit': 'combined', 'iw_solver': 'lbfgs', 'iw_rho': 1.0}. Best is trial 276 with value: 0.20098544878699612.
2026-06-01 18:18:06 | INFO | Trial 279 | outer=4 | alpha=1.114e+05 n_pcs=4500 (pc_topk) weight={'name': 'pc_logistic', 'floor': 1e-06, 'clip_max': 4.0, 'prob_clip': 0.03286069463093857, 'n_components': 100, 'logistic_c': 2.2370541451774066e-05, 'pca_fit': 'combined', 'solver': 'lbfgs', 'max_iter': 2000, 'fit_intercept': True, 'standardize_with_source': True, 'rho': 1.0}
[I 2026-06-01 18:18:21,728] Trial 279 finished with value: 0.20001718913873212 and parameters: {'alpha': 111408.6035396643, 'n_pcs': 4500, 'iw_method': 'pc_logistic', 'iw_clip_max': 4.0, 'iw_prob_clip': 0.03286069463093857, 'iw_n_components': 100, 'iw_logistic_c': 2.2370541451774066e-05, 'iw_pca_fit': 'combined', 'iw_solver': 'lbfgs', 'iw_rho': 1.0}. Best is trial 276 with value: 0.20098544878699612.
2026-06-01 18:18:21 | INFO | Trial 280 | outer=4 | alpha=3.914e+04 n_pcs=4500 (pc_topk) weight={'name': 'pc_logistic', 'floor': 1e-06, 'clip_max': 7.0, 'prob_clip': 0.029121624463276468, 'n_components': 100, 'logistic_c': 1.3824455206365574e-05, 'pca_fit': 'combined', 'solver': 'lbfgs', 'max_iter': 2000, 'fit_intercept': True, 'standardize_with_source': True, 'rho': 1.0}
[I 2026-06-01 18:18:36,532] Trial 280 finished with value: 0.1963001529519875 and parameters: {'alpha': 39143.46165160988, 'n_pcs': 4500, 'iw_method': 'pc_logistic', 'iw_clip_max': 7.0, 'iw_prob_clip': 0.029121624463276468, 'iw_n_components': 100, 'iw_logistic_c': 1.3824455206365574e-05, 'iw_pca_fit': 'combined', 'iw_solver': 'lbfgs', 'iw_rho': 1.0}. Best is trial 276 with value: 0.20098544878699612.
2026-06-01 18:18:36 | INFO | Trial 281 | outer=4 | alpha=7.932e+04 n_pcs=4500 (pc_topk) weight={'name': 'pc_logistic', 'floor': 1e-06, 'clip_max': 4.0, 'prob_clip': 0.024824751830556876, 'n_components': 100, 'logistic_c': 6.235726249993361e-05, 'pca_fit': 'combined', 'solver': 'lbfgs', 'max_iter': 2000, 'fit_intercept': True, 'standardize_with_source': True, 'rho': 1.0}
[I 2026-06-01 18:18:52,856] Trial 281 finished with value: 0.19875382518006907 and parameters: {'alpha': 79317.1996595955, 'n_pcs': 4500, 'iw_method': 'pc_logistic', 'iw_clip_max': 4.0, 'iw_prob_clip': 0.024824751830556876, 'iw_n_components': 100, 'iw_logistic_c': 6.235726249993361e-05, 'iw_pca_fit': 'combined', 'iw_solver': 'lbfgs', 'iw_rho': 1.0}. Best is trial 276 with value: 0.20098544878699612.
2026-06-01 18:18:52 | INFO | Trial 282 | outer=4 | alpha=8.199e+04 n_pcs=4500 (pc_topk) weight={'name': 'pc_logistic', 'floor': 1e-06, 'clip_max': 4.0, 'prob_clip': 0.03448421934516257, 'n_components': 100, 'logistic_c': 3.498403414132444e-05, 'pca_fit': 'combined', 'solver': 'lbfgs', 'max_iter': 2000, 'fit_intercept': True, 'standardize_with_source': True, 'rho': 1.0}
[I 2026-06-01 18:19:22,250] Trial 282 finished with value: 0.19969852268294266 and parameters: {'alpha': 81989.90824868747, 'n_pcs': 4500, 'iw_method': 'pc_logistic', 'iw_clip_max': 4.0, 'iw_prob_clip': 0.03448421934516257, 'iw_n_components': 100, 'iw_logistic_c': 3.498403414132444e-05, 'iw_pca_fit': 'combined', 'iw_solver': 'lbfgs', 'iw_rho': 1.0}. Best is trial 276 with value: 0.20098544878699612.
2026-06-01 18:19:22 | INFO | Trial 283 | outer=4 | alpha=5.158e+04 n_pcs=500 (pc_topk) weight={'name': 'pc_logistic', 'floor': 1e-06, 'clip_max': 4.0, 'prob_clip': 0.040177842958585744, 'n_components': 100, 'logistic_c': 8.762093794072357e-06, 'pca_fit': 'combined', 'solver': 'lbfgs', 'max_iter': 2000, 'fit_intercept': True, 'standardize_with_source': True, 'rho': 1.0}
[I 2026-06-01 18:19:28,073] Trial 283 finished with value: 0.15577588464443018 and parameters: {'alpha': 51583.21059929078, 'n_pcs': 500, 'iw_method': 'pc_logistic', 'iw_clip_max': 4.0, 'iw_prob_clip': 0.040177842958585744, 'iw_n_components': 100, 'iw_logistic_c': 8.762093794072357e-06, 'iw_pca_fit': 'combined', 'iw_solver': 'lbfgs', 'iw_rho': 1.0}. Best is trial 276 with value: 0.20098544878699612.
2026-06-01 18:19:28 | INFO | Trial 284 | outer=4 | alpha=9.927e+04 n_pcs=4500 (pc_topk) weight={'name': 'pc_logistic', 'floor': 1e-06, 'clip_max': 4.0, 'prob_clip': 0.030509007062954768, 'n_components': 100, 'logistic_c': 1.958352183994317e-05, 'pca_fit': 'combined', 'solver': 'lbfgs', 'max_iter': 2000, 'fit_intercept': True, 'standardize_with_source': True, 'rho': 1.0}
[I 2026-06-01 18:20:07,487] Trial 284 finished with value: 0.20045193360292995 and parameters: {'alpha': 99268.15858783062, 'n_pcs': 4500, 'iw_method': 'pc_logistic', 'iw_clip_max': 4.0, 'iw_prob_clip': 0.030509007062954768, 'iw_n_components': 100, 'iw_logistic_c': 1.958352183994317e-05, 'iw_pca_fit': 'combined', 'iw_solver': 'lbfgs', 'iw_rho': 1.0}. Best is trial 276 with value: 0.20098544878699612.
2026-06-01 18:20:07 | INFO | Trial 285 | outer=4 | alpha=1.219e+05 n_pcs=1000 (pc_topk) weight={'name': 'pc_logistic', 'floor': 1e-06, 'clip_max': 4.0, 'prob_clip': 0.029406252640125544, 'n_components': 100, 'logistic_c': 9.104425555251695e-07, 'pca_fit': 'combined', 'solver': 'lbfgs', 'max_iter': 2000, 'fit_intercept': True, 'standardize_with_source': True, 'rho': 1.0}
[I 2026-06-01 18:20:14,841] Trial 285 finished with value: 0.1848266623106443 and parameters: {'alpha': 121929.21908991961, 'n_pcs': 1000, 'iw_method': 'pc_logistic', 'iw_clip_max': 4.0, 'iw_prob_clip': 0.029406252640125544, 'iw_n_components': 100, 'iw_logistic_c': 9.104425555251695e-07, 'iw_pca_fit': 'combined', 'iw_solver': 'lbfgs', 'iw_rho': 1.0}. Best is trial 276 with value: 0.20098544878699612.
2026-06-01 18:20:14 | INFO | Trial 286 | outer=4 | alpha=1.012e+05 n_pcs=4500 (pc_topk) weight={'name': 'pc_logistic', 'floor': 1e-06, 'clip_max': 1.5, 'prob_clip': 0.03159656306830565, 'n_components': 100, 'logistic_c': 1.2724783720895385e-05, 'pca_fit': 'combined', 'solver': 'lbfgs', 'max_iter': 2000, 'fit_intercept': True, 'standardize_with_source': True, 'rho': 0.5}
[I 2026-06-01 18:20:29,687] Trial 286 finished with value: 0.19394717913503173 and parameters: {'alpha': 101171.81772843852, 'n_pcs': 4500, 'iw_method': 'pc_logistic', 'iw_clip_max': 1.5, 'iw_prob_clip': 0.03159656306830565, 'iw_n_components': 100, 'iw_logistic_c': 1.2724783720895385e-05, 'iw_pca_fit': 'combined', 'iw_solver': 'lbfgs', 'iw_rho': 0.5}. Best is trial 276 with value: 0.20098544878699612.
2026-06-01 18:20:29 | INFO | Trial 287 | outer=4 | alpha=9.873e+04 n_pcs=3500 (pc_topk) weight={'name': 'pc_logistic', 'floor': 1e-06, 'clip_max': 4.0, 'prob_clip': 0.025818898172560296, 'n_components': 100, 'logistic_c': 1.4930539060196376e-05, 'pca_fit': 'combined', 'solver': 'lbfgs', 'max_iter': 2000, 'fit_intercept': True, 'standardize_with_source': True, 'rho': 1.0}
[I 2026-06-01 18:20:40,383] Trial 287 finished with value: 0.1986956846499932 and parameters: {'alpha': 98730.09129997613, 'n_pcs': 3500, 'iw_method': 'pc_logistic', 'iw_clip_max': 4.0, 'iw_prob_clip': 0.025818898172560296, 'iw_n_components': 100, 'iw_logistic_c': 1.4930539060196376e-05, 'iw_pca_fit': 'combined', 'iw_solver': 'lbfgs', 'iw_rho': 1.0}. Best is trial 276 with value: 0.20098544878699612.
2026-06-01 18:20:40 | INFO | Trial 288 | outer=4 | alpha=8.414e+04 n_pcs=4500 (pc_topk) weight={'name': 'pc_logistic', 'floor': 1e-06, 'clip_max': 4.0, 'prob_clip': 0.02837635403163261, 'n_components': 100, 'logistic_c': 5.055170972960174e-06, 'pca_fit': 'combined', 'solver': 'lbfgs', 'max_iter': 2000, 'fit_intercept': True, 'standardize_with_source': True, 'rho': 1.0}
[I 2026-06-01 18:21:06,407] Trial 288 finished with value: 0.19666751843541203 and parameters: {'alpha': 84137.30920410364, 'n_pcs': 4500, 'iw_method': 'pc_logistic', 'iw_clip_max': 4.0, 'iw_prob_clip': 0.02837635403163261, 'iw_n_components': 100, 'iw_logistic_c': 5.055170972960174e-06, 'iw_pca_fit': 'combined', 'iw_solver': 'lbfgs', 'iw_rho': 1.0}. Best is trial 276 with value: 0.20098544878699612.
2026-06-01 18:21:06 | INFO | Trial 289 | outer=4 | alpha=1.104e+05 n_pcs=4500 (pc_topk) weight={'name': 'pc_logistic', 'floor': 1e-06, 'clip_max': 4.0, 'prob_clip': 0.03234585467453526, 'n_components': 100, 'logistic_c': 0.004343709974534374, 'pca_fit': 'combined', 'solver': 'lbfgs', 'max_iter': 2000, 'fit_intercept': True, 'standardize_with_source': True, 'rho': 1.0}
[I 2026-06-01 18:21:28,891] Trial 289 finished with value: 0.1898918894105787 and parameters: {'alpha': 110387.79368473814, 'n_pcs': 4500, 'iw_method': 'pc_logistic', 'iw_clip_max': 4.0, 'iw_prob_clip': 0.03234585467453526, 'iw_n_components': 100, 'iw_logistic_c': 0.004343709974534374, 'iw_pca_fit': 'combined', 'iw_solver': 'lbfgs', 'iw_rho': 1.0}. Best is trial 276 with value: 0.20098544878699612.
2026-06-01 18:21:28 | INFO | Trial 290 | outer=4 | alpha=6.805e+04 n_pcs=4500 (pc_topk) weight={'name': 'pc_logistic', 'floor': 1e-06, 'clip_max': 4.0, 'prob_clip': 0.0016266305713886905, 'n_components': 100, 'logistic_c': 2.658413797494196e-05, 'pca_fit': 'combined', 'solver': 'lbfgs', 'max_iter': 2000, 'fit_intercept': True, 'standardize_with_source': True, 'rho': 1.0}
[I 2026-06-01 18:21:43,160] Trial 290 finished with value: 0.19690373392001098 and parameters: {'alpha': 68047.58184146156, 'n_pcs': 4500, 'iw_method': 'pc_logistic', 'iw_clip_max': 4.0, 'iw_prob_clip': 0.0016266305713886905, 'iw_n_components': 100, 'iw_logistic_c': 2.658413797494196e-05, 'iw_pca_fit': 'combined', 'iw_solver': 'lbfgs', 'iw_rho': 1.0}. Best is trial 276 with value: 0.20098544878699612.
2026-06-01 18:21:43 | INFO | Trial 291 | outer=4 | alpha=1.290e+05 n_pcs=4000 (pc_topk) weight={'name': 'pc_logistic', 'floor': 1e-06, 'clip_max': 4.0, 'prob_clip': 0.029575170471547892, 'n_components': 100, 'logistic_c': 0.0005933050485242583, 'pca_fit': 'combined', 'solver': 'lbfgs', 'max_iter': 2000, 'fit_intercept': True, 'standardize_with_source': True, 'rho': 1.0}
[I 2026-06-01 18:21:59,925] Trial 291 finished with value: 0.18856947701713228 and parameters: {'alpha': 129045.798090836, 'n_pcs': 4000, 'iw_method': 'pc_logistic', 'iw_clip_max': 4.0, 'iw_prob_clip': 0.029575170471547892, 'iw_n_components': 100, 'iw_logistic_c': 0.0005933050485242583, 'iw_pca_fit': 'combined', 'iw_solver': 'lbfgs', 'iw_rho': 1.0}. Best is trial 276 with value: 0.20098544878699612.
2026-06-01 18:21:59 | INFO | Trial 292 | outer=4 | alpha=8.440e+04 n_pcs=4500 (pc_topk) weight={'name': 'pc_logistic', 'floor': 1e-06, 'clip_max': 4.0, 'prob_clip': 0.0008685150528381692, 'n_components': 100, 'logistic_c': 1.883605392870624e-05, 'pca_fit': 'combined', 'solver': 'lbfgs', 'max_iter': 2000, 'fit_intercept': True, 'standardize_with_source': True, 'rho': 1.0}
[I 2026-06-01 18:22:15,693] Trial 292 finished with value: 0.1978750756257343 and parameters: {'alpha': 84400.11731864519, 'n_pcs': 4500, 'iw_method': 'pc_logistic', 'iw_clip_max': 4.0, 'iw_prob_clip': 0.0008685150528381692, 'iw_n_components': 100, 'iw_logistic_c': 1.883605392870624e-05, 'iw_pca_fit': 'combined', 'iw_solver': 'lbfgs', 'iw_rho': 1.0}. Best is trial 276 with value: 0.20098544878699612.
2026-06-01 18:22:15 | INFO | Trial 293 | outer=4 | alpha=6.781e+04 n_pcs=4500 (pc_topk) weight={'name': 'pc_logistic', 'floor': 1e-06, 'clip_max': 4.0, 'prob_clip': 0.024630169470005625, 'n_components': 100, 'logistic_c': 8.219824942163264e-06, 'pca_fit': 'combined', 'solver': 'lbfgs', 'max_iter': 2000, 'fit_intercept': True, 'standardize_with_source': True, 'rho': 1.0}
[I 2026-06-01 18:22:30,731] Trial 293 finished with value: 0.19899795875533216 and parameters: {'alpha': 67812.03025869888, 'n_pcs': 4500, 'iw_method': 'pc_logistic', 'iw_clip_max': 4.0, 'iw_prob_clip': 0.024630169470005625, 'iw_n_components': 100, 'iw_logistic_c': 8.219824942163264e-06, 'iw_pca_fit': 'combined', 'iw_solver': 'lbfgs', 'iw_rho': 1.0}. Best is trial 276 with value: 0.20098544878699612.
2026-06-01 18:22:30 | INFO | Trial 294 | outer=4 | alpha=9.658e+04 n_pcs=4500 (pc_topk) weight={'name': 'pc_logistic', 'floor': 1e-06, 'clip_max': 4.0, 'prob_clip': 0.03457144901219701, 'n_components': 100, 'logistic_c': 1.2435809724405645e-05, 'pca_fit': 'combined', 'solver': 'lbfgs', 'max_iter': 2000, 'fit_intercept': True, 'standardize_with_source': True, 'rho': 1.0}
[I 2026-06-01 18:22:57,761] Trial 294 finished with value: 0.20003843447172512 and parameters: {'alpha': 96582.58824587677, 'n_pcs': 4500, 'iw_method': 'pc_logistic', 'iw_clip_max': 4.0, 'iw_prob_clip': 0.03457144901219701, 'iw_n_components': 100, 'iw_logistic_c': 1.2435809724405645e-05, 'iw_pca_fit': 'combined', 'iw_solver': 'lbfgs', 'iw_rho': 1.0}. Best is trial 276 with value: 0.20098544878699612.
2026-06-01 18:22:57 | INFO | Trial 295 | outer=4 | alpha=8.398e+04 n_pcs=4500 (pc_topk) weight={'name': 'uniform'}
[I 2026-06-01 18:23:06,659] Trial 295 finished with value: 0.19061206867766525 and parameters: {'alpha': 83976.66162779434, 'n_pcs': 4500, 'iw_method': 'uniform'}. Best is trial 276 with value: 0.20098544878699612.
2026-06-01 18:23:06 | INFO | Trial 296 | outer=4 | alpha=6.435e+04 n_pcs=4500 (pc_topk) weight={'name': 'pc_logistic', 'floor': 1e-06, 'clip_max': 4.0, 'prob_clip': 0.02820587861027272, 'n_components': 100, 'logistic_c': 3.838319973225128e-05, 'pca_fit': 'combined', 'solver': 'lbfgs', 'max_iter': 2000, 'fit_intercept': True, 'standardize_with_source': True, 'rho': 1.0}
[I 2026-06-01 18:23:25,404] Trial 296 finished with value: 0.199795220326126 and parameters: {'alpha': 64351.938868347446, 'n_pcs': 4500, 'iw_method': 'pc_logistic', 'iw_clip_max': 4.0, 'iw_prob_clip': 0.02820587861027272, 'iw_n_components': 100, 'iw_logistic_c': 3.838319973225128e-05, 'iw_pca_fit': 'combined', 'iw_solver': 'lbfgs', 'iw_rho': 1.0}. Best is trial 276 with value: 0.20098544878699612.
2026-06-01 18:23:25 | INFO | Trial 297 | outer=4 | alpha=4.334e+04 n_pcs=4500 (pc_topk) weight={'name': 'pc_logistic', 'floor': 1e-06, 'clip_max': 12.0, 'prob_clip': 0.0320734513688343, 'n_components': 100, 'logistic_c': 1.9679085993181745e-05, 'pca_fit': 'combined', 'solver': 'lbfgs', 'max_iter': 2000, 'fit_intercept': True, 'standardize_with_source': True, 'rho': 0.85}
[I 2026-06-01 18:23:41,609] Trial 297 finished with value: 0.19504102632238907 and parameters: {'alpha': 43338.380526800254, 'n_pcs': 4500, 'iw_method': 'pc_logistic', 'iw_clip_max': 12.0, 'iw_prob_clip': 0.0320734513688343, 'iw_n_components': 100, 'iw_logistic_c': 1.9679085993181745e-05, 'iw_pca_fit': 'combined', 'iw_solver': 'lbfgs', 'iw_rho': 0.85}. Best is trial 276 with value: 0.20098544878699612.
2026-06-01 18:23:41 | INFO | Trial 298 | outer=4 | alpha=1.108e+05 n_pcs=4000 (pc_topk) weight={'name': 'pc_logistic', 'floor': 1e-06, 'clip_max': 4.0, 'prob_clip': 0.02564563855737842, 'n_components': 100, 'logistic_c': 9.884161396498099e-06, 'pca_fit': 'combined', 'solver': 'lbfgs', 'max_iter': 2000, 'fit_intercept': True, 'standardize_with_source': True, 'rho': 1.0}
[I 2026-06-01 18:23:57,091] Trial 298 finished with value: 0.1983557212758498 and parameters: {'alpha': 110780.26580231678, 'n_pcs': 4000, 'iw_method': 'pc_logistic', 'iw_clip_max': 4.0, 'iw_prob_clip': 0.02564563855737842, 'iw_n_components': 100, 'iw_logistic_c': 9.884161396498099e-06, 'iw_pca_fit': 'combined', 'iw_solver': 'lbfgs', 'iw_rho': 1.0}. Best is trial 276 with value: 0.20098544878699612.
2026-06-01 18:23:57 | INFO | Trial 299 | outer=4 | alpha=8.047e+04 n_pcs=4500 (pc_topk) weight={'name': 'pc_logistic', 'floor': 1e-06, 'clip_max': 4.0, 'prob_clip': 0.02247458412591777, 'n_components': 100, 'logistic_c': 2.8698142929269337e-05, 'pca_fit': 'combined', 'solver': 'lbfgs', 'max_iter': 2000, 'fit_intercept': True, 'standardize_with_source': True, 'rho': 1.0}
[I 2026-06-01 18:24:13,019] Trial 299 finished with value: 0.1995909015302057 and parameters: {'alpha': 80469.6993465037, 'n_pcs': 4500, 'iw_method': 'pc_logistic', 'iw_clip_max': 4.0, 'iw_prob_clip': 0.02247458412591777, 'iw_n_components': 100, 'iw_logistic_c': 2.8698142929269337e-05, 'iw_pca_fit': 'combined', 'iw_solver': 'lbfgs', 'iw_rho': 1.0}. Best is trial 276 with value: 0.20098544878699612.
2026-06-01 18:24:13 | INFO | OUTER 4 best (inner mean r=0.2010): {'model_type': 'pc_ridge', 'alpha': 83037.81169697603, 'use_snp_selection': True, 'num_snps': 4500, 'n_pcs': 4500, 'weighting': {'name': 'pc_logistic', 'floor': 1e-06, 'clip_max': 4.0, 'prob_clip': 0.029792292844399278, 'n_components': 100, 'logistic_c': 1.4363231502049721e-05, 'pca_fit': 'combined', 'solver': 'lbfgs', 'max_iter': 2000, 'fit_intercept': True, 'standardize_with_source': True, 'rho': 1.0}, 'mean_inner_effective_sample_size': 4271.837606964611, 'mean_inner_effective_sample_size_threshold': 1020.0600000000001}
2026-06-01 18:24:14 | INFO | OUTER 4 TEST r = 0.3865
2026-06-01 18:24:14 | INFO | OUTER 4 incremental summary saved to outputs/final_results/e6_pc_ridge_importance/thr_wing/e6_pc_ridge_importance_thr_wing_results.json
2026-06-01 18:24:14 | INFO | OUTER 5: test_size=553 island=4 (Gjerøy)
2026-06-01 18:24:15 | INFO | OUTER 5: using top 10 related inner validation islands for tuning: 5(Hestmannøy, avgGRM=0.0047), 6(Indre Kvarøy, avgGRM=0.0043), 0(Nesøy, avgGRM=0.0039), 10(Aldra, avgGRM=0.0011), 7(Onøy og Lurøy, avgGRM=0.0002), 1(Myken, avgGRM=-0.0004), 3(Selvær, avgGRM=-0.0013), 2(Træna, avgGRM=-0.0020), 8(Lovund, avgGRM=-0.0020), 9(Sleneset, avgGRM=-0.0024)
[I 2026-06-01 18:24:15,052] A new study created in memory with name: ridge_importance_inner_outer4
2026-06-01 18:24:15 | INFO | Trial 0 | outer=5 | alpha=1.137e+05 n_pcs=4000 (pc_topk) weight={'name': 'uniform'}
[I 2026-06-01 18:24:23,781] Trial 0 finished with value: 0.2328232617529998 and parameters: {'alpha': 113703.38004442609, 'n_pcs': 4000, 'iw_method': 'uniform'}. Best is trial 0 with value: 0.2328232617529998.
2026-06-01 18:24:23 | INFO | Trial 1 | outer=5 | alpha=1.734e+04 n_pcs=5000 (pc_topk) weight={'name': 'uniform'}
[I 2026-06-01 18:24:33,917] Trial 1 finished with value: 0.24144309420148774 and parameters: {'alpha': 17335.792577698634, 'n_pcs': 5000, 'iw_method': 'uniform'}. Best is trial 1 with value: 0.24144309420148774.
2026-06-01 18:24:33 | INFO | Trial 2 | outer=5 | alpha=1.435e+05 n_pcs=1500 (pc_topk) weight={'name': 'uniform'}
