[I 2026-05-31 22:59:37,955] Trial 172 finished with value: 0.26027066127839243 and parameters: {'alpha': 233183.0291690224, 'n_pcs': 4000, 'weight_scheme': 'exponential', 'weight_clip_max': 3.0, 'weight_exponential_beta': 9.776535792879953}. Best is trial 151 with value: 0.2607458721637643.
2026-05-31 22:59:37 | INFO | src.nested_cv_avggrm_weighted_unified | Trial 173 | outer=1 | alpha=2.426e+05 n_pcs=4000 (pc_topk) weight_search=on
2026-05-31 22:59:37 | INFO | src.nested_cv_avggrm_weighted_unified | Trial 173 | outer=1 | weight={'name': 'exponential', 'floor': 1e-06, 'clip_max': 3.0, 'beta': 9.268209123548692}
[I 2026-05-31 22:59:43,646] Trial 173 finished with value: 0.2600754654574393 and parameters: {'alpha': 242648.8461794081, 'n_pcs': 4000, 'weight_scheme': 'exponential', 'weight_clip_max': 3.0, 'weight_exponential_beta': 9.268209123548692}. Best is trial 151 with value: 0.2607458721637643.
2026-05-31 22:59:43 | INFO | src.nested_cv_avggrm_weighted_unified | Trial 174 | outer=1 | alpha=2.339e+05 n_pcs=4000 (pc_topk) weight_search=on
2026-05-31 22:59:43 | INFO | src.nested_cv_avggrm_weighted_unified | Trial 174 | outer=1 | weight={'name': 'exponential', 'floor': 1e-06, 'clip_max': 3.0, 'beta': 9.269226998171876}
[I 2026-05-31 22:59:49,382] Trial 174 finished with value: 0.260181728581261 and parameters: {'alpha': 233943.7085261019, 'n_pcs': 4000, 'weight_scheme': 'exponential', 'weight_clip_max': 3.0, 'weight_exponential_beta': 9.269226998171876}. Best is trial 151 with value: 0.2607458721637643.
2026-05-31 22:59:49 | INFO | src.nested_cv_avggrm_weighted_unified | Trial 175 | outer=1 | alpha=4.978e+05 n_pcs=4000 (pc_topk) weight_search=on
2026-05-31 22:59:49 | INFO | src.nested_cv_avggrm_weighted_unified | Trial 175 | outer=1 | weight={'name': 'exponential', 'floor': 1e-06, 'clip_max': 3.0, 'beta': 8.990307227964582}
[I 2026-05-31 22:59:55,055] Trial 175 finished with value: 0.25620549524610226 and parameters: {'alpha': 497772.68418267765, 'n_pcs': 4000, 'weight_scheme': 'exponential', 'weight_clip_max': 3.0, 'weight_exponential_beta': 8.990307227964582}. Best is trial 151 with value: 0.2607458721637643.
2026-05-31 22:59:55 | INFO | src.nested_cv_avggrm_weighted_unified | Trial 176 | outer=1 | alpha=3.509e+05 n_pcs=4000 (pc_topk) weight_search=on
2026-05-31 22:59:55 | INFO | src.nested_cv_avggrm_weighted_unified | Trial 176 | outer=1 | weight={'name': 'exponential', 'floor': 1e-06, 'clip_max': 20.0, 'beta': 9.790439028631145}
[I 2026-05-31 23:00:00,776] Trial 176 finished with value: 0.2403069016041469 and parameters: {'alpha': 350877.70426367765, 'n_pcs': 4000, 'weight_scheme': 'exponential', 'weight_clip_max': 20.0, 'weight_exponential_beta': 9.790439028631145}. Best is trial 151 with value: 0.2607458721637643.
2026-05-31 23:00:00 | INFO | src.nested_cv_avggrm_weighted_unified | Trial 177 | outer=1 | alpha=2.310e+05 n_pcs=4000 (pc_topk) weight_search=on
2026-05-31 23:00:00 | INFO | src.nested_cv_avggrm_weighted_unified | Trial 177 | outer=1 | weight={'name': 'exponential', 'floor': 1e-06, 'clip_max': 3.0, 'beta': 9.251460312685055}
[I 2026-05-31 23:00:06,503] Trial 177 finished with value: 0.2602064792691796 and parameters: {'alpha': 230982.14059494837, 'n_pcs': 4000, 'weight_scheme': 'exponential', 'weight_clip_max': 3.0, 'weight_exponential_beta': 9.251460312685055}. Best is trial 151 with value: 0.2607458721637643.
2026-05-31 23:00:06 | INFO | src.nested_cv_avggrm_weighted_unified | Trial 178 | outer=1 | alpha=2.095e+05 n_pcs=4000 (pc_topk) weight_search=on
2026-05-31 23:00:06 | INFO | src.nested_cv_avggrm_weighted_unified | Trial 178 | outer=1 | weight={'name': 'exponential', 'floor': 1e-06, 'clip_max': 3.0, 'beta': 8.588102292107042}
[I 2026-05-31 23:00:12,222] Trial 178 finished with value: 0.2600449326183997 and parameters: {'alpha': 209526.90477917832, 'n_pcs': 4000, 'weight_scheme': 'exponential', 'weight_clip_max': 3.0, 'weight_exponential_beta': 8.588102292107042}. Best is trial 151 with value: 0.2607458721637643.
2026-05-31 23:00:12 | INFO | src.nested_cv_avggrm_weighted_unified | Trial 179 | outer=1 | alpha=2.738e+05 n_pcs=4000 (pc_topk) weight_search=on
2026-05-31 23:00:12 | INFO | src.nested_cv_avggrm_weighted_unified | Trial 179 | outer=1 | weight={'name': 'linear', 'floor': 1e-06, 'clip_max': 3.0, 'min_weight': 0.9972521213442769, 'max_weight': 1.7758796322059043}
2026-05-31 23:00:15 | INFO | src.nested_cv_avggrm_weighted_unified | Trial 179 | outer=1 | pruned after 6/10 inner folds (mean r=0.2472)
[I 2026-05-31 23:00:15,670] Trial 179 pruned. 
2026-05-31 23:00:15 | INFO | src.nested_cv_avggrm_weighted_unified | Trial 180 | outer=1 | alpha=2.032e+05 n_pcs=4000 (pc_topk) weight_search=on
2026-05-31 23:00:15 | INFO | src.nested_cv_avggrm_weighted_unified | Trial 180 | outer=1 | weight={'name': 'uniform', 'floor': 1e-06, 'clip_max': 3.0}
2026-05-31 23:00:18 | INFO | src.nested_cv_avggrm_weighted_unified | Trial 180 | outer=1 | pruned after 6/10 inner folds (mean r=0.2406)
[I 2026-05-31 23:00:18,585] Trial 180 pruned. 
2026-05-31 23:00:18 | INFO | src.nested_cv_avggrm_weighted_unified | Trial 181 | outer=1 | alpha=2.430e+05 n_pcs=4000 (pc_topk) weight_search=on
2026-05-31 23:00:18 | INFO | src.nested_cv_avggrm_weighted_unified | Trial 181 | outer=1 | weight={'name': 'exponential', 'floor': 1e-06, 'clip_max': 3.0, 'beta': 9.247920214506246}
[I 2026-05-31 23:00:24,311] Trial 181 finished with value: 0.2600591081747138 and parameters: {'alpha': 243027.15900800514, 'n_pcs': 4000, 'weight_scheme': 'exponential', 'weight_clip_max': 3.0, 'weight_exponential_beta': 9.247920214506246}. Best is trial 151 with value: 0.2607458721637643.
2026-05-31 23:00:24 | INFO | src.nested_cv_avggrm_weighted_unified | Trial 182 | outer=1 | alpha=3.227e+05 n_pcs=4000 (pc_topk) weight_search=on
2026-05-31 23:00:24 | INFO | src.nested_cv_avggrm_weighted_unified | Trial 182 | outer=1 | weight={'name': 'exponential', 'floor': 1e-06, 'clip_max': 3.0, 'beta': 9.75743681857497}
[I 2026-05-31 23:00:30,028] Trial 182 finished with value: 0.2591231023259488 and parameters: {'alpha': 322672.7887866716, 'n_pcs': 4000, 'weight_scheme': 'exponential', 'weight_clip_max': 3.0, 'weight_exponential_beta': 9.75743681857497}. Best is trial 151 with value: 0.2607458721637643.
2026-05-31 23:00:30 | INFO | src.nested_cv_avggrm_weighted_unified | Trial 183 | outer=1 | alpha=2.247e+05 n_pcs=3500 (pc_topk) weight_search=on
2026-05-31 23:00:30 | INFO | src.nested_cv_avggrm_weighted_unified | Trial 183 | outer=1 | weight={'name': 'exponential', 'floor': 1e-06, 'clip_max': 3.0, 'beta': 9.998349100056085}
[I 2026-05-31 23:00:34,892] Trial 183 finished with value: 0.25897587181397996 and parameters: {'alpha': 224659.2206410742, 'n_pcs': 3500, 'weight_scheme': 'exponential', 'weight_clip_max': 3.0, 'weight_exponential_beta': 9.998349100056085}. Best is trial 151 with value: 0.2607458721637643.
2026-05-31 23:00:34 | INFO | src.nested_cv_avggrm_weighted_unified | Trial 184 | outer=1 | alpha=2.749e+05 n_pcs=4000 (pc_topk) weight_search=on
2026-05-31 23:00:34 | INFO | src.nested_cv_avggrm_weighted_unified | Trial 184 | outer=1 | weight={'name': 'exponential', 'floor': 1e-06, 'clip_max': 3.0, 'beta': 9.052196508157344}
[I 2026-05-31 23:00:40,624] Trial 184 finished with value: 0.25948356085908464 and parameters: {'alpha': 274864.4543720816, 'n_pcs': 4000, 'weight_scheme': 'exponential', 'weight_clip_max': 3.0, 'weight_exponential_beta': 9.052196508157344}. Best is trial 151 with value: 0.2607458721637643.
2026-05-31 23:00:40 | INFO | src.nested_cv_avggrm_weighted_unified | Trial 185 | outer=1 | alpha=1.957e+05 n_pcs=4000 (pc_topk) weight_search=on
2026-05-31 23:00:40 | INFO | src.nested_cv_avggrm_weighted_unified | Trial 185 | outer=1 | weight={'name': 'exponential', 'floor': 1e-06, 'clip_max': 3.0, 'beta': 9.343090156622532}
[I 2026-05-31 23:00:46,343] Trial 185 finished with value: 0.26059379060505816 and parameters: {'alpha': 195738.04310743266, 'n_pcs': 4000, 'weight_scheme': 'exponential', 'weight_clip_max': 3.0, 'weight_exponential_beta': 9.343090156622532}. Best is trial 151 with value: 0.2607458721637643.
2026-05-31 23:00:46 | INFO | src.nested_cv_avggrm_weighted_unified | Trial 186 | outer=1 | alpha=1.987e+05 n_pcs=4000 (pc_topk) weight_search=on
2026-05-31 23:00:46 | INFO | src.nested_cv_avggrm_weighted_unified | Trial 186 | outer=1 | weight={'name': 'exponential', 'floor': 1e-06, 'clip_max': 3.0, 'beta': 9.337441706796833}
[I 2026-05-31 23:00:52,072] Trial 186 finished with value: 0.26056878724655724 and parameters: {'alpha': 198723.92667572573, 'n_pcs': 4000, 'weight_scheme': 'exponential', 'weight_clip_max': 3.0, 'weight_exponential_beta': 9.337441706796833}. Best is trial 151 with value: 0.2607458721637643.
2026-05-31 23:00:52 | INFO | src.nested_cv_avggrm_weighted_unified | Trial 187 | outer=1 | alpha=1.835e+05 n_pcs=4000 (pc_topk) weight_search=on
2026-05-31 23:00:52 | INFO | src.nested_cv_avggrm_weighted_unified | Trial 187 | outer=1 | weight={'name': 'exponential', 'floor': 1e-06, 'clip_max': 3.0, 'beta': 9.325168314872318}
[I 2026-05-31 23:00:57,803] Trial 187 finished with value: 0.260668195415789 and parameters: {'alpha': 183477.7621712248, 'n_pcs': 4000, 'weight_scheme': 'exponential', 'weight_clip_max': 3.0, 'weight_exponential_beta': 9.325168314872318}. Best is trial 151 with value: 0.2607458721637643.
2026-05-31 23:00:57 | INFO | src.nested_cv_avggrm_weighted_unified | Trial 188 | outer=1 | alpha=1.895e+05 n_pcs=4000 (pc_topk) weight_search=on
2026-05-31 23:00:57 | INFO | src.nested_cv_avggrm_weighted_unified | Trial 188 | outer=1 | weight={'name': 'exponential', 'floor': 1e-06, 'clip_max': 3.0, 'beta': 9.70936519836322}
[I 2026-05-31 23:01:03,534] Trial 188 finished with value: 0.26065313803252754 and parameters: {'alpha': 189477.7895172225, 'n_pcs': 4000, 'weight_scheme': 'exponential', 'weight_clip_max': 3.0, 'weight_exponential_beta': 9.70936519836322}. Best is trial 151 with value: 0.2607458721637643.
2026-05-31 23:01:03 | INFO | src.nested_cv_avggrm_weighted_unified | Trial 189 | outer=1 | alpha=1.904e+05 n_pcs=3500 (pc_topk) weight_search=on
2026-05-31 23:01:03 | INFO | src.nested_cv_avggrm_weighted_unified | Trial 189 | outer=1 | weight={'name': 'exponential', 'floor': 1e-06, 'clip_max': 3.0, 'beta': 9.749845335853173}
[I 2026-05-31 23:01:08,402] Trial 189 finished with value: 0.2592736498274034 and parameters: {'alpha': 190402.33315071464, 'n_pcs': 3500, 'weight_scheme': 'exponential', 'weight_clip_max': 3.0, 'weight_exponential_beta': 9.749845335853173}. Best is trial 151 with value: 0.2607458721637643.
2026-05-31 23:01:08 | INFO | src.nested_cv_avggrm_weighted_unified | Trial 190 | outer=1 | alpha=1.822e+05 n_pcs=4000 (pc_topk) weight_search=on
2026-05-31 23:01:08 | INFO | src.nested_cv_avggrm_weighted_unified | Trial 190 | outer=1 | weight={'name': 'exponential', 'floor': 1e-06, 'clip_max': 3.0, 'beta': 9.75622988363959}
[I 2026-05-31 23:01:14,132] Trial 190 finished with value: 0.2606715466805019 and parameters: {'alpha': 182159.23802006125, 'n_pcs': 4000, 'weight_scheme': 'exponential', 'weight_clip_max': 3.0, 'weight_exponential_beta': 9.75622988363959}. Best is trial 151 with value: 0.2607458721637643.
2026-05-31 23:01:14 | INFO | src.nested_cv_avggrm_weighted_unified | Trial 191 | outer=1 | alpha=1.852e+05 n_pcs=4000 (pc_topk) weight_search=on
2026-05-31 23:01:14 | INFO | src.nested_cv_avggrm_weighted_unified | Trial 191 | outer=1 | weight={'name': 'exponential', 'floor': 1e-06, 'clip_max': 3.0, 'beta': 9.73089525552578}
[I 2026-05-31 23:01:19,866] Trial 191 finished with value: 0.2606679737680685 and parameters: {'alpha': 185165.28363041626, 'n_pcs': 4000, 'weight_scheme': 'exponential', 'weight_clip_max': 3.0, 'weight_exponential_beta': 9.73089525552578}. Best is trial 151 with value: 0.2607458721637643.
2026-05-31 23:01:19 | INFO | src.nested_cv_avggrm_weighted_unified | Trial 192 | outer=1 | alpha=1.737e+05 n_pcs=4000 (pc_topk) weight_search=on
2026-05-31 23:01:19 | INFO | src.nested_cv_avggrm_weighted_unified | Trial 192 | outer=1 | weight={'name': 'exponential', 'floor': 1e-06, 'clip_max': 3.0, 'beta': 9.671994104867892}
[I 2026-05-31 23:01:25,593] Trial 192 finished with value: 0.26072105944899293 and parameters: {'alpha': 173735.75031004238, 'n_pcs': 4000, 'weight_scheme': 'exponential', 'weight_clip_max': 3.0, 'weight_exponential_beta': 9.671994104867892}. Best is trial 151 with value: 0.2607458721637643.
2026-05-31 23:01:25 | INFO | src.nested_cv_avggrm_weighted_unified | Trial 193 | outer=1 | alpha=1.823e+05 n_pcs=4000 (pc_topk) weight_search=on
2026-05-31 23:01:25 | INFO | src.nested_cv_avggrm_weighted_unified | Trial 193 | outer=1 | weight={'name': 'exponential', 'floor': 1e-06, 'clip_max': 3.0, 'beta': 9.713898334266636}
[I 2026-05-31 23:01:31,302] Trial 193 finished with value: 0.26068500444910586 and parameters: {'alpha': 182300.21785286645, 'n_pcs': 4000, 'weight_scheme': 'exponential', 'weight_clip_max': 3.0, 'weight_exponential_beta': 9.713898334266636}. Best is trial 151 with value: 0.2607458721637643.
2026-05-31 23:01:31 | INFO | src.nested_cv_avggrm_weighted_unified | Trial 194 | outer=1 | alpha=1.845e+05 n_pcs=4000 (pc_topk) weight_search=on
2026-05-31 23:01:31 | INFO | src.nested_cv_avggrm_weighted_unified | Trial 194 | outer=1 | weight={'name': 'exponential', 'floor': 1e-06, 'clip_max': 3.0, 'beta': 9.997517005393998}
[I 2026-05-31 23:01:37,028] Trial 194 finished with value: 0.2604996875402382 and parameters: {'alpha': 184549.14944428095, 'n_pcs': 4000, 'weight_scheme': 'exponential', 'weight_clip_max': 3.0, 'weight_exponential_beta': 9.997517005393998}. Best is trial 151 with value: 0.2607458721637643.
2026-05-31 23:01:37 | INFO | src.nested_cv_avggrm_weighted_unified | Trial 195 | outer=1 | alpha=1.780e+05 n_pcs=4000 (pc_topk) weight_search=on
2026-05-31 23:01:37 | INFO | src.nested_cv_avggrm_weighted_unified | Trial 195 | outer=1 | weight={'name': 'exponential', 'floor': 1e-06, 'clip_max': 3.0, 'beta': 9.963847522496392}
[I 2026-05-31 23:01:42,755] Trial 195 finished with value: 0.26055046634142737 and parameters: {'alpha': 178012.14513231508, 'n_pcs': 4000, 'weight_scheme': 'exponential', 'weight_clip_max': 3.0, 'weight_exponential_beta': 9.963847522496392}. Best is trial 151 with value: 0.2607458721637643.
2026-05-31 23:01:42 | INFO | src.nested_cv_avggrm_weighted_unified | Trial 196 | outer=1 | alpha=1.843e+05 n_pcs=4000 (pc_topk) weight_search=on
2026-05-31 23:01:42 | INFO | src.nested_cv_avggrm_weighted_unified | Trial 196 | outer=1 | weight={'name': 'exponential', 'floor': 1e-06, 'clip_max': 3.0, 'beta': 9.985048146800715}
[I 2026-05-31 23:01:48,467] Trial 196 finished with value: 0.2605129061472991 and parameters: {'alpha': 184294.92999461727, 'n_pcs': 4000, 'weight_scheme': 'exponential', 'weight_clip_max': 3.0, 'weight_exponential_beta': 9.985048146800715}. Best is trial 151 with value: 0.2607458721637643.
2026-05-31 23:01:48 | INFO | src.nested_cv_avggrm_weighted_unified | Trial 197 | outer=1 | alpha=1.820e+05 n_pcs=4000 (pc_topk) weight_search=on
2026-05-31 23:01:48 | INFO | src.nested_cv_avggrm_weighted_unified | Trial 197 | outer=1 | weight={'name': 'exponential', 'floor': 1e-06, 'clip_max': 3.0, 'beta': 9.979434414246484}
[I 2026-05-31 23:01:54,191] Trial 197 finished with value: 0.2605257283344651 and parameters: {'alpha': 182028.85463929834, 'n_pcs': 4000, 'weight_scheme': 'exponential', 'weight_clip_max': 3.0, 'weight_exponential_beta': 9.979434414246484}. Best is trial 151 with value: 0.2607458721637643.
2026-05-31 23:01:54 | INFO | src.nested_cv_avggrm_weighted_unified | Trial 198 | outer=1 | alpha=1.799e+05 n_pcs=3500 (pc_topk) weight_search=on
2026-05-31 23:01:54 | INFO | src.nested_cv_avggrm_weighted_unified | Trial 198 | outer=1 | weight={'name': 'exponential', 'floor': 1e-06, 'clip_max': 3.0, 'beta': 9.854071520111505}
[I 2026-05-31 23:01:59,074] Trial 198 finished with value: 0.25917550571659065 and parameters: {'alpha': 179912.49834720563, 'n_pcs': 3500, 'weight_scheme': 'exponential', 'weight_clip_max': 3.0, 'weight_exponential_beta': 9.854071520111505}. Best is trial 151 with value: 0.2607458721637643.
2026-05-31 23:01:59 | INFO | src.nested_cv_avggrm_weighted_unified | Trial 199 | outer=1 | alpha=1.263e+05 n_pcs=4000 (pc_topk) weight_search=on
2026-05-31 23:01:59 | INFO | src.nested_cv_avggrm_weighted_unified | Trial 199 | outer=1 | weight={'name': 'exponential', 'floor': 1e-06, 'clip_max': None, 'beta': 9.752116166184154}
[I 2026-05-31 23:02:04,771] Trial 199 finished with value: 0.23395010758582696 and parameters: {'alpha': 126287.9871745459, 'n_pcs': 4000, 'weight_scheme': 'exponential', 'weight_clip_max': None, 'weight_exponential_beta': 9.752116166184154}. Best is trial 151 with value: 0.2607458721637643.
2026-05-31 23:02:04 | INFO | src.nested_cv_avggrm_weighted_unified | Trial 200 | outer=1 | alpha=1.803e+05 n_pcs=4000 (pc_topk) weight_search=on
2026-05-31 23:02:04 | INFO | src.nested_cv_avggrm_weighted_unified | Trial 200 | outer=1 | weight={'name': 'exponential', 'floor': 1e-06, 'clip_max': 3.0, 'beta': 9.979428811396872}
[I 2026-05-31 23:02:10,490] Trial 200 finished with value: 0.2605306399796399 and parameters: {'alpha': 180314.86141481684, 'n_pcs': 4000, 'weight_scheme': 'exponential', 'weight_clip_max': 3.0, 'weight_exponential_beta': 9.979428811396872}. Best is trial 151 with value: 0.2607458721637643.
2026-05-31 23:02:10 | INFO | src.nested_cv_avggrm_weighted_unified | Trial 201 | outer=1 | alpha=1.717e+05 n_pcs=4000 (pc_topk) weight_search=on
2026-05-31 23:02:10 | INFO | src.nested_cv_avggrm_weighted_unified | Trial 201 | outer=1 | weight={'name': 'exponential', 'floor': 1e-06, 'clip_max': 3.0, 'beta': 9.992337617831359}
[I 2026-05-31 23:02:16,209] Trial 201 finished with value: 0.2605315170874637 and parameters: {'alpha': 171721.53010304386, 'n_pcs': 4000, 'weight_scheme': 'exponential', 'weight_clip_max': 3.0, 'weight_exponential_beta': 9.992337617831359}. Best is trial 151 with value: 0.2607458721637643.
2026-05-31 23:02:16 | INFO | src.nested_cv_avggrm_weighted_unified | Trial 202 | outer=1 | alpha=1.710e+05 n_pcs=4000 (pc_topk) weight_search=on
2026-05-31 23:02:16 | INFO | src.nested_cv_avggrm_weighted_unified | Trial 202 | outer=1 | weight={'name': 'exponential', 'floor': 1e-06, 'clip_max': 3.0, 'beta': 9.709701593448974}
[I 2026-05-31 23:02:21,928] Trial 202 finished with value: 0.26071547946096746 and parameters: {'alpha': 171022.46975350252, 'n_pcs': 4000, 'weight_scheme': 'exponential', 'weight_clip_max': 3.0, 'weight_exponential_beta': 9.709701593448974}. Best is trial 151 with value: 0.2607458721637643.
2026-05-31 23:02:21 | INFO | src.nested_cv_avggrm_weighted_unified | Trial 203 | outer=1 | alpha=1.134e+05 n_pcs=4000 (pc_topk) weight_search=on
2026-05-31 23:02:21 | INFO | src.nested_cv_avggrm_weighted_unified | Trial 203 | outer=1 | weight={'name': 'exponential', 'floor': 1e-06, 'clip_max': 3.0, 'beta': 9.669119760834942}
[I 2026-05-31 23:02:27,653] Trial 203 finished with value: 0.2601169733010024 and parameters: {'alpha': 113400.2559109374, 'n_pcs': 4000, 'weight_scheme': 'exponential', 'weight_clip_max': 3.0, 'weight_exponential_beta': 9.669119760834942}. Best is trial 151 with value: 0.2607458721637643.
2026-05-31 23:02:27 | INFO | src.nested_cv_avggrm_weighted_unified | Trial 204 | outer=1 | alpha=1.696e+05 n_pcs=4000 (pc_topk) weight_search=on
2026-05-31 23:02:27 | INFO | src.nested_cv_avggrm_weighted_unified | Trial 204 | outer=1 | weight={'name': 'exponential', 'floor': 1e-06, 'clip_max': 3.0, 'beta': 9.651311732207136}
[I 2026-05-31 23:02:33,349] Trial 204 finished with value: 0.2607314132656456 and parameters: {'alpha': 169590.9004940287, 'n_pcs': 4000, 'weight_scheme': 'exponential', 'weight_clip_max': 3.0, 'weight_exponential_beta': 9.651311732207136}. Best is trial 151 with value: 0.2607458721637643.
2026-05-31 23:02:33 | INFO | src.nested_cv_avggrm_weighted_unified | Trial 205 | outer=1 | alpha=1.373e+05 n_pcs=4000 (pc_topk) weight_search=on
2026-05-31 23:02:33 | INFO | src.nested_cv_avggrm_weighted_unified | Trial 205 | outer=1 | weight={'name': 'exponential', 'floor': 1e-06, 'clip_max': 3.0, 'beta': 9.643682006365994}
[I 2026-05-31 23:02:39,054] Trial 205 finished with value: 0.26058875713660595 and parameters: {'alpha': 137299.68313400442, 'n_pcs': 4000, 'weight_scheme': 'exponential', 'weight_clip_max': 3.0, 'weight_exponential_beta': 9.643682006365994}. Best is trial 151 with value: 0.2607458721637643.
2026-05-31 23:02:39 | INFO | src.nested_cv_avggrm_weighted_unified | Trial 206 | outer=1 | alpha=1.317e+05 n_pcs=4000 (pc_topk) weight_search=on
2026-05-31 23:02:39 | INFO | src.nested_cv_avggrm_weighted_unified | Trial 206 | outer=1 | weight={'name': 'exponential', 'floor': 1e-06, 'clip_max': 3.0, 'beta': 9.618036637191256}
[I 2026-05-31 23:02:44,772] Trial 206 finished with value: 0.2605250495075916 and parameters: {'alpha': 131664.4090890965, 'n_pcs': 4000, 'weight_scheme': 'exponential', 'weight_clip_max': 3.0, 'weight_exponential_beta': 9.618036637191256}. Best is trial 151 with value: 0.2607458721637643.
2026-05-31 23:02:44 | INFO | src.nested_cv_avggrm_weighted_unified | Trial 207 | outer=1 | alpha=1.184e+05 n_pcs=4000 (pc_topk) weight_search=on
2026-05-31 23:02:44 | INFO | src.nested_cv_avggrm_weighted_unified | Trial 207 | outer=1 | weight={'name': 'exponential', 'floor': 1e-06, 'clip_max': 3.0, 'beta': 9.650531649606384}
