[I 2026-06-01 01:03:26,170] Trial 291 pruned. 
2026-06-01 01:03:26 | INFO | src.nested_cv_avggrm_weighted_unified | Trial 292 | outer=6 | alpha=1.164e+05 n_pcs=500 (pc_topk) weight_search=on
2026-06-01 01:03:26 | INFO | src.nested_cv_avggrm_weighted_unified | Trial 292 | outer=6 | weight={'name': 'exponential', 'floor': 1e-06, 'clip_max': 3.0, 'beta': 4.033772123513988}
2026-06-01 01:03:26 | INFO | src.nested_cv_avggrm_weighted_unified | Trial 292 | outer=6 | pruned after 5/10 inner folds (mean r=0.1895)
[I 2026-06-01 01:03:26,551] Trial 292 pruned. 
2026-06-01 01:03:26 | INFO | src.nested_cv_avggrm_weighted_unified | Trial 293 | outer=6 | alpha=1.728e+05 n_pcs=4000 (pc_topk) weight_search=on
2026-06-01 01:03:26 | INFO | src.nested_cv_avggrm_weighted_unified | Trial 293 | outer=6 | weight={'name': 'exponential', 'floor': 1e-06, 'clip_max': 20.0, 'beta': 4.457423979603711}
2026-06-01 01:03:30 | INFO | src.nested_cv_avggrm_weighted_unified | Trial 293 | outer=6 | pruned after 6/10 inner folds (mean r=0.2350)
[I 2026-06-01 01:03:30,283] Trial 293 pruned. 
2026-06-01 01:03:30 | INFO | src.nested_cv_avggrm_weighted_unified | Trial 294 | outer=6 | alpha=2.854e+05 n_pcs=3500 (pc_topk) weight_search=on
2026-06-01 01:03:30 | INFO | src.nested_cv_avggrm_weighted_unified | Trial 294 | outer=6 | weight={'name': 'exponential', 'floor': 1e-06, 'clip_max': 3.0, 'beta': 3.8891958867233165}
[I 2026-06-01 01:03:34,760] Trial 294 finished with value: 0.2359754178138306 and parameters: {'alpha': 285379.6499619166, 'n_pcs': 3500, 'weight_scheme': 'exponential', 'weight_clip_max': 3.0, 'weight_exponential_beta': 3.8891958867233165}. Best is trial 237 with value: 0.23825365933560247.
2026-06-01 01:03:34 | INFO | src.nested_cv_avggrm_weighted_unified | Trial 295 | outer=6 | alpha=1.814e+05 n_pcs=4500 (pc_topk) weight_search=on
2026-06-01 01:03:34 | INFO | src.nested_cv_avggrm_weighted_unified | Trial 295 | outer=6 | weight={'name': 'exponential', 'floor': 1e-06, 'clip_max': 10.0, 'beta': 3.596874881000419}
2026-06-01 01:03:38 | INFO | src.nested_cv_avggrm_weighted_unified | Trial 295 | outer=6 | pruned after 6/10 inner folds (mean r=0.2424)
[I 2026-06-01 01:03:38,588] Trial 295 pruned. 
2026-06-01 01:03:38 | INFO | src.nested_cv_avggrm_weighted_unified | Trial 296 | outer=6 | alpha=1.383e+05 n_pcs=4000 (pc_topk) weight_search=on
2026-06-01 01:03:38 | INFO | src.nested_cv_avggrm_weighted_unified | Trial 296 | outer=6 | weight={'name': 'exponential', 'floor': 1e-06, 'clip_max': 3.0, 'beta': 4.1268788603748945}
2026-06-01 01:03:42 | INFO | src.nested_cv_avggrm_weighted_unified | Trial 296 | outer=6 | pruned after 7/10 inner folds (mean r=0.2644)
[I 2026-06-01 01:03:42,273] Trial 296 pruned. 
2026-06-01 01:03:42 | INFO | src.nested_cv_avggrm_weighted_unified | Trial 297 | outer=6 | alpha=9.867e+04 n_pcs=4000 (pc_topk) weight_search=on
2026-06-01 01:03:42 | INFO | src.nested_cv_avggrm_weighted_unified | Trial 297 | outer=6 | weight={'name': 'exponential', 'floor': 1e-06, 'clip_max': 3.0, 'beta': 3.7622072254099987}
2026-06-01 01:03:45 | INFO | src.nested_cv_avggrm_weighted_unified | Trial 297 | outer=6 | pruned after 7/10 inner folds (mean r=0.2616)
[I 2026-06-01 01:03:45,925] Trial 297 pruned. 
2026-06-01 01:03:45 | INFO | src.nested_cv_avggrm_weighted_unified | Trial 298 | outer=6 | alpha=2.376e+05 n_pcs=4000 (pc_topk) weight_search=on
2026-06-01 01:03:45 | INFO | src.nested_cv_avggrm_weighted_unified | Trial 298 | outer=6 | weight={'name': 'exponential', 'floor': 1e-06, 'clip_max': 3.0, 'beta': 3.959997423179132}
[I 2026-06-01 01:03:51,099] Trial 298 finished with value: 0.23736329620527918 and parameters: {'alpha': 237573.55697471712, 'n_pcs': 4000, 'weight_scheme': 'exponential', 'weight_clip_max': 3.0, 'weight_exponential_beta': 3.959997423179132}. Best is trial 237 with value: 0.23825365933560247.
2026-06-01 01:03:51 | INFO | src.nested_cv_avggrm_weighted_unified | Trial 299 | outer=6 | alpha=1.521e+05 n_pcs=4000 (pc_topk) weight_search=on
2026-06-01 01:03:51 | INFO | src.nested_cv_avggrm_weighted_unified | Trial 299 | outer=6 | weight={'name': 'uniform', 'floor': 1e-06, 'clip_max': 3.0}
2026-06-01 01:03:53 | INFO | src.nested_cv_avggrm_weighted_unified | Trial 299 | outer=6 | pruned after 6/10 inner folds (mean r=0.2404)
[I 2026-06-01 01:03:53,837] Trial 299 pruned. 
2026-06-01 01:03:53 | INFO | src.nested_cv_avggrm_weighted_unified | OUTER 6 best (inner mean r=0.2383): {'model_type': 'pc_ridge', 'alpha': 155631.1686378173, 'n_pcs': 4000, 'use_snp_selection': True, 'num_snps': 4000, 'feature_mode': 'pc_topk', 'weighting': {'name': 'exponential', 'floor': 1e-06, 'clip_max': 3.0, 'beta': 3.8432398460779433}}
2026-06-01 01:03:54 | INFO | src.nested_cv_avggrm_weighted_unified | OUTER 6 TEST r = 0.1634
2026-06-01 01:03:54 | INFO | src.nested_cv_avggrm_weighted_unified | OUTER 6 incremental summary saved to outputs/final_results/e6_pc_ridge_avggrm/thr_wing/e6_pc_ridge_avggrm_thr_wing_results.json
2026-06-01 01:03:54 | INFO | src.nested_cv_avggrm_weighted_unified | OUTER 7: test_size=349 island=6 (Indre Kvarøy)
2026-06-01 01:03:54 | INFO | src.nested_cv_avggrm_weighted_unified | OUTER 7: inner LOIO validation islands: 0(Nesøy), 1(Myken), 2(Træna), 3(Selvær), 4(Gjerøy), 5(Hestmannøy), 7(Onøy og Lurøy), 8(Lovund), 9(Sleneset), 10(Aldra), 11(Leka), 12(Vega), 13(Vikna), 14(Lauvøya)
2026-06-01 01:03:54 | INFO | src.nested_cv_avggrm_weighted_unified | OUTER 7: using top 10 related inner validation islands for tuning: 4(Gjerøy, avgGRM=0.0043), 7(Onøy og Lurøy, avgGRM=0.0042), 5(Hestmannøy, avgGRM=0.0039), 9(Sleneset, avgGRM=0.0038), 8(Lovund, avgGRM=0.0023), 0(Nesøy, avgGRM=0.0016), 2(Træna, avgGRM=0.0015), 1(Myken, avgGRM=0.0009), 3(Selvær, avgGRM=0.0005), 10(Aldra, avgGRM=-0.0026)
[I 2026-06-01 01:03:54,704] A new study created in memory with name: ridge_inner_outer6
2026-06-01 01:03:54 | INFO | src.nested_cv_avggrm_weighted_unified | Trial 0 | outer=7 | alpha=1.137e+05 n_pcs=4000 (pc_topk) weight_search=on
2026-06-01 01:03:54 | INFO | src.nested_cv_avggrm_weighted_unified | Trial 0 | outer=7 | weight={'name': 'uniform', 'floor': 1e-06, 'clip_max': None}
[I 2026-06-01 01:04:00,263] Trial 0 finished with value: 0.2117453123579222 and parameters: {'alpha': 113703.38004442609, 'n_pcs': 4000, 'weight_scheme': 'uniform', 'weight_clip_max': None}. Best is trial 0 with value: 0.2117453123579222.
2026-06-01 01:04:00 | INFO | src.nested_cv_avggrm_weighted_unified | OUTER 7 | new best trial 0 (mean inner r=0.2117) saved to outputs/final_results/e6_pc_ridge_avggrm/thr_wing/e6_pc_ridge_avggrm_thr_wing_best_trials/split_07_best_trial.json
2026-06-01 01:04:00 | INFO | src.nested_cv_avggrm_weighted_unified | Trial 1 | outer=7 | alpha=1.682e+06 n_pcs=2000 (pc_topk) weight_search=on
2026-06-01 01:04:00 | INFO | src.nested_cv_avggrm_weighted_unified | Trial 1 | outer=7 | weight={'name': 'exponential', 'floor': 1e-06, 'clip_max': 3.0, 'beta': 8.711469579953913}
[I 2026-06-01 01:04:03,193] Trial 1 finished with value: 0.20913829650576385 and parameters: {'alpha': 1682385.170967095, 'n_pcs': 2000, 'weight_scheme': 'exponential', 'weight_clip_max': 3.0, 'weight_exponential_beta': 8.711469579953913}. Best is trial 0 with value: 0.2117453123579222.
2026-06-01 01:04:03 | INFO | src.nested_cv_avggrm_weighted_unified | Trial 2 | outer=7 | alpha=2.757e+03 n_pcs=2000 (pc_topk) weight_search=on
2026-06-01 01:04:03 | INFO | src.nested_cv_avggrm_weighted_unified | Trial 2 | outer=7 | weight={'name': 'linear', 'floor': 1e-06, 'clip_max': 20.0, 'min_weight': 0.12918170299726892, 'max_weight': 3.9862564805616327}
[I 2026-06-01 01:04:06,249] Trial 2 finished with value: 0.15066000237389637 and parameters: {'alpha': 2757.0504493185063, 'n_pcs': 2000, 'weight_scheme': 'linear', 'weight_clip_max': 20.0, 'weight_linear_min_weight': 0.12918170299726892, 'weight_linear_max_weight': 3.9862564805616327}. Best is trial 0 with value: 0.2117453123579222.
2026-06-01 01:04:06 | INFO | src.nested_cv_avggrm_weighted_unified | Trial 3 | outer=7 | alpha=1.776e+03 n_pcs=4000 (pc_topk) weight_search=on
2026-06-01 01:04:06 | INFO | src.nested_cv_avggrm_weighted_unified | Trial 3 | outer=7 | weight={'name': 'exponential', 'floor': 1e-06, 'clip_max': 10.0, 'beta': 0.563604612251006}
[I 2026-06-01 01:04:12,008] Trial 3 finished with value: 0.14051283386376878 and parameters: {'alpha': 1775.825123718637, 'n_pcs': 4000, 'weight_scheme': 'exponential', 'weight_clip_max': 10.0, 'weight_exponential_beta': 0.563604612251006}. Best is trial 0 with value: 0.2117453123579222.
2026-06-01 01:04:12 | INFO | src.nested_cv_avggrm_weighted_unified | Trial 4 | outer=7 | alpha=1.835e+04 n_pcs=5000 (pc_topk) weight_search=on
2026-06-01 01:04:12 | INFO | src.nested_cv_avggrm_weighted_unified | Trial 4 | outer=7 | weight={'name': 'exponential', 'floor': 1e-06, 'clip_max': None, 'beta': 9.957095048208117}
[I 2026-06-01 01:04:19,969] Trial 4 finished with value: 0.22094363376409815 and parameters: {'alpha': 18351.68801260339, 'n_pcs': 5000, 'weight_scheme': 'exponential', 'weight_clip_max': None, 'weight_exponential_beta': 9.957095048208117}. Best is trial 4 with value: 0.22094363376409815.
2026-06-01 01:04:19 | INFO | src.nested_cv_avggrm_weighted_unified | OUTER 7 | new best trial 4 (mean inner r=0.2209) saved to outputs/final_results/e6_pc_ridge_avggrm/thr_wing/e6_pc_ridge_avggrm_thr_wing_best_trials/split_07_best_trial.json
2026-06-01 01:04:19 | INFO | src.nested_cv_avggrm_weighted_unified | Trial 5 | outer=7 | alpha=9.696e+03 n_pcs=1000 (pc_topk) weight_search=on
2026-06-01 01:04:19 | INFO | src.nested_cv_avggrm_weighted_unified | Trial 5 | outer=7 | weight={'name': 'exponential', 'floor': 1e-06, 'clip_max': 3.0, 'beta': 1.5726039441128932}
[I 2026-06-01 01:04:21,987] Trial 5 finished with value: 0.20532545346287553 and parameters: {'alpha': 9695.792837096258, 'n_pcs': 1000, 'weight_scheme': 'exponential', 'weight_clip_max': 3.0, 'weight_exponential_beta': 1.5726039441128932}. Best is trial 4 with value: 0.22094363376409815.
2026-06-01 01:04:21 | INFO | src.nested_cv_avggrm_weighted_unified | Trial 6 | outer=7 | alpha=6.320e+04 n_pcs=2500 (pc_topk) weight_search=on
2026-06-01 01:04:21 | INFO | src.nested_cv_avggrm_weighted_unified | Trial 6 | outer=7 | weight={'name': 'uniform', 'floor': 1e-06, 'clip_max': 10.0}
[I 2026-06-01 01:04:24,666] Trial 6 finished with value: 0.21057129925890433 and parameters: {'alpha': 63199.5851103866, 'n_pcs': 2500, 'weight_scheme': 'uniform', 'weight_clip_max': 10.0}. Best is trial 4 with value: 0.22094363376409815.
2026-06-01 01:04:24 | INFO | src.nested_cv_avggrm_weighted_unified | Trial 7 | outer=7 | alpha=4.681e+04 n_pcs=2500 (pc_topk) weight_search=on
2026-06-01 01:04:24 | INFO | src.nested_cv_avggrm_weighted_unified | Trial 7 | outer=7 | weight={'name': 'linear', 'floor': 1e-06, 'clip_max': 3.0, 'min_weight': 0.13798029304672477, 'max_weight': 3.0957974174373546}
[I 2026-06-01 01:04:27,836] Trial 7 finished with value: 0.21744363538167125 and parameters: {'alpha': 46806.97703257331, 'n_pcs': 2500, 'weight_scheme': 'linear', 'weight_clip_max': 3.0, 'weight_linear_min_weight': 0.13798029304672477, 'weight_linear_max_weight': 3.0957974174373546}. Best is trial 4 with value: 0.22094363376409815.
2026-06-01 01:04:27 | INFO | src.nested_cv_avggrm_weighted_unified | Trial 8 | outer=7 | alpha=5.456e+04 n_pcs=3000 (pc_topk) weight_search=on
2026-06-01 01:04:27 | INFO | src.nested_cv_avggrm_weighted_unified | Trial 8 | outer=7 | weight={'name': 'linear', 'floor': 1e-06, 'clip_max': 5.0, 'min_weight': 0.6690067570691431, 'max_weight': 4.8744640334054115}
[I 2026-06-01 01:04:31,678] Trial 8 finished with value: 0.22355914227227314 and parameters: {'alpha': 54559.68395210245, 'n_pcs': 3000, 'weight_scheme': 'linear', 'weight_clip_max': 5.0, 'weight_linear_min_weight': 0.6690067570691431, 'weight_linear_max_weight': 4.8744640334054115}. Best is trial 8 with value: 0.22355914227227314.
2026-06-01 01:04:31 | INFO | src.nested_cv_avggrm_weighted_unified | OUTER 7 | new best trial 8 (mean inner r=0.2236) saved to outputs/final_results/e6_pc_ridge_avggrm/thr_wing/e6_pc_ridge_avggrm_thr_wing_best_trials/split_07_best_trial.json
2026-06-01 01:04:31 | INFO | src.nested_cv_avggrm_weighted_unified | Trial 9 | outer=7 | alpha=8.868e+03 n_pcs=2000 (pc_topk) weight_search=on
2026-06-01 01:04:31 | INFO | src.nested_cv_avggrm_weighted_unified | Trial 9 | outer=7 | weight={'name': 'linear', 'floor': 1e-06, 'clip_max': 20.0, 'min_weight': 0.861124149305412, 'max_weight': 4.702809729786679}
2026-06-01 01:04:32 | INFO | src.nested_cv_avggrm_weighted_unified | Trial 9 | outer=7 | pruned after 5/10 inner folds (mean r=0.1880)
[I 2026-06-01 01:04:32,960] Trial 9 pruned. 
2026-06-01 01:04:32 | INFO | src.nested_cv_avggrm_weighted_unified | Trial 10 | outer=7 | alpha=5.986e+05 n_pcs=500 (pc_topk) weight_search=on
2026-06-01 01:04:32 | INFO | src.nested_cv_avggrm_weighted_unified | Trial 10 | outer=7 | weight={'name': 'linear', 'floor': 1e-06, 'clip_max': 5.0, 'min_weight': 0.6649918033453551, 'max_weight': 1.3005022441588598}
2026-06-01 01:04:33 | INFO | src.nested_cv_avggrm_weighted_unified | Trial 10 | outer=7 | pruned after 5/10 inner folds (mean r=0.1816)
[I 2026-06-01 01:04:33,488] Trial 10 pruned. 
2026-06-01 01:04:33 | INFO | src.nested_cv_avggrm_weighted_unified | Trial 11 | outer=7 | alpha=9.423e+06 n_pcs=5000 (pc_topk) weight_search=on
2026-06-01 01:04:33 | INFO | src.nested_cv_avggrm_weighted_unified | Trial 11 | outer=7 | weight={'name': 'exponential', 'floor': 1e-06, 'clip_max': None, 'beta': 9.422900556669042}
2026-06-01 01:04:37 | INFO | src.nested_cv_avggrm_weighted_unified | Trial 11 | outer=7 | pruned after 5/10 inner folds (mean r=0.1361)
[I 2026-06-01 01:04:37,590] Trial 11 pruned. 
2026-06-01 01:04:37 | INFO | src.nested_cv_avggrm_weighted_unified | Trial 12 | outer=7 | alpha=1.721e+04 n_pcs=5000 (pc_topk) weight_search=on
2026-06-01 01:04:37 | INFO | src.nested_cv_avggrm_weighted_unified | Trial 12 | outer=7 | weight={'name': 'exponential', 'floor': 1e-06, 'clip_max': 5.0, 'beta': 5.647108005526702}
[I 2026-06-01 01:04:45,662] Trial 12 finished with value: 0.22069715872241646 and parameters: {'alpha': 17214.20557627711, 'n_pcs': 5000, 'weight_scheme': 'exponential', 'weight_clip_max': 5.0, 'weight_exponential_beta': 5.647108005526702}. Best is trial 8 with value: 0.22355914227227314.
2026-06-01 01:04:45 | INFO | src.nested_cv_avggrm_weighted_unified | Trial 13 | outer=7 | alpha=2.090e+05 n_pcs=3500 (pc_topk) weight_search=on
2026-06-01 01:04:45 | INFO | src.nested_cv_avggrm_weighted_unified | Trial 13 | outer=7 | weight={'name': 'linear', 'floor': 1e-06, 'clip_max': 5.0, 'min_weight': 0.44725940969778444, 'max_weight': 1.689579879242048}
[I 2026-06-01 01:04:50,542] Trial 13 finished with value: 0.2164776189960141 and parameters: {'alpha': 209001.29593602012, 'n_pcs': 3500, 'weight_scheme': 'linear', 'weight_clip_max': 5.0, 'weight_linear_min_weight': 0.44725940969778444, 'weight_linear_max_weight': 1.689579879242048}. Best is trial 8 with value: 0.22355914227227314.
2026-06-01 01:04:50 | INFO | src.nested_cv_avggrm_weighted_unified | Trial 14 | outer=7 | alpha=2.772e+04 n_pcs=3500 (pc_topk) weight_search=on
2026-06-01 01:04:50 | INFO | src.nested_cv_avggrm_weighted_unified | Trial 14 | outer=7 | weight={'name': 'uniform', 'floor': 1e-06, 'clip_max': None}
[I 2026-06-01 01:04:54,682] Trial 14 finished with value: 0.21335755798238157 and parameters: {'alpha': 27717.768527487133, 'n_pcs': 3500, 'weight_scheme': 'uniform', 'weight_clip_max': None}. Best is trial 8 with value: 0.22355914227227314.
2026-06-01 01:04:54 | INFO | src.nested_cv_avggrm_weighted_unified | Trial 15 | outer=7 | alpha=2.761e+05 n_pcs=4500 (pc_topk) weight_search=on
2026-06-01 01:04:54 | INFO | src.nested_cv_avggrm_weighted_unified | Trial 15 | outer=7 | weight={'name': 'linear', 'floor': 1e-06, 'clip_max': 5.0, 'min_weight': 0.9689803782581343, 'max_weight': 4.9100809859168315}
[I 2026-06-01 01:05:01,523] Trial 15 finished with value: 0.21516966260299478 and parameters: {'alpha': 276109.39921497885, 'n_pcs': 4500, 'weight_scheme': 'linear', 'weight_clip_max': 5.0, 'weight_linear_min_weight': 0.9689803782581343, 'weight_linear_max_weight': 4.9100809859168315}. Best is trial 8 with value: 0.22355914227227314.
2026-06-01 01:05:01 | INFO | src.nested_cv_avggrm_weighted_unified | Trial 16 | outer=7 | alpha=5.226e+03 n_pcs=3000 (pc_topk) weight_search=on
2026-06-01 01:05:01 | INFO | src.nested_cv_avggrm_weighted_unified | Trial 16 | outer=7 | weight={'name': 'exponential', 'floor': 1e-06, 'clip_max': None, 'beta': 5.962752903888057}
[I 2026-06-01 01:05:05,686] Trial 16 finished with value: 0.17347829229764894 and parameters: {'alpha': 5226.284112606966, 'n_pcs': 3000, 'weight_scheme': 'exponential', 'weight_clip_max': None, 'weight_exponential_beta': 5.962752903888057}. Best is trial 8 with value: 0.22355914227227314.
2026-06-01 01:05:05 | INFO | src.nested_cv_avggrm_weighted_unified | Trial 17 | outer=7 | alpha=8.859e+05 n_pcs=1000 (pc_topk) weight_search=on
2026-06-01 01:05:05 | INFO | src.nested_cv_avggrm_weighted_unified | Trial 17 | outer=7 | weight={'name': 'exponential', 'floor': 1e-06, 'clip_max': 5.0, 'beta': 7.492261875463922}
[I 2026-06-01 01:05:07,210] Trial 17 finished with value: 0.2116909807055444 and parameters: {'alpha': 885943.8516209496, 'n_pcs': 1000, 'weight_scheme': 'exponential', 'weight_clip_max': 5.0, 'weight_exponential_beta': 7.492261875463922}. Best is trial 8 with value: 0.22355914227227314.
2026-06-01 01:05:07 | INFO | src.nested_cv_avggrm_weighted_unified | Trial 18 | outer=7 | alpha=2.240e+04 n_pcs=4500 (pc_topk) weight_search=on
2026-06-01 01:05:07 | INFO | src.nested_cv_avggrm_weighted_unified | Trial 18 | outer=7 | weight={'name': 'linear', 'floor': 1e-06, 'clip_max': None, 'min_weight': 0.49175692108848046, 'max_weight': 3.017045951297736}
[I 2026-06-01 01:05:14,139] Trial 18 finished with value: 0.2256142724356489 and parameters: {'alpha': 22403.457262214473, 'n_pcs': 4500, 'weight_scheme': 'linear', 'weight_clip_max': None, 'weight_linear_min_weight': 0.49175692108848046, 'weight_linear_max_weight': 3.017045951297736}. Best is trial 18 with value: 0.2256142724356489.
2026-06-01 01:05:14 | INFO | src.nested_cv_avggrm_weighted_unified | OUTER 7 | new best trial 18 (mean inner r=0.2256) saved to outputs/final_results/e6_pc_ridge_avggrm/thr_wing/e6_pc_ridge_avggrm_thr_wing_best_trials/split_07_best_trial.json
2026-06-01 01:05:14 | INFO | src.nested_cv_avggrm_weighted_unified | Trial 19 | outer=7 | alpha=1.040e+05 n_pcs=4000 (pc_topk) weight_search=on
2026-06-01 01:05:14 | INFO | src.nested_cv_avggrm_weighted_unified | Trial 19 | outer=7 | weight={'name': 'linear', 'floor': 1e-06, 'clip_max': 10.0, 'min_weight': 0.5490255503378874, 'max_weight': 2.8208226819894096}
[I 2026-06-01 01:05:19,974] Trial 19 finished with value: 0.22506941423540847 and parameters: {'alpha': 103959.76380975673, 'n_pcs': 4000, 'weight_scheme': 'linear', 'weight_clip_max': 10.0, 'weight_linear_min_weight': 0.5490255503378874, 'weight_linear_max_weight': 2.8208226819894096}. Best is trial 18 with value: 0.2256142724356489.
2026-06-01 01:05:19 | INFO | src.nested_cv_avggrm_weighted_unified | Trial 20 | outer=7 | alpha=1.064e+03 n_pcs=4000 (pc_topk) weight_search=on
2026-06-01 01:05:19 | INFO | src.nested_cv_avggrm_weighted_unified | Trial 20 | outer=7 | weight={'name': 'linear', 'floor': 1e-06, 'clip_max': 10.0, 'min_weight': 0.41478014955711395, 'max_weight': 2.6506394195744667}
2026-06-01 01:05:23 | INFO | src.nested_cv_avggrm_weighted_unified | Trial 20 | outer=7 | pruned after 5/10 inner folds (mean r=0.1563)
[I 2026-06-01 01:05:23,018] Trial 20 pruned. 
2026-06-01 01:05:23 | INFO | src.nested_cv_avggrm_weighted_unified | Trial 21 | outer=7 | alpha=1.009e+05 n_pcs=3500 (pc_topk) weight_search=on
2026-06-01 01:05:23 | INFO | src.nested_cv_avggrm_weighted_unified | Trial 21 | outer=7 | weight={'name': 'linear', 'floor': 1e-06, 'clip_max': 10.0, 'min_weight': 0.618889175005588, 'max_weight': 2.7897707995975045}
[I 2026-06-01 01:05:27,805] Trial 21 finished with value: 0.22304209965450283 and parameters: {'alpha': 100888.27287916727, 'n_pcs': 3500, 'weight_scheme': 'linear', 'weight_clip_max': 10.0, 'weight_linear_min_weight': 0.618889175005588, 'weight_linear_max_weight': 2.7897707995975045}. Best is trial 18 with value: 0.2256142724356489.
2026-06-01 01:05:27 | INFO | src.nested_cv_avggrm_weighted_unified | Trial 22 | outer=7 | alpha=3.283e+04 n_pcs=4500 (pc_topk) weight_search=on
2026-06-01 01:05:27 | INFO | src.nested_cv_avggrm_weighted_unified | Trial 22 | outer=7 | weight={'name': 'linear', 'floor': 1e-06, 'clip_max': 10.0, 'min_weight': 0.6938773503011147, 'max_weight': 3.6412300760588865}
[I 2026-06-01 01:05:34,654] Trial 22 finished with value: 0.22756024335746972 and parameters: {'alpha': 32828.18686580972, 'n_pcs': 4500, 'weight_scheme': 'linear', 'weight_clip_max': 10.0, 'weight_linear_min_weight': 0.6938773503011147, 'weight_linear_max_weight': 3.6412300760588865}. Best is trial 22 with value: 0.22756024335746972.
2026-06-01 01:05:34 | INFO | src.nested_cv_avggrm_weighted_unified | OUTER 7 | new best trial 22 (mean inner r=0.2276) saved to outputs/final_results/e6_pc_ridge_avggrm/thr_wing/e6_pc_ridge_avggrm_thr_wing_best_trials/split_07_best_trial.json
2026-06-01 01:05:34 | INFO | src.nested_cv_avggrm_weighted_unified | Trial 23 | outer=7 | alpha=2.120e+05 n_pcs=4500 (pc_topk) weight_search=on
2026-06-01 01:05:34 | INFO | src.nested_cv_avggrm_weighted_unified | Trial 23 | outer=7 | weight={'name': 'linear', 'floor': 1e-06, 'clip_max': 10.0, 'min_weight': 0.485144454742556, 'max_weight': 3.5298516450305972}
