[I 2026-06-01 21:09:03,191] Trial 290 finished with value: 0.2367704240917178 and parameters: {'alpha': 62166.03398161436, 'n_pcs': 4000, 'iw_method': 'pc_logistic', 'iw_clip_max': 1.5, 'iw_prob_clip': 0.02003158689222114, 'iw_n_components': 80, 'iw_logistic_c': 1.0499007488658916, 'iw_pca_fit': 'combined', 'iw_solver': 'lbfgs', 'iw_rho': 0.85}. Best is trial 223 with value: 0.23705194687121506.
2026-06-01 21:09:03 | INFO | Trial 291 | outer=6 | alpha=7.914e+04 n_pcs=4000 (pc_topk) weight={'name': 'pc_logistic', 'floor': 1e-06, 'clip_max': 4.0, 'prob_clip': 0.016026254560100636, 'n_components': 10, 'logistic_c': 4.7777737100851745, 'pca_fit': 'combined', 'solver': 'lbfgs', 'max_iter': 2000, 'fit_intercept': True, 'standardize_with_source': True, 'rho': 0.85}
[I 2026-06-01 21:09:17,769] Trial 291 finished with value: 0.22965519961585484 and parameters: {'alpha': 79138.97108936896, 'n_pcs': 4000, 'iw_method': 'pc_logistic', 'iw_clip_max': 4.0, 'iw_prob_clip': 0.016026254560100636, 'iw_n_components': 10, 'iw_logistic_c': 4.7777737100851745, 'iw_pca_fit': 'combined', 'iw_solver': 'lbfgs', 'iw_rho': 0.85}. Best is trial 223 with value: 0.23705194687121506.
2026-06-01 21:09:17 | INFO | Trial 292 | outer=6 | alpha=9.766e+04 n_pcs=4000 (pc_topk) weight={'name': 'pc_logistic', 'floor': 1e-06, 'clip_max': 1.5, 'prob_clip': 0.018620517170611882, 'n_components': 80, 'logistic_c': 0.7398167597791053, 'pca_fit': 'combined', 'solver': 'lbfgs', 'max_iter': 2000, 'fit_intercept': True, 'standardize_with_source': True, 'rho': 0.85}
[I 2026-06-01 21:09:41,707] Trial 292 finished with value: 0.23633077319911497 and parameters: {'alpha': 97662.2364254823, 'n_pcs': 4000, 'iw_method': 'pc_logistic', 'iw_clip_max': 1.5, 'iw_prob_clip': 0.018620517170611882, 'iw_n_components': 80, 'iw_logistic_c': 0.7398167597791053, 'iw_pca_fit': 'combined', 'iw_solver': 'lbfgs', 'iw_rho': 0.85}. Best is trial 223 with value: 0.23705194687121506.
2026-06-01 21:09:41 | INFO | Trial 293 | outer=6 | alpha=7.540e+04 n_pcs=4000 (pc_topk) weight={'name': 'pc_logistic', 'floor': 1e-06, 'clip_max': 1.5, 'prob_clip': 0.01609700207890477, 'n_components': 80, 'logistic_c': 1.747136714338561, 'pca_fit': 'combined', 'solver': 'lbfgs', 'max_iter': 2000, 'fit_intercept': True, 'standardize_with_source': True, 'rho': 0.85}
[I 2026-06-01 21:10:05,244] Trial 293 finished with value: 0.23672918344200838 and parameters: {'alpha': 75398.4395903069, 'n_pcs': 4000, 'iw_method': 'pc_logistic', 'iw_clip_max': 1.5, 'iw_prob_clip': 0.01609700207890477, 'iw_n_components': 80, 'iw_logistic_c': 1.747136714338561, 'iw_pca_fit': 'combined', 'iw_solver': 'lbfgs', 'iw_rho': 0.85}. Best is trial 223 with value: 0.23705194687121506.
2026-06-01 21:10:05 | INFO | Trial 294 | outer=6 | alpha=6.226e+04 n_pcs=4000 (pc_topk) weight={'name': 'pc_logistic', 'floor': 1e-06, 'clip_max': 1.5, 'prob_clip': 0.014267969663171823, 'n_components': 80, 'logistic_c': 1.1998282512443452, 'pca_fit': 'combined', 'solver': 'lbfgs', 'max_iter': 2000, 'fit_intercept': True, 'standardize_with_source': True, 'rho': 0.85}
[I 2026-06-01 21:10:33,583] Trial 294 finished with value: 0.2367462951805448 and parameters: {'alpha': 62257.04693895484, 'n_pcs': 4000, 'iw_method': 'pc_logistic', 'iw_clip_max': 1.5, 'iw_prob_clip': 0.014267969663171823, 'iw_n_components': 80, 'iw_logistic_c': 1.1998282512443452, 'iw_pca_fit': 'combined', 'iw_solver': 'lbfgs', 'iw_rho': 0.85}. Best is trial 223 with value: 0.23705194687121506.
2026-06-01 21:10:33 | INFO | Trial 295 | outer=6 | alpha=1.086e+05 n_pcs=4000 (pc_topk) weight={'name': 'pc_logistic', 'floor': 1e-06, 'clip_max': 1.5, 'prob_clip': 0.017420175560512927, 'n_components': 80, 'logistic_c': 0.6761974649687429, 'pca_fit': 'combined', 'solver': 'lbfgs', 'max_iter': 2000, 'fit_intercept': True, 'standardize_with_source': True, 'rho': 0.85}
[I 2026-06-01 21:11:01,065] Trial 295 finished with value: 0.23600086020782948 and parameters: {'alpha': 108572.3791339765, 'n_pcs': 4000, 'iw_method': 'pc_logistic', 'iw_clip_max': 1.5, 'iw_prob_clip': 0.017420175560512927, 'iw_n_components': 80, 'iw_logistic_c': 0.6761974649687429, 'iw_pca_fit': 'combined', 'iw_solver': 'lbfgs', 'iw_rho': 0.85}. Best is trial 223 with value: 0.23705194687121506.
2026-06-01 21:11:01 | INFO | Trial 296 | outer=6 | alpha=7.399e+04 n_pcs=4000 (pc_topk) weight={'name': 'pc_logistic', 'floor': 1e-06, 'clip_max': 1.5, 'prob_clip': 0.020587848827209255, 'n_components': 80, 'logistic_c': 2.682710928332281, 'pca_fit': 'combined', 'solver': 'lbfgs', 'max_iter': 2000, 'fit_intercept': True, 'standardize_with_source': True, 'rho': 0.85}
[I 2026-06-01 21:11:28,400] Trial 296 finished with value: 0.23649294021843376 and parameters: {'alpha': 73985.0668489377, 'n_pcs': 4000, 'iw_method': 'pc_logistic', 'iw_clip_max': 1.5, 'iw_prob_clip': 0.020587848827209255, 'iw_n_components': 80, 'iw_logistic_c': 2.682710928332281, 'iw_pca_fit': 'combined', 'iw_solver': 'lbfgs', 'iw_rho': 0.85}. Best is trial 223 with value: 0.23705194687121506.
2026-06-01 21:11:28 | INFO | Trial 297 | outer=6 | alpha=6.549e+04 n_pcs=4000 (pc_topk) weight={'name': 'pc_logistic', 'floor': 1e-06, 'clip_max': 1.5, 'prob_clip': 0.004481169832397661, 'n_components': 80, 'logistic_c': 1.1177935081678316, 'pca_fit': 'combined', 'solver': 'lbfgs', 'max_iter': 2000, 'fit_intercept': True, 'standardize_with_source': True, 'rho': 0.85}
[I 2026-06-01 21:11:54,420] Trial 297 finished with value: 0.23344863752449846 and parameters: {'alpha': 65487.426840106455, 'n_pcs': 4000, 'iw_method': 'pc_logistic', 'iw_clip_max': 1.5, 'iw_prob_clip': 0.004481169832397661, 'iw_n_components': 80, 'iw_logistic_c': 1.1177935081678316, 'iw_pca_fit': 'combined', 'iw_solver': 'lbfgs', 'iw_rho': 0.85}. Best is trial 223 with value: 0.23705194687121506.
2026-06-01 21:11:54 | INFO | Trial 298 | outer=6 | alpha=5.992e+04 n_pcs=4000 (pc_topk) weight={'name': 'pc_logistic', 'floor': 1e-06, 'clip_max': 1.5, 'prob_clip': 0.014178257296770047, 'n_components': 80, 'logistic_c': 0.42277696631259487, 'pca_fit': 'combined', 'solver': 'lbfgs', 'max_iter': 2000, 'fit_intercept': True, 'standardize_with_source': True, 'rho': 0.3}
[I 2026-06-01 21:12:20,574] Trial 298 finished with value: 0.23605328136858975 and parameters: {'alpha': 59922.99419064431, 'n_pcs': 4000, 'iw_method': 'pc_logistic', 'iw_clip_max': 1.5, 'iw_prob_clip': 0.014178257296770047, 'iw_n_components': 80, 'iw_logistic_c': 0.42277696631259487, 'iw_pca_fit': 'combined', 'iw_solver': 'lbfgs', 'iw_rho': 0.3}. Best is trial 223 with value: 0.23705194687121506.
2026-06-01 21:12:20 | INFO | Trial 299 | outer=6 | alpha=7.801e+04 n_pcs=4000 (pc_topk) weight={'name': 'pc_logistic', 'floor': 1e-06, 'clip_max': 1.5, 'prob_clip': 0.018808114218055554, 'n_components': 80, 'logistic_c': 0.2770652371177479, 'pca_fit': 'combined', 'solver': 'lbfgs', 'max_iter': 2000, 'fit_intercept': True, 'standardize_with_source': True, 'rho': 0.85}
[I 2026-06-01 21:12:47,254] Trial 299 finished with value: 0.23696189763530162 and parameters: {'alpha': 78006.81116304541, 'n_pcs': 4000, 'iw_method': 'pc_logistic', 'iw_clip_max': 1.5, 'iw_prob_clip': 0.018808114218055554, 'iw_n_components': 80, 'iw_logistic_c': 0.2770652371177479, 'iw_pca_fit': 'combined', 'iw_solver': 'lbfgs', 'iw_rho': 0.85}. Best is trial 223 with value: 0.23705194687121506.
2026-06-01 21:12:47 | INFO | OUTER 6 best (inner mean r=0.2371): {'model_type': 'pc_ridge', 'alpha': 57060.76418723017, 'use_snp_selection': True, 'num_snps': 4000, 'n_pcs': 4000, 'weighting': {'name': 'pc_logistic', 'floor': 1e-06, 'clip_max': 1.5, 'prob_clip': 0.015959449343063432, 'n_components': 80, 'logistic_c': 0.34561732481429136, 'pca_fit': 'combined', 'solver': 'lbfgs', 'max_iter': 2000, 'fit_intercept': True, 'standardize_with_source': True, 'rho': 0.85}, 'mean_inner_effective_sample_size': 4024.7473783470887, 'mean_inner_effective_sample_size_threshold': 869.0200000000001}
2026-06-01 21:12:49 | INFO | OUTER 6 TEST r = 0.1598
2026-06-01 21:12:49 | INFO | OUTER 6 incremental summary saved to outputs/final_results/e6_pc_ridge_importance/thr_wing/e6_pc_ridge_importance_thr_wing_results.json
2026-06-01 21:12:49 | INFO | OUTER 7: test_size=349 island=6 (Indre Kvarøy)
2026-06-01 21:12:49 | INFO | OUTER 7: using top 10 related inner validation islands for tuning: 4(Gjerøy, avgGRM=0.0043), 7(Onøy og Lurøy, avgGRM=0.0042), 5(Hestmannøy, avgGRM=0.0039), 9(Sleneset, avgGRM=0.0038), 8(Lovund, avgGRM=0.0023), 0(Nesøy, avgGRM=0.0016), 2(Træna, avgGRM=0.0015), 1(Myken, avgGRM=0.0009), 3(Selvær, avgGRM=0.0005), 10(Aldra, avgGRM=-0.0026)
[I 2026-06-01 21:12:49,662] A new study created in memory with name: ridge_importance_inner_outer6
2026-06-01 21:12:49 | INFO | Trial 0 | outer=7 | alpha=1.137e+05 n_pcs=4000 (pc_topk) weight={'name': 'uniform'}
[I 2026-06-01 21:12:56,603] Trial 0 finished with value: 0.21174414797952051 and parameters: {'alpha': 113703.38004442609, 'n_pcs': 4000, 'iw_method': 'uniform'}. Best is trial 0 with value: 0.21174414797952051.
2026-06-01 21:12:56 | INFO | Trial 1 | outer=7 | alpha=1.734e+04 n_pcs=5000 (pc_topk) weight={'name': 'uniform'}
[I 2026-06-01 21:13:06,700] Trial 1 finished with value: 0.21758989195960052 and parameters: {'alpha': 17335.792577698634, 'n_pcs': 5000, 'iw_method': 'uniform'}. Best is trial 1 with value: 0.21758989195960052.
2026-06-01 21:13:06 | INFO | Trial 2 | outer=7 | alpha=1.435e+05 n_pcs=1500 (pc_topk) weight={'name': 'uniform'}
[I 2026-06-01 21:13:10,206] Trial 2 finished with value: 0.19979948980404888 and parameters: {'alpha': 143482.76912965564, 'n_pcs': 1500, 'iw_method': 'uniform'}. Best is trial 1 with value: 0.21758989195960052.
2026-06-01 21:13:10 | INFO | Trial 3 | outer=7 | alpha=1.431e+05 n_pcs=500 (pc_topk) weight={'name': 'uniform'}
[I 2026-06-01 21:13:11,241] Trial 3 finished with value: 0.16572297510313777 and parameters: {'alpha': 143072.2464444983, 'n_pcs': 500, 'iw_method': 'uniform'}. Best is trial 1 with value: 0.21758989195960052.
2026-06-01 21:13:11 | INFO | Trial 4 | outer=7 | alpha=5.373e+06 n_pcs=2000 (pc_topk) weight={'name': 'pc_logistic', 'floor': 1e-06, 'clip_max': 1.5, 'prob_clip': 0.001637400317167702, 'n_components': 80, 'logistic_c': 0.09386700500068379, 'pca_fit': 'combined', 'solver': 'lbfgs', 'max_iter': 2000, 'fit_intercept': True, 'standardize_with_source': True, 'rho': 1.0}
[I 2026-06-01 21:13:31,306] Trial 4 finished with value: 0.18701483926990473 and parameters: {'alpha': 5373167.4046281455, 'n_pcs': 2000, 'iw_method': 'pc_logistic', 'iw_clip_max': 1.5, 'iw_prob_clip': 0.001637400317167702, 'iw_n_components': 80, 'iw_logistic_c': 0.09386700500068379, 'iw_pca_fit': 'combined', 'iw_solver': 'lbfgs', 'iw_rho': 1.0}. Best is trial 1 with value: 0.21758989195960052.
2026-06-01 21:13:31 | INFO | Trial 5 | outer=7 | alpha=6.435e+04 n_pcs=1000 (pc_topk) weight={'name': 'pc_logistic', 'floor': 1e-06, 'clip_max': 7.0, 'prob_clip': 0.004193356127903791, 'n_components': 20, 'logistic_c': 9.236417519010976, 'pca_fit': 'combined', 'solver': 'lbfgs', 'max_iter': 2000, 'fit_intercept': True, 'standardize_with_source': True, 'rho': 1.0}
2026-06-01 21:13:41 | INFO | Trial 5 rejected by ESS guard: mean_ess=863.16 threshold=996.10
[I 2026-06-01 21:13:41,763] Trial 5 finished with value: -1.0 and parameters: {'alpha': 64350.09539177312, 'n_pcs': 1000, 'iw_method': 'pc_logistic', 'iw_clip_max': 7.0, 'iw_prob_clip': 0.004193356127903791, 'iw_n_components': 20, 'iw_logistic_c': 9.236417519010976, 'iw_pca_fit': 'combined', 'iw_solver': 'lbfgs', 'iw_rho': 1.0}. Best is trial 1 with value: 0.21758989195960052.
2026-06-01 21:13:41 | INFO | Trial 6 | outer=7 | alpha=3.046e+05 n_pcs=3500 (pc_topk) weight={'name': 'pc_logistic', 'floor': 1e-06, 'clip_max': 12.0, 'prob_clip': 0.0007016380040663315, 'n_components': 80, 'logistic_c': 0.00021908930989278453, 'pca_fit': 'combined', 'solver': 'lbfgs', 'max_iter': 2000, 'fit_intercept': True, 'standardize_with_source': True, 'rho': 0.7}
[I 2026-06-01 21:13:54,985] Trial 6 finished with value: 0.21357347386963954 and parameters: {'alpha': 304631.0485153137, 'n_pcs': 3500, 'iw_method': 'pc_logistic', 'iw_clip_max': 12.0, 'iw_prob_clip': 0.0007016380040663315, 'iw_n_components': 80, 'iw_logistic_c': 0.00021908930989278453, 'iw_pca_fit': 'combined', 'iw_solver': 'lbfgs', 'iw_rho': 0.7}. Best is trial 1 with value: 0.21758989195960052.
2026-06-01 21:13:54 | INFO | Trial 7 | outer=7 | alpha=7.213e+06 n_pcs=500 (pc_topk) weight={'name': 'uniform'}
[I 2026-06-01 21:13:56,069] Trial 7 finished with value: 0.1562727762409412 and parameters: {'alpha': 7213019.60957054, 'n_pcs': 500, 'iw_method': 'uniform'}. Best is trial 1 with value: 0.21758989195960052.
2026-06-01 21:13:56 | INFO | Trial 8 | outer=7 | alpha=2.347e+03 n_pcs=3000 (pc_topk) weight={'name': 'pc_logistic', 'floor': 1e-06, 'clip_max': 2.5, 'prob_clip': 0.017782866059784724, 'n_components': 60, 'logistic_c': 4.584813955429537e-07, 'pca_fit': 'combined', 'solver': 'lbfgs', 'max_iter': 2000, 'fit_intercept': True, 'standardize_with_source': True, 'rho': 0.3}
[I 2026-06-01 21:14:05,029] Trial 8 finished with value: 0.13269095443051288 and parameters: {'alpha': 2346.6230871488538, 'n_pcs': 3000, 'iw_method': 'pc_logistic', 'iw_clip_max': 2.5, 'iw_prob_clip': 0.017782866059784724, 'iw_n_components': 60, 'iw_logistic_c': 4.584813955429537e-07, 'iw_pca_fit': 'combined', 'iw_solver': 'lbfgs', 'iw_rho': 0.3}. Best is trial 1 with value: 0.21758989195960052.
2026-06-01 21:14:05 | INFO | Trial 9 | outer=7 | alpha=1.067e+03 n_pcs=4000 (pc_topk) weight={'name': 'pc_logistic', 'floor': 1e-06, 'clip_max': 4.0, 'prob_clip': 0.003002704300062754, 'n_components': 10, 'logistic_c': 4.32601466983518e-06, 'pca_fit': 'combined', 'solver': 'lbfgs', 'max_iter': 2000, 'fit_intercept': True, 'standardize_with_source': True, 'rho': 1.0}
[I 2026-06-01 21:14:17,718] Trial 9 finished with value: 0.12137955128441702 and parameters: {'alpha': 1067.2105048492429, 'n_pcs': 4000, 'iw_method': 'pc_logistic', 'iw_clip_max': 4.0, 'iw_prob_clip': 0.003002704300062754, 'iw_n_components': 10, 'iw_logistic_c': 4.32601466983518e-06, 'iw_pca_fit': 'combined', 'iw_solver': 'lbfgs', 'iw_rho': 1.0}. Best is trial 1 with value: 0.21758989195960052.
2026-06-01 21:14:17 | INFO | Trial 10 | outer=7 | alpha=1.150e+04 n_pcs=5000 (pc_topk) weight={'name': 'uniform'}
[I 2026-06-01 21:14:28,031] Trial 10 finished with value: 0.2137338218804575 and parameters: {'alpha': 11501.099698953694, 'n_pcs': 5000, 'iw_method': 'uniform'}. Best is trial 1 with value: 0.21758989195960052.
2026-06-01 21:14:28 | INFO | Trial 11 | outer=7 | alpha=9.461e+03 n_pcs=5000 (pc_topk) weight={'name': 'uniform'}
[I 2026-06-01 21:14:38,411] Trial 11 finished with value: 0.21112516912358145 and parameters: {'alpha': 9461.19667347222, 'n_pcs': 5000, 'iw_method': 'uniform'}. Best is trial 1 with value: 0.21758989195960052.
2026-06-01 21:14:38 | INFO | Trial 12 | outer=7 | alpha=1.341e+04 n_pcs=5000 (pc_topk) weight={'name': 'uniform'}
[I 2026-06-01 21:14:48,703] Trial 12 finished with value: 0.2154369777263767 and parameters: {'alpha': 13411.551226369838, 'n_pcs': 5000, 'iw_method': 'uniform'}. Best is trial 1 with value: 0.21758989195960052.
2026-06-01 21:14:48 | INFO | Trial 13 | outer=7 | alpha=1.460e+04 n_pcs=4500 (pc_topk) weight={'name': 'uniform'}
[I 2026-06-01 21:14:57,741] Trial 13 finished with value: 0.21691888039596624 and parameters: {'alpha': 14604.768536146159, 'n_pcs': 4500, 'iw_method': 'uniform'}. Best is trial 1 with value: 0.21758989195960052.
2026-06-01 21:14:57 | INFO | Trial 14 | outer=7 | alpha=4.147e+04 n_pcs=4000 (pc_topk) weight={'name': 'uniform'}
[I 2026-06-01 21:15:05,245] Trial 14 finished with value: 0.2197032638059912 and parameters: {'alpha': 41467.09244464692, 'n_pcs': 4000, 'iw_method': 'uniform'}. Best is trial 14 with value: 0.2197032638059912.
2026-06-01 21:15:05 | INFO | Trial 15 | outer=7 | alpha=9.891e+05 n_pcs=2500 (pc_topk) weight={'name': 'uniform'}
[I 2026-06-01 21:15:09,168] Trial 15 finished with value: 0.1881751912649184 and parameters: {'alpha': 989126.4335540048, 'n_pcs': 2500, 'iw_method': 'uniform'}. Best is trial 14 with value: 0.2197032638059912.
2026-06-01 21:15:09 | INFO | Trial 16 | outer=7 | alpha=4.070e+04 n_pcs=4000 (pc_topk) weight={'name': 'uniform'}
[I 2026-06-01 21:15:16,287] Trial 16 finished with value: 0.2197420513226782 and parameters: {'alpha': 40698.44372944894, 'n_pcs': 4000, 'iw_method': 'uniform'}. Best is trial 16 with value: 0.2197420513226782.
2026-06-01 21:15:16 | INFO | Trial 17 | outer=7 | alpha=3.762e+04 n_pcs=3500 (pc_topk) weight={'name': 'uniform'}
[I 2026-06-01 21:15:21,930] Trial 17 finished with value: 0.215393195930851 and parameters: {'alpha': 37618.4927169187, 'n_pcs': 3500, 'iw_method': 'uniform'}. Best is trial 16 with value: 0.2197420513226782.
2026-06-01 21:15:21 | INFO | Trial 18 | outer=7 | alpha=7.147e+05 n_pcs=3000 (pc_topk) weight={'name': 'uniform'}
[I 2026-06-01 21:15:26,946] Trial 18 finished with value: 0.1905675874917766 and parameters: {'alpha': 714694.6799037684, 'n_pcs': 3000, 'iw_method': 'uniform'}. Best is trial 16 with value: 0.2197420513226782.
2026-06-01 21:15:26 | INFO | Trial 19 | outer=7 | alpha=4.665e+03 n_pcs=4000 (pc_topk) weight={'name': 'uniform'}
[I 2026-06-01 21:15:34,272] Trial 19 finished with value: 0.17931631483749885 and parameters: {'alpha': 4664.983445930532, 'n_pcs': 4000, 'iw_method': 'uniform'}. Best is trial 16 with value: 0.2197420513226782.
2026-06-01 21:15:34 | INFO | Trial 20 | outer=7 | alpha=3.786e+04 n_pcs=3500 (pc_topk) weight={'name': 'uniform'}
[I 2026-06-01 21:15:40,407] Trial 20 finished with value: 0.21541494845191078 and parameters: {'alpha': 37855.51033082005, 'n_pcs': 3500, 'iw_method': 'uniform'}. Best is trial 16 with value: 0.2197420513226782.
2026-06-01 21:15:40 | INFO | Trial 21 | outer=7 | alpha=3.300e+04 n_pcs=4500 (pc_topk) weight={'name': 'uniform'}
[I 2026-06-01 21:15:49,557] Trial 21 finished with value: 0.22058382710875532 and parameters: {'alpha': 33004.39036663558, 'n_pcs': 4500, 'iw_method': 'uniform'}. Best is trial 21 with value: 0.22058382710875532.
2026-06-01 21:15:49 | INFO | Trial 22 | outer=7 | alpha=3.431e+04 n_pcs=4500 (pc_topk) weight={'name': 'uniform'}
[I 2026-06-01 21:15:58,364] Trial 22 finished with value: 0.22051655989358668 and parameters: {'alpha': 34306.136877271674, 'n_pcs': 4500, 'iw_method': 'uniform'}. Best is trial 21 with value: 0.22058382710875532.
2026-06-01 21:15:58 | INFO | Trial 23 | outer=7 | alpha=3.259e+05 n_pcs=4500 (pc_topk) weight={'name': 'uniform'}
[I 2026-06-01 21:16:07,172] Trial 23 finished with value: 0.19779099566343908 and parameters: {'alpha': 325858.95183422806, 'n_pcs': 4500, 'iw_method': 'uniform'}. Best is trial 21 with value: 0.22058382710875532.
2026-06-01 21:16:07 | INFO | Trial 24 | outer=7 | alpha=4.499e+03 n_pcs=4000 (pc_topk) weight={'name': 'uniform'}
[I 2026-06-01 21:16:14,272] Trial 24 finished with value: 0.17789374906857433 and parameters: {'alpha': 4498.781011896854, 'n_pcs': 4000, 'iw_method': 'uniform'}. Best is trial 21 with value: 0.22058382710875532.
2026-06-01 21:16:14 | INFO | Trial 25 | outer=7 | alpha=3.065e+04 n_pcs=4500 (pc_topk) weight={'name': 'uniform'}
[I 2026-06-01 21:16:23,275] Trial 25 finished with value: 0.22065653751690967 and parameters: {'alpha': 30646.422704798224, 'n_pcs': 4500, 'iw_method': 'uniform'}. Best is trial 25 with value: 0.22065653751690967.
2026-06-01 21:16:23 | INFO | Trial 26 | outer=7 | alpha=2.547e+04 n_pcs=4500 (pc_topk) weight={'name': 'pc_logistic', 'floor': 1e-06, 'clip_max': 2.5, 'prob_clip': 0.04783268173298191, 'n_components': 40, 'logistic_c': 0.0034285114017368, 'pca_fit': 'combined', 'solver': 'lbfgs', 'max_iter': 2000, 'fit_intercept': True, 'standardize_with_source': True, 'rho': 0.5}
[I 2026-06-01 21:16:41,887] Trial 26 finished with value: 0.22498965169866433 and parameters: {'alpha': 25474.059335164024, 'n_pcs': 4500, 'iw_method': 'pc_logistic', 'iw_clip_max': 2.5, 'iw_prob_clip': 0.04783268173298191, 'iw_n_components': 40, 'iw_logistic_c': 0.0034285114017368, 'iw_pca_fit': 'combined', 'iw_solver': 'lbfgs', 'iw_rho': 0.5}. Best is trial 26 with value: 0.22498965169866433.
2026-06-01 21:16:41 | INFO | Trial 27 | outer=7 | alpha=4.810e+03 n_pcs=4500 (pc_topk) weight={'name': 'pc_logistic', 'floor': 1e-06, 'clip_max': 2.5, 'prob_clip': 0.04068282884065535, 'n_components': 40, 'logistic_c': 0.004144301940152981, 'pca_fit': 'combined', 'solver': 'lbfgs', 'max_iter': 2000, 'fit_intercept': True, 'standardize_with_source': True, 'rho': 0.5}
[I 2026-06-01 21:17:00,634] Trial 27 finished with value: 0.19498016385746436 and parameters: {'alpha': 4809.607228025614, 'n_pcs': 4500, 'iw_method': 'pc_logistic', 'iw_clip_max': 2.5, 'iw_prob_clip': 0.04068282884065535, 'iw_n_components': 40, 'iw_logistic_c': 0.004144301940152981, 'iw_pca_fit': 'combined', 'iw_solver': 'lbfgs', 'iw_rho': 0.5}. Best is trial 26 with value: 0.22498965169866433.
2026-06-01 21:17:00 | INFO | Trial 28 | outer=7 | alpha=2.150e+04 n_pcs=2500 (pc_topk) weight={'name': 'pc_logistic', 'floor': 1e-06, 'clip_max': 2.5, 'prob_clip': 0.016572379481429717, 'n_components': 40, 'logistic_c': 0.0007021133098376147, 'pca_fit': 'combined', 'solver': 'lbfgs', 'max_iter': 2000, 'fit_intercept': True, 'standardize_with_source': True, 'rho': 0.5}
