[I 2026-06-01 02:14:56,332] Trial 223 finished with value: 0.23468116563209018 and parameters: {'alpha': 204305.14370894237, 'n_pcs': 3000, 'weight_scheme': 'exponential', 'weight_clip_max': 3.0, 'weight_exponential_beta': 8.721639214226837}. Best is trial 174 with value: 0.23469062114588263.
2026-06-01 02:14:56 | INFO | src.nested_cv_avggrm_weighted_unified | Trial 224 | outer=9 | alpha=2.194e+05 n_pcs=3000 (pc_topk) weight_search=on
2026-06-01 02:14:56 | INFO | src.nested_cv_avggrm_weighted_unified | Trial 224 | outer=9 | weight={'name': 'exponential', 'floor': 1e-06, 'clip_max': 3.0, 'beta': 8.766380847741585}
[I 2026-06-01 02:15:00,144] Trial 224 finished with value: 0.23464361378239024 and parameters: {'alpha': 219412.70990659008, 'n_pcs': 3000, 'weight_scheme': 'exponential', 'weight_clip_max': 3.0, 'weight_exponential_beta': 8.766380847741585}. Best is trial 174 with value: 0.23469062114588263.
2026-06-01 02:15:00 | INFO | src.nested_cv_avggrm_weighted_unified | Trial 225 | outer=9 | alpha=2.412e+05 n_pcs=3000 (pc_topk) weight_search=on
2026-06-01 02:15:00 | INFO | src.nested_cv_avggrm_weighted_unified | Trial 225 | outer=9 | weight={'name': 'exponential', 'floor': 1e-06, 'clip_max': 3.0, 'beta': 9.1846449260542}
[I 2026-06-01 02:15:03,949] Trial 225 finished with value: 0.2344683351034223 and parameters: {'alpha': 241234.70544342275, 'n_pcs': 3000, 'weight_scheme': 'exponential', 'weight_clip_max': 3.0, 'weight_exponential_beta': 9.1846449260542}. Best is trial 174 with value: 0.23469062114588263.
2026-06-01 02:15:03 | INFO | src.nested_cv_avggrm_weighted_unified | Trial 226 | outer=9 | alpha=2.164e+05 n_pcs=3000 (pc_topk) weight_search=on
2026-06-01 02:15:03 | INFO | src.nested_cv_avggrm_weighted_unified | Trial 226 | outer=9 | weight={'name': 'exponential', 'floor': 1e-06, 'clip_max': 3.0, 'beta': 8.923052996281026}
[I 2026-06-01 02:15:07,795] Trial 226 finished with value: 0.23463724954635917 and parameters: {'alpha': 216410.71448700767, 'n_pcs': 3000, 'weight_scheme': 'exponential', 'weight_clip_max': 3.0, 'weight_exponential_beta': 8.923052996281026}. Best is trial 174 with value: 0.23469062114588263.
2026-06-01 02:15:07 | INFO | src.nested_cv_avggrm_weighted_unified | Trial 227 | outer=9 | alpha=3.501e+05 n_pcs=3000 (pc_topk) weight_search=on
2026-06-01 02:15:07 | INFO | src.nested_cv_avggrm_weighted_unified | Trial 227 | outer=9 | weight={'name': 'exponential', 'floor': 1e-06, 'clip_max': 3.0, 'beta': 8.976766986127018}
[I 2026-06-01 02:15:11,600] Trial 227 finished with value: 0.23368207218606135 and parameters: {'alpha': 350056.5333036649, 'n_pcs': 3000, 'weight_scheme': 'exponential', 'weight_clip_max': 3.0, 'weight_exponential_beta': 8.976766986127018}. Best is trial 174 with value: 0.23469062114588263.
2026-06-01 02:15:11 | INFO | src.nested_cv_avggrm_weighted_unified | Trial 228 | outer=9 | alpha=2.874e+05 n_pcs=3000 (pc_topk) weight_search=on
2026-06-01 02:15:11 | INFO | src.nested_cv_avggrm_weighted_unified | Trial 228 | outer=9 | weight={'name': 'exponential', 'floor': 1e-06, 'clip_max': 3.0, 'beta': 9.34312516635984}
[I 2026-06-01 02:15:15,405] Trial 228 finished with value: 0.23417508411255797 and parameters: {'alpha': 287399.19806200004, 'n_pcs': 3000, 'weight_scheme': 'exponential', 'weight_clip_max': 3.0, 'weight_exponential_beta': 9.34312516635984}. Best is trial 174 with value: 0.23469062114588263.
2026-06-01 02:15:15 | INFO | src.nested_cv_avggrm_weighted_unified | Trial 229 | outer=9 | alpha=2.156e+05 n_pcs=3000 (pc_topk) weight_search=on
2026-06-01 02:15:15 | INFO | src.nested_cv_avggrm_weighted_unified | Trial 229 | outer=9 | weight={'name': 'exponential', 'floor': 1e-06, 'clip_max': 3.0, 'beta': 8.954712962213591}
[I 2026-06-01 02:15:19,223] Trial 229 finished with value: 0.2346279546056234 and parameters: {'alpha': 215632.61156487052, 'n_pcs': 3000, 'weight_scheme': 'exponential', 'weight_clip_max': 3.0, 'weight_exponential_beta': 8.954712962213591}. Best is trial 174 with value: 0.23469062114588263.
2026-06-01 02:15:19 | INFO | src.nested_cv_avggrm_weighted_unified | Trial 230 | outer=9 | alpha=2.290e+05 n_pcs=3000 (pc_topk) weight_search=on
2026-06-01 02:15:19 | INFO | src.nested_cv_avggrm_weighted_unified | Trial 230 | outer=9 | weight={'name': 'exponential', 'floor': 1e-06, 'clip_max': 3.0, 'beta': 8.797605032604988}
[I 2026-06-01 02:15:23,038] Trial 230 finished with value: 0.23460823937276465 and parameters: {'alpha': 229025.94931591596, 'n_pcs': 3000, 'weight_scheme': 'exponential', 'weight_clip_max': 3.0, 'weight_exponential_beta': 8.797605032604988}. Best is trial 174 with value: 0.23469062114588263.
2026-06-01 02:15:23 | INFO | src.nested_cv_avggrm_weighted_unified | Trial 231 | outer=9 | alpha=2.112e+05 n_pcs=3000 (pc_topk) weight_search=on
2026-06-01 02:15:23 | INFO | src.nested_cv_avggrm_weighted_unified | Trial 231 | outer=9 | weight={'name': 'exponential', 'floor': 1e-06, 'clip_max': 3.0, 'beta': 9.028223093545627}
[I 2026-06-01 02:15:26,852] Trial 231 finished with value: 0.23459426488839683 and parameters: {'alpha': 211226.00184168646, 'n_pcs': 3000, 'weight_scheme': 'exponential', 'weight_clip_max': 3.0, 'weight_exponential_beta': 9.028223093545627}. Best is trial 174 with value: 0.23469062114588263.
2026-06-01 02:15:26 | INFO | src.nested_cv_avggrm_weighted_unified | Trial 232 | outer=9 | alpha=2.059e+05 n_pcs=3000 (pc_topk) weight_search=on
2026-06-01 02:15:26 | INFO | src.nested_cv_avggrm_weighted_unified | Trial 232 | outer=9 | weight={'name': 'exponential', 'floor': 1e-06, 'clip_max': 3.0, 'beta': 8.581235155329033}
[I 2026-06-01 02:15:30,707] Trial 232 finished with value: 0.23465929797104373 and parameters: {'alpha': 205895.272480412, 'n_pcs': 3000, 'weight_scheme': 'exponential', 'weight_clip_max': 3.0, 'weight_exponential_beta': 8.581235155329033}. Best is trial 174 with value: 0.23469062114588263.
2026-06-01 02:15:30 | INFO | src.nested_cv_avggrm_weighted_unified | Trial 233 | outer=9 | alpha=2.590e+05 n_pcs=3000 (pc_topk) weight_search=on
2026-06-01 02:15:30 | INFO | src.nested_cv_avggrm_weighted_unified | Trial 233 | outer=9 | weight={'name': 'exponential', 'floor': 1e-06, 'clip_max': 3.0, 'beta': 8.576268482854967}
[I 2026-06-01 02:15:34,521] Trial 233 finished with value: 0.23431804524468558 and parameters: {'alpha': 259045.9437440764, 'n_pcs': 3000, 'weight_scheme': 'exponential', 'weight_clip_max': 3.0, 'weight_exponential_beta': 8.576268482854967}. Best is trial 174 with value: 0.23469062114588263.
2026-06-01 02:15:34 | INFO | src.nested_cv_avggrm_weighted_unified | Trial 234 | outer=9 | alpha=1.444e+05 n_pcs=3000 (pc_topk) weight_search=on
2026-06-01 02:15:34 | INFO | src.nested_cv_avggrm_weighted_unified | Trial 234 | outer=9 | weight={'name': 'exponential', 'floor': 1e-06, 'clip_max': 3.0, 'beta': 8.743008894048222}
[I 2026-06-01 02:15:38,424] Trial 234 finished with value: 0.2342871528711128 and parameters: {'alpha': 144408.26492026946, 'n_pcs': 3000, 'weight_scheme': 'exponential', 'weight_clip_max': 3.0, 'weight_exponential_beta': 8.743008894048222}. Best is trial 174 with value: 0.23469062114588263.
2026-06-01 02:15:38 | INFO | src.nested_cv_avggrm_weighted_unified | Trial 235 | outer=9 | alpha=1.978e+05 n_pcs=3000 (pc_topk) weight_search=on
2026-06-01 02:15:38 | INFO | src.nested_cv_avggrm_weighted_unified | Trial 235 | outer=9 | weight={'name': 'exponential', 'floor': 1e-06, 'clip_max': 3.0, 'beta': 8.493284008458991}
[I 2026-06-01 02:15:42,281] Trial 235 finished with value: 0.23466521648908772 and parameters: {'alpha': 197820.71738969436, 'n_pcs': 3000, 'weight_scheme': 'exponential', 'weight_clip_max': 3.0, 'weight_exponential_beta': 8.493284008458991}. Best is trial 174 with value: 0.23469062114588263.
2026-06-01 02:15:42 | INFO | src.nested_cv_avggrm_weighted_unified | Trial 236 | outer=9 | alpha=2.989e+05 n_pcs=3000 (pc_topk) weight_search=on
2026-06-01 02:15:42 | INFO | src.nested_cv_avggrm_weighted_unified | Trial 236 | outer=9 | weight={'name': 'exponential', 'floor': 1e-06, 'clip_max': 3.0, 'beta': 8.489321834879188}
[I 2026-06-01 02:15:46,067] Trial 236 finished with value: 0.23385254418550497 and parameters: {'alpha': 298869.88015052216, 'n_pcs': 3000, 'weight_scheme': 'exponential', 'weight_clip_max': 3.0, 'weight_exponential_beta': 8.489321834879188}. Best is trial 174 with value: 0.23469062114588263.
2026-06-01 02:15:46 | INFO | src.nested_cv_avggrm_weighted_unified | Trial 237 | outer=9 | alpha=2.135e+05 n_pcs=3000 (pc_topk) weight_search=on
2026-06-01 02:15:46 | INFO | src.nested_cv_avggrm_weighted_unified | Trial 237 | outer=9 | weight={'name': 'exponential', 'floor': 1e-06, 'clip_max': 5.0, 'beta': 8.80887520142575}
2026-06-01 02:15:49 | INFO | src.nested_cv_avggrm_weighted_unified | Trial 237 | outer=9 | pruned after 8/10 inner folds (mean r=0.2638)
[I 2026-06-01 02:15:49,168] Trial 237 pruned. 
2026-06-01 02:15:49 | INFO | src.nested_cv_avggrm_weighted_unified | Trial 238 | outer=9 | alpha=1.947e+05 n_pcs=3000 (pc_topk) weight_search=on
2026-06-01 02:15:49 | INFO | src.nested_cv_avggrm_weighted_unified | Trial 238 | outer=9 | weight={'name': 'linear', 'floor': 1e-06, 'clip_max': 3.0, 'min_weight': 0.7859390550628571, 'max_weight': 1.4633788503071636}
2026-06-01 02:15:51 | INFO | src.nested_cv_avggrm_weighted_unified | Trial 238 | outer=9 | pruned after 7/10 inner folds (mean r=0.2346)
[I 2026-06-01 02:15:51,879] Trial 238 pruned. 
2026-06-01 02:15:51 | INFO | src.nested_cv_avggrm_weighted_unified | Trial 239 | outer=9 | alpha=2.637e+05 n_pcs=3000 (pc_topk) weight_search=on
2026-06-01 02:15:51 | INFO | src.nested_cv_avggrm_weighted_unified | Trial 239 | outer=9 | weight={'name': 'exponential', 'floor': 1e-06, 'clip_max': 3.0, 'beta': 8.568761803864577}
[I 2026-06-01 02:15:55,685] Trial 239 finished with value: 0.2342709655234104 and parameters: {'alpha': 263684.43033224106, 'n_pcs': 3000, 'weight_scheme': 'exponential', 'weight_clip_max': 3.0, 'weight_exponential_beta': 8.568761803864577}. Best is trial 174 with value: 0.23469062114588263.
2026-06-01 02:15:55 | INFO | src.nested_cv_avggrm_weighted_unified | Trial 240 | outer=9 | alpha=3.393e+05 n_pcs=3000 (pc_topk) weight_search=on
2026-06-01 02:15:55 | INFO | src.nested_cv_avggrm_weighted_unified | Trial 240 | outer=9 | weight={'name': 'exponential', 'floor': 1e-06, 'clip_max': 3.0, 'beta': 9.18819597379826}
[I 2026-06-01 02:15:59,519] Trial 240 finished with value: 0.23383399266647814 and parameters: {'alpha': 339281.35109270277, 'n_pcs': 3000, 'weight_scheme': 'exponential', 'weight_clip_max': 3.0, 'weight_exponential_beta': 9.18819597379826}. Best is trial 174 with value: 0.23469062114588263.
2026-06-01 02:15:59 | INFO | src.nested_cv_avggrm_weighted_unified | Trial 241 | outer=9 | alpha=1.565e+05 n_pcs=3000 (pc_topk) weight_search=on
2026-06-01 02:15:59 | INFO | src.nested_cv_avggrm_weighted_unified | Trial 241 | outer=9 | weight={'name': 'exponential', 'floor': 1e-06, 'clip_max': 3.0, 'beta': 8.879272402464746}
2026-06-01 02:16:02 | INFO | src.nested_cv_avggrm_weighted_unified | Trial 241 | outer=9 | pruned after 8/10 inner folds (mean r=0.2653)
[I 2026-06-01 02:16:02,574] Trial 241 pruned. 
2026-06-01 02:16:02 | INFO | src.nested_cv_avggrm_weighted_unified | Trial 242 | outer=9 | alpha=1.967e+05 n_pcs=3000 (pc_topk) weight_search=on
2026-06-01 02:16:02 | INFO | src.nested_cv_avggrm_weighted_unified | Trial 242 | outer=9 | weight={'name': 'exponential', 'floor': 1e-06, 'clip_max': 3.0, 'beta': 8.352184614156364}
[I 2026-06-01 02:16:06,372] Trial 242 finished with value: 0.2346443814076667 and parameters: {'alpha': 196732.68389806544, 'n_pcs': 3000, 'weight_scheme': 'exponential', 'weight_clip_max': 3.0, 'weight_exponential_beta': 8.352184614156364}. Best is trial 174 with value: 0.23469062114588263.
2026-06-01 02:16:06 | INFO | src.nested_cv_avggrm_weighted_unified | Trial 243 | outer=9 | alpha=1.912e+05 n_pcs=3000 (pc_topk) weight_search=on
2026-06-01 02:16:06 | INFO | src.nested_cv_avggrm_weighted_unified | Trial 243 | outer=9 | weight={'name': 'exponential', 'floor': 1e-06, 'clip_max': 3.0, 'beta': 8.400844762422423}
[I 2026-06-01 02:16:10,269] Trial 243 finished with value: 0.23466867794822424 and parameters: {'alpha': 191183.2908235629, 'n_pcs': 3000, 'weight_scheme': 'exponential', 'weight_clip_max': 3.0, 'weight_exponential_beta': 8.400844762422423}. Best is trial 174 with value: 0.23469062114588263.
2026-06-01 02:16:10 | INFO | src.nested_cv_avggrm_weighted_unified | Trial 244 | outer=9 | alpha=1.978e+05 n_pcs=3000 (pc_topk) weight_search=on
2026-06-01 02:16:10 | INFO | src.nested_cv_avggrm_weighted_unified | Trial 244 | outer=9 | weight={'name': 'exponential', 'floor': 1e-06, 'clip_max': 3.0, 'beta': 8.37132340861735}
[I 2026-06-01 02:16:14,077] Trial 244 finished with value: 0.23464431038796243 and parameters: {'alpha': 197826.6909257763, 'n_pcs': 3000, 'weight_scheme': 'exponential', 'weight_clip_max': 3.0, 'weight_exponential_beta': 8.37132340861735}. Best is trial 174 with value: 0.23469062114588263.
2026-06-01 02:16:14 | INFO | src.nested_cv_avggrm_weighted_unified | Trial 245 | outer=9 | alpha=1.769e+05 n_pcs=3000 (pc_topk) weight_search=on
2026-06-01 02:16:14 | INFO | src.nested_cv_avggrm_weighted_unified | Trial 245 | outer=9 | weight={'name': 'exponential', 'floor': 1e-06, 'clip_max': 3.0, 'beta': 8.463920356267833}
[I 2026-06-01 02:16:17,911] Trial 245 finished with value: 0.23467395647421743 and parameters: {'alpha': 176922.71192134978, 'n_pcs': 3000, 'weight_scheme': 'exponential', 'weight_clip_max': 3.0, 'weight_exponential_beta': 8.463920356267833}. Best is trial 174 with value: 0.23469062114588263.
2026-06-01 02:16:17 | INFO | src.nested_cv_avggrm_weighted_unified | Trial 246 | outer=9 | alpha=1.419e+05 n_pcs=3000 (pc_topk) weight_search=on
2026-06-01 02:16:17 | INFO | src.nested_cv_avggrm_weighted_unified | Trial 246 | outer=9 | weight={'name': 'exponential', 'floor': 1e-06, 'clip_max': 3.0, 'beta': 8.360916789112634}
[I 2026-06-01 02:16:21,788] Trial 246 finished with value: 0.2344428539096927 and parameters: {'alpha': 141915.51510135597, 'n_pcs': 3000, 'weight_scheme': 'exponential', 'weight_clip_max': 3.0, 'weight_exponential_beta': 8.360916789112634}. Best is trial 174 with value: 0.23469062114588263.
2026-06-01 02:16:21 | INFO | src.nested_cv_avggrm_weighted_unified | Trial 247 | outer=9 | alpha=1.847e+05 n_pcs=3000 (pc_topk) weight_search=on
2026-06-01 02:16:21 | INFO | src.nested_cv_avggrm_weighted_unified | Trial 247 | outer=9 | weight={'name': 'exponential', 'floor': 1e-06, 'clip_max': 3.0, 'beta': 8.39198226799554}
[I 2026-06-01 02:16:25,574] Trial 247 finished with value: 0.23467683878188123 and parameters: {'alpha': 184734.71791046197, 'n_pcs': 3000, 'weight_scheme': 'exponential', 'weight_clip_max': 3.0, 'weight_exponential_beta': 8.39198226799554}. Best is trial 174 with value: 0.23469062114588263.
2026-06-01 02:16:25 | INFO | src.nested_cv_avggrm_weighted_unified | Trial 248 | outer=9 | alpha=1.869e+05 n_pcs=3000 (pc_topk) weight_search=on
2026-06-01 02:16:25 | INFO | src.nested_cv_avggrm_weighted_unified | Trial 248 | outer=9 | weight={'name': 'exponential', 'floor': 1e-06, 'clip_max': None, 'beta': 7.993014010773663}
2026-06-01 02:16:28 | INFO | src.nested_cv_avggrm_weighted_unified | Trial 248 | outer=9 | pruned after 8/10 inner folds (mean r=0.2442)
[I 2026-06-01 02:16:28,609] Trial 248 pruned. 
2026-06-01 02:16:28 | INFO | src.nested_cv_avggrm_weighted_unified | Trial 249 | outer=9 | alpha=1.301e+05 n_pcs=3000 (pc_topk) weight_search=on
2026-06-01 02:16:28 | INFO | src.nested_cv_avggrm_weighted_unified | Trial 249 | outer=9 | weight={'name': 'exponential', 'floor': 1e-06, 'clip_max': 3.0, 'beta': 8.33089021636864}
[I 2026-06-01 02:16:32,414] Trial 249 finished with value: 0.23425334163456046 and parameters: {'alpha': 130116.15168847091, 'n_pcs': 3000, 'weight_scheme': 'exponential', 'weight_clip_max': 3.0, 'weight_exponential_beta': 8.33089021636864}. Best is trial 174 with value: 0.23469062114588263.
2026-06-01 02:16:32 | INFO | src.nested_cv_avggrm_weighted_unified | Trial 250 | outer=9 | alpha=1.802e+05 n_pcs=3000 (pc_topk) weight_search=on
2026-06-01 02:16:32 | INFO | src.nested_cv_avggrm_weighted_unified | Trial 250 | outer=9 | weight={'name': 'exponential', 'floor': 1e-06, 'clip_max': 3.0, 'beta': 8.372767558075173}
[I 2026-06-01 02:16:36,931] Trial 250 finished with value: 0.23467688933667658 and parameters: {'alpha': 180170.30226534992, 'n_pcs': 3000, 'weight_scheme': 'exponential', 'weight_clip_max': 3.0, 'weight_exponential_beta': 8.372767558075173}. Best is trial 174 with value: 0.23469062114588263.
2026-06-01 02:16:36 | INFO | src.nested_cv_avggrm_weighted_unified | Trial 251 | outer=9 | alpha=1.733e+05 n_pcs=3000 (pc_topk) weight_search=on
2026-06-01 02:16:36 | INFO | src.nested_cv_avggrm_weighted_unified | Trial 251 | outer=9 | weight={'name': 'uniform', 'floor': 1e-06, 'clip_max': 3.0}
2026-06-01 02:16:39 | INFO | src.nested_cv_avggrm_weighted_unified | Trial 251 | outer=9 | pruned after 7/10 inner folds (mean r=0.2271)
[I 2026-06-01 02:16:39,329] Trial 251 pruned. 
2026-06-01 02:16:39 | INFO | src.nested_cv_avggrm_weighted_unified | Trial 252 | outer=9 | alpha=1.114e+05 n_pcs=2500 (pc_topk) weight_search=on
2026-06-01 02:16:39 | INFO | src.nested_cv_avggrm_weighted_unified | Trial 252 | outer=9 | weight={'name': 'exponential', 'floor': 1e-06, 'clip_max': 3.0, 'beta': 8.312822551707558}
2026-06-01 02:16:41 | INFO | src.nested_cv_avggrm_weighted_unified | Trial 252 | outer=9 | pruned after 8/10 inner folds (mean r=0.2601)
[I 2026-06-01 02:16:41,690] Trial 252 pruned. 
2026-06-01 02:16:41 | INFO | src.nested_cv_avggrm_weighted_unified | Trial 253 | outer=9 | alpha=1.525e+05 n_pcs=3000 (pc_topk) weight_search=on
2026-06-01 02:16:41 | INFO | src.nested_cv_avggrm_weighted_unified | Trial 253 | outer=9 | weight={'name': 'exponential', 'floor': 1e-06, 'clip_max': 3.0, 'beta': 8.08141805076915}
[I 2026-06-01 02:16:45,772] Trial 253 finished with value: 0.23455149183431048 and parameters: {'alpha': 152525.4173310933, 'n_pcs': 3000, 'weight_scheme': 'exponential', 'weight_clip_max': 3.0, 'weight_exponential_beta': 8.08141805076915}. Best is trial 174 with value: 0.23469062114588263.
2026-06-01 02:16:45 | INFO | src.nested_cv_avggrm_weighted_unified | Trial 254 | outer=9 | alpha=1.810e+05 n_pcs=3000 (pc_topk) weight_search=on
2026-06-01 02:16:45 | INFO | src.nested_cv_avggrm_weighted_unified | Trial 254 | outer=9 | weight={'name': 'exponential', 'floor': 1e-06, 'clip_max': 3.0, 'beta': 8.452296366864829}
[I 2026-06-01 02:16:49,631] Trial 254 finished with value: 0.2346796150936185 and parameters: {'alpha': 181014.29046025968, 'n_pcs': 3000, 'weight_scheme': 'exponential', 'weight_clip_max': 3.0, 'weight_exponential_beta': 8.452296366864829}. Best is trial 174 with value: 0.23469062114588263.
2026-06-01 02:16:49 | INFO | src.nested_cv_avggrm_weighted_unified | Trial 255 | outer=9 | alpha=2.614e+05 n_pcs=3500 (pc_topk) weight_search=on
2026-06-01 02:16:49 | INFO | src.nested_cv_avggrm_weighted_unified | Trial 255 | outer=9 | weight={'name': 'exponential', 'floor': 1e-06, 'clip_max': 10.0, 'beta': 8.454772612432004}
2026-06-01 02:16:53 | INFO | src.nested_cv_avggrm_weighted_unified | Trial 255 | outer=9 | pruned after 8/10 inner folds (mean r=0.2603)
[I 2026-06-01 02:16:53,665] Trial 255 pruned. 
2026-06-01 02:16:53 | INFO | src.nested_cv_avggrm_weighted_unified | Trial 256 | outer=9 | alpha=1.726e+05 n_pcs=3000 (pc_topk) weight_search=on
2026-06-01 02:16:53 | INFO | src.nested_cv_avggrm_weighted_unified | Trial 256 | outer=9 | weight={'name': 'exponential', 'floor': 1e-06, 'clip_max': 3.0, 'beta': 7.856017748131191}
[I 2026-06-01 02:16:57,714] Trial 256 finished with value: 0.23448647340158835 and parameters: {'alpha': 172630.53596243245, 'n_pcs': 3000, 'weight_scheme': 'exponential', 'weight_clip_max': 3.0, 'weight_exponential_beta': 7.856017748131191}. Best is trial 174 with value: 0.23469062114588263.
2026-06-01 02:16:57 | INFO | src.nested_cv_avggrm_weighted_unified | Trial 257 | outer=9 | alpha=1.324e+05 n_pcs=3000 (pc_topk) weight_search=on
2026-06-01 02:16:57 | INFO | src.nested_cv_avggrm_weighted_unified | Trial 257 | outer=9 | weight={'name': 'exponential', 'floor': 1e-06, 'clip_max': 3.0, 'beta': 8.512468038429901}
[I 2026-06-01 02:17:01,556] Trial 257 finished with value: 0.2341944866884579 and parameters: {'alpha': 132389.7159561598, 'n_pcs': 3000, 'weight_scheme': 'exponential', 'weight_clip_max': 3.0, 'weight_exponential_beta': 8.512468038429901}. Best is trial 174 with value: 0.23469062114588263.
2026-06-01 02:17:01 | INFO | src.nested_cv_avggrm_weighted_unified | Trial 258 | outer=9 | alpha=2.480e+05 n_pcs=3000 (pc_topk) weight_search=on
2026-06-01 02:17:01 | INFO | src.nested_cv_avggrm_weighted_unified | Trial 258 | outer=9 | weight={'name': 'exponential', 'floor': 1e-06, 'clip_max': 3.0, 'beta': 8.244038424110322}
[I 2026-06-01 02:17:05,394] Trial 258 finished with value: 0.23420855836925064 and parameters: {'alpha': 247962.11264222913, 'n_pcs': 3000, 'weight_scheme': 'exponential', 'weight_clip_max': 3.0, 'weight_exponential_beta': 8.244038424110322}. Best is trial 174 with value: 0.23469062114588263.
2026-06-01 02:17:05 | INFO | src.nested_cv_avggrm_weighted_unified | Trial 259 | outer=9 | alpha=1.638e+05 n_pcs=3000 (pc_topk) weight_search=on
2026-06-01 02:17:05 | INFO | src.nested_cv_avggrm_weighted_unified | Trial 259 | outer=9 | weight={'name': 'exponential', 'floor': 1e-06, 'clip_max': 3.0, 'beta': 8.612829726355935}
