[I 2026-06-01 13:50:35,997] Trial 174 finished with value: 0.2539346765058714 and parameters: {'alpha': 95082.06970460259, 'n_pcs': 5000, 'iw_method': 'pc_logistic', 'iw_clip_max': 4.0, 'iw_prob_clip': 0.01367725674874494, 'iw_n_components': 100, 'iw_logistic_c': 2.5325451949281008e-05, 'iw_pca_fit': 'combined', 'iw_solver': 'lbfgs', 'iw_rho': 0.85}. Best is trial 160 with value: 0.2552976728977937.
2026-06-01 13:50:36 | INFO | Trial 175 | outer=1 | alpha=9.010e+04 n_pcs=5000 (pc_topk) weight={'name': 'pc_logistic', 'floor': 1e-06, 'clip_max': 4.0, 'prob_clip': 0.016240225595897214, 'n_components': 100, 'logistic_c': 1.302532814184821e-05, 'pca_fit': 'combined', 'solver': 'lbfgs', 'max_iter': 2000, 'fit_intercept': True, 'standardize_with_source': True, 'rho': 0.85}
[I 2026-06-01 13:50:53,441] Trial 175 finished with value: 0.2521112059668077 and parameters: {'alpha': 90099.93680980391, 'n_pcs': 5000, 'iw_method': 'pc_logistic', 'iw_clip_max': 4.0, 'iw_prob_clip': 0.016240225595897214, 'iw_n_components': 100, 'iw_logistic_c': 1.302532814184821e-05, 'iw_pca_fit': 'combined', 'iw_solver': 'lbfgs', 'iw_rho': 0.85}. Best is trial 160 with value: 0.2552976728977937.
2026-06-01 13:50:53 | INFO | Trial 176 | outer=1 | alpha=1.128e+05 n_pcs=5000 (pc_topk) weight={'name': 'pc_logistic', 'floor': 1e-06, 'clip_max': 4.0, 'prob_clip': 0.01436778718413039, 'n_components': 100, 'logistic_c': 2.4939323513117123e-05, 'pca_fit': 'combined', 'solver': 'lbfgs', 'max_iter': 2000, 'fit_intercept': True, 'standardize_with_source': True, 'rho': 0.85}
[I 2026-06-01 13:51:10,951] Trial 176 finished with value: 0.25328856290096907 and parameters: {'alpha': 112760.689826936, 'n_pcs': 5000, 'iw_method': 'pc_logistic', 'iw_clip_max': 4.0, 'iw_prob_clip': 0.01436778718413039, 'iw_n_components': 100, 'iw_logistic_c': 2.4939323513117123e-05, 'iw_pca_fit': 'combined', 'iw_solver': 'lbfgs', 'iw_rho': 0.85}. Best is trial 160 with value: 0.2552976728977937.
2026-06-01 13:51:10 | INFO | Trial 177 | outer=1 | alpha=8.947e+04 n_pcs=5000 (pc_topk) weight={'name': 'pc_logistic', 'floor': 1e-06, 'clip_max': 4.0, 'prob_clip': 0.01764176461927424, 'n_components': 100, 'logistic_c': 2.531277626264874e-05, 'pca_fit': 'combined', 'solver': 'lbfgs', 'max_iter': 2000, 'fit_intercept': True, 'standardize_with_source': True, 'rho': 0.85}
[I 2026-06-01 13:51:28,540] Trial 177 finished with value: 0.25381110287094133 and parameters: {'alpha': 89474.16943193715, 'n_pcs': 5000, 'iw_method': 'pc_logistic', 'iw_clip_max': 4.0, 'iw_prob_clip': 0.01764176461927424, 'iw_n_components': 100, 'iw_logistic_c': 2.531277626264874e-05, 'iw_pca_fit': 'combined', 'iw_solver': 'lbfgs', 'iw_rho': 0.85}. Best is trial 160 with value: 0.2552976728977937.
2026-06-01 13:51:28 | INFO | Trial 178 | outer=1 | alpha=7.968e+04 n_pcs=5000 (pc_topk) weight={'name': 'pc_logistic', 'floor': 1e-06, 'clip_max': 4.0, 'prob_clip': 0.013207442981348294, 'n_components': 100, 'logistic_c': 7.445255502842417e-06, 'pca_fit': 'combined', 'solver': 'lbfgs', 'max_iter': 2000, 'fit_intercept': True, 'standardize_with_source': True, 'rho': 0.85}
[I 2026-06-01 13:51:45,597] Trial 178 finished with value: 0.24979453770601992 and parameters: {'alpha': 79682.35053779646, 'n_pcs': 5000, 'iw_method': 'pc_logistic', 'iw_clip_max': 4.0, 'iw_prob_clip': 0.013207442981348294, 'iw_n_components': 100, 'iw_logistic_c': 7.445255502842417e-06, 'iw_pca_fit': 'combined', 'iw_solver': 'lbfgs', 'iw_rho': 0.85}. Best is trial 160 with value: 0.2552976728977937.
2026-06-01 13:51:45 | INFO | Trial 179 | outer=1 | alpha=1.920e+05 n_pcs=5000 (pc_topk) weight={'name': 'pc_logistic', 'floor': 1e-06, 'clip_max': 4.0, 'prob_clip': 0.009747758470169458, 'n_components': 100, 'logistic_c': 0.00010309535369646829, 'pca_fit': 'combined', 'solver': 'lbfgs', 'max_iter': 2000, 'fit_intercept': True, 'standardize_with_source': True, 'rho': 0.85}
[I 2026-06-01 13:52:03,337] Trial 179 finished with value: 0.2525979373617755 and parameters: {'alpha': 191985.56734890808, 'n_pcs': 5000, 'iw_method': 'pc_logistic', 'iw_clip_max': 4.0, 'iw_prob_clip': 0.009747758470169458, 'iw_n_components': 100, 'iw_logistic_c': 0.00010309535369646829, 'iw_pca_fit': 'combined', 'iw_solver': 'lbfgs', 'iw_rho': 0.85}. Best is trial 160 with value: 0.2552976728977937.
2026-06-01 13:52:03 | INFO | Trial 180 | outer=1 | alpha=1.083e+05 n_pcs=5000 (pc_topk) weight={'name': 'pc_logistic', 'floor': 1e-06, 'clip_max': 4.0, 'prob_clip': 0.012133088207827452, 'n_components': 100, 'logistic_c': 1.9699430497867073e-05, 'pca_fit': 'combined', 'solver': 'lbfgs', 'max_iter': 2000, 'fit_intercept': True, 'standardize_with_source': True, 'rho': 0.85}
[I 2026-06-01 13:52:20,635] Trial 180 finished with value: 0.25281323176929094 and parameters: {'alpha': 108307.02520785181, 'n_pcs': 5000, 'iw_method': 'pc_logistic', 'iw_clip_max': 4.0, 'iw_prob_clip': 0.012133088207827452, 'iw_n_components': 100, 'iw_logistic_c': 1.9699430497867073e-05, 'iw_pca_fit': 'combined', 'iw_solver': 'lbfgs', 'iw_rho': 0.85}. Best is trial 160 with value: 0.2552976728977937.
2026-06-01 13:52:20 | INFO | Trial 181 | outer=1 | alpha=8.754e+04 n_pcs=5000 (pc_topk) weight={'name': 'pc_logistic', 'floor': 1e-06, 'clip_max': 4.0, 'prob_clip': 0.017473250844093586, 'n_components': 100, 'logistic_c': 2.632902934841016e-05, 'pca_fit': 'combined', 'solver': 'lbfgs', 'max_iter': 2000, 'fit_intercept': True, 'standardize_with_source': True, 'rho': 0.85}
[I 2026-06-01 13:52:38,386] Trial 181 finished with value: 0.2539506827060826 and parameters: {'alpha': 87537.00599605702, 'n_pcs': 5000, 'iw_method': 'pc_logistic', 'iw_clip_max': 4.0, 'iw_prob_clip': 0.017473250844093586, 'iw_n_components': 100, 'iw_logistic_c': 2.632902934841016e-05, 'iw_pca_fit': 'combined', 'iw_solver': 'lbfgs', 'iw_rho': 0.85}. Best is trial 160 with value: 0.2552976728977937.
2026-06-01 13:52:38 | INFO | Trial 182 | outer=1 | alpha=9.097e+04 n_pcs=5000 (pc_topk) weight={'name': 'pc_logistic', 'floor': 1e-06, 'clip_max': 4.0, 'prob_clip': 0.011114188421326252, 'n_components': 100, 'logistic_c': 3.2822666774095245e-05, 'pca_fit': 'combined', 'solver': 'lbfgs', 'max_iter': 2000, 'fit_intercept': True, 'standardize_with_source': True, 'rho': 0.85}
[I 2026-06-01 13:52:55,996] Trial 182 finished with value: 0.2542699551320712 and parameters: {'alpha': 90965.4563065039, 'n_pcs': 5000, 'iw_method': 'pc_logistic', 'iw_clip_max': 4.0, 'iw_prob_clip': 0.011114188421326252, 'iw_n_components': 100, 'iw_logistic_c': 3.2822666774095245e-05, 'iw_pca_fit': 'combined', 'iw_solver': 'lbfgs', 'iw_rho': 0.85}. Best is trial 160 with value: 0.2552976728977937.
2026-06-01 13:52:56 | INFO | Trial 183 | outer=1 | alpha=7.282e+04 n_pcs=5000 (pc_topk) weight={'name': 'pc_logistic', 'floor': 1e-06, 'clip_max': 4.0, 'prob_clip': 0.0110581526519955, 'n_components': 100, 'logistic_c': 3.838146184285364e-05, 'pca_fit': 'combined', 'solver': 'lbfgs', 'max_iter': 2000, 'fit_intercept': True, 'standardize_with_source': True, 'rho': 0.85}
[I 2026-06-01 13:53:13,879] Trial 183 finished with value: 0.25483330903845663 and parameters: {'alpha': 72818.78526697955, 'n_pcs': 5000, 'iw_method': 'pc_logistic', 'iw_clip_max': 4.0, 'iw_prob_clip': 0.0110581526519955, 'iw_n_components': 100, 'iw_logistic_c': 3.838146184285364e-05, 'iw_pca_fit': 'combined', 'iw_solver': 'lbfgs', 'iw_rho': 0.85}. Best is trial 160 with value: 0.2552976728977937.
2026-06-01 13:53:13 | INFO | Trial 184 | outer=1 | alpha=7.260e+04 n_pcs=5000 (pc_topk) weight={'name': 'pc_logistic', 'floor': 1e-06, 'clip_max': 4.0, 'prob_clip': 0.01107110728391688, 'n_components': 100, 'logistic_c': 4.199299794602368e-05, 'pca_fit': 'combined', 'solver': 'lbfgs', 'max_iter': 2000, 'fit_intercept': True, 'standardize_with_source': True, 'rho': 0.85}
[I 2026-06-01 13:53:31,823] Trial 184 finished with value: 0.25505770788852133 and parameters: {'alpha': 72604.9755682276, 'n_pcs': 5000, 'iw_method': 'pc_logistic', 'iw_clip_max': 4.0, 'iw_prob_clip': 0.01107110728391688, 'iw_n_components': 100, 'iw_logistic_c': 4.199299794602368e-05, 'iw_pca_fit': 'combined', 'iw_solver': 'lbfgs', 'iw_rho': 0.85}. Best is trial 160 with value: 0.2552976728977937.
2026-06-01 13:53:31 | INFO | Trial 185 | outer=1 | alpha=7.530e+04 n_pcs=5000 (pc_topk) weight={'name': 'pc_logistic', 'floor': 1e-06, 'clip_max': 4.0, 'prob_clip': 0.011385905959768516, 'n_components': 100, 'logistic_c': 4.014153371135659e-05, 'pca_fit': 'combined', 'solver': 'lbfgs', 'max_iter': 2000, 'fit_intercept': True, 'standardize_with_source': True, 'rho': 0.85}
[I 2026-06-01 13:53:49,394] Trial 185 finished with value: 0.25499077824098393 and parameters: {'alpha': 75297.49003467831, 'n_pcs': 5000, 'iw_method': 'pc_logistic', 'iw_clip_max': 4.0, 'iw_prob_clip': 0.011385905959768516, 'iw_n_components': 100, 'iw_logistic_c': 4.014153371135659e-05, 'iw_pca_fit': 'combined', 'iw_solver': 'lbfgs', 'iw_rho': 0.85}. Best is trial 160 with value: 0.2552976728977937.
2026-06-01 13:53:49 | INFO | Trial 186 | outer=1 | alpha=7.132e+04 n_pcs=5000 (pc_topk) weight={'name': 'pc_logistic', 'floor': 1e-06, 'clip_max': 4.0, 'prob_clip': 0.011258534485025362, 'n_components': 100, 'logistic_c': 4.706117573961764e-05, 'pca_fit': 'combined', 'solver': 'lbfgs', 'max_iter': 2000, 'fit_intercept': True, 'standardize_with_source': True, 'rho': 0.85}
[I 2026-06-01 13:54:07,610] Trial 186 finished with value: 0.2551593610978481 and parameters: {'alpha': 71324.57232432273, 'n_pcs': 5000, 'iw_method': 'pc_logistic', 'iw_clip_max': 4.0, 'iw_prob_clip': 0.011258534485025362, 'iw_n_components': 100, 'iw_logistic_c': 4.706117573961764e-05, 'iw_pca_fit': 'combined', 'iw_solver': 'lbfgs', 'iw_rho': 0.85}. Best is trial 160 with value: 0.2552976728977937.
2026-06-01 13:54:07 | INFO | Trial 187 | outer=1 | alpha=7.227e+04 n_pcs=5000 (pc_topk) weight={'name': 'pc_logistic', 'floor': 1e-06, 'clip_max': 7.0, 'prob_clip': 0.008462677074738181, 'n_components': 100, 'logistic_c': 3.679401436093027e-05, 'pca_fit': 'combined', 'solver': 'lbfgs', 'max_iter': 2000, 'fit_intercept': True, 'standardize_with_source': True, 'rho': 1.0}
[I 2026-06-01 13:54:25,547] Trial 187 finished with value: 0.252248229705161 and parameters: {'alpha': 72267.45870585229, 'n_pcs': 5000, 'iw_method': 'pc_logistic', 'iw_clip_max': 7.0, 'iw_prob_clip': 0.008462677074738181, 'iw_n_components': 100, 'iw_logistic_c': 3.679401436093027e-05, 'iw_pca_fit': 'combined', 'iw_solver': 'lbfgs', 'iw_rho': 1.0}. Best is trial 160 with value: 0.2552976728977937.
2026-06-01 13:54:25 | INFO | Trial 188 | outer=1 | alpha=6.656e+04 n_pcs=5000 (pc_topk) weight={'name': 'pc_logistic', 'floor': 1e-06, 'clip_max': 4.0, 'prob_clip': 0.009728981308252687, 'n_components': 100, 'logistic_c': 0.00015382776975888547, 'pca_fit': 'combined', 'solver': 'lbfgs', 'max_iter': 2000, 'fit_intercept': True, 'standardize_with_source': True, 'rho': 0.85}
[I 2026-06-01 13:54:44,653] Trial 188 finished with value: 0.2547263055311226 and parameters: {'alpha': 66556.10696744043, 'n_pcs': 5000, 'iw_method': 'pc_logistic', 'iw_clip_max': 4.0, 'iw_prob_clip': 0.009728981308252687, 'iw_n_components': 100, 'iw_logistic_c': 0.00015382776975888547, 'iw_pca_fit': 'combined', 'iw_solver': 'lbfgs', 'iw_rho': 0.85}. Best is trial 160 with value: 0.2552976728977937.
2026-06-01 13:54:44 | INFO | Trial 189 | outer=1 | alpha=6.790e+04 n_pcs=5000 (pc_topk) weight={'name': 'uniform'}
[I 2026-06-01 13:54:54,966] Trial 189 finished with value: 0.2417223426906276 and parameters: {'alpha': 67901.91753120565, 'n_pcs': 5000, 'iw_method': 'uniform'}. Best is trial 160 with value: 0.2552976728977937.
2026-06-01 13:54:54 | INFO | Trial 190 | outer=1 | alpha=7.156e+04 n_pcs=5000 (pc_topk) weight={'name': 'pc_logistic', 'floor': 1e-06, 'clip_max': 4.0, 'prob_clip': 0.009667332814186348, 'n_components': 20, 'logistic_c': 0.0001587160062879992, 'pca_fit': 'combined', 'solver': 'lbfgs', 'max_iter': 2000, 'fit_intercept': True, 'standardize_with_source': True, 'rho': 0.85}
[I 2026-06-01 13:55:12,711] Trial 190 finished with value: 0.2528577294815173 and parameters: {'alpha': 71562.89504657002, 'n_pcs': 5000, 'iw_method': 'pc_logistic', 'iw_clip_max': 4.0, 'iw_prob_clip': 0.009667332814186348, 'iw_n_components': 20, 'iw_logistic_c': 0.0001587160062879992, 'iw_pca_fit': 'combined', 'iw_solver': 'lbfgs', 'iw_rho': 0.85}. Best is trial 160 with value: 0.2552976728977937.
2026-06-01 13:55:12 | INFO | Trial 191 | outer=1 | alpha=7.066e+04 n_pcs=5000 (pc_topk) weight={'name': 'pc_logistic', 'floor': 1e-06, 'clip_max': 4.0, 'prob_clip': 0.010227903299867315, 'n_components': 100, 'logistic_c': 7.03032492111168e-05, 'pca_fit': 'combined', 'solver': 'lbfgs', 'max_iter': 2000, 'fit_intercept': True, 'standardize_with_source': True, 'rho': 0.85}
[I 2026-06-01 13:55:29,768] Trial 191 finished with value: 0.2551326839994964 and parameters: {'alpha': 70664.11929457681, 'n_pcs': 5000, 'iw_method': 'pc_logistic', 'iw_clip_max': 4.0, 'iw_prob_clip': 0.010227903299867315, 'iw_n_components': 100, 'iw_logistic_c': 7.03032492111168e-05, 'iw_pca_fit': 'combined', 'iw_solver': 'lbfgs', 'iw_rho': 0.85}. Best is trial 160 with value: 0.2552976728977937.
2026-06-01 13:55:29 | INFO | Trial 192 | outer=1 | alpha=7.109e+04 n_pcs=5000 (pc_topk) weight={'name': 'pc_logistic', 'floor': 1e-06, 'clip_max': 4.0, 'prob_clip': 0.010212616339857199, 'n_components': 100, 'logistic_c': 0.00010339210101324652, 'pca_fit': 'combined', 'solver': 'lbfgs', 'max_iter': 2000, 'fit_intercept': True, 'standardize_with_source': True, 'rho': 0.85}
[I 2026-06-01 13:55:47,721] Trial 192 finished with value: 0.25496352835931546 and parameters: {'alpha': 71085.4795954761, 'n_pcs': 5000, 'iw_method': 'pc_logistic', 'iw_clip_max': 4.0, 'iw_prob_clip': 0.010212616339857199, 'iw_n_components': 100, 'iw_logistic_c': 0.00010339210101324652, 'iw_pca_fit': 'combined', 'iw_solver': 'lbfgs', 'iw_rho': 0.85}. Best is trial 160 with value: 0.2552976728977937.
2026-06-01 13:55:47 | INFO | Trial 193 | outer=1 | alpha=7.181e+04 n_pcs=5000 (pc_topk) weight={'name': 'pc_logistic', 'floor': 1e-06, 'clip_max': 4.0, 'prob_clip': 0.0100550835898509, 'n_components': 100, 'logistic_c': 0.00012045917212725397, 'pca_fit': 'combined', 'solver': 'lbfgs', 'max_iter': 2000, 'fit_intercept': True, 'standardize_with_source': True, 'rho': 0.85}
[I 2026-06-01 13:56:06,868] Trial 193 finished with value: 0.2548915303587584 and parameters: {'alpha': 71809.64685988572, 'n_pcs': 5000, 'iw_method': 'pc_logistic', 'iw_clip_max': 4.0, 'iw_prob_clip': 0.0100550835898509, 'iw_n_components': 100, 'iw_logistic_c': 0.00012045917212725397, 'iw_pca_fit': 'combined', 'iw_solver': 'lbfgs', 'iw_rho': 0.85}. Best is trial 160 with value: 0.2552976728977937.
2026-06-01 13:56:06 | INFO | Trial 194 | outer=1 | alpha=6.927e+04 n_pcs=5000 (pc_topk) weight={'name': 'pc_logistic', 'floor': 1e-06, 'clip_max': 4.0, 'prob_clip': 0.009853930623009894, 'n_components': 100, 'logistic_c': 9.590215014547967e-05, 'pca_fit': 'combined', 'solver': 'lbfgs', 'max_iter': 2000, 'fit_intercept': True, 'standardize_with_source': True, 'rho': 0.85}
[I 2026-06-01 13:56:25,246] Trial 194 finished with value: 0.2549508567190884 and parameters: {'alpha': 69267.56147260817, 'n_pcs': 5000, 'iw_method': 'pc_logistic', 'iw_clip_max': 4.0, 'iw_prob_clip': 0.009853930623009894, 'iw_n_components': 100, 'iw_logistic_c': 9.590215014547967e-05, 'iw_pca_fit': 'combined', 'iw_solver': 'lbfgs', 'iw_rho': 0.85}. Best is trial 160 with value: 0.2552976728977937.
2026-06-01 13:56:25 | INFO | Trial 195 | outer=1 | alpha=4.893e+04 n_pcs=5000 (pc_topk) weight={'name': 'pc_logistic', 'floor': 1e-06, 'clip_max': 4.0, 'prob_clip': 0.009676642946642779, 'n_components': 100, 'logistic_c': 0.00013218651188395367, 'pca_fit': 'combined', 'solver': 'lbfgs', 'max_iter': 2000, 'fit_intercept': True, 'standardize_with_source': True, 'rho': 0.85}
[I 2026-06-01 13:56:44,277] Trial 195 finished with value: 0.25383460158354 and parameters: {'alpha': 48925.329096727, 'n_pcs': 5000, 'iw_method': 'pc_logistic', 'iw_clip_max': 4.0, 'iw_prob_clip': 0.009676642946642779, 'iw_n_components': 100, 'iw_logistic_c': 0.00013218651188395367, 'iw_pca_fit': 'combined', 'iw_solver': 'lbfgs', 'iw_rho': 0.85}. Best is trial 160 with value: 0.2552976728977937.
2026-06-01 13:56:44 | INFO | Trial 196 | outer=1 | alpha=6.733e+04 n_pcs=5000 (pc_topk) weight={'name': 'pc_logistic', 'floor': 1e-06, 'clip_max': 1.5, 'prob_clip': 0.010265059571884793, 'n_components': 100, 'logistic_c': 8.419613389894004e-05, 'pca_fit': 'combined', 'solver': 'lbfgs', 'max_iter': 2000, 'fit_intercept': True, 'standardize_with_source': True, 'rho': 0.85}
[I 2026-06-01 13:57:02,751] Trial 196 finished with value: 0.2491888469003542 and parameters: {'alpha': 67333.1206405851, 'n_pcs': 5000, 'iw_method': 'pc_logistic', 'iw_clip_max': 1.5, 'iw_prob_clip': 0.010265059571884793, 'iw_n_components': 100, 'iw_logistic_c': 8.419613389894004e-05, 'iw_pca_fit': 'combined', 'iw_solver': 'lbfgs', 'iw_rho': 0.85}. Best is trial 160 with value: 0.2552976728977937.
2026-06-01 13:57:02 | INFO | Trial 197 | outer=1 | alpha=3.315e+03 n_pcs=5000 (pc_topk) weight={'name': 'pc_logistic', 'floor': 1e-06, 'clip_max': 4.0, 'prob_clip': 0.008989634063330377, 'n_components': 100, 'logistic_c': 4.5865690327149294e-05, 'pca_fit': 'combined', 'solver': 'lbfgs', 'max_iter': 2000, 'fit_intercept': True, 'standardize_with_source': True, 'rho': 0.85}
[I 2026-06-01 13:57:20,853] Trial 197 finished with value: 0.1984453708998718 and parameters: {'alpha': 3314.522817235901, 'n_pcs': 5000, 'iw_method': 'pc_logistic', 'iw_clip_max': 4.0, 'iw_prob_clip': 0.008989634063330377, 'iw_n_components': 100, 'iw_logistic_c': 4.5865690327149294e-05, 'iw_pca_fit': 'combined', 'iw_solver': 'lbfgs', 'iw_rho': 0.85}. Best is trial 160 with value: 0.2552976728977937.
2026-06-01 13:57:20 | INFO | Trial 198 | outer=1 | alpha=6.729e+04 n_pcs=5000 (pc_topk) weight={'name': 'pc_logistic', 'floor': 1e-06, 'clip_max': 4.0, 'prob_clip': 0.012152410873953341, 'n_components': 100, 'logistic_c': 0.00010222719731175459, 'pca_fit': 'combined', 'solver': 'lbfgs', 'max_iter': 2000, 'fit_intercept': True, 'standardize_with_source': True, 'rho': 0.85}
[I 2026-06-01 13:57:39,510] Trial 198 finished with value: 0.2552561092496515 and parameters: {'alpha': 67291.21399782348, 'n_pcs': 5000, 'iw_method': 'pc_logistic', 'iw_clip_max': 4.0, 'iw_prob_clip': 0.012152410873953341, 'iw_n_components': 100, 'iw_logistic_c': 0.00010222719731175459, 'iw_pca_fit': 'combined', 'iw_solver': 'lbfgs', 'iw_rho': 0.85}. Best is trial 160 with value: 0.2552976728977937.
2026-06-01 13:57:39 | INFO | Trial 199 | outer=1 | alpha=4.868e+04 n_pcs=5000 (pc_topk) weight={'name': 'pc_logistic', 'floor': 1e-06, 'clip_max': 4.0, 'prob_clip': 0.012044461950516488, 'n_components': 40, 'logistic_c': 5.6046073936549515e-05, 'pca_fit': 'combined', 'solver': 'lbfgs', 'max_iter': 2000, 'fit_intercept': True, 'standardize_with_source': True, 'rho': 0.85}
[I 2026-06-01 13:57:57,179] Trial 199 finished with value: 0.2529036658738669 and parameters: {'alpha': 48676.54194793703, 'n_pcs': 5000, 'iw_method': 'pc_logistic', 'iw_clip_max': 4.0, 'iw_prob_clip': 0.012044461950516488, 'iw_n_components': 40, 'iw_logistic_c': 5.6046073936549515e-05, 'iw_pca_fit': 'combined', 'iw_solver': 'lbfgs', 'iw_rho': 0.85}. Best is trial 160 with value: 0.2552976728977937.
2026-06-01 13:57:57 | INFO | Trial 200 | outer=1 | alpha=6.431e+04 n_pcs=5000 (pc_topk) weight={'name': 'pc_logistic', 'floor': 1e-06, 'clip_max': 4.0, 'prob_clip': 0.010178074134699762, 'n_components': 100, 'logistic_c': 0.00010235601976522095, 'pca_fit': 'combined', 'solver': 'lbfgs', 'max_iter': 2000, 'fit_intercept': True, 'standardize_with_source': True, 'rho': 0.85}
[I 2026-06-01 13:58:15,742] Trial 200 finished with value: 0.2548202128042074 and parameters: {'alpha': 64309.95561022579, 'n_pcs': 5000, 'iw_method': 'pc_logistic', 'iw_clip_max': 4.0, 'iw_prob_clip': 0.010178074134699762, 'iw_n_components': 100, 'iw_logistic_c': 0.00010235601976522095, 'iw_pca_fit': 'combined', 'iw_solver': 'lbfgs', 'iw_rho': 0.85}. Best is trial 160 with value: 0.2552976728977937.
2026-06-01 13:58:15 | INFO | Trial 201 | outer=1 | alpha=6.454e+04 n_pcs=5000 (pc_topk) weight={'name': 'pc_logistic', 'floor': 1e-06, 'clip_max': 4.0, 'prob_clip': 0.010503825323581104, 'n_components': 100, 'logistic_c': 0.00010485331321462295, 'pca_fit': 'combined', 'solver': 'lbfgs', 'max_iter': 2000, 'fit_intercept': True, 'standardize_with_source': True, 'rho': 0.85}
[I 2026-06-01 13:58:34,429] Trial 201 finished with value: 0.2548363802532888 and parameters: {'alpha': 64536.60175739253, 'n_pcs': 5000, 'iw_method': 'pc_logistic', 'iw_clip_max': 4.0, 'iw_prob_clip': 0.010503825323581104, 'iw_n_components': 100, 'iw_logistic_c': 0.00010485331321462295, 'iw_pca_fit': 'combined', 'iw_solver': 'lbfgs', 'iw_rho': 0.85}. Best is trial 160 with value: 0.2552976728977937.
2026-06-01 13:58:34 | INFO | Trial 202 | outer=1 | alpha=6.817e+04 n_pcs=5000 (pc_topk) weight={'name': 'pc_logistic', 'floor': 1e-06, 'clip_max': 4.0, 'prob_clip': 0.010202966337178885, 'n_components': 100, 'logistic_c': 0.00010216949562496295, 'pca_fit': 'combined', 'solver': 'lbfgs', 'max_iter': 2000, 'fit_intercept': True, 'standardize_with_source': True, 'rho': 0.85}
