[I 2026-06-01 00:16:36,263] Trial 299 pruned. 
2026-06-01 00:16:36 | INFO | src.nested_cv_avggrm_weighted_unified | OUTER 4 best (inner mean r=0.1981): {'model_type': 'pc_ridge', 'alpha': 72577.79002653851, 'n_pcs': 4500, 'use_snp_selection': True, 'num_snps': 4500, 'feature_mode': 'pc_topk', 'weighting': {'name': 'linear', 'floor': 1e-06, 'clip_max': None, 'min_weight': 0.4183155631713417, 'max_weight': 3.5222744063870994}}
2026-06-01 00:16:36 | INFO | src.nested_cv_avggrm_weighted_unified | OUTER 4 TEST r = 0.3952
2026-06-01 00:16:36 | INFO | src.nested_cv_avggrm_weighted_unified | OUTER 4 incremental summary saved to outputs/final_results/e6_pc_ridge_avggrm/thr_wing/e6_pc_ridge_avggrm_thr_wing_results.json
2026-06-01 00:16:36 | INFO | src.nested_cv_avggrm_weighted_unified | OUTER 5: test_size=553 island=4 (Gjerøy)
2026-06-01 00:16:36 | INFO | src.nested_cv_avggrm_weighted_unified | OUTER 5: inner LOIO validation islands: 0(Nesøy), 1(Myken), 2(Træna), 3(Selvær), 5(Hestmannøy), 6(Indre Kvarøy), 7(Onøy og Lurøy), 8(Lovund), 9(Sleneset), 10(Aldra), 11(Leka), 12(Vega), 13(Vikna), 14(Lauvøya)
2026-06-01 00:16:37 | INFO | src.nested_cv_avggrm_weighted_unified | OUTER 5: using top 10 related inner validation islands for tuning: 5(Hestmannøy, avgGRM=0.0047), 6(Indre Kvarøy, avgGRM=0.0043), 0(Nesøy, avgGRM=0.0039), 10(Aldra, avgGRM=0.0011), 7(Onøy og Lurøy, avgGRM=0.0002), 1(Myken, avgGRM=-0.0004), 3(Selvær, avgGRM=-0.0013), 2(Træna, avgGRM=-0.0020), 8(Lovund, avgGRM=-0.0020), 9(Sleneset, avgGRM=-0.0024)
[I 2026-06-01 00:16:37,035] A new study created in memory with name: ridge_inner_outer4
2026-06-01 00:16:37 | INFO | src.nested_cv_avggrm_weighted_unified | Trial 0 | outer=5 | alpha=1.137e+05 n_pcs=4000 (pc_topk) weight_search=on
2026-06-01 00:16:37 | INFO | src.nested_cv_avggrm_weighted_unified | Trial 0 | outer=5 | weight={'name': 'uniform', 'floor': 1e-06, 'clip_max': None}
[I 2026-06-01 00:16:42,225] Trial 0 finished with value: 0.2328243875385143 and parameters: {'alpha': 113703.38004442609, 'n_pcs': 4000, 'weight_scheme': 'uniform', 'weight_clip_max': None}. Best is trial 0 with value: 0.2328243875385143.
2026-06-01 00:16:42 | INFO | src.nested_cv_avggrm_weighted_unified | OUTER 5 | new best trial 0 (mean inner r=0.2328) saved to outputs/final_results/e6_pc_ridge_avggrm/thr_wing/e6_pc_ridge_avggrm_thr_wing_best_trials/split_05_best_trial.json
2026-06-01 00:16:42 | INFO | src.nested_cv_avggrm_weighted_unified | Trial 1 | outer=5 | alpha=1.682e+06 n_pcs=2000 (pc_topk) weight_search=on
2026-06-01 00:16:42 | INFO | src.nested_cv_avggrm_weighted_unified | Trial 1 | outer=5 | weight={'name': 'exponential', 'floor': 1e-06, 'clip_max': 3.0, 'beta': 8.711469579953913}
[I 2026-06-01 00:16:44,577] Trial 1 finished with value: 0.24318041804100013 and parameters: {'alpha': 1682385.170967095, 'n_pcs': 2000, 'weight_scheme': 'exponential', 'weight_clip_max': 3.0, 'weight_exponential_beta': 8.711469579953913}. Best is trial 1 with value: 0.24318041804100013.
2026-06-01 00:16:44 | INFO | src.nested_cv_avggrm_weighted_unified | OUTER 5 | new best trial 1 (mean inner r=0.2432) saved to outputs/final_results/e6_pc_ridge_avggrm/thr_wing/e6_pc_ridge_avggrm_thr_wing_best_trials/split_05_best_trial.json
2026-06-01 00:16:44 | INFO | src.nested_cv_avggrm_weighted_unified | Trial 2 | outer=5 | alpha=2.757e+03 n_pcs=2000 (pc_topk) weight_search=on
2026-06-01 00:16:44 | INFO | src.nested_cv_avggrm_weighted_unified | Trial 2 | outer=5 | weight={'name': 'linear', 'floor': 1e-06, 'clip_max': 20.0, 'min_weight': 0.12918170299726892, 'max_weight': 3.9862564805616327}
[I 2026-06-01 00:16:47,336] Trial 2 finished with value: 0.17168778031543586 and parameters: {'alpha': 2757.0504493185063, 'n_pcs': 2000, 'weight_scheme': 'linear', 'weight_clip_max': 20.0, 'weight_linear_min_weight': 0.12918170299726892, 'weight_linear_max_weight': 3.9862564805616327}. Best is trial 1 with value: 0.24318041804100013.
2026-06-01 00:16:47 | INFO | src.nested_cv_avggrm_weighted_unified | Trial 3 | outer=5 | alpha=1.776e+03 n_pcs=4000 (pc_topk) weight_search=on
2026-06-01 00:16:47 | INFO | src.nested_cv_avggrm_weighted_unified | Trial 3 | outer=5 | weight={'name': 'exponential', 'floor': 1e-06, 'clip_max': 10.0, 'beta': 0.563604612251006}
[I 2026-06-01 00:16:52,775] Trial 3 finished with value: 0.15978288566980386 and parameters: {'alpha': 1775.825123718637, 'n_pcs': 4000, 'weight_scheme': 'exponential', 'weight_clip_max': 10.0, 'weight_exponential_beta': 0.563604612251006}. Best is trial 1 with value: 0.24318041804100013.
2026-06-01 00:16:52 | INFO | src.nested_cv_avggrm_weighted_unified | Trial 4 | outer=5 | alpha=1.835e+04 n_pcs=5000 (pc_topk) weight_search=on
2026-06-01 00:16:52 | INFO | src.nested_cv_avggrm_weighted_unified | Trial 4 | outer=5 | weight={'name': 'exponential', 'floor': 1e-06, 'clip_max': None, 'beta': 9.957095048208117}
[I 2026-06-01 00:17:00,633] Trial 4 finished with value: 0.2509768916499643 and parameters: {'alpha': 18351.68801260339, 'n_pcs': 5000, 'weight_scheme': 'exponential', 'weight_clip_max': None, 'weight_exponential_beta': 9.957095048208117}. Best is trial 4 with value: 0.2509768916499643.
2026-06-01 00:17:00 | INFO | src.nested_cv_avggrm_weighted_unified | OUTER 5 | new best trial 4 (mean inner r=0.2510) saved to outputs/final_results/e6_pc_ridge_avggrm/thr_wing/e6_pc_ridge_avggrm_thr_wing_best_trials/split_05_best_trial.json
2026-06-01 00:17:00 | INFO | src.nested_cv_avggrm_weighted_unified | Trial 5 | outer=5 | alpha=9.696e+03 n_pcs=1000 (pc_topk) weight_search=on
2026-06-01 00:17:00 | INFO | src.nested_cv_avggrm_weighted_unified | Trial 5 | outer=5 | weight={'name': 'exponential', 'floor': 1e-06, 'clip_max': 3.0, 'beta': 1.5726039441128932}
2026-06-01 00:17:01 | INFO | src.nested_cv_avggrm_weighted_unified | Trial 5 | outer=5 | pruned after 7/10 inner folds (mean r=0.2491)
[I 2026-06-01 00:17:01,584] Trial 5 pruned. 
2026-06-01 00:17:01 | INFO | src.nested_cv_avggrm_weighted_unified | Trial 6 | outer=5 | alpha=6.320e+04 n_pcs=2500 (pc_topk) weight_search=on
2026-06-01 00:17:01 | INFO | src.nested_cv_avggrm_weighted_unified | Trial 6 | outer=5 | weight={'name': 'uniform', 'floor': 1e-06, 'clip_max': 10.0}
[I 2026-06-01 00:17:03,959] Trial 6 finished with value: 0.23582132214004004 and parameters: {'alpha': 63199.5851103866, 'n_pcs': 2500, 'weight_scheme': 'uniform', 'weight_clip_max': 10.0}. Best is trial 4 with value: 0.2509768916499643.
2026-06-01 00:17:03 | INFO | src.nested_cv_avggrm_weighted_unified | Trial 7 | outer=5 | alpha=4.681e+04 n_pcs=2500 (pc_topk) weight_search=on
2026-06-01 00:17:03 | INFO | src.nested_cv_avggrm_weighted_unified | Trial 7 | outer=5 | weight={'name': 'linear', 'floor': 1e-06, 'clip_max': 3.0, 'min_weight': 0.13798029304672477, 'max_weight': 3.0957974174373546}
[I 2026-06-01 00:17:06,712] Trial 7 finished with value: 0.24962435592543222 and parameters: {'alpha': 46806.97703257331, 'n_pcs': 2500, 'weight_scheme': 'linear', 'weight_clip_max': 3.0, 'weight_linear_min_weight': 0.13798029304672477, 'weight_linear_max_weight': 3.0957974174373546}. Best is trial 4 with value: 0.2509768916499643.
2026-06-01 00:17:06 | INFO | src.nested_cv_avggrm_weighted_unified | Trial 8 | outer=5 | alpha=5.456e+04 n_pcs=3000 (pc_topk) weight_search=on
2026-06-01 00:17:06 | INFO | src.nested_cv_avggrm_weighted_unified | Trial 8 | outer=5 | weight={'name': 'linear', 'floor': 1e-06, 'clip_max': 5.0, 'min_weight': 0.6690067570691431, 'max_weight': 4.8744640334054115}
[I 2026-06-01 00:17:10,257] Trial 8 finished with value: 0.2515805913028666 and parameters: {'alpha': 54559.68395210245, 'n_pcs': 3000, 'weight_scheme': 'linear', 'weight_clip_max': 5.0, 'weight_linear_min_weight': 0.6690067570691431, 'weight_linear_max_weight': 4.8744640334054115}. Best is trial 8 with value: 0.2515805913028666.
2026-06-01 00:17:10 | INFO | src.nested_cv_avggrm_weighted_unified | OUTER 5 | new best trial 8 (mean inner r=0.2516) saved to outputs/final_results/e6_pc_ridge_avggrm/thr_wing/e6_pc_ridge_avggrm_thr_wing_best_trials/split_05_best_trial.json
2026-06-01 00:17:10 | INFO | src.nested_cv_avggrm_weighted_unified | Trial 9 | outer=5 | alpha=8.868e+03 n_pcs=2000 (pc_topk) weight_search=on
2026-06-01 00:17:10 | INFO | src.nested_cv_avggrm_weighted_unified | Trial 9 | outer=5 | weight={'name': 'linear', 'floor': 1e-06, 'clip_max': 20.0, 'min_weight': 0.861124149305412, 'max_weight': 4.702809729786679}
2026-06-01 00:17:11 | INFO | src.nested_cv_avggrm_weighted_unified | Trial 9 | outer=5 | pruned after 5/10 inner folds (mean r=0.2088)
[I 2026-06-01 00:17:11,297] Trial 9 pruned. 
2026-06-01 00:17:11 | INFO | src.nested_cv_avggrm_weighted_unified | Trial 10 | outer=5 | alpha=5.986e+05 n_pcs=500 (pc_topk) weight_search=on
2026-06-01 00:17:11 | INFO | src.nested_cv_avggrm_weighted_unified | Trial 10 | outer=5 | weight={'name': 'linear', 'floor': 1e-06, 'clip_max': 5.0, 'min_weight': 0.6649918033453551, 'max_weight': 1.3005022441588598}
2026-06-01 00:17:11 | INFO | src.nested_cv_avggrm_weighted_unified | Trial 10 | outer=5 | pruned after 5/10 inner folds (mean r=0.1798)
[I 2026-06-01 00:17:11,767] Trial 10 pruned. 
2026-06-01 00:17:11 | INFO | src.nested_cv_avggrm_weighted_unified | Trial 11 | outer=5 | alpha=9.423e+06 n_pcs=5000 (pc_topk) weight_search=on
2026-06-01 00:17:11 | INFO | src.nested_cv_avggrm_weighted_unified | Trial 11 | outer=5 | weight={'name': 'exponential', 'floor': 1e-06, 'clip_max': None, 'beta': 9.422900556669042}
2026-06-01 00:17:15 | INFO | src.nested_cv_avggrm_weighted_unified | Trial 11 | outer=5 | pruned after 5/10 inner folds (mean r=0.1909)
[I 2026-06-01 00:17:15,653] Trial 11 pruned. 
2026-06-01 00:17:15 | INFO | src.nested_cv_avggrm_weighted_unified | Trial 12 | outer=5 | alpha=1.721e+04 n_pcs=5000 (pc_topk) weight_search=on
2026-06-01 00:17:15 | INFO | src.nested_cv_avggrm_weighted_unified | Trial 12 | outer=5 | weight={'name': 'exponential', 'floor': 1e-06, 'clip_max': 5.0, 'beta': 5.647108005526702}
[I 2026-06-01 00:17:23,555] Trial 12 finished with value: 0.24805462084939894 and parameters: {'alpha': 17214.20557627711, 'n_pcs': 5000, 'weight_scheme': 'exponential', 'weight_clip_max': 5.0, 'weight_exponential_beta': 5.647108005526702}. Best is trial 8 with value: 0.2515805913028666.
2026-06-01 00:17:23 | INFO | src.nested_cv_avggrm_weighted_unified | Trial 13 | outer=5 | alpha=2.090e+05 n_pcs=3500 (pc_topk) weight_search=on
2026-06-01 00:17:23 | INFO | src.nested_cv_avggrm_weighted_unified | Trial 13 | outer=5 | weight={'name': 'linear', 'floor': 1e-06, 'clip_max': 5.0, 'min_weight': 0.44725940969778444, 'max_weight': 1.689579879242048}
[I 2026-06-01 00:17:28,103] Trial 13 finished with value: 0.2400173144766149 and parameters: {'alpha': 209001.29593602012, 'n_pcs': 3500, 'weight_scheme': 'linear', 'weight_clip_max': 5.0, 'weight_linear_min_weight': 0.44725940969778444, 'weight_linear_max_weight': 1.689579879242048}. Best is trial 8 with value: 0.2515805913028666.
2026-06-01 00:17:28 | INFO | src.nested_cv_avggrm_weighted_unified | Trial 14 | outer=5 | alpha=2.772e+04 n_pcs=3500 (pc_topk) weight_search=on
2026-06-01 00:17:28 | INFO | src.nested_cv_avggrm_weighted_unified | Trial 14 | outer=5 | weight={'name': 'uniform', 'floor': 1e-06, 'clip_max': None}
2026-06-01 00:17:30 | INFO | src.nested_cv_avggrm_weighted_unified | Trial 14 | outer=5 | pruned after 7/10 inner folds (mean r=0.2640)
[I 2026-06-01 00:17:30,841] Trial 14 pruned. 
2026-06-01 00:17:30 | INFO | src.nested_cv_avggrm_weighted_unified | Trial 15 | outer=5 | alpha=2.761e+05 n_pcs=4500 (pc_topk) weight_search=on
2026-06-01 00:17:30 | INFO | src.nested_cv_avggrm_weighted_unified | Trial 15 | outer=5 | weight={'name': 'linear', 'floor': 1e-06, 'clip_max': 5.0, 'min_weight': 0.9689803782581343, 'max_weight': 4.9100809859168315}
[I 2026-06-01 00:17:37,336] Trial 15 finished with value: 0.23948148352264095 and parameters: {'alpha': 276109.39921497885, 'n_pcs': 4500, 'weight_scheme': 'linear', 'weight_clip_max': 5.0, 'weight_linear_min_weight': 0.9689803782581343, 'weight_linear_max_weight': 4.9100809859168315}. Best is trial 8 with value: 0.2515805913028666.
2026-06-01 00:17:37 | INFO | src.nested_cv_avggrm_weighted_unified | Trial 16 | outer=5 | alpha=5.226e+03 n_pcs=3000 (pc_topk) weight_search=on
2026-06-01 00:17:37 | INFO | src.nested_cv_avggrm_weighted_unified | Trial 16 | outer=5 | weight={'name': 'exponential', 'floor': 1e-06, 'clip_max': None, 'beta': 5.962752903888057}
2026-06-01 00:17:39 | INFO | src.nested_cv_avggrm_weighted_unified | Trial 16 | outer=5 | pruned after 7/10 inner folds (mean r=0.2167)
[I 2026-06-01 00:17:39,826] Trial 16 pruned. 
2026-06-01 00:17:39 | INFO | src.nested_cv_avggrm_weighted_unified | Trial 17 | outer=5 | alpha=8.859e+05 n_pcs=1000 (pc_topk) weight_search=on
2026-06-01 00:17:39 | INFO | src.nested_cv_avggrm_weighted_unified | Trial 17 | outer=5 | weight={'name': 'exponential', 'floor': 1e-06, 'clip_max': 5.0, 'beta': 7.492261875463922}
[I 2026-06-01 00:17:41,076] Trial 17 finished with value: 0.24445447977226684 and parameters: {'alpha': 885943.8516209496, 'n_pcs': 1000, 'weight_scheme': 'exponential', 'weight_clip_max': 5.0, 'weight_exponential_beta': 7.492261875463922}. Best is trial 8 with value: 0.2515805913028666.
2026-06-01 00:17:41 | INFO | src.nested_cv_avggrm_weighted_unified | Trial 18 | outer=5 | alpha=2.240e+04 n_pcs=4500 (pc_topk) weight_search=on
2026-06-01 00:17:41 | INFO | src.nested_cv_avggrm_weighted_unified | Trial 18 | outer=5 | weight={'name': 'linear', 'floor': 1e-06, 'clip_max': None, 'min_weight': 0.49175692108848046, 'max_weight': 3.017045951297736}
[I 2026-06-01 00:17:47,674] Trial 18 finished with value: 0.251735093255844 and parameters: {'alpha': 22403.457262214473, 'n_pcs': 4500, 'weight_scheme': 'linear', 'weight_clip_max': None, 'weight_linear_min_weight': 0.49175692108848046, 'weight_linear_max_weight': 3.017045951297736}. Best is trial 18 with value: 0.251735093255844.
2026-06-01 00:17:47 | INFO | src.nested_cv_avggrm_weighted_unified | OUTER 5 | new best trial 18 (mean inner r=0.2517) saved to outputs/final_results/e6_pc_ridge_avggrm/thr_wing/e6_pc_ridge_avggrm_thr_wing_best_trials/split_05_best_trial.json
2026-06-01 00:17:47 | INFO | src.nested_cv_avggrm_weighted_unified | Trial 19 | outer=5 | alpha=1.040e+05 n_pcs=4000 (pc_topk) weight_search=on
2026-06-01 00:17:47 | INFO | src.nested_cv_avggrm_weighted_unified | Trial 19 | outer=5 | weight={'name': 'linear', 'floor': 1e-06, 'clip_max': 10.0, 'min_weight': 0.5490255503378874, 'max_weight': 2.8208226819894096}
[I 2026-06-01 00:17:53,525] Trial 19 finished with value: 0.24947262624248526 and parameters: {'alpha': 103959.76380975673, 'n_pcs': 4000, 'weight_scheme': 'linear', 'weight_clip_max': 10.0, 'weight_linear_min_weight': 0.5490255503378874, 'weight_linear_max_weight': 2.8208226819894096}. Best is trial 18 with value: 0.251735093255844.
2026-06-01 00:17:53 | INFO | src.nested_cv_avggrm_weighted_unified | Trial 20 | outer=5 | alpha=1.064e+03 n_pcs=3000 (pc_topk) weight_search=on
2026-06-01 00:17:53 | INFO | src.nested_cv_avggrm_weighted_unified | Trial 20 | outer=5 | weight={'name': 'linear', 'floor': 1e-06, 'clip_max': 20.0, 'min_weight': 0.3901802144499684, 'max_weight': 3.2977565232142583}
2026-06-01 00:17:55 | INFO | src.nested_cv_avggrm_weighted_unified | Trial 20 | outer=5 | pruned after 5/10 inner folds (mean r=0.1875)
[I 2026-06-01 00:17:55,325] Trial 20 pruned. 
2026-06-01 00:17:55 | INFO | src.nested_cv_avggrm_weighted_unified | Trial 21 | outer=5 | alpha=2.420e+04 n_pcs=4500 (pc_topk) weight_search=on
2026-06-01 00:17:55 | INFO | src.nested_cv_avggrm_weighted_unified | Trial 21 | outer=5 | weight={'name': 'linear', 'floor': 1e-06, 'clip_max': None, 'min_weight': 0.7114078418333506, 'max_weight': 2.225510825066153}
[I 2026-06-01 00:18:01,859] Trial 21 finished with value: 0.2505025115209382 and parameters: {'alpha': 24201.07000108759, 'n_pcs': 4500, 'weight_scheme': 'linear', 'weight_clip_max': None, 'weight_linear_min_weight': 0.7114078418333506, 'weight_linear_max_weight': 2.225510825066153}. Best is trial 18 with value: 0.251735093255844.
2026-06-01 00:18:01 | INFO | src.nested_cv_avggrm_weighted_unified | Trial 22 | outer=5 | alpha=5.225e+03 n_pcs=5000 (pc_topk) weight_search=on
2026-06-01 00:18:01 | INFO | src.nested_cv_avggrm_weighted_unified | Trial 22 | outer=5 | weight={'name': 'linear', 'floor': 1e-06, 'clip_max': None, 'min_weight': 0.28930837771293655, 'max_weight': 4.259758047852707}
2026-06-01 00:18:07 | INFO | src.nested_cv_avggrm_weighted_unified | Trial 22 | outer=5 | pruned after 7/10 inner folds (mean r=0.2413)
[I 2026-06-01 00:18:07,282] Trial 22 pruned. 
2026-06-01 00:18:07 | INFO | src.nested_cv_avggrm_weighted_unified | Trial 23 | outer=5 | alpha=3.665e+04 n_pcs=3500 (pc_topk) weight_search=on
2026-06-01 00:18:07 | INFO | src.nested_cv_avggrm_weighted_unified | Trial 23 | outer=5 | weight={'name': 'uniform', 'floor': 1e-06, 'clip_max': None}
2026-06-01 00:18:10 | INFO | src.nested_cv_avggrm_weighted_unified | Trial 23 | outer=5 | pruned after 7/10 inner folds (mean r=0.2668)
[I 2026-06-01 00:18:10,003] Trial 23 pruned. 
2026-06-01 00:18:10 | INFO | src.nested_cv_avggrm_weighted_unified | Trial 24 | outer=5 | alpha=1.497e+04 n_pcs=4500 (pc_topk) weight_search=on
2026-06-01 00:18:10 | INFO | src.nested_cv_avggrm_weighted_unified | Trial 24 | outer=5 | weight={'name': 'linear', 'floor': 1e-06, 'clip_max': None, 'min_weight': 0.6526986044669096, 'max_weight': 3.7629333799945806}
[I 2026-06-01 00:18:16,520] Trial 24 finished with value: 0.24718047199468604 and parameters: {'alpha': 14965.707284952221, 'n_pcs': 4500, 'weight_scheme': 'linear', 'weight_clip_max': None, 'weight_linear_min_weight': 0.6526986044669096, 'weight_linear_max_weight': 3.7629333799945806}. Best is trial 18 with value: 0.251735093255844.
2026-06-01 00:18:16 | INFO | src.nested_cv_avggrm_weighted_unified | Trial 25 | outer=5 | alpha=7.958e+04 n_pcs=4500 (pc_topk) weight_search=on
2026-06-01 00:18:16 | INFO | src.nested_cv_avggrm_weighted_unified | Trial 25 | outer=5 | weight={'name': 'exponential', 'floor': 1e-06, 'clip_max': 5.0, 'beta': 4.06993889492095}
[I 2026-06-01 00:18:23,030] Trial 25 finished with value: 0.2585216221253553 and parameters: {'alpha': 79582.832412452, 'n_pcs': 4500, 'weight_scheme': 'exponential', 'weight_clip_max': 5.0, 'weight_exponential_beta': 4.06993889492095}. Best is trial 25 with value: 0.2585216221253553.
2026-06-01 00:18:23 | INFO | src.nested_cv_avggrm_weighted_unified | OUTER 5 | new best trial 25 (mean inner r=0.2585) saved to outputs/final_results/e6_pc_ridge_avggrm/thr_wing/e6_pc_ridge_avggrm_thr_wing_best_trials/split_05_best_trial.json
2026-06-01 00:18:23 | INFO | src.nested_cv_avggrm_weighted_unified | Trial 26 | outer=5 | alpha=2.631e+05 n_pcs=4000 (pc_topk) weight_search=on
2026-06-01 00:18:23 | INFO | src.nested_cv_avggrm_weighted_unified | Trial 26 | outer=5 | weight={'name': 'linear', 'floor': 1e-06, 'clip_max': 5.0, 'min_weight': 0.8188221250717371, 'max_weight': 3.5653607303175416}
2026-06-01 00:18:27 | INFO | src.nested_cv_avggrm_weighted_unified | Trial 26 | outer=5 | pruned after 7/10 inner folds (mean r=0.2768)
[I 2026-06-01 00:18:27,099] Trial 26 pruned. 
2026-06-01 00:18:27 | INFO | src.nested_cv_avggrm_weighted_unified | Trial 27 | outer=5 | alpha=6.901e+04 n_pcs=4500 (pc_topk) weight_search=on
2026-06-01 00:18:27 | INFO | src.nested_cv_avggrm_weighted_unified | Trial 27 | outer=5 | weight={'name': 'linear', 'floor': 1e-06, 'clip_max': 5.0, 'min_weight': 0.5480011391085505, 'max_weight': 2.3802817288567977}
[I 2026-06-01 00:18:33,631] Trial 27 finished with value: 0.25084962847947334 and parameters: {'alpha': 69007.17213701534, 'n_pcs': 4500, 'weight_scheme': 'linear', 'weight_clip_max': 5.0, 'weight_linear_min_weight': 0.5480011391085505, 'weight_linear_max_weight': 2.3802817288567977}. Best is trial 25 with value: 0.2585216221253553.
2026-06-01 00:18:33 | INFO | src.nested_cv_avggrm_weighted_unified | Trial 28 | outer=5 | alpha=1.654e+05 n_pcs=3500 (pc_topk) weight_search=on
2026-06-01 00:18:33 | INFO | src.nested_cv_avggrm_weighted_unified | Trial 28 | outer=5 | weight={'name': 'exponential', 'floor': 1e-06, 'clip_max': 5.0, 'beta': 3.031528860011487}
[I 2026-06-01 00:18:38,185] Trial 28 finished with value: 0.25149238299279925 and parameters: {'alpha': 165385.21721651353, 'n_pcs': 3500, 'weight_scheme': 'exponential', 'weight_clip_max': 5.0, 'weight_exponential_beta': 3.031528860011487}. Best is trial 25 with value: 0.2585216221253553.
2026-06-01 00:18:38 | INFO | src.nested_cv_avggrm_weighted_unified | Trial 29 | outer=5 | alpha=1.002e+05 n_pcs=3000 (pc_topk) weight_search=on
2026-06-01 00:18:38 | INFO | src.nested_cv_avggrm_weighted_unified | Trial 29 | outer=5 | weight={'name': 'uniform', 'floor': 1e-06, 'clip_max': 5.0}
2026-06-01 00:18:39 | INFO | src.nested_cv_avggrm_weighted_unified | Trial 29 | outer=5 | pruned after 6/10 inner folds (mean r=0.2469)
[I 2026-06-01 00:18:39,963] Trial 29 pruned. 
2026-06-01 00:18:39 | INFO | src.nested_cv_avggrm_weighted_unified | Trial 30 | outer=5 | alpha=5.161e+05 n_pcs=4000 (pc_topk) weight_search=on
2026-06-01 00:18:39 | INFO | src.nested_cv_avggrm_weighted_unified | Trial 30 | outer=5 | weight={'name': 'uniform', 'floor': 1e-06, 'clip_max': 5.0}
2026-06-01 00:18:42 | INFO | src.nested_cv_avggrm_weighted_unified | Trial 30 | outer=5 | pruned after 5/10 inner folds (mean r=0.2081)
[I 2026-06-01 00:18:42,287] Trial 30 pruned. 
2026-06-01 00:18:42 | INFO | src.nested_cv_avggrm_weighted_unified | Trial 31 | outer=5 | alpha=1.647e+05 n_pcs=3500 (pc_topk) weight_search=on
2026-06-01 00:18:42 | INFO | src.nested_cv_avggrm_weighted_unified | Trial 31 | outer=5 | weight={'name': 'exponential', 'floor': 1e-06, 'clip_max': 5.0, 'beta': 3.245761444298201}
