[I 2026-06-01 01:11:20,794] Trial 84 finished with value: 0.21840949231222676 and parameters: {'alpha': 12890.710370281478, 'n_pcs': 4500, 'weight_scheme': 'linear', 'weight_clip_max': 20.0, 'weight_linear_min_weight': 0.18688216216915343, 'weight_linear_max_weight': 4.577702748574922}. Best is trial 83 with value: 0.2287321870874001.
2026-06-01 01:11:20 | INFO | src.nested_cv_avggrm_weighted_unified | Trial 85 | outer=7 | alpha=3.421e+04 n_pcs=4500 (pc_topk) weight_search=on
2026-06-01 01:11:20 | INFO | src.nested_cv_avggrm_weighted_unified | Trial 85 | outer=7 | weight={'name': 'linear', 'floor': 1e-06, 'clip_max': 20.0, 'min_weight': 0.1570679321504581, 'max_weight': 4.996547739742434}
[I 2026-06-01 01:11:27,675] Trial 85 finished with value: 0.22777828344649603 and parameters: {'alpha': 34210.13141329377, 'n_pcs': 4500, 'weight_scheme': 'linear', 'weight_clip_max': 20.0, 'weight_linear_min_weight': 0.1570679321504581, 'weight_linear_max_weight': 4.996547739742434}. Best is trial 83 with value: 0.2287321870874001.
2026-06-01 01:11:27 | INFO | src.nested_cv_avggrm_weighted_unified | Trial 86 | outer=7 | alpha=5.379e+04 n_pcs=4500 (pc_topk) weight_search=on
2026-06-01 01:11:27 | INFO | src.nested_cv_avggrm_weighted_unified | Trial 86 | outer=7 | weight={'name': 'linear', 'floor': 1e-06, 'clip_max': 20.0, 'min_weight': 0.20589255920573885, 'max_weight': 4.106161538937919}
[I 2026-06-01 01:11:34,509] Trial 86 finished with value: 0.22876955329088525 and parameters: {'alpha': 53792.52804983272, 'n_pcs': 4500, 'weight_scheme': 'linear', 'weight_clip_max': 20.0, 'weight_linear_min_weight': 0.20589255920573885, 'weight_linear_max_weight': 4.106161538937919}. Best is trial 86 with value: 0.22876955329088525.
2026-06-01 01:11:34 | INFO | src.nested_cv_avggrm_weighted_unified | OUTER 7 | new best trial 86 (mean inner r=0.2288) saved to outputs/final_results/e6_pc_ridge_avggrm/thr_wing/e6_pc_ridge_avggrm_thr_wing_best_trials/split_07_best_trial.json
2026-06-01 01:11:34 | INFO | src.nested_cv_avggrm_weighted_unified | Trial 87 | outer=7 | alpha=5.446e+04 n_pcs=5000 (pc_topk) weight_search=on
2026-06-01 01:11:34 | INFO | src.nested_cv_avggrm_weighted_unified | Trial 87 | outer=7 | weight={'name': 'linear', 'floor': 1e-06, 'clip_max': 20.0, 'min_weight': 0.19296389787690846, 'max_weight': 4.115300659103847}
[I 2026-06-01 01:11:42,580] Trial 87 finished with value: 0.2268679516167949 and parameters: {'alpha': 54457.35420616758, 'n_pcs': 5000, 'weight_scheme': 'linear', 'weight_clip_max': 20.0, 'weight_linear_min_weight': 0.19296389787690846, 'weight_linear_max_weight': 4.115300659103847}. Best is trial 86 with value: 0.22876955329088525.
2026-06-01 01:11:42 | INFO | src.nested_cv_avggrm_weighted_unified | Trial 88 | outer=7 | alpha=2.207e+04 n_pcs=4500 (pc_topk) weight_search=on
2026-06-01 01:11:42 | INFO | src.nested_cv_avggrm_weighted_unified | Trial 88 | outer=7 | weight={'name': 'linear', 'floor': 1e-06, 'clip_max': 3.0, 'min_weight': 0.13824847852837646, 'max_weight': 4.777721568283964}
[I 2026-06-01 01:11:49,474] Trial 88 finished with value: 0.22421653470953432 and parameters: {'alpha': 22073.064322364702, 'n_pcs': 4500, 'weight_scheme': 'linear', 'weight_clip_max': 3.0, 'weight_linear_min_weight': 0.13824847852837646, 'weight_linear_max_weight': 4.777721568283964}. Best is trial 86 with value: 0.22876955329088525.
2026-06-01 01:11:49 | INFO | src.nested_cv_avggrm_weighted_unified | Trial 89 | outer=7 | alpha=5.211e+04 n_pcs=5000 (pc_topk) weight_search=on
2026-06-01 01:11:49 | INFO | src.nested_cv_avggrm_weighted_unified | Trial 89 | outer=7 | weight={'name': 'linear', 'floor': 1e-06, 'clip_max': 20.0, 'min_weight': 0.21365738266009066, 'max_weight': 4.502734253664945}
[I 2026-06-01 01:11:57,537] Trial 89 finished with value: 0.22686147127875636 and parameters: {'alpha': 52112.61017670232, 'n_pcs': 5000, 'weight_scheme': 'linear', 'weight_clip_max': 20.0, 'weight_linear_min_weight': 0.21365738266009066, 'weight_linear_max_weight': 4.502734253664945}. Best is trial 86 with value: 0.22876955329088525.
2026-06-01 01:11:57 | INFO | src.nested_cv_avggrm_weighted_unified | Trial 90 | outer=7 | alpha=1.407e+05 n_pcs=4500 (pc_topk) weight_search=on
2026-06-01 01:11:57 | INFO | src.nested_cv_avggrm_weighted_unified | Trial 90 | outer=7 | weight={'name': 'linear', 'floor': 1e-06, 'clip_max': 20.0, 'min_weight': 0.3215414408027264, 'max_weight': 4.083257921538679}
[I 2026-06-01 01:12:04,375] Trial 90 finished with value: 0.22436301460095734 and parameters: {'alpha': 140737.89697833188, 'n_pcs': 4500, 'weight_scheme': 'linear', 'weight_clip_max': 20.0, 'weight_linear_min_weight': 0.3215414408027264, 'weight_linear_max_weight': 4.083257921538679}. Best is trial 86 with value: 0.22876955329088525.
2026-06-01 01:12:04 | INFO | src.nested_cv_avggrm_weighted_unified | Trial 91 | outer=7 | alpha=7.121e+04 n_pcs=4000 (pc_topk) weight_search=on
2026-06-01 01:12:04 | INFO | src.nested_cv_avggrm_weighted_unified | Trial 91 | outer=7 | weight={'name': 'linear', 'floor': 1e-06, 'clip_max': 20.0, 'min_weight': 0.22306594067938162, 'max_weight': 4.181584096685062}
[I 2026-06-01 01:12:10,524] Trial 91 finished with value: 0.22858589582276653 and parameters: {'alpha': 71210.3777638188, 'n_pcs': 4000, 'weight_scheme': 'linear', 'weight_clip_max': 20.0, 'weight_linear_min_weight': 0.22306594067938162, 'weight_linear_max_weight': 4.181584096685062}. Best is trial 86 with value: 0.22876955329088525.
2026-06-01 01:12:10 | INFO | src.nested_cv_avggrm_weighted_unified | Trial 92 | outer=7 | alpha=3.808e+04 n_pcs=2000 (pc_topk) weight_search=on
2026-06-01 01:12:10 | INFO | src.nested_cv_avggrm_weighted_unified | Trial 92 | outer=7 | weight={'name': 'linear', 'floor': 1e-06, 'clip_max': 20.0, 'min_weight': 0.21659593200375715, 'max_weight': 4.445227961574446}
[I 2026-06-01 01:12:12,686] Trial 92 finished with value: 0.21630338508992045 and parameters: {'alpha': 38077.27370058302, 'n_pcs': 2000, 'weight_scheme': 'linear', 'weight_clip_max': 20.0, 'weight_linear_min_weight': 0.21659593200375715, 'weight_linear_max_weight': 4.445227961574446}. Best is trial 86 with value: 0.22876955329088525.
2026-06-01 01:12:12 | INFO | src.nested_cv_avggrm_weighted_unified | Trial 93 | outer=7 | alpha=1.064e+05 n_pcs=4000 (pc_topk) weight_search=on
2026-06-01 01:12:12 | INFO | src.nested_cv_avggrm_weighted_unified | Trial 93 | outer=7 | weight={'name': 'linear', 'floor': 1e-06, 'clip_max': 20.0, 'min_weight': 0.1840477632611169, 'max_weight': 4.207856607517973}
[I 2026-06-01 01:12:18,308] Trial 93 finished with value: 0.22739701598942808 and parameters: {'alpha': 106391.98923750818, 'n_pcs': 4000, 'weight_scheme': 'linear', 'weight_clip_max': 20.0, 'weight_linear_min_weight': 0.1840477632611169, 'weight_linear_max_weight': 4.207856607517973}. Best is trial 86 with value: 0.22876955329088525.
2026-06-01 01:12:18 | INFO | src.nested_cv_avggrm_weighted_unified | Trial 94 | outer=7 | alpha=5.066e+04 n_pcs=3500 (pc_topk) weight_search=on
2026-06-01 01:12:18 | INFO | src.nested_cv_avggrm_weighted_unified | Trial 94 | outer=7 | weight={'name': 'linear', 'floor': 1e-06, 'clip_max': 20.0, 'min_weight': 0.06828761495139399, 'max_weight': 3.8941725906414244}
[I 2026-06-01 01:12:23,145] Trial 94 finished with value: 0.22422165247222897 and parameters: {'alpha': 50663.904501061435, 'n_pcs': 3500, 'weight_scheme': 'linear', 'weight_clip_max': 20.0, 'weight_linear_min_weight': 0.06828761495139399, 'weight_linear_max_weight': 3.8941725906414244}. Best is trial 86 with value: 0.22876955329088525.
2026-06-01 01:12:23 | INFO | src.nested_cv_avggrm_weighted_unified | Trial 95 | outer=7 | alpha=5.959e+04 n_pcs=4500 (pc_topk) weight_search=on
2026-06-01 01:12:23 | INFO | src.nested_cv_avggrm_weighted_unified | Trial 95 | outer=7 | weight={'name': 'linear', 'floor': 1e-06, 'clip_max': 20.0, 'min_weight': 0.12392056780683222, 'max_weight': 4.8713533601312635}
[I 2026-06-01 01:12:29,969] Trial 95 finished with value: 0.22865241733852418 and parameters: {'alpha': 59587.490675243745, 'n_pcs': 4500, 'weight_scheme': 'linear', 'weight_clip_max': 20.0, 'weight_linear_min_weight': 0.12392056780683222, 'weight_linear_max_weight': 4.8713533601312635}. Best is trial 86 with value: 0.22876955329088525.
2026-06-01 01:12:29 | INFO | src.nested_cv_avggrm_weighted_unified | Trial 96 | outer=7 | alpha=6.424e+04 n_pcs=4500 (pc_topk) weight_search=on
2026-06-01 01:12:29 | INFO | src.nested_cv_avggrm_weighted_unified | Trial 96 | outer=7 | weight={'name': 'linear', 'floor': 1e-06, 'clip_max': 20.0, 'min_weight': 0.12461825818367488, 'max_weight': 4.778381733213526}
[I 2026-06-01 01:12:36,784] Trial 96 finished with value: 0.22857464097179628 and parameters: {'alpha': 64243.19203550058, 'n_pcs': 4500, 'weight_scheme': 'linear', 'weight_clip_max': 20.0, 'weight_linear_min_weight': 0.12461825818367488, 'weight_linear_max_weight': 4.778381733213526}. Best is trial 86 with value: 0.22876955329088525.
2026-06-01 01:12:36 | INFO | src.nested_cv_avggrm_weighted_unified | Trial 97 | outer=7 | alpha=3.354e+04 n_pcs=4500 (pc_topk) weight_search=on
2026-06-01 01:12:36 | INFO | src.nested_cv_avggrm_weighted_unified | Trial 97 | outer=7 | weight={'name': 'linear', 'floor': 1e-06, 'clip_max': 20.0, 'min_weight': 0.1283628951849423, 'max_weight': 4.7712993471556}
[I 2026-06-01 01:12:43,753] Trial 97 finished with value: 0.22762340761856575 and parameters: {'alpha': 33538.77320632713, 'n_pcs': 4500, 'weight_scheme': 'linear', 'weight_clip_max': 20.0, 'weight_linear_min_weight': 0.1283628951849423, 'weight_linear_max_weight': 4.7712993471556}. Best is trial 86 with value: 0.22876955329088525.
2026-06-01 01:12:43 | INFO | src.nested_cv_avggrm_weighted_unified | Trial 98 | outer=7 | alpha=6.498e+04 n_pcs=4500 (pc_topk) weight_search=on
2026-06-01 01:12:43 | INFO | src.nested_cv_avggrm_weighted_unified | Trial 98 | outer=7 | weight={'name': 'uniform', 'floor': 1e-06, 'clip_max': 5.0}
[I 2026-06-01 01:12:49,727] Trial 98 finished with value: 0.21685858231319194 and parameters: {'alpha': 64983.157059902165, 'n_pcs': 4500, 'weight_scheme': 'uniform', 'weight_clip_max': 5.0}. Best is trial 86 with value: 0.22876955329088525.
2026-06-01 01:12:49 | INFO | src.nested_cv_avggrm_weighted_unified | Trial 99 | outer=7 | alpha=1.084e+05 n_pcs=5000 (pc_topk) weight_search=on
2026-06-01 01:12:49 | INFO | src.nested_cv_avggrm_weighted_unified | Trial 99 | outer=7 | weight={'name': 'linear', 'floor': 1e-06, 'clip_max': 20.0, 'min_weight': 0.15480812303392372, 'max_weight': 4.862734238969969}
[I 2026-06-01 01:12:57,762] Trial 99 finished with value: 0.2252151852606314 and parameters: {'alpha': 108391.08530046897, 'n_pcs': 5000, 'weight_scheme': 'linear', 'weight_clip_max': 20.0, 'weight_linear_min_weight': 0.15480812303392372, 'weight_linear_max_weight': 4.862734238969969}. Best is trial 86 with value: 0.22876955329088525.
2026-06-01 01:12:57 | INFO | src.nested_cv_avggrm_weighted_unified | Trial 100 | outer=7 | alpha=1.623e+04 n_pcs=4500 (pc_topk) weight_search=on
2026-06-01 01:12:57 | INFO | src.nested_cv_avggrm_weighted_unified | Trial 100 | outer=7 | weight={'name': 'exponential', 'floor': 1e-06, 'clip_max': 20.0, 'beta': 0.3870901654143113}
[I 2026-06-01 01:13:04,590] Trial 100 finished with value: 0.2196918896977797 and parameters: {'alpha': 16231.753189764273, 'n_pcs': 4500, 'weight_scheme': 'exponential', 'weight_clip_max': 20.0, 'weight_exponential_beta': 0.3870901654143113}. Best is trial 86 with value: 0.22876955329088525.
2026-06-01 01:13:04 | INFO | src.nested_cv_avggrm_weighted_unified | Trial 101 | outer=7 | alpha=4.095e+04 n_pcs=4500 (pc_topk) weight_search=on
2026-06-01 01:13:04 | INFO | src.nested_cv_avggrm_weighted_unified | Trial 101 | outer=7 | weight={'name': 'linear', 'floor': 1e-06, 'clip_max': 20.0, 'min_weight': 0.11235009080172799, 'max_weight': 4.451535749273692}
[I 2026-06-01 01:13:11,422] Trial 101 finished with value: 0.22831613215386432 and parameters: {'alpha': 40953.49689449074, 'n_pcs': 4500, 'weight_scheme': 'linear', 'weight_clip_max': 20.0, 'weight_linear_min_weight': 0.11235009080172799, 'weight_linear_max_weight': 4.451535749273692}. Best is trial 86 with value: 0.22876955329088525.
2026-06-01 01:13:11 | INFO | src.nested_cv_avggrm_weighted_unified | Trial 102 | outer=7 | alpha=6.912e+04 n_pcs=4000 (pc_topk) weight_search=on
2026-06-01 01:13:11 | INFO | src.nested_cv_avggrm_weighted_unified | Trial 102 | outer=7 | weight={'name': 'linear', 'floor': 1e-06, 'clip_max': 20.0, 'min_weight': 0.22945672946084944, 'max_weight': 4.666630354573053}
[I 2026-06-01 01:13:17,065] Trial 102 finished with value: 0.22863457060726167 and parameters: {'alpha': 69116.27658085848, 'n_pcs': 4000, 'weight_scheme': 'linear', 'weight_clip_max': 20.0, 'weight_linear_min_weight': 0.22945672946084944, 'weight_linear_max_weight': 4.666630354573053}. Best is trial 86 with value: 0.22876955329088525.
2026-06-01 01:13:17 | INFO | src.nested_cv_avggrm_weighted_unified | Trial 103 | outer=7 | alpha=6.807e+04 n_pcs=1500 (pc_topk) weight_search=on
2026-06-01 01:13:17 | INFO | src.nested_cv_avggrm_weighted_unified | Trial 103 | outer=7 | weight={'name': 'linear', 'floor': 1e-06, 'clip_max': 20.0, 'min_weight': 0.45232815025853235, 'max_weight': 4.687520510955696}
[I 2026-06-01 01:13:18,799] Trial 103 finished with value: 0.21680390376167513 and parameters: {'alpha': 68071.6052161328, 'n_pcs': 1500, 'weight_scheme': 'linear', 'weight_clip_max': 20.0, 'weight_linear_min_weight': 0.45232815025853235, 'weight_linear_max_weight': 4.687520510955696}. Best is trial 86 with value: 0.22876955329088525.
2026-06-01 01:13:18 | INFO | src.nested_cv_avggrm_weighted_unified | Trial 104 | outer=7 | alpha=5.368e+04 n_pcs=4000 (pc_topk) weight_search=on
2026-06-01 01:13:18 | INFO | src.nested_cv_avggrm_weighted_unified | Trial 104 | outer=7 | weight={'name': 'linear', 'floor': 1e-06, 'clip_max': 20.0, 'min_weight': 0.29617319169387185, 'max_weight': 4.881744558321322}
[I 2026-06-01 01:13:24,445] Trial 104 finished with value: 0.22864124979216305 and parameters: {'alpha': 53684.595571134654, 'n_pcs': 4000, 'weight_scheme': 'linear', 'weight_clip_max': 20.0, 'weight_linear_min_weight': 0.29617319169387185, 'weight_linear_max_weight': 4.881744558321322}. Best is trial 86 with value: 0.22876955329088525.
2026-06-01 01:13:24 | INFO | src.nested_cv_avggrm_weighted_unified | Trial 105 | outer=7 | alpha=2.711e+04 n_pcs=4500 (pc_topk) weight_search=on
2026-06-01 01:13:24 | INFO | src.nested_cv_avggrm_weighted_unified | Trial 105 | outer=7 | weight={'name': 'linear', 'floor': 1e-06, 'clip_max': 20.0, 'min_weight': 0.27966949267263963, 'max_weight': 4.916762031580672}
[I 2026-06-01 01:13:31,293] Trial 105 finished with value: 0.22681101676823814 and parameters: {'alpha': 27110.642931264418, 'n_pcs': 4500, 'weight_scheme': 'linear', 'weight_clip_max': 20.0, 'weight_linear_min_weight': 0.27966949267263963, 'weight_linear_max_weight': 4.916762031580672}. Best is trial 86 with value: 0.22876955329088525.
2026-06-01 01:13:31 | INFO | src.nested_cv_avggrm_weighted_unified | Trial 106 | outer=7 | alpha=9.064e+04 n_pcs=5000 (pc_topk) weight_search=on
2026-06-01 01:13:31 | INFO | src.nested_cv_avggrm_weighted_unified | Trial 106 | outer=7 | weight={'name': 'linear', 'floor': 1e-06, 'clip_max': 20.0, 'min_weight': 0.22948560412077368, 'max_weight': 4.783395618643546}
[I 2026-06-01 01:13:39,348] Trial 106 finished with value: 0.22582400502041344 and parameters: {'alpha': 90635.51542327493, 'n_pcs': 5000, 'weight_scheme': 'linear', 'weight_clip_max': 20.0, 'weight_linear_min_weight': 0.22948560412077368, 'weight_linear_max_weight': 4.783395618643546}. Best is trial 86 with value: 0.22876955329088525.
2026-06-01 01:13:39 | INFO | src.nested_cv_avggrm_weighted_unified | Trial 107 | outer=7 | alpha=1.467e+05 n_pcs=4000 (pc_topk) weight_search=on
2026-06-01 01:13:39 | INFO | src.nested_cv_avggrm_weighted_unified | Trial 107 | outer=7 | weight={'name': 'linear', 'floor': 1e-06, 'clip_max': 20.0, 'min_weight': 0.12221916390570126, 'max_weight': 4.071568662880111}
[I 2026-06-01 01:13:45,014] Trial 107 finished with value: 0.22583996741709006 and parameters: {'alpha': 146744.15608234284, 'n_pcs': 4000, 'weight_scheme': 'linear', 'weight_clip_max': 20.0, 'weight_linear_min_weight': 0.12221916390570126, 'weight_linear_max_weight': 4.071568662880111}. Best is trial 86 with value: 0.22876955329088525.
2026-06-01 01:13:45 | INFO | src.nested_cv_avggrm_weighted_unified | Trial 108 | outer=7 | alpha=3.614e+06 n_pcs=4500 (pc_topk) weight_search=on
2026-06-01 01:13:45 | INFO | src.nested_cv_avggrm_weighted_unified | Trial 108 | outer=7 | weight={'name': 'linear', 'floor': 1e-06, 'clip_max': 3.0, 'min_weight': 0.07486613195750909, 'max_weight': 4.976339375648676}
[I 2026-06-01 01:13:51,798] Trial 108 finished with value: 0.19952574655087357 and parameters: {'alpha': 3614255.1682771053, 'n_pcs': 4500, 'weight_scheme': 'linear', 'weight_clip_max': 3.0, 'weight_linear_min_weight': 0.07486613195750909, 'weight_linear_max_weight': 4.976339375648676}. Best is trial 86 with value: 0.22876955329088525.
2026-06-01 01:13:51 | INFO | src.nested_cv_avggrm_weighted_unified | Trial 109 | outer=7 | alpha=7.230e+04 n_pcs=4000 (pc_topk) weight_search=on
2026-06-01 01:13:51 | INFO | src.nested_cv_avggrm_weighted_unified | Trial 109 | outer=7 | weight={'name': 'linear', 'floor': 1e-06, 'clip_max': 20.0, 'min_weight': 0.29346294073534895, 'max_weight': 4.661797596476099}
[I 2026-06-01 01:13:57,429] Trial 109 finished with value: 0.22852274630653585 and parameters: {'alpha': 72295.94135351256, 'n_pcs': 4000, 'weight_scheme': 'linear', 'weight_clip_max': 20.0, 'weight_linear_min_weight': 0.29346294073534895, 'weight_linear_max_weight': 4.661797596476099}. Best is trial 86 with value: 0.22876955329088525.
2026-06-01 01:13:57 | INFO | src.nested_cv_avggrm_weighted_unified | Trial 110 | outer=7 | alpha=4.246e+04 n_pcs=3500 (pc_topk) weight_search=on
2026-06-01 01:13:57 | INFO | src.nested_cv_avggrm_weighted_unified | Trial 110 | outer=7 | weight={'name': 'linear', 'floor': 1e-06, 'clip_max': 20.0, 'min_weight': 0.14667284544860912, 'max_weight': 4.395250064896642}
[I 2026-06-01 01:14:02,208] Trial 110 finished with value: 0.2231697813196578 and parameters: {'alpha': 42461.30777903989, 'n_pcs': 3500, 'weight_scheme': 'linear', 'weight_clip_max': 20.0, 'weight_linear_min_weight': 0.14667284544860912, 'weight_linear_max_weight': 4.395250064896642}. Best is trial 86 with value: 0.22876955329088525.
2026-06-01 01:14:02 | INFO | src.nested_cv_avggrm_weighted_unified | Trial 111 | outer=7 | alpha=5.723e+04 n_pcs=4000 (pc_topk) weight_search=on
2026-06-01 01:14:02 | INFO | src.nested_cv_avggrm_weighted_unified | Trial 111 | outer=7 | weight={'name': 'linear', 'floor': 1e-06, 'clip_max': 20.0, 'min_weight': 0.3105114855461719, 'max_weight': 4.648123606445681}
[I 2026-06-01 01:14:07,847] Trial 111 finished with value: 0.22869329752808656 and parameters: {'alpha': 57233.255632750435, 'n_pcs': 4000, 'weight_scheme': 'linear', 'weight_clip_max': 20.0, 'weight_linear_min_weight': 0.3105114855461719, 'weight_linear_max_weight': 4.648123606445681}. Best is trial 86 with value: 0.22876955329088525.
2026-06-01 01:14:07 | INFO | src.nested_cv_avggrm_weighted_unified | Trial 112 | outer=7 | alpha=5.603e+04 n_pcs=4000 (pc_topk) weight_search=on
2026-06-01 01:14:07 | INFO | src.nested_cv_avggrm_weighted_unified | Trial 112 | outer=7 | weight={'name': 'linear', 'floor': 1e-06, 'clip_max': 20.0, 'min_weight': 0.20653984045201262, 'max_weight': 4.219894988706302}
[I 2026-06-01 01:14:14,075] Trial 112 finished with value: 0.22865868278442641 and parameters: {'alpha': 56026.84830391393, 'n_pcs': 4000, 'weight_scheme': 'linear', 'weight_clip_max': 20.0, 'weight_linear_min_weight': 0.20653984045201262, 'weight_linear_max_weight': 4.219894988706302}. Best is trial 86 with value: 0.22876955329088525.
2026-06-01 01:14:14 | INFO | src.nested_cv_avggrm_weighted_unified | Trial 113 | outer=7 | alpha=5.173e+04 n_pcs=4000 (pc_topk) weight_search=on
2026-06-01 01:14:14 | INFO | src.nested_cv_avggrm_weighted_unified | Trial 113 | outer=7 | weight={'name': 'linear', 'floor': 1e-06, 'clip_max': 20.0, 'min_weight': 0.32177285789561344, 'max_weight': 4.234522805044525}
[I 2026-06-01 01:14:19,703] Trial 113 finished with value: 0.22860064633517405 and parameters: {'alpha': 51727.01401557714, 'n_pcs': 4000, 'weight_scheme': 'linear', 'weight_clip_max': 20.0, 'weight_linear_min_weight': 0.32177285789561344, 'weight_linear_max_weight': 4.234522805044525}. Best is trial 86 with value: 0.22876955329088525.
2026-06-01 01:14:19 | INFO | src.nested_cv_avggrm_weighted_unified | Trial 114 | outer=7 | alpha=6.103e+04 n_pcs=4000 (pc_topk) weight_search=on
2026-06-01 01:14:19 | INFO | src.nested_cv_avggrm_weighted_unified | Trial 114 | outer=7 | weight={'name': 'linear', 'floor': 1e-06, 'clip_max': 20.0, 'min_weight': 0.3254272289389179, 'max_weight': 4.2758954358740215}
[I 2026-06-01 01:14:25,335] Trial 114 finished with value: 0.22866823174757958 and parameters: {'alpha': 61028.5902090078, 'n_pcs': 4000, 'weight_scheme': 'linear', 'weight_clip_max': 20.0, 'weight_linear_min_weight': 0.3254272289389179, 'weight_linear_max_weight': 4.2758954358740215}. Best is trial 86 with value: 0.22876955329088525.
2026-06-01 01:14:25 | INFO | src.nested_cv_avggrm_weighted_unified | Trial 115 | outer=7 | alpha=3.687e+04 n_pcs=4500 (pc_topk) weight_search=on
2026-06-01 01:14:25 | INFO | src.nested_cv_avggrm_weighted_unified | Trial 115 | outer=7 | weight={'name': 'linear', 'floor': 1e-06, 'clip_max': 20.0, 'min_weight': 0.4019415860042433, 'max_weight': 4.2197243032844165}
