[I 2026-06-01 01:42:53,301] Trial 102 finished with value: 0.22023421530385337 and parameters: {'alpha': 69248.08808317778, 'n_pcs': 4000, 'weight_scheme': 'exponential', 'weight_clip_max': 5.0, 'weight_exponential_beta': 6.322023326170087}. Best is trial 67 with value: 0.22356194409955688.
2026-06-01 01:42:53 | INFO | src.nested_cv_avggrm_weighted_unified | Trial 103 | outer=8 | alpha=1.806e+05 n_pcs=3500 (pc_topk) weight_search=on
2026-06-01 01:42:53 | INFO | src.nested_cv_avggrm_weighted_unified | Trial 103 | outer=8 | weight={'name': 'exponential', 'floor': 1e-06, 'clip_max': 5.0, 'beta': 6.426530560566789}
[I 2026-06-01 01:42:58,115] Trial 103 finished with value: 0.22168919224954156 and parameters: {'alpha': 180610.95315456722, 'n_pcs': 3500, 'weight_scheme': 'exponential', 'weight_clip_max': 5.0, 'weight_exponential_beta': 6.426530560566789}. Best is trial 67 with value: 0.22356194409955688.
2026-06-01 01:42:58 | INFO | src.nested_cv_avggrm_weighted_unified | Trial 104 | outer=8 | alpha=1.057e+05 n_pcs=4000 (pc_topk) weight_search=on
2026-06-01 01:42:58 | INFO | src.nested_cv_avggrm_weighted_unified | Trial 104 | outer=8 | weight={'name': 'exponential', 'floor': 1e-06, 'clip_max': 5.0, 'beta': 5.6054149598348735}
[I 2026-06-01 01:43:04,243] Trial 104 finished with value: 0.22250034352621673 and parameters: {'alpha': 105742.34869408373, 'n_pcs': 4000, 'weight_scheme': 'exponential', 'weight_clip_max': 5.0, 'weight_exponential_beta': 5.6054149598348735}. Best is trial 67 with value: 0.22356194409955688.
2026-06-01 01:43:04 | INFO | src.nested_cv_avggrm_weighted_unified | Trial 105 | outer=8 | alpha=2.117e+05 n_pcs=4000 (pc_topk) weight_search=on
2026-06-01 01:43:04 | INFO | src.nested_cv_avggrm_weighted_unified | Trial 105 | outer=8 | weight={'name': 'exponential', 'floor': 1e-06, 'clip_max': 5.0, 'beta': 5.965382655930926}
[I 2026-06-01 01:43:10,514] Trial 105 finished with value: 0.22304478575089354 and parameters: {'alpha': 211709.7225510566, 'n_pcs': 4000, 'weight_scheme': 'exponential', 'weight_clip_max': 5.0, 'weight_exponential_beta': 5.965382655930926}. Best is trial 67 with value: 0.22356194409955688.
2026-06-01 01:43:10 | INFO | src.nested_cv_avggrm_weighted_unified | Trial 106 | outer=8 | alpha=2.036e+05 n_pcs=3500 (pc_topk) weight_search=on
2026-06-01 01:43:10 | INFO | src.nested_cv_avggrm_weighted_unified | Trial 106 | outer=8 | weight={'name': 'exponential', 'floor': 1e-06, 'clip_max': 5.0, 'beta': 6.082318543036252}
[I 2026-06-01 01:43:15,456] Trial 106 finished with value: 0.2219904973763948 and parameters: {'alpha': 203649.80842753907, 'n_pcs': 3500, 'weight_scheme': 'exponential', 'weight_clip_max': 5.0, 'weight_exponential_beta': 6.082318543036252}. Best is trial 67 with value: 0.22356194409955688.
2026-06-01 01:43:15 | INFO | src.nested_cv_avggrm_weighted_unified | Trial 107 | outer=8 | alpha=1.329e+05 n_pcs=4000 (pc_topk) weight_search=on
2026-06-01 01:43:15 | INFO | src.nested_cv_avggrm_weighted_unified | Trial 107 | outer=8 | weight={'name': 'exponential', 'floor': 1e-06, 'clip_max': 5.0, 'beta': 4.450599413758313}
[I 2026-06-01 01:43:21,160] Trial 107 finished with value: 0.22278252734508955 and parameters: {'alpha': 132907.7992341295, 'n_pcs': 4000, 'weight_scheme': 'exponential', 'weight_clip_max': 5.0, 'weight_exponential_beta': 4.450599413758313}. Best is trial 67 with value: 0.22356194409955688.
2026-06-01 01:43:21 | INFO | src.nested_cv_avggrm_weighted_unified | Trial 108 | outer=8 | alpha=3.212e+05 n_pcs=1500 (pc_topk) weight_search=on
2026-06-01 01:43:21 | INFO | src.nested_cv_avggrm_weighted_unified | Trial 108 | outer=8 | weight={'name': 'exponential', 'floor': 1e-06, 'clip_max': 5.0, 'beta': 2.7632585403051135}
[I 2026-06-01 01:43:24,014] Trial 108 finished with value: 0.2087452888376898 and parameters: {'alpha': 321159.89141960774, 'n_pcs': 1500, 'weight_scheme': 'exponential', 'weight_clip_max': 5.0, 'weight_exponential_beta': 2.7632585403051135}. Best is trial 67 with value: 0.22356194409955688.
2026-06-01 01:43:24 | INFO | src.nested_cv_avggrm_weighted_unified | Trial 109 | outer=8 | alpha=1.613e+05 n_pcs=4500 (pc_topk) weight_search=on
2026-06-01 01:43:24 | INFO | src.nested_cv_avggrm_weighted_unified | Trial 109 | outer=8 | weight={'name': 'exponential', 'floor': 1e-06, 'clip_max': 5.0, 'beta': 5.46651958411151}
[I 2026-06-01 01:43:30,846] Trial 109 finished with value: 0.22257194425578772 and parameters: {'alpha': 161263.48227456288, 'n_pcs': 4500, 'weight_scheme': 'exponential', 'weight_clip_max': 5.0, 'weight_exponential_beta': 5.46651958411151}. Best is trial 67 with value: 0.22356194409955688.
2026-06-01 01:43:30 | INFO | src.nested_cv_avggrm_weighted_unified | Trial 110 | outer=8 | alpha=4.755e+05 n_pcs=4500 (pc_topk) weight_search=on
2026-06-01 01:43:30 | INFO | src.nested_cv_avggrm_weighted_unified | Trial 110 | outer=8 | weight={'name': 'exponential', 'floor': 1e-06, 'clip_max': 5.0, 'beta': 6.665954955350199}
[I 2026-06-01 01:43:37,649] Trial 110 finished with value: 0.22068505951628667 and parameters: {'alpha': 475537.88999748416, 'n_pcs': 4500, 'weight_scheme': 'exponential', 'weight_clip_max': 5.0, 'weight_exponential_beta': 6.665954955350199}. Best is trial 67 with value: 0.22356194409955688.
2026-06-01 01:43:37 | INFO | src.nested_cv_avggrm_weighted_unified | Trial 111 | outer=8 | alpha=2.087e+05 n_pcs=4000 (pc_topk) weight_search=on
2026-06-01 01:43:37 | INFO | src.nested_cv_avggrm_weighted_unified | Trial 111 | outer=8 | weight={'name': 'exponential', 'floor': 1e-06, 'clip_max': 3.0, 'beta': 5.896387958312871}
[I 2026-06-01 01:43:43,369] Trial 111 finished with value: 0.22231198353732967 and parameters: {'alpha': 208709.61966704932, 'n_pcs': 4000, 'weight_scheme': 'exponential', 'weight_clip_max': 3.0, 'weight_exponential_beta': 5.896387958312871}. Best is trial 67 with value: 0.22356194409955688.
2026-06-01 01:43:43 | INFO | src.nested_cv_avggrm_weighted_unified | Trial 112 | outer=8 | alpha=1.197e+05 n_pcs=4000 (pc_topk) weight_search=on
2026-06-01 01:43:43 | INFO | src.nested_cv_avggrm_weighted_unified | Trial 112 | outer=8 | weight={'name': 'exponential', 'floor': 1e-06, 'clip_max': 5.0, 'beta': 6.4315179582916056}
[I 2026-06-01 01:43:49,106] Trial 112 finished with value: 0.22224489351275717 and parameters: {'alpha': 119723.27949460315, 'n_pcs': 4000, 'weight_scheme': 'exponential', 'weight_clip_max': 5.0, 'weight_exponential_beta': 6.4315179582916056}. Best is trial 67 with value: 0.22356194409955688.
2026-06-01 01:43:49 | INFO | src.nested_cv_avggrm_weighted_unified | Trial 113 | outer=8 | alpha=2.888e+05 n_pcs=4000 (pc_topk) weight_search=on
2026-06-01 01:43:49 | INFO | src.nested_cv_avggrm_weighted_unified | Trial 113 | outer=8 | weight={'name': 'exponential', 'floor': 1e-06, 'clip_max': 5.0, 'beta': 6.23771944049279}
[I 2026-06-01 01:43:54,782] Trial 113 finished with value: 0.22274878543202337 and parameters: {'alpha': 288776.83804711513, 'n_pcs': 4000, 'weight_scheme': 'exponential', 'weight_clip_max': 5.0, 'weight_exponential_beta': 6.23771944049279}. Best is trial 67 with value: 0.22356194409955688.
2026-06-01 01:43:54 | INFO | src.nested_cv_avggrm_weighted_unified | Trial 114 | outer=8 | alpha=1.579e+05 n_pcs=4000 (pc_topk) weight_search=on
2026-06-01 01:43:54 | INFO | src.nested_cv_avggrm_weighted_unified | Trial 114 | outer=8 | weight={'name': 'exponential', 'floor': 1e-06, 'clip_max': 3.0, 'beta': 5.207429878804864}
[I 2026-06-01 01:44:00,481] Trial 114 finished with value: 0.22263061460110656 and parameters: {'alpha': 157946.42123379654, 'n_pcs': 4000, 'weight_scheme': 'exponential', 'weight_clip_max': 3.0, 'weight_exponential_beta': 5.207429878804864}. Best is trial 67 with value: 0.22356194409955688.
2026-06-01 01:44:00 | INFO | src.nested_cv_avggrm_weighted_unified | Trial 115 | outer=8 | alpha=9.126e+04 n_pcs=4000 (pc_topk) weight_search=on
2026-06-01 01:44:00 | INFO | src.nested_cv_avggrm_weighted_unified | Trial 115 | outer=8 | weight={'name': 'exponential', 'floor': 1e-06, 'clip_max': 5.0, 'beta': 6.81024809292456}
[I 2026-06-01 01:44:06,395] Trial 115 finished with value: 0.22093594078011694 and parameters: {'alpha': 91258.06136186083, 'n_pcs': 4000, 'weight_scheme': 'exponential', 'weight_clip_max': 5.0, 'weight_exponential_beta': 6.81024809292456}. Best is trial 67 with value: 0.22356194409955688.
2026-06-01 01:44:06 | INFO | src.nested_cv_avggrm_weighted_unified | Trial 116 | outer=8 | alpha=3.767e+05 n_pcs=3500 (pc_topk) weight_search=on
2026-06-01 01:44:06 | INFO | src.nested_cv_avggrm_weighted_unified | Trial 116 | outer=8 | weight={'name': 'uniform', 'floor': 1e-06, 'clip_max': 5.0}
2026-06-01 01:44:08 | INFO | src.nested_cv_avggrm_weighted_unified | Trial 116 | outer=8 | pruned after 5/10 inner folds (mean r=0.2012)
[I 2026-06-01 01:44:08,762] Trial 116 pruned. 
2026-06-01 01:44:08 | INFO | src.nested_cv_avggrm_weighted_unified | Trial 117 | outer=8 | alpha=2.192e+05 n_pcs=4000 (pc_topk) weight_search=on
2026-06-01 01:44:08 | INFO | src.nested_cv_avggrm_weighted_unified | Trial 117 | outer=8 | weight={'name': 'exponential', 'floor': 1e-06, 'clip_max': None, 'beta': 6.0137327685998745}
[I 2026-06-01 01:44:14,604] Trial 117 finished with value: 0.204800055423995 and parameters: {'alpha': 219179.2296851676, 'n_pcs': 4000, 'weight_scheme': 'exponential', 'weight_clip_max': None, 'weight_exponential_beta': 6.0137327685998745}. Best is trial 67 with value: 0.22356194409955688.
2026-06-01 01:44:14 | INFO | src.nested_cv_avggrm_weighted_unified | Trial 118 | outer=8 | alpha=6.873e+05 n_pcs=4000 (pc_topk) weight_search=on
2026-06-01 01:44:14 | INFO | src.nested_cv_avggrm_weighted_unified | Trial 118 | outer=8 | weight={'name': 'exponential', 'floor': 1e-06, 'clip_max': 5.0, 'beta': 5.486809313864824}
[I 2026-06-01 01:44:20,310] Trial 118 finished with value: 0.2191167406105153 and parameters: {'alpha': 687283.5738126334, 'n_pcs': 4000, 'weight_scheme': 'exponential', 'weight_clip_max': 5.0, 'weight_exponential_beta': 5.486809313864824}. Best is trial 67 with value: 0.22356194409955688.
2026-06-01 01:44:20 | INFO | src.nested_cv_avggrm_weighted_unified | Trial 119 | outer=8 | alpha=1.740e+05 n_pcs=4500 (pc_topk) weight_search=on
2026-06-01 01:44:20 | INFO | src.nested_cv_avggrm_weighted_unified | Trial 119 | outer=8 | weight={'name': 'linear', 'floor': 1e-06, 'clip_max': 3.0, 'min_weight': 0.2658164793128362, 'max_weight': 2.2122501197612396}
[I 2026-06-01 01:44:27,221] Trial 119 finished with value: 0.21698876251501184 and parameters: {'alpha': 173962.3798651738, 'n_pcs': 4500, 'weight_scheme': 'linear', 'weight_clip_max': 3.0, 'weight_linear_min_weight': 0.2658164793128362, 'weight_linear_max_weight': 2.2122501197612396}. Best is trial 67 with value: 0.22356194409955688.
2026-06-01 01:44:27 | INFO | src.nested_cv_avggrm_weighted_unified | Trial 120 | outer=8 | alpha=1.377e+05 n_pcs=4000 (pc_topk) weight_search=on
2026-06-01 01:44:27 | INFO | src.nested_cv_avggrm_weighted_unified | Trial 120 | outer=8 | weight={'name': 'exponential', 'floor': 1e-06, 'clip_max': 5.0, 'beta': 7.617370170263969}
[I 2026-06-01 01:44:32,918] Trial 120 finished with value: 0.22151935298935904 and parameters: {'alpha': 137674.46496053602, 'n_pcs': 4000, 'weight_scheme': 'exponential', 'weight_clip_max': 5.0, 'weight_exponential_beta': 7.617370170263969}. Best is trial 67 with value: 0.22356194409955688.
2026-06-01 01:44:32 | INFO | src.nested_cv_avggrm_weighted_unified | Trial 121 | outer=8 | alpha=2.860e+05 n_pcs=4000 (pc_topk) weight_search=on
2026-06-01 01:44:32 | INFO | src.nested_cv_avggrm_weighted_unified | Trial 121 | outer=8 | weight={'name': 'exponential', 'floor': 1e-06, 'clip_max': 5.0, 'beta': 5.773150977820273}
[I 2026-06-01 01:44:38,603] Trial 121 finished with value: 0.22259644395808942 and parameters: {'alpha': 286003.81243377615, 'n_pcs': 4000, 'weight_scheme': 'exponential', 'weight_clip_max': 5.0, 'weight_exponential_beta': 5.773150977820273}. Best is trial 67 with value: 0.22356194409955688.
2026-06-01 01:44:38 | INFO | src.nested_cv_avggrm_weighted_unified | Trial 122 | outer=8 | alpha=2.292e+05 n_pcs=4000 (pc_topk) weight_search=on
2026-06-01 01:44:38 | INFO | src.nested_cv_avggrm_weighted_unified | Trial 122 | outer=8 | weight={'name': 'exponential', 'floor': 1e-06, 'clip_max': 5.0, 'beta': 6.270293684494331}
[I 2026-06-01 01:44:44,771] Trial 122 finished with value: 0.22299273769299507 and parameters: {'alpha': 229176.65026451135, 'n_pcs': 4000, 'weight_scheme': 'exponential', 'weight_clip_max': 5.0, 'weight_exponential_beta': 6.270293684494331}. Best is trial 67 with value: 0.22356194409955688.
2026-06-01 01:44:44 | INFO | src.nested_cv_avggrm_weighted_unified | Trial 123 | outer=8 | alpha=2.130e+05 n_pcs=3500 (pc_topk) weight_search=on
2026-06-01 01:44:44 | INFO | src.nested_cv_avggrm_weighted_unified | Trial 123 | outer=8 | weight={'name': 'exponential', 'floor': 1e-06, 'clip_max': 5.0, 'beta': 6.312616981412457}
[I 2026-06-01 01:44:49,724] Trial 123 finished with value: 0.2219584220257677 and parameters: {'alpha': 213012.78216461118, 'n_pcs': 3500, 'weight_scheme': 'exponential', 'weight_clip_max': 5.0, 'weight_exponential_beta': 6.312616981412457}. Best is trial 67 with value: 0.22356194409955688.
2026-06-01 01:44:49 | INFO | src.nested_cv_avggrm_weighted_unified | Trial 124 | outer=8 | alpha=1.152e+05 n_pcs=4000 (pc_topk) weight_search=on
2026-06-01 01:44:49 | INFO | src.nested_cv_avggrm_weighted_unified | Trial 124 | outer=8 | weight={'name': 'exponential', 'floor': 1e-06, 'clip_max': 5.0, 'beta': 6.692268093835832}
[I 2026-06-01 01:44:55,593] Trial 124 finished with value: 0.22190610263258836 and parameters: {'alpha': 115173.01418091825, 'n_pcs': 4000, 'weight_scheme': 'exponential', 'weight_clip_max': 5.0, 'weight_exponential_beta': 6.692268093835832}. Best is trial 67 with value: 0.22356194409955688.
2026-06-01 01:44:55 | INFO | src.nested_cv_avggrm_weighted_unified | Trial 125 | outer=8 | alpha=3.384e+05 n_pcs=4000 (pc_topk) weight_search=on
2026-06-01 01:44:55 | INFO | src.nested_cv_avggrm_weighted_unified | Trial 125 | outer=8 | weight={'name': 'exponential', 'floor': 1e-06, 'clip_max': 5.0, 'beta': 7.3846154124251555}
[I 2026-06-01 01:45:01,339] Trial 125 finished with value: 0.22247387426241624 and parameters: {'alpha': 338403.5219290319, 'n_pcs': 4000, 'weight_scheme': 'exponential', 'weight_clip_max': 5.0, 'weight_exponential_beta': 7.3846154124251555}. Best is trial 67 with value: 0.22356194409955688.
2026-06-01 01:45:01 | INFO | src.nested_cv_avggrm_weighted_unified | Trial 126 | outer=8 | alpha=1.884e+05 n_pcs=4000 (pc_topk) weight_search=on
2026-06-01 01:45:01 | INFO | src.nested_cv_avggrm_weighted_unified | Trial 126 | outer=8 | weight={'name': 'exponential', 'floor': 1e-06, 'clip_max': 10.0, 'beta': 5.048431928396618}
[I 2026-06-01 01:45:07,042] Trial 126 finished with value: 0.21738343126894133 and parameters: {'alpha': 188380.32531415566, 'n_pcs': 4000, 'weight_scheme': 'exponential', 'weight_clip_max': 10.0, 'weight_exponential_beta': 5.048431928396618}. Best is trial 67 with value: 0.22356194409955688.
2026-06-01 01:45:07 | INFO | src.nested_cv_avggrm_weighted_unified | Trial 127 | outer=8 | alpha=2.471e+05 n_pcs=4500 (pc_topk) weight_search=on
2026-06-01 01:45:07 | INFO | src.nested_cv_avggrm_weighted_unified | Trial 127 | outer=8 | weight={'name': 'exponential', 'floor': 1e-06, 'clip_max': 20.0, 'beta': 6.03393699208121}
[I 2026-06-01 01:45:13,936] Trial 127 finished with value: 0.20889188468437045 and parameters: {'alpha': 247141.68813301178, 'n_pcs': 4500, 'weight_scheme': 'exponential', 'weight_clip_max': 20.0, 'weight_exponential_beta': 6.03393699208121}. Best is trial 67 with value: 0.22356194409955688.
2026-06-01 01:45:13 | INFO | src.nested_cv_avggrm_weighted_unified | Trial 128 | outer=8 | alpha=4.359e+05 n_pcs=4000 (pc_topk) weight_search=on
2026-06-01 01:45:13 | INFO | src.nested_cv_avggrm_weighted_unified | Trial 128 | outer=8 | weight={'name': 'exponential', 'floor': 1e-06, 'clip_max': 5.0, 'beta': 6.498495435819278}
[I 2026-06-01 01:45:19,840] Trial 128 finished with value: 0.2218444435159876 and parameters: {'alpha': 435862.27301571204, 'n_pcs': 4000, 'weight_scheme': 'exponential', 'weight_clip_max': 5.0, 'weight_exponential_beta': 6.498495435819278}. Best is trial 67 with value: 0.22356194409955688.
2026-06-01 01:45:19 | INFO | src.nested_cv_avggrm_weighted_unified | Trial 129 | outer=8 | alpha=1.413e+05 n_pcs=3500 (pc_topk) weight_search=on
2026-06-01 01:45:19 | INFO | src.nested_cv_avggrm_weighted_unified | Trial 129 | outer=8 | weight={'name': 'exponential', 'floor': 1e-06, 'clip_max': 5.0, 'beta': 5.609480102259175}
[I 2026-06-01 01:45:24,695] Trial 129 finished with value: 0.22157194416953904 and parameters: {'alpha': 141304.66118147862, 'n_pcs': 3500, 'weight_scheme': 'exponential', 'weight_clip_max': 5.0, 'weight_exponential_beta': 5.609480102259175}. Best is trial 67 with value: 0.22356194409955688.
2026-06-01 01:45:24 | INFO | src.nested_cv_avggrm_weighted_unified | Trial 130 | outer=8 | alpha=5.428e+05 n_pcs=4500 (pc_topk) weight_search=on
2026-06-01 01:45:24 | INFO | src.nested_cv_avggrm_weighted_unified | Trial 130 | outer=8 | weight={'name': 'exponential', 'floor': 1e-06, 'clip_max': 3.0, 'beta': 5.325722521538724}
[I 2026-06-01 01:45:31,623] Trial 130 finished with value: 0.21661735520953918 and parameters: {'alpha': 542847.6219198513, 'n_pcs': 4500, 'weight_scheme': 'exponential', 'weight_clip_max': 3.0, 'weight_exponential_beta': 5.325722521538724}. Best is trial 67 with value: 0.22356194409955688.
2026-06-01 01:45:31 | INFO | src.nested_cv_avggrm_weighted_unified | Trial 131 | outer=8 | alpha=2.514e+05 n_pcs=4000 (pc_topk) weight_search=on
2026-06-01 01:45:31 | INFO | src.nested_cv_avggrm_weighted_unified | Trial 131 | outer=8 | weight={'name': 'exponential', 'floor': 1e-06, 'clip_max': 5.0, 'beta': 5.854911632055744}
[I 2026-06-01 01:45:37,324] Trial 131 finished with value: 0.2228541254116037 and parameters: {'alpha': 251444.16267961677, 'n_pcs': 4000, 'weight_scheme': 'exponential', 'weight_clip_max': 5.0, 'weight_exponential_beta': 5.854911632055744}. Best is trial 67 with value: 0.22356194409955688.
2026-06-01 01:45:37 | INFO | src.nested_cv_avggrm_weighted_unified | Trial 132 | outer=8 | alpha=1.702e+05 n_pcs=4000 (pc_topk) weight_search=on
2026-06-01 01:45:37 | INFO | src.nested_cv_avggrm_weighted_unified | Trial 132 | outer=8 | weight={'name': 'exponential', 'floor': 1e-06, 'clip_max': 5.0, 'beta': 6.201606404731528}
[I 2026-06-01 01:45:43,037] Trial 132 finished with value: 0.22297581017662696 and parameters: {'alpha': 170182.5056162957, 'n_pcs': 4000, 'weight_scheme': 'exponential', 'weight_clip_max': 5.0, 'weight_exponential_beta': 6.201606404731528}. Best is trial 67 with value: 0.22356194409955688.
2026-06-01 01:45:43 | INFO | src.nested_cv_avggrm_weighted_unified | Trial 133 | outer=8 | alpha=1.667e+05 n_pcs=4000 (pc_topk) weight_search=on
2026-06-01 01:45:43 | INFO | src.nested_cv_avggrm_weighted_unified | Trial 133 | outer=8 | weight={'name': 'exponential', 'floor': 1e-06, 'clip_max': 5.0, 'beta': 6.132003862927903}
[I 2026-06-01 01:45:48,834] Trial 133 finished with value: 0.22298209222172255 and parameters: {'alpha': 166710.5798785366, 'n_pcs': 4000, 'weight_scheme': 'exponential', 'weight_clip_max': 5.0, 'weight_exponential_beta': 6.132003862927903}. Best is trial 67 with value: 0.22356194409955688.
2026-06-01 01:45:48 | INFO | src.nested_cv_avggrm_weighted_unified | Trial 134 | outer=8 | alpha=1.019e+05 n_pcs=4000 (pc_topk) weight_search=on
2026-06-01 01:45:48 | INFO | src.nested_cv_avggrm_weighted_unified | Trial 134 | outer=8 | weight={'name': 'exponential', 'floor': 1e-06, 'clip_max': 5.0, 'beta': 6.118664865152599}
[I 2026-06-01 01:45:54,785] Trial 134 finished with value: 0.22205020366179876 and parameters: {'alpha': 101916.43408333816, 'n_pcs': 4000, 'weight_scheme': 'exponential', 'weight_clip_max': 5.0, 'weight_exponential_beta': 6.118664865152599}. Best is trial 67 with value: 0.22356194409955688.
2026-06-01 01:45:54 | INFO | src.nested_cv_avggrm_weighted_unified | Trial 135 | outer=8 | alpha=1.738e+05 n_pcs=4000 (pc_topk) weight_search=on
2026-06-01 01:45:54 | INFO | src.nested_cv_avggrm_weighted_unified | Trial 135 | outer=8 | weight={'name': 'exponential', 'floor': 1e-06, 'clip_max': 5.0, 'beta': 6.163908329461737}
[I 2026-06-01 01:46:00,522] Trial 135 finished with value: 0.22300120616694158 and parameters: {'alpha': 173835.62489207313, 'n_pcs': 4000, 'weight_scheme': 'exponential', 'weight_clip_max': 5.0, 'weight_exponential_beta': 6.163908329461737}. Best is trial 67 with value: 0.22356194409955688.
2026-06-01 01:46:00 | INFO | src.nested_cv_avggrm_weighted_unified | Trial 136 | outer=8 | alpha=1.800e+05 n_pcs=4000 (pc_topk) weight_search=on
2026-06-01 01:46:00 | INFO | src.nested_cv_avggrm_weighted_unified | Trial 136 | outer=8 | weight={'name': 'exponential', 'floor': 1e-06, 'clip_max': 5.0, 'beta': 9.291691133644917}
[I 2026-06-01 01:46:06,280] Trial 136 finished with value: 0.21947221343822623 and parameters: {'alpha': 180040.22999236663, 'n_pcs': 4000, 'weight_scheme': 'exponential', 'weight_clip_max': 5.0, 'weight_exponential_beta': 9.291691133644917}. Best is trial 67 with value: 0.22356194409955688.
2026-06-01 01:46:06 | INFO | src.nested_cv_avggrm_weighted_unified | Trial 137 | outer=8 | alpha=3.590e+03 n_pcs=4000 (pc_topk) weight_search=on
2026-06-01 01:46:06 | INFO | src.nested_cv_avggrm_weighted_unified | Trial 137 | outer=8 | weight={'name': 'exponential', 'floor': 1e-06, 'clip_max': 5.0, 'beta': 6.2822679762672085}
2026-06-01 01:46:09 | INFO | src.nested_cv_avggrm_weighted_unified | Trial 137 | outer=8 | pruned after 5/10 inner folds (mean r=0.1929)
