[I 2026-06-01 02:10:26,073] Trial 152 finished with value: 0.2333281440883732 and parameters: {'alpha': 105802.26972278643, 'n_pcs': 3000, 'weight_scheme': 'exponential', 'weight_clip_max': 3.0, 'weight_exponential_beta': 8.495099106644695}. Best is trial 133 with value: 0.23467014124689958.
2026-06-01 02:10:26 | INFO | src.nested_cv_avggrm_weighted_unified | Trial 153 | outer=9 | alpha=1.277e+05 n_pcs=3000 (pc_topk) weight_search=on
2026-06-01 02:10:26 | INFO | src.nested_cv_avggrm_weighted_unified | Trial 153 | outer=9 | weight={'name': 'exponential', 'floor': 1e-06, 'clip_max': 3.0, 'beta': 8.688344614217902}
[I 2026-06-01 02:10:29,901] Trial 153 finished with value: 0.23395194243050196 and parameters: {'alpha': 127716.32424955211, 'n_pcs': 3000, 'weight_scheme': 'exponential', 'weight_clip_max': 3.0, 'weight_exponential_beta': 8.688344614217902}. Best is trial 133 with value: 0.23467014124689958.
2026-06-01 02:10:29 | INFO | src.nested_cv_avggrm_weighted_unified | Trial 154 | outer=9 | alpha=1.498e+05 n_pcs=3000 (pc_topk) weight_search=on
2026-06-01 02:10:29 | INFO | src.nested_cv_avggrm_weighted_unified | Trial 154 | outer=9 | weight={'name': 'exponential', 'floor': 1e-06, 'clip_max': 3.0, 'beta': 8.231532335753558}
[I 2026-06-01 02:10:33,687] Trial 154 finished with value: 0.23455403081340762 and parameters: {'alpha': 149809.14033347904, 'n_pcs': 3000, 'weight_scheme': 'exponential', 'weight_clip_max': 3.0, 'weight_exponential_beta': 8.231532335753558}. Best is trial 133 with value: 0.23467014124689958.
2026-06-01 02:10:33 | INFO | src.nested_cv_avggrm_weighted_unified | Trial 155 | outer=9 | alpha=1.409e+05 n_pcs=3000 (pc_topk) weight_search=on
2026-06-01 02:10:33 | INFO | src.nested_cv_avggrm_weighted_unified | Trial 155 | outer=9 | weight={'name': 'exponential', 'floor': 1e-06, 'clip_max': 3.0, 'beta': 8.200971895763525}
[I 2026-06-01 02:10:37,570] Trial 155 finished with value: 0.23446076439525237 and parameters: {'alpha': 140946.58231409863, 'n_pcs': 3000, 'weight_scheme': 'exponential', 'weight_clip_max': 3.0, 'weight_exponential_beta': 8.200971895763525}. Best is trial 133 with value: 0.23467014124689958.
2026-06-01 02:10:37 | INFO | src.nested_cv_avggrm_weighted_unified | Trial 156 | outer=9 | alpha=1.619e+05 n_pcs=3000 (pc_topk) weight_search=on
2026-06-01 02:10:37 | INFO | src.nested_cv_avggrm_weighted_unified | Trial 156 | outer=9 | weight={'name': 'exponential', 'floor': 1e-06, 'clip_max': 3.0, 'beta': 8.199555244324603}
[I 2026-06-01 02:10:41,433] Trial 156 finished with value: 0.23462057497733996 and parameters: {'alpha': 161888.70236485187, 'n_pcs': 3000, 'weight_scheme': 'exponential', 'weight_clip_max': 3.0, 'weight_exponential_beta': 8.199555244324603}. Best is trial 133 with value: 0.23467014124689958.
2026-06-01 02:10:41 | INFO | src.nested_cv_avggrm_weighted_unified | Trial 157 | outer=9 | alpha=1.410e+05 n_pcs=3500 (pc_topk) weight_search=on
2026-06-01 02:10:41 | INFO | src.nested_cv_avggrm_weighted_unified | Trial 157 | outer=9 | weight={'name': 'exponential', 'floor': 1e-06, 'clip_max': 3.0, 'beta': 8.196108748060654}
[I 2026-06-01 02:10:46,363] Trial 157 finished with value: 0.23310951563876542 and parameters: {'alpha': 140999.30082983564, 'n_pcs': 3500, 'weight_scheme': 'exponential', 'weight_clip_max': 3.0, 'weight_exponential_beta': 8.196108748060654}. Best is trial 133 with value: 0.23467014124689958.
2026-06-01 02:10:46 | INFO | src.nested_cv_avggrm_weighted_unified | Trial 158 | outer=9 | alpha=1.052e+05 n_pcs=3000 (pc_topk) weight_search=on
2026-06-01 02:10:46 | INFO | src.nested_cv_avggrm_weighted_unified | Trial 158 | outer=9 | weight={'name': 'exponential', 'floor': 1e-06, 'clip_max': 3.0, 'beta': 7.739855304336372}
[I 2026-06-01 02:10:50,170] Trial 158 finished with value: 0.2337575127619366 and parameters: {'alpha': 105162.58281888893, 'n_pcs': 3000, 'weight_scheme': 'exponential', 'weight_clip_max': 3.0, 'weight_exponential_beta': 7.739855304336372}. Best is trial 133 with value: 0.23467014124689958.
2026-06-01 02:10:50 | INFO | src.nested_cv_avggrm_weighted_unified | Trial 159 | outer=9 | alpha=1.565e+05 n_pcs=3000 (pc_topk) weight_search=on
2026-06-01 02:10:50 | INFO | src.nested_cv_avggrm_weighted_unified | Trial 159 | outer=9 | weight={'name': 'linear', 'floor': 1e-06, 'clip_max': 3.0, 'min_weight': 0.5384405804404568, 'max_weight': 1.548285517110684}
2026-06-01 02:10:53 | INFO | src.nested_cv_avggrm_weighted_unified | Trial 159 | outer=9 | pruned after 8/10 inner folds (mean r=0.2596)
[I 2026-06-01 02:10:53,397] Trial 159 pruned. 
2026-06-01 02:10:53 | INFO | src.nested_cv_avggrm_weighted_unified | Trial 160 | outer=9 | alpha=1.858e+05 n_pcs=3000 (pc_topk) weight_search=on
2026-06-01 02:10:53 | INFO | src.nested_cv_avggrm_weighted_unified | Trial 160 | outer=9 | weight={'name': 'exponential', 'floor': 1e-06, 'clip_max': None, 'beta': 8.00947101358701}
2026-06-01 02:10:56 | INFO | src.nested_cv_avggrm_weighted_unified | Trial 160 | outer=9 | pruned after 8/10 inner folds (mean r=0.2442)
[I 2026-06-01 02:10:56,441] Trial 160 pruned. 
2026-06-01 02:10:56 | INFO | src.nested_cv_avggrm_weighted_unified | Trial 161 | outer=9 | alpha=2.219e+05 n_pcs=3000 (pc_topk) weight_search=on
2026-06-01 02:10:56 | INFO | src.nested_cv_avggrm_weighted_unified | Trial 161 | outer=9 | weight={'name': 'exponential', 'floor': 1e-06, 'clip_max': 3.0, 'beta': 8.422803103818435}
[I 2026-06-01 02:11:00,238] Trial 161 finished with value: 0.23453479645235698 and parameters: {'alpha': 221909.91039027576, 'n_pcs': 3000, 'weight_scheme': 'exponential', 'weight_clip_max': 3.0, 'weight_exponential_beta': 8.422803103818435}. Best is trial 133 with value: 0.23467014124689958.
2026-06-01 02:11:00 | INFO | src.nested_cv_avggrm_weighted_unified | Trial 162 | outer=9 | alpha=1.495e+05 n_pcs=3000 (pc_topk) weight_search=on
2026-06-01 02:11:00 | INFO | src.nested_cv_avggrm_weighted_unified | Trial 162 | outer=9 | weight={'name': 'exponential', 'floor': 1e-06, 'clip_max': 3.0, 'beta': 8.540419385723858}
[I 2026-06-01 02:11:04,011] Trial 162 finished with value: 0.2344692997725748 and parameters: {'alpha': 149503.74304925767, 'n_pcs': 3000, 'weight_scheme': 'exponential', 'weight_clip_max': 3.0, 'weight_exponential_beta': 8.540419385723858}. Best is trial 133 with value: 0.23467014124689958.
2026-06-01 02:11:04 | INFO | src.nested_cv_avggrm_weighted_unified | Trial 163 | outer=9 | alpha=1.519e+05 n_pcs=3000 (pc_topk) weight_search=on
2026-06-01 02:11:04 | INFO | src.nested_cv_avggrm_weighted_unified | Trial 163 | outer=9 | weight={'name': 'exponential', 'floor': 1e-06, 'clip_max': 3.0, 'beta': 8.227948153964828}
[I 2026-06-01 02:11:07,858] Trial 163 finished with value: 0.23457056726421852 and parameters: {'alpha': 151890.21639977154, 'n_pcs': 3000, 'weight_scheme': 'exponential', 'weight_clip_max': 3.0, 'weight_exponential_beta': 8.227948153964828}. Best is trial 133 with value: 0.23467014124689958.
2026-06-01 02:11:07 | INFO | src.nested_cv_avggrm_weighted_unified | Trial 164 | outer=9 | alpha=1.862e+05 n_pcs=3000 (pc_topk) weight_search=on
2026-06-01 02:11:07 | INFO | src.nested_cv_avggrm_weighted_unified | Trial 164 | outer=9 | weight={'name': 'exponential', 'floor': 1e-06, 'clip_max': 3.0, 'beta': 8.169366143739813}
[I 2026-06-01 02:11:11,672] Trial 164 finished with value: 0.23460674365140402 and parameters: {'alpha': 186158.2900081575, 'n_pcs': 3000, 'weight_scheme': 'exponential', 'weight_clip_max': 3.0, 'weight_exponential_beta': 8.169366143739813}. Best is trial 133 with value: 0.23467014124689958.
2026-06-01 02:11:11 | INFO | src.nested_cv_avggrm_weighted_unified | Trial 165 | outer=9 | alpha=1.231e+05 n_pcs=3000 (pc_topk) weight_search=on
2026-06-01 02:11:11 | INFO | src.nested_cv_avggrm_weighted_unified | Trial 165 | outer=9 | weight={'name': 'exponential', 'floor': 1e-06, 'clip_max': 3.0, 'beta': 8.187630086933131}
[I 2026-06-01 02:11:15,473] Trial 165 finished with value: 0.2341456203808962 and parameters: {'alpha': 123082.38436058644, 'n_pcs': 3000, 'weight_scheme': 'exponential', 'weight_clip_max': 3.0, 'weight_exponential_beta': 8.187630086933131}. Best is trial 133 with value: 0.23467014124689958.
2026-06-01 02:11:15 | INFO | src.nested_cv_avggrm_weighted_unified | Trial 166 | outer=9 | alpha=1.792e+05 n_pcs=5000 (pc_topk) weight_search=on
2026-06-01 02:11:15 | INFO | src.nested_cv_avggrm_weighted_unified | Trial 166 | outer=9 | weight={'name': 'exponential', 'floor': 1e-06, 'clip_max': 3.0, 'beta': 7.960522027139486}
[I 2026-06-01 02:11:23,688] Trial 166 finished with value: 0.2325678571116682 and parameters: {'alpha': 179163.07306084622, 'n_pcs': 5000, 'weight_scheme': 'exponential', 'weight_clip_max': 3.0, 'weight_exponential_beta': 7.960522027139486}. Best is trial 133 with value: 0.23467014124689958.
2026-06-01 02:11:23 | INFO | src.nested_cv_avggrm_weighted_unified | Trial 167 | outer=9 | alpha=1.464e+05 n_pcs=3000 (pc_topk) weight_search=on
2026-06-01 02:11:23 | INFO | src.nested_cv_avggrm_weighted_unified | Trial 167 | outer=9 | weight={'name': 'exponential', 'floor': 1e-06, 'clip_max': 3.0, 'beta': 8.519388650997145}
[I 2026-06-01 02:11:27,505] Trial 167 finished with value: 0.2344375744879915 and parameters: {'alpha': 146351.04268740077, 'n_pcs': 3000, 'weight_scheme': 'exponential', 'weight_clip_max': 3.0, 'weight_exponential_beta': 8.519388650997145}. Best is trial 133 with value: 0.23467014124689958.
2026-06-01 02:11:27 | INFO | src.nested_cv_avggrm_weighted_unified | Trial 168 | outer=9 | alpha=5.775e+03 n_pcs=3500 (pc_topk) weight_search=on
2026-06-01 02:11:27 | INFO | src.nested_cv_avggrm_weighted_unified | Trial 168 | outer=9 | weight={'name': 'exponential', 'floor': 1e-06, 'clip_max': 10.0, 'beta': 8.171018998101378}
2026-06-01 02:11:29 | INFO | src.nested_cv_avggrm_weighted_unified | Trial 168 | outer=9 | pruned after 5/10 inner folds (mean r=0.1954)
[I 2026-06-01 02:11:29,971] Trial 168 pruned. 
2026-06-01 02:11:29 | INFO | src.nested_cv_avggrm_weighted_unified | Trial 169 | outer=9 | alpha=1.081e+05 n_pcs=3000 (pc_topk) weight_search=on
2026-06-01 02:11:29 | INFO | src.nested_cv_avggrm_weighted_unified | Trial 169 | outer=9 | weight={'name': 'uniform', 'floor': 1e-06, 'clip_max': 3.0}
2026-06-01 02:11:32 | INFO | src.nested_cv_avggrm_weighted_unified | Trial 169 | outer=9 | pruned after 8/10 inner folds (mean r=0.2497)
[I 2026-06-01 02:11:32,926] Trial 169 pruned. 
2026-06-01 02:11:32 | INFO | src.nested_cv_avggrm_weighted_unified | Trial 170 | outer=9 | alpha=2.041e+05 n_pcs=3000 (pc_topk) weight_search=on
2026-06-01 02:11:32 | INFO | src.nested_cv_avggrm_weighted_unified | Trial 170 | outer=9 | weight={'name': 'exponential', 'floor': 1e-06, 'clip_max': 3.0, 'beta': 8.664906962456907}
[I 2026-06-01 02:11:36,854] Trial 170 finished with value: 0.23467954492846982 and parameters: {'alpha': 204102.75665385867, 'n_pcs': 3000, 'weight_scheme': 'exponential', 'weight_clip_max': 3.0, 'weight_exponential_beta': 8.664906962456907}. Best is trial 170 with value: 0.23467954492846982.
2026-06-01 02:11:36 | INFO | src.nested_cv_avggrm_weighted_unified | OUTER 9 | new best trial 170 (mean inner r=0.2347) saved to outputs/final_results/e6_pc_ridge_avggrm/thr_wing/e6_pc_ridge_avggrm_thr_wing_best_trials/split_09_best_trial.json
2026-06-01 02:11:36 | INFO | src.nested_cv_avggrm_weighted_unified | Trial 171 | outer=9 | alpha=1.974e+05 n_pcs=3000 (pc_topk) weight_search=on
2026-06-01 02:11:36 | INFO | src.nested_cv_avggrm_weighted_unified | Trial 171 | outer=9 | weight={'name': 'exponential', 'floor': 1e-06, 'clip_max': 3.0, 'beta': 8.62344111121323}
[I 2026-06-01 02:11:41,233] Trial 171 finished with value: 0.23468725748470587 and parameters: {'alpha': 197428.61385474537, 'n_pcs': 3000, 'weight_scheme': 'exponential', 'weight_clip_max': 3.0, 'weight_exponential_beta': 8.62344111121323}. Best is trial 171 with value: 0.23468725748470587.
2026-06-01 02:11:41 | INFO | src.nested_cv_avggrm_weighted_unified | OUTER 9 | new best trial 171 (mean inner r=0.2347) saved to outputs/final_results/e6_pc_ridge_avggrm/thr_wing/e6_pc_ridge_avggrm_thr_wing_best_trials/split_09_best_trial.json
2026-06-01 02:11:41 | INFO | src.nested_cv_avggrm_weighted_unified | Trial 172 | outer=9 | alpha=1.991e+05 n_pcs=3000 (pc_topk) weight_search=on
2026-06-01 02:11:41 | INFO | src.nested_cv_avggrm_weighted_unified | Trial 172 | outer=9 | weight={'name': 'exponential', 'floor': 1e-06, 'clip_max': 3.0, 'beta': 8.628784191919456}
[I 2026-06-01 02:11:45,281] Trial 172 finished with value: 0.23468591276501952 and parameters: {'alpha': 199081.94255625378, 'n_pcs': 3000, 'weight_scheme': 'exponential', 'weight_clip_max': 3.0, 'weight_exponential_beta': 8.628784191919456}. Best is trial 171 with value: 0.23468725748470587.
2026-06-01 02:11:45 | INFO | src.nested_cv_avggrm_weighted_unified | Trial 173 | outer=9 | alpha=2.066e+05 n_pcs=3000 (pc_topk) weight_search=on
2026-06-01 02:11:45 | INFO | src.nested_cv_avggrm_weighted_unified | Trial 173 | outer=9 | weight={'name': 'exponential', 'floor': 1e-06, 'clip_max': 3.0, 'beta': 8.715016625101441}
[I 2026-06-01 02:11:49,085] Trial 173 finished with value: 0.23467694859593352 and parameters: {'alpha': 206592.808769348, 'n_pcs': 3000, 'weight_scheme': 'exponential', 'weight_clip_max': 3.0, 'weight_exponential_beta': 8.715016625101441}. Best is trial 171 with value: 0.23468725748470587.
2026-06-01 02:11:49 | INFO | src.nested_cv_avggrm_weighted_unified | Trial 174 | outer=9 | alpha=1.938e+05 n_pcs=3000 (pc_topk) weight_search=on
2026-06-01 02:11:49 | INFO | src.nested_cv_avggrm_weighted_unified | Trial 174 | outer=9 | weight={'name': 'exponential', 'floor': 1e-06, 'clip_max': 3.0, 'beta': 8.663138503575343}
[I 2026-06-01 02:11:52,867] Trial 174 finished with value: 0.23469062114588263 and parameters: {'alpha': 193767.91373495167, 'n_pcs': 3000, 'weight_scheme': 'exponential', 'weight_clip_max': 3.0, 'weight_exponential_beta': 8.663138503575343}. Best is trial 174 with value: 0.23469062114588263.
2026-06-01 02:11:52 | INFO | src.nested_cv_avggrm_weighted_unified | OUTER 9 | new best trial 174 (mean inner r=0.2347) saved to outputs/final_results/e6_pc_ridge_avggrm/thr_wing/e6_pc_ridge_avggrm_thr_wing_best_trials/split_09_best_trial.json
2026-06-01 02:11:52 | INFO | src.nested_cv_avggrm_weighted_unified | Trial 175 | outer=9 | alpha=2.085e+05 n_pcs=3000 (pc_topk) weight_search=on
2026-06-01 02:11:52 | INFO | src.nested_cv_avggrm_weighted_unified | Trial 175 | outer=9 | weight={'name': 'exponential', 'floor': 1e-06, 'clip_max': 3.0, 'beta': 9.020284323047065}
[I 2026-06-01 02:11:56,807] Trial 175 finished with value: 0.2345977826640941 and parameters: {'alpha': 208456.01259923697, 'n_pcs': 3000, 'weight_scheme': 'exponential', 'weight_clip_max': 3.0, 'weight_exponential_beta': 9.020284323047065}. Best is trial 174 with value: 0.23469062114588263.
2026-06-01 02:11:56 | INFO | src.nested_cv_avggrm_weighted_unified | Trial 176 | outer=9 | alpha=1.962e+05 n_pcs=3000 (pc_topk) weight_search=on
2026-06-01 02:11:56 | INFO | src.nested_cv_avggrm_weighted_unified | Trial 176 | outer=9 | weight={'name': 'exponential', 'floor': 1e-06, 'clip_max': 3.0, 'beta': 9.107166694475474}
[I 2026-06-01 02:12:00,669] Trial 176 finished with value: 0.234511403852947 and parameters: {'alpha': 196160.9745470232, 'n_pcs': 3000, 'weight_scheme': 'exponential', 'weight_clip_max': 3.0, 'weight_exponential_beta': 9.107166694475474}. Best is trial 174 with value: 0.23469062114588263.
2026-06-01 02:12:00 | INFO | src.nested_cv_avggrm_weighted_unified | Trial 177 | outer=9 | alpha=2.056e+05 n_pcs=3000 (pc_topk) weight_search=on
2026-06-01 02:12:00 | INFO | src.nested_cv_avggrm_weighted_unified | Trial 177 | outer=9 | weight={'name': 'exponential', 'floor': 1e-06, 'clip_max': 3.0, 'beta': 9.440283177000383}
[I 2026-06-01 02:12:04,427] Trial 177 finished with value: 0.2341889726034426 and parameters: {'alpha': 205627.68838579542, 'n_pcs': 3000, 'weight_scheme': 'exponential', 'weight_clip_max': 3.0, 'weight_exponential_beta': 9.440283177000383}. Best is trial 174 with value: 0.23469062114588263.
2026-06-01 02:12:04 | INFO | src.nested_cv_avggrm_weighted_unified | Trial 178 | outer=9 | alpha=1.851e+05 n_pcs=3000 (pc_topk) weight_search=on
2026-06-01 02:12:04 | INFO | src.nested_cv_avggrm_weighted_unified | Trial 178 | outer=9 | weight={'name': 'exponential', 'floor': 1e-06, 'clip_max': 20.0, 'beta': 9.08978246362713}
[I 2026-06-01 02:12:08,312] Trial 178 finished with value: 0.2214102053598857 and parameters: {'alpha': 185142.2189723466, 'n_pcs': 3000, 'weight_scheme': 'exponential', 'weight_clip_max': 20.0, 'weight_exponential_beta': 9.08978246362713}. Best is trial 174 with value: 0.23469062114588263.
2026-06-01 02:12:08 | INFO | src.nested_cv_avggrm_weighted_unified | Trial 179 | outer=9 | alpha=1.982e+05 n_pcs=2500 (pc_topk) weight_search=on
2026-06-01 02:12:08 | INFO | src.nested_cv_avggrm_weighted_unified | Trial 179 | outer=9 | weight={'name': 'exponential', 'floor': 1e-06, 'clip_max': 3.0, 'beta': 8.993571671986775}
2026-06-01 02:12:10 | INFO | src.nested_cv_avggrm_weighted_unified | Trial 179 | outer=9 | pruned after 8/10 inner folds (mean r=0.2637)
[I 2026-06-01 02:12:10,900] Trial 179 pruned. 
2026-06-01 02:12:10 | INFO | src.nested_cv_avggrm_weighted_unified | Trial 180 | outer=9 | alpha=1.736e+05 n_pcs=3000 (pc_topk) weight_search=on
2026-06-01 02:12:10 | INFO | src.nested_cv_avggrm_weighted_unified | Trial 180 | outer=9 | weight={'name': 'exponential', 'floor': 1e-06, 'clip_max': 3.0, 'beta': 8.774681788548007}
[I 2026-06-01 02:12:14,794] Trial 180 finished with value: 0.23460765105697406 and parameters: {'alpha': 173635.7381601922, 'n_pcs': 3000, 'weight_scheme': 'exponential', 'weight_clip_max': 3.0, 'weight_exponential_beta': 8.774681788548007}. Best is trial 174 with value: 0.23469062114588263.
2026-06-01 02:12:14 | INFO | src.nested_cv_avggrm_weighted_unified | Trial 181 | outer=9 | alpha=1.757e+05 n_pcs=3000 (pc_topk) weight_search=on
2026-06-01 02:12:14 | INFO | src.nested_cv_avggrm_weighted_unified | Trial 181 | outer=9 | weight={'name': 'exponential', 'floor': 1e-06, 'clip_max': 3.0, 'beta': 8.672109609614719}
[I 2026-06-01 02:12:18,564] Trial 181 finished with value: 0.2346516573661271 and parameters: {'alpha': 175695.58446586522, 'n_pcs': 3000, 'weight_scheme': 'exponential', 'weight_clip_max': 3.0, 'weight_exponential_beta': 8.672109609614719}. Best is trial 174 with value: 0.23469062114588263.
2026-06-01 02:12:18 | INFO | src.nested_cv_avggrm_weighted_unified | Trial 182 | outer=9 | alpha=1.776e+05 n_pcs=3000 (pc_topk) weight_search=on
2026-06-01 02:12:18 | INFO | src.nested_cv_avggrm_weighted_unified | Trial 182 | outer=9 | weight={'name': 'exponential', 'floor': 1e-06, 'clip_max': 3.0, 'beta': 8.724062883573367}
[I 2026-06-01 02:12:22,398] Trial 182 finished with value: 0.23464701314858188 and parameters: {'alpha': 177582.79506339916, 'n_pcs': 3000, 'weight_scheme': 'exponential', 'weight_clip_max': 3.0, 'weight_exponential_beta': 8.724062883573367}. Best is trial 174 with value: 0.23469062114588263.
2026-06-01 02:12:22 | INFO | src.nested_cv_avggrm_weighted_unified | Trial 183 | outer=9 | alpha=1.683e+05 n_pcs=3000 (pc_topk) weight_search=on
2026-06-01 02:12:22 | INFO | src.nested_cv_avggrm_weighted_unified | Trial 183 | outer=9 | weight={'name': 'exponential', 'floor': 1e-06, 'clip_max': 3.0, 'beta': 8.673304594497267}
[I 2026-06-01 02:12:26,250] Trial 183 finished with value: 0.23460960518975651 and parameters: {'alpha': 168276.5858727093, 'n_pcs': 3000, 'weight_scheme': 'exponential', 'weight_clip_max': 3.0, 'weight_exponential_beta': 8.673304594497267}. Best is trial 174 with value: 0.23469062114588263.
2026-06-01 02:12:26 | INFO | src.nested_cv_avggrm_weighted_unified | Trial 184 | outer=9 | alpha=1.198e+05 n_pcs=3000 (pc_topk) weight_search=on
2026-06-01 02:12:26 | INFO | src.nested_cv_avggrm_weighted_unified | Trial 184 | outer=9 | weight={'name': 'exponential', 'floor': 1e-06, 'clip_max': 3.0, 'beta': 8.65364496849893}
[I 2026-06-01 02:12:30,079] Trial 184 finished with value: 0.2337390684864193 and parameters: {'alpha': 119822.84730811526, 'n_pcs': 3000, 'weight_scheme': 'exponential', 'weight_clip_max': 3.0, 'weight_exponential_beta': 8.65364496849893}. Best is trial 174 with value: 0.23469062114588263.
2026-06-01 02:12:30 | INFO | src.nested_cv_avggrm_weighted_unified | Trial 185 | outer=9 | alpha=1.670e+05 n_pcs=3000 (pc_topk) weight_search=on
2026-06-01 02:12:30 | INFO | src.nested_cv_avggrm_weighted_unified | Trial 185 | outer=9 | weight={'name': 'exponential', 'floor': 1e-06, 'clip_max': 3.0, 'beta': 8.705551279926201}
[I 2026-06-01 02:12:33,874] Trial 185 finished with value: 0.2345891511494666 and parameters: {'alpha': 166998.8951875631, 'n_pcs': 3000, 'weight_scheme': 'exponential', 'weight_clip_max': 3.0, 'weight_exponential_beta': 8.705551279926201}. Best is trial 174 with value: 0.23469062114588263.
2026-06-01 02:12:33 | INFO | src.nested_cv_avggrm_weighted_unified | Trial 186 | outer=9 | alpha=1.746e+05 n_pcs=3000 (pc_topk) weight_search=on
2026-06-01 02:12:33 | INFO | src.nested_cv_avggrm_weighted_unified | Trial 186 | outer=9 | weight={'name': 'exponential', 'floor': 1e-06, 'clip_max': 3.0, 'beta': 8.684509273111471}
[I 2026-06-01 02:12:37,691] Trial 186 finished with value: 0.23464332009687078 and parameters: {'alpha': 174576.54215832235, 'n_pcs': 3000, 'weight_scheme': 'exponential', 'weight_clip_max': 3.0, 'weight_exponential_beta': 8.684509273111471}. Best is trial 174 with value: 0.23469062114588263.
2026-06-01 02:12:37 | INFO | src.nested_cv_avggrm_weighted_unified | Trial 187 | outer=9 | alpha=1.764e+05 n_pcs=3500 (pc_topk) weight_search=on
2026-06-01 02:12:37 | INFO | src.nested_cv_avggrm_weighted_unified | Trial 187 | outer=9 | weight={'name': 'exponential', 'floor': 1e-06, 'clip_max': 3.0, 'beta': 8.727929723329806}
