[I 2026-06-01 16:33:36,099] Trial 166 finished with value: 0.2061128913283748 and parameters: {'alpha': 87527.17963916631, 'n_pcs': 5000, 'iw_method': 'pc_logistic', 'iw_clip_max': 2.5, 'iw_prob_clip': 0.0006307719990856066, 'iw_n_components': 60, 'iw_logistic_c': 2.1544891737216426e-05, 'iw_pca_fit': 'combined', 'iw_solver': 'lbfgs', 'iw_rho': 0.5}. Best is trial 144 with value: 0.20790406387774057.
2026-06-01 16:33:36 | INFO | Trial 167 | outer=3 | alpha=1.195e+05 n_pcs=1000 (pc_topk) weight={'name': 'pc_logistic', 'floor': 1e-06, 'clip_max': 2.5, 'prob_clip': 0.011972477757973585, 'n_components': 60, 'logistic_c': 1.0263090632032288e-05, 'pca_fit': 'combined', 'solver': 'lbfgs', 'max_iter': 2000, 'fit_intercept': True, 'standardize_with_source': True, 'rho': 0.5}
[I 2026-06-01 16:33:43,546] Trial 167 finished with value: 0.1951156410416126 and parameters: {'alpha': 119546.30969110852, 'n_pcs': 1000, 'iw_method': 'pc_logistic', 'iw_clip_max': 2.5, 'iw_prob_clip': 0.011972477757973585, 'iw_n_components': 60, 'iw_logistic_c': 1.0263090632032288e-05, 'iw_pca_fit': 'combined', 'iw_solver': 'lbfgs', 'iw_rho': 0.5}. Best is trial 144 with value: 0.20790406387774057.
2026-06-01 16:33:43 | INFO | Trial 168 | outer=3 | alpha=5.207e+04 n_pcs=4500 (pc_topk) weight={'name': 'pc_logistic', 'floor': 1e-06, 'clip_max': 2.5, 'prob_clip': 0.0005041294455005595, 'n_components': 60, 'logistic_c': 4.32173626291255e-05, 'pca_fit': 'combined', 'solver': 'lbfgs', 'max_iter': 2000, 'fit_intercept': True, 'standardize_with_source': True, 'rho': 0.5}
[I 2026-06-01 16:34:00,600] Trial 168 finished with value: 0.2065278429008061 and parameters: {'alpha': 52066.93340653028, 'n_pcs': 4500, 'iw_method': 'pc_logistic', 'iw_clip_max': 2.5, 'iw_prob_clip': 0.0005041294455005595, 'iw_n_components': 60, 'iw_logistic_c': 4.32173626291255e-05, 'iw_pca_fit': 'combined', 'iw_solver': 'lbfgs', 'iw_rho': 0.5}. Best is trial 144 with value: 0.20790406387774057.
2026-06-01 16:34:00 | INFO | Trial 169 | outer=3 | alpha=9.862e+04 n_pcs=4500 (pc_topk) weight={'name': 'pc_logistic', 'floor': 1e-06, 'clip_max': 2.5, 'prob_clip': 0.0059819640551108805, 'n_components': 60, 'logistic_c': 2.373286946033965e-05, 'pca_fit': 'combined', 'solver': 'lbfgs', 'max_iter': 2000, 'fit_intercept': True, 'standardize_with_source': True, 'rho': 0.5}
[I 2026-06-01 16:34:15,900] Trial 169 finished with value: 0.20728569862628374 and parameters: {'alpha': 98616.9016727554, 'n_pcs': 4500, 'iw_method': 'pc_logistic', 'iw_clip_max': 2.5, 'iw_prob_clip': 0.0059819640551108805, 'iw_n_components': 60, 'iw_logistic_c': 2.373286946033965e-05, 'iw_pca_fit': 'combined', 'iw_solver': 'lbfgs', 'iw_rho': 0.5}. Best is trial 144 with value: 0.20790406387774057.
2026-06-01 16:34:15 | INFO | Trial 170 | outer=3 | alpha=7.965e+04 n_pcs=4500 (pc_topk) weight={'name': 'pc_logistic', 'floor': 1e-06, 'clip_max': 2.5, 'prob_clip': 0.0005874153203014103, 'n_components': 60, 'logistic_c': 1.7815204877402446e-05, 'pca_fit': 'combined', 'solver': 'lbfgs', 'max_iter': 2000, 'fit_intercept': True, 'standardize_with_source': True, 'rho': 0.5}
[I 2026-06-01 16:34:30,722] Trial 170 finished with value: 0.207272792694905 and parameters: {'alpha': 79650.75858893426, 'n_pcs': 4500, 'iw_method': 'pc_logistic', 'iw_clip_max': 2.5, 'iw_prob_clip': 0.0005874153203014103, 'iw_n_components': 60, 'iw_logistic_c': 1.7815204877402446e-05, 'iw_pca_fit': 'combined', 'iw_solver': 'lbfgs', 'iw_rho': 0.5}. Best is trial 144 with value: 0.20790406387774057.
2026-06-01 16:34:30 | INFO | Trial 171 | outer=3 | alpha=5.823e+04 n_pcs=4500 (pc_topk) weight={'name': 'pc_logistic', 'floor': 1e-06, 'clip_max': 2.5, 'prob_clip': 0.0005550725998564935, 'n_components': 60, 'logistic_c': 3.5496294250377204e-05, 'pca_fit': 'combined', 'solver': 'lbfgs', 'max_iter': 2000, 'fit_intercept': True, 'standardize_with_source': True, 'rho': 0.5}
[I 2026-06-01 16:34:46,205] Trial 171 finished with value: 0.2069869724412683 and parameters: {'alpha': 58231.64367247463, 'n_pcs': 4500, 'iw_method': 'pc_logistic', 'iw_clip_max': 2.5, 'iw_prob_clip': 0.0005550725998564935, 'iw_n_components': 60, 'iw_logistic_c': 3.5496294250377204e-05, 'iw_pca_fit': 'combined', 'iw_solver': 'lbfgs', 'iw_rho': 0.5}. Best is trial 144 with value: 0.20790406387774057.
2026-06-01 16:34:46 | INFO | Trial 172 | outer=3 | alpha=1.152e+05 n_pcs=4500 (pc_topk) weight={'name': 'pc_logistic', 'floor': 1e-06, 'clip_max': 2.5, 'prob_clip': 0.0006288386044333562, 'n_components': 60, 'logistic_c': 2.759227037059093e-05, 'pca_fit': 'combined', 'solver': 'lbfgs', 'max_iter': 2000, 'fit_intercept': True, 'standardize_with_source': True, 'rho': 0.5}
[I 2026-06-01 16:35:01,227] Trial 172 finished with value: 0.20721411299978093 and parameters: {'alpha': 115210.95804882325, 'n_pcs': 4500, 'iw_method': 'pc_logistic', 'iw_clip_max': 2.5, 'iw_prob_clip': 0.0006288386044333562, 'iw_n_components': 60, 'iw_logistic_c': 2.759227037059093e-05, 'iw_pca_fit': 'combined', 'iw_solver': 'lbfgs', 'iw_rho': 0.5}. Best is trial 144 with value: 0.20790406387774057.
2026-06-01 16:35:01 | INFO | Trial 173 | outer=3 | alpha=7.127e+04 n_pcs=4500 (pc_topk) weight={'name': 'pc_logistic', 'floor': 1e-06, 'clip_max': 2.5, 'prob_clip': 0.0005392842560853021, 'n_components': 60, 'logistic_c': 1.5216290953087211e-05, 'pca_fit': 'combined', 'solver': 'lbfgs', 'max_iter': 2000, 'fit_intercept': True, 'standardize_with_source': True, 'rho': 0.5}
[I 2026-06-01 16:35:16,771] Trial 173 finished with value: 0.20721015498685386 and parameters: {'alpha': 71273.61482249586, 'n_pcs': 4500, 'iw_method': 'pc_logistic', 'iw_clip_max': 2.5, 'iw_prob_clip': 0.0005392842560853021, 'iw_n_components': 60, 'iw_logistic_c': 1.5216290953087211e-05, 'iw_pca_fit': 'combined', 'iw_solver': 'lbfgs', 'iw_rho': 0.5}. Best is trial 144 with value: 0.20790406387774057.
2026-06-01 16:35:16 | INFO | Trial 174 | outer=3 | alpha=1.312e+05 n_pcs=4500 (pc_topk) weight={'name': 'pc_logistic', 'floor': 1e-06, 'clip_max': 2.5, 'prob_clip': 0.0005878917595870556, 'n_components': 60, 'logistic_c': 3.93192707988456e-05, 'pca_fit': 'combined', 'solver': 'lbfgs', 'max_iter': 2000, 'fit_intercept': True, 'standardize_with_source': True, 'rho': 0.5}
[I 2026-06-01 16:35:32,305] Trial 174 finished with value: 0.2071183987961104 and parameters: {'alpha': 131205.94795543965, 'n_pcs': 4500, 'iw_method': 'pc_logistic', 'iw_clip_max': 2.5, 'iw_prob_clip': 0.0005878917595870556, 'iw_n_components': 60, 'iw_logistic_c': 3.93192707988456e-05, 'iw_pca_fit': 'combined', 'iw_solver': 'lbfgs', 'iw_rho': 0.5}. Best is trial 144 with value: 0.20790406387774057.
2026-06-01 16:35:32 | INFO | Trial 175 | outer=3 | alpha=8.969e+04 n_pcs=4500 (pc_topk) weight={'name': 'pc_logistic', 'floor': 1e-06, 'clip_max': 2.5, 'prob_clip': 0.0005496997865186449, 'n_components': 60, 'logistic_c': 3.096852314828025e-05, 'pca_fit': 'combined', 'solver': 'lbfgs', 'max_iter': 2000, 'fit_intercept': True, 'standardize_with_source': True, 'rho': 0.3}
[I 2026-06-01 16:35:47,810] Trial 175 finished with value: 0.20628845916404362 and parameters: {'alpha': 89693.37653531374, 'n_pcs': 4500, 'iw_method': 'pc_logistic', 'iw_clip_max': 2.5, 'iw_prob_clip': 0.0005496997865186449, 'iw_n_components': 60, 'iw_logistic_c': 3.096852314828025e-05, 'iw_pca_fit': 'combined', 'iw_solver': 'lbfgs', 'iw_rho': 0.3}. Best is trial 144 with value: 0.20790406387774057.
2026-06-01 16:35:47 | INFO | Trial 176 | outer=3 | alpha=1.081e+05 n_pcs=4500 (pc_topk) weight={'name': 'pc_logistic', 'floor': 1e-06, 'clip_max': 2.5, 'prob_clip': 0.000639041961426943, 'n_components': 60, 'logistic_c': 5.590872245346335e-06, 'pca_fit': 'combined', 'solver': 'lbfgs', 'max_iter': 2000, 'fit_intercept': True, 'standardize_with_source': True, 'rho': 0.5}
[I 2026-06-01 16:36:07,161] Trial 176 finished with value: 0.20478193948261886 and parameters: {'alpha': 108144.19868846094, 'n_pcs': 4500, 'iw_method': 'pc_logistic', 'iw_clip_max': 2.5, 'iw_prob_clip': 0.000639041961426943, 'iw_n_components': 60, 'iw_logistic_c': 5.590872245346335e-06, 'iw_pca_fit': 'combined', 'iw_solver': 'lbfgs', 'iw_rho': 0.5}. Best is trial 144 with value: 0.20790406387774057.
2026-06-01 16:36:07 | INFO | Trial 177 | outer=3 | alpha=4.805e+04 n_pcs=5000 (pc_topk) weight={'name': 'uniform'}
[I 2026-06-01 16:36:17,610] Trial 177 finished with value: 0.2013641351524525 and parameters: {'alpha': 48045.32092528323, 'n_pcs': 5000, 'iw_method': 'uniform'}. Best is trial 144 with value: 0.20790406387774057.
2026-06-01 16:36:17 | INFO | Trial 178 | outer=3 | alpha=6.485e+04 n_pcs=4500 (pc_topk) weight={'name': 'pc_logistic', 'floor': 1e-06, 'clip_max': 2.5, 'prob_clip': 0.0005023935089659994, 'n_components': 60, 'logistic_c': 1.2474682352816507e-05, 'pca_fit': 'combined', 'solver': 'lbfgs', 'max_iter': 2000, 'fit_intercept': True, 'standardize_with_source': True, 'rho': 1.0}
[I 2026-06-01 16:36:39,969] Trial 178 finished with value: 0.2079450425497808 and parameters: {'alpha': 64845.011794087455, 'n_pcs': 4500, 'iw_method': 'pc_logistic', 'iw_clip_max': 2.5, 'iw_prob_clip': 0.0005023935089659994, 'iw_n_components': 60, 'iw_logistic_c': 1.2474682352816507e-05, 'iw_pca_fit': 'combined', 'iw_solver': 'lbfgs', 'iw_rho': 1.0}. Best is trial 178 with value: 0.2079450425497808.
2026-06-01 16:36:39 | INFO | Trial 179 | outer=3 | alpha=8.178e+04 n_pcs=4500 (pc_topk) weight={'name': 'pc_logistic', 'floor': 1e-06, 'clip_max': 2.5, 'prob_clip': 0.0005069861533763875, 'n_components': 80, 'logistic_c': 1.0153449869602815e-05, 'pca_fit': 'combined', 'solver': 'lbfgs', 'max_iter': 2000, 'fit_intercept': True, 'standardize_with_source': True, 'rho': 1.0}
[I 2026-06-01 16:36:55,115] Trial 179 finished with value: 0.20823535455994152 and parameters: {'alpha': 81778.69757178982, 'n_pcs': 4500, 'iw_method': 'pc_logistic', 'iw_clip_max': 2.5, 'iw_prob_clip': 0.0005069861533763875, 'iw_n_components': 80, 'iw_logistic_c': 1.0153449869602815e-05, 'iw_pca_fit': 'combined', 'iw_solver': 'lbfgs', 'iw_rho': 1.0}. Best is trial 179 with value: 0.20823535455994152.
2026-06-01 16:36:55 | INFO | Trial 180 | outer=3 | alpha=7.767e+04 n_pcs=4500 (pc_topk) weight={'name': 'pc_logistic', 'floor': 1e-06, 'clip_max': 2.5, 'prob_clip': 0.000500911146328693, 'n_components': 80, 'logistic_c': 8.436045537408864e-06, 'pca_fit': 'combined', 'solver': 'lbfgs', 'max_iter': 2000, 'fit_intercept': True, 'standardize_with_source': True, 'rho': 1.0}
[I 2026-06-01 16:37:10,627] Trial 180 finished with value: 0.20777395515914013 and parameters: {'alpha': 77668.5058902495, 'n_pcs': 4500, 'iw_method': 'pc_logistic', 'iw_clip_max': 2.5, 'iw_prob_clip': 0.000500911146328693, 'iw_n_components': 80, 'iw_logistic_c': 8.436045537408864e-06, 'iw_pca_fit': 'combined', 'iw_solver': 'lbfgs', 'iw_rho': 1.0}. Best is trial 179 with value: 0.20823535455994152.
2026-06-01 16:37:10 | INFO | Trial 181 | outer=3 | alpha=7.828e+04 n_pcs=4500 (pc_topk) weight={'name': 'pc_logistic', 'floor': 1e-06, 'clip_max': 2.5, 'prob_clip': 0.0005030825100240924, 'n_components': 80, 'logistic_c': 3.273053883258753e-06, 'pca_fit': 'combined', 'solver': 'lbfgs', 'max_iter': 2000, 'fit_intercept': True, 'standardize_with_source': True, 'rho': 1.0}
[I 2026-06-01 16:37:25,751] Trial 181 finished with value: 0.20509817748574025 and parameters: {'alpha': 78279.34713251899, 'n_pcs': 4500, 'iw_method': 'pc_logistic', 'iw_clip_max': 2.5, 'iw_prob_clip': 0.0005030825100240924, 'iw_n_components': 80, 'iw_logistic_c': 3.273053883258753e-06, 'iw_pca_fit': 'combined', 'iw_solver': 'lbfgs', 'iw_rho': 1.0}. Best is trial 179 with value: 0.20823535455994152.
2026-06-01 16:37:25 | INFO | Trial 182 | outer=3 | alpha=8.492e+04 n_pcs=4500 (pc_topk) weight={'name': 'pc_logistic', 'floor': 1e-06, 'clip_max': 2.5, 'prob_clip': 0.0005056800067210462, 'n_components': 80, 'logistic_c': 8.432955163351523e-06, 'pca_fit': 'combined', 'solver': 'lbfgs', 'max_iter': 2000, 'fit_intercept': True, 'standardize_with_source': True, 'rho': 1.0}
[I 2026-06-01 16:37:42,993] Trial 182 finished with value: 0.20779713213117196 and parameters: {'alpha': 84918.46002353569, 'n_pcs': 4500, 'iw_method': 'pc_logistic', 'iw_clip_max': 2.5, 'iw_prob_clip': 0.0005056800067210462, 'iw_n_components': 80, 'iw_logistic_c': 8.432955163351523e-06, 'iw_pca_fit': 'combined', 'iw_solver': 'lbfgs', 'iw_rho': 1.0}. Best is trial 179 with value: 0.20823535455994152.
2026-06-01 16:37:43 | INFO | Trial 183 | outer=3 | alpha=5.598e+04 n_pcs=4500 (pc_topk) weight={'name': 'pc_logistic', 'floor': 1e-06, 'clip_max': 2.5, 'prob_clip': 0.0033825928830994137, 'n_components': 80, 'logistic_c': 1.7653139858337365e-06, 'pca_fit': 'combined', 'solver': 'lbfgs', 'max_iter': 2000, 'fit_intercept': True, 'standardize_with_source': True, 'rho': 1.0}
[I 2026-06-01 16:38:01,909] Trial 183 finished with value: 0.20436243288413883 and parameters: {'alpha': 55975.43039488983, 'n_pcs': 4500, 'iw_method': 'pc_logistic', 'iw_clip_max': 2.5, 'iw_prob_clip': 0.0033825928830994137, 'iw_n_components': 80, 'iw_logistic_c': 1.7653139858337365e-06, 'iw_pca_fit': 'combined', 'iw_solver': 'lbfgs', 'iw_rho': 1.0}. Best is trial 179 with value: 0.20823535455994152.
2026-06-01 16:38:01 | INFO | Trial 184 | outer=3 | alpha=1.293e+05 n_pcs=4500 (pc_topk) weight={'name': 'pc_logistic', 'floor': 1e-06, 'clip_max': 2.5, 'prob_clip': 0.0005162250816352987, 'n_components': 80, 'logistic_c': 9.274013110121053e-06, 'pca_fit': 'combined', 'solver': 'lbfgs', 'max_iter': 2000, 'fit_intercept': True, 'standardize_with_source': True, 'rho': 1.0}
[I 2026-06-01 16:38:16,905] Trial 184 finished with value: 0.20763085429116832 and parameters: {'alpha': 129283.83204882145, 'n_pcs': 4500, 'iw_method': 'pc_logistic', 'iw_clip_max': 2.5, 'iw_prob_clip': 0.0005162250816352987, 'iw_n_components': 80, 'iw_logistic_c': 9.274013110121053e-06, 'iw_pca_fit': 'combined', 'iw_solver': 'lbfgs', 'iw_rho': 1.0}. Best is trial 179 with value: 0.20823535455994152.
2026-06-01 16:38:16 | INFO | Trial 185 | outer=3 | alpha=1.256e+05 n_pcs=4500 (pc_topk) weight={'name': 'pc_logistic', 'floor': 1e-06, 'clip_max': 2.5, 'prob_clip': 0.000501147143007938, 'n_components': 80, 'logistic_c': 8.72818972907983e-06, 'pca_fit': 'combined', 'solver': 'lbfgs', 'max_iter': 2000, 'fit_intercept': True, 'standardize_with_source': True, 'rho': 1.0}
[I 2026-06-01 16:38:32,669] Trial 185 finished with value: 0.2074656385074877 and parameters: {'alpha': 125648.78114885489, 'n_pcs': 4500, 'iw_method': 'pc_logistic', 'iw_clip_max': 2.5, 'iw_prob_clip': 0.000501147143007938, 'iw_n_components': 80, 'iw_logistic_c': 8.72818972907983e-06, 'iw_pca_fit': 'combined', 'iw_solver': 'lbfgs', 'iw_rho': 1.0}. Best is trial 179 with value: 0.20823535455994152.
2026-06-01 16:38:32 | INFO | Trial 186 | outer=3 | alpha=3.937e+04 n_pcs=4500 (pc_topk) weight={'name': 'pc_logistic', 'floor': 1e-06, 'clip_max': 2.5, 'prob_clip': 0.0005120083693195099, 'n_components': 80, 'logistic_c': 4.377745692714955e-06, 'pca_fit': 'combined', 'solver': 'lbfgs', 'max_iter': 2000, 'fit_intercept': True, 'standardize_with_source': True, 'rho': 1.0}
[I 2026-06-01 16:38:48,386] Trial 186 finished with value: 0.2043222961090252 and parameters: {'alpha': 39366.92350011946, 'n_pcs': 4500, 'iw_method': 'pc_logistic', 'iw_clip_max': 2.5, 'iw_prob_clip': 0.0005120083693195099, 'iw_n_components': 80, 'iw_logistic_c': 4.377745692714955e-06, 'iw_pca_fit': 'combined', 'iw_solver': 'lbfgs', 'iw_rho': 1.0}. Best is trial 179 with value: 0.20823535455994152.
2026-06-01 16:38:48 | INFO | Trial 187 | outer=3 | alpha=6.324e+04 n_pcs=4500 (pc_topk) weight={'name': 'pc_logistic', 'floor': 1e-06, 'clip_max': 7.0, 'prob_clip': 0.0005055722355725692, 'n_components': 80, 'logistic_c': 9.296946876626508e-06, 'pca_fit': 'combined', 'solver': 'lbfgs', 'max_iter': 2000, 'fit_intercept': True, 'standardize_with_source': True, 'rho': 1.0}
[I 2026-06-01 16:39:02,929] Trial 187 finished with value: 0.2028785246695469 and parameters: {'alpha': 63240.56708314519, 'n_pcs': 4500, 'iw_method': 'pc_logistic', 'iw_clip_max': 7.0, 'iw_prob_clip': 0.0005055722355725692, 'iw_n_components': 80, 'iw_logistic_c': 9.296946876626508e-06, 'iw_pca_fit': 'combined', 'iw_solver': 'lbfgs', 'iw_rho': 1.0}. Best is trial 179 with value: 0.20823535455994152.
2026-06-01 16:39:02 | INFO | Trial 188 | outer=3 | alpha=8.429e+04 n_pcs=4500 (pc_topk) weight={'name': 'pc_logistic', 'floor': 1e-06, 'clip_max': 2.5, 'prob_clip': 0.0005426411570544297, 'n_components': 80, 'logistic_c': 5.824334229094051e-06, 'pca_fit': 'combined', 'solver': 'lbfgs', 'max_iter': 2000, 'fit_intercept': True, 'standardize_with_source': True, 'rho': 1.0}
[I 2026-06-01 16:39:18,328] Trial 188 finished with value: 0.2068293924154007 and parameters: {'alpha': 84293.02502581057, 'n_pcs': 4500, 'iw_method': 'pc_logistic', 'iw_clip_max': 2.5, 'iw_prob_clip': 0.0005426411570544297, 'iw_n_components': 80, 'iw_logistic_c': 5.824334229094051e-06, 'iw_pca_fit': 'combined', 'iw_solver': 'lbfgs', 'iw_rho': 1.0}. Best is trial 179 with value: 0.20823535455994152.
2026-06-01 16:39:18 | INFO | Trial 189 | outer=3 | alpha=1.368e+05 n_pcs=4500 (pc_topk) weight={'name': 'pc_logistic', 'floor': 1e-06, 'clip_max': 2.5, 'prob_clip': 0.0005707199243863262, 'n_components': 80, 'logistic_c': 1.2028652393487468e-05, 'pca_fit': 'combined', 'solver': 'lbfgs', 'max_iter': 2000, 'fit_intercept': True, 'standardize_with_source': True, 'rho': 1.0}
[I 2026-06-01 16:39:33,361] Trial 189 finished with value: 0.20791490345213903 and parameters: {'alpha': 136767.3820901103, 'n_pcs': 4500, 'iw_method': 'pc_logistic', 'iw_clip_max': 2.5, 'iw_prob_clip': 0.0005707199243863262, 'iw_n_components': 80, 'iw_logistic_c': 1.2028652393487468e-05, 'iw_pca_fit': 'combined', 'iw_solver': 'lbfgs', 'iw_rho': 1.0}. Best is trial 179 with value: 0.20823535455994152.
2026-06-01 16:39:33 | INFO | Trial 190 | outer=3 | alpha=1.381e+05 n_pcs=5000 (pc_topk) weight={'name': 'pc_logistic', 'floor': 1e-06, 'clip_max': 2.5, 'prob_clip': 0.0006556249040627477, 'n_components': 80, 'logistic_c': 1.1498311440042715e-05, 'pca_fit': 'combined', 'solver': 'lbfgs', 'max_iter': 2000, 'fit_intercept': True, 'standardize_with_source': True, 'rho': 1.0}
[I 2026-06-01 16:39:49,927] Trial 190 finished with value: 0.20677036040945462 and parameters: {'alpha': 138134.89772685096, 'n_pcs': 5000, 'iw_method': 'pc_logistic', 'iw_clip_max': 2.5, 'iw_prob_clip': 0.0006556249040627477, 'iw_n_components': 80, 'iw_logistic_c': 1.1498311440042715e-05, 'iw_pca_fit': 'combined', 'iw_solver': 'lbfgs', 'iw_rho': 1.0}. Best is trial 179 with value: 0.20823535455994152.
2026-06-01 16:39:49 | INFO | Trial 191 | outer=3 | alpha=1.268e+05 n_pcs=4500 (pc_topk) weight={'name': 'pc_logistic', 'floor': 1e-06, 'clip_max': 2.5, 'prob_clip': 0.0005652080506052872, 'n_components': 80, 'logistic_c': 8.1029085440715e-06, 'pca_fit': 'combined', 'solver': 'lbfgs', 'max_iter': 2000, 'fit_intercept': True, 'standardize_with_source': True, 'rho': 1.0}
[I 2026-06-01 16:40:05,430] Trial 191 finished with value: 0.2072664910667703 and parameters: {'alpha': 126750.37325316854, 'n_pcs': 4500, 'iw_method': 'pc_logistic', 'iw_clip_max': 2.5, 'iw_prob_clip': 0.0005652080506052872, 'iw_n_components': 80, 'iw_logistic_c': 8.1029085440715e-06, 'iw_pca_fit': 'combined', 'iw_solver': 'lbfgs', 'iw_rho': 1.0}. Best is trial 179 with value: 0.20823535455994152.
2026-06-01 16:40:05 | INFO | Trial 192 | outer=3 | alpha=9.945e+04 n_pcs=4500 (pc_topk) weight={'name': 'pc_logistic', 'floor': 1e-06, 'clip_max': 2.5, 'prob_clip': 0.0005008193681025837, 'n_components': 80, 'logistic_c': 1.4307740062123873e-05, 'pca_fit': 'combined', 'solver': 'lbfgs', 'max_iter': 2000, 'fit_intercept': True, 'standardize_with_source': True, 'rho': 1.0}
[I 2026-06-01 16:40:21,648] Trial 192 finished with value: 0.20811883394551228 and parameters: {'alpha': 99454.14735468579, 'n_pcs': 4500, 'iw_method': 'pc_logistic', 'iw_clip_max': 2.5, 'iw_prob_clip': 0.0005008193681025837, 'iw_n_components': 80, 'iw_logistic_c': 1.4307740062123873e-05, 'iw_pca_fit': 'combined', 'iw_solver': 'lbfgs', 'iw_rho': 1.0}. Best is trial 179 with value: 0.20823535455994152.
2026-06-01 16:40:21 | INFO | Trial 193 | outer=3 | alpha=1.040e+05 n_pcs=4500 (pc_topk) weight={'name': 'pc_logistic', 'floor': 1e-06, 'clip_max': 2.5, 'prob_clip': 0.0005010130796298607, 'n_components': 80, 'logistic_c': 1.2279059289165514e-05, 'pca_fit': 'combined', 'solver': 'lbfgs', 'max_iter': 2000, 'fit_intercept': True, 'standardize_with_source': True, 'rho': 1.0}
[I 2026-06-01 16:40:54,609] Trial 193 finished with value: 0.20821701078501476 and parameters: {'alpha': 104017.32741976563, 'n_pcs': 4500, 'iw_method': 'pc_logistic', 'iw_clip_max': 2.5, 'iw_prob_clip': 0.0005010130796298607, 'iw_n_components': 80, 'iw_logistic_c': 1.2279059289165514e-05, 'iw_pca_fit': 'combined', 'iw_solver': 'lbfgs', 'iw_rho': 1.0}. Best is trial 179 with value: 0.20823535455994152.
2026-06-01 16:40:54 | INFO | Trial 194 | outer=3 | alpha=8.569e+04 n_pcs=4500 (pc_topk) weight={'name': 'pc_logistic', 'floor': 1e-06, 'clip_max': 2.5, 'prob_clip': 0.0005001101516995896, 'n_components': 80, 'logistic_c': 1.3069249877640062e-05, 'pca_fit': 'combined', 'solver': 'lbfgs', 'max_iter': 2000, 'fit_intercept': True, 'standardize_with_source': True, 'rho': 1.0}
