[I 2026-06-01 15:38:56,802] Trial 286 finished with value: 0.24241369904598198 and parameters: {'alpha': 173515.72129289515, 'n_pcs': 4500, 'iw_method': 'pc_logistic', 'iw_clip_max': 2.5, 'iw_prob_clip': 0.019988779772983807, 'iw_n_components': 40, 'iw_logistic_c': 8.407751034810319e-06, 'iw_pca_fit': 'combined', 'iw_solver': 'lbfgs', 'iw_rho': 1.0}. Best is trial 283 with value: 0.2458449183362247.
2026-06-01 15:38:56 | INFO | Trial 287 | outer=2 | alpha=1.589e+05 n_pcs=4000 (pc_topk) weight={'name': 'pc_logistic', 'floor': 1e-06, 'clip_max': 2.5, 'prob_clip': 0.022195665391336394, 'n_components': 60, 'logistic_c': 1.8770194074731588e-05, 'pca_fit': 'combined', 'solver': 'lbfgs', 'max_iter': 2000, 'fit_intercept': True, 'standardize_with_source': True, 'rho': 0.3}
[I 2026-06-01 15:39:09,925] Trial 287 finished with value: 0.2385680557762507 and parameters: {'alpha': 158878.72751649804, 'n_pcs': 4000, 'iw_method': 'pc_logistic', 'iw_clip_max': 2.5, 'iw_prob_clip': 0.022195665391336394, 'iw_n_components': 60, 'iw_logistic_c': 1.8770194074731588e-05, 'iw_pca_fit': 'combined', 'iw_solver': 'lbfgs', 'iw_rho': 0.3}. Best is trial 283 with value: 0.2458449183362247.
2026-06-01 15:39:09 | INFO | Trial 288 | outer=2 | alpha=2.139e+05 n_pcs=4000 (pc_topk) weight={'name': 'pc_logistic', 'floor': 1e-06, 'clip_max': 2.5, 'prob_clip': 0.02406100532222281, 'n_components': 60, 'logistic_c': 2.4160755765958173e-05, 'pca_fit': 'combined', 'solver': 'lbfgs', 'max_iter': 2000, 'fit_intercept': True, 'standardize_with_source': True, 'rho': 1.0}
[I 2026-06-01 15:39:23,999] Trial 288 finished with value: 0.24559571221841284 and parameters: {'alpha': 213854.19293747918, 'n_pcs': 4000, 'iw_method': 'pc_logistic', 'iw_clip_max': 2.5, 'iw_prob_clip': 0.02406100532222281, 'iw_n_components': 60, 'iw_logistic_c': 2.4160755765958173e-05, 'iw_pca_fit': 'combined', 'iw_solver': 'lbfgs', 'iw_rho': 1.0}. Best is trial 283 with value: 0.2458449183362247.
2026-06-01 15:39:24 | INFO | Trial 289 | outer=2 | alpha=2.080e+05 n_pcs=4500 (pc_topk) weight={'name': 'pc_logistic', 'floor': 1e-06, 'clip_max': 2.5, 'prob_clip': 0.02423382472951223, 'n_components': 60, 'logistic_c': 1.3168199455357473e-05, 'pca_fit': 'combined', 'solver': 'lbfgs', 'max_iter': 2000, 'fit_intercept': True, 'standardize_with_source': True, 'rho': 1.0}
[I 2026-06-01 15:39:39,764] Trial 289 finished with value: 0.24371559455119582 and parameters: {'alpha': 208049.75186361914, 'n_pcs': 4500, 'iw_method': 'pc_logistic', 'iw_clip_max': 2.5, 'iw_prob_clip': 0.02423382472951223, 'iw_n_components': 60, 'iw_logistic_c': 1.3168199455357473e-05, 'iw_pca_fit': 'combined', 'iw_solver': 'lbfgs', 'iw_rho': 1.0}. Best is trial 283 with value: 0.2458449183362247.
2026-06-01 15:39:39 | INFO | Trial 290 | outer=2 | alpha=2.094e+05 n_pcs=4000 (pc_topk) weight={'name': 'pc_logistic', 'floor': 1e-06, 'clip_max': 2.5, 'prob_clip': 0.029067269660961677, 'n_components': 60, 'logistic_c': 2.027319056725589e-05, 'pca_fit': 'combined', 'solver': 'lbfgs', 'max_iter': 2000, 'fit_intercept': True, 'standardize_with_source': True, 'rho': 1.0}
[I 2026-06-01 15:39:53,108] Trial 290 finished with value: 0.2455114587239991 and parameters: {'alpha': 209388.94965716702, 'n_pcs': 4000, 'iw_method': 'pc_logistic', 'iw_clip_max': 2.5, 'iw_prob_clip': 0.029067269660961677, 'iw_n_components': 60, 'iw_logistic_c': 2.027319056725589e-05, 'iw_pca_fit': 'combined', 'iw_solver': 'lbfgs', 'iw_rho': 1.0}. Best is trial 283 with value: 0.2458449183362247.
2026-06-01 15:39:53 | INFO | Trial 291 | outer=2 | alpha=1.655e+05 n_pcs=4000 (pc_topk) weight={'name': 'pc_logistic', 'floor': 1e-06, 'clip_max': 2.5, 'prob_clip': 0.030066526495146118, 'n_components': 60, 'logistic_c': 2.2833230084613132e-05, 'pca_fit': 'combined', 'solver': 'lbfgs', 'max_iter': 2000, 'fit_intercept': True, 'standardize_with_source': True, 'rho': 1.0}
[I 2026-06-01 15:40:06,343] Trial 291 finished with value: 0.2459895054916043 and parameters: {'alpha': 165549.90272216007, 'n_pcs': 4000, 'iw_method': 'pc_logistic', 'iw_clip_max': 2.5, 'iw_prob_clip': 0.030066526495146118, 'iw_n_components': 60, 'iw_logistic_c': 2.2833230084613132e-05, 'iw_pca_fit': 'combined', 'iw_solver': 'lbfgs', 'iw_rho': 1.0}. Best is trial 291 with value: 0.2459895054916043.
2026-06-01 15:40:06 | INFO | Trial 292 | outer=2 | alpha=1.723e+05 n_pcs=4000 (pc_topk) weight={'name': 'pc_logistic', 'floor': 1e-06, 'clip_max': 2.5, 'prob_clip': 0.02924771079646178, 'n_components': 60, 'logistic_c': 3.655507078452425e-05, 'pca_fit': 'combined', 'solver': 'lbfgs', 'max_iter': 2000, 'fit_intercept': True, 'standardize_with_source': True, 'rho': 1.0}
[I 2026-06-01 15:40:19,871] Trial 292 finished with value: 0.2457020849390063 and parameters: {'alpha': 172265.1780532692, 'n_pcs': 4000, 'iw_method': 'pc_logistic', 'iw_clip_max': 2.5, 'iw_prob_clip': 0.02924771079646178, 'iw_n_components': 60, 'iw_logistic_c': 3.655507078452425e-05, 'iw_pca_fit': 'combined', 'iw_solver': 'lbfgs', 'iw_rho': 1.0}. Best is trial 291 with value: 0.2459895054916043.
2026-06-01 15:40:19 | INFO | Trial 293 | outer=2 | alpha=1.610e+05 n_pcs=4000 (pc_topk) weight={'name': 'pc_logistic', 'floor': 1e-06, 'clip_max': 2.5, 'prob_clip': 0.028854098452280222, 'n_components': 60, 'logistic_c': 4.279343921164532e-05, 'pca_fit': 'combined', 'solver': 'lbfgs', 'max_iter': 2000, 'fit_intercept': True, 'standardize_with_source': True, 'rho': 1.0}
[I 2026-06-01 15:40:37,853] Trial 293 finished with value: 0.24566009697626248 and parameters: {'alpha': 161049.41224741345, 'n_pcs': 4000, 'iw_method': 'pc_logistic', 'iw_clip_max': 2.5, 'iw_prob_clip': 0.028854098452280222, 'iw_n_components': 60, 'iw_logistic_c': 4.279343921164532e-05, 'iw_pca_fit': 'combined', 'iw_solver': 'lbfgs', 'iw_rho': 1.0}. Best is trial 291 with value: 0.2459895054916043.
2026-06-01 15:40:37 | INFO | Trial 294 | outer=2 | alpha=1.539e+05 n_pcs=4000 (pc_topk) weight={'name': 'pc_logistic', 'floor': 1e-06, 'clip_max': 4.0, 'prob_clip': 0.030218682325993146, 'n_components': 60, 'logistic_c': 4.962122059774879e-05, 'pca_fit': 'combined', 'solver': 'lbfgs', 'max_iter': 2000, 'fit_intercept': True, 'standardize_with_source': True, 'rho': 1.0}
[I 2026-06-01 15:40:51,707] Trial 294 finished with value: 0.2437356015439088 and parameters: {'alpha': 153853.84705666205, 'n_pcs': 4000, 'iw_method': 'pc_logistic', 'iw_clip_max': 4.0, 'iw_prob_clip': 0.030218682325993146, 'iw_n_components': 60, 'iw_logistic_c': 4.962122059774879e-05, 'iw_pca_fit': 'combined', 'iw_solver': 'lbfgs', 'iw_rho': 1.0}. Best is trial 291 with value: 0.2459895054916043.
2026-06-01 15:40:51 | INFO | Trial 295 | outer=2 | alpha=1.643e+05 n_pcs=4500 (pc_topk) weight={'name': 'pc_logistic', 'floor': 1e-06, 'clip_max': 7.0, 'prob_clip': 0.037534310685534054, 'n_components': 60, 'logistic_c': 2.6448667426133263e-05, 'pca_fit': 'combined', 'solver': 'lbfgs', 'max_iter': 2000, 'fit_intercept': True, 'standardize_with_source': True, 'rho': 1.0}
[I 2026-06-01 15:41:07,589] Trial 295 finished with value: 0.236357891263777 and parameters: {'alpha': 164319.01096583842, 'n_pcs': 4500, 'iw_method': 'pc_logistic', 'iw_clip_max': 7.0, 'iw_prob_clip': 0.037534310685534054, 'iw_n_components': 60, 'iw_logistic_c': 2.6448667426133263e-05, 'iw_pca_fit': 'combined', 'iw_solver': 'lbfgs', 'iw_rho': 1.0}. Best is trial 291 with value: 0.2459895054916043.
2026-06-01 15:41:07 | INFO | Trial 296 | outer=2 | alpha=1.385e+05 n_pcs=1000 (pc_topk) weight={'name': 'pc_logistic', 'floor': 1e-06, 'clip_max': 1.5, 'prob_clip': 0.02919404052996901, 'n_components': 60, 'logistic_c': 9.823151621915073e-06, 'pca_fit': 'combined', 'solver': 'lbfgs', 'max_iter': 2000, 'fit_intercept': True, 'standardize_with_source': True, 'rho': 1.0}
[I 2026-06-01 15:41:15,011] Trial 296 finished with value: 0.2317215015706023 and parameters: {'alpha': 138467.56649857585, 'n_pcs': 1000, 'iw_method': 'pc_logistic', 'iw_clip_max': 1.5, 'iw_prob_clip': 0.02919404052996901, 'iw_n_components': 60, 'iw_logistic_c': 9.823151621915073e-06, 'iw_pca_fit': 'combined', 'iw_solver': 'lbfgs', 'iw_rho': 1.0}. Best is trial 291 with value: 0.2459895054916043.
2026-06-01 15:41:15 | INFO | Trial 297 | outer=2 | alpha=1.823e+05 n_pcs=4000 (pc_topk) weight={'name': 'pc_logistic', 'floor': 1e-06, 'clip_max': 2.5, 'prob_clip': 0.032391258313227915, 'n_components': 60, 'logistic_c': 2.3759290428446482e-06, 'pca_fit': 'combined', 'solver': 'lbfgs', 'max_iter': 2000, 'fit_intercept': True, 'standardize_with_source': True, 'rho': 1.0}
[I 2026-06-01 15:41:28,022] Trial 297 finished with value: 0.23576062312944215 and parameters: {'alpha': 182328.8125792167, 'n_pcs': 4000, 'iw_method': 'pc_logistic', 'iw_clip_max': 2.5, 'iw_prob_clip': 0.032391258313227915, 'iw_n_components': 60, 'iw_logistic_c': 2.3759290428446482e-06, 'iw_pca_fit': 'combined', 'iw_solver': 'lbfgs', 'iw_rho': 1.0}. Best is trial 291 with value: 0.2459895054916043.
2026-06-01 15:41:28 | INFO | Trial 298 | outer=2 | alpha=1.646e+05 n_pcs=4000 (pc_topk) weight={'name': 'pc_logistic', 'floor': 1e-06, 'clip_max': 2.5, 'prob_clip': 0.029004010658101275, 'n_components': 60, 'logistic_c': 1.735817811506369e-05, 'pca_fit': 'combined', 'solver': 'lbfgs', 'max_iter': 2000, 'fit_intercept': True, 'standardize_with_source': True, 'rho': 1.0}
[I 2026-06-01 15:41:41,800] Trial 298 finished with value: 0.24574507963897158 and parameters: {'alpha': 164647.2944470545, 'n_pcs': 4000, 'iw_method': 'pc_logistic', 'iw_clip_max': 2.5, 'iw_prob_clip': 0.029004010658101275, 'iw_n_components': 60, 'iw_logistic_c': 1.735817811506369e-05, 'iw_pca_fit': 'combined', 'iw_solver': 'lbfgs', 'iw_rho': 1.0}. Best is trial 291 with value: 0.2459895054916043.
2026-06-01 15:41:41 | INFO | Trial 299 | outer=2 | alpha=1.377e+05 n_pcs=4000 (pc_topk) weight={'name': 'uniform'}
[I 2026-06-01 15:41:49,285] Trial 299 finished with value: 0.2306931496033159 and parameters: {'alpha': 137746.92550587468, 'n_pcs': 4000, 'iw_method': 'uniform'}. Best is trial 291 with value: 0.2459895054916043.
2026-06-01 15:41:49 | INFO | OUTER 2 best (inner mean r=0.2460): {'model_type': 'pc_ridge', 'alpha': 165549.90272216007, 'use_snp_selection': True, 'num_snps': 4000, 'n_pcs': 4000, 'weighting': {'name': 'pc_logistic', 'floor': 1e-06, 'clip_max': 2.5, 'prob_clip': 0.030066526495146118, 'n_components': 60, 'logistic_c': 2.2833230084613132e-05, 'pca_fit': 'combined', 'solver': 'lbfgs', 'max_iter': 2000, 'fit_intercept': True, 'standardize_with_source': True, 'rho': 1.0}, 'mean_inner_effective_sample_size': 4446.84888802661, 'mean_inner_effective_sample_size_threshold': 1042.3600000000001}
2026-06-01 15:41:50 | INFO | OUTER 2 TEST r = 0.2223
2026-06-01 15:41:50 | INFO | OUTER 2 incremental summary saved to outputs/final_results/e6_pc_ridge_importance/thr_wing/e6_pc_ridge_importance_thr_wing_results.json
2026-06-01 15:41:50 | INFO | OUTER 3: test_size=286 island=2 (Træna)
2026-06-01 15:41:50 | INFO | OUTER 3: using top 10 related inner validation islands for tuning: 3(Selvær, avgGRM=0.0194), 1(Myken, avgGRM=0.0152), 8(Lovund, avgGRM=0.0119), 9(Sleneset, avgGRM=0.0084), 0(Nesøy, avgGRM=0.0030), 7(Onøy og Lurøy, avgGRM=0.0024), 6(Indre Kvarøy, avgGRM=0.0015), 5(Hestmannøy, avgGRM=-0.0005), 4(Gjerøy, avgGRM=-0.0020), 12(Vega, avgGRM=-0.0032)
[I 2026-06-01 15:41:50,999] A new study created in memory with name: ridge_importance_inner_outer2
2026-06-01 15:41:51 | INFO | Trial 0 | outer=3 | alpha=1.137e+05 n_pcs=4000 (pc_topk) weight={'name': 'uniform'}
[I 2026-06-01 15:41:59,029] Trial 0 finished with value: 0.1995121087043757 and parameters: {'alpha': 113703.38004442609, 'n_pcs': 4000, 'iw_method': 'uniform'}. Best is trial 0 with value: 0.1995121087043757.
2026-06-01 15:41:59 | INFO | Trial 1 | outer=3 | alpha=1.734e+04 n_pcs=5000 (pc_topk) weight={'name': 'uniform'}
[I 2026-06-01 15:42:09,920] Trial 1 finished with value: 0.1959983676348103 and parameters: {'alpha': 17335.792577698634, 'n_pcs': 5000, 'iw_method': 'uniform'}. Best is trial 0 with value: 0.1995121087043757.
2026-06-01 15:42:09 | INFO | Trial 2 | outer=3 | alpha=1.435e+05 n_pcs=1500 (pc_topk) weight={'name': 'uniform'}
[I 2026-06-01 15:42:16,582] Trial 2 finished with value: 0.19167748210381633 and parameters: {'alpha': 143482.76912965564, 'n_pcs': 1500, 'iw_method': 'uniform'}. Best is trial 0 with value: 0.1995121087043757.
2026-06-01 15:42:16 | INFO | Trial 3 | outer=3 | alpha=1.431e+05 n_pcs=500 (pc_topk) weight={'name': 'uniform'}
[I 2026-06-01 15:42:17,514] Trial 3 finished with value: 0.16712500427475532 and parameters: {'alpha': 143072.2464444983, 'n_pcs': 500, 'iw_method': 'uniform'}. Best is trial 0 with value: 0.1995121087043757.
2026-06-01 15:42:17 | INFO | Trial 4 | outer=3 | alpha=5.373e+06 n_pcs=2000 (pc_topk) weight={'name': 'pc_logistic', 'floor': 1e-06, 'clip_max': 1.5, 'prob_clip': 0.001637400317167702, 'n_components': 80, 'logistic_c': 0.09386700500068379, 'pca_fit': 'combined', 'solver': 'lbfgs', 'max_iter': 2000, 'fit_intercept': True, 'standardize_with_source': True, 'rho': 1.0}
[I 2026-06-01 15:42:37,504] Trial 4 finished with value: 0.17330958718880263 and parameters: {'alpha': 5373167.4046281455, 'n_pcs': 2000, 'iw_method': 'pc_logistic', 'iw_clip_max': 1.5, 'iw_prob_clip': 0.001637400317167702, 'iw_n_components': 80, 'iw_logistic_c': 0.09386700500068379, 'iw_pca_fit': 'combined', 'iw_solver': 'lbfgs', 'iw_rho': 1.0}. Best is trial 0 with value: 0.1995121087043757.
2026-06-01 15:42:37 | INFO | Trial 5 | outer=3 | alpha=6.435e+04 n_pcs=1000 (pc_topk) weight={'name': 'pc_logistic', 'floor': 1e-06, 'clip_max': 7.0, 'prob_clip': 0.004193356127903791, 'n_components': 20, 'logistic_c': 9.236417519010976, 'pca_fit': 'combined', 'solver': 'lbfgs', 'max_iter': 2000, 'fit_intercept': True, 'standardize_with_source': True, 'rho': 1.0}
2026-06-01 15:42:49 | INFO | Trial 5 rejected by ESS guard: mean_ess=634.95 threshold=1002.96
[I 2026-06-01 15:42:49,200] Trial 5 finished with value: -1.0 and parameters: {'alpha': 64350.09539177312, 'n_pcs': 1000, 'iw_method': 'pc_logistic', 'iw_clip_max': 7.0, 'iw_prob_clip': 0.004193356127903791, 'iw_n_components': 20, 'iw_logistic_c': 9.236417519010976, 'iw_pca_fit': 'combined', 'iw_solver': 'lbfgs', 'iw_rho': 1.0}. Best is trial 0 with value: 0.1995121087043757.
2026-06-01 15:42:49 | INFO | Trial 6 | outer=3 | alpha=3.046e+05 n_pcs=3500 (pc_topk) weight={'name': 'pc_logistic', 'floor': 1e-06, 'clip_max': 12.0, 'prob_clip': 0.0007016380040663315, 'n_components': 80, 'logistic_c': 0.00021908930989278453, 'pca_fit': 'combined', 'solver': 'lbfgs', 'max_iter': 2000, 'fit_intercept': True, 'standardize_with_source': True, 'rho': 0.7}
[I 2026-06-01 15:43:06,346] Trial 6 finished with value: 0.19422929126289057 and parameters: {'alpha': 304631.0485153137, 'n_pcs': 3500, 'iw_method': 'pc_logistic', 'iw_clip_max': 12.0, 'iw_prob_clip': 0.0007016380040663315, 'iw_n_components': 80, 'iw_logistic_c': 0.00021908930989278453, 'iw_pca_fit': 'combined', 'iw_solver': 'lbfgs', 'iw_rho': 0.7}. Best is trial 0 with value: 0.1995121087043757.
2026-06-01 15:43:06 | INFO | Trial 7 | outer=3 | alpha=7.213e+06 n_pcs=500 (pc_topk) weight={'name': 'uniform'}
[I 2026-06-01 15:43:07,232] Trial 7 finished with value: 0.16349000605881903 and parameters: {'alpha': 7213019.60957054, 'n_pcs': 500, 'iw_method': 'uniform'}. Best is trial 0 with value: 0.1995121087043757.
2026-06-01 15:43:07 | INFO | Trial 8 | outer=3 | alpha=2.347e+03 n_pcs=3000 (pc_topk) weight={'name': 'pc_logistic', 'floor': 1e-06, 'clip_max': 2.5, 'prob_clip': 0.017782866059784724, 'n_components': 60, 'logistic_c': 4.584813955429537e-07, 'pca_fit': 'combined', 'solver': 'lbfgs', 'max_iter': 2000, 'fit_intercept': True, 'standardize_with_source': True, 'rho': 0.3}
[I 2026-06-01 15:43:16,799] Trial 8 finished with value: 0.11864778832760721 and parameters: {'alpha': 2346.6230871488538, 'n_pcs': 3000, 'iw_method': 'pc_logistic', 'iw_clip_max': 2.5, 'iw_prob_clip': 0.017782866059784724, 'iw_n_components': 60, 'iw_logistic_c': 4.584813955429537e-07, 'iw_pca_fit': 'combined', 'iw_solver': 'lbfgs', 'iw_rho': 0.3}. Best is trial 0 with value: 0.1995121087043757.
2026-06-01 15:43:16 | INFO | Trial 9 | outer=3 | alpha=1.067e+03 n_pcs=4000 (pc_topk) weight={'name': 'pc_logistic', 'floor': 1e-06, 'clip_max': 4.0, 'prob_clip': 0.003002704300062754, 'n_components': 10, 'logistic_c': 4.32601466983518e-06, 'pca_fit': 'combined', 'solver': 'lbfgs', 'max_iter': 2000, 'fit_intercept': True, 'standardize_with_source': True, 'rho': 1.0}
[I 2026-06-01 15:43:43,179] Trial 9 finished with value: 0.09150936482766119 and parameters: {'alpha': 1067.2105048492429, 'n_pcs': 4000, 'iw_method': 'pc_logistic', 'iw_clip_max': 4.0, 'iw_prob_clip': 0.003002704300062754, 'iw_n_components': 10, 'iw_logistic_c': 4.32601466983518e-06, 'iw_pca_fit': 'combined', 'iw_solver': 'lbfgs', 'iw_rho': 1.0}. Best is trial 0 with value: 0.1995121087043757.
2026-06-01 15:43:43 | INFO | Trial 10 | outer=3 | alpha=9.030e+05 n_pcs=5000 (pc_topk) weight={'name': 'uniform'}
[I 2026-06-01 15:43:55,097] Trial 10 finished with value: 0.18558187865985984 and parameters: {'alpha': 902970.0505273588, 'n_pcs': 5000, 'iw_method': 'uniform'}. Best is trial 0 with value: 0.1995121087043757.
2026-06-01 15:43:55 | INFO | Trial 11 | outer=3 | alpha=1.245e+04 n_pcs=5000 (pc_topk) weight={'name': 'uniform'}
[I 2026-06-01 15:44:06,232] Trial 11 finished with value: 0.1920050260919181 and parameters: {'alpha': 12451.817386682478, 'n_pcs': 5000, 'iw_method': 'uniform'}. Best is trial 0 with value: 0.1995121087043757.
2026-06-01 15:44:06 | INFO | Trial 12 | outer=3 | alpha=1.792e+04 n_pcs=4000 (pc_topk) weight={'name': 'uniform'}
[I 2026-06-01 15:44:18,900] Trial 12 finished with value: 0.19194354609533934 and parameters: {'alpha': 17922.511917924126, 'n_pcs': 4000, 'iw_method': 'uniform'}. Best is trial 0 with value: 0.1995121087043757.
2026-06-01 15:44:18 | INFO | Trial 13 | outer=3 | alpha=1.913e+04 n_pcs=4500 (pc_topk) weight={'name': 'uniform'}
[I 2026-06-01 15:44:30,746] Trial 13 finished with value: 0.19806573274603023 and parameters: {'alpha': 19132.13627882653, 'n_pcs': 4500, 'iw_method': 'uniform'}. Best is trial 0 with value: 0.1995121087043757.
2026-06-01 15:44:30 | INFO | Trial 14 | outer=3 | alpha=8.124e+05 n_pcs=4000 (pc_topk) weight={'name': 'uniform'}
[I 2026-06-01 15:44:38,074] Trial 14 finished with value: 0.18675025778844417 and parameters: {'alpha': 812435.5329230118, 'n_pcs': 4000, 'iw_method': 'uniform'}. Best is trial 0 with value: 0.1995121087043757.
2026-06-01 15:44:38 | INFO | Trial 15 | outer=3 | alpha=3.569e+04 n_pcs=2500 (pc_topk) weight={'name': 'uniform'}
[I 2026-06-01 15:44:42,250] Trial 15 finished with value: 0.20000695374430041 and parameters: {'alpha': 35688.940173379786, 'n_pcs': 2500, 'iw_method': 'uniform'}. Best is trial 15 with value: 0.20000695374430041.
2026-06-01 15:44:42 | INFO | Trial 16 | outer=3 | alpha=5.443e+03 n_pcs=2500 (pc_topk) weight={'name': 'uniform'}
[I 2026-06-01 15:44:46,711] Trial 16 finished with value: 0.16093902612317249 and parameters: {'alpha': 5443.00802406258, 'n_pcs': 2500, 'iw_method': 'uniform'}. Best is trial 15 with value: 0.20000695374430041.
2026-06-01 15:44:46 | INFO | Trial 17 | outer=3 | alpha=5.205e+04 n_pcs=3000 (pc_topk) weight={'name': 'uniform'}
[I 2026-06-01 15:44:51,985] Trial 17 finished with value: 0.19968087036279877 and parameters: {'alpha': 52049.37180416863, 'n_pcs': 3000, 'iw_method': 'uniform'}. Best is trial 15 with value: 0.20000695374430041.
2026-06-01 15:44:51 | INFO | Trial 18 | outer=3 | alpha=4.373e+04 n_pcs=2500 (pc_topk) weight={'name': 'uniform'}
[I 2026-06-01 15:44:57,964] Trial 18 finished with value: 0.20154502745961253 and parameters: {'alpha': 43728.2224131535, 'n_pcs': 2500, 'iw_method': 'uniform'}. Best is trial 18 with value: 0.20154502745961253.
2026-06-01 15:44:57 | INFO | Trial 19 | outer=3 | alpha=5.342e+05 n_pcs=2000 (pc_topk) weight={'name': 'uniform'}
[I 2026-06-01 15:45:01,326] Trial 19 finished with value: 0.19303663877570604 and parameters: {'alpha': 534155.6128455045, 'n_pcs': 2000, 'iw_method': 'uniform'}. Best is trial 18 with value: 0.20154502745961253.
2026-06-01 15:45:01 | INFO | Trial 20 | outer=3 | alpha=2.302e+06 n_pcs=2500 (pc_topk) weight={'name': 'uniform'}
[I 2026-06-01 15:45:05,878] Trial 20 finished with value: 0.18477532101865826 and parameters: {'alpha': 2302261.4439267134, 'n_pcs': 2500, 'iw_method': 'uniform'}. Best is trial 18 with value: 0.20154502745961253.
2026-06-01 15:45:05 | INFO | Trial 21 | outer=3 | alpha=6.073e+04 n_pcs=3000 (pc_topk) weight={'name': 'uniform'}
[I 2026-06-01 15:45:10,999] Trial 21 finished with value: 0.2002728914846763 and parameters: {'alpha': 60728.10286625173, 'n_pcs': 3000, 'iw_method': 'uniform'}. Best is trial 18 with value: 0.20154502745961253.
2026-06-01 15:45:11 | INFO | Trial 22 | outer=3 | alpha=5.115e+04 n_pcs=2000 (pc_topk) weight={'name': 'uniform'}
[I 2026-06-01 15:45:14,480] Trial 22 finished with value: 0.20221539957231985 and parameters: {'alpha': 51153.15125988608, 'n_pcs': 2000, 'iw_method': 'uniform'}. Best is trial 22 with value: 0.20221539957231985.
2026-06-01 15:45:14 | INFO | Trial 23 | outer=3 | alpha=3.064e+05 n_pcs=1500 (pc_topk) weight={'name': 'uniform'}
[I 2026-06-01 15:45:18,027] Trial 23 finished with value: 0.1894540935625229 and parameters: {'alpha': 306440.9043952946, 'n_pcs': 1500, 'iw_method': 'uniform'}. Best is trial 22 with value: 0.20221539957231985.
2026-06-01 15:45:18 | INFO | Trial 24 | outer=3 | alpha=7.318e+03 n_pcs=2000 (pc_topk) weight={'name': 'uniform'}
[I 2026-06-01 15:45:21,480] Trial 24 finished with value: 0.1711660288507268 and parameters: {'alpha': 7318.397128771984, 'n_pcs': 2000, 'iw_method': 'uniform'}. Best is trial 22 with value: 0.20221539957231985.
2026-06-01 15:45:21 | INFO | Trial 25 | outer=3 | alpha=3.340e+04 n_pcs=3000 (pc_topk) weight={'name': 'uniform'}
