[I 2026-06-01 21:49:18,706] Trial 170 finished with value: 0.22490010387885012 and parameters: {'alpha': 55787.99247414584, 'n_pcs': 3500, 'iw_method': 'pc_logistic', 'iw_clip_max': 4.0, 'iw_prob_clip': 0.010288109906740065, 'iw_n_components': 40, 'iw_logistic_c': 1.8464068814372398e-05, 'iw_pca_fit': 'combined', 'iw_solver': 'lbfgs', 'iw_rho': 1.0}. Best is trial 84 with value: 0.2289525216150688.
2026-06-01 21:49:18 | INFO | Trial 171 | outer=7 | alpha=4.255e+04 n_pcs=4000 (pc_topk) weight={'name': 'pc_logistic', 'floor': 1e-06, 'clip_max': 4.0, 'prob_clip': 0.01646504094339543, 'n_components': 40, 'logistic_c': 2.469823696248121e-05, 'pca_fit': 'combined', 'solver': 'lbfgs', 'max_iter': 2000, 'fit_intercept': True, 'standardize_with_source': True, 'rho': 1.0}
[I 2026-06-01 21:49:31,416] Trial 171 finished with value: 0.2289431240952994 and parameters: {'alpha': 42548.46594461009, 'n_pcs': 4000, 'iw_method': 'pc_logistic', 'iw_clip_max': 4.0, 'iw_prob_clip': 0.01646504094339543, 'iw_n_components': 40, 'iw_logistic_c': 2.469823696248121e-05, 'iw_pca_fit': 'combined', 'iw_solver': 'lbfgs', 'iw_rho': 1.0}. Best is trial 84 with value: 0.2289525216150688.
2026-06-01 21:49:31 | INFO | Trial 172 | outer=7 | alpha=3.530e+04 n_pcs=4000 (pc_topk) weight={'name': 'pc_logistic', 'floor': 1e-06, 'clip_max': 4.0, 'prob_clip': 0.015970596407690718, 'n_components': 40, 'logistic_c': 3.1349585783592125e-05, 'pca_fit': 'combined', 'solver': 'lbfgs', 'max_iter': 2000, 'fit_intercept': True, 'standardize_with_source': True, 'rho': 1.0}
[I 2026-06-01 21:49:44,290] Trial 172 finished with value: 0.22750594002702024 and parameters: {'alpha': 35300.72088848056, 'n_pcs': 4000, 'iw_method': 'pc_logistic', 'iw_clip_max': 4.0, 'iw_prob_clip': 0.015970596407690718, 'iw_n_components': 40, 'iw_logistic_c': 3.1349585783592125e-05, 'iw_pca_fit': 'combined', 'iw_solver': 'lbfgs', 'iw_rho': 1.0}. Best is trial 84 with value: 0.2289525216150688.
2026-06-01 21:49:44 | INFO | Trial 173 | outer=7 | alpha=3.697e+04 n_pcs=4000 (pc_topk) weight={'name': 'pc_logistic', 'floor': 1e-06, 'clip_max': 4.0, 'prob_clip': 0.016894563390295676, 'n_components': 40, 'logistic_c': 1.4037349047291456e-05, 'pca_fit': 'combined', 'solver': 'lbfgs', 'max_iter': 2000, 'fit_intercept': True, 'standardize_with_source': True, 'rho': 1.0}
[I 2026-06-01 21:49:57,267] Trial 173 finished with value: 0.2284040210295441 and parameters: {'alpha': 36969.63892052258, 'n_pcs': 4000, 'iw_method': 'pc_logistic', 'iw_clip_max': 4.0, 'iw_prob_clip': 0.016894563390295676, 'iw_n_components': 40, 'iw_logistic_c': 1.4037349047291456e-05, 'iw_pca_fit': 'combined', 'iw_solver': 'lbfgs', 'iw_rho': 1.0}. Best is trial 84 with value: 0.2289525216150688.
2026-06-01 21:49:57 | INFO | Trial 174 | outer=7 | alpha=3.760e+04 n_pcs=1500 (pc_topk) weight={'name': 'pc_logistic', 'floor': 1e-06, 'clip_max': 4.0, 'prob_clip': 0.016760298905672072, 'n_components': 40, 'logistic_c': 0.311846545994663, 'pca_fit': 'combined', 'solver': 'lbfgs', 'max_iter': 2000, 'fit_intercept': True, 'standardize_with_source': True, 'rho': 1.0}
[I 2026-06-01 21:50:12,483] Trial 174 finished with value: 0.20902045233711158 and parameters: {'alpha': 37602.73515300068, 'n_pcs': 1500, 'iw_method': 'pc_logistic', 'iw_clip_max': 4.0, 'iw_prob_clip': 0.016760298905672072, 'iw_n_components': 40, 'iw_logistic_c': 0.311846545994663, 'iw_pca_fit': 'combined', 'iw_solver': 'lbfgs', 'iw_rho': 1.0}. Best is trial 84 with value: 0.2289525216150688.
2026-06-01 21:50:12 | INFO | Trial 175 | outer=7 | alpha=4.979e+04 n_pcs=4000 (pc_topk) weight={'name': 'pc_logistic', 'floor': 1e-06, 'clip_max': 4.0, 'prob_clip': 0.01632195240990978, 'n_components': 40, 'logistic_c': 1.7543629199438866e-05, 'pca_fit': 'combined', 'solver': 'lbfgs', 'max_iter': 2000, 'fit_intercept': True, 'standardize_with_source': True, 'rho': 1.0}
[I 2026-06-01 21:50:25,284] Trial 175 finished with value: 0.229450612280315 and parameters: {'alpha': 49785.23780717685, 'n_pcs': 4000, 'iw_method': 'pc_logistic', 'iw_clip_max': 4.0, 'iw_prob_clip': 0.01632195240990978, 'iw_n_components': 40, 'iw_logistic_c': 1.7543629199438866e-05, 'iw_pca_fit': 'combined', 'iw_solver': 'lbfgs', 'iw_rho': 1.0}. Best is trial 175 with value: 0.229450612280315.
2026-06-01 21:50:25 | INFO | Trial 176 | outer=7 | alpha=6.017e+04 n_pcs=4000 (pc_topk) weight={'name': 'pc_logistic', 'floor': 1e-06, 'clip_max': 4.0, 'prob_clip': 0.015318171007473944, 'n_components': 40, 'logistic_c': 2.1237093295052243e-05, 'pca_fit': 'combined', 'solver': 'lbfgs', 'max_iter': 2000, 'fit_intercept': True, 'standardize_with_source': True, 'rho': 1.0}
[I 2026-06-01 21:50:39,184] Trial 176 finished with value: 0.22939954594394596 and parameters: {'alpha': 60168.57045857259, 'n_pcs': 4000, 'iw_method': 'pc_logistic', 'iw_clip_max': 4.0, 'iw_prob_clip': 0.015318171007473944, 'iw_n_components': 40, 'iw_logistic_c': 2.1237093295052243e-05, 'iw_pca_fit': 'combined', 'iw_solver': 'lbfgs', 'iw_rho': 1.0}. Best is trial 175 with value: 0.229450612280315.
2026-06-01 21:50:39 | INFO | Trial 177 | outer=7 | alpha=5.147e+04 n_pcs=4000 (pc_topk) weight={'name': 'uniform'}
[I 2026-06-01 21:50:46,236] Trial 177 finished with value: 0.21889573496490922 and parameters: {'alpha': 51474.9379092065, 'n_pcs': 4000, 'iw_method': 'uniform'}. Best is trial 175 with value: 0.229450612280315.
2026-06-01 21:50:46 | INFO | Trial 178 | outer=7 | alpha=6.452e+04 n_pcs=4000 (pc_topk) weight={'name': 'pc_logistic', 'floor': 1e-06, 'clip_max': 4.0, 'prob_clip': 0.01544592124874898, 'n_components': 40, 'logistic_c': 2.262666378839943e-05, 'pca_fit': 'combined', 'solver': 'lbfgs', 'max_iter': 2000, 'fit_intercept': True, 'standardize_with_source': True, 'rho': 1.0}
[I 2026-06-01 21:50:58,878] Trial 178 finished with value: 0.22935481869299879 and parameters: {'alpha': 64524.88006944154, 'n_pcs': 4000, 'iw_method': 'pc_logistic', 'iw_clip_max': 4.0, 'iw_prob_clip': 0.01544592124874898, 'iw_n_components': 40, 'iw_logistic_c': 2.262666378839943e-05, 'iw_pca_fit': 'combined', 'iw_solver': 'lbfgs', 'iw_rho': 1.0}. Best is trial 175 with value: 0.229450612280315.
2026-06-01 21:50:58 | INFO | Trial 179 | outer=7 | alpha=6.403e+04 n_pcs=4000 (pc_topk) weight={'name': 'pc_logistic', 'floor': 1e-06, 'clip_max': 4.0, 'prob_clip': 0.0151621103275802, 'n_components': 60, 'logistic_c': 2.5633143867619996e-05, 'pca_fit': 'combined', 'solver': 'lbfgs', 'max_iter': 2000, 'fit_intercept': True, 'standardize_with_source': True, 'rho': 1.0}
[I 2026-06-01 21:51:10,759] Trial 179 finished with value: 0.23023279731129884 and parameters: {'alpha': 64034.153818591425, 'n_pcs': 4000, 'iw_method': 'pc_logistic', 'iw_clip_max': 4.0, 'iw_prob_clip': 0.0151621103275802, 'iw_n_components': 60, 'iw_logistic_c': 2.5633143867619996e-05, 'iw_pca_fit': 'combined', 'iw_solver': 'lbfgs', 'iw_rho': 1.0}. Best is trial 179 with value: 0.23023279731129884.
2026-06-01 21:51:10 | INFO | Trial 180 | outer=7 | alpha=6.947e+04 n_pcs=4000 (pc_topk) weight={'name': 'pc_logistic', 'floor': 1e-06, 'clip_max': 4.0, 'prob_clip': 0.015245788808623635, 'n_components': 60, 'logistic_c': 2.405027936766423e-05, 'pca_fit': 'combined', 'solver': 'lbfgs', 'max_iter': 2000, 'fit_intercept': True, 'standardize_with_source': True, 'rho': 1.0}
[I 2026-06-01 21:51:22,803] Trial 180 finished with value: 0.23023184398722624 and parameters: {'alpha': 69468.01058769549, 'n_pcs': 4000, 'iw_method': 'pc_logistic', 'iw_clip_max': 4.0, 'iw_prob_clip': 0.015245788808623635, 'iw_n_components': 60, 'iw_logistic_c': 2.405027936766423e-05, 'iw_pca_fit': 'combined', 'iw_solver': 'lbfgs', 'iw_rho': 1.0}. Best is trial 179 with value: 0.23023279731129884.
2026-06-01 21:51:22 | INFO | Trial 181 | outer=7 | alpha=6.903e+04 n_pcs=4000 (pc_topk) weight={'name': 'pc_logistic', 'floor': 1e-06, 'clip_max': 4.0, 'prob_clip': 0.015263938521012741, 'n_components': 60, 'logistic_c': 2.3831134474249362e-05, 'pca_fit': 'combined', 'solver': 'lbfgs', 'max_iter': 2000, 'fit_intercept': True, 'standardize_with_source': True, 'rho': 1.0}
[I 2026-06-01 21:51:36,667] Trial 181 finished with value: 0.23024635835446375 and parameters: {'alpha': 69032.72364693187, 'n_pcs': 4000, 'iw_method': 'pc_logistic', 'iw_clip_max': 4.0, 'iw_prob_clip': 0.015263938521012741, 'iw_n_components': 60, 'iw_logistic_c': 2.3831134474249362e-05, 'iw_pca_fit': 'combined', 'iw_solver': 'lbfgs', 'iw_rho': 1.0}. Best is trial 181 with value: 0.23024635835446375.
2026-06-01 21:51:36 | INFO | Trial 182 | outer=7 | alpha=6.778e+04 n_pcs=4000 (pc_topk) weight={'name': 'pc_logistic', 'floor': 1e-06, 'clip_max': 4.0, 'prob_clip': 0.015260276561665334, 'n_components': 60, 'logistic_c': 2.382239882259863e-05, 'pca_fit': 'combined', 'solver': 'lbfgs', 'max_iter': 2000, 'fit_intercept': True, 'standardize_with_source': True, 'rho': 1.0}
[I 2026-06-01 21:51:49,796] Trial 182 finished with value: 0.23026227017778916 and parameters: {'alpha': 67783.97619243174, 'n_pcs': 4000, 'iw_method': 'pc_logistic', 'iw_clip_max': 4.0, 'iw_prob_clip': 0.015260276561665334, 'iw_n_components': 60, 'iw_logistic_c': 2.382239882259863e-05, 'iw_pca_fit': 'combined', 'iw_solver': 'lbfgs', 'iw_rho': 1.0}. Best is trial 182 with value: 0.23026227017778916.
2026-06-01 21:51:49 | INFO | Trial 183 | outer=7 | alpha=6.918e+04 n_pcs=4000 (pc_topk) weight={'name': 'pc_logistic', 'floor': 1e-06, 'clip_max': 4.0, 'prob_clip': 0.01340854717675542, 'n_components': 60, 'logistic_c': 2.144423590807979e-05, 'pca_fit': 'combined', 'solver': 'lbfgs', 'max_iter': 2000, 'fit_intercept': True, 'standardize_with_source': True, 'rho': 1.0}
[I 2026-06-01 21:52:03,240] Trial 183 finished with value: 0.22997707774443824 and parameters: {'alpha': 69176.19360178617, 'n_pcs': 4000, 'iw_method': 'pc_logistic', 'iw_clip_max': 4.0, 'iw_prob_clip': 0.01340854717675542, 'iw_n_components': 60, 'iw_logistic_c': 2.144423590807979e-05, 'iw_pca_fit': 'combined', 'iw_solver': 'lbfgs', 'iw_rho': 1.0}. Best is trial 182 with value: 0.23026227017778916.
2026-06-01 21:52:03 | INFO | Trial 184 | outer=7 | alpha=8.626e+04 n_pcs=4000 (pc_topk) weight={'name': 'pc_logistic', 'floor': 1e-06, 'clip_max': 4.0, 'prob_clip': 0.013134619604355871, 'n_components': 60, 'logistic_c': 2.2382370478551666e-05, 'pca_fit': 'combined', 'solver': 'lbfgs', 'max_iter': 2000, 'fit_intercept': True, 'standardize_with_source': True, 'rho': 1.0}
[I 2026-06-01 21:52:16,728] Trial 184 finished with value: 0.22943959751213755 and parameters: {'alpha': 86255.86331948, 'n_pcs': 4000, 'iw_method': 'pc_logistic', 'iw_clip_max': 4.0, 'iw_prob_clip': 0.013134619604355871, 'iw_n_components': 60, 'iw_logistic_c': 2.2382370478551666e-05, 'iw_pca_fit': 'combined', 'iw_solver': 'lbfgs', 'iw_rho': 1.0}. Best is trial 182 with value: 0.23026227017778916.
2026-06-01 21:52:16 | INFO | Trial 185 | outer=7 | alpha=8.345e+04 n_pcs=4000 (pc_topk) weight={'name': 'pc_logistic', 'floor': 1e-06, 'clip_max': 4.0, 'prob_clip': 0.013054764131859593, 'n_components': 60, 'logistic_c': 2.4582088201967173e-05, 'pca_fit': 'combined', 'solver': 'lbfgs', 'max_iter': 2000, 'fit_intercept': True, 'standardize_with_source': True, 'rho': 1.0}
[I 2026-06-01 21:52:28,931] Trial 185 finished with value: 0.22956778870026823 and parameters: {'alpha': 83445.14630683529, 'n_pcs': 4000, 'iw_method': 'pc_logistic', 'iw_clip_max': 4.0, 'iw_prob_clip': 0.013054764131859593, 'iw_n_components': 60, 'iw_logistic_c': 2.4582088201967173e-05, 'iw_pca_fit': 'combined', 'iw_solver': 'lbfgs', 'iw_rho': 1.0}. Best is trial 182 with value: 0.23026227017778916.
2026-06-01 21:52:28 | INFO | Trial 186 | outer=7 | alpha=8.437e+04 n_pcs=4000 (pc_topk) weight={'name': 'pc_logistic', 'floor': 1e-06, 'clip_max': 4.0, 'prob_clip': 0.012903755195937843, 'n_components': 60, 'logistic_c': 2.9030964646387805e-05, 'pca_fit': 'combined', 'solver': 'lbfgs', 'max_iter': 2000, 'fit_intercept': True, 'standardize_with_source': True, 'rho': 1.0}
[I 2026-06-01 21:52:42,162] Trial 186 finished with value: 0.22964244043834148 and parameters: {'alpha': 84370.80716061384, 'n_pcs': 4000, 'iw_method': 'pc_logistic', 'iw_clip_max': 4.0, 'iw_prob_clip': 0.012903755195937843, 'iw_n_components': 60, 'iw_logistic_c': 2.9030964646387805e-05, 'iw_pca_fit': 'combined', 'iw_solver': 'lbfgs', 'iw_rho': 1.0}. Best is trial 182 with value: 0.23026227017778916.
2026-06-01 21:52:42 | INFO | Trial 187 | outer=7 | alpha=8.982e+04 n_pcs=3500 (pc_topk) weight={'name': 'pc_logistic', 'floor': 1e-06, 'clip_max': 4.0, 'prob_clip': 0.012597732997896743, 'n_components': 60, 'logistic_c': 2.4571320855799766e-05, 'pca_fit': 'combined', 'solver': 'lbfgs', 'max_iter': 2000, 'fit_intercept': True, 'standardize_with_source': True, 'rho': 1.0}
[I 2026-06-01 21:52:53,728] Trial 187 finished with value: 0.2263588435503654 and parameters: {'alpha': 89824.3093937708, 'n_pcs': 3500, 'iw_method': 'pc_logistic', 'iw_clip_max': 4.0, 'iw_prob_clip': 0.012597732997896743, 'iw_n_components': 60, 'iw_logistic_c': 2.4571320855799766e-05, 'iw_pca_fit': 'combined', 'iw_solver': 'lbfgs', 'iw_rho': 1.0}. Best is trial 182 with value: 0.23026227017778916.
2026-06-01 21:52:53 | INFO | Trial 188 | outer=7 | alpha=7.990e+04 n_pcs=4000 (pc_topk) weight={'name': 'pc_logistic', 'floor': 1e-06, 'clip_max': 4.0, 'prob_clip': 0.011541019834015663, 'n_components': 60, 'logistic_c': 4.0335358980367004e-05, 'pca_fit': 'combined', 'solver': 'lbfgs', 'max_iter': 2000, 'fit_intercept': True, 'standardize_with_source': True, 'rho': 1.0}
[I 2026-06-01 21:53:06,769] Trial 188 finished with value: 0.22926120926982474 and parameters: {'alpha': 79901.44796540635, 'n_pcs': 4000, 'iw_method': 'pc_logistic', 'iw_clip_max': 4.0, 'iw_prob_clip': 0.011541019834015663, 'iw_n_components': 60, 'iw_logistic_c': 4.0335358980367004e-05, 'iw_pca_fit': 'combined', 'iw_solver': 'lbfgs', 'iw_rho': 1.0}. Best is trial 182 with value: 0.23026227017778916.
2026-06-01 21:53:06 | INFO | Trial 189 | outer=7 | alpha=7.107e+04 n_pcs=4000 (pc_topk) weight={'name': 'pc_logistic', 'floor': 1e-06, 'clip_max': 4.0, 'prob_clip': 0.011117556795483891, 'n_components': 60, 'logistic_c': 3.537541872225122e-05, 'pca_fit': 'combined', 'solver': 'lbfgs', 'max_iter': 2000, 'fit_intercept': True, 'standardize_with_source': True, 'rho': 1.0}
[I 2026-06-01 21:53:19,945] Trial 189 finished with value: 0.22938003945024904 and parameters: {'alpha': 71065.03314816383, 'n_pcs': 4000, 'iw_method': 'pc_logistic', 'iw_clip_max': 4.0, 'iw_prob_clip': 0.011117556795483891, 'iw_n_components': 60, 'iw_logistic_c': 3.537541872225122e-05, 'iw_pca_fit': 'combined', 'iw_solver': 'lbfgs', 'iw_rho': 1.0}. Best is trial 182 with value: 0.23026227017778916.
2026-06-01 21:53:19 | INFO | Trial 190 | outer=7 | alpha=8.262e+04 n_pcs=4000 (pc_topk) weight={'name': 'pc_logistic', 'floor': 1e-06, 'clip_max': 4.0, 'prob_clip': 0.01173403005100156, 'n_components': 60, 'logistic_c': 3.655833490116561e-05, 'pca_fit': 'combined', 'solver': 'lbfgs', 'max_iter': 2000, 'fit_intercept': True, 'standardize_with_source': True, 'rho': 1.0}
[I 2026-06-01 21:53:33,346] Trial 190 finished with value: 0.2294014746294694 and parameters: {'alpha': 82621.24203079427, 'n_pcs': 4000, 'iw_method': 'pc_logistic', 'iw_clip_max': 4.0, 'iw_prob_clip': 0.01173403005100156, 'iw_n_components': 60, 'iw_logistic_c': 3.655833490116561e-05, 'iw_pca_fit': 'combined', 'iw_solver': 'lbfgs', 'iw_rho': 1.0}. Best is trial 182 with value: 0.23026227017778916.
2026-06-01 21:53:33 | INFO | Trial 191 | outer=7 | alpha=8.224e+04 n_pcs=4000 (pc_topk) weight={'name': 'pc_logistic', 'floor': 1e-06, 'clip_max': 4.0, 'prob_clip': 0.011002960165121698, 'n_components': 60, 'logistic_c': 3.084391508729262e-05, 'pca_fit': 'combined', 'solver': 'lbfgs', 'max_iter': 2000, 'fit_intercept': True, 'standardize_with_source': True, 'rho': 1.0}
[I 2026-06-01 21:53:46,774] Trial 191 finished with value: 0.2292975184736264 and parameters: {'alpha': 82239.92857138294, 'n_pcs': 4000, 'iw_method': 'pc_logistic', 'iw_clip_max': 4.0, 'iw_prob_clip': 0.011002960165121698, 'iw_n_components': 60, 'iw_logistic_c': 3.084391508729262e-05, 'iw_pca_fit': 'combined', 'iw_solver': 'lbfgs', 'iw_rho': 1.0}. Best is trial 182 with value: 0.23026227017778916.
2026-06-01 21:53:46 | INFO | Trial 192 | outer=7 | alpha=7.944e+04 n_pcs=4000 (pc_topk) weight={'name': 'pc_logistic', 'floor': 1e-06, 'clip_max': 4.0, 'prob_clip': 0.01049757107058668, 'n_components': 60, 'logistic_c': 3.429379347879396e-05, 'pca_fit': 'combined', 'solver': 'lbfgs', 'max_iter': 2000, 'fit_intercept': True, 'standardize_with_source': True, 'rho': 1.0}
[I 2026-06-01 21:54:00,055] Trial 192 finished with value: 0.22920188170020558 and parameters: {'alpha': 79444.67778666655, 'n_pcs': 4000, 'iw_method': 'pc_logistic', 'iw_clip_max': 4.0, 'iw_prob_clip': 0.01049757107058668, 'iw_n_components': 60, 'iw_logistic_c': 3.429379347879396e-05, 'iw_pca_fit': 'combined', 'iw_solver': 'lbfgs', 'iw_rho': 1.0}. Best is trial 182 with value: 0.23026227017778916.
2026-06-01 21:54:00 | INFO | Trial 193 | outer=7 | alpha=8.132e+04 n_pcs=4000 (pc_topk) weight={'name': 'pc_logistic', 'floor': 1e-06, 'clip_max': 4.0, 'prob_clip': 0.010967714723460862, 'n_components': 60, 'logistic_c': 3.16011736903095e-05, 'pca_fit': 'combined', 'solver': 'lbfgs', 'max_iter': 2000, 'fit_intercept': True, 'standardize_with_source': True, 'rho': 1.0}
[I 2026-06-01 21:54:12,791] Trial 193 finished with value: 0.229303643838689 and parameters: {'alpha': 81317.93809334032, 'n_pcs': 4000, 'iw_method': 'pc_logistic', 'iw_clip_max': 4.0, 'iw_prob_clip': 0.010967714723460862, 'iw_n_components': 60, 'iw_logistic_c': 3.16011736903095e-05, 'iw_pca_fit': 'combined', 'iw_solver': 'lbfgs', 'iw_rho': 1.0}. Best is trial 182 with value: 0.23026227017778916.
2026-06-01 21:54:12 | INFO | Trial 194 | outer=7 | alpha=8.289e+04 n_pcs=4000 (pc_topk) weight={'name': 'pc_logistic', 'floor': 1e-06, 'clip_max': 4.0, 'prob_clip': 0.01030475330057259, 'n_components': 60, 'logistic_c': 3.621781422326349e-05, 'pca_fit': 'combined', 'solver': 'lbfgs', 'max_iter': 2000, 'fit_intercept': True, 'standardize_with_source': True, 'rho': 1.0}
[I 2026-06-01 21:54:25,640] Trial 194 finished with value: 0.22905594827927805 and parameters: {'alpha': 82886.78568642355, 'n_pcs': 4000, 'iw_method': 'pc_logistic', 'iw_clip_max': 4.0, 'iw_prob_clip': 0.01030475330057259, 'iw_n_components': 60, 'iw_logistic_c': 3.621781422326349e-05, 'iw_pca_fit': 'combined', 'iw_solver': 'lbfgs', 'iw_rho': 1.0}. Best is trial 182 with value: 0.23026227017778916.
2026-06-01 21:54:25 | INFO | Trial 195 | outer=7 | alpha=1.382e+05 n_pcs=4000 (pc_topk) weight={'name': 'pc_logistic', 'floor': 1e-06, 'clip_max': 4.0, 'prob_clip': 0.009804729151322883, 'n_components': 60, 'logistic_c': 4.138718558147221e-05, 'pca_fit': 'combined', 'solver': 'lbfgs', 'max_iter': 2000, 'fit_intercept': True, 'standardize_with_source': True, 'rho': 1.0}
[I 2026-06-01 21:54:38,759] Trial 195 finished with value: 0.2271513440307083 and parameters: {'alpha': 138177.0908480392, 'n_pcs': 4000, 'iw_method': 'pc_logistic', 'iw_clip_max': 4.0, 'iw_prob_clip': 0.009804729151322883, 'iw_n_components': 60, 'iw_logistic_c': 4.138718558147221e-05, 'iw_pca_fit': 'combined', 'iw_solver': 'lbfgs', 'iw_rho': 1.0}. Best is trial 182 with value: 0.23026227017778916.
2026-06-01 21:54:38 | INFO | Trial 196 | outer=7 | alpha=8.454e+04 n_pcs=4000 (pc_topk) weight={'name': 'pc_logistic', 'floor': 1e-06, 'clip_max': 4.0, 'prob_clip': 0.011498498988696742, 'n_components': 60, 'logistic_c': 3.768395257753747e-05, 'pca_fit': 'combined', 'solver': 'lbfgs', 'max_iter': 2000, 'fit_intercept': True, 'standardize_with_source': True, 'rho': 1.0}
[I 2026-06-01 21:54:52,524] Trial 196 finished with value: 0.229288039809928 and parameters: {'alpha': 84539.59496081187, 'n_pcs': 4000, 'iw_method': 'pc_logistic', 'iw_clip_max': 4.0, 'iw_prob_clip': 0.011498498988696742, 'iw_n_components': 60, 'iw_logistic_c': 3.768395257753747e-05, 'iw_pca_fit': 'combined', 'iw_solver': 'lbfgs', 'iw_rho': 1.0}. Best is trial 182 with value: 0.23026227017778916.
2026-06-01 21:54:52 | INFO | Trial 197 | outer=7 | alpha=8.415e+04 n_pcs=4000 (pc_topk) weight={'name': 'pc_logistic', 'floor': 1e-06, 'clip_max': 4.0, 'prob_clip': 0.011011745264049976, 'n_components': 60, 'logistic_c': 3.398470064560369e-05, 'pca_fit': 'combined', 'solver': 'lbfgs', 'max_iter': 2000, 'fit_intercept': True, 'standardize_with_source': True, 'rho': 1.0}
[I 2026-06-01 21:55:06,052] Trial 197 finished with value: 0.2292366575878188 and parameters: {'alpha': 84145.1854189023, 'n_pcs': 4000, 'iw_method': 'pc_logistic', 'iw_clip_max': 4.0, 'iw_prob_clip': 0.011011745264049976, 'iw_n_components': 60, 'iw_logistic_c': 3.398470064560369e-05, 'iw_pca_fit': 'combined', 'iw_solver': 'lbfgs', 'iw_rho': 1.0}. Best is trial 182 with value: 0.23026227017778916.
2026-06-01 21:55:06 | INFO | Trial 198 | outer=7 | alpha=8.497e+04 n_pcs=4000 (pc_topk) weight={'name': 'pc_logistic', 'floor': 1e-06, 'clip_max': 4.0, 'prob_clip': 0.011190090412569291, 'n_components': 60, 'logistic_c': 2.318699431289709e-07, 'pca_fit': 'combined', 'solver': 'lbfgs', 'max_iter': 2000, 'fit_intercept': True, 'standardize_with_source': True, 'rho': 1.0}
[I 2026-06-01 21:55:18,107] Trial 198 finished with value: 0.21582865484089703 and parameters: {'alpha': 84966.75226324788, 'n_pcs': 4000, 'iw_method': 'pc_logistic', 'iw_clip_max': 4.0, 'iw_prob_clip': 0.011190090412569291, 'iw_n_components': 60, 'iw_logistic_c': 2.318699431289709e-07, 'iw_pca_fit': 'combined', 'iw_solver': 'lbfgs', 'iw_rho': 1.0}. Best is trial 182 with value: 0.23026227017778916.
2026-06-01 21:55:18 | INFO | Trial 199 | outer=7 | alpha=1.015e+05 n_pcs=4000 (pc_topk) weight={'name': 'pc_logistic', 'floor': 1e-06, 'clip_max': 4.0, 'prob_clip': 0.008958235809496194, 'n_components': 60, 'logistic_c': 3.502522785800545e-05, 'pca_fit': 'combined', 'solver': 'lbfgs', 'max_iter': 2000, 'fit_intercept': True, 'standardize_with_source': True, 'rho': 1.0}
