[I 2026-06-01 01:36:38,773] Trial 31 finished with value: 0.22255882363353266 and parameters: {'alpha': 309147.05806210305, 'n_pcs': 4000, 'weight_scheme': 'exponential', 'weight_clip_max': 5.0, 'weight_exponential_beta': 7.430641993254369}. Best is trial 16 with value: 0.2230252978147868.
2026-06-01 01:36:38 | INFO | src.nested_cv_avggrm_weighted_unified | Trial 32 | outer=8 | alpha=3.504e+05 n_pcs=4000 (pc_topk) weight_search=on
2026-06-01 01:36:38 | INFO | src.nested_cv_avggrm_weighted_unified | Trial 32 | outer=8 | weight={'name': 'exponential', 'floor': 1e-06, 'clip_max': 5.0, 'beta': 6.567156513841621}
[I 2026-06-01 01:36:44,447] Trial 32 finished with value: 0.2224307776193462 and parameters: {'alpha': 350377.4185720809, 'n_pcs': 4000, 'weight_scheme': 'exponential', 'weight_clip_max': 5.0, 'weight_exponential_beta': 6.567156513841621}. Best is trial 16 with value: 0.2230252978147868.
2026-06-01 01:36:44 | INFO | src.nested_cv_avggrm_weighted_unified | Trial 33 | outer=8 | alpha=2.026e+05 n_pcs=3500 (pc_topk) weight_search=on
2026-06-01 01:36:44 | INFO | src.nested_cv_avggrm_weighted_unified | Trial 33 | outer=8 | weight={'name': 'exponential', 'floor': 1e-06, 'clip_max': 5.0, 'beta': 7.758858664061094}
[I 2026-06-01 01:36:49,296] Trial 33 finished with value: 0.22091430918908248 and parameters: {'alpha': 202579.42415128587, 'n_pcs': 3500, 'weight_scheme': 'exponential', 'weight_clip_max': 5.0, 'weight_exponential_beta': 7.758858664061094}. Best is trial 16 with value: 0.2230252978147868.
2026-06-01 01:36:49 | INFO | src.nested_cv_avggrm_weighted_unified | Trial 34 | outer=8 | alpha=4.435e+05 n_pcs=4500 (pc_topk) weight_search=on
2026-06-01 01:36:49 | INFO | src.nested_cv_avggrm_weighted_unified | Trial 34 | outer=8 | weight={'name': 'exponential', 'floor': 1e-06, 'clip_max': 20.0, 'beta': 5.861319868442756}
[I 2026-06-01 01:36:56,179] Trial 34 finished with value: 0.2041014997106727 and parameters: {'alpha': 443479.2682558709, 'n_pcs': 4500, 'weight_scheme': 'exponential', 'weight_clip_max': 20.0, 'weight_exponential_beta': 5.861319868442756}. Best is trial 16 with value: 0.2230252978147868.
2026-06-01 01:36:56 | INFO | src.nested_cv_avggrm_weighted_unified | Trial 35 | outer=8 | alpha=1.059e+06 n_pcs=4000 (pc_topk) weight_search=on
2026-06-01 01:36:56 | INFO | src.nested_cv_avggrm_weighted_unified | Trial 35 | outer=8 | weight={'name': 'exponential', 'floor': 1e-06, 'clip_max': 5.0, 'beta': 6.862042428225406}
[I 2026-06-01 01:37:01,826] Trial 35 finished with value: 0.21814857505310528 and parameters: {'alpha': 1058669.212173339, 'n_pcs': 4000, 'weight_scheme': 'exponential', 'weight_clip_max': 5.0, 'weight_exponential_beta': 6.862042428225406}. Best is trial 16 with value: 0.2230252978147868.
2026-06-01 01:37:01 | INFO | src.nested_cv_avggrm_weighted_unified | Trial 36 | outer=8 | alpha=1.075e+05 n_pcs=5000 (pc_topk) weight_search=on
2026-06-01 01:37:01 | INFO | src.nested_cv_avggrm_weighted_unified | Trial 36 | outer=8 | weight={'name': 'exponential', 'floor': 1e-06, 'clip_max': 10.0, 'beta': 7.926767222727194}
[I 2026-06-01 01:37:09,883] Trial 36 finished with value: 0.21527912875284896 and parameters: {'alpha': 107485.96916965683, 'n_pcs': 5000, 'weight_scheme': 'exponential', 'weight_clip_max': 10.0, 'weight_exponential_beta': 7.926767222727194}. Best is trial 16 with value: 0.2230252978147868.
2026-06-01 01:37:09 | INFO | src.nested_cv_avggrm_weighted_unified | Trial 37 | outer=8 | alpha=1.879e+04 n_pcs=3500 (pc_topk) weight_search=on
2026-06-01 01:37:09 | INFO | src.nested_cv_avggrm_weighted_unified | Trial 37 | outer=8 | weight={'name': 'exponential', 'floor': 1e-06, 'clip_max': None, 'beta': 6.230545960135118}
[I 2026-06-01 01:37:14,870] Trial 37 finished with value: 0.19803665436562223 and parameters: {'alpha': 18786.125175288267, 'n_pcs': 3500, 'weight_scheme': 'exponential', 'weight_clip_max': None, 'weight_exponential_beta': 6.230545960135118}. Best is trial 16 with value: 0.2230252978147868.
2026-06-01 01:37:14 | INFO | src.nested_cv_avggrm_weighted_unified | Trial 38 | outer=8 | alpha=1.913e+05 n_pcs=4000 (pc_topk) weight_search=on
2026-06-01 01:37:14 | INFO | src.nested_cv_avggrm_weighted_unified | Trial 38 | outer=8 | weight={'name': 'uniform', 'floor': 1e-06, 'clip_max': 5.0}
2026-06-01 01:37:17 | INFO | src.nested_cv_avggrm_weighted_unified | Trial 38 | outer=8 | pruned after 5/10 inner folds (mean r=0.2121)
[I 2026-06-01 01:37:17,906] Trial 38 pruned. 
2026-06-01 01:37:17 | INFO | src.nested_cv_avggrm_weighted_unified | Trial 39 | outer=8 | alpha=7.338e+04 n_pcs=2500 (pc_topk) weight_search=on
2026-06-01 01:37:17 | INFO | src.nested_cv_avggrm_weighted_unified | Trial 39 | outer=8 | weight={'name': 'exponential', 'floor': 1e-06, 'clip_max': 10.0, 'beta': 5.320636793341021}
[I 2026-06-01 01:37:20,851] Trial 39 finished with value: 0.20849733595490036 and parameters: {'alpha': 73375.33141357788, 'n_pcs': 2500, 'weight_scheme': 'exponential', 'weight_clip_max': 10.0, 'weight_exponential_beta': 5.320636793341021}. Best is trial 16 with value: 0.2230252978147868.
2026-06-01 01:37:20 | INFO | src.nested_cv_avggrm_weighted_unified | Trial 40 | outer=8 | alpha=3.269e+04 n_pcs=3000 (pc_topk) weight_search=on
2026-06-01 01:37:20 | INFO | src.nested_cv_avggrm_weighted_unified | Trial 40 | outer=8 | weight={'name': 'exponential', 'floor': 1e-06, 'clip_max': 5.0, 'beta': 3.7649704708049914}
[I 2026-06-01 01:37:25,031] Trial 40 finished with value: 0.21207703066782405 and parameters: {'alpha': 32693.745897455086, 'n_pcs': 3000, 'weight_scheme': 'exponential', 'weight_clip_max': 5.0, 'weight_exponential_beta': 3.7649704708049914}. Best is trial 16 with value: 0.2230252978147868.
2026-06-01 01:37:25 | INFO | src.nested_cv_avggrm_weighted_unified | Trial 41 | outer=8 | alpha=4.500e+05 n_pcs=4000 (pc_topk) weight_search=on
2026-06-01 01:37:25 | INFO | src.nested_cv_avggrm_weighted_unified | Trial 41 | outer=8 | weight={'name': 'exponential', 'floor': 1e-06, 'clip_max': 5.0, 'beta': 7.284678700865912}
[I 2026-06-01 01:37:30,860] Trial 41 finished with value: 0.22191923349116896 and parameters: {'alpha': 450048.28697916016, 'n_pcs': 4000, 'weight_scheme': 'exponential', 'weight_clip_max': 5.0, 'weight_exponential_beta': 7.284678700865912}. Best is trial 16 with value: 0.2230252978147868.
2026-06-01 01:37:30 | INFO | src.nested_cv_avggrm_weighted_unified | Trial 42 | outer=8 | alpha=2.971e+05 n_pcs=4500 (pc_topk) weight_search=on
2026-06-01 01:37:30 | INFO | src.nested_cv_avggrm_weighted_unified | Trial 42 | outer=8 | weight={'name': 'exponential', 'floor': 1e-06, 'clip_max': 5.0, 'beta': 7.412510492284553}
[I 2026-06-01 01:37:37,747] Trial 42 finished with value: 0.22177780270074887 and parameters: {'alpha': 297130.6530098301, 'n_pcs': 4500, 'weight_scheme': 'exponential', 'weight_clip_max': 5.0, 'weight_exponential_beta': 7.412510492284553}. Best is trial 16 with value: 0.2230252978147868.
2026-06-01 01:37:37 | INFO | src.nested_cv_avggrm_weighted_unified | Trial 43 | outer=8 | alpha=2.153e+05 n_pcs=3500 (pc_topk) weight_search=on
2026-06-01 01:37:37 | INFO | src.nested_cv_avggrm_weighted_unified | Trial 43 | outer=8 | weight={'name': 'exponential', 'floor': 1e-06, 'clip_max': 5.0, 'beta': 6.729752580223081}
[I 2026-06-01 01:37:42,952] Trial 43 finished with value: 0.2217936509991468 and parameters: {'alpha': 215251.02100757853, 'n_pcs': 3500, 'weight_scheme': 'exponential', 'weight_clip_max': 5.0, 'weight_exponential_beta': 6.729752580223081}. Best is trial 16 with value: 0.2230252978147868.
2026-06-01 01:37:42 | INFO | src.nested_cv_avggrm_weighted_unified | Trial 44 | outer=8 | alpha=5.219e+05 n_pcs=4500 (pc_topk) weight_search=on
2026-06-01 01:37:42 | INFO | src.nested_cv_avggrm_weighted_unified | Trial 44 | outer=8 | weight={'name': 'exponential', 'floor': 1e-06, 'clip_max': 20.0, 'beta': 8.563295116010675}
[I 2026-06-01 01:37:49,809] Trial 44 finished with value: 0.20347719294476407 and parameters: {'alpha': 521853.85698220646, 'n_pcs': 4500, 'weight_scheme': 'exponential', 'weight_clip_max': 20.0, 'weight_exponential_beta': 8.563295116010675}. Best is trial 16 with value: 0.2230252978147868.
2026-06-01 01:37:49 | INFO | src.nested_cv_avggrm_weighted_unified | Trial 45 | outer=8 | alpha=1.342e+06 n_pcs=4000 (pc_topk) weight_search=on
2026-06-01 01:37:49 | INFO | src.nested_cv_avggrm_weighted_unified | Trial 45 | outer=8 | weight={'name': 'exponential', 'floor': 1e-06, 'clip_max': 3.0, 'beta': 7.723525772791155}
[I 2026-06-01 01:37:55,523] Trial 45 finished with value: 0.21638851031957876 and parameters: {'alpha': 1342449.309281316, 'n_pcs': 4000, 'weight_scheme': 'exponential', 'weight_clip_max': 3.0, 'weight_exponential_beta': 7.723525772791155}. Best is trial 16 with value: 0.2230252978147868.
2026-06-01 01:37:55 | INFO | src.nested_cv_avggrm_weighted_unified | Trial 46 | outer=8 | alpha=4.020e+03 n_pcs=4000 (pc_topk) weight_search=on
2026-06-01 01:37:55 | INFO | src.nested_cv_avggrm_weighted_unified | Trial 46 | outer=8 | weight={'name': 'exponential', 'floor': 1e-06, 'clip_max': 5.0, 'beta': 9.219305246571384}
2026-06-01 01:37:58 | INFO | src.nested_cv_avggrm_weighted_unified | Trial 46 | outer=8 | pruned after 5/10 inner folds (mean r=0.1978)
[I 2026-06-01 01:37:58,378] Trial 46 pruned. 
2026-06-01 01:37:58 | INFO | src.nested_cv_avggrm_weighted_unified | Trial 47 | outer=8 | alpha=7.389e+04 n_pcs=3000 (pc_topk) weight_search=on
2026-06-01 01:37:58 | INFO | src.nested_cv_avggrm_weighted_unified | Trial 47 | outer=8 | weight={'name': 'linear', 'floor': 1e-06, 'clip_max': 5.0, 'min_weight': 0.3629512657579377, 'max_weight': 2.399446156454588}
[I 2026-06-01 01:38:02,155] Trial 47 finished with value: 0.21919412774852934 and parameters: {'alpha': 73892.20410746205, 'n_pcs': 3000, 'weight_scheme': 'linear', 'weight_clip_max': 5.0, 'weight_linear_min_weight': 0.3629512657579377, 'weight_linear_max_weight': 2.399446156454588}. Best is trial 16 with value: 0.2230252978147868.
2026-06-01 01:38:02 | INFO | src.nested_cv_avggrm_weighted_unified | Trial 48 | outer=8 | alpha=7.712e+05 n_pcs=5000 (pc_topk) weight_search=on
2026-06-01 01:38:02 | INFO | src.nested_cv_avggrm_weighted_unified | Trial 48 | outer=8 | weight={'name': 'uniform', 'floor': 1e-06, 'clip_max': 5.0}
2026-06-01 01:38:05 | INFO | src.nested_cv_avggrm_weighted_unified | Trial 48 | outer=8 | pruned after 5/10 inner folds (mean r=0.1889)
[I 2026-06-01 01:38:05,764] Trial 48 pruned. 
2026-06-01 01:38:05 | INFO | src.nested_cv_avggrm_weighted_unified | Trial 49 | outer=8 | alpha=1.359e+05 n_pcs=4000 (pc_topk) weight_search=on
2026-06-01 01:38:05 | INFO | src.nested_cv_avggrm_weighted_unified | Trial 49 | outer=8 | weight={'name': 'exponential', 'floor': 1e-06, 'clip_max': 5.0, 'beta': 6.130476730446252}
[I 2026-06-01 01:38:11,556] Trial 49 finished with value: 0.22272911625198688 and parameters: {'alpha': 135910.23757211032, 'n_pcs': 4000, 'weight_scheme': 'exponential', 'weight_clip_max': 5.0, 'weight_exponential_beta': 6.130476730446252}. Best is trial 16 with value: 0.2230252978147868.
2026-06-01 01:38:11 | INFO | src.nested_cv_avggrm_weighted_unified | Trial 50 | outer=8 | alpha=4.115e+04 n_pcs=2500 (pc_topk) weight_search=on
2026-06-01 01:38:11 | INFO | src.nested_cv_avggrm_weighted_unified | Trial 50 | outer=8 | weight={'name': 'linear', 'floor': 1e-06, 'clip_max': 3.0, 'min_weight': 0.31994018115236955, 'max_weight': 3.4117078324545704}
[I 2026-06-01 01:38:15,118] Trial 50 finished with value: 0.2134581487092368 and parameters: {'alpha': 41148.9169465059, 'n_pcs': 2500, 'weight_scheme': 'linear', 'weight_clip_max': 3.0, 'weight_linear_min_weight': 0.31994018115236955, 'weight_linear_max_weight': 3.4117078324545704}. Best is trial 16 with value: 0.2230252978147868.
2026-06-01 01:38:15 | INFO | src.nested_cv_avggrm_weighted_unified | Trial 51 | outer=8 | alpha=1.496e+05 n_pcs=3500 (pc_topk) weight_search=on
2026-06-01 01:38:15 | INFO | src.nested_cv_avggrm_weighted_unified | Trial 51 | outer=8 | weight={'name': 'exponential', 'floor': 1e-06, 'clip_max': 5.0, 'beta': 6.242021353366364}
[I 2026-06-01 01:38:20,078] Trial 51 finished with value: 0.22138468912648746 and parameters: {'alpha': 149561.8102618471, 'n_pcs': 3500, 'weight_scheme': 'exponential', 'weight_clip_max': 5.0, 'weight_exponential_beta': 6.242021353366364}. Best is trial 16 with value: 0.2230252978147868.
2026-06-01 01:38:20 | INFO | src.nested_cv_avggrm_weighted_unified | Trial 52 | outer=8 | alpha=1.306e+05 n_pcs=4000 (pc_topk) weight_search=on
2026-06-01 01:38:20 | INFO | src.nested_cv_avggrm_weighted_unified | Trial 52 | outer=8 | weight={'name': 'exponential', 'floor': 1e-06, 'clip_max': 5.0, 'beta': 5.480222189261021}
[I 2026-06-01 01:38:25,792] Trial 52 finished with value: 0.22295118737078937 and parameters: {'alpha': 130553.46786318222, 'n_pcs': 4000, 'weight_scheme': 'exponential', 'weight_clip_max': 5.0, 'weight_exponential_beta': 5.480222189261021}. Best is trial 16 with value: 0.2230252978147868.
2026-06-01 01:38:25 | INFO | src.nested_cv_avggrm_weighted_unified | Trial 53 | outer=8 | alpha=8.305e+04 n_pcs=4500 (pc_topk) weight_search=on
2026-06-01 01:38:25 | INFO | src.nested_cv_avggrm_weighted_unified | Trial 53 | outer=8 | weight={'name': 'exponential', 'floor': 1e-06, 'clip_max': 5.0, 'beta': 5.452974507452417}
[I 2026-06-01 01:38:32,655] Trial 53 finished with value: 0.22215916528420623 and parameters: {'alpha': 83049.06250059317, 'n_pcs': 4500, 'weight_scheme': 'exponential', 'weight_clip_max': 5.0, 'weight_exponential_beta': 5.452974507452417}. Best is trial 16 with value: 0.2230252978147868.
2026-06-01 01:38:32 | INFO | src.nested_cv_avggrm_weighted_unified | Trial 54 | outer=8 | alpha=1.541e+05 n_pcs=3500 (pc_topk) weight_search=on
2026-06-01 01:38:32 | INFO | src.nested_cv_avggrm_weighted_unified | Trial 54 | outer=8 | weight={'name': 'exponential', 'floor': 1e-06, 'clip_max': 5.0, 'beta': 4.2510903397733735}
[I 2026-06-01 01:38:37,889] Trial 54 finished with value: 0.22142164109984894 and parameters: {'alpha': 154132.4460452081, 'n_pcs': 3500, 'weight_scheme': 'exponential', 'weight_clip_max': 5.0, 'weight_exponential_beta': 4.2510903397733735}. Best is trial 16 with value: 0.2230252978147868.
2026-06-01 01:38:37 | INFO | src.nested_cv_avggrm_weighted_unified | Trial 55 | outer=8 | alpha=1.220e+05 n_pcs=4000 (pc_topk) weight_search=on
2026-06-01 01:38:37 | INFO | src.nested_cv_avggrm_weighted_unified | Trial 55 | outer=8 | weight={'name': 'exponential', 'floor': 1e-06, 'clip_max': None, 'beta': 6.182628286759158}
[I 2026-06-01 01:38:43,636] Trial 55 finished with value: 0.20888300541631794 and parameters: {'alpha': 122009.849923161, 'n_pcs': 4000, 'weight_scheme': 'exponential', 'weight_clip_max': None, 'weight_exponential_beta': 6.182628286759158}. Best is trial 16 with value: 0.2230252978147868.
2026-06-01 01:38:43 | INFO | src.nested_cv_avggrm_weighted_unified | Trial 56 | outer=8 | alpha=2.294e+04 n_pcs=500 (pc_topk) weight_search=on
2026-06-01 01:38:43 | INFO | src.nested_cv_avggrm_weighted_unified | Trial 56 | outer=8 | weight={'name': 'exponential', 'floor': 1e-06, 'clip_max': 5.0, 'beta': 4.716188494424416}
2026-06-01 01:38:44 | INFO | src.nested_cv_avggrm_weighted_unified | Trial 56 | outer=8 | pruned after 5/10 inner folds (mean r=0.1641)
[I 2026-06-01 01:38:44,104] Trial 56 pruned. 
2026-06-01 01:38:44 | INFO | src.nested_cv_avggrm_weighted_unified | Trial 57 | outer=8 | alpha=5.471e+04 n_pcs=4500 (pc_topk) weight_search=on
2026-06-01 01:38:44 | INFO | src.nested_cv_avggrm_weighted_unified | Trial 57 | outer=8 | weight={'name': 'exponential', 'floor': 1e-06, 'clip_max': 5.0, 'beta': 5.695044931441415}
[I 2026-06-01 01:38:51,024] Trial 57 finished with value: 0.22072391557812185 and parameters: {'alpha': 54706.5695932279, 'n_pcs': 4500, 'weight_scheme': 'exponential', 'weight_clip_max': 5.0, 'weight_exponential_beta': 5.695044931441415}. Best is trial 16 with value: 0.2230252978147868.
2026-06-01 01:38:51 | INFO | src.nested_cv_avggrm_weighted_unified | Trial 58 | outer=8 | alpha=2.206e+05 n_pcs=3000 (pc_topk) weight_search=on
2026-06-01 01:38:51 | INFO | src.nested_cv_avggrm_weighted_unified | Trial 58 | outer=8 | weight={'name': 'exponential', 'floor': 1e-06, 'clip_max': 20.0, 'beta': 6.412961076901482}
[I 2026-06-01 01:38:54,840] Trial 58 finished with value: 0.2070663742596679 and parameters: {'alpha': 220566.39580709368, 'n_pcs': 3000, 'weight_scheme': 'exponential', 'weight_clip_max': 20.0, 'weight_exponential_beta': 6.412961076901482}. Best is trial 16 with value: 0.2230252978147868.
2026-06-01 01:38:54 | INFO | src.nested_cv_avggrm_weighted_unified | Trial 59 | outer=8 | alpha=3.584e+05 n_pcs=3500 (pc_topk) weight_search=on
2026-06-01 01:38:54 | INFO | src.nested_cv_avggrm_weighted_unified | Trial 59 | outer=8 | weight={'name': 'linear', 'floor': 1e-06, 'clip_max': 10.0, 'min_weight': 0.6453295675053757, 'max_weight': 2.2885197165382296}
2026-06-01 01:38:58 | INFO | src.nested_cv_avggrm_weighted_unified | Trial 59 | outer=8 | pruned after 7/10 inner folds (mean r=0.2359)
[I 2026-06-01 01:38:58,326] Trial 59 pruned. 
2026-06-01 01:38:58 | INFO | src.nested_cv_avggrm_weighted_unified | Trial 60 | outer=8 | alpha=1.171e+04 n_pcs=4000 (pc_topk) weight_search=on
2026-06-01 01:38:58 | INFO | src.nested_cv_avggrm_weighted_unified | Trial 60 | outer=8 | weight={'name': 'uniform', 'floor': 1e-06, 'clip_max': 5.0}
[I 2026-06-01 01:39:03,386] Trial 60 finished with value: 0.20341233572970824 and parameters: {'alpha': 11710.65368744512, 'n_pcs': 4000, 'weight_scheme': 'uniform', 'weight_clip_max': 5.0}. Best is trial 16 with value: 0.2230252978147868.
2026-06-01 01:39:03 | INFO | src.nested_cv_avggrm_weighted_unified | Trial 61 | outer=8 | alpha=2.542e+05 n_pcs=4000 (pc_topk) weight_search=on
2026-06-01 01:39:03 | INFO | src.nested_cv_avggrm_weighted_unified | Trial 61 | outer=8 | weight={'name': 'exponential', 'floor': 1e-06, 'clip_max': 5.0, 'beta': 7.006756589975726}
[I 2026-06-01 01:39:09,056] Trial 61 finished with value: 0.22279638819114095 and parameters: {'alpha': 254216.34652398643, 'n_pcs': 4000, 'weight_scheme': 'exponential', 'weight_clip_max': 5.0, 'weight_exponential_beta': 7.006756589975726}. Best is trial 16 with value: 0.2230252978147868.
2026-06-01 01:39:09 | INFO | src.nested_cv_avggrm_weighted_unified | Trial 62 | outer=8 | alpha=2.500e+05 n_pcs=4000 (pc_topk) weight_search=on
2026-06-01 01:39:09 | INFO | src.nested_cv_avggrm_weighted_unified | Trial 62 | outer=8 | weight={'name': 'exponential', 'floor': 1e-06, 'clip_max': 5.0, 'beta': 7.148900499512098}
[I 2026-06-01 01:39:14,740] Trial 62 finished with value: 0.2227493487911616 and parameters: {'alpha': 249970.10870202954, 'n_pcs': 4000, 'weight_scheme': 'exponential', 'weight_clip_max': 5.0, 'weight_exponential_beta': 7.148900499512098}. Best is trial 16 with value: 0.2230252978147868.
2026-06-01 01:39:14 | INFO | src.nested_cv_avggrm_weighted_unified | Trial 63 | outer=8 | alpha=6.061e+05 n_pcs=4500 (pc_topk) weight_search=on
2026-06-01 01:39:14 | INFO | src.nested_cv_avggrm_weighted_unified | Trial 63 | outer=8 | weight={'name': 'exponential', 'floor': 1e-06, 'clip_max': 5.0, 'beta': 5.863202525084714}
[I 2026-06-01 01:39:21,603] Trial 63 finished with value: 0.21917532863255634 and parameters: {'alpha': 606100.4497105498, 'n_pcs': 4500, 'weight_scheme': 'exponential', 'weight_clip_max': 5.0, 'weight_exponential_beta': 5.863202525084714}. Best is trial 16 with value: 0.2230252978147868.
2026-06-01 01:39:21 | INFO | src.nested_cv_avggrm_weighted_unified | Trial 64 | outer=8 | alpha=1.424e+05 n_pcs=4000 (pc_topk) weight_search=on
2026-06-01 01:39:21 | INFO | src.nested_cv_avggrm_weighted_unified | Trial 64 | outer=8 | weight={'name': 'exponential', 'floor': 1e-06, 'clip_max': 5.0, 'beta': 7.105214872267454}
[I 2026-06-01 01:39:27,318] Trial 64 finished with value: 0.22211479600833206 and parameters: {'alpha': 142374.0386537398, 'n_pcs': 4000, 'weight_scheme': 'exponential', 'weight_clip_max': 5.0, 'weight_exponential_beta': 7.105214872267454}. Best is trial 16 with value: 0.2230252978147868.
2026-06-01 01:39:27 | INFO | src.nested_cv_avggrm_weighted_unified | Trial 65 | outer=8 | alpha=1.216e+03 n_pcs=3500 (pc_topk) weight_search=on
2026-06-01 01:39:27 | INFO | src.nested_cv_avggrm_weighted_unified | Trial 65 | outer=8 | weight={'name': 'exponential', 'floor': 1e-06, 'clip_max': 5.0, 'beta': 5.18178597906682}
2026-06-01 01:39:29 | INFO | src.nested_cv_avggrm_weighted_unified | Trial 65 | outer=8 | pruned after 5/10 inner folds (mean r=0.1340)
[I 2026-06-01 01:39:29,826] Trial 65 pruned. 
2026-06-01 01:39:29 | INFO | src.nested_cv_avggrm_weighted_unified | Trial 66 | outer=8 | alpha=4.347e+05 n_pcs=5000 (pc_topk) weight_search=on
2026-06-01 01:39:29 | INFO | src.nested_cv_avggrm_weighted_unified | Trial 66 | outer=8 | weight={'name': 'exponential', 'floor': 1e-06, 'clip_max': 5.0, 'beta': 6.559361224483161}
[I 2026-06-01 01:39:37,849] Trial 66 finished with value: 0.22008320986155047 and parameters: {'alpha': 434663.7797957388, 'n_pcs': 5000, 'weight_scheme': 'exponential', 'weight_clip_max': 5.0, 'weight_exponential_beta': 6.559361224483161}. Best is trial 16 with value: 0.2230252978147868.
2026-06-01 01:39:37 | INFO | src.nested_cv_avggrm_weighted_unified | Trial 67 | outer=8 | alpha=2.427e+05 n_pcs=4000 (pc_topk) weight_search=on
2026-06-01 01:39:37 | INFO | src.nested_cv_avggrm_weighted_unified | Trial 67 | outer=8 | weight={'name': 'exponential', 'floor': 1e-06, 'clip_max': 3.0, 'beta': 8.10058390652623}
