[I 2026-06-01 20:45:51,865] Trial 234 finished with value: 0.2367631342841951 and parameters: {'alpha': 84218.56531284007, 'n_pcs': 4000, 'iw_method': 'pc_logistic', 'iw_clip_max': 1.5, 'iw_prob_clip': 0.01523122227066132, 'iw_n_components': 80, 'iw_logistic_c': 0.5997143692544471, 'iw_pca_fit': 'combined', 'iw_solver': 'lbfgs', 'iw_rho': 0.85}. Best is trial 223 with value: 0.23705194687121506.
2026-06-01 20:45:51 | INFO | Trial 235 | outer=6 | alpha=8.583e+04 n_pcs=4000 (pc_topk) weight={'name': 'pc_logistic', 'floor': 1e-06, 'clip_max': 1.5, 'prob_clip': 0.014883638247973875, 'n_components': 80, 'logistic_c': 0.6109564084800366, 'pca_fit': 'combined', 'solver': 'lbfgs', 'max_iter': 2000, 'fit_intercept': True, 'standardize_with_source': True, 'rho': 0.85}
[I 2026-06-01 20:46:20,715] Trial 235 finished with value: 0.236681477856086 and parameters: {'alpha': 85831.44717455246, 'n_pcs': 4000, 'iw_method': 'pc_logistic', 'iw_clip_max': 1.5, 'iw_prob_clip': 0.014883638247973875, 'iw_n_components': 80, 'iw_logistic_c': 0.6109564084800366, 'iw_pca_fit': 'combined', 'iw_solver': 'lbfgs', 'iw_rho': 0.85}. Best is trial 223 with value: 0.23705194687121506.
2026-06-01 20:46:20 | INFO | Trial 236 | outer=6 | alpha=8.970e+04 n_pcs=4000 (pc_topk) weight={'name': 'pc_logistic', 'floor': 1e-06, 'clip_max': 1.5, 'prob_clip': 0.0150595716826919, 'n_components': 80, 'logistic_c': 0.6727492593844145, 'pca_fit': 'combined', 'solver': 'lbfgs', 'max_iter': 2000, 'fit_intercept': True, 'standardize_with_source': True, 'rho': 0.85}
[I 2026-06-01 20:46:48,069] Trial 236 finished with value: 0.2365920520673593 and parameters: {'alpha': 89702.94655228242, 'n_pcs': 4000, 'iw_method': 'pc_logistic', 'iw_clip_max': 1.5, 'iw_prob_clip': 0.0150595716826919, 'iw_n_components': 80, 'iw_logistic_c': 0.6727492593844145, 'iw_pca_fit': 'combined', 'iw_solver': 'lbfgs', 'iw_rho': 0.85}. Best is trial 223 with value: 0.23705194687121506.
2026-06-01 20:46:48 | INFO | Trial 237 | outer=6 | alpha=8.900e+04 n_pcs=4000 (pc_topk) weight={'name': 'pc_logistic', 'floor': 1e-06, 'clip_max': 1.5, 'prob_clip': 0.015126517233145528, 'n_components': 80, 'logistic_c': 0.7016409517116774, 'pca_fit': 'combined', 'solver': 'lbfgs', 'max_iter': 2000, 'fit_intercept': True, 'standardize_with_source': True, 'rho': 0.85}
[I 2026-06-01 20:47:15,236] Trial 237 finished with value: 0.2365512919390554 and parameters: {'alpha': 88996.44004305196, 'n_pcs': 4000, 'iw_method': 'pc_logistic', 'iw_clip_max': 1.5, 'iw_prob_clip': 0.015126517233145528, 'iw_n_components': 80, 'iw_logistic_c': 0.7016409517116774, 'iw_pca_fit': 'combined', 'iw_solver': 'lbfgs', 'iw_rho': 0.85}. Best is trial 223 with value: 0.23705194687121506.
2026-06-01 20:47:15 | INFO | Trial 238 | outer=6 | alpha=9.347e+04 n_pcs=4000 (pc_topk) weight={'name': 'pc_logistic', 'floor': 1e-06, 'clip_max': 1.5, 'prob_clip': 0.016843811443385908, 'n_components': 80, 'logistic_c': 0.7906156379279816, 'pca_fit': 'combined', 'solver': 'lbfgs', 'max_iter': 2000, 'fit_intercept': True, 'standardize_with_source': True, 'rho': 0.85}
[I 2026-06-01 20:47:40,669] Trial 238 finished with value: 0.2364696649720488 and parameters: {'alpha': 93468.28582960507, 'n_pcs': 4000, 'iw_method': 'pc_logistic', 'iw_clip_max': 1.5, 'iw_prob_clip': 0.016843811443385908, 'iw_n_components': 80, 'iw_logistic_c': 0.7906156379279816, 'iw_pca_fit': 'combined', 'iw_solver': 'lbfgs', 'iw_rho': 0.85}. Best is trial 223 with value: 0.23705194687121506.
2026-06-01 20:47:40 | INFO | Trial 239 | outer=6 | alpha=8.615e+04 n_pcs=4000 (pc_topk) weight={'name': 'pc_logistic', 'floor': 1e-06, 'clip_max': 1.5, 'prob_clip': 0.015369655134098182, 'n_components': 80, 'logistic_c': 0.5126544269623498, 'pca_fit': 'combined', 'solver': 'lbfgs', 'max_iter': 2000, 'fit_intercept': True, 'standardize_with_source': True, 'rho': 0.85}
[I 2026-06-01 20:48:08,458] Trial 239 finished with value: 0.23673556267810292 and parameters: {'alpha': 86152.02867153019, 'n_pcs': 4000, 'iw_method': 'pc_logistic', 'iw_clip_max': 1.5, 'iw_prob_clip': 0.015369655134098182, 'iw_n_components': 80, 'iw_logistic_c': 0.5126544269623498, 'iw_pca_fit': 'combined', 'iw_solver': 'lbfgs', 'iw_rho': 0.85}. Best is trial 223 with value: 0.23705194687121506.
2026-06-01 20:48:08 | INFO | Trial 240 | outer=6 | alpha=8.703e+04 n_pcs=4000 (pc_topk) weight={'name': 'pc_logistic', 'floor': 1e-06, 'clip_max': 1.5, 'prob_clip': 0.015669505586600754, 'n_components': 80, 'logistic_c': 0.5232391118663018, 'pca_fit': 'combined', 'solver': 'lbfgs', 'max_iter': 2000, 'fit_intercept': True, 'standardize_with_source': True, 'rho': 0.85}
[I 2026-06-01 20:48:34,872] Trial 240 finished with value: 0.23674236054039569 and parameters: {'alpha': 87026.24103281522, 'n_pcs': 4000, 'iw_method': 'pc_logistic', 'iw_clip_max': 1.5, 'iw_prob_clip': 0.015669505586600754, 'iw_n_components': 80, 'iw_logistic_c': 0.5232391118663018, 'iw_pca_fit': 'combined', 'iw_solver': 'lbfgs', 'iw_rho': 0.85}. Best is trial 223 with value: 0.23705194687121506.
2026-06-01 20:48:34 | INFO | Trial 241 | outer=6 | alpha=8.122e+04 n_pcs=4000 (pc_topk) weight={'name': 'pc_logistic', 'floor': 1e-06, 'clip_max': 1.5, 'prob_clip': 0.015697322732017252, 'n_components': 80, 'logistic_c': 0.5636928619036173, 'pca_fit': 'combined', 'solver': 'lbfgs', 'max_iter': 2000, 'fit_intercept': True, 'standardize_with_source': True, 'rho': 0.85}
[I 2026-06-01 20:48:59,739] Trial 241 finished with value: 0.23684033809510563 and parameters: {'alpha': 81216.73188260729, 'n_pcs': 4000, 'iw_method': 'pc_logistic', 'iw_clip_max': 1.5, 'iw_prob_clip': 0.015697322732017252, 'iw_n_components': 80, 'iw_logistic_c': 0.5636928619036173, 'iw_pca_fit': 'combined', 'iw_solver': 'lbfgs', 'iw_rho': 0.85}. Best is trial 223 with value: 0.23705194687121506.
2026-06-01 20:48:59 | INFO | Trial 242 | outer=6 | alpha=8.578e+04 n_pcs=4000 (pc_topk) weight={'name': 'pc_logistic', 'floor': 1e-06, 'clip_max': 1.5, 'prob_clip': 0.01767387264742592, 'n_components': 80, 'logistic_c': 0.4836276996622585, 'pca_fit': 'combined', 'solver': 'lbfgs', 'max_iter': 2000, 'fit_intercept': True, 'standardize_with_source': True, 'rho': 0.85}
[I 2026-06-01 20:49:25,721] Trial 242 finished with value: 0.23678028931431983 and parameters: {'alpha': 85782.86269507426, 'n_pcs': 4000, 'iw_method': 'pc_logistic', 'iw_clip_max': 1.5, 'iw_prob_clip': 0.01767387264742592, 'iw_n_components': 80, 'iw_logistic_c': 0.4836276996622585, 'iw_pca_fit': 'combined', 'iw_solver': 'lbfgs', 'iw_rho': 0.85}. Best is trial 223 with value: 0.23705194687121506.
2026-06-01 20:49:25 | INFO | Trial 243 | outer=6 | alpha=8.029e+04 n_pcs=4000 (pc_topk) weight={'name': 'pc_logistic', 'floor': 1e-06, 'clip_max': 1.5, 'prob_clip': 0.01814806033627662, 'n_components': 80, 'logistic_c': 0.5282868045327297, 'pca_fit': 'combined', 'solver': 'lbfgs', 'max_iter': 2000, 'fit_intercept': True, 'standardize_with_source': True, 'rho': 0.85}
[I 2026-06-01 20:49:51,072] Trial 243 finished with value: 0.2368890178154932 and parameters: {'alpha': 80291.87129265255, 'n_pcs': 4000, 'iw_method': 'pc_logistic', 'iw_clip_max': 1.5, 'iw_prob_clip': 0.01814806033627662, 'iw_n_components': 80, 'iw_logistic_c': 0.5282868045327297, 'iw_pca_fit': 'combined', 'iw_solver': 'lbfgs', 'iw_rho': 0.85}. Best is trial 223 with value: 0.23705194687121506.
2026-06-01 20:49:51 | INFO | Trial 244 | outer=6 | alpha=1.109e+05 n_pcs=4000 (pc_topk) weight={'name': 'pc_logistic', 'floor': 1e-06, 'clip_max': 1.5, 'prob_clip': 0.017879417295515444, 'n_components': 40, 'logistic_c': 0.4974710161854413, 'pca_fit': 'combined', 'solver': 'lbfgs', 'max_iter': 2000, 'fit_intercept': True, 'standardize_with_source': True, 'rho': 0.85}
[I 2026-06-01 20:50:13,105] Trial 244 finished with value: 0.23332377552831413 and parameters: {'alpha': 110910.95484268678, 'n_pcs': 4000, 'iw_method': 'pc_logistic', 'iw_clip_max': 1.5, 'iw_prob_clip': 0.017879417295515444, 'iw_n_components': 40, 'iw_logistic_c': 0.4974710161854413, 'iw_pca_fit': 'combined', 'iw_solver': 'lbfgs', 'iw_rho': 0.85}. Best is trial 223 with value: 0.23705194687121506.
2026-06-01 20:50:13 | INFO | Trial 245 | outer=6 | alpha=8.090e+04 n_pcs=4000 (pc_topk) weight={'name': 'pc_logistic', 'floor': 1e-06, 'clip_max': 1.5, 'prob_clip': 0.016221644793522335, 'n_components': 80, 'logistic_c': 0.4636245152290152, 'pca_fit': 'combined', 'solver': 'lbfgs', 'max_iter': 2000, 'fit_intercept': True, 'standardize_with_source': True, 'rho': 0.85}
[I 2026-06-01 20:50:39,189] Trial 245 finished with value: 0.2369817223520152 and parameters: {'alpha': 80900.39977718197, 'n_pcs': 4000, 'iw_method': 'pc_logistic', 'iw_clip_max': 1.5, 'iw_prob_clip': 0.016221644793522335, 'iw_n_components': 80, 'iw_logistic_c': 0.4636245152290152, 'iw_pca_fit': 'combined', 'iw_solver': 'lbfgs', 'iw_rho': 0.85}. Best is trial 223 with value: 0.23705194687121506.
2026-06-01 20:50:39 | INFO | Trial 246 | outer=6 | alpha=8.023e+04 n_pcs=4000 (pc_topk) weight={'name': 'pc_logistic', 'floor': 1e-06, 'clip_max': 1.5, 'prob_clip': 0.016494828233352316, 'n_components': 100, 'logistic_c': 0.48544066972534033, 'pca_fit': 'combined', 'solver': 'lbfgs', 'max_iter': 2000, 'fit_intercept': True, 'standardize_with_source': True, 'rho': 0.85}
[I 2026-06-01 20:51:05,822] Trial 246 finished with value: 0.23664552855541604 and parameters: {'alpha': 80229.54369126595, 'n_pcs': 4000, 'iw_method': 'pc_logistic', 'iw_clip_max': 1.5, 'iw_prob_clip': 0.016494828233352316, 'iw_n_components': 100, 'iw_logistic_c': 0.48544066972534033, 'iw_pca_fit': 'combined', 'iw_solver': 'lbfgs', 'iw_rho': 0.85}. Best is trial 223 with value: 0.23705194687121506.
2026-06-01 20:51:05 | INFO | Trial 247 | outer=6 | alpha=8.039e+04 n_pcs=4000 (pc_topk) weight={'name': 'pc_logistic', 'floor': 1e-06, 'clip_max': 7.0, 'prob_clip': 0.01797848376405479, 'n_components': 100, 'logistic_c': 1.07972658853621, 'pca_fit': 'combined', 'solver': 'lbfgs', 'max_iter': 2000, 'fit_intercept': True, 'standardize_with_source': True, 'rho': 0.85}
[I 2026-06-01 20:51:32,522] Trial 247 finished with value: 0.22061669533881675 and parameters: {'alpha': 80385.4315055033, 'n_pcs': 4000, 'iw_method': 'pc_logistic', 'iw_clip_max': 7.0, 'iw_prob_clip': 0.01797848376405479, 'iw_n_components': 100, 'iw_logistic_c': 1.07972658853621, 'iw_pca_fit': 'combined', 'iw_solver': 'lbfgs', 'iw_rho': 0.85}. Best is trial 223 with value: 0.23705194687121506.
2026-06-01 20:51:32 | INFO | Trial 248 | outer=6 | alpha=7.948e+04 n_pcs=4000 (pc_topk) weight={'name': 'pc_logistic', 'floor': 1e-06, 'clip_max': 1.5, 'prob_clip': 0.016569654004045423, 'n_components': 100, 'logistic_c': 0.4779015766544147, 'pca_fit': 'combined', 'solver': 'lbfgs', 'max_iter': 2000, 'fit_intercept': True, 'standardize_with_source': True, 'rho': 0.85}
[I 2026-06-01 20:51:58,280] Trial 248 finished with value: 0.23663265328983427 and parameters: {'alpha': 79483.86278984066, 'n_pcs': 4000, 'iw_method': 'pc_logistic', 'iw_clip_max': 1.5, 'iw_prob_clip': 0.016569654004045423, 'iw_n_components': 100, 'iw_logistic_c': 0.4779015766544147, 'iw_pca_fit': 'combined', 'iw_solver': 'lbfgs', 'iw_rho': 0.85}. Best is trial 223 with value: 0.23705194687121506.
2026-06-01 20:51:58 | INFO | Trial 249 | outer=6 | alpha=1.210e+05 n_pcs=4000 (pc_topk) weight={'name': 'pc_logistic', 'floor': 1e-06, 'clip_max': 1.5, 'prob_clip': 0.01610865409303915, 'n_components': 100, 'logistic_c': 1.4980295103395411, 'pca_fit': 'combined', 'solver': 'lbfgs', 'max_iter': 2000, 'fit_intercept': True, 'standardize_with_source': True, 'rho': 0.85}
[I 2026-06-01 20:52:26,459] Trial 249 finished with value: 0.23542981751644182 and parameters: {'alpha': 120982.50110621938, 'n_pcs': 4000, 'iw_method': 'pc_logistic', 'iw_clip_max': 1.5, 'iw_prob_clip': 0.01610865409303915, 'iw_n_components': 100, 'iw_logistic_c': 1.4980295103395411, 'iw_pca_fit': 'combined', 'iw_solver': 'lbfgs', 'iw_rho': 0.85}. Best is trial 223 with value: 0.23705194687121506.
2026-06-01 20:52:26 | INFO | Trial 250 | outer=6 | alpha=7.506e+04 n_pcs=4000 (pc_topk) weight={'name': 'pc_logistic', 'floor': 1e-06, 'clip_max': 1.5, 'prob_clip': 0.018346106842253643, 'n_components': 20, 'logistic_c': 0.5120934900014219, 'pca_fit': 'combined', 'solver': 'lbfgs', 'max_iter': 2000, 'fit_intercept': True, 'standardize_with_source': True, 'rho': 0.85}
[I 2026-06-01 20:52:44,557] Trial 250 finished with value: 0.23539138980219443 and parameters: {'alpha': 75056.02001126547, 'n_pcs': 4000, 'iw_method': 'pc_logistic', 'iw_clip_max': 1.5, 'iw_prob_clip': 0.018346106842253643, 'iw_n_components': 20, 'iw_logistic_c': 0.5120934900014219, 'iw_pca_fit': 'combined', 'iw_solver': 'lbfgs', 'iw_rho': 0.85}. Best is trial 223 with value: 0.23705194687121506.
2026-06-01 20:52:44 | INFO | Trial 251 | outer=6 | alpha=1.066e+05 n_pcs=4000 (pc_topk) weight={'name': 'pc_logistic', 'floor': 1e-06, 'clip_max': 1.5, 'prob_clip': 0.016270843611552205, 'n_components': 80, 'logistic_c': 0.7822747957925407, 'pca_fit': 'combined', 'solver': 'lbfgs', 'max_iter': 2000, 'fit_intercept': True, 'standardize_with_source': True, 'rho': 0.3}
[I 2026-06-01 20:53:10,152] Trial 251 finished with value: 0.2347067615402668 and parameters: {'alpha': 106609.32412759277, 'n_pcs': 4000, 'iw_method': 'pc_logistic', 'iw_clip_max': 1.5, 'iw_prob_clip': 0.016270843611552205, 'iw_n_components': 80, 'iw_logistic_c': 0.7822747957925407, 'iw_pca_fit': 'combined', 'iw_solver': 'lbfgs', 'iw_rho': 0.3}. Best is trial 223 with value: 0.23705194687121506.
2026-06-01 20:53:10 | INFO | Trial 252 | outer=6 | alpha=7.704e+04 n_pcs=1500 (pc_topk) weight={'name': 'pc_logistic', 'floor': 1e-06, 'clip_max': 1.5, 'prob_clip': 0.018564478255240987, 'n_components': 80, 'logistic_c': 0.4821976901495534, 'pca_fit': 'combined', 'solver': 'lbfgs', 'max_iter': 2000, 'fit_intercept': True, 'standardize_with_source': True, 'rho': 0.85}
[I 2026-06-01 20:53:31,232] Trial 252 finished with value: 0.22326380768592863 and parameters: {'alpha': 77036.73084575948, 'n_pcs': 1500, 'iw_method': 'pc_logistic', 'iw_clip_max': 1.5, 'iw_prob_clip': 0.018564478255240987, 'iw_n_components': 80, 'iw_logistic_c': 0.4821976901495534, 'iw_pca_fit': 'combined', 'iw_solver': 'lbfgs', 'iw_rho': 0.85}. Best is trial 223 with value: 0.23705194687121506.
2026-06-01 20:53:31 | INFO | Trial 253 | outer=6 | alpha=1.011e+05 n_pcs=4000 (pc_topk) weight={'name': 'pc_logistic', 'floor': 1e-06, 'clip_max': 2.5, 'prob_clip': 0.01698480437245076, 'n_components': 80, 'logistic_c': 1.050748181050243, 'pca_fit': 'combined', 'solver': 'lbfgs', 'max_iter': 2000, 'fit_intercept': True, 'standardize_with_source': True, 'rho': 0.85}
[I 2026-06-01 20:53:58,031] Trial 253 finished with value: 0.23549500247247704 and parameters: {'alpha': 101144.1824340616, 'n_pcs': 4000, 'iw_method': 'pc_logistic', 'iw_clip_max': 2.5, 'iw_prob_clip': 0.01698480437245076, 'iw_n_components': 80, 'iw_logistic_c': 1.050748181050243, 'iw_pca_fit': 'combined', 'iw_solver': 'lbfgs', 'iw_rho': 0.85}. Best is trial 223 with value: 0.23705194687121506.
2026-06-01 20:53:58 | INFO | Trial 254 | outer=6 | alpha=6.593e+04 n_pcs=4000 (pc_topk) weight={'name': 'pc_logistic', 'floor': 1e-06, 'clip_max': 12.0, 'prob_clip': 0.01577860855667305, 'n_components': 80, 'logistic_c': 0.46407200970020285, 'pca_fit': 'combined', 'solver': 'lbfgs', 'max_iter': 2000, 'fit_intercept': True, 'standardize_with_source': True, 'rho': 0.85}
[I 2026-06-01 20:54:24,552] Trial 254 finished with value: 0.2190557048526125 and parameters: {'alpha': 65933.24101767574, 'n_pcs': 4000, 'iw_method': 'pc_logistic', 'iw_clip_max': 12.0, 'iw_prob_clip': 0.01577860855667305, 'iw_n_components': 80, 'iw_logistic_c': 0.46407200970020285, 'iw_pca_fit': 'combined', 'iw_solver': 'lbfgs', 'iw_rho': 0.85}. Best is trial 223 with value: 0.23705194687121506.
2026-06-01 20:54:24 | INFO | Trial 255 | outer=6 | alpha=1.368e+05 n_pcs=4000 (pc_topk) weight={'name': 'pc_logistic', 'floor': 1e-06, 'clip_max': 1.5, 'prob_clip': 0.020620193647461274, 'n_components': 80, 'logistic_c': 4.1347842370656045e-06, 'pca_fit': 'combined', 'solver': 'lbfgs', 'max_iter': 2000, 'fit_intercept': True, 'standardize_with_source': True, 'rho': 0.85}
[I 2026-06-01 20:54:36,905] Trial 255 finished with value: 0.23287121111650197 and parameters: {'alpha': 136782.86532824757, 'n_pcs': 4000, 'iw_method': 'pc_logistic', 'iw_clip_max': 1.5, 'iw_prob_clip': 0.020620193647461274, 'iw_n_components': 80, 'iw_logistic_c': 4.1347842370656045e-06, 'iw_pca_fit': 'combined', 'iw_solver': 'lbfgs', 'iw_rho': 0.85}. Best is trial 223 with value: 0.23705194687121506.
2026-06-01 20:54:36 | INFO | Trial 256 | outer=6 | alpha=8.044e+04 n_pcs=4000 (pc_topk) weight={'name': 'pc_logistic', 'floor': 1e-06, 'clip_max': 1.5, 'prob_clip': 0.017481744702303834, 'n_components': 80, 'logistic_c': 0.6944595627348997, 'pca_fit': 'combined', 'solver': 'lbfgs', 'max_iter': 2000, 'fit_intercept': True, 'standardize_with_source': True, 'rho': 0.85}
[I 2026-06-01 20:55:05,191] Trial 256 finished with value: 0.23687504210696245 and parameters: {'alpha': 80442.66225226612, 'n_pcs': 4000, 'iw_method': 'pc_logistic', 'iw_clip_max': 1.5, 'iw_prob_clip': 0.017481744702303834, 'iw_n_components': 80, 'iw_logistic_c': 0.6944595627348997, 'iw_pca_fit': 'combined', 'iw_solver': 'lbfgs', 'iw_rho': 0.85}. Best is trial 223 with value: 0.23705194687121506.
2026-06-01 20:55:05 | INFO | Trial 257 | outer=6 | alpha=6.975e+04 n_pcs=4000 (pc_topk) weight={'name': 'pc_logistic', 'floor': 1e-06, 'clip_max': 1.5, 'prob_clip': 0.019193684898920923, 'n_components': 80, 'logistic_c': 2.187502381809975e-07, 'pca_fit': 'combined', 'solver': 'lbfgs', 'max_iter': 2000, 'fit_intercept': True, 'standardize_with_source': True, 'rho': 0.85}
[I 2026-06-01 20:55:16,232] Trial 257 finished with value: 0.23206280495974907 and parameters: {'alpha': 69752.10162068119, 'n_pcs': 4000, 'iw_method': 'pc_logistic', 'iw_clip_max': 1.5, 'iw_prob_clip': 0.019193684898920923, 'iw_n_components': 80, 'iw_logistic_c': 2.187502381809975e-07, 'iw_pca_fit': 'combined', 'iw_solver': 'lbfgs', 'iw_rho': 0.85}. Best is trial 223 with value: 0.23705194687121506.
2026-06-01 20:55:16 | INFO | Trial 258 | outer=6 | alpha=7.717e+04 n_pcs=4000 (pc_topk) weight={'name': 'pc_logistic', 'floor': 1e-06, 'clip_max': 1.5, 'prob_clip': 0.017435757746666485, 'n_components': 80, 'logistic_c': 0.8844708002901817, 'pca_fit': 'combined', 'solver': 'lbfgs', 'max_iter': 2000, 'fit_intercept': True, 'standardize_with_source': True, 'rho': 0.85}
[I 2026-06-01 20:55:42,030] Trial 258 finished with value: 0.23682457830763787 and parameters: {'alpha': 77165.09339182696, 'n_pcs': 4000, 'iw_method': 'pc_logistic', 'iw_clip_max': 1.5, 'iw_prob_clip': 0.017435757746666485, 'iw_n_components': 80, 'iw_logistic_c': 0.8844708002901817, 'iw_pca_fit': 'combined', 'iw_solver': 'lbfgs', 'iw_rho': 0.85}. Best is trial 223 with value: 0.23705194687121506.
2026-06-01 20:55:42 | INFO | Trial 259 | outer=6 | alpha=7.812e+04 n_pcs=4000 (pc_topk) weight={'name': 'pc_logistic', 'floor': 1e-06, 'clip_max': 1.5, 'prob_clip': 0.017968116540620614, 'n_components': 80, 'logistic_c': 0.6962988789522582, 'pca_fit': 'combined', 'solver': 'lbfgs', 'max_iter': 2000, 'fit_intercept': True, 'standardize_with_source': True, 'rho': 0.85}
[I 2026-06-01 20:56:07,854] Trial 259 finished with value: 0.23692378827711402 and parameters: {'alpha': 78123.81385537572, 'n_pcs': 4000, 'iw_method': 'pc_logistic', 'iw_clip_max': 1.5, 'iw_prob_clip': 0.017968116540620614, 'iw_n_components': 80, 'iw_logistic_c': 0.6962988789522582, 'iw_pca_fit': 'combined', 'iw_solver': 'lbfgs', 'iw_rho': 0.85}. Best is trial 223 with value: 0.23705194687121506.
2026-06-01 20:56:07 | INFO | Trial 260 | outer=6 | alpha=7.806e+04 n_pcs=4000 (pc_topk) weight={'name': 'pc_logistic', 'floor': 1e-06, 'clip_max': 1.5, 'prob_clip': 0.017649534631957967, 'n_components': 80, 'logistic_c': 0.8509818453417132, 'pca_fit': 'combined', 'solver': 'lbfgs', 'max_iter': 2000, 'fit_intercept': True, 'standardize_with_source': True, 'rho': 0.85}
[I 2026-06-01 20:56:33,640] Trial 260 finished with value: 0.23685240274799405 and parameters: {'alpha': 78061.67730302922, 'n_pcs': 4000, 'iw_method': 'pc_logistic', 'iw_clip_max': 1.5, 'iw_prob_clip': 0.017649534631957967, 'iw_n_components': 80, 'iw_logistic_c': 0.8509818453417132, 'iw_pca_fit': 'combined', 'iw_solver': 'lbfgs', 'iw_rho': 0.85}. Best is trial 223 with value: 0.23705194687121506.
2026-06-01 20:56:33 | INFO | Trial 261 | outer=6 | alpha=1.083e+05 n_pcs=4000 (pc_topk) weight={'name': 'pc_logistic', 'floor': 1e-06, 'clip_max': 1.5, 'prob_clip': 0.018093329370474122, 'n_components': 80, 'logistic_c': 0.9027014913769772, 'pca_fit': 'combined', 'solver': 'lbfgs', 'max_iter': 2000, 'fit_intercept': True, 'standardize_with_source': True, 'rho': 0.85}
[I 2026-06-01 20:57:00,865] Trial 261 finished with value: 0.23591180931172775 and parameters: {'alpha': 108263.62841346911, 'n_pcs': 4000, 'iw_method': 'pc_logistic', 'iw_clip_max': 1.5, 'iw_prob_clip': 0.018093329370474122, 'iw_n_components': 80, 'iw_logistic_c': 0.9027014913769772, 'iw_pca_fit': 'combined', 'iw_solver': 'lbfgs', 'iw_rho': 0.85}. Best is trial 223 with value: 0.23705194687121506.
2026-06-01 20:57:00 | INFO | Trial 262 | outer=6 | alpha=7.521e+04 n_pcs=4000 (pc_topk) weight={'name': 'pc_logistic', 'floor': 1e-06, 'clip_max': 1.5, 'prob_clip': 0.017548993560312216, 'n_components': 80, 'logistic_c': 1.9358639601664953, 'pca_fit': 'combined', 'solver': 'lbfgs', 'max_iter': 2000, 'fit_intercept': True, 'standardize_with_source': True, 'rho': 0.85}
