[I 2026-06-01 17:10:21,451] Trial 48 finished with value: 0.19745115972444965 and parameters: {'alpha': 81460.20639719536, 'n_pcs': 5000, 'iw_method': 'pc_logistic', 'iw_clip_max': 2.5, 'iw_prob_clip': 0.015461424469625245, 'iw_n_components': 10, 'iw_logistic_c': 3.755645798800076e-05, 'iw_pca_fit': 'combined', 'iw_solver': 'lbfgs', 'iw_rho': 0.7}. Best is trial 48 with value: 0.19745115972444965.
2026-06-01 17:10:21 | INFO | Trial 49 | outer=4 | alpha=7.542e+04 n_pcs=5000 (pc_topk) weight={'name': 'pc_logistic', 'floor': 1e-06, 'clip_max': 2.5, 'prob_clip': 0.03122947578535367, 'n_components': 10, 'logistic_c': 0.0009545389399091379, 'pca_fit': 'combined', 'solver': 'lbfgs', 'max_iter': 2000, 'fit_intercept': True, 'standardize_with_source': True, 'rho': 0.7}
[I 2026-06-01 17:10:43,653] Trial 49 finished with value: 0.1955452263923796 and parameters: {'alpha': 75420.02917277774, 'n_pcs': 5000, 'iw_method': 'pc_logistic', 'iw_clip_max': 2.5, 'iw_prob_clip': 0.03122947578535367, 'iw_n_components': 10, 'iw_logistic_c': 0.0009545389399091379, 'iw_pca_fit': 'combined', 'iw_solver': 'lbfgs', 'iw_rho': 0.7}. Best is trial 48 with value: 0.19745115972444965.
2026-06-01 17:10:43 | INFO | Trial 50 | outer=4 | alpha=2.303e+04 n_pcs=5000 (pc_topk) weight={'name': 'pc_logistic', 'floor': 1e-06, 'clip_max': 2.5, 'prob_clip': 0.03392891828821518, 'n_components': 10, 'logistic_c': 0.0007463864341967511, 'pca_fit': 'combined', 'solver': 'lbfgs', 'max_iter': 2000, 'fit_intercept': True, 'standardize_with_source': True, 'rho': 0.7}
[I 2026-06-01 17:11:02,058] Trial 50 finished with value: 0.1901488336646025 and parameters: {'alpha': 23031.037577240008, 'n_pcs': 5000, 'iw_method': 'pc_logistic', 'iw_clip_max': 2.5, 'iw_prob_clip': 0.03392891828821518, 'iw_n_components': 10, 'iw_logistic_c': 0.0007463864341967511, 'iw_pca_fit': 'combined', 'iw_solver': 'lbfgs', 'iw_rho': 0.7}. Best is trial 48 with value: 0.19745115972444965.
2026-06-01 17:11:02 | INFO | Trial 51 | outer=4 | alpha=8.427e+04 n_pcs=5000 (pc_topk) weight={'name': 'pc_logistic', 'floor': 1e-06, 'clip_max': 2.5, 'prob_clip': 0.017915910920890062, 'n_components': 60, 'logistic_c': 7.80022529246623e-05, 'pca_fit': 'combined', 'solver': 'lbfgs', 'max_iter': 2000, 'fit_intercept': True, 'standardize_with_source': True, 'rho': 0.7}
[I 2026-06-01 17:11:20,244] Trial 51 finished with value: 0.19690093743289258 and parameters: {'alpha': 84269.88020811255, 'n_pcs': 5000, 'iw_method': 'pc_logistic', 'iw_clip_max': 2.5, 'iw_prob_clip': 0.017915910920890062, 'iw_n_components': 60, 'iw_logistic_c': 7.80022529246623e-05, 'iw_pca_fit': 'combined', 'iw_solver': 'lbfgs', 'iw_rho': 0.7}. Best is trial 48 with value: 0.19745115972444965.
2026-06-01 17:11:20 | INFO | Trial 52 | outer=4 | alpha=7.792e+04 n_pcs=5000 (pc_topk) weight={'name': 'pc_logistic', 'floor': 1e-06, 'clip_max': 2.5, 'prob_clip': 0.018662430095280843, 'n_components': 60, 'logistic_c': 9.360476457714798e-05, 'pca_fit': 'combined', 'solver': 'lbfgs', 'max_iter': 2000, 'fit_intercept': True, 'standardize_with_source': True, 'rho': 0.7}
[I 2026-06-01 17:11:52,616] Trial 52 finished with value: 0.19709482007200485 and parameters: {'alpha': 77918.4935500743, 'n_pcs': 5000, 'iw_method': 'pc_logistic', 'iw_clip_max': 2.5, 'iw_prob_clip': 0.018662430095280843, 'iw_n_components': 60, 'iw_logistic_c': 9.360476457714798e-05, 'iw_pca_fit': 'combined', 'iw_solver': 'lbfgs', 'iw_rho': 0.7}. Best is trial 48 with value: 0.19745115972444965.
2026-06-01 17:11:52 | INFO | Trial 53 | outer=4 | alpha=9.216e+04 n_pcs=5000 (pc_topk) weight={'name': 'pc_logistic', 'floor': 1e-06, 'clip_max': 2.5, 'prob_clip': 0.019822568426473165, 'n_components': 60, 'logistic_c': 0.0028074886515333693, 'pca_fit': 'combined', 'solver': 'lbfgs', 'max_iter': 2000, 'fit_intercept': True, 'standardize_with_source': True, 'rho': 0.7}
[I 2026-06-01 17:12:37,010] Trial 53 finished with value: 0.19632290783056724 and parameters: {'alpha': 92163.05856563307, 'n_pcs': 5000, 'iw_method': 'pc_logistic', 'iw_clip_max': 2.5, 'iw_prob_clip': 0.019822568426473165, 'iw_n_components': 60, 'iw_logistic_c': 0.0028074886515333693, 'iw_pca_fit': 'combined', 'iw_solver': 'lbfgs', 'iw_rho': 0.7}. Best is trial 48 with value: 0.19745115972444965.
2026-06-01 17:12:37 | INFO | Trial 54 | outer=4 | alpha=5.624e+04 n_pcs=5000 (pc_topk) weight={'name': 'pc_logistic', 'floor': 1e-06, 'clip_max': 2.5, 'prob_clip': 0.03377681379731128, 'n_components': 60, 'logistic_c': 0.007200430303431638, 'pca_fit': 'combined', 'solver': 'lbfgs', 'max_iter': 2000, 'fit_intercept': True, 'standardize_with_source': True, 'rho': 0.7}
[I 2026-06-01 17:13:01,869] Trial 54 finished with value: 0.19525981132167644 and parameters: {'alpha': 56244.09262834646, 'n_pcs': 5000, 'iw_method': 'pc_logistic', 'iw_clip_max': 2.5, 'iw_prob_clip': 0.03377681379731128, 'iw_n_components': 60, 'iw_logistic_c': 0.007200430303431638, 'iw_pca_fit': 'combined', 'iw_solver': 'lbfgs', 'iw_rho': 0.7}. Best is trial 48 with value: 0.19745115972444965.
2026-06-01 17:13:01 | INFO | Trial 55 | outer=4 | alpha=8.300e+04 n_pcs=5000 (pc_topk) weight={'name': 'pc_logistic', 'floor': 1e-06, 'clip_max': 2.5, 'prob_clip': 0.016293011840008677, 'n_components': 60, 'logistic_c': 0.016994954177313795, 'pca_fit': 'combined', 'solver': 'lbfgs', 'max_iter': 2000, 'fit_intercept': True, 'standardize_with_source': True, 'rho': 0.7}
[I 2026-06-01 17:13:34,341] Trial 55 finished with value: 0.19723353301649973 and parameters: {'alpha': 83003.58145373585, 'n_pcs': 5000, 'iw_method': 'pc_logistic', 'iw_clip_max': 2.5, 'iw_prob_clip': 0.016293011840008677, 'iw_n_components': 60, 'iw_logistic_c': 0.016994954177313795, 'iw_pca_fit': 'combined', 'iw_solver': 'lbfgs', 'iw_rho': 0.7}. Best is trial 48 with value: 0.19745115972444965.
2026-06-01 17:13:34 | INFO | Trial 56 | outer=4 | alpha=5.015e+04 n_pcs=5000 (pc_topk) weight={'name': 'pc_logistic', 'floor': 1e-06, 'clip_max': 2.5, 'prob_clip': 0.01616725142741084, 'n_components': 60, 'logistic_c': 0.032944819406937165, 'pca_fit': 'combined', 'solver': 'lbfgs', 'max_iter': 2000, 'fit_intercept': True, 'standardize_with_source': True, 'rho': 0.7}
[I 2026-06-01 17:14:00,828] Trial 56 finished with value: 0.19676241301541458 and parameters: {'alpha': 50147.338675189974, 'n_pcs': 5000, 'iw_method': 'pc_logistic', 'iw_clip_max': 2.5, 'iw_prob_clip': 0.01616725142741084, 'iw_n_components': 60, 'iw_logistic_c': 0.032944819406937165, 'iw_pca_fit': 'combined', 'iw_solver': 'lbfgs', 'iw_rho': 0.7}. Best is trial 48 with value: 0.19745115972444965.
2026-06-01 17:14:00 | INFO | Trial 57 | outer=4 | alpha=1.227e+04 n_pcs=5000 (pc_topk) weight={'name': 'pc_logistic', 'floor': 1e-06, 'clip_max': 2.5, 'prob_clip': 0.01681276182190799, 'n_components': 60, 'logistic_c': 0.0503902185867578, 'pca_fit': 'combined', 'solver': 'lbfgs', 'max_iter': 2000, 'fit_intercept': True, 'standardize_with_source': True, 'rho': 0.7}
[I 2026-06-01 17:14:26,672] Trial 57 finished with value: 0.1834532047780538 and parameters: {'alpha': 12272.031995729185, 'n_pcs': 5000, 'iw_method': 'pc_logistic', 'iw_clip_max': 2.5, 'iw_prob_clip': 0.01681276182190799, 'iw_n_components': 60, 'iw_logistic_c': 0.0503902185867578, 'iw_pca_fit': 'combined', 'iw_solver': 'lbfgs', 'iw_rho': 0.7}. Best is trial 48 with value: 0.19745115972444965.
2026-06-01 17:14:26 | INFO | Trial 58 | outer=4 | alpha=4.637e+04 n_pcs=5000 (pc_topk) weight={'name': 'pc_logistic', 'floor': 1e-06, 'clip_max': 2.5, 'prob_clip': 0.016121727520575366, 'n_components': 60, 'logistic_c': 0.0403068682354438, 'pca_fit': 'combined', 'solver': 'lbfgs', 'max_iter': 2000, 'fit_intercept': True, 'standardize_with_source': True, 'rho': 0.7}
[I 2026-06-01 17:14:53,056] Trial 58 finished with value: 0.19652156135252047 and parameters: {'alpha': 46365.29542777313, 'n_pcs': 5000, 'iw_method': 'pc_logistic', 'iw_clip_max': 2.5, 'iw_prob_clip': 0.016121727520575366, 'iw_n_components': 60, 'iw_logistic_c': 0.0403068682354438, 'iw_pca_fit': 'combined', 'iw_solver': 'lbfgs', 'iw_rho': 0.7}. Best is trial 48 with value: 0.19745115972444965.
2026-06-01 17:14:53 | INFO | Trial 59 | outer=4 | alpha=4.740e+04 n_pcs=5000 (pc_topk) weight={'name': 'pc_logistic', 'floor': 1e-06, 'clip_max': 2.5, 'prob_clip': 0.01623413716371088, 'n_components': 60, 'logistic_c': 0.1303388654380436, 'pca_fit': 'combined', 'solver': 'lbfgs', 'max_iter': 2000, 'fit_intercept': True, 'standardize_with_source': True, 'rho': 0.7}
[I 2026-06-01 17:15:20,394] Trial 59 finished with value: 0.19666506579869678 and parameters: {'alpha': 47397.687943334095, 'n_pcs': 5000, 'iw_method': 'pc_logistic', 'iw_clip_max': 2.5, 'iw_prob_clip': 0.01623413716371088, 'iw_n_components': 60, 'iw_logistic_c': 0.1303388654380436, 'iw_pca_fit': 'combined', 'iw_solver': 'lbfgs', 'iw_rho': 0.7}. Best is trial 48 with value: 0.19745115972444965.
2026-06-01 17:15:20 | INFO | Trial 60 | outer=4 | alpha=2.518e+04 n_pcs=1500 (pc_topk) weight={'name': 'pc_logistic', 'floor': 1e-06, 'clip_max': 2.5, 'prob_clip': 0.005063039300813602, 'n_components': 60, 'logistic_c': 0.45001440085794564, 'pca_fit': 'combined', 'solver': 'lbfgs', 'max_iter': 2000, 'fit_intercept': True, 'standardize_with_source': True, 'rho': 0.7}
[I 2026-06-01 17:15:38,511] Trial 60 finished with value: 0.17519057310893457 and parameters: {'alpha': 25179.239114014512, 'n_pcs': 1500, 'iw_method': 'pc_logistic', 'iw_clip_max': 2.5, 'iw_prob_clip': 0.005063039300813602, 'iw_n_components': 60, 'iw_logistic_c': 0.45001440085794564, 'iw_pca_fit': 'combined', 'iw_solver': 'lbfgs', 'iw_rho': 0.7}. Best is trial 48 with value: 0.19745115972444965.
2026-06-01 17:15:38 | INFO | Trial 61 | outer=4 | alpha=5.388e+04 n_pcs=5000 (pc_topk) weight={'name': 'pc_logistic', 'floor': 1e-06, 'clip_max': 2.5, 'prob_clip': 0.015182268678477086, 'n_components': 60, 'logistic_c': 0.08581341879642268, 'pca_fit': 'combined', 'solver': 'lbfgs', 'max_iter': 2000, 'fit_intercept': True, 'standardize_with_source': True, 'rho': 0.7}
[I 2026-06-01 17:16:03,907] Trial 61 finished with value: 0.19701234906369278 and parameters: {'alpha': 53880.69006048225, 'n_pcs': 5000, 'iw_method': 'pc_logistic', 'iw_clip_max': 2.5, 'iw_prob_clip': 0.015182268678477086, 'iw_n_components': 60, 'iw_logistic_c': 0.08581341879642268, 'iw_pca_fit': 'combined', 'iw_solver': 'lbfgs', 'iw_rho': 0.7}. Best is trial 48 with value: 0.19745115972444965.
2026-06-01 17:16:03 | INFO | Trial 62 | outer=4 | alpha=1.625e+04 n_pcs=5000 (pc_topk) weight={'name': 'pc_logistic', 'floor': 1e-06, 'clip_max': 2.5, 'prob_clip': 0.015330992368287038, 'n_components': 60, 'logistic_c': 0.3570920264093245, 'pca_fit': 'combined', 'solver': 'lbfgs', 'max_iter': 2000, 'fit_intercept': True, 'standardize_with_source': True, 'rho': 0.7}
[I 2026-06-01 17:16:34,325] Trial 62 finished with value: 0.1874454460664549 and parameters: {'alpha': 16246.953870604615, 'n_pcs': 5000, 'iw_method': 'pc_logistic', 'iw_clip_max': 2.5, 'iw_prob_clip': 0.015330992368287038, 'iw_n_components': 60, 'iw_logistic_c': 0.3570920264093245, 'iw_pca_fit': 'combined', 'iw_solver': 'lbfgs', 'iw_rho': 0.7}. Best is trial 48 with value: 0.19745115972444965.
2026-06-01 17:16:34 | INFO | Trial 63 | outer=4 | alpha=3.018e+04 n_pcs=5000 (pc_topk) weight={'name': 'pc_logistic', 'floor': 1e-06, 'clip_max': 2.5, 'prob_clip': 0.000884423117505125, 'n_components': 60, 'logistic_c': 0.26802956077712853, 'pca_fit': 'combined', 'solver': 'lbfgs', 'max_iter': 2000, 'fit_intercept': True, 'standardize_with_source': True, 'rho': 0.7}
[I 2026-06-01 17:17:03,858] Trial 63 finished with value: 0.18626268537375884 and parameters: {'alpha': 30176.146274655544, 'n_pcs': 5000, 'iw_method': 'pc_logistic', 'iw_clip_max': 2.5, 'iw_prob_clip': 0.000884423117505125, 'iw_n_components': 60, 'iw_logistic_c': 0.26802956077712853, 'iw_pca_fit': 'combined', 'iw_solver': 'lbfgs', 'iw_rho': 0.7}. Best is trial 48 with value: 0.19745115972444965.
2026-06-01 17:17:03 | INFO | Trial 64 | outer=4 | alpha=5.514e+04 n_pcs=5000 (pc_topk) weight={'name': 'pc_logistic', 'floor': 1e-06, 'clip_max': 2.5, 'prob_clip': 0.024740720450992314, 'n_components': 60, 'logistic_c': 2.223917091692862, 'pca_fit': 'combined', 'solver': 'lbfgs', 'max_iter': 2000, 'fit_intercept': True, 'standardize_with_source': True, 'rho': 0.7}
[I 2026-06-01 17:17:31,220] Trial 64 finished with value: 0.1966673365077234 and parameters: {'alpha': 55143.14296610202, 'n_pcs': 5000, 'iw_method': 'pc_logistic', 'iw_clip_max': 2.5, 'iw_prob_clip': 0.024740720450992314, 'iw_n_components': 60, 'iw_logistic_c': 2.223917091692862, 'iw_pca_fit': 'combined', 'iw_solver': 'lbfgs', 'iw_rho': 0.7}. Best is trial 48 with value: 0.19745115972444965.
2026-06-01 17:17:31 | INFO | Trial 65 | outer=4 | alpha=8.261e+03 n_pcs=5000 (pc_topk) weight={'name': 'pc_logistic', 'floor': 1e-06, 'clip_max': 2.5, 'prob_clip': 0.025672405199222523, 'n_components': 80, 'logistic_c': 2.327056280975007, 'pca_fit': 'combined', 'solver': 'lbfgs', 'max_iter': 2000, 'fit_intercept': True, 'standardize_with_source': True, 'rho': 0.3}
[I 2026-06-01 17:18:00,363] Trial 65 finished with value: 0.17790154297448565 and parameters: {'alpha': 8260.894426498884, 'n_pcs': 5000, 'iw_method': 'pc_logistic', 'iw_clip_max': 2.5, 'iw_prob_clip': 0.025672405199222523, 'iw_n_components': 80, 'iw_logistic_c': 2.327056280975007, 'iw_pca_fit': 'combined', 'iw_solver': 'lbfgs', 'iw_rho': 0.3}. Best is trial 48 with value: 0.19745115972444965.
2026-06-01 17:18:00 | INFO | Trial 66 | outer=4 | alpha=6.012e+04 n_pcs=4500 (pc_topk) weight={'name': 'pc_logistic', 'floor': 1e-06, 'clip_max': 1.5, 'prob_clip': 0.0218068113510098, 'n_components': 60, 'logistic_c': 9.132433418674859, 'pca_fit': 'combined', 'solver': 'lbfgs', 'max_iter': 2000, 'fit_intercept': True, 'standardize_with_source': True, 'rho': 0.7}
[I 2026-06-01 17:18:28,874] Trial 66 finished with value: 0.19762273712629574 and parameters: {'alpha': 60122.56851945913, 'n_pcs': 4500, 'iw_method': 'pc_logistic', 'iw_clip_max': 1.5, 'iw_prob_clip': 0.0218068113510098, 'iw_n_components': 60, 'iw_logistic_c': 9.132433418674859, 'iw_pca_fit': 'combined', 'iw_solver': 'lbfgs', 'iw_rho': 0.7}. Best is trial 66 with value: 0.19762273712629574.
2026-06-01 17:18:28 | INFO | Trial 67 | outer=4 | alpha=3.434e+04 n_pcs=4500 (pc_topk) weight={'name': 'pc_logistic', 'floor': 1e-06, 'clip_max': 1.5, 'prob_clip': 0.03864850812767741, 'n_components': 60, 'logistic_c': 0.02264682628325197, 'pca_fit': 'combined', 'solver': 'lbfgs', 'max_iter': 2000, 'fit_intercept': True, 'standardize_with_source': True, 'rho': 1.0}
[I 2026-06-01 17:18:53,034] Trial 67 finished with value: 0.1954234783433321 and parameters: {'alpha': 34335.87486702668, 'n_pcs': 4500, 'iw_method': 'pc_logistic', 'iw_clip_max': 1.5, 'iw_prob_clip': 0.03864850812767741, 'iw_n_components': 60, 'iw_logistic_c': 0.02264682628325197, 'iw_pca_fit': 'combined', 'iw_solver': 'lbfgs', 'iw_rho': 1.0}. Best is trial 66 with value: 0.19762273712629574.
2026-06-01 17:18:53 | INFO | Trial 68 | outer=4 | alpha=1.989e+05 n_pcs=4500 (pc_topk) weight={'name': 'pc_logistic', 'floor': 1e-06, 'clip_max': 1.5, 'prob_clip': 0.0036226897450013936, 'n_components': 60, 'logistic_c': 0.01689223819998516, 'pca_fit': 'combined', 'solver': 'lbfgs', 'max_iter': 2000, 'fit_intercept': True, 'standardize_with_source': True, 'rho': 0.7}
[I 2026-06-01 17:19:16,613] Trial 68 finished with value: 0.19032790590747248 and parameters: {'alpha': 198904.27315061813, 'n_pcs': 4500, 'iw_method': 'pc_logistic', 'iw_clip_max': 1.5, 'iw_prob_clip': 0.0036226897450013936, 'iw_n_components': 60, 'iw_logistic_c': 0.01689223819998516, 'iw_pca_fit': 'combined', 'iw_solver': 'lbfgs', 'iw_rho': 0.7}. Best is trial 66 with value: 0.19762273712629574.
2026-06-01 17:19:16 | INFO | Trial 69 | outer=4 | alpha=6.173e+04 n_pcs=5000 (pc_topk) weight={'name': 'pc_logistic', 'floor': 1e-06, 'clip_max': 1.5, 'prob_clip': 0.013779004021477598, 'n_components': 10, 'logistic_c': 5.295927573569368, 'pca_fit': 'combined', 'solver': 'lbfgs', 'max_iter': 2000, 'fit_intercept': True, 'standardize_with_source': True, 'rho': 0.7}
[I 2026-06-01 17:19:36,289] Trial 69 finished with value: 0.19578560272084114 and parameters: {'alpha': 61728.1495139418, 'n_pcs': 5000, 'iw_method': 'pc_logistic', 'iw_clip_max': 1.5, 'iw_prob_clip': 0.013779004021477598, 'iw_n_components': 10, 'iw_logistic_c': 5.295927573569368, 'iw_pca_fit': 'combined', 'iw_solver': 'lbfgs', 'iw_rho': 0.7}. Best is trial 66 with value: 0.19762273712629574.
2026-06-01 17:19:36 | INFO | Trial 70 | outer=4 | alpha=2.555e+05 n_pcs=4500 (pc_topk) weight={'name': 'pc_logistic', 'floor': 1e-06, 'clip_max': 12.0, 'prob_clip': 0.019862886937138446, 'n_components': 60, 'logistic_c': 5.990114766722143e-05, 'pca_fit': 'combined', 'solver': 'lbfgs', 'max_iter': 2000, 'fit_intercept': True, 'standardize_with_source': True, 'rho': 0.7}
[I 2026-06-01 17:19:53,615] Trial 70 finished with value: 0.1896439003456573 and parameters: {'alpha': 255531.6188098206, 'n_pcs': 4500, 'iw_method': 'pc_logistic', 'iw_clip_max': 12.0, 'iw_prob_clip': 0.019862886937138446, 'iw_n_components': 60, 'iw_logistic_c': 5.990114766722143e-05, 'iw_pca_fit': 'combined', 'iw_solver': 'lbfgs', 'iw_rho': 0.7}. Best is trial 66 with value: 0.19762273712629574.
2026-06-01 17:19:53 | INFO | Trial 71 | outer=4 | alpha=5.280e+04 n_pcs=5000 (pc_topk) weight={'name': 'pc_logistic', 'floor': 1e-06, 'clip_max': 2.5, 'prob_clip': 0.024271216867651046, 'n_components': 60, 'logistic_c': 1.6263959473290857, 'pca_fit': 'combined', 'solver': 'lbfgs', 'max_iter': 2000, 'fit_intercept': True, 'standardize_with_source': True, 'rho': 0.7}
[I 2026-06-01 17:20:21,083] Trial 71 finished with value: 0.19669734182068474 and parameters: {'alpha': 52796.54578492019, 'n_pcs': 5000, 'iw_method': 'pc_logistic', 'iw_clip_max': 2.5, 'iw_prob_clip': 0.024271216867651046, 'iw_n_components': 60, 'iw_logistic_c': 1.6263959473290857, 'iw_pca_fit': 'combined', 'iw_solver': 'lbfgs', 'iw_rho': 0.7}. Best is trial 66 with value: 0.19762273712629574.
2026-06-01 17:20:21 | INFO | Trial 72 | outer=4 | alpha=9.452e+04 n_pcs=5000 (pc_topk) weight={'name': 'pc_logistic', 'floor': 1e-06, 'clip_max': 2.5, 'prob_clip': 0.02159622983731414, 'n_components': 60, 'logistic_c': 7.643958666256828, 'pca_fit': 'combined', 'solver': 'lbfgs', 'max_iter': 2000, 'fit_intercept': True, 'standardize_with_source': True, 'rho': 0.5}
[I 2026-06-01 17:20:48,641] Trial 72 finished with value: 0.19537230029446437 and parameters: {'alpha': 94520.84884721726, 'n_pcs': 5000, 'iw_method': 'pc_logistic', 'iw_clip_max': 2.5, 'iw_prob_clip': 0.02159622983731414, 'iw_n_components': 60, 'iw_logistic_c': 7.643958666256828, 'iw_pca_fit': 'combined', 'iw_solver': 'lbfgs', 'iw_rho': 0.5}. Best is trial 66 with value: 0.19762273712629574.
2026-06-01 17:20:48 | INFO | Trial 73 | outer=4 | alpha=4.431e+04 n_pcs=5000 (pc_topk) weight={'name': 'pc_logistic', 'floor': 1e-06, 'clip_max': 2.5, 'prob_clip': 0.0022811039119793953, 'n_components': 60, 'logistic_c': 1.657767696555564, 'pca_fit': 'combined', 'solver': 'lbfgs', 'max_iter': 2000, 'fit_intercept': True, 'standardize_with_source': True, 'rho': 0.7}
[I 2026-06-01 17:21:14,838] Trial 73 finished with value: 0.19123555321618657 and parameters: {'alpha': 44310.01736634313, 'n_pcs': 5000, 'iw_method': 'pc_logistic', 'iw_clip_max': 2.5, 'iw_prob_clip': 0.0022811039119793953, 'iw_n_components': 60, 'iw_logistic_c': 1.657767696555564, 'iw_pca_fit': 'combined', 'iw_solver': 'lbfgs', 'iw_rho': 0.7}. Best is trial 66 with value: 0.19762273712629574.
2026-06-01 17:21:14 | INFO | Trial 74 | outer=4 | alpha=6.689e+04 n_pcs=4500 (pc_topk) weight={'name': 'pc_logistic', 'floor': 1e-06, 'clip_max': 4.0, 'prob_clip': 0.013808978797481924, 'n_components': 20, 'logistic_c': 0.792735434509239, 'pca_fit': 'combined', 'solver': 'lbfgs', 'max_iter': 2000, 'fit_intercept': True, 'standardize_with_source': True, 'rho': 0.7}
[I 2026-06-01 17:21:34,681] Trial 74 finished with value: 0.19279576759597622 and parameters: {'alpha': 66886.70525060943, 'n_pcs': 4500, 'iw_method': 'pc_logistic', 'iw_clip_max': 4.0, 'iw_prob_clip': 0.013808978797481924, 'iw_n_components': 20, 'iw_logistic_c': 0.792735434509239, 'iw_pca_fit': 'combined', 'iw_solver': 'lbfgs', 'iw_rho': 0.7}. Best is trial 66 with value: 0.19762273712629574.
2026-06-01 17:21:34 | INFO | Trial 75 | outer=4 | alpha=2.501e+04 n_pcs=500 (pc_topk) weight={'name': 'pc_logistic', 'floor': 1e-06, 'clip_max': 2.5, 'prob_clip': 0.009488837756812417, 'n_components': 80, 'logistic_c': 0.09877143461431377, 'pca_fit': 'combined', 'solver': 'lbfgs', 'max_iter': 2000, 'fit_intercept': True, 'standardize_with_source': True, 'rho': 0.3}
[I 2026-06-01 17:21:51,030] Trial 75 finished with value: 0.13890903573464836 and parameters: {'alpha': 25007.45994175488, 'n_pcs': 500, 'iw_method': 'pc_logistic', 'iw_clip_max': 2.5, 'iw_prob_clip': 0.009488837756812417, 'iw_n_components': 80, 'iw_logistic_c': 0.09877143461431377, 'iw_pca_fit': 'combined', 'iw_solver': 'lbfgs', 'iw_rho': 0.3}. Best is trial 66 with value: 0.19762273712629574.
2026-06-01 17:21:51 | INFO | Trial 76 | outer=4 | alpha=3.421e+04 n_pcs=4500 (pc_topk) weight={'name': 'pc_logistic', 'floor': 1e-06, 'clip_max': 2.5, 'prob_clip': 0.02990491448334336, 'n_components': 60, 'logistic_c': 7.703119605276783e-05, 'pca_fit': 'combined', 'solver': 'lbfgs', 'max_iter': 2000, 'fit_intercept': True, 'standardize_with_source': True, 'rho': 0.7}
