[I 2026-05-31 23:44:35,714] Trial 167 pruned. 
2026-05-31 23:44:35 | INFO | src.nested_cv_avggrm_weighted_unified | Trial 168 | outer=3 | alpha=1.570e+05 n_pcs=3500 (pc_topk) weight_search=on
2026-05-31 23:44:35 | INFO | src.nested_cv_avggrm_weighted_unified | Trial 168 | outer=3 | weight={'name': 'exponential', 'floor': 1e-06, 'clip_max': 5.0, 'beta': 3.0849279844603643}
2026-05-31 23:44:38 | INFO | src.nested_cv_avggrm_weighted_unified | Trial 168 | outer=3 | pruned after 6/10 inner folds (mean r=0.2195)
[I 2026-05-31 23:44:38,636] Trial 168 pruned. 
2026-05-31 23:44:38 | INFO | src.nested_cv_avggrm_weighted_unified | Trial 169 | outer=3 | alpha=1.301e+05 n_pcs=3500 (pc_topk) weight_search=on
2026-05-31 23:44:38 | INFO | src.nested_cv_avggrm_weighted_unified | Trial 169 | outer=3 | weight={'name': 'exponential', 'floor': 1e-06, 'clip_max': 3.0, 'beta': 2.6740495328894625}
2026-05-31 23:44:41 | INFO | src.nested_cv_avggrm_weighted_unified | Trial 169 | outer=3 | pruned after 6/10 inner folds (mean r=0.2200)
[I 2026-05-31 23:44:41,527] Trial 169 pruned. 
2026-05-31 23:44:41 | INFO | src.nested_cv_avggrm_weighted_unified | Trial 170 | outer=3 | alpha=9.794e+04 n_pcs=3000 (pc_topk) weight_search=on
2026-05-31 23:44:41 | INFO | src.nested_cv_avggrm_weighted_unified | Trial 170 | outer=3 | weight={'name': 'uniform', 'floor': 1e-06, 'clip_max': 3.0}
2026-05-31 23:44:43 | INFO | src.nested_cv_avggrm_weighted_unified | Trial 170 | outer=3 | pruned after 6/10 inner folds (mean r=0.2149)
[I 2026-05-31 23:44:43,404] Trial 170 pruned. 
2026-05-31 23:44:43 | INFO | src.nested_cv_avggrm_weighted_unified | Trial 171 | outer=3 | alpha=2.009e+05 n_pcs=3000 (pc_topk) weight_search=on
2026-05-31 23:44:43 | INFO | src.nested_cv_avggrm_weighted_unified | Trial 171 | outer=3 | weight={'name': 'exponential', 'floor': 1e-06, 'clip_max': 3.0, 'beta': 2.9903071246181683}
[I 2026-05-31 23:44:47,170] Trial 171 finished with value: 0.20838610095331406 and parameters: {'alpha': 200865.95342365408, 'n_pcs': 3000, 'weight_scheme': 'exponential', 'weight_clip_max': 3.0, 'weight_exponential_beta': 2.9903071246181683}. Best is trial 148 with value: 0.20859388196438702.
2026-05-31 23:44:47 | INFO | src.nested_cv_avggrm_weighted_unified | Trial 172 | outer=3 | alpha=1.830e+05 n_pcs=3000 (pc_topk) weight_search=on
2026-05-31 23:44:47 | INFO | src.nested_cv_avggrm_weighted_unified | Trial 172 | outer=3 | weight={'name': 'exponential', 'floor': 1e-06, 'clip_max': 3.0, 'beta': 2.9126754840034446}
[I 2026-05-31 23:44:50,988] Trial 172 finished with value: 0.2083914533013341 and parameters: {'alpha': 182989.13450738377, 'n_pcs': 3000, 'weight_scheme': 'exponential', 'weight_clip_max': 3.0, 'weight_exponential_beta': 2.9126754840034446}. Best is trial 148 with value: 0.20859388196438702.
2026-05-31 23:44:50 | INFO | src.nested_cv_avggrm_weighted_unified | Trial 173 | outer=3 | alpha=1.958e+05 n_pcs=3000 (pc_topk) weight_search=on
2026-05-31 23:44:51 | INFO | src.nested_cv_avggrm_weighted_unified | Trial 173 | outer=3 | weight={'name': 'exponential', 'floor': 1e-06, 'clip_max': 3.0, 'beta': 2.9207802583524614}
[I 2026-05-31 23:44:54,753] Trial 173 finished with value: 0.20833763044475634 and parameters: {'alpha': 195800.84126471714, 'n_pcs': 3000, 'weight_scheme': 'exponential', 'weight_clip_max': 3.0, 'weight_exponential_beta': 2.9207802583524614}. Best is trial 148 with value: 0.20859388196438702.
2026-05-31 23:44:54 | INFO | src.nested_cv_avggrm_weighted_unified | Trial 174 | outer=3 | alpha=1.626e+05 n_pcs=3000 (pc_topk) weight_search=on
2026-05-31 23:44:54 | INFO | src.nested_cv_avggrm_weighted_unified | Trial 174 | outer=3 | weight={'name': 'exponential', 'floor': 1e-06, 'clip_max': 3.0, 'beta': 3.72756018883055}
2026-05-31 23:44:57 | INFO | src.nested_cv_avggrm_weighted_unified | Trial 174 | outer=3 | pruned after 6/10 inner folds (mean r=0.2235)
[I 2026-05-31 23:44:57,037] Trial 174 pruned. 
2026-05-31 23:44:57 | INFO | src.nested_cv_avggrm_weighted_unified | Trial 175 | outer=3 | alpha=2.005e+05 n_pcs=3000 (pc_topk) weight_search=on
2026-05-31 23:44:57 | INFO | src.nested_cv_avggrm_weighted_unified | Trial 175 | outer=3 | weight={'name': 'exponential', 'floor': 1e-06, 'clip_max': 3.0, 'beta': 2.267481250120894}
[I 2026-05-31 23:45:00,839] Trial 175 finished with value: 0.20736211127654416 and parameters: {'alpha': 200547.4066677199, 'n_pcs': 3000, 'weight_scheme': 'exponential', 'weight_clip_max': 3.0, 'weight_exponential_beta': 2.267481250120894}. Best is trial 148 with value: 0.20859388196438702.
2026-05-31 23:45:00 | INFO | src.nested_cv_avggrm_weighted_unified | Trial 176 | outer=3 | alpha=1.385e+05 n_pcs=3000 (pc_topk) weight_search=on
2026-05-31 23:45:00 | INFO | src.nested_cv_avggrm_weighted_unified | Trial 176 | outer=3 | weight={'name': 'exponential', 'floor': 1e-06, 'clip_max': 3.0, 'beta': 2.737903973776351}
2026-05-31 23:45:03 | INFO | src.nested_cv_avggrm_weighted_unified | Trial 176 | outer=3 | pruned after 7/10 inner folds (mean r=0.2486)
[I 2026-05-31 23:45:03,504] Trial 176 pruned. 
2026-05-31 23:45:03 | INFO | src.nested_cv_avggrm_weighted_unified | Trial 177 | outer=3 | alpha=1.879e+05 n_pcs=3000 (pc_topk) weight_search=on
2026-05-31 23:45:03 | INFO | src.nested_cv_avggrm_weighted_unified | Trial 177 | outer=3 | weight={'name': 'exponential', 'floor': 1e-06, 'clip_max': 3.0, 'beta': 9.829423421207807}
2026-05-31 23:45:06 | INFO | src.nested_cv_avggrm_weighted_unified | Trial 177 | outer=3 | pruned after 6/10 inner folds (mean r=0.2142)
[I 2026-05-31 23:45:06,938] Trial 177 pruned. 
2026-05-31 23:45:06 | INFO | src.nested_cv_avggrm_weighted_unified | Trial 178 | outer=3 | alpha=1.157e+05 n_pcs=3000 (pc_topk) weight_search=on
2026-05-31 23:45:06 | INFO | src.nested_cv_avggrm_weighted_unified | Trial 178 | outer=3 | weight={'name': 'exponential', 'floor': 1e-06, 'clip_max': 3.0, 'beta': 3.1110261811238193}
2026-05-31 23:45:09 | INFO | src.nested_cv_avggrm_weighted_unified | Trial 178 | outer=3 | pruned after 7/10 inner folds (mean r=0.2471)
[I 2026-05-31 23:45:09,632] Trial 178 pruned. 
2026-05-31 23:45:09 | INFO | src.nested_cv_avggrm_weighted_unified | Trial 179 | outer=3 | alpha=1.593e+05 n_pcs=3500 (pc_topk) weight_search=on
2026-05-31 23:45:09 | INFO | src.nested_cv_avggrm_weighted_unified | Trial 179 | outer=3 | weight={'name': 'exponential', 'floor': 1e-06, 'clip_max': 3.0, 'beta': 2.6073428774339096}
2026-05-31 23:45:12 | INFO | src.nested_cv_avggrm_weighted_unified | Trial 179 | outer=3 | pruned after 6/10 inner folds (mean r=0.2212)
[I 2026-05-31 23:45:12,546] Trial 179 pruned. 
2026-05-31 23:45:12 | INFO | src.nested_cv_avggrm_weighted_unified | Trial 180 | outer=3 | alpha=2.060e+05 n_pcs=3000 (pc_topk) weight_search=on
2026-05-31 23:45:12 | INFO | src.nested_cv_avggrm_weighted_unified | Trial 180 | outer=3 | weight={'name': 'exponential', 'floor': 1e-06, 'clip_max': 3.0, 'beta': 2.7797300000682448}
[I 2026-05-31 23:45:16,377] Trial 180 finished with value: 0.20815463246925633 and parameters: {'alpha': 206037.9238687658, 'n_pcs': 3000, 'weight_scheme': 'exponential', 'weight_clip_max': 3.0, 'weight_exponential_beta': 2.7797300000682448}. Best is trial 148 with value: 0.20859388196438702.
2026-05-31 23:45:16 | INFO | src.nested_cv_avggrm_weighted_unified | Trial 181 | outer=3 | alpha=1.702e+05 n_pcs=3000 (pc_topk) weight_search=on
2026-05-31 23:45:16 | INFO | src.nested_cv_avggrm_weighted_unified | Trial 181 | outer=3 | weight={'name': 'exponential', 'floor': 1e-06, 'clip_max': 3.0, 'beta': 3.002165729592255}
[I 2026-05-31 23:45:20,161] Trial 181 finished with value: 0.20852245393581587 and parameters: {'alpha': 170173.53485567612, 'n_pcs': 3000, 'weight_scheme': 'exponential', 'weight_clip_max': 3.0, 'weight_exponential_beta': 3.002165729592255}. Best is trial 148 with value: 0.20859388196438702.
2026-05-31 23:45:20 | INFO | src.nested_cv_avggrm_weighted_unified | Trial 182 | outer=3 | alpha=1.392e+05 n_pcs=3000 (pc_topk) weight_search=on
2026-05-31 23:45:20 | INFO | src.nested_cv_avggrm_weighted_unified | Trial 182 | outer=3 | weight={'name': 'exponential', 'floor': 1e-06, 'clip_max': 3.0, 'beta': 3.655554161930273}
2026-05-31 23:45:22 | INFO | src.nested_cv_avggrm_weighted_unified | Trial 182 | outer=3 | pruned after 6/10 inner folds (mean r=0.2227)
[I 2026-05-31 23:45:22,455] Trial 182 pruned. 
2026-05-31 23:45:22 | INFO | src.nested_cv_avggrm_weighted_unified | Trial 183 | outer=3 | alpha=1.886e+05 n_pcs=3000 (pc_topk) weight_search=on
2026-05-31 23:45:22 | INFO | src.nested_cv_avggrm_weighted_unified | Trial 183 | outer=3 | weight={'name': 'exponential', 'floor': 1e-06, 'clip_max': 3.0, 'beta': 3.1504416917190246}
[I 2026-05-31 23:45:26,813] Trial 183 finished with value: 0.20857368285879202 and parameters: {'alpha': 188589.22705320767, 'n_pcs': 3000, 'weight_scheme': 'exponential', 'weight_clip_max': 3.0, 'weight_exponential_beta': 3.1504416917190246}. Best is trial 148 with value: 0.20859388196438702.
2026-05-31 23:45:26 | INFO | src.nested_cv_avggrm_weighted_unified | Trial 184 | outer=3 | alpha=1.558e+05 n_pcs=3000 (pc_topk) weight_search=on
2026-05-31 23:45:26 | INFO | src.nested_cv_avggrm_weighted_unified | Trial 184 | outer=3 | weight={'name': 'exponential', 'floor': 1e-06, 'clip_max': 3.0, 'beta': 3.176066724798292}
[I 2026-05-31 23:45:30,624] Trial 184 finished with value: 0.2086265729435542 and parameters: {'alpha': 155818.53172473545, 'n_pcs': 3000, 'weight_scheme': 'exponential', 'weight_clip_max': 3.0, 'weight_exponential_beta': 3.176066724798292}. Best is trial 184 with value: 0.2086265729435542.
2026-05-31 23:45:30 | INFO | src.nested_cv_avggrm_weighted_unified | OUTER 3 | new best trial 184 (mean inner r=0.2086) saved to outputs/final_results/e6_pc_ridge_avggrm/thr_wing/e6_pc_ridge_avggrm_thr_wing_best_trials/split_03_best_trial.json
2026-05-31 23:45:30 | INFO | src.nested_cv_avggrm_weighted_unified | Trial 185 | outer=3 | alpha=1.040e+05 n_pcs=3000 (pc_topk) weight_search=on
2026-05-31 23:45:30 | INFO | src.nested_cv_avggrm_weighted_unified | Trial 185 | outer=3 | weight={'name': 'exponential', 'floor': 1e-06, 'clip_max': 3.0, 'beta': 3.1990304909483616}
2026-05-31 23:45:33 | INFO | src.nested_cv_avggrm_weighted_unified | Trial 185 | outer=3 | pruned after 7/10 inner folds (mean r=0.2462)
[I 2026-05-31 23:45:33,705] Trial 185 pruned. 
2026-05-31 23:45:33 | INFO | src.nested_cv_avggrm_weighted_unified | Trial 186 | outer=3 | alpha=1.574e+05 n_pcs=3000 (pc_topk) weight_search=on
2026-05-31 23:45:33 | INFO | src.nested_cv_avggrm_weighted_unified | Trial 186 | outer=3 | weight={'name': 'exponential', 'floor': 1e-06, 'clip_max': 3.0, 'beta': 3.5493797552487982}
2026-05-31 23:45:35 | INFO | src.nested_cv_avggrm_weighted_unified | Trial 186 | outer=3 | pruned after 6/10 inner folds (mean r=0.2234)
[I 2026-05-31 23:45:35,991] Trial 186 pruned. 
2026-05-31 23:45:35 | INFO | src.nested_cv_avggrm_weighted_unified | Trial 187 | outer=3 | alpha=1.291e+05 n_pcs=3000 (pc_topk) weight_search=on
2026-05-31 23:45:36 | INFO | src.nested_cv_avggrm_weighted_unified | Trial 187 | outer=3 | weight={'name': 'exponential', 'floor': 1e-06, 'clip_max': 3.0, 'beta': 3.9760359901738966}
2026-05-31 23:45:38 | INFO | src.nested_cv_avggrm_weighted_unified | Trial 187 | outer=3 | pruned after 6/10 inner folds (mean r=0.2220)
[I 2026-05-31 23:45:38,270] Trial 187 pruned. 
2026-05-31 23:45:38 | INFO | src.nested_cv_avggrm_weighted_unified | Trial 188 | outer=3 | alpha=8.038e+04 n_pcs=3500 (pc_topk) weight_search=on
2026-05-31 23:45:38 | INFO | src.nested_cv_avggrm_weighted_unified | Trial 188 | outer=3 | weight={'name': 'exponential', 'floor': 1e-06, 'clip_max': 3.0, 'beta': 7.452916760081056}
2026-05-31 23:45:41 | INFO | src.nested_cv_avggrm_weighted_unified | Trial 188 | outer=3 | pruned after 6/10 inner folds (mean r=0.2094)
[I 2026-05-31 23:45:41,175] Trial 188 pruned. 
2026-05-31 23:45:41 | INFO | src.nested_cv_avggrm_weighted_unified | Trial 189 | outer=3 | alpha=1.549e+05 n_pcs=3000 (pc_topk) weight_search=on
2026-05-31 23:45:41 | INFO | src.nested_cv_avggrm_weighted_unified | Trial 189 | outer=3 | weight={'name': 'exponential', 'floor': 1e-06, 'clip_max': 3.0, 'beta': 3.1632936893108563}
[I 2026-05-31 23:45:45,179] Trial 189 finished with value: 0.20862512359097257 and parameters: {'alpha': 154862.92497157565, 'n_pcs': 3000, 'weight_scheme': 'exponential', 'weight_clip_max': 3.0, 'weight_exponential_beta': 3.1632936893108563}. Best is trial 184 with value: 0.2086265729435542.
2026-05-31 23:45:45 | INFO | src.nested_cv_avggrm_weighted_unified | Trial 190 | outer=3 | alpha=1.581e+05 n_pcs=3000 (pc_topk) weight_search=on
2026-05-31 23:45:45 | INFO | src.nested_cv_avggrm_weighted_unified | Trial 190 | outer=3 | weight={'name': 'exponential', 'floor': 1e-06, 'clip_max': 3.0, 'beta': 3.2070455344785644}
[I 2026-05-31 23:45:48,997] Trial 190 finished with value: 0.20863113225955532 and parameters: {'alpha': 158146.16623398705, 'n_pcs': 3000, 'weight_scheme': 'exponential', 'weight_clip_max': 3.0, 'weight_exponential_beta': 3.2070455344785644}. Best is trial 190 with value: 0.20863113225955532.
2026-05-31 23:45:49 | INFO | src.nested_cv_avggrm_weighted_unified | OUTER 3 | new best trial 190 (mean inner r=0.2086) saved to outputs/final_results/e6_pc_ridge_avggrm/thr_wing/e6_pc_ridge_avggrm_thr_wing_best_trials/split_03_best_trial.json
2026-05-31 23:45:49 | INFO | src.nested_cv_avggrm_weighted_unified | Trial 191 | outer=3 | alpha=1.613e+05 n_pcs=3000 (pc_topk) weight_search=on
2026-05-31 23:45:49 | INFO | src.nested_cv_avggrm_weighted_unified | Trial 191 | outer=3 | weight={'name': 'exponential', 'floor': 1e-06, 'clip_max': 3.0, 'beta': 3.196654210568803}
[I 2026-05-31 23:45:53,018] Trial 191 finished with value: 0.20863437636832166 and parameters: {'alpha': 161272.32061306835, 'n_pcs': 3000, 'weight_scheme': 'exponential', 'weight_clip_max': 3.0, 'weight_exponential_beta': 3.196654210568803}. Best is trial 191 with value: 0.20863437636832166.
2026-05-31 23:45:53 | INFO | src.nested_cv_avggrm_weighted_unified | OUTER 3 | new best trial 191 (mean inner r=0.2086) saved to outputs/final_results/e6_pc_ridge_avggrm/thr_wing/e6_pc_ridge_avggrm_thr_wing_best_trials/split_03_best_trial.json
2026-05-31 23:45:53 | INFO | src.nested_cv_avggrm_weighted_unified | Trial 192 | outer=3 | alpha=1.610e+05 n_pcs=3000 (pc_topk) weight_search=on
2026-05-31 23:45:53 | INFO | src.nested_cv_avggrm_weighted_unified | Trial 192 | outer=3 | weight={'name': 'exponential', 'floor': 1e-06, 'clip_max': 3.0, 'beta': 3.2797424439642926}
[I 2026-05-31 23:45:56,911] Trial 192 finished with value: 0.2086173860344717 and parameters: {'alpha': 160968.83768548476, 'n_pcs': 3000, 'weight_scheme': 'exponential', 'weight_clip_max': 3.0, 'weight_exponential_beta': 3.2797424439642926}. Best is trial 191 with value: 0.20863437636832166.
2026-05-31 23:45:56 | INFO | src.nested_cv_avggrm_weighted_unified | Trial 193 | outer=3 | alpha=1.189e+05 n_pcs=3000 (pc_topk) weight_search=on
2026-05-31 23:45:56 | INFO | src.nested_cv_avggrm_weighted_unified | Trial 193 | outer=3 | weight={'name': 'exponential', 'floor': 1e-06, 'clip_max': 3.0, 'beta': 3.23223866558346}
2026-05-31 23:45:59 | INFO | src.nested_cv_avggrm_weighted_unified | Trial 193 | outer=3 | pruned after 7/10 inner folds (mean r=0.2472)
[I 2026-05-31 23:45:59,566] Trial 193 pruned. 
2026-05-31 23:45:59 | INFO | src.nested_cv_avggrm_weighted_unified | Trial 194 | outer=3 | alpha=1.502e+05 n_pcs=3000 (pc_topk) weight_search=on
2026-05-31 23:45:59 | INFO | src.nested_cv_avggrm_weighted_unified | Trial 194 | outer=3 | weight={'name': 'exponential', 'floor': 1e-06, 'clip_max': 3.0, 'beta': 3.58213800481548}
2026-05-31 23:46:01 | INFO | src.nested_cv_avggrm_weighted_unified | Trial 194 | outer=3 | pruned after 6/10 inner folds (mean r=0.2232)
[I 2026-05-31 23:46:01,864] Trial 194 pruned. 
2026-05-31 23:46:01 | INFO | src.nested_cv_avggrm_weighted_unified | Trial 195 | outer=3 | alpha=9.583e+04 n_pcs=3000 (pc_topk) weight_search=on
2026-05-31 23:46:01 | INFO | src.nested_cv_avggrm_weighted_unified | Trial 195 | outer=3 | weight={'name': 'exponential', 'floor': 1e-06, 'clip_max': 3.0, 'beta': 3.231242010372537}
2026-05-31 23:46:04 | INFO | src.nested_cv_avggrm_weighted_unified | Trial 195 | outer=3 | pruned after 7/10 inner folds (mean r=0.2454)
[I 2026-05-31 23:46:04,641] Trial 195 pruned. 
2026-05-31 23:46:04 | INFO | src.nested_cv_avggrm_weighted_unified | Trial 196 | outer=3 | alpha=1.566e+05 n_pcs=3000 (pc_topk) weight_search=on
2026-05-31 23:46:04 | INFO | src.nested_cv_avggrm_weighted_unified | Trial 196 | outer=3 | weight={'name': 'exponential', 'floor': 1e-06, 'clip_max': 3.0, 'beta': 3.197378823988392}
[I 2026-05-31 23:46:08,624] Trial 196 finished with value: 0.20862865141789647 and parameters: {'alpha': 156570.03002886637, 'n_pcs': 3000, 'weight_scheme': 'exponential', 'weight_clip_max': 3.0, 'weight_exponential_beta': 3.197378823988392}. Best is trial 191 with value: 0.20863437636832166.
2026-05-31 23:46:08 | INFO | src.nested_cv_avggrm_weighted_unified | Trial 197 | outer=3 | alpha=1.284e+05 n_pcs=3000 (pc_topk) weight_search=on
2026-05-31 23:46:08 | INFO | src.nested_cv_avggrm_weighted_unified | Trial 197 | outer=3 | weight={'name': 'uniform', 'floor': 1e-06, 'clip_max': None}
2026-05-31 23:46:10 | INFO | src.nested_cv_avggrm_weighted_unified | Trial 197 | outer=3 | pruned after 6/10 inner folds (mean r=0.2149)
[I 2026-05-31 23:46:10,506] Trial 197 pruned. 
2026-05-31 23:46:10 | INFO | src.nested_cv_avggrm_weighted_unified | Trial 198 | outer=3 | alpha=1.546e+05 n_pcs=3000 (pc_topk) weight_search=on
2026-05-31 23:46:10 | INFO | src.nested_cv_avggrm_weighted_unified | Trial 198 | outer=3 | weight={'name': 'exponential', 'floor': 1e-06, 'clip_max': 3.0, 'beta': 3.4792591483357964}
2026-05-31 23:46:12 | INFO | src.nested_cv_avggrm_weighted_unified | Trial 198 | outer=3 | pruned after 6/10 inner folds (mean r=0.2234)
[I 2026-05-31 23:46:12,758] Trial 198 pruned. 
2026-05-31 23:46:12 | INFO | src.nested_cv_avggrm_weighted_unified | Trial 199 | outer=3 | alpha=2.238e+05 n_pcs=3000 (pc_topk) weight_search=on
2026-05-31 23:46:12 | INFO | src.nested_cv_avggrm_weighted_unified | Trial 199 | outer=3 | weight={'name': 'exponential', 'floor': 1e-06, 'clip_max': 3.0, 'beta': 3.2349881740211144}
[I 2026-05-31 23:46:16,530] Trial 199 finished with value: 0.20838208367704691 and parameters: {'alpha': 223798.7394585326, 'n_pcs': 3000, 'weight_scheme': 'exponential', 'weight_clip_max': 3.0, 'weight_exponential_beta': 3.2349881740211144}. Best is trial 191 with value: 0.20863437636832166.
2026-05-31 23:46:16 | INFO | src.nested_cv_avggrm_weighted_unified | Trial 200 | outer=3 | alpha=1.117e+05 n_pcs=3000 (pc_topk) weight_search=on
2026-05-31 23:46:16 | INFO | src.nested_cv_avggrm_weighted_unified | Trial 200 | outer=3 | weight={'name': 'exponential', 'floor': 1e-06, 'clip_max': 5.0, 'beta': 3.845481147080339}
2026-05-31 23:46:19 | INFO | src.nested_cv_avggrm_weighted_unified | Trial 200 | outer=3 | pruned after 7/10 inner folds (mean r=0.2446)
[I 2026-05-31 23:46:19,672] Trial 200 pruned. 
2026-05-31 23:46:19 | INFO | src.nested_cv_avggrm_weighted_unified | Trial 201 | outer=3 | alpha=1.616e+05 n_pcs=3000 (pc_topk) weight_search=on
2026-05-31 23:46:19 | INFO | src.nested_cv_avggrm_weighted_unified | Trial 201 | outer=3 | weight={'name': 'exponential', 'floor': 1e-06, 'clip_max': 3.0, 'beta': 2.7696604285736917}
[I 2026-05-31 23:46:23,535] Trial 201 finished with value: 0.2083524446700793 and parameters: {'alpha': 161550.4253017699, 'n_pcs': 3000, 'weight_scheme': 'exponential', 'weight_clip_max': 3.0, 'weight_exponential_beta': 2.7696604285736917}. Best is trial 191 with value: 0.20863437636832166.
2026-05-31 23:46:23 | INFO | src.nested_cv_avggrm_weighted_unified | Trial 202 | outer=3 | alpha=1.717e+05 n_pcs=3000 (pc_topk) weight_search=on
2026-05-31 23:46:23 | INFO | src.nested_cv_avggrm_weighted_unified | Trial 202 | outer=3 | weight={'name': 'exponential', 'floor': 1e-06, 'clip_max': 3.0, 'beta': 3.161616940999927}
[I 2026-05-31 23:46:27,854] Trial 202 finished with value: 0.20862792759802123 and parameters: {'alpha': 171669.05016908358, 'n_pcs': 3000, 'weight_scheme': 'exponential', 'weight_clip_max': 3.0, 'weight_exponential_beta': 3.161616940999927}. Best is trial 191 with value: 0.20863437636832166.
2026-05-31 23:46:27 | INFO | src.nested_cv_avggrm_weighted_unified | Trial 203 | outer=3 | alpha=1.394e+05 n_pcs=3000 (pc_topk) weight_search=on
2026-05-31 23:46:27 | INFO | src.nested_cv_avggrm_weighted_unified | Trial 203 | outer=3 | weight={'name': 'exponential', 'floor': 1e-06, 'clip_max': 3.0, 'beta': 3.2329277327355195}
2026-05-31 23:46:31 | INFO | src.nested_cv_avggrm_weighted_unified | Trial 203 | outer=3 | pruned after 6/10 inner folds (mean r=0.2231)
[I 2026-05-31 23:46:31,296] Trial 203 pruned. 
2026-05-31 23:46:31 | INFO | src.nested_cv_avggrm_weighted_unified | Trial 204 | outer=3 | alpha=2.182e+05 n_pcs=3000 (pc_topk) weight_search=on
2026-05-31 23:46:31 | INFO | src.nested_cv_avggrm_weighted_unified | Trial 204 | outer=3 | weight={'name': 'exponential', 'floor': 1e-06, 'clip_max': 3.0, 'beta': 2.5772762646835607}
[I 2026-05-31 23:46:35,811] Trial 204 finished with value: 0.20788068371932816 and parameters: {'alpha': 218240.40381013078, 'n_pcs': 3000, 'weight_scheme': 'exponential', 'weight_clip_max': 3.0, 'weight_exponential_beta': 2.5772762646835607}. Best is trial 191 with value: 0.20863437636832166.
2026-05-31 23:46:35 | INFO | src.nested_cv_avggrm_weighted_unified | Trial 205 | outer=3 | alpha=1.697e+05 n_pcs=3000 (pc_topk) weight_search=on
2026-05-31 23:46:35 | INFO | src.nested_cv_avggrm_weighted_unified | Trial 205 | outer=3 | weight={'name': 'exponential', 'floor': 1e-06, 'clip_max': 3.0, 'beta': 3.477652030894648}
