[I 2026-06-01 15:03:55,391] Trial 144 finished with value: 0.24325127025271565 and parameters: {'alpha': 130319.54085134438, 'n_pcs': 3500, 'iw_method': 'pc_logistic', 'iw_clip_max': 2.5, 'iw_prob_clip': 0.010005887773494072, 'iw_n_components': 80, 'iw_logistic_c': 4.217394384573704e-05, 'iw_pca_fit': 'combined', 'iw_solver': 'lbfgs', 'iw_rho': 0.7}. Best is trial 144 with value: 0.24325127025271565.
2026-06-01 15:03:55 | INFO | Trial 145 | outer=2 | alpha=1.489e+05 n_pcs=3500 (pc_topk) weight={'name': 'pc_logistic', 'floor': 1e-06, 'clip_max': 2.5, 'prob_clip': 0.010197922780344017, 'n_components': 80, 'logistic_c': 5.9826423309254185e-05, 'pca_fit': 'combined', 'solver': 'lbfgs', 'max_iter': 2000, 'fit_intercept': True, 'standardize_with_source': True, 'rho': 0.7}
[I 2026-06-01 15:04:06,354] Trial 145 finished with value: 0.24342209733879128 and parameters: {'alpha': 148938.2499469324, 'n_pcs': 3500, 'iw_method': 'pc_logistic', 'iw_clip_max': 2.5, 'iw_prob_clip': 0.010197922780344017, 'iw_n_components': 80, 'iw_logistic_c': 5.9826423309254185e-05, 'iw_pca_fit': 'combined', 'iw_solver': 'lbfgs', 'iw_rho': 0.7}. Best is trial 145 with value: 0.24342209733879128.
2026-06-01 15:04:06 | INFO | Trial 146 | outer=2 | alpha=1.457e+05 n_pcs=3500 (pc_topk) weight={'name': 'pc_logistic', 'floor': 1e-06, 'clip_max': 2.5, 'prob_clip': 0.009835310198726448, 'n_components': 80, 'logistic_c': 7.130605954449337e-05, 'pca_fit': 'combined', 'solver': 'lbfgs', 'max_iter': 2000, 'fit_intercept': True, 'standardize_with_source': True, 'rho': 0.7}
[I 2026-06-01 15:04:18,830] Trial 146 finished with value: 0.24343952064345942 and parameters: {'alpha': 145658.65420094863, 'n_pcs': 3500, 'iw_method': 'pc_logistic', 'iw_clip_max': 2.5, 'iw_prob_clip': 0.009835310198726448, 'iw_n_components': 80, 'iw_logistic_c': 7.130605954449337e-05, 'iw_pca_fit': 'combined', 'iw_solver': 'lbfgs', 'iw_rho': 0.7}. Best is trial 146 with value: 0.24343952064345942.
2026-06-01 15:04:18 | INFO | Trial 147 | outer=2 | alpha=1.471e+05 n_pcs=3500 (pc_topk) weight={'name': 'pc_logistic', 'floor': 1e-06, 'clip_max': 2.5, 'prob_clip': 0.010444627866919728, 'n_components': 80, 'logistic_c': 4.9597393612969786e-05, 'pca_fit': 'combined', 'solver': 'lbfgs', 'max_iter': 2000, 'fit_intercept': True, 'standardize_with_source': True, 'rho': 0.7}
[I 2026-06-01 15:04:31,766] Trial 147 finished with value: 0.2433643776428212 and parameters: {'alpha': 147093.41643260815, 'n_pcs': 3500, 'iw_method': 'pc_logistic', 'iw_clip_max': 2.5, 'iw_prob_clip': 0.010444627866919728, 'iw_n_components': 80, 'iw_logistic_c': 4.9597393612969786e-05, 'iw_pca_fit': 'combined', 'iw_solver': 'lbfgs', 'iw_rho': 0.7}. Best is trial 146 with value: 0.24343952064345942.
2026-06-01 15:04:31 | INFO | Trial 148 | outer=2 | alpha=1.516e+05 n_pcs=3500 (pc_topk) weight={'name': 'pc_logistic', 'floor': 1e-06, 'clip_max': 2.5, 'prob_clip': 0.010098234516430328, 'n_components': 80, 'logistic_c': 3.362609279992756e-05, 'pca_fit': 'combined', 'solver': 'lbfgs', 'max_iter': 2000, 'fit_intercept': True, 'standardize_with_source': True, 'rho': 0.7}
[I 2026-06-01 15:04:43,172] Trial 148 finished with value: 0.24323945451934623 and parameters: {'alpha': 151635.29079572167, 'n_pcs': 3500, 'iw_method': 'pc_logistic', 'iw_clip_max': 2.5, 'iw_prob_clip': 0.010098234516430328, 'iw_n_components': 80, 'iw_logistic_c': 3.362609279992756e-05, 'iw_pca_fit': 'combined', 'iw_solver': 'lbfgs', 'iw_rho': 0.7}. Best is trial 146 with value: 0.24343952064345942.
2026-06-01 15:04:43 | INFO | Trial 149 | outer=2 | alpha=1.521e+05 n_pcs=3500 (pc_topk) weight={'name': 'pc_logistic', 'floor': 1e-06, 'clip_max': 2.5, 'prob_clip': 0.010169558809613411, 'n_components': 80, 'logistic_c': 4.8822227543603433e-05, 'pca_fit': 'combined', 'solver': 'lbfgs', 'max_iter': 2000, 'fit_intercept': True, 'standardize_with_source': True, 'rho': 0.7}
[I 2026-06-01 15:04:54,705] Trial 149 finished with value: 0.24336411304858122 and parameters: {'alpha': 152149.71079902523, 'n_pcs': 3500, 'iw_method': 'pc_logistic', 'iw_clip_max': 2.5, 'iw_prob_clip': 0.010169558809613411, 'iw_n_components': 80, 'iw_logistic_c': 4.8822227543603433e-05, 'iw_pca_fit': 'combined', 'iw_solver': 'lbfgs', 'iw_rho': 0.7}. Best is trial 146 with value: 0.24343952064345942.
2026-06-01 15:04:54 | INFO | Trial 150 | outer=2 | alpha=3.189e+05 n_pcs=3500 (pc_topk) weight={'name': 'pc_logistic', 'floor': 1e-06, 'clip_max': 7.0, 'prob_clip': 0.008205253613519176, 'n_components': 20, 'logistic_c': 3.2992442211630505e-05, 'pca_fit': 'combined', 'solver': 'lbfgs', 'max_iter': 2000, 'fit_intercept': True, 'standardize_with_source': True, 'rho': 0.7}
[I 2026-06-01 15:05:06,611] Trial 150 finished with value: 0.23978009159221642 and parameters: {'alpha': 318908.4125775784, 'n_pcs': 3500, 'iw_method': 'pc_logistic', 'iw_clip_max': 7.0, 'iw_prob_clip': 0.008205253613519176, 'iw_n_components': 20, 'iw_logistic_c': 3.2992442211630505e-05, 'iw_pca_fit': 'combined', 'iw_solver': 'lbfgs', 'iw_rho': 0.7}. Best is trial 146 with value: 0.24343952064345942.
2026-06-01 15:05:06 | INFO | Trial 151 | outer=2 | alpha=1.474e+05 n_pcs=3500 (pc_topk) weight={'name': 'pc_logistic', 'floor': 1e-06, 'clip_max': 2.5, 'prob_clip': 0.010316845600205064, 'n_components': 80, 'logistic_c': 5.730434656529434e-05, 'pca_fit': 'combined', 'solver': 'lbfgs', 'max_iter': 2000, 'fit_intercept': True, 'standardize_with_source': True, 'rho': 0.7}
[I 2026-06-01 15:05:18,672] Trial 151 finished with value: 0.24340303442230188 and parameters: {'alpha': 147351.36222137194, 'n_pcs': 3500, 'iw_method': 'pc_logistic', 'iw_clip_max': 2.5, 'iw_prob_clip': 0.010316845600205064, 'iw_n_components': 80, 'iw_logistic_c': 5.730434656529434e-05, 'iw_pca_fit': 'combined', 'iw_solver': 'lbfgs', 'iw_rho': 0.7}. Best is trial 146 with value: 0.24343952064345942.
2026-06-01 15:05:18 | INFO | Trial 152 | outer=2 | alpha=1.651e+05 n_pcs=3500 (pc_topk) weight={'name': 'pc_logistic', 'floor': 1e-06, 'clip_max': 2.5, 'prob_clip': 0.010182783531710793, 'n_components': 80, 'logistic_c': 6.1032322768429566e-05, 'pca_fit': 'combined', 'solver': 'lbfgs', 'max_iter': 2000, 'fit_intercept': True, 'standardize_with_source': True, 'rho': 0.7}
[I 2026-06-01 15:05:30,340] Trial 152 finished with value: 0.24346246553898646 and parameters: {'alpha': 165079.6394287721, 'n_pcs': 3500, 'iw_method': 'pc_logistic', 'iw_clip_max': 2.5, 'iw_prob_clip': 0.010182783531710793, 'iw_n_components': 80, 'iw_logistic_c': 6.1032322768429566e-05, 'iw_pca_fit': 'combined', 'iw_solver': 'lbfgs', 'iw_rho': 0.7}. Best is trial 152 with value: 0.24346246553898646.
2026-06-01 15:05:30 | INFO | Trial 153 | outer=2 | alpha=1.933e+05 n_pcs=3500 (pc_topk) weight={'name': 'pc_logistic', 'floor': 1e-06, 'clip_max': 2.5, 'prob_clip': 0.010482134593243563, 'n_components': 80, 'logistic_c': 5.8407936826158924e-05, 'pca_fit': 'combined', 'solver': 'lbfgs', 'max_iter': 2000, 'fit_intercept': True, 'standardize_with_source': True, 'rho': 0.7}
[I 2026-06-01 15:05:41,400] Trial 153 finished with value: 0.24335943230401655 and parameters: {'alpha': 193271.5809900646, 'n_pcs': 3500, 'iw_method': 'pc_logistic', 'iw_clip_max': 2.5, 'iw_prob_clip': 0.010482134593243563, 'iw_n_components': 80, 'iw_logistic_c': 5.8407936826158924e-05, 'iw_pca_fit': 'combined', 'iw_solver': 'lbfgs', 'iw_rho': 0.7}. Best is trial 152 with value: 0.24346246553898646.
2026-06-01 15:05:41 | INFO | Trial 154 | outer=2 | alpha=1.793e+05 n_pcs=3500 (pc_topk) weight={'name': 'pc_logistic', 'floor': 1e-06, 'clip_max': 2.5, 'prob_clip': 0.010625472100456524, 'n_components': 80, 'logistic_c': 5.465433312096921e-05, 'pca_fit': 'combined', 'solver': 'lbfgs', 'max_iter': 2000, 'fit_intercept': True, 'standardize_with_source': True, 'rho': 0.7}
[I 2026-06-01 15:05:53,558] Trial 154 finished with value: 0.2433988867888343 and parameters: {'alpha': 179260.72139697583, 'n_pcs': 3500, 'iw_method': 'pc_logistic', 'iw_clip_max': 2.5, 'iw_prob_clip': 0.010625472100456524, 'iw_n_components': 80, 'iw_logistic_c': 5.465433312096921e-05, 'iw_pca_fit': 'combined', 'iw_solver': 'lbfgs', 'iw_rho': 0.7}. Best is trial 152 with value: 0.24346246553898646.
2026-06-01 15:05:53 | INFO | Trial 155 | outer=2 | alpha=1.951e+05 n_pcs=3500 (pc_topk) weight={'name': 'pc_logistic', 'floor': 1e-06, 'clip_max': 2.5, 'prob_clip': 0.010562963470709712, 'n_components': 80, 'logistic_c': 5.683708447075444e-05, 'pca_fit': 'combined', 'solver': 'lbfgs', 'max_iter': 2000, 'fit_intercept': True, 'standardize_with_source': True, 'rho': 0.7}
[I 2026-06-01 15:06:06,135] Trial 155 finished with value: 0.2433356389004712 and parameters: {'alpha': 195138.03980943005, 'n_pcs': 3500, 'iw_method': 'pc_logistic', 'iw_clip_max': 2.5, 'iw_prob_clip': 0.010562963470709712, 'iw_n_components': 80, 'iw_logistic_c': 5.683708447075444e-05, 'iw_pca_fit': 'combined', 'iw_solver': 'lbfgs', 'iw_rho': 0.7}. Best is trial 152 with value: 0.24346246553898646.
2026-06-01 15:06:06 | INFO | Trial 156 | outer=2 | alpha=1.930e+05 n_pcs=3500 (pc_topk) weight={'name': 'pc_logistic', 'floor': 1e-06, 'clip_max': 2.5, 'prob_clip': 0.012972547819777509, 'n_components': 80, 'logistic_c': 5.79920322296969e-05, 'pca_fit': 'combined', 'solver': 'lbfgs', 'max_iter': 2000, 'fit_intercept': True, 'standardize_with_source': True, 'rho': 0.7}
[I 2026-06-01 15:06:18,510] Trial 156 finished with value: 0.2433844954285802 and parameters: {'alpha': 193039.16991908438, 'n_pcs': 3500, 'iw_method': 'pc_logistic', 'iw_clip_max': 2.5, 'iw_prob_clip': 0.012972547819777509, 'iw_n_components': 80, 'iw_logistic_c': 5.79920322296969e-05, 'iw_pca_fit': 'combined', 'iw_solver': 'lbfgs', 'iw_rho': 0.7}. Best is trial 152 with value: 0.24346246553898646.
2026-06-01 15:06:18 | INFO | Trial 157 | outer=2 | alpha=1.910e+05 n_pcs=3500 (pc_topk) weight={'name': 'pc_logistic', 'floor': 1e-06, 'clip_max': 2.5, 'prob_clip': 0.013311199769208568, 'n_components': 80, 'logistic_c': 5.8443657294207035e-05, 'pca_fit': 'combined', 'solver': 'lbfgs', 'max_iter': 2000, 'fit_intercept': True, 'standardize_with_source': True, 'rho': 0.7}
[I 2026-06-01 15:06:31,118] Trial 157 finished with value: 0.2434454100492011 and parameters: {'alpha': 191036.86612458425, 'n_pcs': 3500, 'iw_method': 'pc_logistic', 'iw_clip_max': 2.5, 'iw_prob_clip': 0.013311199769208568, 'iw_n_components': 80, 'iw_logistic_c': 5.8443657294207035e-05, 'iw_pca_fit': 'combined', 'iw_solver': 'lbfgs', 'iw_rho': 0.7}. Best is trial 152 with value: 0.24346246553898646.
2026-06-01 15:06:31 | INFO | Trial 158 | outer=2 | alpha=2.029e+05 n_pcs=3500 (pc_topk) weight={'name': 'pc_logistic', 'floor': 1e-06, 'clip_max': 2.5, 'prob_clip': 0.013013466665247381, 'n_components': 80, 'logistic_c': 5.8438759289229024e-05, 'pca_fit': 'combined', 'solver': 'lbfgs', 'max_iter': 2000, 'fit_intercept': True, 'standardize_with_source': True, 'rho': 0.7}
[I 2026-06-01 15:06:43,206] Trial 158 finished with value: 0.24331616341863338 and parameters: {'alpha': 202925.69644088438, 'n_pcs': 3500, 'iw_method': 'pc_logistic', 'iw_clip_max': 2.5, 'iw_prob_clip': 0.013013466665247381, 'iw_n_components': 80, 'iw_logistic_c': 5.8438759289229024e-05, 'iw_pca_fit': 'combined', 'iw_solver': 'lbfgs', 'iw_rho': 0.7}. Best is trial 152 with value: 0.24346246553898646.
2026-06-01 15:06:43 | INFO | Trial 159 | outer=2 | alpha=2.037e+05 n_pcs=3500 (pc_topk) weight={'name': 'uniform'}
[I 2026-06-01 15:06:49,173] Trial 159 finished with value: 0.2276336571643936 and parameters: {'alpha': 203682.2968073129, 'n_pcs': 3500, 'iw_method': 'uniform'}. Best is trial 152 with value: 0.24346246553898646.
2026-06-01 15:06:49 | INFO | Trial 160 | outer=2 | alpha=3.138e+05 n_pcs=3500 (pc_topk) weight={'name': 'pc_logistic', 'floor': 1e-06, 'clip_max': 2.5, 'prob_clip': 0.013120227799604268, 'n_components': 80, 'logistic_c': 4.668606030299466e-05, 'pca_fit': 'combined', 'solver': 'lbfgs', 'max_iter': 2000, 'fit_intercept': True, 'standardize_with_source': True, 'rho': 0.7}
[I 2026-06-01 15:07:12,088] Trial 160 finished with value: 0.24210115178174219 and parameters: {'alpha': 313750.07495804026, 'n_pcs': 3500, 'iw_method': 'pc_logistic', 'iw_clip_max': 2.5, 'iw_prob_clip': 0.013120227799604268, 'iw_n_components': 80, 'iw_logistic_c': 4.668606030299466e-05, 'iw_pca_fit': 'combined', 'iw_solver': 'lbfgs', 'iw_rho': 0.7}. Best is trial 152 with value: 0.24346246553898646.
2026-06-01 15:07:12 | INFO | Trial 161 | outer=2 | alpha=1.963e+05 n_pcs=3500 (pc_topk) weight={'name': 'pc_logistic', 'floor': 1e-06, 'clip_max': 2.5, 'prob_clip': 0.013678737003139284, 'n_components': 80, 'logistic_c': 6.32750887546058e-05, 'pca_fit': 'combined', 'solver': 'lbfgs', 'max_iter': 2000, 'fit_intercept': True, 'standardize_with_source': True, 'rho': 0.7}
[I 2026-06-01 15:07:24,195] Trial 161 finished with value: 0.24351352996907347 and parameters: {'alpha': 196295.43880990185, 'n_pcs': 3500, 'iw_method': 'pc_logistic', 'iw_clip_max': 2.5, 'iw_prob_clip': 0.013678737003139284, 'iw_n_components': 80, 'iw_logistic_c': 6.32750887546058e-05, 'iw_pca_fit': 'combined', 'iw_solver': 'lbfgs', 'iw_rho': 0.7}. Best is trial 161 with value: 0.24351352996907347.
2026-06-01 15:07:24 | INFO | Trial 162 | outer=2 | alpha=1.940e+05 n_pcs=3500 (pc_topk) weight={'name': 'pc_logistic', 'floor': 1e-06, 'clip_max': 2.5, 'prob_clip': 0.01639697228530418, 'n_components': 80, 'logistic_c': 2.1348395536671524e-05, 'pca_fit': 'combined', 'solver': 'lbfgs', 'max_iter': 2000, 'fit_intercept': True, 'standardize_with_source': True, 'rho': 0.7}
[I 2026-06-01 15:07:35,928] Trial 162 finished with value: 0.24237139905219868 and parameters: {'alpha': 194024.6503304124, 'n_pcs': 3500, 'iw_method': 'pc_logistic', 'iw_clip_max': 2.5, 'iw_prob_clip': 0.01639697228530418, 'iw_n_components': 80, 'iw_logistic_c': 2.1348395536671524e-05, 'iw_pca_fit': 'combined', 'iw_solver': 'lbfgs', 'iw_rho': 0.7}. Best is trial 161 with value: 0.24351352996907347.
2026-06-01 15:07:35 | INFO | Trial 163 | outer=2 | alpha=3.920e+05 n_pcs=3500 (pc_topk) weight={'name': 'pc_logistic', 'floor': 1e-06, 'clip_max': 2.5, 'prob_clip': 0.0170126117665962, 'n_components': 80, 'logistic_c': 7.603504120968083e-06, 'pca_fit': 'combined', 'solver': 'lbfgs', 'max_iter': 2000, 'fit_intercept': True, 'standardize_with_source': True, 'rho': 0.7}
[I 2026-06-01 15:07:58,872] Trial 163 finished with value: 0.23593582856518727 and parameters: {'alpha': 391962.56129943347, 'n_pcs': 3500, 'iw_method': 'pc_logistic', 'iw_clip_max': 2.5, 'iw_prob_clip': 0.0170126117665962, 'iw_n_components': 80, 'iw_logistic_c': 7.603504120968083e-06, 'iw_pca_fit': 'combined', 'iw_solver': 'lbfgs', 'iw_rho': 0.7}. Best is trial 161 with value: 0.24351352996907347.
2026-06-01 15:07:58 | INFO | Trial 164 | outer=2 | alpha=1.958e+05 n_pcs=3500 (pc_topk) weight={'name': 'pc_logistic', 'floor': 1e-06, 'clip_max': 2.5, 'prob_clip': 0.012884907752221404, 'n_components': 80, 'logistic_c': 2.212268807182661e-05, 'pca_fit': 'combined', 'solver': 'lbfgs', 'max_iter': 2000, 'fit_intercept': True, 'standardize_with_source': True, 'rho': 0.7}
[I 2026-06-01 15:08:14,051] Trial 164 finished with value: 0.24238765229636966 and parameters: {'alpha': 195774.88045365954, 'n_pcs': 3500, 'iw_method': 'pc_logistic', 'iw_clip_max': 2.5, 'iw_prob_clip': 0.012884907752221404, 'iw_n_components': 80, 'iw_logistic_c': 2.212268807182661e-05, 'iw_pca_fit': 'combined', 'iw_solver': 'lbfgs', 'iw_rho': 0.7}. Best is trial 161 with value: 0.24351352996907347.
2026-06-01 15:08:14 | INFO | Trial 165 | outer=2 | alpha=2.173e+05 n_pcs=3500 (pc_topk) weight={'name': 'pc_logistic', 'floor': 1e-06, 'clip_max': 2.5, 'prob_clip': 0.014104606059119479, 'n_components': 80, 'logistic_c': 6.54735237624506e-05, 'pca_fit': 'combined', 'solver': 'lbfgs', 'max_iter': 2000, 'fit_intercept': True, 'standardize_with_source': True, 'rho': 0.7}
[I 2026-06-01 15:08:26,566] Trial 165 finished with value: 0.24338917952872502 and parameters: {'alpha': 217334.09891954903, 'n_pcs': 3500, 'iw_method': 'pc_logistic', 'iw_clip_max': 2.5, 'iw_prob_clip': 0.014104606059119479, 'iw_n_components': 80, 'iw_logistic_c': 6.54735237624506e-05, 'iw_pca_fit': 'combined', 'iw_solver': 'lbfgs', 'iw_rho': 0.7}. Best is trial 161 with value: 0.24351352996907347.
2026-06-01 15:08:26 | INFO | Trial 166 | outer=2 | alpha=2.812e+05 n_pcs=3500 (pc_topk) weight={'name': 'pc_logistic', 'floor': 1e-06, 'clip_max': 2.5, 'prob_clip': 0.014101177504127137, 'n_components': 80, 'logistic_c': 6.43966920820064e-05, 'pca_fit': 'combined', 'solver': 'lbfgs', 'max_iter': 2000, 'fit_intercept': True, 'standardize_with_source': True, 'rho': 0.7}
[I 2026-06-01 15:08:38,781] Trial 166 finished with value: 0.24266728823500175 and parameters: {'alpha': 281214.979997908, 'n_pcs': 3500, 'iw_method': 'pc_logistic', 'iw_clip_max': 2.5, 'iw_prob_clip': 0.014101177504127137, 'iw_n_components': 80, 'iw_logistic_c': 6.43966920820064e-05, 'iw_pca_fit': 'combined', 'iw_solver': 'lbfgs', 'iw_rho': 0.7}. Best is trial 161 with value: 0.24351352996907347.
2026-06-01 15:08:38 | INFO | Trial 167 | outer=2 | alpha=2.458e+05 n_pcs=3500 (pc_topk) weight={'name': 'pc_logistic', 'floor': 1e-06, 'clip_max': 2.5, 'prob_clip': 0.01219749168766603, 'n_components': 80, 'logistic_c': 3.7581903976934376e-05, 'pca_fit': 'combined', 'solver': 'lbfgs', 'max_iter': 2000, 'fit_intercept': True, 'standardize_with_source': True, 'rho': 0.5}
[I 2026-06-01 15:08:55,402] Trial 167 finished with value: 0.24087273413810753 and parameters: {'alpha': 245820.12077134618, 'n_pcs': 3500, 'iw_method': 'pc_logistic', 'iw_clip_max': 2.5, 'iw_prob_clip': 0.01219749168766603, 'iw_n_components': 80, 'iw_logistic_c': 3.7581903976934376e-05, 'iw_pca_fit': 'combined', 'iw_solver': 'lbfgs', 'iw_rho': 0.5}. Best is trial 161 with value: 0.24351352996907347.
2026-06-01 15:08:55 | INFO | Trial 168 | outer=2 | alpha=2.454e+05 n_pcs=3500 (pc_topk) weight={'name': 'pc_logistic', 'floor': 1e-06, 'clip_max': 12.0, 'prob_clip': 0.010600894080565712, 'n_components': 80, 'logistic_c': 5.854711841015616e-05, 'pca_fit': 'combined', 'solver': 'lbfgs', 'max_iter': 2000, 'fit_intercept': True, 'standardize_with_source': True, 'rho': 0.85}
[I 2026-06-01 15:09:08,092] Trial 168 finished with value: 0.23128568151631904 and parameters: {'alpha': 245411.83397643376, 'n_pcs': 3500, 'iw_method': 'pc_logistic', 'iw_clip_max': 12.0, 'iw_prob_clip': 0.010600894080565712, 'iw_n_components': 80, 'iw_logistic_c': 5.854711841015616e-05, 'iw_pca_fit': 'combined', 'iw_solver': 'lbfgs', 'iw_rho': 0.85}. Best is trial 161 with value: 0.24351352996907347.
2026-06-01 15:09:08 | INFO | Trial 169 | outer=2 | alpha=1.785e+05 n_pcs=3500 (pc_topk) weight={'name': 'pc_logistic', 'floor': 1e-06, 'clip_max': 2.5, 'prob_clip': 0.01557096884336676, 'n_components': 80, 'logistic_c': 9.331570656963606e-05, 'pca_fit': 'combined', 'solver': 'lbfgs', 'max_iter': 2000, 'fit_intercept': True, 'standardize_with_source': True, 'rho': 0.7}
[I 2026-06-01 15:09:19,650] Trial 169 finished with value: 0.24360985385405204 and parameters: {'alpha': 178453.72236112313, 'n_pcs': 3500, 'iw_method': 'pc_logistic', 'iw_clip_max': 2.5, 'iw_prob_clip': 0.01557096884336676, 'iw_n_components': 80, 'iw_logistic_c': 9.331570656963606e-05, 'iw_pca_fit': 'combined', 'iw_solver': 'lbfgs', 'iw_rho': 0.7}. Best is trial 169 with value: 0.24360985385405204.
2026-06-01 15:09:19 | INFO | Trial 170 | outer=2 | alpha=4.887e+05 n_pcs=3500 (pc_topk) weight={'name': 'pc_logistic', 'floor': 1e-06, 'clip_max': 2.5, 'prob_clip': 0.018676184594332623, 'n_components': 80, 'logistic_c': 9.466243530895564e-05, 'pca_fit': 'combined', 'solver': 'lbfgs', 'max_iter': 2000, 'fit_intercept': True, 'standardize_with_source': True, 'rho': 0.7}
[I 2026-06-01 15:09:31,346] Trial 170 finished with value: 0.24012318216795786 and parameters: {'alpha': 488714.9111912365, 'n_pcs': 3500, 'iw_method': 'pc_logistic', 'iw_clip_max': 2.5, 'iw_prob_clip': 0.018676184594332623, 'iw_n_components': 80, 'iw_logistic_c': 9.466243530895564e-05, 'iw_pca_fit': 'combined', 'iw_solver': 'lbfgs', 'iw_rho': 0.7}. Best is trial 169 with value: 0.24360985385405204.
2026-06-01 15:09:31 | INFO | Trial 171 | outer=2 | alpha=1.674e+05 n_pcs=3500 (pc_topk) weight={'name': 'pc_logistic', 'floor': 1e-06, 'clip_max': 2.5, 'prob_clip': 0.012466369888808367, 'n_components': 80, 'logistic_c': 3.096748737869389e-05, 'pca_fit': 'combined', 'solver': 'lbfgs', 'max_iter': 2000, 'fit_intercept': True, 'standardize_with_source': True, 'rho': 0.7}
[I 2026-06-01 15:09:45,043] Trial 171 finished with value: 0.24333792390063635 and parameters: {'alpha': 167350.47855963107, 'n_pcs': 3500, 'iw_method': 'pc_logistic', 'iw_clip_max': 2.5, 'iw_prob_clip': 0.012466369888808367, 'iw_n_components': 80, 'iw_logistic_c': 3.096748737869389e-05, 'iw_pca_fit': 'combined', 'iw_solver': 'lbfgs', 'iw_rho': 0.7}. Best is trial 169 with value: 0.24360985385405204.
2026-06-01 15:09:45 | INFO | Trial 172 | outer=2 | alpha=1.764e+05 n_pcs=3500 (pc_topk) weight={'name': 'pc_logistic', 'floor': 1e-06, 'clip_max': 2.5, 'prob_clip': 0.015333445393198931, 'n_components': 80, 'logistic_c': 3.0923028598372146e-05, 'pca_fit': 'combined', 'solver': 'lbfgs', 'max_iter': 2000, 'fit_intercept': True, 'standardize_with_source': True, 'rho': 0.7}
