[I 2026-06-01 22:13:06,083] Trial 283 finished with value: 0.22942391721359118 and parameters: {'alpha': 62807.60910896884, 'n_pcs': 4000, 'iw_method': 'pc_logistic', 'iw_clip_max': 4.0, 'iw_prob_clip': 0.019402133699338346, 'iw_n_components': 80, 'iw_logistic_c': 1.3024576339645995e-05, 'iw_pca_fit': 'combined', 'iw_solver': 'lbfgs', 'iw_rho': 1.0}. Best is trial 276 with value: 0.23067241221891616.
2026-06-01 22:13:06 | INFO | Trial 284 | outer=7 | alpha=7.342e+04 n_pcs=4000 (pc_topk) weight={'name': 'pc_logistic', 'floor': 1e-06, 'clip_max': 4.0, 'prob_clip': 0.015975555849444108, 'n_components': 60, 'logistic_c': 2.3255258905960937e-05, 'pca_fit': 'combined', 'solver': 'lbfgs', 'max_iter': 2000, 'fit_intercept': True, 'standardize_with_source': True, 'rho': 1.0}
[I 2026-06-01 22:13:19,230] Trial 284 finished with value: 0.23026095075099767 and parameters: {'alpha': 73417.67651889553, 'n_pcs': 4000, 'iw_method': 'pc_logistic', 'iw_clip_max': 4.0, 'iw_prob_clip': 0.015975555849444108, 'iw_n_components': 60, 'iw_logistic_c': 2.3255258905960937e-05, 'iw_pca_fit': 'combined', 'iw_solver': 'lbfgs', 'iw_rho': 1.0}. Best is trial 276 with value: 0.23067241221891616.
2026-06-01 22:13:19 | INFO | Trial 285 | outer=7 | alpha=1.085e+05 n_pcs=2000 (pc_topk) weight={'name': 'pc_logistic', 'floor': 1e-06, 'clip_max': 4.0, 'prob_clip': 0.01765988417857073, 'n_components': 60, 'logistic_c': 1.7042246059919495, 'pca_fit': 'combined', 'solver': 'lbfgs', 'max_iter': 2000, 'fit_intercept': True, 'standardize_with_source': True, 'rho': 1.0}
[I 2026-06-01 22:13:38,713] Trial 285 finished with value: 0.21311909901034748 and parameters: {'alpha': 108540.57340674271, 'n_pcs': 2000, 'iw_method': 'pc_logistic', 'iw_clip_max': 4.0, 'iw_prob_clip': 0.01765988417857073, 'iw_n_components': 60, 'iw_logistic_c': 1.7042246059919495, 'iw_pca_fit': 'combined', 'iw_solver': 'lbfgs', 'iw_rho': 1.0}. Best is trial 276 with value: 0.23067241221891616.
2026-06-01 22:13:38 | INFO | Trial 286 | outer=7 | alpha=7.247e+04 n_pcs=3500 (pc_topk) weight={'name': 'pc_logistic', 'floor': 1e-06, 'clip_max': 4.0, 'prob_clip': 0.01627118889032286, 'n_components': 60, 'logistic_c': 2.6007027493722807e-05, 'pca_fit': 'combined', 'solver': 'lbfgs', 'max_iter': 2000, 'fit_intercept': True, 'standardize_with_source': True, 'rho': 1.0}
[I 2026-06-01 22:13:49,721] Trial 286 finished with value: 0.22678548239235563 and parameters: {'alpha': 72467.0969554332, 'n_pcs': 3500, 'iw_method': 'pc_logistic', 'iw_clip_max': 4.0, 'iw_prob_clip': 0.01627118889032286, 'iw_n_components': 60, 'iw_logistic_c': 2.6007027493722807e-05, 'iw_pca_fit': 'combined', 'iw_solver': 'lbfgs', 'iw_rho': 1.0}. Best is trial 276 with value: 0.23067241221891616.
2026-06-01 22:13:49 | INFO | Trial 287 | outer=7 | alpha=9.062e+04 n_pcs=4000 (pc_topk) weight={'name': 'pc_logistic', 'floor': 1e-06, 'clip_max': 4.0, 'prob_clip': 0.020033417576477138, 'n_components': 60, 'logistic_c': 2.3105535173116557e-05, 'pca_fit': 'combined', 'solver': 'lbfgs', 'max_iter': 2000, 'fit_intercept': True, 'standardize_with_source': True, 'rho': 0.85}
[I 2026-06-01 22:14:01,687] Trial 287 finished with value: 0.2296223880286133 and parameters: {'alpha': 90620.69982588482, 'n_pcs': 4000, 'iw_method': 'pc_logistic', 'iw_clip_max': 4.0, 'iw_prob_clip': 0.020033417576477138, 'iw_n_components': 60, 'iw_logistic_c': 2.3105535173116557e-05, 'iw_pca_fit': 'combined', 'iw_solver': 'lbfgs', 'iw_rho': 0.85}. Best is trial 276 with value: 0.23067241221891616.
2026-06-01 22:14:01 | INFO | Trial 288 | outer=7 | alpha=7.191e+04 n_pcs=4000 (pc_topk) weight={'name': 'pc_logistic', 'floor': 1e-06, 'clip_max': 4.0, 'prob_clip': 0.01740781813584421, 'n_components': 60, 'logistic_c': 1.0163818515570967e-05, 'pca_fit': 'combined', 'solver': 'lbfgs', 'max_iter': 2000, 'fit_intercept': True, 'standardize_with_source': True, 'rho': 1.0}
[I 2026-06-01 22:14:14,627] Trial 288 finished with value: 0.2285208974145097 and parameters: {'alpha': 71910.84155514951, 'n_pcs': 4000, 'iw_method': 'pc_logistic', 'iw_clip_max': 4.0, 'iw_prob_clip': 0.01740781813584421, 'iw_n_components': 60, 'iw_logistic_c': 1.0163818515570967e-05, 'iw_pca_fit': 'combined', 'iw_solver': 'lbfgs', 'iw_rho': 1.0}. Best is trial 276 with value: 0.23067241221891616.
2026-06-01 22:14:14 | INFO | Trial 289 | outer=7 | alpha=4.415e+04 n_pcs=4000 (pc_topk) weight={'name': 'pc_logistic', 'floor': 1e-06, 'clip_max': 4.0, 'prob_clip': 0.016180295654283635, 'n_components': 60, 'logistic_c': 2.090663758385076e-05, 'pca_fit': 'combined', 'solver': 'lbfgs', 'max_iter': 2000, 'fit_intercept': True, 'standardize_with_source': True, 'rho': 1.0}
[I 2026-06-01 22:14:27,880] Trial 289 finished with value: 0.22990969047834567 and parameters: {'alpha': 44149.4000469975, 'n_pcs': 4000, 'iw_method': 'pc_logistic', 'iw_clip_max': 4.0, 'iw_prob_clip': 0.016180295654283635, 'iw_n_components': 60, 'iw_logistic_c': 2.090663758385076e-05, 'iw_pca_fit': 'combined', 'iw_solver': 'lbfgs', 'iw_rho': 1.0}. Best is trial 276 with value: 0.23067241221891616.
2026-06-01 22:14:27 | INFO | Trial 290 | outer=7 | alpha=7.913e+04 n_pcs=4000 (pc_topk) weight={'name': 'uniform'}
[I 2026-06-01 22:14:34,694] Trial 290 finished with value: 0.21564820341708116 and parameters: {'alpha': 79132.87951810133, 'n_pcs': 4000, 'iw_method': 'uniform'}. Best is trial 276 with value: 0.23067241221891616.
2026-06-01 22:14:34 | INFO | Trial 291 | outer=7 | alpha=6.026e+04 n_pcs=4000 (pc_topk) weight={'name': 'pc_logistic', 'floor': 1e-06, 'clip_max': 4.0, 'prob_clip': 0.014707391410569332, 'n_components': 60, 'logistic_c': 0.04647871172360692, 'pca_fit': 'combined', 'solver': 'lbfgs', 'max_iter': 2000, 'fit_intercept': True, 'standardize_with_source': True, 'rho': 1.0}
[I 2026-06-01 22:14:58,128] Trial 291 finished with value: 0.22361443483399018 and parameters: {'alpha': 60260.27851675615, 'n_pcs': 4000, 'iw_method': 'pc_logistic', 'iw_clip_max': 4.0, 'iw_prob_clip': 0.014707391410569332, 'iw_n_components': 60, 'iw_logistic_c': 0.04647871172360692, 'iw_pca_fit': 'combined', 'iw_solver': 'lbfgs', 'iw_rho': 1.0}. Best is trial 276 with value: 0.23067241221891616.
2026-06-01 22:14:58 | INFO | Trial 292 | outer=7 | alpha=9.903e+04 n_pcs=4000 (pc_topk) weight={'name': 'pc_logistic', 'floor': 1e-06, 'clip_max': 4.0, 'prob_clip': 0.019065222456788333, 'n_components': 60, 'logistic_c': 1.4447276757443452e-05, 'pca_fit': 'combined', 'solver': 'lbfgs', 'max_iter': 2000, 'fit_intercept': True, 'standardize_with_source': True, 'rho': 1.0}
[I 2026-06-01 22:15:11,174] Trial 292 finished with value: 0.22832431889997534 and parameters: {'alpha': 99033.02404622632, 'n_pcs': 4000, 'iw_method': 'pc_logistic', 'iw_clip_max': 4.0, 'iw_prob_clip': 0.019065222456788333, 'iw_n_components': 60, 'iw_logistic_c': 1.4447276757443452e-05, 'iw_pca_fit': 'combined', 'iw_solver': 'lbfgs', 'iw_rho': 1.0}. Best is trial 276 with value: 0.23067241221891616.
2026-06-01 22:15:11 | INFO | Trial 293 | outer=7 | alpha=4.719e+04 n_pcs=4000 (pc_topk) weight={'name': 'pc_logistic', 'floor': 1e-06, 'clip_max': 4.0, 'prob_clip': 0.017130785792285837, 'n_components': 60, 'logistic_c': 2.5820246124191137e-05, 'pca_fit': 'combined', 'solver': 'lbfgs', 'max_iter': 2000, 'fit_intercept': True, 'standardize_with_source': True, 'rho': 1.0}
[I 2026-06-01 22:15:24,607] Trial 293 finished with value: 0.22996831332571993 and parameters: {'alpha': 47193.57304369149, 'n_pcs': 4000, 'iw_method': 'pc_logistic', 'iw_clip_max': 4.0, 'iw_prob_clip': 0.017130785792285837, 'iw_n_components': 60, 'iw_logistic_c': 2.5820246124191137e-05, 'iw_pca_fit': 'combined', 'iw_solver': 'lbfgs', 'iw_rho': 1.0}. Best is trial 276 with value: 0.23067241221891616.
2026-06-01 22:15:24 | INFO | Trial 294 | outer=7 | alpha=3.446e+06 n_pcs=4000 (pc_topk) weight={'name': 'pc_logistic', 'floor': 1e-06, 'clip_max': 4.0, 'prob_clip': 0.01555788251267088, 'n_components': 60, 'logistic_c': 7.115336397112314e-06, 'pca_fit': 'combined', 'solver': 'lbfgs', 'max_iter': 2000, 'fit_intercept': True, 'standardize_with_source': True, 'rho': 1.0}
[I 2026-06-01 22:15:37,006] Trial 294 finished with value: 0.1957325802128425 and parameters: {'alpha': 3446293.479174138, 'n_pcs': 4000, 'iw_method': 'pc_logistic', 'iw_clip_max': 4.0, 'iw_prob_clip': 0.01555788251267088, 'iw_n_components': 60, 'iw_logistic_c': 7.115336397112314e-06, 'iw_pca_fit': 'combined', 'iw_solver': 'lbfgs', 'iw_rho': 1.0}. Best is trial 276 with value: 0.23067241221891616.
2026-06-01 22:15:37 | INFO | Trial 295 | outer=7 | alpha=7.891e+04 n_pcs=4000 (pc_topk) weight={'name': 'pc_logistic', 'floor': 1e-06, 'clip_max': 1.5, 'prob_clip': 0.02033106015241782, 'n_components': 60, 'logistic_c': 1.8986815627952643e-05, 'pca_fit': 'combined', 'solver': 'lbfgs', 'max_iter': 2000, 'fit_intercept': True, 'standardize_with_source': True, 'rho': 0.7}
[I 2026-06-01 22:15:50,082] Trial 295 finished with value: 0.22317200803472598 and parameters: {'alpha': 78906.99759638419, 'n_pcs': 4000, 'iw_method': 'pc_logistic', 'iw_clip_max': 1.5, 'iw_prob_clip': 0.02033106015241782, 'iw_n_components': 60, 'iw_logistic_c': 1.8986815627952643e-05, 'iw_pca_fit': 'combined', 'iw_solver': 'lbfgs', 'iw_rho': 0.7}. Best is trial 276 with value: 0.23067241221891616.
2026-06-01 22:15:50 | INFO | Trial 296 | outer=7 | alpha=5.732e+04 n_pcs=3500 (pc_topk) weight={'name': 'pc_logistic', 'floor': 1e-06, 'clip_max': 4.0, 'prob_clip': 0.01819432337865772, 'n_components': 60, 'logistic_c': 1.1727748644272522e-05, 'pca_fit': 'combined', 'solver': 'lbfgs', 'max_iter': 2000, 'fit_intercept': True, 'standardize_with_source': True, 'rho': 1.0}
[I 2026-06-01 22:16:00,947] Trial 296 finished with value: 0.2258551575201237 and parameters: {'alpha': 57317.88664474766, 'n_pcs': 3500, 'iw_method': 'pc_logistic', 'iw_clip_max': 4.0, 'iw_prob_clip': 0.01819432337865772, 'iw_n_components': 60, 'iw_logistic_c': 1.1727748644272522e-05, 'iw_pca_fit': 'combined', 'iw_solver': 'lbfgs', 'iw_rho': 1.0}. Best is trial 276 with value: 0.23067241221891616.
2026-06-01 22:16:01 | INFO | Trial 297 | outer=7 | alpha=6.606e+04 n_pcs=4000 (pc_topk) weight={'name': 'pc_logistic', 'floor': 1e-06, 'clip_max': 4.0, 'prob_clip': 0.014665212712941394, 'n_components': 60, 'logistic_c': 2.697766324616916e-05, 'pca_fit': 'combined', 'solver': 'lbfgs', 'max_iter': 2000, 'fit_intercept': True, 'standardize_with_source': True, 'rho': 1.0}
[I 2026-06-01 22:16:13,301] Trial 297 finished with value: 0.23016765523451568 and parameters: {'alpha': 66061.56716338256, 'n_pcs': 4000, 'iw_method': 'pc_logistic', 'iw_clip_max': 4.0, 'iw_prob_clip': 0.014665212712941394, 'iw_n_components': 60, 'iw_logistic_c': 2.697766324616916e-05, 'iw_pca_fit': 'combined', 'iw_solver': 'lbfgs', 'iw_rho': 1.0}. Best is trial 276 with value: 0.23067241221891616.
2026-06-01 22:16:13 | INFO | Trial 298 | outer=7 | alpha=4.521e+04 n_pcs=4000 (pc_topk) weight={'name': 'pc_logistic', 'floor': 1e-06, 'clip_max': 4.0, 'prob_clip': 0.015905506210558536, 'n_components': 60, 'logistic_c': 1.7242325335041224e-05, 'pca_fit': 'combined', 'solver': 'lbfgs', 'max_iter': 2000, 'fit_intercept': True, 'standardize_with_source': True, 'rho': 1.0}
[I 2026-06-01 22:16:26,660] Trial 298 finished with value: 0.22998955665725868 and parameters: {'alpha': 45210.950966035096, 'n_pcs': 4000, 'iw_method': 'pc_logistic', 'iw_clip_max': 4.0, 'iw_prob_clip': 0.015905506210558536, 'iw_n_components': 60, 'iw_logistic_c': 1.7242325335041224e-05, 'iw_pca_fit': 'combined', 'iw_solver': 'lbfgs', 'iw_rho': 1.0}. Best is trial 276 with value: 0.23067241221891616.
2026-06-01 22:16:26 | INFO | Trial 299 | outer=7 | alpha=8.758e+04 n_pcs=4000 (pc_topk) weight={'name': 'pc_logistic', 'floor': 1e-06, 'clip_max': 4.0, 'prob_clip': 0.014228697132561448, 'n_components': 60, 'logistic_c': 9.059008917690223e-06, 'pca_fit': 'combined', 'solver': 'lbfgs', 'max_iter': 2000, 'fit_intercept': True, 'standardize_with_source': True, 'rho': 1.0}
[I 2026-06-01 22:16:39,252] Trial 299 finished with value: 0.22710933804063496 and parameters: {'alpha': 87582.70624751378, 'n_pcs': 4000, 'iw_method': 'pc_logistic', 'iw_clip_max': 4.0, 'iw_prob_clip': 0.014228697132561448, 'iw_n_components': 60, 'iw_logistic_c': 9.059008917690223e-06, 'iw_pca_fit': 'combined', 'iw_solver': 'lbfgs', 'iw_rho': 1.0}. Best is trial 276 with value: 0.23067241221891616.
2026-06-01 22:16:39 | INFO | OUTER 7 best (inner mean r=0.2307): {'model_type': 'pc_ridge', 'alpha': 70416.38332517771, 'use_snp_selection': True, 'num_snps': 4000, 'n_pcs': 4000, 'weighting': {'name': 'pc_logistic', 'floor': 1e-06, 'clip_max': 4.0, 'prob_clip': 0.019641938167716005, 'n_components': 60, 'logistic_c': 2.198793509155266e-05, 'pca_fit': 'combined', 'solver': 'lbfgs', 'max_iter': 2000, 'fit_intercept': True, 'standardize_with_source': True, 'rho': 1.0}, 'mean_inner_effective_sample_size': 3776.6950439034727, 'mean_inner_effective_sample_size_threshold': 996.1}
2026-06-01 22:16:40 | INFO | OUTER 7 TEST r = 0.3769
2026-06-01 22:16:40 | INFO | OUTER 7 incremental summary saved to outputs/final_results/e6_pc_ridge_importance/thr_wing/e6_pc_ridge_importance_thr_wing_results.json
2026-06-01 22:16:40 | INFO | OUTER 8: test_size=256 island=7 (Onøy og Lurøy)
2026-06-01 22:16:40 | INFO | OUTER 8: using top 10 related inner validation islands for tuning: 9(Sleneset, avgGRM=0.0092), 8(Lovund, avgGRM=0.0058), 6(Indre Kvarøy, avgGRM=0.0042), 5(Hestmannøy, avgGRM=0.0026), 0(Nesøy, avgGRM=0.0025), 1(Myken, avgGRM=0.0024), 2(Træna, avgGRM=0.0024), 3(Selvær, avgGRM=0.0018), 10(Aldra, avgGRM=0.0011), 4(Gjerøy, avgGRM=0.0002)
[I 2026-06-01 22:16:40,724] A new study created in memory with name: ridge_importance_inner_outer7
2026-06-01 22:16:40 | INFO | Trial 0 | outer=8 | alpha=1.137e+05 n_pcs=4000 (pc_topk) weight={'name': 'uniform'}
[I 2026-06-01 22:16:47,798] Trial 0 finished with value: 0.20743499001809346 and parameters: {'alpha': 113703.38004442609, 'n_pcs': 4000, 'iw_method': 'uniform'}. Best is trial 0 with value: 0.20743499001809346.
2026-06-01 22:16:47 | INFO | Trial 1 | outer=8 | alpha=1.734e+04 n_pcs=5000 (pc_topk) weight={'name': 'uniform'}
[I 2026-06-01 22:16:57,790] Trial 1 finished with value: 0.214571473362331 and parameters: {'alpha': 17335.792577698634, 'n_pcs': 5000, 'iw_method': 'uniform'}. Best is trial 1 with value: 0.214571473362331.
2026-06-01 22:16:57 | INFO | Trial 2 | outer=8 | alpha=1.435e+05 n_pcs=1500 (pc_topk) weight={'name': 'uniform'}
[I 2026-06-01 22:17:01,242] Trial 2 finished with value: 0.19626204242344417 and parameters: {'alpha': 143482.76912965564, 'n_pcs': 1500, 'iw_method': 'uniform'}. Best is trial 1 with value: 0.214571473362331.
2026-06-01 22:17:01 | INFO | Trial 3 | outer=8 | alpha=1.431e+05 n_pcs=500 (pc_topk) weight={'name': 'uniform'}
[I 2026-06-01 22:17:02,410] Trial 3 finished with value: 0.1536470580740425 and parameters: {'alpha': 143072.2464444983, 'n_pcs': 500, 'iw_method': 'uniform'}. Best is trial 1 with value: 0.214571473362331.
2026-06-01 22:17:02 | INFO | Trial 4 | outer=8 | alpha=5.373e+06 n_pcs=2000 (pc_topk) weight={'name': 'pc_logistic', 'floor': 1e-06, 'clip_max': 1.5, 'prob_clip': 0.001637400317167702, 'n_components': 80, 'logistic_c': 0.09386700500068379, 'pca_fit': 'combined', 'solver': 'lbfgs', 'max_iter': 2000, 'fit_intercept': True, 'standardize_with_source': True, 'rho': 1.0}
[I 2026-06-01 22:17:22,205] Trial 4 finished with value: 0.19172784005538784 and parameters: {'alpha': 5373167.4046281455, 'n_pcs': 2000, 'iw_method': 'pc_logistic', 'iw_clip_max': 1.5, 'iw_prob_clip': 0.001637400317167702, 'iw_n_components': 80, 'iw_logistic_c': 0.09386700500068379, 'iw_pca_fit': 'combined', 'iw_solver': 'lbfgs', 'iw_rho': 1.0}. Best is trial 1 with value: 0.214571473362331.
2026-06-01 22:17:22 | INFO | Trial 5 | outer=8 | alpha=6.435e+04 n_pcs=1000 (pc_topk) weight={'name': 'pc_logistic', 'floor': 1e-06, 'clip_max': 7.0, 'prob_clip': 0.004193356127903791, 'n_components': 20, 'logistic_c': 9.236417519010976, 'pca_fit': 'combined', 'solver': 'lbfgs', 'max_iter': 2000, 'fit_intercept': True, 'standardize_with_source': True, 'rho': 1.0}
2026-06-01 22:17:35 | INFO | Trial 5 rejected by ESS guard: mean_ess=805.84 threshold=1012.84
[I 2026-06-01 22:17:35,201] Trial 5 finished with value: -1.0 and parameters: {'alpha': 64350.09539177312, 'n_pcs': 1000, 'iw_method': 'pc_logistic', 'iw_clip_max': 7.0, 'iw_prob_clip': 0.004193356127903791, 'iw_n_components': 20, 'iw_logistic_c': 9.236417519010976, 'iw_pca_fit': 'combined', 'iw_solver': 'lbfgs', 'iw_rho': 1.0}. Best is trial 1 with value: 0.214571473362331.
2026-06-01 22:17:35 | INFO | Trial 6 | outer=8 | alpha=3.046e+05 n_pcs=3500 (pc_topk) weight={'name': 'pc_logistic', 'floor': 1e-06, 'clip_max': 12.0, 'prob_clip': 0.0007016380040663315, 'n_components': 80, 'logistic_c': 0.00021908930989278453, 'pca_fit': 'combined', 'solver': 'lbfgs', 'max_iter': 2000, 'fit_intercept': True, 'standardize_with_source': True, 'rho': 0.7}
[I 2026-06-01 22:17:48,747] Trial 6 finished with value: 0.20622764515110364 and parameters: {'alpha': 304631.0485153137, 'n_pcs': 3500, 'iw_method': 'pc_logistic', 'iw_clip_max': 12.0, 'iw_prob_clip': 0.0007016380040663315, 'iw_n_components': 80, 'iw_logistic_c': 0.00021908930989278453, 'iw_pca_fit': 'combined', 'iw_solver': 'lbfgs', 'iw_rho': 0.7}. Best is trial 1 with value: 0.214571473362331.
2026-06-01 22:17:48 | INFO | Trial 7 | outer=8 | alpha=7.213e+06 n_pcs=500 (pc_topk) weight={'name': 'uniform'}
[I 2026-06-01 22:17:49,726] Trial 7 finished with value: 0.14709295741708606 and parameters: {'alpha': 7213019.60957054, 'n_pcs': 500, 'iw_method': 'uniform'}. Best is trial 1 with value: 0.214571473362331.
2026-06-01 22:17:49 | INFO | Trial 8 | outer=8 | alpha=2.347e+03 n_pcs=3000 (pc_topk) weight={'name': 'pc_logistic', 'floor': 1e-06, 'clip_max': 2.5, 'prob_clip': 0.017782866059784724, 'n_components': 60, 'logistic_c': 4.584813955429537e-07, 'pca_fit': 'combined', 'solver': 'lbfgs', 'max_iter': 2000, 'fit_intercept': True, 'standardize_with_source': True, 'rho': 0.3}
[I 2026-06-01 22:17:59,199] Trial 8 finished with value: 0.13170150451881343 and parameters: {'alpha': 2346.6230871488538, 'n_pcs': 3000, 'iw_method': 'pc_logistic', 'iw_clip_max': 2.5, 'iw_prob_clip': 0.017782866059784724, 'iw_n_components': 60, 'iw_logistic_c': 4.584813955429537e-07, 'iw_pca_fit': 'combined', 'iw_solver': 'lbfgs', 'iw_rho': 0.3}. Best is trial 1 with value: 0.214571473362331.
2026-06-01 22:17:59 | INFO | Trial 9 | outer=8 | alpha=1.067e+03 n_pcs=4000 (pc_topk) weight={'name': 'pc_logistic', 'floor': 1e-06, 'clip_max': 4.0, 'prob_clip': 0.003002704300062754, 'n_components': 10, 'logistic_c': 4.32601466983518e-06, 'pca_fit': 'combined', 'solver': 'lbfgs', 'max_iter': 2000, 'fit_intercept': True, 'standardize_with_source': True, 'rho': 1.0}
[I 2026-06-01 22:18:11,520] Trial 9 finished with value: 0.1171358067852227 and parameters: {'alpha': 1067.2105048492429, 'n_pcs': 4000, 'iw_method': 'pc_logistic', 'iw_clip_max': 4.0, 'iw_prob_clip': 0.003002704300062754, 'iw_n_components': 10, 'iw_logistic_c': 4.32601466983518e-06, 'iw_pca_fit': 'combined', 'iw_solver': 'lbfgs', 'iw_rho': 1.0}. Best is trial 1 with value: 0.214571473362331.
2026-06-01 22:18:11 | INFO | Trial 10 | outer=8 | alpha=1.150e+04 n_pcs=5000 (pc_topk) weight={'name': 'uniform'}
[I 2026-06-01 22:18:21,986] Trial 10 finished with value: 0.21133872097980033 and parameters: {'alpha': 11501.099698953694, 'n_pcs': 5000, 'iw_method': 'uniform'}. Best is trial 1 with value: 0.214571473362331.
2026-06-01 22:18:21 | INFO | Trial 11 | outer=8 | alpha=9.461e+03 n_pcs=5000 (pc_topk) weight={'name': 'uniform'}
[I 2026-06-01 22:18:32,262] Trial 11 finished with value: 0.20908946924832977 and parameters: {'alpha': 9461.19667347222, 'n_pcs': 5000, 'iw_method': 'uniform'}. Best is trial 1 with value: 0.214571473362331.
2026-06-01 22:18:32 | INFO | Trial 12 | outer=8 | alpha=1.341e+04 n_pcs=5000 (pc_topk) weight={'name': 'uniform'}
[I 2026-06-01 22:18:42,541] Trial 12 finished with value: 0.21278570839555327 and parameters: {'alpha': 13411.551226369838, 'n_pcs': 5000, 'iw_method': 'uniform'}. Best is trial 1 with value: 0.214571473362331.
2026-06-01 22:18:42 | INFO | Trial 13 | outer=8 | alpha=1.460e+04 n_pcs=4500 (pc_topk) weight={'name': 'uniform'}
[I 2026-06-01 22:18:51,457] Trial 13 finished with value: 0.21447938124636168 and parameters: {'alpha': 14604.768536146159, 'n_pcs': 4500, 'iw_method': 'uniform'}. Best is trial 1 with value: 0.214571473362331.
2026-06-01 22:18:51 | INFO | Trial 14 | outer=8 | alpha=4.147e+04 n_pcs=4000 (pc_topk) weight={'name': 'uniform'}
[I 2026-06-01 22:18:58,809] Trial 14 finished with value: 0.2147458740936131 and parameters: {'alpha': 41467.09244464692, 'n_pcs': 4000, 'iw_method': 'uniform'}. Best is trial 14 with value: 0.2147458740936131.
2026-06-01 22:18:58 | INFO | Trial 15 | outer=8 | alpha=9.891e+05 n_pcs=2500 (pc_topk) weight={'name': 'uniform'}
[I 2026-06-01 22:19:02,830] Trial 15 finished with value: 0.18679112350308136 and parameters: {'alpha': 989126.4335540048, 'n_pcs': 2500, 'iw_method': 'uniform'}. Best is trial 14 with value: 0.2147458740936131.
2026-06-01 22:19:02 | INFO | Trial 16 | outer=8 | alpha=4.070e+04 n_pcs=4000 (pc_topk) weight={'name': 'uniform'}
[I 2026-06-01 22:19:10,041] Trial 16 finished with value: 0.21477752273540457 and parameters: {'alpha': 40698.44372944894, 'n_pcs': 4000, 'iw_method': 'uniform'}. Best is trial 16 with value: 0.21477752273540457.
2026-06-01 22:19:10 | INFO | Trial 17 | outer=8 | alpha=3.762e+04 n_pcs=3500 (pc_topk) weight={'name': 'uniform'}
[I 2026-06-01 22:19:15,855] Trial 17 finished with value: 0.2121249223633373 and parameters: {'alpha': 37618.4927169187, 'n_pcs': 3500, 'iw_method': 'uniform'}. Best is trial 16 with value: 0.21477752273540457.
2026-06-01 22:19:15 | INFO | Trial 18 | outer=8 | alpha=7.147e+05 n_pcs=3000 (pc_topk) weight={'name': 'uniform'}
