[I 2026-06-01 01:20:36,105] Trial 177 finished with value: 0.22702382323388792 and parameters: {'alpha': 27360.375657300905, 'n_pcs': 4500, 'weight_scheme': 'linear', 'weight_clip_max': 20.0, 'weight_linear_min_weight': 0.3701330115428419, 'weight_linear_max_weight': 4.514413280885417}. Best is trial 86 with value: 0.22876955329088525.
2026-06-01 01:20:36 | INFO | src.nested_cv_avggrm_weighted_unified | Trial 178 | outer=7 | alpha=7.312e+04 n_pcs=5000 (pc_topk) weight_search=on
2026-06-01 01:20:36 | INFO | src.nested_cv_avggrm_weighted_unified | Trial 178 | outer=7 | weight={'name': 'linear', 'floor': 1e-06, 'clip_max': 20.0, 'min_weight': 0.40057061014668827, 'max_weight': 4.293371226764088}
[I 2026-06-01 01:20:44,026] Trial 178 finished with value: 0.22614279044212343 and parameters: {'alpha': 73118.99202020226, 'n_pcs': 5000, 'weight_scheme': 'linear', 'weight_clip_max': 20.0, 'weight_linear_min_weight': 0.40057061014668827, 'weight_linear_max_weight': 4.293371226764088}. Best is trial 86 with value: 0.22876955329088525.
2026-06-01 01:20:44 | INFO | src.nested_cv_avggrm_weighted_unified | Trial 179 | outer=7 | alpha=4.768e+04 n_pcs=4500 (pc_topk) weight_search=on
2026-06-01 01:20:44 | INFO | src.nested_cv_avggrm_weighted_unified | Trial 179 | outer=7 | weight={'name': 'uniform', 'floor': 1e-06, 'clip_max': 20.0}
[I 2026-06-01 01:20:49,910] Trial 179 finished with value: 0.21919241058768088 and parameters: {'alpha': 47682.1212318188, 'n_pcs': 4500, 'weight_scheme': 'uniform', 'weight_clip_max': 20.0}. Best is trial 86 with value: 0.22876955329088525.
2026-06-01 01:20:49 | INFO | src.nested_cv_avggrm_weighted_unified | Trial 180 | outer=7 | alpha=3.537e+04 n_pcs=2500 (pc_topk) weight_search=on
2026-06-01 01:20:49 | INFO | src.nested_cv_avggrm_weighted_unified | Trial 180 | outer=7 | weight={'name': 'linear', 'floor': 1e-06, 'clip_max': 3.0, 'min_weight': 0.4477022218607855, 'max_weight': 4.221421091403233}
[I 2026-06-01 01:20:53,328] Trial 180 finished with value: 0.21486473296938646 and parameters: {'alpha': 35365.79551066391, 'n_pcs': 2500, 'weight_scheme': 'linear', 'weight_clip_max': 3.0, 'weight_linear_min_weight': 0.4477022218607855, 'weight_linear_max_weight': 4.221421091403233}. Best is trial 86 with value: 0.22876955329088525.
2026-06-01 01:20:53 | INFO | src.nested_cv_avggrm_weighted_unified | Trial 181 | outer=7 | alpha=4.784e+04 n_pcs=4500 (pc_topk) weight_search=on
2026-06-01 01:20:53 | INFO | src.nested_cv_avggrm_weighted_unified | Trial 181 | outer=7 | weight={'name': 'linear', 'floor': 1e-06, 'clip_max': 20.0, 'min_weight': 0.4024052620805444, 'max_weight': 4.420425349729643}
[I 2026-06-01 01:21:00,137] Trial 181 finished with value: 0.22869579343418317 and parameters: {'alpha': 47835.2125766319, 'n_pcs': 4500, 'weight_scheme': 'linear', 'weight_clip_max': 20.0, 'weight_linear_min_weight': 0.4024052620805444, 'weight_linear_max_weight': 4.420425349729643}. Best is trial 86 with value: 0.22876955329088525.
2026-06-01 01:21:00 | INFO | src.nested_cv_avggrm_weighted_unified | Trial 182 | outer=7 | alpha=6.617e+04 n_pcs=4500 (pc_topk) weight_search=on
2026-06-01 01:21:00 | INFO | src.nested_cv_avggrm_weighted_unified | Trial 182 | outer=7 | weight={'name': 'linear', 'floor': 1e-06, 'clip_max': 20.0, 'min_weight': 0.3969527657401607, 'max_weight': 4.399367102098632}
[I 2026-06-01 01:21:06,977] Trial 182 finished with value: 0.22822538296838563 and parameters: {'alpha': 66170.21525354189, 'n_pcs': 4500, 'weight_scheme': 'linear', 'weight_clip_max': 20.0, 'weight_linear_min_weight': 0.3969527657401607, 'weight_linear_max_weight': 4.399367102098632}. Best is trial 86 with value: 0.22876955329088525.
2026-06-01 01:21:06 | INFO | src.nested_cv_avggrm_weighted_unified | Trial 183 | outer=7 | alpha=4.810e+04 n_pcs=4500 (pc_topk) weight_search=on
2026-06-01 01:21:06 | INFO | src.nested_cv_avggrm_weighted_unified | Trial 183 | outer=7 | weight={'name': 'linear', 'floor': 1e-06, 'clip_max': 20.0, 'min_weight': 0.47224502642644606, 'max_weight': 4.4568412275887255}
[I 2026-06-01 01:21:13,851] Trial 183 finished with value: 0.22861583729180435 and parameters: {'alpha': 48096.342607039725, 'n_pcs': 4500, 'weight_scheme': 'linear', 'weight_clip_max': 20.0, 'weight_linear_min_weight': 0.47224502642644606, 'weight_linear_max_weight': 4.4568412275887255}. Best is trial 86 with value: 0.22876955329088525.
2026-06-01 01:21:13 | INFO | src.nested_cv_avggrm_weighted_unified | Trial 184 | outer=7 | alpha=7.986e+04 n_pcs=4500 (pc_topk) weight_search=on
2026-06-01 01:21:13 | INFO | src.nested_cv_avggrm_weighted_unified | Trial 184 | outer=7 | weight={'name': 'linear', 'floor': 1e-06, 'clip_max': 20.0, 'min_weight': 0.35911797770210885, 'max_weight': 4.264815172586131}
[I 2026-06-01 01:21:20,627] Trial 184 finished with value: 0.22762167051711552 and parameters: {'alpha': 79864.59334162831, 'n_pcs': 4500, 'weight_scheme': 'linear', 'weight_clip_max': 20.0, 'weight_linear_min_weight': 0.35911797770210885, 'weight_linear_max_weight': 4.264815172586131}. Best is trial 86 with value: 0.22876955329088525.
2026-06-01 01:21:20 | INFO | src.nested_cv_avggrm_weighted_unified | Trial 185 | outer=7 | alpha=4.157e+04 n_pcs=4500 (pc_topk) weight_search=on
2026-06-01 01:21:20 | INFO | src.nested_cv_avggrm_weighted_unified | Trial 185 | outer=7 | weight={'name': 'linear', 'floor': 1e-06, 'clip_max': 20.0, 'min_weight': 0.3470009593458644, 'max_weight': 4.160226508695581}
[I 2026-06-01 01:21:27,366] Trial 185 finished with value: 0.228610656829699 and parameters: {'alpha': 41568.77207561345, 'n_pcs': 4500, 'weight_scheme': 'linear', 'weight_clip_max': 20.0, 'weight_linear_min_weight': 0.3470009593458644, 'weight_linear_max_weight': 4.160226508695581}. Best is trial 86 with value: 0.22876955329088525.
2026-06-01 01:21:27 | INFO | src.nested_cv_avggrm_weighted_unified | Trial 186 | outer=7 | alpha=5.390e+04 n_pcs=1000 (pc_topk) weight_search=on
2026-06-01 01:21:27 | INFO | src.nested_cv_avggrm_weighted_unified | Trial 186 | outer=7 | weight={'name': 'linear', 'floor': 1e-06, 'clip_max': 20.0, 'min_weight': 0.38106130316017217, 'max_weight': 4.530624703266082}
[I 2026-06-01 01:21:28,762] Trial 186 finished with value: 0.22014403254693002 and parameters: {'alpha': 53900.20597550675, 'n_pcs': 1000, 'weight_scheme': 'linear', 'weight_clip_max': 20.0, 'weight_linear_min_weight': 0.38106130316017217, 'weight_linear_max_weight': 4.530624703266082}. Best is trial 86 with value: 0.22876955329088525.
2026-06-01 01:21:28 | INFO | src.nested_cv_avggrm_weighted_unified | Trial 187 | outer=7 | alpha=6.613e+04 n_pcs=4500 (pc_topk) weight_search=on
2026-06-01 01:21:28 | INFO | src.nested_cv_avggrm_weighted_unified | Trial 187 | outer=7 | weight={'name': 'exponential', 'floor': 1e-06, 'clip_max': 20.0, 'beta': 7.051912223632591}
[I 2026-06-01 01:21:35,545] Trial 187 finished with value: 0.22735355131730378 and parameters: {'alpha': 66133.96800121016, 'n_pcs': 4500, 'weight_scheme': 'exponential', 'weight_clip_max': 20.0, 'weight_exponential_beta': 7.051912223632591}. Best is trial 86 with value: 0.22876955329088525.
2026-06-01 01:21:35 | INFO | src.nested_cv_avggrm_weighted_unified | Trial 188 | outer=7 | alpha=3.130e+04 n_pcs=5000 (pc_topk) weight_search=on
2026-06-01 01:21:35 | INFO | src.nested_cv_avggrm_weighted_unified | Trial 188 | outer=7 | weight={'name': 'linear', 'floor': 1e-06, 'clip_max': 20.0, 'min_weight': 0.3264460424640108, 'max_weight': 4.071010218484926}
[I 2026-06-01 01:21:43,519] Trial 188 finished with value: 0.22572123761352247 and parameters: {'alpha': 31297.134074514346, 'n_pcs': 5000, 'weight_scheme': 'linear', 'weight_clip_max': 20.0, 'weight_linear_min_weight': 0.3264460424640108, 'weight_linear_max_weight': 4.071010218484926}. Best is trial 86 with value: 0.22876955329088525.
2026-06-01 01:21:43 | INFO | src.nested_cv_avggrm_weighted_unified | Trial 189 | outer=7 | alpha=4.936e+04 n_pcs=4500 (pc_topk) weight_search=on
2026-06-01 01:21:43 | INFO | src.nested_cv_avggrm_weighted_unified | Trial 189 | outer=7 | weight={'name': 'linear', 'floor': 1e-06, 'clip_max': 10.0, 'min_weight': 0.36713704452149953, 'max_weight': 3.9496116694509573}
[I 2026-06-01 01:21:50,287] Trial 189 finished with value: 0.22868197076797553 and parameters: {'alpha': 49364.978860193405, 'n_pcs': 4500, 'weight_scheme': 'linear', 'weight_clip_max': 10.0, 'weight_linear_min_weight': 0.36713704452149953, 'weight_linear_max_weight': 3.9496116694509573}. Best is trial 86 with value: 0.22876955329088525.
2026-06-01 01:21:50 | INFO | src.nested_cv_avggrm_weighted_unified | Trial 190 | outer=7 | alpha=4.206e+04 n_pcs=4500 (pc_topk) weight_search=on
2026-06-01 01:21:50 | INFO | src.nested_cv_avggrm_weighted_unified | Trial 190 | outer=7 | weight={'name': 'linear', 'floor': 1e-06, 'clip_max': 10.0, 'min_weight': 0.3724201110263632, 'max_weight': 3.9195691588377874}
[I 2026-06-01 01:21:57,100] Trial 190 finished with value: 0.22860034770660814 and parameters: {'alpha': 42064.567296215464, 'n_pcs': 4500, 'weight_scheme': 'linear', 'weight_clip_max': 10.0, 'weight_linear_min_weight': 0.3724201110263632, 'weight_linear_max_weight': 3.9195691588377874}. Best is trial 86 with value: 0.22876955329088525.
2026-06-01 01:21:57 | INFO | src.nested_cv_avggrm_weighted_unified | Trial 191 | outer=7 | alpha=5.205e+04 n_pcs=4500 (pc_topk) weight_search=on
2026-06-01 01:21:57 | INFO | src.nested_cv_avggrm_weighted_unified | Trial 191 | outer=7 | weight={'name': 'linear', 'floor': 1e-06, 'clip_max': 10.0, 'min_weight': 0.4373500903457928, 'max_weight': 3.85954242918515}
[I 2026-06-01 01:22:03,879] Trial 191 finished with value: 0.2285108286913453 and parameters: {'alpha': 52045.95084912254, 'n_pcs': 4500, 'weight_scheme': 'linear', 'weight_clip_max': 10.0, 'weight_linear_min_weight': 0.4373500903457928, 'weight_linear_max_weight': 3.85954242918515}. Best is trial 86 with value: 0.22876955329088525.
2026-06-01 01:22:03 | INFO | src.nested_cv_avggrm_weighted_unified | Trial 192 | outer=7 | alpha=6.395e+04 n_pcs=4500 (pc_topk) weight_search=on
2026-06-01 01:22:03 | INFO | src.nested_cv_avggrm_weighted_unified | Trial 192 | outer=7 | weight={'name': 'linear', 'floor': 1e-06, 'clip_max': 10.0, 'min_weight': 0.4049794040181243, 'max_weight': 4.5835308097028875}
[I 2026-06-01 01:22:10,687] Trial 192 finished with value: 0.2283347525083234 and parameters: {'alpha': 63953.659765884404, 'n_pcs': 4500, 'weight_scheme': 'linear', 'weight_clip_max': 10.0, 'weight_linear_min_weight': 0.4049794040181243, 'weight_linear_max_weight': 4.5835308097028875}. Best is trial 86 with value: 0.22876955329088525.
2026-06-01 01:22:10 | INFO | src.nested_cv_avggrm_weighted_unified | Trial 193 | outer=7 | alpha=4.815e+04 n_pcs=4500 (pc_topk) weight_search=on
2026-06-01 01:22:10 | INFO | src.nested_cv_avggrm_weighted_unified | Trial 193 | outer=7 | weight={'name': 'linear', 'floor': 1e-06, 'clip_max': 20.0, 'min_weight': 0.33136243514161307, 'max_weight': 4.017647830485739}
[I 2026-06-01 01:22:17,468] Trial 193 finished with value: 0.22873014119589805 and parameters: {'alpha': 48152.22321660214, 'n_pcs': 4500, 'weight_scheme': 'linear', 'weight_clip_max': 20.0, 'weight_linear_min_weight': 0.33136243514161307, 'weight_linear_max_weight': 4.017647830485739}. Best is trial 86 with value: 0.22876955329088525.
2026-06-01 01:22:17 | INFO | src.nested_cv_avggrm_weighted_unified | Trial 194 | outer=7 | alpha=3.713e+04 n_pcs=4500 (pc_topk) weight_search=on
2026-06-01 01:22:17 | INFO | src.nested_cv_avggrm_weighted_unified | Trial 194 | outer=7 | weight={'name': 'linear', 'floor': 1e-06, 'clip_max': 10.0, 'min_weight': 0.3573229990525237, 'max_weight': 3.9435938691507513}
[I 2026-06-01 01:22:24,217] Trial 194 finished with value: 0.22836877792304952 and parameters: {'alpha': 37131.04809503053, 'n_pcs': 4500, 'weight_scheme': 'linear', 'weight_clip_max': 10.0, 'weight_linear_min_weight': 0.3573229990525237, 'weight_linear_max_weight': 3.9435938691507513}. Best is trial 86 with value: 0.22876955329088525.
2026-06-01 01:22:24 | INFO | src.nested_cv_avggrm_weighted_unified | Trial 195 | outer=7 | alpha=4.496e+04 n_pcs=4500 (pc_topk) weight_search=on
2026-06-01 01:22:24 | INFO | src.nested_cv_avggrm_weighted_unified | Trial 195 | outer=7 | weight={'name': 'linear', 'floor': 1e-06, 'clip_max': 20.0, 'min_weight': 0.3320542514358683, 'max_weight': 4.005043865795905}
[I 2026-06-01 01:22:30,990] Trial 195 finished with value: 0.22870066478102138 and parameters: {'alpha': 44964.528790083765, 'n_pcs': 4500, 'weight_scheme': 'linear', 'weight_clip_max': 20.0, 'weight_linear_min_weight': 0.3320542514358683, 'weight_linear_max_weight': 4.005043865795905}. Best is trial 86 with value: 0.22876955329088525.
2026-06-01 01:22:30 | INFO | src.nested_cv_avggrm_weighted_unified | Trial 196 | outer=7 | alpha=2.813e+04 n_pcs=5000 (pc_topk) weight_search=on
2026-06-01 01:22:31 | INFO | src.nested_cv_avggrm_weighted_unified | Trial 196 | outer=7 | weight={'name': 'linear', 'floor': 1e-06, 'clip_max': 20.0, 'min_weight': 0.33920984996024794, 'max_weight': 4.087037171527554}
[I 2026-06-01 01:22:39,002] Trial 196 finished with value: 0.2251731112812307 and parameters: {'alpha': 28126.07114552472, 'n_pcs': 5000, 'weight_scheme': 'linear', 'weight_clip_max': 20.0, 'weight_linear_min_weight': 0.33920984996024794, 'weight_linear_max_weight': 4.087037171527554}. Best is trial 86 with value: 0.22876955329088525.
2026-06-01 01:22:39 | INFO | src.nested_cv_avggrm_weighted_unified | Trial 197 | outer=7 | alpha=4.636e+04 n_pcs=4500 (pc_topk) weight_search=on
2026-06-01 01:22:39 | INFO | src.nested_cv_avggrm_weighted_unified | Trial 197 | outer=7 | weight={'name': 'linear', 'floor': 1e-06, 'clip_max': 20.0, 'min_weight': 0.3821920861659801, 'max_weight': 4.354963596477913}
[I 2026-06-01 01:22:45,790] Trial 197 finished with value: 0.22870284347751096 and parameters: {'alpha': 46364.4433629993, 'n_pcs': 4500, 'weight_scheme': 'linear', 'weight_clip_max': 20.0, 'weight_linear_min_weight': 0.3821920861659801, 'weight_linear_max_weight': 4.354963596477913}. Best is trial 86 with value: 0.22876955329088525.
2026-06-01 01:22:45 | INFO | src.nested_cv_avggrm_weighted_unified | Trial 198 | outer=7 | alpha=1.220e+06 n_pcs=4500 (pc_topk) weight_search=on
2026-06-01 01:22:45 | INFO | src.nested_cv_avggrm_weighted_unified | Trial 198 | outer=7 | weight={'name': 'linear', 'floor': 1e-06, 'clip_max': 20.0, 'min_weight': 0.30841404858482735, 'max_weight': 4.429493706344568}
[I 2026-06-01 01:22:52,516] Trial 198 finished with value: 0.2058892050687159 and parameters: {'alpha': 1220291.096309943, 'n_pcs': 4500, 'weight_scheme': 'linear', 'weight_clip_max': 20.0, 'weight_linear_min_weight': 0.30841404858482735, 'weight_linear_max_weight': 4.429493706344568}. Best is trial 86 with value: 0.22876955329088525.
2026-06-01 01:22:52 | INFO | src.nested_cv_avggrm_weighted_unified | Trial 199 | outer=7 | alpha=4.876e+04 n_pcs=4500 (pc_topk) weight_search=on
2026-06-01 01:22:52 | INFO | src.nested_cv_avggrm_weighted_unified | Trial 199 | outer=7 | weight={'name': 'linear', 'floor': 1e-06, 'clip_max': 10.0, 'min_weight': 0.28336687283287826, 'max_weight': 4.0036977582279185}
[I 2026-06-01 01:22:59,314] Trial 199 finished with value: 0.22876342455233045 and parameters: {'alpha': 48756.84546758791, 'n_pcs': 4500, 'weight_scheme': 'linear', 'weight_clip_max': 10.0, 'weight_linear_min_weight': 0.28336687283287826, 'weight_linear_max_weight': 4.0036977582279185}. Best is trial 86 with value: 0.22876955329088525.
2026-06-01 01:22:59 | INFO | src.nested_cv_avggrm_weighted_unified | Trial 200 | outer=7 | alpha=3.485e+04 n_pcs=4500 (pc_topk) weight_search=on
2026-06-01 01:22:59 | INFO | src.nested_cv_avggrm_weighted_unified | Trial 200 | outer=7 | weight={'name': 'linear', 'floor': 1e-06, 'clip_max': 10.0, 'min_weight': 0.35087795043701, 'max_weight': 4.0342079832586135}
[I 2026-06-01 01:23:06,163] Trial 200 finished with value: 0.22818102048294425 and parameters: {'alpha': 34853.279047498225, 'n_pcs': 4500, 'weight_scheme': 'linear', 'weight_clip_max': 10.0, 'weight_linear_min_weight': 0.35087795043701, 'weight_linear_max_weight': 4.0342079832586135}. Best is trial 86 with value: 0.22876955329088525.
2026-06-01 01:23:06 | INFO | src.nested_cv_avggrm_weighted_unified | Trial 201 | outer=7 | alpha=5.092e+04 n_pcs=4500 (pc_topk) weight_search=on
2026-06-01 01:23:06 | INFO | src.nested_cv_avggrm_weighted_unified | Trial 201 | outer=7 | weight={'name': 'linear', 'floor': 1e-06, 'clip_max': 10.0, 'min_weight': 0.29310567557751704, 'max_weight': 4.17218191164557}
[I 2026-06-01 01:23:12,965] Trial 201 finished with value: 0.2287623414821701 and parameters: {'alpha': 50919.61726260532, 'n_pcs': 4500, 'weight_scheme': 'linear', 'weight_clip_max': 10.0, 'weight_linear_min_weight': 0.29310567557751704, 'weight_linear_max_weight': 4.17218191164557}. Best is trial 86 with value: 0.22876955329088525.
2026-06-01 01:23:12 | INFO | src.nested_cv_avggrm_weighted_unified | Trial 202 | outer=7 | alpha=5.090e+04 n_pcs=4500 (pc_topk) weight_search=on
2026-06-01 01:23:12 | INFO | src.nested_cv_avggrm_weighted_unified | Trial 202 | outer=7 | weight={'name': 'linear', 'floor': 1e-06, 'clip_max': 10.0, 'min_weight': 0.2871207440556594, 'max_weight': 4.164125232604105}
[I 2026-06-01 01:23:19,742] Trial 202 finished with value: 0.22876562858066357 and parameters: {'alpha': 50900.68447550507, 'n_pcs': 4500, 'weight_scheme': 'linear', 'weight_clip_max': 10.0, 'weight_linear_min_weight': 0.2871207440556594, 'weight_linear_max_weight': 4.164125232604105}. Best is trial 86 with value: 0.22876955329088525.
2026-06-01 01:23:19 | INFO | src.nested_cv_avggrm_weighted_unified | Trial 203 | outer=7 | alpha=4.798e+04 n_pcs=4500 (pc_topk) weight_search=on
2026-06-01 01:23:19 | INFO | src.nested_cv_avggrm_weighted_unified | Trial 203 | outer=7 | weight={'name': 'linear', 'floor': 1e-06, 'clip_max': 10.0, 'min_weight': 0.2805550495532832, 'max_weight': 4.152060563941678}
[I 2026-06-01 01:23:26,514] Trial 203 finished with value: 0.22876440572468731 and parameters: {'alpha': 47976.01986356044, 'n_pcs': 4500, 'weight_scheme': 'linear', 'weight_clip_max': 10.0, 'weight_linear_min_weight': 0.2805550495532832, 'weight_linear_max_weight': 4.152060563941678}. Best is trial 86 with value: 0.22876955329088525.
2026-06-01 01:23:26 | INFO | src.nested_cv_avggrm_weighted_unified | Trial 204 | outer=7 | alpha=4.684e+04 n_pcs=4500 (pc_topk) weight_search=on
2026-06-01 01:23:26 | INFO | src.nested_cv_avggrm_weighted_unified | Trial 204 | outer=7 | weight={'name': 'linear', 'floor': 1e-06, 'clip_max': 10.0, 'min_weight': 0.27686534818208564, 'max_weight': 4.151070323998855}
[I 2026-06-01 01:23:33,304] Trial 204 finished with value: 0.22875376423577415 and parameters: {'alpha': 46837.41118709679, 'n_pcs': 4500, 'weight_scheme': 'linear', 'weight_clip_max': 10.0, 'weight_linear_min_weight': 0.27686534818208564, 'weight_linear_max_weight': 4.151070323998855}. Best is trial 86 with value: 0.22876955329088525.
2026-06-01 01:23:33 | INFO | src.nested_cv_avggrm_weighted_unified | Trial 205 | outer=7 | alpha=4.092e+04 n_pcs=4500 (pc_topk) weight_search=on
2026-06-01 01:23:33 | INFO | src.nested_cv_avggrm_weighted_unified | Trial 205 | outer=7 | weight={'name': 'linear', 'floor': 1e-06, 'clip_max': 10.0, 'min_weight': 0.27860479207438216, 'max_weight': 4.1543683625163075}
[I 2026-06-01 01:23:40,110] Trial 205 finished with value: 0.22858443496363962 and parameters: {'alpha': 40915.91991006473, 'n_pcs': 4500, 'weight_scheme': 'linear', 'weight_clip_max': 10.0, 'weight_linear_min_weight': 0.27860479207438216, 'weight_linear_max_weight': 4.1543683625163075}. Best is trial 86 with value: 0.22876955329088525.
2026-06-01 01:23:40 | INFO | src.nested_cv_avggrm_weighted_unified | Trial 206 | outer=7 | alpha=3.215e+04 n_pcs=4500 (pc_topk) weight_search=on
2026-06-01 01:23:40 | INFO | src.nested_cv_avggrm_weighted_unified | Trial 206 | outer=7 | weight={'name': 'linear', 'floor': 1e-06, 'clip_max': 10.0, 'min_weight': 0.25295103844962147, 'max_weight': 4.161430235305248}
[I 2026-06-01 01:23:46,884] Trial 206 finished with value: 0.22778242489299858 and parameters: {'alpha': 32147.994903715527, 'n_pcs': 4500, 'weight_scheme': 'linear', 'weight_clip_max': 10.0, 'weight_linear_min_weight': 0.25295103844962147, 'weight_linear_max_weight': 4.161430235305248}. Best is trial 86 with value: 0.22876955329088525.
2026-06-01 01:23:46 | INFO | src.nested_cv_avggrm_weighted_unified | Trial 207 | outer=7 | alpha=1.155e+03 n_pcs=4500 (pc_topk) weight_search=on
2026-06-01 01:23:46 | INFO | src.nested_cv_avggrm_weighted_unified | Trial 207 | outer=7 | weight={'name': 'linear', 'floor': 1e-06, 'clip_max': 10.0, 'min_weight': 0.28873632853617726, 'max_weight': 4.025568893302248}
2026-06-01 01:23:50 | INFO | src.nested_cv_avggrm_weighted_unified | Trial 207 | outer=7 | pruned after 5/10 inner folds (mean r=0.1765)
[I 2026-06-01 01:23:50,296] Trial 207 pruned. 
2026-06-01 01:23:50 | INFO | src.nested_cv_avggrm_weighted_unified | Trial 208 | outer=7 | alpha=4.642e+04 n_pcs=5000 (pc_topk) weight_search=on
2026-06-01 01:23:50 | INFO | src.nested_cv_avggrm_weighted_unified | Trial 208 | outer=7 | weight={'name': 'linear', 'floor': 1e-06, 'clip_max': 10.0, 'min_weight': 0.2682704426786563, 'max_weight': 4.103294498436975}
