[I 2026-06-01 01:46:09,208] Trial 137 pruned. 
2026-06-01 01:46:09 | INFO | src.nested_cv_avggrm_weighted_unified | Trial 138 | outer=8 | alpha=4.686e+06 n_pcs=3500 (pc_topk) weight_search=on
2026-06-01 01:46:09 | INFO | src.nested_cv_avggrm_weighted_unified | Trial 138 | outer=8 | weight={'name': 'exponential', 'floor': 1e-06, 'clip_max': 5.0, 'beta': 5.667492283394484}
2026-06-01 01:46:12 | INFO | src.nested_cv_avggrm_weighted_unified | Trial 138 | outer=8 | pruned after 7/10 inner folds (mean r=0.2403)
[I 2026-06-01 01:46:12,713] Trial 138 pruned. 
2026-06-01 01:46:12 | INFO | src.nested_cv_avggrm_weighted_unified | Trial 139 | outer=8 | alpha=8.595e+04 n_pcs=4500 (pc_topk) weight_search=on
2026-06-01 01:46:12 | INFO | src.nested_cv_avggrm_weighted_unified | Trial 139 | outer=8 | weight={'name': 'uniform', 'floor': 1e-06, 'clip_max': 5.0}
[I 2026-06-01 01:46:18,760] Trial 139 finished with value: 0.21049379142556948 and parameters: {'alpha': 85945.92208291331, 'n_pcs': 4500, 'weight_scheme': 'uniform', 'weight_clip_max': 5.0}. Best is trial 67 with value: 0.22356194409955688.
2026-06-01 01:46:18 | INFO | src.nested_cv_avggrm_weighted_unified | Trial 140 | outer=8 | alpha=3.092e+05 n_pcs=4000 (pc_topk) weight_search=on
2026-06-01 01:46:18 | INFO | src.nested_cv_avggrm_weighted_unified | Trial 140 | outer=8 | weight={'name': 'exponential', 'floor': 1e-06, 'clip_max': 5.0, 'beta': 6.539924621330643}
[I 2026-06-01 01:46:24,442] Trial 140 finished with value: 0.22266040180874885 and parameters: {'alpha': 309197.4661333462, 'n_pcs': 4000, 'weight_scheme': 'exponential', 'weight_clip_max': 5.0, 'weight_exponential_beta': 6.539924621330643}. Best is trial 67 with value: 0.22356194409955688.
2026-06-01 01:46:24 | INFO | src.nested_cv_avggrm_weighted_unified | Trial 141 | outer=8 | alpha=1.539e+05 n_pcs=4000 (pc_topk) weight_search=on
2026-06-01 01:46:24 | INFO | src.nested_cv_avggrm_weighted_unified | Trial 141 | outer=8 | weight={'name': 'exponential', 'floor': 1e-06, 'clip_max': 5.0, 'beta': 5.922155206022701}
[I 2026-06-01 01:46:30,222] Trial 141 finished with value: 0.22298163536133891 and parameters: {'alpha': 153859.94725091985, 'n_pcs': 4000, 'weight_scheme': 'exponential', 'weight_clip_max': 5.0, 'weight_exponential_beta': 5.922155206022701}. Best is trial 67 with value: 0.22356194409955688.
2026-06-01 01:46:30 | INFO | src.nested_cv_avggrm_weighted_unified | Trial 142 | outer=8 | alpha=1.204e+05 n_pcs=4000 (pc_topk) weight_search=on
2026-06-01 01:46:30 | INFO | src.nested_cv_avggrm_weighted_unified | Trial 142 | outer=8 | weight={'name': 'exponential', 'floor': 1e-06, 'clip_max': 5.0, 'beta': 6.842181759299893}
[I 2026-06-01 01:46:35,911] Trial 142 finished with value: 0.22189929334990585 and parameters: {'alpha': 120394.04781645427, 'n_pcs': 4000, 'weight_scheme': 'exponential', 'weight_clip_max': 5.0, 'weight_exponential_beta': 6.842181759299893}. Best is trial 67 with value: 0.22356194409955688.
2026-06-01 01:46:35 | INFO | src.nested_cv_avggrm_weighted_unified | Trial 143 | outer=8 | alpha=1.619e+05 n_pcs=4000 (pc_topk) weight_search=on
2026-06-01 01:46:35 | INFO | src.nested_cv_avggrm_weighted_unified | Trial 143 | outer=8 | weight={'name': 'exponential', 'floor': 1e-06, 'clip_max': 5.0, 'beta': 5.836822520779028}
[I 2026-06-01 01:46:41,601] Trial 143 finished with value: 0.22302372594430805 and parameters: {'alpha': 161910.15007507263, 'n_pcs': 4000, 'weight_scheme': 'exponential', 'weight_clip_max': 5.0, 'weight_exponential_beta': 5.836822520779028}. Best is trial 67 with value: 0.22356194409955688.
2026-06-01 01:46:41 | INFO | src.nested_cv_avggrm_weighted_unified | Trial 144 | outer=8 | alpha=1.675e+05 n_pcs=1000 (pc_topk) weight_search=on
2026-06-01 01:46:41 | INFO | src.nested_cv_avggrm_weighted_unified | Trial 144 | outer=8 | weight={'name': 'exponential', 'floor': 1e-06, 'clip_max': 5.0, 'beta': 5.453050787366399}
[I 2026-06-01 01:46:43,142] Trial 144 finished with value: 0.2157702443156529 and parameters: {'alpha': 167520.61702672925, 'n_pcs': 1000, 'weight_scheme': 'exponential', 'weight_clip_max': 5.0, 'weight_exponential_beta': 5.453050787366399}. Best is trial 67 with value: 0.22356194409955688.
2026-06-01 01:46:43 | INFO | src.nested_cv_avggrm_weighted_unified | Trial 145 | outer=8 | alpha=2.085e+05 n_pcs=4000 (pc_topk) weight_search=on
2026-06-01 01:46:43 | INFO | src.nested_cv_avggrm_weighted_unified | Trial 145 | outer=8 | weight={'name': 'exponential', 'floor': 1e-06, 'clip_max': 5.0, 'beta': 5.857911107132464}
[I 2026-06-01 01:46:49,152] Trial 145 finished with value: 0.22303269373729595 and parameters: {'alpha': 208520.92213524063, 'n_pcs': 4000, 'weight_scheme': 'exponential', 'weight_clip_max': 5.0, 'weight_exponential_beta': 5.857911107132464}. Best is trial 67 with value: 0.22356194409955688.
2026-06-01 01:46:49 | INFO | src.nested_cv_avggrm_weighted_unified | Trial 146 | outer=8 | alpha=2.182e+05 n_pcs=4000 (pc_topk) weight_search=on
2026-06-01 01:46:49 | INFO | src.nested_cv_avggrm_weighted_unified | Trial 146 | outer=8 | weight={'name': 'exponential', 'floor': 1e-06, 'clip_max': 5.0, 'beta': 5.11043064052}
[I 2026-06-01 01:46:54,830] Trial 146 finished with value: 0.2228279999233039 and parameters: {'alpha': 218233.02190194812, 'n_pcs': 4000, 'weight_scheme': 'exponential', 'weight_clip_max': 5.0, 'weight_exponential_beta': 5.11043064052}. Best is trial 67 with value: 0.22356194409955688.
2026-06-01 01:46:54 | INFO | src.nested_cv_avggrm_weighted_unified | Trial 147 | outer=8 | alpha=1.391e+05 n_pcs=4000 (pc_topk) weight_search=on
2026-06-01 01:46:54 | INFO | src.nested_cv_avggrm_weighted_unified | Trial 147 | outer=8 | weight={'name': 'linear', 'floor': 1e-06, 'clip_max': 5.0, 'min_weight': 0.5192066646357982, 'max_weight': 4.354188817026887}
[I 2026-06-01 01:47:00,611] Trial 147 finished with value: 0.2186830494974142 and parameters: {'alpha': 139079.61884776124, 'n_pcs': 4000, 'weight_scheme': 'linear', 'weight_clip_max': 5.0, 'weight_linear_min_weight': 0.5192066646357982, 'weight_linear_max_weight': 4.354188817026887}. Best is trial 67 with value: 0.22356194409955688.
2026-06-01 01:47:00 | INFO | src.nested_cv_avggrm_weighted_unified | Trial 148 | outer=8 | alpha=1.133e+05 n_pcs=4000 (pc_topk) weight_search=on
2026-06-01 01:47:00 | INFO | src.nested_cv_avggrm_weighted_unified | Trial 148 | outer=8 | weight={'name': 'exponential', 'floor': 1e-06, 'clip_max': 5.0, 'beta': 5.750859281875991}
[I 2026-06-01 01:47:06,458] Trial 148 finished with value: 0.22256106205172457 and parameters: {'alpha': 113270.61408764674, 'n_pcs': 4000, 'weight_scheme': 'exponential', 'weight_clip_max': 5.0, 'weight_exponential_beta': 5.750859281875991}. Best is trial 67 with value: 0.22356194409955688.
2026-06-01 01:47:06 | INFO | src.nested_cv_avggrm_weighted_unified | Trial 149 | outer=8 | alpha=2.043e+05 n_pcs=3500 (pc_topk) weight_search=on
2026-06-01 01:47:06 | INFO | src.nested_cv_avggrm_weighted_unified | Trial 149 | outer=8 | weight={'name': 'exponential', 'floor': 1e-06, 'clip_max': 5.0, 'beta': 4.866766396872871}
[I 2026-06-01 01:47:11,291] Trial 149 finished with value: 0.22186524777696812 and parameters: {'alpha': 204338.24226459122, 'n_pcs': 3500, 'weight_scheme': 'exponential', 'weight_clip_max': 5.0, 'weight_exponential_beta': 4.866766396872871}. Best is trial 67 with value: 0.22356194409955688.
2026-06-01 01:47:11 | INFO | src.nested_cv_avggrm_weighted_unified | Trial 150 | outer=8 | alpha=7.393e+04 n_pcs=4000 (pc_topk) weight_search=on
2026-06-01 01:47:11 | INFO | src.nested_cv_avggrm_weighted_unified | Trial 150 | outer=8 | weight={'name': 'exponential', 'floor': 1e-06, 'clip_max': 5.0, 'beta': 5.91940187618107}
[I 2026-06-01 01:47:17,114] Trial 150 finished with value: 0.22102806555909052 and parameters: {'alpha': 73931.25546128943, 'n_pcs': 4000, 'weight_scheme': 'exponential', 'weight_clip_max': 5.0, 'weight_exponential_beta': 5.91940187618107}. Best is trial 67 with value: 0.22356194409955688.
2026-06-01 01:47:17 | INFO | src.nested_cv_avggrm_weighted_unified | Trial 151 | outer=8 | alpha=1.654e+05 n_pcs=4000 (pc_topk) weight_search=on
2026-06-01 01:47:17 | INFO | src.nested_cv_avggrm_weighted_unified | Trial 151 | outer=8 | weight={'name': 'exponential', 'floor': 1e-06, 'clip_max': 5.0, 'beta': 6.206978765677825}
[I 2026-06-01 01:47:22,783] Trial 151 finished with value: 0.2229506822857291 and parameters: {'alpha': 165424.69699416903, 'n_pcs': 4000, 'weight_scheme': 'exponential', 'weight_clip_max': 5.0, 'weight_exponential_beta': 6.206978765677825}. Best is trial 67 with value: 0.22356194409955688.
2026-06-01 01:47:22 | INFO | src.nested_cv_avggrm_weighted_unified | Trial 152 | outer=8 | alpha=1.480e+05 n_pcs=4000 (pc_topk) weight_search=on
2026-06-01 01:47:22 | INFO | src.nested_cv_avggrm_weighted_unified | Trial 152 | outer=8 | weight={'name': 'exponential', 'floor': 1e-06, 'clip_max': 5.0, 'beta': 6.195813632441163}
[I 2026-06-01 01:47:28,514] Trial 152 finished with value: 0.22282868597985428 and parameters: {'alpha': 147997.53888109844, 'n_pcs': 4000, 'weight_scheme': 'exponential', 'weight_clip_max': 5.0, 'weight_exponential_beta': 6.195813632441163}. Best is trial 67 with value: 0.22356194409955688.
2026-06-01 01:47:28 | INFO | src.nested_cv_avggrm_weighted_unified | Trial 153 | outer=8 | alpha=1.605e+05 n_pcs=4000 (pc_topk) weight_search=on
2026-06-01 01:47:28 | INFO | src.nested_cv_avggrm_weighted_unified | Trial 153 | outer=8 | weight={'name': 'exponential', 'floor': 1e-06, 'clip_max': 5.0, 'beta': 5.537485488814448}
[I 2026-06-01 01:47:34,624] Trial 153 finished with value: 0.22307072741259287 and parameters: {'alpha': 160487.78062328574, 'n_pcs': 4000, 'weight_scheme': 'exponential', 'weight_clip_max': 5.0, 'weight_exponential_beta': 5.537485488814448}. Best is trial 67 with value: 0.22356194409955688.
2026-06-01 01:47:34 | INFO | src.nested_cv_avggrm_weighted_unified | Trial 154 | outer=8 | alpha=2.161e+05 n_pcs=4000 (pc_topk) weight_search=on
2026-06-01 01:47:34 | INFO | src.nested_cv_avggrm_weighted_unified | Trial 154 | outer=8 | weight={'name': 'exponential', 'floor': 1e-06, 'clip_max': 5.0, 'beta': 5.298801006444112}
[I 2026-06-01 01:47:40,302] Trial 154 finished with value: 0.2229244380935333 and parameters: {'alpha': 216053.08984629426, 'n_pcs': 4000, 'weight_scheme': 'exponential', 'weight_clip_max': 5.0, 'weight_exponential_beta': 5.298801006444112}. Best is trial 67 with value: 0.22356194409955688.
2026-06-01 01:47:40 | INFO | src.nested_cv_avggrm_weighted_unified | Trial 155 | outer=8 | alpha=2.740e+05 n_pcs=4000 (pc_topk) weight_search=on
2026-06-01 01:47:40 | INFO | src.nested_cv_avggrm_weighted_unified | Trial 155 | outer=8 | weight={'name': 'exponential', 'floor': 1e-06, 'clip_max': 5.0, 'beta': 5.5901222997968505}
[I 2026-06-01 01:47:46,111] Trial 155 finished with value: 0.22259548647331268 and parameters: {'alpha': 274046.34246663173, 'n_pcs': 4000, 'weight_scheme': 'exponential', 'weight_clip_max': 5.0, 'weight_exponential_beta': 5.5901222997968505}. Best is trial 67 with value: 0.22356194409955688.
2026-06-01 01:47:46 | INFO | src.nested_cv_avggrm_weighted_unified | Trial 156 | outer=8 | alpha=1.012e+05 n_pcs=4500 (pc_topk) weight_search=on
2026-06-01 01:47:46 | INFO | src.nested_cv_avggrm_weighted_unified | Trial 156 | outer=8 | weight={'name': 'exponential', 'floor': 1e-06, 'clip_max': None, 'beta': 5.856743567668733}
[I 2026-06-01 01:47:53,121] Trial 156 finished with value: 0.2117976436669471 and parameters: {'alpha': 101236.37788437982, 'n_pcs': 4500, 'weight_scheme': 'exponential', 'weight_clip_max': None, 'weight_exponential_beta': 5.856743567668733}. Best is trial 67 with value: 0.22356194409955688.
2026-06-01 01:47:53 | INFO | src.nested_cv_avggrm_weighted_unified | Trial 157 | outer=8 | alpha=1.296e+05 n_pcs=4000 (pc_topk) weight_search=on
2026-06-01 01:47:53 | INFO | src.nested_cv_avggrm_weighted_unified | Trial 157 | outer=8 | weight={'name': 'exponential', 'floor': 1e-06, 'clip_max': 5.0, 'beta': 5.410521058900258}
[I 2026-06-01 01:47:59,045] Trial 157 finished with value: 0.2229744501960464 and parameters: {'alpha': 129571.21328681282, 'n_pcs': 4000, 'weight_scheme': 'exponential', 'weight_clip_max': 5.0, 'weight_exponential_beta': 5.410521058900258}. Best is trial 67 with value: 0.22356194409955688.
2026-06-01 01:47:59 | INFO | src.nested_cv_avggrm_weighted_unified | Trial 158 | outer=8 | alpha=1.805e+05 n_pcs=4000 (pc_topk) weight_search=on
2026-06-01 01:47:59 | INFO | src.nested_cv_avggrm_weighted_unified | Trial 158 | outer=8 | weight={'name': 'exponential', 'floor': 1e-06, 'clip_max': 5.0, 'beta': 5.23960671803926}
[I 2026-06-01 01:48:04,919] Trial 158 finished with value: 0.22308867227738616 and parameters: {'alpha': 180545.23755842965, 'n_pcs': 4000, 'weight_scheme': 'exponential', 'weight_clip_max': 5.0, 'weight_exponential_beta': 5.23960671803926}. Best is trial 67 with value: 0.22356194409955688.
2026-06-01 01:48:04 | INFO | src.nested_cv_avggrm_weighted_unified | Trial 159 | outer=8 | alpha=2.285e+05 n_pcs=4500 (pc_topk) weight_search=on
2026-06-01 01:48:04 | INFO | src.nested_cv_avggrm_weighted_unified | Trial 159 | outer=8 | weight={'name': 'exponential', 'floor': 1e-06, 'clip_max': 5.0, 'beta': 4.660752640734295}
[I 2026-06-01 01:48:11,754] Trial 159 finished with value: 0.22159596183301372 and parameters: {'alpha': 228451.2630485285, 'n_pcs': 4500, 'weight_scheme': 'exponential', 'weight_clip_max': 5.0, 'weight_exponential_beta': 4.660752640734295}. Best is trial 67 with value: 0.22356194409955688.
2026-06-01 01:48:11 | INFO | src.nested_cv_avggrm_weighted_unified | Trial 160 | outer=8 | alpha=1.524e+05 n_pcs=4000 (pc_topk) weight_search=on
2026-06-01 01:48:11 | INFO | src.nested_cv_avggrm_weighted_unified | Trial 160 | outer=8 | weight={'name': 'exponential', 'floor': 1e-06, 'clip_max': 5.0, 'beta': 5.215197928590008}
[I 2026-06-01 01:48:17,779] Trial 160 finished with value: 0.2231278016738917 and parameters: {'alpha': 152408.68883018335, 'n_pcs': 4000, 'weight_scheme': 'exponential', 'weight_clip_max': 5.0, 'weight_exponential_beta': 5.215197928590008}. Best is trial 67 with value: 0.22356194409955688.
2026-06-01 01:48:17 | INFO | src.nested_cv_avggrm_weighted_unified | Trial 161 | outer=8 | alpha=1.241e+05 n_pcs=4000 (pc_topk) weight_search=on
2026-06-01 01:48:17 | INFO | src.nested_cv_avggrm_weighted_unified | Trial 161 | outer=8 | weight={'name': 'exponential', 'floor': 1e-06, 'clip_max': 5.0, 'beta': 5.2294525025695195}
[I 2026-06-01 01:48:23,609] Trial 161 finished with value: 0.22300216833422487 and parameters: {'alpha': 124100.40382861096, 'n_pcs': 4000, 'weight_scheme': 'exponential', 'weight_clip_max': 5.0, 'weight_exponential_beta': 5.2294525025695195}. Best is trial 67 with value: 0.22356194409955688.
2026-06-01 01:48:23 | INFO | src.nested_cv_avggrm_weighted_unified | Trial 162 | outer=8 | alpha=1.293e+05 n_pcs=4000 (pc_topk) weight_search=on
2026-06-01 01:48:23 | INFO | src.nested_cv_avggrm_weighted_unified | Trial 162 | outer=8 | weight={'name': 'exponential', 'floor': 1e-06, 'clip_max': 5.0, 'beta': 5.119790431294715}
[I 2026-06-01 01:48:29,354] Trial 162 finished with value: 0.22304408026843991 and parameters: {'alpha': 129311.0429788932, 'n_pcs': 4000, 'weight_scheme': 'exponential', 'weight_clip_max': 5.0, 'weight_exponential_beta': 5.119790431294715}. Best is trial 67 with value: 0.22356194409955688.
2026-06-01 01:48:29 | INFO | src.nested_cv_avggrm_weighted_unified | Trial 163 | outer=8 | alpha=6.044e+04 n_pcs=4000 (pc_topk) weight_search=on
2026-06-01 01:48:29 | INFO | src.nested_cv_avggrm_weighted_unified | Trial 163 | outer=8 | weight={'name': 'exponential', 'floor': 1e-06, 'clip_max': 5.0, 'beta': 5.240201647852465}
[I 2026-06-01 01:48:35,019] Trial 163 finished with value: 0.22086419650798997 and parameters: {'alpha': 60442.291865138366, 'n_pcs': 4000, 'weight_scheme': 'exponential', 'weight_clip_max': 5.0, 'weight_exponential_beta': 5.240201647852465}. Best is trial 67 with value: 0.22356194409955688.
2026-06-01 01:48:35 | INFO | src.nested_cv_avggrm_weighted_unified | Trial 164 | outer=8 | alpha=1.564e+05 n_pcs=4000 (pc_topk) weight_search=on
2026-06-01 01:48:35 | INFO | src.nested_cv_avggrm_weighted_unified | Trial 164 | outer=8 | weight={'name': 'exponential', 'floor': 1e-06, 'clip_max': 5.0, 'beta': 3.9845113989933054}
[I 2026-06-01 01:48:40,909] Trial 164 finished with value: 0.2220193414335292 and parameters: {'alpha': 156388.91558063417, 'n_pcs': 4000, 'weight_scheme': 'exponential', 'weight_clip_max': 5.0, 'weight_exponential_beta': 3.9845113989933054}. Best is trial 67 with value: 0.22356194409955688.
2026-06-01 01:48:40 | INFO | src.nested_cv_avggrm_weighted_unified | Trial 165 | outer=8 | alpha=1.107e+05 n_pcs=4000 (pc_topk) weight_search=on
2026-06-01 01:48:40 | INFO | src.nested_cv_avggrm_weighted_unified | Trial 165 | outer=8 | weight={'name': 'exponential', 'floor': 1e-06, 'clip_max': 5.0, 'beta': 5.020863194507122}
[I 2026-06-01 01:48:46,615] Trial 165 finished with value: 0.22287579897560944 and parameters: {'alpha': 110653.80171678627, 'n_pcs': 4000, 'weight_scheme': 'exponential', 'weight_clip_max': 5.0, 'weight_exponential_beta': 5.020863194507122}. Best is trial 67 with value: 0.22356194409955688.
2026-06-01 01:48:46 | INFO | src.nested_cv_avggrm_weighted_unified | Trial 166 | outer=8 | alpha=1.884e+05 n_pcs=4000 (pc_topk) weight_search=on
2026-06-01 01:48:46 | INFO | src.nested_cv_avggrm_weighted_unified | Trial 166 | outer=8 | weight={'name': 'exponential', 'floor': 1e-06, 'clip_max': 10.0, 'beta': 4.599852889677021}
[I 2026-06-01 01:48:52,286] Trial 166 finished with value: 0.21646494811336767 and parameters: {'alpha': 188433.54897860077, 'n_pcs': 4000, 'weight_scheme': 'exponential', 'weight_clip_max': 10.0, 'weight_exponential_beta': 4.599852889677021}. Best is trial 67 with value: 0.22356194409955688.
2026-06-01 01:48:52 | INFO | src.nested_cv_avggrm_weighted_unified | Trial 167 | outer=8 | alpha=8.487e+04 n_pcs=3500 (pc_topk) weight_search=on
2026-06-01 01:48:52 | INFO | src.nested_cv_avggrm_weighted_unified | Trial 167 | outer=8 | weight={'name': 'exponential', 'floor': 1e-06, 'clip_max': 20.0, 'beta': 5.094898014042019}
[I 2026-06-01 01:48:57,123] Trial 167 finished with value: 0.21189645850163163 and parameters: {'alpha': 84867.64115337696, 'n_pcs': 3500, 'weight_scheme': 'exponential', 'weight_clip_max': 20.0, 'weight_exponential_beta': 5.094898014042019}. Best is trial 67 with value: 0.22356194409955688.
2026-06-01 01:48:57 | INFO | src.nested_cv_avggrm_weighted_unified | Trial 168 | outer=8 | alpha=1.329e+05 n_pcs=4000 (pc_topk) weight_search=on
2026-06-01 01:48:57 | INFO | src.nested_cv_avggrm_weighted_unified | Trial 168 | outer=8 | weight={'name': 'exponential', 'floor': 1e-06, 'clip_max': 5.0, 'beta': 5.747451689653776}
[I 2026-06-01 01:49:02,869] Trial 168 finished with value: 0.22284532156910516 and parameters: {'alpha': 132881.67539278482, 'n_pcs': 4000, 'weight_scheme': 'exponential', 'weight_clip_max': 5.0, 'weight_exponential_beta': 5.747451689653776}. Best is trial 67 with value: 0.22356194409955688.
2026-06-01 01:49:02 | INFO | src.nested_cv_avggrm_weighted_unified | Trial 169 | outer=8 | alpha=2.871e+05 n_pcs=4000 (pc_topk) weight_search=on
2026-06-01 01:49:02 | INFO | src.nested_cv_avggrm_weighted_unified | Trial 169 | outer=8 | weight={'name': 'exponential', 'floor': 1e-06, 'clip_max': 5.0, 'beta': 5.2846532999574665}
[I 2026-06-01 01:49:09,085] Trial 169 finished with value: 0.2223821787442574 and parameters: {'alpha': 287054.69683567795, 'n_pcs': 4000, 'weight_scheme': 'exponential', 'weight_clip_max': 5.0, 'weight_exponential_beta': 5.2846532999574665}. Best is trial 67 with value: 0.22356194409955688.
2026-06-01 01:49:09 | INFO | src.nested_cv_avggrm_weighted_unified | Trial 170 | outer=8 | alpha=1.607e+05 n_pcs=4000 (pc_topk) weight_search=on
2026-06-01 01:49:09 | INFO | src.nested_cv_avggrm_weighted_unified | Trial 170 | outer=8 | weight={'name': 'exponential', 'floor': 1e-06, 'clip_max': 5.0, 'beta': 5.970483335106894}
[I 2026-06-01 01:49:14,826] Trial 170 finished with value: 0.22300590276925125 and parameters: {'alpha': 160710.90411081797, 'n_pcs': 4000, 'weight_scheme': 'exponential', 'weight_clip_max': 5.0, 'weight_exponential_beta': 5.970483335106894}. Best is trial 67 with value: 0.22356194409955688.
2026-06-01 01:49:14 | INFO | src.nested_cv_avggrm_weighted_unified | Trial 171 | outer=8 | alpha=1.609e+05 n_pcs=4000 (pc_topk) weight_search=on
2026-06-01 01:49:14 | INFO | src.nested_cv_avggrm_weighted_unified | Trial 171 | outer=8 | weight={'name': 'exponential', 'floor': 1e-06, 'clip_max': 5.0, 'beta': 5.97630620662249}
[I 2026-06-01 01:49:20,791] Trial 171 finished with value: 0.22300527247238516 and parameters: {'alpha': 160897.84788747696, 'n_pcs': 4000, 'weight_scheme': 'exponential', 'weight_clip_max': 5.0, 'weight_exponential_beta': 5.97630620662249}. Best is trial 67 with value: 0.22356194409955688.
2026-06-01 01:49:20 | INFO | src.nested_cv_avggrm_weighted_unified | Trial 172 | outer=8 | alpha=1.489e+05 n_pcs=4000 (pc_topk) weight_search=on
2026-06-01 01:49:20 | INFO | src.nested_cv_avggrm_weighted_unified | Trial 172 | outer=8 | weight={'name': 'exponential', 'floor': 1e-06, 'clip_max': 5.0, 'beta': 6.004961906030501}
[I 2026-06-01 01:49:26,477] Trial 172 finished with value: 0.22292205512986732 and parameters: {'alpha': 148939.728968382, 'n_pcs': 4000, 'weight_scheme': 'exponential', 'weight_clip_max': 5.0, 'weight_exponential_beta': 6.004961906030501}. Best is trial 67 with value: 0.22356194409955688.
2026-06-01 01:49:26 | INFO | src.nested_cv_avggrm_weighted_unified | Trial 173 | outer=8 | alpha=1.238e+05 n_pcs=4000 (pc_topk) weight_search=on
2026-06-01 01:49:26 | INFO | src.nested_cv_avggrm_weighted_unified | Trial 173 | outer=8 | weight={'name': 'exponential', 'floor': 1e-06, 'clip_max': 5.0, 'beta': 5.626910011729893}
