[I 2026-06-01 17:22:07,534] Trial 76 finished with value: 0.19845516656773377 and parameters: {'alpha': 34210.13141329377, 'n_pcs': 4500, 'iw_method': 'pc_logistic', 'iw_clip_max': 2.5, 'iw_prob_clip': 0.02990491448334336, 'iw_n_components': 60, 'iw_logistic_c': 7.703119605276783e-05, 'iw_pca_fit': 'combined', 'iw_solver': 'lbfgs', 'iw_rho': 0.7}. Best is trial 76 with value: 0.19845516656773377.
2026-06-01 17:22:07 | INFO | Trial 77 | outer=4 | alpha=3.240e+04 n_pcs=4500 (pc_topk) weight={'name': 'pc_logistic', 'floor': 1e-06, 'clip_max': 2.5, 'prob_clip': 0.04309386423592209, 'n_components': 10, 'logistic_c': 6.61212414919375e-05, 'pca_fit': 'combined', 'solver': 'lbfgs', 'max_iter': 2000, 'fit_intercept': True, 'standardize_with_source': True, 'rho': 1.0}
[I 2026-06-01 17:22:24,239] Trial 77 finished with value: 0.1961252770746828 and parameters: {'alpha': 32397.894486731555, 'n_pcs': 4500, 'iw_method': 'pc_logistic', 'iw_clip_max': 2.5, 'iw_prob_clip': 0.04309386423592209, 'iw_n_components': 10, 'iw_logistic_c': 6.61212414919375e-05, 'iw_pca_fit': 'combined', 'iw_solver': 'lbfgs', 'iw_rho': 1.0}. Best is trial 76 with value: 0.19845516656773377.
2026-06-01 17:22:24 | INFO | Trial 78 | outer=4 | alpha=4.993e+06 n_pcs=4500 (pc_topk) weight={'name': 'pc_logistic', 'floor': 1e-06, 'clip_max': 1.5, 'prob_clip': 0.030591162236516, 'n_components': 60, 'logistic_c': 0.0003622647386320645, 'pca_fit': 'combined', 'solver': 'lbfgs', 'max_iter': 2000, 'fit_intercept': True, 'standardize_with_source': True, 'rho': 0.7}
[I 2026-06-01 17:22:41,988] Trial 78 finished with value: 0.16940849863238505 and parameters: {'alpha': 4993084.942796183, 'n_pcs': 4500, 'iw_method': 'pc_logistic', 'iw_clip_max': 1.5, 'iw_prob_clip': 0.030591162236516, 'iw_n_components': 60, 'iw_logistic_c': 0.0003622647386320645, 'iw_pca_fit': 'combined', 'iw_solver': 'lbfgs', 'iw_rho': 0.7}. Best is trial 76 with value: 0.19845516656773377.
2026-06-01 17:22:42 | INFO | Trial 79 | outer=4 | alpha=1.875e+04 n_pcs=4500 (pc_topk) weight={'name': 'pc_logistic', 'floor': 1e-06, 'clip_max': 2.5, 'prob_clip': 0.01874912752614623, 'n_components': 60, 'logistic_c': 9.69271921369062e-05, 'pca_fit': 'combined', 'solver': 'lbfgs', 'max_iter': 2000, 'fit_intercept': True, 'standardize_with_source': True, 'rho': 0.7}
[I 2026-06-01 17:22:57,815] Trial 79 finished with value: 0.1907656838917332 and parameters: {'alpha': 18750.756305784336, 'n_pcs': 4500, 'iw_method': 'pc_logistic', 'iw_clip_max': 2.5, 'iw_prob_clip': 0.01874912752614623, 'iw_n_components': 60, 'iw_logistic_c': 9.69271921369062e-05, 'iw_pca_fit': 'combined', 'iw_solver': 'lbfgs', 'iw_rho': 0.7}. Best is trial 76 with value: 0.19845516656773377.
2026-06-01 17:22:57 | INFO | Trial 80 | outer=4 | alpha=2.550e+03 n_pcs=4500 (pc_topk) weight={'name': 'pc_logistic', 'floor': 1e-06, 'clip_max': 2.5, 'prob_clip': 0.013433104224808888, 'n_components': 60, 'logistic_c': 0.0022056358686552632, 'pca_fit': 'combined', 'solver': 'lbfgs', 'max_iter': 2000, 'fit_intercept': True, 'standardize_with_source': True, 'rho': 0.5}
[I 2026-06-01 17:23:18,195] Trial 80 finished with value: 0.14269834069484646 and parameters: {'alpha': 2550.154431190386, 'n_pcs': 4500, 'iw_method': 'pc_logistic', 'iw_clip_max': 2.5, 'iw_prob_clip': 0.013433104224808888, 'iw_n_components': 60, 'iw_logistic_c': 0.0022056358686552632, 'iw_pca_fit': 'combined', 'iw_solver': 'lbfgs', 'iw_rho': 0.5}. Best is trial 76 with value: 0.19845516656773377.
2026-06-01 17:23:18 | INFO | Trial 81 | outer=4 | alpha=4.204e+04 n_pcs=5000 (pc_topk) weight={'name': 'pc_logistic', 'floor': 1e-06, 'clip_max': 2.5, 'prob_clip': 0.022489850339390764, 'n_components': 60, 'logistic_c': 0.009354209606744563, 'pca_fit': 'combined', 'solver': 'lbfgs', 'max_iter': 2000, 'fit_intercept': True, 'standardize_with_source': True, 'rho': 0.7}
[I 2026-06-01 17:23:41,499] Trial 81 finished with value: 0.19596176923498393 and parameters: {'alpha': 42043.818151382206, 'n_pcs': 5000, 'iw_method': 'pc_logistic', 'iw_clip_max': 2.5, 'iw_prob_clip': 0.022489850339390764, 'iw_n_components': 60, 'iw_logistic_c': 0.009354209606744563, 'iw_pca_fit': 'combined', 'iw_solver': 'lbfgs', 'iw_rho': 0.7}. Best is trial 76 with value: 0.19845516656773377.
2026-06-01 17:23:41 | INFO | Trial 82 | outer=4 | alpha=1.480e+05 n_pcs=5000 (pc_topk) weight={'name': 'pc_logistic', 'floor': 1e-06, 'clip_max': 2.5, 'prob_clip': 0.027889024650780476, 'n_components': 60, 'logistic_c': 3.66560114606561e-05, 'pca_fit': 'combined', 'solver': 'lbfgs', 'max_iter': 2000, 'fit_intercept': True, 'standardize_with_source': True, 'rho': 0.7}
[I 2026-06-01 17:24:06,683] Trial 82 finished with value: 0.1961303265032845 and parameters: {'alpha': 148009.08469103966, 'n_pcs': 5000, 'iw_method': 'pc_logistic', 'iw_clip_max': 2.5, 'iw_prob_clip': 0.027889024650780476, 'iw_n_components': 60, 'iw_logistic_c': 3.66560114606561e-05, 'iw_pca_fit': 'combined', 'iw_solver': 'lbfgs', 'iw_rho': 0.7}. Best is trial 76 with value: 0.19845516656773377.
2026-06-01 17:24:06 | INFO | Trial 83 | outer=4 | alpha=6.933e+04 n_pcs=5000 (pc_topk) weight={'name': 'pc_logistic', 'floor': 1e-06, 'clip_max': 2.5, 'prob_clip': 0.018471031777458655, 'n_components': 60, 'logistic_c': 6.643602363711803e-06, 'pca_fit': 'combined', 'solver': 'lbfgs', 'max_iter': 2000, 'fit_intercept': True, 'standardize_with_source': True, 'rho': 0.7}
[I 2026-06-01 17:24:26,910] Trial 83 finished with value: 0.19701033625703795 and parameters: {'alpha': 69331.73876628977, 'n_pcs': 5000, 'iw_method': 'pc_logistic', 'iw_clip_max': 2.5, 'iw_prob_clip': 0.018471031777458655, 'iw_n_components': 60, 'iw_logistic_c': 6.643602363711803e-06, 'iw_pca_fit': 'combined', 'iw_solver': 'lbfgs', 'iw_rho': 0.7}. Best is trial 76 with value: 0.19845516656773377.
2026-06-01 17:24:26 | INFO | Trial 84 | outer=4 | alpha=1.024e+05 n_pcs=5000 (pc_topk) weight={'name': 'pc_logistic', 'floor': 1e-06, 'clip_max': 12.0, 'prob_clip': 0.009158598442470143, 'n_components': 40, 'logistic_c': 7.525165641704179e-06, 'pca_fit': 'combined', 'solver': 'lbfgs', 'max_iter': 2000, 'fit_intercept': True, 'standardize_with_source': True, 'rho': 0.7}
[I 2026-06-01 17:24:44,276] Trial 84 finished with value: 0.19424497753128606 and parameters: {'alpha': 102358.03686479821, 'n_pcs': 5000, 'iw_method': 'pc_logistic', 'iw_clip_max': 12.0, 'iw_prob_clip': 0.009158598442470143, 'iw_n_components': 40, 'iw_logistic_c': 7.525165641704179e-06, 'iw_pca_fit': 'combined', 'iw_solver': 'lbfgs', 'iw_rho': 0.7}. Best is trial 76 with value: 0.19845516656773377.
2026-06-01 17:24:44 | INFO | Trial 85 | outer=4 | alpha=7.112e+04 n_pcs=5000 (pc_topk) weight={'name': 'pc_logistic', 'floor': 1e-06, 'clip_max': 2.5, 'prob_clip': 0.017711534028047246, 'n_components': 60, 'logistic_c': 0.0003736592544611642, 'pca_fit': 'combined', 'solver': 'lbfgs', 'max_iter': 2000, 'fit_intercept': True, 'standardize_with_source': True, 'rho': 0.7}
[I 2026-06-01 17:25:03,642] Trial 85 finished with value: 0.19683346018046857 and parameters: {'alpha': 71124.46704160894, 'n_pcs': 5000, 'iw_method': 'pc_logistic', 'iw_clip_max': 2.5, 'iw_prob_clip': 0.017711534028047246, 'iw_n_components': 60, 'iw_logistic_c': 0.0003736592544611642, 'iw_pca_fit': 'combined', 'iw_solver': 'lbfgs', 'iw_rho': 0.7}. Best is trial 76 with value: 0.19845516656773377.
2026-06-01 17:25:03 | INFO | Trial 86 | outer=4 | alpha=6.955e+04 n_pcs=4500 (pc_topk) weight={'name': 'pc_logistic', 'floor': 1e-06, 'clip_max': 4.0, 'prob_clip': 0.018554719437269208, 'n_components': 10, 'logistic_c': 0.00013172302123726684, 'pca_fit': 'combined', 'solver': 'lbfgs', 'max_iter': 2000, 'fit_intercept': True, 'standardize_with_source': True, 'rho': 0.7}
[I 2026-06-01 17:25:21,612] Trial 86 finished with value: 0.19725296115908256 and parameters: {'alpha': 69545.95026735957, 'n_pcs': 4500, 'iw_method': 'pc_logistic', 'iw_clip_max': 4.0, 'iw_prob_clip': 0.018554719437269208, 'iw_n_components': 10, 'iw_logistic_c': 0.00013172302123726684, 'iw_pca_fit': 'combined', 'iw_solver': 'lbfgs', 'iw_rho': 0.7}. Best is trial 76 with value: 0.19845516656773377.
2026-06-01 17:25:21 | INFO | Trial 87 | outer=4 | alpha=1.311e+05 n_pcs=4000 (pc_topk) weight={'name': 'pc_logistic', 'floor': 1e-06, 'clip_max': 4.0, 'prob_clip': 0.012741268165604997, 'n_components': 10, 'logistic_c': 1.2848769337486364e-06, 'pca_fit': 'combined', 'solver': 'lbfgs', 'max_iter': 2000, 'fit_intercept': True, 'standardize_with_source': True, 'rho': 0.7}
[I 2026-06-01 17:25:35,848] Trial 87 finished with value: 0.18824808103988602 and parameters: {'alpha': 131102.40488850544, 'n_pcs': 4000, 'iw_method': 'pc_logistic', 'iw_clip_max': 4.0, 'iw_prob_clip': 0.012741268165604997, 'iw_n_components': 10, 'iw_logistic_c': 1.2848769337486364e-06, 'iw_pca_fit': 'combined', 'iw_solver': 'lbfgs', 'iw_rho': 0.7}. Best is trial 76 with value: 0.19845516656773377.
2026-06-01 17:25:35 | INFO | Trial 88 | outer=4 | alpha=8.612e+04 n_pcs=4500 (pc_topk) weight={'name': 'pc_logistic', 'floor': 1e-06, 'clip_max': 4.0, 'prob_clip': 0.036262421068399685, 'n_components': 10, 'logistic_c': 8.346965357878e-06, 'pca_fit': 'combined', 'solver': 'lbfgs', 'max_iter': 2000, 'fit_intercept': True, 'standardize_with_source': True, 'rho': 0.7}
[I 2026-06-01 17:25:51,038] Trial 88 finished with value: 0.19686032987727345 and parameters: {'alpha': 86117.79073042385, 'n_pcs': 4500, 'iw_method': 'pc_logistic', 'iw_clip_max': 4.0, 'iw_prob_clip': 0.036262421068399685, 'iw_n_components': 10, 'iw_logistic_c': 8.346965357878e-06, 'iw_pca_fit': 'combined', 'iw_solver': 'lbfgs', 'iw_rho': 0.7}. Best is trial 76 with value: 0.19845516656773377.
2026-06-01 17:25:51 | INFO | Trial 89 | outer=4 | alpha=3.223e+05 n_pcs=4000 (pc_topk) weight={'name': 'pc_logistic', 'floor': 1e-06, 'clip_max': 4.0, 'prob_clip': 0.028078699222262207, 'n_components': 10, 'logistic_c': 1.3169457774774628e-07, 'pca_fit': 'combined', 'solver': 'lbfgs', 'max_iter': 2000, 'fit_intercept': True, 'standardize_with_source': True, 'rho': 0.3}
[I 2026-06-01 17:26:03,137] Trial 89 finished with value: 0.17611162323801718 and parameters: {'alpha': 322348.8441324948, 'n_pcs': 4000, 'iw_method': 'pc_logistic', 'iw_clip_max': 4.0, 'iw_prob_clip': 0.028078699222262207, 'iw_n_components': 10, 'iw_logistic_c': 1.3169457774774628e-07, 'iw_pca_fit': 'combined', 'iw_solver': 'lbfgs', 'iw_rho': 0.3}. Best is trial 76 with value: 0.19845516656773377.
2026-06-01 17:26:03 | INFO | Trial 90 | outer=4 | alpha=1.862e+05 n_pcs=4500 (pc_topk) weight={'name': 'pc_logistic', 'floor': 1e-06, 'clip_max': 1.5, 'prob_clip': 0.021307391846650484, 'n_components': 20, 'logistic_c': 0.0001625263519631352, 'pca_fit': 'combined', 'solver': 'lbfgs', 'max_iter': 2000, 'fit_intercept': True, 'standardize_with_source': True, 'rho': 0.7}
[I 2026-06-01 17:26:18,926] Trial 90 finished with value: 0.1927385435763517 and parameters: {'alpha': 186176.03157288273, 'n_pcs': 4500, 'iw_method': 'pc_logistic', 'iw_clip_max': 1.5, 'iw_prob_clip': 0.021307391846650484, 'iw_n_components': 20, 'iw_logistic_c': 0.0001625263519631352, 'iw_pca_fit': 'combined', 'iw_solver': 'lbfgs', 'iw_rho': 0.7}. Best is trial 76 with value: 0.19845516656773377.
2026-06-01 17:26:18 | INFO | Trial 91 | outer=4 | alpha=7.945e+04 n_pcs=4500 (pc_topk) weight={'name': 'pc_logistic', 'floor': 1e-06, 'clip_max': 4.0, 'prob_clip': 0.03845601993076421, 'n_components': 10, 'logistic_c': 6.292515178079102e-06, 'pca_fit': 'combined', 'solver': 'lbfgs', 'max_iter': 2000, 'fit_intercept': True, 'standardize_with_source': True, 'rho': 0.7}
[I 2026-06-01 17:26:34,068] Trial 91 finished with value: 0.19654295458474272 and parameters: {'alpha': 79451.8733032164, 'n_pcs': 4500, 'iw_method': 'pc_logistic', 'iw_clip_max': 4.0, 'iw_prob_clip': 0.03845601993076421, 'iw_n_components': 10, 'iw_logistic_c': 6.292515178079102e-06, 'iw_pca_fit': 'combined', 'iw_solver': 'lbfgs', 'iw_rho': 0.7}. Best is trial 76 with value: 0.19845516656773377.
2026-06-01 17:26:34 | INFO | Trial 92 | outer=4 | alpha=9.990e+04 n_pcs=4500 (pc_topk) weight={'name': 'pc_logistic', 'floor': 1e-06, 'clip_max': 4.0, 'prob_clip': 0.01858463750994828, 'n_components': 10, 'logistic_c': 3.8673312452230966e-05, 'pca_fit': 'combined', 'solver': 'lbfgs', 'max_iter': 2000, 'fit_intercept': True, 'standardize_with_source': True, 'rho': 0.7}
[I 2026-06-01 17:26:50,152] Trial 92 finished with value: 0.19905701409120344 and parameters: {'alpha': 99896.91549482358, 'n_pcs': 4500, 'iw_method': 'pc_logistic', 'iw_clip_max': 4.0, 'iw_prob_clip': 0.01858463750994828, 'iw_n_components': 10, 'iw_logistic_c': 3.8673312452230966e-05, 'iw_pca_fit': 'combined', 'iw_solver': 'lbfgs', 'iw_rho': 0.7}. Best is trial 92 with value: 0.19905701409120344.
2026-06-01 17:26:50 | INFO | Trial 93 | outer=4 | alpha=1.107e+05 n_pcs=4500 (pc_topk) weight={'name': 'pc_logistic', 'floor': 1e-06, 'clip_max': 4.0, 'prob_clip': 0.019233656014051352, 'n_components': 10, 'logistic_c': 3.878843694573324e-05, 'pca_fit': 'combined', 'solver': 'lbfgs', 'max_iter': 2000, 'fit_intercept': True, 'standardize_with_source': True, 'rho': 0.7}
[I 2026-06-01 17:27:06,399] Trial 93 finished with value: 0.19886276204906878 and parameters: {'alpha': 110705.96705139815, 'n_pcs': 4500, 'iw_method': 'pc_logistic', 'iw_clip_max': 4.0, 'iw_prob_clip': 0.019233656014051352, 'iw_n_components': 10, 'iw_logistic_c': 3.878843694573324e-05, 'iw_pca_fit': 'combined', 'iw_solver': 'lbfgs', 'iw_rho': 0.7}. Best is trial 92 with value: 0.19905701409120344.
2026-06-01 17:27:06 | INFO | Trial 94 | outer=4 | alpha=6.621e+04 n_pcs=4000 (pc_topk) weight={'name': 'pc_logistic', 'floor': 1e-06, 'clip_max': 4.0, 'prob_clip': 0.018854080428281537, 'n_components': 10, 'logistic_c': 2.8013940769751002e-05, 'pca_fit': 'combined', 'solver': 'lbfgs', 'max_iter': 2000, 'fit_intercept': True, 'standardize_with_source': True, 'rho': 0.7}
[I 2026-06-01 17:27:19,582] Trial 94 finished with value: 0.1975882027076255 and parameters: {'alpha': 66211.78510702754, 'n_pcs': 4000, 'iw_method': 'pc_logistic', 'iw_clip_max': 4.0, 'iw_prob_clip': 0.018854080428281537, 'iw_n_components': 10, 'iw_logistic_c': 2.8013940769751002e-05, 'iw_pca_fit': 'combined', 'iw_solver': 'lbfgs', 'iw_rho': 0.7}. Best is trial 92 with value: 0.19905701409120344.
2026-06-01 17:27:19 | INFO | Trial 95 | outer=4 | alpha=3.899e+04 n_pcs=4000 (pc_topk) weight={'name': 'pc_logistic', 'floor': 1e-06, 'clip_max': 4.0, 'prob_clip': 0.04920079136722296, 'n_components': 10, 'logistic_c': 3.7206552964491995e-05, 'pca_fit': 'combined', 'solver': 'lbfgs', 'max_iter': 2000, 'fit_intercept': True, 'standardize_with_source': True, 'rho': 1.0}
[I 2026-06-01 17:27:33,149] Trial 95 finished with value: 0.19464761547217682 and parameters: {'alpha': 38993.03748209249, 'n_pcs': 4000, 'iw_method': 'pc_logistic', 'iw_clip_max': 4.0, 'iw_prob_clip': 0.04920079136722296, 'iw_n_components': 10, 'iw_logistic_c': 3.7206552964491995e-05, 'iw_pca_fit': 'combined', 'iw_solver': 'lbfgs', 'iw_rho': 1.0}. Best is trial 92 with value: 0.19905701409120344.
2026-06-01 17:27:33 | INFO | Trial 96 | outer=4 | alpha=1.189e+05 n_pcs=4000 (pc_topk) weight={'name': 'pc_logistic', 'floor': 1e-06, 'clip_max': 4.0, 'prob_clip': 0.010843813263092526, 'n_components': 10, 'logistic_c': 0.00034243571128554396, 'pca_fit': 'combined', 'solver': 'lbfgs', 'max_iter': 2000, 'fit_intercept': True, 'standardize_with_source': True, 'rho': 0.7}
[I 2026-06-01 17:27:49,006] Trial 96 finished with value: 0.1952868175492756 and parameters: {'alpha': 118885.83338871856, 'n_pcs': 4000, 'iw_method': 'pc_logistic', 'iw_clip_max': 4.0, 'iw_prob_clip': 0.010843813263092526, 'iw_n_components': 10, 'iw_logistic_c': 0.00034243571128554396, 'iw_pca_fit': 'combined', 'iw_solver': 'lbfgs', 'iw_rho': 0.7}. Best is trial 92 with value: 0.19905701409120344.
2026-06-01 17:27:49 | INFO | Trial 97 | outer=4 | alpha=1.011e+05 n_pcs=4500 (pc_topk) weight={'name': 'pc_logistic', 'floor': 1e-06, 'clip_max': 4.0, 'prob_clip': 0.014602544825194946, 'n_components': 10, 'logistic_c': 1.4080155396676432e-05, 'pca_fit': 'combined', 'solver': 'lbfgs', 'max_iter': 2000, 'fit_intercept': True, 'standardize_with_source': True, 'rho': 0.7}
[I 2026-06-01 17:28:05,094] Trial 97 finished with value: 0.1984908465473077 and parameters: {'alpha': 101147.3962189713, 'n_pcs': 4500, 'iw_method': 'pc_logistic', 'iw_clip_max': 4.0, 'iw_prob_clip': 0.014602544825194946, 'iw_n_components': 10, 'iw_logistic_c': 1.4080155396676432e-05, 'iw_pca_fit': 'combined', 'iw_solver': 'lbfgs', 'iw_rho': 0.7}. Best is trial 92 with value: 0.19905701409120344.
2026-06-01 17:28:05 | INFO | Trial 98 | outer=4 | alpha=1.075e+05 n_pcs=4000 (pc_topk) weight={'name': 'pc_logistic', 'floor': 1e-06, 'clip_max': 4.0, 'prob_clip': 0.022435492378451407, 'n_components': 10, 'logistic_c': 2.0967805970068924e-05, 'pca_fit': 'combined', 'solver': 'lbfgs', 'max_iter': 2000, 'fit_intercept': True, 'standardize_with_source': True, 'rho': 0.5}
[I 2026-06-01 17:28:20,293] Trial 98 finished with value: 0.19674736333752493 and parameters: {'alpha': 107515.40741789478, 'n_pcs': 4000, 'iw_method': 'pc_logistic', 'iw_clip_max': 4.0, 'iw_prob_clip': 0.022435492378451407, 'iw_n_components': 10, 'iw_logistic_c': 2.0967805970068924e-05, 'iw_pca_fit': 'combined', 'iw_solver': 'lbfgs', 'iw_rho': 0.5}. Best is trial 92 with value: 0.19905701409120344.
2026-06-01 17:28:20 | INFO | Trial 99 | outer=4 | alpha=1.719e+05 n_pcs=4500 (pc_topk) weight={'name': 'pc_logistic', 'floor': 1e-06, 'clip_max': 4.0, 'prob_clip': 0.030426453705131147, 'n_components': 10, 'logistic_c': 0.00011171947826426935, 'pca_fit': 'combined', 'solver': 'lbfgs', 'max_iter': 2000, 'fit_intercept': True, 'standardize_with_source': True, 'rho': 0.7}
[I 2026-06-01 17:28:36,199] Trial 99 finished with value: 0.19592330860624133 and parameters: {'alpha': 171912.1207159701, 'n_pcs': 4500, 'iw_method': 'pc_logistic', 'iw_clip_max': 4.0, 'iw_prob_clip': 0.030426453705131147, 'iw_n_components': 10, 'iw_logistic_c': 0.00011171947826426935, 'iw_pca_fit': 'combined', 'iw_solver': 'lbfgs', 'iw_rho': 0.7}. Best is trial 92 with value: 0.19905701409120344.
2026-06-01 17:28:36 | INFO | Trial 100 | outer=4 | alpha=1.446e+05 n_pcs=4500 (pc_topk) weight={'name': 'pc_logistic', 'floor': 1e-06, 'clip_max': 4.0, 'prob_clip': 0.020725142513325738, 'n_components': 10, 'logistic_c': 4.043958592026789e-05, 'pca_fit': 'combined', 'solver': 'lbfgs', 'max_iter': 2000, 'fit_intercept': True, 'standardize_with_source': True, 'rho': 0.7}
[I 2026-06-01 17:28:52,215] Trial 100 finished with value: 0.19787157731299965 and parameters: {'alpha': 144640.21475604066, 'n_pcs': 4500, 'iw_method': 'pc_logistic', 'iw_clip_max': 4.0, 'iw_prob_clip': 0.020725142513325738, 'iw_n_components': 10, 'iw_logistic_c': 4.043958592026789e-05, 'iw_pca_fit': 'combined', 'iw_solver': 'lbfgs', 'iw_rho': 0.7}. Best is trial 92 with value: 0.19905701409120344.
2026-06-01 17:28:52 | INFO | Trial 101 | outer=4 | alpha=1.401e+05 n_pcs=4500 (pc_topk) weight={'name': 'pc_logistic', 'floor': 1e-06, 'clip_max': 4.0, 'prob_clip': 0.02024107785010226, 'n_components': 10, 'logistic_c': 1.3189496670691716e-05, 'pca_fit': 'combined', 'solver': 'lbfgs', 'max_iter': 2000, 'fit_intercept': True, 'standardize_with_source': True, 'rho': 0.7}
[I 2026-06-01 17:29:07,170] Trial 101 finished with value: 0.1967340871690128 and parameters: {'alpha': 140135.10724914132, 'n_pcs': 4500, 'iw_method': 'pc_logistic', 'iw_clip_max': 4.0, 'iw_prob_clip': 0.02024107785010226, 'iw_n_components': 10, 'iw_logistic_c': 1.3189496670691716e-05, 'iw_pca_fit': 'combined', 'iw_solver': 'lbfgs', 'iw_rho': 0.7}. Best is trial 92 with value: 0.19905701409120344.
2026-06-01 17:29:07 | INFO | Trial 102 | outer=4 | alpha=1.031e+05 n_pcs=4500 (pc_topk) weight={'name': 'pc_logistic', 'floor': 1e-06, 'clip_max': 4.0, 'prob_clip': 0.014146515199740377, 'n_components': 10, 'logistic_c': 4.7751192402536e-05, 'pca_fit': 'combined', 'solver': 'lbfgs', 'max_iter': 2000, 'fit_intercept': True, 'standardize_with_source': True, 'rho': 0.7}
[I 2026-06-01 17:29:23,126] Trial 102 finished with value: 0.1985617551434569 and parameters: {'alpha': 103066.44053828578, 'n_pcs': 4500, 'iw_method': 'pc_logistic', 'iw_clip_max': 4.0, 'iw_prob_clip': 0.014146515199740377, 'iw_n_components': 10, 'iw_logistic_c': 4.7751192402536e-05, 'iw_pca_fit': 'combined', 'iw_solver': 'lbfgs', 'iw_rho': 0.7}. Best is trial 92 with value: 0.19905701409120344.
2026-06-01 17:29:23 | INFO | Trial 103 | outer=4 | alpha=2.658e+05 n_pcs=4000 (pc_topk) weight={'name': 'pc_logistic', 'floor': 1e-06, 'clip_max': 4.0, 'prob_clip': 0.01447754951361547, 'n_components': 10, 'logistic_c': 4.163811083666844e-05, 'pca_fit': 'combined', 'solver': 'lbfgs', 'max_iter': 2000, 'fit_intercept': True, 'standardize_with_source': True, 'rho': 0.7}
[I 2026-06-01 17:29:37,145] Trial 103 finished with value: 0.1945104219969202 and parameters: {'alpha': 265825.530054642, 'n_pcs': 4000, 'iw_method': 'pc_logistic', 'iw_clip_max': 4.0, 'iw_prob_clip': 0.01447754951361547, 'iw_n_components': 10, 'iw_logistic_c': 4.163811083666844e-05, 'iw_pca_fit': 'combined', 'iw_solver': 'lbfgs', 'iw_rho': 0.7}. Best is trial 92 with value: 0.19905701409120344.
2026-06-01 17:29:37 | INFO | Trial 104 | outer=4 | alpha=2.101e+05 n_pcs=4500 (pc_topk) weight={'name': 'pc_logistic', 'floor': 1e-06, 'clip_max': 4.0, 'prob_clip': 0.011961969297685998, 'n_components': 10, 'logistic_c': 1.3959457876212045e-05, 'pca_fit': 'combined', 'solver': 'lbfgs', 'max_iter': 2000, 'fit_intercept': True, 'standardize_with_source': True, 'rho': 0.7}
