[I 2026-06-01 02:08:09,145] Trial 117 finished with value: 0.23108904655050505 and parameters: {'alpha': 610869.8671552271, 'n_pcs': 3000, 'weight_scheme': 'exponential', 'weight_clip_max': 3.0, 'weight_exponential_beta': 9.074635501446199}. Best is trial 102 with value: 0.2346683079285648.
2026-06-01 02:08:09 | INFO | src.nested_cv_avggrm_weighted_unified | Trial 118 | outer=9 | alpha=1.620e+05 n_pcs=3000 (pc_topk) weight_search=on
2026-06-01 02:08:09 | INFO | src.nested_cv_avggrm_weighted_unified | Trial 118 | outer=9 | weight={'name': 'exponential', 'floor': 1e-06, 'clip_max': 3.0, 'beta': 9.53826557329522}
[I 2026-06-01 02:08:12,990] Trial 118 finished with value: 0.2335233570892064 and parameters: {'alpha': 162030.32482448005, 'n_pcs': 3000, 'weight_scheme': 'exponential', 'weight_clip_max': 3.0, 'weight_exponential_beta': 9.53826557329522}. Best is trial 102 with value: 0.2346683079285648.
2026-06-01 02:08:12 | INFO | src.nested_cv_avggrm_weighted_unified | Trial 119 | outer=9 | alpha=9.288e+05 n_pcs=2500 (pc_topk) weight_search=on
2026-06-01 02:08:13 | INFO | src.nested_cv_avggrm_weighted_unified | Trial 119 | outer=9 | weight={'name': 'exponential', 'floor': 1e-06, 'clip_max': 5.0, 'beta': 8.702947651654053}
2026-06-01 02:08:15 | INFO | src.nested_cv_avggrm_weighted_unified | Trial 119 | outer=9 | pruned after 8/10 inner folds (mean r=0.2622)
[I 2026-06-01 02:08:15,364] Trial 119 pruned. 
2026-06-01 02:08:15 | INFO | src.nested_cv_avggrm_weighted_unified | Trial 120 | outer=9 | alpha=2.780e+05 n_pcs=3000 (pc_topk) weight_search=on
2026-06-01 02:08:15 | INFO | src.nested_cv_avggrm_weighted_unified | Trial 120 | outer=9 | weight={'name': 'exponential', 'floor': 1e-06, 'clip_max': 3.0, 'beta': 8.757294714442136}
[I 2026-06-01 02:08:19,153] Trial 120 finished with value: 0.2342571498752823 and parameters: {'alpha': 277983.6674424946, 'n_pcs': 3000, 'weight_scheme': 'exponential', 'weight_clip_max': 3.0, 'weight_exponential_beta': 8.757294714442136}. Best is trial 102 with value: 0.2346683079285648.
2026-06-01 02:08:19 | INFO | src.nested_cv_avggrm_weighted_unified | Trial 121 | outer=9 | alpha=2.869e+05 n_pcs=3000 (pc_topk) weight_search=on
2026-06-01 02:08:19 | INFO | src.nested_cv_avggrm_weighted_unified | Trial 121 | outer=9 | weight={'name': 'exponential', 'floor': 1e-06, 'clip_max': 3.0, 'beta': 8.314383990026716}
[I 2026-06-01 02:08:22,973] Trial 121 finished with value: 0.23384648383703227 and parameters: {'alpha': 286921.39081384894, 'n_pcs': 3000, 'weight_scheme': 'exponential', 'weight_clip_max': 3.0, 'weight_exponential_beta': 8.314383990026716}. Best is trial 102 with value: 0.2346683079285648.
2026-06-01 02:08:22 | INFO | src.nested_cv_avggrm_weighted_unified | Trial 122 | outer=9 | alpha=2.439e+05 n_pcs=3000 (pc_topk) weight_search=on
2026-06-01 02:08:22 | INFO | src.nested_cv_avggrm_weighted_unified | Trial 122 | outer=9 | weight={'name': 'exponential', 'floor': 1e-06, 'clip_max': 3.0, 'beta': 8.850227389533135}
[I 2026-06-01 02:08:26,773] Trial 122 finished with value: 0.2345376291133765 and parameters: {'alpha': 243929.78549213728, 'n_pcs': 3000, 'weight_scheme': 'exponential', 'weight_clip_max': 3.0, 'weight_exponential_beta': 8.850227389533135}. Best is trial 102 with value: 0.2346683079285648.
2026-06-01 02:08:26 | INFO | src.nested_cv_avggrm_weighted_unified | Trial 123 | outer=9 | alpha=2.524e+05 n_pcs=3000 (pc_topk) weight_search=on
2026-06-01 02:08:26 | INFO | src.nested_cv_avggrm_weighted_unified | Trial 123 | outer=9 | weight={'name': 'exponential', 'floor': 1e-06, 'clip_max': 3.0, 'beta': 8.810657866386247}
[I 2026-06-01 02:08:30,631] Trial 123 finished with value: 0.23447857898419638 and parameters: {'alpha': 252375.70863660076, 'n_pcs': 3000, 'weight_scheme': 'exponential', 'weight_clip_max': 3.0, 'weight_exponential_beta': 8.810657866386247}. Best is trial 102 with value: 0.2346683079285648.
2026-06-01 02:08:30 | INFO | src.nested_cv_avggrm_weighted_unified | Trial 124 | outer=9 | alpha=4.118e+05 n_pcs=3000 (pc_topk) weight_search=on
2026-06-01 02:08:30 | INFO | src.nested_cv_avggrm_weighted_unified | Trial 124 | outer=9 | weight={'name': 'exponential', 'floor': 1e-06, 'clip_max': 3.0, 'beta': 8.807081167446562}
[I 2026-06-01 02:08:34,584] Trial 124 finished with value: 0.2328925573262192 and parameters: {'alpha': 411821.69559247117, 'n_pcs': 3000, 'weight_scheme': 'exponential', 'weight_clip_max': 3.0, 'weight_exponential_beta': 8.807081167446562}. Best is trial 102 with value: 0.2346683079285648.
2026-06-01 02:08:34 | INFO | src.nested_cv_avggrm_weighted_unified | Trial 125 | outer=9 | alpha=2.296e+05 n_pcs=3500 (pc_topk) weight_search=on
2026-06-01 02:08:34 | INFO | src.nested_cv_avggrm_weighted_unified | Trial 125 | outer=9 | weight={'name': 'exponential', 'floor': 1e-06, 'clip_max': 3.0, 'beta': 9.0007351288815}
[I 2026-06-01 02:08:39,397] Trial 125 finished with value: 0.23340670853115678 and parameters: {'alpha': 229613.4362746538, 'n_pcs': 3500, 'weight_scheme': 'exponential', 'weight_clip_max': 3.0, 'weight_exponential_beta': 9.0007351288815}. Best is trial 102 with value: 0.2346683079285648.
2026-06-01 02:08:39 | INFO | src.nested_cv_avggrm_weighted_unified | Trial 126 | outer=9 | alpha=2.956e+05 n_pcs=3000 (pc_topk) weight_search=on
2026-06-01 02:08:39 | INFO | src.nested_cv_avggrm_weighted_unified | Trial 126 | outer=9 | weight={'name': 'exponential', 'floor': 1e-06, 'clip_max': 3.0, 'beta': 9.52684895996149}
[I 2026-06-01 02:08:43,952] Trial 126 finished with value: 0.23400671948503377 and parameters: {'alpha': 295550.89442121447, 'n_pcs': 3000, 'weight_scheme': 'exponential', 'weight_clip_max': 3.0, 'weight_exponential_beta': 9.52684895996149}. Best is trial 102 with value: 0.2346683079285648.
2026-06-01 02:08:43 | INFO | src.nested_cv_avggrm_weighted_unified | Trial 127 | outer=9 | alpha=2.530e+05 n_pcs=3000 (pc_topk) weight_search=on
2026-06-01 02:08:43 | INFO | src.nested_cv_avggrm_weighted_unified | Trial 127 | outer=9 | weight={'name': 'exponential', 'floor': 1e-06, 'clip_max': None, 'beta': 8.641026620690527}
2026-06-01 02:08:47 | INFO | src.nested_cv_avggrm_weighted_unified | Trial 127 | outer=9 | pruned after 8/10 inner folds (mean r=0.2388)
[I 2026-06-01 02:08:47,179] Trial 127 pruned. 
2026-06-01 02:08:47 | INFO | src.nested_cv_avggrm_weighted_unified | Trial 128 | outer=9 | alpha=1.360e+05 n_pcs=3500 (pc_topk) weight_search=on
2026-06-01 02:08:47 | INFO | src.nested_cv_avggrm_weighted_unified | Trial 128 | outer=9 | weight={'name': 'exponential', 'floor': 1e-06, 'clip_max': 3.0, 'beta': 8.302915875623873}
[I 2026-06-01 02:08:51,978] Trial 128 finished with value: 0.23301301004857544 and parameters: {'alpha': 136017.58640697782, 'n_pcs': 3500, 'weight_scheme': 'exponential', 'weight_clip_max': 3.0, 'weight_exponential_beta': 8.302915875623873}. Best is trial 102 with value: 0.2346683079285648.
2026-06-01 02:08:51 | INFO | src.nested_cv_avggrm_weighted_unified | Trial 129 | outer=9 | alpha=5.297e+05 n_pcs=3000 (pc_topk) weight_search=on
2026-06-01 02:08:51 | INFO | src.nested_cv_avggrm_weighted_unified | Trial 129 | outer=9 | weight={'name': 'linear', 'floor': 1e-06, 'clip_max': 3.0, 'min_weight': 0.7621383670495037, 'max_weight': 2.428679228675063}
2026-06-01 02:08:54 | INFO | src.nested_cv_avggrm_weighted_unified | Trial 129 | outer=9 | pruned after 7/10 inner folds (mean r=0.2333)
[I 2026-06-01 02:08:54,604] Trial 129 pruned. 
2026-06-01 02:08:54 | INFO | src.nested_cv_avggrm_weighted_unified | Trial 130 | outer=9 | alpha=3.651e+05 n_pcs=3000 (pc_topk) weight_search=on
2026-06-01 02:08:54 | INFO | src.nested_cv_avggrm_weighted_unified | Trial 130 | outer=9 | weight={'name': 'exponential', 'floor': 1e-06, 'clip_max': 10.0, 'beta': 7.858491865378406}
[I 2026-06-01 02:08:58,368] Trial 130 finished with value: 0.23062113161196374 and parameters: {'alpha': 365101.7145174673, 'n_pcs': 3000, 'weight_scheme': 'exponential', 'weight_clip_max': 10.0, 'weight_exponential_beta': 7.858491865378406}. Best is trial 102 with value: 0.2346683079285648.
2026-06-01 02:08:58 | INFO | src.nested_cv_avggrm_weighted_unified | Trial 131 | outer=9 | alpha=2.974e+05 n_pcs=3000 (pc_topk) weight_search=on
2026-06-01 02:08:58 | INFO | src.nested_cv_avggrm_weighted_unified | Trial 131 | outer=9 | weight={'name': 'exponential', 'floor': 1e-06, 'clip_max': 3.0, 'beta': 9.08084335679512}
[I 2026-06-01 02:09:02,120] Trial 131 finished with value: 0.23418085971590763 and parameters: {'alpha': 297381.73515185347, 'n_pcs': 3000, 'weight_scheme': 'exponential', 'weight_clip_max': 3.0, 'weight_exponential_beta': 9.08084335679512}. Best is trial 102 with value: 0.2346683079285648.
2026-06-01 02:09:02 | INFO | src.nested_cv_avggrm_weighted_unified | Trial 132 | outer=9 | alpha=7.499e+05 n_pcs=3000 (pc_topk) weight_search=on
2026-06-01 02:09:02 | INFO | src.nested_cv_avggrm_weighted_unified | Trial 132 | outer=9 | weight={'name': 'exponential', 'floor': 1e-06, 'clip_max': 3.0, 'beta': 9.029012668364892}
[I 2026-06-01 02:09:06,505] Trial 132 finished with value: 0.22977257576908094 and parameters: {'alpha': 749869.5666006225, 'n_pcs': 3000, 'weight_scheme': 'exponential', 'weight_clip_max': 3.0, 'weight_exponential_beta': 9.029012668364892}. Best is trial 102 with value: 0.2346683079285648.
2026-06-01 02:09:06 | INFO | src.nested_cv_avggrm_weighted_unified | Trial 133 | outer=9 | alpha=1.930e+05 n_pcs=3000 (pc_topk) weight_search=on
2026-06-01 02:09:06 | INFO | src.nested_cv_avggrm_weighted_unified | Trial 133 | outer=9 | weight={'name': 'exponential', 'floor': 1e-06, 'clip_max': 3.0, 'beta': 8.809403014961783}
[I 2026-06-01 02:09:10,287] Trial 133 finished with value: 0.23467014124689958 and parameters: {'alpha': 193018.95372386483, 'n_pcs': 3000, 'weight_scheme': 'exponential', 'weight_clip_max': 3.0, 'weight_exponential_beta': 8.809403014961783}. Best is trial 133 with value: 0.23467014124689958.
2026-06-01 02:09:10 | INFO | src.nested_cv_avggrm_weighted_unified | OUTER 9 | new best trial 133 (mean inner r=0.2347) saved to outputs/final_results/e6_pc_ridge_avggrm/thr_wing/e6_pc_ridge_avggrm_thr_wing_best_trials/split_09_best_trial.json
2026-06-01 02:09:10 | INFO | src.nested_cv_avggrm_weighted_unified | Trial 134 | outer=9 | alpha=2.117e+05 n_pcs=3000 (pc_topk) weight_search=on
2026-06-01 02:09:10 | INFO | src.nested_cv_avggrm_weighted_unified | Trial 134 | outer=9 | weight={'name': 'exponential', 'floor': 1e-06, 'clip_max': 3.0, 'beta': 9.659348552740916}
[I 2026-06-01 02:09:14,330] Trial 134 finished with value: 0.23393040252082864 and parameters: {'alpha': 211734.8654179708, 'n_pcs': 3000, 'weight_scheme': 'exponential', 'weight_clip_max': 3.0, 'weight_exponential_beta': 9.659348552740916}. Best is trial 133 with value: 0.23467014124689958.
2026-06-01 02:09:14 | INFO | src.nested_cv_avggrm_weighted_unified | Trial 135 | outer=9 | alpha=3.259e+05 n_pcs=3500 (pc_topk) weight_search=on
2026-06-01 02:09:14 | INFO | src.nested_cv_avggrm_weighted_unified | Trial 135 | outer=9 | weight={'name': 'exponential', 'floor': 1e-06, 'clip_max': 3.0, 'beta': 8.814440753384865}
[I 2026-06-01 02:09:19,205] Trial 135 finished with value: 0.23274251886749342 and parameters: {'alpha': 325923.17373014434, 'n_pcs': 3500, 'weight_scheme': 'exponential', 'weight_clip_max': 3.0, 'weight_exponential_beta': 8.814440753384865}. Best is trial 133 with value: 0.23467014124689958.
2026-06-01 02:09:19 | INFO | src.nested_cv_avggrm_weighted_unified | Trial 136 | outer=9 | alpha=4.219e+05 n_pcs=3000 (pc_topk) weight_search=on
2026-06-01 02:09:19 | INFO | src.nested_cv_avggrm_weighted_unified | Trial 136 | outer=9 | weight={'name': 'exponential', 'floor': 1e-06, 'clip_max': 3.0, 'beta': 9.172396011046516}
[I 2026-06-01 02:09:23,260] Trial 136 finished with value: 0.23304543931403704 and parameters: {'alpha': 421854.1457858955, 'n_pcs': 3000, 'weight_scheme': 'exponential', 'weight_clip_max': 3.0, 'weight_exponential_beta': 9.172396011046516}. Best is trial 133 with value: 0.23467014124689958.
2026-06-01 02:09:23 | INFO | src.nested_cv_avggrm_weighted_unified | Trial 137 | outer=9 | alpha=2.721e+05 n_pcs=3000 (pc_topk) weight_search=on
2026-06-01 02:09:23 | INFO | src.nested_cv_avggrm_weighted_unified | Trial 137 | outer=9 | weight={'name': 'exponential', 'floor': 1e-06, 'clip_max': 3.0, 'beta': 8.328295327432759}
[I 2026-06-01 02:09:27,088] Trial 137 finished with value: 0.2340246780510094 and parameters: {'alpha': 272074.2595200317, 'n_pcs': 3000, 'weight_scheme': 'exponential', 'weight_clip_max': 3.0, 'weight_exponential_beta': 8.328295327432759}. Best is trial 133 with value: 0.23467014124689958.
2026-06-01 02:09:27 | INFO | src.nested_cv_avggrm_weighted_unified | Trial 138 | outer=9 | alpha=2.482e+05 n_pcs=3000 (pc_topk) weight_search=on
2026-06-01 02:09:27 | INFO | src.nested_cv_avggrm_weighted_unified | Trial 138 | outer=9 | weight={'name': 'exponential', 'floor': 1e-06, 'clip_max': 3.0, 'beta': 8.358543412792548}
[I 2026-06-01 02:09:30,868] Trial 138 finished with value: 0.23428928673094798 and parameters: {'alpha': 248167.17081853704, 'n_pcs': 3000, 'weight_scheme': 'exponential', 'weight_clip_max': 3.0, 'weight_exponential_beta': 8.358543412792548}. Best is trial 133 with value: 0.23467014124689958.
2026-06-01 02:09:30 | INFO | src.nested_cv_avggrm_weighted_unified | Trial 139 | outer=9 | alpha=2.380e+05 n_pcs=3500 (pc_topk) weight_search=on
2026-06-01 02:09:30 | INFO | src.nested_cv_avggrm_weighted_unified | Trial 139 | outer=9 | weight={'name': 'uniform', 'floor': 1e-06, 'clip_max': 3.0}
2026-06-01 02:09:32 | INFO | src.nested_cv_avggrm_weighted_unified | Trial 139 | outer=9 | pruned after 5/10 inner folds (mean r=0.2068)
[I 2026-06-01 02:09:32,935] Trial 139 pruned. 
2026-06-01 02:09:32 | INFO | src.nested_cv_avggrm_weighted_unified | Trial 140 | outer=9 | alpha=1.933e+05 n_pcs=3000 (pc_topk) weight_search=on
2026-06-01 02:09:32 | INFO | src.nested_cv_avggrm_weighted_unified | Trial 140 | outer=9 | weight={'name': 'exponential', 'floor': 1e-06, 'clip_max': 20.0, 'beta': 7.6429323234473046}
[I 2026-06-01 02:09:37,066] Trial 140 finished with value: 0.22520714858944918 and parameters: {'alpha': 193263.25441446423, 'n_pcs': 3000, 'weight_scheme': 'exponential', 'weight_clip_max': 20.0, 'weight_exponential_beta': 7.6429323234473046}. Best is trial 133 with value: 0.23467014124689958.
2026-06-01 02:09:37 | INFO | src.nested_cv_avggrm_weighted_unified | Trial 141 | outer=9 | alpha=2.692e+05 n_pcs=3000 (pc_topk) weight_search=on
2026-06-01 02:09:37 | INFO | src.nested_cv_avggrm_weighted_unified | Trial 141 | outer=9 | weight={'name': 'exponential', 'floor': 1e-06, 'clip_max': 3.0, 'beta': 8.2670013114933}
[I 2026-06-01 02:09:40,885] Trial 141 finished with value: 0.23400340550530715 and parameters: {'alpha': 269213.21542946826, 'n_pcs': 3000, 'weight_scheme': 'exponential', 'weight_clip_max': 3.0, 'weight_exponential_beta': 8.2670013114933}. Best is trial 133 with value: 0.23467014124689958.
2026-06-01 02:09:40 | INFO | src.nested_cv_avggrm_weighted_unified | Trial 142 | outer=9 | alpha=3.228e+05 n_pcs=3000 (pc_topk) weight_search=on
2026-06-01 02:09:40 | INFO | src.nested_cv_avggrm_weighted_unified | Trial 142 | outer=9 | weight={'name': 'exponential', 'floor': 1e-06, 'clip_max': 3.0, 'beta': 7.140178441403663}
[I 2026-06-01 02:09:44,709] Trial 142 finished with value: 0.23183990461912365 and parameters: {'alpha': 322763.2208257101, 'n_pcs': 3000, 'weight_scheme': 'exponential', 'weight_clip_max': 3.0, 'weight_exponential_beta': 7.140178441403663}. Best is trial 133 with value: 0.23467014124689958.
2026-06-01 02:09:44 | INFO | src.nested_cv_avggrm_weighted_unified | Trial 143 | outer=9 | alpha=4.635e+05 n_pcs=3000 (pc_topk) weight_search=on
2026-06-01 02:09:44 | INFO | src.nested_cv_avggrm_weighted_unified | Trial 143 | outer=9 | weight={'name': 'exponential', 'floor': 1e-06, 'clip_max': 3.0, 'beta': 8.676202338900474}
[I 2026-06-01 02:09:48,551] Trial 143 finished with value: 0.23215069430285712 and parameters: {'alpha': 463472.9475982793, 'n_pcs': 3000, 'weight_scheme': 'exponential', 'weight_clip_max': 3.0, 'weight_exponential_beta': 8.676202338900474}. Best is trial 133 with value: 0.23467014124689958.
2026-06-01 02:09:48 | INFO | src.nested_cv_avggrm_weighted_unified | Trial 144 | outer=9 | alpha=2.463e+05 n_pcs=3000 (pc_topk) weight_search=on
2026-06-01 02:09:48 | INFO | src.nested_cv_avggrm_weighted_unified | Trial 144 | outer=9 | weight={'name': 'exponential', 'floor': 1e-06, 'clip_max': 3.0, 'beta': 8.513979006683}
[I 2026-06-01 02:09:52,466] Trial 144 finished with value: 0.2343900141453182 and parameters: {'alpha': 246332.95462135613, 'n_pcs': 3000, 'weight_scheme': 'exponential', 'weight_clip_max': 3.0, 'weight_exponential_beta': 8.513979006683}. Best is trial 133 with value: 0.23467014124689958.
2026-06-01 02:09:52 | INFO | src.nested_cv_avggrm_weighted_unified | Trial 145 | outer=9 | alpha=1.309e+05 n_pcs=3000 (pc_topk) weight_search=on
2026-06-01 02:09:52 | INFO | src.nested_cv_avggrm_weighted_unified | Trial 145 | outer=9 | weight={'name': 'exponential', 'floor': 1e-06, 'clip_max': 3.0, 'beta': 8.921792746785579}
[I 2026-06-01 02:09:56,279] Trial 145 finished with value: 0.23378628073386168 and parameters: {'alpha': 130880.61295009532, 'n_pcs': 3000, 'weight_scheme': 'exponential', 'weight_clip_max': 3.0, 'weight_exponential_beta': 8.921792746785579}. Best is trial 133 with value: 0.23467014124689958.
2026-06-01 02:09:56 | INFO | src.nested_cv_avggrm_weighted_unified | Trial 146 | outer=9 | alpha=2.079e+05 n_pcs=3000 (pc_topk) weight_search=on
2026-06-01 02:09:56 | INFO | src.nested_cv_avggrm_weighted_unified | Trial 146 | outer=9 | weight={'name': 'exponential', 'floor': 1e-06, 'clip_max': 3.0, 'beta': 8.577046011792806}
[I 2026-06-01 02:10:00,088] Trial 146 finished with value: 0.23465145839783327 and parameters: {'alpha': 207909.4600867465, 'n_pcs': 3000, 'weight_scheme': 'exponential', 'weight_clip_max': 3.0, 'weight_exponential_beta': 8.577046011792806}. Best is trial 133 with value: 0.23467014124689958.
2026-06-01 02:10:00 | INFO | src.nested_cv_avggrm_weighted_unified | Trial 147 | outer=9 | alpha=3.758e+05 n_pcs=3000 (pc_topk) weight_search=on
2026-06-01 02:10:00 | INFO | src.nested_cv_avggrm_weighted_unified | Trial 147 | outer=9 | weight={'name': 'exponential', 'floor': 1e-06, 'clip_max': 3.0, 'beta': 8.61855785187818}
[I 2026-06-01 02:10:03,858] Trial 147 finished with value: 0.2330981981448405 and parameters: {'alpha': 375847.1132020514, 'n_pcs': 3000, 'weight_scheme': 'exponential', 'weight_clip_max': 3.0, 'weight_exponential_beta': 8.61855785187818}. Best is trial 133 with value: 0.23467014124689958.
2026-06-01 02:10:03 | INFO | src.nested_cv_avggrm_weighted_unified | Trial 148 | outer=9 | alpha=2.322e+05 n_pcs=3500 (pc_topk) weight_search=on
2026-06-01 02:10:03 | INFO | src.nested_cv_avggrm_weighted_unified | Trial 148 | outer=9 | weight={'name': 'exponential', 'floor': 1e-06, 'clip_max': 3.0, 'beta': 8.448906801530704}
[I 2026-06-01 02:10:10,290] Trial 148 finished with value: 0.23327585901021625 and parameters: {'alpha': 232249.10604031064, 'n_pcs': 3500, 'weight_scheme': 'exponential', 'weight_clip_max': 3.0, 'weight_exponential_beta': 8.448906801530704}. Best is trial 133 with value: 0.23467014124689958.
2026-06-01 02:10:10 | INFO | src.nested_cv_avggrm_weighted_unified | Trial 149 | outer=9 | alpha=1.916e+05 n_pcs=3000 (pc_topk) weight_search=on
2026-06-01 02:10:10 | INFO | src.nested_cv_avggrm_weighted_unified | Trial 149 | outer=9 | weight={'name': 'exponential', 'floor': 1e-06, 'clip_max': 3.0, 'beta': 8.816584651984398}
[I 2026-06-01 02:10:14,538] Trial 149 finished with value: 0.23466540854507442 and parameters: {'alpha': 191634.54598474305, 'n_pcs': 3000, 'weight_scheme': 'exponential', 'weight_clip_max': 3.0, 'weight_exponential_beta': 8.816584651984398}. Best is trial 133 with value: 0.23467014124689958.
2026-06-01 02:10:14 | INFO | src.nested_cv_avggrm_weighted_unified | Trial 150 | outer=9 | alpha=1.959e+05 n_pcs=3000 (pc_topk) weight_search=on
2026-06-01 02:10:14 | INFO | src.nested_cv_avggrm_weighted_unified | Trial 150 | outer=9 | weight={'name': 'exponential', 'floor': 1e-06, 'clip_max': 5.0, 'beta': 8.84906939205569}
[I 2026-06-01 02:10:18,370] Trial 150 finished with value: 0.23287291862237547 and parameters: {'alpha': 195947.02264715792, 'n_pcs': 3000, 'weight_scheme': 'exponential', 'weight_clip_max': 5.0, 'weight_exponential_beta': 8.84906939205569}. Best is trial 133 with value: 0.23467014124689958.
2026-06-01 02:10:18 | INFO | src.nested_cv_avggrm_weighted_unified | Trial 151 | outer=9 | alpha=1.494e+05 n_pcs=3000 (pc_topk) weight_search=on
2026-06-01 02:10:18 | INFO | src.nested_cv_avggrm_weighted_unified | Trial 151 | outer=9 | weight={'name': 'exponential', 'floor': 1e-06, 'clip_max': 3.0, 'beta': 8.580638448109262}
[I 2026-06-01 02:10:22,244] Trial 151 finished with value: 0.23445438567573618 and parameters: {'alpha': 149384.25154395847, 'n_pcs': 3000, 'weight_scheme': 'exponential', 'weight_clip_max': 3.0, 'weight_exponential_beta': 8.580638448109262}. Best is trial 133 with value: 0.23467014124689958.
2026-06-01 02:10:22 | INFO | src.nested_cv_avggrm_weighted_unified | Trial 152 | outer=9 | alpha=1.058e+05 n_pcs=3000 (pc_topk) weight_search=on
2026-06-01 02:10:22 | INFO | src.nested_cv_avggrm_weighted_unified | Trial 152 | outer=9 | weight={'name': 'exponential', 'floor': 1e-06, 'clip_max': 3.0, 'beta': 8.495099106644695}
