[I 2026-06-01 23:10:32,146] Trial 219 finished with value: 0.2249838239748856 and parameters: {'alpha': 72832.17166746562, 'n_pcs': 4000, 'iw_method': 'pc_logistic', 'iw_clip_max': 2.5, 'iw_prob_clip': 0.03624040079625726, 'iw_n_components': 100, 'iw_logistic_c': 0.0001280504965278816, 'iw_pca_fit': 'combined', 'iw_solver': 'lbfgs', 'iw_rho': 0.85}. Best is trial 108 with value: 0.22594023894922968.
2026-06-01 23:10:32 | INFO | Trial 220 | outer=8 | alpha=6.942e+04 n_pcs=4000 (pc_topk) weight={'name': 'pc_logistic', 'floor': 1e-06, 'clip_max': 2.5, 'prob_clip': 0.037119497160132964, 'n_components': 40, 'logistic_c': 0.00020131723996482515, 'pca_fit': 'combined', 'solver': 'lbfgs', 'max_iter': 2000, 'fit_intercept': True, 'standardize_with_source': True, 'rho': 0.85}
[I 2026-06-01 23:10:47,726] Trial 220 finished with value: 0.22193750735215997 and parameters: {'alpha': 69418.24491832264, 'n_pcs': 4000, 'iw_method': 'pc_logistic', 'iw_clip_max': 2.5, 'iw_prob_clip': 0.037119497160132964, 'iw_n_components': 40, 'iw_logistic_c': 0.00020131723996482515, 'iw_pca_fit': 'combined', 'iw_solver': 'lbfgs', 'iw_rho': 0.85}. Best is trial 108 with value: 0.22594023894922968.
2026-06-01 23:10:47 | INFO | Trial 221 | outer=8 | alpha=7.795e+04 n_pcs=4000 (pc_topk) weight={'name': 'pc_logistic', 'floor': 1e-06, 'clip_max': 2.5, 'prob_clip': 0.036745504531456696, 'n_components': 100, 'logistic_c': 0.00011767009996994023, 'pca_fit': 'combined', 'solver': 'lbfgs', 'max_iter': 2000, 'fit_intercept': True, 'standardize_with_source': True, 'rho': 0.85}
[I 2026-06-01 23:11:01,790] Trial 221 finished with value: 0.2249107495665575 and parameters: {'alpha': 77951.05957816467, 'n_pcs': 4000, 'iw_method': 'pc_logistic', 'iw_clip_max': 2.5, 'iw_prob_clip': 0.036745504531456696, 'iw_n_components': 100, 'iw_logistic_c': 0.00011767009996994023, 'iw_pca_fit': 'combined', 'iw_solver': 'lbfgs', 'iw_rho': 0.85}. Best is trial 108 with value: 0.22594023894922968.
2026-06-01 23:11:01 | INFO | Trial 222 | outer=8 | alpha=6.678e+04 n_pcs=4000 (pc_topk) weight={'name': 'pc_logistic', 'floor': 1e-06, 'clip_max': 2.5, 'prob_clip': 0.03627691068342857, 'n_components': 100, 'logistic_c': 0.00013656116332144653, 'pca_fit': 'combined', 'solver': 'lbfgs', 'max_iter': 2000, 'fit_intercept': True, 'standardize_with_source': True, 'rho': 0.85}
[I 2026-06-01 23:11:15,887] Trial 222 finished with value: 0.22501135531910746 and parameters: {'alpha': 66777.61985805108, 'n_pcs': 4000, 'iw_method': 'pc_logistic', 'iw_clip_max': 2.5, 'iw_prob_clip': 0.03627691068342857, 'iw_n_components': 100, 'iw_logistic_c': 0.00013656116332144653, 'iw_pca_fit': 'combined', 'iw_solver': 'lbfgs', 'iw_rho': 0.85}. Best is trial 108 with value: 0.22594023894922968.
2026-06-01 23:11:15 | INFO | Trial 223 | outer=8 | alpha=7.872e+04 n_pcs=4000 (pc_topk) weight={'name': 'pc_logistic', 'floor': 1e-06, 'clip_max': 2.5, 'prob_clip': 0.035666183985396976, 'n_components': 100, 'logistic_c': 0.0001261423896629086, 'pca_fit': 'combined', 'solver': 'lbfgs', 'max_iter': 2000, 'fit_intercept': True, 'standardize_with_source': True, 'rho': 0.85}
[I 2026-06-01 23:11:30,243] Trial 223 finished with value: 0.22489725781580847 and parameters: {'alpha': 78717.3659063537, 'n_pcs': 4000, 'iw_method': 'pc_logistic', 'iw_clip_max': 2.5, 'iw_prob_clip': 0.035666183985396976, 'iw_n_components': 100, 'iw_logistic_c': 0.0001261423896629086, 'iw_pca_fit': 'combined', 'iw_solver': 'lbfgs', 'iw_rho': 0.85}. Best is trial 108 with value: 0.22594023894922968.
2026-06-01 23:11:30 | INFO | Trial 224 | outer=8 | alpha=1.017e+05 n_pcs=4000 (pc_topk) weight={'name': 'pc_logistic', 'floor': 1e-06, 'clip_max': 2.5, 'prob_clip': 0.03901881010869494, 'n_components': 100, 'logistic_c': 0.00012262723107076538, 'pca_fit': 'combined', 'solver': 'lbfgs', 'max_iter': 2000, 'fit_intercept': True, 'standardize_with_source': True, 'rho': 0.85}
[I 2026-06-01 23:11:44,437] Trial 224 finished with value: 0.22356051697983492 and parameters: {'alpha': 101672.13544506293, 'n_pcs': 4000, 'iw_method': 'pc_logistic', 'iw_clip_max': 2.5, 'iw_prob_clip': 0.03901881010869494, 'iw_n_components': 100, 'iw_logistic_c': 0.00012262723107076538, 'iw_pca_fit': 'combined', 'iw_solver': 'lbfgs', 'iw_rho': 0.85}. Best is trial 108 with value: 0.22594023894922968.
2026-06-01 23:11:44 | INFO | Trial 225 | outer=8 | alpha=8.185e+04 n_pcs=4000 (pc_topk) weight={'name': 'pc_logistic', 'floor': 1e-06, 'clip_max': 2.5, 'prob_clip': 0.03482469491055358, 'n_components': 100, 'logistic_c': 0.0001941675575504575, 'pca_fit': 'combined', 'solver': 'lbfgs', 'max_iter': 2000, 'fit_intercept': True, 'standardize_with_source': True, 'rho': 0.85}
[I 2026-06-01 23:12:00,013] Trial 225 finished with value: 0.22447338764710406 and parameters: {'alpha': 81845.11041845342, 'n_pcs': 4000, 'iw_method': 'pc_logistic', 'iw_clip_max': 2.5, 'iw_prob_clip': 0.03482469491055358, 'iw_n_components': 100, 'iw_logistic_c': 0.0001941675575504575, 'iw_pca_fit': 'combined', 'iw_solver': 'lbfgs', 'iw_rho': 0.85}. Best is trial 108 with value: 0.22594023894922968.
2026-06-01 23:12:00 | INFO | Trial 226 | outer=8 | alpha=6.527e+04 n_pcs=4000 (pc_topk) weight={'name': 'pc_logistic', 'floor': 1e-06, 'clip_max': 2.5, 'prob_clip': 0.03544430462859636, 'n_components': 100, 'logistic_c': 0.00011991771565814076, 'pca_fit': 'combined', 'solver': 'lbfgs', 'max_iter': 2000, 'fit_intercept': True, 'standardize_with_source': True, 'rho': 0.85}
[I 2026-06-01 23:12:14,520] Trial 226 finished with value: 0.22526752507870995 and parameters: {'alpha': 65272.11374727253, 'n_pcs': 4000, 'iw_method': 'pc_logistic', 'iw_clip_max': 2.5, 'iw_prob_clip': 0.03544430462859636, 'iw_n_components': 100, 'iw_logistic_c': 0.00011991771565814076, 'iw_pca_fit': 'combined', 'iw_solver': 'lbfgs', 'iw_rho': 0.85}. Best is trial 108 with value: 0.22594023894922968.
2026-06-01 23:12:14 | INFO | Trial 227 | outer=8 | alpha=6.487e+04 n_pcs=4000 (pc_topk) weight={'name': 'pc_logistic', 'floor': 1e-06, 'clip_max': 2.5, 'prob_clip': 0.03652453426675262, 'n_components': 100, 'logistic_c': 0.00010682082290072088, 'pca_fit': 'combined', 'solver': 'lbfgs', 'max_iter': 2000, 'fit_intercept': True, 'standardize_with_source': True, 'rho': 0.85}
[I 2026-06-01 23:12:28,158] Trial 227 finished with value: 0.22534288298465927 and parameters: {'alpha': 64866.94039164996, 'n_pcs': 4000, 'iw_method': 'pc_logistic', 'iw_clip_max': 2.5, 'iw_prob_clip': 0.03652453426675262, 'iw_n_components': 100, 'iw_logistic_c': 0.00010682082290072088, 'iw_pca_fit': 'combined', 'iw_solver': 'lbfgs', 'iw_rho': 0.85}. Best is trial 108 with value: 0.22594023894922968.
2026-06-01 23:12:28 | INFO | Trial 228 | outer=8 | alpha=6.683e+04 n_pcs=4000 (pc_topk) weight={'name': 'pc_logistic', 'floor': 1e-06, 'clip_max': 2.5, 'prob_clip': 0.03618157042596144, 'n_components': 100, 'logistic_c': 9.746629090889469e-05, 'pca_fit': 'combined', 'solver': 'lbfgs', 'max_iter': 2000, 'fit_intercept': True, 'standardize_with_source': True, 'rho': 0.85}
[I 2026-06-01 23:12:42,014] Trial 228 finished with value: 0.22545178872613297 and parameters: {'alpha': 66826.9182826319, 'n_pcs': 4000, 'iw_method': 'pc_logistic', 'iw_clip_max': 2.5, 'iw_prob_clip': 0.03618157042596144, 'iw_n_components': 100, 'iw_logistic_c': 9.746629090889469e-05, 'iw_pca_fit': 'combined', 'iw_solver': 'lbfgs', 'iw_rho': 0.85}. Best is trial 108 with value: 0.22594023894922968.
2026-06-01 23:12:42 | INFO | Trial 229 | outer=8 | alpha=6.530e+04 n_pcs=4000 (pc_topk) weight={'name': 'pc_logistic', 'floor': 1e-06, 'clip_max': 2.5, 'prob_clip': 0.035914177100759156, 'n_components': 60, 'logistic_c': 0.00020920770640729623, 'pca_fit': 'combined', 'solver': 'lbfgs', 'max_iter': 2000, 'fit_intercept': True, 'standardize_with_source': True, 'rho': 0.85}
[I 2026-06-01 23:12:56,732] Trial 229 finished with value: 0.22213348773757943 and parameters: {'alpha': 65301.21230455249, 'n_pcs': 4000, 'iw_method': 'pc_logistic', 'iw_clip_max': 2.5, 'iw_prob_clip': 0.035914177100759156, 'iw_n_components': 60, 'iw_logistic_c': 0.00020920770640729623, 'iw_pca_fit': 'combined', 'iw_solver': 'lbfgs', 'iw_rho': 0.85}. Best is trial 108 with value: 0.22594023894922968.
2026-06-01 23:12:56 | INFO | Trial 230 | outer=8 | alpha=5.385e+04 n_pcs=4000 (pc_topk) weight={'name': 'pc_logistic', 'floor': 1e-06, 'clip_max': 2.5, 'prob_clip': 0.03502966527183337, 'n_components': 100, 'logistic_c': 0.00010718442844357482, 'pca_fit': 'combined', 'solver': 'lbfgs', 'max_iter': 2000, 'fit_intercept': True, 'standardize_with_source': True, 'rho': 0.85}
[I 2026-06-01 23:13:10,607] Trial 230 finished with value: 0.22536452929086837 and parameters: {'alpha': 53845.62438670958, 'n_pcs': 4000, 'iw_method': 'pc_logistic', 'iw_clip_max': 2.5, 'iw_prob_clip': 0.03502966527183337, 'iw_n_components': 100, 'iw_logistic_c': 0.00010718442844357482, 'iw_pca_fit': 'combined', 'iw_solver': 'lbfgs', 'iw_rho': 0.85}. Best is trial 108 with value: 0.22594023894922968.
2026-06-01 23:13:10 | INFO | Trial 231 | outer=8 | alpha=5.721e+04 n_pcs=4000 (pc_topk) weight={'name': 'pc_logistic', 'floor': 1e-06, 'clip_max': 2.5, 'prob_clip': 0.03465161427217804, 'n_components': 100, 'logistic_c': 0.00010450248447327451, 'pca_fit': 'combined', 'solver': 'lbfgs', 'max_iter': 2000, 'fit_intercept': True, 'standardize_with_source': True, 'rho': 0.85}
[I 2026-06-01 23:13:24,368] Trial 231 finished with value: 0.22546521707949668 and parameters: {'alpha': 57208.11228581514, 'n_pcs': 4000, 'iw_method': 'pc_logistic', 'iw_clip_max': 2.5, 'iw_prob_clip': 0.03465161427217804, 'iw_n_components': 100, 'iw_logistic_c': 0.00010450248447327451, 'iw_pca_fit': 'combined', 'iw_solver': 'lbfgs', 'iw_rho': 0.85}. Best is trial 108 with value: 0.22594023894922968.
2026-06-01 23:13:24 | INFO | Trial 232 | outer=8 | alpha=5.537e+04 n_pcs=4000 (pc_topk) weight={'name': 'pc_logistic', 'floor': 1e-06, 'clip_max': 2.5, 'prob_clip': 0.03433705021040053, 'n_components': 100, 'logistic_c': 9.574093732974213e-05, 'pca_fit': 'combined', 'solver': 'lbfgs', 'max_iter': 2000, 'fit_intercept': True, 'standardize_with_source': True, 'rho': 0.85}
[I 2026-06-01 23:13:38,802] Trial 232 finished with value: 0.22557888223439632 and parameters: {'alpha': 55374.81493008514, 'n_pcs': 4000, 'iw_method': 'pc_logistic', 'iw_clip_max': 2.5, 'iw_prob_clip': 0.03433705021040053, 'iw_n_components': 100, 'iw_logistic_c': 9.574093732974213e-05, 'iw_pca_fit': 'combined', 'iw_solver': 'lbfgs', 'iw_rho': 0.85}. Best is trial 108 with value: 0.22594023894922968.
2026-06-01 23:13:38 | INFO | Trial 233 | outer=8 | alpha=5.131e+04 n_pcs=4000 (pc_topk) weight={'name': 'pc_logistic', 'floor': 1e-06, 'clip_max': 2.5, 'prob_clip': 0.03329070392685811, 'n_components': 100, 'logistic_c': 8.859180459902454e-05, 'pca_fit': 'combined', 'solver': 'lbfgs', 'max_iter': 2000, 'fit_intercept': True, 'standardize_with_source': True, 'rho': 0.85}
[I 2026-06-01 23:13:53,386] Trial 233 finished with value: 0.22562514428400599 and parameters: {'alpha': 51305.30061975724, 'n_pcs': 4000, 'iw_method': 'pc_logistic', 'iw_clip_max': 2.5, 'iw_prob_clip': 0.03329070392685811, 'iw_n_components': 100, 'iw_logistic_c': 8.859180459902454e-05, 'iw_pca_fit': 'combined', 'iw_solver': 'lbfgs', 'iw_rho': 0.85}. Best is trial 108 with value: 0.22594023894922968.
2026-06-01 23:13:53 | INFO | Trial 234 | outer=8 | alpha=4.966e+04 n_pcs=4000 (pc_topk) weight={'name': 'pc_logistic', 'floor': 1e-06, 'clip_max': 2.5, 'prob_clip': 0.03291959881155814, 'n_components': 100, 'logistic_c': 9.090929312405096e-05, 'pca_fit': 'combined', 'solver': 'lbfgs', 'max_iter': 2000, 'fit_intercept': True, 'standardize_with_source': True, 'rho': 0.85}
[I 2026-06-01 23:14:07,865] Trial 234 finished with value: 0.22554211455622294 and parameters: {'alpha': 49655.91371016782, 'n_pcs': 4000, 'iw_method': 'pc_logistic', 'iw_clip_max': 2.5, 'iw_prob_clip': 0.03291959881155814, 'iw_n_components': 100, 'iw_logistic_c': 9.090929312405096e-05, 'iw_pca_fit': 'combined', 'iw_solver': 'lbfgs', 'iw_rho': 0.85}. Best is trial 108 with value: 0.22594023894922968.
2026-06-01 23:14:07 | INFO | Trial 235 | outer=8 | alpha=4.818e+04 n_pcs=4000 (pc_topk) weight={'name': 'pc_logistic', 'floor': 1e-06, 'clip_max': 2.5, 'prob_clip': 0.03299071934851029, 'n_components': 100, 'logistic_c': 7.743061866487781e-05, 'pca_fit': 'combined', 'solver': 'lbfgs', 'max_iter': 2000, 'fit_intercept': True, 'standardize_with_source': True, 'rho': 0.85}
[I 2026-06-01 23:14:21,759] Trial 235 finished with value: 0.22571085132787375 and parameters: {'alpha': 48183.77719850116, 'n_pcs': 4000, 'iw_method': 'pc_logistic', 'iw_clip_max': 2.5, 'iw_prob_clip': 0.03299071934851029, 'iw_n_components': 100, 'iw_logistic_c': 7.743061866487781e-05, 'iw_pca_fit': 'combined', 'iw_solver': 'lbfgs', 'iw_rho': 0.85}. Best is trial 108 with value: 0.22594023894922968.
2026-06-01 23:14:21 | INFO | Trial 236 | outer=8 | alpha=4.885e+04 n_pcs=4000 (pc_topk) weight={'name': 'pc_logistic', 'floor': 1e-06, 'clip_max': 2.5, 'prob_clip': 0.03381736946874405, 'n_components': 10, 'logistic_c': 7.198024852977038e-05, 'pca_fit': 'combined', 'solver': 'lbfgs', 'max_iter': 2000, 'fit_intercept': True, 'standardize_with_source': True, 'rho': 0.85}
[I 2026-06-01 23:14:34,823] Trial 236 finished with value: 0.22289070580349915 and parameters: {'alpha': 48851.41204171724, 'n_pcs': 4000, 'iw_method': 'pc_logistic', 'iw_clip_max': 2.5, 'iw_prob_clip': 0.03381736946874405, 'iw_n_components': 10, 'iw_logistic_c': 7.198024852977038e-05, 'iw_pca_fit': 'combined', 'iw_solver': 'lbfgs', 'iw_rho': 0.85}. Best is trial 108 with value: 0.22594023894922968.
2026-06-01 23:14:34 | INFO | Trial 237 | outer=8 | alpha=4.423e+04 n_pcs=4000 (pc_topk) weight={'name': 'pc_logistic', 'floor': 1e-06, 'clip_max': 2.5, 'prob_clip': 0.03203079932527393, 'n_components': 100, 'logistic_c': 0.0001832721654760988, 'pca_fit': 'combined', 'solver': 'lbfgs', 'max_iter': 2000, 'fit_intercept': True, 'standardize_with_source': True, 'rho': 0.85}
[I 2026-06-01 23:14:49,783] Trial 237 finished with value: 0.22466741049656874 and parameters: {'alpha': 44228.712517759486, 'n_pcs': 4000, 'iw_method': 'pc_logistic', 'iw_clip_max': 2.5, 'iw_prob_clip': 0.03203079932527393, 'iw_n_components': 100, 'iw_logistic_c': 0.0001832721654760988, 'iw_pca_fit': 'combined', 'iw_solver': 'lbfgs', 'iw_rho': 0.85}. Best is trial 108 with value: 0.22594023894922968.
2026-06-01 23:14:49 | INFO | Trial 238 | outer=8 | alpha=5.270e+04 n_pcs=4000 (pc_topk) weight={'name': 'pc_logistic', 'floor': 1e-06, 'clip_max': 2.5, 'prob_clip': 0.03247584872303143, 'n_components': 100, 'logistic_c': 8.104515092601953e-05, 'pca_fit': 'combined', 'solver': 'lbfgs', 'max_iter': 2000, 'fit_intercept': True, 'standardize_with_source': True, 'rho': 0.85}
[I 2026-06-01 23:15:03,226] Trial 238 finished with value: 0.22584683829993363 and parameters: {'alpha': 52699.76495560795, 'n_pcs': 4000, 'iw_method': 'pc_logistic', 'iw_clip_max': 2.5, 'iw_prob_clip': 0.03247584872303143, 'iw_n_components': 100, 'iw_logistic_c': 8.104515092601953e-05, 'iw_pca_fit': 'combined', 'iw_solver': 'lbfgs', 'iw_rho': 0.85}. Best is trial 108 with value: 0.22594023894922968.
2026-06-01 23:15:03 | INFO | Trial 239 | outer=8 | alpha=5.197e+04 n_pcs=4000 (pc_topk) weight={'name': 'pc_logistic', 'floor': 1e-06, 'clip_max': 2.5, 'prob_clip': 0.03187191909697021, 'n_components': 100, 'logistic_c': 8.031193631533994e-05, 'pca_fit': 'combined', 'solver': 'lbfgs', 'max_iter': 2000, 'fit_intercept': True, 'standardize_with_source': True, 'rho': 0.85}
[I 2026-06-01 23:15:16,574] Trial 239 finished with value: 0.22584387701567882 and parameters: {'alpha': 51974.126009546104, 'n_pcs': 4000, 'iw_method': 'pc_logistic', 'iw_clip_max': 2.5, 'iw_prob_clip': 0.03187191909697021, 'iw_n_components': 100, 'iw_logistic_c': 8.031193631533994e-05, 'iw_pca_fit': 'combined', 'iw_solver': 'lbfgs', 'iw_rho': 0.85}. Best is trial 108 with value: 0.22594023894922968.
2026-06-01 23:15:16 | INFO | Trial 240 | outer=8 | alpha=3.747e+04 n_pcs=4000 (pc_topk) weight={'name': 'pc_logistic', 'floor': 1e-06, 'clip_max': 2.5, 'prob_clip': 0.03178483921321963, 'n_components': 80, 'logistic_c': 8.004922349792472e-05, 'pca_fit': 'combined', 'solver': 'lbfgs', 'max_iter': 2000, 'fit_intercept': True, 'standardize_with_source': True, 'rho': 0.85}
[I 2026-06-01 23:15:30,763] Trial 240 finished with value: 0.22356034544145081 and parameters: {'alpha': 37465.587017224076, 'n_pcs': 4000, 'iw_method': 'pc_logistic', 'iw_clip_max': 2.5, 'iw_prob_clip': 0.03178483921321963, 'iw_n_components': 80, 'iw_logistic_c': 8.004922349792472e-05, 'iw_pca_fit': 'combined', 'iw_solver': 'lbfgs', 'iw_rho': 0.85}. Best is trial 108 with value: 0.22594023894922968.
2026-06-01 23:15:30 | INFO | Trial 241 | outer=8 | alpha=5.007e+04 n_pcs=4000 (pc_topk) weight={'name': 'pc_logistic', 'floor': 1e-06, 'clip_max': 2.5, 'prob_clip': 0.03370262095970189, 'n_components': 100, 'logistic_c': 8.449090331192443e-05, 'pca_fit': 'combined', 'solver': 'lbfgs', 'max_iter': 2000, 'fit_intercept': True, 'standardize_with_source': True, 'rho': 0.85}
[I 2026-06-01 23:15:45,344] Trial 241 finished with value: 0.2256367065953683 and parameters: {'alpha': 50073.92559044357, 'n_pcs': 4000, 'iw_method': 'pc_logistic', 'iw_clip_max': 2.5, 'iw_prob_clip': 0.03370262095970189, 'iw_n_components': 100, 'iw_logistic_c': 8.449090331192443e-05, 'iw_pca_fit': 'combined', 'iw_solver': 'lbfgs', 'iw_rho': 0.85}. Best is trial 108 with value: 0.22594023894922968.
2026-06-01 23:15:45 | INFO | Trial 242 | outer=8 | alpha=5.067e+04 n_pcs=4000 (pc_topk) weight={'name': 'pc_logistic', 'floor': 1e-06, 'clip_max': 2.5, 'prob_clip': 0.034912389828243316, 'n_components': 100, 'logistic_c': 8.084748882141929e-05, 'pca_fit': 'combined', 'solver': 'lbfgs', 'max_iter': 2000, 'fit_intercept': True, 'standardize_with_source': True, 'rho': 0.85}
[I 2026-06-01 23:15:59,016] Trial 242 finished with value: 0.22570098594044583 and parameters: {'alpha': 50671.56989836655, 'n_pcs': 4000, 'iw_method': 'pc_logistic', 'iw_clip_max': 2.5, 'iw_prob_clip': 0.034912389828243316, 'iw_n_components': 100, 'iw_logistic_c': 8.084748882141929e-05, 'iw_pca_fit': 'combined', 'iw_solver': 'lbfgs', 'iw_rho': 0.85}. Best is trial 108 with value: 0.22594023894922968.
2026-06-01 23:15:59 | INFO | Trial 243 | outer=8 | alpha=5.063e+04 n_pcs=4000 (pc_topk) weight={'name': 'pc_logistic', 'floor': 1e-06, 'clip_max': 2.5, 'prob_clip': 0.03303883164466595, 'n_components': 100, 'logistic_c': 7.676805026710262e-05, 'pca_fit': 'combined', 'solver': 'lbfgs', 'max_iter': 2000, 'fit_intercept': True, 'standardize_with_source': True, 'rho': 0.85}
[I 2026-06-01 23:16:12,417] Trial 243 finished with value: 0.2258334348288272 and parameters: {'alpha': 50625.85079415714, 'n_pcs': 4000, 'iw_method': 'pc_logistic', 'iw_clip_max': 2.5, 'iw_prob_clip': 0.03303883164466595, 'iw_n_components': 100, 'iw_logistic_c': 7.676805026710262e-05, 'iw_pca_fit': 'combined', 'iw_solver': 'lbfgs', 'iw_rho': 0.85}. Best is trial 108 with value: 0.22594023894922968.
2026-06-01 23:16:12 | INFO | Trial 244 | outer=8 | alpha=4.080e+04 n_pcs=4000 (pc_topk) weight={'name': 'pc_logistic', 'floor': 1e-06, 'clip_max': 2.5, 'prob_clip': 0.03350703318042109, 'n_components': 100, 'logistic_c': 7.265980380889422e-05, 'pca_fit': 'combined', 'solver': 'lbfgs', 'max_iter': 2000, 'fit_intercept': True, 'standardize_with_source': True, 'rho': 0.85}
[I 2026-06-01 23:16:25,749] Trial 244 finished with value: 0.22520069674374552 and parameters: {'alpha': 40798.09160607508, 'n_pcs': 4000, 'iw_method': 'pc_logistic', 'iw_clip_max': 2.5, 'iw_prob_clip': 0.03350703318042109, 'iw_n_components': 100, 'iw_logistic_c': 7.265980380889422e-05, 'iw_pca_fit': 'combined', 'iw_solver': 'lbfgs', 'iw_rho': 0.85}. Best is trial 108 with value: 0.22594023894922968.
2026-06-01 23:16:25 | INFO | Trial 245 | outer=8 | alpha=4.451e+04 n_pcs=3500 (pc_topk) weight={'name': 'pc_logistic', 'floor': 1e-06, 'clip_max': 2.5, 'prob_clip': 0.03268910120844715, 'n_components': 100, 'logistic_c': 7.309632296150255e-05, 'pca_fit': 'combined', 'solver': 'lbfgs', 'max_iter': 2000, 'fit_intercept': True, 'standardize_with_source': True, 'rho': 0.85}
[I 2026-06-01 23:16:37,735] Trial 245 finished with value: 0.22245428808243606 and parameters: {'alpha': 44509.40862221561, 'n_pcs': 3500, 'iw_method': 'pc_logistic', 'iw_clip_max': 2.5, 'iw_prob_clip': 0.03268910120844715, 'iw_n_components': 100, 'iw_logistic_c': 7.309632296150255e-05, 'iw_pca_fit': 'combined', 'iw_solver': 'lbfgs', 'iw_rho': 0.85}. Best is trial 108 with value: 0.22594023894922968.
2026-06-01 23:16:37 | INFO | Trial 246 | outer=8 | alpha=5.085e+04 n_pcs=4000 (pc_topk) weight={'name': 'pc_logistic', 'floor': 1e-06, 'clip_max': 2.5, 'prob_clip': 0.033754708810744535, 'n_components': 100, 'logistic_c': 6.836607585859975e-05, 'pca_fit': 'combined', 'solver': 'lbfgs', 'max_iter': 2000, 'fit_intercept': True, 'standardize_with_source': True, 'rho': 0.85}
[I 2026-06-01 23:16:51,188] Trial 246 finished with value: 0.2259764472647919 and parameters: {'alpha': 50846.28475237425, 'n_pcs': 4000, 'iw_method': 'pc_logistic', 'iw_clip_max': 2.5, 'iw_prob_clip': 0.033754708810744535, 'iw_n_components': 100, 'iw_logistic_c': 6.836607585859975e-05, 'iw_pca_fit': 'combined', 'iw_solver': 'lbfgs', 'iw_rho': 0.85}. Best is trial 246 with value: 0.2259764472647919.
2026-06-01 23:16:51 | INFO | Trial 247 | outer=8 | alpha=4.136e+04 n_pcs=4000 (pc_topk) weight={'name': 'pc_logistic', 'floor': 1e-06, 'clip_max': 2.5, 'prob_clip': 0.033496586139214, 'n_components': 100, 'logistic_c': 4.598361265222778e-05, 'pca_fit': 'combined', 'solver': 'lbfgs', 'max_iter': 2000, 'fit_intercept': True, 'standardize_with_source': True, 'rho': 0.85}
