[I 2026-05-31 23:48:40,078] Trial 243 finished with value: 0.20859915992507636 and parameters: {'alpha': 182859.8772707085, 'n_pcs': 3000, 'weight_scheme': 'exponential', 'weight_clip_max': 3.0, 'weight_exponential_beta': 3.252120074250768}. Best is trial 191 with value: 0.20863437636832166.
2026-05-31 23:48:40 | INFO | src.nested_cv_avggrm_weighted_unified | Trial 244 | outer=3 | alpha=2.312e+05 n_pcs=3000 (pc_topk) weight_search=on
2026-05-31 23:48:40 | INFO | src.nested_cv_avggrm_weighted_unified | Trial 244 | outer=3 | weight={'name': 'exponential', 'floor': 1e-06, 'clip_max': 3.0, 'beta': 3.6671771767241252}
[I 2026-05-31 23:48:43,859] Trial 244 finished with value: 0.20819116996752135 and parameters: {'alpha': 231214.74813335488, 'n_pcs': 3000, 'weight_scheme': 'exponential', 'weight_clip_max': 3.0, 'weight_exponential_beta': 3.6671771767241252}. Best is trial 191 with value: 0.20863437636832166.
2026-05-31 23:48:43 | INFO | src.nested_cv_avggrm_weighted_unified | Trial 245 | outer=3 | alpha=1.472e+05 n_pcs=3000 (pc_topk) weight_search=on
2026-05-31 23:48:43 | INFO | src.nested_cv_avggrm_weighted_unified | Trial 245 | outer=3 | weight={'name': 'exponential', 'floor': 1e-06, 'clip_max': 3.0, 'beta': 3.24231613156358}
2026-05-31 23:48:46 | INFO | src.nested_cv_avggrm_weighted_unified | Trial 245 | outer=3 | pruned after 6/10 inner folds (mean r=0.2234)
[I 2026-05-31 23:48:46,167] Trial 245 pruned. 
2026-05-31 23:48:46 | INFO | src.nested_cv_avggrm_weighted_unified | Trial 246 | outer=3 | alpha=1.646e+05 n_pcs=3000 (pc_topk) weight_search=on
2026-05-31 23:48:46 | INFO | src.nested_cv_avggrm_weighted_unified | Trial 246 | outer=3 | weight={'name': 'exponential', 'floor': 1e-06, 'clip_max': 3.0, 'beta': 3.4468473427518695}
2026-05-31 23:48:48 | INFO | src.nested_cv_avggrm_weighted_unified | Trial 246 | outer=3 | pruned after 6/10 inner folds (mean r=0.2237)
[I 2026-05-31 23:48:48,459] Trial 246 pruned. 
2026-05-31 23:48:48 | INFO | src.nested_cv_avggrm_weighted_unified | Trial 247 | outer=3 | alpha=1.299e+05 n_pcs=3000 (pc_topk) weight_search=on
2026-05-31 23:48:48 | INFO | src.nested_cv_avggrm_weighted_unified | Trial 247 | outer=3 | weight={'name': 'exponential', 'floor': 1e-06, 'clip_max': 5.0, 'beta': 3.2203310588346543}
2026-05-31 23:48:51 | INFO | src.nested_cv_avggrm_weighted_unified | Trial 247 | outer=3 | pruned after 7/10 inner folds (mean r=0.2465)
[I 2026-05-31 23:48:51,176] Trial 247 pruned. 
2026-05-31 23:48:51 | INFO | src.nested_cv_avggrm_weighted_unified | Trial 248 | outer=3 | alpha=1.924e+05 n_pcs=1000 (pc_topk) weight_search=on
2026-05-31 23:48:51 | INFO | src.nested_cv_avggrm_weighted_unified | Trial 248 | outer=3 | weight={'name': 'exponential', 'floor': 1e-06, 'clip_max': 3.0, 'beta': 2.7845550372402683}
2026-05-31 23:48:52 | INFO | src.nested_cv_avggrm_weighted_unified | Trial 248 | outer=3 | pruned after 6/10 inner folds (mean r=0.2078)
[I 2026-05-31 23:48:52,925] Trial 248 pruned. 
2026-05-31 23:48:52 | INFO | src.nested_cv_avggrm_weighted_unified | Trial 249 | outer=3 | alpha=2.358e+05 n_pcs=3000 (pc_topk) weight_search=on
2026-05-31 23:48:52 | INFO | src.nested_cv_avggrm_weighted_unified | Trial 249 | outer=3 | weight={'name': 'exponential', 'floor': 1e-06, 'clip_max': 3.0, 'beta': 3.921524368351733}
[I 2026-05-31 23:48:56,903] Trial 249 finished with value: 0.20807464264664524 and parameters: {'alpha': 235834.28512641008, 'n_pcs': 3000, 'weight_scheme': 'exponential', 'weight_clip_max': 3.0, 'weight_exponential_beta': 3.921524368351733}. Best is trial 191 with value: 0.20863437636832166.
2026-05-31 23:48:56 | INFO | src.nested_cv_avggrm_weighted_unified | Trial 250 | outer=3 | alpha=1.628e+05 n_pcs=3000 (pc_topk) weight_search=on
2026-05-31 23:48:56 | INFO | src.nested_cv_avggrm_weighted_unified | Trial 250 | outer=3 | weight={'name': 'exponential', 'floor': 1e-06, 'clip_max': 3.0, 'beta': 3.1841398636018665}
2026-05-31 23:48:59 | INFO | src.nested_cv_avggrm_weighted_unified | Trial 250 | outer=3 | pruned after 6/10 inner folds (mean r=0.2239)
[I 2026-05-31 23:48:59,222] Trial 250 pruned. 
2026-05-31 23:48:59 | INFO | src.nested_cv_avggrm_weighted_unified | Trial 251 | outer=3 | alpha=1.949e+05 n_pcs=3000 (pc_topk) weight_search=on
2026-05-31 23:48:59 | INFO | src.nested_cv_avggrm_weighted_unified | Trial 251 | outer=3 | weight={'name': 'exponential', 'floor': 1e-06, 'clip_max': 3.0, 'beta': 3.573398998819099}
[I 2026-05-31 23:49:03,033] Trial 251 finished with value: 0.20842234770857543 and parameters: {'alpha': 194912.57167397282, 'n_pcs': 3000, 'weight_scheme': 'exponential', 'weight_clip_max': 3.0, 'weight_exponential_beta': 3.573398998819099}. Best is trial 191 with value: 0.20863437636832166.
2026-05-31 23:49:03 | INFO | src.nested_cv_avggrm_weighted_unified | Trial 252 | outer=3 | alpha=5.294e+03 n_pcs=3000 (pc_topk) weight_search=on
2026-05-31 23:49:03 | INFO | src.nested_cv_avggrm_weighted_unified | Trial 252 | outer=3 | weight={'name': 'exponential', 'floor': 1e-06, 'clip_max': 3.0, 'beta': 2.8883055265000346}
2026-05-31 23:49:05 | INFO | src.nested_cv_avggrm_weighted_unified | Trial 252 | outer=3 | pruned after 6/10 inner folds (mean r=0.1607)
[I 2026-05-31 23:49:05,355] Trial 252 pruned. 
2026-05-31 23:49:05 | INFO | src.nested_cv_avggrm_weighted_unified | Trial 253 | outer=3 | alpha=1.431e+05 n_pcs=3000 (pc_topk) weight_search=on
2026-05-31 23:49:05 | INFO | src.nested_cv_avggrm_weighted_unified | Trial 253 | outer=3 | weight={'name': 'exponential', 'floor': 1e-06, 'clip_max': 10.0, 'beta': 2.347889448800826}
2026-05-31 23:49:07 | INFO | src.nested_cv_avggrm_weighted_unified | Trial 253 | outer=3 | pruned after 6/10 inner folds (mean r=0.2217)
[I 2026-05-31 23:49:07,646] Trial 253 pruned. 
2026-05-31 23:49:07 | INFO | src.nested_cv_avggrm_weighted_unified | Trial 254 | outer=3 | alpha=1.036e+05 n_pcs=500 (pc_topk) weight_search=on
2026-05-31 23:49:07 | INFO | src.nested_cv_avggrm_weighted_unified | Trial 254 | outer=3 | weight={'name': 'exponential', 'floor': 1e-06, 'clip_max': 3.0, 'beta': 2.574412383427013}
2026-05-31 23:49:08 | INFO | src.nested_cv_avggrm_weighted_unified | Trial 254 | outer=3 | pruned after 5/10 inner folds (mean r=0.1409)
[I 2026-05-31 23:49:08,119] Trial 254 pruned. 
2026-05-31 23:49:08 | INFO | src.nested_cv_avggrm_weighted_unified | Trial 255 | outer=3 | alpha=1.303e+05 n_pcs=3000 (pc_topk) weight_search=on
2026-05-31 23:49:08 | INFO | src.nested_cv_avggrm_weighted_unified | Trial 255 | outer=3 | weight={'name': 'exponential', 'floor': 1e-06, 'clip_max': 3.0, 'beta': 3.3704580177541112}
2026-05-31 23:49:10 | INFO | src.nested_cv_avggrm_weighted_unified | Trial 255 | outer=3 | pruned after 6/10 inner folds (mean r=0.2226)
[I 2026-05-31 23:49:10,964] Trial 255 pruned. 
2026-05-31 23:49:10 | INFO | src.nested_cv_avggrm_weighted_unified | Trial 256 | outer=3 | alpha=1.728e+05 n_pcs=3000 (pc_topk) weight_search=on
2026-05-31 23:49:10 | INFO | src.nested_cv_avggrm_weighted_unified | Trial 256 | outer=3 | weight={'name': 'exponential', 'floor': 1e-06, 'clip_max': 3.0, 'beta': 3.0760432605918426}
[I 2026-05-31 23:49:15,345] Trial 256 finished with value: 0.2085694285288504 and parameters: {'alpha': 172773.8929130819, 'n_pcs': 3000, 'weight_scheme': 'exponential', 'weight_clip_max': 3.0, 'weight_exponential_beta': 3.0760432605918426}. Best is trial 191 with value: 0.20863437636832166.
2026-05-31 23:49:15 | INFO | src.nested_cv_avggrm_weighted_unified | Trial 257 | outer=3 | alpha=2.306e+05 n_pcs=3500 (pc_topk) weight_search=on
2026-05-31 23:49:15 | INFO | src.nested_cv_avggrm_weighted_unified | Trial 257 | outer=3 | weight={'name': 'exponential', 'floor': 1e-06, 'clip_max': 3.0, 'beta': 3.1793781210744676}
2026-05-31 23:49:18 | INFO | src.nested_cv_avggrm_weighted_unified | Trial 257 | outer=3 | pruned after 6/10 inner folds (mean r=0.2221)
[I 2026-05-31 23:49:18,274] Trial 257 pruned. 
2026-05-31 23:49:18 | INFO | src.nested_cv_avggrm_weighted_unified | Trial 258 | outer=3 | alpha=2.011e+05 n_pcs=3000 (pc_topk) weight_search=on
2026-05-31 23:49:18 | INFO | src.nested_cv_avggrm_weighted_unified | Trial 258 | outer=3 | weight={'name': 'exponential', 'floor': 1e-06, 'clip_max': 3.0, 'beta': 2.8374140856587062}
[I 2026-05-31 23:49:22,051] Trial 258 finished with value: 0.20821928820405966 and parameters: {'alpha': 201144.0400283255, 'n_pcs': 3000, 'weight_scheme': 'exponential', 'weight_clip_max': 3.0, 'weight_exponential_beta': 2.8374140856587062}. Best is trial 191 with value: 0.20863437636832166.
2026-05-31 23:49:22 | INFO | src.nested_cv_avggrm_weighted_unified | Trial 259 | outer=3 | alpha=1.557e+05 n_pcs=3000 (pc_topk) weight_search=on
2026-05-31 23:49:22 | INFO | src.nested_cv_avggrm_weighted_unified | Trial 259 | outer=3 | weight={'name': 'uniform', 'floor': 1e-06, 'clip_max': 3.0}
2026-05-31 23:49:23 | INFO | src.nested_cv_avggrm_weighted_unified | Trial 259 | outer=3 | pruned after 6/10 inner folds (mean r=0.2146)
[I 2026-05-31 23:49:23,913] Trial 259 pruned. 
2026-05-31 23:49:23 | INFO | src.nested_cv_avggrm_weighted_unified | Trial 260 | outer=3 | alpha=1.153e+05 n_pcs=3000 (pc_topk) weight_search=on
2026-05-31 23:49:23 | INFO | src.nested_cv_avggrm_weighted_unified | Trial 260 | outer=3 | weight={'name': 'exponential', 'floor': 1e-06, 'clip_max': 3.0, 'beta': 1.1239076163051336}
2026-05-31 23:49:26 | INFO | src.nested_cv_avggrm_weighted_unified | Trial 260 | outer=3 | pruned after 6/10 inner folds (mean r=0.2215)
[I 2026-05-31 23:49:26,236] Trial 260 pruned. 
2026-05-31 23:49:26 | INFO | src.nested_cv_avggrm_weighted_unified | Trial 261 | outer=3 | alpha=1.828e+05 n_pcs=3000 (pc_topk) weight_search=on
2026-05-31 23:49:26 | INFO | src.nested_cv_avggrm_weighted_unified | Trial 261 | outer=3 | weight={'name': 'exponential', 'floor': 1e-06, 'clip_max': 3.0, 'beta': 3.502311516507075}
[I 2026-05-31 23:49:30,063] Trial 261 finished with value: 0.20850796514923084 and parameters: {'alpha': 182752.0578121629, 'n_pcs': 3000, 'weight_scheme': 'exponential', 'weight_clip_max': 3.0, 'weight_exponential_beta': 3.502311516507075}. Best is trial 191 with value: 0.20863437636832166.
2026-05-31 23:49:30 | INFO | src.nested_cv_avggrm_weighted_unified | Trial 262 | outer=3 | alpha=1.402e+05 n_pcs=3000 (pc_topk) weight_search=on
2026-05-31 23:49:30 | INFO | src.nested_cv_avggrm_weighted_unified | Trial 262 | outer=3 | weight={'name': 'exponential', 'floor': 1e-06, 'clip_max': 3.0, 'beta': 3.0529445343318047}
2026-05-31 23:49:32 | INFO | src.nested_cv_avggrm_weighted_unified | Trial 262 | outer=3 | pruned after 6/10 inner folds (mean r=0.2232)
[I 2026-05-31 23:49:32,359] Trial 262 pruned. 
2026-05-31 23:49:32 | INFO | src.nested_cv_avggrm_weighted_unified | Trial 263 | outer=3 | alpha=2.093e+03 n_pcs=3500 (pc_topk) weight_search=on
2026-05-31 23:49:32 | INFO | src.nested_cv_avggrm_weighted_unified | Trial 263 | outer=3 | weight={'name': 'exponential', 'floor': 1e-06, 'clip_max': 3.0, 'beta': 6.294291369517126}
2026-05-31 23:49:34 | INFO | src.nested_cv_avggrm_weighted_unified | Trial 263 | outer=3 | pruned after 5/10 inner folds (mean r=0.1344)
[I 2026-05-31 23:49:34,745] Trial 263 pruned. 
2026-05-31 23:49:34 | INFO | src.nested_cv_avggrm_weighted_unified | Trial 264 | outer=3 | alpha=2.548e+05 n_pcs=3000 (pc_topk) weight_search=on
2026-05-31 23:49:34 | INFO | src.nested_cv_avggrm_weighted_unified | Trial 264 | outer=3 | weight={'name': 'exponential', 'floor': 1e-06, 'clip_max': 3.0, 'beta': 3.32774681593082}
[I 2026-05-31 23:49:38,445] Trial 264 finished with value: 0.20811961856655223 and parameters: {'alpha': 254842.9777876199, 'n_pcs': 3000, 'weight_scheme': 'exponential', 'weight_clip_max': 3.0, 'weight_exponential_beta': 3.32774681593082}. Best is trial 191 with value: 0.20863437636832166.
2026-05-31 23:49:38 | INFO | src.nested_cv_avggrm_weighted_unified | Trial 265 | outer=3 | alpha=8.399e+04 n_pcs=3000 (pc_topk) weight_search=on
2026-05-31 23:49:38 | INFO | src.nested_cv_avggrm_weighted_unified | Trial 265 | outer=3 | weight={'name': 'exponential', 'floor': 1e-06, 'clip_max': 3.0, 'beta': 3.737061341766659}
2026-05-31 23:49:40 | INFO | src.nested_cv_avggrm_weighted_unified | Trial 265 | outer=3 | pruned after 6/10 inner folds (mean r=0.2188)
[I 2026-05-31 23:49:40,681] Trial 265 pruned. 
2026-05-31 23:49:40 | INFO | src.nested_cv_avggrm_weighted_unified | Trial 266 | outer=3 | alpha=1.698e+05 n_pcs=3000 (pc_topk) weight_search=on
2026-05-31 23:49:40 | INFO | src.nested_cv_avggrm_weighted_unified | Trial 266 | outer=3 | weight={'name': 'exponential', 'floor': 1e-06, 'clip_max': 3.0, 'beta': 2.650806403906805}
[I 2026-05-31 23:49:44,387] Trial 266 finished with value: 0.20821576499833974 and parameters: {'alpha': 169770.62177707822, 'n_pcs': 3000, 'weight_scheme': 'exponential', 'weight_clip_max': 3.0, 'weight_exponential_beta': 2.650806403906805}. Best is trial 191 with value: 0.20863437636832166.
2026-05-31 23:49:44 | INFO | src.nested_cv_avggrm_weighted_unified | Trial 267 | outer=3 | alpha=2.125e+05 n_pcs=3000 (pc_topk) weight_search=on
2026-05-31 23:49:44 | INFO | src.nested_cv_avggrm_weighted_unified | Trial 267 | outer=3 | weight={'name': 'exponential', 'floor': 1e-06, 'clip_max': 3.0, 'beta': 3.068767188675051}
[I 2026-05-31 23:49:48,153] Trial 267 finished with value: 0.2083791719854396 and parameters: {'alpha': 212524.2265436834, 'n_pcs': 3000, 'weight_scheme': 'exponential', 'weight_clip_max': 3.0, 'weight_exponential_beta': 3.068767188675051}. Best is trial 191 with value: 0.20863437636832166.
2026-05-31 23:49:48 | INFO | src.nested_cv_avggrm_weighted_unified | Trial 268 | outer=3 | alpha=1.286e+05 n_pcs=3000 (pc_topk) weight_search=on
2026-05-31 23:49:48 | INFO | src.nested_cv_avggrm_weighted_unified | Trial 268 | outer=3 | weight={'name': 'exponential', 'floor': 1e-06, 'clip_max': 3.0, 'beta': 3.3000946808260125}
2026-05-31 23:49:50 | INFO | src.nested_cv_avggrm_weighted_unified | Trial 268 | outer=3 | pruned after 6/10 inner folds (mean r=0.2226)
[I 2026-05-31 23:49:50,405] Trial 268 pruned. 
2026-05-31 23:49:50 | INFO | src.nested_cv_avggrm_weighted_unified | Trial 269 | outer=3 | alpha=4.551e+06 n_pcs=3000 (pc_topk) weight_search=on
2026-05-31 23:49:50 | INFO | src.nested_cv_avggrm_weighted_unified | Trial 269 | outer=3 | weight={'name': 'exponential', 'floor': 1e-06, 'clip_max': None, 'beta': 2.906897434072793}
2026-05-31 23:49:52 | INFO | src.nested_cv_avggrm_weighted_unified | Trial 269 | outer=3 | pruned after 6/10 inner folds (mean r=0.2189)
[I 2026-05-31 23:49:52,631] Trial 269 pruned. 
2026-05-31 23:49:52 | INFO | src.nested_cv_avggrm_weighted_unified | Trial 270 | outer=3 | alpha=1.570e+05 n_pcs=3000 (pc_topk) weight_search=on
2026-05-31 23:49:52 | INFO | src.nested_cv_avggrm_weighted_unified | Trial 270 | outer=3 | weight={'name': 'exponential', 'floor': 1e-06, 'clip_max': 3.0, 'beta': 3.573626701505767}
2026-05-31 23:49:54 | INFO | src.nested_cv_avggrm_weighted_unified | Trial 270 | outer=3 | pruned after 6/10 inner folds (mean r=0.2234)
[I 2026-05-31 23:49:54,895] Trial 270 pruned. 
2026-05-31 23:49:54 | INFO | src.nested_cv_avggrm_weighted_unified | Trial 271 | outer=3 | alpha=1.082e+05 n_pcs=3000 (pc_topk) weight_search=on
2026-05-31 23:49:54 | INFO | src.nested_cv_avggrm_weighted_unified | Trial 271 | outer=3 | weight={'name': 'exponential', 'floor': 1e-06, 'clip_max': 5.0, 'beta': 3.13029213555378}
2026-05-31 23:49:57 | INFO | src.nested_cv_avggrm_weighted_unified | Trial 271 | outer=3 | pruned after 7/10 inner folds (mean r=0.2451)
[I 2026-05-31 23:49:57,510] Trial 271 pruned. 
2026-05-31 23:49:57 | INFO | src.nested_cv_avggrm_weighted_unified | Trial 272 | outer=3 | alpha=1.946e+05 n_pcs=3000 (pc_topk) weight_search=on
2026-05-31 23:49:57 | INFO | src.nested_cv_avggrm_weighted_unified | Trial 272 | outer=3 | weight={'name': 'exponential', 'floor': 1e-06, 'clip_max': 3.0, 'beta': 2.7136753325777825}
[I 2026-05-31 23:50:01,252] Trial 272 finished with value: 0.2081694403382793 and parameters: {'alpha': 194595.16075365682, 'n_pcs': 3000, 'weight_scheme': 'exponential', 'weight_clip_max': 3.0, 'weight_exponential_beta': 2.7136753325777825}. Best is trial 191 with value: 0.20863437636832166.
2026-05-31 23:50:01 | INFO | src.nested_cv_avggrm_weighted_unified | Trial 273 | outer=3 | alpha=2.443e+05 n_pcs=3500 (pc_topk) weight_search=on
2026-05-31 23:50:01 | INFO | src.nested_cv_avggrm_weighted_unified | Trial 273 | outer=3 | weight={'name': 'exponential', 'floor': 1e-06, 'clip_max': 3.0, 'beta': 3.365264947402329}
2026-05-31 23:50:04 | INFO | src.nested_cv_avggrm_weighted_unified | Trial 273 | outer=3 | pruned after 6/10 inner folds (mean r=0.2221)
[I 2026-05-31 23:50:04,099] Trial 273 pruned. 
2026-05-31 23:50:04 | INFO | src.nested_cv_avggrm_weighted_unified | Trial 274 | outer=3 | alpha=1.470e+05 n_pcs=3000 (pc_topk) weight_search=on
2026-05-31 23:50:04 | INFO | src.nested_cv_avggrm_weighted_unified | Trial 274 | outer=3 | weight={'name': 'exponential', 'floor': 1e-06, 'clip_max': 3.0, 'beta': 2.9073968371367926}
2026-05-31 23:50:06 | INFO | src.nested_cv_avggrm_weighted_unified | Trial 274 | outer=3 | pruned after 6/10 inner folds (mean r=0.2235)
[I 2026-05-31 23:50:06,395] Trial 274 pruned. 
2026-05-31 23:50:06 | INFO | src.nested_cv_avggrm_weighted_unified | Trial 275 | outer=3 | alpha=1.864e+05 n_pcs=3000 (pc_topk) weight_search=on
2026-05-31 23:50:06 | INFO | src.nested_cv_avggrm_weighted_unified | Trial 275 | outer=3 | weight={'name': 'exponential', 'floor': 1e-06, 'clip_max': 3.0, 'beta': 3.0931992112969593}
[I 2026-05-31 23:50:10,129] Trial 275 finished with value: 0.2085422698034593 and parameters: {'alpha': 186386.14783690966, 'n_pcs': 3000, 'weight_scheme': 'exponential', 'weight_clip_max': 3.0, 'weight_exponential_beta': 3.0931992112969593}. Best is trial 191 with value: 0.20863437636832166.
2026-05-31 23:50:10 | INFO | src.nested_cv_avggrm_weighted_unified | Trial 276 | outer=3 | alpha=2.737e+05 n_pcs=2500 (pc_topk) weight_search=on
2026-05-31 23:50:10 | INFO | src.nested_cv_avggrm_weighted_unified | Trial 276 | outer=3 | weight={'name': 'exponential', 'floor': 1e-06, 'clip_max': 3.0, 'beta': 3.1928950477342557}
[I 2026-05-31 23:50:13,044] Trial 276 finished with value: 0.2083737551215942 and parameters: {'alpha': 273677.3815794592, 'n_pcs': 2500, 'weight_scheme': 'exponential', 'weight_clip_max': 3.0, 'weight_exponential_beta': 3.1928950477342557}. Best is trial 191 with value: 0.20863437636832166.
2026-05-31 23:50:13 | INFO | src.nested_cv_avggrm_weighted_unified | Trial 277 | outer=3 | alpha=1.901e+05 n_pcs=3000 (pc_topk) weight_search=on
2026-05-31 23:50:13 | INFO | src.nested_cv_avggrm_weighted_unified | Trial 277 | outer=3 | weight={'name': 'exponential', 'floor': 1e-06, 'clip_max': 10.0, 'beta': 5.542184664816525}
2026-05-31 23:50:15 | INFO | src.nested_cv_avggrm_weighted_unified | Trial 277 | outer=3 | pruned after 6/10 inner folds (mean r=0.2143)
[I 2026-05-31 23:50:15,277] Trial 277 pruned. 
2026-05-31 23:50:15 | INFO | src.nested_cv_avggrm_weighted_unified | Trial 278 | outer=3 | alpha=2.215e+05 n_pcs=3000 (pc_topk) weight_search=on
2026-05-31 23:50:15 | INFO | src.nested_cv_avggrm_weighted_unified | Trial 278 | outer=3 | weight={'name': 'exponential', 'floor': 1e-06, 'clip_max': 3.0, 'beta': 3.5180514927161264}
[I 2026-05-31 23:50:19,053] Trial 278 finished with value: 0.20830821300231653 and parameters: {'alpha': 221490.0239170676, 'n_pcs': 3000, 'weight_scheme': 'exponential', 'weight_clip_max': 3.0, 'weight_exponential_beta': 3.5180514927161264}. Best is trial 191 with value: 0.20863437636832166.
2026-05-31 23:50:19 | INFO | src.nested_cv_avggrm_weighted_unified | Trial 279 | outer=3 | alpha=1.798e+05 n_pcs=3000 (pc_topk) weight_search=on
2026-05-31 23:50:19 | INFO | src.nested_cv_avggrm_weighted_unified | Trial 279 | outer=3 | weight={'name': 'exponential', 'floor': 1e-06, 'clip_max': 3.0, 'beta': 3.0529604791785583}
[I 2026-05-31 23:50:22,847] Trial 279 finished with value: 0.20853723127724422 and parameters: {'alpha': 179800.93389900491, 'n_pcs': 3000, 'weight_scheme': 'exponential', 'weight_clip_max': 3.0, 'weight_exponential_beta': 3.0529604791785583}. Best is trial 191 with value: 0.20863437636832166.
2026-05-31 23:50:22 | INFO | src.nested_cv_avggrm_weighted_unified | Trial 280 | outer=3 | alpha=1.806e+05 n_pcs=3000 (pc_topk) weight_search=on
2026-05-31 23:50:22 | INFO | src.nested_cv_avggrm_weighted_unified | Trial 280 | outer=3 | weight={'name': 'exponential', 'floor': 1e-06, 'clip_max': 3.0, 'beta': 3.2695263015444107}
[I 2026-05-31 23:50:26,657] Trial 280 finished with value: 0.2086000552910678 and parameters: {'alpha': 180596.40357000194, 'n_pcs': 3000, 'weight_scheme': 'exponential', 'weight_clip_max': 3.0, 'weight_exponential_beta': 3.2695263015444107}. Best is trial 191 with value: 0.20863437636832166.
2026-05-31 23:50:26 | INFO | src.nested_cv_avggrm_weighted_unified | Trial 281 | outer=3 | alpha=1.266e+05 n_pcs=3000 (pc_topk) weight_search=on
2026-05-31 23:50:26 | INFO | src.nested_cv_avggrm_weighted_unified | Trial 281 | outer=3 | weight={'name': 'uniform', 'floor': 1e-06, 'clip_max': 3.0}
2026-05-31 23:50:28 | INFO | src.nested_cv_avggrm_weighted_unified | Trial 281 | outer=3 | pruned after 6/10 inner folds (mean r=0.2149)
[I 2026-05-31 23:50:28,492] Trial 281 pruned. 
2026-05-31 23:50:28 | INFO | src.nested_cv_avggrm_weighted_unified | Trial 282 | outer=3 | alpha=2.364e+05 n_pcs=3000 (pc_topk) weight_search=on
2026-05-31 23:50:28 | INFO | src.nested_cv_avggrm_weighted_unified | Trial 282 | outer=3 | weight={'name': 'exponential', 'floor': 1e-06, 'clip_max': 3.0, 'beta': 3.778740270542594}
