[I 2026-06-01 18:01:33,630] Trial 217 finished with value: 0.1909455106995817 and parameters: {'alpha': 86846.12648290354, 'n_pcs': 4500, 'iw_method': 'pc_logistic', 'iw_clip_max': 4.0, 'iw_prob_clip': 0.027904751637670838, 'iw_n_components': 100, 'iw_logistic_c': 0.0014887444640558556, 'iw_pca_fit': 'combined', 'iw_solver': 'lbfgs', 'iw_rho': 1.0}. Best is trial 203 with value: 0.20096057737722944.
2026-06-01 18:01:33 | INFO | Trial 218 | outer=4 | alpha=1.032e+05 n_pcs=4500 (pc_topk) weight={'name': 'pc_logistic', 'floor': 1e-06, 'clip_max': 4.0, 'prob_clip': 0.029663261313168238, 'n_components': 100, 'logistic_c': 1.2275214438917527e-05, 'pca_fit': 'combined', 'solver': 'lbfgs', 'max_iter': 2000, 'fit_intercept': True, 'standardize_with_source': True, 'rho': 1.0}
[I 2026-06-01 18:01:49,134] Trial 218 finished with value: 0.20047772815432138 and parameters: {'alpha': 103180.91196691127, 'n_pcs': 4500, 'iw_method': 'pc_logistic', 'iw_clip_max': 4.0, 'iw_prob_clip': 0.029663261313168238, 'iw_n_components': 100, 'iw_logistic_c': 1.2275214438917527e-05, 'iw_pca_fit': 'combined', 'iw_solver': 'lbfgs', 'iw_rho': 1.0}. Best is trial 203 with value: 0.20096057737722944.
2026-06-01 18:01:49 | INFO | Trial 219 | outer=4 | alpha=1.061e+05 n_pcs=4500 (pc_topk) weight={'name': 'pc_logistic', 'floor': 1e-06, 'clip_max': 4.0, 'prob_clip': 0.03306288667803907, 'n_components': 100, 'logistic_c': 4.400434884581871e-06, 'pca_fit': 'combined', 'solver': 'lbfgs', 'max_iter': 2000, 'fit_intercept': True, 'standardize_with_source': True, 'rho': 1.0}
[I 2026-06-01 18:02:06,509] Trial 219 finished with value: 0.19440926908774353 and parameters: {'alpha': 106125.61885268874, 'n_pcs': 4500, 'iw_method': 'pc_logistic', 'iw_clip_max': 4.0, 'iw_prob_clip': 0.03306288667803907, 'iw_n_components': 100, 'iw_logistic_c': 4.400434884581871e-06, 'iw_pca_fit': 'combined', 'iw_solver': 'lbfgs', 'iw_rho': 1.0}. Best is trial 203 with value: 0.20096057737722944.
2026-06-01 18:02:06 | INFO | Trial 220 | outer=4 | alpha=9.705e+04 n_pcs=4000 (pc_topk) weight={'name': 'uniform'}
[I 2026-06-01 18:02:14,276] Trial 220 finished with value: 0.18818555546212543 and parameters: {'alpha': 97046.24349602648, 'n_pcs': 4000, 'iw_method': 'uniform'}. Best is trial 203 with value: 0.20096057737722944.
2026-06-01 18:02:14 | INFO | Trial 221 | outer=4 | alpha=9.929e+06 n_pcs=4500 (pc_topk) weight={'name': 'pc_logistic', 'floor': 1e-06, 'clip_max': 4.0, 'prob_clip': 0.029108173106494783, 'n_components': 100, 'logistic_c': 1.3530215933226131e-05, 'pca_fit': 'combined', 'solver': 'lbfgs', 'max_iter': 2000, 'fit_intercept': True, 'standardize_with_source': True, 'rho': 1.0}
[I 2026-06-01 18:02:29,540] Trial 221 finished with value: 0.18122539728234593 and parameters: {'alpha': 9928971.189526226, 'n_pcs': 4500, 'iw_method': 'pc_logistic', 'iw_clip_max': 4.0, 'iw_prob_clip': 0.029108173106494783, 'iw_n_components': 100, 'iw_logistic_c': 1.3530215933226131e-05, 'iw_pca_fit': 'combined', 'iw_solver': 'lbfgs', 'iw_rho': 1.0}. Best is trial 203 with value: 0.20096057737722944.
2026-06-01 18:02:29 | INFO | Trial 222 | outer=4 | alpha=7.958e+04 n_pcs=4500 (pc_topk) weight={'name': 'pc_logistic', 'floor': 1e-06, 'clip_max': 4.0, 'prob_clip': 0.02679566945685029, 'n_components': 100, 'logistic_c': 1.091972313217739e-05, 'pca_fit': 'combined', 'solver': 'lbfgs', 'max_iter': 2000, 'fit_intercept': True, 'standardize_with_source': True, 'rho': 1.0}
[I 2026-06-01 18:02:44,392] Trial 222 finished with value: 0.20035683032722593 and parameters: {'alpha': 79584.63687238895, 'n_pcs': 4500, 'iw_method': 'pc_logistic', 'iw_clip_max': 4.0, 'iw_prob_clip': 0.02679566945685029, 'iw_n_components': 100, 'iw_logistic_c': 1.091972313217739e-05, 'iw_pca_fit': 'combined', 'iw_solver': 'lbfgs', 'iw_rho': 1.0}. Best is trial 203 with value: 0.20096057737722944.
2026-06-01 18:02:44 | INFO | Trial 223 | outer=4 | alpha=8.218e+04 n_pcs=4500 (pc_topk) weight={'name': 'pc_logistic', 'floor': 1e-06, 'clip_max': 4.0, 'prob_clip': 0.02685616154247728, 'n_components': 100, 'logistic_c': 9.721075884011132e-06, 'pca_fit': 'combined', 'solver': 'lbfgs', 'max_iter': 2000, 'fit_intercept': True, 'standardize_with_source': True, 'rho': 1.0}
[I 2026-06-01 18:02:59,119] Trial 223 finished with value: 0.19976073834165492 and parameters: {'alpha': 82184.89109970254, 'n_pcs': 4500, 'iw_method': 'pc_logistic', 'iw_clip_max': 4.0, 'iw_prob_clip': 0.02685616154247728, 'iw_n_components': 100, 'iw_logistic_c': 9.721075884011132e-06, 'iw_pca_fit': 'combined', 'iw_solver': 'lbfgs', 'iw_rho': 1.0}. Best is trial 203 with value: 0.20096057737722944.
2026-06-01 18:02:59 | INFO | Trial 224 | outer=4 | alpha=1.089e+05 n_pcs=4500 (pc_topk) weight={'name': 'pc_logistic', 'floor': 1e-06, 'clip_max': 1.5, 'prob_clip': 0.026695644278369925, 'n_components': 100, 'logistic_c': 1.2537926454914505e-05, 'pca_fit': 'combined', 'solver': 'lbfgs', 'max_iter': 2000, 'fit_intercept': True, 'standardize_with_source': True, 'rho': 1.0}
[I 2026-06-01 18:03:15,180] Trial 224 finished with value: 0.19583344904717082 and parameters: {'alpha': 108879.50859388668, 'n_pcs': 4500, 'iw_method': 'pc_logistic', 'iw_clip_max': 1.5, 'iw_prob_clip': 0.026695644278369925, 'iw_n_components': 100, 'iw_logistic_c': 1.2537926454914505e-05, 'iw_pca_fit': 'combined', 'iw_solver': 'lbfgs', 'iw_rho': 1.0}. Best is trial 203 with value: 0.20096057737722944.
2026-06-01 18:03:15 | INFO | Trial 225 | outer=4 | alpha=8.345e+04 n_pcs=4500 (pc_topk) weight={'name': 'pc_logistic', 'floor': 1e-06, 'clip_max': 4.0, 'prob_clip': 0.023069332045238294, 'n_components': 100, 'logistic_c': 9.089517340618931e-06, 'pca_fit': 'combined', 'solver': 'lbfgs', 'max_iter': 2000, 'fit_intercept': True, 'standardize_with_source': True, 'rho': 1.0}
[I 2026-06-01 18:03:30,864] Trial 225 finished with value: 0.1991968879912102 and parameters: {'alpha': 83448.36901297557, 'n_pcs': 4500, 'iw_method': 'pc_logistic', 'iw_clip_max': 4.0, 'iw_prob_clip': 0.023069332045238294, 'iw_n_components': 100, 'iw_logistic_c': 9.089517340618931e-06, 'iw_pca_fit': 'combined', 'iw_solver': 'lbfgs', 'iw_rho': 1.0}. Best is trial 203 with value: 0.20096057737722944.
2026-06-01 18:03:30 | INFO | Trial 226 | outer=4 | alpha=6.170e+04 n_pcs=4500 (pc_topk) weight={'name': 'pc_logistic', 'floor': 1e-06, 'clip_max': 4.0, 'prob_clip': 0.03323195115801551, 'n_components': 100, 'logistic_c': 6.0508886905845995e-06, 'pca_fit': 'combined', 'solver': 'lbfgs', 'max_iter': 2000, 'fit_intercept': True, 'standardize_with_source': True, 'rho': 0.5}
[I 2026-06-01 18:03:45,961] Trial 226 finished with value: 0.1967164712647266 and parameters: {'alpha': 61698.76492166066, 'n_pcs': 4500, 'iw_method': 'pc_logistic', 'iw_clip_max': 4.0, 'iw_prob_clip': 0.03323195115801551, 'iw_n_components': 100, 'iw_logistic_c': 6.0508886905845995e-06, 'iw_pca_fit': 'combined', 'iw_solver': 'lbfgs', 'iw_rho': 0.5}. Best is trial 203 with value: 0.20096057737722944.
2026-06-01 18:03:45 | INFO | Trial 227 | outer=4 | alpha=9.595e+04 n_pcs=4500 (pc_topk) weight={'name': 'pc_logistic', 'floor': 1e-06, 'clip_max': 4.0, 'prob_clip': 0.0301082968671431, 'n_components': 100, 'logistic_c': 2.3747261503499198e-05, 'pca_fit': 'combined', 'solver': 'lbfgs', 'max_iter': 2000, 'fit_intercept': True, 'standardize_with_source': True, 'rho': 1.0}
[I 2026-06-01 18:04:01,020] Trial 227 finished with value: 0.2001545041584695 and parameters: {'alpha': 95951.27620297992, 'n_pcs': 4500, 'iw_method': 'pc_logistic', 'iw_clip_max': 4.0, 'iw_prob_clip': 0.0301082968671431, 'iw_n_components': 100, 'iw_logistic_c': 2.3747261503499198e-05, 'iw_pca_fit': 'combined', 'iw_solver': 'lbfgs', 'iw_rho': 1.0}. Best is trial 203 with value: 0.20096057737722944.
2026-06-01 18:04:01 | INFO | Trial 228 | outer=4 | alpha=1.125e+05 n_pcs=4500 (pc_topk) weight={'name': 'pc_logistic', 'floor': 1e-06, 'clip_max': 4.0, 'prob_clip': 0.030352393468048793, 'n_components': 100, 'logistic_c': 2.7896220248489835e-05, 'pca_fit': 'combined', 'solver': 'lbfgs', 'max_iter': 2000, 'fit_intercept': True, 'standardize_with_source': True, 'rho': 1.0}
[I 2026-06-01 18:04:16,811] Trial 228 finished with value: 0.19963967668584684 and parameters: {'alpha': 112506.66943698094, 'n_pcs': 4500, 'iw_method': 'pc_logistic', 'iw_clip_max': 4.0, 'iw_prob_clip': 0.030352393468048793, 'iw_n_components': 100, 'iw_logistic_c': 2.7896220248489835e-05, 'iw_pca_fit': 'combined', 'iw_solver': 'lbfgs', 'iw_rho': 1.0}. Best is trial 203 with value: 0.20096057737722944.
2026-06-01 18:04:16 | INFO | Trial 229 | outer=4 | alpha=7.877e+04 n_pcs=4500 (pc_topk) weight={'name': 'pc_logistic', 'floor': 1e-06, 'clip_max': 4.0, 'prob_clip': 0.03852143442805644, 'n_components': 100, 'logistic_c': 1.1918345764130997e-05, 'pca_fit': 'combined', 'solver': 'lbfgs', 'max_iter': 2000, 'fit_intercept': True, 'standardize_with_source': True, 'rho': 1.0}
[I 2026-06-01 18:04:31,391] Trial 229 finished with value: 0.19951677042777263 and parameters: {'alpha': 78769.89895527998, 'n_pcs': 4500, 'iw_method': 'pc_logistic', 'iw_clip_max': 4.0, 'iw_prob_clip': 0.03852143442805644, 'iw_n_components': 100, 'iw_logistic_c': 1.1918345764130997e-05, 'iw_pca_fit': 'combined', 'iw_solver': 'lbfgs', 'iw_rho': 1.0}. Best is trial 203 with value: 0.20096057737722944.
2026-06-01 18:04:31 | INFO | Trial 230 | outer=4 | alpha=5.517e+04 n_pcs=4500 (pc_topk) weight={'name': 'pc_logistic', 'floor': 1e-06, 'clip_max': 4.0, 'prob_clip': 0.034744851304754513, 'n_components': 100, 'logistic_c': 2.3073535485875843e-05, 'pca_fit': 'combined', 'solver': 'lbfgs', 'max_iter': 2000, 'fit_intercept': True, 'standardize_with_source': True, 'rho': 1.0}
[I 2026-06-01 18:04:49,626] Trial 230 finished with value: 0.20035291509717265 and parameters: {'alpha': 55165.91426492061, 'n_pcs': 4500, 'iw_method': 'pc_logistic', 'iw_clip_max': 4.0, 'iw_prob_clip': 0.034744851304754513, 'iw_n_components': 100, 'iw_logistic_c': 2.3073535485875843e-05, 'iw_pca_fit': 'combined', 'iw_solver': 'lbfgs', 'iw_rho': 1.0}. Best is trial 203 with value: 0.20096057737722944.
2026-06-01 18:04:49 | INFO | Trial 231 | outer=4 | alpha=5.926e+04 n_pcs=4500 (pc_topk) weight={'name': 'pc_logistic', 'floor': 1e-06, 'clip_max': 4.0, 'prob_clip': 0.034716103079524406, 'n_components': 100, 'logistic_c': 2.145573734372668e-05, 'pca_fit': 'combined', 'solver': 'lbfgs', 'max_iter': 2000, 'fit_intercept': True, 'standardize_with_source': True, 'rho': 1.0}
[I 2026-06-01 18:05:04,373] Trial 231 finished with value: 0.2005446355791436 and parameters: {'alpha': 59264.73997669996, 'n_pcs': 4500, 'iw_method': 'pc_logistic', 'iw_clip_max': 4.0, 'iw_prob_clip': 0.034716103079524406, 'iw_n_components': 100, 'iw_logistic_c': 2.145573734372668e-05, 'iw_pca_fit': 'combined', 'iw_solver': 'lbfgs', 'iw_rho': 1.0}. Best is trial 203 with value: 0.20096057737722944.
2026-06-01 18:05:04 | INFO | Trial 232 | outer=4 | alpha=5.458e+04 n_pcs=4500 (pc_topk) weight={'name': 'pc_logistic', 'floor': 1e-06, 'clip_max': 4.0, 'prob_clip': 0.034758025866664995, 'n_components': 100, 'logistic_c': 1.647506232724295e-05, 'pca_fit': 'combined', 'solver': 'lbfgs', 'max_iter': 2000, 'fit_intercept': True, 'standardize_with_source': True, 'rho': 1.0}
[I 2026-06-01 18:05:19,159] Trial 232 finished with value: 0.20081482711415127 and parameters: {'alpha': 54584.76942562491, 'n_pcs': 4500, 'iw_method': 'pc_logistic', 'iw_clip_max': 4.0, 'iw_prob_clip': 0.034758025866664995, 'iw_n_components': 100, 'iw_logistic_c': 1.647506232724295e-05, 'iw_pca_fit': 'combined', 'iw_solver': 'lbfgs', 'iw_rho': 1.0}. Best is trial 203 with value: 0.20096057737722944.
2026-06-01 18:05:19 | INFO | Trial 233 | outer=4 | alpha=4.904e+04 n_pcs=4500 (pc_topk) weight={'name': 'pc_logistic', 'floor': 1e-06, 'clip_max': 4.0, 'prob_clip': 0.03517309997437841, 'n_components': 100, 'logistic_c': 1.3802614056813482e-05, 'pca_fit': 'combined', 'solver': 'lbfgs', 'max_iter': 2000, 'fit_intercept': True, 'standardize_with_source': True, 'rho': 1.0}
[I 2026-06-01 18:05:34,668] Trial 233 finished with value: 0.20049885121800112 and parameters: {'alpha': 49039.79564377028, 'n_pcs': 4500, 'iw_method': 'pc_logistic', 'iw_clip_max': 4.0, 'iw_prob_clip': 0.03517309997437841, 'iw_n_components': 100, 'iw_logistic_c': 1.3802614056813482e-05, 'iw_pca_fit': 'combined', 'iw_solver': 'lbfgs', 'iw_rho': 1.0}. Best is trial 203 with value: 0.20096057737722944.
2026-06-01 18:05:34 | INFO | Trial 234 | outer=4 | alpha=3.764e+04 n_pcs=4500 (pc_topk) weight={'name': 'pc_logistic', 'floor': 1e-06, 'clip_max': 4.0, 'prob_clip': 0.0028820232721070726, 'n_components': 100, 'logistic_c': 1.3926424544644904e-05, 'pca_fit': 'combined', 'solver': 'lbfgs', 'max_iter': 2000, 'fit_intercept': True, 'standardize_with_source': True, 'rho': 1.0}
[I 2026-06-01 18:05:49,943] Trial 234 finished with value: 0.195762175283246 and parameters: {'alpha': 37640.10830650341, 'n_pcs': 4500, 'iw_method': 'pc_logistic', 'iw_clip_max': 4.0, 'iw_prob_clip': 0.0028820232721070726, 'iw_n_components': 100, 'iw_logistic_c': 1.3926424544644904e-05, 'iw_pca_fit': 'combined', 'iw_solver': 'lbfgs', 'iw_rho': 1.0}. Best is trial 203 with value: 0.20096057737722944.
2026-06-01 18:05:49 | INFO | Trial 235 | outer=4 | alpha=5.128e+04 n_pcs=4500 (pc_topk) weight={'name': 'pc_logistic', 'floor': 1e-06, 'clip_max': 4.0, 'prob_clip': 0.04199910475195508, 'n_components': 100, 'logistic_c': 8.54502476964442e-06, 'pca_fit': 'combined', 'solver': 'lbfgs', 'max_iter': 2000, 'fit_intercept': True, 'standardize_with_source': True, 'rho': 1.0}
[I 2026-06-01 18:06:04,951] Trial 235 finished with value: 0.19802910850217686 and parameters: {'alpha': 51279.25615706824, 'n_pcs': 4500, 'iw_method': 'pc_logistic', 'iw_clip_max': 4.0, 'iw_prob_clip': 0.04199910475195508, 'iw_n_components': 100, 'iw_logistic_c': 8.54502476964442e-06, 'iw_pca_fit': 'combined', 'iw_solver': 'lbfgs', 'iw_rho': 1.0}. Best is trial 203 with value: 0.20096057737722944.
2026-06-01 18:06:04 | INFO | Trial 236 | outer=4 | alpha=4.469e+04 n_pcs=4500 (pc_topk) weight={'name': 'pc_logistic', 'floor': 1e-06, 'clip_max': 4.0, 'prob_clip': 0.03573871718216441, 'n_components': 100, 'logistic_c': 1.4567681649915168e-05, 'pca_fit': 'combined', 'solver': 'lbfgs', 'max_iter': 2000, 'fit_intercept': True, 'standardize_with_source': True, 'rho': 1.0}
[I 2026-06-01 18:06:20,577] Trial 236 finished with value: 0.20023887121243616 and parameters: {'alpha': 44687.88155807683, 'n_pcs': 4500, 'iw_method': 'pc_logistic', 'iw_clip_max': 4.0, 'iw_prob_clip': 0.03573871718216441, 'iw_n_components': 100, 'iw_logistic_c': 1.4567681649915168e-05, 'iw_pca_fit': 'combined', 'iw_solver': 'lbfgs', 'iw_rho': 1.0}. Best is trial 203 with value: 0.20096057737722944.
2026-06-01 18:06:20 | INFO | Trial 237 | outer=4 | alpha=4.423e+04 n_pcs=4500 (pc_topk) weight={'name': 'pc_logistic', 'floor': 1e-06, 'clip_max': 4.0, 'prob_clip': 0.03762769455701038, 'n_components': 100, 'logistic_c': 1.3419797291681001e-05, 'pca_fit': 'combined', 'solver': 'lbfgs', 'max_iter': 2000, 'fit_intercept': True, 'standardize_with_source': True, 'rho': 1.0}
[I 2026-06-01 18:06:36,825] Trial 237 finished with value: 0.199775818646904 and parameters: {'alpha': 44232.30735795755, 'n_pcs': 4500, 'iw_method': 'pc_logistic', 'iw_clip_max': 4.0, 'iw_prob_clip': 0.03762769455701038, 'iw_n_components': 100, 'iw_logistic_c': 1.3419797291681001e-05, 'iw_pca_fit': 'combined', 'iw_solver': 'lbfgs', 'iw_rho': 1.0}. Best is trial 203 with value: 0.20096057737722944.
2026-06-01 18:06:36 | INFO | Trial 238 | outer=4 | alpha=5.189e+04 n_pcs=4500 (pc_topk) weight={'name': 'pc_logistic', 'floor': 1e-06, 'clip_max': 12.0, 'prob_clip': 0.03502918632211517, 'n_components': 100, 'logistic_c': 7.127174754384129e-06, 'pca_fit': 'combined', 'solver': 'lbfgs', 'max_iter': 2000, 'fit_intercept': True, 'standardize_with_source': True, 'rho': 1.0}
[I 2026-06-01 18:06:52,342] Trial 238 finished with value: 0.19622454791804028 and parameters: {'alpha': 51890.745103134635, 'n_pcs': 4500, 'iw_method': 'pc_logistic', 'iw_clip_max': 12.0, 'iw_prob_clip': 0.03502918632211517, 'iw_n_components': 100, 'iw_logistic_c': 7.127174754384129e-06, 'iw_pca_fit': 'combined', 'iw_solver': 'lbfgs', 'iw_rho': 1.0}. Best is trial 203 with value: 0.20096057737722944.
2026-06-01 18:06:52 | INFO | Trial 239 | outer=4 | alpha=4.098e+04 n_pcs=4500 (pc_topk) weight={'name': 'pc_logistic', 'floor': 1e-06, 'clip_max': 4.0, 'prob_clip': 0.04543803942593573, 'n_components': 100, 'logistic_c': 1.158111366556301e-05, 'pca_fit': 'combined', 'solver': 'lbfgs', 'max_iter': 2000, 'fit_intercept': True, 'standardize_with_source': True, 'rho': 1.0}
[I 2026-06-01 18:07:07,869] Trial 239 finished with value: 0.19783711942576382 and parameters: {'alpha': 40978.821612839376, 'n_pcs': 4500, 'iw_method': 'pc_logistic', 'iw_clip_max': 4.0, 'iw_prob_clip': 0.04543803942593573, 'iw_n_components': 100, 'iw_logistic_c': 1.158111366556301e-05, 'iw_pca_fit': 'combined', 'iw_solver': 'lbfgs', 'iw_rho': 1.0}. Best is trial 203 with value: 0.20096057737722944.
2026-06-01 18:07:07 | INFO | Trial 240 | outer=4 | alpha=5.797e+04 n_pcs=3000 (pc_topk) weight={'name': 'pc_logistic', 'floor': 1e-06, 'clip_max': 4.0, 'prob_clip': 0.03861394604017077, 'n_components': 100, 'logistic_c': 1.565171918802138e-05, 'pca_fit': 'combined', 'solver': 'lbfgs', 'max_iter': 2000, 'fit_intercept': True, 'standardize_with_source': True, 'rho': 0.85}
[I 2026-06-01 18:07:19,177] Trial 240 finished with value: 0.1980211450339439 and parameters: {'alpha': 57967.731213877254, 'n_pcs': 3000, 'iw_method': 'pc_logistic', 'iw_clip_max': 4.0, 'iw_prob_clip': 0.03861394604017077, 'iw_n_components': 100, 'iw_logistic_c': 1.565171918802138e-05, 'iw_pca_fit': 'combined', 'iw_solver': 'lbfgs', 'iw_rho': 0.85}. Best is trial 203 with value: 0.20096057737722944.
2026-06-01 18:07:19 | INFO | Trial 241 | outer=4 | alpha=6.196e+04 n_pcs=4500 (pc_topk) weight={'name': 'pc_logistic', 'floor': 1e-06, 'clip_max': 4.0, 'prob_clip': 0.0336784464101088, 'n_components': 100, 'logistic_c': 2.1143746897607633e-05, 'pca_fit': 'combined', 'solver': 'lbfgs', 'max_iter': 2000, 'fit_intercept': True, 'standardize_with_source': True, 'rho': 1.0}
[I 2026-06-01 18:07:35,256] Trial 241 finished with value: 0.20066342726173278 and parameters: {'alpha': 61959.47955740306, 'n_pcs': 4500, 'iw_method': 'pc_logistic', 'iw_clip_max': 4.0, 'iw_prob_clip': 0.0336784464101088, 'iw_n_components': 100, 'iw_logistic_c': 2.1143746897607633e-05, 'iw_pca_fit': 'combined', 'iw_solver': 'lbfgs', 'iw_rho': 1.0}. Best is trial 203 with value: 0.20096057737722944.
2026-06-01 18:07:35 | INFO | Trial 242 | outer=4 | alpha=6.127e+04 n_pcs=4500 (pc_topk) weight={'name': 'pc_logistic', 'floor': 1e-06, 'clip_max': 4.0, 'prob_clip': 0.03444966678642999, 'n_components': 100, 'logistic_c': 1.829619333384634e-05, 'pca_fit': 'combined', 'solver': 'lbfgs', 'max_iter': 2000, 'fit_intercept': True, 'standardize_with_source': True, 'rho': 1.0}
[I 2026-06-01 18:07:50,880] Trial 242 finished with value: 0.200669923410707 and parameters: {'alpha': 61274.86927317286, 'n_pcs': 4500, 'iw_method': 'pc_logistic', 'iw_clip_max': 4.0, 'iw_prob_clip': 0.03444966678642999, 'iw_n_components': 100, 'iw_logistic_c': 1.829619333384634e-05, 'iw_pca_fit': 'combined', 'iw_solver': 'lbfgs', 'iw_rho': 1.0}. Best is trial 203 with value: 0.20096057737722944.
2026-06-01 18:07:50 | INFO | Trial 243 | outer=4 | alpha=5.470e+04 n_pcs=4500 (pc_topk) weight={'name': 'pc_logistic', 'floor': 1e-06, 'clip_max': 4.0, 'prob_clip': 0.033406101839273034, 'n_components': 100, 'logistic_c': 4.2238774854700054e-05, 'pca_fit': 'combined', 'solver': 'lbfgs', 'max_iter': 2000, 'fit_intercept': True, 'standardize_with_source': True, 'rho': 1.0}
[I 2026-06-01 18:08:06,644] Trial 243 finished with value: 0.19920752580098858 and parameters: {'alpha': 54702.089290515316, 'n_pcs': 4500, 'iw_method': 'pc_logistic', 'iw_clip_max': 4.0, 'iw_prob_clip': 0.033406101839273034, 'iw_n_components': 100, 'iw_logistic_c': 4.2238774854700054e-05, 'iw_pca_fit': 'combined', 'iw_solver': 'lbfgs', 'iw_rho': 1.0}. Best is trial 203 with value: 0.20096057737722944.
2026-06-01 18:08:06 | INFO | Trial 244 | outer=4 | alpha=6.274e+04 n_pcs=4500 (pc_topk) weight={'name': 'pc_logistic', 'floor': 1e-06, 'clip_max': 4.0, 'prob_clip': 0.04010556727993425, 'n_components': 100, 'logistic_c': 2.1111419716296655e-05, 'pca_fit': 'combined', 'solver': 'lbfgs', 'max_iter': 2000, 'fit_intercept': True, 'standardize_with_source': True, 'rho': 1.0}
[I 2026-06-01 18:08:21,652] Trial 244 finished with value: 0.20014011448968727 and parameters: {'alpha': 62735.665408988345, 'n_pcs': 4500, 'iw_method': 'pc_logistic', 'iw_clip_max': 4.0, 'iw_prob_clip': 0.04010556727993425, 'iw_n_components': 100, 'iw_logistic_c': 2.1111419716296655e-05, 'iw_pca_fit': 'combined', 'iw_solver': 'lbfgs', 'iw_rho': 1.0}. Best is trial 203 with value: 0.20096057737722944.
2026-06-01 18:08:21 | INFO | Trial 245 | outer=4 | alpha=4.633e+04 n_pcs=4500 (pc_topk) weight={'name': 'pc_logistic', 'floor': 1e-06, 'clip_max': 4.0, 'prob_clip': 0.036299052338606384, 'n_components': 100, 'logistic_c': 1.669006562233383e-05, 'pca_fit': 'combined', 'solver': 'lbfgs', 'max_iter': 2000, 'fit_intercept': True, 'standardize_with_source': True, 'rho': 1.0}
