[I 2026-05-31 22:56:11,353] Trial 137 finished with value: 0.25362786130105097 and parameters: {'alpha': 106899.67105356767, 'n_pcs': 4500, 'weight_scheme': 'exponential', 'weight_clip_max': 10.0, 'weight_exponential_beta': 9.644282548597404}. Best is trial 88 with value: 0.2601238911726941.
2026-05-31 22:56:11 | INFO | src.nested_cv_avggrm_weighted_unified | Trial 138 | outer=1 | alpha=4.686e+06 n_pcs=4500 (pc_topk) weight_search=on
2026-05-31 22:56:11 | INFO | src.nested_cv_avggrm_weighted_unified | Trial 138 | outer=1 | weight={'name': 'exponential', 'floor': 1e-06, 'clip_max': 20.0, 'beta': 9.403268321888564}
2026-05-31 22:56:15 | INFO | src.nested_cv_avggrm_weighted_unified | Trial 138 | outer=1 | pruned after 6/10 inner folds (mean r=0.2402)
[I 2026-05-31 22:56:15,490] Trial 138 pruned. 
2026-05-31 22:56:15 | INFO | src.nested_cv_avggrm_weighted_unified | Trial 139 | outer=1 | alpha=6.576e+04 n_pcs=4000 (pc_topk) weight_search=on
2026-05-31 22:56:15 | INFO | src.nested_cv_avggrm_weighted_unified | Trial 139 | outer=1 | weight={'name': 'exponential', 'floor': 1e-06, 'clip_max': 3.0, 'beta': 9.822495324768436}
[I 2026-05-31 22:56:21,215] Trial 139 finished with value: 0.2567756366364964 and parameters: {'alpha': 65759.0069570713, 'n_pcs': 4000, 'weight_scheme': 'exponential', 'weight_clip_max': 3.0, 'weight_exponential_beta': 9.822495324768436}. Best is trial 88 with value: 0.2601238911726941.
2026-05-31 22:56:21 | INFO | src.nested_cv_avggrm_weighted_unified | Trial 140 | outer=1 | alpha=1.307e+05 n_pcs=5000 (pc_topk) weight_search=on
2026-05-31 22:56:21 | INFO | src.nested_cv_avggrm_weighted_unified | Trial 140 | outer=1 | weight={'name': 'exponential', 'floor': 1e-06, 'clip_max': 3.0, 'beta': 4.511888165129333}
[I 2026-05-31 22:56:29,374] Trial 140 finished with value: 0.25527085023773766 and parameters: {'alpha': 130739.82983436, 'n_pcs': 5000, 'weight_scheme': 'exponential', 'weight_clip_max': 3.0, 'weight_exponential_beta': 4.511888165129333}. Best is trial 88 with value: 0.2601238911726941.
2026-05-31 22:56:29 | INFO | src.nested_cv_avggrm_weighted_unified | Trial 141 | outer=1 | alpha=1.733e+05 n_pcs=4500 (pc_topk) weight_search=on
2026-05-31 22:56:29 | INFO | src.nested_cv_avggrm_weighted_unified | Trial 141 | outer=1 | weight={'name': 'exponential', 'floor': 1e-06, 'clip_max': 3.0, 'beta': 9.411578440769274}
[I 2026-05-31 22:56:36,359] Trial 141 finished with value: 0.2598079194221389 and parameters: {'alpha': 173328.1866686583, 'n_pcs': 4500, 'weight_scheme': 'exponential', 'weight_clip_max': 3.0, 'weight_exponential_beta': 9.411578440769274}. Best is trial 88 with value: 0.2601238911726941.
2026-05-31 22:56:36 | INFO | src.nested_cv_avggrm_weighted_unified | Trial 142 | outer=1 | alpha=2.261e+05 n_pcs=4500 (pc_topk) weight_search=on
2026-05-31 22:56:36 | INFO | src.nested_cv_avggrm_weighted_unified | Trial 142 | outer=1 | weight={'name': 'exponential', 'floor': 1e-06, 'clip_max': 3.0, 'beta': 9.059826220556094}
[I 2026-05-31 22:56:43,284] Trial 142 finished with value: 0.25906311278667554 and parameters: {'alpha': 226107.15358267212, 'n_pcs': 4500, 'weight_scheme': 'exponential', 'weight_clip_max': 3.0, 'weight_exponential_beta': 9.059826220556094}. Best is trial 88 with value: 0.2601238911726941.
2026-05-31 22:56:43 | INFO | src.nested_cv_avggrm_weighted_unified | Trial 143 | outer=1 | alpha=1.555e+05 n_pcs=4500 (pc_topk) weight_search=on
2026-05-31 22:56:43 | INFO | src.nested_cv_avggrm_weighted_unified | Trial 143 | outer=1 | weight={'name': 'exponential', 'floor': 1e-06, 'clip_max': 3.0, 'beta': 9.546830518061471}
[I 2026-05-31 22:56:50,207] Trial 143 finished with value: 0.25989401486085567 and parameters: {'alpha': 155451.03204443675, 'n_pcs': 4500, 'weight_scheme': 'exponential', 'weight_clip_max': 3.0, 'weight_exponential_beta': 9.546830518061471}. Best is trial 88 with value: 0.2601238911726941.
2026-05-31 22:56:50 | INFO | src.nested_cv_avggrm_weighted_unified | Trial 144 | outer=1 | alpha=3.020e+05 n_pcs=4500 (pc_topk) weight_search=on
2026-05-31 22:56:50 | INFO | src.nested_cv_avggrm_weighted_unified | Trial 144 | outer=1 | weight={'name': 'exponential', 'floor': 1e-06, 'clip_max': 3.0, 'beta': 9.984394004640219}
[I 2026-05-31 22:56:57,094] Trial 144 finished with value: 0.2582297598525262 and parameters: {'alpha': 302045.1468483508, 'n_pcs': 4500, 'weight_scheme': 'exponential', 'weight_clip_max': 3.0, 'weight_exponential_beta': 9.984394004640219}. Best is trial 88 with value: 0.2601238911726941.
2026-05-31 22:56:57 | INFO | src.nested_cv_avggrm_weighted_unified | Trial 145 | outer=1 | alpha=9.326e+04 n_pcs=4500 (pc_topk) weight_search=on
2026-05-31 22:56:57 | INFO | src.nested_cv_avggrm_weighted_unified | Trial 145 | outer=1 | weight={'name': 'exponential', 'floor': 1e-06, 'clip_max': 3.0, 'beta': 9.563072639045506}
[I 2026-05-31 22:57:04,021] Trial 145 finished with value: 0.25899324996878165 and parameters: {'alpha': 93260.1425964671, 'n_pcs': 4500, 'weight_scheme': 'exponential', 'weight_clip_max': 3.0, 'weight_exponential_beta': 9.563072639045506}. Best is trial 88 with value: 0.2601238911726941.
2026-05-31 22:57:04 | INFO | src.nested_cv_avggrm_weighted_unified | Trial 146 | outer=1 | alpha=1.487e+05 n_pcs=4000 (pc_topk) weight_search=on
2026-05-31 22:57:04 | INFO | src.nested_cv_avggrm_weighted_unified | Trial 146 | outer=1 | weight={'name': 'linear', 'floor': 1e-06, 'clip_max': 3.0, 'min_weight': 0.5245207256794462, 'max_weight': 4.106268188849034}
[I 2026-05-31 22:57:09,764] Trial 146 finished with value: 0.2525092312782272 and parameters: {'alpha': 148663.34537516278, 'n_pcs': 4000, 'weight_scheme': 'linear', 'weight_clip_max': 3.0, 'weight_linear_min_weight': 0.5245207256794462, 'weight_linear_max_weight': 4.106268188849034}. Best is trial 88 with value: 0.2601238911726941.
2026-05-31 22:57:09 | INFO | src.nested_cv_avggrm_weighted_unified | Trial 147 | outer=1 | alpha=2.098e+05 n_pcs=4500 (pc_topk) weight_search=on
2026-05-31 22:57:09 | INFO | src.nested_cv_avggrm_weighted_unified | Trial 147 | outer=1 | weight={'name': 'exponential', 'floor': 1e-06, 'clip_max': 3.0, 'beta': 9.792236435273738}
[I 2026-05-31 22:57:16,688] Trial 147 finished with value: 0.2595066736209584 and parameters: {'alpha': 209825.2591870311, 'n_pcs': 4500, 'weight_scheme': 'exponential', 'weight_clip_max': 3.0, 'weight_exponential_beta': 9.792236435273738}. Best is trial 88 with value: 0.2601238911726941.
2026-05-31 22:57:16 | INFO | src.nested_cv_avggrm_weighted_unified | Trial 148 | outer=1 | alpha=1.230e+05 n_pcs=4500 (pc_topk) weight_search=on
2026-05-31 22:57:16 | INFO | src.nested_cv_avggrm_weighted_unified | Trial 148 | outer=1 | weight={'name': 'uniform', 'floor': 1e-06, 'clip_max': 3.0}
2026-05-31 22:57:20 | INFO | src.nested_cv_avggrm_weighted_unified | Trial 148 | outer=1 | pruned after 6/10 inner folds (mean r=0.2452)
[I 2026-05-31 22:57:20,311] Trial 148 pruned. 
2026-05-31 22:57:20 | INFO | src.nested_cv_avggrm_weighted_unified | Trial 149 | outer=1 | alpha=1.717e+05 n_pcs=4000 (pc_topk) weight_search=on
2026-05-31 22:57:20 | INFO | src.nested_cv_avggrm_weighted_unified | Trial 149 | outer=1 | weight={'name': 'exponential', 'floor': 1e-06, 'clip_max': 3.0, 'beta': 9.434541556673478}
[I 2026-05-31 22:57:26,029] Trial 149 finished with value: 0.260737825668265 and parameters: {'alpha': 171682.9781046157, 'n_pcs': 4000, 'weight_scheme': 'exponential', 'weight_clip_max': 3.0, 'weight_exponential_beta': 9.434541556673478}. Best is trial 149 with value: 0.260737825668265.
2026-05-31 22:57:26 | INFO | src.nested_cv_avggrm_weighted_unified | OUTER 1 | new best trial 149 (mean inner r=0.2607) saved to outputs/final_results/e6_pc_ridge_avggrm/thr_wing/e6_pc_ridge_avggrm_thr_wing_best_trials/split_01_best_trial.json
2026-05-31 22:57:26 | INFO | src.nested_cv_avggrm_weighted_unified | Trial 150 | outer=1 | alpha=2.787e+05 n_pcs=5000 (pc_topk) weight_search=on
2026-05-31 22:57:26 | INFO | src.nested_cv_avggrm_weighted_unified | Trial 150 | outer=1 | weight={'name': 'exponential', 'floor': 1e-06, 'clip_max': 3.0, 'beta': 9.375995381060186}
[I 2026-05-31 22:57:34,184] Trial 150 finished with value: 0.2575862149194298 and parameters: {'alpha': 278734.90743281005, 'n_pcs': 5000, 'weight_scheme': 'exponential', 'weight_clip_max': 3.0, 'weight_exponential_beta': 9.375995381060186}. Best is trial 149 with value: 0.260737825668265.
2026-05-31 22:57:34 | INFO | src.nested_cv_avggrm_weighted_unified | Trial 151 | outer=1 | alpha=1.658e+05 n_pcs=4000 (pc_topk) weight_search=on
2026-05-31 22:57:34 | INFO | src.nested_cv_avggrm_weighted_unified | Trial 151 | outer=1 | weight={'name': 'exponential', 'floor': 1e-06, 'clip_max': 3.0, 'beta': 9.586246058117538}
[I 2026-05-31 22:57:39,918] Trial 151 finished with value: 0.2607458721637643 and parameters: {'alpha': 165766.55252087387, 'n_pcs': 4000, 'weight_scheme': 'exponential', 'weight_clip_max': 3.0, 'weight_exponential_beta': 9.586246058117538}. Best is trial 151 with value: 0.2607458721637643.
2026-05-31 22:57:39 | INFO | src.nested_cv_avggrm_weighted_unified | OUTER 1 | new best trial 151 (mean inner r=0.2607) saved to outputs/final_results/e6_pc_ridge_avggrm/thr_wing/e6_pc_ridge_avggrm_thr_wing_best_trials/split_01_best_trial.json
2026-05-31 22:57:39 | INFO | src.nested_cv_avggrm_weighted_unified | Trial 152 | outer=1 | alpha=1.698e+05 n_pcs=4000 (pc_topk) weight_search=on
2026-05-31 22:57:39 | INFO | src.nested_cv_avggrm_weighted_unified | Trial 152 | outer=1 | weight={'name': 'exponential', 'floor': 1e-06, 'clip_max': 3.0, 'beta': 9.635422375394157}
[I 2026-05-31 22:57:46,079] Trial 152 finished with value: 0.2607343062492862 and parameters: {'alpha': 169846.7804067763, 'n_pcs': 4000, 'weight_scheme': 'exponential', 'weight_clip_max': 3.0, 'weight_exponential_beta': 9.635422375394157}. Best is trial 151 with value: 0.2607458721637643.
2026-05-31 22:57:46 | INFO | src.nested_cv_avggrm_weighted_unified | Trial 153 | outer=1 | alpha=1.782e+05 n_pcs=4000 (pc_topk) weight_search=on
2026-05-31 22:57:46 | INFO | src.nested_cv_avggrm_weighted_unified | Trial 153 | outer=1 | weight={'name': 'exponential', 'floor': 1e-06, 'clip_max': 3.0, 'beta': 9.577348306787389}
[I 2026-05-31 22:57:51,799] Trial 153 finished with value: 0.2607234211901721 and parameters: {'alpha': 178174.3804765343, 'n_pcs': 4000, 'weight_scheme': 'exponential', 'weight_clip_max': 3.0, 'weight_exponential_beta': 9.577348306787389}. Best is trial 151 with value: 0.2607458721637643.
2026-05-31 22:57:51 | INFO | src.nested_cv_avggrm_weighted_unified | Trial 154 | outer=1 | alpha=1.805e+05 n_pcs=4000 (pc_topk) weight_search=on
2026-05-31 22:57:51 | INFO | src.nested_cv_avggrm_weighted_unified | Trial 154 | outer=1 | weight={'name': 'exponential', 'floor': 1e-06, 'clip_max': 3.0, 'beta': 9.603074177220709}
[I 2026-05-31 22:57:57,515] Trial 154 finished with value: 0.2607122100931666 and parameters: {'alpha': 180548.221258677, 'n_pcs': 4000, 'weight_scheme': 'exponential', 'weight_clip_max': 3.0, 'weight_exponential_beta': 9.603074177220709}. Best is trial 151 with value: 0.2607458721637643.
2026-05-31 22:57:57 | INFO | src.nested_cv_avggrm_weighted_unified | Trial 155 | outer=1 | alpha=2.170e+05 n_pcs=4000 (pc_topk) weight_search=on
2026-05-31 22:57:57 | INFO | src.nested_cv_avggrm_weighted_unified | Trial 155 | outer=1 | weight={'name': 'exponential', 'floor': 1e-06, 'clip_max': 3.0, 'beta': 1.794465145727894}
2026-05-31 22:58:01 | INFO | src.nested_cv_avggrm_weighted_unified | Trial 155 | outer=1 | pruned after 7/10 inner folds (mean r=0.2847)
[I 2026-05-31 22:58:01,522] Trial 155 pruned. 
2026-05-31 22:58:01 | INFO | src.nested_cv_avggrm_weighted_unified | Trial 156 | outer=1 | alpha=1.008e+05 n_pcs=4000 (pc_topk) weight_search=on
2026-05-31 22:58:01 | INFO | src.nested_cv_avggrm_weighted_unified | Trial 156 | outer=1 | weight={'name': 'exponential', 'floor': 1e-06, 'clip_max': 3.0, 'beta': 9.55057356483582}
[I 2026-05-31 22:58:07,261] Trial 156 finished with value: 0.2597304699620078 and parameters: {'alpha': 100778.31107781116, 'n_pcs': 4000, 'weight_scheme': 'exponential', 'weight_clip_max': 3.0, 'weight_exponential_beta': 9.55057356483582}. Best is trial 151 with value: 0.2607458721637643.
2026-05-31 22:58:07 | INFO | src.nested_cv_avggrm_weighted_unified | Trial 157 | outer=1 | alpha=2.625e+05 n_pcs=4000 (pc_topk) weight_search=on
2026-05-31 22:58:07 | INFO | src.nested_cv_avggrm_weighted_unified | Trial 157 | outer=1 | weight={'name': 'exponential', 'floor': 1e-06, 'clip_max': 3.0, 'beta': 8.968476633221343}
[I 2026-05-31 22:58:12,983] Trial 157 finished with value: 0.25959907660898085 and parameters: {'alpha': 262521.13836008747, 'n_pcs': 4000, 'weight_scheme': 'exponential', 'weight_clip_max': 3.0, 'weight_exponential_beta': 8.968476633221343}. Best is trial 151 with value: 0.2607458721637643.
2026-05-31 22:58:12 | INFO | src.nested_cv_avggrm_weighted_unified | Trial 158 | outer=1 | alpha=1.860e+05 n_pcs=4000 (pc_topk) weight_search=on
2026-05-31 22:58:12 | INFO | src.nested_cv_avggrm_weighted_unified | Trial 158 | outer=1 | weight={'name': 'exponential', 'floor': 1e-06, 'clip_max': None, 'beta': 9.21459077032537}
[I 2026-05-31 22:58:18,658] Trial 158 finished with value: 0.23143500314987336 and parameters: {'alpha': 186046.3577542361, 'n_pcs': 4000, 'weight_scheme': 'exponential', 'weight_clip_max': None, 'weight_exponential_beta': 9.21459077032537}. Best is trial 151 with value: 0.2607458721637643.
2026-05-31 22:58:18 | INFO | src.nested_cv_avggrm_weighted_unified | Trial 159 | outer=1 | alpha=1.353e+05 n_pcs=4000 (pc_topk) weight_search=on
2026-05-31 22:58:18 | INFO | src.nested_cv_avggrm_weighted_unified | Trial 159 | outer=1 | weight={'name': 'exponential', 'floor': 1e-06, 'clip_max': 3.0, 'beta': 9.690618334713307}
[I 2026-05-31 22:58:24,377] Trial 159 finished with value: 0.26054702882379444 and parameters: {'alpha': 135263.82506222848, 'n_pcs': 4000, 'weight_scheme': 'exponential', 'weight_clip_max': 3.0, 'weight_exponential_beta': 9.690618334713307}. Best is trial 151 with value: 0.2607458721637643.
2026-05-31 22:58:24 | INFO | src.nested_cv_avggrm_weighted_unified | Trial 160 | outer=1 | alpha=3.444e+05 n_pcs=4000 (pc_topk) weight_search=on
2026-05-31 22:58:24 | INFO | src.nested_cv_avggrm_weighted_unified | Trial 160 | outer=1 | weight={'name': 'exponential', 'floor': 1e-06, 'clip_max': 3.0, 'beta': 9.674179349426348}
[I 2026-05-31 22:58:30,105] Trial 160 finished with value: 0.25881497640438444 and parameters: {'alpha': 344378.3051320193, 'n_pcs': 4000, 'weight_scheme': 'exponential', 'weight_clip_max': 3.0, 'weight_exponential_beta': 9.674179349426348}. Best is trial 151 with value: 0.2607458721637643.
2026-05-31 22:58:30 | INFO | src.nested_cv_avggrm_weighted_unified | Trial 161 | outer=1 | alpha=1.376e+05 n_pcs=4000 (pc_topk) weight_search=on
2026-05-31 22:58:30 | INFO | src.nested_cv_avggrm_weighted_unified | Trial 161 | outer=1 | weight={'name': 'exponential', 'floor': 1e-06, 'clip_max': 3.0, 'beta': 9.656086211930843}
[I 2026-05-31 22:58:35,826] Trial 161 finished with value: 0.2605879485430749 and parameters: {'alpha': 137592.71750190578, 'n_pcs': 4000, 'weight_scheme': 'exponential', 'weight_clip_max': 3.0, 'weight_exponential_beta': 9.656086211930843}. Best is trial 151 with value: 0.2607458721637643.
2026-05-31 22:58:35 | INFO | src.nested_cv_avggrm_weighted_unified | Trial 162 | outer=1 | alpha=1.715e+05 n_pcs=4000 (pc_topk) weight_search=on
2026-05-31 22:58:35 | INFO | src.nested_cv_avggrm_weighted_unified | Trial 162 | outer=1 | weight={'name': 'exponential', 'floor': 1e-06, 'clip_max': 3.0, 'beta': 9.772357370562869}
[I 2026-05-31 22:58:41,567] Trial 162 finished with value: 0.2606912441760704 and parameters: {'alpha': 171507.23060556696, 'n_pcs': 4000, 'weight_scheme': 'exponential', 'weight_clip_max': 3.0, 'weight_exponential_beta': 9.772357370562869}. Best is trial 151 with value: 0.2607458721637643.
2026-05-31 22:58:41 | INFO | src.nested_cv_avggrm_weighted_unified | Trial 163 | outer=1 | alpha=1.863e+05 n_pcs=4000 (pc_topk) weight_search=on
2026-05-31 22:58:41 | INFO | src.nested_cv_avggrm_weighted_unified | Trial 163 | outer=1 | weight={'name': 'exponential', 'floor': 1e-06, 'clip_max': 3.0, 'beta': 9.69306395722188}
[I 2026-05-31 22:58:47,299] Trial 163 finished with value: 0.2606728744030658 and parameters: {'alpha': 186342.6299044223, 'n_pcs': 4000, 'weight_scheme': 'exponential', 'weight_clip_max': 3.0, 'weight_exponential_beta': 9.69306395722188}. Best is trial 151 with value: 0.2607458721637643.
2026-05-31 22:58:47 | INFO | src.nested_cv_avggrm_weighted_unified | Trial 164 | outer=1 | alpha=2.209e+05 n_pcs=4000 (pc_topk) weight_search=on
2026-05-31 22:58:47 | INFO | src.nested_cv_avggrm_weighted_unified | Trial 164 | outer=1 | weight={'name': 'exponential', 'floor': 1e-06, 'clip_max': 3.0, 'beta': 9.316150409881832}
[I 2026-05-31 22:58:53,029] Trial 164 finished with value: 0.26035218836298557 and parameters: {'alpha': 220883.39490516298, 'n_pcs': 4000, 'weight_scheme': 'exponential', 'weight_clip_max': 3.0, 'weight_exponential_beta': 9.316150409881832}. Best is trial 151 with value: 0.2607458721637643.
2026-05-31 22:58:53 | INFO | src.nested_cv_avggrm_weighted_unified | Trial 165 | outer=1 | alpha=2.269e+05 n_pcs=4000 (pc_topk) weight_search=on
2026-05-31 22:58:53 | INFO | src.nested_cv_avggrm_weighted_unified | Trial 165 | outer=1 | weight={'name': 'exponential', 'floor': 1e-06, 'clip_max': 3.0, 'beta': 9.305567188185483}
[I 2026-05-31 22:58:58,733] Trial 165 finished with value: 0.26028137366729476 and parameters: {'alpha': 226941.38780772654, 'n_pcs': 4000, 'weight_scheme': 'exponential', 'weight_clip_max': 3.0, 'weight_exponential_beta': 9.305567188185483}. Best is trial 151 with value: 0.2607458721637643.
2026-05-31 22:58:58 | INFO | src.nested_cv_avggrm_weighted_unified | Trial 166 | outer=1 | alpha=2.192e+05 n_pcs=4000 (pc_topk) weight_search=on
2026-05-31 22:58:58 | INFO | src.nested_cv_avggrm_weighted_unified | Trial 166 | outer=1 | weight={'name': 'exponential', 'floor': 1e-06, 'clip_max': 3.0, 'beta': 9.297662912185267}
[I 2026-05-31 22:59:04,450] Trial 166 finished with value: 0.26036224046400624 and parameters: {'alpha': 219190.0223733175, 'n_pcs': 4000, 'weight_scheme': 'exponential', 'weight_clip_max': 3.0, 'weight_exponential_beta': 9.297662912185267}. Best is trial 151 with value: 0.2607458721637643.
2026-05-31 22:59:04 | INFO | src.nested_cv_avggrm_weighted_unified | Trial 167 | outer=1 | alpha=2.253e+05 n_pcs=4000 (pc_topk) weight_search=on
2026-05-31 22:59:04 | INFO | src.nested_cv_avggrm_weighted_unified | Trial 167 | outer=1 | weight={'name': 'exponential', 'floor': 1e-06, 'clip_max': 3.0, 'beta': 9.255234010499688}
[I 2026-05-31 22:59:10,170] Trial 167 finished with value: 0.26027297116564646 and parameters: {'alpha': 225334.50169568424, 'n_pcs': 4000, 'weight_scheme': 'exponential', 'weight_clip_max': 3.0, 'weight_exponential_beta': 9.255234010499688}. Best is trial 151 with value: 0.2607458721637643.
2026-05-31 22:59:10 | INFO | src.nested_cv_avggrm_weighted_unified | Trial 168 | outer=1 | alpha=2.359e+05 n_pcs=4000 (pc_topk) weight_search=on
2026-05-31 22:59:10 | INFO | src.nested_cv_avggrm_weighted_unified | Trial 168 | outer=1 | weight={'name': 'exponential', 'floor': 1e-06, 'clip_max': 3.0, 'beta': 9.188126236615446}
[I 2026-05-31 22:59:15,910] Trial 168 finished with value: 0.2601083940103015 and parameters: {'alpha': 235914.81000937053, 'n_pcs': 4000, 'weight_scheme': 'exponential', 'weight_clip_max': 3.0, 'weight_exponential_beta': 9.188126236615446}. Best is trial 151 with value: 0.2607458721637643.
2026-05-31 22:59:15 | INFO | src.nested_cv_avggrm_weighted_unified | Trial 169 | outer=1 | alpha=3.969e+05 n_pcs=4000 (pc_topk) weight_search=on
2026-05-31 22:59:15 | INFO | src.nested_cv_avggrm_weighted_unified | Trial 169 | outer=1 | weight={'name': 'exponential', 'floor': 1e-06, 'clip_max': 3.0, 'beta': 9.13136178807987}
[I 2026-05-31 22:59:21,620] Trial 169 finished with value: 0.2577575620099183 and parameters: {'alpha': 396915.43299601786, 'n_pcs': 4000, 'weight_scheme': 'exponential', 'weight_clip_max': 3.0, 'weight_exponential_beta': 9.13136178807987}. Best is trial 151 with value: 0.2607458721637643.
2026-05-31 22:59:21 | INFO | src.nested_cv_avggrm_weighted_unified | Trial 170 | outer=1 | alpha=3.041e+05 n_pcs=3500 (pc_topk) weight_search=on
2026-05-31 22:59:21 | INFO | src.nested_cv_avggrm_weighted_unified | Trial 170 | outer=1 | weight={'name': 'exponential', 'floor': 1e-06, 'clip_max': 10.0, 'beta': 8.817098082126964}
[I 2026-05-31 22:59:26,508] Trial 170 finished with value: 0.2514620598285384 and parameters: {'alpha': 304097.47991015494, 'n_pcs': 3500, 'weight_scheme': 'exponential', 'weight_clip_max': 10.0, 'weight_exponential_beta': 8.817098082126964}. Best is trial 151 with value: 0.2607458721637643.
2026-05-31 22:59:26 | INFO | src.nested_cv_avggrm_weighted_unified | Trial 171 | outer=1 | alpha=2.099e+05 n_pcs=4000 (pc_topk) weight_search=on
2026-05-31 22:59:26 | INFO | src.nested_cv_avggrm_weighted_unified | Trial 171 | outer=1 | weight={'name': 'exponential', 'floor': 1e-06, 'clip_max': 3.0, 'beta': 9.315062712131837}
[I 2026-05-31 22:59:32,226] Trial 171 finished with value: 0.2604625776461183 and parameters: {'alpha': 209905.69053302784, 'n_pcs': 4000, 'weight_scheme': 'exponential', 'weight_clip_max': 3.0, 'weight_exponential_beta': 9.315062712131837}. Best is trial 151 with value: 0.2607458721637643.
2026-05-31 22:59:32 | INFO | src.nested_cv_avggrm_weighted_unified | Trial 172 | outer=1 | alpha=2.332e+05 n_pcs=4000 (pc_topk) weight_search=on
2026-05-31 22:59:32 | INFO | src.nested_cv_avggrm_weighted_unified | Trial 172 | outer=1 | weight={'name': 'exponential', 'floor': 1e-06, 'clip_max': 3.0, 'beta': 9.776535792879953}
