[I 2026-06-01 19:36:15,988] Trial 289 finished with value: 0.25834296766560566 and parameters: {'alpha': 59610.180332376825, 'n_pcs': 4000, 'iw_method': 'pc_logistic', 'iw_clip_max': 7.0, 'iw_prob_clip': 0.029145091608899776, 'iw_n_components': 20, 'iw_logistic_c': 3.051243333819714e-05, 'iw_pca_fit': 'combined', 'iw_solver': 'lbfgs', 'iw_rho': 0.85}. Best is trial 268 with value: 0.2587260526062522.
2026-06-01 19:36:16 | INFO | Trial 290 | outer=5 | alpha=1.276e+03 n_pcs=4000 (pc_topk) weight={'name': 'pc_logistic', 'floor': 1e-06, 'clip_max': 7.0, 'prob_clip': 0.02946177624544414, 'n_components': 20, 'logistic_c': 1.7598170536433363e-05, 'pca_fit': 'combined', 'solver': 'lbfgs', 'max_iter': 2000, 'fit_intercept': True, 'standardize_with_source': True, 'rho': 0.85}
[I 2026-06-01 19:36:28,592] Trial 290 finished with value: 0.1430941023079791 and parameters: {'alpha': 1275.559785409602, 'n_pcs': 4000, 'iw_method': 'pc_logistic', 'iw_clip_max': 7.0, 'iw_prob_clip': 0.02946177624544414, 'iw_n_components': 20, 'iw_logistic_c': 1.7598170536433363e-05, 'iw_pca_fit': 'combined', 'iw_solver': 'lbfgs', 'iw_rho': 0.85}. Best is trial 268 with value: 0.2587260526062522.
2026-06-01 19:36:28 | INFO | Trial 291 | outer=5 | alpha=6.073e+04 n_pcs=4500 (pc_topk) weight={'name': 'pc_logistic', 'floor': 1e-06, 'clip_max': 7.0, 'prob_clip': 0.027502632883866406, 'n_components': 20, 'logistic_c': 3.164168204035492e-05, 'pca_fit': 'combined', 'solver': 'lbfgs', 'max_iter': 2000, 'fit_intercept': True, 'standardize_with_source': True, 'rho': 0.85}
[I 2026-06-01 19:36:43,386] Trial 291 finished with value: 0.2581256309613925 and parameters: {'alpha': 60727.94589603582, 'n_pcs': 4500, 'iw_method': 'pc_logistic', 'iw_clip_max': 7.0, 'iw_prob_clip': 0.027502632883866406, 'iw_n_components': 20, 'iw_logistic_c': 3.164168204035492e-05, 'iw_pca_fit': 'combined', 'iw_solver': 'lbfgs', 'iw_rho': 0.85}. Best is trial 268 with value: 0.2587260526062522.
2026-06-01 19:36:43 | INFO | Trial 292 | outer=5 | alpha=7.209e+04 n_pcs=4500 (pc_topk) weight={'name': 'pc_logistic', 'floor': 1e-06, 'clip_max': 7.0, 'prob_clip': 0.027020535601096584, 'n_components': 20, 'logistic_c': 9.550798524266477e-06, 'pca_fit': 'combined', 'solver': 'lbfgs', 'max_iter': 2000, 'fit_intercept': True, 'standardize_with_source': True, 'rho': 0.85}
[I 2026-06-01 19:36:58,636] Trial 292 finished with value: 0.25093806914634875 and parameters: {'alpha': 72093.06654798157, 'n_pcs': 4500, 'iw_method': 'pc_logistic', 'iw_clip_max': 7.0, 'iw_prob_clip': 0.027020535601096584, 'iw_n_components': 20, 'iw_logistic_c': 9.550798524266477e-06, 'iw_pca_fit': 'combined', 'iw_solver': 'lbfgs', 'iw_rho': 0.85}. Best is trial 268 with value: 0.2587260526062522.
2026-06-01 19:36:58 | INFO | Trial 293 | outer=5 | alpha=5.739e+04 n_pcs=4500 (pc_topk) weight={'name': 'pc_logistic', 'floor': 1e-06, 'clip_max': 7.0, 'prob_clip': 0.024784125644589417, 'n_components': 20, 'logistic_c': 2.6210848211144657e-05, 'pca_fit': 'combined', 'solver': 'lbfgs', 'max_iter': 2000, 'fit_intercept': True, 'standardize_with_source': True, 'rho': 0.85}
[I 2026-06-01 19:37:13,612] Trial 293 finished with value: 0.2581059989854964 and parameters: {'alpha': 57386.11282845946, 'n_pcs': 4500, 'iw_method': 'pc_logistic', 'iw_clip_max': 7.0, 'iw_prob_clip': 0.024784125644589417, 'iw_n_components': 20, 'iw_logistic_c': 2.6210848211144657e-05, 'iw_pca_fit': 'combined', 'iw_solver': 'lbfgs', 'iw_rho': 0.85}. Best is trial 268 with value: 0.2587260526062522.
2026-06-01 19:37:13 | INFO | Trial 294 | outer=5 | alpha=6.308e+04 n_pcs=4500 (pc_topk) weight={'name': 'pc_logistic', 'floor': 1e-06, 'clip_max': 7.0, 'prob_clip': 0.02495256252296698, 'n_components': 20, 'logistic_c': 1.9369311311883875e-05, 'pca_fit': 'combined', 'solver': 'lbfgs', 'max_iter': 2000, 'fit_intercept': True, 'standardize_with_source': True, 'rho': 0.85}
[I 2026-06-01 19:37:28,326] Trial 294 finished with value: 0.2562427446373313 and parameters: {'alpha': 63083.25278084661, 'n_pcs': 4500, 'iw_method': 'pc_logistic', 'iw_clip_max': 7.0, 'iw_prob_clip': 0.02495256252296698, 'iw_n_components': 20, 'iw_logistic_c': 1.9369311311883875e-05, 'iw_pca_fit': 'combined', 'iw_solver': 'lbfgs', 'iw_rho': 0.85}. Best is trial 268 with value: 0.2587260526062522.
2026-06-01 19:37:28 | INFO | Trial 295 | outer=5 | alpha=7.778e+04 n_pcs=4500 (pc_topk) weight={'name': 'pc_logistic', 'floor': 1e-06, 'clip_max': 7.0, 'prob_clip': 0.024298165758725423, 'n_components': 20, 'logistic_c': 3.0953958233854135e-05, 'pca_fit': 'combined', 'solver': 'lbfgs', 'max_iter': 2000, 'fit_intercept': True, 'standardize_with_source': True, 'rho': 0.3}
[I 2026-06-01 19:37:42,745] Trial 295 finished with value: 0.2510384907047991 and parameters: {'alpha': 77779.22426745875, 'n_pcs': 4500, 'iw_method': 'pc_logistic', 'iw_clip_max': 7.0, 'iw_prob_clip': 0.024298165758725423, 'iw_n_components': 20, 'iw_logistic_c': 3.0953958233854135e-05, 'iw_pca_fit': 'combined', 'iw_solver': 'lbfgs', 'iw_rho': 0.3}. Best is trial 268 with value: 0.2587260526062522.
2026-06-01 19:37:42 | INFO | Trial 296 | outer=5 | alpha=3.911e+04 n_pcs=4500 (pc_topk) weight={'name': 'pc_logistic', 'floor': 1e-06, 'clip_max': 7.0, 'prob_clip': 0.022962999201892122, 'n_components': 20, 'logistic_c': 4.7927304638485164e-05, 'pca_fit': 'combined', 'solver': 'lbfgs', 'max_iter': 2000, 'fit_intercept': True, 'standardize_with_source': True, 'rho': 0.85}
[I 2026-06-01 19:37:57,608] Trial 296 finished with value: 0.2581095269091101 and parameters: {'alpha': 39110.387517590316, 'n_pcs': 4500, 'iw_method': 'pc_logistic', 'iw_clip_max': 7.0, 'iw_prob_clip': 0.022962999201892122, 'iw_n_components': 20, 'iw_logistic_c': 4.7927304638485164e-05, 'iw_pca_fit': 'combined', 'iw_solver': 'lbfgs', 'iw_rho': 0.85}. Best is trial 268 with value: 0.2587260526062522.
2026-06-01 19:37:57 | INFO | Trial 297 | outer=5 | alpha=3.074e+04 n_pcs=4500 (pc_topk) weight={'name': 'uniform'}
[I 2026-06-01 19:38:06,346] Trial 297 finished with value: 0.24353784168026954 and parameters: {'alpha': 30743.472087318503, 'n_pcs': 4500, 'iw_method': 'uniform'}. Best is trial 268 with value: 0.2587260526062522.
2026-06-01 19:38:06 | INFO | Trial 298 | outer=5 | alpha=3.876e+04 n_pcs=4500 (pc_topk) weight={'name': 'pc_logistic', 'floor': 1e-06, 'clip_max': 1.5, 'prob_clip': 0.02262753153907452, 'n_components': 20, 'logistic_c': 1.4035276777645535e-05, 'pca_fit': 'combined', 'solver': 'lbfgs', 'max_iter': 2000, 'fit_intercept': True, 'standardize_with_source': True, 'rho': 0.85}
[I 2026-06-01 19:38:20,717] Trial 298 finished with value: 0.24960648660735768 and parameters: {'alpha': 38759.03649384278, 'n_pcs': 4500, 'iw_method': 'pc_logistic', 'iw_clip_max': 1.5, 'iw_prob_clip': 0.02262753153907452, 'iw_n_components': 20, 'iw_logistic_c': 1.4035276777645535e-05, 'iw_pca_fit': 'combined', 'iw_solver': 'lbfgs', 'iw_rho': 0.85}. Best is trial 268 with value: 0.2587260526062522.
2026-06-01 19:38:20 | INFO | Trial 299 | outer=5 | alpha=2.558e+04 n_pcs=4500 (pc_topk) weight={'name': 'pc_logistic', 'floor': 1e-06, 'clip_max': 7.0, 'prob_clip': 0.022533378339252716, 'n_components': 20, 'logistic_c': 5.1484031871531886e-05, 'pca_fit': 'combined', 'solver': 'lbfgs', 'max_iter': 2000, 'fit_intercept': True, 'standardize_with_source': True, 'rho': 0.7}
[I 2026-06-01 19:38:35,865] Trial 299 finished with value: 0.255606473088716 and parameters: {'alpha': 25579.382371714222, 'n_pcs': 4500, 'iw_method': 'pc_logistic', 'iw_clip_max': 7.0, 'iw_prob_clip': 0.022533378339252716, 'iw_n_components': 20, 'iw_logistic_c': 5.1484031871531886e-05, 'iw_pca_fit': 'combined', 'iw_solver': 'lbfgs', 'iw_rho': 0.7}. Best is trial 268 with value: 0.2587260526062522.
2026-06-01 19:38:35 | INFO | OUTER 5 best (inner mean r=0.2587): {'model_type': 'pc_ridge', 'alpha': 52108.610536557535, 'use_snp_selection': True, 'num_snps': 4500, 'n_pcs': 4500, 'weighting': {'name': 'pc_logistic', 'floor': 1e-06, 'clip_max': 7.0, 'prob_clip': 0.023318583467654568, 'n_components': 20, 'logistic_c': 3.256194798869524e-05, 'pca_fit': 'combined', 'solver': 'lbfgs', 'max_iter': 2000, 'fit_intercept': True, 'standardize_with_source': True, 'rho': 0.85}, 'mean_inner_effective_sample_size': 3353.9166552713127, 'mean_inner_effective_sample_size_threshold': 959.3800000000001}
2026-06-01 19:38:37 | INFO | OUTER 5 TEST r = 0.0733
2026-06-01 19:38:37 | INFO | OUTER 5 incremental summary saved to outputs/final_results/e6_pc_ridge_importance/thr_wing/e6_pc_ridge_importance_thr_wing_results.json
2026-06-01 19:38:37 | INFO | OUTER 6: test_size=1055 island=5 (Hestmannøy)
2026-06-01 19:38:37 | INFO | OUTER 6: using top 10 related inner validation islands for tuning: 4(Gjerøy, avgGRM=0.0047), 0(Nesøy, avgGRM=0.0045), 6(Indre Kvarøy, avgGRM=0.0039), 7(Onøy og Lurøy, avgGRM=0.0026), 1(Myken, avgGRM=0.0014), 3(Selvær, avgGRM=-0.0000), 2(Træna, avgGRM=-0.0005), 8(Lovund, avgGRM=-0.0006), 9(Sleneset, avgGRM=-0.0009), 10(Aldra, avgGRM=-0.0021)
[I 2026-06-01 19:38:37,709] A new study created in memory with name: ridge_importance_inner_outer5
2026-06-01 19:38:37 | INFO | Trial 0 | outer=6 | alpha=1.137e+05 n_pcs=4000 (pc_topk) weight={'name': 'uniform'}
[I 2026-06-01 19:38:44,321] Trial 0 finished with value: 0.22891910070781343 and parameters: {'alpha': 113703.38004442609, 'n_pcs': 4000, 'iw_method': 'uniform'}. Best is trial 0 with value: 0.22891910070781343.
2026-06-01 19:38:44 | INFO | Trial 1 | outer=6 | alpha=1.734e+04 n_pcs=5000 (pc_topk) weight={'name': 'uniform'}
[I 2026-06-01 19:38:52,650] Trial 1 finished with value: 0.22688963358539405 and parameters: {'alpha': 17335.792577698634, 'n_pcs': 5000, 'iw_method': 'uniform'}. Best is trial 0 with value: 0.22891910070781343.
2026-06-01 19:38:52 | INFO | Trial 2 | outer=6 | alpha=1.435e+05 n_pcs=1500 (pc_topk) weight={'name': 'uniform'}
[I 2026-06-01 19:38:56,379] Trial 2 finished with value: 0.21789021732265862 and parameters: {'alpha': 143482.76912965564, 'n_pcs': 1500, 'iw_method': 'uniform'}. Best is trial 0 with value: 0.22891910070781343.
2026-06-01 19:38:56 | INFO | Trial 3 | outer=6 | alpha=1.431e+05 n_pcs=500 (pc_topk) weight={'name': 'uniform'}
[I 2026-06-01 19:38:57,619] Trial 3 finished with value: 0.19320724381085536 and parameters: {'alpha': 143072.2464444983, 'n_pcs': 500, 'iw_method': 'uniform'}. Best is trial 0 with value: 0.22891910070781343.
2026-06-01 19:38:57 | INFO | Trial 4 | outer=6 | alpha=5.373e+06 n_pcs=2000 (pc_topk) weight={'name': 'pc_logistic', 'floor': 1e-06, 'clip_max': 1.5, 'prob_clip': 0.001637400317167702, 'n_components': 80, 'logistic_c': 0.09386700500068379, 'pca_fit': 'combined', 'solver': 'lbfgs', 'max_iter': 2000, 'fit_intercept': True, 'standardize_with_source': True, 'rho': 1.0}
[I 2026-06-01 19:39:18,695] Trial 4 finished with value: 0.1942494376882668 and parameters: {'alpha': 5373167.4046281455, 'n_pcs': 2000, 'iw_method': 'pc_logistic', 'iw_clip_max': 1.5, 'iw_prob_clip': 0.001637400317167702, 'iw_n_components': 80, 'iw_logistic_c': 0.09386700500068379, 'iw_pca_fit': 'combined', 'iw_solver': 'lbfgs', 'iw_rho': 1.0}. Best is trial 0 with value: 0.22891910070781343.
2026-06-01 19:39:18 | INFO | Trial 5 | outer=6 | alpha=6.435e+04 n_pcs=1000 (pc_topk) weight={'name': 'pc_logistic', 'floor': 1e-06, 'clip_max': 7.0, 'prob_clip': 0.004193356127903791, 'n_components': 20, 'logistic_c': 9.236417519010976, 'pca_fit': 'combined', 'solver': 'lbfgs', 'max_iter': 2000, 'fit_intercept': True, 'standardize_with_source': True, 'rho': 1.0}
2026-06-01 19:39:31 | INFO | Trial 5 rejected by ESS guard: mean_ess=676.22 threshold=869.02
[I 2026-06-01 19:39:31,827] Trial 5 finished with value: -1.0 and parameters: {'alpha': 64350.09539177312, 'n_pcs': 1000, 'iw_method': 'pc_logistic', 'iw_clip_max': 7.0, 'iw_prob_clip': 0.004193356127903791, 'iw_n_components': 20, 'iw_logistic_c': 9.236417519010976, 'iw_pca_fit': 'combined', 'iw_solver': 'lbfgs', 'iw_rho': 1.0}. Best is trial 0 with value: 0.22891910070781343.
2026-06-01 19:39:31 | INFO | Trial 6 | outer=6 | alpha=3.046e+05 n_pcs=3500 (pc_topk) weight={'name': 'pc_logistic', 'floor': 1e-06, 'clip_max': 12.0, 'prob_clip': 0.0007016380040663315, 'n_components': 80, 'logistic_c': 0.00021908930989278453, 'pca_fit': 'combined', 'solver': 'lbfgs', 'max_iter': 2000, 'fit_intercept': True, 'standardize_with_source': True, 'rho': 0.7}
[I 2026-06-01 19:39:45,149] Trial 6 finished with value: 0.2169310048105107 and parameters: {'alpha': 304631.0485153137, 'n_pcs': 3500, 'iw_method': 'pc_logistic', 'iw_clip_max': 12.0, 'iw_prob_clip': 0.0007016380040663315, 'iw_n_components': 80, 'iw_logistic_c': 0.00021908930989278453, 'iw_pca_fit': 'combined', 'iw_solver': 'lbfgs', 'iw_rho': 0.7}. Best is trial 0 with value: 0.22891910070781343.
2026-06-01 19:39:45 | INFO | Trial 7 | outer=6 | alpha=7.213e+06 n_pcs=500 (pc_topk) weight={'name': 'uniform'}
[I 2026-06-01 19:39:46,374] Trial 7 finished with value: 0.18273210962762348 and parameters: {'alpha': 7213019.60957054, 'n_pcs': 500, 'iw_method': 'uniform'}. Best is trial 0 with value: 0.22891910070781343.
2026-06-01 19:39:46 | INFO | Trial 8 | outer=6 | alpha=2.347e+03 n_pcs=3000 (pc_topk) weight={'name': 'pc_logistic', 'floor': 1e-06, 'clip_max': 2.5, 'prob_clip': 0.017782866059784724, 'n_components': 60, 'logistic_c': 4.584813955429537e-07, 'pca_fit': 'combined', 'solver': 'lbfgs', 'max_iter': 2000, 'fit_intercept': True, 'standardize_with_source': True, 'rho': 0.3}
[I 2026-06-01 19:39:56,468] Trial 8 finished with value: 0.14239472391792965 and parameters: {'alpha': 2346.6230871488538, 'n_pcs': 3000, 'iw_method': 'pc_logistic', 'iw_clip_max': 2.5, 'iw_prob_clip': 0.017782866059784724, 'iw_n_components': 60, 'iw_logistic_c': 4.584813955429537e-07, 'iw_pca_fit': 'combined', 'iw_solver': 'lbfgs', 'iw_rho': 0.3}. Best is trial 0 with value: 0.22891910070781343.
2026-06-01 19:39:56 | INFO | Trial 9 | outer=6 | alpha=1.067e+03 n_pcs=4000 (pc_topk) weight={'name': 'pc_logistic', 'floor': 1e-06, 'clip_max': 4.0, 'prob_clip': 0.003002704300062754, 'n_components': 10, 'logistic_c': 4.32601466983518e-06, 'pca_fit': 'combined', 'solver': 'lbfgs', 'max_iter': 2000, 'fit_intercept': True, 'standardize_with_source': True, 'rho': 1.0}
[I 2026-06-01 19:40:08,332] Trial 9 finished with value: 0.11721852014829366 and parameters: {'alpha': 1067.2105048492429, 'n_pcs': 4000, 'iw_method': 'pc_logistic', 'iw_clip_max': 4.0, 'iw_prob_clip': 0.003002704300062754, 'iw_n_components': 10, 'iw_logistic_c': 4.32601466983518e-06, 'iw_pca_fit': 'combined', 'iw_solver': 'lbfgs', 'iw_rho': 1.0}. Best is trial 0 with value: 0.22891910070781343.
2026-06-01 19:40:08 | INFO | Trial 10 | outer=6 | alpha=9.030e+05 n_pcs=5000 (pc_topk) weight={'name': 'uniform'}
[I 2026-06-01 19:40:17,006] Trial 10 finished with value: 0.20961663225818122 and parameters: {'alpha': 902970.0505273588, 'n_pcs': 5000, 'iw_method': 'uniform'}. Best is trial 0 with value: 0.22891910070781343.
2026-06-01 19:40:17 | INFO | Trial 11 | outer=6 | alpha=1.245e+04 n_pcs=5000 (pc_topk) weight={'name': 'uniform'}
[I 2026-06-01 19:40:25,643] Trial 11 finished with value: 0.22291415875908083 and parameters: {'alpha': 12451.817386682478, 'n_pcs': 5000, 'iw_method': 'uniform'}. Best is trial 0 with value: 0.22891910070781343.
2026-06-01 19:40:25 | INFO | Trial 12 | outer=6 | alpha=1.792e+04 n_pcs=4000 (pc_topk) weight={'name': 'uniform'}
[I 2026-06-01 19:40:32,463] Trial 12 finished with value: 0.22408135034476215 and parameters: {'alpha': 17922.511917924126, 'n_pcs': 4000, 'iw_method': 'uniform'}. Best is trial 0 with value: 0.22891910070781343.
2026-06-01 19:40:32 | INFO | Trial 13 | outer=6 | alpha=1.913e+04 n_pcs=4500 (pc_topk) weight={'name': 'uniform'}
[I 2026-06-01 19:40:40,820] Trial 13 finished with value: 0.22764646052003074 and parameters: {'alpha': 19132.13627882653, 'n_pcs': 4500, 'iw_method': 'uniform'}. Best is trial 0 with value: 0.22891910070781343.
2026-06-01 19:40:40 | INFO | Trial 14 | outer=6 | alpha=8.124e+05 n_pcs=4000 (pc_topk) weight={'name': 'uniform'}
[I 2026-06-01 19:40:47,269] Trial 14 finished with value: 0.21181816175371124 and parameters: {'alpha': 812435.5329230118, 'n_pcs': 4000, 'iw_method': 'uniform'}. Best is trial 0 with value: 0.22891910070781343.
2026-06-01 19:40:47 | INFO | Trial 15 | outer=6 | alpha=3.569e+04 n_pcs=2500 (pc_topk) weight={'name': 'uniform'}
[I 2026-06-01 19:40:51,921] Trial 15 finished with value: 0.22108645879815775 and parameters: {'alpha': 35688.940173379786, 'n_pcs': 2500, 'iw_method': 'uniform'}. Best is trial 0 with value: 0.22891910070781343.
2026-06-01 19:40:51 | INFO | Trial 16 | outer=6 | alpha=5.443e+03 n_pcs=4500 (pc_topk) weight={'name': 'uniform'}
[I 2026-06-01 19:41:00,201] Trial 16 finished with value: 0.20092529290876948 and parameters: {'alpha': 5443.00802406258, 'n_pcs': 4500, 'iw_method': 'uniform'}. Best is trial 0 with value: 0.22891910070781343.
2026-06-01 19:41:00 | INFO | Trial 17 | outer=6 | alpha=3.658e+05 n_pcs=3000 (pc_topk) weight={'name': 'uniform'}
[I 2026-06-01 19:41:05,061] Trial 17 finished with value: 0.2182834899541012 and parameters: {'alpha': 365759.5232064611, 'n_pcs': 3000, 'iw_method': 'uniform'}. Best is trial 0 with value: 0.22891910070781343.
2026-06-01 19:41:05 | INFO | Trial 18 | outer=6 | alpha=4.298e+03 n_pcs=3500 (pc_topk) weight={'name': 'uniform'}
[I 2026-06-01 19:41:11,092] Trial 18 finished with value: 0.16530723039352957 and parameters: {'alpha': 4297.891908049084, 'n_pcs': 3500, 'iw_method': 'uniform'}. Best is trial 0 with value: 0.22891910070781343.
2026-06-01 19:41:11 | INFO | Trial 19 | outer=6 | alpha=3.714e+04 n_pcs=4500 (pc_topk) weight={'name': 'uniform'}
[I 2026-06-01 19:41:19,079] Trial 19 finished with value: 0.23226271822259342 and parameters: {'alpha': 37135.95011052599, 'n_pcs': 4500, 'iw_method': 'uniform'}. Best is trial 19 with value: 0.23226271822259342.
2026-06-01 19:41:19 | INFO | Trial 20 | outer=6 | alpha=2.450e+06 n_pcs=3500 (pc_topk) weight={'name': 'uniform'}
[I 2026-06-01 19:41:24,604] Trial 20 finished with value: 0.20609260808607693 and parameters: {'alpha': 2449852.09368159, 'n_pcs': 3500, 'iw_method': 'uniform'}. Best is trial 19 with value: 0.23226271822259342.
2026-06-01 19:41:24 | INFO | Trial 21 | outer=6 | alpha=5.642e+04 n_pcs=4500 (pc_topk) weight={'name': 'uniform'}
[I 2026-06-01 19:41:32,568] Trial 21 finished with value: 0.23233073142763963 and parameters: {'alpha': 56423.51703014092, 'n_pcs': 4500, 'iw_method': 'uniform'}. Best is trial 21 with value: 0.23233073142763963.
2026-06-01 19:41:32 | INFO | Trial 22 | outer=6 | alpha=5.649e+04 n_pcs=4500 (pc_topk) weight={'name': 'uniform'}
[I 2026-06-01 19:41:40,607] Trial 22 finished with value: 0.2323279606594327 and parameters: {'alpha': 56494.901577378594, 'n_pcs': 4500, 'iw_method': 'uniform'}. Best is trial 21 with value: 0.23233073142763963.
2026-06-01 19:41:40 | INFO | Trial 23 | outer=6 | alpha=5.241e+04 n_pcs=4500 (pc_topk) weight={'name': 'uniform'}
[I 2026-06-01 19:41:48,735] Trial 23 finished with value: 0.2324619820588727 and parameters: {'alpha': 52414.50518039546, 'n_pcs': 4500, 'iw_method': 'uniform'}. Best is trial 23 with value: 0.2324619820588727.
2026-06-01 19:41:48 | INFO | Trial 24 | outer=6 | alpha=5.785e+04 n_pcs=5000 (pc_topk) weight={'name': 'uniform'}
[I 2026-06-01 19:41:57,310] Trial 24 finished with value: 0.23129907881692918 and parameters: {'alpha': 57853.487672630894, 'n_pcs': 5000, 'iw_method': 'uniform'}. Best is trial 23 with value: 0.2324619820588727.
2026-06-01 19:41:57 | INFO | Trial 25 | outer=6 | alpha=3.040e+05 n_pcs=4500 (pc_topk) weight={'name': 'uniform'}
[I 2026-06-01 19:42:05,707] Trial 25 finished with value: 0.21939406571467654 and parameters: {'alpha': 304044.5976496834, 'n_pcs': 4500, 'iw_method': 'uniform'}. Best is trial 23 with value: 0.2324619820588727.
2026-06-01 19:42:05 | INFO | Trial 26 | outer=6 | alpha=6.586e+03 n_pcs=2500 (pc_topk) weight={'name': 'pc_logistic', 'floor': 1e-06, 'clip_max': 2.5, 'prob_clip': 0.04783268173298191, 'n_components': 40, 'logistic_c': 0.0034285114017368, 'pca_fit': 'combined', 'solver': 'lbfgs', 'max_iter': 2000, 'fit_intercept': True, 'standardize_with_source': True, 'rho': 0.5}
[I 2026-06-01 19:42:20,731] Trial 26 finished with value: 0.17130311271797205 and parameters: {'alpha': 6585.903380288864, 'n_pcs': 2500, 'iw_method': 'pc_logistic', 'iw_clip_max': 2.5, 'iw_prob_clip': 0.04783268173298191, 'iw_n_components': 40, 'iw_logistic_c': 0.0034285114017368, 'iw_pca_fit': 'combined', 'iw_solver': 'lbfgs', 'iw_rho': 0.5}. Best is trial 23 with value: 0.2324619820588727.
2026-06-01 19:42:20 | INFO | Trial 27 | outer=6 | alpha=3.726e+04 n_pcs=4500 (pc_topk) weight={'name': 'uniform'}
[I 2026-06-01 19:42:29,239] Trial 27 finished with value: 0.23227164958627405 and parameters: {'alpha': 37262.71251533625, 'n_pcs': 4500, 'iw_method': 'uniform'}. Best is trial 23 with value: 0.2324619820588727.
2026-06-01 19:42:29 | INFO | Trial 28 | outer=6 | alpha=7.561e+04 n_pcs=3500 (pc_topk) weight={'name': 'uniform'}
[I 2026-06-01 19:42:35,101] Trial 28 finished with value: 0.22899047116392307 and parameters: {'alpha': 75613.22060711085, 'n_pcs': 3500, 'iw_method': 'uniform'}. Best is trial 23 with value: 0.2324619820588727.
2026-06-01 19:42:35 | INFO | Trial 29 | outer=6 | alpha=1.397e+05 n_pcs=4000 (pc_topk) weight={'name': 'uniform'}
[I 2026-06-01 19:42:41,912] Trial 29 finished with value: 0.22728596279910113 and parameters: {'alpha': 139652.89894072743, 'n_pcs': 4000, 'iw_method': 'uniform'}. Best is trial 23 with value: 0.2324619820588727.
2026-06-01 19:42:41 | INFO | Trial 30 | outer=6 | alpha=9.389e+03 n_pcs=5000 (pc_topk) weight={'name': 'uniform'}
