[I 2026-06-02 00:20:16,841] Trial 226 finished with value: 0.2306155011948381 and parameters: {'alpha': 60258.872719544524, 'n_pcs': 5000, 'iw_method': 'pc_logistic', 'iw_clip_max': 4.0, 'iw_prob_clip': 0.012838499511322387, 'iw_n_components': 80, 'iw_logistic_c': 0.16097282496942264, 'iw_pca_fit': 'combined', 'iw_solver': 'lbfgs', 'iw_rho': 0.5}. Best is trial 211 with value: 0.232461192271555.
2026-06-02 00:20:16 | INFO | Trial 227 | outer=9 | alpha=7.641e+04 n_pcs=5000 (pc_topk) weight={'name': 'pc_logistic', 'floor': 1e-06, 'clip_max': 2.5, 'prob_clip': 0.010081165419284065, 'n_components': 80, 'logistic_c': 0.06994598529396, 'pca_fit': 'combined', 'solver': 'lbfgs', 'max_iter': 2000, 'fit_intercept': True, 'standardize_with_source': True, 'rho': 0.7}
[I 2026-06-02 00:20:41,235] Trial 227 finished with value: 0.23206909431264272 and parameters: {'alpha': 76406.02806045288, 'n_pcs': 5000, 'iw_method': 'pc_logistic', 'iw_clip_max': 2.5, 'iw_prob_clip': 0.010081165419284065, 'iw_n_components': 80, 'iw_logistic_c': 0.06994598529396, 'iw_pca_fit': 'combined', 'iw_solver': 'lbfgs', 'iw_rho': 0.7}. Best is trial 211 with value: 0.232461192271555.
2026-06-02 00:20:41 | INFO | Trial 228 | outer=9 | alpha=7.069e+04 n_pcs=5000 (pc_topk) weight={'name': 'pc_logistic', 'floor': 1e-06, 'clip_max': 2.5, 'prob_clip': 0.010274510737729767, 'n_components': 80, 'logistic_c': 0.06373747593037563, 'pca_fit': 'combined', 'solver': 'lbfgs', 'max_iter': 2000, 'fit_intercept': True, 'standardize_with_source': True, 'rho': 0.85}
[I 2026-06-02 00:21:07,516] Trial 228 finished with value: 0.23261458705948912 and parameters: {'alpha': 70689.24806597698, 'n_pcs': 5000, 'iw_method': 'pc_logistic', 'iw_clip_max': 2.5, 'iw_prob_clip': 0.010274510737729767, 'iw_n_components': 80, 'iw_logistic_c': 0.06373747593037563, 'iw_pca_fit': 'combined', 'iw_solver': 'lbfgs', 'iw_rho': 0.85}. Best is trial 228 with value: 0.23261458705948912.
2026-06-02 00:21:07 | INFO | Trial 229 | outer=9 | alpha=6.738e+04 n_pcs=5000 (pc_topk) weight={'name': 'pc_logistic', 'floor': 1e-06, 'clip_max': 2.5, 'prob_clip': 0.01282224657479668, 'n_components': 80, 'logistic_c': 0.0626915813546213, 'pca_fit': 'combined', 'solver': 'lbfgs', 'max_iter': 2000, 'fit_intercept': True, 'standardize_with_source': True, 'rho': 0.85}
[I 2026-06-02 00:21:33,334] Trial 229 finished with value: 0.2323927665306964 and parameters: {'alpha': 67383.0512021086, 'n_pcs': 5000, 'iw_method': 'pc_logistic', 'iw_clip_max': 2.5, 'iw_prob_clip': 0.01282224657479668, 'iw_n_components': 80, 'iw_logistic_c': 0.0626915813546213, 'iw_pca_fit': 'combined', 'iw_solver': 'lbfgs', 'iw_rho': 0.85}. Best is trial 228 with value: 0.23261458705948912.
2026-06-02 00:21:33 | INFO | Trial 230 | outer=9 | alpha=6.413e+04 n_pcs=5000 (pc_topk) weight={'name': 'pc_logistic', 'floor': 1e-06, 'clip_max': 2.5, 'prob_clip': 0.013145141324474132, 'n_components': 80, 'logistic_c': 0.06443083882098784, 'pca_fit': 'combined', 'solver': 'lbfgs', 'max_iter': 2000, 'fit_intercept': True, 'standardize_with_source': True, 'rho': 0.85}
[I 2026-06-02 00:21:57,446] Trial 230 finished with value: 0.23241667189348436 and parameters: {'alpha': 64131.97158986215, 'n_pcs': 5000, 'iw_method': 'pc_logistic', 'iw_clip_max': 2.5, 'iw_prob_clip': 0.013145141324474132, 'iw_n_components': 80, 'iw_logistic_c': 0.06443083882098784, 'iw_pca_fit': 'combined', 'iw_solver': 'lbfgs', 'iw_rho': 0.85}. Best is trial 228 with value: 0.23261458705948912.
2026-06-02 00:21:57 | INFO | Trial 231 | outer=9 | alpha=6.563e+04 n_pcs=5000 (pc_topk) weight={'name': 'pc_logistic', 'floor': 1e-06, 'clip_max': 2.5, 'prob_clip': 0.01344380126869807, 'n_components': 80, 'logistic_c': 0.061616796822032804, 'pca_fit': 'combined', 'solver': 'lbfgs', 'max_iter': 2000, 'fit_intercept': True, 'standardize_with_source': True, 'rho': 0.85}
[I 2026-06-02 00:22:23,487] Trial 231 finished with value: 0.23234396570859647 and parameters: {'alpha': 65630.18825535903, 'n_pcs': 5000, 'iw_method': 'pc_logistic', 'iw_clip_max': 2.5, 'iw_prob_clip': 0.01344380126869807, 'iw_n_components': 80, 'iw_logistic_c': 0.061616796822032804, 'iw_pca_fit': 'combined', 'iw_solver': 'lbfgs', 'iw_rho': 0.85}. Best is trial 228 with value: 0.23261458705948912.
2026-06-02 00:22:23 | INFO | Trial 232 | outer=9 | alpha=5.885e+04 n_pcs=5000 (pc_topk) weight={'name': 'pc_logistic', 'floor': 1e-06, 'clip_max': 2.5, 'prob_clip': 0.013195158478020583, 'n_components': 80, 'logistic_c': 0.061160559692353775, 'pca_fit': 'combined', 'solver': 'lbfgs', 'max_iter': 2000, 'fit_intercept': True, 'standardize_with_source': True, 'rho': 0.85}
[I 2026-06-02 00:22:49,604] Trial 232 finished with value: 0.23257065605939453 and parameters: {'alpha': 58852.25030056754, 'n_pcs': 5000, 'iw_method': 'pc_logistic', 'iw_clip_max': 2.5, 'iw_prob_clip': 0.013195158478020583, 'iw_n_components': 80, 'iw_logistic_c': 0.061160559692353775, 'iw_pca_fit': 'combined', 'iw_solver': 'lbfgs', 'iw_rho': 0.85}. Best is trial 228 with value: 0.23261458705948912.
2026-06-02 00:22:49 | INFO | Trial 233 | outer=9 | alpha=5.884e+04 n_pcs=5000 (pc_topk) weight={'name': 'pc_logistic', 'floor': 1e-06, 'clip_max': 2.5, 'prob_clip': 0.016915477509666942, 'n_components': 80, 'logistic_c': 0.05015736417517379, 'pca_fit': 'combined', 'solver': 'lbfgs', 'max_iter': 2000, 'fit_intercept': True, 'standardize_with_source': True, 'rho': 0.85}
[I 2026-06-02 00:23:13,497] Trial 233 finished with value: 0.23188530143682634 and parameters: {'alpha': 58837.16022821044, 'n_pcs': 5000, 'iw_method': 'pc_logistic', 'iw_clip_max': 2.5, 'iw_prob_clip': 0.016915477509666942, 'iw_n_components': 80, 'iw_logistic_c': 0.05015736417517379, 'iw_pca_fit': 'combined', 'iw_solver': 'lbfgs', 'iw_rho': 0.85}. Best is trial 228 with value: 0.23261458705948912.
2026-06-02 00:23:13 | INFO | Trial 234 | outer=9 | alpha=5.661e+04 n_pcs=5000 (pc_topk) weight={'name': 'pc_logistic', 'floor': 1e-06, 'clip_max': 2.5, 'prob_clip': 0.016201375355217314, 'n_components': 80, 'logistic_c': 0.05931557856039524, 'pca_fit': 'combined', 'solver': 'lbfgs', 'max_iter': 2000, 'fit_intercept': True, 'standardize_with_source': True, 'rho': 0.85}
[I 2026-06-02 00:23:37,924] Trial 234 finished with value: 0.23205977853308055 and parameters: {'alpha': 56613.339587369876, 'n_pcs': 5000, 'iw_method': 'pc_logistic', 'iw_clip_max': 2.5, 'iw_prob_clip': 0.016201375355217314, 'iw_n_components': 80, 'iw_logistic_c': 0.05931557856039524, 'iw_pca_fit': 'combined', 'iw_solver': 'lbfgs', 'iw_rho': 0.85}. Best is trial 228 with value: 0.23261458705948912.
2026-06-02 00:23:37 | INFO | Trial 235 | outer=9 | alpha=5.481e+04 n_pcs=5000 (pc_topk) weight={'name': 'pc_logistic', 'floor': 1e-06, 'clip_max': 2.5, 'prob_clip': 0.017758867704141795, 'n_components': 80, 'logistic_c': 0.06463470733547153, 'pca_fit': 'combined', 'solver': 'lbfgs', 'max_iter': 2000, 'fit_intercept': True, 'standardize_with_source': True, 'rho': 0.85}
[I 2026-06-02 00:24:03,017] Trial 235 finished with value: 0.23197207777562787 and parameters: {'alpha': 54813.180911122465, 'n_pcs': 5000, 'iw_method': 'pc_logistic', 'iw_clip_max': 2.5, 'iw_prob_clip': 0.017758867704141795, 'iw_n_components': 80, 'iw_logistic_c': 0.06463470733547153, 'iw_pca_fit': 'combined', 'iw_solver': 'lbfgs', 'iw_rho': 0.85}. Best is trial 228 with value: 0.23261458705948912.
2026-06-02 00:24:03 | INFO | Trial 236 | outer=9 | alpha=5.687e+04 n_pcs=5000 (pc_topk) weight={'name': 'pc_logistic', 'floor': 1e-06, 'clip_max': 2.5, 'prob_clip': 0.01750825489459295, 'n_components': 80, 'logistic_c': 0.06571495070091954, 'pca_fit': 'combined', 'solver': 'lbfgs', 'max_iter': 2000, 'fit_intercept': True, 'standardize_with_source': True, 'rho': 0.85}
[I 2026-06-02 00:24:27,709] Trial 236 finished with value: 0.2319492434699278 and parameters: {'alpha': 56867.559628690986, 'n_pcs': 5000, 'iw_method': 'pc_logistic', 'iw_clip_max': 2.5, 'iw_prob_clip': 0.01750825489459295, 'iw_n_components': 80, 'iw_logistic_c': 0.06571495070091954, 'iw_pca_fit': 'combined', 'iw_solver': 'lbfgs', 'iw_rho': 0.85}. Best is trial 228 with value: 0.23261458705948912.
2026-06-02 00:24:27 | INFO | Trial 237 | outer=9 | alpha=5.223e+04 n_pcs=5000 (pc_topk) weight={'name': 'pc_logistic', 'floor': 1e-06, 'clip_max': 2.5, 'prob_clip': 0.019006825712431945, 'n_components': 80, 'logistic_c': 0.07314263473280352, 'pca_fit': 'combined', 'solver': 'lbfgs', 'max_iter': 2000, 'fit_intercept': True, 'standardize_with_source': True, 'rho': 0.85}
[I 2026-06-02 00:24:53,194] Trial 237 finished with value: 0.2319675136737772 and parameters: {'alpha': 52225.43128568026, 'n_pcs': 5000, 'iw_method': 'pc_logistic', 'iw_clip_max': 2.5, 'iw_prob_clip': 0.019006825712431945, 'iw_n_components': 80, 'iw_logistic_c': 0.07314263473280352, 'iw_pca_fit': 'combined', 'iw_solver': 'lbfgs', 'iw_rho': 0.85}. Best is trial 228 with value: 0.23261458705948912.
2026-06-02 00:24:53 | INFO | Trial 238 | outer=9 | alpha=5.182e+04 n_pcs=5000 (pc_topk) weight={'name': 'pc_logistic', 'floor': 1e-06, 'clip_max': 2.5, 'prob_clip': 0.018237035614805122, 'n_components': 80, 'logistic_c': 0.07284820339963523, 'pca_fit': 'combined', 'solver': 'lbfgs', 'max_iter': 2000, 'fit_intercept': True, 'standardize_with_source': True, 'rho': 0.85}
[I 2026-06-02 00:25:18,267] Trial 238 finished with value: 0.23201034022825268 and parameters: {'alpha': 51817.34612414248, 'n_pcs': 5000, 'iw_method': 'pc_logistic', 'iw_clip_max': 2.5, 'iw_prob_clip': 0.018237035614805122, 'iw_n_components': 80, 'iw_logistic_c': 0.07284820339963523, 'iw_pca_fit': 'combined', 'iw_solver': 'lbfgs', 'iw_rho': 0.85}. Best is trial 228 with value: 0.23261458705948912.
2026-06-02 00:25:18 | INFO | Trial 239 | outer=9 | alpha=5.530e+04 n_pcs=5000 (pc_topk) weight={'name': 'pc_logistic', 'floor': 1e-06, 'clip_max': 2.5, 'prob_clip': 0.01843413636697546, 'n_components': 80, 'logistic_c': 0.06708251889708414, 'pca_fit': 'combined', 'solver': 'lbfgs', 'max_iter': 2000, 'fit_intercept': True, 'standardize_with_source': True, 'rho': 0.85}
[I 2026-06-02 00:25:43,561] Trial 239 finished with value: 0.2319434795433899 and parameters: {'alpha': 55296.97340208633, 'n_pcs': 5000, 'iw_method': 'pc_logistic', 'iw_clip_max': 2.5, 'iw_prob_clip': 0.01843413636697546, 'iw_n_components': 80, 'iw_logistic_c': 0.06708251889708414, 'iw_pca_fit': 'combined', 'iw_solver': 'lbfgs', 'iw_rho': 0.85}. Best is trial 228 with value: 0.23261458705948912.
2026-06-02 00:25:43 | INFO | Trial 240 | outer=9 | alpha=5.459e+04 n_pcs=5000 (pc_topk) weight={'name': 'pc_logistic', 'floor': 1e-06, 'clip_max': 2.5, 'prob_clip': 0.01806231941581441, 'n_components': 80, 'logistic_c': 0.06992649307311882, 'pca_fit': 'combined', 'solver': 'lbfgs', 'max_iter': 2000, 'fit_intercept': True, 'standardize_with_source': True, 'rho': 0.85}
[I 2026-06-02 00:26:09,027] Trial 240 finished with value: 0.2319748191018745 and parameters: {'alpha': 54586.77356716079, 'n_pcs': 5000, 'iw_method': 'pc_logistic', 'iw_clip_max': 2.5, 'iw_prob_clip': 0.01806231941581441, 'iw_n_components': 80, 'iw_logistic_c': 0.06992649307311882, 'iw_pca_fit': 'combined', 'iw_solver': 'lbfgs', 'iw_rho': 0.85}. Best is trial 228 with value: 0.23261458705948912.
2026-06-02 00:26:09 | INFO | Trial 241 | outer=9 | alpha=5.232e+04 n_pcs=5000 (pc_topk) weight={'name': 'pc_logistic', 'floor': 1e-06, 'clip_max': 2.5, 'prob_clip': 0.01853105950895794, 'n_components': 80, 'logistic_c': 0.06630234975014829, 'pca_fit': 'combined', 'solver': 'lbfgs', 'max_iter': 2000, 'fit_intercept': True, 'standardize_with_source': True, 'rho': 0.85}
[I 2026-06-02 00:26:34,880] Trial 241 finished with value: 0.2319791241161393 and parameters: {'alpha': 52320.87734041803, 'n_pcs': 5000, 'iw_method': 'pc_logistic', 'iw_clip_max': 2.5, 'iw_prob_clip': 0.01853105950895794, 'iw_n_components': 80, 'iw_logistic_c': 0.06630234975014829, 'iw_pca_fit': 'combined', 'iw_solver': 'lbfgs', 'iw_rho': 0.85}. Best is trial 228 with value: 0.23261458705948912.
2026-06-02 00:26:34 | INFO | Trial 242 | outer=9 | alpha=5.227e+04 n_pcs=5000 (pc_topk) weight={'name': 'pc_logistic', 'floor': 1e-06, 'clip_max': 2.5, 'prob_clip': 0.022108261070772815, 'n_components': 80, 'logistic_c': 0.06889685849088925, 'pca_fit': 'combined', 'solver': 'lbfgs', 'max_iter': 2000, 'fit_intercept': True, 'standardize_with_source': True, 'rho': 0.85}
[I 2026-06-02 00:27:00,628] Trial 242 finished with value: 0.23172434353646448 and parameters: {'alpha': 52273.213855376765, 'n_pcs': 5000, 'iw_method': 'pc_logistic', 'iw_clip_max': 2.5, 'iw_prob_clip': 0.022108261070772815, 'iw_n_components': 80, 'iw_logistic_c': 0.06889685849088925, 'iw_pca_fit': 'combined', 'iw_solver': 'lbfgs', 'iw_rho': 0.85}. Best is trial 228 with value: 0.23261458705948912.
2026-06-02 00:27:00 | INFO | Trial 243 | outer=9 | alpha=5.259e+04 n_pcs=5000 (pc_topk) weight={'name': 'pc_logistic', 'floor': 1e-06, 'clip_max': 2.5, 'prob_clip': 0.01775198780000549, 'n_components': 80, 'logistic_c': 0.07558910090722543, 'pca_fit': 'combined', 'solver': 'lbfgs', 'max_iter': 2000, 'fit_intercept': True, 'standardize_with_source': True, 'rho': 0.85}
[I 2026-06-02 00:27:26,153] Trial 243 finished with value: 0.23203786695788117 and parameters: {'alpha': 52587.822293672536, 'n_pcs': 5000, 'iw_method': 'pc_logistic', 'iw_clip_max': 2.5, 'iw_prob_clip': 0.01775198780000549, 'iw_n_components': 80, 'iw_logistic_c': 0.07558910090722543, 'iw_pca_fit': 'combined', 'iw_solver': 'lbfgs', 'iw_rho': 0.85}. Best is trial 228 with value: 0.23261458705948912.
2026-06-02 00:27:26 | INFO | Trial 244 | outer=9 | alpha=5.167e+04 n_pcs=5000 (pc_topk) weight={'name': 'pc_logistic', 'floor': 1e-06, 'clip_max': 2.5, 'prob_clip': 0.017253922390361283, 'n_components': 80, 'logistic_c': 0.020175850562126462, 'pca_fit': 'combined', 'solver': 'lbfgs', 'max_iter': 2000, 'fit_intercept': True, 'standardize_with_source': True, 'rho': 0.85}
[I 2026-06-02 00:27:49,697] Trial 244 finished with value: 0.23181396640550944 and parameters: {'alpha': 51669.14951003143, 'n_pcs': 5000, 'iw_method': 'pc_logistic', 'iw_clip_max': 2.5, 'iw_prob_clip': 0.017253922390361283, 'iw_n_components': 80, 'iw_logistic_c': 0.020175850562126462, 'iw_pca_fit': 'combined', 'iw_solver': 'lbfgs', 'iw_rho': 0.85}. Best is trial 228 with value: 0.23261458705948912.
2026-06-02 00:27:49 | INFO | Trial 245 | outer=9 | alpha=5.057e+04 n_pcs=5000 (pc_topk) weight={'name': 'pc_logistic', 'floor': 1e-06, 'clip_max': 2.5, 'prob_clip': 0.019570533431383954, 'n_components': 80, 'logistic_c': 0.07243154759119458, 'pca_fit': 'combined', 'solver': 'lbfgs', 'max_iter': 2000, 'fit_intercept': True, 'standardize_with_source': True, 'rho': 0.85}
[I 2026-06-02 00:28:14,341] Trial 245 finished with value: 0.23197775763210463 and parameters: {'alpha': 50567.772466699585, 'n_pcs': 5000, 'iw_method': 'pc_logistic', 'iw_clip_max': 2.5, 'iw_prob_clip': 0.019570533431383954, 'iw_n_components': 80, 'iw_logistic_c': 0.07243154759119458, 'iw_pca_fit': 'combined', 'iw_solver': 'lbfgs', 'iw_rho': 0.85}. Best is trial 228 with value: 0.23261458705948912.
2026-06-02 00:28:14 | INFO | Trial 246 | outer=9 | alpha=5.098e+04 n_pcs=5000 (pc_topk) weight={'name': 'pc_logistic', 'floor': 1e-06, 'clip_max': 2.5, 'prob_clip': 0.009591567708903475, 'n_components': 80, 'logistic_c': 0.023203974714623415, 'pca_fit': 'combined', 'solver': 'lbfgs', 'max_iter': 2000, 'fit_intercept': True, 'standardize_with_source': True, 'rho': 0.85}
[I 2026-06-02 00:28:38,485] Trial 246 finished with value: 0.23302871664292 and parameters: {'alpha': 50984.702126931574, 'n_pcs': 5000, 'iw_method': 'pc_logistic', 'iw_clip_max': 2.5, 'iw_prob_clip': 0.009591567708903475, 'iw_n_components': 80, 'iw_logistic_c': 0.023203974714623415, 'iw_pca_fit': 'combined', 'iw_solver': 'lbfgs', 'iw_rho': 0.85}. Best is trial 246 with value: 0.23302871664292.
2026-06-02 00:28:38 | INFO | Trial 247 | outer=9 | alpha=4.815e+04 n_pcs=5000 (pc_topk) weight={'name': 'pc_logistic', 'floor': 1e-06, 'clip_max': 2.5, 'prob_clip': 0.02134843953249403, 'n_components': 80, 'logistic_c': 0.08324265621997382, 'pca_fit': 'combined', 'solver': 'lbfgs', 'max_iter': 2000, 'fit_intercept': True, 'standardize_with_source': True, 'rho': 0.85}
[I 2026-06-02 00:29:04,398] Trial 247 finished with value: 0.23189662473115896 and parameters: {'alpha': 48145.94840464456, 'n_pcs': 5000, 'iw_method': 'pc_logistic', 'iw_clip_max': 2.5, 'iw_prob_clip': 0.02134843953249403, 'iw_n_components': 80, 'iw_logistic_c': 0.08324265621997382, 'iw_pca_fit': 'combined', 'iw_solver': 'lbfgs', 'iw_rho': 0.85}. Best is trial 246 with value: 0.23302871664292.
2026-06-02 00:29:04 | INFO | Trial 248 | outer=9 | alpha=5.194e+04 n_pcs=5000 (pc_topk) weight={'name': 'pc_logistic', 'floor': 1e-06, 'clip_max': 2.5, 'prob_clip': 0.019251113625163355, 'n_components': 80, 'logistic_c': 0.025971943041246493, 'pca_fit': 'combined', 'solver': 'lbfgs', 'max_iter': 2000, 'fit_intercept': True, 'standardize_with_source': True, 'rho': 0.85}
[I 2026-06-02 00:29:28,677] Trial 248 finished with value: 0.23163752604668483 and parameters: {'alpha': 51938.77651220101, 'n_pcs': 5000, 'iw_method': 'pc_logistic', 'iw_clip_max': 2.5, 'iw_prob_clip': 0.019251113625163355, 'iw_n_components': 80, 'iw_logistic_c': 0.025971943041246493, 'iw_pca_fit': 'combined', 'iw_solver': 'lbfgs', 'iw_rho': 0.85}. Best is trial 246 with value: 0.23302871664292.
2026-06-02 00:29:28 | INFO | Trial 249 | outer=9 | alpha=4.876e+04 n_pcs=5000 (pc_topk) weight={'name': 'pc_logistic', 'floor': 1e-06, 'clip_max': 2.5, 'prob_clip': 0.009622549097398531, 'n_components': 80, 'logistic_c': 0.3541993584399001, 'pca_fit': 'combined', 'solver': 'lbfgs', 'max_iter': 2000, 'fit_intercept': True, 'standardize_with_source': True, 'rho': 0.85}
[I 2026-06-02 00:29:53,157] Trial 249 finished with value: 0.2330357454325883 and parameters: {'alpha': 48760.34916682933, 'n_pcs': 5000, 'iw_method': 'pc_logistic', 'iw_clip_max': 2.5, 'iw_prob_clip': 0.009622549097398531, 'iw_n_components': 80, 'iw_logistic_c': 0.3541993584399001, 'iw_pca_fit': 'combined', 'iw_solver': 'lbfgs', 'iw_rho': 0.85}. Best is trial 249 with value: 0.2330357454325883.
2026-06-02 00:29:53 | INFO | Trial 250 | outer=9 | alpha=4.534e+04 n_pcs=5000 (pc_topk) weight={'name': 'pc_logistic', 'floor': 1e-06, 'clip_max': 2.5, 'prob_clip': 0.009472981067636442, 'n_components': 80, 'logistic_c': 0.32007221981162887, 'pca_fit': 'combined', 'solver': 'lbfgs', 'max_iter': 2000, 'fit_intercept': True, 'standardize_with_source': True, 'rho': 0.85}
[I 2026-06-02 00:30:18,692] Trial 250 finished with value: 0.23296885156669336 and parameters: {'alpha': 45341.08513819578, 'n_pcs': 5000, 'iw_method': 'pc_logistic', 'iw_clip_max': 2.5, 'iw_prob_clip': 0.009472981067636442, 'iw_n_components': 80, 'iw_logistic_c': 0.32007221981162887, 'iw_pca_fit': 'combined', 'iw_solver': 'lbfgs', 'iw_rho': 0.85}. Best is trial 249 with value: 0.2330357454325883.
2026-06-02 00:30:18 | INFO | Trial 251 | outer=9 | alpha=4.640e+04 n_pcs=5000 (pc_topk) weight={'name': 'pc_logistic', 'floor': 1e-06, 'clip_max': 2.5, 'prob_clip': 0.009819653704924165, 'n_components': 80, 'logistic_c': 0.2973856151027501, 'pca_fit': 'combined', 'solver': 'lbfgs', 'max_iter': 2000, 'fit_intercept': True, 'standardize_with_source': True, 'rho': 0.85}
[I 2026-06-02 00:30:42,819] Trial 251 finished with value: 0.23298617800919508 and parameters: {'alpha': 46401.37264521721, 'n_pcs': 5000, 'iw_method': 'pc_logistic', 'iw_clip_max': 2.5, 'iw_prob_clip': 0.009819653704924165, 'iw_n_components': 80, 'iw_logistic_c': 0.2973856151027501, 'iw_pca_fit': 'combined', 'iw_solver': 'lbfgs', 'iw_rho': 0.85}. Best is trial 249 with value: 0.2330357454325883.
2026-06-02 00:30:42 | INFO | Trial 252 | outer=9 | alpha=4.563e+04 n_pcs=5000 (pc_topk) weight={'name': 'pc_logistic', 'floor': 1e-06, 'clip_max': 2.5, 'prob_clip': 0.009424697242123276, 'n_components': 80, 'logistic_c': 0.3553836675790718, 'pca_fit': 'combined', 'solver': 'lbfgs', 'max_iter': 2000, 'fit_intercept': True, 'standardize_with_source': True, 'rho': 0.85}
[I 2026-06-02 00:31:07,124] Trial 252 finished with value: 0.2329776139216851 and parameters: {'alpha': 45628.417069908086, 'n_pcs': 5000, 'iw_method': 'pc_logistic', 'iw_clip_max': 2.5, 'iw_prob_clip': 0.009424697242123276, 'iw_n_components': 80, 'iw_logistic_c': 0.3553836675790718, 'iw_pca_fit': 'combined', 'iw_solver': 'lbfgs', 'iw_rho': 0.85}. Best is trial 249 with value: 0.2330357454325883.
2026-06-02 00:31:07 | INFO | Trial 253 | outer=9 | alpha=4.581e+04 n_pcs=5000 (pc_topk) weight={'name': 'pc_logistic', 'floor': 1e-06, 'clip_max': 12.0, 'prob_clip': 0.009692678032716694, 'n_components': 80, 'logistic_c': 0.3966861136615401, 'pca_fit': 'combined', 'solver': 'lbfgs', 'max_iter': 2000, 'fit_intercept': True, 'standardize_with_source': True, 'rho': 0.85}
[I 2026-06-02 00:31:32,895] Trial 253 finished with value: 0.2259491794473789 and parameters: {'alpha': 45811.192750060065, 'n_pcs': 5000, 'iw_method': 'pc_logistic', 'iw_clip_max': 12.0, 'iw_prob_clip': 0.009692678032716694, 'iw_n_components': 80, 'iw_logistic_c': 0.3966861136615401, 'iw_pca_fit': 'combined', 'iw_solver': 'lbfgs', 'iw_rho': 0.85}. Best is trial 249 with value: 0.2330357454325883.
2026-06-02 00:31:32 | INFO | Trial 254 | outer=9 | alpha=4.293e+04 n_pcs=5000 (pc_topk) weight={'name': 'pc_logistic', 'floor': 1e-06, 'clip_max': 2.5, 'prob_clip': 0.009653268189118094, 'n_components': 80, 'logistic_c': 0.35974076696834567, 'pca_fit': 'combined', 'solver': 'lbfgs', 'max_iter': 2000, 'fit_intercept': True, 'standardize_with_source': True, 'rho': 0.85}
