[I 2026-06-01 22:49:24,027] Trial 135 finished with value: 0.22056613041132037 and parameters: {'alpha': 93893.49323378064, 'n_pcs': 4500, 'iw_method': 'pc_logistic', 'iw_clip_max': 2.5, 'iw_prob_clip': 0.022938898954428837, 'iw_n_components': 100, 'iw_logistic_c': 0.0016926872166811685, 'iw_pca_fit': 'combined', 'iw_solver': 'lbfgs', 'iw_rho': 0.85}. Best is trial 108 with value: 0.22594023894922968.
2026-06-01 22:49:24 | INFO | Trial 136 | outer=8 | alpha=7.466e+04 n_pcs=4500 (pc_topk) weight={'name': 'pc_logistic', 'floor': 1e-06, 'clip_max': 2.5, 'prob_clip': 0.031242542023145574, 'n_components': 100, 'logistic_c': 0.00043031319865093087, 'pca_fit': 'combined', 'solver': 'lbfgs', 'max_iter': 2000, 'fit_intercept': True, 'standardize_with_source': True, 'rho': 0.85}
[I 2026-06-01 22:49:42,482] Trial 136 finished with value: 0.22411347284468658 and parameters: {'alpha': 74656.89384401876, 'n_pcs': 4500, 'iw_method': 'pc_logistic', 'iw_clip_max': 2.5, 'iw_prob_clip': 0.031242542023145574, 'iw_n_components': 100, 'iw_logistic_c': 0.00043031319865093087, 'iw_pca_fit': 'combined', 'iw_solver': 'lbfgs', 'iw_rho': 0.85}. Best is trial 108 with value: 0.22594023894922968.
2026-06-01 22:49:42 | INFO | Trial 137 | outer=8 | alpha=1.415e+05 n_pcs=4500 (pc_topk) weight={'name': 'pc_logistic', 'floor': 1e-06, 'clip_max': 2.5, 'prob_clip': 0.02563175566568746, 'n_components': 100, 'logistic_c': 0.0004352091554611572, 'pca_fit': 'combined', 'solver': 'lbfgs', 'max_iter': 2000, 'fit_intercept': True, 'standardize_with_source': True, 'rho': 0.85}
[I 2026-06-01 22:50:00,660] Trial 137 finished with value: 0.22143056086825705 and parameters: {'alpha': 141478.39758346122, 'n_pcs': 4500, 'iw_method': 'pc_logistic', 'iw_clip_max': 2.5, 'iw_prob_clip': 0.02563175566568746, 'iw_n_components': 100, 'iw_logistic_c': 0.0004352091554611572, 'iw_pca_fit': 'combined', 'iw_solver': 'lbfgs', 'iw_rho': 0.85}. Best is trial 108 with value: 0.22594023894922968.
2026-06-01 22:50:00 | INFO | Trial 138 | outer=8 | alpha=2.098e+05 n_pcs=4500 (pc_topk) weight={'name': 'pc_logistic', 'floor': 1e-06, 'clip_max': 2.5, 'prob_clip': 0.029591283187584236, 'n_components': 100, 'logistic_c': 0.0007854734457930788, 'pca_fit': 'combined', 'solver': 'lbfgs', 'max_iter': 2000, 'fit_intercept': True, 'standardize_with_source': True, 'rho': 0.85}
[I 2026-06-01 22:50:18,790] Trial 138 finished with value: 0.21770070078647152 and parameters: {'alpha': 209818.16130020574, 'n_pcs': 4500, 'iw_method': 'pc_logistic', 'iw_clip_max': 2.5, 'iw_prob_clip': 0.029591283187584236, 'iw_n_components': 100, 'iw_logistic_c': 0.0007854734457930788, 'iw_pca_fit': 'combined', 'iw_solver': 'lbfgs', 'iw_rho': 0.85}. Best is trial 108 with value: 0.22594023894922968.
2026-06-01 22:50:18 | INFO | Trial 139 | outer=8 | alpha=7.695e+04 n_pcs=4500 (pc_topk) weight={'name': 'pc_logistic', 'floor': 1e-06, 'clip_max': 12.0, 'prob_clip': 0.03127668565223793, 'n_components': 100, 'logistic_c': 0.00012523799785138794, 'pca_fit': 'combined', 'solver': 'lbfgs', 'max_iter': 2000, 'fit_intercept': True, 'standardize_with_source': True, 'rho': 0.85}
[I 2026-06-01 22:50:34,437] Trial 139 finished with value: 0.21307416274571991 and parameters: {'alpha': 76946.54699247945, 'n_pcs': 4500, 'iw_method': 'pc_logistic', 'iw_clip_max': 12.0, 'iw_prob_clip': 0.03127668565223793, 'iw_n_components': 100, 'iw_logistic_c': 0.00012523799785138794, 'iw_pca_fit': 'combined', 'iw_solver': 'lbfgs', 'iw_rho': 0.85}. Best is trial 108 with value: 0.22594023894922968.
2026-06-01 22:50:34 | INFO | Trial 140 | outer=8 | alpha=1.306e+05 n_pcs=5000 (pc_topk) weight={'name': 'pc_logistic', 'floor': 1e-06, 'clip_max': 2.5, 'prob_clip': 0.03227316996542868, 'n_components': 20, 'logistic_c': 7.530699410268762e-05, 'pca_fit': 'combined', 'solver': 'lbfgs', 'max_iter': 2000, 'fit_intercept': True, 'standardize_with_source': True, 'rho': 0.85}
[I 2026-06-01 22:50:51,040] Trial 140 finished with value: 0.21892647995754957 and parameters: {'alpha': 130641.55360287656, 'n_pcs': 5000, 'iw_method': 'pc_logistic', 'iw_clip_max': 2.5, 'iw_prob_clip': 0.03227316996542868, 'iw_n_components': 20, 'iw_logistic_c': 7.530699410268762e-05, 'iw_pca_fit': 'combined', 'iw_solver': 'lbfgs', 'iw_rho': 0.85}. Best is trial 108 with value: 0.22594023894922968.
2026-06-01 22:50:51 | INFO | Trial 141 | outer=8 | alpha=8.125e+04 n_pcs=4500 (pc_topk) weight={'name': 'pc_logistic', 'floor': 1e-06, 'clip_max': 2.5, 'prob_clip': 0.02010807811726657, 'n_components': 100, 'logistic_c': 0.00018191587896558906, 'pca_fit': 'combined', 'solver': 'lbfgs', 'max_iter': 2000, 'fit_intercept': True, 'standardize_with_source': True, 'rho': 0.85}
[I 2026-06-01 22:51:07,986] Trial 141 finished with value: 0.22513758527139727 and parameters: {'alpha': 81253.23198063833, 'n_pcs': 4500, 'iw_method': 'pc_logistic', 'iw_clip_max': 2.5, 'iw_prob_clip': 0.02010807811726657, 'iw_n_components': 100, 'iw_logistic_c': 0.00018191587896558906, 'iw_pca_fit': 'combined', 'iw_solver': 'lbfgs', 'iw_rho': 0.85}. Best is trial 108 with value: 0.22594023894922968.
2026-06-01 22:51:08 | INFO | Trial 142 | outer=8 | alpha=7.078e+04 n_pcs=4500 (pc_topk) weight={'name': 'pc_logistic', 'floor': 1e-06, 'clip_max': 2.5, 'prob_clip': 0.02036558176399309, 'n_components': 100, 'logistic_c': 0.00018665655036463743, 'pca_fit': 'combined', 'solver': 'lbfgs', 'max_iter': 2000, 'fit_intercept': True, 'standardize_with_source': True, 'rho': 0.85}
[I 2026-06-01 22:51:23,802] Trial 142 finished with value: 0.22545991106478827 and parameters: {'alpha': 70778.09657413892, 'n_pcs': 4500, 'iw_method': 'pc_logistic', 'iw_clip_max': 2.5, 'iw_prob_clip': 0.02036558176399309, 'iw_n_components': 100, 'iw_logistic_c': 0.00018665655036463743, 'iw_pca_fit': 'combined', 'iw_solver': 'lbfgs', 'iw_rho': 0.85}. Best is trial 108 with value: 0.22594023894922968.
2026-06-01 22:51:23 | INFO | Trial 143 | outer=8 | alpha=7.646e+04 n_pcs=4500 (pc_topk) weight={'name': 'pc_logistic', 'floor': 1e-06, 'clip_max': 2.5, 'prob_clip': 0.020666866863019037, 'n_components': 100, 'logistic_c': 0.00017723331312860042, 'pca_fit': 'combined', 'solver': 'lbfgs', 'max_iter': 2000, 'fit_intercept': True, 'standardize_with_source': True, 'rho': 0.85}
[I 2026-06-01 22:51:40,235] Trial 143 finished with value: 0.2253852921329263 and parameters: {'alpha': 76457.20467924986, 'n_pcs': 4500, 'iw_method': 'pc_logistic', 'iw_clip_max': 2.5, 'iw_prob_clip': 0.020666866863019037, 'iw_n_components': 100, 'iw_logistic_c': 0.00017723331312860042, 'iw_pca_fit': 'combined', 'iw_solver': 'lbfgs', 'iw_rho': 0.85}. Best is trial 108 with value: 0.22594023894922968.
2026-06-01 22:51:40 | INFO | Trial 144 | outer=8 | alpha=9.451e+04 n_pcs=4500 (pc_topk) weight={'name': 'pc_logistic', 'floor': 1e-06, 'clip_max': 2.5, 'prob_clip': 0.020788426790210816, 'n_components': 100, 'logistic_c': 0.00015760829207023613, 'pca_fit': 'combined', 'solver': 'lbfgs', 'max_iter': 2000, 'fit_intercept': True, 'standardize_with_source': True, 'rho': 0.85}
[I 2026-06-01 22:51:57,224] Trial 144 finished with value: 0.2248789818471879 and parameters: {'alpha': 94509.16369659718, 'n_pcs': 4500, 'iw_method': 'pc_logistic', 'iw_clip_max': 2.5, 'iw_prob_clip': 0.020788426790210816, 'iw_n_components': 100, 'iw_logistic_c': 0.00015760829207023613, 'iw_pca_fit': 'combined', 'iw_solver': 'lbfgs', 'iw_rho': 0.85}. Best is trial 108 with value: 0.22594023894922968.
2026-06-01 22:51:57 | INFO | Trial 145 | outer=8 | alpha=1.104e+05 n_pcs=4500 (pc_topk) weight={'name': 'pc_logistic', 'floor': 1e-06, 'clip_max': 4.0, 'prob_clip': 0.021310056220344337, 'n_components': 100, 'logistic_c': 0.00018266712421690265, 'pca_fit': 'combined', 'solver': 'lbfgs', 'max_iter': 2000, 'fit_intercept': True, 'standardize_with_source': True, 'rho': 0.85}
[I 2026-06-01 22:52:15,337] Trial 145 finished with value: 0.2235130899669271 and parameters: {'alpha': 110370.61672455707, 'n_pcs': 4500, 'iw_method': 'pc_logistic', 'iw_clip_max': 4.0, 'iw_prob_clip': 0.021310056220344337, 'iw_n_components': 100, 'iw_logistic_c': 0.00018266712421690265, 'iw_pca_fit': 'combined', 'iw_solver': 'lbfgs', 'iw_rho': 0.85}. Best is trial 108 with value: 0.22594023894922968.
2026-06-01 22:52:15 | INFO | Trial 146 | outer=8 | alpha=1.133e+05 n_pcs=4500 (pc_topk) weight={'name': 'pc_logistic', 'floor': 1e-06, 'clip_max': 4.0, 'prob_clip': 0.02163672430262489, 'n_components': 100, 'logistic_c': 0.00015725229164193836, 'pca_fit': 'combined', 'solver': 'lbfgs', 'max_iter': 2000, 'fit_intercept': True, 'standardize_with_source': True, 'rho': 0.85}
[I 2026-06-01 22:52:31,848] Trial 146 finished with value: 0.22360316682520992 and parameters: {'alpha': 113347.37416720935, 'n_pcs': 4500, 'iw_method': 'pc_logistic', 'iw_clip_max': 4.0, 'iw_prob_clip': 0.02163672430262489, 'iw_n_components': 100, 'iw_logistic_c': 0.00015725229164193836, 'iw_pca_fit': 'combined', 'iw_solver': 'lbfgs', 'iw_rho': 0.85}. Best is trial 108 with value: 0.22594023894922968.
2026-06-01 22:52:31 | INFO | Trial 147 | outer=8 | alpha=9.949e+04 n_pcs=4500 (pc_topk) weight={'name': 'uniform'}
[I 2026-06-01 22:52:40,859] Trial 147 finished with value: 0.20889083477939346 and parameters: {'alpha': 99488.6328054301, 'n_pcs': 4500, 'iw_method': 'uniform'}. Best is trial 108 with value: 0.22594023894922968.
2026-06-01 22:52:40 | INFO | Trial 148 | outer=8 | alpha=1.875e+05 n_pcs=4500 (pc_topk) weight={'name': 'pc_logistic', 'floor': 1e-06, 'clip_max': 4.0, 'prob_clip': 0.021548187077212254, 'n_components': 60, 'logistic_c': 0.00011683035810733058, 'pca_fit': 'combined', 'solver': 'lbfgs', 'max_iter': 2000, 'fit_intercept': True, 'standardize_with_source': True, 'rho': 0.85}
[I 2026-06-01 22:52:56,665] Trial 148 finished with value: 0.218102983097857 and parameters: {'alpha': 187549.1995654033, 'n_pcs': 4500, 'iw_method': 'pc_logistic', 'iw_clip_max': 4.0, 'iw_prob_clip': 0.021548187077212254, 'iw_n_components': 60, 'iw_logistic_c': 0.00011683035810733058, 'iw_pca_fit': 'combined', 'iw_solver': 'lbfgs', 'iw_rho': 0.85}. Best is trial 108 with value: 0.22594023894922968.
2026-06-01 22:52:56 | INFO | Trial 149 | outer=8 | alpha=1.156e+05 n_pcs=4500 (pc_topk) weight={'name': 'pc_logistic', 'floor': 1e-06, 'clip_max': 4.0, 'prob_clip': 0.027975163943965677, 'n_components': 10, 'logistic_c': 0.0005395379561231537, 'pca_fit': 'combined', 'solver': 'lbfgs', 'max_iter': 2000, 'fit_intercept': True, 'standardize_with_source': True, 'rho': 0.85}
[I 2026-06-01 22:53:13,315] Trial 149 finished with value: 0.21799077949848425 and parameters: {'alpha': 115557.1038017308, 'n_pcs': 4500, 'iw_method': 'pc_logistic', 'iw_clip_max': 4.0, 'iw_prob_clip': 0.027975163943965677, 'iw_n_components': 10, 'iw_logistic_c': 0.0005395379561231537, 'iw_pca_fit': 'combined', 'iw_solver': 'lbfgs', 'iw_rho': 0.85}. Best is trial 108 with value: 0.22594023894922968.
2026-06-01 22:53:13 | INFO | Trial 150 | outer=8 | alpha=1.515e+05 n_pcs=4500 (pc_topk) weight={'name': 'pc_logistic', 'floor': 1e-06, 'clip_max': 4.0, 'prob_clip': 0.02465893955035872, 'n_components': 100, 'logistic_c': 0.00016161369808298756, 'pca_fit': 'combined', 'solver': 'lbfgs', 'max_iter': 2000, 'fit_intercept': True, 'standardize_with_source': True, 'rho': 0.85}
[I 2026-06-01 22:53:30,298] Trial 150 finished with value: 0.2222536733461081 and parameters: {'alpha': 151515.4716140263, 'n_pcs': 4500, 'iw_method': 'pc_logistic', 'iw_clip_max': 4.0, 'iw_prob_clip': 0.02465893955035872, 'iw_n_components': 100, 'iw_logistic_c': 0.00016161369808298756, 'iw_pca_fit': 'combined', 'iw_solver': 'lbfgs', 'iw_rho': 0.85}. Best is trial 108 with value: 0.22594023894922968.
2026-06-01 22:53:30 | INFO | Trial 151 | outer=8 | alpha=8.068e+04 n_pcs=500 (pc_topk) weight={'name': 'pc_logistic', 'floor': 1e-06, 'clip_max': 4.0, 'prob_clip': 0.022828764079344546, 'n_components': 100, 'logistic_c': 0.2609711028252653, 'pca_fit': 'combined', 'solver': 'lbfgs', 'max_iter': 2000, 'fit_intercept': True, 'standardize_with_source': True, 'rho': 0.85}
[I 2026-06-01 22:53:49,074] Trial 151 finished with value: 0.16434570059735365 and parameters: {'alpha': 80676.88950672507, 'n_pcs': 500, 'iw_method': 'pc_logistic', 'iw_clip_max': 4.0, 'iw_prob_clip': 0.022828764079344546, 'iw_n_components': 100, 'iw_logistic_c': 0.2609711028252653, 'iw_pca_fit': 'combined', 'iw_solver': 'lbfgs', 'iw_rho': 0.85}. Best is trial 108 with value: 0.22594023894922968.
2026-06-01 22:53:49 | INFO | Trial 152 | outer=8 | alpha=9.030e+04 n_pcs=4500 (pc_topk) weight={'name': 'pc_logistic', 'floor': 1e-06, 'clip_max': 4.0, 'prob_clip': 0.02029335692781711, 'n_components': 100, 'logistic_c': 0.0003969190943905809, 'pca_fit': 'combined', 'solver': 'lbfgs', 'max_iter': 2000, 'fit_intercept': True, 'standardize_with_source': True, 'rho': 0.85}
[I 2026-06-01 22:54:07,365] Trial 152 finished with value: 0.22265466048851285 and parameters: {'alpha': 90303.22466709204, 'n_pcs': 4500, 'iw_method': 'pc_logistic', 'iw_clip_max': 4.0, 'iw_prob_clip': 0.02029335692781711, 'iw_n_components': 100, 'iw_logistic_c': 0.0003969190943905809, 'iw_pca_fit': 'combined', 'iw_solver': 'lbfgs', 'iw_rho': 0.85}. Best is trial 108 with value: 0.22594023894922968.
2026-06-01 22:54:07 | INFO | Trial 153 | outer=8 | alpha=1.076e+05 n_pcs=4500 (pc_topk) weight={'name': 'pc_logistic', 'floor': 1e-06, 'clip_max': 4.0, 'prob_clip': 0.0269763176184628, 'n_components': 100, 'logistic_c': 0.00014726495915214806, 'pca_fit': 'combined', 'solver': 'lbfgs', 'max_iter': 2000, 'fit_intercept': True, 'standardize_with_source': True, 'rho': 0.85}
[I 2026-06-01 22:54:23,775] Trial 153 finished with value: 0.22338431589685373 and parameters: {'alpha': 107617.0690042711, 'n_pcs': 4500, 'iw_method': 'pc_logistic', 'iw_clip_max': 4.0, 'iw_prob_clip': 0.0269763176184628, 'iw_n_components': 100, 'iw_logistic_c': 0.00014726495915214806, 'iw_pca_fit': 'combined', 'iw_solver': 'lbfgs', 'iw_rho': 0.85}. Best is trial 108 with value: 0.22594023894922968.
2026-06-01 22:54:23 | INFO | Trial 154 | outer=8 | alpha=1.133e+05 n_pcs=4500 (pc_topk) weight={'name': 'pc_logistic', 'floor': 1e-06, 'clip_max': 4.0, 'prob_clip': 0.02675610183058526, 'n_components': 100, 'logistic_c': 0.00016449025635484414, 'pca_fit': 'combined', 'solver': 'lbfgs', 'max_iter': 2000, 'fit_intercept': True, 'standardize_with_source': True, 'rho': 0.85}
[I 2026-06-01 22:54:40,184] Trial 154 finished with value: 0.22315688885398957 and parameters: {'alpha': 113281.53587143475, 'n_pcs': 4500, 'iw_method': 'pc_logistic', 'iw_clip_max': 4.0, 'iw_prob_clip': 0.02675610183058526, 'iw_n_components': 100, 'iw_logistic_c': 0.00016449025635484414, 'iw_pca_fit': 'combined', 'iw_solver': 'lbfgs', 'iw_rho': 0.85}. Best is trial 108 with value: 0.22594023894922968.
2026-06-01 22:54:40 | INFO | Trial 155 | outer=8 | alpha=1.307e+05 n_pcs=4500 (pc_topk) weight={'name': 'pc_logistic', 'floor': 1e-06, 'clip_max': 4.0, 'prob_clip': 0.02055763463885659, 'n_components': 100, 'logistic_c': 5.972633852666897e-05, 'pca_fit': 'combined', 'solver': 'lbfgs', 'max_iter': 2000, 'fit_intercept': True, 'standardize_with_source': True, 'rho': 0.85}
[I 2026-06-01 22:54:55,660] Trial 155 finished with value: 0.22321072277217557 and parameters: {'alpha': 130736.89336376825, 'n_pcs': 4500, 'iw_method': 'pc_logistic', 'iw_clip_max': 4.0, 'iw_prob_clip': 0.02055763463885659, 'iw_n_components': 100, 'iw_logistic_c': 5.972633852666897e-05, 'iw_pca_fit': 'combined', 'iw_solver': 'lbfgs', 'iw_rho': 0.85}. Best is trial 108 with value: 0.22594023894922968.
2026-06-01 22:54:55 | INFO | Trial 156 | outer=8 | alpha=8.103e+04 n_pcs=5000 (pc_topk) weight={'name': 'pc_logistic', 'floor': 1e-06, 'clip_max': 4.0, 'prob_clip': 0.03317718722450185, 'n_components': 80, 'logistic_c': 0.00011316999070318819, 'pca_fit': 'combined', 'solver': 'lbfgs', 'max_iter': 2000, 'fit_intercept': True, 'standardize_with_source': True, 'rho': 0.85}
[I 2026-06-01 22:55:12,209] Trial 156 finished with value: 0.21989436926065092 and parameters: {'alpha': 81026.39566592065, 'n_pcs': 5000, 'iw_method': 'pc_logistic', 'iw_clip_max': 4.0, 'iw_prob_clip': 0.03317718722450185, 'iw_n_components': 80, 'iw_logistic_c': 0.00011316999070318819, 'iw_pca_fit': 'combined', 'iw_solver': 'lbfgs', 'iw_rho': 0.85}. Best is trial 108 with value: 0.22594023894922968.
2026-06-01 22:55:12 | INFO | Trial 157 | outer=8 | alpha=9.778e+04 n_pcs=4500 (pc_topk) weight={'name': 'pc_logistic', 'floor': 1e-06, 'clip_max': 4.0, 'prob_clip': 0.02878685696301904, 'n_components': 100, 'logistic_c': 0.00039955960439309673, 'pca_fit': 'combined', 'solver': 'lbfgs', 'max_iter': 2000, 'fit_intercept': True, 'standardize_with_source': True, 'rho': 0.85}
[I 2026-06-01 22:55:29,479] Trial 157 finished with value: 0.22221498481466892 and parameters: {'alpha': 97784.97114429034, 'n_pcs': 4500, 'iw_method': 'pc_logistic', 'iw_clip_max': 4.0, 'iw_prob_clip': 0.02878685696301904, 'iw_n_components': 100, 'iw_logistic_c': 0.00039955960439309673, 'iw_pca_fit': 'combined', 'iw_solver': 'lbfgs', 'iw_rho': 0.85}. Best is trial 108 with value: 0.22594023894922968.
2026-06-01 22:55:29 | INFO | Trial 158 | outer=8 | alpha=1.587e+05 n_pcs=4500 (pc_topk) weight={'name': 'pc_logistic', 'floor': 1e-06, 'clip_max': 4.0, 'prob_clip': 0.025119675891766082, 'n_components': 100, 'logistic_c': 3.500848761310965e-05, 'pca_fit': 'combined', 'solver': 'lbfgs', 'max_iter': 2000, 'fit_intercept': True, 'standardize_with_source': True, 'rho': 0.85}
[I 2026-06-01 22:55:44,599] Trial 158 finished with value: 0.22089156060986648 and parameters: {'alpha': 158738.1035638538, 'n_pcs': 4500, 'iw_method': 'pc_logistic', 'iw_clip_max': 4.0, 'iw_prob_clip': 0.025119675891766082, 'iw_n_components': 100, 'iw_logistic_c': 3.500848761310965e-05, 'iw_pca_fit': 'combined', 'iw_solver': 'lbfgs', 'iw_rho': 0.85}. Best is trial 108 with value: 0.22594023894922968.
2026-06-01 22:55:44 | INFO | Trial 159 | outer=8 | alpha=5.615e+04 n_pcs=4000 (pc_topk) weight={'name': 'pc_logistic', 'floor': 1e-06, 'clip_max': 1.5, 'prob_clip': 0.015401699608551318, 'n_components': 100, 'logistic_c': 0.0007627474833774096, 'pca_fit': 'combined', 'solver': 'lbfgs', 'max_iter': 2000, 'fit_intercept': True, 'standardize_with_source': True, 'rho': 0.85}
[I 2026-06-01 22:56:00,642] Trial 159 finished with value: 0.22044409627422437 and parameters: {'alpha': 56147.92798726684, 'n_pcs': 4000, 'iw_method': 'pc_logistic', 'iw_clip_max': 1.5, 'iw_prob_clip': 0.015401699608551318, 'iw_n_components': 100, 'iw_logistic_c': 0.0007627474833774096, 'iw_pca_fit': 'combined', 'iw_solver': 'lbfgs', 'iw_rho': 0.85}. Best is trial 108 with value: 0.22594023894922968.
2026-06-01 22:56:00 | INFO | Trial 160 | outer=8 | alpha=2.473e+05 n_pcs=4500 (pc_topk) weight={'name': 'pc_logistic', 'floor': 1e-06, 'clip_max': 4.0, 'prob_clip': 0.021240312171604506, 'n_components': 100, 'logistic_c': 8.391138792935135e-05, 'pca_fit': 'combined', 'solver': 'lbfgs', 'max_iter': 2000, 'fit_intercept': True, 'standardize_with_source': True, 'rho': 0.85}
[I 2026-06-01 22:56:15,855] Trial 160 finished with value: 0.22057629399961232 and parameters: {'alpha': 247296.94132227145, 'n_pcs': 4500, 'iw_method': 'pc_logistic', 'iw_clip_max': 4.0, 'iw_prob_clip': 0.021240312171604506, 'iw_n_components': 100, 'iw_logistic_c': 8.391138792935135e-05, 'iw_pca_fit': 'combined', 'iw_solver': 'lbfgs', 'iw_rho': 0.85}. Best is trial 108 with value: 0.22594023894922968.
2026-06-01 22:56:15 | INFO | Trial 161 | outer=8 | alpha=1.272e+05 n_pcs=4500 (pc_topk) weight={'name': 'pc_logistic', 'floor': 1e-06, 'clip_max': 4.0, 'prob_clip': 0.020196211688215348, 'n_components': 100, 'logistic_c': 0.00017450888750245296, 'pca_fit': 'combined', 'solver': 'lbfgs', 'max_iter': 2000, 'fit_intercept': True, 'standardize_with_source': True, 'rho': 0.85}
[I 2026-06-01 22:56:32,702] Trial 161 finished with value: 0.2232461843467804 and parameters: {'alpha': 127178.8391451531, 'n_pcs': 4500, 'iw_method': 'pc_logistic', 'iw_clip_max': 4.0, 'iw_prob_clip': 0.020196211688215348, 'iw_n_components': 100, 'iw_logistic_c': 0.00017450888750245296, 'iw_pca_fit': 'combined', 'iw_solver': 'lbfgs', 'iw_rho': 0.85}. Best is trial 108 with value: 0.22594023894922968.
2026-06-01 22:56:32 | INFO | Trial 162 | outer=8 | alpha=1.164e+05 n_pcs=4500 (pc_topk) weight={'name': 'pc_logistic', 'floor': 1e-06, 'clip_max': 4.0, 'prob_clip': 0.02371386750034118, 'n_components': 100, 'logistic_c': 0.0001577364987142183, 'pca_fit': 'combined', 'solver': 'lbfgs', 'max_iter': 2000, 'fit_intercept': True, 'standardize_with_source': True, 'rho': 0.85}
[I 2026-06-01 22:56:49,727] Trial 162 finished with value: 0.2233844196327222 and parameters: {'alpha': 116449.65613153891, 'n_pcs': 4500, 'iw_method': 'pc_logistic', 'iw_clip_max': 4.0, 'iw_prob_clip': 0.02371386750034118, 'iw_n_components': 100, 'iw_logistic_c': 0.0001577364987142183, 'iw_pca_fit': 'combined', 'iw_solver': 'lbfgs', 'iw_rho': 0.85}. Best is trial 108 with value: 0.22594023894922968.
2026-06-01 22:56:49 | INFO | Trial 163 | outer=8 | alpha=8.013e+04 n_pcs=4500 (pc_topk) weight={'name': 'pc_logistic', 'floor': 1e-06, 'clip_max': 4.0, 'prob_clip': 0.024211869573731976, 'n_components': 100, 'logistic_c': 0.0001181516845294959, 'pca_fit': 'combined', 'solver': 'lbfgs', 'max_iter': 2000, 'fit_intercept': True, 'standardize_with_source': True, 'rho': 0.85}
