[I 2026-06-01 02:58:47,663] Trial 142 finished with value: 0.2276582189073527 and parameters: {'alpha': 69318.68031393348, 'n_pcs': 4500, 'weight_scheme': 'linear', 'weight_clip_max': 3.0, 'weight_linear_min_weight': 0.4701569164515931, 'weight_linear_max_weight': 4.918113469477903}. Best is trial 142 with value: 0.2276582189073527.
2026-06-01 02:58:47 | INFO | src.nested_cv_avggrm_weighted_unified | OUTER 11 | new best trial 142 (mean inner r=0.2277) saved to outputs/final_results/e6_pc_ridge_avggrm/thr_wing/e6_pc_ridge_avggrm_thr_wing_best_trials/split_11_best_trial.json
2026-06-01 02:58:47 | INFO | src.nested_cv_avggrm_weighted_unified | Trial 143 | outer=11 | alpha=7.143e+04 n_pcs=4500 (pc_topk) weight_search=on
2026-06-01 02:58:47 | INFO | src.nested_cv_avggrm_weighted_unified | Trial 143 | outer=11 | weight={'name': 'linear', 'floor': 1e-06, 'clip_max': 3.0, 'min_weight': 0.47198459794100933, 'max_weight': 4.912589852114253}
[I 2026-06-01 02:58:54,758] Trial 143 finished with value: 0.2276446435931078 and parameters: {'alpha': 71426.84691220993, 'n_pcs': 4500, 'weight_scheme': 'linear', 'weight_clip_max': 3.0, 'weight_linear_min_weight': 0.47198459794100933, 'weight_linear_max_weight': 4.912589852114253}. Best is trial 142 with value: 0.2276582189073527.
2026-06-01 02:58:54 | INFO | src.nested_cv_avggrm_weighted_unified | Trial 144 | outer=11 | alpha=7.912e+04 n_pcs=4500 (pc_topk) weight_search=on
2026-06-01 02:58:54 | INFO | src.nested_cv_avggrm_weighted_unified | Trial 144 | outer=11 | weight={'name': 'linear', 'floor': 1e-06, 'clip_max': 3.0, 'min_weight': 0.47011760076544196, 'max_weight': 4.913487704097229}
[I 2026-06-01 02:59:01,803] Trial 144 finished with value: 0.22756390009664562 and parameters: {'alpha': 79120.33196009003, 'n_pcs': 4500, 'weight_scheme': 'linear', 'weight_clip_max': 3.0, 'weight_linear_min_weight': 0.47011760076544196, 'weight_linear_max_weight': 4.913487704097229}. Best is trial 142 with value: 0.2276582189073527.
2026-06-01 02:59:01 | INFO | src.nested_cv_avggrm_weighted_unified | Trial 145 | outer=11 | alpha=7.830e+04 n_pcs=4500 (pc_topk) weight_search=on
2026-06-01 02:59:01 | INFO | src.nested_cv_avggrm_weighted_unified | Trial 145 | outer=11 | weight={'name': 'linear', 'floor': 1e-06, 'clip_max': 3.0, 'min_weight': 0.46921301666583204, 'max_weight': 4.9143859134702765}
[I 2026-06-01 02:59:08,848] Trial 145 finished with value: 0.22757828980004563 and parameters: {'alpha': 78295.19167718971, 'n_pcs': 4500, 'weight_scheme': 'linear', 'weight_clip_max': 3.0, 'weight_linear_min_weight': 0.46921301666583204, 'weight_linear_max_weight': 4.9143859134702765}. Best is trial 142 with value: 0.2276582189073527.
2026-06-01 02:59:08 | INFO | src.nested_cv_avggrm_weighted_unified | Trial 146 | outer=11 | alpha=9.732e+04 n_pcs=4500 (pc_topk) weight_search=on
2026-06-01 02:59:08 | INFO | src.nested_cv_avggrm_weighted_unified | Trial 146 | outer=11 | weight={'name': 'linear', 'floor': 1e-06, 'clip_max': 10.0, 'min_weight': 0.4716314466156033, 'max_weight': 4.921249087310549}
[I 2026-06-01 02:59:15,890] Trial 146 finished with value: 0.2267725751972322 and parameters: {'alpha': 97322.12798880786, 'n_pcs': 4500, 'weight_scheme': 'linear', 'weight_clip_max': 10.0, 'weight_linear_min_weight': 0.4716314466156033, 'weight_linear_max_weight': 4.921249087310549}. Best is trial 142 with value: 0.2276582189073527.
2026-06-01 02:59:15 | INFO | src.nested_cv_avggrm_weighted_unified | Trial 147 | outer=11 | alpha=8.299e+04 n_pcs=5000 (pc_topk) weight_search=on
2026-06-01 02:59:15 | INFO | src.nested_cv_avggrm_weighted_unified | Trial 147 | outer=11 | weight={'name': 'exponential', 'floor': 1e-06, 'clip_max': 3.0, 'beta': 4.002808068404107}
[I 2026-06-01 02:59:24,188] Trial 147 finished with value: 0.22735850743599356 and parameters: {'alpha': 82985.9496576815, 'n_pcs': 5000, 'weight_scheme': 'exponential', 'weight_clip_max': 3.0, 'weight_exponential_beta': 4.002808068404107}. Best is trial 142 with value: 0.2276582189073527.
2026-06-01 02:59:24 | INFO | src.nested_cv_avggrm_weighted_unified | Trial 148 | outer=11 | alpha=7.668e+04 n_pcs=4500 (pc_topk) weight_search=on
2026-06-01 02:59:24 | INFO | src.nested_cv_avggrm_weighted_unified | Trial 148 | outer=11 | weight={'name': 'linear', 'floor': 1e-06, 'clip_max': 3.0, 'min_weight': 0.43623414945714645, 'max_weight': 4.928578972529405}
[I 2026-06-01 02:59:31,249] Trial 148 finished with value: 0.22765463126508517 and parameters: {'alpha': 76682.08980561931, 'n_pcs': 4500, 'weight_scheme': 'linear', 'weight_clip_max': 3.0, 'weight_linear_min_weight': 0.43623414945714645, 'weight_linear_max_weight': 4.928578972529405}. Best is trial 142 with value: 0.2276582189073527.
2026-06-01 02:59:31 | INFO | src.nested_cv_avggrm_weighted_unified | Trial 149 | outer=11 | alpha=7.493e+04 n_pcs=4000 (pc_topk) weight_search=on
2026-06-01 02:59:31 | INFO | src.nested_cv_avggrm_weighted_unified | Trial 149 | outer=11 | weight={'name': 'linear', 'floor': 1e-06, 'clip_max': 3.0, 'min_weight': 0.4329096553001856, 'max_weight': 4.993989416974783}
[I 2026-06-01 02:59:37,027] Trial 149 finished with value: 0.22679705068153294 and parameters: {'alpha': 74929.60742515283, 'n_pcs': 4000, 'weight_scheme': 'linear', 'weight_clip_max': 3.0, 'weight_linear_min_weight': 0.4329096553001856, 'weight_linear_max_weight': 4.993989416974783}. Best is trial 142 with value: 0.2276582189073527.
2026-06-01 02:59:37 | INFO | src.nested_cv_avggrm_weighted_unified | Trial 150 | outer=11 | alpha=1.092e+05 n_pcs=4500 (pc_topk) weight_search=on
2026-06-01 02:59:37 | INFO | src.nested_cv_avggrm_weighted_unified | Trial 150 | outer=11 | weight={'name': 'linear', 'floor': 1e-06, 'clip_max': 3.0, 'min_weight': 0.47066263534032216, 'max_weight': 4.902305535151484}
[I 2026-06-01 02:59:44,059] Trial 150 finished with value: 0.22681093836714533 and parameters: {'alpha': 109178.12995779511, 'n_pcs': 4500, 'weight_scheme': 'linear', 'weight_clip_max': 3.0, 'weight_linear_min_weight': 0.47066263534032216, 'weight_linear_max_weight': 4.902305535151484}. Best is trial 142 with value: 0.2276582189073527.
2026-06-01 02:59:44 | INFO | src.nested_cv_avggrm_weighted_unified | Trial 151 | outer=11 | alpha=8.155e+04 n_pcs=4500 (pc_topk) weight_search=on
2026-06-01 02:59:44 | INFO | src.nested_cv_avggrm_weighted_unified | Trial 151 | outer=11 | weight={'name': 'linear', 'floor': 1e-06, 'clip_max': 3.0, 'min_weight': 0.4568857825822837, 'max_weight': 4.928307022450092}
[I 2026-06-01 02:59:51,133] Trial 151 finished with value: 0.22755029438617105 and parameters: {'alpha': 81548.89579612303, 'n_pcs': 4500, 'weight_scheme': 'linear', 'weight_clip_max': 3.0, 'weight_linear_min_weight': 0.4568857825822837, 'weight_linear_max_weight': 4.928307022450092}. Best is trial 142 with value: 0.2276582189073527.
2026-06-01 02:59:51 | INFO | src.nested_cv_avggrm_weighted_unified | Trial 152 | outer=11 | alpha=7.832e+04 n_pcs=4500 (pc_topk) weight_search=on
2026-06-01 02:59:51 | INFO | src.nested_cv_avggrm_weighted_unified | Trial 152 | outer=11 | weight={'name': 'linear', 'floor': 1e-06, 'clip_max': 3.0, 'min_weight': 0.4544436037741634, 'max_weight': 4.930219748069981}
[I 2026-06-01 02:59:58,166] Trial 152 finished with value: 0.22760525028074344 and parameters: {'alpha': 78320.15405960656, 'n_pcs': 4500, 'weight_scheme': 'linear', 'weight_clip_max': 3.0, 'weight_linear_min_weight': 0.4544436037741634, 'weight_linear_max_weight': 4.930219748069981}. Best is trial 142 with value: 0.2276582189073527.
2026-06-01 02:59:58 | INFO | src.nested_cv_avggrm_weighted_unified | Trial 153 | outer=11 | alpha=8.116e+04 n_pcs=4500 (pc_topk) weight_search=on
2026-06-01 02:59:58 | INFO | src.nested_cv_avggrm_weighted_unified | Trial 153 | outer=11 | weight={'name': 'linear', 'floor': 1e-06, 'clip_max': 3.0, 'min_weight': 0.40821924804916315, 'max_weight': 4.928858286516609}
[I 2026-06-01 03:00:05,450] Trial 153 finished with value: 0.22762786329987938 and parameters: {'alpha': 81160.901504075, 'n_pcs': 4500, 'weight_scheme': 'linear', 'weight_clip_max': 3.0, 'weight_linear_min_weight': 0.40821924804916315, 'weight_linear_max_weight': 4.928858286516609}. Best is trial 142 with value: 0.2276582189073527.
2026-06-01 03:00:05 | INFO | src.nested_cv_avggrm_weighted_unified | Trial 154 | outer=11 | alpha=9.307e+04 n_pcs=4500 (pc_topk) weight_search=on
2026-06-01 03:00:05 | INFO | src.nested_cv_avggrm_weighted_unified | Trial 154 | outer=11 | weight={'name': 'linear', 'floor': 1e-06, 'clip_max': 3.0, 'min_weight': 0.41260831198213177, 'max_weight': 4.939593326008102}
[I 2026-06-01 03:00:12,494] Trial 154 finished with value: 0.22738699477664004 and parameters: {'alpha': 93070.57845078454, 'n_pcs': 4500, 'weight_scheme': 'linear', 'weight_clip_max': 3.0, 'weight_linear_min_weight': 0.41260831198213177, 'weight_linear_max_weight': 4.939593326008102}. Best is trial 142 with value: 0.2276582189073527.
2026-06-01 03:00:12 | INFO | src.nested_cv_avggrm_weighted_unified | Trial 155 | outer=11 | alpha=1.185e+05 n_pcs=4500 (pc_topk) weight_search=on
2026-06-01 03:00:12 | INFO | src.nested_cv_avggrm_weighted_unified | Trial 155 | outer=11 | weight={'name': 'linear', 'floor': 1e-06, 'clip_max': 3.0, 'min_weight': 0.45790624253769563, 'max_weight': 4.994217403372692}
[I 2026-06-01 03:00:19,593] Trial 155 finished with value: 0.22657330374684834 and parameters: {'alpha': 118525.49380449844, 'n_pcs': 4500, 'weight_scheme': 'linear', 'weight_clip_max': 3.0, 'weight_linear_min_weight': 0.45790624253769563, 'weight_linear_max_weight': 4.994217403372692}. Best is trial 142 with value: 0.2276582189073527.
2026-06-01 03:00:19 | INFO | src.nested_cv_avggrm_weighted_unified | Trial 156 | outer=11 | alpha=7.743e+04 n_pcs=4000 (pc_topk) weight_search=on
2026-06-01 03:00:19 | INFO | src.nested_cv_avggrm_weighted_unified | Trial 156 | outer=11 | weight={'name': 'linear', 'floor': 1e-06, 'clip_max': 3.0, 'min_weight': 0.427233520601563, 'max_weight': 2.665091690160134}
[I 2026-06-01 03:00:25,585] Trial 156 finished with value: 0.2261363647238817 and parameters: {'alpha': 77427.24258823933, 'n_pcs': 4000, 'weight_scheme': 'linear', 'weight_clip_max': 3.0, 'weight_linear_min_weight': 0.427233520601563, 'weight_linear_max_weight': 2.665091690160134}. Best is trial 142 with value: 0.2276582189073527.
2026-06-01 03:00:25 | INFO | src.nested_cv_avggrm_weighted_unified | Trial 157 | outer=11 | alpha=7.927e+04 n_pcs=4500 (pc_topk) weight_search=on
2026-06-01 03:00:25 | INFO | src.nested_cv_avggrm_weighted_unified | Trial 157 | outer=11 | weight={'name': 'linear', 'floor': 1e-06, 'clip_max': 3.0, 'min_weight': 0.39690806097473114, 'max_weight': 4.918332704270758}
[I 2026-06-01 03:00:32,669] Trial 157 finished with value: 0.2276608592360967 and parameters: {'alpha': 79274.71463159261, 'n_pcs': 4500, 'weight_scheme': 'linear', 'weight_clip_max': 3.0, 'weight_linear_min_weight': 0.39690806097473114, 'weight_linear_max_weight': 4.918332704270758}. Best is trial 157 with value: 0.2276608592360967.
2026-06-01 03:00:32 | INFO | src.nested_cv_avggrm_weighted_unified | OUTER 11 | new best trial 157 (mean inner r=0.2277) saved to outputs/final_results/e6_pc_ridge_avggrm/thr_wing/e6_pc_ridge_avggrm_thr_wing_best_trials/split_11_best_trial.json
2026-06-01 03:00:32 | INFO | src.nested_cv_avggrm_weighted_unified | Trial 158 | outer=11 | alpha=9.779e+04 n_pcs=5000 (pc_topk) weight_search=on
2026-06-01 03:00:32 | INFO | src.nested_cv_avggrm_weighted_unified | Trial 158 | outer=11 | weight={'name': 'linear', 'floor': 1e-06, 'clip_max': 3.0, 'min_weight': 0.40074876822494643, 'max_weight': 4.9345485528752375}
[I 2026-06-01 03:00:40,937] Trial 158 finished with value: 0.22595324573028835 and parameters: {'alpha': 97791.97042266015, 'n_pcs': 5000, 'weight_scheme': 'linear', 'weight_clip_max': 3.0, 'weight_linear_min_weight': 0.40074876822494643, 'weight_linear_max_weight': 4.9345485528752375}. Best is trial 157 with value: 0.2276608592360967.
2026-06-01 03:00:40 | INFO | src.nested_cv_avggrm_weighted_unified | Trial 159 | outer=11 | alpha=7.923e+04 n_pcs=4500 (pc_topk) weight_search=on
2026-06-01 03:00:40 | INFO | src.nested_cv_avggrm_weighted_unified | Trial 159 | outer=11 | weight={'name': 'linear', 'floor': 1e-06, 'clip_max': 3.0, 'min_weight': 0.4558972586891803, 'max_weight': 4.889838541266131}
[I 2026-06-01 03:00:47,958] Trial 159 finished with value: 0.22758307642640035 and parameters: {'alpha': 79234.37122660552, 'n_pcs': 4500, 'weight_scheme': 'linear', 'weight_clip_max': 3.0, 'weight_linear_min_weight': 0.4558972586891803, 'weight_linear_max_weight': 4.889838541266131}. Best is trial 157 with value: 0.2276608592360967.
2026-06-01 03:00:47 | INFO | src.nested_cv_avggrm_weighted_unified | Trial 160 | outer=11 | alpha=1.229e+05 n_pcs=4500 (pc_topk) weight_search=on
2026-06-01 03:00:47 | INFO | src.nested_cv_avggrm_weighted_unified | Trial 160 | outer=11 | weight={'name': 'linear', 'floor': 1e-06, 'clip_max': 3.0, 'min_weight': 0.43880106099093136, 'max_weight': 4.853695686531971}
[I 2026-06-01 03:00:54,972] Trial 160 finished with value: 0.2264505467349768 and parameters: {'alpha': 122865.44766240187, 'n_pcs': 4500, 'weight_scheme': 'linear', 'weight_clip_max': 3.0, 'weight_linear_min_weight': 0.43880106099093136, 'weight_linear_max_weight': 4.853695686531971}. Best is trial 157 with value: 0.2276608592360967.
2026-06-01 03:00:54 | INFO | src.nested_cv_avggrm_weighted_unified | Trial 161 | outer=11 | alpha=7.508e+04 n_pcs=4500 (pc_topk) weight_search=on
2026-06-01 03:00:54 | INFO | src.nested_cv_avggrm_weighted_unified | Trial 161 | outer=11 | weight={'name': 'linear', 'floor': 1e-06, 'clip_max': 3.0, 'min_weight': 0.4470072705196842, 'max_weight': 4.908995130503322}
[I 2026-06-01 03:01:02,025] Trial 161 finished with value: 0.22765302674387708 and parameters: {'alpha': 75077.6383558598, 'n_pcs': 4500, 'weight_scheme': 'linear', 'weight_clip_max': 3.0, 'weight_linear_min_weight': 0.4470072705196842, 'weight_linear_max_weight': 4.908995130503322}. Best is trial 157 with value: 0.2276608592360967.
2026-06-01 03:01:02 | INFO | src.nested_cv_avggrm_weighted_unified | Trial 162 | outer=11 | alpha=1.951e+03 n_pcs=4500 (pc_topk) weight_search=on
2026-06-01 03:01:02 | INFO | src.nested_cv_avggrm_weighted_unified | Trial 162 | outer=11 | weight={'name': 'linear', 'floor': 1e-06, 'clip_max': 3.0, 'min_weight': 0.391220716873244, 'max_weight': 4.993124637816874}
2026-06-01 03:01:06 | INFO | src.nested_cv_avggrm_weighted_unified | Trial 162 | outer=11 | pruned after 6/10 inner folds (mean r=0.1657)
[I 2026-06-01 03:01:06,329] Trial 162 pruned. 
2026-06-01 03:01:06 | INFO | src.nested_cv_avggrm_weighted_unified | Trial 163 | outer=11 | alpha=7.731e+04 n_pcs=4500 (pc_topk) weight_search=on
2026-06-01 03:01:06 | INFO | src.nested_cv_avggrm_weighted_unified | Trial 163 | outer=11 | weight={'name': 'linear', 'floor': 1e-06, 'clip_max': 3.0, 'min_weight': 0.44835325320520947, 'max_weight': 4.868433434012804}
[I 2026-06-01 03:01:13,444] Trial 163 finished with value: 0.2276195695117777 and parameters: {'alpha': 77306.85082618699, 'n_pcs': 4500, 'weight_scheme': 'linear', 'weight_clip_max': 3.0, 'weight_linear_min_weight': 0.44835325320520947, 'weight_linear_max_weight': 4.868433434012804}. Best is trial 157 with value: 0.2276608592360967.
2026-06-01 03:01:13 | INFO | src.nested_cv_avggrm_weighted_unified | Trial 164 | outer=11 | alpha=7.870e+04 n_pcs=4000 (pc_topk) weight_search=on
2026-06-01 03:01:13 | INFO | src.nested_cv_avggrm_weighted_unified | Trial 164 | outer=11 | weight={'name': 'linear', 'floor': 1e-06, 'clip_max': 3.0, 'min_weight': 0.4435593578175442, 'max_weight': 2.9000743720435245}
[I 2026-06-01 03:01:19,219] Trial 164 finished with value: 0.22617516371088403 and parameters: {'alpha': 78703.0134455304, 'n_pcs': 4000, 'weight_scheme': 'linear', 'weight_clip_max': 3.0, 'weight_linear_min_weight': 0.4435593578175442, 'weight_linear_max_weight': 2.9000743720435245}. Best is trial 157 with value: 0.2276608592360967.
2026-06-01 03:01:19 | INFO | src.nested_cv_avggrm_weighted_unified | Trial 165 | outer=11 | alpha=1.056e+05 n_pcs=4500 (pc_topk) weight_search=on
2026-06-01 03:01:19 | INFO | src.nested_cv_avggrm_weighted_unified | Trial 165 | outer=11 | weight={'name': 'linear', 'floor': 1e-06, 'clip_max': 3.0, 'min_weight': 0.42404675744135945, 'max_weight': 4.862875517609181}
[I 2026-06-01 03:01:26,237] Trial 165 finished with value: 0.22702106663580074 and parameters: {'alpha': 105596.25580772436, 'n_pcs': 4500, 'weight_scheme': 'linear', 'weight_clip_max': 3.0, 'weight_linear_min_weight': 0.42404675744135945, 'weight_linear_max_weight': 4.862875517609181}. Best is trial 157 with value: 0.2276608592360967.
2026-06-01 03:01:26 | INFO | src.nested_cv_avggrm_weighted_unified | Trial 166 | outer=11 | alpha=1.533e+05 n_pcs=4500 (pc_topk) weight_search=on
2026-06-01 03:01:26 | INFO | src.nested_cv_avggrm_weighted_unified | Trial 166 | outer=11 | weight={'name': 'linear', 'floor': 1e-06, 'clip_max': 3.0, 'min_weight': 0.3665678707042745, 'max_weight': 4.906453978562556}
[I 2026-06-01 03:01:33,274] Trial 166 finished with value: 0.22563729355491285 and parameters: {'alpha': 153331.9337870825, 'n_pcs': 4500, 'weight_scheme': 'linear', 'weight_clip_max': 3.0, 'weight_linear_min_weight': 0.3665678707042745, 'weight_linear_max_weight': 4.906453978562556}. Best is trial 157 with value: 0.2276608592360967.
2026-06-01 03:01:33 | INFO | src.nested_cv_avggrm_weighted_unified | Trial 167 | outer=11 | alpha=8.840e+04 n_pcs=4500 (pc_topk) weight_search=on
2026-06-01 03:01:33 | INFO | src.nested_cv_avggrm_weighted_unified | Trial 167 | outer=11 | weight={'name': 'linear', 'floor': 1e-06, 'clip_max': 3.0, 'min_weight': 0.5159354209026389, 'max_weight': 4.826239167574077}
[I 2026-06-01 03:01:40,296] Trial 167 finished with value: 0.2272277270961919 and parameters: {'alpha': 88397.0602261542, 'n_pcs': 4500, 'weight_scheme': 'linear', 'weight_clip_max': 3.0, 'weight_linear_min_weight': 0.5159354209026389, 'weight_linear_max_weight': 4.826239167574077}. Best is trial 157 with value: 0.2276608592360967.
2026-06-01 03:01:40 | INFO | src.nested_cv_avggrm_weighted_unified | Trial 168 | outer=11 | alpha=4.513e+04 n_pcs=5000 (pc_topk) weight_search=on
2026-06-01 03:01:40 | INFO | src.nested_cv_avggrm_weighted_unified | Trial 168 | outer=11 | weight={'name': 'linear', 'floor': 1e-06, 'clip_max': 3.0, 'min_weight': 0.4513326777568982, 'max_weight': 4.995751566445049}
[I 2026-06-01 03:01:48,531] Trial 168 finished with value: 0.22540821669407252 and parameters: {'alpha': 45132.85192802798, 'n_pcs': 5000, 'weight_scheme': 'linear', 'weight_clip_max': 3.0, 'weight_linear_min_weight': 0.4513326777568982, 'weight_linear_max_weight': 4.995751566445049}. Best is trial 157 with value: 0.2276608592360967.
2026-06-01 03:01:48 | INFO | src.nested_cv_avggrm_weighted_unified | Trial 169 | outer=11 | alpha=7.295e+04 n_pcs=4000 (pc_topk) weight_search=on
2026-06-01 03:01:48 | INFO | src.nested_cv_avggrm_weighted_unified | Trial 169 | outer=11 | weight={'name': 'linear', 'floor': 1e-06, 'clip_max': None, 'min_weight': 0.4176597552288692, 'max_weight': 4.73296361679716}
[I 2026-06-01 03:01:54,285] Trial 169 finished with value: 0.22631742222620152 and parameters: {'alpha': 72946.66647625172, 'n_pcs': 4000, 'weight_scheme': 'linear', 'weight_clip_max': None, 'weight_linear_min_weight': 0.4176597552288692, 'weight_linear_max_weight': 4.73296361679716}. Best is trial 157 with value: 0.2276608592360967.
2026-06-01 03:01:54 | INFO | src.nested_cv_avggrm_weighted_unified | Trial 170 | outer=11 | alpha=1.119e+05 n_pcs=4500 (pc_topk) weight_search=on
2026-06-01 03:01:54 | INFO | src.nested_cv_avggrm_weighted_unified | Trial 170 | outer=11 | weight={'name': 'uniform', 'floor': 1e-06, 'clip_max': 3.0}
2026-06-01 03:01:58 | INFO | src.nested_cv_avggrm_weighted_unified | Trial 170 | outer=11 | pruned after 7/10 inner folds (mean r=0.2602)
[I 2026-06-01 03:01:58,578] Trial 170 pruned. 
2026-06-01 03:01:58 | INFO | src.nested_cv_avggrm_weighted_unified | Trial 171 | outer=11 | alpha=7.107e+04 n_pcs=4500 (pc_topk) weight_search=on
2026-06-01 03:01:58 | INFO | src.nested_cv_avggrm_weighted_unified | Trial 171 | outer=11 | weight={'name': 'linear', 'floor': 1e-06, 'clip_max': 3.0, 'min_weight': 0.47491815636135526, 'max_weight': 4.887387358524821}
[I 2026-06-01 03:02:05,621] Trial 171 finished with value: 0.22763646914477992 and parameters: {'alpha': 71068.11600154248, 'n_pcs': 4500, 'weight_scheme': 'linear', 'weight_clip_max': 3.0, 'weight_linear_min_weight': 0.47491815636135526, 'weight_linear_max_weight': 4.887387358524821}. Best is trial 157 with value: 0.2276608592360967.
2026-06-01 03:02:05 | INFO | src.nested_cv_avggrm_weighted_unified | Trial 172 | outer=11 | alpha=7.287e+04 n_pcs=4500 (pc_topk) weight_search=on
2026-06-01 03:02:05 | INFO | src.nested_cv_avggrm_weighted_unified | Trial 172 | outer=11 | weight={'name': 'linear', 'floor': 1e-06, 'clip_max': 3.0, 'min_weight': 0.480433008333071, 'max_weight': 4.902682689948748}
[I 2026-06-01 03:02:12,658] Trial 172 finished with value: 0.22761579525659165 and parameters: {'alpha': 72868.18879908817, 'n_pcs': 4500, 'weight_scheme': 'linear', 'weight_clip_max': 3.0, 'weight_linear_min_weight': 0.480433008333071, 'weight_linear_max_weight': 4.902682689948748}. Best is trial 157 with value: 0.2276608592360967.
2026-06-01 03:02:12 | INFO | src.nested_cv_avggrm_weighted_unified | Trial 173 | outer=11 | alpha=9.032e+04 n_pcs=4500 (pc_topk) weight_search=on
2026-06-01 03:02:12 | INFO | src.nested_cv_avggrm_weighted_unified | Trial 173 | outer=11 | weight={'name': 'linear', 'floor': 1e-06, 'clip_max': 3.0, 'min_weight': 0.4396040739962076, 'max_weight': 4.910184337416408}
