[I 2026-06-01 00:04:17,124] Trial 157 finished with value: 0.19551169821333134 and parameters: {'alpha': 145843.4298183808, 'n_pcs': 5000, 'weight_scheme': 'linear', 'weight_clip_max': None, 'weight_linear_min_weight': 0.3997913017398322, 'weight_linear_max_weight': 4.990020153485582}. Best is trial 41 with value: 0.19810774778548906.
2026-06-01 00:04:17 | INFO | src.nested_cv_avggrm_weighted_unified | Trial 158 | outer=4 | alpha=9.009e+04 n_pcs=4500 (pc_topk) weight_search=on
2026-06-01 00:04:17 | INFO | src.nested_cv_avggrm_weighted_unified | Trial 158 | outer=4 | weight={'name': 'linear', 'floor': 1e-06, 'clip_max': 10.0, 'min_weight': 0.5726246132470126, 'max_weight': 3.3533356578606432}
2026-06-01 00:04:21 | INFO | src.nested_cv_avggrm_weighted_unified | Trial 158 | outer=4 | pruned after 6/10 inner folds (mean r=0.2053)
[I 2026-06-01 00:04:21,311] Trial 158 pruned. 
2026-06-01 00:04:21 | INFO | src.nested_cv_avggrm_weighted_unified | Trial 159 | outer=4 | alpha=7.419e+04 n_pcs=4000 (pc_topk) weight_search=on
2026-06-01 00:04:21 | INFO | src.nested_cv_avggrm_weighted_unified | Trial 159 | outer=4 | weight={'name': 'linear', 'floor': 1e-06, 'clip_max': 10.0, 'min_weight': 0.49108072633260696, 'max_weight': 3.468981596274743}
2026-06-01 00:04:24 | INFO | src.nested_cv_avggrm_weighted_unified | Trial 159 | outer=4 | pruned after 6/10 inner folds (mean r=0.2031)
[I 2026-06-01 00:04:24,730] Trial 159 pruned. 
2026-06-01 00:04:24 | INFO | src.nested_cv_avggrm_weighted_unified | Trial 160 | outer=4 | alpha=1.788e+05 n_pcs=4500 (pc_topk) weight_search=on
2026-06-01 00:04:24 | INFO | src.nested_cv_avggrm_weighted_unified | Trial 160 | outer=4 | weight={'name': 'linear', 'floor': 1e-06, 'clip_max': None, 'min_weight': 0.588453213116873, 'max_weight': 4.6165951452764045}
[I 2026-06-01 00:04:31,670] Trial 160 finished with value: 0.19488198679221908 and parameters: {'alpha': 178766.04613981236, 'n_pcs': 4500, 'weight_scheme': 'linear', 'weight_clip_max': None, 'weight_linear_min_weight': 0.588453213116873, 'weight_linear_max_weight': 4.6165951452764045}. Best is trial 41 with value: 0.19810774778548906.
2026-06-01 00:04:31 | INFO | src.nested_cv_avggrm_weighted_unified | Trial 161 | outer=4 | alpha=1.081e+05 n_pcs=4500 (pc_topk) weight_search=on
2026-06-01 00:04:31 | INFO | src.nested_cv_avggrm_weighted_unified | Trial 161 | outer=4 | weight={'name': 'linear', 'floor': 1e-06, 'clip_max': 10.0, 'min_weight': 0.6465032188164734, 'max_weight': 4.2908901714645316}
[I 2026-06-01 00:04:38,603] Trial 161 finished with value: 0.19714632470882626 and parameters: {'alpha': 108089.59313521514, 'n_pcs': 4500, 'weight_scheme': 'linear', 'weight_clip_max': 10.0, 'weight_linear_min_weight': 0.6465032188164734, 'weight_linear_max_weight': 4.2908901714645316}. Best is trial 41 with value: 0.19810774778548906.
2026-06-01 00:04:38 | INFO | src.nested_cv_avggrm_weighted_unified | Trial 162 | outer=4 | alpha=1.056e+05 n_pcs=4500 (pc_topk) weight_search=on
2026-06-01 00:04:38 | INFO | src.nested_cv_avggrm_weighted_unified | Trial 162 | outer=4 | weight={'name': 'linear', 'floor': 1e-06, 'clip_max': 10.0, 'min_weight': 0.6011358738507289, 'max_weight': 4.080564112714558}
[I 2026-06-01 00:04:45,614] Trial 162 finished with value: 0.1972616174540727 and parameters: {'alpha': 105643.45296036082, 'n_pcs': 4500, 'weight_scheme': 'linear', 'weight_clip_max': 10.0, 'weight_linear_min_weight': 0.6011358738507289, 'weight_linear_max_weight': 4.080564112714558}. Best is trial 41 with value: 0.19810774778548906.
2026-06-01 00:04:45 | INFO | src.nested_cv_avggrm_weighted_unified | Trial 163 | outer=4 | alpha=1.320e+05 n_pcs=4500 (pc_topk) weight_search=on
2026-06-01 00:04:45 | INFO | src.nested_cv_avggrm_weighted_unified | Trial 163 | outer=4 | weight={'name': 'linear', 'floor': 1e-06, 'clip_max': 10.0, 'min_weight': 0.6125370177828511, 'max_weight': 2.942940819530748}
[I 2026-06-01 00:04:52,582] Trial 163 finished with value: 0.19546331340021428 and parameters: {'alpha': 132046.33388845128, 'n_pcs': 4500, 'weight_scheme': 'linear', 'weight_clip_max': 10.0, 'weight_linear_min_weight': 0.6125370177828511, 'weight_linear_max_weight': 2.942940819530748}. Best is trial 41 with value: 0.19810774778548906.
2026-06-01 00:04:52 | INFO | src.nested_cv_avggrm_weighted_unified | Trial 164 | outer=4 | alpha=7.415e+04 n_pcs=4500 (pc_topk) weight_search=on
2026-06-01 00:04:52 | INFO | src.nested_cv_avggrm_weighted_unified | Trial 164 | outer=4 | weight={'name': 'linear', 'floor': 1e-06, 'clip_max': 10.0, 'min_weight': 0.5523393941676368, 'max_weight': 4.5146066065028805}
2026-06-01 00:04:56 | INFO | src.nested_cv_avggrm_weighted_unified | Trial 164 | outer=4 | pruned after 6/10 inner folds (mean r=0.2041)
[I 2026-06-01 00:04:56,780] Trial 164 pruned. 
2026-06-01 00:04:56 | INFO | src.nested_cv_avggrm_weighted_unified | Trial 165 | outer=4 | alpha=9.330e+04 n_pcs=4500 (pc_topk) weight_search=on
2026-06-01 00:04:56 | INFO | src.nested_cv_avggrm_weighted_unified | Trial 165 | outer=4 | weight={'name': 'linear', 'floor': 1e-06, 'clip_max': 10.0, 'min_weight': 0.5216396483243184, 'max_weight': 3.238641189405679}
2026-06-01 00:05:00 | INFO | src.nested_cv_avggrm_weighted_unified | Trial 165 | outer=4 | pruned after 6/10 inner folds (mean r=0.2055)
[I 2026-06-01 00:05:00,965] Trial 165 pruned. 
2026-06-01 00:05:00 | INFO | src.nested_cv_avggrm_weighted_unified | Trial 166 | outer=4 | alpha=5.694e+04 n_pcs=4500 (pc_topk) weight_search=on
2026-06-01 00:05:00 | INFO | src.nested_cv_avggrm_weighted_unified | Trial 166 | outer=4 | weight={'name': 'linear', 'floor': 1e-06, 'clip_max': 20.0, 'min_weight': 0.4199070857519173, 'max_weight': 3.561424132986544}
2026-06-01 00:05:05 | INFO | src.nested_cv_avggrm_weighted_unified | Trial 166 | outer=4 | pruned after 6/10 inner folds (mean r=0.2017)
[I 2026-06-01 00:05:05,161] Trial 166 pruned. 
2026-06-01 00:05:05 | INFO | src.nested_cv_avggrm_weighted_unified | Trial 167 | outer=4 | alpha=9.726e+04 n_pcs=4500 (pc_topk) weight_search=on
2026-06-01 00:05:05 | INFO | src.nested_cv_avggrm_weighted_unified | Trial 167 | outer=4 | weight={'name': 'linear', 'floor': 1e-06, 'clip_max': 10.0, 'min_weight': 0.7466247777325054, 'max_weight': 4.364956053726703}
2026-06-01 00:05:10 | INFO | src.nested_cv_avggrm_weighted_unified | Trial 167 | outer=4 | pruned after 7/10 inner folds (mean r=0.2345)
[I 2026-06-01 00:05:10,036] Trial 167 pruned. 
2026-06-01 00:05:10 | INFO | src.nested_cv_avggrm_weighted_unified | Trial 168 | outer=4 | alpha=4.256e+04 n_pcs=5000 (pc_topk) weight_search=on
2026-06-01 00:05:10 | INFO | src.nested_cv_avggrm_weighted_unified | Trial 168 | outer=4 | weight={'name': 'linear', 'floor': 1e-06, 'clip_max': None, 'min_weight': 0.666413099783, 'max_weight': 4.156573530695501}
2026-06-01 00:05:14 | INFO | src.nested_cv_avggrm_weighted_unified | Trial 168 | outer=4 | pruned after 6/10 inner folds (mean r=0.1973)
[I 2026-06-01 00:05:14,945] Trial 168 pruned. 
2026-06-01 00:05:14 | INFO | src.nested_cv_avggrm_weighted_unified | Trial 169 | outer=4 | alpha=1.227e+05 n_pcs=4500 (pc_topk) weight_search=on
2026-06-01 00:05:14 | INFO | src.nested_cv_avggrm_weighted_unified | Trial 169 | outer=4 | weight={'name': 'linear', 'floor': 1e-06, 'clip_max': 10.0, 'min_weight': 0.6227299435849232, 'max_weight': 3.6515474240795043}
[I 2026-06-01 00:05:21,885] Trial 169 finished with value: 0.19637292479761337 and parameters: {'alpha': 122664.54234419196, 'n_pcs': 4500, 'weight_scheme': 'linear', 'weight_clip_max': 10.0, 'weight_linear_min_weight': 0.6227299435849232, 'weight_linear_max_weight': 3.6515474240795043}. Best is trial 41 with value: 0.19810774778548906.
2026-06-01 00:05:21 | INFO | src.nested_cv_avggrm_weighted_unified | Trial 170 | outer=4 | alpha=6.666e+04 n_pcs=4500 (pc_topk) weight_search=on
2026-06-01 00:05:21 | INFO | src.nested_cv_avggrm_weighted_unified | Trial 170 | outer=4 | weight={'name': 'linear', 'floor': 1e-06, 'clip_max': 10.0, 'min_weight': 0.5015300458358248, 'max_weight': 4.86656291426231}
2026-06-01 00:05:26 | INFO | src.nested_cv_avggrm_weighted_unified | Trial 170 | outer=4 | pruned after 6/10 inner folds (mean r=0.2030)
[I 2026-06-01 00:05:26,065] Trial 170 pruned. 
2026-06-01 00:05:26 | INFO | src.nested_cv_avggrm_weighted_unified | Trial 171 | outer=4 | alpha=1.083e+05 n_pcs=4500 (pc_topk) weight_search=on
2026-06-01 00:05:26 | INFO | src.nested_cv_avggrm_weighted_unified | Trial 171 | outer=4 | weight={'name': 'linear', 'floor': 1e-06, 'clip_max': 10.0, 'min_weight': 0.6513329113880171, 'max_weight': 4.468654232953382}
[I 2026-06-01 00:05:33,020] Trial 171 finished with value: 0.19718459794779025 and parameters: {'alpha': 108336.7185326314, 'n_pcs': 4500, 'weight_scheme': 'linear', 'weight_clip_max': 10.0, 'weight_linear_min_weight': 0.6513329113880171, 'weight_linear_max_weight': 4.468654232953382}. Best is trial 41 with value: 0.19810774778548906.
2026-06-01 00:05:33 | INFO | src.nested_cv_avggrm_weighted_unified | Trial 172 | outer=4 | alpha=8.971e+04 n_pcs=4500 (pc_topk) weight_search=on
2026-06-01 00:05:33 | INFO | src.nested_cv_avggrm_weighted_unified | Trial 172 | outer=4 | weight={'name': 'linear', 'floor': 1e-06, 'clip_max': 10.0, 'min_weight': 0.6384423831001049, 'max_weight': 4.609232436363919}
2026-06-01 00:05:37 | INFO | src.nested_cv_avggrm_weighted_unified | Trial 172 | outer=4 | pruned after 6/10 inner folds (mean r=0.2054)
[I 2026-06-01 00:05:37,176] Trial 172 pruned. 
2026-06-01 00:05:37 | INFO | src.nested_cv_avggrm_weighted_unified | Trial 173 | outer=4 | alpha=1.592e+05 n_pcs=4500 (pc_topk) weight_search=on
2026-06-01 00:05:37 | INFO | src.nested_cv_avggrm_weighted_unified | Trial 173 | outer=4 | weight={'name': 'linear', 'floor': 1e-06, 'clip_max': 10.0, 'min_weight': 0.5910143696240223, 'max_weight': 4.379730088330187}
[I 2026-06-01 00:05:44,078] Trial 173 finished with value: 0.1954614436634718 and parameters: {'alpha': 159170.7650267453, 'n_pcs': 4500, 'weight_scheme': 'linear', 'weight_clip_max': 10.0, 'weight_linear_min_weight': 0.5910143696240223, 'weight_linear_max_weight': 4.379730088330187}. Best is trial 41 with value: 0.19810774778548906.
2026-06-01 00:05:44 | INFO | src.nested_cv_avggrm_weighted_unified | Trial 174 | outer=4 | alpha=7.743e+04 n_pcs=4500 (pc_topk) weight_search=on
2026-06-01 00:05:44 | INFO | src.nested_cv_avggrm_weighted_unified | Trial 174 | outer=4 | weight={'name': 'linear', 'floor': 1e-06, 'clip_max': 10.0, 'min_weight': 0.37738529293384826, 'max_weight': 4.4626539062676915}
2026-06-01 00:05:48 | INFO | src.nested_cv_avggrm_weighted_unified | Trial 174 | outer=4 | pruned after 6/10 inner folds (mean r=0.2041)
[I 2026-06-01 00:05:48,274] Trial 174 pruned. 
2026-06-01 00:05:48 | INFO | src.nested_cv_avggrm_weighted_unified | Trial 175 | outer=4 | alpha=1.105e+05 n_pcs=4500 (pc_topk) weight_search=on
2026-06-01 00:05:48 | INFO | src.nested_cv_avggrm_weighted_unified | Trial 175 | outer=4 | weight={'name': 'linear', 'floor': 1e-06, 'clip_max': None, 'min_weight': 0.638218415355912, 'max_weight': 4.299786550704429}
[I 2026-06-01 00:05:55,234] Trial 175 finished with value: 0.19708507361295297 and parameters: {'alpha': 110458.80762885993, 'n_pcs': 4500, 'weight_scheme': 'linear', 'weight_clip_max': None, 'weight_linear_min_weight': 0.638218415355912, 'weight_linear_max_weight': 4.299786550704429}. Best is trial 41 with value: 0.19810774778548906.
2026-06-01 00:05:55 | INFO | src.nested_cv_avggrm_weighted_unified | Trial 176 | outer=4 | alpha=1.319e+05 n_pcs=4500 (pc_topk) weight_search=on
2026-06-01 00:05:55 | INFO | src.nested_cv_avggrm_weighted_unified | Trial 176 | outer=4 | weight={'name': 'linear', 'floor': 1e-06, 'clip_max': 10.0, 'min_weight': 0.4544612208332524, 'max_weight': 4.73720469828078}
[I 2026-06-01 00:06:02,159] Trial 176 finished with value: 0.19690019630937136 and parameters: {'alpha': 131949.5358848041, 'n_pcs': 4500, 'weight_scheme': 'linear', 'weight_clip_max': 10.0, 'weight_linear_min_weight': 0.4544612208332524, 'weight_linear_max_weight': 4.73720469828078}. Best is trial 41 with value: 0.19810774778548906.
2026-06-01 00:06:02 | INFO | src.nested_cv_avggrm_weighted_unified | Trial 177 | outer=4 | alpha=8.710e+04 n_pcs=4000 (pc_topk) weight_search=on
2026-06-01 00:06:02 | INFO | src.nested_cv_avggrm_weighted_unified | Trial 177 | outer=4 | weight={'name': 'exponential', 'floor': 1e-06, 'clip_max': 10.0, 'beta': 8.459534103388435}
2026-06-01 00:06:05 | INFO | src.nested_cv_avggrm_weighted_unified | Trial 177 | outer=4 | pruned after 6/10 inner folds (mean r=0.1874)
[I 2026-06-01 00:06:05,592] Trial 177 pruned. 
2026-06-01 00:06:05 | INFO | src.nested_cv_avggrm_weighted_unified | Trial 178 | outer=4 | alpha=5.854e+04 n_pcs=4500 (pc_topk) weight_search=on
2026-06-01 00:06:05 | INFO | src.nested_cv_avggrm_weighted_unified | Trial 178 | outer=4 | weight={'name': 'uniform', 'floor': 1e-06, 'clip_max': None}
2026-06-01 00:06:09 | INFO | src.nested_cv_avggrm_weighted_unified | Trial 178 | outer=4 | pruned after 6/10 inner folds (mean r=0.1974)
[I 2026-06-01 00:06:09,201] Trial 178 pruned. 
2026-06-01 00:06:09 | INFO | src.nested_cv_avggrm_weighted_unified | Trial 179 | outer=4 | alpha=1.028e+05 n_pcs=4500 (pc_topk) weight_search=on
2026-06-01 00:06:09 | INFO | src.nested_cv_avggrm_weighted_unified | Trial 179 | outer=4 | weight={'name': 'linear', 'floor': 1e-06, 'clip_max': 10.0, 'min_weight': 0.5660241752190207, 'max_weight': 4.250205466859216}
[I 2026-06-01 00:06:16,130] Trial 179 finished with value: 0.19747218049536422 and parameters: {'alpha': 102785.44252562003, 'n_pcs': 4500, 'weight_scheme': 'linear', 'weight_clip_max': 10.0, 'weight_linear_min_weight': 0.5660241752190207, 'weight_linear_max_weight': 4.250205466859216}. Best is trial 41 with value: 0.19810774778548906.
2026-06-01 00:06:16 | INFO | src.nested_cv_avggrm_weighted_unified | Trial 180 | outer=4 | alpha=2.410e+05 n_pcs=4500 (pc_topk) weight_search=on
2026-06-01 00:06:16 | INFO | src.nested_cv_avggrm_weighted_unified | Trial 180 | outer=4 | weight={'name': 'linear', 'floor': 1e-06, 'clip_max': 10.0, 'min_weight': 0.5714135987121329, 'max_weight': 4.252452820837311}
[I 2026-06-01 00:06:22,940] Trial 180 finished with value: 0.19268208946426052 and parameters: {'alpha': 241046.2079872651, 'n_pcs': 4500, 'weight_scheme': 'linear', 'weight_clip_max': 10.0, 'weight_linear_min_weight': 0.5714135987121329, 'weight_linear_max_weight': 4.252452820837311}. Best is trial 41 with value: 0.19810774778548906.
2026-06-01 00:06:22 | INFO | src.nested_cv_avggrm_weighted_unified | Trial 181 | outer=4 | alpha=1.036e+05 n_pcs=4500 (pc_topk) weight_search=on
2026-06-01 00:06:22 | INFO | src.nested_cv_avggrm_weighted_unified | Trial 181 | outer=4 | weight={'name': 'linear', 'floor': 1e-06, 'clip_max': 10.0, 'min_weight': 0.6141684778549322, 'max_weight': 4.182105289244293}
[I 2026-06-01 00:06:29,813] Trial 181 finished with value: 0.19733482197600233 and parameters: {'alpha': 103569.62907345296, 'n_pcs': 4500, 'weight_scheme': 'linear', 'weight_clip_max': 10.0, 'weight_linear_min_weight': 0.6141684778549322, 'weight_linear_max_weight': 4.182105289244293}. Best is trial 41 with value: 0.19810774778548906.
2026-06-01 00:06:29 | INFO | src.nested_cv_avggrm_weighted_unified | Trial 182 | outer=4 | alpha=7.355e+04 n_pcs=4500 (pc_topk) weight_search=on
2026-06-01 00:06:29 | INFO | src.nested_cv_avggrm_weighted_unified | Trial 182 | outer=4 | weight={'name': 'linear', 'floor': 1e-06, 'clip_max': 10.0, 'min_weight': 0.612510884057037, 'max_weight': 4.142415596408723}
2026-06-01 00:06:33 | INFO | src.nested_cv_avggrm_weighted_unified | Trial 182 | outer=4 | pruned after 6/10 inner folds (mean r=0.2041)
[I 2026-06-01 00:06:33,949] Trial 182 pruned. 
2026-06-01 00:06:33 | INFO | src.nested_cv_avggrm_weighted_unified | Trial 183 | outer=4 | alpha=9.225e+04 n_pcs=4500 (pc_topk) weight_search=on
2026-06-01 00:06:33 | INFO | src.nested_cv_avggrm_weighted_unified | Trial 183 | outer=4 | weight={'name': 'linear', 'floor': 1e-06, 'clip_max': 10.0, 'min_weight': 0.5565033173916463, 'max_weight': 4.009425708740394}
2026-06-01 00:06:38 | INFO | src.nested_cv_avggrm_weighted_unified | Trial 183 | outer=4 | pruned after 6/10 inner folds (mean r=0.2056)
[I 2026-06-01 00:06:38,074] Trial 183 pruned. 
2026-06-01 00:06:38 | INFO | src.nested_cv_avggrm_weighted_unified | Trial 184 | outer=4 | alpha=1.414e+05 n_pcs=4500 (pc_topk) weight_search=on
2026-06-01 00:06:38 | INFO | src.nested_cv_avggrm_weighted_unified | Trial 184 | outer=4 | weight={'name': 'linear', 'floor': 1e-06, 'clip_max': 10.0, 'min_weight': 0.5333535123955307, 'max_weight': 3.4378785200766986}
[I 2026-06-01 00:06:44,935] Trial 184 finished with value: 0.19583115609910934 and parameters: {'alpha': 141441.4944182901, 'n_pcs': 4500, 'weight_scheme': 'linear', 'weight_clip_max': 10.0, 'weight_linear_min_weight': 0.5333535123955307, 'weight_linear_max_weight': 3.4378785200766986}. Best is trial 41 with value: 0.19810774778548906.
2026-06-01 00:06:44 | INFO | src.nested_cv_avggrm_weighted_unified | Trial 185 | outer=4 | alpha=1.167e+05 n_pcs=4500 (pc_topk) weight_search=on
2026-06-01 00:06:44 | INFO | src.nested_cv_avggrm_weighted_unified | Trial 185 | outer=4 | weight={'name': 'linear', 'floor': 1e-06, 'clip_max': 10.0, 'min_weight': 0.5902392647906043, 'max_weight': 3.704252946214231}
[I 2026-06-01 00:06:51,812] Trial 185 finished with value: 0.19674023416105485 and parameters: {'alpha': 116702.79283532753, 'n_pcs': 4500, 'weight_scheme': 'linear', 'weight_clip_max': 10.0, 'weight_linear_min_weight': 0.5902392647906043, 'weight_linear_max_weight': 3.704252946214231}. Best is trial 41 with value: 0.19810774778548906.
2026-06-01 00:06:51 | INFO | src.nested_cv_avggrm_weighted_unified | Trial 186 | outer=4 | alpha=6.501e+04 n_pcs=4500 (pc_topk) weight_search=on
2026-06-01 00:06:51 | INFO | src.nested_cv_avggrm_weighted_unified | Trial 186 | outer=4 | weight={'name': 'linear', 'floor': 1e-06, 'clip_max': 3.0, 'min_weight': 0.5765063476989891, 'max_weight': 4.197846623216437}
2026-06-01 00:06:55 | INFO | src.nested_cv_avggrm_weighted_unified | Trial 186 | outer=4 | pruned after 6/10 inner folds (mean r=0.2026)
[I 2026-06-01 00:06:55,921] Trial 186 pruned. 
2026-06-01 00:06:55 | INFO | src.nested_cv_avggrm_weighted_unified | Trial 187 | outer=4 | alpha=8.075e+04 n_pcs=5000 (pc_topk) weight_search=on
2026-06-01 00:06:55 | INFO | src.nested_cv_avggrm_weighted_unified | Trial 187 | outer=4 | weight={'name': 'linear', 'floor': 1e-06, 'clip_max': None, 'min_weight': 0.6058045194401372, 'max_weight': 3.9176249174407562}
2026-06-01 00:07:00 | INFO | src.nested_cv_avggrm_weighted_unified | Trial 187 | outer=4 | pruned after 6/10 inner folds (mean r=0.2033)
[I 2026-06-01 00:07:00,799] Trial 187 pruned. 
2026-06-01 00:07:00 | INFO | src.nested_cv_avggrm_weighted_unified | Trial 188 | outer=4 | alpha=9.886e+04 n_pcs=4500 (pc_topk) weight_search=on
2026-06-01 00:07:00 | INFO | src.nested_cv_avggrm_weighted_unified | Trial 188 | outer=4 | weight={'name': 'linear', 'floor': 1e-06, 'clip_max': 10.0, 'min_weight': 0.4767250470793276, 'max_weight': 3.84758036068187}
[I 2026-06-01 00:07:07,704] Trial 188 finished with value: 0.1976500814205761 and parameters: {'alpha': 98861.71748677599, 'n_pcs': 4500, 'weight_scheme': 'linear', 'weight_clip_max': 10.0, 'weight_linear_min_weight': 0.4767250470793276, 'weight_linear_max_weight': 3.84758036068187}. Best is trial 41 with value: 0.19810774778548906.
2026-06-01 00:07:07 | INFO | src.nested_cv_avggrm_weighted_unified | Trial 189 | outer=4 | alpha=4.751e+04 n_pcs=4000 (pc_topk) weight_search=on
2026-06-01 00:07:07 | INFO | src.nested_cv_avggrm_weighted_unified | Trial 189 | outer=4 | weight={'name': 'linear', 'floor': 1e-06, 'clip_max': 10.0, 'min_weight': 0.48166785863063233, 'max_weight': 3.7882202307962123}
2026-06-01 00:07:11 | INFO | src.nested_cv_avggrm_weighted_unified | Trial 189 | outer=4 | pruned after 6/10 inner folds (mean r=0.1977)
[I 2026-06-01 00:07:11,109] Trial 189 pruned. 
2026-06-01 00:07:11 | INFO | src.nested_cv_avggrm_weighted_unified | Trial 190 | outer=4 | alpha=1.595e+05 n_pcs=4500 (pc_topk) weight_search=on
2026-06-01 00:07:11 | INFO | src.nested_cv_avggrm_weighted_unified | Trial 190 | outer=4 | weight={'name': 'linear', 'floor': 1e-06, 'clip_max': 5.0, 'min_weight': 0.43185490437333324, 'max_weight': 4.053403927696793}
[I 2026-06-01 00:07:17,941] Trial 190 finished with value: 0.19587896125772955 and parameters: {'alpha': 159494.9538238403, 'n_pcs': 4500, 'weight_scheme': 'linear', 'weight_clip_max': 5.0, 'weight_linear_min_weight': 0.43185490437333324, 'weight_linear_max_weight': 4.053403927696793}. Best is trial 41 with value: 0.19810774778548906.
2026-06-01 00:07:17 | INFO | src.nested_cv_avggrm_weighted_unified | Trial 191 | outer=4 | alpha=9.770e+04 n_pcs=4500 (pc_topk) weight_search=on
2026-06-01 00:07:17 | INFO | src.nested_cv_avggrm_weighted_unified | Trial 191 | outer=4 | weight={'name': 'linear', 'floor': 1e-06, 'clip_max': 10.0, 'min_weight': 0.5073137449210094, 'max_weight': 4.230118346401639}
[I 2026-06-01 00:07:24,798] Trial 191 finished with value: 0.19770485316717534 and parameters: {'alpha': 97697.88238799566, 'n_pcs': 4500, 'weight_scheme': 'linear', 'weight_clip_max': 10.0, 'weight_linear_min_weight': 0.5073137449210094, 'weight_linear_max_weight': 4.230118346401639}. Best is trial 41 with value: 0.19810774778548906.
2026-06-01 00:07:24 | INFO | src.nested_cv_avggrm_weighted_unified | Trial 192 | outer=4 | alpha=9.510e+04 n_pcs=4500 (pc_topk) weight_search=on
2026-06-01 00:07:24 | INFO | src.nested_cv_avggrm_weighted_unified | Trial 192 | outer=4 | weight={'name': 'linear', 'floor': 1e-06, 'clip_max': 10.0, 'min_weight': 0.4713196059776071, 'max_weight': 3.8664990600082136}
2026-06-01 00:07:28 | INFO | src.nested_cv_avggrm_weighted_unified | Trial 192 | outer=4 | pruned after 6/10 inner folds (mean r=0.2057)
