[I 2026-05-31 23:38:14,996] Trial 62 finished with value: 0.20618917075717452 and parameters: {'alpha': 119520.88716620719, 'n_pcs': 4500, 'weight_scheme': 'linear', 'weight_clip_max': 20.0, 'weight_linear_min_weight': 0.5336874840756982, 'weight_linear_max_weight': 3.2141378767128748}. Best is trial 18 with value: 0.20714176623289293.
2026-05-31 23:38:15 | INFO | src.nested_cv_avggrm_weighted_unified | Trial 63 | outer=3 | alpha=1.053e+05 n_pcs=4000 (pc_topk) weight_search=on
2026-05-31 23:38:15 | INFO | src.nested_cv_avggrm_weighted_unified | Trial 63 | outer=3 | weight={'name': 'linear', 'floor': 1e-06, 'clip_max': 20.0, 'min_weight': 0.6307819266063102, 'max_weight': 3.228476566586102}
2026-05-31 23:38:18 | INFO | src.nested_cv_avggrm_weighted_unified | Trial 63 | outer=3 | pruned after 6/10 inner folds (mean r=0.2193)
[I 2026-05-31 23:38:18,405] Trial 63 pruned. 
2026-05-31 23:38:18 | INFO | src.nested_cv_avggrm_weighted_unified | Trial 64 | outer=3 | alpha=3.245e+05 n_pcs=5000 (pc_topk) weight_search=on
2026-05-31 23:38:18 | INFO | src.nested_cv_avggrm_weighted_unified | Trial 64 | outer=3 | weight={'name': 'linear', 'floor': 1e-06, 'clip_max': 20.0, 'min_weight': 0.7727186712948546, 'max_weight': 3.4535498221077816}
2026-05-31 23:38:23 | INFO | src.nested_cv_avggrm_weighted_unified | Trial 64 | outer=3 | pruned after 6/10 inner folds (mean r=0.2198)
[I 2026-05-31 23:38:23,173] Trial 64 pruned. 
2026-05-31 23:38:23 | INFO | src.nested_cv_avggrm_weighted_unified | Trial 65 | outer=3 | alpha=5.731e+05 n_pcs=4500 (pc_topk) weight_search=on
2026-05-31 23:38:23 | INFO | src.nested_cv_avggrm_weighted_unified | Trial 65 | outer=3 | weight={'name': 'linear', 'floor': 1e-06, 'clip_max': 5.0, 'min_weight': 0.9282400673370889, 'max_weight': 3.142044283963031}
2026-05-31 23:38:27 | INFO | src.nested_cv_avggrm_weighted_unified | Trial 65 | outer=3 | pruned after 6/10 inner folds (mean r=0.2180)
[I 2026-05-31 23:38:27,253] Trial 65 pruned. 
2026-05-31 23:38:27 | INFO | src.nested_cv_avggrm_weighted_unified | Trial 66 | outer=3 | alpha=8.913e+05 n_pcs=4000 (pc_topk) weight_search=on
2026-05-31 23:38:27 | INFO | src.nested_cv_avggrm_weighted_unified | Trial 66 | outer=3 | weight={'name': 'linear', 'floor': 1e-06, 'clip_max': 10.0, 'min_weight': 0.48900235469090636, 'max_weight': 2.7140241819806574}
2026-05-31 23:38:30 | INFO | src.nested_cv_avggrm_weighted_unified | Trial 66 | outer=3 | pruned after 6/10 inner folds (mean r=0.2192)
[I 2026-05-31 23:38:30,642] Trial 66 pruned. 
2026-05-31 23:38:30 | INFO | src.nested_cv_avggrm_weighted_unified | Trial 67 | outer=3 | alpha=1.263e+05 n_pcs=1500 (pc_topk) weight_search=on
2026-05-31 23:38:30 | INFO | src.nested_cv_avggrm_weighted_unified | Trial 67 | outer=3 | weight={'name': 'exponential', 'floor': 1e-06, 'clip_max': 20.0, 'beta': 4.805383708571625}
2026-05-31 23:38:31 | INFO | src.nested_cv_avggrm_weighted_unified | Trial 67 | outer=3 | pruned after 5/10 inner folds (mean r=0.1511)
[I 2026-05-31 23:38:31,488] Trial 67 pruned. 
2026-05-31 23:38:31 | INFO | src.nested_cv_avggrm_weighted_unified | Trial 68 | outer=3 | alpha=5.066e+04 n_pcs=2500 (pc_topk) weight_search=on
2026-05-31 23:38:31 | INFO | src.nested_cv_avggrm_weighted_unified | Trial 68 | outer=3 | weight={'name': 'linear', 'floor': 1e-06, 'clip_max': 3.0, 'min_weight': 0.10246196487666065, 'max_weight': 2.8719060461267767}
2026-05-31 23:38:33 | INFO | src.nested_cv_avggrm_weighted_unified | Trial 68 | outer=3 | pruned after 6/10 inner folds (mean r=0.2102)
[I 2026-05-31 23:38:33,266] Trial 68 pruned. 
2026-05-31 23:38:33 | INFO | src.nested_cv_avggrm_weighted_unified | Trial 69 | outer=3 | alpha=2.651e+04 n_pcs=2000 (pc_topk) weight_search=on
2026-05-31 23:38:33 | INFO | src.nested_cv_avggrm_weighted_unified | Trial 69 | outer=3 | weight={'name': 'linear', 'floor': 1e-06, 'clip_max': 20.0, 'min_weight': 0.5517299344988406, 'max_weight': 3.684245117475843}
2026-05-31 23:38:34 | INFO | src.nested_cv_avggrm_weighted_unified | Trial 69 | outer=3 | pruned after 6/10 inner folds (mean r=0.1858)
[I 2026-05-31 23:38:34,583] Trial 69 pruned. 
2026-05-31 23:38:34 | INFO | src.nested_cv_avggrm_weighted_unified | Trial 70 | outer=3 | alpha=4.318e+05 n_pcs=4500 (pc_topk) weight_search=on
2026-05-31 23:38:34 | INFO | src.nested_cv_avggrm_weighted_unified | Trial 70 | outer=3 | weight={'name': 'uniform', 'floor': 1e-06, 'clip_max': None}
2026-05-31 23:38:38 | INFO | src.nested_cv_avggrm_weighted_unified | Trial 70 | outer=3 | pruned after 6/10 inner folds (mean r=0.2080)
[I 2026-05-31 23:38:38,143] Trial 70 pruned. 
2026-05-31 23:38:38 | INFO | src.nested_cv_avggrm_weighted_unified | Trial 71 | outer=3 | alpha=1.737e+05 n_pcs=4500 (pc_topk) weight_search=on
2026-05-31 23:38:38 | INFO | src.nested_cv_avggrm_weighted_unified | Trial 71 | outer=3 | weight={'name': 'linear', 'floor': 1e-06, 'clip_max': 20.0, 'min_weight': 0.6272801078263321, 'max_weight': 2.1825542605172465}
[I 2026-05-31 23:38:44,958] Trial 71 finished with value: 0.20425490375871563 and parameters: {'alpha': 173729.69622755956, 'n_pcs': 4500, 'weight_scheme': 'linear', 'weight_clip_max': 20.0, 'weight_linear_min_weight': 0.6272801078263321, 'weight_linear_max_weight': 2.1825542605172465}. Best is trial 18 with value: 0.20714176623289293.
2026-05-31 23:38:44 | INFO | src.nested_cv_avggrm_weighted_unified | Trial 72 | outer=3 | alpha=2.479e+05 n_pcs=4500 (pc_topk) weight_search=on
2026-05-31 23:38:44 | INFO | src.nested_cv_avggrm_weighted_unified | Trial 72 | outer=3 | weight={'name': 'linear', 'floor': 1e-06, 'clip_max': 20.0, 'min_weight': 0.2829096945435432, 'max_weight': 2.5307254130201855}
[I 2026-05-31 23:38:51,746] Trial 72 finished with value: 0.2045946992545172 and parameters: {'alpha': 247906.31119948273, 'n_pcs': 4500, 'weight_scheme': 'linear', 'weight_clip_max': 20.0, 'weight_linear_min_weight': 0.2829096945435432, 'weight_linear_max_weight': 2.5307254130201855}. Best is trial 18 with value: 0.20714176623289293.
2026-05-31 23:38:51 | INFO | src.nested_cv_avggrm_weighted_unified | Trial 73 | outer=3 | alpha=7.440e+04 n_pcs=5000 (pc_topk) weight_search=on
2026-05-31 23:38:51 | INFO | src.nested_cv_avggrm_weighted_unified | Trial 73 | outer=3 | weight={'name': 'linear', 'floor': 1e-06, 'clip_max': 20.0, 'min_weight': 0.41608400141082474, 'max_weight': 2.3768137771990148}
2026-05-31 23:38:56 | INFO | src.nested_cv_avggrm_weighted_unified | Trial 73 | outer=3 | pruned after 6/10 inner folds (mean r=0.2164)
[I 2026-05-31 23:38:56,532] Trial 73 pruned. 
2026-05-31 23:38:56 | INFO | src.nested_cv_avggrm_weighted_unified | Trial 74 | outer=3 | alpha=1.375e+05 n_pcs=4000 (pc_topk) weight_search=on
2026-05-31 23:38:56 | INFO | src.nested_cv_avggrm_weighted_unified | Trial 74 | outer=3 | weight={'name': 'linear', 'floor': 1e-06, 'clip_max': 20.0, 'min_weight': 0.3682743315392378, 'max_weight': 3.0811924943667606}
[I 2026-05-31 23:39:02,190] Trial 74 finished with value: 0.20572075743309487 and parameters: {'alpha': 137515.8847029405, 'n_pcs': 4000, 'weight_scheme': 'linear', 'weight_clip_max': 20.0, 'weight_linear_min_weight': 0.3682743315392378, 'weight_linear_max_weight': 3.0811924943667606}. Best is trial 18 with value: 0.20714176623289293.
2026-05-31 23:39:02 | INFO | src.nested_cv_avggrm_weighted_unified | Trial 75 | outer=3 | alpha=8.975e+04 n_pcs=4000 (pc_topk) weight_search=on
2026-05-31 23:39:02 | INFO | src.nested_cv_avggrm_weighted_unified | Trial 75 | outer=3 | weight={'name': 'linear', 'floor': 1e-06, 'clip_max': 20.0, 'min_weight': 0.3506862988871149, 'max_weight': 3.4775300815029278}
2026-05-31 23:39:05 | INFO | src.nested_cv_avggrm_weighted_unified | Trial 75 | outer=3 | pruned after 6/10 inner folds (mean r=0.2179)
[I 2026-05-31 23:39:05,578] Trial 75 pruned. 
2026-05-31 23:39:05 | INFO | src.nested_cv_avggrm_weighted_unified | Trial 76 | outer=3 | alpha=1.195e+05 n_pcs=3500 (pc_topk) weight_search=on
2026-05-31 23:39:05 | INFO | src.nested_cv_avggrm_weighted_unified | Trial 76 | outer=3 | weight={'name': 'linear', 'floor': 1e-06, 'clip_max': 3.0, 'min_weight': 0.5165358130320348, 'max_weight': 3.1234976160202708}
2026-05-31 23:39:08 | INFO | src.nested_cv_avggrm_weighted_unified | Trial 76 | outer=3 | pruned after 6/10 inner folds (mean r=0.2192)
[I 2026-05-31 23:39:08,454] Trial 76 pruned. 
2026-05-31 23:39:08 | INFO | src.nested_cv_avggrm_weighted_unified | Trial 77 | outer=3 | alpha=1.959e+05 n_pcs=4000 (pc_topk) weight_search=on
2026-05-31 23:39:08 | INFO | src.nested_cv_avggrm_weighted_unified | Trial 77 | outer=3 | weight={'name': 'linear', 'floor': 1e-06, 'clip_max': 5.0, 'min_weight': 0.22014214918294922, 'max_weight': 2.8696767363832896}
[I 2026-05-31 23:39:14,124] Trial 77 finished with value: 0.2052559645356986 and parameters: {'alpha': 195949.3769873818, 'n_pcs': 4000, 'weight_scheme': 'linear', 'weight_clip_max': 5.0, 'weight_linear_min_weight': 0.22014214918294922, 'weight_linear_max_weight': 2.8696767363832896}. Best is trial 18 with value: 0.20714176623289293.
2026-05-31 23:39:14 | INFO | src.nested_cv_avggrm_weighted_unified | Trial 78 | outer=3 | alpha=2.782e+05 n_pcs=3000 (pc_topk) weight_search=on
2026-05-31 23:39:14 | INFO | src.nested_cv_avggrm_weighted_unified | Trial 78 | outer=3 | weight={'name': 'linear', 'floor': 1e-06, 'clip_max': 10.0, 'min_weight': 0.8184251982329052, 'max_weight': 3.2650887984401575}
[I 2026-05-31 23:39:17,893] Trial 78 finished with value: 0.20375600556588463 and parameters: {'alpha': 278174.55209959723, 'n_pcs': 3000, 'weight_scheme': 'linear', 'weight_clip_max': 10.0, 'weight_linear_min_weight': 0.8184251982329052, 'weight_linear_max_weight': 3.2650887984401575}. Best is trial 18 with value: 0.20714176623289293.
2026-05-31 23:39:17 | INFO | src.nested_cv_avggrm_weighted_unified | Trial 79 | outer=3 | alpha=6.517e+04 n_pcs=3500 (pc_topk) weight_search=on
2026-05-31 23:39:17 | INFO | src.nested_cv_avggrm_weighted_unified | Trial 79 | outer=3 | weight={'name': 'exponential', 'floor': 1e-06, 'clip_max': 20.0, 'beta': 0.07227222182529225}
2026-05-31 23:39:20 | INFO | src.nested_cv_avggrm_weighted_unified | Trial 79 | outer=3 | pruned after 6/10 inner folds (mean r=0.2115)
[I 2026-05-31 23:39:20,787] Trial 79 pruned. 
2026-05-31 23:39:20 | INFO | src.nested_cv_avggrm_weighted_unified | Trial 80 | outer=3 | alpha=1.430e+05 n_pcs=2000 (pc_topk) weight_search=on
2026-05-31 23:39:20 | INFO | src.nested_cv_avggrm_weighted_unified | Trial 80 | outer=3 | weight={'name': 'linear', 'floor': 1e-06, 'clip_max': 20.0, 'min_weight': 0.38016271759190107, 'max_weight': 2.619314628599542}
2026-05-31 23:39:22 | INFO | src.nested_cv_avggrm_weighted_unified | Trial 80 | outer=3 | pruned after 6/10 inner folds (mean r=0.2162)
[I 2026-05-31 23:39:22,110] Trial 80 pruned. 
2026-05-31 23:39:22 | INFO | src.nested_cv_avggrm_weighted_unified | Trial 81 | outer=3 | alpha=1.599e+05 n_pcs=4500 (pc_topk) weight_search=on
2026-05-31 23:39:22 | INFO | src.nested_cv_avggrm_weighted_unified | Trial 81 | outer=3 | weight={'name': 'linear', 'floor': 1e-06, 'clip_max': 20.0, 'min_weight': 0.30792540585253686, 'max_weight': 2.0473612533001675}
[I 2026-05-31 23:39:28,978] Trial 81 finished with value: 0.20567518307399202 and parameters: {'alpha': 159911.61252341702, 'n_pcs': 4500, 'weight_scheme': 'linear', 'weight_clip_max': 20.0, 'weight_linear_min_weight': 0.30792540585253686, 'weight_linear_max_weight': 2.0473612533001675}. Best is trial 18 with value: 0.20714176623289293.
2026-05-31 23:39:28 | INFO | src.nested_cv_avggrm_weighted_unified | Trial 82 | outer=3 | alpha=9.143e+04 n_pcs=4500 (pc_topk) weight_search=on
2026-05-31 23:39:28 | INFO | src.nested_cv_avggrm_weighted_unified | Trial 82 | outer=3 | weight={'name': 'linear', 'floor': 1e-06, 'clip_max': 20.0, 'min_weight': 0.29628061285719265, 'max_weight': 1.6917963467960484}
2026-05-31 23:39:33 | INFO | src.nested_cv_avggrm_weighted_unified | Trial 82 | outer=3 | pruned after 6/10 inner folds (mean r=0.2190)
[I 2026-05-31 23:39:33,073] Trial 82 pruned. 
2026-05-31 23:39:33 | INFO | src.nested_cv_avggrm_weighted_unified | Trial 83 | outer=3 | alpha=4.719e+04 n_pcs=4000 (pc_topk) weight_search=on
2026-05-31 23:39:33 | INFO | src.nested_cv_avggrm_weighted_unified | Trial 83 | outer=3 | weight={'name': 'linear', 'floor': 1e-06, 'clip_max': 20.0, 'min_weight': 0.2499794361107598, 'max_weight': 2.042075884605654}
2026-05-31 23:39:36 | INFO | src.nested_cv_avggrm_weighted_unified | Trial 83 | outer=3 | pruned after 6/10 inner folds (mean r=0.2122)
[I 2026-05-31 23:39:36,468] Trial 83 pruned. 
2026-05-31 23:39:36 | INFO | src.nested_cv_avggrm_weighted_unified | Trial 84 | outer=3 | alpha=1.418e+05 n_pcs=4500 (pc_topk) weight_search=on
2026-05-31 23:39:36 | INFO | src.nested_cv_avggrm_weighted_unified | Trial 84 | outer=3 | weight={'name': 'linear', 'floor': 1e-06, 'clip_max': 20.0, 'min_weight': 0.3620602054496002, 'max_weight': 3.0149363169457364}
[I 2026-05-31 23:39:43,249] Trial 84 finished with value: 0.2060679824165063 and parameters: {'alpha': 141753.46289403347, 'n_pcs': 4500, 'weight_scheme': 'linear', 'weight_clip_max': 20.0, 'weight_linear_min_weight': 0.3620602054496002, 'weight_linear_max_weight': 3.0149363169457364}. Best is trial 18 with value: 0.20714176623289293.
2026-05-31 23:39:43 | INFO | src.nested_cv_avggrm_weighted_unified | Trial 85 | outer=3 | alpha=1.225e+05 n_pcs=5000 (pc_topk) weight_search=on
2026-05-31 23:39:43 | INFO | src.nested_cv_avggrm_weighted_unified | Trial 85 | outer=3 | weight={'name': 'linear', 'floor': 1e-06, 'clip_max': 20.0, 'min_weight': 0.4216148177348374, 'max_weight': 2.99599265241487}
2026-05-31 23:39:48 | INFO | src.nested_cv_avggrm_weighted_unified | Trial 85 | outer=3 | pruned after 6/10 inner folds (mean r=0.2190)
[I 2026-05-31 23:39:48,033] Trial 85 pruned. 
2026-05-31 23:39:48 | INFO | src.nested_cv_avggrm_weighted_unified | Trial 86 | outer=3 | alpha=2.864e+05 n_pcs=4500 (pc_topk) weight_search=on
2026-05-31 23:39:48 | INFO | src.nested_cv_avggrm_weighted_unified | Trial 86 | outer=3 | weight={'name': 'linear', 'floor': 1e-06, 'clip_max': 20.0, 'min_weight': 0.3719869118804225, 'max_weight': 2.7568373506278654}
[I 2026-05-31 23:39:54,849] Trial 86 finished with value: 0.20384592404299 and parameters: {'alpha': 286447.1566725173, 'n_pcs': 4500, 'weight_scheme': 'linear', 'weight_clip_max': 20.0, 'weight_linear_min_weight': 0.3719869118804225, 'weight_linear_max_weight': 2.7568373506278654}. Best is trial 18 with value: 0.20714176623289293.
2026-05-31 23:39:54 | INFO | src.nested_cv_avggrm_weighted_unified | Trial 87 | outer=3 | alpha=2.266e+05 n_pcs=4000 (pc_topk) weight_search=on
2026-05-31 23:39:54 | INFO | src.nested_cv_avggrm_weighted_unified | Trial 87 | outer=3 | weight={'name': 'linear', 'floor': 1e-06, 'clip_max': 3.0, 'min_weight': 0.18874553438028688, 'max_weight': 3.180365616578355}
[I 2026-05-31 23:40:00,490] Trial 87 finished with value: 0.2059932971497133 and parameters: {'alpha': 226577.10927618013, 'n_pcs': 4000, 'weight_scheme': 'linear', 'weight_clip_max': 3.0, 'weight_linear_min_weight': 0.18874553438028688, 'weight_linear_max_weight': 3.180365616578355}. Best is trial 18 with value: 0.20714176623289293.
2026-05-31 23:40:00 | INFO | src.nested_cv_avggrm_weighted_unified | Trial 88 | outer=3 | alpha=2.148e+05 n_pcs=4000 (pc_topk) weight_search=on
2026-05-31 23:40:00 | INFO | src.nested_cv_avggrm_weighted_unified | Trial 88 | outer=3 | weight={'name': 'linear', 'floor': 1e-06, 'clip_max': 3.0, 'min_weight': 0.1887862914224159, 'max_weight': 3.3975326142757525}
[I 2026-05-31 23:40:06,150] Trial 88 finished with value: 0.20611792765164577 and parameters: {'alpha': 214771.58675650106, 'n_pcs': 4000, 'weight_scheme': 'linear', 'weight_clip_max': 3.0, 'weight_linear_min_weight': 0.1887862914224159, 'weight_linear_max_weight': 3.3975326142757525}. Best is trial 18 with value: 0.20714176623289293.
2026-05-31 23:40:06 | INFO | src.nested_cv_avggrm_weighted_unified | Trial 89 | outer=3 | alpha=4.766e+05 n_pcs=3500 (pc_topk) weight_search=on
2026-05-31 23:40:06 | INFO | src.nested_cv_avggrm_weighted_unified | Trial 89 | outer=3 | weight={'name': 'uniform', 'floor': 1e-06, 'clip_max': 3.0}
2026-05-31 23:40:08 | INFO | src.nested_cv_avggrm_weighted_unified | Trial 89 | outer=3 | pruned after 6/10 inner folds (mean r=0.2076)
[I 2026-05-31 23:40:08,602] Trial 89 pruned. 
2026-05-31 23:40:08 | INFO | src.nested_cv_avggrm_weighted_unified | Trial 90 | outer=3 | alpha=2.148e+05 n_pcs=4000 (pc_topk) weight_search=on
2026-05-31 23:40:08 | INFO | src.nested_cv_avggrm_weighted_unified | Trial 90 | outer=3 | weight={'name': 'linear', 'floor': 1e-06, 'clip_max': 3.0, 'min_weight': 0.1973779510938681, 'max_weight': 3.9010356284172762}
[I 2026-05-31 23:40:14,262] Trial 90 finished with value: 0.20612920015388836 and parameters: {'alpha': 214819.66984163967, 'n_pcs': 4000, 'weight_scheme': 'linear', 'weight_clip_max': 3.0, 'weight_linear_min_weight': 0.1973779510938681, 'weight_linear_max_weight': 3.9010356284172762}. Best is trial 18 with value: 0.20714176623289293.
2026-05-31 23:40:14 | INFO | src.nested_cv_avggrm_weighted_unified | Trial 91 | outer=3 | alpha=2.157e+05 n_pcs=4000 (pc_topk) weight_search=on
2026-05-31 23:40:14 | INFO | src.nested_cv_avggrm_weighted_unified | Trial 91 | outer=3 | weight={'name': 'linear', 'floor': 1e-06, 'clip_max': 3.0, 'min_weight': 0.17296950490737734, 'max_weight': 4.268014886321444}
[I 2026-05-31 23:40:19,938] Trial 91 finished with value: 0.20609713492838216 and parameters: {'alpha': 215711.497687089, 'n_pcs': 4000, 'weight_scheme': 'linear', 'weight_clip_max': 3.0, 'weight_linear_min_weight': 0.17296950490737734, 'weight_linear_max_weight': 4.268014886321444}. Best is trial 18 with value: 0.20714176623289293.
2026-05-31 23:40:19 | INFO | src.nested_cv_avggrm_weighted_unified | Trial 92 | outer=3 | alpha=3.311e+05 n_pcs=4000 (pc_topk) weight_search=on
2026-05-31 23:40:19 | INFO | src.nested_cv_avggrm_weighted_unified | Trial 92 | outer=3 | weight={'name': 'linear', 'floor': 1e-06, 'clip_max': 3.0, 'min_weight': 0.18969490052306265, 'max_weight': 4.237531881627816}
[I 2026-05-31 23:40:25,571] Trial 92 finished with value: 0.20486898832986097 and parameters: {'alpha': 331141.39133109385, 'n_pcs': 4000, 'weight_scheme': 'linear', 'weight_clip_max': 3.0, 'weight_linear_min_weight': 0.18969490052306265, 'weight_linear_max_weight': 4.237531881627816}. Best is trial 18 with value: 0.20714176623289293.
2026-05-31 23:40:25 | INFO | src.nested_cv_avggrm_weighted_unified | Trial 93 | outer=3 | alpha=2.063e+05 n_pcs=4000 (pc_topk) weight_search=on
2026-05-31 23:40:25 | INFO | src.nested_cv_avggrm_weighted_unified | Trial 93 | outer=3 | weight={'name': 'linear', 'floor': 1e-06, 'clip_max': 3.0, 'min_weight': 0.11346369462388894, 'max_weight': 3.9717479666385653}
[I 2026-05-31 23:40:31,242] Trial 93 finished with value: 0.20610816780221067 and parameters: {'alpha': 206261.6622694464, 'n_pcs': 4000, 'weight_scheme': 'linear', 'weight_clip_max': 3.0, 'weight_linear_min_weight': 0.11346369462388894, 'weight_linear_max_weight': 3.9717479666385653}. Best is trial 18 with value: 0.20714176623289293.
2026-05-31 23:40:31 | INFO | src.nested_cv_avggrm_weighted_unified | Trial 94 | outer=3 | alpha=1.992e+05 n_pcs=3500 (pc_topk) weight_search=on
2026-05-31 23:40:31 | INFO | src.nested_cv_avggrm_weighted_unified | Trial 94 | outer=3 | weight={'name': 'linear', 'floor': 1e-06, 'clip_max': 3.0, 'min_weight': 0.1402082682356231, 'max_weight': 3.9761935082560522}
2026-05-31 23:40:34 | INFO | src.nested_cv_avggrm_weighted_unified | Trial 94 | outer=3 | pruned after 6/10 inner folds (mean r=0.2204)
[I 2026-05-31 23:40:34,139] Trial 94 pruned. 
2026-05-31 23:40:34 | INFO | src.nested_cv_avggrm_weighted_unified | Trial 95 | outer=3 | alpha=3.804e+05 n_pcs=4000 (pc_topk) weight_search=on
2026-05-31 23:40:34 | INFO | src.nested_cv_avggrm_weighted_unified | Trial 95 | outer=3 | weight={'name': 'linear', 'floor': 1e-06, 'clip_max': 3.0, 'min_weight': 0.17647772650419985, 'max_weight': 4.401942700933948}
[I 2026-05-31 23:40:39,779] Trial 95 finished with value: 0.20434343267854466 and parameters: {'alpha': 380354.9730655112, 'n_pcs': 4000, 'weight_scheme': 'linear', 'weight_clip_max': 3.0, 'weight_linear_min_weight': 0.17647772650419985, 'weight_linear_max_weight': 4.401942700933948}. Best is trial 18 with value: 0.20714176623289293.
2026-05-31 23:40:39 | INFO | src.nested_cv_avggrm_weighted_unified | Trial 96 | outer=3 | alpha=2.294e+05 n_pcs=2500 (pc_topk) weight_search=on
2026-05-31 23:40:39 | INFO | src.nested_cv_avggrm_weighted_unified | Trial 96 | outer=3 | weight={'name': 'linear', 'floor': 1e-06, 'clip_max': 3.0, 'min_weight': 0.09498030430772056, 'max_weight': 4.497993024208243}
[I 2026-05-31 23:40:42,723] Trial 96 finished with value: 0.20758995590173432 and parameters: {'alpha': 229426.9569308818, 'n_pcs': 2500, 'weight_scheme': 'linear', 'weight_clip_max': 3.0, 'weight_linear_min_weight': 0.09498030430772056, 'weight_linear_max_weight': 4.497993024208243}. Best is trial 96 with value: 0.20758995590173432.
2026-05-31 23:40:42 | INFO | src.nested_cv_avggrm_weighted_unified | OUTER 3 | new best trial 96 (mean inner r=0.2076) saved to outputs/final_results/e6_pc_ridge_avggrm/thr_wing/e6_pc_ridge_avggrm_thr_wing_best_trials/split_03_best_trial.json
2026-05-31 23:40:42 | INFO | src.nested_cv_avggrm_weighted_unified | Trial 97 | outer=3 | alpha=2.841e+05 n_pcs=2500 (pc_topk) weight_search=on
2026-05-31 23:40:42 | INFO | src.nested_cv_avggrm_weighted_unified | Trial 97 | outer=3 | weight={'name': 'linear', 'floor': 1e-06, 'clip_max': 3.0, 'min_weight': 0.08960232764971778, 'max_weight': 4.6739272050788445}
