[I 2026-05-31 23:12:59,707] Trial 45 pruned. 
2026-05-31 23:12:59 | INFO | src.nested_cv_avggrm_weighted_unified | Trial 46 | outer=2 | alpha=1.486e+06 n_pcs=1500 (pc_topk) weight_search=on
2026-05-31 23:12:59 | INFO | src.nested_cv_avggrm_weighted_unified | Trial 46 | outer=2 | weight={'name': 'exponential', 'floor': 1e-06, 'clip_max': 5.0, 'beta': 8.435773483102363}
[I 2026-05-31 23:13:01,973] Trial 46 finished with value: 0.24148978394817927 and parameters: {'alpha': 1485533.9646883453, 'n_pcs': 1500, 'weight_scheme': 'exponential', 'weight_clip_max': 5.0, 'weight_exponential_beta': 8.435773483102363}. Best is trial 32 with value: 0.24612842367059637.
2026-05-31 23:13:01 | INFO | src.nested_cv_avggrm_weighted_unified | Trial 47 | outer=2 | alpha=4.258e+03 n_pcs=2000 (pc_topk) weight_search=on
2026-05-31 23:13:01 | INFO | src.nested_cv_avggrm_weighted_unified | Trial 47 | outer=2 | weight={'name': 'exponential', 'floor': 1e-06, 'clip_max': 5.0, 'beta': 5.526342701721469}
2026-05-31 23:13:03 | INFO | src.nested_cv_avggrm_weighted_unified | Trial 47 | outer=2 | pruned after 5/10 inner folds (mean r=0.1367)
[I 2026-05-31 23:13:03,112] Trial 47 pruned. 
2026-05-31 23:13:03 | INFO | src.nested_cv_avggrm_weighted_unified | Trial 48 | outer=2 | alpha=1.474e+05 n_pcs=2500 (pc_topk) weight_search=on
2026-05-31 23:13:03 | INFO | src.nested_cv_avggrm_weighted_unified | Trial 48 | outer=2 | weight={'name': 'linear', 'floor': 1e-06, 'clip_max': 5.0, 'min_weight': 0.9319951414732137, 'max_weight': 2.5104053264157646}
2026-05-31 23:13:05 | INFO | src.nested_cv_avggrm_weighted_unified | Trial 48 | outer=2 | pruned after 7/10 inner folds (mean r=0.2688)
[I 2026-05-31 23:13:05,239] Trial 48 pruned. 
2026-05-31 23:13:05 | INFO | src.nested_cv_avggrm_weighted_unified | Trial 49 | outer=2 | alpha=3.398e+05 n_pcs=3000 (pc_topk) weight_search=on
2026-05-31 23:13:05 | INFO | src.nested_cv_avggrm_weighted_unified | Trial 49 | outer=2 | weight={'name': 'uniform', 'floor': 1e-06, 'clip_max': 5.0}
2026-05-31 23:13:07 | INFO | src.nested_cv_avggrm_weighted_unified | Trial 49 | outer=2 | pruned after 6/10 inner folds (mean r=0.2355)
[I 2026-05-31 23:13:07,172] Trial 49 pruned. 
2026-05-31 23:13:07 | INFO | src.nested_cv_avggrm_weighted_unified | Trial 50 | outer=2 | alpha=6.585e+04 n_pcs=1500 (pc_topk) weight_search=on
2026-05-31 23:13:07 | INFO | src.nested_cv_avggrm_weighted_unified | Trial 50 | outer=2 | weight={'name': 'exponential', 'floor': 1e-06, 'clip_max': None, 'beta': 4.406788459971747}
2026-05-31 23:13:08 | INFO | src.nested_cv_avggrm_weighted_unified | Trial 50 | outer=2 | pruned after 6/10 inner folds (mean r=0.2121)
[I 2026-05-31 23:13:08,713] Trial 50 pruned. 
2026-05-31 23:13:08 | INFO | src.nested_cv_avggrm_weighted_unified | Trial 51 | outer=2 | alpha=5.491e+05 n_pcs=1500 (pc_topk) weight_search=on
2026-05-31 23:13:08 | INFO | src.nested_cv_avggrm_weighted_unified | Trial 51 | outer=2 | weight={'name': 'exponential', 'floor': 1e-06, 'clip_max': 5.0, 'beta': 5.909370944681475}
[I 2026-05-31 23:13:10,478] Trial 51 finished with value: 0.24444880843853162 and parameters: {'alpha': 549058.6525632736, 'n_pcs': 1500, 'weight_scheme': 'exponential', 'weight_clip_max': 5.0, 'weight_exponential_beta': 5.909370944681475}. Best is trial 32 with value: 0.24612842367059637.
2026-05-31 23:13:10 | INFO | src.nested_cv_avggrm_weighted_unified | Trial 52 | outer=2 | alpha=4.193e+05 n_pcs=1000 (pc_topk) weight_search=on
2026-05-31 23:13:10 | INFO | src.nested_cv_avggrm_weighted_unified | Trial 52 | outer=2 | weight={'name': 'exponential', 'floor': 1e-06, 'clip_max': 5.0, 'beta': 6.384826569139321}
[I 2026-05-31 23:13:11,912] Trial 52 finished with value: 0.24431252683376975 and parameters: {'alpha': 419280.00170860224, 'n_pcs': 1000, 'weight_scheme': 'exponential', 'weight_clip_max': 5.0, 'weight_exponential_beta': 6.384826569139321}. Best is trial 32 with value: 0.24612842367059637.
2026-05-31 23:13:11 | INFO | src.nested_cv_avggrm_weighted_unified | Trial 53 | outer=2 | alpha=2.560e+05 n_pcs=2000 (pc_topk) weight_search=on
2026-05-31 23:13:11 | INFO | src.nested_cv_avggrm_weighted_unified | Trial 53 | outer=2 | weight={'name': 'exponential', 'floor': 1e-06, 'clip_max': 5.0, 'beta': 6.842779170592984}
[I 2026-05-31 23:13:14,836] Trial 53 finished with value: 0.24527161743974973 and parameters: {'alpha': 256007.02721020803, 'n_pcs': 2000, 'weight_scheme': 'exponential', 'weight_clip_max': 5.0, 'weight_exponential_beta': 6.842779170592984}. Best is trial 32 with value: 0.24612842367059637.
2026-05-31 23:13:14 | INFO | src.nested_cv_avggrm_weighted_unified | Trial 54 | outer=2 | alpha=2.494e+05 n_pcs=2000 (pc_topk) weight_search=on
2026-05-31 23:13:14 | INFO | src.nested_cv_avggrm_weighted_unified | Trial 54 | outer=2 | weight={'name': 'exponential', 'floor': 1e-06, 'clip_max': 5.0, 'beta': 7.296175919115323}
[I 2026-05-31 23:13:17,069] Trial 54 finished with value: 0.24476555903370717 and parameters: {'alpha': 249420.58903594682, 'n_pcs': 2000, 'weight_scheme': 'exponential', 'weight_clip_max': 5.0, 'weight_exponential_beta': 7.296175919115323}. Best is trial 32 with value: 0.24612842367059637.
2026-05-31 23:13:17 | INFO | src.nested_cv_avggrm_weighted_unified | Trial 55 | outer=2 | alpha=8.753e+05 n_pcs=2000 (pc_topk) weight_search=on
2026-05-31 23:13:17 | INFO | src.nested_cv_avggrm_weighted_unified | Trial 55 | outer=2 | weight={'name': 'exponential', 'floor': 1e-06, 'clip_max': 5.0, 'beta': 6.635432096921071}
[I 2026-05-31 23:13:19,298] Trial 55 finished with value: 0.24418083586532235 and parameters: {'alpha': 875284.1169407043, 'n_pcs': 2000, 'weight_scheme': 'exponential', 'weight_clip_max': 5.0, 'weight_exponential_beta': 6.635432096921071}. Best is trial 32 with value: 0.24612842367059637.
2026-05-31 23:13:19 | INFO | src.nested_cv_avggrm_weighted_unified | Trial 56 | outer=2 | alpha=4.397e+04 n_pcs=2500 (pc_topk) weight_search=on
2026-05-31 23:13:19 | INFO | src.nested_cv_avggrm_weighted_unified | Trial 56 | outer=2 | weight={'name': 'exponential', 'floor': 1e-06, 'clip_max': 3.0, 'beta': 9.323866042704832}
2026-05-31 23:13:21 | INFO | src.nested_cv_avggrm_weighted_unified | Trial 56 | outer=2 | pruned after 7/10 inner folds (mean r=0.2436)
[I 2026-05-31 23:13:21,420] Trial 56 pruned. 
2026-05-31 23:13:21 | INFO | src.nested_cv_avggrm_weighted_unified | Trial 57 | outer=2 | alpha=5.819e+05 n_pcs=1500 (pc_topk) weight_search=on
2026-05-31 23:13:21 | INFO | src.nested_cv_avggrm_weighted_unified | Trial 57 | outer=2 | weight={'name': 'exponential', 'floor': 1e-06, 'clip_max': 5.0, 'beta': 5.84614513766276}
[I 2026-05-31 23:13:23,118] Trial 57 finished with value: 0.24426284210897364 and parameters: {'alpha': 581855.8299360768, 'n_pcs': 1500, 'weight_scheme': 'exponential', 'weight_clip_max': 5.0, 'weight_exponential_beta': 5.84614513766276}. Best is trial 32 with value: 0.24612842367059637.
2026-05-31 23:13:23 | INFO | src.nested_cv_avggrm_weighted_unified | Trial 58 | outer=2 | alpha=3.315e+05 n_pcs=2000 (pc_topk) weight_search=on
2026-05-31 23:13:23 | INFO | src.nested_cv_avggrm_weighted_unified | Trial 58 | outer=2 | weight={'name': 'linear', 'floor': 1e-06, 'clip_max': 10.0, 'min_weight': 0.3061931014019099, 'max_weight': 1.0127281197324869}
2026-05-31 23:13:24 | INFO | src.nested_cv_avggrm_weighted_unified | Trial 58 | outer=2 | pruned after 7/10 inner folds (mean r=0.2676)
[I 2026-05-31 23:13:24,706] Trial 58 pruned. 
2026-05-31 23:13:24 | INFO | src.nested_cv_avggrm_weighted_unified | Trial 59 | outer=2 | alpha=1.604e+05 n_pcs=1000 (pc_topk) weight_search=on
2026-05-31 23:13:24 | INFO | src.nested_cv_avggrm_weighted_unified | Trial 59 | outer=2 | weight={'name': 'exponential', 'floor': 1e-06, 'clip_max': 5.0, 'beta': 8.184270411536575}
[I 2026-05-31 23:13:26,436] Trial 59 finished with value: 0.2385699213081363 and parameters: {'alpha': 160412.74909614644, 'n_pcs': 1000, 'weight_scheme': 'exponential', 'weight_clip_max': 5.0, 'weight_exponential_beta': 8.184270411536575}. Best is trial 32 with value: 0.24612842367059637.
2026-05-31 23:13:26 | INFO | src.nested_cv_avggrm_weighted_unified | Trial 60 | outer=2 | alpha=6.479e+05 n_pcs=3500 (pc_topk) weight_search=on
2026-05-31 23:13:26 | INFO | src.nested_cv_avggrm_weighted_unified | Trial 60 | outer=2 | weight={'name': 'uniform', 'floor': 1e-06, 'clip_max': 20.0}
2026-05-31 23:13:29 | INFO | src.nested_cv_avggrm_weighted_unified | Trial 60 | outer=2 | pruned after 6/10 inner folds (mean r=0.2329)
[I 2026-05-31 23:13:29,451] Trial 60 pruned. 
2026-05-31 23:13:29 | INFO | src.nested_cv_avggrm_weighted_unified | Trial 61 | outer=2 | alpha=3.542e+05 n_pcs=1500 (pc_topk) weight_search=on
2026-05-31 23:13:29 | INFO | src.nested_cv_avggrm_weighted_unified | Trial 61 | outer=2 | weight={'name': 'exponential', 'floor': 1e-06, 'clip_max': 5.0, 'beta': 5.426284966494179}
[I 2026-05-31 23:13:31,296] Trial 61 finished with value: 0.24422639102220672 and parameters: {'alpha': 354201.5558923526, 'n_pcs': 1500, 'weight_scheme': 'exponential', 'weight_clip_max': 5.0, 'weight_exponential_beta': 5.426284966494179}. Best is trial 32 with value: 0.24612842367059637.
2026-05-31 23:13:31 | INFO | src.nested_cv_avggrm_weighted_unified | Trial 62 | outer=2 | alpha=2.459e+05 n_pcs=1500 (pc_topk) weight_search=on
2026-05-31 23:13:31 | INFO | src.nested_cv_avggrm_weighted_unified | Trial 62 | outer=2 | weight={'name': 'exponential', 'floor': 1e-06, 'clip_max': 5.0, 'beta': 0.25626807133970786}
2026-05-31 23:13:32 | INFO | src.nested_cv_avggrm_weighted_unified | Trial 62 | outer=2 | pruned after 6/10 inner folds (mean r=0.2300)
[I 2026-05-31 23:13:32,347] Trial 62 pruned. 
2026-05-31 23:13:32 | INFO | src.nested_cv_avggrm_weighted_unified | Trial 63 | outer=2 | alpha=1.096e+06 n_pcs=2000 (pc_topk) weight_search=on
2026-05-31 23:13:32 | INFO | src.nested_cv_avggrm_weighted_unified | Trial 63 | outer=2 | weight={'name': 'exponential', 'floor': 1e-06, 'clip_max': 5.0, 'beta': 6.07210273012603}
[I 2026-05-31 23:13:34,583] Trial 63 finished with value: 0.2428268812400757 and parameters: {'alpha': 1095729.051337854, 'n_pcs': 2000, 'weight_scheme': 'exponential', 'weight_clip_max': 5.0, 'weight_exponential_beta': 6.07210273012603}. Best is trial 32 with value: 0.24612842367059637.
2026-05-31 23:13:34 | INFO | src.nested_cv_avggrm_weighted_unified | Trial 64 | outer=2 | alpha=4.426e+05 n_pcs=1500 (pc_topk) weight_search=on
2026-05-31 23:13:34 | INFO | src.nested_cv_avggrm_weighted_unified | Trial 64 | outer=2 | weight={'name': 'exponential', 'floor': 1e-06, 'clip_max': 5.0, 'beta': 1.7464865927646516}
2026-05-31 23:13:35 | INFO | src.nested_cv_avggrm_weighted_unified | Trial 64 | outer=2 | pruned after 7/10 inner folds (mean r=0.2684)
[I 2026-05-31 23:13:35,806] Trial 64 pruned. 
2026-05-31 23:13:35 | INFO | src.nested_cv_avggrm_weighted_unified | Trial 65 | outer=2 | alpha=1.005e+05 n_pcs=500 (pc_topk) weight_search=on
2026-05-31 23:13:35 | INFO | src.nested_cv_avggrm_weighted_unified | Trial 65 | outer=2 | weight={'name': 'exponential', 'floor': 1e-06, 'clip_max': 5.0, 'beta': 6.944130757828222}
2026-05-31 23:13:36 | INFO | src.nested_cv_avggrm_weighted_unified | Trial 65 | outer=2 | pruned after 5/10 inner folds (mean r=0.1698)
[I 2026-05-31 23:13:36,300] Trial 65 pruned. 
2026-05-31 23:13:36 | INFO | src.nested_cv_avggrm_weighted_unified | Trial 66 | outer=2 | alpha=7.793e+05 n_pcs=2000 (pc_topk) weight_search=on
2026-05-31 23:13:36 | INFO | src.nested_cv_avggrm_weighted_unified | Trial 66 | outer=2 | weight={'name': 'exponential', 'floor': 1e-06, 'clip_max': 5.0, 'beta': 6.994122159016082}
[I 2026-05-31 23:13:39,233] Trial 66 finished with value: 0.2447390105064707 and parameters: {'alpha': 779336.1198044688, 'n_pcs': 2000, 'weight_scheme': 'exponential', 'weight_clip_max': 5.0, 'weight_exponential_beta': 6.994122159016082}. Best is trial 32 with value: 0.24612842367059637.
2026-05-31 23:13:39 | INFO | src.nested_cv_avggrm_weighted_unified | Trial 67 | outer=2 | alpha=1.865e+06 n_pcs=1000 (pc_topk) weight_search=on
2026-05-31 23:13:39 | INFO | src.nested_cv_avggrm_weighted_unified | Trial 67 | outer=2 | weight={'name': 'exponential', 'floor': 1e-06, 'clip_max': 5.0, 'beta': 4.909826538397771}
2026-05-31 23:13:40 | INFO | src.nested_cv_avggrm_weighted_unified | Trial 67 | outer=2 | pruned after 7/10 inner folds (mean r=0.2749)
[I 2026-05-31 23:13:40,259] Trial 67 pruned. 
2026-05-31 23:13:40 | INFO | src.nested_cv_avggrm_weighted_unified | Trial 68 | outer=2 | alpha=2.338e+05 n_pcs=2500 (pc_topk) weight_search=on
2026-05-31 23:13:40 | INFO | src.nested_cv_avggrm_weighted_unified | Trial 68 | outer=2 | weight={'name': 'exponential', 'floor': 1e-06, 'clip_max': None, 'beta': 7.43940855305918}
2026-05-31 23:13:42 | INFO | src.nested_cv_avggrm_weighted_unified | Trial 68 | outer=2 | pruned after 6/10 inner folds (mean r=0.2136)
[I 2026-05-31 23:13:42,179] Trial 68 pruned. 
2026-05-31 23:13:42 | INFO | src.nested_cv_avggrm_weighted_unified | Trial 69 | outer=2 | alpha=1.326e+05 n_pcs=1500 (pc_topk) weight_search=on
2026-05-31 23:13:42 | INFO | src.nested_cv_avggrm_weighted_unified | Trial 69 | outer=2 | weight={'name': 'uniform', 'floor': 1e-06, 'clip_max': 5.0}
2026-05-31 23:13:43 | INFO | src.nested_cv_avggrm_weighted_unified | Trial 69 | outer=2 | pruned after 6/10 inner folds (mean r=0.2236)
[I 2026-05-31 23:13:43,205] Trial 69 pruned. 
2026-05-31 23:13:43 | INFO | src.nested_cv_avggrm_weighted_unified | Trial 70 | outer=2 | alpha=5.235e+05 n_pcs=2000 (pc_topk) weight_search=on
2026-05-31 23:13:43 | INFO | src.nested_cv_avggrm_weighted_unified | Trial 70 | outer=2 | weight={'name': 'exponential', 'floor': 1e-06, 'clip_max': 10.0, 'beta': 6.210970522753309}
2026-05-31 23:13:44 | INFO | src.nested_cv_avggrm_weighted_unified | Trial 70 | outer=2 | pruned after 7/10 inner folds (mean r=0.2705)
[I 2026-05-31 23:13:44,801] Trial 70 pruned. 
2026-05-31 23:13:44 | INFO | src.nested_cv_avggrm_weighted_unified | Trial 71 | outer=2 | alpha=2.704e+05 n_pcs=2000 (pc_topk) weight_search=on
2026-05-31 23:13:44 | INFO | src.nested_cv_avggrm_weighted_unified | Trial 71 | outer=2 | weight={'name': 'exponential', 'floor': 1e-06, 'clip_max': 5.0, 'beta': 7.307078472849531}
[I 2026-05-31 23:13:47,034] Trial 71 finished with value: 0.24508299155418403 and parameters: {'alpha': 270449.53786566574, 'n_pcs': 2000, 'weight_scheme': 'exponential', 'weight_clip_max': 5.0, 'weight_exponential_beta': 7.307078472849531}. Best is trial 32 with value: 0.24612842367059637.
2026-05-31 23:13:47 | INFO | src.nested_cv_avggrm_weighted_unified | Trial 72 | outer=2 | alpha=3.030e+05 n_pcs=2500 (pc_topk) weight_search=on
2026-05-31 23:13:47 | INFO | src.nested_cv_avggrm_weighted_unified | Trial 72 | outer=2 | weight={'name': 'exponential', 'floor': 1e-06, 'clip_max': 5.0, 'beta': 6.756492377635029}
[I 2026-05-31 23:13:50,034] Trial 72 finished with value: 0.24443884032231278 and parameters: {'alpha': 302984.9231875197, 'n_pcs': 2500, 'weight_scheme': 'exponential', 'weight_clip_max': 5.0, 'weight_exponential_beta': 6.756492377635029}. Best is trial 32 with value: 0.24612842367059637.
2026-05-31 23:13:50 | INFO | src.nested_cv_avggrm_weighted_unified | Trial 73 | outer=2 | alpha=1.724e+05 n_pcs=2000 (pc_topk) weight_search=on
2026-05-31 23:13:50 | INFO | src.nested_cv_avggrm_weighted_unified | Trial 73 | outer=2 | weight={'name': 'exponential', 'floor': 1e-06, 'clip_max': 5.0, 'beta': 5.683552497045537}
[I 2026-05-31 23:13:52,271] Trial 73 finished with value: 0.24382016251298796 and parameters: {'alpha': 172371.7958519033, 'n_pcs': 2000, 'weight_scheme': 'exponential', 'weight_clip_max': 5.0, 'weight_exponential_beta': 5.683552497045537}. Best is trial 32 with value: 0.24612842367059637.
2026-05-31 23:13:52 | INFO | src.nested_cv_avggrm_weighted_unified | Trial 74 | outer=2 | alpha=9.112e+05 n_pcs=1500 (pc_topk) weight_search=on
2026-05-31 23:13:52 | INFO | src.nested_cv_avggrm_weighted_unified | Trial 74 | outer=2 | weight={'name': 'exponential', 'floor': 1e-06, 'clip_max': 5.0, 'beta': 7.329093391479159}
[I 2026-05-31 23:13:53,985] Trial 74 finished with value: 0.24372657582559346 and parameters: {'alpha': 911153.5021412839, 'n_pcs': 1500, 'weight_scheme': 'exponential', 'weight_clip_max': 5.0, 'weight_exponential_beta': 7.329093391479159}. Best is trial 32 with value: 0.24612842367059637.
2026-05-31 23:13:53 | INFO | src.nested_cv_avggrm_weighted_unified | Trial 75 | outer=2 | alpha=4.019e+05 n_pcs=2000 (pc_topk) weight_search=on
2026-05-31 23:13:53 | INFO | src.nested_cv_avggrm_weighted_unified | Trial 75 | outer=2 | weight={'name': 'exponential', 'floor': 1e-06, 'clip_max': 5.0, 'beta': 7.682997677531334}
[I 2026-05-31 23:13:56,218] Trial 75 finished with value: 0.24558639028638268 and parameters: {'alpha': 401945.5367191865, 'n_pcs': 2000, 'weight_scheme': 'exponential', 'weight_clip_max': 5.0, 'weight_exponential_beta': 7.682997677531334}. Best is trial 32 with value: 0.24612842367059637.
2026-05-31 23:13:56 | INFO | src.nested_cv_avggrm_weighted_unified | Trial 76 | outer=2 | alpha=6.191e+05 n_pcs=2000 (pc_topk) weight_search=on
2026-05-31 23:13:56 | INFO | src.nested_cv_avggrm_weighted_unified | Trial 76 | outer=2 | weight={'name': 'exponential', 'floor': 1e-06, 'clip_max': 3.0, 'beta': 7.695224844462513}
[I 2026-05-31 23:13:58,462] Trial 76 finished with value: 0.24622959230035635 and parameters: {'alpha': 619092.3439798318, 'n_pcs': 2000, 'weight_scheme': 'exponential', 'weight_clip_max': 3.0, 'weight_exponential_beta': 7.695224844462513}. Best is trial 76 with value: 0.24622959230035635.
2026-05-31 23:13:58 | INFO | src.nested_cv_avggrm_weighted_unified | OUTER 2 | new best trial 76 (mean inner r=0.2462) saved to outputs/final_results/e6_pc_ridge_avggrm/thr_wing/e6_pc_ridge_avggrm_thr_wing_best_trials/split_02_best_trial.json
2026-05-31 23:13:58 | INFO | src.nested_cv_avggrm_weighted_unified | Trial 77 | outer=2 | alpha=2.396e+06 n_pcs=2500 (pc_topk) weight_search=on
2026-05-31 23:13:58 | INFO | src.nested_cv_avggrm_weighted_unified | Trial 77 | outer=2 | weight={'name': 'exponential', 'floor': 1e-06, 'clip_max': 20.0, 'beta': 8.967172499292344}
2026-05-31 23:14:01 | INFO | src.nested_cv_avggrm_weighted_unified | Trial 77 | outer=2 | pruned after 6/10 inner folds (mean r=0.2302)
[I 2026-05-31 23:14:01,047] Trial 77 pruned. 
2026-05-31 23:14:01 | INFO | src.nested_cv_avggrm_weighted_unified | Trial 78 | outer=2 | alpha=1.366e+06 n_pcs=2000 (pc_topk) weight_search=on
2026-05-31 23:14:01 | INFO | src.nested_cv_avggrm_weighted_unified | Trial 78 | outer=2 | weight={'name': 'exponential', 'floor': 1e-06, 'clip_max': 3.0, 'beta': 7.742333404222149}
[I 2026-05-31 23:14:03,280] Trial 78 finished with value: 0.24244295109385372 and parameters: {'alpha': 1365841.5756619046, 'n_pcs': 2000, 'weight_scheme': 'exponential', 'weight_clip_max': 3.0, 'weight_exponential_beta': 7.742333404222149}. Best is trial 76 with value: 0.24622959230035635.
2026-05-31 23:14:03 | INFO | src.nested_cv_avggrm_weighted_unified | Trial 79 | outer=2 | alpha=6.947e+05 n_pcs=2000 (pc_topk) weight_search=on
2026-05-31 23:14:03 | INFO | src.nested_cv_avggrm_weighted_unified | Trial 79 | outer=2 | weight={'name': 'linear', 'floor': 1e-06, 'clip_max': 3.0, 'min_weight': 0.5976759914500844, 'max_weight': 3.89069076097435}
2026-05-31 23:14:04 | INFO | src.nested_cv_avggrm_weighted_unified | Trial 79 | outer=2 | pruned after 7/10 inner folds (mean r=0.2704)
[I 2026-05-31 23:14:04,861] Trial 79 pruned. 
2026-05-31 23:14:04 | INFO | src.nested_cv_avggrm_weighted_unified | Trial 80 | outer=2 | alpha=2.786e+05 n_pcs=3000 (pc_topk) weight_search=on
2026-05-31 23:14:04 | INFO | src.nested_cv_avggrm_weighted_unified | Trial 80 | outer=2 | weight={'name': 'exponential', 'floor': 1e-06, 'clip_max': 3.0, 'beta': 7.779084688972167}
[I 2026-05-31 23:14:08,711] Trial 80 finished with value: 0.24730155358415104 and parameters: {'alpha': 278612.54666367447, 'n_pcs': 3000, 'weight_scheme': 'exponential', 'weight_clip_max': 3.0, 'weight_exponential_beta': 7.779084688972167}. Best is trial 80 with value: 0.24730155358415104.
2026-05-31 23:14:08 | INFO | src.nested_cv_avggrm_weighted_unified | OUTER 2 | new best trial 80 (mean inner r=0.2473) saved to outputs/final_results/e6_pc_ridge_avggrm/thr_wing/e6_pc_ridge_avggrm_thr_wing_best_trials/split_02_best_trial.json
2026-05-31 23:14:08 | INFO | src.nested_cv_avggrm_weighted_unified | Trial 81 | outer=2 | alpha=3.789e+05 n_pcs=3000 (pc_topk) weight_search=on
2026-05-31 23:14:08 | INFO | src.nested_cv_avggrm_weighted_unified | Trial 81 | outer=2 | weight={'name': 'exponential', 'floor': 1e-06, 'clip_max': 3.0, 'beta': 8.264504437747519}
[I 2026-05-31 23:14:13,190] Trial 81 finished with value: 0.2477455676488017 and parameters: {'alpha': 378915.6604539449, 'n_pcs': 3000, 'weight_scheme': 'exponential', 'weight_clip_max': 3.0, 'weight_exponential_beta': 8.264504437747519}. Best is trial 81 with value: 0.2477455676488017.
2026-05-31 23:14:13 | INFO | src.nested_cv_avggrm_weighted_unified | OUTER 2 | new best trial 81 (mean inner r=0.2477) saved to outputs/final_results/e6_pc_ridge_avggrm/thr_wing/e6_pc_ridge_avggrm_thr_wing_best_trials/split_02_best_trial.json
2026-05-31 23:14:13 | INFO | src.nested_cv_avggrm_weighted_unified | Trial 82 | outer=2 | alpha=4.360e+05 n_pcs=3000 (pc_topk) weight_search=on
2026-05-31 23:14:13 | INFO | src.nested_cv_avggrm_weighted_unified | Trial 82 | outer=2 | weight={'name': 'exponential', 'floor': 1e-06, 'clip_max': 3.0, 'beta': 8.225873840851554}
