[I 2026-06-01 22:35:21,401] Trial 78 finished with value: 0.22089134524605206 and parameters: {'alpha': 35460.187217074956, 'n_pcs': 4000, 'iw_method': 'pc_logistic', 'iw_clip_max': 2.5, 'iw_prob_clip': 0.02094979025973624, 'iw_n_components': 100, 'iw_logistic_c': 0.0454720566204609, 'iw_pca_fit': 'combined', 'iw_solver': 'lbfgs', 'iw_rho': 0.7}. Best is trial 67 with value: 0.22329059589719744.
2026-06-01 22:35:21 | INFO | Trial 79 | outer=8 | alpha=3.085e+04 n_pcs=4000 (pc_topk) weight={'name': 'pc_logistic', 'floor': 1e-06, 'clip_max': 2.5, 'prob_clip': 0.021921510891024686, 'n_components': 100, 'logistic_c': 0.08780028654607529, 'pca_fit': 'combined', 'solver': 'lbfgs', 'max_iter': 2000, 'fit_intercept': True, 'standardize_with_source': True, 'rho': 0.7}
[I 2026-06-01 22:35:46,012] Trial 79 finished with value: 0.22022445163994203 and parameters: {'alpha': 30851.27782668305, 'n_pcs': 4000, 'iw_method': 'pc_logistic', 'iw_clip_max': 2.5, 'iw_prob_clip': 0.021921510891024686, 'iw_n_components': 100, 'iw_logistic_c': 0.08780028654607529, 'iw_pca_fit': 'combined', 'iw_solver': 'lbfgs', 'iw_rho': 0.7}. Best is trial 67 with value: 0.22329059589719744.
2026-06-01 22:35:46 | INFO | Trial 80 | outer=8 | alpha=6.999e+03 n_pcs=4500 (pc_topk) weight={'name': 'pc_logistic', 'floor': 1e-06, 'clip_max': 2.5, 'prob_clip': 0.020363426417387004, 'n_components': 100, 'logistic_c': 0.06621197961008497, 'pca_fit': 'combined', 'solver': 'lbfgs', 'max_iter': 2000, 'fit_intercept': True, 'standardize_with_source': True, 'rho': 0.7}
[I 2026-06-01 22:36:12,011] Trial 80 finished with value: 0.2044769925178942 and parameters: {'alpha': 6998.939726950211, 'n_pcs': 4500, 'iw_method': 'pc_logistic', 'iw_clip_max': 2.5, 'iw_prob_clip': 0.020363426417387004, 'iw_n_components': 100, 'iw_logistic_c': 0.06621197961008497, 'iw_pca_fit': 'combined', 'iw_solver': 'lbfgs', 'iw_rho': 0.7}. Best is trial 67 with value: 0.22329059589719744.
2026-06-01 22:36:12 | INFO | Trial 81 | outer=8 | alpha=4.028e+04 n_pcs=4000 (pc_topk) weight={'name': 'pc_logistic', 'floor': 1e-06, 'clip_max': 2.5, 'prob_clip': 0.027720629403799858, 'n_components': 100, 'logistic_c': 0.0031057210778466997, 'pca_fit': 'combined', 'solver': 'lbfgs', 'max_iter': 2000, 'fit_intercept': True, 'standardize_with_source': True, 'rho': 0.7}
[I 2026-06-01 22:36:32,627] Trial 81 finished with value: 0.22046194360364363 and parameters: {'alpha': 40281.66683426001, 'n_pcs': 4000, 'iw_method': 'pc_logistic', 'iw_clip_max': 2.5, 'iw_prob_clip': 0.027720629403799858, 'iw_n_components': 100, 'iw_logistic_c': 0.0031057210778466997, 'iw_pca_fit': 'combined', 'iw_solver': 'lbfgs', 'iw_rho': 0.7}. Best is trial 67 with value: 0.22329059589719744.
2026-06-01 22:36:32 | INFO | Trial 82 | outer=8 | alpha=2.346e+04 n_pcs=4500 (pc_topk) weight={'name': 'pc_logistic', 'floor': 1e-06, 'clip_max': 2.5, 'prob_clip': 0.015375571499306686, 'n_components': 100, 'logistic_c': 0.00048176116872495126, 'pca_fit': 'combined', 'solver': 'lbfgs', 'max_iter': 2000, 'fit_intercept': True, 'standardize_with_source': True, 'rho': 0.7}
[I 2026-06-01 22:36:50,185] Trial 82 finished with value: 0.22131930410581974 and parameters: {'alpha': 23464.46246712512, 'n_pcs': 4500, 'iw_method': 'pc_logistic', 'iw_clip_max': 2.5, 'iw_prob_clip': 0.015375571499306686, 'iw_n_components': 100, 'iw_logistic_c': 0.00048176116872495126, 'iw_pca_fit': 'combined', 'iw_solver': 'lbfgs', 'iw_rho': 0.7}. Best is trial 67 with value: 0.22329059589719744.
2026-06-01 22:36:50 | INFO | Trial 83 | outer=8 | alpha=2.431e+04 n_pcs=4500 (pc_topk) weight={'name': 'pc_logistic', 'floor': 1e-06, 'clip_max': 2.5, 'prob_clip': 0.0391557197255089, 'n_components': 100, 'logistic_c': 0.000526943704588665, 'pca_fit': 'combined', 'solver': 'lbfgs', 'max_iter': 2000, 'fit_intercept': True, 'standardize_with_source': True, 'rho': 0.7}
[I 2026-06-01 22:37:08,620] Trial 83 finished with value: 0.22160928942979402 and parameters: {'alpha': 24306.715549960954, 'n_pcs': 4500, 'iw_method': 'pc_logistic', 'iw_clip_max': 2.5, 'iw_prob_clip': 0.0391557197255089, 'iw_n_components': 100, 'iw_logistic_c': 0.000526943704588665, 'iw_pca_fit': 'combined', 'iw_solver': 'lbfgs', 'iw_rho': 0.7}. Best is trial 67 with value: 0.22329059589719744.
2026-06-01 22:37:08 | INFO | Trial 84 | outer=8 | alpha=2.485e+04 n_pcs=4500 (pc_topk) weight={'name': 'pc_logistic', 'floor': 1e-06, 'clip_max': 2.5, 'prob_clip': 0.036875744233312774, 'n_components': 100, 'logistic_c': 0.0004848937380212359, 'pca_fit': 'combined', 'solver': 'lbfgs', 'max_iter': 2000, 'fit_intercept': True, 'standardize_with_source': True, 'rho': 0.7}
[I 2026-06-01 22:37:26,402] Trial 84 finished with value: 0.22194029537187498 and parameters: {'alpha': 24850.081318424865, 'n_pcs': 4500, 'iw_method': 'pc_logistic', 'iw_clip_max': 2.5, 'iw_prob_clip': 0.036875744233312774, 'iw_n_components': 100, 'iw_logistic_c': 0.0004848937380212359, 'iw_pca_fit': 'combined', 'iw_solver': 'lbfgs', 'iw_rho': 0.7}. Best is trial 67 with value: 0.22329059589719744.
2026-06-01 22:37:26 | INFO | Trial 85 | outer=8 | alpha=1.585e+04 n_pcs=4500 (pc_topk) weight={'name': 'pc_logistic', 'floor': 1e-06, 'clip_max': 2.5, 'prob_clip': 0.04048869812376259, 'n_components': 100, 'logistic_c': 0.0005066564267224513, 'pca_fit': 'combined', 'solver': 'lbfgs', 'max_iter': 2000, 'fit_intercept': True, 'standardize_with_source': True, 'rho': 0.7}
[I 2026-06-01 22:37:43,632] Trial 85 finished with value: 0.2178833504393686 and parameters: {'alpha': 15846.776480782677, 'n_pcs': 4500, 'iw_method': 'pc_logistic', 'iw_clip_max': 2.5, 'iw_prob_clip': 0.04048869812376259, 'iw_n_components': 100, 'iw_logistic_c': 0.0005066564267224513, 'iw_pca_fit': 'combined', 'iw_solver': 'lbfgs', 'iw_rho': 0.7}. Best is trial 67 with value: 0.22329059589719744.
2026-06-01 22:37:43 | INFO | Trial 86 | outer=8 | alpha=2.176e+04 n_pcs=4500 (pc_topk) weight={'name': 'pc_logistic', 'floor': 1e-06, 'clip_max': 2.5, 'prob_clip': 0.04110749560777983, 'n_components': 100, 'logistic_c': 0.00025739294253496566, 'pca_fit': 'combined', 'solver': 'lbfgs', 'max_iter': 2000, 'fit_intercept': True, 'standardize_with_source': True, 'rho': 0.7}
[I 2026-06-01 22:38:01,017] Trial 86 finished with value: 0.22123612205453053 and parameters: {'alpha': 21762.550002631477, 'n_pcs': 4500, 'iw_method': 'pc_logistic', 'iw_clip_max': 2.5, 'iw_prob_clip': 0.04110749560777983, 'iw_n_components': 100, 'iw_logistic_c': 0.00025739294253496566, 'iw_pca_fit': 'combined', 'iw_solver': 'lbfgs', 'iw_rho': 0.7}. Best is trial 67 with value: 0.22329059589719744.
2026-06-01 22:38:01 | INFO | Trial 87 | outer=8 | alpha=1.140e+04 n_pcs=4500 (pc_topk) weight={'name': 'pc_logistic', 'floor': 1e-06, 'clip_max': 2.5, 'prob_clip': 0.04252666048577908, 'n_components': 100, 'logistic_c': 0.0007661834365538895, 'pca_fit': 'combined', 'solver': 'lbfgs', 'max_iter': 2000, 'fit_intercept': True, 'standardize_with_source': True, 'rho': 0.7}
[I 2026-06-01 22:38:19,426] Trial 87 finished with value: 0.21325643236574318 and parameters: {'alpha': 11400.05185367657, 'n_pcs': 4500, 'iw_method': 'pc_logistic', 'iw_clip_max': 2.5, 'iw_prob_clip': 0.04252666048577908, 'iw_n_components': 100, 'iw_logistic_c': 0.0007661834365538895, 'iw_pca_fit': 'combined', 'iw_solver': 'lbfgs', 'iw_rho': 0.7}. Best is trial 67 with value: 0.22329059589719744.
2026-06-01 22:38:19 | INFO | Trial 88 | outer=8 | alpha=2.674e+04 n_pcs=4500 (pc_topk) weight={'name': 'pc_logistic', 'floor': 1e-06, 'clip_max': 2.5, 'prob_clip': 0.027217207703575382, 'n_components': 100, 'logistic_c': 0.00013596021362251426, 'pca_fit': 'combined', 'solver': 'lbfgs', 'max_iter': 2000, 'fit_intercept': True, 'standardize_with_source': True, 'rho': 0.7}
[I 2026-06-01 22:38:35,684] Trial 88 finished with value: 0.2238406669618031 and parameters: {'alpha': 26737.908198916404, 'n_pcs': 4500, 'iw_method': 'pc_logistic', 'iw_clip_max': 2.5, 'iw_prob_clip': 0.027217207703575382, 'iw_n_components': 100, 'iw_logistic_c': 0.00013596021362251426, 'iw_pca_fit': 'combined', 'iw_solver': 'lbfgs', 'iw_rho': 0.7}. Best is trial 88 with value: 0.2238406669618031.
2026-06-01 22:38:35 | INFO | Trial 89 | outer=8 | alpha=2.787e+04 n_pcs=4500 (pc_topk) weight={'name': 'uniform'}
[I 2026-06-01 22:38:44,355] Trial 89 finished with value: 0.21721830430847264 and parameters: {'alpha': 27874.831512547018, 'n_pcs': 4500, 'iw_method': 'uniform'}. Best is trial 88 with value: 0.2238406669618031.
2026-06-01 22:38:44 | INFO | Trial 90 | outer=8 | alpha=2.011e+04 n_pcs=4500 (pc_topk) weight={'name': 'pc_logistic', 'floor': 1e-06, 'clip_max': 2.5, 'prob_clip': 0.025148296623281063, 'n_components': 100, 'logistic_c': 0.00014294377594195734, 'pca_fit': 'combined', 'solver': 'lbfgs', 'max_iter': 2000, 'fit_intercept': True, 'standardize_with_source': True, 'rho': 0.7}
[I 2026-06-01 22:39:01,026] Trial 90 finished with value: 0.2216751014566824 and parameters: {'alpha': 20111.047450001857, 'n_pcs': 4500, 'iw_method': 'pc_logistic', 'iw_clip_max': 2.5, 'iw_prob_clip': 0.025148296623281063, 'iw_n_components': 100, 'iw_logistic_c': 0.00014294377594195734, 'iw_pca_fit': 'combined', 'iw_solver': 'lbfgs', 'iw_rho': 0.7}. Best is trial 88 with value: 0.2238406669618031.
2026-06-01 22:39:01 | INFO | Trial 91 | outer=8 | alpha=1.899e+04 n_pcs=4500 (pc_topk) weight={'name': 'pc_logistic', 'floor': 1e-06, 'clip_max': 2.5, 'prob_clip': 0.026151353098720485, 'n_components': 100, 'logistic_c': 0.00011036391649685748, 'pca_fit': 'combined', 'solver': 'lbfgs', 'max_iter': 2000, 'fit_intercept': True, 'standardize_with_source': True, 'rho': 0.7}
[I 2026-06-01 22:39:17,753] Trial 91 finished with value: 0.2211078880284607 and parameters: {'alpha': 18987.999522436105, 'n_pcs': 4500, 'iw_method': 'pc_logistic', 'iw_clip_max': 2.5, 'iw_prob_clip': 0.026151353098720485, 'iw_n_components': 100, 'iw_logistic_c': 0.00011036391649685748, 'iw_pca_fit': 'combined', 'iw_solver': 'lbfgs', 'iw_rho': 0.7}. Best is trial 88 with value: 0.2238406669618031.
2026-06-01 22:39:17 | INFO | Trial 92 | outer=8 | alpha=3.416e+04 n_pcs=4500 (pc_topk) weight={'name': 'pc_logistic', 'floor': 1e-06, 'clip_max': 2.5, 'prob_clip': 0.035308296849060575, 'n_components': 100, 'logistic_c': 0.00029818254691650457, 'pca_fit': 'combined', 'solver': 'lbfgs', 'max_iter': 2000, 'fit_intercept': True, 'standardize_with_source': True, 'rho': 0.7}
[I 2026-06-01 22:39:35,094] Trial 92 finished with value: 0.22386962853002085 and parameters: {'alpha': 34159.05500711439, 'n_pcs': 4500, 'iw_method': 'pc_logistic', 'iw_clip_max': 2.5, 'iw_prob_clip': 0.035308296849060575, 'iw_n_components': 100, 'iw_logistic_c': 0.00029818254691650457, 'iw_pca_fit': 'combined', 'iw_solver': 'lbfgs', 'iw_rho': 0.7}. Best is trial 92 with value: 0.22386962853002085.
2026-06-01 22:39:35 | INFO | Trial 93 | outer=8 | alpha=3.198e+04 n_pcs=4500 (pc_topk) weight={'name': 'pc_logistic', 'floor': 1e-06, 'clip_max': 2.5, 'prob_clip': 0.02698836797618905, 'n_components': 100, 'logistic_c': 0.00025813821189428547, 'pca_fit': 'combined', 'solver': 'lbfgs', 'max_iter': 2000, 'fit_intercept': True, 'standardize_with_source': True, 'rho': 0.3}
[I 2026-06-01 22:39:52,655] Trial 93 finished with value: 0.22250555276891557 and parameters: {'alpha': 31981.29254525375, 'n_pcs': 4500, 'iw_method': 'pc_logistic', 'iw_clip_max': 2.5, 'iw_prob_clip': 0.02698836797618905, 'iw_n_components': 100, 'iw_logistic_c': 0.00025813821189428547, 'iw_pca_fit': 'combined', 'iw_solver': 'lbfgs', 'iw_rho': 0.3}. Best is trial 92 with value: 0.22386962853002085.
2026-06-01 22:39:52 | INFO | Trial 94 | outer=8 | alpha=3.429e+04 n_pcs=4500 (pc_topk) weight={'name': 'pc_logistic', 'floor': 1e-06, 'clip_max': 2.5, 'prob_clip': 0.04815553880328289, 'n_components': 100, 'logistic_c': 0.00022712375352220302, 'pca_fit': 'combined', 'solver': 'lbfgs', 'max_iter': 2000, 'fit_intercept': True, 'standardize_with_source': True, 'rho': 0.3}
[I 2026-06-01 22:40:09,736] Trial 94 finished with value: 0.221339939743667 and parameters: {'alpha': 34289.31703790128, 'n_pcs': 4500, 'iw_method': 'pc_logistic', 'iw_clip_max': 2.5, 'iw_prob_clip': 0.04815553880328289, 'iw_n_components': 100, 'iw_logistic_c': 0.00022712375352220302, 'iw_pca_fit': 'combined', 'iw_solver': 'lbfgs', 'iw_rho': 0.3}. Best is trial 92 with value: 0.22386962853002085.
2026-06-01 22:40:09 | INFO | Trial 95 | outer=8 | alpha=1.314e+04 n_pcs=4500 (pc_topk) weight={'name': 'pc_logistic', 'floor': 1e-06, 'clip_max': 2.5, 'prob_clip': 0.028009727446117395, 'n_components': 100, 'logistic_c': 0.0020294546609416807, 'pca_fit': 'combined', 'solver': 'lbfgs', 'max_iter': 2000, 'fit_intercept': True, 'standardize_with_source': True, 'rho': 0.3}
[I 2026-06-01 22:40:32,028] Trial 95 finished with value: 0.21432119106734948 and parameters: {'alpha': 13142.85795002708, 'n_pcs': 4500, 'iw_method': 'pc_logistic', 'iw_clip_max': 2.5, 'iw_prob_clip': 0.028009727446117395, 'iw_n_components': 100, 'iw_logistic_c': 0.0020294546609416807, 'iw_pca_fit': 'combined', 'iw_solver': 'lbfgs', 'iw_rho': 0.3}. Best is trial 92 with value: 0.22386962853002085.
2026-06-01 22:40:32 | INFO | Trial 96 | outer=8 | alpha=3.208e+04 n_pcs=4500 (pc_topk) weight={'name': 'pc_logistic', 'floor': 1e-06, 'clip_max': 2.5, 'prob_clip': 0.036399686104361714, 'n_components': 100, 'logistic_c': 7.049827217867908e-05, 'pca_fit': 'combined', 'solver': 'lbfgs', 'max_iter': 2000, 'fit_intercept': True, 'standardize_with_source': True, 'rho': 0.3}
[I 2026-06-01 22:40:47,594] Trial 96 finished with value: 0.22232927619997347 and parameters: {'alpha': 32084.216385348238, 'n_pcs': 4500, 'iw_method': 'pc_logistic', 'iw_clip_max': 2.5, 'iw_prob_clip': 0.036399686104361714, 'iw_n_components': 100, 'iw_logistic_c': 7.049827217867908e-05, 'iw_pca_fit': 'combined', 'iw_solver': 'lbfgs', 'iw_rho': 0.3}. Best is trial 92 with value: 0.22386962853002085.
2026-06-01 22:40:47 | INFO | Trial 97 | outer=8 | alpha=5.572e+04 n_pcs=4500 (pc_topk) weight={'name': 'pc_logistic', 'floor': 1e-06, 'clip_max': 2.5, 'prob_clip': 0.03538069270295416, 'n_components': 100, 'logistic_c': 0.000316688291319387, 'pca_fit': 'combined', 'solver': 'lbfgs', 'max_iter': 2000, 'fit_intercept': True, 'standardize_with_source': True, 'rho': 0.3}
[I 2026-06-01 22:41:05,821] Trial 97 finished with value: 0.2215695063035498 and parameters: {'alpha': 55724.88075499259, 'n_pcs': 4500, 'iw_method': 'pc_logistic', 'iw_clip_max': 2.5, 'iw_prob_clip': 0.03538069270295416, 'iw_n_components': 100, 'iw_logistic_c': 0.000316688291319387, 'iw_pca_fit': 'combined', 'iw_solver': 'lbfgs', 'iw_rho': 0.3}. Best is trial 92 with value: 0.22386962853002085.
2026-06-01 22:41:05 | INFO | Trial 98 | outer=8 | alpha=2.884e+04 n_pcs=4500 (pc_topk) weight={'name': 'pc_logistic', 'floor': 1e-06, 'clip_max': 12.0, 'prob_clip': 0.034488323239618014, 'n_components': 100, 'logistic_c': 8.582537468285154e-05, 'pca_fit': 'combined', 'solver': 'lbfgs', 'max_iter': 2000, 'fit_intercept': True, 'standardize_with_source': True, 'rho': 0.3}
[I 2026-06-01 22:41:21,343] Trial 98 finished with value: 0.21767095007492712 and parameters: {'alpha': 28836.47843198778, 'n_pcs': 4500, 'iw_method': 'pc_logistic', 'iw_clip_max': 12.0, 'iw_prob_clip': 0.034488323239618014, 'iw_n_components': 100, 'iw_logistic_c': 8.582537468285154e-05, 'iw_pca_fit': 'combined', 'iw_solver': 'lbfgs', 'iw_rho': 0.3}. Best is trial 92 with value: 0.22386962853002085.
2026-06-01 22:41:21 | INFO | Trial 99 | outer=8 | alpha=8.325e+03 n_pcs=2500 (pc_topk) weight={'name': 'pc_logistic', 'floor': 1e-06, 'clip_max': 4.0, 'prob_clip': 0.028769583205074098, 'n_components': 60, 'logistic_c': 6.122550713826111e-05, 'pca_fit': 'combined', 'solver': 'lbfgs', 'max_iter': 2000, 'fit_intercept': True, 'standardize_with_source': True, 'rho': 0.3}
[I 2026-06-01 22:41:31,147] Trial 99 finished with value: 0.18216118065405398 and parameters: {'alpha': 8325.463167365366, 'n_pcs': 2500, 'iw_method': 'pc_logistic', 'iw_clip_max': 4.0, 'iw_prob_clip': 0.028769583205074098, 'iw_n_components': 60, 'iw_logistic_c': 6.122550713826111e-05, 'iw_pca_fit': 'combined', 'iw_solver': 'lbfgs', 'iw_rho': 0.3}. Best is trial 92 with value: 0.22386962853002085.
2026-06-01 22:41:31 | INFO | Trial 100 | outer=8 | alpha=5.619e+04 n_pcs=4500 (pc_topk) weight={'name': 'uniform'}
[I 2026-06-01 22:41:40,302] Trial 100 finished with value: 0.214393288329159 and parameters: {'alpha': 56188.52264726451, 'n_pcs': 4500, 'iw_method': 'uniform'}. Best is trial 92 with value: 0.22386962853002085.
2026-06-01 22:41:40 | INFO | Trial 101 | outer=8 | alpha=3.838e+04 n_pcs=4000 (pc_topk) weight={'name': 'pc_logistic', 'floor': 1e-06, 'clip_max': 2.5, 'prob_clip': 0.021686071787093232, 'n_components': 100, 'logistic_c': 0.0009015998046314906, 'pca_fit': 'combined', 'solver': 'lbfgs', 'max_iter': 2000, 'fit_intercept': True, 'standardize_with_source': True, 'rho': 0.3}
[I 2026-06-01 22:41:57,766] Trial 101 finished with value: 0.220555231042187 and parameters: {'alpha': 38379.38179945458, 'n_pcs': 4000, 'iw_method': 'pc_logistic', 'iw_clip_max': 2.5, 'iw_prob_clip': 0.021686071787093232, 'iw_n_components': 100, 'iw_logistic_c': 0.0009015998046314906, 'iw_pca_fit': 'combined', 'iw_solver': 'lbfgs', 'iw_rho': 0.3}. Best is trial 92 with value: 0.22386962853002085.
2026-06-01 22:41:57 | INFO | Trial 102 | outer=8 | alpha=1.064e+03 n_pcs=4500 (pc_topk) weight={'name': 'pc_logistic', 'floor': 1e-06, 'clip_max': 2.5, 'prob_clip': 0.02453743331984599, 'n_components': 100, 'logistic_c': 0.0001830833858853071, 'pca_fit': 'combined', 'solver': 'lbfgs', 'max_iter': 2000, 'fit_intercept': True, 'standardize_with_source': True, 'rho': 0.7}
[I 2026-06-01 22:42:14,949] Trial 102 finished with value: 0.1436718661997754 and parameters: {'alpha': 1063.614641640196, 'n_pcs': 4500, 'iw_method': 'pc_logistic', 'iw_clip_max': 2.5, 'iw_prob_clip': 0.02453743331984599, 'iw_n_components': 100, 'iw_logistic_c': 0.0001830833858853071, 'iw_pca_fit': 'combined', 'iw_solver': 'lbfgs', 'iw_rho': 0.7}. Best is trial 92 with value: 0.22386962853002085.
2026-06-01 22:42:14 | INFO | Trial 103 | outer=8 | alpha=2.996e+04 n_pcs=4500 (pc_topk) weight={'name': 'pc_logistic', 'floor': 1e-06, 'clip_max': 2.5, 'prob_clip': 0.03704461496192825, 'n_components': 10, 'logistic_c': 0.0003393626274953564, 'pca_fit': 'combined', 'solver': 'lbfgs', 'max_iter': 2000, 'fit_intercept': True, 'standardize_with_source': True, 'rho': 0.85}
[I 2026-06-01 22:42:30,828] Trial 103 finished with value: 0.2195634934667427 and parameters: {'alpha': 29958.82088193666, 'n_pcs': 4500, 'iw_method': 'pc_logistic', 'iw_clip_max': 2.5, 'iw_prob_clip': 0.03704461496192825, 'iw_n_components': 10, 'iw_logistic_c': 0.0003393626274953564, 'iw_pca_fit': 'combined', 'iw_solver': 'lbfgs', 'iw_rho': 0.85}. Best is trial 92 with value: 0.22386962853002085.
2026-06-01 22:42:30 | INFO | Trial 104 | outer=8 | alpha=1.734e+04 n_pcs=4000 (pc_topk) weight={'name': 'pc_logistic', 'floor': 1e-06, 'clip_max': 2.5, 'prob_clip': 0.016739191203288914, 'n_components': 100, 'logistic_c': 0.0027167134550477538, 'pca_fit': 'combined', 'solver': 'lbfgs', 'max_iter': 2000, 'fit_intercept': True, 'standardize_with_source': True, 'rho': 0.3}
[I 2026-06-01 22:42:50,483] Trial 104 finished with value: 0.21248230425976247 and parameters: {'alpha': 17344.113214141216, 'n_pcs': 4000, 'iw_method': 'pc_logistic', 'iw_clip_max': 2.5, 'iw_prob_clip': 0.016739191203288914, 'iw_n_components': 100, 'iw_logistic_c': 0.0027167134550477538, 'iw_pca_fit': 'combined', 'iw_solver': 'lbfgs', 'iw_rho': 0.3}. Best is trial 92 with value: 0.22386962853002085.
2026-06-01 22:42:50 | INFO | Trial 105 | outer=8 | alpha=3.364e+04 n_pcs=1000 (pc_topk) weight={'name': 'pc_logistic', 'floor': 1e-06, 'clip_max': 1.5, 'prob_clip': 0.044422836749683746, 'n_components': 80, 'logistic_c': 0.0013571775630698692, 'pca_fit': 'combined', 'solver': 'lbfgs', 'max_iter': 2000, 'fit_intercept': True, 'standardize_with_source': True, 'rho': 0.7}
[I 2026-06-01 22:43:01,337] Trial 105 finished with value: 0.20388730997138688 and parameters: {'alpha': 33636.971875434465, 'n_pcs': 1000, 'iw_method': 'pc_logistic', 'iw_clip_max': 1.5, 'iw_prob_clip': 0.044422836749683746, 'iw_n_components': 80, 'iw_logistic_c': 0.0013571775630698692, 'iw_pca_fit': 'combined', 'iw_solver': 'lbfgs', 'iw_rho': 0.7}. Best is trial 92 with value: 0.22386962853002085.
2026-06-01 22:43:01 | INFO | Trial 106 | outer=8 | alpha=1.347e+04 n_pcs=2000 (pc_topk) weight={'name': 'pc_logistic', 'floor': 1e-06, 'clip_max': 2.5, 'prob_clip': 0.011803177330558565, 'n_components': 100, 'logistic_c': 0.000677207677264894, 'pca_fit': 'combined', 'solver': 'lbfgs', 'max_iter': 2000, 'fit_intercept': True, 'standardize_with_source': True, 'rho': 0.7}
[I 2026-06-01 22:43:12,894] Trial 106 finished with value: 0.19273917147034186 and parameters: {'alpha': 13466.962472270397, 'n_pcs': 2000, 'iw_method': 'pc_logistic', 'iw_clip_max': 2.5, 'iw_prob_clip': 0.011803177330558565, 'iw_n_components': 100, 'iw_logistic_c': 0.000677207677264894, 'iw_pca_fit': 'combined', 'iw_solver': 'lbfgs', 'iw_rho': 0.7}. Best is trial 92 with value: 0.22386962853002085.
2026-06-01 22:43:12 | INFO | Trial 107 | outer=8 | alpha=5.207e+04 n_pcs=3000 (pc_topk) weight={'name': 'pc_logistic', 'floor': 1e-06, 'clip_max': 2.5, 'prob_clip': 0.019071197588500476, 'n_components': 100, 'logistic_c': 0.00012990611517965488, 'pca_fit': 'combined', 'solver': 'lbfgs', 'max_iter': 2000, 'fit_intercept': True, 'standardize_with_source': True, 'rho': 0.85}
