[I 2026-05-31 22:48:46,197] Trial 66 pruned. 
2026-05-31 22:48:46 | INFO | src.nested_cv_avggrm_weighted_unified | Trial 67 | outer=1 | alpha=5.822e+04 n_pcs=3500 (pc_topk) weight_search=on
2026-05-31 22:48:46 | INFO | src.nested_cv_avggrm_weighted_unified | Trial 67 | outer=1 | weight={'name': 'exponential', 'floor': 1e-06, 'clip_max': 3.0, 'beta': 9.221480720241503}
[I 2026-05-31 22:48:51,058] Trial 67 finished with value: 0.252696440745236 and parameters: {'alpha': 58216.124876934926, 'n_pcs': 3500, 'weight_scheme': 'exponential', 'weight_clip_max': 3.0, 'weight_exponential_beta': 9.221480720241503}. Best is trial 43 with value: 0.25987350859233793.
2026-05-31 22:48:51 | INFO | src.nested_cv_avggrm_weighted_unified | Trial 68 | outer=1 | alpha=1.072e+03 n_pcs=1000 (pc_topk) weight_search=on
2026-05-31 22:48:51 | INFO | src.nested_cv_avggrm_weighted_unified | Trial 68 | outer=1 | weight={'name': 'exponential', 'floor': 1e-06, 'clip_max': 5.0, 'beta': 7.419297154086187}
[I 2026-05-31 22:48:52,451] Trial 68 finished with value: 0.2009291793383304 and parameters: {'alpha': 1071.992231268272, 'n_pcs': 1000, 'weight_scheme': 'exponential', 'weight_clip_max': 5.0, 'weight_exponential_beta': 7.419297154086187}. Best is trial 43 with value: 0.25987350859233793.
2026-05-31 22:48:52 | INFO | src.nested_cv_avggrm_weighted_unified | Trial 69 | outer=1 | alpha=1.114e+05 n_pcs=4000 (pc_topk) weight_search=on
2026-05-31 22:48:52 | INFO | src.nested_cv_avggrm_weighted_unified | Trial 69 | outer=1 | weight={'name': 'exponential', 'floor': 1e-06, 'clip_max': 5.0, 'beta': 6.827492308912468}
[I 2026-05-31 22:48:58,243] Trial 69 finished with value: 0.25968643848418443 and parameters: {'alpha': 111358.10712024676, 'n_pcs': 4000, 'weight_scheme': 'exponential', 'weight_clip_max': 5.0, 'weight_exponential_beta': 6.827492308912468}. Best is trial 43 with value: 0.25987350859233793.
2026-05-31 22:48:58 | INFO | src.nested_cv_avggrm_weighted_unified | Trial 70 | outer=1 | alpha=1.103e+05 n_pcs=4000 (pc_topk) weight_search=on
2026-05-31 22:48:58 | INFO | src.nested_cv_avggrm_weighted_unified | Trial 70 | outer=1 | weight={'name': 'exponential', 'floor': 1e-06, 'clip_max': 5.0, 'beta': 8.140173362243893}
[I 2026-05-31 22:49:03,972] Trial 70 finished with value: 0.25954074196337706 and parameters: {'alpha': 110317.4209968067, 'n_pcs': 4000, 'weight_scheme': 'exponential', 'weight_clip_max': 5.0, 'weight_exponential_beta': 8.140173362243893}. Best is trial 43 with value: 0.25987350859233793.
2026-05-31 22:49:03 | INFO | src.nested_cv_avggrm_weighted_unified | Trial 71 | outer=1 | alpha=1.017e+05 n_pcs=4000 (pc_topk) weight_search=on
2026-05-31 22:49:03 | INFO | src.nested_cv_avggrm_weighted_unified | Trial 71 | outer=1 | weight={'name': 'exponential', 'floor': 1e-06, 'clip_max': 5.0, 'beta': 7.883679936544773}
[I 2026-05-31 22:49:09,703] Trial 71 finished with value: 0.25940802070899954 and parameters: {'alpha': 101747.41694155087, 'n_pcs': 4000, 'weight_scheme': 'exponential', 'weight_clip_max': 5.0, 'weight_exponential_beta': 7.883679936544773}. Best is trial 43 with value: 0.25987350859233793.
2026-05-31 22:49:09 | INFO | src.nested_cv_avggrm_weighted_unified | Trial 72 | outer=1 | alpha=1.198e+05 n_pcs=4000 (pc_topk) weight_search=on
2026-05-31 22:49:09 | INFO | src.nested_cv_avggrm_weighted_unified | Trial 72 | outer=1 | weight={'name': 'exponential', 'floor': 1e-06, 'clip_max': 5.0, 'beta': 6.8852729459818285}
[I 2026-05-31 22:49:15,434] Trial 72 finished with value: 0.2597587517048855 and parameters: {'alpha': 119794.82080246166, 'n_pcs': 4000, 'weight_scheme': 'exponential', 'weight_clip_max': 5.0, 'weight_exponential_beta': 6.8852729459818285}. Best is trial 43 with value: 0.25987350859233793.
2026-05-31 22:49:15 | INFO | src.nested_cv_avggrm_weighted_unified | Trial 73 | outer=1 | alpha=1.026e+05 n_pcs=4000 (pc_topk) weight_search=on
2026-05-31 22:49:15 | INFO | src.nested_cv_avggrm_weighted_unified | Trial 73 | outer=1 | weight={'name': 'exponential', 'floor': 1e-06, 'clip_max': 5.0, 'beta': 6.833051765485636}
[I 2026-05-31 22:49:21,156] Trial 73 finished with value: 0.25955737218941416 and parameters: {'alpha': 102621.8143057657, 'n_pcs': 4000, 'weight_scheme': 'exponential', 'weight_clip_max': 5.0, 'weight_exponential_beta': 6.833051765485636}. Best is trial 43 with value: 0.25987350859233793.
2026-05-31 22:49:21 | INFO | src.nested_cv_avggrm_weighted_unified | Trial 74 | outer=1 | alpha=1.219e+05 n_pcs=3500 (pc_topk) weight_search=on
2026-05-31 22:49:21 | INFO | src.nested_cv_avggrm_weighted_unified | Trial 74 | outer=1 | weight={'name': 'exponential', 'floor': 1e-06, 'clip_max': 5.0, 'beta': 6.798811478544482}
[I 2026-05-31 22:49:26,067] Trial 74 finished with value: 0.25783144037968075 and parameters: {'alpha': 121887.61090171945, 'n_pcs': 3500, 'weight_scheme': 'exponential', 'weight_clip_max': 5.0, 'weight_exponential_beta': 6.798811478544482}. Best is trial 43 with value: 0.25987350859233793.
2026-05-31 22:49:26 | INFO | src.nested_cv_avggrm_weighted_unified | Trial 75 | outer=1 | alpha=3.745e+04 n_pcs=4000 (pc_topk) weight_search=on
2026-05-31 22:49:26 | INFO | src.nested_cv_avggrm_weighted_unified | Trial 75 | outer=1 | weight={'name': 'exponential', 'floor': 1e-06, 'clip_max': None, 'beta': 7.004554768321285}
[I 2026-05-31 22:49:31,769] Trial 75 finished with value: 0.24657779922684164 and parameters: {'alpha': 37447.547922004, 'n_pcs': 4000, 'weight_scheme': 'exponential', 'weight_clip_max': None, 'weight_exponential_beta': 7.004554768321285}. Best is trial 43 with value: 0.25987350859233793.
2026-05-31 22:49:31 | INFO | src.nested_cv_avggrm_weighted_unified | Trial 76 | outer=1 | alpha=6.342e+04 n_pcs=4000 (pc_topk) weight_search=on
2026-05-31 22:49:31 | INFO | src.nested_cv_avggrm_weighted_unified | Trial 76 | outer=1 | weight={'name': 'exponential', 'floor': 1e-06, 'clip_max': 5.0, 'beta': 5.678249874113104}
[I 2026-05-31 22:49:37,503] Trial 76 finished with value: 0.2581051017900945 and parameters: {'alpha': 63418.085425446145, 'n_pcs': 4000, 'weight_scheme': 'exponential', 'weight_clip_max': 5.0, 'weight_exponential_beta': 5.678249874113104}. Best is trial 43 with value: 0.25987350859233793.
2026-05-31 22:49:37 | INFO | src.nested_cv_avggrm_weighted_unified | Trial 77 | outer=1 | alpha=2.169e+05 n_pcs=3500 (pc_topk) weight_search=on
2026-05-31 22:49:37 | INFO | src.nested_cv_avggrm_weighted_unified | Trial 77 | outer=1 | weight={'name': 'exponential', 'floor': 1e-06, 'clip_max': 5.0, 'beta': 6.148983616177451}
[I 2026-05-31 22:49:42,353] Trial 77 finished with value: 0.25723432515378697 and parameters: {'alpha': 216885.81133757785, 'n_pcs': 3500, 'weight_scheme': 'exponential', 'weight_clip_max': 5.0, 'weight_exponential_beta': 6.148983616177451}. Best is trial 43 with value: 0.25987350859233793.
2026-05-31 22:49:42 | INFO | src.nested_cv_avggrm_weighted_unified | Trial 78 | outer=1 | alpha=2.889e+05 n_pcs=4000 (pc_topk) weight_search=on
2026-05-31 22:49:42 | INFO | src.nested_cv_avggrm_weighted_unified | Trial 78 | outer=1 | weight={'name': 'uniform', 'floor': 1e-06, 'clip_max': 10.0}
2026-05-31 22:49:45 | INFO | src.nested_cv_avggrm_weighted_unified | Trial 78 | outer=1 | pruned after 6/10 inner folds (mean r=0.2367)
[I 2026-05-31 22:49:45,256] Trial 78 pruned. 
2026-05-31 22:49:45 | INFO | src.nested_cv_avggrm_weighted_unified | Trial 79 | outer=1 | alpha=1.184e+05 n_pcs=3500 (pc_topk) weight_search=on
2026-05-31 22:49:45 | INFO | src.nested_cv_avggrm_weighted_unified | Trial 79 | outer=1 | weight={'name': 'linear', 'floor': 1e-06, 'clip_max': 20.0, 'min_weight': 0.7984437192776195, 'max_weight': 3.7690281093446596}
[I 2026-05-31 22:49:50,150] Trial 79 finished with value: 0.2506328145788019 and parameters: {'alpha': 118431.49520899574, 'n_pcs': 3500, 'weight_scheme': 'linear', 'weight_clip_max': 20.0, 'weight_linear_min_weight': 0.7984437192776195, 'weight_linear_max_weight': 3.7690281093446596}. Best is trial 43 with value: 0.25987350859233793.
2026-05-31 22:49:50 | INFO | src.nested_cv_avggrm_weighted_unified | Trial 80 | outer=1 | alpha=7.305e+04 n_pcs=4000 (pc_topk) weight_search=on
2026-05-31 22:49:50 | INFO | src.nested_cv_avggrm_weighted_unified | Trial 80 | outer=1 | weight={'name': 'exponential', 'floor': 1e-06, 'clip_max': 5.0, 'beta': 7.609505717961204}
[I 2026-05-31 22:49:55,890] Trial 80 finished with value: 0.25807063670631203 and parameters: {'alpha': 73048.76534666406, 'n_pcs': 4000, 'weight_scheme': 'exponential', 'weight_clip_max': 5.0, 'weight_exponential_beta': 7.609505717961204}. Best is trial 43 with value: 0.25987350859233793.
2026-05-31 22:49:55 | INFO | src.nested_cv_avggrm_weighted_unified | Trial 81 | outer=1 | alpha=9.231e+04 n_pcs=4000 (pc_topk) weight_search=on
2026-05-31 22:49:55 | INFO | src.nested_cv_avggrm_weighted_unified | Trial 81 | outer=1 | weight={'name': 'exponential', 'floor': 1e-06, 'clip_max': 5.0, 'beta': 7.923872281496244}
[I 2026-05-31 22:50:01,616] Trial 81 finished with value: 0.2590680799712007 and parameters: {'alpha': 92305.34669581248, 'n_pcs': 4000, 'weight_scheme': 'exponential', 'weight_clip_max': 5.0, 'weight_exponential_beta': 7.923872281496244}. Best is trial 43 with value: 0.25987350859233793.
2026-05-31 22:50:01 | INFO | src.nested_cv_avggrm_weighted_unified | Trial 82 | outer=1 | alpha=9.979e+04 n_pcs=4000 (pc_topk) weight_search=on
2026-05-31 22:50:01 | INFO | src.nested_cv_avggrm_weighted_unified | Trial 82 | outer=1 | weight={'name': 'exponential', 'floor': 1e-06, 'clip_max': 5.0, 'beta': 8.224829952159862}
[I 2026-05-31 22:50:07,332] Trial 82 finished with value: 0.25922233198490396 and parameters: {'alpha': 99785.185452351, 'n_pcs': 4000, 'weight_scheme': 'exponential', 'weight_clip_max': 5.0, 'weight_exponential_beta': 8.224829952159862}. Best is trial 43 with value: 0.25987350859233793.
2026-05-31 22:50:07 | INFO | src.nested_cv_avggrm_weighted_unified | Trial 83 | outer=1 | alpha=1.837e+05 n_pcs=4000 (pc_topk) weight_search=on
2026-05-31 22:50:07 | INFO | src.nested_cv_avggrm_weighted_unified | Trial 83 | outer=1 | weight={'name': 'exponential', 'floor': 1e-06, 'clip_max': 5.0, 'beta': 8.691183556953455}
[I 2026-05-31 22:50:13,061] Trial 83 finished with value: 0.2595638148230085 and parameters: {'alpha': 183697.4457656439, 'n_pcs': 4000, 'weight_scheme': 'exponential', 'weight_clip_max': 5.0, 'weight_exponential_beta': 8.691183556953455}. Best is trial 43 with value: 0.25987350859233793.
2026-05-31 22:50:13 | INFO | src.nested_cv_avggrm_weighted_unified | Trial 84 | outer=1 | alpha=1.678e+05 n_pcs=3500 (pc_topk) weight_search=on
2026-05-31 22:50:13 | INFO | src.nested_cv_avggrm_weighted_unified | Trial 84 | outer=1 | weight={'name': 'exponential', 'floor': 1e-06, 'clip_max': 5.0, 'beta': 9.997489789058555}
[I 2026-05-31 22:50:17,946] Trial 84 finished with value: 0.25633866664904764 and parameters: {'alpha': 167773.26614065986, 'n_pcs': 3500, 'weight_scheme': 'exponential', 'weight_clip_max': 5.0, 'weight_exponential_beta': 9.997489789058555}. Best is trial 43 with value: 0.25987350859233793.
2026-05-31 22:50:17 | INFO | src.nested_cv_avggrm_weighted_unified | Trial 85 | outer=1 | alpha=5.382e+05 n_pcs=4500 (pc_topk) weight_search=on
2026-05-31 22:50:17 | INFO | src.nested_cv_avggrm_weighted_unified | Trial 85 | outer=1 | weight={'name': 'exponential', 'floor': 1e-06, 'clip_max': 5.0, 'beta': 9.022173891312095}
[I 2026-05-31 22:50:24,859] Trial 85 finished with value: 0.25348165109470033 and parameters: {'alpha': 538233.8282004201, 'n_pcs': 4500, 'weight_scheme': 'exponential', 'weight_clip_max': 5.0, 'weight_exponential_beta': 9.022173891312095}. Best is trial 43 with value: 0.25987350859233793.
2026-05-31 22:50:24 | INFO | src.nested_cv_avggrm_weighted_unified | Trial 86 | outer=1 | alpha=4.920e+04 n_pcs=2000 (pc_topk) weight_search=on
2026-05-31 22:50:24 | INFO | src.nested_cv_avggrm_weighted_unified | Trial 86 | outer=1 | weight={'name': 'exponential', 'floor': 1e-06, 'clip_max': 5.0, 'beta': 6.577477487537656}
[I 2026-05-31 22:50:27,072] Trial 86 finished with value: 0.2430856359315614 and parameters: {'alpha': 49199.077836239485, 'n_pcs': 2000, 'weight_scheme': 'exponential', 'weight_clip_max': 5.0, 'weight_exponential_beta': 6.577477487537656}. Best is trial 43 with value: 0.25987350859233793.
2026-05-31 22:50:27 | INFO | src.nested_cv_avggrm_weighted_unified | Trial 87 | outer=1 | alpha=1.985e+05 n_pcs=4000 (pc_topk) weight_search=on
2026-05-31 22:50:27 | INFO | src.nested_cv_avggrm_weighted_unified | Trial 87 | outer=1 | weight={'name': 'exponential', 'floor': 1e-06, 'clip_max': 5.0, 'beta': 8.700144590698283}
[I 2026-05-31 22:50:32,799] Trial 87 finished with value: 0.2594275312614764 and parameters: {'alpha': 198495.2071963422, 'n_pcs': 4000, 'weight_scheme': 'exponential', 'weight_clip_max': 5.0, 'weight_exponential_beta': 8.700144590698283}. Best is trial 43 with value: 0.25987350859233793.
2026-05-31 22:50:32 | INFO | src.nested_cv_avggrm_weighted_unified | Trial 88 | outer=1 | alpha=2.039e+05 n_pcs=4000 (pc_topk) weight_search=on
2026-05-31 22:50:32 | INFO | src.nested_cv_avggrm_weighted_unified | Trial 88 | outer=1 | weight={'name': 'exponential', 'floor': 1e-06, 'clip_max': 3.0, 'beta': 8.609323817219485}
[I 2026-05-31 22:50:38,523] Trial 88 finished with value: 0.2601238911726941 and parameters: {'alpha': 203921.6210074425, 'n_pcs': 4000, 'weight_scheme': 'exponential', 'weight_clip_max': 3.0, 'weight_exponential_beta': 8.609323817219485}. Best is trial 88 with value: 0.2601238911726941.
2026-05-31 22:50:38 | INFO | src.nested_cv_avggrm_weighted_unified | OUTER 1 | new best trial 88 (mean inner r=0.2601) saved to outputs/final_results/e6_pc_ridge_avggrm/thr_wing/e6_pc_ridge_avggrm_thr_wing_best_trials/split_01_best_trial.json
2026-05-31 22:50:38 | INFO | src.nested_cv_avggrm_weighted_unified | Trial 89 | outer=1 | alpha=3.319e+05 n_pcs=3500 (pc_topk) weight_search=on
2026-05-31 22:50:38 | INFO | src.nested_cv_avggrm_weighted_unified | Trial 89 | outer=1 | weight={'name': 'exponential', 'floor': 1e-06, 'clip_max': 3.0, 'beta': 8.653471435300382}
[I 2026-05-31 22:50:43,475] Trial 89 finished with value: 0.25765964332529234 and parameters: {'alpha': 331923.6667334975, 'n_pcs': 3500, 'weight_scheme': 'exponential', 'weight_clip_max': 3.0, 'weight_exponential_beta': 8.653471435300382}. Best is trial 88 with value: 0.2601238911726941.
2026-05-31 22:50:43 | INFO | src.nested_cv_avggrm_weighted_unified | Trial 90 | outer=1 | alpha=2.026e+05 n_pcs=4500 (pc_topk) weight_search=on
2026-05-31 22:50:43 | INFO | src.nested_cv_avggrm_weighted_unified | Trial 90 | outer=1 | weight={'name': 'exponential', 'floor': 1e-06, 'clip_max': 3.0, 'beta': 9.71447130744376}
[I 2026-05-31 22:50:50,402] Trial 90 finished with value: 0.2595936426614144 and parameters: {'alpha': 202636.11475471707, 'n_pcs': 4500, 'weight_scheme': 'exponential', 'weight_clip_max': 3.0, 'weight_exponential_beta': 9.71447130744376}. Best is trial 88 with value: 0.2601238911726941.
2026-05-31 22:50:50 | INFO | src.nested_cv_avggrm_weighted_unified | Trial 91 | outer=1 | alpha=1.862e+05 n_pcs=4500 (pc_topk) weight_search=on
2026-05-31 22:50:50 | INFO | src.nested_cv_avggrm_weighted_unified | Trial 91 | outer=1 | weight={'name': 'exponential', 'floor': 1e-06, 'clip_max': 3.0, 'beta': 9.390053629853309}
[I 2026-05-31 22:50:57,334] Trial 91 finished with value: 0.2597076007423081 and parameters: {'alpha': 186244.5329774802, 'n_pcs': 4500, 'weight_scheme': 'exponential', 'weight_clip_max': 3.0, 'weight_exponential_beta': 9.390053629853309}. Best is trial 88 with value: 0.2601238911726941.
2026-05-31 22:50:57 | INFO | src.nested_cv_avggrm_weighted_unified | Trial 92 | outer=1 | alpha=2.006e+05 n_pcs=4500 (pc_topk) weight_search=on
2026-05-31 22:50:57 | INFO | src.nested_cv_avggrm_weighted_unified | Trial 92 | outer=1 | weight={'name': 'exponential', 'floor': 1e-06, 'clip_max': 3.0, 'beta': 9.67465263004921}
[I 2026-05-31 22:51:04,300] Trial 92 finished with value: 0.25961640637172634 and parameters: {'alpha': 200625.82881962883, 'n_pcs': 4500, 'weight_scheme': 'exponential', 'weight_clip_max': 3.0, 'weight_exponential_beta': 9.67465263004921}. Best is trial 88 with value: 0.2601238911726941.
2026-05-31 22:51:04 | INFO | src.nested_cv_avggrm_weighted_unified | Trial 93 | outer=1 | alpha=2.399e+05 n_pcs=5000 (pc_topk) weight_search=on
2026-05-31 22:51:04 | INFO | src.nested_cv_avggrm_weighted_unified | Trial 93 | outer=1 | weight={'name': 'exponential', 'floor': 1e-06, 'clip_max': 3.0, 'beta': 9.759662360484729}
[I 2026-05-31 22:51:12,419] Trial 93 finished with value: 0.25817743938404975 and parameters: {'alpha': 239865.82503247177, 'n_pcs': 5000, 'weight_scheme': 'exponential', 'weight_clip_max': 3.0, 'weight_exponential_beta': 9.759662360484729}. Best is trial 88 with value: 0.2601238911726941.
2026-05-31 22:51:12 | INFO | src.nested_cv_avggrm_weighted_unified | Trial 94 | outer=1 | alpha=1.374e+05 n_pcs=4500 (pc_topk) weight_search=on
2026-05-31 22:51:12 | INFO | src.nested_cv_avggrm_weighted_unified | Trial 94 | outer=1 | weight={'name': 'exponential', 'floor': 1e-06, 'clip_max': 3.0, 'beta': 9.631979421888591}
[I 2026-05-31 22:51:19,342] Trial 94 finished with value: 0.25984909183827776 and parameters: {'alpha': 137379.01955517006, 'n_pcs': 4500, 'weight_scheme': 'exponential', 'weight_clip_max': 3.0, 'weight_exponential_beta': 9.631979421888591}. Best is trial 88 with value: 0.2601238911726941.
2026-05-31 22:51:19 | INFO | src.nested_cv_avggrm_weighted_unified | Trial 95 | outer=1 | alpha=1.417e+05 n_pcs=4500 (pc_topk) weight_search=on
2026-05-31 22:51:19 | INFO | src.nested_cv_avggrm_weighted_unified | Trial 95 | outer=1 | weight={'name': 'exponential', 'floor': 1e-06, 'clip_max': 3.0, 'beta': 9.641729126573674}
[I 2026-05-31 22:51:26,273] Trial 95 finished with value: 0.2598672249693278 and parameters: {'alpha': 141678.71094133583, 'n_pcs': 4500, 'weight_scheme': 'exponential', 'weight_clip_max': 3.0, 'weight_exponential_beta': 9.641729126573674}. Best is trial 88 with value: 0.2601238911726941.
2026-05-31 22:51:26 | INFO | src.nested_cv_avggrm_weighted_unified | Trial 96 | outer=1 | alpha=3.791e+05 n_pcs=4500 (pc_topk) weight_search=on
2026-05-31 22:51:26 | INFO | src.nested_cv_avggrm_weighted_unified | Trial 96 | outer=1 | weight={'name': 'exponential', 'floor': 1e-06, 'clip_max': 3.0, 'beta': 9.480848421100372}
[I 2026-05-31 22:51:33,593] Trial 96 finished with value: 0.2570971805461913 and parameters: {'alpha': 379108.53518089093, 'n_pcs': 4500, 'weight_scheme': 'exponential', 'weight_clip_max': 3.0, 'weight_exponential_beta': 9.480848421100372}. Best is trial 88 with value: 0.2601238911726941.
2026-05-31 22:51:33 | INFO | src.nested_cv_avggrm_weighted_unified | Trial 97 | outer=1 | alpha=8.479e+05 n_pcs=4500 (pc_topk) weight_search=on
2026-05-31 22:51:33 | INFO | src.nested_cv_avggrm_weighted_unified | Trial 97 | outer=1 | weight={'name': 'linear', 'floor': 1e-06, 'clip_max': 3.0, 'min_weight': 0.050980691236144515, 'max_weight': 2.4626631673019985}
2026-05-31 22:51:38 | INFO | src.nested_cv_avggrm_weighted_unified | Trial 97 | outer=1 | pruned after 7/10 inner folds (mean r=0.2789)
[I 2026-05-31 22:51:38,430] Trial 97 pruned. 
2026-05-31 22:51:38 | INFO | src.nested_cv_avggrm_weighted_unified | Trial 98 | outer=1 | alpha=1.353e+05 n_pcs=5000 (pc_topk) weight_search=on
2026-05-31 22:51:38 | INFO | src.nested_cv_avggrm_weighted_unified | Trial 98 | outer=1 | weight={'name': 'exponential', 'floor': 1e-06, 'clip_max': 3.0, 'beta': 9.62978779366249}
[I 2026-05-31 22:51:46,553] Trial 98 finished with value: 0.2588109181344026 and parameters: {'alpha': 135296.9167957416, 'n_pcs': 5000, 'weight_scheme': 'exponential', 'weight_clip_max': 3.0, 'weight_exponential_beta': 9.62978779366249}. Best is trial 88 with value: 0.2601238911726941.
2026-05-31 22:51:46 | INFO | src.nested_cv_avggrm_weighted_unified | Trial 99 | outer=1 | alpha=2.727e+05 n_pcs=4500 (pc_topk) weight_search=on
2026-05-31 22:51:46 | INFO | src.nested_cv_avggrm_weighted_unified | Trial 99 | outer=1 | weight={'name': 'uniform', 'floor': 1e-06, 'clip_max': 3.0}
2026-05-31 22:51:50 | INFO | src.nested_cv_avggrm_weighted_unified | Trial 99 | outer=1 | pruned after 6/10 inner folds (mean r=0.2366)
[I 2026-05-31 22:51:50,168] Trial 99 pruned. 
2026-05-31 22:51:50 | INFO | src.nested_cv_avggrm_weighted_unified | Trial 100 | outer=1 | alpha=5.188e+05 n_pcs=5000 (pc_topk) weight_search=on
2026-05-31 22:51:50 | INFO | src.nested_cv_avggrm_weighted_unified | Trial 100 | outer=1 | weight={'name': 'exponential', 'floor': 1e-06, 'clip_max': 3.0, 'beta': 9.05551128341608}
[I 2026-05-31 22:51:58,269] Trial 100 finished with value: 0.25393183809916786 and parameters: {'alpha': 518757.16419841076, 'n_pcs': 5000, 'weight_scheme': 'exponential', 'weight_clip_max': 3.0, 'weight_exponential_beta': 9.05551128341608}. Best is trial 88 with value: 0.2601238911726941.
2026-05-31 22:51:58 | INFO | src.nested_cv_avggrm_weighted_unified | Trial 101 | outer=1 | alpha=2.011e+05 n_pcs=4500 (pc_topk) weight_search=on
2026-05-31 22:51:58 | INFO | src.nested_cv_avggrm_weighted_unified | Trial 101 | outer=1 | weight={'name': 'exponential', 'floor': 1e-06, 'clip_max': 3.0, 'beta': 9.703117536563674}
[I 2026-05-31 22:52:05,191] Trial 101 finished with value: 0.25960951677095867 and parameters: {'alpha': 201130.1165322947, 'n_pcs': 4500, 'weight_scheme': 'exponential', 'weight_clip_max': 3.0, 'weight_exponential_beta': 9.703117536563674}. Best is trial 88 with value: 0.2601238911726941.
2026-05-31 22:52:05 | INFO | src.nested_cv_avggrm_weighted_unified | Trial 102 | outer=1 | alpha=1.916e+05 n_pcs=4500 (pc_topk) weight_search=on
2026-05-31 22:52:05 | INFO | src.nested_cv_avggrm_weighted_unified | Trial 102 | outer=1 | weight={'name': 'exponential', 'floor': 1e-06, 'clip_max': 3.0, 'beta': 9.779063354264547}
