[I 2026-05-31 23:02:50,509] Trial 207 finished with value: 0.2602571350773209 and parameters: {'alpha': 118362.66539376452, 'n_pcs': 4000, 'weight_scheme': 'exponential', 'weight_clip_max': 3.0, 'weight_exponential_beta': 9.650531649606384}. Best is trial 151 with value: 0.2607458721637643.
2026-05-31 23:02:50 | INFO | src.nested_cv_avggrm_weighted_unified | Trial 208 | outer=1 | alpha=1.572e+05 n_pcs=4000 (pc_topk) weight_search=on
2026-05-31 23:02:50 | INFO | src.nested_cv_avggrm_weighted_unified | Trial 208 | outer=1 | weight={'name': 'exponential', 'floor': 1e-06, 'clip_max': 10.0, 'beta': 9.52011661251915}
[I 2026-05-31 23:02:56,232] Trial 208 finished with value: 0.2536115836720516 and parameters: {'alpha': 157211.55611963855, 'n_pcs': 4000, 'weight_scheme': 'exponential', 'weight_clip_max': 10.0, 'weight_exponential_beta': 9.52011661251915}. Best is trial 151 with value: 0.2607458721637643.
2026-05-31 23:02:56 | INFO | src.nested_cv_avggrm_weighted_unified | Trial 209 | outer=1 | alpha=1.387e+05 n_pcs=4000 (pc_topk) weight_search=on
2026-05-31 23:02:56 | INFO | src.nested_cv_avggrm_weighted_unified | Trial 209 | outer=1 | weight={'name': 'exponential', 'floor': 1e-06, 'clip_max': 3.0, 'beta': 9.728096380911165}
[I 2026-05-31 23:03:01,959] Trial 209 finished with value: 0.2605709621091644 and parameters: {'alpha': 138709.1699967204, 'n_pcs': 4000, 'weight_scheme': 'exponential', 'weight_clip_max': 3.0, 'weight_exponential_beta': 9.728096380911165}. Best is trial 151 with value: 0.2607458721637643.
2026-05-31 23:03:01 | INFO | src.nested_cv_avggrm_weighted_unified | Trial 210 | outer=1 | alpha=1.083e+05 n_pcs=4000 (pc_topk) weight_search=on
2026-05-31 23:03:01 | INFO | src.nested_cv_avggrm_weighted_unified | Trial 210 | outer=1 | weight={'name': 'exponential', 'floor': 1e-06, 'clip_max': 20.0, 'beta': 9.470579555950543}
[I 2026-05-31 23:03:07,671] Trial 210 finished with value: 0.2481521558671162 and parameters: {'alpha': 108295.33514420704, 'n_pcs': 4000, 'weight_scheme': 'exponential', 'weight_clip_max': 20.0, 'weight_exponential_beta': 9.470579555950543}. Best is trial 151 with value: 0.2607458721637643.
2026-05-31 23:03:07 | INFO | src.nested_cv_avggrm_weighted_unified | Trial 211 | outer=1 | alpha=1.420e+05 n_pcs=4000 (pc_topk) weight_search=on
2026-05-31 23:03:07 | INFO | src.nested_cv_avggrm_weighted_unified | Trial 211 | outer=1 | weight={'name': 'exponential', 'floor': 1e-06, 'clip_max': 3.0, 'beta': 9.729213870112527}
[I 2026-05-31 23:03:13,404] Trial 211 finished with value: 0.26060426185919605 and parameters: {'alpha': 142014.80012884186, 'n_pcs': 4000, 'weight_scheme': 'exponential', 'weight_clip_max': 3.0, 'weight_exponential_beta': 9.729213870112527}. Best is trial 151 with value: 0.2607458721637643.
2026-05-31 23:03:13 | INFO | src.nested_cv_avggrm_weighted_unified | Trial 212 | outer=1 | alpha=1.667e+05 n_pcs=4000 (pc_topk) weight_search=on
2026-05-31 23:03:13 | INFO | src.nested_cv_avggrm_weighted_unified | Trial 212 | outer=1 | weight={'name': 'exponential', 'floor': 1e-06, 'clip_max': 3.0, 'beta': 9.750765872841452}
[I 2026-05-31 23:03:19,145] Trial 212 finished with value: 0.2607027916683008 and parameters: {'alpha': 166688.67880458295, 'n_pcs': 4000, 'weight_scheme': 'exponential', 'weight_clip_max': 3.0, 'weight_exponential_beta': 9.750765872841452}. Best is trial 151 with value: 0.2607458721637643.
2026-05-31 23:03:19 | INFO | src.nested_cv_avggrm_weighted_unified | Trial 213 | outer=1 | alpha=1.544e+05 n_pcs=4000 (pc_topk) weight_search=on
2026-05-31 23:03:19 | INFO | src.nested_cv_avggrm_weighted_unified | Trial 213 | outer=1 | weight={'name': 'exponential', 'floor': 1e-06, 'clip_max': 3.0, 'beta': 9.698526336695616}
[I 2026-05-31 23:03:24,889] Trial 213 finished with value: 0.2606985913686426 and parameters: {'alpha': 154389.88107215107, 'n_pcs': 4000, 'weight_scheme': 'exponential', 'weight_clip_max': 3.0, 'weight_exponential_beta': 9.698526336695616}. Best is trial 151 with value: 0.2607458721637643.
2026-05-31 23:03:24 | INFO | src.nested_cv_avggrm_weighted_unified | Trial 214 | outer=1 | alpha=1.402e+05 n_pcs=4000 (pc_topk) weight_search=on
2026-05-31 23:03:24 | INFO | src.nested_cv_avggrm_weighted_unified | Trial 214 | outer=1 | weight={'name': 'exponential', 'floor': 1e-06, 'clip_max': 3.0, 'beta': 9.723620054203014}
[I 2026-05-31 23:03:30,627] Trial 214 finished with value: 0.26058941253344137 and parameters: {'alpha': 140237.365872061, 'n_pcs': 4000, 'weight_scheme': 'exponential', 'weight_clip_max': 3.0, 'weight_exponential_beta': 9.723620054203014}. Best is trial 151 with value: 0.2607458721637643.
2026-05-31 23:03:30 | INFO | src.nested_cv_avggrm_weighted_unified | Trial 215 | outer=1 | alpha=1.575e+05 n_pcs=4000 (pc_topk) weight_search=on
2026-05-31 23:03:30 | INFO | src.nested_cv_avggrm_weighted_unified | Trial 215 | outer=1 | weight={'name': 'exponential', 'floor': 1e-06, 'clip_max': 3.0, 'beta': 9.626989919479628}
[I 2026-05-31 23:03:36,376] Trial 215 finished with value: 0.26072842636499505 and parameters: {'alpha': 157462.0769846889, 'n_pcs': 4000, 'weight_scheme': 'exponential', 'weight_clip_max': 3.0, 'weight_exponential_beta': 9.626989919479628}. Best is trial 151 with value: 0.2607458721637643.
2026-05-31 23:03:36 | INFO | src.nested_cv_avggrm_weighted_unified | Trial 216 | outer=1 | alpha=1.618e+05 n_pcs=4000 (pc_topk) weight_search=on
2026-05-31 23:03:36 | INFO | src.nested_cv_avggrm_weighted_unified | Trial 216 | outer=1 | weight={'name': 'exponential', 'floor': 1e-06, 'clip_max': 3.0, 'beta': 9.760552211187365}
[I 2026-05-31 23:03:42,098] Trial 216 finished with value: 0.2606942870020452 and parameters: {'alpha': 161828.00401266397, 'n_pcs': 4000, 'weight_scheme': 'exponential', 'weight_clip_max': 3.0, 'weight_exponential_beta': 9.760552211187365}. Best is trial 151 with value: 0.2607458721637643.
2026-05-31 23:03:42 | INFO | src.nested_cv_avggrm_weighted_unified | Trial 217 | outer=1 | alpha=1.646e+05 n_pcs=4000 (pc_topk) weight_search=on
2026-05-31 23:03:42 | INFO | src.nested_cv_avggrm_weighted_unified | Trial 217 | outer=1 | weight={'name': 'exponential', 'floor': 1e-06, 'clip_max': 3.0, 'beta': 9.787187365768705}
[I 2026-05-31 23:03:47,834] Trial 217 finished with value: 0.2606854699358726 and parameters: {'alpha': 164637.69102353023, 'n_pcs': 4000, 'weight_scheme': 'exponential', 'weight_clip_max': 3.0, 'weight_exponential_beta': 9.787187365768705}. Best is trial 151 with value: 0.2607458721637643.
2026-05-31 23:03:47 | INFO | src.nested_cv_avggrm_weighted_unified | Trial 218 | outer=1 | alpha=1.611e+05 n_pcs=4000 (pc_topk) weight_search=on
2026-05-31 23:03:47 | INFO | src.nested_cv_avggrm_weighted_unified | Trial 218 | outer=1 | weight={'name': 'exponential', 'floor': 1e-06, 'clip_max': 3.0, 'beta': 9.475579558412939}
[I 2026-05-31 23:03:53,553] Trial 218 finished with value: 0.2607483577080956 and parameters: {'alpha': 161083.53030425895, 'n_pcs': 4000, 'weight_scheme': 'exponential', 'weight_clip_max': 3.0, 'weight_exponential_beta': 9.475579558412939}. Best is trial 218 with value: 0.2607483577080956.
2026-05-31 23:03:53 | INFO | src.nested_cv_avggrm_weighted_unified | OUTER 1 | new best trial 218 (mean inner r=0.2607) saved to outputs/final_results/e6_pc_ridge_avggrm/thr_wing/e6_pc_ridge_avggrm_thr_wing_best_trials/split_01_best_trial.json
2026-05-31 23:03:53 | INFO | src.nested_cv_avggrm_weighted_unified | Trial 219 | outer=1 | alpha=1.711e+05 n_pcs=4000 (pc_topk) weight_search=on
2026-05-31 23:03:53 | INFO | src.nested_cv_avggrm_weighted_unified | Trial 219 | outer=1 | weight={'name': 'linear', 'floor': 1e-06, 'clip_max': 3.0, 'min_weight': 0.7953739511427115, 'max_weight': 2.7517833860668404}
2026-05-31 23:03:58 | INFO | src.nested_cv_avggrm_weighted_unified | Trial 219 | outer=1 | pruned after 7/10 inner folds (mean r=0.2826)
[I 2026-05-31 23:03:58,205] Trial 219 pruned. 
2026-05-31 23:03:58 | INFO | src.nested_cv_avggrm_weighted_unified | Trial 220 | outer=1 | alpha=9.858e+04 n_pcs=3500 (pc_topk) weight_search=on
2026-05-31 23:03:58 | INFO | src.nested_cv_avggrm_weighted_unified | Trial 220 | outer=1 | weight={'name': 'exponential', 'floor': 1e-06, 'clip_max': 3.0, 'beta': 9.492929285709296}
[I 2026-05-31 23:04:03,101] Trial 220 finished with value: 0.257378538318551 and parameters: {'alpha': 98580.35041500369, 'n_pcs': 3500, 'weight_scheme': 'exponential', 'weight_clip_max': 3.0, 'weight_exponential_beta': 9.492929285709296}. Best is trial 218 with value: 0.2607483577080956.
2026-05-31 23:04:03 | INFO | src.nested_cv_avggrm_weighted_unified | Trial 221 | outer=1 | alpha=1.654e+05 n_pcs=4000 (pc_topk) weight_search=on
2026-05-31 23:04:03 | INFO | src.nested_cv_avggrm_weighted_unified | Trial 221 | outer=1 | weight={'name': 'exponential', 'floor': 1e-06, 'clip_max': 3.0, 'beta': 9.78532849781045}
[I 2026-05-31 23:04:08,832] Trial 221 finished with value: 0.2606869239606459 and parameters: {'alpha': 165386.45568936836, 'n_pcs': 4000, 'weight_scheme': 'exponential', 'weight_clip_max': 3.0, 'weight_exponential_beta': 9.78532849781045}. Best is trial 218 with value: 0.2607483577080956.
2026-05-31 23:04:08 | INFO | src.nested_cv_avggrm_weighted_unified | Trial 222 | outer=1 | alpha=1.596e+05 n_pcs=4000 (pc_topk) weight_search=on
2026-05-31 23:04:08 | INFO | src.nested_cv_avggrm_weighted_unified | Trial 222 | outer=1 | weight={'name': 'exponential', 'floor': 1e-06, 'clip_max': 3.0, 'beta': 9.80445758273519}
[I 2026-05-31 23:04:14,562] Trial 222 finished with value: 0.2606686002531642 and parameters: {'alpha': 159594.95049282903, 'n_pcs': 4000, 'weight_scheme': 'exponential', 'weight_clip_max': 3.0, 'weight_exponential_beta': 9.80445758273519}. Best is trial 218 with value: 0.2607483577080956.
2026-05-31 23:04:14 | INFO | src.nested_cv_avggrm_weighted_unified | Trial 223 | outer=1 | alpha=1.651e+05 n_pcs=4000 (pc_topk) weight_search=on
2026-05-31 23:04:14 | INFO | src.nested_cv_avggrm_weighted_unified | Trial 223 | outer=1 | weight={'name': 'exponential', 'floor': 1e-06, 'clip_max': 3.0, 'beta': 9.770632682325909}
[I 2026-05-31 23:04:20,296] Trial 223 finished with value: 0.26069355355172813 and parameters: {'alpha': 165127.3918881117, 'n_pcs': 4000, 'weight_scheme': 'exponential', 'weight_clip_max': 3.0, 'weight_exponential_beta': 9.770632682325909}. Best is trial 218 with value: 0.2607483577080956.
2026-05-31 23:04:20 | INFO | src.nested_cv_avggrm_weighted_unified | Trial 224 | outer=1 | alpha=1.645e+05 n_pcs=4000 (pc_topk) weight_search=on
2026-05-31 23:04:20 | INFO | src.nested_cv_avggrm_weighted_unified | Trial 224 | outer=1 | weight={'name': 'exponential', 'floor': 1e-06, 'clip_max': 3.0, 'beta': 9.830307484400373}
[I 2026-05-31 23:04:26,028] Trial 224 finished with value: 0.26066383086352146 and parameters: {'alpha': 164480.30290094434, 'n_pcs': 4000, 'weight_scheme': 'exponential', 'weight_clip_max': 3.0, 'weight_exponential_beta': 9.830307484400373}. Best is trial 218 with value: 0.2607483577080956.
2026-05-31 23:04:26 | INFO | src.nested_cv_avggrm_weighted_unified | Trial 225 | outer=1 | alpha=1.130e+05 n_pcs=4000 (pc_topk) weight_search=on
2026-05-31 23:04:26 | INFO | src.nested_cv_avggrm_weighted_unified | Trial 225 | outer=1 | weight={'name': 'exponential', 'floor': 1e-06, 'clip_max': 3.0, 'beta': 9.497658927891006}
[I 2026-05-31 23:04:31,761] Trial 225 finished with value: 0.26017146135326075 and parameters: {'alpha': 112962.40167275022, 'n_pcs': 4000, 'weight_scheme': 'exponential', 'weight_clip_max': 3.0, 'weight_exponential_beta': 9.497658927891006}. Best is trial 218 with value: 0.2607483577080956.
2026-05-31 23:04:31 | INFO | src.nested_cv_avggrm_weighted_unified | Trial 226 | outer=1 | alpha=1.638e+05 n_pcs=4000 (pc_topk) weight_search=on
2026-05-31 23:04:31 | INFO | src.nested_cv_avggrm_weighted_unified | Trial 226 | outer=1 | weight={'name': 'uniform', 'floor': 1e-06, 'clip_max': 3.0}
2026-05-31 23:04:34 | INFO | src.nested_cv_avggrm_weighted_unified | Trial 226 | outer=1 | pruned after 6/10 inner folds (mean r=0.2430)
[I 2026-05-31 23:04:34,693] Trial 226 pruned. 
2026-05-31 23:04:34 | INFO | src.nested_cv_avggrm_weighted_unified | Trial 227 | outer=1 | alpha=1.625e+05 n_pcs=4000 (pc_topk) weight_search=on
2026-05-31 23:04:34 | INFO | src.nested_cv_avggrm_weighted_unified | Trial 227 | outer=1 | weight={'name': 'exponential', 'floor': 1e-06, 'clip_max': 3.0, 'beta': 9.838335427891524}
[I 2026-05-31 23:04:40,436] Trial 227 finished with value: 0.26065547443021203 and parameters: {'alpha': 162473.70797398983, 'n_pcs': 4000, 'weight_scheme': 'exponential', 'weight_clip_max': 3.0, 'weight_exponential_beta': 9.838335427891524}. Best is trial 218 with value: 0.2607483577080956.
2026-05-31 23:04:40 | INFO | src.nested_cv_avggrm_weighted_unified | Trial 228 | outer=1 | alpha=1.198e+05 n_pcs=4000 (pc_topk) weight_search=on
2026-05-31 23:04:40 | INFO | src.nested_cv_avggrm_weighted_unified | Trial 228 | outer=1 | weight={'name': 'exponential', 'floor': 1e-06, 'clip_max': 3.0, 'beta': 9.48853198293673}
[I 2026-05-31 23:04:46,161] Trial 228 finished with value: 0.2603448044753213 and parameters: {'alpha': 119815.09065073075, 'n_pcs': 4000, 'weight_scheme': 'exponential', 'weight_clip_max': 3.0, 'weight_exponential_beta': 9.48853198293673}. Best is trial 218 with value: 0.2607483577080956.
2026-05-31 23:04:46 | INFO | src.nested_cv_avggrm_weighted_unified | Trial 229 | outer=1 | alpha=1.590e+05 n_pcs=1000 (pc_topk) weight_search=on
2026-05-31 23:04:46 | INFO | src.nested_cv_avggrm_weighted_unified | Trial 229 | outer=1 | weight={'name': 'exponential', 'floor': 1e-06, 'clip_max': 3.0, 'beta': 9.827693440115237}
[I 2026-05-31 23:04:48,785] Trial 229 finished with value: 0.2528746889675484 and parameters: {'alpha': 158958.02554739077, 'n_pcs': 1000, 'weight_scheme': 'exponential', 'weight_clip_max': 3.0, 'weight_exponential_beta': 9.827693440115237}. Best is trial 218 with value: 0.2607483577080956.
2026-05-31 23:04:48 | INFO | src.nested_cv_avggrm_weighted_unified | Trial 230 | outer=1 | alpha=2.739e+05 n_pcs=4000 (pc_topk) weight_search=on
2026-05-31 23:04:48 | INFO | src.nested_cv_avggrm_weighted_unified | Trial 230 | outer=1 | weight={'name': 'exponential', 'floor': 1e-06, 'clip_max': 3.0, 'beta': 9.591397233177274}
[I 2026-05-31 23:04:54,584] Trial 230 finished with value: 0.2597873955736615 and parameters: {'alpha': 273896.01349149196, 'n_pcs': 4000, 'weight_scheme': 'exponential', 'weight_clip_max': 3.0, 'weight_exponential_beta': 9.591397233177274}. Best is trial 218 with value: 0.2607483577080956.
2026-05-31 23:04:54 | INFO | src.nested_cv_avggrm_weighted_unified | Trial 231 | outer=1 | alpha=1.610e+05 n_pcs=4000 (pc_topk) weight_search=on
2026-05-31 23:04:54 | INFO | src.nested_cv_avggrm_weighted_unified | Trial 231 | outer=1 | weight={'name': 'exponential', 'floor': 1e-06, 'clip_max': 3.0, 'beta': 9.819426663148972}
[I 2026-05-31 23:05:00,341] Trial 231 finished with value: 0.2606640561302525 and parameters: {'alpha': 160951.8744353105, 'n_pcs': 4000, 'weight_scheme': 'exponential', 'weight_clip_max': 3.0, 'weight_exponential_beta': 9.819426663148972}. Best is trial 218 with value: 0.2607483577080956.
2026-05-31 23:05:00 | INFO | src.nested_cv_avggrm_weighted_unified | Trial 232 | outer=1 | alpha=1.665e+05 n_pcs=4000 (pc_topk) weight_search=on
2026-05-31 23:05:00 | INFO | src.nested_cv_avggrm_weighted_unified | Trial 232 | outer=1 | weight={'name': 'exponential', 'floor': 1e-06, 'clip_max': 3.0, 'beta': 9.503732966963705}
[I 2026-05-31 23:05:06,112] Trial 232 finished with value: 0.2607490501447128 and parameters: {'alpha': 166506.26987310412, 'n_pcs': 4000, 'weight_scheme': 'exponential', 'weight_clip_max': 3.0, 'weight_exponential_beta': 9.503732966963705}. Best is trial 232 with value: 0.2607490501447128.
2026-05-31 23:05:06 | INFO | src.nested_cv_avggrm_weighted_unified | OUTER 1 | new best trial 232 (mean inner r=0.2607) saved to outputs/final_results/e6_pc_ridge_avggrm/thr_wing/e6_pc_ridge_avggrm_thr_wing_best_trials/split_01_best_trial.json
2026-05-31 23:05:06 | INFO | src.nested_cv_avggrm_weighted_unified | Trial 233 | outer=1 | alpha=1.994e+05 n_pcs=4000 (pc_topk) weight_search=on
2026-05-31 23:05:06 | INFO | src.nested_cv_avggrm_weighted_unified | Trial 233 | outer=1 | weight={'name': 'exponential', 'floor': 1e-06, 'clip_max': 3.0, 'beta': 9.484987709732819}
[I 2026-05-31 23:05:11,996] Trial 233 finished with value: 0.2605967647812309 and parameters: {'alpha': 199383.78350297626, 'n_pcs': 4000, 'weight_scheme': 'exponential', 'weight_clip_max': 3.0, 'weight_exponential_beta': 9.484987709732819}. Best is trial 232 with value: 0.2607490501447128.
2026-05-31 23:05:12 | INFO | src.nested_cv_avggrm_weighted_unified | Trial 234 | outer=1 | alpha=1.810e+05 n_pcs=4000 (pc_topk) weight_search=on
2026-05-31 23:05:12 | INFO | src.nested_cv_avggrm_weighted_unified | Trial 234 | outer=1 | weight={'name': 'exponential', 'floor': 1e-06, 'clip_max': 3.0, 'beta': 9.59184013298978}
[I 2026-05-31 23:05:17,727] Trial 234 finished with value: 0.2607116241324182 and parameters: {'alpha': 180969.06465242562, 'n_pcs': 4000, 'weight_scheme': 'exponential', 'weight_clip_max': 3.0, 'weight_exponential_beta': 9.59184013298978}. Best is trial 232 with value: 0.2607490501447128.
2026-05-31 23:05:17 | INFO | src.nested_cv_avggrm_weighted_unified | Trial 235 | outer=1 | alpha=1.273e+05 n_pcs=4000 (pc_topk) weight_search=on
2026-05-31 23:05:17 | INFO | src.nested_cv_avggrm_weighted_unified | Trial 235 | outer=1 | weight={'name': 'exponential', 'floor': 1e-06, 'clip_max': 3.0, 'beta': 9.46381352840853}
[I 2026-05-31 23:05:23,449] Trial 235 finished with value: 0.2604923654691971 and parameters: {'alpha': 127298.97163070115, 'n_pcs': 4000, 'weight_scheme': 'exponential', 'weight_clip_max': 3.0, 'weight_exponential_beta': 9.46381352840853}. Best is trial 232 with value: 0.2607490501447128.
2026-05-31 23:05:23 | INFO | src.nested_cv_avggrm_weighted_unified | Trial 236 | outer=1 | alpha=1.605e+05 n_pcs=4000 (pc_topk) weight_search=on
2026-05-31 23:05:23 | INFO | src.nested_cv_avggrm_weighted_unified | Trial 236 | outer=1 | weight={'name': 'exponential', 'floor': 1e-06, 'clip_max': 3.0, 'beta': 9.614617630075825}
[I 2026-05-31 23:05:29,172] Trial 236 finished with value: 0.2607375827654182 and parameters: {'alpha': 160487.20337554952, 'n_pcs': 4000, 'weight_scheme': 'exponential', 'weight_clip_max': 3.0, 'weight_exponential_beta': 9.614617630075825}. Best is trial 232 with value: 0.2607490501447128.
2026-05-31 23:05:29 | INFO | src.nested_cv_avggrm_weighted_unified | Trial 237 | outer=1 | alpha=1.463e+05 n_pcs=4000 (pc_topk) weight_search=on
2026-05-31 23:05:29 | INFO | src.nested_cv_avggrm_weighted_unified | Trial 237 | outer=1 | weight={'name': 'exponential', 'floor': 1e-06, 'clip_max': 3.0, 'beta': 9.564922951214069}
[I 2026-05-31 23:05:34,902] Trial 237 finished with value: 0.260691969086311 and parameters: {'alpha': 146348.4398578044, 'n_pcs': 4000, 'weight_scheme': 'exponential', 'weight_clip_max': 3.0, 'weight_exponential_beta': 9.564922951214069}. Best is trial 232 with value: 0.2607490501447128.
2026-05-31 23:05:34 | INFO | src.nested_cv_avggrm_weighted_unified | Trial 238 | outer=1 | alpha=1.029e+05 n_pcs=4000 (pc_topk) weight_search=on
2026-05-31 23:05:34 | INFO | src.nested_cv_avggrm_weighted_unified | Trial 238 | outer=1 | weight={'name': 'exponential', 'floor': 1e-06, 'clip_max': 3.0, 'beta': 9.595902629827073}
[I 2026-05-31 23:05:40,641] Trial 238 finished with value: 0.25979699251213895 and parameters: {'alpha': 102931.304459105, 'n_pcs': 4000, 'weight_scheme': 'exponential', 'weight_clip_max': 3.0, 'weight_exponential_beta': 9.595902629827073}. Best is trial 232 with value: 0.2607490501447128.
2026-05-31 23:05:40 | INFO | src.nested_cv_avggrm_weighted_unified | Trial 239 | outer=1 | alpha=1.371e+05 n_pcs=4000 (pc_topk) weight_search=on
2026-05-31 23:05:40 | INFO | src.nested_cv_avggrm_weighted_unified | Trial 239 | outer=1 | weight={'name': 'exponential', 'floor': 1e-06, 'clip_max': 3.0, 'beta': 0.11728879350980037}
2026-05-31 23:05:44 | INFO | src.nested_cv_avggrm_weighted_unified | Trial 239 | outer=1 | pruned after 6/10 inner folds (mean r=0.2466)
[I 2026-05-31 23:05:44,095] Trial 239 pruned. 
2026-05-31 23:05:44 | INFO | src.nested_cv_avggrm_weighted_unified | Trial 240 | outer=1 | alpha=2.655e+05 n_pcs=3500 (pc_topk) weight_search=on
2026-05-31 23:05:44 | INFO | src.nested_cv_avggrm_weighted_unified | Trial 240 | outer=1 | weight={'name': 'exponential', 'floor': 1e-06, 'clip_max': 3.0, 'beta': 9.607888354641872}
[I 2026-05-31 23:05:48,958] Trial 240 finished with value: 0.2589039632311899 and parameters: {'alpha': 265528.54291013116, 'n_pcs': 3500, 'weight_scheme': 'exponential', 'weight_clip_max': 3.0, 'weight_exponential_beta': 9.607888354641872}. Best is trial 232 with value: 0.2607490501447128.
2026-05-31 23:05:48 | INFO | src.nested_cv_avggrm_weighted_unified | Trial 241 | outer=1 | alpha=1.545e+05 n_pcs=4000 (pc_topk) weight_search=on
2026-05-31 23:05:48 | INFO | src.nested_cv_avggrm_weighted_unified | Trial 241 | outer=1 | weight={'name': 'exponential', 'floor': 1e-06, 'clip_max': 3.0, 'beta': 9.813455061149442}
[I 2026-05-31 23:05:54,694] Trial 241 finished with value: 0.26064627710770827 and parameters: {'alpha': 154515.946791547, 'n_pcs': 4000, 'weight_scheme': 'exponential', 'weight_clip_max': 3.0, 'weight_exponential_beta': 9.813455061149442}. Best is trial 232 with value: 0.2607490501447128.
2026-05-31 23:05:54 | INFO | src.nested_cv_avggrm_weighted_unified | Trial 242 | outer=1 | alpha=1.600e+05 n_pcs=4000 (pc_topk) weight_search=on
2026-05-31 23:05:54 | INFO | src.nested_cv_avggrm_weighted_unified | Trial 242 | outer=1 | weight={'name': 'exponential', 'floor': 1e-06, 'clip_max': 3.0, 'beta': 9.458540325294148}
