[I 2026-06-01 13:32:47,853] Trial 118 finished with value: 0.22674187089824324 and parameters: {'alpha': 5660092.838665279, 'n_pcs': 4000, 'iw_method': 'pc_logistic', 'iw_clip_max': 4.0, 'iw_prob_clip': 0.006535070536286109, 'iw_n_components': 20, 'iw_logistic_c': 0.0006092968842244883, 'iw_pca_fit': 'combined', 'iw_solver': 'lbfgs', 'iw_rho': 0.85}. Best is trial 81 with value: 0.25357534381681857.
2026-06-01 13:32:47 | INFO | Trial 119 | outer=1 | alpha=3.916e+04 n_pcs=4000 (pc_topk) weight={'name': 'pc_logistic', 'floor': 1e-06, 'clip_max': 1.5, 'prob_clip': 0.003142311859354346, 'n_components': 100, 'logistic_c': 0.0002224220100770358, 'pca_fit': 'combined', 'solver': 'lbfgs', 'max_iter': 2000, 'fit_intercept': True, 'standardize_with_source': True, 'rho': 0.85}
[I 2026-06-01 13:33:03,076] Trial 119 finished with value: 0.24900123591368928 and parameters: {'alpha': 39160.27898481995, 'n_pcs': 4000, 'iw_method': 'pc_logistic', 'iw_clip_max': 1.5, 'iw_prob_clip': 0.003142311859354346, 'iw_n_components': 100, 'iw_logistic_c': 0.0002224220100770358, 'iw_pca_fit': 'combined', 'iw_solver': 'lbfgs', 'iw_rho': 0.85}. Best is trial 81 with value: 0.25357534381681857.
2026-06-01 13:33:03 | INFO | Trial 120 | outer=1 | alpha=5.319e+04 n_pcs=3500 (pc_topk) weight={'name': 'pc_logistic', 'floor': 1e-06, 'clip_max': 4.0, 'prob_clip': 0.0036439866127829785, 'n_components': 100, 'logistic_c': 0.0026195223830748995, 'pca_fit': 'combined', 'solver': 'lbfgs', 'max_iter': 2000, 'fit_intercept': True, 'standardize_with_source': True, 'rho': 0.85}
[I 2026-06-01 13:33:19,922] Trial 120 finished with value: 0.2477802403362582 and parameters: {'alpha': 53188.84950692374, 'n_pcs': 3500, 'iw_method': 'pc_logistic', 'iw_clip_max': 4.0, 'iw_prob_clip': 0.0036439866127829785, 'iw_n_components': 100, 'iw_logistic_c': 0.0026195223830748995, 'iw_pca_fit': 'combined', 'iw_solver': 'lbfgs', 'iw_rho': 0.85}. Best is trial 81 with value: 0.25357534381681857.
2026-06-01 13:33:19 | INFO | Trial 121 | outer=1 | alpha=9.428e+04 n_pcs=4000 (pc_topk) weight={'name': 'pc_logistic', 'floor': 1e-06, 'clip_max': 4.0, 'prob_clip': 0.004934772630113163, 'n_components': 100, 'logistic_c': 0.001556193019842433, 'pca_fit': 'combined', 'solver': 'lbfgs', 'max_iter': 2000, 'fit_intercept': True, 'standardize_with_source': True, 'rho': 0.85}
[I 2026-06-01 13:33:40,028] Trial 121 finished with value: 0.2518504396360808 and parameters: {'alpha': 94276.46609639365, 'n_pcs': 4000, 'iw_method': 'pc_logistic', 'iw_clip_max': 4.0, 'iw_prob_clip': 0.004934772630113163, 'iw_n_components': 100, 'iw_logistic_c': 0.001556193019842433, 'iw_pca_fit': 'combined', 'iw_solver': 'lbfgs', 'iw_rho': 0.85}. Best is trial 81 with value: 0.25357534381681857.
2026-06-01 13:33:40 | INFO | Trial 122 | outer=1 | alpha=9.640e+04 n_pcs=4000 (pc_topk) weight={'name': 'pc_logistic', 'floor': 1e-06, 'clip_max': 4.0, 'prob_clip': 0.005784724526788553, 'n_components': 100, 'logistic_c': 0.0012095734855524125, 'pca_fit': 'combined', 'solver': 'lbfgs', 'max_iter': 2000, 'fit_intercept': True, 'standardize_with_source': True, 'rho': 0.85}
[I 2026-06-01 13:33:59,966] Trial 122 finished with value: 0.2524471134255854 and parameters: {'alpha': 96398.28708179932, 'n_pcs': 4000, 'iw_method': 'pc_logistic', 'iw_clip_max': 4.0, 'iw_prob_clip': 0.005784724526788553, 'iw_n_components': 100, 'iw_logistic_c': 0.0012095734855524125, 'iw_pca_fit': 'combined', 'iw_solver': 'lbfgs', 'iw_rho': 0.85}. Best is trial 81 with value: 0.25357534381681857.
2026-06-01 13:33:59 | INFO | Trial 123 | outer=1 | alpha=1.123e+05 n_pcs=4000 (pc_topk) weight={'name': 'pc_logistic', 'floor': 1e-06, 'clip_max': 4.0, 'prob_clip': 0.005801466216140799, 'n_components': 100, 'logistic_c': 0.0012390701746820383, 'pca_fit': 'combined', 'solver': 'lbfgs', 'max_iter': 2000, 'fit_intercept': True, 'standardize_with_source': True, 'rho': 0.85}
[I 2026-06-01 13:34:19,436] Trial 123 finished with value: 0.25215604368444566 and parameters: {'alpha': 112335.37723692294, 'n_pcs': 4000, 'iw_method': 'pc_logistic', 'iw_clip_max': 4.0, 'iw_prob_clip': 0.005801466216140799, 'iw_n_components': 100, 'iw_logistic_c': 0.0012390701746820383, 'iw_pca_fit': 'combined', 'iw_solver': 'lbfgs', 'iw_rho': 0.85}. Best is trial 81 with value: 0.25357534381681857.
2026-06-01 13:34:19 | INFO | Trial 124 | outer=1 | alpha=1.004e+05 n_pcs=4000 (pc_topk) weight={'name': 'pc_logistic', 'floor': 1e-06, 'clip_max': 4.0, 'prob_clip': 0.004821474398472232, 'n_components': 100, 'logistic_c': 0.0012287393320201832, 'pca_fit': 'combined', 'solver': 'lbfgs', 'max_iter': 2000, 'fit_intercept': True, 'standardize_with_source': True, 'rho': 0.85}
[I 2026-06-01 13:34:39,740] Trial 124 finished with value: 0.25208172399390816 and parameters: {'alpha': 100388.79685367658, 'n_pcs': 4000, 'iw_method': 'pc_logistic', 'iw_clip_max': 4.0, 'iw_prob_clip': 0.004821474398472232, 'iw_n_components': 100, 'iw_logistic_c': 0.0012287393320201832, 'iw_pca_fit': 'combined', 'iw_solver': 'lbfgs', 'iw_rho': 0.85}. Best is trial 81 with value: 0.25357534381681857.
2026-06-01 13:34:39 | INFO | Trial 125 | outer=1 | alpha=1.027e+05 n_pcs=4000 (pc_topk) weight={'name': 'pc_logistic', 'floor': 1e-06, 'clip_max': 4.0, 'prob_clip': 0.005682734612504697, 'n_components': 100, 'logistic_c': 0.0012782162743471678, 'pca_fit': 'combined', 'solver': 'lbfgs', 'max_iter': 2000, 'fit_intercept': True, 'standardize_with_source': True, 'rho': 0.85}
[I 2026-06-01 13:34:58,733] Trial 125 finished with value: 0.2522181233552097 and parameters: {'alpha': 102680.026462732, 'n_pcs': 4000, 'iw_method': 'pc_logistic', 'iw_clip_max': 4.0, 'iw_prob_clip': 0.005682734612504697, 'iw_n_components': 100, 'iw_logistic_c': 0.0012782162743471678, 'iw_pca_fit': 'combined', 'iw_solver': 'lbfgs', 'iw_rho': 0.85}. Best is trial 81 with value: 0.25357534381681857.
2026-06-01 13:34:58 | INFO | Trial 126 | outer=1 | alpha=9.858e+04 n_pcs=3500 (pc_topk) weight={'name': 'pc_logistic', 'floor': 1e-06, 'clip_max': 4.0, 'prob_clip': 0.005672489127377584, 'n_components': 100, 'logistic_c': 0.0014785679655574659, 'pca_fit': 'combined', 'solver': 'lbfgs', 'max_iter': 2000, 'fit_intercept': True, 'standardize_with_source': True, 'rho': 0.85}
[I 2026-06-01 13:35:17,107] Trial 126 finished with value: 0.2508552182527995 and parameters: {'alpha': 98576.4446445769, 'n_pcs': 3500, 'iw_method': 'pc_logistic', 'iw_clip_max': 4.0, 'iw_prob_clip': 0.005672489127377584, 'iw_n_components': 100, 'iw_logistic_c': 0.0014785679655574659, 'iw_pca_fit': 'combined', 'iw_solver': 'lbfgs', 'iw_rho': 0.85}. Best is trial 81 with value: 0.25357534381681857.
2026-06-01 13:35:17 | INFO | Trial 127 | outer=1 | alpha=1.615e+05 n_pcs=4000 (pc_topk) weight={'name': 'pc_logistic', 'floor': 1e-06, 'clip_max': 4.0, 'prob_clip': 0.005002094693047154, 'n_components': 100, 'logistic_c': 0.001255640503932578, 'pca_fit': 'combined', 'solver': 'lbfgs', 'max_iter': 2000, 'fit_intercept': True, 'standardize_with_source': True, 'rho': 0.85}
[I 2026-06-01 13:35:35,665] Trial 127 finished with value: 0.2509061019637283 and parameters: {'alpha': 161528.11040876628, 'n_pcs': 4000, 'iw_method': 'pc_logistic', 'iw_clip_max': 4.0, 'iw_prob_clip': 0.005002094693047154, 'iw_n_components': 100, 'iw_logistic_c': 0.001255640503932578, 'iw_pca_fit': 'combined', 'iw_solver': 'lbfgs', 'iw_rho': 0.85}. Best is trial 81 with value: 0.25357534381681857.
2026-06-01 13:35:35 | INFO | Trial 128 | outer=1 | alpha=1.101e+05 n_pcs=3500 (pc_topk) weight={'name': 'pc_logistic', 'floor': 1e-06, 'clip_max': 4.0, 'prob_clip': 0.005836336974061704, 'n_components': 100, 'logistic_c': 0.003981108427083321, 'pca_fit': 'combined', 'solver': 'lbfgs', 'max_iter': 2000, 'fit_intercept': True, 'standardize_with_source': True, 'rho': 0.85}
[I 2026-06-01 13:35:56,325] Trial 128 finished with value: 0.2493943529907921 and parameters: {'alpha': 110081.39731760147, 'n_pcs': 3500, 'iw_method': 'pc_logistic', 'iw_clip_max': 4.0, 'iw_prob_clip': 0.005836336974061704, 'iw_n_components': 100, 'iw_logistic_c': 0.003981108427083321, 'iw_pca_fit': 'combined', 'iw_solver': 'lbfgs', 'iw_rho': 0.85}. Best is trial 81 with value: 0.25357534381681857.
2026-06-01 13:35:56 | INFO | Trial 129 | outer=1 | alpha=8.343e+04 n_pcs=4000 (pc_topk) weight={'name': 'uniform'}
[I 2026-06-01 13:36:03,448] Trial 129 finished with value: 0.24228220653030066 and parameters: {'alpha': 83428.40898589227, 'n_pcs': 4000, 'iw_method': 'uniform'}. Best is trial 81 with value: 0.25357534381681857.
2026-06-01 13:36:03 | INFO | Trial 130 | outer=1 | alpha=4.600e+04 n_pcs=4500 (pc_topk) weight={'name': 'pc_logistic', 'floor': 1e-06, 'clip_max': 4.0, 'prob_clip': 0.004836526402888814, 'n_components': 100, 'logistic_c': 0.001856620379136308, 'pca_fit': 'combined', 'solver': 'lbfgs', 'max_iter': 2000, 'fit_intercept': True, 'standardize_with_source': True, 'rho': 0.85}
[I 2026-06-01 13:36:27,218] Trial 130 finished with value: 0.2515803923434625 and parameters: {'alpha': 46003.37418246608, 'n_pcs': 4500, 'iw_method': 'pc_logistic', 'iw_clip_max': 4.0, 'iw_prob_clip': 0.004836526402888814, 'iw_n_components': 100, 'iw_logistic_c': 0.001856620379136308, 'iw_pca_fit': 'combined', 'iw_solver': 'lbfgs', 'iw_rho': 0.85}. Best is trial 81 with value: 0.25357534381681857.
2026-06-01 13:36:27 | INFO | Trial 131 | outer=1 | alpha=4.446e+04 n_pcs=4500 (pc_topk) weight={'name': 'pc_logistic', 'floor': 1e-06, 'clip_max': 4.0, 'prob_clip': 0.004817106879318424, 'n_components': 100, 'logistic_c': 0.002775482129746805, 'pca_fit': 'combined', 'solver': 'lbfgs', 'max_iter': 2000, 'fit_intercept': True, 'standardize_with_source': True, 'rho': 0.85}
[I 2026-06-01 13:36:50,570] Trial 131 finished with value: 0.2511405897977171 and parameters: {'alpha': 44460.79913560932, 'n_pcs': 4500, 'iw_method': 'pc_logistic', 'iw_clip_max': 4.0, 'iw_prob_clip': 0.004817106879318424, 'iw_n_components': 100, 'iw_logistic_c': 0.002775482129746805, 'iw_pca_fit': 'combined', 'iw_solver': 'lbfgs', 'iw_rho': 0.85}. Best is trial 81 with value: 0.25357534381681857.
2026-06-01 13:36:50 | INFO | Trial 132 | outer=1 | alpha=6.292e+04 n_pcs=4500 (pc_topk) weight={'name': 'pc_logistic', 'floor': 1e-06, 'clip_max': 4.0, 'prob_clip': 0.005343858588128132, 'n_components': 100, 'logistic_c': 0.0019640469838265165, 'pca_fit': 'combined', 'solver': 'lbfgs', 'max_iter': 2000, 'fit_intercept': True, 'standardize_with_source': True, 'rho': 0.85}
[I 2026-06-01 13:37:12,565] Trial 132 finished with value: 0.2522430953363056 and parameters: {'alpha': 62918.340247736975, 'n_pcs': 4500, 'iw_method': 'pc_logistic', 'iw_clip_max': 4.0, 'iw_prob_clip': 0.005343858588128132, 'iw_n_components': 100, 'iw_logistic_c': 0.0019640469838265165, 'iw_pca_fit': 'combined', 'iw_solver': 'lbfgs', 'iw_rho': 0.85}. Best is trial 81 with value: 0.25357534381681857.
2026-06-01 13:37:12 | INFO | Trial 133 | outer=1 | alpha=5.819e+04 n_pcs=4500 (pc_topk) weight={'name': 'pc_logistic', 'floor': 1e-06, 'clip_max': 4.0, 'prob_clip': 0.0050805618954166635, 'n_components': 100, 'logistic_c': 0.001973300650644721, 'pca_fit': 'combined', 'solver': 'lbfgs', 'max_iter': 2000, 'fit_intercept': True, 'standardize_with_source': True, 'rho': 0.85}
[I 2026-06-01 13:37:35,385] Trial 133 finished with value: 0.252151163384032 and parameters: {'alpha': 58191.80701270873, 'n_pcs': 4500, 'iw_method': 'pc_logistic', 'iw_clip_max': 4.0, 'iw_prob_clip': 0.0050805618954166635, 'iw_n_components': 100, 'iw_logistic_c': 0.001973300650644721, 'iw_pca_fit': 'combined', 'iw_solver': 'lbfgs', 'iw_rho': 0.85}. Best is trial 81 with value: 0.25357534381681857.
2026-06-01 13:37:35 | INFO | Trial 134 | outer=1 | alpha=5.843e+04 n_pcs=4500 (pc_topk) weight={'name': 'pc_logistic', 'floor': 1e-06, 'clip_max': 4.0, 'prob_clip': 0.005390071822797728, 'n_components': 100, 'logistic_c': 0.000941815020108807, 'pca_fit': 'combined', 'solver': 'lbfgs', 'max_iter': 2000, 'fit_intercept': True, 'standardize_with_source': True, 'rho': 0.85}
[I 2026-06-01 13:37:55,904] Trial 134 finished with value: 0.25301986761050216 and parameters: {'alpha': 58432.55109319296, 'n_pcs': 4500, 'iw_method': 'pc_logistic', 'iw_clip_max': 4.0, 'iw_prob_clip': 0.005390071822797728, 'iw_n_components': 100, 'iw_logistic_c': 0.000941815020108807, 'iw_pca_fit': 'combined', 'iw_solver': 'lbfgs', 'iw_rho': 0.85}. Best is trial 81 with value: 0.25357534381681857.
2026-06-01 13:37:55 | INFO | Trial 135 | outer=1 | alpha=5.931e+04 n_pcs=4500 (pc_topk) weight={'name': 'pc_logistic', 'floor': 1e-06, 'clip_max': 4.0, 'prob_clip': 0.005524040557121201, 'n_components': 100, 'logistic_c': 0.0008915590476900925, 'pca_fit': 'combined', 'solver': 'lbfgs', 'max_iter': 2000, 'fit_intercept': True, 'standardize_with_source': True, 'rho': 0.85}
[I 2026-06-01 13:38:16,251] Trial 135 finished with value: 0.2531415418524329 and parameters: {'alpha': 59305.92467570002, 'n_pcs': 4500, 'iw_method': 'pc_logistic', 'iw_clip_max': 4.0, 'iw_prob_clip': 0.005524040557121201, 'iw_n_components': 100, 'iw_logistic_c': 0.0008915590476900925, 'iw_pca_fit': 'combined', 'iw_solver': 'lbfgs', 'iw_rho': 0.85}. Best is trial 81 with value: 0.25357534381681857.
2026-06-01 13:38:16 | INFO | Trial 136 | outer=1 | alpha=6.418e+04 n_pcs=4500 (pc_topk) weight={'name': 'pc_logistic', 'floor': 1e-06, 'clip_max': 12.0, 'prob_clip': 0.005714457350231967, 'n_components': 100, 'logistic_c': 0.0008381978416614901, 'pca_fit': 'combined', 'solver': 'lbfgs', 'max_iter': 2000, 'fit_intercept': True, 'standardize_with_source': True, 'rho': 0.85}
[I 2026-06-01 13:38:37,549] Trial 136 finished with value: 0.24650683268343268 and parameters: {'alpha': 64176.90228173468, 'n_pcs': 4500, 'iw_method': 'pc_logistic', 'iw_clip_max': 12.0, 'iw_prob_clip': 0.005714457350231967, 'iw_n_components': 100, 'iw_logistic_c': 0.0008381978416614901, 'iw_pca_fit': 'combined', 'iw_solver': 'lbfgs', 'iw_rho': 0.85}. Best is trial 81 with value: 0.25357534381681857.
2026-06-01 13:38:37 | INFO | Trial 137 | outer=1 | alpha=3.524e+04 n_pcs=5000 (pc_topk) weight={'name': 'pc_logistic', 'floor': 1e-06, 'clip_max': 4.0, 'prob_clip': 0.00748196849700681, 'n_components': 60, 'logistic_c': 0.0010897280761197614, 'pca_fit': 'combined', 'solver': 'lbfgs', 'max_iter': 2000, 'fit_intercept': True, 'standardize_with_source': True, 'rho': 0.85}
[I 2026-06-01 13:38:59,759] Trial 137 finished with value: 0.24795788897176524 and parameters: {'alpha': 35243.13662425671, 'n_pcs': 5000, 'iw_method': 'pc_logistic', 'iw_clip_max': 4.0, 'iw_prob_clip': 0.00748196849700681, 'iw_n_components': 60, 'iw_logistic_c': 0.0010897280761197614, 'iw_pca_fit': 'combined', 'iw_solver': 'lbfgs', 'iw_rho': 0.85}. Best is trial 81 with value: 0.25357534381681857.
2026-06-01 13:38:59 | INFO | Trial 138 | outer=1 | alpha=2.580e+04 n_pcs=4500 (pc_topk) weight={'name': 'pc_logistic', 'floor': 1e-06, 'clip_max': 4.0, 'prob_clip': 0.0053885632917506305, 'n_components': 100, 'logistic_c': 0.0008678382201201013, 'pca_fit': 'combined', 'solver': 'lbfgs', 'max_iter': 2000, 'fit_intercept': True, 'standardize_with_source': True, 'rho': 0.85}
[I 2026-06-01 13:39:19,857] Trial 138 finished with value: 0.2475516284540135 and parameters: {'alpha': 25801.100998364996, 'n_pcs': 4500, 'iw_method': 'pc_logistic', 'iw_clip_max': 4.0, 'iw_prob_clip': 0.0053885632917506305, 'iw_n_components': 100, 'iw_logistic_c': 0.0008678382201201013, 'iw_pca_fit': 'combined', 'iw_solver': 'lbfgs', 'iw_rho': 0.85}. Best is trial 81 with value: 0.25357534381681857.
2026-06-01 13:39:19 | INFO | Trial 139 | outer=1 | alpha=5.613e+04 n_pcs=4500 (pc_topk) weight={'name': 'pc_logistic', 'floor': 1e-06, 'clip_max': 4.0, 'prob_clip': 0.006141510446781302, 'n_components': 100, 'logistic_c': 0.0022141560877129785, 'pca_fit': 'combined', 'solver': 'lbfgs', 'max_iter': 2000, 'fit_intercept': True, 'standardize_with_source': True, 'rho': 0.85}
[I 2026-06-01 13:39:43,399] Trial 139 finished with value: 0.25212233507932585 and parameters: {'alpha': 56127.43591131009, 'n_pcs': 4500, 'iw_method': 'pc_logistic', 'iw_clip_max': 4.0, 'iw_prob_clip': 0.006141510446781302, 'iw_n_components': 100, 'iw_logistic_c': 0.0022141560877129785, 'iw_pca_fit': 'combined', 'iw_solver': 'lbfgs', 'iw_rho': 0.85}. Best is trial 81 with value: 0.25357534381681857.
2026-06-01 13:39:43 | INFO | Trial 140 | outer=1 | alpha=5.189e+04 n_pcs=5000 (pc_topk) weight={'name': 'pc_logistic', 'floor': 1e-06, 'clip_max': 4.0, 'prob_clip': 0.006242163965912384, 'n_components': 100, 'logistic_c': 0.002295435802420612, 'pca_fit': 'combined', 'solver': 'lbfgs', 'max_iter': 2000, 'fit_intercept': True, 'standardize_with_source': True, 'rho': 0.85}
[I 2026-06-01 13:40:08,786] Trial 140 finished with value: 0.25101032447528915 and parameters: {'alpha': 51888.01239522255, 'n_pcs': 5000, 'iw_method': 'pc_logistic', 'iw_clip_max': 4.0, 'iw_prob_clip': 0.006242163965912384, 'iw_n_components': 100, 'iw_logistic_c': 0.002295435802420612, 'iw_pca_fit': 'combined', 'iw_solver': 'lbfgs', 'iw_rho': 0.85}. Best is trial 81 with value: 0.25357534381681857.
2026-06-01 13:40:08 | INFO | Trial 141 | outer=1 | alpha=6.366e+04 n_pcs=4500 (pc_topk) weight={'name': 'pc_logistic', 'floor': 1e-06, 'clip_max': 4.0, 'prob_clip': 0.004231258225809675, 'n_components': 100, 'logistic_c': 0.0006808207303413511, 'pca_fit': 'combined', 'solver': 'lbfgs', 'max_iter': 2000, 'fit_intercept': True, 'standardize_with_source': True, 'rho': 0.85}
[I 2026-06-01 13:40:28,715] Trial 141 finished with value: 0.253002317478295 and parameters: {'alpha': 63659.960320950486, 'n_pcs': 4500, 'iw_method': 'pc_logistic', 'iw_clip_max': 4.0, 'iw_prob_clip': 0.004231258225809675, 'iw_n_components': 100, 'iw_logistic_c': 0.0006808207303413511, 'iw_pca_fit': 'combined', 'iw_solver': 'lbfgs', 'iw_rho': 0.85}. Best is trial 81 with value: 0.25357534381681857.
2026-06-01 13:40:28 | INFO | Trial 142 | outer=1 | alpha=6.025e+04 n_pcs=4500 (pc_topk) weight={'name': 'pc_logistic', 'floor': 1e-06, 'clip_max': 4.0, 'prob_clip': 0.004285827951538432, 'n_components': 100, 'logistic_c': 0.0004640331076952684, 'pca_fit': 'combined', 'solver': 'lbfgs', 'max_iter': 2000, 'fit_intercept': True, 'standardize_with_source': True, 'rho': 0.85}
[I 2026-06-01 13:40:48,653] Trial 142 finished with value: 0.25343596273242364 and parameters: {'alpha': 60248.84236300342, 'n_pcs': 4500, 'iw_method': 'pc_logistic', 'iw_clip_max': 4.0, 'iw_prob_clip': 0.004285827951538432, 'iw_n_components': 100, 'iw_logistic_c': 0.0004640331076952684, 'iw_pca_fit': 'combined', 'iw_solver': 'lbfgs', 'iw_rho': 0.85}. Best is trial 81 with value: 0.25357534381681857.
2026-06-01 13:40:48 | INFO | Trial 143 | outer=1 | alpha=6.493e+04 n_pcs=4500 (pc_topk) weight={'name': 'pc_logistic', 'floor': 1e-06, 'clip_max': 4.0, 'prob_clip': 0.004254903123486108, 'n_components': 100, 'logistic_c': 0.0033779397850772466, 'pca_fit': 'combined', 'solver': 'lbfgs', 'max_iter': 2000, 'fit_intercept': True, 'standardize_with_source': True, 'rho': 0.85}
[I 2026-06-01 13:41:13,658] Trial 143 finished with value: 0.25156058728934955 and parameters: {'alpha': 64932.07095600579, 'n_pcs': 4500, 'iw_method': 'pc_logistic', 'iw_clip_max': 4.0, 'iw_prob_clip': 0.004254903123486108, 'iw_n_components': 100, 'iw_logistic_c': 0.0033779397850772466, 'iw_pca_fit': 'combined', 'iw_solver': 'lbfgs', 'iw_rho': 0.85}. Best is trial 81 with value: 0.25357534381681857.
2026-06-01 13:41:13 | INFO | Trial 144 | outer=1 | alpha=4.011e+04 n_pcs=4500 (pc_topk) weight={'name': 'pc_logistic', 'floor': 1e-06, 'clip_max': 4.0, 'prob_clip': 0.007055106607638901, 'n_components': 100, 'logistic_c': 0.0003619088213243888, 'pca_fit': 'combined', 'solver': 'lbfgs', 'max_iter': 2000, 'fit_intercept': True, 'standardize_with_source': True, 'rho': 0.85}
[I 2026-06-01 13:41:32,922] Trial 144 finished with value: 0.252747552237792 and parameters: {'alpha': 40105.5852223338, 'n_pcs': 4500, 'iw_method': 'pc_logistic', 'iw_clip_max': 4.0, 'iw_prob_clip': 0.007055106607638901, 'iw_n_components': 100, 'iw_logistic_c': 0.0003619088213243888, 'iw_pca_fit': 'combined', 'iw_solver': 'lbfgs', 'iw_rho': 0.85}. Best is trial 81 with value: 0.25357534381681857.
2026-06-01 13:41:32 | INFO | Trial 145 | outer=1 | alpha=2.172e+04 n_pcs=4500 (pc_topk) weight={'name': 'pc_logistic', 'floor': 1e-06, 'clip_max': 4.0, 'prob_clip': 0.007125321210395598, 'n_components': 100, 'logistic_c': 0.00046839953616535033, 'pca_fit': 'combined', 'solver': 'lbfgs', 'max_iter': 2000, 'fit_intercept': True, 'standardize_with_source': True, 'rho': 0.85}
[I 2026-06-01 13:41:49,871] Trial 145 finished with value: 0.24633866503893528 and parameters: {'alpha': 21723.16566430683, 'n_pcs': 4500, 'iw_method': 'pc_logistic', 'iw_clip_max': 4.0, 'iw_prob_clip': 0.007125321210395598, 'iw_n_components': 100, 'iw_logistic_c': 0.00046839953616535033, 'iw_pca_fit': 'combined', 'iw_solver': 'lbfgs', 'iw_rho': 0.85}. Best is trial 81 with value: 0.25357534381681857.
2026-06-01 13:41:49 | INFO | Trial 146 | outer=1 | alpha=4.413e+04 n_pcs=4500 (pc_topk) weight={'name': 'pc_logistic', 'floor': 1e-06, 'clip_max': 4.0, 'prob_clip': 0.0037837439540102744, 'n_components': 100, 'logistic_c': 0.00044138977807534464, 'pca_fit': 'combined', 'solver': 'lbfgs', 'max_iter': 2000, 'fit_intercept': True, 'standardize_with_source': True, 'rho': 0.85}
