[I 2026-05-31 23:09:08,357] Trial 277 finished with value: 0.26062639754754163 and parameters: {'alpha': 139486.45223970673, 'n_pcs': 4000, 'weight_scheme': 'exponential', 'weight_clip_max': 3.0, 'weight_exponential_beta': 9.219782342942956}. Best is trial 232 with value: 0.2607490501447128.
2026-05-31 23:09:08 | INFO | src.nested_cv_avggrm_weighted_unified | Trial 278 | outer=1 | alpha=1.745e+05 n_pcs=3500 (pc_topk) weight_search=on
2026-05-31 23:09:08 | INFO | src.nested_cv_avggrm_weighted_unified | Trial 278 | outer=1 | weight={'name': 'linear', 'floor': 1e-06, 'clip_max': 3.0, 'min_weight': 0.5519853790644625, 'max_weight': 3.3674923272539603}
[I 2026-05-31 23:09:13,258] Trial 278 finished with value: 0.2493084488166732 and parameters: {'alpha': 174527.32032739843, 'n_pcs': 3500, 'weight_scheme': 'linear', 'weight_clip_max': 3.0, 'weight_linear_min_weight': 0.5519853790644625, 'weight_linear_max_weight': 3.3674923272539603}. Best is trial 232 with value: 0.2607490501447128.
2026-05-31 23:09:13 | INFO | src.nested_cv_avggrm_weighted_unified | Trial 279 | outer=1 | alpha=1.102e+05 n_pcs=4000 (pc_topk) weight_search=on
2026-05-31 23:09:13 | INFO | src.nested_cv_avggrm_weighted_unified | Trial 279 | outer=1 | weight={'name': 'exponential', 'floor': 1e-06, 'clip_max': 20.0, 'beta': 9.832589013154546}
[I 2026-05-31 23:09:18,978] Trial 279 finished with value: 0.2471527125270966 and parameters: {'alpha': 110197.48501455062, 'n_pcs': 4000, 'weight_scheme': 'exponential', 'weight_clip_max': 20.0, 'weight_exponential_beta': 9.832589013154546}. Best is trial 232 with value: 0.2607490501447128.
2026-05-31 23:09:18 | INFO | src.nested_cv_avggrm_weighted_unified | Trial 280 | outer=1 | alpha=2.008e+05 n_pcs=4000 (pc_topk) weight_search=on
2026-05-31 23:09:18 | INFO | src.nested_cv_avggrm_weighted_unified | Trial 280 | outer=1 | weight={'name': 'uniform', 'floor': 1e-06, 'clip_max': 3.0}
2026-05-31 23:09:21 | INFO | src.nested_cv_avggrm_weighted_unified | Trial 280 | outer=1 | pruned after 6/10 inner folds (mean r=0.2408)
[I 2026-05-31 23:09:21,912] Trial 280 pruned. 
2026-05-31 23:09:21 | INFO | src.nested_cv_avggrm_weighted_unified | Trial 281 | outer=1 | alpha=1.518e+05 n_pcs=4000 (pc_topk) weight_search=on
2026-05-31 23:09:21 | INFO | src.nested_cv_avggrm_weighted_unified | Trial 281 | outer=1 | weight={'name': 'exponential', 'floor': 1e-06, 'clip_max': 3.0, 'beta': 9.51481206239294}
[I 2026-05-31 23:09:27,634] Trial 281 finished with value: 0.26072635305084313 and parameters: {'alpha': 151848.7616406935, 'n_pcs': 4000, 'weight_scheme': 'exponential', 'weight_clip_max': 3.0, 'weight_exponential_beta': 9.51481206239294}. Best is trial 232 with value: 0.2607490501447128.
2026-05-31 23:09:27 | INFO | src.nested_cv_avggrm_weighted_unified | Trial 282 | outer=1 | alpha=1.266e+05 n_pcs=4000 (pc_topk) weight_search=on
2026-05-31 23:09:27 | INFO | src.nested_cv_avggrm_weighted_unified | Trial 282 | outer=1 | weight={'name': 'exponential', 'floor': 1e-06, 'clip_max': 3.0, 'beta': 9.467678345445568}
[I 2026-05-31 23:09:33,373] Trial 282 finished with value: 0.2604806126641331 and parameters: {'alpha': 126627.64465327974, 'n_pcs': 4000, 'weight_scheme': 'exponential', 'weight_clip_max': 3.0, 'weight_exponential_beta': 9.467678345445568}. Best is trial 232 with value: 0.2607490501447128.
2026-05-31 23:09:33 | INFO | src.nested_cv_avggrm_weighted_unified | Trial 283 | outer=1 | alpha=1.454e+05 n_pcs=4000 (pc_topk) weight_search=on
2026-05-31 23:09:33 | INFO | src.nested_cv_avggrm_weighted_unified | Trial 283 | outer=1 | weight={'name': 'exponential', 'floor': 1e-06, 'clip_max': 3.0, 'beta': 9.05721140927062}
[I 2026-05-31 23:09:39,145] Trial 283 finished with value: 0.26060257268150516 and parameters: {'alpha': 145376.37946553115, 'n_pcs': 4000, 'weight_scheme': 'exponential', 'weight_clip_max': 3.0, 'weight_exponential_beta': 9.05721140927062}. Best is trial 232 with value: 0.2607490501447128.
2026-05-31 23:09:39 | INFO | src.nested_cv_avggrm_weighted_unified | Trial 284 | outer=1 | alpha=2.424e+05 n_pcs=4000 (pc_topk) weight_search=on
2026-05-31 23:09:39 | INFO | src.nested_cv_avggrm_weighted_unified | Trial 284 | outer=1 | weight={'name': 'exponential', 'floor': 1e-06, 'clip_max': 3.0, 'beta': 4.90053744097492}
[I 2026-05-31 23:09:44,881] Trial 284 finished with value: 0.2548876162127216 and parameters: {'alpha': 242390.87737075266, 'n_pcs': 4000, 'weight_scheme': 'exponential', 'weight_clip_max': 3.0, 'weight_exponential_beta': 4.90053744097492}. Best is trial 232 with value: 0.2607490501447128.
2026-05-31 23:09:44 | INFO | src.nested_cv_avggrm_weighted_unified | Trial 285 | outer=1 | alpha=1.813e+05 n_pcs=4000 (pc_topk) weight_search=on
2026-05-31 23:09:44 | INFO | src.nested_cv_avggrm_weighted_unified | Trial 285 | outer=1 | weight={'name': 'exponential', 'floor': 1e-06, 'clip_max': 3.0, 'beta': 9.338159512040338}
[I 2026-05-31 23:09:50,623] Trial 285 finished with value: 0.2606834151261514 and parameters: {'alpha': 181271.2090448311, 'n_pcs': 4000, 'weight_scheme': 'exponential', 'weight_clip_max': 3.0, 'weight_exponential_beta': 9.338159512040338}. Best is trial 232 with value: 0.2607490501447128.
2026-05-31 23:09:50 | INFO | src.nested_cv_avggrm_weighted_unified | Trial 286 | outer=1 | alpha=1.089e+05 n_pcs=3000 (pc_topk) weight_search=on
2026-05-31 23:09:50 | INFO | src.nested_cv_avggrm_weighted_unified | Trial 286 | outer=1 | weight={'name': 'exponential', 'floor': 1e-06, 'clip_max': 3.0, 'beta': 9.55880987938677}
[I 2026-05-31 23:09:55,093] Trial 286 finished with value: 0.2570892597752482 and parameters: {'alpha': 108854.73422969769, 'n_pcs': 3000, 'weight_scheme': 'exponential', 'weight_clip_max': 3.0, 'weight_exponential_beta': 9.55880987938677}. Best is trial 232 with value: 0.2607490501447128.
2026-05-31 23:09:55 | INFO | src.nested_cv_avggrm_weighted_unified | Trial 287 | outer=1 | alpha=1.613e+05 n_pcs=3500 (pc_topk) weight_search=on
2026-05-31 23:09:55 | INFO | src.nested_cv_avggrm_weighted_unified | Trial 287 | outer=1 | weight={'name': 'exponential', 'floor': 1e-06, 'clip_max': 3.0, 'beta': 9.59060299179768}
[I 2026-05-31 23:09:59,957] Trial 287 finished with value: 0.2592188993713088 and parameters: {'alpha': 161329.1235196029, 'n_pcs': 3500, 'weight_scheme': 'exponential', 'weight_clip_max': 3.0, 'weight_exponential_beta': 9.59060299179768}. Best is trial 232 with value: 0.2607490501447128.
2026-05-31 23:09:59 | INFO | src.nested_cv_avggrm_weighted_unified | Trial 288 | outer=1 | alpha=2.031e+05 n_pcs=4000 (pc_topk) weight_search=on
2026-05-31 23:09:59 | INFO | src.nested_cv_avggrm_weighted_unified | Trial 288 | outer=1 | weight={'name': 'exponential', 'floor': 1e-06, 'clip_max': 3.0, 'beta': 9.234369859147137}
[I 2026-05-31 23:10:05,818] Trial 288 finished with value: 0.26048826641864803 and parameters: {'alpha': 203140.48232255204, 'n_pcs': 4000, 'weight_scheme': 'exponential', 'weight_clip_max': 3.0, 'weight_exponential_beta': 9.234369859147137}. Best is trial 232 with value: 0.2607490501447128.
2026-05-31 23:10:05 | INFO | src.nested_cv_avggrm_weighted_unified | Trial 289 | outer=1 | alpha=1.312e+05 n_pcs=4000 (pc_topk) weight_search=on
2026-05-31 23:10:05 | INFO | src.nested_cv_avggrm_weighted_unified | Trial 289 | outer=1 | weight={'name': 'exponential', 'floor': 1e-06, 'clip_max': 3.0, 'beta': 9.453815167008191}
[I 2026-05-31 23:10:11,557] Trial 289 finished with value: 0.26055301687761095 and parameters: {'alpha': 131206.3709526289, 'n_pcs': 4000, 'weight_scheme': 'exponential', 'weight_clip_max': 3.0, 'weight_exponential_beta': 9.453815167008191}. Best is trial 232 with value: 0.2607490501447128.
2026-05-31 23:10:11 | INFO | src.nested_cv_avggrm_weighted_unified | Trial 290 | outer=1 | alpha=2.230e+05 n_pcs=4000 (pc_topk) weight_search=on
2026-05-31 23:10:11 | INFO | src.nested_cv_avggrm_weighted_unified | Trial 290 | outer=1 | weight={'name': 'exponential', 'floor': 1e-06, 'clip_max': 3.0, 'beta': 9.994886079232938}
[I 2026-05-31 23:10:17,279] Trial 290 finished with value: 0.2602432352111391 and parameters: {'alpha': 222975.08753857625, 'n_pcs': 4000, 'weight_scheme': 'exponential', 'weight_clip_max': 3.0, 'weight_exponential_beta': 9.994886079232938}. Best is trial 232 with value: 0.2607490501447128.
2026-05-31 23:10:17 | INFO | src.nested_cv_avggrm_weighted_unified | Trial 291 | outer=1 | alpha=1.523e+03 n_pcs=4000 (pc_topk) weight_search=on
2026-05-31 23:10:17 | INFO | src.nested_cv_avggrm_weighted_unified | Trial 291 | outer=1 | weight={'name': 'exponential', 'floor': 1e-06, 'clip_max': 3.0, 'beta': 9.73576326442358}
[I 2026-05-31 23:10:23,026] Trial 291 finished with value: 0.15556329334174995 and parameters: {'alpha': 1522.7276287273787, 'n_pcs': 4000, 'weight_scheme': 'exponential', 'weight_clip_max': 3.0, 'weight_exponential_beta': 9.73576326442358}. Best is trial 232 with value: 0.2607490501447128.
2026-05-31 23:10:23 | INFO | src.nested_cv_avggrm_weighted_unified | Trial 292 | outer=1 | alpha=3.100e+05 n_pcs=4000 (pc_topk) weight_search=on
2026-05-31 23:10:23 | INFO | src.nested_cv_avggrm_weighted_unified | Trial 292 | outer=1 | weight={'name': 'exponential', 'floor': 1e-06, 'clip_max': 3.0, 'beta': 9.068392476099408}
[I 2026-05-31 23:10:28,748] Trial 292 finished with value: 0.25898482706738546 and parameters: {'alpha': 309954.05481754174, 'n_pcs': 4000, 'weight_scheme': 'exponential', 'weight_clip_max': 3.0, 'weight_exponential_beta': 9.068392476099408}. Best is trial 232 with value: 0.2607490501447128.
2026-05-31 23:10:28 | INFO | src.nested_cv_avggrm_weighted_unified | Trial 293 | outer=1 | alpha=1.564e+05 n_pcs=4000 (pc_topk) weight_search=on
2026-05-31 23:10:28 | INFO | src.nested_cv_avggrm_weighted_unified | Trial 293 | outer=1 | weight={'name': 'exponential', 'floor': 1e-06, 'clip_max': 3.0, 'beta': 9.612130260928808}
[I 2026-05-31 23:10:34,485] Trial 293 finished with value: 0.260729204229443 and parameters: {'alpha': 156407.30221970583, 'n_pcs': 4000, 'weight_scheme': 'exponential', 'weight_clip_max': 3.0, 'weight_exponential_beta': 9.612130260928808}. Best is trial 232 with value: 0.2607490501447128.
2026-05-31 23:10:34 | INFO | src.nested_cv_avggrm_weighted_unified | Trial 294 | outer=1 | alpha=1.264e+05 n_pcs=4000 (pc_topk) weight_search=on
2026-05-31 23:10:34 | INFO | src.nested_cv_avggrm_weighted_unified | Trial 294 | outer=1 | weight={'name': 'exponential', 'floor': 1e-06, 'clip_max': 3.0, 'beta': 9.38875307206207}
[I 2026-05-31 23:10:40,198] Trial 294 finished with value: 0.26048686290506007 and parameters: {'alpha': 126398.51270417486, 'n_pcs': 4000, 'weight_scheme': 'exponential', 'weight_clip_max': 3.0, 'weight_exponential_beta': 9.38875307206207}. Best is trial 232 with value: 0.2607490501447128.
2026-05-31 23:10:40 | INFO | src.nested_cv_avggrm_weighted_unified | Trial 295 | outer=1 | alpha=2.568e+06 n_pcs=4000 (pc_topk) weight_search=on
2026-05-31 23:10:40 | INFO | src.nested_cv_avggrm_weighted_unified | Trial 295 | outer=1 | weight={'name': 'exponential', 'floor': 1e-06, 'clip_max': 3.0, 'beta': 8.854655031553447}
2026-05-31 23:10:44 | INFO | src.nested_cv_avggrm_weighted_unified | Trial 295 | outer=1 | pruned after 7/10 inner folds (mean r=0.2834)
[I 2026-05-31 23:10:44,191] Trial 295 pruned. 
2026-05-31 23:10:44 | INFO | src.nested_cv_avggrm_weighted_unified | Trial 296 | outer=1 | alpha=1.514e+05 n_pcs=4000 (pc_topk) weight_search=on
2026-05-31 23:10:44 | INFO | src.nested_cv_avggrm_weighted_unified | Trial 296 | outer=1 | weight={'name': 'exponential', 'floor': 1e-06, 'clip_max': 3.0, 'beta': 9.57776642895624}
[I 2026-05-31 23:10:49,916] Trial 296 finished with value: 0.26071743222110033 and parameters: {'alpha': 151363.30706802692, 'n_pcs': 4000, 'weight_scheme': 'exponential', 'weight_clip_max': 3.0, 'weight_exponential_beta': 9.57776642895624}. Best is trial 232 with value: 0.2607490501447128.
2026-05-31 23:10:49 | INFO | src.nested_cv_avggrm_weighted_unified | Trial 297 | outer=1 | alpha=9.936e+04 n_pcs=4000 (pc_topk) weight_search=on
2026-05-31 23:10:49 | INFO | src.nested_cv_avggrm_weighted_unified | Trial 297 | outer=1 | weight={'name': 'exponential', 'floor': 1e-06, 'clip_max': None, 'beta': 9.156931188365965}
[I 2026-05-31 23:10:55,607] Trial 297 finished with value: 0.23984698912546115 and parameters: {'alpha': 99356.54018674514, 'n_pcs': 4000, 'weight_scheme': 'exponential', 'weight_clip_max': None, 'weight_exponential_beta': 9.156931188365965}. Best is trial 232 with value: 0.2607490501447128.
2026-05-31 23:10:55 | INFO | src.nested_cv_avggrm_weighted_unified | Trial 298 | outer=1 | alpha=1.480e+05 n_pcs=4000 (pc_topk) weight_search=on
2026-05-31 23:10:55 | INFO | src.nested_cv_avggrm_weighted_unified | Trial 298 | outer=1 | weight={'name': 'exponential', 'floor': 1e-06, 'clip_max': 3.0, 'beta': 9.540888286813507}
[I 2026-05-31 23:11:01,344] Trial 298 finished with value: 0.26070612523235154 and parameters: {'alpha': 147983.44916128175, 'n_pcs': 4000, 'weight_scheme': 'exponential', 'weight_clip_max': 3.0, 'weight_exponential_beta': 9.540888286813507}. Best is trial 232 with value: 0.2607490501447128.
2026-05-31 23:11:01 | INFO | src.nested_cv_avggrm_weighted_unified | Trial 299 | outer=1 | alpha=1.931e+05 n_pcs=3500 (pc_topk) weight_search=on
2026-05-31 23:11:01 | INFO | src.nested_cv_avggrm_weighted_unified | Trial 299 | outer=1 | weight={'name': 'exponential', 'floor': 1e-06, 'clip_max': 3.0, 'beta': 9.378605033679486}
[I 2026-05-31 23:11:06,223] Trial 299 finished with value: 0.2593624219463154 and parameters: {'alpha': 193116.7250192766, 'n_pcs': 3500, 'weight_scheme': 'exponential', 'weight_clip_max': 3.0, 'weight_exponential_beta': 9.378605033679486}. Best is trial 232 with value: 0.2607490501447128.
2026-05-31 23:11:06 | INFO | src.nested_cv_avggrm_weighted_unified | OUTER 1 best (inner mean r=0.2607): {'model_type': 'pc_ridge', 'alpha': 166506.26987310412, 'n_pcs': 4000, 'use_snp_selection': True, 'num_snps': 4000, 'feature_mode': 'pc_topk', 'weighting': {'name': 'exponential', 'floor': 1e-06, 'clip_max': 3.0, 'beta': 9.503732966963705}}
2026-05-31 23:11:06 | INFO | src.nested_cv_avggrm_weighted_unified | OUTER 1 TEST r = 0.1364
2026-05-31 23:11:06 | INFO | src.nested_cv_avggrm_weighted_unified | OUTER 1 incremental summary saved to outputs/final_results/e6_pc_ridge_avggrm/thr_wing/e6_pc_ridge_avggrm_thr_wing_results.json
2026-05-31 23:11:06 | INFO | src.nested_cv_avggrm_weighted_unified | OUTER 2: test_size=92 island=1 (Myken)
2026-05-31 23:11:06 | INFO | src.nested_cv_avggrm_weighted_unified | OUTER 2: inner LOIO validation islands: 0(Nesøy), 2(Træna), 3(Selvær), 4(Gjerøy), 5(Hestmannøy), 6(Indre Kvarøy), 7(Onøy og Lurøy), 8(Lovund), 9(Sleneset), 10(Aldra), 11(Leka), 12(Vega), 13(Vikna), 14(Lauvøya)
2026-05-31 23:11:06 | INFO | src.nested_cv_avggrm_weighted_unified | OUTER 2: using top 10 related inner validation islands for tuning: 3(Selvær, avgGRM=0.0212), 2(Træna, avgGRM=0.0152), 8(Lovund, avgGRM=0.0084), 0(Nesøy, avgGRM=0.0066), 9(Sleneset, avgGRM=0.0044), 7(Onøy og Lurøy, avgGRM=0.0024), 5(Hestmannøy, avgGRM=0.0014), 6(Indre Kvarøy, avgGRM=0.0009), 4(Gjerøy, avgGRM=-0.0004), 10(Aldra, avgGRM=-0.0036)
[I 2026-05-31 23:11:06,821] A new study created in memory with name: ridge_inner_outer1
2026-05-31 23:11:06 | INFO | src.nested_cv_avggrm_weighted_unified | Trial 0 | outer=2 | alpha=1.137e+05 n_pcs=4000 (pc_topk) weight_search=on
2026-05-31 23:11:06 | INFO | src.nested_cv_avggrm_weighted_unified | Trial 0 | outer=2 | weight={'name': 'uniform', 'floor': 1e-06, 'clip_max': None}
[I 2026-05-31 23:11:11,882] Trial 0 finished with value: 0.2317837058793958 and parameters: {'alpha': 113703.38004442609, 'n_pcs': 4000, 'weight_scheme': 'uniform', 'weight_clip_max': None}. Best is trial 0 with value: 0.2317837058793958.
2026-05-31 23:11:11 | INFO | src.nested_cv_avggrm_weighted_unified | OUTER 2 | new best trial 0 (mean inner r=0.2318) saved to outputs/final_results/e6_pc_ridge_avggrm/thr_wing/e6_pc_ridge_avggrm_thr_wing_best_trials/split_02_best_trial.json
2026-05-31 23:11:11 | INFO | src.nested_cv_avggrm_weighted_unified | Trial 1 | outer=2 | alpha=1.682e+06 n_pcs=2000 (pc_topk) weight_search=on
2026-05-31 23:11:11 | INFO | src.nested_cv_avggrm_weighted_unified | Trial 1 | outer=2 | weight={'name': 'exponential', 'floor': 1e-06, 'clip_max': 3.0, 'beta': 8.711469579953913}
[I 2026-05-31 23:11:14,820] Trial 1 finished with value: 0.24252049586843816 and parameters: {'alpha': 1682385.170967095, 'n_pcs': 2000, 'weight_scheme': 'exponential', 'weight_clip_max': 3.0, 'weight_exponential_beta': 8.711469579953913}. Best is trial 1 with value: 0.24252049586843816.
2026-05-31 23:11:14 | INFO | src.nested_cv_avggrm_weighted_unified | OUTER 2 | new best trial 1 (mean inner r=0.2425) saved to outputs/final_results/e6_pc_ridge_avggrm/thr_wing/e6_pc_ridge_avggrm_thr_wing_best_trials/split_02_best_trial.json
2026-05-31 23:11:14 | INFO | src.nested_cv_avggrm_weighted_unified | Trial 2 | outer=2 | alpha=2.757e+03 n_pcs=2000 (pc_topk) weight_search=on
2026-05-31 23:11:14 | INFO | src.nested_cv_avggrm_weighted_unified | Trial 2 | outer=2 | weight={'name': 'linear', 'floor': 1e-06, 'clip_max': 20.0, 'min_weight': 0.12918170299726892, 'max_weight': 3.9862564805616327}
[I 2026-05-31 23:11:17,398] Trial 2 finished with value: 0.1624949850561488 and parameters: {'alpha': 2757.0504493185063, 'n_pcs': 2000, 'weight_scheme': 'linear', 'weight_clip_max': 20.0, 'weight_linear_min_weight': 0.12918170299726892, 'weight_linear_max_weight': 3.9862564805616327}. Best is trial 1 with value: 0.24252049586843816.
2026-05-31 23:11:17 | INFO | src.nested_cv_avggrm_weighted_unified | Trial 3 | outer=2 | alpha=1.776e+03 n_pcs=4000 (pc_topk) weight_search=on
2026-05-31 23:11:17 | INFO | src.nested_cv_avggrm_weighted_unified | Trial 3 | outer=2 | weight={'name': 'exponential', 'floor': 1e-06, 'clip_max': 10.0, 'beta': 0.563604612251006}
[I 2026-05-31 23:11:23,206] Trial 3 finished with value: 0.13262922481620162 and parameters: {'alpha': 1775.825123718637, 'n_pcs': 4000, 'weight_scheme': 'exponential', 'weight_clip_max': 10.0, 'weight_exponential_beta': 0.563604612251006}. Best is trial 1 with value: 0.24252049586843816.
2026-05-31 23:11:23 | INFO | src.nested_cv_avggrm_weighted_unified | Trial 4 | outer=2 | alpha=1.835e+04 n_pcs=5000 (pc_topk) weight_search=on
2026-05-31 23:11:23 | INFO | src.nested_cv_avggrm_weighted_unified | Trial 4 | outer=2 | weight={'name': 'exponential', 'floor': 1e-06, 'clip_max': None, 'beta': 9.957095048208117}
[I 2026-05-31 23:11:31,325] Trial 4 finished with value: 0.22454679023044663 and parameters: {'alpha': 18351.68801260339, 'n_pcs': 5000, 'weight_scheme': 'exponential', 'weight_clip_max': None, 'weight_exponential_beta': 9.957095048208117}. Best is trial 1 with value: 0.24252049586843816.
2026-05-31 23:11:31 | INFO | src.nested_cv_avggrm_weighted_unified | Trial 5 | outer=2 | alpha=9.696e+03 n_pcs=1000 (pc_topk) weight_search=on
2026-05-31 23:11:31 | INFO | src.nested_cv_avggrm_weighted_unified | Trial 5 | outer=2 | weight={'name': 'exponential', 'floor': 1e-06, 'clip_max': 3.0, 'beta': 1.5726039441128932}
2026-05-31 23:11:32 | INFO | src.nested_cv_avggrm_weighted_unified | Trial 5 | outer=2 | pruned after 6/10 inner folds (mean r=0.1773)
[I 2026-05-31 23:11:32,181] Trial 5 pruned. 
2026-05-31 23:11:32 | INFO | src.nested_cv_avggrm_weighted_unified | Trial 6 | outer=2 | alpha=6.320e+04 n_pcs=2500 (pc_topk) weight_search=on
2026-05-31 23:11:32 | INFO | src.nested_cv_avggrm_weighted_unified | Trial 6 | outer=2 | weight={'name': 'uniform', 'floor': 1e-06, 'clip_max': 10.0}
[I 2026-05-31 23:11:34,938] Trial 6 finished with value: 0.22944399601934123 and parameters: {'alpha': 63199.5851103866, 'n_pcs': 2500, 'weight_scheme': 'uniform', 'weight_clip_max': 10.0}. Best is trial 1 with value: 0.24252049586843816.
2026-05-31 23:11:34 | INFO | src.nested_cv_avggrm_weighted_unified | Trial 7 | outer=2 | alpha=4.681e+04 n_pcs=2500 (pc_topk) weight_search=on
2026-05-31 23:11:34 | INFO | src.nested_cv_avggrm_weighted_unified | Trial 7 | outer=2 | weight={'name': 'linear', 'floor': 1e-06, 'clip_max': 3.0, 'min_weight': 0.13798029304672477, 'max_weight': 3.0957974174373546}
[I 2026-05-31 23:11:37,918] Trial 7 finished with value: 0.23081616834045363 and parameters: {'alpha': 46806.97703257331, 'n_pcs': 2500, 'weight_scheme': 'linear', 'weight_clip_max': 3.0, 'weight_linear_min_weight': 0.13798029304672477, 'weight_linear_max_weight': 3.0957974174373546}. Best is trial 1 with value: 0.24252049586843816.
2026-05-31 23:11:37 | INFO | src.nested_cv_avggrm_weighted_unified | Trial 8 | outer=2 | alpha=5.456e+04 n_pcs=3000 (pc_topk) weight_search=on
2026-05-31 23:11:37 | INFO | src.nested_cv_avggrm_weighted_unified | Trial 8 | outer=2 | weight={'name': 'linear', 'floor': 1e-06, 'clip_max': 5.0, 'min_weight': 0.6690067570691431, 'max_weight': 4.8744640334054115}
[I 2026-05-31 23:11:41,776] Trial 8 finished with value: 0.234382631089334 and parameters: {'alpha': 54559.68395210245, 'n_pcs': 3000, 'weight_scheme': 'linear', 'weight_clip_max': 5.0, 'weight_linear_min_weight': 0.6690067570691431, 'weight_linear_max_weight': 4.8744640334054115}. Best is trial 1 with value: 0.24252049586843816.
2026-05-31 23:11:41 | INFO | src.nested_cv_avggrm_weighted_unified | Trial 9 | outer=2 | alpha=8.868e+03 n_pcs=2000 (pc_topk) weight_search=on
2026-05-31 23:11:41 | INFO | src.nested_cv_avggrm_weighted_unified | Trial 9 | outer=2 | weight={'name': 'linear', 'floor': 1e-06, 'clip_max': 20.0, 'min_weight': 0.861124149305412, 'max_weight': 4.702809729786679}
2026-05-31 23:11:43 | INFO | src.nested_cv_avggrm_weighted_unified | Trial 9 | outer=2 | pruned after 6/10 inner folds (mean r=0.1703)
