[I 2026-06-01 19:51:02,695] Trial 89 finished with value: 0.22761834511028808 and parameters: {'alpha': 113063.12871845308, 'n_pcs': 5000, 'iw_method': 'uniform'}. Best is trial 62 with value: 0.2325481020969798.
2026-06-01 19:51:02 | INFO | Trial 90 | outer=6 | alpha=1.216e+03 n_pcs=4500 (pc_topk) weight={'name': 'uniform'}
[I 2026-06-01 19:51:10,628] Trial 90 finished with value: 0.13950989453874268 and parameters: {'alpha': 1215.6941365409461, 'n_pcs': 4500, 'iw_method': 'uniform'}. Best is trial 62 with value: 0.2325481020969798.
2026-06-01 19:51:10 | INFO | Trial 91 | outer=6 | alpha=4.544e+04 n_pcs=4500 (pc_topk) weight={'name': 'uniform'}
[I 2026-06-01 19:51:18,537] Trial 91 finished with value: 0.23254675282804166 and parameters: {'alpha': 45435.12607696237, 'n_pcs': 4500, 'iw_method': 'uniform'}. Best is trial 62 with value: 0.2325481020969798.
2026-06-01 19:51:18 | INFO | Trial 92 | outer=6 | alpha=4.960e+04 n_pcs=4500 (pc_topk) weight={'name': 'uniform'}
[I 2026-06-01 19:51:26,553] Trial 92 finished with value: 0.23252180171094827 and parameters: {'alpha': 49599.2828153913, 'n_pcs': 4500, 'iw_method': 'uniform'}. Best is trial 62 with value: 0.2325481020969798.
2026-06-01 19:51:26 | INFO | Trial 93 | outer=6 | alpha=5.237e+04 n_pcs=4000 (pc_topk) weight={'name': 'uniform'}
[I 2026-06-01 19:51:32,957] Trial 93 finished with value: 0.23211304880681422 and parameters: {'alpha': 52368.391414211095, 'n_pcs': 4000, 'iw_method': 'uniform'}. Best is trial 62 with value: 0.2325481020969798.
2026-06-01 19:51:32 | INFO | Trial 94 | outer=6 | alpha=3.238e+04 n_pcs=4500 (pc_topk) weight={'name': 'uniform'}
[I 2026-06-01 19:51:41,296] Trial 94 finished with value: 0.23178478176429892 and parameters: {'alpha': 32377.070402675512, 'n_pcs': 4500, 'iw_method': 'uniform'}. Best is trial 62 with value: 0.2325481020969798.
2026-06-01 19:51:41 | INFO | Trial 95 | outer=6 | alpha=6.998e+04 n_pcs=5000 (pc_topk) weight={'name': 'uniform'}
[I 2026-06-01 19:51:50,070] Trial 95 finished with value: 0.23061874650742725 and parameters: {'alpha': 69981.73790756769, 'n_pcs': 5000, 'iw_method': 'uniform'}. Best is trial 62 with value: 0.2325481020969798.
2026-06-01 19:51:50 | INFO | Trial 96 | outer=6 | alpha=8.802e+04 n_pcs=2500 (pc_topk) weight={'name': 'uniform'}
[I 2026-06-01 19:51:53,820] Trial 96 finished with value: 0.22678198398223715 and parameters: {'alpha': 88022.6574427429, 'n_pcs': 2500, 'iw_method': 'uniform'}. Best is trial 62 with value: 0.2325481020969798.
2026-06-01 19:51:53 | INFO | Trial 97 | outer=6 | alpha=4.917e+04 n_pcs=4000 (pc_topk) weight={'name': 'uniform'}
[I 2026-06-01 19:52:00,310] Trial 97 finished with value: 0.23209430623843735 and parameters: {'alpha': 49168.88556783548, 'n_pcs': 4000, 'iw_method': 'uniform'}. Best is trial 62 with value: 0.2325481020969798.
2026-06-01 19:52:00 | INFO | Trial 98 | outer=6 | alpha=2.705e+04 n_pcs=4500 (pc_topk) weight={'name': 'pc_logistic', 'floor': 1e-06, 'clip_max': 1.5, 'prob_clip': 0.025073278281794273, 'n_components': 100, 'logistic_c': 0.37895450179579326, 'pca_fit': 'combined', 'solver': 'lbfgs', 'max_iter': 2000, 'fit_intercept': True, 'standardize_with_source': True, 'rho': 0.5}
[I 2026-06-01 19:52:27,752] Trial 98 finished with value: 0.23251860009452358 and parameters: {'alpha': 27045.88875878102, 'n_pcs': 4500, 'iw_method': 'pc_logistic', 'iw_clip_max': 1.5, 'iw_prob_clip': 0.025073278281794273, 'iw_n_components': 100, 'iw_logistic_c': 0.37895450179579326, 'iw_pca_fit': 'combined', 'iw_solver': 'lbfgs', 'iw_rho': 0.5}. Best is trial 62 with value: 0.2325481020969798.
2026-06-01 19:52:27 | INFO | Trial 99 | outer=6 | alpha=2.194e+04 n_pcs=4500 (pc_topk) weight={'name': 'pc_logistic', 'floor': 1e-06, 'clip_max': 1.5, 'prob_clip': 0.02590994961088944, 'n_components': 100, 'logistic_c': 0.31559464488269134, 'pca_fit': 'combined', 'solver': 'lbfgs', 'max_iter': 2000, 'fit_intercept': True, 'standardize_with_source': True, 'rho': 0.5}
[I 2026-06-01 19:52:54,955] Trial 99 finished with value: 0.230518822065957 and parameters: {'alpha': 21935.460060415047, 'n_pcs': 4500, 'iw_method': 'pc_logistic', 'iw_clip_max': 1.5, 'iw_prob_clip': 0.02590994961088944, 'iw_n_components': 100, 'iw_logistic_c': 0.31559464488269134, 'iw_pca_fit': 'combined', 'iw_solver': 'lbfgs', 'iw_rho': 0.5}. Best is trial 62 with value: 0.2325481020969798.
2026-06-01 19:52:54 | INFO | Trial 100 | outer=6 | alpha=1.094e+04 n_pcs=4500 (pc_topk) weight={'name': 'pc_logistic', 'floor': 1e-06, 'clip_max': 1.5, 'prob_clip': 0.024007460516374264, 'n_components': 100, 'logistic_c': 0.0010555649530664378, 'pca_fit': 'combined', 'solver': 'lbfgs', 'max_iter': 2000, 'fit_intercept': True, 'standardize_with_source': True, 'rho': 0.5}
[I 2026-06-01 19:53:13,518] Trial 100 finished with value: 0.21910723949280514 and parameters: {'alpha': 10940.176543444191, 'n_pcs': 4500, 'iw_method': 'pc_logistic', 'iw_clip_max': 1.5, 'iw_prob_clip': 0.024007460516374264, 'iw_n_components': 100, 'iw_logistic_c': 0.0010555649530664378, 'iw_pca_fit': 'combined', 'iw_solver': 'lbfgs', 'iw_rho': 0.5}. Best is trial 62 with value: 0.2325481020969798.
2026-06-01 19:53:13 | INFO | Trial 101 | outer=6 | alpha=2.520e+04 n_pcs=4500 (pc_topk) weight={'name': 'pc_logistic', 'floor': 1e-06, 'clip_max': 1.5, 'prob_clip': 0.005571858530682648, 'n_components': 100, 'logistic_c': 0.8292881208629359, 'pca_fit': 'combined', 'solver': 'lbfgs', 'max_iter': 2000, 'fit_intercept': True, 'standardize_with_source': True, 'rho': 0.5}
[I 2026-06-01 19:53:42,688] Trial 101 finished with value: 0.23115396503021063 and parameters: {'alpha': 25202.81564197408, 'n_pcs': 4500, 'iw_method': 'pc_logistic', 'iw_clip_max': 1.5, 'iw_prob_clip': 0.005571858530682648, 'iw_n_components': 100, 'iw_logistic_c': 0.8292881208629359, 'iw_pca_fit': 'combined', 'iw_solver': 'lbfgs', 'iw_rho': 0.5}. Best is trial 62 with value: 0.2325481020969798.
2026-06-01 19:53:42 | INFO | Trial 102 | outer=6 | alpha=3.180e+04 n_pcs=4500 (pc_topk) weight={'name': 'pc_logistic', 'floor': 1e-06, 'clip_max': 2.5, 'prob_clip': 0.0025469518522554216, 'n_components': 80, 'logistic_c': 0.025886256097907415, 'pca_fit': 'combined', 'solver': 'lbfgs', 'max_iter': 2000, 'fit_intercept': True, 'standardize_with_source': True, 'rho': 0.7}
[I 2026-06-01 19:54:09,888] Trial 102 finished with value: 0.22883594683288272 and parameters: {'alpha': 31798.876199629027, 'n_pcs': 4500, 'iw_method': 'pc_logistic', 'iw_clip_max': 2.5, 'iw_prob_clip': 0.0025469518522554216, 'iw_n_components': 80, 'iw_logistic_c': 0.025886256097907415, 'iw_pca_fit': 'combined', 'iw_solver': 'lbfgs', 'iw_rho': 0.7}. Best is trial 62 with value: 0.2325481020969798.
2026-06-01 19:54:09 | INFO | Trial 103 | outer=6 | alpha=6.311e+04 n_pcs=4500 (pc_topk) weight={'name': 'pc_logistic', 'floor': 1e-06, 'clip_max': 4.0, 'prob_clip': 0.008372110140484128, 'n_components': 20, 'logistic_c': 1.5466125954033771, 'pca_fit': 'combined', 'solver': 'lbfgs', 'max_iter': 2000, 'fit_intercept': True, 'standardize_with_source': True, 'rho': 0.3}
[I 2026-06-01 19:54:31,068] Trial 103 finished with value: 0.23335976869494104 and parameters: {'alpha': 63112.74089705214, 'n_pcs': 4500, 'iw_method': 'pc_logistic', 'iw_clip_max': 4.0, 'iw_prob_clip': 0.008372110140484128, 'iw_n_components': 20, 'iw_logistic_c': 1.5466125954033771, 'iw_pca_fit': 'combined', 'iw_solver': 'lbfgs', 'iw_rho': 0.3}. Best is trial 103 with value: 0.23335976869494104.
2026-06-01 19:54:31 | INFO | Trial 104 | outer=6 | alpha=5.956e+04 n_pcs=5000 (pc_topk) weight={'name': 'pc_logistic', 'floor': 1e-06, 'clip_max': 4.0, 'prob_clip': 0.00924078887504485, 'n_components': 20, 'logistic_c': 1.515101790327772, 'pca_fit': 'combined', 'solver': 'lbfgs', 'max_iter': 2000, 'fit_intercept': True, 'standardize_with_source': True, 'rho': 0.3}
[I 2026-06-01 19:54:52,276] Trial 104 finished with value: 0.23238109432298643 and parameters: {'alpha': 59555.80089570296, 'n_pcs': 5000, 'iw_method': 'pc_logistic', 'iw_clip_max': 4.0, 'iw_prob_clip': 0.00924078887504485, 'iw_n_components': 20, 'iw_logistic_c': 1.515101790327772, 'iw_pca_fit': 'combined', 'iw_solver': 'lbfgs', 'iw_rho': 0.3}. Best is trial 103 with value: 0.23335976869494104.
2026-06-01 19:54:52 | INFO | Trial 105 | outer=6 | alpha=1.531e+04 n_pcs=4000 (pc_topk) weight={'name': 'pc_logistic', 'floor': 1e-06, 'clip_max': 4.0, 'prob_clip': 0.02842430017050342, 'n_components': 20, 'logistic_c': 0.034344735601639496, 'pca_fit': 'combined', 'solver': 'lbfgs', 'max_iter': 2000, 'fit_intercept': True, 'standardize_with_source': True, 'rho': 0.3}
[I 2026-06-01 19:55:10,064] Trial 105 finished with value: 0.22294807541157668 and parameters: {'alpha': 15306.847257915319, 'n_pcs': 4000, 'iw_method': 'pc_logistic', 'iw_clip_max': 4.0, 'iw_prob_clip': 0.02842430017050342, 'iw_n_components': 20, 'iw_logistic_c': 0.034344735601639496, 'iw_pca_fit': 'combined', 'iw_solver': 'lbfgs', 'iw_rho': 0.3}. Best is trial 103 with value: 0.23335976869494104.
2026-06-01 19:55:10 | INFO | Trial 106 | outer=6 | alpha=1.255e+05 n_pcs=4500 (pc_topk) weight={'name': 'pc_logistic', 'floor': 1e-06, 'clip_max': 4.0, 'prob_clip': 0.01608658765942226, 'n_components': 20, 'logistic_c': 1.1512856356035177, 'pca_fit': 'combined', 'solver': 'lbfgs', 'max_iter': 2000, 'fit_intercept': True, 'standardize_with_source': True, 'rho': 0.3}
[I 2026-06-01 19:55:30,841] Trial 106 finished with value: 0.23213472153490508 and parameters: {'alpha': 125475.77083508973, 'n_pcs': 4500, 'iw_method': 'pc_logistic', 'iw_clip_max': 4.0, 'iw_prob_clip': 0.01608658765942226, 'iw_n_components': 20, 'iw_logistic_c': 1.1512856356035177, 'iw_pca_fit': 'combined', 'iw_solver': 'lbfgs', 'iw_rho': 0.3}. Best is trial 103 with value: 0.23335976869494104.
2026-06-01 19:55:30 | INFO | Trial 107 | outer=6 | alpha=4.706e+04 n_pcs=500 (pc_topk) weight={'name': 'pc_logistic', 'floor': 1e-06, 'clip_max': 4.0, 'prob_clip': 0.006156575909898804, 'n_components': 10, 'logistic_c': 0.0027823590111624536, 'pca_fit': 'combined', 'solver': 'lbfgs', 'max_iter': 2000, 'fit_intercept': True, 'standardize_with_source': True, 'rho': 0.3}
[I 2026-06-01 19:55:40,261] Trial 107 finished with value: 0.19204599658413085 and parameters: {'alpha': 47063.028431739396, 'n_pcs': 500, 'iw_method': 'pc_logistic', 'iw_clip_max': 4.0, 'iw_prob_clip': 0.006156575909898804, 'iw_n_components': 10, 'iw_logistic_c': 0.0027823590111624536, 'iw_pca_fit': 'combined', 'iw_solver': 'lbfgs', 'iw_rho': 0.3}. Best is trial 103 with value: 0.23335976869494104.
2026-06-01 19:55:40 | INFO | Trial 108 | outer=6 | alpha=7.092e+04 n_pcs=4500 (pc_topk) weight={'name': 'pc_logistic', 'floor': 1e-06, 'clip_max': 1.5, 'prob_clip': 0.03399467292256382, 'n_components': 60, 'logistic_c': 0.27240852625040374, 'pca_fit': 'combined', 'solver': 'lbfgs', 'max_iter': 2000, 'fit_intercept': True, 'standardize_with_source': True, 'rho': 0.5}
[I 2026-06-01 19:56:04,964] Trial 108 finished with value: 0.23595167441312664 and parameters: {'alpha': 70921.67115979375, 'n_pcs': 4500, 'iw_method': 'pc_logistic', 'iw_clip_max': 1.5, 'iw_prob_clip': 0.03399467292256382, 'iw_n_components': 60, 'iw_logistic_c': 0.27240852625040374, 'iw_pca_fit': 'combined', 'iw_solver': 'lbfgs', 'iw_rho': 0.5}. Best is trial 108 with value: 0.23595167441312664.
2026-06-01 19:56:04 | INFO | Trial 109 | outer=6 | alpha=1.715e+05 n_pcs=5000 (pc_topk) weight={'name': 'pc_logistic', 'floor': 1e-06, 'clip_max': 1.5, 'prob_clip': 0.03642418157355608, 'n_components': 60, 'logistic_c': 0.2721809770192124, 'pca_fit': 'combined', 'solver': 'lbfgs', 'max_iter': 2000, 'fit_intercept': True, 'standardize_with_source': True, 'rho': 0.5}
[I 2026-06-01 19:56:31,319] Trial 109 finished with value: 0.2297329679100907 and parameters: {'alpha': 171493.11811403985, 'n_pcs': 5000, 'iw_method': 'pc_logistic', 'iw_clip_max': 1.5, 'iw_prob_clip': 0.03642418157355608, 'iw_n_components': 60, 'iw_logistic_c': 0.2721809770192124, 'iw_pca_fit': 'combined', 'iw_solver': 'lbfgs', 'iw_rho': 0.5}. Best is trial 108 with value: 0.23595167441312664.
2026-06-01 19:56:31 | INFO | Trial 110 | outer=6 | alpha=7.447e+04 n_pcs=4000 (pc_topk) weight={'name': 'pc_logistic', 'floor': 1e-06, 'clip_max': 1.5, 'prob_clip': 0.018365882050246796, 'n_components': 60, 'logistic_c': 7.400156150335948, 'pca_fit': 'combined', 'solver': 'lbfgs', 'max_iter': 2000, 'fit_intercept': True, 'standardize_with_source': True, 'rho': 0.5}
[I 2026-06-01 19:56:54,348] Trial 110 finished with value: 0.23536723092664363 and parameters: {'alpha': 74468.59372456992, 'n_pcs': 4000, 'iw_method': 'pc_logistic', 'iw_clip_max': 1.5, 'iw_prob_clip': 0.018365882050246796, 'iw_n_components': 60, 'iw_logistic_c': 7.400156150335948, 'iw_pca_fit': 'combined', 'iw_solver': 'lbfgs', 'iw_rho': 0.5}. Best is trial 108 with value: 0.23595167441312664.
2026-06-01 19:56:54 | INFO | Trial 111 | outer=6 | alpha=7.186e+04 n_pcs=4500 (pc_topk) weight={'name': 'pc_logistic', 'floor': 1e-06, 'clip_max': 1.5, 'prob_clip': 0.01846416281821857, 'n_components': 60, 'logistic_c': 4.869025383822555, 'pca_fit': 'combined', 'solver': 'lbfgs', 'max_iter': 2000, 'fit_intercept': True, 'standardize_with_source': True, 'rho': 0.5}
[I 2026-06-01 19:57:20,522] Trial 111 finished with value: 0.23536736559026114 and parameters: {'alpha': 71859.49970493342, 'n_pcs': 4500, 'iw_method': 'pc_logistic', 'iw_clip_max': 1.5, 'iw_prob_clip': 0.01846416281821857, 'iw_n_components': 60, 'iw_logistic_c': 4.869025383822555, 'iw_pca_fit': 'combined', 'iw_solver': 'lbfgs', 'iw_rho': 0.5}. Best is trial 108 with value: 0.23595167441312664.
2026-06-01 19:57:20 | INFO | Trial 112 | outer=6 | alpha=7.467e+04 n_pcs=4500 (pc_topk) weight={'name': 'pc_logistic', 'floor': 1e-06, 'clip_max': 1.5, 'prob_clip': 0.01928169914888615, 'n_components': 60, 'logistic_c': 8.547745321109264, 'pca_fit': 'combined', 'solver': 'lbfgs', 'max_iter': 2000, 'fit_intercept': True, 'standardize_with_source': True, 'rho': 0.5}
[I 2026-06-01 19:57:46,648] Trial 112 finished with value: 0.235343177816519 and parameters: {'alpha': 74670.17289552446, 'n_pcs': 4500, 'iw_method': 'pc_logistic', 'iw_clip_max': 1.5, 'iw_prob_clip': 0.01928169914888615, 'iw_n_components': 60, 'iw_logistic_c': 8.547745321109264, 'iw_pca_fit': 'combined', 'iw_solver': 'lbfgs', 'iw_rho': 0.5}. Best is trial 108 with value: 0.23595167441312664.
2026-06-01 19:57:46 | INFO | Trial 113 | outer=6 | alpha=7.688e+04 n_pcs=4500 (pc_topk) weight={'name': 'pc_logistic', 'floor': 1e-06, 'clip_max': 1.5, 'prob_clip': 0.018431235822656697, 'n_components': 60, 'logistic_c': 8.49208978689383, 'pca_fit': 'combined', 'solver': 'lbfgs', 'max_iter': 2000, 'fit_intercept': True, 'standardize_with_source': True, 'rho': 0.5}
[I 2026-06-01 19:58:13,405] Trial 113 finished with value: 0.23521959586804927 and parameters: {'alpha': 76876.66831039263, 'n_pcs': 4500, 'iw_method': 'pc_logistic', 'iw_clip_max': 1.5, 'iw_prob_clip': 0.018431235822656697, 'iw_n_components': 60, 'iw_logistic_c': 8.49208978689383, 'iw_pca_fit': 'combined', 'iw_solver': 'lbfgs', 'iw_rho': 0.5}. Best is trial 108 with value: 0.23595167441312664.
2026-06-01 19:58:13 | INFO | Trial 114 | outer=6 | alpha=7.270e+04 n_pcs=4000 (pc_topk) weight={'name': 'pc_logistic', 'floor': 1e-06, 'clip_max': 1.5, 'prob_clip': 0.01746329762993517, 'n_components': 60, 'logistic_c': 9.931061215576063, 'pca_fit': 'combined', 'solver': 'lbfgs', 'max_iter': 2000, 'fit_intercept': True, 'standardize_with_source': True, 'rho': 0.5}
[I 2026-06-01 19:58:37,339] Trial 114 finished with value: 0.23529644273878042 and parameters: {'alpha': 72703.88605400611, 'n_pcs': 4000, 'iw_method': 'pc_logistic', 'iw_clip_max': 1.5, 'iw_prob_clip': 0.01746329762993517, 'iw_n_components': 60, 'iw_logistic_c': 9.931061215576063, 'iw_pca_fit': 'combined', 'iw_solver': 'lbfgs', 'iw_rho': 0.5}. Best is trial 108 with value: 0.23595167441312664.
2026-06-01 19:58:37 | INFO | Trial 115 | outer=6 | alpha=7.656e+04 n_pcs=3500 (pc_topk) weight={'name': 'pc_logistic', 'floor': 1e-06, 'clip_max': 1.5, 'prob_clip': 0.017551030070414832, 'n_components': 60, 'logistic_c': 7.5440571516925905, 'pca_fit': 'combined', 'solver': 'lbfgs', 'max_iter': 2000, 'fit_intercept': True, 'standardize_with_source': True, 'rho': 0.5}
[I 2026-06-01 19:59:00,207] Trial 115 finished with value: 0.23322659357263165 and parameters: {'alpha': 76559.4424931815, 'n_pcs': 3500, 'iw_method': 'pc_logistic', 'iw_clip_max': 1.5, 'iw_prob_clip': 0.017551030070414832, 'iw_n_components': 60, 'iw_logistic_c': 7.5440571516925905, 'iw_pca_fit': 'combined', 'iw_solver': 'lbfgs', 'iw_rho': 0.5}. Best is trial 108 with value: 0.23595167441312664.
2026-06-01 19:59:00 | INFO | Trial 116 | outer=6 | alpha=7.591e+04 n_pcs=3500 (pc_topk) weight={'name': 'pc_logistic', 'floor': 1e-06, 'clip_max': 1.5, 'prob_clip': 0.015851470471966774, 'n_components': 60, 'logistic_c': 7.285290448155995, 'pca_fit': 'combined', 'solver': 'lbfgs', 'max_iter': 2000, 'fit_intercept': True, 'standardize_with_source': True, 'rho': 0.5}
[I 2026-06-01 19:59:20,132] Trial 116 finished with value: 0.23304082850035251 and parameters: {'alpha': 75913.30321520905, 'n_pcs': 3500, 'iw_method': 'pc_logistic', 'iw_clip_max': 1.5, 'iw_prob_clip': 0.015851470471966774, 'iw_n_components': 60, 'iw_logistic_c': 7.285290448155995, 'iw_pca_fit': 'combined', 'iw_solver': 'lbfgs', 'iw_rho': 0.5}. Best is trial 108 with value: 0.23595167441312664.
2026-06-01 19:59:20 | INFO | Trial 117 | outer=6 | alpha=1.297e+05 n_pcs=3500 (pc_topk) weight={'name': 'pc_logistic', 'floor': 1e-06, 'clip_max': 1.5, 'prob_clip': 0.01767667632263833, 'n_components': 60, 'logistic_c': 7.5094428987476025, 'pca_fit': 'combined', 'solver': 'lbfgs', 'max_iter': 2000, 'fit_intercept': True, 'standardize_with_source': True, 'rho': 0.5}
[I 2026-06-01 19:59:43,623] Trial 117 finished with value: 0.23215059856425052 and parameters: {'alpha': 129681.43030059969, 'n_pcs': 3500, 'iw_method': 'pc_logistic', 'iw_clip_max': 1.5, 'iw_prob_clip': 0.01767667632263833, 'iw_n_components': 60, 'iw_logistic_c': 7.5094428987476025, 'iw_pca_fit': 'combined', 'iw_solver': 'lbfgs', 'iw_rho': 0.5}. Best is trial 108 with value: 0.23595167441312664.
2026-06-01 19:59:43 | INFO | Trial 118 | outer=6 | alpha=7.845e+04 n_pcs=3500 (pc_topk) weight={'name': 'pc_logistic', 'floor': 1e-06, 'clip_max': 1.5, 'prob_clip': 0.014703472643174694, 'n_components': 60, 'logistic_c': 3.309825874337695, 'pca_fit': 'combined', 'solver': 'lbfgs', 'max_iter': 2000, 'fit_intercept': True, 'standardize_with_source': True, 'rho': 0.5}
[I 2026-06-01 20:00:04,908] Trial 118 finished with value: 0.23293164404341563 and parameters: {'alpha': 78448.96537598484, 'n_pcs': 3500, 'iw_method': 'pc_logistic', 'iw_clip_max': 1.5, 'iw_prob_clip': 0.014703472643174694, 'iw_n_components': 60, 'iw_logistic_c': 3.309825874337695, 'iw_pca_fit': 'combined', 'iw_solver': 'lbfgs', 'iw_rho': 0.5}. Best is trial 108 with value: 0.23595167441312664.
2026-06-01 20:00:04 | INFO | Trial 119 | outer=6 | alpha=2.209e+05 n_pcs=3000 (pc_topk) weight={'name': 'pc_logistic', 'floor': 1e-06, 'clip_max': 1.5, 'prob_clip': 0.015478717616796983, 'n_components': 60, 'logistic_c': 3.1377744042758375, 'pca_fit': 'combined', 'solver': 'lbfgs', 'max_iter': 2000, 'fit_intercept': True, 'standardize_with_source': True, 'rho': 0.5}
[I 2026-06-01 20:00:25,936] Trial 119 finished with value: 0.22924579141484086 and parameters: {'alpha': 220909.30343623093, 'n_pcs': 3000, 'iw_method': 'pc_logistic', 'iw_clip_max': 1.5, 'iw_prob_clip': 0.015478717616796983, 'iw_n_components': 60, 'iw_logistic_c': 3.1377744042758375, 'iw_pca_fit': 'combined', 'iw_solver': 'lbfgs', 'iw_rho': 0.5}. Best is trial 108 with value: 0.23595167441312664.
2026-06-01 20:00:26 | INFO | Trial 120 | outer=6 | alpha=7.776e+04 n_pcs=3500 (pc_topk) weight={'name': 'pc_logistic', 'floor': 1e-06, 'clip_max': 1.5, 'prob_clip': 0.019819739159927043, 'n_components': 60, 'logistic_c': 6.755417737802074, 'pca_fit': 'combined', 'solver': 'lbfgs', 'max_iter': 2000, 'fit_intercept': True, 'standardize_with_source': True, 'rho': 0.5}
[I 2026-06-01 20:00:45,358] Trial 120 finished with value: 0.23340714519282177 and parameters: {'alpha': 77762.69862914484, 'n_pcs': 3500, 'iw_method': 'pc_logistic', 'iw_clip_max': 1.5, 'iw_prob_clip': 0.019819739159927043, 'iw_n_components': 60, 'iw_logistic_c': 6.755417737802074, 'iw_pca_fit': 'combined', 'iw_solver': 'lbfgs', 'iw_rho': 0.5}. Best is trial 108 with value: 0.23595167441312664.
2026-06-01 20:00:45 | INFO | Trial 121 | outer=6 | alpha=7.807e+04 n_pcs=3500 (pc_topk) weight={'name': 'pc_logistic', 'floor': 1e-06, 'clip_max': 1.5, 'prob_clip': 0.0196311715181566, 'n_components': 60, 'logistic_c': 8.40204663991311, 'pca_fit': 'combined', 'solver': 'lbfgs', 'max_iter': 2000, 'fit_intercept': True, 'standardize_with_source': True, 'rho': 0.5}
[I 2026-06-01 20:01:04,455] Trial 121 finished with value: 0.23338615287637535 and parameters: {'alpha': 78074.67185013018, 'n_pcs': 3500, 'iw_method': 'pc_logistic', 'iw_clip_max': 1.5, 'iw_prob_clip': 0.0196311715181566, 'iw_n_components': 60, 'iw_logistic_c': 8.40204663991311, 'iw_pca_fit': 'combined', 'iw_solver': 'lbfgs', 'iw_rho': 0.5}. Best is trial 108 with value: 0.23595167441312664.
2026-06-01 20:01:04 | INFO | Trial 122 | outer=6 | alpha=9.760e+04 n_pcs=3500 (pc_topk) weight={'name': 'pc_logistic', 'floor': 1e-06, 'clip_max': 1.5, 'prob_clip': 0.019807945732524722, 'n_components': 60, 'logistic_c': 9.385033066032713, 'pca_fit': 'combined', 'solver': 'lbfgs', 'max_iter': 2000, 'fit_intercept': True, 'standardize_with_source': True, 'rho': 0.5}
