[I 2026-06-01 16:57:43,420] Trial 279 finished with value: 0.20054982983119102 and parameters: {'alpha': 208635.63851114898, 'n_pcs': 1500, 'iw_method': 'pc_logistic', 'iw_clip_max': 2.5, 'iw_prob_clip': 0.014700589238422575, 'iw_n_components': 20, 'iw_logistic_c': 8.811040670088229e-06, 'iw_pca_fit': 'combined', 'iw_solver': 'lbfgs', 'iw_rho': 1.0}. Best is trial 267 with value: 0.20933291711767107.
2026-06-01 16:57:43 | INFO | Trial 280 | outer=3 | alpha=1.371e+05 n_pcs=2000 (pc_topk) weight={'name': 'pc_logistic', 'floor': 1e-06, 'clip_max': 2.5, 'prob_clip': 0.013924743154922984, 'n_components': 80, 'logistic_c': 4.908768413985107e-06, 'pca_fit': 'combined', 'solver': 'lbfgs', 'max_iter': 2000, 'fit_intercept': True, 'standardize_with_source': True, 'rho': 1.0}
[I 2026-06-01 16:57:52,715] Trial 280 finished with value: 0.20759983017297415 and parameters: {'alpha': 137056.27736948672, 'n_pcs': 2000, 'iw_method': 'pc_logistic', 'iw_clip_max': 2.5, 'iw_prob_clip': 0.013924743154922984, 'iw_n_components': 80, 'iw_logistic_c': 4.908768413985107e-06, 'iw_pca_fit': 'combined', 'iw_solver': 'lbfgs', 'iw_rho': 1.0}. Best is trial 267 with value: 0.20933291711767107.
2026-06-01 16:57:52 | INFO | Trial 281 | outer=3 | alpha=1.883e+05 n_pcs=2000 (pc_topk) weight={'name': 'pc_logistic', 'floor': 1e-06, 'clip_max': 2.5, 'prob_clip': 0.009476426520540612, 'n_components': 80, 'logistic_c': 6.870432066483194e-06, 'pca_fit': 'combined', 'solver': 'lbfgs', 'max_iter': 2000, 'fit_intercept': True, 'standardize_with_source': True, 'rho': 1.0}
[I 2026-06-01 16:58:01,543] Trial 281 finished with value: 0.2079778559891678 and parameters: {'alpha': 188294.2460395793, 'n_pcs': 2000, 'iw_method': 'pc_logistic', 'iw_clip_max': 2.5, 'iw_prob_clip': 0.009476426520540612, 'iw_n_components': 80, 'iw_logistic_c': 6.870432066483194e-06, 'iw_pca_fit': 'combined', 'iw_solver': 'lbfgs', 'iw_rho': 1.0}. Best is trial 267 with value: 0.20933291711767107.
2026-06-01 16:58:01 | INFO | Trial 282 | outer=3 | alpha=1.566e+05 n_pcs=2000 (pc_topk) weight={'name': 'pc_logistic', 'floor': 1e-06, 'clip_max': 2.5, 'prob_clip': 0.005691340699539307, 'n_components': 80, 'logistic_c': 4.239939615410795e-06, 'pca_fit': 'combined', 'solver': 'lbfgs', 'max_iter': 2000, 'fit_intercept': True, 'standardize_with_source': True, 'rho': 1.0}
[I 2026-06-01 16:58:15,227] Trial 282 finished with value: 0.20675715169322323 and parameters: {'alpha': 156645.39369447643, 'n_pcs': 2000, 'iw_method': 'pc_logistic', 'iw_clip_max': 2.5, 'iw_prob_clip': 0.005691340699539307, 'iw_n_components': 80, 'iw_logistic_c': 4.239939615410795e-06, 'iw_pca_fit': 'combined', 'iw_solver': 'lbfgs', 'iw_rho': 1.0}. Best is trial 267 with value: 0.20933291711767107.
2026-06-01 16:58:15 | INFO | Trial 283 | outer=3 | alpha=2.420e+05 n_pcs=2000 (pc_topk) weight={'name': 'pc_logistic', 'floor': 1e-06, 'clip_max': 2.5, 'prob_clip': 0.007377041306805133, 'n_components': 80, 'logistic_c': 9.583767581026893e-06, 'pca_fit': 'combined', 'solver': 'lbfgs', 'max_iter': 2000, 'fit_intercept': True, 'standardize_with_source': True, 'rho': 1.0}
[I 2026-06-01 16:58:23,073] Trial 283 finished with value: 0.20845710627937247 and parameters: {'alpha': 242024.38520318072, 'n_pcs': 2000, 'iw_method': 'pc_logistic', 'iw_clip_max': 2.5, 'iw_prob_clip': 0.007377041306805133, 'iw_n_components': 80, 'iw_logistic_c': 9.583767581026893e-06, 'iw_pca_fit': 'combined', 'iw_solver': 'lbfgs', 'iw_rho': 1.0}. Best is trial 267 with value: 0.20933291711767107.
2026-06-01 16:58:23 | INFO | Trial 284 | outer=3 | alpha=2.467e+05 n_pcs=2000 (pc_topk) weight={'name': 'pc_logistic', 'floor': 1e-06, 'clip_max': 2.5, 'prob_clip': 0.00736678710784901, 'n_components': 80, 'logistic_c': 8.767900246014222e-06, 'pca_fit': 'combined', 'solver': 'lbfgs', 'max_iter': 2000, 'fit_intercept': True, 'standardize_with_source': True, 'rho': 1.0}
[I 2026-06-01 16:58:34,320] Trial 284 finished with value: 0.20795993638024002 and parameters: {'alpha': 246733.11476482498, 'n_pcs': 2000, 'iw_method': 'pc_logistic', 'iw_clip_max': 2.5, 'iw_prob_clip': 0.00736678710784901, 'iw_n_components': 80, 'iw_logistic_c': 8.767900246014222e-06, 'iw_pca_fit': 'combined', 'iw_solver': 'lbfgs', 'iw_rho': 1.0}. Best is trial 267 with value: 0.20933291711767107.
2026-06-01 16:58:34 | INFO | Trial 285 | outer=3 | alpha=1.281e+05 n_pcs=2500 (pc_topk) weight={'name': 'pc_logistic', 'floor': 1e-06, 'clip_max': 2.5, 'prob_clip': 0.0061212421126143985, 'n_components': 80, 'logistic_c': 9.257883918280402e-06, 'pca_fit': 'combined', 'solver': 'lbfgs', 'max_iter': 2000, 'fit_intercept': True, 'standardize_with_source': True, 'rho': 1.0}
[I 2026-06-01 16:58:44,157] Trial 285 finished with value: 0.20890641510465624 and parameters: {'alpha': 128108.5697288678, 'n_pcs': 2500, 'iw_method': 'pc_logistic', 'iw_clip_max': 2.5, 'iw_prob_clip': 0.0061212421126143985, 'iw_n_components': 80, 'iw_logistic_c': 9.257883918280402e-06, 'iw_pca_fit': 'combined', 'iw_solver': 'lbfgs', 'iw_rho': 1.0}. Best is trial 267 with value: 0.20933291711767107.
2026-06-01 16:58:44 | INFO | Trial 286 | outer=3 | alpha=1.317e+05 n_pcs=2500 (pc_topk) weight={'name': 'pc_logistic', 'floor': 1e-06, 'clip_max': 2.5, 'prob_clip': 0.00634468864467097, 'n_components': 80, 'logistic_c': 9.072225947542627e-06, 'pca_fit': 'combined', 'solver': 'lbfgs', 'max_iter': 2000, 'fit_intercept': True, 'standardize_with_source': True, 'rho': 1.0}
[I 2026-06-01 16:58:53,314] Trial 286 finished with value: 0.2088202361582708 and parameters: {'alpha': 131671.26650643078, 'n_pcs': 2500, 'iw_method': 'pc_logistic', 'iw_clip_max': 2.5, 'iw_prob_clip': 0.00634468864467097, 'iw_n_components': 80, 'iw_logistic_c': 9.072225947542627e-06, 'iw_pca_fit': 'combined', 'iw_solver': 'lbfgs', 'iw_rho': 1.0}. Best is trial 267 with value: 0.20933291711767107.
2026-06-01 16:58:53 | INFO | Trial 287 | outer=3 | alpha=1.283e+05 n_pcs=2500 (pc_topk) weight={'name': 'pc_logistic', 'floor': 1e-06, 'clip_max': 2.5, 'prob_clip': 0.0060725531070491105, 'n_components': 80, 'logistic_c': 8.61865430860772e-06, 'pca_fit': 'combined', 'solver': 'lbfgs', 'max_iter': 2000, 'fit_intercept': True, 'standardize_with_source': True, 'rho': 1.0}
[I 2026-06-01 16:59:07,406] Trial 287 finished with value: 0.20870837278983712 and parameters: {'alpha': 128339.34147570394, 'n_pcs': 2500, 'iw_method': 'pc_logistic', 'iw_clip_max': 2.5, 'iw_prob_clip': 0.0060725531070491105, 'iw_n_components': 80, 'iw_logistic_c': 8.61865430860772e-06, 'iw_pca_fit': 'combined', 'iw_solver': 'lbfgs', 'iw_rho': 1.0}. Best is trial 267 with value: 0.20933291711767107.
2026-06-01 16:59:07 | INFO | Trial 288 | outer=3 | alpha=1.300e+05 n_pcs=2500 (pc_topk) weight={'name': 'pc_logistic', 'floor': 1e-06, 'clip_max': 2.5, 'prob_clip': 0.006027594738989799, 'n_components': 80, 'logistic_c': 2.721387216947091e-06, 'pca_fit': 'combined', 'solver': 'lbfgs', 'max_iter': 2000, 'fit_intercept': True, 'standardize_with_source': True, 'rho': 1.0}
[I 2026-06-01 16:59:17,014] Trial 288 finished with value: 0.20561769390241094 and parameters: {'alpha': 129987.83041247551, 'n_pcs': 2500, 'iw_method': 'pc_logistic', 'iw_clip_max': 2.5, 'iw_prob_clip': 0.006027594738989799, 'iw_n_components': 80, 'iw_logistic_c': 2.721387216947091e-06, 'iw_pca_fit': 'combined', 'iw_solver': 'lbfgs', 'iw_rho': 1.0}. Best is trial 267 with value: 0.20933291711767107.
2026-06-01 16:59:17 | INFO | Trial 289 | outer=3 | alpha=1.257e+05 n_pcs=2500 (pc_topk) weight={'name': 'pc_logistic', 'floor': 1e-06, 'clip_max': 2.5, 'prob_clip': 0.005370119272503937, 'n_components': 80, 'logistic_c': 4.735574948601186e-06, 'pca_fit': 'combined', 'solver': 'lbfgs', 'max_iter': 2000, 'fit_intercept': True, 'standardize_with_source': True, 'rho': 1.0}
[I 2026-06-01 16:59:27,767] Trial 289 finished with value: 0.20715594617511432 and parameters: {'alpha': 125668.94816977417, 'n_pcs': 2500, 'iw_method': 'pc_logistic', 'iw_clip_max': 2.5, 'iw_prob_clip': 0.005370119272503937, 'iw_n_components': 80, 'iw_logistic_c': 4.735574948601186e-06, 'iw_pca_fit': 'combined', 'iw_solver': 'lbfgs', 'iw_rho': 1.0}. Best is trial 267 with value: 0.20933291711767107.
2026-06-01 16:59:27 | INFO | Trial 290 | outer=3 | alpha=1.253e+05 n_pcs=2500 (pc_topk) weight={'name': 'uniform'}
[I 2026-06-01 16:59:32,134] Trial 290 finished with value: 0.20173890777101292 and parameters: {'alpha': 125305.0584499401, 'n_pcs': 2500, 'iw_method': 'uniform'}. Best is trial 267 with value: 0.20933291711767107.
2026-06-01 16:59:32 | INFO | Trial 291 | outer=3 | alpha=1.799e+05 n_pcs=2500 (pc_topk) weight={'name': 'pc_logistic', 'floor': 1e-06, 'clip_max': 2.5, 'prob_clip': 0.006282255575692005, 'n_components': 80, 'logistic_c': 9.2568768286966e-06, 'pca_fit': 'combined', 'solver': 'lbfgs', 'max_iter': 2000, 'fit_intercept': True, 'standardize_with_source': True, 'rho': 1.0}
[I 2026-06-01 16:59:41,667] Trial 291 finished with value: 0.20845778934428744 and parameters: {'alpha': 179851.97060284764, 'n_pcs': 2500, 'iw_method': 'pc_logistic', 'iw_clip_max': 2.5, 'iw_prob_clip': 0.006282255575692005, 'iw_n_components': 80, 'iw_logistic_c': 9.2568768286966e-06, 'iw_pca_fit': 'combined', 'iw_solver': 'lbfgs', 'iw_rho': 1.0}. Best is trial 267 with value: 0.20933291711767107.
2026-06-01 16:59:41 | INFO | Trial 292 | outer=3 | alpha=1.345e+05 n_pcs=2500 (pc_topk) weight={'name': 'pc_logistic', 'floor': 1e-06, 'clip_max': 2.5, 'prob_clip': 0.0048186539286095165, 'n_components': 80, 'logistic_c': 4.919555723773472e-07, 'pca_fit': 'combined', 'solver': 'lbfgs', 'max_iter': 2000, 'fit_intercept': True, 'standardize_with_source': True, 'rho': 0.3}
[I 2026-06-01 16:59:51,789] Trial 292 finished with value: 0.20183208333252453 and parameters: {'alpha': 134467.70549387386, 'n_pcs': 2500, 'iw_method': 'pc_logistic', 'iw_clip_max': 2.5, 'iw_prob_clip': 0.0048186539286095165, 'iw_n_components': 80, 'iw_logistic_c': 4.919555723773472e-07, 'iw_pca_fit': 'combined', 'iw_solver': 'lbfgs', 'iw_rho': 0.3}. Best is trial 267 with value: 0.20933291711767107.
2026-06-01 16:59:51 | INFO | Trial 293 | outer=3 | alpha=1.228e+05 n_pcs=2500 (pc_topk) weight={'name': 'pc_logistic', 'floor': 1e-06, 'clip_max': 7.0, 'prob_clip': 0.0057654013365906545, 'n_components': 80, 'logistic_c': 6.039046230453026e-06, 'pca_fit': 'combined', 'solver': 'lbfgs', 'max_iter': 2000, 'fit_intercept': True, 'standardize_with_source': True, 'rho': 1.0}
[I 2026-06-01 17:00:05,503] Trial 293 finished with value: 0.20514554401153337 and parameters: {'alpha': 122816.00607188752, 'n_pcs': 2500, 'iw_method': 'pc_logistic', 'iw_clip_max': 7.0, 'iw_prob_clip': 0.0057654013365906545, 'iw_n_components': 80, 'iw_logistic_c': 6.039046230453026e-06, 'iw_pca_fit': 'combined', 'iw_solver': 'lbfgs', 'iw_rho': 1.0}. Best is trial 267 with value: 0.20933291711767107.
2026-06-01 17:00:05 | INFO | Trial 294 | outer=3 | alpha=1.973e+05 n_pcs=2000 (pc_topk) weight={'name': 'pc_logistic', 'floor': 1e-06, 'clip_max': 2.5, 'prob_clip': 0.01022504682007073, 'n_components': 80, 'logistic_c': 9.810376669901047e-06, 'pca_fit': 'combined', 'solver': 'lbfgs', 'max_iter': 2000, 'fit_intercept': True, 'standardize_with_source': True, 'rho': 1.0}
[I 2026-06-01 17:00:14,389] Trial 294 finished with value: 0.20908544528910356 and parameters: {'alpha': 197274.84229390966, 'n_pcs': 2000, 'iw_method': 'pc_logistic', 'iw_clip_max': 2.5, 'iw_prob_clip': 0.01022504682007073, 'iw_n_components': 80, 'iw_logistic_c': 9.810376669901047e-06, 'iw_pca_fit': 'combined', 'iw_solver': 'lbfgs', 'iw_rho': 1.0}. Best is trial 267 with value: 0.20933291711767107.
2026-06-01 17:00:14 | INFO | Trial 295 | outer=3 | alpha=2.062e+05 n_pcs=2000 (pc_topk) weight={'name': 'pc_logistic', 'floor': 1e-06, 'clip_max': 2.5, 'prob_clip': 0.006343042485060371, 'n_components': 20, 'logistic_c': 9.804033691533077e-06, 'pca_fit': 'combined', 'solver': 'lbfgs', 'max_iter': 2000, 'fit_intercept': True, 'standardize_with_source': True, 'rho': 1.0}
[I 2026-06-01 17:00:22,873] Trial 295 finished with value: 0.2089355532379818 and parameters: {'alpha': 206193.59037369973, 'n_pcs': 2000, 'iw_method': 'pc_logistic', 'iw_clip_max': 2.5, 'iw_prob_clip': 0.006343042485060371, 'iw_n_components': 20, 'iw_logistic_c': 9.804033691533077e-06, 'iw_pca_fit': 'combined', 'iw_solver': 'lbfgs', 'iw_rho': 1.0}. Best is trial 267 with value: 0.20933291711767107.
2026-06-01 17:00:22 | INFO | Trial 296 | outer=3 | alpha=3.021e+05 n_pcs=2000 (pc_topk) weight={'name': 'pc_logistic', 'floor': 1e-06, 'clip_max': 2.5, 'prob_clip': 0.006235401837279778, 'n_components': 20, 'logistic_c': 3.5192449932869872e-06, 'pca_fit': 'combined', 'solver': 'lbfgs', 'max_iter': 2000, 'fit_intercept': True, 'standardize_with_source': True, 'rho': 1.0}
[I 2026-06-01 17:00:31,650] Trial 296 finished with value: 0.20323119652469748 and parameters: {'alpha': 302096.6284601334, 'n_pcs': 2000, 'iw_method': 'pc_logistic', 'iw_clip_max': 2.5, 'iw_prob_clip': 0.006235401837279778, 'iw_n_components': 20, 'iw_logistic_c': 3.5192449932869872e-06, 'iw_pca_fit': 'combined', 'iw_solver': 'lbfgs', 'iw_rho': 1.0}. Best is trial 267 with value: 0.20933291711767107.
2026-06-01 17:00:31 | INFO | Trial 297 | outer=3 | alpha=2.094e+05 n_pcs=2500 (pc_topk) weight={'name': 'pc_logistic', 'floor': 1e-06, 'clip_max': 12.0, 'prob_clip': 0.006520709480608181, 'n_components': 20, 'logistic_c': 9.102097272950694e-06, 'pca_fit': 'combined', 'solver': 'lbfgs', 'max_iter': 2000, 'fit_intercept': True, 'standardize_with_source': True, 'rho': 1.0}
[I 2026-06-01 17:00:43,206] Trial 297 finished with value: 0.20263881222175079 and parameters: {'alpha': 209370.4305817227, 'n_pcs': 2500, 'iw_method': 'pc_logistic', 'iw_clip_max': 12.0, 'iw_prob_clip': 0.006520709480608181, 'iw_n_components': 20, 'iw_logistic_c': 9.102097272950694e-06, 'iw_pca_fit': 'combined', 'iw_solver': 'lbfgs', 'iw_rho': 1.0}. Best is trial 267 with value: 0.20933291711767107.
2026-06-01 17:00:43 | INFO | Trial 298 | outer=3 | alpha=1.897e+05 n_pcs=1500 (pc_topk) weight={'name': 'pc_logistic', 'floor': 1e-06, 'clip_max': 2.5, 'prob_clip': 0.005489878760650557, 'n_components': 20, 'logistic_c': 9.675636541651318e-06, 'pca_fit': 'combined', 'solver': 'lbfgs', 'max_iter': 2000, 'fit_intercept': True, 'standardize_with_source': True, 'rho': 1.0}
[I 2026-06-01 17:00:53,580] Trial 298 finished with value: 0.2004912151381706 and parameters: {'alpha': 189699.82827132003, 'n_pcs': 1500, 'iw_method': 'pc_logistic', 'iw_clip_max': 2.5, 'iw_prob_clip': 0.005489878760650557, 'iw_n_components': 20, 'iw_logistic_c': 9.675636541651318e-06, 'iw_pca_fit': 'combined', 'iw_solver': 'lbfgs', 'iw_rho': 1.0}. Best is trial 267 with value: 0.20933291711767107.
2026-06-01 17:00:53 | INFO | Trial 299 | outer=3 | alpha=2.200e+05 n_pcs=2000 (pc_topk) weight={'name': 'pc_logistic', 'floor': 1e-06, 'clip_max': 4.0, 'prob_clip': 0.0095207704952513, 'n_components': 20, 'logistic_c': 4.698587966117951e-06, 'pca_fit': 'combined', 'solver': 'lbfgs', 'max_iter': 2000, 'fit_intercept': True, 'standardize_with_source': True, 'rho': 1.0}
[I 2026-06-01 17:01:02,240] Trial 299 finished with value: 0.20523596917344017 and parameters: {'alpha': 220018.8141461296, 'n_pcs': 2000, 'iw_method': 'pc_logistic', 'iw_clip_max': 4.0, 'iw_prob_clip': 0.0095207704952513, 'iw_n_components': 20, 'iw_logistic_c': 4.698587966117951e-06, 'iw_pca_fit': 'combined', 'iw_solver': 'lbfgs', 'iw_rho': 1.0}. Best is trial 267 with value: 0.20933291711767107.
2026-06-01 17:01:02 | INFO | OUTER 3 best (inner mean r=0.2093): {'model_type': 'pc_ridge', 'alpha': 163632.53399865946, 'use_snp_selection': True, 'num_snps': 2000, 'n_pcs': 2000, 'weighting': {'name': 'pc_logistic', 'floor': 1e-06, 'clip_max': 2.5, 'prob_clip': 0.011929070954467701, 'n_components': 20, 'logistic_c': 9.379143363320458e-06, 'pca_fit': 'combined', 'solver': 'lbfgs', 'max_iter': 2000, 'fit_intercept': True, 'standardize_with_source': True, 'rho': 1.0}, 'mean_inner_effective_sample_size': 4493.197218580763, 'mean_inner_effective_sample_size_threshold': 1002.96}
2026-06-01 17:01:03 | INFO | OUTER 3 TEST r = 0.2618
2026-06-01 17:01:03 | INFO | OUTER 3 incremental summary saved to outputs/final_results/e6_pc_ridge_importance/thr_wing/e6_pc_ridge_importance_thr_wing_results.json
2026-06-01 17:01:03 | INFO | OUTER 4: test_size=191 island=3 (Selvær)
2026-06-01 17:01:03 | INFO | OUTER 4: using top 10 related inner validation islands for tuning: 1(Myken, avgGRM=0.0212), 2(Træna, avgGRM=0.0194), 8(Lovund, avgGRM=0.0087), 9(Sleneset, avgGRM=0.0056), 0(Nesøy, avgGRM=0.0033), 7(Onøy og Lurøy, avgGRM=0.0018), 6(Indre Kvarøy, avgGRM=0.0005), 5(Hestmannøy, avgGRM=-0.0000), 4(Gjerøy, avgGRM=-0.0013), 12(Vega, avgGRM=-0.0030)
[I 2026-06-01 17:01:03,511] A new study created in memory with name: ridge_importance_inner_outer3
2026-06-01 17:01:03 | INFO | Trial 0 | outer=4 | alpha=1.137e+05 n_pcs=4000 (pc_topk) weight={'name': 'uniform'}
[I 2026-06-01 17:01:17,175] Trial 0 finished with value: 0.18683628324969398 and parameters: {'alpha': 113703.38004442609, 'n_pcs': 4000, 'iw_method': 'uniform'}. Best is trial 0 with value: 0.18683628324969398.
2026-06-01 17:01:17 | INFO | Trial 1 | outer=4 | alpha=1.734e+04 n_pcs=5000 (pc_topk) weight={'name': 'uniform'}
[I 2026-06-01 17:01:27,889] Trial 1 finished with value: 0.18938351819175628 and parameters: {'alpha': 17335.792577698634, 'n_pcs': 5000, 'iw_method': 'uniform'}. Best is trial 1 with value: 0.18938351819175628.
2026-06-01 17:01:27 | INFO | Trial 2 | outer=4 | alpha=1.435e+05 n_pcs=1500 (pc_topk) weight={'name': 'uniform'}
[I 2026-06-01 17:01:31,131] Trial 2 finished with value: 0.1802041245393174 and parameters: {'alpha': 143482.76912965564, 'n_pcs': 1500, 'iw_method': 'uniform'}. Best is trial 1 with value: 0.18938351819175628.
2026-06-01 17:01:31 | INFO | Trial 3 | outer=4 | alpha=1.431e+05 n_pcs=500 (pc_topk) weight={'name': 'uniform'}
[I 2026-06-01 17:01:31,989] Trial 3 finished with value: 0.15271748781362146 and parameters: {'alpha': 143072.2464444983, 'n_pcs': 500, 'iw_method': 'uniform'}. Best is trial 1 with value: 0.18938351819175628.
2026-06-01 17:01:31 | INFO | Trial 4 | outer=4 | alpha=5.373e+06 n_pcs=2000 (pc_topk) weight={'name': 'pc_logistic', 'floor': 1e-06, 'clip_max': 1.5, 'prob_clip': 0.001637400317167702, 'n_components': 80, 'logistic_c': 0.09386700500068379, 'pca_fit': 'combined', 'solver': 'lbfgs', 'max_iter': 2000, 'fit_intercept': True, 'standardize_with_source': True, 'rho': 1.0}
[I 2026-06-01 17:01:50,882] Trial 4 finished with value: 0.17233011708953958 and parameters: {'alpha': 5373167.4046281455, 'n_pcs': 2000, 'iw_method': 'pc_logistic', 'iw_clip_max': 1.5, 'iw_prob_clip': 0.001637400317167702, 'iw_n_components': 80, 'iw_logistic_c': 0.09386700500068379, 'iw_pca_fit': 'combined', 'iw_solver': 'lbfgs', 'iw_rho': 1.0}. Best is trial 1 with value: 0.18938351819175628.
2026-06-01 17:01:50 | INFO | Trial 5 | outer=4 | alpha=6.435e+04 n_pcs=1000 (pc_topk) weight={'name': 'pc_logistic', 'floor': 1e-06, 'clip_max': 7.0, 'prob_clip': 0.004193356127903791, 'n_components': 20, 'logistic_c': 9.236417519010976, 'pca_fit': 'combined', 'solver': 'lbfgs', 'max_iter': 2000, 'fit_intercept': True, 'standardize_with_source': True, 'rho': 1.0}
2026-06-01 17:02:03 | INFO | Trial 5 rejected by ESS guard: mean_ess=668.97 threshold=1020.06
[I 2026-06-01 17:02:03,564] Trial 5 finished with value: -1.0 and parameters: {'alpha': 64350.09539177312, 'n_pcs': 1000, 'iw_method': 'pc_logistic', 'iw_clip_max': 7.0, 'iw_prob_clip': 0.004193356127903791, 'iw_n_components': 20, 'iw_logistic_c': 9.236417519010976, 'iw_pca_fit': 'combined', 'iw_solver': 'lbfgs', 'iw_rho': 1.0}. Best is trial 1 with value: 0.18938351819175628.
2026-06-01 17:02:03 | INFO | Trial 6 | outer=4 | alpha=3.046e+05 n_pcs=3500 (pc_topk) weight={'name': 'pc_logistic', 'floor': 1e-06, 'clip_max': 12.0, 'prob_clip': 0.0007016380040663315, 'n_components': 80, 'logistic_c': 0.00021908930989278453, 'pca_fit': 'combined', 'solver': 'lbfgs', 'max_iter': 2000, 'fit_intercept': True, 'standardize_with_source': True, 'rho': 0.7}
[I 2026-06-01 17:02:17,011] Trial 6 finished with value: 0.18201232302433937 and parameters: {'alpha': 304631.0485153137, 'n_pcs': 3500, 'iw_method': 'pc_logistic', 'iw_clip_max': 12.0, 'iw_prob_clip': 0.0007016380040663315, 'iw_n_components': 80, 'iw_logistic_c': 0.00021908930989278453, 'iw_pca_fit': 'combined', 'iw_solver': 'lbfgs', 'iw_rho': 0.7}. Best is trial 1 with value: 0.18938351819175628.
2026-06-01 17:02:17 | INFO | Trial 7 | outer=4 | alpha=7.213e+06 n_pcs=500 (pc_topk) weight={'name': 'uniform'}
[I 2026-06-01 17:02:18,077] Trial 7 finished with value: 0.14218309272818336 and parameters: {'alpha': 7213019.60957054, 'n_pcs': 500, 'iw_method': 'uniform'}. Best is trial 1 with value: 0.18938351819175628.
2026-06-01 17:02:18 | INFO | Trial 8 | outer=4 | alpha=2.347e+03 n_pcs=3000 (pc_topk) weight={'name': 'pc_logistic', 'floor': 1e-06, 'clip_max': 2.5, 'prob_clip': 0.017782866059784724, 'n_components': 60, 'logistic_c': 4.584813955429537e-07, 'pca_fit': 'combined', 'solver': 'lbfgs', 'max_iter': 2000, 'fit_intercept': True, 'standardize_with_source': True, 'rho': 0.3}
[I 2026-06-01 17:02:27,871] Trial 8 finished with value: 0.11406069581910057 and parameters: {'alpha': 2346.6230871488538, 'n_pcs': 3000, 'iw_method': 'pc_logistic', 'iw_clip_max': 2.5, 'iw_prob_clip': 0.017782866059784724, 'iw_n_components': 60, 'iw_logistic_c': 4.584813955429537e-07, 'iw_pca_fit': 'combined', 'iw_solver': 'lbfgs', 'iw_rho': 0.3}. Best is trial 1 with value: 0.18938351819175628.
2026-06-01 17:02:27 | INFO | Trial 9 | outer=4 | alpha=1.067e+03 n_pcs=4000 (pc_topk) weight={'name': 'pc_logistic', 'floor': 1e-06, 'clip_max': 4.0, 'prob_clip': 0.003002704300062754, 'n_components': 10, 'logistic_c': 4.32601466983518e-06, 'pca_fit': 'combined', 'solver': 'lbfgs', 'max_iter': 2000, 'fit_intercept': True, 'standardize_with_source': True, 'rho': 1.0}
