[I 2026-06-01 02:01:42,682] Trial 10 pruned. 
2026-06-01 02:01:42 | INFO | src.nested_cv_avggrm_weighted_unified | Trial 11 | outer=9 | alpha=2.721e+05 n_pcs=3500 (pc_topk) weight_search=on
2026-06-01 02:01:42 | INFO | src.nested_cv_avggrm_weighted_unified | Trial 11 | outer=9 | weight={'name': 'linear', 'floor': 1e-06, 'clip_max': 5.0, 'min_weight': 0.6153200271900192, 'max_weight': 2.818602486352887}
[I 2026-06-01 02:01:47,614] Trial 11 finished with value: 0.22375159353584043 and parameters: {'alpha': 272075.3782264197, 'n_pcs': 3500, 'weight_scheme': 'linear', 'weight_clip_max': 5.0, 'weight_linear_min_weight': 0.6153200271900192, 'weight_linear_max_weight': 2.818602486352887}. Best is trial 7 with value: 0.2314062910020001.
2026-06-01 02:01:47 | INFO | src.nested_cv_avggrm_weighted_unified | Trial 12 | outer=9 | alpha=6.289e+06 n_pcs=3000 (pc_topk) weight_search=on
2026-06-01 02:01:47 | INFO | src.nested_cv_avggrm_weighted_unified | Trial 12 | outer=9 | weight={'name': 'linear', 'floor': 1e-06, 'clip_max': 5.0, 'min_weight': 0.4540006977063487, 'max_weight': 3.4027472299595605}
2026-06-01 02:01:49 | INFO | src.nested_cv_avggrm_weighted_unified | Trial 12 | outer=9 | pruned after 5/10 inner folds (mean r=0.2096)
[I 2026-06-01 02:01:49,721] Trial 12 pruned. 
2026-06-01 02:01:49 | INFO | src.nested_cv_avggrm_weighted_unified | Trial 13 | outer=9 | alpha=4.154e+04 n_pcs=3000 (pc_topk) weight_search=on
2026-06-01 02:01:49 | INFO | src.nested_cv_avggrm_weighted_unified | Trial 13 | outer=9 | weight={'name': 'linear', 'floor': 1e-06, 'clip_max': 5.0, 'min_weight': 0.4665545926042718, 'max_weight': 4.907324246199112}
[I 2026-06-01 02:01:53,544] Trial 13 finished with value: 0.22938983364108276 and parameters: {'alpha': 41536.58822281956, 'n_pcs': 3000, 'weight_scheme': 'linear', 'weight_clip_max': 5.0, 'weight_linear_min_weight': 0.4665545926042718, 'weight_linear_max_weight': 4.907324246199112}. Best is trial 7 with value: 0.2314062910020001.
2026-06-01 02:01:53 | INFO | src.nested_cv_avggrm_weighted_unified | Trial 14 | outer=9 | alpha=3.593e+05 n_pcs=1500 (pc_topk) weight_search=on
2026-06-01 02:01:53 | INFO | src.nested_cv_avggrm_weighted_unified | Trial 14 | outer=9 | weight={'name': 'linear', 'floor': 1e-06, 'clip_max': 5.0, 'min_weight': 0.7643695825995991, 'max_weight': 1.5436169487501357}
2026-06-01 02:01:54 | INFO | src.nested_cv_avggrm_weighted_unified | Trial 14 | outer=9 | pruned after 5/10 inner folds (mean r=0.2018)
[I 2026-06-01 02:01:54,383] Trial 14 pruned. 
2026-06-01 02:01:54 | INFO | src.nested_cv_avggrm_weighted_unified | Trial 15 | outer=9 | alpha=1.692e+05 n_pcs=5000 (pc_topk) weight_search=on
2026-06-01 02:01:54 | INFO | src.nested_cv_avggrm_weighted_unified | Trial 15 | outer=9 | weight={'name': 'uniform', 'floor': 1e-06, 'clip_max': 3.0}
2026-06-01 02:01:59 | INFO | src.nested_cv_avggrm_weighted_unified | Trial 15 | outer=9 | pruned after 7/10 inner folds (mean r=0.2246)
[I 2026-06-01 02:01:59,459] Trial 15 pruned. 
2026-06-01 02:01:59 | INFO | src.nested_cv_avggrm_weighted_unified | Trial 16 | outer=9 | alpha=3.073e+04 n_pcs=4000 (pc_topk) weight_search=on
2026-06-01 02:01:59 | INFO | src.nested_cv_avggrm_weighted_unified | Trial 16 | outer=9 | weight={'name': 'linear', 'floor': 1e-06, 'clip_max': 3.0, 'min_weight': 0.29975181794527334, 'max_weight': 2.618764297721812}
[I 2026-06-01 02:02:05,200] Trial 16 finished with value: 0.2274533412212202 and parameters: {'alpha': 30734.84880605378, 'n_pcs': 4000, 'weight_scheme': 'linear', 'weight_clip_max': 3.0, 'weight_linear_min_weight': 0.29975181794527334, 'weight_linear_max_weight': 2.618764297721812}. Best is trial 7 with value: 0.2314062910020001.
2026-06-01 02:02:05 | INFO | src.nested_cv_avggrm_weighted_unified | Trial 17 | outer=9 | alpha=5.746e+03 n_pcs=2500 (pc_topk) weight_search=on
2026-06-01 02:02:05 | INFO | src.nested_cv_avggrm_weighted_unified | Trial 17 | outer=9 | weight={'name': 'linear', 'floor': 1e-06, 'clip_max': 5.0, 'min_weight': 0.6428755640113902, 'max_weight': 3.892450766644199}
[I 2026-06-01 02:02:08,173] Trial 17 finished with value: 0.19472825057628523 and parameters: {'alpha': 5746.343616439135, 'n_pcs': 2500, 'weight_scheme': 'linear', 'weight_clip_max': 5.0, 'weight_linear_min_weight': 0.6428755640113902, 'weight_linear_max_weight': 3.892450766644199}. Best is trial 7 with value: 0.2314062910020001.
2026-06-01 02:02:08 | INFO | src.nested_cv_avggrm_weighted_unified | Trial 18 | outer=9 | alpha=6.768e+05 n_pcs=3500 (pc_topk) weight_search=on
2026-06-01 02:02:08 | INFO | src.nested_cv_avggrm_weighted_unified | Trial 18 | outer=9 | weight={'name': 'linear', 'floor': 1e-06, 'clip_max': 20.0, 'min_weight': 0.992389344984786, 'max_weight': 2.25834803764851}
2026-06-01 02:02:10 | INFO | src.nested_cv_avggrm_weighted_unified | Trial 18 | outer=9 | pruned after 5/10 inner folds (mean r=0.2071)
[I 2026-06-01 02:02:10,607] Trial 18 pruned. 
2026-06-01 02:02:10 | INFO | src.nested_cv_avggrm_weighted_unified | Trial 19 | outer=9 | alpha=7.796e+04 n_pcs=1500 (pc_topk) weight_search=on
2026-06-01 02:02:10 | INFO | src.nested_cv_avggrm_weighted_unified | Trial 19 | outer=9 | weight={'name': 'uniform', 'floor': 1e-06, 'clip_max': 10.0}
2026-06-01 02:02:11 | INFO | src.nested_cv_avggrm_weighted_unified | Trial 19 | outer=9 | pruned after 7/10 inner folds (mean r=0.2084)
[I 2026-06-01 02:02:11,656] Trial 19 pruned. 
2026-06-01 02:02:11 | INFO | src.nested_cv_avggrm_weighted_unified | Trial 20 | outer=9 | alpha=1.855e+04 n_pcs=3500 (pc_topk) weight_search=on
2026-06-01 02:02:11 | INFO | src.nested_cv_avggrm_weighted_unified | Trial 20 | outer=9 | weight={'name': 'linear', 'floor': 1e-06, 'clip_max': None, 'min_weight': 0.3006932949930545, 'max_weight': 1.0178640395102259}
[I 2026-06-01 02:02:16,506] Trial 20 finished with value: 0.21883286077390035 and parameters: {'alpha': 18548.76589838162, 'n_pcs': 3500, 'weight_scheme': 'linear', 'weight_clip_max': None, 'weight_linear_min_weight': 0.3006932949930545, 'weight_linear_max_weight': 1.0178640395102259}. Best is trial 7 with value: 0.2314062910020001.
2026-06-01 02:02:16 | INFO | src.nested_cv_avggrm_weighted_unified | Trial 21 | outer=9 | alpha=3.604e+04 n_pcs=3000 (pc_topk) weight_search=on
2026-06-01 02:02:16 | INFO | src.nested_cv_avggrm_weighted_unified | Trial 21 | outer=9 | weight={'name': 'linear', 'floor': 1e-06, 'clip_max': 5.0, 'min_weight': 0.4473650948102167, 'max_weight': 4.946069503110623}
[I 2026-06-01 02:02:20,920] Trial 21 finished with value: 0.2279880150519086 and parameters: {'alpha': 36043.47205083096, 'n_pcs': 3000, 'weight_scheme': 'linear', 'weight_clip_max': 5.0, 'weight_linear_min_weight': 0.4473650948102167, 'weight_linear_max_weight': 4.946069503110623}. Best is trial 7 with value: 0.2314062910020001.
2026-06-01 02:02:20 | INFO | src.nested_cv_avggrm_weighted_unified | Trial 22 | outer=9 | alpha=4.808e+04 n_pcs=3000 (pc_topk) weight_search=on
2026-06-01 02:02:20 | INFO | src.nested_cv_avggrm_weighted_unified | Trial 22 | outer=9 | weight={'name': 'linear', 'floor': 1e-06, 'clip_max': 5.0, 'min_weight': 0.2812128333442703, 'max_weight': 4.334465692930086}
[I 2026-06-01 02:02:24,777] Trial 22 finished with value: 0.230432147305991 and parameters: {'alpha': 48083.75142515797, 'n_pcs': 3000, 'weight_scheme': 'linear', 'weight_clip_max': 5.0, 'weight_linear_min_weight': 0.2812128333442703, 'weight_linear_max_weight': 4.334465692930086}. Best is trial 7 with value: 0.2314062910020001.
2026-06-01 02:02:24 | INFO | src.nested_cv_avggrm_weighted_unified | Trial 23 | outer=9 | alpha=1.586e+05 n_pcs=2500 (pc_topk) weight_search=on
2026-06-01 02:02:24 | INFO | src.nested_cv_avggrm_weighted_unified | Trial 23 | outer=9 | weight={'name': 'linear', 'floor': 1e-06, 'clip_max': 5.0, 'min_weight': 0.2560177998433877, 'max_weight': 4.2093463131320625}
[I 2026-06-01 02:02:27,876] Trial 23 finished with value: 0.23197225596808538 and parameters: {'alpha': 158558.81115094683, 'n_pcs': 2500, 'weight_scheme': 'linear', 'weight_clip_max': 5.0, 'weight_linear_min_weight': 0.2560177998433877, 'weight_linear_max_weight': 4.2093463131320625}. Best is trial 23 with value: 0.23197225596808538.
2026-06-01 02:02:27 | INFO | src.nested_cv_avggrm_weighted_unified | OUTER 9 | new best trial 23 (mean inner r=0.2320) saved to outputs/final_results/e6_pc_ridge_avggrm/thr_wing/e6_pc_ridge_avggrm_thr_wing_best_trials/split_09_best_trial.json
2026-06-01 02:02:27 | INFO | src.nested_cv_avggrm_weighted_unified | Trial 24 | outer=9 | alpha=1.716e+05 n_pcs=2500 (pc_topk) weight_search=on
2026-06-01 02:02:27 | INFO | src.nested_cv_avggrm_weighted_unified | Trial 24 | outer=9 | weight={'name': 'linear', 'floor': 1e-06, 'clip_max': 5.0, 'min_weight': 0.2192761742431431, 'max_weight': 3.472749045445248}
[I 2026-06-01 02:02:31,036] Trial 24 finished with value: 0.23162252212494408 and parameters: {'alpha': 171578.62315270866, 'n_pcs': 2500, 'weight_scheme': 'linear', 'weight_clip_max': 5.0, 'weight_linear_min_weight': 0.2192761742431431, 'weight_linear_max_weight': 3.472749045445248}. Best is trial 23 with value: 0.23197225596808538.
2026-06-01 02:02:31 | INFO | src.nested_cv_avggrm_weighted_unified | Trial 25 | outer=9 | alpha=3.067e+06 n_pcs=1500 (pc_topk) weight_search=on
2026-06-01 02:02:31 | INFO | src.nested_cv_avggrm_weighted_unified | Trial 25 | outer=9 | weight={'name': 'linear', 'floor': 1e-06, 'clip_max': 3.0, 'min_weight': 0.19361195823478605, 'max_weight': 3.395611464868455}
2026-06-01 02:02:32 | INFO | src.nested_cv_avggrm_weighted_unified | Trial 25 | outer=9 | pruned after 5/10 inner folds (mean r=0.2036)
[I 2026-06-01 02:02:32,024] Trial 25 pruned. 
2026-06-01 02:02:32 | INFO | src.nested_cv_avggrm_weighted_unified | Trial 26 | outer=9 | alpha=2.570e+05 n_pcs=2500 (pc_topk) weight_search=on
2026-06-01 02:02:32 | INFO | src.nested_cv_avggrm_weighted_unified | Trial 26 | outer=9 | weight={'name': 'linear', 'floor': 1e-06, 'clip_max': 5.0, 'min_weight': 0.06703673517369083, 'max_weight': 3.3415246197644817}
[I 2026-06-01 02:02:35,790] Trial 26 finished with value: 0.2304698558265009 and parameters: {'alpha': 256984.59199470864, 'n_pcs': 2500, 'weight_scheme': 'linear', 'weight_clip_max': 5.0, 'weight_linear_min_weight': 0.06703673517369083, 'weight_linear_max_weight': 3.3415246197644817}. Best is trial 23 with value: 0.23197225596808538.
2026-06-01 02:02:35 | INFO | src.nested_cv_avggrm_weighted_unified | Trial 27 | outer=9 | alpha=4.661e+05 n_pcs=2000 (pc_topk) weight_search=on
2026-06-01 02:02:35 | INFO | src.nested_cv_avggrm_weighted_unified | Trial 27 | outer=9 | weight={'name': 'linear', 'floor': 1e-06, 'clip_max': 5.0, 'min_weight': 0.2222629648986431, 'max_weight': 3.8958644076052833}
[I 2026-06-01 02:02:38,823] Trial 27 finished with value: 0.22293082682740692 and parameters: {'alpha': 466079.1548342122, 'n_pcs': 2000, 'weight_scheme': 'linear', 'weight_clip_max': 5.0, 'weight_linear_min_weight': 0.2222629648986431, 'weight_linear_max_weight': 3.8958644076052833}. Best is trial 23 with value: 0.23197225596808538.
2026-06-01 02:02:38 | INFO | src.nested_cv_avggrm_weighted_unified | Trial 28 | outer=9 | alpha=1.232e+05 n_pcs=2500 (pc_topk) weight_search=on
2026-06-01 02:02:38 | INFO | src.nested_cv_avggrm_weighted_unified | Trial 28 | outer=9 | weight={'name': 'exponential', 'floor': 1e-06, 'clip_max': 3.0, 'beta': 4.7891066221006735}
[I 2026-06-01 02:02:42,046] Trial 28 finished with value: 0.2339384975360017 and parameters: {'alpha': 123242.58908152914, 'n_pcs': 2500, 'weight_scheme': 'exponential', 'weight_clip_max': 3.0, 'weight_exponential_beta': 4.7891066221006735}. Best is trial 28 with value: 0.2339384975360017.
2026-06-01 02:02:42 | INFO | src.nested_cv_avggrm_weighted_unified | OUTER 9 | new best trial 28 (mean inner r=0.2339) saved to outputs/final_results/e6_pc_ridge_avggrm/thr_wing/e6_pc_ridge_avggrm_thr_wing_best_trials/split_09_best_trial.json
2026-06-01 02:02:42 | INFO | src.nested_cv_avggrm_weighted_unified | Trial 29 | outer=9 | alpha=1.417e+05 n_pcs=4500 (pc_topk) weight_search=on
2026-06-01 02:02:42 | INFO | src.nested_cv_avggrm_weighted_unified | Trial 29 | outer=9 | weight={'name': 'exponential', 'floor': 1e-06, 'clip_max': None, 'beta': 5.113232985555226}
[I 2026-06-01 02:02:49,041] Trial 29 finished with value: 0.22676025600687807 and parameters: {'alpha': 141681.60703804236, 'n_pcs': 4500, 'weight_scheme': 'exponential', 'weight_clip_max': None, 'weight_exponential_beta': 5.113232985555226}. Best is trial 28 with value: 0.2339384975360017.
2026-06-01 02:02:49 | INFO | src.nested_cv_avggrm_weighted_unified | Trial 30 | outer=9 | alpha=1.132e+05 n_pcs=1000 (pc_topk) weight_search=on
2026-06-01 02:02:49 | INFO | src.nested_cv_avggrm_weighted_unified | Trial 30 | outer=9 | weight={'name': 'exponential', 'floor': 1e-06, 'clip_max': 10.0, 'beta': 4.9836087082197515}
[I 2026-06-01 02:02:50,460] Trial 30 finished with value: 0.22505569939554734 and parameters: {'alpha': 113236.1556321762, 'n_pcs': 1000, 'weight_scheme': 'exponential', 'weight_clip_max': 10.0, 'weight_exponential_beta': 4.9836087082197515}. Best is trial 28 with value: 0.2339384975360017.
2026-06-01 02:02:50 | INFO | src.nested_cv_avggrm_weighted_unified | Trial 31 | outer=9 | alpha=1.703e+05 n_pcs=2500 (pc_topk) weight_search=on
2026-06-01 02:02:50 | INFO | src.nested_cv_avggrm_weighted_unified | Trial 31 | outer=9 | weight={'name': 'exponential', 'floor': 1e-06, 'clip_max': 3.0, 'beta': 5.380666553518518}
[I 2026-06-01 02:02:53,404] Trial 31 finished with value: 0.23315719410314673 and parameters: {'alpha': 170297.32592350693, 'n_pcs': 2500, 'weight_scheme': 'exponential', 'weight_clip_max': 3.0, 'weight_exponential_beta': 5.380666553518518}. Best is trial 28 with value: 0.2339384975360017.
2026-06-01 02:02:53 | INFO | src.nested_cv_avggrm_weighted_unified | Trial 32 | outer=9 | alpha=1.780e+05 n_pcs=2500 (pc_topk) weight_search=on
2026-06-01 02:02:53 | INFO | src.nested_cv_avggrm_weighted_unified | Trial 32 | outer=9 | weight={'name': 'exponential', 'floor': 1e-06, 'clip_max': 3.0, 'beta': 5.286626836321336}
[I 2026-06-01 02:02:56,338] Trial 32 finished with value: 0.23300040478894485 and parameters: {'alpha': 178002.9520461622, 'n_pcs': 2500, 'weight_scheme': 'exponential', 'weight_clip_max': 3.0, 'weight_exponential_beta': 5.286626836321336}. Best is trial 28 with value: 0.2339384975360017.
2026-06-01 02:02:56 | INFO | src.nested_cv_avggrm_weighted_unified | Trial 33 | outer=9 | alpha=1.039e+06 n_pcs=2000 (pc_topk) weight_search=on
2026-06-01 02:02:56 | INFO | src.nested_cv_avggrm_weighted_unified | Trial 33 | outer=9 | weight={'name': 'exponential', 'floor': 1e-06, 'clip_max': 3.0, 'beta': 5.242117658503695}
2026-06-01 02:02:57 | INFO | src.nested_cv_avggrm_weighted_unified | Trial 33 | outer=9 | pruned after 7/10 inner folds (mean r=0.2366)
[I 2026-06-01 02:02:57,921] Trial 33 pruned. 
2026-06-01 02:02:57 | INFO | src.nested_cv_avggrm_weighted_unified | Trial 34 | outer=9 | alpha=1.905e+06 n_pcs=2000 (pc_topk) weight_search=on
2026-06-01 02:02:57 | INFO | src.nested_cv_avggrm_weighted_unified | Trial 34 | outer=9 | weight={'name': 'exponential', 'floor': 1e-06, 'clip_max': 3.0, 'beta': 6.736927370734595}
2026-06-01 02:02:58 | INFO | src.nested_cv_avggrm_weighted_unified | Trial 34 | outer=9 | pruned after 5/10 inner folds (mean r=0.2161)
[I 2026-06-01 02:02:58,996] Trial 34 pruned. 
2026-06-01 02:02:59 | INFO | src.nested_cv_avggrm_weighted_unified | Trial 35 | outer=9 | alpha=5.034e+05 n_pcs=3500 (pc_topk) weight_search=on
2026-06-01 02:02:59 | INFO | src.nested_cv_avggrm_weighted_unified | Trial 35 | outer=9 | weight={'name': 'exponential', 'floor': 1e-06, 'clip_max': 3.0, 'beta': 3.38804422231168}
[I 2026-06-01 02:03:04,753] Trial 35 finished with value: 0.22476893319369284 and parameters: {'alpha': 503351.5680891602, 'n_pcs': 3500, 'weight_scheme': 'exponential', 'weight_clip_max': 3.0, 'weight_exponential_beta': 3.38804422231168}. Best is trial 28 with value: 0.2339384975360017.
2026-06-01 02:03:04 | INFO | src.nested_cv_avggrm_weighted_unified | Trial 36 | outer=9 | alpha=9.749e+04 n_pcs=2500 (pc_topk) weight_search=on
2026-06-01 02:03:04 | INFO | src.nested_cv_avggrm_weighted_unified | Trial 36 | outer=9 | weight={'name': 'exponential', 'floor': 1e-06, 'clip_max': 3.0, 'beta': 6.909718283638223}
[I 2026-06-01 02:03:07,822] Trial 36 finished with value: 0.23345325258953684 and parameters: {'alpha': 97490.51324634228, 'n_pcs': 2500, 'weight_scheme': 'exponential', 'weight_clip_max': 3.0, 'weight_exponential_beta': 6.909718283638223}. Best is trial 28 with value: 0.2339384975360017.
2026-06-01 02:03:07 | INFO | src.nested_cv_avggrm_weighted_unified | Trial 37 | outer=9 | alpha=9.183e+04 n_pcs=1500 (pc_topk) weight_search=on
2026-06-01 02:03:07 | INFO | src.nested_cv_avggrm_weighted_unified | Trial 37 | outer=9 | weight={'name': 'exponential', 'floor': 1e-06, 'clip_max': 3.0, 'beta': 6.684350703659362}
2026-06-01 02:03:10 | INFO | src.nested_cv_avggrm_weighted_unified | Trial 37 | outer=9 | pruned after 8/10 inner folds (mean r=0.2475)
[I 2026-06-01 02:03:10,805] Trial 37 pruned. 
2026-06-01 02:03:10 | INFO | src.nested_cv_avggrm_weighted_unified | Trial 38 | outer=9 | alpha=2.582e+04 n_pcs=2000 (pc_topk) weight_search=on
2026-06-01 02:03:10 | INFO | src.nested_cv_avggrm_weighted_unified | Trial 38 | outer=9 | weight={'name': 'exponential', 'floor': 1e-06, 'clip_max': 3.0, 'beta': 6.611875285376952}
2026-06-01 02:03:12 | INFO | src.nested_cv_avggrm_weighted_unified | Trial 38 | outer=9 | pruned after 7/10 inner folds (mean r=0.2067)
[I 2026-06-01 02:03:12,673] Trial 38 pruned. 
2026-06-01 02:03:12 | INFO | src.nested_cv_avggrm_weighted_unified | Trial 39 | outer=9 | alpha=2.287e+05 n_pcs=2500 (pc_topk) weight_search=on
2026-06-01 02:03:12 | INFO | src.nested_cv_avggrm_weighted_unified | Trial 39 | outer=9 | weight={'name': 'exponential', 'floor': 1e-06, 'clip_max': 3.0, 'beta': 4.445676387472996}
[I 2026-06-01 02:03:16,347] Trial 39 finished with value: 0.231871766581504 and parameters: {'alpha': 228683.7707624267, 'n_pcs': 2500, 'weight_scheme': 'exponential', 'weight_clip_max': 3.0, 'weight_exponential_beta': 4.445676387472996}. Best is trial 28 with value: 0.2339384975360017.
2026-06-01 02:03:16 | INFO | src.nested_cv_avggrm_weighted_unified | Trial 40 | outer=9 | alpha=8.122e+04 n_pcs=3000 (pc_topk) weight_search=on
2026-06-01 02:03:16 | INFO | src.nested_cv_avggrm_weighted_unified | Trial 40 | outer=9 | weight={'name': 'exponential', 'floor': 1e-06, 'clip_max': 3.0, 'beta': 3.6107910291078458}
[I 2026-06-01 02:03:20,188] Trial 40 finished with value: 0.23367776930360776 and parameters: {'alpha': 81224.18494477567, 'n_pcs': 3000, 'weight_scheme': 'exponential', 'weight_clip_max': 3.0, 'weight_exponential_beta': 3.6107910291078458}. Best is trial 28 with value: 0.2339384975360017.
2026-06-01 02:03:20 | INFO | src.nested_cv_avggrm_weighted_unified | Trial 41 | outer=9 | alpha=9.082e+04 n_pcs=3000 (pc_topk) weight_search=on
2026-06-01 02:03:20 | INFO | src.nested_cv_avggrm_weighted_unified | Trial 41 | outer=9 | weight={'name': 'exponential', 'floor': 1e-06, 'clip_max': 3.0, 'beta': 3.5997555898542886}
[I 2026-06-01 02:03:24,017] Trial 41 finished with value: 0.23378762911095982 and parameters: {'alpha': 90818.36940331585, 'n_pcs': 3000, 'weight_scheme': 'exponential', 'weight_clip_max': 3.0, 'weight_exponential_beta': 3.5997555898542886}. Best is trial 28 with value: 0.2339384975360017.
2026-06-01 02:03:24 | INFO | src.nested_cv_avggrm_weighted_unified | Trial 42 | outer=9 | alpha=8.037e+04 n_pcs=3000 (pc_topk) weight_search=on
2026-06-01 02:03:24 | INFO | src.nested_cv_avggrm_weighted_unified | Trial 42 | outer=9 | weight={'name': 'exponential', 'floor': 1e-06, 'clip_max': 3.0, 'beta': 3.230015998111852}
[I 2026-06-01 02:03:27,818] Trial 42 finished with value: 0.23373942950650348 and parameters: {'alpha': 80370.21746587384, 'n_pcs': 3000, 'weight_scheme': 'exponential', 'weight_clip_max': 3.0, 'weight_exponential_beta': 3.230015998111852}. Best is trial 28 with value: 0.2339384975360017.
2026-06-01 02:03:27 | INFO | src.nested_cv_avggrm_weighted_unified | Trial 43 | outer=9 | alpha=8.414e+04 n_pcs=3000 (pc_topk) weight_search=on
2026-06-01 02:03:27 | INFO | src.nested_cv_avggrm_weighted_unified | Trial 43 | outer=9 | weight={'name': 'exponential', 'floor': 1e-06, 'clip_max': 3.0, 'beta': 2.934295265050402}
[I 2026-06-01 02:03:31,865] Trial 43 finished with value: 0.23376431774235357 and parameters: {'alpha': 84140.61163763741, 'n_pcs': 3000, 'weight_scheme': 'exponential', 'weight_clip_max': 3.0, 'weight_exponential_beta': 2.934295265050402}. Best is trial 28 with value: 0.2339384975360017.
2026-06-01 02:03:31 | INFO | src.nested_cv_avggrm_weighted_unified | Trial 44 | outer=9 | alpha=1.819e+04 n_pcs=4000 (pc_topk) weight_search=on
2026-06-01 02:03:31 | INFO | src.nested_cv_avggrm_weighted_unified | Trial 44 | outer=9 | weight={'name': 'exponential', 'floor': 1e-06, 'clip_max': 3.0, 'beta': 2.3383314807475886}
[I 2026-06-01 02:03:37,981] Trial 44 finished with value: 0.2209623628219612 and parameters: {'alpha': 18194.944810144396, 'n_pcs': 4000, 'weight_scheme': 'exponential', 'weight_clip_max': 3.0, 'weight_exponential_beta': 2.3383314807475886}. Best is trial 28 with value: 0.2339384975360017.
2026-06-01 02:03:37 | INFO | src.nested_cv_avggrm_weighted_unified | Trial 45 | outer=9 | alpha=6.882e+04 n_pcs=3500 (pc_topk) weight_search=on
2026-06-01 02:03:37 | INFO | src.nested_cv_avggrm_weighted_unified | Trial 45 | outer=9 | weight={'name': 'exponential', 'floor': 1e-06, 'clip_max': 20.0, 'beta': 3.0968036102727567}
