[I 2026-06-01 02:55:14,646] Trial 112 finished with value: 0.22754136179084145 and parameters: {'alpha': 67645.47060420908, 'n_pcs': 4500, 'weight_scheme': 'linear', 'weight_clip_max': 3.0, 'weight_linear_min_weight': 0.49959960862605585, 'weight_linear_max_weight': 4.667394862692985}. Best is trial 111 with value: 0.22757049682419658.
2026-06-01 02:55:14 | INFO | src.nested_cv_avggrm_weighted_unified | Trial 113 | outer=11 | alpha=6.231e+04 n_pcs=4500 (pc_topk) weight_search=on
2026-06-01 02:55:14 | INFO | src.nested_cv_avggrm_weighted_unified | Trial 113 | outer=11 | weight={'name': 'linear', 'floor': 1e-06, 'clip_max': 3.0, 'min_weight': 0.48190080818878916, 'max_weight': 4.659030820672498}
[I 2026-06-01 02:55:21,703] Trial 113 finished with value: 0.22756137196672213 and parameters: {'alpha': 62309.792728865556, 'n_pcs': 4500, 'weight_scheme': 'linear', 'weight_clip_max': 3.0, 'weight_linear_min_weight': 0.48190080818878916, 'weight_linear_max_weight': 4.659030820672498}. Best is trial 111 with value: 0.22757049682419658.
2026-06-01 02:55:21 | INFO | src.nested_cv_avggrm_weighted_unified | Trial 114 | outer=11 | alpha=5.974e+04 n_pcs=4500 (pc_topk) weight_search=on
2026-06-01 02:55:21 | INFO | src.nested_cv_avggrm_weighted_unified | Trial 114 | outer=11 | weight={'name': 'linear', 'floor': 1e-06, 'clip_max': 3.0, 'min_weight': 0.4945645415007536, 'max_weight': 4.662769966156802}
[I 2026-06-01 02:55:28,774] Trial 114 finished with value: 0.2275028903569703 and parameters: {'alpha': 59739.31845636705, 'n_pcs': 4500, 'weight_scheme': 'linear', 'weight_clip_max': 3.0, 'weight_linear_min_weight': 0.4945645415007536, 'weight_linear_max_weight': 4.662769966156802}. Best is trial 111 with value: 0.22757049682419658.
2026-06-01 02:55:28 | INFO | src.nested_cv_avggrm_weighted_unified | Trial 115 | outer=11 | alpha=6.401e+04 n_pcs=4500 (pc_topk) weight_search=on
2026-06-01 02:55:28 | INFO | src.nested_cv_avggrm_weighted_unified | Trial 115 | outer=11 | weight={'name': 'linear', 'floor': 1e-06, 'clip_max': 3.0, 'min_weight': 0.4870068595099732, 'max_weight': 4.6838807991295885}
[I 2026-06-01 02:55:35,828] Trial 115 finished with value: 0.22756864933922777 and parameters: {'alpha': 64006.64927169046, 'n_pcs': 4500, 'weight_scheme': 'linear', 'weight_clip_max': 3.0, 'weight_linear_min_weight': 0.4870068595099732, 'weight_linear_max_weight': 4.6838807991295885}. Best is trial 111 with value: 0.22757049682419658.
2026-06-01 02:55:35 | INFO | src.nested_cv_avggrm_weighted_unified | Trial 116 | outer=11 | alpha=6.100e+04 n_pcs=4500 (pc_topk) weight_search=on
2026-06-01 02:55:35 | INFO | src.nested_cv_avggrm_weighted_unified | Trial 116 | outer=11 | weight={'name': 'uniform', 'floor': 1e-06, 'clip_max': 3.0}
[I 2026-06-01 02:55:41,993] Trial 116 finished with value: 0.22094203523709885 and parameters: {'alpha': 60995.6916269928, 'n_pcs': 4500, 'weight_scheme': 'uniform', 'weight_clip_max': 3.0}. Best is trial 111 with value: 0.22757049682419658.
2026-06-01 02:55:41 | INFO | src.nested_cv_avggrm_weighted_unified | Trial 117 | outer=11 | alpha=4.644e+04 n_pcs=5000 (pc_topk) weight_search=on
2026-06-01 02:55:42 | INFO | src.nested_cv_avggrm_weighted_unified | Trial 117 | outer=11 | weight={'name': 'linear', 'floor': 1e-06, 'clip_max': 3.0, 'min_weight': 0.48209146220823884, 'max_weight': 4.6549672321544415}
[I 2026-06-01 02:55:50,269] Trial 117 finished with value: 0.22547480397942993 and parameters: {'alpha': 46436.00656324835, 'n_pcs': 5000, 'weight_scheme': 'linear', 'weight_clip_max': 3.0, 'weight_linear_min_weight': 0.48209146220823884, 'weight_linear_max_weight': 4.6549672321544415}. Best is trial 111 with value: 0.22757049682419658.
2026-06-01 02:55:50 | INFO | src.nested_cv_avggrm_weighted_unified | Trial 118 | outer=11 | alpha=3.983e+04 n_pcs=4500 (pc_topk) weight_search=on
2026-06-01 02:55:50 | INFO | src.nested_cv_avggrm_weighted_unified | Trial 118 | outer=11 | weight={'name': 'exponential', 'floor': 1e-06, 'clip_max': 3.0, 'beta': 7.929111359664503}
[I 2026-06-01 02:55:57,337] Trial 118 finished with value: 0.22404828583293046 and parameters: {'alpha': 39827.89668938964, 'n_pcs': 4500, 'weight_scheme': 'exponential', 'weight_clip_max': 3.0, 'weight_exponential_beta': 7.929111359664503}. Best is trial 111 with value: 0.22757049682419658.
2026-06-01 02:55:57 | INFO | src.nested_cv_avggrm_weighted_unified | Trial 119 | outer=11 | alpha=2.807e+04 n_pcs=4500 (pc_topk) weight_search=on
2026-06-01 02:55:57 | INFO | src.nested_cv_avggrm_weighted_unified | Trial 119 | outer=11 | weight={'name': 'linear', 'floor': 1e-06, 'clip_max': 3.0, 'min_weight': 0.5370801347058674, 'max_weight': 4.695038576698739}
[I 2026-06-01 02:56:04,384] Trial 119 finished with value: 0.22389143342144338 and parameters: {'alpha': 28071.02980951715, 'n_pcs': 4500, 'weight_scheme': 'linear', 'weight_clip_max': 3.0, 'weight_linear_min_weight': 0.5370801347058674, 'weight_linear_max_weight': 4.695038576698739}. Best is trial 111 with value: 0.22757049682419658.
2026-06-01 02:56:04 | INFO | src.nested_cv_avggrm_weighted_unified | Trial 120 | outer=11 | alpha=5.794e+04 n_pcs=4500 (pc_topk) weight_search=on
2026-06-01 02:56:04 | INFO | src.nested_cv_avggrm_weighted_unified | Trial 120 | outer=11 | weight={'name': 'linear', 'floor': 1e-06, 'clip_max': 3.0, 'min_weight': 0.48030308990496795, 'max_weight': 4.87859697374736}
[I 2026-06-01 02:56:11,443] Trial 120 finished with value: 0.22753661427664734 and parameters: {'alpha': 57942.19082540689, 'n_pcs': 4500, 'weight_scheme': 'linear', 'weight_clip_max': 3.0, 'weight_linear_min_weight': 0.48030308990496795, 'weight_linear_max_weight': 4.87859697374736}. Best is trial 111 with value: 0.22757049682419658.
2026-06-01 02:56:11 | INFO | src.nested_cv_avggrm_weighted_unified | Trial 121 | outer=11 | alpha=5.304e+04 n_pcs=4500 (pc_topk) weight_search=on
2026-06-01 02:56:11 | INFO | src.nested_cv_avggrm_weighted_unified | Trial 121 | outer=11 | weight={'name': 'linear', 'floor': 1e-06, 'clip_max': 3.0, 'min_weight': 0.48653755203506555, 'max_weight': 4.864739175143585}
[I 2026-06-01 02:56:18,500] Trial 121 finished with value: 0.22737394199819408 and parameters: {'alpha': 53036.115732501086, 'n_pcs': 4500, 'weight_scheme': 'linear', 'weight_clip_max': 3.0, 'weight_linear_min_weight': 0.48653755203506555, 'weight_linear_max_weight': 4.864739175143585}. Best is trial 111 with value: 0.22757049682419658.
2026-06-01 02:56:18 | INFO | src.nested_cv_avggrm_weighted_unified | Trial 122 | outer=11 | alpha=5.611e+04 n_pcs=4500 (pc_topk) weight_search=on
2026-06-01 02:56:18 | INFO | src.nested_cv_avggrm_weighted_unified | Trial 122 | outer=11 | weight={'name': 'linear', 'floor': 1e-06, 'clip_max': 3.0, 'min_weight': 0.4964593470994749, 'max_weight': 4.812547510085066}
[I 2026-06-01 02:56:25,563] Trial 122 finished with value: 0.2274526519534743 and parameters: {'alpha': 56112.3825946474, 'n_pcs': 4500, 'weight_scheme': 'linear', 'weight_clip_max': 3.0, 'weight_linear_min_weight': 0.4964593470994749, 'weight_linear_max_weight': 4.812547510085066}. Best is trial 111 with value: 0.22757049682419658.
2026-06-01 02:56:25 | INFO | src.nested_cv_avggrm_weighted_unified | Trial 123 | outer=11 | alpha=6.538e+04 n_pcs=4500 (pc_topk) weight_search=on
2026-06-01 02:56:25 | INFO | src.nested_cv_avggrm_weighted_unified | Trial 123 | outer=11 | weight={'name': 'linear', 'floor': 1e-06, 'clip_max': 3.0, 'min_weight': 0.4898125902493557, 'max_weight': 4.759117189064911}
[I 2026-06-01 02:56:32,622] Trial 123 finished with value: 0.22758590238306894 and parameters: {'alpha': 65379.76157034089, 'n_pcs': 4500, 'weight_scheme': 'linear', 'weight_clip_max': 3.0, 'weight_linear_min_weight': 0.4898125902493557, 'weight_linear_max_weight': 4.759117189064911}. Best is trial 123 with value: 0.22758590238306894.
2026-06-01 02:56:32 | INFO | src.nested_cv_avggrm_weighted_unified | OUTER 11 | new best trial 123 (mean inner r=0.2276) saved to outputs/final_results/e6_pc_ridge_avggrm/thr_wing/e6_pc_ridge_avggrm_thr_wing_best_trials/split_11_best_trial.json
2026-06-01 02:56:32 | INFO | src.nested_cv_avggrm_weighted_unified | Trial 124 | outer=11 | alpha=6.686e+04 n_pcs=5000 (pc_topk) weight_search=on
2026-06-01 02:56:32 | INFO | src.nested_cv_avggrm_weighted_unified | Trial 124 | outer=11 | weight={'name': 'linear', 'floor': 1e-06, 'clip_max': 3.0, 'min_weight': 0.4994497229369306, 'max_weight': 4.872943036814097}
[I 2026-06-01 02:56:40,941] Trial 124 finished with value: 0.2261573016830971 and parameters: {'alpha': 66857.91749865297, 'n_pcs': 5000, 'weight_scheme': 'linear', 'weight_clip_max': 3.0, 'weight_linear_min_weight': 0.4994497229369306, 'weight_linear_max_weight': 4.872943036814097}. Best is trial 123 with value: 0.22758590238306894.
2026-06-01 02:56:40 | INFO | src.nested_cv_avggrm_weighted_unified | Trial 125 | outer=11 | alpha=3.329e+04 n_pcs=4500 (pc_topk) weight_search=on
2026-06-01 02:56:40 | INFO | src.nested_cv_avggrm_weighted_unified | Trial 125 | outer=11 | weight={'name': 'linear', 'floor': 1e-06, 'clip_max': 3.0, 'min_weight': 0.47120033568090713, 'max_weight': 4.776239140629544}
[I 2026-06-01 02:56:47,983] Trial 125 finished with value: 0.22527863161360737 and parameters: {'alpha': 33292.17146663101, 'n_pcs': 4500, 'weight_scheme': 'linear', 'weight_clip_max': 3.0, 'weight_linear_min_weight': 0.47120033568090713, 'weight_linear_max_weight': 4.776239140629544}. Best is trial 123 with value: 0.22758590238306894.
2026-06-01 02:56:47 | INFO | src.nested_cv_avggrm_weighted_unified | Trial 126 | outer=11 | alpha=6.343e+04 n_pcs=5000 (pc_topk) weight_search=on
2026-06-01 02:56:47 | INFO | src.nested_cv_avggrm_weighted_unified | Trial 126 | outer=11 | weight={'name': 'linear', 'floor': 1e-06, 'clip_max': 3.0, 'min_weight': 0.4511671272836607, 'max_weight': 4.759757229538622}
[I 2026-06-01 02:56:56,278] Trial 126 finished with value: 0.22619231722603367 and parameters: {'alpha': 63429.44215210361, 'n_pcs': 5000, 'weight_scheme': 'linear', 'weight_clip_max': 3.0, 'weight_linear_min_weight': 0.4511671272836607, 'weight_linear_max_weight': 4.759757229538622}. Best is trial 123 with value: 0.22758590238306894.
2026-06-01 02:56:56 | INFO | src.nested_cv_avggrm_weighted_unified | Trial 127 | outer=11 | alpha=4.729e+04 n_pcs=4500 (pc_topk) weight_search=on
2026-06-01 02:56:56 | INFO | src.nested_cv_avggrm_weighted_unified | Trial 127 | outer=11 | weight={'name': 'linear', 'floor': 1e-06, 'clip_max': 3.0, 'min_weight': 0.4913596976992839, 'max_weight': 4.892382251973972}
[I 2026-06-01 02:57:03,333] Trial 127 finished with value: 0.2270664470147409 and parameters: {'alpha': 47287.53550178922, 'n_pcs': 4500, 'weight_scheme': 'linear', 'weight_clip_max': 3.0, 'weight_linear_min_weight': 0.4913596976992839, 'weight_linear_max_weight': 4.892382251973972}. Best is trial 123 with value: 0.22758590238306894.
2026-06-01 02:57:03 | INFO | src.nested_cv_avggrm_weighted_unified | Trial 128 | outer=11 | alpha=3.960e+04 n_pcs=4500 (pc_topk) weight_search=on
2026-06-01 02:57:03 | INFO | src.nested_cv_avggrm_weighted_unified | Trial 128 | outer=11 | weight={'name': 'linear', 'floor': 1e-06, 'clip_max': 3.0, 'min_weight': 0.5141618953742347, 'max_weight': 4.705708364140168}
[I 2026-06-01 02:57:10,385] Trial 128 finished with value: 0.22630029938510723 and parameters: {'alpha': 39598.38037152202, 'n_pcs': 4500, 'weight_scheme': 'linear', 'weight_clip_max': 3.0, 'weight_linear_min_weight': 0.5141618953742347, 'weight_linear_max_weight': 4.705708364140168}. Best is trial 123 with value: 0.22758590238306894.
2026-06-01 02:57:10 | INFO | src.nested_cv_avggrm_weighted_unified | Trial 129 | outer=11 | alpha=2.597e+04 n_pcs=4000 (pc_topk) weight_search=on
2026-06-01 02:57:10 | INFO | src.nested_cv_avggrm_weighted_unified | Trial 129 | outer=11 | weight={'name': 'linear', 'floor': 1e-06, 'clip_max': 3.0, 'min_weight': 0.4212254312535948, 'max_weight': 4.562087647384253}
[I 2026-06-01 02:57:16,175] Trial 129 finished with value: 0.2194206535032736 and parameters: {'alpha': 25969.198245111256, 'n_pcs': 4000, 'weight_scheme': 'linear', 'weight_clip_max': 3.0, 'weight_linear_min_weight': 0.4212254312535948, 'weight_linear_max_weight': 4.562087647384253}. Best is trial 123 with value: 0.22758590238306894.
2026-06-01 02:57:16 | INFO | src.nested_cv_avggrm_weighted_unified | Trial 130 | outer=11 | alpha=5.878e+04 n_pcs=4500 (pc_topk) weight_search=on
2026-06-01 02:57:16 | INFO | src.nested_cv_avggrm_weighted_unified | Trial 130 | outer=11 | weight={'name': 'linear', 'floor': 1e-06, 'clip_max': 3.0, 'min_weight': 0.5599532375355785, 'max_weight': 4.803988202934743}
[I 2026-06-01 02:57:23,217] Trial 130 finished with value: 0.2273899243660126 and parameters: {'alpha': 58778.1430478436, 'n_pcs': 4500, 'weight_scheme': 'linear', 'weight_clip_max': 3.0, 'weight_linear_min_weight': 0.5599532375355785, 'weight_linear_max_weight': 4.803988202934743}. Best is trial 123 with value: 0.22758590238306894.
2026-06-01 02:57:23 | INFO | src.nested_cv_avggrm_weighted_unified | Trial 131 | outer=11 | alpha=6.022e+04 n_pcs=4500 (pc_topk) weight_search=on
2026-06-01 02:57:23 | INFO | src.nested_cv_avggrm_weighted_unified | Trial 131 | outer=11 | weight={'name': 'linear', 'floor': 1e-06, 'clip_max': 3.0, 'min_weight': 0.5482832092342365, 'max_weight': 4.758485296307367}
[I 2026-06-01 02:57:30,276] Trial 131 finished with value: 0.22742297990871668 and parameters: {'alpha': 60220.04651375338, 'n_pcs': 4500, 'weight_scheme': 'linear', 'weight_clip_max': 3.0, 'weight_linear_min_weight': 0.5482832092342365, 'weight_linear_max_weight': 4.758485296307367}. Best is trial 123 with value: 0.22758590238306894.
2026-06-01 02:57:30 | INFO | src.nested_cv_avggrm_weighted_unified | Trial 132 | outer=11 | alpha=6.326e+04 n_pcs=4500 (pc_topk) weight_search=on
2026-06-01 02:57:30 | INFO | src.nested_cv_avggrm_weighted_unified | Trial 132 | outer=11 | weight={'name': 'linear', 'floor': 1e-06, 'clip_max': 3.0, 'min_weight': 0.5644620218236762, 'max_weight': 4.787272550574819}
[I 2026-06-01 02:57:37,327] Trial 132 finished with value: 0.22741978502754018 and parameters: {'alpha': 63255.18666896441, 'n_pcs': 4500, 'weight_scheme': 'linear', 'weight_clip_max': 3.0, 'weight_linear_min_weight': 0.5644620218236762, 'weight_linear_max_weight': 4.787272550574819}. Best is trial 123 with value: 0.22758590238306894.
2026-06-01 02:57:37 | INFO | src.nested_cv_avggrm_weighted_unified | Trial 133 | outer=11 | alpha=6.787e+04 n_pcs=4500 (pc_topk) weight_search=on
2026-06-01 02:57:37 | INFO | src.nested_cv_avggrm_weighted_unified | Trial 133 | outer=11 | weight={'name': 'linear', 'floor': 1e-06, 'clip_max': 3.0, 'min_weight': 0.5555969763736293, 'max_weight': 4.788846366720907}
[I 2026-06-01 02:57:44,440] Trial 133 finished with value: 0.22744003202117824 and parameters: {'alpha': 67865.60939388747, 'n_pcs': 4500, 'weight_scheme': 'linear', 'weight_clip_max': 3.0, 'weight_linear_min_weight': 0.5555969763736293, 'weight_linear_max_weight': 4.788846366720907}. Best is trial 123 with value: 0.22758590238306894.
2026-06-01 02:57:44 | INFO | src.nested_cv_avggrm_weighted_unified | Trial 134 | outer=11 | alpha=6.823e+04 n_pcs=5000 (pc_topk) weight_search=on
2026-06-01 02:57:44 | INFO | src.nested_cv_avggrm_weighted_unified | Trial 134 | outer=11 | weight={'name': 'linear', 'floor': 1e-06, 'clip_max': 3.0, 'min_weight': 0.5226950593763338, 'max_weight': 4.99734383091522}
[I 2026-06-01 02:57:52,734] Trial 134 finished with value: 0.22613920006033492 and parameters: {'alpha': 68228.75516043499, 'n_pcs': 5000, 'weight_scheme': 'linear', 'weight_clip_max': 3.0, 'weight_linear_min_weight': 0.5226950593763338, 'weight_linear_max_weight': 4.99734383091522}. Best is trial 123 with value: 0.22758590238306894.
2026-06-01 02:57:52 | INFO | src.nested_cv_avggrm_weighted_unified | Trial 135 | outer=11 | alpha=7.200e+04 n_pcs=4500 (pc_topk) weight_search=on
2026-06-01 02:57:52 | INFO | src.nested_cv_avggrm_weighted_unified | Trial 135 | outer=11 | weight={'name': 'linear', 'floor': 1e-06, 'clip_max': 3.0, 'min_weight': 0.5498270001613166, 'max_weight': 4.745258701164735}
[I 2026-06-01 02:57:59,787] Trial 135 finished with value: 0.22741031171115153 and parameters: {'alpha': 71999.71880862513, 'n_pcs': 4500, 'weight_scheme': 'linear', 'weight_clip_max': 3.0, 'weight_linear_min_weight': 0.5498270001613166, 'weight_linear_max_weight': 4.745258701164735}. Best is trial 123 with value: 0.22758590238306894.
2026-06-01 02:57:59 | INFO | src.nested_cv_avggrm_weighted_unified | Trial 136 | outer=11 | alpha=4.075e+04 n_pcs=4000 (pc_topk) weight_search=on
2026-06-01 02:57:59 | INFO | src.nested_cv_avggrm_weighted_unified | Trial 136 | outer=11 | weight={'name': 'linear', 'floor': 1e-06, 'clip_max': 3.0, 'min_weight': 0.4543082249255746, 'max_weight': 4.458580758715294}
[I 2026-06-01 02:58:05,567] Trial 136 finished with value: 0.22435254866752552 and parameters: {'alpha': 40748.09949721144, 'n_pcs': 4000, 'weight_scheme': 'linear', 'weight_clip_max': 3.0, 'weight_linear_min_weight': 0.4543082249255746, 'weight_linear_max_weight': 4.458580758715294}. Best is trial 123 with value: 0.22758590238306894.
2026-06-01 02:58:05 | INFO | src.nested_cv_avggrm_weighted_unified | Trial 137 | outer=11 | alpha=3.378e+04 n_pcs=4500 (pc_topk) weight_search=on
2026-06-01 02:58:05 | INFO | src.nested_cv_avggrm_weighted_unified | Trial 137 | outer=11 | weight={'name': 'linear', 'floor': 1e-06, 'clip_max': 3.0, 'min_weight': 0.6299544622122146, 'max_weight': 4.554424276734511}
[I 2026-06-01 02:58:12,627] Trial 137 finished with value: 0.22528989145154163 and parameters: {'alpha': 33777.36060949596, 'n_pcs': 4500, 'weight_scheme': 'linear', 'weight_clip_max': 3.0, 'weight_linear_min_weight': 0.6299544622122146, 'weight_linear_max_weight': 4.554424276734511}. Best is trial 123 with value: 0.22758590238306894.
2026-06-01 02:58:12 | INFO | src.nested_cv_avggrm_weighted_unified | Trial 138 | outer=11 | alpha=9.933e+04 n_pcs=5000 (pc_topk) weight_search=on
2026-06-01 02:58:12 | INFO | src.nested_cv_avggrm_weighted_unified | Trial 138 | outer=11 | weight={'name': 'linear', 'floor': 1e-06, 'clip_max': None, 'min_weight': 0.5066297660860586, 'max_weight': 4.811135873386422}
[I 2026-06-01 02:58:20,936] Trial 138 finished with value: 0.2253609424349267 and parameters: {'alpha': 99329.47056479375, 'n_pcs': 5000, 'weight_scheme': 'linear', 'weight_clip_max': None, 'weight_linear_min_weight': 0.5066297660860586, 'weight_linear_max_weight': 4.811135873386422}. Best is trial 123 with value: 0.22758590238306894.
2026-06-01 02:58:20 | INFO | src.nested_cv_avggrm_weighted_unified | Trial 139 | outer=11 | alpha=6.185e+04 n_pcs=4500 (pc_topk) weight_search=on
2026-06-01 02:58:20 | INFO | src.nested_cv_avggrm_weighted_unified | Trial 139 | outer=11 | weight={'name': 'linear', 'floor': 1e-06, 'clip_max': 3.0, 'min_weight': 0.47205497467319835, 'max_weight': 4.918873946749964}
[I 2026-06-01 02:58:28,006] Trial 139 finished with value: 0.2276231238887601 and parameters: {'alpha': 61853.84688597544, 'n_pcs': 4500, 'weight_scheme': 'linear', 'weight_clip_max': 3.0, 'weight_linear_min_weight': 0.47205497467319835, 'weight_linear_max_weight': 4.918873946749964}. Best is trial 139 with value: 0.2276231238887601.
2026-06-01 02:58:28 | INFO | src.nested_cv_avggrm_weighted_unified | OUTER 11 | new best trial 139 (mean inner r=0.2276) saved to outputs/final_results/e6_pc_ridge_avggrm/thr_wing/e6_pc_ridge_avggrm_thr_wing_best_trials/split_11_best_trial.json
2026-06-01 02:58:28 | INFO | src.nested_cv_avggrm_weighted_unified | Trial 140 | outer=11 | alpha=4.469e+04 n_pcs=4000 (pc_topk) weight_search=on
2026-06-01 02:58:28 | INFO | src.nested_cv_avggrm_weighted_unified | Trial 140 | outer=11 | weight={'name': 'uniform', 'floor': 1e-06, 'clip_max': 3.0}
[I 2026-06-01 02:58:33,497] Trial 140 finished with value: 0.2201536631447864 and parameters: {'alpha': 44693.102820768414, 'n_pcs': 4000, 'weight_scheme': 'uniform', 'weight_clip_max': 3.0}. Best is trial 139 with value: 0.2276231238887601.
2026-06-01 02:58:33 | INFO | src.nested_cv_avggrm_weighted_unified | Trial 141 | outer=11 | alpha=6.253e+04 n_pcs=4500 (pc_topk) weight_search=on
2026-06-01 02:58:33 | INFO | src.nested_cv_avggrm_weighted_unified | Trial 141 | outer=11 | weight={'name': 'linear', 'floor': 1e-06, 'clip_max': 3.0, 'min_weight': 0.4706335029989463, 'max_weight': 4.90993977596151}
[I 2026-06-01 02:58:40,540] Trial 141 finished with value: 0.22763174771719014 and parameters: {'alpha': 62530.88495567439, 'n_pcs': 4500, 'weight_scheme': 'linear', 'weight_clip_max': 3.0, 'weight_linear_min_weight': 0.4706335029989463, 'weight_linear_max_weight': 4.90993977596151}. Best is trial 141 with value: 0.22763174771719014.
2026-06-01 02:58:40 | INFO | src.nested_cv_avggrm_weighted_unified | OUTER 11 | new best trial 141 (mean inner r=0.2276) saved to outputs/final_results/e6_pc_ridge_avggrm/thr_wing/e6_pc_ridge_avggrm_thr_wing_best_trials/split_11_best_trial.json
2026-06-01 02:58:40 | INFO | src.nested_cv_avggrm_weighted_unified | Trial 142 | outer=11 | alpha=6.932e+04 n_pcs=4500 (pc_topk) weight_search=on
2026-06-01 02:58:40 | INFO | src.nested_cv_avggrm_weighted_unified | Trial 142 | outer=11 | weight={'name': 'linear', 'floor': 1e-06, 'clip_max': 3.0, 'min_weight': 0.4701569164515931, 'max_weight': 4.918113469477903}
