[I 2026-06-01 21:36:59,496] Trial 113 finished with value: 0.2258553720195914 and parameters: {'alpha': 62575.351641628426, 'n_pcs': 4000, 'iw_method': 'pc_logistic', 'iw_clip_max': 12.0, 'iw_prob_clip': 0.025854134940410316, 'iw_n_components': 40, 'iw_logistic_c': 0.00037801050835785404, 'iw_pca_fit': 'combined', 'iw_solver': 'lbfgs', 'iw_rho': 0.5}. Best is trial 84 with value: 0.2289525216150688.
2026-06-01 21:36:59 | INFO | Trial 114 | outer=7 | alpha=5.116e+04 n_pcs=4000 (pc_topk) weight={'name': 'pc_logistic', 'floor': 1e-06, 'clip_max': 12.0, 'prob_clip': 0.02563643660066302, 'n_components': 40, 'logistic_c': 0.00014322574833948288, 'pca_fit': 'combined', 'solver': 'lbfgs', 'max_iter': 2000, 'fit_intercept': True, 'standardize_with_source': True, 'rho': 0.5}
[I 2026-06-01 21:37:13,187] Trial 114 finished with value: 0.2276733791851227 and parameters: {'alpha': 51155.69271163204, 'n_pcs': 4000, 'iw_method': 'pc_logistic', 'iw_clip_max': 12.0, 'iw_prob_clip': 0.02563643660066302, 'iw_n_components': 40, 'iw_logistic_c': 0.00014322574833948288, 'iw_pca_fit': 'combined', 'iw_solver': 'lbfgs', 'iw_rho': 0.5}. Best is trial 84 with value: 0.2289525216150688.
2026-06-01 21:37:13 | INFO | Trial 115 | outer=7 | alpha=5.212e+04 n_pcs=4000 (pc_topk) weight={'name': 'pc_logistic', 'floor': 1e-06, 'clip_max': 12.0, 'prob_clip': 0.03842155714584767, 'n_components': 40, 'logistic_c': 0.00012087615363093459, 'pca_fit': 'combined', 'solver': 'lbfgs', 'max_iter': 2000, 'fit_intercept': True, 'standardize_with_source': True, 'rho': 0.5}
[I 2026-06-01 21:37:27,357] Trial 115 finished with value: 0.22606509992152649 and parameters: {'alpha': 52120.62789838631, 'n_pcs': 4000, 'iw_method': 'pc_logistic', 'iw_clip_max': 12.0, 'iw_prob_clip': 0.03842155714584767, 'iw_n_components': 40, 'iw_logistic_c': 0.00012087615363093459, 'iw_pca_fit': 'combined', 'iw_solver': 'lbfgs', 'iw_rho': 0.5}. Best is trial 84 with value: 0.2289525216150688.
2026-06-01 21:37:27 | INFO | Trial 116 | outer=7 | alpha=1.785e+06 n_pcs=4000 (pc_topk) weight={'name': 'pc_logistic', 'floor': 1e-06, 'clip_max': 12.0, 'prob_clip': 0.03793973677029385, 'n_components': 100, 'logistic_c': 0.00013634705503370512, 'pca_fit': 'combined', 'solver': 'lbfgs', 'max_iter': 2000, 'fit_intercept': True, 'standardize_with_source': True, 'rho': 0.5}
[I 2026-06-01 21:37:41,740] Trial 116 finished with value: 0.18924298869300696 and parameters: {'alpha': 1784545.3906039984, 'n_pcs': 4000, 'iw_method': 'pc_logistic', 'iw_clip_max': 12.0, 'iw_prob_clip': 0.03793973677029385, 'iw_n_components': 100, 'iw_logistic_c': 0.00013634705503370512, 'iw_pca_fit': 'combined', 'iw_solver': 'lbfgs', 'iw_rho': 0.5}. Best is trial 84 with value: 0.2289525216150688.
2026-06-01 21:37:41 | INFO | Trial 117 | outer=7 | alpha=4.537e+04 n_pcs=4000 (pc_topk) weight={'name': 'pc_logistic', 'floor': 1e-06, 'clip_max': 12.0, 'prob_clip': 0.03432333788199258, 'n_components': 40, 'logistic_c': 4.699055146898257e-05, 'pca_fit': 'combined', 'solver': 'lbfgs', 'max_iter': 2000, 'fit_intercept': True, 'standardize_with_source': True, 'rho': 0.5}
[I 2026-06-01 21:37:55,296] Trial 117 finished with value: 0.22681897426458292 and parameters: {'alpha': 45374.4875259398, 'n_pcs': 4000, 'iw_method': 'pc_logistic', 'iw_clip_max': 12.0, 'iw_prob_clip': 0.03432333788199258, 'iw_n_components': 40, 'iw_logistic_c': 4.699055146898257e-05, 'iw_pca_fit': 'combined', 'iw_solver': 'lbfgs', 'iw_rho': 0.5}. Best is trial 84 with value: 0.2289525216150688.
2026-06-01 21:37:55 | INFO | Trial 118 | outer=7 | alpha=2.504e+04 n_pcs=4000 (pc_topk) weight={'name': 'pc_logistic', 'floor': 1e-06, 'clip_max': 12.0, 'prob_clip': 0.0323779671924367, 'n_components': 40, 'logistic_c': 4.355664272568303e-05, 'pca_fit': 'combined', 'solver': 'lbfgs', 'max_iter': 2000, 'fit_intercept': True, 'standardize_with_source': True, 'rho': 0.5}
[I 2026-06-01 21:38:08,774] Trial 118 finished with value: 0.2257151852977833 and parameters: {'alpha': 25039.356948814046, 'n_pcs': 4000, 'iw_method': 'pc_logistic', 'iw_clip_max': 12.0, 'iw_prob_clip': 0.0323779671924367, 'iw_n_components': 40, 'iw_logistic_c': 4.355664272568303e-05, 'iw_pca_fit': 'combined', 'iw_solver': 'lbfgs', 'iw_rho': 0.5}. Best is trial 84 with value: 0.2289525216150688.
2026-06-01 21:38:08 | INFO | Trial 119 | outer=7 | alpha=4.596e+04 n_pcs=4500 (pc_topk) weight={'name': 'pc_logistic', 'floor': 1e-06, 'clip_max': 12.0, 'prob_clip': 0.022941087454693282, 'n_components': 40, 'logistic_c': 2.155388658877469e-05, 'pca_fit': 'combined', 'solver': 'lbfgs', 'max_iter': 2000, 'fit_intercept': True, 'standardize_with_source': True, 'rho': 0.5}
[I 2026-06-01 21:38:23,933] Trial 119 finished with value: 0.22664572768095534 and parameters: {'alpha': 45964.53941200452, 'n_pcs': 4500, 'iw_method': 'pc_logistic', 'iw_clip_max': 12.0, 'iw_prob_clip': 0.022941087454693282, 'iw_n_components': 40, 'iw_logistic_c': 2.155388658877469e-05, 'iw_pca_fit': 'combined', 'iw_solver': 'lbfgs', 'iw_rho': 0.5}. Best is trial 84 with value: 0.2289525216150688.
2026-06-01 21:38:23 | INFO | Trial 120 | outer=7 | alpha=2.088e+04 n_pcs=5000 (pc_topk) weight={'name': 'pc_logistic', 'floor': 1e-06, 'clip_max': 4.0, 'prob_clip': 0.022399112120366153, 'n_components': 40, 'logistic_c': 4.270551649535686e-05, 'pca_fit': 'combined', 'solver': 'lbfgs', 'max_iter': 2000, 'fit_intercept': True, 'standardize_with_source': True, 'rho': 0.5}
[I 2026-06-01 21:38:39,755] Trial 120 finished with value: 0.2242654540463198 and parameters: {'alpha': 20883.050241047706, 'n_pcs': 5000, 'iw_method': 'pc_logistic', 'iw_clip_max': 4.0, 'iw_prob_clip': 0.022399112120366153, 'iw_n_components': 40, 'iw_logistic_c': 4.270551649535686e-05, 'iw_pca_fit': 'combined', 'iw_solver': 'lbfgs', 'iw_rho': 0.5}. Best is trial 84 with value: 0.2289525216150688.
2026-06-01 21:38:39 | INFO | Trial 121 | outer=7 | alpha=4.718e+04 n_pcs=4500 (pc_topk) weight={'name': 'pc_logistic', 'floor': 1e-06, 'clip_max': 12.0, 'prob_clip': 0.02387009554787676, 'n_components': 40, 'logistic_c': 1.9411767999417734e-05, 'pca_fit': 'combined', 'solver': 'lbfgs', 'max_iter': 2000, 'fit_intercept': True, 'standardize_with_source': True, 'rho': 0.5}
[I 2026-06-01 21:38:54,651] Trial 121 finished with value: 0.2262976009495135 and parameters: {'alpha': 47180.78764953682, 'n_pcs': 4500, 'iw_method': 'pc_logistic', 'iw_clip_max': 12.0, 'iw_prob_clip': 0.02387009554787676, 'iw_n_components': 40, 'iw_logistic_c': 1.9411767999417734e-05, 'iw_pca_fit': 'combined', 'iw_solver': 'lbfgs', 'iw_rho': 0.5}. Best is trial 84 with value: 0.2289525216150688.
2026-06-01 21:38:54 | INFO | Trial 122 | outer=7 | alpha=4.592e+04 n_pcs=4500 (pc_topk) weight={'name': 'pc_logistic', 'floor': 1e-06, 'clip_max': 12.0, 'prob_clip': 0.018939824675003745, 'n_components': 40, 'logistic_c': 2.5459484417878848e-05, 'pca_fit': 'combined', 'solver': 'lbfgs', 'max_iter': 2000, 'fit_intercept': True, 'standardize_with_source': True, 'rho': 0.5}
[I 2026-06-01 21:39:09,530] Trial 122 finished with value: 0.22695281376912088 and parameters: {'alpha': 45916.479283313485, 'n_pcs': 4500, 'iw_method': 'pc_logistic', 'iw_clip_max': 12.0, 'iw_prob_clip': 0.018939824675003745, 'iw_n_components': 40, 'iw_logistic_c': 2.5459484417878848e-05, 'iw_pca_fit': 'combined', 'iw_solver': 'lbfgs', 'iw_rho': 0.5}. Best is trial 84 with value: 0.2289525216150688.
2026-06-01 21:39:09 | INFO | Trial 123 | outer=7 | alpha=2.835e+04 n_pcs=4500 (pc_topk) weight={'name': 'pc_logistic', 'floor': 1e-06, 'clip_max': 12.0, 'prob_clip': 0.01848042012132224, 'n_components': 40, 'logistic_c': 2.0821440897347446e-05, 'pca_fit': 'combined', 'solver': 'lbfgs', 'max_iter': 2000, 'fit_intercept': True, 'standardize_with_source': True, 'rho': 0.5}
[I 2026-06-01 21:39:24,021] Trial 123 finished with value: 0.22644607721544588 and parameters: {'alpha': 28352.639862353095, 'n_pcs': 4500, 'iw_method': 'pc_logistic', 'iw_clip_max': 12.0, 'iw_prob_clip': 0.01848042012132224, 'iw_n_components': 40, 'iw_logistic_c': 2.0821440897347446e-05, 'iw_pca_fit': 'combined', 'iw_solver': 'lbfgs', 'iw_rho': 0.5}. Best is trial 84 with value: 0.2289525216150688.
2026-06-01 21:39:24 | INFO | Trial 124 | outer=7 | alpha=2.764e+04 n_pcs=4500 (pc_topk) weight={'name': 'pc_logistic', 'floor': 1e-06, 'clip_max': 12.0, 'prob_clip': 0.019484103860238387, 'n_components': 40, 'logistic_c': 1.8766012254329194e-05, 'pca_fit': 'combined', 'solver': 'lbfgs', 'max_iter': 2000, 'fit_intercept': True, 'standardize_with_source': True, 'rho': 0.5}
[I 2026-06-01 21:39:39,473] Trial 124 finished with value: 0.22620929451461397 and parameters: {'alpha': 27643.44662431711, 'n_pcs': 4500, 'iw_method': 'pc_logistic', 'iw_clip_max': 12.0, 'iw_prob_clip': 0.019484103860238387, 'iw_n_components': 40, 'iw_logistic_c': 1.8766012254329194e-05, 'iw_pca_fit': 'combined', 'iw_solver': 'lbfgs', 'iw_rho': 0.5}. Best is trial 84 with value: 0.2289525216150688.
2026-06-01 21:39:39 | INFO | Trial 125 | outer=7 | alpha=4.333e+04 n_pcs=4500 (pc_topk) weight={'name': 'pc_logistic', 'floor': 1e-06, 'clip_max': 12.0, 'prob_clip': 0.0211923767156646, 'n_components': 40, 'logistic_c': 6.684034439692219e-05, 'pca_fit': 'combined', 'solver': 'lbfgs', 'max_iter': 2000, 'fit_intercept': True, 'standardize_with_source': True, 'rho': 0.5}
[I 2026-06-01 21:39:55,704] Trial 125 finished with value: 0.22812839025724382 and parameters: {'alpha': 43328.78489044402, 'n_pcs': 4500, 'iw_method': 'pc_logistic', 'iw_clip_max': 12.0, 'iw_prob_clip': 0.0211923767156646, 'iw_n_components': 40, 'iw_logistic_c': 6.684034439692219e-05, 'iw_pca_fit': 'combined', 'iw_solver': 'lbfgs', 'iw_rho': 0.5}. Best is trial 84 with value: 0.2289525216150688.
2026-06-01 21:39:55 | INFO | Trial 126 | outer=7 | alpha=4.508e+04 n_pcs=4000 (pc_topk) weight={'name': 'uniform'}
[I 2026-06-01 21:40:02,802] Trial 126 finished with value: 0.21946802020092698 and parameters: {'alpha': 45075.6200908046, 'n_pcs': 4000, 'iw_method': 'uniform'}. Best is trial 84 with value: 0.2289525216150688.
2026-06-01 21:40:02 | INFO | Trial 127 | outer=7 | alpha=1.652e+04 n_pcs=4000 (pc_topk) weight={'name': 'pc_logistic', 'floor': 1e-06, 'clip_max': 12.0, 'prob_clip': 0.021753687238519826, 'n_components': 20, 'logistic_c': 6.661701198712187e-05, 'pca_fit': 'combined', 'solver': 'lbfgs', 'max_iter': 2000, 'fit_intercept': True, 'standardize_with_source': True, 'rho': 0.5}
[I 2026-06-01 21:40:16,635] Trial 127 finished with value: 0.2207303343868982 and parameters: {'alpha': 16520.78317134269, 'n_pcs': 4000, 'iw_method': 'pc_logistic', 'iw_clip_max': 12.0, 'iw_prob_clip': 0.021753687238519826, 'iw_n_components': 20, 'iw_logistic_c': 6.661701198712187e-05, 'iw_pca_fit': 'combined', 'iw_solver': 'lbfgs', 'iw_rho': 0.5}. Best is trial 84 with value: 0.2289525216150688.
2026-06-01 21:40:16 | INFO | Trial 128 | outer=7 | alpha=9.737e+06 n_pcs=4500 (pc_topk) weight={'name': 'pc_logistic', 'floor': 1e-06, 'clip_max': 12.0, 'prob_clip': 0.028588376098800303, 'n_components': 40, 'logistic_c': 0.00019936760561456256, 'pca_fit': 'combined', 'solver': 'lbfgs', 'max_iter': 2000, 'fit_intercept': True, 'standardize_with_source': True, 'rho': 0.5}
[I 2026-06-01 21:40:32,922] Trial 128 finished with value: 0.18054931011646502 and parameters: {'alpha': 9737107.945261743, 'n_pcs': 4500, 'iw_method': 'pc_logistic', 'iw_clip_max': 12.0, 'iw_prob_clip': 0.028588376098800303, 'iw_n_components': 40, 'iw_logistic_c': 0.00019936760561456256, 'iw_pca_fit': 'combined', 'iw_solver': 'lbfgs', 'iw_rho': 0.5}. Best is trial 84 with value: 0.2289525216150688.
2026-06-01 21:40:32 | INFO | Trial 129 | outer=7 | alpha=5.167e+04 n_pcs=4500 (pc_topk) weight={'name': 'pc_logistic', 'floor': 1e-06, 'clip_max': 12.0, 'prob_clip': 0.03269187307475863, 'n_components': 40, 'logistic_c': 5.837924939613383e-06, 'pca_fit': 'combined', 'solver': 'lbfgs', 'max_iter': 2000, 'fit_intercept': True, 'standardize_with_source': True, 'rho': 0.3}
[I 2026-06-01 21:40:48,047] Trial 129 finished with value: 0.22270533788969527 and parameters: {'alpha': 51673.14960869236, 'n_pcs': 4500, 'iw_method': 'pc_logistic', 'iw_clip_max': 12.0, 'iw_prob_clip': 0.03269187307475863, 'iw_n_components': 40, 'iw_logistic_c': 5.837924939613383e-06, 'iw_pca_fit': 'combined', 'iw_solver': 'lbfgs', 'iw_rho': 0.3}. Best is trial 84 with value: 0.2289525216150688.
2026-06-01 21:40:48 | INFO | Trial 130 | outer=7 | alpha=6.795e+04 n_pcs=4500 (pc_topk) weight={'name': 'pc_logistic', 'floor': 1e-06, 'clip_max': 12.0, 'prob_clip': 0.02514703280074418, 'n_components': 40, 'logistic_c': 0.00016454425976025487, 'pca_fit': 'combined', 'solver': 'lbfgs', 'max_iter': 2000, 'fit_intercept': True, 'standardize_with_source': True, 'rho': 0.5}
[I 2026-06-01 21:41:04,651] Trial 130 finished with value: 0.2252554952956364 and parameters: {'alpha': 67951.48925457902, 'n_pcs': 4500, 'iw_method': 'pc_logistic', 'iw_clip_max': 12.0, 'iw_prob_clip': 0.02514703280074418, 'iw_n_components': 40, 'iw_logistic_c': 0.00016454425976025487, 'iw_pca_fit': 'combined', 'iw_solver': 'lbfgs', 'iw_rho': 0.5}. Best is trial 84 with value: 0.2289525216150688.
2026-06-01 21:41:04 | INFO | Trial 131 | outer=7 | alpha=4.299e+04 n_pcs=4500 (pc_topk) weight={'name': 'pc_logistic', 'floor': 1e-06, 'clip_max': 12.0, 'prob_clip': 0.02057166484645057, 'n_components': 40, 'logistic_c': 5.625789732125755e-05, 'pca_fit': 'combined', 'solver': 'lbfgs', 'max_iter': 2000, 'fit_intercept': True, 'standardize_with_source': True, 'rho': 0.5}
[I 2026-06-01 21:41:19,967] Trial 131 finished with value: 0.2281183790451094 and parameters: {'alpha': 42994.62391732709, 'n_pcs': 4500, 'iw_method': 'pc_logistic', 'iw_clip_max': 12.0, 'iw_prob_clip': 0.02057166484645057, 'iw_n_components': 40, 'iw_logistic_c': 5.625789732125755e-05, 'iw_pca_fit': 'combined', 'iw_solver': 'lbfgs', 'iw_rho': 0.5}. Best is trial 84 with value: 0.2289525216150688.
2026-06-01 21:41:20 | INFO | Trial 132 | outer=7 | alpha=8.833e+04 n_pcs=4500 (pc_topk) weight={'name': 'pc_logistic', 'floor': 1e-06, 'clip_max': 12.0, 'prob_clip': 0.020416164199655657, 'n_components': 40, 'logistic_c': 3.911940517696813e-05, 'pca_fit': 'combined', 'solver': 'lbfgs', 'max_iter': 2000, 'fit_intercept': True, 'standardize_with_source': True, 'rho': 0.5}
[I 2026-06-01 21:41:35,002] Trial 132 finished with value: 0.22407004777955158 and parameters: {'alpha': 88329.17893057199, 'n_pcs': 4500, 'iw_method': 'pc_logistic', 'iw_clip_max': 12.0, 'iw_prob_clip': 0.020416164199655657, 'iw_n_components': 40, 'iw_logistic_c': 3.911940517696813e-05, 'iw_pca_fit': 'combined', 'iw_solver': 'lbfgs', 'iw_rho': 0.5}. Best is trial 84 with value: 0.2289525216150688.
2026-06-01 21:41:35 | INFO | Trial 133 | outer=7 | alpha=4.121e+04 n_pcs=4000 (pc_topk) weight={'name': 'pc_logistic', 'floor': 1e-06, 'clip_max': 12.0, 'prob_clip': 0.03445926808569642, 'n_components': 40, 'logistic_c': 7.121132159698958e-05, 'pca_fit': 'combined', 'solver': 'lbfgs', 'max_iter': 2000, 'fit_intercept': True, 'standardize_with_source': True, 'rho': 0.5}
[I 2026-06-01 21:41:48,436] Trial 133 finished with value: 0.22728993472337025 and parameters: {'alpha': 41206.560179027474, 'n_pcs': 4000, 'iw_method': 'pc_logistic', 'iw_clip_max': 12.0, 'iw_prob_clip': 0.03445926808569642, 'iw_n_components': 40, 'iw_logistic_c': 7.121132159698958e-05, 'iw_pca_fit': 'combined', 'iw_solver': 'lbfgs', 'iw_rho': 0.5}. Best is trial 84 with value: 0.2289525216150688.
2026-06-01 21:41:48 | INFO | Trial 134 | outer=7 | alpha=4.198e+04 n_pcs=4000 (pc_topk) weight={'name': 'pc_logistic', 'floor': 1e-06, 'clip_max': 12.0, 'prob_clip': 0.03447431927461393, 'n_components': 40, 'logistic_c': 4.865427480429085e-05, 'pca_fit': 'combined', 'solver': 'lbfgs', 'max_iter': 2000, 'fit_intercept': True, 'standardize_with_source': True, 'rho': 0.5}
[I 2026-06-01 21:42:01,666] Trial 134 finished with value: 0.22698822681883687 and parameters: {'alpha': 41984.822363876, 'n_pcs': 4000, 'iw_method': 'pc_logistic', 'iw_clip_max': 12.0, 'iw_prob_clip': 0.03447431927461393, 'iw_n_components': 40, 'iw_logistic_c': 4.865427480429085e-05, 'iw_pca_fit': 'combined', 'iw_solver': 'lbfgs', 'iw_rho': 0.5}. Best is trial 84 with value: 0.2289525216150688.
2026-06-01 21:42:01 | INFO | Trial 135 | outer=7 | alpha=2.180e+03 n_pcs=4000 (pc_topk) weight={'name': 'pc_logistic', 'floor': 1e-06, 'clip_max': 12.0, 'prob_clip': 0.03420945219522766, 'n_components': 80, 'logistic_c': 5.5122966709399845e-05, 'pca_fit': 'combined', 'solver': 'lbfgs', 'max_iter': 2000, 'fit_intercept': True, 'standardize_with_source': True, 'rho': 0.5}
[I 2026-06-01 21:42:15,875] Trial 135 finished with value: 0.1552804098067676 and parameters: {'alpha': 2180.471449859837, 'n_pcs': 4000, 'iw_method': 'pc_logistic', 'iw_clip_max': 12.0, 'iw_prob_clip': 0.03420945219522766, 'iw_n_components': 80, 'iw_logistic_c': 5.5122966709399845e-05, 'iw_pca_fit': 'combined', 'iw_solver': 'lbfgs', 'iw_rho': 0.5}. Best is trial 84 with value: 0.2289525216150688.
2026-06-01 21:42:15 | INFO | Trial 136 | outer=7 | alpha=4.072e+04 n_pcs=4000 (pc_topk) weight={'name': 'pc_logistic', 'floor': 1e-06, 'clip_max': 12.0, 'prob_clip': 0.03745319855316804, 'n_components': 10, 'logistic_c': 0.00010268277319947991, 'pca_fit': 'combined', 'solver': 'lbfgs', 'max_iter': 2000, 'fit_intercept': True, 'standardize_with_source': True, 'rho': 0.5}
[I 2026-06-01 21:42:28,898] Trial 136 finished with value: 0.2253788611440238 and parameters: {'alpha': 40719.10193497376, 'n_pcs': 4000, 'iw_method': 'pc_logistic', 'iw_clip_max': 12.0, 'iw_prob_clip': 0.03745319855316804, 'iw_n_components': 10, 'iw_logistic_c': 0.00010268277319947991, 'iw_pca_fit': 'combined', 'iw_solver': 'lbfgs', 'iw_rho': 0.5}. Best is trial 84 with value: 0.2289525216150688.
2026-06-01 21:42:28 | INFO | Trial 137 | outer=7 | alpha=4.278e+04 n_pcs=4000 (pc_topk) weight={'name': 'pc_logistic', 'floor': 1e-06, 'clip_max': 12.0, 'prob_clip': 0.017820723376604224, 'n_components': 40, 'logistic_c': 1.4946699819413084e-05, 'pca_fit': 'combined', 'solver': 'lbfgs', 'max_iter': 2000, 'fit_intercept': True, 'standardize_with_source': True, 'rho': 0.5}
[I 2026-06-01 21:42:41,618] Trial 137 finished with value: 0.22678441236295316 and parameters: {'alpha': 42777.86815102927, 'n_pcs': 4000, 'iw_method': 'pc_logistic', 'iw_clip_max': 12.0, 'iw_prob_clip': 0.017820723376604224, 'iw_n_components': 40, 'iw_logistic_c': 1.4946699819413084e-05, 'iw_pca_fit': 'combined', 'iw_solver': 'lbfgs', 'iw_rho': 0.5}. Best is trial 84 with value: 0.2289525216150688.
2026-06-01 21:42:41 | INFO | Trial 138 | outer=7 | alpha=4.172e+04 n_pcs=4000 (pc_topk) weight={'name': 'pc_logistic', 'floor': 1e-06, 'clip_max': 12.0, 'prob_clip': 0.022434748934385934, 'n_components': 40, 'logistic_c': 1.2841567088328564e-05, 'pca_fit': 'combined', 'solver': 'lbfgs', 'max_iter': 2000, 'fit_intercept': True, 'standardize_with_source': True, 'rho': 1.0}
[I 2026-06-01 21:42:54,307] Trial 138 finished with value: 0.22746584309154655 and parameters: {'alpha': 41715.29173915968, 'n_pcs': 4000, 'iw_method': 'pc_logistic', 'iw_clip_max': 12.0, 'iw_prob_clip': 0.022434748934385934, 'iw_n_components': 40, 'iw_logistic_c': 1.2841567088328564e-05, 'iw_pca_fit': 'combined', 'iw_solver': 'lbfgs', 'iw_rho': 1.0}. Best is trial 84 with value: 0.2289525216150688.
2026-06-01 21:42:54 | INFO | Trial 139 | outer=7 | alpha=5.292e+04 n_pcs=4000 (pc_topk) weight={'name': 'pc_logistic', 'floor': 1e-06, 'clip_max': 12.0, 'prob_clip': 0.017275605950582102, 'n_components': 40, 'logistic_c': 1.0631658394496254e-05, 'pca_fit': 'combined', 'solver': 'lbfgs', 'max_iter': 2000, 'fit_intercept': True, 'standardize_with_source': True, 'rho': 1.0}
[I 2026-06-01 21:43:06,307] Trial 139 finished with value: 0.22744417241293252 and parameters: {'alpha': 52915.57314075436, 'n_pcs': 4000, 'iw_method': 'pc_logistic', 'iw_clip_max': 12.0, 'iw_prob_clip': 0.017275605950582102, 'iw_n_components': 40, 'iw_logistic_c': 1.0631658394496254e-05, 'iw_pca_fit': 'combined', 'iw_solver': 'lbfgs', 'iw_rho': 1.0}. Best is trial 84 with value: 0.2289525216150688.
2026-06-01 21:43:06 | INFO | Trial 140 | outer=7 | alpha=5.421e+04 n_pcs=3500 (pc_topk) weight={'name': 'pc_logistic', 'floor': 1e-06, 'clip_max': 12.0, 'prob_clip': 0.017604418832444447, 'n_components': 100, 'logistic_c': 1.0675139289792576e-05, 'pca_fit': 'combined', 'solver': 'lbfgs', 'max_iter': 2000, 'fit_intercept': True, 'standardize_with_source': True, 'rho': 1.0}
[I 2026-06-01 21:43:16,810] Trial 140 finished with value: 0.224506907791229 and parameters: {'alpha': 54207.09167261786, 'n_pcs': 3500, 'iw_method': 'pc_logistic', 'iw_clip_max': 12.0, 'iw_prob_clip': 0.017604418832444447, 'iw_n_components': 100, 'iw_logistic_c': 1.0675139289792576e-05, 'iw_pca_fit': 'combined', 'iw_solver': 'lbfgs', 'iw_rho': 1.0}. Best is trial 84 with value: 0.2289525216150688.
2026-06-01 21:43:16 | INFO | Trial 141 | outer=7 | alpha=4.240e+04 n_pcs=4000 (pc_topk) weight={'name': 'pc_logistic', 'floor': 1e-06, 'clip_max': 12.0, 'prob_clip': 0.020792597730296767, 'n_components': 40, 'logistic_c': 1.5355401355732392e-05, 'pca_fit': 'combined', 'solver': 'lbfgs', 'max_iter': 2000, 'fit_intercept': True, 'standardize_with_source': True, 'rho': 1.0}
