[I 2026-06-01 01:30:59,027] Trial 270 finished with value: 0.22620641778503744 and parameters: {'alpha': 35777.614871944854, 'n_pcs': 5000, 'weight_scheme': 'linear', 'weight_clip_max': 10.0, 'weight_linear_min_weight': 0.270973705935978, 'weight_linear_max_weight': 4.193942449322685}. Best is trial 247 with value: 0.22877115310215607.
2026-06-01 01:30:59 | INFO | src.nested_cv_avggrm_weighted_unified | Trial 271 | outer=7 | alpha=4.588e+04 n_pcs=4500 (pc_topk) weight_search=on
2026-06-01 01:30:59 | INFO | src.nested_cv_avggrm_weighted_unified | Trial 271 | outer=7 | weight={'name': 'linear', 'floor': 1e-06, 'clip_max': 10.0, 'min_weight': 0.29309312451430053, 'max_weight': 4.120004995890665}
[I 2026-06-01 01:31:05,868] Trial 271 finished with value: 0.22873653405439393 and parameters: {'alpha': 45878.868503627324, 'n_pcs': 4500, 'weight_scheme': 'linear', 'weight_clip_max': 10.0, 'weight_linear_min_weight': 0.29309312451430053, 'weight_linear_max_weight': 4.120004995890665}. Best is trial 247 with value: 0.22877115310215607.
2026-06-01 01:31:05 | INFO | src.nested_cv_avggrm_weighted_unified | Trial 272 | outer=7 | alpha=4.287e+04 n_pcs=4500 (pc_topk) weight_search=on
2026-06-01 01:31:05 | INFO | src.nested_cv_avggrm_weighted_unified | Trial 272 | outer=7 | weight={'name': 'linear', 'floor': 1e-06, 'clip_max': 10.0, 'min_weight': 0.2366692641137418, 'max_weight': 4.088355552490393}
[I 2026-06-01 01:31:12,720] Trial 272 finished with value: 0.2286486656099 and parameters: {'alpha': 42874.27370028722, 'n_pcs': 4500, 'weight_scheme': 'linear', 'weight_clip_max': 10.0, 'weight_linear_min_weight': 0.2366692641137418, 'weight_linear_max_weight': 4.088355552490393}. Best is trial 247 with value: 0.22877115310215607.
2026-06-01 01:31:12 | INFO | src.nested_cv_avggrm_weighted_unified | Trial 273 | outer=7 | alpha=3.236e+04 n_pcs=4500 (pc_topk) weight_search=on
2026-06-01 01:31:12 | INFO | src.nested_cv_avggrm_weighted_unified | Trial 273 | outer=7 | weight={'name': 'linear', 'floor': 1e-06, 'clip_max': 10.0, 'min_weight': 0.25821699462510833, 'max_weight': 4.149009835519712}
[I 2026-06-01 01:31:19,635] Trial 273 finished with value: 0.2278209345663595 and parameters: {'alpha': 32362.807294132763, 'n_pcs': 4500, 'weight_scheme': 'linear', 'weight_clip_max': 10.0, 'weight_linear_min_weight': 0.25821699462510833, 'weight_linear_max_weight': 4.149009835519712}. Best is trial 247 with value: 0.22877115310215607.
2026-06-01 01:31:19 | INFO | src.nested_cv_avggrm_weighted_unified | Trial 274 | outer=7 | alpha=6.529e+04 n_pcs=4500 (pc_topk) weight_search=on
2026-06-01 01:31:19 | INFO | src.nested_cv_avggrm_weighted_unified | Trial 274 | outer=7 | weight={'name': 'linear', 'floor': 1e-06, 'clip_max': 10.0, 'min_weight': 0.22395071668163852, 'max_weight': 4.0970830538011045}
[I 2026-06-01 01:31:26,459] Trial 274 finished with value: 0.228513547876292 and parameters: {'alpha': 65288.648309994365, 'n_pcs': 4500, 'weight_scheme': 'linear', 'weight_clip_max': 10.0, 'weight_linear_min_weight': 0.22395071668163852, 'weight_linear_max_weight': 4.0970830538011045}. Best is trial 247 with value: 0.22877115310215607.
2026-06-01 01:31:26 | INFO | src.nested_cv_avggrm_weighted_unified | Trial 275 | outer=7 | alpha=4.554e+04 n_pcs=4500 (pc_topk) weight_search=on
2026-06-01 01:31:26 | INFO | src.nested_cv_avggrm_weighted_unified | Trial 275 | outer=7 | weight={'name': 'linear', 'floor': 1e-06, 'clip_max': 10.0, 'min_weight': 0.5942955669108494, 'max_weight': 3.9709865519070413}
[I 2026-06-01 01:31:33,341] Trial 275 finished with value: 0.22830338575586567 and parameters: {'alpha': 45536.95646234609, 'n_pcs': 4500, 'weight_scheme': 'linear', 'weight_clip_max': 10.0, 'weight_linear_min_weight': 0.5942955669108494, 'weight_linear_max_weight': 3.9709865519070413}. Best is trial 247 with value: 0.22877115310215607.
2026-06-01 01:31:33 | INFO | src.nested_cv_avggrm_weighted_unified | Trial 276 | outer=7 | alpha=3.826e+04 n_pcs=4500 (pc_topk) weight_search=on
2026-06-01 01:31:33 | INFO | src.nested_cv_avggrm_weighted_unified | Trial 276 | outer=7 | weight={'name': 'linear', 'floor': 1e-06, 'clip_max': 10.0, 'min_weight': 0.7544109381022426, 'max_weight': 4.225719316188287}
[I 2026-06-01 01:31:40,179] Trial 276 finished with value: 0.22797586867700942 and parameters: {'alpha': 38262.145614639616, 'n_pcs': 4500, 'weight_scheme': 'linear', 'weight_clip_max': 10.0, 'weight_linear_min_weight': 0.7544109381022426, 'weight_linear_max_weight': 4.225719316188287}. Best is trial 247 with value: 0.22877115310215607.
2026-06-01 01:31:40 | INFO | src.nested_cv_avggrm_weighted_unified | Trial 277 | outer=7 | alpha=8.244e+04 n_pcs=4500 (pc_topk) weight_search=on
2026-06-01 01:31:40 | INFO | src.nested_cv_avggrm_weighted_unified | Trial 277 | outer=7 | weight={'name': 'linear', 'floor': 1e-06, 'clip_max': 10.0, 'min_weight': 0.27970357329727497, 'max_weight': 4.0574603363248665}
[I 2026-06-01 01:31:47,012] Trial 277 finished with value: 0.22766454203262793 and parameters: {'alpha': 82439.21278953782, 'n_pcs': 4500, 'weight_scheme': 'linear', 'weight_clip_max': 10.0, 'weight_linear_min_weight': 0.27970357329727497, 'weight_linear_max_weight': 4.0574603363248665}. Best is trial 247 with value: 0.22877115310215607.
2026-06-01 01:31:47 | INFO | src.nested_cv_avggrm_weighted_unified | Trial 278 | outer=7 | alpha=5.998e+04 n_pcs=4500 (pc_topk) weight_search=on
2026-06-01 01:31:47 | INFO | src.nested_cv_avggrm_weighted_unified | Trial 278 | outer=7 | weight={'name': 'linear', 'floor': 1e-06, 'clip_max': 10.0, 'min_weight': 0.29952192284514273, 'max_weight': 3.687701786088738}
[I 2026-06-01 01:31:53,862] Trial 278 finished with value: 0.22853299403164912 and parameters: {'alpha': 59980.304849885535, 'n_pcs': 4500, 'weight_scheme': 'linear', 'weight_clip_max': 10.0, 'weight_linear_min_weight': 0.29952192284514273, 'weight_linear_max_weight': 3.687701786088738}. Best is trial 247 with value: 0.22877115310215607.
2026-06-01 01:31:53 | INFO | src.nested_cv_avggrm_weighted_unified | Trial 279 | outer=7 | alpha=2.838e+04 n_pcs=4500 (pc_topk) weight_search=on
2026-06-01 01:31:53 | INFO | src.nested_cv_avggrm_weighted_unified | Trial 279 | outer=7 | weight={'name': 'uniform', 'floor': 1e-06, 'clip_max': 10.0}
[I 2026-06-01 01:31:59,867] Trial 279 finished with value: 0.22066389438944106 and parameters: {'alpha': 28380.365533704884, 'n_pcs': 4500, 'weight_scheme': 'uniform', 'weight_clip_max': 10.0}. Best is trial 247 with value: 0.22877115310215607.
2026-06-01 01:31:59 | INFO | src.nested_cv_avggrm_weighted_unified | Trial 280 | outer=7 | alpha=4.943e+04 n_pcs=4500 (pc_topk) weight_search=on
2026-06-01 01:31:59 | INFO | src.nested_cv_avggrm_weighted_unified | Trial 280 | outer=7 | weight={'name': 'linear', 'floor': 1e-06, 'clip_max': 10.0, 'min_weight': 0.2515303641845996, 'max_weight': 3.9546011693181757}
[I 2026-06-01 01:32:06,697] Trial 280 finished with value: 0.2287757813831091 and parameters: {'alpha': 49430.87757657087, 'n_pcs': 4500, 'weight_scheme': 'linear', 'weight_clip_max': 10.0, 'weight_linear_min_weight': 0.2515303641845996, 'weight_linear_max_weight': 3.9546011693181757}. Best is trial 280 with value: 0.2287757813831091.
2026-06-01 01:32:06 | INFO | src.nested_cv_avggrm_weighted_unified | OUTER 7 | new best trial 280 (mean inner r=0.2288) saved to outputs/final_results/e6_pc_ridge_avggrm/thr_wing/e6_pc_ridge_avggrm_thr_wing_best_trials/split_07_best_trial.json
2026-06-01 01:32:06 | INFO | src.nested_cv_avggrm_weighted_unified | Trial 281 | outer=7 | alpha=5.261e+04 n_pcs=5000 (pc_topk) weight_search=on
2026-06-01 01:32:06 | INFO | src.nested_cv_avggrm_weighted_unified | Trial 281 | outer=7 | weight={'name': 'linear', 'floor': 1e-06, 'clip_max': 10.0, 'min_weight': 0.24481644962499527, 'max_weight': 3.968080578770106}
[I 2026-06-01 01:32:14,771] Trial 281 finished with value: 0.22687440043751733 and parameters: {'alpha': 52606.975814492514, 'n_pcs': 5000, 'weight_scheme': 'linear', 'weight_clip_max': 10.0, 'weight_linear_min_weight': 0.24481644962499527, 'weight_linear_max_weight': 3.968080578770106}. Best is trial 280 with value: 0.2287757813831091.
2026-06-01 01:32:14 | INFO | src.nested_cv_avggrm_weighted_unified | Trial 282 | outer=7 | alpha=7.448e+04 n_pcs=4500 (pc_topk) weight_search=on
2026-06-01 01:32:14 | INFO | src.nested_cv_avggrm_weighted_unified | Trial 282 | outer=7 | weight={'name': 'linear', 'floor': 1e-06, 'clip_max': 10.0, 'min_weight': 0.19755522281588528, 'max_weight': 2.7358783957154538}
[I 2026-06-01 01:32:21,609] Trial 282 finished with value: 0.22801922385590787 and parameters: {'alpha': 74482.1969893085, 'n_pcs': 4500, 'weight_scheme': 'linear', 'weight_clip_max': 10.0, 'weight_linear_min_weight': 0.19755522281588528, 'weight_linear_max_weight': 2.7358783957154538}. Best is trial 280 with value: 0.2287757813831091.
2026-06-01 01:32:21 | INFO | src.nested_cv_avggrm_weighted_unified | Trial 283 | outer=7 | alpha=3.611e+04 n_pcs=1500 (pc_topk) weight_search=on
2026-06-01 01:32:21 | INFO | src.nested_cv_avggrm_weighted_unified | Trial 283 | outer=7 | weight={'name': 'linear', 'floor': 1e-06, 'clip_max': 10.0, 'min_weight': 0.2602007285989516, 'max_weight': 3.92356012053607}
[I 2026-06-01 01:32:23,277] Trial 283 finished with value: 0.21126273518421207 and parameters: {'alpha': 36114.538032817596, 'n_pcs': 1500, 'weight_scheme': 'linear', 'weight_clip_max': 10.0, 'weight_linear_min_weight': 0.2602007285989516, 'weight_linear_max_weight': 3.92356012053607}. Best is trial 280 with value: 0.2287757813831091.
2026-06-01 01:32:23 | INFO | src.nested_cv_avggrm_weighted_unified | Trial 284 | outer=7 | alpha=6.361e+04 n_pcs=4500 (pc_topk) weight_search=on
2026-06-01 01:32:23 | INFO | src.nested_cv_avggrm_weighted_unified | Trial 284 | outer=7 | weight={'name': 'exponential', 'floor': 1e-06, 'clip_max': 10.0, 'beta': 1.827760843939981}
[I 2026-06-01 01:32:30,120] Trial 284 finished with value: 0.22770436609440198 and parameters: {'alpha': 63611.15109225336, 'n_pcs': 4500, 'weight_scheme': 'exponential', 'weight_clip_max': 10.0, 'weight_exponential_beta': 1.827760843939981}. Best is trial 280 with value: 0.2287757813831091.
2026-06-01 01:32:30 | INFO | src.nested_cv_avggrm_weighted_unified | Trial 285 | outer=7 | alpha=4.753e+04 n_pcs=4500 (pc_topk) weight_search=on
2026-06-01 01:32:30 | INFO | src.nested_cv_avggrm_weighted_unified | Trial 285 | outer=7 | weight={'name': 'linear', 'floor': 1e-06, 'clip_max': 10.0, 'min_weight': 0.21742478970249596, 'max_weight': 3.348408285001}
[I 2026-06-01 01:32:36,968] Trial 285 finished with value: 0.22876262154278287 and parameters: {'alpha': 47525.31454276429, 'n_pcs': 4500, 'weight_scheme': 'linear', 'weight_clip_max': 10.0, 'weight_linear_min_weight': 0.21742478970249596, 'weight_linear_max_weight': 3.348408285001}. Best is trial 280 with value: 0.2287757813831091.
2026-06-01 01:32:36 | INFO | src.nested_cv_avggrm_weighted_unified | Trial 286 | outer=7 | alpha=4.116e+04 n_pcs=4500 (pc_topk) weight_search=on
2026-06-01 01:32:36 | INFO | src.nested_cv_avggrm_weighted_unified | Trial 286 | outer=7 | weight={'name': 'linear', 'floor': 1e-06, 'clip_max': 10.0, 'min_weight': 0.21373682561565294, 'max_weight': 4.042675586666176}
[I 2026-06-01 01:32:43,858] Trial 286 finished with value: 0.2285564310116444 and parameters: {'alpha': 41162.341493553766, 'n_pcs': 4500, 'weight_scheme': 'linear', 'weight_clip_max': 10.0, 'weight_linear_min_weight': 0.21373682561565294, 'weight_linear_max_weight': 4.042675586666176}. Best is trial 280 with value: 0.2287757813831091.
2026-06-01 01:32:43 | INFO | src.nested_cv_avggrm_weighted_unified | Trial 287 | outer=7 | alpha=5.122e+03 n_pcs=4500 (pc_topk) weight_search=on
2026-06-01 01:32:43 | INFO | src.nested_cv_avggrm_weighted_unified | Trial 287 | outer=7 | weight={'name': 'linear', 'floor': 1e-06, 'clip_max': 10.0, 'min_weight': 0.2320630313616832, 'max_weight': 3.046163426619808}
[I 2026-06-01 01:32:50,694] Trial 287 finished with value: 0.1984979157368805 and parameters: {'alpha': 5121.77971316935, 'n_pcs': 4500, 'weight_scheme': 'linear', 'weight_clip_max': 10.0, 'weight_linear_min_weight': 0.2320630313616832, 'weight_linear_max_weight': 3.046163426619808}. Best is trial 280 with value: 0.2287757813831091.
2026-06-01 01:32:50 | INFO | src.nested_cv_avggrm_weighted_unified | Trial 288 | outer=7 | alpha=4.709e+04 n_pcs=4500 (pc_topk) weight_search=on
2026-06-01 01:32:50 | INFO | src.nested_cv_avggrm_weighted_unified | Trial 288 | outer=7 | weight={'name': 'linear', 'floor': 1e-06, 'clip_max': 10.0, 'min_weight': 0.18890782753383806, 'max_weight': 3.558214183626352}
[I 2026-06-01 01:32:57,593] Trial 288 finished with value: 0.228748577360368 and parameters: {'alpha': 47089.09793063935, 'n_pcs': 4500, 'weight_scheme': 'linear', 'weight_clip_max': 10.0, 'weight_linear_min_weight': 0.18890782753383806, 'weight_linear_max_weight': 3.558214183626352}. Best is trial 280 with value: 0.2287757813831091.
2026-06-01 01:32:57 | INFO | src.nested_cv_avggrm_weighted_unified | Trial 289 | outer=7 | alpha=3.265e+04 n_pcs=4500 (pc_topk) weight_search=on
2026-06-01 01:32:57 | INFO | src.nested_cv_avggrm_weighted_unified | Trial 289 | outer=7 | weight={'name': 'linear', 'floor': 1e-06, 'clip_max': 10.0, 'min_weight': 0.1763964369013239, 'max_weight': 3.557467767295924}
[I 2026-06-01 01:33:04,422] Trial 289 finished with value: 0.22777191566220395 and parameters: {'alpha': 32652.67212090939, 'n_pcs': 4500, 'weight_scheme': 'linear', 'weight_clip_max': 10.0, 'weight_linear_min_weight': 0.1763964369013239, 'weight_linear_max_weight': 3.557467767295924}. Best is trial 280 with value: 0.2287757813831091.
2026-06-01 01:33:04 | INFO | src.nested_cv_avggrm_weighted_unified | Trial 290 | outer=7 | alpha=4.501e+04 n_pcs=5000 (pc_topk) weight_search=on
2026-06-01 01:33:04 | INFO | src.nested_cv_avggrm_weighted_unified | Trial 290 | outer=7 | weight={'name': 'linear', 'floor': 1e-06, 'clip_max': 10.0, 'min_weight': 0.19327486958839618, 'max_weight': 3.4075241637254985}
[I 2026-06-01 01:33:12,492] Trial 290 finished with value: 0.22675224096640653 and parameters: {'alpha': 45013.12812247327, 'n_pcs': 5000, 'weight_scheme': 'linear', 'weight_clip_max': 10.0, 'weight_linear_min_weight': 0.19327486958839618, 'weight_linear_max_weight': 3.4075241637254985}. Best is trial 280 with value: 0.2287757813831091.
2026-06-01 01:33:12 | INFO | src.nested_cv_avggrm_weighted_unified | Trial 291 | outer=7 | alpha=2.550e+04 n_pcs=4500 (pc_topk) weight_search=on
2026-06-01 01:33:12 | INFO | src.nested_cv_avggrm_weighted_unified | Trial 291 | outer=7 | weight={'name': 'linear', 'floor': 1e-06, 'clip_max': 5.0, 'min_weight': 0.2324963859572527, 'max_weight': 3.2009938584781543}
[I 2026-06-01 01:33:19,444] Trial 291 finished with value: 0.2265115986836924 and parameters: {'alpha': 25496.874538846147, 'n_pcs': 4500, 'weight_scheme': 'linear', 'weight_clip_max': 5.0, 'weight_linear_min_weight': 0.2324963859572527, 'weight_linear_max_weight': 3.2009938584781543}. Best is trial 280 with value: 0.2287757813831091.
2026-06-01 01:33:19 | INFO | src.nested_cv_avggrm_weighted_unified | Trial 292 | outer=7 | alpha=3.820e+04 n_pcs=4500 (pc_topk) weight_search=on
2026-06-01 01:33:19 | INFO | src.nested_cv_avggrm_weighted_unified | Trial 292 | outer=7 | weight={'name': 'linear', 'floor': 1e-06, 'clip_max': 10.0, 'min_weight': 0.2072683784020021, 'max_weight': 3.4905872674760583}
[I 2026-06-01 01:33:26,298] Trial 292 finished with value: 0.22840310502176955 and parameters: {'alpha': 38195.08980365059, 'n_pcs': 4500, 'weight_scheme': 'linear', 'weight_clip_max': 10.0, 'weight_linear_min_weight': 0.2072683784020021, 'weight_linear_max_weight': 3.4905872674760583}. Best is trial 280 with value: 0.2287757813831091.
2026-06-01 01:33:26 | INFO | src.nested_cv_avggrm_weighted_unified | Trial 293 | outer=7 | alpha=4.722e+04 n_pcs=4500 (pc_topk) weight_search=on
2026-06-01 01:33:26 | INFO | src.nested_cv_avggrm_weighted_unified | Trial 293 | outer=7 | weight={'name': 'linear', 'floor': 1e-06, 'clip_max': 10.0, 'min_weight': 0.16100777384069836, 'max_weight': 3.7128360436681995}
[I 2026-06-01 01:33:33,149] Trial 293 finished with value: 0.22872038208934198 and parameters: {'alpha': 47219.280452473424, 'n_pcs': 4500, 'weight_scheme': 'linear', 'weight_clip_max': 10.0, 'weight_linear_min_weight': 0.16100777384069836, 'weight_linear_max_weight': 3.7128360436681995}. Best is trial 280 with value: 0.2287757813831091.
2026-06-01 01:33:33 | INFO | src.nested_cv_avggrm_weighted_unified | Trial 294 | outer=7 | alpha=6.304e+04 n_pcs=4500 (pc_topk) weight_search=on
2026-06-01 01:33:33 | INFO | src.nested_cv_avggrm_weighted_unified | Trial 294 | outer=7 | weight={'name': 'linear', 'floor': 1e-06, 'clip_max': 3.0, 'min_weight': 0.21803835952599138, 'max_weight': 4.198908589398268}
[I 2026-06-01 01:33:39,994] Trial 294 finished with value: 0.22847419469401076 and parameters: {'alpha': 63035.34112359967, 'n_pcs': 4500, 'weight_scheme': 'linear', 'weight_clip_max': 3.0, 'weight_linear_min_weight': 0.21803835952599138, 'weight_linear_max_weight': 4.198908589398268}. Best is trial 280 with value: 0.2287757813831091.
2026-06-01 01:33:40 | INFO | src.nested_cv_avggrm_weighted_unified | Trial 295 | outer=7 | alpha=3.960e+04 n_pcs=4500 (pc_topk) weight_search=on
2026-06-01 01:33:40 | INFO | src.nested_cv_avggrm_weighted_unified | Trial 295 | outer=7 | weight={'name': 'linear', 'floor': 1e-06, 'clip_max': 10.0, 'min_weight': 0.19019800626719371, 'max_weight': 3.347150815120169}
[I 2026-06-01 01:33:46,830] Trial 295 finished with value: 0.22848600416336065 and parameters: {'alpha': 39601.51283134319, 'n_pcs': 4500, 'weight_scheme': 'linear', 'weight_clip_max': 10.0, 'weight_linear_min_weight': 0.19019800626719371, 'weight_linear_max_weight': 3.347150815120169}. Best is trial 280 with value: 0.2287757813831091.
2026-06-01 01:33:46 | INFO | src.nested_cv_avggrm_weighted_unified | Trial 296 | outer=7 | alpha=5.527e+04 n_pcs=4500 (pc_topk) weight_search=on
2026-06-01 01:33:46 | INFO | src.nested_cv_avggrm_weighted_unified | Trial 296 | outer=7 | weight={'name': 'linear', 'floor': 1e-06, 'clip_max': 10.0, 'min_weight': 0.25277148944736977, 'max_weight': 3.6581121998049295}
[I 2026-06-01 01:33:53,692] Trial 296 finished with value: 0.22871543761969876 and parameters: {'alpha': 55265.97280903885, 'n_pcs': 4500, 'weight_scheme': 'linear', 'weight_clip_max': 10.0, 'weight_linear_min_weight': 0.25277148944736977, 'weight_linear_max_weight': 3.6581121998049295}. Best is trial 280 with value: 0.2287757813831091.
2026-06-01 01:33:53 | INFO | src.nested_cv_avggrm_weighted_unified | Trial 297 | outer=7 | alpha=7.580e+04 n_pcs=4500 (pc_topk) weight_search=on
2026-06-01 01:33:53 | INFO | src.nested_cv_avggrm_weighted_unified | Trial 297 | outer=7 | weight={'name': 'linear', 'floor': 1e-06, 'clip_max': 10.0, 'min_weight': 0.2449556547663706, 'max_weight': 3.7839921109695975}
[I 2026-06-01 01:34:00,493] Trial 297 finished with value: 0.2280267574848061 and parameters: {'alpha': 75802.87641372893, 'n_pcs': 4500, 'weight_scheme': 'linear', 'weight_clip_max': 10.0, 'weight_linear_min_weight': 0.2449556547663706, 'weight_linear_max_weight': 3.7839921109695975}. Best is trial 280 with value: 0.2287757813831091.
2026-06-01 01:34:00 | INFO | src.nested_cv_avggrm_weighted_unified | Trial 298 | outer=7 | alpha=4.773e+04 n_pcs=4500 (pc_topk) weight_search=on
2026-06-01 01:34:00 | INFO | src.nested_cv_avggrm_weighted_unified | Trial 298 | outer=7 | weight={'name': 'linear', 'floor': 1e-06, 'clip_max': 10.0, 'min_weight': 0.3153943124266252, 'max_weight': 4.037074230908908}
[I 2026-06-01 01:34:07,357] Trial 298 finished with value: 0.22874222466656463 and parameters: {'alpha': 47727.54284943727, 'n_pcs': 4500, 'weight_scheme': 'linear', 'weight_clip_max': 10.0, 'weight_linear_min_weight': 0.3153943124266252, 'weight_linear_max_weight': 4.037074230908908}. Best is trial 280 with value: 0.2287757813831091.
2026-06-01 01:34:07 | INFO | src.nested_cv_avggrm_weighted_unified | Trial 299 | outer=7 | alpha=3.188e+04 n_pcs=5000 (pc_topk) weight_search=on
2026-06-01 01:34:07 | INFO | src.nested_cv_avggrm_weighted_unified | Trial 299 | outer=7 | weight={'name': 'linear', 'floor': 1e-06, 'clip_max': 10.0, 'min_weight': 0.26406037280711975, 'max_weight': 3.98119721519352}
