[I 2026-06-01 02:19:22,666] Trial 296 finished with value: 0.23416400694463121 and parameters: {'alpha': 137716.14923675152, 'n_pcs': 3000, 'weight_scheme': 'exponential', 'weight_clip_max': 3.0, 'weight_exponential_beta': 8.730771256655164}. Best is trial 174 with value: 0.23469062114588263.
2026-06-01 02:19:22 | INFO | src.nested_cv_avggrm_weighted_unified | Trial 297 | outer=9 | alpha=1.100e+05 n_pcs=3000 (pc_topk) weight_search=on
2026-06-01 02:19:22 | INFO | src.nested_cv_avggrm_weighted_unified | Trial 297 | outer=9 | weight={'name': 'exponential', 'floor': 1e-06, 'clip_max': 3.0, 'beta': 8.578776184186482}
[I 2026-06-01 02:19:26,504] Trial 297 finished with value: 0.23343231739700654 and parameters: {'alpha': 110044.69723349086, 'n_pcs': 3000, 'weight_scheme': 'exponential', 'weight_clip_max': 3.0, 'weight_exponential_beta': 8.578776184186482}. Best is trial 174 with value: 0.23469062114588263.
2026-06-01 02:19:26 | INFO | src.nested_cv_avggrm_weighted_unified | Trial 298 | outer=9 | alpha=2.901e+05 n_pcs=3000 (pc_topk) weight_search=on
2026-06-01 02:19:26 | INFO | src.nested_cv_avggrm_weighted_unified | Trial 298 | outer=9 | weight={'name': 'exponential', 'floor': 1e-06, 'clip_max': 3.0, 'beta': 7.848896011677924}
[I 2026-06-01 02:19:30,331] Trial 298 finished with value: 0.23324698677736713 and parameters: {'alpha': 290145.34294498933, 'n_pcs': 3000, 'weight_scheme': 'exponential', 'weight_clip_max': 3.0, 'weight_exponential_beta': 7.848896011677924}. Best is trial 174 with value: 0.23469062114588263.
2026-06-01 02:19:30 | INFO | src.nested_cv_avggrm_weighted_unified | Trial 299 | outer=9 | alpha=2.051e+05 n_pcs=3500 (pc_topk) weight_search=on
2026-06-01 02:19:30 | INFO | src.nested_cv_avggrm_weighted_unified | Trial 299 | outer=9 | weight={'name': 'exponential', 'floor': 1e-06, 'clip_max': 3.0, 'beta': 8.101070853512141}
[I 2026-06-01 02:19:35,316] Trial 299 finished with value: 0.23323266608255117 and parameters: {'alpha': 205090.30233239563, 'n_pcs': 3500, 'weight_scheme': 'exponential', 'weight_clip_max': 3.0, 'weight_exponential_beta': 8.101070853512141}. Best is trial 174 with value: 0.23469062114588263.
2026-06-01 02:19:35 | INFO | src.nested_cv_avggrm_weighted_unified | OUTER 9 best (inner mean r=0.2347): {'model_type': 'pc_ridge', 'alpha': 193767.91373495167, 'n_pcs': 3000, 'use_snp_selection': True, 'num_snps': 3000, 'feature_mode': 'pc_topk', 'weighting': {'name': 'exponential', 'floor': 1e-06, 'clip_max': 3.0, 'beta': 8.663138503575343}}
2026-06-01 02:19:35 | INFO | src.nested_cv_avggrm_weighted_unified | OUTER 9 TEST r = 0.1632
2026-06-01 02:19:35 | INFO | src.nested_cv_avggrm_weighted_unified | OUTER 9 incremental summary saved to outputs/final_results/e6_pc_ridge_avggrm/thr_wing/e6_pc_ridge_avggrm_thr_wing_results.json
2026-06-01 02:19:35 | INFO | src.nested_cv_avggrm_weighted_unified | OUTER 10: test_size=160 island=9 (Sleneset)
2026-06-01 02:19:35 | INFO | src.nested_cv_avggrm_weighted_unified | OUTER 10: inner LOIO validation islands: 0(Nesøy), 1(Myken), 2(Træna), 3(Selvær), 4(Gjerøy), 5(Hestmannøy), 6(Indre Kvarøy), 7(Onøy og Lurøy), 8(Lovund), 10(Aldra), 11(Leka), 12(Vega), 13(Vikna), 14(Lauvøya)
2026-06-01 02:19:35 | INFO | src.nested_cv_avggrm_weighted_unified | OUTER 10: using top 10 related inner validation islands for tuning: 8(Lovund, avgGRM=0.0219), 7(Onøy og Lurøy, avgGRM=0.0092), 2(Træna, avgGRM=0.0084), 3(Selvær, avgGRM=0.0056), 1(Myken, avgGRM=0.0044), 6(Indre Kvarøy, avgGRM=0.0038), 0(Nesøy, avgGRM=0.0013), 5(Hestmannøy, avgGRM=-0.0009), 4(Gjerøy, avgGRM=-0.0024), 12(Vega, avgGRM=-0.0042)
[I 2026-06-01 02:19:35,766] A new study created in memory with name: ridge_inner_outer9
2026-06-01 02:19:35 | INFO | src.nested_cv_avggrm_weighted_unified | Trial 0 | outer=10 | alpha=1.137e+05 n_pcs=4000 (pc_topk) weight_search=on
2026-06-01 02:19:35 | INFO | src.nested_cv_avggrm_weighted_unified | Trial 0 | outer=10 | weight={'name': 'uniform', 'floor': 1e-06, 'clip_max': None}
[I 2026-06-01 02:19:40,771] Trial 0 finished with value: 0.22203075774427866 and parameters: {'alpha': 113703.38004442609, 'n_pcs': 4000, 'weight_scheme': 'uniform', 'weight_clip_max': None}. Best is trial 0 with value: 0.22203075774427866.
2026-06-01 02:19:40 | INFO | src.nested_cv_avggrm_weighted_unified | OUTER 10 | new best trial 0 (mean inner r=0.2220) saved to outputs/final_results/e6_pc_ridge_avggrm/thr_wing/e6_pc_ridge_avggrm_thr_wing_best_trials/split_10_best_trial.json
2026-06-01 02:19:40 | INFO | src.nested_cv_avggrm_weighted_unified | Trial 1 | outer=10 | alpha=1.682e+06 n_pcs=2000 (pc_topk) weight_search=on
2026-06-01 02:19:40 | INFO | src.nested_cv_avggrm_weighted_unified | Trial 1 | outer=10 | weight={'name': 'exponential', 'floor': 1e-06, 'clip_max': 3.0, 'beta': 8.711469579953913}
[I 2026-06-01 02:19:43,834] Trial 1 finished with value: 0.22916838003018164 and parameters: {'alpha': 1682385.170967095, 'n_pcs': 2000, 'weight_scheme': 'exponential', 'weight_clip_max': 3.0, 'weight_exponential_beta': 8.711469579953913}. Best is trial 1 with value: 0.22916838003018164.
2026-06-01 02:19:43 | INFO | src.nested_cv_avggrm_weighted_unified | OUTER 10 | new best trial 1 (mean inner r=0.2292) saved to outputs/final_results/e6_pc_ridge_avggrm/thr_wing/e6_pc_ridge_avggrm_thr_wing_best_trials/split_10_best_trial.json
2026-06-01 02:19:43 | INFO | src.nested_cv_avggrm_weighted_unified | Trial 2 | outer=10 | alpha=2.757e+03 n_pcs=2000 (pc_topk) weight_search=on
2026-06-01 02:19:43 | INFO | src.nested_cv_avggrm_weighted_unified | Trial 2 | outer=10 | weight={'name': 'linear', 'floor': 1e-06, 'clip_max': 20.0, 'min_weight': 0.12918170299726892, 'max_weight': 3.9862564805616327}
[I 2026-06-01 02:19:47,481] Trial 2 finished with value: 0.13772555670639977 and parameters: {'alpha': 2757.0504493185063, 'n_pcs': 2000, 'weight_scheme': 'linear', 'weight_clip_max': 20.0, 'weight_linear_min_weight': 0.12918170299726892, 'weight_linear_max_weight': 3.9862564805616327}. Best is trial 1 with value: 0.22916838003018164.
2026-06-01 02:19:47 | INFO | src.nested_cv_avggrm_weighted_unified | Trial 3 | outer=10 | alpha=1.776e+03 n_pcs=4000 (pc_topk) weight_search=on
2026-06-01 02:19:47 | INFO | src.nested_cv_avggrm_weighted_unified | Trial 3 | outer=10 | weight={'name': 'exponential', 'floor': 1e-06, 'clip_max': 10.0, 'beta': 0.563604612251006}
[I 2026-06-01 02:19:53,242] Trial 3 finished with value: 0.12536133610888564 and parameters: {'alpha': 1775.825123718637, 'n_pcs': 4000, 'weight_scheme': 'exponential', 'weight_clip_max': 10.0, 'weight_exponential_beta': 0.563604612251006}. Best is trial 1 with value: 0.22916838003018164.
2026-06-01 02:19:53 | INFO | src.nested_cv_avggrm_weighted_unified | Trial 4 | outer=10 | alpha=1.835e+04 n_pcs=5000 (pc_topk) weight_search=on
2026-06-01 02:19:53 | INFO | src.nested_cv_avggrm_weighted_unified | Trial 4 | outer=10 | weight={'name': 'exponential', 'floor': 1e-06, 'clip_max': None, 'beta': 9.957095048208117}
[I 2026-06-01 02:20:01,310] Trial 4 finished with value: 0.2172493036601039 and parameters: {'alpha': 18351.68801260339, 'n_pcs': 5000, 'weight_scheme': 'exponential', 'weight_clip_max': None, 'weight_exponential_beta': 9.957095048208117}. Best is trial 1 with value: 0.22916838003018164.
2026-06-01 02:20:01 | INFO | src.nested_cv_avggrm_weighted_unified | Trial 5 | outer=10 | alpha=9.696e+03 n_pcs=1000 (pc_topk) weight_search=on
2026-06-01 02:20:01 | INFO | src.nested_cv_avggrm_weighted_unified | Trial 5 | outer=10 | weight={'name': 'exponential', 'floor': 1e-06, 'clip_max': 3.0, 'beta': 1.5726039441128932}
2026-06-01 02:20:03 | INFO | src.nested_cv_avggrm_weighted_unified | Trial 5 | outer=10 | pruned after 7/10 inner folds (mean r=0.1904)
[I 2026-06-01 02:20:03,367] Trial 5 pruned. 
2026-06-01 02:20:03 | INFO | src.nested_cv_avggrm_weighted_unified | Trial 6 | outer=10 | alpha=6.320e+04 n_pcs=2500 (pc_topk) weight_search=on
2026-06-01 02:20:03 | INFO | src.nested_cv_avggrm_weighted_unified | Trial 6 | outer=10 | weight={'name': 'uniform', 'floor': 1e-06, 'clip_max': 10.0}
[I 2026-06-01 02:20:06,097] Trial 6 finished with value: 0.22600152921160474 and parameters: {'alpha': 63199.5851103866, 'n_pcs': 2500, 'weight_scheme': 'uniform', 'weight_clip_max': 10.0}. Best is trial 1 with value: 0.22916838003018164.
2026-06-01 02:20:06 | INFO | src.nested_cv_avggrm_weighted_unified | Trial 7 | outer=10 | alpha=4.681e+04 n_pcs=2500 (pc_topk) weight_search=on
2026-06-01 02:20:06 | INFO | src.nested_cv_avggrm_weighted_unified | Trial 7 | outer=10 | weight={'name': 'linear', 'floor': 1e-06, 'clip_max': 3.0, 'min_weight': 0.13798029304672477, 'max_weight': 3.0957974174373546}
[I 2026-06-01 02:20:09,216] Trial 7 finished with value: 0.22946766083321385 and parameters: {'alpha': 46806.97703257331, 'n_pcs': 2500, 'weight_scheme': 'linear', 'weight_clip_max': 3.0, 'weight_linear_min_weight': 0.13798029304672477, 'weight_linear_max_weight': 3.0957974174373546}. Best is trial 7 with value: 0.22946766083321385.
2026-06-01 02:20:09 | INFO | src.nested_cv_avggrm_weighted_unified | OUTER 10 | new best trial 7 (mean inner r=0.2295) saved to outputs/final_results/e6_pc_ridge_avggrm/thr_wing/e6_pc_ridge_avggrm_thr_wing_best_trials/split_10_best_trial.json
2026-06-01 02:20:09 | INFO | src.nested_cv_avggrm_weighted_unified | Trial 8 | outer=10 | alpha=5.456e+04 n_pcs=3000 (pc_topk) weight_search=on
2026-06-01 02:20:09 | INFO | src.nested_cv_avggrm_weighted_unified | Trial 8 | outer=10 | weight={'name': 'linear', 'floor': 1e-06, 'clip_max': 5.0, 'min_weight': 0.6690067570691431, 'max_weight': 4.8744640334054115}
[I 2026-06-01 02:20:13,223] Trial 8 finished with value: 0.23198713535180268 and parameters: {'alpha': 54559.68395210245, 'n_pcs': 3000, 'weight_scheme': 'linear', 'weight_clip_max': 5.0, 'weight_linear_min_weight': 0.6690067570691431, 'weight_linear_max_weight': 4.8744640334054115}. Best is trial 8 with value: 0.23198713535180268.
2026-06-01 02:20:13 | INFO | src.nested_cv_avggrm_weighted_unified | OUTER 10 | new best trial 8 (mean inner r=0.2320) saved to outputs/final_results/e6_pc_ridge_avggrm/thr_wing/e6_pc_ridge_avggrm_thr_wing_best_trials/split_10_best_trial.json
2026-06-01 02:20:13 | INFO | src.nested_cv_avggrm_weighted_unified | Trial 9 | outer=10 | alpha=8.868e+03 n_pcs=2000 (pc_topk) weight_search=on
2026-06-01 02:20:13 | INFO | src.nested_cv_avggrm_weighted_unified | Trial 9 | outer=10 | weight={'name': 'linear', 'floor': 1e-06, 'clip_max': 20.0, 'min_weight': 0.861124149305412, 'max_weight': 4.702809729786679}
2026-06-01 02:20:14 | INFO | src.nested_cv_avggrm_weighted_unified | Trial 9 | outer=10 | pruned after 5/10 inner folds (mean r=0.1763)
[I 2026-06-01 02:20:14,991] Trial 9 pruned. 
2026-06-01 02:20:14 | INFO | src.nested_cv_avggrm_weighted_unified | Trial 10 | outer=10 | alpha=5.986e+05 n_pcs=500 (pc_topk) weight_search=on
2026-06-01 02:20:15 | INFO | src.nested_cv_avggrm_weighted_unified | Trial 10 | outer=10 | weight={'name': 'linear', 'floor': 1e-06, 'clip_max': 5.0, 'min_weight': 0.6649918033453551, 'max_weight': 1.3005022441588598}
2026-06-01 02:20:15 | INFO | src.nested_cv_avggrm_weighted_unified | Trial 10 | outer=10 | pruned after 5/10 inner folds (mean r=0.1766)
[I 2026-06-01 02:20:15,547] Trial 10 pruned. 
2026-06-01 02:20:15 | INFO | src.nested_cv_avggrm_weighted_unified | Trial 11 | outer=10 | alpha=1.521e+05 n_pcs=3500 (pc_topk) weight_search=on
2026-06-01 02:20:15 | INFO | src.nested_cv_avggrm_weighted_unified | Trial 11 | outer=10 | weight={'name': 'linear', 'floor': 1e-06, 'clip_max': 5.0, 'min_weight': 0.21805052648556972, 'max_weight': 2.6186888191762083}
[I 2026-06-01 02:20:20,631] Trial 11 finished with value: 0.23481733561769147 and parameters: {'alpha': 152073.59892684163, 'n_pcs': 3500, 'weight_scheme': 'linear', 'weight_clip_max': 5.0, 'weight_linear_min_weight': 0.21805052648556972, 'weight_linear_max_weight': 2.6186888191762083}. Best is trial 11 with value: 0.23481733561769147.
2026-06-01 02:20:20 | INFO | src.nested_cv_avggrm_weighted_unified | OUTER 10 | new best trial 11 (mean inner r=0.2348) saved to outputs/final_results/e6_pc_ridge_avggrm/thr_wing/e6_pc_ridge_avggrm_thr_wing_best_trials/split_10_best_trial.json
2026-06-01 02:20:20 | INFO | src.nested_cv_avggrm_weighted_unified | Trial 12 | outer=10 | alpha=3.350e+05 n_pcs=3500 (pc_topk) weight_search=on
2026-06-01 02:20:20 | INFO | src.nested_cv_avggrm_weighted_unified | Trial 12 | outer=10 | weight={'name': 'linear', 'floor': 1e-06, 'clip_max': 5.0, 'min_weight': 0.441330407432163, 'max_weight': 2.2759309186672403}
[I 2026-06-01 02:20:25,680] Trial 12 finished with value: 0.22793823683074063 and parameters: {'alpha': 334975.35321501165, 'n_pcs': 3500, 'weight_scheme': 'linear', 'weight_clip_max': 5.0, 'weight_linear_min_weight': 0.441330407432163, 'weight_linear_max_weight': 2.2759309186672403}. Best is trial 11 with value: 0.23481733561769147.
2026-06-01 02:20:25 | INFO | src.nested_cv_avggrm_weighted_unified | Trial 13 | outer=10 | alpha=9.546e+06 n_pcs=3500 (pc_topk) weight_search=on
2026-06-01 02:20:25 | INFO | src.nested_cv_avggrm_weighted_unified | Trial 13 | outer=10 | weight={'name': 'linear', 'floor': 1e-06, 'clip_max': 5.0, 'min_weight': 0.4665545926042718, 'max_weight': 2.936524498434815}
2026-06-01 02:20:28 | INFO | src.nested_cv_avggrm_weighted_unified | Trial 13 | outer=10 | pruned after 5/10 inner folds (mean r=0.2122)
[I 2026-06-01 02:20:28,209] Trial 13 pruned. 
2026-06-01 02:20:28 | INFO | src.nested_cv_avggrm_weighted_unified | Trial 14 | outer=10 | alpha=1.274e+05 n_pcs=5000 (pc_topk) weight_search=on
2026-06-01 02:20:28 | INFO | src.nested_cv_avggrm_weighted_unified | Trial 14 | outer=10 | weight={'name': 'linear', 'floor': 1e-06, 'clip_max': 5.0, 'min_weight': 0.7048126363943998, 'max_weight': 4.923849368117419}
[I 2026-06-01 02:20:36,331] Trial 14 finished with value: 0.2331565129479413 and parameters: {'alpha': 127392.0944984584, 'n_pcs': 5000, 'weight_scheme': 'linear', 'weight_clip_max': 5.0, 'weight_linear_min_weight': 0.7048126363943998, 'weight_linear_max_weight': 4.923849368117419}. Best is trial 11 with value: 0.23481733561769147.
2026-06-01 02:20:36 | INFO | src.nested_cv_avggrm_weighted_unified | Trial 15 | outer=10 | alpha=3.739e+05 n_pcs=5000 (pc_topk) weight_search=on
2026-06-01 02:20:36 | INFO | src.nested_cv_avggrm_weighted_unified | Trial 15 | outer=10 | weight={'name': 'uniform', 'floor': 1e-06, 'clip_max': 5.0}
2026-06-01 02:20:39 | INFO | src.nested_cv_avggrm_weighted_unified | Trial 15 | outer=10 | pruned after 5/10 inner folds (mean r=0.2033)
[I 2026-06-01 02:20:39,968] Trial 15 pruned. 
2026-06-01 02:20:39 | INFO | src.nested_cv_avggrm_weighted_unified | Trial 16 | outer=10 | alpha=2.102e+06 n_pcs=4500 (pc_topk) weight_search=on
2026-06-01 02:20:39 | INFO | src.nested_cv_avggrm_weighted_unified | Trial 16 | outer=10 | weight={'name': 'linear', 'floor': 1e-06, 'clip_max': 5.0, 'min_weight': 0.9899348522408853, 'max_weight': 2.3710369555596627}
2026-06-01 02:20:43 | INFO | src.nested_cv_avggrm_weighted_unified | Trial 16 | outer=10 | pruned after 5/10 inner folds (mean r=0.2042)
[I 2026-06-01 02:20:43,424] Trial 16 pruned. 
2026-06-01 02:20:43 | INFO | src.nested_cv_avggrm_weighted_unified | Trial 17 | outer=10 | alpha=1.695e+05 n_pcs=4500 (pc_topk) weight_search=on
2026-06-01 02:20:43 | INFO | src.nested_cv_avggrm_weighted_unified | Trial 17 | outer=10 | weight={'name': 'linear', 'floor': 1e-06, 'clip_max': 5.0, 'min_weight': 0.3167512509223513, 'max_weight': 3.7166959348359123}
[I 2026-06-01 02:20:50,362] Trial 17 finished with value: 0.2343255513186945 and parameters: {'alpha': 169487.76192369638, 'n_pcs': 4500, 'weight_scheme': 'linear', 'weight_clip_max': 5.0, 'weight_linear_min_weight': 0.3167512509223513, 'weight_linear_max_weight': 3.7166959348359123}. Best is trial 11 with value: 0.23481733561769147.
2026-06-01 02:20:50 | INFO | src.nested_cv_avggrm_weighted_unified | Trial 18 | outer=10 | alpha=1.147e+06 n_pcs=4000 (pc_topk) weight_search=on
2026-06-01 02:20:50 | INFO | src.nested_cv_avggrm_weighted_unified | Trial 18 | outer=10 | weight={'name': 'linear', 'floor': 1e-06, 'clip_max': 5.0, 'min_weight': 0.2783965310596569, 'max_weight': 3.8003422496430366}
[I 2026-06-01 02:20:56,071] Trial 18 finished with value: 0.222712223681835 and parameters: {'alpha': 1147229.2217332055, 'n_pcs': 4000, 'weight_scheme': 'linear', 'weight_clip_max': 5.0, 'weight_linear_min_weight': 0.2783965310596569, 'weight_linear_max_weight': 3.8003422496430366}. Best is trial 11 with value: 0.23481733561769147.
2026-06-01 02:20:56 | INFO | src.nested_cv_avggrm_weighted_unified | Trial 19 | outer=10 | alpha=8.069e+06 n_pcs=4500 (pc_topk) weight_search=on
2026-06-01 02:20:56 | INFO | src.nested_cv_avggrm_weighted_unified | Trial 19 | outer=10 | weight={'name': 'uniform', 'floor': 1e-06, 'clip_max': 10.0}
2026-06-01 02:20:59 | INFO | src.nested_cv_avggrm_weighted_unified | Trial 19 | outer=10 | pruned after 5/10 inner folds (mean r=0.1844)
[I 2026-06-01 02:20:59,041] Trial 19 pruned. 
2026-06-01 02:20:59 | INFO | src.nested_cv_avggrm_weighted_unified | Trial 20 | outer=10 | alpha=2.202e+05 n_pcs=3000 (pc_topk) weight_search=on
2026-06-01 02:20:59 | INFO | src.nested_cv_avggrm_weighted_unified | Trial 20 | outer=10 | weight={'name': 'linear', 'floor': 1e-06, 'clip_max': None, 'min_weight': 0.3006932949930545, 'max_weight': 3.686436260504225}
[I 2026-06-01 02:21:02,862] Trial 20 finished with value: 0.23393857998787432 and parameters: {'alpha': 220196.91418488897, 'n_pcs': 3000, 'weight_scheme': 'linear', 'weight_clip_max': None, 'weight_linear_min_weight': 0.3006932949930545, 'weight_linear_max_weight': 3.686436260504225}. Best is trial 11 with value: 0.23481733561769147.
2026-06-01 02:21:02 | INFO | src.nested_cv_avggrm_weighted_unified | Trial 21 | outer=10 | alpha=1.943e+05 n_pcs=3000 (pc_topk) weight_search=on
2026-06-01 02:21:02 | INFO | src.nested_cv_avggrm_weighted_unified | Trial 21 | outer=10 | weight={'name': 'linear', 'floor': 1e-06, 'clip_max': None, 'min_weight': 0.2982243312816384, 'max_weight': 3.7551809772169067}
[I 2026-06-01 02:21:06,866] Trial 21 finished with value: 0.23452287463860352 and parameters: {'alpha': 194338.33352974337, 'n_pcs': 3000, 'weight_scheme': 'linear', 'weight_clip_max': None, 'weight_linear_min_weight': 0.2982243312816384, 'weight_linear_max_weight': 3.7551809772169067}. Best is trial 11 with value: 0.23481733561769147.
2026-06-01 02:21:06 | INFO | src.nested_cv_avggrm_weighted_unified | Trial 22 | outer=10 | alpha=7.985e+05 n_pcs=3500 (pc_topk) weight_search=on
2026-06-01 02:21:06 | INFO | src.nested_cv_avggrm_weighted_unified | Trial 22 | outer=10 | weight={'name': 'linear', 'floor': 1e-06, 'clip_max': None, 'min_weight': 0.298736466779014, 'max_weight': 3.1606922905337442}
[I 2026-06-01 02:21:11,726] Trial 22 finished with value: 0.22458694621140532 and parameters: {'alpha': 798492.4980469069, 'n_pcs': 3500, 'weight_scheme': 'linear', 'weight_clip_max': None, 'weight_linear_min_weight': 0.298736466779014, 'weight_linear_max_weight': 3.1606922905337442}. Best is trial 11 with value: 0.23481733561769147.
2026-06-01 02:21:11 | INFO | src.nested_cv_avggrm_weighted_unified | Trial 23 | outer=10 | alpha=2.059e+04 n_pcs=4500 (pc_topk) weight_search=on
2026-06-01 02:21:11 | INFO | src.nested_cv_avggrm_weighted_unified | Trial 23 | outer=10 | weight={'name': 'linear', 'floor': 1e-06, 'clip_max': None, 'min_weight': 0.05247303287463728, 'max_weight': 4.172021461131635}
[I 2026-06-01 02:21:18,672] Trial 23 finished with value: 0.22188778435643544 and parameters: {'alpha': 20590.990871967864, 'n_pcs': 4500, 'weight_scheme': 'linear', 'weight_clip_max': None, 'weight_linear_min_weight': 0.05247303287463728, 'weight_linear_max_weight': 4.172021461131635}. Best is trial 11 with value: 0.23481733561769147.
2026-06-01 02:21:18 | INFO | src.nested_cv_avggrm_weighted_unified | Trial 24 | outer=10 | alpha=1.730e+05 n_pcs=3000 (pc_topk) weight_search=on
2026-06-01 02:21:18 | INFO | src.nested_cv_avggrm_weighted_unified | Trial 24 | outer=10 | weight={'name': 'linear', 'floor': 1e-06, 'clip_max': 20.0, 'min_weight': 0.33464012442479596, 'max_weight': 2.453099633320348}
[I 2026-06-01 02:21:22,647] Trial 24 finished with value: 0.23387081997812792 and parameters: {'alpha': 173032.61904027037, 'n_pcs': 3000, 'weight_scheme': 'linear', 'weight_clip_max': 20.0, 'weight_linear_min_weight': 0.33464012442479596, 'weight_linear_max_weight': 2.453099633320348}. Best is trial 11 with value: 0.23481733561769147.
2026-06-01 02:21:22 | INFO | src.nested_cv_avggrm_weighted_unified | Trial 25 | outer=10 | alpha=3.067e+06 n_pcs=3500 (pc_topk) weight_search=on
2026-06-01 02:21:22 | INFO | src.nested_cv_avggrm_weighted_unified | Trial 25 | outer=10 | weight={'name': 'linear', 'floor': 1e-06, 'clip_max': None, 'min_weight': 0.20437300532136127, 'max_weight': 3.4742289079948208}
2026-06-01 02:21:26 | INFO | src.nested_cv_avggrm_weighted_unified | Trial 25 | outer=10 | pruned after 7/10 inner folds (mean r=0.2372)
[I 2026-06-01 02:21:26,037] Trial 25 pruned. 
2026-06-01 02:21:26 | INFO | src.nested_cv_avggrm_weighted_unified | Trial 26 | outer=10 | alpha=3.978e+05 n_pcs=4000 (pc_topk) weight_search=on
2026-06-01 02:21:26 | INFO | src.nested_cv_avggrm_weighted_unified | Trial 26 | outer=10 | weight={'name': 'linear', 'floor': 1e-06, 'clip_max': 5.0, 'min_weight': 0.3938021390809069, 'max_weight': 4.268243576106276}
