[I 2026-06-01 19:06:37,413] Trial 149 finished with value: 0.2547106649250232 and parameters: {'alpha': 58260.3336067325, 'n_pcs': 4500, 'iw_method': 'pc_logistic', 'iw_clip_max': 7.0, 'iw_prob_clip': 0.044820182958779015, 'iw_n_components': 100, 'iw_logistic_c': 6.262381509422595e-05, 'iw_pca_fit': 'combined', 'iw_solver': 'lbfgs', 'iw_rho': 0.85}. Best is trial 147 with value: 0.25836214582968176.
2026-06-01 19:06:37 | INFO | Trial 150 | outer=5 | alpha=2.496e+04 n_pcs=4500 (pc_topk) weight={'name': 'pc_logistic', 'floor': 1e-06, 'clip_max': 7.0, 'prob_clip': 0.030655786189583017, 'n_components': 100, 'logistic_c': 3.177780732876214e-05, 'pca_fit': 'combined', 'solver': 'lbfgs', 'max_iter': 2000, 'fit_intercept': True, 'standardize_with_source': True, 'rho': 0.85}
[I 2026-06-01 19:06:51,989] Trial 150 finished with value: 0.2566844340060224 and parameters: {'alpha': 24964.781432859403, 'n_pcs': 4500, 'iw_method': 'pc_logistic', 'iw_clip_max': 7.0, 'iw_prob_clip': 0.030655786189583017, 'iw_n_components': 100, 'iw_logistic_c': 3.177780732876214e-05, 'iw_pca_fit': 'combined', 'iw_solver': 'lbfgs', 'iw_rho': 0.85}. Best is trial 147 with value: 0.25836214582968176.
2026-06-01 19:06:52 | INFO | Trial 151 | outer=5 | alpha=3.166e+04 n_pcs=4500 (pc_topk) weight={'name': 'pc_logistic', 'floor': 1e-06, 'clip_max': 7.0, 'prob_clip': 0.023050847208012978, 'n_components': 100, 'logistic_c': 0.00018132502274283187, 'pca_fit': 'combined', 'solver': 'lbfgs', 'max_iter': 2000, 'fit_intercept': True, 'standardize_with_source': True, 'rho': 0.85}
[I 2026-06-01 19:07:08,442] Trial 151 finished with value: 0.2570680569235158 and parameters: {'alpha': 31658.99997753726, 'n_pcs': 4500, 'iw_method': 'pc_logistic', 'iw_clip_max': 7.0, 'iw_prob_clip': 0.023050847208012978, 'iw_n_components': 100, 'iw_logistic_c': 0.00018132502274283187, 'iw_pca_fit': 'combined', 'iw_solver': 'lbfgs', 'iw_rho': 0.85}. Best is trial 147 with value: 0.25836214582968176.
2026-06-01 19:07:08 | INFO | Trial 152 | outer=5 | alpha=3.999e+04 n_pcs=4500 (pc_topk) weight={'name': 'pc_logistic', 'floor': 1e-06, 'clip_max': 7.0, 'prob_clip': 0.02368922035090144, 'n_components': 100, 'logistic_c': 9.858993113069889e-05, 'pca_fit': 'combined', 'solver': 'lbfgs', 'max_iter': 2000, 'fit_intercept': True, 'standardize_with_source': True, 'rho': 0.85}
[I 2026-06-01 19:07:23,010] Trial 152 finished with value: 0.2582063361486058 and parameters: {'alpha': 39992.1054326271, 'n_pcs': 4500, 'iw_method': 'pc_logistic', 'iw_clip_max': 7.0, 'iw_prob_clip': 0.02368922035090144, 'iw_n_components': 100, 'iw_logistic_c': 9.858993113069889e-05, 'iw_pca_fit': 'combined', 'iw_solver': 'lbfgs', 'iw_rho': 0.85}. Best is trial 147 with value: 0.25836214582968176.
2026-06-01 19:07:23 | INFO | Trial 153 | outer=5 | alpha=6.702e+04 n_pcs=5000 (pc_topk) weight={'name': 'pc_logistic', 'floor': 1e-06, 'clip_max': 7.0, 'prob_clip': 0.0005308094677757515, 'n_components': 100, 'logistic_c': 8.915808313463306e-05, 'pca_fit': 'combined', 'solver': 'lbfgs', 'max_iter': 2000, 'fit_intercept': True, 'standardize_with_source': True, 'rho': 0.85}
[I 2026-06-01 19:07:39,912] Trial 153 finished with value: 0.2528726880644654 and parameters: {'alpha': 67020.52435724415, 'n_pcs': 5000, 'iw_method': 'pc_logistic', 'iw_clip_max': 7.0, 'iw_prob_clip': 0.0005308094677757515, 'iw_n_components': 100, 'iw_logistic_c': 8.915808313463306e-05, 'iw_pca_fit': 'combined', 'iw_solver': 'lbfgs', 'iw_rho': 0.85}. Best is trial 147 with value: 0.25836214582968176.
2026-06-01 19:07:39 | INFO | Trial 154 | outer=5 | alpha=4.278e+04 n_pcs=4500 (pc_topk) weight={'name': 'pc_logistic', 'floor': 1e-06, 'clip_max': 7.0, 'prob_clip': 0.021273330472693155, 'n_components': 100, 'logistic_c': 4.031274701428331e-05, 'pca_fit': 'combined', 'solver': 'lbfgs', 'max_iter': 2000, 'fit_intercept': True, 'standardize_with_source': True, 'rho': 0.85}
[I 2026-06-01 19:07:54,389] Trial 154 finished with value: 0.25829468122367266 and parameters: {'alpha': 42783.81224927888, 'n_pcs': 4500, 'iw_method': 'pc_logistic', 'iw_clip_max': 7.0, 'iw_prob_clip': 0.021273330472693155, 'iw_n_components': 100, 'iw_logistic_c': 4.031274701428331e-05, 'iw_pca_fit': 'combined', 'iw_solver': 'lbfgs', 'iw_rho': 0.85}. Best is trial 147 with value: 0.25836214582968176.
2026-06-01 19:07:54 | INFO | Trial 155 | outer=5 | alpha=4.329e+04 n_pcs=4000 (pc_topk) weight={'name': 'pc_logistic', 'floor': 1e-06, 'clip_max': 7.0, 'prob_clip': 0.018653554626520602, 'n_components': 100, 'logistic_c': 3.5650529631666316e-05, 'pca_fit': 'combined', 'solver': 'lbfgs', 'max_iter': 2000, 'fit_intercept': True, 'standardize_with_source': True, 'rho': 0.85}
[I 2026-06-01 19:08:07,187] Trial 155 finished with value: 0.2572329524984871 and parameters: {'alpha': 43288.64390000662, 'n_pcs': 4000, 'iw_method': 'pc_logistic', 'iw_clip_max': 7.0, 'iw_prob_clip': 0.018653554626520602, 'iw_n_components': 100, 'iw_logistic_c': 3.5650529631666316e-05, 'iw_pca_fit': 'combined', 'iw_solver': 'lbfgs', 'iw_rho': 0.85}. Best is trial 147 with value: 0.25836214582968176.
2026-06-01 19:08:07 | INFO | Trial 156 | outer=5 | alpha=3.914e+04 n_pcs=4000 (pc_topk) weight={'name': 'pc_logistic', 'floor': 1e-06, 'clip_max': 7.0, 'prob_clip': 0.021064594256455415, 'n_components': 100, 'logistic_c': 3.341963579029874e-05, 'pca_fit': 'combined', 'solver': 'lbfgs', 'max_iter': 2000, 'fit_intercept': True, 'standardize_with_source': True, 'rho': 0.85}
[I 2026-06-01 19:08:20,503] Trial 156 finished with value: 0.25723195998921156 and parameters: {'alpha': 39142.59171854692, 'n_pcs': 4000, 'iw_method': 'pc_logistic', 'iw_clip_max': 7.0, 'iw_prob_clip': 0.021064594256455415, 'iw_n_components': 100, 'iw_logistic_c': 3.341963579029874e-05, 'iw_pca_fit': 'combined', 'iw_solver': 'lbfgs', 'iw_rho': 0.85}. Best is trial 147 with value: 0.25836214582968176.
2026-06-01 19:08:20 | INFO | Trial 157 | outer=5 | alpha=3.847e+04 n_pcs=4000 (pc_topk) weight={'name': 'pc_logistic', 'floor': 1e-06, 'clip_max': 7.0, 'prob_clip': 0.019099036174119174, 'n_components': 100, 'logistic_c': 2.013736987614412e-05, 'pca_fit': 'combined', 'solver': 'lbfgs', 'max_iter': 2000, 'fit_intercept': True, 'standardize_with_source': True, 'rho': 0.85}
[I 2026-06-01 19:08:33,470] Trial 157 finished with value: 0.2567065391624143 and parameters: {'alpha': 38468.436446135674, 'n_pcs': 4000, 'iw_method': 'pc_logistic', 'iw_clip_max': 7.0, 'iw_prob_clip': 0.019099036174119174, 'iw_n_components': 100, 'iw_logistic_c': 2.013736987614412e-05, 'iw_pca_fit': 'combined', 'iw_solver': 'lbfgs', 'iw_rho': 0.85}. Best is trial 147 with value: 0.25836214582968176.
2026-06-01 19:08:33 | INFO | Trial 158 | outer=5 | alpha=1.751e+04 n_pcs=4000 (pc_topk) weight={'name': 'uniform'}
[I 2026-06-01 19:08:40,232] Trial 158 finished with value: 0.23941596433687584 and parameters: {'alpha': 17506.57563533551, 'n_pcs': 4000, 'iw_method': 'uniform'}. Best is trial 147 with value: 0.25836214582968176.
2026-06-01 19:08:40 | INFO | Trial 159 | outer=5 | alpha=2.264e+04 n_pcs=4000 (pc_topk) weight={'name': 'pc_logistic', 'floor': 1e-06, 'clip_max': 12.0, 'prob_clip': 0.0006779302859258291, 'n_components': 100, 'logistic_c': 4.2299396061788376e-05, 'pca_fit': 'combined', 'solver': 'lbfgs', 'max_iter': 2000, 'fit_intercept': True, 'standardize_with_source': True, 'rho': 0.85}
[I 2026-06-01 19:08:52,736] Trial 159 finished with value: 0.24877778121092736 and parameters: {'alpha': 22641.84033146785, 'n_pcs': 4000, 'iw_method': 'pc_logistic', 'iw_clip_max': 12.0, 'iw_prob_clip': 0.0006779302859258291, 'iw_n_components': 100, 'iw_logistic_c': 4.2299396061788376e-05, 'iw_pca_fit': 'combined', 'iw_solver': 'lbfgs', 'iw_rho': 0.85}. Best is trial 147 with value: 0.25836214582968176.
2026-06-01 19:08:52 | INFO | Trial 160 | outer=5 | alpha=7.333e+04 n_pcs=4000 (pc_topk) weight={'name': 'pc_logistic', 'floor': 1e-06, 'clip_max': 7.0, 'prob_clip': 0.015056189056369684, 'n_components': 100, 'logistic_c': 2.937662459741541e-05, 'pca_fit': 'combined', 'solver': 'lbfgs', 'max_iter': 2000, 'fit_intercept': True, 'standardize_with_source': True, 'rho': 0.85}
[I 2026-06-01 19:09:05,128] Trial 160 finished with value: 0.25660742337138737 and parameters: {'alpha': 73325.59360682666, 'n_pcs': 4000, 'iw_method': 'pc_logistic', 'iw_clip_max': 7.0, 'iw_prob_clip': 0.015056189056369684, 'iw_n_components': 100, 'iw_logistic_c': 2.937662459741541e-05, 'iw_pca_fit': 'combined', 'iw_solver': 'lbfgs', 'iw_rho': 0.85}. Best is trial 147 with value: 0.25836214582968176.
2026-06-01 19:09:05 | INFO | Trial 161 | outer=5 | alpha=4.075e+04 n_pcs=4000 (pc_topk) weight={'name': 'pc_logistic', 'floor': 1e-06, 'clip_max': 7.0, 'prob_clip': 0.020970917177663407, 'n_components': 100, 'logistic_c': 7.174783875568956e-06, 'pca_fit': 'combined', 'solver': 'lbfgs', 'max_iter': 2000, 'fit_intercept': True, 'standardize_with_source': True, 'rho': 0.85}
[I 2026-06-01 19:09:17,330] Trial 161 finished with value: 0.2530594473823105 and parameters: {'alpha': 40746.75701653221, 'n_pcs': 4000, 'iw_method': 'pc_logistic', 'iw_clip_max': 7.0, 'iw_prob_clip': 0.020970917177663407, 'iw_n_components': 100, 'iw_logistic_c': 7.174783875568956e-06, 'iw_pca_fit': 'combined', 'iw_solver': 'lbfgs', 'iw_rho': 0.85}. Best is trial 147 with value: 0.25836214582968176.
2026-06-01 19:09:17 | INFO | Trial 162 | outer=5 | alpha=3.498e+04 n_pcs=4000 (pc_topk) weight={'name': 'pc_logistic', 'floor': 1e-06, 'clip_max': 7.0, 'prob_clip': 0.021843110885597882, 'n_components': 20, 'logistic_c': 6.040928158298663e-05, 'pca_fit': 'combined', 'solver': 'lbfgs', 'max_iter': 2000, 'fit_intercept': True, 'standardize_with_source': True, 'rho': 0.85}
[I 2026-06-01 19:09:30,372] Trial 162 finished with value: 0.2563021410993491 and parameters: {'alpha': 34981.33605000399, 'n_pcs': 4000, 'iw_method': 'pc_logistic', 'iw_clip_max': 7.0, 'iw_prob_clip': 0.021843110885597882, 'iw_n_components': 20, 'iw_logistic_c': 6.040928158298663e-05, 'iw_pca_fit': 'combined', 'iw_solver': 'lbfgs', 'iw_rho': 0.85}. Best is trial 147 with value: 0.25836214582968176.
2026-06-01 19:09:30 | INFO | Trial 163 | outer=5 | alpha=4.323e+04 n_pcs=4000 (pc_topk) weight={'name': 'pc_logistic', 'floor': 1e-06, 'clip_max': 7.0, 'prob_clip': 0.01731196034316713, 'n_components': 100, 'logistic_c': 9.539016576705883e-05, 'pca_fit': 'combined', 'solver': 'lbfgs', 'max_iter': 2000, 'fit_intercept': True, 'standardize_with_source': True, 'rho': 0.85}
[I 2026-06-01 19:09:44,311] Trial 163 finished with value: 0.25684093386069085 and parameters: {'alpha': 43234.081977497684, 'n_pcs': 4000, 'iw_method': 'pc_logistic', 'iw_clip_max': 7.0, 'iw_prob_clip': 0.01731196034316713, 'iw_n_components': 100, 'iw_logistic_c': 9.539016576705883e-05, 'iw_pca_fit': 'combined', 'iw_solver': 'lbfgs', 'iw_rho': 0.85}. Best is trial 147 with value: 0.25836214582968176.
2026-06-01 19:09:44 | INFO | Trial 164 | outer=5 | alpha=1.489e+06 n_pcs=4000 (pc_topk) weight={'name': 'pc_logistic', 'floor': 1e-06, 'clip_max': 7.0, 'prob_clip': 0.019430885674551517, 'n_components': 100, 'logistic_c': 2.7544778066815942e-05, 'pca_fit': 'combined', 'solver': 'lbfgs', 'max_iter': 2000, 'fit_intercept': True, 'standardize_with_source': True, 'rho': 0.85}
[I 2026-06-01 19:09:57,660] Trial 164 finished with value: 0.2310962454954475 and parameters: {'alpha': 1489377.206406733, 'n_pcs': 4000, 'iw_method': 'pc_logistic', 'iw_clip_max': 7.0, 'iw_prob_clip': 0.019430885674551517, 'iw_n_components': 100, 'iw_logistic_c': 2.7544778066815942e-05, 'iw_pca_fit': 'combined', 'iw_solver': 'lbfgs', 'iw_rho': 0.85}. Best is trial 147 with value: 0.25836214582968176.
2026-06-01 19:09:57 | INFO | Trial 165 | outer=5 | alpha=2.794e+04 n_pcs=4000 (pc_topk) weight={'name': 'pc_logistic', 'floor': 1e-06, 'clip_max': 7.0, 'prob_clip': 0.023933571979897657, 'n_components': 100, 'logistic_c': 1.4068981061960167e-05, 'pca_fit': 'combined', 'solver': 'lbfgs', 'max_iter': 2000, 'fit_intercept': True, 'standardize_with_source': True, 'rho': 0.85}
[I 2026-06-01 19:10:10,777] Trial 165 finished with value: 0.2544641967676936 and parameters: {'alpha': 27944.129089629136, 'n_pcs': 4000, 'iw_method': 'pc_logistic', 'iw_clip_max': 7.0, 'iw_prob_clip': 0.023933571979897657, 'iw_n_components': 100, 'iw_logistic_c': 1.4068981061960167e-05, 'iw_pca_fit': 'combined', 'iw_solver': 'lbfgs', 'iw_rho': 0.85}. Best is trial 147 with value: 0.25836214582968176.
2026-06-01 19:10:10 | INFO | Trial 166 | outer=5 | alpha=5.672e+04 n_pcs=4000 (pc_topk) weight={'name': 'pc_logistic', 'floor': 1e-06, 'clip_max': 1.5, 'prob_clip': 0.017985438804294446, 'n_components': 100, 'logistic_c': 4.387843977764893e-05, 'pca_fit': 'combined', 'solver': 'lbfgs', 'max_iter': 2000, 'fit_intercept': True, 'standardize_with_source': True, 'rho': 1.0}
[I 2026-06-01 19:10:24,166] Trial 166 finished with value: 0.2525151470100851 and parameters: {'alpha': 56720.3454776434, 'n_pcs': 4000, 'iw_method': 'pc_logistic', 'iw_clip_max': 1.5, 'iw_prob_clip': 0.017985438804294446, 'iw_n_components': 100, 'iw_logistic_c': 4.387843977764893e-05, 'iw_pca_fit': 'combined', 'iw_solver': 'lbfgs', 'iw_rho': 1.0}. Best is trial 147 with value: 0.25836214582968176.
2026-06-01 19:10:24 | INFO | Trial 167 | outer=5 | alpha=4.716e+04 n_pcs=4000 (pc_topk) weight={'name': 'pc_logistic', 'floor': 1e-06, 'clip_max': 7.0, 'prob_clip': 0.021084165294336127, 'n_components': 100, 'logistic_c': 7.567231311405475e-05, 'pca_fit': 'combined', 'solver': 'lbfgs', 'max_iter': 2000, 'fit_intercept': True, 'standardize_with_source': True, 'rho': 0.85}
[I 2026-06-01 19:10:38,094] Trial 167 finished with value: 0.2578835322843844 and parameters: {'alpha': 47157.12520004907, 'n_pcs': 4000, 'iw_method': 'pc_logistic', 'iw_clip_max': 7.0, 'iw_prob_clip': 0.021084165294336127, 'iw_n_components': 100, 'iw_logistic_c': 7.567231311405475e-05, 'iw_pca_fit': 'combined', 'iw_solver': 'lbfgs', 'iw_rho': 0.85}. Best is trial 147 with value: 0.25836214582968176.
2026-06-01 19:10:38 | INFO | Trial 168 | outer=5 | alpha=6.449e+04 n_pcs=4000 (pc_topk) weight={'name': 'pc_logistic', 'floor': 1e-06, 'clip_max': 7.0, 'prob_clip': 0.02205616059967648, 'n_components': 100, 'logistic_c': 8.691121440453943e-05, 'pca_fit': 'combined', 'solver': 'lbfgs', 'max_iter': 2000, 'fit_intercept': True, 'standardize_with_source': True, 'rho': 0.85}
[I 2026-06-01 19:10:52,005] Trial 168 finished with value: 0.257619758713595 and parameters: {'alpha': 64494.075781939566, 'n_pcs': 4000, 'iw_method': 'pc_logistic', 'iw_clip_max': 7.0, 'iw_prob_clip': 0.02205616059967648, 'iw_n_components': 100, 'iw_logistic_c': 8.691121440453943e-05, 'iw_pca_fit': 'combined', 'iw_solver': 'lbfgs', 'iw_rho': 0.85}. Best is trial 147 with value: 0.25836214582968176.
2026-06-01 19:10:52 | INFO | Trial 169 | outer=5 | alpha=6.670e+04 n_pcs=4000 (pc_topk) weight={'name': 'pc_logistic', 'floor': 1e-06, 'clip_max': 7.0, 'prob_clip': 0.021054979286481573, 'n_components': 100, 'logistic_c': 8.742596891170105e-05, 'pca_fit': 'combined', 'solver': 'lbfgs', 'max_iter': 2000, 'fit_intercept': True, 'standardize_with_source': True, 'rho': 0.85}
[I 2026-06-01 19:11:06,235] Trial 169 finished with value: 0.25755399136051027 and parameters: {'alpha': 66700.12612040063, 'n_pcs': 4000, 'iw_method': 'pc_logistic', 'iw_clip_max': 7.0, 'iw_prob_clip': 0.021054979286481573, 'iw_n_components': 100, 'iw_logistic_c': 8.742596891170105e-05, 'iw_pca_fit': 'combined', 'iw_solver': 'lbfgs', 'iw_rho': 0.85}. Best is trial 147 with value: 0.25836214582968176.
2026-06-01 19:11:06 | INFO | Trial 170 | outer=5 | alpha=7.060e+04 n_pcs=4000 (pc_topk) weight={'name': 'pc_logistic', 'floor': 1e-06, 'clip_max': 7.0, 'prob_clip': 0.021009582233538437, 'n_components': 100, 'logistic_c': 8.455513615617933e-05, 'pca_fit': 'combined', 'solver': 'lbfgs', 'max_iter': 2000, 'fit_intercept': True, 'standardize_with_source': True, 'rho': 0.85}
[I 2026-06-01 19:11:21,307] Trial 170 finished with value: 0.25741060166983404 and parameters: {'alpha': 70598.92584639436, 'n_pcs': 4000, 'iw_method': 'pc_logistic', 'iw_clip_max': 7.0, 'iw_prob_clip': 0.021009582233538437, 'iw_n_components': 100, 'iw_logistic_c': 8.455513615617933e-05, 'iw_pca_fit': 'combined', 'iw_solver': 'lbfgs', 'iw_rho': 0.85}. Best is trial 147 with value: 0.25836214582968176.
2026-06-01 19:11:21 | INFO | Trial 171 | outer=5 | alpha=7.170e+04 n_pcs=4000 (pc_topk) weight={'name': 'pc_logistic', 'floor': 1e-06, 'clip_max': 7.0, 'prob_clip': 0.02107390830170815, 'n_components': 100, 'logistic_c': 8.504422046308897e-05, 'pca_fit': 'combined', 'solver': 'lbfgs', 'max_iter': 2000, 'fit_intercept': True, 'standardize_with_source': True, 'rho': 0.85}
[I 2026-06-01 19:11:34,806] Trial 171 finished with value: 0.2573487273532403 and parameters: {'alpha': 71702.82021946744, 'n_pcs': 4000, 'iw_method': 'pc_logistic', 'iw_clip_max': 7.0, 'iw_prob_clip': 0.02107390830170815, 'iw_n_components': 100, 'iw_logistic_c': 8.504422046308897e-05, 'iw_pca_fit': 'combined', 'iw_solver': 'lbfgs', 'iw_rho': 0.85}. Best is trial 147 with value: 0.25836214582968176.
2026-06-01 19:11:34 | INFO | Trial 172 | outer=5 | alpha=6.698e+04 n_pcs=4000 (pc_topk) weight={'name': 'pc_logistic', 'floor': 1e-06, 'clip_max': 7.0, 'prob_clip': 0.01965331800513262, 'n_components': 100, 'logistic_c': 9.006907920277e-05, 'pca_fit': 'combined', 'solver': 'lbfgs', 'max_iter': 2000, 'fit_intercept': True, 'standardize_with_source': True, 'rho': 0.85}
[I 2026-06-01 19:11:48,931] Trial 172 finished with value: 0.2574516053482944 and parameters: {'alpha': 66980.36798405925, 'n_pcs': 4000, 'iw_method': 'pc_logistic', 'iw_clip_max': 7.0, 'iw_prob_clip': 0.01965331800513262, 'iw_n_components': 100, 'iw_logistic_c': 9.006907920277e-05, 'iw_pca_fit': 'combined', 'iw_solver': 'lbfgs', 'iw_rho': 0.85}. Best is trial 147 with value: 0.25836214582968176.
2026-06-01 19:11:48 | INFO | Trial 173 | outer=5 | alpha=7.168e+04 n_pcs=4000 (pc_topk) weight={'name': 'pc_logistic', 'floor': 1e-06, 'clip_max': 7.0, 'prob_clip': 0.020308004308788326, 'n_components': 100, 'logistic_c': 8.55163452151839e-05, 'pca_fit': 'combined', 'solver': 'lbfgs', 'max_iter': 2000, 'fit_intercept': True, 'standardize_with_source': True, 'rho': 0.85}
[I 2026-06-01 19:12:02,924] Trial 173 finished with value: 0.2573506148119516 and parameters: {'alpha': 71679.71174756344, 'n_pcs': 4000, 'iw_method': 'pc_logistic', 'iw_clip_max': 7.0, 'iw_prob_clip': 0.020308004308788326, 'iw_n_components': 100, 'iw_logistic_c': 8.55163452151839e-05, 'iw_pca_fit': 'combined', 'iw_solver': 'lbfgs', 'iw_rho': 0.85}. Best is trial 147 with value: 0.25836214582968176.
2026-06-01 19:12:02 | INFO | Trial 174 | outer=5 | alpha=7.124e+04 n_pcs=4000 (pc_topk) weight={'name': 'pc_logistic', 'floor': 1e-06, 'clip_max': 7.0, 'prob_clip': 0.020676413837698433, 'n_components': 100, 'logistic_c': 8.985125443476426e-05, 'pca_fit': 'combined', 'solver': 'lbfgs', 'max_iter': 2000, 'fit_intercept': True, 'standardize_with_source': True, 'rho': 0.85}
[I 2026-06-01 19:12:17,075] Trial 174 finished with value: 0.25734130696577756 and parameters: {'alpha': 71243.31088865313, 'n_pcs': 4000, 'iw_method': 'pc_logistic', 'iw_clip_max': 7.0, 'iw_prob_clip': 0.020676413837698433, 'iw_n_components': 100, 'iw_logistic_c': 8.985125443476426e-05, 'iw_pca_fit': 'combined', 'iw_solver': 'lbfgs', 'iw_rho': 0.85}. Best is trial 147 with value: 0.25836214582968176.
2026-06-01 19:12:17 | INFO | Trial 175 | outer=5 | alpha=6.599e+04 n_pcs=4000 (pc_topk) weight={'name': 'pc_logistic', 'floor': 1e-06, 'clip_max': 7.0, 'prob_clip': 0.022002033010953027, 'n_components': 60, 'logistic_c': 0.000108637236898945, 'pca_fit': 'combined', 'solver': 'lbfgs', 'max_iter': 2000, 'fit_intercept': True, 'standardize_with_source': True, 'rho': 0.85}
[I 2026-06-01 19:12:30,922] Trial 175 finished with value: 0.255269221092956 and parameters: {'alpha': 65992.9910243352, 'n_pcs': 4000, 'iw_method': 'pc_logistic', 'iw_clip_max': 7.0, 'iw_prob_clip': 0.022002033010953027, 'iw_n_components': 60, 'iw_logistic_c': 0.000108637236898945, 'iw_pca_fit': 'combined', 'iw_solver': 'lbfgs', 'iw_rho': 0.85}. Best is trial 147 with value: 0.25836214582968176.
2026-06-01 19:12:30 | INFO | Trial 176 | outer=5 | alpha=1.012e+05 n_pcs=3500 (pc_topk) weight={'name': 'pc_logistic', 'floor': 1e-06, 'clip_max': 7.0, 'prob_clip': 0.019401937489007842, 'n_components': 100, 'logistic_c': 6.844678015579408e-05, 'pca_fit': 'combined', 'solver': 'lbfgs', 'max_iter': 2000, 'fit_intercept': True, 'standardize_with_source': True, 'rho': 0.85}
[I 2026-06-01 19:12:41,412] Trial 176 finished with value: 0.25362707139032625 and parameters: {'alpha': 101207.1643986074, 'n_pcs': 3500, 'iw_method': 'pc_logistic', 'iw_clip_max': 7.0, 'iw_prob_clip': 0.019401937489007842, 'iw_n_components': 100, 'iw_logistic_c': 6.844678015579408e-05, 'iw_pca_fit': 'combined', 'iw_solver': 'lbfgs', 'iw_rho': 0.85}. Best is trial 147 with value: 0.25836214582968176.
2026-06-01 19:12:41 | INFO | Trial 177 | outer=5 | alpha=7.130e+04 n_pcs=4000 (pc_topk) weight={'name': 'pc_logistic', 'floor': 1e-06, 'clip_max': 7.0, 'prob_clip': 0.023767501612785995, 'n_components': 100, 'logistic_c': 0.00013563110011509348, 'pca_fit': 'combined', 'solver': 'lbfgs', 'max_iter': 2000, 'fit_intercept': True, 'standardize_with_source': True, 'rho': 0.85}
