[I 2026-06-01 15:09:56,781] Trial 172 finished with value: 0.24334589693029124 and parameters: {'alpha': 176391.96944899572, 'n_pcs': 3500, 'iw_method': 'pc_logistic', 'iw_clip_max': 2.5, 'iw_prob_clip': 0.015333445393198931, 'iw_n_components': 80, 'iw_logistic_c': 3.0923028598372146e-05, 'iw_pca_fit': 'combined', 'iw_solver': 'lbfgs', 'iw_rho': 0.7}. Best is trial 169 with value: 0.24360985385405204.
2026-06-01 15:09:56 | INFO | Trial 173 | outer=2 | alpha=1.835e+05 n_pcs=3500 (pc_topk) weight={'name': 'pc_logistic', 'floor': 1e-06, 'clip_max': 2.5, 'prob_clip': 0.015880055838457335, 'n_components': 80, 'logistic_c': 1.6502558066816407e-05, 'pca_fit': 'combined', 'solver': 'lbfgs', 'max_iter': 2000, 'fit_intercept': True, 'standardize_with_source': True, 'rho': 0.7}
[I 2026-06-01 15:10:08,274] Trial 173 finished with value: 0.2419118852274429 and parameters: {'alpha': 183488.53024118254, 'n_pcs': 3500, 'iw_method': 'pc_logistic', 'iw_clip_max': 2.5, 'iw_prob_clip': 0.015880055838457335, 'iw_n_components': 80, 'iw_logistic_c': 1.6502558066816407e-05, 'iw_pca_fit': 'combined', 'iw_solver': 'lbfgs', 'iw_rho': 0.7}. Best is trial 169 with value: 0.24360985385405204.
2026-06-01 15:10:08 | INFO | Trial 174 | outer=2 | alpha=2.129e+05 n_pcs=3500 (pc_topk) weight={'name': 'pc_logistic', 'floor': 1e-06, 'clip_max': 2.5, 'prob_clip': 0.022412862255122408, 'n_components': 80, 'logistic_c': 0.0001447326904512518, 'pca_fit': 'combined', 'solver': 'lbfgs', 'max_iter': 2000, 'fit_intercept': True, 'standardize_with_source': True, 'rho': 0.7}
[I 2026-06-01 15:10:24,349] Trial 174 finished with value: 0.24260227690236252 and parameters: {'alpha': 212942.71093486913, 'n_pcs': 3500, 'iw_method': 'pc_logistic', 'iw_clip_max': 2.5, 'iw_prob_clip': 0.022412862255122408, 'iw_n_components': 80, 'iw_logistic_c': 0.0001447326904512518, 'iw_pca_fit': 'combined', 'iw_solver': 'lbfgs', 'iw_rho': 0.7}. Best is trial 169 with value: 0.24360985385405204.
2026-06-01 15:10:24 | INFO | Trial 175 | outer=2 | alpha=1.703e+05 n_pcs=3500 (pc_topk) weight={'name': 'pc_logistic', 'floor': 1e-06, 'clip_max': 2.5, 'prob_clip': 0.014021528344073097, 'n_components': 80, 'logistic_c': 8.378687221537278e-05, 'pca_fit': 'combined', 'solver': 'lbfgs', 'max_iter': 2000, 'fit_intercept': True, 'standardize_with_source': True, 'rho': 0.7}
[I 2026-06-01 15:10:39,023] Trial 175 finished with value: 0.24365156471433566 and parameters: {'alpha': 170305.1686049229, 'n_pcs': 3500, 'iw_method': 'pc_logistic', 'iw_clip_max': 2.5, 'iw_prob_clip': 0.014021528344073097, 'iw_n_components': 80, 'iw_logistic_c': 8.378687221537278e-05, 'iw_pca_fit': 'combined', 'iw_solver': 'lbfgs', 'iw_rho': 0.7}. Best is trial 175 with value: 0.24365156471433566.
2026-06-01 15:10:39 | INFO | Trial 176 | outer=2 | alpha=3.295e+05 n_pcs=3500 (pc_topk) weight={'name': 'pc_logistic', 'floor': 1e-06, 'clip_max': 2.5, 'prob_clip': 0.013993238594157034, 'n_components': 60, 'logistic_c': 7.797436603154951e-05, 'pca_fit': 'combined', 'solver': 'lbfgs', 'max_iter': 2000, 'fit_intercept': True, 'standardize_with_source': True, 'rho': 1.0}
[I 2026-06-01 15:10:51,391] Trial 176 finished with value: 0.24389582708387164 and parameters: {'alpha': 329460.71078807843, 'n_pcs': 3500, 'iw_method': 'pc_logistic', 'iw_clip_max': 2.5, 'iw_prob_clip': 0.013993238594157034, 'iw_n_components': 60, 'iw_logistic_c': 7.797436603154951e-05, 'iw_pca_fit': 'combined', 'iw_solver': 'lbfgs', 'iw_rho': 1.0}. Best is trial 176 with value: 0.24389582708387164.
2026-06-01 15:10:51 | INFO | Trial 177 | outer=2 | alpha=3.276e+05 n_pcs=3500 (pc_topk) weight={'name': 'pc_logistic', 'floor': 1e-06, 'clip_max': 2.5, 'prob_clip': 0.014477463511161635, 'n_components': 60, 'logistic_c': 8.98302661848385e-05, 'pca_fit': 'combined', 'solver': 'lbfgs', 'max_iter': 2000, 'fit_intercept': True, 'standardize_with_source': True, 'rho': 1.0}
[I 2026-06-01 15:11:04,593] Trial 177 finished with value: 0.24354331231895907 and parameters: {'alpha': 327553.08180126443, 'n_pcs': 3500, 'iw_method': 'pc_logistic', 'iw_clip_max': 2.5, 'iw_prob_clip': 0.014477463511161635, 'iw_n_components': 60, 'iw_logistic_c': 8.98302661848385e-05, 'iw_pca_fit': 'combined', 'iw_solver': 'lbfgs', 'iw_rho': 1.0}. Best is trial 176 with value: 0.24389582708387164.
2026-06-01 15:11:04 | INFO | Trial 178 | outer=2 | alpha=3.253e+05 n_pcs=3500 (pc_topk) weight={'name': 'pc_logistic', 'floor': 1e-06, 'clip_max': 2.5, 'prob_clip': 0.014330637834320231, 'n_components': 60, 'logistic_c': 8.919476429389393e-05, 'pca_fit': 'combined', 'solver': 'lbfgs', 'max_iter': 2000, 'fit_intercept': True, 'standardize_with_source': True, 'rho': 1.0}
[I 2026-06-01 15:11:17,171] Trial 178 finished with value: 0.24359793567547391 and parameters: {'alpha': 325254.86720674316, 'n_pcs': 3500, 'iw_method': 'pc_logistic', 'iw_clip_max': 2.5, 'iw_prob_clip': 0.014330637834320231, 'iw_n_components': 60, 'iw_logistic_c': 8.919476429389393e-05, 'iw_pca_fit': 'combined', 'iw_solver': 'lbfgs', 'iw_rho': 1.0}. Best is trial 176 with value: 0.24389582708387164.
2026-06-01 15:11:17 | INFO | Trial 179 | outer=2 | alpha=3.459e+05 n_pcs=3500 (pc_topk) weight={'name': 'pc_logistic', 'floor': 1e-06, 'clip_max': 2.5, 'prob_clip': 0.014799103471220062, 'n_components': 60, 'logistic_c': 9.23740626322283e-05, 'pca_fit': 'combined', 'solver': 'lbfgs', 'max_iter': 2000, 'fit_intercept': True, 'standardize_with_source': True, 'rho': 1.0}
[I 2026-06-01 15:11:34,360] Trial 179 finished with value: 0.24327421724815612 and parameters: {'alpha': 345914.39186744724, 'n_pcs': 3500, 'iw_method': 'pc_logistic', 'iw_clip_max': 2.5, 'iw_prob_clip': 0.014799103471220062, 'iw_n_components': 60, 'iw_logistic_c': 9.23740626322283e-05, 'iw_pca_fit': 'combined', 'iw_solver': 'lbfgs', 'iw_rho': 1.0}. Best is trial 176 with value: 0.24389582708387164.
2026-06-01 15:11:34 | INFO | Trial 180 | outer=2 | alpha=4.682e+05 n_pcs=3500 (pc_topk) weight={'name': 'pc_logistic', 'floor': 1e-06, 'clip_max': 2.5, 'prob_clip': 0.018090426858135056, 'n_components': 60, 'logistic_c': 0.00016754320572083179, 'pca_fit': 'combined', 'solver': 'lbfgs', 'max_iter': 2000, 'fit_intercept': True, 'standardize_with_source': True, 'rho': 1.0}
[I 2026-06-01 15:11:47,722] Trial 180 finished with value: 0.24019965718461603 and parameters: {'alpha': 468220.2974885504, 'n_pcs': 3500, 'iw_method': 'pc_logistic', 'iw_clip_max': 2.5, 'iw_prob_clip': 0.018090426858135056, 'iw_n_components': 60, 'iw_logistic_c': 0.00016754320572083179, 'iw_pca_fit': 'combined', 'iw_solver': 'lbfgs', 'iw_rho': 1.0}. Best is trial 176 with value: 0.24389582708387164.
2026-06-01 15:11:47 | INFO | Trial 181 | outer=2 | alpha=2.930e+05 n_pcs=3500 (pc_topk) weight={'name': 'pc_logistic', 'floor': 1e-06, 'clip_max': 2.5, 'prob_clip': 0.014425010388455622, 'n_components': 60, 'logistic_c': 8.676265575897487e-05, 'pca_fit': 'combined', 'solver': 'lbfgs', 'max_iter': 2000, 'fit_intercept': True, 'standardize_with_source': True, 'rho': 1.0}
[I 2026-06-01 15:12:13,070] Trial 181 finished with value: 0.24391094524689755 and parameters: {'alpha': 292986.8754826779, 'n_pcs': 3500, 'iw_method': 'pc_logistic', 'iw_clip_max': 2.5, 'iw_prob_clip': 0.014425010388455622, 'iw_n_components': 60, 'iw_logistic_c': 8.676265575897487e-05, 'iw_pca_fit': 'combined', 'iw_solver': 'lbfgs', 'iw_rho': 1.0}. Best is trial 181 with value: 0.24391094524689755.
2026-06-01 15:12:13 | INFO | Trial 182 | outer=2 | alpha=5.502e+05 n_pcs=3500 (pc_topk) weight={'name': 'pc_logistic', 'floor': 1e-06, 'clip_max': 2.5, 'prob_clip': 0.01411177423462403, 'n_components': 60, 'logistic_c': 8.763273385363074e-05, 'pca_fit': 'combined', 'solver': 'lbfgs', 'max_iter': 2000, 'fit_intercept': True, 'standardize_with_source': True, 'rho': 1.0}
[I 2026-06-01 15:12:25,635] Trial 182 finished with value: 0.24158245349757207 and parameters: {'alpha': 550217.5155594089, 'n_pcs': 3500, 'iw_method': 'pc_logistic', 'iw_clip_max': 2.5, 'iw_prob_clip': 0.01411177423462403, 'iw_n_components': 60, 'iw_logistic_c': 8.763273385363074e-05, 'iw_pca_fit': 'combined', 'iw_solver': 'lbfgs', 'iw_rho': 1.0}. Best is trial 181 with value: 0.24391094524689755.
2026-06-01 15:12:25 | INFO | Trial 183 | outer=2 | alpha=3.782e+05 n_pcs=3500 (pc_topk) weight={'name': 'pc_logistic', 'floor': 1e-06, 'clip_max': 2.5, 'prob_clip': 0.01625257956868875, 'n_components': 60, 'logistic_c': 0.00026364627181423803, 'pca_fit': 'combined', 'solver': 'lbfgs', 'max_iter': 2000, 'fit_intercept': True, 'standardize_with_source': True, 'rho': 1.0}
[I 2026-06-01 15:12:51,613] Trial 183 finished with value: 0.23998058209921003 and parameters: {'alpha': 378190.321852545, 'n_pcs': 3500, 'iw_method': 'pc_logistic', 'iw_clip_max': 2.5, 'iw_prob_clip': 0.01625257956868875, 'iw_n_components': 60, 'iw_logistic_c': 0.00026364627181423803, 'iw_pca_fit': 'combined', 'iw_solver': 'lbfgs', 'iw_rho': 1.0}. Best is trial 181 with value: 0.24391094524689755.
2026-06-01 15:12:51 | INFO | Trial 184 | outer=2 | alpha=2.940e+05 n_pcs=3500 (pc_topk) weight={'name': 'pc_logistic', 'floor': 1e-06, 'clip_max': 2.5, 'prob_clip': 0.029692359926741997, 'n_components': 60, 'logistic_c': 0.0001160319827574739, 'pca_fit': 'combined', 'solver': 'lbfgs', 'max_iter': 2000, 'fit_intercept': True, 'standardize_with_source': True, 'rho': 1.0}
[I 2026-06-01 15:13:04,687] Trial 184 finished with value: 0.24088114318443754 and parameters: {'alpha': 293995.6438031668, 'n_pcs': 3500, 'iw_method': 'pc_logistic', 'iw_clip_max': 2.5, 'iw_prob_clip': 0.029692359926741997, 'iw_n_components': 60, 'iw_logistic_c': 0.0001160319827574739, 'iw_pca_fit': 'combined', 'iw_solver': 'lbfgs', 'iw_rho': 1.0}. Best is trial 181 with value: 0.24391094524689755.
2026-06-01 15:13:04 | INFO | Trial 185 | outer=2 | alpha=2.541e+05 n_pcs=3500 (pc_topk) weight={'name': 'pc_logistic', 'floor': 1e-06, 'clip_max': 2.5, 'prob_clip': 0.013923822223079366, 'n_components': 60, 'logistic_c': 7.592289472809745e-05, 'pca_fit': 'combined', 'solver': 'lbfgs', 'max_iter': 2000, 'fit_intercept': True, 'standardize_with_source': True, 'rho': 1.0}
[I 2026-06-01 15:13:17,944] Trial 185 finished with value: 0.24451401174785756 and parameters: {'alpha': 254097.47584710357, 'n_pcs': 3500, 'iw_method': 'pc_logistic', 'iw_clip_max': 2.5, 'iw_prob_clip': 0.013923822223079366, 'iw_n_components': 60, 'iw_logistic_c': 7.592289472809745e-05, 'iw_pca_fit': 'combined', 'iw_solver': 'lbfgs', 'iw_rho': 1.0}. Best is trial 185 with value: 0.24451401174785756.
2026-06-01 15:13:17 | INFO | Trial 186 | outer=2 | alpha=2.589e+05 n_pcs=3500 (pc_topk) weight={'name': 'pc_logistic', 'floor': 1e-06, 'clip_max': 2.5, 'prob_clip': 0.014141666661140096, 'n_components': 60, 'logistic_c': 8.094638562310643e-05, 'pca_fit': 'combined', 'solver': 'lbfgs', 'max_iter': 2000, 'fit_intercept': True, 'standardize_with_source': True, 'rho': 1.0}
[I 2026-06-01 15:13:31,552] Trial 186 finished with value: 0.2443269840081484 and parameters: {'alpha': 258942.82986145784, 'n_pcs': 3500, 'iw_method': 'pc_logistic', 'iw_clip_max': 2.5, 'iw_prob_clip': 0.014141666661140096, 'iw_n_components': 60, 'iw_logistic_c': 8.094638562310643e-05, 'iw_pca_fit': 'combined', 'iw_solver': 'lbfgs', 'iw_rho': 1.0}. Best is trial 185 with value: 0.24451401174785756.
2026-06-01 15:13:31 | INFO | Trial 187 | outer=2 | alpha=2.671e+05 n_pcs=3500 (pc_topk) weight={'name': 'pc_logistic', 'floor': 1e-06, 'clip_max': 7.0, 'prob_clip': 0.013733017798146934, 'n_components': 60, 'logistic_c': 8.951190174898701e-05, 'pca_fit': 'combined', 'solver': 'lbfgs', 'max_iter': 2000, 'fit_intercept': True, 'standardize_with_source': True, 'rho': 1.0}
[I 2026-06-01 15:13:43,788] Trial 187 finished with value: 0.23612740551172512 and parameters: {'alpha': 267077.78997694835, 'n_pcs': 3500, 'iw_method': 'pc_logistic', 'iw_clip_max': 7.0, 'iw_prob_clip': 0.013733017798146934, 'iw_n_components': 60, 'iw_logistic_c': 8.951190174898701e-05, 'iw_pca_fit': 'combined', 'iw_solver': 'lbfgs', 'iw_rho': 1.0}. Best is trial 185 with value: 0.24451401174785756.
2026-06-01 15:13:43 | INFO | Trial 188 | outer=2 | alpha=3.304e+05 n_pcs=3500 (pc_topk) weight={'name': 'uniform'}
[I 2026-06-01 15:13:52,614] Trial 188 finished with value: 0.2244496604479993 and parameters: {'alpha': 330363.5771022802, 'n_pcs': 3500, 'iw_method': 'uniform'}. Best is trial 185 with value: 0.24451401174785756.
2026-06-01 15:13:52 | INFO | Trial 189 | outer=2 | alpha=2.520e+05 n_pcs=3500 (pc_topk) weight={'name': 'pc_logistic', 'floor': 1e-06, 'clip_max': 2.5, 'prob_clip': 0.011830840682928268, 'n_components': 60, 'logistic_c': 0.0001453543369132773, 'pca_fit': 'combined', 'solver': 'lbfgs', 'max_iter': 2000, 'fit_intercept': True, 'standardize_with_source': True, 'rho': 1.0}
[I 2026-06-01 15:14:04,800] Trial 189 finished with value: 0.2427418259554559 and parameters: {'alpha': 251972.57696338487, 'n_pcs': 3500, 'iw_method': 'pc_logistic', 'iw_clip_max': 2.5, 'iw_prob_clip': 0.011830840682928268, 'iw_n_components': 60, 'iw_logistic_c': 0.0001453543369132773, 'iw_pca_fit': 'combined', 'iw_solver': 'lbfgs', 'iw_rho': 1.0}. Best is trial 185 with value: 0.24451401174785756.
2026-06-01 15:14:04 | INFO | Trial 190 | outer=2 | alpha=3.812e+05 n_pcs=3500 (pc_topk) weight={'name': 'pc_logistic', 'floor': 1e-06, 'clip_max': 2.5, 'prob_clip': 0.013910114812015708, 'n_components': 60, 'logistic_c': 0.00020745009473033482, 'pca_fit': 'combined', 'solver': 'lbfgs', 'max_iter': 2000, 'fit_intercept': True, 'standardize_with_source': True, 'rho': 1.0}
[I 2026-06-01 15:14:17,669] Trial 190 finished with value: 0.24087430372862836 and parameters: {'alpha': 381171.2924484222, 'n_pcs': 3500, 'iw_method': 'pc_logistic', 'iw_clip_max': 2.5, 'iw_prob_clip': 0.013910114812015708, 'iw_n_components': 60, 'iw_logistic_c': 0.00020745009473033482, 'iw_pca_fit': 'combined', 'iw_solver': 'lbfgs', 'iw_rho': 1.0}. Best is trial 185 with value: 0.24451401174785756.
2026-06-01 15:14:17 | INFO | Trial 191 | outer=2 | alpha=2.364e+05 n_pcs=3500 (pc_topk) weight={'name': 'pc_logistic', 'floor': 1e-06, 'clip_max': 2.5, 'prob_clip': 0.011202739726226062, 'n_components': 60, 'logistic_c': 6.377190758941692e-05, 'pca_fit': 'combined', 'solver': 'lbfgs', 'max_iter': 2000, 'fit_intercept': True, 'standardize_with_source': True, 'rho': 1.0}
[I 2026-06-01 15:14:30,096] Trial 191 finished with value: 0.2449762364140197 and parameters: {'alpha': 236441.14306988908, 'n_pcs': 3500, 'iw_method': 'pc_logistic', 'iw_clip_max': 2.5, 'iw_prob_clip': 0.011202739726226062, 'iw_n_components': 60, 'iw_logistic_c': 6.377190758941692e-05, 'iw_pca_fit': 'combined', 'iw_solver': 'lbfgs', 'iw_rho': 1.0}. Best is trial 191 with value: 0.2449762364140197.
2026-06-01 15:14:30 | INFO | Trial 192 | outer=2 | alpha=2.313e+05 n_pcs=3500 (pc_topk) weight={'name': 'pc_logistic', 'floor': 1e-06, 'clip_max': 2.5, 'prob_clip': 0.011711224479774969, 'n_components': 60, 'logistic_c': 8.061132066121681e-05, 'pca_fit': 'combined', 'solver': 'lbfgs', 'max_iter': 2000, 'fit_intercept': True, 'standardize_with_source': True, 'rho': 1.0}
[I 2026-06-01 15:14:42,413] Trial 192 finished with value: 0.24455896217614742 and parameters: {'alpha': 231314.3087194231, 'n_pcs': 3500, 'iw_method': 'pc_logistic', 'iw_clip_max': 2.5, 'iw_prob_clip': 0.011711224479774969, 'iw_n_components': 60, 'iw_logistic_c': 8.061132066121681e-05, 'iw_pca_fit': 'combined', 'iw_solver': 'lbfgs', 'iw_rho': 1.0}. Best is trial 191 with value: 0.2449762364140197.
2026-06-01 15:14:42 | INFO | Trial 193 | outer=2 | alpha=6.621e+05 n_pcs=3500 (pc_topk) weight={'name': 'pc_logistic', 'floor': 1e-06, 'clip_max': 2.5, 'prob_clip': 0.012397171177282248, 'n_components': 60, 'logistic_c': 7.403239842203787e-05, 'pca_fit': 'combined', 'solver': 'lbfgs', 'max_iter': 2000, 'fit_intercept': True, 'standardize_with_source': True, 'rho': 1.0}
[I 2026-06-01 15:14:54,451] Trial 193 finished with value: 0.24113800178167422 and parameters: {'alpha': 662070.9084673021, 'n_pcs': 3500, 'iw_method': 'pc_logistic', 'iw_clip_max': 2.5, 'iw_prob_clip': 0.012397171177282248, 'iw_n_components': 60, 'iw_logistic_c': 7.403239842203787e-05, 'iw_pca_fit': 'combined', 'iw_solver': 'lbfgs', 'iw_rho': 1.0}. Best is trial 191 with value: 0.2449762364140197.
2026-06-01 15:14:54 | INFO | Trial 194 | outer=2 | alpha=2.947e+05 n_pcs=3500 (pc_topk) weight={'name': 'pc_logistic', 'floor': 1e-06, 'clip_max': 2.5, 'prob_clip': 0.017793629324324618, 'n_components': 60, 'logistic_c': 0.00011414973071849841, 'pca_fit': 'combined', 'solver': 'lbfgs', 'max_iter': 2000, 'fit_intercept': True, 'standardize_with_source': True, 'rho': 1.0}
[I 2026-06-01 15:15:06,893] Trial 194 finished with value: 0.24273942692009412 and parameters: {'alpha': 294702.6742230859, 'n_pcs': 3500, 'iw_method': 'pc_logistic', 'iw_clip_max': 2.5, 'iw_prob_clip': 0.017793629324324618, 'iw_n_components': 60, 'iw_logistic_c': 0.00011414973071849841, 'iw_pca_fit': 'combined', 'iw_solver': 'lbfgs', 'iw_rho': 1.0}. Best is trial 191 with value: 0.2449762364140197.
2026-06-01 15:15:06 | INFO | Trial 195 | outer=2 | alpha=2.441e+05 n_pcs=3500 (pc_topk) weight={'name': 'pc_logistic', 'floor': 1e-06, 'clip_max': 2.5, 'prob_clip': 0.015341409181579665, 'n_components': 60, 'logistic_c': 7.721527989985295e-05, 'pca_fit': 'combined', 'solver': 'lbfgs', 'max_iter': 2000, 'fit_intercept': True, 'standardize_with_source': True, 'rho': 1.0}
[I 2026-06-01 15:15:24,590] Trial 195 finished with value: 0.2443595674325037 and parameters: {'alpha': 244117.74192973733, 'n_pcs': 3500, 'iw_method': 'pc_logistic', 'iw_clip_max': 2.5, 'iw_prob_clip': 0.015341409181579665, 'iw_n_components': 60, 'iw_logistic_c': 7.721527989985295e-05, 'iw_pca_fit': 'combined', 'iw_solver': 'lbfgs', 'iw_rho': 1.0}. Best is trial 191 with value: 0.2449762364140197.
2026-06-01 15:15:24 | INFO | Trial 196 | outer=2 | alpha=2.318e+05 n_pcs=3500 (pc_topk) weight={'name': 'pc_logistic', 'floor': 1e-06, 'clip_max': 2.5, 'prob_clip': 0.015306201585296577, 'n_components': 60, 'logistic_c': 7.029170467063294e-05, 'pca_fit': 'combined', 'solver': 'lbfgs', 'max_iter': 2000, 'fit_intercept': True, 'standardize_with_source': True, 'rho': 1.0}
[I 2026-06-01 15:15:37,032] Trial 196 finished with value: 0.24464221958460092 and parameters: {'alpha': 231807.81897922917, 'n_pcs': 3500, 'iw_method': 'pc_logistic', 'iw_clip_max': 2.5, 'iw_prob_clip': 0.015306201585296577, 'iw_n_components': 60, 'iw_logistic_c': 7.029170467063294e-05, 'iw_pca_fit': 'combined', 'iw_solver': 'lbfgs', 'iw_rho': 1.0}. Best is trial 191 with value: 0.2449762364140197.
2026-06-01 15:15:37 | INFO | Trial 197 | outer=2 | alpha=2.347e+05 n_pcs=3500 (pc_topk) weight={'name': 'pc_logistic', 'floor': 1e-06, 'clip_max': 2.5, 'prob_clip': 0.01575152585710358, 'n_components': 60, 'logistic_c': 8.725648114417145e-05, 'pca_fit': 'combined', 'solver': 'lbfgs', 'max_iter': 2000, 'fit_intercept': True, 'standardize_with_source': True, 'rho': 1.0}
[I 2026-06-01 15:15:48,463] Trial 197 finished with value: 0.2441094684707826 and parameters: {'alpha': 234732.07219988536, 'n_pcs': 3500, 'iw_method': 'pc_logistic', 'iw_clip_max': 2.5, 'iw_prob_clip': 0.01575152585710358, 'iw_n_components': 60, 'iw_logistic_c': 8.725648114417145e-05, 'iw_pca_fit': 'combined', 'iw_solver': 'lbfgs', 'iw_rho': 1.0}. Best is trial 191 with value: 0.2449762364140197.
2026-06-01 15:15:48 | INFO | Trial 198 | outer=2 | alpha=2.496e+05 n_pcs=3500 (pc_topk) weight={'name': 'pc_logistic', 'floor': 1e-06, 'clip_max': 2.5, 'prob_clip': 0.01562556047824773, 'n_components': 60, 'logistic_c': 0.00012250668629417143, 'pca_fit': 'combined', 'solver': 'lbfgs', 'max_iter': 2000, 'fit_intercept': True, 'standardize_with_source': True, 'rho': 1.0}
[I 2026-06-01 15:16:01,034] Trial 198 finished with value: 0.24307578294217436 and parameters: {'alpha': 249573.25545438327, 'n_pcs': 3500, 'iw_method': 'pc_logistic', 'iw_clip_max': 2.5, 'iw_prob_clip': 0.01562556047824773, 'iw_n_components': 60, 'iw_logistic_c': 0.00012250668629417143, 'iw_pca_fit': 'combined', 'iw_solver': 'lbfgs', 'iw_rho': 1.0}. Best is trial 191 with value: 0.2449762364140197.
2026-06-01 15:16:01 | INFO | Trial 199 | outer=2 | alpha=4.152e+05 n_pcs=3500 (pc_topk) weight={'name': 'pc_logistic', 'floor': 1e-06, 'clip_max': 2.5, 'prob_clip': 0.02040603888348782, 'n_components': 60, 'logistic_c': 0.00018656716670208563, 'pca_fit': 'combined', 'solver': 'lbfgs', 'max_iter': 2000, 'fit_intercept': True, 'standardize_with_source': True, 'rho': 1.0}
[I 2026-06-01 15:16:14,357] Trial 199 finished with value: 0.24000735463170209 and parameters: {'alpha': 415238.92344653426, 'n_pcs': 3500, 'iw_method': 'pc_logistic', 'iw_clip_max': 2.5, 'iw_prob_clip': 0.02040603888348782, 'iw_n_components': 60, 'iw_logistic_c': 0.00018656716670208563, 'iw_pca_fit': 'combined', 'iw_solver': 'lbfgs', 'iw_rho': 1.0}. Best is trial 191 with value: 0.2449762364140197.
2026-06-01 15:16:14 | INFO | Trial 200 | outer=2 | alpha=3.253e+05 n_pcs=3500 (pc_topk) weight={'name': 'pc_logistic', 'floor': 1e-06, 'clip_max': 2.5, 'prob_clip': 0.016560965827496544, 'n_components': 60, 'logistic_c': 9.526474499566752e-05, 'pca_fit': 'combined', 'solver': 'lbfgs', 'max_iter': 2000, 'fit_intercept': True, 'standardize_with_source': True, 'rho': 1.0}
