[I 2026-06-01 01:49:32,372] Trial 173 finished with value: 0.22279391455601355 and parameters: {'alpha': 123803.35487618406, 'n_pcs': 4000, 'weight_scheme': 'exponential', 'weight_clip_max': 5.0, 'weight_exponential_beta': 5.626910011729893}. Best is trial 67 with value: 0.22356194409955688.
2026-06-01 01:49:32 | INFO | src.nested_cv_avggrm_weighted_unified | Trial 174 | outer=8 | alpha=1.956e+05 n_pcs=4000 (pc_topk) weight_search=on
2026-06-01 01:49:32 | INFO | src.nested_cv_avggrm_weighted_unified | Trial 174 | outer=8 | weight={'name': 'exponential', 'floor': 1e-06, 'clip_max': 5.0, 'beta': 5.887370262321831}
[I 2026-06-01 01:49:38,368] Trial 174 finished with value: 0.22306418099816389 and parameters: {'alpha': 195597.05715482822, 'n_pcs': 4000, 'weight_scheme': 'exponential', 'weight_clip_max': 5.0, 'weight_exponential_beta': 5.887370262321831}. Best is trial 67 with value: 0.22356194409955688.
2026-06-01 01:49:38 | INFO | src.nested_cv_avggrm_weighted_unified | Trial 175 | outer=8 | alpha=2.438e+05 n_pcs=4000 (pc_topk) weight_search=on
2026-06-01 01:49:38 | INFO | src.nested_cv_avggrm_weighted_unified | Trial 175 | outer=8 | weight={'name': 'exponential', 'floor': 1e-06, 'clip_max': 5.0, 'beta': 4.858246226837377}
[I 2026-06-01 01:49:44,152] Trial 175 finished with value: 0.22238892863969045 and parameters: {'alpha': 243829.44445250722, 'n_pcs': 4000, 'weight_scheme': 'exponential', 'weight_clip_max': 5.0, 'weight_exponential_beta': 4.858246226837377}. Best is trial 67 with value: 0.22356194409955688.
2026-06-01 01:49:44 | INFO | src.nested_cv_avggrm_weighted_unified | Trial 176 | outer=8 | alpha=1.963e+05 n_pcs=2500 (pc_topk) weight_search=on
2026-06-01 01:49:44 | INFO | src.nested_cv_avggrm_weighted_unified | Trial 176 | outer=8 | weight={'name': 'uniform', 'floor': 1e-06, 'clip_max': 5.0}
2026-06-01 01:49:45 | INFO | src.nested_cv_avggrm_weighted_unified | Trial 176 | outer=8 | pruned after 5/10 inner folds (mean r=0.2172)
[I 2026-06-01 01:49:45,338] Trial 176 pruned. 
2026-06-01 01:49:45 | INFO | src.nested_cv_avggrm_weighted_unified | Trial 177 | outer=8 | alpha=1.008e+05 n_pcs=3500 (pc_topk) weight_search=on
2026-06-01 01:49:45 | INFO | src.nested_cv_avggrm_weighted_unified | Trial 177 | outer=8 | weight={'name': 'exponential', 'floor': 1e-06, 'clip_max': 5.0, 'beta': 5.5172692444396745}
[I 2026-06-01 01:49:50,379] Trial 177 finished with value: 0.22058072247216937 and parameters: {'alpha': 100831.33845502388, 'n_pcs': 3500, 'weight_scheme': 'exponential', 'weight_clip_max': 5.0, 'weight_exponential_beta': 5.5172692444396745}. Best is trial 67 with value: 0.22356194409955688.
2026-06-01 01:49:50 | INFO | src.nested_cv_avggrm_weighted_unified | Trial 178 | outer=8 | alpha=3.198e+05 n_pcs=4000 (pc_topk) weight_search=on
2026-06-01 01:49:50 | INFO | src.nested_cv_avggrm_weighted_unified | Trial 178 | outer=8 | weight={'name': 'linear', 'floor': 1e-06, 'clip_max': 5.0, 'min_weight': 0.9890489002827806, 'max_weight': 2.9545690946040124}
2026-06-01 01:49:54 | INFO | src.nested_cv_avggrm_weighted_unified | Trial 178 | outer=8 | pruned after 7/10 inner folds (mean r=0.2345)
[I 2026-06-01 01:49:54,446] Trial 178 pruned. 
2026-06-01 01:49:54 | INFO | src.nested_cv_avggrm_weighted_unified | Trial 179 | outer=8 | alpha=1.908e+05 n_pcs=4000 (pc_topk) weight_search=on
2026-06-01 01:49:54 | INFO | src.nested_cv_avggrm_weighted_unified | Trial 179 | outer=8 | weight={'name': 'exponential', 'floor': 1e-06, 'clip_max': 5.0, 'beta': 5.757427987756603}
[I 2026-06-01 01:50:00,124] Trial 179 finished with value: 0.22304808538734422 and parameters: {'alpha': 190806.93212194846, 'n_pcs': 4000, 'weight_scheme': 'exponential', 'weight_clip_max': 5.0, 'weight_exponential_beta': 5.757427987756603}. Best is trial 67 with value: 0.22356194409955688.
2026-06-01 01:50:00 | INFO | src.nested_cv_avggrm_weighted_unified | Trial 180 | outer=8 | alpha=2.314e+05 n_pcs=4000 (pc_topk) weight_search=on
2026-06-01 01:50:00 | INFO | src.nested_cv_avggrm_weighted_unified | Trial 180 | outer=8 | weight={'name': 'exponential', 'floor': 1e-06, 'clip_max': 5.0, 'beta': 5.806235371337228}
[I 2026-06-01 01:50:05,810] Trial 180 finished with value: 0.22293096305108362 and parameters: {'alpha': 231427.61345721863, 'n_pcs': 4000, 'weight_scheme': 'exponential', 'weight_clip_max': 5.0, 'weight_exponential_beta': 5.806235371337228}. Best is trial 67 with value: 0.22356194409955688.
2026-06-01 01:50:05 | INFO | src.nested_cv_avggrm_weighted_unified | Trial 181 | outer=8 | alpha=1.792e+05 n_pcs=4000 (pc_topk) weight_search=on
2026-06-01 01:50:05 | INFO | src.nested_cv_avggrm_weighted_unified | Trial 181 | outer=8 | weight={'name': 'exponential', 'floor': 1e-06, 'clip_max': 5.0, 'beta': 5.675424146863168}
[I 2026-06-01 01:50:11,616] Trial 181 finished with value: 0.2230568389708561 and parameters: {'alpha': 179166.1406462152, 'n_pcs': 4000, 'weight_scheme': 'exponential', 'weight_clip_max': 5.0, 'weight_exponential_beta': 5.675424146863168}. Best is trial 67 with value: 0.22356194409955688.
2026-06-01 01:50:11 | INFO | src.nested_cv_avggrm_weighted_unified | Trial 182 | outer=8 | alpha=1.871e+05 n_pcs=4000 (pc_topk) weight_search=on
2026-06-01 01:50:11 | INFO | src.nested_cv_avggrm_weighted_unified | Trial 182 | outer=8 | weight={'name': 'exponential', 'floor': 1e-06, 'clip_max': 5.0, 'beta': 5.359295258649791}
[I 2026-06-01 01:50:17,774] Trial 182 finished with value: 0.22306802580293694 and parameters: {'alpha': 187058.91311676722, 'n_pcs': 4000, 'weight_scheme': 'exponential', 'weight_clip_max': 5.0, 'weight_exponential_beta': 5.359295258649791}. Best is trial 67 with value: 0.22356194409955688.
2026-06-01 01:50:17 | INFO | src.nested_cv_avggrm_weighted_unified | Trial 183 | outer=8 | alpha=1.928e+05 n_pcs=4000 (pc_topk) weight_search=on
2026-06-01 01:50:17 | INFO | src.nested_cv_avggrm_weighted_unified | Trial 183 | outer=8 | weight={'name': 'exponential', 'floor': 1e-06, 'clip_max': 5.0, 'beta': 5.326942759831272}
[I 2026-06-01 01:50:23,461] Trial 183 finished with value: 0.2230430958542878 and parameters: {'alpha': 192754.27936343753, 'n_pcs': 4000, 'weight_scheme': 'exponential', 'weight_clip_max': 5.0, 'weight_exponential_beta': 5.326942759831272}. Best is trial 67 with value: 0.22356194409955688.
2026-06-01 01:50:23 | INFO | src.nested_cv_avggrm_weighted_unified | Trial 184 | outer=8 | alpha=1.966e+05 n_pcs=4000 (pc_topk) weight_search=on
2026-06-01 01:50:23 | INFO | src.nested_cv_avggrm_weighted_unified | Trial 184 | outer=8 | weight={'name': 'exponential', 'floor': 1e-06, 'clip_max': 5.0, 'beta': 5.152133442185104}
[I 2026-06-01 01:50:29,204] Trial 184 finished with value: 0.22298674327155302 and parameters: {'alpha': 196643.3607987322, 'n_pcs': 4000, 'weight_scheme': 'exponential', 'weight_clip_max': 5.0, 'weight_exponential_beta': 5.152133442185104}. Best is trial 67 with value: 0.22356194409955688.
2026-06-01 01:50:29 | INFO | src.nested_cv_avggrm_weighted_unified | Trial 185 | outer=8 | alpha=1.297e+05 n_pcs=4000 (pc_topk) weight_search=on
2026-06-01 01:50:29 | INFO | src.nested_cv_avggrm_weighted_unified | Trial 185 | outer=8 | weight={'name': 'exponential', 'floor': 1e-06, 'clip_max': 5.0, 'beta': 5.295485550375591}
[I 2026-06-01 01:50:34,936] Trial 185 finished with value: 0.22302436665266515 and parameters: {'alpha': 129694.83026747886, 'n_pcs': 4000, 'weight_scheme': 'exponential', 'weight_clip_max': 5.0, 'weight_exponential_beta': 5.295485550375591}. Best is trial 67 with value: 0.22356194409955688.
2026-06-01 01:50:34 | INFO | src.nested_cv_avggrm_weighted_unified | Trial 186 | outer=8 | alpha=1.940e+05 n_pcs=4000 (pc_topk) weight_search=on
2026-06-01 01:50:34 | INFO | src.nested_cv_avggrm_weighted_unified | Trial 186 | outer=8 | weight={'name': 'exponential', 'floor': 1e-06, 'clip_max': 5.0, 'beta': 5.3971991883516655}
[I 2026-06-01 01:50:40,691] Trial 186 finished with value: 0.2230450699466807 and parameters: {'alpha': 193976.41507961584, 'n_pcs': 4000, 'weight_scheme': 'exponential', 'weight_clip_max': 5.0, 'weight_exponential_beta': 5.3971991883516655}. Best is trial 67 with value: 0.22356194409955688.
2026-06-01 01:50:40 | INFO | src.nested_cv_avggrm_weighted_unified | Trial 187 | outer=8 | alpha=2.680e+05 n_pcs=4000 (pc_topk) weight_search=on
2026-06-01 01:50:40 | INFO | src.nested_cv_avggrm_weighted_unified | Trial 187 | outer=8 | weight={'name': 'exponential', 'floor': 1e-06, 'clip_max': 5.0, 'beta': 5.434848388513739}
[I 2026-06-01 01:50:46,452] Trial 187 finished with value: 0.22259704128482513 and parameters: {'alpha': 268045.8399275401, 'n_pcs': 4000, 'weight_scheme': 'exponential', 'weight_clip_max': 5.0, 'weight_exponential_beta': 5.434848388513739}. Best is trial 67 with value: 0.22356194409955688.
2026-06-01 01:50:46 | INFO | src.nested_cv_avggrm_weighted_unified | Trial 188 | outer=8 | alpha=1.982e+05 n_pcs=4000 (pc_topk) weight_search=on
2026-06-01 01:50:46 | INFO | src.nested_cv_avggrm_weighted_unified | Trial 188 | outer=8 | weight={'name': 'exponential', 'floor': 1e-06, 'clip_max': None, 'beta': 5.66891148228371}
[I 2026-06-01 01:50:52,130] Trial 188 finished with value: 0.20718593252134254 and parameters: {'alpha': 198220.5518356955, 'n_pcs': 4000, 'weight_scheme': 'exponential', 'weight_clip_max': None, 'weight_exponential_beta': 5.66891148228371}. Best is trial 67 with value: 0.22356194409955688.
2026-06-01 01:50:52 | INFO | src.nested_cv_avggrm_weighted_unified | Trial 189 | outer=8 | alpha=3.742e+05 n_pcs=4000 (pc_topk) weight_search=on
2026-06-01 01:50:52 | INFO | src.nested_cv_avggrm_weighted_unified | Trial 189 | outer=8 | weight={'name': 'exponential', 'floor': 1e-06, 'clip_max': 5.0, 'beta': 5.0334106566113075}
[I 2026-06-01 01:50:57,789] Trial 189 finished with value: 0.22135576985919644 and parameters: {'alpha': 374156.85569575796, 'n_pcs': 4000, 'weight_scheme': 'exponential', 'weight_clip_max': 5.0, 'weight_exponential_beta': 5.0334106566113075}. Best is trial 67 with value: 0.22356194409955688.
2026-06-01 01:50:57 | INFO | src.nested_cv_avggrm_weighted_unified | Trial 190 | outer=8 | alpha=1.368e+05 n_pcs=4500 (pc_topk) weight_search=on
2026-06-01 01:50:57 | INFO | src.nested_cv_avggrm_weighted_unified | Trial 190 | outer=8 | weight={'name': 'exponential', 'floor': 1e-06, 'clip_max': 5.0, 'beta': 5.372307361474722}
[I 2026-06-01 01:51:04,734] Trial 190 finished with value: 0.22264518925369764 and parameters: {'alpha': 136800.89153109796, 'n_pcs': 4500, 'weight_scheme': 'exponential', 'weight_clip_max': 5.0, 'weight_exponential_beta': 5.372307361474722}. Best is trial 67 with value: 0.22356194409955688.
2026-06-01 01:51:04 | INFO | src.nested_cv_avggrm_weighted_unified | Trial 191 | outer=8 | alpha=1.628e+05 n_pcs=4000 (pc_topk) weight_search=on
2026-06-01 01:51:04 | INFO | src.nested_cv_avggrm_weighted_unified | Trial 191 | outer=8 | weight={'name': 'exponential', 'floor': 1e-06, 'clip_max': 5.0, 'beta': 5.591426957251755}
[I 2026-06-01 01:51:10,426] Trial 191 finished with value: 0.22305636568696344 and parameters: {'alpha': 162780.49949163228, 'n_pcs': 4000, 'weight_scheme': 'exponential', 'weight_clip_max': 5.0, 'weight_exponential_beta': 5.591426957251755}. Best is trial 67 with value: 0.22356194409955688.
2026-06-01 01:51:10 | INFO | src.nested_cv_avggrm_weighted_unified | Trial 192 | outer=8 | alpha=1.829e+05 n_pcs=4000 (pc_topk) weight_search=on
2026-06-01 01:51:10 | INFO | src.nested_cv_avggrm_weighted_unified | Trial 192 | outer=8 | weight={'name': 'exponential', 'floor': 1e-06, 'clip_max': 5.0, 'beta': 5.531848334976255}
[I 2026-06-01 01:51:16,468] Trial 192 finished with value: 0.22306773746526867 and parameters: {'alpha': 182939.90815248288, 'n_pcs': 4000, 'weight_scheme': 'exponential', 'weight_clip_max': 5.0, 'weight_exponential_beta': 5.531848334976255}. Best is trial 67 with value: 0.22356194409955688.
2026-06-01 01:51:16 | INFO | src.nested_cv_avggrm_weighted_unified | Trial 193 | outer=8 | alpha=1.986e+05 n_pcs=4000 (pc_topk) weight_search=on
2026-06-01 01:51:16 | INFO | src.nested_cv_avggrm_weighted_unified | Trial 193 | outer=8 | weight={'name': 'exponential', 'floor': 1e-06, 'clip_max': 5.0, 'beta': 5.551211862067353}
[I 2026-06-01 01:51:22,172] Trial 193 finished with value: 0.22302440368938856 and parameters: {'alpha': 198572.73473934724, 'n_pcs': 4000, 'weight_scheme': 'exponential', 'weight_clip_max': 5.0, 'weight_exponential_beta': 5.551211862067353}. Best is trial 67 with value: 0.22356194409955688.
2026-06-01 01:51:22 | INFO | src.nested_cv_avggrm_weighted_unified | Trial 194 | outer=8 | alpha=2.357e+05 n_pcs=4000 (pc_topk) weight_search=on
2026-06-01 01:51:22 | INFO | src.nested_cv_avggrm_weighted_unified | Trial 194 | outer=8 | weight={'name': 'exponential', 'floor': 1e-06, 'clip_max': 5.0, 'beta': 4.784227980199319}
[I 2026-06-01 01:51:27,991] Trial 194 finished with value: 0.2223772479492331 and parameters: {'alpha': 235684.1254810296, 'n_pcs': 4000, 'weight_scheme': 'exponential', 'weight_clip_max': 5.0, 'weight_exponential_beta': 4.784227980199319}. Best is trial 67 with value: 0.22356194409955688.
2026-06-01 01:51:27 | INFO | src.nested_cv_avggrm_weighted_unified | Trial 195 | outer=8 | alpha=2.025e+05 n_pcs=4000 (pc_topk) weight_search=on
2026-06-01 01:51:28 | INFO | src.nested_cv_avggrm_weighted_unified | Trial 195 | outer=8 | weight={'name': 'exponential', 'floor': 1e-06, 'clip_max': 5.0, 'beta': 5.536197605034042}
[I 2026-06-01 01:51:33,719] Trial 195 finished with value: 0.22301127687816402 and parameters: {'alpha': 202513.72730890886, 'n_pcs': 4000, 'weight_scheme': 'exponential', 'weight_clip_max': 5.0, 'weight_exponential_beta': 5.536197605034042}. Best is trial 67 with value: 0.22356194409955688.
2026-06-01 01:51:33 | INFO | src.nested_cv_avggrm_weighted_unified | Trial 196 | outer=8 | alpha=3.036e+05 n_pcs=3500 (pc_topk) weight_search=on
2026-06-01 01:51:33 | INFO | src.nested_cv_avggrm_weighted_unified | Trial 196 | outer=8 | weight={'name': 'exponential', 'floor': 1e-06, 'clip_max': 5.0, 'beta': 5.270221991773055}
[I 2026-06-01 01:51:38,556] Trial 196 finished with value: 0.22159996546055946 and parameters: {'alpha': 303632.6345977764, 'n_pcs': 3500, 'weight_scheme': 'exponential', 'weight_clip_max': 5.0, 'weight_exponential_beta': 5.270221991773055}. Best is trial 67 with value: 0.22356194409955688.
2026-06-01 01:51:38 | INFO | src.nested_cv_avggrm_weighted_unified | Trial 197 | outer=8 | alpha=1.965e+05 n_pcs=4000 (pc_topk) weight_search=on
2026-06-01 01:51:38 | INFO | src.nested_cv_avggrm_weighted_unified | Trial 197 | outer=8 | weight={'name': 'exponential', 'floor': 1e-06, 'clip_max': 5.0, 'beta': 4.897080830525258}
[I 2026-06-01 01:51:44,494] Trial 197 finished with value: 0.22281762082807477 and parameters: {'alpha': 196498.53322591897, 'n_pcs': 4000, 'weight_scheme': 'exponential', 'weight_clip_max': 5.0, 'weight_exponential_beta': 4.897080830525258}. Best is trial 67 with value: 0.22356194409955688.
2026-06-01 01:51:44 | INFO | src.nested_cv_avggrm_weighted_unified | Trial 198 | outer=8 | alpha=2.643e+05 n_pcs=4000 (pc_topk) weight_search=on
2026-06-01 01:51:44 | INFO | src.nested_cv_avggrm_weighted_unified | Trial 198 | outer=8 | weight={'name': 'exponential', 'floor': 1e-06, 'clip_max': 10.0, 'beta': 5.601966860400392}
[I 2026-06-01 01:51:50,517] Trial 198 finished with value: 0.21738270136688093 and parameters: {'alpha': 264302.0297725527, 'n_pcs': 4000, 'weight_scheme': 'exponential', 'weight_clip_max': 10.0, 'weight_exponential_beta': 5.601966860400392}. Best is trial 67 with value: 0.22356194409955688.
2026-06-01 01:51:50 | INFO | src.nested_cv_avggrm_weighted_unified | Trial 199 | outer=8 | alpha=1.254e+05 n_pcs=4000 (pc_topk) weight_search=on
2026-06-01 01:51:50 | INFO | src.nested_cv_avggrm_weighted_unified | Trial 199 | outer=8 | weight={'name': 'exponential', 'floor': 1e-06, 'clip_max': 5.0, 'beta': 5.153436586507935}
[I 2026-06-01 01:51:56,560] Trial 199 finished with value: 0.22301836244831286 and parameters: {'alpha': 125359.45929249458, 'n_pcs': 4000, 'weight_scheme': 'exponential', 'weight_clip_max': 5.0, 'weight_exponential_beta': 5.153436586507935}. Best is trial 67 with value: 0.22356194409955688.
2026-06-01 01:51:56 | INFO | src.nested_cv_avggrm_weighted_unified | Trial 200 | outer=8 | alpha=2.234e+05 n_pcs=4000 (pc_topk) weight_search=on
2026-06-01 01:51:56 | INFO | src.nested_cv_avggrm_weighted_unified | Trial 200 | outer=8 | weight={'name': 'exponential', 'floor': 1e-06, 'clip_max': 20.0, 'beta': 5.395519727987294}
[I 2026-06-01 01:52:02,367] Trial 200 finished with value: 0.20932790202979135 and parameters: {'alpha': 223409.65133778498, 'n_pcs': 4000, 'weight_scheme': 'exponential', 'weight_clip_max': 20.0, 'weight_exponential_beta': 5.395519727987294}. Best is trial 67 with value: 0.22356194409955688.
2026-06-01 01:52:02 | INFO | src.nested_cv_avggrm_weighted_unified | Trial 201 | outer=8 | alpha=1.735e+05 n_pcs=4000 (pc_topk) weight_search=on
2026-06-01 01:52:02 | INFO | src.nested_cv_avggrm_weighted_unified | Trial 201 | outer=8 | weight={'name': 'exponential', 'floor': 1e-06, 'clip_max': 5.0, 'beta': 5.7415228295653105}
[I 2026-06-01 01:52:08,273] Trial 201 finished with value: 0.22305213430226095 and parameters: {'alpha': 173477.67437841173, 'n_pcs': 4000, 'weight_scheme': 'exponential', 'weight_clip_max': 5.0, 'weight_exponential_beta': 5.7415228295653105}. Best is trial 67 with value: 0.22356194409955688.
2026-06-01 01:52:08 | INFO | src.nested_cv_avggrm_weighted_unified | Trial 202 | outer=8 | alpha=1.746e+05 n_pcs=4000 (pc_topk) weight_search=on
2026-06-01 01:52:08 | INFO | src.nested_cv_avggrm_weighted_unified | Trial 202 | outer=8 | weight={'name': 'exponential', 'floor': 1e-06, 'clip_max': 5.0, 'beta': 5.667054671342178}
[I 2026-06-01 01:52:14,331] Trial 202 finished with value: 0.2230576741365331 and parameters: {'alpha': 174618.44451598858, 'n_pcs': 4000, 'weight_scheme': 'exponential', 'weight_clip_max': 5.0, 'weight_exponential_beta': 5.667054671342178}. Best is trial 67 with value: 0.22356194409955688.
2026-06-01 01:52:14 | INFO | src.nested_cv_avggrm_weighted_unified | Trial 203 | outer=8 | alpha=1.786e+05 n_pcs=4000 (pc_topk) weight_search=on
2026-06-01 01:52:14 | INFO | src.nested_cv_avggrm_weighted_unified | Trial 203 | outer=8 | weight={'name': 'exponential', 'floor': 1e-06, 'clip_max': 5.0, 'beta': 5.718079234792638}
[I 2026-06-01 01:52:20,332] Trial 203 finished with value: 0.22305426847396018 and parameters: {'alpha': 178553.064819394, 'n_pcs': 4000, 'weight_scheme': 'exponential', 'weight_clip_max': 5.0, 'weight_exponential_beta': 5.718079234792638}. Best is trial 67 with value: 0.22356194409955688.
2026-06-01 01:52:20 | INFO | src.nested_cv_avggrm_weighted_unified | Trial 204 | outer=8 | alpha=1.765e+05 n_pcs=4000 (pc_topk) weight_search=on
2026-06-01 01:52:20 | INFO | src.nested_cv_avggrm_weighted_unified | Trial 204 | outer=8 | weight={'name': 'exponential', 'floor': 1e-06, 'clip_max': 5.0, 'beta': 5.681025863590253}
[I 2026-06-01 01:52:26,174] Trial 204 finished with value: 0.2230570276069206 and parameters: {'alpha': 176541.58042157532, 'n_pcs': 4000, 'weight_scheme': 'exponential', 'weight_clip_max': 5.0, 'weight_exponential_beta': 5.681025863590253}. Best is trial 67 with value: 0.22356194409955688.
2026-06-01 01:52:26 | INFO | src.nested_cv_avggrm_weighted_unified | Trial 205 | outer=8 | alpha=1.753e+05 n_pcs=4000 (pc_topk) weight_search=on
2026-06-01 01:52:26 | INFO | src.nested_cv_avggrm_weighted_unified | Trial 205 | outer=8 | weight={'name': 'exponential', 'floor': 1e-06, 'clip_max': 5.0, 'beta': 5.713207775455628}
[I 2026-06-01 01:52:31,930] Trial 205 finished with value: 0.22305358247114665 and parameters: {'alpha': 175286.90842798102, 'n_pcs': 4000, 'weight_scheme': 'exponential', 'weight_clip_max': 5.0, 'weight_exponential_beta': 5.713207775455628}. Best is trial 67 with value: 0.22356194409955688.
2026-06-01 01:52:31 | INFO | src.nested_cv_avggrm_weighted_unified | Trial 206 | outer=8 | alpha=1.482e+05 n_pcs=4000 (pc_topk) weight_search=on
2026-06-01 01:52:31 | INFO | src.nested_cv_avggrm_weighted_unified | Trial 206 | outer=8 | weight={'name': 'exponential', 'floor': 1e-06, 'clip_max': 5.0, 'beta': 5.720682694126749}
[I 2026-06-01 01:52:37,912] Trial 206 finished with value: 0.2229745521279869 and parameters: {'alpha': 148167.90748882163, 'n_pcs': 4000, 'weight_scheme': 'exponential', 'weight_clip_max': 5.0, 'weight_exponential_beta': 5.720682694126749}. Best is trial 67 with value: 0.22356194409955688.
2026-06-01 01:52:37 | INFO | src.nested_cv_avggrm_weighted_unified | Trial 207 | outer=8 | alpha=1.728e+05 n_pcs=4000 (pc_topk) weight_search=on
2026-06-01 01:52:37 | INFO | src.nested_cv_avggrm_weighted_unified | Trial 207 | outer=8 | weight={'name': 'exponential', 'floor': 1e-06, 'clip_max': 5.0, 'beta': 3.1033435419371553}
[I 2026-06-01 01:52:43,606] Trial 207 finished with value: 0.21913166105770263 and parameters: {'alpha': 172808.62052433944, 'n_pcs': 4000, 'weight_scheme': 'exponential', 'weight_clip_max': 5.0, 'weight_exponential_beta': 3.1033435419371553}. Best is trial 67 with value: 0.22356194409955688.
2026-06-01 01:52:43 | INFO | src.nested_cv_avggrm_weighted_unified | Trial 208 | outer=8 | alpha=1.065e+05 n_pcs=4500 (pc_topk) weight_search=on
2026-06-01 01:52:43 | INFO | src.nested_cv_avggrm_weighted_unified | Trial 208 | outer=8 | weight={'name': 'exponential', 'floor': 1e-06, 'clip_max': 5.0, 'beta': 5.657915081578271}
