[I 2026-05-31 23:21:18,138] Trial 152 finished with value: 0.2497204229349786 and parameters: {'alpha': 255937.78797553177, 'n_pcs': 4000, 'weight_scheme': 'exponential', 'weight_clip_max': 3.0, 'weight_exponential_beta': 8.783679349906938}. Best is trial 144 with value: 0.24983212973228822.
2026-05-31 23:21:18 | INFO | src.nested_cv_avggrm_weighted_unified | Trial 153 | outer=2 | alpha=2.643e+05 n_pcs=4000 (pc_topk) weight_search=on
2026-05-31 23:21:18 | INFO | src.nested_cv_avggrm_weighted_unified | Trial 153 | outer=2 | weight={'name': 'exponential', 'floor': 1e-06, 'clip_max': 3.0, 'beta': 8.9656652767526}
[I 2026-05-31 23:21:23,905] Trial 153 finished with value: 0.24971908893313066 and parameters: {'alpha': 264277.93370468746, 'n_pcs': 4000, 'weight_scheme': 'exponential', 'weight_clip_max': 3.0, 'weight_exponential_beta': 8.9656652767526}. Best is trial 144 with value: 0.24983212973228822.
2026-05-31 23:21:23 | INFO | src.nested_cv_avggrm_weighted_unified | Trial 154 | outer=2 | alpha=1.697e+05 n_pcs=4000 (pc_topk) weight_search=on
2026-05-31 23:21:23 | INFO | src.nested_cv_avggrm_weighted_unified | Trial 154 | outer=2 | weight={'name': 'exponential', 'floor': 1e-06, 'clip_max': 3.0, 'beta': 9.010298077778002}
[I 2026-05-31 23:21:29,673] Trial 154 finished with value: 0.24832662195156924 and parameters: {'alpha': 169719.83057656264, 'n_pcs': 4000, 'weight_scheme': 'exponential', 'weight_clip_max': 3.0, 'weight_exponential_beta': 9.010298077778002}. Best is trial 144 with value: 0.24983212973228822.
2026-05-31 23:21:29 | INFO | src.nested_cv_avggrm_weighted_unified | Trial 155 | outer=2 | alpha=2.650e+05 n_pcs=4000 (pc_topk) weight_search=on
2026-05-31 23:21:29 | INFO | src.nested_cv_avggrm_weighted_unified | Trial 155 | outer=2 | weight={'name': 'exponential', 'floor': 1e-06, 'clip_max': 3.0, 'beta': 8.817544228324513}
[I 2026-05-31 23:21:35,442] Trial 155 finished with value: 0.24976865887011673 and parameters: {'alpha': 264982.6661893188, 'n_pcs': 4000, 'weight_scheme': 'exponential', 'weight_clip_max': 3.0, 'weight_exponential_beta': 8.817544228324513}. Best is trial 144 with value: 0.24983212973228822.
2026-05-31 23:21:35 | INFO | src.nested_cv_avggrm_weighted_unified | Trial 156 | outer=2 | alpha=2.717e+05 n_pcs=3500 (pc_topk) weight_search=on
2026-05-31 23:21:35 | INFO | src.nested_cv_avggrm_weighted_unified | Trial 156 | outer=2 | weight={'name': 'exponential', 'floor': 1e-06, 'clip_max': 3.0, 'beta': 9.054499131696023}
[I 2026-05-31 23:21:40,370] Trial 156 finished with value: 0.24867524396864985 and parameters: {'alpha': 271655.1130010798, 'n_pcs': 3500, 'weight_scheme': 'exponential', 'weight_clip_max': 3.0, 'weight_exponential_beta': 9.054499131696023}. Best is trial 144 with value: 0.24983212973228822.
2026-05-31 23:21:40 | INFO | src.nested_cv_avggrm_weighted_unified | Trial 157 | outer=2 | alpha=1.462e+05 n_pcs=4000 (pc_topk) weight_search=on
2026-05-31 23:21:40 | INFO | src.nested_cv_avggrm_weighted_unified | Trial 157 | outer=2 | weight={'name': 'exponential', 'floor': 1e-06, 'clip_max': 3.0, 'beta': 8.908305696202978}
[I 2026-05-31 23:21:46,131] Trial 157 finished with value: 0.24763435489715943 and parameters: {'alpha': 146234.02242059167, 'n_pcs': 4000, 'weight_scheme': 'exponential', 'weight_clip_max': 3.0, 'weight_exponential_beta': 8.908305696202978}. Best is trial 144 with value: 0.24983212973228822.
2026-05-31 23:21:46 | INFO | src.nested_cv_avggrm_weighted_unified | Trial 158 | outer=2 | alpha=4.238e+05 n_pcs=4000 (pc_topk) weight_search=on
2026-05-31 23:21:46 | INFO | src.nested_cv_avggrm_weighted_unified | Trial 158 | outer=2 | weight={'name': 'exponential', 'floor': 1e-06, 'clip_max': 10.0, 'beta': 8.11252362297949}
[I 2026-05-31 23:21:51,874] Trial 158 finished with value: 0.24088639326173897 and parameters: {'alpha': 423770.2849126118, 'n_pcs': 4000, 'weight_scheme': 'exponential', 'weight_clip_max': 10.0, 'weight_exponential_beta': 8.11252362297949}. Best is trial 144 with value: 0.24983212973228822.
2026-05-31 23:21:51 | INFO | src.nested_cv_avggrm_weighted_unified | Trial 159 | outer=2 | alpha=1.893e+05 n_pcs=4000 (pc_topk) weight_search=on
2026-05-31 23:21:51 | INFO | src.nested_cv_avggrm_weighted_unified | Trial 159 | outer=2 | weight={'name': 'exponential', 'floor': 1e-06, 'clip_max': 3.0, 'beta': 8.831434530255793}
[I 2026-05-31 23:21:57,627] Trial 159 finished with value: 0.2489329196064304 and parameters: {'alpha': 189341.19410728812, 'n_pcs': 4000, 'weight_scheme': 'exponential', 'weight_clip_max': 3.0, 'weight_exponential_beta': 8.831434530255793}. Best is trial 144 with value: 0.24983212973228822.
2026-05-31 23:21:57 | INFO | src.nested_cv_avggrm_weighted_unified | Trial 160 | outer=2 | alpha=4.884e+05 n_pcs=4000 (pc_topk) weight_search=on
2026-05-31 23:21:57 | INFO | src.nested_cv_avggrm_weighted_unified | Trial 160 | outer=2 | weight={'name': 'exponential', 'floor': 1e-06, 'clip_max': 20.0, 'beta': 9.095843796706138}
2026-05-31 23:22:01 | INFO | src.nested_cv_avggrm_weighted_unified | Trial 160 | outer=2 | pruned after 7/10 inner folds (mean r=0.2569)
[I 2026-05-31 23:22:01,650] Trial 160 pruned. 
2026-05-31 23:22:01 | INFO | src.nested_cv_avggrm_weighted_unified | Trial 161 | outer=2 | alpha=2.668e+05 n_pcs=4000 (pc_topk) weight_search=on
2026-05-31 23:22:01 | INFO | src.nested_cv_avggrm_weighted_unified | Trial 161 | outer=2 | weight={'name': 'exponential', 'floor': 1e-06, 'clip_max': 3.0, 'beta': 8.711114459298345}
[I 2026-05-31 23:22:07,406] Trial 161 finished with value: 0.24977092196847073 and parameters: {'alpha': 266827.83358595346, 'n_pcs': 4000, 'weight_scheme': 'exponential', 'weight_clip_max': 3.0, 'weight_exponential_beta': 8.711114459298345}. Best is trial 144 with value: 0.24983212973228822.
2026-05-31 23:22:07 | INFO | src.nested_cv_avggrm_weighted_unified | Trial 162 | outer=2 | alpha=2.876e+05 n_pcs=4000 (pc_topk) weight_search=on
2026-05-31 23:22:07 | INFO | src.nested_cv_avggrm_weighted_unified | Trial 162 | outer=2 | weight={'name': 'exponential', 'floor': 1e-06, 'clip_max': 3.0, 'beta': 8.781823262825677}
[I 2026-05-31 23:22:13,156] Trial 162 finished with value: 0.24983526311300713 and parameters: {'alpha': 287584.5111541837, 'n_pcs': 4000, 'weight_scheme': 'exponential', 'weight_clip_max': 3.0, 'weight_exponential_beta': 8.781823262825677}. Best is trial 162 with value: 0.24983526311300713.
2026-05-31 23:22:13 | INFO | src.nested_cv_avggrm_weighted_unified | OUTER 2 | new best trial 162 (mean inner r=0.2498) saved to outputs/final_results/e6_pc_ridge_avggrm/thr_wing/e6_pc_ridge_avggrm_thr_wing_best_trials/split_02_best_trial.json
2026-05-31 23:22:13 | INFO | src.nested_cv_avggrm_weighted_unified | Trial 163 | outer=2 | alpha=4.130e+05 n_pcs=4000 (pc_topk) weight_search=on
2026-05-31 23:22:13 | INFO | src.nested_cv_avggrm_weighted_unified | Trial 163 | outer=2 | weight={'name': 'exponential', 'floor': 1e-06, 'clip_max': 3.0, 'beta': 9.438134824231499}
[I 2026-05-31 23:22:19,091] Trial 163 finished with value: 0.24942930905249425 and parameters: {'alpha': 412990.40081693156, 'n_pcs': 4000, 'weight_scheme': 'exponential', 'weight_clip_max': 3.0, 'weight_exponential_beta': 9.438134824231499}. Best is trial 162 with value: 0.24983526311300713.
2026-05-31 23:22:19 | INFO | src.nested_cv_avggrm_weighted_unified | Trial 164 | outer=2 | alpha=4.018e+05 n_pcs=4000 (pc_topk) weight_search=on
2026-05-31 23:22:19 | INFO | src.nested_cv_avggrm_weighted_unified | Trial 164 | outer=2 | weight={'name': 'exponential', 'floor': 1e-06, 'clip_max': 3.0, 'beta': 9.420451008394378}
[I 2026-05-31 23:22:24,872] Trial 164 finished with value: 0.2494805120055108 and parameters: {'alpha': 401758.2274216748, 'n_pcs': 4000, 'weight_scheme': 'exponential', 'weight_clip_max': 3.0, 'weight_exponential_beta': 9.420451008394378}. Best is trial 162 with value: 0.24983526311300713.
2026-05-31 23:22:24 | INFO | src.nested_cv_avggrm_weighted_unified | Trial 165 | outer=2 | alpha=4.057e+05 n_pcs=3500 (pc_topk) weight_search=on
2026-05-31 23:22:24 | INFO | src.nested_cv_avggrm_weighted_unified | Trial 165 | outer=2 | weight={'name': 'exponential', 'floor': 1e-06, 'clip_max': 3.0, 'beta': 9.785706933188765}
[I 2026-05-31 23:22:29,808] Trial 165 finished with value: 0.2480572102149754 and parameters: {'alpha': 405748.47433355096, 'n_pcs': 3500, 'weight_scheme': 'exponential', 'weight_clip_max': 3.0, 'weight_exponential_beta': 9.785706933188765}. Best is trial 162 with value: 0.24983526311300713.
2026-05-31 23:22:29 | INFO | src.nested_cv_avggrm_weighted_unified | Trial 166 | outer=2 | alpha=4.305e+05 n_pcs=4000 (pc_topk) weight_search=on
2026-05-31 23:22:29 | INFO | src.nested_cv_avggrm_weighted_unified | Trial 166 | outer=2 | weight={'name': 'exponential', 'floor': 1e-06, 'clip_max': 3.0, 'beta': 9.524226189272154}
[I 2026-05-31 23:22:35,567] Trial 166 finished with value: 0.2492786667249355 and parameters: {'alpha': 430482.5100745009, 'n_pcs': 4000, 'weight_scheme': 'exponential', 'weight_clip_max': 3.0, 'weight_exponential_beta': 9.524226189272154}. Best is trial 162 with value: 0.24983526311300713.
2026-05-31 23:22:35 | INFO | src.nested_cv_avggrm_weighted_unified | Trial 167 | outer=2 | alpha=4.803e+05 n_pcs=4000 (pc_topk) weight_search=on
2026-05-31 23:22:35 | INFO | src.nested_cv_avggrm_weighted_unified | Trial 167 | outer=2 | weight={'name': 'exponential', 'floor': 1e-06, 'clip_max': 3.0, 'beta': 9.396323570691973}
[I 2026-05-31 23:22:41,325] Trial 167 finished with value: 0.24918581469183598 and parameters: {'alpha': 480291.6904296401, 'n_pcs': 4000, 'weight_scheme': 'exponential', 'weight_clip_max': 3.0, 'weight_exponential_beta': 9.396323570691973}. Best is trial 162 with value: 0.24983526311300713.
2026-05-31 23:22:41 | INFO | src.nested_cv_avggrm_weighted_unified | Trial 168 | outer=2 | alpha=4.207e+05 n_pcs=4000 (pc_topk) weight_search=on
2026-05-31 23:22:41 | INFO | src.nested_cv_avggrm_weighted_unified | Trial 168 | outer=2 | weight={'name': 'exponential', 'floor': 1e-06, 'clip_max': 3.0, 'beta': 9.775083283134556}
[I 2026-05-31 23:22:47,076] Trial 168 finished with value: 0.2489843727887767 and parameters: {'alpha': 420676.7493911499, 'n_pcs': 4000, 'weight_scheme': 'exponential', 'weight_clip_max': 3.0, 'weight_exponential_beta': 9.775083283134556}. Best is trial 162 with value: 0.24983526311300713.
2026-05-31 23:22:47 | INFO | src.nested_cv_avggrm_weighted_unified | Trial 169 | outer=2 | alpha=5.227e+05 n_pcs=4000 (pc_topk) weight_search=on
2026-05-31 23:22:47 | INFO | src.nested_cv_avggrm_weighted_unified | Trial 169 | outer=2 | weight={'name': 'exponential', 'floor': 1e-06, 'clip_max': 3.0, 'beta': 9.12411440113821}
[I 2026-05-31 23:22:52,825] Trial 169 finished with value: 0.24905018725726658 and parameters: {'alpha': 522663.23900556896, 'n_pcs': 4000, 'weight_scheme': 'exponential', 'weight_clip_max': 3.0, 'weight_exponential_beta': 9.12411440113821}. Best is trial 162 with value: 0.24983526311300713.
2026-05-31 23:22:52 | INFO | src.nested_cv_avggrm_weighted_unified | Trial 170 | outer=2 | alpha=1.712e+05 n_pcs=3500 (pc_topk) weight_search=on
2026-05-31 23:22:52 | INFO | src.nested_cv_avggrm_weighted_unified | Trial 170 | outer=2 | weight={'name': 'uniform', 'floor': 1e-06, 'clip_max': 3.0}
2026-05-31 23:22:55 | INFO | src.nested_cv_avggrm_weighted_unified | Trial 170 | outer=2 | pruned after 6/10 inner folds (mean r=0.2372)
[I 2026-05-31 23:22:55,308] Trial 170 pruned. 
2026-05-31 23:22:55 | INFO | src.nested_cv_avggrm_weighted_unified | Trial 171 | outer=2 | alpha=2.434e+05 n_pcs=4000 (pc_topk) weight_search=on
2026-05-31 23:22:55 | INFO | src.nested_cv_avggrm_weighted_unified | Trial 171 | outer=2 | weight={'name': 'exponential', 'floor': 1e-06, 'clip_max': 3.0, 'beta': 9.433047142314743}
[I 2026-05-31 23:23:01,094] Trial 171 finished with value: 0.24918533833359877 and parameters: {'alpha': 243378.544802552, 'n_pcs': 4000, 'weight_scheme': 'exponential', 'weight_clip_max': 3.0, 'weight_exponential_beta': 9.433047142314743}. Best is trial 162 with value: 0.24983526311300713.
2026-05-31 23:23:01 | INFO | src.nested_cv_avggrm_weighted_unified | Trial 172 | outer=2 | alpha=3.863e+05 n_pcs=4000 (pc_topk) weight_search=on
2026-05-31 23:23:01 | INFO | src.nested_cv_avggrm_weighted_unified | Trial 172 | outer=2 | weight={'name': 'exponential', 'floor': 1e-06, 'clip_max': 3.0, 'beta': 9.175701631002948}
[I 2026-05-31 23:23:06,875] Trial 172 finished with value: 0.24967347565287437 and parameters: {'alpha': 386281.2803638266, 'n_pcs': 4000, 'weight_scheme': 'exponential', 'weight_clip_max': 3.0, 'weight_exponential_beta': 9.175701631002948}. Best is trial 162 with value: 0.24983526311300713.
2026-05-31 23:23:06 | INFO | src.nested_cv_avggrm_weighted_unified | Trial 173 | outer=2 | alpha=3.704e+03 n_pcs=4000 (pc_topk) weight_search=on
2026-05-31 23:23:06 | INFO | src.nested_cv_avggrm_weighted_unified | Trial 173 | outer=2 | weight={'name': 'exponential', 'floor': 1e-06, 'clip_max': 3.0, 'beta': 9.584511837996708}
2026-05-31 23:23:09 | INFO | src.nested_cv_avggrm_weighted_unified | Trial 173 | outer=2 | pruned after 5/10 inner folds (mean r=0.1582)
[I 2026-05-31 23:23:09,792] Trial 173 pruned. 
2026-05-31 23:23:09 | INFO | src.nested_cv_avggrm_weighted_unified | Trial 174 | outer=2 | alpha=3.850e+05 n_pcs=4000 (pc_topk) weight_search=on
2026-05-31 23:23:09 | INFO | src.nested_cv_avggrm_weighted_unified | Trial 174 | outer=2 | weight={'name': 'exponential', 'floor': 1e-06, 'clip_max': 3.0, 'beta': 9.16833561849788}
[I 2026-05-31 23:23:15,606] Trial 174 finished with value: 0.24967947129697105 and parameters: {'alpha': 385047.59442359535, 'n_pcs': 4000, 'weight_scheme': 'exponential', 'weight_clip_max': 3.0, 'weight_exponential_beta': 9.16833561849788}. Best is trial 162 with value: 0.24983526311300713.
2026-05-31 23:23:15 | INFO | src.nested_cv_avggrm_weighted_unified | Trial 175 | outer=2 | alpha=3.918e+05 n_pcs=4000 (pc_topk) weight_search=on
2026-05-31 23:23:15 | INFO | src.nested_cv_avggrm_weighted_unified | Trial 175 | outer=2 | weight={'name': 'exponential', 'floor': 1e-06, 'clip_max': 3.0, 'beta': 9.197585950321905}
[I 2026-05-31 23:23:21,433] Trial 175 finished with value: 0.24964957933567403 and parameters: {'alpha': 391759.8166190435, 'n_pcs': 4000, 'weight_scheme': 'exponential', 'weight_clip_max': 3.0, 'weight_exponential_beta': 9.197585950321905}. Best is trial 162 with value: 0.24983526311300713.
2026-05-31 23:23:21 | INFO | src.nested_cv_avggrm_weighted_unified | Trial 176 | outer=2 | alpha=3.765e+05 n_pcs=4000 (pc_topk) weight_search=on
2026-05-31 23:23:21 | INFO | src.nested_cv_avggrm_weighted_unified | Trial 176 | outer=2 | weight={'name': 'exponential', 'floor': 1e-06, 'clip_max': 3.0, 'beta': 9.157184444167537}
[I 2026-05-31 23:23:27,244] Trial 176 finished with value: 0.2497067322489411 and parameters: {'alpha': 376475.72219339944, 'n_pcs': 4000, 'weight_scheme': 'exponential', 'weight_clip_max': 3.0, 'weight_exponential_beta': 9.157184444167537}. Best is trial 162 with value: 0.24983526311300713.
2026-05-31 23:23:27 | INFO | src.nested_cv_avggrm_weighted_unified | Trial 177 | outer=2 | alpha=3.794e+05 n_pcs=4000 (pc_topk) weight_search=on
2026-05-31 23:23:27 | INFO | src.nested_cv_avggrm_weighted_unified | Trial 177 | outer=2 | weight={'name': 'exponential', 'floor': 1e-06, 'clip_max': 3.0, 'beta': 9.193737163682615}
[I 2026-05-31 23:23:33,010] Trial 177 finished with value: 0.24968639820458732 and parameters: {'alpha': 379353.3861338711, 'n_pcs': 4000, 'weight_scheme': 'exponential', 'weight_clip_max': 3.0, 'weight_exponential_beta': 9.193737163682615}. Best is trial 162 with value: 0.24983526311300713.
2026-05-31 23:23:33 | INFO | src.nested_cv_avggrm_weighted_unified | Trial 178 | outer=2 | alpha=5.559e+05 n_pcs=4000 (pc_topk) weight_search=on
2026-05-31 23:23:33 | INFO | src.nested_cv_avggrm_weighted_unified | Trial 178 | outer=2 | weight={'name': 'exponential', 'floor': 1e-06, 'clip_max': 3.0, 'beta': 9.1402356083709}
[I 2026-05-31 23:23:38,769] Trial 178 finished with value: 0.248858503699056 and parameters: {'alpha': 555870.0315015948, 'n_pcs': 4000, 'weight_scheme': 'exponential', 'weight_clip_max': 3.0, 'weight_exponential_beta': 9.1402356083709}. Best is trial 162 with value: 0.24983526311300713.
2026-05-31 23:23:38 | INFO | src.nested_cv_avggrm_weighted_unified | Trial 179 | outer=2 | alpha=3.701e+05 n_pcs=3500 (pc_topk) weight_search=on
2026-05-31 23:23:38 | INFO | src.nested_cv_avggrm_weighted_unified | Trial 179 | outer=2 | weight={'name': 'exponential', 'floor': 1e-06, 'clip_max': 3.0, 'beta': 9.138304346078922}
[I 2026-05-31 23:23:43,682] Trial 179 finished with value: 0.24887804000388733 and parameters: {'alpha': 370112.9627509602, 'n_pcs': 3500, 'weight_scheme': 'exponential', 'weight_clip_max': 3.0, 'weight_exponential_beta': 9.138304346078922}. Best is trial 162 with value: 0.24983526311300713.
2026-05-31 23:23:43 | INFO | src.nested_cv_avggrm_weighted_unified | Trial 180 | outer=2 | alpha=2.302e+05 n_pcs=4000 (pc_topk) weight_search=on
2026-05-31 23:23:43 | INFO | src.nested_cv_avggrm_weighted_unified | Trial 180 | outer=2 | weight={'name': 'exponential', 'floor': 1e-06, 'clip_max': 3.0, 'beta': 9.01454577277529}
[I 2026-05-31 23:23:49,514] Trial 180 finished with value: 0.24942759781787283 and parameters: {'alpha': 230235.5323261891, 'n_pcs': 4000, 'weight_scheme': 'exponential', 'weight_clip_max': 3.0, 'weight_exponential_beta': 9.01454577277529}. Best is trial 162 with value: 0.24983526311300713.
2026-05-31 23:23:49 | INFO | src.nested_cv_avggrm_weighted_unified | Trial 181 | outer=2 | alpha=3.640e+05 n_pcs=4000 (pc_topk) weight_search=on
2026-05-31 23:23:49 | INFO | src.nested_cv_avggrm_weighted_unified | Trial 181 | outer=2 | weight={'name': 'exponential', 'floor': 1e-06, 'clip_max': 3.0, 'beta': 9.231235062374138}
[I 2026-05-31 23:23:55,332] Trial 181 finished with value: 0.2497055211353607 and parameters: {'alpha': 364045.77020580013, 'n_pcs': 4000, 'weight_scheme': 'exponential', 'weight_clip_max': 3.0, 'weight_exponential_beta': 9.231235062374138}. Best is trial 162 with value: 0.24983526311300713.
2026-05-31 23:23:55 | INFO | src.nested_cv_avggrm_weighted_unified | Trial 182 | outer=2 | alpha=3.833e+05 n_pcs=4000 (pc_topk) weight_search=on
2026-05-31 23:23:55 | INFO | src.nested_cv_avggrm_weighted_unified | Trial 182 | outer=2 | weight={'name': 'exponential', 'floor': 1e-06, 'clip_max': 3.0, 'beta': 9.230274559713216}
[I 2026-05-31 23:24:01,158] Trial 182 finished with value: 0.2496613931413178 and parameters: {'alpha': 383337.3358861321, 'n_pcs': 4000, 'weight_scheme': 'exponential', 'weight_clip_max': 3.0, 'weight_exponential_beta': 9.230274559713216}. Best is trial 162 with value: 0.24983526311300713.
2026-05-31 23:24:01 | INFO | src.nested_cv_avggrm_weighted_unified | Trial 183 | outer=2 | alpha=3.619e+05 n_pcs=4000 (pc_topk) weight_search=on
2026-05-31 23:24:01 | INFO | src.nested_cv_avggrm_weighted_unified | Trial 183 | outer=2 | weight={'name': 'exponential', 'floor': 1e-06, 'clip_max': 3.0, 'beta': 9.253729708210548}
[I 2026-05-31 23:24:06,977] Trial 183 finished with value: 0.24969558081037052 and parameters: {'alpha': 361853.55676147976, 'n_pcs': 4000, 'weight_scheme': 'exponential', 'weight_clip_max': 3.0, 'weight_exponential_beta': 9.253729708210548}. Best is trial 162 with value: 0.24983526311300713.
2026-05-31 23:24:06 | INFO | src.nested_cv_avggrm_weighted_unified | Trial 184 | outer=2 | alpha=2.359e+05 n_pcs=4000 (pc_topk) weight_search=on
2026-05-31 23:24:06 | INFO | src.nested_cv_avggrm_weighted_unified | Trial 184 | outer=2 | weight={'name': 'exponential', 'floor': 1e-06, 'clip_max': 3.0, 'beta': 9.727845967836545}
[I 2026-05-31 23:24:12,785] Trial 184 finished with value: 0.24861541494249942 and parameters: {'alpha': 235916.8589203219, 'n_pcs': 4000, 'weight_scheme': 'exponential', 'weight_clip_max': 3.0, 'weight_exponential_beta': 9.727845967836545}. Best is trial 162 with value: 0.24983526311300713.
2026-05-31 23:24:12 | INFO | src.nested_cv_avggrm_weighted_unified | Trial 185 | outer=2 | alpha=2.931e+05 n_pcs=4000 (pc_topk) weight_search=on
2026-05-31 23:24:12 | INFO | src.nested_cv_avggrm_weighted_unified | Trial 185 | outer=2 | weight={'name': 'exponential', 'floor': 1e-06, 'clip_max': 3.0, 'beta': 8.906092654018002}
[I 2026-05-31 23:24:18,549] Trial 185 finished with value: 0.24984234950489692 and parameters: {'alpha': 293069.89804548863, 'n_pcs': 4000, 'weight_scheme': 'exponential', 'weight_clip_max': 3.0, 'weight_exponential_beta': 8.906092654018002}. Best is trial 185 with value: 0.24984234950489692.
2026-05-31 23:24:18 | INFO | src.nested_cv_avggrm_weighted_unified | OUTER 2 | new best trial 185 (mean inner r=0.2498) saved to outputs/final_results/e6_pc_ridge_avggrm/thr_wing/e6_pc_ridge_avggrm_thr_wing_best_trials/split_02_best_trial.json
2026-05-31 23:24:18 | INFO | src.nested_cv_avggrm_weighted_unified | Trial 186 | outer=2 | alpha=1.844e+05 n_pcs=4000 (pc_topk) weight_search=on
2026-05-31 23:24:18 | INFO | src.nested_cv_avggrm_weighted_unified | Trial 186 | outer=2 | weight={'name': 'linear', 'floor': 1e-06, 'clip_max': None, 'min_weight': 0.5412570941930029, 'max_weight': 3.2797241004789037}
2026-05-31 23:24:22 | INFO | src.nested_cv_avggrm_weighted_unified | Trial 186 | outer=2 | pruned after 7/10 inner folds (mean r=0.2736)
[I 2026-05-31 23:24:22,907] Trial 186 pruned. 
2026-05-31 23:24:22 | INFO | src.nested_cv_avggrm_weighted_unified | Trial 187 | outer=2 | alpha=2.902e+05 n_pcs=4000 (pc_topk) weight_search=on
2026-05-31 23:24:22 | INFO | src.nested_cv_avggrm_weighted_unified | Trial 187 | outer=2 | weight={'name': 'exponential', 'floor': 1e-06, 'clip_max': 3.0, 'beta': 8.871329136841636}
