[I 2026-06-01 15:45:28,496] Trial 25 finished with value: 0.19600384965508902 and parameters: {'alpha': 33403.769793291, 'n_pcs': 3000, 'iw_method': 'uniform'}. Best is trial 22 with value: 0.20221539957231985.
2026-06-01 15:45:28 | INFO | Trial 26 | outer=3 | alpha=7.674e+04 n_pcs=3500 (pc_topk) weight={'name': 'pc_logistic', 'floor': 1e-06, 'clip_max': 2.5, 'prob_clip': 0.04783268173298191, 'n_components': 40, 'logistic_c': 0.0034285114017368, 'pca_fit': 'combined', 'solver': 'lbfgs', 'max_iter': 2000, 'fit_intercept': True, 'standardize_with_source': True, 'rho': 0.5}
[I 2026-06-01 15:45:45,555] Trial 26 finished with value: 0.20278008710373158 and parameters: {'alpha': 76738.73664853146, 'n_pcs': 3500, 'iw_method': 'pc_logistic', 'iw_clip_max': 2.5, 'iw_prob_clip': 0.04783268173298191, 'iw_n_components': 40, 'iw_logistic_c': 0.0034285114017368, 'iw_pca_fit': 'combined', 'iw_solver': 'lbfgs', 'iw_rho': 0.5}. Best is trial 26 with value: 0.20278008710373158.
2026-06-01 15:45:45 | INFO | Trial 27 | outer=3 | alpha=2.608e+05 n_pcs=3500 (pc_topk) weight={'name': 'pc_logistic', 'floor': 1e-06, 'clip_max': 2.5, 'prob_clip': 0.04068282884065535, 'n_components': 40, 'logistic_c': 0.004144301940152981, 'pca_fit': 'combined', 'solver': 'lbfgs', 'max_iter': 2000, 'fit_intercept': True, 'standardize_with_source': True, 'rho': 0.5}
[I 2026-06-01 15:46:02,116] Trial 27 finished with value: 0.20126115475730985 and parameters: {'alpha': 260801.8872795479, 'n_pcs': 3500, 'iw_method': 'pc_logistic', 'iw_clip_max': 2.5, 'iw_prob_clip': 0.04068282884065535, 'iw_n_components': 40, 'iw_logistic_c': 0.004144301940152981, 'iw_pca_fit': 'combined', 'iw_solver': 'lbfgs', 'iw_rho': 0.5}. Best is trial 26 with value: 0.20278008710373158.
2026-06-01 15:46:02 | INFO | Trial 28 | outer=3 | alpha=6.556e+03 n_pcs=1500 (pc_topk) weight={'name': 'pc_logistic', 'floor': 1e-06, 'clip_max': 2.5, 'prob_clip': 0.016572379481429717, 'n_components': 40, 'logistic_c': 0.0007021133098376147, 'pca_fit': 'combined', 'solver': 'lbfgs', 'max_iter': 2000, 'fit_intercept': True, 'standardize_with_source': True, 'rho': 0.5}
[I 2026-06-01 15:46:12,611] Trial 28 finished with value: 0.14257884283288177 and parameters: {'alpha': 6556.132383650318, 'n_pcs': 1500, 'iw_method': 'pc_logistic', 'iw_clip_max': 2.5, 'iw_prob_clip': 0.016572379481429717, 'iw_n_components': 40, 'iw_logistic_c': 0.0007021133098376147, 'iw_pca_fit': 'combined', 'iw_solver': 'lbfgs', 'iw_rho': 0.5}. Best is trial 26 with value: 0.20278008710373158.
2026-06-01 15:46:12 | INFO | Trial 29 | outer=3 | alpha=1.005e+05 n_pcs=3500 (pc_topk) weight={'name': 'pc_logistic', 'floor': 1e-06, 'clip_max': 1.5, 'prob_clip': 0.04937079087391629, 'n_components': 100, 'logistic_c': 0.16854017434312787, 'pca_fit': 'combined', 'solver': 'lbfgs', 'max_iter': 2000, 'fit_intercept': True, 'standardize_with_source': True, 'rho': 0.85}
[I 2026-06-01 15:46:35,484] Trial 29 finished with value: 0.2036231701202115 and parameters: {'alpha': 100480.27348644074, 'n_pcs': 3500, 'iw_method': 'pc_logistic', 'iw_clip_max': 1.5, 'iw_prob_clip': 0.04937079087391629, 'iw_n_components': 100, 'iw_logistic_c': 0.16854017434312787, 'iw_pca_fit': 'combined', 'iw_solver': 'lbfgs', 'iw_rho': 0.85}. Best is trial 29 with value: 0.2036231701202115.
2026-06-01 15:46:35 | INFO | Trial 30 | outer=3 | alpha=1.111e+05 n_pcs=3500 (pc_topk) weight={'name': 'pc_logistic', 'floor': 1e-06, 'clip_max': 1.5, 'prob_clip': 0.03304341027555255, 'n_components': 100, 'logistic_c': 0.3282270478127271, 'pca_fit': 'combined', 'solver': 'lbfgs', 'max_iter': 2000, 'fit_intercept': True, 'standardize_with_source': True, 'rho': 0.85}
[I 2026-06-01 15:46:59,558] Trial 30 finished with value: 0.2044304781745953 and parameters: {'alpha': 111090.15879591517, 'n_pcs': 3500, 'iw_method': 'pc_logistic', 'iw_clip_max': 1.5, 'iw_prob_clip': 0.03304341027555255, 'iw_n_components': 100, 'iw_logistic_c': 0.3282270478127271, 'iw_pca_fit': 'combined', 'iw_solver': 'lbfgs', 'iw_rho': 0.85}. Best is trial 30 with value: 0.2044304781745953.
2026-06-01 15:46:59 | INFO | Trial 31 | outer=3 | alpha=1.089e+05 n_pcs=3500 (pc_topk) weight={'name': 'pc_logistic', 'floor': 1e-06, 'clip_max': 1.5, 'prob_clip': 0.04598353015294807, 'n_components': 100, 'logistic_c': 0.34861665662439967, 'pca_fit': 'combined', 'solver': 'lbfgs', 'max_iter': 2000, 'fit_intercept': True, 'standardize_with_source': True, 'rho': 0.85}
[I 2026-06-01 15:47:27,566] Trial 31 finished with value: 0.20362552293201636 and parameters: {'alpha': 108926.22113695698, 'n_pcs': 3500, 'iw_method': 'pc_logistic', 'iw_clip_max': 1.5, 'iw_prob_clip': 0.04598353015294807, 'iw_n_components': 100, 'iw_logistic_c': 0.34861665662439967, 'iw_pca_fit': 'combined', 'iw_solver': 'lbfgs', 'iw_rho': 0.85}. Best is trial 30 with value: 0.2044304781745953.
2026-06-01 15:47:27 | INFO | Trial 32 | outer=3 | alpha=1.139e+05 n_pcs=3500 (pc_topk) weight={'name': 'pc_logistic', 'floor': 1e-06, 'clip_max': 1.5, 'prob_clip': 0.04366801611440335, 'n_components': 100, 'logistic_c': 0.36572497978433466, 'pca_fit': 'combined', 'solver': 'lbfgs', 'max_iter': 2000, 'fit_intercept': True, 'standardize_with_source': True, 'rho': 0.85}
[I 2026-06-01 15:48:07,108] Trial 32 finished with value: 0.2036992672791579 and parameters: {'alpha': 113862.01527382979, 'n_pcs': 3500, 'iw_method': 'pc_logistic', 'iw_clip_max': 1.5, 'iw_prob_clip': 0.04366801611440335, 'iw_n_components': 100, 'iw_logistic_c': 0.36572497978433466, 'iw_pca_fit': 'combined', 'iw_solver': 'lbfgs', 'iw_rho': 0.85}. Best is trial 30 with value: 0.2044304781745953.
2026-06-01 15:48:07 | INFO | Trial 33 | outer=3 | alpha=1.310e+05 n_pcs=4500 (pc_topk) weight={'name': 'pc_logistic', 'floor': 1e-06, 'clip_max': 1.5, 'prob_clip': 0.025137047731283328, 'n_components': 100, 'logistic_c': 0.7704279632603839, 'pca_fit': 'combined', 'solver': 'lbfgs', 'max_iter': 2000, 'fit_intercept': True, 'standardize_with_source': True, 'rho': 0.85}
[I 2026-06-01 15:48:59,267] Trial 33 finished with value: 0.20402021378590315 and parameters: {'alpha': 130957.96328250576, 'n_pcs': 4500, 'iw_method': 'pc_logistic', 'iw_clip_max': 1.5, 'iw_prob_clip': 0.025137047731283328, 'iw_n_components': 100, 'iw_logistic_c': 0.7704279632603839, 'iw_pca_fit': 'combined', 'iw_solver': 'lbfgs', 'iw_rho': 0.85}. Best is trial 30 with value: 0.2044304781745953.
2026-06-01 15:48:59 | INFO | Trial 34 | outer=3 | alpha=1.470e+05 n_pcs=4500 (pc_topk) weight={'name': 'pc_logistic', 'floor': 1e-06, 'clip_max': 1.5, 'prob_clip': 0.01822132490697988, 'n_components': 100, 'logistic_c': 1.7305929406164404, 'pca_fit': 'combined', 'solver': 'lbfgs', 'max_iter': 2000, 'fit_intercept': True, 'standardize_with_source': True, 'rho': 0.85}
[I 2026-06-01 15:49:28,824] Trial 34 finished with value: 0.20329651378792396 and parameters: {'alpha': 147019.49705243885, 'n_pcs': 4500, 'iw_method': 'pc_logistic', 'iw_clip_max': 1.5, 'iw_prob_clip': 0.01822132490697988, 'iw_n_components': 100, 'iw_logistic_c': 1.7305929406164404, 'iw_pca_fit': 'combined', 'iw_solver': 'lbfgs', 'iw_rho': 0.85}. Best is trial 30 with value: 0.2044304781745953.
2026-06-01 15:49:28 | INFO | Trial 35 | outer=3 | alpha=2.034e+05 n_pcs=4500 (pc_topk) weight={'name': 'pc_logistic', 'floor': 1e-06, 'clip_max': 1.5, 'prob_clip': 0.023875597288364716, 'n_components': 100, 'logistic_c': 0.16336705190331471, 'pca_fit': 'combined', 'solver': 'lbfgs', 'max_iter': 2000, 'fit_intercept': True, 'standardize_with_source': True, 'rho': 0.85}
[I 2026-06-01 15:50:04,590] Trial 35 finished with value: 0.20213254861062885 and parameters: {'alpha': 203395.59880464355, 'n_pcs': 4500, 'iw_method': 'pc_logistic', 'iw_clip_max': 1.5, 'iw_prob_clip': 0.023875597288364716, 'iw_n_components': 100, 'iw_logistic_c': 0.16336705190331471, 'iw_pca_fit': 'combined', 'iw_solver': 'lbfgs', 'iw_rho': 0.85}. Best is trial 30 with value: 0.2044304781745953.
2026-06-01 15:50:04 | INFO | Trial 36 | outer=3 | alpha=4.774e+05 n_pcs=4500 (pc_topk) weight={'name': 'pc_logistic', 'floor': 1e-06, 'clip_max': 1.5, 'prob_clip': 0.02628665730049812, 'n_components': 100, 'logistic_c': 1.0230405414673505, 'pca_fit': 'combined', 'solver': 'lbfgs', 'max_iter': 2000, 'fit_intercept': True, 'standardize_with_source': True, 'rho': 0.85}
[I 2026-06-01 15:50:36,497] Trial 36 finished with value: 0.19722591251890603 and parameters: {'alpha': 477397.71676626866, 'n_pcs': 4500, 'iw_method': 'pc_logistic', 'iw_clip_max': 1.5, 'iw_prob_clip': 0.02628665730049812, 'iw_n_components': 100, 'iw_logistic_c': 1.0230405414673505, 'iw_pca_fit': 'combined', 'iw_solver': 'lbfgs', 'iw_rho': 0.85}. Best is trial 30 with value: 0.2044304781745953.
2026-06-01 15:50:36 | INFO | Trial 37 | outer=3 | alpha=1.257e+05 n_pcs=4000 (pc_topk) weight={'name': 'pc_logistic', 'floor': 1e-06, 'clip_max': 1.5, 'prob_clip': 0.009558546973255849, 'n_components': 100, 'logistic_c': 0.0304782969169094, 'pca_fit': 'combined', 'solver': 'lbfgs', 'max_iter': 2000, 'fit_intercept': True, 'standardize_with_source': True, 'rho': 0.85}
[I 2026-06-01 15:51:02,314] Trial 37 finished with value: 0.20314956152311128 and parameters: {'alpha': 125721.38568380872, 'n_pcs': 4000, 'iw_method': 'pc_logistic', 'iw_clip_max': 1.5, 'iw_prob_clip': 0.009558546973255849, 'iw_n_components': 100, 'iw_logistic_c': 0.0304782969169094, 'iw_pca_fit': 'combined', 'iw_solver': 'lbfgs', 'iw_rho': 0.85}. Best is trial 30 with value: 0.2044304781745953.
2026-06-01 15:51:02 | INFO | Trial 38 | outer=3 | alpha=2.702e+04 n_pcs=3500 (pc_topk) weight={'name': 'pc_logistic', 'floor': 1e-06, 'clip_max': 1.5, 'prob_clip': 0.03159641570348627, 'n_components': 100, 'logistic_c': 1.4127437988323117, 'pca_fit': 'combined', 'solver': 'lbfgs', 'max_iter': 2000, 'fit_intercept': True, 'standardize_with_source': True, 'rho': 0.85}
[I 2026-06-01 15:51:30,923] Trial 38 finished with value: 0.19697836203797076 and parameters: {'alpha': 27017.922512272835, 'n_pcs': 3500, 'iw_method': 'pc_logistic', 'iw_clip_max': 1.5, 'iw_prob_clip': 0.03159641570348627, 'iw_n_components': 100, 'iw_logistic_c': 1.4127437988323117, 'iw_pca_fit': 'combined', 'iw_solver': 'lbfgs', 'iw_rho': 0.85}. Best is trial 30 with value: 0.2044304781745953.
2026-06-01 15:51:30 | INFO | Trial 39 | outer=3 | alpha=2.382e+06 n_pcs=3500 (pc_topk) weight={'name': 'pc_logistic', 'floor': 1e-06, 'clip_max': 1.5, 'prob_clip': 0.009270477578650977, 'n_components': 100, 'logistic_c': 0.026141916511053447, 'pca_fit': 'combined', 'solver': 'lbfgs', 'max_iter': 2000, 'fit_intercept': True, 'standardize_with_source': True, 'rho': 0.85}
[I 2026-06-01 15:51:54,107] Trial 39 finished with value: 0.19031820981656303 and parameters: {'alpha': 2381584.253827562, 'n_pcs': 3500, 'iw_method': 'pc_logistic', 'iw_clip_max': 1.5, 'iw_prob_clip': 0.009270477578650977, 'iw_n_components': 100, 'iw_logistic_c': 0.026141916511053447, 'iw_pca_fit': 'combined', 'iw_solver': 'lbfgs', 'iw_rho': 0.85}. Best is trial 30 with value: 0.2044304781745953.
2026-06-01 15:51:54 | INFO | Trial 40 | outer=3 | alpha=1.769e+05 n_pcs=4000 (pc_topk) weight={'name': 'pc_logistic', 'floor': 1e-06, 'clip_max': 1.5, 'prob_clip': 0.01082138618801843, 'n_components': 100, 'logistic_c': 5.355618604617365, 'pca_fit': 'combined', 'solver': 'lbfgs', 'max_iter': 2000, 'fit_intercept': True, 'standardize_with_source': True, 'rho': 0.85}
[I 2026-06-01 15:52:21,901] Trial 40 finished with value: 0.20219535426057064 and parameters: {'alpha': 176949.60933054358, 'n_pcs': 4000, 'iw_method': 'pc_logistic', 'iw_clip_max': 1.5, 'iw_prob_clip': 0.01082138618801843, 'iw_n_components': 100, 'iw_logistic_c': 5.355618604617365, 'iw_pca_fit': 'combined', 'iw_solver': 'lbfgs', 'iw_rho': 0.85}. Best is trial 30 with value: 0.2044304781745953.
2026-06-01 15:52:21 | INFO | Trial 41 | outer=3 | alpha=9.213e+04 n_pcs=3500 (pc_topk) weight={'name': 'pc_logistic', 'floor': 1e-06, 'clip_max': 1.5, 'prob_clip': 0.04368400425181124, 'n_components': 100, 'logistic_c': 0.34386708350677847, 'pca_fit': 'combined', 'solver': 'lbfgs', 'max_iter': 2000, 'fit_intercept': True, 'standardize_with_source': True, 'rho': 0.85}
[I 2026-06-01 15:52:45,077] Trial 41 finished with value: 0.20397373498423765 and parameters: {'alpha': 92132.62762996773, 'n_pcs': 3500, 'iw_method': 'pc_logistic', 'iw_clip_max': 1.5, 'iw_prob_clip': 0.04368400425181124, 'iw_n_components': 100, 'iw_logistic_c': 0.34386708350677847, 'iw_pca_fit': 'combined', 'iw_solver': 'lbfgs', 'iw_rho': 0.85}. Best is trial 30 with value: 0.2044304781745953.
2026-06-01 15:52:45 | INFO | Trial 42 | outer=3 | alpha=8.905e+04 n_pcs=3000 (pc_topk) weight={'name': 'pc_logistic', 'floor': 1e-06, 'clip_max': 1.5, 'prob_clip': 0.03260471813122649, 'n_components': 100, 'logistic_c': 0.3900378725096293, 'pca_fit': 'combined', 'solver': 'lbfgs', 'max_iter': 2000, 'fit_intercept': True, 'standardize_with_source': True, 'rho': 0.85}
[I 2026-06-01 15:53:06,511] Trial 42 finished with value: 0.20484949333358043 and parameters: {'alpha': 89054.41193554671, 'n_pcs': 3000, 'iw_method': 'pc_logistic', 'iw_clip_max': 1.5, 'iw_prob_clip': 0.03260471813122649, 'iw_n_components': 100, 'iw_logistic_c': 0.3900378725096293, 'iw_pca_fit': 'combined', 'iw_solver': 'lbfgs', 'iw_rho': 0.85}. Best is trial 42 with value: 0.20484949333358043.
2026-06-01 15:53:06 | INFO | Trial 43 | outer=3 | alpha=8.295e+04 n_pcs=3000 (pc_topk) weight={'name': 'pc_logistic', 'floor': 1e-06, 'clip_max': 1.5, 'prob_clip': 0.026976742098893433, 'n_components': 100, 'logistic_c': 0.6504377962934158, 'pca_fit': 'combined', 'solver': 'lbfgs', 'max_iter': 2000, 'fit_intercept': True, 'standardize_with_source': True, 'rho': 0.85}
[I 2026-06-01 15:53:27,912] Trial 43 finished with value: 0.20461425891249566 and parameters: {'alpha': 82950.40986843336, 'n_pcs': 3000, 'iw_method': 'pc_logistic', 'iw_clip_max': 1.5, 'iw_prob_clip': 0.026976742098893433, 'iw_n_components': 100, 'iw_logistic_c': 0.6504377962934158, 'iw_pca_fit': 'combined', 'iw_solver': 'lbfgs', 'iw_rho': 0.85}. Best is trial 42 with value: 0.20484949333358043.
2026-06-01 15:53:27 | INFO | Trial 44 | outer=3 | alpha=3.468e+05 n_pcs=3000 (pc_topk) weight={'name': 'pc_logistic', 'floor': 1e-06, 'clip_max': 4.0, 'prob_clip': 0.027258342213560327, 'n_components': 100, 'logistic_c': 0.017191902508569182, 'pca_fit': 'combined', 'solver': 'lbfgs', 'max_iter': 2000, 'fit_intercept': True, 'standardize_with_source': True, 'rho': 0.85}
[I 2026-06-01 15:53:46,939] Trial 44 finished with value: 0.20159379291045973 and parameters: {'alpha': 346768.5803642332, 'n_pcs': 3000, 'iw_method': 'pc_logistic', 'iw_clip_max': 4.0, 'iw_prob_clip': 0.027258342213560327, 'iw_n_components': 100, 'iw_logistic_c': 0.017191902508569182, 'iw_pca_fit': 'combined', 'iw_solver': 'lbfgs', 'iw_rho': 0.85}. Best is trial 42 with value: 0.20484949333358043.
2026-06-01 15:53:46 | INFO | Trial 45 | outer=3 | alpha=7.695e+04 n_pcs=5000 (pc_topk) weight={'name': 'pc_logistic', 'floor': 1e-06, 'clip_max': 12.0, 'prob_clip': 0.02709063879864806, 'n_components': 10, 'logistic_c': 1.3124548866555423, 'pca_fit': 'combined', 'solver': 'lbfgs', 'max_iter': 2000, 'fit_intercept': True, 'standardize_with_source': True, 'rho': 0.7}
[I 2026-06-01 15:54:06,137] Trial 45 finished with value: 0.19182348751394215 and parameters: {'alpha': 76953.190698391, 'n_pcs': 5000, 'iw_method': 'pc_logistic', 'iw_clip_max': 12.0, 'iw_prob_clip': 0.02709063879864806, 'iw_n_components': 10, 'iw_logistic_c': 1.3124548866555423, 'iw_pca_fit': 'combined', 'iw_solver': 'lbfgs', 'iw_rho': 0.7}. Best is trial 42 with value: 0.20484949333358043.
2026-06-01 15:54:06 | INFO | Trial 46 | outer=3 | alpha=2.612e+04 n_pcs=3000 (pc_topk) weight={'name': 'pc_logistic', 'floor': 1e-06, 'clip_max': 7.0, 'prob_clip': 0.013589237903004465, 'n_components': 60, 'logistic_c': 0.06028065228202459, 'pca_fit': 'combined', 'solver': 'lbfgs', 'max_iter': 2000, 'fit_intercept': True, 'standardize_with_source': True, 'rho': 0.3}
[I 2026-06-01 15:54:22,283] Trial 46 finished with value: 0.18553691121444715 and parameters: {'alpha': 26116.982485579367, 'n_pcs': 3000, 'iw_method': 'pc_logistic', 'iw_clip_max': 7.0, 'iw_prob_clip': 0.013589237903004465, 'iw_n_components': 60, 'iw_logistic_c': 0.06028065228202459, 'iw_pca_fit': 'combined', 'iw_solver': 'lbfgs', 'iw_rho': 0.3}. Best is trial 42 with value: 0.20484949333358043.
2026-06-01 15:54:22 | INFO | Trial 47 | outer=3 | alpha=1.252e+04 n_pcs=2500 (pc_topk) weight={'name': 'pc_logistic', 'floor': 1e-06, 'clip_max': 1.5, 'prob_clip': 0.032478256467469706, 'n_components': 20, 'logistic_c': 0.5126270469088153, 'pca_fit': 'combined', 'solver': 'lbfgs', 'max_iter': 2000, 'fit_intercept': True, 'standardize_with_source': True, 'rho': 0.85}
[I 2026-06-01 15:54:34,924] Trial 47 finished with value: 0.18261460798265766 and parameters: {'alpha': 12519.740335183264, 'n_pcs': 2500, 'iw_method': 'pc_logistic', 'iw_clip_max': 1.5, 'iw_prob_clip': 0.032478256467469706, 'iw_n_components': 20, 'iw_logistic_c': 0.5126270469088153, 'iw_pca_fit': 'combined', 'iw_solver': 'lbfgs', 'iw_rho': 0.85}. Best is trial 42 with value: 0.20484949333358043.
2026-06-01 15:54:34 | INFO | Trial 48 | outer=3 | alpha=7.688e+04 n_pcs=4000 (pc_topk) weight={'name': 'pc_logistic', 'floor': 1e-06, 'clip_max': 1.5, 'prob_clip': 0.021343564431945707, 'n_components': 100, 'logistic_c': 3.6085153976553306, 'pca_fit': 'combined', 'solver': 'lbfgs', 'max_iter': 2000, 'fit_intercept': True, 'standardize_with_source': True, 'rho': 0.85}
[I 2026-06-01 15:54:58,071] Trial 48 finished with value: 0.20452463561276502 and parameters: {'alpha': 76882.60938007207, 'n_pcs': 4000, 'iw_method': 'pc_logistic', 'iw_clip_max': 1.5, 'iw_prob_clip': 0.021343564431945707, 'iw_n_components': 100, 'iw_logistic_c': 3.6085153976553306, 'iw_pca_fit': 'combined', 'iw_solver': 'lbfgs', 'iw_rho': 0.85}. Best is trial 42 with value: 0.20484949333358043.
2026-06-01 15:54:58 | INFO | Trial 49 | outer=3 | alpha=8.057e+05 n_pcs=4000 (pc_topk) weight={'name': 'pc_logistic', 'floor': 1e-06, 'clip_max': 1.5, 'prob_clip': 0.01837724340284549, 'n_components': 100, 'logistic_c': 4.1637537200795585, 'pca_fit': 'combined', 'solver': 'lbfgs', 'max_iter': 2000, 'fit_intercept': True, 'standardize_with_source': True, 'rho': 0.85}
[I 2026-06-01 15:55:23,012] Trial 49 finished with value: 0.1942570379591952 and parameters: {'alpha': 805678.8098955161, 'n_pcs': 4000, 'iw_method': 'pc_logistic', 'iw_clip_max': 1.5, 'iw_prob_clip': 0.01837724340284549, 'iw_n_components': 100, 'iw_logistic_c': 4.1637537200795585, 'iw_pca_fit': 'combined', 'iw_solver': 'lbfgs', 'iw_rho': 0.85}. Best is trial 42 with value: 0.20484949333358043.
2026-06-01 15:55:23 | INFO | Trial 50 | outer=3 | alpha=2.432e+05 n_pcs=4500 (pc_topk) weight={'name': 'pc_logistic', 'floor': 1e-06, 'clip_max': 1.5, 'prob_clip': 0.007421363372174961, 'n_components': 100, 'logistic_c': 9.867256005263341, 'pca_fit': 'combined', 'solver': 'lbfgs', 'max_iter': 2000, 'fit_intercept': True, 'standardize_with_source': True, 'rho': 0.85}
[I 2026-06-01 15:55:48,941] Trial 50 finished with value: 0.20091096914257314 and parameters: {'alpha': 243228.2150739537, 'n_pcs': 4500, 'iw_method': 'pc_logistic', 'iw_clip_max': 1.5, 'iw_prob_clip': 0.007421363372174961, 'iw_n_components': 100, 'iw_logistic_c': 9.867256005263341, 'iw_pca_fit': 'combined', 'iw_solver': 'lbfgs', 'iw_rho': 0.85}. Best is trial 42 with value: 0.20484949333358043.
2026-06-01 15:55:48 | INFO | Trial 51 | outer=3 | alpha=8.642e+04 n_pcs=4000 (pc_topk) weight={'name': 'pc_logistic', 'floor': 1e-06, 'clip_max': 1.5, 'prob_clip': 0.03452805398596714, 'n_components': 100, 'logistic_c': 1.8825883013083808, 'pca_fit': 'combined', 'solver': 'lbfgs', 'max_iter': 2000, 'fit_intercept': True, 'standardize_with_source': True, 'rho': 0.85}
[I 2026-06-01 15:56:13,550] Trial 51 finished with value: 0.204737903364932 and parameters: {'alpha': 86422.58096024525, 'n_pcs': 4000, 'iw_method': 'pc_logistic', 'iw_clip_max': 1.5, 'iw_prob_clip': 0.03452805398596714, 'iw_n_components': 100, 'iw_logistic_c': 1.8825883013083808, 'iw_pca_fit': 'combined', 'iw_solver': 'lbfgs', 'iw_rho': 0.85}. Best is trial 42 with value: 0.20484949333358043.
2026-06-01 15:56:13 | INFO | Trial 52 | outer=3 | alpha=1.624e+05 n_pcs=4000 (pc_topk) weight={'name': 'pc_logistic', 'floor': 1e-06, 'clip_max': 1.5, 'prob_clip': 0.024884353988926487, 'n_components': 100, 'logistic_c': 2.403829292193204, 'pca_fit': 'combined', 'solver': 'lbfgs', 'max_iter': 2000, 'fit_intercept': True, 'standardize_with_source': True, 'rho': 0.85}
[I 2026-06-01 15:56:40,044] Trial 52 finished with value: 0.2029331850448753 and parameters: {'alpha': 162377.9113019029, 'n_pcs': 4000, 'iw_method': 'pc_logistic', 'iw_clip_max': 1.5, 'iw_prob_clip': 0.024884353988926487, 'iw_n_components': 100, 'iw_logistic_c': 2.403829292193204, 'iw_pca_fit': 'combined', 'iw_solver': 'lbfgs', 'iw_rho': 0.85}. Best is trial 42 with value: 0.20484949333358043.
2026-06-01 15:56:40 | INFO | Trial 53 | outer=3 | alpha=6.632e+04 n_pcs=4000 (pc_topk) weight={'name': 'pc_logistic', 'floor': 1e-06, 'clip_max': 1.5, 'prob_clip': 0.035159659036539934, 'n_components': 80, 'logistic_c': 0.07750156081661802, 'pca_fit': 'combined', 'solver': 'lbfgs', 'max_iter': 2000, 'fit_intercept': True, 'standardize_with_source': True, 'rho': 0.85}
