[I 2026-06-01 00:07:28,953] Trial 192 pruned. 
2026-06-01 00:07:28 | INFO | src.nested_cv_avggrm_weighted_unified | Trial 193 | outer=4 | alpha=8.174e+04 n_pcs=4500 (pc_topk) weight_search=on
2026-06-01 00:07:28 | INFO | src.nested_cv_avggrm_weighted_unified | Trial 193 | outer=4 | weight={'name': 'linear', 'floor': 1e-06, 'clip_max': 10.0, 'min_weight': 0.512558967904783, 'max_weight': 4.2688314709888955}
2026-06-01 00:07:33 | INFO | src.nested_cv_avggrm_weighted_unified | Trial 193 | outer=4 | pruned after 6/10 inner folds (mean r=0.2048)
[I 2026-06-01 00:07:33,404] Trial 193 pruned. 
2026-06-01 00:07:33 | INFO | src.nested_cv_avggrm_weighted_unified | Trial 194 | outer=4 | alpha=1.284e+05 n_pcs=4500 (pc_topk) weight_search=on
2026-06-01 00:07:33 | INFO | src.nested_cv_avggrm_weighted_unified | Trial 194 | outer=4 | weight={'name': 'linear', 'floor': 1e-06, 'clip_max': 10.0, 'min_weight': 0.542524438560095, 'max_weight': 3.578668088143798}
[I 2026-06-01 00:07:40,301] Trial 194 finished with value: 0.1963859746801171 and parameters: {'alpha': 128383.08870897953, 'n_pcs': 4500, 'weight_scheme': 'linear', 'weight_clip_max': 10.0, 'weight_linear_min_weight': 0.542524438560095, 'weight_linear_max_weight': 3.578668088143798}. Best is trial 41 with value: 0.19810774778548906.
2026-06-01 00:07:40 | INFO | src.nested_cv_avggrm_weighted_unified | Trial 195 | outer=4 | alpha=7.098e+04 n_pcs=4500 (pc_topk) weight_search=on
2026-06-01 00:07:40 | INFO | src.nested_cv_avggrm_weighted_unified | Trial 195 | outer=4 | weight={'name': 'linear', 'floor': 1e-06, 'clip_max': 10.0, 'min_weight': 0.4992568998725758, 'max_weight': 4.095197842484928}
2026-06-01 00:07:44 | INFO | src.nested_cv_avggrm_weighted_unified | Trial 195 | outer=4 | pruned after 6/10 inner folds (mean r=0.2037)
[I 2026-06-01 00:07:44,519] Trial 195 pruned. 
2026-06-01 00:07:44 | INFO | src.nested_cv_avggrm_weighted_unified | Trial 196 | outer=4 | alpha=1.059e+05 n_pcs=2500 (pc_topk) weight_search=on
2026-06-01 00:07:44 | INFO | src.nested_cv_avggrm_weighted_unified | Trial 196 | outer=4 | weight={'name': 'linear', 'floor': 1e-06, 'clip_max': None, 'min_weight': 0.3943006924047697, 'max_weight': 3.9614052194617075}
2026-06-01 00:07:46 | INFO | src.nested_cv_avggrm_weighted_unified | Trial 196 | outer=4 | pruned after 7/10 inner folds (mean r=0.2345)
[I 2026-06-01 00:07:46,587] Trial 196 pruned. 
2026-06-01 00:07:46 | INFO | src.nested_cv_avggrm_weighted_unified | Trial 197 | outer=4 | alpha=5.913e+04 n_pcs=4500 (pc_topk) weight_search=on
2026-06-01 00:07:46 | INFO | src.nested_cv_avggrm_weighted_unified | Trial 197 | outer=4 | weight={'name': 'linear', 'floor': 1e-06, 'clip_max': 10.0, 'min_weight': 0.5214096673192973, 'max_weight': 3.528523329826185}
2026-06-01 00:07:50 | INFO | src.nested_cv_avggrm_weighted_unified | Trial 197 | outer=4 | pruned after 6/10 inner folds (mean r=0.2023)
[I 2026-06-01 00:07:50,768] Trial 197 pruned. 
2026-06-01 00:07:50 | INFO | src.nested_cv_avggrm_weighted_unified | Trial 198 | outer=4 | alpha=9.004e+04 n_pcs=4500 (pc_topk) weight_search=on
2026-06-01 00:07:50 | INFO | src.nested_cv_avggrm_weighted_unified | Trial 198 | outer=4 | weight={'name': 'linear', 'floor': 1e-06, 'clip_max': 10.0, 'min_weight': 0.5560235512363008, 'max_weight': 3.339964916531861}
2026-06-01 00:07:54 | INFO | src.nested_cv_avggrm_weighted_unified | Trial 198 | outer=4 | pruned after 6/10 inner folds (mean r=0.2054)
[I 2026-06-01 00:07:54,908] Trial 198 pruned. 
2026-06-01 00:07:54 | INFO | src.nested_cv_avggrm_weighted_unified | Trial 199 | outer=4 | alpha=1.157e+05 n_pcs=4500 (pc_topk) weight_search=on
2026-06-01 00:07:54 | INFO | src.nested_cv_avggrm_weighted_unified | Trial 199 | outer=4 | weight={'name': 'linear', 'floor': 1e-06, 'clip_max': 10.0, 'min_weight': 0.4526853996333028, 'max_weight': 4.207541369979016}
[I 2026-06-01 00:08:01,784] Trial 199 finished with value: 0.19728875978068472 and parameters: {'alpha': 115656.39904853974, 'n_pcs': 4500, 'weight_scheme': 'linear', 'weight_clip_max': 10.0, 'weight_linear_min_weight': 0.4526853996333028, 'weight_linear_max_weight': 4.207541369979016}. Best is trial 41 with value: 0.19810774778548906.
2026-06-01 00:08:01 | INFO | src.nested_cv_avggrm_weighted_unified | Trial 200 | outer=4 | alpha=7.741e+04 n_pcs=1000 (pc_topk) weight_search=on
2026-06-01 00:08:01 | INFO | src.nested_cv_avggrm_weighted_unified | Trial 200 | outer=4 | weight={'name': 'linear', 'floor': 1e-06, 'clip_max': None, 'min_weight': 0.5319691087303361, 'max_weight': 3.8266392739758963}
2026-06-01 00:08:02 | INFO | src.nested_cv_avggrm_weighted_unified | Trial 200 | outer=4 | pruned after 6/10 inner folds (mean r=0.1965)
[I 2026-06-01 00:08:02,640] Trial 200 pruned. 
2026-06-01 00:08:02 | INFO | src.nested_cv_avggrm_weighted_unified | Trial 201 | outer=4 | alpha=9.832e+04 n_pcs=4500 (pc_topk) weight_search=on
2026-06-01 00:08:02 | INFO | src.nested_cv_avggrm_weighted_unified | Trial 201 | outer=4 | weight={'name': 'linear', 'floor': 1e-06, 'clip_max': 10.0, 'min_weight': 0.6170570694297276, 'max_weight': 4.344552848507366}
2026-06-01 00:08:06 | INFO | src.nested_cv_avggrm_weighted_unified | Trial 201 | outer=4 | pruned after 6/10 inner folds (mean r=0.2059)
[I 2026-06-01 00:08:06,795] Trial 201 pruned. 
2026-06-01 00:08:06 | INFO | src.nested_cv_avggrm_weighted_unified | Trial 202 | outer=4 | alpha=1.150e+05 n_pcs=4500 (pc_topk) weight_search=on
2026-06-01 00:08:06 | INFO | src.nested_cv_avggrm_weighted_unified | Trial 202 | outer=4 | weight={'name': 'linear', 'floor': 1e-06, 'clip_max': 10.0, 'min_weight': 0.5895990108042152, 'max_weight': 4.387601649048723}
[I 2026-06-01 00:08:13,680] Trial 202 finished with value: 0.19706533978225255 and parameters: {'alpha': 115044.2086200102, 'n_pcs': 4500, 'weight_scheme': 'linear', 'weight_clip_max': 10.0, 'weight_linear_min_weight': 0.5895990108042152, 'weight_linear_max_weight': 4.387601649048723}. Best is trial 41 with value: 0.19810774778548906.
2026-06-01 00:08:13 | INFO | src.nested_cv_avggrm_weighted_unified | Trial 203 | outer=4 | alpha=7.084e+04 n_pcs=4500 (pc_topk) weight_search=on
2026-06-01 00:08:13 | INFO | src.nested_cv_avggrm_weighted_unified | Trial 203 | outer=4 | weight={'name': 'linear', 'floor': 1e-06, 'clip_max': 10.0, 'min_weight': 0.6873706579358152, 'max_weight': 4.552580973674982}
2026-06-01 00:08:17 | INFO | src.nested_cv_avggrm_weighted_unified | Trial 203 | outer=4 | pruned after 6/10 inner folds (mean r=0.2039)
[I 2026-06-01 00:08:17,907] Trial 203 pruned. 
2026-06-01 00:08:17 | INFO | src.nested_cv_avggrm_weighted_unified | Trial 204 | outer=4 | alpha=1.419e+05 n_pcs=3000 (pc_topk) weight_search=on
2026-06-01 00:08:17 | INFO | src.nested_cv_avggrm_weighted_unified | Trial 204 | outer=4 | weight={'name': 'linear', 'floor': 1e-06, 'clip_max': 10.0, 'min_weight': 0.35823727997280974, 'max_weight': 3.709977162465435}
[I 2026-06-01 00:08:21,749] Trial 204 finished with value: 0.19702585627060304 and parameters: {'alpha': 141947.34794408927, 'n_pcs': 3000, 'weight_scheme': 'linear', 'weight_clip_max': 10.0, 'weight_linear_min_weight': 0.35823727997280974, 'weight_linear_max_weight': 3.709977162465435}. Best is trial 41 with value: 0.19810774778548906.
2026-06-01 00:08:21 | INFO | src.nested_cv_avggrm_weighted_unified | Trial 205 | outer=4 | alpha=9.286e+04 n_pcs=4500 (pc_topk) weight_search=on
2026-06-01 00:08:21 | INFO | src.nested_cv_avggrm_weighted_unified | Trial 205 | outer=4 | weight={'name': 'linear', 'floor': 1e-06, 'clip_max': 20.0, 'min_weight': 0.5687816215574181, 'max_weight': 4.235136618306323}
2026-06-01 00:08:25 | INFO | src.nested_cv_avggrm_weighted_unified | Trial 205 | outer=4 | pruned after 6/10 inner folds (mean r=0.2056)
[I 2026-06-01 00:08:25,908] Trial 205 pruned. 
2026-06-01 00:08:25 | INFO | src.nested_cv_avggrm_weighted_unified | Trial 206 | outer=4 | alpha=1.063e+05 n_pcs=4500 (pc_topk) weight_search=on
2026-06-01 00:08:25 | INFO | src.nested_cv_avggrm_weighted_unified | Trial 206 | outer=4 | weight={'name': 'linear', 'floor': 1e-06, 'clip_max': 10.0, 'min_weight': 0.41006538175869334, 'max_weight': 4.348928266355088}
[I 2026-06-01 00:08:32,823] Trial 206 finished with value: 0.1976325178825148 and parameters: {'alpha': 106276.06881972565, 'n_pcs': 4500, 'weight_scheme': 'linear', 'weight_clip_max': 10.0, 'weight_linear_min_weight': 0.41006538175869334, 'weight_linear_max_weight': 4.348928266355088}. Best is trial 41 with value: 0.19810774778548906.
2026-06-01 00:08:32 | INFO | src.nested_cv_avggrm_weighted_unified | Trial 207 | outer=4 | alpha=5.428e+04 n_pcs=4500 (pc_topk) weight_search=on
2026-06-01 00:08:32 | INFO | src.nested_cv_avggrm_weighted_unified | Trial 207 | outer=4 | weight={'name': 'linear', 'floor': 1e-06, 'clip_max': 10.0, 'min_weight': 0.41758464002548734, 'max_weight': 4.173062694680961}
2026-06-01 00:08:37 | INFO | src.nested_cv_avggrm_weighted_unified | Trial 207 | outer=4 | pruned after 6/10 inner folds (mean r=0.2009)
[I 2026-06-01 00:08:37,011] Trial 207 pruned. 
2026-06-01 00:08:37 | INFO | src.nested_cv_avggrm_weighted_unified | Trial 208 | outer=4 | alpha=8.024e+04 n_pcs=4500 (pc_topk) weight_search=on
2026-06-01 00:08:37 | INFO | src.nested_cv_avggrm_weighted_unified | Trial 208 | outer=4 | weight={'name': 'linear', 'floor': 1e-06, 'clip_max': 10.0, 'min_weight': 0.4083048979117693, 'max_weight': 4.466111088722963}
2026-06-01 00:08:41 | INFO | src.nested_cv_avggrm_weighted_unified | Trial 208 | outer=4 | pruned after 6/10 inner folds (mean r=0.2045)
[I 2026-06-01 00:08:41,166] Trial 208 pruned. 
2026-06-01 00:08:41 | INFO | src.nested_cv_avggrm_weighted_unified | Trial 209 | outer=4 | alpha=1.252e+05 n_pcs=4500 (pc_topk) weight_search=on
2026-06-01 00:08:41 | INFO | src.nested_cv_avggrm_weighted_unified | Trial 209 | outer=4 | weight={'name': 'exponential', 'floor': 1e-06, 'clip_max': None, 'beta': 1.9500292464230768}
[I 2026-06-01 00:08:48,093] Trial 209 finished with value: 0.19675914534285582 and parameters: {'alpha': 125203.5827517312, 'n_pcs': 4500, 'weight_scheme': 'exponential', 'weight_clip_max': None, 'weight_exponential_beta': 1.9500292464230768}. Best is trial 41 with value: 0.19810774778548906.
2026-06-01 00:08:48 | INFO | src.nested_cv_avggrm_weighted_unified | Trial 210 | outer=4 | alpha=6.697e+04 n_pcs=5000 (pc_topk) weight_search=on
2026-06-01 00:08:48 | INFO | src.nested_cv_avggrm_weighted_unified | Trial 210 | outer=4 | weight={'name': 'linear', 'floor': 1e-06, 'clip_max': 10.0, 'min_weight': 0.3797411988931365, 'max_weight': 2.8381068436245713}
2026-06-01 00:08:52 | INFO | src.nested_cv_avggrm_weighted_unified | Trial 210 | outer=4 | pruned after 6/10 inner folds (mean r=0.2019)
[I 2026-06-01 00:08:52,985] Trial 210 pruned. 
2026-06-01 00:08:52 | INFO | src.nested_cv_avggrm_weighted_unified | Trial 211 | outer=4 | alpha=1.025e+05 n_pcs=4500 (pc_topk) weight_search=on
2026-06-01 00:08:53 | INFO | src.nested_cv_avggrm_weighted_unified | Trial 211 | outer=4 | weight={'name': 'linear', 'floor': 1e-06, 'clip_max': 10.0, 'min_weight': 0.6281286235328665, 'max_weight': 4.338536994950286}
[I 2026-06-01 00:08:59,881] Trial 211 finished with value: 0.19738868489842193 and parameters: {'alpha': 102459.75042780286, 'n_pcs': 4500, 'weight_scheme': 'linear', 'weight_clip_max': 10.0, 'weight_linear_min_weight': 0.6281286235328665, 'weight_linear_max_weight': 4.338536994950286}. Best is trial 41 with value: 0.19810774778548906.
2026-06-01 00:08:59 | INFO | src.nested_cv_avggrm_weighted_unified | Trial 212 | outer=4 | alpha=1.011e+05 n_pcs=4500 (pc_topk) weight_search=on
2026-06-01 00:08:59 | INFO | src.nested_cv_avggrm_weighted_unified | Trial 212 | outer=4 | weight={'name': 'linear', 'floor': 1e-06, 'clip_max': 10.0, 'min_weight': 0.4958199710625243, 'max_weight': 4.307850453727299}
[I 2026-06-01 00:09:06,786] Trial 212 finished with value: 0.1976459993373239 and parameters: {'alpha': 101083.84474168222, 'n_pcs': 4500, 'weight_scheme': 'linear', 'weight_clip_max': 10.0, 'weight_linear_min_weight': 0.4958199710625243, 'weight_linear_max_weight': 4.307850453727299}. Best is trial 41 with value: 0.19810774778548906.
2026-06-01 00:09:06 | INFO | src.nested_cv_avggrm_weighted_unified | Trial 213 | outer=4 | alpha=8.652e+04 n_pcs=4500 (pc_topk) weight_search=on
2026-06-01 00:09:06 | INFO | src.nested_cv_avggrm_weighted_unified | Trial 213 | outer=4 | weight={'name': 'linear', 'floor': 1e-06, 'clip_max': 10.0, 'min_weight': 0.5046212669748531, 'max_weight': 4.309803486402475}
2026-06-01 00:09:10 | INFO | src.nested_cv_avggrm_weighted_unified | Trial 213 | outer=4 | pruned after 6/10 inner folds (mean r=0.2052)
[I 2026-06-01 00:09:10,921] Trial 213 pruned. 
2026-06-01 00:09:10 | INFO | src.nested_cv_avggrm_weighted_unified | Trial 214 | outer=4 | alpha=1.031e+05 n_pcs=4500 (pc_topk) weight_search=on
2026-06-01 00:09:10 | INFO | src.nested_cv_avggrm_weighted_unified | Trial 214 | outer=4 | weight={'name': 'linear', 'floor': 1e-06, 'clip_max': 10.0, 'min_weight': 0.814101083697945, 'max_weight': 4.396348537833632}
2026-06-01 00:09:15 | INFO | src.nested_cv_avggrm_weighted_unified | Trial 214 | outer=4 | pruned after 6/10 inner folds (mean r=0.2058)
[I 2026-06-01 00:09:15,096] Trial 214 pruned. 
2026-06-01 00:09:15 | INFO | src.nested_cv_avggrm_weighted_unified | Trial 215 | outer=4 | alpha=1.346e+05 n_pcs=4500 (pc_topk) weight_search=on
2026-06-01 00:09:15 | INFO | src.nested_cv_avggrm_weighted_unified | Trial 215 | outer=4 | weight={'name': 'linear', 'floor': 1e-06, 'clip_max': 10.0, 'min_weight': 0.47974355730649076, 'max_weight': 4.561360593360767}
[I 2026-06-01 00:09:21,975] Trial 215 finished with value: 0.19671910802237186 and parameters: {'alpha': 134629.11172805596, 'n_pcs': 4500, 'weight_scheme': 'linear', 'weight_clip_max': 10.0, 'weight_linear_min_weight': 0.47974355730649076, 'weight_linear_max_weight': 4.561360593360767}. Best is trial 41 with value: 0.19810774778548906.
2026-06-01 00:09:21 | INFO | src.nested_cv_avggrm_weighted_unified | Trial 216 | outer=4 | alpha=1.792e+05 n_pcs=4500 (pc_topk) weight_search=on
2026-06-01 00:09:21 | INFO | src.nested_cv_avggrm_weighted_unified | Trial 216 | outer=4 | weight={'name': 'linear', 'floor': 1e-06, 'clip_max': 10.0, 'min_weight': 0.44124448979755454, 'max_weight': 3.4535278205892097}
[I 2026-06-01 00:09:28,920] Trial 216 finished with value: 0.19486174007211193 and parameters: {'alpha': 179194.26962280762, 'n_pcs': 4500, 'weight_scheme': 'linear', 'weight_clip_max': 10.0, 'weight_linear_min_weight': 0.44124448979755454, 'weight_linear_max_weight': 3.4535278205892097}. Best is trial 41 with value: 0.19810774778548906.
2026-06-01 00:09:28 | INFO | src.nested_cv_avggrm_weighted_unified | Trial 217 | outer=4 | alpha=7.980e+04 n_pcs=4500 (pc_topk) weight_search=on
2026-06-01 00:09:28 | INFO | src.nested_cv_avggrm_weighted_unified | Trial 217 | outer=4 | weight={'name': 'uniform', 'floor': 1e-06, 'clip_max': 10.0}
2026-06-01 00:09:32 | INFO | src.nested_cv_avggrm_weighted_unified | Trial 217 | outer=4 | pruned after 6/10 inner folds (mean r=0.1970)
[I 2026-06-01 00:09:32,539] Trial 217 pruned. 
2026-06-01 00:09:32 | INFO | src.nested_cv_avggrm_weighted_unified | Trial 218 | outer=4 | alpha=9.712e+04 n_pcs=4500 (pc_topk) weight_search=on
2026-06-01 00:09:32 | INFO | src.nested_cv_avggrm_weighted_unified | Trial 218 | outer=4 | weight={'name': 'linear', 'floor': 1e-06, 'clip_max': None, 'min_weight': 0.5435431381053247, 'max_weight': 4.266467894800702}
2026-06-01 00:09:36 | INFO | src.nested_cv_avggrm_weighted_unified | Trial 218 | outer=4 | pruned after 6/10 inner folds (mean r=0.2058)
[I 2026-06-01 00:09:36,688] Trial 218 pruned. 
2026-06-01 00:09:36 | INFO | src.nested_cv_avggrm_weighted_unified | Trial 219 | outer=4 | alpha=6.544e+04 n_pcs=4500 (pc_topk) weight_search=on
2026-06-01 00:09:36 | INFO | src.nested_cv_avggrm_weighted_unified | Trial 219 | outer=4 | weight={'name': 'linear', 'floor': 1e-06, 'clip_max': 10.0, 'min_weight': 0.3395870314995054, 'max_weight': 4.67275546502921}
2026-06-01 00:09:40 | INFO | src.nested_cv_avggrm_weighted_unified | Trial 219 | outer=4 | pruned after 6/10 inner folds (mean r=0.2023)
[I 2026-06-01 00:09:40,848] Trial 219 pruned. 
2026-06-01 00:09:40 | INFO | src.nested_cv_avggrm_weighted_unified | Trial 220 | outer=4 | alpha=1.157e+05 n_pcs=4500 (pc_topk) weight_search=on
2026-06-01 00:09:40 | INFO | src.nested_cv_avggrm_weighted_unified | Trial 220 | outer=4 | weight={'name': 'linear', 'floor': 1e-06, 'clip_max': 10.0, 'min_weight': 0.4635337014090668, 'max_weight': 4.444986144966039}
[I 2026-06-01 00:09:47,829] Trial 220 finished with value: 0.19731256769316513 and parameters: {'alpha': 115747.67855365519, 'n_pcs': 4500, 'weight_scheme': 'linear', 'weight_clip_max': 10.0, 'weight_linear_min_weight': 0.4635337014090668, 'weight_linear_max_weight': 4.444986144966039}. Best is trial 41 with value: 0.19810774778548906.
2026-06-01 00:09:47 | INFO | src.nested_cv_avggrm_weighted_unified | Trial 221 | outer=4 | alpha=9.965e+04 n_pcs=4500 (pc_topk) weight_search=on
2026-06-01 00:09:47 | INFO | src.nested_cv_avggrm_weighted_unified | Trial 221 | outer=4 | weight={'name': 'linear', 'floor': 1e-06, 'clip_max': 10.0, 'min_weight': 0.6008030873219753, 'max_weight': 4.127145373298039}
2026-06-01 00:09:52 | INFO | src.nested_cv_avggrm_weighted_unified | Trial 221 | outer=4 | pruned after 6/10 inner folds (mean r=0.2059)
[I 2026-06-01 00:09:52,037] Trial 221 pruned. 
2026-06-01 00:09:52 | INFO | src.nested_cv_avggrm_weighted_unified | Trial 222 | outer=4 | alpha=8.381e+04 n_pcs=4500 (pc_topk) weight_search=on
2026-06-01 00:09:52 | INFO | src.nested_cv_avggrm_weighted_unified | Trial 222 | outer=4 | weight={'name': 'linear', 'floor': 1e-06, 'clip_max': 10.0, 'min_weight': 0.487119342764975, 'max_weight': 4.3451185477438825}
2026-06-01 00:09:56 | INFO | src.nested_cv_avggrm_weighted_unified | Trial 222 | outer=4 | pruned after 6/10 inner folds (mean r=0.2049)
[I 2026-06-01 00:09:56,238] Trial 222 pruned. 
2026-06-01 00:09:56 | INFO | src.nested_cv_avggrm_weighted_unified | Trial 223 | outer=4 | alpha=1.133e+05 n_pcs=4500 (pc_topk) weight_search=on
2026-06-01 00:09:56 | INFO | src.nested_cv_avggrm_weighted_unified | Trial 223 | outer=4 | weight={'name': 'linear', 'floor': 1e-06, 'clip_max': 10.0, 'min_weight': 0.624134156943932, 'max_weight': 4.238952944448381}
[I 2026-06-01 00:10:03,220] Trial 223 finished with value: 0.1969970915460853 and parameters: {'alpha': 113280.36271055932, 'n_pcs': 4500, 'weight_scheme': 'linear', 'weight_clip_max': 10.0, 'weight_linear_min_weight': 0.624134156943932, 'weight_linear_max_weight': 4.238952944448381}. Best is trial 41 with value: 0.19810774778548906.
2026-06-01 00:10:03 | INFO | src.nested_cv_avggrm_weighted_unified | Trial 224 | outer=4 | alpha=1.408e+05 n_pcs=4500 (pc_topk) weight_search=on
2026-06-01 00:10:03 | INFO | src.nested_cv_avggrm_weighted_unified | Trial 224 | outer=4 | weight={'name': 'linear', 'floor': 1e-06, 'clip_max': 10.0, 'min_weight': 0.5139495022777518, 'max_weight': 4.015039448423146}
[I 2026-06-01 00:10:10,208] Trial 224 finished with value: 0.19623122436183765 and parameters: {'alpha': 140770.99744862004, 'n_pcs': 4500, 'weight_scheme': 'linear', 'weight_clip_max': 10.0, 'weight_linear_min_weight': 0.5139495022777518, 'weight_linear_max_weight': 4.015039448423146}. Best is trial 41 with value: 0.19810774778548906.
2026-06-01 00:10:10 | INFO | src.nested_cv_avggrm_weighted_unified | Trial 225 | outer=4 | alpha=9.649e+04 n_pcs=4500 (pc_topk) weight_search=on
2026-06-01 00:10:10 | INFO | src.nested_cv_avggrm_weighted_unified | Trial 225 | outer=4 | weight={'name': 'linear', 'floor': 1e-06, 'clip_max': 10.0, 'min_weight': 0.059788123212571265, 'max_weight': 3.6403891474124324}
2026-06-01 00:10:14 | INFO | src.nested_cv_avggrm_weighted_unified | Trial 225 | outer=4 | pruned after 6/10 inner folds (mean r=0.2045)
[I 2026-06-01 00:10:14,376] Trial 225 pruned. 
2026-06-01 00:10:14 | INFO | src.nested_cv_avggrm_weighted_unified | Trial 226 | outer=4 | alpha=8.033e+04 n_pcs=4500 (pc_topk) weight_search=on
2026-06-01 00:10:14 | INFO | src.nested_cv_avggrm_weighted_unified | Trial 226 | outer=4 | weight={'name': 'linear', 'floor': 1e-06, 'clip_max': None, 'min_weight': 0.6471375746646693, 'max_weight': 3.2784562996606668}
2026-06-01 00:10:18 | INFO | src.nested_cv_avggrm_weighted_unified | Trial 226 | outer=4 | pruned after 6/10 inner folds (mean r=0.2047)
[I 2026-06-01 00:10:18,581] Trial 226 pruned. 
2026-06-01 00:10:18 | INFO | src.nested_cv_avggrm_weighted_unified | Trial 227 | outer=4 | alpha=6.900e+04 n_pcs=4500 (pc_topk) weight_search=on
2026-06-01 00:10:18 | INFO | src.nested_cv_avggrm_weighted_unified | Trial 227 | outer=4 | weight={'name': 'linear', 'floor': 1e-06, 'clip_max': 3.0, 'min_weight': 0.5771659085476961, 'max_weight': 4.309073806757679}
2026-06-01 00:10:22 | INFO | src.nested_cv_avggrm_weighted_unified | Trial 227 | outer=4 | pruned after 6/10 inner folds (mean r=0.2030)
[I 2026-06-01 00:10:22,792] Trial 227 pruned. 
2026-06-01 00:10:22 | INFO | src.nested_cv_avggrm_weighted_unified | Trial 228 | outer=4 | alpha=1.092e+05 n_pcs=4500 (pc_topk) weight_search=on
2026-06-01 00:10:22 | INFO | src.nested_cv_avggrm_weighted_unified | Trial 228 | outer=4 | weight={'name': 'linear', 'floor': 1e-06, 'clip_max': 10.0, 'min_weight': 0.3923062488057395, 'max_weight': 4.986537028715837}
