[I 2026-06-01 17:02:40,825] Trial 9 finished with value: 0.08564685545775964 and parameters: {'alpha': 1067.2105048492429, 'n_pcs': 4000, 'iw_method': 'pc_logistic', 'iw_clip_max': 4.0, 'iw_prob_clip': 0.003002704300062754, 'iw_n_components': 10, 'iw_logistic_c': 4.32601466983518e-06, 'iw_pca_fit': 'combined', 'iw_solver': 'lbfgs', 'iw_rho': 1.0}. Best is trial 1 with value: 0.18938351819175628.
2026-06-01 17:02:40 | INFO | Trial 10 | outer=4 | alpha=1.150e+04 n_pcs=5000 (pc_topk) weight={'name': 'uniform'}
[I 2026-06-01 17:02:52,205] Trial 10 finished with value: 0.18467946925815718 and parameters: {'alpha': 11501.099698953694, 'n_pcs': 5000, 'iw_method': 'uniform'}. Best is trial 1 with value: 0.18938351819175628.
2026-06-01 17:02:52 | INFO | Trial 11 | outer=4 | alpha=1.855e+04 n_pcs=5000 (pc_topk) weight={'name': 'uniform'}
[I 2026-06-01 17:03:02,713] Trial 11 finished with value: 0.1899621598370535 and parameters: {'alpha': 18554.940984053464, 'n_pcs': 5000, 'iw_method': 'uniform'}. Best is trial 11 with value: 0.1899621598370535.
2026-06-01 17:03:02 | INFO | Trial 12 | outer=4 | alpha=1.245e+04 n_pcs=5000 (pc_topk) weight={'name': 'uniform'}
[I 2026-06-01 17:03:13,608] Trial 12 finished with value: 0.18575087282574937 and parameters: {'alpha': 12449.4168314059, 'n_pcs': 5000, 'iw_method': 'uniform'}. Best is trial 11 with value: 0.1899621598370535.
2026-06-01 17:03:13 | INFO | Trial 13 | outer=4 | alpha=1.460e+04 n_pcs=4500 (pc_topk) weight={'name': 'uniform'}
[I 2026-06-01 17:03:22,988] Trial 13 finished with value: 0.18924182289119412 and parameters: {'alpha': 14604.768536146159, 'n_pcs': 4500, 'iw_method': 'uniform'}. Best is trial 11 with value: 0.1899621598370535.
2026-06-01 17:03:22 | INFO | Trial 14 | outer=4 | alpha=6.106e+05 n_pcs=2500 (pc_topk) weight={'name': 'uniform'}
[I 2026-06-01 17:03:27,053] Trial 14 finished with value: 0.1738393177558848 and parameters: {'alpha': 610573.2699796738, 'n_pcs': 2500, 'iw_method': 'uniform'}. Best is trial 11 with value: 0.1899621598370535.
2026-06-01 17:03:27 | INFO | Trial 15 | outer=4 | alpha=2.766e+04 n_pcs=5000 (pc_topk) weight={'name': 'uniform'}
[I 2026-06-01 17:03:38,179] Trial 15 finished with value: 0.1922287304944107 and parameters: {'alpha': 27663.10398873833, 'n_pcs': 5000, 'iw_method': 'uniform'}. Best is trial 15 with value: 0.1922287304944107.
2026-06-01 17:03:38 | INFO | Trial 16 | outer=4 | alpha=4.491e+03 n_pcs=4000 (pc_topk) weight={'name': 'uniform'}
[I 2026-06-01 17:03:45,274] Trial 16 finished with value: 0.14508740652883062 and parameters: {'alpha': 4491.306239445428, 'n_pcs': 4000, 'iw_method': 'uniform'}. Best is trial 15 with value: 0.1922287304944107.
2026-06-01 17:03:45 | INFO | Trial 17 | outer=4 | alpha=5.156e+04 n_pcs=3000 (pc_topk) weight={'name': 'uniform'}
[I 2026-06-01 17:03:50,116] Trial 17 finished with value: 0.19062282806882308 and parameters: {'alpha': 51562.72619089577, 'n_pcs': 3000, 'iw_method': 'uniform'}. Best is trial 15 with value: 0.1922287304944107.
2026-06-01 17:03:50 | INFO | Trial 18 | outer=4 | alpha=8.928e+05 n_pcs=3000 (pc_topk) weight={'name': 'uniform'}
[I 2026-06-01 17:03:55,292] Trial 18 finished with value: 0.16825278168208324 and parameters: {'alpha': 892815.271777451, 'n_pcs': 3000, 'iw_method': 'uniform'}. Best is trial 15 with value: 0.1922287304944107.
2026-06-01 17:03:55 | INFO | Trial 19 | outer=4 | alpha=3.714e+04 n_pcs=2000 (pc_topk) weight={'name': 'uniform'}
[I 2026-06-01 17:03:58,778] Trial 19 finished with value: 0.18662785552843492 and parameters: {'alpha': 37135.95011052599, 'n_pcs': 2000, 'iw_method': 'uniform'}. Best is trial 15 with value: 0.1922287304944107.
2026-06-01 17:03:58 | INFO | Trial 20 | outer=4 | alpha=1.915e+06 n_pcs=2500 (pc_topk) weight={'name': 'uniform'}
[I 2026-06-01 17:04:03,131] Trial 20 finished with value: 0.1663205931084074 and parameters: {'alpha': 1914531.6708431945, 'n_pcs': 2500, 'iw_method': 'uniform'}. Best is trial 15 with value: 0.1922287304944107.
2026-06-01 17:04:03 | INFO | Trial 21 | outer=4 | alpha=4.025e+04 n_pcs=4500 (pc_topk) weight={'name': 'uniform'}
[I 2026-06-01 17:04:12,671] Trial 21 finished with value: 0.19432094654989254 and parameters: {'alpha': 40253.03114396932, 'n_pcs': 4500, 'iw_method': 'uniform'}. Best is trial 21 with value: 0.19432094654989254.
2026-06-01 17:04:12 | INFO | Trial 22 | outer=4 | alpha=4.118e+04 n_pcs=4500 (pc_topk) weight={'name': 'uniform'}
[I 2026-06-01 17:04:22,031] Trial 22 finished with value: 0.19428773442516153 and parameters: {'alpha': 41180.36295870189, 'n_pcs': 4500, 'iw_method': 'uniform'}. Best is trial 21 with value: 0.19432094654989254.
2026-06-01 17:04:22 | INFO | Trial 23 | outer=4 | alpha=3.888e+04 n_pcs=4500 (pc_topk) weight={'name': 'uniform'}
[I 2026-06-01 17:04:32,009] Trial 23 finished with value: 0.19436024778838998 and parameters: {'alpha': 38875.98928837552, 'n_pcs': 4500, 'iw_method': 'uniform'}. Best is trial 23 with value: 0.19436024778838998.
2026-06-01 17:04:32 | INFO | Trial 24 | outer=4 | alpha=5.323e+03 n_pcs=3500 (pc_topk) weight={'name': 'uniform'}
[I 2026-06-01 17:04:38,334] Trial 24 finished with value: 0.14598944011020437 and parameters: {'alpha': 5322.9876789354275, 'n_pcs': 3500, 'iw_method': 'uniform'}. Best is trial 23 with value: 0.19436024778838998.
2026-06-01 17:04:38 | INFO | Trial 25 | outer=4 | alpha=2.289e+05 n_pcs=4500 (pc_topk) weight={'name': 'uniform'}
[I 2026-06-01 17:04:50,485] Trial 25 finished with value: 0.18017592472579824 and parameters: {'alpha': 228903.23479772382, 'n_pcs': 4500, 'iw_method': 'uniform'}. Best is trial 23 with value: 0.19436024778838998.
2026-06-01 17:04:50 | INFO | Trial 26 | outer=4 | alpha=5.928e+04 n_pcs=4500 (pc_topk) weight={'name': 'pc_logistic', 'floor': 1e-06, 'clip_max': 2.5, 'prob_clip': 0.04783268173298191, 'n_components': 40, 'logistic_c': 0.0034285114017368, 'pca_fit': 'combined', 'solver': 'lbfgs', 'max_iter': 2000, 'fit_intercept': True, 'standardize_with_source': True, 'rho': 0.5}
[I 2026-06-01 17:05:29,319] Trial 26 finished with value: 0.19410176238921872 and parameters: {'alpha': 59279.67532578145, 'n_pcs': 4500, 'iw_method': 'pc_logistic', 'iw_clip_max': 2.5, 'iw_prob_clip': 0.04783268173298191, 'iw_n_components': 40, 'iw_logistic_c': 0.0034285114017368, 'iw_pca_fit': 'combined', 'iw_solver': 'lbfgs', 'iw_rho': 0.5}. Best is trial 23 with value: 0.19436024778838998.
2026-06-01 17:05:29 | INFO | Trial 27 | outer=4 | alpha=6.659e+03 n_pcs=3500 (pc_topk) weight={'name': 'uniform'}
[I 2026-06-01 17:05:35,490] Trial 27 finished with value: 0.15419890570164504 and parameters: {'alpha': 6658.578430270923, 'n_pcs': 3500, 'iw_method': 'uniform'}. Best is trial 23 with value: 0.19436024778838998.
2026-06-01 17:05:35 | INFO | Trial 28 | outer=4 | alpha=4.196e+05 n_pcs=4500 (pc_topk) weight={'name': 'uniform'}
[I 2026-06-01 17:05:57,247] Trial 28 finished with value: 0.17361707057361006 and parameters: {'alpha': 419589.36516276764, 'n_pcs': 4500, 'iw_method': 'uniform'}. Best is trial 23 with value: 0.19436024778838998.
2026-06-01 17:05:57 | INFO | Trial 29 | outer=4 | alpha=1.034e+05 n_pcs=4000 (pc_topk) weight={'name': 'uniform'}
[I 2026-06-01 17:06:05,096] Trial 29 finished with value: 0.18766123941140875 and parameters: {'alpha': 103445.20452394287, 'n_pcs': 4000, 'iw_method': 'uniform'}. Best is trial 23 with value: 0.19436024778838998.
2026-06-01 17:06:05 | INFO | Trial 30 | outer=4 | alpha=3.163e+04 n_pcs=4000 (pc_topk) weight={'name': 'uniform'}
[I 2026-06-01 17:06:12,590] Trial 30 finished with value: 0.19056662278443465 and parameters: {'alpha': 31629.508934289726, 'n_pcs': 4000, 'iw_method': 'uniform'}. Best is trial 23 with value: 0.19436024778838998.
2026-06-01 17:06:12 | INFO | Trial 31 | outer=4 | alpha=6.935e+04 n_pcs=4500 (pc_topk) weight={'name': 'pc_logistic', 'floor': 1e-06, 'clip_max': 2.5, 'prob_clip': 0.0455220199863459, 'n_components': 40, 'logistic_c': 0.0044094779848786745, 'pca_fit': 'combined', 'solver': 'lbfgs', 'max_iter': 2000, 'fit_intercept': True, 'standardize_with_source': True, 'rho': 0.5}
[I 2026-06-01 17:06:32,027] Trial 31 finished with value: 0.19380664538991693 and parameters: {'alpha': 69345.50645191173, 'n_pcs': 4500, 'iw_method': 'pc_logistic', 'iw_clip_max': 2.5, 'iw_prob_clip': 0.0455220199863459, 'iw_n_components': 40, 'iw_logistic_c': 0.0044094779848786745, 'iw_pca_fit': 'combined', 'iw_solver': 'lbfgs', 'iw_rho': 0.5}. Best is trial 23 with value: 0.19436024778838998.
2026-06-01 17:06:32 | INFO | Trial 32 | outer=4 | alpha=8.250e+04 n_pcs=4500 (pc_topk) weight={'name': 'pc_logistic', 'floor': 1e-06, 'clip_max': 2.5, 'prob_clip': 0.01204638538839298, 'n_components': 40, 'logistic_c': 0.00016147604053110286, 'pca_fit': 'combined', 'solver': 'lbfgs', 'max_iter': 2000, 'fit_intercept': True, 'standardize_with_source': True, 'rho': 0.85}
[I 2026-06-01 17:06:48,730] Trial 32 finished with value: 0.19558009481403635 and parameters: {'alpha': 82495.9493996526, 'n_pcs': 4500, 'iw_method': 'pc_logistic', 'iw_clip_max': 2.5, 'iw_prob_clip': 0.01204638538839298, 'iw_n_components': 40, 'iw_logistic_c': 0.00016147604053110286, 'iw_pca_fit': 'combined', 'iw_solver': 'lbfgs', 'iw_rho': 0.85}. Best is trial 32 with value: 0.19558009481403635.
2026-06-01 17:06:48 | INFO | Trial 33 | outer=4 | alpha=1.506e+05 n_pcs=4500 (pc_topk) weight={'name': 'pc_logistic', 'floor': 1e-06, 'clip_max': 7.0, 'prob_clip': 0.011736541942042792, 'n_components': 100, 'logistic_c': 2.8258730115974314e-05, 'pca_fit': 'combined', 'solver': 'lbfgs', 'max_iter': 2000, 'fit_intercept': True, 'standardize_with_source': True, 'rho': 0.85}
[I 2026-06-01 17:07:04,577] Trial 33 finished with value: 0.19504964273061126 and parameters: {'alpha': 150552.17297118207, 'n_pcs': 4500, 'iw_method': 'pc_logistic', 'iw_clip_max': 7.0, 'iw_prob_clip': 0.011736541942042792, 'iw_n_components': 100, 'iw_logistic_c': 2.8258730115974314e-05, 'iw_pca_fit': 'combined', 'iw_solver': 'lbfgs', 'iw_rho': 0.85}. Best is trial 32 with value: 0.19558009481403635.
2026-06-01 17:07:04 | INFO | Trial 34 | outer=4 | alpha=1.960e+05 n_pcs=4000 (pc_topk) weight={'name': 'pc_logistic', 'floor': 1e-06, 'clip_max': 7.0, 'prob_clip': 0.011248847173191077, 'n_components': 100, 'logistic_c': 3.1787044934350964e-05, 'pca_fit': 'combined', 'solver': 'lbfgs', 'max_iter': 2000, 'fit_intercept': True, 'standardize_with_source': True, 'rho': 0.85}
[I 2026-06-01 17:07:17,620] Trial 34 finished with value: 0.1936865584346536 and parameters: {'alpha': 195979.40129955474, 'n_pcs': 4000, 'iw_method': 'pc_logistic', 'iw_clip_max': 7.0, 'iw_prob_clip': 0.011248847173191077, 'iw_n_components': 100, 'iw_logistic_c': 3.1787044934350964e-05, 'iw_pca_fit': 'combined', 'iw_solver': 'lbfgs', 'iw_rho': 0.85}. Best is trial 32 with value: 0.19558009481403635.
2026-06-01 17:07:17 | INFO | Trial 35 | outer=4 | alpha=1.263e+05 n_pcs=3500 (pc_topk) weight={'name': 'pc_logistic', 'floor': 1e-06, 'clip_max': 7.0, 'prob_clip': 0.011484988624405322, 'n_components': 100, 'logistic_c': 1.6689303983896237e-05, 'pca_fit': 'combined', 'solver': 'lbfgs', 'max_iter': 2000, 'fit_intercept': True, 'standardize_with_source': True, 'rho': 0.85}
[I 2026-06-01 17:07:28,782] Trial 35 finished with value: 0.1949576725319373 and parameters: {'alpha': 126291.16018589192, 'n_pcs': 3500, 'iw_method': 'pc_logistic', 'iw_clip_max': 7.0, 'iw_prob_clip': 0.011484988624405322, 'iw_n_components': 100, 'iw_logistic_c': 1.6689303983896237e-05, 'iw_pca_fit': 'combined', 'iw_solver': 'lbfgs', 'iw_rho': 0.85}. Best is trial 32 with value: 0.19558009481403635.
2026-06-01 17:07:28 | INFO | Trial 36 | outer=4 | alpha=1.176e+05 n_pcs=3500 (pc_topk) weight={'name': 'pc_logistic', 'floor': 1e-06, 'clip_max': 7.0, 'prob_clip': 0.01079300774956085, 'n_components': 100, 'logistic_c': 1.7045571870614855e-05, 'pca_fit': 'combined', 'solver': 'lbfgs', 'max_iter': 2000, 'fit_intercept': True, 'standardize_with_source': True, 'rho': 0.85}
[I 2026-06-01 17:07:39,277] Trial 36 finished with value: 0.19480309462242568 and parameters: {'alpha': 117590.63447856592, 'n_pcs': 3500, 'iw_method': 'pc_logistic', 'iw_clip_max': 7.0, 'iw_prob_clip': 0.01079300774956085, 'iw_n_components': 100, 'iw_logistic_c': 1.7045571870614855e-05, 'iw_pca_fit': 'combined', 'iw_solver': 'lbfgs', 'iw_rho': 0.85}. Best is trial 32 with value: 0.19558009481403635.
2026-06-01 17:07:39 | INFO | Trial 37 | outer=4 | alpha=1.144e+05 n_pcs=3500 (pc_topk) weight={'name': 'pc_logistic', 'floor': 1e-06, 'clip_max': 7.0, 'prob_clip': 0.011018056813088394, 'n_components': 100, 'logistic_c': 1.6008451328358326e-05, 'pca_fit': 'combined', 'solver': 'lbfgs', 'max_iter': 2000, 'fit_intercept': True, 'standardize_with_source': True, 'rho': 0.85}
[I 2026-06-01 17:07:49,630] Trial 37 finished with value: 0.1951249860030676 and parameters: {'alpha': 114412.94032715351, 'n_pcs': 3500, 'iw_method': 'pc_logistic', 'iw_clip_max': 7.0, 'iw_prob_clip': 0.011018056813088394, 'iw_n_components': 100, 'iw_logistic_c': 1.6008451328358326e-05, 'iw_pca_fit': 'combined', 'iw_solver': 'lbfgs', 'iw_rho': 0.85}. Best is trial 32 with value: 0.19558009481403635.
2026-06-01 17:07:49 | INFO | Trial 38 | outer=4 | alpha=1.338e+06 n_pcs=3500 (pc_topk) weight={'name': 'pc_logistic', 'floor': 1e-06, 'clip_max': 7.0, 'prob_clip': 0.012175617466373858, 'n_components': 100, 'logistic_c': 0.00017253025449834135, 'pca_fit': 'combined', 'solver': 'lbfgs', 'max_iter': 2000, 'fit_intercept': True, 'standardize_with_source': True, 'rho': 0.85}
[I 2026-06-01 17:08:02,918] Trial 38 finished with value: 0.18337927121515066 and parameters: {'alpha': 1338037.1564485563, 'n_pcs': 3500, 'iw_method': 'pc_logistic', 'iw_clip_max': 7.0, 'iw_prob_clip': 0.012175617466373858, 'iw_n_components': 100, 'iw_logistic_c': 0.00017253025449834135, 'iw_pca_fit': 'combined', 'iw_solver': 'lbfgs', 'iw_rho': 0.85}. Best is trial 32 with value: 0.19558009481403635.
2026-06-01 17:08:02 | INFO | Trial 39 | outer=4 | alpha=3.209e+05 n_pcs=3000 (pc_topk) weight={'name': 'pc_logistic', 'floor': 1e-06, 'clip_max': 7.0, 'prob_clip': 0.021558946668532943, 'n_components': 100, 'logistic_c': 2.9772125152223002e-06, 'pca_fit': 'combined', 'solver': 'lbfgs', 'max_iter': 2000, 'fit_intercept': True, 'standardize_with_source': True, 'rho': 0.85}
[I 2026-06-01 17:08:12,492] Trial 39 finished with value: 0.184620651665584 and parameters: {'alpha': 320852.6597747601, 'n_pcs': 3000, 'iw_method': 'pc_logistic', 'iw_clip_max': 7.0, 'iw_prob_clip': 0.021558946668532943, 'iw_n_components': 100, 'iw_logistic_c': 2.9772125152223002e-06, 'iw_pca_fit': 'combined', 'iw_solver': 'lbfgs', 'iw_rho': 0.85}. Best is trial 32 with value: 0.19558009481403635.
2026-06-01 17:08:12 | INFO | Trial 40 | outer=4 | alpha=1.629e+05 n_pcs=2000 (pc_topk) weight={'name': 'pc_logistic', 'floor': 1e-06, 'clip_max': 7.0, 'prob_clip': 0.007359213645192276, 'n_components': 100, 'logistic_c': 7.844732530820693e-05, 'pca_fit': 'combined', 'solver': 'lbfgs', 'max_iter': 2000, 'fit_intercept': True, 'standardize_with_source': True, 'rho': 0.85}
[I 2026-06-01 17:08:21,897] Trial 40 finished with value: 0.19008682320117198 and parameters: {'alpha': 162910.67886780616, 'n_pcs': 2000, 'iw_method': 'pc_logistic', 'iw_clip_max': 7.0, 'iw_prob_clip': 0.007359213645192276, 'iw_n_components': 100, 'iw_logistic_c': 7.844732530820693e-05, 'iw_pca_fit': 'combined', 'iw_solver': 'lbfgs', 'iw_rho': 0.85}. Best is trial 32 with value: 0.19558009481403635.
2026-06-01 17:08:21 | INFO | Trial 41 | outer=4 | alpha=1.183e+05 n_pcs=3500 (pc_topk) weight={'name': 'pc_logistic', 'floor': 1e-06, 'clip_max': 7.0, 'prob_clip': 0.009560023462991308, 'n_components': 100, 'logistic_c': 8.43095019210626e-06, 'pca_fit': 'combined', 'solver': 'lbfgs', 'max_iter': 2000, 'fit_intercept': True, 'standardize_with_source': True, 'rho': 0.85}
[I 2026-06-01 17:08:33,446] Trial 41 finished with value: 0.1945038705023489 and parameters: {'alpha': 118329.05719683295, 'n_pcs': 3500, 'iw_method': 'pc_logistic', 'iw_clip_max': 7.0, 'iw_prob_clip': 0.009560023462991308, 'iw_n_components': 100, 'iw_logistic_c': 8.43095019210626e-06, 'iw_pca_fit': 'combined', 'iw_solver': 'lbfgs', 'iw_rho': 0.85}. Best is trial 32 with value: 0.19558009481403635.
2026-06-01 17:08:33 | INFO | Trial 42 | outer=4 | alpha=7.785e+04 n_pcs=3500 (pc_topk) weight={'name': 'pc_logistic', 'floor': 1e-06, 'clip_max': 7.0, 'prob_clip': 0.019399022131768816, 'n_components': 100, 'logistic_c': 1.527624677332058e-05, 'pca_fit': 'combined', 'solver': 'lbfgs', 'max_iter': 2000, 'fit_intercept': True, 'standardize_with_source': True, 'rho': 0.85}
[I 2026-06-01 17:08:44,922] Trial 42 finished with value: 0.19536975754523112 and parameters: {'alpha': 77848.95226119252, 'n_pcs': 3500, 'iw_method': 'pc_logistic', 'iw_clip_max': 7.0, 'iw_prob_clip': 0.019399022131768816, 'iw_n_components': 100, 'iw_logistic_c': 1.527624677332058e-05, 'iw_pca_fit': 'combined', 'iw_solver': 'lbfgs', 'iw_rho': 0.85}. Best is trial 32 with value: 0.19558009481403635.
2026-06-01 17:08:44 | INFO | Trial 43 | outer=4 | alpha=8.519e+04 n_pcs=4000 (pc_topk) weight={'name': 'pc_logistic', 'floor': 1e-06, 'clip_max': 7.0, 'prob_clip': 0.02415264793701674, 'n_components': 100, 'logistic_c': 6.509577911250786e-07, 'pca_fit': 'combined', 'solver': 'lbfgs', 'max_iter': 2000, 'fit_intercept': True, 'standardize_with_source': True, 'rho': 0.85}
[I 2026-06-01 17:09:01,043] Trial 43 finished with value: 0.19060771370623297 and parameters: {'alpha': 85185.41710307923, 'n_pcs': 4000, 'iw_method': 'pc_logistic', 'iw_clip_max': 7.0, 'iw_prob_clip': 0.02415264793701674, 'iw_n_components': 100, 'iw_logistic_c': 6.509577911250786e-07, 'iw_pca_fit': 'combined', 'iw_solver': 'lbfgs', 'iw_rho': 0.85}. Best is trial 32 with value: 0.19558009481403635.
2026-06-01 17:09:01 | INFO | Trial 44 | outer=4 | alpha=4.358e+05 n_pcs=3000 (pc_topk) weight={'name': 'pc_logistic', 'floor': 1e-06, 'clip_max': 7.0, 'prob_clip': 0.006237829606699209, 'n_components': 40, 'logistic_c': 0.00021298878983557517, 'pca_fit': 'combined', 'solver': 'lbfgs', 'max_iter': 2000, 'fit_intercept': True, 'standardize_with_source': True, 'rho': 0.85}
[I 2026-06-01 17:09:19,993] Trial 44 finished with value: 0.1856118597912501 and parameters: {'alpha': 435809.04829893104, 'n_pcs': 3000, 'iw_method': 'pc_logistic', 'iw_clip_max': 7.0, 'iw_prob_clip': 0.006237829606699209, 'iw_n_components': 40, 'iw_logistic_c': 0.00021298878983557517, 'iw_pca_fit': 'combined', 'iw_solver': 'lbfgs', 'iw_rho': 0.85}. Best is trial 32 with value: 0.19558009481403635.
2026-06-01 17:09:20 | INFO | Trial 45 | outer=4 | alpha=2.452e+05 n_pcs=2500 (pc_topk) weight={'name': 'pc_logistic', 'floor': 1e-06, 'clip_max': 12.0, 'prob_clip': 0.015236656478635004, 'n_components': 100, 'logistic_c': 2.257675633944114e-05, 'pca_fit': 'combined', 'solver': 'lbfgs', 'max_iter': 2000, 'fit_intercept': True, 'standardize_with_source': True, 'rho': 0.85}
[I 2026-06-01 17:09:30,341] Trial 45 finished with value: 0.19145567638423333 and parameters: {'alpha': 245186.50637255787, 'n_pcs': 2500, 'iw_method': 'pc_logistic', 'iw_clip_max': 12.0, 'iw_prob_clip': 0.015236656478635004, 'iw_n_components': 100, 'iw_logistic_c': 2.257675633944114e-05, 'iw_pca_fit': 'combined', 'iw_solver': 'lbfgs', 'iw_rho': 0.85}. Best is trial 32 with value: 0.19558009481403635.
2026-06-01 17:09:30 | INFO | Trial 46 | outer=4 | alpha=2.023e+04 n_pcs=4000 (pc_topk) weight={'name': 'pc_logistic', 'floor': 1e-06, 'clip_max': 4.0, 'prob_clip': 0.027298845945349388, 'n_components': 100, 'logistic_c': 0.0007797535305432982, 'pca_fit': 'combined', 'solver': 'lbfgs', 'max_iter': 2000, 'fit_intercept': True, 'standardize_with_source': True, 'rho': 0.85}
[I 2026-06-01 17:09:52,722] Trial 46 finished with value: 0.18511396703205701 and parameters: {'alpha': 20233.56818967125, 'n_pcs': 4000, 'iw_method': 'pc_logistic', 'iw_clip_max': 4.0, 'iw_prob_clip': 0.027298845945349388, 'iw_n_components': 100, 'iw_logistic_c': 0.0007797535305432982, 'iw_pca_fit': 'combined', 'iw_solver': 'lbfgs', 'iw_rho': 0.85}. Best is trial 32 with value: 0.19558009481403635.
2026-06-01 17:09:52 | INFO | Trial 47 | outer=4 | alpha=1.592e+05 n_pcs=3500 (pc_topk) weight={'name': 'pc_logistic', 'floor': 1e-06, 'clip_max': 1.5, 'prob_clip': 0.007724883351327594, 'n_components': 20, 'logistic_c': 2.0835508684090037e-06, 'pca_fit': 'combined', 'solver': 'lbfgs', 'max_iter': 2000, 'fit_intercept': True, 'standardize_with_source': True, 'rho': 0.85}
[I 2026-06-01 17:10:04,092] Trial 47 finished with value: 0.18872049592358403 and parameters: {'alpha': 159223.66394946168, 'n_pcs': 3500, 'iw_method': 'pc_logistic', 'iw_clip_max': 1.5, 'iw_prob_clip': 0.007724883351327594, 'iw_n_components': 20, 'iw_logistic_c': 2.0835508684090037e-06, 'iw_pca_fit': 'combined', 'iw_solver': 'lbfgs', 'iw_rho': 0.85}. Best is trial 32 with value: 0.19558009481403635.
2026-06-01 17:10:04 | INFO | Trial 48 | outer=4 | alpha=8.146e+04 n_pcs=5000 (pc_topk) weight={'name': 'pc_logistic', 'floor': 1e-06, 'clip_max': 2.5, 'prob_clip': 0.015461424469625245, 'n_components': 10, 'logistic_c': 3.755645798800076e-05, 'pca_fit': 'combined', 'solver': 'lbfgs', 'max_iter': 2000, 'fit_intercept': True, 'standardize_with_source': True, 'rho': 0.7}
