[I 2026-06-01 00:55:21,042] Trial 177 finished with value: 0.23794163302424254 and parameters: {'alpha': 171231.91887107235, 'n_pcs': 4000, 'weight_scheme': 'exponential', 'weight_clip_max': 3.0, 'weight_exponential_beta': 2.888935467628807}. Best is trial 152 with value: 0.23807568909916635.
2026-06-01 00:55:21 | INFO | src.nested_cv_avggrm_weighted_unified | Trial 178 | outer=6 | alpha=9.433e+04 n_pcs=2500 (pc_topk) weight_search=on
2026-06-01 00:55:21 | INFO | src.nested_cv_avggrm_weighted_unified | Trial 178 | outer=6 | weight={'name': 'exponential', 'floor': 1e-06, 'clip_max': 3.0, 'beta': 2.5196203383572944}
2026-06-01 00:55:22 | INFO | src.nested_cv_avggrm_weighted_unified | Trial 178 | outer=6 | pruned after 7/10 inner folds (mean r=0.2581)
[I 2026-06-01 00:55:22,884] Trial 178 pruned. 
2026-06-01 00:55:22 | INFO | src.nested_cv_avggrm_weighted_unified | Trial 179 | outer=6 | alpha=1.655e+05 n_pcs=4000 (pc_topk) weight_search=on
2026-06-01 00:55:22 | INFO | src.nested_cv_avggrm_weighted_unified | Trial 179 | outer=6 | weight={'name': 'linear', 'floor': 1e-06, 'clip_max': 3.0, 'min_weight': 0.9796856115298678, 'max_weight': 3.9434257150967347}
2026-06-01 00:55:26 | INFO | src.nested_cv_avggrm_weighted_unified | Trial 179 | outer=6 | pruned after 7/10 inner folds (mean r=0.2627)
[I 2026-06-01 00:55:26,537] Trial 179 pruned. 
2026-06-01 00:55:26 | INFO | src.nested_cv_avggrm_weighted_unified | Trial 180 | outer=6 | alpha=1.393e+05 n_pcs=4500 (pc_topk) weight_search=on
2026-06-01 00:55:26 | INFO | src.nested_cv_avggrm_weighted_unified | Trial 180 | outer=6 | weight={'name': 'exponential', 'floor': 1e-06, 'clip_max': 3.0, 'beta': 2.9157036806125034}
2026-06-01 00:55:30 | INFO | src.nested_cv_avggrm_weighted_unified | Trial 180 | outer=6 | pruned after 7/10 inner folds (mean r=0.2642)
[I 2026-06-01 00:55:30,983] Trial 180 pruned. 
2026-06-01 00:55:30 | INFO | src.nested_cv_avggrm_weighted_unified | Trial 181 | outer=6 | alpha=1.806e+05 n_pcs=4000 (pc_topk) weight_search=on
2026-06-01 00:55:30 | INFO | src.nested_cv_avggrm_weighted_unified | Trial 181 | outer=6 | weight={'name': 'exponential', 'floor': 1e-06, 'clip_max': 3.0, 'beta': 2.7482435067456397}
[I 2026-06-01 00:55:36,253] Trial 181 finished with value: 0.23765482919656908 and parameters: {'alpha': 180592.60513267783, 'n_pcs': 4000, 'weight_scheme': 'exponential', 'weight_clip_max': 3.0, 'weight_exponential_beta': 2.7482435067456397}. Best is trial 152 with value: 0.23807568909916635.
2026-06-01 00:55:36 | INFO | src.nested_cv_avggrm_weighted_unified | Trial 182 | outer=6 | alpha=1.771e+05 n_pcs=4000 (pc_topk) weight_search=on
2026-06-01 00:55:36 | INFO | src.nested_cv_avggrm_weighted_unified | Trial 182 | outer=6 | weight={'name': 'exponential', 'floor': 1e-06, 'clip_max': 3.0, 'beta': 2.724824196262229}
[I 2026-06-01 00:55:41,430] Trial 182 finished with value: 0.23768885044735183 and parameters: {'alpha': 177054.1349554261, 'n_pcs': 4000, 'weight_scheme': 'exponential', 'weight_clip_max': 3.0, 'weight_exponential_beta': 2.724824196262229}. Best is trial 152 with value: 0.23807568909916635.
2026-06-01 00:55:41 | INFO | src.nested_cv_avggrm_weighted_unified | Trial 183 | outer=6 | alpha=1.966e+05 n_pcs=4000 (pc_topk) weight_search=on
2026-06-01 00:55:41 | INFO | src.nested_cv_avggrm_weighted_unified | Trial 183 | outer=6 | weight={'name': 'exponential', 'floor': 1e-06, 'clip_max': 3.0, 'beta': 2.8323594357019433}
[I 2026-06-01 00:55:46,663] Trial 183 finished with value: 0.23745724821007608 and parameters: {'alpha': 196586.2632459553, 'n_pcs': 4000, 'weight_scheme': 'exponential', 'weight_clip_max': 3.0, 'weight_exponential_beta': 2.8323594357019433}. Best is trial 152 with value: 0.23807568909916635.
2026-06-01 00:55:46 | INFO | src.nested_cv_avggrm_weighted_unified | Trial 184 | outer=6 | alpha=1.203e+05 n_pcs=4000 (pc_topk) weight_search=on
2026-06-01 00:55:46 | INFO | src.nested_cv_avggrm_weighted_unified | Trial 184 | outer=6 | weight={'name': 'exponential', 'floor': 1e-06, 'clip_max': 3.0, 'beta': 2.832890821023533}
2026-06-01 00:55:50 | INFO | src.nested_cv_avggrm_weighted_unified | Trial 184 | outer=6 | pruned after 7/10 inner folds (mean r=0.2632)
[I 2026-06-01 00:55:50,325] Trial 184 pruned. 
2026-06-01 00:55:50 | INFO | src.nested_cv_avggrm_weighted_unified | Trial 185 | outer=6 | alpha=1.826e+05 n_pcs=4000 (pc_topk) weight_search=on
2026-06-01 00:55:50 | INFO | src.nested_cv_avggrm_weighted_unified | Trial 185 | outer=6 | weight={'name': 'exponential', 'floor': 1e-06, 'clip_max': 3.0, 'beta': 2.065906535803837}
2026-06-01 00:55:53 | INFO | src.nested_cv_avggrm_weighted_unified | Trial 185 | outer=6 | pruned after 7/10 inner folds (mean r=0.2637)
[I 2026-06-01 00:55:53,950] Trial 185 pruned. 
2026-06-01 00:55:53 | INFO | src.nested_cv_avggrm_weighted_unified | Trial 186 | outer=6 | alpha=1.432e+05 n_pcs=4000 (pc_topk) weight_search=on
2026-06-01 00:55:53 | INFO | src.nested_cv_avggrm_weighted_unified | Trial 186 | outer=6 | weight={'name': 'exponential', 'floor': 1e-06, 'clip_max': 3.0, 'beta': 2.763986271225645}
2026-06-01 00:55:57 | INFO | src.nested_cv_avggrm_weighted_unified | Trial 186 | outer=6 | pruned after 7/10 inner folds (mean r=0.2642)
[I 2026-06-01 00:55:57,919] Trial 186 pruned. 
2026-06-01 00:55:57 | INFO | src.nested_cv_avggrm_weighted_unified | Trial 187 | outer=6 | alpha=1.954e+05 n_pcs=3500 (pc_topk) weight_search=on
2026-06-01 00:55:57 | INFO | src.nested_cv_avggrm_weighted_unified | Trial 187 | outer=6 | weight={'name': 'exponential', 'floor': 1e-06, 'clip_max': 3.0, 'beta': 2.963041877024099}
2026-06-01 00:56:01 | INFO | src.nested_cv_avggrm_weighted_unified | Trial 187 | outer=6 | pruned after 7/10 inner folds (mean r=0.2647)
[I 2026-06-01 00:56:01,025] Trial 187 pruned. 
2026-06-01 00:56:01 | INFO | src.nested_cv_avggrm_weighted_unified | Trial 188 | outer=6 | alpha=1.058e+05 n_pcs=4000 (pc_topk) weight_search=on
2026-06-01 00:56:01 | INFO | src.nested_cv_avggrm_weighted_unified | Trial 188 | outer=6 | weight={'name': 'exponential', 'floor': 1e-06, 'clip_max': 3.0, 'beta': 3.4737542004410704}
2026-06-01 00:56:04 | INFO | src.nested_cv_avggrm_weighted_unified | Trial 188 | outer=6 | pruned after 7/10 inner folds (mean r=0.2621)
[I 2026-06-01 00:56:04,891] Trial 188 pruned. 
2026-06-01 00:56:04 | INFO | src.nested_cv_avggrm_weighted_unified | Trial 189 | outer=6 | alpha=1.586e+05 n_pcs=4000 (pc_topk) weight_search=on
2026-06-01 00:56:04 | INFO | src.nested_cv_avggrm_weighted_unified | Trial 189 | outer=6 | weight={'name': 'exponential', 'floor': 1e-06, 'clip_max': 3.0, 'beta': 2.720026485073109}
2026-06-01 00:56:08 | INFO | src.nested_cv_avggrm_weighted_unified | Trial 189 | outer=6 | pruned after 7/10 inner folds (mean r=0.2646)
[I 2026-06-01 00:56:08,585] Trial 189 pruned. 
2026-06-01 00:56:08 | INFO | src.nested_cv_avggrm_weighted_unified | Trial 190 | outer=6 | alpha=2.013e+05 n_pcs=4000 (pc_topk) weight_search=on
2026-06-01 00:56:08 | INFO | src.nested_cv_avggrm_weighted_unified | Trial 190 | outer=6 | weight={'name': 'exponential', 'floor': 1e-06, 'clip_max': 3.0, 'beta': 3.272037919227251}
[I 2026-06-01 00:56:13,756] Trial 190 finished with value: 0.2377067237281648 and parameters: {'alpha': 201325.9595504436, 'n_pcs': 4000, 'weight_scheme': 'exponential', 'weight_clip_max': 3.0, 'weight_exponential_beta': 3.272037919227251}. Best is trial 152 with value: 0.23807568909916635.
2026-06-01 00:56:13 | INFO | src.nested_cv_avggrm_weighted_unified | Trial 191 | outer=6 | alpha=2.046e+05 n_pcs=4000 (pc_topk) weight_search=on
2026-06-01 00:56:13 | INFO | src.nested_cv_avggrm_weighted_unified | Trial 191 | outer=6 | weight={'name': 'exponential', 'floor': 1e-06, 'clip_max': 3.0, 'beta': 3.299156649375182}
[I 2026-06-01 00:56:18,948] Trial 191 finished with value: 0.23765895631414113 and parameters: {'alpha': 204648.300067099, 'n_pcs': 4000, 'weight_scheme': 'exponential', 'weight_clip_max': 3.0, 'weight_exponential_beta': 3.299156649375182}. Best is trial 152 with value: 0.23807568909916635.
2026-06-01 00:56:18 | INFO | src.nested_cv_avggrm_weighted_unified | Trial 192 | outer=6 | alpha=2.057e+05 n_pcs=4000 (pc_topk) weight_search=on
2026-06-01 00:56:18 | INFO | src.nested_cv_avggrm_weighted_unified | Trial 192 | outer=6 | weight={'name': 'exponential', 'floor': 1e-06, 'clip_max': 3.0, 'beta': 3.293627267280301}
[I 2026-06-01 00:56:24,114] Trial 192 finished with value: 0.2376434759964324 and parameters: {'alpha': 205656.21588757483, 'n_pcs': 4000, 'weight_scheme': 'exponential', 'weight_clip_max': 3.0, 'weight_exponential_beta': 3.293627267280301}. Best is trial 152 with value: 0.23807568909916635.
2026-06-01 00:56:24 | INFO | src.nested_cv_avggrm_weighted_unified | Trial 193 | outer=6 | alpha=2.027e+05 n_pcs=4000 (pc_topk) weight_search=on
2026-06-01 00:56:24 | INFO | src.nested_cv_avggrm_weighted_unified | Trial 193 | outer=6 | weight={'name': 'exponential', 'floor': 1e-06, 'clip_max': 3.0, 'beta': 3.2745009595250827}
[I 2026-06-01 00:56:29,273] Trial 193 finished with value: 0.237686556612637 and parameters: {'alpha': 202673.8417217268, 'n_pcs': 4000, 'weight_scheme': 'exponential', 'weight_clip_max': 3.0, 'weight_exponential_beta': 3.2745009595250827}. Best is trial 152 with value: 0.23807568909916635.
2026-06-01 00:56:29 | INFO | src.nested_cv_avggrm_weighted_unified | Trial 194 | outer=6 | alpha=1.292e+05 n_pcs=4000 (pc_topk) weight_search=on
2026-06-01 00:56:29 | INFO | src.nested_cv_avggrm_weighted_unified | Trial 194 | outer=6 | weight={'name': 'exponential', 'floor': 1e-06, 'clip_max': 3.0, 'beta': 3.174193555391344}
2026-06-01 00:56:32 | INFO | src.nested_cv_avggrm_weighted_unified | Trial 194 | outer=6 | pruned after 7/10 inner folds (mean r=0.2636)
[I 2026-06-01 00:56:32,893] Trial 194 pruned. 
2026-06-01 00:56:32 | INFO | src.nested_cv_avggrm_weighted_unified | Trial 195 | outer=6 | alpha=2.058e+05 n_pcs=5000 (pc_topk) weight_search=on
2026-06-01 00:56:32 | INFO | src.nested_cv_avggrm_weighted_unified | Trial 195 | outer=6 | weight={'name': 'exponential', 'floor': 1e-06, 'clip_max': 3.0, 'beta': 3.3042228345716396}
[I 2026-06-01 00:56:39,618] Trial 195 finished with value: 0.23577780366255324 and parameters: {'alpha': 205778.44436260674, 'n_pcs': 5000, 'weight_scheme': 'exponential', 'weight_clip_max': 3.0, 'weight_exponential_beta': 3.3042228345716396}. Best is trial 152 with value: 0.23807568909916635.
2026-06-01 00:56:39 | INFO | src.nested_cv_avggrm_weighted_unified | Trial 196 | outer=6 | alpha=1.582e+05 n_pcs=4000 (pc_topk) weight_search=on
2026-06-01 00:56:39 | INFO | src.nested_cv_avggrm_weighted_unified | Trial 196 | outer=6 | weight={'name': 'exponential', 'floor': 1e-06, 'clip_max': 3.0, 'beta': 2.9409182718608533}
2026-06-01 00:56:43 | INFO | src.nested_cv_avggrm_weighted_unified | Trial 196 | outer=6 | pruned after 7/10 inner folds (mean r=0.2646)
[I 2026-06-01 00:56:43,240] Trial 196 pruned. 
2026-06-01 00:56:43 | INFO | src.nested_cv_avggrm_weighted_unified | Trial 197 | outer=6 | alpha=1.992e+05 n_pcs=4000 (pc_topk) weight_search=on
2026-06-01 00:56:43 | INFO | src.nested_cv_avggrm_weighted_unified | Trial 197 | outer=6 | weight={'name': 'exponential', 'floor': 1e-06, 'clip_max': 3.0, 'beta': 3.4614442055166115}
[I 2026-06-01 00:56:48,415] Trial 197 finished with value: 0.2377226687401634 and parameters: {'alpha': 199190.71607072718, 'n_pcs': 4000, 'weight_scheme': 'exponential', 'weight_clip_max': 3.0, 'weight_exponential_beta': 3.4614442055166115}. Best is trial 152 with value: 0.23807568909916635.
2026-06-01 00:56:48 | INFO | src.nested_cv_avggrm_weighted_unified | Trial 198 | outer=6 | alpha=2.014e+05 n_pcs=4000 (pc_topk) weight_search=on
2026-06-01 00:56:48 | INFO | src.nested_cv_avggrm_weighted_unified | Trial 198 | outer=6 | weight={'name': 'exponential', 'floor': 1e-06, 'clip_max': 3.0, 'beta': 3.5091831984105446}
[I 2026-06-01 00:56:53,579] Trial 198 finished with value: 0.2376844826795832 and parameters: {'alpha': 201351.59830749562, 'n_pcs': 4000, 'weight_scheme': 'exponential', 'weight_clip_max': 3.0, 'weight_exponential_beta': 3.5091831984105446}. Best is trial 152 with value: 0.23807568909916635.
2026-06-01 00:56:53 | INFO | src.nested_cv_avggrm_weighted_unified | Trial 199 | outer=6 | alpha=2.013e+05 n_pcs=4000 (pc_topk) weight_search=on
2026-06-01 00:56:53 | INFO | src.nested_cv_avggrm_weighted_unified | Trial 199 | outer=6 | weight={'name': 'exponential', 'floor': 1e-06, 'clip_max': 3.0, 'beta': 3.4429311040955235}
[I 2026-06-01 00:56:58,751] Trial 199 finished with value: 0.23770208887020744 and parameters: {'alpha': 201320.22493839246, 'n_pcs': 4000, 'weight_scheme': 'exponential', 'weight_clip_max': 3.0, 'weight_exponential_beta': 3.4429311040955235}. Best is trial 152 with value: 0.23807568909916635.
2026-06-01 00:56:58 | INFO | src.nested_cv_avggrm_weighted_unified | Trial 200 | outer=6 | alpha=2.064e+05 n_pcs=4000 (pc_topk) weight_search=on
2026-06-01 00:56:58 | INFO | src.nested_cv_avggrm_weighted_unified | Trial 200 | outer=6 | weight={'name': 'exponential', 'floor': 1e-06, 'clip_max': 3.0, 'beta': 3.502787690127577}
[I 2026-06-01 00:57:03,960] Trial 200 finished with value: 0.2376128636344994 and parameters: {'alpha': 206433.59871928114, 'n_pcs': 4000, 'weight_scheme': 'exponential', 'weight_clip_max': 3.0, 'weight_exponential_beta': 3.502787690127577}. Best is trial 152 with value: 0.23807568909916635.
2026-06-01 00:57:03 | INFO | src.nested_cv_avggrm_weighted_unified | Trial 201 | outer=6 | alpha=2.040e+05 n_pcs=4000 (pc_topk) weight_search=on
2026-06-01 00:57:03 | INFO | src.nested_cv_avggrm_weighted_unified | Trial 201 | outer=6 | weight={'name': 'exponential', 'floor': 1e-06, 'clip_max': 3.0, 'beta': 3.4865600396939165}
[I 2026-06-01 00:57:09,139] Trial 201 finished with value: 0.23765032738396177 and parameters: {'alpha': 204006.79840334138, 'n_pcs': 4000, 'weight_scheme': 'exponential', 'weight_clip_max': 3.0, 'weight_exponential_beta': 3.4865600396939165}. Best is trial 152 with value: 0.23807568909916635.
2026-06-01 00:57:09 | INFO | src.nested_cv_avggrm_weighted_unified | Trial 202 | outer=6 | alpha=2.160e+05 n_pcs=4000 (pc_topk) weight_search=on
2026-06-01 00:57:09 | INFO | src.nested_cv_avggrm_weighted_unified | Trial 202 | outer=6 | weight={'name': 'exponential', 'floor': 1e-06, 'clip_max': 3.0, 'beta': 3.569885826790192}
[I 2026-06-01 00:57:14,362] Trial 202 finished with value: 0.23748264211344822 and parameters: {'alpha': 215994.56327427246, 'n_pcs': 4000, 'weight_scheme': 'exponential', 'weight_clip_max': 3.0, 'weight_exponential_beta': 3.569885826790192}. Best is trial 152 with value: 0.23807568909916635.
2026-06-01 00:57:14 | INFO | src.nested_cv_avggrm_weighted_unified | Trial 203 | outer=6 | alpha=1.339e+05 n_pcs=4000 (pc_topk) weight_search=on
2026-06-01 00:57:14 | INFO | src.nested_cv_avggrm_weighted_unified | Trial 203 | outer=6 | weight={'name': 'exponential', 'floor': 1e-06, 'clip_max': 3.0, 'beta': 3.509830797767691}
2026-06-01 00:57:18 | INFO | src.nested_cv_avggrm_weighted_unified | Trial 203 | outer=6 | pruned after 7/10 inner folds (mean r=0.2638)
[I 2026-06-01 00:57:18,478] Trial 203 pruned. 
2026-06-01 00:57:18 | INFO | src.nested_cv_avggrm_weighted_unified | Trial 204 | outer=6 | alpha=1.624e+05 n_pcs=4000 (pc_topk) weight_search=on
2026-06-01 00:57:18 | INFO | src.nested_cv_avggrm_weighted_unified | Trial 204 | outer=6 | weight={'name': 'exponential', 'floor': 1e-06, 'clip_max': 3.0, 'beta': 3.314837604501673}
[I 2026-06-01 00:57:23,687] Trial 204 finished with value: 0.23823455832943674 and parameters: {'alpha': 162430.40505368562, 'n_pcs': 4000, 'weight_scheme': 'exponential', 'weight_clip_max': 3.0, 'weight_exponential_beta': 3.314837604501673}. Best is trial 204 with value: 0.23823455832943674.
2026-06-01 00:57:23 | INFO | src.nested_cv_avggrm_weighted_unified | OUTER 6 | new best trial 204 (mean inner r=0.2382) saved to outputs/final_results/e6_pc_ridge_avggrm/thr_wing/e6_pc_ridge_avggrm_thr_wing_best_trials/split_06_best_trial.json
2026-06-01 00:57:23 | INFO | src.nested_cv_avggrm_weighted_unified | Trial 205 | outer=6 | alpha=1.517e+05 n_pcs=4000 (pc_topk) weight_search=on
2026-06-01 00:57:23 | INFO | src.nested_cv_avggrm_weighted_unified | Trial 205 | outer=6 | weight={'name': 'exponential', 'floor': 1e-06, 'clip_max': 3.0, 'beta': 3.3182184193723656}
2026-06-01 00:57:27 | INFO | src.nested_cv_avggrm_weighted_unified | Trial 205 | outer=6 | pruned after 7/10 inner folds (mean r=0.2645)
[I 2026-06-01 00:57:27,431] Trial 205 pruned. 
2026-06-01 00:57:27 | INFO | src.nested_cv_avggrm_weighted_unified | Trial 206 | outer=6 | alpha=1.109e+05 n_pcs=4000 (pc_topk) weight_search=on
2026-06-01 00:57:27 | INFO | src.nested_cv_avggrm_weighted_unified | Trial 206 | outer=6 | weight={'name': 'exponential', 'floor': 1e-06, 'clip_max': 3.0, 'beta': 3.23567245708598}
2026-06-01 00:57:31 | INFO | src.nested_cv_avggrm_weighted_unified | Trial 206 | outer=6 | pruned after 7/10 inner folds (mean r=0.2626)
[I 2026-06-01 00:57:31,097] Trial 206 pruned. 
2026-06-01 00:57:31 | INFO | src.nested_cv_avggrm_weighted_unified | Trial 207 | outer=6 | alpha=1.666e+05 n_pcs=4000 (pc_topk) weight_search=on
2026-06-01 00:57:31 | INFO | src.nested_cv_avggrm_weighted_unified | Trial 207 | outer=6 | weight={'name': 'exponential', 'floor': 1e-06, 'clip_max': 3.0, 'beta': 3.6325252217253503}
[I 2026-06-01 00:57:36,284] Trial 207 finished with value: 0.23811852490375324 and parameters: {'alpha': 166636.11082727136, 'n_pcs': 4000, 'weight_scheme': 'exponential', 'weight_clip_max': 3.0, 'weight_exponential_beta': 3.6325252217253503}. Best is trial 204 with value: 0.23823455832943674.
2026-06-01 00:57:36 | INFO | src.nested_cv_avggrm_weighted_unified | Trial 208 | outer=6 | alpha=1.611e+05 n_pcs=4000 (pc_topk) weight_search=on
2026-06-01 00:57:36 | INFO | src.nested_cv_avggrm_weighted_unified | Trial 208 | outer=6 | weight={'name': 'exponential', 'floor': 1e-06, 'clip_max': 3.0, 'beta': 3.566028619367512}
[I 2026-06-01 00:57:41,503] Trial 208 finished with value: 0.2381689969639233 and parameters: {'alpha': 161075.7706638784, 'n_pcs': 4000, 'weight_scheme': 'exponential', 'weight_clip_max': 3.0, 'weight_exponential_beta': 3.566028619367512}. Best is trial 204 with value: 0.23823455832943674.
2026-06-01 00:57:41 | INFO | src.nested_cv_avggrm_weighted_unified | Trial 209 | outer=6 | alpha=1.317e+05 n_pcs=4000 (pc_topk) weight_search=on
2026-06-01 00:57:41 | INFO | src.nested_cv_avggrm_weighted_unified | Trial 209 | outer=6 | weight={'name': 'exponential', 'floor': 1e-06, 'clip_max': 3.0, 'beta': 3.6351702828380197}
2026-06-01 00:57:45 | INFO | src.nested_cv_avggrm_weighted_unified | Trial 209 | outer=6 | pruned after 7/10 inner folds (mean r=0.2638)
[I 2026-06-01 00:57:45,163] Trial 209 pruned. 
2026-06-01 00:57:45 | INFO | src.nested_cv_avggrm_weighted_unified | Trial 210 | outer=6 | alpha=1.622e+05 n_pcs=3500 (pc_topk) weight_search=on
2026-06-01 00:57:45 | INFO | src.nested_cv_avggrm_weighted_unified | Trial 210 | outer=6 | weight={'name': 'uniform', 'floor': 1e-06, 'clip_max': 3.0}
2026-06-01 00:57:47 | INFO | src.nested_cv_avggrm_weighted_unified | Trial 210 | outer=6 | pruned after 6/10 inner folds (mean r=0.2413)
[I 2026-06-01 00:57:47,461] Trial 210 pruned. 
2026-06-01 00:57:47 | INFO | src.nested_cv_avggrm_weighted_unified | Trial 211 | outer=6 | alpha=2.238e+05 n_pcs=4000 (pc_topk) weight_search=on
2026-06-01 00:57:47 | INFO | src.nested_cv_avggrm_weighted_unified | Trial 211 | outer=6 | weight={'name': 'exponential', 'floor': 1e-06, 'clip_max': 3.0, 'beta': 3.391073940168146}
[I 2026-06-01 00:57:52,629] Trial 211 finished with value: 0.23737996048650895 and parameters: {'alpha': 223758.4522908078, 'n_pcs': 4000, 'weight_scheme': 'exponential', 'weight_clip_max': 3.0, 'weight_exponential_beta': 3.391073940168146}. Best is trial 204 with value: 0.23823455832943674.
2026-06-01 00:57:52 | INFO | src.nested_cv_avggrm_weighted_unified | Trial 212 | outer=6 | alpha=1.695e+05 n_pcs=4000 (pc_topk) weight_search=on
2026-06-01 00:57:52 | INFO | src.nested_cv_avggrm_weighted_unified | Trial 212 | outer=6 | weight={'name': 'exponential', 'floor': 1e-06, 'clip_max': 3.0, 'beta': 3.5968139163766684}
[I 2026-06-01 00:57:57,842] Trial 212 finished with value: 0.23808249561173675 and parameters: {'alpha': 169545.23505835768, 'n_pcs': 4000, 'weight_scheme': 'exponential', 'weight_clip_max': 3.0, 'weight_exponential_beta': 3.5968139163766684}. Best is trial 204 with value: 0.23823455832943674.
2026-06-01 00:57:57 | INFO | src.nested_cv_avggrm_weighted_unified | Trial 213 | outer=6 | alpha=1.662e+05 n_pcs=4000 (pc_topk) weight_search=on
2026-06-01 00:57:57 | INFO | src.nested_cv_avggrm_weighted_unified | Trial 213 | outer=6 | weight={'name': 'exponential', 'floor': 1e-06, 'clip_max': 3.0, 'beta': 3.8323242574296765}
[I 2026-06-01 00:58:03,054] Trial 213 finished with value: 0.23816978878816425 and parameters: {'alpha': 166246.0132227819, 'n_pcs': 4000, 'weight_scheme': 'exponential', 'weight_clip_max': 3.0, 'weight_exponential_beta': 3.8323242574296765}. Best is trial 204 with value: 0.23823455832943674.
2026-06-01 00:58:03 | INFO | src.nested_cv_avggrm_weighted_unified | Trial 214 | outer=6 | alpha=1.580e+05 n_pcs=4000 (pc_topk) weight_search=on
2026-06-01 00:58:03 | INFO | src.nested_cv_avggrm_weighted_unified | Trial 214 | outer=6 | weight={'name': 'exponential', 'floor': 1e-06, 'clip_max': 3.0, 'beta': 3.709536208130616}
