[I 2026-06-01 02:33:45,329] Trial 155 finished with value: 0.2357421865647722 and parameters: {'alpha': 118304.05889623736, 'n_pcs': 4000, 'weight_scheme': 'linear', 'weight_clip_max': 10.0, 'weight_linear_min_weight': 0.14369594804572514, 'weight_linear_max_weight': 2.633072140172513}. Best is trial 128 with value: 0.23590165924304424.
2026-06-01 02:33:45 | INFO | src.nested_cv_avggrm_weighted_unified | Trial 156 | outer=10 | alpha=1.502e+05 n_pcs=4000 (pc_topk) weight_search=on
2026-06-01 02:33:45 | INFO | src.nested_cv_avggrm_weighted_unified | Trial 156 | outer=10 | weight={'name': 'linear', 'floor': 1e-06, 'clip_max': 10.0, 'min_weight': 0.0868425738155508, 'max_weight': 3.1199594359375085}
[I 2026-06-01 02:33:51,076] Trial 156 finished with value: 0.23568970257014127 and parameters: {'alpha': 150155.29107249802, 'n_pcs': 4000, 'weight_scheme': 'linear', 'weight_clip_max': 10.0, 'weight_linear_min_weight': 0.0868425738155508, 'weight_linear_max_weight': 3.1199594359375085}. Best is trial 128 with value: 0.23590165924304424.
2026-06-01 02:33:51 | INFO | src.nested_cv_avggrm_weighted_unified | Trial 157 | outer=10 | alpha=2.040e+05 n_pcs=4000 (pc_topk) weight_search=on
2026-06-01 02:33:51 | INFO | src.nested_cv_avggrm_weighted_unified | Trial 157 | outer=10 | weight={'name': 'linear', 'floor': 1e-06, 'clip_max': 10.0, 'min_weight': 0.11968719356261216, 'max_weight': 2.9467259177702045}
[I 2026-06-01 02:33:56,813] Trial 157 finished with value: 0.2345952553011982 and parameters: {'alpha': 203986.34130019243, 'n_pcs': 4000, 'weight_scheme': 'linear', 'weight_clip_max': 10.0, 'weight_linear_min_weight': 0.11968719356261216, 'weight_linear_max_weight': 2.9467259177702045}. Best is trial 128 with value: 0.23590165924304424.
2026-06-01 02:33:56 | INFO | src.nested_cv_avggrm_weighted_unified | Trial 158 | outer=10 | alpha=6.774e+04 n_pcs=3500 (pc_topk) weight_search=on
2026-06-01 02:33:56 | INFO | src.nested_cv_avggrm_weighted_unified | Trial 158 | outer=10 | weight={'name': 'linear', 'floor': 1e-06, 'clip_max': 10.0, 'min_weight': 0.05610830765430088, 'max_weight': 2.803756803398117}
2026-06-01 02:34:00 | INFO | src.nested_cv_avggrm_weighted_unified | Trial 158 | outer=10 | pruned after 8/10 inner folds (mean r=0.2636)
[I 2026-06-01 02:34:00,774] Trial 158 pruned. 
2026-06-01 02:34:00 | INFO | src.nested_cv_avggrm_weighted_unified | Trial 159 | outer=10 | alpha=1.073e+05 n_pcs=4000 (pc_topk) weight_search=on
2026-06-01 02:34:00 | INFO | src.nested_cv_avggrm_weighted_unified | Trial 159 | outer=10 | weight={'name': 'linear', 'floor': 1e-06, 'clip_max': 10.0, 'min_weight': 0.050689546199209796, 'max_weight': 2.535556346219158}
[I 2026-06-01 02:34:06,517] Trial 159 finished with value: 0.23584724503679655 and parameters: {'alpha': 107272.52649581234, 'n_pcs': 4000, 'weight_scheme': 'linear', 'weight_clip_max': 10.0, 'weight_linear_min_weight': 0.050689546199209796, 'weight_linear_max_weight': 2.535556346219158}. Best is trial 128 with value: 0.23590165924304424.
2026-06-01 02:34:06 | INFO | src.nested_cv_avggrm_weighted_unified | Trial 160 | outer=10 | alpha=1.380e+05 n_pcs=4000 (pc_topk) weight_search=on
2026-06-01 02:34:06 | INFO | src.nested_cv_avggrm_weighted_unified | Trial 160 | outer=10 | weight={'name': 'linear', 'floor': 1e-06, 'clip_max': 10.0, 'min_weight': 0.09803482757554738, 'max_weight': 2.5535982750073543}
[I 2026-06-01 02:34:12,260] Trial 160 finished with value: 0.23573224209811375 and parameters: {'alpha': 138003.59644988755, 'n_pcs': 4000, 'weight_scheme': 'linear', 'weight_clip_max': 10.0, 'weight_linear_min_weight': 0.09803482757554738, 'weight_linear_max_weight': 2.5535982750073543}. Best is trial 128 with value: 0.23590165924304424.
2026-06-01 02:34:12 | INFO | src.nested_cv_avggrm_weighted_unified | Trial 161 | outer=10 | alpha=1.176e+05 n_pcs=4000 (pc_topk) weight_search=on
2026-06-01 02:34:12 | INFO | src.nested_cv_avggrm_weighted_unified | Trial 161 | outer=10 | weight={'name': 'linear', 'floor': 1e-06, 'clip_max': 10.0, 'min_weight': 0.07153473281665612, 'max_weight': 2.6152501288871175}
[I 2026-06-01 02:34:17,999] Trial 161 finished with value: 0.23590282759169154 and parameters: {'alpha': 117608.70805246077, 'n_pcs': 4000, 'weight_scheme': 'linear', 'weight_clip_max': 10.0, 'weight_linear_min_weight': 0.07153473281665612, 'weight_linear_max_weight': 2.6152501288871175}. Best is trial 161 with value: 0.23590282759169154.
2026-06-01 02:34:18 | INFO | src.nested_cv_avggrm_weighted_unified | OUTER 10 | new best trial 161 (mean inner r=0.2359) saved to outputs/final_results/e6_pc_ridge_avggrm/thr_wing/e6_pc_ridge_avggrm_thr_wing_best_trials/split_10_best_trial.json
2026-06-01 02:34:18 | INFO | src.nested_cv_avggrm_weighted_unified | Trial 162 | outer=10 | alpha=1.096e+05 n_pcs=4000 (pc_topk) weight_search=on
2026-06-01 02:34:18 | INFO | src.nested_cv_avggrm_weighted_unified | Trial 162 | outer=10 | weight={'name': 'linear', 'floor': 1e-06, 'clip_max': 10.0, 'min_weight': 0.05126117190623996, 'max_weight': 2.62473947460451}
[I 2026-06-01 02:34:25,490] Trial 162 finished with value: 0.23586974338837327 and parameters: {'alpha': 109597.94786080527, 'n_pcs': 4000, 'weight_scheme': 'linear', 'weight_clip_max': 10.0, 'weight_linear_min_weight': 0.05126117190623996, 'weight_linear_max_weight': 2.62473947460451}. Best is trial 161 with value: 0.23590282759169154.
2026-06-01 02:34:25 | INFO | src.nested_cv_avggrm_weighted_unified | Trial 163 | outer=10 | alpha=1.379e+05 n_pcs=4000 (pc_topk) weight_search=on
2026-06-01 02:34:25 | INFO | src.nested_cv_avggrm_weighted_unified | Trial 163 | outer=10 | weight={'name': 'linear', 'floor': 1e-06, 'clip_max': 10.0, 'min_weight': 0.05274296807740826, 'max_weight': 2.6340438899014114}
[I 2026-06-01 02:34:31,258] Trial 163 finished with value: 0.23586427442796437 and parameters: {'alpha': 137897.68765467484, 'n_pcs': 4000, 'weight_scheme': 'linear', 'weight_clip_max': 10.0, 'weight_linear_min_weight': 0.05274296807740826, 'weight_linear_max_weight': 2.6340438899014114}. Best is trial 161 with value: 0.23590282759169154.
2026-06-01 02:34:31 | INFO | src.nested_cv_avggrm_weighted_unified | Trial 164 | outer=10 | alpha=1.623e+05 n_pcs=4000 (pc_topk) weight_search=on
2026-06-01 02:34:31 | INFO | src.nested_cv_avggrm_weighted_unified | Trial 164 | outer=10 | weight={'name': 'linear', 'floor': 1e-06, 'clip_max': 10.0, 'min_weight': 0.05546982754413135, 'max_weight': 2.6407007532052056}
[I 2026-06-01 02:34:37,044] Trial 164 finished with value: 0.23559322560774132 and parameters: {'alpha': 162340.6348238497, 'n_pcs': 4000, 'weight_scheme': 'linear', 'weight_clip_max': 10.0, 'weight_linear_min_weight': 0.05546982754413135, 'weight_linear_max_weight': 2.6407007532052056}. Best is trial 161 with value: 0.23590282759169154.
2026-06-01 02:34:37 | INFO | src.nested_cv_avggrm_weighted_unified | Trial 165 | outer=10 | alpha=8.330e+04 n_pcs=4000 (pc_topk) weight_search=on
2026-06-01 02:34:37 | INFO | src.nested_cv_avggrm_weighted_unified | Trial 165 | outer=10 | weight={'name': 'linear', 'floor': 1e-06, 'clip_max': 10.0, 'min_weight': 0.07779101981494826, 'max_weight': 2.95553202379249}
[I 2026-06-01 02:34:43,048] Trial 165 finished with value: 0.23529131923898694 and parameters: {'alpha': 83296.4472834614, 'n_pcs': 4000, 'weight_scheme': 'linear', 'weight_clip_max': 10.0, 'weight_linear_min_weight': 0.07779101981494826, 'weight_linear_max_weight': 2.95553202379249}. Best is trial 161 with value: 0.23590282759169154.
2026-06-01 02:34:43 | INFO | src.nested_cv_avggrm_weighted_unified | Trial 166 | outer=10 | alpha=1.434e+05 n_pcs=500 (pc_topk) weight_search=on
2026-06-01 02:34:43 | INFO | src.nested_cv_avggrm_weighted_unified | Trial 166 | outer=10 | weight={'name': 'linear', 'floor': 1e-06, 'clip_max': 10.0, 'min_weight': 0.05080048688488946, 'max_weight': 3.2204192952544433}
2026-06-01 02:34:43 | INFO | src.nested_cv_avggrm_weighted_unified | Trial 166 | outer=10 | pruned after 5/10 inner folds (mean r=0.1862)
[I 2026-06-01 02:34:43,476] Trial 166 pruned. 
2026-06-01 02:34:43 | INFO | src.nested_cv_avggrm_weighted_unified | Trial 167 | outer=10 | alpha=1.863e+05 n_pcs=4000 (pc_topk) weight_search=on
2026-06-01 02:34:43 | INFO | src.nested_cv_avggrm_weighted_unified | Trial 167 | outer=10 | weight={'name': 'linear', 'floor': 1e-06, 'clip_max': 10.0, 'min_weight': 0.7786819530134481, 'max_weight': 2.7130873112340206}
2026-06-01 02:34:48 | INFO | src.nested_cv_avggrm_weighted_unified | Trial 167 | outer=10 | pruned after 8/10 inner folds (mean r=0.2646)
[I 2026-06-01 02:34:48,514] Trial 167 pruned. 
2026-06-01 02:34:48 | INFO | src.nested_cv_avggrm_weighted_unified | Trial 168 | outer=10 | alpha=1.043e+05 n_pcs=3500 (pc_topk) weight_search=on
2026-06-01 02:34:48 | INFO | src.nested_cv_avggrm_weighted_unified | Trial 168 | outer=10 | weight={'name': 'linear', 'floor': 1e-06, 'clip_max': 10.0, 'min_weight': 0.07938474885694136, 'max_weight': 2.8573799446616017}
2026-06-01 02:34:52 | INFO | src.nested_cv_avggrm_weighted_unified | Trial 168 | outer=10 | pruned after 8/10 inner folds (mean r=0.2682)
[I 2026-06-01 02:34:52,915] Trial 168 pruned. 
2026-06-01 02:34:52 | INFO | src.nested_cv_avggrm_weighted_unified | Trial 169 | outer=10 | alpha=7.680e+04 n_pcs=4000 (pc_topk) weight_search=on
2026-06-01 02:34:52 | INFO | src.nested_cv_avggrm_weighted_unified | Trial 169 | outer=10 | weight={'name': 'uniform', 'floor': 1e-06, 'clip_max': 10.0}
2026-06-01 02:34:57 | INFO | src.nested_cv_avggrm_weighted_unified | Trial 169 | outer=10 | pruned after 8/10 inner folds (mean r=0.2539)
[I 2026-06-01 02:34:57,384] Trial 169 pruned. 
2026-06-01 02:34:57 | INFO | src.nested_cv_avggrm_weighted_unified | Trial 170 | outer=10 | alpha=9.363e+04 n_pcs=4000 (pc_topk) weight_search=on
2026-06-01 02:34:57 | INFO | src.nested_cv_avggrm_weighted_unified | Trial 170 | outer=10 | weight={'name': 'linear', 'floor': 1e-06, 'clip_max': 10.0, 'min_weight': 0.0501292439137662, 'max_weight': 3.0422230967615516}
2026-06-01 02:35:02 | INFO | src.nested_cv_avggrm_weighted_unified | Trial 170 | outer=10 | pruned after 8/10 inner folds (mean r=0.2688)
[I 2026-06-01 02:35:02,022] Trial 170 pruned. 
2026-06-01 02:35:02 | INFO | src.nested_cv_avggrm_weighted_unified | Trial 171 | outer=10 | alpha=1.148e+05 n_pcs=4000 (pc_topk) weight_search=on
2026-06-01 02:35:02 | INFO | src.nested_cv_avggrm_weighted_unified | Trial 171 | outer=10 | weight={'name': 'linear', 'floor': 1e-06, 'clip_max': 10.0, 'min_weight': 0.09133714076597178, 'max_weight': 2.619937149090679}
[I 2026-06-01 02:35:07,989] Trial 171 finished with value: 0.23587265825139453 and parameters: {'alpha': 114756.35653142203, 'n_pcs': 4000, 'weight_scheme': 'linear', 'weight_clip_max': 10.0, 'weight_linear_min_weight': 0.09133714076597178, 'weight_linear_max_weight': 2.619937149090679}. Best is trial 161 with value: 0.23590282759169154.
2026-06-01 02:35:07 | INFO | src.nested_cv_avggrm_weighted_unified | Trial 172 | outer=10 | alpha=1.350e+05 n_pcs=4000 (pc_topk) weight_search=on
2026-06-01 02:35:08 | INFO | src.nested_cv_avggrm_weighted_unified | Trial 172 | outer=10 | weight={'name': 'linear', 'floor': 1e-06, 'clip_max': 10.0, 'min_weight': 0.08773478635925452, 'max_weight': 2.4645382311673822}
[I 2026-06-01 02:35:13,779] Trial 172 finished with value: 0.2357844621030459 and parameters: {'alpha': 135046.46226907085, 'n_pcs': 4000, 'weight_scheme': 'linear', 'weight_clip_max': 10.0, 'weight_linear_min_weight': 0.08773478635925452, 'weight_linear_max_weight': 2.4645382311673822}. Best is trial 161 with value: 0.23590282759169154.
2026-06-01 02:35:13 | INFO | src.nested_cv_avggrm_weighted_unified | Trial 173 | outer=10 | alpha=1.104e+05 n_pcs=4000 (pc_topk) weight_search=on
2026-06-01 02:35:13 | INFO | src.nested_cv_avggrm_weighted_unified | Trial 173 | outer=10 | weight={'name': 'linear', 'floor': 1e-06, 'clip_max': 10.0, 'min_weight': 0.07088656674223195, 'max_weight': 2.6586169026698108}
[I 2026-06-01 02:35:19,634] Trial 173 finished with value: 0.23587591802011776 and parameters: {'alpha': 110374.97065291525, 'n_pcs': 4000, 'weight_scheme': 'linear', 'weight_clip_max': 10.0, 'weight_linear_min_weight': 0.07088656674223195, 'weight_linear_max_weight': 2.6586169026698108}. Best is trial 161 with value: 0.23590282759169154.
2026-06-01 02:35:19 | INFO | src.nested_cv_avggrm_weighted_unified | Trial 174 | outer=10 | alpha=9.908e+04 n_pcs=4000 (pc_topk) weight_search=on
2026-06-01 02:35:19 | INFO | src.nested_cv_avggrm_weighted_unified | Trial 174 | outer=10 | weight={'name': 'linear', 'floor': 1e-06, 'clip_max': 5.0, 'min_weight': 0.06698337442772748, 'max_weight': 2.638158827646625}
2026-06-01 02:35:24 | INFO | src.nested_cv_avggrm_weighted_unified | Trial 174 | outer=10 | pruned after 8/10 inner folds (mean r=0.2691)
[I 2026-06-01 02:35:24,276] Trial 174 pruned. 
2026-06-01 02:35:24 | INFO | src.nested_cv_avggrm_weighted_unified | Trial 175 | outer=10 | alpha=6.685e+04 n_pcs=4000 (pc_topk) weight_search=on
2026-06-01 02:35:24 | INFO | src.nested_cv_avggrm_weighted_unified | Trial 175 | outer=10 | weight={'name': 'linear', 'floor': 1e-06, 'clip_max': 10.0, 'min_weight': 0.06756109300441722, 'max_weight': 2.8102014159845337}
[I 2026-06-01 02:35:30,057] Trial 175 finished with value: 0.234240205896928 and parameters: {'alpha': 66851.68605205085, 'n_pcs': 4000, 'weight_scheme': 'linear', 'weight_clip_max': 10.0, 'weight_linear_min_weight': 0.06756109300441722, 'weight_linear_max_weight': 2.8102014159845337}. Best is trial 161 with value: 0.23590282759169154.
2026-06-01 02:35:30 | INFO | src.nested_cv_avggrm_weighted_unified | Trial 176 | outer=10 | alpha=1.687e+05 n_pcs=3000 (pc_topk) weight_search=on
2026-06-01 02:35:30 | INFO | src.nested_cv_avggrm_weighted_unified | Trial 176 | outer=10 | weight={'name': 'linear', 'floor': 1e-06, 'clip_max': 10.0, 'min_weight': 0.12899112506828786, 'max_weight': 2.621248472526896}
[I 2026-06-01 02:35:33,950] Trial 176 finished with value: 0.2354454499513058 and parameters: {'alpha': 168656.5112289107, 'n_pcs': 3000, 'weight_scheme': 'linear', 'weight_clip_max': 10.0, 'weight_linear_min_weight': 0.12899112506828786, 'weight_linear_max_weight': 2.621248472526896}. Best is trial 161 with value: 0.23590282759169154.
2026-06-01 02:35:33 | INFO | src.nested_cv_avggrm_weighted_unified | Trial 177 | outer=10 | alpha=8.463e+04 n_pcs=3500 (pc_topk) weight_search=on
2026-06-01 02:35:33 | INFO | src.nested_cv_avggrm_weighted_unified | Trial 177 | outer=10 | weight={'name': 'linear', 'floor': 1e-06, 'clip_max': 10.0, 'min_weight': 0.08777913950912367, 'max_weight': 2.815836012672429}
2026-06-01 02:35:37 | INFO | src.nested_cv_avggrm_weighted_unified | Trial 177 | outer=10 | pruned after 8/10 inner folds (mean r=0.2664)
[I 2026-06-01 02:35:37,923] Trial 177 pruned. 
2026-06-01 02:35:37 | INFO | src.nested_cv_avggrm_weighted_unified | Trial 178 | outer=10 | alpha=2.236e+03 n_pcs=4000 (pc_topk) weight_search=on
2026-06-01 02:35:37 | INFO | src.nested_cv_avggrm_weighted_unified | Trial 178 | outer=10 | weight={'name': 'exponential', 'floor': 1e-06, 'clip_max': 10.0, 'beta': 9.81580900481442}
2026-06-01 02:35:40 | INFO | src.nested_cv_avggrm_weighted_unified | Trial 178 | outer=10 | pruned after 5/10 inner folds (mean r=0.1883)
[I 2026-06-01 02:35:40,788] Trial 178 pruned. 
2026-06-01 02:35:40 | INFO | src.nested_cv_avggrm_weighted_unified | Trial 179 | outer=10 | alpha=1.410e+05 n_pcs=4000 (pc_topk) weight_search=on
2026-06-01 02:35:40 | INFO | src.nested_cv_avggrm_weighted_unified | Trial 179 | outer=10 | weight={'name': 'linear', 'floor': 1e-06, 'clip_max': None, 'min_weight': 0.07153655060392526, 'max_weight': 2.9903213159966}
[I 2026-06-01 02:35:46,575] Trial 179 finished with value: 0.23581650554434005 and parameters: {'alpha': 141049.23422552922, 'n_pcs': 4000, 'weight_scheme': 'linear', 'weight_clip_max': None, 'weight_linear_min_weight': 0.07153655060392526, 'weight_linear_max_weight': 2.9903213159966}. Best is trial 161 with value: 0.23590282759169154.
2026-06-01 02:35:46 | INFO | src.nested_cv_avggrm_weighted_unified | Trial 180 | outer=10 | alpha=1.103e+05 n_pcs=4000 (pc_topk) weight_search=on
2026-06-01 02:35:46 | INFO | src.nested_cv_avggrm_weighted_unified | Trial 180 | outer=10 | weight={'name': 'linear', 'floor': 1e-06, 'clip_max': 10.0, 'min_weight': 0.05225913709501497, 'max_weight': 2.33982615396814}
[I 2026-06-01 02:35:52,341] Trial 180 finished with value: 0.23587775937818023 and parameters: {'alpha': 110340.91918564831, 'n_pcs': 4000, 'weight_scheme': 'linear', 'weight_clip_max': 10.0, 'weight_linear_min_weight': 0.05225913709501497, 'weight_linear_max_weight': 2.33982615396814}. Best is trial 161 with value: 0.23590282759169154.
2026-06-01 02:35:52 | INFO | src.nested_cv_avggrm_weighted_unified | Trial 181 | outer=10 | alpha=1.077e+05 n_pcs=4000 (pc_topk) weight_search=on
2026-06-01 02:35:52 | INFO | src.nested_cv_avggrm_weighted_unified | Trial 181 | outer=10 | weight={'name': 'linear', 'floor': 1e-06, 'clip_max': 10.0, 'min_weight': 0.050060967778765175, 'max_weight': 2.384790559059182}
[I 2026-06-01 02:35:58,157] Trial 181 finished with value: 0.23585280856243956 and parameters: {'alpha': 107667.28930335045, 'n_pcs': 4000, 'weight_scheme': 'linear', 'weight_clip_max': 10.0, 'weight_linear_min_weight': 0.050060967778765175, 'weight_linear_max_weight': 2.384790559059182}. Best is trial 161 with value: 0.23590282759169154.
2026-06-01 02:35:58 | INFO | src.nested_cv_avggrm_weighted_unified | Trial 182 | outer=10 | alpha=1.052e+05 n_pcs=4000 (pc_topk) weight_search=on
2026-06-01 02:35:58 | INFO | src.nested_cv_avggrm_weighted_unified | Trial 182 | outer=10 | weight={'name': 'linear', 'floor': 1e-06, 'clip_max': 10.0, 'min_weight': 0.05271373230351742, 'max_weight': 2.31368011261061}
[I 2026-06-01 02:36:03,985] Trial 182 finished with value: 0.23582677570723112 and parameters: {'alpha': 105153.00482623244, 'n_pcs': 4000, 'weight_scheme': 'linear', 'weight_clip_max': 10.0, 'weight_linear_min_weight': 0.05271373230351742, 'weight_linear_max_weight': 2.31368011261061}. Best is trial 161 with value: 0.23590282759169154.
2026-06-01 02:36:03 | INFO | src.nested_cv_avggrm_weighted_unified | Trial 183 | outer=10 | alpha=1.338e+05 n_pcs=4000 (pc_topk) weight_search=on
2026-06-01 02:36:04 | INFO | src.nested_cv_avggrm_weighted_unified | Trial 183 | outer=10 | weight={'name': 'linear', 'floor': 1e-06, 'clip_max': 10.0, 'min_weight': 0.05016621983699923, 'max_weight': 2.2474700175967293}
[I 2026-06-01 02:36:09,783] Trial 183 finished with value: 0.23587972040893676 and parameters: {'alpha': 133818.13491519014, 'n_pcs': 4000, 'weight_scheme': 'linear', 'weight_clip_max': 10.0, 'weight_linear_min_weight': 0.05016621983699923, 'weight_linear_max_weight': 2.2474700175967293}. Best is trial 161 with value: 0.23590282759169154.
2026-06-01 02:36:09 | INFO | src.nested_cv_avggrm_weighted_unified | Trial 184 | outer=10 | alpha=2.028e+05 n_pcs=4000 (pc_topk) weight_search=on
2026-06-01 02:36:09 | INFO | src.nested_cv_avggrm_weighted_unified | Trial 184 | outer=10 | weight={'name': 'linear', 'floor': 1e-06, 'clip_max': 10.0, 'min_weight': 0.08570061190538536, 'max_weight': 2.2087000773671255}
[I 2026-06-01 02:36:15,585] Trial 184 finished with value: 0.23465056993104305 and parameters: {'alpha': 202791.7393429623, 'n_pcs': 4000, 'weight_scheme': 'linear', 'weight_clip_max': 10.0, 'weight_linear_min_weight': 0.08570061190538536, 'weight_linear_max_weight': 2.2087000773671255}. Best is trial 161 with value: 0.23590282759169154.
2026-06-01 02:36:15 | INFO | src.nested_cv_avggrm_weighted_unified | Trial 185 | outer=10 | alpha=1.422e+05 n_pcs=4000 (pc_topk) weight_search=on
2026-06-01 02:36:15 | INFO | src.nested_cv_avggrm_weighted_unified | Trial 185 | outer=10 | weight={'name': 'linear', 'floor': 1e-06, 'clip_max': 10.0, 'min_weight': 0.07132641719095338, 'max_weight': 2.210688273903431}
[I 2026-06-01 02:36:21,384] Trial 185 finished with value: 0.23574238732073285 and parameters: {'alpha': 142173.06868694862, 'n_pcs': 4000, 'weight_scheme': 'linear', 'weight_clip_max': 10.0, 'weight_linear_min_weight': 0.07132641719095338, 'weight_linear_max_weight': 2.210688273903431}. Best is trial 161 with value: 0.23590282759169154.
2026-06-01 02:36:21 | INFO | src.nested_cv_avggrm_weighted_unified | Trial 186 | outer=10 | alpha=8.609e+04 n_pcs=3500 (pc_topk) weight_search=on
2026-06-01 02:36:21 | INFO | src.nested_cv_avggrm_weighted_unified | Trial 186 | outer=10 | weight={'name': 'linear', 'floor': 1e-06, 'clip_max': 10.0, 'min_weight': 0.09262776238148021, 'max_weight': 2.1348859101827102}
2026-06-01 02:36:25 | INFO | src.nested_cv_avggrm_weighted_unified | Trial 186 | outer=10 | pruned after 8/10 inner folds (mean r=0.2667)
[I 2026-06-01 02:36:25,326] Trial 186 pruned. 
2026-06-01 02:36:25 | INFO | src.nested_cv_avggrm_weighted_unified | Trial 187 | outer=10 | alpha=1.684e+05 n_pcs=4000 (pc_topk) weight_search=on
2026-06-01 02:36:25 | INFO | src.nested_cv_avggrm_weighted_unified | Trial 187 | outer=10 | weight={'name': 'linear', 'floor': 1e-06, 'clip_max': 10.0, 'min_weight': 0.07163279920361809, 'max_weight': 2.919193813456678}
[I 2026-06-01 02:36:31,122] Trial 187 finished with value: 0.23547004598385737 and parameters: {'alpha': 168374.52744357524, 'n_pcs': 4000, 'weight_scheme': 'linear', 'weight_clip_max': 10.0, 'weight_linear_min_weight': 0.07163279920361809, 'weight_linear_max_weight': 2.919193813456678}. Best is trial 161 with value: 0.23590282759169154.
2026-06-01 02:36:31 | INFO | src.nested_cv_avggrm_weighted_unified | Trial 188 | outer=10 | alpha=1.263e+05 n_pcs=4000 (pc_topk) weight_search=on
2026-06-01 02:36:31 | INFO | src.nested_cv_avggrm_weighted_unified | Trial 188 | outer=10 | weight={'name': 'linear', 'floor': 1e-06, 'clip_max': 10.0, 'min_weight': 0.1267965192315766, 'max_weight': 2.3722296125853375}
