[I 2026-06-01 16:41:21,984] Trial 194 finished with value: 0.20814159360825654 and parameters: {'alpha': 85692.67873748581, 'n_pcs': 4500, 'iw_method': 'pc_logistic', 'iw_clip_max': 2.5, 'iw_prob_clip': 0.0005001101516995896, 'iw_n_components': 80, 'iw_logistic_c': 1.3069249877640062e-05, 'iw_pca_fit': 'combined', 'iw_solver': 'lbfgs', 'iw_rho': 1.0}. Best is trial 179 with value: 0.20823535455994152.
2026-06-01 16:41:22 | INFO | Trial 195 | outer=3 | alpha=1.113e+05 n_pcs=4500 (pc_topk) weight={'name': 'pc_logistic', 'floor': 1e-06, 'clip_max': 12.0, 'prob_clip': 0.0005011757333214615, 'n_components': 80, 'logistic_c': 2.836345548808537e-06, 'pca_fit': 'combined', 'solver': 'lbfgs', 'max_iter': 2000, 'fit_intercept': True, 'standardize_with_source': True, 'rho': 1.0}
[I 2026-06-01 16:41:36,673] Trial 195 finished with value: 0.20411070551924748 and parameters: {'alpha': 111275.22270624884, 'n_pcs': 4500, 'iw_method': 'pc_logistic', 'iw_clip_max': 12.0, 'iw_prob_clip': 0.0005011757333214615, 'iw_n_components': 80, 'iw_logistic_c': 2.836345548808537e-06, 'iw_pca_fit': 'combined', 'iw_solver': 'lbfgs', 'iw_rho': 1.0}. Best is trial 179 with value: 0.20823535455994152.
2026-06-01 16:41:36 | INFO | Trial 196 | outer=3 | alpha=9.056e+04 n_pcs=4500 (pc_topk) weight={'name': 'pc_logistic', 'floor': 1e-06, 'clip_max': 2.5, 'prob_clip': 0.0005065292153821524, 'n_components': 80, 'logistic_c': 1.3660780630814318e-05, 'pca_fit': 'combined', 'solver': 'lbfgs', 'max_iter': 2000, 'fit_intercept': True, 'standardize_with_source': True, 'rho': 1.0}
[I 2026-06-01 16:41:52,154] Trial 196 finished with value: 0.20813562963937082 and parameters: {'alpha': 90560.61977861071, 'n_pcs': 4500, 'iw_method': 'pc_logistic', 'iw_clip_max': 2.5, 'iw_prob_clip': 0.0005065292153821524, 'iw_n_components': 80, 'iw_logistic_c': 1.3660780630814318e-05, 'iw_pca_fit': 'combined', 'iw_solver': 'lbfgs', 'iw_rho': 1.0}. Best is trial 179 with value: 0.20823535455994152.
2026-06-01 16:41:52 | INFO | Trial 197 | outer=3 | alpha=9.515e+04 n_pcs=4500 (pc_topk) weight={'name': 'pc_logistic', 'floor': 1e-06, 'clip_max': 4.0, 'prob_clip': 0.0006034620376074446, 'n_components': 80, 'logistic_c': 1.1746052649984213e-05, 'pca_fit': 'combined', 'solver': 'lbfgs', 'max_iter': 2000, 'fit_intercept': True, 'standardize_with_source': True, 'rho': 1.0}
[I 2026-06-01 16:42:20,915] Trial 197 finished with value: 0.20673080576922512 and parameters: {'alpha': 95154.10674634734, 'n_pcs': 4500, 'iw_method': 'pc_logistic', 'iw_clip_max': 4.0, 'iw_prob_clip': 0.0006034620376074446, 'iw_n_components': 80, 'iw_logistic_c': 1.1746052649984213e-05, 'iw_pca_fit': 'combined', 'iw_solver': 'lbfgs', 'iw_rho': 1.0}. Best is trial 179 with value: 0.20823535455994152.
2026-06-01 16:42:20 | INFO | Trial 198 | outer=3 | alpha=8.969e+04 n_pcs=4500 (pc_topk) weight={'name': 'pc_logistic', 'floor': 1e-06, 'clip_max': 2.5, 'prob_clip': 0.0005027975197000639, 'n_components': 80, 'logistic_c': 5.759511171928459e-06, 'pca_fit': 'combined', 'solver': 'lbfgs', 'max_iter': 2000, 'fit_intercept': True, 'standardize_with_source': True, 'rho': 1.0}
[I 2026-06-01 16:42:43,330] Trial 198 finished with value: 0.20676854183277 and parameters: {'alpha': 89690.26971373244, 'n_pcs': 4500, 'iw_method': 'pc_logistic', 'iw_clip_max': 2.5, 'iw_prob_clip': 0.0005027975197000639, 'iw_n_components': 80, 'iw_logistic_c': 5.759511171928459e-06, 'iw_pca_fit': 'combined', 'iw_solver': 'lbfgs', 'iw_rho': 1.0}. Best is trial 179 with value: 0.20823535455994152.
2026-06-01 16:42:43 | INFO | Trial 199 | outer=3 | alpha=1.012e+05 n_pcs=4500 (pc_topk) weight={'name': 'pc_logistic', 'floor': 1e-06, 'clip_max': 2.5, 'prob_clip': 0.008958235809496194, 'n_components': 80, 'logistic_c': 1.4126197259218991e-05, 'pca_fit': 'combined', 'solver': 'lbfgs', 'max_iter': 2000, 'fit_intercept': True, 'standardize_with_source': True, 'rho': 1.0}
[I 2026-06-01 16:43:00,871] Trial 199 finished with value: 0.20813315968438245 and parameters: {'alpha': 101246.98052161266, 'n_pcs': 4500, 'iw_method': 'pc_logistic', 'iw_clip_max': 2.5, 'iw_prob_clip': 0.008958235809496194, 'iw_n_components': 80, 'iw_logistic_c': 1.4126197259218991e-05, 'iw_pca_fit': 'combined', 'iw_solver': 'lbfgs', 'iw_rho': 1.0}. Best is trial 179 with value: 0.20823535455994152.
2026-06-01 16:43:00 | INFO | Trial 200 | outer=3 | alpha=9.598e+04 n_pcs=4500 (pc_topk) weight={'name': 'pc_logistic', 'floor': 1e-06, 'clip_max': 2.5, 'prob_clip': 0.0006505051494213666, 'n_components': 80, 'logistic_c': 1.5395390735311945e-05, 'pca_fit': 'combined', 'solver': 'lbfgs', 'max_iter': 2000, 'fit_intercept': True, 'standardize_with_source': True, 'rho': 1.0}
[I 2026-06-01 16:43:15,957] Trial 200 finished with value: 0.20806880517568055 and parameters: {'alpha': 95982.34069292298, 'n_pcs': 4500, 'iw_method': 'pc_logistic', 'iw_clip_max': 2.5, 'iw_prob_clip': 0.0006505051494213666, 'iw_n_components': 80, 'iw_logistic_c': 1.5395390735311945e-05, 'iw_pca_fit': 'combined', 'iw_solver': 'lbfgs', 'iw_rho': 1.0}. Best is trial 179 with value: 0.20823535455994152.
2026-06-01 16:43:15 | INFO | Trial 201 | outer=3 | alpha=9.103e+04 n_pcs=4500 (pc_topk) weight={'name': 'pc_logistic', 'floor': 1e-06, 'clip_max': 2.5, 'prob_clip': 0.0006406334133580375, 'n_components': 80, 'logistic_c': 1.4159617515044298e-05, 'pca_fit': 'combined', 'solver': 'lbfgs', 'max_iter': 2000, 'fit_intercept': True, 'standardize_with_source': True, 'rho': 1.0}
[I 2026-06-01 16:43:32,563] Trial 201 finished with value: 0.2081081413675514 and parameters: {'alpha': 91031.26772885496, 'n_pcs': 4500, 'iw_method': 'pc_logistic', 'iw_clip_max': 2.5, 'iw_prob_clip': 0.0006406334133580375, 'iw_n_components': 80, 'iw_logistic_c': 1.4159617515044298e-05, 'iw_pca_fit': 'combined', 'iw_solver': 'lbfgs', 'iw_rho': 1.0}. Best is trial 179 with value: 0.20823535455994152.
2026-06-01 16:43:32 | INFO | Trial 202 | outer=3 | alpha=1.491e+05 n_pcs=4500 (pc_topk) weight={'name': 'pc_logistic', 'floor': 1e-06, 'clip_max': 2.5, 'prob_clip': 0.007509993757749792, 'n_components': 80, 'logistic_c': 1.450362823555338e-05, 'pca_fit': 'combined', 'solver': 'lbfgs', 'max_iter': 2000, 'fit_intercept': True, 'standardize_with_source': True, 'rho': 1.0}
[I 2026-06-01 16:43:47,536] Trial 202 finished with value: 0.20774145964824564 and parameters: {'alpha': 149124.77508079773, 'n_pcs': 4500, 'iw_method': 'pc_logistic', 'iw_clip_max': 2.5, 'iw_prob_clip': 0.007509993757749792, 'iw_n_components': 80, 'iw_logistic_c': 1.450362823555338e-05, 'iw_pca_fit': 'combined', 'iw_solver': 'lbfgs', 'iw_rho': 1.0}. Best is trial 179 with value: 0.20823535455994152.
2026-06-01 16:43:47 | INFO | Trial 203 | outer=3 | alpha=1.003e+05 n_pcs=4500 (pc_topk) weight={'name': 'pc_logistic', 'floor': 1e-06, 'clip_max': 2.5, 'prob_clip': 0.00854554423322164, 'n_components': 80, 'logistic_c': 1.4174572193899836e-05, 'pca_fit': 'combined', 'solver': 'lbfgs', 'max_iter': 2000, 'fit_intercept': True, 'standardize_with_source': True, 'rho': 1.0}
[I 2026-06-01 16:44:04,265] Trial 203 finished with value: 0.2081303219675516 and parameters: {'alpha': 100325.19722553616, 'n_pcs': 4500, 'iw_method': 'pc_logistic', 'iw_clip_max': 2.5, 'iw_prob_clip': 0.00854554423322164, 'iw_n_components': 80, 'iw_logistic_c': 1.4174572193899836e-05, 'iw_pca_fit': 'combined', 'iw_solver': 'lbfgs', 'iw_rho': 1.0}. Best is trial 179 with value: 0.20823535455994152.
2026-06-01 16:44:04 | INFO | Trial 204 | outer=3 | alpha=1.514e+05 n_pcs=4500 (pc_topk) weight={'name': 'pc_logistic', 'floor': 1e-06, 'clip_max': 2.5, 'prob_clip': 0.00852287467633861, 'n_components': 80, 'logistic_c': 1.2706232580527318e-05, 'pca_fit': 'combined', 'solver': 'lbfgs', 'max_iter': 2000, 'fit_intercept': True, 'standardize_with_source': True, 'rho': 1.0}
[I 2026-06-01 16:44:31,569] Trial 204 finished with value: 0.207757600643984 and parameters: {'alpha': 151421.73996628608, 'n_pcs': 4500, 'iw_method': 'pc_logistic', 'iw_clip_max': 2.5, 'iw_prob_clip': 0.00852287467633861, 'iw_n_components': 80, 'iw_logistic_c': 1.2706232580527318e-05, 'iw_pca_fit': 'combined', 'iw_solver': 'lbfgs', 'iw_rho': 1.0}. Best is trial 179 with value: 0.20823535455994152.
2026-06-01 16:44:31 | INFO | Trial 205 | outer=3 | alpha=1.034e+05 n_pcs=4500 (pc_topk) weight={'name': 'pc_logistic', 'floor': 1e-06, 'clip_max': 2.5, 'prob_clip': 0.008265306973284202, 'n_components': 80, 'logistic_c': 1.4227283843414484e-05, 'pca_fit': 'combined', 'solver': 'lbfgs', 'max_iter': 2000, 'fit_intercept': True, 'standardize_with_source': True, 'rho': 1.0}
[I 2026-06-01 16:44:46,757] Trial 205 finished with value: 0.20812347071408235 and parameters: {'alpha': 103402.14638641922, 'n_pcs': 4500, 'iw_method': 'pc_logistic', 'iw_clip_max': 2.5, 'iw_prob_clip': 0.008265306973284202, 'iw_n_components': 80, 'iw_logistic_c': 1.4227283843414484e-05, 'iw_pca_fit': 'combined', 'iw_solver': 'lbfgs', 'iw_rho': 1.0}. Best is trial 179 with value: 0.20823535455994152.
2026-06-01 16:44:46 | INFO | Trial 206 | outer=3 | alpha=1.039e+05 n_pcs=4500 (pc_topk) weight={'name': 'pc_logistic', 'floor': 1e-06, 'clip_max': 2.5, 'prob_clip': 0.008219229887406714, 'n_components': 80, 'logistic_c': 1.3971488598210445e-05, 'pca_fit': 'combined', 'solver': 'lbfgs', 'max_iter': 2000, 'fit_intercept': True, 'standardize_with_source': True, 'rho': 1.0}
[I 2026-06-01 16:45:01,538] Trial 206 finished with value: 0.20813789128500954 and parameters: {'alpha': 103929.51269943708, 'n_pcs': 4500, 'iw_method': 'pc_logistic', 'iw_clip_max': 2.5, 'iw_prob_clip': 0.008219229887406714, 'iw_n_components': 80, 'iw_logistic_c': 1.3971488598210445e-05, 'iw_pca_fit': 'combined', 'iw_solver': 'lbfgs', 'iw_rho': 1.0}. Best is trial 179 with value: 0.20823535455994152.
2026-06-01 16:45:01 | INFO | Trial 207 | outer=3 | alpha=7.661e+04 n_pcs=4500 (pc_topk) weight={'name': 'pc_logistic', 'floor': 1e-06, 'clip_max': 2.5, 'prob_clip': 0.009310425703211195, 'n_components': 80, 'logistic_c': 6.603227341159467e-06, 'pca_fit': 'combined', 'solver': 'lbfgs', 'max_iter': 2000, 'fit_intercept': True, 'standardize_with_source': True, 'rho': 1.0}
[I 2026-06-01 16:45:22,371] Trial 207 finished with value: 0.20713371180609402 and parameters: {'alpha': 76609.88889644228, 'n_pcs': 4500, 'iw_method': 'pc_logistic', 'iw_clip_max': 2.5, 'iw_prob_clip': 0.009310425703211195, 'iw_n_components': 80, 'iw_logistic_c': 6.603227341159467e-06, 'iw_pca_fit': 'combined', 'iw_solver': 'lbfgs', 'iw_rho': 1.0}. Best is trial 179 with value: 0.20823535455994152.
2026-06-01 16:45:22 | INFO | Trial 208 | outer=3 | alpha=9.962e+04 n_pcs=4500 (pc_topk) weight={'name': 'pc_logistic', 'floor': 1e-06, 'clip_max': 2.5, 'prob_clip': 0.008497611736253413, 'n_components': 80, 'logistic_c': 1.4865509761287197e-05, 'pca_fit': 'combined', 'solver': 'lbfgs', 'max_iter': 2000, 'fit_intercept': True, 'standardize_with_source': True, 'rho': 1.0}
[I 2026-06-01 16:46:08,399] Trial 208 finished with value: 0.2080985097856504 and parameters: {'alpha': 99615.04471026546, 'n_pcs': 4500, 'iw_method': 'pc_logistic', 'iw_clip_max': 2.5, 'iw_prob_clip': 0.008497611736253413, 'iw_n_components': 80, 'iw_logistic_c': 1.4865509761287197e-05, 'iw_pca_fit': 'combined', 'iw_solver': 'lbfgs', 'iw_rho': 1.0}. Best is trial 179 with value: 0.20823535455994152.
2026-06-01 16:46:08 | INFO | Trial 209 | outer=3 | alpha=1.009e+05 n_pcs=4500 (pc_topk) weight={'name': 'pc_logistic', 'floor': 1e-06, 'clip_max': 2.5, 'prob_clip': 0.008465820685094886, 'n_components': 80, 'logistic_c': 1.4946634554741525e-05, 'pca_fit': 'combined', 'solver': 'lbfgs', 'max_iter': 2000, 'fit_intercept': True, 'standardize_with_source': True, 'rho': 1.0}
[I 2026-06-01 16:46:23,334] Trial 209 finished with value: 0.2080969715302506 and parameters: {'alpha': 100922.41433180802, 'n_pcs': 4500, 'iw_method': 'pc_logistic', 'iw_clip_max': 2.5, 'iw_prob_clip': 0.008465820685094886, 'iw_n_components': 80, 'iw_logistic_c': 1.4946634554741525e-05, 'iw_pca_fit': 'combined', 'iw_solver': 'lbfgs', 'iw_rho': 1.0}. Best is trial 179 with value: 0.20823535455994152.
2026-06-01 16:46:23 | INFO | Trial 210 | outer=3 | alpha=5.938e+04 n_pcs=4500 (pc_topk) weight={'name': 'uniform'}
[I 2026-06-01 16:46:32,525] Trial 210 finished with value: 0.20234597916132113 and parameters: {'alpha': 59378.84241075334, 'n_pcs': 4500, 'iw_method': 'uniform'}. Best is trial 179 with value: 0.20823535455994152.
2026-06-01 16:46:32 | INFO | Trial 211 | outer=3 | alpha=1.058e+05 n_pcs=4500 (pc_topk) weight={'name': 'pc_logistic', 'floor': 1e-06, 'clip_max': 2.5, 'prob_clip': 0.008147114954751417, 'n_components': 80, 'logistic_c': 1.4501778157112439e-05, 'pca_fit': 'combined', 'solver': 'lbfgs', 'max_iter': 2000, 'fit_intercept': True, 'standardize_with_source': True, 'rho': 1.0}
[I 2026-06-01 16:46:47,724] Trial 211 finished with value: 0.20810501351994617 and parameters: {'alpha': 105829.42220366739, 'n_pcs': 4500, 'iw_method': 'pc_logistic', 'iw_clip_max': 2.5, 'iw_prob_clip': 0.008147114954751417, 'iw_n_components': 80, 'iw_logistic_c': 1.4501778157112439e-05, 'iw_pca_fit': 'combined', 'iw_solver': 'lbfgs', 'iw_rho': 1.0}. Best is trial 179 with value: 0.20823535455994152.
2026-06-01 16:46:47 | INFO | Trial 212 | outer=3 | alpha=9.728e+04 n_pcs=4500 (pc_topk) weight={'name': 'pc_logistic', 'floor': 1e-06, 'clip_max': 2.5, 'prob_clip': 0.008296298583529923, 'n_components': 80, 'logistic_c': 1.538021406272947e-05, 'pca_fit': 'combined', 'solver': 'lbfgs', 'max_iter': 2000, 'fit_intercept': True, 'standardize_with_source': True, 'rho': 1.0}
[I 2026-06-01 16:47:03,492] Trial 212 finished with value: 0.20807347748045793 and parameters: {'alpha': 97276.54431758712, 'n_pcs': 4500, 'iw_method': 'pc_logistic', 'iw_clip_max': 2.5, 'iw_prob_clip': 0.008296298583529923, 'iw_n_components': 80, 'iw_logistic_c': 1.538021406272947e-05, 'iw_pca_fit': 'combined', 'iw_solver': 'lbfgs', 'iw_rho': 1.0}. Best is trial 179 with value: 0.20823535455994152.
2026-06-01 16:47:03 | INFO | Trial 213 | outer=3 | alpha=1.030e+05 n_pcs=4500 (pc_topk) weight={'name': 'pc_logistic', 'floor': 1e-06, 'clip_max': 2.5, 'prob_clip': 0.008225652794831135, 'n_components': 80, 'logistic_c': 1.5922089218523785e-05, 'pca_fit': 'combined', 'solver': 'lbfgs', 'max_iter': 2000, 'fit_intercept': True, 'standardize_with_source': True, 'rho': 1.0}
[I 2026-06-01 16:47:19,617] Trial 213 finished with value: 0.20804335249398256 and parameters: {'alpha': 102969.33333222718, 'n_pcs': 4500, 'iw_method': 'pc_logistic', 'iw_clip_max': 2.5, 'iw_prob_clip': 0.008225652794831135, 'iw_n_components': 80, 'iw_logistic_c': 1.5922089218523785e-05, 'iw_pca_fit': 'combined', 'iw_solver': 'lbfgs', 'iw_rho': 1.0}. Best is trial 179 with value: 0.20823535455994152.
2026-06-01 16:47:19 | INFO | Trial 214 | outer=3 | alpha=9.966e+04 n_pcs=4500 (pc_topk) weight={'name': 'pc_logistic', 'floor': 1e-06, 'clip_max': 2.5, 'prob_clip': 0.008351690098309977, 'n_components': 80, 'logistic_c': 1.2305417262735672e-05, 'pca_fit': 'combined', 'solver': 'lbfgs', 'max_iter': 2000, 'fit_intercept': True, 'standardize_with_source': True, 'rho': 1.0}
[I 2026-06-01 16:47:35,041] Trial 214 finished with value: 0.2082306593440853 and parameters: {'alpha': 99664.05622889336, 'n_pcs': 4500, 'iw_method': 'pc_logistic', 'iw_clip_max': 2.5, 'iw_prob_clip': 0.008351690098309977, 'iw_n_components': 80, 'iw_logistic_c': 1.2305417262735672e-05, 'iw_pca_fit': 'combined', 'iw_solver': 'lbfgs', 'iw_rho': 1.0}. Best is trial 179 with value: 0.20823535455994152.
2026-06-01 16:47:35 | INFO | Trial 215 | outer=3 | alpha=9.832e+04 n_pcs=4500 (pc_topk) weight={'name': 'pc_logistic', 'floor': 1e-06, 'clip_max': 2.5, 'prob_clip': 0.008043390537039202, 'n_components': 80, 'logistic_c': 1.5268824243761064e-05, 'pca_fit': 'combined', 'solver': 'lbfgs', 'max_iter': 2000, 'fit_intercept': True, 'standardize_with_source': True, 'rho': 1.0}
[I 2026-06-01 16:47:49,854] Trial 215 finished with value: 0.20808114098226754 and parameters: {'alpha': 98319.90868976209, 'n_pcs': 4500, 'iw_method': 'pc_logistic', 'iw_clip_max': 2.5, 'iw_prob_clip': 0.008043390537039202, 'iw_n_components': 80, 'iw_logistic_c': 1.5268824243761064e-05, 'iw_pca_fit': 'combined', 'iw_solver': 'lbfgs', 'iw_rho': 1.0}. Best is trial 179 with value: 0.20823535455994152.
2026-06-01 16:47:49 | INFO | Trial 216 | outer=3 | alpha=9.928e+04 n_pcs=4500 (pc_topk) weight={'name': 'pc_logistic', 'floor': 1e-06, 'clip_max': 2.5, 'prob_clip': 0.007955050098498085, 'n_components': 80, 'logistic_c': 1.510356042247072e-05, 'pca_fit': 'combined', 'solver': 'lbfgs', 'max_iter': 2000, 'fit_intercept': True, 'standardize_with_source': True, 'rho': 1.0}
[I 2026-06-01 16:48:05,174] Trial 216 finished with value: 0.20809025106339188 and parameters: {'alpha': 99276.79220869034, 'n_pcs': 4500, 'iw_method': 'pc_logistic', 'iw_clip_max': 2.5, 'iw_prob_clip': 0.007955050098498085, 'iw_n_components': 80, 'iw_logistic_c': 1.510356042247072e-05, 'iw_pca_fit': 'combined', 'iw_solver': 'lbfgs', 'iw_rho': 1.0}. Best is trial 179 with value: 0.20823535455994152.
2026-06-01 16:48:05 | INFO | Trial 217 | outer=3 | alpha=9.714e+04 n_pcs=2000 (pc_topk) weight={'name': 'pc_logistic', 'floor': 1e-06, 'clip_max': 2.5, 'prob_clip': 0.008151459932596479, 'n_components': 80, 'logistic_c': 1.3869477023343447e-05, 'pca_fit': 'combined', 'solver': 'lbfgs', 'max_iter': 2000, 'fit_intercept': True, 'standardize_with_source': True, 'rho': 1.0}
[I 2026-06-01 16:48:13,672] Trial 217 finished with value: 0.20866809896703806 and parameters: {'alpha': 97141.17162424565, 'n_pcs': 2000, 'iw_method': 'pc_logistic', 'iw_clip_max': 2.5, 'iw_prob_clip': 0.008151459932596479, 'iw_n_components': 80, 'iw_logistic_c': 1.3869477023343447e-05, 'iw_pca_fit': 'combined', 'iw_solver': 'lbfgs', 'iw_rho': 1.0}. Best is trial 217 with value: 0.20866809896703806.
2026-06-01 16:48:13 | INFO | Trial 218 | outer=3 | alpha=6.504e+04 n_pcs=1500 (pc_topk) weight={'name': 'pc_logistic', 'floor': 1e-06, 'clip_max': 2.5, 'prob_clip': 0.007937015900588195, 'n_components': 80, 'logistic_c': 1.4300237474535921e-05, 'pca_fit': 'combined', 'solver': 'lbfgs', 'max_iter': 2000, 'fit_intercept': True, 'standardize_with_source': True, 'rho': 1.0}
[I 2026-06-01 16:48:24,056] Trial 218 finished with value: 0.19379484026911592 and parameters: {'alpha': 65042.152076643164, 'n_pcs': 1500, 'iw_method': 'pc_logistic', 'iw_clip_max': 2.5, 'iw_prob_clip': 0.007937015900588195, 'iw_n_components': 80, 'iw_logistic_c': 1.4300237474535921e-05, 'iw_pca_fit': 'combined', 'iw_solver': 'lbfgs', 'iw_rho': 1.0}. Best is trial 217 with value: 0.20866809896703806.
2026-06-01 16:48:24 | INFO | Trial 219 | outer=3 | alpha=9.131e+04 n_pcs=2000 (pc_topk) weight={'name': 'pc_logistic', 'floor': 1e-06, 'clip_max': 2.5, 'prob_clip': 0.01024769605983042, 'n_components': 80, 'logistic_c': 1.3594043972617072e-05, 'pca_fit': 'combined', 'solver': 'lbfgs', 'max_iter': 2000, 'fit_intercept': True, 'standardize_with_source': True, 'rho': 1.0}
[I 2026-06-01 16:48:33,213] Trial 219 finished with value: 0.20846281663900687 and parameters: {'alpha': 91310.29117728754, 'n_pcs': 2000, 'iw_method': 'pc_logistic', 'iw_clip_max': 2.5, 'iw_prob_clip': 0.01024769605983042, 'iw_n_components': 80, 'iw_logistic_c': 1.3594043972617072e-05, 'iw_pca_fit': 'combined', 'iw_solver': 'lbfgs', 'iw_rho': 1.0}. Best is trial 217 with value: 0.20866809896703806.
2026-06-01 16:48:33 | INFO | Trial 220 | outer=3 | alpha=9.761e+04 n_pcs=2000 (pc_topk) weight={'name': 'pc_logistic', 'floor': 1e-06, 'clip_max': 2.5, 'prob_clip': 0.010860726422724868, 'n_components': 80, 'logistic_c': 5.3231908646301e-06, 'pca_fit': 'combined', 'solver': 'lbfgs', 'max_iter': 2000, 'fit_intercept': True, 'standardize_with_source': True, 'rho': 1.0}
[I 2026-06-01 16:48:43,689] Trial 220 finished with value: 0.20796042744318757 and parameters: {'alpha': 97613.64704729151, 'n_pcs': 2000, 'iw_method': 'pc_logistic', 'iw_clip_max': 2.5, 'iw_prob_clip': 0.010860726422724868, 'iw_n_components': 80, 'iw_logistic_c': 5.3231908646301e-06, 'iw_pca_fit': 'combined', 'iw_solver': 'lbfgs', 'iw_rho': 1.0}. Best is trial 217 with value: 0.20866809896703806.
2026-06-01 16:48:43 | INFO | Trial 221 | outer=3 | alpha=9.682e+04 n_pcs=2000 (pc_topk) weight={'name': 'pc_logistic', 'floor': 1e-06, 'clip_max': 2.5, 'prob_clip': 0.010523989785332626, 'n_components': 80, 'logistic_c': 4.60639387411606e-06, 'pca_fit': 'combined', 'solver': 'lbfgs', 'max_iter': 2000, 'fit_intercept': True, 'standardize_with_source': True, 'rho': 1.0}
[I 2026-06-01 16:48:51,868] Trial 221 finished with value: 0.2074385871453112 and parameters: {'alpha': 96820.91804950329, 'n_pcs': 2000, 'iw_method': 'pc_logistic', 'iw_clip_max': 2.5, 'iw_prob_clip': 0.010523989785332626, 'iw_n_components': 80, 'iw_logistic_c': 4.60639387411606e-06, 'iw_pca_fit': 'combined', 'iw_solver': 'lbfgs', 'iw_rho': 1.0}. Best is trial 217 with value: 0.20866809896703806.
2026-06-01 16:48:51 | INFO | Trial 222 | outer=3 | alpha=9.616e+04 n_pcs=2000 (pc_topk) weight={'name': 'pc_logistic', 'floor': 1e-06, 'clip_max': 2.5, 'prob_clip': 0.006758844311876246, 'n_components': 80, 'logistic_c': 1.5269811632855904e-05, 'pca_fit': 'combined', 'solver': 'lbfgs', 'max_iter': 2000, 'fit_intercept': True, 'standardize_with_source': True, 'rho': 1.0}
