[I 2026-06-01 00:49:38,442] Trial 101 finished with value: 0.23688492492408325 and parameters: {'alpha': 320216.313721464, 'n_pcs': 4000, 'weight_scheme': 'exponential', 'weight_clip_max': 5.0, 'weight_exponential_beta': 6.388623973659487}. Best is trial 57 with value: 0.23745149892178968.
2026-06-01 00:49:38 | INFO | src.nested_cv_avggrm_weighted_unified | Trial 102 | outer=6 | alpha=2.347e+05 n_pcs=4000 (pc_topk) weight_search=on
2026-06-01 00:49:38 | INFO | src.nested_cv_avggrm_weighted_unified | Trial 102 | outer=6 | weight={'name': 'exponential', 'floor': 1e-06, 'clip_max': 5.0, 'beta': 6.310459667989945}
2026-06-01 00:49:42 | INFO | src.nested_cv_avggrm_weighted_unified | Trial 102 | outer=6 | pruned after 7/10 inner folds (mean r=0.2636)
[I 2026-06-01 00:49:42,077] Trial 102 pruned. 
2026-06-01 00:49:42 | INFO | src.nested_cv_avggrm_weighted_unified | Trial 103 | outer=6 | alpha=3.357e+05 n_pcs=4000 (pc_topk) weight_search=on
2026-06-01 00:49:42 | INFO | src.nested_cv_avggrm_weighted_unified | Trial 103 | outer=6 | weight={'name': 'exponential', 'floor': 1e-06, 'clip_max': 5.0, 'beta': 5.78381231833419}
[I 2026-06-01 00:49:47,256] Trial 103 finished with value: 0.23673232851036569 and parameters: {'alpha': 335682.72254504135, 'n_pcs': 4000, 'weight_scheme': 'exponential', 'weight_clip_max': 5.0, 'weight_exponential_beta': 5.78381231833419}. Best is trial 57 with value: 0.23745149892178968.
2026-06-01 00:49:47 | INFO | src.nested_cv_avggrm_weighted_unified | Trial 104 | outer=6 | alpha=1.717e+05 n_pcs=3500 (pc_topk) weight_search=on
2026-06-01 00:49:47 | INFO | src.nested_cv_avggrm_weighted_unified | Trial 104 | outer=6 | weight={'name': 'exponential', 'floor': 1e-06, 'clip_max': 5.0, 'beta': 5.680330670507987}
2026-06-01 00:49:50 | INFO | src.nested_cv_avggrm_weighted_unified | Trial 104 | outer=6 | pruned after 7/10 inner folds (mean r=0.2607)
[I 2026-06-01 00:49:50,351] Trial 104 pruned. 
2026-06-01 00:49:50 | INFO | src.nested_cv_avggrm_weighted_unified | Trial 105 | outer=6 | alpha=5.092e+05 n_pcs=4000 (pc_topk) weight_search=on
2026-06-01 00:49:50 | INFO | src.nested_cv_avggrm_weighted_unified | Trial 105 | outer=6 | weight={'name': 'exponential', 'floor': 1e-06, 'clip_max': 5.0, 'beta': 5.306227344218599}
[I 2026-06-01 00:49:56,019] Trial 105 finished with value: 0.23513955383931573 and parameters: {'alpha': 509206.5198381464, 'n_pcs': 4000, 'weight_scheme': 'exponential', 'weight_clip_max': 5.0, 'weight_exponential_beta': 5.306227344218599}. Best is trial 57 with value: 0.23745149892178968.
2026-06-01 00:49:56 | INFO | src.nested_cv_avggrm_weighted_unified | Trial 106 | outer=6 | alpha=2.849e+05 n_pcs=4000 (pc_topk) weight_search=on
2026-06-01 00:49:56 | INFO | src.nested_cv_avggrm_weighted_unified | Trial 106 | outer=6 | weight={'name': 'exponential', 'floor': 1e-06, 'clip_max': 5.0, 'beta': 5.8272818018004395}
[I 2026-06-01 00:50:01,330] Trial 106 finished with value: 0.23710658518107594 and parameters: {'alpha': 284912.3803037176, 'n_pcs': 4000, 'weight_scheme': 'exponential', 'weight_clip_max': 5.0, 'weight_exponential_beta': 5.8272818018004395}. Best is trial 57 with value: 0.23745149892178968.
2026-06-01 00:50:01 | INFO | src.nested_cv_avggrm_weighted_unified | Trial 107 | outer=6 | alpha=2.749e+05 n_pcs=3500 (pc_topk) weight_search=on
2026-06-01 00:50:01 | INFO | src.nested_cv_avggrm_weighted_unified | Trial 107 | outer=6 | weight={'name': 'exponential', 'floor': 1e-06, 'clip_max': 5.0, 'beta': 9.905636652104313}
2026-06-01 00:50:04 | INFO | src.nested_cv_avggrm_weighted_unified | Trial 107 | outer=6 | pruned after 6/10 inner folds (mean r=0.2425)
[I 2026-06-01 00:50:04,530] Trial 107 pruned. 
2026-06-01 00:50:04 | INFO | src.nested_cv_avggrm_weighted_unified | Trial 108 | outer=6 | alpha=4.107e+05 n_pcs=1500 (pc_topk) weight_search=on
2026-06-01 00:50:04 | INFO | src.nested_cv_avggrm_weighted_unified | Trial 108 | outer=6 | weight={'name': 'exponential', 'floor': 1e-06, 'clip_max': 5.0, 'beta': 6.137256886310552}
2026-06-01 00:50:06 | INFO | src.nested_cv_avggrm_weighted_unified | Trial 108 | outer=6 | pruned after 6/10 inner folds (mean r=0.2478)
[I 2026-06-01 00:50:06,804] Trial 108 pruned. 
2026-06-01 00:50:06 | INFO | src.nested_cv_avggrm_weighted_unified | Trial 109 | outer=6 | alpha=1.766e+05 n_pcs=3000 (pc_topk) weight_search=on
2026-06-01 00:50:06 | INFO | src.nested_cv_avggrm_weighted_unified | Trial 109 | outer=6 | weight={'name': 'exponential', 'floor': 1e-06, 'clip_max': 3.0, 'beta': 5.555597416837154}
[I 2026-06-01 00:50:10,364] Trial 109 finished with value: 0.23628856053999558 and parameters: {'alpha': 176588.72507297754, 'n_pcs': 3000, 'weight_scheme': 'exponential', 'weight_clip_max': 3.0, 'weight_exponential_beta': 5.555597416837154}. Best is trial 57 with value: 0.23745149892178968.
2026-06-01 00:50:10 | INFO | src.nested_cv_avggrm_weighted_unified | Trial 110 | outer=6 | alpha=2.202e+05 n_pcs=4500 (pc_topk) weight_search=on
2026-06-01 00:50:10 | INFO | src.nested_cv_avggrm_weighted_unified | Trial 110 | outer=6 | weight={'name': 'uniform', 'floor': 1e-06, 'clip_max': 5.0}
2026-06-01 00:50:13 | INFO | src.nested_cv_avggrm_weighted_unified | Trial 110 | outer=6 | pruned after 6/10 inner folds (mean r=0.2386)
[I 2026-06-01 00:50:13,778] Trial 110 pruned. 
2026-06-01 00:50:13 | INFO | src.nested_cv_avggrm_weighted_unified | Trial 111 | outer=6 | alpha=3.001e+05 n_pcs=4000 (pc_topk) weight_search=on
2026-06-01 00:50:13 | INFO | src.nested_cv_avggrm_weighted_unified | Trial 111 | outer=6 | weight={'name': 'exponential', 'floor': 1e-06, 'clip_max': 5.0, 'beta': 5.877267104789315}
[I 2026-06-01 00:50:19,023] Trial 111 finished with value: 0.23701958157489936 and parameters: {'alpha': 300075.8487824409, 'n_pcs': 4000, 'weight_scheme': 'exponential', 'weight_clip_max': 5.0, 'weight_exponential_beta': 5.877267104789315}. Best is trial 57 with value: 0.23745149892178968.
2026-06-01 00:50:19 | INFO | src.nested_cv_avggrm_weighted_unified | Trial 112 | outer=6 | alpha=2.835e+05 n_pcs=4000 (pc_topk) weight_search=on
2026-06-01 00:50:19 | INFO | src.nested_cv_avggrm_weighted_unified | Trial 112 | outer=6 | weight={'name': 'exponential', 'floor': 1e-06, 'clip_max': 5.0, 'beta': 4.563389870068644}
[I 2026-06-01 00:50:24,643] Trial 112 finished with value: 0.2369870055375217 and parameters: {'alpha': 283522.2750971093, 'n_pcs': 4000, 'weight_scheme': 'exponential', 'weight_clip_max': 5.0, 'weight_exponential_beta': 4.563389870068644}. Best is trial 57 with value: 0.23745149892178968.
2026-06-01 00:50:24 | INFO | src.nested_cv_avggrm_weighted_unified | Trial 113 | outer=6 | alpha=2.767e+05 n_pcs=4000 (pc_topk) weight_search=on
2026-06-01 00:50:24 | INFO | src.nested_cv_avggrm_weighted_unified | Trial 113 | outer=6 | weight={'name': 'exponential', 'floor': 1e-06, 'clip_max': 5.0, 'beta': 4.5566447613561545}
[I 2026-06-01 00:50:29,857] Trial 113 finished with value: 0.23704873291218434 and parameters: {'alpha': 276704.93112316023, 'n_pcs': 4000, 'weight_scheme': 'exponential', 'weight_clip_max': 5.0, 'weight_exponential_beta': 4.5566447613561545}. Best is trial 57 with value: 0.23745149892178968.
2026-06-01 00:50:29 | INFO | src.nested_cv_avggrm_weighted_unified | Trial 114 | outer=6 | alpha=2.778e+05 n_pcs=4000 (pc_topk) weight_search=on
2026-06-01 00:50:29 | INFO | src.nested_cv_avggrm_weighted_unified | Trial 114 | outer=6 | weight={'name': 'exponential', 'floor': 1e-06, 'clip_max': 5.0, 'beta': 4.6495786378519455}
[I 2026-06-01 00:50:35,115] Trial 114 finished with value: 0.23707842656727643 and parameters: {'alpha': 277754.80732980475, 'n_pcs': 4000, 'weight_scheme': 'exponential', 'weight_clip_max': 5.0, 'weight_exponential_beta': 4.6495786378519455}. Best is trial 57 with value: 0.23745149892178968.
2026-06-01 00:50:35 | INFO | src.nested_cv_avggrm_weighted_unified | Trial 115 | outer=6 | alpha=2.608e+05 n_pcs=4000 (pc_topk) weight_search=on
2026-06-01 00:50:35 | INFO | src.nested_cv_avggrm_weighted_unified | Trial 115 | outer=6 | weight={'name': 'exponential', 'floor': 1e-06, 'clip_max': 5.0, 'beta': 4.491651938561069}
[I 2026-06-01 00:50:40,309] Trial 115 finished with value: 0.2371687223611279 and parameters: {'alpha': 260846.81076617233, 'n_pcs': 4000, 'weight_scheme': 'exponential', 'weight_clip_max': 5.0, 'weight_exponential_beta': 4.491651938561069}. Best is trial 57 with value: 0.23745149892178968.
2026-06-01 00:50:40 | INFO | src.nested_cv_avggrm_weighted_unified | Trial 116 | outer=6 | alpha=1.473e+05 n_pcs=4000 (pc_topk) weight_search=on
2026-06-01 00:50:40 | INFO | src.nested_cv_avggrm_weighted_unified | Trial 116 | outer=6 | weight={'name': 'exponential', 'floor': 1e-06, 'clip_max': None, 'beta': 4.029061448114316}
2026-06-01 00:50:43 | INFO | src.nested_cv_avggrm_weighted_unified | Trial 116 | outer=6 | pruned after 6/10 inner folds (mean r=0.2376)
[I 2026-06-01 00:50:43,457] Trial 116 pruned. 
2026-06-01 00:50:43 | INFO | src.nested_cv_avggrm_weighted_unified | Trial 117 | outer=6 | alpha=2.617e+05 n_pcs=4000 (pc_topk) weight_search=on
2026-06-01 00:50:43 | INFO | src.nested_cv_avggrm_weighted_unified | Trial 117 | outer=6 | weight={'name': 'linear', 'floor': 1e-06, 'clip_max': 5.0, 'min_weight': 0.5270568908419184, 'max_weight': 1.9883190330069902}
2026-06-01 00:50:46 | INFO | src.nested_cv_avggrm_weighted_unified | Trial 117 | outer=6 | pruned after 6/10 inner folds (mean r=0.2495)
[I 2026-06-01 00:50:46,555] Trial 117 pruned. 
2026-06-01 00:50:46 | INFO | src.nested_cv_avggrm_weighted_unified | Trial 118 | outer=6 | alpha=5.197e+05 n_pcs=3500 (pc_topk) weight_search=on
2026-06-01 00:50:46 | INFO | src.nested_cv_avggrm_weighted_unified | Trial 118 | outer=6 | weight={'name': 'exponential', 'floor': 1e-06, 'clip_max': 5.0, 'beta': 3.408144758158784}
2026-06-01 00:50:49 | INFO | src.nested_cv_avggrm_weighted_unified | Trial 118 | outer=6 | pruned after 6/10 inner folds (mean r=0.2518)
[I 2026-06-01 00:50:49,250] Trial 118 pruned. 
2026-06-01 00:50:49 | INFO | src.nested_cv_avggrm_weighted_unified | Trial 119 | outer=6 | alpha=1.978e+05 n_pcs=4000 (pc_topk) weight_search=on
2026-06-01 00:50:49 | INFO | src.nested_cv_avggrm_weighted_unified | Trial 119 | outer=6 | weight={'name': 'exponential', 'floor': 1e-06, 'clip_max': 5.0, 'beta': 4.553048665991487}
2026-06-01 00:50:52 | INFO | src.nested_cv_avggrm_weighted_unified | Trial 119 | outer=6 | pruned after 7/10 inner folds (mean r=0.2637)
[I 2026-06-01 00:50:52,896] Trial 119 pruned. 
2026-06-01 00:50:52 | INFO | src.nested_cv_avggrm_weighted_unified | Trial 120 | outer=6 | alpha=9.870e+04 n_pcs=4000 (pc_topk) weight_search=on
2026-06-01 00:50:52 | INFO | src.nested_cv_avggrm_weighted_unified | Trial 120 | outer=6 | weight={'name': 'exponential', 'floor': 1e-06, 'clip_max': 5.0, 'beta': 4.924464378256725}
2026-06-01 00:50:56 | INFO | src.nested_cv_avggrm_weighted_unified | Trial 120 | outer=6 | pruned after 7/10 inner folds (mean r=0.2581)
[I 2026-06-01 00:50:56,542] Trial 120 pruned. 
2026-06-01 00:50:56 | INFO | src.nested_cv_avggrm_weighted_unified | Trial 121 | outer=6 | alpha=2.578e+05 n_pcs=4000 (pc_topk) weight_search=on
2026-06-01 00:50:56 | INFO | src.nested_cv_avggrm_weighted_unified | Trial 121 | outer=6 | weight={'name': 'exponential', 'floor': 1e-06, 'clip_max': 5.0, 'beta': 4.568959915402703}
[I 2026-06-01 00:51:01,922] Trial 121 finished with value: 0.23722497196984443 and parameters: {'alpha': 257764.12783959464, 'n_pcs': 4000, 'weight_scheme': 'exponential', 'weight_clip_max': 5.0, 'weight_exponential_beta': 4.568959915402703}. Best is trial 57 with value: 0.23745149892178968.
2026-06-01 00:51:01 | INFO | src.nested_cv_avggrm_weighted_unified | Trial 122 | outer=6 | alpha=3.955e+05 n_pcs=4000 (pc_topk) weight_search=on
2026-06-01 00:51:01 | INFO | src.nested_cv_avggrm_weighted_unified | Trial 122 | outer=6 | weight={'name': 'exponential', 'floor': 1e-06, 'clip_max': 5.0, 'beta': 4.443835324590469}
[I 2026-06-01 00:51:07,202] Trial 122 finished with value: 0.2357897608938453 and parameters: {'alpha': 395508.0293414756, 'n_pcs': 4000, 'weight_scheme': 'exponential', 'weight_clip_max': 5.0, 'weight_exponential_beta': 4.443835324590469}. Best is trial 57 with value: 0.23745149892178968.
2026-06-01 00:51:07 | INFO | src.nested_cv_avggrm_weighted_unified | Trial 123 | outer=6 | alpha=2.673e+05 n_pcs=4000 (pc_topk) weight_search=on
2026-06-01 00:51:07 | INFO | src.nested_cv_avggrm_weighted_unified | Trial 123 | outer=6 | weight={'name': 'exponential', 'floor': 1e-06, 'clip_max': 5.0, 'beta': 4.26754376797399}
[I 2026-06-01 00:51:12,435] Trial 123 finished with value: 0.23690445536514843 and parameters: {'alpha': 267349.9998189438, 'n_pcs': 4000, 'weight_scheme': 'exponential', 'weight_clip_max': 5.0, 'weight_exponential_beta': 4.26754376797399}. Best is trial 57 with value: 0.23745149892178968.
2026-06-01 00:51:12 | INFO | src.nested_cv_avggrm_weighted_unified | Trial 124 | outer=6 | alpha=2.231e+05 n_pcs=4000 (pc_topk) weight_search=on
2026-06-01 00:51:12 | INFO | src.nested_cv_avggrm_weighted_unified | Trial 124 | outer=6 | weight={'name': 'exponential', 'floor': 1e-06, 'clip_max': 5.0, 'beta': 4.6152255190078275}
2026-06-01 00:51:16 | INFO | src.nested_cv_avggrm_weighted_unified | Trial 124 | outer=6 | pruned after 7/10 inner folds (mean r=0.2641)
[I 2026-06-01 00:51:16,073] Trial 124 pruned. 
2026-06-01 00:51:16 | INFO | src.nested_cv_avggrm_weighted_unified | Trial 125 | outer=6 | alpha=1.526e+05 n_pcs=3500 (pc_topk) weight_search=on
2026-06-01 00:51:16 | INFO | src.nested_cv_avggrm_weighted_unified | Trial 125 | outer=6 | weight={'name': 'exponential', 'floor': 1e-06, 'clip_max': 5.0, 'beta': 4.981675431742139}
2026-06-01 00:51:19 | INFO | src.nested_cv_avggrm_weighted_unified | Trial 125 | outer=6 | pruned after 7/10 inner folds (mean r=0.2604)
[I 2026-06-01 00:51:19,233] Trial 125 pruned. 
2026-06-01 00:51:19 | INFO | src.nested_cv_avggrm_weighted_unified | Trial 126 | outer=6 | alpha=4.319e+05 n_pcs=4000 (pc_topk) weight_search=on
2026-06-01 00:51:19 | INFO | src.nested_cv_avggrm_weighted_unified | Trial 126 | outer=6 | weight={'name': 'exponential', 'floor': 1e-06, 'clip_max': 10.0, 'beta': 3.7554237245668998}
2026-06-01 00:51:22 | INFO | src.nested_cv_avggrm_weighted_unified | Trial 126 | outer=6 | pruned after 6/10 inner folds (mean r=0.2411)
[I 2026-06-01 00:51:22,429] Trial 126 pruned. 
2026-06-01 00:51:22 | INFO | src.nested_cv_avggrm_weighted_unified | Trial 127 | outer=6 | alpha=2.855e+05 n_pcs=4000 (pc_topk) weight_search=on
2026-06-01 00:51:22 | INFO | src.nested_cv_avggrm_weighted_unified | Trial 127 | outer=6 | weight={'name': 'exponential', 'floor': 1e-06, 'clip_max': 20.0, 'beta': 4.666487077133364}
2026-06-01 00:51:25 | INFO | src.nested_cv_avggrm_weighted_unified | Trial 127 | outer=6 | pruned after 6/10 inner folds (mean r=0.2329)
[I 2026-06-01 00:51:25,537] Trial 127 pruned. 
2026-06-01 00:51:25 | INFO | src.nested_cv_avggrm_weighted_unified | Trial 128 | outer=6 | alpha=1.844e+05 n_pcs=3500 (pc_topk) weight_search=on
2026-06-01 00:51:25 | INFO | src.nested_cv_avggrm_weighted_unified | Trial 128 | outer=6 | weight={'name': 'exponential', 'floor': 1e-06, 'clip_max': 5.0, 'beta': 4.044527430339832}
2026-06-01 00:51:29 | INFO | src.nested_cv_avggrm_weighted_unified | Trial 128 | outer=6 | pruned after 7/10 inner folds (mean r=0.2625)
[I 2026-06-01 00:51:29,293] Trial 128 pruned. 
2026-06-01 00:51:29 | INFO | src.nested_cv_avggrm_weighted_unified | Trial 129 | outer=6 | alpha=1.219e+05 n_pcs=4000 (pc_topk) weight_search=on
2026-06-01 00:51:29 | INFO | src.nested_cv_avggrm_weighted_unified | Trial 129 | outer=6 | weight={'name': 'exponential', 'floor': 1e-06, 'clip_max': 5.0, 'beta': 3.3475531401274523}
2026-06-01 00:51:32 | INFO | src.nested_cv_avggrm_weighted_unified | Trial 129 | outer=6 | pruned after 7/10 inner folds (mean r=0.2609)
[I 2026-06-01 00:51:32,966] Trial 129 pruned. 
2026-06-01 00:51:32 | INFO | src.nested_cv_avggrm_weighted_unified | Trial 130 | outer=6 | alpha=5.796e+05 n_pcs=4500 (pc_topk) weight_search=on
2026-06-01 00:51:32 | INFO | src.nested_cv_avggrm_weighted_unified | Trial 130 | outer=6 | weight={'name': 'exponential', 'floor': 1e-06, 'clip_max': 5.0, 'beta': 5.329730571741083}
2026-06-01 00:51:37 | INFO | src.nested_cv_avggrm_weighted_unified | Trial 130 | outer=6 | pruned after 7/10 inner folds (mean r=0.2642)
[I 2026-06-01 00:51:37,416] Trial 130 pruned. 
2026-06-01 00:51:37 | INFO | src.nested_cv_avggrm_weighted_unified | Trial 131 | outer=6 | alpha=2.696e+05 n_pcs=4000 (pc_topk) weight_search=on
2026-06-01 00:51:37 | INFO | src.nested_cv_avggrm_weighted_unified | Trial 131 | outer=6 | weight={'name': 'exponential', 'floor': 1e-06, 'clip_max': 5.0, 'beta': 4.314075538203473}
[I 2026-06-01 00:51:42,582] Trial 131 finished with value: 0.23693210147943272 and parameters: {'alpha': 269595.90334481554, 'n_pcs': 4000, 'weight_scheme': 'exponential', 'weight_clip_max': 5.0, 'weight_exponential_beta': 4.314075538203473}. Best is trial 57 with value: 0.23745149892178968.
2026-06-01 00:51:42 | INFO | src.nested_cv_avggrm_weighted_unified | Trial 132 | outer=6 | alpha=2.349e+05 n_pcs=4000 (pc_topk) weight_search=on
2026-06-01 00:51:42 | INFO | src.nested_cv_avggrm_weighted_unified | Trial 132 | outer=6 | weight={'name': 'exponential', 'floor': 1e-06, 'clip_max': 5.0, 'beta': 4.239500865094984}
[I 2026-06-01 00:51:48,041] Trial 132 finished with value: 0.2371998257038023 and parameters: {'alpha': 234909.12056626234, 'n_pcs': 4000, 'weight_scheme': 'exponential', 'weight_clip_max': 5.0, 'weight_exponential_beta': 4.239500865094984}. Best is trial 57 with value: 0.23745149892178968.
2026-06-01 00:51:48 | INFO | src.nested_cv_avggrm_weighted_unified | Trial 133 | outer=6 | alpha=2.113e+05 n_pcs=4000 (pc_topk) weight_search=on
2026-06-01 00:51:48 | INFO | src.nested_cv_avggrm_weighted_unified | Trial 133 | outer=6 | weight={'name': 'exponential', 'floor': 1e-06, 'clip_max': 5.0, 'beta': 4.227602568442547}
2026-06-01 00:51:51 | INFO | src.nested_cv_avggrm_weighted_unified | Trial 133 | outer=6 | pruned after 7/10 inner folds (mean r=0.2640)
[I 2026-06-01 00:51:51,677] Trial 133 pruned. 
2026-06-01 00:51:51 | INFO | src.nested_cv_avggrm_weighted_unified | Trial 134 | outer=6 | alpha=2.577e+05 n_pcs=4000 (pc_topk) weight_search=on
2026-06-01 00:51:51 | INFO | src.nested_cv_avggrm_weighted_unified | Trial 134 | outer=6 | weight={'name': 'exponential', 'floor': 1e-06, 'clip_max': 5.0, 'beta': 4.826902365711488}
[I 2026-06-01 00:51:57,073] Trial 134 finished with value: 0.23729623123101123 and parameters: {'alpha': 257685.40745989024, 'n_pcs': 4000, 'weight_scheme': 'exponential', 'weight_clip_max': 5.0, 'weight_exponential_beta': 4.826902365711488}. Best is trial 57 with value: 0.23745149892178968.
2026-06-01 00:51:57 | INFO | src.nested_cv_avggrm_weighted_unified | Trial 135 | outer=6 | alpha=4.599e+03 n_pcs=4000 (pc_topk) weight_search=on
2026-06-01 00:51:57 | INFO | src.nested_cv_avggrm_weighted_unified | Trial 135 | outer=6 | weight={'name': 'exponential', 'floor': 1e-06, 'clip_max': 5.0, 'beta': 4.858806832447401}
2026-06-01 00:51:59 | INFO | src.nested_cv_avggrm_weighted_unified | Trial 135 | outer=6 | pruned after 5/10 inner folds (mean r=0.1796)
[I 2026-06-01 00:51:59,670] Trial 135 pruned. 
2026-06-01 00:51:59 | INFO | src.nested_cv_avggrm_weighted_unified | Trial 136 | outer=6 | alpha=3.791e+05 n_pcs=4000 (pc_topk) weight_search=on
2026-06-01 00:51:59 | INFO | src.nested_cv_avggrm_weighted_unified | Trial 136 | outer=6 | weight={'name': 'exponential', 'floor': 1e-06, 'clip_max': 5.0, 'beta': 5.150651281355639}
[I 2026-06-01 00:52:04,921] Trial 136 finished with value: 0.23623812280532927 and parameters: {'alpha': 379089.419757201, 'n_pcs': 4000, 'weight_scheme': 'exponential', 'weight_clip_max': 5.0, 'weight_exponential_beta': 5.150651281355639}. Best is trial 57 with value: 0.23745149892178968.
2026-06-01 00:52:04 | INFO | src.nested_cv_avggrm_weighted_unified | Trial 137 | outer=6 | alpha=1.571e+05 n_pcs=4500 (pc_topk) weight_search=on
2026-06-01 00:52:04 | INFO | src.nested_cv_avggrm_weighted_unified | Trial 137 | outer=6 | weight={'name': 'exponential', 'floor': 1e-06, 'clip_max': 5.0, 'beta': 4.511074513370434}
2026-06-01 00:52:09 | INFO | src.nested_cv_avggrm_weighted_unified | Trial 137 | outer=6 | pruned after 7/10 inner folds (mean r=0.2626)
[I 2026-06-01 00:52:09,361] Trial 137 pruned. 
2026-06-01 00:52:09 | INFO | src.nested_cv_avggrm_weighted_unified | Trial 138 | outer=6 | alpha=4.686e+06 n_pcs=3500 (pc_topk) weight_search=on
2026-06-01 00:52:09 | INFO | src.nested_cv_avggrm_weighted_unified | Trial 138 | outer=6 | weight={'name': 'uniform', 'floor': 1e-06, 'clip_max': 5.0}
2026-06-01 00:52:11 | INFO | src.nested_cv_avggrm_weighted_unified | Trial 138 | outer=6 | pruned after 5/10 inner folds (mean r=0.1989)
[I 2026-06-01 00:52:11,259] Trial 138 pruned. 
2026-06-01 00:52:11 | INFO | src.nested_cv_avggrm_weighted_unified | Trial 139 | outer=6 | alpha=2.333e+05 n_pcs=4000 (pc_topk) weight_search=on
2026-06-01 00:52:11 | INFO | src.nested_cv_avggrm_weighted_unified | Trial 139 | outer=6 | weight={'name': 'exponential', 'floor': 1e-06, 'clip_max': 3.0, 'beta': 3.953448119277543}
[I 2026-06-01 00:52:16,446] Trial 139 finished with value: 0.2374194029891327 and parameters: {'alpha': 233321.90760920118, 'n_pcs': 4000, 'weight_scheme': 'exponential', 'weight_clip_max': 3.0, 'weight_exponential_beta': 3.953448119277543}. Best is trial 57 with value: 0.23745149892178968.
2026-06-01 00:52:16 | INFO | src.nested_cv_avggrm_weighted_unified | Trial 140 | outer=6 | alpha=2.225e+05 n_pcs=2000 (pc_topk) weight_search=on
2026-06-01 00:52:16 | INFO | src.nested_cv_avggrm_weighted_unified | Trial 140 | outer=6 | weight={'name': 'exponential', 'floor': 1e-06, 'clip_max': 3.0, 'beta': 3.453127176580895}
2026-06-01 00:52:17 | INFO | src.nested_cv_avggrm_weighted_unified | Trial 140 | outer=6 | pruned after 7/10 inner folds (mean r=0.2622)
