[I 2026-06-01 20:11:32,655] Trial 150 finished with value: 0.23591917167344834 and parameters: {'alpha': 64551.60078798379, 'n_pcs': 4000, 'iw_method': 'pc_logistic', 'iw_clip_max': 1.5, 'iw_prob_clip': 0.042357787540367696, 'iw_n_components': 60, 'iw_logistic_c': 0.4395977449478127, 'iw_pca_fit': 'combined', 'iw_solver': 'lbfgs', 'iw_rho': 1.0}. Best is trial 108 with value: 0.23595167441312664.
2026-06-01 20:11:32 | INFO | Trial 151 | outer=6 | alpha=6.256e+04 n_pcs=4000 (pc_topk) weight={'name': 'pc_logistic', 'floor': 1e-06, 'clip_max': 1.5, 'prob_clip': 0.0421863624995845, 'n_components': 80, 'logistic_c': 0.4252215732426462, 'pca_fit': 'combined', 'solver': 'lbfgs', 'max_iter': 2000, 'fit_intercept': True, 'standardize_with_source': True, 'rho': 1.0}
[I 2026-06-01 20:11:57,894] Trial 151 finished with value: 0.2356400258412769 and parameters: {'alpha': 62557.03051304705, 'n_pcs': 4000, 'iw_method': 'pc_logistic', 'iw_clip_max': 1.5, 'iw_prob_clip': 0.0421863624995845, 'iw_n_components': 80, 'iw_logistic_c': 0.4252215732426462, 'iw_pca_fit': 'combined', 'iw_solver': 'lbfgs', 'iw_rho': 1.0}. Best is trial 108 with value: 0.23595167441312664.
2026-06-01 20:11:57 | INFO | Trial 152 | outer=6 | alpha=6.694e+04 n_pcs=4000 (pc_topk) weight={'name': 'pc_logistic', 'floor': 1e-06, 'clip_max': 2.5, 'prob_clip': 0.040307011343154696, 'n_components': 80, 'logistic_c': 0.28925890011660305, 'pca_fit': 'combined', 'solver': 'lbfgs', 'max_iter': 2000, 'fit_intercept': True, 'standardize_with_source': True, 'rho': 1.0}
[I 2026-06-01 20:12:22,646] Trial 152 finished with value: 0.23173838214895254 and parameters: {'alpha': 66936.8251867428, 'n_pcs': 4000, 'iw_method': 'pc_logistic', 'iw_clip_max': 2.5, 'iw_prob_clip': 0.040307011343154696, 'iw_n_components': 80, 'iw_logistic_c': 0.28925890011660305, 'iw_pca_fit': 'combined', 'iw_solver': 'lbfgs', 'iw_rho': 1.0}. Best is trial 108 with value: 0.23595167441312664.
2026-06-01 20:12:22 | INFO | Trial 153 | outer=6 | alpha=5.905e+04 n_pcs=4000 (pc_topk) weight={'name': 'pc_logistic', 'floor': 1e-06, 'clip_max': 1.5, 'prob_clip': 0.04823556485293039, 'n_components': 80, 'logistic_c': 0.4368854392482688, 'pca_fit': 'combined', 'solver': 'lbfgs', 'max_iter': 2000, 'fit_intercept': True, 'standardize_with_source': True, 'rho': 1.0}
[I 2026-06-01 20:12:48,030] Trial 153 finished with value: 0.2355911715550258 and parameters: {'alpha': 59053.48502179835, 'n_pcs': 4000, 'iw_method': 'pc_logistic', 'iw_clip_max': 1.5, 'iw_prob_clip': 0.04823556485293039, 'iw_n_components': 80, 'iw_logistic_c': 0.4368854392482688, 'iw_pca_fit': 'combined', 'iw_solver': 'lbfgs', 'iw_rho': 1.0}. Best is trial 108 with value: 0.23595167441312664.
2026-06-01 20:12:48 | INFO | Trial 154 | outer=6 | alpha=3.718e+04 n_pcs=4000 (pc_topk) weight={'name': 'pc_logistic', 'floor': 1e-06, 'clip_max': 1.5, 'prob_clip': 0.04773337880447725, 'n_components': 80, 'logistic_c': 0.21357840034438358, 'pca_fit': 'combined', 'solver': 'lbfgs', 'max_iter': 2000, 'fit_intercept': True, 'standardize_with_source': True, 'rho': 1.0}
[I 2026-06-01 20:13:14,449] Trial 154 finished with value: 0.23366216175275784 and parameters: {'alpha': 37181.946367540586, 'n_pcs': 4000, 'iw_method': 'pc_logistic', 'iw_clip_max': 1.5, 'iw_prob_clip': 0.04773337880447725, 'iw_n_components': 80, 'iw_logistic_c': 0.21357840034438358, 'iw_pca_fit': 'combined', 'iw_solver': 'lbfgs', 'iw_rho': 1.0}. Best is trial 108 with value: 0.23595167441312664.
2026-06-01 20:13:14 | INFO | Trial 155 | outer=6 | alpha=6.211e+04 n_pcs=4000 (pc_topk) weight={'name': 'pc_logistic', 'floor': 1e-06, 'clip_max': 1.5, 'prob_clip': 0.031166601801987395, 'n_components': 80, 'logistic_c': 0.5042934419713985, 'pca_fit': 'combined', 'solver': 'lbfgs', 'max_iter': 2000, 'fit_intercept': True, 'standardize_with_source': True, 'rho': 1.0}
[I 2026-06-01 20:13:39,479] Trial 155 finished with value: 0.23509689767880024 and parameters: {'alpha': 62107.249645921205, 'n_pcs': 4000, 'iw_method': 'pc_logistic', 'iw_clip_max': 1.5, 'iw_prob_clip': 0.031166601801987395, 'iw_n_components': 80, 'iw_logistic_c': 0.5042934419713985, 'iw_pca_fit': 'combined', 'iw_solver': 'lbfgs', 'iw_rho': 1.0}. Best is trial 108 with value: 0.23595167441312664.
2026-06-01 20:13:39 | INFO | Trial 156 | outer=6 | alpha=6.086e+04 n_pcs=4000 (pc_topk) weight={'name': 'pc_logistic', 'floor': 1e-06, 'clip_max': 1.5, 'prob_clip': 0.027024858261133905, 'n_components': 80, 'logistic_c': 0.06424973555640102, 'pca_fit': 'combined', 'solver': 'lbfgs', 'max_iter': 2000, 'fit_intercept': True, 'standardize_with_source': True, 'rho': 1.0}
[I 2026-06-01 20:14:03,715] Trial 156 finished with value: 0.2353793547389015 and parameters: {'alpha': 60860.787106135474, 'n_pcs': 4000, 'iw_method': 'pc_logistic', 'iw_clip_max': 1.5, 'iw_prob_clip': 0.027024858261133905, 'iw_n_components': 80, 'iw_logistic_c': 0.06424973555640102, 'iw_pca_fit': 'combined', 'iw_solver': 'lbfgs', 'iw_rho': 1.0}. Best is trial 108 with value: 0.23595167441312664.
2026-06-01 20:14:03 | INFO | Trial 157 | outer=6 | alpha=5.565e+04 n_pcs=4000 (pc_topk) weight={'name': 'pc_logistic', 'floor': 1e-06, 'clip_max': 1.5, 'prob_clip': 0.02616863547276884, 'n_components': 80, 'logistic_c': 0.0971488913816954, 'pca_fit': 'combined', 'solver': 'lbfgs', 'max_iter': 2000, 'fit_intercept': True, 'standardize_with_source': True, 'rho': 1.0}
[I 2026-06-01 20:14:28,505] Trial 157 finished with value: 0.23481731180774573 and parameters: {'alpha': 55645.541275186784, 'n_pcs': 4000, 'iw_method': 'pc_logistic', 'iw_clip_max': 1.5, 'iw_prob_clip': 0.02616863547276884, 'iw_n_components': 80, 'iw_logistic_c': 0.0971488913816954, 'iw_pca_fit': 'combined', 'iw_solver': 'lbfgs', 'iw_rho': 1.0}. Best is trial 108 with value: 0.23595167441312664.
2026-06-01 20:14:28 | INFO | Trial 158 | outer=6 | alpha=5.628e+04 n_pcs=4000 (pc_topk) weight={'name': 'pc_logistic', 'floor': 1e-06, 'clip_max': 1.5, 'prob_clip': 0.026070699373520852, 'n_components': 80, 'logistic_c': 0.07388718338489358, 'pca_fit': 'combined', 'solver': 'lbfgs', 'max_iter': 2000, 'fit_intercept': True, 'standardize_with_source': True, 'rho': 1.0}
[I 2026-06-01 20:14:53,672] Trial 158 finished with value: 0.23490007796099582 and parameters: {'alpha': 56277.610007311436, 'n_pcs': 4000, 'iw_method': 'pc_logistic', 'iw_clip_max': 1.5, 'iw_prob_clip': 0.026070699373520852, 'iw_n_components': 80, 'iw_logistic_c': 0.07388718338489358, 'iw_pca_fit': 'combined', 'iw_solver': 'lbfgs', 'iw_rho': 1.0}. Best is trial 108 with value: 0.23595167441312664.
2026-06-01 20:14:53 | INFO | Trial 159 | outer=6 | alpha=3.663e+04 n_pcs=4000 (pc_topk) weight={'name': 'pc_logistic', 'floor': 1e-06, 'clip_max': 1.5, 'prob_clip': 0.02699524051615159, 'n_components': 80, 'logistic_c': 0.07670236742991712, 'pca_fit': 'combined', 'solver': 'lbfgs', 'max_iter': 2000, 'fit_intercept': True, 'standardize_with_source': True, 'rho': 1.0}
[I 2026-06-01 20:15:18,403] Trial 159 finished with value: 0.2330848678154332 and parameters: {'alpha': 36630.30370813329, 'n_pcs': 4000, 'iw_method': 'pc_logistic', 'iw_clip_max': 1.5, 'iw_prob_clip': 0.02699524051615159, 'iw_n_components': 80, 'iw_logistic_c': 0.07670236742991712, 'iw_pca_fit': 'combined', 'iw_solver': 'lbfgs', 'iw_rho': 1.0}. Best is trial 108 with value: 0.23595167441312664.
2026-06-01 20:15:18 | INFO | Trial 160 | outer=6 | alpha=5.129e+04 n_pcs=4000 (pc_topk) weight={'name': 'pc_logistic', 'floor': 1e-06, 'clip_max': 1.5, 'prob_clip': 0.032296498061196874, 'n_components': 80, 'logistic_c': 0.08711685277949757, 'pca_fit': 'combined', 'solver': 'lbfgs', 'max_iter': 2000, 'fit_intercept': True, 'standardize_with_source': True, 'rho': 1.0}
[I 2026-06-01 20:15:44,794] Trial 160 finished with value: 0.23521908788894472 and parameters: {'alpha': 51291.03696822606, 'n_pcs': 4000, 'iw_method': 'pc_logistic', 'iw_clip_max': 1.5, 'iw_prob_clip': 0.032296498061196874, 'iw_n_components': 80, 'iw_logistic_c': 0.08711685277949757, 'iw_pca_fit': 'combined', 'iw_solver': 'lbfgs', 'iw_rho': 1.0}. Best is trial 108 with value: 0.23595167441312664.
2026-06-01 20:15:44 | INFO | Trial 161 | outer=6 | alpha=5.457e+04 n_pcs=4000 (pc_topk) weight={'name': 'pc_logistic', 'floor': 1e-06, 'clip_max': 1.5, 'prob_clip': 0.026120857086972017, 'n_components': 80, 'logistic_c': 0.08223432013635704, 'pca_fit': 'combined', 'solver': 'lbfgs', 'max_iter': 2000, 'fit_intercept': True, 'standardize_with_source': True, 'rho': 1.0}
[I 2026-06-01 20:16:10,013] Trial 161 finished with value: 0.23487627231365882 and parameters: {'alpha': 54566.38546340853, 'n_pcs': 4000, 'iw_method': 'pc_logistic', 'iw_clip_max': 1.5, 'iw_prob_clip': 0.026120857086972017, 'iw_n_components': 80, 'iw_logistic_c': 0.08223432013635704, 'iw_pca_fit': 'combined', 'iw_solver': 'lbfgs', 'iw_rho': 1.0}. Best is trial 108 with value: 0.23595167441312664.
2026-06-01 20:16:10 | INFO | Trial 162 | outer=6 | alpha=5.781e+04 n_pcs=4000 (pc_topk) weight={'name': 'pc_logistic', 'floor': 1e-06, 'clip_max': 1.5, 'prob_clip': 0.025994210412233116, 'n_components': 80, 'logistic_c': 0.05845368596658227, 'pca_fit': 'combined', 'solver': 'lbfgs', 'max_iter': 2000, 'fit_intercept': True, 'standardize_with_source': True, 'rho': 1.0}
[I 2026-06-01 20:16:34,971] Trial 162 finished with value: 0.23513898376687573 and parameters: {'alpha': 57807.50194817293, 'n_pcs': 4000, 'iw_method': 'pc_logistic', 'iw_clip_max': 1.5, 'iw_prob_clip': 0.025994210412233116, 'iw_n_components': 80, 'iw_logistic_c': 0.05845368596658227, 'iw_pca_fit': 'combined', 'iw_solver': 'lbfgs', 'iw_rho': 1.0}. Best is trial 108 with value: 0.23595167441312664.
2026-06-01 20:16:35 | INFO | Trial 163 | outer=6 | alpha=5.507e+04 n_pcs=4000 (pc_topk) weight={'name': 'pc_logistic', 'floor': 1e-06, 'clip_max': 1.5, 'prob_clip': 0.026142968815001603, 'n_components': 80, 'logistic_c': 0.05990621090998715, 'pca_fit': 'combined', 'solver': 'lbfgs', 'max_iter': 2000, 'fit_intercept': True, 'standardize_with_source': True, 'rho': 0.7}
[I 2026-06-01 20:16:59,666] Trial 163 finished with value: 0.23699875400639323 and parameters: {'alpha': 55068.11756913947, 'n_pcs': 4000, 'iw_method': 'pc_logistic', 'iw_clip_max': 1.5, 'iw_prob_clip': 0.026142968815001603, 'iw_n_components': 80, 'iw_logistic_c': 0.05990621090998715, 'iw_pca_fit': 'combined', 'iw_solver': 'lbfgs', 'iw_rho': 0.7}. Best is trial 163 with value: 0.23699875400639323.
2026-06-01 20:16:59 | INFO | Trial 164 | outer=6 | alpha=5.126e+04 n_pcs=4000 (pc_topk) weight={'name': 'pc_logistic', 'floor': 1e-06, 'clip_max': 1.5, 'prob_clip': 0.02535807332228384, 'n_components': 80, 'logistic_c': 0.07255648106334392, 'pca_fit': 'combined', 'solver': 'lbfgs', 'max_iter': 2000, 'fit_intercept': True, 'standardize_with_source': True, 'rho': 0.7}
[I 2026-06-01 20:17:24,340] Trial 164 finished with value: 0.2367777329311013 and parameters: {'alpha': 51261.90295756061, 'n_pcs': 4000, 'iw_method': 'pc_logistic', 'iw_clip_max': 1.5, 'iw_prob_clip': 0.02535807332228384, 'iw_n_components': 80, 'iw_logistic_c': 0.07255648106334392, 'iw_pca_fit': 'combined', 'iw_solver': 'lbfgs', 'iw_rho': 0.7}. Best is trial 163 with value: 0.23699875400639323.
2026-06-01 20:17:24 | INFO | Trial 165 | outer=6 | alpha=3.794e+04 n_pcs=4000 (pc_topk) weight={'name': 'pc_logistic', 'floor': 1e-06, 'clip_max': 1.5, 'prob_clip': 0.024654307510133967, 'n_components': 80, 'logistic_c': 0.05296902069408869, 'pca_fit': 'combined', 'solver': 'lbfgs', 'max_iter': 2000, 'fit_intercept': True, 'standardize_with_source': True, 'rho': 0.7}
[I 2026-06-01 20:17:49,035] Trial 165 finished with value: 0.23554742271149015 and parameters: {'alpha': 37941.11200966085, 'n_pcs': 4000, 'iw_method': 'pc_logistic', 'iw_clip_max': 1.5, 'iw_prob_clip': 0.024654307510133967, 'iw_n_components': 80, 'iw_logistic_c': 0.05296902069408869, 'iw_pca_fit': 'combined', 'iw_solver': 'lbfgs', 'iw_rho': 0.7}. Best is trial 163 with value: 0.23699875400639323.
2026-06-01 20:17:49 | INFO | Trial 166 | outer=6 | alpha=3.608e+04 n_pcs=4000 (pc_topk) weight={'name': 'pc_logistic', 'floor': 1e-06, 'clip_max': 7.0, 'prob_clip': 0.024351427194742647, 'n_components': 80, 'logistic_c': 0.043233604892728573, 'pca_fit': 'combined', 'solver': 'lbfgs', 'max_iter': 2000, 'fit_intercept': True, 'standardize_with_source': True, 'rho': 0.7}
[I 2026-06-01 20:18:13,625] Trial 166 finished with value: 0.22522517805940484 and parameters: {'alpha': 36075.17194572414, 'n_pcs': 4000, 'iw_method': 'pc_logistic', 'iw_clip_max': 7.0, 'iw_prob_clip': 0.024351427194742647, 'iw_n_components': 80, 'iw_logistic_c': 0.043233604892728573, 'iw_pca_fit': 'combined', 'iw_solver': 'lbfgs', 'iw_rho': 0.7}. Best is trial 163 with value: 0.23699875400639323.
2026-06-01 20:18:13 | INFO | Trial 167 | outer=6 | alpha=4.105e+04 n_pcs=4000 (pc_topk) weight={'name': 'pc_logistic', 'floor': 1e-06, 'clip_max': 1.5, 'prob_clip': 0.030242136793559114, 'n_components': 80, 'logistic_c': 0.02206173180940104, 'pca_fit': 'combined', 'solver': 'lbfgs', 'max_iter': 2000, 'fit_intercept': True, 'standardize_with_source': True, 'rho': 0.7}
[I 2026-06-01 20:18:37,487] Trial 167 finished with value: 0.2356708897548451 and parameters: {'alpha': 41046.52673173421, 'n_pcs': 4000, 'iw_method': 'pc_logistic', 'iw_clip_max': 1.5, 'iw_prob_clip': 0.030242136793559114, 'iw_n_components': 80, 'iw_logistic_c': 0.02206173180940104, 'iw_pca_fit': 'combined', 'iw_solver': 'lbfgs', 'iw_rho': 0.7}. Best is trial 163 with value: 0.23699875400639323.
2026-06-01 20:18:37 | INFO | Trial 168 | outer=6 | alpha=4.131e+04 n_pcs=4000 (pc_topk) weight={'name': 'pc_logistic', 'floor': 1e-06, 'clip_max': 12.0, 'prob_clip': 0.031758236945148136, 'n_components': 80, 'logistic_c': 0.03130138699781609, 'pca_fit': 'combined', 'solver': 'lbfgs', 'max_iter': 2000, 'fit_intercept': True, 'standardize_with_source': True, 'rho': 0.7}
[I 2026-06-01 20:19:02,234] Trial 168 finished with value: 0.2227355374197697 and parameters: {'alpha': 41311.88493333655, 'n_pcs': 4000, 'iw_method': 'pc_logistic', 'iw_clip_max': 12.0, 'iw_prob_clip': 0.031758236945148136, 'iw_n_components': 80, 'iw_logistic_c': 0.03130138699781609, 'iw_pca_fit': 'combined', 'iw_solver': 'lbfgs', 'iw_rho': 0.7}. Best is trial 163 with value: 0.23699875400639323.
2026-06-01 20:19:02 | INFO | Trial 169 | outer=6 | alpha=3.177e+04 n_pcs=4000 (pc_topk) weight={'name': 'pc_logistic', 'floor': 1e-06, 'clip_max': 1.5, 'prob_clip': 0.030219518068541968, 'n_components': 80, 'logistic_c': 0.018485250104169425, 'pca_fit': 'combined', 'solver': 'lbfgs', 'max_iter': 2000, 'fit_intercept': True, 'standardize_with_source': True, 'rho': 0.7}
[I 2026-06-01 20:19:24,953] Trial 169 finished with value: 0.2339003717390835 and parameters: {'alpha': 31766.2947943264, 'n_pcs': 4000, 'iw_method': 'pc_logistic', 'iw_clip_max': 1.5, 'iw_prob_clip': 0.030219518068541968, 'iw_n_components': 80, 'iw_logistic_c': 0.018485250104169425, 'iw_pca_fit': 'combined', 'iw_solver': 'lbfgs', 'iw_rho': 0.7}. Best is trial 163 with value: 0.23699875400639323.
2026-06-01 20:19:24 | INFO | Trial 170 | outer=6 | alpha=4.356e+04 n_pcs=4000 (pc_topk) weight={'name': 'pc_logistic', 'floor': 1e-06, 'clip_max': 1.5, 'prob_clip': 0.023959109253753864, 'n_components': 80, 'logistic_c': 0.00957983667391264, 'pca_fit': 'combined', 'solver': 'lbfgs', 'max_iter': 2000, 'fit_intercept': True, 'standardize_with_source': True, 'rho': 0.7}
[I 2026-06-01 20:19:46,862] Trial 170 finished with value: 0.2358433148185915 and parameters: {'alpha': 43563.67264233725, 'n_pcs': 4000, 'iw_method': 'pc_logistic', 'iw_clip_max': 1.5, 'iw_prob_clip': 0.023959109253753864, 'iw_n_components': 80, 'iw_logistic_c': 0.00957983667391264, 'iw_pca_fit': 'combined', 'iw_solver': 'lbfgs', 'iw_rho': 0.7}. Best is trial 163 with value: 0.23699875400639323.
2026-06-01 20:19:46 | INFO | Trial 171 | outer=6 | alpha=4.317e+04 n_pcs=4000 (pc_topk) weight={'name': 'pc_logistic', 'floor': 1e-06, 'clip_max': 1.5, 'prob_clip': 0.023925636476775633, 'n_components': 80, 'logistic_c': 0.012039324748401699, 'pca_fit': 'combined', 'solver': 'lbfgs', 'max_iter': 2000, 'fit_intercept': True, 'standardize_with_source': True, 'rho': 0.7}
[I 2026-06-01 20:20:09,176] Trial 171 finished with value: 0.23586170929147401 and parameters: {'alpha': 43168.77707296548, 'n_pcs': 4000, 'iw_method': 'pc_logistic', 'iw_clip_max': 1.5, 'iw_prob_clip': 0.023925636476775633, 'iw_n_components': 80, 'iw_logistic_c': 0.012039324748401699, 'iw_pca_fit': 'combined', 'iw_solver': 'lbfgs', 'iw_rho': 0.7}. Best is trial 163 with value: 0.23699875400639323.
2026-06-01 20:20:09 | INFO | Trial 172 | outer=6 | alpha=4.056e+04 n_pcs=4000 (pc_topk) weight={'name': 'pc_logistic', 'floor': 1e-06, 'clip_max': 1.5, 'prob_clip': 0.024144175425630892, 'n_components': 80, 'logistic_c': 0.009918204353937815, 'pca_fit': 'combined', 'solver': 'lbfgs', 'max_iter': 2000, 'fit_intercept': True, 'standardize_with_source': True, 'rho': 0.7}
[I 2026-06-01 20:20:31,594] Trial 172 finished with value: 0.235500942464021 and parameters: {'alpha': 40555.45679865131, 'n_pcs': 4000, 'iw_method': 'pc_logistic', 'iw_clip_max': 1.5, 'iw_prob_clip': 0.024144175425630892, 'iw_n_components': 80, 'iw_logistic_c': 0.009918204353937815, 'iw_pca_fit': 'combined', 'iw_solver': 'lbfgs', 'iw_rho': 0.7}. Best is trial 163 with value: 0.23699875400639323.
2026-06-01 20:20:31 | INFO | Trial 173 | outer=6 | alpha=4.190e+04 n_pcs=4000 (pc_topk) weight={'name': 'pc_logistic', 'floor': 1e-06, 'clip_max': 1.5, 'prob_clip': 0.02298098016045525, 'n_components': 80, 'logistic_c': 0.008032244799266145, 'pca_fit': 'combined', 'solver': 'lbfgs', 'max_iter': 2000, 'fit_intercept': True, 'standardize_with_source': True, 'rho': 0.7}
[I 2026-06-01 20:20:53,658] Trial 173 finished with value: 0.23566737717485314 and parameters: {'alpha': 41903.83565911994, 'n_pcs': 4000, 'iw_method': 'pc_logistic', 'iw_clip_max': 1.5, 'iw_prob_clip': 0.02298098016045525, 'iw_n_components': 80, 'iw_logistic_c': 0.008032244799266145, 'iw_pca_fit': 'combined', 'iw_solver': 'lbfgs', 'iw_rho': 0.7}. Best is trial 163 with value: 0.23699875400639323.
2026-06-01 20:20:53 | INFO | Trial 174 | outer=6 | alpha=1.420e+06 n_pcs=4000 (pc_topk) weight={'name': 'pc_logistic', 'floor': 1e-06, 'clip_max': 2.5, 'prob_clip': 0.02293432818211421, 'n_components': 80, 'logistic_c': 0.007400797218842801, 'pca_fit': 'combined', 'solver': 'lbfgs', 'max_iter': 2000, 'fit_intercept': True, 'standardize_with_source': True, 'rho': 0.7}
[I 2026-06-01 20:21:16,638] Trial 174 finished with value: 0.2205957758862917 and parameters: {'alpha': 1420029.8112922285, 'n_pcs': 4000, 'iw_method': 'pc_logistic', 'iw_clip_max': 2.5, 'iw_prob_clip': 0.02293432818211421, 'iw_n_components': 80, 'iw_logistic_c': 0.007400797218842801, 'iw_pca_fit': 'combined', 'iw_solver': 'lbfgs', 'iw_rho': 0.7}. Best is trial 163 with value: 0.23699875400639323.
2026-06-01 20:21:16 | INFO | Trial 175 | outer=6 | alpha=4.013e+04 n_pcs=4000 (pc_topk) weight={'name': 'pc_logistic', 'floor': 1e-06, 'clip_max': 1.5, 'prob_clip': 0.017036544457501215, 'n_components': 80, 'logistic_c': 0.008140468126108408, 'pca_fit': 'combined', 'solver': 'lbfgs', 'max_iter': 2000, 'fit_intercept': True, 'standardize_with_source': True, 'rho': 0.7}
[I 2026-06-01 20:21:38,683] Trial 175 finished with value: 0.2351745342465356 and parameters: {'alpha': 40125.25556425263, 'n_pcs': 4000, 'iw_method': 'pc_logistic', 'iw_clip_max': 1.5, 'iw_prob_clip': 0.017036544457501215, 'iw_n_components': 80, 'iw_logistic_c': 0.008140468126108408, 'iw_pca_fit': 'combined', 'iw_solver': 'lbfgs', 'iw_rho': 0.7}. Best is trial 163 with value: 0.23699875400639323.
2026-06-01 20:21:38 | INFO | Trial 176 | outer=6 | alpha=2.825e+04 n_pcs=4000 (pc_topk) weight={'name': 'pc_logistic', 'floor': 1e-06, 'clip_max': 1.5, 'prob_clip': 0.004061107728208216, 'n_components': 80, 'logistic_c': 0.015640447265393237, 'pca_fit': 'combined', 'solver': 'lbfgs', 'max_iter': 2000, 'fit_intercept': True, 'standardize_with_source': True, 'rho': 0.7}
[I 2026-06-01 20:22:02,621] Trial 176 finished with value: 0.22889897081268198 and parameters: {'alpha': 28249.158104414044, 'n_pcs': 4000, 'iw_method': 'pc_logistic', 'iw_clip_max': 1.5, 'iw_prob_clip': 0.004061107728208216, 'iw_n_components': 80, 'iw_logistic_c': 0.015640447265393237, 'iw_pca_fit': 'combined', 'iw_solver': 'lbfgs', 'iw_rho': 0.7}. Best is trial 163 with value: 0.23699875400639323.
2026-06-01 20:22:02 | INFO | Trial 177 | outer=6 | alpha=4.414e+04 n_pcs=4000 (pc_topk) weight={'name': 'pc_logistic', 'floor': 1e-06, 'clip_max': 1.5, 'prob_clip': 0.023905689792850265, 'n_components': 80, 'logistic_c': 0.013872157145009301, 'pca_fit': 'combined', 'solver': 'lbfgs', 'max_iter': 2000, 'fit_intercept': True, 'standardize_with_source': True, 'rho': 0.7}
[I 2026-06-01 20:22:25,349] Trial 177 finished with value: 0.23604837782410865 and parameters: {'alpha': 44137.845409123125, 'n_pcs': 4000, 'iw_method': 'pc_logistic', 'iw_clip_max': 1.5, 'iw_prob_clip': 0.023905689792850265, 'iw_n_components': 80, 'iw_logistic_c': 0.013872157145009301, 'iw_pca_fit': 'combined', 'iw_solver': 'lbfgs', 'iw_rho': 0.7}. Best is trial 163 with value: 0.23699875400639323.
2026-06-01 20:22:25 | INFO | Trial 178 | outer=6 | alpha=4.073e+04 n_pcs=4000 (pc_topk) weight={'name': 'pc_logistic', 'floor': 1e-06, 'clip_max': 1.5, 'prob_clip': 0.023311072815068667, 'n_components': 80, 'logistic_c': 0.0022182602297254918, 'pca_fit': 'combined', 'solver': 'lbfgs', 'max_iter': 2000, 'fit_intercept': True, 'standardize_with_source': True, 'rho': 0.7}
