[I 2026-06-01 00:28:09,832] Trial 140 finished with value: 0.25996359913458195 and parameters: {'alpha': 110571.43779071631, 'n_pcs': 4000, 'weight_scheme': 'exponential', 'weight_clip_max': 5.0, 'weight_exponential_beta': 8.06484811908058}. Best is trial 140 with value: 0.25996359913458195.
2026-06-01 00:28:09 | INFO | src.nested_cv_avggrm_weighted_unified | OUTER 5 | new best trial 140 (mean inner r=0.2600) saved to outputs/final_results/e6_pc_ridge_avggrm/thr_wing/e6_pc_ridge_avggrm_thr_wing_best_trials/split_05_best_trial.json
2026-06-01 00:28:09 | INFO | src.nested_cv_avggrm_weighted_unified | Trial 141 | outer=5 | alpha=1.101e+05 n_pcs=4000 (pc_topk) weight_search=on
2026-06-01 00:28:09 | INFO | src.nested_cv_avggrm_weighted_unified | Trial 141 | outer=5 | weight={'name': 'exponential', 'floor': 1e-06, 'clip_max': 5.0, 'beta': 8.128394751687193}
[I 2026-06-01 00:28:15,551] Trial 141 finished with value: 0.2599596727105391 and parameters: {'alpha': 110082.81679393974, 'n_pcs': 4000, 'weight_scheme': 'exponential', 'weight_clip_max': 5.0, 'weight_exponential_beta': 8.128394751687193}. Best is trial 140 with value: 0.25996359913458195.
2026-06-01 00:28:15 | INFO | src.nested_cv_avggrm_weighted_unified | Trial 142 | outer=5 | alpha=1.074e+05 n_pcs=4000 (pc_topk) weight_search=on
2026-06-01 00:28:15 | INFO | src.nested_cv_avggrm_weighted_unified | Trial 142 | outer=5 | weight={'name': 'exponential', 'floor': 1e-06, 'clip_max': 5.0, 'beta': 7.937479929476544}
[I 2026-06-01 00:28:21,042] Trial 142 finished with value: 0.25995344877368437 and parameters: {'alpha': 107425.89147323203, 'n_pcs': 4000, 'weight_scheme': 'exponential', 'weight_clip_max': 5.0, 'weight_exponential_beta': 7.937479929476544}. Best is trial 140 with value: 0.25996359913458195.
2026-06-01 00:28:21 | INFO | src.nested_cv_avggrm_weighted_unified | Trial 143 | outer=5 | alpha=1.098e+05 n_pcs=1000 (pc_topk) weight_search=on
2026-06-01 00:28:21 | INFO | src.nested_cv_avggrm_weighted_unified | Trial 143 | outer=5 | weight={'name': 'exponential', 'floor': 1e-06, 'clip_max': 5.0, 'beta': 8.105816676888452}
2026-06-01 00:28:21 | INFO | src.nested_cv_avggrm_weighted_unified | Trial 143 | outer=5 | pruned after 7/10 inner folds (mean r=0.2880)
[I 2026-06-01 00:28:21,989] Trial 143 pruned. 
2026-06-01 00:28:21 | INFO | src.nested_cv_avggrm_weighted_unified | Trial 144 | outer=5 | alpha=1.311e+05 n_pcs=4000 (pc_topk) weight_search=on
2026-06-01 00:28:22 | INFO | src.nested_cv_avggrm_weighted_unified | Trial 144 | outer=5 | weight={'name': 'exponential', 'floor': 1e-06, 'clip_max': 5.0, 'beta': 7.994849357840173}
[I 2026-06-01 00:28:27,490] Trial 144 finished with value: 0.25990622583117723 and parameters: {'alpha': 131101.2712036356, 'n_pcs': 4000, 'weight_scheme': 'exponential', 'weight_clip_max': 5.0, 'weight_exponential_beta': 7.994849357840173}. Best is trial 140 with value: 0.25996359913458195.
2026-06-01 00:28:27 | INFO | src.nested_cv_avggrm_weighted_unified | Trial 145 | outer=5 | alpha=6.162e+04 n_pcs=4000 (pc_topk) weight_search=on
2026-06-01 00:28:27 | INFO | src.nested_cv_avggrm_weighted_unified | Trial 145 | outer=5 | weight={'name': 'exponential', 'floor': 1e-06, 'clip_max': 5.0, 'beta': 7.896383831144431}
2026-06-01 00:28:31 | INFO | src.nested_cv_avggrm_weighted_unified | Trial 145 | outer=5 | pruned after 7/10 inner folds (mean r=0.2904)
[I 2026-06-01 00:28:31,332] Trial 145 pruned. 
2026-06-01 00:28:31 | INFO | src.nested_cv_avggrm_weighted_unified | Trial 146 | outer=5 | alpha=1.207e+05 n_pcs=3500 (pc_topk) weight_search=on
2026-06-01 00:28:31 | INFO | src.nested_cv_avggrm_weighted_unified | Trial 146 | outer=5 | weight={'name': 'exponential', 'floor': 1e-06, 'clip_max': 5.0, 'beta': 8.313321711317398}
2026-06-01 00:28:34 | INFO | src.nested_cv_avggrm_weighted_unified | Trial 146 | outer=5 | pruned after 7/10 inner folds (mean r=0.2917)
[I 2026-06-01 00:28:34,603] Trial 146 pruned. 
2026-06-01 00:28:34 | INFO | src.nested_cv_avggrm_weighted_unified | Trial 147 | outer=5 | alpha=7.774e+04 n_pcs=4000 (pc_topk) weight_search=on
2026-06-01 00:28:34 | INFO | src.nested_cv_avggrm_weighted_unified | Trial 147 | outer=5 | weight={'name': 'exponential', 'floor': 1e-06, 'clip_max': 5.0, 'beta': 8.083603265707339}
2026-06-01 00:28:38 | INFO | src.nested_cv_avggrm_weighted_unified | Trial 147 | outer=5 | pruned after 7/10 inner folds (mean r=0.2925)
[I 2026-06-01 00:28:38,456] Trial 147 pruned. 
2026-06-01 00:28:38 | INFO | src.nested_cv_avggrm_weighted_unified | Trial 148 | outer=5 | alpha=1.333e+05 n_pcs=4500 (pc_topk) weight_search=on
2026-06-01 00:28:38 | INFO | src.nested_cv_avggrm_weighted_unified | Trial 148 | outer=5 | weight={'name': 'uniform', 'floor': 1e-06, 'clip_max': 5.0}
2026-06-01 00:28:41 | INFO | src.nested_cv_avggrm_weighted_unified | Trial 148 | outer=5 | pruned after 5/10 inner folds (mean r=0.2312)
[I 2026-06-01 00:28:41,353] Trial 148 pruned. 
2026-06-01 00:28:41 | INFO | src.nested_cv_avggrm_weighted_unified | Trial 149 | outer=5 | alpha=1.457e+05 n_pcs=4000 (pc_topk) weight_search=on
2026-06-01 00:28:41 | INFO | src.nested_cv_avggrm_weighted_unified | Trial 149 | outer=5 | weight={'name': 'exponential', 'floor': 1e-06, 'clip_max': 5.0, 'beta': 7.636117789375653}
[I 2026-06-01 00:28:46,838] Trial 149 finished with value: 0.25965760990989384 and parameters: {'alpha': 145744.86353678847, 'n_pcs': 4000, 'weight_scheme': 'exponential', 'weight_clip_max': 5.0, 'weight_exponential_beta': 7.636117789375653}. Best is trial 140 with value: 0.25996359913458195.
2026-06-01 00:28:46 | INFO | src.nested_cv_avggrm_weighted_unified | Trial 150 | outer=5 | alpha=1.047e+05 n_pcs=4500 (pc_topk) weight_search=on
2026-06-01 00:28:46 | INFO | src.nested_cv_avggrm_weighted_unified | Trial 150 | outer=5 | weight={'name': 'exponential', 'floor': 1e-06, 'clip_max': 5.0, 'beta': 7.630543148381217}
[I 2026-06-01 00:28:53,503] Trial 150 finished with value: 0.2598233730600986 and parameters: {'alpha': 104706.00482800424, 'n_pcs': 4500, 'weight_scheme': 'exponential', 'weight_clip_max': 5.0, 'weight_exponential_beta': 7.630543148381217}. Best is trial 140 with value: 0.25996359913458195.
2026-06-01 00:28:53 | INFO | src.nested_cv_avggrm_weighted_unified | Trial 151 | outer=5 | alpha=1.014e+05 n_pcs=4500 (pc_topk) weight_search=on
2026-06-01 00:28:53 | INFO | src.nested_cv_avggrm_weighted_unified | Trial 151 | outer=5 | weight={'name': 'exponential', 'floor': 1e-06, 'clip_max': 5.0, 'beta': 7.832539977856618}
[I 2026-06-01 00:29:00,219] Trial 151 finished with value: 0.25987330125261665 and parameters: {'alpha': 101418.08095975086, 'n_pcs': 4500, 'weight_scheme': 'exponential', 'weight_clip_max': 5.0, 'weight_exponential_beta': 7.832539977856618}. Best is trial 140 with value: 0.25996359913458195.
2026-06-01 00:29:00 | INFO | src.nested_cv_avggrm_weighted_unified | Trial 152 | outer=5 | alpha=1.106e+05 n_pcs=4500 (pc_topk) weight_search=on
2026-06-01 00:29:00 | INFO | src.nested_cv_avggrm_weighted_unified | Trial 152 | outer=5 | weight={'name': 'exponential', 'floor': 1e-06, 'clip_max': 5.0, 'beta': 7.716776643212311}
[I 2026-06-01 00:29:06,866] Trial 152 finished with value: 0.259800983716864 and parameters: {'alpha': 110645.87276497463, 'n_pcs': 4500, 'weight_scheme': 'exponential', 'weight_clip_max': 5.0, 'weight_exponential_beta': 7.716776643212311}. Best is trial 140 with value: 0.25996359913458195.
2026-06-01 00:29:06 | INFO | src.nested_cv_avggrm_weighted_unified | Trial 153 | outer=5 | alpha=1.435e+05 n_pcs=4500 (pc_topk) weight_search=on
2026-06-01 00:29:06 | INFO | src.nested_cv_avggrm_weighted_unified | Trial 153 | outer=5 | weight={'name': 'exponential', 'floor': 1e-06, 'clip_max': 5.0, 'beta': 7.626369611748507}
[I 2026-06-01 00:29:13,571] Trial 153 finished with value: 0.25931338883101973 and parameters: {'alpha': 143500.1513989828, 'n_pcs': 4500, 'weight_scheme': 'exponential', 'weight_clip_max': 5.0, 'weight_exponential_beta': 7.626369611748507}. Best is trial 140 with value: 0.25996359913458195.
2026-06-01 00:29:13 | INFO | src.nested_cv_avggrm_weighted_unified | Trial 154 | outer=5 | alpha=1.132e+05 n_pcs=4500 (pc_topk) weight_search=on
2026-06-01 00:29:13 | INFO | src.nested_cv_avggrm_weighted_unified | Trial 154 | outer=5 | weight={'name': 'exponential', 'floor': 1e-06, 'clip_max': 5.0, 'beta': 7.838579239892133}
[I 2026-06-01 00:29:20,274] Trial 154 finished with value: 0.25980863340581 and parameters: {'alpha': 113168.7962454831, 'n_pcs': 4500, 'weight_scheme': 'exponential', 'weight_clip_max': 5.0, 'weight_exponential_beta': 7.838579239892133}. Best is trial 140 with value: 0.25996359913458195.
2026-06-01 00:29:20 | INFO | src.nested_cv_avggrm_weighted_unified | Trial 155 | outer=5 | alpha=1.114e+05 n_pcs=4500 (pc_topk) weight_search=on
2026-06-01 00:29:20 | INFO | src.nested_cv_avggrm_weighted_unified | Trial 155 | outer=5 | weight={'name': 'exponential', 'floor': 1e-06, 'clip_max': 5.0, 'beta': 7.8112987250172985}
[I 2026-06-01 00:29:26,939] Trial 155 finished with value: 0.2598170547238118 and parameters: {'alpha': 111381.8226870787, 'n_pcs': 4500, 'weight_scheme': 'exponential', 'weight_clip_max': 5.0, 'weight_exponential_beta': 7.8112987250172985}. Best is trial 140 with value: 0.25996359913458195.
2026-06-01 00:29:26 | INFO | src.nested_cv_avggrm_weighted_unified | Trial 156 | outer=5 | alpha=1.148e+05 n_pcs=4500 (pc_topk) weight_search=on
2026-06-01 00:29:26 | INFO | src.nested_cv_avggrm_weighted_unified | Trial 156 | outer=5 | weight={'name': 'exponential', 'floor': 1e-06, 'clip_max': 5.0, 'beta': 7.784348028596136}
[I 2026-06-01 00:29:33,597] Trial 156 finished with value: 0.25978127691946906 and parameters: {'alpha': 114764.74629182184, 'n_pcs': 4500, 'weight_scheme': 'exponential', 'weight_clip_max': 5.0, 'weight_exponential_beta': 7.784348028596136}. Best is trial 140 with value: 0.25996359913458195.
2026-06-01 00:29:33 | INFO | src.nested_cv_avggrm_weighted_unified | Trial 157 | outer=5 | alpha=1.158e+05 n_pcs=4500 (pc_topk) weight_search=on
2026-06-01 00:29:33 | INFO | src.nested_cv_avggrm_weighted_unified | Trial 157 | outer=5 | weight={'name': 'exponential', 'floor': 1e-06, 'clip_max': None, 'beta': 7.7943896845557425}
[I 2026-06-01 00:29:40,233] Trial 157 finished with value: 0.2519493741615223 and parameters: {'alpha': 115799.08162341706, 'n_pcs': 4500, 'weight_scheme': 'exponential', 'weight_clip_max': None, 'weight_exponential_beta': 7.7943896845557425}. Best is trial 140 with value: 0.25996359913458195.
2026-06-01 00:29:40 | INFO | src.nested_cv_avggrm_weighted_unified | Trial 158 | outer=5 | alpha=1.007e+05 n_pcs=4500 (pc_topk) weight_search=on
2026-06-01 00:29:40 | INFO | src.nested_cv_avggrm_weighted_unified | Trial 158 | outer=5 | weight={'name': 'exponential', 'floor': 1e-06, 'clip_max': 5.0, 'beta': 7.436053291104312}
[I 2026-06-01 00:29:46,875] Trial 158 finished with value: 0.25980450559596063 and parameters: {'alpha': 100666.98931928651, 'n_pcs': 4500, 'weight_scheme': 'exponential', 'weight_clip_max': 5.0, 'weight_exponential_beta': 7.436053291104312}. Best is trial 140 with value: 0.25996359913458195.
2026-06-01 00:29:46 | INFO | src.nested_cv_avggrm_weighted_unified | Trial 159 | outer=5 | alpha=9.544e+04 n_pcs=4500 (pc_topk) weight_search=on
2026-06-01 00:29:46 | INFO | src.nested_cv_avggrm_weighted_unified | Trial 159 | outer=5 | weight={'name': 'exponential', 'floor': 1e-06, 'clip_max': 5.0, 'beta': 7.622059683734852}
[I 2026-06-01 00:29:53,535] Trial 159 finished with value: 0.25985056079423274 and parameters: {'alpha': 95443.62655404552, 'n_pcs': 4500, 'weight_scheme': 'exponential', 'weight_clip_max': 5.0, 'weight_exponential_beta': 7.622059683734852}. Best is trial 140 with value: 0.25996359913458195.
2026-06-01 00:29:53 | INFO | src.nested_cv_avggrm_weighted_unified | Trial 160 | outer=5 | alpha=9.884e+04 n_pcs=4500 (pc_topk) weight_search=on
2026-06-01 00:29:53 | INFO | src.nested_cv_avggrm_weighted_unified | Trial 160 | outer=5 | weight={'name': 'linear', 'floor': 1e-06, 'clip_max': 5.0, 'min_weight': 0.2719758844074869, 'max_weight': 4.514180209182158}
2026-06-01 00:29:58 | INFO | src.nested_cv_avggrm_weighted_unified | Trial 160 | outer=5 | pruned after 7/10 inner folds (mean r=0.2903)
[I 2026-06-01 00:29:58,190] Trial 160 pruned. 
2026-06-01 00:29:58 | INFO | src.nested_cv_avggrm_weighted_unified | Trial 161 | outer=5 | alpha=1.100e+05 n_pcs=4500 (pc_topk) weight_search=on
2026-06-01 00:29:58 | INFO | src.nested_cv_avggrm_weighted_unified | Trial 161 | outer=5 | weight={'name': 'exponential', 'floor': 1e-06, 'clip_max': 5.0, 'beta': 7.465070535986147}
[I 2026-06-01 00:30:04,855] Trial 161 finished with value: 0.2597402346147095 and parameters: {'alpha': 110026.3524372734, 'n_pcs': 4500, 'weight_scheme': 'exponential', 'weight_clip_max': 5.0, 'weight_exponential_beta': 7.465070535986147}. Best is trial 140 with value: 0.25996359913458195.
2026-06-01 00:30:04 | INFO | src.nested_cv_avggrm_weighted_unified | Trial 162 | outer=5 | alpha=1.101e+05 n_pcs=4500 (pc_topk) weight_search=on
2026-06-01 00:30:04 | INFO | src.nested_cv_avggrm_weighted_unified | Trial 162 | outer=5 | weight={'name': 'exponential', 'floor': 1e-06, 'clip_max': 5.0, 'beta': 7.414467876149427}
[I 2026-06-01 00:30:11,524] Trial 162 finished with value: 0.25972599312333094 and parameters: {'alpha': 110077.9595888866, 'n_pcs': 4500, 'weight_scheme': 'exponential', 'weight_clip_max': 5.0, 'weight_exponential_beta': 7.414467876149427}. Best is trial 140 with value: 0.25996359913458195.
2026-06-01 00:30:11 | INFO | src.nested_cv_avggrm_weighted_unified | Trial 163 | outer=5 | alpha=9.029e+04 n_pcs=4500 (pc_topk) weight_search=on
2026-06-01 00:30:11 | INFO | src.nested_cv_avggrm_weighted_unified | Trial 163 | outer=5 | weight={'name': 'exponential', 'floor': 1e-06, 'clip_max': 5.0, 'beta': 7.425144250973559}
[I 2026-06-01 00:30:18,209] Trial 163 finished with value: 0.2598201255103453 and parameters: {'alpha': 90289.88609875199, 'n_pcs': 4500, 'weight_scheme': 'exponential', 'weight_clip_max': 5.0, 'weight_exponential_beta': 7.425144250973559}. Best is trial 140 with value: 0.25996359913458195.
2026-06-01 00:30:18 | INFO | src.nested_cv_avggrm_weighted_unified | Trial 164 | outer=5 | alpha=8.674e+04 n_pcs=4500 (pc_topk) weight_search=on
2026-06-01 00:30:18 | INFO | src.nested_cv_avggrm_weighted_unified | Trial 164 | outer=5 | weight={'name': 'exponential', 'floor': 1e-06, 'clip_max': 5.0, 'beta': 7.403314803245903}
[I 2026-06-01 00:30:24,909] Trial 164 finished with value: 0.25980458997978084 and parameters: {'alpha': 86742.08311709712, 'n_pcs': 4500, 'weight_scheme': 'exponential', 'weight_clip_max': 5.0, 'weight_exponential_beta': 7.403314803245903}. Best is trial 140 with value: 0.25996359913458195.
2026-06-01 00:30:24 | INFO | src.nested_cv_avggrm_weighted_unified | Trial 165 | outer=5 | alpha=8.590e+04 n_pcs=4500 (pc_topk) weight_search=on
2026-06-01 00:30:24 | INFO | src.nested_cv_avggrm_weighted_unified | Trial 165 | outer=5 | weight={'name': 'exponential', 'floor': 1e-06, 'clip_max': 5.0, 'beta': 7.468045397246679}
[I 2026-06-01 00:30:31,576] Trial 165 finished with value: 0.2598036254832277 and parameters: {'alpha': 85904.54578005898, 'n_pcs': 4500, 'weight_scheme': 'exponential', 'weight_clip_max': 5.0, 'weight_exponential_beta': 7.468045397246679}. Best is trial 140 with value: 0.25996359913458195.
2026-06-01 00:30:31 | INFO | src.nested_cv_avggrm_weighted_unified | Trial 166 | outer=5 | alpha=4.932e+04 n_pcs=4500 (pc_topk) weight_search=on
2026-06-01 00:30:31 | INFO | src.nested_cv_avggrm_weighted_unified | Trial 166 | outer=5 | weight={'name': 'exponential', 'floor': 1e-06, 'clip_max': 5.0, 'beta': 7.8969118659763335}
2026-06-01 00:30:36 | INFO | src.nested_cv_avggrm_weighted_unified | Trial 166 | outer=5 | pruned after 7/10 inner folds (mean r=0.2898)
[I 2026-06-01 00:30:36,237] Trial 166 pruned. 
2026-06-01 00:30:36 | INFO | src.nested_cv_avggrm_weighted_unified | Trial 167 | outer=5 | alpha=7.494e+04 n_pcs=4500 (pc_topk) weight_search=on
2026-06-01 00:30:36 | INFO | src.nested_cv_avggrm_weighted_unified | Trial 167 | outer=5 | weight={'name': 'exponential', 'floor': 1e-06, 'clip_max': 10.0, 'beta': 6.983331709677535}
[I 2026-06-01 00:30:42,902] Trial 167 finished with value: 0.25960543270292075 and parameters: {'alpha': 74943.557891035, 'n_pcs': 4500, 'weight_scheme': 'exponential', 'weight_clip_max': 10.0, 'weight_exponential_beta': 6.983331709677535}. Best is trial 140 with value: 0.25996359913458195.
2026-06-01 00:30:42 | INFO | src.nested_cv_avggrm_weighted_unified | Trial 168 | outer=5 | alpha=9.102e+04 n_pcs=4500 (pc_topk) weight_search=on
2026-06-01 00:30:42 | INFO | src.nested_cv_avggrm_weighted_unified | Trial 168 | outer=5 | weight={'name': 'exponential', 'floor': 1e-06, 'clip_max': 5.0, 'beta': 7.744312540150584}
[I 2026-06-01 00:30:49,573] Trial 168 finished with value: 0.2598537189886584 and parameters: {'alpha': 91015.89417521124, 'n_pcs': 4500, 'weight_scheme': 'exponential', 'weight_clip_max': 5.0, 'weight_exponential_beta': 7.744312540150584}. Best is trial 140 with value: 0.25996359913458195.
2026-06-01 00:30:49 | INFO | src.nested_cv_avggrm_weighted_unified | Trial 169 | outer=5 | alpha=6.338e+04 n_pcs=4500 (pc_topk) weight_search=on
2026-06-01 00:30:49 | INFO | src.nested_cv_avggrm_weighted_unified | Trial 169 | outer=5 | weight={'name': 'exponential', 'floor': 1e-06, 'clip_max': 5.0, 'beta': 7.411331467878952}
2026-06-01 00:30:54 | INFO | src.nested_cv_avggrm_weighted_unified | Trial 169 | outer=5 | pruned after 7/10 inner folds (mean r=0.2925)
[I 2026-06-01 00:30:54,243] Trial 169 pruned. 
2026-06-01 00:30:54 | INFO | src.nested_cv_avggrm_weighted_unified | Trial 170 | outer=5 | alpha=8.454e+04 n_pcs=4500 (pc_topk) weight_search=on
2026-06-01 00:30:54 | INFO | src.nested_cv_avggrm_weighted_unified | Trial 170 | outer=5 | weight={'name': 'exponential', 'floor': 1e-06, 'clip_max': 5.0, 'beta': 7.632323982029878}
[I 2026-06-01 00:31:00,906] Trial 170 finished with value: 0.25980073277031474 and parameters: {'alpha': 84543.00252780272, 'n_pcs': 4500, 'weight_scheme': 'exponential', 'weight_clip_max': 5.0, 'weight_exponential_beta': 7.632323982029878}. Best is trial 140 with value: 0.25996359913458195.
2026-06-01 00:31:00 | INFO | src.nested_cv_avggrm_weighted_unified | Trial 171 | outer=5 | alpha=8.797e+04 n_pcs=4500 (pc_topk) weight_search=on
2026-06-01 00:31:00 | INFO | src.nested_cv_avggrm_weighted_unified | Trial 171 | outer=5 | weight={'name': 'exponential', 'floor': 1e-06, 'clip_max': 5.0, 'beta': 6.639264771663257}
[I 2026-06-01 00:31:07,571] Trial 171 finished with value: 0.2597167969299814 and parameters: {'alpha': 87972.82756845113, 'n_pcs': 4500, 'weight_scheme': 'exponential', 'weight_clip_max': 5.0, 'weight_exponential_beta': 6.639264771663257}. Best is trial 140 with value: 0.25996359913458195.
2026-06-01 00:31:07 | INFO | src.nested_cv_avggrm_weighted_unified | Trial 172 | outer=5 | alpha=8.713e+04 n_pcs=4500 (pc_topk) weight_search=on
2026-06-01 00:31:07 | INFO | src.nested_cv_avggrm_weighted_unified | Trial 172 | outer=5 | weight={'name': 'exponential', 'floor': 1e-06, 'clip_max': 5.0, 'beta': 7.584553770132587}
[I 2026-06-01 00:31:14,229] Trial 172 finished with value: 0.2598195840563495 and parameters: {'alpha': 87132.56473240194, 'n_pcs': 4500, 'weight_scheme': 'exponential', 'weight_clip_max': 5.0, 'weight_exponential_beta': 7.584553770132587}. Best is trial 140 with value: 0.25996359913458195.
2026-06-01 00:31:14 | INFO | src.nested_cv_avggrm_weighted_unified | Trial 173 | outer=5 | alpha=5.981e+04 n_pcs=4500 (pc_topk) weight_search=on
2026-06-01 00:31:14 | INFO | src.nested_cv_avggrm_weighted_unified | Trial 173 | outer=5 | weight={'name': 'exponential', 'floor': 1e-06, 'clip_max': 5.0, 'beta': 7.580561899556942}
2026-06-01 00:31:18 | INFO | src.nested_cv_avggrm_weighted_unified | Trial 173 | outer=5 | pruned after 7/10 inner folds (mean r=0.2919)
[I 2026-06-01 00:31:18,907] Trial 173 pruned. 
2026-06-01 00:31:18 | INFO | src.nested_cv_avggrm_weighted_unified | Trial 174 | outer=5 | alpha=7.776e+04 n_pcs=4500 (pc_topk) weight_search=on
2026-06-01 00:31:18 | INFO | src.nested_cv_avggrm_weighted_unified | Trial 174 | outer=5 | weight={'name': 'exponential', 'floor': 1e-06, 'clip_max': 5.0, 'beta': 7.978342274060671}
2026-06-01 00:31:23 | INFO | src.nested_cv_avggrm_weighted_unified | Trial 174 | outer=5 | pruned after 7/10 inner folds (mean r=0.2936)
[I 2026-06-01 00:31:23,579] Trial 174 pruned. 
2026-06-01 00:31:23 | INFO | src.nested_cv_avggrm_weighted_unified | Trial 175 | outer=5 | alpha=9.108e+04 n_pcs=4500 (pc_topk) weight_search=on
2026-06-01 00:31:23 | INFO | src.nested_cv_avggrm_weighted_unified | Trial 175 | outer=5 | weight={'name': 'exponential', 'floor': 1e-06, 'clip_max': 5.0, 'beta': 7.695820864031828}
[I 2026-06-01 00:31:30,256] Trial 175 finished with value: 0.25985008322486297 and parameters: {'alpha': 91078.70377636325, 'n_pcs': 4500, 'weight_scheme': 'exponential', 'weight_clip_max': 5.0, 'weight_exponential_beta': 7.695820864031828}. Best is trial 140 with value: 0.25996359913458195.
2026-06-01 00:31:30 | INFO | src.nested_cv_avggrm_weighted_unified | Trial 176 | outer=5 | alpha=1.001e+05 n_pcs=4500 (pc_topk) weight_search=on
2026-06-01 00:31:30 | INFO | src.nested_cv_avggrm_weighted_unified | Trial 176 | outer=5 | weight={'name': 'exponential', 'floor': 1e-06, 'clip_max': 5.0, 'beta': 7.8540111488916065}
