[I 2026-06-01 21:17:13,713] Trial 28 finished with value: 0.20296888080478767 and parameters: {'alpha': 21495.428945950072, 'n_pcs': 2500, 'iw_method': 'pc_logistic', 'iw_clip_max': 2.5, 'iw_prob_clip': 0.016572379481429717, 'iw_n_components': 40, 'iw_logistic_c': 0.0007021133098376147, 'iw_pca_fit': 'combined', 'iw_solver': 'lbfgs', 'iw_rho': 0.5}. Best is trial 26 with value: 0.22498965169866433.
2026-06-01 21:17:13 | INFO | Trial 29 | outer=7 | alpha=2.135e+05 n_pcs=4500 (pc_topk) weight={'name': 'pc_logistic', 'floor': 1e-06, 'clip_max': 1.5, 'prob_clip': 0.04937079087391629, 'n_components': 100, 'logistic_c': 0.16854017434312787, 'pca_fit': 'combined', 'solver': 'lbfgs', 'max_iter': 2000, 'fit_intercept': True, 'standardize_with_source': True, 'rho': 0.85}
[I 2026-06-01 21:17:42,476] Trial 29 finished with value: 0.21286049852860578 and parameters: {'alpha': 213522.80414088359, 'n_pcs': 4500, 'iw_method': 'pc_logistic', 'iw_clip_max': 1.5, 'iw_prob_clip': 0.04937079087391629, 'iw_n_components': 100, 'iw_logistic_c': 0.16854017434312787, 'iw_pca_fit': 'combined', 'iw_solver': 'lbfgs', 'iw_rho': 0.85}. Best is trial 26 with value: 0.22498965169866433.
2026-06-01 21:17:42 | INFO | Trial 30 | outer=7 | alpha=8.400e+04 n_pcs=3500 (pc_topk) weight={'name': 'pc_logistic', 'floor': 1e-06, 'clip_max': 7.0, 'prob_clip': 0.013020675682074805, 'n_components': 40, 'logistic_c': 2.5444813470676852e-05, 'pca_fit': 'combined', 'solver': 'lbfgs', 'max_iter': 2000, 'fit_intercept': True, 'standardize_with_source': True, 'rho': 0.5}
[I 2026-06-01 21:17:54,277] Trial 30 finished with value: 0.22439588867860896 and parameters: {'alpha': 84000.70039537566, 'n_pcs': 3500, 'iw_method': 'pc_logistic', 'iw_clip_max': 7.0, 'iw_prob_clip': 0.013020675682074805, 'iw_n_components': 40, 'iw_logistic_c': 2.5444813470676852e-05, 'iw_pca_fit': 'combined', 'iw_solver': 'lbfgs', 'iw_rho': 0.5}. Best is trial 26 with value: 0.22498965169866433.
2026-06-01 21:17:54 | INFO | Trial 31 | outer=7 | alpha=8.682e+04 n_pcs=3500 (pc_topk) weight={'name': 'pc_logistic', 'floor': 1e-06, 'clip_max': 7.0, 'prob_clip': 0.014184394404565212, 'n_components': 40, 'logistic_c': 1.4305234579210648e-05, 'pca_fit': 'combined', 'solver': 'lbfgs', 'max_iter': 2000, 'fit_intercept': True, 'standardize_with_source': True, 'rho': 0.5}
[I 2026-06-01 21:18:05,797] Trial 31 finished with value: 0.2220116988577186 and parameters: {'alpha': 86822.6092100292, 'n_pcs': 3500, 'iw_method': 'pc_logistic', 'iw_clip_max': 7.0, 'iw_prob_clip': 0.014184394404565212, 'iw_n_components': 40, 'iw_logistic_c': 1.4305234579210648e-05, 'iw_pca_fit': 'combined', 'iw_solver': 'lbfgs', 'iw_rho': 0.5}. Best is trial 26 with value: 0.22498965169866433.
2026-06-01 21:18:05 | INFO | Trial 32 | outer=7 | alpha=7.595e+04 n_pcs=3500 (pc_topk) weight={'name': 'pc_logistic', 'floor': 1e-06, 'clip_max': 7.0, 'prob_clip': 0.013863129099865996, 'n_components': 40, 'logistic_c': 1.851439190790495e-05, 'pca_fit': 'combined', 'solver': 'lbfgs', 'max_iter': 2000, 'fit_intercept': True, 'standardize_with_source': True, 'rho': 0.5}
[I 2026-06-01 21:18:16,561] Trial 32 finished with value: 0.2236988355254212 and parameters: {'alpha': 75954.53164738616, 'n_pcs': 3500, 'iw_method': 'pc_logistic', 'iw_clip_max': 7.0, 'iw_prob_clip': 0.013863129099865996, 'iw_n_components': 40, 'iw_logistic_c': 1.851439190790495e-05, 'iw_pca_fit': 'combined', 'iw_solver': 'lbfgs', 'iw_rho': 0.5}. Best is trial 26 with value: 0.22498965169866433.
2026-06-01 21:18:16 | INFO | Trial 33 | outer=7 | alpha=7.486e+04 n_pcs=3000 (pc_topk) weight={'name': 'pc_logistic', 'floor': 1e-06, 'clip_max': 7.0, 'prob_clip': 0.013168688286995595, 'n_components': 40, 'logistic_c': 1.894702755870267e-05, 'pca_fit': 'combined', 'solver': 'lbfgs', 'max_iter': 2000, 'fit_intercept': True, 'standardize_with_source': True, 'rho': 0.5}
[I 2026-06-01 21:18:26,504] Trial 33 finished with value: 0.22269324414385167 and parameters: {'alpha': 74855.5757590295, 'n_pcs': 3000, 'iw_method': 'pc_logistic', 'iw_clip_max': 7.0, 'iw_prob_clip': 0.013168688286995595, 'iw_n_components': 40, 'iw_logistic_c': 1.894702755870267e-05, 'iw_pca_fit': 'combined', 'iw_solver': 'lbfgs', 'iw_rho': 0.5}. Best is trial 26 with value: 0.22498965169866433.
2026-06-01 21:18:26 | INFO | Trial 34 | outer=7 | alpha=8.153e+04 n_pcs=3000 (pc_topk) weight={'name': 'pc_logistic', 'floor': 1e-06, 'clip_max': 7.0, 'prob_clip': 0.009521901633313522, 'n_components': 40, 'logistic_c': 3.143191438641656e-05, 'pca_fit': 'combined', 'solver': 'lbfgs', 'max_iter': 2000, 'fit_intercept': True, 'standardize_with_source': True, 'rho': 0.5}
[I 2026-06-01 21:18:36,901] Trial 34 finished with value: 0.2237779957389899 and parameters: {'alpha': 81530.5718310303, 'n_pcs': 3000, 'iw_method': 'pc_logistic', 'iw_clip_max': 7.0, 'iw_prob_clip': 0.009521901633313522, 'iw_n_components': 40, 'iw_logistic_c': 3.143191438641656e-05, 'iw_pca_fit': 'combined', 'iw_solver': 'lbfgs', 'iw_rho': 0.5}. Best is trial 26 with value: 0.22498965169866433.
2026-06-01 21:18:36 | INFO | Trial 35 | outer=7 | alpha=6.249e+05 n_pcs=2000 (pc_topk) weight={'name': 'pc_logistic', 'floor': 1e-06, 'clip_max': 7.0, 'prob_clip': 0.007874189667628448, 'n_components': 40, 'logistic_c': 0.00018674951608667142, 'pca_fit': 'combined', 'solver': 'lbfgs', 'max_iter': 2000, 'fit_intercept': True, 'standardize_with_source': True, 'rho': 0.5}
[I 2026-06-01 21:18:47,771] Trial 35 finished with value: 0.2056950633663321 and parameters: {'alpha': 624854.5551536237, 'n_pcs': 2000, 'iw_method': 'pc_logistic', 'iw_clip_max': 7.0, 'iw_prob_clip': 0.007874189667628448, 'iw_n_components': 40, 'iw_logistic_c': 0.00018674951608667142, 'iw_pca_fit': 'combined', 'iw_solver': 'lbfgs', 'iw_rho': 0.5}. Best is trial 26 with value: 0.22498965169866433.
2026-06-01 21:18:47 | INFO | Trial 36 | outer=7 | alpha=1.373e+05 n_pcs=2500 (pc_topk) weight={'name': 'pc_logistic', 'floor': 1e-06, 'clip_max': 7.0, 'prob_clip': 0.02628665730049814, 'n_components': 40, 'logistic_c': 1.4516767659341625e-06, 'pca_fit': 'combined', 'solver': 'lbfgs', 'max_iter': 2000, 'fit_intercept': True, 'standardize_with_source': True, 'rho': 0.5}
[I 2026-06-01 21:18:57,133] Trial 36 finished with value: 0.2088533052574307 and parameters: {'alpha': 137342.98267369816, 'n_pcs': 2500, 'iw_method': 'pc_logistic', 'iw_clip_max': 7.0, 'iw_prob_clip': 0.02628665730049814, 'iw_n_components': 40, 'iw_logistic_c': 1.4516767659341625e-06, 'iw_pca_fit': 'combined', 'iw_solver': 'lbfgs', 'iw_rho': 0.5}. Best is trial 26 with value: 0.22498965169866433.
2026-06-01 21:18:57 | INFO | Trial 37 | outer=7 | alpha=2.944e+06 n_pcs=2000 (pc_topk) weight={'name': 'pc_logistic', 'floor': 1e-06, 'clip_max': 7.0, 'prob_clip': 0.007432213866649449, 'n_components': 40, 'logistic_c': 2.8617376876494446e-05, 'pca_fit': 'combined', 'solver': 'lbfgs', 'max_iter': 2000, 'fit_intercept': True, 'standardize_with_source': True, 'rho': 0.5}
[I 2026-06-01 21:19:05,872] Trial 37 finished with value: 0.19543846195048267 and parameters: {'alpha': 2944158.874971519, 'n_pcs': 2000, 'iw_method': 'pc_logistic', 'iw_clip_max': 7.0, 'iw_prob_clip': 0.007432213866649449, 'iw_n_components': 40, 'iw_logistic_c': 2.8617376876494446e-05, 'iw_pca_fit': 'combined', 'iw_solver': 'lbfgs', 'iw_rho': 0.5}. Best is trial 26 with value: 0.22498965169866433.
2026-06-01 21:19:05 | INFO | Trial 38 | outer=7 | alpha=2.166e+05 n_pcs=3000 (pc_topk) weight={'name': 'pc_logistic', 'floor': 1e-06, 'clip_max': 7.0, 'prob_clip': 0.008693472728304293, 'n_components': 40, 'logistic_c': 0.005104558712743668, 'pca_fit': 'combined', 'solver': 'lbfgs', 'max_iter': 2000, 'fit_intercept': True, 'standardize_with_source': True, 'rho': 0.5}
[I 2026-06-01 21:19:20,117] Trial 38 finished with value: 0.21610998406313686 and parameters: {'alpha': 216632.10190233664, 'n_pcs': 3000, 'iw_method': 'pc_logistic', 'iw_clip_max': 7.0, 'iw_prob_clip': 0.008693472728304293, 'iw_n_components': 40, 'iw_logistic_c': 0.005104558712743668, 'iw_pca_fit': 'combined', 'iw_solver': 'lbfgs', 'iw_rho': 0.5}. Best is trial 26 with value: 0.22498965169866433.
2026-06-01 21:19:20 | INFO | Trial 39 | outer=7 | alpha=6.232e+04 n_pcs=3500 (pc_topk) weight={'name': 'pc_logistic', 'floor': 1e-06, 'clip_max': 12.0, 'prob_clip': 0.026995366941691946, 'n_components': 40, 'logistic_c': 1.1257311463741388e-07, 'pca_fit': 'combined', 'solver': 'lbfgs', 'max_iter': 2000, 'fit_intercept': True, 'standardize_with_source': True, 'rho': 0.5}
[I 2026-06-01 21:19:30,288] Trial 39 finished with value: 0.2151295053012538 and parameters: {'alpha': 62316.45449978319, 'n_pcs': 3500, 'iw_method': 'pc_logistic', 'iw_clip_max': 12.0, 'iw_prob_clip': 0.026995366941691946, 'iw_n_components': 40, 'iw_logistic_c': 1.1257311463741388e-07, 'iw_pca_fit': 'combined', 'iw_solver': 'lbfgs', 'iw_rho': 0.5}. Best is trial 26 with value: 0.22498965169866433.
2026-06-01 21:19:30 | INFO | Trial 40 | outer=7 | alpha=1.110e+05 n_pcs=1500 (pc_topk) weight={'name': 'pc_logistic', 'floor': 1e-06, 'clip_max': 4.0, 'prob_clip': 0.009500087940098826, 'n_components': 20, 'logistic_c': 0.00010228229982369436, 'pca_fit': 'combined', 'solver': 'lbfgs', 'max_iter': 2000, 'fit_intercept': True, 'standardize_with_source': True, 'rho': 0.7}
[I 2026-06-01 21:19:39,168] Trial 40 finished with value: 0.21531296334186528 and parameters: {'alpha': 111004.17526004478, 'n_pcs': 1500, 'iw_method': 'pc_logistic', 'iw_clip_max': 4.0, 'iw_prob_clip': 0.009500087940098826, 'iw_n_components': 20, 'iw_logistic_c': 0.00010228229982369436, 'iw_pca_fit': 'combined', 'iw_solver': 'lbfgs', 'iw_rho': 0.7}. Best is trial 26 with value: 0.22498965169866433.
2026-06-01 21:19:39 | INFO | Trial 41 | outer=7 | alpha=6.209e+04 n_pcs=3000 (pc_topk) weight={'name': 'pc_logistic', 'floor': 1e-06, 'clip_max': 7.0, 'prob_clip': 0.01268805131054247, 'n_components': 40, 'logistic_c': 1.51851631941799e-05, 'pca_fit': 'combined', 'solver': 'lbfgs', 'max_iter': 2000, 'fit_intercept': True, 'standardize_with_source': True, 'rho': 0.5}
[I 2026-06-01 21:19:49,185] Trial 41 finished with value: 0.22172909708297986 and parameters: {'alpha': 62089.44564880626, 'n_pcs': 3000, 'iw_method': 'pc_logistic', 'iw_clip_max': 7.0, 'iw_prob_clip': 0.01268805131054247, 'iw_n_components': 40, 'iw_logistic_c': 1.51851631941799e-05, 'iw_pca_fit': 'combined', 'iw_solver': 'lbfgs', 'iw_rho': 0.5}. Best is trial 26 with value: 0.22498965169866433.
2026-06-01 21:19:49 | INFO | Trial 42 | outer=7 | alpha=7.509e+04 n_pcs=3500 (pc_topk) weight={'name': 'pc_logistic', 'floor': 1e-06, 'clip_max': 7.0, 'prob_clip': 0.02221112495326645, 'n_components': 40, 'logistic_c': 4.406357787833548e-05, 'pca_fit': 'combined', 'solver': 'lbfgs', 'max_iter': 2000, 'fit_intercept': True, 'standardize_with_source': True, 'rho': 0.5}
[I 2026-06-01 21:19:59,712] Trial 42 finished with value: 0.22577512967465635 and parameters: {'alpha': 75088.51258303932, 'n_pcs': 3500, 'iw_method': 'pc_logistic', 'iw_clip_max': 7.0, 'iw_prob_clip': 0.02221112495326645, 'iw_n_components': 40, 'iw_logistic_c': 4.406357787833548e-05, 'iw_pca_fit': 'combined', 'iw_solver': 'lbfgs', 'iw_rho': 0.5}. Best is trial 42 with value: 0.22577512967465635.
2026-06-01 21:19:59 | INFO | Trial 43 | outer=7 | alpha=1.958e+05 n_pcs=3500 (pc_topk) weight={'name': 'pc_logistic', 'floor': 1e-06, 'clip_max': 7.0, 'prob_clip': 0.026976742098893433, 'n_components': 40, 'logistic_c': 0.002175316905517819, 'pca_fit': 'combined', 'solver': 'lbfgs', 'max_iter': 2000, 'fit_intercept': True, 'standardize_with_source': True, 'rho': 0.5}
[I 2026-06-01 21:20:13,642] Trial 43 finished with value: 0.21682889008174397 and parameters: {'alpha': 195815.73651074184, 'n_pcs': 3500, 'iw_method': 'pc_logistic', 'iw_clip_max': 7.0, 'iw_prob_clip': 0.026976742098893433, 'iw_n_components': 40, 'iw_logistic_c': 0.002175316905517819, 'iw_pca_fit': 'combined', 'iw_solver': 'lbfgs', 'iw_rho': 0.5}. Best is trial 42 with value: 0.22577512967465635.
2026-06-01 21:20:13 | INFO | Trial 44 | outer=7 | alpha=2.265e+04 n_pcs=3000 (pc_topk) weight={'name': 'pc_logistic', 'floor': 1e-06, 'clip_max': 2.5, 'prob_clip': 0.02270269760721421, 'n_components': 60, 'logistic_c': 9.940025857747716e-05, 'pca_fit': 'combined', 'solver': 'lbfgs', 'max_iter': 2000, 'fit_intercept': True, 'standardize_with_source': True, 'rho': 0.85}
[I 2026-06-01 21:20:25,428] Trial 44 finished with value: 0.21214120697765054 and parameters: {'alpha': 22651.77539716844, 'n_pcs': 3000, 'iw_method': 'pc_logistic', 'iw_clip_max': 2.5, 'iw_prob_clip': 0.02270269760721421, 'iw_n_components': 60, 'iw_logistic_c': 9.940025857747716e-05, 'iw_pca_fit': 'combined', 'iw_solver': 'lbfgs', 'iw_rho': 0.85}. Best is trial 42 with value: 0.22577512967465635.
2026-06-01 21:20:25 | INFO | Trial 45 | outer=7 | alpha=3.569e+05 n_pcs=3500 (pc_topk) weight={'name': 'pc_logistic', 'floor': 1e-06, 'clip_max': 7.0, 'prob_clip': 0.03665611351505688, 'n_components': 10, 'logistic_c': 2.4798476894944204e-06, 'pca_fit': 'combined', 'solver': 'lbfgs', 'max_iter': 2000, 'fit_intercept': True, 'standardize_with_source': True, 'rho': 0.3}
[I 2026-06-01 21:20:36,031] Trial 45 finished with value: 0.19979666238093519 and parameters: {'alpha': 356870.5534592388, 'n_pcs': 3500, 'iw_method': 'pc_logistic', 'iw_clip_max': 7.0, 'iw_prob_clip': 0.03665611351505688, 'iw_n_components': 10, 'iw_logistic_c': 2.4798476894944204e-06, 'iw_pca_fit': 'combined', 'iw_solver': 'lbfgs', 'iw_rho': 0.3}. Best is trial 42 with value: 0.22577512967465635.
2026-06-01 21:20:36 | INFO | Trial 46 | outer=7 | alpha=8.410e+03 n_pcs=4000 (pc_topk) weight={'name': 'pc_logistic', 'floor': 1e-06, 'clip_max': 7.0, 'prob_clip': 0.005082997098010188, 'n_components': 100, 'logistic_c': 0.0005127441403166515, 'pca_fit': 'combined', 'solver': 'lbfgs', 'max_iter': 2000, 'fit_intercept': True, 'standardize_with_source': True, 'rho': 0.5}
[I 2026-06-01 21:20:52,549] Trial 46 finished with value: 0.20256993927253658 and parameters: {'alpha': 8409.974408276943, 'n_pcs': 4000, 'iw_method': 'pc_logistic', 'iw_clip_max': 7.0, 'iw_prob_clip': 0.005082997098010188, 'iw_n_components': 100, 'iw_logistic_c': 0.0005127441403166515, 'iw_pca_fit': 'combined', 'iw_solver': 'lbfgs', 'iw_rho': 0.5}. Best is trial 42 with value: 0.22577512967465635.
2026-06-01 21:20:52 | INFO | Trial 47 | outer=7 | alpha=9.778e+04 n_pcs=2500 (pc_topk) weight={'name': 'pc_logistic', 'floor': 1e-06, 'clip_max': 7.0, 'prob_clip': 0.019789684034933724, 'n_components': 40, 'logistic_c': 4.482873940303625e-05, 'pca_fit': 'combined', 'solver': 'lbfgs', 'max_iter': 2000, 'fit_intercept': True, 'standardize_with_source': True, 'rho': 0.5}
[I 2026-06-01 21:21:02,123] Trial 47 finished with value: 0.21990933697322523 and parameters: {'alpha': 97782.09990540528, 'n_pcs': 2500, 'iw_method': 'pc_logistic', 'iw_clip_max': 7.0, 'iw_prob_clip': 0.019789684034933724, 'iw_n_components': 40, 'iw_logistic_c': 4.482873940303625e-05, 'iw_pca_fit': 'combined', 'iw_solver': 'lbfgs', 'iw_rho': 0.5}. Best is trial 42 with value: 0.22577512967465635.
2026-06-01 21:21:02 | INFO | Trial 48 | outer=7 | alpha=5.635e+04 n_pcs=3500 (pc_topk) weight={'name': 'pc_logistic', 'floor': 1e-06, 'clip_max': 2.5, 'prob_clip': 0.010858041585354073, 'n_components': 40, 'logistic_c': 7.16784774690736e-06, 'pca_fit': 'combined', 'solver': 'lbfgs', 'max_iter': 2000, 'fit_intercept': True, 'standardize_with_source': True, 'rho': 0.5}
[I 2026-06-01 21:21:13,314] Trial 48 finished with value: 0.22197090916147708 and parameters: {'alpha': 56349.56405467028, 'n_pcs': 3500, 'iw_method': 'pc_logistic', 'iw_clip_max': 2.5, 'iw_prob_clip': 0.010858041585354073, 'iw_n_components': 40, 'iw_logistic_c': 7.16784774690736e-06, 'iw_pca_fit': 'combined', 'iw_solver': 'lbfgs', 'iw_rho': 0.5}. Best is trial 42 with value: 0.22577512967465635.
2026-06-01 21:21:13 | INFO | Trial 49 | outer=7 | alpha=1.928e+04 n_pcs=5000 (pc_topk) weight={'name': 'pc_logistic', 'floor': 1e-06, 'clip_max': 7.0, 'prob_clip': 0.005808820304567014, 'n_components': 40, 'logistic_c': 0.01993666210967476, 'pca_fit': 'combined', 'solver': 'lbfgs', 'max_iter': 2000, 'fit_intercept': True, 'standardize_with_source': True, 'rho': 0.5}
[I 2026-06-01 21:21:36,627] Trial 49 finished with value: 0.21971439951211727 and parameters: {'alpha': 19278.51379002907, 'n_pcs': 5000, 'iw_method': 'pc_logistic', 'iw_clip_max': 7.0, 'iw_prob_clip': 0.005808820304567014, 'iw_n_components': 40, 'iw_logistic_c': 0.01993666210967476, 'iw_pca_fit': 'combined', 'iw_solver': 'lbfgs', 'iw_rho': 0.5}. Best is trial 42 with value: 0.22577512967465635.
2026-06-01 21:21:36 | INFO | Trial 50 | outer=7 | alpha=1.597e+05 n_pcs=4000 (pc_topk) weight={'name': 'pc_logistic', 'floor': 1e-06, 'clip_max': 12.0, 'prob_clip': 0.03521622271951203, 'n_components': 40, 'logistic_c': 8.050095601846774e-07, 'pca_fit': 'combined', 'solver': 'lbfgs', 'max_iter': 2000, 'fit_intercept': True, 'standardize_with_source': True, 'rho': 0.5}
[I 2026-06-01 21:21:49,226] Trial 50 finished with value: 0.20902914290737748 and parameters: {'alpha': 159717.75627969048, 'n_pcs': 4000, 'iw_method': 'pc_logistic', 'iw_clip_max': 12.0, 'iw_prob_clip': 0.03521622271951203, 'iw_n_components': 40, 'iw_logistic_c': 8.050095601846774e-07, 'iw_pca_fit': 'combined', 'iw_solver': 'lbfgs', 'iw_rho': 0.5}. Best is trial 42 with value: 0.22577512967465635.
2026-06-01 21:21:49 | INFO | Trial 51 | outer=7 | alpha=7.265e+04 n_pcs=3000 (pc_topk) weight={'name': 'pc_logistic', 'floor': 1e-06, 'clip_max': 7.0, 'prob_clip': 0.013072184163918634, 'n_components': 40, 'logistic_c': 3.1267341932460486e-05, 'pca_fit': 'combined', 'solver': 'lbfgs', 'max_iter': 2000, 'fit_intercept': True, 'standardize_with_source': True, 'rho': 0.5}
[I 2026-06-01 21:22:00,118] Trial 51 finished with value: 0.22394020624861377 and parameters: {'alpha': 72648.74886061467, 'n_pcs': 3000, 'iw_method': 'pc_logistic', 'iw_clip_max': 7.0, 'iw_prob_clip': 0.013072184163918634, 'iw_n_components': 40, 'iw_logistic_c': 3.1267341932460486e-05, 'iw_pca_fit': 'combined', 'iw_solver': 'lbfgs', 'iw_rho': 0.5}. Best is trial 42 with value: 0.22577512967465635.
2026-06-01 21:22:00 | INFO | Trial 52 | outer=7 | alpha=5.310e+04 n_pcs=3000 (pc_topk) weight={'name': 'pc_logistic', 'floor': 1e-06, 'clip_max': 7.0, 'prob_clip': 0.016311920531931326, 'n_components': 40, 'logistic_c': 5.246432953915251e-05, 'pca_fit': 'combined', 'solver': 'lbfgs', 'max_iter': 2000, 'fit_intercept': True, 'standardize_with_source': True, 'rho': 0.5}
[I 2026-06-01 21:22:11,141] Trial 52 finished with value: 0.22356894596878457 and parameters: {'alpha': 53100.654401938154, 'n_pcs': 3000, 'iw_method': 'pc_logistic', 'iw_clip_max': 7.0, 'iw_prob_clip': 0.016311920531931326, 'iw_n_components': 40, 'iw_logistic_c': 5.246432953915251e-05, 'iw_pca_fit': 'combined', 'iw_solver': 'lbfgs', 'iw_rho': 0.5}. Best is trial 42 with value: 0.22577512967465635.
2026-06-01 21:22:11 | INFO | Trial 53 | outer=7 | alpha=1.030e+05 n_pcs=2500 (pc_topk) weight={'name': 'pc_logistic', 'floor': 1e-06, 'clip_max': 1.5, 'prob_clip': 0.011480093796431372, 'n_components': 80, 'logistic_c': 6.386856369028515e-06, 'pca_fit': 'combined', 'solver': 'lbfgs', 'max_iter': 2000, 'fit_intercept': True, 'standardize_with_source': True, 'rho': 0.5}
[I 2026-06-01 21:22:20,590] Trial 53 finished with value: 0.21343133574436726 and parameters: {'alpha': 103031.21056469354, 'n_pcs': 2500, 'iw_method': 'pc_logistic', 'iw_clip_max': 1.5, 'iw_prob_clip': 0.011480093796431372, 'iw_n_components': 80, 'iw_logistic_c': 6.386856369028515e-06, 'iw_pca_fit': 'combined', 'iw_solver': 'lbfgs', 'iw_rho': 0.5}. Best is trial 42 with value: 0.22577512967465635.
2026-06-01 21:22:20 | INFO | Trial 54 | outer=7 | alpha=4.526e+05 n_pcs=2000 (pc_topk) weight={'name': 'pc_logistic', 'floor': 1e-06, 'clip_max': 7.0, 'prob_clip': 0.006851092277230083, 'n_components': 40, 'logistic_c': 0.0004000822570747909, 'pca_fit': 'combined', 'solver': 'lbfgs', 'max_iter': 2000, 'fit_intercept': True, 'standardize_with_source': True, 'rho': 0.3}
[I 2026-06-01 21:22:31,549] Trial 54 finished with value: 0.20870606629309257 and parameters: {'alpha': 452569.7502652709, 'n_pcs': 2000, 'iw_method': 'pc_logistic', 'iw_clip_max': 7.0, 'iw_prob_clip': 0.006851092277230083, 'iw_n_components': 40, 'iw_logistic_c': 0.0004000822570747909, 'iw_pca_fit': 'combined', 'iw_solver': 'lbfgs', 'iw_rho': 0.3}. Best is trial 42 with value: 0.22577512967465635.
2026-06-01 21:22:31 | INFO | Trial 55 | outer=7 | alpha=8.022e+04 n_pcs=3500 (pc_topk) weight={'name': 'pc_logistic', 'floor': 1e-06, 'clip_max': 7.0, 'prob_clip': 0.01814900882718858, 'n_components': 20, 'logistic_c': 0.025085053847220214, 'pca_fit': 'combined', 'solver': 'lbfgs', 'max_iter': 2000, 'fit_intercept': True, 'standardize_with_source': True, 'rho': 1.0}
[I 2026-06-01 21:22:47,944] Trial 55 finished with value: 0.2145985387413257 and parameters: {'alpha': 80217.46880866116, 'n_pcs': 3500, 'iw_method': 'pc_logistic', 'iw_clip_max': 7.0, 'iw_prob_clip': 0.01814900882718858, 'iw_n_components': 20, 'iw_logistic_c': 0.025085053847220214, 'iw_pca_fit': 'combined', 'iw_solver': 'lbfgs', 'iw_rho': 1.0}. Best is trial 42 with value: 0.22577512967465635.
2026-06-01 21:22:47 | INFO | Trial 56 | outer=7 | alpha=2.590e+04 n_pcs=3000 (pc_topk) weight={'name': 'pc_logistic', 'floor': 1e-06, 'clip_max': 4.0, 'prob_clip': 0.0034365332435714207, 'n_components': 80, 'logistic_c': 9.212471525459919e-05, 'pca_fit': 'combined', 'solver': 'lbfgs', 'max_iter': 2000, 'fit_intercept': True, 'standardize_with_source': True, 'rho': 0.85}
