[I 2026-06-01 23:36:56,678] Trial 58 finished with value: 0.22137115282317352 and parameters: {'alpha': 49486.79957110115, 'n_pcs': 3000, 'iw_method': 'uniform'}. Best is trial 42 with value: 0.22412397147737737.
2026-06-01 23:36:56 | INFO | Trial 59 | outer=9 | alpha=2.977e+03 n_pcs=4500 (pc_topk) weight={'name': 'pc_logistic', 'floor': 1e-06, 'clip_max': 1.5, 'prob_clip': 0.0017016215177604655, 'n_components': 20, 'logistic_c': 0.01934139649381318, 'pca_fit': 'combined', 'solver': 'lbfgs', 'max_iter': 2000, 'fit_intercept': True, 'standardize_with_source': True, 'rho': 0.3}
[I 2026-06-01 23:37:15,320] Trial 59 finished with value: 0.18129542407775323 and parameters: {'alpha': 2977.337110203631, 'n_pcs': 4500, 'iw_method': 'pc_logistic', 'iw_clip_max': 1.5, 'iw_prob_clip': 0.0017016215177604655, 'iw_n_components': 20, 'iw_logistic_c': 0.01934139649381318, 'iw_pca_fit': 'combined', 'iw_solver': 'lbfgs', 'iw_rho': 0.3}. Best is trial 42 with value: 0.22412397147737737.
2026-06-01 23:37:15 | INFO | Trial 60 | outer=9 | alpha=1.693e+05 n_pcs=4000 (pc_topk) weight={'name': 'uniform'}
[I 2026-06-01 23:37:22,519] Trial 60 finished with value: 0.21295897977756698 and parameters: {'alpha': 169308.92164661252, 'n_pcs': 4000, 'iw_method': 'uniform'}. Best is trial 42 with value: 0.22412397147737737.
2026-06-01 23:37:22 | INFO | Trial 61 | outer=9 | alpha=2.648e+04 n_pcs=4500 (pc_topk) weight={'name': 'uniform'}
[I 2026-06-01 23:37:31,350] Trial 61 finished with value: 0.22420512850492766 and parameters: {'alpha': 26481.545950310767, 'n_pcs': 4500, 'iw_method': 'uniform'}. Best is trial 61 with value: 0.22420512850492766.
2026-06-01 23:37:31 | INFO | Trial 62 | outer=9 | alpha=2.432e+04 n_pcs=4500 (pc_topk) weight={'name': 'uniform'}
[I 2026-06-01 23:37:40,129] Trial 62 finished with value: 0.2240210277317701 and parameters: {'alpha': 24323.27297506043, 'n_pcs': 4500, 'iw_method': 'uniform'}. Best is trial 61 with value: 0.22420512850492766.
2026-06-01 23:37:40 | INFO | Trial 63 | outer=9 | alpha=1.748e+04 n_pcs=4500 (pc_topk) weight={'name': 'uniform'}
[I 2026-06-01 23:37:48,978] Trial 63 finished with value: 0.2224398829154901 and parameters: {'alpha': 17477.999943805644, 'n_pcs': 4500, 'iw_method': 'uniform'}. Best is trial 61 with value: 0.22420512850492766.
2026-06-01 23:37:48 | INFO | Trial 64 | outer=9 | alpha=2.625e+04 n_pcs=4000 (pc_topk) weight={'name': 'uniform'}
[I 2026-06-01 23:37:56,079] Trial 64 finished with value: 0.21969080098164206 and parameters: {'alpha': 26246.800950540364, 'n_pcs': 4000, 'iw_method': 'uniform'}. Best is trial 61 with value: 0.22420512850492766.
2026-06-01 23:37:56 | INFO | Trial 65 | outer=9 | alpha=9.386e+04 n_pcs=500 (pc_topk) weight={'name': 'uniform'}
[I 2026-06-01 23:37:57,164] Trial 65 finished with value: 0.1767327711930117 and parameters: {'alpha': 93860.56012332518, 'n_pcs': 500, 'iw_method': 'uniform'}. Best is trial 61 with value: 0.22420512850492766.
2026-06-01 23:37:57 | INFO | Trial 66 | outer=9 | alpha=5.062e+04 n_pcs=4500 (pc_topk) weight={'name': 'uniform'}
[I 2026-06-01 23:38:06,056] Trial 66 finished with value: 0.22314369188132427 and parameters: {'alpha': 50618.49347378764, 'n_pcs': 4500, 'iw_method': 'uniform'}. Best is trial 61 with value: 0.22420512850492766.
2026-06-01 23:38:06 | INFO | Trial 67 | outer=9 | alpha=1.519e+04 n_pcs=5000 (pc_topk) weight={'name': 'uniform'}
[I 2026-06-01 23:38:16,551] Trial 67 finished with value: 0.22067792378701384 and parameters: {'alpha': 15188.432195997082, 'n_pcs': 5000, 'iw_method': 'uniform'}. Best is trial 61 with value: 0.22420512850492766.
2026-06-01 23:38:16 | INFO | Trial 68 | outer=9 | alpha=7.246e+04 n_pcs=4000 (pc_topk) weight={'name': 'uniform'}
[I 2026-06-01 23:38:23,779] Trial 68 finished with value: 0.21956690107519333 and parameters: {'alpha': 72461.12163972885, 'n_pcs': 4000, 'iw_method': 'uniform'}. Best is trial 61 with value: 0.22420512850492766.
2026-06-01 23:38:23 | INFO | Trial 69 | outer=9 | alpha=9.391e+03 n_pcs=1000 (pc_topk) weight={'name': 'uniform'}
[I 2026-06-01 23:38:25,947] Trial 69 finished with value: 0.19276087069258935 and parameters: {'alpha': 9390.718898261652, 'n_pcs': 1000, 'iw_method': 'uniform'}. Best is trial 61 with value: 0.22420512850492766.
2026-06-01 23:38:25 | INFO | Trial 70 | outer=9 | alpha=3.734e+04 n_pcs=4500 (pc_topk) weight={'name': 'uniform'}
[I 2026-06-01 23:38:35,265] Trial 70 finished with value: 0.22414045755517847 and parameters: {'alpha': 37336.2641111323, 'n_pcs': 4500, 'iw_method': 'uniform'}. Best is trial 61 with value: 0.22420512850492766.
2026-06-01 23:38:35 | INFO | Trial 71 | outer=9 | alpha=4.256e+04 n_pcs=4500 (pc_topk) weight={'name': 'uniform'}
[I 2026-06-01 23:38:44,794] Trial 71 finished with value: 0.2238093180292761 and parameters: {'alpha': 42561.054946528864, 'n_pcs': 4500, 'iw_method': 'uniform'}. Best is trial 61 with value: 0.22420512850492766.
2026-06-01 23:38:44 | INFO | Trial 72 | outer=9 | alpha=3.656e+04 n_pcs=5000 (pc_topk) weight={'name': 'uniform'}
[I 2026-06-01 23:38:55,108] Trial 72 finished with value: 0.223059132393429 and parameters: {'alpha': 36558.52350512431, 'n_pcs': 5000, 'iw_method': 'uniform'}. Best is trial 61 with value: 0.22420512850492766.
2026-06-01 23:38:55 | INFO | Trial 73 | outer=9 | alpha=2.845e+04 n_pcs=4500 (pc_topk) weight={'name': 'uniform'}
[I 2026-06-01 23:39:04,003] Trial 73 finished with value: 0.224295448058556 and parameters: {'alpha': 28445.372364023002, 'n_pcs': 4500, 'iw_method': 'uniform'}. Best is trial 73 with value: 0.224295448058556.
2026-06-01 23:39:04 | INFO | Trial 74 | outer=9 | alpha=2.959e+04 n_pcs=4000 (pc_topk) weight={'name': 'uniform'}
[I 2026-06-01 23:39:11,180] Trial 74 finished with value: 0.22035955443591743 and parameters: {'alpha': 29594.782478528654, 'n_pcs': 4000, 'iw_method': 'uniform'}. Best is trial 73 with value: 0.224295448058556.
2026-06-01 23:39:11 | INFO | Trial 75 | outer=9 | alpha=1.719e+04 n_pcs=4500 (pc_topk) weight={'name': 'uniform'}
[I 2026-06-01 23:39:19,976] Trial 75 finished with value: 0.22232279862981924 and parameters: {'alpha': 17193.688251825424, 'n_pcs': 4500, 'iw_method': 'uniform'}. Best is trial 73 with value: 0.224295448058556.
2026-06-01 23:39:19 | INFO | Trial 76 | outer=9 | alpha=7.373e+04 n_pcs=4500 (pc_topk) weight={'name': 'uniform'}
[I 2026-06-01 23:39:28,799] Trial 76 finished with value: 0.2209375483154501 and parameters: {'alpha': 73734.78827509274, 'n_pcs': 4500, 'iw_method': 'uniform'}. Best is trial 73 with value: 0.224295448058556.
2026-06-01 23:39:28 | INFO | Trial 77 | outer=9 | alpha=4.375e+04 n_pcs=5000 (pc_topk) weight={'name': 'uniform'}
[I 2026-06-01 23:39:39,182] Trial 77 finished with value: 0.22260657398274253 and parameters: {'alpha': 43754.3328484041, 'n_pcs': 5000, 'iw_method': 'uniform'}. Best is trial 73 with value: 0.224295448058556.
2026-06-01 23:39:39 | INFO | Trial 78 | outer=9 | alpha=1.088e+04 n_pcs=5000 (pc_topk) weight={'name': 'pc_logistic', 'floor': 1e-06, 'clip_max': 2.5, 'prob_clip': 0.008689239461824053, 'n_components': 10, 'logistic_c': 0.4992000275563164, 'pca_fit': 'combined', 'solver': 'lbfgs', 'max_iter': 2000, 'fit_intercept': True, 'standardize_with_source': True, 'rho': 0.3}
[I 2026-06-01 23:39:59,076] Trial 78 finished with value: 0.21661602571926936 and parameters: {'alpha': 10883.182533770268, 'n_pcs': 5000, 'iw_method': 'pc_logistic', 'iw_clip_max': 2.5, 'iw_prob_clip': 0.008689239461824053, 'iw_n_components': 10, 'iw_logistic_c': 0.4992000275563164, 'iw_pca_fit': 'combined', 'iw_solver': 'lbfgs', 'iw_rho': 0.3}. Best is trial 73 with value: 0.224295448058556.
2026-06-01 23:39:59 | INFO | Trial 79 | outer=9 | alpha=6.613e+03 n_pcs=4500 (pc_topk) weight={'name': 'uniform'}
[I 2026-06-01 23:40:08,189] Trial 79 finished with value: 0.20780070043022483 and parameters: {'alpha': 6613.3976194620645, 'n_pcs': 4500, 'iw_method': 'uniform'}. Best is trial 73 with value: 0.224295448058556.
2026-06-01 23:40:08 | INFO | Trial 80 | outer=9 | alpha=3.401e+04 n_pcs=3500 (pc_topk) weight={'name': 'uniform'}
[I 2026-06-01 23:40:14,459] Trial 80 finished with value: 0.22164385887028093 and parameters: {'alpha': 34014.687096329755, 'n_pcs': 3500, 'iw_method': 'uniform'}. Best is trial 73 with value: 0.224295448058556.
2026-06-01 23:40:14 | INFO | Trial 81 | outer=9 | alpha=1.996e+04 n_pcs=4500 (pc_topk) weight={'name': 'uniform'}
[I 2026-06-01 23:40:23,334] Trial 81 finished with value: 0.22324905031956685 and parameters: {'alpha': 19960.86456848812, 'n_pcs': 4500, 'iw_method': 'uniform'}. Best is trial 73 with value: 0.224295448058556.
2026-06-01 23:40:23 | INFO | Trial 82 | outer=9 | alpha=2.655e+04 n_pcs=4500 (pc_topk) weight={'name': 'uniform'}
[I 2026-06-01 23:40:32,193] Trial 82 finished with value: 0.22420916444240388 and parameters: {'alpha': 26545.513872325428, 'n_pcs': 4500, 'iw_method': 'uniform'}. Best is trial 73 with value: 0.224295448058556.
2026-06-01 23:40:32 | INFO | Trial 83 | outer=9 | alpha=1.437e+04 n_pcs=4500 (pc_topk) weight={'name': 'uniform'}
[I 2026-06-01 23:40:41,011] Trial 83 finished with value: 0.22078308821408452 and parameters: {'alpha': 14370.86860190708, 'n_pcs': 4500, 'iw_method': 'uniform'}. Best is trial 73 with value: 0.224295448058556.
2026-06-01 23:40:41 | INFO | Trial 84 | outer=9 | alpha=2.772e+04 n_pcs=4000 (pc_topk) weight={'name': 'uniform'}
[I 2026-06-01 23:40:48,135] Trial 84 finished with value: 0.2200230246847632 and parameters: {'alpha': 27722.08868633205, 'n_pcs': 4000, 'iw_method': 'uniform'}. Best is trial 73 with value: 0.224295448058556.
2026-06-01 23:40:48 | INFO | Trial 85 | outer=9 | alpha=1.272e+05 n_pcs=5000 (pc_topk) weight={'name': 'uniform'}
[I 2026-06-01 23:40:58,333] Trial 85 finished with value: 0.2154593742214789 and parameters: {'alpha': 127159.03742033184, 'n_pcs': 5000, 'iw_method': 'uniform'}. Best is trial 73 with value: 0.224295448058556.
2026-06-01 23:40:58 | INFO | Trial 86 | outer=9 | alpha=5.757e+04 n_pcs=4000 (pc_topk) weight={'name': 'uniform'}
[I 2026-06-01 23:41:05,295] Trial 86 finished with value: 0.22057818240158275 and parameters: {'alpha': 57570.92817361941, 'n_pcs': 4000, 'iw_method': 'uniform'}. Best is trial 73 with value: 0.224295448058556.
2026-06-01 23:41:05 | INFO | Trial 87 | outer=9 | alpha=9.052e+04 n_pcs=4500 (pc_topk) weight={'name': 'uniform'}
[I 2026-06-01 23:41:14,147] Trial 87 finished with value: 0.21937515034730742 and parameters: {'alpha': 90515.33077200229, 'n_pcs': 4500, 'iw_method': 'uniform'}. Best is trial 73 with value: 0.224295448058556.
2026-06-01 23:41:14 | INFO | Trial 88 | outer=9 | alpha=4.073e+04 n_pcs=4500 (pc_topk) weight={'name': 'uniform'}
[I 2026-06-01 23:41:22,973] Trial 88 finished with value: 0.22393790051644805 and parameters: {'alpha': 40728.2017325076, 'n_pcs': 4500, 'iw_method': 'uniform'}. Best is trial 73 with value: 0.224295448058556.
2026-06-01 23:41:22 | INFO | Trial 89 | outer=9 | alpha=2.666e+04 n_pcs=4000 (pc_topk) weight={'name': 'uniform'}
[I 2026-06-01 23:41:30,245] Trial 89 finished with value: 0.21979109037992245 and parameters: {'alpha': 26662.584224441238, 'n_pcs': 4000, 'iw_method': 'uniform'}. Best is trial 73 with value: 0.224295448058556.
2026-06-01 23:41:30 | INFO | Trial 90 | outer=9 | alpha=1.857e+04 n_pcs=5000 (pc_topk) weight={'name': 'pc_logistic', 'floor': 1e-06, 'clip_max': 1.5, 'prob_clip': 0.0013893242379131973, 'n_components': 10, 'logistic_c': 0.00581620412952703, 'pca_fit': 'combined', 'solver': 'lbfgs', 'max_iter': 2000, 'fit_intercept': True, 'standardize_with_source': True, 'rho': 0.85}
[I 2026-06-01 23:41:49,079] Trial 90 finished with value: 0.22080531590257832 and parameters: {'alpha': 18570.585645032428, 'n_pcs': 5000, 'iw_method': 'pc_logistic', 'iw_clip_max': 1.5, 'iw_prob_clip': 0.0013893242379131973, 'iw_n_components': 10, 'iw_logistic_c': 0.00581620412952703, 'iw_pca_fit': 'combined', 'iw_solver': 'lbfgs', 'iw_rho': 0.85}. Best is trial 73 with value: 0.224295448058556.
2026-06-01 23:41:49 | INFO | Trial 91 | outer=9 | alpha=3.976e+04 n_pcs=4500 (pc_topk) weight={'name': 'uniform'}
[I 2026-06-01 23:41:58,315] Trial 91 finished with value: 0.22400079355593272 and parameters: {'alpha': 39761.09834440585, 'n_pcs': 4500, 'iw_method': 'uniform'}. Best is trial 73 with value: 0.224295448058556.
2026-06-01 23:41:58 | INFO | Trial 92 | outer=9 | alpha=3.503e+04 n_pcs=4500 (pc_topk) weight={'name': 'uniform'}
[I 2026-06-01 23:42:07,376] Trial 92 finished with value: 0.224243894639815 and parameters: {'alpha': 35030.571610324885, 'n_pcs': 4500, 'iw_method': 'uniform'}. Best is trial 73 with value: 0.224295448058556.
2026-06-01 23:42:07 | INFO | Trial 93 | outer=9 | alpha=3.687e+04 n_pcs=4500 (pc_topk) weight={'name': 'uniform'}
[I 2026-06-01 23:42:16,438] Trial 93 finished with value: 0.22416374344194093 and parameters: {'alpha': 36874.24681655227, 'n_pcs': 4500, 'iw_method': 'uniform'}. Best is trial 73 with value: 0.224295448058556.
2026-06-01 23:42:16 | INFO | Trial 94 | outer=9 | alpha=5.116e+04 n_pcs=4500 (pc_topk) weight={'name': 'uniform'}
[I 2026-06-01 23:42:25,518] Trial 94 finished with value: 0.22309490931295844 and parameters: {'alpha': 51160.410469742295, 'n_pcs': 4500, 'iw_method': 'uniform'}. Best is trial 73 with value: 0.224295448058556.
2026-06-01 23:42:25 | INFO | Trial 95 | outer=9 | alpha=3.161e+04 n_pcs=5000 (pc_topk) weight={'name': 'uniform'}
[I 2026-06-01 23:42:36,101] Trial 95 finished with value: 0.22321646260422728 and parameters: {'alpha': 31610.89099200007, 'n_pcs': 5000, 'iw_method': 'uniform'}. Best is trial 73 with value: 0.224295448058556.
2026-06-01 23:42:36 | INFO | Trial 96 | outer=9 | alpha=6.934e+04 n_pcs=4500 (pc_topk) weight={'name': 'uniform'}
[I 2026-06-01 23:42:45,022] Trial 96 finished with value: 0.22136132566572667 and parameters: {'alpha': 69335.34250110287, 'n_pcs': 4500, 'iw_method': 'uniform'}. Best is trial 73 with value: 0.224295448058556.
2026-06-01 23:42:45 | INFO | Trial 97 | outer=9 | alpha=1.520e+04 n_pcs=4500 (pc_topk) weight={'name': 'uniform'}
[I 2026-06-01 23:42:54,001] Trial 97 finished with value: 0.2213177432601106 and parameters: {'alpha': 15201.390824810534, 'n_pcs': 4500, 'iw_method': 'uniform'}. Best is trial 73 with value: 0.224295448058556.
2026-06-01 23:42:54 | INFO | Trial 98 | outer=9 | alpha=9.945e+06 n_pcs=4000 (pc_topk) weight={'name': 'uniform'}
[I 2026-06-01 23:43:00,908] Trial 98 finished with value: 0.18917239027614513 and parameters: {'alpha': 9944801.515729368, 'n_pcs': 4000, 'iw_method': 'uniform'}. Best is trial 73 with value: 0.224295448058556.
2026-06-01 23:43:00 | INFO | Trial 99 | outer=9 | alpha=1.046e+04 n_pcs=5000 (pc_topk) weight={'name': 'uniform'}
[I 2026-06-01 23:43:11,077] Trial 99 finished with value: 0.21688496659818676 and parameters: {'alpha': 10457.376565917946, 'n_pcs': 5000, 'iw_method': 'uniform'}. Best is trial 73 with value: 0.224295448058556.
2026-06-01 23:43:11 | INFO | Trial 100 | outer=9 | alpha=2.215e+04 n_pcs=4000 (pc_topk) weight={'name': 'uniform'}
[I 2026-06-01 23:43:18,308] Trial 100 finished with value: 0.2183520990879953 and parameters: {'alpha': 22154.483691681886, 'n_pcs': 4000, 'iw_method': 'uniform'}. Best is trial 73 with value: 0.224295448058556.
2026-06-01 23:43:18 | INFO | Trial 101 | outer=9 | alpha=3.661e+04 n_pcs=4500 (pc_topk) weight={'name': 'uniform'}
[I 2026-06-01 23:43:27,090] Trial 101 finished with value: 0.2241763175018944 and parameters: {'alpha': 36613.76290096206, 'n_pcs': 4500, 'iw_method': 'uniform'}. Best is trial 73 with value: 0.224295448058556.
2026-06-01 23:43:27 | INFO | Trial 102 | outer=9 | alpha=1.210e+03 n_pcs=4500 (pc_topk) weight={'name': 'uniform'}
[I 2026-06-01 23:43:35,854] Trial 102 finished with value: 0.14396706211540872 and parameters: {'alpha': 1209.5032681290143, 'n_pcs': 4500, 'iw_method': 'uniform'}. Best is trial 73 with value: 0.224295448058556.
2026-06-01 23:43:35 | INFO | Trial 103 | outer=9 | alpha=3.601e+04 n_pcs=4500 (pc_topk) weight={'name': 'uniform'}
[I 2026-06-01 23:43:44,545] Trial 103 finished with value: 0.2242039715219001 and parameters: {'alpha': 36008.79860844535, 'n_pcs': 4500, 'iw_method': 'uniform'}. Best is trial 73 with value: 0.224295448058556.
2026-06-01 23:43:44 | INFO | Trial 104 | outer=9 | alpha=3.514e+04 n_pcs=2500 (pc_topk) weight={'name': 'uniform'}
[I 2026-06-01 23:43:49,409] Trial 104 finished with value: 0.22234730532404803 and parameters: {'alpha': 35138.45614601815, 'n_pcs': 2500, 'iw_method': 'uniform'}. Best is trial 73 with value: 0.224295448058556.
2026-06-01 23:43:49 | INFO | Trial 105 | outer=9 | alpha=6.149e+04 n_pcs=4500 (pc_topk) weight={'name': 'uniform'}
[I 2026-06-01 23:43:58,298] Trial 105 finished with value: 0.22212080192567113 and parameters: {'alpha': 61494.80374997831, 'n_pcs': 4500, 'iw_method': 'uniform'}. Best is trial 73 with value: 0.224295448058556.
2026-06-01 23:43:58 | INFO | Trial 106 | outer=9 | alpha=8.358e+04 n_pcs=4500 (pc_topk) weight={'name': 'uniform'}
[I 2026-06-01 23:44:07,088] Trial 106 finished with value: 0.2200086225106725 and parameters: {'alpha': 83577.8492888556, 'n_pcs': 4500, 'iw_method': 'uniform'}. Best is trial 73 with value: 0.224295448058556.
2026-06-01 23:44:07 | INFO | Trial 107 | outer=9 | alpha=4.989e+04 n_pcs=5000 (pc_topk) weight={'name': 'uniform'}
[I 2026-06-01 23:44:17,353] Trial 107 finished with value: 0.22210944962972085 and parameters: {'alpha': 49891.98837849148, 'n_pcs': 5000, 'iw_method': 'uniform'}. Best is trial 73 with value: 0.224295448058556.
2026-06-01 23:44:17 | INFO | Trial 108 | outer=9 | alpha=2.856e+04 n_pcs=4500 (pc_topk) weight={'name': 'uniform'}
[I 2026-06-01 23:44:26,159] Trial 108 finished with value: 0.22429891233487945 and parameters: {'alpha': 28562.6408006658, 'n_pcs': 4500, 'iw_method': 'uniform'}. Best is trial 108 with value: 0.22429891233487945.
2026-06-01 23:44:26 | INFO | Trial 109 | outer=9 | alpha=2.704e+04 n_pcs=4000 (pc_topk) weight={'name': 'uniform'}
[I 2026-06-01 23:44:33,167] Trial 109 finished with value: 0.21987779659819573 and parameters: {'alpha': 27041.23087449483, 'n_pcs': 4000, 'iw_method': 'uniform'}. Best is trial 108 with value: 0.22429891233487945.
2026-06-01 23:44:33 | INFO | Trial 110 | outer=9 | alpha=1.878e+04 n_pcs=4500 (pc_topk) weight={'name': 'pc_logistic', 'floor': 1e-06, 'clip_max': 4.0, 'prob_clip': 0.02261541380734373, 'n_components': 100, 'logistic_c': 6.6019272093270294e-06, 'pca_fit': 'combined', 'solver': 'lbfgs', 'max_iter': 2000, 'fit_intercept': True, 'standardize_with_source': True, 'rho': 0.5}
[I 2026-06-01 23:44:48,054] Trial 110 finished with value: 0.22379597259582057 and parameters: {'alpha': 18775.583289332306, 'n_pcs': 4500, 'iw_method': 'pc_logistic', 'iw_clip_max': 4.0, 'iw_prob_clip': 0.02261541380734373, 'iw_n_components': 100, 'iw_logistic_c': 6.6019272093270294e-06, 'iw_pca_fit': 'combined', 'iw_solver': 'lbfgs', 'iw_rho': 0.5}. Best is trial 108 with value: 0.22429891233487945.
2026-06-01 23:44:48 | INFO | Trial 111 | outer=9 | alpha=4.506e+04 n_pcs=4500 (pc_topk) weight={'name': 'uniform'}
[I 2026-06-01 23:44:57,057] Trial 111 finished with value: 0.22361747145285107 and parameters: {'alpha': 45063.15304875398, 'n_pcs': 4500, 'iw_method': 'uniform'}. Best is trial 108 with value: 0.22429891233487945.
2026-06-01 23:44:57 | INFO | Trial 112 | outer=9 | alpha=3.376e+04 n_pcs=4500 (pc_topk) weight={'name': 'uniform'}
[I 2026-06-01 23:45:05,924] Trial 112 finished with value: 0.2242854619552932 and parameters: {'alpha': 33764.84620520898, 'n_pcs': 4500, 'iw_method': 'uniform'}. Best is trial 108 with value: 0.22429891233487945.
2026-06-01 23:45:05 | INFO | Trial 113 | outer=9 | alpha=3.289e+04 n_pcs=4500 (pc_topk) weight={'name': 'uniform'}
[I 2026-06-01 23:45:14,676] Trial 113 finished with value: 0.2243069564829549 and parameters: {'alpha': 32886.420228935254, 'n_pcs': 4500, 'iw_method': 'uniform'}. Best is trial 113 with value: 0.2243069564829549.
2026-06-01 23:45:14 | INFO | Trial 114 | outer=9 | alpha=3.275e+04 n_pcs=4500 (pc_topk) weight={'name': 'uniform'}
[I 2026-06-01 23:45:23,567] Trial 114 finished with value: 0.22430962297689927 and parameters: {'alpha': 32750.426290266998, 'n_pcs': 4500, 'iw_method': 'uniform'}. Best is trial 114 with value: 0.22430962297689927.
2026-06-01 23:45:23 | INFO | Trial 115 | outer=9 | alpha=3.335e+04 n_pcs=4500 (pc_topk) weight={'name': 'uniform'}
[I 2026-06-01 23:45:32,403] Trial 115 finished with value: 0.22429638087616505 and parameters: {'alpha': 33351.55495431017, 'n_pcs': 4500, 'iw_method': 'uniform'}. Best is trial 114 with value: 0.22430962297689927.
2026-06-01 23:45:32 | INFO | Trial 116 | outer=9 | alpha=1.086e+05 n_pcs=2000 (pc_topk) weight={'name': 'uniform'}
[I 2026-06-01 23:45:36,249] Trial 116 finished with value: 0.21352753158480664 and parameters: {'alpha': 108590.8227843072, 'n_pcs': 2000, 'iw_method': 'uniform'}. Best is trial 114 with value: 0.22430962297689927.
2026-06-01 23:45:36 | INFO | Trial 117 | outer=9 | alpha=3.004e+04 n_pcs=5000 (pc_topk) weight={'name': 'uniform'}
[I 2026-06-01 23:45:46,639] Trial 117 finished with value: 0.22322466468108298 and parameters: {'alpha': 30040.840978291668, 'n_pcs': 5000, 'iw_method': 'uniform'}. Best is trial 114 with value: 0.22430962297689927.
2026-06-01 23:45:46 | INFO | Trial 118 | outer=9 | alpha=1.323e+04 n_pcs=4500 (pc_topk) weight={'name': 'uniform'}
[I 2026-06-01 23:45:55,739] Trial 118 finished with value: 0.21990383052767296 and parameters: {'alpha': 13228.114403324482, 'n_pcs': 4500, 'iw_method': 'uniform'}. Best is trial 114 with value: 0.22430962297689927.
2026-06-01 23:45:55 | INFO | Trial 119 | outer=9 | alpha=6.005e+04 n_pcs=4000 (pc_topk) weight={'name': 'uniform'}
