[I 2026-06-01 23:23:09,210] Trial 276 finished with value: 0.22441129138524096 and parameters: {'alpha': 33596.62888065336, 'n_pcs': 4000, 'iw_method': 'pc_logistic', 'iw_clip_max': 2.5, 'iw_prob_clip': 0.028812164070782683, 'iw_n_components': 100, 'iw_logistic_c': 3.961674454075278e-05, 'iw_pca_fit': 'combined', 'iw_solver': 'lbfgs', 'iw_rho': 0.85}. Best is trial 261 with value: 0.22642856853149448.
2026-06-01 23:23:09 | INFO | Trial 277 | outer=8 | alpha=5.187e+04 n_pcs=4000 (pc_topk) weight={'name': 'pc_logistic', 'floor': 1e-06, 'clip_max': 2.5, 'prob_clip': 0.03354984010027448, 'n_components': 100, 'logistic_c': 2.4289293741207076e-05, 'pca_fit': 'combined', 'solver': 'lbfgs', 'max_iter': 2000, 'fit_intercept': True, 'standardize_with_source': True, 'rho': 0.5}
[I 2026-06-01 23:23:22,021] Trial 277 finished with value: 0.2232490041769525 and parameters: {'alpha': 51871.57700200885, 'n_pcs': 4000, 'iw_method': 'pc_logistic', 'iw_clip_max': 2.5, 'iw_prob_clip': 0.03354984010027448, 'iw_n_components': 100, 'iw_logistic_c': 2.4289293741207076e-05, 'iw_pca_fit': 'combined', 'iw_solver': 'lbfgs', 'iw_rho': 0.5}. Best is trial 261 with value: 0.22642856853149448.
2026-06-01 23:23:22 | INFO | Trial 278 | outer=8 | alpha=4.289e+04 n_pcs=4000 (pc_topk) weight={'name': 'pc_logistic', 'floor': 1e-06, 'clip_max': 2.5, 'prob_clip': 0.02991826602987106, 'n_components': 100, 'logistic_c': 5.421159808681816e-05, 'pca_fit': 'combined', 'solver': 'lbfgs', 'max_iter': 2000, 'fit_intercept': True, 'standardize_with_source': True, 'rho': 0.85}
[I 2026-06-01 23:23:35,342] Trial 278 finished with value: 0.22573606314655548 and parameters: {'alpha': 42891.81958450459, 'n_pcs': 4000, 'iw_method': 'pc_logistic', 'iw_clip_max': 2.5, 'iw_prob_clip': 0.02991826602987106, 'iw_n_components': 100, 'iw_logistic_c': 5.421159808681816e-05, 'iw_pca_fit': 'combined', 'iw_solver': 'lbfgs', 'iw_rho': 0.85}. Best is trial 261 with value: 0.22642856853149448.
2026-06-01 23:23:35 | INFO | Trial 279 | outer=8 | alpha=4.345e+04 n_pcs=3500 (pc_topk) weight={'name': 'pc_logistic', 'floor': 1e-06, 'clip_max': 2.5, 'prob_clip': 0.03280211531471152, 'n_components': 100, 'logistic_c': 5.8001949311704125e-05, 'pca_fit': 'combined', 'solver': 'lbfgs', 'max_iter': 2000, 'fit_intercept': True, 'standardize_with_source': True, 'rho': 0.85}
[I 2026-06-01 23:23:46,510] Trial 279 finished with value: 0.22261547197732628 and parameters: {'alpha': 43446.4367796494, 'n_pcs': 3500, 'iw_method': 'pc_logistic', 'iw_clip_max': 2.5, 'iw_prob_clip': 0.03280211531471152, 'iw_n_components': 100, 'iw_logistic_c': 5.8001949311704125e-05, 'iw_pca_fit': 'combined', 'iw_solver': 'lbfgs', 'iw_rho': 0.85}. Best is trial 261 with value: 0.22642856853149448.
2026-06-01 23:23:46 | INFO | Trial 280 | outer=8 | alpha=4.991e+04 n_pcs=4000 (pc_topk) weight={'name': 'pc_logistic', 'floor': 1e-06, 'clip_max': 2.5, 'prob_clip': 0.027216605245386116, 'n_components': 100, 'logistic_c': 5.488486621477035e-05, 'pca_fit': 'combined', 'solver': 'lbfgs', 'max_iter': 2000, 'fit_intercept': True, 'standardize_with_source': True, 'rho': 0.85}
[I 2026-06-01 23:23:58,588] Trial 280 finished with value: 0.2260953704429693 and parameters: {'alpha': 49905.1485364866, 'n_pcs': 4000, 'iw_method': 'pc_logistic', 'iw_clip_max': 2.5, 'iw_prob_clip': 0.027216605245386116, 'iw_n_components': 100, 'iw_logistic_c': 5.488486621477035e-05, 'iw_pca_fit': 'combined', 'iw_solver': 'lbfgs', 'iw_rho': 0.85}. Best is trial 261 with value: 0.22642856853149448.
2026-06-01 23:23:58 | INFO | Trial 281 | outer=8 | alpha=5.313e+04 n_pcs=4000 (pc_topk) weight={'name': 'pc_logistic', 'floor': 1e-06, 'clip_max': 2.5, 'prob_clip': 0.02716644884167465, 'n_components': 100, 'logistic_c': 5.370348502186489e-05, 'pca_fit': 'combined', 'solver': 'lbfgs', 'max_iter': 2000, 'fit_intercept': True, 'standardize_with_source': True, 'rho': 0.85}
[I 2026-06-01 23:24:10,768] Trial 281 finished with value: 0.22624370065406585 and parameters: {'alpha': 53129.58116809647, 'n_pcs': 4000, 'iw_method': 'pc_logistic', 'iw_clip_max': 2.5, 'iw_prob_clip': 0.02716644884167465, 'iw_n_components': 100, 'iw_logistic_c': 5.370348502186489e-05, 'iw_pca_fit': 'combined', 'iw_solver': 'lbfgs', 'iw_rho': 0.85}. Best is trial 261 with value: 0.22642856853149448.
2026-06-01 23:24:10 | INFO | Trial 282 | outer=8 | alpha=3.087e+04 n_pcs=4000 (pc_topk) weight={'name': 'pc_logistic', 'floor': 1e-06, 'clip_max': 2.5, 'prob_clip': 0.027227102496875627, 'n_components': 100, 'logistic_c': 5.271074613053241e-05, 'pca_fit': 'combined', 'solver': 'lbfgs', 'max_iter': 2000, 'fit_intercept': True, 'standardize_with_source': True, 'rho': 0.85}
[I 2026-06-01 23:24:24,335] Trial 282 finished with value: 0.22346568485208013 and parameters: {'alpha': 30867.749462062286, 'n_pcs': 4000, 'iw_method': 'pc_logistic', 'iw_clip_max': 2.5, 'iw_prob_clip': 0.027227102496875627, 'iw_n_components': 100, 'iw_logistic_c': 5.271074613053241e-05, 'iw_pca_fit': 'combined', 'iw_solver': 'lbfgs', 'iw_rho': 0.85}. Best is trial 261 with value: 0.22642856853149448.
2026-06-01 23:24:24 | INFO | Trial 283 | outer=8 | alpha=5.155e+04 n_pcs=4000 (pc_topk) weight={'name': 'pc_logistic', 'floor': 1e-06, 'clip_max': 7.0, 'prob_clip': 0.027583242873852994, 'n_components': 100, 'logistic_c': 4.021555210330641e-05, 'pca_fit': 'combined', 'solver': 'lbfgs', 'max_iter': 2000, 'fit_intercept': True, 'standardize_with_source': True, 'rho': 0.3}
[I 2026-06-01 23:24:37,654] Trial 283 finished with value: 0.22046738248506323 and parameters: {'alpha': 51545.85127704219, 'n_pcs': 4000, 'iw_method': 'pc_logistic', 'iw_clip_max': 7.0, 'iw_prob_clip': 0.027583242873852994, 'iw_n_components': 100, 'iw_logistic_c': 4.021555210330641e-05, 'iw_pca_fit': 'combined', 'iw_solver': 'lbfgs', 'iw_rho': 0.3}. Best is trial 261 with value: 0.22642856853149448.
2026-06-01 23:24:37 | INFO | Trial 284 | outer=8 | alpha=4.397e+04 n_pcs=4000 (pc_topk) weight={'name': 'pc_logistic', 'floor': 1e-06, 'clip_max': 2.5, 'prob_clip': 0.030691487346638603, 'n_components': 100, 'logistic_c': 6.132749400749326e-05, 'pca_fit': 'combined', 'solver': 'lbfgs', 'max_iter': 2000, 'fit_intercept': True, 'standardize_with_source': True, 'rho': 0.85}
[I 2026-06-01 23:24:50,548] Trial 284 finished with value: 0.22572182044136685 and parameters: {'alpha': 43965.62038755628, 'n_pcs': 4000, 'iw_method': 'pc_logistic', 'iw_clip_max': 2.5, 'iw_prob_clip': 0.030691487346638603, 'iw_n_components': 100, 'iw_logistic_c': 6.132749400749326e-05, 'iw_pca_fit': 'combined', 'iw_solver': 'lbfgs', 'iw_rho': 0.85}. Best is trial 261 with value: 0.22642856853149448.
2026-06-01 23:24:50 | INFO | Trial 285 | outer=8 | alpha=4.286e+04 n_pcs=4000 (pc_topk) weight={'name': 'pc_logistic', 'floor': 1e-06, 'clip_max': 12.0, 'prob_clip': 0.004362740517712947, 'n_components': 100, 'logistic_c': 5.534700001071331e-05, 'pca_fit': 'combined', 'solver': 'lbfgs', 'max_iter': 2000, 'fit_intercept': True, 'standardize_with_source': True, 'rho': 0.85}
[I 2026-06-01 23:25:04,697] Trial 285 finished with value: 0.21315552313116887 and parameters: {'alpha': 42861.13006999978, 'n_pcs': 4000, 'iw_method': 'pc_logistic', 'iw_clip_max': 12.0, 'iw_prob_clip': 0.004362740517712947, 'iw_n_components': 100, 'iw_logistic_c': 5.534700001071331e-05, 'iw_pca_fit': 'combined', 'iw_solver': 'lbfgs', 'iw_rho': 0.85}. Best is trial 261 with value: 0.22642856853149448.
2026-06-01 23:25:04 | INFO | Trial 286 | outer=8 | alpha=3.481e+04 n_pcs=4000 (pc_topk) weight={'name': 'pc_logistic', 'floor': 1e-06, 'clip_max': 2.5, 'prob_clip': 0.030419609645720866, 'n_components': 100, 'logistic_c': 1.9874503828041102e-05, 'pca_fit': 'combined', 'solver': 'lbfgs', 'max_iter': 2000, 'fit_intercept': True, 'standardize_with_source': True, 'rho': 0.85}
[I 2026-06-01 23:25:18,211] Trial 286 finished with value: 0.22403845913147052 and parameters: {'alpha': 34811.97240214022, 'n_pcs': 4000, 'iw_method': 'pc_logistic', 'iw_clip_max': 2.5, 'iw_prob_clip': 0.030419609645720866, 'iw_n_components': 100, 'iw_logistic_c': 1.9874503828041102e-05, 'iw_pca_fit': 'combined', 'iw_solver': 'lbfgs', 'iw_rho': 0.85}. Best is trial 261 with value: 0.22642856853149448.
2026-06-01 23:25:18 | INFO | Trial 287 | outer=8 | alpha=4.534e+04 n_pcs=4000 (pc_topk) weight={'name': 'pc_logistic', 'floor': 1e-06, 'clip_max': 2.5, 'prob_clip': 0.02670888585567282, 'n_components': 100, 'logistic_c': 9.93077720104788e-06, 'pca_fit': 'combined', 'solver': 'lbfgs', 'max_iter': 2000, 'fit_intercept': True, 'standardize_with_source': True, 'rho': 0.85}
[I 2026-06-01 23:25:31,079] Trial 287 finished with value: 0.22311213930844956 and parameters: {'alpha': 45337.72037433543, 'n_pcs': 4000, 'iw_method': 'pc_logistic', 'iw_clip_max': 2.5, 'iw_prob_clip': 0.02670888585567282, 'iw_n_components': 100, 'iw_logistic_c': 9.93077720104788e-06, 'iw_pca_fit': 'combined', 'iw_solver': 'lbfgs', 'iw_rho': 0.85}. Best is trial 261 with value: 0.22642856853149448.
2026-06-01 23:25:31 | INFO | Trial 288 | outer=8 | alpha=3.734e+04 n_pcs=1000 (pc_topk) weight={'name': 'pc_logistic', 'floor': 1e-06, 'clip_max': 2.5, 'prob_clip': 0.030128620354350696, 'n_components': 100, 'logistic_c': 4.0431416704935246e-05, 'pca_fit': 'combined', 'solver': 'lbfgs', 'max_iter': 2000, 'fit_intercept': True, 'standardize_with_source': True, 'rho': 0.85}
[I 2026-06-01 23:25:38,217] Trial 288 finished with value: 0.2106955304863672 and parameters: {'alpha': 37342.69234756393, 'n_pcs': 1000, 'iw_method': 'pc_logistic', 'iw_clip_max': 2.5, 'iw_prob_clip': 0.030128620354350696, 'iw_n_components': 100, 'iw_logistic_c': 4.0431416704935246e-05, 'iw_pca_fit': 'combined', 'iw_solver': 'lbfgs', 'iw_rho': 0.85}. Best is trial 261 with value: 0.22642856853149448.
2026-06-01 23:25:38 | INFO | Trial 289 | outer=8 | alpha=2.525e+04 n_pcs=4000 (pc_topk) weight={'name': 'pc_logistic', 'floor': 1e-06, 'clip_max': 2.5, 'prob_clip': 0.03107721043712857, 'n_components': 100, 'logistic_c': 6.43783526229476e-05, 'pca_fit': 'combined', 'solver': 'lbfgs', 'max_iter': 2000, 'fit_intercept': True, 'standardize_with_source': True, 'rho': 0.85}
[I 2026-06-01 23:25:50,536] Trial 289 finished with value: 0.22151984607249903 and parameters: {'alpha': 25247.842716928957, 'n_pcs': 4000, 'iw_method': 'pc_logistic', 'iw_clip_max': 2.5, 'iw_prob_clip': 0.03107721043712857, 'iw_n_components': 100, 'iw_logistic_c': 6.43783526229476e-05, 'iw_pca_fit': 'combined', 'iw_solver': 'lbfgs', 'iw_rho': 0.85}. Best is trial 261 with value: 0.22642856853149448.
2026-06-01 23:25:50 | INFO | Trial 290 | outer=8 | alpha=5.176e+04 n_pcs=3500 (pc_topk) weight={'name': 'uniform'}
[I 2026-06-01 23:25:56,817] Trial 290 finished with value: 0.2121525812579895 and parameters: {'alpha': 51756.457737770244, 'n_pcs': 3500, 'iw_method': 'uniform'}. Best is trial 261 with value: 0.22642856853149448.
2026-06-01 23:25:56 | INFO | Trial 291 | outer=8 | alpha=2.932e+04 n_pcs=4000 (pc_topk) weight={'name': 'pc_logistic', 'floor': 1e-06, 'clip_max': 2.5, 'prob_clip': 0.027386501972716647, 'n_components': 100, 'logistic_c': 2.8297219707217013e-05, 'pca_fit': 'combined', 'solver': 'lbfgs', 'max_iter': 2000, 'fit_intercept': True, 'standardize_with_source': True, 'rho': 0.85}
[I 2026-06-01 23:26:10,099] Trial 291 finished with value: 0.22303880226073364 and parameters: {'alpha': 29319.698801873863, 'n_pcs': 4000, 'iw_method': 'pc_logistic', 'iw_clip_max': 2.5, 'iw_prob_clip': 0.027386501972716647, 'iw_n_components': 100, 'iw_logistic_c': 2.8297219707217013e-05, 'iw_pca_fit': 'combined', 'iw_solver': 'lbfgs', 'iw_rho': 0.85}. Best is trial 261 with value: 0.22642856853149448.
2026-06-01 23:26:10 | INFO | Trial 292 | outer=8 | alpha=4.362e+04 n_pcs=4000 (pc_topk) weight={'name': 'pc_logistic', 'floor': 1e-06, 'clip_max': 2.5, 'prob_clip': 0.033363080869318246, 'n_components': 40, 'logistic_c': 6.436987695789997e-05, 'pca_fit': 'combined', 'solver': 'lbfgs', 'max_iter': 2000, 'fit_intercept': True, 'standardize_with_source': True, 'rho': 0.85}
[I 2026-06-01 23:26:23,105] Trial 292 finished with value: 0.2244511506852198 and parameters: {'alpha': 43623.326665042616, 'n_pcs': 4000, 'iw_method': 'pc_logistic', 'iw_clip_max': 2.5, 'iw_prob_clip': 0.033363080869318246, 'iw_n_components': 40, 'iw_logistic_c': 6.436987695789997e-05, 'iw_pca_fit': 'combined', 'iw_solver': 'lbfgs', 'iw_rho': 0.85}. Best is trial 261 with value: 0.22642856853149448.
2026-06-01 23:26:23 | INFO | Trial 293 | outer=8 | alpha=5.123e+04 n_pcs=4000 (pc_topk) weight={'name': 'pc_logistic', 'floor': 1e-06, 'clip_max': 2.5, 'prob_clip': 0.029020356245512424, 'n_components': 20, 'logistic_c': 3.280983158622173e-05, 'pca_fit': 'combined', 'solver': 'lbfgs', 'max_iter': 2000, 'fit_intercept': True, 'standardize_with_source': True, 'rho': 0.85}
[I 2026-06-01 23:26:35,838] Trial 293 finished with value: 0.2242453289523108 and parameters: {'alpha': 51226.495502534664, 'n_pcs': 4000, 'iw_method': 'pc_logistic', 'iw_clip_max': 2.5, 'iw_prob_clip': 0.029020356245512424, 'iw_n_components': 20, 'iw_logistic_c': 3.280983158622173e-05, 'iw_pca_fit': 'combined', 'iw_solver': 'lbfgs', 'iw_rho': 0.85}. Best is trial 261 with value: 0.22642856853149448.
2026-06-01 23:26:35 | INFO | Trial 294 | outer=8 | alpha=3.431e+04 n_pcs=4000 (pc_topk) weight={'name': 'pc_logistic', 'floor': 1e-06, 'clip_max': 2.5, 'prob_clip': 0.025765769307122034, 'n_components': 100, 'logistic_c': 4.5822877756152426e-05, 'pca_fit': 'combined', 'solver': 'lbfgs', 'max_iter': 2000, 'fit_intercept': True, 'standardize_with_source': True, 'rho': 0.85}
[I 2026-06-01 23:26:49,791] Trial 294 finished with value: 0.22412596424822198 and parameters: {'alpha': 34308.77401859701, 'n_pcs': 4000, 'iw_method': 'pc_logistic', 'iw_clip_max': 2.5, 'iw_prob_clip': 0.025765769307122034, 'iw_n_components': 100, 'iw_logistic_c': 4.5822877756152426e-05, 'iw_pca_fit': 'combined', 'iw_solver': 'lbfgs', 'iw_rho': 0.85}. Best is trial 261 with value: 0.22642856853149448.
2026-06-01 23:26:49 | INFO | Trial 295 | outer=8 | alpha=4.257e+04 n_pcs=4000 (pc_topk) weight={'name': 'pc_logistic', 'floor': 1e-06, 'clip_max': 1.5, 'prob_clip': 0.031772296327987115, 'n_components': 100, 'logistic_c': 6.079372392644889e-05, 'pca_fit': 'combined', 'solver': 'lbfgs', 'max_iter': 2000, 'fit_intercept': True, 'standardize_with_source': True, 'rho': 0.85}
[I 2026-06-01 23:27:03,094] Trial 295 finished with value: 0.22221579603646463 and parameters: {'alpha': 42565.58652155163, 'n_pcs': 4000, 'iw_method': 'pc_logistic', 'iw_clip_max': 1.5, 'iw_prob_clip': 0.031772296327987115, 'iw_n_components': 100, 'iw_logistic_c': 6.079372392644889e-05, 'iw_pca_fit': 'combined', 'iw_solver': 'lbfgs', 'iw_rho': 0.85}. Best is trial 261 with value: 0.22642856853149448.
2026-06-01 23:27:03 | INFO | Trial 296 | outer=8 | alpha=4.949e+04 n_pcs=4000 (pc_topk) weight={'name': 'pc_logistic', 'floor': 1e-06, 'clip_max': 2.5, 'prob_clip': 0.032622490039788656, 'n_components': 100, 'logistic_c': 1.9533098230091224e-05, 'pca_fit': 'combined', 'solver': 'lbfgs', 'max_iter': 2000, 'fit_intercept': True, 'standardize_with_source': True, 'rho': 0.85}
[I 2026-06-01 23:27:15,972] Trial 296 finished with value: 0.22496951469870452 and parameters: {'alpha': 49485.46138635185, 'n_pcs': 4000, 'iw_method': 'pc_logistic', 'iw_clip_max': 2.5, 'iw_prob_clip': 0.032622490039788656, 'iw_n_components': 100, 'iw_logistic_c': 1.9533098230091224e-05, 'iw_pca_fit': 'combined', 'iw_solver': 'lbfgs', 'iw_rho': 0.85}. Best is trial 261 with value: 0.22642856853149448.
2026-06-01 23:27:16 | INFO | Trial 297 | outer=8 | alpha=5.325e+04 n_pcs=4000 (pc_topk) weight={'name': 'pc_logistic', 'floor': 1e-06, 'clip_max': 2.5, 'prob_clip': 0.02843258326729184, 'n_components': 100, 'logistic_c': 3.55066576102458e-05, 'pca_fit': 'combined', 'solver': 'lbfgs', 'max_iter': 2000, 'fit_intercept': True, 'standardize_with_source': True, 'rho': 0.85}
[I 2026-06-01 23:27:28,927] Trial 297 finished with value: 0.22633078562628386 and parameters: {'alpha': 53249.35810517698, 'n_pcs': 4000, 'iw_method': 'pc_logistic', 'iw_clip_max': 2.5, 'iw_prob_clip': 0.02843258326729184, 'iw_n_components': 100, 'iw_logistic_c': 3.55066576102458e-05, 'iw_pca_fit': 'combined', 'iw_solver': 'lbfgs', 'iw_rho': 0.85}. Best is trial 261 with value: 0.22642856853149448.
2026-06-01 23:27:28 | INFO | Trial 298 | outer=8 | alpha=5.496e+04 n_pcs=4000 (pc_topk) weight={'name': 'pc_logistic', 'floor': 1e-06, 'clip_max': 2.5, 'prob_clip': 0.033755833135863056, 'n_components': 100, 'logistic_c': 2.7424388134236042e-05, 'pca_fit': 'combined', 'solver': 'lbfgs', 'max_iter': 2000, 'fit_intercept': True, 'standardize_with_source': True, 'rho': 0.85}
[I 2026-06-01 23:27:42,315] Trial 298 finished with value: 0.22596076690628447 and parameters: {'alpha': 54959.48664044046, 'n_pcs': 4000, 'iw_method': 'pc_logistic', 'iw_clip_max': 2.5, 'iw_prob_clip': 0.033755833135863056, 'iw_n_components': 100, 'iw_logistic_c': 2.7424388134236042e-05, 'iw_pca_fit': 'combined', 'iw_solver': 'lbfgs', 'iw_rho': 0.85}. Best is trial 261 with value: 0.22642856853149448.
2026-06-01 23:27:42 | INFO | Trial 299 | outer=8 | alpha=5.676e+04 n_pcs=4000 (pc_topk) weight={'name': 'pc_logistic', 'floor': 1e-06, 'clip_max': 2.5, 'prob_clip': 0.03004678084690627, 'n_components': 100, 'logistic_c': 2.4298988755166037e-05, 'pca_fit': 'combined', 'solver': 'lbfgs', 'max_iter': 2000, 'fit_intercept': True, 'standardize_with_source': True, 'rho': 0.85}
[I 2026-06-01 23:27:55,270] Trial 299 finished with value: 0.22603458251366884 and parameters: {'alpha': 56762.206796334074, 'n_pcs': 4000, 'iw_method': 'pc_logistic', 'iw_clip_max': 2.5, 'iw_prob_clip': 0.03004678084690627, 'iw_n_components': 100, 'iw_logistic_c': 2.4298988755166037e-05, 'iw_pca_fit': 'combined', 'iw_solver': 'lbfgs', 'iw_rho': 0.85}. Best is trial 261 with value: 0.22642856853149448.
2026-06-01 23:27:55 | INFO | OUTER 8 best (inner mean r=0.2264): {'model_type': 'pc_ridge', 'alpha': 49972.20562664418, 'use_snp_selection': True, 'num_snps': 4000, 'n_pcs': 4000, 'weighting': {'name': 'pc_logistic', 'floor': 1e-06, 'clip_max': 2.5, 'prob_clip': 0.030547622362027477, 'n_components': 100, 'logistic_c': 3.466926883251038e-05, 'pca_fit': 'combined', 'solver': 'lbfgs', 'max_iter': 2000, 'fit_intercept': True, 'standardize_with_source': True, 'rho': 0.85}, 'mean_inner_effective_sample_size': 4467.426787778722, 'mean_inner_effective_sample_size_threshold': 1012.8399999999999}
2026-06-01 23:27:56 | INFO | OUTER 8 TEST r = 0.3969
2026-06-01 23:27:56 | INFO | OUTER 8 incremental summary saved to outputs/final_results/e6_pc_ridge_importance/thr_wing/e6_pc_ridge_importance_thr_wing_results.json
2026-06-01 23:27:56 | INFO | OUTER 9: test_size=151 island=8 (Lovund)
2026-06-01 23:27:56 | INFO | OUTER 9: using top 10 related inner validation islands for tuning: 9(Sleneset, avgGRM=0.0219), 2(Træna, avgGRM=0.0119), 3(Selvær, avgGRM=0.0087), 1(Myken, avgGRM=0.0084), 7(Onøy og Lurøy, avgGRM=0.0058), 0(Nesøy, avgGRM=0.0024), 6(Indre Kvarøy, avgGRM=0.0023), 5(Hestmannøy, avgGRM=-0.0006), 12(Vega, avgGRM=-0.0012), 4(Gjerøy, avgGRM=-0.0020)
[I 2026-06-01 23:27:56,975] A new study created in memory with name: ridge_importance_inner_outer8
2026-06-01 23:27:56 | INFO | Trial 0 | outer=9 | alpha=1.137e+05 n_pcs=4000 (pc_topk) weight={'name': 'uniform'}
[I 2026-06-01 23:28:03,926] Trial 0 finished with value: 0.21648643993895678 and parameters: {'alpha': 113703.38004442609, 'n_pcs': 4000, 'iw_method': 'uniform'}. Best is trial 0 with value: 0.21648643993895678.
2026-06-01 23:28:03 | INFO | Trial 1 | outer=9 | alpha=1.734e+04 n_pcs=5000 (pc_topk) weight={'name': 'uniform'}
[I 2026-06-01 23:28:14,255] Trial 1 finished with value: 0.2215883419681996 and parameters: {'alpha': 17335.792577698634, 'n_pcs': 5000, 'iw_method': 'uniform'}. Best is trial 1 with value: 0.2215883419681996.
2026-06-01 23:28:14 | INFO | Trial 2 | outer=9 | alpha=1.435e+05 n_pcs=1500 (pc_topk) weight={'name': 'uniform'}
[I 2026-06-01 23:28:17,832] Trial 2 finished with value: 0.20490610667195072 and parameters: {'alpha': 143482.76912965564, 'n_pcs': 1500, 'iw_method': 'uniform'}. Best is trial 1 with value: 0.2215883419681996.
2026-06-01 23:28:17 | INFO | Trial 3 | outer=9 | alpha=1.431e+05 n_pcs=500 (pc_topk) weight={'name': 'uniform'}
[I 2026-06-01 23:28:18,785] Trial 3 finished with value: 0.17834909574338031 and parameters: {'alpha': 143072.2464444983, 'n_pcs': 500, 'iw_method': 'uniform'}. Best is trial 1 with value: 0.2215883419681996.
2026-06-01 23:28:18 | INFO | Trial 4 | outer=9 | alpha=5.373e+06 n_pcs=2000 (pc_topk) weight={'name': 'pc_logistic', 'floor': 1e-06, 'clip_max': 1.5, 'prob_clip': 0.001637400317167702, 'n_components': 80, 'logistic_c': 0.09386700500068379, 'pca_fit': 'combined', 'solver': 'lbfgs', 'max_iter': 2000, 'fit_intercept': True, 'standardize_with_source': True, 'rho': 1.0}
[I 2026-06-01 23:28:36,739] Trial 4 finished with value: 0.19720293651184534 and parameters: {'alpha': 5373167.4046281455, 'n_pcs': 2000, 'iw_method': 'pc_logistic', 'iw_clip_max': 1.5, 'iw_prob_clip': 0.001637400317167702, 'iw_n_components': 80, 'iw_logistic_c': 0.09386700500068379, 'iw_pca_fit': 'combined', 'iw_solver': 'lbfgs', 'iw_rho': 1.0}. Best is trial 1 with value: 0.2215883419681996.
2026-06-01 23:28:36 | INFO | Trial 5 | outer=9 | alpha=6.435e+04 n_pcs=1000 (pc_topk) weight={'name': 'pc_logistic', 'floor': 1e-06, 'clip_max': 7.0, 'prob_clip': 0.004193356127903791, 'n_components': 20, 'logistic_c': 9.236417519010976, 'pca_fit': 'combined', 'solver': 'lbfgs', 'max_iter': 2000, 'fit_intercept': True, 'standardize_with_source': True, 'rho': 1.0}
2026-06-01 23:28:48 | INFO | Trial 5 rejected by ESS guard: mean_ess=635.57 threshold=1027.26
