2026-05-31 22:40:49 | INFO | src.data | Loading data from NPZ: Data/npz/snp_thr_wing_ALL.npz
2026-05-31 22:40:57 | INFO | src.data | Loading GRM from RDS: Data/GRM/GRM_vanraden.rds
2026-05-31 22:41:05 | INFO | src.nested_cv_avggrm_weighted_unified | Filtered to 5633 samples from islands (codes->labels): 0->20, 1->22, 2->23, 3->24, 4->26, 5->27, 6->28, 7->33, 8->34, 9->35, 10->38, 11->60, 12->61, 13->63, 14->67 based on include_islands=[0, 1, 2, 3, 4, 5, 6, 7, 8, 9, 10, 11, 12, 13, 14]
2026-05-31 22:43:11 | INFO | src.pc_feature | feature_pca: fit PCA on (n=5633, p=65344) -> r=5000 in 125.6s (cumvar=0.9881, standardize=False)
2026-05-31 22:43:11 | INFO | src.nested_cv_avggrm_weighted_unified | Using PC features for ridge: r_fit=5000 (cumvar=0.9881). Trials will pick top-k PCs from this set.
2026-05-31 22:43:11 | INFO | src.nested_cv_avggrm_weighted_unified | OUTER 1: test_size=118 island=0 (Nesøy)
2026-05-31 22:43:11 | INFO | src.nested_cv_avggrm_weighted_unified | OUTER 1: inner LOIO validation islands: 1(Myken), 2(Træna), 3(Selvær), 4(Gjerøy), 5(Hestmannøy), 6(Indre Kvarøy), 7(Onøy og Lurøy), 8(Lovund), 9(Sleneset), 10(Aldra), 11(Leka), 12(Vega), 13(Vikna), 14(Lauvøya)
2026-05-31 22:43:11 | INFO | src.nested_cv_avggrm_weighted_unified | OUTER 1: using top 10 related inner validation islands for tuning: 1(Myken, avgGRM=0.0066), 5(Hestmannøy, avgGRM=0.0045), 4(Gjerøy, avgGRM=0.0039), 3(Selvær, avgGRM=0.0033), 2(Træna, avgGRM=0.0030), 7(Onøy og Lurøy, avgGRM=0.0025), 8(Lovund, avgGRM=0.0024), 6(Indre Kvarøy, avgGRM=0.0016), 9(Sleneset, avgGRM=0.0013), 10(Aldra, avgGRM=-0.0006)
[I 2026-05-31 22:43:11,336] A new study created in memory with name: ridge_inner_outer0
2026-05-31 22:43:11 | INFO | src.nested_cv_avggrm_weighted_unified | Trial 0 | outer=1 | alpha=1.137e+05 n_pcs=4000 (pc_topk) weight_search=on
2026-05-31 22:43:11 | INFO | src.nested_cv_avggrm_weighted_unified | Trial 0 | outer=1 | weight={'name': 'uniform', 'floor': 1e-06, 'clip_max': None}
[I 2026-05-31 22:43:16,522] Trial 0 finished with value: 0.2391757300592162 and parameters: {'alpha': 113703.38004442609, 'n_pcs': 4000, 'weight_scheme': 'uniform', 'weight_clip_max': None}. Best is trial 0 with value: 0.2391757300592162.
2026-05-31 22:43:16 | INFO | src.nested_cv_avggrm_weighted_unified | OUTER 1 | new best trial 0 (mean inner r=0.2392) saved to outputs/final_results/e6_pc_ridge_avggrm/thr_wing/e6_pc_ridge_avggrm_thr_wing_best_trials/split_01_best_trial.json
2026-05-31 22:43:16 | INFO | src.nested_cv_avggrm_weighted_unified | Trial 1 | outer=1 | alpha=1.682e+06 n_pcs=2000 (pc_topk) weight_search=on
2026-05-31 22:43:16 | INFO | src.nested_cv_avggrm_weighted_unified | Trial 1 | outer=1 | weight={'name': 'exponential', 'floor': 1e-06, 'clip_max': 3.0, 'beta': 8.711469579953913}
[I 2026-05-31 22:43:19,145] Trial 1 finished with value: 0.246381439902214 and parameters: {'alpha': 1682385.170967095, 'n_pcs': 2000, 'weight_scheme': 'exponential', 'weight_clip_max': 3.0, 'weight_exponential_beta': 8.711469579953913}. Best is trial 1 with value: 0.246381439902214.
2026-05-31 22:43:19 | INFO | src.nested_cv_avggrm_weighted_unified | OUTER 1 | new best trial 1 (mean inner r=0.2464) saved to outputs/final_results/e6_pc_ridge_avggrm/thr_wing/e6_pc_ridge_avggrm_thr_wing_best_trials/split_01_best_trial.json
2026-05-31 22:43:19 | INFO | src.nested_cv_avggrm_weighted_unified | Trial 2 | outer=1 | alpha=2.757e+03 n_pcs=2000 (pc_topk) weight_search=on
2026-05-31 22:43:19 | INFO | src.nested_cv_avggrm_weighted_unified | Trial 2 | outer=1 | weight={'name': 'linear', 'floor': 1e-06, 'clip_max': 20.0, 'min_weight': 0.12918170299726892, 'max_weight': 3.9862564805616327}
[I 2026-05-31 22:43:22,131] Trial 2 finished with value: 0.17188844163075528 and parameters: {'alpha': 2757.0504493185063, 'n_pcs': 2000, 'weight_scheme': 'linear', 'weight_clip_max': 20.0, 'weight_linear_min_weight': 0.12918170299726892, 'weight_linear_max_weight': 3.9862564805616327}. Best is trial 1 with value: 0.246381439902214.
2026-05-31 22:43:22 | INFO | src.nested_cv_avggrm_weighted_unified | Trial 3 | outer=1 | alpha=1.776e+03 n_pcs=4000 (pc_topk) weight_search=on
2026-05-31 22:43:22 | INFO | src.nested_cv_avggrm_weighted_unified | Trial 3 | outer=1 | weight={'name': 'exponential', 'floor': 1e-06, 'clip_max': 10.0, 'beta': 0.563604612251006}
[I 2026-05-31 22:43:27,929] Trial 3 finished with value: 0.15683671996249157 and parameters: {'alpha': 1775.825123718637, 'n_pcs': 4000, 'weight_scheme': 'exponential', 'weight_clip_max': 10.0, 'weight_exponential_beta': 0.563604612251006}. Best is trial 1 with value: 0.246381439902214.
2026-05-31 22:43:27 | INFO | src.nested_cv_avggrm_weighted_unified | Trial 4 | outer=1 | alpha=1.835e+04 n_pcs=5000 (pc_topk) weight_search=on
2026-05-31 22:43:27 | INFO | src.nested_cv_avggrm_weighted_unified | Trial 4 | outer=1 | weight={'name': 'exponential', 'floor': 1e-06, 'clip_max': None, 'beta': 9.957095048208117}
[I 2026-05-31 22:43:36,077] Trial 4 finished with value: 0.24578640190929707 and parameters: {'alpha': 18351.68801260339, 'n_pcs': 5000, 'weight_scheme': 'exponential', 'weight_clip_max': None, 'weight_exponential_beta': 9.957095048208117}. Best is trial 1 with value: 0.246381439902214.
2026-05-31 22:43:36 | INFO | src.nested_cv_avggrm_weighted_unified | Trial 5 | outer=1 | alpha=9.696e+03 n_pcs=1000 (pc_topk) weight_search=on
2026-05-31 22:43:36 | INFO | src.nested_cv_avggrm_weighted_unified | Trial 5 | outer=1 | weight={'name': 'exponential', 'floor': 1e-06, 'clip_max': 3.0, 'beta': 1.5726039441128932}
[I 2026-05-31 22:43:37,496] Trial 5 finished with value: 0.22880650292259572 and parameters: {'alpha': 9695.792837096258, 'n_pcs': 1000, 'weight_scheme': 'exponential', 'weight_clip_max': 3.0, 'weight_exponential_beta': 1.5726039441128932}. Best is trial 1 with value: 0.246381439902214.
2026-05-31 22:43:37 | INFO | src.nested_cv_avggrm_weighted_unified | Trial 6 | outer=1 | alpha=6.320e+04 n_pcs=2500 (pc_topk) weight_search=on
2026-05-31 22:43:37 | INFO | src.nested_cv_avggrm_weighted_unified | Trial 6 | outer=1 | weight={'name': 'uniform', 'floor': 1e-06, 'clip_max': 10.0}
[I 2026-05-31 22:43:39,981] Trial 6 finished with value: 0.23784863139278611 and parameters: {'alpha': 63199.5851103866, 'n_pcs': 2500, 'weight_scheme': 'uniform', 'weight_clip_max': 10.0}. Best is trial 1 with value: 0.246381439902214.
2026-05-31 22:43:39 | INFO | src.nested_cv_avggrm_weighted_unified | Trial 7 | outer=1 | alpha=4.681e+04 n_pcs=2500 (pc_topk) weight_search=on
2026-05-31 22:43:39 | INFO | src.nested_cv_avggrm_weighted_unified | Trial 7 | outer=1 | weight={'name': 'linear', 'floor': 1e-06, 'clip_max': 3.0, 'min_weight': 0.13798029304672477, 'max_weight': 3.0957974174373546}
[I 2026-05-31 22:43:42,976] Trial 7 finished with value: 0.24612275869576336 and parameters: {'alpha': 46806.97703257331, 'n_pcs': 2500, 'weight_scheme': 'linear', 'weight_clip_max': 3.0, 'weight_linear_min_weight': 0.13798029304672477, 'weight_linear_max_weight': 3.0957974174373546}. Best is trial 1 with value: 0.246381439902214.
2026-05-31 22:43:42 | INFO | src.nested_cv_avggrm_weighted_unified | Trial 8 | outer=1 | alpha=5.456e+04 n_pcs=3000 (pc_topk) weight_search=on
2026-05-31 22:43:42 | INFO | src.nested_cv_avggrm_weighted_unified | Trial 8 | outer=1 | weight={'name': 'linear', 'floor': 1e-06, 'clip_max': 5.0, 'min_weight': 0.6690067570691431, 'max_weight': 4.8744640334054115}
[I 2026-05-31 22:43:46,871] Trial 8 finished with value: 0.2512248926241386 and parameters: {'alpha': 54559.68395210245, 'n_pcs': 3000, 'weight_scheme': 'linear', 'weight_clip_max': 5.0, 'weight_linear_min_weight': 0.6690067570691431, 'weight_linear_max_weight': 4.8744640334054115}. Best is trial 8 with value: 0.2512248926241386.
2026-05-31 22:43:46 | INFO | src.nested_cv_avggrm_weighted_unified | OUTER 1 | new best trial 8 (mean inner r=0.2512) saved to outputs/final_results/e6_pc_ridge_avggrm/thr_wing/e6_pc_ridge_avggrm_thr_wing_best_trials/split_01_best_trial.json
2026-05-31 22:43:46 | INFO | src.nested_cv_avggrm_weighted_unified | Trial 9 | outer=1 | alpha=8.868e+03 n_pcs=2000 (pc_topk) weight_search=on
2026-05-31 22:43:46 | INFO | src.nested_cv_avggrm_weighted_unified | Trial 9 | outer=1 | weight={'name': 'linear', 'floor': 1e-06, 'clip_max': 20.0, 'min_weight': 0.861124149305412, 'max_weight': 4.702809729786679}
[I 2026-05-31 22:43:49,379] Trial 9 finished with value: 0.2080967259466368 and parameters: {'alpha': 8867.636212887126, 'n_pcs': 2000, 'weight_scheme': 'linear', 'weight_clip_max': 20.0, 'weight_linear_min_weight': 0.861124149305412, 'weight_linear_max_weight': 4.702809729786679}. Best is trial 8 with value: 0.2512248926241386.
2026-05-31 22:43:49 | INFO | src.nested_cv_avggrm_weighted_unified | Trial 10 | outer=1 | alpha=5.986e+05 n_pcs=500 (pc_topk) weight_search=on
2026-05-31 22:43:49 | INFO | src.nested_cv_avggrm_weighted_unified | Trial 10 | outer=1 | weight={'name': 'linear', 'floor': 1e-06, 'clip_max': 5.0, 'min_weight': 0.6649918033453551, 'max_weight': 1.3005022441588598}
2026-05-31 22:43:49 | INFO | src.nested_cv_avggrm_weighted_unified | Trial 10 | outer=1 | pruned after 5/10 inner folds (mean r=0.1744)
[I 2026-05-31 22:43:49,855] Trial 10 pruned. 
2026-05-31 22:43:49 | INFO | src.nested_cv_avggrm_weighted_unified | Trial 11 | outer=1 | alpha=9.820e+06 n_pcs=3500 (pc_topk) weight_search=on
2026-05-31 22:43:49 | INFO | src.nested_cv_avggrm_weighted_unified | Trial 11 | outer=1 | weight={'name': 'exponential', 'floor': 1e-06, 'clip_max': 5.0, 'beta': 8.928948956746435}
[I 2026-05-31 22:43:55,195] Trial 11 finished with value: 0.2356455789424879 and parameters: {'alpha': 9819751.211795544, 'n_pcs': 3500, 'weight_scheme': 'exponential', 'weight_clip_max': 5.0, 'weight_exponential_beta': 8.928948956746435}. Best is trial 8 with value: 0.2512248926241386.
2026-05-31 22:43:55 | INFO | src.nested_cv_avggrm_weighted_unified | Trial 12 | outer=1 | alpha=8.246e+05 n_pcs=1500 (pc_topk) weight_search=on
2026-05-31 22:43:55 | INFO | src.nested_cv_avggrm_weighted_unified | Trial 12 | outer=1 | weight={'name': 'exponential', 'floor': 1e-06, 'clip_max': 3.0, 'beta': 5.982934772883383}
[I 2026-05-31 22:43:56,906] Trial 12 finished with value: 0.24415962314051565 and parameters: {'alpha': 824606.3021630079, 'n_pcs': 1500, 'weight_scheme': 'exponential', 'weight_clip_max': 3.0, 'weight_exponential_beta': 5.982934772883383}. Best is trial 8 with value: 0.2512248926241386.
2026-05-31 22:43:56 | INFO | src.nested_cv_avggrm_weighted_unified | Trial 13 | outer=1 | alpha=5.945e+05 n_pcs=3000 (pc_topk) weight_search=on
2026-05-31 22:43:56 | INFO | src.nested_cv_avggrm_weighted_unified | Trial 13 | outer=1 | weight={'name': 'linear', 'floor': 1e-06, 'clip_max': 5.0, 'min_weight': 0.44725940969778444, 'max_weight': 1.689579879242048}
[I 2026-05-31 22:44:00,807] Trial 13 finished with value: 0.23578971763029064 and parameters: {'alpha': 594462.3939741419, 'n_pcs': 3000, 'weight_scheme': 'linear', 'weight_clip_max': 5.0, 'weight_linear_min_weight': 0.44725940969778444, 'weight_linear_max_weight': 1.689579879242048}. Best is trial 8 with value: 0.2512248926241386.
2026-05-31 22:44:00 | INFO | src.nested_cv_avggrm_weighted_unified | Trial 14 | outer=1 | alpha=6.828e+06 n_pcs=3000 (pc_topk) weight_search=on
2026-05-31 22:44:00 | INFO | src.nested_cv_avggrm_weighted_unified | Trial 14 | outer=1 | weight={'name': 'uniform', 'floor': 1e-06, 'clip_max': 5.0}
2026-05-31 22:44:02 | INFO | src.nested_cv_avggrm_weighted_unified | Trial 14 | outer=1 | pruned after 5/10 inner folds (mean r=0.1801)
[I 2026-05-31 22:44:02,365] Trial 14 pruned. 
2026-05-31 22:44:02 | INFO | src.nested_cv_avggrm_weighted_unified | Trial 15 | outer=1 | alpha=2.575e+06 n_pcs=1500 (pc_topk) weight_search=on
2026-05-31 22:44:02 | INFO | src.nested_cv_avggrm_weighted_unified | Trial 15 | outer=1 | weight={'name': 'linear', 'floor': 1e-06, 'clip_max': 3.0, 'min_weight': 0.9689803782581343, 'max_weight': 4.9100809859168315}
2026-05-31 22:44:03 | INFO | src.nested_cv_avggrm_weighted_unified | Trial 15 | outer=1 | pruned after 6/10 inner folds (mean r=0.2388)
[I 2026-05-31 22:44:03,412] Trial 15 pruned. 
2026-05-31 22:44:03 | INFO | src.nested_cv_avggrm_weighted_unified | Trial 16 | outer=1 | alpha=1.971e+05 n_pcs=4000 (pc_topk) weight_search=on
2026-05-31 22:44:03 | INFO | src.nested_cv_avggrm_weighted_unified | Trial 16 | outer=1 | weight={'name': 'exponential', 'floor': 1e-06, 'clip_max': 5.0, 'beta': 6.257422035595178}
[I 2026-05-31 22:44:09,155] Trial 16 finished with value: 0.25884761115120014 and parameters: {'alpha': 197062.07683822478, 'n_pcs': 4000, 'weight_scheme': 'exponential', 'weight_clip_max': 5.0, 'weight_exponential_beta': 6.257422035595178}. Best is trial 16 with value: 0.25884761115120014.
2026-05-31 22:44:09 | INFO | src.nested_cv_avggrm_weighted_unified | OUTER 1 | new best trial 16 (mean inner r=0.2588) saved to outputs/final_results/e6_pc_ridge_avggrm/thr_wing/e6_pc_ridge_avggrm_thr_wing_best_trials/split_01_best_trial.json
2026-05-31 22:44:09 | INFO | src.nested_cv_avggrm_weighted_unified | Trial 17 | outer=1 | alpha=1.429e+05 n_pcs=5000 (pc_topk) weight_search=on
2026-05-31 22:44:09 | INFO | src.nested_cv_avggrm_weighted_unified | Trial 17 | outer=1 | weight={'name': 'exponential', 'floor': 1e-06, 'clip_max': 5.0, 'beta': 4.7609444110373085}
[I 2026-05-31 22:44:17,370] Trial 17 finished with value: 0.2565140929360913 and parameters: {'alpha': 142925.80558027924, 'n_pcs': 5000, 'weight_scheme': 'exponential', 'weight_clip_max': 5.0, 'weight_exponential_beta': 4.7609444110373085}. Best is trial 16 with value: 0.25884761115120014.
2026-05-31 22:44:17 | INFO | src.nested_cv_avggrm_weighted_unified | Trial 18 | outer=1 | alpha=1.758e+05 n_pcs=5000 (pc_topk) weight_search=on
2026-05-31 22:44:17 | INFO | src.nested_cv_avggrm_weighted_unified | Trial 18 | outer=1 | weight={'name': 'exponential', 'floor': 1e-06, 'clip_max': 5.0, 'beta': 4.760399744704552}
[I 2026-05-31 22:44:25,544] Trial 18 finished with value: 0.2558170062062408 and parameters: {'alpha': 175775.55039751038, 'n_pcs': 5000, 'weight_scheme': 'exponential', 'weight_clip_max': 5.0, 'weight_exponential_beta': 4.760399744704552}. Best is trial 16 with value: 0.25884761115120014.
2026-05-31 22:44:25 | INFO | src.nested_cv_avggrm_weighted_unified | Trial 19 | outer=1 | alpha=2.750e+05 n_pcs=4500 (pc_topk) weight_search=on
2026-05-31 22:44:25 | INFO | src.nested_cv_avggrm_weighted_unified | Trial 19 | outer=1 | weight={'name': 'exponential', 'floor': 1e-06, 'clip_max': 5.0, 'beta': 5.124407753064943}
[I 2026-05-31 22:44:32,513] Trial 19 finished with value: 0.2551876028704425 and parameters: {'alpha': 274975.166841956, 'n_pcs': 4500, 'weight_scheme': 'exponential', 'weight_clip_max': 5.0, 'weight_exponential_beta': 5.124407753064943}. Best is trial 16 with value: 0.25884761115120014.
2026-05-31 22:44:32 | INFO | src.nested_cv_avggrm_weighted_unified | Trial 20 | outer=1 | alpha=2.295e+04 n_pcs=4500 (pc_topk) weight_search=on
2026-05-31 22:44:32 | INFO | src.nested_cv_avggrm_weighted_unified | Trial 20 | outer=1 | weight={'name': 'exponential', 'floor': 1e-06, 'clip_max': 5.0, 'beta': 3.09908658160143}
[I 2026-05-31 22:44:39,503] Trial 20 finished with value: 0.24913015339799133 and parameters: {'alpha': 22946.59245361273, 'n_pcs': 4500, 'weight_scheme': 'exponential', 'weight_clip_max': 5.0, 'weight_exponential_beta': 3.09908658160143}. Best is trial 16 with value: 0.25884761115120014.
2026-05-31 22:44:39 | INFO | src.nested_cv_avggrm_weighted_unified | Trial 21 | outer=1 | alpha=2.033e+05 n_pcs=5000 (pc_topk) weight_search=on
2026-05-31 22:44:39 | INFO | src.nested_cv_avggrm_weighted_unified | Trial 21 | outer=1 | weight={'name': 'exponential', 'floor': 1e-06, 'clip_max': 5.0, 'beta': 6.732510198004261}
[I 2026-05-31 22:44:47,632] Trial 21 finished with value: 0.25691661109021335 and parameters: {'alpha': 203265.0481997102, 'n_pcs': 5000, 'weight_scheme': 'exponential', 'weight_clip_max': 5.0, 'weight_exponential_beta': 6.732510198004261}. Best is trial 16 with value: 0.25884761115120014.
2026-05-31 22:44:47 | INFO | src.nested_cv_avggrm_weighted_unified | Trial 22 | outer=1 | alpha=2.480e+05 n_pcs=4500 (pc_topk) weight_search=on
2026-05-31 22:44:47 | INFO | src.nested_cv_avggrm_weighted_unified | Trial 22 | outer=1 | weight={'name': 'exponential', 'floor': 1e-06, 'clip_max': 5.0, 'beta': 6.811827100022695}
[I 2026-05-31 22:44:54,569] Trial 22 finished with value: 0.25720413796304187 and parameters: {'alpha': 248015.02994416017, 'n_pcs': 4500, 'weight_scheme': 'exponential', 'weight_clip_max': 5.0, 'weight_exponential_beta': 6.811827100022695}. Best is trial 16 with value: 0.25884761115120014.
2026-05-31 22:44:54 | INFO | src.nested_cv_avggrm_weighted_unified | Trial 23 | outer=1 | alpha=3.196e+05 n_pcs=4000 (pc_topk) weight_search=on
2026-05-31 22:44:54 | INFO | src.nested_cv_avggrm_weighted_unified | Trial 23 | outer=1 | weight={'name': 'exponential', 'floor': 1e-06, 'clip_max': 5.0, 'beta': 7.0238084535929985}
[I 2026-05-31 22:45:00,295] Trial 23 finished with value: 0.2571610592260865 and parameters: {'alpha': 319626.5050405024, 'n_pcs': 4000, 'weight_scheme': 'exponential', 'weight_clip_max': 5.0, 'weight_exponential_beta': 7.0238084535929985}. Best is trial 16 with value: 0.25884761115120014.
2026-05-31 22:45:00 | INFO | src.nested_cv_avggrm_weighted_unified | Trial 24 | outer=1 | alpha=3.839e+05 n_pcs=4000 (pc_topk) weight_search=on
2026-05-31 22:45:00 | INFO | src.nested_cv_avggrm_weighted_unified | Trial 24 | outer=1 | weight={'name': 'exponential', 'floor': 1e-06, 'clip_max': None, 'beta': 7.258288914513776}
[I 2026-05-31 22:45:06,032] Trial 24 finished with value: 0.23117081748009477 and parameters: {'alpha': 383885.6452604392, 'n_pcs': 4000, 'weight_scheme': 'exponential', 'weight_clip_max': None, 'weight_exponential_beta': 7.258288914513776}. Best is trial 16 with value: 0.25884761115120014.
2026-05-31 22:45:06 | INFO | src.nested_cv_avggrm_weighted_unified | Trial 25 | outer=1 | alpha=1.460e+06 n_pcs=3500 (pc_topk) weight_search=on
2026-05-31 22:45:06 | INFO | src.nested_cv_avggrm_weighted_unified | Trial 25 | outer=1 | weight={'name': 'exponential', 'floor': 1e-06, 'clip_max': 20.0, 'beta': 7.564072671462328}
[I 2026-05-31 22:45:10,896] Trial 25 finished with value: 0.23151617426111573 and parameters: {'alpha': 1459505.713325629, 'n_pcs': 3500, 'weight_scheme': 'exponential', 'weight_clip_max': 20.0, 'weight_exponential_beta': 7.564072671462328}. Best is trial 16 with value: 0.25884761115120014.
2026-05-31 22:45:10 | INFO | src.nested_cv_avggrm_weighted_unified | Trial 26 | outer=1 | alpha=3.398e+05 n_pcs=4500 (pc_topk) weight_search=on
2026-05-31 22:45:10 | INFO | src.nested_cv_avggrm_weighted_unified | Trial 26 | outer=1 | weight={'name': 'uniform', 'floor': 1e-06, 'clip_max': 5.0}
2026-05-31 22:45:14 | INFO | src.nested_cv_avggrm_weighted_unified | Trial 26 | outer=1 | pruned after 6/10 inner folds (mean r=0.2341)
[I 2026-05-31 22:45:14,518] Trial 26 pruned. 
2026-05-31 22:45:14 | INFO | src.nested_cv_avggrm_weighted_unified | Trial 27 | outer=1 | alpha=3.067e+06 n_pcs=3500 (pc_topk) weight_search=on
2026-05-31 22:45:14 | INFO | src.nested_cv_avggrm_weighted_unified | Trial 27 | outer=1 | weight={'name': 'exponential', 'floor': 1e-06, 'clip_max': 10.0, 'beta': 5.936534170094182}
[I 2026-05-31 22:45:19,393] Trial 27 finished with value: 0.2361067300633764 and parameters: {'alpha': 3066873.2236079415, 'n_pcs': 3500, 'weight_scheme': 'exponential', 'weight_clip_max': 10.0, 'weight_exponential_beta': 5.936534170094182}. Best is trial 16 with value: 0.25884761115120014.
2026-05-31 22:45:19 | INFO | src.nested_cv_avggrm_weighted_unified | Trial 28 | outer=1 | alpha=7.970e+04 n_pcs=4000 (pc_topk) weight_search=on
2026-05-31 22:45:19 | INFO | src.nested_cv_avggrm_weighted_unified | Trial 28 | outer=1 | weight={'name': 'exponential', 'floor': 1e-06, 'clip_max': 5.0, 'beta': 8.453444164179853}
[I 2026-05-31 22:45:25,130] Trial 28 finished with value: 0.25809411837497065 and parameters: {'alpha': 79704.55881499201, 'n_pcs': 4000, 'weight_scheme': 'exponential', 'weight_clip_max': 5.0, 'weight_exponential_beta': 8.453444164179853}. Best is trial 16 with value: 0.25884761115120014.
2026-05-31 22:45:25 | INFO | src.nested_cv_avggrm_weighted_unified | Trial 29 | outer=1 | alpha=1.033e+05 n_pcs=4500 (pc_topk) weight_search=on
2026-05-31 22:45:25 | INFO | src.nested_cv_avggrm_weighted_unified | Trial 29 | outer=1 | weight={'name': 'uniform', 'floor': 1e-06, 'clip_max': None}
2026-05-31 22:45:29 | INFO | src.nested_cv_avggrm_weighted_unified | Trial 29 | outer=1 | pruned after 7/10 inner folds (mean r=0.2701)
[I 2026-05-31 22:45:29,368] Trial 29 pruned. 
2026-05-31 22:45:29 | INFO | src.nested_cv_avggrm_weighted_unified | Trial 30 | outer=1 | alpha=3.014e+04 n_pcs=3500 (pc_topk) weight_search=on
2026-05-31 22:45:29 | INFO | src.nested_cv_avggrm_weighted_unified | Trial 30 | outer=1 | weight={'name': 'exponential', 'floor': 1e-06, 'clip_max': 5.0, 'beta': 8.343630351919664}
[I 2026-05-31 22:45:34,283] Trial 30 finished with value: 0.24188760780197288 and parameters: {'alpha': 30144.768972944872, 'n_pcs': 3500, 'weight_scheme': 'exponential', 'weight_clip_max': 5.0, 'weight_exponential_beta': 8.343630351919664}. Best is trial 16 with value: 0.25884761115120014.
2026-05-31 22:45:34 | INFO | src.nested_cv_avggrm_weighted_unified | Trial 31 | outer=1 | alpha=9.293e+04 n_pcs=4000 (pc_topk) weight_search=on
2026-05-31 22:45:34 | INFO | src.nested_cv_avggrm_weighted_unified | Trial 31 | outer=1 | weight={'name': 'exponential', 'floor': 1e-06, 'clip_max': 5.0, 'beta': 7.049245062440757}
