[I 2026-06-01 20:22:44,798] Trial 178 finished with value: 0.2348449553521131 and parameters: {'alpha': 40729.697202138006, 'n_pcs': 4000, 'iw_method': 'pc_logistic', 'iw_clip_max': 1.5, 'iw_prob_clip': 0.023311072815068667, 'iw_n_components': 80, 'iw_logistic_c': 0.0022182602297254918, 'iw_pca_fit': 'combined', 'iw_solver': 'lbfgs', 'iw_rho': 0.7}. Best is trial 163 with value: 0.23699875400639323.
2026-06-01 20:22:44 | INFO | Trial 179 | outer=6 | alpha=3.099e+04 n_pcs=4000 (pc_topk) weight={'name': 'pc_logistic', 'floor': 1e-06, 'clip_max': 1.5, 'prob_clip': 0.001163334491760031, 'n_components': 80, 'logistic_c': 0.005371405201669545, 'pca_fit': 'combined', 'solver': 'lbfgs', 'max_iter': 2000, 'fit_intercept': True, 'standardize_with_source': True, 'rho': 0.7}
[I 2026-06-01 20:23:06,366] Trial 179 finished with value: 0.22619473704851983 and parameters: {'alpha': 30986.322783598935, 'n_pcs': 4000, 'iw_method': 'pc_logistic', 'iw_clip_max': 1.5, 'iw_prob_clip': 0.001163334491760031, 'iw_n_components': 80, 'iw_logistic_c': 0.005371405201669545, 'iw_pca_fit': 'combined', 'iw_solver': 'lbfgs', 'iw_rho': 0.7}. Best is trial 163 with value: 0.23699875400639323.
2026-06-01 20:23:06 | INFO | Trial 180 | outer=6 | alpha=3.498e+04 n_pcs=4000 (pc_topk) weight={'name': 'pc_logistic', 'floor': 1e-06, 'clip_max': 1.5, 'prob_clip': 0.02853982256761863, 'n_components': 80, 'logistic_c': 0.01923725263643174, 'pca_fit': 'combined', 'solver': 'lbfgs', 'max_iter': 2000, 'fit_intercept': True, 'standardize_with_source': True, 'rho': 0.7}
[I 2026-06-01 20:23:30,034] Trial 180 finished with value: 0.23472429086386506 and parameters: {'alpha': 34979.829239102786, 'n_pcs': 4000, 'iw_method': 'pc_logistic', 'iw_clip_max': 1.5, 'iw_prob_clip': 0.02853982256761863, 'iw_n_components': 80, 'iw_logistic_c': 0.01923725263643174, 'iw_pca_fit': 'combined', 'iw_solver': 'lbfgs', 'iw_rho': 0.7}. Best is trial 163 with value: 0.23699875400639323.
2026-06-01 20:23:30 | INFO | Trial 181 | outer=6 | alpha=4.440e+04 n_pcs=4000 (pc_topk) weight={'name': 'pc_logistic', 'floor': 1e-06, 'clip_max': 1.5, 'prob_clip': 0.023622049117070235, 'n_components': 10, 'logistic_c': 0.012242678861339954, 'pca_fit': 'combined', 'solver': 'lbfgs', 'max_iter': 2000, 'fit_intercept': True, 'standardize_with_source': True, 'rho': 0.7}
[I 2026-06-01 20:23:45,752] Trial 181 finished with value: 0.2337232713780367 and parameters: {'alpha': 44396.89584659145, 'n_pcs': 4000, 'iw_method': 'pc_logistic', 'iw_clip_max': 1.5, 'iw_prob_clip': 0.023622049117070235, 'iw_n_components': 10, 'iw_logistic_c': 0.012242678861339954, 'iw_pca_fit': 'combined', 'iw_solver': 'lbfgs', 'iw_rho': 0.7}. Best is trial 163 with value: 0.23699875400639323.
2026-06-01 20:23:45 | INFO | Trial 182 | outer=6 | alpha=4.799e+04 n_pcs=4000 (pc_topk) weight={'name': 'pc_logistic', 'floor': 1e-06, 'clip_max': 1.5, 'prob_clip': 0.01494495667831929, 'n_components': 80, 'logistic_c': 0.04348080942013877, 'pca_fit': 'combined', 'solver': 'lbfgs', 'max_iter': 2000, 'fit_intercept': True, 'standardize_with_source': True, 'rho': 0.7}
[I 2026-06-01 20:24:08,984] Trial 182 finished with value: 0.2359081516573865 and parameters: {'alpha': 47986.87631716081, 'n_pcs': 4000, 'iw_method': 'pc_logistic', 'iw_clip_max': 1.5, 'iw_prob_clip': 0.01494495667831929, 'iw_n_components': 80, 'iw_logistic_c': 0.04348080942013877, 'iw_pca_fit': 'combined', 'iw_solver': 'lbfgs', 'iw_rho': 0.7}. Best is trial 163 with value: 0.23699875400639323.
2026-06-01 20:24:09 | INFO | Trial 183 | outer=6 | alpha=4.678e+04 n_pcs=4000 (pc_topk) weight={'name': 'pc_logistic', 'floor': 1e-06, 'clip_max': 1.5, 'prob_clip': 0.013587859858005886, 'n_components': 80, 'logistic_c': 0.042864356637416626, 'pca_fit': 'combined', 'solver': 'lbfgs', 'max_iter': 2000, 'fit_intercept': True, 'standardize_with_source': True, 'rho': 0.7}
[I 2026-06-01 20:24:32,133] Trial 183 finished with value: 0.23573984316082255 and parameters: {'alpha': 46777.12475805196, 'n_pcs': 4000, 'iw_method': 'pc_logistic', 'iw_clip_max': 1.5, 'iw_prob_clip': 0.013587859858005886, 'iw_n_components': 80, 'iw_logistic_c': 0.042864356637416626, 'iw_pca_fit': 'combined', 'iw_solver': 'lbfgs', 'iw_rho': 0.7}. Best is trial 163 with value: 0.23699875400639323.
2026-06-01 20:24:32 | INFO | Trial 184 | outer=6 | alpha=4.580e+04 n_pcs=4000 (pc_topk) weight={'name': 'pc_logistic', 'floor': 1e-06, 'clip_max': 1.5, 'prob_clip': 0.013805393410760954, 'n_components': 80, 'logistic_c': 0.04947383283470135, 'pca_fit': 'combined', 'solver': 'lbfgs', 'max_iter': 2000, 'fit_intercept': True, 'standardize_with_source': True, 'rho': 0.7}
[I 2026-06-01 20:24:56,782] Trial 184 finished with value: 0.2357398289370553 and parameters: {'alpha': 45800.06173078701, 'n_pcs': 4000, 'iw_method': 'pc_logistic', 'iw_clip_max': 1.5, 'iw_prob_clip': 0.013805393410760954, 'iw_n_components': 80, 'iw_logistic_c': 0.04947383283470135, 'iw_pca_fit': 'combined', 'iw_solver': 'lbfgs', 'iw_rho': 0.7}. Best is trial 163 with value: 0.23699875400639323.
2026-06-01 20:24:56 | INFO | Trial 185 | outer=6 | alpha=2.231e+04 n_pcs=4000 (pc_topk) weight={'name': 'pc_logistic', 'floor': 1e-06, 'clip_max': 1.5, 'prob_clip': 0.010977579165103165, 'n_components': 80, 'logistic_c': 0.04245315553909945, 'pca_fit': 'combined', 'solver': 'lbfgs', 'max_iter': 2000, 'fit_intercept': True, 'standardize_with_source': True, 'rho': 0.7}
[I 2026-06-01 20:25:21,568] Trial 185 finished with value: 0.22918748714062195 and parameters: {'alpha': 22308.572853721857, 'n_pcs': 4000, 'iw_method': 'pc_logistic', 'iw_clip_max': 1.5, 'iw_prob_clip': 0.010977579165103165, 'iw_n_components': 80, 'iw_logistic_c': 0.04245315553909945, 'iw_pca_fit': 'combined', 'iw_solver': 'lbfgs', 'iw_rho': 0.7}. Best is trial 163 with value: 0.23699875400639323.
2026-06-01 20:25:21 | INFO | Trial 186 | outer=6 | alpha=4.625e+04 n_pcs=4000 (pc_topk) weight={'name': 'pc_logistic', 'floor': 1e-06, 'clip_max': 1.5, 'prob_clip': 0.011608436001389522, 'n_components': 80, 'logistic_c': 0.16362914098499284, 'pca_fit': 'combined', 'solver': 'lbfgs', 'max_iter': 2000, 'fit_intercept': True, 'standardize_with_source': True, 'rho': 0.7}
[I 2026-06-01 20:25:48,073] Trial 186 finished with value: 0.23589337514733266 and parameters: {'alpha': 46247.683280182646, 'n_pcs': 4000, 'iw_method': 'pc_logistic', 'iw_clip_max': 1.5, 'iw_prob_clip': 0.011608436001389522, 'iw_n_components': 80, 'iw_logistic_c': 0.16362914098499284, 'iw_pca_fit': 'combined', 'iw_solver': 'lbfgs', 'iw_rho': 0.7}. Best is trial 163 with value: 0.23699875400639323.
2026-06-01 20:25:48 | INFO | Trial 187 | outer=6 | alpha=4.761e+04 n_pcs=4000 (pc_topk) weight={'name': 'pc_logistic', 'floor': 1e-06, 'clip_max': 1.5, 'prob_clip': 0.010937986674703868, 'n_components': 80, 'logistic_c': 0.030311075595649727, 'pca_fit': 'combined', 'solver': 'lbfgs', 'max_iter': 2000, 'fit_intercept': True, 'standardize_with_source': True, 'rho': 0.7}
[I 2026-06-01 20:26:13,732] Trial 187 finished with value: 0.2352094169976961 and parameters: {'alpha': 47614.07648880615, 'n_pcs': 4000, 'iw_method': 'pc_logistic', 'iw_clip_max': 1.5, 'iw_prob_clip': 0.010937986674703868, 'iw_n_components': 80, 'iw_logistic_c': 0.030311075595649727, 'iw_pca_fit': 'combined', 'iw_solver': 'lbfgs', 'iw_rho': 0.7}. Best is trial 163 with value: 0.23699875400639323.
2026-06-01 20:26:13 | INFO | Trial 188 | outer=6 | alpha=2.569e+04 n_pcs=4000 (pc_topk) weight={'name': 'pc_logistic', 'floor': 1e-06, 'clip_max': 1.5, 'prob_clip': 0.027913760598620236, 'n_components': 80, 'logistic_c': 0.16567952297401298, 'pca_fit': 'combined', 'solver': 'lbfgs', 'max_iter': 2000, 'fit_intercept': True, 'standardize_with_source': True, 'rho': 0.7}
[I 2026-06-01 20:26:39,537] Trial 188 finished with value: 0.23176180515380213 and parameters: {'alpha': 25687.207295588705, 'n_pcs': 4000, 'iw_method': 'pc_logistic', 'iw_clip_max': 1.5, 'iw_prob_clip': 0.027913760598620236, 'iw_n_components': 80, 'iw_logistic_c': 0.16567952297401298, 'iw_pca_fit': 'combined', 'iw_solver': 'lbfgs', 'iw_rho': 0.7}. Best is trial 163 with value: 0.23699875400639323.
2026-06-01 20:26:39 | INFO | Trial 189 | outer=6 | alpha=3.438e+04 n_pcs=4000 (pc_topk) weight={'name': 'pc_logistic', 'floor': 1e-06, 'clip_max': 4.0, 'prob_clip': 0.014885214491164785, 'n_components': 80, 'logistic_c': 0.04626845249210778, 'pca_fit': 'combined', 'solver': 'lbfgs', 'max_iter': 2000, 'fit_intercept': True, 'standardize_with_source': True, 'rho': 0.7}
[I 2026-06-01 20:27:01,780] Trial 189 finished with value: 0.23061304552230158 and parameters: {'alpha': 34378.49556544735, 'n_pcs': 4000, 'iw_method': 'pc_logistic', 'iw_clip_max': 4.0, 'iw_prob_clip': 0.014885214491164785, 'iw_n_components': 80, 'iw_logistic_c': 0.04626845249210778, 'iw_pca_fit': 'combined', 'iw_solver': 'lbfgs', 'iw_rho': 0.7}. Best is trial 163 with value: 0.23699875400639323.
2026-06-01 20:27:01 | INFO | Trial 190 | outer=6 | alpha=4.206e+04 n_pcs=4000 (pc_topk) weight={'name': 'pc_logistic', 'floor': 1e-06, 'clip_max': 1.5, 'prob_clip': 0.01346242038211201, 'n_components': 80, 'logistic_c': 0.02319670514570448, 'pca_fit': 'combined', 'solver': 'lbfgs', 'max_iter': 2000, 'fit_intercept': True, 'standardize_with_source': True, 'rho': 0.7}
[I 2026-06-01 20:27:22,069] Trial 190 finished with value: 0.23514435997463914 and parameters: {'alpha': 42055.52905264174, 'n_pcs': 4000, 'iw_method': 'pc_logistic', 'iw_clip_max': 1.5, 'iw_prob_clip': 0.01346242038211201, 'iw_n_components': 80, 'iw_logistic_c': 0.02319670514570448, 'iw_pca_fit': 'combined', 'iw_solver': 'lbfgs', 'iw_rho': 0.7}. Best is trial 163 with value: 0.23699875400639323.
2026-06-01 20:27:22 | INFO | Trial 191 | outer=6 | alpha=4.763e+04 n_pcs=4000 (pc_topk) weight={'name': 'pc_logistic', 'floor': 1e-06, 'clip_max': 1.5, 'prob_clip': 0.012074885876295084, 'n_components': 80, 'logistic_c': 0.12918648630867444, 'pca_fit': 'combined', 'solver': 'lbfgs', 'max_iter': 2000, 'fit_intercept': True, 'standardize_with_source': True, 'rho': 0.85}
[I 2026-06-01 20:27:46,965] Trial 191 finished with value: 0.23619030049399764 and parameters: {'alpha': 47625.7165354293, 'n_pcs': 4000, 'iw_method': 'pc_logistic', 'iw_clip_max': 1.5, 'iw_prob_clip': 0.012074885876295084, 'iw_n_components': 80, 'iw_logistic_c': 0.12918648630867444, 'iw_pca_fit': 'combined', 'iw_solver': 'lbfgs', 'iw_rho': 0.85}. Best is trial 163 with value: 0.23699875400639323.
2026-06-01 20:27:46 | INFO | Trial 192 | outer=6 | alpha=5.053e+04 n_pcs=4000 (pc_topk) weight={'name': 'pc_logistic', 'floor': 1e-06, 'clip_max': 1.5, 'prob_clip': 0.012569111510039175, 'n_components': 80, 'logistic_c': 0.12898320821782233, 'pca_fit': 'combined', 'solver': 'lbfgs', 'max_iter': 2000, 'fit_intercept': True, 'standardize_with_source': True, 'rho': 0.85}
[I 2026-06-01 20:28:13,051] Trial 192 finished with value: 0.23645370885852635 and parameters: {'alpha': 50525.45936129529, 'n_pcs': 4000, 'iw_method': 'pc_logistic', 'iw_clip_max': 1.5, 'iw_prob_clip': 0.012569111510039175, 'iw_n_components': 80, 'iw_logistic_c': 0.12898320821782233, 'iw_pca_fit': 'combined', 'iw_solver': 'lbfgs', 'iw_rho': 0.85}. Best is trial 163 with value: 0.23699875400639323.
2026-06-01 20:28:13 | INFO | Trial 193 | outer=6 | alpha=4.871e+04 n_pcs=4000 (pc_topk) weight={'name': 'pc_logistic', 'floor': 1e-06, 'clip_max': 1.5, 'prob_clip': 0.011969816821127273, 'n_components': 80, 'logistic_c': 0.16165887359587877, 'pca_fit': 'combined', 'solver': 'lbfgs', 'max_iter': 2000, 'fit_intercept': True, 'standardize_with_source': True, 'rho': 0.85}
[I 2026-06-01 20:28:38,896] Trial 193 finished with value: 0.23621940748143225 and parameters: {'alpha': 48714.61820537235, 'n_pcs': 4000, 'iw_method': 'pc_logistic', 'iw_clip_max': 1.5, 'iw_prob_clip': 0.011969816821127273, 'iw_n_components': 80, 'iw_logistic_c': 0.16165887359587877, 'iw_pca_fit': 'combined', 'iw_solver': 'lbfgs', 'iw_rho': 0.85}. Best is trial 163 with value: 0.23699875400639323.
2026-06-01 20:28:38 | INFO | Trial 194 | outer=6 | alpha=4.309e+04 n_pcs=4000 (pc_topk) weight={'name': 'pc_logistic', 'floor': 1e-06, 'clip_max': 1.5, 'prob_clip': 0.009799987077778103, 'n_components': 80, 'logistic_c': 0.13183080531565305, 'pca_fit': 'combined', 'solver': 'lbfgs', 'max_iter': 2000, 'fit_intercept': True, 'standardize_with_source': True, 'rho': 0.85}
[I 2026-06-01 20:29:03,358] Trial 194 finished with value: 0.2352733823010705 and parameters: {'alpha': 43092.912541861755, 'n_pcs': 4000, 'iw_method': 'pc_logistic', 'iw_clip_max': 1.5, 'iw_prob_clip': 0.009799987077778103, 'iw_n_components': 80, 'iw_logistic_c': 0.13183080531565305, 'iw_pca_fit': 'combined', 'iw_solver': 'lbfgs', 'iw_rho': 0.85}. Best is trial 163 with value: 0.23699875400639323.
2026-06-01 20:29:03 | INFO | Trial 195 | outer=6 | alpha=4.864e+04 n_pcs=4000 (pc_topk) weight={'name': 'pc_logistic', 'floor': 1e-06, 'clip_max': 1.5, 'prob_clip': 0.013109139157884683, 'n_components': 80, 'logistic_c': 0.22260379379333828, 'pca_fit': 'combined', 'solver': 'lbfgs', 'max_iter': 2000, 'fit_intercept': True, 'standardize_with_source': True, 'rho': 0.85}
[I 2026-06-01 20:29:28,922] Trial 195 finished with value: 0.23616378408727354 and parameters: {'alpha': 48638.87986047613, 'n_pcs': 4000, 'iw_method': 'pc_logistic', 'iw_clip_max': 1.5, 'iw_prob_clip': 0.013109139157884683, 'iw_n_components': 80, 'iw_logistic_c': 0.22260379379333828, 'iw_pca_fit': 'combined', 'iw_solver': 'lbfgs', 'iw_rho': 0.85}. Best is trial 163 with value: 0.23699875400639323.
2026-06-01 20:29:28 | INFO | Trial 196 | outer=6 | alpha=4.899e+04 n_pcs=4000 (pc_topk) weight={'name': 'pc_logistic', 'floor': 1e-06, 'clip_max': 1.5, 'prob_clip': 0.012064300555490716, 'n_components': 80, 'logistic_c': 0.219179435734848, 'pca_fit': 'combined', 'solver': 'lbfgs', 'max_iter': 2000, 'fit_intercept': True, 'standardize_with_source': True, 'rho': 0.85}
[I 2026-06-01 20:29:52,896] Trial 196 finished with value: 0.2360355535563219 and parameters: {'alpha': 48994.74521712779, 'n_pcs': 4000, 'iw_method': 'pc_logistic', 'iw_clip_max': 1.5, 'iw_prob_clip': 0.012064300555490716, 'iw_n_components': 80, 'iw_logistic_c': 0.219179435734848, 'iw_pca_fit': 'combined', 'iw_solver': 'lbfgs', 'iw_rho': 0.85}. Best is trial 163 with value: 0.23699875400639323.
2026-06-01 20:29:52 | INFO | Trial 197 | outer=6 | alpha=5.050e+04 n_pcs=4000 (pc_topk) weight={'name': 'pc_logistic', 'floor': 1e-06, 'clip_max': 1.5, 'prob_clip': 0.0128350173567739, 'n_components': 80, 'logistic_c': 0.23772819479138171, 'pca_fit': 'combined', 'solver': 'lbfgs', 'max_iter': 2000, 'fit_intercept': True, 'standardize_with_source': True, 'rho': 0.85}
[I 2026-06-01 20:30:17,461] Trial 197 finished with value: 0.23626608507923547 and parameters: {'alpha': 50495.87775886075, 'n_pcs': 4000, 'iw_method': 'pc_logistic', 'iw_clip_max': 1.5, 'iw_prob_clip': 0.0128350173567739, 'iw_n_components': 80, 'iw_logistic_c': 0.23772819479138171, 'iw_pca_fit': 'combined', 'iw_solver': 'lbfgs', 'iw_rho': 0.85}. Best is trial 163 with value: 0.23699875400639323.
2026-06-01 20:30:17 | INFO | Trial 198 | outer=6 | alpha=4.988e+04 n_pcs=4000 (pc_topk) weight={'name': 'pc_logistic', 'floor': 1e-06, 'clip_max': 1.5, 'prob_clip': 0.01230688679236801, 'n_components': 80, 'logistic_c': 0.20875229004572948, 'pca_fit': 'combined', 'solver': 'lbfgs', 'max_iter': 2000, 'fit_intercept': True, 'standardize_with_source': True, 'rho': 0.85}
[I 2026-06-01 20:30:44,085] Trial 198 finished with value: 0.23616115084407058 and parameters: {'alpha': 49879.065165620166, 'n_pcs': 4000, 'iw_method': 'pc_logistic', 'iw_clip_max': 1.5, 'iw_prob_clip': 0.01230688679236801, 'iw_n_components': 80, 'iw_logistic_c': 0.20875229004572948, 'iw_pca_fit': 'combined', 'iw_solver': 'lbfgs', 'iw_rho': 0.85}. Best is trial 163 with value: 0.23699875400639323.
2026-06-01 20:30:44 | INFO | Trial 199 | outer=6 | alpha=4.935e+04 n_pcs=4000 (pc_topk) weight={'name': 'pc_logistic', 'floor': 1e-06, 'clip_max': 1.5, 'prob_clip': 0.012120944647128897, 'n_components': 80, 'logistic_c': 0.21769536438837783, 'pca_fit': 'combined', 'solver': 'lbfgs', 'max_iter': 2000, 'fit_intercept': True, 'standardize_with_source': True, 'rho': 0.85}
[I 2026-06-01 20:31:10,596] Trial 199 finished with value: 0.23606829579406424 and parameters: {'alpha': 49354.26016932665, 'n_pcs': 4000, 'iw_method': 'pc_logistic', 'iw_clip_max': 1.5, 'iw_prob_clip': 0.012120944647128897, 'iw_n_components': 80, 'iw_logistic_c': 0.21769536438837783, 'iw_pca_fit': 'combined', 'iw_solver': 'lbfgs', 'iw_rho': 0.85}. Best is trial 163 with value: 0.23699875400639323.
2026-06-01 20:31:10 | INFO | Trial 200 | outer=6 | alpha=4.919e+04 n_pcs=4000 (pc_topk) weight={'name': 'pc_logistic', 'floor': 1e-06, 'clip_max': 1.5, 'prob_clip': 0.012047875651941164, 'n_components': 40, 'logistic_c': 0.2066980381284285, 'pca_fit': 'combined', 'solver': 'lbfgs', 'max_iter': 2000, 'fit_intercept': True, 'standardize_with_source': True, 'rho': 0.85}
[I 2026-06-01 20:31:32,111] Trial 200 finished with value: 0.23219776227672612 and parameters: {'alpha': 49188.28006352628, 'n_pcs': 4000, 'iw_method': 'pc_logistic', 'iw_clip_max': 1.5, 'iw_prob_clip': 0.012047875651941164, 'iw_n_components': 40, 'iw_logistic_c': 0.2066980381284285, 'iw_pca_fit': 'combined', 'iw_solver': 'lbfgs', 'iw_rho': 0.85}. Best is trial 163 with value: 0.23699875400639323.
2026-06-01 20:31:32 | INFO | Trial 201 | outer=6 | alpha=4.845e+04 n_pcs=4000 (pc_topk) weight={'name': 'pc_logistic', 'floor': 1e-06, 'clip_max': 1.5, 'prob_clip': 0.013617094811317568, 'n_components': 80, 'logistic_c': 0.3002098264756195, 'pca_fit': 'combined', 'solver': 'lbfgs', 'max_iter': 2000, 'fit_intercept': True, 'standardize_with_source': True, 'rho': 0.85}
[I 2026-06-01 20:31:58,731] Trial 201 finished with value: 0.2363446600295164 and parameters: {'alpha': 48447.142931858754, 'n_pcs': 4000, 'iw_method': 'pc_logistic', 'iw_clip_max': 1.5, 'iw_prob_clip': 0.013617094811317568, 'iw_n_components': 80, 'iw_logistic_c': 0.3002098264756195, 'iw_pca_fit': 'combined', 'iw_solver': 'lbfgs', 'iw_rho': 0.85}. Best is trial 163 with value: 0.23699875400639323.
2026-06-01 20:31:58 | INFO | Trial 202 | outer=6 | alpha=3.064e+04 n_pcs=4000 (pc_topk) weight={'name': 'pc_logistic', 'floor': 1e-06, 'clip_max': 1.5, 'prob_clip': 0.012264997340486663, 'n_components': 80, 'logistic_c': 0.2768832002500613, 'pca_fit': 'combined', 'solver': 'lbfgs', 'max_iter': 2000, 'fit_intercept': True, 'standardize_with_source': True, 'rho': 0.85}
[I 2026-06-01 20:32:23,987] Trial 202 finished with value: 0.23332669343861373 and parameters: {'alpha': 30642.49278283236, 'n_pcs': 4000, 'iw_method': 'pc_logistic', 'iw_clip_max': 1.5, 'iw_prob_clip': 0.012264997340486663, 'iw_n_components': 80, 'iw_logistic_c': 0.2768832002500613, 'iw_pca_fit': 'combined', 'iw_solver': 'lbfgs', 'iw_rho': 0.85}. Best is trial 163 with value: 0.23699875400639323.
2026-06-01 20:32:24 | INFO | Trial 203 | outer=6 | alpha=5.048e+04 n_pcs=4000 (pc_topk) weight={'name': 'pc_logistic', 'floor': 1e-06, 'clip_max': 1.5, 'prob_clip': 0.01351372143474483, 'n_components': 80, 'logistic_c': 0.10879109524630734, 'pca_fit': 'combined', 'solver': 'lbfgs', 'max_iter': 2000, 'fit_intercept': True, 'standardize_with_source': True, 'rho': 0.85}
[I 2026-06-01 20:32:48,870] Trial 203 finished with value: 0.23660752545565994 and parameters: {'alpha': 50483.48871535336, 'n_pcs': 4000, 'iw_method': 'pc_logistic', 'iw_clip_max': 1.5, 'iw_prob_clip': 0.01351372143474483, 'iw_n_components': 80, 'iw_logistic_c': 0.10879109524630734, 'iw_pca_fit': 'combined', 'iw_solver': 'lbfgs', 'iw_rho': 0.85}. Best is trial 163 with value: 0.23699875400639323.
2026-06-01 20:32:48 | INFO | Trial 204 | outer=6 | alpha=5.187e+04 n_pcs=4000 (pc_topk) weight={'name': 'pc_logistic', 'floor': 1e-06, 'clip_max': 1.5, 'prob_clip': 0.013446378473279985, 'n_components': 80, 'logistic_c': 0.21622205538472017, 'pca_fit': 'combined', 'solver': 'lbfgs', 'max_iter': 2000, 'fit_intercept': True, 'standardize_with_source': True, 'rho': 0.85}
[I 2026-06-01 20:33:14,915] Trial 204 finished with value: 0.23641451107996056 and parameters: {'alpha': 51865.616734029914, 'n_pcs': 4000, 'iw_method': 'pc_logistic', 'iw_clip_max': 1.5, 'iw_prob_clip': 0.013446378473279985, 'iw_n_components': 80, 'iw_logistic_c': 0.21622205538472017, 'iw_pca_fit': 'combined', 'iw_solver': 'lbfgs', 'iw_rho': 0.85}. Best is trial 163 with value: 0.23699875400639323.
2026-06-01 20:33:14 | INFO | Trial 205 | outer=6 | alpha=4.904e+04 n_pcs=4000 (pc_topk) weight={'name': 'pc_logistic', 'floor': 1e-06, 'clip_max': 1.5, 'prob_clip': 0.009388738266267965, 'n_components': 80, 'logistic_c': 0.1189189135412819, 'pca_fit': 'combined', 'solver': 'lbfgs', 'max_iter': 2000, 'fit_intercept': True, 'standardize_with_source': True, 'rho': 0.85}
[I 2026-06-01 20:33:40,790] Trial 205 finished with value: 0.23562063252860624 and parameters: {'alpha': 49038.31428855626, 'n_pcs': 4000, 'iw_method': 'pc_logistic', 'iw_clip_max': 1.5, 'iw_prob_clip': 0.009388738266267965, 'iw_n_components': 80, 'iw_logistic_c': 0.1189189135412819, 'iw_pca_fit': 'combined', 'iw_solver': 'lbfgs', 'iw_rho': 0.85}. Best is trial 163 with value: 0.23699875400639323.
2026-06-01 20:33:40 | INFO | Trial 206 | outer=6 | alpha=5.097e+04 n_pcs=4000 (pc_topk) weight={'name': 'pc_logistic', 'floor': 1e-06, 'clip_max': 1.5, 'prob_clip': 0.011485544411084894, 'n_components': 80, 'logistic_c': 0.17321614898367205, 'pca_fit': 'combined', 'solver': 'lbfgs', 'max_iter': 2000, 'fit_intercept': True, 'standardize_with_source': True, 'rho': 0.85}
