[I 2026-06-01 20:01:25,423] Trial 122 finished with value: 0.23315428114521514 and parameters: {'alpha': 97596.7197212432, 'n_pcs': 3500, 'iw_method': 'pc_logistic', 'iw_clip_max': 1.5, 'iw_prob_clip': 0.019807945732524722, 'iw_n_components': 60, 'iw_logistic_c': 9.385033066032713, 'iw_pca_fit': 'combined', 'iw_solver': 'lbfgs', 'iw_rho': 0.5}. Best is trial 108 with value: 0.23595167441312664.
2026-06-01 20:01:25 | INFO | Trial 123 | outer=6 | alpha=1.062e+05 n_pcs=3500 (pc_topk) weight={'name': 'pc_logistic', 'floor': 1e-06, 'clip_max': 1.5, 'prob_clip': 0.018258631447318138, 'n_components': 60, 'logistic_c': 9.091884052006188, 'pca_fit': 'combined', 'solver': 'lbfgs', 'max_iter': 2000, 'fit_intercept': True, 'standardize_with_source': True, 'rho': 0.5}
[I 2026-06-01 20:01:48,394] Trial 123 finished with value: 0.23286142905602328 and parameters: {'alpha': 106160.05047525825, 'n_pcs': 3500, 'iw_method': 'pc_logistic', 'iw_clip_max': 1.5, 'iw_prob_clip': 0.018258631447318138, 'iw_n_components': 60, 'iw_logistic_c': 9.091884052006188, 'iw_pca_fit': 'combined', 'iw_solver': 'lbfgs', 'iw_rho': 0.5}. Best is trial 108 with value: 0.23595167441312664.
2026-06-01 20:01:48 | INFO | Trial 124 | outer=6 | alpha=8.301e+04 n_pcs=3500 (pc_topk) weight={'name': 'pc_logistic', 'floor': 1e-06, 'clip_max': 1.5, 'prob_clip': 0.020473676757958855, 'n_components': 60, 'logistic_c': 9.348208230534196, 'pca_fit': 'combined', 'solver': 'lbfgs', 'max_iter': 2000, 'fit_intercept': True, 'standardize_with_source': True, 'rho': 0.5}
[I 2026-06-01 20:02:10,542] Trial 124 finished with value: 0.23343545235495716 and parameters: {'alpha': 83010.89966132161, 'n_pcs': 3500, 'iw_method': 'pc_logistic', 'iw_clip_max': 1.5, 'iw_prob_clip': 0.020473676757958855, 'iw_n_components': 60, 'iw_logistic_c': 9.348208230534196, 'iw_pca_fit': 'combined', 'iw_solver': 'lbfgs', 'iw_rho': 0.5}. Best is trial 108 with value: 0.23595167441312664.
2026-06-01 20:02:10 | INFO | Trial 125 | outer=6 | alpha=9.298e+04 n_pcs=3000 (pc_topk) weight={'name': 'pc_logistic', 'floor': 1e-06, 'clip_max': 1.5, 'prob_clip': 0.021032615297561515, 'n_components': 60, 'logistic_c': 9.379596558418427, 'pca_fit': 'combined', 'solver': 'lbfgs', 'max_iter': 2000, 'fit_intercept': True, 'standardize_with_source': True, 'rho': 0.5}
[I 2026-06-01 20:02:32,086] Trial 125 finished with value: 0.23305722877768303 and parameters: {'alpha': 92979.89043285137, 'n_pcs': 3000, 'iw_method': 'pc_logistic', 'iw_clip_max': 1.5, 'iw_prob_clip': 0.021032615297561515, 'iw_n_components': 60, 'iw_logistic_c': 9.379596558418427, 'iw_pca_fit': 'combined', 'iw_solver': 'lbfgs', 'iw_rho': 0.5}. Best is trial 108 with value: 0.23595167441312664.
2026-06-01 20:02:32 | INFO | Trial 126 | outer=6 | alpha=9.748e+04 n_pcs=3000 (pc_topk) weight={'name': 'pc_logistic', 'floor': 1e-06, 'clip_max': 1.5, 'prob_clip': 0.021862810246593832, 'n_components': 60, 'logistic_c': 9.751311804360064, 'pca_fit': 'combined', 'solver': 'lbfgs', 'max_iter': 2000, 'fit_intercept': True, 'standardize_with_source': True, 'rho': 0.5}
[I 2026-06-01 20:02:51,203] Trial 126 finished with value: 0.23311082146498494 and parameters: {'alpha': 97476.10818020243, 'n_pcs': 3000, 'iw_method': 'pc_logistic', 'iw_clip_max': 1.5, 'iw_prob_clip': 0.021862810246593832, 'iw_n_components': 60, 'iw_logistic_c': 9.751311804360064, 'iw_pca_fit': 'combined', 'iw_solver': 'lbfgs', 'iw_rho': 0.5}. Best is trial 108 with value: 0.23595167441312664.
2026-06-01 20:02:51 | INFO | Trial 127 | outer=6 | alpha=1.754e+05 n_pcs=3000 (pc_topk) weight={'name': 'pc_logistic', 'floor': 1e-06, 'clip_max': 1.5, 'prob_clip': 0.02149434755401962, 'n_components': 60, 'logistic_c': 2.7382953236682757, 'pca_fit': 'combined', 'solver': 'lbfgs', 'max_iter': 2000, 'fit_intercept': True, 'standardize_with_source': True, 'rho': 0.5}
[I 2026-06-01 20:03:12,338] Trial 127 finished with value: 0.23072472511361344 and parameters: {'alpha': 175411.37777963743, 'n_pcs': 3000, 'iw_method': 'pc_logistic', 'iw_clip_max': 1.5, 'iw_prob_clip': 0.02149434755401962, 'iw_n_components': 60, 'iw_logistic_c': 2.7382953236682757, 'iw_pca_fit': 'combined', 'iw_solver': 'lbfgs', 'iw_rho': 0.5}. Best is trial 108 with value: 0.23595167441312664.
2026-06-01 20:03:12 | INFO | Trial 128 | outer=6 | alpha=2.493e+05 n_pcs=3500 (pc_topk) weight={'name': 'pc_logistic', 'floor': 1e-06, 'clip_max': 1.5, 'prob_clip': 0.030542120149679785, 'n_components': 60, 'logistic_c': 9.918249237909134, 'pca_fit': 'combined', 'solver': 'lbfgs', 'max_iter': 2000, 'fit_intercept': True, 'standardize_with_source': True, 'rho': 0.5}
[I 2026-06-01 20:03:34,115] Trial 128 finished with value: 0.22814023434068983 and parameters: {'alpha': 249265.58111361493, 'n_pcs': 3500, 'iw_method': 'pc_logistic', 'iw_clip_max': 1.5, 'iw_prob_clip': 0.030542120149679785, 'iw_n_components': 60, 'iw_logistic_c': 9.918249237909134, 'iw_pca_fit': 'combined', 'iw_solver': 'lbfgs', 'iw_rho': 0.5}. Best is trial 108 with value: 0.23595167441312664.
2026-06-01 20:03:34 | INFO | Trial 129 | outer=6 | alpha=4.100e+05 n_pcs=3500 (pc_topk) weight={'name': 'pc_logistic', 'floor': 1e-06, 'clip_max': 1.5, 'prob_clip': 0.02271298876107899, 'n_components': 60, 'logistic_c': 2.9778935346973956, 'pca_fit': 'combined', 'solver': 'lbfgs', 'max_iter': 2000, 'fit_intercept': True, 'standardize_with_source': True, 'rho': 0.5}
[I 2026-06-01 20:03:55,373] Trial 129 finished with value: 0.22434068001101695 and parameters: {'alpha': 409966.6842990319, 'n_pcs': 3500, 'iw_method': 'pc_logistic', 'iw_clip_max': 1.5, 'iw_prob_clip': 0.02271298876107899, 'iw_n_components': 60, 'iw_logistic_c': 2.9778935346973956, 'iw_pca_fit': 'combined', 'iw_solver': 'lbfgs', 'iw_rho': 0.5}. Best is trial 108 with value: 0.23595167441312664.
2026-06-01 20:03:55 | INFO | Trial 130 | outer=6 | alpha=1.299e+05 n_pcs=3000 (pc_topk) weight={'name': 'pc_logistic', 'floor': 1e-06, 'clip_max': 1.5, 'prob_clip': 0.019672983061933616, 'n_components': 60, 'logistic_c': 9.860226903645655, 'pca_fit': 'combined', 'solver': 'lbfgs', 'max_iter': 2000, 'fit_intercept': True, 'standardize_with_source': True, 'rho': 0.5}
[I 2026-06-01 20:04:16,312] Trial 130 finished with value: 0.23212231058852403 and parameters: {'alpha': 129902.14496993009, 'n_pcs': 3000, 'iw_method': 'pc_logistic', 'iw_clip_max': 1.5, 'iw_prob_clip': 0.019672983061933616, 'iw_n_components': 60, 'iw_logistic_c': 9.860226903645655, 'iw_pca_fit': 'combined', 'iw_solver': 'lbfgs', 'iw_rho': 0.5}. Best is trial 108 with value: 0.23595167441312664.
2026-06-01 20:04:16 | INFO | Trial 131 | outer=6 | alpha=9.992e+04 n_pcs=3000 (pc_topk) weight={'name': 'pc_logistic', 'floor': 1e-06, 'clip_max': 1.5, 'prob_clip': 0.020529069985519642, 'n_components': 60, 'logistic_c': 9.28901304470186, 'pca_fit': 'combined', 'solver': 'lbfgs', 'max_iter': 2000, 'fit_intercept': True, 'standardize_with_source': True, 'rho': 0.5}
[I 2026-06-01 20:04:36,912] Trial 131 finished with value: 0.2329168013707681 and parameters: {'alpha': 99921.54969389255, 'n_pcs': 3000, 'iw_method': 'pc_logistic', 'iw_clip_max': 1.5, 'iw_prob_clip': 0.020529069985519642, 'iw_n_components': 60, 'iw_logistic_c': 9.28901304470186, 'iw_pca_fit': 'combined', 'iw_solver': 'lbfgs', 'iw_rho': 0.5}. Best is trial 108 with value: 0.23595167441312664.
2026-06-01 20:04:36 | INFO | Trial 132 | outer=6 | alpha=8.944e+04 n_pcs=3000 (pc_topk) weight={'name': 'pc_logistic', 'floor': 1e-06, 'clip_max': 1.5, 'prob_clip': 0.019753799979233346, 'n_components': 60, 'logistic_c': 3.5122459483390904, 'pca_fit': 'combined', 'solver': 'lbfgs', 'max_iter': 2000, 'fit_intercept': True, 'standardize_with_source': True, 'rho': 0.5}
[I 2026-06-01 20:04:57,697] Trial 132 finished with value: 0.23296683254415135 and parameters: {'alpha': 89439.38657748018, 'n_pcs': 3000, 'iw_method': 'pc_logistic', 'iw_clip_max': 1.5, 'iw_prob_clip': 0.019753799979233346, 'iw_n_components': 60, 'iw_logistic_c': 3.5122459483390904, 'iw_pca_fit': 'combined', 'iw_solver': 'lbfgs', 'iw_rho': 0.5}. Best is trial 108 with value: 0.23595167441312664.
2026-06-01 20:04:57 | INFO | Trial 133 | outer=6 | alpha=6.472e+04 n_pcs=3500 (pc_topk) weight={'name': 'pc_logistic', 'floor': 1e-06, 'clip_max': 1.5, 'prob_clip': 0.013019941304296685, 'n_components': 60, 'logistic_c': 4.106646168818003, 'pca_fit': 'combined', 'solver': 'lbfgs', 'max_iter': 2000, 'fit_intercept': True, 'standardize_with_source': True, 'rho': 0.5}
[I 2026-06-01 20:05:19,452] Trial 133 finished with value: 0.23229637212905235 and parameters: {'alpha': 64722.4570106891, 'n_pcs': 3500, 'iw_method': 'pc_logistic', 'iw_clip_max': 1.5, 'iw_prob_clip': 0.013019941304296685, 'iw_n_components': 60, 'iw_logistic_c': 4.106646168818003, 'iw_pca_fit': 'combined', 'iw_solver': 'lbfgs', 'iw_rho': 0.5}. Best is trial 108 with value: 0.23595167441312664.
2026-06-01 20:05:19 | INFO | Trial 134 | outer=6 | alpha=1.471e+05 n_pcs=2500 (pc_topk) weight={'name': 'pc_logistic', 'floor': 1e-06, 'clip_max': 1.5, 'prob_clip': 0.01984769805478467, 'n_components': 60, 'logistic_c': 8.66156841601195, 'pca_fit': 'combined', 'solver': 'lbfgs', 'max_iter': 2000, 'fit_intercept': True, 'standardize_with_source': True, 'rho': 0.5}
[I 2026-06-01 20:05:39,369] Trial 134 finished with value: 0.2298139077378037 and parameters: {'alpha': 147140.96361674825, 'n_pcs': 2500, 'iw_method': 'pc_logistic', 'iw_clip_max': 1.5, 'iw_prob_clip': 0.01984769805478467, 'iw_n_components': 60, 'iw_logistic_c': 8.66156841601195, 'iw_pca_fit': 'combined', 'iw_solver': 'lbfgs', 'iw_rho': 0.5}. Best is trial 108 with value: 0.23595167441312664.
2026-06-01 20:05:39 | INFO | Trial 135 | outer=6 | alpha=1.094e+05 n_pcs=3000 (pc_topk) weight={'name': 'pc_logistic', 'floor': 1e-06, 'clip_max': 1.5, 'prob_clip': 0.030826161063022273, 'n_components': 60, 'logistic_c': 1.920748169332563, 'pca_fit': 'combined', 'solver': 'lbfgs', 'max_iter': 2000, 'fit_intercept': True, 'standardize_with_source': True, 'rho': 1.0}
[I 2026-06-01 20:06:00,407] Trial 135 finished with value: 0.23313037349365145 and parameters: {'alpha': 109428.57984130245, 'n_pcs': 3000, 'iw_method': 'pc_logistic', 'iw_clip_max': 1.5, 'iw_prob_clip': 0.030826161063022273, 'iw_n_components': 60, 'iw_logistic_c': 1.920748169332563, 'iw_pca_fit': 'combined', 'iw_solver': 'lbfgs', 'iw_rho': 1.0}. Best is trial 108 with value: 0.23595167441312664.
2026-06-01 20:06:00 | INFO | Trial 136 | outer=6 | alpha=1.105e+05 n_pcs=3500 (pc_topk) weight={'name': 'pc_logistic', 'floor': 1e-06, 'clip_max': 1.5, 'prob_clip': 0.0304772956384118, 'n_components': 60, 'logistic_c': 1.8602653941246723, 'pca_fit': 'combined', 'solver': 'lbfgs', 'max_iter': 2000, 'fit_intercept': True, 'standardize_with_source': True, 'rho': 1.0}
[I 2026-06-01 20:06:21,385] Trial 136 finished with value: 0.23369497722540636 and parameters: {'alpha': 110536.8996177074, 'n_pcs': 3500, 'iw_method': 'pc_logistic', 'iw_clip_max': 1.5, 'iw_prob_clip': 0.0304772956384118, 'iw_n_components': 60, 'iw_logistic_c': 1.8602653941246723, 'iw_pca_fit': 'combined', 'iw_solver': 'lbfgs', 'iw_rho': 1.0}. Best is trial 108 with value: 0.23595167441312664.
2026-06-01 20:06:21 | INFO | Trial 137 | outer=6 | alpha=1.196e+05 n_pcs=3500 (pc_topk) weight={'name': 'pc_logistic', 'floor': 1e-06, 'clip_max': 1.5, 'prob_clip': 0.03535840230616138, 'n_components': 60, 'logistic_c': 1.4601447666145393, 'pca_fit': 'combined', 'solver': 'lbfgs', 'max_iter': 2000, 'fit_intercept': True, 'standardize_with_source': True, 'rho': 1.0}
[I 2026-06-01 20:06:43,663] Trial 137 finished with value: 0.23360861931009888 and parameters: {'alpha': 119576.64321254342, 'n_pcs': 3500, 'iw_method': 'pc_logistic', 'iw_clip_max': 1.5, 'iw_prob_clip': 0.03535840230616138, 'iw_n_components': 60, 'iw_logistic_c': 1.4601447666145393, 'iw_pca_fit': 'combined', 'iw_solver': 'lbfgs', 'iw_rho': 1.0}. Best is trial 108 with value: 0.23595167441312664.
2026-06-01 20:06:43 | INFO | Trial 138 | outer=6 | alpha=6.726e+04 n_pcs=3500 (pc_topk) weight={'name': 'pc_logistic', 'floor': 1e-06, 'clip_max': 1.5, 'prob_clip': 0.035636679763674156, 'n_components': 60, 'logistic_c': 0.8948121261330573, 'pca_fit': 'combined', 'solver': 'lbfgs', 'max_iter': 2000, 'fit_intercept': True, 'standardize_with_source': True, 'rho': 1.0}
[I 2026-06-01 20:07:06,164] Trial 138 finished with value: 0.23391102395956648 and parameters: {'alpha': 67255.29487481898, 'n_pcs': 3500, 'iw_method': 'pc_logistic', 'iw_clip_max': 1.5, 'iw_prob_clip': 0.035636679763674156, 'iw_n_components': 60, 'iw_logistic_c': 0.8948121261330573, 'iw_pca_fit': 'combined', 'iw_solver': 'lbfgs', 'iw_rho': 1.0}. Best is trial 108 with value: 0.23595167441312664.
2026-06-01 20:07:06 | INFO | Trial 139 | outer=6 | alpha=6.689e+04 n_pcs=3500 (pc_topk) weight={'name': 'pc_logistic', 'floor': 1e-06, 'clip_max': 1.5, 'prob_clip': 0.0388516224466235, 'n_components': 60, 'logistic_c': 1.0341297740356779, 'pca_fit': 'combined', 'solver': 'lbfgs', 'max_iter': 2000, 'fit_intercept': True, 'standardize_with_source': True, 'rho': 1.0}
[I 2026-06-01 20:07:28,461] Trial 139 finished with value: 0.23390356952215444 and parameters: {'alpha': 66892.11868507563, 'n_pcs': 3500, 'iw_method': 'pc_logistic', 'iw_clip_max': 1.5, 'iw_prob_clip': 0.0388516224466235, 'iw_n_components': 60, 'iw_logistic_c': 1.0341297740356779, 'iw_pca_fit': 'combined', 'iw_solver': 'lbfgs', 'iw_rho': 1.0}. Best is trial 108 with value: 0.23595167441312664.
2026-06-01 20:07:28 | INFO | Trial 140 | outer=6 | alpha=7.093e+04 n_pcs=3500 (pc_topk) weight={'name': 'pc_logistic', 'floor': 1e-06, 'clip_max': 1.5, 'prob_clip': 0.039122420025393276, 'n_components': 60, 'logistic_c': 0.6882662022114107, 'pca_fit': 'combined', 'solver': 'lbfgs', 'max_iter': 2000, 'fit_intercept': True, 'standardize_with_source': True, 'rho': 1.0}
[I 2026-06-01 20:07:50,272] Trial 140 finished with value: 0.23403928706985985 and parameters: {'alpha': 70933.51508517955, 'n_pcs': 3500, 'iw_method': 'pc_logistic', 'iw_clip_max': 1.5, 'iw_prob_clip': 0.039122420025393276, 'iw_n_components': 60, 'iw_logistic_c': 0.6882662022114107, 'iw_pca_fit': 'combined', 'iw_solver': 'lbfgs', 'iw_rho': 1.0}. Best is trial 108 with value: 0.23595167441312664.
2026-06-01 20:07:50 | INFO | Trial 141 | outer=6 | alpha=6.716e+04 n_pcs=3500 (pc_topk) weight={'name': 'pc_logistic', 'floor': 1e-06, 'clip_max': 1.5, 'prob_clip': 0.04046588641405997, 'n_components': 60, 'logistic_c': 1.1353625339406568, 'pca_fit': 'combined', 'solver': 'lbfgs', 'max_iter': 2000, 'fit_intercept': True, 'standardize_with_source': True, 'rho': 1.0}
[I 2026-06-01 20:08:12,485] Trial 141 finished with value: 0.2338785722957044 and parameters: {'alpha': 67159.94867508924, 'n_pcs': 3500, 'iw_method': 'pc_logistic', 'iw_clip_max': 1.5, 'iw_prob_clip': 0.04046588641405997, 'iw_n_components': 60, 'iw_logistic_c': 1.1353625339406568, 'iw_pca_fit': 'combined', 'iw_solver': 'lbfgs', 'iw_rho': 1.0}. Best is trial 108 with value: 0.23595167441312664.
2026-06-01 20:08:12 | INFO | Trial 142 | outer=6 | alpha=6.913e+04 n_pcs=3500 (pc_topk) weight={'name': 'pc_logistic', 'floor': 1e-06, 'clip_max': 1.5, 'prob_clip': 0.037716417068855694, 'n_components': 60, 'logistic_c': 0.6271883856260716, 'pca_fit': 'combined', 'solver': 'lbfgs', 'max_iter': 2000, 'fit_intercept': True, 'standardize_with_source': True, 'rho': 1.0}
[I 2026-06-01 20:08:34,425] Trial 142 finished with value: 0.23396896309227552 and parameters: {'alpha': 69132.25484131106, 'n_pcs': 3500, 'iw_method': 'pc_logistic', 'iw_clip_max': 1.5, 'iw_prob_clip': 0.037716417068855694, 'iw_n_components': 60, 'iw_logistic_c': 0.6271883856260716, 'iw_pca_fit': 'combined', 'iw_solver': 'lbfgs', 'iw_rho': 1.0}. Best is trial 108 with value: 0.23595167441312664.
2026-06-01 20:08:34 | INFO | Trial 143 | outer=6 | alpha=6.416e+04 n_pcs=3500 (pc_topk) weight={'name': 'pc_logistic', 'floor': 1e-06, 'clip_max': 1.5, 'prob_clip': 0.04253758862690124, 'n_components': 60, 'logistic_c': 0.6150537892162282, 'pca_fit': 'combined', 'solver': 'lbfgs', 'max_iter': 2000, 'fit_intercept': True, 'standardize_with_source': True, 'rho': 1.0}
[I 2026-06-01 20:08:55,304] Trial 143 finished with value: 0.23363930165800678 and parameters: {'alpha': 64158.61276827107, 'n_pcs': 3500, 'iw_method': 'pc_logistic', 'iw_clip_max': 1.5, 'iw_prob_clip': 0.04253758862690124, 'iw_n_components': 60, 'iw_logistic_c': 0.6150537892162282, 'iw_pca_fit': 'combined', 'iw_solver': 'lbfgs', 'iw_rho': 1.0}. Best is trial 108 with value: 0.23595167441312664.
2026-06-01 20:08:55 | INFO | Trial 144 | outer=6 | alpha=6.400e+04 n_pcs=3500 (pc_topk) weight={'name': 'pc_logistic', 'floor': 1e-06, 'clip_max': 1.5, 'prob_clip': 0.038769459811182974, 'n_components': 60, 'logistic_c': 0.5493108157864439, 'pca_fit': 'combined', 'solver': 'lbfgs', 'max_iter': 2000, 'fit_intercept': True, 'standardize_with_source': True, 'rho': 1.0}
[I 2026-06-01 20:09:18,105] Trial 144 finished with value: 0.23375477720264787 and parameters: {'alpha': 63998.68200276814, 'n_pcs': 3500, 'iw_method': 'pc_logistic', 'iw_clip_max': 1.5, 'iw_prob_clip': 0.038769459811182974, 'iw_n_components': 60, 'iw_logistic_c': 0.5493108157864439, 'iw_pca_fit': 'combined', 'iw_solver': 'lbfgs', 'iw_rho': 1.0}. Best is trial 108 with value: 0.23595167441312664.
2026-06-01 20:09:18 | INFO | Trial 145 | outer=6 | alpha=6.612e+04 n_pcs=3500 (pc_topk) weight={'name': 'pc_logistic', 'floor': 1e-06, 'clip_max': 1.5, 'prob_clip': 0.04294107224893955, 'n_components': 40, 'logistic_c': 0.4933408480405072, 'pca_fit': 'combined', 'solver': 'lbfgs', 'max_iter': 2000, 'fit_intercept': True, 'standardize_with_source': True, 'rho': 1.0}
[I 2026-06-01 20:09:38,103] Trial 145 finished with value: 0.2332192738705722 and parameters: {'alpha': 66118.35193652521, 'n_pcs': 3500, 'iw_method': 'pc_logistic', 'iw_clip_max': 1.5, 'iw_prob_clip': 0.04294107224893955, 'iw_n_components': 40, 'iw_logistic_c': 0.4933408480405072, 'iw_pca_fit': 'combined', 'iw_solver': 'lbfgs', 'iw_rho': 1.0}. Best is trial 108 with value: 0.23595167441312664.
2026-06-01 20:09:38 | INFO | Trial 146 | outer=6 | alpha=1.511e+05 n_pcs=3500 (pc_topk) weight={'name': 'pc_logistic', 'floor': 1e-06, 'clip_max': 7.0, 'prob_clip': 0.03794323010969651, 'n_components': 60, 'logistic_c': 0.6863258667995967, 'pca_fit': 'combined', 'solver': 'lbfgs', 'max_iter': 2000, 'fit_intercept': True, 'standardize_with_source': True, 'rho': 1.0}
[I 2026-06-01 20:10:00,464] Trial 146 finished with value: 0.21453923896475166 and parameters: {'alpha': 151079.81207396457, 'n_pcs': 3500, 'iw_method': 'pc_logistic', 'iw_clip_max': 7.0, 'iw_prob_clip': 0.03794323010969651, 'iw_n_components': 60, 'iw_logistic_c': 0.6863258667995967, 'iw_pca_fit': 'combined', 'iw_solver': 'lbfgs', 'iw_rho': 1.0}. Best is trial 108 with value: 0.23595167441312664.
2026-06-01 20:10:00 | INFO | Trial 147 | outer=6 | alpha=9.616e+06 n_pcs=4000 (pc_topk) weight={'name': 'pc_logistic', 'floor': 1e-06, 'clip_max': 1.5, 'prob_clip': 0.03664951795632718, 'n_components': 60, 'logistic_c': 0.1566828333823141, 'pca_fit': 'combined', 'solver': 'lbfgs', 'max_iter': 2000, 'fit_intercept': True, 'standardize_with_source': True, 'rho': 1.0}
[I 2026-06-01 20:10:23,702] Trial 147 finished with value: 0.21350747200841785 and parameters: {'alpha': 9616215.530243786, 'n_pcs': 4000, 'iw_method': 'pc_logistic', 'iw_clip_max': 1.5, 'iw_prob_clip': 0.03664951795632718, 'iw_n_components': 60, 'iw_logistic_c': 0.1566828333823141, 'iw_pca_fit': 'combined', 'iw_solver': 'lbfgs', 'iw_rho': 1.0}. Best is trial 108 with value: 0.23595167441312664.
2026-06-01 20:10:23 | INFO | Trial 148 | outer=6 | alpha=1.169e+05 n_pcs=3500 (pc_topk) weight={'name': 'pc_logistic', 'floor': 1e-06, 'clip_max': 12.0, 'prob_clip': 0.04843177587994042, 'n_components': 60, 'logistic_c': 0.8891958944871925, 'pca_fit': 'combined', 'solver': 'lbfgs', 'max_iter': 2000, 'fit_intercept': True, 'standardize_with_source': True, 'rho': 1.0}
[I 2026-06-01 20:10:45,792] Trial 148 finished with value: 0.2116819689690712 and parameters: {'alpha': 116905.8028160919, 'n_pcs': 3500, 'iw_method': 'pc_logistic', 'iw_clip_max': 12.0, 'iw_prob_clip': 0.04843177587994042, 'iw_n_components': 60, 'iw_logistic_c': 0.8891958944871925, 'iw_pca_fit': 'combined', 'iw_solver': 'lbfgs', 'iw_rho': 1.0}. Best is trial 108 with value: 0.23595167441312664.
2026-06-01 20:10:45 | INFO | Trial 149 | outer=6 | alpha=6.115e+04 n_pcs=3500 (pc_topk) weight={'name': 'pc_logistic', 'floor': 1e-06, 'clip_max': 1.5, 'prob_clip': 0.034903155130715166, 'n_components': 60, 'logistic_c': 1.0942264666795263, 'pca_fit': 'combined', 'solver': 'lbfgs', 'max_iter': 2000, 'fit_intercept': True, 'standardize_with_source': True, 'rho': 1.0}
[I 2026-06-01 20:11:07,856] Trial 149 finished with value: 0.23356480308426814 and parameters: {'alpha': 61152.88333257809, 'n_pcs': 3500, 'iw_method': 'pc_logistic', 'iw_clip_max': 1.5, 'iw_prob_clip': 0.034903155130715166, 'iw_n_components': 60, 'iw_logistic_c': 1.0942264666795263, 'iw_pca_fit': 'combined', 'iw_solver': 'lbfgs', 'iw_rho': 1.0}. Best is trial 108 with value: 0.23595167441312664.
2026-06-01 20:11:07 | INFO | Trial 150 | outer=6 | alpha=6.455e+04 n_pcs=4000 (pc_topk) weight={'name': 'pc_logistic', 'floor': 1e-06, 'clip_max': 1.5, 'prob_clip': 0.042357787540367696, 'n_components': 60, 'logistic_c': 0.4395977449478127, 'pca_fit': 'combined', 'solver': 'lbfgs', 'max_iter': 2000, 'fit_intercept': True, 'standardize_with_source': True, 'rho': 1.0}
