[I 2026-06-01 14:39:40,817] Trial 60 finished with value: 0.23399681208020776 and parameters: {'alpha': 606100.4497105499, 'n_pcs': 1000, 'iw_method': 'pc_logistic', 'iw_clip_max': 4.0, 'iw_prob_clip': 0.0007363175211554254, 'iw_n_components': 20, 'iw_logistic_c': 0.00010294472054751157, 'iw_pca_fit': 'combined', 'iw_solver': 'lbfgs', 'iw_rho': 0.7}. Best is trial 54 with value: 0.2396068775133852.
2026-06-01 14:39:40 | INFO | Trial 61 | outer=2 | alpha=1.560e+05 n_pcs=5000 (pc_topk) weight={'name': 'pc_logistic', 'floor': 1e-06, 'clip_max': 4.0, 'prob_clip': 0.0008869796497168592, 'n_components': 40, 'logistic_c': 2.2923328130570736e-05, 'pca_fit': 'combined', 'solver': 'lbfgs', 'max_iter': 2000, 'fit_intercept': True, 'standardize_with_source': True, 'rho': 0.3}
[I 2026-06-01 14:39:57,866] Trial 61 finished with value: 0.2391420424039959 and parameters: {'alpha': 156040.75612776403, 'n_pcs': 5000, 'iw_method': 'pc_logistic', 'iw_clip_max': 4.0, 'iw_prob_clip': 0.0008869796497168592, 'iw_n_components': 40, 'iw_logistic_c': 2.2923328130570736e-05, 'iw_pca_fit': 'combined', 'iw_solver': 'lbfgs', 'iw_rho': 0.3}. Best is trial 54 with value: 0.2396068775133852.
2026-06-01 14:39:57 | INFO | Trial 62 | outer=2 | alpha=1.495e+05 n_pcs=5000 (pc_topk) weight={'name': 'pc_logistic', 'floor': 1e-06, 'clip_max': 4.0, 'prob_clip': 0.0007068590968644344, 'n_components': 40, 'logistic_c': 1.6142038080912842e-05, 'pca_fit': 'combined', 'solver': 'lbfgs', 'max_iter': 2000, 'fit_intercept': True, 'standardize_with_source': True, 'rho': 0.3}
[I 2026-06-01 14:40:14,744] Trial 62 finished with value: 0.2385096198560354 and parameters: {'alpha': 149510.99645242703, 'n_pcs': 5000, 'iw_method': 'pc_logistic', 'iw_clip_max': 4.0, 'iw_prob_clip': 0.0007068590968644344, 'iw_n_components': 40, 'iw_logistic_c': 1.6142038080912842e-05, 'iw_pca_fit': 'combined', 'iw_solver': 'lbfgs', 'iw_rho': 0.3}. Best is trial 54 with value: 0.2396068775133852.
2026-06-01 14:40:14 | INFO | Trial 63 | outer=2 | alpha=1.365e+05 n_pcs=5000 (pc_topk) weight={'name': 'pc_logistic', 'floor': 1e-06, 'clip_max': 4.0, 'prob_clip': 0.0006819630276780939, 'n_components': 40, 'logistic_c': 6.320630073929913e-06, 'pca_fit': 'combined', 'solver': 'lbfgs', 'max_iter': 2000, 'fit_intercept': True, 'standardize_with_source': True, 'rho': 0.3}
[I 2026-06-01 14:40:31,317] Trial 63 finished with value: 0.23506420429140767 and parameters: {'alpha': 136549.36037876498, 'n_pcs': 5000, 'iw_method': 'pc_logistic', 'iw_clip_max': 4.0, 'iw_prob_clip': 0.0006819630276780939, 'iw_n_components': 40, 'iw_logistic_c': 6.320630073929913e-06, 'iw_pca_fit': 'combined', 'iw_solver': 'lbfgs', 'iw_rho': 0.3}. Best is trial 54 with value: 0.2396068775133852.
2026-06-01 14:40:31 | INFO | Trial 64 | outer=2 | alpha=3.428e+05 n_pcs=4500 (pc_topk) weight={'name': 'pc_logistic', 'floor': 1e-06, 'clip_max': 4.0, 'prob_clip': 0.0007187558241975143, 'n_components': 40, 'logistic_c': 5.0766788837813214e-05, 'pca_fit': 'combined', 'solver': 'lbfgs', 'max_iter': 2000, 'fit_intercept': True, 'standardize_with_source': True, 'rho': 0.3}
[I 2026-06-01 14:40:47,268] Trial 64 finished with value: 0.23744517744843896 and parameters: {'alpha': 342777.09357505135, 'n_pcs': 4500, 'iw_method': 'pc_logistic', 'iw_clip_max': 4.0, 'iw_prob_clip': 0.0007187558241975143, 'iw_n_components': 40, 'iw_logistic_c': 5.0766788837813214e-05, 'iw_pca_fit': 'combined', 'iw_solver': 'lbfgs', 'iw_rho': 0.3}. Best is trial 54 with value: 0.2396068775133852.
2026-06-01 14:40:47 | INFO | Trial 65 | outer=2 | alpha=8.100e+04 n_pcs=5000 (pc_topk) weight={'name': 'pc_logistic', 'floor': 1e-06, 'clip_max': 1.5, 'prob_clip': 0.0014553476875558003, 'n_components': 80, 'logistic_c': 0.0002481203366053119, 'pca_fit': 'combined', 'solver': 'lbfgs', 'max_iter': 2000, 'fit_intercept': True, 'standardize_with_source': True, 'rho': 0.3}
[I 2026-06-01 14:41:06,633] Trial 65 finished with value: 0.23851473110632454 and parameters: {'alpha': 80997.72205945221, 'n_pcs': 5000, 'iw_method': 'pc_logistic', 'iw_clip_max': 1.5, 'iw_prob_clip': 0.0014553476875558003, 'iw_n_components': 80, 'iw_logistic_c': 0.0002481203366053119, 'iw_pca_fit': 'combined', 'iw_solver': 'lbfgs', 'iw_rho': 0.3}. Best is trial 54 with value: 0.2396068775133852.
2026-06-01 14:41:06 | INFO | Trial 66 | outer=2 | alpha=8.972e+04 n_pcs=4500 (pc_topk) weight={'name': 'pc_logistic', 'floor': 1e-06, 'clip_max': 1.5, 'prob_clip': 0.0016147366983446142, 'n_components': 80, 'logistic_c': 0.0003136439815426604, 'pca_fit': 'combined', 'solver': 'lbfgs', 'max_iter': 2000, 'fit_intercept': True, 'standardize_with_source': True, 'rho': 0.3}
[I 2026-06-01 14:41:24,471] Trial 66 finished with value: 0.23914969871693859 and parameters: {'alpha': 89724.76437123441, 'n_pcs': 4500, 'iw_method': 'pc_logistic', 'iw_clip_max': 1.5, 'iw_prob_clip': 0.0016147366983446142, 'iw_n_components': 80, 'iw_logistic_c': 0.0003136439815426604, 'iw_pca_fit': 'combined', 'iw_solver': 'lbfgs', 'iw_rho': 0.3}. Best is trial 54 with value: 0.2396068775133852.
2026-06-01 14:41:24 | INFO | Trial 67 | outer=2 | alpha=1.063e+06 n_pcs=4500 (pc_topk) weight={'name': 'pc_logistic', 'floor': 1e-06, 'clip_max': 1.5, 'prob_clip': 0.002294013882331325, 'n_components': 80, 'logistic_c': 0.0005324207680964953, 'pca_fit': 'combined', 'solver': 'lbfgs', 'max_iter': 2000, 'fit_intercept': True, 'standardize_with_source': True, 'rho': 1.0}
[I 2026-06-01 14:41:42,075] Trial 67 finished with value: 0.23015884080380253 and parameters: {'alpha': 1063259.9669870161, 'n_pcs': 4500, 'iw_method': 'pc_logistic', 'iw_clip_max': 1.5, 'iw_prob_clip': 0.002294013882331325, 'iw_n_components': 80, 'iw_logistic_c': 0.0005324207680964953, 'iw_pca_fit': 'combined', 'iw_solver': 'lbfgs', 'iw_rho': 1.0}. Best is trial 54 with value: 0.2396068775133852.
2026-06-01 14:41:42 | INFO | Trial 68 | outer=2 | alpha=1.119e+05 n_pcs=4000 (pc_topk) weight={'name': 'pc_logistic', 'floor': 1e-06, 'clip_max': 1.5, 'prob_clip': 0.00493643585784842, 'n_components': 80, 'logistic_c': 0.00011491677958857365, 'pca_fit': 'combined', 'solver': 'lbfgs', 'max_iter': 2000, 'fit_intercept': True, 'standardize_with_source': True, 'rho': 0.7}
[I 2026-06-01 14:41:54,702] Trial 68 finished with value: 0.24014454202952282 and parameters: {'alpha': 111949.62600899173, 'n_pcs': 4000, 'iw_method': 'pc_logistic', 'iw_clip_max': 1.5, 'iw_prob_clip': 0.00493643585784842, 'iw_n_components': 80, 'iw_logistic_c': 0.00011491677958857365, 'iw_pca_fit': 'combined', 'iw_solver': 'lbfgs', 'iw_rho': 0.7}. Best is trial 68 with value: 0.24014454202952282.
2026-06-01 14:41:54 | INFO | Trial 69 | outer=2 | alpha=4.092e+04 n_pcs=4000 (pc_topk) weight={'name': 'pc_logistic', 'floor': 1e-06, 'clip_max': 1.5, 'prob_clip': 0.008162229100305589, 'n_components': 80, 'logistic_c': 0.0001516028828620217, 'pca_fit': 'combined', 'solver': 'lbfgs', 'max_iter': 2000, 'fit_intercept': True, 'standardize_with_source': True, 'rho': 0.7}
[I 2026-06-01 14:42:08,502] Trial 69 finished with value: 0.23736701305618696 and parameters: {'alpha': 40916.758845229575, 'n_pcs': 4000, 'iw_method': 'pc_logistic', 'iw_clip_max': 1.5, 'iw_prob_clip': 0.008162229100305589, 'iw_n_components': 80, 'iw_logistic_c': 0.0001516028828620217, 'iw_pca_fit': 'combined', 'iw_solver': 'lbfgs', 'iw_rho': 0.7}. Best is trial 68 with value: 0.24014454202952282.
2026-06-01 14:42:08 | INFO | Trial 70 | outer=2 | alpha=4.091e+06 n_pcs=3000 (pc_topk) weight={'name': 'pc_logistic', 'floor': 1e-06, 'clip_max': 1.5, 'prob_clip': 0.005954698199031008, 'n_components': 80, 'logistic_c': 8.332810950820483e-05, 'pca_fit': 'combined', 'solver': 'lbfgs', 'max_iter': 2000, 'fit_intercept': True, 'standardize_with_source': True, 'rho': 0.7}
[I 2026-06-01 14:42:18,518] Trial 70 finished with value: 0.22417890591737474 and parameters: {'alpha': 4091145.267798178, 'n_pcs': 3000, 'iw_method': 'pc_logistic', 'iw_clip_max': 1.5, 'iw_prob_clip': 0.005954698199031008, 'iw_n_components': 80, 'iw_logistic_c': 8.332810950820483e-05, 'iw_pca_fit': 'combined', 'iw_solver': 'lbfgs', 'iw_rho': 0.7}. Best is trial 68 with value: 0.24014454202952282.
2026-06-01 14:42:18 | INFO | Trial 71 | outer=2 | alpha=1.087e+05 n_pcs=4500 (pc_topk) weight={'name': 'pc_logistic', 'floor': 1e-06, 'clip_max': 1.5, 'prob_clip': 0.003672343544834231, 'n_components': 80, 'logistic_c': 2.9538578605063127e-05, 'pca_fit': 'combined', 'solver': 'lbfgs', 'max_iter': 2000, 'fit_intercept': True, 'standardize_with_source': True, 'rho': 0.7}
[I 2026-06-01 14:42:33,835] Trial 71 finished with value: 0.23955368079559558 and parameters: {'alpha': 108692.66684254077, 'n_pcs': 4500, 'iw_method': 'pc_logistic', 'iw_clip_max': 1.5, 'iw_prob_clip': 0.003672343544834231, 'iw_n_components': 80, 'iw_logistic_c': 2.9538578605063127e-05, 'iw_pca_fit': 'combined', 'iw_solver': 'lbfgs', 'iw_rho': 0.7}. Best is trial 68 with value: 0.24014454202952282.
2026-06-01 14:42:33 | INFO | Trial 72 | outer=2 | alpha=1.068e+05 n_pcs=4500 (pc_topk) weight={'name': 'pc_logistic', 'floor': 1e-06, 'clip_max': 1.5, 'prob_clip': 0.004276459619779456, 'n_components': 80, 'logistic_c': 1.0233431643616814e-07, 'pca_fit': 'combined', 'solver': 'lbfgs', 'max_iter': 2000, 'fit_intercept': True, 'standardize_with_source': True, 'rho': 0.7}
[I 2026-06-01 14:42:47,402] Trial 72 finished with value: 0.23200167222135967 and parameters: {'alpha': 106766.06104878407, 'n_pcs': 4500, 'iw_method': 'pc_logistic', 'iw_clip_max': 1.5, 'iw_prob_clip': 0.004276459619779456, 'iw_n_components': 80, 'iw_logistic_c': 1.0233431643616814e-07, 'iw_pca_fit': 'combined', 'iw_solver': 'lbfgs', 'iw_rho': 0.7}. Best is trial 68 with value: 0.24014454202952282.
2026-06-01 14:42:47 | INFO | Trial 73 | outer=2 | alpha=7.552e+04 n_pcs=4000 (pc_topk) weight={'name': 'pc_logistic', 'floor': 1e-06, 'clip_max': 1.5, 'prob_clip': 0.0031383717554706882, 'n_components': 80, 'logistic_c': 0.0004691087742728649, 'pca_fit': 'combined', 'solver': 'lbfgs', 'max_iter': 2000, 'fit_intercept': True, 'standardize_with_source': True, 'rho': 0.7}
[I 2026-06-01 14:43:03,135] Trial 73 finished with value: 0.2405462601611225 and parameters: {'alpha': 75523.27489469553, 'n_pcs': 4000, 'iw_method': 'pc_logistic', 'iw_clip_max': 1.5, 'iw_prob_clip': 0.0031383717554706882, 'iw_n_components': 80, 'iw_logistic_c': 0.0004691087742728649, 'iw_pca_fit': 'combined', 'iw_solver': 'lbfgs', 'iw_rho': 0.7}. Best is trial 73 with value: 0.2405462601611225.
2026-06-01 14:43:03 | INFO | Trial 74 | outer=2 | alpha=6.544e+04 n_pcs=4000 (pc_topk) weight={'name': 'pc_logistic', 'floor': 1e-06, 'clip_max': 1.5, 'prob_clip': 0.0029157768183166147, 'n_components': 80, 'logistic_c': 0.0004211757550000862, 'pca_fit': 'combined', 'solver': 'lbfgs', 'max_iter': 2000, 'fit_intercept': True, 'standardize_with_source': True, 'rho': 0.7}
[I 2026-06-01 14:43:18,431] Trial 74 finished with value: 0.24016144632781816 and parameters: {'alpha': 65438.928107945445, 'n_pcs': 4000, 'iw_method': 'pc_logistic', 'iw_clip_max': 1.5, 'iw_prob_clip': 0.0029157768183166147, 'iw_n_components': 80, 'iw_logistic_c': 0.0004211757550000862, 'iw_pca_fit': 'combined', 'iw_solver': 'lbfgs', 'iw_rho': 0.7}. Best is trial 73 with value: 0.2405462601611225.
2026-06-01 14:43:18 | INFO | Trial 75 | outer=2 | alpha=2.323e+04 n_pcs=4000 (pc_topk) weight={'name': 'pc_logistic', 'floor': 1e-06, 'clip_max': 1.5, 'prob_clip': 0.0031484510353243893, 'n_components': 80, 'logistic_c': 0.00031369683612631155, 'pca_fit': 'combined', 'solver': 'lbfgs', 'max_iter': 2000, 'fit_intercept': True, 'standardize_with_source': True, 'rho': 0.7}
[I 2026-06-01 14:43:33,425] Trial 75 finished with value: 0.2301723149589563 and parameters: {'alpha': 23234.32350425204, 'n_pcs': 4000, 'iw_method': 'pc_logistic', 'iw_clip_max': 1.5, 'iw_prob_clip': 0.0031484510353243893, 'iw_n_components': 80, 'iw_logistic_c': 0.00031369683612631155, 'iw_pca_fit': 'combined', 'iw_solver': 'lbfgs', 'iw_rho': 0.7}. Best is trial 73 with value: 0.2405462601611225.
2026-06-01 14:43:33 | INFO | Trial 76 | outer=2 | alpha=6.377e+04 n_pcs=3500 (pc_topk) weight={'name': 'pc_logistic', 'floor': 1e-06, 'clip_max': 1.5, 'prob_clip': 0.0032479171133455924, 'n_components': 80, 'logistic_c': 0.0017473172281017486, 'pca_fit': 'combined', 'solver': 'lbfgs', 'max_iter': 2000, 'fit_intercept': True, 'standardize_with_source': True, 'rho': 0.7}
[I 2026-06-01 14:43:47,309] Trial 76 finished with value: 0.23811822105799094 and parameters: {'alpha': 63771.86793383732, 'n_pcs': 3500, 'iw_method': 'pc_logistic', 'iw_clip_max': 1.5, 'iw_prob_clip': 0.0032479171133455924, 'iw_n_components': 80, 'iw_logistic_c': 0.0017473172281017486, 'iw_pca_fit': 'combined', 'iw_solver': 'lbfgs', 'iw_rho': 0.7}. Best is trial 73 with value: 0.2405462601611225.
2026-06-01 14:43:47 | INFO | Trial 77 | outer=2 | alpha=4.743e+04 n_pcs=4000 (pc_topk) weight={'name': 'pc_logistic', 'floor': 1e-06, 'clip_max': 7.0, 'prob_clip': 0.0018857530710259043, 'n_components': 80, 'logistic_c': 0.000834592114819737, 'pca_fit': 'combined', 'solver': 'lbfgs', 'max_iter': 2000, 'fit_intercept': True, 'standardize_with_source': True, 'rho': 0.7}
[I 2026-06-01 14:44:02,393] Trial 77 finished with value: 0.22791359907667622 and parameters: {'alpha': 47426.06476109736, 'n_pcs': 4000, 'iw_method': 'pc_logistic', 'iw_clip_max': 7.0, 'iw_prob_clip': 0.0018857530710259043, 'iw_n_components': 80, 'iw_logistic_c': 0.000834592114819737, 'iw_pca_fit': 'combined', 'iw_solver': 'lbfgs', 'iw_rho': 0.7}. Best is trial 73 with value: 0.2405462601611225.
2026-06-01 14:44:02 | INFO | Trial 78 | outer=2 | alpha=6.790e+04 n_pcs=3500 (pc_topk) weight={'name': 'pc_logistic', 'floor': 1e-06, 'clip_max': 2.5, 'prob_clip': 0.0061141499483858604, 'n_components': 80, 'logistic_c': 0.00022269469568444604, 'pca_fit': 'combined', 'solver': 'lbfgs', 'max_iter': 2000, 'fit_intercept': True, 'standardize_with_source': True, 'rho': 0.7}
[I 2026-06-01 14:44:13,791] Trial 78 finished with value: 0.239475040056439 and parameters: {'alpha': 67901.8596249443, 'n_pcs': 3500, 'iw_method': 'pc_logistic', 'iw_clip_max': 2.5, 'iw_prob_clip': 0.0061141499483858604, 'iw_n_components': 80, 'iw_logistic_c': 0.00022269469568444604, 'iw_pca_fit': 'combined', 'iw_solver': 'lbfgs', 'iw_rho': 0.7}. Best is trial 73 with value: 0.2405462601611225.
2026-06-01 14:44:13 | INFO | Trial 79 | outer=2 | alpha=6.877e+04 n_pcs=3500 (pc_topk) weight={'name': 'pc_logistic', 'floor': 1e-06, 'clip_max': 2.5, 'prob_clip': 0.005649579929774506, 'n_components': 80, 'logistic_c': 0.011610093510806836, 'pca_fit': 'combined', 'solver': 'lbfgs', 'max_iter': 2000, 'fit_intercept': True, 'standardize_with_source': True, 'rho': 0.7}
[I 2026-06-01 14:44:31,926] Trial 79 finished with value: 0.2390492496452794 and parameters: {'alpha': 68774.61467858184, 'n_pcs': 3500, 'iw_method': 'pc_logistic', 'iw_clip_max': 2.5, 'iw_prob_clip': 0.005649579929774506, 'iw_n_components': 80, 'iw_logistic_c': 0.011610093510806836, 'iw_pca_fit': 'combined', 'iw_solver': 'lbfgs', 'iw_rho': 0.7}. Best is trial 73 with value: 0.2405462601611225.
2026-06-01 14:44:31 | INFO | Trial 80 | outer=2 | alpha=1.066e+05 n_pcs=4000 (pc_topk) weight={'name': 'pc_logistic', 'floor': 1e-06, 'clip_max': 2.5, 'prob_clip': 0.007836303887411999, 'n_components': 20, 'logistic_c': 0.00011936269519773656, 'pca_fit': 'combined', 'solver': 'lbfgs', 'max_iter': 2000, 'fit_intercept': True, 'standardize_with_source': True, 'rho': 0.7}
[I 2026-06-01 14:44:46,032] Trial 80 finished with value: 0.24170930152631045 and parameters: {'alpha': 106566.36716534765, 'n_pcs': 4000, 'iw_method': 'pc_logistic', 'iw_clip_max': 2.5, 'iw_prob_clip': 0.007836303887411999, 'iw_n_components': 20, 'iw_logistic_c': 0.00011936269519773656, 'iw_pca_fit': 'combined', 'iw_solver': 'lbfgs', 'iw_rho': 0.7}. Best is trial 80 with value: 0.24170930152631045.
2026-06-01 14:44:46 | INFO | Trial 81 | outer=2 | alpha=3.321e+04 n_pcs=4000 (pc_topk) weight={'name': 'pc_logistic', 'floor': 1e-06, 'clip_max': 2.5, 'prob_clip': 0.004167705634795392, 'n_components': 20, 'logistic_c': 0.00010333786569133337, 'pca_fit': 'combined', 'solver': 'lbfgs', 'max_iter': 2000, 'fit_intercept': True, 'standardize_with_source': True, 'rho': 0.7}
[I 2026-06-01 14:44:59,777] Trial 81 finished with value: 0.23242610765463878 and parameters: {'alpha': 33210.4260207918, 'n_pcs': 4000, 'iw_method': 'pc_logistic', 'iw_clip_max': 2.5, 'iw_prob_clip': 0.004167705634795392, 'iw_n_components': 20, 'iw_logistic_c': 0.00010333786569133337, 'iw_pca_fit': 'combined', 'iw_solver': 'lbfgs', 'iw_rho': 0.7}. Best is trial 80 with value: 0.24170930152631045.
2026-06-01 14:44:59 | INFO | Trial 82 | outer=2 | alpha=1.214e+05 n_pcs=3500 (pc_topk) weight={'name': 'pc_logistic', 'floor': 1e-06, 'clip_max': 2.5, 'prob_clip': 0.007718563155165879, 'n_components': 20, 'logistic_c': 0.00014017702769093457, 'pca_fit': 'combined', 'solver': 'lbfgs', 'max_iter': 2000, 'fit_intercept': True, 'standardize_with_source': True, 'rho': 0.7}
[I 2026-06-01 14:45:11,419] Trial 82 finished with value: 0.24003794320823899 and parameters: {'alpha': 121353.03356057846, 'n_pcs': 3500, 'iw_method': 'pc_logistic', 'iw_clip_max': 2.5, 'iw_prob_clip': 0.007718563155165879, 'iw_n_components': 20, 'iw_logistic_c': 0.00014017702769093457, 'iw_pca_fit': 'combined', 'iw_solver': 'lbfgs', 'iw_rho': 0.7}. Best is trial 80 with value: 0.24170930152631045.
2026-06-01 14:45:11 | INFO | Trial 83 | outer=2 | alpha=1.143e+05 n_pcs=3000 (pc_topk) weight={'name': 'pc_logistic', 'floor': 1e-06, 'clip_max': 2.5, 'prob_clip': 0.010497982936904113, 'n_components': 20, 'logistic_c': 0.00020241344092887802, 'pca_fit': 'combined', 'solver': 'lbfgs', 'max_iter': 2000, 'fit_intercept': True, 'standardize_with_source': True, 'rho': 0.7}
[I 2026-06-01 14:45:23,743] Trial 83 finished with value: 0.2389663987818214 and parameters: {'alpha': 114328.50682503423, 'n_pcs': 3000, 'iw_method': 'pc_logistic', 'iw_clip_max': 2.5, 'iw_prob_clip': 0.010497982936904113, 'iw_n_components': 20, 'iw_logistic_c': 0.00020241344092887802, 'iw_pca_fit': 'combined', 'iw_solver': 'lbfgs', 'iw_rho': 0.7}. Best is trial 80 with value: 0.24170930152631045.
2026-06-01 14:45:23 | INFO | Trial 84 | outer=2 | alpha=4.467e+04 n_pcs=3500 (pc_topk) weight={'name': 'pc_logistic', 'floor': 1e-06, 'clip_max': 2.5, 'prob_clip': 0.007802838639070892, 'n_components': 20, 'logistic_c': 0.0006362668381601865, 'pca_fit': 'combined', 'solver': 'lbfgs', 'max_iter': 2000, 'fit_intercept': True, 'standardize_with_source': True, 'rho': 0.7}
[I 2026-06-01 14:45:37,149] Trial 84 finished with value: 0.23097315702945825 and parameters: {'alpha': 44672.3336815184, 'n_pcs': 3500, 'iw_method': 'pc_logistic', 'iw_clip_max': 2.5, 'iw_prob_clip': 0.007802838639070892, 'iw_n_components': 20, 'iw_logistic_c': 0.0006362668381601865, 'iw_pca_fit': 'combined', 'iw_solver': 'lbfgs', 'iw_rho': 0.7}. Best is trial 80 with value: 0.24170930152631045.
2026-06-01 14:45:37 | INFO | Trial 85 | outer=2 | alpha=5.994e+04 n_pcs=3500 (pc_topk) weight={'name': 'pc_logistic', 'floor': 1e-06, 'clip_max': 2.5, 'prob_clip': 0.007529868177200721, 'n_components': 20, 'logistic_c': 0.0016337678922120425, 'pca_fit': 'combined', 'solver': 'lbfgs', 'max_iter': 2000, 'fit_intercept': True, 'standardize_with_source': True, 'rho': 0.7}
[I 2026-06-01 14:45:53,088] Trial 85 finished with value: 0.2343722672868822 and parameters: {'alpha': 59943.67593551891, 'n_pcs': 3500, 'iw_method': 'pc_logistic', 'iw_clip_max': 2.5, 'iw_prob_clip': 0.007529868177200721, 'iw_n_components': 20, 'iw_logistic_c': 0.0016337678922120425, 'iw_pca_fit': 'combined', 'iw_solver': 'lbfgs', 'iw_rho': 0.7}. Best is trial 80 with value: 0.24170930152631045.
2026-06-01 14:45:53 | INFO | Trial 86 | outer=2 | alpha=7.080e+04 n_pcs=4000 (pc_topk) weight={'name': 'pc_logistic', 'floor': 1e-06, 'clip_max': 2.5, 'prob_clip': 0.004455011300110936, 'n_components': 80, 'logistic_c': 6.884836539948713e-05, 'pca_fit': 'combined', 'solver': 'lbfgs', 'max_iter': 2000, 'fit_intercept': True, 'standardize_with_source': True, 'rho': 0.7}
[I 2026-06-01 14:46:07,264] Trial 86 finished with value: 0.2421509335753262 and parameters: {'alpha': 70796.36737924027, 'n_pcs': 4000, 'iw_method': 'pc_logistic', 'iw_clip_max': 2.5, 'iw_prob_clip': 0.004455011300110936, 'iw_n_components': 80, 'iw_logistic_c': 6.884836539948713e-05, 'iw_pca_fit': 'combined', 'iw_solver': 'lbfgs', 'iw_rho': 0.7}. Best is trial 86 with value: 0.2421509335753262.
2026-06-01 14:46:07 | INFO | Trial 87 | outer=2 | alpha=1.573e+04 n_pcs=4000 (pc_topk) weight={'name': 'pc_logistic', 'floor': 1e-06, 'clip_max': 2.5, 'prob_clip': 0.004070719728924087, 'n_components': 80, 'logistic_c': 7.564951178062353e-05, 'pca_fit': 'combined', 'solver': 'lbfgs', 'max_iter': 2000, 'fit_intercept': True, 'standardize_with_source': True, 'rho': 0.7}
[I 2026-06-01 14:46:21,801] Trial 87 finished with value: 0.22034166418169682 and parameters: {'alpha': 15730.573113832397, 'n_pcs': 4000, 'iw_method': 'pc_logistic', 'iw_clip_max': 2.5, 'iw_prob_clip': 0.004070719728924087, 'iw_n_components': 80, 'iw_logistic_c': 7.564951178062353e-05, 'iw_pca_fit': 'combined', 'iw_solver': 'lbfgs', 'iw_rho': 0.7}. Best is trial 86 with value: 0.2421509335753262.
2026-06-01 14:46:21 | INFO | Trial 88 | outer=2 | alpha=7.592e+04 n_pcs=4000 (pc_topk) weight={'name': 'pc_logistic', 'floor': 1e-06, 'clip_max': 2.5, 'prob_clip': 0.005165966555322641, 'n_components': 80, 'logistic_c': 0.528108891817114, 'pca_fit': 'combined', 'solver': 'lbfgs', 'max_iter': 2000, 'fit_intercept': True, 'standardize_with_source': True, 'rho': 0.7}
