[I 2026-06-01 01:27:28,739] Trial 239 finished with value: 0.22875469033416093 and parameters: {'alpha': 52621.9755448262, 'n_pcs': 4500, 'weight_scheme': 'linear', 'weight_clip_max': 10.0, 'weight_linear_min_weight': 0.26649603034940783, 'weight_linear_max_weight': 3.8993601681571266}. Best is trial 86 with value: 0.22876955329088525.
2026-06-01 01:27:28 | INFO | src.nested_cv_avggrm_weighted_unified | Trial 240 | outer=7 | alpha=5.236e+04 n_pcs=4500 (pc_topk) weight_search=on
2026-06-01 01:27:28 | INFO | src.nested_cv_avggrm_weighted_unified | Trial 240 | outer=7 | weight={'name': 'linear', 'floor': 1e-06, 'clip_max': 10.0, 'min_weight': 0.2934855699194043, 'max_weight': 3.884351691695434}
[I 2026-06-01 01:27:35,584] Trial 240 finished with value: 0.22873358919825493 and parameters: {'alpha': 52357.573314452486, 'n_pcs': 4500, 'weight_scheme': 'linear', 'weight_clip_max': 10.0, 'weight_linear_min_weight': 0.2934855699194043, 'weight_linear_max_weight': 3.884351691695434}. Best is trial 86 with value: 0.22876955329088525.
2026-06-01 01:27:35 | INFO | src.nested_cv_avggrm_weighted_unified | Trial 241 | outer=7 | alpha=4.844e+04 n_pcs=4500 (pc_topk) weight_search=on
2026-06-01 01:27:35 | INFO | src.nested_cv_avggrm_weighted_unified | Trial 241 | outer=7 | weight={'name': 'linear', 'floor': 1e-06, 'clip_max': 10.0, 'min_weight': 0.2923185372711532, 'max_weight': 3.746650805272705}
[I 2026-06-01 01:27:42,901] Trial 241 finished with value: 0.22874498635132898 and parameters: {'alpha': 48437.6264115045, 'n_pcs': 4500, 'weight_scheme': 'linear', 'weight_clip_max': 10.0, 'weight_linear_min_weight': 0.2923185372711532, 'weight_linear_max_weight': 3.746650805272705}. Best is trial 86 with value: 0.22876955329088525.
2026-06-01 01:27:42 | INFO | src.nested_cv_avggrm_weighted_unified | Trial 242 | outer=7 | alpha=5.148e+04 n_pcs=4500 (pc_topk) weight_search=on
2026-06-01 01:27:42 | INFO | src.nested_cv_avggrm_weighted_unified | Trial 242 | outer=7 | weight={'name': 'linear', 'floor': 1e-06, 'clip_max': 10.0, 'min_weight': 0.29827362889839, 'max_weight': 3.763794747629418}
[I 2026-06-01 01:27:49,766] Trial 242 finished with value: 0.22872825738130084 and parameters: {'alpha': 51476.69893284708, 'n_pcs': 4500, 'weight_scheme': 'linear', 'weight_clip_max': 10.0, 'weight_linear_min_weight': 0.29827362889839, 'weight_linear_max_weight': 3.763794747629418}. Best is trial 86 with value: 0.22876955329088525.
2026-06-01 01:27:49 | INFO | src.nested_cv_avggrm_weighted_unified | Trial 243 | outer=7 | alpha=5.278e+04 n_pcs=4500 (pc_topk) weight_search=on
2026-06-01 01:27:49 | INFO | src.nested_cv_avggrm_weighted_unified | Trial 243 | outer=7 | weight={'name': 'linear', 'floor': 1e-06, 'clip_max': 10.0, 'min_weight': 0.30098220847465507, 'max_weight': 3.7439887834716505}
[I 2026-06-01 01:27:56,646] Trial 243 finished with value: 0.22870766251718283 and parameters: {'alpha': 52781.84603659234, 'n_pcs': 4500, 'weight_scheme': 'linear', 'weight_clip_max': 10.0, 'weight_linear_min_weight': 0.30098220847465507, 'weight_linear_max_weight': 3.7439887834716505}. Best is trial 86 with value: 0.22876955329088525.
2026-06-01 01:27:56 | INFO | src.nested_cv_avggrm_weighted_unified | Trial 244 | outer=7 | alpha=5.169e+04 n_pcs=4500 (pc_topk) weight_search=on
2026-06-01 01:27:56 | INFO | src.nested_cv_avggrm_weighted_unified | Trial 244 | outer=7 | weight={'name': 'linear', 'floor': 1e-06, 'clip_max': 10.0, 'min_weight': 0.30087059094783963, 'max_weight': 3.829427545426206}
[I 2026-06-01 01:28:03,486] Trial 244 finished with value: 0.2287289095403818 and parameters: {'alpha': 51690.91158532843, 'n_pcs': 4500, 'weight_scheme': 'linear', 'weight_clip_max': 10.0, 'weight_linear_min_weight': 0.30087059094783963, 'weight_linear_max_weight': 3.829427545426206}. Best is trial 86 with value: 0.22876955329088525.
2026-06-01 01:28:03 | INFO | src.nested_cv_avggrm_weighted_unified | Trial 245 | outer=7 | alpha=6.993e+04 n_pcs=4500 (pc_topk) weight_search=on
2026-06-01 01:28:03 | INFO | src.nested_cv_avggrm_weighted_unified | Trial 245 | outer=7 | weight={'name': 'linear', 'floor': 1e-06, 'clip_max': 10.0, 'min_weight': 0.2882408071201936, 'max_weight': 3.8457968576069037}
[I 2026-06-01 01:28:10,335] Trial 245 finished with value: 0.2282002837389027 and parameters: {'alpha': 69932.3045666155, 'n_pcs': 4500, 'weight_scheme': 'linear', 'weight_clip_max': 10.0, 'weight_linear_min_weight': 0.2882408071201936, 'weight_linear_max_weight': 3.8457968576069037}. Best is trial 86 with value: 0.22876955329088525.
2026-06-01 01:28:10 | INFO | src.nested_cv_avggrm_weighted_unified | Trial 246 | outer=7 | alpha=3.599e+04 n_pcs=4500 (pc_topk) weight_search=on
2026-06-01 01:28:10 | INFO | src.nested_cv_avggrm_weighted_unified | Trial 246 | outer=7 | weight={'name': 'linear', 'floor': 1e-06, 'clip_max': 10.0, 'min_weight': 0.3087612142580062, 'max_weight': 3.6158790361912505}
[I 2026-06-01 01:28:17,180] Trial 246 finished with value: 0.2282827817923458 and parameters: {'alpha': 35989.80460533218, 'n_pcs': 4500, 'weight_scheme': 'linear', 'weight_clip_max': 10.0, 'weight_linear_min_weight': 0.3087612142580062, 'weight_linear_max_weight': 3.6158790361912505}. Best is trial 86 with value: 0.22876955329088525.
2026-06-01 01:28:17 | INFO | src.nested_cv_avggrm_weighted_unified | Trial 247 | outer=7 | alpha=5.112e+04 n_pcs=4500 (pc_topk) weight_search=on
2026-06-01 01:28:17 | INFO | src.nested_cv_avggrm_weighted_unified | Trial 247 | outer=7 | weight={'name': 'linear', 'floor': 1e-06, 'clip_max': 10.0, 'min_weight': 0.25733191707450503, 'max_weight': 3.905169105522832}
[I 2026-06-01 01:28:23,993] Trial 247 finished with value: 0.22877115310215607 and parameters: {'alpha': 51115.94830687448, 'n_pcs': 4500, 'weight_scheme': 'linear', 'weight_clip_max': 10.0, 'weight_linear_min_weight': 0.25733191707450503, 'weight_linear_max_weight': 3.905169105522832}. Best is trial 247 with value: 0.22877115310215607.
2026-06-01 01:28:24 | INFO | src.nested_cv_avggrm_weighted_unified | OUTER 7 | new best trial 247 (mean inner r=0.2288) saved to outputs/final_results/e6_pc_ridge_avggrm/thr_wing/e6_pc_ridge_avggrm_thr_wing_best_trials/split_07_best_trial.json
2026-06-01 01:28:24 | INFO | src.nested_cv_avggrm_weighted_unified | Trial 248 | outer=7 | alpha=6.760e+04 n_pcs=4500 (pc_topk) weight_search=on
2026-06-01 01:28:24 | INFO | src.nested_cv_avggrm_weighted_unified | Trial 248 | outer=7 | weight={'name': 'linear', 'floor': 1e-06, 'clip_max': 10.0, 'min_weight': 0.26010493049552347, 'max_weight': 3.900219657170881}
[I 2026-06-01 01:28:30,768] Trial 248 finished with value: 0.2283617749796544 and parameters: {'alpha': 67595.12468033936, 'n_pcs': 4500, 'weight_scheme': 'linear', 'weight_clip_max': 10.0, 'weight_linear_min_weight': 0.26010493049552347, 'weight_linear_max_weight': 3.900219657170881}. Best is trial 247 with value: 0.22877115310215607.
2026-06-01 01:28:30 | INFO | src.nested_cv_avggrm_weighted_unified | Trial 249 | outer=7 | alpha=3.998e+04 n_pcs=4500 (pc_topk) weight_search=on
2026-06-01 01:28:30 | INFO | src.nested_cv_avggrm_weighted_unified | Trial 249 | outer=7 | weight={'name': 'linear', 'floor': 1e-06, 'clip_max': 10.0, 'min_weight': 0.23271349692804202, 'max_weight': 3.8942118569688398}
[I 2026-06-01 01:28:37,569] Trial 249 finished with value: 0.22851869238313158 and parameters: {'alpha': 39975.68670272584, 'n_pcs': 4500, 'weight_scheme': 'linear', 'weight_clip_max': 10.0, 'weight_linear_min_weight': 0.23271349692804202, 'weight_linear_max_weight': 3.8942118569688398}. Best is trial 247 with value: 0.22877115310215607.
2026-06-01 01:28:37 | INFO | src.nested_cv_avggrm_weighted_unified | Trial 250 | outer=7 | alpha=5.148e+04 n_pcs=4500 (pc_topk) weight_search=on
2026-06-01 01:28:37 | INFO | src.nested_cv_avggrm_weighted_unified | Trial 250 | outer=7 | weight={'name': 'linear', 'floor': 1e-06, 'clip_max': 10.0, 'min_weight': 0.25177854472054756, 'max_weight': 3.5641314097828802}
[I 2026-06-01 01:28:44,371] Trial 250 finished with value: 0.22875790666185294 and parameters: {'alpha': 51481.3623451721, 'n_pcs': 4500, 'weight_scheme': 'linear', 'weight_clip_max': 10.0, 'weight_linear_min_weight': 0.25177854472054756, 'weight_linear_max_weight': 3.5641314097828802}. Best is trial 247 with value: 0.22877115310215607.
2026-06-01 01:28:44 | INFO | src.nested_cv_avggrm_weighted_unified | Trial 251 | outer=7 | alpha=5.650e+04 n_pcs=4500 (pc_topk) weight_search=on
2026-06-01 01:28:44 | INFO | src.nested_cv_avggrm_weighted_unified | Trial 251 | outer=7 | weight={'name': 'linear', 'floor': 1e-06, 'clip_max': 10.0, 'min_weight': 0.24974993867869522, 'max_weight': 3.7436143728035267}
[I 2026-06-01 01:28:51,245] Trial 251 finished with value: 0.22870102422527103 and parameters: {'alpha': 56504.631673817516, 'n_pcs': 4500, 'weight_scheme': 'linear', 'weight_clip_max': 10.0, 'weight_linear_min_weight': 0.24974993867869522, 'weight_linear_max_weight': 3.7436143728035267}. Best is trial 247 with value: 0.22877115310215607.
2026-06-01 01:28:51 | INFO | src.nested_cv_avggrm_weighted_unified | Trial 252 | outer=7 | alpha=3.215e+04 n_pcs=4500 (pc_topk) weight_search=on
2026-06-01 01:28:51 | INFO | src.nested_cv_avggrm_weighted_unified | Trial 252 | outer=7 | weight={'name': 'linear', 'floor': 1e-06, 'clip_max': 10.0, 'min_weight': 0.2699896953224947, 'max_weight': 4.108488198717161}
[I 2026-06-01 01:28:58,045] Trial 252 finished with value: 0.22780937135691115 and parameters: {'alpha': 32146.425546792332, 'n_pcs': 4500, 'weight_scheme': 'linear', 'weight_clip_max': 10.0, 'weight_linear_min_weight': 0.2699896953224947, 'weight_linear_max_weight': 4.108488198717161}. Best is trial 247 with value: 0.22877115310215607.
2026-06-01 01:28:58 | INFO | src.nested_cv_avggrm_weighted_unified | Trial 253 | outer=7 | alpha=4.057e+04 n_pcs=4500 (pc_topk) weight_search=on
2026-06-01 01:28:58 | INFO | src.nested_cv_avggrm_weighted_unified | Trial 253 | outer=7 | weight={'name': 'linear', 'floor': 1e-06, 'clip_max': 10.0, 'min_weight': 0.2129558685461977, 'max_weight': 3.5973434205319577}
[I 2026-06-01 01:29:04,834] Trial 253 finished with value: 0.22854917961185892 and parameters: {'alpha': 40565.025025587, 'n_pcs': 4500, 'weight_scheme': 'linear', 'weight_clip_max': 10.0, 'weight_linear_min_weight': 0.2129558685461977, 'weight_linear_max_weight': 3.5973434205319577}. Best is trial 247 with value: 0.22877115310215607.
2026-06-01 01:29:04 | INFO | src.nested_cv_avggrm_weighted_unified | Trial 254 | outer=7 | alpha=7.095e+04 n_pcs=5000 (pc_topk) weight_search=on
2026-06-01 01:29:04 | INFO | src.nested_cv_avggrm_weighted_unified | Trial 254 | outer=7 | weight={'name': 'linear', 'floor': 1e-06, 'clip_max': 10.0, 'min_weight': 0.25434539522083577, 'max_weight': 3.433863597558272}
[I 2026-06-01 01:29:12,851] Trial 254 finished with value: 0.22641199942610762 and parameters: {'alpha': 70950.2229209869, 'n_pcs': 5000, 'weight_scheme': 'linear', 'weight_clip_max': 10.0, 'weight_linear_min_weight': 0.25434539522083577, 'weight_linear_max_weight': 3.433863597558272}. Best is trial 247 with value: 0.22877115310215607.
2026-06-01 01:29:12 | INFO | src.nested_cv_avggrm_weighted_unified | Trial 255 | outer=7 | alpha=5.224e+04 n_pcs=4500 (pc_topk) weight_search=on
2026-06-01 01:29:12 | INFO | src.nested_cv_avggrm_weighted_unified | Trial 255 | outer=7 | weight={'name': 'linear', 'floor': 1e-06, 'clip_max': 10.0, 'min_weight': 0.28387220075161973, 'max_weight': 3.91674283321156}
[I 2026-06-01 01:29:19,787] Trial 255 finished with value: 0.22874581126947438 and parameters: {'alpha': 52241.99031006891, 'n_pcs': 4500, 'weight_scheme': 'linear', 'weight_clip_max': 10.0, 'weight_linear_min_weight': 0.28387220075161973, 'weight_linear_max_weight': 3.91674283321156}. Best is trial 247 with value: 0.22877115310215607.
2026-06-01 01:29:19 | INFO | src.nested_cv_avggrm_weighted_unified | Trial 256 | outer=7 | alpha=5.791e+04 n_pcs=4500 (pc_topk) weight_search=on
2026-06-01 01:29:19 | INFO | src.nested_cv_avggrm_weighted_unified | Trial 256 | outer=7 | weight={'name': 'linear', 'floor': 1e-06, 'clip_max': 10.0, 'min_weight': 0.22207952548748733, 'max_weight': 3.816856564050067}
[I 2026-06-01 01:29:26,696] Trial 256 finished with value: 0.22870041771446598 and parameters: {'alpha': 57914.2014402237, 'n_pcs': 4500, 'weight_scheme': 'linear', 'weight_clip_max': 10.0, 'weight_linear_min_weight': 0.22207952548748733, 'weight_linear_max_weight': 3.816856564050067}. Best is trial 247 with value: 0.22877115310215607.
2026-06-01 01:29:26 | INFO | src.nested_cv_avggrm_weighted_unified | Trial 257 | outer=7 | alpha=7.509e+04 n_pcs=4500 (pc_topk) weight_search=on
2026-06-01 01:29:26 | INFO | src.nested_cv_avggrm_weighted_unified | Trial 257 | outer=7 | weight={'name': 'uniform', 'floor': 1e-06, 'clip_max': 10.0}
[I 2026-06-01 01:29:32,668] Trial 257 finished with value: 0.2154807765152174 and parameters: {'alpha': 75093.87708506775, 'n_pcs': 4500, 'weight_scheme': 'uniform', 'weight_clip_max': 10.0}. Best is trial 247 with value: 0.22877115310215607.
2026-06-01 01:29:32 | INFO | src.nested_cv_avggrm_weighted_unified | Trial 258 | outer=7 | alpha=5.263e+04 n_pcs=4500 (pc_topk) weight_search=on
2026-06-01 01:29:32 | INFO | src.nested_cv_avggrm_weighted_unified | Trial 258 | outer=7 | weight={'name': 'linear', 'floor': 1e-06, 'clip_max': 10.0, 'min_weight': 0.2824619045713637, 'max_weight': 3.848474189336754}
[I 2026-06-01 01:29:39,467] Trial 258 finished with value: 0.22873849575323035 and parameters: {'alpha': 52630.015754426706, 'n_pcs': 4500, 'weight_scheme': 'linear', 'weight_clip_max': 10.0, 'weight_linear_min_weight': 0.2824619045713637, 'weight_linear_max_weight': 3.848474189336754}. Best is trial 247 with value: 0.22877115310215607.
2026-06-01 01:29:39 | INFO | src.nested_cv_avggrm_weighted_unified | Trial 259 | outer=7 | alpha=6.646e+04 n_pcs=4500 (pc_topk) weight_search=on
2026-06-01 01:29:39 | INFO | src.nested_cv_avggrm_weighted_unified | Trial 259 | outer=7 | weight={'name': 'linear', 'floor': 1e-06, 'clip_max': 10.0, 'min_weight': 0.28225650560985416, 'max_weight': 3.7173957907367834}
[I 2026-06-01 01:29:46,289] Trial 259 finished with value: 0.2283375267815822 and parameters: {'alpha': 66461.87200236252, 'n_pcs': 4500, 'weight_scheme': 'linear', 'weight_clip_max': 10.0, 'weight_linear_min_weight': 0.28225650560985416, 'weight_linear_max_weight': 3.7173957907367834}. Best is trial 247 with value: 0.22877115310215607.
2026-06-01 01:29:46 | INFO | src.nested_cv_avggrm_weighted_unified | Trial 260 | outer=7 | alpha=5.435e+04 n_pcs=5000 (pc_topk) weight_search=on
2026-06-01 01:29:46 | INFO | src.nested_cv_avggrm_weighted_unified | Trial 260 | outer=7 | weight={'name': 'linear', 'floor': 1e-06, 'clip_max': 10.0, 'min_weight': 0.2807375703263024, 'max_weight': 3.905297086645784}
[I 2026-06-01 01:29:54,298] Trial 260 finished with value: 0.22684798656278105 and parameters: {'alpha': 54350.00694092674, 'n_pcs': 5000, 'weight_scheme': 'linear', 'weight_clip_max': 10.0, 'weight_linear_min_weight': 0.2807375703263024, 'weight_linear_max_weight': 3.905297086645784}. Best is trial 247 with value: 0.22877115310215607.
2026-06-01 01:29:54 | INFO | src.nested_cv_avggrm_weighted_unified | Trial 261 | outer=7 | alpha=2.535e+04 n_pcs=4500 (pc_topk) weight_search=on
2026-06-01 01:29:54 | INFO | src.nested_cv_avggrm_weighted_unified | Trial 261 | outer=7 | weight={'name': 'linear', 'floor': 1e-06, 'clip_max': 10.0, 'min_weight': 0.2434718304244735, 'max_weight': 3.5103705581596523}
[I 2026-06-01 01:30:01,092] Trial 261 finished with value: 0.22644837780433874 and parameters: {'alpha': 25346.98106805735, 'n_pcs': 4500, 'weight_scheme': 'linear', 'weight_clip_max': 10.0, 'weight_linear_min_weight': 0.2434718304244735, 'weight_linear_max_weight': 3.5103705581596523}. Best is trial 247 with value: 0.22877115310215607.
2026-06-01 01:30:01 | INFO | src.nested_cv_avggrm_weighted_unified | Trial 262 | outer=7 | alpha=3.929e+04 n_pcs=2000 (pc_topk) weight_search=on
2026-06-01 01:30:01 | INFO | src.nested_cv_avggrm_weighted_unified | Trial 262 | outer=7 | weight={'name': 'exponential', 'floor': 1e-06, 'clip_max': 10.0, 'beta': 5.959755967938826}
[I 2026-06-01 01:30:03,227] Trial 262 finished with value: 0.21016503157176855 and parameters: {'alpha': 39290.73104299082, 'n_pcs': 2000, 'weight_scheme': 'exponential', 'weight_clip_max': 10.0, 'weight_exponential_beta': 5.959755967938826}. Best is trial 247 with value: 0.22877115310215607.
2026-06-01 01:30:03 | INFO | src.nested_cv_avggrm_weighted_unified | Trial 263 | outer=7 | alpha=8.488e+04 n_pcs=4500 (pc_topk) weight_search=on
2026-06-01 01:30:03 | INFO | src.nested_cv_avggrm_weighted_unified | Trial 263 | outer=7 | weight={'name': 'linear', 'floor': 1e-06, 'clip_max': 10.0, 'min_weight': 0.2611426959715859, 'max_weight': 4.206936626661091}
[I 2026-06-01 01:30:10,070] Trial 263 finished with value: 0.22761655105871678 and parameters: {'alpha': 84877.64671238798, 'n_pcs': 4500, 'weight_scheme': 'linear', 'weight_clip_max': 10.0, 'weight_linear_min_weight': 0.2611426959715859, 'weight_linear_max_weight': 4.206936626661091}. Best is trial 247 with value: 0.22877115310215607.
2026-06-01 01:30:10 | INFO | src.nested_cv_avggrm_weighted_unified | Trial 264 | outer=7 | alpha=5.459e+04 n_pcs=4500 (pc_topk) weight_search=on
2026-06-01 01:30:10 | INFO | src.nested_cv_avggrm_weighted_unified | Trial 264 | outer=7 | weight={'name': 'linear', 'floor': 1e-06, 'clip_max': 10.0, 'min_weight': 0.29377163342543755, 'max_weight': 3.8099896366811907}
[I 2026-06-01 01:30:16,875] Trial 264 finished with value: 0.2286935946183967 and parameters: {'alpha': 54588.527614205195, 'n_pcs': 4500, 'weight_scheme': 'linear', 'weight_clip_max': 10.0, 'weight_linear_min_weight': 0.29377163342543755, 'weight_linear_max_weight': 3.8099896366811907}. Best is trial 247 with value: 0.22877115310215607.
2026-06-01 01:30:16 | INFO | src.nested_cv_avggrm_weighted_unified | Trial 265 | outer=7 | alpha=4.633e+04 n_pcs=4500 (pc_topk) weight_search=on
2026-06-01 01:30:16 | INFO | src.nested_cv_avggrm_weighted_unified | Trial 265 | outer=7 | weight={'name': 'linear', 'floor': 1e-06, 'clip_max': 10.0, 'min_weight': 0.26713916313512187, 'max_weight': 3.9064151116309076}
[I 2026-06-01 01:30:23,750] Trial 265 finished with value: 0.22874571809910557 and parameters: {'alpha': 46327.17463910522, 'n_pcs': 4500, 'weight_scheme': 'linear', 'weight_clip_max': 10.0, 'weight_linear_min_weight': 0.26713916313512187, 'weight_linear_max_weight': 3.9064151116309076}. Best is trial 247 with value: 0.22877115310215607.
2026-06-01 01:30:23 | INFO | src.nested_cv_avggrm_weighted_unified | Trial 266 | outer=7 | alpha=3.046e+04 n_pcs=4500 (pc_topk) weight_search=on
2026-06-01 01:30:23 | INFO | src.nested_cv_avggrm_weighted_unified | Trial 266 | outer=7 | weight={'name': 'linear', 'floor': 1e-06, 'clip_max': 10.0, 'min_weight': 0.23827773643178862, 'max_weight': 4.105565890228567}
[I 2026-06-01 01:30:30,553] Trial 266 finished with value: 0.22750045598865318 and parameters: {'alpha': 30455.098159542784, 'n_pcs': 4500, 'weight_scheme': 'linear', 'weight_clip_max': 10.0, 'weight_linear_min_weight': 0.23827773643178862, 'weight_linear_max_weight': 4.105565890228567}. Best is trial 247 with value: 0.22877115310215607.
2026-06-01 01:30:30 | INFO | src.nested_cv_avggrm_weighted_unified | Trial 267 | outer=7 | alpha=4.157e+04 n_pcs=4500 (pc_topk) weight_search=on
2026-06-01 01:30:30 | INFO | src.nested_cv_avggrm_weighted_unified | Trial 267 | outer=7 | weight={'name': 'linear', 'floor': 1e-06, 'clip_max': 10.0, 'min_weight': 0.27013482303104075, 'max_weight': 3.8973882853240207}
[I 2026-06-01 01:30:37,391] Trial 267 finished with value: 0.2286157204342595 and parameters: {'alpha': 41566.11945242617, 'n_pcs': 4500, 'weight_scheme': 'linear', 'weight_clip_max': 10.0, 'weight_linear_min_weight': 0.27013482303104075, 'weight_linear_max_weight': 3.8973882853240207}. Best is trial 247 with value: 0.22877115310215607.
2026-06-01 01:30:37 | INFO | src.nested_cv_avggrm_weighted_unified | Trial 268 | outer=7 | alpha=6.472e+04 n_pcs=4500 (pc_topk) weight_search=on
2026-06-01 01:30:37 | INFO | src.nested_cv_avggrm_weighted_unified | Trial 268 | outer=7 | weight={'name': 'linear', 'floor': 1e-06, 'clip_max': 10.0, 'min_weight': 0.2563837941298348, 'max_weight': 3.9347795621427495}
[I 2026-06-01 01:30:44,230] Trial 268 finished with value: 0.22847774632376341 and parameters: {'alpha': 64724.577165172035, 'n_pcs': 4500, 'weight_scheme': 'linear', 'weight_clip_max': 10.0, 'weight_linear_min_weight': 0.2563837941298348, 'weight_linear_max_weight': 3.9347795621427495}. Best is trial 247 with value: 0.22877115310215607.
2026-06-01 01:30:44 | INFO | src.nested_cv_avggrm_weighted_unified | Trial 269 | outer=7 | alpha=4.654e+04 n_pcs=4500 (pc_topk) weight_search=on
2026-06-01 01:30:44 | INFO | src.nested_cv_avggrm_weighted_unified | Trial 269 | outer=7 | weight={'name': 'linear', 'floor': 1e-06, 'clip_max': 10.0, 'min_weight': 0.3120919124664592, 'max_weight': 2.0496630781478284}
[I 2026-06-01 01:30:50,990] Trial 269 finished with value: 0.22827227582942675 and parameters: {'alpha': 46544.25604480127, 'n_pcs': 4500, 'weight_scheme': 'linear', 'weight_clip_max': 10.0, 'weight_linear_min_weight': 0.3120919124664592, 'weight_linear_max_weight': 2.0496630781478284}. Best is trial 247 with value: 0.22877115310215607.
2026-06-01 01:30:50 | INFO | src.nested_cv_avggrm_weighted_unified | Trial 270 | outer=7 | alpha=3.578e+04 n_pcs=5000 (pc_topk) weight_search=on
2026-06-01 01:30:51 | INFO | src.nested_cv_avggrm_weighted_unified | Trial 270 | outer=7 | weight={'name': 'linear', 'floor': 1e-06, 'clip_max': 10.0, 'min_weight': 0.270973705935978, 'max_weight': 4.193942449322685}
