[I 2026-05-31 23:30:42,085] Trial 256 pruned. 
2026-05-31 23:30:42 | INFO | src.nested_cv_avggrm_weighted_unified | Trial 257 | outer=2 | alpha=5.509e+05 n_pcs=3500 (pc_topk) weight_search=on
2026-05-31 23:30:42 | INFO | src.nested_cv_avggrm_weighted_unified | Trial 257 | outer=2 | weight={'name': 'exponential', 'floor': 1e-06, 'clip_max': 3.0, 'beta': 8.933822716046683}
[I 2026-05-31 23:30:46,970] Trial 257 finished with value: 0.24824507145443464 and parameters: {'alpha': 550852.3775272688, 'n_pcs': 3500, 'weight_scheme': 'exponential', 'weight_clip_max': 3.0, 'weight_exponential_beta': 8.933822716046683}. Best is trial 214 with value: 0.2498688542015699.
2026-05-31 23:30:46 | INFO | src.nested_cv_avggrm_weighted_unified | Trial 258 | outer=2 | alpha=3.665e+05 n_pcs=4000 (pc_topk) weight_search=on
2026-05-31 23:30:46 | INFO | src.nested_cv_avggrm_weighted_unified | Trial 258 | outer=2 | weight={'name': 'exponential', 'floor': 1e-06, 'clip_max': 3.0, 'beta': 8.465642800549713}
[I 2026-05-31 23:30:52,707] Trial 258 finished with value: 0.249610763586482 and parameters: {'alpha': 366485.33057629736, 'n_pcs': 4000, 'weight_scheme': 'exponential', 'weight_clip_max': 3.0, 'weight_exponential_beta': 8.465642800549713}. Best is trial 214 with value: 0.2498688542015699.
2026-05-31 23:30:52 | INFO | src.nested_cv_avggrm_weighted_unified | Trial 259 | outer=2 | alpha=1.786e+05 n_pcs=4000 (pc_topk) weight_search=on
2026-05-31 23:30:52 | INFO | src.nested_cv_avggrm_weighted_unified | Trial 259 | outer=2 | weight={'name': 'linear', 'floor': 1e-06, 'clip_max': 3.0, 'min_weight': 0.3940218038060367, 'max_weight': 1.021404028728624}
2026-05-31 23:30:56 | INFO | src.nested_cv_avggrm_weighted_unified | Trial 259 | outer=2 | pruned after 7/10 inner folds (mean r=0.2689)
[I 2026-05-31 23:30:56,760] Trial 259 pruned. 
2026-05-31 23:30:56 | INFO | src.nested_cv_avggrm_weighted_unified | Trial 260 | outer=2 | alpha=2.776e+05 n_pcs=4000 (pc_topk) weight_search=on
2026-05-31 23:30:56 | INFO | src.nested_cv_avggrm_weighted_unified | Trial 260 | outer=2 | weight={'name': 'exponential', 'floor': 1e-06, 'clip_max': 3.0, 'beta': 9.33517753762244}
[I 2026-05-31 23:31:02,508] Trial 260 finished with value: 0.24954338803280424 and parameters: {'alpha': 277627.117766805, 'n_pcs': 4000, 'weight_scheme': 'exponential', 'weight_clip_max': 3.0, 'weight_exponential_beta': 9.33517753762244}. Best is trial 214 with value: 0.2498688542015699.
2026-05-31 23:31:02 | INFO | src.nested_cv_avggrm_weighted_unified | Trial 261 | outer=2 | alpha=4.329e+05 n_pcs=4000 (pc_topk) weight_search=on
2026-05-31 23:31:02 | INFO | src.nested_cv_avggrm_weighted_unified | Trial 261 | outer=2 | weight={'name': 'exponential', 'floor': 1e-06, 'clip_max': None, 'beta': 8.785039634407822}
2026-05-31 23:31:05 | INFO | src.nested_cv_avggrm_weighted_unified | Trial 261 | outer=2 | pruned after 5/10 inner folds (mean r=0.1800)
[I 2026-05-31 23:31:05,383] Trial 261 pruned. 
2026-05-31 23:31:05 | INFO | src.nested_cv_avggrm_weighted_unified | Trial 262 | outer=2 | alpha=3.113e+05 n_pcs=4000 (pc_topk) weight_search=on
2026-05-31 23:31:05 | INFO | src.nested_cv_avggrm_weighted_unified | Trial 262 | outer=2 | weight={'name': 'exponential', 'floor': 1e-06, 'clip_max': 3.0, 'beta': 2.8077704707349227}
2026-05-31 23:31:09 | INFO | src.nested_cv_avggrm_weighted_unified | Trial 262 | outer=2 | pruned after 7/10 inner folds (mean r=0.2776)
[I 2026-05-31 23:31:09,401] Trial 262 pruned. 
2026-05-31 23:31:09 | INFO | src.nested_cv_avggrm_weighted_unified | Trial 263 | outer=2 | alpha=2.571e+05 n_pcs=4000 (pc_topk) weight_search=on
2026-05-31 23:31:09 | INFO | src.nested_cv_avggrm_weighted_unified | Trial 263 | outer=2 | weight={'name': 'exponential', 'floor': 1e-06, 'clip_max': 3.0, 'beta': 9.123653114940007}
[I 2026-05-31 23:31:15,150] Trial 263 finished with value: 0.2495914517819387 and parameters: {'alpha': 257140.58475831329, 'n_pcs': 4000, 'weight_scheme': 'exponential', 'weight_clip_max': 3.0, 'weight_exponential_beta': 9.123653114940007}. Best is trial 214 with value: 0.2498688542015699.
2026-05-31 23:31:15 | INFO | src.nested_cv_avggrm_weighted_unified | Trial 264 | outer=2 | alpha=3.534e+05 n_pcs=4000 (pc_topk) weight_search=on
2026-05-31 23:31:15 | INFO | src.nested_cv_avggrm_weighted_unified | Trial 264 | outer=2 | weight={'name': 'exponential', 'floor': 1e-06, 'clip_max': 3.0, 'beta': 8.59632982774495}
[I 2026-05-31 23:31:20,898] Trial 264 finished with value: 0.24972561438921348 and parameters: {'alpha': 353377.0847011387, 'n_pcs': 4000, 'weight_scheme': 'exponential', 'weight_clip_max': 3.0, 'weight_exponential_beta': 8.59632982774495}. Best is trial 214 with value: 0.2498688542015699.
2026-05-31 23:31:20 | INFO | src.nested_cv_avggrm_weighted_unified | Trial 265 | outer=2 | alpha=6.911e+03 n_pcs=3500 (pc_topk) weight_search=on
2026-05-31 23:31:20 | INFO | src.nested_cv_avggrm_weighted_unified | Trial 265 | outer=2 | weight={'name': 'exponential', 'floor': 1e-06, 'clip_max': 3.0, 'beta': 8.94937608771719}
2026-05-31 23:31:23 | INFO | src.nested_cv_avggrm_weighted_unified | Trial 265 | outer=2 | pruned after 5/10 inner folds (mean r=0.1624)
[I 2026-05-31 23:31:23,409] Trial 265 pruned. 
2026-05-31 23:31:23 | INFO | src.nested_cv_avggrm_weighted_unified | Trial 266 | outer=2 | alpha=2.126e+05 n_pcs=4000 (pc_topk) weight_search=on
2026-05-31 23:31:23 | INFO | src.nested_cv_avggrm_weighted_unified | Trial 266 | outer=2 | weight={'name': 'exponential', 'floor': 1e-06, 'clip_max': 3.0, 'beta': 8.705039494384083}
[I 2026-05-31 23:31:29,150] Trial 266 finished with value: 0.24934224750120676 and parameters: {'alpha': 212595.0273791018, 'n_pcs': 4000, 'weight_scheme': 'exponential', 'weight_clip_max': 3.0, 'weight_exponential_beta': 8.705039494384083}. Best is trial 214 with value: 0.2498688542015699.
2026-05-31 23:31:29 | INFO | src.nested_cv_avggrm_weighted_unified | Trial 267 | outer=2 | alpha=2.900e+05 n_pcs=4000 (pc_topk) weight_search=on
2026-05-31 23:31:29 | INFO | src.nested_cv_avggrm_weighted_unified | Trial 267 | outer=2 | weight={'name': 'exponential', 'floor': 1e-06, 'clip_max': 10.0, 'beta': 8.174504252599268}
2026-05-31 23:31:33 | INFO | src.nested_cv_avggrm_weighted_unified | Trial 267 | outer=2 | pruned after 7/10 inner folds (mean r=0.2719)
[I 2026-05-31 23:31:33,199] Trial 267 pruned. 
2026-05-31 23:31:33 | INFO | src.nested_cv_avggrm_weighted_unified | Trial 268 | outer=2 | alpha=4.012e+05 n_pcs=4000 (pc_topk) weight_search=on
2026-05-31 23:31:33 | INFO | src.nested_cv_avggrm_weighted_unified | Trial 268 | outer=2 | weight={'name': 'exponential', 'floor': 1e-06, 'clip_max': 3.0, 'beta': 9.10451484518368}
[I 2026-05-31 23:31:38,989] Trial 268 finished with value: 0.2496408854380004 and parameters: {'alpha': 401163.40897296986, 'n_pcs': 4000, 'weight_scheme': 'exponential', 'weight_clip_max': 3.0, 'weight_exponential_beta': 9.10451484518368}. Best is trial 214 with value: 0.2498688542015699.
2026-05-31 23:31:38 | INFO | src.nested_cv_avggrm_weighted_unified | Trial 269 | outer=2 | alpha=2.475e+05 n_pcs=4000 (pc_topk) weight_search=on
2026-05-31 23:31:39 | INFO | src.nested_cv_avggrm_weighted_unified | Trial 269 | outer=2 | weight={'name': 'exponential', 'floor': 1e-06, 'clip_max': 3.0, 'beta': 9.379875823138889}
[I 2026-05-31 23:31:44,735] Trial 269 finished with value: 0.24929070656555666 and parameters: {'alpha': 247478.93883603203, 'n_pcs': 4000, 'weight_scheme': 'exponential', 'weight_clip_max': 3.0, 'weight_exponential_beta': 9.379875823138889}. Best is trial 214 with value: 0.2498688542015699.
2026-05-31 23:31:44 | INFO | src.nested_cv_avggrm_weighted_unified | Trial 270 | outer=2 | alpha=3.500e+05 n_pcs=4000 (pc_topk) weight_search=on
2026-05-31 23:31:44 | INFO | src.nested_cv_avggrm_weighted_unified | Trial 270 | outer=2 | weight={'name': 'exponential', 'floor': 1e-06, 'clip_max': 3.0, 'beta': 8.898784849039519}
[I 2026-05-31 23:31:50,475] Trial 270 finished with value: 0.2498276623416955 and parameters: {'alpha': 349994.7653257062, 'n_pcs': 4000, 'weight_scheme': 'exponential', 'weight_clip_max': 3.0, 'weight_exponential_beta': 8.898784849039519}. Best is trial 214 with value: 0.2498688542015699.
2026-05-31 23:31:50 | INFO | src.nested_cv_avggrm_weighted_unified | Trial 271 | outer=2 | alpha=4.841e+05 n_pcs=4000 (pc_topk) weight_search=on
2026-05-31 23:31:50 | INFO | src.nested_cv_avggrm_weighted_unified | Trial 271 | outer=2 | weight={'name': 'exponential', 'floor': 1e-06, 'clip_max': 3.0, 'beta': 8.482483275737335}
[I 2026-05-31 23:31:56,191] Trial 271 finished with value: 0.24899209223261995 and parameters: {'alpha': 484109.5059466135, 'n_pcs': 4000, 'weight_scheme': 'exponential', 'weight_clip_max': 3.0, 'weight_exponential_beta': 8.482483275737335}. Best is trial 214 with value: 0.2498688542015699.
2026-05-31 23:31:56 | INFO | src.nested_cv_avggrm_weighted_unified | Trial 272 | outer=2 | alpha=3.480e+05 n_pcs=4000 (pc_topk) weight_search=on
2026-05-31 23:31:56 | INFO | src.nested_cv_avggrm_weighted_unified | Trial 272 | outer=2 | weight={'name': 'exponential', 'floor': 1e-06, 'clip_max': 20.0, 'beta': 7.9290529733887265}
2026-05-31 23:32:00 | INFO | src.nested_cv_avggrm_weighted_unified | Trial 272 | outer=2 | pruned after 7/10 inner folds (mean r=0.2614)
[I 2026-05-31 23:32:00,191] Trial 272 pruned. 
2026-05-31 23:32:00 | INFO | src.nested_cv_avggrm_weighted_unified | Trial 273 | outer=2 | alpha=4.069e+05 n_pcs=4000 (pc_topk) weight_search=on
2026-05-31 23:32:00 | INFO | src.nested_cv_avggrm_weighted_unified | Trial 273 | outer=2 | weight={'name': 'exponential', 'floor': 1e-06, 'clip_max': 3.0, 'beta': 8.801322768741601}
[I 2026-05-31 23:32:05,921] Trial 273 finished with value: 0.24961920226863782 and parameters: {'alpha': 406907.66564729967, 'n_pcs': 4000, 'weight_scheme': 'exponential', 'weight_clip_max': 3.0, 'weight_exponential_beta': 8.801322768741601}. Best is trial 214 with value: 0.2498688542015699.
2026-05-31 23:32:05 | INFO | src.nested_cv_avggrm_weighted_unified | Trial 274 | outer=2 | alpha=1.674e+05 n_pcs=4000 (pc_topk) weight_search=on
2026-05-31 23:32:05 | INFO | src.nested_cv_avggrm_weighted_unified | Trial 274 | outer=2 | weight={'name': 'uniform', 'floor': 1e-06, 'clip_max': 3.0}
2026-05-31 23:32:08 | INFO | src.nested_cv_avggrm_weighted_unified | Trial 274 | outer=2 | pruned after 6/10 inner folds (mean r=0.2367)
[I 2026-05-31 23:32:08,873] Trial 274 pruned. 
2026-05-31 23:32:08 | INFO | src.nested_cv_avggrm_weighted_unified | Trial 275 | outer=2 | alpha=3.245e+05 n_pcs=4000 (pc_topk) weight_search=on
2026-05-31 23:32:08 | INFO | src.nested_cv_avggrm_weighted_unified | Trial 275 | outer=2 | weight={'name': 'exponential', 'floor': 1e-06, 'clip_max': 3.0, 'beta': 9.243162652311904}
[I 2026-05-31 23:32:14,621] Trial 275 finished with value: 0.2497312175925031 and parameters: {'alpha': 324526.55655310693, 'n_pcs': 4000, 'weight_scheme': 'exponential', 'weight_clip_max': 3.0, 'weight_exponential_beta': 9.243162652311904}. Best is trial 214 with value: 0.2498688542015699.
2026-05-31 23:32:14 | INFO | src.nested_cv_avggrm_weighted_unified | Trial 276 | outer=2 | alpha=5.830e+05 n_pcs=3500 (pc_topk) weight_search=on
2026-05-31 23:32:14 | INFO | src.nested_cv_avggrm_weighted_unified | Trial 276 | outer=2 | weight={'name': 'exponential', 'floor': 1e-06, 'clip_max': 3.0, 'beta': 8.260915855461509}
[I 2026-05-31 23:32:19,513] Trial 276 finished with value: 0.24755934954945297 and parameters: {'alpha': 583030.8541404834, 'n_pcs': 3500, 'weight_scheme': 'exponential', 'weight_clip_max': 3.0, 'weight_exponential_beta': 8.260915855461509}. Best is trial 214 with value: 0.2498688542015699.
2026-05-31 23:32:19 | INFO | src.nested_cv_avggrm_weighted_unified | Trial 277 | outer=2 | alpha=2.130e+05 n_pcs=4000 (pc_topk) weight_search=on
2026-05-31 23:32:19 | INFO | src.nested_cv_avggrm_weighted_unified | Trial 277 | outer=2 | weight={'name': 'exponential', 'floor': 1e-06, 'clip_max': 3.0, 'beta': 8.638445866361511}
[I 2026-05-31 23:32:25,262] Trial 277 finished with value: 0.24935214142466916 and parameters: {'alpha': 212960.38274120446, 'n_pcs': 4000, 'weight_scheme': 'exponential', 'weight_clip_max': 3.0, 'weight_exponential_beta': 8.638445866361511}. Best is trial 214 with value: 0.2498688542015699.
2026-05-31 23:32:25 | INFO | src.nested_cv_avggrm_weighted_unified | Trial 278 | outer=2 | alpha=3.101e+05 n_pcs=4000 (pc_topk) weight_search=on
2026-05-31 23:32:25 | INFO | src.nested_cv_avggrm_weighted_unified | Trial 278 | outer=2 | weight={'name': 'exponential', 'floor': 1e-06, 'clip_max': 3.0, 'beta': 9.004617019367755}
[I 2026-05-31 23:32:31,004] Trial 278 finished with value: 0.24982737979363517 and parameters: {'alpha': 310128.5141900458, 'n_pcs': 4000, 'weight_scheme': 'exponential', 'weight_clip_max': 3.0, 'weight_exponential_beta': 9.004617019367755}. Best is trial 214 with value: 0.2498688542015699.
2026-05-31 23:32:31 | INFO | src.nested_cv_avggrm_weighted_unified | Trial 279 | outer=2 | alpha=2.667e+05 n_pcs=4000 (pc_topk) weight_search=on
2026-05-31 23:32:31 | INFO | src.nested_cv_avggrm_weighted_unified | Trial 279 | outer=2 | weight={'name': 'exponential', 'floor': 1e-06, 'clip_max': 3.0, 'beta': 8.796775468408216}
[I 2026-05-31 23:32:36,715] Trial 279 finished with value: 0.24977430485094332 and parameters: {'alpha': 266740.08924829576, 'n_pcs': 4000, 'weight_scheme': 'exponential', 'weight_clip_max': 3.0, 'weight_exponential_beta': 8.796775468408216}. Best is trial 214 with value: 0.2498688542015699.
2026-05-31 23:32:36 | INFO | src.nested_cv_avggrm_weighted_unified | Trial 280 | outer=2 | alpha=4.349e+05 n_pcs=4000 (pc_topk) weight_search=on
2026-05-31 23:32:36 | INFO | src.nested_cv_avggrm_weighted_unified | Trial 280 | outer=2 | weight={'name': 'exponential', 'floor': 1e-06, 'clip_max': 3.0, 'beta': 9.081849159999425}
[I 2026-05-31 23:32:42,412] Trial 280 finished with value: 0.24950607396148117 and parameters: {'alpha': 434905.90363218886, 'n_pcs': 4000, 'weight_scheme': 'exponential', 'weight_clip_max': 3.0, 'weight_exponential_beta': 9.081849159999425}. Best is trial 214 with value: 0.2498688542015699.
2026-05-31 23:32:42 | INFO | src.nested_cv_avggrm_weighted_unified | Trial 281 | outer=2 | alpha=2.431e+05 n_pcs=4000 (pc_topk) weight_search=on
2026-05-31 23:32:42 | INFO | src.nested_cv_avggrm_weighted_unified | Trial 281 | outer=2 | weight={'name': 'linear', 'floor': 1e-06, 'clip_max': 3.0, 'min_weight': 0.7388465202563004, 'max_weight': 2.5106569756709205}
2026-05-31 23:32:46 | INFO | src.nested_cv_avggrm_weighted_unified | Trial 281 | outer=2 | pruned after 7/10 inner folds (mean r=0.2710)
[I 2026-05-31 23:32:46,441] Trial 281 pruned. 
2026-05-31 23:32:46 | INFO | src.nested_cv_avggrm_weighted_unified | Trial 282 | outer=2 | alpha=3.054e+05 n_pcs=4000 (pc_topk) weight_search=on
2026-05-31 23:32:46 | INFO | src.nested_cv_avggrm_weighted_unified | Trial 282 | outer=2 | weight={'name': 'exponential', 'floor': 1e-06, 'clip_max': 3.0, 'beta': 8.505981042732564}
[I 2026-05-31 23:32:52,150] Trial 282 finished with value: 0.24977647643145479 and parameters: {'alpha': 305356.31482845894, 'n_pcs': 4000, 'weight_scheme': 'exponential', 'weight_clip_max': 3.0, 'weight_exponential_beta': 8.505981042732564}. Best is trial 214 with value: 0.2498688542015699.
2026-05-31 23:32:52 | INFO | src.nested_cv_avggrm_weighted_unified | Trial 283 | outer=2 | alpha=3.715e+05 n_pcs=4000 (pc_topk) weight_search=on
2026-05-31 23:32:52 | INFO | src.nested_cv_avggrm_weighted_unified | Trial 283 | outer=2 | weight={'name': 'exponential', 'floor': 1e-06, 'clip_max': 3.0, 'beta': 8.8803445036179}
[I 2026-05-31 23:32:57,857] Trial 283 finished with value: 0.24977417386889494 and parameters: {'alpha': 371538.5264829472, 'n_pcs': 4000, 'weight_scheme': 'exponential', 'weight_clip_max': 3.0, 'weight_exponential_beta': 8.8803445036179}. Best is trial 214 with value: 0.2498688542015699.
2026-05-31 23:32:57 | INFO | src.nested_cv_avggrm_weighted_unified | Trial 284 | outer=2 | alpha=2.113e+05 n_pcs=4000 (pc_topk) weight_search=on
2026-05-31 23:32:57 | INFO | src.nested_cv_avggrm_weighted_unified | Trial 284 | outer=2 | weight={'name': 'exponential', 'floor': 1e-06, 'clip_max': 3.0, 'beta': 8.677334619420815}
[I 2026-05-31 23:33:03,581] Trial 284 finished with value: 0.24932841331763766 and parameters: {'alpha': 211348.95740642422, 'n_pcs': 4000, 'weight_scheme': 'exponential', 'weight_clip_max': 3.0, 'weight_exponential_beta': 8.677334619420815}. Best is trial 214 with value: 0.2498688542015699.
2026-05-31 23:33:03 | INFO | src.nested_cv_avggrm_weighted_unified | Trial 285 | outer=2 | alpha=2.917e+05 n_pcs=4000 (pc_topk) weight_search=on
2026-05-31 23:33:03 | INFO | src.nested_cv_avggrm_weighted_unified | Trial 285 | outer=2 | weight={'name': 'exponential', 'floor': 1e-06, 'clip_max': 3.0, 'beta': 9.418239346369143}
[I 2026-05-31 23:33:09,316] Trial 285 finished with value: 0.24951390101893162 and parameters: {'alpha': 291702.95173519966, 'n_pcs': 4000, 'weight_scheme': 'exponential', 'weight_clip_max': 3.0, 'weight_exponential_beta': 9.418239346369143}. Best is trial 214 with value: 0.2498688542015699.
2026-05-31 23:33:09 | INFO | src.nested_cv_avggrm_weighted_unified | Trial 286 | outer=2 | alpha=4.726e+05 n_pcs=3500 (pc_topk) weight_search=on
2026-05-31 23:33:09 | INFO | src.nested_cv_avggrm_weighted_unified | Trial 286 | outer=2 | weight={'name': 'exponential', 'floor': 1e-06, 'clip_max': 3.0, 'beta': 9.142156618916808}
[I 2026-05-31 23:33:14,166] Trial 286 finished with value: 0.24859860361406244 and parameters: {'alpha': 472585.46930242213, 'n_pcs': 3500, 'weight_scheme': 'exponential', 'weight_clip_max': 3.0, 'weight_exponential_beta': 9.142156618916808}. Best is trial 214 with value: 0.2498688542015699.
2026-05-31 23:33:14 | INFO | src.nested_cv_avggrm_weighted_unified | Trial 287 | outer=2 | alpha=3.645e+05 n_pcs=4000 (pc_topk) weight_search=on
2026-05-31 23:33:14 | INFO | src.nested_cv_avggrm_weighted_unified | Trial 287 | outer=2 | weight={'name': 'exponential', 'floor': 1e-06, 'clip_max': 3.0, 'beta': 8.336315127837162}
[I 2026-05-31 23:33:19,895] Trial 287 finished with value: 0.24953067155783842 and parameters: {'alpha': 364480.68080975424, 'n_pcs': 4000, 'weight_scheme': 'exponential', 'weight_clip_max': 3.0, 'weight_exponential_beta': 8.336315127837162}. Best is trial 214 with value: 0.2498688542015699.
2026-05-31 23:33:19 | INFO | src.nested_cv_avggrm_weighted_unified | Trial 288 | outer=2 | alpha=2.563e+05 n_pcs=4000 (pc_topk) weight_search=on
2026-05-31 23:33:19 | INFO | src.nested_cv_avggrm_weighted_unified | Trial 288 | outer=2 | weight={'name': 'exponential', 'floor': 1e-06, 'clip_max': None, 'beta': 8.933411236197676}
2026-05-31 23:33:23 | INFO | src.nested_cv_avggrm_weighted_unified | Trial 288 | outer=2 | pruned after 6/10 inner folds (mean r=0.2160)
[I 2026-05-31 23:33:23,343] Trial 288 pruned. 
2026-05-31 23:33:23 | INFO | src.nested_cv_avggrm_weighted_unified | Trial 289 | outer=2 | alpha=3.175e+05 n_pcs=4000 (pc_topk) weight_search=on
2026-05-31 23:33:23 | INFO | src.nested_cv_avggrm_weighted_unified | Trial 289 | outer=2 | weight={'name': 'exponential', 'floor': 1e-06, 'clip_max': 3.0, 'beta': 8.603682935046725}
[I 2026-05-31 23:33:29,030] Trial 289 finished with value: 0.24980347079797166 and parameters: {'alpha': 317538.8155735651, 'n_pcs': 4000, 'weight_scheme': 'exponential', 'weight_clip_max': 3.0, 'weight_exponential_beta': 8.603682935046725}. Best is trial 214 with value: 0.2498688542015699.
2026-05-31 23:33:29 | INFO | src.nested_cv_avggrm_weighted_unified | Trial 290 | outer=2 | alpha=1.851e+05 n_pcs=4000 (pc_topk) weight_search=on
2026-05-31 23:33:29 | INFO | src.nested_cv_avggrm_weighted_unified | Trial 290 | outer=2 | weight={'name': 'exponential', 'floor': 1e-06, 'clip_max': 3.0, 'beta': 8.868039385489872}
[I 2026-05-31 23:33:34,777] Trial 290 finished with value: 0.24882797874123205 and parameters: {'alpha': 185083.97968213673, 'n_pcs': 4000, 'weight_scheme': 'exponential', 'weight_clip_max': 3.0, 'weight_exponential_beta': 8.868039385489872}. Best is trial 214 with value: 0.2498688542015699.
2026-05-31 23:33:34 | INFO | src.nested_cv_avggrm_weighted_unified | Trial 291 | outer=2 | alpha=2.333e+05 n_pcs=4000 (pc_topk) weight_search=on
2026-05-31 23:33:34 | INFO | src.nested_cv_avggrm_weighted_unified | Trial 291 | outer=2 | weight={'name': 'exponential', 'floor': 1e-06, 'clip_max': 10.0, 'beta': 9.21083772116135}
2026-05-31 23:33:38 | INFO | src.nested_cv_avggrm_weighted_unified | Trial 291 | outer=2 | pruned after 7/10 inner folds (mean r=0.2675)
[I 2026-05-31 23:33:38,804] Trial 291 pruned. 
2026-05-31 23:33:38 | INFO | src.nested_cv_avggrm_weighted_unified | Trial 292 | outer=2 | alpha=3.800e+05 n_pcs=4000 (pc_topk) weight_search=on
2026-05-31 23:33:38 | INFO | src.nested_cv_avggrm_weighted_unified | Trial 292 | outer=2 | weight={'name': 'exponential', 'floor': 1e-06, 'clip_max': 3.0, 'beta': 9.003811056074055}
[I 2026-05-31 23:33:44,543] Trial 292 finished with value: 0.24972964038777673 and parameters: {'alpha': 379981.66191191046, 'n_pcs': 4000, 'weight_scheme': 'exponential', 'weight_clip_max': 3.0, 'weight_exponential_beta': 9.003811056074055}. Best is trial 214 with value: 0.2498688542015699.
2026-05-31 23:33:44 | INFO | src.nested_cv_avggrm_weighted_unified | Trial 293 | outer=2 | alpha=5.291e+05 n_pcs=4000 (pc_topk) weight_search=on
2026-05-31 23:33:44 | INFO | src.nested_cv_avggrm_weighted_unified | Trial 293 | outer=2 | weight={'name': 'exponential', 'floor': 1e-06, 'clip_max': 3.0, 'beta': 8.506519614768536}
