[I 2026-06-01 01:05:41,507] Trial 23 finished with value: 0.21943813758603797 and parameters: {'alpha': 212025.31723120666, 'n_pcs': 4500, 'weight_scheme': 'linear', 'weight_clip_max': 10.0, 'weight_linear_min_weight': 0.485144454742556, 'weight_linear_max_weight': 3.5298516450305972}. Best is trial 22 with value: 0.22756024335746972.
2026-06-01 01:05:41 | INFO | src.nested_cv_avggrm_weighted_unified | Trial 24 | outer=7 | alpha=3.309e+04 n_pcs=4500 (pc_topk) weight_search=on
2026-06-01 01:05:41 | INFO | src.nested_cv_avggrm_weighted_unified | Trial 24 | outer=7 | weight={'name': 'linear', 'floor': 1e-06, 'clip_max': 10.0, 'min_weight': 0.3280517574997741, 'max_weight': 2.201371992369878}
[I 2026-06-01 01:05:48,346] Trial 24 finished with value: 0.22783933822232294 and parameters: {'alpha': 33091.02472644412, 'n_pcs': 4500, 'weight_scheme': 'linear', 'weight_clip_max': 10.0, 'weight_linear_min_weight': 0.3280517574997741, 'weight_linear_max_weight': 2.201371992369878}. Best is trial 24 with value: 0.22783933822232294.
2026-06-01 01:05:48 | INFO | src.nested_cv_avggrm_weighted_unified | OUTER 7 | new best trial 24 (mean inner r=0.2278) saved to outputs/final_results/e6_pc_ridge_avggrm/thr_wing/e6_pc_ridge_avggrm_thr_wing_best_trials/split_07_best_trial.json
2026-06-01 01:05:48 | INFO | src.nested_cv_avggrm_weighted_unified | Trial 25 | outer=7 | alpha=2.916e+04 n_pcs=4500 (pc_topk) weight_search=on
2026-06-01 01:05:48 | INFO | src.nested_cv_avggrm_weighted_unified | Trial 25 | outer=7 | weight={'name': 'linear', 'floor': 1e-06, 'clip_max': 10.0, 'min_weight': 0.30154560746365755, 'max_weight': 1.900699345535369}
[I 2026-06-01 01:05:55,215] Trial 25 finished with value: 0.2272930283246935 and parameters: {'alpha': 29163.829775901504, 'n_pcs': 4500, 'weight_scheme': 'linear', 'weight_clip_max': 10.0, 'weight_linear_min_weight': 0.30154560746365755, 'weight_linear_max_weight': 1.900699345535369}. Best is trial 24 with value: 0.22783933822232294.
2026-06-01 01:05:55 | INFO | src.nested_cv_avggrm_weighted_unified | Trial 26 | outer=7 | alpha=7.138e+03 n_pcs=4500 (pc_topk) weight_search=on
2026-06-01 01:05:55 | INFO | src.nested_cv_avggrm_weighted_unified | Trial 26 | outer=7 | weight={'name': 'linear', 'floor': 1e-06, 'clip_max': 10.0, 'min_weight': 0.28605345945467847, 'max_weight': 2.0776351707661544}
[I 2026-06-01 01:06:02,062] Trial 26 finished with value: 0.20735733648232624 and parameters: {'alpha': 7137.803057774156, 'n_pcs': 4500, 'weight_scheme': 'linear', 'weight_clip_max': 10.0, 'weight_linear_min_weight': 0.28605345945467847, 'weight_linear_max_weight': 2.0776351707661544}. Best is trial 24 with value: 0.22783933822232294.
2026-06-01 01:06:02 | INFO | src.nested_cv_avggrm_weighted_unified | Trial 27 | outer=7 | alpha=3.886e+03 n_pcs=5000 (pc_topk) weight_search=on
2026-06-01 01:06:02 | INFO | src.nested_cv_avggrm_weighted_unified | Trial 27 | outer=7 | weight={'name': 'uniform', 'floor': 1e-06, 'clip_max': 10.0}
[I 2026-06-01 01:06:09,207] Trial 27 finished with value: 0.19264572153731893 and parameters: {'alpha': 3886.036589206813, 'n_pcs': 5000, 'weight_scheme': 'uniform', 'weight_clip_max': 10.0}. Best is trial 24 with value: 0.22783933822232294.
2026-06-01 01:06:09 | INFO | src.nested_cv_avggrm_weighted_unified | Trial 28 | outer=7 | alpha=1.234e+04 n_pcs=4500 (pc_topk) weight_search=on
2026-06-01 01:06:09 | INFO | src.nested_cv_avggrm_weighted_unified | Trial 28 | outer=7 | weight={'name': 'linear', 'floor': 1e-06, 'clip_max': 10.0, 'min_weight': 0.2721353900006627, 'max_weight': 2.122322402987006}
[I 2026-06-01 01:06:16,046] Trial 28 finished with value: 0.21840282116109053 and parameters: {'alpha': 12338.468054473582, 'n_pcs': 4500, 'weight_scheme': 'linear', 'weight_clip_max': 10.0, 'weight_linear_min_weight': 0.2721353900006627, 'weight_linear_max_weight': 2.122322402987006}. Best is trial 24 with value: 0.22783933822232294.
2026-06-01 01:06:16 | INFO | src.nested_cv_avggrm_weighted_unified | Trial 29 | outer=7 | alpha=3.091e+04 n_pcs=3500 (pc_topk) weight_search=on
2026-06-01 01:06:16 | INFO | src.nested_cv_avggrm_weighted_unified | Trial 29 | outer=7 | weight={'name': 'uniform', 'floor': 1e-06, 'clip_max': 10.0}
[I 2026-06-01 01:06:20,296] Trial 29 finished with value: 0.21431059737819697 and parameters: {'alpha': 30907.967857194843, 'n_pcs': 3500, 'weight_scheme': 'uniform', 'weight_clip_max': 10.0}. Best is trial 24 with value: 0.22783933822232294.
2026-06-01 01:06:20 | INFO | src.nested_cv_avggrm_weighted_unified | Trial 30 | outer=7 | alpha=4.342e+04 n_pcs=4000 (pc_topk) weight_search=on
2026-06-01 01:06:20 | INFO | src.nested_cv_avggrm_weighted_unified | Trial 30 | outer=7 | weight={'name': 'linear', 'floor': 1e-06, 'clip_max': 20.0, 'min_weight': 0.2984286598940332, 'max_weight': 2.160772677107655}
[I 2026-06-01 01:06:26,169] Trial 30 finished with value: 0.22806106584879013 and parameters: {'alpha': 43416.153441282804, 'n_pcs': 4000, 'weight_scheme': 'linear', 'weight_clip_max': 20.0, 'weight_linear_min_weight': 0.2984286598940332, 'weight_linear_max_weight': 2.160772677107655}. Best is trial 30 with value: 0.22806106584879013.
2026-06-01 01:06:26 | INFO | src.nested_cv_avggrm_weighted_unified | OUTER 7 | new best trial 30 (mean inner r=0.2281) saved to outputs/final_results/e6_pc_ridge_avggrm/thr_wing/e6_pc_ridge_avggrm_thr_wing_best_trials/split_07_best_trial.json
2026-06-01 01:06:26 | INFO | src.nested_cv_avggrm_weighted_unified | Trial 31 | outer=7 | alpha=4.463e+04 n_pcs=4000 (pc_topk) weight_search=on
2026-06-01 01:06:26 | INFO | src.nested_cv_avggrm_weighted_unified | Trial 31 | outer=7 | weight={'name': 'linear', 'floor': 1e-06, 'clip_max': 20.0, 'min_weight': 0.3020355792743935, 'max_weight': 2.0618096966893593}
[I 2026-06-01 01:06:32,298] Trial 31 finished with value: 0.22807563054512642 and parameters: {'alpha': 44627.265368586275, 'n_pcs': 4000, 'weight_scheme': 'linear', 'weight_clip_max': 20.0, 'weight_linear_min_weight': 0.3020355792743935, 'weight_linear_max_weight': 2.0618096966893593}. Best is trial 31 with value: 0.22807563054512642.
2026-06-01 01:06:32 | INFO | src.nested_cv_avggrm_weighted_unified | OUTER 7 | new best trial 31 (mean inner r=0.2281) saved to outputs/final_results/e6_pc_ridge_avggrm/thr_wing/e6_pc_ridge_avggrm_thr_wing_best_trials/split_07_best_trial.json
2026-06-01 01:06:32 | INFO | src.nested_cv_avggrm_weighted_unified | Trial 32 | outer=7 | alpha=1.589e+05 n_pcs=4000 (pc_topk) weight_search=on
2026-06-01 01:06:32 | INFO | src.nested_cv_avggrm_weighted_unified | Trial 32 | outer=7 | weight={'name': 'linear', 'floor': 1e-06, 'clip_max': 20.0, 'min_weight': 0.3322343842839358, 'max_weight': 2.400462805648299}
[I 2026-06-01 01:06:38,205] Trial 32 finished with value: 0.2230116461800476 and parameters: {'alpha': 158904.40971658294, 'n_pcs': 4000, 'weight_scheme': 'linear', 'weight_clip_max': 20.0, 'weight_linear_min_weight': 0.3322343842839358, 'weight_linear_max_weight': 2.400462805648299}. Best is trial 31 with value: 0.22807563054512642.
2026-06-01 01:06:38 | INFO | src.nested_cv_avggrm_weighted_unified | Trial 33 | outer=7 | alpha=5.206e+04 n_pcs=4000 (pc_topk) weight_search=on
2026-06-01 01:06:38 | INFO | src.nested_cv_avggrm_weighted_unified | Trial 33 | outer=7 | weight={'name': 'linear', 'floor': 1e-06, 'clip_max': 20.0, 'min_weight': 0.21399490904663038, 'max_weight': 1.4949209267105221}
[I 2026-06-01 01:06:43,915] Trial 33 finished with value: 0.22827371848223282 and parameters: {'alpha': 52064.417204518046, 'n_pcs': 4000, 'weight_scheme': 'linear', 'weight_clip_max': 20.0, 'weight_linear_min_weight': 0.21399490904663038, 'weight_linear_max_weight': 1.4949209267105221}. Best is trial 33 with value: 0.22827371848223282.
2026-06-01 01:06:43 | INFO | src.nested_cv_avggrm_weighted_unified | OUTER 7 | new best trial 33 (mean inner r=0.2283) saved to outputs/final_results/e6_pc_ridge_avggrm/thr_wing/e6_pc_ridge_avggrm_thr_wing_best_trials/split_07_best_trial.json
2026-06-01 01:06:43 | INFO | src.nested_cv_avggrm_weighted_unified | Trial 34 | outer=7 | alpha=6.705e+04 n_pcs=4000 (pc_topk) weight_search=on
2026-06-01 01:06:43 | INFO | src.nested_cv_avggrm_weighted_unified | Trial 34 | outer=7 | weight={'name': 'linear', 'floor': 1e-06, 'clip_max': 20.0, 'min_weight': 0.19257531092960356, 'max_weight': 1.0952282475606878}
[I 2026-06-01 01:06:50,146] Trial 34 finished with value: 0.2275679409247649 and parameters: {'alpha': 67049.95170376133, 'n_pcs': 4000, 'weight_scheme': 'linear', 'weight_clip_max': 20.0, 'weight_linear_min_weight': 0.19257531092960356, 'weight_linear_max_weight': 1.0952282475606878}. Best is trial 33 with value: 0.22827371848223282.
2026-06-01 01:06:50 | INFO | src.nested_cv_avggrm_weighted_unified | Trial 35 | outer=7 | alpha=4.982e+05 n_pcs=3000 (pc_topk) weight_search=on
2026-06-01 01:06:50 | INFO | src.nested_cv_avggrm_weighted_unified | Trial 35 | outer=7 | weight={'name': 'linear', 'floor': 1e-06, 'clip_max': 20.0, 'min_weight': 0.053371149670196794, 'max_weight': 1.6301166920117574}
[I 2026-06-01 01:06:53,897] Trial 35 finished with value: 0.21552856674263174 and parameters: {'alpha': 498174.57876427914, 'n_pcs': 3000, 'weight_scheme': 'linear', 'weight_clip_max': 20.0, 'weight_linear_min_weight': 0.053371149670196794, 'weight_linear_max_weight': 1.6301166920117574}. Best is trial 33 with value: 0.22827371848223282.
2026-06-01 01:06:53 | INFO | src.nested_cv_avggrm_weighted_unified | Trial 36 | outer=7 | alpha=2.862e+06 n_pcs=4000 (pc_topk) weight_search=on
2026-06-01 01:06:53 | INFO | src.nested_cv_avggrm_weighted_unified | Trial 36 | outer=7 | weight={'name': 'linear', 'floor': 1e-06, 'clip_max': 20.0, 'min_weight': 0.37239672891510656, 'max_weight': 1.424029754436671}
[I 2026-06-01 01:06:59,564] Trial 36 finished with value: 0.19683421411308552 and parameters: {'alpha': 2862256.14801237, 'n_pcs': 4000, 'weight_scheme': 'linear', 'weight_clip_max': 20.0, 'weight_linear_min_weight': 0.37239672891510656, 'weight_linear_max_weight': 1.424029754436671}. Best is trial 33 with value: 0.22827371848223282.
2026-06-01 01:06:59 | INFO | src.nested_cv_avggrm_weighted_unified | Trial 37 | outer=7 | alpha=8.161e+04 n_pcs=3500 (pc_topk) weight_search=on
2026-06-01 01:06:59 | INFO | src.nested_cv_avggrm_weighted_unified | Trial 37 | outer=7 | weight={'name': 'uniform', 'floor': 1e-06, 'clip_max': 20.0}
[I 2026-06-01 01:07:03,641] Trial 37 finished with value: 0.21321842199044197 and parameters: {'alpha': 81606.57557677203, 'n_pcs': 3500, 'weight_scheme': 'uniform', 'weight_clip_max': 20.0}. Best is trial 33 with value: 0.22827371848223282.
2026-06-01 01:07:03 | INFO | src.nested_cv_avggrm_weighted_unified | Trial 38 | outer=7 | alpha=4.683e+04 n_pcs=4000 (pc_topk) weight_search=on
2026-06-01 01:07:03 | INFO | src.nested_cv_avggrm_weighted_unified | Trial 38 | outer=7 | weight={'name': 'linear', 'floor': 1e-06, 'clip_max': 20.0, 'min_weight': 0.21938505916513584, 'max_weight': 2.321170078860331}
[I 2026-06-01 01:07:09,289] Trial 38 finished with value: 0.22840307880907104 and parameters: {'alpha': 46834.67312653244, 'n_pcs': 4000, 'weight_scheme': 'linear', 'weight_clip_max': 20.0, 'weight_linear_min_weight': 0.21938505916513584, 'weight_linear_max_weight': 2.321170078860331}. Best is trial 38 with value: 0.22840307880907104.
2026-06-01 01:07:09 | INFO | src.nested_cv_avggrm_weighted_unified | OUTER 7 | new best trial 38 (mean inner r=0.2284) saved to outputs/final_results/e6_pc_ridge_avggrm/thr_wing/e6_pc_ridge_avggrm_thr_wing_best_trials/split_07_best_trial.json
2026-06-01 01:07:09 | INFO | src.nested_cv_avggrm_weighted_unified | Trial 39 | outer=7 | alpha=1.644e+04 n_pcs=2500 (pc_topk) weight_search=on
2026-06-01 01:07:09 | INFO | src.nested_cv_avggrm_weighted_unified | Trial 39 | outer=7 | weight={'name': 'linear', 'floor': 1e-06, 'clip_max': 20.0, 'min_weight': 0.21732979826290882, 'max_weight': 1.7111094922183832}
[I 2026-06-01 01:07:12,672] Trial 39 finished with value: 0.19888146658867836 and parameters: {'alpha': 16437.949925337474, 'n_pcs': 2500, 'weight_scheme': 'linear', 'weight_clip_max': 20.0, 'weight_linear_min_weight': 0.21732979826290882, 'weight_linear_max_weight': 1.7111094922183832}. Best is trial 38 with value: 0.22840307880907104.
2026-06-01 01:07:12 | INFO | src.nested_cv_avggrm_weighted_unified | Trial 40 | outer=7 | alpha=5.377e+04 n_pcs=3000 (pc_topk) weight_search=on
2026-06-01 01:07:12 | INFO | src.nested_cv_avggrm_weighted_unified | Trial 40 | outer=7 | weight={'name': 'linear', 'floor': 1e-06, 'clip_max': 20.0, 'min_weight': 0.21354986784826244, 'max_weight': 2.4425865700875122}
[I 2026-06-01 01:07:16,607] Trial 40 finished with value: 0.2237596382901466 and parameters: {'alpha': 53774.41819690465, 'n_pcs': 3000, 'weight_scheme': 'linear', 'weight_clip_max': 20.0, 'weight_linear_min_weight': 0.21354986784826244, 'weight_linear_max_weight': 2.4425865700875122}. Best is trial 38 with value: 0.22840307880907104.
2026-06-01 01:07:16 | INFO | src.nested_cv_avggrm_weighted_unified | Trial 41 | outer=7 | alpha=4.267e+04 n_pcs=4000 (pc_topk) weight_search=on
2026-06-01 01:07:16 | INFO | src.nested_cv_avggrm_weighted_unified | Trial 41 | outer=7 | weight={'name': 'linear', 'floor': 1e-06, 'clip_max': 20.0, 'min_weight': 0.37348138095737116, 'max_weight': 2.2681866348179454}
[I 2026-06-01 01:07:22,225] Trial 41 finished with value: 0.22785460767017152 and parameters: {'alpha': 42673.52801352874, 'n_pcs': 4000, 'weight_scheme': 'linear', 'weight_clip_max': 20.0, 'weight_linear_min_weight': 0.37348138095737116, 'weight_linear_max_weight': 2.2681866348179454}. Best is trial 38 with value: 0.22840307880907104.
2026-06-01 01:07:22 | INFO | src.nested_cv_avggrm_weighted_unified | Trial 42 | outer=7 | alpha=1.444e+05 n_pcs=3500 (pc_topk) weight_search=on
2026-06-01 01:07:22 | INFO | src.nested_cv_avggrm_weighted_unified | Trial 42 | outer=7 | weight={'name': 'linear', 'floor': 1e-06, 'clip_max': 20.0, 'min_weight': 0.23233945127927416, 'max_weight': 2.3637588090763515}
[I 2026-06-01 01:07:27,083] Trial 42 finished with value: 0.22340281792435462 and parameters: {'alpha': 144446.99017292945, 'n_pcs': 3500, 'weight_scheme': 'linear', 'weight_clip_max': 20.0, 'weight_linear_min_weight': 0.23233945127927416, 'weight_linear_max_weight': 2.3637588090763515}. Best is trial 38 with value: 0.22840307880907104.
2026-06-01 01:07:27 | INFO | src.nested_cv_avggrm_weighted_unified | Trial 43 | outer=7 | alpha=3.870e+04 n_pcs=4000 (pc_topk) weight_search=on
2026-06-01 01:07:27 | INFO | src.nested_cv_avggrm_weighted_unified | Trial 43 | outer=7 | weight={'name': 'linear', 'floor': 1e-06, 'clip_max': 20.0, 'min_weight': 0.3822892139875972, 'max_weight': 1.9149400449079068}
[I 2026-06-01 01:07:32,792] Trial 43 finished with value: 0.22731726602934071 and parameters: {'alpha': 38703.95403703108, 'n_pcs': 4000, 'weight_scheme': 'linear', 'weight_clip_max': 20.0, 'weight_linear_min_weight': 0.3822892139875972, 'weight_linear_max_weight': 1.9149400449079068}. Best is trial 38 with value: 0.22840307880907104.
2026-06-01 01:07:32 | INFO | src.nested_cv_avggrm_weighted_unified | Trial 44 | outer=7 | alpha=1.309e+04 n_pcs=4000 (pc_topk) weight_search=on
2026-06-01 01:07:32 | INFO | src.nested_cv_avggrm_weighted_unified | Trial 44 | outer=7 | weight={'name': 'linear', 'floor': 1e-06, 'clip_max': 3.0, 'min_weight': 0.12213383782897119, 'max_weight': 1.4927307347679668}
[I 2026-06-01 01:07:38,410] Trial 44 finished with value: 0.21349662812812492 and parameters: {'alpha': 13089.333651741568, 'n_pcs': 4000, 'weight_scheme': 'linear', 'weight_clip_max': 3.0, 'weight_linear_min_weight': 0.12213383782897119, 'weight_linear_max_weight': 1.4927307347679668}. Best is trial 38 with value: 0.22840307880907104.
2026-06-01 01:07:38 | INFO | src.nested_cv_avggrm_weighted_unified | Trial 45 | outer=7 | alpha=6.724e+04 n_pcs=5000 (pc_topk) weight_search=on
2026-06-01 01:07:38 | INFO | src.nested_cv_avggrm_weighted_unified | Trial 45 | outer=7 | weight={'name': 'linear', 'floor': 1e-06, 'clip_max': 20.0, 'min_weight': 0.1369627636267723, 'max_weight': 1.9216913210784037}
[I 2026-06-01 01:07:46,412] Trial 45 finished with value: 0.22656415340946134 and parameters: {'alpha': 67237.82582600178, 'n_pcs': 5000, 'weight_scheme': 'linear', 'weight_clip_max': 20.0, 'weight_linear_min_weight': 0.1369627636267723, 'weight_linear_max_weight': 1.9216913210784037}. Best is trial 38 with value: 0.22840307880907104.
2026-06-01 01:07:46 | INFO | src.nested_cv_avggrm_weighted_unified | Trial 46 | outer=7 | alpha=4.773e+04 n_pcs=3500 (pc_topk) weight_search=on
2026-06-01 01:07:46 | INFO | src.nested_cv_avggrm_weighted_unified | Trial 46 | outer=7 | weight={'name': 'linear', 'floor': 1e-06, 'clip_max': 20.0, 'min_weight': 0.3544087768643764, 'max_weight': 2.5205111917949745}
[I 2026-06-01 01:07:51,442] Trial 46 finished with value: 0.22443583242020354 and parameters: {'alpha': 47733.49026506248, 'n_pcs': 3500, 'weight_scheme': 'linear', 'weight_clip_max': 20.0, 'weight_linear_min_weight': 0.3544087768643764, 'weight_linear_max_weight': 2.5205111917949745}. Best is trial 38 with value: 0.22840307880907104.
2026-06-01 01:07:51 | INFO | src.nested_cv_avggrm_weighted_unified | Trial 47 | outer=7 | alpha=2.091e+04 n_pcs=2500 (pc_topk) weight_search=on
2026-06-01 01:07:51 | INFO | src.nested_cv_avggrm_weighted_unified | Trial 47 | outer=7 | weight={'name': 'uniform', 'floor': 1e-06, 'clip_max': 20.0}
[I 2026-06-01 01:07:53,999] Trial 47 finished with value: 0.20055739504613185 and parameters: {'alpha': 20914.02646612334, 'n_pcs': 2500, 'weight_scheme': 'uniform', 'weight_clip_max': 20.0}. Best is trial 38 with value: 0.22840307880907104.
2026-06-01 01:07:54 | INFO | src.nested_cv_avggrm_weighted_unified | Trial 48 | outer=7 | alpha=1.249e+05 n_pcs=1500 (pc_topk) weight_search=on
2026-06-01 01:07:54 | INFO | src.nested_cv_avggrm_weighted_unified | Trial 48 | outer=7 | weight={'name': 'exponential', 'floor': 1e-06, 'clip_max': 20.0, 'beta': 2.9555353865157197}
[I 2026-06-01 01:07:56,083] Trial 48 finished with value: 0.21849382023725195 and parameters: {'alpha': 124875.0622682826, 'n_pcs': 1500, 'weight_scheme': 'exponential', 'weight_clip_max': 20.0, 'weight_exponential_beta': 2.9555353865157197}. Best is trial 38 with value: 0.22840307880907104.
2026-06-01 01:07:56 | INFO | src.nested_cv_avggrm_weighted_unified | Trial 49 | outer=7 | alpha=3.083e+05 n_pcs=3500 (pc_topk) weight_search=on
2026-06-01 01:07:56 | INFO | src.nested_cv_avggrm_weighted_unified | Trial 49 | outer=7 | weight={'name': 'linear', 'floor': 1e-06, 'clip_max': 3.0, 'min_weight': 0.17486788019088634, 'max_weight': 2.2338140597859826}
[I 2026-06-01 01:08:01,766] Trial 49 finished with value: 0.2182870008270854 and parameters: {'alpha': 308276.03775099537, 'n_pcs': 3500, 'weight_scheme': 'linear', 'weight_clip_max': 3.0, 'weight_linear_min_weight': 0.17486788019088634, 'weight_linear_max_weight': 2.2338140597859826}. Best is trial 38 with value: 0.22840307880907104.
2026-06-01 01:08:01 | INFO | src.nested_cv_avggrm_weighted_unified | Trial 50 | outer=7 | alpha=8.233e+03 n_pcs=3000 (pc_topk) weight_search=on
2026-06-01 01:08:01 | INFO | src.nested_cv_avggrm_weighted_unified | Trial 50 | outer=7 | weight={'name': 'linear', 'floor': 1e-06, 'clip_max': 20.0, 'min_weight': 0.08840520992130241, 'max_weight': 1.1479658113710518}
[I 2026-06-01 01:08:05,752] Trial 50 finished with value: 0.18232389876402075 and parameters: {'alpha': 8233.1228479446, 'n_pcs': 3000, 'weight_scheme': 'linear', 'weight_clip_max': 20.0, 'weight_linear_min_weight': 0.08840520992130241, 'weight_linear_max_weight': 1.1479658113710518}. Best is trial 38 with value: 0.22840307880907104.
2026-06-01 01:08:05 | INFO | src.nested_cv_avggrm_weighted_unified | Trial 51 | outer=7 | alpha=4.097e+04 n_pcs=4000 (pc_topk) weight_search=on
2026-06-01 01:08:05 | INFO | src.nested_cv_avggrm_weighted_unified | Trial 51 | outer=7 | weight={'name': 'linear', 'floor': 1e-06, 'clip_max': 20.0, 'min_weight': 0.26126668046201396, 'max_weight': 2.1818536871618917}
[I 2026-06-01 01:08:11,588] Trial 51 finished with value: 0.2279613966057735 and parameters: {'alpha': 40969.76494978223, 'n_pcs': 4000, 'weight_scheme': 'linear', 'weight_clip_max': 20.0, 'weight_linear_min_weight': 0.26126668046201396, 'weight_linear_max_weight': 2.1818536871618917}. Best is trial 38 with value: 0.22840307880907104.
2026-06-01 01:08:11 | INFO | src.nested_cv_avggrm_weighted_unified | Trial 52 | outer=7 | alpha=4.505e+04 n_pcs=4000 (pc_topk) weight_search=on
2026-06-01 01:08:11 | INFO | src.nested_cv_avggrm_weighted_unified | Trial 52 | outer=7 | weight={'name': 'linear', 'floor': 1e-06, 'clip_max': 20.0, 'min_weight': 0.2531478163433398, 'max_weight': 3.285084006333667}
[I 2026-06-01 01:08:17,214] Trial 52 finished with value: 0.22830675211429474 and parameters: {'alpha': 45046.7287725612, 'n_pcs': 4000, 'weight_scheme': 'linear', 'weight_clip_max': 20.0, 'weight_linear_min_weight': 0.2531478163433398, 'weight_linear_max_weight': 3.285084006333667}. Best is trial 38 with value: 0.22840307880907104.
2026-06-01 01:08:17 | INFO | src.nested_cv_avggrm_weighted_unified | Trial 53 | outer=7 | alpha=7.510e+04 n_pcs=4000 (pc_topk) weight_search=on
2026-06-01 01:08:17 | INFO | src.nested_cv_avggrm_weighted_unified | Trial 53 | outer=7 | weight={'name': 'linear', 'floor': 1e-06, 'clip_max': 20.0, 'min_weight': 0.258998963071039, 'max_weight': 3.424110477468894}
