2026-06-01 13:02:29 | INFO | Loading data from NPZ: Data/npz/snp_thr_wing_ALL.npz
2026-06-01 13:02:38 | INFO | Loading GRM from RDS: Data/GRM/GRM_vanraden.rds
2026-06-01 13:02:48 | INFO | Filtered to 5633 samples from islands (codes->labels): 0->20, 1->22, 2->23, 3->24, 4->26, 5->27, 6->28, 7->33, 8->34, 9->35, 10->38, 11->60, 12->61, 13->63, 14->67 based on include_islands=[0, 1, 2, 3, 4, 5, 6, 7, 8, 9, 10, 11, 12, 13, 14]
2026-06-01 13:05:28 | INFO | feature_pca: fit PCA on (n=5633, p=65344) -> r=5000 in 159.9s (cumvar=0.9881, standardize=False)
2026-06-01 13:05:28 | INFO | Using PC features for ridge: r_fit=5000 (cumvar=0.9881). Trials will pick top-k PCs from this set.
2026-06-01 13:05:28 | INFO | OUTER 1: test_size=118 island=0 (Nesøy)
2026-06-01 13:05:28 | INFO | OUTER 1: using top 10 related inner validation islands for tuning: 1(Myken, avgGRM=0.0066), 5(Hestmannøy, avgGRM=0.0045), 4(Gjerøy, avgGRM=0.0039), 3(Selvær, avgGRM=0.0033), 2(Træna, avgGRM=0.0030), 7(Onøy og Lurøy, avgGRM=0.0025), 8(Lovund, avgGRM=0.0024), 6(Indre Kvarøy, avgGRM=0.0016), 9(Sleneset, avgGRM=0.0013), 10(Aldra, avgGRM=-0.0006)
[I 2026-06-01 13:05:28,549] A new study created in memory with name: ridge_importance_inner_outer0
2026-06-01 13:05:28 | INFO | Trial 0 | outer=1 | alpha=1.137e+05 n_pcs=4000 (pc_topk) weight={'name': 'uniform'}
[I 2026-06-01 13:05:35,704] Trial 0 finished with value: 0.23917337977817446 and parameters: {'alpha': 113703.38004442609, 'n_pcs': 4000, 'iw_method': 'uniform'}. Best is trial 0 with value: 0.23917337977817446.
2026-06-01 13:05:35 | INFO | Trial 1 | outer=1 | alpha=1.734e+04 n_pcs=5000 (pc_topk) weight={'name': 'uniform'}
[I 2026-06-01 13:05:46,008] Trial 1 finished with value: 0.24119050700322645 and parameters: {'alpha': 17335.792577698634, 'n_pcs': 5000, 'iw_method': 'uniform'}. Best is trial 1 with value: 0.24119050700322645.
2026-06-01 13:05:46 | INFO | Trial 2 | outer=1 | alpha=1.435e+05 n_pcs=1500 (pc_topk) weight={'name': 'uniform'}
[I 2026-06-01 13:05:48,976] Trial 2 finished with value: 0.2267262469123091 and parameters: {'alpha': 143482.76912965564, 'n_pcs': 1500, 'iw_method': 'uniform'}. Best is trial 1 with value: 0.24119050700322645.
2026-06-01 13:05:48 | INFO | Trial 3 | outer=1 | alpha=1.431e+05 n_pcs=500 (pc_topk) weight={'name': 'uniform'}
[I 2026-06-01 13:05:49,832] Trial 3 finished with value: 0.19389298750508716 and parameters: {'alpha': 143072.2464444983, 'n_pcs': 500, 'iw_method': 'uniform'}. Best is trial 1 with value: 0.24119050700322645.
2026-06-01 13:05:49 | INFO | Trial 4 | outer=1 | alpha=5.373e+06 n_pcs=2000 (pc_topk) weight={'name': 'pc_logistic', 'floor': 1e-06, 'clip_max': 1.5, 'prob_clip': 0.001637400317167702, 'n_components': 80, 'logistic_c': 0.09386700500068379, 'pca_fit': 'combined', 'solver': 'lbfgs', 'max_iter': 2000, 'fit_intercept': True, 'standardize_with_source': True, 'rho': 1.0}
[I 2026-06-01 13:06:10,632] Trial 4 finished with value: 0.21310490751655964 and parameters: {'alpha': 5373167.4046281455, 'n_pcs': 2000, 'iw_method': 'pc_logistic', 'iw_clip_max': 1.5, 'iw_prob_clip': 0.001637400317167702, 'iw_n_components': 80, 'iw_logistic_c': 0.09386700500068379, 'iw_pca_fit': 'combined', 'iw_solver': 'lbfgs', 'iw_rho': 1.0}. Best is trial 1 with value: 0.24119050700322645.
2026-06-01 13:06:10 | INFO | Trial 5 | outer=1 | alpha=6.435e+04 n_pcs=1000 (pc_topk) weight={'name': 'pc_logistic', 'floor': 1e-06, 'clip_max': 7.0, 'prob_clip': 0.004193356127903791, 'n_components': 20, 'logistic_c': 9.236417519010976, 'pca_fit': 'combined', 'solver': 'lbfgs', 'max_iter': 2000, 'fit_intercept': True, 'standardize_with_source': True, 'rho': 1.0}
2026-06-01 13:06:19 | INFO | Trial 5 rejected by ESS guard: mean_ess=866.26 threshold=1037.68
[I 2026-06-01 13:06:19,613] Trial 5 finished with value: -1.0 and parameters: {'alpha': 64350.09539177312, 'n_pcs': 1000, 'iw_method': 'pc_logistic', 'iw_clip_max': 7.0, 'iw_prob_clip': 0.004193356127903791, 'iw_n_components': 20, 'iw_logistic_c': 9.236417519010976, 'iw_pca_fit': 'combined', 'iw_solver': 'lbfgs', 'iw_rho': 1.0}. Best is trial 1 with value: 0.24119050700322645.
2026-06-01 13:06:19 | INFO | Trial 6 | outer=1 | alpha=3.046e+05 n_pcs=3500 (pc_topk) weight={'name': 'pc_logistic', 'floor': 1e-06, 'clip_max': 12.0, 'prob_clip': 0.0007016380040663315, 'n_components': 80, 'logistic_c': 0.00021908930989278453, 'pca_fit': 'combined', 'solver': 'lbfgs', 'max_iter': 2000, 'fit_intercept': True, 'standardize_with_source': True, 'rho': 0.7}
[I 2026-06-01 13:06:32,942] Trial 6 finished with value: 0.23976105869363443 and parameters: {'alpha': 304631.0485153137, 'n_pcs': 3500, 'iw_method': 'pc_logistic', 'iw_clip_max': 12.0, 'iw_prob_clip': 0.0007016380040663315, 'iw_n_components': 80, 'iw_logistic_c': 0.00021908930989278453, 'iw_pca_fit': 'combined', 'iw_solver': 'lbfgs', 'iw_rho': 0.7}. Best is trial 1 with value: 0.24119050700322645.
2026-06-01 13:06:32 | INFO | Trial 7 | outer=1 | alpha=7.213e+06 n_pcs=500 (pc_topk) weight={'name': 'uniform'}
[I 2026-06-01 13:06:33,876] Trial 7 finished with value: 0.18277890507045252 and parameters: {'alpha': 7213019.60957054, 'n_pcs': 500, 'iw_method': 'uniform'}. Best is trial 1 with value: 0.24119050700322645.
2026-06-01 13:06:33 | INFO | Trial 8 | outer=1 | alpha=2.347e+03 n_pcs=3000 (pc_topk) weight={'name': 'pc_logistic', 'floor': 1e-06, 'clip_max': 2.5, 'prob_clip': 0.017782866059784724, 'n_components': 60, 'logistic_c': 4.584813955429537e-07, 'pca_fit': 'combined', 'solver': 'lbfgs', 'max_iter': 2000, 'fit_intercept': True, 'standardize_with_source': True, 'rho': 0.3}
[I 2026-06-01 13:06:43,244] Trial 8 finished with value: 0.14805197406952192 and parameters: {'alpha': 2346.6230871488538, 'n_pcs': 3000, 'iw_method': 'pc_logistic', 'iw_clip_max': 2.5, 'iw_prob_clip': 0.017782866059784724, 'iw_n_components': 60, 'iw_logistic_c': 4.584813955429537e-07, 'iw_pca_fit': 'combined', 'iw_solver': 'lbfgs', 'iw_rho': 0.3}. Best is trial 1 with value: 0.24119050700322645.
2026-06-01 13:06:43 | INFO | Trial 9 | outer=1 | alpha=1.067e+03 n_pcs=4000 (pc_topk) weight={'name': 'pc_logistic', 'floor': 1e-06, 'clip_max': 4.0, 'prob_clip': 0.003002704300062754, 'n_components': 10, 'logistic_c': 4.32601466983518e-06, 'pca_fit': 'combined', 'solver': 'lbfgs', 'max_iter': 2000, 'fit_intercept': True, 'standardize_with_source': True, 'rho': 1.0}
[I 2026-06-01 13:06:56,562] Trial 9 finished with value: 0.13403391779462018 and parameters: {'alpha': 1067.2105048492429, 'n_pcs': 4000, 'iw_method': 'pc_logistic', 'iw_clip_max': 4.0, 'iw_prob_clip': 0.003002704300062754, 'iw_n_components': 10, 'iw_logistic_c': 4.32601466983518e-06, 'iw_pca_fit': 'combined', 'iw_solver': 'lbfgs', 'iw_rho': 1.0}. Best is trial 1 with value: 0.24119050700322645.
2026-06-01 13:06:56 | INFO | Trial 10 | outer=1 | alpha=1.150e+04 n_pcs=5000 (pc_topk) weight={'name': 'uniform'}
[I 2026-06-01 13:07:06,810] Trial 10 finished with value: 0.2358640035298838 and parameters: {'alpha': 11501.099698953694, 'n_pcs': 5000, 'iw_method': 'uniform'}. Best is trial 1 with value: 0.24119050700322645.
2026-06-01 13:07:06 | INFO | Trial 11 | outer=1 | alpha=1.199e+06 n_pcs=5000 (pc_topk) weight={'name': 'pc_logistic', 'floor': 1e-06, 'clip_max': 12.0, 'prob_clip': 0.0007158490266448297, 'n_components': 80, 'logistic_c': 0.00047345791522711923, 'pca_fit': 'combined', 'solver': 'lbfgs', 'max_iter': 2000, 'fit_intercept': True, 'standardize_with_source': True, 'rho': 0.7}
[I 2026-06-01 13:07:27,829] Trial 11 finished with value: 0.22605809671244756 and parameters: {'alpha': 1199098.4863751335, 'n_pcs': 5000, 'iw_method': 'pc_logistic', 'iw_clip_max': 12.0, 'iw_prob_clip': 0.0007158490266448297, 'iw_n_components': 80, 'iw_logistic_c': 0.00047345791522711923, 'iw_pca_fit': 'combined', 'iw_solver': 'lbfgs', 'iw_rho': 0.7}. Best is trial 1 with value: 0.24119050700322645.
2026-06-01 13:07:27 | INFO | Trial 12 | outer=1 | alpha=1.651e+04 n_pcs=3500 (pc_topk) weight={'name': 'pc_logistic', 'floor': 1e-06, 'clip_max': 12.0, 'prob_clip': 0.0005593063313063697, 'n_components': 100, 'logistic_c': 0.00045106102832414717, 'pca_fit': 'combined', 'solver': 'lbfgs', 'max_iter': 2000, 'fit_intercept': True, 'standardize_with_source': True, 'rho': 0.5}
[I 2026-06-01 13:07:43,284] Trial 12 finished with value: 0.22465290977304742 and parameters: {'alpha': 16513.01867784095, 'n_pcs': 3500, 'iw_method': 'pc_logistic', 'iw_clip_max': 12.0, 'iw_prob_clip': 0.0005593063313063697, 'iw_n_components': 100, 'iw_logistic_c': 0.00045106102832414717, 'iw_pca_fit': 'combined', 'iw_solver': 'lbfgs', 'iw_rho': 0.5}. Best is trial 1 with value: 0.24119050700322645.
2026-06-01 13:07:43 | INFO | Trial 13 | outer=1 | alpha=7.725e+05 n_pcs=2500 (pc_topk) weight={'name': 'uniform'}
[I 2026-06-01 13:07:47,789] Trial 13 finished with value: 0.21713024436627587 and parameters: {'alpha': 772521.7668112898, 'n_pcs': 2500, 'iw_method': 'uniform'}. Best is trial 1 with value: 0.24119050700322645.
2026-06-01 13:07:47 | INFO | Trial 14 | outer=1 | alpha=1.792e+04 n_pcs=4500 (pc_topk) weight={'name': 'pc_logistic', 'floor': 1e-06, 'clip_max': 12.0, 'prob_clip': 0.01473817737520998, 'n_components': 40, 'logistic_c': 3.191202215750811e-05, 'pca_fit': 'combined', 'solver': 'lbfgs', 'max_iter': 2000, 'fit_intercept': True, 'standardize_with_source': True, 'rho': 0.7}
[I 2026-06-01 13:08:03,314] Trial 14 finished with value: 0.2421870687738727 and parameters: {'alpha': 17920.618967560844, 'n_pcs': 4500, 'iw_method': 'pc_logistic', 'iw_clip_max': 12.0, 'iw_prob_clip': 0.01473817737520998, 'iw_n_components': 40, 'iw_logistic_c': 3.191202215750811e-05, 'iw_pca_fit': 'combined', 'iw_solver': 'lbfgs', 'iw_rho': 0.7}. Best is trial 14 with value: 0.2421870687738727.
2026-06-01 13:08:03 | INFO | Trial 15 | outer=1 | alpha=1.723e+04 n_pcs=4500 (pc_topk) weight={'name': 'uniform'}
[I 2026-06-01 13:08:12,091] Trial 15 finished with value: 0.241253385705255 and parameters: {'alpha': 17228.29982979997, 'n_pcs': 4500, 'iw_method': 'uniform'}. Best is trial 14 with value: 0.2421870687738727.
2026-06-01 13:08:12 | INFO | Trial 16 | outer=1 | alpha=5.637e+03 n_pcs=4500 (pc_topk) weight={'name': 'uniform'}
[I 2026-06-01 13:08:20,748] Trial 16 finished with value: 0.21533375425701712 and parameters: {'alpha': 5636.553639398155, 'n_pcs': 4500, 'iw_method': 'uniform'}. Best is trial 14 with value: 0.2421870687738727.
2026-06-01 13:08:20 | INFO | Trial 17 | outer=1 | alpha=3.641e+04 n_pcs=4000 (pc_topk) weight={'name': 'pc_logistic', 'floor': 1e-06, 'clip_max': 7.0, 'prob_clip': 0.03337712720521348, 'n_components': 40, 'logistic_c': 8.281683443089995e-06, 'pca_fit': 'combined', 'solver': 'lbfgs', 'max_iter': 2000, 'fit_intercept': True, 'standardize_with_source': True, 'rho': 0.85}
[I 2026-06-01 13:08:34,949] Trial 17 finished with value: 0.24850844043105055 and parameters: {'alpha': 36411.74696869292, 'n_pcs': 4000, 'iw_method': 'pc_logistic', 'iw_clip_max': 7.0, 'iw_prob_clip': 0.03337712720521348, 'iw_n_components': 40, 'iw_logistic_c': 8.281683443089995e-06, 'iw_pca_fit': 'combined', 'iw_solver': 'lbfgs', 'iw_rho': 0.85}. Best is trial 17 with value: 0.24850844043105055.
2026-06-01 13:08:34 | INFO | Trial 18 | outer=1 | alpha=4.128e+04 n_pcs=3000 (pc_topk) weight={'name': 'pc_logistic', 'floor': 1e-06, 'clip_max': 7.0, 'prob_clip': 0.042441587678024965, 'n_components': 40, 'logistic_c': 1.386563881518709e-05, 'pca_fit': 'combined', 'solver': 'lbfgs', 'max_iter': 2000, 'fit_intercept': True, 'standardize_with_source': True, 'rho': 0.85}
[I 2026-06-01 13:08:45,628] Trial 18 finished with value: 0.24162614193893198 and parameters: {'alpha': 41275.644714677655, 'n_pcs': 3000, 'iw_method': 'pc_logistic', 'iw_clip_max': 7.0, 'iw_prob_clip': 0.042441587678024965, 'iw_n_components': 40, 'iw_logistic_c': 1.386563881518709e-05, 'iw_pca_fit': 'combined', 'iw_solver': 'lbfgs', 'iw_rho': 0.85}. Best is trial 17 with value: 0.24850844043105055.
2026-06-01 13:08:45 | INFO | Trial 19 | outer=1 | alpha=5.106e+03 n_pcs=4000 (pc_topk) weight={'name': 'pc_logistic', 'floor': 1e-06, 'clip_max': 7.0, 'prob_clip': 0.014526263976174323, 'n_components': 40, 'logistic_c': 2.746050909780874e-07, 'pca_fit': 'combined', 'solver': 'lbfgs', 'max_iter': 2000, 'fit_intercept': True, 'standardize_with_source': True, 'rho': 0.85}
[I 2026-06-01 13:08:58,427] Trial 19 finished with value: 0.20407503735893134 and parameters: {'alpha': 5105.564542116895, 'n_pcs': 4000, 'iw_method': 'pc_logistic', 'iw_clip_max': 7.0, 'iw_prob_clip': 0.014526263976174323, 'iw_n_components': 40, 'iw_logistic_c': 2.746050909780874e-07, 'iw_pca_fit': 'combined', 'iw_solver': 'lbfgs', 'iw_rho': 0.85}. Best is trial 17 with value: 0.24850844043105055.
2026-06-01 13:08:58 | INFO | Trial 20 | outer=1 | alpha=4.090e+04 n_pcs=3500 (pc_topk) weight={'name': 'pc_logistic', 'floor': 1e-06, 'clip_max': 2.5, 'prob_clip': 0.014007859203797862, 'n_components': 40, 'logistic_c': 2.059131840020274e-05, 'pca_fit': 'combined', 'solver': 'lbfgs', 'max_iter': 2000, 'fit_intercept': True, 'standardize_with_source': True, 'rho': 0.7}
[I 2026-06-01 13:09:10,006] Trial 20 finished with value: 0.2489702549343213 and parameters: {'alpha': 40902.90362787918, 'n_pcs': 3500, 'iw_method': 'pc_logistic', 'iw_clip_max': 2.5, 'iw_prob_clip': 0.014007859203797862, 'iw_n_components': 40, 'iw_logistic_c': 2.059131840020274e-05, 'iw_pca_fit': 'combined', 'iw_solver': 'lbfgs', 'iw_rho': 0.7}. Best is trial 20 with value: 0.2489702549343213.
2026-06-01 13:09:10 | INFO | Trial 21 | outer=1 | alpha=3.770e+04 n_pcs=3500 (pc_topk) weight={'name': 'pc_logistic', 'floor': 1e-06, 'clip_max': 2.5, 'prob_clip': 0.01423550558280633, 'n_components': 40, 'logistic_c': 1.7502075769792983e-05, 'pca_fit': 'combined', 'solver': 'lbfgs', 'max_iter': 2000, 'fit_intercept': True, 'standardize_with_source': True, 'rho': 0.7}
[I 2026-06-01 13:09:22,214] Trial 21 finished with value: 0.24809057936508078 and parameters: {'alpha': 37698.71320060063, 'n_pcs': 3500, 'iw_method': 'pc_logistic', 'iw_clip_max': 2.5, 'iw_prob_clip': 0.01423550558280633, 'iw_n_components': 40, 'iw_logistic_c': 1.7502075769792983e-05, 'iw_pca_fit': 'combined', 'iw_solver': 'lbfgs', 'iw_rho': 0.7}. Best is trial 20 with value: 0.2489702549343213.
2026-06-01 13:09:22 | INFO | Trial 22 | outer=1 | alpha=4.286e+04 n_pcs=3500 (pc_topk) weight={'name': 'pc_logistic', 'floor': 1e-06, 'clip_max': 2.5, 'prob_clip': 0.0378135943625269, 'n_components': 40, 'logistic_c': 5.502285194615629e-06, 'pca_fit': 'combined', 'solver': 'lbfgs', 'max_iter': 2000, 'fit_intercept': True, 'standardize_with_source': True, 'rho': 0.7}
[I 2026-06-01 13:09:34,193] Trial 22 finished with value: 0.24485983438422015 and parameters: {'alpha': 42856.12678284478, 'n_pcs': 3500, 'iw_method': 'pc_logistic', 'iw_clip_max': 2.5, 'iw_prob_clip': 0.0378135943625269, 'iw_n_components': 40, 'iw_logistic_c': 5.502285194615629e-06, 'iw_pca_fit': 'combined', 'iw_solver': 'lbfgs', 'iw_rho': 0.7}. Best is trial 20 with value: 0.2489702549343213.
2026-06-01 13:09:34 | INFO | Trial 23 | outer=1 | alpha=3.567e+05 n_pcs=2500 (pc_topk) weight={'name': 'pc_logistic', 'floor': 1e-06, 'clip_max': 2.5, 'prob_clip': 0.008574876973780902, 'n_components': 40, 'logistic_c': 0.02309768950775249, 'pca_fit': 'combined', 'solver': 'lbfgs', 'max_iter': 2000, 'fit_intercept': True, 'standardize_with_source': True, 'rho': 0.85}
[I 2026-06-01 13:09:52,270] Trial 23 finished with value: 0.23937919423452722 and parameters: {'alpha': 356691.4632492415, 'n_pcs': 2500, 'iw_method': 'pc_logistic', 'iw_clip_max': 2.5, 'iw_prob_clip': 0.008574876973780902, 'iw_n_components': 40, 'iw_logistic_c': 0.02309768950775249, 'iw_pca_fit': 'combined', 'iw_solver': 'lbfgs', 'iw_rho': 0.85}. Best is trial 20 with value: 0.2489702549343213.
2026-06-01 13:09:52 | INFO | Trial 24 | outer=1 | alpha=5.003e+04 n_pcs=3000 (pc_topk) weight={'name': 'pc_logistic', 'floor': 1e-06, 'clip_max': 2.5, 'prob_clip': 0.025561570614423632, 'n_components': 40, 'logistic_c': 4.597061428390856e-05, 'pca_fit': 'combined', 'solver': 'lbfgs', 'max_iter': 2000, 'fit_intercept': True, 'standardize_with_source': True, 'rho': 0.7}
[I 2026-06-01 13:10:01,148] Trial 24 finished with value: 0.25025325981231206 and parameters: {'alpha': 50029.08386493828, 'n_pcs': 3000, 'iw_method': 'pc_logistic', 'iw_clip_max': 2.5, 'iw_prob_clip': 0.025561570614423632, 'iw_n_components': 40, 'iw_logistic_c': 4.597061428390856e-05, 'iw_pca_fit': 'combined', 'iw_solver': 'lbfgs', 'iw_rho': 0.7}. Best is trial 24 with value: 0.25025325981231206.
2026-06-01 13:10:01 | INFO | Trial 25 | outer=1 | alpha=2.758e+05 n_pcs=2000 (pc_topk) weight={'name': 'pc_logistic', 'floor': 1e-06, 'clip_max': 2.5, 'prob_clip': 0.030187701121214973, 'n_components': 40, 'logistic_c': 0.004556045627586126, 'pca_fit': 'combined', 'solver': 'lbfgs', 'max_iter': 2000, 'fit_intercept': True, 'standardize_with_source': True, 'rho': 0.3}
[I 2026-06-01 13:10:16,524] Trial 25 finished with value: 0.23621048198764236 and parameters: {'alpha': 275757.6185236786, 'n_pcs': 2000, 'iw_method': 'pc_logistic', 'iw_clip_max': 2.5, 'iw_prob_clip': 0.030187701121214973, 'iw_n_components': 40, 'iw_logistic_c': 0.004556045627586126, 'iw_pca_fit': 'combined', 'iw_solver': 'lbfgs', 'iw_rho': 0.3}. Best is trial 24 with value: 0.25025325981231206.
2026-06-01 13:10:16 | INFO | Trial 26 | outer=1 | alpha=6.348e+03 n_pcs=3000 (pc_topk) weight={'name': 'pc_logistic', 'floor': 1e-06, 'clip_max': 1.5, 'prob_clip': 0.02537343527900832, 'n_components': 20, 'logistic_c': 1.6546520379247774e-06, 'pca_fit': 'combined', 'solver': 'lbfgs', 'max_iter': 2000, 'fit_intercept': True, 'standardize_with_source': True, 'rho': 0.5}
[I 2026-06-01 13:10:26,973] Trial 26 finished with value: 0.1888175628262972 and parameters: {'alpha': 6348.170081967723, 'n_pcs': 3000, 'iw_method': 'pc_logistic', 'iw_clip_max': 1.5, 'iw_prob_clip': 0.02537343527900832, 'iw_n_components': 20, 'iw_logistic_c': 1.6546520379247774e-06, 'iw_pca_fit': 'combined', 'iw_solver': 'lbfgs', 'iw_rho': 0.5}. Best is trial 24 with value: 0.25025325981231206.
2026-06-01 13:10:26 | INFO | Trial 27 | outer=1 | alpha=6.428e+04 n_pcs=2500 (pc_topk) weight={'name': 'pc_logistic', 'floor': 1e-06, 'clip_max': 4.0, 'prob_clip': 0.008042279464042729, 'n_components': 100, 'logistic_c': 4.3709627269967526e-05, 'pca_fit': 'combined', 'solver': 'lbfgs', 'max_iter': 2000, 'fit_intercept': True, 'standardize_with_source': True, 'rho': 0.85}
[I 2026-06-01 13:10:36,661] Trial 27 finished with value: 0.2488715099829916 and parameters: {'alpha': 64282.95079764347, 'n_pcs': 2500, 'iw_method': 'pc_logistic', 'iw_clip_max': 4.0, 'iw_prob_clip': 0.008042279464042729, 'iw_n_components': 100, 'iw_logistic_c': 4.3709627269967526e-05, 'iw_pca_fit': 'combined', 'iw_solver': 'lbfgs', 'iw_rho': 0.85}. Best is trial 24 with value: 0.25025325981231206.
2026-06-01 13:10:36 | INFO | Trial 28 | outer=1 | alpha=6.972e+04 n_pcs=2500 (pc_topk) weight={'name': 'pc_logistic', 'floor': 1e-06, 'clip_max': 4.0, 'prob_clip': 0.0077036129327921555, 'n_components': 100, 'logistic_c': 7.364646783407585e-05, 'pca_fit': 'combined', 'solver': 'lbfgs', 'max_iter': 2000, 'fit_intercept': True, 'standardize_with_source': True, 'rho': 0.7}
[I 2026-06-01 13:10:46,637] Trial 28 finished with value: 0.24954599459714707 and parameters: {'alpha': 69715.40040715986, 'n_pcs': 2500, 'iw_method': 'pc_logistic', 'iw_clip_max': 4.0, 'iw_prob_clip': 0.0077036129327921555, 'iw_n_components': 100, 'iw_logistic_c': 7.364646783407585e-05, 'iw_pca_fit': 'combined', 'iw_solver': 'lbfgs', 'iw_rho': 0.7}. Best is trial 24 with value: 0.25025325981231206.
2026-06-01 13:10:46 | INFO | Trial 29 | outer=1 | alpha=1.279e+05 n_pcs=2000 (pc_topk) weight={'name': 'pc_logistic', 'floor': 1e-06, 'clip_max': 4.0, 'prob_clip': 0.007967167281394974, 'n_components': 100, 'logistic_c': 0.0001507708084730593, 'pca_fit': 'combined', 'solver': 'lbfgs', 'max_iter': 2000, 'fit_intercept': True, 'standardize_with_source': True, 'rho': 0.7}
[I 2026-06-01 13:10:57,286] Trial 29 finished with value: 0.2510587116895133 and parameters: {'alpha': 127870.2613791602, 'n_pcs': 2000, 'iw_method': 'pc_logistic', 'iw_clip_max': 4.0, 'iw_prob_clip': 0.007967167281394974, 'iw_n_components': 100, 'iw_logistic_c': 0.0001507708084730593, 'iw_pca_fit': 'combined', 'iw_solver': 'lbfgs', 'iw_rho': 0.7}. Best is trial 29 with value: 0.2510587116895133.
2026-06-01 13:10:57 | INFO | Trial 30 | outer=1 | alpha=9.917e+04 n_pcs=2000 (pc_topk) weight={'name': 'pc_logistic', 'floor': 1e-06, 'clip_max': 4.0, 'prob_clip': 0.007359213645192276, 'n_components': 100, 'logistic_c': 0.0001163176309416609, 'pca_fit': 'combined', 'solver': 'lbfgs', 'max_iter': 2000, 'fit_intercept': True, 'standardize_with_source': True, 'rho': 0.7}
[I 2026-06-01 13:11:07,733] Trial 30 finished with value: 0.250709389256364 and parameters: {'alpha': 99173.80828850767, 'n_pcs': 2000, 'iw_method': 'pc_logistic', 'iw_clip_max': 4.0, 'iw_prob_clip': 0.007359213645192276, 'iw_n_components': 100, 'iw_logistic_c': 0.0001163176309416609, 'iw_pca_fit': 'combined', 'iw_solver': 'lbfgs', 'iw_rho': 0.7}. Best is trial 29 with value: 0.2510587116895133.
2026-06-01 13:11:07 | INFO | Trial 31 | outer=1 | alpha=1.211e+05 n_pcs=2000 (pc_topk) weight={'name': 'pc_logistic', 'floor': 1e-06, 'clip_max': 4.0, 'prob_clip': 0.007159763669426219, 'n_components': 100, 'logistic_c': 0.00011481830887254837, 'pca_fit': 'combined', 'solver': 'lbfgs', 'max_iter': 2000, 'fit_intercept': True, 'standardize_with_source': True, 'rho': 0.7}
