[I 2026-05-31 23:35:36,222] Trial 26 pruned. 
2026-05-31 23:35:36 | INFO | src.nested_cv_avggrm_weighted_unified | Trial 27 | outer=3 | alpha=2.017e+05 n_pcs=2500 (pc_topk) weight_search=on
2026-05-31 23:35:36 | INFO | src.nested_cv_avggrm_weighted_unified | Trial 27 | outer=3 | weight={'name': 'linear', 'floor': 1e-06, 'clip_max': 3.0, 'min_weight': 0.33827183666893407, 'max_weight': 2.3802817288567977}
[I 2026-05-31 23:35:39,237] Trial 27 finished with value: 0.2070526881405498 and parameters: {'alpha': 201722.40415916237, 'n_pcs': 2500, 'weight_scheme': 'linear', 'weight_clip_max': 3.0, 'weight_linear_min_weight': 0.33827183666893407, 'weight_linear_max_weight': 2.3802817288567977}. Best is trial 18 with value: 0.20714176623289293.
2026-05-31 23:35:39 | INFO | src.nested_cv_avggrm_weighted_unified | Trial 28 | outer=3 | alpha=2.176e+05 n_pcs=1500 (pc_topk) weight_search=on
2026-05-31 23:35:39 | INFO | src.nested_cv_avggrm_weighted_unified | Trial 28 | outer=3 | weight={'name': 'exponential', 'floor': 1e-06, 'clip_max': 3.0, 'beta': 3.904005531020421}
2026-05-31 23:35:40 | INFO | src.nested_cv_avggrm_weighted_unified | Trial 28 | outer=3 | pruned after 6/10 inner folds (mean r=0.2092)
[I 2026-05-31 23:35:40,272] Trial 28 pruned. 
2026-05-31 23:35:40 | INFO | src.nested_cv_avggrm_weighted_unified | Trial 29 | outer=3 | alpha=1.012e+05 n_pcs=2500 (pc_topk) weight_search=on
2026-05-31 23:35:40 | INFO | src.nested_cv_avggrm_weighted_unified | Trial 29 | outer=3 | weight={'name': 'uniform', 'floor': 1e-06, 'clip_max': 3.0}
2026-05-31 23:35:41 | INFO | src.nested_cv_avggrm_weighted_unified | Trial 29 | outer=3 | pruned after 7/10 inner folds (mean r=0.2386)
[I 2026-05-31 23:35:41,922] Trial 29 pruned. 
2026-05-31 23:35:41 | INFO | src.nested_cv_avggrm_weighted_unified | Trial 30 | outer=3 | alpha=5.161e+05 n_pcs=500 (pc_topk) weight_search=on
2026-05-31 23:35:41 | INFO | src.nested_cv_avggrm_weighted_unified | Trial 30 | outer=3 | weight={'name': 'uniform', 'floor': 1e-06, 'clip_max': None}
2026-05-31 23:35:42 | INFO | src.nested_cv_avggrm_weighted_unified | Trial 30 | outer=3 | pruned after 5/10 inner folds (mean r=0.1464)
[I 2026-05-31 23:35:42,278] Trial 30 pruned. 
2026-05-31 23:35:42 | INFO | src.nested_cv_avggrm_weighted_unified | Trial 31 | outer=3 | alpha=5.575e+04 n_pcs=3000 (pc_topk) weight_search=on
2026-05-31 23:35:42 | INFO | src.nested_cv_avggrm_weighted_unified | Trial 31 | outer=3 | weight={'name': 'linear', 'floor': 1e-06, 'clip_max': 3.0, 'min_weight': 0.29025180166365583, 'max_weight': 2.4840661536455024}
2026-05-31 23:35:44 | INFO | src.nested_cv_avggrm_weighted_unified | Trial 31 | outer=3 | pruned after 7/10 inner folds (mean r=0.2394)
[I 2026-05-31 23:35:44,977] Trial 31 pruned. 
2026-05-31 23:35:44 | INFO | src.nested_cv_avggrm_weighted_unified | Trial 32 | outer=3 | alpha=8.098e+04 n_pcs=4000 (pc_topk) weight_search=on
2026-05-31 23:35:44 | INFO | src.nested_cv_avggrm_weighted_unified | Trial 32 | outer=3 | weight={'name': 'linear', 'floor': 1e-06, 'clip_max': 20.0, 'min_weight': 0.2929109625593876, 'max_weight': 2.1359637925309687}
[I 2026-05-31 23:35:50,659] Trial 32 finished with value: 0.20551003920838454 and parameters: {'alpha': 80981.30764782865, 'n_pcs': 4000, 'weight_scheme': 'linear', 'weight_clip_max': 20.0, 'weight_linear_min_weight': 0.2929109625593876, 'weight_linear_max_weight': 2.1359637925309687}. Best is trial 18 with value: 0.20714176623289293.
2026-05-31 23:35:50 | INFO | src.nested_cv_avggrm_weighted_unified | Trial 33 | outer=3 | alpha=1.631e+05 n_pcs=4500 (pc_topk) weight_search=on
2026-05-31 23:35:50 | INFO | src.nested_cv_avggrm_weighted_unified | Trial 33 | outer=3 | weight={'name': 'linear', 'floor': 1e-06, 'clip_max': 20.0, 'min_weight': 0.3135953889984739, 'max_weight': 2.194716844533418}
[I 2026-05-31 23:35:57,508] Trial 33 finished with value: 0.20566829624038818 and parameters: {'alpha': 163069.22304498137, 'n_pcs': 4500, 'weight_scheme': 'linear', 'weight_clip_max': 20.0, 'weight_linear_min_weight': 0.3135953889984739, 'weight_linear_max_weight': 2.194716844533418}. Best is trial 18 with value: 0.20714176623289293.
2026-05-31 23:35:57 | INFO | src.nested_cv_avggrm_weighted_unified | Trial 34 | outer=3 | alpha=1.766e+05 n_pcs=4500 (pc_topk) weight_search=on
2026-05-31 23:35:57 | INFO | src.nested_cv_avggrm_weighted_unified | Trial 34 | outer=3 | weight={'name': 'linear', 'floor': 1e-06, 'clip_max': 20.0, 'min_weight': 0.3125541343001084, 'max_weight': 1.9521845867343177}
[I 2026-05-31 23:36:04,353] Trial 34 finished with value: 0.20534072601218695 and parameters: {'alpha': 176590.04597988309, 'n_pcs': 4500, 'weight_scheme': 'linear', 'weight_clip_max': 20.0, 'weight_linear_min_weight': 0.3125541343001084, 'weight_linear_max_weight': 1.9521845867343177}. Best is trial 18 with value: 0.20714176623289293.
2026-05-31 23:36:04 | INFO | src.nested_cv_avggrm_weighted_unified | Trial 35 | outer=3 | alpha=8.976e+04 n_pcs=4500 (pc_topk) weight_search=on
2026-05-31 23:36:04 | INFO | src.nested_cv_avggrm_weighted_unified | Trial 35 | outer=3 | weight={'name': 'linear', 'floor': 1e-06, 'clip_max': 20.0, 'min_weight': 0.24735058940775828, 'max_weight': 2.4792475088016297}
[I 2026-05-31 23:36:11,180] Trial 35 finished with value: 0.20638515753766237 and parameters: {'alpha': 89760.97148042195, 'n_pcs': 4500, 'weight_scheme': 'linear', 'weight_clip_max': 20.0, 'weight_linear_min_weight': 0.24735058940775828, 'weight_linear_max_weight': 2.4792475088016297}. Best is trial 18 with value: 0.20714176623289293.
2026-05-31 23:36:11 | INFO | src.nested_cv_avggrm_weighted_unified | Trial 36 | outer=3 | alpha=2.668e+04 n_pcs=4500 (pc_topk) weight_search=on
2026-05-31 23:36:11 | INFO | src.nested_cv_avggrm_weighted_unified | Trial 36 | outer=3 | weight={'name': 'linear', 'floor': 1e-06, 'clip_max': 20.0, 'min_weight': 0.2097556242121606, 'max_weight': 2.6479330783074966}
2026-05-31 23:36:15 | INFO | src.nested_cv_avggrm_weighted_unified | Trial 36 | outer=3 | pruned after 7/10 inner folds (mean r=0.2305)
[I 2026-05-31 23:36:15,980] Trial 36 pruned. 
2026-05-31 23:36:15 | INFO | src.nested_cv_avggrm_weighted_unified | Trial 37 | outer=3 | alpha=9.832e+04 n_pcs=4500 (pc_topk) weight_search=on
2026-05-31 23:36:15 | INFO | src.nested_cv_avggrm_weighted_unified | Trial 37 | outer=3 | weight={'name': 'linear', 'floor': 1e-06, 'clip_max': 20.0, 'min_weight': 0.05615877254594309, 'max_weight': 2.3608832693907837}
2026-05-31 23:36:20 | INFO | src.nested_cv_avggrm_weighted_unified | Trial 37 | outer=3 | pruned after 6/10 inner folds (mean r=0.2175)
[I 2026-05-31 23:36:20,087] Trial 37 pruned. 
2026-05-31 23:36:20 | INFO | src.nested_cv_avggrm_weighted_unified | Trial 38 | outer=3 | alpha=7.071e+05 n_pcs=4000 (pc_topk) weight_search=on
2026-05-31 23:36:20 | INFO | src.nested_cv_avggrm_weighted_unified | Trial 38 | outer=3 | weight={'name': 'linear', 'floor': 1e-06, 'clip_max': 20.0, 'min_weight': 0.39351632262432823, 'max_weight': 1.2030933388910399}
2026-05-31 23:36:23 | INFO | src.nested_cv_avggrm_weighted_unified | Trial 38 | outer=3 | pruned after 6/10 inner folds (mean r=0.2168)
[I 2026-05-31 23:36:23,481] Trial 38 pruned. 
2026-05-31 23:36:23 | INFO | src.nested_cv_avggrm_weighted_unified | Trial 39 | outer=3 | alpha=2.631e+05 n_pcs=5000 (pc_topk) weight_search=on
2026-05-31 23:36:23 | INFO | src.nested_cv_avggrm_weighted_unified | Trial 39 | outer=3 | weight={'name': 'linear', 'floor': 1e-06, 'clip_max': 20.0, 'min_weight': 0.5758069391529337, 'max_weight': 2.844102669662755}
[I 2026-05-31 23:36:31,527] Trial 39 finished with value: 0.20252968966393264 and parameters: {'alpha': 263120.11916004383, 'n_pcs': 5000, 'weight_scheme': 'linear', 'weight_clip_max': 20.0, 'weight_linear_min_weight': 0.5758069391529337, 'weight_linear_max_weight': 2.844102669662755}. Best is trial 18 with value: 0.20714176623289293.
2026-05-31 23:36:31 | INFO | src.nested_cv_avggrm_weighted_unified | Trial 40 | outer=3 | alpha=1.419e+04 n_pcs=4500 (pc_topk) weight_search=on
2026-05-31 23:36:31 | INFO | src.nested_cv_avggrm_weighted_unified | Trial 40 | outer=3 | weight={'name': 'linear', 'floor': 1e-06, 'clip_max': 10.0, 'min_weight': 0.25011412929976007, 'max_weight': 3.302707334668073}
2026-05-31 23:36:36 | INFO | src.nested_cv_avggrm_weighted_unified | Trial 40 | outer=3 | pruned after 7/10 inner folds (mean r=0.2193)
[I 2026-05-31 23:36:36,329] Trial 40 pruned. 
2026-05-31 23:36:36 | INFO | src.nested_cv_avggrm_weighted_unified | Trial 41 | outer=3 | alpha=9.318e+04 n_pcs=4000 (pc_topk) weight_search=on
2026-05-31 23:36:36 | INFO | src.nested_cv_avggrm_weighted_unified | Trial 41 | outer=3 | weight={'name': 'linear', 'floor': 1e-06, 'clip_max': 20.0, 'min_weight': 0.3186738792455631, 'max_weight': 2.1558296367304255}
[I 2026-05-31 23:36:42,015] Trial 41 finished with value: 0.2057226572679381 and parameters: {'alpha': 93182.61152174523, 'n_pcs': 4000, 'weight_scheme': 'linear', 'weight_clip_max': 20.0, 'weight_linear_min_weight': 0.3186738792455631, 'weight_linear_max_weight': 2.1558296367304255}. Best is trial 18 with value: 0.20714176623289293.
2026-05-31 23:36:42 | INFO | src.nested_cv_avggrm_weighted_unified | Trial 42 | outer=3 | alpha=3.557e+04 n_pcs=4000 (pc_topk) weight_search=on
2026-05-31 23:36:42 | INFO | src.nested_cv_avggrm_weighted_unified | Trial 42 | outer=3 | weight={'name': 'linear', 'floor': 1e-06, 'clip_max': 20.0, 'min_weight': 0.37306554019735166, 'max_weight': 1.9015009062250559}
2026-05-31 23:36:45 | INFO | src.nested_cv_avggrm_weighted_unified | Trial 42 | outer=3 | pruned after 7/10 inner folds (mean r=0.2336)
[I 2026-05-31 23:36:45,991] Trial 42 pruned. 
2026-05-31 23:36:45 | INFO | src.nested_cv_avggrm_weighted_unified | Trial 43 | outer=3 | alpha=8.496e+04 n_pcs=5000 (pc_topk) weight_search=on
2026-05-31 23:36:46 | INFO | src.nested_cv_avggrm_weighted_unified | Trial 43 | outer=3 | weight={'name': 'linear', 'floor': 1e-06, 'clip_max': 20.0, 'min_weight': 0.19064806163448136, 'max_weight': 2.471465082087335}
2026-05-31 23:36:50 | INFO | src.nested_cv_avggrm_weighted_unified | Trial 43 | outer=3 | pruned after 6/10 inner folds (mean r=0.2163)
[I 2026-05-31 23:36:50,748] Trial 43 pruned. 
2026-05-31 23:36:50 | INFO | src.nested_cv_avggrm_weighted_unified | Trial 44 | outer=3 | alpha=1.543e+05 n_pcs=4500 (pc_topk) weight_search=on
2026-05-31 23:36:50 | INFO | src.nested_cv_avggrm_weighted_unified | Trial 44 | outer=3 | weight={'name': 'linear', 'floor': 1e-06, 'clip_max': 20.0, 'min_weight': 0.48137048297407575, 'max_weight': 2.6770335221290606}
[I 2026-05-31 23:36:57,605] Trial 44 finished with value: 0.20558277945041487 and parameters: {'alpha': 154299.67697864637, 'n_pcs': 4500, 'weight_scheme': 'linear', 'weight_clip_max': 20.0, 'weight_linear_min_weight': 0.48137048297407575, 'weight_linear_max_weight': 2.6770335221290606}. Best is trial 18 with value: 0.20714176623289293.
2026-05-31 23:36:57 | INFO | src.nested_cv_avggrm_weighted_unified | Trial 45 | outer=3 | alpha=3.288e+05 n_pcs=3500 (pc_topk) weight_search=on
2026-05-31 23:36:57 | INFO | src.nested_cv_avggrm_weighted_unified | Trial 45 | outer=3 | weight={'name': 'linear', 'floor': 1e-06, 'clip_max': None, 'min_weight': 0.3491767462099131, 'max_weight': 1.631222009168812}
[I 2026-05-31 23:37:02,420] Trial 45 finished with value: 0.20258011958203787 and parameters: {'alpha': 328753.1091939755, 'n_pcs': 3500, 'weight_scheme': 'linear', 'weight_clip_max': None, 'weight_linear_min_weight': 0.3491767462099131, 'weight_linear_max_weight': 1.631222009168812}. Best is trial 18 with value: 0.20714176623289293.
2026-05-31 23:37:02 | INFO | src.nested_cv_avggrm_weighted_unified | Trial 46 | outer=3 | alpha=4.486e+04 n_pcs=4000 (pc_topk) weight_search=on
2026-05-31 23:37:02 | INFO | src.nested_cv_avggrm_weighted_unified | Trial 46 | outer=3 | weight={'name': 'linear', 'floor': 1e-06, 'clip_max': 20.0, 'min_weight': 0.2339771648090122, 'max_weight': 2.0574283905777264}
2026-05-31 23:37:06 | INFO | src.nested_cv_avggrm_weighted_unified | Trial 46 | outer=3 | pruned after 7/10 inner folds (mean r=0.2366)
[I 2026-05-31 23:37:06,407] Trial 46 pruned. 
2026-05-31 23:37:06 | INFO | src.nested_cv_avggrm_weighted_unified | Trial 47 | outer=3 | alpha=6.870e+04 n_pcs=2000 (pc_topk) weight_search=on
2026-05-31 23:37:06 | INFO | src.nested_cv_avggrm_weighted_unified | Trial 47 | outer=3 | weight={'name': 'linear', 'floor': 1e-06, 'clip_max': 10.0, 'min_weight': 0.15202540599840697, 'max_weight': 2.2929966407271074}
2026-05-31 23:37:07 | INFO | src.nested_cv_avggrm_weighted_unified | Trial 47 | outer=3 | pruned after 6/10 inner folds (mean r=0.2046)
[I 2026-05-31 23:37:07,731] Trial 47 pruned. 
2026-05-31 23:37:07 | INFO | src.nested_cv_avggrm_weighted_unified | Trial 48 | outer=3 | alpha=2.118e+05 n_pcs=5000 (pc_topk) weight_search=on
2026-05-31 23:37:07 | INFO | src.nested_cv_avggrm_weighted_unified | Trial 48 | outer=3 | weight={'name': 'linear', 'floor': 1e-06, 'clip_max': 20.0, 'min_weight': 0.4422039834817614, 'max_weight': 3.0764366596449566}
[I 2026-05-31 23:37:15,778] Trial 48 finished with value: 0.2038762103067965 and parameters: {'alpha': 211809.61564621556, 'n_pcs': 5000, 'weight_scheme': 'linear', 'weight_clip_max': 20.0, 'weight_linear_min_weight': 0.4422039834817614, 'weight_linear_max_weight': 3.0764366596449566}. Best is trial 18 with value: 0.20714176623289293.
2026-05-31 23:37:15 | INFO | src.nested_cv_avggrm_weighted_unified | Trial 49 | outer=3 | alpha=1.292e+05 n_pcs=2500 (pc_topk) weight_search=on
2026-05-31 23:37:15 | INFO | src.nested_cv_avggrm_weighted_unified | Trial 49 | outer=3 | weight={'name': 'uniform', 'floor': 1e-06, 'clip_max': 20.0}
2026-05-31 23:37:17 | INFO | src.nested_cv_avggrm_weighted_unified | Trial 49 | outer=3 | pruned after 6/10 inner folds (mean r=0.2156)
[I 2026-05-31 23:37:17,185] Trial 49 pruned. 
2026-05-31 23:37:17 | INFO | src.nested_cv_avggrm_weighted_unified | Trial 50 | outer=3 | alpha=1.452e+04 n_pcs=3500 (pc_topk) weight_search=on
2026-05-31 23:37:17 | INFO | src.nested_cv_avggrm_weighted_unified | Trial 50 | outer=3 | weight={'name': 'linear', 'floor': 1e-06, 'clip_max': 10.0, 'min_weight': 0.05214814563872827, 'max_weight': 1.8183246521929926}
2026-05-31 23:37:20 | INFO | src.nested_cv_avggrm_weighted_unified | Trial 50 | outer=3 | pruned after 6/10 inner folds (mean r=0.1863)
[I 2026-05-31 23:37:20,112] Trial 50 pruned. 
2026-05-31 23:37:20 | INFO | src.nested_cv_avggrm_weighted_unified | Trial 51 | outer=3 | alpha=1.771e+05 n_pcs=4500 (pc_topk) weight_search=on
2026-05-31 23:37:20 | INFO | src.nested_cv_avggrm_weighted_unified | Trial 51 | outer=3 | weight={'name': 'linear', 'floor': 1e-06, 'clip_max': 20.0, 'min_weight': 0.46083720748735807, 'max_weight': 2.72773075990815}
[I 2026-05-31 23:37:26,953] Trial 51 finished with value: 0.20526758874575254 and parameters: {'alpha': 177094.98685163294, 'n_pcs': 4500, 'weight_scheme': 'linear', 'weight_clip_max': 20.0, 'weight_linear_min_weight': 0.46083720748735807, 'weight_linear_max_weight': 2.72773075990815}. Best is trial 18 with value: 0.20714176623289293.
2026-05-31 23:37:26 | INFO | src.nested_cv_avggrm_weighted_unified | Trial 52 | outer=3 | alpha=3.911e+05 n_pcs=4500 (pc_topk) weight_search=on
2026-05-31 23:37:26 | INFO | src.nested_cv_avggrm_weighted_unified | Trial 52 | outer=3 | weight={'name': 'linear', 'floor': 1e-06, 'clip_max': 20.0, 'min_weight': 0.5670282307624537, 'max_weight': 2.525146908334731}
[I 2026-05-31 23:37:33,783] Trial 52 finished with value: 0.2012724934947085 and parameters: {'alpha': 391095.71648080467, 'n_pcs': 4500, 'weight_scheme': 'linear', 'weight_clip_max': 20.0, 'weight_linear_min_weight': 0.5670282307624537, 'weight_linear_max_weight': 2.525146908334731}. Best is trial 18 with value: 0.20714176623289293.
2026-05-31 23:37:33 | INFO | src.nested_cv_avggrm_weighted_unified | Trial 53 | outer=3 | alpha=1.276e+05 n_pcs=4000 (pc_topk) weight_search=on
2026-05-31 23:37:33 | INFO | src.nested_cv_avggrm_weighted_unified | Trial 53 | outer=3 | weight={'name': 'linear', 'floor': 1e-06, 'clip_max': 20.0, 'min_weight': 0.3400771874703941, 'max_weight': 3.157034382466972}
[I 2026-05-31 23:37:39,459] Trial 53 finished with value: 0.20578590861643598 and parameters: {'alpha': 127642.50254158374, 'n_pcs': 4000, 'weight_scheme': 'linear', 'weight_clip_max': 20.0, 'weight_linear_min_weight': 0.3400771874703941, 'weight_linear_max_weight': 3.157034382466972}. Best is trial 18 with value: 0.20714176623289293.
2026-05-31 23:37:39 | INFO | src.nested_cv_avggrm_weighted_unified | Trial 54 | outer=3 | alpha=1.100e+03 n_pcs=4000 (pc_topk) weight_search=on
2026-05-31 23:37:39 | INFO | src.nested_cv_avggrm_weighted_unified | Trial 54 | outer=3 | weight={'name': 'linear', 'floor': 1e-06, 'clip_max': 20.0, 'min_weight': 0.3351553642679684, 'max_weight': 3.42394394986576}
2026-05-31 23:37:42 | INFO | src.nested_cv_avggrm_weighted_unified | Trial 54 | outer=3 | pruned after 5/10 inner folds (mean r=0.1284)
[I 2026-05-31 23:37:42,314] Trial 54 pruned. 
2026-05-31 23:37:42 | INFO | src.nested_cv_avggrm_weighted_unified | Trial 55 | outer=3 | alpha=5.672e+04 n_pcs=2500 (pc_topk) weight_search=on
2026-05-31 23:37:42 | INFO | src.nested_cv_avggrm_weighted_unified | Trial 55 | outer=3 | weight={'name': 'linear', 'floor': 1e-06, 'clip_max': 20.0, 'min_weight': 0.26784270262341203, 'max_weight': 2.9812065378290193}
2026-05-31 23:37:44 | INFO | src.nested_cv_avggrm_weighted_unified | Trial 55 | outer=3 | pruned after 7/10 inner folds (mean r=0.2355)
[I 2026-05-31 23:37:44,377] Trial 55 pruned. 
2026-05-31 23:37:44 | INFO | src.nested_cv_avggrm_weighted_unified | Trial 56 | outer=3 | alpha=3.838e+04 n_pcs=4000 (pc_topk) weight_search=on
2026-05-31 23:37:44 | INFO | src.nested_cv_avggrm_weighted_unified | Trial 56 | outer=3 | weight={'name': 'linear', 'floor': 1e-06, 'clip_max': 3.0, 'min_weight': 0.16181280532137166, 'max_weight': 3.782544606245182}
2026-05-31 23:37:48 | INFO | src.nested_cv_avggrm_weighted_unified | Trial 56 | outer=3 | pruned after 7/10 inner folds (mean r=0.2338)
[I 2026-05-31 23:37:48,369] Trial 56 pruned. 
2026-05-31 23:37:48 | INFO | src.nested_cv_avggrm_weighted_unified | Trial 57 | outer=3 | alpha=2.307e+05 n_pcs=3500 (pc_topk) weight_search=on
2026-05-31 23:37:48 | INFO | src.nested_cv_avggrm_weighted_unified | Trial 57 | outer=3 | weight={'name': 'linear', 'floor': 1e-06, 'clip_max': None, 'min_weight': 0.40773654415137245, 'max_weight': 2.9567221428052752}
[I 2026-05-31 23:37:53,144] Trial 57 finished with value: 0.2046907102790482 and parameters: {'alpha': 230746.0798376044, 'n_pcs': 3500, 'weight_scheme': 'linear', 'weight_clip_max': None, 'weight_linear_min_weight': 0.40773654415137245, 'weight_linear_max_weight': 2.9567221428052752}. Best is trial 18 with value: 0.20714176623289293.
2026-05-31 23:37:53 | INFO | src.nested_cv_avggrm_weighted_unified | Trial 58 | outer=3 | alpha=1.060e+05 n_pcs=2000 (pc_topk) weight_search=on
2026-05-31 23:37:53 | INFO | src.nested_cv_avggrm_weighted_unified | Trial 58 | outer=3 | weight={'name': 'exponential', 'floor': 1e-06, 'clip_max': 10.0, 'beta': 2.6733494032639222}
2026-05-31 23:37:54 | INFO | src.nested_cv_avggrm_weighted_unified | Trial 58 | outer=3 | pruned after 6/10 inner folds (mean r=0.2098)
[I 2026-05-31 23:37:54,465] Trial 58 pruned. 
2026-05-31 23:37:54 | INFO | src.nested_cv_avggrm_weighted_unified | Trial 59 | outer=3 | alpha=3.909e+03 n_pcs=5000 (pc_topk) weight_search=on
2026-05-31 23:37:54 | INFO | src.nested_cv_avggrm_weighted_unified | Trial 59 | outer=3 | weight={'name': 'uniform', 'floor': 1e-06, 'clip_max': 20.0}
2026-05-31 23:37:58 | INFO | src.nested_cv_avggrm_weighted_unified | Trial 59 | outer=3 | pruned after 6/10 inner folds (mean r=0.1764)
[I 2026-05-31 23:37:58,665] Trial 59 pruned. 
2026-05-31 23:37:58 | INFO | src.nested_cv_avggrm_weighted_unified | Trial 60 | outer=3 | alpha=7.228e+04 n_pcs=3000 (pc_topk) weight_search=on
2026-05-31 23:37:58 | INFO | src.nested_cv_avggrm_weighted_unified | Trial 60 | outer=3 | weight={'name': 'linear', 'floor': 1e-06, 'clip_max': 3.0, 'min_weight': 0.33224814614512826, 'max_weight': 2.295373248326504}
2026-05-31 23:38:01 | INFO | src.nested_cv_avggrm_weighted_unified | Trial 60 | outer=3 | pruned after 7/10 inner folds (mean r=0.2429)
[I 2026-05-31 23:38:01,328] Trial 60 pruned. 
2026-05-31 23:38:01 | INFO | src.nested_cv_avggrm_weighted_unified | Trial 61 | outer=3 | alpha=1.451e+05 n_pcs=4500 (pc_topk) weight_search=on
2026-05-31 23:38:01 | INFO | src.nested_cv_avggrm_weighted_unified | Trial 61 | outer=3 | weight={'name': 'linear', 'floor': 1e-06, 'clip_max': 20.0, 'min_weight': 0.4872752151209986, 'max_weight': 2.639150522492354}
[I 2026-05-31 23:38:08,154] Trial 61 finished with value: 0.20570887091378287 and parameters: {'alpha': 145053.15549955884, 'n_pcs': 4500, 'weight_scheme': 'linear', 'weight_clip_max': 20.0, 'weight_linear_min_weight': 0.4872752151209986, 'weight_linear_max_weight': 2.639150522492354}. Best is trial 18 with value: 0.20714176623289293.
2026-05-31 23:38:08 | INFO | src.nested_cv_avggrm_weighted_unified | Trial 62 | outer=3 | alpha=1.195e+05 n_pcs=4500 (pc_topk) weight_search=on
2026-05-31 23:38:08 | INFO | src.nested_cv_avggrm_weighted_unified | Trial 62 | outer=3 | weight={'name': 'linear', 'floor': 1e-06, 'clip_max': 20.0, 'min_weight': 0.5336874840756982, 'max_weight': 3.2141378767128748}
