[I 2026-06-01 00:13:44,700] Trial 262 finished with value: 0.19619515072206167 and parameters: {'alpha': 149088.49009107664, 'n_pcs': 4500, 'weight_scheme': 'linear', 'weight_clip_max': 10.0, 'weight_linear_min_weight': 0.49203230953629107, 'weight_linear_max_weight': 4.517029557127786}. Best is trial 41 with value: 0.19810774778548906.
2026-06-01 00:13:44 | INFO | src.nested_cv_avggrm_weighted_unified | Trial 263 | outer=4 | alpha=9.105e+04 n_pcs=4000 (pc_topk) weight_search=on
2026-06-01 00:13:44 | INFO | src.nested_cv_avggrm_weighted_unified | Trial 263 | outer=4 | weight={'name': 'linear', 'floor': 1e-06, 'clip_max': 10.0, 'min_weight': 0.42943480511139615, 'max_weight': 3.0300640997760597}
2026-06-01 00:13:48 | INFO | src.nested_cv_avggrm_weighted_unified | Trial 263 | outer=4 | pruned after 6/10 inner folds (mean r=0.2047)
[I 2026-06-01 00:13:48,163] Trial 263 pruned. 
2026-06-01 00:13:48 | INFO | src.nested_cv_avggrm_weighted_unified | Trial 264 | outer=4 | alpha=7.312e+04 n_pcs=4500 (pc_topk) weight_search=on
2026-06-01 00:13:48 | INFO | src.nested_cv_avggrm_weighted_unified | Trial 264 | outer=4 | weight={'name': 'linear', 'floor': 1e-06, 'clip_max': 10.0, 'min_weight': 0.3247864863546348, 'max_weight': 4.838308760083118}
2026-06-01 00:13:52 | INFO | src.nested_cv_avggrm_weighted_unified | Trial 264 | outer=4 | pruned after 6/10 inner folds (mean r=0.2033)
[I 2026-06-01 00:13:52,420] Trial 264 pruned. 
2026-06-01 00:13:52 | INFO | src.nested_cv_avggrm_weighted_unified | Trial 265 | outer=4 | alpha=1.119e+05 n_pcs=4500 (pc_topk) weight_search=on
2026-06-01 00:13:52 | INFO | src.nested_cv_avggrm_weighted_unified | Trial 265 | outer=4 | weight={'name': 'linear', 'floor': 1e-06, 'clip_max': 3.0, 'min_weight': 0.34794622513112405, 'max_weight': 3.395542373527236}
2026-06-01 00:13:56 | INFO | src.nested_cv_avggrm_weighted_unified | Trial 265 | outer=4 | pruned after 6/10 inner folds (mean r=0.2053)
[I 2026-06-01 00:13:56,632] Trial 265 pruned. 
2026-06-01 00:13:56 | INFO | src.nested_cv_avggrm_weighted_unified | Trial 266 | outer=4 | alpha=8.694e+04 n_pcs=1500 (pc_topk) weight_search=on
2026-06-01 00:13:56 | INFO | src.nested_cv_avggrm_weighted_unified | Trial 266 | outer=4 | weight={'name': 'linear', 'floor': 1e-06, 'clip_max': None, 'min_weight': 0.3897732601390719, 'max_weight': 3.503535789960852}
2026-06-01 00:13:57 | INFO | src.nested_cv_avggrm_weighted_unified | Trial 266 | outer=4 | pruned after 6/10 inner folds (mean r=0.1893)
[I 2026-06-01 00:13:57,697] Trial 266 pruned. 
2026-06-01 00:13:57 | INFO | src.nested_cv_avggrm_weighted_unified | Trial 267 | outer=4 | alpha=1.275e+05 n_pcs=5000 (pc_topk) weight_search=on
2026-06-01 00:13:57 | INFO | src.nested_cv_avggrm_weighted_unified | Trial 267 | outer=4 | weight={'name': 'linear', 'floor': 1e-06, 'clip_max': 10.0, 'min_weight': 0.4641329921837356, 'max_weight': 4.9917960328232045}
2026-06-01 00:14:02 | INFO | src.nested_cv_avggrm_weighted_unified | Trial 267 | outer=4 | pruned after 6/10 inner folds (mean r=0.2058)
[I 2026-06-01 00:14:02,630] Trial 267 pruned. 
2026-06-01 00:14:02 | INFO | src.nested_cv_avggrm_weighted_unified | Trial 268 | outer=4 | alpha=1.022e+05 n_pcs=4500 (pc_topk) weight_search=on
2026-06-01 00:14:02 | INFO | src.nested_cv_avggrm_weighted_unified | Trial 268 | outer=4 | weight={'name': 'linear', 'floor': 1e-06, 'clip_max': 10.0, 'min_weight': 0.3659690758500125, 'max_weight': 4.703917942478212}
2026-06-01 00:14:06 | INFO | src.nested_cv_avggrm_weighted_unified | Trial 268 | outer=4 | pruned after 6/10 inner folds (mean r=0.2060)
[I 2026-06-01 00:14:06,839] Trial 268 pruned. 
2026-06-01 00:14:06 | INFO | src.nested_cv_avggrm_weighted_unified | Trial 269 | outer=4 | alpha=5.385e+04 n_pcs=4500 (pc_topk) weight_search=on
2026-06-01 00:14:06 | INFO | src.nested_cv_avggrm_weighted_unified | Trial 269 | outer=4 | weight={'name': 'linear', 'floor': 1e-06, 'clip_max': 5.0, 'min_weight': 0.2921041902884374, 'max_weight': 2.930667004356792}
2026-06-01 00:14:11 | INFO | src.nested_cv_avggrm_weighted_unified | Trial 269 | outer=4 | pruned after 6/10 inner folds (mean r=0.2008)
[I 2026-06-01 00:14:11,053] Trial 269 pruned. 
2026-06-01 00:14:11 | INFO | src.nested_cv_avggrm_weighted_unified | Trial 270 | outer=4 | alpha=1.610e+05 n_pcs=4500 (pc_topk) weight_search=on
2026-06-01 00:14:11 | INFO | src.nested_cv_avggrm_weighted_unified | Trial 270 | outer=4 | weight={'name': 'linear', 'floor': 1e-06, 'clip_max': 10.0, 'min_weight': 0.4406251917004624, 'max_weight': 4.917484330160048}
[I 2026-06-01 00:14:18,044] Trial 270 finished with value: 0.19606819528237301 and parameters: {'alpha': 160976.71849525083, 'n_pcs': 4500, 'weight_scheme': 'linear', 'weight_clip_max': 10.0, 'weight_linear_min_weight': 0.4406251917004624, 'weight_linear_max_weight': 4.917484330160048}. Best is trial 41 with value: 0.19810774778548906.
2026-06-01 00:14:18 | INFO | src.nested_cv_avggrm_weighted_unified | Trial 271 | outer=4 | alpha=6.867e+04 n_pcs=4500 (pc_topk) weight_search=on
2026-06-01 00:14:18 | INFO | src.nested_cv_avggrm_weighted_unified | Trial 271 | outer=4 | weight={'name': 'linear', 'floor': 1e-06, 'clip_max': 10.0, 'min_weight': 0.5127934768802632, 'max_weight': 4.630212404442917}
2026-06-01 00:14:22 | INFO | src.nested_cv_avggrm_weighted_unified | Trial 271 | outer=4 | pruned after 6/10 inner folds (mean r=0.2034)
[I 2026-06-01 00:14:22,259] Trial 271 pruned. 
2026-06-01 00:14:22 | INFO | src.nested_cv_avggrm_weighted_unified | Trial 272 | outer=4 | alpha=8.636e+04 n_pcs=4500 (pc_topk) weight_search=on
2026-06-01 00:14:22 | INFO | src.nested_cv_avggrm_weighted_unified | Trial 272 | outer=4 | weight={'name': 'linear', 'floor': 1e-06, 'clip_max': None, 'min_weight': 0.39834271042692593, 'max_weight': 4.807766940470487}
2026-06-01 00:14:26 | INFO | src.nested_cv_avggrm_weighted_unified | Trial 272 | outer=4 | pruned after 6/10 inner folds (mean r=0.2049)
[I 2026-06-01 00:14:26,471] Trial 272 pruned. 
2026-06-01 00:14:26 | INFO | src.nested_cv_avggrm_weighted_unified | Trial 273 | outer=4 | alpha=1.105e+05 n_pcs=4500 (pc_topk) weight_search=on
2026-06-01 00:14:26 | INFO | src.nested_cv_avggrm_weighted_unified | Trial 273 | outer=4 | weight={'name': 'exponential', 'floor': 1e-06, 'clip_max': 10.0, 'beta': 6.228935855425943}
2026-06-01 00:14:30 | INFO | src.nested_cv_avggrm_weighted_unified | Trial 273 | outer=4 | pruned after 6/10 inner folds (mean r=0.1982)
[I 2026-06-01 00:14:30,673] Trial 273 pruned. 
2026-06-01 00:14:30 | INFO | src.nested_cv_avggrm_weighted_unified | Trial 274 | outer=4 | alpha=7.718e+04 n_pcs=4500 (pc_topk) weight_search=on
2026-06-01 00:14:30 | INFO | src.nested_cv_avggrm_weighted_unified | Trial 274 | outer=4 | weight={'name': 'linear', 'floor': 1e-06, 'clip_max': 10.0, 'min_weight': 0.4906243617609029, 'max_weight': 4.533275102373307}
2026-06-01 00:14:34 | INFO | src.nested_cv_avggrm_weighted_unified | Trial 274 | outer=4 | pruned after 6/10 inner folds (mean r=0.2043)
[I 2026-06-01 00:14:34,890] Trial 274 pruned. 
2026-06-01 00:14:34 | INFO | src.nested_cv_avggrm_weighted_unified | Trial 275 | outer=4 | alpha=1.409e+05 n_pcs=5000 (pc_topk) weight_search=on
2026-06-01 00:14:34 | INFO | src.nested_cv_avggrm_weighted_unified | Trial 275 | outer=4 | weight={'name': 'linear', 'floor': 1e-06, 'clip_max': 10.0, 'min_weight': 0.37437703247955495, 'max_weight': 4.720781055258472}
[I 2026-06-01 00:14:43,115] Trial 275 finished with value: 0.19565843187185364 and parameters: {'alpha': 140859.11200950338, 'n_pcs': 5000, 'weight_scheme': 'linear', 'weight_clip_max': 10.0, 'weight_linear_min_weight': 0.37437703247955495, 'weight_linear_max_weight': 4.720781055258472}. Best is trial 41 with value: 0.19810774778548906.
2026-06-01 00:14:43 | INFO | src.nested_cv_avggrm_weighted_unified | Trial 276 | outer=4 | alpha=9.733e+04 n_pcs=4500 (pc_topk) weight_search=on
2026-06-01 00:14:43 | INFO | src.nested_cv_avggrm_weighted_unified | Trial 276 | outer=4 | weight={'name': 'linear', 'floor': 1e-06, 'clip_max': 20.0, 'min_weight': 0.417720701936031, 'max_weight': 4.893992470646577}
2026-06-01 00:14:47 | INFO | src.nested_cv_avggrm_weighted_unified | Trial 276 | outer=4 | pruned after 6/10 inner folds (mean r=0.2058)
[I 2026-06-01 00:14:47,331] Trial 276 pruned. 
2026-06-01 00:14:47 | INFO | src.nested_cv_avggrm_weighted_unified | Trial 277 | outer=4 | alpha=6.178e+04 n_pcs=4500 (pc_topk) weight_search=on
2026-06-01 00:14:47 | INFO | src.nested_cv_avggrm_weighted_unified | Trial 277 | outer=4 | weight={'name': 'linear', 'floor': 1e-06, 'clip_max': None, 'min_weight': 0.5293643285215479, 'max_weight': 3.5241045018916504}
2026-06-01 00:14:51 | INFO | src.nested_cv_avggrm_weighted_unified | Trial 277 | outer=4 | pruned after 6/10 inner folds (mean r=0.2028)
[I 2026-06-01 00:14:51,551] Trial 277 pruned. 
2026-06-01 00:14:51 | INFO | src.nested_cv_avggrm_weighted_unified | Trial 278 | outer=4 | alpha=1.249e+05 n_pcs=4500 (pc_topk) weight_search=on
2026-06-01 00:14:51 | INFO | src.nested_cv_avggrm_weighted_unified | Trial 278 | outer=4 | weight={'name': 'uniform', 'floor': 1e-06, 'clip_max': 10.0}
2026-06-01 00:14:55 | INFO | src.nested_cv_avggrm_weighted_unified | Trial 278 | outer=4 | pruned after 6/10 inner folds (mean r=0.1948)
[I 2026-06-01 00:14:55,208] Trial 278 pruned. 
2026-06-01 00:14:55 | INFO | src.nested_cv_avggrm_weighted_unified | Trial 279 | outer=4 | alpha=1.020e+05 n_pcs=4500 (pc_topk) weight_search=on
2026-06-01 00:14:55 | INFO | src.nested_cv_avggrm_weighted_unified | Trial 279 | outer=4 | weight={'name': 'linear', 'floor': 1e-06, 'clip_max': 10.0, 'min_weight': 0.47933659490641894, 'max_weight': 4.610579304906583}
2026-06-01 00:14:59 | INFO | src.nested_cv_avggrm_weighted_unified | Trial 279 | outer=4 | pruned after 6/10 inner folds (mean r=0.2061)
[I 2026-06-01 00:14:59,423] Trial 279 pruned. 
2026-06-01 00:14:59 | INFO | src.nested_cv_avggrm_weighted_unified | Trial 280 | outer=4 | alpha=8.008e+04 n_pcs=4000 (pc_topk) weight_search=on
2026-06-01 00:14:59 | INFO | src.nested_cv_avggrm_weighted_unified | Trial 280 | outer=4 | weight={'name': 'linear', 'floor': 1e-06, 'clip_max': 10.0, 'min_weight': 0.4256561932550585, 'max_weight': 4.769042659666498}
2026-06-01 00:15:02 | INFO | src.nested_cv_avggrm_weighted_unified | Trial 280 | outer=4 | pruned after 6/10 inner folds (mean r=0.2035)
[I 2026-06-01 00:15:02,881] Trial 280 pruned. 
2026-06-01 00:15:02 | INFO | src.nested_cv_avggrm_weighted_unified | Trial 281 | outer=4 | alpha=1.158e+05 n_pcs=4500 (pc_topk) weight_search=on
2026-06-01 00:15:02 | INFO | src.nested_cv_avggrm_weighted_unified | Trial 281 | outer=4 | weight={'name': 'linear', 'floor': 1e-06, 'clip_max': 10.0, 'min_weight': 0.44949672380155686, 'max_weight': 3.422351564425607}
[I 2026-06-01 00:15:09,853] Trial 281 finished with value: 0.19707003205147094 and parameters: {'alpha': 115788.74959543195, 'n_pcs': 4500, 'weight_scheme': 'linear', 'weight_clip_max': 10.0, 'weight_linear_min_weight': 0.44949672380155686, 'weight_linear_max_weight': 3.422351564425607}. Best is trial 41 with value: 0.19810774778548906.
2026-06-01 00:15:09 | INFO | src.nested_cv_avggrm_weighted_unified | Trial 282 | outer=4 | alpha=1.826e+05 n_pcs=4500 (pc_topk) weight_search=on
2026-06-01 00:15:09 | INFO | src.nested_cv_avggrm_weighted_unified | Trial 282 | outer=4 | weight={'name': 'linear', 'floor': 1e-06, 'clip_max': None, 'min_weight': 0.39967634629282794, 'max_weight': 4.484346023714344}
[I 2026-06-01 00:15:16,831] Trial 282 finished with value: 0.19540106677756222 and parameters: {'alpha': 182567.5072698227, 'n_pcs': 4500, 'weight_scheme': 'linear', 'weight_clip_max': None, 'weight_linear_min_weight': 0.39967634629282794, 'weight_linear_max_weight': 4.484346023714344}. Best is trial 41 with value: 0.19810774778548906.
2026-06-01 00:15:16 | INFO | src.nested_cv_avggrm_weighted_unified | Trial 283 | outer=4 | alpha=9.025e+04 n_pcs=4500 (pc_topk) weight_search=on
2026-06-01 00:15:16 | INFO | src.nested_cv_avggrm_weighted_unified | Trial 283 | outer=4 | weight={'name': 'linear', 'floor': 1e-06, 'clip_max': 10.0, 'min_weight': 0.5062760909920694, 'max_weight': 3.3385629934820993}
2026-06-01 00:15:21 | INFO | src.nested_cv_avggrm_weighted_unified | Trial 283 | outer=4 | pruned after 6/10 inner folds (mean r=0.2054)
[I 2026-06-01 00:15:21,046] Trial 283 pruned. 
2026-06-01 00:15:21 | INFO | src.nested_cv_avggrm_weighted_unified | Trial 284 | outer=4 | alpha=6.347e+04 n_pcs=4500 (pc_topk) weight_search=on
2026-06-01 00:15:21 | INFO | src.nested_cv_avggrm_weighted_unified | Trial 284 | outer=4 | weight={'name': 'linear', 'floor': 1e-06, 'clip_max': 10.0, 'min_weight': 0.3463125307489666, 'max_weight': 4.9417392470107675}
2026-06-01 00:15:25 | INFO | src.nested_cv_avggrm_weighted_unified | Trial 284 | outer=4 | pruned after 6/10 inner folds (mean r=0.2020)
[I 2026-06-01 00:15:25,259] Trial 284 pruned. 
2026-06-01 00:15:25 | INFO | src.nested_cv_avggrm_weighted_unified | Trial 285 | outer=4 | alpha=7.233e+04 n_pcs=4500 (pc_topk) weight_search=on
2026-06-01 00:15:25 | INFO | src.nested_cv_avggrm_weighted_unified | Trial 285 | outer=4 | weight={'name': 'linear', 'floor': 1e-06, 'clip_max': 10.0, 'min_weight': 0.46643300171962687, 'max_weight': 4.888236383138005}
2026-06-01 00:15:29 | INFO | src.nested_cv_avggrm_weighted_unified | Trial 285 | outer=4 | pruned after 6/10 inner folds (mean r=0.2036)
[I 2026-06-01 00:15:29,476] Trial 285 pruned. 
2026-06-01 00:15:29 | INFO | src.nested_cv_avggrm_weighted_unified | Trial 286 | outer=4 | alpha=1.343e+05 n_pcs=4500 (pc_topk) weight_search=on
2026-06-01 00:15:29 | INFO | src.nested_cv_avggrm_weighted_unified | Trial 286 | outer=4 | weight={'name': 'linear', 'floor': 1e-06, 'clip_max': None, 'min_weight': 0.37868290409746824, 'max_weight': 3.5956696900101144}
[I 2026-06-01 00:15:36,462] Trial 286 finished with value: 0.19672774020539657 and parameters: {'alpha': 134314.5369156584, 'n_pcs': 4500, 'weight_scheme': 'linear', 'weight_clip_max': None, 'weight_linear_min_weight': 0.37868290409746824, 'weight_linear_max_weight': 3.5956696900101144}. Best is trial 41 with value: 0.19810774778548906.
2026-06-01 00:15:36 | INFO | src.nested_cv_avggrm_weighted_unified | Trial 287 | outer=4 | alpha=1.021e+05 n_pcs=4000 (pc_topk) weight_search=on
2026-06-01 00:15:36 | INFO | src.nested_cv_avggrm_weighted_unified | Trial 287 | outer=4 | weight={'name': 'linear', 'floor': 1e-06, 'clip_max': 10.0, 'min_weight': 0.40229340900025495, 'max_weight': 3.0733416698250404}
2026-06-01 00:15:39 | INFO | src.nested_cv_avggrm_weighted_unified | Trial 287 | outer=4 | pruned after 6/10 inner folds (mean r=0.2055)
[I 2026-06-01 00:15:39,928] Trial 287 pruned. 
2026-06-01 00:15:39 | INFO | src.nested_cv_avggrm_weighted_unified | Trial 288 | outer=4 | alpha=8.250e+04 n_pcs=4500 (pc_topk) weight_search=on
2026-06-01 00:15:39 | INFO | src.nested_cv_avggrm_weighted_unified | Trial 288 | outer=4 | weight={'name': 'linear', 'floor': 1e-06, 'clip_max': 10.0, 'min_weight': 0.4233058176773528, 'max_weight': 4.788015296819007}
2026-06-01 00:15:44 | INFO | src.nested_cv_avggrm_weighted_unified | Trial 288 | outer=4 | pruned after 6/10 inner folds (mean r=0.2046)
[I 2026-06-01 00:15:44,132] Trial 288 pruned. 
2026-06-01 00:15:44 | INFO | src.nested_cv_avggrm_weighted_unified | Trial 289 | outer=4 | alpha=5.185e+04 n_pcs=4500 (pc_topk) weight_search=on
2026-06-01 00:15:44 | INFO | src.nested_cv_avggrm_weighted_unified | Trial 289 | outer=4 | weight={'name': 'linear', 'floor': 1e-06, 'clip_max': 10.0, 'min_weight': 0.3633617266936736, 'max_weight': 4.999829277619904}
2026-06-01 00:15:48 | INFO | src.nested_cv_avggrm_weighted_unified | Trial 289 | outer=4 | pruned after 6/10 inner folds (mean r=0.1998)
[I 2026-06-01 00:15:48,352] Trial 289 pruned. 
2026-06-01 00:15:48 | INFO | src.nested_cv_avggrm_weighted_unified | Trial 290 | outer=4 | alpha=1.495e+05 n_pcs=5000 (pc_topk) weight_search=on
2026-06-01 00:15:48 | INFO | src.nested_cv_avggrm_weighted_unified | Trial 290 | outer=4 | weight={'name': 'linear', 'floor': 1e-06, 'clip_max': None, 'min_weight': 0.5259724653683706, 'max_weight': 3.2389335536069317}
2026-06-01 00:15:53 | INFO | src.nested_cv_avggrm_weighted_unified | Trial 290 | outer=4 | pruned after 6/10 inner folds (mean r=0.2053)
[I 2026-06-01 00:15:53,283] Trial 290 pruned. 
2026-06-01 00:15:53 | INFO | src.nested_cv_avggrm_weighted_unified | Trial 291 | outer=4 | alpha=1.103e+05 n_pcs=4500 (pc_topk) weight_search=on
2026-06-01 00:15:53 | INFO | src.nested_cv_avggrm_weighted_unified | Trial 291 | outer=4 | weight={'name': 'linear', 'floor': 1e-06, 'clip_max': 10.0, 'min_weight': 0.6643032543352951, 'max_weight': 4.670751950921622}
[I 2026-06-01 00:16:00,245] Trial 291 finished with value: 0.19714991791660091 and parameters: {'alpha': 110328.30893417481, 'n_pcs': 4500, 'weight_scheme': 'linear', 'weight_clip_max': 10.0, 'weight_linear_min_weight': 0.6643032543352951, 'weight_linear_max_weight': 4.670751950921622}. Best is trial 41 with value: 0.19810774778548906.
2026-06-01 00:16:00 | INFO | src.nested_cv_avggrm_weighted_unified | Trial 292 | outer=4 | alpha=7.107e+03 n_pcs=2000 (pc_topk) weight_search=on
2026-06-01 00:16:00 | INFO | src.nested_cv_avggrm_weighted_unified | Trial 292 | outer=4 | weight={'name': 'linear', 'floor': 1e-06, 'clip_max': 10.0, 'min_weight': 0.4382100762695702, 'max_weight': 4.557134632640293}
2026-06-01 00:16:01 | INFO | src.nested_cv_avggrm_weighted_unified | Trial 292 | outer=4 | pruned after 5/10 inner folds (mean r=0.1010)
[I 2026-06-01 00:16:01,385] Trial 292 pruned. 
2026-06-01 00:16:01 | INFO | src.nested_cv_avggrm_weighted_unified | Trial 293 | outer=4 | alpha=8.775e+04 n_pcs=4500 (pc_topk) weight_search=on
2026-06-01 00:16:01 | INFO | src.nested_cv_avggrm_weighted_unified | Trial 293 | outer=4 | weight={'name': 'linear', 'floor': 1e-06, 'clip_max': 3.0, 'min_weight': 0.4989637802921784, 'max_weight': 4.830431327675621}
2026-06-01 00:16:05 | INFO | src.nested_cv_avggrm_weighted_unified | Trial 293 | outer=4 | pruned after 6/10 inner folds (mean r=0.2042)
[I 2026-06-01 00:16:05,576] Trial 293 pruned. 
2026-06-01 00:16:05 | INFO | src.nested_cv_avggrm_weighted_unified | Trial 294 | outer=4 | alpha=1.263e+05 n_pcs=4500 (pc_topk) weight_search=on
2026-06-01 00:16:05 | INFO | src.nested_cv_avggrm_weighted_unified | Trial 294 | outer=4 | weight={'name': 'linear', 'floor': 1e-06, 'clip_max': 10.0, 'min_weight': 0.38545761377871174, 'max_weight': 4.41960976592637}
[I 2026-06-01 00:16:12,510] Trial 294 finished with value: 0.19714506159359316 and parameters: {'alpha': 126323.98673992761, 'n_pcs': 4500, 'weight_scheme': 'linear', 'weight_clip_max': 10.0, 'weight_linear_min_weight': 0.38545761377871174, 'weight_linear_max_weight': 4.41960976592637}. Best is trial 41 with value: 0.19810774778548906.
2026-06-01 00:16:12 | INFO | src.nested_cv_avggrm_weighted_unified | Trial 295 | outer=4 | alpha=1.001e+05 n_pcs=4500 (pc_topk) weight_search=on
2026-06-01 00:16:12 | INFO | src.nested_cv_avggrm_weighted_unified | Trial 295 | outer=4 | weight={'name': 'exponential', 'floor': 1e-06, 'clip_max': 10.0, 'beta': 9.9547781797264}
2026-06-01 00:16:16 | INFO | src.nested_cv_avggrm_weighted_unified | Trial 295 | outer=4 | pruned after 6/10 inner folds (mean r=0.1868)
[I 2026-06-01 00:16:16,682] Trial 295 pruned. 
2026-06-01 00:16:16 | INFO | src.nested_cv_avggrm_weighted_unified | Trial 296 | outer=4 | alpha=6.768e+04 n_pcs=4500 (pc_topk) weight_search=on
2026-06-01 00:16:16 | INFO | src.nested_cv_avggrm_weighted_unified | Trial 296 | outer=4 | weight={'name': 'linear', 'floor': 1e-06, 'clip_max': 5.0, 'min_weight': 0.47581271244714407, 'max_weight': 4.727406564661568}
2026-06-01 00:16:20 | INFO | src.nested_cv_avggrm_weighted_unified | Trial 296 | outer=4 | pruned after 6/10 inner folds (mean r=0.2031)
[I 2026-06-01 00:16:20,858] Trial 296 pruned. 
2026-06-01 00:16:20 | INFO | src.nested_cv_avggrm_weighted_unified | Trial 297 | outer=4 | alpha=8.228e+04 n_pcs=4500 (pc_topk) weight_search=on
2026-06-01 00:16:20 | INFO | src.nested_cv_avggrm_weighted_unified | Trial 297 | outer=4 | weight={'name': 'linear', 'floor': 1e-06, 'clip_max': None, 'min_weight': 0.5463444447947723, 'max_weight': 3.727359323631471}
2026-06-01 00:16:25 | INFO | src.nested_cv_avggrm_weighted_unified | Trial 297 | outer=4 | pruned after 6/10 inner folds (mean r=0.2049)
[I 2026-06-01 00:16:25,037] Trial 297 pruned. 
2026-06-01 00:16:25 | INFO | src.nested_cv_avggrm_weighted_unified | Trial 298 | outer=4 | alpha=1.683e+05 n_pcs=4500 (pc_topk) weight_search=on
2026-06-01 00:16:25 | INFO | src.nested_cv_avggrm_weighted_unified | Trial 298 | outer=4 | weight={'name': 'linear', 'floor': 1e-06, 'clip_max': 10.0, 'min_weight': 0.33017683617979143, 'max_weight': 3.4878990619351105}
[I 2026-06-01 00:16:31,959] Trial 298 finished with value: 0.1957658844489012 and parameters: {'alpha': 168264.98155431106, 'n_pcs': 4500, 'weight_scheme': 'linear', 'weight_clip_max': 10.0, 'weight_linear_min_weight': 0.33017683617979143, 'weight_linear_max_weight': 3.4878990619351105}. Best is trial 41 with value: 0.19810774778548906.
2026-06-01 00:16:31 | INFO | src.nested_cv_avggrm_weighted_unified | Trial 299 | outer=4 | alpha=1.232e+05 n_pcs=5000 (pc_topk) weight_search=on
2026-06-01 00:16:31 | INFO | src.nested_cv_avggrm_weighted_unified | Trial 299 | outer=4 | weight={'name': 'uniform', 'floor': 1e-06, 'clip_max': 10.0}
2026-06-01 00:16:36 | INFO | src.nested_cv_avggrm_weighted_unified | Trial 299 | outer=4 | pruned after 6/10 inner folds (mean r=0.1934)
