[I 2026-06-01 00:25:23,142] Trial 103 finished with value: 0.25898237858478235 and parameters: {'alpha': 172858.48054993618, 'n_pcs': 4000, 'weight_scheme': 'exponential', 'weight_clip_max': 5.0, 'weight_exponential_beta': 7.1857430462892316}. Best is trial 100 with value: 0.25978472795967683.
2026-06-01 00:25:23 | INFO | src.nested_cv_avggrm_weighted_unified | Trial 104 | outer=5 | alpha=1.796e+05 n_pcs=4000 (pc_topk) weight_search=on
2026-06-01 00:25:23 | INFO | src.nested_cv_avggrm_weighted_unified | Trial 104 | outer=5 | weight={'name': 'exponential', 'floor': 1e-06, 'clip_max': 5.0, 'beta': 7.142852758909788}
[I 2026-06-01 00:25:28,601] Trial 104 finished with value: 0.2588226103340759 and parameters: {'alpha': 179560.2650850409, 'n_pcs': 4000, 'weight_scheme': 'exponential', 'weight_clip_max': 5.0, 'weight_exponential_beta': 7.142852758909788}. Best is trial 100 with value: 0.25978472795967683.
2026-06-01 00:25:28 | INFO | src.nested_cv_avggrm_weighted_unified | Trial 105 | outer=5 | alpha=2.351e+05 n_pcs=4000 (pc_topk) weight_search=on
2026-06-01 00:25:28 | INFO | src.nested_cv_avggrm_weighted_unified | Trial 105 | outer=5 | weight={'name': 'exponential', 'floor': 1e-06, 'clip_max': None, 'beta': 7.299942656715522}
2026-06-01 00:25:32 | INFO | src.nested_cv_avggrm_weighted_unified | Trial 105 | outer=5 | pruned after 7/10 inner folds (mean r=0.2878)
[I 2026-06-01 00:25:32,419] Trial 105 pruned. 
2026-06-01 00:25:32 | INFO | src.nested_cv_avggrm_weighted_unified | Trial 106 | outer=5 | alpha=1.929e+05 n_pcs=3500 (pc_topk) weight_search=on
2026-06-01 00:25:32 | INFO | src.nested_cv_avggrm_weighted_unified | Trial 106 | outer=5 | weight={'name': 'exponential', 'floor': 1e-06, 'clip_max': 5.0, 'beta': 7.53332530334772}
[I 2026-06-01 00:25:37,074] Trial 106 finished with value: 0.25731331123615375 and parameters: {'alpha': 192878.02105100953, 'n_pcs': 3500, 'weight_scheme': 'exponential', 'weight_clip_max': 5.0, 'weight_exponential_beta': 7.53332530334772}. Best is trial 100 with value: 0.25978472795967683.
2026-06-01 00:25:37 | INFO | src.nested_cv_avggrm_weighted_unified | Trial 107 | outer=5 | alpha=4.155e+05 n_pcs=4000 (pc_topk) weight_search=on
2026-06-01 00:25:37 | INFO | src.nested_cv_avggrm_weighted_unified | Trial 107 | outer=5 | weight={'name': 'exponential', 'floor': 1e-06, 'clip_max': 5.0, 'beta': 7.847209100884296}
2026-06-01 00:25:40 | INFO | src.nested_cv_avggrm_weighted_unified | Trial 107 | outer=5 | pruned after 7/10 inner folds (mean r=0.2915)
[I 2026-06-01 00:25:40,873] Trial 107 pruned. 
2026-06-01 00:25:40 | INFO | src.nested_cv_avggrm_weighted_unified | Trial 108 | outer=5 | alpha=9.157e+04 n_pcs=4000 (pc_topk) weight_search=on
2026-06-01 00:25:40 | INFO | src.nested_cv_avggrm_weighted_unified | Trial 108 | outer=5 | weight={'name': 'linear', 'floor': 1e-06, 'clip_max': 5.0, 'min_weight': 0.07400106305590826, 'max_weight': 1.9243824448182154}
2026-06-01 00:25:44 | INFO | src.nested_cv_avggrm_weighted_unified | Trial 108 | outer=5 | pruned after 7/10 inner folds (mean r=0.2907)
[I 2026-06-01 00:25:44,694] Trial 108 pruned. 
2026-06-01 00:25:44 | INFO | src.nested_cv_avggrm_weighted_unified | Trial 109 | outer=5 | alpha=3.211e+05 n_pcs=4000 (pc_topk) weight_search=on
2026-06-01 00:25:44 | INFO | src.nested_cv_avggrm_weighted_unified | Trial 109 | outer=5 | weight={'name': 'exponential', 'floor': 1e-06, 'clip_max': 10.0, 'beta': 7.151581539183108}
[I 2026-06-01 00:25:50,126] Trial 109 finished with value: 0.2548124280457537 and parameters: {'alpha': 321107.2580936077, 'n_pcs': 4000, 'weight_scheme': 'exponential', 'weight_clip_max': 10.0, 'weight_exponential_beta': 7.151581539183108}. Best is trial 100 with value: 0.25978472795967683.
2026-06-01 00:25:50 | INFO | src.nested_cv_avggrm_weighted_unified | Trial 110 | outer=5 | alpha=6.555e+04 n_pcs=4000 (pc_topk) weight_search=on
2026-06-01 00:25:50 | INFO | src.nested_cv_avggrm_weighted_unified | Trial 110 | outer=5 | weight={'name': 'exponential', 'floor': 1e-06, 'clip_max': 5.0, 'beta': 8.690936075501632}
2026-06-01 00:25:53 | INFO | src.nested_cv_avggrm_weighted_unified | Trial 110 | outer=5 | pruned after 7/10 inner folds (mean r=0.2901)
[I 2026-06-01 00:25:53,954] Trial 110 pruned. 
2026-06-01 00:25:53 | INFO | src.nested_cv_avggrm_weighted_unified | Trial 111 | outer=5 | alpha=1.772e+05 n_pcs=4000 (pc_topk) weight_search=on
2026-06-01 00:25:53 | INFO | src.nested_cv_avggrm_weighted_unified | Trial 111 | outer=5 | weight={'name': 'exponential', 'floor': 1e-06, 'clip_max': 5.0, 'beta': 6.938993619154937}
[I 2026-06-01 00:25:59,389] Trial 111 finished with value: 0.25873732244704406 and parameters: {'alpha': 177172.23994924763, 'n_pcs': 4000, 'weight_scheme': 'exponential', 'weight_clip_max': 5.0, 'weight_exponential_beta': 6.938993619154937}. Best is trial 100 with value: 0.25978472795967683.
2026-06-01 00:25:59 | INFO | src.nested_cv_avggrm_weighted_unified | Trial 112 | outer=5 | alpha=1.758e+05 n_pcs=3500 (pc_topk) weight_search=on
2026-06-01 00:25:59 | INFO | src.nested_cv_avggrm_weighted_unified | Trial 112 | outer=5 | weight={'name': 'exponential', 'floor': 1e-06, 'clip_max': 5.0, 'beta': 7.75139832480724}
[I 2026-06-01 00:26:04,018] Trial 112 finished with value: 0.25760992961920015 and parameters: {'alpha': 175833.57433328108, 'n_pcs': 3500, 'weight_scheme': 'exponential', 'weight_clip_max': 5.0, 'weight_exponential_beta': 7.75139832480724}. Best is trial 100 with value: 0.25978472795967683.
2026-06-01 00:26:04 | INFO | src.nested_cv_avggrm_weighted_unified | Trial 113 | outer=5 | alpha=2.829e+05 n_pcs=4000 (pc_topk) weight_search=on
2026-06-01 00:26:04 | INFO | src.nested_cv_avggrm_weighted_unified | Trial 113 | outer=5 | weight={'name': 'exponential', 'floor': 1e-06, 'clip_max': 5.0, 'beta': 8.97500890034714}
[I 2026-06-01 00:26:09,447] Trial 113 finished with value: 0.25757545501837176 and parameters: {'alpha': 282851.037427488, 'n_pcs': 4000, 'weight_scheme': 'exponential', 'weight_clip_max': 5.0, 'weight_exponential_beta': 8.97500890034714}. Best is trial 100 with value: 0.25978472795967683.
2026-06-01 00:26:09 | INFO | src.nested_cv_avggrm_weighted_unified | Trial 114 | outer=5 | alpha=2.196e+05 n_pcs=4000 (pc_topk) weight_search=on
2026-06-01 00:26:09 | INFO | src.nested_cv_avggrm_weighted_unified | Trial 114 | outer=5 | weight={'name': 'exponential', 'floor': 1e-06, 'clip_max': 5.0, 'beta': 6.830397089922532}
[I 2026-06-01 00:26:14,887] Trial 114 finished with value: 0.2577258279042586 and parameters: {'alpha': 219597.65117878705, 'n_pcs': 4000, 'weight_scheme': 'exponential', 'weight_clip_max': 5.0, 'weight_exponential_beta': 6.830397089922532}. Best is trial 100 with value: 0.25978472795967683.
2026-06-01 00:26:14 | INFO | src.nested_cv_avggrm_weighted_unified | Trial 115 | outer=5 | alpha=9.428e+04 n_pcs=4000 (pc_topk) weight_search=on
2026-06-01 00:26:14 | INFO | src.nested_cv_avggrm_weighted_unified | Trial 115 | outer=5 | weight={'name': 'exponential', 'floor': 1e-06, 'clip_max': 5.0, 'beta': 9.418492468325667}
[I 2026-06-01 00:26:20,322] Trial 115 finished with value: 0.25903510791844153 and parameters: {'alpha': 94283.75150394738, 'n_pcs': 4000, 'weight_scheme': 'exponential', 'weight_clip_max': 5.0, 'weight_exponential_beta': 9.418492468325667}. Best is trial 100 with value: 0.25978472795967683.
2026-06-01 00:26:20 | INFO | src.nested_cv_avggrm_weighted_unified | Trial 116 | outer=5 | alpha=1.196e+05 n_pcs=4000 (pc_topk) weight_search=on
2026-06-01 00:26:20 | INFO | src.nested_cv_avggrm_weighted_unified | Trial 116 | outer=5 | weight={'name': 'exponential', 'floor': 1e-06, 'clip_max': 5.0, 'beta': 9.908285773062065}
[I 2026-06-01 00:26:25,764] Trial 116 finished with value: 0.258903307738269 and parameters: {'alpha': 119640.7651277733, 'n_pcs': 4000, 'weight_scheme': 'exponential', 'weight_clip_max': 5.0, 'weight_exponential_beta': 9.908285773062065}. Best is trial 100 with value: 0.25978472795967683.
2026-06-01 00:26:25 | INFO | src.nested_cv_avggrm_weighted_unified | Trial 117 | outer=5 | alpha=1.043e+05 n_pcs=3500 (pc_topk) weight_search=on
2026-06-01 00:26:25 | INFO | src.nested_cv_avggrm_weighted_unified | Trial 117 | outer=5 | weight={'name': 'exponential', 'floor': 1e-06, 'clip_max': 5.0, 'beta': 9.933468713355813}
2026-06-01 00:26:29 | INFO | src.nested_cv_avggrm_weighted_unified | Trial 117 | outer=5 | pruned after 7/10 inner folds (mean r=0.2879)
[I 2026-06-01 00:26:29,040] Trial 117 pruned. 
2026-06-01 00:26:29 | INFO | src.nested_cv_avggrm_weighted_unified | Trial 118 | outer=5 | alpha=1.306e+05 n_pcs=4000 (pc_topk) weight_search=on
2026-06-01 00:26:29 | INFO | src.nested_cv_avggrm_weighted_unified | Trial 118 | outer=5 | weight={'name': 'exponential', 'floor': 1e-06, 'clip_max': 3.0, 'beta': 9.436348885323072}
[I 2026-06-01 00:26:34,492] Trial 118 finished with value: 0.25892275412977994 and parameters: {'alpha': 130591.87976951712, 'n_pcs': 4000, 'weight_scheme': 'exponential', 'weight_clip_max': 3.0, 'weight_exponential_beta': 9.436348885323072}. Best is trial 100 with value: 0.25978472795967683.
2026-06-01 00:26:34 | INFO | src.nested_cv_avggrm_weighted_unified | Trial 119 | outer=5 | alpha=6.474e+04 n_pcs=4000 (pc_topk) weight_search=on
2026-06-01 00:26:34 | INFO | src.nested_cv_avggrm_weighted_unified | Trial 119 | outer=5 | weight={'name': 'exponential', 'floor': 1e-06, 'clip_max': 3.0, 'beta': 9.518891987953038}
2026-06-01 00:26:38 | INFO | src.nested_cv_avggrm_weighted_unified | Trial 119 | outer=5 | pruned after 7/10 inner folds (mean r=0.2894)
[I 2026-06-01 00:26:38,327] Trial 119 pruned. 
2026-06-01 00:26:38 | INFO | src.nested_cv_avggrm_weighted_unified | Trial 120 | outer=5 | alpha=8.696e+04 n_pcs=4000 (pc_topk) weight_search=on
2026-06-01 00:26:38 | INFO | src.nested_cv_avggrm_weighted_unified | Trial 120 | outer=5 | weight={'name': 'uniform', 'floor': 1e-06, 'clip_max': 3.0}
2026-06-01 00:26:40 | INFO | src.nested_cv_avggrm_weighted_unified | Trial 120 | outer=5 | pruned after 5/10 inner folds (mean r=0.2376)
[I 2026-06-01 00:26:40,667] Trial 120 pruned. 
2026-06-01 00:26:40 | INFO | src.nested_cv_avggrm_weighted_unified | Trial 121 | outer=5 | alpha=1.278e+05 n_pcs=4000 (pc_topk) weight_search=on
2026-06-01 00:26:40 | INFO | src.nested_cv_avggrm_weighted_unified | Trial 121 | outer=5 | weight={'name': 'exponential', 'floor': 1e-06, 'clip_max': 3.0, 'beta': 9.356507153484394}
[I 2026-06-01 00:26:46,111] Trial 121 finished with value: 0.2588958239989402 and parameters: {'alpha': 127750.93380294029, 'n_pcs': 4000, 'weight_scheme': 'exponential', 'weight_clip_max': 3.0, 'weight_exponential_beta': 9.356507153484394}. Best is trial 100 with value: 0.25978472795967683.
2026-06-01 00:26:46 | INFO | src.nested_cv_avggrm_weighted_unified | Trial 122 | outer=5 | alpha=1.206e+05 n_pcs=3500 (pc_topk) weight_search=on
2026-06-01 00:26:46 | INFO | src.nested_cv_avggrm_weighted_unified | Trial 122 | outer=5 | weight={'name': 'exponential', 'floor': 1e-06, 'clip_max': 3.0, 'beta': 8.929485389120128}
2026-06-01 00:26:49 | INFO | src.nested_cv_avggrm_weighted_unified | Trial 122 | outer=5 | pruned after 7/10 inner folds (mean r=0.2911)
[I 2026-06-01 00:26:49,358] Trial 122 pruned. 
2026-06-01 00:26:49 | INFO | src.nested_cv_avggrm_weighted_unified | Trial 123 | outer=5 | alpha=9.906e+04 n_pcs=4000 (pc_topk) weight_search=on
2026-06-01 00:26:49 | INFO | src.nested_cv_avggrm_weighted_unified | Trial 123 | outer=5 | weight={'name': 'exponential', 'floor': 1e-06, 'clip_max': 5.0, 'beta': 9.288682438715373}
[I 2026-06-01 00:26:54,816] Trial 123 finished with value: 0.2592846606349896 and parameters: {'alpha': 99057.32968308117, 'n_pcs': 4000, 'weight_scheme': 'exponential', 'weight_clip_max': 5.0, 'weight_exponential_beta': 9.288682438715373}. Best is trial 100 with value: 0.25978472795967683.
2026-06-01 00:26:54 | INFO | src.nested_cv_avggrm_weighted_unified | Trial 124 | outer=5 | alpha=9.809e+04 n_pcs=4000 (pc_topk) weight_search=on
2026-06-01 00:26:54 | INFO | src.nested_cv_avggrm_weighted_unified | Trial 124 | outer=5 | weight={'name': 'exponential', 'floor': 1e-06, 'clip_max': None, 'beta': 9.435215277469732}
2026-06-01 00:26:58 | INFO | src.nested_cv_avggrm_weighted_unified | Trial 124 | outer=5 | pruned after 7/10 inner folds (mean r=0.2861)
[I 2026-06-01 00:26:58,620] Trial 124 pruned. 
2026-06-01 00:26:58 | INFO | src.nested_cv_avggrm_weighted_unified | Trial 125 | outer=5 | alpha=6.928e+04 n_pcs=3500 (pc_topk) weight_search=on
2026-06-01 00:26:58 | INFO | src.nested_cv_avggrm_weighted_unified | Trial 125 | outer=5 | weight={'name': 'exponential', 'floor': 1e-06, 'clip_max': 5.0, 'beta': 8.841482092776646}
2026-06-01 00:27:01 | INFO | src.nested_cv_avggrm_weighted_unified | Trial 125 | outer=5 | pruned after 7/10 inner folds (mean r=0.2855)
[I 2026-06-01 00:27:01,888] Trial 125 pruned. 
2026-06-01 00:27:01 | INFO | src.nested_cv_avggrm_weighted_unified | Trial 126 | outer=5 | alpha=8.093e+04 n_pcs=4000 (pc_topk) weight_search=on
2026-06-01 00:27:01 | INFO | src.nested_cv_avggrm_weighted_unified | Trial 126 | outer=5 | weight={'name': 'exponential', 'floor': 1e-06, 'clip_max': 5.0, 'beta': 8.166174818521874}
[I 2026-06-01 00:27:07,361] Trial 126 finished with value: 0.2594319224469787 and parameters: {'alpha': 80928.23635721482, 'n_pcs': 4000, 'weight_scheme': 'exponential', 'weight_clip_max': 5.0, 'weight_exponential_beta': 8.166174818521874}. Best is trial 100 with value: 0.25978472795967683.
2026-06-01 00:27:07 | INFO | src.nested_cv_avggrm_weighted_unified | Trial 127 | outer=5 | alpha=4.378e+04 n_pcs=4000 (pc_topk) weight_search=on
2026-06-01 00:27:07 | INFO | src.nested_cv_avggrm_weighted_unified | Trial 127 | outer=5 | weight={'name': 'exponential', 'floor': 1e-06, 'clip_max': 5.0, 'beta': 8.298992886186957}
2026-06-01 00:27:11 | INFO | src.nested_cv_avggrm_weighted_unified | Trial 127 | outer=5 | pruned after 7/10 inner folds (mean r=0.2853)
[I 2026-06-01 00:27:11,224] Trial 127 pruned. 
2026-06-01 00:27:11 | INFO | src.nested_cv_avggrm_weighted_unified | Trial 128 | outer=5 | alpha=8.018e+04 n_pcs=2000 (pc_topk) weight_search=on
2026-06-01 00:27:11 | INFO | src.nested_cv_avggrm_weighted_unified | Trial 128 | outer=5 | weight={'name': 'exponential', 'floor': 1e-06, 'clip_max': 5.0, 'beta': 8.035895045360805}
2026-06-01 00:27:12 | INFO | src.nested_cv_avggrm_weighted_unified | Trial 128 | outer=5 | pruned after 6/10 inner folds (mean r=0.2561)
[I 2026-06-01 00:27:12,481] Trial 128 pruned. 
2026-06-01 00:27:12 | INFO | src.nested_cv_avggrm_weighted_unified | Trial 129 | outer=5 | alpha=1.001e+05 n_pcs=4000 (pc_topk) weight_search=on
2026-06-01 00:27:12 | INFO | src.nested_cv_avggrm_weighted_unified | Trial 129 | outer=5 | weight={'name': 'linear', 'floor': 1e-06, 'clip_max': 5.0, 'min_weight': 0.9918250994128883, 'max_weight': 2.364654283146739}
2026-06-01 00:27:15 | INFO | src.nested_cv_avggrm_weighted_unified | Trial 129 | outer=5 | pruned after 6/10 inner folds (mean r=0.2569)
[I 2026-06-01 00:27:15,753] Trial 129 pruned. 
2026-06-01 00:27:15 | INFO | src.nested_cv_avggrm_weighted_unified | Trial 130 | outer=5 | alpha=7.303e+04 n_pcs=3500 (pc_topk) weight_search=on
2026-06-01 00:27:15 | INFO | src.nested_cv_avggrm_weighted_unified | Trial 130 | outer=5 | weight={'name': 'exponential', 'floor': 1e-06, 'clip_max': 5.0, 'beta': 8.632228878870889}
2026-06-01 00:27:19 | INFO | src.nested_cv_avggrm_weighted_unified | Trial 130 | outer=5 | pruned after 7/10 inner folds (mean r=0.2866)
[I 2026-06-01 00:27:19,003] Trial 130 pruned. 
2026-06-01 00:27:19 | INFO | src.nested_cv_avggrm_weighted_unified | Trial 131 | outer=5 | alpha=1.512e+05 n_pcs=4000 (pc_topk) weight_search=on
2026-06-01 00:27:19 | INFO | src.nested_cv_avggrm_weighted_unified | Trial 131 | outer=5 | weight={'name': 'exponential', 'floor': 1e-06, 'clip_max': 5.0, 'beta': 9.32151095851786}
[I 2026-06-01 00:27:24,451] Trial 131 finished with value: 0.2594555328223619 and parameters: {'alpha': 151190.65004111236, 'n_pcs': 4000, 'weight_scheme': 'exponential', 'weight_clip_max': 5.0, 'weight_exponential_beta': 9.32151095851786}. Best is trial 100 with value: 0.25978472795967683.
2026-06-01 00:27:24 | INFO | src.nested_cv_avggrm_weighted_unified | Trial 132 | outer=5 | alpha=2.488e+03 n_pcs=4000 (pc_topk) weight_search=on
2026-06-01 00:27:24 | INFO | src.nested_cv_avggrm_weighted_unified | Trial 132 | outer=5 | weight={'name': 'exponential', 'floor': 1e-06, 'clip_max': 5.0, 'beta': 7.656719021766593}
2026-06-01 00:27:27 | INFO | src.nested_cv_avggrm_weighted_unified | Trial 132 | outer=5 | pruned after 5/10 inner folds (mean r=0.1995)
[I 2026-06-01 00:27:27,192] Trial 132 pruned. 
2026-06-01 00:27:27 | INFO | src.nested_cv_avggrm_weighted_unified | Trial 133 | outer=5 | alpha=2.112e+05 n_pcs=4000 (pc_topk) weight_search=on
2026-06-01 00:27:27 | INFO | src.nested_cv_avggrm_weighted_unified | Trial 133 | outer=5 | weight={'name': 'exponential', 'floor': 1e-06, 'clip_max': 5.0, 'beta': 9.283616134585293}
[I 2026-06-01 00:27:32,632] Trial 133 finished with value: 0.2587121346606454 and parameters: {'alpha': 211241.48554656014, 'n_pcs': 4000, 'weight_scheme': 'exponential', 'weight_clip_max': 5.0, 'weight_exponential_beta': 9.283616134585293}. Best is trial 100 with value: 0.25978472795967683.
2026-06-01 00:27:32 | INFO | src.nested_cv_avggrm_weighted_unified | Trial 134 | outer=5 | alpha=1.457e+05 n_pcs=4000 (pc_topk) weight_search=on
2026-06-01 00:27:32 | INFO | src.nested_cv_avggrm_weighted_unified | Trial 134 | outer=5 | weight={'name': 'exponential', 'floor': 1e-06, 'clip_max': 5.0, 'beta': 8.363197878933422}
[I 2026-06-01 00:27:38,087] Trial 134 finished with value: 0.25981152240075706 and parameters: {'alpha': 145730.21526025282, 'n_pcs': 4000, 'weight_scheme': 'exponential', 'weight_clip_max': 5.0, 'weight_exponential_beta': 8.363197878933422}. Best is trial 134 with value: 0.25981152240075706.
2026-06-01 00:27:38 | INFO | src.nested_cv_avggrm_weighted_unified | OUTER 5 | new best trial 134 (mean inner r=0.2598) saved to outputs/final_results/e6_pc_ridge_avggrm/thr_wing/e6_pc_ridge_avggrm_thr_wing_best_trials/split_05_best_trial.json
2026-06-01 00:27:38 | INFO | src.nested_cv_avggrm_weighted_unified | Trial 135 | outer=5 | alpha=1.633e+05 n_pcs=4000 (pc_topk) weight_search=on
2026-06-01 00:27:38 | INFO | src.nested_cv_avggrm_weighted_unified | Trial 135 | outer=5 | weight={'name': 'exponential', 'floor': 1e-06, 'clip_max': 5.0, 'beta': 8.415368369708963}
[I 2026-06-01 00:27:43,619] Trial 135 finished with value: 0.25960874487652064 and parameters: {'alpha': 163279.37570572124, 'n_pcs': 4000, 'weight_scheme': 'exponential', 'weight_clip_max': 5.0, 'weight_exponential_beta': 8.415368369708963}. Best is trial 134 with value: 0.25981152240075706.
2026-06-01 00:27:43 | INFO | src.nested_cv_avggrm_weighted_unified | Trial 136 | outer=5 | alpha=2.750e+05 n_pcs=4000 (pc_topk) weight_search=on
2026-06-01 00:27:43 | INFO | src.nested_cv_avggrm_weighted_unified | Trial 136 | outer=5 | weight={'name': 'exponential', 'floor': 1e-06, 'clip_max': 5.0, 'beta': 8.438443000464334}
[I 2026-06-01 00:27:49,067] Trial 136 finished with value: 0.25767971524636435 and parameters: {'alpha': 275012.5569729718, 'n_pcs': 4000, 'weight_scheme': 'exponential', 'weight_clip_max': 5.0, 'weight_exponential_beta': 8.438443000464334}. Best is trial 134 with value: 0.25981152240075706.
2026-06-01 00:27:49 | INFO | src.nested_cv_avggrm_weighted_unified | Trial 137 | outer=5 | alpha=1.530e+05 n_pcs=4000 (pc_topk) weight_search=on
2026-06-01 00:27:49 | INFO | src.nested_cv_avggrm_weighted_unified | Trial 137 | outer=5 | weight={'name': 'exponential', 'floor': 1e-06, 'clip_max': 10.0, 'beta': 8.730299933910574}
[I 2026-06-01 00:27:54,519] Trial 137 finished with value: 0.25738674421613217 and parameters: {'alpha': 153022.963509135, 'n_pcs': 4000, 'weight_scheme': 'exponential', 'weight_clip_max': 10.0, 'weight_exponential_beta': 8.730299933910574}. Best is trial 134 with value: 0.25981152240075706.
2026-06-01 00:27:54 | INFO | src.nested_cv_avggrm_weighted_unified | Trial 138 | outer=5 | alpha=1.441e+05 n_pcs=3500 (pc_topk) weight_search=on
2026-06-01 00:27:54 | INFO | src.nested_cv_avggrm_weighted_unified | Trial 138 | outer=5 | weight={'name': 'exponential', 'floor': 1e-06, 'clip_max': 5.0, 'beta': 8.433143862059982}
2026-06-01 00:27:57 | INFO | src.nested_cv_avggrm_weighted_unified | Trial 138 | outer=5 | pruned after 7/10 inner folds (mean r=0.2923)
[I 2026-06-01 00:27:57,788] Trial 138 pruned. 
2026-06-01 00:27:57 | INFO | src.nested_cv_avggrm_weighted_unified | Trial 139 | outer=5 | alpha=2.426e+05 n_pcs=4500 (pc_topk) weight_search=on
2026-06-01 00:27:57 | INFO | src.nested_cv_avggrm_weighted_unified | Trial 139 | outer=5 | weight={'name': 'exponential', 'floor': 1e-06, 'clip_max': 5.0, 'beta': 8.94661496463986}
[I 2026-06-01 00:28:04,382] Trial 139 finished with value: 0.25781678889694437 and parameters: {'alpha': 242601.84281043953, 'n_pcs': 4500, 'weight_scheme': 'exponential', 'weight_clip_max': 5.0, 'weight_exponential_beta': 8.94661496463986}. Best is trial 134 with value: 0.25981152240075706.
2026-06-01 00:28:04 | INFO | src.nested_cv_avggrm_weighted_unified | Trial 140 | outer=5 | alpha=1.106e+05 n_pcs=4000 (pc_topk) weight_search=on
2026-06-01 00:28:04 | INFO | src.nested_cv_avggrm_weighted_unified | Trial 140 | outer=5 | weight={'name': 'exponential', 'floor': 1e-06, 'clip_max': 5.0, 'beta': 8.06484811908058}
