[I 2026-05-31 23:11:43,137] Trial 9 pruned. 
2026-05-31 23:11:43 | INFO | src.nested_cv_avggrm_weighted_unified | Trial 10 | outer=2 | alpha=3.342e+06 n_pcs=500 (pc_topk) weight_search=on
2026-05-31 23:11:43 | INFO | src.nested_cv_avggrm_weighted_unified | Trial 10 | outer=2 | weight={'name': 'exponential', 'floor': 1e-06, 'clip_max': 3.0, 'beta': 8.988150276350877}
[I 2026-05-31 23:11:44,071] Trial 10 finished with value: 0.21650044984151987 and parameters: {'alpha': 3341898.543904248, 'n_pcs': 500, 'weight_scheme': 'exponential', 'weight_clip_max': 3.0, 'weight_exponential_beta': 8.988150276350877}. Best is trial 1 with value: 0.24252049586843816.
2026-05-31 23:11:44 | INFO | src.nested_cv_avggrm_weighted_unified | Trial 11 | outer=2 | alpha=1.325e+06 n_pcs=3500 (pc_topk) weight_search=on
2026-05-31 23:11:44 | INFO | src.nested_cv_avggrm_weighted_unified | Trial 11 | outer=2 | weight={'name': 'linear', 'floor': 1e-06, 'clip_max': 5.0, 'min_weight': 0.7213129440546091, 'max_weight': 1.427793907186323}
[I 2026-05-31 23:11:49,319] Trial 11 finished with value: 0.22377450579083566 and parameters: {'alpha': 1325209.1973720277, 'n_pcs': 3500, 'weight_scheme': 'linear', 'weight_clip_max': 5.0, 'weight_linear_min_weight': 0.7213129440546091, 'weight_linear_max_weight': 1.427793907186323}. Best is trial 1 with value: 0.24252049586843816.
2026-05-31 23:11:49 | INFO | src.nested_cv_avggrm_weighted_unified | Trial 12 | outer=2 | alpha=4.498e+05 n_pcs=1500 (pc_topk) weight_search=on
2026-05-31 23:11:49 | INFO | src.nested_cv_avggrm_weighted_unified | Trial 12 | outer=2 | weight={'name': 'exponential', 'floor': 1e-06, 'clip_max': 5.0, 'beta': 5.982934772883383}
[I 2026-05-31 23:11:51,036] Trial 12 finished with value: 0.2447828100348522 and parameters: {'alpha': 449804.39949452895, 'n_pcs': 1500, 'weight_scheme': 'exponential', 'weight_clip_max': 5.0, 'weight_exponential_beta': 5.982934772883383}. Best is trial 12 with value: 0.2447828100348522.
2026-05-31 23:11:51 | INFO | src.nested_cv_avggrm_weighted_unified | OUTER 2 | new best trial 12 (mean inner r=0.2448) saved to outputs/final_results/e6_pc_ridge_avggrm/thr_wing/e6_pc_ridge_avggrm_thr_wing_best_trials/split_02_best_trial.json
2026-05-31 23:11:51 | INFO | src.nested_cv_avggrm_weighted_unified | Trial 13 | outer=2 | alpha=5.299e+05 n_pcs=1500 (pc_topk) weight_search=on
2026-05-31 23:11:51 | INFO | src.nested_cv_avggrm_weighted_unified | Trial 13 | outer=2 | weight={'name': 'exponential', 'floor': 1e-06, 'clip_max': 5.0, 'beta': 6.204667046898591}
[I 2026-05-31 23:11:53,242] Trial 13 finished with value: 0.24474072970364547 and parameters: {'alpha': 529850.7864256519, 'n_pcs': 1500, 'weight_scheme': 'exponential', 'weight_clip_max': 5.0, 'weight_exponential_beta': 6.204667046898591}. Best is trial 12 with value: 0.2447828100348522.
2026-05-31 23:11:53 | INFO | src.nested_cv_avggrm_weighted_unified | Trial 14 | outer=2 | alpha=3.301e+05 n_pcs=1000 (pc_topk) weight_search=on
2026-05-31 23:11:53 | INFO | src.nested_cv_avggrm_weighted_unified | Trial 14 | outer=2 | weight={'name': 'exponential', 'floor': 1e-06, 'clip_max': 5.0, 'beta': 5.608589532120922}
[I 2026-05-31 23:11:55,696] Trial 14 finished with value: 0.24369097465587317 and parameters: {'alpha': 330100.2690268646, 'n_pcs': 1000, 'weight_scheme': 'exponential', 'weight_clip_max': 5.0, 'weight_exponential_beta': 5.608589532120922}. Best is trial 12 with value: 0.2447828100348522.
2026-05-31 23:11:55 | INFO | src.nested_cv_avggrm_weighted_unified | Trial 15 | outer=2 | alpha=2.761e+05 n_pcs=1500 (pc_topk) weight_search=on
2026-05-31 23:11:55 | INFO | src.nested_cv_avggrm_weighted_unified | Trial 15 | outer=2 | weight={'name': 'exponential', 'floor': 1e-06, 'clip_max': 5.0, 'beta': 5.593124650462985}
[I 2026-05-31 23:11:58,223] Trial 15 finished with value: 0.24389213889072375 and parameters: {'alpha': 276109.39921497885, 'n_pcs': 1500, 'weight_scheme': 'exponential', 'weight_clip_max': 5.0, 'weight_exponential_beta': 5.593124650462985}. Best is trial 12 with value: 0.2447828100348522.
2026-05-31 23:11:58 | INFO | src.nested_cv_avggrm_weighted_unified | Trial 16 | outer=2 | alpha=6.735e+06 n_pcs=500 (pc_topk) weight_search=on
2026-05-31 23:11:58 | INFO | src.nested_cv_avggrm_weighted_unified | Trial 16 | outer=2 | weight={'name': 'uniform', 'floor': 1e-06, 'clip_max': 5.0}
2026-05-31 23:11:58 | INFO | src.nested_cv_avggrm_weighted_unified | Trial 16 | outer=2 | pruned after 5/10 inner folds (mean r=0.1656)
[I 2026-05-31 23:11:58,564] Trial 16 pruned. 
2026-05-31 23:11:58 | INFO | src.nested_cv_avggrm_weighted_unified | Trial 17 | outer=2 | alpha=6.370e+05 n_pcs=1500 (pc_topk) weight_search=on
2026-05-31 23:11:58 | INFO | src.nested_cv_avggrm_weighted_unified | Trial 17 | outer=2 | weight={'name': 'exponential', 'floor': 1e-06, 'clip_max': 5.0, 'beta': 3.623960538313919}
[I 2026-05-31 23:12:00,407] Trial 17 finished with value: 0.23948832133329315 and parameters: {'alpha': 636958.8777231084, 'n_pcs': 1500, 'weight_scheme': 'exponential', 'weight_clip_max': 5.0, 'weight_exponential_beta': 3.623960538313919}. Best is trial 12 with value: 0.2447828100348522.
2026-05-31 23:12:00 | INFO | src.nested_cv_avggrm_weighted_unified | Trial 18 | outer=2 | alpha=2.010e+05 n_pcs=1500 (pc_topk) weight_search=on
2026-05-31 23:12:00 | INFO | src.nested_cv_avggrm_weighted_unified | Trial 18 | outer=2 | weight={'name': 'exponential', 'floor': 1e-06, 'clip_max': 5.0, 'beta': 6.961576171639018}
[I 2026-05-31 23:12:02,483] Trial 18 finished with value: 0.2423874856725951 and parameters: {'alpha': 201022.80300325237, 'n_pcs': 1500, 'weight_scheme': 'exponential', 'weight_clip_max': 5.0, 'weight_exponential_beta': 6.961576171639018}. Best is trial 12 with value: 0.2447828100348522.
2026-05-31 23:12:02 | INFO | src.nested_cv_avggrm_weighted_unified | Trial 19 | outer=2 | alpha=7.806e+05 n_pcs=1000 (pc_topk) weight_search=on
2026-05-31 23:12:02 | INFO | src.nested_cv_avggrm_weighted_unified | Trial 19 | outer=2 | weight={'name': 'exponential', 'floor': 1e-06, 'clip_max': 5.0, 'beta': 3.72000239072686}
[I 2026-05-31 23:12:03,913] Trial 19 finished with value: 0.23843202141955908 and parameters: {'alpha': 780639.9386624675, 'n_pcs': 1000, 'weight_scheme': 'exponential', 'weight_clip_max': 5.0, 'weight_exponential_beta': 3.72000239072686}. Best is trial 12 with value: 0.2447828100348522.
2026-05-31 23:12:03 | INFO | src.nested_cv_avggrm_weighted_unified | Trial 20 | outer=2 | alpha=9.289e+06 n_pcs=3000 (pc_topk) weight_search=on
2026-05-31 23:12:03 | INFO | src.nested_cv_avggrm_weighted_unified | Trial 20 | outer=2 | weight={'name': 'uniform', 'floor': 1e-06, 'clip_max': 10.0}
2026-05-31 23:12:05 | INFO | src.nested_cv_avggrm_weighted_unified | Trial 20 | outer=2 | pruned after 6/10 inner folds (mean r=0.2271)
[I 2026-05-31 23:12:05,933] Trial 20 pruned. 
2026-05-31 23:12:05 | INFO | src.nested_cv_avggrm_weighted_unified | Trial 21 | outer=2 | alpha=4.047e+05 n_pcs=1500 (pc_topk) weight_search=on
2026-05-31 23:12:05 | INFO | src.nested_cv_avggrm_weighted_unified | Trial 21 | outer=2 | weight={'name': 'exponential', 'floor': 1e-06, 'clip_max': 5.0, 'beta': 6.330543047793919}
[I 2026-05-31 23:12:07,640] Trial 21 finished with value: 0.24500255646776165 and parameters: {'alpha': 404702.7704578935, 'n_pcs': 1500, 'weight_scheme': 'exponential', 'weight_clip_max': 5.0, 'weight_exponential_beta': 6.330543047793919}. Best is trial 21 with value: 0.24500255646776165.
2026-05-31 23:12:07 | INFO | src.nested_cv_avggrm_weighted_unified | OUTER 2 | new best trial 21 (mean inner r=0.2450) saved to outputs/final_results/e6_pc_ridge_avggrm/thr_wing/e6_pc_ridge_avggrm_thr_wing_best_trials/split_02_best_trial.json
2026-05-31 23:12:07 | INFO | src.nested_cv_avggrm_weighted_unified | Trial 22 | outer=2 | alpha=5.231e+05 n_pcs=1500 (pc_topk) weight_search=on
2026-05-31 23:12:07 | INFO | src.nested_cv_avggrm_weighted_unified | Trial 22 | outer=2 | weight={'name': 'exponential', 'floor': 1e-06, 'clip_max': 5.0, 'beta': 6.894586685782687}
[I 2026-05-31 23:12:09,412] Trial 22 finished with value: 0.24508661318068214 and parameters: {'alpha': 523109.6488216679, 'n_pcs': 1500, 'weight_scheme': 'exponential', 'weight_clip_max': 5.0, 'weight_exponential_beta': 6.894586685782687}. Best is trial 22 with value: 0.24508661318068214.
2026-05-31 23:12:09 | INFO | src.nested_cv_avggrm_weighted_unified | OUTER 2 | new best trial 22 (mean inner r=0.2451) saved to outputs/final_results/e6_pc_ridge_avggrm/thr_wing/e6_pc_ridge_avggrm_thr_wing_best_trials/split_02_best_trial.json
2026-05-31 23:12:09 | INFO | src.nested_cv_avggrm_weighted_unified | Trial 23 | outer=2 | alpha=2.158e+06 n_pcs=2000 (pc_topk) weight_search=on
2026-05-31 23:12:09 | INFO | src.nested_cv_avggrm_weighted_unified | Trial 23 | outer=2 | weight={'name': 'exponential', 'floor': 1e-06, 'clip_max': 5.0, 'beta': 7.532071326030967}
[I 2026-05-31 23:12:11,695] Trial 23 finished with value: 0.23994202862919786 and parameters: {'alpha': 2157787.6205024747, 'n_pcs': 2000, 'weight_scheme': 'exponential', 'weight_clip_max': 5.0, 'weight_exponential_beta': 7.532071326030967}. Best is trial 22 with value: 0.24508661318068214.
2026-05-31 23:12:11 | INFO | src.nested_cv_avggrm_weighted_unified | Trial 24 | outer=2 | alpha=1.203e+05 n_pcs=500 (pc_topk) weight_search=on
2026-05-31 23:12:11 | INFO | src.nested_cv_avggrm_weighted_unified | Trial 24 | outer=2 | weight={'name': 'exponential', 'floor': 1e-06, 'clip_max': 5.0, 'beta': 4.314479997947219}
2026-05-31 23:12:12 | INFO | src.nested_cv_avggrm_weighted_unified | Trial 24 | outer=2 | pruned after 5/10 inner folds (mean r=0.1776)
[I 2026-05-31 23:12:12,194] Trial 24 pruned. 
2026-05-31 23:12:12 | INFO | src.nested_cv_avggrm_weighted_unified | Trial 25 | outer=2 | alpha=7.469e+05 n_pcs=1000 (pc_topk) weight_search=on
2026-05-31 23:12:12 | INFO | src.nested_cv_avggrm_weighted_unified | Trial 25 | outer=2 | weight={'name': 'exponential', 'floor': 1e-06, 'clip_max': 20.0, 'beta': 7.008792949498124}
2026-05-31 23:12:13 | INFO | src.nested_cv_avggrm_weighted_unified | Trial 25 | outer=2 | pruned after 7/10 inner folds (mean r=0.2575)
[I 2026-05-31 23:12:13,218] Trial 25 pruned. 
2026-05-31 23:12:13 | INFO | src.nested_cv_avggrm_weighted_unified | Trial 26 | outer=2 | alpha=2.026e+05 n_pcs=2500 (pc_topk) weight_search=on
2026-05-31 23:12:13 | INFO | src.nested_cv_avggrm_weighted_unified | Trial 26 | outer=2 | weight={'name': 'exponential', 'floor': 1e-06, 'clip_max': None, 'beta': 7.888227671369119}
2026-05-31 23:12:15 | INFO | src.nested_cv_avggrm_weighted_unified | Trial 26 | outer=2 | pruned after 6/10 inner folds (mean r=0.2111)
[I 2026-05-31 23:12:15,135] Trial 26 pruned. 
2026-05-31 23:12:15 | INFO | src.nested_cv_avggrm_weighted_unified | Trial 27 | outer=2 | alpha=3.688e+06 n_pcs=1500 (pc_topk) weight_search=on
2026-05-31 23:12:15 | INFO | src.nested_cv_avggrm_weighted_unified | Trial 27 | outer=2 | weight={'name': 'exponential', 'floor': 1e-06, 'clip_max': 5.0, 'beta': 4.66928234868174}
2026-05-31 23:12:16 | INFO | src.nested_cv_avggrm_weighted_unified | Trial 27 | outer=2 | pruned after 7/10 inner folds (mean r=0.2722)
[I 2026-05-31 23:12:16,366] Trial 27 pruned. 
2026-05-31 23:12:16 | INFO | src.nested_cv_avggrm_weighted_unified | Trial 28 | outer=2 | alpha=4.472e+05 n_pcs=2000 (pc_topk) weight_search=on
2026-05-31 23:12:16 | INFO | src.nested_cv_avggrm_weighted_unified | Trial 28 | outer=2 | weight={'name': 'exponential', 'floor': 1e-06, 'clip_max': 5.0, 'beta': 6.1637846884915035}
[I 2026-05-31 23:12:18,596] Trial 28 finished with value: 0.24600515582314228 and parameters: {'alpha': 447157.19015419326, 'n_pcs': 2000, 'weight_scheme': 'exponential', 'weight_clip_max': 5.0, 'weight_exponential_beta': 6.1637846884915035}. Best is trial 28 with value: 0.24600515582314228.
2026-05-31 23:12:18 | INFO | src.nested_cv_avggrm_weighted_unified | OUTER 2 | new best trial 28 (mean inner r=0.2460) saved to outputs/final_results/e6_pc_ridge_avggrm/thr_wing/e6_pc_ridge_avggrm_thr_wing_best_trials/split_02_best_trial.json
2026-05-31 23:12:18 | INFO | src.nested_cv_avggrm_weighted_unified | Trial 29 | outer=2 | alpha=1.289e+05 n_pcs=5000 (pc_topk) weight_search=on
2026-05-31 23:12:18 | INFO | src.nested_cv_avggrm_weighted_unified | Trial 29 | outer=2 | weight={'name': 'uniform', 'floor': 1e-06, 'clip_max': None}
2026-05-31 23:12:23 | INFO | src.nested_cv_avggrm_weighted_unified | Trial 29 | outer=2 | pruned after 7/10 inner folds (mean r=0.2594)
[I 2026-05-31 23:12:23,681] Trial 29 pruned. 
2026-05-31 23:12:23 | INFO | src.nested_cv_avggrm_weighted_unified | Trial 30 | outer=2 | alpha=1.073e+06 n_pcs=3500 (pc_topk) weight_search=on
2026-05-31 23:12:23 | INFO | src.nested_cv_avggrm_weighted_unified | Trial 30 | outer=2 | weight={'name': 'uniform', 'floor': 1e-06, 'clip_max': 5.0}
2026-05-31 23:12:26 | INFO | src.nested_cv_avggrm_weighted_unified | Trial 30 | outer=2 | pruned after 6/10 inner folds (mean r=0.2311)
[I 2026-05-31 23:12:26,155] Trial 30 pruned. 
2026-05-31 23:12:26 | INFO | src.nested_cv_avggrm_weighted_unified | Trial 31 | outer=2 | alpha=3.778e+05 n_pcs=2000 (pc_topk) weight_search=on
2026-05-31 23:12:26 | INFO | src.nested_cv_avggrm_weighted_unified | Trial 31 | outer=2 | weight={'name': 'exponential', 'floor': 1e-06, 'clip_max': 5.0, 'beta': 6.188046388135494}
[I 2026-05-31 23:12:28,392] Trial 31 finished with value: 0.2461217486617035 and parameters: {'alpha': 377833.30163072614, 'n_pcs': 2000, 'weight_scheme': 'exponential', 'weight_clip_max': 5.0, 'weight_exponential_beta': 6.188046388135494}. Best is trial 31 with value: 0.2461217486617035.
2026-05-31 23:12:28 | INFO | src.nested_cv_avggrm_weighted_unified | OUTER 2 | new best trial 31 (mean inner r=0.2461) saved to outputs/final_results/e6_pc_ridge_avggrm/thr_wing/e6_pc_ridge_avggrm_thr_wing_best_trials/split_02_best_trial.json
2026-05-31 23:12:28 | INFO | src.nested_cv_avggrm_weighted_unified | Trial 32 | outer=2 | alpha=3.960e+05 n_pcs=2000 (pc_topk) weight_search=on
2026-05-31 23:12:28 | INFO | src.nested_cv_avggrm_weighted_unified | Trial 32 | outer=2 | weight={'name': 'exponential', 'floor': 1e-06, 'clip_max': 5.0, 'beta': 6.60392234924857}
[I 2026-05-31 23:12:30,821] Trial 32 finished with value: 0.24612842367059637 and parameters: {'alpha': 395962.5976985098, 'n_pcs': 2000, 'weight_scheme': 'exponential', 'weight_clip_max': 5.0, 'weight_exponential_beta': 6.60392234924857}. Best is trial 32 with value: 0.24612842367059637.
2026-05-31 23:12:30 | INFO | src.nested_cv_avggrm_weighted_unified | OUTER 2 | new best trial 32 (mean inner r=0.2461) saved to outputs/final_results/e6_pc_ridge_avggrm/thr_wing/e6_pc_ridge_avggrm_thr_wing_best_trials/split_02_best_trial.json
2026-05-31 23:12:30 | INFO | src.nested_cv_avggrm_weighted_unified | Trial 33 | outer=2 | alpha=1.826e+05 n_pcs=2000 (pc_topk) weight_search=on
2026-05-31 23:12:30 | INFO | src.nested_cv_avggrm_weighted_unified | Trial 33 | outer=2 | weight={'name': 'exponential', 'floor': 1e-06, 'clip_max': 5.0, 'beta': 7.97938859906049}
2026-05-31 23:12:32 | INFO | src.nested_cv_avggrm_weighted_unified | Trial 33 | outer=2 | pruned after 7/10 inner folds (mean r=0.2688)
[I 2026-05-31 23:12:32,760] Trial 33 pruned. 
2026-05-31 23:12:32 | INFO | src.nested_cv_avggrm_weighted_unified | Trial 34 | outer=2 | alpha=1.961e+06 n_pcs=2000 (pc_topk) weight_search=on
2026-05-31 23:12:32 | INFO | src.nested_cv_avggrm_weighted_unified | Trial 34 | outer=2 | weight={'name': 'exponential', 'floor': 1e-06, 'clip_max': 20.0, 'beta': 6.914870582967373}
2026-05-31 23:12:34 | INFO | src.nested_cv_avggrm_weighted_unified | Trial 34 | outer=2 | pruned after 6/10 inner folds (mean r=0.2346)
[I 2026-05-31 23:12:34,119] Trial 34 pruned. 
2026-05-31 23:12:34 | INFO | src.nested_cv_avggrm_weighted_unified | Trial 35 | outer=2 | alpha=9.286e+04 n_pcs=2500 (pc_topk) weight_search=on
2026-05-31 23:12:34 | INFO | src.nested_cv_avggrm_weighted_unified | Trial 35 | outer=2 | weight={'name': 'exponential', 'floor': 1e-06, 'clip_max': 10.0, 'beta': 5.141919858412098}
2026-05-31 23:12:36 | INFO | src.nested_cv_avggrm_weighted_unified | Trial 35 | outer=2 | pruned after 7/10 inner folds (mean r=0.2559)
[I 2026-05-31 23:12:36,240] Trial 35 pruned. 
2026-05-31 23:12:36 | INFO | src.nested_cv_avggrm_weighted_unified | Trial 36 | outer=2 | alpha=3.210e+04 n_pcs=3000 (pc_topk) weight_search=on
2026-05-31 23:12:36 | INFO | src.nested_cv_avggrm_weighted_unified | Trial 36 | outer=2 | weight={'name': 'exponential', 'floor': 1e-06, 'clip_max': None, 'beta': 6.602722166671365}
2026-05-31 23:12:38 | INFO | src.nested_cv_avggrm_weighted_unified | Trial 36 | outer=2 | pruned after 6/10 inner folds (mean r=0.2091)
[I 2026-05-31 23:12:38,556] Trial 36 pruned. 
2026-05-31 23:12:38 | INFO | src.nested_cv_avggrm_weighted_unified | Trial 37 | outer=2 | alpha=1.189e+06 n_pcs=2000 (pc_topk) weight_search=on
2026-05-31 23:12:38 | INFO | src.nested_cv_avggrm_weighted_unified | Trial 37 | outer=2 | weight={'name': 'exponential', 'floor': 1e-06, 'clip_max': 5.0, 'beta': 5.195367641475601}
[I 2026-05-31 23:12:40,778] Trial 37 finished with value: 0.2415606992251984 and parameters: {'alpha': 1189424.7182803208, 'n_pcs': 2000, 'weight_scheme': 'exponential', 'weight_clip_max': 5.0, 'weight_exponential_beta': 5.195367641475601}. Best is trial 32 with value: 0.24612842367059637.
2026-05-31 23:12:40 | INFO | src.nested_cv_avggrm_weighted_unified | Trial 38 | outer=2 | alpha=2.921e+05 n_pcs=2500 (pc_topk) weight_search=on
2026-05-31 23:12:40 | INFO | src.nested_cv_avggrm_weighted_unified | Trial 38 | outer=2 | weight={'name': 'linear', 'floor': 1e-06, 'clip_max': 3.0, 'min_weight': 0.4013212833403871, 'max_weight': 1.678126240076686}
2026-05-31 23:12:42 | INFO | src.nested_cv_avggrm_weighted_unified | Trial 38 | outer=2 | pruned after 7/10 inner folds (mean r=0.2724)
[I 2026-05-31 23:12:42,896] Trial 38 pruned. 
2026-05-31 23:12:42 | INFO | src.nested_cv_avggrm_weighted_unified | Trial 39 | outer=2 | alpha=2.990e+06 n_pcs=2000 (pc_topk) weight_search=on
2026-05-31 23:12:42 | INFO | src.nested_cv_avggrm_weighted_unified | Trial 39 | outer=2 | weight={'name': 'exponential', 'floor': 1e-06, 'clip_max': 10.0, 'beta': 7.757771086256291}
2026-05-31 23:12:44 | INFO | src.nested_cv_avggrm_weighted_unified | Trial 39 | outer=2 | pruned after 7/10 inner folds (mean r=0.2678)
[I 2026-05-31 23:12:44,480] Trial 39 pruned. 
2026-05-31 23:12:44 | INFO | src.nested_cv_avggrm_weighted_unified | Trial 40 | outer=2 | alpha=8.634e+05 n_pcs=4500 (pc_topk) weight_search=on
2026-05-31 23:12:44 | INFO | src.nested_cv_avggrm_weighted_unified | Trial 40 | outer=2 | weight={'name': 'exponential', 'floor': 1e-06, 'clip_max': 5.0, 'beta': 8.626402825085602}
[I 2026-05-31 23:12:51,451] Trial 40 finished with value: 0.24465729861313937 and parameters: {'alpha': 863399.2565226483, 'n_pcs': 4500, 'weight_scheme': 'exponential', 'weight_clip_max': 5.0, 'weight_exponential_beta': 8.626402825085602}. Best is trial 32 with value: 0.24612842367059637.
2026-05-31 23:12:51 | INFO | src.nested_cv_avggrm_weighted_unified | Trial 41 | outer=2 | alpha=4.104e+05 n_pcs=1000 (pc_topk) weight_search=on
2026-05-31 23:12:51 | INFO | src.nested_cv_avggrm_weighted_unified | Trial 41 | outer=2 | weight={'name': 'exponential', 'floor': 1e-06, 'clip_max': 5.0, 'beta': 6.4128559525417534}
[I 2026-05-31 23:12:52,866] Trial 41 finished with value: 0.2443233330537371 and parameters: {'alpha': 410447.0905042972, 'n_pcs': 1000, 'weight_scheme': 'exponential', 'weight_clip_max': 5.0, 'weight_exponential_beta': 6.4128559525417534}. Best is trial 32 with value: 0.24612842367059637.
2026-05-31 23:12:52 | INFO | src.nested_cv_avggrm_weighted_unified | Trial 42 | outer=2 | alpha=1.124e+03 n_pcs=2000 (pc_topk) weight_search=on
2026-05-31 23:12:52 | INFO | src.nested_cv_avggrm_weighted_unified | Trial 42 | outer=2 | weight={'name': 'exponential', 'floor': 1e-06, 'clip_max': 5.0, 'beta': 5.950398538917757}
2026-05-31 23:12:54 | INFO | src.nested_cv_avggrm_weighted_unified | Trial 42 | outer=2 | pruned after 5/10 inner folds (mean r=0.1134)
[I 2026-05-31 23:12:54,693] Trial 42 pruned. 
2026-05-31 23:12:54 | INFO | src.nested_cv_avggrm_weighted_unified | Trial 43 | outer=2 | alpha=8.398e+04 n_pcs=2500 (pc_topk) weight_search=on
2026-05-31 23:12:54 | INFO | src.nested_cv_avggrm_weighted_unified | Trial 43 | outer=2 | weight={'name': 'exponential', 'floor': 1e-06, 'clip_max': 5.0, 'beta': 7.307891208808671}
2026-05-31 23:12:56 | INFO | src.nested_cv_avggrm_weighted_unified | Trial 43 | outer=2 | pruned after 7/10 inner folds (mean r=0.2603)
[I 2026-05-31 23:12:56,804] Trial 43 pruned. 
2026-05-31 23:12:56 | INFO | src.nested_cv_avggrm_weighted_unified | Trial 44 | outer=2 | alpha=4.845e+05 n_pcs=1500 (pc_topk) weight_search=on
2026-05-31 23:12:56 | INFO | src.nested_cv_avggrm_weighted_unified | Trial 44 | outer=2 | weight={'name': 'linear', 'floor': 1e-06, 'clip_max': 3.0, 'min_weight': 0.41463090101375105, 'max_weight': 2.738585404454886}
2026-05-31 23:12:58 | INFO | src.nested_cv_avggrm_weighted_unified | Trial 44 | outer=2 | pruned after 7/10 inner folds (mean r=0.2695)
[I 2026-05-31 23:12:58,011] Trial 44 pruned. 
2026-05-31 23:12:58 | INFO | src.nested_cv_avggrm_weighted_unified | Trial 45 | outer=2 | alpha=2.080e+05 n_pcs=1000 (pc_topk) weight_search=on
2026-05-31 23:12:58 | INFO | src.nested_cv_avggrm_weighted_unified | Trial 45 | outer=2 | weight={'name': 'exponential', 'floor': 1e-06, 'clip_max': 20.0, 'beta': 6.411581650297805}
2026-05-31 23:12:59 | INFO | src.nested_cv_avggrm_weighted_unified | Trial 45 | outer=2 | pruned after 6/10 inner folds (mean r=0.2282)
