[I 2026-06-01 01:00:50,453] Trial 251 pruned. 
2026-06-01 01:00:50 | INFO | src.nested_cv_avggrm_weighted_unified | Trial 252 | outer=6 | alpha=1.055e+05 n_pcs=4000 (pc_topk) weight_search=on
2026-06-01 01:00:50 | INFO | src.nested_cv_avggrm_weighted_unified | Trial 252 | outer=6 | weight={'name': 'exponential', 'floor': 1e-06, 'clip_max': 3.0, 'beta': 4.077696231387491}
2026-06-01 01:00:54 | INFO | src.nested_cv_avggrm_weighted_unified | Trial 252 | outer=6 | pruned after 7/10 inner folds (mean r=0.2623)
[I 2026-06-01 01:00:54,196] Trial 252 pruned. 
2026-06-01 01:00:54 | INFO | src.nested_cv_avggrm_weighted_unified | Trial 253 | outer=6 | alpha=1.568e+05 n_pcs=4000 (pc_topk) weight_search=on
2026-06-01 01:00:54 | INFO | src.nested_cv_avggrm_weighted_unified | Trial 253 | outer=6 | weight={'name': 'uniform', 'floor': 1e-06, 'clip_max': 3.0}
2026-06-01 01:00:56 | INFO | src.nested_cv_avggrm_weighted_unified | Trial 253 | outer=6 | pruned after 6/10 inner folds (mean r=0.2402)
[I 2026-06-01 01:00:56,923] Trial 253 pruned. 
2026-06-01 01:00:56 | INFO | src.nested_cv_avggrm_weighted_unified | Trial 254 | outer=6 | alpha=7.604e+04 n_pcs=4000 (pc_topk) weight_search=on
2026-06-01 01:00:56 | INFO | src.nested_cv_avggrm_weighted_unified | Trial 254 | outer=6 | weight={'name': 'exponential', 'floor': 1e-06, 'clip_max': 3.0, 'beta': 4.223534513330188}
2026-06-01 01:01:00 | INFO | src.nested_cv_avggrm_weighted_unified | Trial 254 | outer=6 | pruned after 7/10 inner folds (mean r=0.2587)
[I 2026-06-01 01:01:00,564] Trial 254 pruned. 
2026-06-01 01:01:00 | INFO | src.nested_cv_avggrm_weighted_unified | Trial 255 | outer=6 | alpha=1.572e+05 n_pcs=4000 (pc_topk) weight_search=on
2026-06-01 01:01:00 | INFO | src.nested_cv_avggrm_weighted_unified | Trial 255 | outer=6 | weight={'name': 'exponential', 'floor': 1e-06, 'clip_max': 3.0, 'beta': 3.7032952856631374}
2026-06-01 01:01:04 | INFO | src.nested_cv_avggrm_weighted_unified | Trial 255 | outer=6 | pruned after 7/10 inner folds (mean r=0.2649)
[I 2026-06-01 01:01:04,420] Trial 255 pruned. 
2026-06-01 01:01:04 | INFO | src.nested_cv_avggrm_weighted_unified | Trial 256 | outer=6 | alpha=1.254e+05 n_pcs=4000 (pc_topk) weight_search=on
2026-06-01 01:01:04 | INFO | src.nested_cv_avggrm_weighted_unified | Trial 256 | outer=6 | weight={'name': 'exponential', 'floor': 1e-06, 'clip_max': 3.0, 'beta': 3.877714382112631}
2026-06-01 01:01:08 | INFO | src.nested_cv_avggrm_weighted_unified | Trial 256 | outer=6 | pruned after 7/10 inner folds (mean r=0.2637)
[I 2026-06-01 01:01:08,111] Trial 256 pruned. 
2026-06-01 01:01:08 | INFO | src.nested_cv_avggrm_weighted_unified | Trial 257 | outer=6 | alpha=1.614e+05 n_pcs=4000 (pc_topk) weight_search=on
2026-06-01 01:01:08 | INFO | src.nested_cv_avggrm_weighted_unified | Trial 257 | outer=6 | weight={'name': 'linear', 'floor': 1e-06, 'clip_max': 3.0, 'min_weight': 0.7927477460709366, 'max_weight': 4.393238003040897}
2026-06-01 01:01:11 | INFO | src.nested_cv_avggrm_weighted_unified | Trial 257 | outer=6 | pruned after 7/10 inner folds (mean r=0.2629)
[I 2026-06-01 01:01:11,803] Trial 257 pruned. 
2026-06-01 01:01:11 | INFO | src.nested_cv_avggrm_weighted_unified | Trial 258 | outer=6 | alpha=1.179e+05 n_pcs=4000 (pc_topk) weight_search=on
2026-06-01 01:01:11 | INFO | src.nested_cv_avggrm_weighted_unified | Trial 258 | outer=6 | weight={'name': 'exponential', 'floor': 1e-06, 'clip_max': 3.0, 'beta': 4.356513071838532}
2026-06-01 01:01:15 | INFO | src.nested_cv_avggrm_weighted_unified | Trial 258 | outer=6 | pruned after 7/10 inner folds (mean r=0.2632)
[I 2026-06-01 01:01:15,587] Trial 258 pruned. 
2026-06-01 01:01:15 | INFO | src.nested_cv_avggrm_weighted_unified | Trial 259 | outer=6 | alpha=1.585e+05 n_pcs=4000 (pc_topk) weight_search=on
2026-06-01 01:01:15 | INFO | src.nested_cv_avggrm_weighted_unified | Trial 259 | outer=6 | weight={'name': 'exponential', 'floor': 1e-06, 'clip_max': 3.0, 'beta': 4.064652760606258}
[I 2026-06-01 01:01:20,780] Trial 259 finished with value: 0.23818117581244752 and parameters: {'alpha': 158529.31654806537, 'n_pcs': 4000, 'weight_scheme': 'exponential', 'weight_clip_max': 3.0, 'weight_exponential_beta': 4.064652760606258}. Best is trial 237 with value: 0.23825365933560247.
2026-06-01 01:01:20 | INFO | src.nested_cv_avggrm_weighted_unified | Trial 260 | outer=6 | alpha=1.360e+05 n_pcs=3500 (pc_topk) weight_search=on
2026-06-01 01:01:20 | INFO | src.nested_cv_avggrm_weighted_unified | Trial 260 | outer=6 | weight={'name': 'exponential', 'floor': 1e-06, 'clip_max': 3.0, 'beta': 4.047779399391778}
2026-06-01 01:01:24 | INFO | src.nested_cv_avggrm_weighted_unified | Trial 260 | outer=6 | pruned after 7/10 inner folds (mean r=0.2632)
[I 2026-06-01 01:01:24,117] Trial 260 pruned. 
2026-06-01 01:01:24 | INFO | src.nested_cv_avggrm_weighted_unified | Trial 261 | outer=6 | alpha=1.013e+05 n_pcs=4000 (pc_topk) weight_search=on
2026-06-01 01:01:24 | INFO | src.nested_cv_avggrm_weighted_unified | Trial 261 | outer=6 | weight={'name': 'exponential', 'floor': 1e-06, 'clip_max': 3.0, 'beta': 3.9000720968813365}
2026-06-01 01:01:27 | INFO | src.nested_cv_avggrm_weighted_unified | Trial 261 | outer=6 | pruned after 7/10 inner folds (mean r=0.2619)
[I 2026-06-01 01:01:27,757] Trial 261 pruned. 
2026-06-01 01:01:27 | INFO | src.nested_cv_avggrm_weighted_unified | Trial 262 | outer=6 | alpha=1.575e+05 n_pcs=4000 (pc_topk) weight_search=on
2026-06-01 01:01:27 | INFO | src.nested_cv_avggrm_weighted_unified | Trial 262 | outer=6 | weight={'name': 'exponential', 'floor': 1e-06, 'clip_max': None, 'beta': 4.1628602935377375}
2026-06-01 01:01:30 | INFO | src.nested_cv_avggrm_weighted_unified | Trial 262 | outer=6 | pruned after 6/10 inner folds (mean r=0.2367)
[I 2026-06-01 01:01:30,880] Trial 262 pruned. 
2026-06-01 01:01:30 | INFO | src.nested_cv_avggrm_weighted_unified | Trial 263 | outer=6 | alpha=1.426e+05 n_pcs=4000 (pc_topk) weight_search=on
2026-06-01 01:01:30 | INFO | src.nested_cv_avggrm_weighted_unified | Trial 263 | outer=6 | weight={'name': 'exponential', 'floor': 1e-06, 'clip_max': 3.0, 'beta': 3.762246172548043}
2026-06-01 01:01:34 | INFO | src.nested_cv_avggrm_weighted_unified | Trial 263 | outer=6 | pruned after 7/10 inner folds (mean r=0.2644)
[I 2026-06-01 01:01:34,578] Trial 263 pruned. 
2026-06-01 01:01:34 | INFO | src.nested_cv_avggrm_weighted_unified | Trial 264 | outer=6 | alpha=1.644e+05 n_pcs=4000 (pc_topk) weight_search=on
2026-06-01 01:01:34 | INFO | src.nested_cv_avggrm_weighted_unified | Trial 264 | outer=6 | weight={'name': 'exponential', 'floor': 1e-06, 'clip_max': 3.0, 'beta': 4.082521493276187}
[I 2026-06-01 01:01:39,780] Trial 264 finished with value: 0.23813801115546288 and parameters: {'alpha': 164380.89840108735, 'n_pcs': 4000, 'weight_scheme': 'exponential', 'weight_clip_max': 3.0, 'weight_exponential_beta': 4.082521493276187}. Best is trial 237 with value: 0.23825365933560247.
2026-06-01 01:01:39 | INFO | src.nested_cv_avggrm_weighted_unified | Trial 265 | outer=6 | alpha=1.148e+05 n_pcs=4000 (pc_topk) weight_search=on
2026-06-01 01:01:39 | INFO | src.nested_cv_avggrm_weighted_unified | Trial 265 | outer=6 | weight={'name': 'exponential', 'floor': 1e-06, 'clip_max': 3.0, 'beta': 4.435400036265937}
2026-06-01 01:01:43 | INFO | src.nested_cv_avggrm_weighted_unified | Trial 265 | outer=6 | pruned after 7/10 inner folds (mean r=0.2629)
[I 2026-06-01 01:01:43,510] Trial 265 pruned. 
2026-06-01 01:01:43 | INFO | src.nested_cv_avggrm_weighted_unified | Trial 266 | outer=6 | alpha=1.607e+05 n_pcs=3500 (pc_topk) weight_search=on
2026-06-01 01:01:43 | INFO | src.nested_cv_avggrm_weighted_unified | Trial 266 | outer=6 | weight={'name': 'exponential', 'floor': 1e-06, 'clip_max': 3.0, 'beta': 4.150399120001948}
2026-06-01 01:01:46 | INFO | src.nested_cv_avggrm_weighted_unified | Trial 266 | outer=6 | pruned after 7/10 inner folds (mean r=0.2643)
[I 2026-06-01 01:01:46,703] Trial 266 pruned. 
2026-06-01 01:01:46 | INFO | src.nested_cv_avggrm_weighted_unified | Trial 267 | outer=6 | alpha=1.348e+05 n_pcs=4000 (pc_topk) weight_search=on
2026-06-01 01:01:46 | INFO | src.nested_cv_avggrm_weighted_unified | Trial 267 | outer=6 | weight={'name': 'exponential', 'floor': 1e-06, 'clip_max': 20.0, 'beta': 3.959154948368743}
2026-06-01 01:01:49 | INFO | src.nested_cv_avggrm_weighted_unified | Trial 267 | outer=6 | pruned after 6/10 inner folds (mean r=0.2380)
[I 2026-06-01 01:01:49,816] Trial 267 pruned. 
2026-06-01 01:01:49 | INFO | src.nested_cv_avggrm_weighted_unified | Trial 268 | outer=6 | alpha=8.812e+03 n_pcs=4000 (pc_topk) weight_search=on
2026-06-01 01:01:49 | INFO | src.nested_cv_avggrm_weighted_unified | Trial 268 | outer=6 | weight={'name': 'exponential', 'floor': 1e-06, 'clip_max': 10.0, 'beta': 4.387729006526309}
2026-06-01 01:01:52 | INFO | src.nested_cv_avggrm_weighted_unified | Trial 268 | outer=6 | pruned after 6/10 inner folds (mean r=0.2041)
[I 2026-06-01 01:01:52,923] Trial 268 pruned. 
2026-06-01 01:01:52 | INFO | src.nested_cv_avggrm_weighted_unified | Trial 269 | outer=6 | alpha=9.392e+04 n_pcs=4000 (pc_topk) weight_search=on
2026-06-01 01:01:52 | INFO | src.nested_cv_avggrm_weighted_unified | Trial 269 | outer=6 | weight={'name': 'exponential', 'floor': 1e-06, 'clip_max': 3.0, 'beta': 3.818426525817947}
2026-06-01 01:01:56 | INFO | src.nested_cv_avggrm_weighted_unified | Trial 269 | outer=6 | pruned after 7/10 inner folds (mean r=0.2611)
[I 2026-06-01 01:01:56,585] Trial 269 pruned. 
2026-06-01 01:01:56 | INFO | src.nested_cv_avggrm_weighted_unified | Trial 270 | outer=6 | alpha=1.670e+05 n_pcs=4000 (pc_topk) weight_search=on
2026-06-01 01:01:56 | INFO | src.nested_cv_avggrm_weighted_unified | Trial 270 | outer=6 | weight={'name': 'exponential', 'floor': 1e-06, 'clip_max': 3.0, 'beta': 4.186059514824323}
[I 2026-06-01 01:02:01,766] Trial 270 finished with value: 0.2380936799005548 and parameters: {'alpha': 166970.15514616502, 'n_pcs': 4000, 'weight_scheme': 'exponential', 'weight_clip_max': 3.0, 'weight_exponential_beta': 4.186059514824323}. Best is trial 237 with value: 0.23825365933560247.
2026-06-01 01:02:01 | INFO | src.nested_cv_avggrm_weighted_unified | Trial 271 | outer=6 | alpha=1.340e+05 n_pcs=4000 (pc_topk) weight_search=on
2026-06-01 01:02:01 | INFO | src.nested_cv_avggrm_weighted_unified | Trial 271 | outer=6 | weight={'name': 'exponential', 'floor': 1e-06, 'clip_max': 3.0, 'beta': 4.043130014501628}
2026-06-01 01:02:05 | INFO | src.nested_cv_avggrm_weighted_unified | Trial 271 | outer=6 | pruned after 7/10 inner folds (mean r=0.2642)
[I 2026-06-01 01:02:05,468] Trial 271 pruned. 
2026-06-01 01:02:05 | INFO | src.nested_cv_avggrm_weighted_unified | Trial 272 | outer=6 | alpha=2.450e+05 n_pcs=4000 (pc_topk) weight_search=on
2026-06-01 01:02:05 | INFO | src.nested_cv_avggrm_weighted_unified | Trial 272 | outer=6 | weight={'name': 'exponential', 'floor': 1e-06, 'clip_max': 3.0, 'beta': 3.7018291547152415}
[I 2026-06-01 01:02:10,704] Trial 272 finished with value: 0.23713181682156917 and parameters: {'alpha': 245037.79398893315, 'n_pcs': 4000, 'weight_scheme': 'exponential', 'weight_clip_max': 3.0, 'weight_exponential_beta': 3.7018291547152415}. Best is trial 237 with value: 0.23825365933560247.
2026-06-01 01:02:10 | INFO | src.nested_cv_avggrm_weighted_unified | Trial 273 | outer=6 | alpha=1.731e+05 n_pcs=4000 (pc_topk) weight_search=on
2026-06-01 01:02:10 | INFO | src.nested_cv_avggrm_weighted_unified | Trial 273 | outer=6 | weight={'name': 'exponential', 'floor': 1e-06, 'clip_max': 3.0, 'beta': 4.1403274131971655}
[I 2026-06-01 01:02:15,889] Trial 273 finished with value: 0.2380619688405364 and parameters: {'alpha': 173106.0800692965, 'n_pcs': 4000, 'weight_scheme': 'exponential', 'weight_clip_max': 3.0, 'weight_exponential_beta': 4.1403274131971655}. Best is trial 237 with value: 0.23825365933560247.
2026-06-01 01:02:15 | INFO | src.nested_cv_avggrm_weighted_unified | Trial 274 | outer=6 | alpha=1.140e+05 n_pcs=4000 (pc_topk) weight_search=on
2026-06-01 01:02:15 | INFO | src.nested_cv_avggrm_weighted_unified | Trial 274 | outer=6 | weight={'name': 'exponential', 'floor': 1e-06, 'clip_max': 3.0, 'beta': 3.9318062261108406}
2026-06-01 01:02:19 | INFO | src.nested_cv_avggrm_weighted_unified | Trial 274 | outer=6 | pruned after 7/10 inner folds (mean r=0.2630)
[I 2026-06-01 01:02:19,513] Trial 274 pruned. 
2026-06-01 01:02:19 | INFO | src.nested_cv_avggrm_weighted_unified | Trial 275 | outer=6 | alpha=1.692e+05 n_pcs=4000 (pc_topk) weight_search=on
2026-06-01 01:02:19 | INFO | src.nested_cv_avggrm_weighted_unified | Trial 275 | outer=6 | weight={'name': 'exponential', 'floor': 1e-06, 'clip_max': 3.0, 'beta': 3.7362429385639233}
[I 2026-06-01 01:02:24,688] Trial 275 finished with value: 0.23811490975288954 and parameters: {'alpha': 169202.96935056872, 'n_pcs': 4000, 'weight_scheme': 'exponential', 'weight_clip_max': 3.0, 'weight_exponential_beta': 3.7362429385639233}. Best is trial 237 with value: 0.23825365933560247.
2026-06-01 01:02:24 | INFO | src.nested_cv_avggrm_weighted_unified | Trial 276 | outer=6 | alpha=1.315e+05 n_pcs=4000 (pc_topk) weight_search=on
2026-06-01 01:02:24 | INFO | src.nested_cv_avggrm_weighted_unified | Trial 276 | outer=6 | weight={'name': 'exponential', 'floor': 1e-06, 'clip_max': 3.0, 'beta': 3.672279596488565}
2026-06-01 01:02:28 | INFO | src.nested_cv_avggrm_weighted_unified | Trial 276 | outer=6 | pruned after 7/10 inner folds (mean r=0.2638)
[I 2026-06-01 01:02:28,357] Trial 276 pruned. 
2026-06-01 01:02:28 | INFO | src.nested_cv_avggrm_weighted_unified | Trial 277 | outer=6 | alpha=1.687e+05 n_pcs=4000 (pc_topk) weight_search=on
2026-06-01 01:02:28 | INFO | src.nested_cv_avggrm_weighted_unified | Trial 277 | outer=6 | weight={'name': 'exponential', 'floor': 1e-06, 'clip_max': 3.0, 'beta': 3.877152123284783}
[I 2026-06-01 01:02:33,568] Trial 277 finished with value: 0.23815784853374292 and parameters: {'alpha': 168716.65618827706, 'n_pcs': 4000, 'weight_scheme': 'exponential', 'weight_clip_max': 3.0, 'weight_exponential_beta': 3.877152123284783}. Best is trial 237 with value: 0.23825365933560247.
2026-06-01 01:02:33 | INFO | src.nested_cv_avggrm_weighted_unified | Trial 278 | outer=6 | alpha=2.481e+05 n_pcs=3500 (pc_topk) weight_search=on
2026-06-01 01:02:33 | INFO | src.nested_cv_avggrm_weighted_unified | Trial 278 | outer=6 | weight={'name': 'exponential', 'floor': 1e-06, 'clip_max': 3.0, 'beta': 3.8302496522485474}
[I 2026-06-01 01:02:38,267] Trial 278 finished with value: 0.23636469338009616 and parameters: {'alpha': 248105.4741006064, 'n_pcs': 3500, 'weight_scheme': 'exponential', 'weight_clip_max': 3.0, 'weight_exponential_beta': 3.8302496522485474}. Best is trial 237 with value: 0.23825365933560247.
2026-06-01 01:02:38 | INFO | src.nested_cv_avggrm_weighted_unified | Trial 279 | outer=6 | alpha=1.055e+05 n_pcs=4000 (pc_topk) weight_search=on
2026-06-01 01:02:38 | INFO | src.nested_cv_avggrm_weighted_unified | Trial 279 | outer=6 | weight={'name': 'linear', 'floor': 1e-06, 'clip_max': 3.0, 'min_weight': 0.22173596993179662, 'max_weight': 2.879029490740883}
2026-06-01 01:02:42 | INFO | src.nested_cv_avggrm_weighted_unified | Trial 279 | outer=6 | pruned after 7/10 inner folds (mean r=0.2609)
[I 2026-06-01 01:02:42,010] Trial 279 pruned. 
2026-06-01 01:02:42 | INFO | src.nested_cv_avggrm_weighted_unified | Trial 280 | outer=6 | alpha=2.330e+05 n_pcs=4000 (pc_topk) weight_search=on
2026-06-01 01:02:42 | INFO | src.nested_cv_avggrm_weighted_unified | Trial 280 | outer=6 | weight={'name': 'uniform', 'floor': 1e-06, 'clip_max': 3.0}
2026-06-01 01:02:44 | INFO | src.nested_cv_avggrm_weighted_unified | Trial 280 | outer=6 | pruned after 6/10 inner folds (mean r=0.2374)
[I 2026-06-01 01:02:44,710] Trial 280 pruned. 
2026-06-01 01:02:44 | INFO | src.nested_cv_avggrm_weighted_unified | Trial 281 | outer=6 | alpha=1.428e+05 n_pcs=4000 (pc_topk) weight_search=on
2026-06-01 01:02:44 | INFO | src.nested_cv_avggrm_weighted_unified | Trial 281 | outer=6 | weight={'name': 'exponential', 'floor': 1e-06, 'clip_max': 3.0, 'beta': 3.6545000145890354}
2026-06-01 01:02:48 | INFO | src.nested_cv_avggrm_weighted_unified | Trial 281 | outer=6 | pruned after 7/10 inner folds (mean r=0.2643)
[I 2026-06-01 01:02:48,389] Trial 281 pruned. 
2026-06-01 01:02:48 | INFO | src.nested_cv_avggrm_weighted_unified | Trial 282 | outer=6 | alpha=1.679e+05 n_pcs=4000 (pc_topk) weight_search=on
2026-06-01 01:02:48 | INFO | src.nested_cv_avggrm_weighted_unified | Trial 282 | outer=6 | weight={'name': 'exponential', 'floor': 1e-06, 'clip_max': 3.0, 'beta': 3.99023685587585}
[I 2026-06-01 01:02:53,559] Trial 282 finished with value: 0.23814424930705505 and parameters: {'alpha': 167937.1738160221, 'n_pcs': 4000, 'weight_scheme': 'exponential', 'weight_clip_max': 3.0, 'weight_exponential_beta': 3.99023685587585}. Best is trial 237 with value: 0.23825365933560247.
2026-06-01 01:02:53 | INFO | src.nested_cv_avggrm_weighted_unified | Trial 283 | outer=6 | alpha=1.786e+05 n_pcs=1500 (pc_topk) weight_search=on
2026-06-01 01:02:53 | INFO | src.nested_cv_avggrm_weighted_unified | Trial 283 | outer=6 | weight={'name': 'exponential', 'floor': 1e-06, 'clip_max': 3.0, 'beta': 3.895047465215529}
2026-06-01 01:02:55 | INFO | src.nested_cv_avggrm_weighted_unified | Trial 283 | outer=6 | pruned after 6/10 inner folds (mean r=0.2455)
[I 2026-06-01 01:02:55,128] Trial 283 pruned. 
2026-06-01 01:02:55 | INFO | src.nested_cv_avggrm_weighted_unified | Trial 284 | outer=6 | alpha=1.212e+05 n_pcs=4000 (pc_topk) weight_search=on
2026-06-01 01:02:55 | INFO | src.nested_cv_avggrm_weighted_unified | Trial 284 | outer=6 | weight={'name': 'exponential', 'floor': 1e-06, 'clip_max': 3.0, 'beta': 3.6286742420271367}
2026-06-01 01:02:59 | INFO | src.nested_cv_avggrm_weighted_unified | Trial 284 | outer=6 | pruned after 7/10 inner folds (mean r=0.2632)
[I 2026-06-01 01:02:59,013] Trial 284 pruned. 
2026-06-01 01:02:59 | INFO | src.nested_cv_avggrm_weighted_unified | Trial 285 | outer=6 | alpha=2.345e+05 n_pcs=4000 (pc_topk) weight_search=on
2026-06-01 01:02:59 | INFO | src.nested_cv_avggrm_weighted_unified | Trial 285 | outer=6 | weight={'name': 'exponential', 'floor': 1e-06, 'clip_max': 3.0, 'beta': 4.016979223233574}
[I 2026-06-01 01:03:04,237] Trial 285 finished with value: 0.23739723496586218 and parameters: {'alpha': 234505.59777788058, 'n_pcs': 4000, 'weight_scheme': 'exponential', 'weight_clip_max': 3.0, 'weight_exponential_beta': 4.016979223233574}. Best is trial 237 with value: 0.23825365933560247.
2026-06-01 01:03:04 | INFO | src.nested_cv_avggrm_weighted_unified | Trial 286 | outer=6 | alpha=8.451e+04 n_pcs=4000 (pc_topk) weight_search=on
2026-06-01 01:03:04 | INFO | src.nested_cv_avggrm_weighted_unified | Trial 286 | outer=6 | weight={'name': 'exponential', 'floor': 1e-06, 'clip_max': 3.0, 'beta': 3.8085455738788325}
2026-06-01 01:03:07 | INFO | src.nested_cv_avggrm_weighted_unified | Trial 286 | outer=6 | pruned after 7/10 inner folds (mean r=0.2600)
[I 2026-06-01 01:03:07,878] Trial 286 pruned. 
2026-06-01 01:03:07 | INFO | src.nested_cv_avggrm_weighted_unified | Trial 287 | outer=6 | alpha=1.767e+05 n_pcs=3500 (pc_topk) weight_search=on
2026-06-01 01:03:07 | INFO | src.nested_cv_avggrm_weighted_unified | Trial 287 | outer=6 | weight={'name': 'exponential', 'floor': 1e-06, 'clip_max': 3.0, 'beta': 3.6689478652184504}
2026-06-01 01:03:10 | INFO | src.nested_cv_avggrm_weighted_unified | Trial 287 | outer=6 | pruned after 7/10 inner folds (mean r=0.2645)
[I 2026-06-01 01:03:10,960] Trial 287 pruned. 
2026-06-01 01:03:10 | INFO | src.nested_cv_avggrm_weighted_unified | Trial 288 | outer=6 | alpha=1.373e+05 n_pcs=4000 (pc_topk) weight_search=on
2026-06-01 01:03:10 | INFO | src.nested_cv_avggrm_weighted_unified | Trial 288 | outer=6 | weight={'name': 'exponential', 'floor': 1e-06, 'clip_max': None, 'beta': 4.014403417755332}
2026-06-01 01:03:14 | INFO | src.nested_cv_avggrm_weighted_unified | Trial 288 | outer=6 | pruned after 6/10 inner folds (mean r=0.2377)
[I 2026-06-01 01:03:14,183] Trial 288 pruned. 
2026-06-01 01:03:14 | INFO | src.nested_cv_avggrm_weighted_unified | Trial 289 | outer=6 | alpha=1.777e+05 n_pcs=4000 (pc_topk) weight_search=on
2026-06-01 01:03:14 | INFO | src.nested_cv_avggrm_weighted_unified | Trial 289 | outer=6 | weight={'name': 'exponential', 'floor': 1e-06, 'clip_max': 3.0, 'beta': 3.826013487021738}
[I 2026-06-01 01:03:19,411] Trial 289 finished with value: 0.23805972674161308 and parameters: {'alpha': 177717.87567870016, 'n_pcs': 4000, 'weight_scheme': 'exponential', 'weight_clip_max': 3.0, 'weight_exponential_beta': 3.826013487021738}. Best is trial 237 with value: 0.23825365933560247.
2026-06-01 01:03:19 | INFO | src.nested_cv_avggrm_weighted_unified | Trial 290 | outer=6 | alpha=2.272e+05 n_pcs=4000 (pc_topk) weight_search=on
2026-06-01 01:03:19 | INFO | src.nested_cv_avggrm_weighted_unified | Trial 290 | outer=6 | weight={'name': 'exponential', 'floor': 1e-06, 'clip_max': 3.0, 'beta': 0.8166010223166342}
2026-06-01 01:03:22 | INFO | src.nested_cv_avggrm_weighted_unified | Trial 290 | outer=6 | pruned after 6/10 inner folds (mean r=0.2468)
[I 2026-06-01 01:03:22,511] Trial 290 pruned. 
2026-06-01 01:03:22 | INFO | src.nested_cv_avggrm_weighted_unified | Trial 291 | outer=6 | alpha=1.446e+05 n_pcs=4000 (pc_topk) weight_search=on
2026-06-01 01:03:22 | INFO | src.nested_cv_avggrm_weighted_unified | Trial 291 | outer=6 | weight={'name': 'exponential', 'floor': 1e-06, 'clip_max': 3.0, 'beta': 3.588135325843677}
2026-06-01 01:03:26 | INFO | src.nested_cv_avggrm_weighted_unified | Trial 291 | outer=6 | pruned after 7/10 inner folds (mean r=0.2643)
