[I 2026-06-01 18:59:23,904] Trial 121 finished with value: 0.25635659329736105 and parameters: {'alpha': 84776.65496547695, 'n_pcs': 4000, 'iw_method': 'pc_logistic', 'iw_clip_max': 4.0, 'iw_prob_clip': 0.01836358281620227, 'iw_n_components': 100, 'iw_logistic_c': 0.00022127179416666425, 'iw_pca_fit': 'combined', 'iw_solver': 'lbfgs', 'iw_rho': 0.85}. Best is trial 105 with value: 0.2576898995269994.
2026-06-01 18:59:23 | INFO | Trial 122 | outer=5 | alpha=5.090e+04 n_pcs=4000 (pc_topk) weight={'name': 'pc_logistic', 'floor': 1e-06, 'clip_max': 4.0, 'prob_clip': 0.01742636467385464, 'n_components': 100, 'logistic_c': 0.00011009204334677459, 'pca_fit': 'combined', 'solver': 'lbfgs', 'max_iter': 2000, 'fit_intercept': True, 'standardize_with_source': True, 'rho': 0.85}
[I 2026-06-01 18:59:37,486] Trial 122 finished with value: 0.2574954468980417 and parameters: {'alpha': 50897.05441621251, 'n_pcs': 4000, 'iw_method': 'pc_logistic', 'iw_clip_max': 4.0, 'iw_prob_clip': 0.01742636467385464, 'iw_n_components': 100, 'iw_logistic_c': 0.00011009204334677459, 'iw_pca_fit': 'combined', 'iw_solver': 'lbfgs', 'iw_rho': 0.85}. Best is trial 105 with value: 0.2576898995269994.
2026-06-01 18:59:37 | INFO | Trial 123 | outer=5 | alpha=9.737e+06 n_pcs=4000 (pc_topk) weight={'name': 'pc_logistic', 'floor': 1e-06, 'clip_max': 7.0, 'prob_clip': 0.01665181422919091, 'n_components': 100, 'logistic_c': 0.00024404404672482058, 'pca_fit': 'combined', 'solver': 'lbfgs', 'max_iter': 2000, 'fit_intercept': True, 'standardize_with_source': True, 'rho': 0.85}
[I 2026-06-01 18:59:52,693] Trial 123 finished with value: 0.2230123132404216 and parameters: {'alpha': 9737107.945261743, 'n_pcs': 4000, 'iw_method': 'pc_logistic', 'iw_clip_max': 7.0, 'iw_prob_clip': 0.01665181422919091, 'iw_n_components': 100, 'iw_logistic_c': 0.00024404404672482058, 'iw_pca_fit': 'combined', 'iw_solver': 'lbfgs', 'iw_rho': 0.85}. Best is trial 105 with value: 0.2576898995269994.
2026-06-01 18:59:52 | INFO | Trial 124 | outer=5 | alpha=4.945e+04 n_pcs=4000 (pc_topk) weight={'name': 'pc_logistic', 'floor': 1e-06, 'clip_max': 4.0, 'prob_clip': 0.014690942617018308, 'n_components': 100, 'logistic_c': 2.5161257909527013e-05, 'pca_fit': 'combined', 'solver': 'lbfgs', 'max_iter': 2000, 'fit_intercept': True, 'standardize_with_source': True, 'rho': 0.85}
[I 2026-06-01 19:00:05,593] Trial 124 finished with value: 0.2563363891824133 and parameters: {'alpha': 49452.96705407421, 'n_pcs': 4000, 'iw_method': 'pc_logistic', 'iw_clip_max': 4.0, 'iw_prob_clip': 0.014690942617018308, 'iw_n_components': 100, 'iw_logistic_c': 2.5161257909527013e-05, 'iw_pca_fit': 'combined', 'iw_solver': 'lbfgs', 'iw_rho': 0.85}. Best is trial 105 with value: 0.2576898995269994.
2026-06-01 19:00:05 | INFO | Trial 125 | outer=5 | alpha=7.882e+04 n_pcs=3500 (pc_topk) weight={'name': 'pc_logistic', 'floor': 1e-06, 'clip_max': 4.0, 'prob_clip': 0.02348124873266583, 'n_components': 100, 'logistic_c': 7.921724031313555e-05, 'pca_fit': 'combined', 'solver': 'lbfgs', 'max_iter': 2000, 'fit_intercept': True, 'standardize_with_source': True, 'rho': 0.85}
[I 2026-06-01 19:00:17,907] Trial 125 finished with value: 0.2550271573724057 and parameters: {'alpha': 78815.72049290455, 'n_pcs': 3500, 'iw_method': 'pc_logistic', 'iw_clip_max': 4.0, 'iw_prob_clip': 0.02348124873266583, 'iw_n_components': 100, 'iw_logistic_c': 7.921724031313555e-05, 'iw_pca_fit': 'combined', 'iw_solver': 'lbfgs', 'iw_rho': 0.85}. Best is trial 105 with value: 0.2576898995269994.
2026-06-01 19:00:17 | INFO | Trial 126 | outer=5 | alpha=2.841e+04 n_pcs=4500 (pc_topk) weight={'name': 'pc_logistic', 'floor': 1e-06, 'clip_max': 4.0, 'prob_clip': 0.030779087842718267, 'n_components': 100, 'logistic_c': 5.4208881763459435e-05, 'pca_fit': 'combined', 'solver': 'lbfgs', 'max_iter': 2000, 'fit_intercept': True, 'standardize_with_source': True, 'rho': 0.3}
[I 2026-06-01 19:00:32,569] Trial 126 finished with value: 0.2527231971127313 and parameters: {'alpha': 28411.987848635057, 'n_pcs': 4500, 'iw_method': 'pc_logistic', 'iw_clip_max': 4.0, 'iw_prob_clip': 0.030779087842718267, 'iw_n_components': 100, 'iw_logistic_c': 5.4208881763459435e-05, 'iw_pca_fit': 'combined', 'iw_solver': 'lbfgs', 'iw_rho': 0.3}. Best is trial 105 with value: 0.2576898995269994.
2026-06-01 19:00:32 | INFO | Trial 127 | outer=5 | alpha=5.689e+04 n_pcs=4000 (pc_topk) weight={'name': 'pc_logistic', 'floor': 1e-06, 'clip_max': 4.0, 'prob_clip': 0.0213848082609395, 'n_components': 100, 'logistic_c': 0.0001381850614118296, 'pca_fit': 'combined', 'solver': 'lbfgs', 'max_iter': 2000, 'fit_intercept': True, 'standardize_with_source': True, 'rho': 0.85}
[I 2026-06-01 19:00:46,425] Trial 127 finished with value: 0.2577919277362231 and parameters: {'alpha': 56887.34462402945, 'n_pcs': 4000, 'iw_method': 'pc_logistic', 'iw_clip_max': 4.0, 'iw_prob_clip': 0.0213848082609395, 'iw_n_components': 100, 'iw_logistic_c': 0.0001381850614118296, 'iw_pca_fit': 'combined', 'iw_solver': 'lbfgs', 'iw_rho': 0.85}. Best is trial 127 with value: 0.2577919277362231.
2026-06-01 19:00:46 | INFO | Trial 128 | outer=5 | alpha=3.807e+06 n_pcs=4000 (pc_topk) weight={'name': 'pc_logistic', 'floor': 1e-06, 'clip_max': 4.0, 'prob_clip': 0.02145871713882539, 'n_components': 20, 'logistic_c': 0.00014227378646126983, 'pca_fit': 'combined', 'solver': 'lbfgs', 'max_iter': 2000, 'fit_intercept': True, 'standardize_with_source': True, 'rho': 0.85}
[I 2026-06-01 19:00:59,929] Trial 128 finished with value: 0.22180053716004106 and parameters: {'alpha': 3807131.3338423115, 'n_pcs': 4000, 'iw_method': 'pc_logistic', 'iw_clip_max': 4.0, 'iw_prob_clip': 0.02145871713882539, 'iw_n_components': 20, 'iw_logistic_c': 0.00014227378646126983, 'iw_pca_fit': 'combined', 'iw_solver': 'lbfgs', 'iw_rho': 0.85}. Best is trial 127 with value: 0.2577919277362231.
2026-06-01 19:00:59 | INFO | Trial 129 | outer=5 | alpha=5.504e+04 n_pcs=4000 (pc_topk) weight={'name': 'pc_logistic', 'floor': 1e-06, 'clip_max': 7.0, 'prob_clip': 0.02431989004934859, 'n_components': 100, 'logistic_c': 0.00011157196195452951, 'pca_fit': 'combined', 'solver': 'lbfgs', 'max_iter': 2000, 'fit_intercept': True, 'standardize_with_source': True, 'rho': 0.85}
[I 2026-06-01 19:01:14,182] Trial 129 finished with value: 0.2575324245934968 and parameters: {'alpha': 55041.34893277396, 'n_pcs': 4000, 'iw_method': 'pc_logistic', 'iw_clip_max': 7.0, 'iw_prob_clip': 0.02431989004934859, 'iw_n_components': 100, 'iw_logistic_c': 0.00011157196195452951, 'iw_pca_fit': 'combined', 'iw_solver': 'lbfgs', 'iw_rho': 0.85}. Best is trial 127 with value: 0.2577919277362231.
2026-06-01 19:01:14 | INFO | Trial 130 | outer=5 | alpha=4.633e+04 n_pcs=4500 (pc_topk) weight={'name': 'pc_logistic', 'floor': 1e-06, 'clip_max': 7.0, 'prob_clip': 0.02478530815898807, 'n_components': 100, 'logistic_c': 0.0002835426313501328, 'pca_fit': 'combined', 'solver': 'lbfgs', 'max_iter': 2000, 'fit_intercept': True, 'standardize_with_source': True, 'rho': 0.85}
[I 2026-06-01 19:01:32,964] Trial 130 finished with value: 0.2571936537227375 and parameters: {'alpha': 46330.138294648576, 'n_pcs': 4500, 'iw_method': 'pc_logistic', 'iw_clip_max': 7.0, 'iw_prob_clip': 0.02478530815898807, 'iw_n_components': 100, 'iw_logistic_c': 0.0002835426313501328, 'iw_pca_fit': 'combined', 'iw_solver': 'lbfgs', 'iw_rho': 0.85}. Best is trial 127 with value: 0.2577919277362231.
2026-06-01 19:01:33 | INFO | Trial 131 | outer=5 | alpha=5.267e+04 n_pcs=4500 (pc_topk) weight={'name': 'pc_logistic', 'floor': 1e-06, 'clip_max': 7.0, 'prob_clip': 0.025495030916160316, 'n_components': 100, 'logistic_c': 0.0002688251930717302, 'pca_fit': 'combined', 'solver': 'lbfgs', 'max_iter': 2000, 'fit_intercept': True, 'standardize_with_source': True, 'rho': 0.85}
[I 2026-06-01 19:01:50,147] Trial 131 finished with value: 0.2569169915893154 and parameters: {'alpha': 52672.61746097998, 'n_pcs': 4500, 'iw_method': 'pc_logistic', 'iw_clip_max': 7.0, 'iw_prob_clip': 0.025495030916160316, 'iw_n_components': 100, 'iw_logistic_c': 0.0002688251930717302, 'iw_pca_fit': 'combined', 'iw_solver': 'lbfgs', 'iw_rho': 0.85}. Best is trial 127 with value: 0.2577919277362231.
2026-06-01 19:01:50 | INFO | Trial 132 | outer=5 | alpha=5.529e+04 n_pcs=4500 (pc_topk) weight={'name': 'pc_logistic', 'floor': 1e-06, 'clip_max': 7.0, 'prob_clip': 0.02592234137498771, 'n_components': 100, 'logistic_c': 0.00017822503367608445, 'pca_fit': 'combined', 'solver': 'lbfgs', 'max_iter': 2000, 'fit_intercept': True, 'standardize_with_source': True, 'rho': 0.85}
[I 2026-06-01 19:02:06,834] Trial 132 finished with value: 0.25710225285566163 and parameters: {'alpha': 55288.66086511745, 'n_pcs': 4500, 'iw_method': 'pc_logistic', 'iw_clip_max': 7.0, 'iw_prob_clip': 0.02592234137498771, 'iw_n_components': 100, 'iw_logistic_c': 0.00017822503367608445, 'iw_pca_fit': 'combined', 'iw_solver': 'lbfgs', 'iw_rho': 0.85}. Best is trial 127 with value: 0.2577919277362231.
2026-06-01 19:02:06 | INFO | Trial 133 | outer=5 | alpha=4.609e+04 n_pcs=4500 (pc_topk) weight={'name': 'pc_logistic', 'floor': 1e-06, 'clip_max': 7.0, 'prob_clip': 0.027427336712275353, 'n_components': 100, 'logistic_c': 0.00025694404734837484, 'pca_fit': 'combined', 'solver': 'lbfgs', 'max_iter': 2000, 'fit_intercept': True, 'standardize_with_source': True, 'rho': 0.85}
[I 2026-06-01 19:02:23,413] Trial 133 finished with value: 0.2571170610330072 and parameters: {'alpha': 46088.51856425849, 'n_pcs': 4500, 'iw_method': 'pc_logistic', 'iw_clip_max': 7.0, 'iw_prob_clip': 0.027427336712275353, 'iw_n_components': 100, 'iw_logistic_c': 0.00025694404734837484, 'iw_pca_fit': 'combined', 'iw_solver': 'lbfgs', 'iw_rho': 0.85}. Best is trial 127 with value: 0.2577919277362231.
2026-06-01 19:02:23 | INFO | Trial 134 | outer=5 | alpha=4.579e+04 n_pcs=4500 (pc_topk) weight={'name': 'pc_logistic', 'floor': 1e-06, 'clip_max': 7.0, 'prob_clip': 0.027176215618364908, 'n_components': 100, 'logistic_c': 0.00028755136825847497, 'pca_fit': 'combined', 'solver': 'lbfgs', 'max_iter': 2000, 'fit_intercept': True, 'standardize_with_source': True, 'rho': 0.85}
[I 2026-06-01 19:02:41,581] Trial 134 finished with value: 0.2570738381213301 and parameters: {'alpha': 45794.72229557507, 'n_pcs': 4500, 'iw_method': 'pc_logistic', 'iw_clip_max': 7.0, 'iw_prob_clip': 0.027176215618364908, 'iw_n_components': 100, 'iw_logistic_c': 0.00028755136825847497, 'iw_pca_fit': 'combined', 'iw_solver': 'lbfgs', 'iw_rho': 0.85}. Best is trial 127 with value: 0.2577919277362231.
2026-06-01 19:02:41 | INFO | Trial 135 | outer=5 | alpha=4.691e+04 n_pcs=4500 (pc_topk) weight={'name': 'uniform'}
[I 2026-06-01 19:02:50,022] Trial 135 finished with value: 0.24152986548741504 and parameters: {'alpha': 46912.441126113816, 'n_pcs': 4500, 'iw_method': 'uniform'}. Best is trial 127 with value: 0.2577919277362231.
2026-06-01 19:02:50 | INFO | Trial 136 | outer=5 | alpha=3.068e+04 n_pcs=4500 (pc_topk) weight={'name': 'pc_logistic', 'floor': 1e-06, 'clip_max': 7.0, 'prob_clip': 0.02771385824165685, 'n_components': 100, 'logistic_c': 0.0002718781508212476, 'pca_fit': 'combined', 'solver': 'lbfgs', 'max_iter': 2000, 'fit_intercept': True, 'standardize_with_source': True, 'rho': 0.85}
[I 2026-06-01 19:03:07,439] Trial 136 finished with value: 0.2566775242698214 and parameters: {'alpha': 30683.05039508833, 'n_pcs': 4500, 'iw_method': 'pc_logistic', 'iw_clip_max': 7.0, 'iw_prob_clip': 0.02771385824165685, 'iw_n_components': 100, 'iw_logistic_c': 0.0002718781508212476, 'iw_pca_fit': 'combined', 'iw_solver': 'lbfgs', 'iw_rho': 0.85}. Best is trial 127 with value: 0.2577919277362231.
2026-06-01 19:03:07 | INFO | Trial 137 | outer=5 | alpha=4.001e+04 n_pcs=4500 (pc_topk) weight={'name': 'pc_logistic', 'floor': 1e-06, 'clip_max': 7.0, 'prob_clip': 0.03189876359124266, 'n_components': 100, 'logistic_c': 0.0010418308085645251, 'pca_fit': 'combined', 'solver': 'lbfgs', 'max_iter': 2000, 'fit_intercept': True, 'standardize_with_source': True, 'rho': 0.85}
[I 2026-06-01 19:03:26,063] Trial 137 finished with value: 0.25662831420833654 and parameters: {'alpha': 40012.135334346465, 'n_pcs': 4500, 'iw_method': 'pc_logistic', 'iw_clip_max': 7.0, 'iw_prob_clip': 0.03189876359124266, 'iw_n_components': 100, 'iw_logistic_c': 0.0010418308085645251, 'iw_pca_fit': 'combined', 'iw_solver': 'lbfgs', 'iw_rho': 0.85}. Best is trial 127 with value: 0.2577919277362231.
2026-06-01 19:03:26 | INFO | Trial 138 | outer=5 | alpha=5.831e+04 n_pcs=4500 (pc_topk) weight={'name': 'pc_logistic', 'floor': 1e-06, 'clip_max': 7.0, 'prob_clip': 0.02467171233743088, 'n_components': 60, 'logistic_c': 0.00019281699736817446, 'pca_fit': 'combined', 'solver': 'lbfgs', 'max_iter': 2000, 'fit_intercept': True, 'standardize_with_source': True, 'rho': 1.0}
[I 2026-06-01 19:03:42,435] Trial 138 finished with value: 0.2535593359963634 and parameters: {'alpha': 58313.57781604942, 'n_pcs': 4500, 'iw_method': 'pc_logistic', 'iw_clip_max': 7.0, 'iw_prob_clip': 0.02467171233743088, 'iw_n_components': 60, 'iw_logistic_c': 0.00019281699736817446, 'iw_pca_fit': 'combined', 'iw_solver': 'lbfgs', 'iw_rho': 1.0}. Best is trial 127 with value: 0.2577919277362231.
2026-06-01 19:03:42 | INFO | Trial 139 | outer=5 | alpha=2.553e+04 n_pcs=5000 (pc_topk) weight={'name': 'pc_logistic', 'floor': 1e-06, 'clip_max': 7.0, 'prob_clip': 0.02863764221782478, 'n_components': 40, 'logistic_c': 4.257594439963043e-05, 'pca_fit': 'combined', 'solver': 'lbfgs', 'max_iter': 2000, 'fit_intercept': True, 'standardize_with_source': True, 'rho': 0.85}
[I 2026-06-01 19:03:59,266] Trial 139 finished with value: 0.2542957141579419 and parameters: {'alpha': 25525.347893076872, 'n_pcs': 5000, 'iw_method': 'pc_logistic', 'iw_clip_max': 7.0, 'iw_prob_clip': 0.02863764221782478, 'iw_n_components': 40, 'iw_logistic_c': 4.257594439963043e-05, 'iw_pca_fit': 'combined', 'iw_solver': 'lbfgs', 'iw_rho': 0.85}. Best is trial 127 with value: 0.2577919277362231.
2026-06-01 19:03:59 | INFO | Trial 140 | outer=5 | alpha=4.466e+04 n_pcs=4500 (pc_topk) weight={'name': 'pc_logistic', 'floor': 1e-06, 'clip_max': 7.0, 'prob_clip': 0.03299394819770382, 'n_components': 100, 'logistic_c': 0.0003785860865268704, 'pca_fit': 'combined', 'solver': 'lbfgs', 'max_iter': 2000, 'fit_intercept': True, 'standardize_with_source': True, 'rho': 0.5}
[I 2026-06-01 19:04:16,739] Trial 140 finished with value: 0.2550514510848866 and parameters: {'alpha': 44661.0042947354, 'n_pcs': 4500, 'iw_method': 'pc_logistic', 'iw_clip_max': 7.0, 'iw_prob_clip': 0.03299394819770382, 'iw_n_components': 100, 'iw_logistic_c': 0.0003785860865268704, 'iw_pca_fit': 'combined', 'iw_solver': 'lbfgs', 'iw_rho': 0.5}. Best is trial 127 with value: 0.2577919277362231.
2026-06-01 19:04:16 | INFO | Trial 141 | outer=5 | alpha=5.330e+04 n_pcs=4500 (pc_topk) weight={'name': 'pc_logistic', 'floor': 1e-06, 'clip_max': 7.0, 'prob_clip': 0.024747980175675227, 'n_components': 100, 'logistic_c': 0.0002787637832718325, 'pca_fit': 'combined', 'solver': 'lbfgs', 'max_iter': 2000, 'fit_intercept': True, 'standardize_with_source': True, 'rho': 0.85}
[I 2026-06-01 19:04:33,536] Trial 141 finished with value: 0.2569100798268359 and parameters: {'alpha': 53302.693461821415, 'n_pcs': 4500, 'iw_method': 'pc_logistic', 'iw_clip_max': 7.0, 'iw_prob_clip': 0.024747980175675227, 'iw_n_components': 100, 'iw_logistic_c': 0.0002787637832718325, 'iw_pca_fit': 'combined', 'iw_solver': 'lbfgs', 'iw_rho': 0.85}. Best is trial 127 with value: 0.2577919277362231.
2026-06-01 19:04:33 | INFO | Trial 142 | outer=5 | alpha=6.804e+04 n_pcs=4500 (pc_topk) weight={'name': 'pc_logistic', 'floor': 1e-06, 'clip_max': 7.0, 'prob_clip': 0.02799222777406063, 'n_components': 100, 'logistic_c': 0.0006966009308880825, 'pca_fit': 'combined', 'solver': 'lbfgs', 'max_iter': 2000, 'fit_intercept': True, 'standardize_with_source': True, 'rho': 0.85}
[I 2026-06-01 19:04:51,424] Trial 142 finished with value: 0.2549854912946107 and parameters: {'alpha': 68036.99658490178, 'n_pcs': 4500, 'iw_method': 'pc_logistic', 'iw_clip_max': 7.0, 'iw_prob_clip': 0.02799222777406063, 'iw_n_components': 100, 'iw_logistic_c': 0.0006966009308880825, 'iw_pca_fit': 'combined', 'iw_solver': 'lbfgs', 'iw_rho': 0.85}. Best is trial 127 with value: 0.2577919277362231.
2026-06-01 19:04:51 | INFO | Trial 143 | outer=5 | alpha=4.182e+04 n_pcs=4500 (pc_topk) weight={'name': 'pc_logistic', 'floor': 1e-06, 'clip_max': 7.0, 'prob_clip': 0.026041385330157554, 'n_components': 100, 'logistic_c': 0.00020027328412079297, 'pca_fit': 'combined', 'solver': 'lbfgs', 'max_iter': 2000, 'fit_intercept': True, 'standardize_with_source': True, 'rho': 0.85}
[I 2026-06-01 19:05:07,919] Trial 143 finished with value: 0.2574695649116691 and parameters: {'alpha': 41817.17380911103, 'n_pcs': 4500, 'iw_method': 'pc_logistic', 'iw_clip_max': 7.0, 'iw_prob_clip': 0.026041385330157554, 'iw_n_components': 100, 'iw_logistic_c': 0.00020027328412079297, 'iw_pca_fit': 'combined', 'iw_solver': 'lbfgs', 'iw_rho': 0.85}. Best is trial 127 with value: 0.2577919277362231.
2026-06-01 19:05:07 | INFO | Trial 144 | outer=5 | alpha=3.200e+04 n_pcs=4500 (pc_topk) weight={'name': 'pc_logistic', 'floor': 1e-06, 'clip_max': 7.0, 'prob_clip': 0.022659077206343452, 'n_components': 100, 'logistic_c': 0.00018090948828875387, 'pca_fit': 'combined', 'solver': 'lbfgs', 'max_iter': 2000, 'fit_intercept': True, 'standardize_with_source': True, 'rho': 0.85}
[I 2026-06-01 19:05:24,715] Trial 144 finished with value: 0.25709296462299475 and parameters: {'alpha': 32004.141237281787, 'n_pcs': 4500, 'iw_method': 'pc_logistic', 'iw_clip_max': 7.0, 'iw_prob_clip': 0.022659077206343452, 'iw_n_components': 100, 'iw_logistic_c': 0.00018090948828875387, 'iw_pca_fit': 'combined', 'iw_solver': 'lbfgs', 'iw_rho': 0.85}. Best is trial 127 with value: 0.2577919277362231.
2026-06-01 19:05:24 | INFO | Trial 145 | outer=5 | alpha=2.047e+04 n_pcs=5000 (pc_topk) weight={'name': 'pc_logistic', 'floor': 1e-06, 'clip_max': 7.0, 'prob_clip': 0.02239396634820926, 'n_components': 10, 'logistic_c': 1.533768470328934e-05, 'pca_fit': 'combined', 'solver': 'lbfgs', 'max_iter': 2000, 'fit_intercept': True, 'standardize_with_source': True, 'rho': 0.85}
[I 2026-06-01 19:05:41,339] Trial 145 finished with value: 0.24725711059969804 and parameters: {'alpha': 20469.997890694864, 'n_pcs': 5000, 'iw_method': 'pc_logistic', 'iw_clip_max': 7.0, 'iw_prob_clip': 0.02239396634820926, 'iw_n_components': 10, 'iw_logistic_c': 1.533768470328934e-05, 'iw_pca_fit': 'combined', 'iw_solver': 'lbfgs', 'iw_rho': 0.85}. Best is trial 127 with value: 0.2577919277362231.
2026-06-01 19:05:41 | INFO | Trial 146 | outer=5 | alpha=3.035e+04 n_pcs=4500 (pc_topk) weight={'name': 'pc_logistic', 'floor': 1e-06, 'clip_max': 7.0, 'prob_clip': 0.0365450489856658, 'n_components': 100, 'logistic_c': 9.313350423492111e-05, 'pca_fit': 'combined', 'solver': 'lbfgs', 'max_iter': 2000, 'fit_intercept': True, 'standardize_with_source': True, 'rho': 0.85}
[I 2026-06-01 19:05:57,363] Trial 146 finished with value: 0.25671296568879326 and parameters: {'alpha': 30352.38223381452, 'n_pcs': 4500, 'iw_method': 'pc_logistic', 'iw_clip_max': 7.0, 'iw_prob_clip': 0.0365450489856658, 'iw_n_components': 100, 'iw_logistic_c': 9.313350423492111e-05, 'iw_pca_fit': 'combined', 'iw_solver': 'lbfgs', 'iw_rho': 0.85}. Best is trial 127 with value: 0.2577919277362231.
2026-06-01 19:05:57 | INFO | Trial 147 | outer=5 | alpha=3.962e+04 n_pcs=4500 (pc_topk) weight={'name': 'pc_logistic', 'floor': 1e-06, 'clip_max': 7.0, 'prob_clip': 0.023174983906261853, 'n_components': 100, 'logistic_c': 4.735492883594151e-05, 'pca_fit': 'combined', 'solver': 'lbfgs', 'max_iter': 2000, 'fit_intercept': True, 'standardize_with_source': True, 'rho': 0.85}
[I 2026-06-01 19:06:12,568] Trial 147 finished with value: 0.25836214582968176 and parameters: {'alpha': 39616.703020428344, 'n_pcs': 4500, 'iw_method': 'pc_logistic', 'iw_clip_max': 7.0, 'iw_prob_clip': 0.023174983906261853, 'iw_n_components': 100, 'iw_logistic_c': 4.735492883594151e-05, 'iw_pca_fit': 'combined', 'iw_solver': 'lbfgs', 'iw_rho': 0.85}. Best is trial 147 with value: 0.25836214582968176.
2026-06-01 19:06:12 | INFO | Trial 148 | outer=5 | alpha=3.973e+04 n_pcs=2000 (pc_topk) weight={'name': 'pc_logistic', 'floor': 1e-06, 'clip_max': 7.0, 'prob_clip': 0.025683233241433786, 'n_components': 100, 'logistic_c': 4.883118164116007e-05, 'pca_fit': 'combined', 'solver': 'lbfgs', 'max_iter': 2000, 'fit_intercept': True, 'standardize_with_source': True, 'rho': 0.3}
[I 2026-06-01 19:06:22,477] Trial 148 finished with value: 0.24383514665213504 and parameters: {'alpha': 39727.66940213841, 'n_pcs': 2000, 'iw_method': 'pc_logistic', 'iw_clip_max': 7.0, 'iw_prob_clip': 0.025683233241433786, 'iw_n_components': 100, 'iw_logistic_c': 4.883118164116007e-05, 'iw_pca_fit': 'combined', 'iw_solver': 'lbfgs', 'iw_rho': 0.3}. Best is trial 147 with value: 0.25836214582968176.
2026-06-01 19:06:22 | INFO | Trial 149 | outer=5 | alpha=5.826e+04 n_pcs=4500 (pc_topk) weight={'name': 'pc_logistic', 'floor': 1e-06, 'clip_max': 7.0, 'prob_clip': 0.044820182958779015, 'n_components': 100, 'logistic_c': 6.262381509422595e-05, 'pca_fit': 'combined', 'solver': 'lbfgs', 'max_iter': 2000, 'fit_intercept': True, 'standardize_with_source': True, 'rho': 0.85}
