[I 2026-06-01 21:43:29,390] Trial 141 finished with value: 0.22733732604117804 and parameters: {'alpha': 42396.993117616206, 'n_pcs': 4000, 'iw_method': 'pc_logistic', 'iw_clip_max': 12.0, 'iw_prob_clip': 0.020792597730296767, 'iw_n_components': 40, 'iw_logistic_c': 1.5355401355732392e-05, 'iw_pca_fit': 'combined', 'iw_solver': 'lbfgs', 'iw_rho': 1.0}. Best is trial 84 with value: 0.2289525216150688.
2026-06-01 21:43:29 | INFO | Trial 142 | outer=7 | alpha=4.034e+04 n_pcs=4000 (pc_topk) weight={'name': 'pc_logistic', 'floor': 1e-06, 'clip_max': 12.0, 'prob_clip': 0.021442494041354388, 'n_components': 40, 'logistic_c': 1.3943303867983029e-05, 'pca_fit': 'combined', 'solver': 'lbfgs', 'max_iter': 2000, 'fit_intercept': True, 'standardize_with_source': True, 'rho': 1.0}
[I 2026-06-01 21:43:42,075] Trial 142 finished with value: 0.227327530380587 and parameters: {'alpha': 40342.279054588755, 'n_pcs': 4000, 'iw_method': 'pc_logistic', 'iw_clip_max': 12.0, 'iw_prob_clip': 0.021442494041354388, 'iw_n_components': 40, 'iw_logistic_c': 1.3943303867983029e-05, 'iw_pca_fit': 'combined', 'iw_solver': 'lbfgs', 'iw_rho': 1.0}. Best is trial 84 with value: 0.2289525216150688.
2026-06-01 21:43:42 | INFO | Trial 143 | outer=7 | alpha=4.255e+04 n_pcs=4000 (pc_topk) weight={'name': 'pc_logistic', 'floor': 1e-06, 'clip_max': 12.0, 'prob_clip': 0.017597342350598663, 'n_components': 40, 'logistic_c': 3.6283152130466377e-06, 'pca_fit': 'combined', 'solver': 'lbfgs', 'max_iter': 2000, 'fit_intercept': True, 'standardize_with_source': True, 'rho': 1.0}
[I 2026-06-01 21:43:54,318] Trial 143 finished with value: 0.22573373529972812 and parameters: {'alpha': 42547.87204799409, 'n_pcs': 4000, 'iw_method': 'pc_logistic', 'iw_clip_max': 12.0, 'iw_prob_clip': 0.017597342350598663, 'iw_n_components': 40, 'iw_logistic_c': 3.6283152130466377e-06, 'iw_pca_fit': 'combined', 'iw_solver': 'lbfgs', 'iw_rho': 1.0}. Best is trial 84 with value: 0.2289525216150688.
2026-06-01 21:43:54 | INFO | Trial 144 | outer=7 | alpha=3.174e+04 n_pcs=4000 (pc_topk) weight={'name': 'pc_logistic', 'floor': 1e-06, 'clip_max': 4.0, 'prob_clip': 0.020787924907072933, 'n_components': 40, 'logistic_c': 1.3985033675951124e-05, 'pca_fit': 'combined', 'solver': 'lbfgs', 'max_iter': 2000, 'fit_intercept': True, 'standardize_with_source': True, 'rho': 1.0}
[I 2026-06-01 21:44:06,494] Trial 144 finished with value: 0.22777093991160396 and parameters: {'alpha': 31738.21554671111, 'n_pcs': 4000, 'iw_method': 'pc_logistic', 'iw_clip_max': 4.0, 'iw_prob_clip': 0.020787924907072933, 'iw_n_components': 40, 'iw_logistic_c': 1.3985033675951124e-05, 'iw_pca_fit': 'combined', 'iw_solver': 'lbfgs', 'iw_rho': 1.0}. Best is trial 84 with value: 0.2289525216150688.
2026-06-01 21:44:06 | INFO | Trial 145 | outer=7 | alpha=3.044e+04 n_pcs=4000 (pc_topk) weight={'name': 'pc_logistic', 'floor': 1e-06, 'clip_max': 4.0, 'prob_clip': 0.02101990020497716, 'n_components': 40, 'logistic_c': 6.71470472483752e-06, 'pca_fit': 'combined', 'solver': 'lbfgs', 'max_iter': 2000, 'fit_intercept': True, 'standardize_with_source': True, 'rho': 1.0}
[I 2026-06-01 21:44:19,285] Trial 145 finished with value: 0.22508631700559723 and parameters: {'alpha': 30442.959121011947, 'n_pcs': 4000, 'iw_method': 'pc_logistic', 'iw_clip_max': 4.0, 'iw_prob_clip': 0.02101990020497716, 'iw_n_components': 40, 'iw_logistic_c': 6.71470472483752e-06, 'iw_pca_fit': 'combined', 'iw_solver': 'lbfgs', 'iw_rho': 1.0}. Best is trial 84 with value: 0.2289525216150688.
2026-06-01 21:44:19 | INFO | Trial 146 | outer=7 | alpha=3.452e+04 n_pcs=3500 (pc_topk) weight={'name': 'pc_logistic', 'floor': 1e-06, 'clip_max': 12.0, 'prob_clip': 0.023076474502450782, 'n_components': 40, 'logistic_c': 9.421770804387315e-06, 'pca_fit': 'combined', 'solver': 'lbfgs', 'max_iter': 2000, 'fit_intercept': True, 'standardize_with_source': True, 'rho': 1.0}
[I 2026-06-01 21:44:30,774] Trial 146 finished with value: 0.22109705973807348 and parameters: {'alpha': 34517.00753892642, 'n_pcs': 3500, 'iw_method': 'pc_logistic', 'iw_clip_max': 12.0, 'iw_prob_clip': 0.023076474502450782, 'iw_n_components': 40, 'iw_logistic_c': 9.421770804387315e-06, 'iw_pca_fit': 'combined', 'iw_solver': 'lbfgs', 'iw_rho': 1.0}. Best is trial 84 with value: 0.2289525216150688.
2026-06-01 21:44:30 | INFO | Trial 147 | outer=7 | alpha=1.118e+05 n_pcs=4000 (pc_topk) weight={'name': 'pc_logistic', 'floor': 1e-06, 'clip_max': 4.0, 'prob_clip': 0.014342802223255957, 'n_components': 40, 'logistic_c': 2.994040729854883e-05, 'pca_fit': 'combined', 'solver': 'lbfgs', 'max_iter': 2000, 'fit_intercept': True, 'standardize_with_source': True, 'rho': 1.0}
[I 2026-06-01 21:44:44,043] Trial 147 finished with value: 0.22729416884258108 and parameters: {'alpha': 111786.18987246272, 'n_pcs': 4000, 'iw_method': 'pc_logistic', 'iw_clip_max': 4.0, 'iw_prob_clip': 0.014342802223255957, 'iw_n_components': 40, 'iw_logistic_c': 2.994040729854883e-05, 'iw_pca_fit': 'combined', 'iw_solver': 'lbfgs', 'iw_rho': 1.0}. Best is trial 84 with value: 0.2289525216150688.
2026-06-01 21:44:44 | INFO | Trial 148 | outer=7 | alpha=1.218e+05 n_pcs=4000 (pc_topk) weight={'name': 'uniform'}
[I 2026-06-01 21:44:51,190] Trial 148 finished with value: 0.21092467381405872 and parameters: {'alpha': 121843.0360033028, 'n_pcs': 4000, 'iw_method': 'uniform'}. Best is trial 84 with value: 0.2289525216150688.
2026-06-01 21:44:51 | INFO | Trial 149 | outer=7 | alpha=1.542e+05 n_pcs=4000 (pc_topk) weight={'name': 'pc_logistic', 'floor': 1e-06, 'clip_max': 2.5, 'prob_clip': 0.014927719605220265, 'n_components': 40, 'logistic_c': 2.9808821924203696e-05, 'pca_fit': 'combined', 'solver': 'lbfgs', 'max_iter': 2000, 'fit_intercept': True, 'standardize_with_source': True, 'rho': 1.0}
[I 2026-06-01 21:45:03,959] Trial 149 finished with value: 0.22413862321214917 and parameters: {'alpha': 154225.3408626009, 'n_pcs': 4000, 'iw_method': 'pc_logistic', 'iw_clip_max': 2.5, 'iw_prob_clip': 0.014927719605220265, 'iw_n_components': 40, 'iw_logistic_c': 2.9808821924203696e-05, 'iw_pca_fit': 'combined', 'iw_solver': 'lbfgs', 'iw_rho': 1.0}. Best is trial 84 with value: 0.2289525216150688.
2026-06-01 21:45:03 | INFO | Trial 150 | outer=7 | alpha=9.348e+04 n_pcs=3500 (pc_topk) weight={'name': 'pc_logistic', 'floor': 1e-06, 'clip_max': 4.0, 'prob_clip': 0.019320090188298545, 'n_components': 40, 'logistic_c': 1.4269597386858578e-05, 'pca_fit': 'combined', 'solver': 'lbfgs', 'max_iter': 2000, 'fit_intercept': True, 'standardize_with_source': True, 'rho': 1.0}
[I 2026-06-01 21:45:14,340] Trial 150 finished with value: 0.2255264526910295 and parameters: {'alpha': 93480.60923572247, 'n_pcs': 3500, 'iw_method': 'pc_logistic', 'iw_clip_max': 4.0, 'iw_prob_clip': 0.019320090188298545, 'iw_n_components': 40, 'iw_logistic_c': 1.4269597386858578e-05, 'iw_pca_fit': 'combined', 'iw_solver': 'lbfgs', 'iw_rho': 1.0}. Best is trial 84 with value: 0.2289525216150688.
2026-06-01 21:45:14 | INFO | Trial 151 | outer=7 | alpha=7.156e+04 n_pcs=4000 (pc_topk) weight={'name': 'pc_logistic', 'floor': 1e-06, 'clip_max': 4.0, 'prob_clip': 0.02141493310514618, 'n_components': 40, 'logistic_c': 5.276204242811336e-06, 'pca_fit': 'combined', 'solver': 'lbfgs', 'max_iter': 2000, 'fit_intercept': True, 'standardize_with_source': True, 'rho': 1.0}
[I 2026-06-01 21:45:25,661] Trial 151 finished with value: 0.22501283344103373 and parameters: {'alpha': 71555.18665904766, 'n_pcs': 4000, 'iw_method': 'pc_logistic', 'iw_clip_max': 4.0, 'iw_prob_clip': 0.02141493310514618, 'iw_n_components': 40, 'iw_logistic_c': 5.276204242811336e-06, 'iw_pca_fit': 'combined', 'iw_solver': 'lbfgs', 'iw_rho': 1.0}. Best is trial 84 with value: 0.2289525216150688.
2026-06-01 21:45:25 | INFO | Trial 152 | outer=7 | alpha=3.855e+04 n_pcs=4000 (pc_topk) weight={'name': 'pc_logistic', 'floor': 1e-06, 'clip_max': 4.0, 'prob_clip': 0.0021840497898695144, 'n_components': 40, 'logistic_c': 3.820082014905407e-05, 'pca_fit': 'combined', 'solver': 'lbfgs', 'max_iter': 2000, 'fit_intercept': True, 'standardize_with_source': True, 'rho': 1.0}
[I 2026-06-01 21:45:38,524] Trial 152 finished with value: 0.22622606889084734 and parameters: {'alpha': 38546.92758413266, 'n_pcs': 4000, 'iw_method': 'pc_logistic', 'iw_clip_max': 4.0, 'iw_prob_clip': 0.0021840497898695144, 'iw_n_components': 40, 'iw_logistic_c': 3.820082014905407e-05, 'iw_pca_fit': 'combined', 'iw_solver': 'lbfgs', 'iw_rho': 1.0}. Best is trial 84 with value: 0.2289525216150688.
2026-06-01 21:45:38 | INFO | Trial 153 | outer=7 | alpha=4.995e+04 n_pcs=4000 (pc_topk) weight={'name': 'pc_logistic', 'floor': 1e-06, 'clip_max': 4.0, 'prob_clip': 0.024062591873446178, 'n_components': 40, 'logistic_c': 8.38800986472401e-06, 'pca_fit': 'combined', 'solver': 'lbfgs', 'max_iter': 2000, 'fit_intercept': True, 'standardize_with_source': True, 'rho': 1.0}
[I 2026-06-01 21:45:50,908] Trial 153 finished with value: 0.22698507300164872 and parameters: {'alpha': 49948.55478356602, 'n_pcs': 4000, 'iw_method': 'pc_logistic', 'iw_clip_max': 4.0, 'iw_prob_clip': 0.024062591873446178, 'iw_n_components': 40, 'iw_logistic_c': 8.38800986472401e-06, 'iw_pca_fit': 'combined', 'iw_solver': 'lbfgs', 'iw_rho': 1.0}. Best is trial 84 with value: 0.2289525216150688.
2026-06-01 21:45:50 | INFO | Trial 154 | outer=7 | alpha=3.025e+04 n_pcs=4000 (pc_topk) weight={'name': 'pc_logistic', 'floor': 1e-06, 'clip_max': 4.0, 'prob_clip': 0.016280925160091657, 'n_components': 40, 'logistic_c': 8.086684412724435e-06, 'pca_fit': 'combined', 'solver': 'lbfgs', 'max_iter': 2000, 'fit_intercept': True, 'standardize_with_source': True, 'rho': 1.0}
[I 2026-06-01 21:46:02,841] Trial 154 finished with value: 0.2256710214772964 and parameters: {'alpha': 30247.452386686928, 'n_pcs': 4000, 'iw_method': 'pc_logistic', 'iw_clip_max': 4.0, 'iw_prob_clip': 0.016280925160091657, 'iw_n_components': 40, 'iw_logistic_c': 8.086684412724435e-06, 'iw_pca_fit': 'combined', 'iw_solver': 'lbfgs', 'iw_rho': 1.0}. Best is trial 84 with value: 0.2289525216150688.
2026-06-01 21:46:02 | INFO | Trial 155 | outer=7 | alpha=5.713e+04 n_pcs=4000 (pc_topk) weight={'name': 'pc_logistic', 'floor': 1e-06, 'clip_max': 4.0, 'prob_clip': 0.024143235176577776, 'n_components': 40, 'logistic_c': 2.4632282832505098e-06, 'pca_fit': 'combined', 'solver': 'lbfgs', 'max_iter': 2000, 'fit_intercept': True, 'standardize_with_source': True, 'rho': 1.0}
[I 2026-06-01 21:46:14,920] Trial 155 finished with value: 0.2234654980449453 and parameters: {'alpha': 57127.87337583666, 'n_pcs': 4000, 'iw_method': 'pc_logistic', 'iw_clip_max': 4.0, 'iw_prob_clip': 0.024143235176577776, 'iw_n_components': 40, 'iw_logistic_c': 2.4632282832505098e-06, 'iw_pca_fit': 'combined', 'iw_solver': 'lbfgs', 'iw_rho': 1.0}. Best is trial 84 with value: 0.2289525216150688.
2026-06-01 21:46:14 | INFO | Trial 156 | outer=7 | alpha=7.681e+04 n_pcs=3500 (pc_topk) weight={'name': 'pc_logistic', 'floor': 1e-06, 'clip_max': 4.0, 'prob_clip': 0.02698061126195163, 'n_components': 40, 'logistic_c': 1.3918546533042128e-06, 'pca_fit': 'combined', 'solver': 'lbfgs', 'max_iter': 2000, 'fit_intercept': True, 'standardize_with_source': True, 'rho': 1.0}
[I 2026-06-01 21:46:25,979] Trial 156 finished with value: 0.21771579378412667 and parameters: {'alpha': 76809.00397660823, 'n_pcs': 3500, 'iw_method': 'pc_logistic', 'iw_clip_max': 4.0, 'iw_prob_clip': 0.02698061126195163, 'iw_n_components': 40, 'iw_logistic_c': 1.3918546533042128e-06, 'iw_pca_fit': 'combined', 'iw_solver': 'lbfgs', 'iw_rho': 1.0}. Best is trial 84 with value: 0.2289525216150688.
2026-06-01 21:46:26 | INFO | Trial 157 | outer=7 | alpha=4.947e+04 n_pcs=4000 (pc_topk) weight={'name': 'pc_logistic', 'floor': 1e-06, 'clip_max': 4.0, 'prob_clip': 0.01942853006375938, 'n_components': 40, 'logistic_c': 1.1530029705693942e-05, 'pca_fit': 'combined', 'solver': 'lbfgs', 'max_iter': 2000, 'fit_intercept': True, 'standardize_with_source': True, 'rho': 1.0}
[I 2026-06-01 21:46:37,976] Trial 157 finished with value: 0.22878352176983788 and parameters: {'alpha': 49471.67895456919, 'n_pcs': 4000, 'iw_method': 'pc_logistic', 'iw_clip_max': 4.0, 'iw_prob_clip': 0.01942853006375938, 'iw_n_components': 40, 'iw_logistic_c': 1.1530029705693942e-05, 'iw_pca_fit': 'combined', 'iw_solver': 'lbfgs', 'iw_rho': 1.0}. Best is trial 84 with value: 0.2289525216150688.
2026-06-01 21:46:38 | INFO | Trial 158 | outer=7 | alpha=1.078e+05 n_pcs=4000 (pc_topk) weight={'name': 'pc_logistic', 'floor': 1e-06, 'clip_max': 4.0, 'prob_clip': 0.0005308094677757515, 'n_components': 20, 'logistic_c': 1.3614686988702054e-05, 'pca_fit': 'combined', 'solver': 'lbfgs', 'max_iter': 2000, 'fit_intercept': True, 'standardize_with_source': True, 'rho': 1.0}
[I 2026-06-01 21:46:49,781] Trial 158 finished with value: 0.22688661272945215 and parameters: {'alpha': 107799.45815980916, 'n_pcs': 4000, 'iw_method': 'pc_logistic', 'iw_clip_max': 4.0, 'iw_prob_clip': 0.0005308094677757515, 'iw_n_components': 20, 'iw_logistic_c': 1.3614686988702054e-05, 'iw_pca_fit': 'combined', 'iw_solver': 'lbfgs', 'iw_rho': 1.0}. Best is trial 84 with value: 0.2289525216150688.
2026-06-01 21:46:49 | INFO | Trial 159 | outer=7 | alpha=3.446e+04 n_pcs=4000 (pc_topk) weight={'name': 'pc_logistic', 'floor': 1e-06, 'clip_max': 4.0, 'prob_clip': 0.021707414624752324, 'n_components': 40, 'logistic_c': 1.0626511046431726e-05, 'pca_fit': 'combined', 'solver': 'lbfgs', 'max_iter': 2000, 'fit_intercept': True, 'standardize_with_source': True, 'rho': 1.0}
[I 2026-06-01 21:47:01,559] Trial 159 finished with value: 0.22716528827100171 and parameters: {'alpha': 34464.50250282058, 'n_pcs': 4000, 'iw_method': 'pc_logistic', 'iw_clip_max': 4.0, 'iw_prob_clip': 0.021707414624752324, 'iw_n_components': 40, 'iw_logistic_c': 1.0626511046431726e-05, 'iw_pca_fit': 'combined', 'iw_solver': 'lbfgs', 'iw_rho': 1.0}. Best is trial 84 with value: 0.2289525216150688.
2026-06-01 21:47:01 | INFO | Trial 160 | outer=7 | alpha=3.564e+04 n_pcs=4000 (pc_topk) weight={'name': 'pc_logistic', 'floor': 1e-06, 'clip_max': 4.0, 'prob_clip': 0.014289314890354851, 'n_components': 40, 'logistic_c': 1.743745251237273e-05, 'pca_fit': 'combined', 'solver': 'lbfgs', 'max_iter': 2000, 'fit_intercept': True, 'standardize_with_source': True, 'rho': 1.0}
[I 2026-06-01 21:47:14,509] Trial 160 finished with value: 0.2279860727975572 and parameters: {'alpha': 35640.28326667768, 'n_pcs': 4000, 'iw_method': 'pc_logistic', 'iw_clip_max': 4.0, 'iw_prob_clip': 0.014289314890354851, 'iw_n_components': 40, 'iw_logistic_c': 1.743745251237273e-05, 'iw_pca_fit': 'combined', 'iw_solver': 'lbfgs', 'iw_rho': 1.0}. Best is trial 84 with value: 0.2289525216150688.
2026-06-01 21:47:14 | INFO | Trial 161 | outer=7 | alpha=3.614e+04 n_pcs=4000 (pc_topk) weight={'name': 'pc_logistic', 'floor': 1e-06, 'clip_max': 4.0, 'prob_clip': 0.014464654822450098, 'n_components': 40, 'logistic_c': 1.752694792250783e-05, 'pca_fit': 'combined', 'solver': 'lbfgs', 'max_iter': 2000, 'fit_intercept': True, 'standardize_with_source': True, 'rho': 1.0}
[I 2026-06-01 21:47:26,532] Trial 161 finished with value: 0.2280782548039253 and parameters: {'alpha': 36138.85656480142, 'n_pcs': 4000, 'iw_method': 'pc_logistic', 'iw_clip_max': 4.0, 'iw_prob_clip': 0.014464654822450098, 'iw_n_components': 40, 'iw_logistic_c': 1.752694792250783e-05, 'iw_pca_fit': 'combined', 'iw_solver': 'lbfgs', 'iw_rho': 1.0}. Best is trial 84 with value: 0.2289525216150688.
2026-06-01 21:47:26 | INFO | Trial 162 | outer=7 | alpha=3.541e+04 n_pcs=4000 (pc_topk) weight={'name': 'pc_logistic', 'floor': 1e-06, 'clip_max': 4.0, 'prob_clip': 0.016598409155295205, 'n_components': 40, 'logistic_c': 1.757018237899283e-05, 'pca_fit': 'combined', 'solver': 'lbfgs', 'max_iter': 2000, 'fit_intercept': True, 'standardize_with_source': True, 'rho': 1.0}
[I 2026-06-01 21:47:38,979] Trial 162 finished with value: 0.2282234729713354 and parameters: {'alpha': 35407.78509149964, 'n_pcs': 4000, 'iw_method': 'pc_logistic', 'iw_clip_max': 4.0, 'iw_prob_clip': 0.016598409155295205, 'iw_n_components': 40, 'iw_logistic_c': 1.757018237899283e-05, 'iw_pca_fit': 'combined', 'iw_solver': 'lbfgs', 'iw_rho': 1.0}. Best is trial 84 with value: 0.2289525216150688.
2026-06-01 21:47:39 | INFO | Trial 163 | outer=7 | alpha=3.285e+04 n_pcs=4000 (pc_topk) weight={'name': 'pc_logistic', 'floor': 1e-06, 'clip_max': 4.0, 'prob_clip': 0.016179721032174115, 'n_components': 40, 'logistic_c': 1.251559995940673e-05, 'pca_fit': 'combined', 'solver': 'lbfgs', 'max_iter': 2000, 'fit_intercept': True, 'standardize_with_source': True, 'rho': 1.0}
[I 2026-06-01 21:47:51,927] Trial 163 finished with value: 0.22750538254786185 and parameters: {'alpha': 32845.42186527224, 'n_pcs': 4000, 'iw_method': 'pc_logistic', 'iw_clip_max': 4.0, 'iw_prob_clip': 0.016179721032174115, 'iw_n_components': 40, 'iw_logistic_c': 1.251559995940673e-05, 'iw_pca_fit': 'combined', 'iw_solver': 'lbfgs', 'iw_rho': 1.0}. Best is trial 84 with value: 0.2289525216150688.
2026-06-01 21:47:51 | INFO | Trial 164 | outer=7 | alpha=1.953e+04 n_pcs=3500 (pc_topk) weight={'name': 'pc_logistic', 'floor': 1e-06, 'clip_max': 4.0, 'prob_clip': 0.014351766321397548, 'n_components': 40, 'logistic_c': 1.6643990612574415e-05, 'pca_fit': 'combined', 'solver': 'lbfgs', 'max_iter': 2000, 'fit_intercept': True, 'standardize_with_source': True, 'rho': 1.0}
[I 2026-06-01 21:48:02,982] Trial 164 finished with value: 0.21210287673828604 and parameters: {'alpha': 19529.202742616315, 'n_pcs': 3500, 'iw_method': 'pc_logistic', 'iw_clip_max': 4.0, 'iw_prob_clip': 0.014351766321397548, 'iw_n_components': 40, 'iw_logistic_c': 1.6643990612574415e-05, 'iw_pca_fit': 'combined', 'iw_solver': 'lbfgs', 'iw_rho': 1.0}. Best is trial 84 with value: 0.2289525216150688.
2026-06-01 21:48:03 | INFO | Trial 165 | outer=7 | alpha=2.875e+04 n_pcs=4000 (pc_topk) weight={'name': 'pc_logistic', 'floor': 1e-06, 'clip_max': 4.0, 'prob_clip': 0.012711590172867845, 'n_components': 40, 'logistic_c': 2.4395134087032303e-05, 'pca_fit': 'combined', 'solver': 'lbfgs', 'max_iter': 2000, 'fit_intercept': True, 'standardize_with_source': True, 'rho': 1.0}
[I 2026-06-01 21:48:16,130] Trial 165 finished with value: 0.22563971170740152 and parameters: {'alpha': 28745.916496380403, 'n_pcs': 4000, 'iw_method': 'pc_logistic', 'iw_clip_max': 4.0, 'iw_prob_clip': 0.012711590172867845, 'iw_n_components': 40, 'iw_logistic_c': 2.4395134087032303e-05, 'iw_pca_fit': 'combined', 'iw_solver': 'lbfgs', 'iw_rho': 1.0}. Best is trial 84 with value: 0.2289525216150688.
2026-06-01 21:48:16 | INFO | Trial 166 | outer=7 | alpha=2.925e+04 n_pcs=4000 (pc_topk) weight={'name': 'pc_logistic', 'floor': 1e-06, 'clip_max': 4.0, 'prob_clip': 0.016089453412310984, 'n_components': 40, 'logistic_c': 4.2325258660233325e-06, 'pca_fit': 'combined', 'solver': 'lbfgs', 'max_iter': 2000, 'fit_intercept': True, 'standardize_with_source': True, 'rho': 1.0}
[I 2026-06-01 21:48:29,307] Trial 166 finished with value: 0.2247392570053563 and parameters: {'alpha': 29246.410357280034, 'n_pcs': 4000, 'iw_method': 'pc_logistic', 'iw_clip_max': 4.0, 'iw_prob_clip': 0.016089453412310984, 'iw_n_components': 40, 'iw_logistic_c': 4.2325258660233325e-06, 'iw_pca_fit': 'combined', 'iw_solver': 'lbfgs', 'iw_rho': 1.0}. Best is trial 84 with value: 0.2289525216150688.
2026-06-01 21:48:29 | INFO | Trial 167 | outer=7 | alpha=3.908e+04 n_pcs=4000 (pc_topk) weight={'name': 'pc_logistic', 'floor': 1e-06, 'clip_max': 4.0, 'prob_clip': 0.014420606099352123, 'n_components': 40, 'logistic_c': 1.37604285512033e-05, 'pca_fit': 'combined', 'solver': 'lbfgs', 'max_iter': 2000, 'fit_intercept': True, 'standardize_with_source': True, 'rho': 1.0}
[I 2026-06-01 21:48:41,452] Trial 167 finished with value: 0.22843377607856336 and parameters: {'alpha': 39083.48197885095, 'n_pcs': 4000, 'iw_method': 'pc_logistic', 'iw_clip_max': 4.0, 'iw_prob_clip': 0.014420606099352123, 'iw_n_components': 40, 'iw_logistic_c': 1.37604285512033e-05, 'iw_pca_fit': 'combined', 'iw_solver': 'lbfgs', 'iw_rho': 1.0}. Best is trial 84 with value: 0.2289525216150688.
2026-06-01 21:48:41 | INFO | Trial 168 | outer=7 | alpha=2.503e+04 n_pcs=4000 (pc_topk) weight={'name': 'pc_logistic', 'floor': 1e-06, 'clip_max': 4.0, 'prob_clip': 0.012043972709926931, 'n_components': 80, 'logistic_c': 7.104722939644932e-06, 'pca_fit': 'combined', 'solver': 'lbfgs', 'max_iter': 2000, 'fit_intercept': True, 'standardize_with_source': True, 'rho': 1.0}
[I 2026-06-01 21:48:54,500] Trial 168 finished with value: 0.22430634007624098 and parameters: {'alpha': 25027.346561740713, 'n_pcs': 4000, 'iw_method': 'pc_logistic', 'iw_clip_max': 4.0, 'iw_prob_clip': 0.012043972709926931, 'iw_n_components': 80, 'iw_logistic_c': 7.104722939644932e-06, 'iw_pca_fit': 'combined', 'iw_solver': 'lbfgs', 'iw_rho': 1.0}. Best is trial 84 with value: 0.2289525216150688.
2026-06-01 21:48:54 | INFO | Trial 169 | outer=7 | alpha=3.381e+04 n_pcs=4000 (pc_topk) weight={'name': 'pc_logistic', 'floor': 1e-06, 'clip_max': 4.0, 'prob_clip': 0.014025751792581968, 'n_components': 10, 'logistic_c': 1.1312905617519562e-05, 'pca_fit': 'combined', 'solver': 'lbfgs', 'max_iter': 2000, 'fit_intercept': True, 'standardize_with_source': True, 'rho': 1.0}
[I 2026-06-01 21:49:07,462] Trial 169 finished with value: 0.22648630073128717 and parameters: {'alpha': 33811.77365758903, 'n_pcs': 4000, 'iw_method': 'pc_logistic', 'iw_clip_max': 4.0, 'iw_prob_clip': 0.014025751792581968, 'iw_n_components': 10, 'iw_logistic_c': 1.1312905617519562e-05, 'iw_pca_fit': 'combined', 'iw_solver': 'lbfgs', 'iw_rho': 1.0}. Best is trial 84 with value: 0.2289525216150688.
2026-06-01 21:49:07 | INFO | Trial 170 | outer=7 | alpha=5.579e+04 n_pcs=3500 (pc_topk) weight={'name': 'pc_logistic', 'floor': 1e-06, 'clip_max': 4.0, 'prob_clip': 0.010288109906740065, 'n_components': 40, 'logistic_c': 1.8464068814372398e-05, 'pca_fit': 'combined', 'solver': 'lbfgs', 'max_iter': 2000, 'fit_intercept': True, 'standardize_with_source': True, 'rho': 1.0}
