[I 2026-06-01 00:01:12,871] Trial 122 finished with value: 0.1965919317379248 and parameters: {'alpha': 124319.72878374025, 'n_pcs': 4500, 'weight_scheme': 'linear', 'weight_clip_max': 10.0, 'weight_linear_min_weight': 0.6575135525145652, 'weight_linear_max_weight': 4.462509242826226}. Best is trial 41 with value: 0.19810774778548906.
2026-06-01 00:01:12 | INFO | src.nested_cv_avggrm_weighted_unified | Trial 123 | outer=4 | alpha=1.701e+05 n_pcs=1500 (pc_topk) weight_search=on
2026-06-01 00:01:12 | INFO | src.nested_cv_avggrm_weighted_unified | Trial 123 | outer=4 | weight={'name': 'linear', 'floor': 1e-06, 'clip_max': 10.0, 'min_weight': 0.5867191137437754, 'max_weight': 4.619320662062097}
2026-06-01 00:01:13 | INFO | src.nested_cv_avggrm_weighted_unified | Trial 123 | outer=4 | pruned after 6/10 inner folds (mean r=0.1971)
[I 2026-06-01 00:01:13,895] Trial 123 pruned. 
2026-06-01 00:01:13 | INFO | src.nested_cv_avggrm_weighted_unified | Trial 124 | outer=4 | alpha=9.986e+04 n_pcs=4500 (pc_topk) weight_search=on
2026-06-01 00:01:13 | INFO | src.nested_cv_avggrm_weighted_unified | Trial 124 | outer=4 | weight={'name': 'linear', 'floor': 1e-06, 'clip_max': 10.0, 'min_weight': 0.5262117076372044, 'max_weight': 4.365758640354017}
[I 2026-06-01 00:01:20,851] Trial 124 finished with value: 0.1976446947212615 and parameters: {'alpha': 99858.41789354655, 'n_pcs': 4500, 'weight_scheme': 'linear', 'weight_clip_max': 10.0, 'weight_linear_min_weight': 0.5262117076372044, 'weight_linear_max_weight': 4.365758640354017}. Best is trial 41 with value: 0.19810774778548906.
2026-06-01 00:01:20 | INFO | src.nested_cv_avggrm_weighted_unified | Trial 125 | outer=4 | alpha=5.057e+04 n_pcs=5000 (pc_topk) weight_search=on
2026-06-01 00:01:20 | INFO | src.nested_cv_avggrm_weighted_unified | Trial 125 | outer=4 | weight={'name': 'linear', 'floor': 1e-06, 'clip_max': 10.0, 'min_weight': 0.5148917554497835, 'max_weight': 4.188198543722175}
2026-06-01 00:01:25 | INFO | src.nested_cv_avggrm_weighted_unified | Trial 125 | outer=4 | pruned after 6/10 inner folds (mean r=0.1989)
[I 2026-06-01 00:01:25,744] Trial 125 pruned. 
2026-06-01 00:01:25 | INFO | src.nested_cv_avggrm_weighted_unified | Trial 126 | outer=4 | alpha=8.519e+04 n_pcs=4500 (pc_topk) weight_search=on
2026-06-01 00:01:25 | INFO | src.nested_cv_avggrm_weighted_unified | Trial 126 | outer=4 | weight={'name': 'linear', 'floor': 1e-06, 'clip_max': 10.0, 'min_weight': 0.5273406085345984, 'max_weight': 4.347688965617282}
2026-06-01 00:01:29 | INFO | src.nested_cv_avggrm_weighted_unified | Trial 126 | outer=4 | pruned after 6/10 inner folds (mean r=0.2051)
[I 2026-06-01 00:01:29,935] Trial 126 pruned. 
2026-06-01 00:01:29 | INFO | src.nested_cv_avggrm_weighted_unified | Trial 127 | outer=4 | alpha=1.278e+05 n_pcs=4000 (pc_topk) weight_search=on
2026-06-01 00:01:29 | INFO | src.nested_cv_avggrm_weighted_unified | Trial 127 | outer=4 | weight={'name': 'linear', 'floor': 1e-06, 'clip_max': 10.0, 'min_weight': 0.38870494412718753, 'max_weight': 4.027915477114794}
[I 2026-06-01 00:01:35,654] Trial 127 finished with value: 0.19633317964064145 and parameters: {'alpha': 127782.90345702389, 'n_pcs': 4000, 'weight_scheme': 'linear', 'weight_clip_max': 10.0, 'weight_linear_min_weight': 0.38870494412718753, 'weight_linear_max_weight': 4.027915477114794}. Best is trial 41 with value: 0.19810774778548906.
2026-06-01 00:01:35 | INFO | src.nested_cv_avggrm_weighted_unified | Trial 128 | outer=4 | alpha=6.693e+04 n_pcs=4500 (pc_topk) weight_search=on
2026-06-01 00:01:35 | INFO | src.nested_cv_avggrm_weighted_unified | Trial 128 | outer=4 | weight={'name': 'linear', 'floor': 1e-06, 'clip_max': 10.0, 'min_weight': 0.6498206571504521, 'max_weight': 4.154703082938717}
2026-06-01 00:01:39 | INFO | src.nested_cv_avggrm_weighted_unified | Trial 128 | outer=4 | pruned after 6/10 inner folds (mean r=0.2035)
[I 2026-06-01 00:01:39,838] Trial 128 pruned. 
2026-06-01 00:01:39 | INFO | src.nested_cv_avggrm_weighted_unified | Trial 129 | outer=4 | alpha=1.465e+05 n_pcs=4500 (pc_topk) weight_search=on
2026-06-01 00:01:39 | INFO | src.nested_cv_avggrm_weighted_unified | Trial 129 | outer=4 | weight={'name': 'linear', 'floor': 1e-06, 'clip_max': 10.0, 'min_weight': 0.565895338503755, 'max_weight': 3.7799444010802214}
[I 2026-06-01 00:01:46,788] Trial 129 finished with value: 0.19571195096759803 and parameters: {'alpha': 146540.02970497738, 'n_pcs': 4500, 'weight_scheme': 'linear', 'weight_clip_max': 10.0, 'weight_linear_min_weight': 0.565895338503755, 'weight_linear_max_weight': 3.7799444010802214}. Best is trial 41 with value: 0.19810774778548906.
2026-06-01 00:01:46 | INFO | src.nested_cv_avggrm_weighted_unified | Trial 130 | outer=4 | alpha=4.102e+04 n_pcs=4000 (pc_topk) weight_search=on
2026-06-01 00:01:46 | INFO | src.nested_cv_avggrm_weighted_unified | Trial 130 | outer=4 | weight={'name': 'linear', 'floor': 1e-06, 'clip_max': 10.0, 'min_weight': 0.4945649688664352, 'max_weight': 3.651593388351344}
2026-06-01 00:01:50 | INFO | src.nested_cv_avggrm_weighted_unified | Trial 130 | outer=4 | pruned after 6/10 inner folds (mean r=0.1955)
[I 2026-06-01 00:01:50,231] Trial 130 pruned. 
2026-06-01 00:01:50 | INFO | src.nested_cv_avggrm_weighted_unified | Trial 131 | outer=4 | alpha=9.093e+04 n_pcs=4500 (pc_topk) weight_search=on
2026-06-01 00:01:50 | INFO | src.nested_cv_avggrm_weighted_unified | Trial 131 | outer=4 | weight={'name': 'linear', 'floor': 1e-06, 'clip_max': 10.0, 'min_weight': 0.5998611666646144, 'max_weight': 4.48975479726756}
[I 2026-06-01 00:01:57,169] Trial 131 finished with value: 0.19779638214191686 and parameters: {'alpha': 90927.52055494871, 'n_pcs': 4500, 'weight_scheme': 'linear', 'weight_clip_max': 10.0, 'weight_linear_min_weight': 0.5998611666646144, 'weight_linear_max_weight': 4.48975479726756}. Best is trial 41 with value: 0.19810774778548906.
2026-06-01 00:01:57 | INFO | src.nested_cv_avggrm_weighted_unified | Trial 132 | outer=4 | alpha=9.754e+04 n_pcs=4500 (pc_topk) weight_search=on
2026-06-01 00:01:57 | INFO | src.nested_cv_avggrm_weighted_unified | Trial 132 | outer=4 | weight={'name': 'linear', 'floor': 1e-06, 'clip_max': 10.0, 'min_weight': 0.601599026463203, 'max_weight': 4.802883789853373}
[I 2026-06-01 00:02:04,124] Trial 132 finished with value: 0.19767692481792426 and parameters: {'alpha': 97536.31156332693, 'n_pcs': 4500, 'weight_scheme': 'linear', 'weight_clip_max': 10.0, 'weight_linear_min_weight': 0.601599026463203, 'weight_linear_max_weight': 4.802883789853373}. Best is trial 41 with value: 0.19810774778548906.
2026-06-01 00:02:04 | INFO | src.nested_cv_avggrm_weighted_unified | Trial 133 | outer=4 | alpha=8.906e+04 n_pcs=4500 (pc_topk) weight_search=on
2026-06-01 00:02:04 | INFO | src.nested_cv_avggrm_weighted_unified | Trial 133 | outer=4 | weight={'name': 'linear', 'floor': 1e-06, 'clip_max': 10.0, 'min_weight': 0.5980664608013389, 'max_weight': 4.576734933835141}
2026-06-01 00:02:08 | INFO | src.nested_cv_avggrm_weighted_unified | Trial 133 | outer=4 | pruned after 6/10 inner folds (mean r=0.2054)
[I 2026-06-01 00:02:08,314] Trial 133 pruned. 
2026-06-01 00:02:08 | INFO | src.nested_cv_avggrm_weighted_unified | Trial 134 | outer=4 | alpha=5.722e+04 n_pcs=4500 (pc_topk) weight_search=on
2026-06-01 00:02:08 | INFO | src.nested_cv_avggrm_weighted_unified | Trial 134 | outer=4 | weight={'name': 'linear', 'floor': 1e-06, 'clip_max': 10.0, 'min_weight': 0.5249430836398552, 'max_weight': 4.762213868153143}
2026-06-01 00:02:12 | INFO | src.nested_cv_avggrm_weighted_unified | Trial 134 | outer=4 | pruned after 6/10 inner folds (mean r=0.2016)
[I 2026-06-01 00:02:12,502] Trial 134 pruned. 
2026-06-01 00:02:12 | INFO | src.nested_cv_avggrm_weighted_unified | Trial 135 | outer=4 | alpha=6.940e+04 n_pcs=5000 (pc_topk) weight_search=on
2026-06-01 00:02:12 | INFO | src.nested_cv_avggrm_weighted_unified | Trial 135 | outer=4 | weight={'name': 'linear', 'floor': 1e-06, 'clip_max': 10.0, 'min_weight': 0.3534102244846675, 'max_weight': 3.403927482708669}
2026-06-01 00:02:17 | INFO | src.nested_cv_avggrm_weighted_unified | Trial 135 | outer=4 | pruned after 6/10 inner folds (mean r=0.2020)
[I 2026-06-01 00:02:17,411] Trial 135 pruned. 
2026-06-01 00:02:17 | INFO | src.nested_cv_avggrm_weighted_unified | Trial 136 | outer=4 | alpha=9.231e+04 n_pcs=4500 (pc_topk) weight_search=on
2026-06-01 00:02:17 | INFO | src.nested_cv_avggrm_weighted_unified | Trial 136 | outer=4 | weight={'name': 'linear', 'floor': 1e-06, 'clip_max': 3.0, 'min_weight': 0.5915705988048731, 'max_weight': 4.720017145248232}
2026-06-01 00:02:21 | INFO | src.nested_cv_avggrm_weighted_unified | Trial 136 | outer=4 | pruned after 6/10 inner folds (mean r=0.2047)
[I 2026-06-01 00:02:21,601] Trial 136 pruned. 
2026-06-01 00:02:21 | INFO | src.nested_cv_avggrm_weighted_unified | Trial 137 | outer=4 | alpha=1.235e+05 n_pcs=4500 (pc_topk) weight_search=on
2026-06-01 00:02:21 | INFO | src.nested_cv_avggrm_weighted_unified | Trial 137 | outer=4 | weight={'name': 'linear', 'floor': 1e-06, 'clip_max': 10.0, 'min_weight': 0.5381373189895743, 'max_weight': 3.8810818827159337}
[I 2026-06-01 00:02:28,524] Trial 137 finished with value: 0.19672351578893046 and parameters: {'alpha': 123488.25253145253, 'n_pcs': 4500, 'weight_scheme': 'linear', 'weight_clip_max': 10.0, 'weight_linear_min_weight': 0.5381373189895743, 'weight_linear_max_weight': 3.8810818827159337}. Best is trial 41 with value: 0.19810774778548906.
2026-06-01 00:02:28 | INFO | src.nested_cv_avggrm_weighted_unified | Trial 138 | outer=4 | alpha=4.861e+04 n_pcs=4500 (pc_topk) weight_search=on
2026-06-01 00:02:28 | INFO | src.nested_cv_avggrm_weighted_unified | Trial 138 | outer=4 | weight={'name': 'linear', 'floor': 1e-06, 'clip_max': 10.0, 'min_weight': 0.9054129346490254, 'max_weight': 4.290182489694252}
2026-06-01 00:02:32 | INFO | src.nested_cv_avggrm_weighted_unified | Trial 138 | outer=4 | pruned after 6/10 inner folds (mean r=0.2008)
[I 2026-06-01 00:02:32,707] Trial 138 pruned. 
2026-06-01 00:02:32 | INFO | src.nested_cv_avggrm_weighted_unified | Trial 139 | outer=4 | alpha=7.587e+04 n_pcs=5000 (pc_topk) weight_search=on
2026-06-01 00:02:32 | INFO | src.nested_cv_avggrm_weighted_unified | Trial 139 | outer=4 | weight={'name': 'linear', 'floor': 1e-06, 'clip_max': 10.0, 'min_weight': 0.4658480427160532, 'max_weight': 4.854564126411277}
2026-06-01 00:02:37 | INFO | src.nested_cv_avggrm_weighted_unified | Trial 139 | outer=4 | pruned after 6/10 inner folds (mean r=0.2027)
[I 2026-06-01 00:02:37,614] Trial 139 pruned. 
2026-06-01 00:02:37 | INFO | src.nested_cv_avggrm_weighted_unified | Trial 140 | outer=4 | alpha=1.598e+05 n_pcs=4000 (pc_topk) weight_search=on
2026-06-01 00:02:37 | INFO | src.nested_cv_avggrm_weighted_unified | Trial 140 | outer=4 | weight={'name': 'linear', 'floor': 1e-06, 'clip_max': 20.0, 'min_weight': 0.604135588612871, 'max_weight': 3.9909922948488283}
[I 2026-06-01 00:02:43,337] Trial 140 finished with value: 0.19468295138491007 and parameters: {'alpha': 159809.70702296626, 'n_pcs': 4000, 'weight_scheme': 'linear', 'weight_clip_max': 20.0, 'weight_linear_min_weight': 0.604135588612871, 'weight_linear_max_weight': 3.9909922948488283}. Best is trial 41 with value: 0.19810774778548906.
2026-06-01 00:02:43 | INFO | src.nested_cv_avggrm_weighted_unified | Trial 141 | outer=4 | alpha=1.046e+05 n_pcs=4500 (pc_topk) weight_search=on
2026-06-01 00:02:43 | INFO | src.nested_cv_avggrm_weighted_unified | Trial 141 | outer=4 | weight={'name': 'linear', 'floor': 1e-06, 'clip_max': 10.0, 'min_weight': 0.6372159644542245, 'max_weight': 4.453661130887308}
[I 2026-06-01 00:02:50,262] Trial 141 finished with value: 0.19733318582338272 and parameters: {'alpha': 104618.96632223805, 'n_pcs': 4500, 'weight_scheme': 'linear', 'weight_clip_max': 10.0, 'weight_linear_min_weight': 0.6372159644542245, 'weight_linear_max_weight': 4.453661130887308}. Best is trial 41 with value: 0.19810774778548906.
2026-06-01 00:02:50 | INFO | src.nested_cv_avggrm_weighted_unified | Trial 142 | outer=4 | alpha=1.004e+05 n_pcs=4500 (pc_topk) weight_search=on
2026-06-01 00:02:50 | INFO | src.nested_cv_avggrm_weighted_unified | Trial 142 | outer=4 | weight={'name': 'linear', 'floor': 1e-06, 'clip_max': 10.0, 'min_weight': 0.704260849078701, 'max_weight': 4.2281260454910194}
[I 2026-06-01 00:02:57,224] Trial 142 finished with value: 0.1972660683803747 and parameters: {'alpha': 100426.2611192816, 'n_pcs': 4500, 'weight_scheme': 'linear', 'weight_clip_max': 10.0, 'weight_linear_min_weight': 0.704260849078701, 'weight_linear_max_weight': 4.2281260454910194}. Best is trial 41 with value: 0.19810774778548906.
2026-06-01 00:02:57 | INFO | src.nested_cv_avggrm_weighted_unified | Trial 143 | outer=4 | alpha=7.809e+04 n_pcs=4500 (pc_topk) weight_search=on
2026-06-01 00:02:57 | INFO | src.nested_cv_avggrm_weighted_unified | Trial 143 | outer=4 | weight={'name': 'linear', 'floor': 1e-06, 'clip_max': 10.0, 'min_weight': 0.6646030747839794, 'max_weight': 4.360187859271566}
2026-06-01 00:03:01 | INFO | src.nested_cv_avggrm_weighted_unified | Trial 143 | outer=4 | pruned after 6/10 inner folds (mean r=0.2046)
[I 2026-06-01 00:03:01,411] Trial 143 pruned. 
2026-06-01 00:03:01 | INFO | src.nested_cv_avggrm_weighted_unified | Trial 144 | outer=4 | alpha=1.175e+05 n_pcs=4500 (pc_topk) weight_search=on
2026-06-01 00:03:01 | INFO | src.nested_cv_avggrm_weighted_unified | Trial 144 | outer=4 | weight={'name': 'linear', 'floor': 1e-06, 'clip_max': 10.0, 'min_weight': 0.5756610139230178, 'max_weight': 4.93236796244586}
[I 2026-06-01 00:03:08,340] Trial 144 finished with value: 0.19715278225376337 and parameters: {'alpha': 117511.56263158389, 'n_pcs': 4500, 'weight_scheme': 'linear', 'weight_clip_max': 10.0, 'weight_linear_min_weight': 0.5756610139230178, 'weight_linear_max_weight': 4.93236796244586}. Best is trial 41 with value: 0.19810774778548906.
2026-06-01 00:03:08 | INFO | src.nested_cv_avggrm_weighted_unified | Trial 145 | outer=4 | alpha=5.836e+04 n_pcs=4500 (pc_topk) weight_search=on
2026-06-01 00:03:08 | INFO | src.nested_cv_avggrm_weighted_unified | Trial 145 | outer=4 | weight={'name': 'linear', 'floor': 1e-06, 'clip_max': 10.0, 'min_weight': 0.43474115855612866, 'max_weight': 4.527787934011119}
2026-06-01 00:03:12 | INFO | src.nested_cv_avggrm_weighted_unified | Trial 145 | outer=4 | pruned after 6/10 inner folds (mean r=0.2016)
[I 2026-06-01 00:03:12,527] Trial 145 pruned. 
2026-06-01 00:03:12 | INFO | src.nested_cv_avggrm_weighted_unified | Trial 146 | outer=4 | alpha=8.221e+04 n_pcs=4500 (pc_topk) weight_search=on
2026-06-01 00:03:12 | INFO | src.nested_cv_avggrm_weighted_unified | Trial 146 | outer=4 | weight={'name': 'exponential', 'floor': 1e-06, 'clip_max': 10.0, 'beta': 0.6555550648329547}
2026-06-01 00:03:16 | INFO | src.nested_cv_avggrm_weighted_unified | Trial 146 | outer=4 | pruned after 6/10 inner folds (mean r=0.2018)
[I 2026-06-01 00:03:16,687] Trial 146 pruned. 
2026-06-01 00:03:16 | INFO | src.nested_cv_avggrm_weighted_unified | Trial 147 | outer=4 | alpha=1.966e+05 n_pcs=4500 (pc_topk) weight_search=on
2026-06-01 00:03:16 | INFO | src.nested_cv_avggrm_weighted_unified | Trial 147 | outer=4 | weight={'name': 'linear', 'floor': 1e-06, 'clip_max': 10.0, 'min_weight': 0.6762733093844429, 'max_weight': 3.7933621285213106}
[I 2026-06-01 00:03:23,609] Trial 147 finished with value: 0.1932854434214829 and parameters: {'alpha': 196567.4323469315, 'n_pcs': 4500, 'weight_scheme': 'linear', 'weight_clip_max': 10.0, 'weight_linear_min_weight': 0.6762733093844429, 'weight_linear_max_weight': 3.7933621285213106}. Best is trial 41 with value: 0.19810774778548906.
2026-06-01 00:03:23 | INFO | src.nested_cv_avggrm_weighted_unified | Trial 148 | outer=4 | alpha=1.414e+05 n_pcs=5000 (pc_topk) weight_search=on
2026-06-01 00:03:23 | INFO | src.nested_cv_avggrm_weighted_unified | Trial 148 | outer=4 | weight={'name': 'uniform', 'floor': 1e-06, 'clip_max': 10.0}
2026-06-01 00:03:27 | INFO | src.nested_cv_avggrm_weighted_unified | Trial 148 | outer=4 | pruned after 6/10 inner folds (mean r=0.1924)
[I 2026-06-01 00:03:27,910] Trial 148 pruned. 
2026-06-01 00:03:27 | INFO | src.nested_cv_avggrm_weighted_unified | Trial 149 | outer=4 | alpha=1.004e+05 n_pcs=4000 (pc_topk) weight_search=on
2026-06-01 00:03:27 | INFO | src.nested_cv_avggrm_weighted_unified | Trial 149 | outer=4 | weight={'name': 'linear', 'floor': 1e-06, 'clip_max': 10.0, 'min_weight': 0.6167420438898816, 'max_weight': 3.614926290680291}
2026-06-01 00:03:31 | INFO | src.nested_cv_avggrm_weighted_unified | Trial 149 | outer=4 | pruned after 6/10 inner folds (mean r=0.2051)
[I 2026-06-01 00:03:31,351] Trial 149 pruned. 
2026-06-01 00:03:31 | INFO | src.nested_cv_avggrm_weighted_unified | Trial 150 | outer=4 | alpha=6.640e+04 n_pcs=4500 (pc_topk) weight_search=on
2026-06-01 00:03:31 | INFO | src.nested_cv_avggrm_weighted_unified | Trial 150 | outer=4 | weight={'name': 'linear', 'floor': 1e-06, 'clip_max': 3.0, 'min_weight': 0.36151261847585453, 'max_weight': 3.119349507758439}
2026-06-01 00:03:35 | INFO | src.nested_cv_avggrm_weighted_unified | Trial 150 | outer=4 | pruned after 6/10 inner folds (mean r=0.2024)
[I 2026-06-01 00:03:35,547] Trial 150 pruned. 
2026-06-01 00:03:35 | INFO | src.nested_cv_avggrm_weighted_unified | Trial 151 | outer=4 | alpha=1.179e+05 n_pcs=4500 (pc_topk) weight_search=on
2026-06-01 00:03:35 | INFO | src.nested_cv_avggrm_weighted_unified | Trial 151 | outer=4 | weight={'name': 'linear', 'floor': 1e-06, 'clip_max': 10.0, 'min_weight': 0.630801104655246, 'max_weight': 4.4197516276559625}
[I 2026-06-01 00:03:42,487] Trial 151 finished with value: 0.1968784178159681 and parameters: {'alpha': 117927.86687610717, 'n_pcs': 4500, 'weight_scheme': 'linear', 'weight_clip_max': 10.0, 'weight_linear_min_weight': 0.630801104655246, 'weight_linear_max_weight': 4.4197516276559625}. Best is trial 41 with value: 0.19810774778548906.
2026-06-01 00:03:42 | INFO | src.nested_cv_avggrm_weighted_unified | Trial 152 | outer=4 | alpha=9.405e+04 n_pcs=4500 (pc_topk) weight_search=on
2026-06-01 00:03:42 | INFO | src.nested_cv_avggrm_weighted_unified | Trial 152 | outer=4 | weight={'name': 'linear', 'floor': 1e-06, 'clip_max': 10.0, 'min_weight': 0.6364050852393108, 'max_weight': 4.503633258201591}
[I 2026-06-01 00:03:49,457] Trial 152 finished with value: 0.1976679442983641 and parameters: {'alpha': 94049.26431487844, 'n_pcs': 4500, 'weight_scheme': 'linear', 'weight_clip_max': 10.0, 'weight_linear_min_weight': 0.6364050852393108, 'weight_linear_max_weight': 4.503633258201591}. Best is trial 41 with value: 0.19810774778548906.
2026-06-01 00:03:49 | INFO | src.nested_cv_avggrm_weighted_unified | Trial 153 | outer=4 | alpha=9.307e+04 n_pcs=4500 (pc_topk) weight_search=on
2026-06-01 00:03:49 | INFO | src.nested_cv_avggrm_weighted_unified | Trial 153 | outer=4 | weight={'name': 'linear', 'floor': 1e-06, 'clip_max': 10.0, 'min_weight': 0.5509934114821116, 'max_weight': 4.9899375329250875}
[I 2026-06-01 00:03:56,421] Trial 153 finished with value: 0.19785999462345624 and parameters: {'alpha': 93068.4368418276, 'n_pcs': 4500, 'weight_scheme': 'linear', 'weight_clip_max': 10.0, 'weight_linear_min_weight': 0.5509934114821116, 'weight_linear_max_weight': 4.9899375329250875}. Best is trial 41 with value: 0.19810774778548906.
2026-06-01 00:03:56 | INFO | src.nested_cv_avggrm_weighted_unified | Trial 154 | outer=4 | alpha=8.492e+04 n_pcs=4500 (pc_topk) weight_search=on
2026-06-01 00:03:56 | INFO | src.nested_cv_avggrm_weighted_unified | Trial 154 | outer=4 | weight={'name': 'linear', 'floor': 1e-06, 'clip_max': 10.0, 'min_weight': 0.540549597966457, 'max_weight': 4.6876666927384}
2026-06-01 00:04:00 | INFO | src.nested_cv_avggrm_weighted_unified | Trial 154 | outer=4 | pruned after 6/10 inner folds (mean r=0.2050)
[I 2026-06-01 00:04:00,584] Trial 154 pruned. 
2026-06-01 00:04:00 | INFO | src.nested_cv_avggrm_weighted_unified | Trial 155 | outer=4 | alpha=5.087e+04 n_pcs=4500 (pc_topk) weight_search=on
2026-06-01 00:04:00 | INFO | src.nested_cv_avggrm_weighted_unified | Trial 155 | outer=4 | weight={'name': 'linear', 'floor': 1e-06, 'clip_max': 10.0, 'min_weight': 0.5586747373785611, 'max_weight': 4.957793116825966}
2026-06-01 00:04:04 | INFO | src.nested_cv_avggrm_weighted_unified | Trial 155 | outer=4 | pruned after 6/10 inner folds (mean r=0.2004)
[I 2026-06-01 00:04:04,777] Trial 155 pruned. 
2026-06-01 00:04:04 | INFO | src.nested_cv_avggrm_weighted_unified | Trial 156 | outer=4 | alpha=6.426e+04 n_pcs=4500 (pc_topk) weight_search=on
2026-06-01 00:04:04 | INFO | src.nested_cv_avggrm_weighted_unified | Trial 156 | outer=4 | weight={'name': 'linear', 'floor': 1e-06, 'clip_max': 10.0, 'min_weight': 0.31521332191557233, 'max_weight': 4.805691408535176}
2026-06-01 00:04:08 | INFO | src.nested_cv_avggrm_weighted_unified | Trial 156 | outer=4 | pruned after 6/10 inner folds (mean r=0.2020)
[I 2026-06-01 00:04:08,943] Trial 156 pruned. 
2026-06-01 00:04:08 | INFO | src.nested_cv_avggrm_weighted_unified | Trial 157 | outer=4 | alpha=1.458e+05 n_pcs=5000 (pc_topk) weight_search=on
2026-06-01 00:04:08 | INFO | src.nested_cv_avggrm_weighted_unified | Trial 157 | outer=4 | weight={'name': 'linear', 'floor': 1e-06, 'clip_max': None, 'min_weight': 0.3997913017398322, 'max_weight': 4.990020153485582}
