[I 2026-06-02 00:52:43,983] Trial 12 finished with value: 0.21241944079944225 and parameters: {'alpha': 19914.21177648781, 'n_pcs': 4000, 'iw_method': 'pc_logistic', 'iw_clip_max': 12.0, 'iw_prob_clip': 0.0005593063313063697, 'iw_n_components': 100, 'iw_logistic_c': 0.00045106102832414717, 'iw_pca_fit': 'combined', 'iw_solver': 'lbfgs', 'iw_rho': 0.5}. Best is trial 6 with value: 0.22291687974144064.
2026-06-02 00:52:43 | INFO | Trial 13 | outer=10 | alpha=7.725e+05 n_pcs=5000 (pc_topk) weight={'name': 'uniform'}
[I 2026-06-02 00:52:54,717] Trial 13 finished with value: 0.20390037517911758 and parameters: {'alpha': 772521.7668112898, 'n_pcs': 5000, 'iw_method': 'uniform'}. Best is trial 6 with value: 0.22291687974144064.
2026-06-02 00:52:54 | INFO | Trial 14 | outer=10 | alpha=3.816e+04 n_pcs=3500 (pc_topk) weight={'name': 'pc_logistic', 'floor': 1e-06, 'clip_max': 12.0, 'prob_clip': 0.01473817737520998, 'n_components': 40, 'logistic_c': 3.191202215750811e-05, 'pca_fit': 'combined', 'solver': 'lbfgs', 'max_iter': 2000, 'fit_intercept': True, 'standardize_with_source': True, 'rho': 0.7}
[I 2026-06-02 00:53:05,375] Trial 14 finished with value: 0.22146984934010439 and parameters: {'alpha': 38161.90638438215, 'n_pcs': 3500, 'iw_method': 'pc_logistic', 'iw_clip_max': 12.0, 'iw_prob_clip': 0.01473817737520998, 'iw_n_components': 40, 'iw_logistic_c': 3.191202215750811e-05, 'iw_pca_fit': 'combined', 'iw_solver': 'lbfgs', 'iw_rho': 0.7}. Best is trial 6 with value: 0.22291687974144064.
2026-06-02 00:53:05 | INFO | Trial 15 | outer=10 | alpha=3.739e+05 n_pcs=2500 (pc_topk) weight={'name': 'uniform'}
[I 2026-06-02 00:53:10,084] Trial 15 finished with value: 0.21362005874339157 and parameters: {'alpha': 373882.82474302355, 'n_pcs': 2500, 'iw_method': 'uniform'}. Best is trial 6 with value: 0.22291687974144064.
2026-06-02 00:53:10 | INFO | Trial 16 | outer=10 | alpha=1.058e+04 n_pcs=4500 (pc_topk) weight={'name': 'pc_logistic', 'floor': 1e-06, 'clip_max': 2.5, 'prob_clip': 0.0014012235562822078, 'n_components': 80, 'logistic_c': 0.03175461503734837, 'pca_fit': 'combined', 'solver': 'lbfgs', 'max_iter': 2000, 'fit_intercept': True, 'standardize_with_source': True, 'rho': 0.85}
[I 2026-06-02 00:53:32,770] Trial 16 finished with value: 0.20842861379902528 and parameters: {'alpha': 10580.404135724566, 'n_pcs': 4500, 'iw_method': 'pc_logistic', 'iw_clip_max': 2.5, 'iw_prob_clip': 0.0014012235562822078, 'iw_n_components': 80, 'iw_logistic_c': 0.03175461503734837, 'iw_pca_fit': 'combined', 'iw_solver': 'lbfgs', 'iw_rho': 0.85}. Best is trial 6 with value: 0.22291687974144064.
2026-06-02 00:53:32 | INFO | Trial 17 | outer=10 | alpha=2.876e+06 n_pcs=3500 (pc_topk) weight={'name': 'uniform'}
[I 2026-06-02 00:53:39,050] Trial 17 finished with value: 0.19839767339623923 and parameters: {'alpha': 2876385.054868578, 'n_pcs': 3500, 'iw_method': 'uniform'}. Best is trial 6 with value: 0.22291687974144064.
2026-06-02 00:53:39 | INFO | Trial 18 | outer=10 | alpha=2.597e+05 n_pcs=2500 (pc_topk) weight={'name': 'pc_logistic', 'floor': 1e-06, 'clip_max': 1.5, 'prob_clip': 0.042441587678024965, 'n_components': 20, 'logistic_c': 1.1666464054117806e-07, 'pca_fit': 'combined', 'solver': 'lbfgs', 'max_iter': 2000, 'fit_intercept': True, 'standardize_with_source': True, 'rho': 0.7}
[I 2026-06-02 00:53:47,202] Trial 18 finished with value: 0.21738515585867718 and parameters: {'alpha': 259675.9270562552, 'n_pcs': 2500, 'iw_method': 'pc_logistic', 'iw_clip_max': 1.5, 'iw_prob_clip': 0.042441587678024965, 'iw_n_components': 20, 'iw_logistic_c': 1.1666464054117806e-07, 'iw_pca_fit': 'combined', 'iw_solver': 'lbfgs', 'iw_rho': 0.7}. Best is trial 6 with value: 0.22291687974144064.
2026-06-02 00:53:47 | INFO | Trial 19 | outer=10 | alpha=5.106e+03 n_pcs=3500 (pc_topk) weight={'name': 'uniform'}
[I 2026-06-02 00:53:53,508] Trial 19 finished with value: 0.1699011894766388 and parameters: {'alpha': 5105.564542116895, 'n_pcs': 3500, 'iw_method': 'uniform'}. Best is trial 6 with value: 0.22291687974144064.
2026-06-02 00:53:53 | INFO | Trial 20 | outer=10 | alpha=1.838e+06 n_pcs=4500 (pc_topk) weight={'name': 'pc_logistic', 'floor': 1e-06, 'clip_max': 7.0, 'prob_clip': 0.010241940308881514, 'n_components': 60, 'logistic_c': 0.02359785460791896, 'pca_fit': 'combined', 'solver': 'lbfgs', 'max_iter': 2000, 'fit_intercept': True, 'standardize_with_source': True, 'rho': 0.5}
[I 2026-06-02 00:54:16,237] Trial 20 finished with value: 0.2162323864178784 and parameters: {'alpha': 1838374.2777937658, 'n_pcs': 4500, 'iw_method': 'pc_logistic', 'iw_clip_max': 7.0, 'iw_prob_clip': 0.010241940308881514, 'iw_n_components': 60, 'iw_logistic_c': 0.02359785460791896, 'iw_pca_fit': 'combined', 'iw_solver': 'lbfgs', 'iw_rho': 0.5}. Best is trial 6 with value: 0.22291687974144064.
2026-06-02 00:54:16 | INFO | Trial 21 | outer=10 | alpha=4.392e+04 n_pcs=3500 (pc_topk) weight={'name': 'pc_logistic', 'floor': 1e-06, 'clip_max': 12.0, 'prob_clip': 0.010209563575347228, 'n_components': 40, 'logistic_c': 2.935800987376984e-05, 'pca_fit': 'combined', 'solver': 'lbfgs', 'max_iter': 2000, 'fit_intercept': True, 'standardize_with_source': True, 'rho': 0.7}
[I 2026-06-02 00:54:27,328] Trial 21 finished with value: 0.22270579998585344 and parameters: {'alpha': 43920.04718950448, 'n_pcs': 3500, 'iw_method': 'pc_logistic', 'iw_clip_max': 12.0, 'iw_prob_clip': 0.010209563575347228, 'iw_n_components': 40, 'iw_logistic_c': 2.935800987376984e-05, 'iw_pca_fit': 'combined', 'iw_solver': 'lbfgs', 'iw_rho': 0.7}. Best is trial 6 with value: 0.22291687974144064.
2026-06-02 00:54:27 | INFO | Trial 22 | outer=10 | alpha=6.406e+04 n_pcs=3500 (pc_topk) weight={'name': 'pc_logistic', 'floor': 1e-06, 'clip_max': 12.0, 'prob_clip': 0.007729854892887305, 'n_components': 40, 'logistic_c': 1.9845587024239115e-05, 'pca_fit': 'combined', 'solver': 'lbfgs', 'max_iter': 2000, 'fit_intercept': True, 'standardize_with_source': True, 'rho': 0.7}
[I 2026-06-02 00:54:38,798] Trial 22 finished with value: 0.2268356884008314 and parameters: {'alpha': 64062.67651433571, 'n_pcs': 3500, 'iw_method': 'pc_logistic', 'iw_clip_max': 12.0, 'iw_prob_clip': 0.007729854892887305, 'iw_n_components': 40, 'iw_logistic_c': 1.9845587024239115e-05, 'iw_pca_fit': 'combined', 'iw_solver': 'lbfgs', 'iw_rho': 0.7}. Best is trial 22 with value: 0.2268356884008314.
2026-06-02 00:54:38 | INFO | Trial 23 | outer=10 | alpha=4.558e+04 n_pcs=3000 (pc_topk) weight={'name': 'pc_logistic', 'floor': 1e-06, 'clip_max': 12.0, 'prob_clip': 0.012025316293428462, 'n_components': 40, 'logistic_c': 3.087733766555465e-05, 'pca_fit': 'combined', 'solver': 'lbfgs', 'max_iter': 2000, 'fit_intercept': True, 'standardize_with_source': True, 'rho': 0.7}
[I 2026-06-02 00:54:48,605] Trial 23 finished with value: 0.22159494513027966 and parameters: {'alpha': 45579.1251134363, 'n_pcs': 3000, 'iw_method': 'pc_logistic', 'iw_clip_max': 12.0, 'iw_prob_clip': 0.012025316293428462, 'iw_n_components': 40, 'iw_logistic_c': 3.087733766555465e-05, 'iw_pca_fit': 'combined', 'iw_solver': 'lbfgs', 'iw_rho': 0.7}. Best is trial 22 with value: 0.2268356884008314.
2026-06-02 00:54:48 | INFO | Trial 24 | outer=10 | alpha=4.175e+05 n_pcs=2000 (pc_topk) weight={'name': 'pc_logistic', 'floor': 1e-06, 'clip_max': 12.0, 'prob_clip': 0.0069837926839358185, 'n_components': 40, 'logistic_c': 2.3497990648785737e-05, 'pca_fit': 'combined', 'solver': 'lbfgs', 'max_iter': 2000, 'fit_intercept': True, 'standardize_with_source': True, 'rho': 0.7}
[I 2026-06-02 00:54:56,416] Trial 24 finished with value: 0.22000776077214343 and parameters: {'alpha': 417546.7267117048, 'n_pcs': 2000, 'iw_method': 'pc_logistic', 'iw_clip_max': 12.0, 'iw_prob_clip': 0.0069837926839358185, 'iw_n_components': 40, 'iw_logistic_c': 2.3497990648785737e-05, 'iw_pca_fit': 'combined', 'iw_solver': 'lbfgs', 'iw_rho': 0.7}. Best is trial 22 with value: 0.2268356884008314.
2026-06-02 00:54:56 | INFO | Trial 25 | outer=10 | alpha=2.888e+04 n_pcs=3500 (pc_topk) weight={'name': 'pc_logistic', 'floor': 1e-06, 'clip_max': 12.0, 'prob_clip': 0.02843269937827061, 'n_components': 40, 'logistic_c': 0.0020371148968868517, 'pca_fit': 'combined', 'solver': 'lbfgs', 'max_iter': 2000, 'fit_intercept': True, 'standardize_with_source': True, 'rho': 0.7}
[I 2026-06-02 00:55:11,883] Trial 25 finished with value: 0.21318539358878136 and parameters: {'alpha': 28880.432983734016, 'n_pcs': 3500, 'iw_method': 'pc_logistic', 'iw_clip_max': 12.0, 'iw_prob_clip': 0.02843269937827061, 'iw_n_components': 40, 'iw_logistic_c': 0.0020371148968868517, 'iw_pca_fit': 'combined', 'iw_solver': 'lbfgs', 'iw_rho': 0.7}. Best is trial 22 with value: 0.2268356884008314.
2026-06-02 00:55:11 | INFO | Trial 26 | outer=10 | alpha=7.488e+03 n_pcs=4500 (pc_topk) weight={'name': 'pc_logistic', 'floor': 1e-06, 'clip_max': 12.0, 'prob_clip': 0.0060295807037039975, 'n_components': 40, 'logistic_c': 3.0229320133158428e-06, 'pca_fit': 'combined', 'solver': 'lbfgs', 'max_iter': 2000, 'fit_intercept': True, 'standardize_with_source': True, 'rho': 0.7}
[I 2026-06-02 00:55:26,403] Trial 26 finished with value: 0.20110226342922308 and parameters: {'alpha': 7487.697506940579, 'n_pcs': 4500, 'iw_method': 'pc_logistic', 'iw_clip_max': 12.0, 'iw_prob_clip': 0.0060295807037039975, 'iw_n_components': 40, 'iw_logistic_c': 3.0229320133158428e-06, 'iw_pca_fit': 'combined', 'iw_solver': 'lbfgs', 'iw_rho': 0.7}. Best is trial 22 with value: 0.2268356884008314.
2026-06-02 00:55:26 | INFO | Trial 27 | outer=10 | alpha=7.626e+04 n_pcs=2500 (pc_topk) weight={'name': 'pc_logistic', 'floor': 1e-06, 'clip_max': 4.0, 'prob_clip': 0.0024105847348357416, 'n_components': 10, 'logistic_c': 0.00020037905695239063, 'pca_fit': 'combined', 'solver': 'lbfgs', 'max_iter': 2000, 'fit_intercept': True, 'standardize_with_source': True, 'rho': 0.3}
[I 2026-06-02 00:55:37,005] Trial 27 finished with value: 0.2306456468984063 and parameters: {'alpha': 76261.87262742608, 'n_pcs': 2500, 'iw_method': 'pc_logistic', 'iw_clip_max': 4.0, 'iw_prob_clip': 0.0024105847348357416, 'iw_n_components': 10, 'iw_logistic_c': 0.00020037905695239063, 'iw_pca_fit': 'combined', 'iw_solver': 'lbfgs', 'iw_rho': 0.3}. Best is trial 27 with value: 0.2306456468984063.
2026-06-02 00:55:37 | INFO | Trial 28 | outer=10 | alpha=2.276e+05 n_pcs=2000 (pc_topk) weight={'name': 'pc_logistic', 'floor': 1e-06, 'clip_max': 4.0, 'prob_clip': 0.0018490638183498104, 'n_components': 10, 'logistic_c': 0.0021496258711203764, 'pca_fit': 'combined', 'solver': 'lbfgs', 'max_iter': 2000, 'fit_intercept': True, 'standardize_with_source': True, 'rho': 0.3}
[I 2026-06-02 00:55:47,337] Trial 28 finished with value: 0.2259860587608304 and parameters: {'alpha': 227648.25604676906, 'n_pcs': 2000, 'iw_method': 'pc_logistic', 'iw_clip_max': 4.0, 'iw_prob_clip': 0.0018490638183498104, 'iw_n_components': 10, 'iw_logistic_c': 0.0021496258711203764, 'iw_pca_fit': 'combined', 'iw_solver': 'lbfgs', 'iw_rho': 0.3}. Best is trial 27 with value: 0.2306456468984063.
2026-06-02 00:55:47 | INFO | Trial 29 | outer=10 | alpha=7.804e+04 n_pcs=2000 (pc_topk) weight={'name': 'pc_logistic', 'floor': 1e-06, 'clip_max': 4.0, 'prob_clip': 0.0022771015464902065, 'n_components': 10, 'logistic_c': 0.002478552674875515, 'pca_fit': 'combined', 'solver': 'lbfgs', 'max_iter': 2000, 'fit_intercept': True, 'standardize_with_source': True, 'rho': 0.3}
[I 2026-06-02 00:55:56,575] Trial 29 finished with value: 0.2238363580974045 and parameters: {'alpha': 78038.71322069476, 'n_pcs': 2000, 'iw_method': 'pc_logistic', 'iw_clip_max': 4.0, 'iw_prob_clip': 0.0022771015464902065, 'iw_n_components': 10, 'iw_logistic_c': 0.002478552674875515, 'iw_pca_fit': 'combined', 'iw_solver': 'lbfgs', 'iw_rho': 0.3}. Best is trial 27 with value: 0.2306456468984063.
2026-06-02 00:55:56 | INFO | Trial 30 | outer=10 | alpha=1.405e+05 n_pcs=1500 (pc_topk) weight={'name': 'pc_logistic', 'floor': 1e-06, 'clip_max': 4.0, 'prob_clip': 0.0014213137524900115, 'n_components': 10, 'logistic_c': 0.004834899002439579, 'pca_fit': 'combined', 'solver': 'lbfgs', 'max_iter': 2000, 'fit_intercept': True, 'standardize_with_source': True, 'rho': 0.3}
[I 2026-06-02 00:56:05,461] Trial 30 finished with value: 0.22312303372299805 and parameters: {'alpha': 140543.98262297877, 'n_pcs': 1500, 'iw_method': 'pc_logistic', 'iw_clip_max': 4.0, 'iw_prob_clip': 0.0014213137524900115, 'iw_n_components': 10, 'iw_logistic_c': 0.004834899002439579, 'iw_pca_fit': 'combined', 'iw_solver': 'lbfgs', 'iw_rho': 0.3}. Best is trial 27 with value: 0.2306456468984063.
2026-06-02 00:56:05 | INFO | Trial 31 | outer=10 | alpha=8.940e+04 n_pcs=2000 (pc_topk) weight={'name': 'pc_logistic', 'floor': 1e-06, 'clip_max': 4.0, 'prob_clip': 0.0024154749901899326, 'n_components': 10, 'logistic_c': 0.0032007491824075887, 'pca_fit': 'combined', 'solver': 'lbfgs', 'max_iter': 2000, 'fit_intercept': True, 'standardize_with_source': True, 'rho': 0.3}
[I 2026-06-02 00:56:15,658] Trial 31 finished with value: 0.2247950128676497 and parameters: {'alpha': 89403.78598468307, 'n_pcs': 2000, 'iw_method': 'pc_logistic', 'iw_clip_max': 4.0, 'iw_prob_clip': 0.0024154749901899326, 'iw_n_components': 10, 'iw_logistic_c': 0.0032007491824075887, 'iw_pca_fit': 'combined', 'iw_solver': 'lbfgs', 'iw_rho': 0.3}. Best is trial 27 with value: 0.2306456468984063.
2026-06-02 00:56:15 | INFO | Trial 32 | outer=10 | alpha=8.794e+04 n_pcs=2500 (pc_topk) weight={'name': 'pc_logistic', 'floor': 1e-06, 'clip_max': 4.0, 'prob_clip': 0.0028188224822808454, 'n_components': 10, 'logistic_c': 0.00012824273440037527, 'pca_fit': 'combined', 'solver': 'lbfgs', 'max_iter': 2000, 'fit_intercept': True, 'standardize_with_source': True, 'rho': 0.3}
[I 2026-06-02 00:56:25,593] Trial 32 finished with value: 0.23184222509692115 and parameters: {'alpha': 87942.44269549608, 'n_pcs': 2500, 'iw_method': 'pc_logistic', 'iw_clip_max': 4.0, 'iw_prob_clip': 0.0028188224822808454, 'iw_n_components': 10, 'iw_logistic_c': 0.00012824273440037527, 'iw_pca_fit': 'combined', 'iw_solver': 'lbfgs', 'iw_rho': 0.3}. Best is trial 32 with value: 0.23184222509692115.
2026-06-02 00:56:25 | INFO | Trial 33 | outer=10 | alpha=2.040e+05 n_pcs=2500 (pc_topk) weight={'name': 'pc_logistic', 'floor': 1e-06, 'clip_max': 4.0, 'prob_clip': 0.0038240454648012542, 'n_components': 10, 'logistic_c': 0.00011758290269731055, 'pca_fit': 'combined', 'solver': 'lbfgs', 'max_iter': 2000, 'fit_intercept': True, 'standardize_with_source': True, 'rho': 0.3}
[I 2026-06-02 00:56:35,909] Trial 33 finished with value: 0.23058226937277002 and parameters: {'alpha': 204031.59058061696, 'n_pcs': 2500, 'iw_method': 'pc_logistic', 'iw_clip_max': 4.0, 'iw_prob_clip': 0.0038240454648012542, 'iw_n_components': 10, 'iw_logistic_c': 0.00011758290269731055, 'iw_pca_fit': 'combined', 'iw_solver': 'lbfgs', 'iw_rho': 0.3}. Best is trial 32 with value: 0.23184222509692115.
2026-06-02 00:56:35 | INFO | Trial 34 | outer=10 | alpha=1.828e+04 n_pcs=2500 (pc_topk) weight={'name': 'pc_logistic', 'floor': 1e-06, 'clip_max': 4.0, 'prob_clip': 0.003826298475598046, 'n_components': 10, 'logistic_c': 0.00011680839293455417, 'pca_fit': 'combined', 'solver': 'lbfgs', 'max_iter': 2000, 'fit_intercept': True, 'standardize_with_source': True, 'rho': 0.3}
[I 2026-06-02 00:56:45,960] Trial 34 finished with value: 0.21010557474492436 and parameters: {'alpha': 18280.254554677664, 'n_pcs': 2500, 'iw_method': 'pc_logistic', 'iw_clip_max': 4.0, 'iw_prob_clip': 0.003826298475598046, 'iw_n_components': 10, 'iw_logistic_c': 0.00011680839293455417, 'iw_pca_fit': 'combined', 'iw_solver': 'lbfgs', 'iw_rho': 0.3}. Best is trial 32 with value: 0.23184222509692115.
2026-06-02 00:56:45 | INFO | Trial 35 | outer=10 | alpha=1.694e+05 n_pcs=1500 (pc_topk) weight={'name': 'pc_logistic', 'floor': 1e-06, 'clip_max': 4.0, 'prob_clip': 0.006612508315213077, 'n_components': 10, 'logistic_c': 4.907352344710315e-06, 'pca_fit': 'combined', 'solver': 'lbfgs', 'max_iter': 2000, 'fit_intercept': True, 'standardize_with_source': True, 'rho': 0.3}
[I 2026-06-02 00:56:53,788] Trial 35 finished with value: 0.21737135237154015 and parameters: {'alpha': 169429.16663595874, 'n_pcs': 1500, 'iw_method': 'pc_logistic', 'iw_clip_max': 4.0, 'iw_prob_clip': 0.006612508315213077, 'iw_n_components': 10, 'iw_logistic_c': 4.907352344710315e-06, 'iw_pca_fit': 'combined', 'iw_solver': 'lbfgs', 'iw_rho': 0.3}. Best is trial 32 with value: 0.23184222509692115.
2026-06-02 00:56:53 | INFO | Trial 36 | outer=10 | alpha=9.604e+04 n_pcs=2500 (pc_topk) weight={'name': 'pc_logistic', 'floor': 1e-06, 'clip_max': 4.0, 'prob_clip': 0.0035372089177746276, 'n_components': 100, 'logistic_c': 0.00010568346421590234, 'pca_fit': 'combined', 'solver': 'lbfgs', 'max_iter': 2000, 'fit_intercept': True, 'standardize_with_source': True, 'rho': 0.85}
[I 2026-06-02 00:57:04,510] Trial 36 finished with value: 0.2324113173537241 and parameters: {'alpha': 96038.6655164403, 'n_pcs': 2500, 'iw_method': 'pc_logistic', 'iw_clip_max': 4.0, 'iw_prob_clip': 0.0035372089177746276, 'iw_n_components': 100, 'iw_logistic_c': 0.00010568346421590234, 'iw_pca_fit': 'combined', 'iw_solver': 'lbfgs', 'iw_rho': 0.85}. Best is trial 36 with value: 0.2324113173537241.
2026-06-02 00:57:04 | INFO | Trial 37 | outer=10 | alpha=1.049e+05 n_pcs=2500 (pc_topk) weight={'name': 'pc_logistic', 'floor': 1e-06, 'clip_max': 4.0, 'prob_clip': 0.00323460130709177, 'n_components': 100, 'logistic_c': 0.0001144242793248967, 'pca_fit': 'combined', 'solver': 'lbfgs', 'max_iter': 2000, 'fit_intercept': True, 'standardize_with_source': True, 'rho': 0.85}
[I 2026-06-02 00:57:15,274] Trial 37 finished with value: 0.23292217197662737 and parameters: {'alpha': 104874.67785615491, 'n_pcs': 2500, 'iw_method': 'pc_logistic', 'iw_clip_max': 4.0, 'iw_prob_clip': 0.00323460130709177, 'iw_n_components': 100, 'iw_logistic_c': 0.0001144242793248967, 'iw_pca_fit': 'combined', 'iw_solver': 'lbfgs', 'iw_rho': 0.85}. Best is trial 37 with value: 0.23292217197662737.
2026-06-02 00:57:15 | INFO | Trial 38 | outer=10 | alpha=1.019e+05 n_pcs=3000 (pc_topk) weight={'name': 'pc_logistic', 'floor': 1e-06, 'clip_max': 4.0, 'prob_clip': 0.0009725776233436238, 'n_components': 100, 'logistic_c': 0.00012017925290903198, 'pca_fit': 'combined', 'solver': 'lbfgs', 'max_iter': 2000, 'fit_intercept': True, 'standardize_with_source': True, 'rho': 0.85}
[I 2026-06-02 00:57:26,326] Trial 38 finished with value: 0.23412790444022225 and parameters: {'alpha': 101897.51174121142, 'n_pcs': 3000, 'iw_method': 'pc_logistic', 'iw_clip_max': 4.0, 'iw_prob_clip': 0.0009725776233436238, 'iw_n_components': 100, 'iw_logistic_c': 0.00012017925290903198, 'iw_pca_fit': 'combined', 'iw_solver': 'lbfgs', 'iw_rho': 0.85}. Best is trial 38 with value: 0.23412790444022225.
2026-06-02 00:57:26 | INFO | Trial 39 | outer=10 | alpha=1.193e+05 n_pcs=3000 (pc_topk) weight={'name': 'pc_logistic', 'floor': 1e-06, 'clip_max': 4.0, 'prob_clip': 0.0008522266732103189, 'n_components': 100, 'logistic_c': 0.0006740558897749277, 'pca_fit': 'combined', 'solver': 'lbfgs', 'max_iter': 2000, 'fit_intercept': True, 'standardize_with_source': True, 'rho': 0.85}
[I 2026-06-02 00:57:39,251] Trial 39 finished with value: 0.2339610530829162 and parameters: {'alpha': 119308.50514905121, 'n_pcs': 3000, 'iw_method': 'pc_logistic', 'iw_clip_max': 4.0, 'iw_prob_clip': 0.0008522266732103189, 'iw_n_components': 100, 'iw_logistic_c': 0.0006740558897749277, 'iw_pca_fit': 'combined', 'iw_solver': 'lbfgs', 'iw_rho': 0.85}. Best is trial 38 with value: 0.23412790444022225.
2026-06-02 00:57:39 | INFO | Trial 40 | outer=10 | alpha=5.053e+05 n_pcs=3000 (pc_topk) weight={'name': 'pc_logistic', 'floor': 1e-06, 'clip_max': 1.5, 'prob_clip': 0.0010466510147540838, 'n_components': 100, 'logistic_c': 0.33144619157771393, 'pca_fit': 'combined', 'solver': 'lbfgs', 'max_iter': 2000, 'fit_intercept': True, 'standardize_with_source': True, 'rho': 0.85}
[I 2026-06-02 00:57:56,621] Trial 40 finished with value: 0.22559664865206588 and parameters: {'alpha': 505320.6644244122, 'n_pcs': 3000, 'iw_method': 'pc_logistic', 'iw_clip_max': 1.5, 'iw_prob_clip': 0.0010466510147540838, 'iw_n_components': 100, 'iw_logistic_c': 0.33144619157771393, 'iw_pca_fit': 'combined', 'iw_solver': 'lbfgs', 'iw_rho': 0.85}. Best is trial 38 with value: 0.23412790444022225.
2026-06-02 00:57:56 | INFO | Trial 41 | outer=10 | alpha=1.091e+05 n_pcs=3000 (pc_topk) weight={'name': 'pc_logistic', 'floor': 1e-06, 'clip_max': 4.0, 'prob_clip': 0.0009020887782497456, 'n_components': 100, 'logistic_c': 0.000755722887265345, 'pca_fit': 'combined', 'solver': 'lbfgs', 'max_iter': 2000, 'fit_intercept': True, 'standardize_with_source': True, 'rho': 0.85}
[I 2026-06-02 00:58:08,085] Trial 41 finished with value: 0.23359675051317344 and parameters: {'alpha': 109108.49924989828, 'n_pcs': 3000, 'iw_method': 'pc_logistic', 'iw_clip_max': 4.0, 'iw_prob_clip': 0.0009020887782497456, 'iw_n_components': 100, 'iw_logistic_c': 0.000755722887265345, 'iw_pca_fit': 'combined', 'iw_solver': 'lbfgs', 'iw_rho': 0.85}. Best is trial 38 with value: 0.23412790444022225.
2026-06-02 00:58:08 | INFO | Trial 42 | outer=10 | alpha=1.364e+05 n_pcs=3000 (pc_topk) weight={'name': 'pc_logistic', 'floor': 1e-06, 'clip_max': 4.0, 'prob_clip': 0.0010136937847504937, 'n_components': 100, 'logistic_c': 0.0004744121162538082, 'pca_fit': 'combined', 'solver': 'lbfgs', 'max_iter': 2000, 'fit_intercept': True, 'standardize_with_source': True, 'rho': 0.85}
