[I 2026-05-31 23:27:30,980] Trial 220 finished with value: 0.24978817946577908 and parameters: {'alpha': 320515.01264250354, 'n_pcs': 4000, 'weight_scheme': 'exponential', 'weight_clip_max': 3.0, 'weight_exponential_beta': 8.571993087002406}. Best is trial 214 with value: 0.2498688542015699.
2026-05-31 23:27:30 | INFO | src.nested_cv_avggrm_weighted_unified | Trial 221 | outer=2 | alpha=3.219e+05 n_pcs=4000 (pc_topk) weight_search=on
2026-05-31 23:27:30 | INFO | src.nested_cv_avggrm_weighted_unified | Trial 221 | outer=2 | weight={'name': 'exponential', 'floor': 1e-06, 'clip_max': 3.0, 'beta': 8.51750965852634}
[I 2026-05-31 23:27:36,724] Trial 221 finished with value: 0.24976375061455647 and parameters: {'alpha': 321934.73397655063, 'n_pcs': 4000, 'weight_scheme': 'exponential', 'weight_clip_max': 3.0, 'weight_exponential_beta': 8.51750965852634}. Best is trial 214 with value: 0.2498688542015699.
2026-05-31 23:27:36 | INFO | src.nested_cv_avggrm_weighted_unified | Trial 222 | outer=2 | alpha=3.147e+05 n_pcs=4000 (pc_topk) weight_search=on
2026-05-31 23:27:36 | INFO | src.nested_cv_avggrm_weighted_unified | Trial 222 | outer=2 | weight={'name': 'exponential', 'floor': 1e-06, 'clip_max': 3.0, 'beta': 8.896080814077303}
[I 2026-05-31 23:27:42,464] Trial 222 finished with value: 0.24986543182148827 and parameters: {'alpha': 314665.19328328036, 'n_pcs': 4000, 'weight_scheme': 'exponential', 'weight_clip_max': 3.0, 'weight_exponential_beta': 8.896080814077303}. Best is trial 214 with value: 0.2498688542015699.
2026-05-31 23:27:42 | INFO | src.nested_cv_avggrm_weighted_unified | Trial 223 | outer=2 | alpha=4.624e+05 n_pcs=4000 (pc_topk) weight_search=on
2026-05-31 23:27:42 | INFO | src.nested_cv_avggrm_weighted_unified | Trial 223 | outer=2 | weight={'name': 'exponential', 'floor': 1e-06, 'clip_max': 3.0, 'beta': 8.942347984857623}
[I 2026-05-31 23:27:48,183] Trial 223 finished with value: 0.2493789071122059 and parameters: {'alpha': 462407.18949583947, 'n_pcs': 4000, 'weight_scheme': 'exponential', 'weight_clip_max': 3.0, 'weight_exponential_beta': 8.942347984857623}. Best is trial 214 with value: 0.2498688542015699.
2026-05-31 23:27:48 | INFO | src.nested_cv_avggrm_weighted_unified | Trial 224 | outer=2 | alpha=2.320e+05 n_pcs=4000 (pc_topk) weight_search=on
2026-05-31 23:27:48 | INFO | src.nested_cv_avggrm_weighted_unified | Trial 224 | outer=2 | weight={'name': 'exponential', 'floor': 1e-06, 'clip_max': 3.0, 'beta': 8.827166766715749}
[I 2026-05-31 23:27:53,914] Trial 224 finished with value: 0.24954176552516824 and parameters: {'alpha': 231954.85442668706, 'n_pcs': 4000, 'weight_scheme': 'exponential', 'weight_clip_max': 3.0, 'weight_exponential_beta': 8.827166766715749}. Best is trial 214 with value: 0.2498688542015699.
2026-05-31 23:27:53 | INFO | src.nested_cv_avggrm_weighted_unified | Trial 225 | outer=2 | alpha=3.014e+05 n_pcs=4000 (pc_topk) weight_search=on
2026-05-31 23:27:53 | INFO | src.nested_cv_avggrm_weighted_unified | Trial 225 | outer=2 | weight={'name': 'exponential', 'floor': 1e-06, 'clip_max': 3.0, 'beta': 8.900439736789044}
[I 2026-05-31 23:27:59,637] Trial 225 finished with value: 0.24985646327050412 and parameters: {'alpha': 301391.4176795821, 'n_pcs': 4000, 'weight_scheme': 'exponential', 'weight_clip_max': 3.0, 'weight_exponential_beta': 8.900439736789044}. Best is trial 214 with value: 0.2498688542015699.
2026-05-31 23:27:59 | INFO | src.nested_cv_avggrm_weighted_unified | Trial 226 | outer=2 | alpha=2.818e+05 n_pcs=4000 (pc_topk) weight_search=on
2026-05-31 23:27:59 | INFO | src.nested_cv_avggrm_weighted_unified | Trial 226 | outer=2 | weight={'name': 'linear', 'floor': 1e-06, 'clip_max': 3.0, 'min_weight': 0.06083118854800662, 'max_weight': 2.03104039226943}
2026-05-31 23:28:03 | INFO | src.nested_cv_avggrm_weighted_unified | Trial 226 | outer=2 | pruned after 7/10 inner folds (mean r=0.2776)
[I 2026-05-31 23:28:03,654] Trial 226 pruned. 
2026-05-31 23:28:03 | INFO | src.nested_cv_avggrm_weighted_unified | Trial 227 | outer=2 | alpha=1.885e+05 n_pcs=4000 (pc_topk) weight_search=on
2026-05-31 23:28:03 | INFO | src.nested_cv_avggrm_weighted_unified | Trial 227 | outer=2 | weight={'name': 'exponential', 'floor': 1e-06, 'clip_max': None, 'beta': 8.966365961204053}
2026-05-31 23:28:07 | INFO | src.nested_cv_avggrm_weighted_unified | Trial 227 | outer=2 | pruned after 6/10 inner folds (mean r=0.2196)
[I 2026-05-31 23:28:07,091] Trial 227 pruned. 
2026-05-31 23:28:07 | INFO | src.nested_cv_avggrm_weighted_unified | Trial 228 | outer=2 | alpha=2.365e+05 n_pcs=4000 (pc_topk) weight_search=on
2026-05-31 23:28:07 | INFO | src.nested_cv_avggrm_weighted_unified | Trial 228 | outer=2 | weight={'name': 'exponential', 'floor': 1e-06, 'clip_max': 3.0, 'beta': 8.15888248277367}
[I 2026-05-31 23:28:12,841] Trial 228 finished with value: 0.24943260998184372 and parameters: {'alpha': 236525.39739034348, 'n_pcs': 4000, 'weight_scheme': 'exponential', 'weight_clip_max': 3.0, 'weight_exponential_beta': 8.15888248277367}. Best is trial 214 with value: 0.2498688542015699.
2026-05-31 23:28:12 | INFO | src.nested_cv_avggrm_weighted_unified | Trial 229 | outer=2 | alpha=4.727e+05 n_pcs=4000 (pc_topk) weight_search=on
2026-05-31 23:28:12 | INFO | src.nested_cv_avggrm_weighted_unified | Trial 229 | outer=2 | weight={'name': 'exponential', 'floor': 1e-06, 'clip_max': 3.0, 'beta': 8.913123883039399}
[I 2026-05-31 23:28:18,575] Trial 229 finished with value: 0.2493224496009593 and parameters: {'alpha': 472748.4423125553, 'n_pcs': 4000, 'weight_scheme': 'exponential', 'weight_clip_max': 3.0, 'weight_exponential_beta': 8.913123883039399}. Best is trial 214 with value: 0.2498688542015699.
2026-05-31 23:28:18 | INFO | src.nested_cv_avggrm_weighted_unified | Trial 230 | outer=2 | alpha=3.307e+05 n_pcs=4000 (pc_topk) weight_search=on
2026-05-31 23:28:18 | INFO | src.nested_cv_avggrm_weighted_unified | Trial 230 | outer=2 | weight={'name': 'exponential', 'floor': 1e-06, 'clip_max': 3.0, 'beta': 8.399896975697803}
[I 2026-05-31 23:28:24,331] Trial 230 finished with value: 0.24968695227936477 and parameters: {'alpha': 330691.5992512818, 'n_pcs': 4000, 'weight_scheme': 'exponential', 'weight_clip_max': 3.0, 'weight_exponential_beta': 8.399896975697803}. Best is trial 214 with value: 0.2498688542015699.
2026-05-31 23:28:24 | INFO | src.nested_cv_avggrm_weighted_unified | Trial 231 | outer=2 | alpha=2.968e+05 n_pcs=4000 (pc_topk) weight_search=on
2026-05-31 23:28:24 | INFO | src.nested_cv_avggrm_weighted_unified | Trial 231 | outer=2 | weight={'name': 'exponential', 'floor': 1e-06, 'clip_max': 3.0, 'beta': 8.726730948030898}
[I 2026-05-31 23:28:30,067] Trial 231 finished with value: 0.24984268749748467 and parameters: {'alpha': 296818.6666586364, 'n_pcs': 4000, 'weight_scheme': 'exponential', 'weight_clip_max': 3.0, 'weight_exponential_beta': 8.726730948030898}. Best is trial 214 with value: 0.2498688542015699.
2026-05-31 23:28:30 | INFO | src.nested_cv_avggrm_weighted_unified | Trial 232 | outer=2 | alpha=2.957e+05 n_pcs=4000 (pc_topk) weight_search=on
2026-05-31 23:28:30 | INFO | src.nested_cv_avggrm_weighted_unified | Trial 232 | outer=2 | weight={'name': 'exponential', 'floor': 1e-06, 'clip_max': 3.0, 'beta': 8.943722158522789}
[I 2026-05-31 23:28:35,808] Trial 232 finished with value: 0.2498330199169873 and parameters: {'alpha': 295673.4448561784, 'n_pcs': 4000, 'weight_scheme': 'exponential', 'weight_clip_max': 3.0, 'weight_exponential_beta': 8.943722158522789}. Best is trial 214 with value: 0.2498688542015699.
2026-05-31 23:28:35 | INFO | src.nested_cv_avggrm_weighted_unified | Trial 233 | outer=2 | alpha=3.427e+05 n_pcs=4000 (pc_topk) weight_search=on
2026-05-31 23:28:35 | INFO | src.nested_cv_avggrm_weighted_unified | Trial 233 | outer=2 | weight={'name': 'exponential', 'floor': 1e-06, 'clip_max': 3.0, 'beta': 8.984141852172197}
[I 2026-05-31 23:28:41,556] Trial 233 finished with value: 0.2498211194208834 and parameters: {'alpha': 342687.54617145594, 'n_pcs': 4000, 'weight_scheme': 'exponential', 'weight_clip_max': 3.0, 'weight_exponential_beta': 8.984141852172197}. Best is trial 214 with value: 0.2498688542015699.
2026-05-31 23:28:41 | INFO | src.nested_cv_avggrm_weighted_unified | Trial 234 | outer=2 | alpha=3.463e+05 n_pcs=4000 (pc_topk) weight_search=on
2026-05-31 23:28:41 | INFO | src.nested_cv_avggrm_weighted_unified | Trial 234 | outer=2 | weight={'name': 'exponential', 'floor': 1e-06, 'clip_max': 3.0, 'beta': 8.993589053669197}
[I 2026-05-31 23:28:47,300] Trial 234 finished with value: 0.2498129455244106 and parameters: {'alpha': 346253.05068010837, 'n_pcs': 4000, 'weight_scheme': 'exponential', 'weight_clip_max': 3.0, 'weight_exponential_beta': 8.993589053669197}. Best is trial 214 with value: 0.2498688542015699.
2026-05-31 23:28:47 | INFO | src.nested_cv_avggrm_weighted_unified | Trial 235 | outer=2 | alpha=3.443e+05 n_pcs=4000 (pc_topk) weight_search=on
2026-05-31 23:28:47 | INFO | src.nested_cv_avggrm_weighted_unified | Trial 235 | outer=2 | weight={'name': 'exponential', 'floor': 1e-06, 'clip_max': 3.0, 'beta': 8.61396557745264}
[I 2026-05-31 23:28:53,017] Trial 235 finished with value: 0.24975877896243498 and parameters: {'alpha': 344335.218704342, 'n_pcs': 4000, 'weight_scheme': 'exponential', 'weight_clip_max': 3.0, 'weight_exponential_beta': 8.61396557745264}. Best is trial 214 with value: 0.2498688542015699.
2026-05-31 23:28:53 | INFO | src.nested_cv_avggrm_weighted_unified | Trial 236 | outer=2 | alpha=4.728e+05 n_pcs=4000 (pc_topk) weight_search=on
2026-05-31 23:28:53 | INFO | src.nested_cv_avggrm_weighted_unified | Trial 236 | outer=2 | weight={'name': 'exponential', 'floor': 1e-06, 'clip_max': 3.0, 'beta': 8.821575004109791}
[I 2026-05-31 23:28:58,738] Trial 236 finished with value: 0.2492967753890846 and parameters: {'alpha': 472780.41068146226, 'n_pcs': 4000, 'weight_scheme': 'exponential', 'weight_clip_max': 3.0, 'weight_exponential_beta': 8.821575004109791}. Best is trial 214 with value: 0.2498688542015699.
2026-05-31 23:28:58 | INFO | src.nested_cv_avggrm_weighted_unified | Trial 237 | outer=2 | alpha=2.294e+05 n_pcs=4000 (pc_topk) weight_search=on
2026-05-31 23:28:58 | INFO | src.nested_cv_avggrm_weighted_unified | Trial 237 | outer=2 | weight={'name': 'exponential', 'floor': 1e-06, 'clip_max': 10.0, 'beta': 9.038015711085032}
2026-05-31 23:29:02 | INFO | src.nested_cv_avggrm_weighted_unified | Trial 237 | outer=2 | pruned after 7/10 inner folds (mean r=0.2680)
[I 2026-05-31 23:29:02,767] Trial 237 pruned. 
2026-05-31 23:29:02 | INFO | src.nested_cv_avggrm_weighted_unified | Trial 238 | outer=2 | alpha=3.050e+05 n_pcs=3500 (pc_topk) weight_search=on
2026-05-31 23:29:02 | INFO | src.nested_cv_avggrm_weighted_unified | Trial 238 | outer=2 | weight={'name': 'exponential', 'floor': 1e-06, 'clip_max': 3.0, 'beta': 8.652152738340748}
[I 2026-05-31 23:29:07,699] Trial 238 finished with value: 0.24895110492041467 and parameters: {'alpha': 304958.6443480699, 'n_pcs': 3500, 'weight_scheme': 'exponential', 'weight_clip_max': 3.0, 'weight_exponential_beta': 8.652152738340748}. Best is trial 214 with value: 0.2498688542015699.
2026-05-31 23:29:07 | INFO | src.nested_cv_avggrm_weighted_unified | Trial 239 | outer=2 | alpha=3.575e+05 n_pcs=4000 (pc_topk) weight_search=on
2026-05-31 23:29:07 | INFO | src.nested_cv_avggrm_weighted_unified | Trial 239 | outer=2 | weight={'name': 'exponential', 'floor': 1e-06, 'clip_max': 3.0, 'beta': 9.001744385276815}
[I 2026-05-31 23:29:13,448] Trial 239 finished with value: 0.2497894202395651 and parameters: {'alpha': 357467.65321163676, 'n_pcs': 4000, 'weight_scheme': 'exponential', 'weight_clip_max': 3.0, 'weight_exponential_beta': 9.001744385276815}. Best is trial 214 with value: 0.2498688542015699.
2026-05-31 23:29:13 | INFO | src.nested_cv_avggrm_weighted_unified | Trial 240 | outer=2 | alpha=2.681e+05 n_pcs=4000 (pc_topk) weight_search=on
2026-05-31 23:29:13 | INFO | src.nested_cv_avggrm_weighted_unified | Trial 240 | outer=2 | weight={'name': 'exponential', 'floor': 1e-06, 'clip_max': 3.0, 'beta': 8.786011856041918}
[I 2026-05-31 23:29:19,191] Trial 240 finished with value: 0.2497783538097304 and parameters: {'alpha': 268052.0080759775, 'n_pcs': 4000, 'weight_scheme': 'exponential', 'weight_clip_max': 3.0, 'weight_exponential_beta': 8.786011856041918}. Best is trial 214 with value: 0.2498688542015699.
2026-05-31 23:29:19 | INFO | src.nested_cv_avggrm_weighted_unified | Trial 241 | outer=2 | alpha=3.370e+05 n_pcs=4000 (pc_topk) weight_search=on
2026-05-31 23:29:19 | INFO | src.nested_cv_avggrm_weighted_unified | Trial 241 | outer=2 | weight={'name': 'exponential', 'floor': 1e-06, 'clip_max': 3.0, 'beta': 9.019721990757148}
[I 2026-05-31 23:29:24,960] Trial 241 finished with value: 0.24981686597170363 and parameters: {'alpha': 336954.26437347673, 'n_pcs': 4000, 'weight_scheme': 'exponential', 'weight_clip_max': 3.0, 'weight_exponential_beta': 9.019721990757148}. Best is trial 214 with value: 0.2498688542015699.
2026-05-31 23:29:24 | INFO | src.nested_cv_avggrm_weighted_unified | Trial 242 | outer=2 | alpha=4.380e+05 n_pcs=4000 (pc_topk) weight_search=on
2026-05-31 23:29:24 | INFO | src.nested_cv_avggrm_weighted_unified | Trial 242 | outer=2 | weight={'name': 'exponential', 'floor': 1e-06, 'clip_max': 3.0, 'beta': 8.8656476134983}
[I 2026-05-31 23:29:30,700] Trial 242 finished with value: 0.24950000149838916 and parameters: {'alpha': 438017.3008895469, 'n_pcs': 4000, 'weight_scheme': 'exponential', 'weight_clip_max': 3.0, 'weight_exponential_beta': 8.8656476134983}. Best is trial 214 with value: 0.2498688542015699.
2026-05-31 23:29:30 | INFO | src.nested_cv_avggrm_weighted_unified | Trial 243 | outer=2 | alpha=3.468e+05 n_pcs=4000 (pc_topk) weight_search=on
2026-05-31 23:29:30 | INFO | src.nested_cv_avggrm_weighted_unified | Trial 243 | outer=2 | weight={'name': 'exponential', 'floor': 1e-06, 'clip_max': 3.0, 'beta': 9.057839358663172}
[I 2026-05-31 23:29:36,448] Trial 243 finished with value: 0.24979404426753668 and parameters: {'alpha': 346822.0044946073, 'n_pcs': 4000, 'weight_scheme': 'exponential', 'weight_clip_max': 3.0, 'weight_exponential_beta': 9.057839358663172}. Best is trial 214 with value: 0.2498688542015699.
2026-05-31 23:29:36 | INFO | src.nested_cv_avggrm_weighted_unified | Trial 244 | outer=2 | alpha=2.327e+05 n_pcs=4000 (pc_topk) weight_search=on
2026-05-31 23:29:36 | INFO | src.nested_cv_avggrm_weighted_unified | Trial 244 | outer=2 | weight={'name': 'exponential', 'floor': 1e-06, 'clip_max': 3.0, 'beta': 8.614485311610593}
[I 2026-05-31 23:29:42,190] Trial 244 finished with value: 0.24955720430044467 and parameters: {'alpha': 232686.31860494814, 'n_pcs': 4000, 'weight_scheme': 'exponential', 'weight_clip_max': 3.0, 'weight_exponential_beta': 8.614485311610593}. Best is trial 214 with value: 0.2498688542015699.
2026-05-31 23:29:42 | INFO | src.nested_cv_avggrm_weighted_unified | Trial 245 | outer=2 | alpha=2.881e+05 n_pcs=4000 (pc_topk) weight_search=on
2026-05-31 23:29:42 | INFO | src.nested_cv_avggrm_weighted_unified | Trial 245 | outer=2 | weight={'name': 'exponential', 'floor': 1e-06, 'clip_max': 3.0, 'beta': 8.398681316491581}
[I 2026-05-31 23:29:47,909] Trial 245 finished with value: 0.24973198239515187 and parameters: {'alpha': 288109.0256149164, 'n_pcs': 4000, 'weight_scheme': 'exponential', 'weight_clip_max': 3.0, 'weight_exponential_beta': 8.398681316491581}. Best is trial 214 with value: 0.2498688542015699.
2026-05-31 23:29:47 | INFO | src.nested_cv_avggrm_weighted_unified | Trial 246 | outer=2 | alpha=3.576e+05 n_pcs=4000 (pc_topk) weight_search=on
2026-05-31 23:29:47 | INFO | src.nested_cv_avggrm_weighted_unified | Trial 246 | outer=2 | weight={'name': 'exponential', 'floor': 1e-06, 'clip_max': 3.0, 'beta': 8.831501998564786}
[I 2026-05-31 23:29:53,672] Trial 246 finished with value: 0.2498064966111277 and parameters: {'alpha': 357558.8563463896, 'n_pcs': 4000, 'weight_scheme': 'exponential', 'weight_clip_max': 3.0, 'weight_exponential_beta': 8.831501998564786}. Best is trial 214 with value: 0.2498688542015699.
2026-05-31 23:29:53 | INFO | src.nested_cv_avggrm_weighted_unified | Trial 247 | outer=2 | alpha=3.006e+05 n_pcs=4000 (pc_topk) weight_search=on
2026-05-31 23:29:53 | INFO | src.nested_cv_avggrm_weighted_unified | Trial 247 | outer=2 | weight={'name': 'exponential', 'floor': 1e-06, 'clip_max': 20.0, 'beta': 9.078314184607208}
2026-05-31 23:29:57 | INFO | src.nested_cv_avggrm_weighted_unified | Trial 247 | outer=2 | pruned after 7/10 inner folds (mean r=0.2574)
[I 2026-05-31 23:29:57,693] Trial 247 pruned. 
2026-05-31 23:29:57 | INFO | src.nested_cv_avggrm_weighted_unified | Trial 248 | outer=2 | alpha=2.342e+05 n_pcs=4000 (pc_topk) weight_search=on
2026-05-31 23:29:57 | INFO | src.nested_cv_avggrm_weighted_unified | Trial 248 | outer=2 | weight={'name': 'exponential', 'floor': 1e-06, 'clip_max': 3.0, 'beta': 8.678694375561896}
[I 2026-05-31 23:30:03,454] Trial 248 finished with value: 0.24957211286374098 and parameters: {'alpha': 234240.4301138172, 'n_pcs': 4000, 'weight_scheme': 'exponential', 'weight_clip_max': 3.0, 'weight_exponential_beta': 8.678694375561896}. Best is trial 214 with value: 0.2498688542015699.
2026-05-31 23:30:03 | INFO | src.nested_cv_avggrm_weighted_unified | Trial 249 | outer=2 | alpha=3.980e+05 n_pcs=4000 (pc_topk) weight_search=on
2026-05-31 23:30:03 | INFO | src.nested_cv_avggrm_weighted_unified | Trial 249 | outer=2 | weight={'name': 'exponential', 'floor': 1e-06, 'clip_max': 3.0, 'beta': 8.984645907012723}
[I 2026-05-31 23:30:09,181] Trial 249 finished with value: 0.24967173340445686 and parameters: {'alpha': 398042.07512807933, 'n_pcs': 4000, 'weight_scheme': 'exponential', 'weight_clip_max': 3.0, 'weight_exponential_beta': 8.984645907012723}. Best is trial 214 with value: 0.2498688542015699.
2026-05-31 23:30:09 | INFO | src.nested_cv_avggrm_weighted_unified | Trial 250 | outer=2 | alpha=2.733e+05 n_pcs=4000 (pc_topk) weight_search=on
2026-05-31 23:30:09 | INFO | src.nested_cv_avggrm_weighted_unified | Trial 250 | outer=2 | weight={'name': 'exponential', 'floor': 1e-06, 'clip_max': 3.0, 'beta': 9.357232468601616}
[I 2026-05-31 23:30:14,940] Trial 250 finished with value: 0.24949896287210843 and parameters: {'alpha': 273347.3510010935, 'n_pcs': 4000, 'weight_scheme': 'exponential', 'weight_clip_max': 3.0, 'weight_exponential_beta': 9.357232468601616}. Best is trial 214 with value: 0.2498688542015699.
2026-05-31 23:30:14 | INFO | src.nested_cv_avggrm_weighted_unified | Trial 251 | outer=2 | alpha=4.148e+04 n_pcs=4000 (pc_topk) weight_search=on
2026-05-31 23:30:14 | INFO | src.nested_cv_avggrm_weighted_unified | Trial 251 | outer=2 | weight={'name': 'exponential', 'floor': 1e-06, 'clip_max': 3.0, 'beta': 8.828915857722903}
2026-05-31 23:30:18 | INFO | src.nested_cv_avggrm_weighted_unified | Trial 251 | outer=2 | pruned after 7/10 inner folds (mean r=0.2554)
[I 2026-05-31 23:30:18,998] Trial 251 pruned. 
2026-05-31 23:30:19 | INFO | src.nested_cv_avggrm_weighted_unified | Trial 252 | outer=2 | alpha=4.663e+05 n_pcs=4000 (pc_topk) weight_search=on
2026-05-31 23:30:19 | INFO | src.nested_cv_avggrm_weighted_unified | Trial 252 | outer=2 | weight={'name': 'uniform', 'floor': 1e-06, 'clip_max': 3.0}
2026-05-31 23:30:21 | INFO | src.nested_cv_avggrm_weighted_unified | Trial 252 | outer=2 | pruned after 6/10 inner folds (mean r=0.2337)
[I 2026-05-31 23:30:21,951] Trial 252 pruned. 
2026-05-31 23:30:21 | INFO | src.nested_cv_avggrm_weighted_unified | Trial 253 | outer=2 | alpha=1.998e+05 n_pcs=4000 (pc_topk) weight_search=on
2026-05-31 23:30:21 | INFO | src.nested_cv_avggrm_weighted_unified | Trial 253 | outer=2 | weight={'name': 'exponential', 'floor': 1e-06, 'clip_max': 3.0, 'beta': 8.38720018457007}
[I 2026-05-31 23:30:27,688] Trial 253 finished with value: 0.2491807048453305 and parameters: {'alpha': 199834.3964292402, 'n_pcs': 4000, 'weight_scheme': 'exponential', 'weight_clip_max': 3.0, 'weight_exponential_beta': 8.38720018457007}. Best is trial 214 with value: 0.2498688542015699.
2026-05-31 23:30:27 | INFO | src.nested_cv_avggrm_weighted_unified | Trial 254 | outer=2 | alpha=3.208e+05 n_pcs=4000 (pc_topk) weight_search=on
2026-05-31 23:30:27 | INFO | src.nested_cv_avggrm_weighted_unified | Trial 254 | outer=2 | weight={'name': 'exponential', 'floor': 1e-06, 'clip_max': 3.0, 'beta': 8.586168405301452}
[I 2026-05-31 23:30:33,455] Trial 254 finished with value: 0.24979308885501394 and parameters: {'alpha': 320818.801722236, 'n_pcs': 4000, 'weight_scheme': 'exponential', 'weight_clip_max': 3.0, 'weight_exponential_beta': 8.586168405301452}. Best is trial 214 with value: 0.2498688542015699.
2026-05-31 23:30:33 | INFO | src.nested_cv_avggrm_weighted_unified | Trial 255 | outer=2 | alpha=2.384e+05 n_pcs=4000 (pc_topk) weight_search=on
2026-05-31 23:30:33 | INFO | src.nested_cv_avggrm_weighted_unified | Trial 255 | outer=2 | weight={'name': 'exponential', 'floor': 1e-06, 'clip_max': 3.0, 'beta': 9.075134064174577}
[I 2026-05-31 23:30:39,192] Trial 255 finished with value: 0.24947103767373768 and parameters: {'alpha': 238398.27774735226, 'n_pcs': 4000, 'weight_scheme': 'exponential', 'weight_clip_max': 3.0, 'weight_exponential_beta': 9.075134064174577}. Best is trial 214 with value: 0.2498688542015699.
2026-05-31 23:30:39 | INFO | src.nested_cv_avggrm_weighted_unified | Trial 256 | outer=2 | alpha=1.666e+03 n_pcs=4000 (pc_topk) weight_search=on
2026-05-31 23:30:39 | INFO | src.nested_cv_avggrm_weighted_unified | Trial 256 | outer=2 | weight={'name': 'exponential', 'floor': 1e-06, 'clip_max': 3.0, 'beta': 8.759711089032868}
2026-05-31 23:30:42 | INFO | src.nested_cv_avggrm_weighted_unified | Trial 256 | outer=2 | pruned after 5/10 inner folds (mean r=0.1307)
