[I 2026-06-01 22:07:18,696] Trial 255 finished with value: 0.2269871218506016 and parameters: {'alpha': 49010.24163370753, 'n_pcs': 4000, 'iw_method': 'pc_logistic', 'iw_clip_max': 4.0, 'iw_prob_clip': 0.017707879924768483, 'iw_n_components': 60, 'iw_logistic_c': 6.597938449039568e-06, 'iw_pca_fit': 'combined', 'iw_solver': 'lbfgs', 'iw_rho': 1.0}. Best is trial 225 with value: 0.23044692688678342.
2026-06-01 22:07:18 | INFO | Trial 256 | outer=7 | alpha=5.071e+04 n_pcs=4000 (pc_topk) weight={'name': 'pc_logistic', 'floor': 1e-06, 'clip_max': 4.0, 'prob_clip': 0.004545505795176517, 'n_components': 60, 'logistic_c': 1.6502215968471272e-05, 'pca_fit': 'combined', 'solver': 'lbfgs', 'max_iter': 2000, 'fit_intercept': True, 'standardize_with_source': True, 'rho': 1.0}
[I 2026-06-01 22:07:31,813] Trial 256 finished with value: 0.2297936916916934 and parameters: {'alpha': 50711.33012556861, 'n_pcs': 4000, 'iw_method': 'pc_logistic', 'iw_clip_max': 4.0, 'iw_prob_clip': 0.004545505795176517, 'iw_n_components': 60, 'iw_logistic_c': 1.6502215968471272e-05, 'iw_pca_fit': 'combined', 'iw_solver': 'lbfgs', 'iw_rho': 1.0}. Best is trial 225 with value: 0.23044692688678342.
2026-06-01 22:07:31 | INFO | Trial 257 | outer=7 | alpha=4.689e+04 n_pcs=4000 (pc_topk) weight={'name': 'pc_logistic', 'floor': 1e-06, 'clip_max': 4.0, 'prob_clip': 0.015510888848331702, 'n_components': 60, 'logistic_c': 9.62977593794734e-06, 'pca_fit': 'combined', 'solver': 'lbfgs', 'max_iter': 2000, 'fit_intercept': True, 'standardize_with_source': True, 'rho': 1.0}
[I 2026-06-01 22:07:44,663] Trial 257 finished with value: 0.22889180918088678 and parameters: {'alpha': 46886.78696273295, 'n_pcs': 4000, 'iw_method': 'pc_logistic', 'iw_clip_max': 4.0, 'iw_prob_clip': 0.015510888848331702, 'iw_n_components': 60, 'iw_logistic_c': 9.62977593794734e-06, 'iw_pca_fit': 'combined', 'iw_solver': 'lbfgs', 'iw_rho': 1.0}. Best is trial 225 with value: 0.23044692688678342.
2026-06-01 22:07:44 | INFO | Trial 258 | outer=7 | alpha=6.324e+04 n_pcs=4000 (pc_topk) weight={'name': 'pc_logistic', 'floor': 1e-06, 'clip_max': 4.0, 'prob_clip': 0.018283605497031823, 'n_components': 60, 'logistic_c': 1.682302400959206e-05, 'pca_fit': 'combined', 'solver': 'lbfgs', 'max_iter': 2000, 'fit_intercept': True, 'standardize_with_source': True, 'rho': 1.0}
[I 2026-06-01 22:07:57,483] Trial 258 finished with value: 0.2303607432852086 and parameters: {'alpha': 63235.12546607671, 'n_pcs': 4000, 'iw_method': 'pc_logistic', 'iw_clip_max': 4.0, 'iw_prob_clip': 0.018283605497031823, 'iw_n_components': 60, 'iw_logistic_c': 1.682302400959206e-05, 'iw_pca_fit': 'combined', 'iw_solver': 'lbfgs', 'iw_rho': 1.0}. Best is trial 225 with value: 0.23044692688678342.
2026-06-01 22:07:57 | INFO | Trial 259 | outer=7 | alpha=6.274e+04 n_pcs=4000 (pc_topk) weight={'name': 'pc_logistic', 'floor': 1e-06, 'clip_max': 4.0, 'prob_clip': 0.018215258292254528, 'n_components': 60, 'logistic_c': 1.1219085164991482e-05, 'pca_fit': 'combined', 'solver': 'lbfgs', 'max_iter': 2000, 'fit_intercept': True, 'standardize_with_source': True, 'rho': 1.0}
[I 2026-06-01 22:08:10,220] Trial 259 finished with value: 0.22919594749254965 and parameters: {'alpha': 62741.39866264224, 'n_pcs': 4000, 'iw_method': 'pc_logistic', 'iw_clip_max': 4.0, 'iw_prob_clip': 0.018215258292254528, 'iw_n_components': 60, 'iw_logistic_c': 1.1219085164991482e-05, 'iw_pca_fit': 'combined', 'iw_solver': 'lbfgs', 'iw_rho': 1.0}. Best is trial 225 with value: 0.23044692688678342.
2026-06-01 22:08:10 | INFO | Trial 260 | outer=7 | alpha=6.300e+04 n_pcs=3500 (pc_topk) weight={'name': 'pc_logistic', 'floor': 1e-06, 'clip_max': 4.0, 'prob_clip': 0.016457969525053285, 'n_components': 60, 'logistic_c': 1.6432157770282713e-05, 'pca_fit': 'combined', 'solver': 'lbfgs', 'max_iter': 2000, 'fit_intercept': True, 'standardize_with_source': True, 'rho': 0.85}
[I 2026-06-01 22:08:21,695] Trial 260 finished with value: 0.22668249181089034 and parameters: {'alpha': 63000.47789943735, 'n_pcs': 3500, 'iw_method': 'pc_logistic', 'iw_clip_max': 4.0, 'iw_prob_clip': 0.016457969525053285, 'iw_n_components': 60, 'iw_logistic_c': 1.6432157770282713e-05, 'iw_pca_fit': 'combined', 'iw_solver': 'lbfgs', 'iw_rho': 0.85}. Best is trial 225 with value: 0.23044692688678342.
2026-06-01 22:08:21 | INFO | Trial 261 | outer=7 | alpha=4.680e+04 n_pcs=4000 (pc_topk) weight={'name': 'pc_logistic', 'floor': 1e-06, 'clip_max': 4.0, 'prob_clip': 0.015530408592184169, 'n_components': 60, 'logistic_c': 8.420503585839028e-06, 'pca_fit': 'combined', 'solver': 'lbfgs', 'max_iter': 2000, 'fit_intercept': True, 'standardize_with_source': True, 'rho': 1.0}
[I 2026-06-01 22:08:34,345] Trial 261 finished with value: 0.22825356972520025 and parameters: {'alpha': 46798.85052977645, 'n_pcs': 4000, 'iw_method': 'pc_logistic', 'iw_clip_max': 4.0, 'iw_prob_clip': 0.015530408592184169, 'iw_n_components': 60, 'iw_logistic_c': 8.420503585839028e-06, 'iw_pca_fit': 'combined', 'iw_solver': 'lbfgs', 'iw_rho': 1.0}. Best is trial 225 with value: 0.23044692688678342.
2026-06-01 22:08:34 | INFO | Trial 262 | outer=7 | alpha=6.663e+04 n_pcs=4000 (pc_topk) weight={'name': 'pc_logistic', 'floor': 1e-06, 'clip_max': 4.0, 'prob_clip': 0.01859062395812613, 'n_components': 60, 'logistic_c': 1.8560460424732305e-05, 'pca_fit': 'combined', 'solver': 'lbfgs', 'max_iter': 2000, 'fit_intercept': True, 'standardize_with_source': True, 'rho': 1.0}
[I 2026-06-01 22:08:47,620] Trial 262 finished with value: 0.2304207601656826 and parameters: {'alpha': 66625.4481220473, 'n_pcs': 4000, 'iw_method': 'pc_logistic', 'iw_clip_max': 4.0, 'iw_prob_clip': 0.01859062395812613, 'iw_n_components': 60, 'iw_logistic_c': 1.8560460424732305e-05, 'iw_pca_fit': 'combined', 'iw_solver': 'lbfgs', 'iw_rho': 1.0}. Best is trial 225 with value: 0.23044692688678342.
2026-06-01 22:08:47 | INFO | Trial 263 | outer=7 | alpha=6.930e+04 n_pcs=4000 (pc_topk) weight={'name': 'pc_logistic', 'floor': 1e-06, 'clip_max': 4.0, 'prob_clip': 0.018852523458407294, 'n_components': 60, 'logistic_c': 4.740862729938183e-06, 'pca_fit': 'combined', 'solver': 'lbfgs', 'max_iter': 2000, 'fit_intercept': True, 'standardize_with_source': True, 'rho': 1.0}
[I 2026-06-01 22:09:00,661] Trial 263 finished with value: 0.22531123574301795 and parameters: {'alpha': 69296.94968303104, 'n_pcs': 4000, 'iw_method': 'pc_logistic', 'iw_clip_max': 4.0, 'iw_prob_clip': 0.018852523458407294, 'iw_n_components': 60, 'iw_logistic_c': 4.740862729938183e-06, 'iw_pca_fit': 'combined', 'iw_solver': 'lbfgs', 'iw_rho': 1.0}. Best is trial 225 with value: 0.23044692688678342.
2026-06-01 22:09:00 | INFO | Trial 264 | outer=7 | alpha=6.929e+04 n_pcs=4000 (pc_topk) weight={'name': 'pc_logistic', 'floor': 1e-06, 'clip_max': 4.0, 'prob_clip': 0.017744898795353268, 'n_components': 60, 'logistic_c': 1.8402963255279158e-05, 'pca_fit': 'combined', 'solver': 'lbfgs', 'max_iter': 2000, 'fit_intercept': True, 'standardize_with_source': True, 'rho': 1.0}
[I 2026-06-01 22:09:13,280] Trial 264 finished with value: 0.23033254809912423 and parameters: {'alpha': 69292.87107395579, 'n_pcs': 4000, 'iw_method': 'pc_logistic', 'iw_clip_max': 4.0, 'iw_prob_clip': 0.017744898795353268, 'iw_n_components': 60, 'iw_logistic_c': 1.8402963255279158e-05, 'iw_pca_fit': 'combined', 'iw_solver': 'lbfgs', 'iw_rho': 1.0}. Best is trial 225 with value: 0.23044692688678342.
2026-06-01 22:09:13 | INFO | Trial 265 | outer=7 | alpha=5.880e+04 n_pcs=4000 (pc_topk) weight={'name': 'pc_logistic', 'floor': 1e-06, 'clip_max': 4.0, 'prob_clip': 0.018210342754640608, 'n_components': 100, 'logistic_c': 1.075310609016084e-05, 'pca_fit': 'combined', 'solver': 'lbfgs', 'max_iter': 2000, 'fit_intercept': True, 'standardize_with_source': True, 'rho': 1.0}
[I 2026-06-01 22:09:26,092] Trial 265 finished with value: 0.22937199326022822 and parameters: {'alpha': 58804.32303008577, 'n_pcs': 4000, 'iw_method': 'pc_logistic', 'iw_clip_max': 4.0, 'iw_prob_clip': 0.018210342754640608, 'iw_n_components': 100, 'iw_logistic_c': 1.075310609016084e-05, 'iw_pca_fit': 'combined', 'iw_solver': 'lbfgs', 'iw_rho': 1.0}. Best is trial 225 with value: 0.23044692688678342.
2026-06-01 22:09:26 | INFO | Trial 266 | outer=7 | alpha=6.922e+04 n_pcs=4000 (pc_topk) weight={'name': 'pc_logistic', 'floor': 1e-06, 'clip_max': 1.5, 'prob_clip': 0.016894342438244503, 'n_components': 60, 'logistic_c': 1.752149448934692e-05, 'pca_fit': 'combined', 'solver': 'lbfgs', 'max_iter': 2000, 'fit_intercept': True, 'standardize_with_source': True, 'rho': 1.0}
[I 2026-06-01 22:09:38,194] Trial 266 finished with value: 0.22535941474045468 and parameters: {'alpha': 69218.13638134341, 'n_pcs': 4000, 'iw_method': 'pc_logistic', 'iw_clip_max': 1.5, 'iw_prob_clip': 0.016894342438244503, 'iw_n_components': 60, 'iw_logistic_c': 1.752149448934692e-05, 'iw_pca_fit': 'combined', 'iw_solver': 'lbfgs', 'iw_rho': 1.0}. Best is trial 225 with value: 0.23044692688678342.
2026-06-01 22:09:38 | INFO | Trial 267 | outer=7 | alpha=4.536e+04 n_pcs=4000 (pc_topk) weight={'name': 'pc_logistic', 'floor': 1e-06, 'clip_max': 4.0, 'prob_clip': 0.016137892412272446, 'n_components': 60, 'logistic_c': 7.241387306708775e-06, 'pca_fit': 'combined', 'solver': 'lbfgs', 'max_iter': 2000, 'fit_intercept': True, 'standardize_with_source': True, 'rho': 0.7}
[I 2026-06-01 22:09:50,645] Trial 267 finished with value: 0.2265947382465645 and parameters: {'alpha': 45359.75649231816, 'n_pcs': 4000, 'iw_method': 'pc_logistic', 'iw_clip_max': 4.0, 'iw_prob_clip': 0.016137892412272446, 'iw_n_components': 60, 'iw_logistic_c': 7.241387306708775e-06, 'iw_pca_fit': 'combined', 'iw_solver': 'lbfgs', 'iw_rho': 0.7}. Best is trial 225 with value: 0.23044692688678342.
2026-06-01 22:09:50 | INFO | Trial 268 | outer=7 | alpha=5.967e+04 n_pcs=3500 (pc_topk) weight={'name': 'pc_logistic', 'floor': 1e-06, 'clip_max': 4.0, 'prob_clip': 0.018769842803096095, 'n_components': 60, 'logistic_c': 1.3133276000753744e-05, 'pca_fit': 'combined', 'solver': 'lbfgs', 'max_iter': 2000, 'fit_intercept': True, 'standardize_with_source': True, 'rho': 1.0}
[I 2026-06-01 22:10:01,816] Trial 268 finished with value: 0.22628912554642278 and parameters: {'alpha': 59665.46316867436, 'n_pcs': 3500, 'iw_method': 'pc_logistic', 'iw_clip_max': 4.0, 'iw_prob_clip': 0.018769842803096095, 'iw_n_components': 60, 'iw_logistic_c': 1.3133276000753744e-05, 'iw_pca_fit': 'combined', 'iw_solver': 'lbfgs', 'iw_rho': 1.0}. Best is trial 225 with value: 0.23044692688678342.
2026-06-01 22:10:01 | INFO | Trial 269 | outer=7 | alpha=6.979e+04 n_pcs=4000 (pc_topk) weight={'name': 'pc_logistic', 'floor': 1e-06, 'clip_max': 4.0, 'prob_clip': 0.015698005063187737, 'n_components': 60, 'logistic_c': 1.9235995492860062e-05, 'pca_fit': 'combined', 'solver': 'lbfgs', 'max_iter': 2000, 'fit_intercept': True, 'standardize_with_source': True, 'rho': 1.0}
[I 2026-06-01 22:10:14,701] Trial 269 finished with value: 0.23035812782109785 and parameters: {'alpha': 69794.91614754985, 'n_pcs': 4000, 'iw_method': 'pc_logistic', 'iw_clip_max': 4.0, 'iw_prob_clip': 0.015698005063187737, 'iw_n_components': 60, 'iw_logistic_c': 1.9235995492860062e-05, 'iw_pca_fit': 'combined', 'iw_solver': 'lbfgs', 'iw_rho': 1.0}. Best is trial 225 with value: 0.23044692688678342.
2026-06-01 22:10:14 | INFO | Trial 270 | outer=7 | alpha=7.126e+04 n_pcs=4000 (pc_topk) weight={'name': 'pc_logistic', 'floor': 1e-06, 'clip_max': 4.0, 'prob_clip': 0.017208818221674353, 'n_components': 60, 'logistic_c': 1.8656085840556725e-05, 'pca_fit': 'combined', 'solver': 'lbfgs', 'max_iter': 2000, 'fit_intercept': True, 'standardize_with_source': True, 'rho': 1.0}
[I 2026-06-01 22:10:27,460] Trial 270 finished with value: 0.2303229539927582 and parameters: {'alpha': 71264.20914480874, 'n_pcs': 4000, 'iw_method': 'pc_logistic', 'iw_clip_max': 4.0, 'iw_prob_clip': 0.017208818221674353, 'iw_n_components': 60, 'iw_logistic_c': 1.8656085840556725e-05, 'iw_pca_fit': 'combined', 'iw_solver': 'lbfgs', 'iw_rho': 1.0}. Best is trial 225 with value: 0.23044692688678342.
2026-06-01 22:10:27 | INFO | Trial 271 | outer=7 | alpha=1.051e+05 n_pcs=4000 (pc_topk) weight={'name': 'uniform'}
[I 2026-06-01 22:10:34,313] Trial 271 finished with value: 0.21265673335328644 and parameters: {'alpha': 105068.40422085309, 'n_pcs': 4000, 'iw_method': 'uniform'}. Best is trial 225 with value: 0.23044692688678342.
2026-06-01 22:10:34 | INFO | Trial 272 | outer=7 | alpha=7.068e+04 n_pcs=4000 (pc_topk) weight={'name': 'pc_logistic', 'floor': 1e-06, 'clip_max': 4.0, 'prob_clip': 0.017233574140397157, 'n_components': 60, 'logistic_c': 1.0700179250761452e-05, 'pca_fit': 'combined', 'solver': 'lbfgs', 'max_iter': 2000, 'fit_intercept': True, 'standardize_with_source': True, 'rho': 1.0}
[I 2026-06-01 22:10:47,377] Trial 272 finished with value: 0.22872450908408898 and parameters: {'alpha': 70679.2396988283, 'n_pcs': 4000, 'iw_method': 'pc_logistic', 'iw_clip_max': 4.0, 'iw_prob_clip': 0.017233574140397157, 'iw_n_components': 60, 'iw_logistic_c': 1.0700179250761452e-05, 'iw_pca_fit': 'combined', 'iw_solver': 'lbfgs', 'iw_rho': 1.0}. Best is trial 225 with value: 0.23044692688678342.
2026-06-01 22:10:47 | INFO | Trial 273 | outer=7 | alpha=9.877e+04 n_pcs=4000 (pc_topk) weight={'name': 'pc_logistic', 'floor': 1e-06, 'clip_max': 2.5, 'prob_clip': 0.01854523852271801, 'n_components': 60, 'logistic_c': 1.9836886359934604e-05, 'pca_fit': 'combined', 'solver': 'lbfgs', 'max_iter': 2000, 'fit_intercept': True, 'standardize_with_source': True, 'rho': 1.0}
[I 2026-06-01 22:11:00,257] Trial 273 finished with value: 0.2284190849719845 and parameters: {'alpha': 98768.1014661005, 'n_pcs': 4000, 'iw_method': 'pc_logistic', 'iw_clip_max': 2.5, 'iw_prob_clip': 0.01854523852271801, 'iw_n_components': 60, 'iw_logistic_c': 1.9836886359934604e-05, 'iw_pca_fit': 'combined', 'iw_solver': 'lbfgs', 'iw_rho': 1.0}. Best is trial 225 with value: 0.23044692688678342.
2026-06-01 22:11:00 | INFO | Trial 274 | outer=7 | alpha=6.637e+04 n_pcs=4000 (pc_topk) weight={'name': 'pc_logistic', 'floor': 1e-06, 'clip_max': 4.0, 'prob_clip': 0.016189121287958567, 'n_components': 60, 'logistic_c': 2.0812227769938866e-05, 'pca_fit': 'combined', 'solver': 'lbfgs', 'max_iter': 2000, 'fit_intercept': True, 'standardize_with_source': True, 'rho': 1.0}
[I 2026-06-01 22:11:13,585] Trial 274 finished with value: 0.23047554958401956 and parameters: {'alpha': 66374.91330385604, 'n_pcs': 4000, 'iw_method': 'pc_logistic', 'iw_clip_max': 4.0, 'iw_prob_clip': 0.016189121287958567, 'iw_n_components': 60, 'iw_logistic_c': 2.0812227769938866e-05, 'iw_pca_fit': 'combined', 'iw_solver': 'lbfgs', 'iw_rho': 1.0}. Best is trial 274 with value: 0.23047554958401956.
2026-06-01 22:11:13 | INFO | Trial 275 | outer=7 | alpha=7.140e+04 n_pcs=4000 (pc_topk) weight={'name': 'pc_logistic', 'floor': 1e-06, 'clip_max': 4.0, 'prob_clip': 0.017196915728145964, 'n_components': 60, 'logistic_c': 1.1776440386040155e-05, 'pca_fit': 'combined', 'solver': 'lbfgs', 'max_iter': 2000, 'fit_intercept': True, 'standardize_with_source': True, 'rho': 1.0}
[I 2026-06-01 22:11:26,661] Trial 275 finished with value: 0.22897538275690427 and parameters: {'alpha': 71400.6996000133, 'n_pcs': 4000, 'iw_method': 'pc_logistic', 'iw_clip_max': 4.0, 'iw_prob_clip': 0.017196915728145964, 'iw_n_components': 60, 'iw_logistic_c': 1.1776440386040155e-05, 'iw_pca_fit': 'combined', 'iw_solver': 'lbfgs', 'iw_rho': 1.0}. Best is trial 274 with value: 0.23047554958401956.
2026-06-01 22:11:26 | INFO | Trial 276 | outer=7 | alpha=7.042e+04 n_pcs=4000 (pc_topk) weight={'name': 'pc_logistic', 'floor': 1e-06, 'clip_max': 4.0, 'prob_clip': 0.019641938167716005, 'n_components': 60, 'logistic_c': 2.198793509155266e-05, 'pca_fit': 'combined', 'solver': 'lbfgs', 'max_iter': 2000, 'fit_intercept': True, 'standardize_with_source': True, 'rho': 1.0}
[I 2026-06-01 22:11:38,888] Trial 276 finished with value: 0.23067241221891616 and parameters: {'alpha': 70416.38332517771, 'n_pcs': 4000, 'iw_method': 'pc_logistic', 'iw_clip_max': 4.0, 'iw_prob_clip': 0.019641938167716005, 'iw_n_components': 60, 'iw_logistic_c': 2.198793509155266e-05, 'iw_pca_fit': 'combined', 'iw_solver': 'lbfgs', 'iw_rho': 1.0}. Best is trial 276 with value: 0.23067241221891616.
2026-06-01 22:11:38 | INFO | Trial 277 | outer=7 | alpha=7.275e+04 n_pcs=4000 (pc_topk) weight={'name': 'pc_logistic', 'floor': 1e-06, 'clip_max': 4.0, 'prob_clip': 0.0010589721667574594, 'n_components': 60, 'logistic_c': 2.3875142156491386e-05, 'pca_fit': 'combined', 'solver': 'lbfgs', 'max_iter': 2000, 'fit_intercept': True, 'standardize_with_source': True, 'rho': 1.0}
[I 2026-06-01 22:11:51,773] Trial 277 finished with value: 0.22952567441148827 and parameters: {'alpha': 72753.05045563822, 'n_pcs': 4000, 'iw_method': 'pc_logistic', 'iw_clip_max': 4.0, 'iw_prob_clip': 0.0010589721667574594, 'iw_n_components': 60, 'iw_logistic_c': 2.3875142156491386e-05, 'iw_pca_fit': 'combined', 'iw_solver': 'lbfgs', 'iw_rho': 1.0}. Best is trial 276 with value: 0.23067241221891616.
2026-06-01 22:11:51 | INFO | Trial 278 | outer=7 | alpha=9.522e+04 n_pcs=4000 (pc_topk) weight={'name': 'pc_logistic', 'floor': 1e-06, 'clip_max': 4.0, 'prob_clip': 0.019881923029661727, 'n_components': 60, 'logistic_c': 5.953350374161247e-06, 'pca_fit': 'combined', 'solver': 'lbfgs', 'max_iter': 2000, 'fit_intercept': True, 'standardize_with_source': True, 'rho': 1.0}
[I 2026-06-01 22:12:04,282] Trial 278 finished with value: 0.2239146222287919 and parameters: {'alpha': 95219.08377775323, 'n_pcs': 4000, 'iw_method': 'pc_logistic', 'iw_clip_max': 4.0, 'iw_prob_clip': 0.019881923029661727, 'iw_n_components': 60, 'iw_logistic_c': 5.953350374161247e-06, 'iw_pca_fit': 'combined', 'iw_solver': 'lbfgs', 'iw_rho': 1.0}. Best is trial 276 with value: 0.23067241221891616.
2026-06-01 22:12:04 | INFO | Trial 279 | outer=7 | alpha=7.198e+04 n_pcs=4000 (pc_topk) weight={'name': 'pc_logistic', 'floor': 1e-06, 'clip_max': 4.0, 'prob_clip': 0.01906853214469784, 'n_components': 20, 'logistic_c': 2.1692273173061613e-05, 'pca_fit': 'combined', 'solver': 'lbfgs', 'max_iter': 2000, 'fit_intercept': True, 'standardize_with_source': True, 'rho': 1.0}
[I 2026-06-01 22:12:16,658] Trial 279 finished with value: 0.22945521599706337 and parameters: {'alpha': 71976.87211792567, 'n_pcs': 4000, 'iw_method': 'pc_logistic', 'iw_clip_max': 4.0, 'iw_prob_clip': 0.01906853214469784, 'iw_n_components': 20, 'iw_logistic_c': 2.1692273173061613e-05, 'iw_pca_fit': 'combined', 'iw_solver': 'lbfgs', 'iw_rho': 1.0}. Best is trial 276 with value: 0.23067241221891616.
2026-06-01 22:12:16 | INFO | Trial 280 | outer=7 | alpha=9.295e+04 n_pcs=3500 (pc_topk) weight={'name': 'pc_logistic', 'floor': 1e-06, 'clip_max': 4.0, 'prob_clip': 0.015897226118531494, 'n_components': 60, 'logistic_c': 8.45961549165037e-06, 'pca_fit': 'combined', 'solver': 'lbfgs', 'max_iter': 2000, 'fit_intercept': True, 'standardize_with_source': True, 'rho': 0.3}
[I 2026-06-01 22:12:28,101] Trial 280 finished with value: 0.2189222869191892 and parameters: {'alpha': 92947.82765810662, 'n_pcs': 3500, 'iw_method': 'pc_logistic', 'iw_clip_max': 4.0, 'iw_prob_clip': 0.015897226118531494, 'iw_n_components': 60, 'iw_logistic_c': 8.45961549165037e-06, 'iw_pca_fit': 'combined', 'iw_solver': 'lbfgs', 'iw_rho': 0.3}. Best is trial 276 with value: 0.23067241221891616.
2026-06-01 22:12:28 | INFO | Trial 281 | outer=7 | alpha=6.780e+04 n_pcs=4000 (pc_topk) weight={'name': 'pc_logistic', 'floor': 1e-06, 'clip_max': 4.0, 'prob_clip': 0.01674261731090839, 'n_components': 10, 'logistic_c': 1.2514731515974742e-05, 'pca_fit': 'combined', 'solver': 'lbfgs', 'max_iter': 2000, 'fit_intercept': True, 'standardize_with_source': True, 'rho': 1.0}
[I 2026-06-01 22:12:41,064] Trial 281 finished with value: 0.22747288699009854 and parameters: {'alpha': 67795.9692570356, 'n_pcs': 4000, 'iw_method': 'pc_logistic', 'iw_clip_max': 4.0, 'iw_prob_clip': 0.01674261731090839, 'iw_n_components': 10, 'iw_logistic_c': 1.2514731515974742e-05, 'iw_pca_fit': 'combined', 'iw_solver': 'lbfgs', 'iw_rho': 1.0}. Best is trial 276 with value: 0.23067241221891616.
2026-06-01 22:12:41 | INFO | Trial 282 | outer=7 | alpha=4.694e+04 n_pcs=4000 (pc_topk) weight={'name': 'pc_logistic', 'floor': 1e-06, 'clip_max': 4.0, 'prob_clip': 0.0036564251117257875, 'n_components': 60, 'logistic_c': 2.2169107942071152e-05, 'pca_fit': 'combined', 'solver': 'lbfgs', 'max_iter': 2000, 'fit_intercept': True, 'standardize_with_source': True, 'rho': 1.0}
[I 2026-06-01 22:12:53,337] Trial 282 finished with value: 0.2292225241565164 and parameters: {'alpha': 46942.135932040896, 'n_pcs': 4000, 'iw_method': 'pc_logistic', 'iw_clip_max': 4.0, 'iw_prob_clip': 0.0036564251117257875, 'iw_n_components': 60, 'iw_logistic_c': 2.2169107942071152e-05, 'iw_pca_fit': 'combined', 'iw_solver': 'lbfgs', 'iw_rho': 1.0}. Best is trial 276 with value: 0.23067241221891616.
2026-06-01 22:12:53 | INFO | Trial 283 | outer=7 | alpha=6.281e+04 n_pcs=4000 (pc_topk) weight={'name': 'pc_logistic', 'floor': 1e-06, 'clip_max': 4.0, 'prob_clip': 0.019402133699338346, 'n_components': 80, 'logistic_c': 1.3024576339645995e-05, 'pca_fit': 'combined', 'solver': 'lbfgs', 'max_iter': 2000, 'fit_intercept': True, 'standardize_with_source': True, 'rho': 1.0}
