[I 2026-05-31 23:33:50,274] Trial 293 finished with value: 0.24872132128797725 and parameters: {'alpha': 529075.4808885019, 'n_pcs': 4000, 'weight_scheme': 'exponential', 'weight_clip_max': 3.0, 'weight_exponential_beta': 8.506519614768536}. Best is trial 214 with value: 0.2498688542015699.
2026-05-31 23:33:50 | INFO | src.nested_cv_avggrm_weighted_unified | Trial 294 | outer=2 | alpha=3.102e+05 n_pcs=4000 (pc_topk) weight_search=on
2026-05-31 23:33:50 | INFO | src.nested_cv_avggrm_weighted_unified | Trial 294 | outer=2 | weight={'name': 'exponential', 'floor': 1e-06, 'clip_max': 3.0, 'beta': 8.736593923733787}
[I 2026-05-31 23:33:56,020] Trial 294 finished with value: 0.24984967944372077 and parameters: {'alpha': 310188.8165460309, 'n_pcs': 4000, 'weight_scheme': 'exponential', 'weight_clip_max': 3.0, 'weight_exponential_beta': 8.736593923733787}. Best is trial 214 with value: 0.2498688542015699.
2026-05-31 23:33:56 | INFO | src.nested_cv_avggrm_weighted_unified | Trial 295 | outer=2 | alpha=4.168e+05 n_pcs=4000 (pc_topk) weight_search=on
2026-05-31 23:33:56 | INFO | src.nested_cv_avggrm_weighted_unified | Trial 295 | outer=2 | weight={'name': 'exponential', 'floor': 1e-06, 'clip_max': 3.0, 'beta': 4.801954289450073}
2026-05-31 23:34:00 | INFO | src.nested_cv_avggrm_weighted_unified | Trial 295 | outer=2 | pruned after 7/10 inner folds (mean r=0.2806)
[I 2026-05-31 23:34:00,042] Trial 295 pruned. 
2026-05-31 23:34:00 | INFO | src.nested_cv_avggrm_weighted_unified | Trial 296 | outer=2 | alpha=3.126e+05 n_pcs=4000 (pc_topk) weight_search=on
2026-05-31 23:34:00 | INFO | src.nested_cv_avggrm_weighted_unified | Trial 296 | outer=2 | weight={'name': 'exponential', 'floor': 1e-06, 'clip_max': 3.0, 'beta': 8.695672959004705}
[I 2026-05-31 23:34:05,791] Trial 296 finished with value: 0.2498386825172146 and parameters: {'alpha': 312573.2826229271, 'n_pcs': 4000, 'weight_scheme': 'exponential', 'weight_clip_max': 3.0, 'weight_exponential_beta': 8.695672959004705}. Best is trial 214 with value: 0.2498688542015699.
2026-05-31 23:34:05 | INFO | src.nested_cv_avggrm_weighted_unified | Trial 297 | outer=2 | alpha=2.670e+05 n_pcs=3500 (pc_topk) weight_search=on
2026-05-31 23:34:05 | INFO | src.nested_cv_avggrm_weighted_unified | Trial 297 | outer=2 | weight={'name': 'exponential', 'floor': 1e-06, 'clip_max': 3.0, 'beta': 8.36525472908548}
[I 2026-05-31 23:34:10,679] Trial 297 finished with value: 0.24876740877639342 and parameters: {'alpha': 266965.37944585324, 'n_pcs': 3500, 'weight_scheme': 'exponential', 'weight_clip_max': 3.0, 'weight_exponential_beta': 8.36525472908548}. Best is trial 214 with value: 0.2498688542015699.
2026-05-31 23:34:10 | INFO | src.nested_cv_avggrm_weighted_unified | Trial 298 | outer=2 | alpha=2.278e+05 n_pcs=4000 (pc_topk) weight_search=on
2026-05-31 23:34:10 | INFO | src.nested_cv_avggrm_weighted_unified | Trial 298 | outer=2 | weight={'name': 'uniform', 'floor': 1e-06, 'clip_max': 3.0}
2026-05-31 23:34:13 | INFO | src.nested_cv_avggrm_weighted_unified | Trial 298 | outer=2 | pruned after 6/10 inner folds (mean r=0.2361)
[I 2026-05-31 23:34:13,624] Trial 298 pruned. 
2026-05-31 23:34:13 | INFO | src.nested_cv_avggrm_weighted_unified | Trial 299 | outer=2 | alpha=1.595e+05 n_pcs=3500 (pc_topk) weight_search=on
2026-05-31 23:34:13 | INFO | src.nested_cv_avggrm_weighted_unified | Trial 299 | outer=2 | weight={'name': 'exponential', 'floor': 1e-06, 'clip_max': 20.0, 'beta': 8.706972266577088}
2026-05-31 23:34:16 | INFO | src.nested_cv_avggrm_weighted_unified | Trial 299 | outer=2 | pruned after 6/10 inner folds (mean r=0.2309)
[I 2026-05-31 23:34:16,577] Trial 299 pruned. 
2026-05-31 23:34:16 | INFO | src.nested_cv_avggrm_weighted_unified | OUTER 2 best (inner mean r=0.2499): {'model_type': 'pc_ridge', 'alpha': 309905.94186257705, 'n_pcs': 4000, 'use_snp_selection': True, 'num_snps': 4000, 'feature_mode': 'pc_topk', 'weighting': {'name': 'exponential', 'floor': 1e-06, 'clip_max': 3.0, 'beta': 8.844734399290092}}
2026-05-31 23:34:17 | INFO | src.nested_cv_avggrm_weighted_unified | OUTER 2 TEST r = 0.2209
2026-05-31 23:34:17 | INFO | src.nested_cv_avggrm_weighted_unified | OUTER 2 incremental summary saved to outputs/final_results/e6_pc_ridge_avggrm/thr_wing/e6_pc_ridge_avggrm_thr_wing_results.json
2026-05-31 23:34:17 | INFO | src.nested_cv_avggrm_weighted_unified | OUTER 3: test_size=286 island=2 (Træna)
2026-05-31 23:34:17 | INFO | src.nested_cv_avggrm_weighted_unified | OUTER 3: inner LOIO validation islands: 0(Nesøy), 1(Myken), 3(Selvær), 4(Gjerøy), 5(Hestmannøy), 6(Indre Kvarøy), 7(Onøy og Lurøy), 8(Lovund), 9(Sleneset), 10(Aldra), 11(Leka), 12(Vega), 13(Vikna), 14(Lauvøya)
2026-05-31 23:34:17 | INFO | src.nested_cv_avggrm_weighted_unified | OUTER 3: using top 10 related inner validation islands for tuning: 3(Selvær, avgGRM=0.0194), 1(Myken, avgGRM=0.0152), 8(Lovund, avgGRM=0.0119), 9(Sleneset, avgGRM=0.0084), 0(Nesøy, avgGRM=0.0030), 7(Onøy og Lurøy, avgGRM=0.0024), 6(Indre Kvarøy, avgGRM=0.0015), 5(Hestmannøy, avgGRM=-0.0005), 4(Gjerøy, avgGRM=-0.0020), 12(Vega, avgGRM=-0.0032)
[I 2026-05-31 23:34:17,219] A new study created in memory with name: ridge_inner_outer2
2026-05-31 23:34:17 | INFO | src.nested_cv_avggrm_weighted_unified | Trial 0 | outer=3 | alpha=1.137e+05 n_pcs=4000 (pc_topk) weight_search=on
2026-05-31 23:34:17 | INFO | src.nested_cv_avggrm_weighted_unified | Trial 0 | outer=3 | weight={'name': 'uniform', 'floor': 1e-06, 'clip_max': None}
[I 2026-05-31 23:34:22,622] Trial 0 finished with value: 0.1995144986677984 and parameters: {'alpha': 113703.38004442609, 'n_pcs': 4000, 'weight_scheme': 'uniform', 'weight_clip_max': None}. Best is trial 0 with value: 0.1995144986677984.
2026-05-31 23:34:22 | INFO | src.nested_cv_avggrm_weighted_unified | OUTER 3 | new best trial 0 (mean inner r=0.1995) saved to outputs/final_results/e6_pc_ridge_avggrm/thr_wing/e6_pc_ridge_avggrm_thr_wing_best_trials/split_03_best_trial.json
2026-05-31 23:34:22 | INFO | src.nested_cv_avggrm_weighted_unified | Trial 1 | outer=3 | alpha=1.682e+06 n_pcs=2000 (pc_topk) weight_search=on
2026-05-31 23:34:22 | INFO | src.nested_cv_avggrm_weighted_unified | Trial 1 | outer=3 | weight={'name': 'exponential', 'floor': 1e-06, 'clip_max': 3.0, 'beta': 8.711469579953913}
[I 2026-05-31 23:34:25,760] Trial 1 finished with value: 0.203974967084249 and parameters: {'alpha': 1682385.170967095, 'n_pcs': 2000, 'weight_scheme': 'exponential', 'weight_clip_max': 3.0, 'weight_exponential_beta': 8.711469579953913}. Best is trial 1 with value: 0.203974967084249.
2026-05-31 23:34:25 | INFO | src.nested_cv_avggrm_weighted_unified | OUTER 3 | new best trial 1 (mean inner r=0.2040) saved to outputs/final_results/e6_pc_ridge_avggrm/thr_wing/e6_pc_ridge_avggrm_thr_wing_best_trials/split_03_best_trial.json
2026-05-31 23:34:25 | INFO | src.nested_cv_avggrm_weighted_unified | Trial 2 | outer=3 | alpha=2.757e+03 n_pcs=2000 (pc_topk) weight_search=on
2026-05-31 23:34:25 | INFO | src.nested_cv_avggrm_weighted_unified | Trial 2 | outer=3 | weight={'name': 'linear', 'floor': 1e-06, 'clip_max': 20.0, 'min_weight': 0.12918170299726892, 'max_weight': 3.9862564805616327}
[I 2026-05-31 23:34:27,926] Trial 2 finished with value: 0.1407824932078841 and parameters: {'alpha': 2757.0504493185063, 'n_pcs': 2000, 'weight_scheme': 'linear', 'weight_clip_max': 20.0, 'weight_linear_min_weight': 0.12918170299726892, 'weight_linear_max_weight': 3.9862564805616327}. Best is trial 1 with value: 0.203974967084249.
2026-05-31 23:34:27 | INFO | src.nested_cv_avggrm_weighted_unified | Trial 3 | outer=3 | alpha=1.776e+03 n_pcs=4000 (pc_topk) weight_search=on
2026-05-31 23:34:27 | INFO | src.nested_cv_avggrm_weighted_unified | Trial 3 | outer=3 | weight={'name': 'exponential', 'floor': 1e-06, 'clip_max': 10.0, 'beta': 0.563604612251006}
[I 2026-05-31 23:34:33,608] Trial 3 finished with value: 0.11390468252001555 and parameters: {'alpha': 1775.825123718637, 'n_pcs': 4000, 'weight_scheme': 'exponential', 'weight_clip_max': 10.0, 'weight_exponential_beta': 0.563604612251006}. Best is trial 1 with value: 0.203974967084249.
2026-05-31 23:34:33 | INFO | src.nested_cv_avggrm_weighted_unified | Trial 4 | outer=3 | alpha=1.835e+04 n_pcs=5000 (pc_topk) weight_search=on
2026-05-31 23:34:33 | INFO | src.nested_cv_avggrm_weighted_unified | Trial 4 | outer=3 | weight={'name': 'exponential', 'floor': 1e-06, 'clip_max': None, 'beta': 9.957095048208117}
[I 2026-05-31 23:34:41,579] Trial 4 finished with value: 0.183101488867513 and parameters: {'alpha': 18351.68801260339, 'n_pcs': 5000, 'weight_scheme': 'exponential', 'weight_clip_max': None, 'weight_exponential_beta': 9.957095048208117}. Best is trial 1 with value: 0.203974967084249.
2026-05-31 23:34:41 | INFO | src.nested_cv_avggrm_weighted_unified | Trial 5 | outer=3 | alpha=9.696e+03 n_pcs=1000 (pc_topk) weight_search=on
2026-05-31 23:34:41 | INFO | src.nested_cv_avggrm_weighted_unified | Trial 5 | outer=3 | weight={'name': 'exponential', 'floor': 1e-06, 'clip_max': 3.0, 'beta': 1.5726039441128932}
2026-05-31 23:34:42 | INFO | src.nested_cv_avggrm_weighted_unified | Trial 5 | outer=3 | pruned after 5/10 inner folds (mean r=0.1173)
[I 2026-05-31 23:34:42,249] Trial 5 pruned. 
2026-05-31 23:34:42 | INFO | src.nested_cv_avggrm_weighted_unified | Trial 6 | outer=3 | alpha=6.320e+04 n_pcs=2500 (pc_topk) weight_search=on
2026-05-31 23:34:42 | INFO | src.nested_cv_avggrm_weighted_unified | Trial 6 | outer=3 | weight={'name': 'uniform', 'floor': 1e-06, 'clip_max': 10.0}
[I 2026-05-31 23:34:44,924] Trial 6 finished with value: 0.202939617090373 and parameters: {'alpha': 63199.5851103866, 'n_pcs': 2500, 'weight_scheme': 'uniform', 'weight_clip_max': 10.0}. Best is trial 1 with value: 0.203974967084249.
2026-05-31 23:34:44 | INFO | src.nested_cv_avggrm_weighted_unified | Trial 7 | outer=3 | alpha=4.681e+04 n_pcs=2500 (pc_topk) weight_search=on
2026-05-31 23:34:44 | INFO | src.nested_cv_avggrm_weighted_unified | Trial 7 | outer=3 | weight={'name': 'linear', 'floor': 1e-06, 'clip_max': 3.0, 'min_weight': 0.13798029304672477, 'max_weight': 3.0957974174373546}
[I 2026-05-31 23:34:47,837] Trial 7 finished with value: 0.2025269459484232 and parameters: {'alpha': 46806.97703257331, 'n_pcs': 2500, 'weight_scheme': 'linear', 'weight_clip_max': 3.0, 'weight_linear_min_weight': 0.13798029304672477, 'weight_linear_max_weight': 3.0957974174373546}. Best is trial 1 with value: 0.203974967084249.
2026-05-31 23:34:47 | INFO | src.nested_cv_avggrm_weighted_unified | Trial 8 | outer=3 | alpha=5.456e+04 n_pcs=3000 (pc_topk) weight_search=on
2026-05-31 23:34:47 | INFO | src.nested_cv_avggrm_weighted_unified | Trial 8 | outer=3 | weight={'name': 'linear', 'floor': 1e-06, 'clip_max': 5.0, 'min_weight': 0.6690067570691431, 'max_weight': 4.8744640334054115}
[I 2026-05-31 23:34:51,586] Trial 8 finished with value: 0.2035025182602444 and parameters: {'alpha': 54559.68395210245, 'n_pcs': 3000, 'weight_scheme': 'linear', 'weight_clip_max': 5.0, 'weight_linear_min_weight': 0.6690067570691431, 'weight_linear_max_weight': 4.8744640334054115}. Best is trial 1 with value: 0.203974967084249.
2026-05-31 23:34:51 | INFO | src.nested_cv_avggrm_weighted_unified | Trial 9 | outer=3 | alpha=8.868e+03 n_pcs=2000 (pc_topk) weight_search=on
2026-05-31 23:34:51 | INFO | src.nested_cv_avggrm_weighted_unified | Trial 9 | outer=3 | weight={'name': 'linear', 'floor': 1e-06, 'clip_max': 20.0, 'min_weight': 0.861124149305412, 'max_weight': 4.702809729786679}
2026-05-31 23:34:52 | INFO | src.nested_cv_avggrm_weighted_unified | Trial 9 | outer=3 | pruned after 5/10 inner folds (mean r=0.1410)
[I 2026-05-31 23:34:52,688] Trial 9 pruned. 
2026-05-31 23:34:52 | INFO | src.nested_cv_avggrm_weighted_unified | Trial 10 | outer=3 | alpha=3.342e+06 n_pcs=500 (pc_topk) weight_search=on
2026-05-31 23:34:52 | INFO | src.nested_cv_avggrm_weighted_unified | Trial 10 | outer=3 | weight={'name': 'exponential', 'floor': 1e-06, 'clip_max': 3.0, 'beta': 8.988150276350877}
2026-05-31 23:34:53 | INFO | src.nested_cv_avggrm_weighted_unified | Trial 10 | outer=3 | pruned after 5/10 inner folds (mean r=0.1549)
[I 2026-05-31 23:34:53,147] Trial 10 pruned. 
2026-05-31 23:34:53 | INFO | src.nested_cv_avggrm_weighted_unified | Trial 11 | outer=3 | alpha=1.325e+06 n_pcs=3500 (pc_topk) weight_search=on
2026-05-31 23:34:53 | INFO | src.nested_cv_avggrm_weighted_unified | Trial 11 | outer=3 | weight={'name': 'linear', 'floor': 1e-06, 'clip_max': 5.0, 'min_weight': 0.7213129440546091, 'max_weight': 1.427793907186323}
2026-05-31 23:34:56 | INFO | src.nested_cv_avggrm_weighted_unified | Trial 11 | outer=3 | pruned after 6/10 inner folds (mean r=0.2108)
[I 2026-05-31 23:34:56,532] Trial 11 pruned. 
2026-05-31 23:34:56 | INFO | src.nested_cv_avggrm_weighted_unified | Trial 12 | outer=3 | alpha=4.498e+05 n_pcs=1500 (pc_topk) weight_search=on
2026-05-31 23:34:56 | INFO | src.nested_cv_avggrm_weighted_unified | Trial 12 | outer=3 | weight={'name': 'exponential', 'floor': 1e-06, 'clip_max': 5.0, 'beta': 5.982934772883383}
[I 2026-05-31 23:34:58,247] Trial 12 finished with value: 0.20225924716685148 and parameters: {'alpha': 449804.39949452895, 'n_pcs': 1500, 'weight_scheme': 'exponential', 'weight_clip_max': 5.0, 'weight_exponential_beta': 5.982934772883383}. Best is trial 1 with value: 0.203974967084249.
2026-05-31 23:34:58 | INFO | src.nested_cv_avggrm_weighted_unified | Trial 13 | outer=3 | alpha=3.604e+05 n_pcs=3000 (pc_topk) weight_search=on
2026-05-31 23:34:58 | INFO | src.nested_cv_avggrm_weighted_unified | Trial 13 | outer=3 | weight={'name': 'linear', 'floor': 1e-06, 'clip_max': 5.0, 'min_weight': 0.44725940969778444, 'max_weight': 1.689579879242048}
[I 2026-05-31 23:35:02,036] Trial 13 finished with value: 0.20234368010387996 and parameters: {'alpha': 360423.6471579658, 'n_pcs': 3000, 'weight_scheme': 'linear', 'weight_clip_max': 5.0, 'weight_linear_min_weight': 0.44725940969778444, 'weight_linear_max_weight': 1.689579879242048}. Best is trial 1 with value: 0.203974967084249.
2026-05-31 23:35:02 | INFO | src.nested_cv_avggrm_weighted_unified | Trial 14 | outer=3 | alpha=6.828e+06 n_pcs=3000 (pc_topk) weight_search=on
2026-05-31 23:35:02 | INFO | src.nested_cv_avggrm_weighted_unified | Trial 14 | outer=3 | weight={'name': 'uniform', 'floor': 1e-06, 'clip_max': 5.0}
2026-05-31 23:35:03 | INFO | src.nested_cv_avggrm_weighted_unified | Trial 14 | outer=3 | pruned after 5/10 inner folds (mean r=0.1603)
[I 2026-05-31 23:35:03,573] Trial 14 pruned. 
2026-05-31 23:35:03 | INFO | src.nested_cv_avggrm_weighted_unified | Trial 15 | outer=3 | alpha=2.761e+05 n_pcs=1500 (pc_topk) weight_search=on
2026-05-31 23:35:03 | INFO | src.nested_cv_avggrm_weighted_unified | Trial 15 | outer=3 | weight={'name': 'exponential', 'floor': 1e-06, 'clip_max': 3.0, 'beta': 6.449679594041562}
2026-05-31 23:35:04 | INFO | src.nested_cv_avggrm_weighted_unified | Trial 15 | outer=3 | pruned after 6/10 inner folds (mean r=0.2098)
[I 2026-05-31 23:35:04,599] Trial 15 pruned. 
2026-05-31 23:35:04 | INFO | src.nested_cv_avggrm_weighted_unified | Trial 16 | outer=3 | alpha=1.321e+06 n_pcs=5000 (pc_topk) weight_search=on
2026-05-31 23:35:04 | INFO | src.nested_cv_avggrm_weighted_unified | Trial 16 | outer=3 | weight={'name': 'linear', 'floor': 1e-06, 'clip_max': 3.0, 'min_weight': 0.5246335730022055, 'max_weight': 4.960176752701122}
[I 2026-05-31 23:35:12,584] Trial 16 finished with value: 0.1972963215749895 and parameters: {'alpha': 1321388.9291990488, 'n_pcs': 5000, 'weight_scheme': 'linear', 'weight_clip_max': 3.0, 'weight_linear_min_weight': 0.5246335730022055, 'weight_linear_max_weight': 4.960176752701122}. Best is trial 1 with value: 0.203974967084249.
2026-05-31 23:35:12 | INFO | src.nested_cv_avggrm_weighted_unified | Trial 17 | outer=3 | alpha=1.035e+06 n_pcs=3500 (pc_topk) weight_search=on
2026-05-31 23:35:12 | INFO | src.nested_cv_avggrm_weighted_unified | Trial 17 | outer=3 | weight={'name': 'exponential', 'floor': 1e-06, 'clip_max': 5.0, 'beta': 3.227872998170781}
[I 2026-05-31 23:35:17,386] Trial 17 finished with value: 0.2018167457957299 and parameters: {'alpha': 1034769.3176271357, 'n_pcs': 3500, 'weight_scheme': 'exponential', 'weight_clip_max': 5.0, 'weight_exponential_beta': 3.227872998170781}. Best is trial 1 with value: 0.203974967084249.
2026-05-31 23:35:17 | INFO | src.nested_cv_avggrm_weighted_unified | Trial 18 | outer=3 | alpha=1.210e+05 n_pcs=2000 (pc_topk) weight_search=on
2026-05-31 23:35:17 | INFO | src.nested_cv_avggrm_weighted_unified | Trial 18 | outer=3 | weight={'name': 'linear', 'floor': 1e-06, 'clip_max': 10.0, 'min_weight': 0.9516818922781437, 'max_weight': 3.017045951297736}
[I 2026-05-31 23:35:19,572] Trial 18 finished with value: 0.20714176623289293 and parameters: {'alpha': 121031.68315485948, 'n_pcs': 2000, 'weight_scheme': 'linear', 'weight_clip_max': 10.0, 'weight_linear_min_weight': 0.9516818922781437, 'weight_linear_max_weight': 3.017045951297736}. Best is trial 18 with value: 0.20714176623289293.
2026-05-31 23:35:19 | INFO | src.nested_cv_avggrm_weighted_unified | OUTER 3 | new best trial 18 (mean inner r=0.2071) saved to outputs/final_results/e6_pc_ridge_avggrm/thr_wing/e6_pc_ridge_avggrm_thr_wing_best_trials/split_03_best_trial.json
2026-05-31 23:35:19 | INFO | src.nested_cv_avggrm_weighted_unified | Trial 19 | outer=3 | alpha=7.205e+06 n_pcs=1000 (pc_topk) weight_search=on
2026-05-31 23:35:19 | INFO | src.nested_cv_avggrm_weighted_unified | Trial 19 | outer=3 | weight={'name': 'uniform', 'floor': 1e-06, 'clip_max': 10.0}
2026-05-31 23:35:20 | INFO | src.nested_cv_avggrm_weighted_unified | Trial 19 | outer=3 | pruned after 5/10 inner folds (mean r=0.1526)
[I 2026-05-31 23:35:20,327] Trial 19 pruned. 
2026-05-31 23:35:20 | INFO | src.nested_cv_avggrm_weighted_unified | Trial 20 | outer=3 | alpha=3.191e+06 n_pcs=2000 (pc_topk) weight_search=on
2026-05-31 23:35:20 | INFO | src.nested_cv_avggrm_weighted_unified | Trial 20 | outer=3 | weight={'name': 'exponential', 'floor': 1e-06, 'clip_max': 10.0, 'beta': 7.528848252009955}
2026-05-31 23:35:22 | INFO | src.nested_cv_avggrm_weighted_unified | Trial 20 | outer=3 | pruned after 7/10 inner folds (mean r=0.2376)
[I 2026-05-31 23:35:22,567] Trial 20 pruned. 
2026-05-31 23:35:22 | INFO | src.nested_cv_avggrm_weighted_unified | Trial 21 | outer=3 | alpha=3.194e+04 n_pcs=2500 (pc_topk) weight_search=on
2026-05-31 23:35:22 | INFO | src.nested_cv_avggrm_weighted_unified | Trial 21 | outer=3 | weight={'name': 'linear', 'floor': 1e-06, 'clip_max': 10.0, 'min_weight': 0.9999784123328306, 'max_weight': 2.839899402752387}
2026-05-31 23:35:24 | INFO | src.nested_cv_avggrm_weighted_unified | Trial 21 | outer=3 | pruned after 7/10 inner folds (mean r=0.2267)
[I 2026-05-31 23:35:24,616] Trial 21 pruned. 
2026-05-31 23:35:24 | INFO | src.nested_cv_avggrm_weighted_unified | Trial 22 | outer=3 | alpha=1.307e+05 n_pcs=1500 (pc_topk) weight_search=on
2026-05-31 23:35:24 | INFO | src.nested_cv_avggrm_weighted_unified | Trial 22 | outer=3 | weight={'name': 'linear', 'floor': 1e-06, 'clip_max': None, 'min_weight': 0.7285863737969436, 'max_weight': 3.3061638244747766}
2026-05-31 23:35:25 | INFO | src.nested_cv_avggrm_weighted_unified | Trial 22 | outer=3 | pruned after 6/10 inner folds (mean r=0.2032)
[I 2026-05-31 23:35:25,635] Trial 22 pruned. 
2026-05-31 23:35:25 | INFO | src.nested_cv_avggrm_weighted_unified | Trial 23 | outer=3 | alpha=1.503e+05 n_pcs=3500 (pc_topk) weight_search=on
2026-05-31 23:35:25 | INFO | src.nested_cv_avggrm_weighted_unified | Trial 23 | outer=3 | weight={'name': 'linear', 'floor': 1e-06, 'clip_max': 20.0, 'min_weight': 0.9899524254174993, 'max_weight': 2.178608524644927}
[I 2026-05-31 23:35:30,424] Trial 23 finished with value: 0.20299222081852414 and parameters: {'alpha': 150285.16939834302, 'n_pcs': 3500, 'weight_scheme': 'linear', 'weight_clip_max': 20.0, 'weight_linear_min_weight': 0.9899524254174993, 'weight_linear_max_weight': 2.178608524644927}. Best is trial 18 with value: 0.20714176623289293.
2026-05-31 23:35:30 | INFO | src.nested_cv_avggrm_weighted_unified | Trial 24 | outer=3 | alpha=2.149e+04 n_pcs=2000 (pc_topk) weight_search=on
2026-05-31 23:35:30 | INFO | src.nested_cv_avggrm_weighted_unified | Trial 24 | outer=3 | weight={'name': 'linear', 'floor': 1e-06, 'clip_max': 5.0, 'min_weight': 0.6956431587571678, 'max_weight': 4.193108330079829}
2026-05-31 23:35:31 | INFO | src.nested_cv_avggrm_weighted_unified | Trial 24 | outer=3 | pruned after 6/10 inner folds (mean r=0.1804)
[I 2026-05-31 23:35:31,748] Trial 24 pruned. 
2026-05-31 23:35:31 | INFO | src.nested_cv_avggrm_weighted_unified | Trial 25 | outer=3 | alpha=6.502e+05 n_pcs=3000 (pc_topk) weight_search=on
2026-05-31 23:35:31 | INFO | src.nested_cv_avggrm_weighted_unified | Trial 25 | outer=3 | weight={'name': 'linear', 'floor': 1e-06, 'clip_max': 10.0, 'min_weight': 0.3918588386198997, 'max_weight': 3.6269636803213023}
[I 2026-05-31 23:35:35,521] Trial 25 finished with value: 0.20193237398908245 and parameters: {'alpha': 650212.3558151559, 'n_pcs': 3000, 'weight_scheme': 'linear', 'weight_clip_max': 10.0, 'weight_linear_min_weight': 0.3918588386198997, 'weight_linear_max_weight': 3.6269636803213023}. Best is trial 18 with value: 0.20714176623289293.
2026-05-31 23:35:35 | INFO | src.nested_cv_avggrm_weighted_unified | Trial 26 | outer=3 | alpha=6.503e+03 n_pcs=1000 (pc_topk) weight_search=on
2026-05-31 23:35:35 | INFO | src.nested_cv_avggrm_weighted_unified | Trial 26 | outer=3 | weight={'name': 'linear', 'floor': 1e-06, 'clip_max': 3.0, 'min_weight': 0.8365394635112315, 'max_weight': 4.350339807772916}
2026-05-31 23:35:36 | INFO | src.nested_cv_avggrm_weighted_unified | Trial 26 | outer=3 | pruned after 5/10 inner folds (mean r=0.1058)
