[I 2026-05-31 23:40:45,838] Trial 97 finished with value: 0.20708861775787152 and parameters: {'alpha': 284129.95333911385, 'n_pcs': 2500, 'weight_scheme': 'linear', 'weight_clip_max': 3.0, 'weight_linear_min_weight': 0.08960232764971778, 'weight_linear_max_weight': 4.6739272050788445}. Best is trial 96 with value: 0.20758995590173432.
2026-05-31 23:40:45 | INFO | src.nested_cv_avggrm_weighted_unified | Trial 98 | outer=3 | alpha=7.044e+05 n_pcs=2500 (pc_topk) weight_search=on
2026-05-31 23:40:45 | INFO | src.nested_cv_avggrm_weighted_unified | Trial 98 | outer=3 | weight={'name': 'linear', 'floor': 1e-06, 'clip_max': 3.0, 'min_weight': 0.0912960527783574, 'max_weight': 4.7185736313545235}
2026-05-31 23:40:47 | INFO | src.nested_cv_avggrm_weighted_unified | Trial 98 | outer=3 | pruned after 7/10 inner folds (mean r=0.2473)
[I 2026-05-31 23:40:47,902] Trial 98 pruned. 
2026-05-31 23:40:47 | INFO | src.nested_cv_avggrm_weighted_unified | Trial 99 | outer=3 | alpha=5.602e+05 n_pcs=2500 (pc_topk) weight_search=on
2026-05-31 23:40:47 | INFO | src.nested_cv_avggrm_weighted_unified | Trial 99 | outer=3 | weight={'name': 'linear', 'floor': 1e-06, 'clip_max': 3.0, 'min_weight': 0.09914372945800079, 'max_weight': 4.494646904131878}
[I 2026-05-31 23:40:50,837] Trial 99 finished with value: 0.204621929173359 and parameters: {'alpha': 560174.1420704371, 'n_pcs': 2500, 'weight_scheme': 'linear', 'weight_clip_max': 3.0, 'weight_linear_min_weight': 0.09914372945800079, 'weight_linear_max_weight': 4.494646904131878}. Best is trial 96 with value: 0.20758995590173432.
2026-05-31 23:40:50 | INFO | src.nested_cv_avggrm_weighted_unified | Trial 100 | outer=3 | alpha=2.805e+05 n_pcs=2500 (pc_topk) weight_search=on
2026-05-31 23:40:50 | INFO | src.nested_cv_avggrm_weighted_unified | Trial 100 | outer=3 | weight={'name': 'exponential', 'floor': 1e-06, 'clip_max': 3.0, 'beta': 2.0782500645906956}
[I 2026-05-31 23:40:53,755] Trial 100 finished with value: 0.206549683161124 and parameters: {'alpha': 280505.1031119052, 'n_pcs': 2500, 'weight_scheme': 'exponential', 'weight_clip_max': 3.0, 'weight_exponential_beta': 2.0782500645906956}. Best is trial 96 with value: 0.20758995590173432.
2026-05-31 23:40:53 | INFO | src.nested_cv_avggrm_weighted_unified | Trial 101 | outer=3 | alpha=2.964e+05 n_pcs=2500 (pc_topk) weight_search=on
2026-05-31 23:40:53 | INFO | src.nested_cv_avggrm_weighted_unified | Trial 101 | outer=3 | weight={'name': 'exponential', 'floor': 1e-06, 'clip_max': 3.0, 'beta': 1.9499337707431597}
[I 2026-05-31 23:40:56,680] Trial 101 finished with value: 0.2058579925285533 and parameters: {'alpha': 296447.568485637, 'n_pcs': 2500, 'weight_scheme': 'exponential', 'weight_clip_max': 3.0, 'weight_exponential_beta': 1.9499337707431597}. Best is trial 96 with value: 0.20758995590173432.
2026-05-31 23:40:56 | INFO | src.nested_cv_avggrm_weighted_unified | Trial 102 | outer=3 | alpha=2.427e+05 n_pcs=3000 (pc_topk) weight_search=on
2026-05-31 23:40:56 | INFO | src.nested_cv_avggrm_weighted_unified | Trial 102 | outer=3 | weight={'name': 'exponential', 'floor': 1e-06, 'clip_max': 3.0, 'beta': 4.430981319479063}
[I 2026-05-31 23:41:00,432] Trial 102 finished with value: 0.20781331535620903 and parameters: {'alpha': 242657.71899762284, 'n_pcs': 3000, 'weight_scheme': 'exponential', 'weight_clip_max': 3.0, 'weight_exponential_beta': 4.430981319479063}. Best is trial 102 with value: 0.20781331535620903.
2026-05-31 23:41:00 | INFO | src.nested_cv_avggrm_weighted_unified | OUTER 3 | new best trial 102 (mean inner r=0.2078) saved to outputs/final_results/e6_pc_ridge_avggrm/thr_wing/e6_pc_ridge_avggrm_thr_wing_best_trials/split_03_best_trial.json
2026-05-31 23:41:00 | INFO | src.nested_cv_avggrm_weighted_unified | Trial 103 | outer=3 | alpha=9.946e+06 n_pcs=2000 (pc_topk) weight_search=on
2026-05-31 23:41:00 | INFO | src.nested_cv_avggrm_weighted_unified | Trial 103 | outer=3 | weight={'name': 'exponential', 'floor': 1e-06, 'clip_max': 3.0, 'beta': 4.7033596180743125}
2026-05-31 23:41:01 | INFO | src.nested_cv_avggrm_weighted_unified | Trial 103 | outer=3 | pruned after 6/10 inner folds (mean r=0.2179)
[I 2026-05-31 23:41:01,910] Trial 103 pruned. 
2026-05-31 23:41:01 | INFO | src.nested_cv_avggrm_weighted_unified | Trial 104 | outer=3 | alpha=3.943e+05 n_pcs=3000 (pc_topk) weight_search=on
2026-05-31 23:41:01 | INFO | src.nested_cv_avggrm_weighted_unified | Trial 104 | outer=3 | weight={'name': 'exponential', 'floor': 1e-06, 'clip_max': 3.0, 'beta': 3.682384270017202}
[I 2026-05-31 23:41:05,734] Trial 104 finished with value: 0.20679663476058524 and parameters: {'alpha': 394332.8969893321, 'n_pcs': 3000, 'weight_scheme': 'exponential', 'weight_clip_max': 3.0, 'weight_exponential_beta': 3.682384270017202}. Best is trial 102 with value: 0.20781331535620903.
2026-05-31 23:41:05 | INFO | src.nested_cv_avggrm_weighted_unified | Trial 105 | outer=3 | alpha=8.283e+05 n_pcs=3000 (pc_topk) weight_search=on
2026-05-31 23:41:05 | INFO | src.nested_cv_avggrm_weighted_unified | Trial 105 | outer=3 | weight={'name': 'exponential', 'floor': 1e-06, 'clip_max': 3.0, 'beta': 3.714955392795968}
[I 2026-05-31 23:41:09,729] Trial 105 finished with value: 0.20387219223820555 and parameters: {'alpha': 828348.245648585, 'n_pcs': 3000, 'weight_scheme': 'exponential', 'weight_clip_max': 3.0, 'weight_exponential_beta': 3.714955392795968}. Best is trial 102 with value: 0.20781331535620903.
2026-05-31 23:41:09 | INFO | src.nested_cv_avggrm_weighted_unified | Trial 106 | outer=3 | alpha=1.455e+06 n_pcs=3000 (pc_topk) weight_search=on
2026-05-31 23:41:09 | INFO | src.nested_cv_avggrm_weighted_unified | Trial 106 | outer=3 | weight={'name': 'exponential', 'floor': 1e-06, 'clip_max': 3.0, 'beta': 2.1392505745237553}
2026-05-31 23:41:12 | INFO | src.nested_cv_avggrm_weighted_unified | Trial 106 | outer=3 | pruned after 7/10 inner folds (mean r=0.2471)
[I 2026-05-31 23:41:12,384] Trial 106 pruned. 
2026-05-31 23:41:12 | INFO | src.nested_cv_avggrm_weighted_unified | Trial 107 | outer=3 | alpha=3.839e+05 n_pcs=2500 (pc_topk) weight_search=on
2026-05-31 23:41:12 | INFO | src.nested_cv_avggrm_weighted_unified | Trial 107 | outer=3 | weight={'name': 'exponential', 'floor': 1e-06, 'clip_max': 3.0, 'beta': 5.347978566025745}
[I 2026-05-31 23:41:15,313] Trial 107 finished with value: 0.20649254990457644 and parameters: {'alpha': 383893.69002067135, 'n_pcs': 2500, 'weight_scheme': 'exponential', 'weight_clip_max': 3.0, 'weight_exponential_beta': 5.347978566025745}. Best is trial 102 with value: 0.20781331535620903.
2026-05-31 23:41:15 | INFO | src.nested_cv_avggrm_weighted_unified | Trial 108 | outer=3 | alpha=2.021e+06 n_pcs=2500 (pc_topk) weight_search=on
2026-05-31 23:41:15 | INFO | src.nested_cv_avggrm_weighted_unified | Trial 108 | outer=3 | weight={'name': 'exponential', 'floor': 1e-06, 'clip_max': 3.0, 'beta': 5.819304029497859}
2026-05-31 23:41:17 | INFO | src.nested_cv_avggrm_weighted_unified | Trial 108 | outer=3 | pruned after 7/10 inner folds (mean r=0.2449)
[I 2026-05-31 23:41:17,378] Trial 108 pruned. 
2026-05-31 23:41:17 | INFO | src.nested_cv_avggrm_weighted_unified | Trial 109 | outer=3 | alpha=3.603e+05 n_pcs=2500 (pc_topk) weight_search=on
2026-05-31 23:41:17 | INFO | src.nested_cv_avggrm_weighted_unified | Trial 109 | outer=3 | weight={'name': 'exponential', 'floor': 1e-06, 'clip_max': 3.0, 'beta': 4.337928162842998}
[I 2026-05-31 23:41:20,307] Trial 109 finished with value: 0.2071999254653873 and parameters: {'alpha': 360270.6137624672, 'n_pcs': 2500, 'weight_scheme': 'exponential', 'weight_clip_max': 3.0, 'weight_exponential_beta': 4.337928162842998}. Best is trial 102 with value: 0.20781331535620903.
2026-05-31 23:41:20 | INFO | src.nested_cv_avggrm_weighted_unified | Trial 110 | outer=3 | alpha=4.187e+05 n_pcs=2500 (pc_topk) weight_search=on
2026-05-31 23:41:20 | INFO | src.nested_cv_avggrm_weighted_unified | Trial 110 | outer=3 | weight={'name': 'exponential', 'floor': 1e-06, 'clip_max': 3.0, 'beta': 4.227105155636493}
[I 2026-05-31 23:41:23,233] Trial 110 finished with value: 0.20677430433459315 and parameters: {'alpha': 418705.96465210774, 'n_pcs': 2500, 'weight_scheme': 'exponential', 'weight_clip_max': 3.0, 'weight_exponential_beta': 4.227105155636493}. Best is trial 102 with value: 0.20781331535620903.
2026-05-31 23:41:23 | INFO | src.nested_cv_avggrm_weighted_unified | Trial 111 | outer=3 | alpha=3.688e+05 n_pcs=2500 (pc_topk) weight_search=on
2026-05-31 23:41:23 | INFO | src.nested_cv_avggrm_weighted_unified | Trial 111 | outer=3 | weight={'name': 'exponential', 'floor': 1e-06, 'clip_max': 3.0, 'beta': 4.458550153563803}
[I 2026-05-31 23:41:26,159] Trial 111 finished with value: 0.20706835309677799 and parameters: {'alpha': 368796.99163298577, 'n_pcs': 2500, 'weight_scheme': 'exponential', 'weight_clip_max': 3.0, 'weight_exponential_beta': 4.458550153563803}. Best is trial 102 with value: 0.20781331535620903.
2026-05-31 23:41:26 | INFO | src.nested_cv_avggrm_weighted_unified | Trial 112 | outer=3 | alpha=4.300e+05 n_pcs=2500 (pc_topk) weight_search=on
2026-05-31 23:41:26 | INFO | src.nested_cv_avggrm_weighted_unified | Trial 112 | outer=3 | weight={'name': 'exponential', 'floor': 1e-06, 'clip_max': 3.0, 'beta': 4.314656832209882}
[I 2026-05-31 23:41:29,086] Trial 112 finished with value: 0.20666782250666205 and parameters: {'alpha': 429994.13710375415, 'n_pcs': 2500, 'weight_scheme': 'exponential', 'weight_clip_max': 3.0, 'weight_exponential_beta': 4.314656832209882}. Best is trial 102 with value: 0.20781331535620903.
2026-05-31 23:41:29 | INFO | src.nested_cv_avggrm_weighted_unified | Trial 113 | outer=3 | alpha=4.248e+05 n_pcs=2500 (pc_topk) weight_search=on
2026-05-31 23:41:29 | INFO | src.nested_cv_avggrm_weighted_unified | Trial 113 | outer=3 | weight={'name': 'exponential', 'floor': 1e-06, 'clip_max': 3.0, 'beta': 4.395304372066669}
[I 2026-05-31 23:41:32,001] Trial 113 finished with value: 0.20666608251840554 and parameters: {'alpha': 424780.63111771416, 'n_pcs': 2500, 'weight_scheme': 'exponential', 'weight_clip_max': 3.0, 'weight_exponential_beta': 4.395304372066669}. Best is trial 102 with value: 0.20781331535620903.
2026-05-31 23:41:32 | INFO | src.nested_cv_avggrm_weighted_unified | Trial 114 | outer=3 | alpha=5.191e+05 n_pcs=2500 (pc_topk) weight_search=on
2026-05-31 23:41:32 | INFO | src.nested_cv_avggrm_weighted_unified | Trial 114 | outer=3 | weight={'name': 'exponential', 'floor': 1e-06, 'clip_max': 3.0, 'beta': 4.2718152162543355}
[I 2026-05-31 23:41:34,937] Trial 114 finished with value: 0.206018287264645 and parameters: {'alpha': 519062.91677683365, 'n_pcs': 2500, 'weight_scheme': 'exponential', 'weight_clip_max': 3.0, 'weight_exponential_beta': 4.2718152162543355}. Best is trial 102 with value: 0.20781331535620903.
2026-05-31 23:41:34 | INFO | src.nested_cv_avggrm_weighted_unified | Trial 115 | outer=3 | alpha=4.184e+05 n_pcs=3000 (pc_topk) weight_search=on
2026-05-31 23:41:34 | INFO | src.nested_cv_avggrm_weighted_unified | Trial 115 | outer=3 | weight={'name': 'exponential', 'floor': 1e-06, 'clip_max': 3.0, 'beta': 4.200360953361971}
[I 2026-05-31 23:41:38,916] Trial 115 finished with value: 0.20645468191473304 and parameters: {'alpha': 418443.3290140378, 'n_pcs': 3000, 'weight_scheme': 'exponential', 'weight_clip_max': 3.0, 'weight_exponential_beta': 4.200360953361971}. Best is trial 102 with value: 0.20781331535620903.
2026-05-31 23:41:38 | INFO | src.nested_cv_avggrm_weighted_unified | Trial 116 | outer=3 | alpha=9.566e+05 n_pcs=2500 (pc_topk) weight_search=on
2026-05-31 23:41:38 | INFO | src.nested_cv_avggrm_weighted_unified | Trial 116 | outer=3 | weight={'name': 'exponential', 'floor': 1e-06, 'clip_max': 3.0, 'beta': 3.3733977230289476}
2026-05-31 23:41:40 | INFO | src.nested_cv_avggrm_weighted_unified | Trial 116 | outer=3 | pruned after 7/10 inner folds (mean r=0.2478)
[I 2026-05-31 23:41:40,978] Trial 116 pruned. 
2026-05-31 23:41:40 | INFO | src.nested_cv_avggrm_weighted_unified | Trial 117 | outer=3 | alpha=6.344e+05 n_pcs=2500 (pc_topk) weight_search=on
2026-05-31 23:41:40 | INFO | src.nested_cv_avggrm_weighted_unified | Trial 117 | outer=3 | weight={'name': 'exponential', 'floor': 1e-06, 'clip_max': 3.0, 'beta': 4.681255527420158}
[I 2026-05-31 23:41:43,903] Trial 117 finished with value: 0.20505821908852648 and parameters: {'alpha': 634396.2822537452, 'n_pcs': 2500, 'weight_scheme': 'exponential', 'weight_clip_max': 3.0, 'weight_exponential_beta': 4.681255527420158}. Best is trial 102 with value: 0.20781331535620903.
2026-05-31 23:41:43 | INFO | src.nested_cv_avggrm_weighted_unified | Trial 118 | outer=3 | alpha=4.615e+05 n_pcs=3000 (pc_topk) weight_search=on
2026-05-31 23:41:43 | INFO | src.nested_cv_avggrm_weighted_unified | Trial 118 | outer=3 | weight={'name': 'exponential', 'floor': 1e-06, 'clip_max': 3.0, 'beta': 5.194027265515681}
[I 2026-05-31 23:41:47,678] Trial 118 finished with value: 0.20584463341062337 and parameters: {'alpha': 461544.33129790256, 'n_pcs': 3000, 'weight_scheme': 'exponential', 'weight_clip_max': 3.0, 'weight_exponential_beta': 5.194027265515681}. Best is trial 102 with value: 0.20781331535620903.
2026-05-31 23:41:47 | INFO | src.nested_cv_avggrm_weighted_unified | Trial 119 | outer=3 | alpha=3.469e+05 n_pcs=2000 (pc_topk) weight_search=on
2026-05-31 23:41:47 | INFO | src.nested_cv_avggrm_weighted_unified | Trial 119 | outer=3 | weight={'name': 'exponential', 'floor': 1e-06, 'clip_max': 3.0, 'beta': 4.129592664385052}
2026-05-31 23:41:49 | INFO | src.nested_cv_avggrm_weighted_unified | Trial 119 | outer=3 | pruned after 6/10 inner folds (mean r=0.2206)
[I 2026-05-31 23:41:49,006] Trial 119 pruned. 
2026-05-31 23:41:49 | INFO | src.nested_cv_avggrm_weighted_unified | Trial 120 | outer=3 | alpha=2.689e+05 n_pcs=2500 (pc_topk) weight_search=on
2026-05-31 23:41:49 | INFO | src.nested_cv_avggrm_weighted_unified | Trial 120 | outer=3 | weight={'name': 'exponential', 'floor': 1e-06, 'clip_max': 3.0, 'beta': 3.132639581484835}
[I 2026-05-31 23:41:51,939] Trial 120 finished with value: 0.20839733917851877 and parameters: {'alpha': 268915.65429245244, 'n_pcs': 2500, 'weight_scheme': 'exponential', 'weight_clip_max': 3.0, 'weight_exponential_beta': 3.132639581484835}. Best is trial 120 with value: 0.20839733917851877.
2026-05-31 23:41:51 | INFO | src.nested_cv_avggrm_weighted_unified | OUTER 3 | new best trial 120 (mean inner r=0.2084) saved to outputs/final_results/e6_pc_ridge_avggrm/thr_wing/e6_pc_ridge_avggrm_thr_wing_best_trials/split_03_best_trial.json
2026-05-31 23:41:51 | INFO | src.nested_cv_avggrm_weighted_unified | Trial 121 | outer=3 | alpha=2.730e+05 n_pcs=2500 (pc_topk) weight_search=on
2026-05-31 23:41:51 | INFO | src.nested_cv_avggrm_weighted_unified | Trial 121 | outer=3 | weight={'name': 'exponential', 'floor': 1e-06, 'clip_max': 3.0, 'beta': 3.025962440435925}
[I 2026-05-31 23:41:55,531] Trial 121 finished with value: 0.20828811536967057 and parameters: {'alpha': 273003.24633928336, 'n_pcs': 2500, 'weight_scheme': 'exponential', 'weight_clip_max': 3.0, 'weight_exponential_beta': 3.025962440435925}. Best is trial 120 with value: 0.20839733917851877.
2026-05-31 23:41:55 | INFO | src.nested_cv_avggrm_weighted_unified | Trial 122 | outer=3 | alpha=7.727e+05 n_pcs=2500 (pc_topk) weight_search=on
2026-05-31 23:41:55 | INFO | src.nested_cv_avggrm_weighted_unified | Trial 122 | outer=3 | weight={'name': 'exponential', 'floor': 1e-06, 'clip_max': 3.0, 'beta': 2.8598912404338885}
[I 2026-05-31 23:41:58,467] Trial 122 finished with value: 0.20446513215407736 and parameters: {'alpha': 772687.714345358, 'n_pcs': 2500, 'weight_scheme': 'exponential', 'weight_clip_max': 3.0, 'weight_exponential_beta': 2.8598912404338885}. Best is trial 120 with value: 0.20839733917851877.
2026-05-31 23:41:58 | INFO | src.nested_cv_avggrm_weighted_unified | Trial 123 | outer=3 | alpha=3.455e+05 n_pcs=2500 (pc_topk) weight_search=on
2026-05-31 23:41:58 | INFO | src.nested_cv_avggrm_weighted_unified | Trial 123 | outer=3 | weight={'name': 'exponential', 'floor': 1e-06, 'clip_max': 3.0, 'beta': 3.6962470559871523}
[I 2026-05-31 23:42:01,402] Trial 123 finished with value: 0.20757936032771812 and parameters: {'alpha': 345514.2350438171, 'n_pcs': 2500, 'weight_scheme': 'exponential', 'weight_clip_max': 3.0, 'weight_exponential_beta': 3.6962470559871523}. Best is trial 120 with value: 0.20839733917851877.
2026-05-31 23:42:01 | INFO | src.nested_cv_avggrm_weighted_unified | Trial 124 | outer=3 | alpha=3.378e+05 n_pcs=3000 (pc_topk) weight_search=on
2026-05-31 23:42:01 | INFO | src.nested_cv_avggrm_weighted_unified | Trial 124 | outer=3 | weight={'name': 'exponential', 'floor': 1e-06, 'clip_max': 3.0, 'beta': 3.524641337923759}
[I 2026-05-31 23:42:05,155] Trial 124 finished with value: 0.207329774370977 and parameters: {'alpha': 337813.54362564196, 'n_pcs': 3000, 'weight_scheme': 'exponential', 'weight_clip_max': 3.0, 'weight_exponential_beta': 3.524641337923759}. Best is trial 120 with value: 0.20839733917851877.
2026-05-31 23:42:05 | INFO | src.nested_cv_avggrm_weighted_unified | Trial 125 | outer=3 | alpha=2.520e+05 n_pcs=3000 (pc_topk) weight_search=on
2026-05-31 23:42:05 | INFO | src.nested_cv_avggrm_weighted_unified | Trial 125 | outer=3 | weight={'name': 'exponential', 'floor': 1e-06, 'clip_max': 3.0, 'beta': 3.3914223052723598}
[I 2026-05-31 23:42:09,018] Trial 125 finished with value: 0.20812695923877236 and parameters: {'alpha': 252026.43546813197, 'n_pcs': 3000, 'weight_scheme': 'exponential', 'weight_clip_max': 3.0, 'weight_exponential_beta': 3.3914223052723598}. Best is trial 120 with value: 0.20839733917851877.
2026-05-31 23:42:09 | INFO | src.nested_cv_avggrm_weighted_unified | Trial 126 | outer=3 | alpha=2.625e+05 n_pcs=3000 (pc_topk) weight_search=on
2026-05-31 23:42:09 | INFO | src.nested_cv_avggrm_weighted_unified | Trial 126 | outer=3 | weight={'name': 'exponential', 'floor': 1e-06, 'clip_max': 3.0, 'beta': 3.3526479461535343}
[I 2026-05-31 23:42:12,815] Trial 126 finished with value: 0.2080529999697615 and parameters: {'alpha': 262491.5793382773, 'n_pcs': 3000, 'weight_scheme': 'exponential', 'weight_clip_max': 3.0, 'weight_exponential_beta': 3.3526479461535343}. Best is trial 120 with value: 0.20839733917851877.
2026-05-31 23:42:12 | INFO | src.nested_cv_avggrm_weighted_unified | Trial 127 | outer=3 | alpha=2.474e+05 n_pcs=3000 (pc_topk) weight_search=on
2026-05-31 23:42:12 | INFO | src.nested_cv_avggrm_weighted_unified | Trial 127 | outer=3 | weight={'name': 'exponential', 'floor': 1e-06, 'clip_max': 10.0, 'beta': 2.7536949835096323}
2026-05-31 23:42:15 | INFO | src.nested_cv_avggrm_weighted_unified | Trial 127 | outer=3 | pruned after 7/10 inner folds (mean r=0.2476)
[I 2026-05-31 23:42:15,502] Trial 127 pruned. 
2026-05-31 23:42:15 | INFO | src.nested_cv_avggrm_weighted_unified | Trial 128 | outer=3 | alpha=1.706e+05 n_pcs=2000 (pc_topk) weight_search=on
2026-05-31 23:42:15 | INFO | src.nested_cv_avggrm_weighted_unified | Trial 128 | outer=3 | weight={'name': 'exponential', 'floor': 1e-06, 'clip_max': 3.0, 'beta': 3.245778242592384}
2026-05-31 23:42:16 | INFO | src.nested_cv_avggrm_weighted_unified | Trial 128 | outer=3 | pruned after 6/10 inner folds (mean r=0.2178)
[I 2026-05-31 23:42:16,833] Trial 128 pruned. 
2026-05-31 23:42:16 | INFO | src.nested_cv_avggrm_weighted_unified | Trial 129 | outer=3 | alpha=3.102e+05 n_pcs=3000 (pc_topk) weight_search=on
2026-05-31 23:42:16 | INFO | src.nested_cv_avggrm_weighted_unified | Trial 129 | outer=3 | weight={'name': 'exponential', 'floor': 1e-06, 'clip_max': 3.0, 'beta': 3.437931297399617}
[I 2026-05-31 23:42:20,688] Trial 129 finished with value: 0.20761030533926972 and parameters: {'alpha': 310167.3841853981, 'n_pcs': 3000, 'weight_scheme': 'exponential', 'weight_clip_max': 3.0, 'weight_exponential_beta': 3.437931297399617}. Best is trial 120 with value: 0.20839733917851877.
2026-05-31 23:42:20 | INFO | src.nested_cv_avggrm_weighted_unified | Trial 130 | outer=3 | alpha=3.289e+05 n_pcs=3000 (pc_topk) weight_search=on
2026-05-31 23:42:20 | INFO | src.nested_cv_avggrm_weighted_unified | Trial 130 | outer=3 | weight={'name': 'exponential', 'floor': 1e-06, 'clip_max': 3.0, 'beta': 3.4110992514580962}
[I 2026-05-31 23:42:24,473] Trial 130 finished with value: 0.2074476669133373 and parameters: {'alpha': 328932.74744460115, 'n_pcs': 3000, 'weight_scheme': 'exponential', 'weight_clip_max': 3.0, 'weight_exponential_beta': 3.4110992514580962}. Best is trial 120 with value: 0.20839733917851877.
2026-05-31 23:42:24 | INFO | src.nested_cv_avggrm_weighted_unified | Trial 131 | outer=3 | alpha=3.248e+05 n_pcs=3000 (pc_topk) weight_search=on
2026-05-31 23:42:24 | INFO | src.nested_cv_avggrm_weighted_unified | Trial 131 | outer=3 | weight={'name': 'exponential', 'floor': 1e-06, 'clip_max': 3.0, 'beta': 3.415172184192631}
[I 2026-05-31 23:42:28,289] Trial 131 finished with value: 0.20748428501989252 and parameters: {'alpha': 324759.1249450467, 'n_pcs': 3000, 'weight_scheme': 'exponential', 'weight_clip_max': 3.0, 'weight_exponential_beta': 3.415172184192631}. Best is trial 120 with value: 0.20839733917851877.
2026-05-31 23:42:28 | INFO | src.nested_cv_avggrm_weighted_unified | Trial 132 | outer=3 | alpha=2.880e+05 n_pcs=3000 (pc_topk) weight_search=on
2026-05-31 23:42:28 | INFO | src.nested_cv_avggrm_weighted_unified | Trial 132 | outer=3 | weight={'name': 'exponential', 'floor': 1e-06, 'clip_max': 3.0, 'beta': 3.319981773218114}
