[I 2026-06-01 02:24:12,795] Trial 58 pruned. 
2026-06-01 02:24:12 | INFO | src.nested_cv_avggrm_weighted_unified | Trial 59 | outer=10 | alpha=8.660e+04 n_pcs=5000 (pc_topk) weight_search=on
2026-06-01 02:24:12 | INFO | src.nested_cv_avggrm_weighted_unified | Trial 59 | outer=10 | weight={'name': 'uniform', 'floor': 1e-06, 'clip_max': 10.0}
2026-06-01 02:24:18 | INFO | src.nested_cv_avggrm_weighted_unified | Trial 59 | outer=10 | pruned after 8/10 inner folds (mean r=0.2533)
[I 2026-06-01 02:24:18,505] Trial 59 pruned. 
2026-06-01 02:24:18 | INFO | src.nested_cv_avggrm_weighted_unified | Trial 60 | outer=10 | alpha=6.354e+05 n_pcs=4500 (pc_topk) weight_search=on
2026-06-01 02:24:18 | INFO | src.nested_cv_avggrm_weighted_unified | Trial 60 | outer=10 | weight={'name': 'exponential', 'floor': 1e-06, 'clip_max': 20.0, 'beta': 3.369316219106202}
2026-06-01 02:24:24 | INFO | src.nested_cv_avggrm_weighted_unified | Trial 60 | outer=10 | pruned after 8/10 inner folds (mean r=0.2653)
[I 2026-06-01 02:24:24,020] Trial 60 pruned. 
2026-06-01 02:24:24 | INFO | src.nested_cv_avggrm_weighted_unified | Trial 61 | outer=10 | alpha=1.121e+05 n_pcs=4000 (pc_topk) weight_search=on
2026-06-01 02:24:24 | INFO | src.nested_cv_avggrm_weighted_unified | Trial 61 | outer=10 | weight={'name': 'linear', 'floor': 1e-06, 'clip_max': 20.0, 'min_weight': 0.16276257798170493, 'max_weight': 2.6205063132687347}
[I 2026-06-01 02:24:29,762] Trial 61 finished with value: 0.23569849322548037 and parameters: {'alpha': 112063.73935097727, 'n_pcs': 4000, 'weight_scheme': 'linear', 'weight_clip_max': 20.0, 'weight_linear_min_weight': 0.16276257798170493, 'weight_linear_max_weight': 2.6205063132687347}. Best is trial 43 with value: 0.23589421909037797.
2026-06-01 02:24:29 | INFO | src.nested_cv_avggrm_weighted_unified | Trial 62 | outer=10 | alpha=4.875e+04 n_pcs=4000 (pc_topk) weight_search=on
2026-06-01 02:24:29 | INFO | src.nested_cv_avggrm_weighted_unified | Trial 62 | outer=10 | weight={'name': 'linear', 'floor': 1e-06, 'clip_max': 20.0, 'min_weight': 0.2606945417132508, 'max_weight': 2.920444080989191}
[I 2026-06-01 02:24:35,513] Trial 62 finished with value: 0.23250017307999737 and parameters: {'alpha': 48745.56538896004, 'n_pcs': 4000, 'weight_scheme': 'linear', 'weight_clip_max': 20.0, 'weight_linear_min_weight': 0.2606945417132508, 'weight_linear_max_weight': 2.920444080989191}. Best is trial 43 with value: 0.23589421909037797.
2026-06-01 02:24:35 | INFO | src.nested_cv_avggrm_weighted_unified | Trial 63 | outer=10 | alpha=1.198e+05 n_pcs=4500 (pc_topk) weight_search=on
2026-06-01 02:24:35 | INFO | src.nested_cv_avggrm_weighted_unified | Trial 63 | outer=10 | weight={'name': 'linear', 'floor': 1e-06, 'clip_max': 20.0, 'min_weight': 0.1130904547764365, 'max_weight': 2.3550688616360107}
[I 2026-06-01 02:24:42,440] Trial 63 finished with value: 0.23580392926644533 and parameters: {'alpha': 119801.73973195507, 'n_pcs': 4500, 'weight_scheme': 'linear', 'weight_clip_max': 20.0, 'weight_linear_min_weight': 0.1130904547764365, 'weight_linear_max_weight': 2.3550688616360107}. Best is trial 43 with value: 0.23589421909037797.
2026-06-01 02:24:42 | INFO | src.nested_cv_avggrm_weighted_unified | Trial 64 | outer=10 | alpha=1.847e+05 n_pcs=4500 (pc_topk) weight_search=on
2026-06-01 02:24:42 | INFO | src.nested_cv_avggrm_weighted_unified | Trial 64 | outer=10 | weight={'name': 'linear', 'floor': 1e-06, 'clip_max': 20.0, 'min_weight': 0.09108752560065178, 'max_weight': 2.265033861417841}
[I 2026-06-01 02:24:49,371] Trial 64 finished with value: 0.23476521366552575 and parameters: {'alpha': 184747.60241310947, 'n_pcs': 4500, 'weight_scheme': 'linear', 'weight_clip_max': 20.0, 'weight_linear_min_weight': 0.09108752560065178, 'weight_linear_max_weight': 2.265033861417841}. Best is trial 43 with value: 0.23589421909037797.
2026-06-01 02:24:49 | INFO | src.nested_cv_avggrm_weighted_unified | Trial 65 | outer=10 | alpha=1.556e+04 n_pcs=5000 (pc_topk) weight_search=on
2026-06-01 02:24:49 | INFO | src.nested_cv_avggrm_weighted_unified | Trial 65 | outer=10 | weight={'name': 'linear', 'floor': 1e-06, 'clip_max': 20.0, 'min_weight': 0.13218748667554026, 'max_weight': 2.4151593786150864}
2026-06-01 02:24:55 | INFO | src.nested_cv_avggrm_weighted_unified | Trial 65 | outer=10 | pruned after 8/10 inner folds (mean r=0.2413)
[I 2026-06-01 02:24:55,870] Trial 65 pruned. 
2026-06-01 02:24:55 | INFO | src.nested_cv_avggrm_weighted_unified | Trial 66 | outer=10 | alpha=7.581e+04 n_pcs=4500 (pc_topk) weight_search=on
2026-06-01 02:24:55 | INFO | src.nested_cv_avggrm_weighted_unified | Trial 66 | outer=10 | weight={'name': 'linear', 'floor': 1e-06, 'clip_max': 3.0, 'min_weight': 0.15465212689549024, 'max_weight': 1.7319141158498108}
[I 2026-06-01 02:25:02,821] Trial 66 finished with value: 0.23540056831046807 and parameters: {'alpha': 75805.40470873943, 'n_pcs': 4500, 'weight_scheme': 'linear', 'weight_clip_max': 3.0, 'weight_linear_min_weight': 0.15465212689549024, 'weight_linear_max_weight': 1.7319141158498108}. Best is trial 43 with value: 0.23589421909037797.
2026-06-01 02:25:02 | INFO | src.nested_cv_avggrm_weighted_unified | Trial 67 | outer=10 | alpha=1.035e+05 n_pcs=4500 (pc_topk) weight_search=on
2026-06-01 02:25:02 | INFO | src.nested_cv_avggrm_weighted_unified | Trial 67 | outer=10 | weight={'name': 'linear', 'floor': 1e-06, 'clip_max': 20.0, 'min_weight': 0.7636748260438303, 'max_weight': 2.522707601292531}
2026-06-01 02:25:08 | INFO | src.nested_cv_avggrm_weighted_unified | Trial 67 | outer=10 | pruned after 8/10 inner folds (mean r=0.2648)
[I 2026-06-01 02:25:08,341] Trial 67 pruned. 
2026-06-01 02:25:08 | INFO | src.nested_cv_avggrm_weighted_unified | Trial 68 | outer=10 | alpha=2.572e+05 n_pcs=4000 (pc_topk) weight_search=on
2026-06-01 02:25:08 | INFO | src.nested_cv_avggrm_weighted_unified | Trial 68 | outer=10 | weight={'name': 'linear', 'floor': 1e-06, 'clip_max': 20.0, 'min_weight': 0.09088409506374118, 'max_weight': 2.24710500873982}
[I 2026-06-01 02:25:14,055] Trial 68 finished with value: 0.23351028809137647 and parameters: {'alpha': 257207.55770274912, 'n_pcs': 4000, 'weight_scheme': 'linear', 'weight_clip_max': 20.0, 'weight_linear_min_weight': 0.09088409506374118, 'weight_linear_max_weight': 2.24710500873982}. Best is trial 43 with value: 0.23589421909037797.
2026-06-01 02:25:14 | INFO | src.nested_cv_avggrm_weighted_unified | Trial 69 | outer=10 | alpha=1.481e+05 n_pcs=4500 (pc_topk) weight_search=on
2026-06-01 02:25:14 | INFO | src.nested_cv_avggrm_weighted_unified | Trial 69 | outer=10 | weight={'name': 'linear', 'floor': 1e-06, 'clip_max': 20.0, 'min_weight': 0.19579614302102571, 'max_weight': 2.836909118698826}
[I 2026-06-01 02:25:20,987] Trial 69 finished with value: 0.2350939365278289 and parameters: {'alpha': 148133.6701804623, 'n_pcs': 4500, 'weight_scheme': 'linear', 'weight_clip_max': 20.0, 'weight_linear_min_weight': 0.19579614302102571, 'weight_linear_max_weight': 2.836909118698826}. Best is trial 43 with value: 0.23589421909037797.
2026-06-01 02:25:20 | INFO | src.nested_cv_avggrm_weighted_unified | Trial 70 | outer=10 | alpha=4.613e+04 n_pcs=1000 (pc_topk) weight_search=on
2026-06-01 02:25:21 | INFO | src.nested_cv_avggrm_weighted_unified | Trial 70 | outer=10 | weight={'name': 'linear', 'floor': 1e-06, 'clip_max': 10.0, 'min_weight': 0.05103629723706645, 'max_weight': 3.104934101500601}
2026-06-01 02:25:22 | INFO | src.nested_cv_avggrm_weighted_unified | Trial 70 | outer=10 | pruned after 8/10 inner folds (mean r=0.2451)
[I 2026-06-01 02:25:22,124] Trial 70 pruned. 
2026-06-01 02:25:22 | INFO | src.nested_cv_avggrm_weighted_unified | Trial 71 | outer=10 | alpha=7.173e+04 n_pcs=4500 (pc_topk) weight_search=on
2026-06-01 02:25:22 | INFO | src.nested_cv_avggrm_weighted_unified | Trial 71 | outer=10 | weight={'name': 'linear', 'floor': 1e-06, 'clip_max': 3.0, 'min_weight': 0.14218133635164054, 'max_weight': 1.48339746624026}
[I 2026-06-01 02:25:29,077] Trial 71 finished with value: 0.23527251047476824 and parameters: {'alpha': 71725.75591049179, 'n_pcs': 4500, 'weight_scheme': 'linear', 'weight_clip_max': 3.0, 'weight_linear_min_weight': 0.14218133635164054, 'weight_linear_max_weight': 1.48339746624026}. Best is trial 43 with value: 0.23589421909037797.
2026-06-01 02:25:29 | INFO | src.nested_cv_avggrm_weighted_unified | Trial 72 | outer=10 | alpha=9.715e+04 n_pcs=4000 (pc_topk) weight_search=on
2026-06-01 02:25:29 | INFO | src.nested_cv_avggrm_weighted_unified | Trial 72 | outer=10 | weight={'name': 'linear', 'floor': 1e-06, 'clip_max': 3.0, 'min_weight': 0.168536153923708, 'max_weight': 1.0170452802466448}
[I 2026-06-01 02:25:35,233] Trial 72 finished with value: 0.23445790698123528 and parameters: {'alpha': 97151.53175094022, 'n_pcs': 4000, 'weight_scheme': 'linear', 'weight_clip_max': 3.0, 'weight_linear_min_weight': 0.168536153923708, 'weight_linear_max_weight': 1.0170452802466448}. Best is trial 43 with value: 0.23589421909037797.
2026-06-01 02:25:35 | INFO | src.nested_cv_avggrm_weighted_unified | Trial 73 | outer=10 | alpha=1.755e+05 n_pcs=4500 (pc_topk) weight_search=on
2026-06-01 02:25:35 | INFO | src.nested_cv_avggrm_weighted_unified | Trial 73 | outer=10 | weight={'name': 'linear', 'floor': 1e-06, 'clip_max': 3.0, 'min_weight': 0.11698826358137265, 'max_weight': 1.7946343564171758}
[I 2026-06-01 02:25:42,186] Trial 73 finished with value: 0.23424228312273748 and parameters: {'alpha': 175478.34932878672, 'n_pcs': 4500, 'weight_scheme': 'linear', 'weight_clip_max': 3.0, 'weight_linear_min_weight': 0.11698826358137265, 'weight_linear_max_weight': 1.7946343564171758}. Best is trial 43 with value: 0.23589421909037797.
2026-06-01 02:25:42 | INFO | src.nested_cv_avggrm_weighted_unified | Trial 74 | outer=10 | alpha=6.834e+04 n_pcs=5000 (pc_topk) weight_search=on
2026-06-01 02:25:42 | INFO | src.nested_cv_avggrm_weighted_unified | Trial 74 | outer=10 | weight={'name': 'linear', 'floor': 1e-06, 'clip_max': 3.0, 'min_weight': 0.27268508563130056, 'max_weight': 3.3748892942726214}
2026-06-01 02:25:48 | INFO | src.nested_cv_avggrm_weighted_unified | Trial 74 | outer=10 | pruned after 8/10 inner folds (mean r=0.2647)
[I 2026-06-01 02:25:48,678] Trial 74 pruned. 
2026-06-01 02:25:48 | INFO | src.nested_cv_avggrm_weighted_unified | Trial 75 | outer=10 | alpha=4.608e+05 n_pcs=4000 (pc_topk) weight_search=on
2026-06-01 02:25:48 | INFO | src.nested_cv_avggrm_weighted_unified | Trial 75 | outer=10 | weight={'name': 'linear', 'floor': 1e-06, 'clip_max': 20.0, 'min_weight': 0.19994038606505166, 'max_weight': 2.586905244819346}
2026-06-01 02:25:53 | INFO | src.nested_cv_avggrm_weighted_unified | Trial 75 | outer=10 | pruned after 8/10 inner folds (mean r=0.2670)
[I 2026-06-01 02:25:53,247] Trial 75 pruned. 
2026-06-01 02:25:53 | INFO | src.nested_cv_avggrm_weighted_unified | Trial 76 | outer=10 | alpha=1.139e+05 n_pcs=4500 (pc_topk) weight_search=on
2026-06-01 02:25:53 | INFO | src.nested_cv_avggrm_weighted_unified | Trial 76 | outer=10 | weight={'name': 'uniform', 'floor': 1e-06, 'clip_max': 3.0}
2026-06-01 02:25:57 | INFO | src.nested_cv_avggrm_weighted_unified | Trial 76 | outer=10 | pruned after 7/10 inner folds (mean r=0.2320)
[I 2026-06-01 02:25:57,475] Trial 76 pruned. 
2026-06-01 02:25:57 | INFO | src.nested_cv_avggrm_weighted_unified | Trial 77 | outer=10 | alpha=2.145e+05 n_pcs=5000 (pc_topk) weight_search=on
2026-06-01 02:25:57 | INFO | src.nested_cv_avggrm_weighted_unified | Trial 77 | outer=10 | weight={'name': 'linear', 'floor': 1e-06, 'clip_max': 20.0, 'min_weight': 0.3345621196796508, 'max_weight': 2.399461031555342}
2026-06-01 02:26:03 | INFO | src.nested_cv_avggrm_weighted_unified | Trial 77 | outer=10 | pruned after 8/10 inner folds (mean r=0.2667)
[I 2026-06-01 02:26:03,938] Trial 77 pruned. 
2026-06-01 02:26:03 | INFO | src.nested_cv_avggrm_weighted_unified | Trial 78 | outer=10 | alpha=3.143e+04 n_pcs=3500 (pc_topk) weight_search=on
2026-06-01 02:26:03 | INFO | src.nested_cv_avggrm_weighted_unified | Trial 78 | outer=10 | weight={'name': 'linear', 'floor': 1e-06, 'clip_max': 20.0, 'min_weight': 0.07973714515432057, 'max_weight': 1.5989133339294463}
2026-06-01 02:26:07 | INFO | src.nested_cv_avggrm_weighted_unified | Trial 78 | outer=10 | pruned after 8/10 inner folds (mean r=0.2499)
[I 2026-06-01 02:26:07,873] Trial 78 pruned. 
2026-06-01 02:26:07 | INFO | src.nested_cv_avggrm_weighted_unified | Trial 79 | outer=10 | alpha=1.308e+05 n_pcs=4000 (pc_topk) weight_search=on
2026-06-01 02:26:07 | INFO | src.nested_cv_avggrm_weighted_unified | Trial 79 | outer=10 | weight={'name': 'exponential', 'floor': 1e-06, 'clip_max': 20.0, 'beta': 7.5583607364103855}
[I 2026-06-01 02:26:14,343] Trial 79 finished with value: 0.2272087968649707 and parameters: {'alpha': 130842.07449279419, 'n_pcs': 4000, 'weight_scheme': 'exponential', 'weight_clip_max': 20.0, 'weight_exponential_beta': 7.5583607364103855}. Best is trial 43 with value: 0.23589421909037797.
2026-06-01 02:26:14 | INFO | src.nested_cv_avggrm_weighted_unified | Trial 80 | outer=10 | alpha=8.325e+04 n_pcs=4500 (pc_topk) weight_search=on
2026-06-01 02:26:14 | INFO | src.nested_cv_avggrm_weighted_unified | Trial 80 | outer=10 | weight={'name': 'linear', 'floor': 1e-06, 'clip_max': 20.0, 'min_weight': 0.975759952488258, 'max_weight': 2.1440870974063273}
2026-06-01 02:26:19 | INFO | src.nested_cv_avggrm_weighted_unified | Trial 80 | outer=10 | pruned after 8/10 inner folds (mean r=0.2618)
[I 2026-06-01 02:26:19,994] Trial 80 pruned. 
2026-06-01 02:26:20 | INFO | src.nested_cv_avggrm_weighted_unified | Trial 81 | outer=10 | alpha=1.423e+05 n_pcs=4000 (pc_topk) weight_search=on
2026-06-01 02:26:20 | INFO | src.nested_cv_avggrm_weighted_unified | Trial 81 | outer=10 | weight={'name': 'linear', 'floor': 1e-06, 'clip_max': 20.0, 'min_weight': 0.2317325476771394, 'max_weight': 2.666528336329761}
[I 2026-06-01 02:26:25,715] Trial 81 finished with value: 0.23504517025724897 and parameters: {'alpha': 142329.5568327907, 'n_pcs': 4000, 'weight_scheme': 'linear', 'weight_clip_max': 20.0, 'weight_linear_min_weight': 0.2317325476771394, 'weight_linear_max_weight': 2.666528336329761}. Best is trial 43 with value: 0.23589421909037797.
2026-06-01 02:26:25 | INFO | src.nested_cv_avggrm_weighted_unified | Trial 82 | outer=10 | alpha=3.537e+05 n_pcs=4000 (pc_topk) weight_search=on
2026-06-01 02:26:25 | INFO | src.nested_cv_avggrm_weighted_unified | Trial 82 | outer=10 | weight={'name': 'linear', 'floor': 1e-06, 'clip_max': 20.0, 'min_weight': 0.15437051446101502, 'max_weight': 2.857350456545546}
[I 2026-06-01 02:26:31,423] Trial 82 finished with value: 0.23129410792980662 and parameters: {'alpha': 353659.3623109781, 'n_pcs': 4000, 'weight_scheme': 'linear', 'weight_clip_max': 20.0, 'weight_linear_min_weight': 0.15437051446101502, 'weight_linear_max_weight': 2.857350456545546}. Best is trial 43 with value: 0.23589421909037797.
2026-06-01 02:26:31 | INFO | src.nested_cv_avggrm_weighted_unified | Trial 83 | outer=10 | alpha=4.177e+04 n_pcs=4000 (pc_topk) weight_search=on
2026-06-01 02:26:31 | INFO | src.nested_cv_avggrm_weighted_unified | Trial 83 | outer=10 | weight={'name': 'linear', 'floor': 1e-06, 'clip_max': 20.0, 'min_weight': 0.40179774540813273, 'max_weight': 2.7073026168258134}
[I 2026-06-01 02:26:37,171] Trial 83 finished with value: 0.2312029778384089 and parameters: {'alpha': 41772.6920420906, 'n_pcs': 4000, 'weight_scheme': 'linear', 'weight_clip_max': 20.0, 'weight_linear_min_weight': 0.40179774540813273, 'weight_linear_max_weight': 2.7073026168258134}. Best is trial 43 with value: 0.23589421909037797.
2026-06-01 02:26:37 | INFO | src.nested_cv_avggrm_weighted_unified | Trial 84 | outer=10 | alpha=1.009e+05 n_pcs=4500 (pc_topk) weight_search=on
2026-06-01 02:26:37 | INFO | src.nested_cv_avggrm_weighted_unified | Trial 84 | outer=10 | weight={'name': 'linear', 'floor': 1e-06, 'clip_max': 20.0, 'min_weight': 0.21620024932464027, 'max_weight': 3.165369725904962}
[I 2026-06-01 02:26:44,134] Trial 84 finished with value: 0.23576775936414954 and parameters: {'alpha': 100924.57752754558, 'n_pcs': 4500, 'weight_scheme': 'linear', 'weight_clip_max': 20.0, 'weight_linear_min_weight': 0.21620024932464027, 'weight_linear_max_weight': 3.165369725904962}. Best is trial 43 with value: 0.23589421909037797.
2026-06-01 02:26:44 | INFO | src.nested_cv_avggrm_weighted_unified | Trial 85 | outer=10 | alpha=5.393e+04 n_pcs=4500 (pc_topk) weight_search=on
2026-06-01 02:26:44 | INFO | src.nested_cv_avggrm_weighted_unified | Trial 85 | outer=10 | weight={'name': 'linear', 'floor': 1e-06, 'clip_max': 20.0, 'min_weight': 0.19454598894118214, 'max_weight': 3.160753186784998}
[I 2026-06-01 02:26:51,145] Trial 85 finished with value: 0.23412327829097865 and parameters: {'alpha': 53933.97792263626, 'n_pcs': 4500, 'weight_scheme': 'linear', 'weight_clip_max': 20.0, 'weight_linear_min_weight': 0.19454598894118214, 'weight_linear_max_weight': 3.160753186784998}. Best is trial 43 with value: 0.23589421909037797.
2026-06-01 02:26:51 | INFO | src.nested_cv_avggrm_weighted_unified | Trial 86 | outer=10 | alpha=9.640e+04 n_pcs=5000 (pc_topk) weight_search=on
2026-06-01 02:26:51 | INFO | src.nested_cv_avggrm_weighted_unified | Trial 86 | outer=10 | weight={'name': 'linear', 'floor': 1e-06, 'clip_max': 3.0, 'min_weight': 0.27217430528396513, 'max_weight': 3.5209909247514717}
2026-06-01 02:26:57 | INFO | src.nested_cv_avggrm_weighted_unified | Trial 86 | outer=10 | pruned after 8/10 inner folds (mean r=0.2668)
[I 2026-06-01 02:26:57,643] Trial 86 pruned. 
2026-06-01 02:26:57 | INFO | src.nested_cv_avggrm_weighted_unified | Trial 87 | outer=10 | alpha=1.838e+05 n_pcs=4500 (pc_topk) weight_search=on
2026-06-01 02:26:57 | INFO | src.nested_cv_avggrm_weighted_unified | Trial 87 | outer=10 | weight={'name': 'linear', 'floor': 1e-06, 'clip_max': 20.0, 'min_weight': 0.11366691475173347, 'max_weight': 3.0408424718072173}
[I 2026-06-01 02:27:04,583] Trial 87 finished with value: 0.2348300097360676 and parameters: {'alpha': 183764.37322602313, 'n_pcs': 4500, 'weight_scheme': 'linear', 'weight_clip_max': 20.0, 'weight_linear_min_weight': 0.11366691475173347, 'weight_linear_max_weight': 3.0408424718072173}. Best is trial 43 with value: 0.23589421909037797.
2026-06-01 02:27:04 | INFO | src.nested_cv_avggrm_weighted_unified | Trial 88 | outer=10 | alpha=6.430e+04 n_pcs=4500 (pc_topk) weight_search=on
2026-06-01 02:27:04 | INFO | src.nested_cv_avggrm_weighted_unified | Trial 88 | outer=10 | weight={'name': 'linear', 'floor': 1e-06, 'clip_max': 10.0, 'min_weight': 0.1493701405479595, 'max_weight': 3.2507419216496616}
[I 2026-06-01 02:27:11,554] Trial 88 finished with value: 0.2349145091332639 and parameters: {'alpha': 64301.24414178713, 'n_pcs': 4500, 'weight_scheme': 'linear', 'weight_clip_max': 10.0, 'weight_linear_min_weight': 0.1493701405479595, 'weight_linear_max_weight': 3.2507419216496616}. Best is trial 43 with value: 0.23589421909037797.
2026-06-01 02:27:11 | INFO | src.nested_cv_avggrm_weighted_unified | Trial 89 | outer=10 | alpha=2.461e+05 n_pcs=3500 (pc_topk) weight_search=on
2026-06-01 02:27:11 | INFO | src.nested_cv_avggrm_weighted_unified | Trial 89 | outer=10 | weight={'name': 'linear', 'floor': 1e-06, 'clip_max': 20.0, 'min_weight': 0.3016552697852555, 'max_weight': 2.576092699109425}
[I 2026-06-01 02:27:16,616] Trial 89 finished with value: 0.23203803293734704 and parameters: {'alpha': 246135.92576765272, 'n_pcs': 3500, 'weight_scheme': 'linear', 'weight_clip_max': 20.0, 'weight_linear_min_weight': 0.3016552697852555, 'weight_linear_max_weight': 2.576092699109425}. Best is trial 43 with value: 0.23589421909037797.
2026-06-01 02:27:16 | INFO | src.nested_cv_avggrm_weighted_unified | Trial 90 | outer=10 | alpha=1.100e+05 n_pcs=4000 (pc_topk) weight_search=on
2026-06-01 02:27:16 | INFO | src.nested_cv_avggrm_weighted_unified | Trial 90 | outer=10 | weight={'name': 'uniform', 'floor': 1e-06, 'clip_max': 20.0}
2026-06-01 02:27:20 | INFO | src.nested_cv_avggrm_weighted_unified | Trial 90 | outer=10 | pruned after 7/10 inner folds (mean r=0.2320)
[I 2026-06-01 02:27:20,530] Trial 90 pruned. 
2026-06-01 02:27:20 | INFO | src.nested_cv_avggrm_weighted_unified | Trial 91 | outer=10 | alpha=1.439e+05 n_pcs=4000 (pc_topk) weight_search=on
2026-06-01 02:27:20 | INFO | src.nested_cv_avggrm_weighted_unified | Trial 91 | outer=10 | weight={'name': 'linear', 'floor': 1e-06, 'clip_max': 20.0, 'min_weight': 0.23028704628244573, 'max_weight': 2.7830927010826985}
[I 2026-06-01 02:27:26,243] Trial 91 finished with value: 0.23508127336836745 and parameters: {'alpha': 143938.4172295968, 'n_pcs': 4000, 'weight_scheme': 'linear', 'weight_clip_max': 20.0, 'weight_linear_min_weight': 0.23028704628244573, 'weight_linear_max_weight': 2.7830927010826985}. Best is trial 43 with value: 0.23589421909037797.
2026-06-01 02:27:26 | INFO | src.nested_cv_avggrm_weighted_unified | Trial 92 | outer=10 | alpha=7.857e+04 n_pcs=4500 (pc_topk) weight_search=on
2026-06-01 02:27:26 | INFO | src.nested_cv_avggrm_weighted_unified | Trial 92 | outer=10 | weight={'name': 'linear', 'floor': 1e-06, 'clip_max': 20.0, 'min_weight': 0.2136559103972842, 'max_weight': 2.3412651371773308}
[I 2026-06-01 02:27:33,165] Trial 92 finished with value: 0.23546329901908666 and parameters: {'alpha': 78566.00398572408, 'n_pcs': 4500, 'weight_scheme': 'linear', 'weight_clip_max': 20.0, 'weight_linear_min_weight': 0.2136559103972842, 'weight_linear_max_weight': 2.3412651371773308}. Best is trial 43 with value: 0.23589421909037797.
2026-06-01 02:27:33 | INFO | src.nested_cv_avggrm_weighted_unified | Trial 93 | outer=10 | alpha=5.607e+04 n_pcs=4500 (pc_topk) weight_search=on
2026-06-01 02:27:33 | INFO | src.nested_cv_avggrm_weighted_unified | Trial 93 | outer=10 | weight={'name': 'linear', 'floor': 1e-06, 'clip_max': 20.0, 'min_weight': 0.18388743555773657, 'max_weight': 2.273803578951843}
