[I 2026-06-01 00:18:46,856] Trial 31 finished with value: 0.2525044548403805 and parameters: {'alpha': 164661.50107371138, 'n_pcs': 3500, 'weight_scheme': 'exponential', 'weight_clip_max': 5.0, 'weight_exponential_beta': 3.245761444298201}. Best is trial 25 with value: 0.2585216221253553.
2026-06-01 00:18:46 | INFO | src.nested_cv_avggrm_weighted_unified | Trial 32 | outer=5 | alpha=2.238e+06 n_pcs=2500 (pc_topk) weight_search=on
2026-06-01 00:18:46 | INFO | src.nested_cv_avggrm_weighted_unified | Trial 32 | outer=5 | weight={'name': 'exponential', 'floor': 1e-06, 'clip_max': 5.0, 'beta': 3.5634571923226916}
2026-06-01 00:18:48 | INFO | src.nested_cv_avggrm_weighted_unified | Trial 32 | outer=5 | pruned after 5/10 inner folds (mean r=0.2355)
[I 2026-06-01 00:18:48,258] Trial 32 pruned. 
2026-06-01 00:18:48 | INFO | src.nested_cv_avggrm_weighted_unified | Trial 33 | outer=5 | alpha=4.613e+04 n_pcs=4000 (pc_topk) weight_search=on
2026-06-01 00:18:48 | INFO | src.nested_cv_avggrm_weighted_unified | Trial 33 | outer=5 | weight={'name': 'exponential', 'floor': 1e-06, 'clip_max': 5.0, 'beta': 4.012415615505679}
[I 2026-06-01 00:18:53,685] Trial 33 finished with value: 0.25803786005478946 and parameters: {'alpha': 46133.08793552138, 'n_pcs': 4000, 'weight_scheme': 'exponential', 'weight_clip_max': 5.0, 'weight_exponential_beta': 4.012415615505679}. Best is trial 25 with value: 0.2585216221253553.
2026-06-01 00:18:53 | INFO | src.nested_cv_avggrm_weighted_unified | Trial 34 | outer=5 | alpha=1.348e+05 n_pcs=4000 (pc_topk) weight_search=on
2026-06-01 00:18:53 | INFO | src.nested_cv_avggrm_weighted_unified | Trial 34 | outer=5 | weight={'name': 'exponential', 'floor': 1e-06, 'clip_max': 20.0, 'beta': 3.8870347483550045}
[I 2026-06-01 00:18:59,083] Trial 34 finished with value: 0.25563358643183254 and parameters: {'alpha': 134775.21492882734, 'n_pcs': 4000, 'weight_scheme': 'exponential', 'weight_clip_max': 20.0, 'weight_exponential_beta': 3.8870347483550045}. Best is trial 25 with value: 0.2585216221253553.
2026-06-01 00:18:59 | INFO | src.nested_cv_avggrm_weighted_unified | Trial 35 | outer=5 | alpha=1.562e+05 n_pcs=4000 (pc_topk) weight_search=on
2026-06-01 00:18:59 | INFO | src.nested_cv_avggrm_weighted_unified | Trial 35 | outer=5 | weight={'name': 'exponential', 'floor': 1e-06, 'clip_max': 20.0, 'beta': 3.817422480886289}
[I 2026-06-01 00:19:04,450] Trial 35 finished with value: 0.2545932349728899 and parameters: {'alpha': 156189.67463907663, 'n_pcs': 4000, 'weight_scheme': 'exponential', 'weight_clip_max': 20.0, 'weight_exponential_beta': 3.817422480886289}. Best is trial 25 with value: 0.2585216221253553.
2026-06-01 00:19:04 | INFO | src.nested_cv_avggrm_weighted_unified | Trial 36 | outer=5 | alpha=4.051e+05 n_pcs=4000 (pc_topk) weight_search=on
2026-06-01 00:19:04 | INFO | src.nested_cv_avggrm_weighted_unified | Trial 36 | outer=5 | weight={'name': 'exponential', 'floor': 1e-06, 'clip_max': 20.0, 'beta': 4.414477534748012}
[I 2026-06-01 00:19:09,833] Trial 36 finished with value: 0.2444936589966696 and parameters: {'alpha': 405092.0121337371, 'n_pcs': 4000, 'weight_scheme': 'exponential', 'weight_clip_max': 20.0, 'weight_exponential_beta': 4.414477534748012}. Best is trial 25 with value: 0.2585216221253553.
2026-06-01 00:19:09 | INFO | src.nested_cv_avggrm_weighted_unified | Trial 37 | outer=5 | alpha=1.190e+06 n_pcs=4500 (pc_topk) weight_search=on
2026-06-01 00:19:09 | INFO | src.nested_cv_avggrm_weighted_unified | Trial 37 | outer=5 | weight={'name': 'exponential', 'floor': 1e-06, 'clip_max': 20.0, 'beta': 4.623290584810125}
2026-06-01 00:19:14 | INFO | src.nested_cv_avggrm_weighted_unified | Trial 37 | outer=5 | pruned after 7/10 inner folds (mean r=0.2750)
[I 2026-06-01 00:19:14,414] Trial 37 pruned. 
2026-06-01 00:19:14 | INFO | src.nested_cv_avggrm_weighted_unified | Trial 38 | outer=5 | alpha=7.860e+04 n_pcs=4000 (pc_topk) weight_search=on
2026-06-01 00:19:14 | INFO | src.nested_cv_avggrm_weighted_unified | Trial 38 | outer=5 | weight={'name': 'exponential', 'floor': 1e-06, 'clip_max': 20.0, 'beta': 2.2742045739941537}
[I 2026-06-01 00:19:19,785] Trial 38 finished with value: 0.25486851196376914 and parameters: {'alpha': 78601.1789711844, 'n_pcs': 4000, 'weight_scheme': 'exponential', 'weight_clip_max': 20.0, 'weight_exponential_beta': 2.2742045739941537}. Best is trial 25 with value: 0.2585216221253553.
2026-06-01 00:19:19 | INFO | src.nested_cv_avggrm_weighted_unified | Trial 39 | outer=5 | alpha=7.979e+04 n_pcs=5000 (pc_topk) weight_search=on
2026-06-01 00:19:19 | INFO | src.nested_cv_avggrm_weighted_unified | Trial 39 | outer=5 | weight={'name': 'exponential', 'floor': 1e-06, 'clip_max': 20.0, 'beta': 2.1332201566071647}
[I 2026-06-01 00:19:27,730] Trial 39 finished with value: 0.2519879606558736 and parameters: {'alpha': 79789.81047830723, 'n_pcs': 5000, 'weight_scheme': 'exponential', 'weight_clip_max': 20.0, 'weight_exponential_beta': 2.1332201566071647}. Best is trial 25 with value: 0.2585216221253553.
2026-06-01 00:19:27 | INFO | src.nested_cv_avggrm_weighted_unified | Trial 40 | outer=5 | alpha=3.688e+04 n_pcs=4000 (pc_topk) weight_search=on
2026-06-01 00:19:27 | INFO | src.nested_cv_avggrm_weighted_unified | Trial 40 | outer=5 | weight={'name': 'exponential', 'floor': 1e-06, 'clip_max': 3.0, 'beta': 1.984335991566986}
[I 2026-06-01 00:19:33,141] Trial 40 finished with value: 0.25387503994473226 and parameters: {'alpha': 36876.77776374998, 'n_pcs': 4000, 'weight_scheme': 'exponential', 'weight_clip_max': 3.0, 'weight_exponential_beta': 1.984335991566986}. Best is trial 25 with value: 0.2585216221253553.
2026-06-01 00:19:33 | INFO | src.nested_cv_avggrm_weighted_unified | Trial 41 | outer=5 | alpha=1.413e+05 n_pcs=4000 (pc_topk) weight_search=on
2026-06-01 00:19:33 | INFO | src.nested_cv_avggrm_weighted_unified | Trial 41 | outer=5 | weight={'name': 'exponential', 'floor': 1e-06, 'clip_max': 20.0, 'beta': 3.947285409890233}
[I 2026-06-01 00:19:38,506] Trial 41 finished with value: 0.25528839321748953 and parameters: {'alpha': 141263.2307431164, 'n_pcs': 4000, 'weight_scheme': 'exponential', 'weight_clip_max': 20.0, 'weight_exponential_beta': 3.947285409890233}. Best is trial 25 with value: 0.2585216221253553.
2026-06-01 00:19:38 | INFO | src.nested_cv_avggrm_weighted_unified | Trial 42 | outer=5 | alpha=5.318e+04 n_pcs=3500 (pc_topk) weight_search=on
2026-06-01 00:19:38 | INFO | src.nested_cv_avggrm_weighted_unified | Trial 42 | outer=5 | weight={'name': 'exponential', 'floor': 1e-06, 'clip_max': 20.0, 'beta': 5.191191667859961}
[I 2026-06-01 00:19:43,078] Trial 42 finished with value: 0.2545023916321774 and parameters: {'alpha': 53177.64395223755, 'n_pcs': 3500, 'weight_scheme': 'exponential', 'weight_clip_max': 20.0, 'weight_exponential_beta': 5.191191667859961}. Best is trial 25 with value: 0.2585216221253553.
2026-06-01 00:19:43 | INFO | src.nested_cv_avggrm_weighted_unified | Trial 43 | outer=5 | alpha=1.240e+05 n_pcs=4000 (pc_topk) weight_search=on
2026-06-01 00:19:43 | INFO | src.nested_cv_avggrm_weighted_unified | Trial 43 | outer=5 | weight={'name': 'exponential', 'floor': 1e-06, 'clip_max': 20.0, 'beta': 2.864005366835109}
[I 2026-06-01 00:19:48,480] Trial 43 finished with value: 0.25451268123453874 and parameters: {'alpha': 124023.15751191489, 'n_pcs': 4000, 'weight_scheme': 'exponential', 'weight_clip_max': 20.0, 'weight_exponential_beta': 2.864005366835109}. Best is trial 25 with value: 0.2585216221253553.
2026-06-01 00:19:48 | INFO | src.nested_cv_avggrm_weighted_unified | Trial 44 | outer=5 | alpha=3.671e+05 n_pcs=4500 (pc_topk) weight_search=on
2026-06-01 00:19:48 | INFO | src.nested_cv_avggrm_weighted_unified | Trial 44 | outer=5 | weight={'name': 'exponential', 'floor': 1e-06, 'clip_max': 20.0, 'beta': 3.972938417546655}
[I 2026-06-01 00:19:55,031] Trial 44 finished with value: 0.24605358369870886 and parameters: {'alpha': 367149.1732150906, 'n_pcs': 4500, 'weight_scheme': 'exponential', 'weight_clip_max': 20.0, 'weight_exponential_beta': 3.972938417546655}. Best is trial 25 with value: 0.2585216221253553.
2026-06-01 00:19:55 | INFO | src.nested_cv_avggrm_weighted_unified | Trial 45 | outer=5 | alpha=1.120e+04 n_pcs=4000 (pc_topk) weight_search=on
2026-06-01 00:19:55 | INFO | src.nested_cv_avggrm_weighted_unified | Trial 45 | outer=5 | weight={'name': 'exponential', 'floor': 1e-06, 'clip_max': 10.0, 'beta': 6.384152084625624}
2026-06-01 00:19:58 | INFO | src.nested_cv_avggrm_weighted_unified | Trial 45 | outer=5 | pruned after 7/10 inner folds (mean r=0.2528)
[I 2026-06-01 00:19:58,835] Trial 45 pruned. 
2026-06-01 00:19:58 | INFO | src.nested_cv_avggrm_weighted_unified | Trial 46 | outer=5 | alpha=7.967e+04 n_pcs=4500 (pc_topk) weight_search=on
2026-06-01 00:19:58 | INFO | src.nested_cv_avggrm_weighted_unified | Trial 46 | outer=5 | weight={'name': 'exponential', 'floor': 1e-06, 'clip_max': 20.0, 'beta': 4.810573321873033}
[I 2026-06-01 00:20:05,403] Trial 46 finished with value: 0.25826778095100916 and parameters: {'alpha': 79665.90203765199, 'n_pcs': 4500, 'weight_scheme': 'exponential', 'weight_clip_max': 20.0, 'weight_exponential_beta': 4.810573321873033}. Best is trial 25 with value: 0.2585216221253553.
2026-06-01 00:20:05 | INFO | src.nested_cv_avggrm_weighted_unified | Trial 47 | outer=5 | alpha=3.917e+04 n_pcs=5000 (pc_topk) weight_search=on
2026-06-01 00:20:05 | INFO | src.nested_cv_avggrm_weighted_unified | Trial 47 | outer=5 | weight={'name': 'exponential', 'floor': 1e-06, 'clip_max': 3.0, 'beta': 4.704110134086321}
[I 2026-06-01 00:20:13,353] Trial 47 finished with value: 0.25385259755573564 and parameters: {'alpha': 39174.280253317316, 'n_pcs': 5000, 'weight_scheme': 'exponential', 'weight_clip_max': 3.0, 'weight_exponential_beta': 4.704110134086321}. Best is trial 25 with value: 0.2585216221253553.
2026-06-01 00:20:13 | INFO | src.nested_cv_avggrm_weighted_unified | Trial 48 | outer=5 | alpha=2.501e+05 n_pcs=4500 (pc_topk) weight_search=on
2026-06-01 00:20:13 | INFO | src.nested_cv_avggrm_weighted_unified | Trial 48 | outer=5 | weight={'name': 'exponential', 'floor': 1e-06, 'clip_max': 20.0, 'beta': 5.211112623691456}
[I 2026-06-01 00:20:19,891] Trial 48 finished with value: 0.24965537841237273 and parameters: {'alpha': 250138.8130986623, 'n_pcs': 4500, 'weight_scheme': 'exponential', 'weight_clip_max': 20.0, 'weight_exponential_beta': 5.211112623691456}. Best is trial 25 with value: 0.2585216221253553.
2026-06-01 00:20:19 | INFO | src.nested_cv_avggrm_weighted_unified | Trial 49 | outer=5 | alpha=5.592e+04 n_pcs=5000 (pc_topk) weight_search=on
2026-06-01 00:20:19 | INFO | src.nested_cv_avggrm_weighted_unified | Trial 49 | outer=5 | weight={'name': 'exponential', 'floor': 1e-06, 'clip_max': 20.0, 'beta': 4.117304490465992}
[I 2026-06-01 00:20:27,839] Trial 49 finished with value: 0.2567832353427363 and parameters: {'alpha': 55923.481372872186, 'n_pcs': 5000, 'weight_scheme': 'exponential', 'weight_clip_max': 20.0, 'weight_exponential_beta': 4.117304490465992}. Best is trial 25 with value: 0.2585216221253553.
2026-06-01 00:20:27 | INFO | src.nested_cv_avggrm_weighted_unified | Trial 50 | outer=5 | alpha=6.316e+03 n_pcs=5000 (pc_topk) weight_search=on
2026-06-01 00:20:27 | INFO | src.nested_cv_avggrm_weighted_unified | Trial 50 | outer=5 | weight={'name': 'exponential', 'floor': 1e-06, 'clip_max': 10.0, 'beta': 6.800831067181418}
2026-06-01 00:20:33 | INFO | src.nested_cv_avggrm_weighted_unified | Trial 50 | outer=5 | pruned after 7/10 inner folds (mean r=0.2502)
[I 2026-06-01 00:20:33,298] Trial 50 pruned. 
2026-06-01 00:20:33 | INFO | src.nested_cv_avggrm_weighted_unified | Trial 51 | outer=5 | alpha=5.227e+04 n_pcs=5000 (pc_topk) weight_search=on
2026-06-01 00:20:33 | INFO | src.nested_cv_avggrm_weighted_unified | Trial 51 | outer=5 | weight={'name': 'exponential', 'floor': 1e-06, 'clip_max': 20.0, 'beta': 4.096979447307542}
[I 2026-06-01 00:20:41,312] Trial 51 finished with value: 0.25673660589369646 and parameters: {'alpha': 52272.93454627787, 'n_pcs': 5000, 'weight_scheme': 'exponential', 'weight_clip_max': 20.0, 'weight_exponential_beta': 4.096979447307542}. Best is trial 25 with value: 0.2585216221253553.
2026-06-01 00:20:41 | INFO | src.nested_cv_avggrm_weighted_unified | Trial 52 | outer=5 | alpha=5.654e+04 n_pcs=5000 (pc_topk) weight_search=on
2026-06-01 00:20:41 | INFO | src.nested_cv_avggrm_weighted_unified | Trial 52 | outer=5 | weight={'name': 'exponential', 'floor': 1e-06, 'clip_max': 20.0, 'beta': 4.294479624423303}
[I 2026-06-01 00:20:49,355] Trial 52 finished with value: 0.2567948436749391 and parameters: {'alpha': 56537.67803170387, 'n_pcs': 5000, 'weight_scheme': 'exponential', 'weight_clip_max': 20.0, 'weight_exponential_beta': 4.294479624423303}. Best is trial 25 with value: 0.2585216221253553.
2026-06-01 00:20:49 | INFO | src.nested_cv_avggrm_weighted_unified | Trial 53 | outer=5 | alpha=5.490e+04 n_pcs=5000 (pc_topk) weight_search=on
2026-06-01 00:20:49 | INFO | src.nested_cv_avggrm_weighted_unified | Trial 53 | outer=5 | weight={'name': 'exponential', 'floor': 1e-06, 'clip_max': 20.0, 'beta': 4.66511051550091}
[I 2026-06-01 00:20:57,417] Trial 53 finished with value: 0.2567515673894404 and parameters: {'alpha': 54897.59739388338, 'n_pcs': 5000, 'weight_scheme': 'exponential', 'weight_clip_max': 20.0, 'weight_exponential_beta': 4.66511051550091}. Best is trial 25 with value: 0.2585216221253553.
2026-06-01 00:20:57 | INFO | src.nested_cv_avggrm_weighted_unified | Trial 54 | outer=5 | alpha=2.958e+04 n_pcs=5000 (pc_topk) weight_search=on
2026-06-01 00:20:57 | INFO | src.nested_cv_avggrm_weighted_unified | Trial 54 | outer=5 | weight={'name': 'exponential', 'floor': 1e-06, 'clip_max': 20.0, 'beta': 5.1233916343053965}
[I 2026-06-01 00:21:05,459] Trial 54 finished with value: 0.25413690023205115 and parameters: {'alpha': 29578.559560180594, 'n_pcs': 5000, 'weight_scheme': 'exponential', 'weight_clip_max': 20.0, 'weight_exponential_beta': 5.1233916343053965}. Best is trial 25 with value: 0.2585216221253553.
2026-06-01 00:21:05 | INFO | src.nested_cv_avggrm_weighted_unified | Trial 55 | outer=5 | alpha=1.818e+04 n_pcs=4500 (pc_topk) weight_search=on
2026-06-01 00:21:05 | INFO | src.nested_cv_avggrm_weighted_unified | Trial 55 | outer=5 | weight={'name': 'exponential', 'floor': 1e-06, 'clip_max': 20.0, 'beta': 4.768317985436991}
[I 2026-06-01 00:21:12,117] Trial 55 finished with value: 0.251220145591011 and parameters: {'alpha': 18175.957816692895, 'n_pcs': 4500, 'weight_scheme': 'exponential', 'weight_clip_max': 20.0, 'weight_exponential_beta': 4.768317985436991}. Best is trial 25 with value: 0.2585216221253553.
2026-06-01 00:21:12 | INFO | src.nested_cv_avggrm_weighted_unified | Trial 56 | outer=5 | alpha=7.766e+04 n_pcs=5000 (pc_topk) weight_search=on
2026-06-01 00:21:12 | INFO | src.nested_cv_avggrm_weighted_unified | Trial 56 | outer=5 | weight={'name': 'exponential', 'floor': 1e-06, 'clip_max': 3.0, 'beta': 5.718200792588929}
[I 2026-06-01 00:21:20,150] Trial 56 finished with value: 0.25451466425168745 and parameters: {'alpha': 77658.34245665926, 'n_pcs': 5000, 'weight_scheme': 'exponential', 'weight_clip_max': 3.0, 'weight_exponential_beta': 5.718200792588929}. Best is trial 25 with value: 0.2585216221253553.
2026-06-01 00:21:20 | INFO | src.nested_cv_avggrm_weighted_unified | Trial 57 | outer=5 | alpha=5.495e+04 n_pcs=5000 (pc_topk) weight_search=on
2026-06-01 00:21:20 | INFO | src.nested_cv_avggrm_weighted_unified | Trial 57 | outer=5 | weight={'name': 'exponential', 'floor': 1e-06, 'clip_max': 20.0, 'beta': 3.3805030744790665}
[I 2026-06-01 00:21:28,212] Trial 57 finished with value: 0.2563992386284598 and parameters: {'alpha': 54953.882900445205, 'n_pcs': 5000, 'weight_scheme': 'exponential', 'weight_clip_max': 20.0, 'weight_exponential_beta': 3.3805030744790665}. Best is trial 25 with value: 0.2585216221253553.
2026-06-01 00:21:28 | INFO | src.nested_cv_avggrm_weighted_unified | Trial 58 | outer=5 | alpha=1.276e+04 n_pcs=4500 (pc_topk) weight_search=on
2026-06-01 00:21:28 | INFO | src.nested_cv_avggrm_weighted_unified | Trial 58 | outer=5 | weight={'name': 'uniform', 'floor': 1e-06, 'clip_max': 20.0}
2026-06-01 00:21:32 | INFO | src.nested_cv_avggrm_weighted_unified | Trial 58 | outer=5 | pruned after 7/10 inner folds (mean r=0.2596)
[I 2026-06-01 00:21:32,294] Trial 58 pruned. 
2026-06-01 00:21:32 | INFO | src.nested_cv_avggrm_weighted_unified | Trial 59 | outer=5 | alpha=2.195e+04 n_pcs=4500 (pc_topk) weight_search=on
2026-06-01 00:21:32 | INFO | src.nested_cv_avggrm_weighted_unified | Trial 59 | outer=5 | weight={'name': 'exponential', 'floor': 1e-06, 'clip_max': 5.0, 'beta': 2.6645755239427524}
[I 2026-06-01 00:21:38,968] Trial 59 finished with value: 0.25353319616830333 and parameters: {'alpha': 21953.418557394612, 'n_pcs': 4500, 'weight_scheme': 'exponential', 'weight_clip_max': 5.0, 'weight_exponential_beta': 2.6645755239427524}. Best is trial 25 with value: 0.2585216221253553.
2026-06-01 00:21:38 | INFO | src.nested_cv_avggrm_weighted_unified | Trial 60 | outer=5 | alpha=3.467e+04 n_pcs=5000 (pc_topk) weight_search=on
2026-06-01 00:21:38 | INFO | src.nested_cv_avggrm_weighted_unified | Trial 60 | outer=5 | weight={'name': 'exponential', 'floor': 1e-06, 'clip_max': 10.0, 'beta': 4.300798953219502}
[I 2026-06-01 00:21:47,003] Trial 60 finished with value: 0.25542901556377545 and parameters: {'alpha': 34668.06623029093, 'n_pcs': 5000, 'weight_scheme': 'exponential', 'weight_clip_max': 10.0, 'weight_exponential_beta': 4.300798953219502}. Best is trial 25 with value: 0.2585216221253553.
2026-06-01 00:21:47 | INFO | src.nested_cv_avggrm_weighted_unified | Trial 61 | outer=5 | alpha=4.295e+04 n_pcs=5000 (pc_topk) weight_search=on
2026-06-01 00:21:47 | INFO | src.nested_cv_avggrm_weighted_unified | Trial 61 | outer=5 | weight={'name': 'exponential', 'floor': 1e-06, 'clip_max': 20.0, 'beta': 4.3162533561296135}
[I 2026-06-01 00:21:55,044] Trial 61 finished with value: 0.2563329614338487 and parameters: {'alpha': 42951.34898305419, 'n_pcs': 5000, 'weight_scheme': 'exponential', 'weight_clip_max': 20.0, 'weight_exponential_beta': 4.3162533561296135}. Best is trial 25 with value: 0.2585216221253553.
2026-06-01 00:21:55 | INFO | src.nested_cv_avggrm_weighted_unified | Trial 62 | outer=5 | alpha=5.352e+04 n_pcs=5000 (pc_topk) weight_search=on
2026-06-01 00:21:55 | INFO | src.nested_cv_avggrm_weighted_unified | Trial 62 | outer=5 | weight={'name': 'exponential', 'floor': 1e-06, 'clip_max': 20.0, 'beta': 0.36310960702173567}
2026-06-01 00:22:00 | INFO | src.nested_cv_avggrm_weighted_unified | Trial 62 | outer=5 | pruned after 7/10 inner folds (mean r=0.2735)
[I 2026-06-01 00:22:00,564] Trial 62 pruned. 
2026-06-01 00:22:00 | INFO | src.nested_cv_avggrm_weighted_unified | Trial 63 | outer=5 | alpha=1.005e+05 n_pcs=1500 (pc_topk) weight_search=on
2026-06-01 00:22:00 | INFO | src.nested_cv_avggrm_weighted_unified | Trial 63 | outer=5 | weight={'name': 'exponential', 'floor': 1e-06, 'clip_max': 20.0, 'beta': 5.346358126528623}
2026-06-01 00:22:01 | INFO | src.nested_cv_avggrm_weighted_unified | Trial 63 | outer=5 | pruned after 7/10 inner folds (mean r=0.2834)
[I 2026-06-01 00:22:01,710] Trial 63 pruned. 
2026-06-01 00:22:01 | INFO | src.nested_cv_avggrm_weighted_unified | Trial 64 | outer=5 | alpha=2.801e+04 n_pcs=4500 (pc_topk) weight_search=on
2026-06-01 00:22:01 | INFO | src.nested_cv_avggrm_weighted_unified | Trial 64 | outer=5 | weight={'name': 'exponential', 'floor': 1e-06, 'clip_max': 20.0, 'beta': 4.3861739707807095}
[I 2026-06-01 00:22:08,388] Trial 64 finished with value: 0.2561493971924731 and parameters: {'alpha': 28014.529722726023, 'n_pcs': 4500, 'weight_scheme': 'exponential', 'weight_clip_max': 20.0, 'weight_exponential_beta': 4.3861739707807095}. Best is trial 25 with value: 0.2585216221253553.
2026-06-01 00:22:08 | INFO | src.nested_cv_avggrm_weighted_unified | Trial 65 | outer=5 | alpha=6.534e+04 n_pcs=5000 (pc_topk) weight_search=on
2026-06-01 00:22:08 | INFO | src.nested_cv_avggrm_weighted_unified | Trial 65 | outer=5 | weight={'name': 'exponential', 'floor': 1e-06, 'clip_max': 5.0, 'beta': 3.5532780572790705}
[I 2026-06-01 00:22:16,440] Trial 65 finished with value: 0.2561463448470068 and parameters: {'alpha': 65340.27346308056, 'n_pcs': 5000, 'weight_scheme': 'exponential', 'weight_clip_max': 5.0, 'weight_exponential_beta': 3.5532780572790705}. Best is trial 25 with value: 0.2585216221253553.
2026-06-01 00:22:16 | INFO | src.nested_cv_avggrm_weighted_unified | Trial 66 | outer=5 | alpha=2.110e+05 n_pcs=4500 (pc_topk) weight_search=on
2026-06-01 00:22:16 | INFO | src.nested_cv_avggrm_weighted_unified | Trial 66 | outer=5 | weight={'name': 'exponential', 'floor': 1e-06, 'clip_max': 20.0, 'beta': 1.0699345563134472}
2026-06-01 00:22:19 | INFO | src.nested_cv_avggrm_weighted_unified | Trial 66 | outer=5 | pruned after 5/10 inner folds (mean r=0.2399)
[I 2026-06-01 00:22:19,728] Trial 66 pruned. 
2026-06-01 00:22:19 | INFO | src.nested_cv_avggrm_weighted_unified | Trial 67 | outer=5 | alpha=8.821e+04 n_pcs=4500 (pc_topk) weight_search=on
2026-06-01 00:22:19 | INFO | src.nested_cv_avggrm_weighted_unified | Trial 67 | outer=5 | weight={'name': 'uniform', 'floor': 1e-06, 'clip_max': 5.0}
2026-06-01 00:22:22 | INFO | src.nested_cv_avggrm_weighted_unified | Trial 67 | outer=5 | pruned after 5/10 inner folds (mean r=0.2381)
[I 2026-06-01 00:22:22,622] Trial 67 pruned. 
2026-06-01 00:22:22 | INFO | src.nested_cv_avggrm_weighted_unified | Trial 68 | outer=5 | alpha=4.904e+04 n_pcs=5000 (pc_topk) weight_search=on
2026-06-01 00:22:22 | INFO | src.nested_cv_avggrm_weighted_unified | Trial 68 | outer=5 | weight={'name': 'exponential', 'floor': 1e-06, 'clip_max': 20.0, 'beta': 6.073589970755425}
