[I 2026-06-01 20:57:27,476] Trial 262 finished with value: 0.2367013299399518 and parameters: {'alpha': 75213.44383656178, 'n_pcs': 4000, 'iw_method': 'pc_logistic', 'iw_clip_max': 1.5, 'iw_prob_clip': 0.017548993560312216, 'iw_n_components': 80, 'iw_logistic_c': 1.9358639601664953, 'iw_pca_fit': 'combined', 'iw_solver': 'lbfgs', 'iw_rho': 0.85}. Best is trial 223 with value: 0.23705194687121506.
2026-06-01 20:57:27 | INFO | Trial 263 | outer=6 | alpha=6.829e+04 n_pcs=4000 (pc_topk) weight={'name': 'pc_logistic', 'floor': 1e-06, 'clip_max': 1.5, 'prob_clip': 0.019961163608797464, 'n_components': 10, 'logistic_c': 1.7657957367189914, 'pca_fit': 'combined', 'solver': 'lbfgs', 'max_iter': 2000, 'fit_intercept': True, 'standardize_with_source': True, 'rho': 0.85}
[I 2026-06-01 20:57:44,469] Trial 263 finished with value: 0.2341364855678028 and parameters: {'alpha': 68289.10936811635, 'n_pcs': 4000, 'iw_method': 'pc_logistic', 'iw_clip_max': 1.5, 'iw_prob_clip': 0.019961163608797464, 'iw_n_components': 10, 'iw_logistic_c': 1.7657957367189914, 'iw_pca_fit': 'combined', 'iw_solver': 'lbfgs', 'iw_rho': 0.85}. Best is trial 223 with value: 0.23705194687121506.
2026-06-01 20:57:44 | INFO | Trial 264 | outer=6 | alpha=7.732e+04 n_pcs=4000 (pc_topk) weight={'name': 'pc_logistic', 'floor': 1e-06, 'clip_max': 1.5, 'prob_clip': 0.01747223043945742, 'n_components': 80, 'logistic_c': 2.062031017865281, 'pca_fit': 'combined', 'solver': 'lbfgs', 'max_iter': 2000, 'fit_intercept': True, 'standardize_with_source': True, 'rho': 0.85}
[I 2026-06-01 20:58:10,867] Trial 264 finished with value: 0.23665770445955575 and parameters: {'alpha': 77321.44496153393, 'n_pcs': 4000, 'iw_method': 'pc_logistic', 'iw_clip_max': 1.5, 'iw_prob_clip': 0.01747223043945742, 'iw_n_components': 80, 'iw_logistic_c': 2.062031017865281, 'iw_pca_fit': 'combined', 'iw_solver': 'lbfgs', 'iw_rho': 0.85}. Best is trial 223 with value: 0.23705194687121506.
2026-06-01 20:58:10 | INFO | Trial 265 | outer=6 | alpha=6.299e+04 n_pcs=4000 (pc_topk) weight={'name': 'pc_logistic', 'floor': 1e-06, 'clip_max': 1.5, 'prob_clip': 0.01902831571264524, 'n_components': 80, 'logistic_c': 1.2665719624434575, 'pca_fit': 'combined', 'solver': 'lbfgs', 'max_iter': 2000, 'fit_intercept': True, 'standardize_with_source': True, 'rho': 0.85}
[I 2026-06-01 20:58:37,798] Trial 265 finished with value: 0.23676720890180397 and parameters: {'alpha': 62993.58703062745, 'n_pcs': 4000, 'iw_method': 'pc_logistic', 'iw_clip_max': 1.5, 'iw_prob_clip': 0.01902831571264524, 'iw_n_components': 80, 'iw_logistic_c': 1.2665719624434575, 'iw_pca_fit': 'combined', 'iw_solver': 'lbfgs', 'iw_rho': 0.85}. Best is trial 223 with value: 0.23705194687121506.
2026-06-01 20:58:37 | INFO | Trial 266 | outer=6 | alpha=6.536e+04 n_pcs=4000 (pc_topk) weight={'name': 'pc_logistic', 'floor': 1e-06, 'clip_max': 1.5, 'prob_clip': 0.021124507067636047, 'n_components': 80, 'logistic_c': 1.089993032917548, 'pca_fit': 'combined', 'solver': 'lbfgs', 'max_iter': 2000, 'fit_intercept': True, 'standardize_with_source': True, 'rho': 0.85}
[I 2026-06-01 20:59:05,241] Trial 266 finished with value: 0.23665005398388933 and parameters: {'alpha': 65362.08990668294, 'n_pcs': 4000, 'iw_method': 'pc_logistic', 'iw_clip_max': 1.5, 'iw_prob_clip': 0.021124507067636047, 'iw_n_components': 80, 'iw_logistic_c': 1.089993032917548, 'iw_pca_fit': 'combined', 'iw_solver': 'lbfgs', 'iw_rho': 0.85}. Best is trial 223 with value: 0.23705194687121506.
2026-06-01 20:59:05 | INFO | Trial 267 | outer=6 | alpha=6.352e+04 n_pcs=4000 (pc_topk) weight={'name': 'pc_logistic', 'floor': 1e-06, 'clip_max': 1.5, 'prob_clip': 0.019336368327957685, 'n_components': 80, 'logistic_c': 2.399293313647475, 'pca_fit': 'combined', 'solver': 'lbfgs', 'max_iter': 2000, 'fit_intercept': True, 'standardize_with_source': True, 'rho': 0.85}
[I 2026-06-01 20:59:31,198] Trial 267 finished with value: 0.236660942577492 and parameters: {'alpha': 63521.42139606526, 'n_pcs': 4000, 'iw_method': 'pc_logistic', 'iw_clip_max': 1.5, 'iw_prob_clip': 0.019336368327957685, 'iw_n_components': 80, 'iw_logistic_c': 2.399293313647475, 'iw_pca_fit': 'combined', 'iw_solver': 'lbfgs', 'iw_rho': 0.85}. Best is trial 223 with value: 0.23705194687121506.
2026-06-01 20:59:31 | INFO | Trial 268 | outer=6 | alpha=1.108e+05 n_pcs=4000 (pc_topk) weight={'name': 'pc_logistic', 'floor': 1e-06, 'clip_max': 1.5, 'prob_clip': 0.01784944739086909, 'n_components': 80, 'logistic_c': 0.7604989027808544, 'pca_fit': 'combined', 'solver': 'lbfgs', 'max_iter': 2000, 'fit_intercept': True, 'standardize_with_source': True, 'rho': 0.85}
[I 2026-06-01 20:59:58,108] Trial 268 finished with value: 0.23589023688961724 and parameters: {'alpha': 110833.8734016976, 'n_pcs': 4000, 'iw_method': 'pc_logistic', 'iw_clip_max': 1.5, 'iw_prob_clip': 0.01784944739086909, 'iw_n_components': 80, 'iw_logistic_c': 0.7604989027808544, 'iw_pca_fit': 'combined', 'iw_solver': 'lbfgs', 'iw_rho': 0.85}. Best is trial 223 with value: 0.23705194687121506.
2026-06-01 20:59:58 | INFO | Trial 269 | outer=6 | alpha=6.237e+04 n_pcs=4000 (pc_topk) weight={'name': 'pc_logistic', 'floor': 1e-06, 'clip_max': 1.5, 'prob_clip': 0.016418186959965286, 'n_components': 80, 'logistic_c': 1.0471934381997774, 'pca_fit': 'combined', 'solver': 'lbfgs', 'max_iter': 2000, 'fit_intercept': True, 'standardize_with_source': True, 'rho': 0.85}
[I 2026-06-01 21:00:24,920] Trial 269 finished with value: 0.23686985989817147 and parameters: {'alpha': 62374.42653179777, 'n_pcs': 4000, 'iw_method': 'pc_logistic', 'iw_clip_max': 1.5, 'iw_prob_clip': 0.016418186959965286, 'iw_n_components': 80, 'iw_logistic_c': 1.0471934381997774, 'iw_pca_fit': 'combined', 'iw_solver': 'lbfgs', 'iw_rho': 0.85}. Best is trial 223 with value: 0.23705194687121506.
2026-06-01 21:00:24 | INFO | Trial 270 | outer=6 | alpha=6.109e+04 n_pcs=4000 (pc_topk) weight={'name': 'pc_logistic', 'floor': 1e-06, 'clip_max': 4.0, 'prob_clip': 0.016463387258552085, 'n_components': 80, 'logistic_c': 0.9169340402342157, 'pca_fit': 'combined', 'solver': 'lbfgs', 'max_iter': 2000, 'fit_intercept': True, 'standardize_with_source': True, 'rho': 0.85}
[I 2026-06-01 21:00:51,195] Trial 270 finished with value: 0.23137122855742803 and parameters: {'alpha': 61091.176202568146, 'n_pcs': 4000, 'iw_method': 'pc_logistic', 'iw_clip_max': 4.0, 'iw_prob_clip': 0.016463387258552085, 'iw_n_components': 80, 'iw_logistic_c': 0.9169340402342157, 'iw_pca_fit': 'combined', 'iw_solver': 'lbfgs', 'iw_rho': 0.85}. Best is trial 223 with value: 0.23705194687121506.
2026-06-01 21:00:51 | INFO | Trial 271 | outer=6 | alpha=9.945e+04 n_pcs=4000 (pc_topk) weight={'name': 'pc_logistic', 'floor': 1e-06, 'clip_max': 1.5, 'prob_clip': 0.021620269308268426, 'n_components': 80, 'logistic_c': 1.3618976236912572, 'pca_fit': 'combined', 'solver': 'lbfgs', 'max_iter': 2000, 'fit_intercept': True, 'standardize_with_source': True, 'rho': 0.3}
[I 2026-06-01 21:01:16,611] Trial 271 finished with value: 0.23469501439836446 and parameters: {'alpha': 99445.6367964382, 'n_pcs': 4000, 'iw_method': 'pc_logistic', 'iw_clip_max': 1.5, 'iw_prob_clip': 0.021620269308268426, 'iw_n_components': 80, 'iw_logistic_c': 1.3618976236912572, 'iw_pca_fit': 'combined', 'iw_solver': 'lbfgs', 'iw_rho': 0.3}. Best is trial 223 with value: 0.23705194687121506.
2026-06-01 21:01:16 | INFO | Trial 272 | outer=6 | alpha=6.422e+04 n_pcs=4000 (pc_topk) weight={'name': 'pc_logistic', 'floor': 1e-06, 'clip_max': 1.5, 'prob_clip': 0.015986635197670827, 'n_components': 80, 'logistic_c': 0.6542821684204736, 'pca_fit': 'combined', 'solver': 'lbfgs', 'max_iter': 2000, 'fit_intercept': True, 'standardize_with_source': True, 'rho': 0.85}
[I 2026-06-01 21:01:41,934] Trial 272 finished with value: 0.23703986358684537 and parameters: {'alpha': 64224.90146910382, 'n_pcs': 4000, 'iw_method': 'pc_logistic', 'iw_clip_max': 1.5, 'iw_prob_clip': 0.015986635197670827, 'iw_n_components': 80, 'iw_logistic_c': 0.6542821684204736, 'iw_pca_fit': 'combined', 'iw_solver': 'lbfgs', 'iw_rho': 0.85}. Best is trial 223 with value: 0.23705194687121506.
2026-06-01 21:01:41 | INFO | Trial 273 | outer=6 | alpha=6.363e+04 n_pcs=4000 (pc_topk) weight={'name': 'pc_logistic', 'floor': 1e-06, 'clip_max': 1.5, 'prob_clip': 0.0161522993760724, 'n_components': 80, 'logistic_c': 1.2931261636188183, 'pca_fit': 'combined', 'solver': 'lbfgs', 'max_iter': 2000, 'fit_intercept': True, 'standardize_with_source': True, 'rho': 0.85}
[I 2026-06-01 21:02:08,073] Trial 273 finished with value: 0.2368507670303095 and parameters: {'alpha': 63632.73194376688, 'n_pcs': 4000, 'iw_method': 'pc_logistic', 'iw_clip_max': 1.5, 'iw_prob_clip': 0.0161522993760724, 'iw_n_components': 80, 'iw_logistic_c': 1.2931261636188183, 'iw_pca_fit': 'combined', 'iw_solver': 'lbfgs', 'iw_rho': 0.85}. Best is trial 223 with value: 0.23705194687121506.
2026-06-01 21:02:08 | INFO | Trial 274 | outer=6 | alpha=6.387e+04 n_pcs=4000 (pc_topk) weight={'name': 'pc_logistic', 'floor': 1e-06, 'clip_max': 1.5, 'prob_clip': 0.01972415864557652, 'n_components': 80, 'logistic_c': 1.385407543681222, 'pca_fit': 'combined', 'solver': 'lbfgs', 'max_iter': 2000, 'fit_intercept': True, 'standardize_with_source': True, 'rho': 0.85}
[I 2026-06-01 21:02:35,110] Trial 274 finished with value: 0.23673652750996102 and parameters: {'alpha': 63866.963034226996, 'n_pcs': 4000, 'iw_method': 'pc_logistic', 'iw_clip_max': 1.5, 'iw_prob_clip': 0.01972415864557652, 'iw_n_components': 80, 'iw_logistic_c': 1.385407543681222, 'iw_pca_fit': 'combined', 'iw_solver': 'lbfgs', 'iw_rho': 0.85}. Best is trial 223 with value: 0.23705194687121506.
2026-06-01 21:02:35 | INFO | Trial 275 | outer=6 | alpha=6.948e+04 n_pcs=4000 (pc_topk) weight={'name': 'pc_logistic', 'floor': 1e-06, 'clip_max': 1.5, 'prob_clip': 0.016771525385595572, 'n_components': 80, 'logistic_c': 0.8074605829209197, 'pca_fit': 'combined', 'solver': 'lbfgs', 'max_iter': 2000, 'fit_intercept': True, 'standardize_with_source': True, 'rho': 0.85}
[I 2026-06-01 21:03:00,855] Trial 275 finished with value: 0.23701455168757551 and parameters: {'alpha': 69483.13097809964, 'n_pcs': 4000, 'iw_method': 'pc_logistic', 'iw_clip_max': 1.5, 'iw_prob_clip': 0.016771525385595572, 'iw_n_components': 80, 'iw_logistic_c': 0.8074605829209197, 'iw_pca_fit': 'combined', 'iw_solver': 'lbfgs', 'iw_rho': 0.85}. Best is trial 223 with value: 0.23705194687121506.
2026-06-01 21:03:00 | INFO | Trial 276 | outer=6 | alpha=6.304e+04 n_pcs=4000 (pc_topk) weight={'name': 'pc_logistic', 'floor': 1e-06, 'clip_max': 7.0, 'prob_clip': 0.0187710287931658, 'n_components': 40, 'logistic_c': 0.8487237480992972, 'pca_fit': 'combined', 'solver': 'lbfgs', 'max_iter': 2000, 'fit_intercept': True, 'standardize_with_source': True, 'rho': 0.85}
[I 2026-06-01 21:03:22,815] Trial 276 finished with value: 0.22677104877147009 and parameters: {'alpha': 63035.62305982416, 'n_pcs': 4000, 'iw_method': 'pc_logistic', 'iw_clip_max': 7.0, 'iw_prob_clip': 0.0187710287931658, 'iw_n_components': 40, 'iw_logistic_c': 0.8487237480992972, 'iw_pca_fit': 'combined', 'iw_solver': 'lbfgs', 'iw_rho': 0.85}. Best is trial 223 with value: 0.23705194687121506.
2026-06-01 21:03:22 | INFO | Trial 277 | outer=6 | alpha=7.144e+04 n_pcs=4000 (pc_topk) weight={'name': 'pc_logistic', 'floor': 1e-06, 'clip_max': 1.5, 'prob_clip': 0.017437554863152717, 'n_components': 80, 'logistic_c': 1.2199988425724066, 'pca_fit': 'combined', 'solver': 'lbfgs', 'max_iter': 2000, 'fit_intercept': True, 'standardize_with_source': True, 'rho': 0.85}
[I 2026-06-01 21:03:49,269] Trial 277 finished with value: 0.23681125692146998 and parameters: {'alpha': 71435.53381407986, 'n_pcs': 4000, 'iw_method': 'pc_logistic', 'iw_clip_max': 1.5, 'iw_prob_clip': 0.017437554863152717, 'iw_n_components': 80, 'iw_logistic_c': 1.2199988425724066, 'iw_pca_fit': 'combined', 'iw_solver': 'lbfgs', 'iw_rho': 0.85}. Best is trial 223 with value: 0.23705194687121506.
2026-06-01 21:03:49 | INFO | Trial 278 | outer=6 | alpha=6.199e+04 n_pcs=4000 (pc_topk) weight={'name': 'pc_logistic', 'floor': 1e-06, 'clip_max': 1.5, 'prob_clip': 0.017032499887493256, 'n_components': 80, 'logistic_c': 1.2855212324619243, 'pca_fit': 'combined', 'solver': 'lbfgs', 'max_iter': 2000, 'fit_intercept': True, 'standardize_with_source': True, 'rho': 0.85}
[I 2026-06-01 21:04:16,682] Trial 278 finished with value: 0.23685443024243863 and parameters: {'alpha': 61985.87855199287, 'n_pcs': 4000, 'iw_method': 'pc_logistic', 'iw_clip_max': 1.5, 'iw_prob_clip': 0.017032499887493256, 'iw_n_components': 80, 'iw_logistic_c': 1.2855212324619243, 'iw_pca_fit': 'combined', 'iw_solver': 'lbfgs', 'iw_rho': 0.85}. Best is trial 223 with value: 0.23705194687121506.
2026-06-01 21:04:16 | INFO | Trial 279 | outer=6 | alpha=6.889e+04 n_pcs=4000 (pc_topk) weight={'name': 'pc_logistic', 'floor': 1e-06, 'clip_max': 12.0, 'prob_clip': 0.017069627032762682, 'n_components': 80, 'logistic_c': 0.8489394886942204, 'pca_fit': 'combined', 'solver': 'lbfgs', 'max_iter': 2000, 'fit_intercept': True, 'standardize_with_source': True, 'rho': 0.85}
[I 2026-06-01 21:04:41,985] Trial 279 finished with value: 0.21858654608013914 and parameters: {'alpha': 68890.87345424337, 'n_pcs': 4000, 'iw_method': 'pc_logistic', 'iw_clip_max': 12.0, 'iw_prob_clip': 0.017069627032762682, 'iw_n_components': 80, 'iw_logistic_c': 0.8489394886942204, 'iw_pca_fit': 'combined', 'iw_solver': 'lbfgs', 'iw_rho': 0.85}. Best is trial 223 with value: 0.23705194687121506.
2026-06-01 21:04:42 | INFO | Trial 280 | outer=6 | alpha=7.204e+04 n_pcs=4000 (pc_topk) weight={'name': 'pc_logistic', 'floor': 1e-06, 'clip_max': 1.5, 'prob_clip': 0.021658057735721208, 'n_components': 80, 'logistic_c': 1.4203559115862352, 'pca_fit': 'combined', 'solver': 'lbfgs', 'max_iter': 2000, 'fit_intercept': True, 'standardize_with_source': True, 'rho': 0.85}
[I 2026-06-01 21:05:06,185] Trial 280 finished with value: 0.23659952865490808 and parameters: {'alpha': 72037.80064648128, 'n_pcs': 4000, 'iw_method': 'pc_logistic', 'iw_clip_max': 1.5, 'iw_prob_clip': 0.021658057735721208, 'iw_n_components': 80, 'iw_logistic_c': 1.4203559115862352, 'iw_pca_fit': 'combined', 'iw_solver': 'lbfgs', 'iw_rho': 0.85}. Best is trial 223 with value: 0.23705194687121506.
2026-06-01 21:05:06 | INFO | Trial 281 | outer=6 | alpha=5.936e+04 n_pcs=4000 (pc_topk) weight={'name': 'pc_logistic', 'floor': 1e-06, 'clip_max': 1.5, 'prob_clip': 0.0028101098537559846, 'n_components': 80, 'logistic_c': 1.0657090078782296, 'pca_fit': 'combined', 'solver': 'lbfgs', 'max_iter': 2000, 'fit_intercept': True, 'standardize_with_source': True, 'rho': 0.85}
[I 2026-06-01 21:05:30,340] Trial 281 finished with value: 0.23165568749061616 and parameters: {'alpha': 59357.14978450873, 'n_pcs': 4000, 'iw_method': 'pc_logistic', 'iw_clip_max': 1.5, 'iw_prob_clip': 0.0028101098537559846, 'iw_n_components': 80, 'iw_logistic_c': 1.0657090078782296, 'iw_pca_fit': 'combined', 'iw_solver': 'lbfgs', 'iw_rho': 0.85}. Best is trial 223 with value: 0.23705194687121506.
2026-06-01 21:05:30 | INFO | Trial 282 | outer=6 | alpha=7.243e+04 n_pcs=4000 (pc_topk) weight={'name': 'pc_logistic', 'floor': 1e-06, 'clip_max': 1.5, 'prob_clip': 0.016969490232888945, 'n_components': 20, 'logistic_c': 0.6583934975731057, 'pca_fit': 'combined', 'solver': 'lbfgs', 'max_iter': 2000, 'fit_intercept': True, 'standardize_with_source': True, 'rho': 0.85}
[I 2026-06-01 21:05:46,683] Trial 282 finished with value: 0.23502621839989613 and parameters: {'alpha': 72433.41175083046, 'n_pcs': 4000, 'iw_method': 'pc_logistic', 'iw_clip_max': 1.5, 'iw_prob_clip': 0.016969490232888945, 'iw_n_components': 20, 'iw_logistic_c': 0.6583934975731057, 'iw_pca_fit': 'combined', 'iw_solver': 'lbfgs', 'iw_rho': 0.85}. Best is trial 223 with value: 0.23705194687121506.
2026-06-01 21:05:46 | INFO | Trial 283 | outer=6 | alpha=5.949e+04 n_pcs=4000 (pc_topk) weight={'name': 'pc_logistic', 'floor': 1e-06, 'clip_max': 2.5, 'prob_clip': 0.01780537876002159, 'n_components': 80, 'logistic_c': 5.165651029849715e-05, 'pca_fit': 'combined', 'solver': 'lbfgs', 'max_iter': 2000, 'fit_intercept': True, 'standardize_with_source': True, 'rho': 0.85}
[I 2026-06-01 21:05:59,393] Trial 283 finished with value: 0.23526814451408962 and parameters: {'alpha': 59487.75157640941, 'n_pcs': 4000, 'iw_method': 'pc_logistic', 'iw_clip_max': 2.5, 'iw_prob_clip': 0.01780537876002159, 'iw_n_components': 80, 'iw_logistic_c': 5.165651029849715e-05, 'iw_pca_fit': 'combined', 'iw_solver': 'lbfgs', 'iw_rho': 0.85}. Best is trial 223 with value: 0.23705194687121506.
2026-06-01 21:05:59 | INFO | Trial 284 | outer=6 | alpha=7.574e+04 n_pcs=4000 (pc_topk) weight={'name': 'pc_logistic', 'floor': 1e-06, 'clip_max': 1.5, 'prob_clip': 0.016040930759248197, 'n_components': 80, 'logistic_c': 0.7329468564680202, 'pca_fit': 'combined', 'solver': 'lbfgs', 'max_iter': 2000, 'fit_intercept': True, 'standardize_with_source': True, 'rho': 0.85}
[I 2026-06-01 21:06:26,152] Trial 284 finished with value: 0.2369502032260138 and parameters: {'alpha': 75739.81913183178, 'n_pcs': 4000, 'iw_method': 'pc_logistic', 'iw_clip_max': 1.5, 'iw_prob_clip': 0.016040930759248197, 'iw_n_components': 80, 'iw_logistic_c': 0.7329468564680202, 'iw_pca_fit': 'combined', 'iw_solver': 'lbfgs', 'iw_rho': 0.85}. Best is trial 223 with value: 0.23705194687121506.
2026-06-01 21:06:26 | INFO | Trial 285 | outer=6 | alpha=9.733e+04 n_pcs=4000 (pc_topk) weight={'name': 'pc_logistic', 'floor': 1e-06, 'clip_max': 1.5, 'prob_clip': 0.016546483763950685, 'n_components': 80, 'logistic_c': 2.643425947708109, 'pca_fit': 'combined', 'solver': 'lbfgs', 'max_iter': 2000, 'fit_intercept': True, 'standardize_with_source': True, 'rho': 0.85}
[I 2026-06-01 21:06:54,658] Trial 285 finished with value: 0.23600990956012802 and parameters: {'alpha': 97334.40658455723, 'n_pcs': 4000, 'iw_method': 'pc_logistic', 'iw_clip_max': 1.5, 'iw_prob_clip': 0.016546483763950685, 'iw_n_components': 80, 'iw_logistic_c': 2.643425947708109, 'iw_pca_fit': 'combined', 'iw_solver': 'lbfgs', 'iw_rho': 0.85}. Best is trial 223 with value: 0.23705194687121506.
2026-06-01 21:06:54 | INFO | Trial 286 | outer=6 | alpha=7.484e+04 n_pcs=4000 (pc_topk) weight={'name': 'pc_logistic', 'floor': 1e-06, 'clip_max': 1.5, 'prob_clip': 0.015916542714194837, 'n_components': 80, 'logistic_c': 0.8060973271366734, 'pca_fit': 'combined', 'solver': 'lbfgs', 'max_iter': 2000, 'fit_intercept': True, 'standardize_with_source': True, 'rho': 0.85}
[I 2026-06-01 21:07:20,157] Trial 286 finished with value: 0.23693562964574116 and parameters: {'alpha': 74838.37849094797, 'n_pcs': 4000, 'iw_method': 'pc_logistic', 'iw_clip_max': 1.5, 'iw_prob_clip': 0.015916542714194837, 'iw_n_components': 80, 'iw_logistic_c': 0.8060973271366734, 'iw_pca_fit': 'combined', 'iw_solver': 'lbfgs', 'iw_rho': 0.85}. Best is trial 223 with value: 0.23705194687121506.
2026-06-01 21:07:20 | INFO | Trial 287 | outer=6 | alpha=7.117e+04 n_pcs=4000 (pc_topk) weight={'name': 'pc_logistic', 'floor': 1e-06, 'clip_max': 1.5, 'prob_clip': 0.0005506614372552619, 'n_components': 80, 'logistic_c': 1.5802209181183178, 'pca_fit': 'combined', 'solver': 'lbfgs', 'max_iter': 2000, 'fit_intercept': True, 'standardize_with_source': True, 'rho': 0.85}
[I 2026-06-01 21:07:47,348] Trial 287 finished with value: 0.22865251410762372 and parameters: {'alpha': 71171.00029404456, 'n_pcs': 4000, 'iw_method': 'pc_logistic', 'iw_clip_max': 1.5, 'iw_prob_clip': 0.0005506614372552619, 'iw_n_components': 80, 'iw_logistic_c': 1.5802209181183178, 'iw_pca_fit': 'combined', 'iw_solver': 'lbfgs', 'iw_rho': 0.85}. Best is trial 223 with value: 0.23705194687121506.
2026-06-01 21:07:47 | INFO | Trial 288 | outer=6 | alpha=1.292e+05 n_pcs=4000 (pc_topk) weight={'name': 'pc_logistic', 'floor': 1e-06, 'clip_max': 1.5, 'prob_clip': 0.015914147969043814, 'n_components': 80, 'logistic_c': 0.802844027260278, 'pca_fit': 'combined', 'solver': 'lbfgs', 'max_iter': 2000, 'fit_intercept': True, 'standardize_with_source': True, 'rho': 0.85}
[I 2026-06-01 21:08:13,591] Trial 288 finished with value: 0.2351362454811981 and parameters: {'alpha': 129208.81449142023, 'n_pcs': 4000, 'iw_method': 'pc_logistic', 'iw_clip_max': 1.5, 'iw_prob_clip': 0.015914147969043814, 'iw_n_components': 80, 'iw_logistic_c': 0.802844027260278, 'iw_pca_fit': 'combined', 'iw_solver': 'lbfgs', 'iw_rho': 0.85}. Best is trial 223 with value: 0.23705194687121506.
2026-06-01 21:08:13 | INFO | Trial 289 | outer=6 | alpha=6.250e+04 n_pcs=4000 (pc_topk) weight={'name': 'pc_logistic', 'floor': 1e-06, 'clip_max': 1.5, 'prob_clip': 0.016083244700547172, 'n_components': 80, 'logistic_c': 1.0881112972539642, 'pca_fit': 'combined', 'solver': 'lbfgs', 'max_iter': 2000, 'fit_intercept': True, 'standardize_with_source': True, 'rho': 0.85}
[I 2026-06-01 21:08:37,871] Trial 289 finished with value: 0.23684978178944327 and parameters: {'alpha': 62499.14486379279, 'n_pcs': 4000, 'iw_method': 'pc_logistic', 'iw_clip_max': 1.5, 'iw_prob_clip': 0.016083244700547172, 'iw_n_components': 80, 'iw_logistic_c': 1.0881112972539642, 'iw_pca_fit': 'combined', 'iw_solver': 'lbfgs', 'iw_rho': 0.85}. Best is trial 223 with value: 0.23705194687121506.
2026-06-01 21:08:37 | INFO | Trial 290 | outer=6 | alpha=6.217e+04 n_pcs=4000 (pc_topk) weight={'name': 'pc_logistic', 'floor': 1e-06, 'clip_max': 1.5, 'prob_clip': 0.02003158689222114, 'n_components': 80, 'logistic_c': 1.0499007488658916, 'pca_fit': 'combined', 'solver': 'lbfgs', 'max_iter': 2000, 'fit_intercept': True, 'standardize_with_source': True, 'rho': 0.85}
