[I 2026-06-02 00:08:28,916] Trial 198 finished with value: 0.23129419248509642 and parameters: {'alpha': 82859.2513829088, 'n_pcs': 5000, 'iw_method': 'pc_logistic', 'iw_clip_max': 2.5, 'iw_prob_clip': 0.010929461612838661, 'iw_n_components': 60, 'iw_logistic_c': 0.23589699278262027, 'iw_pca_fit': 'combined', 'iw_solver': 'lbfgs', 'iw_rho': 0.7}. Best is trial 198 with value: 0.23129419248509642.
2026-06-02 00:08:28 | INFO | Trial 199 | outer=9 | alpha=7.796e+04 n_pcs=5000 (pc_topk) weight={'name': 'pc_logistic', 'floor': 1e-06, 'clip_max': 2.5, 'prob_clip': 0.010768355414791821, 'n_components': 60, 'logistic_c': 0.18952608662582865, 'pca_fit': 'combined', 'solver': 'lbfgs', 'max_iter': 2000, 'fit_intercept': True, 'standardize_with_source': True, 'rho': 0.7}
[I 2026-06-02 00:08:53,822] Trial 199 finished with value: 0.2313819200011685 and parameters: {'alpha': 77960.13174184886, 'n_pcs': 5000, 'iw_method': 'pc_logistic', 'iw_clip_max': 2.5, 'iw_prob_clip': 0.010768355414791821, 'iw_n_components': 60, 'iw_logistic_c': 0.18952608662582865, 'iw_pca_fit': 'combined', 'iw_solver': 'lbfgs', 'iw_rho': 0.7}. Best is trial 199 with value: 0.2313819200011685.
2026-06-02 00:08:53 | INFO | Trial 200 | outer=9 | alpha=7.979e+04 n_pcs=5000 (pc_topk) weight={'name': 'pc_logistic', 'floor': 1e-06, 'clip_max': 2.5, 'prob_clip': 0.011927417881024836, 'n_components': 60, 'logistic_c': 0.16391935203830446, 'pca_fit': 'combined', 'solver': 'lbfgs', 'max_iter': 2000, 'fit_intercept': True, 'standardize_with_source': True, 'rho': 0.7}
[I 2026-06-02 00:09:18,780] Trial 200 finished with value: 0.23154620237136161 and parameters: {'alpha': 79785.33456535108, 'n_pcs': 5000, 'iw_method': 'pc_logistic', 'iw_clip_max': 2.5, 'iw_prob_clip': 0.011927417881024836, 'iw_n_components': 60, 'iw_logistic_c': 0.16391935203830446, 'iw_pca_fit': 'combined', 'iw_solver': 'lbfgs', 'iw_rho': 0.7}. Best is trial 200 with value: 0.23154620237136161.
2026-06-02 00:09:18 | INFO | Trial 201 | outer=9 | alpha=7.842e+04 n_pcs=5000 (pc_topk) weight={'name': 'pc_logistic', 'floor': 1e-06, 'clip_max': 2.5, 'prob_clip': 0.01122087790646904, 'n_components': 60, 'logistic_c': 0.15663229416503788, 'pca_fit': 'combined', 'solver': 'lbfgs', 'max_iter': 2000, 'fit_intercept': True, 'standardize_with_source': True, 'rho': 0.7}
[I 2026-06-02 00:09:43,389] Trial 201 finished with value: 0.23144064751449633 and parameters: {'alpha': 78421.18842690779, 'n_pcs': 5000, 'iw_method': 'pc_logistic', 'iw_clip_max': 2.5, 'iw_prob_clip': 0.01122087790646904, 'iw_n_components': 60, 'iw_logistic_c': 0.15663229416503788, 'iw_pca_fit': 'combined', 'iw_solver': 'lbfgs', 'iw_rho': 0.7}. Best is trial 200 with value: 0.23154620237136161.
2026-06-02 00:09:43 | INFO | Trial 202 | outer=9 | alpha=7.725e+04 n_pcs=5000 (pc_topk) weight={'name': 'pc_logistic', 'floor': 1e-06, 'clip_max': 2.5, 'prob_clip': 0.011117481897812464, 'n_components': 60, 'logistic_c': 0.1696297771863597, 'pca_fit': 'combined', 'solver': 'lbfgs', 'max_iter': 2000, 'fit_intercept': True, 'standardize_with_source': True, 'rho': 0.7}
[I 2026-06-02 00:10:08,029] Trial 202 finished with value: 0.23144974762577014 and parameters: {'alpha': 77246.01426921922, 'n_pcs': 5000, 'iw_method': 'pc_logistic', 'iw_clip_max': 2.5, 'iw_prob_clip': 0.011117481897812464, 'iw_n_components': 60, 'iw_logistic_c': 0.1696297771863597, 'iw_pca_fit': 'combined', 'iw_solver': 'lbfgs', 'iw_rho': 0.7}. Best is trial 200 with value: 0.23154620237136161.
2026-06-02 00:10:08 | INFO | Trial 203 | outer=9 | alpha=8.026e+04 n_pcs=5000 (pc_topk) weight={'name': 'pc_logistic', 'floor': 1e-06, 'clip_max': 2.5, 'prob_clip': 0.011554522458360337, 'n_components': 60, 'logistic_c': 0.14128176573274018, 'pca_fit': 'combined', 'solver': 'lbfgs', 'max_iter': 2000, 'fit_intercept': True, 'standardize_with_source': True, 'rho': 0.7}
[I 2026-06-02 00:10:32,786] Trial 203 finished with value: 0.2314223582343901 and parameters: {'alpha': 80262.32856447535, 'n_pcs': 5000, 'iw_method': 'pc_logistic', 'iw_clip_max': 2.5, 'iw_prob_clip': 0.011554522458360337, 'iw_n_components': 60, 'iw_logistic_c': 0.14128176573274018, 'iw_pca_fit': 'combined', 'iw_solver': 'lbfgs', 'iw_rho': 0.7}. Best is trial 200 with value: 0.23154620237136161.
2026-06-02 00:10:32 | INFO | Trial 204 | outer=9 | alpha=7.322e+04 n_pcs=5000 (pc_topk) weight={'name': 'pc_logistic', 'floor': 1e-06, 'clip_max': 2.5, 'prob_clip': 0.011341420684818844, 'n_components': 60, 'logistic_c': 0.17401375801679966, 'pca_fit': 'combined', 'solver': 'lbfgs', 'max_iter': 2000, 'fit_intercept': True, 'standardize_with_source': True, 'rho': 0.7}
[I 2026-06-02 00:10:59,254] Trial 204 finished with value: 0.23156398697889977 and parameters: {'alpha': 73219.4251139277, 'n_pcs': 5000, 'iw_method': 'pc_logistic', 'iw_clip_max': 2.5, 'iw_prob_clip': 0.011341420684818844, 'iw_n_components': 60, 'iw_logistic_c': 0.17401375801679966, 'iw_pca_fit': 'combined', 'iw_solver': 'lbfgs', 'iw_rho': 0.7}. Best is trial 204 with value: 0.23156398697889977.
2026-06-02 00:10:59 | INFO | Trial 205 | outer=9 | alpha=6.216e+04 n_pcs=5000 (pc_topk) weight={'name': 'pc_logistic', 'floor': 1e-06, 'clip_max': 2.5, 'prob_clip': 0.01142332657261662, 'n_components': 60, 'logistic_c': 0.2003405793243476, 'pca_fit': 'combined', 'solver': 'lbfgs', 'max_iter': 2000, 'fit_intercept': True, 'standardize_with_source': True, 'rho': 0.7}
[I 2026-06-02 00:11:24,841] Trial 205 finished with value: 0.2317100506551908 and parameters: {'alpha': 62160.2637403936, 'n_pcs': 5000, 'iw_method': 'pc_logistic', 'iw_clip_max': 2.5, 'iw_prob_clip': 0.01142332657261662, 'iw_n_components': 60, 'iw_logistic_c': 0.2003405793243476, 'iw_pca_fit': 'combined', 'iw_solver': 'lbfgs', 'iw_rho': 0.7}. Best is trial 205 with value: 0.2317100506551908.
2026-06-02 00:11:24 | INFO | Trial 206 | outer=9 | alpha=6.836e+04 n_pcs=5000 (pc_topk) weight={'name': 'pc_logistic', 'floor': 1e-06, 'clip_max': 2.5, 'prob_clip': 0.012478022485188995, 'n_components': 60, 'logistic_c': 0.1693193223748254, 'pca_fit': 'combined', 'solver': 'lbfgs', 'max_iter': 2000, 'fit_intercept': True, 'standardize_with_source': True, 'rho': 0.7}
[I 2026-06-02 00:11:50,167] Trial 206 finished with value: 0.23190760547395345 and parameters: {'alpha': 68362.07181830588, 'n_pcs': 5000, 'iw_method': 'pc_logistic', 'iw_clip_max': 2.5, 'iw_prob_clip': 0.012478022485188995, 'iw_n_components': 60, 'iw_logistic_c': 0.1693193223748254, 'iw_pca_fit': 'combined', 'iw_solver': 'lbfgs', 'iw_rho': 0.7}. Best is trial 206 with value: 0.23190760547395345.
2026-06-02 00:11:50 | INFO | Trial 207 | outer=9 | alpha=6.773e+04 n_pcs=5000 (pc_topk) weight={'name': 'pc_logistic', 'floor': 1e-06, 'clip_max': 2.5, 'prob_clip': 0.0118639986944403, 'n_components': 60, 'logistic_c': 0.16477353355152208, 'pca_fit': 'combined', 'solver': 'lbfgs', 'max_iter': 2000, 'fit_intercept': True, 'standardize_with_source': True, 'rho': 0.7}
[I 2026-06-02 00:12:15,959] Trial 207 finished with value: 0.23175522755208036 and parameters: {'alpha': 67728.17590297214, 'n_pcs': 5000, 'iw_method': 'pc_logistic', 'iw_clip_max': 2.5, 'iw_prob_clip': 0.0118639986944403, 'iw_n_components': 60, 'iw_logistic_c': 0.16477353355152208, 'iw_pca_fit': 'combined', 'iw_solver': 'lbfgs', 'iw_rho': 0.7}. Best is trial 206 with value: 0.23190760547395345.
2026-06-02 00:12:15 | INFO | Trial 208 | outer=9 | alpha=6.626e+04 n_pcs=5000 (pc_topk) weight={'name': 'pc_logistic', 'floor': 1e-06, 'clip_max': 2.5, 'prob_clip': 0.011700852767979058, 'n_components': 80, 'logistic_c': 0.15160886298011786, 'pca_fit': 'combined', 'solver': 'lbfgs', 'max_iter': 2000, 'fit_intercept': True, 'standardize_with_source': True, 'rho': 0.7}
[I 2026-06-02 00:12:42,573] Trial 208 finished with value: 0.232287863416547 and parameters: {'alpha': 66262.54436909719, 'n_pcs': 5000, 'iw_method': 'pc_logistic', 'iw_clip_max': 2.5, 'iw_prob_clip': 0.011700852767979058, 'iw_n_components': 80, 'iw_logistic_c': 0.15160886298011786, 'iw_pca_fit': 'combined', 'iw_solver': 'lbfgs', 'iw_rho': 0.7}. Best is trial 208 with value: 0.232287863416547.
2026-06-02 00:12:42 | INFO | Trial 209 | outer=9 | alpha=7.056e+04 n_pcs=5000 (pc_topk) weight={'name': 'pc_logistic', 'floor': 1e-06, 'clip_max': 2.5, 'prob_clip': 0.012160988390541999, 'n_components': 80, 'logistic_c': 0.14727043409594084, 'pca_fit': 'combined', 'solver': 'lbfgs', 'max_iter': 2000, 'fit_intercept': True, 'standardize_with_source': True, 'rho': 0.7}
[I 2026-06-02 00:13:08,273] Trial 209 finished with value: 0.23208984141131625 and parameters: {'alpha': 70556.93474763779, 'n_pcs': 5000, 'iw_method': 'pc_logistic', 'iw_clip_max': 2.5, 'iw_prob_clip': 0.012160988390541999, 'iw_n_components': 80, 'iw_logistic_c': 0.14727043409594084, 'iw_pca_fit': 'combined', 'iw_solver': 'lbfgs', 'iw_rho': 0.7}. Best is trial 208 with value: 0.232287863416547.
2026-06-02 00:13:08 | INFO | Trial 210 | outer=9 | alpha=6.766e+04 n_pcs=5000 (pc_topk) weight={'name': 'pc_logistic', 'floor': 1e-06, 'clip_max': 2.5, 'prob_clip': 0.01184758764442674, 'n_components': 20, 'logistic_c': 0.11359447987780424, 'pca_fit': 'combined', 'solver': 'lbfgs', 'max_iter': 2000, 'fit_intercept': True, 'standardize_with_source': True, 'rho': 0.7}
[I 2026-06-02 00:13:29,101] Trial 210 finished with value: 0.22908341348328293 and parameters: {'alpha': 67663.22693838578, 'n_pcs': 5000, 'iw_method': 'pc_logistic', 'iw_clip_max': 2.5, 'iw_prob_clip': 0.01184758764442674, 'iw_n_components': 20, 'iw_logistic_c': 0.11359447987780424, 'iw_pca_fit': 'combined', 'iw_solver': 'lbfgs', 'iw_rho': 0.7}. Best is trial 208 with value: 0.232287863416547.
2026-06-02 00:13:29 | INFO | Trial 211 | outer=9 | alpha=6.150e+04 n_pcs=5000 (pc_topk) weight={'name': 'pc_logistic', 'floor': 1e-06, 'clip_max': 2.5, 'prob_clip': 0.011556498443294174, 'n_components': 80, 'logistic_c': 0.18789476614478437, 'pca_fit': 'combined', 'solver': 'lbfgs', 'max_iter': 2000, 'fit_intercept': True, 'standardize_with_source': True, 'rho': 0.7}
[I 2026-06-02 00:13:54,286] Trial 211 finished with value: 0.232461192271555 and parameters: {'alpha': 61497.86285145963, 'n_pcs': 5000, 'iw_method': 'pc_logistic', 'iw_clip_max': 2.5, 'iw_prob_clip': 0.011556498443294174, 'iw_n_components': 80, 'iw_logistic_c': 0.18789476614478437, 'iw_pca_fit': 'combined', 'iw_solver': 'lbfgs', 'iw_rho': 0.7}. Best is trial 211 with value: 0.232461192271555.
2026-06-02 00:13:54 | INFO | Trial 212 | outer=9 | alpha=6.500e+04 n_pcs=5000 (pc_topk) weight={'name': 'pc_logistic', 'floor': 1e-06, 'clip_max': 2.5, 'prob_clip': 0.011395472629269815, 'n_components': 80, 'logistic_c': 0.13794099306889748, 'pca_fit': 'combined', 'solver': 'lbfgs', 'max_iter': 2000, 'fit_intercept': True, 'standardize_with_source': True, 'rho': 0.7}
[I 2026-06-02 00:14:19,943] Trial 212 finished with value: 0.23237365344774846 and parameters: {'alpha': 65000.06341096938, 'n_pcs': 5000, 'iw_method': 'pc_logistic', 'iw_clip_max': 2.5, 'iw_prob_clip': 0.011395472629269815, 'iw_n_components': 80, 'iw_logistic_c': 0.13794099306889748, 'iw_pca_fit': 'combined', 'iw_solver': 'lbfgs', 'iw_rho': 0.7}. Best is trial 211 with value: 0.232461192271555.
2026-06-02 00:14:19 | INFO | Trial 213 | outer=9 | alpha=6.403e+04 n_pcs=5000 (pc_topk) weight={'name': 'pc_logistic', 'floor': 1e-06, 'clip_max': 2.5, 'prob_clip': 0.01167975250645174, 'n_components': 80, 'logistic_c': 0.13733702384191493, 'pca_fit': 'combined', 'solver': 'lbfgs', 'max_iter': 2000, 'fit_intercept': True, 'standardize_with_source': True, 'rho': 0.7}
[I 2026-06-02 00:14:45,773] Trial 213 finished with value: 0.2323404116502119 and parameters: {'alpha': 64030.994055709154, 'n_pcs': 5000, 'iw_method': 'pc_logistic', 'iw_clip_max': 2.5, 'iw_prob_clip': 0.01167975250645174, 'iw_n_components': 80, 'iw_logistic_c': 0.13733702384191493, 'iw_pca_fit': 'combined', 'iw_solver': 'lbfgs', 'iw_rho': 0.7}. Best is trial 211 with value: 0.232461192271555.
2026-06-02 00:14:45 | INFO | Trial 214 | outer=9 | alpha=6.749e+04 n_pcs=5000 (pc_topk) weight={'name': 'pc_logistic', 'floor': 1e-06, 'clip_max': 2.5, 'prob_clip': 0.011553169664372314, 'n_components': 80, 'logistic_c': 0.12764057466679027, 'pca_fit': 'combined', 'solver': 'lbfgs', 'max_iter': 2000, 'fit_intercept': True, 'standardize_with_source': True, 'rho': 0.7}
[I 2026-06-02 00:15:12,185] Trial 214 finished with value: 0.23225081047684668 and parameters: {'alpha': 67492.27848545974, 'n_pcs': 5000, 'iw_method': 'pc_logistic', 'iw_clip_max': 2.5, 'iw_prob_clip': 0.011553169664372314, 'iw_n_components': 80, 'iw_logistic_c': 0.12764057466679027, 'iw_pca_fit': 'combined', 'iw_solver': 'lbfgs', 'iw_rho': 0.7}. Best is trial 211 with value: 0.232461192271555.
2026-06-02 00:15:12 | INFO | Trial 215 | outer=9 | alpha=6.507e+04 n_pcs=5000 (pc_topk) weight={'name': 'pc_logistic', 'floor': 1e-06, 'clip_max': 2.5, 'prob_clip': 0.01144974192720372, 'n_components': 80, 'logistic_c': 0.14996773041307276, 'pca_fit': 'combined', 'solver': 'lbfgs', 'max_iter': 2000, 'fit_intercept': True, 'standardize_with_source': True, 'rho': 0.7}
[I 2026-06-02 00:15:36,309] Trial 215 finished with value: 0.23234599764462685 and parameters: {'alpha': 65068.67739359286, 'n_pcs': 5000, 'iw_method': 'pc_logistic', 'iw_clip_max': 2.5, 'iw_prob_clip': 0.01144974192720372, 'iw_n_components': 80, 'iw_logistic_c': 0.14996773041307276, 'iw_pca_fit': 'combined', 'iw_solver': 'lbfgs', 'iw_rho': 0.7}. Best is trial 211 with value: 0.232461192271555.
2026-06-02 00:15:36 | INFO | Trial 216 | outer=9 | alpha=6.121e+04 n_pcs=5000 (pc_topk) weight={'name': 'pc_logistic', 'floor': 1e-06, 'clip_max': 2.5, 'prob_clip': 0.012177000604847034, 'n_components': 80, 'logistic_c': 0.12645246934981882, 'pca_fit': 'combined', 'solver': 'lbfgs', 'max_iter': 2000, 'fit_intercept': True, 'standardize_with_source': True, 'rho': 0.7}
[I 2026-06-02 00:16:01,533] Trial 216 finished with value: 0.23224776360095759 and parameters: {'alpha': 61210.390818949825, 'n_pcs': 5000, 'iw_method': 'pc_logistic', 'iw_clip_max': 2.5, 'iw_prob_clip': 0.012177000604847034, 'iw_n_components': 80, 'iw_logistic_c': 0.12645246934981882, 'iw_pca_fit': 'combined', 'iw_solver': 'lbfgs', 'iw_rho': 0.7}. Best is trial 211 with value: 0.232461192271555.
2026-06-02 00:16:01 | INFO | Trial 217 | outer=9 | alpha=6.297e+04 n_pcs=5000 (pc_topk) weight={'name': 'pc_logistic', 'floor': 1e-06, 'clip_max': 2.5, 'prob_clip': 0.011853984640096803, 'n_components': 80, 'logistic_c': 0.11763257436096897, 'pca_fit': 'combined', 'solver': 'lbfgs', 'max_iter': 2000, 'fit_intercept': True, 'standardize_with_source': True, 'rho': 0.7}
[I 2026-06-02 00:16:26,694] Trial 217 finished with value: 0.2322938322220188 and parameters: {'alpha': 62974.38672018403, 'n_pcs': 5000, 'iw_method': 'pc_logistic', 'iw_clip_max': 2.5, 'iw_prob_clip': 0.011853984640096803, 'iw_n_components': 80, 'iw_logistic_c': 0.11763257436096897, 'iw_pca_fit': 'combined', 'iw_solver': 'lbfgs', 'iw_rho': 0.7}. Best is trial 211 with value: 0.232461192271555.
2026-06-02 00:16:26 | INFO | Trial 218 | outer=9 | alpha=6.493e+04 n_pcs=5000 (pc_topk) weight={'name': 'pc_logistic', 'floor': 1e-06, 'clip_max': 12.0, 'prob_clip': 0.011888968046048567, 'n_components': 80, 'logistic_c': 0.09843551640597287, 'pca_fit': 'combined', 'solver': 'lbfgs', 'max_iter': 2000, 'fit_intercept': True, 'standardize_with_source': True, 'rho': 1.0}
2026-06-02 00:16:53 | INFO | Trial 218 rejected by ESS guard: mean_ess=664.88 threshold=1027.26
[I 2026-06-02 00:16:53,533] Trial 218 finished with value: -1.0 and parameters: {'alpha': 64933.61130621119, 'n_pcs': 5000, 'iw_method': 'pc_logistic', 'iw_clip_max': 12.0, 'iw_prob_clip': 0.011888968046048567, 'iw_n_components': 80, 'iw_logistic_c': 0.09843551640597287, 'iw_pca_fit': 'combined', 'iw_solver': 'lbfgs', 'iw_rho': 1.0}. Best is trial 211 with value: 0.232461192271555.
2026-06-02 00:16:53 | INFO | Trial 219 | outer=9 | alpha=6.726e+04 n_pcs=5000 (pc_topk) weight={'name': 'pc_logistic', 'floor': 1e-06, 'clip_max': 2.5, 'prob_clip': 0.011260727061742833, 'n_components': 80, 'logistic_c': 0.20842305947448805, 'pca_fit': 'combined', 'solver': 'lbfgs', 'max_iter': 2000, 'fit_intercept': True, 'standardize_with_source': True, 'rho': 0.7}
[I 2026-06-02 00:17:18,869] Trial 219 finished with value: 0.2324083696829394 and parameters: {'alpha': 67256.44129788548, 'n_pcs': 5000, 'iw_method': 'pc_logistic', 'iw_clip_max': 2.5, 'iw_prob_clip': 0.011260727061742833, 'iw_n_components': 80, 'iw_logistic_c': 0.20842305947448805, 'iw_pca_fit': 'combined', 'iw_solver': 'lbfgs', 'iw_rho': 0.7}. Best is trial 211 with value: 0.232461192271555.
2026-06-02 00:17:18 | INFO | Trial 220 | outer=9 | alpha=7.199e+04 n_pcs=5000 (pc_topk) weight={'name': 'pc_logistic', 'floor': 1e-06, 'clip_max': 7.0, 'prob_clip': 0.01090464467440899, 'n_components': 80, 'logistic_c': 0.1896805529631147, 'pca_fit': 'combined', 'solver': 'lbfgs', 'max_iter': 2000, 'fit_intercept': True, 'standardize_with_source': True, 'rho': 0.7}
[I 2026-06-02 00:17:44,503] Trial 220 finished with value: 0.22829187057106498 and parameters: {'alpha': 71994.4784802744, 'n_pcs': 5000, 'iw_method': 'pc_logistic', 'iw_clip_max': 7.0, 'iw_prob_clip': 0.01090464467440899, 'iw_n_components': 80, 'iw_logistic_c': 0.1896805529631147, 'iw_pca_fit': 'combined', 'iw_solver': 'lbfgs', 'iw_rho': 0.7}. Best is trial 211 with value: 0.232461192271555.
2026-06-02 00:17:44 | INFO | Trial 221 | outer=9 | alpha=6.243e+04 n_pcs=5000 (pc_topk) weight={'name': 'pc_logistic', 'floor': 1e-06, 'clip_max': 2.5, 'prob_clip': 0.01377179725035027, 'n_components': 80, 'logistic_c': 0.044086538014484415, 'pca_fit': 'combined', 'solver': 'lbfgs', 'max_iter': 2000, 'fit_intercept': True, 'standardize_with_source': True, 'rho': 0.7}
[I 2026-06-02 00:18:09,953] Trial 221 finished with value: 0.23172121688441427 and parameters: {'alpha': 62428.81792175619, 'n_pcs': 5000, 'iw_method': 'pc_logistic', 'iw_clip_max': 2.5, 'iw_prob_clip': 0.01377179725035027, 'iw_n_components': 80, 'iw_logistic_c': 0.044086538014484415, 'iw_pca_fit': 'combined', 'iw_solver': 'lbfgs', 'iw_rho': 0.7}. Best is trial 211 with value: 0.232461192271555.
2026-06-02 00:18:09 | INFO | Trial 222 | outer=9 | alpha=6.273e+04 n_pcs=5000 (pc_topk) weight={'name': 'pc_logistic', 'floor': 1e-06, 'clip_max': 2.5, 'prob_clip': 0.014420453591601778, 'n_components': 80, 'logistic_c': 0.04383733672076246, 'pca_fit': 'combined', 'solver': 'lbfgs', 'max_iter': 2000, 'fit_intercept': True, 'standardize_with_source': True, 'rho': 0.7}
[I 2026-06-02 00:18:35,385] Trial 222 finished with value: 0.23163794860148554 and parameters: {'alpha': 62731.72155590811, 'n_pcs': 5000, 'iw_method': 'pc_logistic', 'iw_clip_max': 2.5, 'iw_prob_clip': 0.014420453591601778, 'iw_n_components': 80, 'iw_logistic_c': 0.04383733672076246, 'iw_pca_fit': 'combined', 'iw_solver': 'lbfgs', 'iw_rho': 0.7}. Best is trial 211 with value: 0.232461192271555.
2026-06-02 00:18:35 | INFO | Trial 223 | outer=9 | alpha=7.244e+04 n_pcs=5000 (pc_topk) weight={'name': 'pc_logistic', 'floor': 1e-06, 'clip_max': 2.5, 'prob_clip': 0.014581415911243432, 'n_components': 80, 'logistic_c': 0.044305219097363395, 'pca_fit': 'combined', 'solver': 'lbfgs', 'max_iter': 2000, 'fit_intercept': True, 'standardize_with_source': True, 'rho': 0.7}
[I 2026-06-02 00:19:00,821] Trial 223 finished with value: 0.2312876718964103 and parameters: {'alpha': 72441.94022270995, 'n_pcs': 5000, 'iw_method': 'pc_logistic', 'iw_clip_max': 2.5, 'iw_prob_clip': 0.014581415911243432, 'iw_n_components': 80, 'iw_logistic_c': 0.044305219097363395, 'iw_pca_fit': 'combined', 'iw_solver': 'lbfgs', 'iw_rho': 0.7}. Best is trial 211 with value: 0.232461192271555.
2026-06-02 00:19:00 | INFO | Trial 224 | outer=9 | alpha=5.735e+04 n_pcs=5000 (pc_topk) weight={'name': 'pc_logistic', 'floor': 1e-06, 'clip_max': 1.5, 'prob_clip': 0.014550786617882339, 'n_components': 80, 'logistic_c': 0.04769941672057034, 'pca_fit': 'combined', 'solver': 'lbfgs', 'max_iter': 2000, 'fit_intercept': True, 'standardize_with_source': True, 'rho': 0.3}
[I 2026-06-02 00:19:25,755] Trial 224 finished with value: 0.22788970269196693 and parameters: {'alpha': 57353.432712963935, 'n_pcs': 5000, 'iw_method': 'pc_logistic', 'iw_clip_max': 1.5, 'iw_prob_clip': 0.014550786617882339, 'iw_n_components': 80, 'iw_logistic_c': 0.04769941672057034, 'iw_pca_fit': 'combined', 'iw_solver': 'lbfgs', 'iw_rho': 0.3}. Best is trial 211 with value: 0.232461192271555.
2026-06-02 00:19:25 | INFO | Trial 225 | outer=9 | alpha=7.286e+04 n_pcs=5000 (pc_topk) weight={'name': 'pc_logistic', 'floor': 1e-06, 'clip_max': 2.5, 'prob_clip': 0.013131482799075368, 'n_components': 80, 'logistic_c': 0.1510046316498533, 'pca_fit': 'combined', 'solver': 'lbfgs', 'max_iter': 2000, 'fit_intercept': True, 'standardize_with_source': True, 'rho': 0.7}
[I 2026-06-02 00:19:51,488] Trial 225 finished with value: 0.2318034403768356 and parameters: {'alpha': 72856.90723764888, 'n_pcs': 5000, 'iw_method': 'pc_logistic', 'iw_clip_max': 2.5, 'iw_prob_clip': 0.013131482799075368, 'iw_n_components': 80, 'iw_logistic_c': 0.1510046316498533, 'iw_pca_fit': 'combined', 'iw_solver': 'lbfgs', 'iw_rho': 0.7}. Best is trial 211 with value: 0.232461192271555.
2026-06-02 00:19:51 | INFO | Trial 226 | outer=9 | alpha=6.026e+04 n_pcs=5000 (pc_topk) weight={'name': 'pc_logistic', 'floor': 1e-06, 'clip_max': 4.0, 'prob_clip': 0.012838499511322387, 'n_components': 80, 'logistic_c': 0.16097282496942264, 'pca_fit': 'combined', 'solver': 'lbfgs', 'max_iter': 2000, 'fit_intercept': True, 'standardize_with_source': True, 'rho': 0.5}
