[I 2026-06-01 01:14:32,262] Trial 115 finished with value: 0.22834503934365333 and parameters: {'alpha': 36874.67110925185, 'n_pcs': 4500, 'weight_scheme': 'linear', 'weight_clip_max': 20.0, 'weight_linear_min_weight': 0.4019415860042433, 'weight_linear_max_weight': 4.2197243032844165}. Best is trial 86 with value: 0.22876955329088525.
2026-06-01 01:14:32 | INFO | src.nested_cv_avggrm_weighted_unified | Trial 116 | outer=7 | alpha=5.846e+04 n_pcs=4000 (pc_topk) weight_search=on
2026-06-01 01:14:32 | INFO | src.nested_cv_avggrm_weighted_unified | Trial 116 | outer=7 | weight={'name': 'linear', 'floor': 1e-06, 'clip_max': 20.0, 'min_weight': 0.3408139136855231, 'max_weight': 4.853746012265926}
[I 2026-06-01 01:14:37,897] Trial 116 finished with value: 0.22869332652327756 and parameters: {'alpha': 58457.58949765014, 'n_pcs': 4000, 'weight_scheme': 'linear', 'weight_clip_max': 20.0, 'weight_linear_min_weight': 0.3408139136855231, 'weight_linear_max_weight': 4.853746012265926}. Best is trial 86 with value: 0.22876955329088525.
2026-06-01 01:14:37 | INFO | src.nested_cv_avggrm_weighted_unified | Trial 117 | outer=7 | alpha=3.184e+04 n_pcs=3500 (pc_topk) weight_search=on
2026-06-01 01:14:37 | INFO | src.nested_cv_avggrm_weighted_unified | Trial 117 | outer=7 | weight={'name': 'linear', 'floor': 1e-06, 'clip_max': 20.0, 'min_weight': 0.33368157191121584, 'max_weight': 4.87213039606868}
[I 2026-06-01 01:14:42,755] Trial 117 finished with value: 0.2205538253202552 and parameters: {'alpha': 31842.022881284895, 'n_pcs': 3500, 'weight_scheme': 'linear', 'weight_clip_max': 20.0, 'weight_linear_min_weight': 0.33368157191121584, 'weight_linear_max_weight': 4.87213039606868}. Best is trial 86 with value: 0.22876955329088525.
2026-06-01 01:14:42 | INFO | src.nested_cv_avggrm_weighted_unified | Trial 118 | outer=7 | alpha=4.730e+04 n_pcs=4000 (pc_topk) weight_search=on
2026-06-01 01:14:42 | INFO | src.nested_cv_avggrm_weighted_unified | Trial 118 | outer=7 | weight={'name': 'linear', 'floor': 1e-06, 'clip_max': 20.0, 'min_weight': 0.31267450592576984, 'max_weight': 4.535336486761826}
[I 2026-06-01 01:14:48,413] Trial 118 finished with value: 0.22842443931993245 and parameters: {'alpha': 47299.41038497749, 'n_pcs': 4000, 'weight_scheme': 'linear', 'weight_clip_max': 20.0, 'weight_linear_min_weight': 0.31267450592576984, 'weight_linear_max_weight': 4.535336486761826}. Best is trial 86 with value: 0.22876955329088525.
2026-06-01 01:14:48 | INFO | src.nested_cv_avggrm_weighted_unified | Trial 119 | outer=7 | alpha=1.198e+05 n_pcs=4000 (pc_topk) weight_search=on
2026-06-01 01:14:48 | INFO | src.nested_cv_avggrm_weighted_unified | Trial 119 | outer=7 | weight={'name': 'linear', 'floor': 1e-06, 'clip_max': 20.0, 'min_weight': 0.34987990237447303, 'max_weight': 4.253953659776164}
[I 2026-06-01 01:14:54,068] Trial 119 finished with value: 0.22622470840641123 and parameters: {'alpha': 119826.36865380395, 'n_pcs': 4000, 'weight_scheme': 'linear', 'weight_clip_max': 20.0, 'weight_linear_min_weight': 0.34987990237447303, 'weight_linear_max_weight': 4.253953659776164}. Best is trial 86 with value: 0.22876955329088525.
2026-06-01 01:14:54 | INFO | src.nested_cv_avggrm_weighted_unified | Trial 120 | outer=7 | alpha=6.011e+04 n_pcs=3500 (pc_topk) weight_search=on
2026-06-01 01:14:54 | INFO | src.nested_cv_avggrm_weighted_unified | Trial 120 | outer=7 | weight={'name': 'uniform', 'floor': 1e-06, 'clip_max': 20.0}
[I 2026-06-01 01:14:58,183] Trial 120 finished with value: 0.21510590002319602 and parameters: {'alpha': 60107.321796094315, 'n_pcs': 3500, 'weight_scheme': 'uniform', 'weight_clip_max': 20.0}. Best is trial 86 with value: 0.22876955329088525.
2026-06-01 01:14:58 | INFO | src.nested_cv_avggrm_weighted_unified | Trial 121 | outer=7 | alpha=9.508e+04 n_pcs=4000 (pc_topk) weight_search=on
2026-06-01 01:14:58 | INFO | src.nested_cv_avggrm_weighted_unified | Trial 121 | outer=7 | weight={'name': 'linear', 'floor': 1e-06, 'clip_max': 20.0, 'min_weight': 0.34834868051396495, 'max_weight': 4.756397923285712}
[I 2026-06-01 01:15:03,845] Trial 121 finished with value: 0.22757044309915142 and parameters: {'alpha': 95076.41298660131, 'n_pcs': 4000, 'weight_scheme': 'linear', 'weight_clip_max': 20.0, 'weight_linear_min_weight': 0.34834868051396495, 'weight_linear_max_weight': 4.756397923285712}. Best is trial 86 with value: 0.22876955329088525.
2026-06-01 01:15:03 | INFO | src.nested_cv_avggrm_weighted_unified | Trial 122 | outer=7 | alpha=5.929e+04 n_pcs=4000 (pc_topk) weight_search=on
2026-06-01 01:15:03 | INFO | src.nested_cv_avggrm_weighted_unified | Trial 122 | outer=7 | weight={'name': 'linear', 'floor': 1e-06, 'clip_max': 20.0, 'min_weight': 0.28204940177845333, 'max_weight': 4.848730187682921}
[I 2026-06-01 01:15:09,511] Trial 122 finished with value: 0.2287066146247852 and parameters: {'alpha': 59287.66727776246, 'n_pcs': 4000, 'weight_scheme': 'linear', 'weight_clip_max': 20.0, 'weight_linear_min_weight': 0.28204940177845333, 'weight_linear_max_weight': 4.848730187682921}. Best is trial 86 with value: 0.22876955329088525.
2026-06-01 01:15:09 | INFO | src.nested_cv_avggrm_weighted_unified | Trial 123 | outer=7 | alpha=4.229e+04 n_pcs=4000 (pc_topk) weight_search=on
2026-06-01 01:15:09 | INFO | src.nested_cv_avggrm_weighted_unified | Trial 123 | outer=7 | weight={'name': 'linear', 'floor': 1e-06, 'clip_max': 20.0, 'min_weight': 0.2833232428780326, 'max_weight': 4.355384501691349}
[I 2026-06-01 01:15:15,160] Trial 123 finished with value: 0.2280506952014238 and parameters: {'alpha': 42290.10142258454, 'n_pcs': 4000, 'weight_scheme': 'linear', 'weight_clip_max': 20.0, 'weight_linear_min_weight': 0.2833232428780326, 'weight_linear_max_weight': 4.355384501691349}. Best is trial 86 with value: 0.22876955329088525.
2026-06-01 01:15:15 | INFO | src.nested_cv_avggrm_weighted_unified | Trial 124 | outer=7 | alpha=2.144e+03 n_pcs=4000 (pc_topk) weight_search=on
2026-06-01 01:15:15 | INFO | src.nested_cv_avggrm_weighted_unified | Trial 124 | outer=7 | weight={'name': 'linear', 'floor': 1e-06, 'clip_max': 20.0, 'min_weight': 0.2601442697721265, 'max_weight': 4.859092924662895}
2026-06-01 01:15:18 | INFO | src.nested_cv_avggrm_weighted_unified | Trial 124 | outer=7 | pruned after 5/10 inner folds (mean r=0.1872)
[I 2026-06-01 01:15:18,002] Trial 124 pruned. 
2026-06-01 01:15:18 | INFO | src.nested_cv_avggrm_weighted_unified | Trial 125 | outer=7 | alpha=2.470e+04 n_pcs=4000 (pc_topk) weight_search=on
2026-06-01 01:15:18 | INFO | src.nested_cv_avggrm_weighted_unified | Trial 125 | outer=7 | weight={'name': 'linear', 'floor': 1e-06, 'clip_max': 20.0, 'min_weight': 0.30359133777298797, 'max_weight': 4.634502552758276}
[I 2026-06-01 01:15:23,649] Trial 125 finished with value: 0.22396527770592067 and parameters: {'alpha': 24699.457214951202, 'n_pcs': 4000, 'weight_scheme': 'linear', 'weight_clip_max': 20.0, 'weight_linear_min_weight': 0.30359133777298797, 'weight_linear_max_weight': 4.634502552758276}. Best is trial 86 with value: 0.22876955329088525.
2026-06-01 01:15:23 | INFO | src.nested_cv_avggrm_weighted_unified | Trial 126 | outer=7 | alpha=6.193e+04 n_pcs=4000 (pc_topk) weight_search=on
2026-06-01 01:15:23 | INFO | src.nested_cv_avggrm_weighted_unified | Trial 126 | outer=7 | weight={'name': 'linear', 'floor': 1e-06, 'clip_max': 20.0, 'min_weight': 0.24533896281524661, 'max_weight': 4.430763388526155}
[I 2026-06-01 01:15:29,304] Trial 126 finished with value: 0.2287059344785419 and parameters: {'alpha': 61931.74741861194, 'n_pcs': 4000, 'weight_scheme': 'linear', 'weight_clip_max': 20.0, 'weight_linear_min_weight': 0.24533896281524661, 'weight_linear_max_weight': 4.430763388526155}. Best is trial 86 with value: 0.22876955329088525.
2026-06-01 01:15:29 | INFO | src.nested_cv_avggrm_weighted_unified | Trial 127 | outer=7 | alpha=5.779e+04 n_pcs=3500 (pc_topk) weight_search=on
2026-06-01 01:15:29 | INFO | src.nested_cv_avggrm_weighted_unified | Trial 127 | outer=7 | weight={'name': 'linear', 'floor': 1e-06, 'clip_max': 10.0, 'min_weight': 0.42848191304508043, 'max_weight': 4.489486395507674}
[I 2026-06-01 01:15:34,094] Trial 127 finished with value: 0.22538828224468185 and parameters: {'alpha': 57790.77966679437, 'n_pcs': 3500, 'weight_scheme': 'linear', 'weight_clip_max': 10.0, 'weight_linear_min_weight': 0.42848191304508043, 'weight_linear_max_weight': 4.489486395507674}. Best is trial 86 with value: 0.22876955329088525.
2026-06-01 01:15:34 | INFO | src.nested_cv_avggrm_weighted_unified | Trial 128 | outer=7 | alpha=3.065e+04 n_pcs=4000 (pc_topk) weight_search=on
2026-06-01 01:15:34 | INFO | src.nested_cv_avggrm_weighted_unified | Trial 128 | outer=7 | weight={'name': 'exponential', 'floor': 1e-06, 'clip_max': 20.0, 'beta': 4.410274019593037}
[I 2026-06-01 01:15:39,742] Trial 128 finished with value: 0.22665463646549283 and parameters: {'alpha': 30649.50237805769, 'n_pcs': 4000, 'weight_scheme': 'exponential', 'weight_clip_max': 20.0, 'weight_exponential_beta': 4.410274019593037}. Best is trial 86 with value: 0.22876955329088525.
2026-06-01 01:15:39 | INFO | src.nested_cv_avggrm_weighted_unified | Trial 129 | outer=7 | alpha=8.683e+04 n_pcs=4500 (pc_topk) weight_search=on
2026-06-01 01:15:39 | INFO | src.nested_cv_avggrm_weighted_unified | Trial 129 | outer=7 | weight={'name': 'linear', 'floor': 1e-06, 'clip_max': 20.0, 'min_weight': 0.24624606169535138, 'max_weight': 4.588544445769651}
[I 2026-06-01 01:15:46,595] Trial 129 finished with value: 0.22760733179226236 and parameters: {'alpha': 86832.95965727346, 'n_pcs': 4500, 'weight_scheme': 'linear', 'weight_clip_max': 20.0, 'weight_linear_min_weight': 0.24624606169535138, 'weight_linear_max_weight': 4.588544445769651}. Best is trial 86 with value: 0.22876955329088525.
2026-06-01 01:15:46 | INFO | src.nested_cv_avggrm_weighted_unified | Trial 130 | outer=7 | alpha=5.171e+04 n_pcs=3500 (pc_topk) weight_search=on
2026-06-01 01:15:46 | INFO | src.nested_cv_avggrm_weighted_unified | Trial 130 | outer=7 | weight={'name': 'linear', 'floor': 1e-06, 'clip_max': 20.0, 'min_weight': 0.38895469371400515, 'max_weight': 4.405932482790593}
[I 2026-06-01 01:15:51,389] Trial 130 finished with value: 0.22496880008602593 and parameters: {'alpha': 51709.00050043231, 'n_pcs': 3500, 'weight_scheme': 'linear', 'weight_clip_max': 20.0, 'weight_linear_min_weight': 0.38895469371400515, 'weight_linear_max_weight': 4.405932482790593}. Best is trial 86 with value: 0.22876955329088525.
2026-06-01 01:15:51 | INFO | src.nested_cv_avggrm_weighted_unified | Trial 131 | outer=7 | alpha=7.575e+04 n_pcs=4000 (pc_topk) weight_search=on
2026-06-01 01:15:51 | INFO | src.nested_cv_avggrm_weighted_unified | Trial 131 | outer=7 | weight={'name': 'linear', 'floor': 1e-06, 'clip_max': 20.0, 'min_weight': 0.2742021575547902, 'max_weight': 4.9341565535042005}
[I 2026-06-01 01:15:57,042] Trial 131 finished with value: 0.2284641875610026 and parameters: {'alpha': 75749.87929728001, 'n_pcs': 4000, 'weight_scheme': 'linear', 'weight_clip_max': 20.0, 'weight_linear_min_weight': 0.2742021575547902, 'weight_linear_max_weight': 4.9341565535042005}. Best is trial 86 with value: 0.22876955329088525.
2026-06-01 01:15:57 | INFO | src.nested_cv_avggrm_weighted_unified | Trial 132 | outer=7 | alpha=6.116e+04 n_pcs=4000 (pc_topk) weight_search=on
2026-06-01 01:15:57 | INFO | src.nested_cv_avggrm_weighted_unified | Trial 132 | outer=7 | weight={'name': 'linear', 'floor': 1e-06, 'clip_max': 20.0, 'min_weight': 0.2437942116046413, 'max_weight': 3.9656814087936927}
[I 2026-06-01 01:16:02,701] Trial 132 finished with value: 0.2287041985068008 and parameters: {'alpha': 61156.25981205924, 'n_pcs': 4000, 'weight_scheme': 'linear', 'weight_clip_max': 20.0, 'weight_linear_min_weight': 0.2437942116046413, 'weight_linear_max_weight': 3.9656814087936927}. Best is trial 86 with value: 0.22876955329088525.
2026-06-01 01:16:02 | INFO | src.nested_cv_avggrm_weighted_unified | Trial 133 | outer=7 | alpha=4.477e+04 n_pcs=4000 (pc_topk) weight_search=on
2026-06-01 01:16:02 | INFO | src.nested_cv_avggrm_weighted_unified | Trial 133 | outer=7 | weight={'name': 'linear', 'floor': 1e-06, 'clip_max': 20.0, 'min_weight': 0.3640503399851098, 'max_weight': 4.6801374993760785}
[I 2026-06-01 01:16:08,359] Trial 133 finished with value: 0.22828975967484277 and parameters: {'alpha': 44774.02184086123, 'n_pcs': 4000, 'weight_scheme': 'linear', 'weight_clip_max': 20.0, 'weight_linear_min_weight': 0.3640503399851098, 'weight_linear_max_weight': 4.6801374993760785}. Best is trial 86 with value: 0.22876955329088525.
2026-06-01 01:16:08 | INFO | src.nested_cv_avggrm_weighted_unified | Trial 134 | outer=7 | alpha=5.842e+04 n_pcs=4000 (pc_topk) weight_search=on
2026-06-01 01:16:08 | INFO | src.nested_cv_avggrm_weighted_unified | Trial 134 | outer=7 | weight={'name': 'linear', 'floor': 1e-06, 'clip_max': 20.0, 'min_weight': 0.32263790749519794, 'max_weight': 3.9357379792248905}
[I 2026-06-01 01:16:14,019] Trial 134 finished with value: 0.22865950249004202 and parameters: {'alpha': 58416.41439728002, 'n_pcs': 4000, 'weight_scheme': 'linear', 'weight_clip_max': 20.0, 'weight_linear_min_weight': 0.32263790749519794, 'weight_linear_max_weight': 3.9357379792248905}. Best is trial 86 with value: 0.22876955329088525.
2026-06-01 01:16:14 | INFO | src.nested_cv_avggrm_weighted_unified | Trial 135 | outer=7 | alpha=3.865e+04 n_pcs=4000 (pc_topk) weight_search=on
2026-06-01 01:16:14 | INFO | src.nested_cv_avggrm_weighted_unified | Trial 135 | outer=7 | weight={'name': 'linear', 'floor': 1e-06, 'clip_max': 5.0, 'min_weight': 0.2442922356553765, 'max_weight': 3.86992248464474}
[I 2026-06-01 01:16:19,699] Trial 135 finished with value: 0.22762475318072278 and parameters: {'alpha': 38654.45288105888, 'n_pcs': 4000, 'weight_scheme': 'linear', 'weight_clip_max': 5.0, 'weight_linear_min_weight': 0.2442922356553765, 'weight_linear_max_weight': 3.86992248464474}. Best is trial 86 with value: 0.22876955329088525.
2026-06-01 01:16:19 | INFO | src.nested_cv_avggrm_weighted_unified | Trial 136 | outer=7 | alpha=6.141e+04 n_pcs=4000 (pc_topk) weight_search=on
2026-06-01 01:16:19 | INFO | src.nested_cv_avggrm_weighted_unified | Trial 136 | outer=7 | weight={'name': 'linear', 'floor': 1e-06, 'clip_max': 20.0, 'min_weight': 0.3049002751950105, 'max_weight': 4.821614227616744}
[I 2026-06-01 01:16:25,349] Trial 136 finished with value: 0.22870062334004565 and parameters: {'alpha': 61406.767095733616, 'n_pcs': 4000, 'weight_scheme': 'linear', 'weight_clip_max': 20.0, 'weight_linear_min_weight': 0.3049002751950105, 'weight_linear_max_weight': 4.821614227616744}. Best is trial 86 with value: 0.22876955329088525.
2026-06-01 01:16:25 | INFO | src.nested_cv_avggrm_weighted_unified | Trial 137 | outer=7 | alpha=9.918e+04 n_pcs=4500 (pc_topk) weight_search=on
2026-06-01 01:16:25 | INFO | src.nested_cv_avggrm_weighted_unified | Trial 137 | outer=7 | weight={'name': 'linear', 'floor': 1e-06, 'clip_max': 20.0, 'min_weight': 0.33445003777678073, 'max_weight': 4.842126779813098}
[I 2026-06-01 01:16:32,165] Trial 137 finished with value: 0.2267796429005426 and parameters: {'alpha': 99183.01996234155, 'n_pcs': 4500, 'weight_scheme': 'linear', 'weight_clip_max': 20.0, 'weight_linear_min_weight': 0.33445003777678073, 'weight_linear_max_weight': 4.842126779813098}. Best is trial 86 with value: 0.22876955329088525.
2026-06-01 01:16:32 | INFO | src.nested_cv_avggrm_weighted_unified | Trial 138 | outer=7 | alpha=5.958e+04 n_pcs=4000 (pc_topk) weight_search=on
2026-06-01 01:16:32 | INFO | src.nested_cv_avggrm_weighted_unified | Trial 138 | outer=7 | weight={'name': 'linear', 'floor': 1e-06, 'clip_max': 20.0, 'min_weight': 0.29268962381576075, 'max_weight': 3.6773225377056926}
[I 2026-06-01 01:16:38,036] Trial 138 finished with value: 0.22866438314513923 and parameters: {'alpha': 59578.62887760794, 'n_pcs': 4000, 'weight_scheme': 'linear', 'weight_clip_max': 20.0, 'weight_linear_min_weight': 0.29268962381576075, 'weight_linear_max_weight': 3.6773225377056926}. Best is trial 86 with value: 0.22876955329088525.
2026-06-01 01:16:38 | INFO | src.nested_cv_avggrm_weighted_unified | Trial 139 | outer=7 | alpha=6.094e+04 n_pcs=4500 (pc_topk) weight_search=on
2026-06-01 01:16:38 | INFO | src.nested_cv_avggrm_weighted_unified | Trial 139 | outer=7 | weight={'name': 'linear', 'floor': 1e-06, 'clip_max': 20.0, 'min_weight': 0.20310566479946449, 'max_weight': 3.6808590934848957}
[I 2026-06-01 01:16:44,889] Trial 139 finished with value: 0.228638923863672 and parameters: {'alpha': 60940.95226012889, 'n_pcs': 4500, 'weight_scheme': 'linear', 'weight_clip_max': 20.0, 'weight_linear_min_weight': 0.20310566479946449, 'weight_linear_max_weight': 3.6808590934848957}. Best is trial 86 with value: 0.22876955329088525.
2026-06-01 01:16:44 | INFO | src.nested_cv_avggrm_weighted_unified | Trial 140 | outer=7 | alpha=1.256e+05 n_pcs=3500 (pc_topk) weight_search=on
2026-06-01 01:16:44 | INFO | src.nested_cv_avggrm_weighted_unified | Trial 140 | outer=7 | weight={'name': 'linear', 'floor': 1e-06, 'clip_max': 20.0, 'min_weight': 0.2564784103996939, 'max_weight': 3.7724104903864077}
[I 2026-06-01 01:16:49,790] Trial 140 finished with value: 0.22469501486138635 and parameters: {'alpha': 125643.86868019371, 'n_pcs': 3500, 'weight_scheme': 'linear', 'weight_clip_max': 20.0, 'weight_linear_min_weight': 0.2564784103996939, 'weight_linear_max_weight': 3.7724104903864077}. Best is trial 86 with value: 0.22876955329088525.
2026-06-01 01:16:49 | INFO | src.nested_cv_avggrm_weighted_unified | Trial 141 | outer=7 | alpha=5.839e+04 n_pcs=4000 (pc_topk) weight_search=on
2026-06-01 01:16:49 | INFO | src.nested_cv_avggrm_weighted_unified | Trial 141 | outer=7 | weight={'name': 'linear', 'floor': 1e-06, 'clip_max': 20.0, 'min_weight': 0.2946531795994376, 'max_weight': 3.9381109777026224}
[I 2026-06-01 01:16:55,504] Trial 141 finished with value: 0.22868263634177594 and parameters: {'alpha': 58393.428351524686, 'n_pcs': 4000, 'weight_scheme': 'linear', 'weight_clip_max': 20.0, 'weight_linear_min_weight': 0.2946531795994376, 'weight_linear_max_weight': 3.9381109777026224}. Best is trial 86 with value: 0.22876955329088525.
2026-06-01 01:16:55 | INFO | src.nested_cv_avggrm_weighted_unified | Trial 142 | outer=7 | alpha=8.545e+04 n_pcs=4000 (pc_topk) weight_search=on
2026-06-01 01:16:55 | INFO | src.nested_cv_avggrm_weighted_unified | Trial 142 | outer=7 | weight={'name': 'linear', 'floor': 1e-06, 'clip_max': 20.0, 'min_weight': 0.28022390881006254, 'max_weight': 4.016137260193183}
[I 2026-06-01 01:17:01,097] Trial 142 finished with value: 0.228025548703482 and parameters: {'alpha': 85448.12657511281, 'n_pcs': 4000, 'weight_scheme': 'linear', 'weight_clip_max': 20.0, 'weight_linear_min_weight': 0.28022390881006254, 'weight_linear_max_weight': 4.016137260193183}. Best is trial 86 with value: 0.22876955329088525.
2026-06-01 01:17:01 | INFO | src.nested_cv_avggrm_weighted_unified | Trial 143 | outer=7 | alpha=3.588e+04 n_pcs=4000 (pc_topk) weight_search=on
2026-06-01 01:17:01 | INFO | src.nested_cv_avggrm_weighted_unified | Trial 143 | outer=7 | weight={'name': 'linear', 'floor': 1e-06, 'clip_max': 20.0, 'min_weight': 0.3099450041792703, 'max_weight': 3.95889492185569}
[I 2026-06-01 01:17:06,727] Trial 143 finished with value: 0.22730926449560393 and parameters: {'alpha': 35875.30364829859, 'n_pcs': 4000, 'weight_scheme': 'linear', 'weight_clip_max': 20.0, 'weight_linear_min_weight': 0.3099450041792703, 'weight_linear_max_weight': 3.95889492185569}. Best is trial 86 with value: 0.22876955329088525.
2026-06-01 01:17:06 | INFO | src.nested_cv_avggrm_weighted_unified | Trial 144 | outer=7 | alpha=6.055e+04 n_pcs=4000 (pc_topk) weight_search=on
2026-06-01 01:17:06 | INFO | src.nested_cv_avggrm_weighted_unified | Trial 144 | outer=7 | weight={'name': 'linear', 'floor': 1e-06, 'clip_max': 20.0, 'min_weight': 0.33805906242076056, 'max_weight': 3.854014747038163}
[I 2026-06-01 01:17:12,361] Trial 144 finished with value: 0.2286205392074972 and parameters: {'alpha': 60551.38703660822, 'n_pcs': 4000, 'weight_scheme': 'linear', 'weight_clip_max': 20.0, 'weight_linear_min_weight': 0.33805906242076056, 'weight_linear_max_weight': 3.854014747038163}. Best is trial 86 with value: 0.22876955329088525.
2026-06-01 01:17:12 | INFO | src.nested_cv_avggrm_weighted_unified | Trial 145 | outer=7 | alpha=4.471e+04 n_pcs=4000 (pc_topk) weight_search=on
2026-06-01 01:17:12 | INFO | src.nested_cv_avggrm_weighted_unified | Trial 145 | outer=7 | weight={'name': 'linear', 'floor': 1e-06, 'clip_max': 20.0, 'min_weight': 0.36531359842771943, 'max_weight': 3.625471070587936}
[I 2026-06-01 01:17:17,990] Trial 145 finished with value: 0.22827865329982608 and parameters: {'alpha': 44714.60542026912, 'n_pcs': 4000, 'weight_scheme': 'linear', 'weight_clip_max': 20.0, 'weight_linear_min_weight': 0.36531359842771943, 'weight_linear_max_weight': 3.625471070587936}. Best is trial 86 with value: 0.22876955329088525.
2026-06-01 01:17:17 | INFO | src.nested_cv_avggrm_weighted_unified | Trial 146 | outer=7 | alpha=2.976e+04 n_pcs=4000 (pc_topk) weight_search=on
2026-06-01 01:17:18 | INFO | src.nested_cv_avggrm_weighted_unified | Trial 146 | outer=7 | weight={'name': 'linear', 'floor': 1e-06, 'clip_max': 3.0, 'min_weight': 0.2948682974487646, 'max_weight': 3.97785690358068}
