[I 2026-06-01 02:06:05,640] Trial 82 finished with value: 0.2336267415666952 and parameters: {'alpha': 94429.53597641399, 'n_pcs': 3000, 'weight_scheme': 'exponential', 'weight_clip_max': 3.0, 'weight_exponential_beta': 6.198735742547631}. Best is trial 28 with value: 0.2339384975360017.
2026-06-01 02:06:05 | INFO | src.nested_cv_avggrm_weighted_unified | Trial 83 | outer=9 | alpha=2.479e+05 n_pcs=2500 (pc_topk) weight_search=on
2026-06-01 02:06:05 | INFO | src.nested_cv_avggrm_weighted_unified | Trial 83 | outer=9 | weight={'name': 'exponential', 'floor': 1e-06, 'clip_max': 3.0, 'beta': 5.103667542851415}
[I 2026-06-01 02:06:08,623] Trial 83 finished with value: 0.2315425589012498 and parameters: {'alpha': 247883.32397205362, 'n_pcs': 2500, 'weight_scheme': 'exponential', 'weight_clip_max': 3.0, 'weight_exponential_beta': 5.103667542851415}. Best is trial 28 with value: 0.2339384975360017.
2026-06-01 02:06:08 | INFO | src.nested_cv_avggrm_weighted_unified | Trial 84 | outer=9 | alpha=1.479e+05 n_pcs=3000 (pc_topk) weight_search=on
2026-06-01 02:06:08 | INFO | src.nested_cv_avggrm_weighted_unified | Trial 84 | outer=9 | weight={'name': 'exponential', 'floor': 1e-06, 'clip_max': 3.0, 'beta': 7.569931963061246}
[I 2026-06-01 02:06:12,468] Trial 84 finished with value: 0.23439125815864076 and parameters: {'alpha': 147889.3520300258, 'n_pcs': 3000, 'weight_scheme': 'exponential', 'weight_clip_max': 3.0, 'weight_exponential_beta': 7.569931963061246}. Best is trial 84 with value: 0.23439125815864076.
2026-06-01 02:06:12 | INFO | src.nested_cv_avggrm_weighted_unified | OUTER 9 | new best trial 84 (mean inner r=0.2344) saved to outputs/final_results/e6_pc_ridge_avggrm/thr_wing/e6_pc_ridge_avggrm_thr_wing_best_trials/split_09_best_trial.json
2026-06-01 02:06:12 | INFO | src.nested_cv_avggrm_weighted_unified | Trial 85 | outer=9 | alpha=7.095e+04 n_pcs=3500 (pc_topk) weight_search=on
2026-06-01 02:06:12 | INFO | src.nested_cv_avggrm_weighted_unified | Trial 85 | outer=9 | weight={'name': 'exponential', 'floor': 1e-06, 'clip_max': 3.0, 'beta': 8.03850237365149}
[I 2026-06-01 02:06:17,847] Trial 85 finished with value: 0.22968605662104302 and parameters: {'alpha': 70949.45387917034, 'n_pcs': 3500, 'weight_scheme': 'exponential', 'weight_clip_max': 3.0, 'weight_exponential_beta': 8.03850237365149}. Best is trial 84 with value: 0.23439125815864076.
2026-06-01 02:06:17 | INFO | src.nested_cv_avggrm_weighted_unified | Trial 86 | outer=9 | alpha=1.163e+05 n_pcs=3000 (pc_topk) weight_search=on
2026-06-01 02:06:17 | INFO | src.nested_cv_avggrm_weighted_unified | Trial 86 | outer=9 | weight={'name': 'exponential', 'floor': 1e-06, 'clip_max': 20.0, 'beta': 7.553002120343978}
[I 2026-06-01 02:06:21,709] Trial 86 finished with value: 0.224725121511903 and parameters: {'alpha': 116273.48096391407, 'n_pcs': 3000, 'weight_scheme': 'exponential', 'weight_clip_max': 20.0, 'weight_exponential_beta': 7.553002120343978}. Best is trial 84 with value: 0.23439125815864076.
2026-06-01 02:06:21 | INFO | src.nested_cv_avggrm_weighted_unified | Trial 87 | outer=9 | alpha=5.878e+04 n_pcs=2500 (pc_topk) weight_search=on
2026-06-01 02:06:21 | INFO | src.nested_cv_avggrm_weighted_unified | Trial 87 | outer=9 | weight={'name': 'exponential', 'floor': 1e-06, 'clip_max': 3.0, 'beta': 4.4675003086009895}
[I 2026-06-01 02:06:25,606] Trial 87 finished with value: 0.23275859399157617 and parameters: {'alpha': 58780.69879274499, 'n_pcs': 2500, 'weight_scheme': 'exponential', 'weight_clip_max': 3.0, 'weight_exponential_beta': 4.4675003086009895}. Best is trial 84 with value: 0.23439125815864076.
2026-06-01 02:06:25 | INFO | src.nested_cv_avggrm_weighted_unified | Trial 88 | outer=9 | alpha=4.563e+05 n_pcs=3500 (pc_topk) weight_search=on
2026-06-01 02:06:25 | INFO | src.nested_cv_avggrm_weighted_unified | Trial 88 | outer=9 | weight={'name': 'exponential', 'floor': 1e-06, 'clip_max': 3.0, 'beta': 2.6923831253966037}
[I 2026-06-01 02:06:30,463] Trial 88 finished with value: 0.22496825515818206 and parameters: {'alpha': 456346.3496903887, 'n_pcs': 3500, 'weight_scheme': 'exponential', 'weight_clip_max': 3.0, 'weight_exponential_beta': 2.6923831253966037}. Best is trial 84 with value: 0.23439125815864076.
2026-06-01 02:06:30 | INFO | src.nested_cv_avggrm_weighted_unified | Trial 89 | outer=9 | alpha=8.193e+04 n_pcs=3000 (pc_topk) weight_search=on
2026-06-01 02:06:30 | INFO | src.nested_cv_avggrm_weighted_unified | Trial 89 | outer=9 | weight={'name': 'uniform', 'floor': 1e-06, 'clip_max': 3.0}
2026-06-01 02:06:33 | INFO | src.nested_cv_avggrm_weighted_unified | Trial 89 | outer=9 | pruned after 8/10 inner folds (mean r=0.2502)
[I 2026-06-01 02:06:33,139] Trial 89 pruned. 
2026-06-01 02:06:33 | INFO | src.nested_cv_avggrm_weighted_unified | Trial 90 | outer=9 | alpha=2.167e+04 n_pcs=2500 (pc_topk) weight_search=on
2026-06-01 02:06:33 | INFO | src.nested_cv_avggrm_weighted_unified | Trial 90 | outer=9 | weight={'name': 'exponential', 'floor': 1e-06, 'clip_max': 3.0, 'beta': 3.734111670385466}
[I 2026-06-01 02:06:36,379] Trial 90 finished with value: 0.22280165991690465 and parameters: {'alpha': 21665.614582604467, 'n_pcs': 2500, 'weight_scheme': 'exponential', 'weight_clip_max': 3.0, 'weight_exponential_beta': 3.734111670385466}. Best is trial 84 with value: 0.23439125815864076.
2026-06-01 02:06:36 | INFO | src.nested_cv_avggrm_weighted_unified | Trial 91 | outer=9 | alpha=1.591e+05 n_pcs=3000 (pc_topk) weight_search=on
2026-06-01 02:06:36 | INFO | src.nested_cv_avggrm_weighted_unified | Trial 91 | outer=9 | weight={'name': 'exponential', 'floor': 1e-06, 'clip_max': 3.0, 'beta': 8.833324245599018}
[I 2026-06-01 02:06:40,234] Trial 91 finished with value: 0.23444188122574863 and parameters: {'alpha': 159115.10244174773, 'n_pcs': 3000, 'weight_scheme': 'exponential', 'weight_clip_max': 3.0, 'weight_exponential_beta': 8.833324245599018}. Best is trial 91 with value: 0.23444188122574863.
2026-06-01 02:06:40 | INFO | src.nested_cv_avggrm_weighted_unified | OUTER 9 | new best trial 91 (mean inner r=0.2344) saved to outputs/final_results/e6_pc_ridge_avggrm/thr_wing/e6_pc_ridge_avggrm_thr_wing_best_trials/split_09_best_trial.json
2026-06-01 02:06:40 | INFO | src.nested_cv_avggrm_weighted_unified | Trial 92 | outer=9 | alpha=1.615e+05 n_pcs=3000 (pc_topk) weight_search=on
2026-06-01 02:06:40 | INFO | src.nested_cv_avggrm_weighted_unified | Trial 92 | outer=9 | weight={'name': 'exponential', 'floor': 1e-06, 'clip_max': 3.0, 'beta': 9.244564867176214}
[I 2026-06-01 02:06:44,310] Trial 92 finished with value: 0.2340226412959728 and parameters: {'alpha': 161495.2356681217, 'n_pcs': 3000, 'weight_scheme': 'exponential', 'weight_clip_max': 3.0, 'weight_exponential_beta': 9.244564867176214}. Best is trial 91 with value: 0.23444188122574863.
2026-06-01 02:06:44 | INFO | src.nested_cv_avggrm_weighted_unified | Trial 93 | outer=9 | alpha=1.605e+05 n_pcs=3000 (pc_topk) weight_search=on
2026-06-01 02:06:44 | INFO | src.nested_cv_avggrm_weighted_unified | Trial 93 | outer=9 | weight={'name': 'exponential', 'floor': 1e-06, 'clip_max': 3.0, 'beta': 9.284914743972488}
[I 2026-06-01 02:06:48,170] Trial 93 finished with value: 0.23394440738651362 and parameters: {'alpha': 160454.62889270234, 'n_pcs': 3000, 'weight_scheme': 'exponential', 'weight_clip_max': 3.0, 'weight_exponential_beta': 9.284914743972488}. Best is trial 91 with value: 0.23444188122574863.
2026-06-01 02:06:48 | INFO | src.nested_cv_avggrm_weighted_unified | Trial 94 | outer=9 | alpha=1.784e+05 n_pcs=3000 (pc_topk) weight_search=on
2026-06-01 02:06:48 | INFO | src.nested_cv_avggrm_weighted_unified | Trial 94 | outer=9 | weight={'name': 'exponential', 'floor': 1e-06, 'clip_max': 3.0, 'beta': 9.298039474660229}
[I 2026-06-01 02:06:52,052] Trial 94 finished with value: 0.23417644803958487 and parameters: {'alpha': 178434.89541931963, 'n_pcs': 3000, 'weight_scheme': 'exponential', 'weight_clip_max': 3.0, 'weight_exponential_beta': 9.298039474660229}. Best is trial 91 with value: 0.23444188122574863.
2026-06-01 02:06:52 | INFO | src.nested_cv_avggrm_weighted_unified | Trial 95 | outer=9 | alpha=1.646e+05 n_pcs=2500 (pc_topk) weight_search=on
2026-06-01 02:06:52 | INFO | src.nested_cv_avggrm_weighted_unified | Trial 95 | outer=9 | weight={'name': 'exponential', 'floor': 1e-06, 'clip_max': 3.0, 'beta': 9.263604143588296}
[I 2026-06-01 02:06:55,703] Trial 95 finished with value: 0.23302322864888653 and parameters: {'alpha': 164622.18777938178, 'n_pcs': 2500, 'weight_scheme': 'exponential', 'weight_clip_max': 3.0, 'weight_exponential_beta': 9.263604143588296}. Best is trial 91 with value: 0.23444188122574863.
2026-06-01 02:06:55 | INFO | src.nested_cv_avggrm_weighted_unified | Trial 96 | outer=9 | alpha=2.891e+05 n_pcs=3000 (pc_topk) weight_search=on
2026-06-01 02:06:55 | INFO | src.nested_cv_avggrm_weighted_unified | Trial 96 | outer=9 | weight={'name': 'exponential', 'floor': 1e-06, 'clip_max': 3.0, 'beta': 8.923926201517004}
[I 2026-06-01 02:06:59,783] Trial 96 finished with value: 0.23423013857897818 and parameters: {'alpha': 289142.6633724184, 'n_pcs': 3000, 'weight_scheme': 'exponential', 'weight_clip_max': 3.0, 'weight_exponential_beta': 8.923926201517004}. Best is trial 91 with value: 0.23444188122574863.
2026-06-01 02:06:59 | INFO | src.nested_cv_avggrm_weighted_unified | Trial 97 | outer=9 | alpha=3.600e+05 n_pcs=3000 (pc_topk) weight_search=on
2026-06-01 02:06:59 | INFO | src.nested_cv_avggrm_weighted_unified | Trial 97 | outer=9 | weight={'name': 'exponential', 'floor': 1e-06, 'clip_max': None, 'beta': 9.378582229302298}
2026-06-01 02:07:02 | INFO | src.nested_cv_avggrm_weighted_unified | Trial 97 | outer=9 | pruned after 8/10 inner folds (mean r=0.2299)
[I 2026-06-01 02:07:02,821] Trial 97 pruned. 
2026-06-01 02:07:02 | INFO | src.nested_cv_avggrm_weighted_unified | Trial 98 | outer=9 | alpha=2.738e+05 n_pcs=2000 (pc_topk) weight_search=on
2026-06-01 02:07:02 | INFO | src.nested_cv_avggrm_weighted_unified | Trial 98 | outer=9 | weight={'name': 'exponential', 'floor': 1e-06, 'clip_max': 3.0, 'beta': 8.479066886414588}
[I 2026-06-01 02:07:05,042] Trial 98 finished with value: 0.23133320643406638 and parameters: {'alpha': 273762.10704409983, 'n_pcs': 2000, 'weight_scheme': 'exponential', 'weight_clip_max': 3.0, 'weight_exponential_beta': 8.479066886414588}. Best is trial 91 with value: 0.23444188122574863.
2026-06-01 02:07:05 | INFO | src.nested_cv_avggrm_weighted_unified | Trial 99 | outer=9 | alpha=2.190e+05 n_pcs=500 (pc_topk) weight_search=on
2026-06-01 02:07:05 | INFO | src.nested_cv_avggrm_weighted_unified | Trial 99 | outer=9 | weight={'name': 'exponential', 'floor': 1e-06, 'clip_max': 5.0, 'beta': 8.994639660037219}
2026-06-01 02:07:05 | INFO | src.nested_cv_avggrm_weighted_unified | Trial 99 | outer=9 | pruned after 5/10 inner folds (mean r=0.1862)
[I 2026-06-01 02:07:05,467] Trial 99 pruned. 
2026-06-01 02:07:05 | INFO | src.nested_cv_avggrm_weighted_unified | Trial 100 | outer=9 | alpha=5.662e+05 n_pcs=3500 (pc_topk) weight_search=on
2026-06-01 02:07:05 | INFO | src.nested_cv_avggrm_weighted_unified | Trial 100 | outer=9 | weight={'name': 'exponential', 'floor': 1e-06, 'clip_max': 3.0, 'beta': 9.776630227633325}
[I 2026-06-01 02:07:10,910] Trial 100 finished with value: 0.23095911390911145 and parameters: {'alpha': 566175.9175546422, 'n_pcs': 3500, 'weight_scheme': 'exponential', 'weight_clip_max': 3.0, 'weight_exponential_beta': 9.776630227633325}. Best is trial 91 with value: 0.23444188122574863.
2026-06-01 02:07:10 | INFO | src.nested_cv_avggrm_weighted_unified | Trial 101 | outer=9 | alpha=1.681e+05 n_pcs=3000 (pc_topk) weight_search=on
2026-06-01 02:07:10 | INFO | src.nested_cv_avggrm_weighted_unified | Trial 101 | outer=9 | weight={'name': 'exponential', 'floor': 1e-06, 'clip_max': 3.0, 'beta': 8.576951301892546}
[I 2026-06-01 02:07:14,736] Trial 101 finished with value: 0.23462792466127752 and parameters: {'alpha': 168088.7109510198, 'n_pcs': 3000, 'weight_scheme': 'exponential', 'weight_clip_max': 3.0, 'weight_exponential_beta': 8.576951301892546}. Best is trial 101 with value: 0.23462792466127752.
2026-06-01 02:07:14 | INFO | src.nested_cv_avggrm_weighted_unified | OUTER 9 | new best trial 101 (mean inner r=0.2346) saved to outputs/final_results/e6_pc_ridge_avggrm/thr_wing/e6_pc_ridge_avggrm_thr_wing_best_trials/split_09_best_trial.json
2026-06-01 02:07:14 | INFO | src.nested_cv_avggrm_weighted_unified | Trial 102 | outer=9 | alpha=1.838e+05 n_pcs=3000 (pc_topk) weight_search=on
2026-06-01 02:07:14 | INFO | src.nested_cv_avggrm_weighted_unified | Trial 102 | outer=9 | weight={'name': 'exponential', 'floor': 1e-06, 'clip_max': 3.0, 'beta': 8.730641733014998}
[I 2026-06-01 02:07:18,787] Trial 102 finished with value: 0.2346683079285648 and parameters: {'alpha': 183784.82976172934, 'n_pcs': 3000, 'weight_scheme': 'exponential', 'weight_clip_max': 3.0, 'weight_exponential_beta': 8.730641733014998}. Best is trial 102 with value: 0.2346683079285648.
2026-06-01 02:07:18 | INFO | src.nested_cv_avggrm_weighted_unified | OUTER 9 | new best trial 102 (mean inner r=0.2347) saved to outputs/final_results/e6_pc_ridge_avggrm/thr_wing/e6_pc_ridge_avggrm_thr_wing_best_trials/split_09_best_trial.json
2026-06-01 02:07:18 | INFO | src.nested_cv_avggrm_weighted_unified | Trial 103 | outer=9 | alpha=3.181e+05 n_pcs=3000 (pc_topk) weight_search=on
2026-06-01 02:07:18 | INFO | src.nested_cv_avggrm_weighted_unified | Trial 103 | outer=9 | weight={'name': 'exponential', 'floor': 1e-06, 'clip_max': 3.0, 'beta': 8.533891879837446}
[I 2026-06-01 02:07:22,699] Trial 103 finished with value: 0.233673188017307 and parameters: {'alpha': 318106.5919191921, 'n_pcs': 3000, 'weight_scheme': 'exponential', 'weight_clip_max': 3.0, 'weight_exponential_beta': 8.533891879837446}. Best is trial 102 with value: 0.2346683079285648.
2026-06-01 02:07:22 | INFO | src.nested_cv_avggrm_weighted_unified | Trial 104 | outer=9 | alpha=1.665e+05 n_pcs=2500 (pc_topk) weight_search=on
2026-06-01 02:07:22 | INFO | src.nested_cv_avggrm_weighted_unified | Trial 104 | outer=9 | weight={'name': 'exponential', 'floor': 1e-06, 'clip_max': 3.0, 'beta': 7.925944079670971}
[I 2026-06-01 02:07:26,079] Trial 104 finished with value: 0.23401089646916184 and parameters: {'alpha': 166492.8246031291, 'n_pcs': 2500, 'weight_scheme': 'exponential', 'weight_clip_max': 3.0, 'weight_exponential_beta': 7.925944079670971}. Best is trial 102 with value: 0.2346683079285648.
2026-06-01 02:07:26 | INFO | src.nested_cv_avggrm_weighted_unified | Trial 105 | outer=9 | alpha=1.896e+05 n_pcs=2500 (pc_topk) weight_search=on
2026-06-01 02:07:26 | INFO | src.nested_cv_avggrm_weighted_unified | Trial 105 | outer=9 | weight={'name': 'exponential', 'floor': 1e-06, 'clip_max': 3.0, 'beta': 8.059930871036958}
[I 2026-06-01 02:07:29,244] Trial 105 finished with value: 0.23398192222934844 and parameters: {'alpha': 189631.59659799686, 'n_pcs': 2500, 'weight_scheme': 'exponential', 'weight_clip_max': 3.0, 'weight_exponential_beta': 8.059930871036958}. Best is trial 102 with value: 0.2346683079285648.
2026-06-01 02:07:29 | INFO | src.nested_cv_avggrm_weighted_unified | Trial 106 | outer=9 | alpha=4.150e+05 n_pcs=2500 (pc_topk) weight_search=on
2026-06-01 02:07:29 | INFO | src.nested_cv_avggrm_weighted_unified | Trial 106 | outer=9 | weight={'name': 'exponential', 'floor': 1e-06, 'clip_max': 3.0, 'beta': 8.073799201396284}
[I 2026-06-01 02:07:32,497] Trial 106 finished with value: 0.2314416000309374 and parameters: {'alpha': 414979.4225706243, 'n_pcs': 2500, 'weight_scheme': 'exponential', 'weight_clip_max': 3.0, 'weight_exponential_beta': 8.073799201396284}. Best is trial 102 with value: 0.2346683079285648.
2026-06-01 02:07:32 | INFO | src.nested_cv_avggrm_weighted_unified | Trial 107 | outer=9 | alpha=1.769e+05 n_pcs=2500 (pc_topk) weight_search=on
2026-06-01 02:07:32 | INFO | src.nested_cv_avggrm_weighted_unified | Trial 107 | outer=9 | weight={'name': 'exponential', 'floor': 1e-06, 'clip_max': 10.0, 'beta': 8.849707605981424}
[I 2026-06-01 02:07:36,352] Trial 107 finished with value: 0.2261660272894681 and parameters: {'alpha': 176880.9461982174, 'n_pcs': 2500, 'weight_scheme': 'exponential', 'weight_clip_max': 10.0, 'weight_exponential_beta': 8.849707605981424}. Best is trial 102 with value: 0.2346683079285648.
2026-06-01 02:07:36 | INFO | src.nested_cv_avggrm_weighted_unified | Trial 108 | outer=9 | alpha=2.632e+05 n_pcs=2000 (pc_topk) weight_search=on
2026-06-01 02:07:36 | INFO | src.nested_cv_avggrm_weighted_unified | Trial 108 | outer=9 | weight={'name': 'exponential', 'floor': 1e-06, 'clip_max': 3.0, 'beta': 8.13225600984668}
2026-06-01 02:07:39 | INFO | src.nested_cv_avggrm_weighted_unified | Trial 108 | outer=9 | pruned after 8/10 inner folds (mean r=0.2617)
[I 2026-06-01 02:07:39,326] Trial 108 pruned. 
2026-06-01 02:07:39 | INFO | src.nested_cv_avggrm_weighted_unified | Trial 109 | outer=9 | alpha=1.386e+05 n_pcs=2500 (pc_topk) weight_search=on
2026-06-01 02:07:39 | INFO | src.nested_cv_avggrm_weighted_unified | Trial 109 | outer=9 | weight={'name': 'linear', 'floor': 1e-06, 'clip_max': 20.0, 'min_weight': 0.9441563396104617, 'max_weight': 1.0241482404261275}
2026-06-01 02:07:41 | INFO | src.nested_cv_avggrm_weighted_unified | Trial 109 | outer=9 | pruned after 8/10 inner folds (mean r=0.2500)
[I 2026-06-01 02:07:41,855] Trial 109 pruned. 
2026-06-01 02:07:41 | INFO | src.nested_cv_avggrm_weighted_unified | Trial 110 | outer=9 | alpha=1.987e+05 n_pcs=2500 (pc_topk) weight_search=on
2026-06-01 02:07:41 | INFO | src.nested_cv_avggrm_weighted_unified | Trial 110 | outer=9 | weight={'name': 'exponential', 'floor': 1e-06, 'clip_max': 3.0, 'beta': 7.379141856776517}
[I 2026-06-01 02:07:45,254] Trial 110 finished with value: 0.2336234874795493 and parameters: {'alpha': 198715.67388809996, 'n_pcs': 2500, 'weight_scheme': 'exponential', 'weight_clip_max': 3.0, 'weight_exponential_beta': 7.379141856776517}. Best is trial 102 with value: 0.2346683079285648.
2026-06-01 02:07:45 | INFO | src.nested_cv_avggrm_weighted_unified | Trial 111 | outer=9 | alpha=1.150e+05 n_pcs=3000 (pc_topk) weight_search=on
2026-06-01 02:07:45 | INFO | src.nested_cv_avggrm_weighted_unified | Trial 111 | outer=9 | weight={'name': 'exponential', 'floor': 1e-06, 'clip_max': 3.0, 'beta': 9.287277282835856}
[I 2026-06-01 02:07:49,152] Trial 111 finished with value: 0.23250799234318903 and parameters: {'alpha': 114964.79754516124, 'n_pcs': 3000, 'weight_scheme': 'exponential', 'weight_clip_max': 3.0, 'weight_exponential_beta': 9.287277282835856}. Best is trial 102 with value: 0.2346683079285648.
2026-06-01 02:07:49 | INFO | src.nested_cv_avggrm_weighted_unified | Trial 112 | outer=9 | alpha=2.354e+05 n_pcs=3000 (pc_topk) weight_search=on
2026-06-01 02:07:49 | INFO | src.nested_cv_avggrm_weighted_unified | Trial 112 | outer=9 | weight={'name': 'exponential', 'floor': 1e-06, 'clip_max': 3.0, 'beta': 8.35828058618796}
[I 2026-06-01 02:07:52,954] Trial 112 finished with value: 0.23440354420338722 and parameters: {'alpha': 235405.0847230957, 'n_pcs': 3000, 'weight_scheme': 'exponential', 'weight_clip_max': 3.0, 'weight_exponential_beta': 8.35828058618796}. Best is trial 102 with value: 0.2346683079285648.
2026-06-01 02:07:52 | INFO | src.nested_cv_avggrm_weighted_unified | Trial 113 | outer=9 | alpha=2.285e+05 n_pcs=3000 (pc_topk) weight_search=on
2026-06-01 02:07:52 | INFO | src.nested_cv_avggrm_weighted_unified | Trial 113 | outer=9 | weight={'name': 'exponential', 'floor': 1e-06, 'clip_max': 3.0, 'beta': 8.475298206899902}
[I 2026-06-01 02:07:56,825] Trial 113 finished with value: 0.23450999795878563 and parameters: {'alpha': 228487.72439256884, 'n_pcs': 3000, 'weight_scheme': 'exponential', 'weight_clip_max': 3.0, 'weight_exponential_beta': 8.475298206899902}. Best is trial 102 with value: 0.2346683079285648.
2026-06-01 02:07:56 | INFO | src.nested_cv_avggrm_weighted_unified | Trial 114 | outer=9 | alpha=9.946e+06 n_pcs=3000 (pc_topk) weight_search=on
2026-06-01 02:07:56 | INFO | src.nested_cv_avggrm_weighted_unified | Trial 114 | outer=9 | weight={'name': 'exponential', 'floor': 1e-06, 'clip_max': 3.0, 'beta': 8.453466723514087}
2026-06-01 02:07:58 | INFO | src.nested_cv_avggrm_weighted_unified | Trial 114 | outer=9 | pruned after 5/10 inner folds (mean r=0.2164)
[I 2026-06-01 02:07:58,683] Trial 114 pruned. 
2026-06-01 02:07:58 | INFO | src.nested_cv_avggrm_weighted_unified | Trial 115 | outer=9 | alpha=3.413e+05 n_pcs=3500 (pc_topk) weight_search=on
2026-06-01 02:07:58 | INFO | src.nested_cv_avggrm_weighted_unified | Trial 115 | outer=9 | weight={'name': 'exponential', 'floor': 1e-06, 'clip_max': 3.0, 'beta': 7.788020853644835}
[I 2026-06-01 02:08:03,535] Trial 115 finished with value: 0.23134627939170072 and parameters: {'alpha': 341272.6656874217, 'n_pcs': 3500, 'weight_scheme': 'exponential', 'weight_clip_max': 3.0, 'weight_exponential_beta': 7.788020853644835}. Best is trial 102 with value: 0.2346683079285648.
2026-06-01 02:08:03 | INFO | src.nested_cv_avggrm_weighted_unified | Trial 116 | outer=9 | alpha=2.240e+05 n_pcs=3000 (pc_topk) weight_search=on
2026-06-01 02:08:03 | INFO | src.nested_cv_avggrm_weighted_unified | Trial 116 | outer=9 | weight={'name': 'uniform', 'floor': 1e-06, 'clip_max': 3.0}
2026-06-01 02:08:05 | INFO | src.nested_cv_avggrm_weighted_unified | Trial 116 | outer=9 | pruned after 5/10 inner folds (mean r=0.2102)
[I 2026-06-01 02:08:05,105] Trial 116 pruned. 
2026-06-01 02:08:05 | INFO | src.nested_cv_avggrm_weighted_unified | Trial 117 | outer=9 | alpha=6.109e+05 n_pcs=3000 (pc_topk) weight_search=on
2026-06-01 02:08:05 | INFO | src.nested_cv_avggrm_weighted_unified | Trial 117 | outer=9 | weight={'name': 'exponential', 'floor': 1e-06, 'clip_max': 3.0, 'beta': 9.074635501446199}
