[I 2026-06-01 02:12:42,730] Trial 187 finished with value: 0.23336861281308213 and parameters: {'alpha': 176415.54209484722, 'n_pcs': 3500, 'weight_scheme': 'exponential', 'weight_clip_max': 3.0, 'weight_exponential_beta': 8.727929723329806}. Best is trial 174 with value: 0.23469062114588263.
2026-06-01 02:12:42 | INFO | src.nested_cv_avggrm_weighted_unified | Trial 188 | outer=9 | alpha=1.801e+05 n_pcs=3000 (pc_topk) weight_search=on
2026-06-01 02:12:42 | INFO | src.nested_cv_avggrm_weighted_unified | Trial 188 | outer=9 | weight={'name': 'exponential', 'floor': 1e-06, 'clip_max': 3.0, 'beta': 8.906676631912719}
[I 2026-06-01 02:12:46,610] Trial 188 finished with value: 0.2345805144924386 and parameters: {'alpha': 180100.10404407777, 'n_pcs': 3000, 'weight_scheme': 'exponential', 'weight_clip_max': 3.0, 'weight_exponential_beta': 8.906676631912719}. Best is trial 174 with value: 0.23469062114588263.
2026-06-01 02:12:46 | INFO | src.nested_cv_avggrm_weighted_unified | Trial 189 | outer=9 | alpha=2.058e+05 n_pcs=3000 (pc_topk) weight_search=on
2026-06-01 02:12:46 | INFO | src.nested_cv_avggrm_weighted_unified | Trial 189 | outer=9 | weight={'name': 'exponential', 'floor': 1e-06, 'clip_max': 3.0, 'beta': 9.175175832412204}
[I 2026-06-01 02:12:50,668] Trial 189 finished with value: 0.23448772596002998 and parameters: {'alpha': 205813.57744859546, 'n_pcs': 3000, 'weight_scheme': 'exponential', 'weight_clip_max': 3.0, 'weight_exponential_beta': 9.175175832412204}. Best is trial 174 with value: 0.23469062114588263.
2026-06-01 02:12:50 | INFO | src.nested_cv_avggrm_weighted_unified | Trial 190 | outer=9 | alpha=9.604e+04 n_pcs=3000 (pc_topk) weight_search=on
2026-06-01 02:12:50 | INFO | src.nested_cv_avggrm_weighted_unified | Trial 190 | outer=9 | weight={'name': 'exponential', 'floor': 1e-06, 'clip_max': 5.0, 'beta': 8.686737629383586}
[I 2026-06-01 02:12:54,473] Trial 190 finished with value: 0.2298093878310282 and parameters: {'alpha': 96041.54766709621, 'n_pcs': 3000, 'weight_scheme': 'exponential', 'weight_clip_max': 5.0, 'weight_exponential_beta': 8.686737629383586}. Best is trial 174 with value: 0.23469062114588263.
2026-06-01 02:12:54 | INFO | src.nested_cv_avggrm_weighted_unified | Trial 191 | outer=9 | alpha=1.717e+05 n_pcs=3000 (pc_topk) weight_search=on
2026-06-01 02:12:54 | INFO | src.nested_cv_avggrm_weighted_unified | Trial 191 | outer=9 | weight={'name': 'exponential', 'floor': 1e-06, 'clip_max': 3.0, 'beta': 8.93837262324117}
[I 2026-06-01 02:12:58,354] Trial 191 finished with value: 0.2344969883141083 and parameters: {'alpha': 171722.59275390254, 'n_pcs': 3000, 'weight_scheme': 'exponential', 'weight_clip_max': 3.0, 'weight_exponential_beta': 8.93837262324117}. Best is trial 174 with value: 0.23469062114588263.
2026-06-01 02:12:58 | INFO | src.nested_cv_avggrm_weighted_unified | Trial 192 | outer=9 | alpha=1.763e+05 n_pcs=3000 (pc_topk) weight_search=on
2026-06-01 02:12:58 | INFO | src.nested_cv_avggrm_weighted_unified | Trial 192 | outer=9 | weight={'name': 'exponential', 'floor': 1e-06, 'clip_max': 3.0, 'beta': 9.333448383343413}
[I 2026-06-01 02:13:02,160] Trial 192 finished with value: 0.23410184094192696 and parameters: {'alpha': 176345.70283962786, 'n_pcs': 3000, 'weight_scheme': 'exponential', 'weight_clip_max': 3.0, 'weight_exponential_beta': 9.333448383343413}. Best is trial 174 with value: 0.23469062114588263.
2026-06-01 02:13:02 | INFO | src.nested_cv_avggrm_weighted_unified | Trial 193 | outer=9 | alpha=1.217e+05 n_pcs=3000 (pc_topk) weight_search=on
2026-06-01 02:13:02 | INFO | src.nested_cv_avggrm_weighted_unified | Trial 193 | outer=9 | weight={'name': 'exponential', 'floor': 1e-06, 'clip_max': 3.0, 'beta': 8.872240256808764}
[I 2026-06-01 02:13:05,979] Trial 193 finished with value: 0.2335516782748342 and parameters: {'alpha': 121738.83368939842, 'n_pcs': 3000, 'weight_scheme': 'exponential', 'weight_clip_max': 3.0, 'weight_exponential_beta': 8.872240256808764}. Best is trial 174 with value: 0.23469062114588263.
2026-06-01 02:13:05 | INFO | src.nested_cv_avggrm_weighted_unified | Trial 194 | outer=9 | alpha=2.219e+05 n_pcs=3000 (pc_topk) weight_search=on
2026-06-01 02:13:05 | INFO | src.nested_cv_avggrm_weighted_unified | Trial 194 | outer=9 | weight={'name': 'exponential', 'floor': 1e-06, 'clip_max': 3.0, 'beta': 8.685898917434633}
[I 2026-06-01 02:13:09,824] Trial 194 finished with value: 0.23462288645573642 and parameters: {'alpha': 221906.25926989093, 'n_pcs': 3000, 'weight_scheme': 'exponential', 'weight_clip_max': 3.0, 'weight_exponential_beta': 8.685898917434633}. Best is trial 174 with value: 0.23469062114588263.
2026-06-01 02:13:09 | INFO | src.nested_cv_avggrm_weighted_unified | Trial 195 | outer=9 | alpha=2.137e+05 n_pcs=1000 (pc_topk) weight_search=on
2026-06-01 02:13:09 | INFO | src.nested_cv_avggrm_weighted_unified | Trial 195 | outer=9 | weight={'name': 'exponential', 'floor': 1e-06, 'clip_max': 3.0, 'beta': 8.622033784921335}
2026-06-01 02:13:10 | INFO | src.nested_cv_avggrm_weighted_unified | Trial 195 | outer=9 | pruned after 8/10 inner folds (mean r=0.2589)
[I 2026-06-01 02:13:10,967] Trial 195 pruned. 
2026-06-01 02:13:10 | INFO | src.nested_cv_avggrm_weighted_unified | Trial 196 | outer=9 | alpha=3.051e+05 n_pcs=3000 (pc_topk) weight_search=on
2026-06-01 02:13:10 | INFO | src.nested_cv_avggrm_weighted_unified | Trial 196 | outer=9 | weight={'name': 'linear', 'floor': 1e-06, 'clip_max': 3.0, 'min_weight': 0.38802458399933987, 'max_weight': 2.0596376547107185}
2026-06-01 02:13:14 | INFO | src.nested_cv_avggrm_weighted_unified | Trial 196 | outer=9 | pruned after 8/10 inner folds (mean r=0.2610)
[I 2026-06-01 02:13:14,172] Trial 196 pruned. 
2026-06-01 02:13:14 | INFO | src.nested_cv_avggrm_weighted_unified | Trial 197 | outer=9 | alpha=2.258e+05 n_pcs=3000 (pc_topk) weight_search=on
2026-06-01 02:13:14 | INFO | src.nested_cv_avggrm_weighted_unified | Trial 197 | outer=9 | weight={'name': 'exponential', 'floor': 1e-06, 'clip_max': 3.0, 'beta': 9.143882240422126}
[I 2026-06-01 02:13:18,022] Trial 197 finished with value: 0.23452284142401694 and parameters: {'alpha': 225832.26521649235, 'n_pcs': 3000, 'weight_scheme': 'exponential', 'weight_clip_max': 3.0, 'weight_exponential_beta': 9.143882240422126}. Best is trial 174 with value: 0.23469062114588263.
2026-06-01 02:13:18 | INFO | src.nested_cv_avggrm_weighted_unified | Trial 198 | outer=9 | alpha=1.277e+05 n_pcs=3000 (pc_topk) weight_search=on
2026-06-01 02:13:18 | INFO | src.nested_cv_avggrm_weighted_unified | Trial 198 | outer=9 | weight={'name': 'exponential', 'floor': 1e-06, 'clip_max': 3.0, 'beta': 8.726504120039086}
[I 2026-06-01 02:13:21,872] Trial 198 finished with value: 0.2339157743204498 and parameters: {'alpha': 127698.6901485004, 'n_pcs': 3000, 'weight_scheme': 'exponential', 'weight_clip_max': 3.0, 'weight_exponential_beta': 8.726504120039086}. Best is trial 174 with value: 0.23469062114588263.
2026-06-01 02:13:21 | INFO | src.nested_cv_avggrm_weighted_unified | Trial 199 | outer=9 | alpha=1.642e+05 n_pcs=2500 (pc_topk) weight_search=on
2026-06-01 02:13:21 | INFO | src.nested_cv_avggrm_weighted_unified | Trial 199 | outer=9 | weight={'name': 'exponential', 'floor': 1e-06, 'clip_max': None, 'beta': 8.352088729119496}
2026-06-01 02:13:24 | INFO | src.nested_cv_avggrm_weighted_unified | Trial 199 | outer=9 | pruned after 8/10 inner folds (mean r=0.2384)
[I 2026-06-01 02:13:24,252] Trial 199 pruned. 
2026-06-01 02:13:24 | INFO | src.nested_cv_avggrm_weighted_unified | Trial 200 | outer=9 | alpha=2.714e+05 n_pcs=3000 (pc_topk) weight_search=on
2026-06-01 02:13:24 | INFO | src.nested_cv_avggrm_weighted_unified | Trial 200 | outer=9 | weight={'name': 'exponential', 'floor': 1e-06, 'clip_max': 3.0, 'beta': 8.524171460392834}
[I 2026-06-01 02:13:28,113] Trial 200 finished with value: 0.23416669683476438 and parameters: {'alpha': 271415.95021254825, 'n_pcs': 3000, 'weight_scheme': 'exponential', 'weight_clip_max': 3.0, 'weight_exponential_beta': 8.524171460392834}. Best is trial 174 with value: 0.23469062114588263.
2026-06-01 02:13:28 | INFO | src.nested_cv_avggrm_weighted_unified | Trial 201 | outer=9 | alpha=1.873e+05 n_pcs=3000 (pc_topk) weight_search=on
2026-06-01 02:13:28 | INFO | src.nested_cv_avggrm_weighted_unified | Trial 201 | outer=9 | weight={'name': 'exponential', 'floor': 1e-06, 'clip_max': 3.0, 'beta': 0.10661989506169256}
2026-06-01 02:13:31 | INFO | src.nested_cv_avggrm_weighted_unified | Trial 201 | outer=9 | pruned after 7/10 inner folds (mean r=0.2280)
[I 2026-06-01 02:13:31,030] Trial 201 pruned. 
2026-06-01 02:13:31 | INFO | src.nested_cv_avggrm_weighted_unified | Trial 202 | outer=9 | alpha=2.124e+05 n_pcs=3000 (pc_topk) weight_search=on
2026-06-01 02:13:31 | INFO | src.nested_cv_avggrm_weighted_unified | Trial 202 | outer=9 | weight={'name': 'exponential', 'floor': 1e-06, 'clip_max': 3.0, 'beta': 8.907258399488681}
[I 2026-06-01 02:13:34,844] Trial 202 finished with value: 0.23464698683663782 and parameters: {'alpha': 212380.18940765518, 'n_pcs': 3000, 'weight_scheme': 'exponential', 'weight_clip_max': 3.0, 'weight_exponential_beta': 8.907258399488681}. Best is trial 174 with value: 0.23469062114588263.
2026-06-01 02:13:34 | INFO | src.nested_cv_avggrm_weighted_unified | Trial 203 | outer=9 | alpha=2.114e+05 n_pcs=3000 (pc_topk) weight_search=on
2026-06-01 02:13:34 | INFO | src.nested_cv_avggrm_weighted_unified | Trial 203 | outer=9 | weight={'name': 'exponential', 'floor': 1e-06, 'clip_max': 3.0, 'beta': 8.977418485245197}
[I 2026-06-01 02:13:38,677] Trial 203 finished with value: 0.23462112002243565 and parameters: {'alpha': 211362.7320037327, 'n_pcs': 3000, 'weight_scheme': 'exponential', 'weight_clip_max': 3.0, 'weight_exponential_beta': 8.977418485245197}. Best is trial 174 with value: 0.23469062114588263.
2026-06-01 02:13:38 | INFO | src.nested_cv_avggrm_weighted_unified | Trial 204 | outer=9 | alpha=2.161e+05 n_pcs=3000 (pc_topk) weight_search=on
2026-06-01 02:13:38 | INFO | src.nested_cv_avggrm_weighted_unified | Trial 204 | outer=9 | weight={'name': 'exponential', 'floor': 1e-06, 'clip_max': 3.0, 'beta': 8.824063294757043}
[I 2026-06-01 02:13:42,523] Trial 204 finished with value: 0.23465374025642344 and parameters: {'alpha': 216062.54510870308, 'n_pcs': 3000, 'weight_scheme': 'exponential', 'weight_clip_max': 3.0, 'weight_exponential_beta': 8.824063294757043}. Best is trial 174 with value: 0.23469062114588263.
2026-06-01 02:13:42 | INFO | src.nested_cv_avggrm_weighted_unified | Trial 205 | outer=9 | alpha=3.386e+05 n_pcs=4500 (pc_topk) weight_search=on
2026-06-01 02:13:42 | INFO | src.nested_cv_avggrm_weighted_unified | Trial 205 | outer=9 | weight={'name': 'exponential', 'floor': 1e-06, 'clip_max': 3.0, 'beta': 8.872969213964275}
[I 2026-06-01 02:13:49,500] Trial 205 finished with value: 0.23241745258413574 and parameters: {'alpha': 338553.2206373616, 'n_pcs': 4500, 'weight_scheme': 'exponential', 'weight_clip_max': 3.0, 'weight_exponential_beta': 8.872969213964275}. Best is trial 174 with value: 0.23469062114588263.
2026-06-01 02:13:49 | INFO | src.nested_cv_avggrm_weighted_unified | Trial 206 | outer=9 | alpha=2.393e+05 n_pcs=3000 (pc_topk) weight_search=on
2026-06-01 02:13:49 | INFO | src.nested_cv_avggrm_weighted_unified | Trial 206 | outer=9 | weight={'name': 'exponential', 'floor': 1e-06, 'clip_max': 3.0, 'beta': 9.246542418996285}
[I 2026-06-01 02:13:53,557] Trial 206 finished with value: 0.23443236510646384 and parameters: {'alpha': 239311.87914384174, 'n_pcs': 3000, 'weight_scheme': 'exponential', 'weight_clip_max': 3.0, 'weight_exponential_beta': 9.246542418996285}. Best is trial 174 with value: 0.23469062114588263.
2026-06-01 02:13:53 | INFO | src.nested_cv_avggrm_weighted_unified | Trial 207 | outer=9 | alpha=2.778e+05 n_pcs=3000 (pc_topk) weight_search=on
2026-06-01 02:13:53 | INFO | src.nested_cv_avggrm_weighted_unified | Trial 207 | outer=9 | weight={'name': 'exponential', 'floor': 1e-06, 'clip_max': 3.0, 'beta': 8.44289435983641}
[I 2026-06-01 02:13:57,456] Trial 207 finished with value: 0.23404688387209313 and parameters: {'alpha': 277770.6956870989, 'n_pcs': 3000, 'weight_scheme': 'exponential', 'weight_clip_max': 3.0, 'weight_exponential_beta': 8.44289435983641}. Best is trial 174 with value: 0.23469062114588263.
2026-06-01 02:13:57 | INFO | src.nested_cv_avggrm_weighted_unified | Trial 208 | outer=9 | alpha=2.294e+05 n_pcs=3000 (pc_topk) weight_search=on
2026-06-01 02:13:57 | INFO | src.nested_cv_avggrm_weighted_unified | Trial 208 | outer=9 | weight={'name': 'uniform', 'floor': 1e-06, 'clip_max': 3.0}
2026-06-01 02:13:59 | INFO | src.nested_cv_avggrm_weighted_unified | Trial 208 | outer=9 | pruned after 5/10 inner folds (mean r=0.2099)
[I 2026-06-01 02:13:59,387] Trial 208 pruned. 
2026-06-01 02:13:59 | INFO | src.nested_cv_avggrm_weighted_unified | Trial 209 | outer=9 | alpha=1.440e+05 n_pcs=3000 (pc_topk) weight_search=on
2026-06-01 02:13:59 | INFO | src.nested_cv_avggrm_weighted_unified | Trial 209 | outer=9 | weight={'name': 'exponential', 'floor': 1e-06, 'clip_max': 3.0, 'beta': 8.764161149724451}
[I 2026-06-01 02:14:03,220] Trial 209 finished with value: 0.23426302412166508 and parameters: {'alpha': 143983.19045690336, 'n_pcs': 3000, 'weight_scheme': 'exponential', 'weight_clip_max': 3.0, 'weight_exponential_beta': 8.764161149724451}. Best is trial 174 with value: 0.23469062114588263.
2026-06-01 02:14:03 | INFO | src.nested_cv_avggrm_weighted_unified | Trial 210 | outer=9 | alpha=2.129e+05 n_pcs=3000 (pc_topk) weight_search=on
2026-06-01 02:14:03 | INFO | src.nested_cv_avggrm_weighted_unified | Trial 210 | outer=9 | weight={'name': 'exponential', 'floor': 1e-06, 'clip_max': 3.0, 'beta': 8.99368312474696}
[I 2026-06-01 02:14:07,044] Trial 210 finished with value: 0.23461257673558125 and parameters: {'alpha': 212912.17151739093, 'n_pcs': 3000, 'weight_scheme': 'exponential', 'weight_clip_max': 3.0, 'weight_exponential_beta': 8.99368312474696}. Best is trial 174 with value: 0.23469062114588263.
2026-06-01 02:14:07 | INFO | src.nested_cv_avggrm_weighted_unified | Trial 211 | outer=9 | alpha=1.998e+05 n_pcs=3000 (pc_topk) weight_search=on
2026-06-01 02:14:07 | INFO | src.nested_cv_avggrm_weighted_unified | Trial 211 | outer=9 | weight={'name': 'exponential', 'floor': 1e-06, 'clip_max': 3.0, 'beta': 9.009411779312439}
[I 2026-06-01 02:14:10,880] Trial 211 finished with value: 0.23459258021648927 and parameters: {'alpha': 199777.46924743894, 'n_pcs': 3000, 'weight_scheme': 'exponential', 'weight_clip_max': 3.0, 'weight_exponential_beta': 9.009411779312439}. Best is trial 174 with value: 0.23469062114588263.
2026-06-01 02:14:10 | INFO | src.nested_cv_avggrm_weighted_unified | Trial 212 | outer=9 | alpha=2.521e+05 n_pcs=3000 (pc_topk) weight_search=on
2026-06-01 02:14:10 | INFO | src.nested_cv_avggrm_weighted_unified | Trial 212 | outer=9 | weight={'name': 'exponential', 'floor': 1e-06, 'clip_max': 3.0, 'beta': 8.61101816571229}
[I 2026-06-01 02:14:15,171] Trial 212 finished with value: 0.23440003024592082 and parameters: {'alpha': 252102.84541777687, 'n_pcs': 3000, 'weight_scheme': 'exponential', 'weight_clip_max': 3.0, 'weight_exponential_beta': 8.61101816571229}. Best is trial 174 with value: 0.23469062114588263.
2026-06-01 02:14:15 | INFO | src.nested_cv_avggrm_weighted_unified | Trial 213 | outer=9 | alpha=1.711e+05 n_pcs=3000 (pc_topk) weight_search=on
2026-06-01 02:14:15 | INFO | src.nested_cv_avggrm_weighted_unified | Trial 213 | outer=9 | weight={'name': 'exponential', 'floor': 1e-06, 'clip_max': 10.0, 'beta': 9.444750667830712}
[I 2026-06-01 02:14:18,967] Trial 213 finished with value: 0.22610677731113332 and parameters: {'alpha': 171130.10949956352, 'n_pcs': 3000, 'weight_scheme': 'exponential', 'weight_clip_max': 10.0, 'weight_exponential_beta': 9.444750667830712}. Best is trial 174 with value: 0.23469062114588263.
2026-06-01 02:14:18 | INFO | src.nested_cv_avggrm_weighted_unified | Trial 214 | outer=9 | alpha=2.708e+06 n_pcs=3000 (pc_topk) weight_search=on
2026-06-01 02:14:18 | INFO | src.nested_cv_avggrm_weighted_unified | Trial 214 | outer=9 | weight={'name': 'exponential', 'floor': 1e-06, 'clip_max': 3.0, 'beta': 8.821262630640975}
2026-06-01 02:14:21 | INFO | src.nested_cv_avggrm_weighted_unified | Trial 214 | outer=9 | pruned after 7/10 inner folds (mean r=0.2418)
[I 2026-06-01 02:14:21,651] Trial 214 pruned. 
2026-06-01 02:14:21 | INFO | src.nested_cv_avggrm_weighted_unified | Trial 215 | outer=9 | alpha=2.180e+05 n_pcs=3000 (pc_topk) weight_search=on
2026-06-01 02:14:21 | INFO | src.nested_cv_avggrm_weighted_unified | Trial 215 | outer=9 | weight={'name': 'exponential', 'floor': 1e-06, 'clip_max': 3.0, 'beta': 8.367104849548856}
[I 2026-06-01 02:14:25,514] Trial 215 finished with value: 0.2345386472335841 and parameters: {'alpha': 218014.7351007039, 'n_pcs': 3000, 'weight_scheme': 'exponential', 'weight_clip_max': 3.0, 'weight_exponential_beta': 8.367104849548856}. Best is trial 174 with value: 0.23469062114588263.
2026-06-01 02:14:25 | INFO | src.nested_cv_avggrm_weighted_unified | Trial 216 | outer=9 | alpha=3.014e+05 n_pcs=3000 (pc_topk) weight_search=on
2026-06-01 02:14:25 | INFO | src.nested_cv_avggrm_weighted_unified | Trial 216 | outer=9 | weight={'name': 'exponential', 'floor': 1e-06, 'clip_max': 3.0, 'beta': 9.095885603455907}
[I 2026-06-01 02:14:29,341] Trial 216 finished with value: 0.2341493122815196 and parameters: {'alpha': 301436.19092842203, 'n_pcs': 3000, 'weight_scheme': 'exponential', 'weight_clip_max': 3.0, 'weight_exponential_beta': 9.095885603455907}. Best is trial 174 with value: 0.23469062114588263.
2026-06-01 02:14:29 | INFO | src.nested_cv_avggrm_weighted_unified | Trial 217 | outer=9 | alpha=1.351e+05 n_pcs=3000 (pc_topk) weight_search=on
2026-06-01 02:14:29 | INFO | src.nested_cv_avggrm_weighted_unified | Trial 217 | outer=9 | weight={'name': 'exponential', 'floor': 1e-06, 'clip_max': 3.0, 'beta': 8.598708971891144}
[I 2026-06-01 02:14:33,170] Trial 217 finished with value: 0.2342023601158711 and parameters: {'alpha': 135123.29471039245, 'n_pcs': 3000, 'weight_scheme': 'exponential', 'weight_clip_max': 3.0, 'weight_exponential_beta': 8.598708971891144}. Best is trial 174 with value: 0.23469062114588263.
2026-06-01 02:14:33 | INFO | src.nested_cv_avggrm_weighted_unified | Trial 218 | outer=9 | alpha=1.842e+05 n_pcs=3000 (pc_topk) weight_search=on
2026-06-01 02:14:33 | INFO | src.nested_cv_avggrm_weighted_unified | Trial 218 | outer=9 | weight={'name': 'exponential', 'floor': 1e-06, 'clip_max': 3.0, 'beta': 8.906873234975343}
[I 2026-06-01 02:14:36,995] Trial 218 finished with value: 0.23460208294191065 and parameters: {'alpha': 184151.75846057048, 'n_pcs': 3000, 'weight_scheme': 'exponential', 'weight_clip_max': 3.0, 'weight_exponential_beta': 8.906873234975343}. Best is trial 174 with value: 0.23469062114588263.
2026-06-01 02:14:37 | INFO | src.nested_cv_avggrm_weighted_unified | Trial 219 | outer=9 | alpha=1.620e+05 n_pcs=3500 (pc_topk) weight_search=on
2026-06-01 02:14:37 | INFO | src.nested_cv_avggrm_weighted_unified | Trial 219 | outer=9 | weight={'name': 'exponential', 'floor': 1e-06, 'clip_max': 3.0, 'beta': 9.657700885158093}
2026-06-01 02:14:40 | INFO | src.nested_cv_avggrm_weighted_unified | Trial 219 | outer=9 | pruned after 8/10 inner folds (mean r=0.2622)
[I 2026-06-01 02:14:40,992] Trial 219 pruned. 
2026-06-01 02:14:40 | INFO | src.nested_cv_avggrm_weighted_unified | Trial 220 | outer=9 | alpha=2.607e+05 n_pcs=3000 (pc_topk) weight_search=on
2026-06-01 02:14:41 | INFO | src.nested_cv_avggrm_weighted_unified | Trial 220 | outer=9 | weight={'name': 'exponential', 'floor': 1e-06, 'clip_max': 20.0, 'beta': 8.44151627014023}
[I 2026-06-01 02:14:44,791] Trial 220 finished with value: 0.2230672874349846 and parameters: {'alpha': 260684.60304601092, 'n_pcs': 3000, 'weight_scheme': 'exponential', 'weight_clip_max': 20.0, 'weight_exponential_beta': 8.44151627014023}. Best is trial 174 with value: 0.23469062114588263.
2026-06-01 02:14:44 | INFO | src.nested_cv_avggrm_weighted_unified | Trial 221 | outer=9 | alpha=1.951e+05 n_pcs=3000 (pc_topk) weight_search=on
2026-06-01 02:14:44 | INFO | src.nested_cv_avggrm_weighted_unified | Trial 221 | outer=9 | weight={'name': 'exponential', 'floor': 1e-06, 'clip_max': 3.0, 'beta': 8.905948486759893}
[I 2026-06-01 02:14:48,635] Trial 221 finished with value: 0.23463998697876712 and parameters: {'alpha': 195050.0394932347, 'n_pcs': 3000, 'weight_scheme': 'exponential', 'weight_clip_max': 3.0, 'weight_exponential_beta': 8.905948486759893}. Best is trial 174 with value: 0.23469062114588263.
2026-06-01 02:14:48 | INFO | src.nested_cv_avggrm_weighted_unified | Trial 222 | outer=9 | alpha=2.056e+05 n_pcs=3000 (pc_topk) weight_search=on
2026-06-01 02:14:48 | INFO | src.nested_cv_avggrm_weighted_unified | Trial 222 | outer=9 | weight={'name': 'exponential', 'floor': 1e-06, 'clip_max': 3.0, 'beta': 6.445154186906921}
[I 2026-06-01 02:14:52,472] Trial 222 finished with value: 0.23312927803501485 and parameters: {'alpha': 205561.41794440785, 'n_pcs': 3000, 'weight_scheme': 'exponential', 'weight_clip_max': 3.0, 'weight_exponential_beta': 6.445154186906921}. Best is trial 174 with value: 0.23469062114588263.
2026-06-01 02:14:52 | INFO | src.nested_cv_avggrm_weighted_unified | Trial 223 | outer=9 | alpha=2.043e+05 n_pcs=3000 (pc_topk) weight_search=on
2026-06-01 02:14:52 | INFO | src.nested_cv_avggrm_weighted_unified | Trial 223 | outer=9 | weight={'name': 'exponential', 'floor': 1e-06, 'clip_max': 3.0, 'beta': 8.721639214226837}
