[I 2026-06-01 23:46:03,069] Trial 119 finished with value: 0.2204272484039266 and parameters: {'alpha': 60050.595293475955, 'n_pcs': 4000, 'iw_method': 'uniform'}. Best is trial 114 with value: 0.22430962297689927.
2026-06-01 23:46:03 | INFO | Trial 120 | outer=9 | alpha=3.303e+04 n_pcs=4500 (pc_topk) weight={'name': 'uniform'}
[I 2026-06-01 23:46:12,065] Trial 120 finished with value: 0.2243039204040659 and parameters: {'alpha': 33025.82135912328, 'n_pcs': 4500, 'iw_method': 'uniform'}. Best is trial 114 with value: 0.22430962297689927.
2026-06-01 23:46:12 | INFO | Trial 121 | outer=9 | alpha=3.290e+04 n_pcs=4500 (pc_topk) weight={'name': 'uniform'}
[I 2026-06-01 23:46:21,188] Trial 121 finished with value: 0.22430669364228728 and parameters: {'alpha': 32897.126812633374, 'n_pcs': 4500, 'iw_method': 'uniform'}. Best is trial 114 with value: 0.22430962297689927.
2026-06-01 23:46:21 | INFO | Trial 122 | outer=9 | alpha=3.234e+04 n_pcs=4500 (pc_topk) weight={'name': 'uniform'}
[I 2026-06-01 23:46:30,213] Trial 122 finished with value: 0.22431698260113234 and parameters: {'alpha': 32336.01589308732, 'n_pcs': 4500, 'iw_method': 'uniform'}. Best is trial 122 with value: 0.22431698260113234.
2026-06-01 23:46:30 | INFO | Trial 123 | outer=9 | alpha=2.132e+04 n_pcs=4500 (pc_topk) weight={'name': 'uniform'}
[I 2026-06-01 23:46:39,179] Trial 123 finished with value: 0.2235613036701137 and parameters: {'alpha': 21317.657498343222, 'n_pcs': 4500, 'iw_method': 'uniform'}. Best is trial 122 with value: 0.22431698260113234.
2026-06-01 23:46:39 | INFO | Trial 124 | outer=9 | alpha=4.648e+04 n_pcs=4500 (pc_topk) weight={'name': 'uniform'}
[I 2026-06-01 23:46:48,293] Trial 124 finished with value: 0.22350182303825616 and parameters: {'alpha': 46482.280961445584, 'n_pcs': 4500, 'iw_method': 'uniform'}. Best is trial 122 with value: 0.22431698260113234.
2026-06-01 23:46:48 | INFO | Trial 125 | outer=9 | alpha=3.259e+04 n_pcs=4000 (pc_topk) weight={'name': 'uniform'}
[I 2026-06-01 23:46:55,394] Trial 125 finished with value: 0.2207400041519672 and parameters: {'alpha': 32586.30888854235, 'n_pcs': 4000, 'iw_method': 'uniform'}. Best is trial 122 with value: 0.22431698260113234.
2026-06-01 23:46:55 | INFO | Trial 126 | outer=9 | alpha=2.871e+04 n_pcs=4500 (pc_topk) weight={'name': 'uniform'}
[I 2026-06-01 23:47:04,825] Trial 126 finished with value: 0.22430298439138388 and parameters: {'alpha': 28712.121149141014, 'n_pcs': 4500, 'iw_method': 'uniform'}. Best is trial 122 with value: 0.22431698260113234.
2026-06-01 23:47:04 | INFO | Trial 127 | outer=9 | alpha=1.734e+04 n_pcs=5000 (pc_topk) weight={'name': 'uniform'}
[I 2026-06-01 23:47:15,225] Trial 127 finished with value: 0.2215910075825044 and parameters: {'alpha': 17343.802277285435, 'n_pcs': 5000, 'iw_method': 'uniform'}. Best is trial 122 with value: 0.22431698260113234.
2026-06-01 23:47:15 | INFO | Trial 128 | outer=9 | alpha=5.231e+05 n_pcs=4500 (pc_topk) weight={'name': 'uniform'}
[I 2026-06-01 23:47:24,095] Trial 128 finished with value: 0.2023673134578819 and parameters: {'alpha': 523107.00166655175, 'n_pcs': 4500, 'iw_method': 'uniform'}. Best is trial 122 with value: 0.22431698260113234.
2026-06-01 23:47:24 | INFO | Trial 129 | outer=9 | alpha=2.660e+04 n_pcs=4000 (pc_topk) weight={'name': 'uniform'}
[I 2026-06-01 23:47:31,335] Trial 129 finished with value: 0.21977695677722964 and parameters: {'alpha': 26602.409430856726, 'n_pcs': 4000, 'iw_method': 'uniform'}. Best is trial 122 with value: 0.22431698260113234.
2026-06-01 23:47:31 | INFO | Trial 130 | outer=9 | alpha=2.089e+04 n_pcs=4500 (pc_topk) weight={'name': 'uniform'}
[I 2026-06-01 23:47:40,336] Trial 130 finished with value: 0.22347200987341526 and parameters: {'alpha': 20893.89836150587, 'n_pcs': 4500, 'iw_method': 'uniform'}. Best is trial 122 with value: 0.22431698260113234.
2026-06-01 23:47:40 | INFO | Trial 131 | outer=9 | alpha=2.909e+04 n_pcs=4500 (pc_topk) weight={'name': 'uniform'}
[I 2026-06-01 23:47:49,399] Trial 131 finished with value: 0.22431199198714208 and parameters: {'alpha': 29093.255051751436, 'n_pcs': 4500, 'iw_method': 'uniform'}. Best is trial 122 with value: 0.22431698260113234.
2026-06-01 23:47:49 | INFO | Trial 132 | outer=9 | alpha=2.910e+04 n_pcs=4500 (pc_topk) weight={'name': 'uniform'}
[I 2026-06-01 23:47:58,435] Trial 132 finished with value: 0.22431219432323107 and parameters: {'alpha': 29100.85428905452, 'n_pcs': 4500, 'iw_method': 'uniform'}. Best is trial 122 with value: 0.22431698260113234.
2026-06-01 23:47:58 | INFO | Trial 133 | outer=9 | alpha=3.018e+04 n_pcs=4500 (pc_topk) weight={'name': 'uniform'}
[I 2026-06-01 23:48:07,456] Trial 133 finished with value: 0.22432725092382003 and parameters: {'alpha': 30182.783418048475, 'n_pcs': 4500, 'iw_method': 'uniform'}. Best is trial 133 with value: 0.22432725092382003.
2026-06-01 23:48:07 | INFO | Trial 134 | outer=9 | alpha=4.580e+04 n_pcs=4500 (pc_topk) weight={'name': 'uniform'}
[I 2026-06-01 23:48:16,339] Trial 134 finished with value: 0.22355789394266012 and parameters: {'alpha': 45800.93253041067, 'n_pcs': 4500, 'iw_method': 'uniform'}. Best is trial 133 with value: 0.22432725092382003.
2026-06-01 23:48:16 | INFO | Trial 135 | outer=9 | alpha=3.172e+04 n_pcs=4500 (pc_topk) weight={'name': 'uniform'}
[I 2026-06-01 23:48:25,524] Trial 135 finished with value: 0.22432483004007078 and parameters: {'alpha': 31720.722282742718, 'n_pcs': 4500, 'iw_method': 'uniform'}. Best is trial 133 with value: 0.22432725092382003.
2026-06-01 23:48:25 | INFO | Trial 136 | outer=9 | alpha=3.086e+04 n_pcs=5000 (pc_topk) weight={'name': 'uniform'}
[I 2026-06-01 23:48:35,875] Trial 136 finished with value: 0.2232235089169531 and parameters: {'alpha': 30855.42596746578, 'n_pcs': 5000, 'iw_method': 'uniform'}. Best is trial 133 with value: 0.22432725092382003.
2026-06-01 23:48:35 | INFO | Trial 137 | outer=9 | alpha=5.390e+04 n_pcs=4500 (pc_topk) weight={'name': 'pc_logistic', 'floor': 1e-06, 'clip_max': 7.0, 'prob_clip': 0.004889310380452023, 'n_components': 40, 'logistic_c': 0.003310412361045688, 'pca_fit': 'combined', 'solver': 'lbfgs', 'max_iter': 2000, 'fit_intercept': True, 'standardize_with_source': True, 'rho': 1.0}
2026-06-01 23:48:55 | INFO | Trial 137 rejected by ESS guard: mean_ess=712.83 threshold=1027.26
[I 2026-06-01 23:48:55,513] Trial 137 finished with value: -1.0 and parameters: {'alpha': 53899.71437728309, 'n_pcs': 4500, 'iw_method': 'pc_logistic', 'iw_clip_max': 7.0, 'iw_prob_clip': 0.004889310380452023, 'iw_n_components': 40, 'iw_logistic_c': 0.003310412361045688, 'iw_pca_fit': 'combined', 'iw_solver': 'lbfgs', 'iw_rho': 1.0}. Best is trial 133 with value: 0.22432725092382003.
2026-06-01 23:48:55 | INFO | Trial 138 | outer=9 | alpha=2.083e+04 n_pcs=3000 (pc_topk) weight={'name': 'uniform'}
[I 2026-06-01 23:49:00,870] Trial 138 finished with value: 0.2152088382711883 and parameters: {'alpha': 20834.94829925854, 'n_pcs': 3000, 'iw_method': 'uniform'}. Best is trial 133 with value: 0.22432725092382003.
2026-06-01 23:49:00 | INFO | Trial 139 | outer=9 | alpha=1.593e+04 n_pcs=4500 (pc_topk) weight={'name': 'uniform'}
[I 2026-06-01 23:49:09,964] Trial 139 finished with value: 0.22172800150356312 and parameters: {'alpha': 15932.966173000495, 'n_pcs': 4500, 'iw_method': 'uniform'}. Best is trial 133 with value: 0.22432725092382003.
2026-06-01 23:49:09 | INFO | Trial 140 | outer=9 | alpha=4.344e+04 n_pcs=5000 (pc_topk) weight={'name': 'uniform'}
[I 2026-06-01 23:49:20,491] Trial 140 finished with value: 0.2226295559463131 and parameters: {'alpha': 43444.925874597626, 'n_pcs': 5000, 'iw_method': 'uniform'}. Best is trial 133 with value: 0.22432725092382003.
2026-06-01 23:49:20 | INFO | Trial 141 | outer=9 | alpha=2.931e+04 n_pcs=4500 (pc_topk) weight={'name': 'uniform'}
[I 2026-06-01 23:49:29,670] Trial 141 finished with value: 0.2243162808802403 and parameters: {'alpha': 29313.18736479911, 'n_pcs': 4500, 'iw_method': 'uniform'}. Best is trial 133 with value: 0.22432725092382003.
2026-06-01 23:49:29 | INFO | Trial 142 | outer=9 | alpha=2.980e+04 n_pcs=4500 (pc_topk) weight={'name': 'uniform'}
[I 2026-06-01 23:49:38,610] Trial 142 finished with value: 0.22432364541143265 and parameters: {'alpha': 29804.975399236926, 'n_pcs': 4500, 'iw_method': 'uniform'}. Best is trial 133 with value: 0.22432725092382003.
2026-06-01 23:49:38 | INFO | Trial 143 | outer=9 | alpha=2.428e+04 n_pcs=4500 (pc_topk) weight={'name': 'uniform'}
[I 2026-06-01 23:49:47,744] Trial 143 finished with value: 0.2240163283548028 and parameters: {'alpha': 24281.09651693972, 'n_pcs': 4500, 'iw_method': 'uniform'}. Best is trial 133 with value: 0.22432725092382003.
2026-06-01 23:49:47 | INFO | Trial 144 | outer=9 | alpha=2.996e+04 n_pcs=4500 (pc_topk) weight={'name': 'uniform'}
[I 2026-06-01 23:49:56,828] Trial 144 finished with value: 0.22432539470243654 and parameters: {'alpha': 29963.839238545086, 'n_pcs': 4500, 'iw_method': 'uniform'}. Best is trial 133 with value: 0.22432725092382003.
2026-06-01 23:49:56 | INFO | Trial 145 | outer=9 | alpha=2.256e+04 n_pcs=4000 (pc_topk) weight={'name': 'uniform'}
[I 2026-06-01 23:50:04,728] Trial 145 finished with value: 0.2185167349221485 and parameters: {'alpha': 22555.638287195998, 'n_pcs': 4000, 'iw_method': 'uniform'}. Best is trial 133 with value: 0.22432725092382003.
2026-06-01 23:50:04 | INFO | Trial 146 | outer=9 | alpha=6.902e+04 n_pcs=4500 (pc_topk) weight={'name': 'uniform'}
[I 2026-06-01 23:50:13,800] Trial 146 finished with value: 0.2213920743971906 and parameters: {'alpha': 69017.02934108631, 'n_pcs': 4500, 'iw_method': 'uniform'}. Best is trial 133 with value: 0.22432725092382003.
2026-06-01 23:50:13 | INFO | Trial 147 | outer=9 | alpha=1.854e+06 n_pcs=4500 (pc_topk) weight={'name': 'uniform'}
[I 2026-06-01 23:50:22,755] Trial 147 finished with value: 0.1937009031911111 and parameters: {'alpha': 1853595.1580476451, 'n_pcs': 4500, 'iw_method': 'uniform'}. Best is trial 133 with value: 0.22432725092382003.
2026-06-01 23:50:22 | INFO | Trial 148 | outer=9 | alpha=2.978e+04 n_pcs=4500 (pc_topk) weight={'name': 'uniform'}
[I 2026-06-01 23:50:31,619] Trial 148 finished with value: 0.22432341337026546 and parameters: {'alpha': 29784.925104478003, 'n_pcs': 4500, 'iw_method': 'uniform'}. Best is trial 133 with value: 0.22432725092382003.
2026-06-01 23:50:31 | INFO | Trial 149 | outer=9 | alpha=1.802e+04 n_pcs=4500 (pc_topk) weight={'name': 'uniform'}
[I 2026-06-01 23:50:40,491] Trial 149 finished with value: 0.22264695280784705 and parameters: {'alpha': 18018.05042177831, 'n_pcs': 4500, 'iw_method': 'uniform'}. Best is trial 133 with value: 0.22432725092382003.
2026-06-01 23:50:40 | INFO | Trial 150 | outer=9 | alpha=4.124e+04 n_pcs=5000 (pc_topk) weight={'name': 'uniform'}
[I 2026-06-01 23:50:50,738] Trial 150 finished with value: 0.2227856493736063 and parameters: {'alpha': 41240.85947061179, 'n_pcs': 5000, 'iw_method': 'uniform'}. Best is trial 133 with value: 0.22432725092382003.
2026-06-01 23:50:50 | INFO | Trial 151 | outer=9 | alpha=2.892e+04 n_pcs=4500 (pc_topk) weight={'name': 'uniform'}
[I 2026-06-01 23:50:59,525] Trial 151 finished with value: 0.22430807210827108 and parameters: {'alpha': 28916.742310769743, 'n_pcs': 4500, 'iw_method': 'uniform'}. Best is trial 133 with value: 0.22432725092382003.
2026-06-01 23:50:59 | INFO | Trial 152 | outer=9 | alpha=2.942e+04 n_pcs=4500 (pc_topk) weight={'name': 'uniform'}
[I 2026-06-01 23:51:08,314] Trial 152 finished with value: 0.2243181858027329 and parameters: {'alpha': 29419.926388344236, 'n_pcs': 4500, 'iw_method': 'uniform'}. Best is trial 133 with value: 0.22432725092382003.
2026-06-01 23:51:08 | INFO | Trial 153 | outer=9 | alpha=2.371e+04 n_pcs=4500 (pc_topk) weight={'name': 'uniform'}
[I 2026-06-01 23:51:17,156] Trial 153 finished with value: 0.22394910758394096 and parameters: {'alpha': 23711.912222171777, 'n_pcs': 4500, 'iw_method': 'uniform'}. Best is trial 133 with value: 0.22432725092382003.
2026-06-01 23:51:17 | INFO | Trial 154 | outer=9 | alpha=5.424e+04 n_pcs=4500 (pc_topk) weight={'name': 'uniform'}
[I 2026-06-01 23:51:25,903] Trial 154 finished with value: 0.22281224098116645 and parameters: {'alpha': 54237.51009759327, 'n_pcs': 4500, 'iw_method': 'uniform'}. Best is trial 133 with value: 0.22432725092382003.
2026-06-01 23:51:25 | INFO | Trial 155 | outer=9 | alpha=4.022e+04 n_pcs=4500 (pc_topk) weight={'name': 'uniform'}
[I 2026-06-01 23:51:34,870] Trial 155 finished with value: 0.22397144462799695 and parameters: {'alpha': 40219.40021280385, 'n_pcs': 4500, 'iw_method': 'uniform'}. Best is trial 133 with value: 0.22432725092382003.
2026-06-01 23:51:34 | INFO | Trial 156 | outer=9 | alpha=2.938e+04 n_pcs=4000 (pc_topk) weight={'name': 'uniform'}
[I 2026-06-01 23:51:41,825] Trial 156 finished with value: 0.22032488717205165 and parameters: {'alpha': 29377.90473837114, 'n_pcs': 4000, 'iw_method': 'uniform'}. Best is trial 133 with value: 0.22432725092382003.
2026-06-01 23:51:41 | INFO | Trial 157 | outer=9 | alpha=1.530e+04 n_pcs=4500 (pc_topk) weight={'name': 'uniform'}
[I 2026-06-01 23:51:50,611] Trial 157 finished with value: 0.22137908281421073 and parameters: {'alpha': 15304.962612735357, 'n_pcs': 4500, 'iw_method': 'uniform'}. Best is trial 133 with value: 0.22432725092382003.
2026-06-01 23:51:50 | INFO | Trial 158 | outer=9 | alpha=1.959e+04 n_pcs=1000 (pc_topk) weight={'name': 'uniform'}
[I 2026-06-01 23:51:53,346] Trial 158 finished with value: 0.20119073683664385 and parameters: {'alpha': 19585.441205335013, 'n_pcs': 1000, 'iw_method': 'uniform'}. Best is trial 133 with value: 0.22432725092382003.
2026-06-01 23:51:53 | INFO | Trial 159 | outer=9 | alpha=2.986e+04 n_pcs=4500 (pc_topk) weight={'name': 'uniform'}
[I 2026-06-01 23:52:02,314] Trial 159 finished with value: 0.22432426660035945 and parameters: {'alpha': 29856.2295517697, 'n_pcs': 4500, 'iw_method': 'uniform'}. Best is trial 133 with value: 0.22432725092382003.
2026-06-01 23:52:02 | INFO | Trial 160 | outer=9 | alpha=3.977e+04 n_pcs=5000 (pc_topk) weight={'name': 'pc_logistic', 'floor': 1e-06, 'clip_max': 2.5, 'prob_clip': 0.008200311805457224, 'n_components': 60, 'logistic_c': 0.3141530832337547, 'pca_fit': 'combined', 'solver': 'lbfgs', 'max_iter': 2000, 'fit_intercept': True, 'standardize_with_source': True, 'rho': 0.7}
[I 2026-06-01 23:52:28,171] Trial 160 finished with value: 0.23027485355314625 and parameters: {'alpha': 39772.18634479413, 'n_pcs': 5000, 'iw_method': 'pc_logistic', 'iw_clip_max': 2.5, 'iw_prob_clip': 0.008200311805457224, 'iw_n_components': 60, 'iw_logistic_c': 0.3141530832337547, 'iw_pca_fit': 'combined', 'iw_solver': 'lbfgs', 'iw_rho': 0.7}. Best is trial 160 with value: 0.23027485355314625.
2026-06-01 23:52:28 | INFO | Trial 161 | outer=9 | alpha=3.915e+04 n_pcs=5000 (pc_topk) weight={'name': 'pc_logistic', 'floor': 1e-06, 'clip_max': 2.5, 'prob_clip': 0.007874484569095423, 'n_components': 60, 'logistic_c': 0.569303953997773, 'pca_fit': 'combined', 'solver': 'lbfgs', 'max_iter': 2000, 'fit_intercept': True, 'standardize_with_source': True, 'rho': 0.7}
[I 2026-06-01 23:52:52,964] Trial 161 finished with value: 0.2301642088378974 and parameters: {'alpha': 39148.69237406333, 'n_pcs': 5000, 'iw_method': 'pc_logistic', 'iw_clip_max': 2.5, 'iw_prob_clip': 0.007874484569095423, 'iw_n_components': 60, 'iw_logistic_c': 0.569303953997773, 'iw_pca_fit': 'combined', 'iw_solver': 'lbfgs', 'iw_rho': 0.7}. Best is trial 160 with value: 0.23027485355314625.
2026-06-01 23:52:52 | INFO | Trial 162 | outer=9 | alpha=3.982e+04 n_pcs=5000 (pc_topk) weight={'name': 'pc_logistic', 'floor': 1e-06, 'clip_max': 2.5, 'prob_clip': 0.007957510998272375, 'n_components': 60, 'logistic_c': 0.6888874900176267, 'pca_fit': 'combined', 'solver': 'lbfgs', 'max_iter': 2000, 'fit_intercept': True, 'standardize_with_source': True, 'rho': 0.7}
[I 2026-06-01 23:53:18,372] Trial 162 finished with value: 0.23025275930520506 and parameters: {'alpha': 39821.55313999334, 'n_pcs': 5000, 'iw_method': 'pc_logistic', 'iw_clip_max': 2.5, 'iw_prob_clip': 0.007957510998272375, 'iw_n_components': 60, 'iw_logistic_c': 0.6888874900176267, 'iw_pca_fit': 'combined', 'iw_solver': 'lbfgs', 'iw_rho': 0.7}. Best is trial 160 with value: 0.23027485355314625.
2026-06-01 23:53:18 | INFO | Trial 163 | outer=9 | alpha=4.792e+04 n_pcs=5000 (pc_topk) weight={'name': 'pc_logistic', 'floor': 1e-06, 'clip_max': 2.5, 'prob_clip': 0.008114330090179948, 'n_components': 60, 'logistic_c': 0.6083956022407048, 'pca_fit': 'combined', 'solver': 'lbfgs', 'max_iter': 2000, 'fit_intercept': True, 'standardize_with_source': True, 'rho': 0.7}
[I 2026-06-01 23:53:43,650] Trial 163 finished with value: 0.2307859772023229 and parameters: {'alpha': 47920.27635144814, 'n_pcs': 5000, 'iw_method': 'pc_logistic', 'iw_clip_max': 2.5, 'iw_prob_clip': 0.008114330090179948, 'iw_n_components': 60, 'iw_logistic_c': 0.6083956022407048, 'iw_pca_fit': 'combined', 'iw_solver': 'lbfgs', 'iw_rho': 0.7}. Best is trial 163 with value: 0.2307859772023229.
2026-06-01 23:53:43 | INFO | Trial 164 | outer=9 | alpha=4.672e+04 n_pcs=5000 (pc_topk) weight={'name': 'pc_logistic', 'floor': 1e-06, 'clip_max': 2.5, 'prob_clip': 0.007783968939751479, 'n_components': 60, 'logistic_c': 0.5772235258717272, 'pca_fit': 'combined', 'solver': 'lbfgs', 'max_iter': 2000, 'fit_intercept': True, 'standardize_with_source': True, 'rho': 0.7}
[I 2026-06-01 23:54:08,722] Trial 164 finished with value: 0.23062249981487412 and parameters: {'alpha': 46716.99957096655, 'n_pcs': 5000, 'iw_method': 'pc_logistic', 'iw_clip_max': 2.5, 'iw_prob_clip': 0.007783968939751479, 'iw_n_components': 60, 'iw_logistic_c': 0.5772235258717272, 'iw_pca_fit': 'combined', 'iw_solver': 'lbfgs', 'iw_rho': 0.7}. Best is trial 163 with value: 0.2307859772023229.
2026-06-01 23:54:08 | INFO | Trial 165 | outer=9 | alpha=4.877e+04 n_pcs=5000 (pc_topk) weight={'name': 'pc_logistic', 'floor': 1e-06, 'clip_max': 2.5, 'prob_clip': 0.008057719949782095, 'n_components': 60, 'logistic_c': 0.5778012625352749, 'pca_fit': 'combined', 'solver': 'lbfgs', 'max_iter': 2000, 'fit_intercept': True, 'standardize_with_source': True, 'rho': 0.7}
[I 2026-06-01 23:54:33,469] Trial 165 finished with value: 0.2307856165572839 and parameters: {'alpha': 48766.95086033184, 'n_pcs': 5000, 'iw_method': 'pc_logistic', 'iw_clip_max': 2.5, 'iw_prob_clip': 0.008057719949782095, 'iw_n_components': 60, 'iw_logistic_c': 0.5778012625352749, 'iw_pca_fit': 'combined', 'iw_solver': 'lbfgs', 'iw_rho': 0.7}. Best is trial 163 with value: 0.2307859772023229.
2026-06-01 23:54:33 | INFO | Trial 166 | outer=9 | alpha=6.141e+04 n_pcs=5000 (pc_topk) weight={'name': 'pc_logistic', 'floor': 1e-06, 'clip_max': 2.5, 'prob_clip': 0.007529945186104906, 'n_components': 60, 'logistic_c': 0.6405307424072881, 'pca_fit': 'combined', 'solver': 'lbfgs', 'max_iter': 2000, 'fit_intercept': True, 'standardize_with_source': True, 'rho': 0.7}
[I 2026-06-01 23:54:58,784] Trial 166 finished with value: 0.2308173183250528 and parameters: {'alpha': 61405.22053836409, 'n_pcs': 5000, 'iw_method': 'pc_logistic', 'iw_clip_max': 2.5, 'iw_prob_clip': 0.007529945186104906, 'iw_n_components': 60, 'iw_logistic_c': 0.6405307424072881, 'iw_pca_fit': 'combined', 'iw_solver': 'lbfgs', 'iw_rho': 0.7}. Best is trial 166 with value: 0.2308173183250528.
2026-06-01 23:54:58 | INFO | Trial 167 | outer=9 | alpha=6.118e+04 n_pcs=5000 (pc_topk) weight={'name': 'pc_logistic', 'floor': 1e-06, 'clip_max': 2.5, 'prob_clip': 0.007939433086691226, 'n_components': 60, 'logistic_c': 0.8512391421547819, 'pca_fit': 'combined', 'solver': 'lbfgs', 'max_iter': 2000, 'fit_intercept': True, 'standardize_with_source': True, 'rho': 0.7}
[I 2026-06-01 23:55:24,254] Trial 167 finished with value: 0.23098583057097094 and parameters: {'alpha': 61179.35826946913, 'n_pcs': 5000, 'iw_method': 'pc_logistic', 'iw_clip_max': 2.5, 'iw_prob_clip': 0.007939433086691226, 'iw_n_components': 60, 'iw_logistic_c': 0.8512391421547819, 'iw_pca_fit': 'combined', 'iw_solver': 'lbfgs', 'iw_rho': 0.7}. Best is trial 167 with value: 0.23098583057097094.
2026-06-01 23:55:24 | INFO | Trial 168 | outer=9 | alpha=7.360e+04 n_pcs=5000 (pc_topk) weight={'name': 'pc_logistic', 'floor': 1e-06, 'clip_max': 2.5, 'prob_clip': 0.00864770742484144, 'n_components': 60, 'logistic_c': 0.7064215979106916, 'pca_fit': 'combined', 'solver': 'lbfgs', 'max_iter': 2000, 'fit_intercept': True, 'standardize_with_source': True, 'rho': 0.7}
[I 2026-06-01 23:55:49,282] Trial 168 finished with value: 0.2310715410277358 and parameters: {'alpha': 73596.98929539495, 'n_pcs': 5000, 'iw_method': 'pc_logistic', 'iw_clip_max': 2.5, 'iw_prob_clip': 0.00864770742484144, 'iw_n_components': 60, 'iw_logistic_c': 0.7064215979106916, 'iw_pca_fit': 'combined', 'iw_solver': 'lbfgs', 'iw_rho': 0.7}. Best is trial 168 with value: 0.2310715410277358.
2026-06-01 23:55:49 | INFO | Trial 169 | outer=9 | alpha=8.152e+04 n_pcs=5000 (pc_topk) weight={'name': 'pc_logistic', 'floor': 1e-06, 'clip_max': 2.5, 'prob_clip': 0.008051534486849875, 'n_components': 60, 'logistic_c': 0.74658060150895, 'pca_fit': 'combined', 'solver': 'lbfgs', 'max_iter': 2000, 'fit_intercept': True, 'standardize_with_source': True, 'rho': 0.7}
[I 2026-06-01 23:56:14,982] Trial 169 finished with value: 0.2307107144231912 and parameters: {'alpha': 81524.8271469921, 'n_pcs': 5000, 'iw_method': 'pc_logistic', 'iw_clip_max': 2.5, 'iw_prob_clip': 0.008051534486849875, 'iw_n_components': 60, 'iw_logistic_c': 0.74658060150895, 'iw_pca_fit': 'combined', 'iw_solver': 'lbfgs', 'iw_rho': 0.7}. Best is trial 168 with value: 0.2310715410277358.
2026-06-01 23:56:15 | INFO | Trial 170 | outer=9 | alpha=9.348e+04 n_pcs=5000 (pc_topk) weight={'name': 'pc_logistic', 'floor': 1e-06, 'clip_max': 2.5, 'prob_clip': 0.00816035288967187, 'n_components': 60, 'logistic_c': 0.7057344102582864, 'pca_fit': 'combined', 'solver': 'lbfgs', 'max_iter': 2000, 'fit_intercept': True, 'standardize_with_source': True, 'rho': 0.7}
