[I 2026-06-01 02:36:36,923] Trial 188 finished with value: 0.2357009721687559 and parameters: {'alpha': 126288.01254430549, 'n_pcs': 4000, 'weight_scheme': 'linear', 'weight_clip_max': 10.0, 'weight_linear_min_weight': 0.1267965192315766, 'weight_linear_max_weight': 2.3722296125853375}. Best is trial 161 with value: 0.23590282759169154.
2026-06-01 02:36:36 | INFO | src.nested_cv_avggrm_weighted_unified | Trial 189 | outer=10 | alpha=5.608e+04 n_pcs=4000 (pc_topk) weight_search=on
2026-06-01 02:36:36 | INFO | src.nested_cv_avggrm_weighted_unified | Trial 189 | outer=10 | weight={'name': 'linear', 'floor': 1e-06, 'clip_max': 10.0, 'min_weight': 0.052052043428790974, 'max_weight': 2.464573496969437}
2026-06-01 02:36:41 | INFO | src.nested_cv_avggrm_weighted_unified | Trial 189 | outer=10 | pruned after 8/10 inner folds (mean r=0.2634)
[I 2026-06-01 02:36:41,577] Trial 189 pruned. 
2026-06-01 02:36:41 | INFO | src.nested_cv_avggrm_weighted_unified | Trial 190 | outer=10 | alpha=2.464e+05 n_pcs=4000 (pc_topk) weight_search=on
2026-06-01 02:36:41 | INFO | src.nested_cv_avggrm_weighted_unified | Trial 190 | outer=10 | weight={'name': 'linear', 'floor': 1e-06, 'clip_max': 10.0, 'min_weight': 0.0909557400681009, 'max_weight': 2.0384165263363836}
[I 2026-06-01 02:36:47,354] Trial 190 finished with value: 0.23364374378651048 and parameters: {'alpha': 246378.96223366217, 'n_pcs': 4000, 'weight_scheme': 'linear', 'weight_clip_max': 10.0, 'weight_linear_min_weight': 0.0909557400681009, 'weight_linear_max_weight': 2.0384165263363836}. Best is trial 161 with value: 0.23590282759169154.
2026-06-01 02:36:47 | INFO | src.nested_cv_avggrm_weighted_unified | Trial 191 | outer=10 | alpha=1.064e+05 n_pcs=4000 (pc_topk) weight_search=on
2026-06-01 02:36:47 | INFO | src.nested_cv_avggrm_weighted_unified | Trial 191 | outer=10 | weight={'name': 'linear', 'floor': 1e-06, 'clip_max': 10.0, 'min_weight': 0.050680049182618446, 'max_weight': 2.3928919924304286}
[I 2026-06-01 02:36:53,592] Trial 191 finished with value: 0.23583945298903092 and parameters: {'alpha': 106416.70464847784, 'n_pcs': 4000, 'weight_scheme': 'linear', 'weight_clip_max': 10.0, 'weight_linear_min_weight': 0.050680049182618446, 'weight_linear_max_weight': 2.3928919924304286}. Best is trial 161 with value: 0.23590282759169154.
2026-06-01 02:36:53 | INFO | src.nested_cv_avggrm_weighted_unified | Trial 192 | outer=10 | alpha=1.268e+05 n_pcs=4000 (pc_topk) weight_search=on
2026-06-01 02:36:53 | INFO | src.nested_cv_avggrm_weighted_unified | Trial 192 | outer=10 | weight={'name': 'linear', 'floor': 1e-06, 'clip_max': 10.0, 'min_weight': 0.07705741909432574, 'max_weight': 2.750559525785567}
[I 2026-06-01 02:36:59,456] Trial 192 finished with value: 0.23588715559335327 and parameters: {'alpha': 126777.89325213358, 'n_pcs': 4000, 'weight_scheme': 'linear', 'weight_clip_max': 10.0, 'weight_linear_min_weight': 0.07705741909432574, 'weight_linear_max_weight': 2.750559525785567}. Best is trial 161 with value: 0.23590282759169154.
2026-06-01 02:36:59 | INFO | src.nested_cv_avggrm_weighted_unified | Trial 193 | outer=10 | alpha=1.454e+05 n_pcs=4000 (pc_topk) weight_search=on
2026-06-01 02:36:59 | INFO | src.nested_cv_avggrm_weighted_unified | Trial 193 | outer=10 | weight={'name': 'linear', 'floor': 1e-06, 'clip_max': 10.0, 'min_weight': 0.07450791699335776, 'max_weight': 2.7383700904455095}
[I 2026-06-01 02:37:05,245] Trial 193 finished with value: 0.23574934839149392 and parameters: {'alpha': 145423.6058411443, 'n_pcs': 4000, 'weight_scheme': 'linear', 'weight_clip_max': 10.0, 'weight_linear_min_weight': 0.07450791699335776, 'weight_linear_max_weight': 2.7383700904455095}. Best is trial 161 with value: 0.23590282759169154.
2026-06-01 02:37:05 | INFO | src.nested_cv_avggrm_weighted_unified | Trial 194 | outer=10 | alpha=1.250e+05 n_pcs=4000 (pc_topk) weight_search=on
2026-06-01 02:37:05 | INFO | src.nested_cv_avggrm_weighted_unified | Trial 194 | outer=10 | weight={'name': 'linear', 'floor': 1e-06, 'clip_max': 10.0, 'min_weight': 0.09597319297553165, 'max_weight': 2.90260486455372}
[I 2026-06-01 02:37:11,043] Trial 194 finished with value: 0.23586776680192661 and parameters: {'alpha': 124957.06301791719, 'n_pcs': 4000, 'weight_scheme': 'linear', 'weight_clip_max': 10.0, 'weight_linear_min_weight': 0.09597319297553165, 'weight_linear_max_weight': 2.90260486455372}. Best is trial 161 with value: 0.23590282759169154.
2026-06-01 02:37:11 | INFO | src.nested_cv_avggrm_weighted_unified | Trial 195 | outer=10 | alpha=9.057e+04 n_pcs=4000 (pc_topk) weight_search=on
2026-06-01 02:37:11 | INFO | src.nested_cv_avggrm_weighted_unified | Trial 195 | outer=10 | weight={'name': 'linear', 'floor': 1e-06, 'clip_max': 10.0, 'min_weight': 0.09218465228128934, 'max_weight': 2.7734287647646614}
2026-06-01 02:37:15 | INFO | src.nested_cv_avggrm_weighted_unified | Trial 195 | outer=10 | pruned after 8/10 inner folds (mean r=0.2686)
[I 2026-06-01 02:37:15,674] Trial 195 pruned. 
2026-06-01 02:37:15 | INFO | src.nested_cv_avggrm_weighted_unified | Trial 196 | outer=10 | alpha=1.706e+05 n_pcs=4000 (pc_topk) weight_search=on
2026-06-01 02:37:15 | INFO | src.nested_cv_avggrm_weighted_unified | Trial 196 | outer=10 | weight={'name': 'linear', 'floor': 1e-06, 'clip_max': 10.0, 'min_weight': 0.07364587955858645, 'max_weight': 3.075100315476819}
[I 2026-06-01 02:37:21,523] Trial 196 finished with value: 0.23544269117768452 and parameters: {'alpha': 170576.03703225605, 'n_pcs': 4000, 'weight_scheme': 'linear', 'weight_clip_max': 10.0, 'weight_linear_min_weight': 0.07364587955858645, 'weight_linear_max_weight': 3.075100315476819}. Best is trial 161 with value: 0.23590282759169154.
2026-06-01 02:37:21 | INFO | src.nested_cv_avggrm_weighted_unified | Trial 197 | outer=10 | alpha=1.308e+05 n_pcs=4000 (pc_topk) weight_search=on
2026-06-01 02:37:21 | INFO | src.nested_cv_avggrm_weighted_unified | Trial 197 | outer=10 | weight={'name': 'linear', 'floor': 1e-06, 'clip_max': 10.0, 'min_weight': 0.06776513075586987, 'max_weight': 2.6974119695829226}
[I 2026-06-01 02:37:27,457] Trial 197 finished with value: 0.2358831061659174 and parameters: {'alpha': 130771.25162538595, 'n_pcs': 4000, 'weight_scheme': 'linear', 'weight_clip_max': 10.0, 'weight_linear_min_weight': 0.06776513075586987, 'weight_linear_max_weight': 2.6974119695829226}. Best is trial 161 with value: 0.23590282759169154.
2026-06-01 02:37:27 | INFO | src.nested_cv_avggrm_weighted_unified | Trial 198 | outer=10 | alpha=1.386e+05 n_pcs=4000 (pc_topk) weight_search=on
2026-06-01 02:37:27 | INFO | src.nested_cv_avggrm_weighted_unified | Trial 198 | outer=10 | weight={'name': 'linear', 'floor': 1e-06, 'clip_max': 5.0, 'min_weight': 0.09763461885659487, 'max_weight': 2.8419371295327465}
[I 2026-06-01 02:37:33,326] Trial 198 finished with value: 0.23573174076787867 and parameters: {'alpha': 138639.35142794132, 'n_pcs': 4000, 'weight_scheme': 'linear', 'weight_clip_max': 5.0, 'weight_linear_min_weight': 0.09763461885659487, 'weight_linear_max_weight': 2.8419371295327465}. Best is trial 161 with value: 0.23590282759169154.
2026-06-01 02:37:33 | INFO | src.nested_cv_avggrm_weighted_unified | Trial 199 | outer=10 | alpha=1.926e+05 n_pcs=4000 (pc_topk) weight_search=on
2026-06-01 02:37:33 | INFO | src.nested_cv_avggrm_weighted_unified | Trial 199 | outer=10 | weight={'name': 'linear', 'floor': 1e-06, 'clip_max': 10.0, 'min_weight': 0.07206870498857715, 'max_weight': 2.6939338296000708}
[I 2026-06-01 02:37:39,433] Trial 199 finished with value: 0.23503376961141903 and parameters: {'alpha': 192629.29025130058, 'n_pcs': 4000, 'weight_scheme': 'linear', 'weight_clip_max': 10.0, 'weight_linear_min_weight': 0.07206870498857715, 'weight_linear_max_weight': 2.6939338296000708}. Best is trial 161 with value: 0.23590282759169154.
2026-06-01 02:37:39 | INFO | src.nested_cv_avggrm_weighted_unified | Trial 200 | outer=10 | alpha=1.245e+05 n_pcs=4000 (pc_topk) weight_search=on
2026-06-01 02:37:39 | INFO | src.nested_cv_avggrm_weighted_unified | Trial 200 | outer=10 | weight={'name': 'linear', 'floor': 1e-06, 'clip_max': 10.0, 'min_weight': 0.12455307930960166, 'max_weight': 3.0023669462756013}
[I 2026-06-01 02:37:45,378] Trial 200 finished with value: 0.23581503815933832 and parameters: {'alpha': 124524.65900130464, 'n_pcs': 4000, 'weight_scheme': 'linear', 'weight_clip_max': 10.0, 'weight_linear_min_weight': 0.12455307930960166, 'weight_linear_max_weight': 3.0023669462756013}. Best is trial 161 with value: 0.23590282759169154.
2026-06-01 02:37:45 | INFO | src.nested_cv_avggrm_weighted_unified | Trial 201 | outer=10 | alpha=7.460e+04 n_pcs=4000 (pc_topk) weight_search=on
2026-06-01 02:37:45 | INFO | src.nested_cv_avggrm_weighted_unified | Trial 201 | outer=10 | weight={'name': 'linear', 'floor': 1e-06, 'clip_max': 10.0, 'min_weight': 0.05056148621616606, 'max_weight': 2.6198781673058287}
2026-06-01 02:37:50 | INFO | src.nested_cv_avggrm_weighted_unified | Trial 201 | outer=10 | pruned after 8/10 inner folds (mean r=0.2668)
[I 2026-06-01 02:37:50,622] Trial 201 pruned. 
2026-06-01 02:37:50 | INFO | src.nested_cv_avggrm_weighted_unified | Trial 202 | outer=10 | alpha=1.009e+05 n_pcs=4000 (pc_topk) weight_search=on
2026-06-01 02:37:50 | INFO | src.nested_cv_avggrm_weighted_unified | Trial 202 | outer=10 | weight={'name': 'linear', 'floor': 1e-06, 'clip_max': 10.0, 'min_weight': 0.06889677108178942, 'max_weight': 2.913234126427172}
2026-06-01 02:37:55 | INFO | src.nested_cv_avggrm_weighted_unified | Trial 202 | outer=10 | pruned after 8/10 inner folds (mean r=0.2693)
[I 2026-06-01 02:37:55,429] Trial 202 pruned. 
2026-06-01 02:37:55 | INFO | src.nested_cv_avggrm_weighted_unified | Trial 203 | outer=10 | alpha=1.231e+05 n_pcs=4000 (pc_topk) weight_search=on
2026-06-01 02:37:55 | INFO | src.nested_cv_avggrm_weighted_unified | Trial 203 | outer=10 | weight={'name': 'linear', 'floor': 1e-06, 'clip_max': 10.0, 'min_weight': 0.08855885832747655, 'max_weight': 2.7650016663394834}
[I 2026-06-01 02:38:01,391] Trial 203 finished with value: 0.2358795931163964 and parameters: {'alpha': 123141.33201867764, 'n_pcs': 4000, 'weight_scheme': 'linear', 'weight_clip_max': 10.0, 'weight_linear_min_weight': 0.08855885832747655, 'weight_linear_max_weight': 2.7650016663394834}. Best is trial 161 with value: 0.23590282759169154.
2026-06-01 02:38:01 | INFO | src.nested_cv_avggrm_weighted_unified | Trial 204 | outer=10 | alpha=1.604e+05 n_pcs=4000 (pc_topk) weight_search=on
2026-06-01 02:38:01 | INFO | src.nested_cv_avggrm_weighted_unified | Trial 204 | outer=10 | weight={'name': 'linear', 'floor': 1e-06, 'clip_max': 10.0, 'min_weight': 0.090976555947092, 'max_weight': 2.7836678695389745}
[I 2026-06-01 02:38:07,160] Trial 204 finished with value: 0.2355008319048139 and parameters: {'alpha': 160368.6776053715, 'n_pcs': 4000, 'weight_scheme': 'linear', 'weight_clip_max': 10.0, 'weight_linear_min_weight': 0.090976555947092, 'weight_linear_max_weight': 2.7836678695389745}. Best is trial 161 with value: 0.23590282759169154.
2026-06-01 02:38:07 | INFO | src.nested_cv_avggrm_weighted_unified | Trial 205 | outer=10 | alpha=1.284e+05 n_pcs=4000 (pc_topk) weight_search=on
2026-06-01 02:38:07 | INFO | src.nested_cv_avggrm_weighted_unified | Trial 205 | outer=10 | weight={'name': 'linear', 'floor': 1e-06, 'clip_max': 10.0, 'min_weight': 0.10773299541132816, 'max_weight': 2.6984610404346663}
[I 2026-06-01 02:38:12,923] Trial 205 finished with value: 0.23580290628568723 and parameters: {'alpha': 128406.4426661364, 'n_pcs': 4000, 'weight_scheme': 'linear', 'weight_clip_max': 10.0, 'weight_linear_min_weight': 0.10773299541132816, 'weight_linear_max_weight': 2.6984610404346663}. Best is trial 161 with value: 0.23590282759169154.
2026-06-01 02:38:12 | INFO | src.nested_cv_avggrm_weighted_unified | Trial 206 | outer=10 | alpha=8.762e+04 n_pcs=4000 (pc_topk) weight_search=on
2026-06-01 02:38:12 | INFO | src.nested_cv_avggrm_weighted_unified | Trial 206 | outer=10 | weight={'name': 'uniform', 'floor': 1e-06, 'clip_max': None}
2026-06-01 02:38:16 | INFO | src.nested_cv_avggrm_weighted_unified | Trial 206 | outer=10 | pruned after 7/10 inner folds (mean r=0.2329)
[I 2026-06-01 02:38:16,427] Trial 206 pruned. 
2026-06-01 02:38:16 | INFO | src.nested_cv_avggrm_weighted_unified | Trial 207 | outer=10 | alpha=1.277e+05 n_pcs=2000 (pc_topk) weight_search=on
2026-06-01 02:38:16 | INFO | src.nested_cv_avggrm_weighted_unified | Trial 207 | outer=10 | weight={'name': 'linear', 'floor': 1e-06, 'clip_max': 10.0, 'min_weight': 0.0819602474200245, 'max_weight': 2.8206399684448513}
2026-06-01 02:38:18 | INFO | src.nested_cv_avggrm_weighted_unified | Trial 207 | outer=10 | pruned after 8/10 inner folds (mean r=0.2607)
[I 2026-06-01 02:38:18,435] Trial 207 pruned. 
2026-06-01 02:38:18 | INFO | src.nested_cv_avggrm_weighted_unified | Trial 208 | outer=10 | alpha=1.582e+05 n_pcs=3500 (pc_topk) weight_search=on
2026-06-01 02:38:18 | INFO | src.nested_cv_avggrm_weighted_unified | Trial 208 | outer=10 | weight={'name': 'linear', 'floor': 1e-06, 'clip_max': 10.0, 'min_weight': 0.09621706665836428, 'max_weight': 2.907175282686823}
[I 2026-06-01 02:38:23,848] Trial 208 finished with value: 0.2353117507168339 and parameters: {'alpha': 158154.94732343825, 'n_pcs': 3500, 'weight_scheme': 'linear', 'weight_clip_max': 10.0, 'weight_linear_min_weight': 0.09621706665836428, 'weight_linear_max_weight': 2.907175282686823}. Best is trial 161 with value: 0.23590282759169154.
2026-06-01 02:38:23 | INFO | src.nested_cv_avggrm_weighted_unified | Trial 209 | outer=10 | alpha=2.070e+05 n_pcs=4000 (pc_topk) weight_search=on
2026-06-01 02:38:23 | INFO | src.nested_cv_avggrm_weighted_unified | Trial 209 | outer=10 | weight={'name': 'linear', 'floor': 1e-06, 'clip_max': 10.0, 'min_weight': 0.14164758805928532, 'max_weight': 2.7411385279417297}
[I 2026-06-01 02:38:29,938] Trial 209 finished with value: 0.2343294269554618 and parameters: {'alpha': 207047.8053205475, 'n_pcs': 4000, 'weight_scheme': 'linear', 'weight_clip_max': 10.0, 'weight_linear_min_weight': 0.14164758805928532, 'weight_linear_max_weight': 2.7411385279417297}. Best is trial 161 with value: 0.23590282759169154.
2026-06-01 02:38:29 | INFO | src.nested_cv_avggrm_weighted_unified | Trial 210 | outer=10 | alpha=1.162e+05 n_pcs=4000 (pc_topk) weight_search=on
2026-06-01 02:38:29 | INFO | src.nested_cv_avggrm_weighted_unified | Trial 210 | outer=10 | weight={'name': 'linear', 'floor': 1e-06, 'clip_max': 10.0, 'min_weight': 0.11863169908402837, 'max_weight': 2.5751791445278447}
[I 2026-06-01 02:38:35,691] Trial 210 finished with value: 0.2358126843734651 and parameters: {'alpha': 116227.16222955212, 'n_pcs': 4000, 'weight_scheme': 'linear', 'weight_clip_max': 10.0, 'weight_linear_min_weight': 0.11863169908402837, 'weight_linear_max_weight': 2.5751791445278447}. Best is trial 161 with value: 0.23590282759169154.
2026-06-01 02:38:35 | INFO | src.nested_cv_avggrm_weighted_unified | Trial 211 | outer=10 | alpha=1.098e+05 n_pcs=4000 (pc_topk) weight_search=on
2026-06-01 02:38:35 | INFO | src.nested_cv_avggrm_weighted_unified | Trial 211 | outer=10 | weight={'name': 'linear', 'floor': 1e-06, 'clip_max': 10.0, 'min_weight': 0.06766791522246203, 'max_weight': 2.6593307778887683}
[I 2026-06-01 02:38:41,428] Trial 211 finished with value: 0.23587284962774374 and parameters: {'alpha': 109796.37155909545, 'n_pcs': 4000, 'weight_scheme': 'linear', 'weight_clip_max': 10.0, 'weight_linear_min_weight': 0.06766791522246203, 'weight_linear_max_weight': 2.6593307778887683}. Best is trial 161 with value: 0.23590282759169154.
2026-06-01 02:38:41 | INFO | src.nested_cv_avggrm_weighted_unified | Trial 212 | outer=10 | alpha=9.478e+04 n_pcs=4000 (pc_topk) weight_search=on
2026-06-01 02:38:41 | INFO | src.nested_cv_avggrm_weighted_unified | Trial 212 | outer=10 | weight={'name': 'linear', 'floor': 1e-06, 'clip_max': 10.0, 'min_weight': 0.07225887480492633, 'max_weight': 2.6835811268938197}
2026-06-01 02:38:46 | INFO | src.nested_cv_avggrm_weighted_unified | Trial 212 | outer=10 | pruned after 8/10 inner folds (mean r=0.2689)
[I 2026-06-01 02:38:46,031] Trial 212 pruned. 
2026-06-01 02:38:46 | INFO | src.nested_cv_avggrm_weighted_unified | Trial 213 | outer=10 | alpha=1.400e+05 n_pcs=4000 (pc_topk) weight_search=on
2026-06-01 02:38:46 | INFO | src.nested_cv_avggrm_weighted_unified | Trial 213 | outer=10 | weight={'name': 'linear', 'floor': 1e-06, 'clip_max': 10.0, 'min_weight': 0.07104473657242444, 'max_weight': 2.521234805074053}
[I 2026-06-01 02:38:51,941] Trial 213 finished with value: 0.23579622882025147 and parameters: {'alpha': 140032.64376722908, 'n_pcs': 4000, 'weight_scheme': 'linear', 'weight_clip_max': 10.0, 'weight_linear_min_weight': 0.07104473657242444, 'weight_linear_max_weight': 2.521234805074053}. Best is trial 161 with value: 0.23590282759169154.
2026-06-01 02:38:51 | INFO | src.nested_cv_avggrm_weighted_unified | Trial 214 | outer=10 | alpha=1.146e+05 n_pcs=4000 (pc_topk) weight_search=on
2026-06-01 02:38:51 | INFO | src.nested_cv_avggrm_weighted_unified | Trial 214 | outer=10 | weight={'name': 'linear', 'floor': 1e-06, 'clip_max': 10.0, 'min_weight': 0.08783472123719727, 'max_weight': 2.8410754017186846}
[I 2026-06-01 02:38:57,954] Trial 214 finished with value: 0.23588628976213766 and parameters: {'alpha': 114571.9309499656, 'n_pcs': 4000, 'weight_scheme': 'linear', 'weight_clip_max': 10.0, 'weight_linear_min_weight': 0.08783472123719727, 'weight_linear_max_weight': 2.8410754017186846}. Best is trial 161 with value: 0.23590282759169154.
2026-06-01 02:38:57 | INFO | src.nested_cv_avggrm_weighted_unified | Trial 215 | outer=10 | alpha=8.078e+04 n_pcs=4000 (pc_topk) weight_search=on
2026-06-01 02:38:57 | INFO | src.nested_cv_avggrm_weighted_unified | Trial 215 | outer=10 | weight={'name': 'linear', 'floor': 1e-06, 'clip_max': 10.0, 'min_weight': 0.08605686239544776, 'max_weight': 2.765249122784055}
2026-06-01 02:39:02 | INFO | src.nested_cv_avggrm_weighted_unified | Trial 215 | outer=10 | pruned after 8/10 inner folds (mean r=0.2677)
[I 2026-06-01 02:39:02,576] Trial 215 pruned. 
2026-06-01 02:39:02 | INFO | src.nested_cv_avggrm_weighted_unified | Trial 216 | outer=10 | alpha=1.007e+05 n_pcs=4000 (pc_topk) weight_search=on
2026-06-01 02:39:02 | INFO | src.nested_cv_avggrm_weighted_unified | Trial 216 | outer=10 | weight={'name': 'linear', 'floor': 1e-06, 'clip_max': 10.0, 'min_weight': 0.06625491332214431, 'max_weight': 2.631294431485963}
2026-06-01 02:39:07 | INFO | src.nested_cv_avggrm_weighted_unified | Trial 216 | outer=10 | pruned after 8/10 inner folds (mean r=0.2693)
[I 2026-06-01 02:39:07,219] Trial 216 pruned. 
2026-06-01 02:39:07 | INFO | src.nested_cv_avggrm_weighted_unified | Trial 217 | outer=10 | alpha=1.585e+05 n_pcs=4000 (pc_topk) weight_search=on
2026-06-01 02:39:07 | INFO | src.nested_cv_avggrm_weighted_unified | Trial 217 | outer=10 | weight={'name': 'linear', 'floor': 1e-06, 'clip_max': 10.0, 'min_weight': 0.09180370623100166, 'max_weight': 2.8232722040597196}
[I 2026-06-01 02:39:13,071] Trial 217 finished with value: 0.23553013685709212 and parameters: {'alpha': 158523.77370329798, 'n_pcs': 4000, 'weight_scheme': 'linear', 'weight_clip_max': 10.0, 'weight_linear_min_weight': 0.09180370623100166, 'weight_linear_max_weight': 2.8232722040597196}. Best is trial 161 with value: 0.23590282759169154.
2026-06-01 02:39:13 | INFO | src.nested_cv_avggrm_weighted_unified | Trial 218 | outer=10 | alpha=1.192e+05 n_pcs=4000 (pc_topk) weight_search=on
2026-06-01 02:39:13 | INFO | src.nested_cv_avggrm_weighted_unified | Trial 218 | outer=10 | weight={'name': 'exponential', 'floor': 1e-06, 'clip_max': 10.0, 'beta': 6.284963639767385}
[I 2026-06-01 02:39:18,860] Trial 218 finished with value: 0.23387884761052286 and parameters: {'alpha': 119161.79543432828, 'n_pcs': 4000, 'weight_scheme': 'exponential', 'weight_clip_max': 10.0, 'weight_exponential_beta': 6.284963639767385}. Best is trial 161 with value: 0.23590282759169154.
2026-06-01 02:39:18 | INFO | src.nested_cv_avggrm_weighted_unified | Trial 219 | outer=10 | alpha=7.211e+04 n_pcs=4000 (pc_topk) weight_search=on
2026-06-01 02:39:18 | INFO | src.nested_cv_avggrm_weighted_unified | Trial 219 | outer=10 | weight={'name': 'linear', 'floor': 1e-06, 'clip_max': 10.0, 'min_weight': 0.06876225047711472, 'max_weight': 2.7006295915306926}
2026-06-01 02:39:23 | INFO | src.nested_cv_avggrm_weighted_unified | Trial 219 | outer=10 | pruned after 8/10 inner folds (mean r=0.2665)
[I 2026-06-01 02:39:23,500] Trial 219 pruned. 
2026-06-01 02:39:23 | INFO | src.nested_cv_avggrm_weighted_unified | Trial 220 | outer=10 | alpha=9.329e+04 n_pcs=4000 (pc_topk) weight_search=on
2026-06-01 02:39:23 | INFO | src.nested_cv_avggrm_weighted_unified | Trial 220 | outer=10 | weight={'name': 'linear', 'floor': 1e-06, 'clip_max': 10.0, 'min_weight': 0.09627674086629781, 'max_weight': 2.991960425013061}
2026-06-01 02:39:28 | INFO | src.nested_cv_avggrm_weighted_unified | Trial 220 | outer=10 | pruned after 8/10 inner folds (mean r=0.2688)
[I 2026-06-01 02:39:28,191] Trial 220 pruned. 
2026-06-01 02:39:28 | INFO | src.nested_cv_avggrm_weighted_unified | Trial 221 | outer=10 | alpha=1.283e+05 n_pcs=4000 (pc_topk) weight_search=on
2026-06-01 02:39:28 | INFO | src.nested_cv_avggrm_weighted_unified | Trial 221 | outer=10 | weight={'name': 'linear', 'floor': 1e-06, 'clip_max': 10.0, 'min_weight': 0.1084760678719317, 'max_weight': 2.9240017115632257}
