[I 2026-06-01 00:10:29,829] Trial 228 finished with value: 0.1976348781158037 and parameters: {'alpha': 109238.2812365695, 'n_pcs': 4500, 'weight_scheme': 'linear', 'weight_clip_max': 10.0, 'weight_linear_min_weight': 0.3923062488057395, 'weight_linear_max_weight': 4.986537028715837}. Best is trial 41 with value: 0.19810774778548906.
2026-06-01 00:10:29 | INFO | src.nested_cv_avggrm_weighted_unified | Trial 229 | outer=4 | alpha=1.235e+05 n_pcs=4000 (pc_topk) weight_search=on
2026-06-01 00:10:29 | INFO | src.nested_cv_avggrm_weighted_unified | Trial 229 | outer=4 | weight={'name': 'linear', 'floor': 1e-06, 'clip_max': 10.0, 'min_weight': 0.39229036598254247, 'max_weight': 4.900766058376438}
[I 2026-06-01 00:10:35,576] Trial 229 finished with value: 0.19654540840012596 and parameters: {'alpha': 123544.01419985635, 'n_pcs': 4000, 'weight_scheme': 'linear', 'weight_clip_max': 10.0, 'weight_linear_min_weight': 0.39229036598254247, 'weight_linear_max_weight': 4.900766058376438}. Best is trial 41 with value: 0.19810774778548906.
2026-06-01 00:10:35 | INFO | src.nested_cv_avggrm_weighted_unified | Trial 230 | outer=4 | alpha=1.685e+05 n_pcs=4500 (pc_topk) weight_search=on
2026-06-01 00:10:35 | INFO | src.nested_cv_avggrm_weighted_unified | Trial 230 | outer=4 | weight={'name': 'linear', 'floor': 1e-06, 'clip_max': 10.0, 'min_weight': 0.3722866739176736, 'max_weight': 4.925014389911102}
[I 2026-06-01 00:10:42,914] Trial 230 finished with value: 0.19602639930810392 and parameters: {'alpha': 168543.0400323587, 'n_pcs': 4500, 'weight_scheme': 'linear', 'weight_clip_max': 10.0, 'weight_linear_min_weight': 0.3722866739176736, 'weight_linear_max_weight': 4.925014389911102}. Best is trial 41 with value: 0.19810774778548906.
2026-06-01 00:10:42 | INFO | src.nested_cv_avggrm_weighted_unified | Trial 231 | outer=4 | alpha=1.023e+05 n_pcs=4500 (pc_topk) weight_search=on
2026-06-01 00:10:42 | INFO | src.nested_cv_avggrm_weighted_unified | Trial 231 | outer=4 | weight={'name': 'linear', 'floor': 1e-06, 'clip_max': 10.0, 'min_weight': 0.4282517865054183, 'max_weight': 4.782131583676826}
[I 2026-06-01 00:10:49,901] Trial 231 finished with value: 0.19774549091288815 and parameters: {'alpha': 102284.84263134754, 'n_pcs': 4500, 'weight_scheme': 'linear', 'weight_clip_max': 10.0, 'weight_linear_min_weight': 0.4282517865054183, 'weight_linear_max_weight': 4.782131583676826}. Best is trial 41 with value: 0.19810774778548906.
2026-06-01 00:10:49 | INFO | src.nested_cv_avggrm_weighted_unified | Trial 232 | outer=4 | alpha=8.955e+04 n_pcs=4500 (pc_topk) weight_search=on
2026-06-01 00:10:49 | INFO | src.nested_cv_avggrm_weighted_unified | Trial 232 | outer=4 | weight={'name': 'linear', 'floor': 1e-06, 'clip_max': 10.0, 'min_weight': 0.4079822669776775, 'max_weight': 4.805533806893386}
2026-06-01 00:10:54 | INFO | src.nested_cv_avggrm_weighted_unified | Trial 232 | outer=4 | pruned after 6/10 inner folds (mean r=0.2052)
[I 2026-06-01 00:10:54,108] Trial 232 pruned. 
2026-06-01 00:10:54 | INFO | src.nested_cv_avggrm_weighted_unified | Trial 233 | outer=4 | alpha=1.136e+05 n_pcs=4500 (pc_topk) weight_search=on
2026-06-01 00:10:54 | INFO | src.nested_cv_avggrm_weighted_unified | Trial 233 | outer=4 | weight={'name': 'linear', 'floor': 1e-06, 'clip_max': 10.0, 'min_weight': 0.4107056251480835, 'max_weight': 4.7725990369782565}
[I 2026-06-01 00:11:01,086] Trial 233 finished with value: 0.19749569012550575 and parameters: {'alpha': 113596.26929514193, 'n_pcs': 4500, 'weight_scheme': 'linear', 'weight_clip_max': 10.0, 'weight_linear_min_weight': 0.4107056251480835, 'weight_linear_max_weight': 4.7725990369782565}. Best is trial 41 with value: 0.19810774778548906.
2026-06-01 00:11:01 | INFO | src.nested_cv_avggrm_weighted_unified | Trial 234 | outer=4 | alpha=1.143e+05 n_pcs=4500 (pc_topk) weight_search=on
2026-06-01 00:11:01 | INFO | src.nested_cv_avggrm_weighted_unified | Trial 234 | outer=4 | weight={'name': 'linear', 'floor': 1e-06, 'clip_max': 10.0, 'min_weight': 0.4171045610091646, 'max_weight': 4.8446963009316875}
[I 2026-06-01 00:11:08,063] Trial 234 finished with value: 0.1974775698503411 and parameters: {'alpha': 114303.70597623466, 'n_pcs': 4500, 'weight_scheme': 'linear', 'weight_clip_max': 10.0, 'weight_linear_min_weight': 0.4171045610091646, 'weight_linear_max_weight': 4.8446963009316875}. Best is trial 41 with value: 0.19810774778548906.
2026-06-01 00:11:08 | INFO | src.nested_cv_avggrm_weighted_unified | Trial 235 | outer=4 | alpha=1.462e+05 n_pcs=4500 (pc_topk) weight_search=on
2026-06-01 00:11:08 | INFO | src.nested_cv_avggrm_weighted_unified | Trial 235 | outer=4 | weight={'name': 'linear', 'floor': 1e-06, 'clip_max': 10.0, 'min_weight': 0.42067353774982635, 'max_weight': 4.883312406823261}
[I 2026-06-01 00:11:15,035] Trial 235 finished with value: 0.1965681272020101 and parameters: {'alpha': 146195.76563891053, 'n_pcs': 4500, 'weight_scheme': 'linear', 'weight_clip_max': 10.0, 'weight_linear_min_weight': 0.42067353774982635, 'weight_linear_max_weight': 4.883312406823261}. Best is trial 41 with value: 0.19810774778548906.
2026-06-01 00:11:15 | INFO | src.nested_cv_avggrm_weighted_unified | Trial 236 | outer=4 | alpha=1.232e+05 n_pcs=4500 (pc_topk) weight_search=on
2026-06-01 00:11:15 | INFO | src.nested_cv_avggrm_weighted_unified | Trial 236 | outer=4 | weight={'name': 'linear', 'floor': 1e-06, 'clip_max': None, 'min_weight': 0.4316500922558635, 'max_weight': 4.759248134177964}
[I 2026-06-01 00:11:22,022] Trial 236 finished with value: 0.197205114572701 and parameters: {'alpha': 123220.99737511626, 'n_pcs': 4500, 'weight_scheme': 'linear', 'weight_clip_max': None, 'weight_linear_min_weight': 0.4316500922558635, 'weight_linear_max_weight': 4.759248134177964}. Best is trial 41 with value: 0.19810774778548906.
2026-06-01 00:11:22 | INFO | src.nested_cv_avggrm_weighted_unified | Trial 237 | outer=4 | alpha=1.110e+05 n_pcs=4500 (pc_topk) weight_search=on
2026-06-01 00:11:22 | INFO | src.nested_cv_avggrm_weighted_unified | Trial 237 | outer=4 | weight={'name': 'linear', 'floor': 1e-06, 'clip_max': 10.0, 'min_weight': 0.44756055349038276, 'max_weight': 4.971454483724983}
[I 2026-06-01 00:11:28,997] Trial 237 finished with value: 0.19753913007581897 and parameters: {'alpha': 110979.1087689469, 'n_pcs': 4500, 'weight_scheme': 'linear', 'weight_clip_max': 10.0, 'weight_linear_min_weight': 0.44756055349038276, 'weight_linear_max_weight': 4.971454483724983}. Best is trial 41 with value: 0.19810774778548906.
2026-06-01 00:11:29 | INFO | src.nested_cv_avggrm_weighted_unified | Trial 238 | outer=4 | alpha=1.165e+05 n_pcs=4500 (pc_topk) weight_search=on
2026-06-01 00:11:29 | INFO | src.nested_cv_avggrm_weighted_unified | Trial 238 | outer=4 | weight={'name': 'linear', 'floor': 1e-06, 'clip_max': 5.0, 'min_weight': 0.44775563320026546, 'max_weight': 4.870282164550572}
[I 2026-06-01 00:11:35,977] Trial 238 finished with value: 0.19738139566759705 and parameters: {'alpha': 116548.13982162985, 'n_pcs': 4500, 'weight_scheme': 'linear', 'weight_clip_max': 5.0, 'weight_linear_min_weight': 0.44775563320026546, 'weight_linear_max_weight': 4.870282164550572}. Best is trial 41 with value: 0.19810774778548906.
2026-06-01 00:11:35 | INFO | src.nested_cv_avggrm_weighted_unified | Trial 239 | outer=4 | alpha=7.183e+04 n_pcs=4500 (pc_topk) weight_search=on
2026-06-01 00:11:35 | INFO | src.nested_cv_avggrm_weighted_unified | Trial 239 | outer=4 | weight={'name': 'linear', 'floor': 1e-06, 'clip_max': 10.0, 'min_weight': 0.4016273765471371, 'max_weight': 4.960191127387508}
2026-06-01 00:11:40 | INFO | src.nested_cv_avggrm_weighted_unified | Trial 239 | outer=4 | pruned after 6/10 inner folds (mean r=0.2034)
[I 2026-06-01 00:11:40,189] Trial 239 pruned. 
2026-06-01 00:11:40 | INFO | src.nested_cv_avggrm_weighted_unified | Trial 240 | outer=4 | alpha=1.014e+06 n_pcs=4500 (pc_topk) weight_search=on
2026-06-01 00:11:40 | INFO | src.nested_cv_avggrm_weighted_unified | Trial 240 | outer=4 | weight={'name': 'linear', 'floor': 1e-06, 'clip_max': 10.0, 'min_weight': 0.4284649626617234, 'max_weight': 4.997392466662301}
2026-06-01 00:11:43 | INFO | src.nested_cv_avggrm_weighted_unified | Trial 240 | outer=4 | pruned after 5/10 inner folds (mean r=0.1589)
[I 2026-06-01 00:11:43,681] Trial 240 pruned. 
2026-06-01 00:11:43 | INFO | src.nested_cv_avggrm_weighted_unified | Trial 241 | outer=4 | alpha=1.053e+05 n_pcs=4500 (pc_topk) weight_search=on
2026-06-01 00:11:43 | INFO | src.nested_cv_avggrm_weighted_unified | Trial 241 | outer=4 | weight={'name': 'linear', 'floor': 1e-06, 'clip_max': 10.0, 'min_weight': 0.3881959528765328, 'max_weight': 4.749748449607589}
[I 2026-06-01 00:11:50,663] Trial 241 finished with value: 0.19770893633601885 and parameters: {'alpha': 105321.3376694457, 'n_pcs': 4500, 'weight_scheme': 'linear', 'weight_clip_max': 10.0, 'weight_linear_min_weight': 0.3881959528765328, 'weight_linear_max_weight': 4.749748449607589}. Best is trial 41 with value: 0.19810774778548906.
2026-06-01 00:11:50 | INFO | src.nested_cv_avggrm_weighted_unified | Trial 242 | outer=4 | alpha=8.793e+04 n_pcs=4500 (pc_topk) weight_search=on
2026-06-01 00:11:50 | INFO | src.nested_cv_avggrm_weighted_unified | Trial 242 | outer=4 | weight={'name': 'linear', 'floor': 1e-06, 'clip_max': 10.0, 'min_weight': 0.38487993071722365, 'max_weight': 4.806229479501278}
2026-06-01 00:11:54 | INFO | src.nested_cv_avggrm_weighted_unified | Trial 242 | outer=4 | pruned after 6/10 inner folds (mean r=0.2050)
[I 2026-06-01 00:11:54,864] Trial 242 pruned. 
2026-06-01 00:11:54 | INFO | src.nested_cv_avggrm_weighted_unified | Trial 243 | outer=4 | alpha=1.103e+05 n_pcs=4500 (pc_topk) weight_search=on
2026-06-01 00:11:54 | INFO | src.nested_cv_avggrm_weighted_unified | Trial 243 | outer=4 | weight={'name': 'linear', 'floor': 1e-06, 'clip_max': 10.0, 'min_weight': 0.41125139243288283, 'max_weight': 4.723391762689025}
[I 2026-06-01 00:12:01,850] Trial 243 finished with value: 0.19757305470071654 and parameters: {'alpha': 110251.70753323863, 'n_pcs': 4500, 'weight_scheme': 'linear', 'weight_clip_max': 10.0, 'weight_linear_min_weight': 0.41125139243288283, 'weight_linear_max_weight': 4.723391762689025}. Best is trial 41 with value: 0.19810774778548906.
2026-06-01 00:12:01 | INFO | src.nested_cv_avggrm_weighted_unified | Trial 244 | outer=4 | alpha=1.391e+05 n_pcs=4500 (pc_topk) weight_search=on
2026-06-01 00:12:01 | INFO | src.nested_cv_avggrm_weighted_unified | Trial 244 | outer=4 | weight={'name': 'linear', 'floor': 1e-06, 'clip_max': 10.0, 'min_weight': 0.4114692917361898, 'max_weight': 4.7049842948651595}
[I 2026-06-01 00:12:08,816] Trial 244 finished with value: 0.19676783761454947 and parameters: {'alpha': 139127.70967618912, 'n_pcs': 4500, 'weight_scheme': 'linear', 'weight_clip_max': 10.0, 'weight_linear_min_weight': 0.4114692917361898, 'weight_linear_max_weight': 4.7049842948651595}. Best is trial 41 with value: 0.19810774778548906.
2026-06-01 00:12:08 | INFO | src.nested_cv_avggrm_weighted_unified | Trial 245 | outer=4 | alpha=1.145e+05 n_pcs=4500 (pc_topk) weight_search=on
2026-06-01 00:12:08 | INFO | src.nested_cv_avggrm_weighted_unified | Trial 245 | outer=4 | weight={'name': 'linear', 'floor': 1e-06, 'clip_max': 10.0, 'min_weight': 0.36913497489422364, 'max_weight': 4.783663705875663}
[I 2026-06-01 00:12:15,811] Trial 245 finished with value: 0.19752017481544065 and parameters: {'alpha': 114507.65504144331, 'n_pcs': 4500, 'weight_scheme': 'linear', 'weight_clip_max': 10.0, 'weight_linear_min_weight': 0.36913497489422364, 'weight_linear_max_weight': 4.783663705875663}. Best is trial 41 with value: 0.19810774778548906.
2026-06-01 00:12:15 | INFO | src.nested_cv_avggrm_weighted_unified | Trial 246 | outer=4 | alpha=1.231e+05 n_pcs=4500 (pc_topk) weight_search=on
2026-06-01 00:12:15 | INFO | src.nested_cv_avggrm_weighted_unified | Trial 246 | outer=4 | weight={'name': 'linear', 'floor': 1e-06, 'clip_max': 10.0, 'min_weight': 0.3614572045192145, 'max_weight': 4.776422342160967}
[I 2026-06-01 00:12:22,783] Trial 246 finished with value: 0.19731586683873795 and parameters: {'alpha': 123094.98913002259, 'n_pcs': 4500, 'weight_scheme': 'linear', 'weight_clip_max': 10.0, 'weight_linear_min_weight': 0.3614572045192145, 'weight_linear_max_weight': 4.776422342160967}. Best is trial 41 with value: 0.19810774778548906.
2026-06-01 00:12:22 | INFO | src.nested_cv_avggrm_weighted_unified | Trial 247 | outer=4 | alpha=1.553e+05 n_pcs=4500 (pc_topk) weight_search=on
2026-06-01 00:12:22 | INFO | src.nested_cv_avggrm_weighted_unified | Trial 247 | outer=4 | weight={'name': 'linear', 'floor': 1e-06, 'clip_max': None, 'min_weight': 0.3885957361180985, 'max_weight': 4.845210980109027}
[I 2026-06-01 00:12:29,730] Trial 247 finished with value: 0.19636330888837572 and parameters: {'alpha': 155268.9511391637, 'n_pcs': 4500, 'weight_scheme': 'linear', 'weight_clip_max': None, 'weight_linear_min_weight': 0.3885957361180985, 'weight_linear_max_weight': 4.845210980109027}. Best is trial 41 with value: 0.19810774778548906.
2026-06-01 00:12:29 | INFO | src.nested_cv_avggrm_weighted_unified | Trial 248 | outer=4 | alpha=7.985e+04 n_pcs=4500 (pc_topk) weight_search=on
2026-06-01 00:12:29 | INFO | src.nested_cv_avggrm_weighted_unified | Trial 248 | outer=4 | weight={'name': 'linear', 'floor': 1e-06, 'clip_max': 10.0, 'min_weight': 0.3995018665220897, 'max_weight': 4.648148911132594}
2026-06-01 00:12:33 | INFO | src.nested_cv_avggrm_weighted_unified | Trial 248 | outer=4 | pruned after 6/10 inner folds (mean r=0.2044)
[I 2026-06-01 00:12:33,912] Trial 248 pruned. 
2026-06-01 00:12:33 | INFO | src.nested_cv_avggrm_weighted_unified | Trial 249 | outer=4 | alpha=1.096e+05 n_pcs=4500 (pc_topk) weight_search=on
2026-06-01 00:12:33 | INFO | src.nested_cv_avggrm_weighted_unified | Trial 249 | outer=4 | weight={'name': 'linear', 'floor': 1e-06, 'clip_max': 10.0, 'min_weight': 0.4380525351008261, 'max_weight': 4.995034263397564}
[I 2026-06-01 00:12:40,914] Trial 249 finished with value: 0.197584958167181 and parameters: {'alpha': 109627.55361365966, 'n_pcs': 4500, 'weight_scheme': 'linear', 'weight_clip_max': 10.0, 'weight_linear_min_weight': 0.4380525351008261, 'weight_linear_max_weight': 4.995034263397564}. Best is trial 41 with value: 0.19810774778548906.
2026-06-01 00:12:40 | INFO | src.nested_cv_avggrm_weighted_unified | Trial 250 | outer=4 | alpha=9.036e+04 n_pcs=4500 (pc_topk) weight_search=on
2026-06-01 00:12:40 | INFO | src.nested_cv_avggrm_weighted_unified | Trial 250 | outer=4 | weight={'name': 'linear', 'floor': 1e-06, 'clip_max': 20.0, 'min_weight': 0.4509345294435941, 'max_weight': 4.9988099286230385}
2026-06-01 00:12:45 | INFO | src.nested_cv_avggrm_weighted_unified | Trial 250 | outer=4 | pruned after 6/10 inner folds (mean r=0.2053)
[I 2026-06-01 00:12:45,111] Trial 250 pruned. 
2026-06-01 00:12:45 | INFO | src.nested_cv_avggrm_weighted_unified | Trial 251 | outer=4 | alpha=1.523e+03 n_pcs=4500 (pc_topk) weight_search=on
2026-06-01 00:12:45 | INFO | src.nested_cv_avggrm_weighted_unified | Trial 251 | outer=4 | weight={'name': 'linear', 'floor': 1e-06, 'clip_max': 10.0, 'min_weight': 0.47377040294633765, 'max_weight': 4.895093803444602}
2026-06-01 00:12:48 | INFO | src.nested_cv_avggrm_weighted_unified | Trial 251 | outer=4 | pruned after 5/10 inner folds (mean r=0.1301)
[I 2026-06-01 00:12:48,615] Trial 251 pruned. 
2026-06-01 00:12:48 | INFO | src.nested_cv_avggrm_weighted_unified | Trial 252 | outer=4 | alpha=5.844e+04 n_pcs=4500 (pc_topk) weight_search=on
2026-06-01 00:12:48 | INFO | src.nested_cv_avggrm_weighted_unified | Trial 252 | outer=4 | weight={'name': 'exponential', 'floor': 1e-06, 'clip_max': None, 'beta': 4.427138613057286}
2026-06-01 00:12:52 | INFO | src.nested_cv_avggrm_weighted_unified | Trial 252 | outer=4 | pruned after 6/10 inner folds (mean r=0.1959)
[I 2026-06-01 00:12:52,820] Trial 252 pruned. 
2026-06-01 00:12:52 | INFO | src.nested_cv_avggrm_weighted_unified | Trial 253 | outer=4 | alpha=3.686e+06 n_pcs=4500 (pc_topk) weight_search=on
2026-06-01 00:12:52 | INFO | src.nested_cv_avggrm_weighted_unified | Trial 253 | outer=4 | weight={'name': 'linear', 'floor': 1e-06, 'clip_max': 10.0, 'min_weight': 0.43888150337827286, 'max_weight': 4.743832337408311}
2026-06-01 00:12:56 | INFO | src.nested_cv_avggrm_weighted_unified | Trial 253 | outer=4 | pruned after 5/10 inner folds (mean r=0.1522)
[I 2026-06-01 00:12:56,310] Trial 253 pruned. 
2026-06-01 00:12:56 | INFO | src.nested_cv_avggrm_weighted_unified | Trial 254 | outer=4 | alpha=7.556e+04 n_pcs=4500 (pc_topk) weight_search=on
2026-06-01 00:12:56 | INFO | src.nested_cv_avggrm_weighted_unified | Trial 254 | outer=4 | weight={'name': 'linear', 'floor': 1e-06, 'clip_max': 10.0, 'min_weight': 0.37003638194213906, 'max_weight': 4.921863823243307}
2026-06-01 00:13:00 | INFO | src.nested_cv_avggrm_weighted_unified | Trial 254 | outer=4 | pruned after 6/10 inner folds (mean r=0.2037)
[I 2026-06-01 00:13:00,515] Trial 254 pruned. 
2026-06-01 00:13:00 | INFO | src.nested_cv_avggrm_weighted_unified | Trial 255 | outer=4 | alpha=1.062e+05 n_pcs=4500 (pc_topk) weight_search=on
2026-06-01 00:13:00 | INFO | src.nested_cv_avggrm_weighted_unified | Trial 255 | outer=4 | weight={'name': 'linear', 'floor': 1e-06, 'clip_max': 10.0, 'min_weight': 0.3536725585051533, 'max_weight': 4.633172718844169}
[I 2026-06-01 00:13:07,505] Trial 255 finished with value: 0.1977078454270949 and parameters: {'alpha': 106207.20686031632, 'n_pcs': 4500, 'weight_scheme': 'linear', 'weight_clip_max': 10.0, 'weight_linear_min_weight': 0.3536725585051533, 'weight_linear_max_weight': 4.633172718844169}. Best is trial 41 with value: 0.19810774778548906.
2026-06-01 00:13:07 | INFO | src.nested_cv_avggrm_weighted_unified | Trial 256 | outer=4 | alpha=9.510e+04 n_pcs=4500 (pc_topk) weight_search=on
2026-06-01 00:13:07 | INFO | src.nested_cv_avggrm_weighted_unified | Trial 256 | outer=4 | weight={'name': 'linear', 'floor': 1e-06, 'clip_max': None, 'min_weight': 0.33696257458882933, 'max_weight': 4.6421555826984875}
2026-06-01 00:13:11 | INFO | src.nested_cv_avggrm_weighted_unified | Trial 256 | outer=4 | pruned after 6/10 inner folds (mean r=0.2055)
[I 2026-06-01 00:13:11,712] Trial 256 pruned. 
2026-06-01 00:13:11 | INFO | src.nested_cv_avggrm_weighted_unified | Trial 257 | outer=4 | alpha=1.290e+05 n_pcs=4500 (pc_topk) weight_search=on
2026-06-01 00:13:11 | INFO | src.nested_cv_avggrm_weighted_unified | Trial 257 | outer=4 | weight={'name': 'linear', 'floor': 1e-06, 'clip_max': 10.0, 'min_weight': 0.3791048776685026, 'max_weight': 4.5802799464003465}
[I 2026-06-01 00:13:18,709] Trial 257 finished with value: 0.19710646923744837 and parameters: {'alpha': 128976.77935500881, 'n_pcs': 4500, 'weight_scheme': 'linear', 'weight_clip_max': 10.0, 'weight_linear_min_weight': 0.3791048776685026, 'weight_linear_max_weight': 4.5802799464003465}. Best is trial 41 with value: 0.19810774778548906.
2026-06-01 00:13:18 | INFO | src.nested_cv_avggrm_weighted_unified | Trial 258 | outer=4 | alpha=7.926e+04 n_pcs=5000 (pc_topk) weight_search=on
2026-06-01 00:13:18 | INFO | src.nested_cv_avggrm_weighted_unified | Trial 258 | outer=4 | weight={'name': 'uniform', 'floor': 1e-06, 'clip_max': 10.0}
2026-06-01 00:13:23 | INFO | src.nested_cv_avggrm_weighted_unified | Trial 258 | outer=4 | pruned after 6/10 inner folds (mean r=0.1953)
[I 2026-06-01 00:13:23,050] Trial 258 pruned. 
2026-06-01 00:13:23 | INFO | src.nested_cv_avggrm_weighted_unified | Trial 259 | outer=4 | alpha=1.996e+05 n_pcs=4500 (pc_topk) weight_search=on
2026-06-01 00:13:23 | INFO | src.nested_cv_avggrm_weighted_unified | Trial 259 | outer=4 | weight={'name': 'linear', 'floor': 1e-06, 'clip_max': 10.0, 'min_weight': 0.4579726022344429, 'max_weight': 4.693938703426122}
[I 2026-06-01 00:13:30,031] Trial 259 finished with value: 0.19472682956190338 and parameters: {'alpha': 199592.00761074934, 'n_pcs': 4500, 'weight_scheme': 'linear', 'weight_clip_max': 10.0, 'weight_linear_min_weight': 0.4579726022344429, 'weight_linear_max_weight': 4.693938703426122}. Best is trial 41 with value: 0.19810774778548906.
2026-06-01 00:13:30 | INFO | src.nested_cv_avggrm_weighted_unified | Trial 260 | outer=4 | alpha=1.027e+05 n_pcs=4000 (pc_topk) weight_search=on
2026-06-01 00:13:30 | INFO | src.nested_cv_avggrm_weighted_unified | Trial 260 | outer=4 | weight={'name': 'linear', 'floor': 1e-06, 'clip_max': 10.0, 'min_weight': 0.3090289706076358, 'max_weight': 4.962648268245693}
2026-06-01 00:13:33 | INFO | src.nested_cv_avggrm_weighted_unified | Trial 260 | outer=4 | pruned after 6/10 inner folds (mean r=0.2054)
[I 2026-06-01 00:13:33,489] Trial 260 pruned. 
2026-06-01 00:13:33 | INFO | src.nested_cv_avggrm_weighted_unified | Trial 261 | outer=4 | alpha=6.381e+04 n_pcs=4500 (pc_topk) weight_search=on
2026-06-01 00:13:33 | INFO | src.nested_cv_avggrm_weighted_unified | Trial 261 | outer=4 | weight={'name': 'linear', 'floor': 1e-06, 'clip_max': None, 'min_weight': 0.35426913512551433, 'max_weight': 3.1601017025481353}
2026-06-01 00:13:37 | INFO | src.nested_cv_avggrm_weighted_unified | Trial 261 | outer=4 | pruned after 6/10 inner folds (mean r=0.2027)
[I 2026-06-01 00:13:37,707] Trial 261 pruned. 
2026-06-01 00:13:37 | INFO | src.nested_cv_avggrm_weighted_unified | Trial 262 | outer=4 | alpha=1.491e+05 n_pcs=4500 (pc_topk) weight_search=on
2026-06-01 00:13:37 | INFO | src.nested_cv_avggrm_weighted_unified | Trial 262 | outer=4 | weight={'name': 'linear', 'floor': 1e-06, 'clip_max': 10.0, 'min_weight': 0.49203230953629107, 'max_weight': 4.517029557127786}
