[I 2026-06-01 17:53:50,778] Trial 189 finished with value: 0.19830539124223867 and parameters: {'alpha': 50694.65278054101, 'n_pcs': 5000, 'iw_method': 'pc_logistic', 'iw_clip_max': 4.0, 'iw_prob_clip': 0.03610752377141781, 'iw_n_components': 20, 'iw_logistic_c': 3.036203880262438e-05, 'iw_pca_fit': 'combined', 'iw_solver': 'lbfgs', 'iw_rho': 1.0}. Best is trial 151 with value: 0.20050890929972173.
2026-06-01 17:53:50 | INFO | Trial 190 | outer=4 | alpha=6.510e+04 n_pcs=5000 (pc_topk) weight={'name': 'pc_logistic', 'floor': 1e-06, 'clip_max': 4.0, 'prob_clip': 0.03144812343144461, 'n_components': 20, 'logistic_c': 2.0580665569297236e-05, 'pca_fit': 'combined', 'solver': 'lbfgs', 'max_iter': 2000, 'fit_intercept': True, 'standardize_with_source': True, 'rho': 1.0}
[I 2026-06-01 17:54:07,418] Trial 190 finished with value: 0.19981099452292495 and parameters: {'alpha': 65101.12495082632, 'n_pcs': 5000, 'iw_method': 'pc_logistic', 'iw_clip_max': 4.0, 'iw_prob_clip': 0.03144812343144461, 'iw_n_components': 20, 'iw_logistic_c': 2.0580665569297236e-05, 'iw_pca_fit': 'combined', 'iw_solver': 'lbfgs', 'iw_rho': 1.0}. Best is trial 151 with value: 0.20050890929972173.
2026-06-01 17:54:07 | INFO | Trial 191 | outer=4 | alpha=6.433e+04 n_pcs=5000 (pc_topk) weight={'name': 'pc_logistic', 'floor': 1e-06, 'clip_max': 4.0, 'prob_clip': 0.029948881098044444, 'n_components': 20, 'logistic_c': 2.588375573316537e-05, 'pca_fit': 'combined', 'solver': 'lbfgs', 'max_iter': 2000, 'fit_intercept': True, 'standardize_with_source': True, 'rho': 1.0}
[I 2026-06-01 17:54:26,204] Trial 191 finished with value: 0.19886597514753618 and parameters: {'alpha': 64332.0264488259, 'n_pcs': 5000, 'iw_method': 'pc_logistic', 'iw_clip_max': 4.0, 'iw_prob_clip': 0.029948881098044444, 'iw_n_components': 20, 'iw_logistic_c': 2.588375573316537e-05, 'iw_pca_fit': 'combined', 'iw_solver': 'lbfgs', 'iw_rho': 1.0}. Best is trial 151 with value: 0.20050890929972173.
2026-06-01 17:54:26 | INFO | Trial 192 | outer=4 | alpha=9.680e+04 n_pcs=5000 (pc_topk) weight={'name': 'pc_logistic', 'floor': 1e-06, 'clip_max': 4.0, 'prob_clip': 0.040535572369851405, 'n_components': 20, 'logistic_c': 2.2566499492133463e-05, 'pca_fit': 'combined', 'solver': 'lbfgs', 'max_iter': 2000, 'fit_intercept': True, 'standardize_with_source': True, 'rho': 1.0}
[I 2026-06-01 17:54:47,952] Trial 192 finished with value: 0.20076946245160024 and parameters: {'alpha': 96798.38297917486, 'n_pcs': 5000, 'iw_method': 'pc_logistic', 'iw_clip_max': 4.0, 'iw_prob_clip': 0.040535572369851405, 'iw_n_components': 20, 'iw_logistic_c': 2.2566499492133463e-05, 'iw_pca_fit': 'combined', 'iw_solver': 'lbfgs', 'iw_rho': 1.0}. Best is trial 192 with value: 0.20076946245160024.
2026-06-01 17:54:47 | INFO | Trial 193 | outer=4 | alpha=1.033e+05 n_pcs=5000 (pc_topk) weight={'name': 'pc_logistic', 'floor': 1e-06, 'clip_max': 4.0, 'prob_clip': 0.04177518511926326, 'n_components': 20, 'logistic_c': 6.716908757305965e-05, 'pca_fit': 'combined', 'solver': 'lbfgs', 'max_iter': 2000, 'fit_intercept': True, 'standardize_with_source': True, 'rho': 1.0}
[I 2026-06-01 17:55:08,219] Trial 193 finished with value: 0.1964590198671629 and parameters: {'alpha': 103337.61823689532, 'n_pcs': 5000, 'iw_method': 'pc_logistic', 'iw_clip_max': 4.0, 'iw_prob_clip': 0.04177518511926326, 'iw_n_components': 20, 'iw_logistic_c': 6.716908757305965e-05, 'iw_pca_fit': 'combined', 'iw_solver': 'lbfgs', 'iw_rho': 1.0}. Best is trial 192 with value: 0.20076946245160024.
2026-06-01 17:55:08 | INFO | Trial 194 | outer=4 | alpha=7.255e+04 n_pcs=5000 (pc_topk) weight={'name': 'pc_logistic', 'floor': 1e-06, 'clip_max': 4.0, 'prob_clip': 0.03373059740131423, 'n_components': 20, 'logistic_c': 3.0660488664455845e-05, 'pca_fit': 'combined', 'solver': 'lbfgs', 'max_iter': 2000, 'fit_intercept': True, 'standardize_with_source': True, 'rho': 1.0}
[I 2026-06-01 17:55:25,714] Trial 194 finished with value: 0.19909820094509284 and parameters: {'alpha': 72547.50410480324, 'n_pcs': 5000, 'iw_method': 'pc_logistic', 'iw_clip_max': 4.0, 'iw_prob_clip': 0.03373059740131423, 'iw_n_components': 20, 'iw_logistic_c': 3.0660488664455845e-05, 'iw_pca_fit': 'combined', 'iw_solver': 'lbfgs', 'iw_rho': 1.0}. Best is trial 192 with value: 0.20076946245160024.
2026-06-01 17:55:25 | INFO | Trial 195 | outer=4 | alpha=1.410e+05 n_pcs=5000 (pc_topk) weight={'name': 'pc_logistic', 'floor': 1e-06, 'clip_max': 12.0, 'prob_clip': 0.039054691958262305, 'n_components': 20, 'logistic_c': 2.2629297228547072e-05, 'pca_fit': 'combined', 'solver': 'lbfgs', 'max_iter': 2000, 'fit_intercept': True, 'standardize_with_source': True, 'rho': 1.0}
[I 2026-06-01 17:55:43,178] Trial 195 finished with value: 0.1945939319290492 and parameters: {'alpha': 140988.55275293632, 'n_pcs': 5000, 'iw_method': 'pc_logistic', 'iw_clip_max': 12.0, 'iw_prob_clip': 0.039054691958262305, 'iw_n_components': 20, 'iw_logistic_c': 2.2629297228547072e-05, 'iw_pca_fit': 'combined', 'iw_solver': 'lbfgs', 'iw_rho': 1.0}. Best is trial 192 with value: 0.20076946245160024.
2026-06-01 17:55:43 | INFO | Trial 196 | outer=4 | alpha=5.852e+04 n_pcs=5000 (pc_topk) weight={'name': 'pc_logistic', 'floor': 1e-06, 'clip_max': 4.0, 'prob_clip': 0.03169006605686614, 'n_components': 20, 'logistic_c': 3.489825559282625e-05, 'pca_fit': 'combined', 'solver': 'lbfgs', 'max_iter': 2000, 'fit_intercept': True, 'standardize_with_source': True, 'rho': 0.5}
[I 2026-06-01 17:55:59,259] Trial 196 finished with value: 0.1985341529963793 and parameters: {'alpha': 58516.69996066048, 'n_pcs': 5000, 'iw_method': 'pc_logistic', 'iw_clip_max': 4.0, 'iw_prob_clip': 0.03169006605686614, 'iw_n_components': 20, 'iw_logistic_c': 3.489825559282625e-05, 'iw_pca_fit': 'combined', 'iw_solver': 'lbfgs', 'iw_rho': 0.5}. Best is trial 192 with value: 0.20076946245160024.
2026-06-01 17:55:59 | INFO | Trial 197 | outer=4 | alpha=1.046e+05 n_pcs=5000 (pc_topk) weight={'name': 'pc_logistic', 'floor': 1e-06, 'clip_max': 4.0, 'prob_clip': 0.03609505589198468, 'n_components': 20, 'logistic_c': 8.458491924865103e-06, 'pca_fit': 'combined', 'solver': 'lbfgs', 'max_iter': 2000, 'fit_intercept': True, 'standardize_with_source': True, 'rho': 1.0}
[I 2026-06-01 17:56:16,508] Trial 197 finished with value: 0.1964158214196951 and parameters: {'alpha': 104600.35778667248, 'n_pcs': 5000, 'iw_method': 'pc_logistic', 'iw_clip_max': 4.0, 'iw_prob_clip': 0.03609505589198468, 'iw_n_components': 20, 'iw_logistic_c': 8.458491924865103e-06, 'iw_pca_fit': 'combined', 'iw_solver': 'lbfgs', 'iw_rho': 1.0}. Best is trial 192 with value: 0.20076946245160024.
2026-06-01 17:56:16 | INFO | Trial 198 | outer=4 | alpha=4.247e+04 n_pcs=5000 (pc_topk) weight={'name': 'pc_logistic', 'floor': 1e-06, 'clip_max': 4.0, 'prob_clip': 0.028429932526758534, 'n_components': 40, 'logistic_c': 1.97213050788401e-05, 'pca_fit': 'combined', 'solver': 'lbfgs', 'max_iter': 2000, 'fit_intercept': True, 'standardize_with_source': True, 'rho': 1.0}
[I 2026-06-01 17:56:41,931] Trial 198 finished with value: 0.19700495715586344 and parameters: {'alpha': 42469.02325635171, 'n_pcs': 5000, 'iw_method': 'pc_logistic', 'iw_clip_max': 4.0, 'iw_prob_clip': 0.028429932526758534, 'iw_n_components': 40, 'iw_logistic_c': 1.97213050788401e-05, 'iw_pca_fit': 'combined', 'iw_solver': 'lbfgs', 'iw_rho': 1.0}. Best is trial 192 with value: 0.20076946245160024.
2026-06-01 17:56:41 | INFO | Trial 199 | outer=4 | alpha=7.753e+04 n_pcs=5000 (pc_topk) weight={'name': 'pc_logistic', 'floor': 1e-06, 'clip_max': 4.0, 'prob_clip': 0.04904406171466703, 'n_components': 40, 'logistic_c': 1.5087955530716894e-05, 'pca_fit': 'combined', 'solver': 'lbfgs', 'max_iter': 2000, 'fit_intercept': True, 'standardize_with_source': True, 'rho': 1.0}
[I 2026-06-01 17:56:58,404] Trial 199 finished with value: 0.1975391329417826 and parameters: {'alpha': 77527.83345909328, 'n_pcs': 5000, 'iw_method': 'pc_logistic', 'iw_clip_max': 4.0, 'iw_prob_clip': 0.04904406171466703, 'iw_n_components': 40, 'iw_logistic_c': 1.5087955530716894e-05, 'iw_pca_fit': 'combined', 'iw_solver': 'lbfgs', 'iw_rho': 1.0}. Best is trial 192 with value: 0.20076946245160024.
2026-06-01 17:56:58 | INFO | Trial 200 | outer=4 | alpha=1.484e+05 n_pcs=5000 (pc_topk) weight={'name': 'pc_logistic', 'floor': 1e-06, 'clip_max': 4.0, 'prob_clip': 0.042262838427029235, 'n_components': 40, 'logistic_c': 3.644340079141935e-05, 'pca_fit': 'combined', 'solver': 'lbfgs', 'max_iter': 2000, 'fit_intercept': True, 'standardize_with_source': True, 'rho': 1.0}
[I 2026-06-01 17:57:15,911] Trial 200 finished with value: 0.19736901097780093 and parameters: {'alpha': 148427.24788431067, 'n_pcs': 5000, 'iw_method': 'pc_logistic', 'iw_clip_max': 4.0, 'iw_prob_clip': 0.042262838427029235, 'iw_n_components': 40, 'iw_logistic_c': 3.644340079141935e-05, 'iw_pca_fit': 'combined', 'iw_solver': 'lbfgs', 'iw_rho': 1.0}. Best is trial 192 with value: 0.20076946245160024.
2026-06-01 17:57:15 | INFO | Trial 201 | outer=4 | alpha=9.273e+04 n_pcs=4500 (pc_topk) weight={'name': 'pc_logistic', 'floor': 1e-06, 'clip_max': 4.0, 'prob_clip': 0.029865800870695274, 'n_components': 40, 'logistic_c': 2.319892989708127e-05, 'pca_fit': 'combined', 'solver': 'lbfgs', 'max_iter': 2000, 'fit_intercept': True, 'standardize_with_source': True, 'rho': 1.0}
[I 2026-06-01 17:57:31,225] Trial 201 finished with value: 0.2001543050716183 and parameters: {'alpha': 92729.53880468724, 'n_pcs': 4500, 'iw_method': 'pc_logistic', 'iw_clip_max': 4.0, 'iw_prob_clip': 0.029865800870695274, 'iw_n_components': 40, 'iw_logistic_c': 2.319892989708127e-05, 'iw_pca_fit': 'combined', 'iw_solver': 'lbfgs', 'iw_rho': 1.0}. Best is trial 192 with value: 0.20076946245160024.
2026-06-01 17:57:31 | INFO | Trial 202 | outer=4 | alpha=9.265e+04 n_pcs=4500 (pc_topk) weight={'name': 'pc_logistic', 'floor': 1e-06, 'clip_max': 4.0, 'prob_clip': 0.030511638645261005, 'n_components': 100, 'logistic_c': 2.192256757601364e-05, 'pca_fit': 'combined', 'solver': 'lbfgs', 'max_iter': 2000, 'fit_intercept': True, 'standardize_with_source': True, 'rho': 1.0}
[I 2026-06-01 17:57:46,716] Trial 202 finished with value: 0.20042332845890853 and parameters: {'alpha': 92650.43931156251, 'n_pcs': 4500, 'iw_method': 'pc_logistic', 'iw_clip_max': 4.0, 'iw_prob_clip': 0.030511638645261005, 'iw_n_components': 100, 'iw_logistic_c': 2.192256757601364e-05, 'iw_pca_fit': 'combined', 'iw_solver': 'lbfgs', 'iw_rho': 1.0}. Best is trial 192 with value: 0.20076946245160024.
2026-06-01 17:57:46 | INFO | Trial 203 | outer=4 | alpha=6.713e+04 n_pcs=4500 (pc_topk) weight={'name': 'pc_logistic', 'floor': 1e-06, 'clip_max': 4.0, 'prob_clip': 0.02948444449346309, 'n_components': 100, 'logistic_c': 1.3780740964407048e-05, 'pca_fit': 'combined', 'solver': 'lbfgs', 'max_iter': 2000, 'fit_intercept': True, 'standardize_with_source': True, 'rho': 1.0}
[I 2026-06-01 17:58:01,191] Trial 203 finished with value: 0.20096057737722944 and parameters: {'alpha': 67128.0184366252, 'n_pcs': 4500, 'iw_method': 'pc_logistic', 'iw_clip_max': 4.0, 'iw_prob_clip': 0.02948444449346309, 'iw_n_components': 100, 'iw_logistic_c': 1.3780740964407048e-05, 'iw_pca_fit': 'combined', 'iw_solver': 'lbfgs', 'iw_rho': 1.0}. Best is trial 203 with value: 0.20096057737722944.
2026-06-01 17:58:01 | INFO | Trial 204 | outer=4 | alpha=6.040e+04 n_pcs=4500 (pc_topk) weight={'name': 'pc_logistic', 'floor': 1e-06, 'clip_max': 4.0, 'prob_clip': 0.029559811403694024, 'n_components': 100, 'logistic_c': 7.677059490225178e-06, 'pca_fit': 'combined', 'solver': 'lbfgs', 'max_iter': 2000, 'fit_intercept': True, 'standardize_with_source': True, 'rho': 1.0}
[I 2026-06-01 17:58:16,382] Trial 204 finished with value: 0.19888335146466585 and parameters: {'alpha': 60399.258978933794, 'n_pcs': 4500, 'iw_method': 'pc_logistic', 'iw_clip_max': 4.0, 'iw_prob_clip': 0.029559811403694024, 'iw_n_components': 100, 'iw_logistic_c': 7.677059490225178e-06, 'iw_pca_fit': 'combined', 'iw_solver': 'lbfgs', 'iw_rho': 1.0}. Best is trial 203 with value: 0.20096057737722944.
2026-06-01 17:58:16 | INFO | Trial 205 | outer=4 | alpha=8.933e+04 n_pcs=4500 (pc_topk) weight={'name': 'pc_logistic', 'floor': 1e-06, 'clip_max': 4.0, 'prob_clip': 0.030118458657583027, 'n_components': 100, 'logistic_c': 1.2249063093932322e-05, 'pca_fit': 'combined', 'solver': 'lbfgs', 'max_iter': 2000, 'fit_intercept': True, 'standardize_with_source': True, 'rho': 1.0}
[I 2026-06-01 17:58:33,075] Trial 205 finished with value: 0.2007405775743208 and parameters: {'alpha': 89327.81085133467, 'n_pcs': 4500, 'iw_method': 'pc_logistic', 'iw_clip_max': 4.0, 'iw_prob_clip': 0.030118458657583027, 'iw_n_components': 100, 'iw_logistic_c': 1.2249063093932322e-05, 'iw_pca_fit': 'combined', 'iw_solver': 'lbfgs', 'iw_rho': 1.0}. Best is trial 203 with value: 0.20096057737722944.
2026-06-01 17:58:33 | INFO | Trial 206 | outer=4 | alpha=1.185e+05 n_pcs=4500 (pc_topk) weight={'name': 'pc_logistic', 'floor': 1e-06, 'clip_max': 4.0, 'prob_clip': 0.026734378247714973, 'n_components': 100, 'logistic_c': 1.1222976030154802e-05, 'pca_fit': 'combined', 'solver': 'lbfgs', 'max_iter': 2000, 'fit_intercept': True, 'standardize_with_source': True, 'rho': 0.85}
[I 2026-06-01 17:58:48,390] Trial 206 finished with value: 0.19924332930329008 and parameters: {'alpha': 118515.71894330441, 'n_pcs': 4500, 'iw_method': 'pc_logistic', 'iw_clip_max': 4.0, 'iw_prob_clip': 0.026734378247714973, 'iw_n_components': 100, 'iw_logistic_c': 1.1222976030154802e-05, 'iw_pca_fit': 'combined', 'iw_solver': 'lbfgs', 'iw_rho': 0.85}. Best is trial 203 with value: 0.20096057737722944.
2026-06-01 17:58:48 | INFO | Trial 207 | outer=4 | alpha=8.972e+04 n_pcs=4500 (pc_topk) weight={'name': 'pc_logistic', 'floor': 1e-06, 'clip_max': 4.0, 'prob_clip': 0.02960448297425663, 'n_components': 100, 'logistic_c': 1.2364554517308507e-05, 'pca_fit': 'combined', 'solver': 'lbfgs', 'max_iter': 2000, 'fit_intercept': True, 'standardize_with_source': True, 'rho': 1.0}
[I 2026-06-01 17:59:03,243] Trial 207 finished with value: 0.20080515031818552 and parameters: {'alpha': 89722.57732150101, 'n_pcs': 4500, 'iw_method': 'pc_logistic', 'iw_clip_max': 4.0, 'iw_prob_clip': 0.02960448297425663, 'iw_n_components': 100, 'iw_logistic_c': 1.2364554517308507e-05, 'iw_pca_fit': 'combined', 'iw_solver': 'lbfgs', 'iw_rho': 1.0}. Best is trial 203 with value: 0.20096057737722944.
2026-06-01 17:59:03 | INFO | Trial 208 | outer=4 | alpha=9.188e+04 n_pcs=4500 (pc_topk) weight={'name': 'pc_logistic', 'floor': 1e-06, 'clip_max': 4.0, 'prob_clip': 0.035863410079397896, 'n_components': 100, 'logistic_c': 6.881372462200978e-06, 'pca_fit': 'combined', 'solver': 'lbfgs', 'max_iter': 2000, 'fit_intercept': True, 'standardize_with_source': True, 'rho': 1.0}
[I 2026-06-01 17:59:18,938] Trial 208 finished with value: 0.19698600386700357 and parameters: {'alpha': 91881.64918849467, 'n_pcs': 4500, 'iw_method': 'pc_logistic', 'iw_clip_max': 4.0, 'iw_prob_clip': 0.035863410079397896, 'iw_n_components': 100, 'iw_logistic_c': 6.881372462200978e-06, 'iw_pca_fit': 'combined', 'iw_solver': 'lbfgs', 'iw_rho': 1.0}. Best is trial 203 with value: 0.20096057737722944.
2026-06-01 17:59:18 | INFO | Trial 209 | outer=4 | alpha=1.153e+05 n_pcs=2000 (pc_topk) weight={'name': 'pc_logistic', 'floor': 1e-06, 'clip_max': 7.0, 'prob_clip': 0.004542986072073686, 'n_components': 100, 'logistic_c': 2.2676617072821346e-07, 'pca_fit': 'combined', 'solver': 'lbfgs', 'max_iter': 2000, 'fit_intercept': True, 'standardize_with_source': True, 'rho': 1.0}
[I 2026-06-01 17:59:27,365] Trial 209 finished with value: 0.18775937430163336 and parameters: {'alpha': 115327.03325395296, 'n_pcs': 2000, 'iw_method': 'pc_logistic', 'iw_clip_max': 7.0, 'iw_prob_clip': 0.004542986072073686, 'iw_n_components': 100, 'iw_logistic_c': 2.2676617072821346e-07, 'iw_pca_fit': 'combined', 'iw_solver': 'lbfgs', 'iw_rho': 1.0}. Best is trial 203 with value: 0.20096057737722944.
2026-06-01 17:59:27 | INFO | Trial 210 | outer=4 | alpha=1.386e+05 n_pcs=4500 (pc_topk) weight={'name': 'pc_logistic', 'floor': 1e-06, 'clip_max': 4.0, 'prob_clip': 0.030563627923459978, 'n_components': 100, 'logistic_c': 1.1877114055447487e-05, 'pca_fit': 'combined', 'solver': 'lbfgs', 'max_iter': 2000, 'fit_intercept': True, 'standardize_with_source': True, 'rho': 1.0}
[I 2026-06-01 17:59:42,305] Trial 210 finished with value: 0.1991342511715386 and parameters: {'alpha': 138553.5755754013, 'n_pcs': 4500, 'iw_method': 'pc_logistic', 'iw_clip_max': 4.0, 'iw_prob_clip': 0.030563627923459978, 'iw_n_components': 100, 'iw_logistic_c': 1.1877114055447487e-05, 'iw_pca_fit': 'combined', 'iw_solver': 'lbfgs', 'iw_rho': 1.0}. Best is trial 203 with value: 0.20096057737722944.
2026-06-01 17:59:42 | INFO | Trial 211 | outer=4 | alpha=9.077e+04 n_pcs=4500 (pc_topk) weight={'name': 'pc_logistic', 'floor': 1e-06, 'clip_max': 4.0, 'prob_clip': 0.027511729784871198, 'n_components': 100, 'logistic_c': 1.4575130171103196e-05, 'pca_fit': 'combined', 'solver': 'lbfgs', 'max_iter': 2000, 'fit_intercept': True, 'standardize_with_source': True, 'rho': 1.0}
[I 2026-06-01 17:59:56,878] Trial 211 finished with value: 0.20043390951385312 and parameters: {'alpha': 90773.18488678825, 'n_pcs': 4500, 'iw_method': 'pc_logistic', 'iw_clip_max': 4.0, 'iw_prob_clip': 0.027511729784871198, 'iw_n_components': 100, 'iw_logistic_c': 1.4575130171103196e-05, 'iw_pca_fit': 'combined', 'iw_solver': 'lbfgs', 'iw_rho': 1.0}. Best is trial 203 with value: 0.20096057737722944.
2026-06-01 17:59:56 | INFO | Trial 212 | outer=4 | alpha=8.237e+04 n_pcs=4500 (pc_topk) weight={'name': 'pc_logistic', 'floor': 1e-06, 'clip_max': 4.0, 'prob_clip': 0.028313379058746584, 'n_components': 100, 'logistic_c': 1.2814084756315515e-05, 'pca_fit': 'combined', 'solver': 'lbfgs', 'max_iter': 2000, 'fit_intercept': True, 'standardize_with_source': True, 'rho': 1.0}
[I 2026-06-01 18:00:13,254] Trial 212 finished with value: 0.2008703495186253 and parameters: {'alpha': 82373.70502279396, 'n_pcs': 4500, 'iw_method': 'pc_logistic', 'iw_clip_max': 4.0, 'iw_prob_clip': 0.028313379058746584, 'iw_n_components': 100, 'iw_logistic_c': 1.2814084756315515e-05, 'iw_pca_fit': 'combined', 'iw_solver': 'lbfgs', 'iw_rho': 1.0}. Best is trial 203 with value: 0.20096057737722944.
2026-06-01 18:00:13 | INFO | Trial 213 | outer=4 | alpha=7.366e+04 n_pcs=4500 (pc_topk) weight={'name': 'pc_logistic', 'floor': 1e-06, 'clip_max': 4.0, 'prob_clip': 0.027869768098061187, 'n_components': 100, 'logistic_c': 1.2910845801754945e-05, 'pca_fit': 'combined', 'solver': 'lbfgs', 'max_iter': 2000, 'fit_intercept': True, 'standardize_with_source': True, 'rho': 1.0}
[I 2026-06-01 18:00:28,464] Trial 213 finished with value: 0.2008337487325494 and parameters: {'alpha': 73663.47242820819, 'n_pcs': 4500, 'iw_method': 'pc_logistic', 'iw_clip_max': 4.0, 'iw_prob_clip': 0.027869768098061187, 'iw_n_components': 100, 'iw_logistic_c': 1.2910845801754945e-05, 'iw_pca_fit': 'combined', 'iw_solver': 'lbfgs', 'iw_rho': 1.0}. Best is trial 203 with value: 0.20096057737722944.
2026-06-01 18:00:28 | INFO | Trial 214 | outer=4 | alpha=7.240e+04 n_pcs=4500 (pc_topk) weight={'name': 'pc_logistic', 'floor': 1e-06, 'clip_max': 4.0, 'prob_clip': 0.027932396944717004, 'n_components': 100, 'logistic_c': 9.074092020221793e-06, 'pca_fit': 'combined', 'solver': 'lbfgs', 'max_iter': 2000, 'fit_intercept': True, 'standardize_with_source': True, 'rho': 1.0}
[I 2026-06-01 18:00:43,609] Trial 214 finished with value: 0.19945849728388915 and parameters: {'alpha': 72403.7525007192, 'n_pcs': 4500, 'iw_method': 'pc_logistic', 'iw_clip_max': 4.0, 'iw_prob_clip': 0.027932396944717004, 'iw_n_components': 100, 'iw_logistic_c': 9.074092020221793e-06, 'iw_pca_fit': 'combined', 'iw_solver': 'lbfgs', 'iw_rho': 1.0}. Best is trial 203 with value: 0.20096057737722944.
2026-06-01 18:00:43 | INFO | Trial 215 | outer=4 | alpha=7.596e+04 n_pcs=4500 (pc_topk) weight={'name': 'pc_logistic', 'floor': 1e-06, 'clip_max': 4.0, 'prob_clip': 0.034721169988462114, 'n_components': 100, 'logistic_c': 1.2589583950954699e-05, 'pca_fit': 'combined', 'solver': 'lbfgs', 'max_iter': 2000, 'fit_intercept': True, 'standardize_with_source': True, 'rho': 1.0}
[I 2026-06-01 18:00:58,849] Trial 215 finished with value: 0.20054420488631614 and parameters: {'alpha': 75955.31374042753, 'n_pcs': 4500, 'iw_method': 'pc_logistic', 'iw_clip_max': 4.0, 'iw_prob_clip': 0.034721169988462114, 'iw_n_components': 100, 'iw_logistic_c': 1.2589583950954699e-05, 'iw_pca_fit': 'combined', 'iw_solver': 'lbfgs', 'iw_rho': 1.0}. Best is trial 203 with value: 0.20096057737722944.
2026-06-01 18:00:58 | INFO | Trial 216 | outer=4 | alpha=5.003e+04 n_pcs=4500 (pc_topk) weight={'name': 'pc_logistic', 'floor': 1e-06, 'clip_max': 4.0, 'prob_clip': 0.033070597283247946, 'n_components': 100, 'logistic_c': 6.187667226750142e-06, 'pca_fit': 'combined', 'solver': 'lbfgs', 'max_iter': 2000, 'fit_intercept': True, 'standardize_with_source': True, 'rho': 1.0}
[I 2026-06-01 18:01:13,804] Trial 216 finished with value: 0.19769363717344576 and parameters: {'alpha': 50029.59011643886, 'n_pcs': 4500, 'iw_method': 'pc_logistic', 'iw_clip_max': 4.0, 'iw_prob_clip': 0.033070597283247946, 'iw_n_components': 100, 'iw_logistic_c': 6.187667226750142e-06, 'iw_pca_fit': 'combined', 'iw_solver': 'lbfgs', 'iw_rho': 1.0}. Best is trial 203 with value: 0.20096057737722944.
2026-06-01 18:01:13 | INFO | Trial 217 | outer=4 | alpha=8.685e+04 n_pcs=4500 (pc_topk) weight={'name': 'pc_logistic', 'floor': 1e-06, 'clip_max': 4.0, 'prob_clip': 0.027904751637670838, 'n_components': 100, 'logistic_c': 0.0014887444640558556, 'pca_fit': 'combined', 'solver': 'lbfgs', 'max_iter': 2000, 'fit_intercept': True, 'standardize_with_source': True, 'rho': 1.0}
