[I 2026-06-01 14:31:44,968] Trial 25 finished with value: 0.22467670450193283 and parameters: {'alpha': 304044.5976496834, 'n_pcs': 4500, 'iw_method': 'uniform'}. Best is trial 23 with value: 0.2341686394044118.
2026-06-01 14:31:44 | INFO | Trial 26 | outer=2 | alpha=6.586e+03 n_pcs=2500 (pc_topk) weight={'name': 'pc_logistic', 'floor': 1e-06, 'clip_max': 2.5, 'prob_clip': 0.04783268173298191, 'n_components': 40, 'logistic_c': 0.0034285114017368, 'pca_fit': 'combined', 'solver': 'lbfgs', 'max_iter': 2000, 'fit_intercept': True, 'standardize_with_source': True, 'rho': 0.5}
[I 2026-06-01 14:31:58,800] Trial 26 finished with value: 0.17079368363123532 and parameters: {'alpha': 6585.903380288864, 'n_pcs': 2500, 'iw_method': 'pc_logistic', 'iw_clip_max': 2.5, 'iw_prob_clip': 0.04783268173298191, 'iw_n_components': 40, 'iw_logistic_c': 0.0034285114017368, 'iw_pca_fit': 'combined', 'iw_solver': 'lbfgs', 'iw_rho': 0.5}. Best is trial 23 with value: 0.2341686394044118.
2026-06-01 14:31:58 | INFO | Trial 27 | outer=2 | alpha=3.726e+04 n_pcs=4500 (pc_topk) weight={'name': 'uniform'}
[I 2026-06-01 14:32:07,730] Trial 27 finished with value: 0.23385020302679052 and parameters: {'alpha': 37262.71251533625, 'n_pcs': 4500, 'iw_method': 'uniform'}. Best is trial 23 with value: 0.2341686394044118.
2026-06-01 14:32:07 | INFO | Trial 28 | outer=2 | alpha=7.561e+04 n_pcs=3500 (pc_topk) weight={'name': 'uniform'}
[I 2026-06-01 14:32:13,175] Trial 28 finished with value: 0.23195439008922664 and parameters: {'alpha': 75613.22060711085, 'n_pcs': 3500, 'iw_method': 'uniform'}. Best is trial 23 with value: 0.2341686394044118.
2026-06-01 14:32:13 | INFO | Trial 29 | outer=2 | alpha=1.397e+05 n_pcs=4000 (pc_topk) weight={'name': 'uniform'}
[I 2026-06-01 14:32:20,133] Trial 29 finished with value: 0.23060977894967394 and parameters: {'alpha': 139652.89894072743, 'n_pcs': 4000, 'iw_method': 'uniform'}. Best is trial 23 with value: 0.2341686394044118.
2026-06-01 14:32:20 | INFO | Trial 30 | outer=2 | alpha=9.389e+03 n_pcs=5000 (pc_topk) weight={'name': 'uniform'}
[I 2026-06-01 14:32:30,231] Trial 30 finished with value: 0.21930649108084305 and parameters: {'alpha': 9389.19594146033, 'n_pcs': 5000, 'iw_method': 'uniform'}. Best is trial 23 with value: 0.2341686394044118.
2026-06-01 14:32:30 | INFO | Trial 31 | outer=2 | alpha=2.718e+04 n_pcs=4500 (pc_topk) weight={'name': 'uniform'}
[I 2026-06-01 14:32:39,145] Trial 31 finished with value: 0.2323784434930313 and parameters: {'alpha': 27178.160980055276, 'n_pcs': 4500, 'iw_method': 'uniform'}. Best is trial 23 with value: 0.2341686394044118.
2026-06-01 14:32:39 | INFO | Trial 32 | outer=2 | alpha=5.029e+04 n_pcs=4000 (pc_topk) weight={'name': 'uniform'}
[I 2026-06-01 14:32:46,056] Trial 32 finished with value: 0.2337496661394478 and parameters: {'alpha': 50289.26800820176, 'n_pcs': 4000, 'iw_method': 'uniform'}. Best is trial 23 with value: 0.2341686394044118.
2026-06-01 14:32:46 | INFO | Trial 33 | outer=2 | alpha=9.756e+04 n_pcs=4500 (pc_topk) weight={'name': 'uniform'}
[I 2026-06-01 14:32:54,737] Trial 33 finished with value: 0.23220676467608276 and parameters: {'alpha': 97556.7866170716, 'n_pcs': 4500, 'iw_method': 'uniform'}. Best is trial 23 with value: 0.2341686394044118.
2026-06-01 14:32:54 | INFO | Trial 34 | outer=2 | alpha=1.996e+05 n_pcs=5000 (pc_topk) weight={'name': 'uniform'}
[I 2026-06-01 14:33:04,858] Trial 34 finished with value: 0.22701338437974825 and parameters: {'alpha': 199597.27910878378, 'n_pcs': 5000, 'iw_method': 'uniform'}. Best is trial 23 with value: 0.2341686394044118.
2026-06-01 14:33:04 | INFO | Trial 35 | outer=2 | alpha=2.806e+04 n_pcs=4000 (pc_topk) weight={'name': 'uniform'}
[I 2026-06-01 14:33:11,908] Trial 35 finished with value: 0.23058526145670566 and parameters: {'alpha': 28056.61813333484, 'n_pcs': 4000, 'iw_method': 'uniform'}. Best is trial 23 with value: 0.2341686394044118.
2026-06-01 14:33:11 | INFO | Trial 36 | outer=2 | alpha=6.241e+05 n_pcs=4500 (pc_topk) weight={'name': 'uniform'}
[I 2026-06-01 14:33:20,588] Trial 36 finished with value: 0.21996223814654198 and parameters: {'alpha': 624125.6583528126, 'n_pcs': 4500, 'iw_method': 'uniform'}. Best is trial 23 with value: 0.2341686394044118.
2026-06-01 14:33:20 | INFO | Trial 37 | outer=2 | alpha=1.268e+05 n_pcs=2000 (pc_topk) weight={'name': 'pc_logistic', 'floor': 1e-06, 'clip_max': 7.0, 'prob_clip': 0.012848620177464912, 'n_components': 100, 'logistic_c': 3.898259261647804, 'pca_fit': 'combined', 'solver': 'lbfgs', 'max_iter': 2000, 'fit_intercept': True, 'standardize_with_source': True, 'rho': 0.85}
[I 2026-06-01 14:33:42,070] Trial 37 finished with value: 0.226871661022926 and parameters: {'alpha': 126834.44383845944, 'n_pcs': 2000, 'iw_method': 'pc_logistic', 'iw_clip_max': 7.0, 'iw_prob_clip': 0.012848620177464912, 'iw_n_components': 100, 'iw_logistic_c': 3.898259261647804, 'iw_pca_fit': 'combined', 'iw_solver': 'lbfgs', 'iw_rho': 0.85}. Best is trial 23 with value: 0.2341686394044118.
2026-06-01 14:33:42 | INFO | Trial 38 | outer=2 | alpha=7.668e+04 n_pcs=3500 (pc_topk) weight={'name': 'uniform'}
[I 2026-06-01 14:33:48,345] Trial 38 finished with value: 0.23193982555837916 and parameters: {'alpha': 76682.79590864351, 'n_pcs': 3500, 'iw_method': 'uniform'}. Best is trial 23 with value: 0.2341686394044118.
2026-06-01 14:33:48 | INFO | Trial 39 | outer=2 | alpha=1.986e+05 n_pcs=5000 (pc_topk) weight={'name': 'pc_logistic', 'floor': 1e-06, 'clip_max': 4.0, 'prob_clip': 0.0005052693826348058, 'n_components': 40, 'logistic_c': 4.248710782266651e-05, 'pca_fit': 'combined', 'solver': 'lbfgs', 'max_iter': 2000, 'fit_intercept': True, 'standardize_with_source': True, 'rho': 0.3}
[I 2026-06-01 14:34:05,121] Trial 39 finished with value: 0.23921249634343567 and parameters: {'alpha': 198584.10059466373, 'n_pcs': 5000, 'iw_method': 'pc_logistic', 'iw_clip_max': 4.0, 'iw_prob_clip': 0.0005052693826348058, 'iw_n_components': 40, 'iw_logistic_c': 4.248710782266651e-05, 'iw_pca_fit': 'combined', 'iw_solver': 'lbfgs', 'iw_rho': 0.3}. Best is trial 39 with value: 0.23921249634343567.
2026-06-01 14:34:05 | INFO | Trial 40 | outer=2 | alpha=1.945e+05 n_pcs=5000 (pc_topk) weight={'name': 'pc_logistic', 'floor': 1e-06, 'clip_max': 4.0, 'prob_clip': 0.0005994536863338856, 'n_components': 40, 'logistic_c': 5.149269823304194e-05, 'pca_fit': 'combined', 'solver': 'lbfgs', 'max_iter': 2000, 'fit_intercept': True, 'standardize_with_source': True, 'rho': 0.3}
[I 2026-06-01 14:34:21,946] Trial 40 finished with value: 0.2394604465702248 and parameters: {'alpha': 194502.37731057857, 'n_pcs': 5000, 'iw_method': 'pc_logistic', 'iw_clip_max': 4.0, 'iw_prob_clip': 0.0005994536863338856, 'iw_n_components': 40, 'iw_logistic_c': 5.149269823304194e-05, 'iw_pca_fit': 'combined', 'iw_solver': 'lbfgs', 'iw_rho': 0.3}. Best is trial 40 with value: 0.2394604465702248.
2026-06-01 14:34:21 | INFO | Trial 41 | outer=2 | alpha=2.112e+05 n_pcs=5000 (pc_topk) weight={'name': 'pc_logistic', 'floor': 1e-06, 'clip_max': 4.0, 'prob_clip': 0.0006208599923060541, 'n_components': 40, 'logistic_c': 4.249995453322042e-05, 'pca_fit': 'combined', 'solver': 'lbfgs', 'max_iter': 2000, 'fit_intercept': True, 'standardize_with_source': True, 'rho': 0.3}
[I 2026-06-01 14:34:38,355] Trial 41 finished with value: 0.238961833884117 and parameters: {'alpha': 211220.07436677456, 'n_pcs': 5000, 'iw_method': 'pc_logistic', 'iw_clip_max': 4.0, 'iw_prob_clip': 0.0006208599923060541, 'iw_n_components': 40, 'iw_logistic_c': 4.249995453322042e-05, 'iw_pca_fit': 'combined', 'iw_solver': 'lbfgs', 'iw_rho': 0.3}. Best is trial 40 with value: 0.2394604465702248.
2026-06-01 14:34:38 | INFO | Trial 42 | outer=2 | alpha=4.222e+05 n_pcs=5000 (pc_topk) weight={'name': 'pc_logistic', 'floor': 1e-06, 'clip_max': 4.0, 'prob_clip': 0.0007600466336881116, 'n_components': 40, 'logistic_c': 4.053892924918148e-05, 'pca_fit': 'combined', 'solver': 'lbfgs', 'max_iter': 2000, 'fit_intercept': True, 'standardize_with_source': True, 'rho': 0.3}
[I 2026-06-01 14:34:55,039] Trial 42 finished with value: 0.23532947607994253 and parameters: {'alpha': 422230.9533044482, 'n_pcs': 5000, 'iw_method': 'pc_logistic', 'iw_clip_max': 4.0, 'iw_prob_clip': 0.0007600466336881116, 'iw_n_components': 40, 'iw_logistic_c': 4.053892924918148e-05, 'iw_pca_fit': 'combined', 'iw_solver': 'lbfgs', 'iw_rho': 0.3}. Best is trial 40 with value: 0.2394604465702248.
2026-06-01 14:34:55 | INFO | Trial 43 | outer=2 | alpha=1.844e+06 n_pcs=5000 (pc_topk) weight={'name': 'pc_logistic', 'floor': 1e-06, 'clip_max': 4.0, 'prob_clip': 0.0005330480172826371, 'n_components': 40, 'logistic_c': 6.931563919111635e-05, 'pca_fit': 'combined', 'solver': 'lbfgs', 'max_iter': 2000, 'fit_intercept': True, 'standardize_with_source': True, 'rho': 0.3}
[I 2026-06-01 14:35:11,585] Trial 43 finished with value: 0.22776930356272498 and parameters: {'alpha': 1843984.1162785366, 'n_pcs': 5000, 'iw_method': 'pc_logistic', 'iw_clip_max': 4.0, 'iw_prob_clip': 0.0005330480172826371, 'iw_n_components': 40, 'iw_logistic_c': 6.931563919111635e-05, 'iw_pca_fit': 'combined', 'iw_solver': 'lbfgs', 'iw_rho': 0.3}. Best is trial 40 with value: 0.2394604465702248.
2026-06-01 14:35:11 | INFO | Trial 44 | outer=2 | alpha=2.084e+05 n_pcs=5000 (pc_topk) weight={'name': 'pc_logistic', 'floor': 1e-06, 'clip_max': 4.0, 'prob_clip': 0.0009510823137997946, 'n_components': 40, 'logistic_c': 2.7156857939443666e-05, 'pca_fit': 'combined', 'solver': 'lbfgs', 'max_iter': 2000, 'fit_intercept': True, 'standardize_with_source': True, 'rho': 0.3}
[I 2026-06-01 14:35:27,575] Trial 44 finished with value: 0.2382922847543388 and parameters: {'alpha': 208430.87541416034, 'n_pcs': 5000, 'iw_method': 'pc_logistic', 'iw_clip_max': 4.0, 'iw_prob_clip': 0.0009510823137997946, 'iw_n_components': 40, 'iw_logistic_c': 2.7156857939443666e-05, 'iw_pca_fit': 'combined', 'iw_solver': 'lbfgs', 'iw_rho': 0.3}. Best is trial 40 with value: 0.2394604465702248.
2026-06-01 14:35:27 | INFO | Trial 45 | outer=2 | alpha=2.072e+05 n_pcs=5000 (pc_topk) weight={'name': 'pc_logistic', 'floor': 1e-06, 'clip_max': 4.0, 'prob_clip': 0.0008816108273909225, 'n_components': 40, 'logistic_c': 2.231198967845912e-05, 'pca_fit': 'combined', 'solver': 'lbfgs', 'max_iter': 2000, 'fit_intercept': True, 'standardize_with_source': True, 'rho': 0.3}
[I 2026-06-01 14:35:44,491] Trial 45 finished with value: 0.2379697903725774 and parameters: {'alpha': 207179.1029172135, 'n_pcs': 5000, 'iw_method': 'pc_logistic', 'iw_clip_max': 4.0, 'iw_prob_clip': 0.0008816108273909225, 'iw_n_components': 40, 'iw_logistic_c': 2.231198967845912e-05, 'iw_pca_fit': 'combined', 'iw_solver': 'lbfgs', 'iw_rho': 0.3}. Best is trial 40 with value: 0.2394604465702248.
2026-06-01 14:35:44 | INFO | Trial 46 | outer=2 | alpha=1.962e+05 n_pcs=5000 (pc_topk) weight={'name': 'pc_logistic', 'floor': 1e-06, 'clip_max': 4.0, 'prob_clip': 0.0010717624596173901, 'n_components': 40, 'logistic_c': 1.038852447522022e-05, 'pca_fit': 'combined', 'solver': 'lbfgs', 'max_iter': 2000, 'fit_intercept': True, 'standardize_with_source': True, 'rho': 0.3}
[I 2026-06-01 14:36:01,692] Trial 46 finished with value: 0.23559989237110127 and parameters: {'alpha': 196171.41806303727, 'n_pcs': 5000, 'iw_method': 'pc_logistic', 'iw_clip_max': 4.0, 'iw_prob_clip': 0.0010717624596173901, 'iw_n_components': 40, 'iw_logistic_c': 1.038852447522022e-05, 'iw_pca_fit': 'combined', 'iw_solver': 'lbfgs', 'iw_rho': 0.3}. Best is trial 40 with value: 0.2394604465702248.
2026-06-01 14:36:01 | INFO | Trial 47 | outer=2 | alpha=2.563e+05 n_pcs=5000 (pc_topk) weight={'name': 'pc_logistic', 'floor': 1e-06, 'clip_max': 4.0, 'prob_clip': 0.0005093161984124352, 'n_components': 40, 'logistic_c': 0.00045046676241307636, 'pca_fit': 'combined', 'solver': 'lbfgs', 'max_iter': 2000, 'fit_intercept': True, 'standardize_with_source': True, 'rho': 0.3}
[I 2026-06-01 14:36:21,334] Trial 47 finished with value: 0.23715974631857736 and parameters: {'alpha': 256278.26371240363, 'n_pcs': 5000, 'iw_method': 'pc_logistic', 'iw_clip_max': 4.0, 'iw_prob_clip': 0.0005093161984124352, 'iw_n_components': 40, 'iw_logistic_c': 0.00045046676241307636, 'iw_pca_fit': 'combined', 'iw_solver': 'lbfgs', 'iw_rho': 0.3}. Best is trial 40 with value: 0.2394604465702248.
2026-06-01 14:36:21 | INFO | Trial 48 | outer=2 | alpha=5.258e+05 n_pcs=1500 (pc_topk) weight={'name': 'pc_logistic', 'floor': 1e-06, 'clip_max': 4.0, 'prob_clip': 0.0013485815883683089, 'n_components': 40, 'logistic_c': 3.406613262026223e-06, 'pca_fit': 'combined', 'solver': 'lbfgs', 'max_iter': 2000, 'fit_intercept': True, 'standardize_with_source': True, 'rho': 0.3}
[I 2026-06-01 14:36:29,117] Trial 48 finished with value: 0.2228220429689419 and parameters: {'alpha': 525835.8636851001, 'n_pcs': 1500, 'iw_method': 'pc_logistic', 'iw_clip_max': 4.0, 'iw_prob_clip': 0.0013485815883683089, 'iw_n_components': 40, 'iw_logistic_c': 3.406613262026223e-06, 'iw_pca_fit': 'combined', 'iw_solver': 'lbfgs', 'iw_rho': 0.3}. Best is trial 40 with value: 0.2394604465702248.
2026-06-01 14:36:29 | INFO | Trial 49 | outer=2 | alpha=1.524e+06 n_pcs=5000 (pc_topk) weight={'name': 'pc_logistic', 'floor': 1e-06, 'clip_max': 4.0, 'prob_clip': 0.0010130230390370443, 'n_components': 40, 'logistic_c': 4.289817467499126e-05, 'pca_fit': 'combined', 'solver': 'lbfgs', 'max_iter': 2000, 'fit_intercept': True, 'standardize_with_source': True, 'rho': 0.3}
[I 2026-06-01 14:36:46,352] Trial 49 finished with value: 0.22833262332737517 and parameters: {'alpha': 1524001.2623032066, 'n_pcs': 5000, 'iw_method': 'pc_logistic', 'iw_clip_max': 4.0, 'iw_prob_clip': 0.0010130230390370443, 'iw_n_components': 40, 'iw_logistic_c': 4.289817467499126e-05, 'iw_pca_fit': 'combined', 'iw_solver': 'lbfgs', 'iw_rho': 0.3}. Best is trial 40 with value: 0.2394604465702248.
2026-06-01 14:36:46 | INFO | Trial 50 | outer=2 | alpha=2.217e+05 n_pcs=5000 (pc_topk) weight={'name': 'pc_logistic', 'floor': 1e-06, 'clip_max': 4.0, 'prob_clip': 0.0005234117554646983, 'n_components': 40, 'logistic_c': 0.000961974137033539, 'pca_fit': 'combined', 'solver': 'lbfgs', 'max_iter': 2000, 'fit_intercept': True, 'standardize_with_source': True, 'rho': 0.3}
[I 2026-06-01 14:37:06,103] Trial 50 finished with value: 0.23727820316845452 and parameters: {'alpha': 221668.88077381684, 'n_pcs': 5000, 'iw_method': 'pc_logistic', 'iw_clip_max': 4.0, 'iw_prob_clip': 0.0005234117554646983, 'iw_n_components': 40, 'iw_logistic_c': 0.000961974137033539, 'iw_pca_fit': 'combined', 'iw_solver': 'lbfgs', 'iw_rho': 0.3}. Best is trial 40 with value: 0.2394604465702248.
2026-06-01 14:37:06 | INFO | Trial 51 | outer=2 | alpha=1.822e+05 n_pcs=5000 (pc_topk) weight={'name': 'pc_logistic', 'floor': 1e-06, 'clip_max': 4.0, 'prob_clip': 0.0005496285855617106, 'n_components': 40, 'logistic_c': 0.0029340490144541664, 'pca_fit': 'combined', 'solver': 'lbfgs', 'max_iter': 2000, 'fit_intercept': True, 'standardize_with_source': True, 'rho': 0.3}
[I 2026-06-01 14:37:28,522] Trial 51 finished with value: 0.23734827371904568 and parameters: {'alpha': 182224.37850714062, 'n_pcs': 5000, 'iw_method': 'pc_logistic', 'iw_clip_max': 4.0, 'iw_prob_clip': 0.0005496285855617106, 'iw_n_components': 40, 'iw_logistic_c': 0.0029340490144541664, 'iw_pca_fit': 'combined', 'iw_solver': 'lbfgs', 'iw_rho': 0.3}. Best is trial 40 with value: 0.2394604465702248.
2026-06-01 14:37:28 | INFO | Trial 52 | outer=2 | alpha=7.886e+05 n_pcs=5000 (pc_topk) weight={'name': 'pc_logistic', 'floor': 1e-06, 'clip_max': 4.0, 'prob_clip': 0.0008658630635598061, 'n_components': 40, 'logistic_c': 0.007792869458070678, 'pca_fit': 'combined', 'solver': 'lbfgs', 'max_iter': 2000, 'fit_intercept': True, 'standardize_with_source': True, 'rho': 0.3}
[I 2026-06-01 14:37:52,875] Trial 52 finished with value: 0.2314444398269758 and parameters: {'alpha': 788582.4714084023, 'n_pcs': 5000, 'iw_method': 'pc_logistic', 'iw_clip_max': 4.0, 'iw_prob_clip': 0.0008658630635598061, 'iw_n_components': 40, 'iw_logistic_c': 0.007792869458070678, 'iw_pca_fit': 'combined', 'iw_solver': 'lbfgs', 'iw_rho': 0.3}. Best is trial 40 with value: 0.2394604465702248.
2026-06-01 14:37:52 | INFO | Trial 53 | outer=2 | alpha=1.519e+05 n_pcs=5000 (pc_topk) weight={'name': 'pc_logistic', 'floor': 1e-06, 'clip_max': 4.0, 'prob_clip': 0.0005106598466297252, 'n_components': 40, 'logistic_c': 1.8393678405738048e-05, 'pca_fit': 'combined', 'solver': 'lbfgs', 'max_iter': 2000, 'fit_intercept': True, 'standardize_with_source': True, 'rho': 0.3}
[I 2026-06-01 14:38:10,070] Trial 53 finished with value: 0.2387427605327796 and parameters: {'alpha': 151887.48023240117, 'n_pcs': 5000, 'iw_method': 'pc_logistic', 'iw_clip_max': 4.0, 'iw_prob_clip': 0.0005106598466297252, 'iw_n_components': 40, 'iw_logistic_c': 1.8393678405738048e-05, 'iw_pca_fit': 'combined', 'iw_solver': 'lbfgs', 'iw_rho': 0.3}. Best is trial 40 with value: 0.2394604465702248.
2026-06-01 14:38:10 | INFO | Trial 54 | outer=2 | alpha=1.076e+05 n_pcs=4500 (pc_topk) weight={'name': 'pc_logistic', 'floor': 1e-06, 'clip_max': 4.0, 'prob_clip': 0.001871357722752196, 'n_components': 40, 'logistic_c': 1.3238808596821676e-05, 'pca_fit': 'combined', 'solver': 'lbfgs', 'max_iter': 2000, 'fit_intercept': True, 'standardize_with_source': True, 'rho': 0.3}
[I 2026-06-01 14:38:25,473] Trial 54 finished with value: 0.2396068775133852 and parameters: {'alpha': 107568.92935168192, 'n_pcs': 4500, 'iw_method': 'pc_logistic', 'iw_clip_max': 4.0, 'iw_prob_clip': 0.001871357722752196, 'iw_n_components': 40, 'iw_logistic_c': 1.3238808596821676e-05, 'iw_pca_fit': 'combined', 'iw_solver': 'lbfgs', 'iw_rho': 0.3}. Best is trial 54 with value: 0.2396068775133852.
2026-06-01 14:38:25 | INFO | Trial 55 | outer=2 | alpha=1.049e+05 n_pcs=4500 (pc_topk) weight={'name': 'pc_logistic', 'floor': 1e-06, 'clip_max': 4.0, 'prob_clip': 0.001744521917971869, 'n_components': 40, 'logistic_c': 1.5063266370124703e-06, 'pca_fit': 'combined', 'solver': 'lbfgs', 'max_iter': 2000, 'fit_intercept': True, 'standardize_with_source': True, 'rho': 0.3}
[I 2026-06-01 14:38:40,654] Trial 55 finished with value: 0.2335460861135094 and parameters: {'alpha': 104915.47651289504, 'n_pcs': 4500, 'iw_method': 'pc_logistic', 'iw_clip_max': 4.0, 'iw_prob_clip': 0.001744521917971869, 'iw_n_components': 40, 'iw_logistic_c': 1.5063266370124703e-06, 'iw_pca_fit': 'combined', 'iw_solver': 'lbfgs', 'iw_rho': 0.3}. Best is trial 54 with value: 0.2396068775133852.
2026-06-01 14:38:40 | INFO | Trial 56 | outer=2 | alpha=4.081e+05 n_pcs=4000 (pc_topk) weight={'name': 'pc_logistic', 'floor': 1e-06, 'clip_max': 4.0, 'prob_clip': 0.0007694704928457131, 'n_components': 40, 'logistic_c': 0.00014307894229255476, 'pca_fit': 'combined', 'solver': 'lbfgs', 'max_iter': 2000, 'fit_intercept': True, 'standardize_with_source': True, 'rho': 0.3}
[I 2026-06-01 14:38:55,052] Trial 56 finished with value: 0.23764475969560017 and parameters: {'alpha': 408130.9217216059, 'n_pcs': 4000, 'iw_method': 'pc_logistic', 'iw_clip_max': 4.0, 'iw_prob_clip': 0.0007694704928457131, 'iw_n_components': 40, 'iw_logistic_c': 0.00014307894229255476, 'iw_pca_fit': 'combined', 'iw_solver': 'lbfgs', 'iw_rho': 0.3}. Best is trial 54 with value: 0.2396068775133852.
2026-06-01 14:38:55 | INFO | Trial 57 | outer=2 | alpha=1.443e+05 n_pcs=4500 (pc_topk) weight={'name': 'pc_logistic', 'floor': 1e-06, 'clip_max': 1.5, 'prob_clip': 0.0005084675051984904, 'n_components': 10, 'logistic_c': 1.3098417390359104e-05, 'pca_fit': 'combined', 'solver': 'lbfgs', 'max_iter': 2000, 'fit_intercept': True, 'standardize_with_source': True, 'rho': 0.5}
[I 2026-06-01 14:39:09,968] Trial 57 finished with value: 0.23586253240867458 and parameters: {'alpha': 144328.4645863044, 'n_pcs': 4500, 'iw_method': 'pc_logistic', 'iw_clip_max': 1.5, 'iw_prob_clip': 0.0005084675051984904, 'iw_n_components': 10, 'iw_logistic_c': 1.3098417390359104e-05, 'iw_pca_fit': 'combined', 'iw_solver': 'lbfgs', 'iw_rho': 0.5}. Best is trial 54 with value: 0.2396068775133852.
2026-06-01 14:39:09 | INFO | Trial 58 | outer=2 | alpha=9.142e+04 n_pcs=500 (pc_topk) weight={'name': 'pc_logistic', 'floor': 1e-06, 'clip_max': 12.0, 'prob_clip': 0.00246095349634772, 'n_components': 60, 'logistic_c': 1.2343281101391757e-05, 'pca_fit': 'combined', 'solver': 'lbfgs', 'max_iter': 2000, 'fit_intercept': True, 'standardize_with_source': True, 'rho': 0.3}
[I 2026-06-01 14:39:16,037] Trial 58 finished with value: 0.18917385429501524 and parameters: {'alpha': 91423.50036248204, 'n_pcs': 500, 'iw_method': 'pc_logistic', 'iw_clip_max': 12.0, 'iw_prob_clip': 0.00246095349634772, 'iw_n_components': 60, 'iw_logistic_c': 1.2343281101391757e-05, 'iw_pca_fit': 'combined', 'iw_solver': 'lbfgs', 'iw_rho': 0.3}. Best is trial 54 with value: 0.2396068775133852.
2026-06-01 14:39:16 | INFO | Trial 59 | outer=2 | alpha=2.875e+05 n_pcs=5000 (pc_topk) weight={'name': 'pc_logistic', 'floor': 1e-06, 'clip_max': 4.0, 'prob_clip': 0.0012491466869325076, 'n_components': 100, 'logistic_c': 1.6570486378653974e-06, 'pca_fit': 'combined', 'solver': 'lbfgs', 'max_iter': 2000, 'fit_intercept': True, 'standardize_with_source': True, 'rho': 0.85}
[I 2026-06-01 14:39:32,992] Trial 59 finished with value: 0.22997977879818424 and parameters: {'alpha': 287487.2439902386, 'n_pcs': 5000, 'iw_method': 'pc_logistic', 'iw_clip_max': 4.0, 'iw_prob_clip': 0.0012491466869325076, 'iw_n_components': 100, 'iw_logistic_c': 1.6570486378653974e-06, 'iw_pca_fit': 'combined', 'iw_solver': 'lbfgs', 'iw_rho': 0.85}. Best is trial 54 with value: 0.2396068775133852.
2026-06-01 14:39:33 | INFO | Trial 60 | outer=2 | alpha=6.061e+05 n_pcs=1000 (pc_topk) weight={'name': 'pc_logistic', 'floor': 1e-06, 'clip_max': 4.0, 'prob_clip': 0.0007363175211554254, 'n_components': 20, 'logistic_c': 0.00010294472054751157, 'pca_fit': 'combined', 'solver': 'lbfgs', 'max_iter': 2000, 'fit_intercept': True, 'standardize_with_source': True, 'rho': 0.7}
