[I 2026-06-01 16:14:42,660] Trial 110 finished with value: 0.20637011695332963 and parameters: {'alpha': 214495.73945055853, 'n_pcs': 4500, 'iw_method': 'pc_logistic', 'iw_clip_max': 2.5, 'iw_prob_clip': 0.0005794642369762632, 'iw_n_components': 60, 'iw_logistic_c': 0.00012135530022962467, 'iw_pca_fit': 'combined', 'iw_solver': 'lbfgs', 'iw_rho': 0.7}. Best is trial 91 with value: 0.2075271950999782.
2026-06-01 16:14:42 | INFO | Trial 111 | outer=3 | alpha=3.623e+05 n_pcs=4500 (pc_topk) weight={'name': 'pc_logistic', 'floor': 1e-06, 'clip_max': 2.5, 'prob_clip': 0.0005437382782520691, 'n_components': 60, 'logistic_c': 0.0001131263519718596, 'pca_fit': 'combined', 'solver': 'lbfgs', 'max_iter': 2000, 'fit_intercept': True, 'standardize_with_source': True, 'rho': 0.7}
[I 2026-06-01 16:15:11,439] Trial 111 finished with value: 0.20459393070985152 and parameters: {'alpha': 362283.1227929793, 'n_pcs': 4500, 'iw_method': 'pc_logistic', 'iw_clip_max': 2.5, 'iw_prob_clip': 0.0005437382782520691, 'iw_n_components': 60, 'iw_logistic_c': 0.0001131263519718596, 'iw_pca_fit': 'combined', 'iw_solver': 'lbfgs', 'iw_rho': 0.7}. Best is trial 91 with value: 0.2075271950999782.
2026-06-01 16:15:11 | INFO | Trial 112 | outer=3 | alpha=2.164e+05 n_pcs=5000 (pc_topk) weight={'name': 'pc_logistic', 'floor': 1e-06, 'clip_max': 2.5, 'prob_clip': 0.0006669930746549558, 'n_components': 60, 'logistic_c': 5.028459791468621e-05, 'pca_fit': 'combined', 'solver': 'lbfgs', 'max_iter': 2000, 'fit_intercept': True, 'standardize_with_source': True, 'rho': 0.7}
[I 2026-06-01 16:15:28,940] Trial 112 finished with value: 0.20538123786667478 and parameters: {'alpha': 216377.57430288196, 'n_pcs': 5000, 'iw_method': 'pc_logistic', 'iw_clip_max': 2.5, 'iw_prob_clip': 0.0006669930746549558, 'iw_n_components': 60, 'iw_logistic_c': 5.028459791468621e-05, 'iw_pca_fit': 'combined', 'iw_solver': 'lbfgs', 'iw_rho': 0.7}. Best is trial 91 with value: 0.2075271950999782.
2026-06-01 16:15:28 | INFO | Trial 113 | outer=3 | alpha=1.754e+05 n_pcs=4500 (pc_topk) weight={'name': 'pc_logistic', 'floor': 1e-06, 'clip_max': 2.5, 'prob_clip': 0.0006267489612143141, 'n_components': 60, 'logistic_c': 0.0001310868826623143, 'pca_fit': 'combined', 'solver': 'lbfgs', 'max_iter': 2000, 'fit_intercept': True, 'standardize_with_source': True, 'rho': 0.7}
[I 2026-06-01 16:15:46,304] Trial 113 finished with value: 0.20682740575763497 and parameters: {'alpha': 175402.09010157402, 'n_pcs': 4500, 'iw_method': 'pc_logistic', 'iw_clip_max': 2.5, 'iw_prob_clip': 0.0006267489612143141, 'iw_n_components': 60, 'iw_logistic_c': 0.0001310868826623143, 'iw_pca_fit': 'combined', 'iw_solver': 'lbfgs', 'iw_rho': 0.7}. Best is trial 91 with value: 0.2075271950999782.
2026-06-01 16:15:46 | INFO | Trial 114 | outer=3 | alpha=3.061e+05 n_pcs=4500 (pc_topk) weight={'name': 'pc_logistic', 'floor': 1e-06, 'clip_max': 2.5, 'prob_clip': 0.0005009619967225492, 'n_components': 60, 'logistic_c': 0.00021380101632631542, 'pca_fit': 'combined', 'solver': 'lbfgs', 'max_iter': 2000, 'fit_intercept': True, 'standardize_with_source': True, 'rho': 0.7}
[I 2026-06-01 16:16:03,677] Trial 114 finished with value: 0.20484774812523296 and parameters: {'alpha': 306121.0648547402, 'n_pcs': 4500, 'iw_method': 'pc_logistic', 'iw_clip_max': 2.5, 'iw_prob_clip': 0.0005009619967225492, 'iw_n_components': 60, 'iw_logistic_c': 0.00021380101632631542, 'iw_pca_fit': 'combined', 'iw_solver': 'lbfgs', 'iw_rho': 0.7}. Best is trial 91 with value: 0.2075271950999782.
2026-06-01 16:16:03 | INFO | Trial 115 | outer=3 | alpha=1.794e+05 n_pcs=4500 (pc_topk) weight={'name': 'pc_logistic', 'floor': 1e-06, 'clip_max': 2.5, 'prob_clip': 0.0006799180195119948, 'n_components': 60, 'logistic_c': 7.361258258435828e-05, 'pca_fit': 'combined', 'solver': 'lbfgs', 'max_iter': 2000, 'fit_intercept': True, 'standardize_with_source': True, 'rho': 0.7}
[I 2026-06-01 16:16:19,701] Trial 115 finished with value: 0.20694734483152416 and parameters: {'alpha': 179362.52202796916, 'n_pcs': 4500, 'iw_method': 'pc_logistic', 'iw_clip_max': 2.5, 'iw_prob_clip': 0.0006799180195119948, 'iw_n_components': 60, 'iw_logistic_c': 7.361258258435828e-05, 'iw_pca_fit': 'combined', 'iw_solver': 'lbfgs', 'iw_rho': 0.7}. Best is trial 91 with value: 0.2075271950999782.
2026-06-01 16:16:19 | INFO | Trial 116 | outer=3 | alpha=1.797e+05 n_pcs=4500 (pc_topk) weight={'name': 'pc_logistic', 'floor': 1e-06, 'clip_max': 2.5, 'prob_clip': 0.0006543202067674337, 'n_components': 60, 'logistic_c': 0.00012881516563303916, 'pca_fit': 'combined', 'solver': 'lbfgs', 'max_iter': 2000, 'fit_intercept': True, 'standardize_with_source': True, 'rho': 0.7}
[I 2026-06-01 16:16:35,923] Trial 116 finished with value: 0.20679020792593197 and parameters: {'alpha': 179718.64651412665, 'n_pcs': 4500, 'iw_method': 'pc_logistic', 'iw_clip_max': 2.5, 'iw_prob_clip': 0.0006543202067674337, 'iw_n_components': 60, 'iw_logistic_c': 0.00012881516563303916, 'iw_pca_fit': 'combined', 'iw_solver': 'lbfgs', 'iw_rho': 0.7}. Best is trial 91 with value: 0.2075271950999782.
2026-06-01 16:16:35 | INFO | Trial 117 | outer=3 | alpha=1.704e+05 n_pcs=5000 (pc_topk) weight={'name': 'pc_logistic', 'floor': 1e-06, 'clip_max': 2.5, 'prob_clip': 0.0006339075483827624, 'n_components': 60, 'logistic_c': 0.00012846170845938224, 'pca_fit': 'combined', 'solver': 'lbfgs', 'max_iter': 2000, 'fit_intercept': True, 'standardize_with_source': True, 'rho': 0.7}
[I 2026-06-01 16:16:55,562] Trial 117 finished with value: 0.2058423286827626 and parameters: {'alpha': 170417.51507268034, 'n_pcs': 5000, 'iw_method': 'pc_logistic', 'iw_clip_max': 2.5, 'iw_prob_clip': 0.0006339075483827624, 'iw_n_components': 60, 'iw_logistic_c': 0.00012846170845938224, 'iw_pca_fit': 'combined', 'iw_solver': 'lbfgs', 'iw_rho': 0.7}. Best is trial 91 with value: 0.2075271950999782.
2026-06-01 16:16:55 | INFO | Trial 118 | outer=3 | alpha=1.921e+05 n_pcs=4500 (pc_topk) weight={'name': 'pc_logistic', 'floor': 1e-06, 'clip_max': 2.5, 'prob_clip': 0.0006991227238380694, 'n_components': 60, 'logistic_c': 6.92977565367022e-05, 'pca_fit': 'combined', 'solver': 'lbfgs', 'max_iter': 2000, 'fit_intercept': True, 'standardize_with_source': True, 'rho': 0.7}
[I 2026-06-01 16:17:39,475] Trial 118 finished with value: 0.20681187867377027 and parameters: {'alpha': 192070.54606354656, 'n_pcs': 4500, 'iw_method': 'pc_logistic', 'iw_clip_max': 2.5, 'iw_prob_clip': 0.0006991227238380694, 'iw_n_components': 60, 'iw_logistic_c': 6.92977565367022e-05, 'iw_pca_fit': 'combined', 'iw_solver': 'lbfgs', 'iw_rho': 0.7}. Best is trial 91 with value: 0.2075271950999782.
2026-06-01 16:17:39 | INFO | Trial 119 | outer=3 | alpha=1.868e+05 n_pcs=4500 (pc_topk) weight={'name': 'pc_logistic', 'floor': 1e-06, 'clip_max': 2.5, 'prob_clip': 0.000712414815533278, 'n_components': 60, 'logistic_c': 7.532424766697243e-05, 'pca_fit': 'combined', 'solver': 'lbfgs', 'max_iter': 2000, 'fit_intercept': True, 'standardize_with_source': True, 'rho': 0.7}
[I 2026-06-01 16:17:56,662] Trial 119 finished with value: 0.20685534858200544 and parameters: {'alpha': 186756.93729102123, 'n_pcs': 4500, 'iw_method': 'pc_logistic', 'iw_clip_max': 2.5, 'iw_prob_clip': 0.000712414815533278, 'iw_n_components': 60, 'iw_logistic_c': 7.532424766697243e-05, 'iw_pca_fit': 'combined', 'iw_solver': 'lbfgs', 'iw_rho': 0.7}. Best is trial 91 with value: 0.2075271950999782.
2026-06-01 16:17:56 | INFO | Trial 120 | outer=3 | alpha=1.859e+05 n_pcs=4500 (pc_topk) weight={'name': 'pc_logistic', 'floor': 1e-06, 'clip_max': 2.5, 'prob_clip': 0.0007310534526019933, 'n_components': 60, 'logistic_c': 6.229890589900314e-05, 'pca_fit': 'combined', 'solver': 'lbfgs', 'max_iter': 2000, 'fit_intercept': True, 'standardize_with_source': True, 'rho': 0.7}
[I 2026-06-01 16:18:13,819] Trial 120 finished with value: 0.2068635335050935 and parameters: {'alpha': 185919.78070813208, 'n_pcs': 4500, 'iw_method': 'pc_logistic', 'iw_clip_max': 2.5, 'iw_prob_clip': 0.0007310534526019933, 'iw_n_components': 60, 'iw_logistic_c': 6.229890589900314e-05, 'iw_pca_fit': 'combined', 'iw_solver': 'lbfgs', 'iw_rho': 0.7}. Best is trial 91 with value: 0.2075271950999782.
2026-06-01 16:18:13 | INFO | Trial 121 | outer=3 | alpha=1.943e+05 n_pcs=4500 (pc_topk) weight={'name': 'pc_logistic', 'floor': 1e-06, 'clip_max': 2.5, 'prob_clip': 0.0007404877253987599, 'n_components': 60, 'logistic_c': 8.342215058609424e-05, 'pca_fit': 'combined', 'solver': 'lbfgs', 'max_iter': 2000, 'fit_intercept': True, 'standardize_with_source': True, 'rho': 0.7}
[I 2026-06-01 16:18:30,085] Trial 121 finished with value: 0.2067186519679462 and parameters: {'alpha': 194335.63812464575, 'n_pcs': 4500, 'iw_method': 'pc_logistic', 'iw_clip_max': 2.5, 'iw_prob_clip': 0.0007404877253987599, 'iw_n_components': 60, 'iw_logistic_c': 8.342215058609424e-05, 'iw_pca_fit': 'combined', 'iw_solver': 'lbfgs', 'iw_rho': 0.7}. Best is trial 91 with value: 0.2075271950999782.
2026-06-01 16:18:30 | INFO | Trial 122 | outer=3 | alpha=1.867e+05 n_pcs=4500 (pc_topk) weight={'name': 'pc_logistic', 'floor': 1e-06, 'clip_max': 2.5, 'prob_clip': 0.0007061356285448432, 'n_components': 60, 'logistic_c': 5.9175246926249076e-05, 'pca_fit': 'combined', 'solver': 'lbfgs', 'max_iter': 2000, 'fit_intercept': True, 'standardize_with_source': True, 'rho': 0.7}
[I 2026-06-01 16:18:45,900] Trial 122 finished with value: 0.2068299613445189 and parameters: {'alpha': 186664.76395517282, 'n_pcs': 4500, 'iw_method': 'pc_logistic', 'iw_clip_max': 2.5, 'iw_prob_clip': 0.0007061356285448432, 'iw_n_components': 60, 'iw_logistic_c': 5.9175246926249076e-05, 'iw_pca_fit': 'combined', 'iw_solver': 'lbfgs', 'iw_rho': 0.7}. Best is trial 91 with value: 0.2075271950999782.
2026-06-01 16:18:45 | INFO | Trial 123 | outer=3 | alpha=1.693e+05 n_pcs=5000 (pc_topk) weight={'name': 'pc_logistic', 'floor': 1e-06, 'clip_max': 2.5, 'prob_clip': 0.0007270185681619726, 'n_components': 60, 'logistic_c': 6.681906247638657e-05, 'pca_fit': 'combined', 'solver': 'lbfgs', 'max_iter': 2000, 'fit_intercept': True, 'standardize_with_source': True, 'rho': 0.7}
[I 2026-06-01 16:19:03,954] Trial 123 finished with value: 0.2060252637416112 and parameters: {'alpha': 169323.33094361267, 'n_pcs': 5000, 'iw_method': 'pc_logistic', 'iw_clip_max': 2.5, 'iw_prob_clip': 0.0007270185681619726, 'iw_n_components': 60, 'iw_logistic_c': 6.681906247638657e-05, 'iw_pca_fit': 'combined', 'iw_solver': 'lbfgs', 'iw_rho': 0.7}. Best is trial 91 with value: 0.2075271950999782.
2026-06-01 16:19:03 | INFO | Trial 124 | outer=3 | alpha=1.834e+05 n_pcs=4500 (pc_topk) weight={'name': 'pc_logistic', 'floor': 1e-06, 'clip_max': 2.5, 'prob_clip': 0.0005872965385214477, 'n_components': 60, 'logistic_c': 0.0002788059612465661, 'pca_fit': 'combined', 'solver': 'lbfgs', 'max_iter': 2000, 'fit_intercept': True, 'standardize_with_source': True, 'rho': 0.7}
[I 2026-06-01 16:19:43,405] Trial 124 finished with value: 0.20622479223503767 and parameters: {'alpha': 183414.2497435729, 'n_pcs': 4500, 'iw_method': 'pc_logistic', 'iw_clip_max': 2.5, 'iw_prob_clip': 0.0005872965385214477, 'iw_n_components': 60, 'iw_logistic_c': 0.0002788059612465661, 'iw_pca_fit': 'combined', 'iw_solver': 'lbfgs', 'iw_rho': 0.7}. Best is trial 91 with value: 0.2075271950999782.
2026-06-01 16:19:43 | INFO | Trial 125 | outer=3 | alpha=1.343e+05 n_pcs=4500 (pc_topk) weight={'name': 'pc_logistic', 'floor': 1e-06, 'clip_max': 2.5, 'prob_clip': 0.0007515910846303175, 'n_components': 60, 'logistic_c': 6.955875719994494e-05, 'pca_fit': 'combined', 'solver': 'lbfgs', 'max_iter': 2000, 'fit_intercept': True, 'standardize_with_source': True, 'rho': 0.7}
[I 2026-06-01 16:20:12,632] Trial 125 finished with value: 0.20739866421842126 and parameters: {'alpha': 134271.92901745887, 'n_pcs': 4500, 'iw_method': 'pc_logistic', 'iw_clip_max': 2.5, 'iw_prob_clip': 0.0007515910846303175, 'iw_n_components': 60, 'iw_logistic_c': 6.955875719994494e-05, 'iw_pca_fit': 'combined', 'iw_solver': 'lbfgs', 'iw_rho': 0.7}. Best is trial 91 with value: 0.2075271950999782.
2026-06-01 16:20:12 | INFO | Trial 126 | outer=3 | alpha=1.171e+05 n_pcs=4500 (pc_topk) weight={'name': 'uniform'}
[I 2026-06-01 16:20:34,286] Trial 126 finished with value: 0.1998890626818877 and parameters: {'alpha': 117127.88499375287, 'n_pcs': 4500, 'iw_method': 'uniform'}. Best is trial 91 with value: 0.2075271950999782.
2026-06-01 16:20:34 | INFO | Trial 127 | outer=3 | alpha=1.477e+05 n_pcs=4500 (pc_topk) weight={'name': 'pc_logistic', 'floor': 1e-06, 'clip_max': 2.5, 'prob_clip': 0.0007314272818281808, 'n_components': 60, 'logistic_c': 6.558789891205957e-05, 'pca_fit': 'combined', 'solver': 'lbfgs', 'max_iter': 2000, 'fit_intercept': True, 'standardize_with_source': True, 'rho': 0.7}
[I 2026-06-01 16:20:50,045] Trial 127 finished with value: 0.20729759669468276 and parameters: {'alpha': 147667.2406531842, 'n_pcs': 4500, 'iw_method': 'pc_logistic', 'iw_clip_max': 2.5, 'iw_prob_clip': 0.0007314272818281808, 'iw_n_components': 60, 'iw_logistic_c': 6.558789891205957e-05, 'iw_pca_fit': 'combined', 'iw_solver': 'lbfgs', 'iw_rho': 0.7}. Best is trial 91 with value: 0.2075271950999782.
2026-06-01 16:20:50 | INFO | Trial 128 | outer=3 | alpha=9.737e+06 n_pcs=5000 (pc_topk) weight={'name': 'pc_logistic', 'floor': 1e-06, 'clip_max': 2.5, 'prob_clip': 0.0006948135605648094, 'n_components': 60, 'logistic_c': 4.954041714461101e-05, 'pca_fit': 'combined', 'solver': 'lbfgs', 'max_iter': 2000, 'fit_intercept': True, 'standardize_with_source': True, 'rho': 0.7}
[I 2026-06-01 16:21:15,003] Trial 128 finished with value: 0.19386570774772893 and parameters: {'alpha': 9737107.945261743, 'n_pcs': 5000, 'iw_method': 'pc_logistic', 'iw_clip_max': 2.5, 'iw_prob_clip': 0.0006948135605648094, 'iw_n_components': 60, 'iw_logistic_c': 4.954041714461101e-05, 'iw_pca_fit': 'combined', 'iw_solver': 'lbfgs', 'iw_rho': 0.7}. Best is trial 91 with value: 0.2075271950999782.
2026-06-01 16:21:15 | INFO | Trial 129 | outer=3 | alpha=1.398e+05 n_pcs=4500 (pc_topk) weight={'name': 'pc_logistic', 'floor': 1e-06, 'clip_max': 2.5, 'prob_clip': 0.0007710306655198833, 'n_components': 40, 'logistic_c': 6.12206466076862e-05, 'pca_fit': 'combined', 'solver': 'lbfgs', 'max_iter': 2000, 'fit_intercept': True, 'standardize_with_source': True, 'rho': 0.7}
[I 2026-06-01 16:21:40,074] Trial 129 finished with value: 0.20650354489102454 and parameters: {'alpha': 139830.2585380437, 'n_pcs': 4500, 'iw_method': 'pc_logistic', 'iw_clip_max': 2.5, 'iw_prob_clip': 0.0007710306655198833, 'iw_n_components': 40, 'iw_logistic_c': 6.12206466076862e-05, 'iw_pca_fit': 'combined', 'iw_solver': 'lbfgs', 'iw_rho': 0.7}. Best is trial 91 with value: 0.2075271950999782.
2026-06-01 16:21:40 | INFO | Trial 130 | outer=3 | alpha=1.058e+05 n_pcs=5000 (pc_topk) weight={'name': 'pc_logistic', 'floor': 1e-06, 'clip_max': 7.0, 'prob_clip': 0.0009820485075387358, 'n_components': 60, 'logistic_c': 1.2452080856230923e-05, 'pca_fit': 'combined', 'solver': 'lbfgs', 'max_iter': 2000, 'fit_intercept': True, 'standardize_with_source': True, 'rho': 0.7}
[I 2026-06-01 16:21:58,944] Trial 130 finished with value: 0.20313675546001136 and parameters: {'alpha': 105826.36313589949, 'n_pcs': 5000, 'iw_method': 'pc_logistic', 'iw_clip_max': 7.0, 'iw_prob_clip': 0.0009820485075387358, 'iw_n_components': 60, 'iw_logistic_c': 1.2452080856230923e-05, 'iw_pca_fit': 'combined', 'iw_solver': 'lbfgs', 'iw_rho': 0.7}. Best is trial 91 with value: 0.2075271950999782.
2026-06-01 16:21:58 | INFO | Trial 131 | outer=3 | alpha=1.369e+05 n_pcs=4500 (pc_topk) weight={'name': 'pc_logistic', 'floor': 1e-06, 'clip_max': 2.5, 'prob_clip': 0.0007936664844141818, 'n_components': 40, 'logistic_c': 7.467588561350592e-05, 'pca_fit': 'combined', 'solver': 'lbfgs', 'max_iter': 2000, 'fit_intercept': True, 'standardize_with_source': True, 'rho': 0.7}
[I 2026-06-01 16:22:22,434] Trial 131 finished with value: 0.2062509850036006 and parameters: {'alpha': 136913.31339839014, 'n_pcs': 4500, 'iw_method': 'pc_logistic', 'iw_clip_max': 2.5, 'iw_prob_clip': 0.0007936664844141818, 'iw_n_components': 40, 'iw_logistic_c': 7.467588561350592e-05, 'iw_pca_fit': 'combined', 'iw_solver': 'lbfgs', 'iw_rho': 0.7}. Best is trial 91 with value: 0.2075271950999782.
2026-06-01 16:22:22 | INFO | Trial 132 | outer=3 | alpha=1.482e+05 n_pcs=4500 (pc_topk) weight={'name': 'pc_logistic', 'floor': 1e-06, 'clip_max': 2.5, 'prob_clip': 0.0007159121689308505, 'n_components': 40, 'logistic_c': 4.9145827060723995e-05, 'pca_fit': 'combined', 'solver': 'lbfgs', 'max_iter': 2000, 'fit_intercept': True, 'standardize_with_source': True, 'rho': 0.7}
[I 2026-06-01 16:22:45,906] Trial 132 finished with value: 0.206631311542198 and parameters: {'alpha': 148156.8381974034, 'n_pcs': 4500, 'iw_method': 'pc_logistic', 'iw_clip_max': 2.5, 'iw_prob_clip': 0.0007159121689308505, 'iw_n_components': 40, 'iw_logistic_c': 4.9145827060723995e-05, 'iw_pca_fit': 'combined', 'iw_solver': 'lbfgs', 'iw_rho': 0.7}. Best is trial 91 with value: 0.2075271950999782.
2026-06-01 16:22:45 | INFO | Trial 133 | outer=3 | alpha=1.745e+05 n_pcs=4500 (pc_topk) weight={'name': 'pc_logistic', 'floor': 1e-06, 'clip_max': 2.5, 'prob_clip': 0.0005151124742204665, 'n_components': 40, 'logistic_c': 4.3627613193368987e-05, 'pca_fit': 'combined', 'solver': 'lbfgs', 'max_iter': 2000, 'fit_intercept': True, 'standardize_with_source': True, 'rho': 0.7}
[I 2026-06-01 16:23:02,052] Trial 133 finished with value: 0.2063447613507543 and parameters: {'alpha': 174497.5804457765, 'n_pcs': 4500, 'iw_method': 'pc_logistic', 'iw_clip_max': 2.5, 'iw_prob_clip': 0.0005151124742204665, 'iw_n_components': 40, 'iw_logistic_c': 4.3627613193368987e-05, 'iw_pca_fit': 'combined', 'iw_solver': 'lbfgs', 'iw_rho': 0.7}. Best is trial 91 with value: 0.2075271950999782.
2026-06-01 16:23:02 | INFO | Trial 134 | outer=3 | alpha=1.621e+05 n_pcs=4500 (pc_topk) weight={'name': 'pc_logistic', 'floor': 1e-06, 'clip_max': 12.0, 'prob_clip': 0.0006938305291160712, 'n_components': 60, 'logistic_c': 8.759036078212301e-05, 'pca_fit': 'combined', 'solver': 'lbfgs', 'max_iter': 2000, 'fit_intercept': True, 'standardize_with_source': True, 'rho': 0.7}
[I 2026-06-01 16:23:30,850] Trial 134 finished with value: 0.19813307048065193 and parameters: {'alpha': 162056.37751177736, 'n_pcs': 4500, 'iw_method': 'pc_logistic', 'iw_clip_max': 12.0, 'iw_prob_clip': 0.0006938305291160712, 'iw_n_components': 60, 'iw_logistic_c': 8.759036078212301e-05, 'iw_pca_fit': 'combined', 'iw_solver': 'lbfgs', 'iw_rho': 0.7}. Best is trial 91 with value: 0.2075271950999782.
2026-06-01 16:23:30 | INFO | Trial 135 | outer=3 | alpha=1.088e+05 n_pcs=4500 (pc_topk) weight={'name': 'pc_logistic', 'floor': 1e-06, 'clip_max': 2.5, 'prob_clip': 0.001104929271151055, 'n_components': 20, 'logistic_c': 0.00027788212265448555, 'pca_fit': 'combined', 'solver': 'lbfgs', 'max_iter': 2000, 'fit_intercept': True, 'standardize_with_source': True, 'rho': 0.3}
[I 2026-06-01 16:23:56,258] Trial 135 finished with value: 0.20608756749543855 and parameters: {'alpha': 108837.2941412317, 'n_pcs': 4500, 'iw_method': 'pc_logistic', 'iw_clip_max': 2.5, 'iw_prob_clip': 0.001104929271151055, 'iw_n_components': 20, 'iw_logistic_c': 0.00027788212265448555, 'iw_pca_fit': 'combined', 'iw_solver': 'lbfgs', 'iw_rho': 0.3}. Best is trial 91 with value: 0.2075271950999782.
2026-06-01 16:23:56 | INFO | Trial 136 | outer=3 | alpha=2.980e+05 n_pcs=4500 (pc_topk) weight={'name': 'pc_logistic', 'floor': 1e-06, 'clip_max': 4.0, 'prob_clip': 0.0007248622441955921, 'n_components': 60, 'logistic_c': 1.3159938382691862e-05, 'pca_fit': 'combined', 'solver': 'lbfgs', 'max_iter': 2000, 'fit_intercept': True, 'standardize_with_source': True, 'rho': 0.7}
[I 2026-06-01 16:24:12,038] Trial 136 finished with value: 0.2044227631330783 and parameters: {'alpha': 297995.20946660824, 'n_pcs': 4500, 'iw_method': 'pc_logistic', 'iw_clip_max': 4.0, 'iw_prob_clip': 0.0007248622441955921, 'iw_n_components': 60, 'iw_logistic_c': 1.3159938382691862e-05, 'iw_pca_fit': 'combined', 'iw_solver': 'lbfgs', 'iw_rho': 0.7}. Best is trial 91 with value: 0.2075271950999782.
2026-06-01 16:24:12 | INFO | Trial 137 | outer=3 | alpha=1.432e+05 n_pcs=4500 (pc_topk) weight={'name': 'pc_logistic', 'floor': 1e-06, 'clip_max': 2.5, 'prob_clip': 0.0008505315131341118, 'n_components': 60, 'logistic_c': 3.204027088980037e-05, 'pca_fit': 'combined', 'solver': 'lbfgs', 'max_iter': 2000, 'fit_intercept': True, 'standardize_with_source': True, 'rho': 0.7}
[I 2026-06-01 16:24:27,603] Trial 137 finished with value: 0.2075589796886786 and parameters: {'alpha': 143204.64523079435, 'n_pcs': 4500, 'iw_method': 'pc_logistic', 'iw_clip_max': 2.5, 'iw_prob_clip': 0.0008505315131341118, 'iw_n_components': 60, 'iw_logistic_c': 3.204027088980037e-05, 'iw_pca_fit': 'combined', 'iw_solver': 'lbfgs', 'iw_rho': 0.7}. Best is trial 137 with value: 0.2075589796886786.
2026-06-01 16:24:27 | INFO | Trial 138 | outer=3 | alpha=1.435e+05 n_pcs=5000 (pc_topk) weight={'name': 'pc_logistic', 'floor': 1e-06, 'clip_max': 2.5, 'prob_clip': 0.0008572631051960411, 'n_components': 60, 'logistic_c': 7.55856536883437e-06, 'pca_fit': 'combined', 'solver': 'lbfgs', 'max_iter': 2000, 'fit_intercept': True, 'standardize_with_source': True, 'rho': 1.0}
