[I 2026-06-01 12:53:59,190] Trial 59 pruned. 
2026-06-01 12:53:59 | INFO | Trial 60 | outer=5 | hidden=[1024, 256] epochs=82 lr=2.639e-04 wd=1.470e-06 n_pcs=4500 weight={'name': 'uniform'}
[I 2026-06-01 12:54:08,480] Trial 60 finished with value: 0.21105171548358137 and parameters: {'hidden_dims': '[1024, 256]', 'dropout': 0.22029234208109402, 'batch_norm': False, 'lr': 0.00026389491270768583, 'weight_decay': 1.469821340383695e-06, 'epochs': 82, 'loss': 'mse', 'optimizer': 'adamw', 'use_snp_selection': False, 'n_pcs': 4500}. Best is trial 26 with value: 0.2282589829782725.
2026-06-01 12:54:08 | INFO | Trial 61 | outer=5 | hidden=[1024, 256] epochs=77 lr=3.542e-04 wd=1.219e-07 n_pcs=5000 weight={'name': 'uniform'}
[I 2026-06-01 12:54:17,866] Trial 61 finished with value: 0.20973652095636677 and parameters: {'hidden_dims': '[1024, 256]', 'dropout': 0.1706868715922714, 'batch_norm': False, 'lr': 0.0003541519006150739, 'weight_decay': 1.219086159720751e-07, 'epochs': 77, 'loss': 'mse', 'optimizer': 'adamw', 'use_snp_selection': False, 'n_pcs': 5000}. Best is trial 26 with value: 0.2282589829782725.
2026-06-01 12:54:17 | INFO | Trial 62 | outer=5 | hidden=[1024, 256] epochs=115 lr=4.477e-04 wd=6.172e-07 n_pcs=5000 weight={'name': 'uniform'}
[I 2026-06-01 12:54:30,674] Trial 62 finished with value: 0.22406552930821286 and parameters: {'hidden_dims': '[1024, 256]', 'dropout': 0.09995527347878527, 'batch_norm': False, 'lr': 0.0004476604288419701, 'weight_decay': 6.171867561314368e-07, 'epochs': 115, 'loss': 'mse', 'optimizer': 'adamw', 'use_snp_selection': False, 'n_pcs': 5000}. Best is trial 26 with value: 0.2282589829782725.
2026-06-01 12:54:30 | INFO | Trial 63 | outer=5 | hidden=[1024, 256] epochs=99 lr=4.483e-04 wd=2.602e-06 n_pcs=4500 weight={'name': 'uniform'}
[I 2026-06-01 12:54:41,394] Trial 63 finished with value: 0.22980708190603338 and parameters: {'hidden_dims': '[1024, 256]', 'dropout': 0.28388576430963147, 'batch_norm': False, 'lr': 0.0004483159571454992, 'weight_decay': 2.602217053405568e-06, 'epochs': 99, 'loss': 'mse', 'optimizer': 'adamw', 'use_snp_selection': False, 'n_pcs': 4500}. Best is trial 63 with value: 0.22980708190603338.
2026-06-01 12:54:41 | INFO | Trial 64 | outer=5 | hidden=[1024, 256] epochs=97 lr=4.269e-04 wd=2.560e-06 n_pcs=5000 weight={'name': 'uniform'}
[I 2026-06-01 12:54:52,576] Trial 64 finished with value: 0.23049422231155905 and parameters: {'hidden_dims': '[1024, 256]', 'dropout': 0.005537890995880312, 'batch_norm': False, 'lr': 0.0004268754644739996, 'weight_decay': 2.560320522218094e-06, 'epochs': 97, 'loss': 'mse', 'optimizer': 'adamw', 'use_snp_selection': False, 'n_pcs': 5000}. Best is trial 64 with value: 0.23049422231155905.
2026-06-01 12:54:52 | INFO | Trial 65 | outer=5 | hidden=[1024, 256] epochs=99 lr=4.250e-04 wd=3.958e-06 n_pcs=4500 weight={'name': 'uniform'}
[I 2026-06-01 12:55:03,303] Trial 65 finished with value: 0.21955359537249172 and parameters: {'hidden_dims': '[1024, 256]', 'dropout': 0.015414377493996158, 'batch_norm': False, 'lr': 0.00042496477162935905, 'weight_decay': 3.957502285871492e-06, 'epochs': 99, 'loss': 'mse', 'optimizer': 'adamw', 'use_snp_selection': False, 'n_pcs': 4500}. Best is trial 64 with value: 0.23049422231155905.
2026-06-01 12:55:03 | INFO | Trial 66 | outer=5 | hidden=[1024, 256] epochs=71 lr=3.676e-04 wd=2.359e-06 n_pcs=4000 weight={'name': 'uniform'}
[I 2026-06-01 12:55:10,922] Trial 66 finished with value: 0.21941096722016012 and parameters: {'hidden_dims': '[1024, 256]', 'dropout': 0.3017316575718223, 'batch_norm': False, 'lr': 0.0003676302934301302, 'weight_decay': 2.3585177278461444e-06, 'epochs': 71, 'loss': 'mse', 'optimizer': 'adamw', 'use_snp_selection': False, 'n_pcs': 4000}. Best is trial 64 with value: 0.23049422231155905.
2026-06-01 12:55:10 | INFO | Trial 67 | outer=5 | hidden=[128, 64] epochs=136 lr=2.719e-04 wd=8.370e-06 n_pcs=2000 weight={'name': 'uniform'}
[I 2026-06-01 12:55:14,396] Trial 67 finished with value: 0.19323725104398615 and parameters: {'hidden_dims': '[128, 64]', 'dropout': 0.2573839403419645, 'batch_norm': False, 'lr': 0.00027186299659808584, 'weight_decay': 8.370109669498881e-06, 'epochs': 136, 'loss': 'mse', 'optimizer': 'adamw', 'use_snp_selection': False, 'n_pcs': 2000}. Best is trial 64 with value: 0.23049422231155905.
2026-06-01 12:55:14 | INFO | Trial 68 | outer=5 | hidden=[1024, 256] epochs=62 lr=1.147e-04 wd=1.260e-06 n_pcs=4500 weight={'name': 'uniform'}
[I 2026-06-01 12:55:22,022] Trial 68 finished with value: 0.19666745833091376 and parameters: {'hidden_dims': '[1024, 256]', 'dropout': 0.03695972543273594, 'batch_norm': False, 'lr': 0.00011474131216150811, 'weight_decay': 1.2597469237776068e-06, 'epochs': 62, 'loss': 'mae', 'optimizer': 'adam', 'use_snp_selection': False, 'n_pcs': 4500}. Best is trial 64 with value: 0.23049422231155905.
2026-06-01 12:55:22 | INFO | Trial 69 | outer=5 | hidden=[512, 128] epochs=87 lr=2.092e-04 wd=2.683e-06 n_pcs=5000 weight={'name': 'uniform'}
[I 2026-06-01 12:55:28,190] Trial 69 finished with value: 0.2116615485748395 and parameters: {'hidden_dims': '[512, 128]', 'dropout': 0.2911638048910177, 'batch_norm': False, 'lr': 0.00020924963127058797, 'weight_decay': 2.683022315551409e-06, 'epochs': 87, 'loss': 'mse', 'optimizer': 'adamw', 'use_snp_selection': False, 'n_pcs': 5000}. Best is trial 64 with value: 0.23049422231155905.
2026-06-01 12:55:28 | INFO | Trial 70 | outer=5 | hidden=[1024, 256] epochs=75 lr=4.965e-04 wd=4.444e-06 n_pcs=4500 weight={'name': 'uniform'}
[I 2026-06-01 12:55:36,936] Trial 70 finished with value: 0.22841331074791893 and parameters: {'hidden_dims': '[1024, 256]', 'dropout': 0.28352348648897463, 'batch_norm': False, 'lr': 0.0004965060675964835, 'weight_decay': 4.443544046509709e-06, 'epochs': 75, 'loss': 'mse', 'optimizer': 'adamw', 'use_snp_selection': False, 'n_pcs': 4500}. Best is trial 64 with value: 0.23049422231155905.
2026-06-01 12:55:36 | INFO | Trial 71 | outer=5 | hidden=[1024, 256] epochs=96 lr=4.962e-04 wd=7.967e-06 n_pcs=4500 weight={'name': 'uniform'}
[I 2026-06-01 12:55:47,431] Trial 71 finished with value: 0.21768514828933538 and parameters: {'hidden_dims': '[1024, 256]', 'dropout': 0.27660235797604565, 'batch_norm': False, 'lr': 0.0004961846554193441, 'weight_decay': 7.96713624717213e-06, 'epochs': 96, 'loss': 'mse', 'optimizer': 'adamw', 'use_snp_selection': False, 'n_pcs': 4500}. Best is trial 64 with value: 0.23049422231155905.
2026-06-01 12:55:47 | INFO | Trial 72 | outer=5 | hidden=[1024, 256] epochs=74 lr=4.193e-04 wd=4.590e-06 n_pcs=4500 weight={'name': 'uniform'}
[I 2026-06-01 12:55:56,082] Trial 72 finished with value: 0.2190317457414605 and parameters: {'hidden_dims': '[1024, 256]', 'dropout': 0.31717098043202, 'batch_norm': False, 'lr': 0.0004193416044029992, 'weight_decay': 4.5896060501812005e-06, 'epochs': 74, 'loss': 'mse', 'optimizer': 'adamw', 'use_snp_selection': False, 'n_pcs': 4500}. Best is trial 64 with value: 0.23049422231155905.
2026-06-01 12:55:56 | INFO | Trial 73 | outer=5 | hidden=[1024, 256] epochs=84 lr=3.210e-04 wd=1.806e-06 n_pcs=4000 weight={'name': 'uniform'}
[I 2026-06-01 12:56:04,706] Trial 73 finished with value: 0.2232695157546707 and parameters: {'hidden_dims': '[1024, 256]', 'dropout': 0.2526120633816362, 'batch_norm': False, 'lr': 0.00032095402715148205, 'weight_decay': 1.8060085086030907e-06, 'epochs': 84, 'loss': 'mse', 'optimizer': 'adamw', 'use_snp_selection': False, 'n_pcs': 4000}. Best is trial 64 with value: 0.23049422231155905.
2026-06-01 12:56:04 | INFO | Trial 74 | outer=5 | hidden=[1024, 256] epochs=110 lr=3.840e-04 wd=3.432e-08 n_pcs=5000 weight={'name': 'uniform'}
[I 2026-06-01 12:56:17,091] Trial 74 finished with value: 0.22350520898867204 and parameters: {'hidden_dims': '[1024, 256]', 'dropout': 0.0027257936032391017, 'batch_norm': False, 'lr': 0.0003840344530448679, 'weight_decay': 3.431992301770592e-08, 'epochs': 110, 'loss': 'mse', 'optimizer': 'adamw', 'use_snp_selection': False, 'n_pcs': 5000}. Best is trial 64 with value: 0.23049422231155905.
2026-06-01 12:56:17 | INFO | Trial 75 | outer=5 | hidden=[1024, 256] epochs=78 lr=4.417e-04 wd=2.970e-06 n_pcs=4500 weight={'name': 'uniform'}
[I 2026-06-01 12:56:26,066] Trial 75 finished with value: 0.23382104046159724 and parameters: {'hidden_dims': '[1024, 256]', 'dropout': 0.3526541160817904, 'batch_norm': False, 'lr': 0.0004417218238425998, 'weight_decay': 2.9700048475215045e-06, 'epochs': 78, 'loss': 'mse', 'optimizer': 'adamw', 'use_snp_selection': False, 'n_pcs': 4500}. Best is trial 75 with value: 0.23382104046159724.
2026-06-01 12:56:26 | INFO | Trial 76 | outer=5 | hidden=[512, 128] epochs=57 lr=4.332e-04 wd=3.812e-06 n_pcs=4500 weight={'name': 'uniform'}
[I 2026-06-01 12:56:30,709] Trial 76 finished with value: 0.20769775568679205 and parameters: {'hidden_dims': '[512, 128]', 'dropout': 0.35531073591499374, 'batch_norm': False, 'lr': 0.00043323955861538895, 'weight_decay': 3.8115611002843697e-06, 'epochs': 57, 'loss': 'mse', 'optimizer': 'adamw', 'use_snp_selection': False, 'n_pcs': 4500}. Best is trial 75 with value: 0.23382104046159724.
2026-06-01 12:56:30 | INFO | Trial 77 | outer=5 | hidden=[1024, 256] epochs=79 lr=4.563e-04 wd=1.190e-06 n_pcs=4000 weight={'name': 'uniform'}
[I 2026-06-01 12:56:38,956] Trial 77 finished with value: 0.21933463361314626 and parameters: {'hidden_dims': '[1024, 256]', 'dropout': 0.39417150823957314, 'batch_norm': False, 'lr': 0.0004562862694249364, 'weight_decay': 1.1896316487370674e-06, 'epochs': 79, 'loss': 'mse', 'optimizer': 'adamw', 'use_snp_selection': False, 'n_pcs': 4000}. Best is trial 75 with value: 0.23382104046159724.
2026-06-01 12:56:38 | INFO | Trial 78 | outer=5 | hidden=[256, 128] epochs=124 lr=3.364e-04 wd=2.467e-06 n_pcs=5000 weight={'name': 'uniform'}
[I 2026-06-01 12:56:44,195] Trial 78 finished with value: 0.2008469252949845 and parameters: {'hidden_dims': '[256, 128]', 'dropout': 0.2921477288208905, 'batch_norm': False, 'lr': 0.0003363531306433067, 'weight_decay': 2.466657625492474e-06, 'epochs': 124, 'loss': 'mse', 'optimizer': 'adamw', 'use_snp_selection': False, 'n_pcs': 5000}. Best is trial 75 with value: 0.23382104046159724.
2026-06-01 12:56:44 | INFO | Trial 79 | outer=5 | hidden=[1024, 256] epochs=103 lr=4.974e-04 wd=1.169e-05 n_pcs=3500 weight={'name': 'uniform'}
[I 2026-06-01 12:56:53,387] Trial 79 finished with value: 0.20916419219053012 and parameters: {'hidden_dims': '[1024, 256]', 'dropout': 0.34701528746290766, 'batch_norm': False, 'lr': 0.0004974075514762363, 'weight_decay': 1.1694214246630223e-05, 'epochs': 103, 'loss': 'mae', 'optimizer': 'adam', 'use_snp_selection': False, 'n_pcs': 3500}. Best is trial 75 with value: 0.23382104046159724.
2026-06-01 12:56:53 | INFO | Trial 80 | outer=5 | hidden=[128, 64] epochs=91 lr=2.375e-04 wd=1.613e-06 n_pcs=4500 weight={'name': 'uniform'}
[I 2026-06-01 12:56:56,710] Trial 80 finished with value: 0.22244388214052124 and parameters: {'hidden_dims': '[128, 64]', 'dropout': 0.21863627738535396, 'batch_norm': False, 'lr': 0.00023752885936595907, 'weight_decay': 1.6125457020827771e-06, 'epochs': 91, 'loss': 'mse', 'optimizer': 'adamw', 'use_snp_selection': False, 'n_pcs': 4500}. Best is trial 75 with value: 0.23382104046159724.
2026-06-01 12:56:56 | INFO | Trial 81 | outer=5 | hidden=[1024, 256] epochs=84 lr=3.888e-04 wd=5.795e-06 n_pcs=4500 weight={'name': 'uniform'}
[I 2026-06-01 12:57:06,171] Trial 81 finished with value: 0.20797270886493718 and parameters: {'hidden_dims': '[1024, 256]', 'dropout': 0.32169280636647835, 'batch_norm': False, 'lr': 0.00038878500320037475, 'weight_decay': 5.795434595847097e-06, 'epochs': 84, 'loss': 'mse', 'optimizer': 'adamw', 'use_snp_selection': False, 'n_pcs': 4500}. Best is trial 75 with value: 0.23382104046159724.
2026-06-01 12:57:06 | INFO | Trial 82 | outer=5 | hidden=[1024, 256] epochs=67 lr=4.390e-04 wd=2.987e-06 n_pcs=4500 weight={'name': 'uniform'}
[I 2026-06-01 12:57:14,485] Trial 82 finished with value: 0.22304829227653128 and parameters: {'hidden_dims': '[1024, 256]', 'dropout': 0.38079960221077414, 'batch_norm': False, 'lr': 0.00043904973651591407, 'weight_decay': 2.987460016644406e-06, 'epochs': 67, 'loss': 'mse', 'optimizer': 'adamw', 'use_snp_selection': False, 'n_pcs': 4500}. Best is trial 75 with value: 0.23382104046159724.
2026-06-01 12:57:14 | INFO | Trial 83 | outer=5 | hidden=[1024, 256] epochs=266 lr=3.558e-04 wd=5.093e-06 n_pcs=4000 weight={'name': 'uniform'}
[I 2026-06-01 12:57:36,798] Trial 83 finished with value: 0.21533122627326845 and parameters: {'hidden_dims': '[1024, 256]', 'dropout': 0.18908936894297002, 'batch_norm': False, 'lr': 0.0003557847059811051, 'weight_decay': 5.092721832160695e-06, 'epochs': 266, 'loss': 'mse', 'optimizer': 'adamw', 'use_snp_selection': False, 'n_pcs': 4000}. Best is trial 75 with value: 0.23382104046159724.
2026-06-01 12:57:36 | INFO | Trial 84 | outer=5 | hidden=[1024, 256] epochs=63 lr=2.992e-04 wd=1.008e-06 n_pcs=4500 weight={'name': 'uniform'}
[I 2026-06-01 12:57:44,566] Trial 84 finished with value: 0.21453537576703546 and parameters: {'hidden_dims': '[1024, 256]', 'dropout': 0.24302494918608336, 'batch_norm': False, 'lr': 0.00029921254201938026, 'weight_decay': 1.0080758713399208e-06, 'epochs': 63, 'loss': 'mse', 'optimizer': 'adamw', 'use_snp_selection': False, 'n_pcs': 4500}. Best is trial 75 with value: 0.23382104046159724.
2026-06-01 12:57:44 | INFO | Trial 85 | outer=5 | hidden=[1024, 256] epochs=77 lr=4.360e-04 wd=8.946e-06 n_pcs=5000 weight={'name': 'uniform'}
[I 2026-06-01 12:57:54,020] Trial 85 finished with value: 0.2145284861954359 and parameters: {'hidden_dims': '[1024, 256]', 'dropout': 0.26788334959036014, 'batch_norm': False, 'lr': 0.00043598899294048927, 'weight_decay': 8.946227385934706e-06, 'epochs': 77, 'loss': 'mse', 'optimizer': 'adamw', 'use_snp_selection': False, 'n_pcs': 5000}. Best is trial 75 with value: 0.23382104046159724.
2026-06-01 12:57:54 | INFO | Trial 86 | outer=5 | hidden=[512, 128] epochs=93 lr=1.820e-04 wd=2.229e-07 n_pcs=4500 weight={'name': 'uniform'}
[I 2026-06-01 12:58:00,187] Trial 86 finished with value: 0.2121180198256062 and parameters: {'hidden_dims': '[512, 128]', 'dropout': 0.16491501461909275, 'batch_norm': False, 'lr': 0.00018204090457829718, 'weight_decay': 2.2290384744387353e-07, 'epochs': 93, 'loss': 'mse', 'optimizer': 'adamw', 'use_snp_selection': False, 'n_pcs': 4500}. Best is trial 75 with value: 0.23382104046159724.
2026-06-01 12:58:00 | INFO | Trial 87 | outer=5 | hidden=[1024, 256] epochs=107 lr=6.346e-05 wd=2.181e-06 n_pcs=4000 weight={'name': 'uniform'}
[I 2026-06-01 12:58:06,387] Trial 87 pruned. 
2026-06-01 12:58:06 | INFO | Trial 88 | outer=5 | hidden=[1024, 256] epochs=100 lr=3.211e-04 wd=2.876e-05 n_pcs=5000 weight={'name': 'uniform'}
[I 2026-06-01 12:58:17,842] Trial 88 finished with value: 0.20447048766826512 and parameters: {'hidden_dims': '[1024, 256]', 'dropout': 0.3050952865111203, 'batch_norm': False, 'lr': 0.0003211023695439836, 'weight_decay': 2.876425383976608e-05, 'epochs': 100, 'loss': 'mse', 'optimizer': 'adamw', 'use_snp_selection': False, 'n_pcs': 5000}. Best is trial 75 with value: 0.23382104046159724.
2026-06-01 12:58:17 | INFO | Trial 89 | outer=5 | hidden=[1024, 256] epochs=73 lr=3.882e-04 wd=7.082e-06 n_pcs=4500 weight={'name': 'uniform'}
[I 2026-06-01 12:58:26,376] Trial 89 finished with value: 0.2150409962848443 and parameters: {'hidden_dims': '[1024, 256]', 'dropout': 0.13097300057984632, 'batch_norm': False, 'lr': 0.0003882162919927856, 'weight_decay': 7.081912697870515e-06, 'epochs': 73, 'loss': 'mse', 'optimizer': 'adamw', 'use_snp_selection': False, 'n_pcs': 4500}. Best is trial 75 with value: 0.23382104046159724.
2026-06-01 12:58:26 | INFO | Trial 90 | outer=5 | hidden=[1024, 256] epochs=147 lr=4.542e-05 wd=1.654e-05 n_pcs=4500 weight={'name': 'uniform'}
[I 2026-06-01 12:58:41,318] Trial 90 finished with value: 0.1801065276339428 and parameters: {'hidden_dims': '[1024, 256]', 'dropout': 0.19280820123959388, 'batch_norm': False, 'lr': 4.541766584777821e-05, 'weight_decay': 1.654036957423359e-05, 'epochs': 147, 'loss': 'mse', 'optimizer': 'adamw', 'use_snp_selection': False, 'n_pcs': 4500}. Best is trial 75 with value: 0.23382104046159724.
2026-06-01 12:58:41 | INFO | Trial 91 | outer=5 | hidden=[1024, 256] epochs=112 lr=4.363e-04 wd=5.393e-07 n_pcs=5000 weight={'name': 'uniform'}
[I 2026-06-01 12:58:54,464] Trial 91 finished with value: 0.23662448930322574 and parameters: {'hidden_dims': '[1024, 256]', 'dropout': 0.08759244213783275, 'batch_norm': False, 'lr': 0.00043627604050766497, 'weight_decay': 5.393468384010982e-07, 'epochs': 112, 'loss': 'mse', 'optimizer': 'adamw', 'use_snp_selection': False, 'n_pcs': 5000}. Best is trial 91 with value: 0.23662448930322574.
2026-06-01 12:58:54 | INFO | Trial 92 | outer=5 | hidden=[1024, 256] epochs=120 lr=4.603e-04 wd=6.082e-07 n_pcs=5000 weight={'name': 'uniform'}
[I 2026-06-01 12:59:07,729] Trial 92 finished with value: 0.21593382352301296 and parameters: {'hidden_dims': '[1024, 256]', 'dropout': 0.08353891647448652, 'batch_norm': False, 'lr': 0.00046029124723189277, 'weight_decay': 6.082066966501448e-07, 'epochs': 120, 'loss': 'mse', 'optimizer': 'adamw', 'use_snp_selection': False, 'n_pcs': 5000}. Best is trial 91 with value: 0.23662448930322574.
2026-06-01 12:59:07 | INFO | Trial 93 | outer=5 | hidden=[1024, 256] epochs=111 lr=3.517e-04 wd=3.173e-06 n_pcs=5000 weight={'name': 'uniform'}
[I 2026-06-01 12:59:20,185] Trial 93 finished with value: 0.21686808127727514 and parameters: {'hidden_dims': '[1024, 256]', 'dropout': 0.14254456664593945, 'batch_norm': False, 'lr': 0.0003517169687442011, 'weight_decay': 3.1731207564403196e-06, 'epochs': 111, 'loss': 'mse', 'optimizer': 'adamw', 'use_snp_selection': False, 'n_pcs': 5000}. Best is trial 91 with value: 0.23662448930322574.
2026-06-01 12:59:20 | INFO | Trial 94 | outer=5 | hidden=[1024, 256] epochs=130 lr=4.093e-04 wd=3.208e-07 n_pcs=5000 weight={'name': 'uniform'}
[I 2026-06-01 12:59:34,452] Trial 94 finished with value: 0.21788921549067672 and parameters: {'hidden_dims': '[1024, 256]', 'dropout': 0.09739748965648086, 'batch_norm': False, 'lr': 0.00040930941734998173, 'weight_decay': 3.2080370412366867e-07, 'epochs': 130, 'loss': 'mse', 'optimizer': 'adamw', 'use_snp_selection': False, 'n_pcs': 5000}. Best is trial 91 with value: 0.23662448930322574.
2026-06-01 12:59:34 | INFO | Trial 95 | outer=5 | hidden=[512, 128] epochs=84 lr=2.889e-04 wd=1.667e-07 n_pcs=4500 weight={'name': 'uniform'}
[I 2026-06-01 12:59:40,262] Trial 95 finished with value: 0.21526354724760824 and parameters: {'hidden_dims': '[512, 128]', 'dropout': 0.22744037983180546, 'batch_norm': False, 'lr': 0.00028886172863879146, 'weight_decay': 1.6666885787317623e-07, 'epochs': 84, 'loss': 'mse', 'optimizer': 'adamw', 'use_snp_selection': False, 'n_pcs': 4500}. Best is trial 91 with value: 0.23662448930322574.
2026-06-01 12:59:40 | INFO | Trial 96 | outer=5 | hidden=[1024, 256] epochs=97 lr=4.608e-04 wd=1.749e-06 n_pcs=3000 weight={'name': 'uniform'}
[I 2026-06-01 12:59:48,159] Trial 96 finished with value: 0.20216341264007404 and parameters: {'hidden_dims': '[1024, 256]', 'dropout': 0.05319036798420626, 'batch_norm': False, 'lr': 0.000460834938106855, 'weight_decay': 1.7488178828008666e-06, 'epochs': 97, 'loss': 'mse', 'optimizer': 'adam', 'use_snp_selection': False, 'n_pcs': 3000}. Best is trial 91 with value: 0.23662448930322574.
2026-06-01 12:59:48 | INFO | Trial 97 | outer=5 | hidden=[256, 128] epochs=54 lr=3.712e-04 wd=8.245e-07 n_pcs=4500 weight={'name': 'uniform'}
[I 2026-06-01 12:59:51,547] Trial 97 finished with value: 0.20288258535167442 and parameters: {'hidden_dims': '[256, 128]', 'dropout': 0.1311341939243023, 'batch_norm': False, 'lr': 0.0003712141197447332, 'weight_decay': 8.244992095103723e-07, 'epochs': 54, 'loss': 'mae', 'optimizer': 'adamw', 'use_snp_selection': False, 'n_pcs': 4500}. Best is trial 91 with value: 0.23662448930322574.
2026-06-01 12:59:51 | INFO | Trial 98 | outer=5 | hidden=[1024, 256] epochs=89 lr=1.849e-05 wd=3.985e-06 n_pcs=5000 weight={'name': 'uniform'}
[I 2026-06-01 12:59:57,781] Trial 98 pruned. 
2026-06-01 12:59:57 | INFO | Trial 99 | outer=5 | hidden=[512, 64] epochs=102 lr=8.472e-05 wd=9.495e-08 n_pcs=4000 weight={'name': 'uniform'}
[I 2026-06-01 13:00:03,709] Trial 99 finished with value: 0.2108718917484274 and parameters: {'hidden_dims': '[512, 64]', 'dropout': 0.15674012577991764, 'batch_norm': False, 'lr': 8.471883473418573e-05, 'weight_decay': 9.49547536615846e-08, 'epochs': 102, 'loss': 'mse', 'optimizer': 'adamw', 'use_snp_selection': False, 'n_pcs': 4000}. Best is trial 91 with value: 0.23662448930322574.
2026-06-01 13:00:03 | INFO | Trial 100 | outer=5 | hidden=[1024, 256] epochs=201 lr=4.989e-04 wd=1.284e-06 n_pcs=4500 weight={'name': 'uniform'}
[I 2026-06-01 13:00:23,066] Trial 100 finished with value: 0.2235539438456863 and parameters: {'hidden_dims': '[1024, 256]', 'dropout': 0.41891398709588246, 'batch_norm': False, 'lr': 0.0004988639036876011, 'weight_decay': 1.2841758583838404e-06, 'epochs': 201, 'loss': 'mse', 'optimizer': 'adamw', 'use_snp_selection': False, 'n_pcs': 4500}. Best is trial 91 with value: 0.23662448930322574.
2026-06-01 13:00:23 | INFO | Trial 101 | outer=5 | hidden=[1024, 256] epochs=113 lr=4.493e-04 wd=6.736e-07 n_pcs=5000 weight={'name': 'uniform'}
[I 2026-06-01 13:00:35,693] Trial 101 finished with value: 0.22547458122236863 and parameters: {'hidden_dims': '[1024, 256]', 'dropout': 0.10519387813434533, 'batch_norm': False, 'lr': 0.0004492912656132936, 'weight_decay': 6.735727844997233e-07, 'epochs': 113, 'loss': 'mse', 'optimizer': 'adamw', 'use_snp_selection': False, 'n_pcs': 5000}. Best is trial 91 with value: 0.23662448930322574.
2026-06-01 13:00:35 | INFO | Trial 102 | outer=5 | hidden=[1024, 256] epochs=122 lr=4.070e-04 wd=7.153e-07 n_pcs=5000 weight={'name': 'uniform'}
