[I 2026-06-01 12:14:14,629] Trial 129 finished with value: 0.1846263894650776 and parameters: {'hidden_dims': '[256, 64]', 'dropout': 0.5798424664269843, 'batch_norm': False, 'lr': 0.00011053900035385599, 'weight_decay': 0.0003166087972876862, 'epochs': 234, 'loss': 'mse', 'optimizer': 'adam', 'use_snp_selection': False, 'n_pcs': 2000}. Best is trial 64 with value: 0.19082431425353114.
2026-06-01 12:14:14 | INFO | Trial 130 | outer=3 | hidden=[256, 64] epochs=235 lr=1.114e-04 wd=2.976e-04 n_pcs=500 weight={'name': 'uniform'}
[I 2026-06-01 12:14:18,789] Trial 130 finished with value: 0.15844427857927837 and parameters: {'hidden_dims': '[256, 64]', 'dropout': 0.5857367324436344, 'batch_norm': False, 'lr': 0.00011143563152247729, 'weight_decay': 0.00029761074046750233, 'epochs': 235, 'loss': 'mse', 'optimizer': 'adamw', 'use_snp_selection': False, 'n_pcs': 500}. Best is trial 64 with value: 0.19082431425353114.
2026-06-01 12:14:18 | INFO | Trial 131 | outer=3 | hidden=[256, 64] epochs=215 lr=4.656e-05 wd=5.930e-04 n_pcs=2000 weight={'name': 'uniform'}
[I 2026-06-01 12:14:23,246] Trial 131 finished with value: 0.15496696906840923 and parameters: {'hidden_dims': '[256, 64]', 'dropout': 0.5600364159735057, 'batch_norm': False, 'lr': 4.655923916232471e-05, 'weight_decay': 0.0005929746138211316, 'epochs': 215, 'loss': 'mse', 'optimizer': 'adam', 'use_snp_selection': False, 'n_pcs': 2000}. Best is trial 64 with value: 0.19082431425353114.
2026-06-01 12:14:23 | INFO | Trial 132 | outer=3 | hidden=[256, 64] epochs=245 lr=6.403e-05 wd=7.600e-04 n_pcs=2000 weight={'name': 'uniform'}
[I 2026-06-01 12:14:28,087] Trial 132 finished with value: 0.1727760135766482 and parameters: {'hidden_dims': '[256, 64]', 'dropout': 0.5730435815974324, 'batch_norm': False, 'lr': 6.402517889456208e-05, 'weight_decay': 0.0007599663149647106, 'epochs': 245, 'loss': 'mse', 'optimizer': 'adam', 'use_snp_selection': False, 'n_pcs': 2000}. Best is trial 64 with value: 0.19082431425353114.
2026-06-01 12:14:28 | INFO | Trial 133 | outer=3 | hidden=[256, 64] epochs=221 lr=9.124e-05 wd=3.021e-04 n_pcs=2500 weight={'name': 'uniform'}
[I 2026-06-01 12:14:33,153] Trial 133 finished with value: 0.16554173531243727 and parameters: {'hidden_dims': '[256, 64]', 'dropout': 0.5841699540329433, 'batch_norm': False, 'lr': 9.123980447017339e-05, 'weight_decay': 0.00030210281591071746, 'epochs': 221, 'loss': 'mse', 'optimizer': 'adam', 'use_snp_selection': False, 'n_pcs': 2500}. Best is trial 64 with value: 0.19082431425353114.
2026-06-01 12:14:33 | INFO | Trial 134 | outer=3 | hidden=[128, 64] epochs=233 lr=1.392e-04 wd=3.463e-04 n_pcs=2000 weight={'name': 'uniform'}
[I 2026-06-01 12:14:36,222] Trial 134 pruned. 
2026-06-01 12:14:36 | INFO | Trial 135 | outer=3 | hidden=[256, 64] epochs=179 lr=1.238e-04 wd=2.920e-08 n_pcs=2000 weight={'name': 'uniform'}
[I 2026-06-01 12:14:40,215] Trial 135 finished with value: 0.1886189031721353 and parameters: {'hidden_dims': '[256, 64]', 'dropout': 0.5527199185258272, 'batch_norm': False, 'lr': 0.00012383898831657263, 'weight_decay': 2.9195116523683253e-08, 'epochs': 179, 'loss': 'mae', 'optimizer': 'adam', 'use_snp_selection': False, 'n_pcs': 2000}. Best is trial 64 with value: 0.19082431425353114.
2026-06-01 12:14:40 | INFO | Trial 136 | outer=3 | hidden=[256, 64] epochs=201 lr=1.197e-04 wd=5.871e-08 n_pcs=2500 weight={'name': 'uniform'}
[I 2026-06-01 12:14:44,985] Trial 136 finished with value: 0.16127968805300988 and parameters: {'hidden_dims': '[256, 64]', 'dropout': 0.5525887539532254, 'batch_norm': False, 'lr': 0.00011968511412427824, 'weight_decay': 5.870940222507499e-08, 'epochs': 201, 'loss': 'mse', 'optimizer': 'adam', 'use_snp_selection': False, 'n_pcs': 2500}. Best is trial 64 with value: 0.19082431425353114.
2026-06-01 12:14:45 | INFO | Trial 137 | outer=3 | hidden=[256, 64] epochs=182 lr=1.521e-04 wd=3.160e-08 n_pcs=3000 weight={'name': 'uniform'}
[I 2026-06-01 12:14:49,983] Trial 137 finished with value: 0.16002692858708406 and parameters: {'hidden_dims': '[256, 64]', 'dropout': 0.5253936580728797, 'batch_norm': False, 'lr': 0.00015208855329600847, 'weight_decay': 3.159668614043445e-08, 'epochs': 182, 'loss': 'mae', 'optimizer': 'adam', 'use_snp_selection': False, 'n_pcs': 3000}. Best is trial 64 with value: 0.19082431425353114.
2026-06-01 12:14:50 | INFO | Trial 138 | outer=3 | hidden=[256, 64] epochs=113 lr=1.313e-04 wd=3.702e-04 n_pcs=1500 weight={'name': 'uniform'}
[I 2026-06-01 12:14:52,921] Trial 138 finished with value: 0.13550358165468393 and parameters: {'hidden_dims': '[256, 64]', 'dropout': 0.5680431538298388, 'batch_norm': False, 'lr': 0.00013126032467150852, 'weight_decay': 0.0003701599112228581, 'epochs': 113, 'loss': 'mae', 'optimizer': 'adam', 'use_snp_selection': False, 'n_pcs': 1500}. Best is trial 64 with value: 0.19082431425353114.
2026-06-01 12:14:52 | INFO | Trial 139 | outer=3 | hidden=[256, 64] epochs=161 lr=1.680e-04 wd=4.414e-07 n_pcs=2000 weight={'name': 'uniform'}
[I 2026-06-01 12:14:56,683] Trial 139 finished with value: 0.18059737012305313 and parameters: {'hidden_dims': '[256, 64]', 'dropout': 0.5393552807231465, 'batch_norm': False, 'lr': 0.0001680215031029423, 'weight_decay': 4.413783614320802e-07, 'epochs': 161, 'loss': 'mae', 'optimizer': 'adam', 'use_snp_selection': False, 'n_pcs': 2000}. Best is trial 64 with value: 0.19082431425353114.
2026-06-01 12:14:56 | INFO | Trial 140 | outer=3 | hidden=[256, 64] epochs=165 lr=2.224e-04 wd=4.231e-07 n_pcs=2000 weight={'name': 'uniform'}
[I 2026-06-01 12:15:00,495] Trial 140 finished with value: 0.19221872234365853 and parameters: {'hidden_dims': '[256, 64]', 'dropout': 0.5987891159726259, 'batch_norm': False, 'lr': 0.00022235953945691145, 'weight_decay': 4.230770444086667e-07, 'epochs': 165, 'loss': 'mae', 'optimizer': 'adam', 'use_snp_selection': False, 'n_pcs': 2000}. Best is trial 140 with value: 0.19221872234365853.
2026-06-01 12:15:00 | INFO | Trial 141 | outer=3 | hidden=[256, 64] epochs=161 lr=2.180e-04 wd=4.495e-07 n_pcs=2000 weight={'name': 'uniform'}
[I 2026-06-01 12:15:04,256] Trial 141 finished with value: 0.18586005603343791 and parameters: {'hidden_dims': '[256, 64]', 'dropout': 0.5993303380809026, 'batch_norm': False, 'lr': 0.00021798729614527787, 'weight_decay': 4.495052375880191e-07, 'epochs': 161, 'loss': 'mae', 'optimizer': 'adam', 'use_snp_selection': False, 'n_pcs': 2000}. Best is trial 140 with value: 0.19221872234365853.
2026-06-01 12:15:04 | INFO | Trial 142 | outer=3 | hidden=[256, 64] epochs=166 lr=2.172e-04 wd=3.266e-07 n_pcs=2000 weight={'name': 'uniform'}
[I 2026-06-01 12:15:08,078] Trial 142 finished with value: 0.17043274683803983 and parameters: {'hidden_dims': '[256, 64]', 'dropout': 0.5916365578243805, 'batch_norm': False, 'lr': 0.0002171676290979082, 'weight_decay': 3.2659973311408095e-07, 'epochs': 166, 'loss': 'mae', 'optimizer': 'adam', 'use_snp_selection': False, 'n_pcs': 2000}. Best is trial 140 with value: 0.19221872234365853.
2026-06-01 12:15:08 | INFO | Trial 143 | outer=3 | hidden=[256, 64] epochs=162 lr=2.666e-04 wd=5.889e-07 n_pcs=2000 weight={'name': 'uniform'}
[I 2026-06-01 12:15:11,855] Trial 143 finished with value: 0.18473823116429203 and parameters: {'hidden_dims': '[256, 64]', 'dropout': 0.5982006464455509, 'batch_norm': False, 'lr': 0.00026655760964442116, 'weight_decay': 5.889491849253508e-07, 'epochs': 162, 'loss': 'mae', 'optimizer': 'adam', 'use_snp_selection': False, 'n_pcs': 2000}. Best is trial 140 with value: 0.19221872234365853.
2026-06-01 12:15:11 | INFO | Trial 144 | outer=3 | hidden=[256, 64] epochs=161 lr=2.328e-04 wd=6.089e-07 n_pcs=2000 weight={'name': 'uniform'}
[I 2026-06-01 12:15:15,617] Trial 144 finished with value: 0.1723164840939524 and parameters: {'hidden_dims': '[256, 64]', 'dropout': 0.59958657198644, 'batch_norm': False, 'lr': 0.00023282510739396214, 'weight_decay': 6.088526215569169e-07, 'epochs': 161, 'loss': 'mae', 'optimizer': 'adam', 'use_snp_selection': False, 'n_pcs': 2000}. Best is trial 140 with value: 0.19221872234365853.
2026-06-01 12:15:15 | INFO | Trial 145 | outer=3 | hidden=[256, 64] epochs=151 lr=2.685e-04 wd=8.600e-07 n_pcs=2000 weight={'name': 'uniform'}
[I 2026-06-01 12:15:19,253] Trial 145 finished with value: 0.18052109390872137 and parameters: {'hidden_dims': '[256, 64]', 'dropout': 0.5733170797235628, 'batch_norm': False, 'lr': 0.00026854852859219434, 'weight_decay': 8.599635729054999e-07, 'epochs': 151, 'loss': 'mae', 'optimizer': 'adam', 'use_snp_selection': False, 'n_pcs': 2000}. Best is trial 140 with value: 0.19221872234365853.
2026-06-01 12:15:19 | INFO | Trial 146 | outer=3 | hidden=[256, 64] epochs=176 lr=2.474e-04 wd=4.764e-07 n_pcs=2000 weight={'name': 'uniform'}
[I 2026-06-01 12:15:23,203] Trial 146 finished with value: 0.19302575348722367 and parameters: {'hidden_dims': '[256, 64]', 'dropout': 0.5999552092177828, 'batch_norm': False, 'lr': 0.0002474130700768401, 'weight_decay': 4.763921434206109e-07, 'epochs': 176, 'loss': 'mae', 'optimizer': 'adam', 'use_snp_selection': False, 'n_pcs': 2000}. Best is trial 146 with value: 0.19302575348722367.
2026-06-01 12:15:23 | INFO | Trial 147 | outer=3 | hidden=[256, 64] epochs=176 lr=3.130e-04 wd=3.955e-07 n_pcs=2000 weight={'name': 'uniform'}
[I 2026-06-01 12:15:27,154] Trial 147 finished with value: 0.182431088338002 and parameters: {'hidden_dims': '[256, 64]', 'dropout': 0.582616481196827, 'batch_norm': False, 'lr': 0.0003130316995936737, 'weight_decay': 3.955181080553091e-07, 'epochs': 176, 'loss': 'mae', 'optimizer': 'adam', 'use_snp_selection': False, 'n_pcs': 2000}. Best is trial 146 with value: 0.19302575348722367.
2026-06-01 12:15:27 | INFO | Trial 148 | outer=3 | hidden=[256, 64] epochs=174 lr=3.028e-04 wd=1.117e-06 n_pcs=2000 weight={'name': 'uniform'}
[I 2026-06-01 12:15:31,081] Trial 148 finished with value: 0.18898741412830006 and parameters: {'hidden_dims': '[256, 64]', 'dropout': 0.5835693398181455, 'batch_norm': False, 'lr': 0.00030282721439316666, 'weight_decay': 1.1169417707755014e-06, 'epochs': 174, 'loss': 'mae', 'optimizer': 'adam', 'use_snp_selection': False, 'n_pcs': 2000}. Best is trial 146 with value: 0.19302575348722367.
2026-06-01 12:15:31 | INFO | Trial 149 | outer=3 | hidden=[256, 64] epochs=177 lr=3.187e-04 wd=2.107e-06 n_pcs=2000 weight={'name': 'uniform'}
[I 2026-06-01 12:15:35,049] Trial 149 finished with value: 0.17981957665169138 and parameters: {'hidden_dims': '[256, 64]', 'dropout': 0.5997570232602626, 'batch_norm': False, 'lr': 0.0003186854974508156, 'weight_decay': 2.1070868158444608e-06, 'epochs': 177, 'loss': 'mae', 'optimizer': 'adam', 'use_snp_selection': False, 'n_pcs': 2000}. Best is trial 146 with value: 0.19302575348722367.
2026-06-01 12:15:35 | INFO | OUTER 3 best (inner mean r=0.1930): model={'hidden_dims': [256, 64], 'dropout': 0.5999552092177828, 'batch_norm': False, 'lr': 0.0002474130700768401, 'weight_decay': 4.763921434206109e-07, 'epochs': 176, 'loss': 'mae', 'optimizer': 'adam', 'use_snp_selection': False, 'n_pcs': 2000} weighting={'name': 'uniform'}
2026-06-01 12:15:35 | INFO | OUTER 3 TEST r = 0.2143
2026-06-01 12:15:35 | INFO | OUTER 3 incremental summary saved to outputs/final_results/e8_pc_mlp_uniform/thr_wing/e8_pc_mlp_uniform_thr_wing_results.json
2026-06-01 12:15:35 | INFO | OUTER 4: test_size=191 island=3 (Selvær)
2026-06-01 12:15:35 | INFO | OUTER 4: inner LOIO validation islands: 0(Nesøy), 1(Myken), 2(Træna), 4(Gjerøy), 5(Hestmannøy), 6(Indre Kvarøy), 7(Onøy og Lurøy), 8(Lovund), 9(Sleneset), 10(Aldra), 11(Leka), 12(Vega), 13(Vikna), 14(Lauvøya)
2026-06-01 12:15:35 | INFO | OUTER 4: using top 10 related inner validation islands for tuning: 1(Myken, avgGRM=0.0212), 2(Træna, avgGRM=0.0194), 8(Lovund, avgGRM=0.0087), 9(Sleneset, avgGRM=0.0056), 0(Nesøy, avgGRM=0.0033), 7(Onøy og Lurøy, avgGRM=0.0018), 6(Indre Kvarøy, avgGRM=0.0005), 5(Hestmannøy, avgGRM=-0.0000), 4(Gjerøy, avgGRM=-0.0013), 12(Vega, avgGRM=-0.0030)
[I 2026-06-01 12:15:35,581] A new study created in memory with name: mlp_importance_inner_outer3
2026-06-01 12:15:35 | INFO | Trial 0 | outer=4 | hidden=[256, 64] epochs=252 lr=8.243e-05 wd=1.277e-07 n_pcs=1500 weight={'name': 'uniform'}
[I 2026-06-01 12:15:40,123] Trial 0 finished with value: 0.1525272490104207 and parameters: {'hidden_dims': '[256, 64]', 'dropout': 0.19097065492325918, 'batch_norm': False, 'lr': 8.242985198911028e-05, 'weight_decay': 1.277246473139888e-07, 'epochs': 252, 'loss': 'mae', 'optimizer': 'adamw', 'use_snp_selection': False, 'n_pcs': 1500}. Best is trial 0 with value: 0.1525272490104207.
2026-06-01 12:15:40 | INFO | Trial 1 | outer=4 | hidden=[1024, 256] epochs=225 lr=1.391e-04 wd=1.941e-07 n_pcs=500 weight={'name': 'uniform'}
[I 2026-06-01 12:15:46,573] Trial 1 finished with value: 0.14473130896315578 and parameters: {'hidden_dims': '[1024, 256]', 'dropout': 0.2849434595702811, 'batch_norm': False, 'lr': 0.00013909108684683413, 'weight_decay': 1.9407167964924495e-07, 'epochs': 225, 'loss': 'mse', 'optimizer': 'adamw', 'use_snp_selection': False, 'n_pcs': 500}. Best is trial 0 with value: 0.1525272490104207.
2026-06-01 12:15:46 | INFO | Trial 2 | outer=4 | hidden=[256, 64] epochs=139 lr=3.957e-05 wd=3.750e-05 n_pcs=2500 weight={'name': 'uniform'}
[I 2026-06-01 12:15:50,443] Trial 2 finished with value: 0.11909810715693463 and parameters: {'hidden_dims': '[256, 64]', 'dropout': 0.11392712587675291, 'batch_norm': False, 'lr': 3.9573351157697276e-05, 'weight_decay': 3.7502337000845044e-05, 'epochs': 139, 'loss': 'mae', 'optimizer': 'adam', 'use_snp_selection': False, 'n_pcs': 2500}. Best is trial 0 with value: 0.1525272490104207.
2026-06-01 12:15:50 | INFO | Trial 3 | outer=4 | hidden=[128, 64] epochs=164 lr=1.538e-05 wd=3.248e-06 n_pcs=3000 weight={'name': 'uniform'}
[I 2026-06-01 12:15:54,218] Trial 3 finished with value: 0.020859266146338373 and parameters: {'hidden_dims': '[128, 64]', 'dropout': 0.1479874991503876, 'batch_norm': False, 'lr': 1.5380732370316375e-05, 'weight_decay': 3.2478890969962294e-06, 'epochs': 164, 'loss': 'mse', 'optimizer': 'adam', 'use_snp_selection': False, 'n_pcs': 3000}. Best is trial 0 with value: 0.1525272490104207.
2026-06-01 12:15:54 | INFO | Trial 4 | outer=4 | hidden=[256, 128] epochs=210 lr=7.298e-05 wd=7.875e-06 n_pcs=3000 weight={'name': 'uniform'}
[I 2026-06-01 12:15:59,863] Trial 4 finished with value: 0.1452872972687604 and parameters: {'hidden_dims': '[256, 128]', 'dropout': 0.09917626474860408, 'batch_norm': False, 'lr': 7.298380589156323e-05, 'weight_decay': 7.875094299510188e-06, 'epochs': 210, 'loss': 'mae', 'optimizer': 'adam', 'use_snp_selection': False, 'n_pcs': 3000}. Best is trial 0 with value: 0.1525272490104207.
2026-06-01 12:15:59 | INFO | Trial 5 | outer=4 | hidden=[512, 128] epochs=284 lr=5.467e-05 wd=5.496e-06 n_pcs=4000 weight={'name': 'uniform'}
[I 2026-06-01 12:16:13,429] Trial 5 finished with value: 0.15953889078850952 and parameters: {'hidden_dims': '[512, 128]', 'dropout': 0.3143696126156032, 'batch_norm': False, 'lr': 5.46667545989349e-05, 'weight_decay': 5.496446859789657e-06, 'epochs': 284, 'loss': 'mse', 'optimizer': 'adamw', 'use_snp_selection': False, 'n_pcs': 4000}. Best is trial 5 with value: 0.15953889078850952.
2026-06-01 12:16:13 | INFO | Trial 6 | outer=4 | hidden=[512, 64] epochs=90 lr=3.103e-05 wd=6.607e-08 n_pcs=5000 weight={'name': 'uniform'}
[I 2026-06-01 12:16:17,966] Trial 6 pruned. 
2026-06-01 12:16:17 | INFO | Trial 7 | outer=4 | hidden=[128, 64] epochs=272 lr=1.348e-05 wd=1.075e-07 n_pcs=4000 weight={'name': 'uniform'}
[I 2026-06-01 12:16:21,224] Trial 7 pruned. 
2026-06-01 12:16:21 | INFO | Trial 8 | outer=4 | hidden=[128, 64] epochs=205 lr=1.815e-05 wd=5.764e-06 n_pcs=3000 weight={'name': 'uniform'}
[I 2026-06-01 12:16:23,760] Trial 8 pruned. 
2026-06-01 12:16:23 | INFO | Trial 9 | outer=4 | hidden=[128, 64] epochs=296 lr=2.338e-05 wd=1.066e-07 n_pcs=2500 weight={'name': 'uniform'}
[I 2026-06-01 12:16:26,909] Trial 9 pruned. 
2026-06-01 12:16:26 | INFO | Trial 10 | outer=4 | hidden=[512, 128] epochs=110 lr=3.984e-04 wd=9.453e-04 n_pcs=5000 weight={'name': 'uniform'}
[I 2026-06-01 12:16:34,469] Trial 10 finished with value: 0.1772959464330006 and parameters: {'hidden_dims': '[512, 128]', 'dropout': 0.5941683348553323, 'batch_norm': False, 'lr': 0.0003983594610602333, 'weight_decay': 0.0009452683165453212, 'epochs': 110, 'loss': 'mse', 'optimizer': 'adamw', 'use_snp_selection': False, 'n_pcs': 5000}. Best is trial 10 with value: 0.1772959464330006.
2026-06-01 12:16:34 | INFO | Trial 11 | outer=4 | hidden=[512, 128] epochs=55 lr=3.985e-04 wd=9.792e-04 n_pcs=5000 weight={'name': 'uniform'}
[I 2026-06-01 12:16:39,423] Trial 11 finished with value: 0.15226859872825707 and parameters: {'hidden_dims': '[512, 128]', 'dropout': 0.5588382083491101, 'batch_norm': False, 'lr': 0.00039850138867195595, 'weight_decay': 0.0009792126502143, 'epochs': 55, 'loss': 'mse', 'optimizer': 'adamw', 'use_snp_selection': False, 'n_pcs': 5000}. Best is trial 10 with value: 0.1772959464330006.
2026-06-01 12:16:39 | INFO | Trial 12 | outer=4 | hidden=[512, 128] epochs=117 lr=4.981e-04 wd=8.865e-04 n_pcs=4000 weight={'name': 'uniform'}
[I 2026-06-01 12:16:46,280] Trial 12 finished with value: 0.16099531414971405 and parameters: {'hidden_dims': '[512, 128]', 'dropout': 0.39928504380457036, 'batch_norm': False, 'lr': 0.000498069436842805, 'weight_decay': 0.0008865268327078721, 'epochs': 117, 'loss': 'mse', 'optimizer': 'adamw', 'use_snp_selection': False, 'n_pcs': 4000}. Best is trial 10 with value: 0.1772959464330006.
2026-06-01 12:16:46 | INFO | Trial 13 | outer=4 | hidden=[512, 128] epochs=118 lr=4.127e-04 wd=9.072e-04 n_pcs=4500 weight={'name': 'uniform'}
[I 2026-06-01 12:16:53,821] Trial 13 finished with value: 0.17090057878444348 and parameters: {'hidden_dims': '[512, 128]', 'dropout': 0.5956363832239465, 'batch_norm': False, 'lr': 0.00041268707845253474, 'weight_decay': 0.000907204068706384, 'epochs': 118, 'loss': 'mse', 'optimizer': 'adamw', 'use_snp_selection': False, 'n_pcs': 4500}. Best is trial 10 with value: 0.1772959464330006.
2026-06-01 12:16:53 | INFO | Trial 14 | outer=4 | hidden=[512, 256] epochs=103 lr=1.939e-04 wd=1.266e-04 n_pcs=4500 weight={'name': 'uniform'}
[I 2026-06-01 12:17:00,929] Trial 14 finished with value: 0.1604574413129719 and parameters: {'hidden_dims': '[512, 256]', 'dropout': 0.5584323202294728, 'batch_norm': False, 'lr': 0.0001938793963648549, 'weight_decay': 0.00012663736825721254, 'epochs': 103, 'loss': 'mse', 'optimizer': 'adamw', 'use_snp_selection': False, 'n_pcs': 4500}. Best is trial 10 with value: 0.1772959464330006.
2026-06-01 12:17:00 | INFO | Trial 15 | outer=4 | hidden=[512, 128] epochs=62 lr=2.582e-04 wd=9.571e-05 n_pcs=5000 weight={'name': 'uniform'}
[I 2026-06-01 12:17:06,208] Trial 15 finished with value: 0.1680014011302393 and parameters: {'hidden_dims': '[512, 128]', 'dropout': 0.4904988847628451, 'batch_norm': False, 'lr': 0.00025820463323916645, 'weight_decay': 9.571452484523231e-05, 'epochs': 62, 'loss': 'mse', 'optimizer': 'adamw', 'use_snp_selection': False, 'n_pcs': 5000}. Best is trial 10 with value: 0.1772959464330006.
2026-06-01 12:17:06 | INFO | Trial 16 | outer=4 | hidden=[512, 128] epochs=154 lr=2.911e-04 wd=2.205e-04 n_pcs=4500 weight={'name': 'uniform'}
[I 2026-06-01 12:17:15,342] Trial 16 finished with value: 0.18445004678898375 and parameters: {'hidden_dims': '[512, 128]', 'dropout': 0.5759757320181973, 'batch_norm': False, 'lr': 0.00029108486514309675, 'weight_decay': 0.0002205028157013437, 'epochs': 154, 'loss': 'mse', 'optimizer': 'adamw', 'use_snp_selection': False, 'n_pcs': 4500}. Best is trial 16 with value: 0.18445004678898375.
2026-06-01 12:17:15 | INFO | Trial 17 | outer=4 | hidden=[512, 256] epochs=158 lr=1.517e-04 wd=1.184e-08 n_pcs=3500 weight={'name': 'uniform'}
[I 2026-06-01 12:17:21,049] Trial 17 pruned. 
2026-06-01 12:17:21 | INFO | Trial 18 | outer=4 | hidden=[512, 64] epochs=191 lr=2.478e-04 wd=1.901e-04 n_pcs=1500 weight={'name': 'uniform'}
[I 2026-06-01 12:17:24,680] Trial 18 pruned. 
2026-06-01 12:17:24 | INFO | Trial 19 | outer=4 | hidden=[256, 128] epochs=147 lr=1.102e-04 wd=3.228e-05 n_pcs=4500 weight={'name': 'uniform'}
[I 2026-06-01 12:17:28,709] Trial 19 pruned. 
2026-06-01 12:17:28 | INFO | Trial 20 | outer=4 | hidden=[1024, 256] epochs=78 lr=2.753e-04 wd=2.998e-04 n_pcs=3500 weight={'name': 'uniform'}
[I 2026-06-01 12:17:34,142] Trial 20 pruned. 
2026-06-01 12:17:34 | INFO | Trial 21 | outer=4 | hidden=[512, 128] epochs=124 lr=3.733e-04 wd=5.491e-04 n_pcs=4500 weight={'name': 'uniform'}
[I 2026-06-01 12:17:41,930] Trial 21 finished with value: 0.1721734236830294 and parameters: {'hidden_dims': '[512, 128]', 'dropout': 0.5954722463543012, 'batch_norm': False, 'lr': 0.00037330291124492706, 'weight_decay': 0.0005491302820218394, 'epochs': 124, 'loss': 'mse', 'optimizer': 'adamw', 'use_snp_selection': False, 'n_pcs': 4500}. Best is trial 16 with value: 0.18445004678898375.
2026-06-01 12:17:41 | INFO | Trial 22 | outer=4 | hidden=[512, 128] epochs=129 lr=3.424e-04 wd=3.437e-04 n_pcs=4500 weight={'name': 'uniform'}
[I 2026-06-01 12:17:49,943] Trial 22 finished with value: 0.16323583836990907 and parameters: {'hidden_dims': '[512, 128]', 'dropout': 0.5312304389049058, 'batch_norm': False, 'lr': 0.0003424013114789092, 'weight_decay': 0.0003437073262595763, 'epochs': 129, 'loss': 'mse', 'optimizer': 'adamw', 'use_snp_selection': False, 'n_pcs': 4500}. Best is trial 16 with value: 0.18445004678898375.
2026-06-01 12:17:49 | INFO | Trial 23 | outer=4 | hidden=[512, 128] epochs=178 lr=2.118e-04 wd=4.791e-05 n_pcs=5000 weight={'name': 'uniform'}
