[I 2026-06-01 14:22:43,368] Trial 132 finished with value: 0.21699573472176867 and parameters: {'hidden_dims': '[512, 256]', 'dropout': 0.5532804218864201, 'batch_norm': False, 'lr': 0.00033040162828830823, 'weight_decay': 5.6735748183948056e-06, 'epochs': 62, 'loss': 'mae', 'optimizer': 'adamw', 'use_snp_selection': False, 'n_pcs': 1000}. Best is trial 95 with value: 0.23197170253801733.
2026-06-01 14:22:43 | INFO | Trial 133 | outer=9 | hidden=[512, 256] epochs=50 lr=3.326e-04 wd=5.256e-06 n_pcs=1000 weight={'name': 'uniform'}
[I 2026-06-01 14:22:45,896] Trial 133 finished with value: 0.19392138740694825 and parameters: {'hidden_dims': '[512, 256]', 'dropout': 0.5517799618796666, 'batch_norm': False, 'lr': 0.000332578360031015, 'weight_decay': 5.255615704764141e-06, 'epochs': 50, 'loss': 'mae', 'optimizer': 'adamw', 'use_snp_selection': False, 'n_pcs': 1000}. Best is trial 95 with value: 0.23197170253801733.
2026-06-01 14:22:45 | INFO | Trial 134 | outer=9 | hidden=[512, 256] epochs=62 lr=4.630e-04 wd=1.999e-05 n_pcs=1000 weight={'name': 'uniform'}
[I 2026-06-01 14:22:48,636] Trial 134 finished with value: 0.2223217983570577 and parameters: {'hidden_dims': '[512, 256]', 'dropout': 0.5287838896066606, 'batch_norm': False, 'lr': 0.00046295473498052177, 'weight_decay': 1.9994900805100273e-05, 'epochs': 62, 'loss': 'mae', 'optimizer': 'adamw', 'use_snp_selection': False, 'n_pcs': 1000}. Best is trial 95 with value: 0.23197170253801733.
2026-06-01 14:22:48 | INFO | Trial 135 | outer=9 | hidden=[512, 256] epochs=61 lr=4.639e-04 wd=2.032e-05 n_pcs=1000 weight={'name': 'uniform'}
[I 2026-06-01 14:22:51,355] Trial 135 finished with value: 0.20159124642041734 and parameters: {'hidden_dims': '[512, 256]', 'dropout': 0.5278614561726234, 'batch_norm': False, 'lr': 0.0004639199036985093, 'weight_decay': 2.0316510172163304e-05, 'epochs': 61, 'loss': 'mae', 'optimizer': 'adamw', 'use_snp_selection': False, 'n_pcs': 1000}. Best is trial 95 with value: 0.23197170253801733.
2026-06-01 14:22:51 | INFO | Trial 136 | outer=9 | hidden=[512, 256] epochs=64 lr=4.169e-04 wd=2.560e-05 n_pcs=1000 weight={'name': 'uniform'}
[I 2026-06-01 14:22:54,132] Trial 136 finished with value: 0.199689727858058 and parameters: {'hidden_dims': '[512, 256]', 'dropout': 0.5354596336395419, 'batch_norm': False, 'lr': 0.0004168709749603623, 'weight_decay': 2.5601739806554922e-05, 'epochs': 64, 'loss': 'mae', 'optimizer': 'adamw', 'use_snp_selection': False, 'n_pcs': 1000}. Best is trial 95 with value: 0.23197170253801733.
2026-06-01 14:22:54 | INFO | Trial 137 | outer=9 | hidden=[512, 256] epochs=84 lr=3.825e-04 wd=1.398e-05 n_pcs=500 weight={'name': 'uniform'}
[I 2026-06-01 14:22:56,818] Trial 137 finished with value: 0.1994056110082335 and parameters: {'hidden_dims': '[512, 256]', 'dropout': 0.510528883995125, 'batch_norm': False, 'lr': 0.00038248025256760126, 'weight_decay': 1.398177896050158e-05, 'epochs': 84, 'loss': 'mae', 'optimizer': 'adamw', 'use_snp_selection': False, 'n_pcs': 500}. Best is trial 95 with value: 0.23197170253801733.
2026-06-01 14:22:56 | INFO | Trial 138 | outer=9 | hidden=[512, 256] epochs=72 lr=3.128e-04 wd=5.152e-05 n_pcs=1500 weight={'name': 'uniform'}
[I 2026-06-01 14:23:00,133] Trial 138 finished with value: 0.19730380905720815 and parameters: {'hidden_dims': '[512, 256]', 'dropout': 0.555272532910354, 'batch_norm': False, 'lr': 0.0003127894695608527, 'weight_decay': 5.1524614558309675e-05, 'epochs': 72, 'loss': 'mae', 'optimizer': 'adam', 'use_snp_selection': False, 'n_pcs': 1500}. Best is trial 95 with value: 0.23197170253801733.
2026-06-01 14:23:00 | INFO | Trial 139 | outer=9 | hidden=[128, 64] epochs=57 lr=3.767e-04 wd=3.964e-06 n_pcs=1000 weight={'name': 'uniform'}
[I 2026-06-01 14:23:01,577] Trial 139 pruned. 
2026-06-01 14:23:01 | INFO | Trial 140 | outer=9 | hidden=[512, 256] epochs=67 lr=4.937e-04 wd=5.999e-06 n_pcs=1000 weight={'name': 'uniform'}
[I 2026-06-01 14:23:04,410] Trial 140 finished with value: 0.22800194085306963 and parameters: {'hidden_dims': '[512, 256]', 'dropout': 0.5913624123685629, 'batch_norm': False, 'lr': 0.0004936694754461951, 'weight_decay': 5.999442810095052e-06, 'epochs': 67, 'loss': 'mae', 'optimizer': 'adamw', 'use_snp_selection': False, 'n_pcs': 1000}. Best is trial 95 with value: 0.23197170253801733.
2026-06-01 14:23:04 | INFO | Trial 141 | outer=9 | hidden=[512, 256] epochs=67 lr=4.812e-04 wd=6.493e-06 n_pcs=1000 weight={'name': 'uniform'}
[I 2026-06-01 14:23:07,236] Trial 141 finished with value: 0.19836757527976126 and parameters: {'hidden_dims': '[512, 256]', 'dropout': 0.5993459433558304, 'batch_norm': False, 'lr': 0.00048123384831563114, 'weight_decay': 6.492904681873449e-06, 'epochs': 67, 'loss': 'mae', 'optimizer': 'adamw', 'use_snp_selection': False, 'n_pcs': 1000}. Best is trial 95 with value: 0.23197170253801733.
2026-06-01 14:23:07 | INFO | Trial 142 | outer=9 | hidden=[512, 256] epochs=61 lr=4.435e-04 wd=8.970e-06 n_pcs=1000 weight={'name': 'uniform'}
[I 2026-06-01 14:23:09,959] Trial 142 finished with value: 0.21290958711467925 and parameters: {'hidden_dims': '[512, 256]', 'dropout': 0.49258568550577536, 'batch_norm': False, 'lr': 0.0004435466479619245, 'weight_decay': 8.969914345997179e-06, 'epochs': 61, 'loss': 'mae', 'optimizer': 'adamw', 'use_snp_selection': False, 'n_pcs': 1000}. Best is trial 95 with value: 0.23197170253801733.
2026-06-01 14:23:09 | INFO | Trial 143 | outer=9 | hidden=[512, 256] epochs=76 lr=3.555e-04 wd=7.570e-06 n_pcs=1000 weight={'name': 'uniform'}
[I 2026-06-01 14:23:12,965] Trial 143 finished with value: 0.21144189871901217 and parameters: {'hidden_dims': '[512, 256]', 'dropout': 0.5432824448937089, 'batch_norm': False, 'lr': 0.0003555289156663504, 'weight_decay': 7.57048268237502e-06, 'epochs': 76, 'loss': 'mae', 'optimizer': 'adamw', 'use_snp_selection': False, 'n_pcs': 1000}. Best is trial 95 with value: 0.23197170253801733.
2026-06-01 14:23:12 | INFO | Trial 144 | outer=9 | hidden=[512, 256] epochs=55 lr=4.932e-04 wd=1.123e-05 n_pcs=1500 weight={'name': 'uniform'}
[I 2026-06-01 14:23:15,894] Trial 144 finished with value: 0.19521481069777058 and parameters: {'hidden_dims': '[512, 256]', 'dropout': 0.5851202625695022, 'batch_norm': False, 'lr': 0.0004932082370508128, 'weight_decay': 1.122572883138481e-05, 'epochs': 55, 'loss': 'mae', 'optimizer': 'adamw', 'use_snp_selection': False, 'n_pcs': 1500}. Best is trial 95 with value: 0.23197170253801733.
2026-06-01 14:23:15 | INFO | Trial 145 | outer=9 | hidden=[256, 64] epochs=65 lr=4.051e-04 wd=2.445e-06 n_pcs=1000 weight={'name': 'uniform'}
[I 2026-06-01 14:23:18,337] Trial 145 finished with value: 0.20051531648327248 and parameters: {'hidden_dims': '[256, 64]', 'dropout': 0.5695733545636497, 'batch_norm': False, 'lr': 0.00040513633010918625, 'weight_decay': 2.444893627314273e-06, 'epochs': 65, 'loss': 'mae', 'optimizer': 'adamw', 'use_snp_selection': False, 'n_pcs': 1000}. Best is trial 95 with value: 0.23197170253801733.
2026-06-01 14:23:18 | INFO | Trial 146 | outer=9 | hidden=[512, 256] epochs=71 lr=6.268e-05 wd=1.741e-05 n_pcs=1000 weight={'name': 'uniform'}
[I 2026-06-01 14:23:20,080] Trial 146 pruned. 
2026-06-01 14:23:20 | INFO | Trial 147 | outer=9 | hidden=[512, 256] epochs=50 lr=4.510e-04 wd=6.066e-06 n_pcs=500 weight={'name': 'uniform'}
[I 2026-06-01 14:23:21,423] Trial 147 pruned. 
2026-06-01 14:23:21 | INFO | Trial 148 | outer=9 | hidden=[256, 128] epochs=92 lr=3.345e-04 wd=3.114e-06 n_pcs=1000 weight={'name': 'uniform'}
[I 2026-06-01 14:23:24,210] Trial 148 finished with value: 0.20851410156294956 and parameters: {'hidden_dims': '[256, 128]', 'dropout': 0.4584559172354672, 'batch_norm': False, 'lr': 0.00033454274917486685, 'weight_decay': 3.1135650112816083e-06, 'epochs': 92, 'loss': 'mae', 'optimizer': 'adamw', 'use_snp_selection': False, 'n_pcs': 1000}. Best is trial 95 with value: 0.23197170253801733.
2026-06-01 14:23:24 | INFO | Trial 149 | outer=9 | hidden=[512, 256] epochs=59 lr=4.091e-04 wd=4.569e-06 n_pcs=1500 weight={'name': 'uniform'}
[I 2026-06-01 14:23:27,238] Trial 149 finished with value: 0.18258094699623356 and parameters: {'hidden_dims': '[512, 256]', 'dropout': 0.5140680715242382, 'batch_norm': False, 'lr': 0.00040910763089404016, 'weight_decay': 4.569377478262482e-06, 'epochs': 59, 'loss': 'mae', 'optimizer': 'adam', 'use_snp_selection': False, 'n_pcs': 1500}. Best is trial 95 with value: 0.23197170253801733.
2026-06-01 14:23:27 | INFO | OUTER 9 best (inner mean r=0.2320): model={'hidden_dims': [1024, 256], 'dropout': 0.33473705246437047, 'batch_norm': False, 'lr': 0.0002744553589107389, 'weight_decay': 7.486452812504172e-06, 'epochs': 50, 'loss': 'mae', 'optimizer': 'adamw', 'use_snp_selection': False, 'n_pcs': 1000} weighting={'name': 'uniform'}
2026-06-01 14:23:27 | INFO | OUTER 9 TEST r = 0.1366
2026-06-01 14:23:27 | INFO | OUTER 9 incremental summary saved to outputs/final_results/e8_pc_mlp_uniform/thr_wing/e8_pc_mlp_uniform_thr_wing_results.json
2026-06-01 14:23:27 | INFO | OUTER 10: test_size=160 island=9 (Sleneset)
2026-06-01 14:23:27 | INFO | OUTER 10: inner LOIO validation islands: 0(Nesøy), 1(Myken), 2(Træna), 3(Selvær), 4(Gjerøy), 5(Hestmannøy), 6(Indre Kvarøy), 7(Onøy og Lurøy), 8(Lovund), 10(Aldra), 11(Leka), 12(Vega), 13(Vikna), 14(Lauvøya)
2026-06-01 14:23:27 | INFO | OUTER 10: using top 10 related inner validation islands for tuning: 8(Lovund, avgGRM=0.0219), 7(Onøy og Lurøy, avgGRM=0.0092), 2(Træna, avgGRM=0.0084), 3(Selvær, avgGRM=0.0056), 1(Myken, avgGRM=0.0044), 6(Indre Kvarøy, avgGRM=0.0038), 0(Nesøy, avgGRM=0.0013), 5(Hestmannøy, avgGRM=-0.0009), 4(Gjerøy, avgGRM=-0.0024), 12(Vega, avgGRM=-0.0042)
[I 2026-06-01 14:23:27,829] A new study created in memory with name: mlp_importance_inner_outer9
2026-06-01 14:23:27 | INFO | Trial 0 | outer=10 | hidden=[256, 64] epochs=252 lr=8.243e-05 wd=1.277e-07 n_pcs=1500 weight={'name': 'uniform'}
[I 2026-06-01 14:23:32,702] Trial 0 finished with value: 0.1895113024948843 and parameters: {'hidden_dims': '[256, 64]', 'dropout': 0.19097065492325918, 'batch_norm': False, 'lr': 8.242985198911028e-05, 'weight_decay': 1.277246473139888e-07, 'epochs': 252, 'loss': 'mae', 'optimizer': 'adamw', 'use_snp_selection': False, 'n_pcs': 1500}. Best is trial 0 with value: 0.1895113024948843.
2026-06-01 14:23:32 | INFO | Trial 1 | outer=10 | hidden=[1024, 256] epochs=225 lr=1.391e-04 wd=1.941e-07 n_pcs=500 weight={'name': 'uniform'}
[I 2026-06-01 14:23:39,223] Trial 1 finished with value: 0.17322131935604648 and parameters: {'hidden_dims': '[1024, 256]', 'dropout': 0.2849434595702811, 'batch_norm': False, 'lr': 0.00013909108684683413, 'weight_decay': 1.9407167964924495e-07, 'epochs': 225, 'loss': 'mse', 'optimizer': 'adamw', 'use_snp_selection': False, 'n_pcs': 500}. Best is trial 0 with value: 0.1895113024948843.
2026-06-01 14:23:39 | INFO | Trial 2 | outer=10 | hidden=[256, 64] epochs=139 lr=3.957e-05 wd=3.750e-05 n_pcs=2500 weight={'name': 'uniform'}
[I 2026-06-01 14:23:43,144] Trial 2 finished with value: 0.1607075454550812 and parameters: {'hidden_dims': '[256, 64]', 'dropout': 0.11392712587675291, 'batch_norm': False, 'lr': 3.9573351157697276e-05, 'weight_decay': 3.7502337000845044e-05, 'epochs': 139, 'loss': 'mae', 'optimizer': 'adam', 'use_snp_selection': False, 'n_pcs': 2500}. Best is trial 0 with value: 0.1895113024948843.
2026-06-01 14:23:43 | INFO | Trial 3 | outer=10 | hidden=[128, 64] epochs=164 lr=1.538e-05 wd=3.248e-06 n_pcs=3000 weight={'name': 'uniform'}
[I 2026-06-01 14:23:47,204] Trial 3 finished with value: 0.12320405467152687 and parameters: {'hidden_dims': '[128, 64]', 'dropout': 0.1479874991503876, 'batch_norm': False, 'lr': 1.5380732370316375e-05, 'weight_decay': 3.2478890969962294e-06, 'epochs': 164, 'loss': 'mse', 'optimizer': 'adam', 'use_snp_selection': False, 'n_pcs': 3000}. Best is trial 0 with value: 0.1895113024948843.
2026-06-01 14:23:47 | INFO | Trial 4 | outer=10 | hidden=[256, 128] epochs=210 lr=7.298e-05 wd=7.875e-06 n_pcs=3000 weight={'name': 'uniform'}
[I 2026-06-01 14:23:52,921] Trial 4 finished with value: 0.17056434325282757 and parameters: {'hidden_dims': '[256, 128]', 'dropout': 0.09917626474860408, 'batch_norm': False, 'lr': 7.298380589156323e-05, 'weight_decay': 7.875094299510188e-06, 'epochs': 210, 'loss': 'mae', 'optimizer': 'adam', 'use_snp_selection': False, 'n_pcs': 3000}. Best is trial 0 with value: 0.1895113024948843.
2026-06-01 14:23:52 | INFO | Trial 5 | outer=10 | hidden=[512, 128] epochs=284 lr=5.467e-05 wd=5.496e-06 n_pcs=4000 weight={'name': 'uniform'}
[I 2026-06-01 14:24:06,603] Trial 5 finished with value: 0.16060163704480102 and parameters: {'hidden_dims': '[512, 128]', 'dropout': 0.3143696126156032, 'batch_norm': False, 'lr': 5.46667545989349e-05, 'weight_decay': 5.496446859789657e-06, 'epochs': 284, 'loss': 'mse', 'optimizer': 'adamw', 'use_snp_selection': False, 'n_pcs': 4000}. Best is trial 0 with value: 0.1895113024948843.
2026-06-01 14:24:06 | INFO | Trial 6 | outer=10 | hidden=[512, 64] epochs=90 lr=3.103e-05 wd=6.607e-08 n_pcs=5000 weight={'name': 'uniform'}
[I 2026-06-01 14:24:10,548] Trial 6 pruned. 
2026-06-01 14:24:10 | INFO | Trial 7 | outer=10 | hidden=[128, 64] epochs=272 lr=1.348e-05 wd=1.075e-07 n_pcs=4000 weight={'name': 'uniform'}
[I 2026-06-01 14:24:15,163] Trial 7 pruned. 
2026-06-01 14:24:15 | INFO | Trial 8 | outer=10 | hidden=[128, 64] epochs=205 lr=1.815e-05 wd=5.764e-06 n_pcs=3000 weight={'name': 'uniform'}
[I 2026-06-01 14:24:18,841] Trial 8 pruned. 
2026-06-01 14:24:18 | INFO | Trial 9 | outer=10 | hidden=[128, 64] epochs=296 lr=2.338e-05 wd=1.066e-07 n_pcs=2500 weight={'name': 'uniform'}
[I 2026-06-01 14:24:24,538] Trial 9 finished with value: 0.14088065849227333 and parameters: {'hidden_dims': '[128, 64]', 'dropout': 0.17607378181405245, 'batch_norm': False, 'lr': 2.3379083621874488e-05, 'weight_decay': 1.0663581123617794e-07, 'epochs': 296, 'loss': 'mae', 'optimizer': 'adam', 'use_snp_selection': False, 'n_pcs': 2500}. Best is trial 0 with value: 0.1895113024948843.
2026-06-01 14:24:24 | INFO | Trial 10 | outer=10 | hidden=[512, 256] epochs=242 lr=3.984e-04 wd=9.453e-04 n_pcs=500 weight={'name': 'uniform'}
[I 2026-06-01 14:24:29,316] Trial 10 finished with value: 0.15511560108833755 and parameters: {'hidden_dims': '[512, 256]', 'dropout': 0.02309895975550147, 'batch_norm': False, 'lr': 0.0003983594610602333, 'weight_decay': 0.0009452683165453212, 'epochs': 242, 'loss': 'mae', 'optimizer': 'adamw', 'use_snp_selection': False, 'n_pcs': 500}. Best is trial 0 with value: 0.1895113024948843.
2026-06-01 14:24:29 | INFO | Trial 11 | outer=10 | hidden=[1024, 256] epochs=234 lr=1.427e-04 wd=2.193e-08 n_pcs=500 weight={'name': 'uniform'}
[I 2026-06-01 14:24:36,045] Trial 11 finished with value: 0.18891246932564043 and parameters: {'hidden_dims': '[1024, 256]', 'dropout': 0.2943416512267277, 'batch_norm': False, 'lr': 0.00014267949767729298, 'weight_decay': 2.1929539154492014e-08, 'epochs': 234, 'loss': 'mae', 'optimizer': 'adamw', 'use_snp_selection': False, 'n_pcs': 500}. Best is trial 0 with value: 0.1895113024948843.
2026-06-01 14:24:36 | INFO | Trial 12 | outer=10 | hidden=[256, 64] epochs=245 lr=1.486e-04 wd=1.415e-08 n_pcs=1500 weight={'name': 'uniform'}
[I 2026-06-01 14:24:40,831] Trial 12 finished with value: 0.1894475725083428 and parameters: {'hidden_dims': '[256, 64]', 'dropout': 0.37425835978186517, 'batch_norm': False, 'lr': 0.00014862880265578126, 'weight_decay': 1.4151425112137584e-08, 'epochs': 245, 'loss': 'mae', 'optimizer': 'adamw', 'use_snp_selection': False, 'n_pcs': 1500}. Best is trial 0 with value: 0.1895113024948843.
2026-06-01 14:24:40 | INFO | Trial 13 | outer=10 | hidden=[256, 64] epochs=179 lr=1.538e-04 wd=1.072e-08 n_pcs=1500 weight={'name': 'uniform'}
[I 2026-06-01 14:24:44,783] Trial 13 finished with value: 0.20607333657125215 and parameters: {'hidden_dims': '[256, 64]', 'dropout': 0.5756846183148882, 'batch_norm': False, 'lr': 0.00015380530863758621, 'weight_decay': 1.0716022249052194e-08, 'epochs': 179, 'loss': 'mae', 'optimizer': 'adamw', 'use_snp_selection': False, 'n_pcs': 1500}. Best is trial 13 with value: 0.20607333657125215.
2026-06-01 14:24:44 | INFO | Trial 14 | outer=10 | hidden=[256, 64] epochs=122 lr=3.622e-04 wd=8.560e-07 n_pcs=1500 weight={'name': 'uniform'}
[I 2026-06-01 14:24:48,008] Trial 14 finished with value: 0.18366263791105414 and parameters: {'hidden_dims': '[256, 64]', 'dropout': 0.5160449215194329, 'batch_norm': False, 'lr': 0.0003621770795572752, 'weight_decay': 8.559912503829372e-07, 'epochs': 122, 'loss': 'mae', 'optimizer': 'adamw', 'use_snp_selection': False, 'n_pcs': 1500}. Best is trial 13 with value: 0.20607333657125215.
2026-06-01 14:24:48 | INFO | Trial 15 | outer=10 | hidden=[256, 64] epochs=177 lr=8.958e-05 wd=7.042e-07 n_pcs=1500 weight={'name': 'uniform'}
[I 2026-06-01 14:24:51,931] Trial 15 finished with value: 0.18842342653934105 and parameters: {'hidden_dims': '[256, 64]', 'dropout': 0.2354098555704116, 'batch_norm': False, 'lr': 8.957948200996738e-05, 'weight_decay': 7.042341982313891e-07, 'epochs': 177, 'loss': 'mae', 'optimizer': 'adamw', 'use_snp_selection': False, 'n_pcs': 1500}. Best is trial 13 with value: 0.20607333657125215.
2026-06-01 14:24:51 | INFO | Trial 16 | outer=10 | hidden=[256, 64] epochs=65 lr=2.066e-04 wd=1.521e-08 n_pcs=2000 weight={'name': 'uniform'}
[I 2026-06-01 14:24:54,576] Trial 16 finished with value: 0.2053174101607848 and parameters: {'hidden_dims': '[256, 64]', 'dropout': 0.40910273602853664, 'batch_norm': False, 'lr': 0.0002065835862805616, 'weight_decay': 1.5207486080842738e-08, 'epochs': 65, 'loss': 'mae', 'optimizer': 'adamw', 'use_snp_selection': False, 'n_pcs': 2000}. Best is trial 13 with value: 0.20607333657125215.
2026-06-01 14:24:54 | INFO | Trial 17 | outer=10 | hidden=[256, 128] epochs=51 lr=2.280e-04 wd=1.184e-08 n_pcs=2000 weight={'name': 'uniform'}
[I 2026-06-01 14:24:56,551] Trial 17 pruned. 
2026-06-01 14:24:56 | INFO | Trial 18 | outer=10 | hidden=[512, 128] epochs=51 lr=2.478e-04 wd=5.822e-05 n_pcs=1000 weight={'name': 'uniform'}
[I 2026-06-01 14:24:58,958] Trial 18 finished with value: 0.18053786875808395 and parameters: {'hidden_dims': '[512, 128]', 'dropout': 0.5842505243526348, 'batch_norm': False, 'lr': 0.0002478423475997261, 'weight_decay': 5.822056129371213e-05, 'epochs': 51, 'loss': 'mae', 'optimizer': 'adamw', 'use_snp_selection': False, 'n_pcs': 1000}. Best is trial 13 with value: 0.20607333657125215.
2026-06-01 14:24:58 | INFO | Trial 19 | outer=10 | hidden=[512, 256] epochs=87 lr=2.221e-04 wd=5.602e-07 n_pcs=2000 weight={'name': 'uniform'}
[I 2026-06-01 14:25:02,985] Trial 19 finished with value: 0.1864529431942549 and parameters: {'hidden_dims': '[512, 256]', 'dropout': 0.4144019999419947, 'batch_norm': False, 'lr': 0.00022208737009496869, 'weight_decay': 5.601657801446409e-07, 'epochs': 87, 'loss': 'mae', 'optimizer': 'adamw', 'use_snp_selection': False, 'n_pcs': 2000}. Best is trial 13 with value: 0.20607333657125215.
2026-06-01 14:25:02 | INFO | Trial 20 | outer=10 | hidden=[512, 64] epochs=171 lr=1.114e-04 wd=3.734e-08 n_pcs=3500 weight={'name': 'uniform'}
[I 2026-06-01 14:25:11,181] Trial 20 finished with value: 0.1910611952361363 and parameters: {'hidden_dims': '[512, 64]', 'dropout': 0.5270243612665664, 'batch_norm': False, 'lr': 0.00011141601926533032, 'weight_decay': 3.733739858632e-08, 'epochs': 171, 'loss': 'mae', 'optimizer': 'adamw', 'use_snp_selection': False, 'n_pcs': 3500}. Best is trial 13 with value: 0.20607333657125215.
2026-06-01 14:25:11 | INFO | Trial 21 | outer=10 | hidden=[512, 64] epochs=178 lr=1.167e-04 wd=2.890e-08 n_pcs=4000 weight={'name': 'uniform'}
[I 2026-06-01 14:25:20,375] Trial 21 finished with value: 0.16909562200923106 and parameters: {'hidden_dims': '[512, 64]', 'dropout': 0.5284003427087071, 'batch_norm': False, 'lr': 0.00011674644500626029, 'weight_decay': 2.889860330306601e-08, 'epochs': 178, 'loss': 'mae', 'optimizer': 'adamw', 'use_snp_selection': False, 'n_pcs': 4000}. Best is trial 13 with value: 0.20607333657125215.
2026-06-01 14:25:20 | INFO | Trial 22 | outer=10 | hidden=[512, 64] epochs=131 lr=2.095e-04 wd=2.653e-08 n_pcs=3500 weight={'name': 'uniform'}
[I 2026-06-01 14:25:27,153] Trial 22 finished with value: 0.18891442369017253 and parameters: {'hidden_dims': '[512, 64]', 'dropout': 0.46350206329644583, 'batch_norm': False, 'lr': 0.00020954826020760673, 'weight_decay': 2.6531015874728558e-08, 'epochs': 131, 'loss': 'mae', 'optimizer': 'adamw', 'use_snp_selection': False, 'n_pcs': 3500}. Best is trial 13 with value: 0.20607333657125215.
2026-06-01 14:25:27 | INFO | Trial 23 | outer=10 | hidden=[512, 64] epochs=155 lr=5.527e-05 wd=4.914e-08 n_pcs=2000 weight={'name': 'uniform'}
[I 2026-06-01 14:25:32,378] Trial 23 finished with value: 0.18169263393305957 and parameters: {'hidden_dims': '[512, 64]', 'dropout': 0.5451159781259418, 'batch_norm': False, 'lr': 5.527423982449448e-05, 'weight_decay': 4.913960434735743e-08, 'epochs': 155, 'loss': 'mae', 'optimizer': 'adamw', 'use_snp_selection': False, 'n_pcs': 2000}. Best is trial 13 with value: 0.20607333657125215.
2026-06-01 14:25:32 | INFO | Trial 24 | outer=10 | hidden=[256, 64] epochs=97 lr=1.052e-04 wd=1.033e-08 n_pcs=5000 weight={'name': 'uniform'}
[I 2026-06-01 14:25:37,150] Trial 24 finished with value: 0.1804320634578 and parameters: {'hidden_dims': '[256, 64]', 'dropout': 0.367773744991025, 'batch_norm': False, 'lr': 0.00010518891578200905, 'weight_decay': 1.0326955472098312e-08, 'epochs': 97, 'loss': 'mae', 'optimizer': 'adamw', 'use_snp_selection': False, 'n_pcs': 5000}. Best is trial 13 with value: 0.20607333657125215.
2026-06-01 14:25:37 | INFO | Trial 25 | outer=10 | hidden=[256, 64] epochs=198 lr=3.059e-04 wd=3.039e-07 n_pcs=3500 weight={'name': 'uniform'}
