[I 2026-06-01 11:46:36,992] Trial 100 finished with value: 0.2053712089885714 and parameters: {'hidden_dims': '[1024, 256]', 'dropout': 0.1025053649880776, 'batch_norm': False, 'lr': 0.0004991699749551708, 'weight_decay': 1.1683794003048272e-07, 'epochs': 263, 'loss': 'mse', 'optimizer': 'adamw', 'use_snp_selection': False, 'n_pcs': 5000}. Best is trial 98 with value: 0.22534808392827754.
2026-06-01 11:46:37 | INFO | Trial 101 | outer=2 | hidden=[1024, 256] epochs=276 lr=3.605e-04 wd=1.481e-07 n_pcs=4500 weight={'name': 'uniform'}
[I 2026-06-01 11:47:04,379] Trial 101 finished with value: 0.20187962998613843 and parameters: {'hidden_dims': '[1024, 256]', 'dropout': 0.2045391310119627, 'batch_norm': False, 'lr': 0.00036047876661458845, 'weight_decay': 1.4814330343807945e-07, 'epochs': 276, 'loss': 'mae', 'optimizer': 'adamw', 'use_snp_selection': False, 'n_pcs': 4500}. Best is trial 98 with value: 0.22534808392827754.
2026-06-01 11:47:04 | INFO | Trial 102 | outer=2 | hidden=[1024, 256] epochs=222 lr=2.889e-04 wd=2.225e-07 n_pcs=5000 weight={'name': 'uniform'}
[I 2026-06-01 11:47:28,811] Trial 102 finished with value: 0.2135423799900989 and parameters: {'hidden_dims': '[1024, 256]', 'dropout': 0.2515620056641621, 'batch_norm': False, 'lr': 0.0002888837169806807, 'weight_decay': 2.2245667499961577e-07, 'epochs': 222, 'loss': 'mae', 'optimizer': 'adamw', 'use_snp_selection': False, 'n_pcs': 5000}. Best is trial 98 with value: 0.22534808392827754.
2026-06-01 11:47:28 | INFO | Trial 103 | outer=2 | hidden=[1024, 256] epochs=226 lr=2.953e-04 wd=3.593e-08 n_pcs=5000 weight={'name': 'uniform'}
[I 2026-06-01 11:47:53,642] Trial 103 finished with value: 0.21464782526867446 and parameters: {'hidden_dims': '[1024, 256]', 'dropout': 0.2640238453166692, 'batch_norm': False, 'lr': 0.0002953144157370857, 'weight_decay': 3.5934870365053964e-08, 'epochs': 226, 'loss': 'mae', 'optimizer': 'adamw', 'use_snp_selection': False, 'n_pcs': 5000}. Best is trial 98 with value: 0.22534808392827754.
2026-06-01 11:47:53 | INFO | Trial 104 | outer=2 | hidden=[1024, 256] epochs=247 lr=2.840e-04 wd=1.163e-08 n_pcs=5000 weight={'name': 'uniform'}
[I 2026-06-01 11:48:20,538] Trial 104 finished with value: 0.2153222931677715 and parameters: {'hidden_dims': '[1024, 256]', 'dropout': 0.27471709243372505, 'batch_norm': False, 'lr': 0.00028396572962878047, 'weight_decay': 1.1631518363573197e-08, 'epochs': 247, 'loss': 'mae', 'optimizer': 'adamw', 'use_snp_selection': False, 'n_pcs': 5000}. Best is trial 98 with value: 0.22534808392827754.
2026-06-01 11:48:20 | INFO | Trial 105 | outer=2 | hidden=[512, 128] epochs=247 lr=2.189e-04 wd=1.035e-08 n_pcs=5000 weight={'name': 'uniform'}
[I 2026-06-01 11:48:34,967] Trial 105 finished with value: 0.19799596613214537 and parameters: {'hidden_dims': '[512, 128]', 'dropout': 0.26605776967871897, 'batch_norm': False, 'lr': 0.00021889408680974352, 'weight_decay': 1.0352366711489545e-08, 'epochs': 247, 'loss': 'mae', 'optimizer': 'adamw', 'use_snp_selection': False, 'n_pcs': 5000}. Best is trial 98 with value: 0.22534808392827754.
2026-06-01 11:48:34 | INFO | Trial 106 | outer=2 | hidden=[1024, 256] epochs=263 lr=2.478e-04 wd=3.494e-08 n_pcs=5000 weight={'name': 'uniform'}
[I 2026-06-01 11:49:03,449] Trial 106 finished with value: 0.21130359157007256 and parameters: {'hidden_dims': '[1024, 256]', 'dropout': 0.3360887019716779, 'batch_norm': False, 'lr': 0.0002477724301277559, 'weight_decay': 3.494417766707202e-08, 'epochs': 263, 'loss': 'mae', 'optimizer': 'adamw', 'use_snp_selection': False, 'n_pcs': 5000}. Best is trial 98 with value: 0.22534808392827754.
2026-06-01 11:49:03 | INFO | Trial 107 | outer=2 | hidden=[1024, 256] epochs=254 lr=3.074e-04 wd=1.423e-08 n_pcs=5000 weight={'name': 'uniform'}
[I 2026-06-01 11:49:31,046] Trial 107 finished with value: 0.21022398275151585 and parameters: {'hidden_dims': '[1024, 256]', 'dropout': 0.27376702524866975, 'batch_norm': False, 'lr': 0.0003073756346772952, 'weight_decay': 1.4227711190436959e-08, 'epochs': 254, 'loss': 'mae', 'optimizer': 'adamw', 'use_snp_selection': False, 'n_pcs': 5000}. Best is trial 98 with value: 0.22534808392827754.
2026-06-01 11:49:31 | INFO | Trial 108 | outer=2 | hidden=[1024, 256] epochs=241 lr=2.737e-04 wd=2.423e-08 n_pcs=5000 weight={'name': 'uniform'}
[I 2026-06-01 11:49:57,347] Trial 108 finished with value: 0.21532667590558124 and parameters: {'hidden_dims': '[1024, 256]', 'dropout': 0.24600418646714758, 'batch_norm': False, 'lr': 0.0002737178713171648, 'weight_decay': 2.423466350600906e-08, 'epochs': 241, 'loss': 'mae', 'optimizer': 'adamw', 'use_snp_selection': False, 'n_pcs': 5000}. Best is trial 98 with value: 0.22534808392827754.
2026-06-01 11:49:57 | INFO | Trial 109 | outer=2 | hidden=[1024, 256] epochs=230 lr=1.957e-04 wd=2.358e-08 n_pcs=5000 weight={'name': 'uniform'}
[I 2026-06-01 11:50:22,573] Trial 109 finished with value: 0.21422155187777095 and parameters: {'hidden_dims': '[1024, 256]', 'dropout': 0.2926990724303815, 'batch_norm': False, 'lr': 0.00019567512196046077, 'weight_decay': 2.358026072127173e-08, 'epochs': 230, 'loss': 'mae', 'optimizer': 'adamw', 'use_snp_selection': False, 'n_pcs': 5000}. Best is trial 98 with value: 0.22534808392827754.
2026-06-01 11:50:22 | INFO | Trial 110 | outer=2 | hidden=[128, 64] epochs=241 lr=2.598e-04 wd=1.917e-08 n_pcs=5000 weight={'name': 'uniform'}
[I 2026-06-01 11:50:28,320] Trial 110 finished with value: 0.1829945280557234 and parameters: {'hidden_dims': '[128, 64]', 'dropout': 0.3611822423288106, 'batch_norm': False, 'lr': 0.0002597739920752878, 'weight_decay': 1.9166982598152942e-08, 'epochs': 241, 'loss': 'mae', 'optimizer': 'adamw', 'use_snp_selection': False, 'n_pcs': 5000}. Best is trial 98 with value: 0.22534808392827754.
2026-06-01 11:50:28 | INFO | Trial 111 | outer=2 | hidden=[1024, 256] epochs=233 lr=2.934e-04 wd=2.676e-08 n_pcs=5000 weight={'name': 'uniform'}
[I 2026-06-01 11:50:53,837] Trial 111 finished with value: 0.20563859880267543 and parameters: {'hidden_dims': '[1024, 256]', 'dropout': 0.29014946037024153, 'batch_norm': False, 'lr': 0.0002933941004744822, 'weight_decay': 2.675829820424866e-08, 'epochs': 233, 'loss': 'mae', 'optimizer': 'adamw', 'use_snp_selection': False, 'n_pcs': 5000}. Best is trial 98 with value: 0.22534808392827754.
2026-06-01 11:50:53 | INFO | Trial 112 | outer=2 | hidden=[1024, 256] epochs=240 lr=2.693e-04 wd=1.315e-08 n_pcs=5000 weight={'name': 'uniform'}
[I 2026-06-01 11:51:20,048] Trial 112 finished with value: 0.21433839376251163 and parameters: {'hidden_dims': '[1024, 256]', 'dropout': 0.31227288430772304, 'batch_norm': False, 'lr': 0.0002693283411071088, 'weight_decay': 1.3146724202389111e-08, 'epochs': 240, 'loss': 'mae', 'optimizer': 'adamw', 'use_snp_selection': False, 'n_pcs': 5000}. Best is trial 98 with value: 0.22534808392827754.
2026-06-01 11:51:20 | INFO | Trial 113 | outer=2 | hidden=[1024, 256] epochs=240 lr=3.852e-04 wd=3.139e-08 n_pcs=5000 weight={'name': 'uniform'}
[I 2026-06-01 11:51:46,279] Trial 113 finished with value: 0.20882066415698786 and parameters: {'hidden_dims': '[1024, 256]', 'dropout': 0.30775450724504133, 'batch_norm': False, 'lr': 0.00038522891481572284, 'weight_decay': 3.139376981656494e-08, 'epochs': 240, 'loss': 'mae', 'optimizer': 'adamw', 'use_snp_selection': False, 'n_pcs': 5000}. Best is trial 98 with value: 0.22534808392827754.
2026-06-01 11:51:46 | INFO | Trial 114 | outer=2 | hidden=[1024, 256] epochs=224 lr=2.698e-04 wd=1.324e-08 n_pcs=3500 weight={'name': 'uniform'}
[I 2026-06-01 11:52:04,792] Trial 114 finished with value: 0.19716673497466347 and parameters: {'hidden_dims': '[1024, 256]', 'dropout': 0.23231589747731546, 'batch_norm': False, 'lr': 0.0002698185578203786, 'weight_decay': 1.324087161801961e-08, 'epochs': 224, 'loss': 'mae', 'optimizer': 'adamw', 'use_snp_selection': False, 'n_pcs': 3500}. Best is trial 98 with value: 0.22534808392827754.
2026-06-01 11:52:04 | INFO | Trial 115 | outer=2 | hidden=[512, 64] epochs=258 lr=2.352e-04 wd=1.453e-08 n_pcs=5000 weight={'name': 'uniform'}
[I 2026-06-01 11:52:19,519] Trial 115 finished with value: 0.22008879486965757 and parameters: {'hidden_dims': '[512, 64]', 'dropout': 0.24645872606388608, 'batch_norm': False, 'lr': 0.0002351964174419291, 'weight_decay': 1.4527588497999069e-08, 'epochs': 258, 'loss': 'mae', 'optimizer': 'adamw', 'use_snp_selection': False, 'n_pcs': 5000}. Best is trial 98 with value: 0.22534808392827754.
2026-06-01 11:52:19 | INFO | Trial 116 | outer=2 | hidden=[512, 64] epochs=269 lr=3.386e-04 wd=4.760e-08 n_pcs=5000 weight={'name': 'uniform'}
[I 2026-06-01 11:52:34,778] Trial 116 finished with value: 0.19962230852353874 and parameters: {'hidden_dims': '[512, 64]', 'dropout': 0.24401686747709372, 'batch_norm': False, 'lr': 0.00033855792756959683, 'weight_decay': 4.760467976637562e-08, 'epochs': 269, 'loss': 'mae', 'optimizer': 'adamw', 'use_snp_selection': False, 'n_pcs': 5000}. Best is trial 98 with value: 0.22534808392827754.
2026-06-01 11:52:34 | INFO | Trial 117 | outer=2 | hidden=[512, 64] epochs=246 lr=2.283e-04 wd=3.863e-08 n_pcs=5000 weight={'name': 'uniform'}
[I 2026-06-01 11:52:48,938] Trial 117 finished with value: 0.20556437409162784 and parameters: {'hidden_dims': '[512, 64]', 'dropout': 0.22284066407099185, 'batch_norm': False, 'lr': 0.0002283463866287958, 'weight_decay': 3.862930885563938e-08, 'epochs': 246, 'loss': 'mae', 'optimizer': 'adamw', 'use_snp_selection': False, 'n_pcs': 5000}. Best is trial 98 with value: 0.22534808392827754.
2026-06-01 11:52:48 | INFO | Trial 118 | outer=2 | hidden=[512, 64] epochs=282 lr=4.315e-04 wd=1.835e-08 n_pcs=4500 weight={'name': 'uniform'}
[I 2026-06-01 11:53:03,876] Trial 118 finished with value: 0.20041343005243845 and parameters: {'hidden_dims': '[512, 64]', 'dropout': 0.27698161565846086, 'batch_norm': False, 'lr': 0.00043150525123804637, 'weight_decay': 1.835153962589791e-08, 'epochs': 282, 'loss': 'mae', 'optimizer': 'adamw', 'use_snp_selection': False, 'n_pcs': 4500}. Best is trial 98 with value: 0.22534808392827754.
2026-06-01 11:53:03 | INFO | Trial 119 | outer=2 | hidden=[256, 64] epochs=248 lr=6.923e-05 wd=5.624e-08 n_pcs=5000 weight={'name': 'uniform'}
[I 2026-06-01 11:53:12,599] Trial 119 finished with value: 0.177287813594154 and parameters: {'hidden_dims': '[256, 64]', 'dropout': 0.1962810238720118, 'batch_norm': False, 'lr': 6.923394037025797e-05, 'weight_decay': 5.6237704772911445e-08, 'epochs': 248, 'loss': 'mae', 'optimizer': 'adamw', 'use_snp_selection': False, 'n_pcs': 5000}. Best is trial 98 with value: 0.22534808392827754.
2026-06-01 11:53:12 | INFO | Trial 120 | outer=2 | hidden=[512, 256] epochs=259 lr=3.073e-04 wd=2.306e-08 n_pcs=5000 weight={'name': 'uniform'}
[I 2026-06-01 11:53:28,271] Trial 120 finished with value: 0.18753928564399291 and parameters: {'hidden_dims': '[512, 256]', 'dropout': 0.24560719876961123, 'batch_norm': False, 'lr': 0.0003072858508064144, 'weight_decay': 2.306078752637146e-08, 'epochs': 259, 'loss': 'mse', 'optimizer': 'adamw', 'use_snp_selection': False, 'n_pcs': 5000}. Best is trial 98 with value: 0.22534808392827754.
2026-06-01 11:53:28 | INFO | Trial 121 | outer=2 | hidden=[1024, 256] epochs=238 lr=2.526e-04 wd=1.315e-08 n_pcs=5000 weight={'name': 'uniform'}
[I 2026-06-01 11:53:54,313] Trial 121 finished with value: 0.21540167175410355 and parameters: {'hidden_dims': '[1024, 256]', 'dropout': 0.313490738607978, 'batch_norm': False, 'lr': 0.00025259212383279937, 'weight_decay': 1.3151983837395453e-08, 'epochs': 238, 'loss': 'mae', 'optimizer': 'adamw', 'use_snp_selection': False, 'n_pcs': 5000}. Best is trial 98 with value: 0.22534808392827754.
2026-06-01 11:53:54 | INFO | Trial 122 | outer=2 | hidden=[1024, 256] epochs=258 lr=3.377e-04 wd=1.562e-08 n_pcs=5000 weight={'name': 'uniform'}
[I 2026-06-01 11:54:22,341] Trial 122 finished with value: 0.20642870426267343 and parameters: {'hidden_dims': '[1024, 256]', 'dropout': 0.2575951025587028, 'batch_norm': False, 'lr': 0.00033770194124427196, 'weight_decay': 1.5620309936532877e-08, 'epochs': 258, 'loss': 'mae', 'optimizer': 'adamw', 'use_snp_selection': False, 'n_pcs': 5000}. Best is trial 98 with value: 0.22534808392827754.
2026-06-01 11:54:22 | INFO | Trial 123 | outer=2 | hidden=[512, 64] epochs=292 lr=2.103e-04 wd=1.090e-08 n_pcs=5000 weight={'name': 'uniform'}
[I 2026-06-01 11:54:38,714] Trial 123 finished with value: 0.21878850066852965 and parameters: {'hidden_dims': '[512, 64]', 'dropout': 0.2282412992472468, 'batch_norm': False, 'lr': 0.00021028031149401886, 'weight_decay': 1.0899274427531633e-08, 'epochs': 292, 'loss': 'mae', 'optimizer': 'adamw', 'use_snp_selection': False, 'n_pcs': 5000}. Best is trial 98 with value: 0.22534808392827754.
2026-06-01 11:54:38 | INFO | Trial 124 | outer=2 | hidden=[512, 64] epochs=289 lr=2.479e-04 wd=1.013e-08 n_pcs=4500 weight={'name': 'uniform'}
[I 2026-06-01 11:54:53,988] Trial 124 finished with value: 0.20758842647455378 and parameters: {'hidden_dims': '[512, 64]', 'dropout': 0.23077132175082626, 'batch_norm': False, 'lr': 0.0002478875755791381, 'weight_decay': 1.0130085980585042e-08, 'epochs': 289, 'loss': 'mae', 'optimizer': 'adamw', 'use_snp_selection': False, 'n_pcs': 4500}. Best is trial 98 with value: 0.22534808392827754.
2026-06-01 11:54:54 | INFO | Trial 125 | outer=2 | hidden=[512, 64] epochs=278 lr=2.164e-04 wd=1.209e-08 n_pcs=5000 weight={'name': 'uniform'}
[I 2026-06-01 11:55:09,692] Trial 125 finished with value: 0.20817518877257388 and parameters: {'hidden_dims': '[512, 64]', 'dropout': 0.19979714298862739, 'batch_norm': False, 'lr': 0.00021642559569221982, 'weight_decay': 1.2086645830713149e-08, 'epochs': 278, 'loss': 'mae', 'optimizer': 'adamw', 'use_snp_selection': False, 'n_pcs': 5000}. Best is trial 98 with value: 0.22534808392827754.
2026-06-01 11:55:09 | INFO | Trial 126 | outer=2 | hidden=[512, 64] epochs=294 lr=1.917e-04 wd=1.909e-08 n_pcs=5000 weight={'name': 'uniform'}
[I 2026-06-01 11:55:26,144] Trial 126 finished with value: 0.2070054520494625 and parameters: {'hidden_dims': '[512, 64]', 'dropout': 0.32008029399893057, 'batch_norm': False, 'lr': 0.0001917402749384502, 'weight_decay': 1.9088570435383122e-08, 'epochs': 294, 'loss': 'mae', 'optimizer': 'adamw', 'use_snp_selection': False, 'n_pcs': 5000}. Best is trial 98 with value: 0.22534808392827754.
2026-06-01 11:55:26 | INFO | Trial 127 | outer=2 | hidden=[512, 64] epochs=299 lr=1.643e-04 wd=1.609e-08 n_pcs=4500 weight={'name': 'uniform'}
[I 2026-06-01 11:55:41,890] Trial 127 finished with value: 0.1943013603905949 and parameters: {'hidden_dims': '[512, 64]', 'dropout': 0.18495063515244256, 'batch_norm': False, 'lr': 0.00016433607154684322, 'weight_decay': 1.6085047836975926e-08, 'epochs': 299, 'loss': 'mae', 'optimizer': 'adamw', 'use_snp_selection': False, 'n_pcs': 4500}. Best is trial 98 with value: 0.22534808392827754.
2026-06-01 11:55:41 | INFO | Trial 128 | outer=2 | hidden=[512, 128] epochs=268 lr=3.797e-04 wd=2.876e-08 n_pcs=5000 weight={'name': 'uniform'}
[I 2026-06-01 11:55:57,371] Trial 128 finished with value: 0.2188722230170325 and parameters: {'hidden_dims': '[512, 128]', 'dropout': 0.2803853166465646, 'batch_norm': False, 'lr': 0.00037974837241656857, 'weight_decay': 2.8763885882736456e-08, 'epochs': 268, 'loss': 'mae', 'optimizer': 'adamw', 'use_snp_selection': False, 'n_pcs': 5000}. Best is trial 98 with value: 0.22534808392827754.
2026-06-01 11:55:57 | INFO | Trial 129 | outer=2 | hidden=[512, 128] epochs=265 lr=2.810e-04 wd=2.945e-08 n_pcs=5000 weight={'name': 'uniform'}
[I 2026-06-01 11:56:12,695] Trial 129 finished with value: 0.20592044558615444 and parameters: {'hidden_dims': '[512, 128]', 'dropout': 0.28479788891085256, 'batch_norm': False, 'lr': 0.0002810460776979974, 'weight_decay': 2.9449615081782366e-08, 'epochs': 265, 'loss': 'mae', 'optimizer': 'adamw', 'use_snp_selection': False, 'n_pcs': 5000}. Best is trial 98 with value: 0.22534808392827754.
2026-06-01 11:56:12 | INFO | Trial 130 | outer=2 | hidden=[512, 128] epochs=251 lr=2.376e-04 wd=2.030e-08 n_pcs=5000 weight={'name': 'uniform'}
[I 2026-06-01 11:56:27,328] Trial 130 finished with value: 0.20077246933394974 and parameters: {'hidden_dims': '[512, 128]', 'dropout': 0.3018268149598467, 'batch_norm': False, 'lr': 0.00023756241483159749, 'weight_decay': 2.029663592973368e-08, 'epochs': 251, 'loss': 'mae', 'optimizer': 'adamw', 'use_snp_selection': False, 'n_pcs': 5000}. Best is trial 98 with value: 0.22534808392827754.
2026-06-01 11:56:27 | INFO | Trial 131 | outer=2 | hidden=[512, 128] epochs=266 lr=3.788e-04 wd=7.800e-08 n_pcs=5000 weight={'name': 'uniform'}
[I 2026-06-01 11:56:42,705] Trial 131 finished with value: 0.20846578581575312 and parameters: {'hidden_dims': '[512, 128]', 'dropout': 0.22213219462262415, 'batch_norm': False, 'lr': 0.00037880787862434737, 'weight_decay': 7.800263625430739e-08, 'epochs': 266, 'loss': 'mae', 'optimizer': 'adamw', 'use_snp_selection': False, 'n_pcs': 5000}. Best is trial 98 with value: 0.22534808392827754.
2026-06-01 11:56:42 | INFO | Trial 132 | outer=2 | hidden=[512, 128] epochs=273 lr=4.173e-04 wd=1.168e-08 n_pcs=5000 weight={'name': 'uniform'}
[I 2026-06-01 11:56:58,431] Trial 132 finished with value: 0.2091663368448986 and parameters: {'hidden_dims': '[512, 128]', 'dropout': 0.16735848817953308, 'batch_norm': False, 'lr': 0.0004172610830181577, 'weight_decay': 1.1684165872082542e-08, 'epochs': 273, 'loss': 'mae', 'optimizer': 'adamw', 'use_snp_selection': False, 'n_pcs': 5000}. Best is trial 98 with value: 0.22534808392827754.
2026-06-01 11:56:58 | INFO | Trial 133 | outer=2 | hidden=[1024, 256] epochs=260 lr=3.357e-04 wd=1.541e-08 n_pcs=4500 weight={'name': 'uniform'}
[I 2026-06-01 11:57:24,397] Trial 133 finished with value: 0.21132548475281832 and parameters: {'hidden_dims': '[1024, 256]', 'dropout': 0.25310741107085866, 'batch_norm': False, 'lr': 0.0003356914913379518, 'weight_decay': 1.541253677122132e-08, 'epochs': 260, 'loss': 'mae', 'optimizer': 'adamw', 'use_snp_selection': False, 'n_pcs': 4500}. Best is trial 98 with value: 0.22534808392827754.
2026-06-01 11:57:24 | INFO | Trial 134 | outer=2 | hidden=[1024, 256] epochs=290 lr=4.555e-04 wd=4.867e-08 n_pcs=5000 weight={'name': 'uniform'}
[I 2026-06-01 11:57:55,565] Trial 134 finished with value: 0.21625586849475414 and parameters: {'hidden_dims': '[1024, 256]', 'dropout': 0.2724379659797192, 'batch_norm': False, 'lr': 0.000455524539508364, 'weight_decay': 4.8666010482740796e-08, 'epochs': 290, 'loss': 'mae', 'optimizer': 'adamw', 'use_snp_selection': False, 'n_pcs': 5000}. Best is trial 98 with value: 0.22534808392827754.
2026-06-01 11:57:55 | INFO | Trial 135 | outer=2 | hidden=[1024, 256] epochs=165 lr=3.877e-04 wd=4.650e-08 n_pcs=5000 weight={'name': 'uniform'}
[I 2026-06-01 11:58:14,401] Trial 135 finished with value: 0.2056284967415544 and parameters: {'hidden_dims': '[1024, 256]', 'dropout': 0.2713930856922466, 'batch_norm': False, 'lr': 0.00038770369277291665, 'weight_decay': 4.6496008966485336e-08, 'epochs': 165, 'loss': 'mae', 'optimizer': 'adamw', 'use_snp_selection': False, 'n_pcs': 5000}. Best is trial 98 with value: 0.22534808392827754.
2026-06-01 11:58:14 | INFO | Trial 136 | outer=2 | hidden=[512, 64] epochs=157 lr=3.250e-04 wd=2.263e-08 n_pcs=5000 weight={'name': 'uniform'}
[I 2026-06-01 11:58:24,287] Trial 136 finished with value: 0.19562133233290593 and parameters: {'hidden_dims': '[512, 64]', 'dropout': 0.23788012371983433, 'batch_norm': False, 'lr': 0.0003249940828912656, 'weight_decay': 2.2625419379864972e-08, 'epochs': 157, 'loss': 'mae', 'optimizer': 'adamw', 'use_snp_selection': False, 'n_pcs': 5000}. Best is trial 98 with value: 0.22534808392827754.
2026-06-01 11:58:24 | INFO | Trial 137 | outer=2 | hidden=[1024, 256] epochs=280 lr=2.574e-04 wd=2.786e-08 n_pcs=5000 weight={'name': 'uniform'}
[I 2026-06-01 11:58:54,483] Trial 137 finished with value: 0.2247340030625021 and parameters: {'hidden_dims': '[1024, 256]', 'dropout': 0.2838857874236823, 'batch_norm': False, 'lr': 0.0002574021614741588, 'weight_decay': 2.786354105467779e-08, 'epochs': 280, 'loss': 'mae', 'optimizer': 'adamw', 'use_snp_selection': False, 'n_pcs': 5000}. Best is trial 98 with value: 0.22534808392827754.
2026-06-01 11:58:54 | INFO | Trial 138 | outer=2 | hidden=[1024, 256] epochs=286 lr=2.577e-04 wd=3.939e-08 n_pcs=5000 weight={'name': 'uniform'}
[I 2026-06-01 11:59:25,263] Trial 138 finished with value: 0.21686273131347789 and parameters: {'hidden_dims': '[1024, 256]', 'dropout': 0.2907347418286295, 'batch_norm': False, 'lr': 0.0002576912618645643, 'weight_decay': 3.938660298930015e-08, 'epochs': 286, 'loss': 'mae', 'optimizer': 'adamw', 'use_snp_selection': False, 'n_pcs': 5000}. Best is trial 98 with value: 0.22534808392827754.
2026-06-01 11:59:25 | INFO | Trial 139 | outer=2 | hidden=[128, 64] epochs=289 lr=2.038e-04 wd=9.567e-08 n_pcs=5000 weight={'name': 'uniform'}
[I 2026-06-01 11:59:29,117] Trial 139 pruned. 
2026-06-01 11:59:29 | INFO | Trial 140 | outer=2 | hidden=[1024, 256] epochs=290 lr=4.479e-04 wd=4.089e-08 n_pcs=5000 weight={'name': 'uniform'}
[I 2026-06-01 12:00:00,285] Trial 140 finished with value: 0.22121973554708707 and parameters: {'hidden_dims': '[1024, 256]', 'dropout': 0.3500534429024038, 'batch_norm': False, 'lr': 0.00044786532364759173, 'weight_decay': 4.0889982406511095e-08, 'epochs': 290, 'loss': 'mae', 'optimizer': 'adamw', 'use_snp_selection': False, 'n_pcs': 5000}. Best is trial 98 with value: 0.22534808392827754.
2026-06-01 12:00:00 | INFO | Trial 141 | outer=2 | hidden=[1024, 256] epochs=291 lr=4.497e-04 wd=5.330e-08 n_pcs=5000 weight={'name': 'uniform'}
