[I 2026-06-01 14:44:27,089] Trial 46 finished with value: 0.18710884276857503 and parameters: {'hidden_dims': '[1024, 256]', 'dropout': 0.15684866814748222, 'batch_norm': False, 'lr': 0.0003353641135163889, 'weight_decay': 1.1222437061506668e-07, 'epochs': 171, 'loss': 'mse', 'optimizer': 'adamw', 'use_snp_selection': False, 'n_pcs': 2000}. Best is trial 36 with value: 0.19978891811140845.
2026-06-01 14:44:27 | INFO | Trial 47 | outer=11 | hidden=[256, 64] epochs=195 lr=1.273e-04 wd=6.314e-06 n_pcs=1500 weight={'name': 'uniform'}
[I 2026-06-01 14:44:31,196] Trial 47 finished with value: 0.18847686864055446 and parameters: {'hidden_dims': '[256, 64]', 'dropout': 0.07294137099867287, 'batch_norm': False, 'lr': 0.0001273296780876226, 'weight_decay': 6.3141934542216675e-06, 'epochs': 195, 'loss': 'mae', 'optimizer': 'adamw', 'use_snp_selection': False, 'n_pcs': 1500}. Best is trial 36 with value: 0.19978891811140845.
2026-06-01 14:44:31 | INFO | Trial 48 | outer=11 | hidden=[256, 128] epochs=153 lr=1.886e-04 wd=4.672e-06 n_pcs=3000 weight={'name': 'uniform'}
[I 2026-06-01 14:44:35,891] Trial 48 finished with value: 0.1737364485307061 and parameters: {'hidden_dims': '[256, 128]', 'dropout': 0.264506469831032, 'batch_norm': False, 'lr': 0.0001885893911367777, 'weight_decay': 4.672408507766725e-06, 'epochs': 153, 'loss': 'mae', 'optimizer': 'adamw', 'use_snp_selection': False, 'n_pcs': 3000}. Best is trial 36 with value: 0.19978891811140845.
2026-06-01 14:44:35 | INFO | Trial 49 | outer=11 | hidden=[128, 64] epochs=83 lr=2.637e-05 wd=5.422e-07 n_pcs=1500 weight={'name': 'uniform'}
[I 2026-06-01 14:44:37,543] Trial 49 pruned. 
2026-06-01 14:44:37 | INFO | Trial 50 | outer=11 | hidden=[512, 128] epochs=136 lr=4.314e-04 wd=1.480e-07 n_pcs=2500 weight={'name': 'uniform'}
[I 2026-06-01 14:44:43,104] Trial 50 finished with value: 0.176133735348828 and parameters: {'hidden_dims': '[512, 128]', 'dropout': 0.21202540476072657, 'batch_norm': False, 'lr': 0.00043137042406990147, 'weight_decay': 1.480188389949563e-07, 'epochs': 136, 'loss': 'mse', 'optimizer': 'adamw', 'use_snp_selection': False, 'n_pcs': 2500}. Best is trial 36 with value: 0.19978891811140845.
2026-06-01 14:44:43 | INFO | Trial 51 | outer=11 | hidden=[512, 64] epochs=117 lr=2.478e-04 wd=9.030e-04 n_pcs=1000 weight={'name': 'uniform'}
[I 2026-06-01 14:44:46,395] Trial 51 finished with value: 0.1873044969669735 and parameters: {'hidden_dims': '[512, 64]', 'dropout': 0.3500645994149325, 'batch_norm': False, 'lr': 0.0002477871718329872, 'weight_decay': 0.0009029710888831891, 'epochs': 117, 'loss': 'mae', 'optimizer': 'adam', 'use_snp_selection': False, 'n_pcs': 1000}. Best is trial 36 with value: 0.19978891811140845.
2026-06-01 14:44:46 | INFO | Trial 52 | outer=11 | hidden=[512, 64] epochs=126 lr=3.185e-04 wd=2.800e-06 n_pcs=500 weight={'name': 'uniform'}
[I 2026-06-01 14:44:49,526] Trial 52 finished with value: 0.18361595261980207 and parameters: {'hidden_dims': '[512, 64]', 'dropout': 0.3052043390768589, 'batch_norm': False, 'lr': 0.0003184553947409614, 'weight_decay': 2.800305411344549e-06, 'epochs': 126, 'loss': 'mae', 'optimizer': 'adam', 'use_snp_selection': False, 'n_pcs': 500}. Best is trial 36 with value: 0.19978891811140845.
2026-06-01 14:44:49 | INFO | Trial 53 | outer=11 | hidden=[512, 256] epochs=106 lr=1.795e-04 wd=1.642e-06 n_pcs=1000 weight={'name': 'uniform'}
[I 2026-06-01 14:44:53,018] Trial 53 finished with value: 0.19845776702497303 and parameters: {'hidden_dims': '[512, 256]', 'dropout': 0.40965065098772474, 'batch_norm': False, 'lr': 0.00017949065710802306, 'weight_decay': 1.6416327936636524e-06, 'epochs': 106, 'loss': 'mae', 'optimizer': 'adam', 'use_snp_selection': False, 'n_pcs': 1000}. Best is trial 36 with value: 0.19978891811140845.
2026-06-01 14:44:53 | INFO | Trial 54 | outer=11 | hidden=[512, 256] epochs=101 lr=1.533e-04 wd=1.842e-06 n_pcs=2000 weight={'name': 'uniform'}
[I 2026-06-01 14:44:57,407] Trial 54 finished with value: 0.2087603246140576 and parameters: {'hidden_dims': '[512, 256]', 'dropout': 0.44176431309891656, 'batch_norm': False, 'lr': 0.00015327202688287066, 'weight_decay': 1.8422300796614106e-06, 'epochs': 101, 'loss': 'mae', 'optimizer': 'adam', 'use_snp_selection': False, 'n_pcs': 2000}. Best is trial 54 with value: 0.2087603246140576.
2026-06-01 14:44:57 | INFO | Trial 55 | outer=11 | hidden=[512, 256] epochs=75 lr=1.051e-04 wd=1.737e-06 n_pcs=1500 weight={'name': 'uniform'}
[I 2026-06-01 14:45:00,764] Trial 55 finished with value: 0.18125221070271874 and parameters: {'hidden_dims': '[512, 256]', 'dropout': 0.4548421465757754, 'batch_norm': False, 'lr': 0.00010506040471017892, 'weight_decay': 1.7366185941694376e-06, 'epochs': 75, 'loss': 'mae', 'optimizer': 'adam', 'use_snp_selection': False, 'n_pcs': 1500}. Best is trial 54 with value: 0.2087603246140576.
2026-06-01 14:45:00 | INFO | Trial 56 | outer=11 | hidden=[512, 256] epochs=167 lr=1.482e-04 wd=9.729e-06 n_pcs=2000 weight={'name': 'uniform'}
[I 2026-06-01 14:45:06,852] Trial 56 finished with value: 0.18551004453684364 and parameters: {'hidden_dims': '[512, 256]', 'dropout': 0.41189832441221397, 'batch_norm': False, 'lr': 0.0001481788537713171, 'weight_decay': 9.728630507491644e-06, 'epochs': 167, 'loss': 'mae', 'optimizer': 'adam', 'use_snp_selection': False, 'n_pcs': 2000}. Best is trial 54 with value: 0.2087603246140576.
2026-06-01 14:45:06 | INFO | Trial 57 | outer=11 | hidden=[512, 256] epochs=94 lr=1.849e-04 wd=6.175e-08 n_pcs=2000 weight={'name': 'uniform'}
[I 2026-06-01 14:45:11,045] Trial 57 finished with value: 0.1998029819099815 and parameters: {'hidden_dims': '[512, 256]', 'dropout': 0.4610834948162286, 'batch_norm': False, 'lr': 0.00018486624678834847, 'weight_decay': 6.175493638464008e-08, 'epochs': 94, 'loss': 'mae', 'optimizer': 'adam', 'use_snp_selection': False, 'n_pcs': 2000}. Best is trial 54 with value: 0.2087603246140576.
2026-06-01 14:45:11 | INFO | Trial 58 | outer=11 | hidden=[512, 256] epochs=286 lr=1.350e-04 wd=1.868e-08 n_pcs=2500 weight={'name': 'uniform'}
[I 2026-06-01 14:45:21,352] Trial 58 finished with value: 0.18522544153761464 and parameters: {'hidden_dims': '[512, 256]', 'dropout': 0.46326450050814183, 'batch_norm': False, 'lr': 0.0001350467434359707, 'weight_decay': 1.8678873509228923e-08, 'epochs': 286, 'loss': 'mae', 'optimizer': 'adam', 'use_snp_selection': False, 'n_pcs': 2500}. Best is trial 54 with value: 0.2087603246140576.
2026-06-01 14:45:21 | INFO | Trial 59 | outer=11 | hidden=[512, 256] epochs=50 lr=9.211e-05 wd=5.554e-08 n_pcs=2000 weight={'name': 'uniform'}
[I 2026-06-01 14:45:23,196] Trial 59 pruned. 
2026-06-01 14:45:23 | INFO | Trial 60 | outer=11 | hidden=[512, 256] epochs=91 lr=1.184e-04 wd=6.299e-05 n_pcs=1500 weight={'name': 'uniform'}
[I 2026-06-01 14:45:26,907] Trial 60 finished with value: 0.17656362427184824 and parameters: {'hidden_dims': '[512, 256]', 'dropout': 0.2330493197729163, 'batch_norm': False, 'lr': 0.00011840972094605253, 'weight_decay': 6.298573592935667e-05, 'epochs': 91, 'loss': 'mae', 'optimizer': 'adam', 'use_snp_selection': False, 'n_pcs': 1500}. Best is trial 54 with value: 0.2087603246140576.
2026-06-01 14:45:26 | INFO | Trial 61 | outer=11 | hidden=[512, 256] epochs=106 lr=1.777e-04 wd=7.896e-08 n_pcs=2000 weight={'name': 'uniform'}
[I 2026-06-01 14:45:31,413] Trial 61 finished with value: 0.19624225215952287 and parameters: {'hidden_dims': '[512, 256]', 'dropout': 0.4759930424713351, 'batch_norm': False, 'lr': 0.00017772632213894363, 'weight_decay': 7.896458161786843e-08, 'epochs': 106, 'loss': 'mae', 'optimizer': 'adam', 'use_snp_selection': False, 'n_pcs': 2000}. Best is trial 54 with value: 0.2087603246140576.
2026-06-01 14:45:31 | INFO | Trial 62 | outer=11 | hidden=[512, 256] epochs=64 lr=1.997e-04 wd=4.682e-06 n_pcs=1500 weight={'name': 'uniform'}
[I 2026-06-01 14:45:34,521] Trial 62 finished with value: 0.19782973244248486 and parameters: {'hidden_dims': '[512, 256]', 'dropout': 0.4300130914398936, 'batch_norm': False, 'lr': 0.00019968627068631478, 'weight_decay': 4.6823343066008705e-06, 'epochs': 64, 'loss': 'mae', 'optimizer': 'adam', 'use_snp_selection': False, 'n_pcs': 1500}. Best is trial 54 with value: 0.2087603246140576.
2026-06-01 14:45:34 | INFO | Trial 63 | outer=11 | hidden=[512, 256] epochs=141 lr=1.617e-04 wd=3.571e-07 n_pcs=2000 weight={'name': 'uniform'}
[I 2026-06-01 14:45:39,939] Trial 63 finished with value: 0.19281645394960764 and parameters: {'hidden_dims': '[512, 256]', 'dropout': 0.5155910656724361, 'batch_norm': False, 'lr': 0.0001616611225530383, 'weight_decay': 3.5709064960793106e-07, 'epochs': 141, 'loss': 'mae', 'optimizer': 'adam', 'use_snp_selection': False, 'n_pcs': 2000}. Best is trial 54 with value: 0.2087603246140576.
2026-06-01 14:45:39 | INFO | Trial 64 | outer=11 | hidden=[512, 256] epochs=81 lr=6.829e-05 wd=1.507e-08 n_pcs=1000 weight={'name': 'uniform'}
[I 2026-06-01 14:45:43,008] Trial 64 finished with value: 0.19043199709136632 and parameters: {'hidden_dims': '[512, 256]', 'dropout': 0.38733310292345896, 'batch_norm': False, 'lr': 6.829088155486936e-05, 'weight_decay': 1.5068354604415623e-08, 'epochs': 81, 'loss': 'mae', 'optimizer': 'adam', 'use_snp_selection': False, 'n_pcs': 1000}. Best is trial 54 with value: 0.2087603246140576.
2026-06-01 14:45:43 | INFO | Trial 65 | outer=11 | hidden=[256, 64] epochs=101 lr=2.407e-04 wd=4.535e-08 n_pcs=2500 weight={'name': 'uniform'}
[I 2026-06-01 14:45:46,370] Trial 65 finished with value: 0.18512406104967039 and parameters: {'hidden_dims': '[256, 64]', 'dropout': 0.5158720301843381, 'batch_norm': False, 'lr': 0.0002406952872603662, 'weight_decay': 4.534687297649411e-08, 'epochs': 101, 'loss': 'mae', 'optimizer': 'adam', 'use_snp_selection': False, 'n_pcs': 2500}. Best is trial 54 with value: 0.2087603246140576.
2026-06-01 14:45:46 | INFO | Trial 66 | outer=11 | hidden=[512, 256] epochs=95 lr=2.980e-04 wd=1.183e-06 n_pcs=2000 weight={'name': 'uniform'}
[I 2026-06-01 14:45:50,611] Trial 66 finished with value: 0.1895409887192097 and parameters: {'hidden_dims': '[512, 256]', 'dropout': 0.3589080720222767, 'batch_norm': False, 'lr': 0.0002980339107093398, 'weight_decay': 1.183226468328106e-06, 'epochs': 95, 'loss': 'mae', 'optimizer': 'adam', 'use_snp_selection': False, 'n_pcs': 2000}. Best is trial 54 with value: 0.2087603246140576.
2026-06-01 14:45:50 | INFO | Trial 67 | outer=11 | hidden=[256, 64] epochs=111 lr=5.733e-05 wd=2.112e-06 n_pcs=2500 weight={'name': 'uniform'}
[I 2026-06-01 14:45:53,059] Trial 67 pruned. 
2026-06-01 14:45:53 | INFO | Trial 68 | outer=11 | hidden=[512, 256] epochs=125 lr=1.436e-04 wd=1.732e-05 n_pcs=1500 weight={'name': 'uniform'}
[I 2026-06-01 14:45:57,512] Trial 68 finished with value: 0.1747435050707688 and parameters: {'hidden_dims': '[512, 256]', 'dropout': 0.4423652498122381, 'batch_norm': False, 'lr': 0.0001435648406393183, 'weight_decay': 1.7318952141264286e-05, 'epochs': 125, 'loss': 'mae', 'optimizer': 'adam', 'use_snp_selection': False, 'n_pcs': 1500}. Best is trial 54 with value: 0.2087603246140576.
2026-06-01 14:45:57 | INFO | Trial 69 | outer=11 | hidden=[256, 128] epochs=188 lr=9.447e-05 wd=9.232e-08 n_pcs=1000 weight={'name': 'uniform'}
[I 2026-06-01 14:46:01,462] Trial 69 finished with value: 0.20140326789878787 and parameters: {'hidden_dims': '[256, 128]', 'dropout': 0.281776256208506, 'batch_norm': False, 'lr': 9.447463928974743e-05, 'weight_decay': 9.232044009571708e-08, 'epochs': 188, 'loss': 'mae', 'optimizer': 'adamw', 'use_snp_selection': False, 'n_pcs': 1000}. Best is trial 54 with value: 0.2087603246140576.
2026-06-01 14:46:01 | INFO | Trial 70 | outer=11 | hidden=[256, 128] epochs=206 lr=7.439e-05 wd=2.675e-08 n_pcs=500 weight={'name': 'uniform'}
[I 2026-06-01 14:46:05,616] Trial 70 finished with value: 0.18059897057717794 and parameters: {'hidden_dims': '[256, 128]', 'dropout': 0.323902137291878, 'batch_norm': False, 'lr': 7.438983499847405e-05, 'weight_decay': 2.6751354329599783e-08, 'epochs': 206, 'loss': 'mse', 'optimizer': 'adamw', 'use_snp_selection': False, 'n_pcs': 500}. Best is trial 54 with value: 0.2087603246140576.
2026-06-01 14:46:05 | INFO | Trial 71 | outer=11 | hidden=[256, 128] epochs=187 lr=8.814e-05 wd=8.041e-08 n_pcs=1000 weight={'name': 'uniform'}
[I 2026-06-01 14:46:09,538] Trial 71 finished with value: 0.17454071232530127 and parameters: {'hidden_dims': '[256, 128]', 'dropout': 0.291194613134998, 'batch_norm': False, 'lr': 8.814281418444043e-05, 'weight_decay': 8.040726455520784e-08, 'epochs': 187, 'loss': 'mae', 'optimizer': 'adamw', 'use_snp_selection': False, 'n_pcs': 1000}. Best is trial 54 with value: 0.2087603246140576.
2026-06-01 14:46:09 | INFO | Trial 72 | outer=11 | hidden=[256, 128] epochs=153 lr=1.160e-04 wd=4.256e-08 n_pcs=1000 weight={'name': 'uniform'}
[I 2026-06-01 14:46:13,057] Trial 72 finished with value: 0.2100215564874496 and parameters: {'hidden_dims': '[256, 128]', 'dropout': 0.24971964493030893, 'batch_norm': False, 'lr': 0.00011601875880696172, 'weight_decay': 4.255517746267803e-08, 'epochs': 153, 'loss': 'mae', 'optimizer': 'adamw', 'use_snp_selection': False, 'n_pcs': 1000}. Best is trial 72 with value: 0.2100215564874496.
2026-06-01 14:46:13 | INFO | Trial 73 | outer=11 | hidden=[256, 128] epochs=149 lr=1.167e-04 wd=4.326e-08 n_pcs=1500 weight={'name': 'uniform'}
[I 2026-06-01 14:46:16,582] Trial 73 finished with value: 0.18543554825050462 and parameters: {'hidden_dims': '[256, 128]', 'dropout': 0.2520820255706301, 'batch_norm': False, 'lr': 0.00011670790563651094, 'weight_decay': 4.3256309642062736e-08, 'epochs': 149, 'loss': 'mae', 'optimizer': 'adamw', 'use_snp_selection': False, 'n_pcs': 1500}. Best is trial 72 with value: 0.2100215564874496.
2026-06-01 14:46:16 | INFO | Trial 74 | outer=11 | hidden=[256, 128] epochs=161 lr=1.008e-04 wd=2.142e-08 n_pcs=1500 weight={'name': 'uniform'}
[I 2026-06-01 14:46:20,256] Trial 74 finished with value: 0.18254819640091532 and parameters: {'hidden_dims': '[256, 128]', 'dropout': 0.2775173503535323, 'batch_norm': False, 'lr': 0.00010079401656128434, 'weight_decay': 2.141932154900494e-08, 'epochs': 161, 'loss': 'mae', 'optimizer': 'adamw', 'use_snp_selection': False, 'n_pcs': 1500}. Best is trial 72 with value: 0.2100215564874496.
2026-06-01 14:46:20 | INFO | Trial 75 | outer=11 | hidden=[256, 128] epochs=187 lr=7.925e-05 wd=1.275e-08 n_pcs=1000 weight={'name': 'uniform'}
[I 2026-06-01 14:46:24,193] Trial 75 finished with value: 0.16646911933850128 and parameters: {'hidden_dims': '[256, 128]', 'dropout': 0.1720808134698944, 'batch_norm': False, 'lr': 7.925363919682608e-05, 'weight_decay': 1.2753101923359552e-08, 'epochs': 187, 'loss': 'mae', 'optimizer': 'adamw', 'use_snp_selection': False, 'n_pcs': 1000}. Best is trial 72 with value: 0.2100215564874496.
2026-06-01 14:46:24 | INFO | Trial 76 | outer=11 | hidden=[256, 128] epochs=179 lr=6.187e-05 wd=1.447e-07 n_pcs=2500 weight={'name': 'uniform'}
[I 2026-06-01 14:46:28,795] Trial 76 finished with value: 0.18393698255154775 and parameters: {'hidden_dims': '[256, 128]', 'dropout': 0.21763546756904412, 'batch_norm': False, 'lr': 6.187329407459811e-05, 'weight_decay': 1.4474558975210473e-07, 'epochs': 179, 'loss': 'mae', 'optimizer': 'adamw', 'use_snp_selection': False, 'n_pcs': 2500}. Best is trial 72 with value: 0.2100215564874496.
2026-06-01 14:46:28 | INFO | Trial 77 | outer=11 | hidden=[256, 64] epochs=169 lr=3.361e-05 wd=1.915e-07 n_pcs=2000 weight={'name': 'uniform'}
[I 2026-06-01 14:46:31,557] Trial 77 pruned. 
2026-06-01 14:46:31 | INFO | Trial 78 | outer=11 | hidden=[512, 128] epochs=156 lr=4.822e-05 wd=8.208e-08 n_pcs=500 weight={'name': 'uniform'}
[I 2026-06-01 14:46:33,676] Trial 78 pruned. 
2026-06-01 14:46:33 | INFO | Trial 79 | outer=11 | hidden=[256, 128] epochs=141 lr=9.303e-05 wd=3.643e-08 n_pcs=2000 weight={'name': 'uniform'}
[I 2026-06-01 14:46:37,329] Trial 79 finished with value: 0.1906364600855778 and parameters: {'hidden_dims': '[256, 128]', 'dropout': 0.2022454629620877, 'batch_norm': False, 'lr': 9.302841371895267e-05, 'weight_decay': 3.643060869830721e-08, 'epochs': 141, 'loss': 'mae', 'optimizer': 'adamw', 'use_snp_selection': False, 'n_pcs': 2000}. Best is trial 72 with value: 0.2100215564874496.
2026-06-01 14:46:37 | INFO | Trial 80 | outer=11 | hidden=[128, 64] epochs=156 lr=1.244e-05 wd=2.802e-04 n_pcs=1000 weight={'name': 'uniform'}
[I 2026-06-01 14:46:39,494] Trial 80 pruned. 
2026-06-01 14:46:39 | INFO | Trial 81 | outer=11 | hidden=[1024, 256] epochs=96 lr=1.703e-04 wd=6.110e-07 n_pcs=1000 weight={'name': 'uniform'}
[I 2026-06-01 14:46:44,153] Trial 81 finished with value: 0.17464114083803983 and parameters: {'hidden_dims': '[1024, 256]', 'dropout': 0.2697941422812926, 'batch_norm': False, 'lr': 0.00017033693645278675, 'weight_decay': 6.110264044761081e-07, 'epochs': 96, 'loss': 'mae', 'optimizer': 'adamw', 'use_snp_selection': False, 'n_pcs': 1000}. Best is trial 72 with value: 0.2100215564874496.
2026-06-01 14:46:44 | INFO | Trial 82 | outer=11 | hidden=[256, 64] epochs=174 lr=1.344e-04 wd=8.841e-07 n_pcs=1000 weight={'name': 'uniform'}
[I 2026-06-01 14:46:47,958] Trial 82 finished with value: 0.18127414588514013 and parameters: {'hidden_dims': '[256, 64]', 'dropout': 0.338891849631886, 'batch_norm': False, 'lr': 0.00013435793336612776, 'weight_decay': 8.841281893039427e-07, 'epochs': 174, 'loss': 'mae', 'optimizer': 'adam', 'use_snp_selection': False, 'n_pcs': 1000}. Best is trial 72 with value: 0.2100215564874496.
2026-06-01 14:46:47 | INFO | Trial 83 | outer=11 | hidden=[512, 256] epochs=252 lr=1.126e-04 wd=3.695e-06 n_pcs=500 weight={'name': 'uniform'}
[I 2026-06-01 14:46:52,864] Trial 83 finished with value: 0.16752693723650836 and parameters: {'hidden_dims': '[512, 256]', 'dropout': 0.24982845545620389, 'batch_norm': False, 'lr': 0.00011260805843176121, 'weight_decay': 3.6950907716958148e-06, 'epochs': 252, 'loss': 'mae', 'optimizer': 'adamw', 'use_snp_selection': False, 'n_pcs': 500}. Best is trial 72 with value: 0.2100215564874496.
2026-06-01 14:46:52 | INFO | Trial 84 | outer=11 | hidden=[1024, 256] epochs=137 lr=2.019e-04 wd=1.031e-07 n_pcs=1000 weight={'name': 'uniform'}
[I 2026-06-01 14:46:58,806] Trial 84 finished with value: 0.18855416565231625 and parameters: {'hidden_dims': '[1024, 256]', 'dropout': 0.16999987923437163, 'batch_norm': False, 'lr': 0.00020186180732107583, 'weight_decay': 1.0307655582742655e-07, 'epochs': 137, 'loss': 'mae', 'optimizer': 'adamw', 'use_snp_selection': False, 'n_pcs': 1000}. Best is trial 72 with value: 0.2100215564874496.
2026-06-01 14:46:58 | INFO | Trial 85 | outer=11 | hidden=[256, 64] epochs=214 lr=4.598e-04 wd=2.784e-08 n_pcs=2000 weight={'name': 'uniform'}
[I 2026-06-01 14:47:03,365] Trial 85 finished with value: 0.19443441081972854 and parameters: {'hidden_dims': '[256, 64]', 'dropout': 0.4082018201546954, 'batch_norm': False, 'lr': 0.0004598352128314708, 'weight_decay': 2.7838841647433158e-08, 'epochs': 214, 'loss': 'mae', 'optimizer': 'adam', 'use_snp_selection': False, 'n_pcs': 2000}. Best is trial 72 with value: 0.2100215564874496.
2026-06-01 14:47:03 | INFO | Trial 86 | outer=11 | hidden=[256, 128] epochs=116 lr=3.739e-04 wd=1.238e-06 n_pcs=1500 weight={'name': 'uniform'}
[I 2026-06-01 14:47:05,573] Trial 86 pruned. 
2026-06-01 14:47:05 | INFO | Trial 87 | outer=11 | hidden=[1024, 256] epochs=193 lr=1.242e-04 wd=1.738e-06 n_pcs=1500 weight={'name': 'uniform'}
[I 2026-06-01 14:47:14,987] Trial 87 finished with value: 0.19997759494985407 and parameters: {'hidden_dims': '[1024, 256]', 'dropout': 0.4786656991861696, 'batch_norm': False, 'lr': 0.0001241649547925059, 'weight_decay': 1.7384566488788355e-06, 'epochs': 193, 'loss': 'mae', 'optimizer': 'adam', 'use_snp_selection': False, 'n_pcs': 1500}. Best is trial 72 with value: 0.2100215564874496.
2026-06-01 14:47:15 | INFO | Trial 88 | outer=11 | hidden=[1024, 256] epochs=197 lr=1.245e-04 wd=1.629e-04 n_pcs=1500 weight={'name': 'uniform'}
[I 2026-06-01 14:47:24,518] Trial 88 finished with value: 0.19489614258898266 and parameters: {'hidden_dims': '[1024, 256]', 'dropout': 0.4817719104805826, 'batch_norm': False, 'lr': 0.00012449984933556122, 'weight_decay': 0.00016290661901219544, 'epochs': 197, 'loss': 'mae', 'optimizer': 'adamw', 'use_snp_selection': False, 'n_pcs': 1500}. Best is trial 72 with value: 0.2100215564874496.
2026-06-01 14:47:24 | INFO | Trial 89 | outer=11 | hidden=[1024, 256] epochs=227 lr=1.037e-04 wd=5.886e-08 n_pcs=2000 weight={'name': 'uniform'}
[I 2026-06-01 14:47:37,835] Trial 89 finished with value: 0.19695102038935336 and parameters: {'hidden_dims': '[1024, 256]', 'dropout': 0.508858123621141, 'batch_norm': False, 'lr': 0.00010369864575378176, 'weight_decay': 5.886251066151294e-08, 'epochs': 227, 'loss': 'mae', 'optimizer': 'adam', 'use_snp_selection': False, 'n_pcs': 2000}. Best is trial 72 with value: 0.2100215564874496.
2026-06-01 14:47:37 | INFO | Trial 90 | outer=11 | hidden=[1024, 256] epochs=188 lr=2.490e-04 wd=3.718e-07 n_pcs=1500 weight={'name': 'uniform'}
[I 2026-06-01 14:47:47,014] Trial 90 finished with value: 0.18442289149255223 and parameters: {'hidden_dims': '[1024, 256]', 'dropout': 0.2921531245590187, 'batch_norm': False, 'lr': 0.0002490010231841659, 'weight_decay': 3.71754482001774e-07, 'epochs': 188, 'loss': 'mse', 'optimizer': 'adamw', 'use_snp_selection': False, 'n_pcs': 1500}. Best is trial 72 with value: 0.2100215564874496.
2026-06-01 14:47:47 | INFO | Trial 91 | outer=11 | hidden=[1024, 256] epochs=206 lr=1.855e-04 wd=1.661e-06 n_pcs=1000 weight={'name': 'uniform'}
