[I 2026-06-01 13:24:25,557] Trial 123 finished with value: 0.20151088678273968 and parameters: {'hidden_dims': '[1024, 256]', 'dropout': 0.18425815991648828, 'batch_norm': False, 'lr': 0.0001510067786493227, 'weight_decay': 2.0840517044717544e-06, 'epochs': 118, 'loss': 'mae', 'optimizer': 'adam', 'use_snp_selection': False, 'n_pcs': 5000}. Best is trial 78 with value: 0.22255274480452733.
2026-06-01 13:24:25 | INFO | Trial 124 | outer=6 | hidden=[1024, 256] epochs=127 lr=1.053e-04 wd=2.699e-06 n_pcs=5000 weight={'name': 'uniform'}
[I 2026-06-01 13:24:38,451] Trial 124 finished with value: 0.189212734825481 and parameters: {'hidden_dims': '[1024, 256]', 'dropout': 0.16476523934830317, 'batch_norm': False, 'lr': 0.00010533186094975521, 'weight_decay': 2.6993480633464997e-06, 'epochs': 127, 'loss': 'mae', 'optimizer': 'adam', 'use_snp_selection': False, 'n_pcs': 5000}. Best is trial 78 with value: 0.22255274480452733.
2026-06-01 13:24:38 | INFO | Trial 125 | outer=6 | hidden=[1024, 256] epochs=132 lr=1.843e-04 wd=5.514e-07 n_pcs=4500 weight={'name': 'uniform'}
[I 2026-06-01 13:24:50,986] Trial 125 finished with value: 0.19774671873053887 and parameters: {'hidden_dims': '[1024, 256]', 'dropout': 0.125012592562543, 'batch_norm': False, 'lr': 0.00018434457777470622, 'weight_decay': 5.513746211445237e-07, 'epochs': 132, 'loss': 'mae', 'optimizer': 'adam', 'use_snp_selection': False, 'n_pcs': 4500}. Best is trial 78 with value: 0.22255274480452733.
2026-06-01 13:24:51 | INFO | Trial 126 | outer=6 | hidden=[1024, 256] epochs=113 lr=7.895e-05 wd=1.691e-06 n_pcs=5000 weight={'name': 'uniform'}
[I 2026-06-01 13:25:02,711] Trial 126 finished with value: 0.18076747402686838 and parameters: {'hidden_dims': '[1024, 256]', 'dropout': 0.14622550698979894, 'batch_norm': False, 'lr': 7.894918468192937e-05, 'weight_decay': 1.69117662582447e-06, 'epochs': 113, 'loss': 'mae', 'optimizer': 'adam', 'use_snp_selection': False, 'n_pcs': 5000}. Best is trial 78 with value: 0.22255274480452733.
2026-06-01 13:25:02 | INFO | Trial 127 | outer=6 | hidden=[1024, 256] epochs=123 lr=1.214e-04 wd=3.168e-06 n_pcs=4000 weight={'name': 'uniform'}
[I 2026-06-01 13:25:13,549] Trial 127 finished with value: 0.19396861878835675 and parameters: {'hidden_dims': '[1024, 256]', 'dropout': 0.11521191663206898, 'batch_norm': False, 'lr': 0.00012138385268267393, 'weight_decay': 3.1683846969966808e-06, 'epochs': 123, 'loss': 'mae', 'optimizer': 'adam', 'use_snp_selection': False, 'n_pcs': 4000}. Best is trial 78 with value: 0.22255274480452733.
2026-06-01 13:25:13 | INFO | Trial 128 | outer=6 | hidden=[1024, 256] epochs=173 lr=3.151e-04 wd=4.194e-06 n_pcs=4500 weight={'name': 'uniform'}
[I 2026-06-01 13:25:29,262] Trial 128 finished with value: 0.21225003257639555 and parameters: {'hidden_dims': '[1024, 256]', 'dropout': 0.13637800274618406, 'batch_norm': False, 'lr': 0.00031514773805075267, 'weight_decay': 4.194239937902425e-06, 'epochs': 173, 'loss': 'mae', 'optimizer': 'adam', 'use_snp_selection': False, 'n_pcs': 4500}. Best is trial 78 with value: 0.22255274480452733.
2026-06-01 13:25:29 | INFO | Trial 129 | outer=6 | hidden=[1024, 256] epochs=91 lr=3.081e-04 wd=7.652e-06 n_pcs=4500 weight={'name': 'uniform'}
[I 2026-06-01 13:25:38,607] Trial 129 finished with value: 0.18452947949360957 and parameters: {'hidden_dims': '[1024, 256]', 'dropout': 0.05023165820960736, 'batch_norm': False, 'lr': 0.0003081179026950669, 'weight_decay': 7.651575176079039e-06, 'epochs': 91, 'loss': 'mae', 'optimizer': 'adam', 'use_snp_selection': False, 'n_pcs': 4500}. Best is trial 78 with value: 0.22255274480452733.
2026-06-01 13:25:38 | INFO | Trial 130 | outer=6 | hidden=[512, 128] epochs=174 lr=3.704e-04 wd=3.554e-06 n_pcs=4500 weight={'name': 'uniform'}
[I 2026-06-01 13:25:47,724] Trial 130 finished with value: 0.20795974392476707 and parameters: {'hidden_dims': '[512, 128]', 'dropout': 0.137135868969233, 'batch_norm': False, 'lr': 0.00037041448946814246, 'weight_decay': 3.5539596658507623e-06, 'epochs': 174, 'loss': 'mae', 'optimizer': 'adam', 'use_snp_selection': False, 'n_pcs': 4500}. Best is trial 78 with value: 0.22255274480452733.
2026-06-01 13:25:47 | INFO | Trial 131 | outer=6 | hidden=[512, 128] epochs=174 lr=3.744e-04 wd=4.120e-06 n_pcs=4500 weight={'name': 'uniform'}
[I 2026-06-01 13:25:56,852] Trial 131 finished with value: 0.21109996037030204 and parameters: {'hidden_dims': '[512, 128]', 'dropout': 0.1488600818008504, 'batch_norm': False, 'lr': 0.0003744073519385227, 'weight_decay': 4.1204054902194906e-06, 'epochs': 174, 'loss': 'mae', 'optimizer': 'adam', 'use_snp_selection': False, 'n_pcs': 4500}. Best is trial 78 with value: 0.22255274480452733.
2026-06-01 13:25:56 | INFO | Trial 132 | outer=6 | hidden=[512, 128] epochs=172 lr=2.611e-04 wd=9.479e-07 n_pcs=4500 weight={'name': 'uniform'}
[I 2026-06-01 13:26:05,907] Trial 132 finished with value: 0.19142218633381172 and parameters: {'hidden_dims': '[512, 128]', 'dropout': 0.13384641831619573, 'batch_norm': False, 'lr': 0.00026110865281581065, 'weight_decay': 9.479200136522821e-07, 'epochs': 172, 'loss': 'mae', 'optimizer': 'adam', 'use_snp_selection': False, 'n_pcs': 4500}. Best is trial 78 with value: 0.22255274480452733.
2026-06-01 13:26:05 | INFO | Trial 133 | outer=6 | hidden=[512, 128] epochs=174 lr=3.599e-04 wd=3.961e-06 n_pcs=4000 weight={'name': 'uniform'}
[I 2026-06-01 13:26:14,257] Trial 133 finished with value: 0.19465999448692275 and parameters: {'hidden_dims': '[512, 128]', 'dropout': 0.10728739464489832, 'batch_norm': False, 'lr': 0.00035990458050149456, 'weight_decay': 3.9613207867602336e-06, 'epochs': 174, 'loss': 'mae', 'optimizer': 'adam', 'use_snp_selection': False, 'n_pcs': 4000}. Best is trial 78 with value: 0.22255274480452733.
2026-06-01 13:26:14 | INFO | Trial 134 | outer=6 | hidden=[512, 128] epochs=186 lr=3.720e-04 wd=2.995e-06 n_pcs=4500 weight={'name': 'uniform'}
[I 2026-06-01 13:26:23,855] Trial 134 finished with value: 0.19602500082049806 and parameters: {'hidden_dims': '[512, 128]', 'dropout': 0.15057332192026446, 'batch_norm': False, 'lr': 0.00037202433246834744, 'weight_decay': 2.99509500614899e-06, 'epochs': 186, 'loss': 'mae', 'optimizer': 'adam', 'use_snp_selection': False, 'n_pcs': 4500}. Best is trial 78 with value: 0.22255274480452733.
2026-06-01 13:26:23 | INFO | Trial 135 | outer=6 | hidden=[512, 128] epochs=159 lr=3.384e-04 wd=4.790e-06 n_pcs=4500 weight={'name': 'uniform'}
[I 2026-06-01 13:26:32,371] Trial 135 finished with value: 0.1935842327312718 and parameters: {'hidden_dims': '[512, 128]', 'dropout': 0.16953630138891748, 'batch_norm': False, 'lr': 0.00033844833807281457, 'weight_decay': 4.789879348327011e-06, 'epochs': 159, 'loss': 'mae', 'optimizer': 'adam', 'use_snp_selection': False, 'n_pcs': 4500}. Best is trial 78 with value: 0.22255274480452733.
2026-06-01 13:26:32 | INFO | Trial 136 | outer=6 | hidden=[512, 128] epochs=189 lr=2.819e-04 wd=1.778e-06 n_pcs=4500 weight={'name': 'uniform'}
[I 2026-06-01 13:26:42,098] Trial 136 finished with value: 0.18873612641850293 and parameters: {'hidden_dims': '[512, 128]', 'dropout': 0.13961215195864443, 'batch_norm': False, 'lr': 0.00028191565211768444, 'weight_decay': 1.777692180656156e-06, 'epochs': 189, 'loss': 'mae', 'optimizer': 'adam', 'use_snp_selection': False, 'n_pcs': 4500}. Best is trial 78 with value: 0.22255274480452733.
2026-06-01 13:26:42 | INFO | Trial 137 | outer=6 | hidden=[512, 128] epochs=182 lr=3.801e-04 wd=3.514e-06 n_pcs=4500 weight={'name': 'uniform'}
[I 2026-06-01 13:26:51,558] Trial 137 finished with value: 0.18950275266235045 and parameters: {'hidden_dims': '[512, 128]', 'dropout': 0.08993863939076711, 'batch_norm': False, 'lr': 0.0003801228618906997, 'weight_decay': 3.5142371322080336e-06, 'epochs': 182, 'loss': 'mae', 'optimizer': 'adam', 'use_snp_selection': False, 'n_pcs': 4500}. Best is trial 78 with value: 0.22255274480452733.
2026-06-01 13:26:51 | INFO | Trial 138 | outer=6 | hidden=[1024, 256] epochs=225 lr=2.161e-04 wd=6.350e-06 n_pcs=4500 weight={'name': 'uniform'}
[I 2026-06-01 13:27:11,324] Trial 138 finished with value: 0.2009941633077576 and parameters: {'hidden_dims': '[1024, 256]', 'dropout': 0.11876302684963377, 'batch_norm': False, 'lr': 0.00021609676709257754, 'weight_decay': 6.349972474858301e-06, 'epochs': 225, 'loss': 'mae', 'optimizer': 'adam', 'use_snp_selection': False, 'n_pcs': 4500}. Best is trial 78 with value: 0.22255274480452733.
2026-06-01 13:27:11 | INFO | Trial 139 | outer=6 | hidden=[1024, 256] epochs=165 lr=3.269e-04 wd=2.599e-06 n_pcs=4000 weight={'name': 'uniform'}
[I 2026-06-01 13:27:25,112] Trial 139 finished with value: 0.21434339967284238 and parameters: {'hidden_dims': '[1024, 256]', 'dropout': 0.1791237914554138, 'batch_norm': False, 'lr': 0.00032690528347037863, 'weight_decay': 2.598535666102319e-06, 'epochs': 165, 'loss': 'mae', 'optimizer': 'adam', 'use_snp_selection': False, 'n_pcs': 4000}. Best is trial 78 with value: 0.22255274480452733.
2026-06-01 13:27:25 | INFO | Trial 140 | outer=6 | hidden=[1024, 256] epochs=179 lr=2.983e-04 wd=2.437e-06 n_pcs=4000 weight={'name': 'uniform'}
[I 2026-06-01 13:27:39,878] Trial 140 finished with value: 0.19937272134917927 and parameters: {'hidden_dims': '[1024, 256]', 'dropout': 0.18188252081697237, 'batch_norm': False, 'lr': 0.00029828420366551594, 'weight_decay': 2.4374400680353605e-06, 'epochs': 179, 'loss': 'mae', 'optimizer': 'adam', 'use_snp_selection': False, 'n_pcs': 4000}. Best is trial 78 with value: 0.22255274480452733.
2026-06-01 13:27:39 | INFO | Trial 141 | outer=6 | hidden=[1024, 256] epochs=168 lr=3.189e-04 wd=4.559e-06 n_pcs=4500 weight={'name': 'uniform'}
[I 2026-06-01 13:27:55,196] Trial 141 finished with value: 0.20079533166095512 and parameters: {'hidden_dims': '[1024, 256]', 'dropout': 0.15891654626275026, 'batch_norm': False, 'lr': 0.0003189091256411892, 'weight_decay': 4.558991830683303e-06, 'epochs': 168, 'loss': 'mae', 'optimizer': 'adam', 'use_snp_selection': False, 'n_pcs': 4500}. Best is trial 78 with value: 0.22255274480452733.
2026-06-01 13:27:55 | INFO | Trial 142 | outer=6 | hidden=[1024, 256] epochs=157 lr=3.422e-04 wd=2.099e-06 n_pcs=3500 weight={'name': 'uniform'}
[I 2026-06-01 13:28:07,349] Trial 142 finished with value: 0.18852612747614078 and parameters: {'hidden_dims': '[1024, 256]', 'dropout': 0.1307130748400677, 'batch_norm': False, 'lr': 0.00034219490798560227, 'weight_decay': 2.099316007577122e-06, 'epochs': 157, 'loss': 'mae', 'optimizer': 'adam', 'use_snp_selection': False, 'n_pcs': 3500}. Best is trial 78 with value: 0.22255274480452733.
2026-06-01 13:28:07 | INFO | Trial 143 | outer=6 | hidden=[1024, 256] epochs=179 lr=4.300e-04 wd=1.574e-06 n_pcs=4000 weight={'name': 'uniform'}
[I 2026-06-01 13:28:22,129] Trial 143 finished with value: 0.1982771675018541 and parameters: {'hidden_dims': '[1024, 256]', 'dropout': 0.14667174251222356, 'batch_norm': False, 'lr': 0.000430004404464183, 'weight_decay': 1.5739391293931533e-06, 'epochs': 179, 'loss': 'mae', 'optimizer': 'adam', 'use_snp_selection': False, 'n_pcs': 4000}. Best is trial 78 with value: 0.22255274480452733.
2026-06-01 13:28:22 | INFO | Trial 144 | outer=6 | hidden=[512, 128] epochs=163 lr=2.704e-04 wd=2.711e-06 n_pcs=4500 weight={'name': 'uniform'}
[I 2026-06-01 13:28:30,816] Trial 144 finished with value: 0.20699419077873057 and parameters: {'hidden_dims': '[512, 128]', 'dropout': 0.22487320042516645, 'batch_norm': False, 'lr': 0.0002704067740213242, 'weight_decay': 2.7114628671572164e-06, 'epochs': 163, 'loss': 'mae', 'optimizer': 'adam', 'use_snp_selection': False, 'n_pcs': 4500}. Best is trial 78 with value: 0.22255274480452733.
2026-06-01 13:28:30 | INFO | Trial 145 | outer=6 | hidden=[512, 128] epochs=166 lr=2.747e-04 wd=3.073e-06 n_pcs=4500 weight={'name': 'uniform'}
[I 2026-06-01 13:28:39,629] Trial 145 finished with value: 0.20906341133038361 and parameters: {'hidden_dims': '[512, 128]', 'dropout': 0.2154664976315328, 'batch_norm': False, 'lr': 0.00027467106936386886, 'weight_decay': 3.073212355190641e-06, 'epochs': 166, 'loss': 'mae', 'optimizer': 'adam', 'use_snp_selection': False, 'n_pcs': 4500}. Best is trial 78 with value: 0.22255274480452733.
2026-06-01 13:28:39 | INFO | Trial 146 | outer=6 | hidden=[512, 128] epochs=164 lr=2.669e-04 wd=9.568e-07 n_pcs=4500 weight={'name': 'uniform'}
[I 2026-06-01 13:28:48,340] Trial 146 finished with value: 0.20032268805776837 and parameters: {'hidden_dims': '[512, 128]', 'dropout': 0.23128759892748865, 'batch_norm': False, 'lr': 0.00026688844084744146, 'weight_decay': 9.567548221534573e-07, 'epochs': 164, 'loss': 'mae', 'optimizer': 'adam', 'use_snp_selection': False, 'n_pcs': 4500}. Best is trial 78 with value: 0.22255274480452733.
2026-06-01 13:28:48 | INFO | Trial 147 | outer=6 | hidden=[512, 128] epochs=195 lr=2.391e-04 wd=2.885e-06 n_pcs=4000 weight={'name': 'uniform'}
[I 2026-06-01 13:28:57,446] Trial 147 finished with value: 0.21002079209599733 and parameters: {'hidden_dims': '[512, 128]', 'dropout': 0.17374481207498893, 'batch_norm': False, 'lr': 0.00023910099210673141, 'weight_decay': 2.8847888759210262e-06, 'epochs': 195, 'loss': 'mae', 'optimizer': 'adam', 'use_snp_selection': False, 'n_pcs': 4000}. Best is trial 78 with value: 0.22255274480452733.
2026-06-01 13:28:57 | INFO | Trial 148 | outer=6 | hidden=[512, 128] epochs=192 lr=2.383e-04 wd=2.790e-06 n_pcs=4000 weight={'name': 'uniform'}
[I 2026-06-01 13:29:06,438] Trial 148 finished with value: 0.19843108929918324 and parameters: {'hidden_dims': '[512, 128]', 'dropout': 0.21267809053679224, 'batch_norm': False, 'lr': 0.00023828589993878308, 'weight_decay': 2.7898185672482773e-06, 'epochs': 192, 'loss': 'mae', 'optimizer': 'adam', 'use_snp_selection': False, 'n_pcs': 4000}. Best is trial 78 with value: 0.22255274480452733.
2026-06-01 13:29:06 | INFO | Trial 149 | outer=6 | hidden=[512, 128] epochs=207 lr=2.105e-04 wd=8.871e-06 n_pcs=4000 weight={'name': 'uniform'}
[I 2026-06-01 13:29:15,996] Trial 149 finished with value: 0.1985472321782578 and parameters: {'hidden_dims': '[512, 128]', 'dropout': 0.20097412424735578, 'batch_norm': False, 'lr': 0.00021045443766235157, 'weight_decay': 8.870861551814603e-06, 'epochs': 207, 'loss': 'mae', 'optimizer': 'adam', 'use_snp_selection': False, 'n_pcs': 4000}. Best is trial 78 with value: 0.22255274480452733.
2026-06-01 13:29:15 | INFO | OUTER 6 best (inner mean r=0.2226): model={'hidden_dims': [512, 64], 'dropout': 0.17756710624281732, 'batch_norm': False, 'lr': 0.00024674418358631566, 'weight_decay': 0.00022524720279863895, 'epochs': 60, 'loss': 'mae', 'optimizer': 'adam', 'use_snp_selection': False, 'n_pcs': 5000} weighting={'name': 'uniform'}
2026-06-01 13:29:16 | INFO | OUTER 6 TEST r = 0.1365
2026-06-01 13:29:16 | INFO | OUTER 6 incremental summary saved to outputs/final_results/e8_pc_mlp_uniform/thr_wing/e8_pc_mlp_uniform_thr_wing_results.json
2026-06-01 13:29:16 | INFO | OUTER 7: test_size=349 island=6 (Indre Kvarøy)
2026-06-01 13:29:16 | INFO | OUTER 7: inner LOIO validation islands: 0(Nesøy), 1(Myken), 2(Træna), 3(Selvær), 4(Gjerøy), 5(Hestmannøy), 7(Onøy og Lurøy), 8(Lovund), 9(Sleneset), 10(Aldra), 11(Leka), 12(Vega), 13(Vikna), 14(Lauvøya)
2026-06-01 13:29:16 | INFO | OUTER 7: using top 10 related inner validation islands for tuning: 4(Gjerøy, avgGRM=0.0043), 7(Onøy og Lurøy, avgGRM=0.0042), 5(Hestmannøy, avgGRM=0.0039), 9(Sleneset, avgGRM=0.0038), 8(Lovund, avgGRM=0.0023), 0(Nesøy, avgGRM=0.0016), 2(Træna, avgGRM=0.0015), 1(Myken, avgGRM=0.0009), 3(Selvær, avgGRM=0.0005), 10(Aldra, avgGRM=-0.0026)
[I 2026-06-01 13:29:16,701] A new study created in memory with name: mlp_importance_inner_outer6
2026-06-01 13:29:16 | INFO | Trial 0 | outer=7 | hidden=[256, 64] epochs=252 lr=8.243e-05 wd=1.277e-07 n_pcs=1500 weight={'name': 'uniform'}
[I 2026-06-01 13:29:21,535] Trial 0 finished with value: 0.1743924989195555 and parameters: {'hidden_dims': '[256, 64]', 'dropout': 0.19097065492325918, 'batch_norm': False, 'lr': 8.242985198911028e-05, 'weight_decay': 1.277246473139888e-07, 'epochs': 252, 'loss': 'mae', 'optimizer': 'adamw', 'use_snp_selection': False, 'n_pcs': 1500}. Best is trial 0 with value: 0.1743924989195555.
2026-06-01 13:29:21 | INFO | Trial 1 | outer=7 | hidden=[1024, 256] epochs=225 lr=1.391e-04 wd=1.941e-07 n_pcs=500 weight={'name': 'uniform'}
[I 2026-06-01 13:29:27,908] Trial 1 finished with value: 0.1722088886051793 and parameters: {'hidden_dims': '[1024, 256]', 'dropout': 0.2849434595702811, 'batch_norm': False, 'lr': 0.00013909108684683413, 'weight_decay': 1.9407167964924495e-07, 'epochs': 225, 'loss': 'mse', 'optimizer': 'adamw', 'use_snp_selection': False, 'n_pcs': 500}. Best is trial 0 with value: 0.1743924989195555.
2026-06-01 13:29:27 | INFO | Trial 2 | outer=7 | hidden=[256, 64] epochs=139 lr=3.957e-05 wd=3.750e-05 n_pcs=2500 weight={'name': 'uniform'}
[I 2026-06-01 13:29:31,775] Trial 2 finished with value: 0.16479391283790237 and parameters: {'hidden_dims': '[256, 64]', 'dropout': 0.11392712587675291, 'batch_norm': False, 'lr': 3.9573351157697276e-05, 'weight_decay': 3.7502337000845044e-05, 'epochs': 139, 'loss': 'mae', 'optimizer': 'adam', 'use_snp_selection': False, 'n_pcs': 2500}. Best is trial 0 with value: 0.1743924989195555.
2026-06-01 13:29:31 | INFO | Trial 3 | outer=7 | hidden=[128, 64] epochs=164 lr=1.538e-05 wd=3.248e-06 n_pcs=3000 weight={'name': 'uniform'}
[I 2026-06-01 13:29:35,829] Trial 3 finished with value: 0.08880904774093021 and parameters: {'hidden_dims': '[128, 64]', 'dropout': 0.1479874991503876, 'batch_norm': False, 'lr': 1.5380732370316375e-05, 'weight_decay': 3.2478890969962294e-06, 'epochs': 164, 'loss': 'mse', 'optimizer': 'adam', 'use_snp_selection': False, 'n_pcs': 3000}. Best is trial 0 with value: 0.1743924989195555.
2026-06-01 13:29:35 | INFO | Trial 4 | outer=7 | hidden=[256, 128] epochs=210 lr=7.298e-05 wd=7.875e-06 n_pcs=3000 weight={'name': 'uniform'}
[I 2026-06-01 13:29:41,450] Trial 4 finished with value: 0.17765341382598515 and parameters: {'hidden_dims': '[256, 128]', 'dropout': 0.09917626474860408, 'batch_norm': False, 'lr': 7.298380589156323e-05, 'weight_decay': 7.875094299510188e-06, 'epochs': 210, 'loss': 'mae', 'optimizer': 'adam', 'use_snp_selection': False, 'n_pcs': 3000}. Best is trial 4 with value: 0.17765341382598515.
2026-06-01 13:29:41 | INFO | Trial 5 | outer=7 | hidden=[512, 128] epochs=284 lr=5.467e-05 wd=5.496e-06 n_pcs=4000 weight={'name': 'uniform'}
[I 2026-06-01 13:29:54,737] Trial 5 finished with value: 0.1603057578856903 and parameters: {'hidden_dims': '[512, 128]', 'dropout': 0.3143696126156032, 'batch_norm': False, 'lr': 5.46667545989349e-05, 'weight_decay': 5.496446859789657e-06, 'epochs': 284, 'loss': 'mse', 'optimizer': 'adamw', 'use_snp_selection': False, 'n_pcs': 4000}. Best is trial 4 with value: 0.17765341382598515.
2026-06-01 13:29:54 | INFO | Trial 6 | outer=7 | hidden=[512, 64] epochs=90 lr=3.103e-05 wd=6.607e-08 n_pcs=5000 weight={'name': 'uniform'}
[I 2026-06-01 13:29:58,553] Trial 6 pruned. 
2026-06-01 13:29:58 | INFO | Trial 7 | outer=7 | hidden=[128, 64] epochs=272 lr=1.348e-05 wd=1.075e-07 n_pcs=4000 weight={'name': 'uniform'}
[I 2026-06-01 13:30:01,886] Trial 7 pruned. 
2026-06-01 13:30:01 | INFO | Trial 8 | outer=7 | hidden=[128, 64] epochs=205 lr=1.815e-05 wd=5.764e-06 n_pcs=3000 weight={'name': 'uniform'}
[I 2026-06-01 13:30:04,635] Trial 8 pruned. 
2026-06-01 13:30:04 | INFO | Trial 9 | outer=7 | hidden=[128, 64] epochs=296 lr=2.338e-05 wd=1.066e-07 n_pcs=2500 weight={'name': 'uniform'}
[I 2026-06-01 13:30:10,380] Trial 9 finished with value: 0.1443093289512832 and parameters: {'hidden_dims': '[128, 64]', 'dropout': 0.17607378181405245, 'batch_norm': False, 'lr': 2.3379083621874488e-05, 'weight_decay': 1.0663581123617794e-07, 'epochs': 296, 'loss': 'mae', 'optimizer': 'adam', 'use_snp_selection': False, 'n_pcs': 2500}. Best is trial 4 with value: 0.17765341382598515.
2026-06-01 13:30:10 | INFO | Trial 10 | outer=7 | hidden=[256, 128] epochs=107 lr=3.984e-04 wd=9.453e-04 n_pcs=1500 weight={'name': 'uniform'}
[I 2026-06-01 13:30:13,408] Trial 10 finished with value: 0.16689540020156315 and parameters: {'hidden_dims': '[256, 128]', 'dropout': 0.02309895975550147, 'batch_norm': False, 'lr': 0.0003983594610602333, 'weight_decay': 0.0009452683165453212, 'epochs': 107, 'loss': 'mae', 'optimizer': 'adam', 'use_snp_selection': False, 'n_pcs': 1500}. Best is trial 4 with value: 0.17765341382598515.
2026-06-01 13:30:13 | INFO | Trial 11 | outer=7 | hidden=[512, 256] epochs=227 lr=1.123e-04 wd=5.581e-07 n_pcs=1500 weight={'name': 'uniform'}
[I 2026-06-01 13:30:19,932] Trial 11 finished with value: 0.18537283577327673 and parameters: {'hidden_dims': '[512, 256]', 'dropout': 0.0542741508625664, 'batch_norm': False, 'lr': 0.00011231773946990237, 'weight_decay': 5.58055131524289e-07, 'epochs': 227, 'loss': 'mae', 'optimizer': 'adamw', 'use_snp_selection': False, 'n_pcs': 1500}. Best is trial 11 with value: 0.18537283577327673.
2026-06-01 13:30:19 | INFO | Trial 12 | outer=7 | hidden=[512, 256] epochs=201 lr=1.886e-04 wd=6.135e-05 n_pcs=1500 weight={'name': 'uniform'}
[I 2026-06-01 13:30:25,900] Trial 12 finished with value: 0.1597704501946069 and parameters: {'hidden_dims': '[512, 256]', 'dropout': 0.027460674969453404, 'batch_norm': False, 'lr': 0.00018857345238962642, 'weight_decay': 6.134980726027285e-05, 'epochs': 201, 'loss': 'mae', 'optimizer': 'adamw', 'use_snp_selection': False, 'n_pcs': 1500}. Best is trial 11 with value: 0.18537283577327673.
2026-06-01 13:30:25 | INFO | Trial 13 | outer=7 | hidden=[256, 128] epochs=238 lr=1.041e-04 wd=9.167e-07 n_pcs=500 weight={'name': 'uniform'}
