[I 2026-06-01 13:42:21,943] Trial 98 finished with value: 0.19674215358450536 and parameters: {'hidden_dims': '[512, 64]', 'dropout': 0.0901441129337828, 'batch_norm': False, 'lr': 0.00028110224253036686, 'weight_decay': 1.760062029141591e-06, 'epochs': 105, 'loss': 'mae', 'optimizer': 'adam', 'use_snp_selection': False, 'n_pcs': 5000}. Best is trial 67 with value: 0.21274226476569685.
2026-06-01 13:42:21 | INFO | Trial 99 | outer=7 | hidden=[512, 64] epochs=147 lr=3.299e-04 wd=6.193e-07 n_pcs=5000 weight={'name': 'uniform'}
[I 2026-06-01 13:42:30,959] Trial 99 finished with value: 0.20842465924754605 and parameters: {'hidden_dims': '[512, 64]', 'dropout': 0.49884122918433293, 'batch_norm': False, 'lr': 0.0003298995932143343, 'weight_decay': 6.193366263454333e-07, 'epochs': 147, 'loss': 'mae', 'optimizer': 'adam', 'use_snp_selection': False, 'n_pcs': 5000}. Best is trial 67 with value: 0.21274226476569685.
2026-06-01 13:42:30 | INFO | Trial 100 | outer=7 | hidden=[512, 64] epochs=117 lr=3.453e-04 wd=5.314e-07 n_pcs=5000 weight={'name': 'uniform'}
[I 2026-06-01 13:42:38,612] Trial 100 finished with value: 0.2071773102116182 and parameters: {'hidden_dims': '[512, 64]', 'dropout': 0.5156269919070751, 'batch_norm': False, 'lr': 0.0003453472670099246, 'weight_decay': 5.313730839937704e-07, 'epochs': 117, 'loss': 'mae', 'optimizer': 'adam', 'use_snp_selection': False, 'n_pcs': 5000}. Best is trial 67 with value: 0.21274226476569685.
2026-06-01 13:42:38 | INFO | Trial 101 | outer=7 | hidden=[512, 64] epochs=113 lr=3.322e-04 wd=5.798e-07 n_pcs=5000 weight={'name': 'uniform'}
[I 2026-06-01 13:42:46,086] Trial 101 finished with value: 0.20336908376871893 and parameters: {'hidden_dims': '[512, 64]', 'dropout': 0.5179146335461601, 'batch_norm': False, 'lr': 0.0003322477537009157, 'weight_decay': 5.797529824240341e-07, 'epochs': 113, 'loss': 'mae', 'optimizer': 'adam', 'use_snp_selection': False, 'n_pcs': 5000}. Best is trial 67 with value: 0.21274226476569685.
2026-06-01 13:42:46 | INFO | Trial 102 | outer=7 | hidden=[512, 64] epochs=118 lr=3.263e-04 wd=5.871e-07 n_pcs=5000 weight={'name': 'uniform'}
[I 2026-06-01 13:42:53,789] Trial 102 finished with value: 0.19709965298716398 and parameters: {'hidden_dims': '[512, 64]', 'dropout': 0.5507628325618972, 'batch_norm': False, 'lr': 0.00032632865783588307, 'weight_decay': 5.870577646379185e-07, 'epochs': 118, 'loss': 'mae', 'optimizer': 'adam', 'use_snp_selection': False, 'n_pcs': 5000}. Best is trial 67 with value: 0.21274226476569685.
2026-06-01 13:42:53 | INFO | Trial 103 | outer=7 | hidden=[512, 64] epochs=98 lr=3.681e-04 wd=4.421e-07 n_pcs=5000 weight={'name': 'uniform'}
[I 2026-06-01 13:43:00,585] Trial 103 finished with value: 0.19549293893119024 and parameters: {'hidden_dims': '[512, 64]', 'dropout': 0.5163230589915588, 'batch_norm': False, 'lr': 0.00036810676449202084, 'weight_decay': 4.4212502989410534e-07, 'epochs': 98, 'loss': 'mae', 'optimizer': 'adam', 'use_snp_selection': False, 'n_pcs': 5000}. Best is trial 67 with value: 0.21274226476569685.
2026-06-01 13:43:00 | INFO | Trial 104 | outer=7 | hidden=[512, 64] epochs=91 lr=4.314e-04 wd=7.009e-07 n_pcs=5000 weight={'name': 'uniform'}
[I 2026-06-01 13:43:07,059] Trial 104 finished with value: 0.19957891128521016 and parameters: {'hidden_dims': '[512, 64]', 'dropout': 0.4924390577001917, 'batch_norm': False, 'lr': 0.0004313720034776344, 'weight_decay': 7.009290396506047e-07, 'epochs': 91, 'loss': 'mae', 'optimizer': 'adam', 'use_snp_selection': False, 'n_pcs': 5000}. Best is trial 67 with value: 0.21274226476569685.
2026-06-01 13:43:07 | INFO | Trial 105 | outer=7 | hidden=[512, 64] epochs=111 lr=3.120e-04 wd=2.307e-07 n_pcs=5000 weight={'name': 'uniform'}
[I 2026-06-01 13:43:14,444] Trial 105 finished with value: 0.19659610955536505 and parameters: {'hidden_dims': '[512, 64]', 'dropout': 0.5397259360302297, 'batch_norm': False, 'lr': 0.00031197520782376767, 'weight_decay': 2.306676842095185e-07, 'epochs': 111, 'loss': 'mae', 'optimizer': 'adam', 'use_snp_selection': False, 'n_pcs': 5000}. Best is trial 67 with value: 0.21274226476569685.
2026-06-01 13:43:14 | INFO | Trial 106 | outer=7 | hidden=[512, 64] epochs=104 lr=3.437e-04 wd=1.475e-06 n_pcs=5000 weight={'name': 'uniform'}
[I 2026-06-01 13:43:21,502] Trial 106 finished with value: 0.194566677722167 and parameters: {'hidden_dims': '[512, 64]', 'dropout': 0.5731093069485824, 'batch_norm': False, 'lr': 0.0003437222041801876, 'weight_decay': 1.4750855647024025e-06, 'epochs': 104, 'loss': 'mse', 'optimizer': 'adamw', 'use_snp_selection': False, 'n_pcs': 5000}. Best is trial 67 with value: 0.21274226476569685.
2026-06-01 13:43:21 | INFO | Trial 107 | outer=7 | hidden=[512, 64] epochs=123 lr=2.438e-04 wd=3.641e-07 n_pcs=5000 weight={'name': 'uniform'}
[I 2026-06-01 13:43:29,430] Trial 107 finished with value: 0.2162868936402865 and parameters: {'hidden_dims': '[512, 64]', 'dropout': 0.5628804336035255, 'batch_norm': False, 'lr': 0.00024384503634278704, 'weight_decay': 3.640838180353535e-07, 'epochs': 123, 'loss': 'mae', 'optimizer': 'adam', 'use_snp_selection': False, 'n_pcs': 5000}. Best is trial 107 with value: 0.2162868936402865.
2026-06-01 13:43:29 | INFO | Trial 108 | outer=7 | hidden=[512, 64] epochs=123 lr=3.759e-04 wd=3.442e-07 n_pcs=5000 weight={'name': 'uniform'}
[I 2026-06-01 13:43:37,354] Trial 108 finished with value: 0.19224524308424823 and parameters: {'hidden_dims': '[512, 64]', 'dropout': 0.5257747534425534, 'batch_norm': False, 'lr': 0.0003758576343877193, 'weight_decay': 3.441886098779719e-07, 'epochs': 123, 'loss': 'mae', 'optimizer': 'adam', 'use_snp_selection': False, 'n_pcs': 5000}. Best is trial 107 with value: 0.2162868936402865.
2026-06-01 13:43:37 | INFO | Trial 109 | outer=7 | hidden=[512, 64] epochs=116 lr=2.432e-04 wd=1.598e-08 n_pcs=5000 weight={'name': 'uniform'}
[I 2026-06-01 13:43:44,957] Trial 109 finished with value: 0.2166011655810823 and parameters: {'hidden_dims': '[512, 64]', 'dropout': 0.5613563535124557, 'batch_norm': False, 'lr': 0.00024318979675173755, 'weight_decay': 1.5981865479499224e-08, 'epochs': 116, 'loss': 'mae', 'optimizer': 'adam', 'use_snp_selection': False, 'n_pcs': 5000}. Best is trial 109 with value: 0.2166011655810823.
2026-06-01 13:43:44 | INFO | Trial 110 | outer=7 | hidden=[512, 64] epochs=114 lr=2.548e-04 wd=1.054e-08 n_pcs=5000 weight={'name': 'uniform'}
[I 2026-06-01 13:43:52,473] Trial 110 finished with value: 0.19147883533627516 and parameters: {'hidden_dims': '[512, 64]', 'dropout': 0.5776381839028015, 'batch_norm': False, 'lr': 0.00025481014259314173, 'weight_decay': 1.053802992347969e-08, 'epochs': 114, 'loss': 'mae', 'optimizer': 'adam', 'use_snp_selection': False, 'n_pcs': 5000}. Best is trial 109 with value: 0.2166011655810823.
2026-06-01 13:43:52 | INFO | Trial 111 | outer=7 | hidden=[512, 64] epochs=127 lr=2.182e-04 wd=1.509e-08 n_pcs=5000 weight={'name': 'uniform'}
[I 2026-06-01 13:44:00,580] Trial 111 finished with value: 0.19303596798941197 and parameters: {'hidden_dims': '[512, 64]', 'dropout': 0.5621192381324902, 'batch_norm': False, 'lr': 0.00021818617647434522, 'weight_decay': 1.5094690285502534e-08, 'epochs': 127, 'loss': 'mae', 'optimizer': 'adam', 'use_snp_selection': False, 'n_pcs': 5000}. Best is trial 109 with value: 0.2166011655810823.
2026-06-01 13:44:00 | INFO | Trial 112 | outer=7 | hidden=[512, 64] epochs=120 lr=2.375e-04 wd=2.130e-08 n_pcs=5000 weight={'name': 'uniform'}
[I 2026-06-01 13:44:08,381] Trial 112 finished with value: 0.213322900290021 and parameters: {'hidden_dims': '[512, 64]', 'dropout': 0.5610321877680192, 'batch_norm': False, 'lr': 0.00023748911603539976, 'weight_decay': 2.1299422277556762e-08, 'epochs': 120, 'loss': 'mae', 'optimizer': 'adam', 'use_snp_selection': False, 'n_pcs': 5000}. Best is trial 109 with value: 0.2166011655810823.
2026-06-01 13:44:08 | INFO | Trial 113 | outer=7 | hidden=[512, 64] epochs=130 lr=3.049e-04 wd=2.383e-08 n_pcs=5000 weight={'name': 'uniform'}
[I 2026-06-01 13:44:16,635] Trial 113 finished with value: 0.19849345603511404 and parameters: {'hidden_dims': '[512, 64]', 'dropout': 0.5597445843413275, 'batch_norm': False, 'lr': 0.00030494727845456764, 'weight_decay': 2.3825819188946127e-08, 'epochs': 130, 'loss': 'mae', 'optimizer': 'adam', 'use_snp_selection': False, 'n_pcs': 5000}. Best is trial 109 with value: 0.2166011655810823.
2026-06-01 13:44:16 | INFO | Trial 114 | outer=7 | hidden=[512, 64] epochs=141 lr=2.479e-04 wd=1.583e-08 n_pcs=5000 weight={'name': 'uniform'}
[I 2026-06-01 13:44:25,387] Trial 114 finished with value: 0.21889059107650932 and parameters: {'hidden_dims': '[512, 64]', 'dropout': 0.5842635974896627, 'batch_norm': False, 'lr': 0.00024787315653993126, 'weight_decay': 1.5834887906903942e-08, 'epochs': 141, 'loss': 'mae', 'optimizer': 'adam', 'use_snp_selection': False, 'n_pcs': 5000}. Best is trial 114 with value: 0.21889059107650932.
2026-06-01 13:44:25 | INFO | Trial 115 | outer=7 | hidden=[512, 64] epochs=140 lr=2.447e-04 wd=1.476e-08 n_pcs=5000 weight={'name': 'uniform'}
[I 2026-06-01 13:44:34,083] Trial 115 finished with value: 0.19882119016960767 and parameters: {'hidden_dims': '[512, 64]', 'dropout': 0.5891115022244819, 'batch_norm': False, 'lr': 0.0002447340365074387, 'weight_decay': 1.476136213491765e-08, 'epochs': 140, 'loss': 'mae', 'optimizer': 'adam', 'use_snp_selection': False, 'n_pcs': 5000}. Best is trial 114 with value: 0.21889059107650932.
2026-06-01 13:44:34 | INFO | Trial 116 | outer=7 | hidden=[512, 64] epochs=151 lr=2.233e-04 wd=3.460e-08 n_pcs=5000 weight={'name': 'uniform'}
[I 2026-06-01 13:44:43,306] Trial 116 finished with value: 0.19301688147928836 and parameters: {'hidden_dims': '[512, 64]', 'dropout': 0.598264497691122, 'batch_norm': False, 'lr': 0.0002232995814693866, 'weight_decay': 3.4595296274221895e-08, 'epochs': 151, 'loss': 'mae', 'optimizer': 'adam', 'use_snp_selection': False, 'n_pcs': 5000}. Best is trial 114 with value: 0.21889059107650932.
2026-06-01 13:44:43 | INFO | Trial 117 | outer=7 | hidden=[512, 64] epochs=160 lr=2.977e-04 wd=2.098e-08 n_pcs=5000 weight={'name': 'uniform'}
[I 2026-06-01 13:44:52,924] Trial 117 finished with value: 0.20202640113635956 and parameters: {'hidden_dims': '[512, 64]', 'dropout': 0.5421866004531661, 'batch_norm': False, 'lr': 0.0002977242575005225, 'weight_decay': 2.0984006660923374e-08, 'epochs': 160, 'loss': 'mse', 'optimizer': 'adam', 'use_snp_selection': False, 'n_pcs': 5000}. Best is trial 114 with value: 0.21889059107650932.
2026-06-01 13:44:52 | INFO | Trial 118 | outer=7 | hidden=[512, 64] epochs=146 lr=2.739e-04 wd=1.589e-08 n_pcs=5000 weight={'name': 'uniform'}
[I 2026-06-01 13:45:01,902] Trial 118 finished with value: 0.2162430253962449 and parameters: {'hidden_dims': '[512, 64]', 'dropout': 0.5034268582755689, 'batch_norm': False, 'lr': 0.00027386945766660317, 'weight_decay': 1.5894917546874197e-08, 'epochs': 146, 'loss': 'mae', 'optimizer': 'adam', 'use_snp_selection': False, 'n_pcs': 5000}. Best is trial 114 with value: 0.21889059107650932.
2026-06-01 13:45:01 | INFO | Trial 119 | outer=7 | hidden=[512, 64] epochs=143 lr=2.236e-05 wd=1.548e-08 n_pcs=5000 weight={'name': 'uniform'}
[I 2026-06-01 13:45:10,748] Trial 119 finished with value: 0.15129790802086798 and parameters: {'hidden_dims': '[512, 64]', 'dropout': 0.5602985038000441, 'batch_norm': False, 'lr': 2.2362197336219834e-05, 'weight_decay': 1.5479401920979917e-08, 'epochs': 143, 'loss': 'mae', 'optimizer': 'adam', 'use_snp_selection': False, 'n_pcs': 5000}. Best is trial 114 with value: 0.21889059107650932.
2026-06-01 13:45:10 | INFO | Trial 120 | outer=7 | hidden=[512, 64] epochs=148 lr=2.834e-04 wd=2.556e-08 n_pcs=5000 weight={'name': 'uniform'}
[I 2026-06-01 13:45:19,821] Trial 120 finished with value: 0.19341216058564897 and parameters: {'hidden_dims': '[512, 64]', 'dropout': 0.5075375927643567, 'batch_norm': False, 'lr': 0.0002833804489250952, 'weight_decay': 2.5559471210442135e-08, 'epochs': 148, 'loss': 'mae', 'optimizer': 'adam', 'use_snp_selection': False, 'n_pcs': 5000}. Best is trial 114 with value: 0.21889059107650932.
2026-06-01 13:45:19 | INFO | Trial 121 | outer=7 | hidden=[512, 64] epochs=137 lr=2.353e-04 wd=1.257e-08 n_pcs=5000 weight={'name': 'uniform'}
[I 2026-06-01 13:45:28,389] Trial 121 finished with value: 0.200727911833087 and parameters: {'hidden_dims': '[512, 64]', 'dropout': 0.569043609629708, 'batch_norm': False, 'lr': 0.00023532207561893334, 'weight_decay': 1.2570841214590488e-08, 'epochs': 137, 'loss': 'mae', 'optimizer': 'adam', 'use_snp_selection': False, 'n_pcs': 5000}. Best is trial 114 with value: 0.21889059107650932.
2026-06-01 13:45:28 | INFO | Trial 122 | outer=7 | hidden=[512, 128] epochs=176 lr=2.588e-04 wd=3.539e-08 n_pcs=5000 weight={'name': 'uniform'}
[I 2026-06-01 13:45:38,919] Trial 122 finished with value: 0.20198824287607042 and parameters: {'hidden_dims': '[512, 128]', 'dropout': 0.5384098952064759, 'batch_norm': False, 'lr': 0.0002587845074334405, 'weight_decay': 3.5388344631348735e-08, 'epochs': 176, 'loss': 'mae', 'optimizer': 'adam', 'use_snp_selection': False, 'n_pcs': 5000}. Best is trial 114 with value: 0.21889059107650932.
2026-06-01 13:45:38 | INFO | Trial 123 | outer=7 | hidden=[256, 64] epochs=106 lr=1.827e-04 wd=5.597e-08 n_pcs=5000 weight={'name': 'uniform'}
[I 2026-06-01 13:45:43,788] Trial 123 finished with value: 0.18792288302539256 and parameters: {'hidden_dims': '[256, 64]', 'dropout': 0.4962254941141392, 'batch_norm': False, 'lr': 0.0001827071622096698, 'weight_decay': 5.597050156242854e-08, 'epochs': 106, 'loss': 'mae', 'optimizer': 'adam', 'use_snp_selection': False, 'n_pcs': 5000}. Best is trial 114 with value: 0.21889059107650932.
2026-06-01 13:45:43 | INFO | Trial 124 | outer=7 | hidden=[512, 64] epochs=126 lr=4.135e-04 wd=1.021e-08 n_pcs=5000 weight={'name': 'uniform'}
[I 2026-06-01 13:45:51,841] Trial 124 finished with value: 0.20187661565516118 and parameters: {'hidden_dims': '[512, 64]', 'dropout': 0.5843795534062016, 'batch_norm': False, 'lr': 0.00041348138463475264, 'weight_decay': 1.0206369254920059e-08, 'epochs': 126, 'loss': 'mae', 'optimizer': 'adam', 'use_snp_selection': False, 'n_pcs': 5000}. Best is trial 114 with value: 0.21889059107650932.
2026-06-01 13:45:51 | INFO | Trial 125 | outer=7 | hidden=[256, 128] epochs=118 lr=3.717e-04 wd=1.951e-08 n_pcs=5000 weight={'name': 'uniform'}
[I 2026-06-01 13:45:57,064] Trial 125 finished with value: 0.18765699060679278 and parameters: {'hidden_dims': '[256, 128]', 'dropout': 0.5496865558459543, 'batch_norm': False, 'lr': 0.00037170792996931573, 'weight_decay': 1.951056719779372e-08, 'epochs': 118, 'loss': 'mae', 'optimizer': 'adam', 'use_snp_selection': False, 'n_pcs': 5000}. Best is trial 114 with value: 0.21889059107650932.
2026-06-01 13:45:57 | INFO | Trial 126 | outer=7 | hidden=[512, 64] epochs=132 lr=2.699e-04 wd=1.338e-08 n_pcs=4500 weight={'name': 'uniform'}
[I 2026-06-01 13:46:04,933] Trial 126 finished with value: 0.1898123720073615 and parameters: {'hidden_dims': '[512, 64]', 'dropout': 0.479686756021587, 'batch_norm': False, 'lr': 0.0002698662024248659, 'weight_decay': 1.3382595760309644e-08, 'epochs': 132, 'loss': 'mae', 'optimizer': 'adamw', 'use_snp_selection': False, 'n_pcs': 4500}. Best is trial 114 with value: 0.21889059107650932.
2026-06-01 13:46:04 | INFO | Trial 127 | outer=7 | hidden=[128, 64] epochs=101 lr=4.776e-04 wd=2.317e-08 n_pcs=5000 weight={'name': 'uniform'}
[I 2026-06-01 13:46:08,561] Trial 127 finished with value: 0.18453178764222383 and parameters: {'hidden_dims': '[128, 64]', 'dropout': 0.006523543601149109, 'batch_norm': False, 'lr': 0.0004776304115218918, 'weight_decay': 2.3165648450449382e-08, 'epochs': 101, 'loss': 'mae', 'optimizer': 'adam', 'use_snp_selection': False, 'n_pcs': 5000}. Best is trial 114 with value: 0.21889059107650932.
2026-06-01 13:46:08 | INFO | Trial 128 | outer=7 | hidden=[512, 64] epochs=123 lr=2.191e-04 wd=4.194e-06 n_pcs=4500 weight={'name': 'uniform'}
[I 2026-06-01 13:46:16,067] Trial 128 finished with value: 0.20777803517164703 and parameters: {'hidden_dims': '[512, 64]', 'dropout': 0.49844376456081807, 'batch_norm': False, 'lr': 0.00021912874316924567, 'weight_decay': 4.194239937902425e-06, 'epochs': 123, 'loss': 'mse', 'optimizer': 'adam', 'use_snp_selection': False, 'n_pcs': 4500}. Best is trial 114 with value: 0.21889059107650932.
2026-06-01 13:46:16 | INFO | Trial 129 | outer=7 | hidden=[512, 64] epochs=123 lr=2.360e-04 wd=4.085e-06 n_pcs=4500 weight={'name': 'uniform'}
[I 2026-06-01 13:46:23,583] Trial 129 finished with value: 0.20173925667793643 and parameters: {'hidden_dims': '[512, 64]', 'dropout': 0.5022855582230284, 'batch_norm': False, 'lr': 0.00023595174800422844, 'weight_decay': 4.085361087093093e-06, 'epochs': 123, 'loss': 'mse', 'optimizer': 'adam', 'use_snp_selection': False, 'n_pcs': 4500}. Best is trial 114 with value: 0.21889059107650932.
2026-06-01 13:46:23 | INFO | Trial 130 | outer=7 | hidden=[512, 64] epochs=116 lr=2.092e-04 wd=6.316e-06 n_pcs=4500 weight={'name': 'uniform'}
[I 2026-06-01 13:46:30,803] Trial 130 finished with value: 0.21519711757511786 and parameters: {'hidden_dims': '[512, 64]', 'dropout': 0.5197694180553653, 'batch_norm': False, 'lr': 0.00020915343856218996, 'weight_decay': 6.316276342747355e-06, 'epochs': 116, 'loss': 'mse', 'optimizer': 'adam', 'use_snp_selection': False, 'n_pcs': 4500}. Best is trial 114 with value: 0.21889059107650932.
2026-06-01 13:46:30 | INFO | Trial 131 | outer=7 | hidden=[512, 64] epochs=117 lr=2.195e-04 wd=1.150e-05 n_pcs=4500 weight={'name': 'uniform'}
[I 2026-06-01 13:46:38,049] Trial 131 finished with value: 0.18611441631673548 and parameters: {'hidden_dims': '[512, 64]', 'dropout': 0.5287456253047869, 'batch_norm': False, 'lr': 0.0002194552681645765, 'weight_decay': 1.1496142231968304e-05, 'epochs': 117, 'loss': 'mse', 'optimizer': 'adam', 'use_snp_selection': False, 'n_pcs': 4500}. Best is trial 114 with value: 0.21889059107650932.
2026-06-01 13:46:38 | INFO | Trial 132 | outer=7 | hidden=[512, 64] epochs=130 lr=1.886e-04 wd=2.256e-06 n_pcs=4500 weight={'name': 'uniform'}
[I 2026-06-01 13:46:45,849] Trial 132 finished with value: 0.17550737083461637 and parameters: {'hidden_dims': '[512, 64]', 'dropout': 0.5215240586558361, 'batch_norm': False, 'lr': 0.00018859279507191758, 'weight_decay': 2.2564492893133925e-06, 'epochs': 130, 'loss': 'mse', 'optimizer': 'adam', 'use_snp_selection': False, 'n_pcs': 4500}. Best is trial 114 with value: 0.21889059107650932.
2026-06-01 13:46:45 | INFO | Trial 133 | outer=7 | hidden=[512, 64] epochs=108 lr=2.479e-04 wd=5.851e-06 n_pcs=4500 weight={'name': 'uniform'}
[I 2026-06-01 13:46:52,727] Trial 133 finished with value: 0.2107075629690795 and parameters: {'hidden_dims': '[512, 64]', 'dropout': 0.48034737165154934, 'batch_norm': False, 'lr': 0.0002479274697473289, 'weight_decay': 5.850970896678413e-06, 'epochs': 108, 'loss': 'mse', 'optimizer': 'adam', 'use_snp_selection': False, 'n_pcs': 4500}. Best is trial 114 with value: 0.21889059107650932.
2026-06-01 13:46:52 | INFO | Trial 134 | outer=7 | hidden=[512, 64] epochs=107 lr=2.147e-04 wd=5.830e-06 n_pcs=4500 weight={'name': 'uniform'}
[I 2026-06-01 13:46:59,549] Trial 134 finished with value: 0.19809626871179756 and parameters: {'hidden_dims': '[512, 64]', 'dropout': 0.4822440493800549, 'batch_norm': False, 'lr': 0.00021473816414975598, 'weight_decay': 5.829971909620966e-06, 'epochs': 107, 'loss': 'mse', 'optimizer': 'adam', 'use_snp_selection': False, 'n_pcs': 4500}. Best is trial 114 with value: 0.21889059107650932.
2026-06-01 13:46:59 | INFO | Trial 135 | outer=7 | hidden=[512, 64] epochs=95 lr=2.462e-04 wd=5.945e-06 n_pcs=4500 weight={'name': 'uniform'}
[I 2026-06-01 13:47:05,857] Trial 135 finished with value: 0.1999799060807151 and parameters: {'hidden_dims': '[512, 64]', 'dropout': 0.4925850000192655, 'batch_norm': False, 'lr': 0.00024616246664899193, 'weight_decay': 5.945081391178851e-06, 'epochs': 95, 'loss': 'mse', 'optimizer': 'adam', 'use_snp_selection': False, 'n_pcs': 4500}. Best is trial 114 with value: 0.21889059107650932.
2026-06-01 13:47:05 | INFO | Trial 136 | outer=7 | hidden=[512, 64] epochs=110 lr=2.829e-04 wd=4.126e-08 n_pcs=4500 weight={'name': 'uniform'}
[I 2026-06-01 13:47:12,812] Trial 136 finished with value: 0.212822333245116 and parameters: {'hidden_dims': '[512, 64]', 'dropout': 0.27536724185562494, 'batch_norm': False, 'lr': 0.0002829482636024063, 'weight_decay': 4.125989049656276e-08, 'epochs': 110, 'loss': 'mse', 'optimizer': 'adam', 'use_snp_selection': False, 'n_pcs': 4500}. Best is trial 114 with value: 0.21889059107650932.
2026-06-01 13:47:12 | INFO | Trial 137 | outer=7 | hidden=[512, 64] epochs=111 lr=2.816e-04 wd=3.665e-06 n_pcs=4500 weight={'name': 'uniform'}
[I 2026-06-01 13:47:19,813] Trial 137 finished with value: 0.20578423098735127 and parameters: {'hidden_dims': '[512, 64]', 'dropout': 0.5950717208796836, 'batch_norm': False, 'lr': 0.00028161226340231324, 'weight_decay': 3.665031084294792e-06, 'epochs': 111, 'loss': 'mse', 'optimizer': 'adam', 'use_snp_selection': False, 'n_pcs': 4500}. Best is trial 114 with value: 0.21889059107650932.
2026-06-01 13:47:19 | INFO | Trial 138 | outer=7 | hidden=[512, 64] epochs=102 lr=2.988e-04 wd=3.610e-08 n_pcs=4500 weight={'name': 'uniform'}
[I 2026-06-01 13:47:26,429] Trial 138 finished with value: 0.2118621136429617 and parameters: {'hidden_dims': '[512, 64]', 'dropout': 0.2512167435159969, 'batch_norm': False, 'lr': 0.000298792027583133, 'weight_decay': 3.610342493722029e-08, 'epochs': 102, 'loss': 'mse', 'optimizer': 'adam', 'use_snp_selection': False, 'n_pcs': 4500}. Best is trial 114 with value: 0.21889059107650932.
2026-06-01 13:47:26 | INFO | Trial 139 | outer=7 | hidden=[512, 64] epochs=88 lr=3.044e-04 wd=3.852e-08 n_pcs=5000 weight={'name': 'uniform'}
