2026-06-01 10:49:24 | INFO | Loading data from NPZ: Data/npz/snp_thr_wing_ALL.npz
2026-06-01 10:49:32 | INFO | Filtered to 5633 samples from islands (codes->labels): 0->20, 1->22, 2->23, 3->24, 4->26, 5->27, 6->28, 7->33, 8->34, 9->35, 10->38, 11->60, 12->61, 13->63, 14->67 based on include_islands=[0, 1, 2, 3, 4, 5, 6, 7, 8, 9, 10, 11, 12, 13, 14]
2026-06-01 10:49:32 | INFO | Resolved GPU worker ids from CUDA_VISIBLE_DEVICES=0
2026-06-01 10:49:33 | INFO | weighting_mode = uniform (choices=['uniform'])
2026-06-01 10:49:33 | INFO | Weights will be uniform; weight-search hyperparameters are not sampled.
2026-06-01 10:49:33 | INFO | Loading data from NPZ: Data/npz/snp_thr_wing_ALL.npz
2026-06-01 10:49:39 | INFO | Loading GRM from RDS: Data/GRM/GRM_vanraden.rds
2026-06-01 10:49:47 | INFO | Filtered to 5633 samples from islands (codes->labels): 0->20, 1->22, 2->23, 3->24, 4->26, 5->27, 6->28, 7->33, 8->34, 9->35, 10->38, 11->60, 12->61, 13->63, 14->67 based on include_islands=[0, 1, 2, 3, 4, 5, 6, 7, 8, 9, 10, 11, 12, 13, 14]
2026-06-01 10:58:40 | INFO | feature_pca: fit PCA on (n=5633, p=65344) -> r=5000 in 532.9s (cumvar=0.9881, standardize=False)
2026-06-01 10:58:40 | INFO | Using PC features for MLP: r_fit=5000 (cumvar=0.9881). Trials will pick top-k PCs from this set.
2026-06-01 10:58:40 | INFO | Device: cuda
2026-06-01 10:58:40 | INFO | OUTER 1: test_size=118 island=0 (Nesøy)
2026-06-01 10:58:40 | INFO | OUTER 1: inner LOIO validation islands: 1(Myken), 2(Træna), 3(Selvær), 4(Gjerøy), 5(Hestmannøy), 6(Indre Kvarøy), 7(Onøy og Lurøy), 8(Lovund), 9(Sleneset), 10(Aldra), 11(Leka), 12(Vega), 13(Vikna), 14(Lauvøya)
2026-06-01 10:58:40 | INFO | OUTER 1: using top 10 related inner validation islands for tuning: 1(Myken, avgGRM=0.0066), 5(Hestmannøy, avgGRM=0.0045), 4(Gjerøy, avgGRM=0.0039), 3(Selvær, avgGRM=0.0033), 2(Træna, avgGRM=0.0030), 7(Onøy og Lurøy, avgGRM=0.0025), 8(Lovund, avgGRM=0.0024), 6(Indre Kvarøy, avgGRM=0.0016), 9(Sleneset, avgGRM=0.0013), 10(Aldra, avgGRM=-0.0006)
[I 2026-06-01 10:58:40,373] A new study created in memory with name: mlp_importance_inner_outer0
2026-06-01 10:58:40 | INFO | Trial 0 | outer=1 | hidden=[256, 64] epochs=252 lr=8.243e-05 wd=1.277e-07 n_pcs=1500 weight={'name': 'uniform'}
[I 2026-06-01 10:59:04,526] Trial 0 finished with value: 0.19701829201714832 and parameters: {'hidden_dims': '[256, 64]', 'dropout': 0.19097065492325918, 'batch_norm': False, 'lr': 8.242985198911028e-05, 'weight_decay': 1.277246473139888e-07, 'epochs': 252, 'loss': 'mae', 'optimizer': 'adamw', 'use_snp_selection': False, 'n_pcs': 1500}. Best is trial 0 with value: 0.19701829201714832.
2026-06-01 10:59:04 | INFO | Trial 1 | outer=1 | hidden=[1024, 256] epochs=225 lr=1.391e-04 wd=1.941e-07 n_pcs=500 weight={'name': 'uniform'}
[I 2026-06-01 10:59:11,122] Trial 1 finished with value: 0.19071309682306198 and parameters: {'hidden_dims': '[1024, 256]', 'dropout': 0.2849434595702811, 'batch_norm': False, 'lr': 0.00013909108684683413, 'weight_decay': 1.9407167964924495e-07, 'epochs': 225, 'loss': 'mse', 'optimizer': 'adamw', 'use_snp_selection': False, 'n_pcs': 500}. Best is trial 0 with value: 0.19701829201714832.
2026-06-01 10:59:11 | INFO | Trial 2 | outer=1 | hidden=[256, 64] epochs=139 lr=3.957e-05 wd=3.750e-05 n_pcs=2500 weight={'name': 'uniform'}
[I 2026-06-01 10:59:15,213] Trial 2 finished with value: 0.17513729002772088 and parameters: {'hidden_dims': '[256, 64]', 'dropout': 0.11392712587675291, 'batch_norm': False, 'lr': 3.9573351157697276e-05, 'weight_decay': 3.7502337000845044e-05, 'epochs': 139, 'loss': 'mae', 'optimizer': 'adam', 'use_snp_selection': False, 'n_pcs': 2500}. Best is trial 0 with value: 0.19701829201714832.
2026-06-01 10:59:15 | INFO | Trial 3 | outer=1 | hidden=[128, 64] epochs=164 lr=1.538e-05 wd=3.248e-06 n_pcs=3000 weight={'name': 'uniform'}
[I 2026-06-01 10:59:19,034] Trial 3 finished with value: 0.0754522003286959 and parameters: {'hidden_dims': '[128, 64]', 'dropout': 0.1479874991503876, 'batch_norm': False, 'lr': 1.5380732370316375e-05, 'weight_decay': 3.2478890969962294e-06, 'epochs': 164, 'loss': 'mse', 'optimizer': 'adam', 'use_snp_selection': False, 'n_pcs': 3000}. Best is trial 0 with value: 0.19701829201714832.
2026-06-01 10:59:19 | INFO | Trial 4 | outer=1 | hidden=[256, 128] epochs=210 lr=7.298e-05 wd=7.875e-06 n_pcs=3000 weight={'name': 'uniform'}
[I 2026-06-01 10:59:24,848] Trial 4 finished with value: 0.17179004056047192 and parameters: {'hidden_dims': '[256, 128]', 'dropout': 0.09917626474860408, 'batch_norm': False, 'lr': 7.298380589156323e-05, 'weight_decay': 7.875094299510188e-06, 'epochs': 210, 'loss': 'mae', 'optimizer': 'adam', 'use_snp_selection': False, 'n_pcs': 3000}. Best is trial 0 with value: 0.19701829201714832.
2026-06-01 10:59:24 | INFO | Trial 5 | outer=1 | hidden=[512, 128] epochs=284 lr=5.467e-05 wd=5.496e-06 n_pcs=4000 weight={'name': 'uniform'}
[I 2026-06-01 10:59:38,550] Trial 5 finished with value: 0.19890703452804478 and parameters: {'hidden_dims': '[512, 128]', 'dropout': 0.3143696126156032, 'batch_norm': False, 'lr': 5.46667545989349e-05, 'weight_decay': 5.496446859789657e-06, 'epochs': 284, 'loss': 'mse', 'optimizer': 'adamw', 'use_snp_selection': False, 'n_pcs': 4000}. Best is trial 5 with value: 0.19890703452804478.
2026-06-01 10:59:38 | INFO | Trial 6 | outer=1 | hidden=[512, 64] epochs=90 lr=3.103e-05 wd=6.607e-08 n_pcs=5000 weight={'name': 'uniform'}
[I 2026-06-01 10:59:45,145] Trial 6 finished with value: 0.1942394331380169 and parameters: {'hidden_dims': '[512, 64]', 'dropout': 0.4941304802762902, 'batch_norm': False, 'lr': 3.103455600245868e-05, 'weight_decay': 6.606788619980135e-08, 'epochs': 90, 'loss': 'mse', 'optimizer': 'adamw', 'use_snp_selection': False, 'n_pcs': 5000}. Best is trial 5 with value: 0.19890703452804478.
2026-06-01 10:59:45 | INFO | Trial 7 | outer=1 | hidden=[128, 64] epochs=272 lr=1.348e-05 wd=1.075e-07 n_pcs=4000 weight={'name': 'uniform'}
[I 2026-06-01 10:59:48,446] Trial 7 pruned. 
2026-06-01 10:59:48 | INFO | Trial 8 | outer=1 | hidden=[128, 64] epochs=205 lr=1.815e-05 wd=5.764e-06 n_pcs=3000 weight={'name': 'uniform'}
[I 2026-06-01 10:59:51,030] Trial 8 pruned. 
2026-06-01 10:59:51 | INFO | Trial 9 | outer=1 | hidden=[128, 64] epochs=296 lr=2.338e-05 wd=1.066e-07 n_pcs=2500 weight={'name': 'uniform'}
[I 2026-06-01 10:59:56,484] Trial 9 finished with value: 0.17688665415624685 and parameters: {'hidden_dims': '[128, 64]', 'dropout': 0.17607378181405245, 'batch_norm': False, 'lr': 2.3379083621874488e-05, 'weight_decay': 1.0663581123617794e-07, 'epochs': 296, 'loss': 'mae', 'optimizer': 'adam', 'use_snp_selection': False, 'n_pcs': 2500}. Best is trial 5 with value: 0.19890703452804478.
2026-06-01 10:59:56 | INFO | Trial 10 | outer=1 | hidden=[512, 128] epochs=110 lr=3.984e-04 wd=9.453e-04 n_pcs=5000 weight={'name': 'uniform'}
[I 2026-06-01 11:00:04,160] Trial 10 finished with value: 0.2126190377392653 and parameters: {'hidden_dims': '[512, 128]', 'dropout': 0.5941683348553323, 'batch_norm': False, 'lr': 0.0003983594610602333, 'weight_decay': 0.0009452683165453212, 'epochs': 110, 'loss': 'mse', 'optimizer': 'adamw', 'use_snp_selection': False, 'n_pcs': 5000}. Best is trial 10 with value: 0.2126190377392653.
2026-06-01 11:00:04 | INFO | Trial 11 | outer=1 | hidden=[512, 128] epochs=55 lr=3.985e-04 wd=9.792e-04 n_pcs=5000 weight={'name': 'uniform'}
[I 2026-06-01 11:00:09,184] Trial 11 finished with value: 0.22631097742542755 and parameters: {'hidden_dims': '[512, 128]', 'dropout': 0.5588382083491101, 'batch_norm': False, 'lr': 0.00039850138867195595, 'weight_decay': 0.0009792126502143, 'epochs': 55, 'loss': 'mse', 'optimizer': 'adamw', 'use_snp_selection': False, 'n_pcs': 5000}. Best is trial 11 with value: 0.22631097742542755.
2026-06-01 11:00:09 | INFO | Trial 12 | outer=1 | hidden=[512, 128] epochs=60 lr=4.988e-04 wd=8.865e-04 n_pcs=5000 weight={'name': 'uniform'}
[I 2026-06-01 11:00:14,441] Trial 12 finished with value: 0.20739579868915828 and parameters: {'hidden_dims': '[512, 128]', 'dropout': 0.5906998896000112, 'batch_norm': False, 'lr': 0.0004987709837145536, 'weight_decay': 0.0008865268327078721, 'epochs': 60, 'loss': 'mse', 'optimizer': 'adamw', 'use_snp_selection': False, 'n_pcs': 5000}. Best is trial 11 with value: 0.22631097742542755.
2026-06-01 11:00:14 | INFO | Trial 13 | outer=1 | hidden=[512, 128] epochs=110 lr=4.127e-04 wd=8.328e-04 n_pcs=4000 weight={'name': 'uniform'}
[I 2026-06-01 11:00:21,083] Trial 13 finished with value: 0.21504216312693147 and parameters: {'hidden_dims': '[512, 128]', 'dropout': 0.5966098843632991, 'batch_norm': False, 'lr': 0.00041268707845253474, 'weight_decay': 0.0008327861371916481, 'epochs': 110, 'loss': 'mse', 'optimizer': 'adamw', 'use_snp_selection': False, 'n_pcs': 4000}. Best is trial 11 with value: 0.22631097742542755.
2026-06-01 11:00:21 | INFO | Trial 14 | outer=1 | hidden=[512, 256] epochs=58 lr=1.939e-04 wd=1.266e-04 n_pcs=4000 weight={'name': 'uniform'}
[I 2026-06-01 11:00:25,760] Trial 14 finished with value: 0.2054240393483367 and parameters: {'hidden_dims': '[512, 256]', 'dropout': 0.47130480051808027, 'batch_norm': False, 'lr': 0.0001938793963648549, 'weight_decay': 0.00012663736825721254, 'epochs': 58, 'loss': 'mse', 'optimizer': 'adamw', 'use_snp_selection': False, 'n_pcs': 4000}. Best is trial 11 with value: 0.22631097742542755.
2026-06-01 11:00:25 | INFO | Trial 15 | outer=1 | hidden=[512, 128] epochs=103 lr=2.582e-04 wd=9.715e-05 n_pcs=4500 weight={'name': 'uniform'}
[I 2026-06-01 11:00:32,731] Trial 15 finished with value: 0.19468700326398308 and parameters: {'hidden_dims': '[512, 128]', 'dropout': 0.3807861783025968, 'batch_norm': False, 'lr': 0.00025820463323916645, 'weight_decay': 9.715102552223227e-05, 'epochs': 103, 'loss': 'mse', 'optimizer': 'adamw', 'use_snp_selection': False, 'n_pcs': 4500}. Best is trial 11 with value: 0.22631097742542755.
2026-06-01 11:00:32 | INFO | Trial 16 | outer=1 | hidden=[512, 128] epochs=138 lr=2.911e-04 wd=2.229e-04 n_pcs=3500 weight={'name': 'uniform'}
[I 2026-06-01 11:00:39,965] Trial 16 finished with value: 0.2087860605048383 and parameters: {'hidden_dims': '[512, 128]', 'dropout': 0.5294738426639388, 'batch_norm': False, 'lr': 0.00029108486514309675, 'weight_decay': 0.00022294718868778329, 'epochs': 138, 'loss': 'mse', 'optimizer': 'adamw', 'use_snp_selection': False, 'n_pcs': 3500}. Best is trial 11 with value: 0.22631097742542755.
2026-06-01 11:00:39 | INFO | Trial 17 | outer=1 | hidden=[512, 256] epochs=80 lr=1.322e-04 wd=1.184e-08 n_pcs=4500 weight={'name': 'uniform'}
[I 2026-06-01 11:00:46,084] Trial 17 finished with value: 0.19371246676970344 and parameters: {'hidden_dims': '[512, 256]', 'dropout': 0.3950918489307103, 'batch_norm': False, 'lr': 0.00013217283840606732, 'weight_decay': 1.1840058441529551e-08, 'epochs': 80, 'loss': 'mse', 'optimizer': 'adamw', 'use_snp_selection': False, 'n_pcs': 4500}. Best is trial 11 with value: 0.22631097742542755.
2026-06-01 11:00:46 | INFO | Trial 18 | outer=1 | hidden=[512, 64] epochs=133 lr=3.010e-04 wd=1.925e-05 n_pcs=4500 weight={'name': 'uniform'}
[I 2026-06-01 11:00:54,328] Trial 18 finished with value: 0.21376024333378477 and parameters: {'hidden_dims': '[512, 64]', 'dropout': 0.022941868683026556, 'batch_norm': False, 'lr': 0.00030101428565247346, 'weight_decay': 1.9245734139552924e-05, 'epochs': 133, 'loss': 'mae', 'optimizer': 'adamw', 'use_snp_selection': False, 'n_pcs': 4500}. Best is trial 11 with value: 0.22631097742542755.
2026-06-01 11:00:54 | INFO | Trial 19 | outer=1 | hidden=[256, 128] epochs=164 lr=1.738e-04 wd=2.742e-04 n_pcs=2000 weight={'name': 'uniform'}
[I 2026-06-01 11:00:58,400] Trial 19 finished with value: 0.20098390043020659 and parameters: {'hidden_dims': '[256, 128]', 'dropout': 0.523898508720424, 'batch_norm': False, 'lr': 0.00017383623891573994, 'weight_decay': 0.00027424031441327865, 'epochs': 164, 'loss': 'mse', 'optimizer': 'adamw', 'use_snp_selection': False, 'n_pcs': 2000}. Best is trial 11 with value: 0.22631097742542755.
2026-06-01 11:00:58 | INFO | Trial 20 | outer=1 | hidden=[1024, 256] epochs=54 lr=4.707e-04 wd=1.043e-06 n_pcs=3500 weight={'name': 'uniform'}
[I 2026-06-01 11:01:04,554] Trial 20 finished with value: 0.198183028248341 and parameters: {'hidden_dims': '[1024, 256]', 'dropout': 0.5669331941996397, 'batch_norm': False, 'lr': 0.0004706677147236052, 'weight_decay': 1.0426761162929084e-06, 'epochs': 54, 'loss': 'mse', 'optimizer': 'adamw', 'use_snp_selection': False, 'n_pcs': 3500}. Best is trial 11 with value: 0.22631097742542755.
2026-06-01 11:01:04 | INFO | Trial 21 | outer=1 | hidden=[512, 64] epochs=131 lr=3.044e-04 wd=1.487e-05 n_pcs=4500 weight={'name': 'uniform'}
[I 2026-06-01 11:01:12,724] Trial 21 finished with value: 0.21478614000094787 and parameters: {'hidden_dims': '[512, 64]', 'dropout': 0.03637087674642864, 'batch_norm': False, 'lr': 0.0003043678164173743, 'weight_decay': 1.4870894604538526e-05, 'epochs': 131, 'loss': 'mae', 'optimizer': 'adamw', 'use_snp_selection': False, 'n_pcs': 4500}. Best is trial 11 with value: 0.22631097742542755.
2026-06-01 11:01:12 | INFO | Trial 22 | outer=1 | hidden=[512, 64] epochs=121 lr=3.368e-04 wd=8.072e-07 n_pcs=4500 weight={'name': 'uniform'}
[I 2026-06-01 11:01:20,434] Trial 22 finished with value: 0.20707592239400996 and parameters: {'hidden_dims': '[512, 64]', 'dropout': 0.02167652115129237, 'batch_norm': False, 'lr': 0.00033680120387256696, 'weight_decay': 8.072287679012886e-07, 'epochs': 121, 'loss': 'mae', 'optimizer': 'adamw', 'use_snp_selection': False, 'n_pcs': 4500}. Best is trial 11 with value: 0.22631097742542755.
2026-06-01 11:01:20 | INFO | Trial 23 | outer=1 | hidden=[512, 64] epochs=82 lr=2.194e-04 wd=4.131e-04 n_pcs=5000 weight={'name': 'uniform'}
[I 2026-06-01 11:01:26,718] Trial 23 finished with value: 0.21278356649506164 and parameters: {'hidden_dims': '[512, 64]', 'dropout': 0.33833767906148926, 'batch_norm': False, 'lr': 0.00021941221164217058, 'weight_decay': 0.00041305892869488337, 'epochs': 82, 'loss': 'mae', 'optimizer': 'adamw', 'use_snp_selection': False, 'n_pcs': 5000}. Best is trial 11 with value: 0.22631097742542755.
2026-06-01 11:01:26 | INFO | Trial 24 | outer=1 | hidden=[512, 128] epochs=181 lr=1.069e-04 wd=4.274e-05 n_pcs=3500 weight={'name': 'uniform'}
[I 2026-06-01 11:01:35,589] Trial 24 finished with value: 0.1894328427611866 and parameters: {'hidden_dims': '[512, 128]', 'dropout': 0.2442792551609736, 'batch_norm': False, 'lr': 0.00010693227215877452, 'weight_decay': 4.2737941552308845e-05, 'epochs': 181, 'loss': 'mae', 'optimizer': 'adamw', 'use_snp_selection': False, 'n_pcs': 3500}. Best is trial 11 with value: 0.22631097742542755.
2026-06-01 11:01:35 | INFO | Trial 25 | outer=1 | hidden=[512, 128] epochs=76 lr=3.502e-04 wd=5.887e-05 n_pcs=4000 weight={'name': 'uniform'}
[I 2026-06-01 11:01:40,890] Trial 25 finished with value: 0.21510439144692825 and parameters: {'hidden_dims': '[512, 128]', 'dropout': 0.43442476928918805, 'batch_norm': False, 'lr': 0.00035021135251787824, 'weight_decay': 5.887125409755201e-05, 'epochs': 76, 'loss': 'mae', 'optimizer': 'adamw', 'use_snp_selection': False, 'n_pcs': 4000}. Best is trial 11 with value: 0.22631097742542755.
2026-06-01 11:01:40 | INFO | Trial 26 | outer=1 | hidden=[512, 128] epochs=74 lr=3.970e-04 wd=8.166e-05 n_pcs=4000 weight={'name': 'uniform'}
[I 2026-06-01 11:01:46,108] Trial 26 finished with value: 0.18852511603660832 and parameters: {'hidden_dims': '[512, 128]', 'dropout': 0.4566950331754423, 'batch_norm': False, 'lr': 0.00039696111756321305, 'weight_decay': 8.165914712567754e-05, 'epochs': 74, 'loss': 'mae', 'optimizer': 'adamw', 'use_snp_selection': False, 'n_pcs': 4000}. Best is trial 11 with value: 0.22631097742542755.
2026-06-01 11:01:46 | INFO | Trial 27 | outer=1 | hidden=[512, 128] epochs=100 lr=2.220e-04 wd=4.867e-04 n_pcs=3500 weight={'name': 'uniform'}
[I 2026-06-01 11:01:51,950] Trial 27 finished with value: 0.19112812755063902 and parameters: {'hidden_dims': '[512, 128]', 'dropout': 0.5318570678417512, 'batch_norm': False, 'lr': 0.00022202295891932586, 'weight_decay': 0.000486734980389944, 'epochs': 100, 'loss': 'mse', 'optimizer': 'adam', 'use_snp_selection': False, 'n_pcs': 3500}. Best is trial 11 with value: 0.22631097742542755.
2026-06-01 11:01:51 | INFO | Trial 28 | outer=1 | hidden=[512, 128] epochs=70 lr=3.807e-04 wd=1.736e-04 n_pcs=500 weight={'name': 'uniform'}
[I 2026-06-01 11:01:54,443] Trial 28 finished with value: 0.21065813559017968 and parameters: {'hidden_dims': '[512, 128]', 'dropout': 0.4025929063529901, 'batch_norm': False, 'lr': 0.00038065736099142296, 'weight_decay': 0.00017357553595308614, 'epochs': 70, 'loss': 'mae', 'optimizer': 'adamw', 'use_snp_selection': False, 'n_pcs': 500}. Best is trial 11 with value: 0.22631097742542755.
2026-06-01 11:01:54 | INFO | Trial 29 | outer=1 | hidden=[256, 64] epochs=94 lr=1.019e-04 wd=5.162e-05 n_pcs=1500 weight={'name': 'uniform'}
[I 2026-06-01 11:01:57,316] Trial 29 finished with value: 0.16596891629240668 and parameters: {'hidden_dims': '[256, 64]', 'dropout': 0.5012789528088679, 'batch_norm': False, 'lr': 0.00010189082739054402, 'weight_decay': 5.1617734060626504e-05, 'epochs': 94, 'loss': 'mae', 'optimizer': 'adamw', 'use_snp_selection': False, 'n_pcs': 1500}. Best is trial 11 with value: 0.22631097742542755.
2026-06-01 11:01:57 | INFO | Trial 30 | outer=1 | hidden=[512, 128] epochs=110 lr=1.400e-04 wd=6.159e-04 n_pcs=4000 weight={'name': 'uniform'}
[I 2026-06-01 11:02:03,990] Trial 30 finished with value: 0.19670460334820325 and parameters: {'hidden_dims': '[512, 128]', 'dropout': 0.5568744379221654, 'batch_norm': False, 'lr': 0.00013999736911367812, 'weight_decay': 0.0006158946258135905, 'epochs': 110, 'loss': 'mse', 'optimizer': 'adamw', 'use_snp_selection': False, 'n_pcs': 4000}. Best is trial 11 with value: 0.22631097742542755.
2026-06-01 11:02:04 | INFO | Trial 31 | outer=1 | hidden=[512, 64] epochs=123 lr=2.698e-04 wd=1.524e-05 n_pcs=4500 weight={'name': 'uniform'}
[I 2026-06-01 11:02:11,761] Trial 31 finished with value: 0.2083957588121949 and parameters: {'hidden_dims': '[512, 64]', 'dropout': 0.4299488958494685, 'batch_norm': False, 'lr': 0.0002698387237822057, 'weight_decay': 1.524342145552582e-05, 'epochs': 123, 'loss': 'mae', 'optimizer': 'adamw', 'use_snp_selection': False, 'n_pcs': 4500}. Best is trial 11 with value: 0.22631097742542755.
2026-06-01 11:02:11 | INFO | Trial 32 | outer=1 | hidden=[1024, 256] epochs=53 lr=4.928e-04 wd=2.100e-05 n_pcs=5000 weight={'name': 'uniform'}
[I 2026-06-01 11:02:19,523] Trial 32 finished with value: 0.21322715517600446 and parameters: {'hidden_dims': '[1024, 256]', 'dropout': 0.5979287432000954, 'batch_norm': False, 'lr': 0.0004927514386292822, 'weight_decay': 2.100158170835191e-05, 'epochs': 53, 'loss': 'mae', 'optimizer': 'adamw', 'use_snp_selection': False, 'n_pcs': 5000}. Best is trial 11 with value: 0.22631097742542755.
2026-06-01 11:02:19 | INFO | Trial 33 | outer=1 | hidden=[256, 64] epochs=151 lr=1.708e-04 wd=1.035e-06 n_pcs=4500 weight={'name': 'uniform'}
[I 2026-06-01 11:02:25,414] Trial 33 finished with value: 0.21704624385278937 and parameters: {'hidden_dims': '[256, 64]', 'dropout': 0.23479715924383554, 'batch_norm': False, 'lr': 0.00017081415987902046, 'weight_decay': 1.0348537240887984e-06, 'epochs': 151, 'loss': 'mae', 'optimizer': 'adamw', 'use_snp_selection': False, 'n_pcs': 4500}. Best is trial 11 with value: 0.22631097742542755.
2026-06-01 11:02:25 | INFO | Trial 34 | outer=1 | hidden=[256, 64] epochs=149 lr=1.660e-04 wd=1.023e-06 n_pcs=4000 weight={'name': 'uniform'}
[I 2026-06-01 11:02:30,757] Trial 34 finished with value: 0.191805588485299 and parameters: {'hidden_dims': '[256, 64]', 'dropout': 0.22497224564552926, 'batch_norm': False, 'lr': 0.0001660124040738104, 'weight_decay': 1.0228244840784779e-06, 'epochs': 149, 'loss': 'mae', 'optimizer': 'adamw', 'use_snp_selection': False, 'n_pcs': 4000}. Best is trial 11 with value: 0.22631097742542755.
2026-06-01 11:02:30 | INFO | Trial 35 | outer=1 | hidden=[256, 64] epochs=185 lr=2.355e-04 wd=3.517e-07 n_pcs=4500 weight={'name': 'uniform'}
[I 2026-06-01 11:02:37,485] Trial 35 finished with value: 0.20862093905987553 and parameters: {'hidden_dims': '[256, 64]', 'dropout': 0.3449857312404706, 'batch_norm': False, 'lr': 0.00023553410589078878, 'weight_decay': 3.517025621506329e-07, 'epochs': 185, 'loss': 'mae', 'optimizer': 'adam', 'use_snp_selection': False, 'n_pcs': 4500}. Best is trial 11 with value: 0.22631097742542755.
2026-06-01 11:02:37 | INFO | Trial 36 | outer=1 | hidden=[256, 64] epochs=157 lr=6.143e-05 wd=2.470e-06 n_pcs=3500 weight={'name': 'uniform'}
[I 2026-06-01 11:02:42,625] Trial 36 finished with value: 0.1734014424952915 and parameters: {'hidden_dims': '[256, 64]', 'dropout': 0.2491348902036959, 'batch_norm': False, 'lr': 6.142871705044981e-05, 'weight_decay': 2.47049342253882e-06, 'epochs': 157, 'loss': 'mae', 'optimizer': 'adamw', 'use_snp_selection': False, 'n_pcs': 3500}. Best is trial 11 with value: 0.22631097742542755.
2026-06-01 11:02:42 | INFO | Trial 37 | outer=1 | hidden=[256, 128] epochs=237 lr=3.871e-04 wd=2.926e-04 n_pcs=5000 weight={'name': 'uniform'}
[I 2026-06-01 11:02:51,151] Trial 37 finished with value: 0.21277007330450806 and parameters: {'hidden_dims': '[256, 128]', 'dropout': 0.49004055904848853, 'batch_norm': False, 'lr': 0.0003870944493219778, 'weight_decay': 0.00029258220256629013, 'epochs': 237, 'loss': 'mse', 'optimizer': 'adam', 'use_snp_selection': False, 'n_pcs': 5000}. Best is trial 11 with value: 0.22631097742542755.
2026-06-01 11:02:51 | INFO | Trial 38 | outer=1 | hidden=[256, 64] epochs=71 lr=1.036e-04 wd=3.264e-07 n_pcs=3000 weight={'name': 'uniform'}
