[I 2026-06-01 14:51:12,667] Trial 133 finished with value: 0.20503414078239118 and parameters: {'hidden_dims': '[256, 128]', 'dropout': 0.4314416516340099, 'batch_norm': False, 'lr': 0.00013436998445606437, 'weight_decay': 6.4324231580837326e-06, 'epochs': 174, 'loss': 'mae', 'optimizer': 'adam', 'use_snp_selection': False, 'n_pcs': 1000}. Best is trial 121 with value: 0.21629387946261183.
2026-06-01 14:51:12 | INFO | Trial 134 | outer=11 | hidden=[256, 128] epochs=171 lr=1.368e-04 wd=1.105e-05 n_pcs=1000 weight={'name': 'uniform'}
[I 2026-06-01 14:51:16,369] Trial 134 finished with value: 0.1946726113288333 and parameters: {'hidden_dims': '[256, 128]', 'dropout': 0.4317282880026453, 'batch_norm': False, 'lr': 0.00013677097894893177, 'weight_decay': 1.1049311041377498e-05, 'epochs': 171, 'loss': 'mae', 'optimizer': 'adam', 'use_snp_selection': False, 'n_pcs': 1000}. Best is trial 121 with value: 0.21629387946261183.
2026-06-01 14:51:16 | INFO | Trial 135 | outer=11 | hidden=[512, 256] epochs=165 lr=1.001e-04 wd=5.376e-06 n_pcs=1000 weight={'name': 'uniform'}
[I 2026-06-01 14:51:20,943] Trial 135 finished with value: 0.20879524256620458 and parameters: {'hidden_dims': '[512, 256]', 'dropout': 0.45344163912389024, 'batch_norm': False, 'lr': 0.00010006927297095069, 'weight_decay': 5.375817681831455e-06, 'epochs': 165, 'loss': 'mae', 'optimizer': 'adam', 'use_snp_selection': False, 'n_pcs': 1000}. Best is trial 121 with value: 0.21629387946261183.
2026-06-01 14:51:20 | INFO | Trial 136 | outer=11 | hidden=[512, 256] epochs=165 lr=1.163e-04 wd=4.630e-06 n_pcs=1000 weight={'name': 'uniform'}
[I 2026-06-01 14:51:25,522] Trial 136 finished with value: 0.19668607709080538 and parameters: {'hidden_dims': '[512, 256]', 'dropout': 0.4577585849885519, 'batch_norm': False, 'lr': 0.00011627164396737037, 'weight_decay': 4.630442758137948e-06, 'epochs': 165, 'loss': 'mae', 'optimizer': 'adam', 'use_snp_selection': False, 'n_pcs': 1000}. Best is trial 121 with value: 0.21629387946261183.
2026-06-01 14:51:25 | INFO | Trial 137 | outer=11 | hidden=[512, 256] epochs=174 lr=1.494e-04 wd=6.574e-06 n_pcs=500 weight={'name': 'uniform'}
[I 2026-06-01 14:51:29,421] Trial 137 finished with value: 0.18529552740765623 and parameters: {'hidden_dims': '[512, 256]', 'dropout': 0.44721206725120066, 'batch_norm': False, 'lr': 0.00014943508543983948, 'weight_decay': 6.574268348863222e-06, 'epochs': 174, 'loss': 'mae', 'optimizer': 'adam', 'use_snp_selection': False, 'n_pcs': 500}. Best is trial 121 with value: 0.21629387946261183.
2026-06-01 14:51:29 | INFO | Trial 138 | outer=11 | hidden=[512, 256] epochs=144 lr=8.374e-05 wd=5.937e-06 n_pcs=1000 weight={'name': 'uniform'}
[I 2026-06-01 14:51:33,598] Trial 138 finished with value: 0.2299030183399927 and parameters: {'hidden_dims': '[512, 256]', 'dropout': 0.4173485286022045, 'batch_norm': False, 'lr': 8.374245740175952e-05, 'weight_decay': 5.937068253898744e-06, 'epochs': 144, 'loss': 'mae', 'optimizer': 'adam', 'use_snp_selection': False, 'n_pcs': 1000}. Best is trial 138 with value: 0.2299030183399927.
2026-06-01 14:51:33 | INFO | Trial 139 | outer=11 | hidden=[512, 256] epochs=129 lr=8.173e-05 wd=6.132e-06 n_pcs=1000 weight={'name': 'uniform'}
[I 2026-06-01 14:51:37,529] Trial 139 finished with value: 0.17996041877396873 and parameters: {'hidden_dims': '[512, 256]', 'dropout': 0.3898144577972262, 'batch_norm': False, 'lr': 8.172981949261304e-05, 'weight_decay': 6.131811156061165e-06, 'epochs': 129, 'loss': 'mae', 'optimizer': 'adam', 'use_snp_selection': False, 'n_pcs': 1000}. Best is trial 138 with value: 0.2299030183399927.
2026-06-01 14:51:37 | INFO | Trial 140 | outer=11 | hidden=[512, 256] epochs=152 lr=8.876e-05 wd=2.636e-06 n_pcs=500 weight={'name': 'uniform'}
[I 2026-06-01 14:51:41,114] Trial 140 finished with value: 0.17739959115460469 and parameters: {'hidden_dims': '[512, 256]', 'dropout': 0.4094961500696082, 'batch_norm': False, 'lr': 8.87619362621792e-05, 'weight_decay': 2.6364394932519557e-06, 'epochs': 152, 'loss': 'mae', 'optimizer': 'adam', 'use_snp_selection': False, 'n_pcs': 500}. Best is trial 138 with value: 0.2299030183399927.
2026-06-01 14:51:41 | INFO | Trial 141 | outer=11 | hidden=[512, 256] epochs=158 lr=1.011e-04 wd=8.262e-06 n_pcs=1000 weight={'name': 'uniform'}
[I 2026-06-01 14:51:45,548] Trial 141 finished with value: 0.1962187730021311 and parameters: {'hidden_dims': '[512, 256]', 'dropout': 0.4322360944144593, 'batch_norm': False, 'lr': 0.00010108674107275726, 'weight_decay': 8.262196203859981e-06, 'epochs': 158, 'loss': 'mae', 'optimizer': 'adam', 'use_snp_selection': False, 'n_pcs': 1000}. Best is trial 138 with value: 0.2299030183399927.
2026-06-01 14:51:45 | INFO | Trial 142 | outer=11 | hidden=[512, 256] epochs=164 lr=1.091e-04 wd=1.206e-05 n_pcs=1000 weight={'name': 'uniform'}
[I 2026-06-01 14:51:50,088] Trial 142 finished with value: 0.20918867407200695 and parameters: {'hidden_dims': '[512, 256]', 'dropout': 0.42300003586118967, 'batch_norm': False, 'lr': 0.0001091105234316841, 'weight_decay': 1.2060999766646435e-05, 'epochs': 164, 'loss': 'mae', 'optimizer': 'adam', 'use_snp_selection': False, 'n_pcs': 1000}. Best is trial 138 with value: 0.2299030183399927.
2026-06-01 14:51:50 | INFO | Trial 143 | outer=11 | hidden=[512, 256] epochs=144 lr=1.052e-04 wd=1.298e-05 n_pcs=1000 weight={'name': 'uniform'}
[I 2026-06-01 14:51:54,257] Trial 143 finished with value: 0.205630661658724 and parameters: {'hidden_dims': '[512, 256]', 'dropout': 0.4168379069703621, 'batch_norm': False, 'lr': 0.00010521587789972487, 'weight_decay': 1.298476903076534e-05, 'epochs': 144, 'loss': 'mae', 'optimizer': 'adam', 'use_snp_selection': False, 'n_pcs': 1000}. Best is trial 138 with value: 0.2299030183399927.
2026-06-01 14:51:54 | INFO | Trial 144 | outer=11 | hidden=[512, 256] epochs=144 lr=1.092e-04 wd=1.208e-05 n_pcs=1000 weight={'name': 'uniform'}
[I 2026-06-01 14:51:58,439] Trial 144 finished with value: 0.2098057783982452 and parameters: {'hidden_dims': '[512, 256]', 'dropout': 0.4587861123475662, 'batch_norm': False, 'lr': 0.00010915677736317578, 'weight_decay': 1.2083626171987706e-05, 'epochs': 144, 'loss': 'mae', 'optimizer': 'adam', 'use_snp_selection': False, 'n_pcs': 1000}. Best is trial 138 with value: 0.2299030183399927.
2026-06-01 14:51:58 | INFO | Trial 145 | outer=11 | hidden=[512, 256] epochs=135 lr=1.124e-04 wd=1.333e-05 n_pcs=1000 weight={'name': 'uniform'}
[I 2026-06-01 14:52:02,485] Trial 145 finished with value: 0.19410457566952416 and parameters: {'hidden_dims': '[512, 256]', 'dropout': 0.41142929055715277, 'batch_norm': False, 'lr': 0.00011238554895884117, 'weight_decay': 1.3327236307546201e-05, 'epochs': 135, 'loss': 'mae', 'optimizer': 'adam', 'use_snp_selection': False, 'n_pcs': 1000}. Best is trial 138 with value: 0.2299030183399927.
2026-06-01 14:52:02 | INFO | Trial 146 | outer=11 | hidden=[512, 256] epochs=146 lr=1.076e-04 wd=1.032e-05 n_pcs=1000 weight={'name': 'uniform'}
[I 2026-06-01 14:52:06,713] Trial 146 finished with value: 0.19644252891046948 and parameters: {'hidden_dims': '[512, 256]', 'dropout': 0.3807365556257703, 'batch_norm': False, 'lr': 0.00010756573237600938, 'weight_decay': 1.0316217971783229e-05, 'epochs': 146, 'loss': 'mae', 'optimizer': 'adam', 'use_snp_selection': False, 'n_pcs': 1000}. Best is trial 138 with value: 0.2299030183399927.
2026-06-01 14:52:06 | INFO | Trial 147 | outer=11 | hidden=[512, 128] epochs=143 lr=9.310e-05 wd=1.842e-05 n_pcs=4500 weight={'name': 'uniform'}
[I 2026-06-01 14:52:15,467] Trial 147 finished with value: 0.18582844774813792 and parameters: {'hidden_dims': '[512, 128]', 'dropout': 0.44945291098160295, 'batch_norm': False, 'lr': 9.310432370789166e-05, 'weight_decay': 1.84195785515459e-05, 'epochs': 143, 'loss': 'mae', 'optimizer': 'adam', 'use_snp_selection': False, 'n_pcs': 4500}. Best is trial 138 with value: 0.2299030183399927.
2026-06-01 14:52:15 | INFO | Trial 148 | outer=11 | hidden=[512, 256] epochs=138 lr=8.436e-05 wd=2.742e-05 n_pcs=1500 weight={'name': 'uniform'}
[I 2026-06-01 14:52:20,227] Trial 148 finished with value: 0.2064380589971817 and parameters: {'hidden_dims': '[512, 256]', 'dropout': 0.4203502922235602, 'batch_norm': False, 'lr': 8.436203138023666e-05, 'weight_decay': 2.7419931078250763e-05, 'epochs': 138, 'loss': 'mae', 'optimizer': 'adam', 'use_snp_selection': False, 'n_pcs': 1500}. Best is trial 138 with value: 0.2299030183399927.
2026-06-01 14:52:20 | INFO | Trial 149 | outer=11 | hidden=[512, 256] epochs=150 lr=7.351e-05 wd=2.329e-05 n_pcs=1500 weight={'name': 'uniform'}
[I 2026-06-01 14:52:25,247] Trial 149 finished with value: 0.17552186665355227 and parameters: {'hidden_dims': '[512, 256]', 'dropout': 0.42007762515231994, 'batch_norm': False, 'lr': 7.351036624010227e-05, 'weight_decay': 2.3294168945607057e-05, 'epochs': 150, 'loss': 'mae', 'optimizer': 'adam', 'use_snp_selection': False, 'n_pcs': 1500}. Best is trial 138 with value: 0.2299030183399927.
2026-06-01 14:52:25 | INFO | OUTER 11 best (inner mean r=0.2299): model={'hidden_dims': [512, 256], 'dropout': 0.4173485286022045, 'batch_norm': False, 'lr': 8.374245740175952e-05, 'weight_decay': 5.937068253898744e-06, 'epochs': 144, 'loss': 'mae', 'optimizer': 'adam', 'use_snp_selection': False, 'n_pcs': 1000} weighting={'name': 'uniform'}
2026-06-01 14:52:25 | INFO | OUTER 11 TEST r = 0.1109
2026-06-01 14:52:25 | INFO | OUTER 11 incremental summary saved to outputs/final_results/e8_pc_mlp_uniform/thr_wing/e8_pc_mlp_uniform_thr_wing_results.json
2026-06-01 14:52:25 | INFO | OUTER 12: test_size=581 island=11 (Leka)
2026-06-01 14:52:25 | INFO | OUTER 12: inner LOIO validation islands: 0(Nesøy), 1(Myken), 2(Træna), 3(Selvær), 4(Gjerøy), 5(Hestmannøy), 6(Indre Kvarøy), 7(Onøy og Lurøy), 8(Lovund), 9(Sleneset), 10(Aldra), 12(Vega), 13(Vikna), 14(Lauvøya)
2026-06-01 14:52:26 | INFO | OUTER 12: using top 10 related inner validation islands for tuning: 13(Vikna, avgGRM=0.0117), 14(Lauvøya, avgGRM=0.0077), 12(Vega, avgGRM=-0.0031), 8(Lovund, avgGRM=-0.0080), 3(Selvær, avgGRM=-0.0081), 2(Træna, avgGRM=-0.0085), 0(Nesøy, avgGRM=-0.0085), 9(Sleneset, avgGRM=-0.0089), 10(Aldra, avgGRM=-0.0094), 7(Onøy og Lurøy, avgGRM=-0.0099)
[I 2026-06-01 14:52:26,004] A new study created in memory with name: mlp_importance_inner_outer11
2026-06-01 14:52:26 | INFO | Trial 0 | outer=12 | hidden=[256, 64] epochs=252 lr=8.243e-05 wd=1.277e-07 n_pcs=1500 weight={'name': 'uniform'}
[I 2026-06-01 14:52:30,777] Trial 0 finished with value: 0.1472780608843304 and parameters: {'hidden_dims': '[256, 64]', 'dropout': 0.19097065492325918, 'batch_norm': False, 'lr': 8.242985198911028e-05, 'weight_decay': 1.277246473139888e-07, 'epochs': 252, 'loss': 'mae', 'optimizer': 'adamw', 'use_snp_selection': False, 'n_pcs': 1500}. Best is trial 0 with value: 0.1472780608843304.
2026-06-01 14:52:30 | INFO | Trial 1 | outer=12 | hidden=[1024, 256] epochs=225 lr=1.391e-04 wd=1.941e-07 n_pcs=500 weight={'name': 'uniform'}
[I 2026-06-01 14:52:36,981] Trial 1 finished with value: 0.1294999350328292 and parameters: {'hidden_dims': '[1024, 256]', 'dropout': 0.2849434595702811, 'batch_norm': False, 'lr': 0.00013909108684683413, 'weight_decay': 1.9407167964924495e-07, 'epochs': 225, 'loss': 'mse', 'optimizer': 'adamw', 'use_snp_selection': False, 'n_pcs': 500}. Best is trial 0 with value: 0.1472780608843304.
2026-06-01 14:52:36 | INFO | Trial 2 | outer=12 | hidden=[256, 64] epochs=139 lr=3.957e-05 wd=3.750e-05 n_pcs=2500 weight={'name': 'uniform'}
[I 2026-06-01 14:52:40,759] Trial 2 finished with value: 0.13426089643013903 and parameters: {'hidden_dims': '[256, 64]', 'dropout': 0.11392712587675291, 'batch_norm': False, 'lr': 3.9573351157697276e-05, 'weight_decay': 3.7502337000845044e-05, 'epochs': 139, 'loss': 'mae', 'optimizer': 'adam', 'use_snp_selection': False, 'n_pcs': 2500}. Best is trial 0 with value: 0.1472780608843304.
2026-06-01 14:52:40 | INFO | Trial 3 | outer=12 | hidden=[128, 64] epochs=164 lr=1.538e-05 wd=3.248e-06 n_pcs=3000 weight={'name': 'uniform'}
[I 2026-06-01 14:52:44,562] Trial 3 finished with value: 0.10302416713513604 and parameters: {'hidden_dims': '[128, 64]', 'dropout': 0.1479874991503876, 'batch_norm': False, 'lr': 1.5380732370316375e-05, 'weight_decay': 3.2478890969962294e-06, 'epochs': 164, 'loss': 'mse', 'optimizer': 'adam', 'use_snp_selection': False, 'n_pcs': 3000}. Best is trial 0 with value: 0.1472780608843304.
2026-06-01 14:52:44 | INFO | Trial 4 | outer=12 | hidden=[256, 128] epochs=210 lr=7.298e-05 wd=7.875e-06 n_pcs=3000 weight={'name': 'uniform'}
[I 2026-06-01 14:52:49,972] Trial 4 finished with value: 0.15225611435855507 and parameters: {'hidden_dims': '[256, 128]', 'dropout': 0.09917626474860408, 'batch_norm': False, 'lr': 7.298380589156323e-05, 'weight_decay': 7.875094299510188e-06, 'epochs': 210, 'loss': 'mae', 'optimizer': 'adam', 'use_snp_selection': False, 'n_pcs': 3000}. Best is trial 4 with value: 0.15225611435855507.
2026-06-01 14:52:49 | INFO | Trial 5 | outer=12 | hidden=[512, 128] epochs=284 lr=5.467e-05 wd=5.496e-06 n_pcs=4000 weight={'name': 'uniform'}
[I 2026-06-01 14:53:02,952] Trial 5 finished with value: 0.15538626702058944 and parameters: {'hidden_dims': '[512, 128]', 'dropout': 0.3143696126156032, 'batch_norm': False, 'lr': 5.46667545989349e-05, 'weight_decay': 5.496446859789657e-06, 'epochs': 284, 'loss': 'mse', 'optimizer': 'adamw', 'use_snp_selection': False, 'n_pcs': 4000}. Best is trial 5 with value: 0.15538626702058944.
2026-06-01 14:53:02 | INFO | Trial 6 | outer=12 | hidden=[512, 64] epochs=90 lr=3.103e-05 wd=6.607e-08 n_pcs=5000 weight={'name': 'uniform'}
[I 2026-06-01 14:53:06,715] Trial 6 pruned. 
2026-06-01 14:53:06 | INFO | Trial 7 | outer=12 | hidden=[128, 64] epochs=272 lr=1.348e-05 wd=1.075e-07 n_pcs=4000 weight={'name': 'uniform'}
[I 2026-06-01 14:53:09,971] Trial 7 pruned. 
2026-06-01 14:53:09 | INFO | Trial 8 | outer=12 | hidden=[128, 64] epochs=205 lr=1.815e-05 wd=5.764e-06 n_pcs=3000 weight={'name': 'uniform'}
[I 2026-06-01 14:53:12,680] Trial 8 pruned. 
2026-06-01 14:53:12 | INFO | Trial 9 | outer=12 | hidden=[128, 64] epochs=296 lr=2.338e-05 wd=1.066e-07 n_pcs=2500 weight={'name': 'uniform'}
[I 2026-06-01 14:53:18,230] Trial 9 finished with value: 0.1291380430790431 and parameters: {'hidden_dims': '[128, 64]', 'dropout': 0.17607378181405245, 'batch_norm': False, 'lr': 2.3379083621874488e-05, 'weight_decay': 1.0663581123617794e-07, 'epochs': 296, 'loss': 'mae', 'optimizer': 'adam', 'use_snp_selection': False, 'n_pcs': 2500}. Best is trial 5 with value: 0.15538626702058944.
2026-06-01 14:53:18 | INFO | Trial 10 | outer=12 | hidden=[512, 128] epochs=110 lr=3.984e-04 wd=9.453e-04 n_pcs=5000 weight={'name': 'uniform'}
[I 2026-06-01 14:53:25,396] Trial 10 finished with value: 0.1827078424621637 and parameters: {'hidden_dims': '[512, 128]', 'dropout': 0.5941683348553323, 'batch_norm': False, 'lr': 0.0003983594610602333, 'weight_decay': 0.0009452683165453212, 'epochs': 110, 'loss': 'mse', 'optimizer': 'adamw', 'use_snp_selection': False, 'n_pcs': 5000}. Best is trial 10 with value: 0.1827078424621637.
2026-06-01 14:53:25 | INFO | Trial 11 | outer=12 | hidden=[512, 128] epochs=55 lr=3.985e-04 wd=9.792e-04 n_pcs=5000 weight={'name': 'uniform'}
[I 2026-06-01 14:53:30,138] Trial 11 finished with value: 0.16749243672265685 and parameters: {'hidden_dims': '[512, 128]', 'dropout': 0.5588382083491101, 'batch_norm': False, 'lr': 0.00039850138867195595, 'weight_decay': 0.0009792126502143, 'epochs': 55, 'loss': 'mse', 'optimizer': 'adamw', 'use_snp_selection': False, 'n_pcs': 5000}. Best is trial 10 with value: 0.1827078424621637.
2026-06-01 14:53:30 | INFO | Trial 12 | outer=12 | hidden=[512, 128] epochs=60 lr=4.988e-04 wd=8.865e-04 n_pcs=5000 weight={'name': 'uniform'}
[I 2026-06-01 14:53:35,104] Trial 12 finished with value: 0.16161855408616416 and parameters: {'hidden_dims': '[512, 128]', 'dropout': 0.5906998896000112, 'batch_norm': False, 'lr': 0.0004987709837145536, 'weight_decay': 0.0008865268327078721, 'epochs': 60, 'loss': 'mse', 'optimizer': 'adamw', 'use_snp_selection': False, 'n_pcs': 5000}. Best is trial 10 with value: 0.1827078424621637.
2026-06-01 14:53:35 | INFO | Trial 13 | outer=12 | hidden=[512, 128] epochs=110 lr=4.127e-04 wd=8.328e-04 n_pcs=4000 weight={'name': 'uniform'}
[I 2026-06-01 14:53:41,434] Trial 13 finished with value: 0.1658893184935281 and parameters: {'hidden_dims': '[512, 128]', 'dropout': 0.5966098843632991, 'batch_norm': False, 'lr': 0.00041268707845253474, 'weight_decay': 0.0008327861371916481, 'epochs': 110, 'loss': 'mse', 'optimizer': 'adamw', 'use_snp_selection': False, 'n_pcs': 4000}. Best is trial 10 with value: 0.1827078424621637.
2026-06-01 14:53:41 | INFO | Trial 14 | outer=12 | hidden=[512, 256] epochs=68 lr=1.905e-04 wd=1.266e-04 n_pcs=5000 weight={'name': 'uniform'}
[I 2026-06-01 14:53:46,897] Trial 14 finished with value: 0.1429877967515335 and parameters: {'hidden_dims': '[512, 256]', 'dropout': 0.0019307147896985288, 'batch_norm': False, 'lr': 0.0001905075436633139, 'weight_decay': 0.00012663736825721254, 'epochs': 68, 'loss': 'mse', 'optimizer': 'adamw', 'use_snp_selection': False, 'n_pcs': 5000}. Best is trial 10 with value: 0.1827078424621637.
2026-06-01 14:53:46 | INFO | Trial 15 | outer=12 | hidden=[512, 128] epochs=127 lr=2.546e-04 wd=1.504e-04 n_pcs=4500 weight={'name': 'uniform'}
[I 2026-06-01 14:53:54,494] Trial 15 finished with value: 0.1623936026543959 and parameters: {'hidden_dims': '[512, 128]', 'dropout': 0.47887352351165985, 'batch_norm': False, 'lr': 0.0002545862829798732, 'weight_decay': 0.00015042906504681534, 'epochs': 127, 'loss': 'mse', 'optimizer': 'adamw', 'use_snp_selection': False, 'n_pcs': 4500}. Best is trial 10 with value: 0.1827078424621637.
2026-06-01 14:53:54 | INFO | Trial 16 | outer=12 | hidden=[512, 128] epochs=51 lr=2.875e-04 wd=1.742e-04 n_pcs=4500 weight={'name': 'uniform'}
[I 2026-06-01 14:53:58,874] Trial 16 finished with value: 0.16903462129905492 and parameters: {'hidden_dims': '[512, 128]', 'dropout': 0.39762479725485356, 'batch_norm': False, 'lr': 0.00028751918488680294, 'weight_decay': 0.00017416232297649785, 'epochs': 51, 'loss': 'mse', 'optimizer': 'adamw', 'use_snp_selection': False, 'n_pcs': 4500}. Best is trial 10 with value: 0.1827078424621637.
2026-06-01 14:53:58 | INFO | Trial 17 | outer=12 | hidden=[512, 256] epochs=93 lr=2.588e-04 wd=1.184e-08 n_pcs=3500 weight={'name': 'uniform'}
[I 2026-06-01 14:54:04,274] Trial 17 finished with value: 0.14677307981434312 and parameters: {'hidden_dims': '[512, 256]', 'dropout': 0.3950918489307103, 'batch_norm': False, 'lr': 0.0002587786856585776, 'weight_decay': 1.1840058441529551e-08, 'epochs': 93, 'loss': 'mse', 'optimizer': 'adamw', 'use_snp_selection': False, 'n_pcs': 3500}. Best is trial 10 with value: 0.1827078424621637.
2026-06-01 14:54:04 | INFO | Trial 18 | outer=12 | hidden=[512, 64] epochs=161 lr=1.249e-04 wd=1.740e-04 n_pcs=4500 weight={'name': 'uniform'}
[I 2026-06-01 14:54:13,162] Trial 18 finished with value: 0.1699534418757636 and parameters: {'hidden_dims': '[512, 64]', 'dropout': 0.41065855593730954, 'batch_norm': False, 'lr': 0.0001249241458532576, 'weight_decay': 0.00017398452004087039, 'epochs': 161, 'loss': 'mae', 'optimizer': 'adamw', 'use_snp_selection': False, 'n_pcs': 4500}. Best is trial 10 with value: 0.1827078424621637.
2026-06-01 14:54:13 | INFO | Trial 19 | outer=12 | hidden=[512, 64] epochs=165 lr=1.126e-04 wd=3.307e-05 n_pcs=1500 weight={'name': 'uniform'}
[I 2026-06-01 14:54:17,696] Trial 19 finished with value: 0.15448095964888103 and parameters: {'hidden_dims': '[512, 64]', 'dropout': 0.5188442407371238, 'batch_norm': False, 'lr': 0.00011262326801061943, 'weight_decay': 3.3067625699771746e-05, 'epochs': 165, 'loss': 'mae', 'optimizer': 'adamw', 'use_snp_selection': False, 'n_pcs': 1500}. Best is trial 10 with value: 0.1827078424621637.
2026-06-01 14:54:17 | INFO | Trial 20 | outer=12 | hidden=[512, 64] epochs=144 lr=1.251e-04 wd=2.652e-05 n_pcs=4500 weight={'name': 'uniform'}
[I 2026-06-01 14:54:25,895] Trial 20 finished with value: 0.17533962758190103 and parameters: {'hidden_dims': '[512, 64]', 'dropout': 0.3630981371362819, 'batch_norm': False, 'lr': 0.00012507298855762912, 'weight_decay': 2.65198304499336e-05, 'epochs': 144, 'loss': 'mae', 'optimizer': 'adamw', 'use_snp_selection': False, 'n_pcs': 4500}. Best is trial 10 with value: 0.1827078424621637.
2026-06-01 14:54:25 | INFO | Trial 21 | outer=12 | hidden=[512, 64] epochs=145 lr=1.326e-04 wd=2.214e-05 n_pcs=4500 weight={'name': 'uniform'}
[I 2026-06-01 14:54:34,132] Trial 21 finished with value: 0.18466940506899376 and parameters: {'hidden_dims': '[512, 64]', 'dropout': 0.3561921095505709, 'batch_norm': False, 'lr': 0.00013259932841393484, 'weight_decay': 2.2144851798092178e-05, 'epochs': 145, 'loss': 'mae', 'optimizer': 'adamw', 'use_snp_selection': False, 'n_pcs': 4500}. Best is trial 21 with value: 0.18466940506899376.
2026-06-01 14:54:34 | INFO | Trial 22 | outer=12 | hidden=[512, 64] epochs=136 lr=1.658e-04 wd=6.380e-07 n_pcs=3500 weight={'name': 'uniform'}
[I 2026-06-01 14:54:38,094] Trial 22 pruned. 
2026-06-01 14:54:38 | INFO | Trial 23 | outer=12 | hidden=[512, 64] epochs=106 lr=1.068e-04 wd=2.195e-05 n_pcs=4500 weight={'name': 'uniform'}
[I 2026-06-01 14:54:44,718] Trial 23 finished with value: 0.15597729097574592 and parameters: {'hidden_dims': '[512, 64]', 'dropout': 0.24702762675660347, 'batch_norm': False, 'lr': 0.00010679963573805725, 'weight_decay': 2.1947074515165358e-05, 'epochs': 106, 'loss': 'mae', 'optimizer': 'adamw', 'use_snp_selection': False, 'n_pcs': 4500}. Best is trial 21 with value: 0.18466940506899376.
2026-06-01 14:54:44 | INFO | Trial 24 | outer=12 | hidden=[256, 128] epochs=183 lr=5.318e-05 wd=5.020e-07 n_pcs=4000 weight={'name': 'uniform'}
