[I 2026-06-01 15:01:37,762] Trial 68 finished with value: 0.15105886650278094 and parameters: {'hidden_dims': '[1024, 256]', 'dropout': 0.2785964622429815, 'batch_norm': False, 'lr': 9.874346432046767e-05, 'weight_decay': 0.0005834217231207549, 'epochs': 115, 'loss': 'mse', 'optimizer': 'adamw', 'use_snp_selection': False, 'n_pcs': 4500}. Best is trial 49 with value: 0.19278381368024503.
2026-06-01 15:01:37 | INFO | Trial 69 | outer=12 | hidden=[256, 64] epochs=142 lr=4.312e-04 wd=4.683e-05 n_pcs=4000 weight={'name': 'uniform'}
[I 2026-06-01 15:01:42,708] Trial 69 finished with value: 0.1562438491500944 and parameters: {'hidden_dims': '[256, 64]', 'dropout': 0.37225262539330556, 'batch_norm': False, 'lr': 0.000431169939268195, 'weight_decay': 4.68347129021249e-05, 'epochs': 142, 'loss': 'mse', 'optimizer': 'adam', 'use_snp_selection': False, 'n_pcs': 4000}. Best is trial 49 with value: 0.19278381368024503.
2026-06-01 15:01:42 | INFO | Trial 70 | outer=12 | hidden=[256, 128] epochs=146 lr=2.183e-04 wd=9.073e-05 n_pcs=5000 weight={'name': 'uniform'}
[I 2026-06-01 15:01:48,467] Trial 70 finished with value: 0.15706551772674932 and parameters: {'hidden_dims': '[256, 128]', 'dropout': 0.33342685430677566, 'batch_norm': False, 'lr': 0.00021829461680230564, 'weight_decay': 9.073207519926711e-05, 'epochs': 146, 'loss': 'mse', 'optimizer': 'adamw', 'use_snp_selection': False, 'n_pcs': 5000}. Best is trial 49 with value: 0.19278381368024503.
2026-06-01 15:01:48 | INFO | Trial 71 | outer=12 | hidden=[512, 256] epochs=264 lr=7.874e-05 wd=1.521e-05 n_pcs=4500 weight={'name': 'uniform'}
[I 2026-06-01 15:02:02,444] Trial 71 finished with value: 0.1612582755590132 and parameters: {'hidden_dims': '[512, 256]', 'dropout': 0.5190048734662597, 'batch_norm': False, 'lr': 7.874081963085774e-05, 'weight_decay': 1.5212869806017696e-05, 'epochs': 264, 'loss': 'mae', 'optimizer': 'adamw', 'use_snp_selection': False, 'n_pcs': 4500}. Best is trial 49 with value: 0.19278381368024503.
2026-06-01 15:02:02 | INFO | Trial 72 | outer=12 | hidden=[512, 256] epochs=193 lr=3.402e-04 wd=2.657e-05 n_pcs=4500 weight={'name': 'uniform'}
[I 2026-06-01 15:02:13,261] Trial 72 finished with value: 0.17920408090611534 and parameters: {'hidden_dims': '[512, 256]', 'dropout': 0.45884998932984133, 'batch_norm': False, 'lr': 0.0003401515476548267, 'weight_decay': 2.6573328738449065e-05, 'epochs': 193, 'loss': 'mae', 'optimizer': 'adamw', 'use_snp_selection': False, 'n_pcs': 4500}. Best is trial 49 with value: 0.19278381368024503.
2026-06-01 15:02:13 | INFO | Trial 73 | outer=12 | hidden=[512, 64] epochs=160 lr=3.250e-04 wd=6.659e-06 n_pcs=4000 weight={'name': 'uniform'}
[I 2026-06-01 15:02:21,357] Trial 73 finished with value: 0.17921467040301098 and parameters: {'hidden_dims': '[512, 64]', 'dropout': 0.598204976340475, 'batch_norm': False, 'lr': 0.0003249513394276639, 'weight_decay': 6.65893599773896e-06, 'epochs': 160, 'loss': 'mae', 'optimizer': 'adamw', 'use_snp_selection': False, 'n_pcs': 4000}. Best is trial 49 with value: 0.19278381368024503.
2026-06-01 15:02:21 | INFO | Trial 74 | outer=12 | hidden=[512, 256] epochs=173 lr=1.559e-04 wd=1.139e-05 n_pcs=5000 weight={'name': 'uniform'}
[I 2026-06-01 15:02:31,719] Trial 74 finished with value: 0.1930479103967875 and parameters: {'hidden_dims': '[512, 256]', 'dropout': 0.43126671053877885, 'batch_norm': False, 'lr': 0.00015585815880611584, 'weight_decay': 1.1385211405238423e-05, 'epochs': 173, 'loss': 'mae', 'optimizer': 'adamw', 'use_snp_selection': False, 'n_pcs': 5000}. Best is trial 74 with value: 0.1930479103967875.
2026-06-01 15:02:31 | INFO | Trial 75 | outer=12 | hidden=[512, 128] epochs=171 lr=1.370e-04 wd=3.788e-06 n_pcs=5000 weight={'name': 'uniform'}
[I 2026-06-01 15:02:41,689] Trial 75 finished with value: 0.1724763866188806 and parameters: {'hidden_dims': '[512, 128]', 'dropout': 0.3993811782607216, 'batch_norm': False, 'lr': 0.00013703742597271883, 'weight_decay': 3.7883036324526636e-06, 'epochs': 171, 'loss': 'mae', 'optimizer': 'adamw', 'use_snp_selection': False, 'n_pcs': 5000}. Best is trial 74 with value: 0.1930479103967875.
2026-06-01 15:02:41 | INFO | Trial 76 | outer=12 | hidden=[128, 64] epochs=299 lr=1.605e-04 wd=9.149e-06 n_pcs=5000 weight={'name': 'uniform'}
[I 2026-06-01 15:02:48,008] Trial 76 finished with value: 0.16038634876132246 and parameters: {'hidden_dims': '[128, 64]', 'dropout': 0.44159730130196356, 'batch_norm': False, 'lr': 0.00016048842447951767, 'weight_decay': 9.149122647237886e-06, 'epochs': 299, 'loss': 'mae', 'optimizer': 'adamw', 'use_snp_selection': False, 'n_pcs': 5000}. Best is trial 74 with value: 0.1930479103967875.
2026-06-01 15:02:48 | INFO | Trial 77 | outer=12 | hidden=[1024, 256] epochs=179 lr=2.479e-04 wd=2.030e-04 n_pcs=5000 weight={'name': 'uniform'}
[I 2026-06-01 15:03:06,564] Trial 77 finished with value: 0.19494852683910804 and parameters: {'hidden_dims': '[1024, 256]', 'dropout': 0.349001031213618, 'batch_norm': False, 'lr': 0.0002479447403848655, 'weight_decay': 0.00020302767192641847, 'epochs': 179, 'loss': 'mae', 'optimizer': 'adamw', 'use_snp_selection': False, 'n_pcs': 5000}. Best is trial 77 with value: 0.19494852683910804.
2026-06-01 15:03:06 | INFO | Trial 78 | outer=12 | hidden=[512, 64] epochs=177 lr=2.491e-04 wd=2.027e-04 n_pcs=5000 weight={'name': 'uniform'}
[I 2026-06-01 15:03:16,552] Trial 78 finished with value: 0.18851460276424764 and parameters: {'hidden_dims': '[512, 64]', 'dropout': 0.3534907191992937, 'batch_norm': False, 'lr': 0.00024911948972129884, 'weight_decay': 0.0002026852431915401, 'epochs': 177, 'loss': 'mae', 'optimizer': 'adamw', 'use_snp_selection': False, 'n_pcs': 5000}. Best is trial 77 with value: 0.19494852683910804.
2026-06-01 15:03:16 | INFO | Trial 79 | outer=12 | hidden=[512, 64] epochs=193 lr=2.525e-04 wd=1.355e-04 n_pcs=4500 weight={'name': 'uniform'}
[I 2026-06-01 15:03:26,782] Trial 79 finished with value: 0.18059461351519507 and parameters: {'hidden_dims': '[512, 64]', 'dropout': 0.3105671116737564, 'batch_norm': False, 'lr': 0.00025251700614303764, 'weight_decay': 0.0001354973656207073, 'epochs': 193, 'loss': 'mae', 'optimizer': 'adamw', 'use_snp_selection': False, 'n_pcs': 4500}. Best is trial 77 with value: 0.19494852683910804.
2026-06-01 15:03:26 | INFO | Trial 80 | outer=12 | hidden=[512, 64] epochs=180 lr=1.825e-04 wd=2.268e-04 n_pcs=5000 weight={'name': 'uniform'}
[I 2026-06-01 15:03:36,916] Trial 80 finished with value: 0.17182412076983647 and parameters: {'hidden_dims': '[512, 64]', 'dropout': 0.3417361415211386, 'batch_norm': False, 'lr': 0.00018253997145472727, 'weight_decay': 0.00022675550514266078, 'epochs': 180, 'loss': 'mae', 'optimizer': 'adam', 'use_snp_selection': False, 'n_pcs': 5000}. Best is trial 77 with value: 0.19494852683910804.
2026-06-01 15:03:36 | INFO | Trial 81 | outer=12 | hidden=[512, 64] epochs=177 lr=2.508e-04 wd=7.181e-04 n_pcs=5000 weight={'name': 'uniform'}
[I 2026-06-01 15:03:46,892] Trial 81 finished with value: 0.1770767077598979 and parameters: {'hidden_dims': '[512, 64]', 'dropout': 0.3564560382029142, 'batch_norm': False, 'lr': 0.0002508263059779702, 'weight_decay': 0.0007180923010815666, 'epochs': 177, 'loss': 'mae', 'optimizer': 'adamw', 'use_snp_selection': False, 'n_pcs': 5000}. Best is trial 77 with value: 0.19494852683910804.
2026-06-01 15:03:46 | INFO | Trial 82 | outer=12 | hidden=[512, 64] epochs=201 lr=2.918e-04 wd=2.858e-04 n_pcs=5000 weight={'name': 'uniform'}
[I 2026-06-01 15:03:57,916] Trial 82 finished with value: 0.1816912671738741 and parameters: {'hidden_dims': '[512, 64]', 'dropout': 0.3831149023851125, 'batch_norm': False, 'lr': 0.0002918427546780303, 'weight_decay': 0.00028579663818470045, 'epochs': 201, 'loss': 'mae', 'optimizer': 'adamw', 'use_snp_selection': False, 'n_pcs': 5000}. Best is trial 77 with value: 0.19494852683910804.
2026-06-01 15:03:57 | INFO | Trial 83 | outer=12 | hidden=[512, 256] epochs=169 lr=1.202e-04 wd=9.707e-05 n_pcs=5000 weight={'name': 'uniform'}
[I 2026-06-01 15:04:08,100] Trial 83 finished with value: 0.18992647899420065 and parameters: {'hidden_dims': '[512, 256]', 'dropout': 0.3245086661150672, 'batch_norm': False, 'lr': 0.00012020332878483753, 'weight_decay': 9.706986056196704e-05, 'epochs': 169, 'loss': 'mae', 'optimizer': 'adamw', 'use_snp_selection': False, 'n_pcs': 5000}. Best is trial 77 with value: 0.19494852683910804.
2026-06-01 15:04:08 | INFO | Trial 84 | outer=12 | hidden=[512, 256] epochs=166 lr=1.483e-04 wd=3.892e-05 n_pcs=4500 weight={'name': 'uniform'}
[I 2026-06-01 15:04:17,714] Trial 84 finished with value: 0.1734257806097405 and parameters: {'hidden_dims': '[512, 256]', 'dropout': 0.2601335772898794, 'batch_norm': False, 'lr': 0.0001483157580279996, 'weight_decay': 3.891656772449952e-05, 'epochs': 166, 'loss': 'mae', 'optimizer': 'adamw', 'use_snp_selection': False, 'n_pcs': 4500}. Best is trial 77 with value: 0.19494852683910804.
2026-06-01 15:04:17 | INFO | Trial 85 | outer=12 | hidden=[512, 256] epochs=188 lr=1.180e-04 wd=8.945e-05 n_pcs=5000 weight={'name': 'uniform'}
[I 2026-06-01 15:04:29,139] Trial 85 finished with value: 0.16851065777057783 and parameters: {'hidden_dims': '[512, 256]', 'dropout': 0.3262000599542679, 'batch_norm': False, 'lr': 0.00011798241619602585, 'weight_decay': 8.94540383223227e-05, 'epochs': 188, 'loss': 'mae', 'optimizer': 'adamw', 'use_snp_selection': False, 'n_pcs': 5000}. Best is trial 77 with value: 0.19494852683910804.
2026-06-01 15:04:29 | INFO | Trial 86 | outer=12 | hidden=[512, 256] epochs=174 lr=9.895e-05 wd=2.042e-04 n_pcs=5000 weight={'name': 'uniform'}
[I 2026-06-01 15:04:39,582] Trial 86 finished with value: 0.18484696000121847 and parameters: {'hidden_dims': '[512, 256]', 'dropout': 0.2899477363178696, 'batch_norm': False, 'lr': 9.894867198896472e-05, 'weight_decay': 0.00020423959695177024, 'epochs': 174, 'loss': 'mae', 'optimizer': 'adamw', 'use_snp_selection': False, 'n_pcs': 5000}. Best is trial 77 with value: 0.19494852683910804.
2026-06-01 15:04:39 | INFO | Trial 87 | outer=12 | hidden=[512, 256] epochs=213 lr=6.237e-05 wd=2.327e-04 n_pcs=4500 weight={'name': 'uniform'}
[I 2026-06-01 15:04:51,320] Trial 87 finished with value: 0.15345109122017286 and parameters: {'hidden_dims': '[512, 256]', 'dropout': 0.3545295706802323, 'batch_norm': False, 'lr': 6.237168746903664e-05, 'weight_decay': 0.000232663427905985, 'epochs': 213, 'loss': 'mae', 'optimizer': 'adamw', 'use_snp_selection': False, 'n_pcs': 4500}. Best is trial 77 with value: 0.19494852683910804.
2026-06-01 15:04:51 | INFO | Trial 88 | outer=12 | hidden=[512, 256] epochs=169 lr=8.133e-05 wd=5.453e-04 n_pcs=5000 weight={'name': 'uniform'}
[I 2026-06-01 15:05:01,553] Trial 88 finished with value: 0.16808879827887385 and parameters: {'hidden_dims': '[512, 256]', 'dropout': 0.28213380366119495, 'batch_norm': False, 'lr': 8.132606410825355e-05, 'weight_decay': 0.0005453101445064159, 'epochs': 169, 'loss': 'mae', 'optimizer': 'adamw', 'use_snp_selection': False, 'n_pcs': 5000}. Best is trial 77 with value: 0.19494852683910804.
2026-06-01 15:05:01 | INFO | Trial 89 | outer=12 | hidden=[512, 256] epochs=152 lr=1.022e-04 wd=1.185e-04 n_pcs=5000 weight={'name': 'uniform'}
[I 2026-06-01 15:05:10,955] Trial 89 finished with value: 0.14013612992876073 and parameters: {'hidden_dims': '[512, 256]', 'dropout': 0.23627247782115066, 'batch_norm': False, 'lr': 0.00010215277817712351, 'weight_decay': 0.00011851744428294071, 'epochs': 152, 'loss': 'mae', 'optimizer': 'adamw', 'use_snp_selection': False, 'n_pcs': 5000}. Best is trial 77 with value: 0.19494852683910804.
2026-06-01 15:05:10 | INFO | Trial 90 | outer=12 | hidden=[512, 256] epochs=173 lr=4.968e-05 wd=1.833e-04 n_pcs=3500 weight={'name': 'uniform'}
[I 2026-06-01 15:05:19,258] Trial 90 finished with value: 0.1324466671861742 and parameters: {'hidden_dims': '[512, 256]', 'dropout': 0.4092585983113852, 'batch_norm': False, 'lr': 4.968086289630688e-05, 'weight_decay': 0.00018334764579638218, 'epochs': 173, 'loss': 'mae', 'optimizer': 'adamw', 'use_snp_selection': False, 'n_pcs': 3500}. Best is trial 77 with value: 0.19494852683910804.
2026-06-01 15:05:19 | INFO | Trial 91 | outer=12 | hidden=[512, 256] epochs=161 lr=9.242e-05 wd=2.085e-05 n_pcs=5000 weight={'name': 'uniform'}
[I 2026-06-01 15:05:29,067] Trial 91 finished with value: 0.15819383947266977 and parameters: {'hidden_dims': '[512, 256]', 'dropout': 0.29314704581020373, 'batch_norm': False, 'lr': 9.242125246525698e-05, 'weight_decay': 2.085138834279074e-05, 'epochs': 161, 'loss': 'mae', 'optimizer': 'adamw', 'use_snp_selection': False, 'n_pcs': 5000}. Best is trial 77 with value: 0.19494852683910804.
2026-06-01 15:05:29 | INFO | Trial 92 | outer=12 | hidden=[1024, 256] epochs=179 lr=2.112e-04 wd=1.027e-04 n_pcs=5000 weight={'name': 'uniform'}
[I 2026-06-01 15:05:52,171] Trial 92 finished with value: 0.17433219614353485 and parameters: {'hidden_dims': '[1024, 256]', 'dropout': 0.3086676200718899, 'batch_norm': False, 'lr': 0.000211232437306614, 'weight_decay': 0.0001026649750408312, 'epochs': 179, 'loss': 'mae', 'optimizer': 'adamw', 'use_snp_selection': False, 'n_pcs': 5000}. Best is trial 77 with value: 0.19494852683910804.
2026-06-01 15:05:52 | INFO | Trial 93 | outer=12 | hidden=[512, 64] epochs=200 lr=1.251e-04 wd=1.775e-04 n_pcs=4500 weight={'name': 'uniform'}
[I 2026-06-01 15:06:02,710] Trial 93 finished with value: 0.16866262213356115 and parameters: {'hidden_dims': '[512, 64]', 'dropout': 0.47894185829017444, 'batch_norm': False, 'lr': 0.0001250559190424398, 'weight_decay': 0.00017749586176208366, 'epochs': 200, 'loss': 'mae', 'optimizer': 'adamw', 'use_snp_selection': False, 'n_pcs': 4500}. Best is trial 77 with value: 0.19494852683910804.
2026-06-01 15:06:02 | INFO | Trial 94 | outer=12 | hidden=[512, 64] epochs=185 lr=1.541e-04 wd=1.033e-05 n_pcs=5000 weight={'name': 'uniform'}
[I 2026-06-01 15:06:13,045] Trial 94 finished with value: 0.1672268751651303 and parameters: {'hidden_dims': '[512, 64]', 'dropout': 0.3218145599786875, 'batch_norm': False, 'lr': 0.00015407380790232193, 'weight_decay': 1.0330265436764768e-05, 'epochs': 185, 'loss': 'mae', 'optimizer': 'adamw', 'use_snp_selection': False, 'n_pcs': 5000}. Best is trial 77 with value: 0.19494852683910804.
2026-06-01 15:06:13 | INFO | Trial 95 | outer=12 | hidden=[256, 64] epochs=189 lr=1.365e-04 wd=6.227e-05 n_pcs=3000 weight={'name': 'uniform'}
[I 2026-06-01 15:06:16,197] Trial 95 pruned. 
2026-06-01 15:06:16 | INFO | Trial 96 | outer=12 | hidden=[512, 256] epochs=151 lr=1.783e-04 wd=4.377e-04 n_pcs=5000 weight={'name': 'uniform'}
[I 2026-06-01 15:06:25,526] Trial 96 finished with value: 0.17366076750726042 and parameters: {'hidden_dims': '[512, 256]', 'dropout': 0.29193859638173253, 'batch_norm': False, 'lr': 0.00017831644085066964, 'weight_decay': 0.00043767063345029805, 'epochs': 151, 'loss': 'mae', 'optimizer': 'adamw', 'use_snp_selection': False, 'n_pcs': 5000}. Best is trial 77 with value: 0.19494852683910804.
2026-06-01 15:06:25 | INFO | Trial 97 | outer=12 | hidden=[256, 128] epochs=132 lr=9.950e-05 wd=1.107e-06 n_pcs=5000 weight={'name': 'uniform'}
[I 2026-06-01 15:06:30,943] Trial 97 finished with value: 0.16946543703529368 and parameters: {'hidden_dims': '[256, 128]', 'dropout': 0.26235037001832096, 'batch_norm': False, 'lr': 9.949844866055904e-05, 'weight_decay': 1.1069145157860307e-06, 'epochs': 132, 'loss': 'mae', 'optimizer': 'adam', 'use_snp_selection': False, 'n_pcs': 5000}. Best is trial 77 with value: 0.19494852683910804.
2026-06-01 15:06:30 | INFO | Trial 98 | outer=12 | hidden=[512, 64] epochs=158 lr=1.120e-04 wd=2.725e-04 n_pcs=4500 weight={'name': 'uniform'}
[I 2026-06-01 15:06:39,710] Trial 98 finished with value: 0.17742974128175398 and parameters: {'hidden_dims': '[512, 64]', 'dropout': 0.3503866971564412, 'batch_norm': False, 'lr': 0.0001119519632135089, 'weight_decay': 0.0002725484012503681, 'epochs': 158, 'loss': 'mae', 'optimizer': 'adamw', 'use_snp_selection': False, 'n_pcs': 4500}. Best is trial 77 with value: 0.19494852683910804.
2026-06-01 15:06:39 | INFO | Trial 99 | outer=12 | hidden=[1024, 256] epochs=142 lr=3.562e-04 wd=3.418e-05 n_pcs=5000 weight={'name': 'uniform'}
[I 2026-06-01 15:06:54,923] Trial 99 finished with value: 0.18412256800785065 and parameters: {'hidden_dims': '[1024, 256]', 'dropout': 0.3340454208808289, 'batch_norm': False, 'lr': 0.0003561910123080631, 'weight_decay': 3.4181404824364233e-05, 'epochs': 142, 'loss': 'mae', 'optimizer': 'adam', 'use_snp_selection': False, 'n_pcs': 5000}. Best is trial 77 with value: 0.19494852683910804.
2026-06-01 15:06:54 | INFO | Trial 100 | outer=12 | hidden=[1024, 256] epochs=142 lr=3.739e-04 wd=3.069e-05 n_pcs=4500 weight={'name': 'uniform'}
[I 2026-06-01 15:07:09,230] Trial 100 finished with value: 0.18566547465521996 and parameters: {'hidden_dims': '[1024, 256]', 'dropout': 0.33465226646355073, 'batch_norm': False, 'lr': 0.0003739417956870643, 'weight_decay': 3.069250434134955e-05, 'epochs': 142, 'loss': 'mae', 'optimizer': 'adamw', 'use_snp_selection': False, 'n_pcs': 4500}. Best is trial 77 with value: 0.19494852683910804.
2026-06-01 15:07:09 | INFO | Trial 101 | outer=12 | hidden=[1024, 256] epochs=143 lr=3.626e-04 wd=5.000e-05 n_pcs=4500 weight={'name': 'uniform'}
[I 2026-06-01 15:07:23,621] Trial 101 finished with value: 0.19047685281578874 and parameters: {'hidden_dims': '[1024, 256]', 'dropout': 0.3371405160138712, 'batch_norm': False, 'lr': 0.0003626293893500144, 'weight_decay': 4.999864853165202e-05, 'epochs': 143, 'loss': 'mae', 'optimizer': 'adamw', 'use_snp_selection': False, 'n_pcs': 4500}. Best is trial 77 with value: 0.19494852683910804.
2026-06-01 15:07:23 | INFO | Trial 102 | outer=12 | hidden=[1024, 256] epochs=166 lr=8.771e-05 wd=2.608e-05 n_pcs=4500 weight={'name': 'uniform'}
[I 2026-06-01 15:07:39,949] Trial 102 finished with value: 0.1760304673714907 and parameters: {'hidden_dims': '[1024, 256]', 'dropout': 0.36682792128657116, 'batch_norm': False, 'lr': 8.771306632782591e-05, 'weight_decay': 2.6077534638502196e-05, 'epochs': 166, 'loss': 'mae', 'optimizer': 'adamw', 'use_snp_selection': False, 'n_pcs': 4500}. Best is trial 77 with value: 0.19494852683910804.
2026-06-01 15:07:39 | INFO | Trial 103 | outer=12 | hidden=[1024, 256] epochs=172 lr=7.499e-05 wd=5.258e-05 n_pcs=4000 weight={'name': 'uniform'}
[I 2026-06-01 15:07:55,080] Trial 103 finished with value: 0.168382666849284 and parameters: {'hidden_dims': '[1024, 256]', 'dropout': 0.33859581306509073, 'batch_norm': False, 'lr': 7.499005670369632e-05, 'weight_decay': 5.2577005947220474e-05, 'epochs': 172, 'loss': 'mae', 'optimizer': 'adamw', 'use_snp_selection': False, 'n_pcs': 4000}. Best is trial 77 with value: 0.19494852683910804.
2026-06-01 15:07:55 | INFO | Trial 104 | outer=12 | hidden=[1024, 256] epochs=157 lr=3.119e-04 wd=4.584e-05 n_pcs=4500 weight={'name': 'uniform'}
[I 2026-06-01 15:08:10,651] Trial 104 finished with value: 0.17890508325281718 and parameters: {'hidden_dims': '[1024, 256]', 'dropout': 0.32190772594745626, 'batch_norm': False, 'lr': 0.0003118614070889624, 'weight_decay': 4.583951261186837e-05, 'epochs': 157, 'loss': 'mae', 'optimizer': 'adamw', 'use_snp_selection': False, 'n_pcs': 4500}. Best is trial 77 with value: 0.19494852683910804.
2026-06-01 15:08:10 | INFO | Trial 105 | outer=12 | hidden=[1024, 256] epochs=147 lr=4.591e-04 wd=8.094e-05 n_pcs=4500 weight={'name': 'uniform'}
[I 2026-06-01 15:08:25,391] Trial 105 finished with value: 0.1855174204171667 and parameters: {'hidden_dims': '[1024, 256]', 'dropout': 0.3705637648711157, 'batch_norm': False, 'lr': 0.0004590889963152494, 'weight_decay': 8.094328933591655e-05, 'epochs': 147, 'loss': 'mae', 'optimizer': 'adamw', 'use_snp_selection': False, 'n_pcs': 4500}. Best is trial 77 with value: 0.19494852683910804.
2026-06-01 15:08:25 | INFO | Trial 106 | outer=12 | hidden=[1024, 256] epochs=196 lr=3.866e-04 wd=7.421e-05 n_pcs=4500 weight={'name': 'uniform'}
[I 2026-06-01 15:08:44,233] Trial 106 finished with value: 0.19070486791664953 and parameters: {'hidden_dims': '[1024, 256]', 'dropout': 0.37610519981336554, 'batch_norm': False, 'lr': 0.0003865557041078146, 'weight_decay': 7.420809057853463e-05, 'epochs': 196, 'loss': 'mae', 'optimizer': 'adamw', 'use_snp_selection': False, 'n_pcs': 4500}. Best is trial 77 with value: 0.19494852683910804.
2026-06-01 15:08:44 | INFO | Trial 107 | outer=12 | hidden=[1024, 256] epochs=124 lr=4.691e-04 wd=1.457e-04 n_pcs=4000 weight={'name': 'uniform'}
[I 2026-06-01 15:08:55,777] Trial 107 finished with value: 0.18546346032314714 and parameters: {'hidden_dims': '[1024, 256]', 'dropout': 0.37496803493917596, 'batch_norm': False, 'lr': 0.00046910324962106683, 'weight_decay': 0.00014569433076277888, 'epochs': 124, 'loss': 'mae', 'optimizer': 'adamw', 'use_snp_selection': False, 'n_pcs': 4000}. Best is trial 77 with value: 0.19494852683910804.
2026-06-01 15:08:55 | INFO | Trial 108 | outer=12 | hidden=[1024, 256] epochs=207 lr=4.631e-04 wd=1.242e-04 n_pcs=4000 weight={'name': 'uniform'}
[I 2026-06-01 15:09:13,533] Trial 108 finished with value: 0.17260047514548998 and parameters: {'hidden_dims': '[1024, 256]', 'dropout': 0.37744869198570963, 'batch_norm': False, 'lr': 0.0004631122964456105, 'weight_decay': 0.00012424746848380144, 'epochs': 207, 'loss': 'mae', 'optimizer': 'adamw', 'use_snp_selection': False, 'n_pcs': 4000}. Best is trial 77 with value: 0.19494852683910804.
2026-06-01 15:09:13 | INFO | Trial 109 | outer=12 | hidden=[1024, 256] epochs=149 lr=3.799e-04 wd=7.931e-05 n_pcs=4000 weight={'name': 'uniform'}
