[I 2026-06-01 14:31:14,321] Trial 70 finished with value: 0.17616987906210083 and parameters: {'hidden_dims': '[256, 128]', 'dropout': 0.3760227328663636, 'batch_norm': False, 'lr': 9.360450040467158e-05, 'weight_decay': 9.073207519926711e-05, 'epochs': 126, 'loss': 'mae', 'optimizer': 'adamw', 'use_snp_selection': False, 'n_pcs': 500}. Best is trial 66 with value: 0.20609455490485815.
2026-06-01 14:31:14 | INFO | Trial 71 | outer=10 | hidden=[512, 128] epochs=188 lr=6.448e-05 wd=9.977e-05 n_pcs=5000 weight={'name': 'uniform'}
[I 2026-06-01 14:31:25,718] Trial 71 finished with value: 0.1627306503896158 and parameters: {'hidden_dims': '[512, 128]', 'dropout': 0.46578711242117204, 'batch_norm': False, 'lr': 6.448283141962803e-05, 'weight_decay': 9.977251342425864e-05, 'epochs': 188, 'loss': 'mae', 'optimizer': 'adamw', 'use_snp_selection': False, 'n_pcs': 5000}. Best is trial 66 with value: 0.20609455490485815.
2026-06-01 14:31:25 | INFO | Trial 72 | outer=10 | hidden=[512, 256] epochs=162 lr=8.180e-05 wd=5.183e-04 n_pcs=4500 weight={'name': 'uniform'}
[I 2026-06-01 14:31:35,719] Trial 72 finished with value: 0.20758968433231528 and parameters: {'hidden_dims': '[512, 256]', 'dropout': 0.35054235331768835, 'batch_norm': False, 'lr': 8.179732505978401e-05, 'weight_decay': 0.0005182885990715871, 'epochs': 162, 'loss': 'mae', 'optimizer': 'adamw', 'use_snp_selection': False, 'n_pcs': 4500}. Best is trial 72 with value: 0.20758968433231528.
2026-06-01 14:31:35 | INFO | Trial 73 | outer=10 | hidden=[512, 256] epochs=160 lr=1.288e-04 wd=4.004e-04 n_pcs=4500 weight={'name': 'uniform'}
[I 2026-06-01 14:31:45,623] Trial 73 finished with value: 0.18582117759788588 and parameters: {'hidden_dims': '[512, 256]', 'dropout': 0.3529023365029937, 'batch_norm': False, 'lr': 0.00012876893522660896, 'weight_decay': 0.0004004322738024325, 'epochs': 160, 'loss': 'mae', 'optimizer': 'adamw', 'use_snp_selection': False, 'n_pcs': 4500}. Best is trial 72 with value: 0.20758968433231528.
2026-06-01 14:31:45 | INFO | Trial 74 | outer=10 | hidden=[512, 256] epochs=175 lr=8.006e-05 wd=5.804e-04 n_pcs=4500 weight={'name': 'uniform'}
[I 2026-06-01 14:31:56,249] Trial 74 finished with value: 0.17961893494289 and parameters: {'hidden_dims': '[512, 256]', 'dropout': 0.3175126416688915, 'batch_norm': False, 'lr': 8.005785776063804e-05, 'weight_decay': 0.0005804390198916922, 'epochs': 175, 'loss': 'mae', 'optimizer': 'adamw', 'use_snp_selection': False, 'n_pcs': 4500}. Best is trial 72 with value: 0.20758968433231528.
2026-06-01 14:31:56 | INFO | Trial 75 | outer=10 | hidden=[512, 256] epochs=143 lr=1.046e-04 wd=3.628e-05 n_pcs=5000 weight={'name': 'uniform'}
[I 2026-06-01 14:32:05,830] Trial 75 finished with value: 0.18555481390294176 and parameters: {'hidden_dims': '[512, 256]', 'dropout': 0.39530621012304973, 'batch_norm': False, 'lr': 0.00010459582874562586, 'weight_decay': 3.627800818898889e-05, 'epochs': 143, 'loss': 'mae', 'optimizer': 'adamw', 'use_snp_selection': False, 'n_pcs': 5000}. Best is trial 72 with value: 0.20758968433231528.
2026-06-01 14:32:05 | INFO | Trial 76 | outer=10 | hidden=[256, 64] epochs=299 lr=8.773e-05 wd=7.533e-04 n_pcs=4000 weight={'name': 'uniform'}
[I 2026-06-01 14:32:14,297] Trial 76 finished with value: 0.1764506821183725 and parameters: {'hidden_dims': '[256, 64]', 'dropout': 0.34115431030213994, 'batch_norm': False, 'lr': 8.773171580159864e-05, 'weight_decay': 0.0007533158218527611, 'epochs': 299, 'loss': 'mae', 'optimizer': 'adamw', 'use_snp_selection': False, 'n_pcs': 4000}. Best is trial 72 with value: 0.20758968433231528.
2026-06-01 14:32:14 | INFO | Trial 77 | outer=10 | hidden=[512, 256] epochs=153 lr=5.775e-05 wd=4.859e-04 n_pcs=4500 weight={'name': 'uniform'}
[I 2026-06-01 14:32:23,870] Trial 77 finished with value: 0.19226917681188124 and parameters: {'hidden_dims': '[512, 256]', 'dropout': 0.41482274556598364, 'batch_norm': False, 'lr': 5.775408025496787e-05, 'weight_decay': 0.00048585891269268617, 'epochs': 153, 'loss': 'mae', 'optimizer': 'adamw', 'use_snp_selection': False, 'n_pcs': 4500}. Best is trial 72 with value: 0.20758968433231528.
2026-06-01 14:32:23 | INFO | Trial 78 | outer=10 | hidden=[512, 64] epochs=283 lr=3.742e-04 wd=2.606e-04 n_pcs=4000 weight={'name': 'uniform'}
[I 2026-06-01 14:32:37,242] Trial 78 finished with value: 0.18956727954453584 and parameters: {'hidden_dims': '[512, 64]', 'dropout': 0.2990793394635578, 'batch_norm': False, 'lr': 0.0003741743638766766, 'weight_decay': 0.00026056098602903014, 'epochs': 283, 'loss': 'mae', 'optimizer': 'adamw', 'use_snp_selection': False, 'n_pcs': 4000}. Best is trial 72 with value: 0.20758968433231528.
2026-06-01 14:32:37 | INFO | Trial 79 | outer=10 | hidden=[128, 64] epochs=167 lr=1.734e-04 wd=2.300e-08 n_pcs=1000 weight={'name': 'uniform'}
[I 2026-06-01 14:32:40,965] Trial 79 finished with value: 0.20987859194971764 and parameters: {'hidden_dims': '[128, 64]', 'dropout': 0.3718233247611851, 'batch_norm': False, 'lr': 0.00017344327605777862, 'weight_decay': 2.3003480604580693e-08, 'epochs': 167, 'loss': 'mae', 'optimizer': 'adamw', 'use_snp_selection': False, 'n_pcs': 1000}. Best is trial 79 with value: 0.20987859194971764.
2026-06-01 14:32:40 | INFO | Trial 80 | outer=10 | hidden=[128, 64] epochs=169 lr=1.738e-04 wd=2.634e-08 n_pcs=1000 weight={'name': 'uniform'}
[I 2026-06-01 14:32:43,551] Trial 80 pruned. 
2026-06-01 14:32:43 | INFO | Trial 81 | outer=10 | hidden=[128, 64] epochs=184 lr=1.551e-04 wd=1.422e-08 n_pcs=1500 weight={'name': 'uniform'}
[I 2026-06-01 14:32:47,534] Trial 81 finished with value: 0.17578599988661198 and parameters: {'hidden_dims': '[128, 64]', 'dropout': 0.3668639798081794, 'batch_norm': False, 'lr': 0.00015512483893319876, 'weight_decay': 1.4215107077600357e-08, 'epochs': 184, 'loss': 'mae', 'optimizer': 'adamw', 'use_snp_selection': False, 'n_pcs': 1500}. Best is trial 79 with value: 0.20987859194971764.
2026-06-01 14:32:47 | INFO | Trial 82 | outer=10 | hidden=[128, 64] epochs=179 lr=2.719e-04 wd=5.162e-08 n_pcs=1000 weight={'name': 'uniform'}
[I 2026-06-01 14:32:51,352] Trial 82 finished with value: 0.20982234919766243 and parameters: {'hidden_dims': '[128, 64]', 'dropout': 0.3784477900465847, 'batch_norm': False, 'lr': 0.00027185391591075616, 'weight_decay': 5.161958278742678e-08, 'epochs': 179, 'loss': 'mae', 'optimizer': 'adamw', 'use_snp_selection': False, 'n_pcs': 1000}. Best is trial 79 with value: 0.20987859194971764.
2026-06-01 14:32:51 | INFO | Trial 83 | outer=10 | hidden=[128, 64] epochs=178 lr=2.772e-04 wd=2.333e-08 n_pcs=1000 weight={'name': 'uniform'}
[I 2026-06-01 14:32:55,158] Trial 83 finished with value: 0.19230544434217364 and parameters: {'hidden_dims': '[128, 64]', 'dropout': 0.381983286207306, 'batch_norm': False, 'lr': 0.0002771887798898855, 'weight_decay': 2.3326286640487363e-08, 'epochs': 178, 'loss': 'mae', 'optimizer': 'adamw', 'use_snp_selection': False, 'n_pcs': 1000}. Best is trial 79 with value: 0.20987859194971764.
2026-06-01 14:32:55 | INFO | Trial 84 | outer=10 | hidden=[128, 64] epochs=136 lr=2.213e-04 wd=1.409e-08 n_pcs=500 weight={'name': 'uniform'}
[I 2026-06-01 14:32:58,432] Trial 84 finished with value: 0.17091720738573826 and parameters: {'hidden_dims': '[128, 64]', 'dropout': 0.3543045721009174, 'batch_norm': False, 'lr': 0.0002213297348424443, 'weight_decay': 1.408736618965875e-08, 'epochs': 136, 'loss': 'mae', 'optimizer': 'adamw', 'use_snp_selection': False, 'n_pcs': 500}. Best is trial 79 with value: 0.20987859194971764.
2026-06-01 14:32:58 | INFO | Trial 85 | outer=10 | hidden=[128, 64] epochs=163 lr=3.068e-04 wd=1.795e-04 n_pcs=1000 weight={'name': 'uniform'}
[I 2026-06-01 14:33:02,049] Trial 85 finished with value: 0.19310749733345778 and parameters: {'hidden_dims': '[128, 64]', 'dropout': 0.3258011280990929, 'batch_norm': False, 'lr': 0.00030684015080166115, 'weight_decay': 0.00017946616625963253, 'epochs': 163, 'loss': 'mae', 'optimizer': 'adamw', 'use_snp_selection': False, 'n_pcs': 1000}. Best is trial 79 with value: 0.20987859194971764.
2026-06-01 14:33:02 | INFO | Trial 86 | outer=10 | hidden=[128, 64] epochs=152 lr=4.381e-04 wd=9.054e-08 n_pcs=1000 weight={'name': 'uniform'}
[I 2026-06-01 14:33:05,573] Trial 86 finished with value: 0.1768076804711505 and parameters: {'hidden_dims': '[128, 64]', 'dropout': 0.1307113374505738, 'batch_norm': False, 'lr': 0.00043806655479846187, 'weight_decay': 9.054355049420591e-08, 'epochs': 152, 'loss': 'mse', 'optimizer': 'adamw', 'use_snp_selection': False, 'n_pcs': 1000}. Best is trial 79 with value: 0.20987859194971764.
2026-06-01 14:33:05 | INFO | Trial 87 | outer=10 | hidden=[128, 64] epochs=170 lr=2.032e-04 wd=6.096e-04 n_pcs=1500 weight={'name': 'uniform'}
[I 2026-06-01 14:33:09,343] Trial 87 finished with value: 0.17650277037676515 and parameters: {'hidden_dims': '[128, 64]', 'dropout': 0.3461598192663397, 'batch_norm': False, 'lr': 0.00020324870403993887, 'weight_decay': 0.0006095925809990551, 'epochs': 170, 'loss': 'mae', 'optimizer': 'adamw', 'use_snp_selection': False, 'n_pcs': 1500}. Best is trial 79 with value: 0.20987859194971764.
2026-06-01 14:33:09 | INFO | Trial 88 | outer=10 | hidden=[256, 64] epochs=190 lr=1.179e-04 wd=2.162e-08 n_pcs=1500 weight={'name': 'uniform'}
[I 2026-06-01 14:33:13,391] Trial 88 finished with value: 0.18053393417296953 and parameters: {'hidden_dims': '[256, 64]', 'dropout': 0.3706323635489327, 'batch_norm': False, 'lr': 0.00011788962929901345, 'weight_decay': 2.161605869580152e-08, 'epochs': 190, 'loss': 'mae', 'optimizer': 'adamw', 'use_snp_selection': False, 'n_pcs': 1500}. Best is trial 79 with value: 0.20987859194971764.
2026-06-01 14:33:13 | INFO | Trial 89 | outer=10 | hidden=[1024, 256] epochs=180 lr=2.608e-04 wd=4.537e-08 n_pcs=500 weight={'name': 'uniform'}
[I 2026-06-01 14:33:17,812] Trial 89 pruned. 
2026-06-01 14:33:17 | INFO | Trial 90 | outer=10 | hidden=[256, 128] epochs=142 lr=1.905e-04 wd=3.718e-07 n_pcs=3500 weight={'name': 'uniform'}
[I 2026-06-01 14:33:22,684] Trial 90 finished with value: 0.17756446089198102 and parameters: {'hidden_dims': '[256, 128]', 'dropout': 0.2707723731496945, 'batch_norm': False, 'lr': 0.0001904591200993406, 'weight_decay': 3.71754482001774e-07, 'epochs': 142, 'loss': 'mae', 'optimizer': 'adamw', 'use_snp_selection': False, 'n_pcs': 3500}. Best is trial 79 with value: 0.20987859194971764.
2026-06-01 14:33:22 | INFO | Trial 91 | outer=10 | hidden=[256, 64] epochs=200 lr=1.438e-04 wd=5.533e-08 n_pcs=5000 weight={'name': 'uniform'}
[I 2026-06-01 14:33:30,021] Trial 91 finished with value: 0.16391354301999977 and parameters: {'hidden_dims': '[256, 64]', 'dropout': 0.4815130206698803, 'batch_norm': False, 'lr': 0.0001437782730344457, 'weight_decay': 5.533167420047594e-08, 'epochs': 200, 'loss': 'mae', 'optimizer': 'adamw', 'use_snp_selection': False, 'n_pcs': 5000}. Best is trial 79 with value: 0.20987859194971764.
2026-06-01 14:33:30 | INFO | Trial 92 | outer=10 | hidden=[128, 64] epochs=215 lr=1.704e-04 wd=1.289e-08 n_pcs=4500 weight={'name': 'uniform'}
[I 2026-06-01 14:33:35,172] Trial 92 finished with value: 0.17981624831821932 and parameters: {'hidden_dims': '[128, 64]', 'dropout': 0.4202455985338057, 'batch_norm': False, 'lr': 0.000170364195635704, 'weight_decay': 1.2892034711256572e-08, 'epochs': 215, 'loss': 'mae', 'optimizer': 'adamw', 'use_snp_selection': False, 'n_pcs': 4500}. Best is trial 79 with value: 0.20987859194971764.
2026-06-01 14:33:35 | INFO | Trial 93 | outer=10 | hidden=[512, 128] epochs=164 lr=3.354e-04 wd=1.985e-08 n_pcs=5000 weight={'name': 'uniform'}
[I 2026-06-01 14:33:45,393] Trial 93 finished with value: 0.20053076157894503 and parameters: {'hidden_dims': '[512, 128]', 'dropout': 0.3914293617772478, 'batch_norm': False, 'lr': 0.00033535217700024917, 'weight_decay': 1.984681003054709e-08, 'epochs': 164, 'loss': 'mae', 'optimizer': 'adamw', 'use_snp_selection': False, 'n_pcs': 5000}. Best is trial 79 with value: 0.20987859194971764.
2026-06-01 14:33:45 | INFO | Trial 94 | outer=10 | hidden=[512, 256] epochs=163 lr=3.395e-04 wd=1.810e-08 n_pcs=5000 weight={'name': 'uniform'}
[I 2026-06-01 14:33:55,954] Trial 94 finished with value: 0.20375957581644558 and parameters: {'hidden_dims': '[512, 256]', 'dropout': 0.3863386942577496, 'batch_norm': False, 'lr': 0.0003394821771613916, 'weight_decay': 1.8098148461930746e-08, 'epochs': 163, 'loss': 'mae', 'optimizer': 'adamw', 'use_snp_selection': False, 'n_pcs': 5000}. Best is trial 79 with value: 0.20987859194971764.
2026-06-01 14:33:55 | INFO | Trial 95 | outer=10 | hidden=[512, 256] epochs=176 lr=3.410e-04 wd=2.720e-08 n_pcs=5000 weight={'name': 'uniform'}
[I 2026-06-01 14:34:07,172] Trial 95 finished with value: 0.19174709470576154 and parameters: {'hidden_dims': '[512, 256]', 'dropout': 0.30912492423588345, 'batch_norm': False, 'lr': 0.00034104386439346644, 'weight_decay': 2.719684797852798e-08, 'epochs': 176, 'loss': 'mae', 'optimizer': 'adamw', 'use_snp_selection': False, 'n_pcs': 5000}. Best is trial 79 with value: 0.20987859194971764.
2026-06-01 14:34:07 | INFO | Trial 96 | outer=10 | hidden=[512, 256] epochs=161 lr=2.412e-04 wd=1.537e-08 n_pcs=5000 weight={'name': 'uniform'}
[I 2026-06-01 14:34:17,660] Trial 96 finished with value: 0.19704397401861767 and parameters: {'hidden_dims': '[512, 256]', 'dropout': 0.3762908113602216, 'batch_norm': False, 'lr': 0.00024120476876502575, 'weight_decay': 1.536819303071277e-08, 'epochs': 161, 'loss': 'mae', 'optimizer': 'adamw', 'use_snp_selection': False, 'n_pcs': 5000}. Best is trial 79 with value: 0.20987859194971764.
2026-06-01 14:34:17 | INFO | Trial 97 | outer=10 | hidden=[512, 256] epochs=172 lr=4.360e-04 wd=1.313e-04 n_pcs=1000 weight={'name': 'uniform'}
[I 2026-06-01 14:34:22,334] Trial 97 finished with value: 0.18521469460145543 and parameters: {'hidden_dims': '[512, 256]', 'dropout': 0.3327872524125666, 'batch_norm': False, 'lr': 0.00043602667158709323, 'weight_decay': 0.0001312677940767725, 'epochs': 172, 'loss': 'mae', 'optimizer': 'adam', 'use_snp_selection': False, 'n_pcs': 1000}. Best is trial 79 with value: 0.20987859194971764.
2026-06-01 14:34:22 | INFO | Trial 98 | outer=10 | hidden=[512, 256] epochs=121 lr=2.182e-04 wd=5.279e-06 n_pcs=1000 weight={'name': 'uniform'}
[I 2026-06-01 14:34:26,092] Trial 98 finished with value: 0.18883529547291056 and parameters: {'hidden_dims': '[512, 256]', 'dropout': 0.3579266519779555, 'batch_norm': False, 'lr': 0.0002182387524219921, 'weight_decay': 5.279116066017468e-06, 'epochs': 121, 'loss': 'mse', 'optimizer': 'adamw', 'use_snp_selection': False, 'n_pcs': 1000}. Best is trial 79 with value: 0.20987859194971764.
2026-06-01 14:34:26 | INFO | Trial 99 | outer=10 | hidden=[512, 64] epochs=149 lr=1.091e-04 wd=1.320e-07 n_pcs=5000 weight={'name': 'uniform'}
[I 2026-06-01 14:34:35,467] Trial 99 finished with value: 0.15848355128748878 and parameters: {'hidden_dims': '[512, 64]', 'dropout': 0.40477062879186254, 'batch_norm': False, 'lr': 0.00010911833621500365, 'weight_decay': 1.320457463100668e-07, 'epochs': 149, 'loss': 'mae', 'optimizer': 'adamw', 'use_snp_selection': False, 'n_pcs': 5000}. Best is trial 79 with value: 0.20987859194971764.
2026-06-01 14:34:35 | INFO | Trial 100 | outer=10 | hidden=[256, 64] epochs=158 lr=1.317e-04 wd=1.205e-06 n_pcs=1500 weight={'name': 'uniform'}
[I 2026-06-01 14:34:39,103] Trial 100 finished with value: 0.19041755663533597 and parameters: {'hidden_dims': '[256, 64]', 'dropout': 0.44349627192246155, 'batch_norm': False, 'lr': 0.00013169389296579815, 'weight_decay': 1.2046295245974422e-06, 'epochs': 158, 'loss': 'mae', 'optimizer': 'adamw', 'use_snp_selection': False, 'n_pcs': 1500}. Best is trial 79 with value: 0.20987859194971764.
2026-06-01 14:34:39 | INFO | Trial 101 | outer=10 | hidden=[512, 128] epochs=165 lr=3.213e-04 wd=1.926e-08 n_pcs=5000 weight={'name': 'uniform'}
[I 2026-06-01 14:34:49,393] Trial 101 finished with value: 0.19290622813959307 and parameters: {'hidden_dims': '[512, 128]', 'dropout': 0.3907334582765118, 'batch_norm': False, 'lr': 0.00032133036670545245, 'weight_decay': 1.925985780760256e-08, 'epochs': 165, 'loss': 'mae', 'optimizer': 'adamw', 'use_snp_selection': False, 'n_pcs': 5000}. Best is trial 79 with value: 0.20987859194971764.
2026-06-01 14:34:49 | INFO | Trial 102 | outer=10 | hidden=[512, 128] epochs=183 lr=3.823e-04 wd=1.763e-08 n_pcs=5000 weight={'name': 'uniform'}
[I 2026-06-01 14:35:00,545] Trial 102 finished with value: 0.18934806096598156 and parameters: {'hidden_dims': '[512, 128]', 'dropout': 0.3928777692536929, 'batch_norm': False, 'lr': 0.00038231398905046323, 'weight_decay': 1.7626861244232228e-08, 'epochs': 183, 'loss': 'mae', 'optimizer': 'adamw', 'use_snp_selection': False, 'n_pcs': 5000}. Best is trial 79 with value: 0.20987859194971764.
2026-06-01 14:35:00 | INFO | Trial 103 | outer=10 | hidden=[512, 128] epochs=167 lr=2.692e-04 wd=1.244e-08 n_pcs=4500 weight={'name': 'uniform'}
[I 2026-06-01 14:35:10,378] Trial 103 finished with value: 0.20754593663261503 and parameters: {'hidden_dims': '[512, 128]', 'dropout': 0.42783002533863623, 'batch_norm': False, 'lr': 0.00026917809763876585, 'weight_decay': 1.2443834169805604e-08, 'epochs': 167, 'loss': 'mae', 'optimizer': 'adamw', 'use_snp_selection': False, 'n_pcs': 4500}. Best is trial 79 with value: 0.20987859194971764.
2026-06-01 14:35:10 | INFO | Trial 104 | outer=10 | hidden=[256, 128] epochs=187 lr=2.874e-04 wd=1.273e-08 n_pcs=4500 weight={'name': 'uniform'}
[I 2026-06-01 14:35:17,189] Trial 104 finished with value: 0.19079507965503523 and parameters: {'hidden_dims': '[256, 128]', 'dropout': 0.427694304032251, 'batch_norm': False, 'lr': 0.00028737111157749813, 'weight_decay': 1.2728334310373848e-08, 'epochs': 187, 'loss': 'mae', 'optimizer': 'adamw', 'use_snp_selection': False, 'n_pcs': 4500}. Best is trial 79 with value: 0.20987859194971764.
2026-06-01 14:35:17 | INFO | Trial 105 | outer=10 | hidden=[512, 256] epochs=167 lr=9.714e-05 wd=1.030e-08 n_pcs=4500 weight={'name': 'uniform'}
[I 2026-06-01 14:35:27,440] Trial 105 finished with value: 0.18803435659587325 and parameters: {'hidden_dims': '[512, 256]', 'dropout': 0.34544513215987466, 'batch_norm': False, 'lr': 9.714239017819127e-05, 'weight_decay': 1.0303893883264695e-08, 'epochs': 167, 'loss': 'mae', 'optimizer': 'adamw', 'use_snp_selection': False, 'n_pcs': 4500}. Best is trial 79 with value: 0.20987859194971764.
2026-06-01 14:35:27 | INFO | Trial 106 | outer=10 | hidden=[256, 64] epochs=193 lr=2.601e-04 wd=4.028e-08 n_pcs=4500 weight={'name': 'uniform'}
[I 2026-06-01 14:35:34,307] Trial 106 finished with value: 0.18807922137501343 and parameters: {'hidden_dims': '[256, 64]', 'dropout': 0.45746612575708867, 'batch_norm': False, 'lr': 0.00026014691362755176, 'weight_decay': 4.028090090580648e-08, 'epochs': 193, 'loss': 'mae', 'optimizer': 'adam', 'use_snp_selection': False, 'n_pcs': 4500}. Best is trial 79 with value: 0.20987859194971764.
2026-06-01 14:35:34 | INFO | Trial 107 | outer=10 | hidden=[512, 128] epochs=174 lr=8.098e-05 wd=3.136e-08 n_pcs=4500 weight={'name': 'uniform'}
[I 2026-06-01 14:35:44,442] Trial 107 finished with value: 0.19063994494929787 and parameters: {'hidden_dims': '[512, 128]', 'dropout': 0.5780505205705175, 'batch_norm': False, 'lr': 8.098285772827021e-05, 'weight_decay': 3.136402163109204e-08, 'epochs': 174, 'loss': 'mae', 'optimizer': 'adamw', 'use_snp_selection': False, 'n_pcs': 4500}. Best is trial 79 with value: 0.20987859194971764.
2026-06-01 14:35:44 | INFO | Trial 108 | outer=10 | hidden=[1024, 256] epochs=181 lr=1.915e-04 wd=2.745e-08 n_pcs=4000 weight={'name': 'uniform'}
[I 2026-06-01 14:36:01,466] Trial 108 finished with value: 0.19498196336798823 and parameters: {'hidden_dims': '[1024, 256]', 'dropout': 0.41057196245156863, 'batch_norm': False, 'lr': 0.00019150265573969385, 'weight_decay': 2.7445289798554173e-08, 'epochs': 181, 'loss': 'mae', 'optimizer': 'adamw', 'use_snp_selection': False, 'n_pcs': 4000}. Best is trial 79 with value: 0.20987859194971764.
2026-06-01 14:36:01 | INFO | Trial 109 | outer=10 | hidden=[512, 128] epochs=132 lr=2.374e-04 wd=1.329e-05 n_pcs=3000 weight={'name': 'uniform'}
[I 2026-06-01 14:36:07,654] Trial 109 finished with value: 0.1984027525449701 and parameters: {'hidden_dims': '[512, 128]', 'dropout': 0.369541855631977, 'batch_norm': False, 'lr': 0.00023738736491887307, 'weight_decay': 1.3289614140424524e-05, 'epochs': 132, 'loss': 'mae', 'optimizer': 'adamw', 'use_snp_selection': False, 'n_pcs': 3000}. Best is trial 79 with value: 0.20987859194971764.
2026-06-01 14:36:07 | INFO | Trial 110 | outer=10 | hidden=[128, 64] epochs=155 lr=1.622e-04 wd=8.068e-05 n_pcs=5000 weight={'name': 'uniform'}
[I 2026-06-01 14:36:12,157] Trial 110 finished with value: 0.16397393648095474 and parameters: {'hidden_dims': '[128, 64]', 'dropout': 0.4358479484038766, 'batch_norm': False, 'lr': 0.00016220176092966176, 'weight_decay': 8.067586987685473e-05, 'epochs': 155, 'loss': 'mae', 'optimizer': 'adam', 'use_snp_selection': False, 'n_pcs': 5000}. Best is trial 79 with value: 0.20987859194971764.
2026-06-01 14:36:12 | INFO | Trial 111 | outer=10 | hidden=[512, 128] epochs=161 lr=3.344e-04 wd=2.253e-08 n_pcs=5000 weight={'name': 'uniform'}
[I 2026-06-01 14:36:22,271] Trial 111 finished with value: 0.20408409263062183 and parameters: {'hidden_dims': '[512, 128]', 'dropout': 0.37571965110455585, 'batch_norm': False, 'lr': 0.00033443353822893617, 'weight_decay': 2.2534085761197923e-08, 'epochs': 161, 'loss': 'mae', 'optimizer': 'adamw', 'use_snp_selection': False, 'n_pcs': 5000}. Best is trial 79 with value: 0.20987859194971764.
2026-06-01 14:36:22 | INFO | Trial 112 | outer=10 | hidden=[512, 128] epochs=159 lr=4.351e-04 wd=1.684e-08 n_pcs=5000 weight={'name': 'uniform'}
