[I 2026-06-01 13:00:49,115] Trial 102 finished with value: 0.22724491336009275 and parameters: {'hidden_dims': '[1024, 256]', 'dropout': 0.06843946934665412, 'batch_norm': False, 'lr': 0.00040698668978691083, 'weight_decay': 7.152673050496908e-07, 'epochs': 122, 'loss': 'mse', 'optimizer': 'adamw', 'use_snp_selection': False, 'n_pcs': 5000}. Best is trial 91 with value: 0.23662448930322574.
2026-06-01 13:00:49 | INFO | Trial 103 | outer=5 | hidden=[1024, 256] epochs=123 lr=4.142e-04 wd=6.614e-07 n_pcs=5000 weight={'name': 'uniform'}
[I 2026-06-01 13:01:02,632] Trial 103 finished with value: 0.21837359805861306 and parameters: {'hidden_dims': '[1024, 256]', 'dropout': 0.0709150739850935, 'batch_norm': False, 'lr': 0.00041419081368048073, 'weight_decay': 6.613667368004993e-07, 'epochs': 123, 'loss': 'mse', 'optimizer': 'adamw', 'use_snp_selection': False, 'n_pcs': 5000}. Best is trial 91 with value: 0.23662448930322574.
2026-06-01 13:01:02 | INFO | Trial 104 | outer=5 | hidden=[1024, 256] epochs=107 lr=4.591e-04 wd=3.750e-07 n_pcs=5000 weight={'name': 'uniform'}
[I 2026-06-01 13:01:14,714] Trial 104 finished with value: 0.21435896962726822 and parameters: {'hidden_dims': '[1024, 256]', 'dropout': 0.03751251467247619, 'batch_norm': False, 'lr': 0.0004591377026141102, 'weight_decay': 3.7496244546884395e-07, 'epochs': 107, 'loss': 'mse', 'optimizer': 'adamw', 'use_snp_selection': False, 'n_pcs': 5000}. Best is trial 91 with value: 0.23662448930322574.
2026-06-01 13:01:14 | INFO | Trial 105 | outer=5 | hidden=[256, 64] epochs=136 lr=3.322e-04 wd=4.871e-07 n_pcs=5000 weight={'name': 'uniform'}
[I 2026-06-01 13:01:20,174] Trial 105 finished with value: 0.20535378023418063 and parameters: {'hidden_dims': '[256, 64]', 'dropout': 0.10445188256582211, 'batch_norm': False, 'lr': 0.0003322390488910846, 'weight_decay': 4.871127294631952e-07, 'epochs': 136, 'loss': 'mse', 'optimizer': 'adamw', 'use_snp_selection': False, 'n_pcs': 5000}. Best is trial 91 with value: 0.23662448930322574.
2026-06-01 13:01:20 | INFO | Trial 106 | outer=5 | hidden=[1024, 256] epochs=96 lr=1.361e-04 wd=1.003e-06 n_pcs=5000 weight={'name': 'uniform'}
[I 2026-06-01 13:01:26,766] Trial 106 pruned. 
2026-06-01 13:01:26 | INFO | Trial 107 | outer=5 | hidden=[128, 64] epochs=113 lr=4.248e-04 wd=6.998e-07 n_pcs=5000 weight={'name': 'uniform'}
[I 2026-06-01 13:01:30,480] Trial 107 finished with value: 0.1821279000068834 and parameters: {'hidden_dims': '[128, 64]', 'dropout': 0.11824812845550683, 'batch_norm': False, 'lr': 0.0004248152565623613, 'weight_decay': 6.997899798943561e-07, 'epochs': 113, 'loss': 'mse', 'optimizer': 'adamw', 'use_snp_selection': False, 'n_pcs': 5000}. Best is trial 91 with value: 0.23662448930322574.
2026-06-01 13:01:30 | INFO | Trial 108 | outer=5 | hidden=[512, 256] epochs=88 lr=3.605e-04 wd=5.122e-07 n_pcs=4500 weight={'name': 'uniform'}
[I 2026-06-01 13:01:36,616] Trial 108 finished with value: 0.20552295502754578 and parameters: {'hidden_dims': '[512, 256]', 'dropout': 0.03126753352943196, 'batch_norm': False, 'lr': 0.0003605135726445624, 'weight_decay': 5.121605059994661e-07, 'epochs': 88, 'loss': 'mse', 'optimizer': 'adamw', 'use_snp_selection': False, 'n_pcs': 4500}. Best is trial 91 with value: 0.23662448930322574.
2026-06-01 13:01:36 | INFO | Trial 109 | outer=5 | hidden=[1024, 256] epochs=132 lr=2.567e-04 wd=2.072e-07 n_pcs=5000 weight={'name': 'uniform'}
[I 2026-06-01 13:01:50,943] Trial 109 finished with value: 0.21500421452228383 and parameters: {'hidden_dims': '[1024, 256]', 'dropout': 0.09173954796643284, 'batch_norm': False, 'lr': 0.00025665714488370066, 'weight_decay': 2.0717186525599e-07, 'epochs': 132, 'loss': 'mse', 'optimizer': 'adamw', 'use_snp_selection': False, 'n_pcs': 5000}. Best is trial 91 with value: 0.23662448930322574.
2026-06-01 13:01:50 | INFO | Trial 110 | outer=5 | hidden=[1024, 256] epochs=121 lr=4.006e-04 wd=2.512e-07 n_pcs=4500 weight={'name': 'uniform'}
[I 2026-06-01 13:02:03,545] Trial 110 finished with value: 0.21418007558245997 and parameters: {'hidden_dims': '[1024, 256]', 'dropout': 0.008382111735599048, 'batch_norm': False, 'lr': 0.0004006141835034048, 'weight_decay': 2.512318895287812e-07, 'epochs': 121, 'loss': 'mse', 'optimizer': 'adam', 'use_snp_selection': False, 'n_pcs': 4500}. Best is trial 91 with value: 0.23662448930322574.
2026-06-01 13:02:03 | INFO | Trial 111 | outer=5 | hidden=[1024, 256] epochs=106 lr=4.556e-04 wd=2.018e-06 n_pcs=4500 weight={'name': 'uniform'}
[I 2026-06-01 13:02:14,854] Trial 111 finished with value: 0.2245905961337872 and parameters: {'hidden_dims': '[1024, 256]', 'dropout': 0.13792197419437321, 'batch_norm': False, 'lr': 0.00045556627140472256, 'weight_decay': 2.017848541853603e-06, 'epochs': 106, 'loss': 'mse', 'optimizer': 'adamw', 'use_snp_selection': False, 'n_pcs': 4500}. Best is trial 91 with value: 0.23662448930322574.
2026-06-01 13:02:14 | INFO | Trial 112 | outer=5 | hidden=[1024, 256] epochs=299 lr=4.584e-04 wd=2.140e-06 n_pcs=4500 weight={'name': 'uniform'}
[I 2026-06-01 13:02:42,470] Trial 112 finished with value: 0.23370654617397416 and parameters: {'hidden_dims': '[1024, 256]', 'dropout': 0.12208459479309804, 'batch_norm': False, 'lr': 0.0004583514296322612, 'weight_decay': 2.1404038447668624e-06, 'epochs': 299, 'loss': 'mse', 'optimizer': 'adamw', 'use_snp_selection': False, 'n_pcs': 4500}. Best is trial 91 with value: 0.23662448930322574.
2026-06-01 13:02:42 | INFO | Trial 113 | outer=5 | hidden=[1024, 256] epochs=298 lr=4.714e-04 wd=1.567e-06 n_pcs=4500 weight={'name': 'uniform'}
[I 2026-06-01 13:03:09,992] Trial 113 finished with value: 0.23382875658306465 and parameters: {'hidden_dims': '[1024, 256]', 'dropout': 0.08041682017556995, 'batch_norm': False, 'lr': 0.0004713587815121247, 'weight_decay': 1.566717376762658e-06, 'epochs': 298, 'loss': 'mse', 'optimizer': 'adamw', 'use_snp_selection': False, 'n_pcs': 4500}. Best is trial 91 with value: 0.23662448930322574.
2026-06-01 13:03:10 | INFO | Trial 114 | outer=5 | hidden=[1024, 256] epochs=294 lr=4.703e-04 wd=1.540e-06 n_pcs=2000 weight={'name': 'uniform'}
[I 2026-06-01 13:03:25,568] Trial 114 finished with value: 0.21564103235680926 and parameters: {'hidden_dims': '[1024, 256]', 'dropout': 0.08579729169476408, 'batch_norm': False, 'lr': 0.0004703446117401737, 'weight_decay': 1.5404092876841415e-06, 'epochs': 294, 'loss': 'mse', 'optimizer': 'adamw', 'use_snp_selection': False, 'n_pcs': 2000}. Best is trial 91 with value: 0.23662448930322574.
2026-06-01 13:03:25 | INFO | Trial 115 | outer=5 | hidden=[512, 128] epochs=255 lr=4.999e-04 wd=2.442e-06 n_pcs=5000 weight={'name': 'uniform'}
[I 2026-06-01 13:03:39,199] Trial 115 finished with value: 0.22018635954066834 and parameters: {'hidden_dims': '[512, 128]', 'dropout': 0.10996145776526645, 'batch_norm': False, 'lr': 0.0004999267262045054, 'weight_decay': 2.4423861169538562e-06, 'epochs': 255, 'loss': 'mse', 'optimizer': 'adamw', 'use_snp_selection': False, 'n_pcs': 5000}. Best is trial 91 with value: 0.23662448930322574.
2026-06-01 13:03:39 | INFO | Trial 116 | outer=5 | hidden=[1024, 256] epochs=300 lr=3.785e-04 wd=1.157e-06 n_pcs=4500 weight={'name': 'uniform'}
[I 2026-06-01 13:04:06,894] Trial 116 finished with value: 0.22900913035064185 and parameters: {'hidden_dims': '[1024, 256]', 'dropout': 0.07504806219286903, 'batch_norm': False, 'lr': 0.0003785470554480409, 'weight_decay': 1.157029966501751e-06, 'epochs': 300, 'loss': 'mse', 'optimizer': 'adamw', 'use_snp_selection': False, 'n_pcs': 4500}. Best is trial 91 with value: 0.23662448930322574.
2026-06-01 13:04:06 | INFO | Trial 117 | outer=5 | hidden=[1024, 256] epochs=287 lr=3.750e-04 wd=1.062e-06 n_pcs=4000 weight={'name': 'uniform'}
[I 2026-06-01 13:04:30,776] Trial 117 finished with value: 0.2118816093352646 and parameters: {'hidden_dims': '[1024, 256]', 'dropout': 0.0233345452854999, 'batch_norm': False, 'lr': 0.00037497515900856396, 'weight_decay': 1.0620915302760423e-06, 'epochs': 287, 'loss': 'mae', 'optimizer': 'adamw', 'use_snp_selection': False, 'n_pcs': 4000}. Best is trial 91 with value: 0.23662448930322574.
2026-06-01 13:04:30 | INFO | Trial 118 | outer=5 | hidden=[1024, 256] epochs=299 lr=4.223e-04 wd=8.490e-07 n_pcs=5000 weight={'name': 'uniform'}
[I 2026-06-01 13:05:00,101] Trial 118 finished with value: 0.21202878421822652 and parameters: {'hidden_dims': '[1024, 256]', 'dropout': 0.06506306709589431, 'batch_norm': False, 'lr': 0.00042233390926343803, 'weight_decay': 8.489930699369596e-07, 'epochs': 299, 'loss': 'mse', 'optimizer': 'adamw', 'use_snp_selection': False, 'n_pcs': 5000}. Best is trial 91 with value: 0.23662448930322574.
2026-06-01 13:05:00 | INFO | Trial 119 | outer=5 | hidden=[1024, 256] epochs=279 lr=4.408e-04 wd=4.010e-06 n_pcs=4500 weight={'name': 'uniform'}
[I 2026-06-01 13:05:26,032] Trial 119 finished with value: 0.21473925555107276 and parameters: {'hidden_dims': '[1024, 256]', 'dropout': 0.07659610104995661, 'batch_norm': False, 'lr': 0.00044078655339392105, 'weight_decay': 4.009753357112755e-06, 'epochs': 279, 'loss': 'mse', 'optimizer': 'adamw', 'use_snp_selection': False, 'n_pcs': 4500}. Best is trial 91 with value: 0.23662448930322574.
2026-06-01 13:05:26 | INFO | Trial 120 | outer=5 | hidden=[1024, 256] epochs=292 lr=3.980e-04 wd=2.828e-06 n_pcs=5000 weight={'name': 'uniform'}
[I 2026-06-01 13:05:54,720] Trial 120 finished with value: 0.21016058603763615 and parameters: {'hidden_dims': '[1024, 256]', 'dropout': 0.041512023779153376, 'batch_norm': False, 'lr': 0.00039799877503297263, 'weight_decay': 2.8275000524518686e-06, 'epochs': 292, 'loss': 'mse', 'optimizer': 'adamw', 'use_snp_selection': False, 'n_pcs': 5000}. Best is trial 91 with value: 0.23662448930322574.
2026-06-01 13:05:54 | INFO | Trial 121 | outer=5 | hidden=[1024, 256] epochs=279 lr=4.603e-04 wd=1.399e-06 n_pcs=4500 weight={'name': 'uniform'}
[I 2026-06-01 13:06:20,645] Trial 121 finished with value: 0.2185836969372732 and parameters: {'hidden_dims': '[1024, 256]', 'dropout': 0.12288496854273132, 'batch_norm': False, 'lr': 0.0004602839451511466, 'weight_decay': 1.3992967187998442e-06, 'epochs': 279, 'loss': 'mse', 'optimizer': 'adamw', 'use_snp_selection': False, 'n_pcs': 4500}. Best is trial 91 with value: 0.23662448930322574.
2026-06-01 13:06:20 | INFO | Trial 122 | outer=5 | hidden=[1024, 256] epochs=300 lr=3.459e-04 wd=2.060e-06 n_pcs=4500 weight={'name': 'uniform'}
[I 2026-06-01 13:06:48,356] Trial 122 finished with value: 0.22700079306433635 and parameters: {'hidden_dims': '[1024, 256]', 'dropout': 0.10006662914865999, 'batch_norm': False, 'lr': 0.0003459188612923644, 'weight_decay': 2.0601768201603022e-06, 'epochs': 300, 'loss': 'mse', 'optimizer': 'adamw', 'use_snp_selection': False, 'n_pcs': 4500}. Best is trial 91 with value: 0.23662448930322574.
2026-06-01 13:06:48 | INFO | Trial 123 | outer=5 | hidden=[1024, 256] epochs=299 lr=3.459e-04 wd=2.097e-06 n_pcs=4500 weight={'name': 'uniform'}
[I 2026-06-01 13:07:15,963] Trial 123 finished with value: 0.22445628841083728 and parameters: {'hidden_dims': '[1024, 256]', 'dropout': 0.09664529785652305, 'batch_norm': False, 'lr': 0.0003459134653683086, 'weight_decay': 2.096822080879224e-06, 'epochs': 299, 'loss': 'mse', 'optimizer': 'adamw', 'use_snp_selection': False, 'n_pcs': 4500}. Best is trial 91 with value: 0.23662448930322574.
2026-06-01 13:07:15 | INFO | Trial 124 | outer=5 | hidden=[1024, 256] epochs=285 lr=3.765e-04 wd=1.073e-06 n_pcs=4500 weight={'name': 'uniform'}
[I 2026-06-01 13:07:42,403] Trial 124 finished with value: 0.22438438307270117 and parameters: {'hidden_dims': '[1024, 256]', 'dropout': 0.10520151494413836, 'batch_norm': False, 'lr': 0.0003765216954549873, 'weight_decay': 1.0725039085834891e-06, 'epochs': 285, 'loss': 'mse', 'optimizer': 'adamw', 'use_snp_selection': False, 'n_pcs': 4500}. Best is trial 91 with value: 0.23662448930322574.
2026-06-01 13:07:42 | INFO | Trial 125 | outer=5 | hidden=[256, 128] epochs=289 lr=3.173e-04 wd=3.551e-06 n_pcs=4000 weight={'name': 'uniform'}
[I 2026-06-01 13:07:47,182] Trial 125 pruned. 
2026-06-01 13:07:47 | INFO | Trial 126 | outer=5 | hidden=[512, 64] epochs=293 lr=4.148e-04 wd=4.917e-06 n_pcs=1000 weight={'name': 'uniform'}
[I 2026-06-01 13:07:51,049] Trial 126 pruned. 
2026-06-01 13:07:51 | INFO | Trial 127 | outer=5 | hidden=[1024, 256] epochs=299 lr=4.939e-04 wd=2.013e-06 n_pcs=4500 weight={'name': 'uniform'}
[I 2026-06-01 13:08:18,652] Trial 127 finished with value: 0.220144344849002 and parameters: {'hidden_dims': '[1024, 256]', 'dropout': 0.06684173155402555, 'batch_norm': False, 'lr': 0.0004938583872441788, 'weight_decay': 2.012667316723976e-06, 'epochs': 299, 'loss': 'mse', 'optimizer': 'adamw', 'use_snp_selection': False, 'n_pcs': 4500}. Best is trial 91 with value: 0.23662448930322574.
2026-06-01 13:08:18 | INFO | Trial 128 | outer=5 | hidden=[512, 128] epochs=281 lr=4.419e-04 wd=2.860e-06 n_pcs=5000 weight={'name': 'uniform'}
[I 2026-06-01 13:08:33,449] Trial 128 finished with value: 0.22706972462304686 and parameters: {'hidden_dims': '[512, 128]', 'dropout': 0.0785563030121815, 'batch_norm': False, 'lr': 0.00044188047316491894, 'weight_decay': 2.860474751485846e-06, 'epochs': 281, 'loss': 'mse', 'optimizer': 'adamw', 'use_snp_selection': False, 'n_pcs': 5000}. Best is trial 91 with value: 0.23662448930322574.
2026-06-01 13:08:33 | INFO | Trial 129 | outer=5 | hidden=[512, 128] epochs=278 lr=2.778e-04 wd=2.776e-06 n_pcs=4500 weight={'name': 'uniform'}
[I 2026-06-01 13:08:47,469] Trial 129 finished with value: 0.22500159506350226 and parameters: {'hidden_dims': '[512, 128]', 'dropout': 0.021555149675341147, 'batch_norm': False, 'lr': 0.00027778624995824337, 'weight_decay': 2.7763047976405394e-06, 'epochs': 278, 'loss': 'mse', 'optimizer': 'adamw', 'use_snp_selection': False, 'n_pcs': 4500}. Best is trial 91 with value: 0.23662448930322574.
2026-06-01 13:08:47 | INFO | Trial 130 | outer=5 | hidden=[512, 128] epochs=290 lr=3.607e-04 wd=1.620e-06 n_pcs=4500 weight={'name': 'uniform'}
[I 2026-06-01 13:09:02,000] Trial 130 finished with value: 0.20450351602042582 and parameters: {'hidden_dims': '[512, 128]', 'dropout': 0.33271545351064363, 'batch_norm': False, 'lr': 0.00036069729809403144, 'weight_decay': 1.6195332568594831e-06, 'epochs': 290, 'loss': 'mse', 'optimizer': 'adamw', 'use_snp_selection': False, 'n_pcs': 4500}. Best is trial 91 with value: 0.23662448930322574.
2026-06-01 13:09:02 | INFO | Trial 131 | outer=5 | hidden=[512, 128] epochs=268 lr=4.382e-04 wd=1.260e-06 n_pcs=5000 weight={'name': 'uniform'}
[I 2026-06-01 13:09:16,220] Trial 131 finished with value: 0.22186425971206578 and parameters: {'hidden_dims': '[512, 128]', 'dropout': 0.07801498279137753, 'batch_norm': False, 'lr': 0.000438247605863275, 'weight_decay': 1.2598041485864805e-06, 'epochs': 268, 'loss': 'mse', 'optimizer': 'adamw', 'use_snp_selection': False, 'n_pcs': 5000}. Best is trial 91 with value: 0.23662448930322574.
2026-06-01 13:09:16 | INFO | Trial 132 | outer=5 | hidden=[512, 128] epochs=300 lr=3.922e-04 wd=2.944e-06 n_pcs=5000 weight={'name': 'uniform'}
[I 2026-06-01 13:09:31,874] Trial 132 finished with value: 0.21294543322428075 and parameters: {'hidden_dims': '[512, 128]', 'dropout': 0.09165614544511408, 'batch_norm': False, 'lr': 0.00039216837459654923, 'weight_decay': 2.943558725726726e-06, 'epochs': 300, 'loss': 'mse', 'optimizer': 'adamw', 'use_snp_selection': False, 'n_pcs': 5000}. Best is trial 91 with value: 0.23662448930322574.
2026-06-01 13:09:31 | INFO | Trial 133 | outer=5 | hidden=[1024, 256] epochs=283 lr=4.569e-04 wd=8.997e-07 n_pcs=5000 weight={'name': 'uniform'}
[I 2026-06-01 13:09:59,768] Trial 133 finished with value: 0.21232227970969028 and parameters: {'hidden_dims': '[1024, 256]', 'dropout': 0.04640835100096725, 'batch_norm': False, 'lr': 0.00045685128650312914, 'weight_decay': 8.996902335097185e-07, 'epochs': 283, 'loss': 'mse', 'optimizer': 'adamw', 'use_snp_selection': False, 'n_pcs': 5000}. Best is trial 91 with value: 0.23662448930322574.
2026-06-01 13:09:59 | INFO | Trial 134 | outer=5 | hidden=[256, 64] epochs=271 lr=4.093e-04 wd=6.959e-06 n_pcs=5000 weight={'name': 'uniform'}
[I 2026-06-01 13:10:08,452] Trial 134 finished with value: 0.2196842681962159 and parameters: {'hidden_dims': '[256, 64]', 'dropout': 0.1198993157327132, 'batch_norm': False, 'lr': 0.00040930633910453163, 'weight_decay': 6.958849719267885e-06, 'epochs': 271, 'loss': 'mse', 'optimizer': 'adamw', 'use_snp_selection': False, 'n_pcs': 5000}. Best is trial 91 with value: 0.23662448930322574.
2026-06-01 13:10:08 | INFO | Trial 135 | outer=5 | hidden=[1024, 256] epochs=294 lr=4.928e-04 wd=4.664e-06 n_pcs=4500 weight={'name': 'uniform'}
[I 2026-06-01 13:10:35,642] Trial 135 finished with value: 0.2131498488893878 and parameters: {'hidden_dims': '[1024, 256]', 'dropout': 0.05874883630742937, 'batch_norm': False, 'lr': 0.0004928487577027653, 'weight_decay': 4.664170163396789e-06, 'epochs': 294, 'loss': 'mse', 'optimizer': 'adamw', 'use_snp_selection': False, 'n_pcs': 4500}. Best is trial 91 with value: 0.23662448930322574.
2026-06-01 13:10:35 | INFO | Trial 136 | outer=5 | hidden=[512, 128] epochs=283 lr=4.361e-04 wd=1.798e-06 n_pcs=5000 weight={'name': 'uniform'}
[I 2026-06-01 13:10:50,554] Trial 136 finished with value: 0.22121967813130414 and parameters: {'hidden_dims': '[512, 128]', 'dropout': 0.31267960057956695, 'batch_norm': False, 'lr': 0.00043609669337095247, 'weight_decay': 1.7983707045467674e-06, 'epochs': 283, 'loss': 'mse', 'optimizer': 'adam', 'use_snp_selection': False, 'n_pcs': 5000}. Best is trial 91 with value: 0.23662448930322574.
2026-06-01 13:10:50 | INFO | Trial 137 | outer=5 | hidden=[512, 256] epochs=64 lr=3.539e-04 wd=3.195e-06 n_pcs=4500 weight={'name': 'uniform'}
[I 2026-06-01 13:10:55,623] Trial 137 finished with value: 0.19098070240623383 and parameters: {'hidden_dims': '[512, 256]', 'dropout': 0.112606053106791, 'batch_norm': False, 'lr': 0.00035394703392199614, 'weight_decay': 3.19481364590079e-06, 'epochs': 64, 'loss': 'mae', 'optimizer': 'adamw', 'use_snp_selection': False, 'n_pcs': 4500}. Best is trial 91 with value: 0.23662448930322574.
2026-06-01 13:10:55 | INFO | Trial 138 | outer=5 | hidden=[1024, 256] epochs=225 lr=3.820e-04 wd=2.429e-06 n_pcs=5000 weight={'name': 'uniform'}
[I 2026-06-01 13:11:18,315] Trial 138 finished with value: 0.22416586715373454 and parameters: {'hidden_dims': '[1024, 256]', 'dropout': 0.26234500940835437, 'batch_norm': False, 'lr': 0.0003820425046511728, 'weight_decay': 2.4286215168291775e-06, 'epochs': 225, 'loss': 'mse', 'optimizer': 'adamw', 'use_snp_selection': False, 'n_pcs': 5000}. Best is trial 91 with value: 0.23662448930322574.
2026-06-01 13:11:18 | INFO | Trial 139 | outer=5 | hidden=[128, 64] epochs=73 lr=3.157e-04 wd=5.649e-07 n_pcs=4500 weight={'name': 'uniform'}
[I 2026-06-01 13:11:21,372] Trial 139 finished with value: 0.19132556263618353 and parameters: {'hidden_dims': '[128, 64]', 'dropout': 0.10014114024843414, 'batch_norm': False, 'lr': 0.0003157060634817277, 'weight_decay': 5.649446141427088e-07, 'epochs': 73, 'loss': 'mse', 'optimizer': 'adamw', 'use_snp_selection': False, 'n_pcs': 4500}. Best is trial 91 with value: 0.23662448930322574.
2026-06-01 13:11:21 | INFO | Trial 140 | outer=5 | hidden=[1024, 256] epochs=115 lr=4.679e-04 wd=3.746e-07 n_pcs=4000 weight={'name': 'uniform'}
[I 2026-06-01 13:11:32,299] Trial 140 finished with value: 0.21479935672891276 and parameters: {'hidden_dims': '[1024, 256]', 'dropout': 0.2851975630359047, 'batch_norm': False, 'lr': 0.0004678534833355163, 'weight_decay': 3.746036091929106e-07, 'epochs': 115, 'loss': 'mse', 'optimizer': 'adamw', 'use_snp_selection': False, 'n_pcs': 4000}. Best is trial 91 with value: 0.23662448930322574.
2026-06-01 13:11:32 | INFO | Trial 141 | outer=5 | hidden=[1024, 256] epochs=76 lr=4.142e-04 wd=7.257e-07 n_pcs=4500 weight={'name': 'uniform'}
[I 2026-06-01 13:11:41,086] Trial 141 finished with value: 0.21612221271521986 and parameters: {'hidden_dims': '[1024, 256]', 'dropout': 0.15619691847477013, 'batch_norm': False, 'lr': 0.0004141659382223704, 'weight_decay': 7.256570062043223e-07, 'epochs': 76, 'loss': 'mse', 'optimizer': 'adamw', 'use_snp_selection': False, 'n_pcs': 4500}. Best is trial 91 with value: 0.23662448930322574.
2026-06-01 13:11:41 | INFO | Trial 142 | outer=5 | hidden=[1024, 256] epochs=296 lr=4.958e-04 wd=1.643e-06 n_pcs=4500 weight={'name': 'uniform'}
[I 2026-06-01 13:12:08,441] Trial 142 finished with value: 0.2236995345624655 and parameters: {'hidden_dims': '[1024, 256]', 'dropout': 0.12647880260919228, 'batch_norm': False, 'lr': 0.0004958416076443153, 'weight_decay': 1.6428372476548845e-06, 'epochs': 296, 'loss': 'mse', 'optimizer': 'adamw', 'use_snp_selection': False, 'n_pcs': 4500}. Best is trial 91 with value: 0.23662448930322574.
2026-06-01 13:12:08 | INFO | Trial 143 | outer=5 | hidden=[1024, 256] epochs=80 lr=4.393e-04 wd=1.104e-06 n_pcs=4500 weight={'name': 'uniform'}
[I 2026-06-01 13:12:17,575] Trial 143 finished with value: 0.22364140184259043 and parameters: {'hidden_dims': '[1024, 256]', 'dropout': 0.1737010953693912, 'batch_norm': False, 'lr': 0.0004393184246892035, 'weight_decay': 1.1036638541305497e-06, 'epochs': 80, 'loss': 'mse', 'optimizer': 'adamw', 'use_snp_selection': False, 'n_pcs': 4500}. Best is trial 91 with value: 0.23662448930322574.
2026-06-01 13:12:17 | INFO | Trial 144 | outer=5 | hidden=[1024, 256] epochs=69 lr=3.896e-04 wd=1.366e-06 n_pcs=5000 weight={'name': 'uniform'}
