[I 2026-06-01 15:09:26,961] Trial 109 finished with value: 0.1822387906449518 and parameters: {'hidden_dims': '[1024, 256]', 'dropout': 0.39182304301434995, 'batch_norm': False, 'lr': 0.00037991212668855964, 'weight_decay': 7.93073018452195e-05, 'epochs': 149, 'loss': 'mae', 'optimizer': 'adamw', 'use_snp_selection': False, 'n_pcs': 4000}. Best is trial 77 with value: 0.19494852683910804.
2026-06-01 15:09:26 | INFO | Trial 110 | outer=12 | hidden=[1024, 256] epochs=198 lr=4.095e-04 wd=7.878e-05 n_pcs=4500 weight={'name': 'uniform'}
[I 2026-06-01 15:09:45,991] Trial 110 finished with value: 0.1909533834236769 and parameters: {'hidden_dims': '[1024, 256]', 'dropout': 0.4135741574516197, 'batch_norm': False, 'lr': 0.0004095347168033082, 'weight_decay': 7.878385970004829e-05, 'epochs': 198, 'loss': 'mae', 'optimizer': 'adamw', 'use_snp_selection': False, 'n_pcs': 4500}. Best is trial 77 with value: 0.19494852683910804.
2026-06-01 15:09:46 | INFO | Trial 111 | outer=12 | hidden=[1024, 256] epochs=198 lr=4.117e-04 wd=1.536e-04 n_pcs=4500 weight={'name': 'uniform'}
[I 2026-06-01 15:10:05,023] Trial 111 finished with value: 0.1722712697041997 and parameters: {'hidden_dims': '[1024, 256]', 'dropout': 0.4110241963967496, 'batch_norm': False, 'lr': 0.00041173478300143964, 'weight_decay': 0.00015362511556054608, 'epochs': 198, 'loss': 'mae', 'optimizer': 'adamw', 'use_snp_selection': False, 'n_pcs': 4500}. Best is trial 77 with value: 0.19494852683910804.
2026-06-01 15:10:05 | INFO | Trial 112 | outer=12 | hidden=[1024, 256] epochs=123 lr=4.673e-04 wd=7.468e-05 n_pcs=4500 weight={'name': 'uniform'}
[I 2026-06-01 15:10:17,768] Trial 112 finished with value: 0.1871958606119943 and parameters: {'hidden_dims': '[1024, 256]', 'dropout': 0.4202366869635652, 'batch_norm': False, 'lr': 0.0004672992372984433, 'weight_decay': 7.468394848421743e-05, 'epochs': 123, 'loss': 'mae', 'optimizer': 'adamw', 'use_snp_selection': False, 'n_pcs': 4500}. Best is trial 77 with value: 0.19494852683910804.
2026-06-01 15:10:17 | INFO | Trial 113 | outer=12 | hidden=[1024, 256] epochs=214 lr=3.619e-04 wd=6.964e-05 n_pcs=4500 weight={'name': 'uniform'}
[I 2026-06-01 15:10:38,139] Trial 113 finished with value: 0.17368268998409303 and parameters: {'hidden_dims': '[1024, 256]', 'dropout': 0.4295780643014819, 'batch_norm': False, 'lr': 0.00036192198543742493, 'weight_decay': 6.963775024474907e-05, 'epochs': 214, 'loss': 'mae', 'optimizer': 'adamw', 'use_snp_selection': False, 'n_pcs': 4500}. Best is trial 77 with value: 0.19494852683910804.
2026-06-01 15:10:38 | INFO | Trial 114 | outer=12 | hidden=[1024, 256] epochs=197 lr=4.086e-04 wd=1.110e-04 n_pcs=4500 weight={'name': 'uniform'}
[I 2026-06-01 15:10:57,076] Trial 114 finished with value: 0.19078898803147154 and parameters: {'hidden_dims': '[1024, 256]', 'dropout': 0.4546734131494068, 'batch_norm': False, 'lr': 0.00040857210616060267, 'weight_decay': 0.0001109793012514802, 'epochs': 197, 'loss': 'mae', 'optimizer': 'adamw', 'use_snp_selection': False, 'n_pcs': 4500}. Best is trial 77 with value: 0.19494852683910804.
2026-06-01 15:10:57 | INFO | Trial 115 | outer=12 | hidden=[1024, 256] epochs=196 lr=2.690e-04 wd=9.960e-05 n_pcs=4500 weight={'name': 'uniform'}
[I 2026-06-01 15:11:15,939] Trial 115 finished with value: 0.18535942025016794 and parameters: {'hidden_dims': '[1024, 256]', 'dropout': 0.44973338269110275, 'batch_norm': False, 'lr': 0.0002690076052531941, 'weight_decay': 9.959817505816858e-05, 'epochs': 196, 'loss': 'mae', 'optimizer': 'adamw', 'use_snp_selection': False, 'n_pcs': 4500}. Best is trial 77 with value: 0.19494852683910804.
2026-06-01 15:11:15 | INFO | Trial 116 | outer=12 | hidden=[1024, 256] epochs=181 lr=3.984e-04 wd=3.160e-05 n_pcs=4500 weight={'name': 'uniform'}
[I 2026-06-01 15:11:33,532] Trial 116 finished with value: 0.1856151972728569 and parameters: {'hidden_dims': '[1024, 256]', 'dropout': 0.4653293415981385, 'batch_norm': False, 'lr': 0.0003984227110844108, 'weight_decay': 3.1596669650379345e-05, 'epochs': 181, 'loss': 'mae', 'optimizer': 'adamw', 'use_snp_selection': False, 'n_pcs': 4500}. Best is trial 77 with value: 0.19494852683910804.
2026-06-01 15:11:33 | INFO | Trial 117 | outer=12 | hidden=[1024, 256] epochs=190 lr=3.098e-04 wd=5.896e-05 n_pcs=1500 weight={'name': 'uniform'}
[I 2026-06-01 15:11:42,258] Trial 117 finished with value: 0.16433468491749614 and parameters: {'hidden_dims': '[1024, 256]', 'dropout': 0.4217447677928692, 'batch_norm': False, 'lr': 0.00030981329222748617, 'weight_decay': 5.896257011616157e-05, 'epochs': 190, 'loss': 'mae', 'optimizer': 'adamw', 'use_snp_selection': False, 'n_pcs': 1500}. Best is trial 77 with value: 0.19494852683910804.
2026-06-01 15:11:42 | INFO | Trial 118 | outer=12 | hidden=[1024, 256] epochs=209 lr=3.422e-04 wd=1.717e-05 n_pcs=2000 weight={'name': 'uniform'}
[I 2026-06-01 15:11:49,267] Trial 118 pruned. 
2026-06-01 15:11:49 | INFO | Trial 119 | outer=12 | hidden=[1024, 256] epochs=204 lr=2.236e-05 wd=4.590e-05 n_pcs=4500 weight={'name': 'uniform'}
[I 2026-06-01 15:12:08,800] Trial 119 finished with value: 0.1588977508552097 and parameters: {'hidden_dims': '[1024, 256]', 'dropout': 0.4446556065141631, 'batch_norm': False, 'lr': 2.2362197336219834e-05, 'weight_decay': 4.589828273664278e-05, 'epochs': 204, 'loss': 'mae', 'optimizer': 'adamw', 'use_snp_selection': False, 'n_pcs': 4500}. Best is trial 77 with value: 0.19494852683910804.
2026-06-01 15:12:08 | INFO | Trial 120 | outer=12 | hidden=[1024, 256] epochs=183 lr=3.800e-04 wd=1.244e-04 n_pcs=4500 weight={'name': 'uniform'}
[I 2026-06-01 15:12:26,562] Trial 120 finished with value: 0.17792077065835202 and parameters: {'hidden_dims': '[1024, 256]', 'dropout': 0.404582580714959, 'batch_norm': False, 'lr': 0.00038004805379384407, 'weight_decay': 0.00012436169901251662, 'epochs': 183, 'loss': 'mae', 'optimizer': 'adamw', 'use_snp_selection': False, 'n_pcs': 4500}. Best is trial 77 with value: 0.19494852683910804.
2026-06-01 15:12:26 | INFO | Trial 121 | outer=12 | hidden=[1024, 256] epochs=183 lr=3.991e-04 wd=2.843e-05 n_pcs=4500 weight={'name': 'uniform'}
[I 2026-06-01 15:12:44,311] Trial 121 finished with value: 0.17869994584953358 and parameters: {'hidden_dims': '[1024, 256]', 'dropout': 0.41532969315899837, 'batch_norm': False, 'lr': 0.000399148808991529, 'weight_decay': 2.843154188947195e-05, 'epochs': 183, 'loss': 'mae', 'optimizer': 'adamw', 'use_snp_selection': False, 'n_pcs': 4500}. Best is trial 77 with value: 0.19494852683910804.
2026-06-01 15:12:44 | INFO | Trial 122 | outer=12 | hidden=[1024, 256] epochs=179 lr=4.298e-04 wd=3.422e-05 n_pcs=4500 weight={'name': 'uniform'}
[I 2026-06-01 15:13:01,732] Trial 122 finished with value: 0.18704203289954885 and parameters: {'hidden_dims': '[1024, 256]', 'dropout': 0.4333053986710235, 'batch_norm': False, 'lr': 0.0004298208958363675, 'weight_decay': 3.4221695360835545e-05, 'epochs': 179, 'loss': 'mae', 'optimizer': 'adamw', 'use_snp_selection': False, 'n_pcs': 4500}. Best is trial 77 with value: 0.19494852683910804.
2026-06-01 15:13:01 | INFO | Trial 123 | outer=12 | hidden=[1024, 256] epochs=194 lr=2.406e-04 wd=3.864e-05 n_pcs=4500 weight={'name': 'uniform'}
[I 2026-06-01 15:13:20,422] Trial 123 finished with value: 0.17954221455468483 and parameters: {'hidden_dims': '[1024, 256]', 'dropout': 0.4556494260546362, 'batch_norm': False, 'lr': 0.00024061948812194742, 'weight_decay': 3.864222688555555e-05, 'epochs': 194, 'loss': 'mae', 'optimizer': 'adamw', 'use_snp_selection': False, 'n_pcs': 4500}. Best is trial 77 with value: 0.19494852683910804.
2026-06-01 15:13:20 | INFO | Trial 124 | outer=12 | hidden=[1024, 256] epochs=176 lr=2.814e-04 wd=6.977e-05 n_pcs=4500 weight={'name': 'uniform'}
[I 2026-06-01 15:13:37,592] Trial 124 finished with value: 0.179673700121013 and parameters: {'hidden_dims': '[1024, 256]', 'dropout': 0.47250647095151566, 'batch_norm': False, 'lr': 0.0002814410724299342, 'weight_decay': 6.977041679257209e-05, 'epochs': 176, 'loss': 'mae', 'optimizer': 'adamw', 'use_snp_selection': False, 'n_pcs': 4500}. Best is trial 77 with value: 0.19494852683910804.
2026-06-01 15:13:37 | INFO | Trial 125 | outer=12 | hidden=[1024, 256] epochs=162 lr=4.923e-04 wd=4.024e-05 n_pcs=4000 weight={'name': 'uniform'}
[I 2026-06-01 15:13:51,974] Trial 125 finished with value: 0.1808917172216466 and parameters: {'hidden_dims': '[1024, 256]', 'dropout': 0.4357660691569114, 'batch_norm': False, 'lr': 0.0004923434988773089, 'weight_decay': 4.023765301727726e-05, 'epochs': 162, 'loss': 'mae', 'optimizer': 'adamw', 'use_snp_selection': False, 'n_pcs': 4000}. Best is trial 77 with value: 0.19494852683910804.
2026-06-01 15:13:51 | INFO | Trial 126 | outer=12 | hidden=[128, 64] epochs=187 lr=4.401e-04 wd=9.466e-05 n_pcs=1000 weight={'name': 'uniform'}
[I 2026-06-01 15:13:55,805] Trial 126 finished with value: 0.16197866771197506 and parameters: {'hidden_dims': '[128, 64]', 'dropout': 0.39382877253499393, 'batch_norm': False, 'lr': 0.00044011370790823806, 'weight_decay': 9.46630403231009e-05, 'epochs': 187, 'loss': 'mae', 'optimizer': 'adamw', 'use_snp_selection': False, 'n_pcs': 1000}. Best is trial 77 with value: 0.19494852683910804.
2026-06-01 15:13:55 | INFO | Trial 127 | outer=12 | hidden=[1024, 256] epochs=177 lr=3.293e-04 wd=5.319e-05 n_pcs=4000 weight={'name': 'uniform'}
[I 2026-06-01 15:14:11,312] Trial 127 finished with value: 0.17276017784126435 and parameters: {'hidden_dims': '[1024, 256]', 'dropout': 0.43032343081234725, 'batch_norm': False, 'lr': 0.0003292650517364685, 'weight_decay': 5.319449073886722e-05, 'epochs': 177, 'loss': 'mae', 'optimizer': 'adamw', 'use_snp_selection': False, 'n_pcs': 4000}. Best is trial 77 with value: 0.19494852683910804.
2026-06-01 15:14:11 | INFO | Trial 128 | outer=12 | hidden=[1024, 256] epochs=219 lr=4.240e-04 wd=1.292e-05 n_pcs=4500 weight={'name': 'uniform'}
[I 2026-06-01 15:14:32,079] Trial 128 finished with value: 0.18712252655818387 and parameters: {'hidden_dims': '[1024, 256]', 'dropout': 0.360839626880888, 'batch_norm': False, 'lr': 0.00042401674464654423, 'weight_decay': 1.2920325158400481e-05, 'epochs': 219, 'loss': 'mae', 'optimizer': 'adamw', 'use_snp_selection': False, 'n_pcs': 4500}. Best is trial 77 with value: 0.19494852683910804.
2026-06-01 15:14:32 | INFO | Trial 129 | outer=12 | hidden=[1024, 256] epochs=217 lr=4.223e-04 wd=7.386e-06 n_pcs=3500 weight={'name': 'uniform'}
[I 2026-06-01 15:14:42,388] Trial 129 pruned. 
2026-06-01 15:14:42 | INFO | Trial 130 | outer=12 | hidden=[1024, 256] epochs=168 lr=4.893e-04 wd=1.392e-05 n_pcs=5000 weight={'name': 'uniform'}
[I 2026-06-01 15:14:59,879] Trial 130 finished with value: 0.1913264834317316 and parameters: {'hidden_dims': '[1024, 256]', 'dropout': 0.48888662000644795, 'batch_norm': False, 'lr': 0.0004892596508862466, 'weight_decay': 1.3917557460927704e-05, 'epochs': 168, 'loss': 'mae', 'optimizer': 'adamw', 'use_snp_selection': False, 'n_pcs': 5000}. Best is trial 77 with value: 0.19494852683910804.
2026-06-01 15:14:59 | INFO | Trial 131 | outer=12 | hidden=[1024, 256] epochs=169 lr=4.931e-04 wd=1.327e-05 n_pcs=5000 weight={'name': 'uniform'}
[I 2026-06-01 15:15:17,450] Trial 131 finished with value: 0.18781300593163328 and parameters: {'hidden_dims': '[1024, 256]', 'dropout': 0.5043049626879492, 'batch_norm': False, 'lr': 0.0004931330072928134, 'weight_decay': 1.3268373130537424e-05, 'epochs': 169, 'loss': 'mae', 'optimizer': 'adamw', 'use_snp_selection': False, 'n_pcs': 5000}. Best is trial 77 with value: 0.19494852683910804.
2026-06-01 15:15:17 | INFO | Trial 132 | outer=12 | hidden=[1024, 256] epochs=226 lr=4.778e-04 wd=1.219e-05 n_pcs=5000 weight={'name': 'uniform'}
[I 2026-06-01 15:15:40,120] Trial 132 finished with value: 0.17954501843362866 and parameters: {'hidden_dims': '[1024, 256]', 'dropout': 0.45475805421898685, 'batch_norm': False, 'lr': 0.000477828005757802, 'weight_decay': 1.218641585634437e-05, 'epochs': 226, 'loss': 'mae', 'optimizer': 'adamw', 'use_snp_selection': False, 'n_pcs': 5000}. Best is trial 77 with value: 0.19494852683910804.
2026-06-01 15:15:40 | INFO | Trial 133 | outer=12 | hidden=[1024, 256] epochs=169 lr=4.911e-04 wd=2.052e-05 n_pcs=5000 weight={'name': 'uniform'}
[I 2026-06-01 15:15:57,696] Trial 133 finished with value: 0.18673193771127466 and parameters: {'hidden_dims': '[1024, 256]', 'dropout': 0.4956049996073415, 'batch_norm': False, 'lr': 0.0004911437517113293, 'weight_decay': 2.0522465448900062e-05, 'epochs': 169, 'loss': 'mae', 'optimizer': 'adamw', 'use_snp_selection': False, 'n_pcs': 5000}. Best is trial 77 with value: 0.19494852683910804.
2026-06-01 15:15:57 | INFO | Trial 134 | outer=12 | hidden=[1024, 256] epochs=164 lr=3.540e-04 wd=1.412e-05 n_pcs=5000 weight={'name': 'uniform'}
[I 2026-06-01 15:16:14,833] Trial 134 finished with value: 0.18052494039561412 and parameters: {'hidden_dims': '[1024, 256]', 'dropout': 0.4830958247794557, 'batch_norm': False, 'lr': 0.0003540090665248583, 'weight_decay': 1.4116938595542291e-05, 'epochs': 164, 'loss': 'mae', 'optimizer': 'adamw', 'use_snp_selection': False, 'n_pcs': 5000}. Best is trial 77 with value: 0.19494852683910804.
2026-06-01 15:16:14 | INFO | Trial 135 | outer=12 | hidden=[1024, 256] epochs=170 lr=4.508e-04 wd=5.269e-06 n_pcs=5000 weight={'name': 'uniform'}
[I 2026-06-01 15:16:32,513] Trial 135 finished with value: 0.1884030464708144 and parameters: {'hidden_dims': '[1024, 256]', 'dropout': 0.5166169559852458, 'batch_norm': False, 'lr': 0.0004508026912893951, 'weight_decay': 5.26892698862026e-06, 'epochs': 170, 'loss': 'mae', 'optimizer': 'adamw', 'use_snp_selection': False, 'n_pcs': 5000}. Best is trial 77 with value: 0.19494852683910804.
2026-06-01 15:16:32 | INFO | Trial 136 | outer=12 | hidden=[256, 64] epochs=170 lr=4.518e-04 wd=4.631e-06 n_pcs=5000 weight={'name': 'uniform'}
[I 2026-06-01 15:16:38,786] Trial 136 finished with value: 0.1755861158316872 and parameters: {'hidden_dims': '[256, 64]', 'dropout': 0.5198146649366845, 'batch_norm': False, 'lr': 0.0004517723864426688, 'weight_decay': 4.631406463284952e-06, 'epochs': 170, 'loss': 'mae', 'optimizer': 'adamw', 'use_snp_selection': False, 'n_pcs': 5000}. Best is trial 77 with value: 0.19494852683910804.
2026-06-01 15:16:38 | INFO | Trial 137 | outer=12 | hidden=[256, 128] epochs=191 lr=2.218e-04 wd=5.530e-06 n_pcs=5000 weight={'name': 'uniform'}
[I 2026-06-01 15:16:45,634] Trial 137 finished with value: 0.19487690560590515 and parameters: {'hidden_dims': '[256, 128]', 'dropout': 0.4999352493701989, 'batch_norm': False, 'lr': 0.00022181714421579091, 'weight_decay': 5.5295224600268746e-06, 'epochs': 191, 'loss': 'mae', 'optimizer': 'adamw', 'use_snp_selection': False, 'n_pcs': 5000}. Best is trial 77 with value: 0.19494852683910804.
2026-06-01 15:16:45 | INFO | Trial 138 | outer=12 | hidden=[256, 128] epochs=192 lr=2.975e-04 wd=3.673e-06 n_pcs=5000 weight={'name': 'uniform'}
[I 2026-06-01 15:16:52,505] Trial 138 finished with value: 0.17897649287890516 and parameters: {'hidden_dims': '[256, 128]', 'dropout': 0.5078558948822287, 'batch_norm': False, 'lr': 0.00029754372871632285, 'weight_decay': 3.672984583470038e-06, 'epochs': 192, 'loss': 'mae', 'optimizer': 'adamw', 'use_snp_selection': False, 'n_pcs': 5000}. Best is trial 77 with value: 0.19494852683910804.
2026-06-01 15:16:52 | INFO | Trial 139 | outer=12 | hidden=[256, 128] epochs=188 lr=1.930e-04 wd=5.711e-06 n_pcs=5000 weight={'name': 'uniform'}
[I 2026-06-01 15:16:59,278] Trial 139 finished with value: 0.1596782062224103 and parameters: {'hidden_dims': '[256, 128]', 'dropout': 0.522214211389479, 'batch_norm': False, 'lr': 0.00019295049174323532, 'weight_decay': 5.710897375287328e-06, 'epochs': 188, 'loss': 'mae', 'optimizer': 'adamw', 'use_snp_selection': False, 'n_pcs': 5000}. Best is trial 77 with value: 0.19494852683910804.
2026-06-01 15:16:59 | INFO | Trial 140 | outer=12 | hidden=[256, 128] epochs=204 lr=2.200e-04 wd=5.572e-06 n_pcs=5000 weight={'name': 'uniform'}
[I 2026-06-01 15:17:06,440] Trial 140 finished with value: 0.1673498780117917 and parameters: {'hidden_dims': '[256, 128]', 'dropout': 0.4859257796766459, 'batch_norm': False, 'lr': 0.00021999892285877315, 'weight_decay': 5.5715535884556046e-06, 'epochs': 204, 'loss': 'mae', 'optimizer': 'adamw', 'use_snp_selection': False, 'n_pcs': 5000}. Best is trial 77 with value: 0.19494852683910804.
2026-06-01 15:17:06 | INFO | Trial 141 | outer=12 | hidden=[256, 128] epochs=155 lr=2.708e-04 wd=2.537e-04 n_pcs=5000 weight={'name': 'uniform'}
[I 2026-06-01 15:17:12,423] Trial 141 finished with value: 0.18356643009352705 and parameters: {'hidden_dims': '[256, 128]', 'dropout': 0.5355347406386108, 'batch_norm': False, 'lr': 0.00027080933375477946, 'weight_decay': 0.00025373645244600884, 'epochs': 155, 'loss': 'mae', 'optimizer': 'adamw', 'use_snp_selection': False, 'n_pcs': 5000}. Best is trial 77 with value: 0.19494852683910804.
2026-06-01 15:17:12 | INFO | Trial 142 | outer=12 | hidden=[1024, 256] epochs=197 lr=3.973e-04 wd=9.188e-06 n_pcs=5000 weight={'name': 'uniform'}
[I 2026-06-01 15:17:32,513] Trial 142 finished with value: 0.18106939376195477 and parameters: {'hidden_dims': '[1024, 256]', 'dropout': 0.5345691925295449, 'batch_norm': False, 'lr': 0.00039726870734849395, 'weight_decay': 9.188374751703511e-06, 'epochs': 197, 'loss': 'mae', 'optimizer': 'adamw', 'use_snp_selection': False, 'n_pcs': 5000}. Best is trial 77 with value: 0.19494852683910804.
2026-06-01 15:17:32 | INFO | Trial 143 | outer=12 | hidden=[1024, 256] epochs=175 lr=4.932e-04 wd=3.283e-04 n_pcs=5000 weight={'name': 'uniform'}
[I 2026-06-01 15:17:51,742] Trial 143 finished with value: 0.189271685507758 and parameters: {'hidden_dims': '[1024, 256]', 'dropout': 0.4991317778159804, 'batch_norm': False, 'lr': 0.0004931719433710361, 'weight_decay': 0.0003283496154060614, 'epochs': 175, 'loss': 'mae', 'optimizer': 'adamw', 'use_snp_selection': False, 'n_pcs': 5000}. Best is trial 77 with value: 0.19494852683910804.
2026-06-01 15:17:51 | INFO | Trial 144 | outer=12 | hidden=[128, 64] epochs=175 lr=4.959e-04 wd=6.899e-06 n_pcs=5000 weight={'name': 'uniform'}
[I 2026-06-01 15:17:56,594] Trial 144 finished with value: 0.16443124388124752 and parameters: {'hidden_dims': '[128, 64]', 'dropout': 0.5646788712153678, 'batch_norm': False, 'lr': 0.0004958772968607138, 'weight_decay': 6.89923033522382e-06, 'epochs': 175, 'loss': 'mae', 'optimizer': 'adamw', 'use_snp_selection': False, 'n_pcs': 5000}. Best is trial 77 with value: 0.19494852683910804.
2026-06-01 15:17:56 | INFO | Trial 145 | outer=12 | hidden=[1024, 256] epochs=166 lr=2.061e-04 wd=4.829e-04 n_pcs=5000 weight={'name': 'uniform'}
[I 2026-06-01 15:18:13,899] Trial 145 finished with value: 0.182739409195065 and parameters: {'hidden_dims': '[1024, 256]', 'dropout': 0.5030311342656629, 'batch_norm': False, 'lr': 0.00020613779802251415, 'weight_decay': 0.0004828831237773525, 'epochs': 166, 'loss': 'mae', 'optimizer': 'adamw', 'use_snp_selection': False, 'n_pcs': 5000}. Best is trial 77 with value: 0.19494852683910804.
2026-06-01 15:18:13 | INFO | Trial 146 | outer=12 | hidden=[256, 128] epochs=181 lr=2.531e-04 wd=3.322e-04 n_pcs=5000 weight={'name': 'uniform'}
[I 2026-06-01 15:18:20,489] Trial 146 finished with value: 0.1636140528053996 and parameters: {'hidden_dims': '[256, 128]', 'dropout': 0.5109060256002073, 'batch_norm': False, 'lr': 0.0002531076873685264, 'weight_decay': 0.00033224723808353366, 'epochs': 181, 'loss': 'mae', 'optimizer': 'adamw', 'use_snp_selection': False, 'n_pcs': 5000}. Best is trial 77 with value: 0.19494852683910804.
2026-06-01 15:18:20 | INFO | Trial 147 | outer=12 | hidden=[1024, 256] epochs=162 lr=2.286e-04 wd=2.538e-06 n_pcs=5000 weight={'name': 'uniform'}
[I 2026-06-01 15:18:37,434] Trial 147 finished with value: 0.1814314449757919 and parameters: {'hidden_dims': '[1024, 256]', 'dropout': 0.5264134320480763, 'batch_norm': False, 'lr': 0.0002285973480567868, 'weight_decay': 2.538255692901958e-06, 'epochs': 162, 'loss': 'mae', 'optimizer': 'adamw', 'use_snp_selection': False, 'n_pcs': 5000}. Best is trial 77 with value: 0.19494852683910804.
2026-06-01 15:18:37 | INFO | Trial 148 | outer=12 | hidden=[512, 256] epochs=171 lr=3.168e-04 wd=1.910e-04 n_pcs=5000 weight={'name': 'uniform'}
[I 2026-06-01 15:18:47,680] Trial 148 finished with value: 0.1709847415914479 and parameters: {'hidden_dims': '[512, 256]', 'dropout': 0.5526516412958062, 'batch_norm': False, 'lr': 0.0003167982646245791, 'weight_decay': 0.00019096677930312256, 'epochs': 171, 'loss': 'mae', 'optimizer': 'adamw', 'use_snp_selection': False, 'n_pcs': 5000}. Best is trial 77 with value: 0.19494852683910804.
2026-06-01 15:18:47 | INFO | Trial 149 | outer=12 | hidden=[1024, 256] epochs=185 lr=3.623e-04 wd=9.398e-06 n_pcs=5000 weight={'name': 'uniform'}
