[I 2026-06-01 15:19:06,668] Trial 149 finished with value: 0.18873012261992572 and parameters: {'hidden_dims': '[1024, 256]', 'dropout': 0.4714618558732835, 'batch_norm': False, 'lr': 0.0003623489832494691, 'weight_decay': 9.397640228487343e-06, 'epochs': 185, 'loss': 'mae', 'optimizer': 'adamw', 'use_snp_selection': False, 'n_pcs': 5000}. Best is trial 77 with value: 0.19494852683910804.
2026-06-01 15:19:06 | INFO | OUTER 12 best (inner mean r=0.1949): model={'hidden_dims': [1024, 256], 'dropout': 0.349001031213618, 'batch_norm': False, 'lr': 0.0002479447403848655, 'weight_decay': 0.00020302767192641847, 'epochs': 179, 'loss': 'mae', 'optimizer': 'adamw', 'use_snp_selection': False, 'n_pcs': 5000} weighting={'name': 'uniform'}
2026-06-01 15:19:08 | INFO | OUTER 12 TEST r = 0.0883
2026-06-01 15:19:08 | INFO | OUTER 12 incremental summary saved to outputs/final_results/e8_pc_mlp_uniform/thr_wing/e8_pc_mlp_uniform_thr_wing_results.json
2026-06-01 15:19:08 | INFO | OUTER 13: test_size=397 island=12 (Vega)
2026-06-01 15:19:08 | INFO | OUTER 13: inner LOIO validation islands: 0(Nesøy), 1(Myken), 2(Træna), 3(Selvær), 4(Gjerøy), 5(Hestmannøy), 6(Indre Kvarøy), 7(Onøy og Lurøy), 8(Lovund), 9(Sleneset), 10(Aldra), 11(Leka), 13(Vikna), 14(Lauvøya)
2026-06-01 15:19:08 | INFO | OUTER 13: using top 10 related inner validation islands for tuning: 14(Lauvøya, avgGRM=0.0007), 13(Vikna, avgGRM=0.0006), 8(Lovund, avgGRM=-0.0012), 3(Selvær, avgGRM=-0.0030), 11(Leka, avgGRM=-0.0031), 2(Træna, avgGRM=-0.0032), 0(Nesøy, avgGRM=-0.0037), 1(Myken, avgGRM=-0.0042), 9(Sleneset, avgGRM=-0.0042), 7(Onøy og Lurøy, avgGRM=-0.0046)
[I 2026-06-01 15:19:08,913] A new study created in memory with name: mlp_importance_inner_outer12
2026-06-01 15:19:08 | INFO | Trial 0 | outer=13 | hidden=[256, 64] epochs=252 lr=8.243e-05 wd=1.277e-07 n_pcs=1500 weight={'name': 'uniform'}
[I 2026-06-01 15:19:13,622] Trial 0 finished with value: 0.18545341546099287 and parameters: {'hidden_dims': '[256, 64]', 'dropout': 0.19097065492325918, 'batch_norm': False, 'lr': 8.242985198911028e-05, 'weight_decay': 1.277246473139888e-07, 'epochs': 252, 'loss': 'mae', 'optimizer': 'adamw', 'use_snp_selection': False, 'n_pcs': 1500}. Best is trial 0 with value: 0.18545341546099287.
2026-06-01 15:19:13 | INFO | Trial 1 | outer=13 | hidden=[1024, 256] epochs=225 lr=1.391e-04 wd=1.941e-07 n_pcs=500 weight={'name': 'uniform'}
[I 2026-06-01 15:19:20,060] Trial 1 finished with value: 0.17231178130536273 and parameters: {'hidden_dims': '[1024, 256]', 'dropout': 0.2849434595702811, 'batch_norm': False, 'lr': 0.00013909108684683413, 'weight_decay': 1.9407167964924495e-07, 'epochs': 225, 'loss': 'mse', 'optimizer': 'adamw', 'use_snp_selection': False, 'n_pcs': 500}. Best is trial 0 with value: 0.18545341546099287.
2026-06-01 15:19:20 | INFO | Trial 2 | outer=13 | hidden=[256, 64] epochs=139 lr=3.957e-05 wd=3.750e-05 n_pcs=2500 weight={'name': 'uniform'}
[I 2026-06-01 15:19:23,899] Trial 2 finished with value: 0.1536286709815354 and parameters: {'hidden_dims': '[256, 64]', 'dropout': 0.11392712587675291, 'batch_norm': False, 'lr': 3.9573351157697276e-05, 'weight_decay': 3.7502337000845044e-05, 'epochs': 139, 'loss': 'mae', 'optimizer': 'adam', 'use_snp_selection': False, 'n_pcs': 2500}. Best is trial 0 with value: 0.18545341546099287.
2026-06-01 15:19:23 | INFO | Trial 3 | outer=13 | hidden=[128, 64] epochs=164 lr=1.538e-05 wd=3.248e-06 n_pcs=3000 weight={'name': 'uniform'}
[I 2026-06-01 15:19:27,674] Trial 3 finished with value: 0.059654152300374116 and parameters: {'hidden_dims': '[128, 64]', 'dropout': 0.1479874991503876, 'batch_norm': False, 'lr': 1.5380732370316375e-05, 'weight_decay': 3.2478890969962294e-06, 'epochs': 164, 'loss': 'mse', 'optimizer': 'adam', 'use_snp_selection': False, 'n_pcs': 3000}. Best is trial 0 with value: 0.18545341546099287.
2026-06-01 15:19:27 | INFO | Trial 4 | outer=13 | hidden=[256, 128] epochs=210 lr=7.298e-05 wd=7.875e-06 n_pcs=3000 weight={'name': 'uniform'}
[I 2026-06-01 15:19:33,222] Trial 4 finished with value: 0.17357768743329866 and parameters: {'hidden_dims': '[256, 128]', 'dropout': 0.09917626474860408, 'batch_norm': False, 'lr': 7.298380589156323e-05, 'weight_decay': 7.875094299510188e-06, 'epochs': 210, 'loss': 'mae', 'optimizer': 'adam', 'use_snp_selection': False, 'n_pcs': 3000}. Best is trial 0 with value: 0.18545341546099287.
2026-06-01 15:19:33 | INFO | Trial 5 | outer=13 | hidden=[512, 128] epochs=284 lr=5.467e-05 wd=5.496e-06 n_pcs=4000 weight={'name': 'uniform'}
[I 2026-06-01 15:19:46,387] Trial 5 finished with value: 0.17032907641669856 and parameters: {'hidden_dims': '[512, 128]', 'dropout': 0.3143696126156032, 'batch_norm': False, 'lr': 5.46667545989349e-05, 'weight_decay': 5.496446859789657e-06, 'epochs': 284, 'loss': 'mse', 'optimizer': 'adamw', 'use_snp_selection': False, 'n_pcs': 4000}. Best is trial 0 with value: 0.18545341546099287.
2026-06-01 15:19:46 | INFO | Trial 6 | outer=13 | hidden=[512, 64] epochs=90 lr=3.103e-05 wd=6.607e-08 n_pcs=5000 weight={'name': 'uniform'}
[I 2026-06-01 15:19:50,219] Trial 6 pruned. 
2026-06-01 15:19:50 | INFO | Trial 7 | outer=13 | hidden=[128, 64] epochs=272 lr=1.348e-05 wd=1.075e-07 n_pcs=4000 weight={'name': 'uniform'}
[I 2026-06-01 15:19:53,432] Trial 7 pruned. 
2026-06-01 15:19:53 | INFO | Trial 8 | outer=13 | hidden=[128, 64] epochs=205 lr=1.815e-05 wd=5.764e-06 n_pcs=3000 weight={'name': 'uniform'}
[I 2026-06-01 15:19:55,980] Trial 8 pruned. 
2026-06-01 15:19:55 | INFO | Trial 9 | outer=13 | hidden=[128, 64] epochs=296 lr=2.338e-05 wd=1.066e-07 n_pcs=2500 weight={'name': 'uniform'}
[I 2026-06-01 15:20:01,277] Trial 9 finished with value: 0.18054839059057234 and parameters: {'hidden_dims': '[128, 64]', 'dropout': 0.17607378181405245, 'batch_norm': False, 'lr': 2.3379083621874488e-05, 'weight_decay': 1.0663581123617794e-07, 'epochs': 296, 'loss': 'mae', 'optimizer': 'adam', 'use_snp_selection': False, 'n_pcs': 2500}. Best is trial 0 with value: 0.18545341546099287.
2026-06-01 15:20:01 | INFO | Trial 10 | outer=13 | hidden=[512, 256] epochs=242 lr=3.984e-04 wd=9.453e-04 n_pcs=500 weight={'name': 'uniform'}
[I 2026-06-01 15:20:05,896] Trial 10 finished with value: 0.1585647650436847 and parameters: {'hidden_dims': '[512, 256]', 'dropout': 0.02309895975550147, 'batch_norm': False, 'lr': 0.0003983594610602333, 'weight_decay': 0.0009452683165453212, 'epochs': 242, 'loss': 'mae', 'optimizer': 'adamw', 'use_snp_selection': False, 'n_pcs': 500}. Best is trial 0 with value: 0.18545341546099287.
2026-06-01 15:20:05 | INFO | Trial 11 | outer=13 | hidden=[256, 64] epochs=295 lr=1.427e-04 wd=2.193e-08 n_pcs=1500 weight={'name': 'uniform'}
[I 2026-06-01 15:20:08,913] Trial 11 pruned. 
2026-06-01 15:20:08 | INFO | Trial 12 | outer=13 | hidden=[256, 64] epochs=252 lr=1.030e-04 wd=3.910e-07 n_pcs=1500 weight={'name': 'uniform'}
[I 2026-06-01 15:20:13,401] Trial 12 finished with value: 0.17718642367760112 and parameters: {'hidden_dims': '[256, 64]', 'dropout': 0.37425835978186517, 'batch_norm': False, 'lr': 0.00010298527401070625, 'weight_decay': 3.909854047740065e-07, 'epochs': 252, 'loss': 'mae', 'optimizer': 'adam', 'use_snp_selection': False, 'n_pcs': 1500}. Best is trial 0 with value: 0.18545341546099287.
2026-06-01 15:20:13 | INFO | Trial 13 | outer=13 | hidden=[512, 128] epochs=299 lr=2.720e-04 wd=1.147e-08 n_pcs=2000 weight={'name': 'uniform'}
[I 2026-06-01 15:20:21,839] Trial 13 finished with value: 0.1948912026229346 and parameters: {'hidden_dims': '[512, 128]', 'dropout': 0.5756846183148882, 'batch_norm': False, 'lr': 0.0002720463875839025, 'weight_decay': 1.1468192807198332e-08, 'epochs': 299, 'loss': 'mae', 'optimizer': 'adamw', 'use_snp_selection': False, 'n_pcs': 2000}. Best is trial 13 with value: 0.1948912026229346.
2026-06-01 15:20:21 | INFO | Trial 14 | outer=13 | hidden=[512, 128] epochs=174 lr=3.252e-04 wd=1.669e-08 n_pcs=1500 weight={'name': 'uniform'}
[I 2026-06-01 15:20:26,788] Trial 14 finished with value: 0.18159368433031323 and parameters: {'hidden_dims': '[512, 128]', 'dropout': 0.5160449215194329, 'batch_norm': False, 'lr': 0.0003252253971917892, 'weight_decay': 1.6687496335788575e-08, 'epochs': 174, 'loss': 'mae', 'optimizer': 'adamw', 'use_snp_selection': False, 'n_pcs': 1500}. Best is trial 13 with value: 0.1948912026229346.
2026-06-01 15:20:26 | INFO | Trial 15 | outer=13 | hidden=[512, 128] epochs=257 lr=2.317e-04 wd=7.042e-07 n_pcs=1500 weight={'name': 'uniform'}
[I 2026-06-01 15:20:33,304] Trial 15 finished with value: 0.18836448795251587 and parameters: {'hidden_dims': '[512, 128]', 'dropout': 0.4004267514138292, 'batch_norm': False, 'lr': 0.0002316522458672098, 'weight_decay': 7.042341982313891e-07, 'epochs': 257, 'loss': 'mae', 'optimizer': 'adamw', 'use_snp_selection': False, 'n_pcs': 1500}. Best is trial 13 with value: 0.1948912026229346.
2026-06-01 15:20:33 | INFO | Trial 16 | outer=13 | hidden=[512, 128] epochs=77 lr=2.442e-04 wd=8.585e-07 n_pcs=2000 weight={'name': 'uniform'}
[I 2026-06-01 15:20:36,814] Trial 16 finished with value: 0.20204782638149568 and parameters: {'hidden_dims': '[512, 128]', 'dropout': 0.5836048339301093, 'batch_norm': False, 'lr': 0.00024417290042243786, 'weight_decay': 8.585234450812397e-07, 'epochs': 77, 'loss': 'mae', 'optimizer': 'adamw', 'use_snp_selection': False, 'n_pcs': 2000}. Best is trial 16 with value: 0.20204782638149568.
2026-06-01 15:20:36 | INFO | Trial 17 | outer=13 | hidden=[512, 128] epochs=51 lr=2.227e-04 wd=3.867e-05 n_pcs=2000 weight={'name': 'uniform'}
[I 2026-06-01 15:20:39,743] Trial 17 finished with value: 0.18911210787871857 and parameters: {'hidden_dims': '[512, 128]', 'dropout': 0.5998375031807794, 'batch_norm': False, 'lr': 0.00022271297632187856, 'weight_decay': 3.867297748063993e-05, 'epochs': 51, 'loss': 'mae', 'optimizer': 'adamw', 'use_snp_selection': False, 'n_pcs': 2000}. Best is trial 16 with value: 0.20204782638149568.
2026-06-01 15:20:39 | INFO | Trial 18 | outer=13 | hidden=[512, 128] epochs=113 lr=2.617e-04 wd=1.120e-06 n_pcs=4000 weight={'name': 'uniform'}
[I 2026-06-01 15:20:46,268] Trial 18 finished with value: 0.1931419540825641 and parameters: {'hidden_dims': '[512, 128]', 'dropout': 0.5842505243526348, 'batch_norm': False, 'lr': 0.00026166546058732464, 'weight_decay': 1.1204687862312573e-06, 'epochs': 113, 'loss': 'mae', 'optimizer': 'adamw', 'use_snp_selection': False, 'n_pcs': 4000}. Best is trial 16 with value: 0.20204782638149568.
2026-06-01 15:20:46 | INFO | Trial 19 | outer=13 | hidden=[256, 128] epochs=66 lr=1.640e-04 wd=6.757e-04 n_pcs=1000 weight={'name': 'uniform'}
[I 2026-06-01 15:20:48,616] Trial 19 finished with value: 0.16837840988270006 and parameters: {'hidden_dims': '[256, 128]', 'dropout': 0.5234707811721447, 'batch_norm': False, 'lr': 0.00016397437423726165, 'weight_decay': 0.0006757254563874141, 'epochs': 66, 'loss': 'mae', 'optimizer': 'adamw', 'use_snp_selection': False, 'n_pcs': 1000}. Best is trial 16 with value: 0.20204782638149568.
2026-06-01 15:20:48 | INFO | Trial 20 | outer=13 | hidden=[1024, 256] epochs=141 lr=4.490e-04 wd=3.013e-05 n_pcs=2000 weight={'name': 'uniform'}
[I 2026-06-01 15:20:57,164] Trial 20 finished with value: 0.19547532995607358 and parameters: {'hidden_dims': '[1024, 256]', 'dropout': 0.45310990983692423, 'batch_norm': False, 'lr': 0.00044895221828700834, 'weight_decay': 3.012529947077554e-05, 'epochs': 141, 'loss': 'mae', 'optimizer': 'adamw', 'use_snp_selection': False, 'n_pcs': 2000}. Best is trial 16 with value: 0.20204782638149568.
2026-06-01 15:20:57 | INFO | Trial 21 | outer=13 | hidden=[1024, 256] epochs=120 lr=4.885e-04 wd=9.758e-05 n_pcs=2000 weight={'name': 'uniform'}
[I 2026-06-01 15:21:04,707] Trial 21 finished with value: 0.2003810633317616 and parameters: {'hidden_dims': '[1024, 256]', 'dropout': 0.5566577049788022, 'batch_norm': False, 'lr': 0.0004884684082828122, 'weight_decay': 9.75786934770112e-05, 'epochs': 120, 'loss': 'mae', 'optimizer': 'adamw', 'use_snp_selection': False, 'n_pcs': 2000}. Best is trial 16 with value: 0.20204782638149568.
2026-06-01 15:21:04 | INFO | Trial 22 | outer=13 | hidden=[1024, 256] epochs=117 lr=4.328e-04 wd=1.621e-04 n_pcs=2000 weight={'name': 'uniform'}
[I 2026-06-01 15:21:12,127] Trial 22 finished with value: 0.19628903967592007 and parameters: {'hidden_dims': '[1024, 256]', 'dropout': 0.4723687961633894, 'batch_norm': False, 'lr': 0.00043275766346515654, 'weight_decay': 0.000162101535240032, 'epochs': 117, 'loss': 'mae', 'optimizer': 'adamw', 'use_snp_selection': False, 'n_pcs': 2000}. Best is trial 16 with value: 0.20204782638149568.
2026-06-01 15:21:12 | INFO | Trial 23 | outer=13 | hidden=[1024, 256] epochs=95 lr=4.747e-04 wd=2.382e-04 n_pcs=2500 weight={'name': 'uniform'}
[I 2026-06-01 15:21:19,107] Trial 23 finished with value: 0.19856788084058077 and parameters: {'hidden_dims': '[1024, 256]', 'dropout': 0.5396078090092606, 'batch_norm': False, 'lr': 0.0004747166100530141, 'weight_decay': 0.00023823473526248258, 'epochs': 95, 'loss': 'mae', 'optimizer': 'adamw', 'use_snp_selection': False, 'n_pcs': 2500}. Best is trial 16 with value: 0.20204782638149568.
2026-06-01 15:21:19 | INFO | Trial 24 | outer=13 | hidden=[1024, 256] epochs=91 lr=4.678e-04 wd=2.422e-04 n_pcs=3500 weight={'name': 'uniform'}
[I 2026-06-01 15:21:27,608] Trial 24 finished with value: 0.18704681059650957 and parameters: {'hidden_dims': '[1024, 256]', 'dropout': 0.5396748167234064, 'batch_norm': False, 'lr': 0.0004677743449016918, 'weight_decay': 0.00024218354489456546, 'epochs': 91, 'loss': 'mae', 'optimizer': 'adamw', 'use_snp_selection': False, 'n_pcs': 3500}. Best is trial 16 with value: 0.20204782638149568.
2026-06-01 15:21:27 | INFO | Trial 25 | outer=13 | hidden=[1024, 256] epochs=85 lr=3.402e-04 wd=1.283e-04 n_pcs=2500 weight={'name': 'uniform'}
[I 2026-06-01 15:21:34,055] Trial 25 finished with value: 0.19212271373524908 and parameters: {'hidden_dims': '[1024, 256]', 'dropout': 0.5376265356977501, 'batch_norm': False, 'lr': 0.00034016124650644423, 'weight_decay': 0.00012825049442198428, 'epochs': 85, 'loss': 'mae', 'optimizer': 'adamw', 'use_snp_selection': False, 'n_pcs': 2500}. Best is trial 16 with value: 0.20204782638149568.
2026-06-01 15:21:34 | INFO | Trial 26 | outer=13 | hidden=[512, 256] epochs=112 lr=1.973e-04 wd=1.706e-05 n_pcs=1000 weight={'name': 'uniform'}
[I 2026-06-01 15:21:37,551] Trial 26 finished with value: 0.2079867783788492 and parameters: {'hidden_dims': '[512, 256]', 'dropout': 0.41378298402277564, 'batch_norm': False, 'lr': 0.00019727582730795864, 'weight_decay': 1.7057854109586052e-05, 'epochs': 112, 'loss': 'mae', 'optimizer': 'adamw', 'use_snp_selection': False, 'n_pcs': 1000}. Best is trial 26 with value: 0.2079867783788492.
2026-06-01 15:21:37 | INFO | Trial 27 | outer=13 | hidden=[512, 256] epochs=132 lr=1.834e-04 wd=1.540e-05 n_pcs=1000 weight={'name': 'uniform'}
[I 2026-06-01 15:21:41,385] Trial 27 finished with value: 0.20934351046785998 and parameters: {'hidden_dims': '[512, 256]', 'dropout': 0.3684780130744776, 'batch_norm': False, 'lr': 0.00018335971588373295, 'weight_decay': 1.54013416298323e-05, 'epochs': 132, 'loss': 'mae', 'optimizer': 'adamw', 'use_snp_selection': False, 'n_pcs': 1000}. Best is trial 27 with value: 0.20934351046785998.
2026-06-01 15:21:41 | INFO | Trial 28 | outer=13 | hidden=[512, 256] epochs=146 lr=1.784e-04 wd=1.483e-05 n_pcs=1000 weight={'name': 'uniform'}
[I 2026-06-01 15:21:45,457] Trial 28 finished with value: 0.1923380049586169 and parameters: {'hidden_dims': '[512, 256]', 'dropout': 0.3516102612912606, 'batch_norm': False, 'lr': 0.0001783955660064359, 'weight_decay': 1.4832299987115235e-05, 'epochs': 146, 'loss': 'mae', 'optimizer': 'adamw', 'use_snp_selection': False, 'n_pcs': 1000}. Best is trial 27 with value: 0.20934351046785998.
2026-06-01 15:21:45 | INFO | Trial 29 | outer=13 | hidden=[512, 256] epochs=70 lr=1.022e-04 wd=1.081e-06 n_pcs=1000 weight={'name': 'uniform'}
[I 2026-06-01 15:21:48,237] Trial 29 finished with value: 0.187073454983461 and parameters: {'hidden_dims': '[512, 256]', 'dropout': 0.240877212393257, 'batch_norm': False, 'lr': 0.00010224436213206475, 'weight_decay': 1.0808787296178465e-06, 'epochs': 70, 'loss': 'mae', 'optimizer': 'adamw', 'use_snp_selection': False, 'n_pcs': 1000}. Best is trial 27 with value: 0.20934351046785998.
2026-06-01 15:21:48 | INFO | Trial 30 | outer=13 | hidden=[512, 256] epochs=107 lr=1.066e-04 wd=1.500e-05 n_pcs=500 weight={'name': 'uniform'}
[I 2026-06-01 15:21:51,142] Trial 30 finished with value: 0.17780679630099758 and parameters: {'hidden_dims': '[512, 256]', 'dropout': 0.4033467372396362, 'batch_norm': False, 'lr': 0.00010661076978964434, 'weight_decay': 1.5002452514867115e-05, 'epochs': 107, 'loss': 'mae', 'optimizer': 'adamw', 'use_snp_selection': False, 'n_pcs': 500}. Best is trial 27 with value: 0.20934351046785998.
2026-06-01 15:21:51 | INFO | Trial 31 | outer=13 | hidden=[512, 256] epochs=125 lr=1.930e-04 wd=7.571e-05 n_pcs=1000 weight={'name': 'uniform'}
[I 2026-06-01 15:21:54,848] Trial 31 finished with value: 0.20744524280416332 and parameters: {'hidden_dims': '[512, 256]', 'dropout': 0.4282449536834268, 'batch_norm': False, 'lr': 0.0001929536221968124, 'weight_decay': 7.570511157648969e-05, 'epochs': 125, 'loss': 'mae', 'optimizer': 'adamw', 'use_snp_selection': False, 'n_pcs': 1000}. Best is trial 27 with value: 0.20934351046785998.
2026-06-01 15:21:54 | INFO | Trial 32 | outer=13 | hidden=[512, 256] epochs=130 lr=1.793e-04 wd=1.945e-06 n_pcs=1000 weight={'name': 'uniform'}
[I 2026-06-01 15:21:58,649] Trial 32 finished with value: 0.19945019741787678 and parameters: {'hidden_dims': '[512, 256]', 'dropout': 0.4109831958863411, 'batch_norm': False, 'lr': 0.00017933648526078253, 'weight_decay': 1.9451217737760346e-06, 'epochs': 130, 'loss': 'mae', 'optimizer': 'adamw', 'use_snp_selection': False, 'n_pcs': 1000}. Best is trial 27 with value: 0.20934351046785998.
2026-06-01 15:21:58 | INFO | Trial 33 | outer=13 | hidden=[512, 256] epochs=158 lr=1.284e-04 wd=5.901e-05 n_pcs=500 weight={'name': 'uniform'}
[I 2026-06-01 15:22:02,193] Trial 33 finished with value: 0.18038915087490576 and parameters: {'hidden_dims': '[512, 256]', 'dropout': 0.3343773129779505, 'batch_norm': False, 'lr': 0.00012835314580200496, 'weight_decay': 5.9012973941796925e-05, 'epochs': 158, 'loss': 'mae', 'optimizer': 'adamw', 'use_snp_selection': False, 'n_pcs': 500}. Best is trial 27 with value: 0.20934351046785998.
2026-06-01 15:22:02 | INFO | Trial 34 | outer=13 | hidden=[512, 256] epochs=189 lr=5.908e-05 wd=1.716e-05 n_pcs=1000 weight={'name': 'uniform'}
[I 2026-06-01 15:22:06,991] Trial 34 finished with value: 0.2018104160784951 and parameters: {'hidden_dims': '[512, 256]', 'dropout': 0.2700938058615612, 'batch_norm': False, 'lr': 5.908244141151402e-05, 'weight_decay': 1.7159392838835927e-05, 'epochs': 189, 'loss': 'mse', 'optimizer': 'adamw', 'use_snp_selection': False, 'n_pcs': 1000}. Best is trial 27 with value: 0.20934351046785998.
2026-06-01 15:22:07 | INFO | Trial 35 | outer=13 | hidden=[512, 64] epochs=130 lr=1.959e-04 wd=2.278e-06 n_pcs=500 weight={'name': 'uniform'}
[I 2026-06-01 15:22:09,961] Trial 35 finished with value: 0.19495441420287252 and parameters: {'hidden_dims': '[512, 64]', 'dropout': 0.43201892080483295, 'batch_norm': False, 'lr': 0.00019587561107046485, 'weight_decay': 2.278257855207863e-06, 'epochs': 130, 'loss': 'mae', 'optimizer': 'adamw', 'use_snp_selection': False, 'n_pcs': 500}. Best is trial 27 with value: 0.20934351046785998.
2026-06-01 15:22:09 | INFO | Trial 36 | outer=13 | hidden=[512, 256] epochs=75 lr=2.996e-04 wd=8.311e-06 n_pcs=1500 weight={'name': 'uniform'}
[I 2026-06-01 15:22:11,946] Trial 36 pruned. 
2026-06-01 15:22:11 | INFO | Trial 37 | outer=13 | hidden=[512, 256] epochs=106 lr=1.291e-04 wd=2.978e-07 n_pcs=1000 weight={'name': 'uniform'}
[I 2026-06-01 15:22:15,354] Trial 37 finished with value: 0.21017707453380918 and parameters: {'hidden_dims': '[512, 256]', 'dropout': 0.4827096818621744, 'batch_norm': False, 'lr': 0.00012912059994633012, 'weight_decay': 2.9780645143048277e-07, 'epochs': 106, 'loss': 'mse', 'optimizer': 'adam', 'use_snp_selection': False, 'n_pcs': 1000}. Best is trial 37 with value: 0.21017707453380918.
2026-06-01 15:22:15 | INFO | Trial 38 | outer=13 | hidden=[512, 256] epochs=157 lr=1.301e-04 wd=6.430e-05 n_pcs=1000 weight={'name': 'uniform'}
[I 2026-06-01 15:22:19,621] Trial 38 finished with value: 0.21419786323691362 and parameters: {'hidden_dims': '[512, 256]', 'dropout': 0.48492948825137083, 'batch_norm': False, 'lr': 0.00013013152491358354, 'weight_decay': 6.429696422563783e-05, 'epochs': 157, 'loss': 'mse', 'optimizer': 'adam', 'use_snp_selection': False, 'n_pcs': 1000}. Best is trial 38 with value: 0.21419786323691362.
2026-06-01 15:22:19 | INFO | Trial 39 | outer=13 | hidden=[512, 256] epochs=158 lr=7.511e-05 wd=2.651e-07 n_pcs=500 weight={'name': 'uniform'}
[I 2026-06-01 15:22:23,170] Trial 39 finished with value: 0.1638991982812733 and parameters: {'hidden_dims': '[512, 256]', 'dropout': 0.4813087010992325, 'batch_norm': False, 'lr': 7.510776865612117e-05, 'weight_decay': 2.6507551081995373e-07, 'epochs': 158, 'loss': 'mse', 'optimizer': 'adam', 'use_snp_selection': False, 'n_pcs': 500}. Best is trial 38 with value: 0.21419786323691362.
2026-06-01 15:22:23 | INFO | Trial 40 | outer=13 | hidden=[256, 128] epochs=183 lr=4.669e-05 wd=2.706e-05 n_pcs=1500 weight={'name': 'uniform'}
