[I 2026-06-01 14:39:28,776] Trial 3 finished with value: 0.09183501575922001 and parameters: {'hidden_dims': '[128, 64]', 'dropout': 0.1479874991503876, 'batch_norm': False, 'lr': 1.5380732370316375e-05, 'weight_decay': 3.2478890969962294e-06, 'epochs': 164, 'loss': 'mse', 'optimizer': 'adam', 'use_snp_selection': False, 'n_pcs': 3000}. Best is trial 2 with value: 0.19950429900259914.
2026-06-01 14:39:28 | INFO | Trial 4 | outer=11 | hidden=[256, 128] epochs=210 lr=7.298e-05 wd=7.875e-06 n_pcs=3000 weight={'name': 'uniform'}
[I 2026-06-01 14:39:34,486] Trial 4 finished with value: 0.16172704331825 and parameters: {'hidden_dims': '[256, 128]', 'dropout': 0.09917626474860408, 'batch_norm': False, 'lr': 7.298380589156323e-05, 'weight_decay': 7.875094299510188e-06, 'epochs': 210, 'loss': 'mae', 'optimizer': 'adam', 'use_snp_selection': False, 'n_pcs': 3000}. Best is trial 2 with value: 0.19950429900259914.
2026-06-01 14:39:34 | INFO | Trial 5 | outer=11 | hidden=[512, 128] epochs=284 lr=5.467e-05 wd=5.496e-06 n_pcs=4000 weight={'name': 'uniform'}
[I 2026-06-01 14:39:48,093] Trial 5 finished with value: 0.16081101912399548 and parameters: {'hidden_dims': '[512, 128]', 'dropout': 0.3143696126156032, 'batch_norm': False, 'lr': 5.46667545989349e-05, 'weight_decay': 5.496446859789657e-06, 'epochs': 284, 'loss': 'mse', 'optimizer': 'adamw', 'use_snp_selection': False, 'n_pcs': 4000}. Best is trial 2 with value: 0.19950429900259914.
2026-06-01 14:39:48 | INFO | Trial 6 | outer=11 | hidden=[512, 64] epochs=90 lr=3.103e-05 wd=6.607e-08 n_pcs=5000 weight={'name': 'uniform'}
[I 2026-06-01 14:39:54,668] Trial 6 finished with value: 0.13492512259373207 and parameters: {'hidden_dims': '[512, 64]', 'dropout': 0.4941304802762902, 'batch_norm': False, 'lr': 3.103455600245868e-05, 'weight_decay': 6.606788619980135e-08, 'epochs': 90, 'loss': 'mse', 'optimizer': 'adamw', 'use_snp_selection': False, 'n_pcs': 5000}. Best is trial 2 with value: 0.19950429900259914.
2026-06-01 14:39:54 | INFO | Trial 7 | outer=11 | hidden=[128, 64] epochs=272 lr=1.348e-05 wd=1.075e-07 n_pcs=4000 weight={'name': 'uniform'}
[I 2026-06-01 14:39:58,041] Trial 7 pruned. 
2026-06-01 14:39:58 | INFO | Trial 8 | outer=11 | hidden=[128, 64] epochs=205 lr=1.815e-05 wd=5.764e-06 n_pcs=3000 weight={'name': 'uniform'}
[I 2026-06-01 14:40:00,791] Trial 8 pruned. 
2026-06-01 14:40:00 | INFO | Trial 9 | outer=11 | hidden=[128, 64] epochs=296 lr=2.338e-05 wd=1.066e-07 n_pcs=2500 weight={'name': 'uniform'}
[I 2026-06-01 14:40:06,506] Trial 9 finished with value: 0.18052343841459967 and parameters: {'hidden_dims': '[128, 64]', 'dropout': 0.17607378181405245, 'batch_norm': False, 'lr': 2.3379083621874488e-05, 'weight_decay': 1.0663581123617794e-07, 'epochs': 296, 'loss': 'mae', 'optimizer': 'adam', 'use_snp_selection': False, 'n_pcs': 2500}. Best is trial 2 with value: 0.19950429900259914.
2026-06-01 14:40:06 | INFO | Trial 10 | outer=11 | hidden=[512, 256] epochs=121 lr=3.984e-04 wd=6.166e-04 n_pcs=1500 weight={'name': 'uniform'}
[I 2026-06-01 14:40:10,890] Trial 10 finished with value: 0.18968308401851317 and parameters: {'hidden_dims': '[512, 256]', 'dropout': 0.023098959755501636, 'batch_norm': False, 'lr': 0.0003983594610602333, 'weight_decay': 0.0006165568464880608, 'epochs': 121, 'loss': 'mae', 'optimizer': 'adam', 'use_snp_selection': False, 'n_pcs': 1500}. Best is trial 2 with value: 0.19950429900259914.
2026-06-01 14:40:10 | INFO | Trial 11 | outer=11 | hidden=[512, 256] epochs=120 lr=3.985e-04 wd=6.080e-04 n_pcs=1500 weight={'name': 'uniform'}
[I 2026-06-01 14:40:15,238] Trial 11 finished with value: 0.17728404123480526 and parameters: {'hidden_dims': '[512, 256]', 'dropout': 0.034453903981306294, 'batch_norm': False, 'lr': 0.00039850138867195595, 'weight_decay': 0.0006080096140690285, 'epochs': 120, 'loss': 'mae', 'optimizer': 'adam', 'use_snp_selection': False, 'n_pcs': 1500}. Best is trial 2 with value: 0.19950429900259914.
2026-06-01 14:40:15 | INFO | Trial 12 | outer=11 | hidden=[256, 64] epochs=133 lr=4.981e-04 wd=3.714e-04 n_pcs=1500 weight={'name': 'uniform'}
[I 2026-06-01 14:40:18,439] Trial 12 finished with value: 0.1660610498349299 and parameters: {'hidden_dims': '[256, 64]', 'dropout': 0.02323342726289353, 'batch_norm': False, 'lr': 0.000498069436842805, 'weight_decay': 0.0003714482006573334, 'epochs': 133, 'loss': 'mae', 'optimizer': 'adam', 'use_snp_selection': False, 'n_pcs': 1500}. Best is trial 2 with value: 0.19950429900259914.
2026-06-01 14:40:18 | INFO | Trial 13 | outer=11 | hidden=[512, 256] epochs=84 lr=1.903e-04 wd=9.791e-05 n_pcs=500 weight={'name': 'uniform'}
[I 2026-06-01 14:40:21,087] Trial 13 finished with value: 0.1586871535361803 and parameters: {'hidden_dims': '[512, 256]', 'dropout': 0.009610489279821471, 'batch_norm': False, 'lr': 0.0001902559518219533, 'weight_decay': 9.790601235140893e-05, 'epochs': 84, 'loss': 'mae', 'optimizer': 'adam', 'use_snp_selection': False, 'n_pcs': 500}. Best is trial 2 with value: 0.19950429900259914.
2026-06-01 14:40:21 | INFO | Trial 14 | outer=11 | hidden=[512, 256] epochs=156 lr=4.057e-05 wd=9.704e-05 n_pcs=2000 weight={'name': 'uniform'}
[I 2026-06-01 14:40:26,852] Trial 14 finished with value: 0.1845607241105509 and parameters: {'hidden_dims': '[512, 256]', 'dropout': 0.09888005118118673, 'batch_norm': False, 'lr': 4.057464583126155e-05, 'weight_decay': 9.703840743007952e-05, 'epochs': 156, 'loss': 'mae', 'optimizer': 'adam', 'use_snp_selection': False, 'n_pcs': 2000}. Best is trial 2 with value: 0.19950429900259914.
2026-06-01 14:40:26 | INFO | Trial 15 | outer=11 | hidden=[256, 64] epochs=62 lr=1.685e-04 wd=3.807e-05 n_pcs=2000 weight={'name': 'uniform'}
[I 2026-06-01 14:40:29,405] Trial 15 finished with value: 0.16046320497543093 and parameters: {'hidden_dims': '[256, 64]', 'dropout': 0.22567202706526443, 'batch_norm': False, 'lr': 0.0001684851987148783, 'weight_decay': 3.807037232902509e-05, 'epochs': 62, 'loss': 'mae', 'optimizer': 'adam', 'use_snp_selection': False, 'n_pcs': 2000}. Best is trial 2 with value: 0.19950429900259914.
2026-06-01 14:40:29 | INFO | Trial 16 | outer=11 | hidden=[512, 64] epochs=120 lr=2.804e-04 wd=8.650e-04 n_pcs=1000 weight={'name': 'uniform'}
[I 2026-06-01 14:40:32,724] Trial 16 finished with value: 0.19756925021691824 and parameters: {'hidden_dims': '[512, 64]', 'dropout': 0.37856068030800605, 'batch_norm': False, 'lr': 0.0002803500725619638, 'weight_decay': 0.0008649714917128324, 'epochs': 120, 'loss': 'mae', 'optimizer': 'adam', 'use_snp_selection': False, 'n_pcs': 1000}. Best is trial 2 with value: 0.19950429900259914.
2026-06-01 14:40:32 | INFO | Trial 17 | outer=11 | hidden=[512, 64] epochs=182 lr=2.238e-04 wd=1.184e-08 n_pcs=4000 weight={'name': 'uniform'}
[I 2026-06-01 14:40:42,039] Trial 17 finished with value: 0.1912177804732773 and parameters: {'hidden_dims': '[512, 64]', 'dropout': 0.5998375031807794, 'batch_norm': False, 'lr': 0.00022379950700400066, 'weight_decay': 1.1840058441529551e-08, 'epochs': 182, 'loss': 'mae', 'optimizer': 'adam', 'use_snp_selection': False, 'n_pcs': 4000}. Best is trial 2 with value: 0.19950429900259914.
2026-06-01 14:40:42 | INFO | Trial 18 | outer=11 | hidden=[512, 64] epochs=51 lr=1.255e-04 wd=3.163e-05 n_pcs=1000 weight={'name': 'uniform'}
[I 2026-06-01 14:40:44,374] Trial 18 finished with value: 0.18908778435766002 and parameters: {'hidden_dims': '[512, 64]', 'dropout': 0.3779333805025589, 'batch_norm': False, 'lr': 0.00012547615642091955, 'weight_decay': 3.163243679361856e-05, 'epochs': 51, 'loss': 'mae', 'optimizer': 'adam', 'use_snp_selection': False, 'n_pcs': 1000}. Best is trial 2 with value: 0.19950429900259914.
2026-06-01 14:40:44 | INFO | Trial 19 | outer=11 | hidden=[256, 128] epochs=142 lr=1.036e-05 wd=1.582e-04 n_pcs=2500 weight={'name': 'uniform'}
[I 2026-06-01 14:40:46,789] Trial 19 pruned. 
2026-06-01 14:40:46 | INFO | Trial 20 | outer=11 | hidden=[1024, 256] epochs=102 lr=2.750e-04 wd=7.106e-07 n_pcs=3500 weight={'name': 'uniform'}
[I 2026-06-01 14:40:56,410] Trial 20 finished with value: 0.1980412708987848 and parameters: {'hidden_dims': '[1024, 256]', 'dropout': 0.5949811438775965, 'batch_norm': False, 'lr': 0.0002749522244423293, 'weight_decay': 7.10553365996841e-07, 'epochs': 102, 'loss': 'mae', 'optimizer': 'adam', 'use_snp_selection': False, 'n_pcs': 3500}. Best is trial 2 with value: 0.19950429900259914.
2026-06-01 14:40:56 | INFO | Trial 21 | outer=11 | hidden=[1024, 256] epochs=94 lr=2.750e-04 wd=7.655e-07 n_pcs=3500 weight={'name': 'uniform'}
[I 2026-06-01 14:41:05,455] Trial 21 finished with value: 0.1871097642020511 and parameters: {'hidden_dims': '[1024, 256]', 'dropout': 0.5732390026204821, 'batch_norm': False, 'lr': 0.0002750492685074443, 'weight_decay': 7.655480668550128e-07, 'epochs': 94, 'loss': 'mae', 'optimizer': 'adam', 'use_snp_selection': False, 'n_pcs': 3500}. Best is trial 2 with value: 0.19950429900259914.
2026-06-01 14:41:05 | INFO | Trial 22 | outer=11 | hidden=[1024, 256] epochs=101 lr=9.854e-05 wd=9.130e-07 n_pcs=5000 weight={'name': 'uniform'}
[I 2026-06-01 14:41:17,786] Trial 22 finished with value: 0.181675613225814 and parameters: {'hidden_dims': '[1024, 256]', 'dropout': 0.49023653641594134, 'batch_norm': False, 'lr': 9.854057278986552e-05, 'weight_decay': 9.129834014072303e-07, 'epochs': 101, 'loss': 'mae', 'optimizer': 'adam', 'use_snp_selection': False, 'n_pcs': 5000}. Best is trial 2 with value: 0.19950429900259914.
2026-06-01 14:41:17 | INFO | Trial 23 | outer=11 | hidden=[512, 128] epochs=114 lr=2.827e-04 wd=1.939e-05 n_pcs=3500 weight={'name': 'uniform'}
[I 2026-06-01 14:41:24,059] Trial 23 finished with value: 0.18423624030694402 and parameters: {'hidden_dims': '[512, 128]', 'dropout': 0.5491805611922709, 'batch_norm': False, 'lr': 0.0002826670203643912, 'weight_decay': 1.938885642677362e-05, 'epochs': 114, 'loss': 'mae', 'optimizer': 'adam', 'use_snp_selection': False, 'n_pcs': 3500}. Best is trial 2 with value: 0.19950429900259914.
2026-06-01 14:41:24 | INFO | Trial 24 | outer=11 | hidden=[256, 64] epochs=183 lr=4.886e-05 wd=1.464e-06 n_pcs=4500 weight={'name': 'uniform'}
[I 2026-06-01 14:41:30,695] Trial 24 finished with value: 0.15829193086460716 and parameters: {'hidden_dims': '[256, 64]', 'dropout': 0.33579419468074145, 'batch_norm': False, 'lr': 4.885635644871433e-05, 'weight_decay': 1.4635274260818566e-06, 'epochs': 183, 'loss': 'mae', 'optimizer': 'adam', 'use_snp_selection': False, 'n_pcs': 4500}. Best is trial 2 with value: 0.19950429900259914.
2026-06-01 14:41:30 | INFO | Trial 25 | outer=11 | hidden=[512, 64] epochs=72 lr=1.096e-04 wd=2.593e-04 n_pcs=3500 weight={'name': 'uniform'}
[I 2026-06-01 14:41:35,361] Trial 25 finished with value: 0.17102982922153667 and parameters: {'hidden_dims': '[512, 64]', 'dropout': 0.49957614833192815, 'batch_norm': False, 'lr': 0.00010958008962602926, 'weight_decay': 0.0002593320243847389, 'epochs': 72, 'loss': 'mae', 'optimizer': 'adam', 'use_snp_selection': False, 'n_pcs': 3500}. Best is trial 2 with value: 0.19950429900259914.
2026-06-01 14:41:35 | INFO | Trial 26 | outer=11 | hidden=[1024, 256] epochs=147 lr=2.793e-04 wd=4.789e-07 n_pcs=2000 weight={'name': 'uniform'}
[I 2026-06-01 14:41:44,662] Trial 26 finished with value: 0.19130605679761165 and parameters: {'hidden_dims': '[1024, 256]', 'dropout': 0.23336761692528468, 'batch_norm': False, 'lr': 0.0002792534495805262, 'weight_decay': 4.789230106233787e-07, 'epochs': 147, 'loss': 'mae', 'optimizer': 'adamw', 'use_snp_selection': False, 'n_pcs': 2000}. Best is trial 2 with value: 0.19950429900259914.
2026-06-01 14:41:44 | INFO | Trial 27 | outer=11 | hidden=[1024, 256] epochs=108 lr=4.032e-05 wd=4.700e-05 n_pcs=1000 weight={'name': 'uniform'}
[I 2026-06-01 14:41:49,714] Trial 27 finished with value: 0.16728595832917179 and parameters: {'hidden_dims': '[1024, 256]', 'dropout': 0.42798641777556456, 'batch_norm': False, 'lr': 4.032002181038174e-05, 'weight_decay': 4.700027594890558e-05, 'epochs': 108, 'loss': 'mae', 'optimizer': 'adam', 'use_snp_selection': False, 'n_pcs': 1000}. Best is trial 2 with value: 0.19950429900259914.
2026-06-01 14:41:49 | INFO | Trial 28 | outer=11 | hidden=[512, 64] epochs=133 lr=2.832e-05 wd=1.743e-05 n_pcs=2500 weight={'name': 'uniform'}
[I 2026-06-01 14:41:55,070] Trial 28 finished with value: 0.18130340128367406 and parameters: {'hidden_dims': '[512, 64]', 'dropout': 0.09178751048673972, 'batch_norm': False, 'lr': 2.8324404477155323e-05, 'weight_decay': 1.7429837363954494e-05, 'epochs': 133, 'loss': 'mae', 'optimizer': 'adam', 'use_snp_selection': False, 'n_pcs': 2500}. Best is trial 2 with value: 0.19950429900259914.
2026-06-01 14:41:55 | INFO | Trial 29 | outer=11 | hidden=[256, 64] epochs=161 lr=8.560e-05 wd=1.966e-06 n_pcs=1000 weight={'name': 'uniform'}
[I 2026-06-01 14:41:58,777] Trial 29 finished with value: 0.19907152281846557 and parameters: {'hidden_dims': '[256, 64]', 'dropout': 0.240877212393257, 'batch_norm': False, 'lr': 8.560230958796296e-05, 'weight_decay': 1.966271100487015e-06, 'epochs': 161, 'loss': 'mae', 'optimizer': 'adamw', 'use_snp_selection': False, 'n_pcs': 1000}. Best is trial 2 with value: 0.19950429900259914.
2026-06-01 14:41:58 | INFO | Trial 30 | outer=11 | hidden=[256, 64] epochs=162 lr=8.330e-05 wd=2.164e-06 n_pcs=4500 weight={'name': 'uniform'}
[I 2026-06-01 14:42:04,891] Trial 30 finished with value: 0.14409713368482263 and parameters: {'hidden_dims': '[256, 64]', 'dropout': 0.23206179524793724, 'batch_norm': False, 'lr': 8.330034450202877e-05, 'weight_decay': 2.1641056713681024e-06, 'epochs': 162, 'loss': 'mae', 'optimizer': 'adamw', 'use_snp_selection': False, 'n_pcs': 4500}. Best is trial 2 with value: 0.19950429900259914.
2026-06-01 14:42:04 | INFO | Trial 31 | outer=11 | hidden=[256, 64] epochs=180 lr=6.095e-05 wd=3.342e-07 n_pcs=500 weight={'name': 'uniform'}
[I 2026-06-01 14:42:08,495] Trial 31 finished with value: 0.1637458716757218 and parameters: {'hidden_dims': '[256, 64]', 'dropout': 0.15822222735062505, 'batch_norm': False, 'lr': 6.095070876613829e-05, 'weight_decay': 3.3420014904276905e-07, 'epochs': 180, 'loss': 'mae', 'optimizer': 'adamw', 'use_snp_selection': False, 'n_pcs': 500}. Best is trial 2 with value: 0.19950429900259914.
2026-06-01 14:42:08 | INFO | Trial 32 | outer=11 | hidden=[256, 64] epochs=244 lr=1.552e-04 wd=1.099e-05 n_pcs=1000 weight={'name': 'uniform'}
[I 2026-06-01 14:42:12,818] Trial 32 finished with value: 0.17463524286285928 and parameters: {'hidden_dims': '[256, 64]', 'dropout': 0.2583199387010155, 'batch_norm': False, 'lr': 0.00015518244141735546, 'weight_decay': 1.0989920279099725e-05, 'epochs': 244, 'loss': 'mae', 'optimizer': 'adamw', 'use_snp_selection': False, 'n_pcs': 1000}. Best is trial 2 with value: 0.19950429900259914.
2026-06-01 14:42:12 | INFO | Trial 33 | outer=11 | hidden=[256, 64] epochs=130 lr=2.260e-04 wd=2.961e-06 n_pcs=1000 weight={'name': 'uniform'}
[I 2026-06-01 14:42:16,031] Trial 33 finished with value: 0.17410022834659936 and parameters: {'hidden_dims': '[256, 64]', 'dropout': 0.35829008749263486, 'batch_norm': False, 'lr': 0.00022596496871669024, 'weight_decay': 2.9612780058146493e-06, 'epochs': 130, 'loss': 'mae', 'optimizer': 'adamw', 'use_snp_selection': False, 'n_pcs': 1000}. Best is trial 2 with value: 0.19950429900259914.
2026-06-01 14:42:16 | INFO | Trial 34 | outer=11 | hidden=[256, 128] epochs=200 lr=8.297e-05 wd=1.155e-06 n_pcs=500 weight={'name': 'uniform'}
[I 2026-06-01 14:42:20,106] Trial 34 finished with value: 0.1756870490199701 and parameters: {'hidden_dims': '[256, 128]', 'dropout': 0.13355567941433458, 'batch_norm': False, 'lr': 8.296780765979456e-05, 'weight_decay': 1.1552738845516166e-06, 'epochs': 200, 'loss': 'mse', 'optimizer': 'adamw', 'use_snp_selection': False, 'n_pcs': 500}. Best is trial 2 with value: 0.19950429900259914.
2026-06-01 14:42:20 | INFO | Trial 35 | outer=11 | hidden=[1024, 256] epochs=169 lr=3.410e-04 wd=2.753e-08 n_pcs=2000 weight={'name': 'uniform'}
[I 2026-06-01 14:42:30,452] Trial 35 finished with value: 0.1987354681686707 and parameters: {'hidden_dims': '[1024, 256]', 'dropout': 0.28323460909666426, 'batch_norm': False, 'lr': 0.0003409758881676372, 'weight_decay': 2.7530330807526184e-08, 'epochs': 169, 'loss': 'mae', 'optimizer': 'adamw', 'use_snp_selection': False, 'n_pcs': 2000}. Best is trial 2 with value: 0.19950429900259914.
2026-06-01 14:42:30 | INFO | Trial 36 | outer=11 | hidden=[1024, 256] epochs=222 lr=3.582e-04 wd=3.395e-08 n_pcs=2000 weight={'name': 'uniform'}
[I 2026-06-01 14:42:43,535] Trial 36 finished with value: 0.19978891811140845 and parameters: {'hidden_dims': '[1024, 256]', 'dropout': 0.20484290186112478, 'batch_norm': False, 'lr': 0.00035824719449492967, 'weight_decay': 3.395372057784527e-08, 'epochs': 222, 'loss': 'mse', 'optimizer': 'adamw', 'use_snp_selection': False, 'n_pcs': 2000}. Best is trial 36 with value: 0.19978891811140845.
2026-06-01 14:42:43 | INFO | Trial 37 | outer=11 | hidden=[1024, 256] epochs=230 lr=4.812e-04 wd=3.188e-08 n_pcs=2000 weight={'name': 'uniform'}
[I 2026-06-01 14:42:57,043] Trial 37 finished with value: 0.18417468092999106 and parameters: {'hidden_dims': '[1024, 256]', 'dropout': 0.2083778868275903, 'batch_norm': False, 'lr': 0.00048121411591962626, 'weight_decay': 3.188475064865781e-08, 'epochs': 230, 'loss': 'mse', 'optimizer': 'adamw', 'use_snp_selection': False, 'n_pcs': 2000}. Best is trial 36 with value: 0.19978891811140845.
2026-06-01 14:42:57 | INFO | Trial 38 | outer=11 | hidden=[512, 128] epochs=221 lr=3.673e-05 wd=1.021e-08 n_pcs=1500 weight={'name': 'uniform'}
[I 2026-06-01 14:43:03,125] Trial 38 finished with value: 0.17520741665798972 and parameters: {'hidden_dims': '[512, 128]', 'dropout': 0.2784305653062239, 'batch_norm': False, 'lr': 3.6727589266282134e-05, 'weight_decay': 1.0210167274559751e-08, 'epochs': 221, 'loss': 'mse', 'optimizer': 'adamw', 'use_snp_selection': False, 'n_pcs': 1500}. Best is trial 36 with value: 0.19978891811140845.
2026-06-01 14:43:03 | INFO | Trial 39 | outer=11 | hidden=[1024, 256] epochs=194 lr=2.154e-05 wd=3.530e-08 n_pcs=2500 weight={'name': 'uniform'}
[I 2026-06-01 14:43:15,984] Trial 39 finished with value: 0.1748956362332079 and parameters: {'hidden_dims': '[1024, 256]', 'dropout': 0.06515508644022443, 'batch_norm': False, 'lr': 2.1544225178305953e-05, 'weight_decay': 3.529520018116752e-08, 'epochs': 194, 'loss': 'mse', 'optimizer': 'adamw', 'use_snp_selection': False, 'n_pcs': 2500}. Best is trial 36 with value: 0.19978891811140845.
2026-06-01 14:43:15 | INFO | Trial 40 | outer=11 | hidden=[256, 64] epochs=263 lr=3.527e-04 wd=1.970e-07 n_pcs=3000 weight={'name': 'uniform'}
[I 2026-06-01 14:43:22,526] Trial 40 finished with value: 0.17671892178548818 and parameters: {'hidden_dims': '[256, 64]', 'dropout': 0.3225152565938497, 'batch_norm': False, 'lr': 0.0003526752065239618, 'weight_decay': 1.9695390450127246e-07, 'epochs': 263, 'loss': 'mse', 'optimizer': 'adamw', 'use_snp_selection': False, 'n_pcs': 3000}. Best is trial 36 with value: 0.19978891811140845.
2026-06-01 14:43:22 | INFO | Trial 41 | outer=11 | hidden=[1024, 256] epochs=161 lr=3.470e-04 wd=2.591e-08 n_pcs=2000 weight={'name': 'uniform'}
[I 2026-06-01 14:43:32,565] Trial 41 finished with value: 0.19505853098422724 and parameters: {'hidden_dims': '[1024, 256]', 'dropout': 0.18364268906016357, 'batch_norm': False, 'lr': 0.00034699200144707815, 'weight_decay': 2.5905357308873103e-08, 'epochs': 161, 'loss': 'mse', 'optimizer': 'adamw', 'use_snp_selection': False, 'n_pcs': 2000}. Best is trial 36 with value: 0.19978891811140845.
2026-06-01 14:43:32 | INFO | Trial 42 | outer=11 | hidden=[1024, 256] epochs=174 lr=2.141e-04 wd=5.145e-08 n_pcs=3000 weight={'name': 'uniform'}
[I 2026-06-01 14:43:45,859] Trial 42 finished with value: 0.18361161654839214 and parameters: {'hidden_dims': '[1024, 256]', 'dropout': 0.25915212618130834, 'batch_norm': False, 'lr': 0.0002140805358724216, 'weight_decay': 5.144932304488197e-08, 'epochs': 174, 'loss': 'mse', 'optimizer': 'adamw', 'use_snp_selection': False, 'n_pcs': 3000}. Best is trial 36 with value: 0.19978891811140845.
2026-06-01 14:43:45 | INFO | Trial 43 | outer=11 | hidden=[1024, 256] epochs=215 lr=6.832e-05 wd=2.557e-07 n_pcs=2500 weight={'name': 'uniform'}
[I 2026-06-01 14:43:59,896] Trial 43 finished with value: 0.18866105638417796 and parameters: {'hidden_dims': '[1024, 256]', 'dropout': 0.13094405304488596, 'batch_norm': False, 'lr': 6.832175964235307e-05, 'weight_decay': 2.5572969297330234e-07, 'epochs': 215, 'loss': 'mse', 'optimizer': 'adamw', 'use_snp_selection': False, 'n_pcs': 2500}. Best is trial 36 with value: 0.19978891811140845.
2026-06-01 14:43:59 | INFO | Trial 44 | outer=11 | hidden=[1024, 256] epochs=147 lr=4.057e-04 wd=1.899e-08 n_pcs=3000 weight={'name': 'uniform'}
[I 2026-06-01 14:44:11,437] Trial 44 finished with value: 0.18231371082446649 and parameters: {'hidden_dims': '[1024, 256]', 'dropout': 0.298294578216821, 'batch_norm': False, 'lr': 0.00040568130125552895, 'weight_decay': 1.8991190719730412e-08, 'epochs': 147, 'loss': 'mae', 'optimizer': 'adamw', 'use_snp_selection': False, 'n_pcs': 3000}. Best is trial 36 with value: 0.19978891811140845.
2026-06-01 14:44:11 | INFO | Trial 45 | outer=11 | hidden=[128, 64] epochs=236 lr=4.978e-05 wd=6.807e-08 n_pcs=3500 weight={'name': 'uniform'}
[I 2026-06-01 14:44:16,546] Trial 45 finished with value: 0.1707173917045529 and parameters: {'hidden_dims': '[128, 64]', 'dropout': 0.1965652293087508, 'batch_norm': False, 'lr': 4.977840321205958e-05, 'weight_decay': 6.807319723737833e-08, 'epochs': 236, 'loss': 'mae', 'optimizer': 'adamw', 'use_snp_selection': False, 'n_pcs': 3500}. Best is trial 36 with value: 0.19978891811140845.
2026-06-01 14:44:16 | INFO | Trial 46 | outer=11 | hidden=[1024, 256] epochs=171 lr=3.354e-04 wd=1.122e-07 n_pcs=2000 weight={'name': 'uniform'}
