[I 2026-06-01 16:02:43,047] Trial 104 finished with value: 0.1741364200103928 and parameters: {'hidden_dims': '[256, 64]', 'dropout': 0.5192063234725584, 'batch_norm': False, 'lr': 5.951499662344957e-05, 'weight_decay': 2.504482094362359e-05, 'epochs': 227, 'loss': 'mae', 'optimizer': 'adam', 'use_snp_selection': False, 'n_pcs': 1500}. Best is trial 69 with value: 0.202766379161958.
2026-06-01 16:02:43 | INFO | Trial 105 | outer=15 | hidden=[512, 128] epochs=283 lr=1.261e-05 wd=3.433e-05 n_pcs=1000 weight={'name': 'uniform'}
[I 2026-06-01 16:02:48,679] Trial 105 finished with value: 0.15495554901495467 and parameters: {'hidden_dims': '[512, 128]', 'dropout': 0.4423818793867722, 'batch_norm': False, 'lr': 1.2611730938227176e-05, 'weight_decay': 3.432733465818956e-05, 'epochs': 283, 'loss': 'mae', 'optimizer': 'adam', 'use_snp_selection': False, 'n_pcs': 1000}. Best is trial 69 with value: 0.202766379161958.
2026-06-01 16:02:48 | INFO | Trial 106 | outer=15 | hidden=[1024, 256] epochs=238 lr=7.522e-05 wd=9.868e-05 n_pcs=1500 weight={'name': 'uniform'}
[I 2026-06-01 16:02:59,082] Trial 106 finished with value: 0.19738615845535867 and parameters: {'hidden_dims': '[1024, 256]', 'dropout': 0.47803403352628293, 'batch_norm': False, 'lr': 7.521637613016303e-05, 'weight_decay': 9.867894512930321e-05, 'epochs': 238, 'loss': 'mae', 'optimizer': 'adam', 'use_snp_selection': False, 'n_pcs': 1500}. Best is trial 69 with value: 0.202766379161958.
2026-06-01 16:02:59 | INFO | Trial 107 | outer=15 | hidden=[1024, 256] epochs=238 lr=7.998e-05 wd=4.129e-06 n_pcs=2000 weight={'name': 'uniform'}
[I 2026-06-01 16:03:11,876] Trial 107 finished with value: 0.19309783960019677 and parameters: {'hidden_dims': '[1024, 256]', 'dropout': 0.09171128170913252, 'batch_norm': False, 'lr': 7.998408986931888e-05, 'weight_decay': 4.128834287270858e-06, 'epochs': 238, 'loss': 'mae', 'optimizer': 'adam', 'use_snp_selection': False, 'n_pcs': 2000}. Best is trial 69 with value: 0.202766379161958.
2026-06-01 16:03:11 | INFO | Trial 108 | outer=15 | hidden=[1024, 256] epochs=248 lr=5.320e-05 wd=8.501e-05 n_pcs=2000 weight={'name': 'uniform'}
[I 2026-06-01 16:03:19,941] Trial 108 pruned. 
2026-06-01 16:03:19 | INFO | Trial 109 | outer=15 | hidden=[1024, 256] epochs=278 lr=6.946e-05 wd=1.469e-07 n_pcs=1500 weight={'name': 'uniform'}
[I 2026-06-01 16:03:31,783] Trial 109 finished with value: 0.19120524491544846 and parameters: {'hidden_dims': '[1024, 256]', 'dropout': 0.4235812250736845, 'batch_norm': False, 'lr': 6.945761273811355e-05, 'weight_decay': 1.4693445081658638e-07, 'epochs': 278, 'loss': 'mae', 'optimizer': 'adam', 'use_snp_selection': False, 'n_pcs': 1500}. Best is trial 69 with value: 0.202766379161958.
2026-06-01 16:03:31 | INFO | Trial 110 | outer=15 | hidden=[1024, 256] epochs=269 lr=2.944e-05 wd=1.749e-06 n_pcs=2500 weight={'name': 'uniform'}
[I 2026-06-01 16:03:47,358] Trial 110 finished with value: 0.18904255420660418 and parameters: {'hidden_dims': '[1024, 256]', 'dropout': 0.5705755832519932, 'batch_norm': False, 'lr': 2.9443517801002124e-05, 'weight_decay': 1.7488833428460197e-06, 'epochs': 269, 'loss': 'mse', 'optimizer': 'adam', 'use_snp_selection': False, 'n_pcs': 2500}. Best is trial 69 with value: 0.202766379161958.
2026-06-01 16:03:47 | INFO | Trial 111 | outer=15 | hidden=[256, 64] epochs=255 lr=5.630e-05 wd=1.004e-04 n_pcs=1500 weight={'name': 'uniform'}
[I 2026-06-01 16:03:51,895] Trial 111 finished with value: 0.1687249793671942 and parameters: {'hidden_dims': '[256, 64]', 'dropout': 0.4753709062437156, 'batch_norm': False, 'lr': 5.6296670975683676e-05, 'weight_decay': 0.00010044211925275364, 'epochs': 255, 'loss': 'mae', 'optimizer': 'adam', 'use_snp_selection': False, 'n_pcs': 1500}. Best is trial 69 with value: 0.202766379161958.
2026-06-01 16:03:51 | INFO | Trial 112 | outer=15 | hidden=[1024, 256] epochs=214 lr=6.093e-05 wd=5.053e-05 n_pcs=1000 weight={'name': 'uniform'}
[I 2026-06-01 16:03:59,722] Trial 112 finished with value: 0.18972473969596487 and parameters: {'hidden_dims': '[1024, 256]', 'dropout': 0.45450659979484814, 'batch_norm': False, 'lr': 6.0925260289196064e-05, 'weight_decay': 5.053187408919452e-05, 'epochs': 214, 'loss': 'mae', 'optimizer': 'adam', 'use_snp_selection': False, 'n_pcs': 1000}. Best is trial 69 with value: 0.202766379161958.
2026-06-01 16:03:59 | INFO | Trial 113 | outer=15 | hidden=[256, 64] epochs=262 lr=4.788e-05 wd=1.410e-04 n_pcs=1500 weight={'name': 'uniform'}
[I 2026-06-01 16:04:02,498] Trial 113 pruned. 
2026-06-01 16:04:02 | INFO | Trial 114 | outer=15 | hidden=[512, 64] epochs=248 lr=7.453e-05 wd=5.698e-05 n_pcs=1000 weight={'name': 'uniform'}
[I 2026-06-01 16:04:07,393] Trial 114 finished with value: 0.17295983262273365 and parameters: {'hidden_dims': '[512, 64]', 'dropout': 0.362211459186377, 'batch_norm': False, 'lr': 7.453090168022284e-05, 'weight_decay': 5.698394753332116e-05, 'epochs': 248, 'loss': 'mae', 'optimizer': 'adam', 'use_snp_selection': False, 'n_pcs': 1000}. Best is trial 69 with value: 0.202766379161958.
2026-06-01 16:04:07 | INFO | Trial 115 | outer=15 | hidden=[128, 64] epochs=258 lr=6.272e-05 wd=4.007e-05 n_pcs=1000 weight={'name': 'uniform'}
[I 2026-06-01 16:04:10,104] Trial 115 pruned. 
2026-06-01 16:04:10 | INFO | Trial 116 | outer=15 | hidden=[256, 128] epochs=274 lr=3.706e-05 wd=1.848e-04 n_pcs=2000 weight={'name': 'uniform'}
[I 2026-06-01 16:04:13,247] Trial 116 pruned. 
2026-06-01 16:04:13 | INFO | Trial 117 | outer=15 | hidden=[1024, 256] epochs=145 lr=9.306e-05 wd=3.795e-04 n_pcs=1500 weight={'name': 'uniform'}
[I 2026-06-01 16:04:17,504] Trial 117 pruned. 
2026-06-01 16:04:17 | INFO | Trial 118 | outer=15 | hidden=[256, 64] epochs=266 lr=8.188e-05 wd=6.454e-08 n_pcs=1000 weight={'name': 'uniform'}
[I 2026-06-01 16:04:22,051] Trial 118 finished with value: 0.18919625563213424 and parameters: {'hidden_dims': '[256, 64]', 'dropout': 0.41170335410726794, 'batch_norm': False, 'lr': 8.187874246446699e-05, 'weight_decay': 6.45373920605812e-08, 'epochs': 266, 'loss': 'mae', 'optimizer': 'adamw', 'use_snp_selection': False, 'n_pcs': 1000}. Best is trial 69 with value: 0.202766379161958.
2026-06-01 16:04:22 | INFO | Trial 119 | outer=15 | hidden=[512, 256] epochs=289 lr=3.356e-05 wd=3.052e-05 n_pcs=1500 weight={'name': 'uniform'}
[I 2026-06-01 16:04:29,556] Trial 119 finished with value: 0.16950395870689322 and parameters: {'hidden_dims': '[512, 256]', 'dropout': 0.46744114478436316, 'batch_norm': False, 'lr': 3.355937152453875e-05, 'weight_decay': 3.0524845238276195e-05, 'epochs': 289, 'loss': 'mae', 'optimizer': 'adam', 'use_snp_selection': False, 'n_pcs': 1500}. Best is trial 69 with value: 0.202766379161958.
2026-06-01 16:04:29 | INFO | Trial 120 | outer=15 | hidden=[1024, 256] epochs=243 lr=4.148e-05 wd=7.289e-05 n_pcs=500 weight={'name': 'uniform'}
[I 2026-06-01 16:04:36,095] Trial 120 finished with value: 0.15665238162631695 and parameters: {'hidden_dims': '[1024, 256]', 'dropout': 0.32630393355766474, 'batch_norm': False, 'lr': 4.1477426287275705e-05, 'weight_decay': 7.289236172200938e-05, 'epochs': 243, 'loss': 'mae', 'optimizer': 'adamw', 'use_snp_selection': False, 'n_pcs': 500}. Best is trial 69 with value: 0.202766379161958.
2026-06-01 16:04:36 | INFO | Trial 121 | outer=15 | hidden=[1024, 256] epochs=86 lr=2.558e-04 wd=8.716e-04 n_pcs=1000 weight={'name': 'uniform'}
[I 2026-06-01 16:04:40,227] Trial 121 finished with value: 0.19048192371570333 and parameters: {'hidden_dims': '[1024, 256]', 'dropout': 0.15038236124938792, 'batch_norm': False, 'lr': 0.00025578117320635953, 'weight_decay': 0.0008716365010953525, 'epochs': 86, 'loss': 'mae', 'optimizer': 'adamw', 'use_snp_selection': False, 'n_pcs': 1000}. Best is trial 69 with value: 0.202766379161958.
2026-06-01 16:04:40 | INFO | Trial 122 | outer=15 | hidden=[1024, 256] epochs=67 lr=5.206e-05 wd=3.333e-04 n_pcs=1000 weight={'name': 'uniform'}
[I 2026-06-01 16:04:42,407] Trial 122 pruned. 
2026-06-01 16:04:42 | INFO | Trial 123 | outer=15 | hidden=[1024, 256] epochs=102 lr=1.706e-04 wd=6.176e-04 n_pcs=500 weight={'name': 'uniform'}
[I 2026-06-01 16:04:46,065] Trial 123 finished with value: 0.1801455880015867 and parameters: {'hidden_dims': '[1024, 256]', 'dropout': 0.3681367444086701, 'batch_norm': False, 'lr': 0.0001705593215950927, 'weight_decay': 0.0006175948905322546, 'epochs': 102, 'loss': 'mae', 'optimizer': 'adamw', 'use_snp_selection': False, 'n_pcs': 500}. Best is trial 69 with value: 0.202766379161958.
2026-06-01 16:04:46 | INFO | Trial 124 | outer=15 | hidden=[1024, 256] epochs=80 lr=7.260e-05 wd=4.326e-04 n_pcs=1000 weight={'name': 'uniform'}
[I 2026-06-01 16:04:50,025] Trial 124 finished with value: 0.16863588855578288 and parameters: {'hidden_dims': '[1024, 256]', 'dropout': 0.342504103826195, 'batch_norm': False, 'lr': 7.260479871709028e-05, 'weight_decay': 0.0004326350333229862, 'epochs': 80, 'loss': 'mae', 'optimizer': 'adamw', 'use_snp_selection': False, 'n_pcs': 1000}. Best is trial 69 with value: 0.202766379161958.
2026-06-01 16:04:50 | INFO | Trial 125 | outer=15 | hidden=[256, 64] epochs=234 lr=1.912e-04 wd=1.150e-04 n_pcs=1500 weight={'name': 'uniform'}
[I 2026-06-01 16:04:52,728] Trial 125 pruned. 
2026-06-01 16:04:52 | INFO | Trial 126 | outer=15 | hidden=[512, 128] epochs=91 lr=1.018e-04 wd=1.692e-05 n_pcs=1000 weight={'name': 'uniform'}
[I 2026-06-01 16:04:54,482] Trial 126 pruned. 
2026-06-01 16:04:54 | INFO | Trial 127 | outer=15 | hidden=[512, 64] epochs=254 lr=5.770e-05 wd=9.892e-06 n_pcs=2000 weight={'name': 'uniform'}
[I 2026-06-01 16:05:01,436] Trial 127 finished with value: 0.19946962883369695 and parameters: {'hidden_dims': '[512, 64]', 'dropout': 0.38464745402556155, 'batch_norm': False, 'lr': 5.769672048332751e-05, 'weight_decay': 9.89207143843576e-06, 'epochs': 254, 'loss': 'mae', 'optimizer': 'adamw', 'use_snp_selection': False, 'n_pcs': 2000}. Best is trial 69 with value: 0.202766379161958.
2026-06-01 16:05:01 | INFO | Trial 128 | outer=15 | hidden=[512, 64] epochs=254 lr=4.504e-05 wd=7.701e-06 n_pcs=2000 weight={'name': 'uniform'}
[I 2026-06-01 16:05:08,396] Trial 128 finished with value: 0.18330732098851124 and parameters: {'hidden_dims': '[512, 64]', 'dropout': 0.38632306855691007, 'batch_norm': False, 'lr': 4.503746279963321e-05, 'weight_decay': 7.700518403095176e-06, 'epochs': 254, 'loss': 'mae', 'optimizer': 'adamw', 'use_snp_selection': False, 'n_pcs': 2000}. Best is trial 69 with value: 0.202766379161958.
2026-06-01 16:05:08 | INFO | Trial 129 | outer=15 | hidden=[512, 64] epochs=251 lr=6.316e-05 wd=2.142e-05 n_pcs=2500 weight={'name': 'uniform'}
[I 2026-06-01 16:05:16,316] Trial 129 finished with value: 0.1922003548851415 and parameters: {'hidden_dims': '[512, 64]', 'dropout': 0.4008934475776562, 'batch_norm': False, 'lr': 6.316230038677748e-05, 'weight_decay': 2.1415945187990258e-05, 'epochs': 251, 'loss': 'mae', 'optimizer': 'adam', 'use_snp_selection': False, 'n_pcs': 2500}. Best is trial 69 with value: 0.202766379161958.
2026-06-01 16:05:16 | INFO | Trial 130 | outer=15 | hidden=[512, 64] epochs=265 lr=5.741e-05 wd=1.222e-05 n_pcs=2000 weight={'name': 'uniform'}
[I 2026-06-01 16:05:20,704] Trial 130 pruned. 
2026-06-01 16:05:20 | INFO | Trial 131 | outer=15 | hidden=[512, 64] epochs=272 lr=2.869e-04 wd=4.992e-04 n_pcs=2000 weight={'name': 'uniform'}
[I 2026-06-01 16:05:28,031] Trial 131 finished with value: 0.18468266748993495 and parameters: {'hidden_dims': '[512, 64]', 'dropout': 0.3331083005201979, 'batch_norm': False, 'lr': 0.0002868953532493291, 'weight_decay': 0.0004991656756969629, 'epochs': 272, 'loss': 'mae', 'optimizer': 'adamw', 'use_snp_selection': False, 'n_pcs': 2000}. Best is trial 69 with value: 0.202766379161958.
2026-06-01 16:05:28 | INFO | Trial 132 | outer=15 | hidden=[128, 64] epochs=245 lr=6.872e-05 wd=2.159e-04 n_pcs=1500 weight={'name': 'uniform'}
[I 2026-06-01 16:05:32,441] Trial 132 finished with value: 0.18422462775670123 and parameters: {'hidden_dims': '[128, 64]', 'dropout': 0.2776848218921622, 'batch_norm': False, 'lr': 6.872403812227141e-05, 'weight_decay': 0.00021585757352104504, 'epochs': 245, 'loss': 'mae', 'optimizer': 'adamw', 'use_snp_selection': False, 'n_pcs': 1500}. Best is trial 69 with value: 0.202766379161958.
2026-06-01 16:05:32 | INFO | Trial 133 | outer=15 | hidden=[1024, 256] epochs=228 lr=2.137e-04 wd=9.627e-06 n_pcs=1000 weight={'name': 'uniform'}
[I 2026-06-01 16:05:40,659] Trial 133 finished with value: 0.18776596132467138 and parameters: {'hidden_dims': '[1024, 256]', 'dropout': 0.35534192817898674, 'batch_norm': False, 'lr': 0.00021370042392154624, 'weight_decay': 9.62683477209357e-06, 'epochs': 228, 'loss': 'mae', 'optimizer': 'adamw', 'use_snp_selection': False, 'n_pcs': 1000}. Best is trial 69 with value: 0.202766379161958.
2026-06-01 16:05:40 | INFO | Trial 134 | outer=15 | hidden=[256, 64] epochs=259 lr=4.999e-05 wd=7.188e-04 n_pcs=2000 weight={'name': 'uniform'}
[I 2026-06-01 16:05:43,620] Trial 134 pruned. 
2026-06-01 16:05:43 | INFO | Trial 135 | outer=15 | hidden=[512, 64] epochs=165 lr=7.630e-05 wd=1.604e-05 n_pcs=1500 weight={'name': 'uniform'}
[I 2026-06-01 16:05:48,126] Trial 135 finished with value: 0.1860444879158262 and parameters: {'hidden_dims': '[512, 64]', 'dropout': 0.40956166254928866, 'batch_norm': False, 'lr': 7.629778902908094e-05, 'weight_decay': 1.6036725639576744e-05, 'epochs': 165, 'loss': 'mae', 'optimizer': 'adamw', 'use_snp_selection': False, 'n_pcs': 1500}. Best is trial 69 with value: 0.202766379161958.
2026-06-01 16:05:48 | INFO | Trial 136 | outer=15 | hidden=[1024, 256] epochs=129 lr=8.428e-05 wd=4.232e-05 n_pcs=1000 weight={'name': 'uniform'}
[I 2026-06-01 16:05:53,474] Trial 136 finished with value: 0.17588940970454586 and parameters: {'hidden_dims': '[1024, 256]', 'dropout': 0.3928137670339725, 'batch_norm': False, 'lr': 8.428053328719357e-05, 'weight_decay': 4.232079723441438e-05, 'epochs': 129, 'loss': 'mae', 'optimizer': 'adamw', 'use_snp_selection': False, 'n_pcs': 1000}. Best is trial 69 with value: 0.202766379161958.
2026-06-01 16:05:53 | INFO | Trial 137 | outer=15 | hidden=[256, 64] epochs=280 lr=5.849e-05 wd=2.773e-05 n_pcs=1500 weight={'name': 'uniform'}
[I 2026-06-01 16:05:58,274] Trial 137 finished with value: 0.18123967088214812 and parameters: {'hidden_dims': '[256, 64]', 'dropout': 0.3775522028312857, 'batch_norm': False, 'lr': 5.848780011578779e-05, 'weight_decay': 2.7731914798423288e-05, 'epochs': 280, 'loss': 'mae', 'optimizer': 'adam', 'use_snp_selection': False, 'n_pcs': 1500}. Best is trial 69 with value: 0.202766379161958.
2026-06-01 16:05:58 | INFO | Trial 138 | outer=15 | hidden=[512, 128] epochs=77 lr=5.422e-05 wd=2.959e-04 n_pcs=3000 weight={'name': 'uniform'}
[I 2026-06-01 16:06:00,826] Trial 138 pruned. 
2026-06-01 16:06:00 | INFO | Trial 139 | outer=15 | hidden=[256, 128] epochs=240 lr=4.810e-05 wd=1.658e-04 n_pcs=1000 weight={'name': 'uniform'}
[I 2026-06-01 16:06:05,103] Trial 139 finished with value: 0.18835574037791597 and parameters: {'hidden_dims': '[256, 128]', 'dropout': 0.4778147775382006, 'batch_norm': False, 'lr': 4.8100808155678375e-05, 'weight_decay': 0.00016579224421845752, 'epochs': 240, 'loss': 'mae', 'optimizer': 'adam', 'use_snp_selection': False, 'n_pcs': 1000}. Best is trial 69 with value: 0.202766379161958.
2026-06-01 16:06:05 | INFO | Trial 140 | outer=15 | hidden=[1024, 256] epochs=57 lr=6.563e-05 wd=9.761e-05 n_pcs=1500 weight={'name': 'uniform'}
[I 2026-06-01 16:06:08,898] Trial 140 finished with value: 0.18060669182060243 and parameters: {'hidden_dims': '[1024, 256]', 'dropout': 0.3454137839497687, 'batch_norm': False, 'lr': 6.563421793783175e-05, 'weight_decay': 9.760650571638735e-05, 'epochs': 57, 'loss': 'mae', 'optimizer': 'adam', 'use_snp_selection': False, 'n_pcs': 1500}. Best is trial 69 with value: 0.202766379161958.
2026-06-01 16:06:08 | INFO | Trial 141 | outer=15 | hidden=[1024, 256] epochs=235 lr=7.704e-05 wd=5.738e-06 n_pcs=2000 weight={'name': 'uniform'}
[I 2026-06-01 16:06:21,521] Trial 141 finished with value: 0.19809926301416958 and parameters: {'hidden_dims': '[1024, 256]', 'dropout': 0.10650187669822905, 'batch_norm': False, 'lr': 7.704007529527085e-05, 'weight_decay': 5.738000489470826e-06, 'epochs': 235, 'loss': 'mae', 'optimizer': 'adam', 'use_snp_selection': False, 'n_pcs': 2000}. Best is trial 69 with value: 0.202766379161958.
2026-06-01 16:06:21 | INFO | Trial 142 | outer=15 | hidden=[1024, 256] epochs=252 lr=9.018e-05 wd=4.974e-06 n_pcs=2000 weight={'name': 'uniform'}
[I 2026-06-01 16:06:34,814] Trial 142 finished with value: 0.1851346603411416 and parameters: {'hidden_dims': '[1024, 256]', 'dropout': 0.45804513447767475, 'batch_norm': False, 'lr': 9.017697715031281e-05, 'weight_decay': 4.973558851030671e-06, 'epochs': 252, 'loss': 'mae', 'optimizer': 'adam', 'use_snp_selection': False, 'n_pcs': 2000}. Best is trial 69 with value: 0.202766379161958.
2026-06-01 16:06:34 | INFO | Trial 143 | outer=15 | hidden=[1024, 256] epochs=264 lr=1.110e-04 wd=3.534e-06 n_pcs=2500 weight={'name': 'uniform'}
[I 2026-06-01 16:06:50,160] Trial 143 finished with value: 0.19764438286931277 and parameters: {'hidden_dims': '[1024, 256]', 'dropout': 0.3638207872918995, 'batch_norm': False, 'lr': 0.00011098341031253931, 'weight_decay': 3.5341591657232865e-06, 'epochs': 264, 'loss': 'mae', 'optimizer': 'adam', 'use_snp_selection': False, 'n_pcs': 2500}. Best is trial 69 with value: 0.202766379161958.
2026-06-01 16:06:50 | INFO | Trial 144 | outer=15 | hidden=[1024, 256] epochs=270 lr=1.119e-04 wd=2.040e-06 n_pcs=2500 weight={'name': 'uniform'}
[I 2026-06-01 16:07:05,835] Trial 144 finished with value: 0.178256819136032 and parameters: {'hidden_dims': '[1024, 256]', 'dropout': 0.004415698689700875, 'batch_norm': False, 'lr': 0.00011193985105492944, 'weight_decay': 2.0395418585090386e-06, 'epochs': 270, 'loss': 'mae', 'optimizer': 'adam', 'use_snp_selection': False, 'n_pcs': 2500}. Best is trial 69 with value: 0.202766379161958.
2026-06-01 16:07:05 | INFO | Trial 145 | outer=15 | hidden=[1024, 256] epochs=263 lr=7.153e-05 wd=4.152e-06 n_pcs=3500 weight={'name': 'uniform'}
[I 2026-06-01 16:07:25,839] Trial 145 finished with value: 0.18867414919051376 and parameters: {'hidden_dims': '[1024, 256]', 'dropout': 0.37136665448924666, 'batch_norm': False, 'lr': 7.153324687267559e-05, 'weight_decay': 4.151992566734072e-06, 'epochs': 263, 'loss': 'mae', 'optimizer': 'adam', 'use_snp_selection': False, 'n_pcs': 3500}. Best is trial 69 with value: 0.202766379161958.
2026-06-01 16:07:25 | INFO | Trial 146 | outer=15 | hidden=[128, 64] epochs=236 lr=9.756e-05 wd=6.081e-06 n_pcs=2500 weight={'name': 'uniform'}
[I 2026-06-01 16:07:30,348] Trial 146 finished with value: 0.16104417949670083 and parameters: {'hidden_dims': '[128, 64]', 'dropout': 0.13152393524261613, 'batch_norm': False, 'lr': 9.755958998284657e-05, 'weight_decay': 6.081215751781772e-06, 'epochs': 236, 'loss': 'mae', 'optimizer': 'adam', 'use_snp_selection': False, 'n_pcs': 2500}. Best is trial 69 with value: 0.202766379161958.
2026-06-01 16:07:30 | INFO | Trial 147 | outer=15 | hidden=[256, 64] epochs=257 lr=8.182e-05 wd=2.634e-06 n_pcs=2000 weight={'name': 'uniform'}
[I 2026-06-01 16:07:33,310] Trial 147 pruned. 
2026-06-01 16:07:33 | INFO | Trial 148 | outer=15 | hidden=[1024, 256] epochs=276 lr=6.045e-05 wd=8.202e-06 n_pcs=2000 weight={'name': 'uniform'}
[I 2026-06-01 16:07:47,835] Trial 148 finished with value: 0.1698787540873592 and parameters: {'hidden_dims': '[1024, 256]', 'dropout': 0.11167833125404647, 'batch_norm': False, 'lr': 6.044801749759506e-05, 'weight_decay': 8.201711988862597e-06, 'epochs': 276, 'loss': 'mae', 'optimizer': 'adam', 'use_snp_selection': False, 'n_pcs': 2000}. Best is trial 69 with value: 0.202766379161958.
2026-06-01 16:07:47 | INFO | Trial 149 | outer=15 | hidden=[512, 256] epochs=249 lr=4.308e-05 wd=1.087e-05 n_pcs=2000 weight={'name': 'uniform'}
[I 2026-06-01 16:07:55,483] Trial 149 finished with value: 0.19331730127001276 and parameters: {'hidden_dims': '[512, 256]', 'dropout': 0.5155360133664422, 'batch_norm': False, 'lr': 4.3080610518773294e-05, 'weight_decay': 1.0867705752365826e-05, 'epochs': 249, 'loss': 'mae', 'optimizer': 'adam', 'use_snp_selection': False, 'n_pcs': 2000}. Best is trial 69 with value: 0.202766379161958.
2026-06-01 16:07:55 | INFO | OUTER 15 best (inner mean r=0.2028): model={'hidden_dims': [256, 64], 'dropout': 0.408024943557273, 'batch_norm': False, 'lr': 7.017803180010296e-05, 'weight_decay': 0.0005703703177680537, 'epochs': 266, 'loss': 'mae', 'optimizer': 'adam', 'use_snp_selection': False, 'n_pcs': 1000} weighting={'name': 'uniform'}
2026-06-01 16:07:55 | INFO | OUTER 15 TEST r = 0.1267
2026-06-01 16:07:56 | INFO | OUTER 15 incremental summary saved to outputs/final_results/e8_pc_mlp_uniform/thr_wing/e8_pc_mlp_uniform_thr_wing_results.json
2026-06-01 16:07:56 | INFO | DONE. Mean OUTER r = 0.1724 +- 0.0759
2026-06-01 16:07:56 | INFO | Saved summary to: outputs/final_results/e8_pc_mlp_uniform/thr_wing/e8_pc_mlp_uniform_thr_wing_results.json
