[I 2026-06-01 11:13:52,187] Trial 81 finished with value: 0.2246419712648399 and parameters: {'hidden_dims': '[512, 64]', 'dropout': 0.05443669860855434, 'batch_norm': False, 'lr': 0.0004980644634991952, 'weight_decay': 0.00015820635217558913, 'epochs': 240, 'loss': 'mae', 'optimizer': 'adam', 'use_snp_selection': False, 'n_pcs': 5000}. Best is trial 71 with value: 0.2400360030720047.
2026-06-01 11:13:52 | INFO | Trial 82 | outer=1 | hidden=[512, 64] epochs=259 lr=4.472e-04 wd=7.817e-05 n_pcs=5000 weight={'name': 'uniform'}
[I 2026-06-01 11:14:06,950] Trial 82 finished with value: 0.23756085311036243 and parameters: {'hidden_dims': '[512, 64]', 'dropout': 0.012997675989676882, 'batch_norm': False, 'lr': 0.00044719995068616576, 'weight_decay': 7.817409626097143e-05, 'epochs': 259, 'loss': 'mae', 'optimizer': 'adam', 'use_snp_selection': False, 'n_pcs': 5000}. Best is trial 71 with value: 0.2400360030720047.
2026-06-01 11:14:06 | INFO | Trial 83 | outer=1 | hidden=[512, 64] epochs=258 lr=4.469e-04 wd=2.264e-04 n_pcs=5000 weight={'name': 'uniform'}
[I 2026-06-01 11:14:21,656] Trial 83 finished with value: 0.22461701187713462 and parameters: {'hidden_dims': '[512, 64]', 'dropout': 0.024059102755314966, 'batch_norm': False, 'lr': 0.000446868930569871, 'weight_decay': 0.0002264240169806422, 'epochs': 258, 'loss': 'mae', 'optimizer': 'adam', 'use_snp_selection': False, 'n_pcs': 5000}. Best is trial 71 with value: 0.2400360030720047.
2026-06-01 11:14:21 | INFO | Trial 84 | outer=1 | hidden=[512, 64] epochs=273 lr=3.935e-04 wd=7.585e-05 n_pcs=5000 weight={'name': 'uniform'}
[I 2026-06-01 11:14:37,090] Trial 84 finished with value: 0.22326477621671675 and parameters: {'hidden_dims': '[512, 64]', 'dropout': 0.01782451880307065, 'batch_norm': False, 'lr': 0.0003934633408838591, 'weight_decay': 7.584679863842112e-05, 'epochs': 273, 'loss': 'mae', 'optimizer': 'adam', 'use_snp_selection': False, 'n_pcs': 5000}. Best is trial 71 with value: 0.2400360030720047.
2026-06-01 11:14:37 | INFO | Trial 85 | outer=1 | hidden=[512, 64] epochs=244 lr=3.331e-04 wd=4.889e-05 n_pcs=5000 weight={'name': 'uniform'}
[I 2026-06-01 11:14:51,134] Trial 85 finished with value: 0.23251275254430528 and parameters: {'hidden_dims': '[512, 64]', 'dropout': 0.06838576387721997, 'batch_norm': False, 'lr': 0.0003330911046881873, 'weight_decay': 4.88872553667249e-05, 'epochs': 244, 'loss': 'mae', 'optimizer': 'adam', 'use_snp_selection': False, 'n_pcs': 5000}. Best is trial 71 with value: 0.2400360030720047.
2026-06-01 11:14:51 | INFO | Trial 86 | outer=1 | hidden=[512, 64] epochs=220 lr=3.667e-04 wd=5.635e-05 n_pcs=5000 weight={'name': 'uniform'}
[I 2026-06-01 11:15:04,054] Trial 86 finished with value: 0.20257677827674025 and parameters: {'hidden_dims': '[512, 64]', 'dropout': 0.03669388223547487, 'batch_norm': False, 'lr': 0.0003667386159383851, 'weight_decay': 5.634767727440129e-05, 'epochs': 220, 'loss': 'mae', 'optimizer': 'adam', 'use_snp_selection': False, 'n_pcs': 5000}. Best is trial 71 with value: 0.2400360030720047.
2026-06-01 11:15:04 | INFO | Trial 87 | outer=1 | hidden=[512, 64] epochs=298 lr=3.270e-04 wd=1.126e-04 n_pcs=5000 weight={'name': 'uniform'}
[I 2026-06-01 11:15:20,672] Trial 87 finished with value: 0.21810990780954476 and parameters: {'hidden_dims': '[512, 64]', 'dropout': 0.08932359703622669, 'batch_norm': False, 'lr': 0.00032696032840201977, 'weight_decay': 0.00011261265868482352, 'epochs': 298, 'loss': 'mae', 'optimizer': 'adam', 'use_snp_selection': False, 'n_pcs': 5000}. Best is trial 71 with value: 0.2400360030720047.
2026-06-01 11:15:20 | INFO | Trial 88 | outer=1 | hidden=[512, 64] epochs=244 lr=4.485e-04 wd=9.838e-04 n_pcs=5000 weight={'name': 'uniform'}
[I 2026-06-01 11:15:34,728] Trial 88 finished with value: 0.24047213959271357 and parameters: {'hidden_dims': '[512, 64]', 'dropout': 0.01151205827353316, 'batch_norm': False, 'lr': 0.0004485249324942159, 'weight_decay': 0.0009838391336689381, 'epochs': 244, 'loss': 'mae', 'optimizer': 'adam', 'use_snp_selection': False, 'n_pcs': 5000}. Best is trial 88 with value: 0.24047213959271357.
2026-06-01 11:15:34 | INFO | Trial 89 | outer=1 | hidden=[512, 64] epochs=211 lr=4.631e-04 wd=4.941e-08 n_pcs=5000 weight={'name': 'uniform'}
[I 2026-06-01 11:15:47,204] Trial 89 finished with value: 0.224462492805216 and parameters: {'hidden_dims': '[512, 64]', 'dropout': 0.011576139851479074, 'batch_norm': False, 'lr': 0.000463052762328894, 'weight_decay': 4.940758521280685e-08, 'epochs': 211, 'loss': 'mae', 'optimizer': 'adam', 'use_snp_selection': False, 'n_pcs': 5000}. Best is trial 88 with value: 0.24047213959271357.
2026-06-01 11:15:47 | INFO | Trial 90 | outer=1 | hidden=[128, 64] epochs=243 lr=4.113e-04 wd=9.349e-04 n_pcs=5000 weight={'name': 'uniform'}
[I 2026-06-01 11:15:52,981] Trial 90 finished with value: 0.22694008817984326 and parameters: {'hidden_dims': '[128, 64]', 'dropout': 0.04245612842604884, 'batch_norm': False, 'lr': 0.00041132006773974563, 'weight_decay': 0.0009349096893992594, 'epochs': 243, 'loss': 'mae', 'optimizer': 'adam', 'use_snp_selection': False, 'n_pcs': 5000}. Best is trial 88 with value: 0.24047213959271357.
2026-06-01 11:15:52 | INFO | Trial 91 | outer=1 | hidden=[512, 64] epochs=231 lr=3.748e-04 wd=4.737e-04 n_pcs=5000 weight={'name': 'uniform'}
[I 2026-06-01 11:16:06,410] Trial 91 finished with value: 0.22261237240697201 and parameters: {'hidden_dims': '[512, 64]', 'dropout': 0.05468117039901575, 'batch_norm': False, 'lr': 0.00037483839850835983, 'weight_decay': 0.00047366897025801115, 'epochs': 231, 'loss': 'mae', 'optimizer': 'adam', 'use_snp_selection': False, 'n_pcs': 5000}. Best is trial 88 with value: 0.24047213959271357.
2026-06-01 11:16:06 | INFO | Trial 92 | outer=1 | hidden=[512, 64] epochs=264 lr=3.282e-04 wd=6.758e-04 n_pcs=5000 weight={'name': 'uniform'}
[I 2026-06-01 11:16:21,393] Trial 92 finished with value: 0.22855393341726393 and parameters: {'hidden_dims': '[512, 64]', 'dropout': 0.06960920876510697, 'batch_norm': False, 'lr': 0.00032817458624277235, 'weight_decay': 0.0006757933323716595, 'epochs': 264, 'loss': 'mae', 'optimizer': 'adam', 'use_snp_selection': False, 'n_pcs': 5000}. Best is trial 88 with value: 0.24047213959271357.
2026-06-01 11:16:21 | INFO | Trial 93 | outer=1 | hidden=[512, 64] epochs=245 lr=4.418e-04 wd=4.441e-05 n_pcs=5000 weight={'name': 'uniform'}
[I 2026-06-01 11:16:35,474] Trial 93 finished with value: 0.2196607553574152 and parameters: {'hidden_dims': '[512, 64]', 'dropout': 0.11092842409043618, 'batch_norm': False, 'lr': 0.00044180787014142767, 'weight_decay': 4.4413058790756615e-05, 'epochs': 245, 'loss': 'mae', 'optimizer': 'adam', 'use_snp_selection': False, 'n_pcs': 5000}. Best is trial 88 with value: 0.24047213959271357.
2026-06-01 11:16:35 | INFO | Trial 94 | outer=1 | hidden=[512, 64] epochs=269 lr=3.978e-04 wd=3.291e-04 n_pcs=4500 weight={'name': 'uniform'}
[I 2026-06-01 11:16:49,829] Trial 94 finished with value: 0.22732940574551058 and parameters: {'hidden_dims': '[512, 64]', 'dropout': 0.026671207662074245, 'batch_norm': False, 'lr': 0.0003977602408327748, 'weight_decay': 0.0003290866197799688, 'epochs': 269, 'loss': 'mae', 'optimizer': 'adam', 'use_snp_selection': False, 'n_pcs': 4500}. Best is trial 88 with value: 0.24047213959271357.
2026-06-01 11:16:49 | INFO | Trial 95 | outer=1 | hidden=[512, 64] epochs=258 lr=4.823e-04 wd=1.466e-04 n_pcs=5000 weight={'name': 'uniform'}
[I 2026-06-01 11:17:04,537] Trial 95 finished with value: 0.22406855233096007 and parameters: {'hidden_dims': '[512, 64]', 'dropout': 0.0012365039298273262, 'batch_norm': False, 'lr': 0.0004823392381741669, 'weight_decay': 0.0001465532889694397, 'epochs': 258, 'loss': 'mae', 'optimizer': 'adam', 'use_snp_selection': False, 'n_pcs': 5000}. Best is trial 88 with value: 0.24047213959271357.
2026-06-01 11:17:04 | INFO | Trial 96 | outer=1 | hidden=[512, 256] epochs=282 lr=3.109e-04 wd=9.548e-05 n_pcs=4500 weight={'name': 'uniform'}
[I 2026-06-01 11:17:20,409] Trial 96 finished with value: 0.21384491612255183 and parameters: {'hidden_dims': '[512, 256]', 'dropout': 0.08324172549722239, 'batch_norm': False, 'lr': 0.00031086878310483066, 'weight_decay': 9.54821594940073e-05, 'epochs': 282, 'loss': 'mae', 'optimizer': 'adam', 'use_snp_selection': False, 'n_pcs': 4500}. Best is trial 88 with value: 0.24047213959271357.
2026-06-01 11:17:20 | INFO | Trial 97 | outer=1 | hidden=[256, 128] epochs=216 lr=3.556e-04 wd=6.898e-05 n_pcs=5000 weight={'name': 'uniform'}
[I 2026-06-01 11:17:28,386] Trial 97 finished with value: 0.21396039389827687 and parameters: {'hidden_dims': '[256, 128]', 'dropout': 0.04487402774862954, 'batch_norm': False, 'lr': 0.0003555971563059892, 'weight_decay': 6.897677070706345e-05, 'epochs': 216, 'loss': 'mae', 'optimizer': 'adam', 'use_snp_selection': False, 'n_pcs': 5000}. Best is trial 88 with value: 0.24047213959271357.
2026-06-01 11:17:28 | INFO | Trial 98 | outer=1 | hidden=[512, 64] epochs=240 lr=2.470e-04 wd=2.187e-05 n_pcs=2000 weight={'name': 'uniform'}
[I 2026-06-01 11:17:35,515] Trial 98 finished with value: 0.20825686662433518 and parameters: {'hidden_dims': '[512, 64]', 'dropout': 0.09937595875301684, 'batch_norm': False, 'lr': 0.0002469514656868219, 'weight_decay': 2.1865890525798758e-05, 'epochs': 240, 'loss': 'mae', 'optimizer': 'adam', 'use_snp_selection': False, 'n_pcs': 2000}. Best is trial 88 with value: 0.24047213959271357.
2026-06-01 11:17:35 | INFO | Trial 99 | outer=1 | hidden=[512, 64] epochs=234 lr=2.864e-04 wd=9.138e-05 n_pcs=4500 weight={'name': 'uniform'}
[I 2026-06-01 11:17:48,276] Trial 99 finished with value: 0.233827699775338 and parameters: {'hidden_dims': '[512, 64]', 'dropout': 0.06841493318091996, 'batch_norm': False, 'lr': 0.00028638695735224486, 'weight_decay': 9.138319330318843e-05, 'epochs': 234, 'loss': 'mse', 'optimizer': 'adam', 'use_snp_selection': False, 'n_pcs': 4500}. Best is trial 88 with value: 0.24047213959271357.
2026-06-01 11:17:48 | INFO | Trial 100 | outer=1 | hidden=[128, 64] epochs=226 lr=4.989e-04 wd=2.619e-04 n_pcs=4500 weight={'name': 'uniform'}
[I 2026-06-01 11:17:53,589] Trial 100 finished with value: 0.20524924442783452 and parameters: {'hidden_dims': '[128, 64]', 'dropout': 0.06947027179138726, 'batch_norm': False, 'lr': 0.0004989127144012578, 'weight_decay': 0.00026185554269312505, 'epochs': 226, 'loss': 'mse', 'optimizer': 'adam', 'use_snp_selection': False, 'n_pcs': 4500}. Best is trial 88 with value: 0.24047213959271357.
2026-06-01 11:17:53 | INFO | Trial 101 | outer=1 | hidden=[512, 64] epochs=233 lr=2.835e-04 wd=9.860e-05 n_pcs=4500 weight={'name': 'uniform'}
[I 2026-06-01 11:18:06,305] Trial 101 finished with value: 0.2332382910536941 and parameters: {'hidden_dims': '[512, 64]', 'dropout': 0.051403536204573684, 'batch_norm': False, 'lr': 0.0002834649359243975, 'weight_decay': 9.859932746670192e-05, 'epochs': 233, 'loss': 'mse', 'optimizer': 'adam', 'use_snp_selection': False, 'n_pcs': 4500}. Best is trial 88 with value: 0.24047213959271357.
2026-06-01 11:18:06 | INFO | Trial 102 | outer=1 | hidden=[512, 64] epochs=232 lr=2.783e-04 wd=1.819e-04 n_pcs=4500 weight={'name': 'uniform'}
[I 2026-06-01 11:18:18,980] Trial 102 finished with value: 0.2111584657112003 and parameters: {'hidden_dims': '[512, 64]', 'dropout': 0.028457444929028256, 'batch_norm': False, 'lr': 0.00027834539159383705, 'weight_decay': 0.00018191429830725114, 'epochs': 232, 'loss': 'mse', 'optimizer': 'adam', 'use_snp_selection': False, 'n_pcs': 4500}. Best is trial 88 with value: 0.24047213959271357.
2026-06-01 11:18:18 | INFO | Trial 103 | outer=1 | hidden=[512, 64] epochs=247 lr=2.252e-04 wd=5.409e-05 n_pcs=4500 weight={'name': 'uniform'}
[I 2026-06-01 11:18:32,319] Trial 103 finished with value: 0.21631055043973496 and parameters: {'hidden_dims': '[512, 64]', 'dropout': 0.13858519146631632, 'batch_norm': False, 'lr': 0.0002251626649448905, 'weight_decay': 5.409330912794828e-05, 'epochs': 247, 'loss': 'mse', 'optimizer': 'adam', 'use_snp_selection': False, 'n_pcs': 4500}. Best is trial 88 with value: 0.24047213959271357.
2026-06-01 11:18:32 | INFO | Trial 104 | outer=1 | hidden=[512, 64] epochs=240 lr=3.029e-04 wd=1.391e-04 n_pcs=4000 weight={'name': 'uniform'}
[I 2026-06-01 11:18:44,073] Trial 104 finished with value: 0.218478534130177 and parameters: {'hidden_dims': '[512, 64]', 'dropout': 0.11740443040450571, 'batch_norm': False, 'lr': 0.000302927185197285, 'weight_decay': 0.00013912057093522066, 'epochs': 240, 'loss': 'mse', 'optimizer': 'adam', 'use_snp_selection': False, 'n_pcs': 4000}. Best is trial 88 with value: 0.24047213959271357.
2026-06-01 11:18:44 | INFO | Trial 105 | outer=1 | hidden=[512, 64] epochs=233 lr=4.344e-04 wd=9.178e-05 n_pcs=3000 weight={'name': 'uniform'}
[I 2026-06-01 11:18:53,321] Trial 105 finished with value: 0.21278094909697604 and parameters: {'hidden_dims': '[512, 64]', 'dropout': 0.08092518205373009, 'batch_norm': False, 'lr': 0.00043442350276337626, 'weight_decay': 9.177676371856682e-05, 'epochs': 233, 'loss': 'mse', 'optimizer': 'adam', 'use_snp_selection': False, 'n_pcs': 3000}. Best is trial 88 with value: 0.24047213959271357.
2026-06-01 11:18:53 | INFO | Trial 106 | outer=1 | hidden=[512, 64] epochs=208 lr=7.693e-05 wd=3.964e-04 n_pcs=4500 weight={'name': 'uniform'}
[I 2026-06-01 11:19:04,919] Trial 106 finished with value: 0.1927132329190631 and parameters: {'hidden_dims': '[512, 64]', 'dropout': 0.04595322717705986, 'batch_norm': False, 'lr': 7.693287799448986e-05, 'weight_decay': 0.00039639743986977986, 'epochs': 208, 'loss': 'mse', 'optimizer': 'adam', 'use_snp_selection': False, 'n_pcs': 4500}. Best is trial 88 with value: 0.24047213959271357.
2026-06-01 11:19:04 | INFO | Trial 107 | outer=1 | hidden=[512, 64] epochs=223 lr=2.415e-04 wd=4.295e-05 n_pcs=4500 weight={'name': 'uniform'}
[I 2026-06-01 11:19:17,179] Trial 107 finished with value: 0.2085225580821232 and parameters: {'hidden_dims': '[512, 64]', 'dropout': 0.16118634814325922, 'batch_norm': False, 'lr': 0.00024154084377552115, 'weight_decay': 4.295418330829543e-05, 'epochs': 223, 'loss': 'mse', 'optimizer': 'adam', 'use_snp_selection': False, 'n_pcs': 4500}. Best is trial 88 with value: 0.24047213959271357.
2026-06-01 11:19:17 | INFO | Trial 108 | outer=1 | hidden=[256, 128] epochs=250 lr=2.763e-04 wd=1.072e-04 n_pcs=4000 weight={'name': 'uniform'}
[I 2026-06-01 11:19:24,807] Trial 108 finished with value: 0.1972457371669979 and parameters: {'hidden_dims': '[256, 128]', 'dropout': 0.011067956491776464, 'batch_norm': False, 'lr': 0.0002762572602084421, 'weight_decay': 0.00010724070717896747, 'epochs': 250, 'loss': 'mse', 'optimizer': 'adam', 'use_snp_selection': False, 'n_pcs': 4000}. Best is trial 88 with value: 0.24047213959271357.
2026-06-01 11:19:24 | INFO | Trial 109 | outer=1 | hidden=[128, 64] epochs=215 lr=3.850e-04 wd=2.843e-04 n_pcs=5000 weight={'name': 'uniform'}
[I 2026-06-01 11:19:30,178] Trial 109 finished with value: 0.23982010632957693 and parameters: {'hidden_dims': '[128, 64]', 'dropout': 0.060602194779057005, 'batch_norm': False, 'lr': 0.00038495740123796, 'weight_decay': 0.0002842929589259764, 'epochs': 215, 'loss': 'mse', 'optimizer': 'adam', 'use_snp_selection': False, 'n_pcs': 5000}. Best is trial 88 with value: 0.24047213959271357.
2026-06-01 11:19:30 | INFO | Trial 110 | outer=1 | hidden=[128, 64] epochs=237 lr=1.860e-05 wd=5.333e-04 n_pcs=5000 weight={'name': 'uniform'}
[I 2026-06-01 11:19:34,128] Trial 110 pruned. 
2026-06-01 11:19:34 | INFO | Trial 111 | outer=1 | hidden=[128, 64] epochs=223 lr=3.983e-04 wd=7.384e-04 n_pcs=5000 weight={'name': 'uniform'}
[I 2026-06-01 11:19:39,609] Trial 111 finished with value: 0.2160782601994351 and parameters: {'hidden_dims': '[128, 64]', 'dropout': 0.06308063669100794, 'batch_norm': False, 'lr': 0.000398273761368616, 'weight_decay': 0.000738422487420763, 'epochs': 223, 'loss': 'mse', 'optimizer': 'adam', 'use_snp_selection': False, 'n_pcs': 5000}. Best is trial 88 with value: 0.24047213959271357.
2026-06-01 11:19:39 | INFO | Trial 112 | outer=1 | hidden=[128, 64] epochs=242 lr=3.323e-04 wd=2.962e-04 n_pcs=4500 weight={'name': 'uniform'}
[I 2026-06-01 11:19:45,147] Trial 112 finished with value: 0.20984700452162328 and parameters: {'hidden_dims': '[128, 64]', 'dropout': 0.0986979364505936, 'batch_norm': False, 'lr': 0.0003323475565011039, 'weight_decay': 0.00029615302056171293, 'epochs': 242, 'loss': 'mse', 'optimizer': 'adam', 'use_snp_selection': False, 'n_pcs': 4500}. Best is trial 88 with value: 0.24047213959271357.
2026-06-01 11:19:45 | INFO | Trial 113 | outer=1 | hidden=[128, 64] epochs=258 lr=4.148e-04 wd=1.475e-04 n_pcs=5000 weight={'name': 'uniform'}
[I 2026-06-01 11:19:51,120] Trial 113 finished with value: 0.19455818588761806 and parameters: {'hidden_dims': '[128, 64]', 'dropout': 0.02841001339358744, 'batch_norm': False, 'lr': 0.0004147888738896306, 'weight_decay': 0.00014750699679323107, 'epochs': 258, 'loss': 'mse', 'optimizer': 'adam', 'use_snp_selection': False, 'n_pcs': 5000}. Best is trial 88 with value: 0.24047213959271357.
2026-06-01 11:19:51 | INFO | Trial 114 | outer=1 | hidden=[512, 64] epochs=217 lr=2.128e-04 wd=2.129e-04 n_pcs=5000 weight={'name': 'uniform'}
[I 2026-06-01 11:20:03,833] Trial 114 finished with value: 0.21985971692984435 and parameters: {'hidden_dims': '[512, 64]', 'dropout': 0.07239242340677517, 'batch_norm': False, 'lr': 0.0002128019750800044, 'weight_decay': 0.00021290250421002868, 'epochs': 217, 'loss': 'mse', 'optimizer': 'adam', 'use_snp_selection': False, 'n_pcs': 5000}. Best is trial 88 with value: 0.24047213959271357.
2026-06-01 11:20:03 | INFO | Trial 115 | outer=1 | hidden=[256, 64] epochs=228 lr=2.974e-04 wd=1.184e-04 n_pcs=4500 weight={'name': 'uniform'}
[I 2026-06-01 11:20:11,604] Trial 115 finished with value: 0.2137764303613822 and parameters: {'hidden_dims': '[256, 64]', 'dropout': 0.05031656449287266, 'batch_norm': False, 'lr': 0.00029736736523610323, 'weight_decay': 0.00011841498511110694, 'epochs': 228, 'loss': 'mse', 'optimizer': 'adam', 'use_snp_selection': False, 'n_pcs': 4500}. Best is trial 88 with value: 0.24047213959271357.
2026-06-01 11:20:11 | INFO | Trial 116 | outer=1 | hidden=[512, 256] epochs=235 lr=3.707e-04 wd=1.791e-04 n_pcs=5000 weight={'name': 'uniform'}
[I 2026-06-01 11:20:25,970] Trial 116 finished with value: 0.20839764816027712 and parameters: {'hidden_dims': '[512, 256]', 'dropout': 0.03632204567808035, 'batch_norm': False, 'lr': 0.0003707251133800256, 'weight_decay': 0.00017905081911314107, 'epochs': 235, 'loss': 'mse', 'optimizer': 'adam', 'use_snp_selection': False, 'n_pcs': 5000}. Best is trial 88 with value: 0.24047213959271357.
2026-06-01 11:20:25 | INFO | Trial 117 | outer=1 | hidden=[512, 64] epochs=248 lr=4.552e-04 wd=3.881e-04 n_pcs=4500 weight={'name': 'uniform'}
[I 2026-06-01 11:20:39,363] Trial 117 finished with value: 0.22590936206634904 and parameters: {'hidden_dims': '[512, 64]', 'dropout': 0.007562140328588455, 'batch_norm': False, 'lr': 0.0004551905614539049, 'weight_decay': 0.0003881076645999574, 'epochs': 248, 'loss': 'mae', 'optimizer': 'adam', 'use_snp_selection': False, 'n_pcs': 4500}. Best is trial 88 with value: 0.24047213959271357.
2026-06-01 11:20:39 | INFO | Trial 118 | outer=1 | hidden=[512, 64] epochs=214 lr=2.645e-04 wd=9.018e-05 n_pcs=5000 weight={'name': 'uniform'}
[I 2026-06-01 11:20:51,941] Trial 118 finished with value: 0.20554697725992463 and parameters: {'hidden_dims': '[512, 64]', 'dropout': 0.08443494830890624, 'batch_norm': False, 'lr': 0.0002645113938593465, 'weight_decay': 9.018219144350207e-05, 'epochs': 214, 'loss': 'mae', 'optimizer': 'adam', 'use_snp_selection': False, 'n_pcs': 5000}. Best is trial 88 with value: 0.24047213959271357.
2026-06-01 11:20:51 | INFO | Trial 119 | outer=1 | hidden=[128, 64] epochs=204 lr=3.345e-04 wd=6.431e-05 n_pcs=4500 weight={'name': 'uniform'}
[I 2026-06-01 11:20:56,958] Trial 119 finished with value: 0.19389879811100735 and parameters: {'hidden_dims': '[128, 64]', 'dropout': 0.01755444829326385, 'batch_norm': False, 'lr': 0.0003344838740516462, 'weight_decay': 6.43052919207756e-05, 'epochs': 204, 'loss': 'mse', 'optimizer': 'adam', 'use_snp_selection': False, 'n_pcs': 4500}. Best is trial 88 with value: 0.24047213959271357.
2026-06-01 11:20:56 | INFO | Trial 120 | outer=1 | hidden=[512, 64] epochs=277 lr=5.282e-05 wd=2.387e-04 n_pcs=5000 weight={'name': 'uniform'}
[I 2026-06-01 11:21:12,554] Trial 120 finished with value: 0.2053565645513007 and parameters: {'hidden_dims': '[512, 64]', 'dropout': 0.10388081616637483, 'batch_norm': False, 'lr': 5.282206290845417e-05, 'weight_decay': 0.0002386587608585687, 'epochs': 277, 'loss': 'mae', 'optimizer': 'adam', 'use_snp_selection': False, 'n_pcs': 5000}. Best is trial 88 with value: 0.24047213959271357.
2026-06-01 11:21:12 | INFO | Trial 121 | outer=1 | hidden=[512, 64] epochs=254 lr=3.530e-04 wd=7.287e-05 n_pcs=5000 weight={'name': 'uniform'}
[I 2026-06-01 11:21:27,070] Trial 121 finished with value: 0.22254710150250373 and parameters: {'hidden_dims': '[512, 64]', 'dropout': 0.06343748820475595, 'batch_norm': False, 'lr': 0.00035295180863613885, 'weight_decay': 7.287120289803316e-05, 'epochs': 254, 'loss': 'mae', 'optimizer': 'adam', 'use_snp_selection': False, 'n_pcs': 5000}. Best is trial 88 with value: 0.24047213959271357.
2026-06-01 11:21:27 | INFO | Trial 122 | outer=1 | hidden=[512, 64] epochs=264 lr=3.820e-04 wd=1.294e-04 n_pcs=5000 weight={'name': 'uniform'}
