[I 2026-06-01 12:18:00,758] Trial 23 finished with value: 0.15266992090749681 and parameters: {'hidden_dims': '[512, 128]', 'dropout': 0.5245752095779502, 'batch_norm': False, 'lr': 0.0002118186584403145, 'weight_decay': 4.790536736379684e-05, 'epochs': 178, 'loss': 'mse', 'optimizer': 'adamw', 'use_snp_selection': False, 'n_pcs': 5000}. Best is trial 16 with value: 0.18445004678898375.
2026-06-01 12:18:00 | INFO | Trial 24 | outer=4 | hidden=[512, 128] epochs=97 lr=3.745e-04 wd=3.948e-04 n_pcs=4000 weight={'name': 'uniform'}
[I 2026-06-01 12:18:04,370] Trial 24 pruned. 
2026-06-01 12:18:04 | INFO | Trial 25 | outer=4 | hidden=[512, 128] epochs=136 lr=1.529e-04 wd=6.322e-07 n_pcs=3500 weight={'name': 'uniform'}
[I 2026-06-01 12:18:09,248] Trial 25 pruned. 
2026-06-01 12:18:09 | INFO | Trial 26 | outer=4 | hidden=[512, 128] epochs=176 lr=4.876e-04 wd=1.505e-05 n_pcs=4500 weight={'name': 'uniform'}
[I 2026-06-01 12:18:19,389] Trial 26 finished with value: 0.17532060055628165 and parameters: {'hidden_dims': '[512, 128]', 'dropout': 0.5153592199207232, 'batch_norm': False, 'lr': 0.0004875890950085615, 'weight_decay': 1.5051174803863381e-05, 'epochs': 176, 'loss': 'mse', 'optimizer': 'adamw', 'use_snp_selection': False, 'n_pcs': 4500}. Best is trial 16 with value: 0.18445004678898375.
2026-06-01 12:18:19 | INFO | Trial 27 | outer=4 | hidden=[512, 128] epochs=182 lr=2.923e-04 wd=1.864e-05 n_pcs=5000 weight={'name': 'uniform'}
[I 2026-06-01 12:18:30,424] Trial 27 finished with value: 0.1784028892868335 and parameters: {'hidden_dims': '[512, 128]', 'dropout': 0.44989997049611197, 'batch_norm': False, 'lr': 0.0002922752980799806, 'weight_decay': 1.863867360867072e-05, 'epochs': 182, 'loss': 'mae', 'optimizer': 'adam', 'use_snp_selection': False, 'n_pcs': 5000}. Best is trial 16 with value: 0.18445004678898375.
2026-06-01 12:18:30 | INFO | Trial 28 | outer=4 | hidden=[512, 64] epochs=236 lr=1.098e-04 wd=7.639e-07 n_pcs=5000 weight={'name': 'uniform'}
[I 2026-06-01 12:18:43,800] Trial 28 finished with value: 0.168758245905988 and parameters: {'hidden_dims': '[512, 64]', 'dropout': 0.44553467128373186, 'batch_norm': False, 'lr': 0.00010984294908241593, 'weight_decay': 7.639356886818703e-07, 'epochs': 236, 'loss': 'mae', 'optimizer': 'adam', 'use_snp_selection': False, 'n_pcs': 5000}. Best is trial 16 with value: 0.18445004678898375.
2026-06-01 12:18:43 | INFO | Trial 29 | outer=4 | hidden=[256, 64] epochs=193 lr=3.012e-04 wd=7.289e-05 n_pcs=1500 weight={'name': 'uniform'}
[I 2026-06-01 12:18:46,120] Trial 29 pruned. 
2026-06-01 12:18:46 | INFO | Trial 30 | outer=4 | hidden=[1024, 256] epochs=153 lr=1.849e-04 wd=1.711e-05 n_pcs=2000 weight={'name': 'uniform'}
[I 2026-06-01 12:18:55,651] Trial 30 finished with value: 0.1712771285960692 and parameters: {'hidden_dims': '[1024, 256]', 'dropout': 0.37808081625341633, 'batch_norm': False, 'lr': 0.0001848572450229692, 'weight_decay': 1.7107180648687535e-05, 'epochs': 153, 'loss': 'mae', 'optimizer': 'adam', 'use_snp_selection': False, 'n_pcs': 2000}. Best is trial 16 with value: 0.18445004678898375.
2026-06-01 12:18:55 | INFO | Trial 31 | outer=4 | hidden=[512, 128] epochs=172 lr=4.748e-04 wd=1.571e-05 n_pcs=4500 weight={'name': 'uniform'}
[I 2026-06-01 12:19:05,643] Trial 31 finished with value: 0.17943540319402104 and parameters: {'hidden_dims': '[512, 128]', 'dropout': 0.5115105135534297, 'batch_norm': False, 'lr': 0.00047482158699794396, 'weight_decay': 1.5708737573726598e-05, 'epochs': 172, 'loss': 'mae', 'optimizer': 'adam', 'use_snp_selection': False, 'n_pcs': 4500}. Best is trial 16 with value: 0.18445004678898375.
2026-06-01 12:19:05 | INFO | Trial 32 | outer=4 | hidden=[512, 128] epochs=169 lr=2.336e-04 wd=1.245e-06 n_pcs=5000 weight={'name': 'uniform'}
[I 2026-06-01 12:19:16,089] Trial 32 finished with value: 0.1697326478047361 and parameters: {'hidden_dims': '[512, 128]', 'dropout': 0.5431785669916184, 'batch_norm': False, 'lr': 0.00023362002410005737, 'weight_decay': 1.2452656650830133e-06, 'epochs': 169, 'loss': 'mae', 'optimizer': 'adam', 'use_snp_selection': False, 'n_pcs': 5000}. Best is trial 16 with value: 0.18445004678898375.
2026-06-01 12:19:16 | INFO | Trial 33 | outer=4 | hidden=[256, 64] epochs=228 lr=1.036e-04 wd=2.211e-05 n_pcs=4000 weight={'name': 'uniform'}
[I 2026-06-01 12:19:23,026] Trial 33 finished with value: 0.15876742147880804 and parameters: {'hidden_dims': '[256, 64]', 'dropout': 0.46382272481251996, 'batch_norm': False, 'lr': 0.00010364069349105411, 'weight_decay': 2.21082113793806e-05, 'epochs': 228, 'loss': 'mae', 'optimizer': 'adam', 'use_snp_selection': False, 'n_pcs': 4000}. Best is trial 16 with value: 0.18445004678898375.
2026-06-01 12:19:23 | INFO | Trial 34 | outer=4 | hidden=[512, 128] epochs=188 lr=3.171e-04 wd=1.595e-04 n_pcs=1000 weight={'name': 'uniform'}
[I 2026-06-01 12:19:25,699] Trial 34 pruned. 
2026-06-01 12:19:25 | INFO | Trial 35 | outer=4 | hidden=[256, 128] epochs=211 lr=4.852e-04 wd=1.072e-05 n_pcs=4500 weight={'name': 'uniform'}
[I 2026-06-01 12:19:30,820] Trial 35 pruned. 
2026-06-01 12:19:30 | INFO | Trial 36 | outer=4 | hidden=[512, 256] epochs=250 lr=6.143e-05 wd=1.578e-06 n_pcs=500 weight={'name': 'uniform'}
[I 2026-06-01 12:19:34,211] Trial 36 pruned. 
2026-06-01 12:19:34 | INFO | Trial 37 | outer=4 | hidden=[512, 128] epochs=148 lr=1.847e-04 wd=5.422e-05 n_pcs=5000 weight={'name': 'uniform'}
[I 2026-06-01 12:19:43,649] Trial 37 finished with value: 0.16546747303189713 and parameters: {'hidden_dims': '[512, 128]', 'dropout': 0.4789644173440515, 'batch_norm': False, 'lr': 0.00018473118450433045, 'weight_decay': 5.4218627718808005e-05, 'epochs': 148, 'loss': 'mae', 'optimizer': 'adam', 'use_snp_selection': False, 'n_pcs': 5000}. Best is trial 16 with value: 0.18445004678898375.
2026-06-01 12:19:43 | INFO | Trial 38 | outer=4 | hidden=[1024, 256] epochs=163 lr=3.088e-04 wd=3.990e-06 n_pcs=3500 weight={'name': 'uniform'}
[I 2026-06-01 12:19:53,446] Trial 38 pruned. 
2026-06-01 12:19:53 | INFO | Trial 39 | outer=4 | hidden=[512, 128] epochs=110 lr=4.593e-05 wd=2.393e-04 n_pcs=4000 weight={'name': 'uniform'}
[I 2026-06-01 12:19:57,385] Trial 39 pruned. 
2026-06-01 12:19:57 | INFO | Trial 40 | outer=4 | hidden=[256, 64] epochs=81 lr=8.639e-05 wd=3.043e-05 n_pcs=5000 weight={'name': 'uniform'}
[I 2026-06-01 12:20:00,402] Trial 40 pruned. 
2026-06-01 12:20:00 | INFO | Trial 41 | outer=4 | hidden=[512, 128] epochs=176 lr=4.595e-04 wd=1.323e-05 n_pcs=4500 weight={'name': 'uniform'}
[I 2026-06-01 12:20:10,574] Trial 41 finished with value: 0.17498448378994125 and parameters: {'hidden_dims': '[512, 128]', 'dropout': 0.514350214551226, 'batch_norm': False, 'lr': 0.0004595366241351815, 'weight_decay': 1.3227287210992384e-05, 'epochs': 176, 'loss': 'mse', 'optimizer': 'adamw', 'use_snp_selection': False, 'n_pcs': 4500}. Best is trial 16 with value: 0.18445004678898375.
2026-06-01 12:20:10 | INFO | Trial 42 | outer=4 | hidden=[512, 128] epochs=206 lr=4.206e-04 wd=8.316e-06 n_pcs=4500 weight={'name': 'uniform'}
[I 2026-06-01 12:20:22,098] Trial 42 finished with value: 0.16700151260557256 and parameters: {'hidden_dims': '[512, 128]', 'dropout': 0.5162622366648995, 'batch_norm': False, 'lr': 0.0004206249542394004, 'weight_decay': 8.315592983987533e-06, 'epochs': 206, 'loss': 'mse', 'optimizer': 'adamw', 'use_snp_selection': False, 'n_pcs': 4500}. Best is trial 16 with value: 0.18445004678898375.
2026-06-01 12:20:22 | INFO | Trial 43 | outer=4 | hidden=[512, 128] epochs=182 lr=3.372e-04 wd=3.073e-06 n_pcs=5000 weight={'name': 'uniform'}
[I 2026-06-01 12:20:33,131] Trial 43 finished with value: 0.17256050625311398 and parameters: {'hidden_dims': '[512, 128]', 'dropout': 0.5663901695263551, 'batch_norm': False, 'lr': 0.00033716867243113665, 'weight_decay': 3.0728261302854655e-06, 'epochs': 182, 'loss': 'mse', 'optimizer': 'adamw', 'use_snp_selection': False, 'n_pcs': 5000}. Best is trial 16 with value: 0.18445004678898375.
2026-06-01 12:20:33 | INFO | Trial 44 | outer=4 | hidden=[128, 64] epochs=135 lr=4.166e-04 wd=9.781e-05 n_pcs=4000 weight={'name': 'uniform'}
[I 2026-06-01 12:20:37,020] Trial 44 finished with value: 0.14571588038211555 and parameters: {'hidden_dims': '[128, 64]', 'dropout': 0.49143765433383585, 'batch_norm': False, 'lr': 0.00041656949762024925, 'weight_decay': 9.780565642949366e-05, 'epochs': 135, 'loss': 'mse', 'optimizer': 'adamw', 'use_snp_selection': False, 'n_pcs': 4000}. Best is trial 16 with value: 0.18445004678898375.
2026-06-01 12:20:37 | INFO | Trial 45 | outer=4 | hidden=[512, 128] epochs=199 lr=4.917e-04 wd=1.872e-05 n_pcs=4500 weight={'name': 'uniform'}
[I 2026-06-01 12:20:48,221] Trial 45 finished with value: 0.17302690965466688 and parameters: {'hidden_dims': '[512, 128]', 'dropout': 0.5378390916728755, 'batch_norm': False, 'lr': 0.0004916815457092067, 'weight_decay': 1.8720576737642138e-05, 'epochs': 199, 'loss': 'mse', 'optimizer': 'adam', 'use_snp_selection': False, 'n_pcs': 4500}. Best is trial 16 with value: 0.18445004678898375.
2026-06-01 12:20:48 | INFO | Trial 46 | outer=4 | hidden=[512, 128] epochs=171 lr=1.030e-05 wd=5.700e-04 n_pcs=3000 weight={'name': 'uniform'}
[I 2026-06-01 12:20:52,629] Trial 46 pruned. 
2026-06-01 12:20:52 | INFO | Trial 47 | outer=4 | hidden=[256, 128] epochs=223 lr=2.787e-04 wd=5.408e-06 n_pcs=5000 weight={'name': 'uniform'}
[I 2026-06-01 12:21:00,649] Trial 47 finished with value: 0.1763939939825058 and parameters: {'hidden_dims': '[256, 128]', 'dropout': 0.5705741270357447, 'batch_norm': False, 'lr': 0.0002786749677732098, 'weight_decay': 5.408286882080738e-06, 'epochs': 223, 'loss': 'mse', 'optimizer': 'adamw', 'use_snp_selection': False, 'n_pcs': 5000}. Best is trial 16 with value: 0.18445004678898375.
2026-06-01 12:21:00 | INFO | Trial 48 | outer=4 | hidden=[256, 128] epochs=217 lr=2.369e-04 wd=3.484e-07 n_pcs=5000 weight={'name': 'uniform'}
[I 2026-06-01 12:21:08,514] Trial 48 finished with value: 0.16629210630749483 and parameters: {'hidden_dims': '[256, 128]', 'dropout': 0.5745853499142448, 'batch_norm': False, 'lr': 0.00023690237666010064, 'weight_decay': 3.4836899921113213e-07, 'epochs': 217, 'loss': 'mse', 'optimizer': 'adam', 'use_snp_selection': False, 'n_pcs': 5000}. Best is trial 16 with value: 0.18445004678898375.
2026-06-01 12:21:08 | INFO | Trial 49 | outer=4 | hidden=[256, 128] epochs=251 lr=2.801e-04 wd=5.484e-06 n_pcs=5000 weight={'name': 'uniform'}
[I 2026-06-01 12:21:17,270] Trial 49 finished with value: 0.17103695875083305 and parameters: {'hidden_dims': '[256, 128]', 'dropout': 0.5736708055187475, 'batch_norm': False, 'lr': 0.00028010742215392345, 'weight_decay': 5.4837183280488544e-06, 'epochs': 251, 'loss': 'mae', 'optimizer': 'adamw', 'use_snp_selection': False, 'n_pcs': 5000}. Best is trial 16 with value: 0.18445004678898375.
2026-06-01 12:21:17 | INFO | Trial 50 | outer=4 | hidden=[256, 128] epochs=270 lr=1.376e-04 wd=3.391e-06 n_pcs=5000 weight={'name': 'uniform'}
[I 2026-06-01 12:21:23,700] Trial 50 pruned. 
2026-06-01 12:21:23 | INFO | Trial 51 | outer=4 | hidden=[512, 64] epochs=144 lr=3.628e-04 wd=2.341e-06 n_pcs=4500 weight={'name': 'uniform'}
[I 2026-06-01 12:21:32,265] Trial 51 finished with value: 0.17570925524344788 and parameters: {'hidden_dims': '[512, 64]', 'dropout': 0.5130078855761457, 'batch_norm': False, 'lr': 0.00036282542740290777, 'weight_decay': 2.3411725826614887e-06, 'epochs': 144, 'loss': 'mse', 'optimizer': 'adamw', 'use_snp_selection': False, 'n_pcs': 4500}. Best is trial 16 with value: 0.18445004678898375.
2026-06-01 12:21:32 | INFO | Trial 52 | outer=4 | hidden=[512, 64] epochs=142 lr=3.565e-04 wd=2.505e-06 n_pcs=4500 weight={'name': 'uniform'}
[I 2026-06-01 12:21:40,756] Trial 52 finished with value: 0.1764911768411408 and parameters: {'hidden_dims': '[512, 64]', 'dropout': 0.5410923702893199, 'batch_norm': False, 'lr': 0.00035650198635662063, 'weight_decay': 2.505134570060809e-06, 'epochs': 142, 'loss': 'mse', 'optimizer': 'adamw', 'use_snp_selection': False, 'n_pcs': 4500}. Best is trial 16 with value: 0.18445004678898375.
2026-06-01 12:21:40 | INFO | Trial 53 | outer=4 | hidden=[512, 64] epochs=162 lr=2.095e-04 wd=6.720e-06 n_pcs=4500 weight={'name': 'uniform'}
[I 2026-06-01 12:21:50,120] Trial 53 finished with value: 0.17562225547984267 and parameters: {'hidden_dims': '[512, 64]', 'dropout': 0.541776735095731, 'batch_norm': False, 'lr': 0.0002094620642410958, 'weight_decay': 6.720383140018952e-06, 'epochs': 162, 'loss': 'mse', 'optimizer': 'adamw', 'use_snp_selection': False, 'n_pcs': 4500}. Best is trial 16 with value: 0.18445004678898375.
2026-06-01 12:21:50 | INFO | Trial 54 | outer=4 | hidden=[512, 64] epochs=119 lr=3.406e-05 wd=1.847e-06 n_pcs=4000 weight={'name': 'uniform'}
[I 2026-06-01 12:21:54,892] Trial 54 pruned. 
2026-06-01 12:21:54 | INFO | Trial 55 | outer=4 | hidden=[256, 128] epochs=106 lr=2.702e-04 wd=5.902e-04 n_pcs=5000 weight={'name': 'uniform'}
[I 2026-06-01 12:21:59,907] Trial 55 finished with value: 0.16608029958269893 and parameters: {'hidden_dims': '[256, 128]', 'dropout': 0.5446784717870358, 'batch_norm': False, 'lr': 0.0002701825780980139, 'weight_decay': 0.0005902167880200769, 'epochs': 106, 'loss': 'mse', 'optimizer': 'adamw', 'use_snp_selection': False, 'n_pcs': 5000}. Best is trial 16 with value: 0.18445004678898375.
2026-06-01 12:21:59 | INFO | Trial 56 | outer=4 | hidden=[128, 64] epochs=221 lr=1.662e-04 wd=9.377e-07 n_pcs=4500 weight={'name': 'uniform'}
[I 2026-06-01 12:22:05,185] Trial 56 finished with value: 0.14317239791575762 and parameters: {'hidden_dims': '[128, 64]', 'dropout': 0.10688500917736163, 'batch_norm': False, 'lr': 0.00016619941677570985, 'weight_decay': 9.377275397871526e-07, 'epochs': 221, 'loss': 'mse', 'optimizer': 'adamw', 'use_snp_selection': False, 'n_pcs': 4500}. Best is trial 16 with value: 0.18445004678898375.
2026-06-01 12:22:05 | INFO | Trial 57 | outer=4 | hidden=[512, 64] epochs=152 lr=3.956e-04 wd=5.013e-07 n_pcs=4000 weight={'name': 'uniform'}
[I 2026-06-01 12:22:13,290] Trial 57 finished with value: 0.17267785807490393 and parameters: {'hidden_dims': '[512, 64]', 'dropout': 0.4983667964802656, 'batch_norm': False, 'lr': 0.00039559583199382176, 'weight_decay': 5.013213902549618e-07, 'epochs': 152, 'loss': 'mse', 'optimizer': 'adamw', 'use_snp_selection': False, 'n_pcs': 4000}. Best is trial 16 with value: 0.18445004678898375.
2026-06-01 12:22:13 | INFO | Trial 58 | outer=4 | hidden=[512, 256] epochs=131 lr=3.335e-04 wd=2.685e-05 n_pcs=5000 weight={'name': 'uniform'}
[I 2026-06-01 12:22:22,183] Trial 58 finished with value: 0.16213995613252355 and parameters: {'hidden_dims': '[512, 256]', 'dropout': 0.5976390336223022, 'batch_norm': False, 'lr': 0.00033350934633149474, 'weight_decay': 2.6845470842968382e-05, 'epochs': 131, 'loss': 'mse', 'optimizer': 'adamw', 'use_snp_selection': False, 'n_pcs': 5000}. Best is trial 16 with value: 0.18445004678898375.
2026-06-01 12:22:22 | INFO | Trial 59 | outer=4 | hidden=[512, 64] epochs=237 lr=2.292e-04 wd=5.153e-08 n_pcs=2500 weight={'name': 'uniform'}
[I 2026-06-01 12:22:30,201] Trial 59 finished with value: 0.17398176252795625 and parameters: {'hidden_dims': '[512, 64]', 'dropout': 0.025182380687247652, 'batch_norm': False, 'lr': 0.00022921890010732285, 'weight_decay': 5.153113481486373e-08, 'epochs': 237, 'loss': 'mse', 'optimizer': 'adam', 'use_snp_selection': False, 'n_pcs': 2500}. Best is trial 16 with value: 0.18445004678898375.
2026-06-01 12:22:30 | INFO | Trial 60 | outer=4 | hidden=[256, 128] epochs=91 lr=1.304e-04 wd=1.014e-05 n_pcs=3500 weight={'name': 'uniform'}
[I 2026-06-01 12:22:32,875] Trial 60 pruned. 
2026-06-01 12:22:32 | INFO | Trial 61 | outer=4 | hidden=[512, 64] epochs=143 lr=3.675e-04 wd=1.713e-06 n_pcs=4500 weight={'name': 'uniform'}
[I 2026-06-01 12:22:41,412] Trial 61 finished with value: 0.1775943875106396 and parameters: {'hidden_dims': '[512, 64]', 'dropout': 0.5105047112158293, 'batch_norm': False, 'lr': 0.0003675245495492513, 'weight_decay': 1.7134420839588898e-06, 'epochs': 143, 'loss': 'mse', 'optimizer': 'adamw', 'use_snp_selection': False, 'n_pcs': 4500}. Best is trial 16 with value: 0.18445004678898375.
2026-06-01 12:22:41 | INFO | Trial 62 | outer=4 | hidden=[512, 64] epochs=141 lr=2.762e-04 wd=4.428e-06 n_pcs=4500 weight={'name': 'uniform'}
[I 2026-06-01 12:22:49,880] Trial 62 finished with value: 0.17265357876981025 and parameters: {'hidden_dims': '[512, 64]', 'dropout': 0.5465547072546337, 'batch_norm': False, 'lr': 0.0002762307062817601, 'weight_decay': 4.427615332209649e-06, 'epochs': 141, 'loss': 'mse', 'optimizer': 'adamw', 'use_snp_selection': False, 'n_pcs': 4500}. Best is trial 16 with value: 0.18445004678898375.
2026-06-01 12:22:49 | INFO | Trial 63 | outer=4 | hidden=[512, 64] epochs=156 lr=4.378e-04 wd=2.451e-06 n_pcs=4500 weight={'name': 'uniform'}
[I 2026-06-01 12:22:58,963] Trial 63 finished with value: 0.18369738853997872 and parameters: {'hidden_dims': '[512, 64]', 'dropout': 0.5717784612534209, 'batch_norm': False, 'lr': 0.0004378208305667988, 'weight_decay': 2.4509974912676885e-06, 'epochs': 156, 'loss': 'mse', 'optimizer': 'adamw', 'use_snp_selection': False, 'n_pcs': 4500}. Best is trial 16 with value: 0.18445004678898375.
2026-06-01 12:22:58 | INFO | Trial 64 | outer=4 | hidden=[512, 64] epochs=154 lr=4.024e-04 wd=2.412e-06 n_pcs=4000 weight={'name': 'uniform'}
[I 2026-06-01 12:23:04,679] Trial 64 pruned. 
2026-06-01 12:23:04 | INFO | Trial 65 | outer=4 | hidden=[512, 64] epochs=166 lr=4.397e-04 wd=2.191e-07 n_pcs=4500 weight={'name': 'uniform'}
[I 2026-06-01 12:23:14,215] Trial 65 finished with value: 0.17082747070530277 and parameters: {'hidden_dims': '[512, 64]', 'dropout': 0.4828955331302771, 'batch_norm': False, 'lr': 0.00043973140240012674, 'weight_decay': 2.190649040738804e-07, 'epochs': 166, 'loss': 'mse', 'optimizer': 'adamw', 'use_snp_selection': False, 'n_pcs': 4500}. Best is trial 16 with value: 0.18445004678898375.
2026-06-01 12:23:14 | INFO | Trial 66 | outer=4 | hidden=[512, 64] epochs=122 lr=3.539e-04 wd=4.785e-05 n_pcs=4500 weight={'name': 'uniform'}
[I 2026-06-01 12:23:21,827] Trial 66 finished with value: 0.17456245633299478 and parameters: {'hidden_dims': '[512, 64]', 'dropout': 0.4161166668890973, 'batch_norm': False, 'lr': 0.0003539350637645464, 'weight_decay': 4.784990918028548e-05, 'epochs': 122, 'loss': 'mse', 'optimizer': 'adamw', 'use_snp_selection': False, 'n_pcs': 4500}. Best is trial 16 with value: 0.18445004678898375.
2026-06-01 12:23:21 | INFO | Trial 67 | outer=4 | hidden=[512, 64] epochs=186 lr=3.091e-04 wd=1.258e-06 n_pcs=4000 weight={'name': 'uniform'}
[I 2026-06-01 12:23:27,462] Trial 67 pruned. 
2026-06-01 12:23:27 | INFO | Trial 68 | outer=4 | hidden=[1024, 256] epochs=113 lr=3.735e-04 wd=7.899e-04 n_pcs=4500 weight={'name': 'uniform'}
[I 2026-06-01 12:23:39,898] Trial 68 finished with value: 0.17720045584685426 and parameters: {'hidden_dims': '[1024, 256]', 'dropout': 0.502695413768653, 'batch_norm': False, 'lr': 0.0003735461400816495, 'weight_decay': 0.0007899336711307518, 'epochs': 113, 'loss': 'mae', 'optimizer': 'adamw', 'use_snp_selection': False, 'n_pcs': 4500}. Best is trial 16 with value: 0.18445004678898375.
2026-06-01 12:23:39 | INFO | Trial 69 | outer=4 | hidden=[512, 128] epochs=75 lr=4.399e-04 wd=4.294e-04 n_pcs=5000 weight={'name': 'uniform'}
[I 2026-06-01 12:23:43,424] Trial 69 pruned. 
2026-06-01 12:23:43 | INFO | Trial 70 | outer=4 | hidden=[1024, 256] epochs=115 lr=2.385e-05 wd=9.169e-04 n_pcs=4000 weight={'name': 'uniform'}
[I 2026-06-01 12:23:50,292] Trial 70 pruned. 
2026-06-01 12:23:50 | INFO | Trial 71 | outer=4 | hidden=[1024, 256] epochs=130 lr=3.735e-04 wd=1.994e-04 n_pcs=4500 weight={'name': 'uniform'}
[I 2026-06-01 12:24:04,248] Trial 71 finished with value: 0.17519181543190035 and parameters: {'hidden_dims': '[1024, 256]', 'dropout': 0.5515028801487298, 'batch_norm': False, 'lr': 0.00037345177992535153, 'weight_decay': 0.00019937160477958101, 'epochs': 130, 'loss': 'mae', 'optimizer': 'adamw', 'use_snp_selection': False, 'n_pcs': 4500}. Best is trial 16 with value: 0.18445004678898375.
2026-06-01 12:24:04 | INFO | Trial 72 | outer=4 | hidden=[1024, 256] epochs=160 lr=3.109e-04 wd=2.817e-04 n_pcs=2000 weight={'name': 'uniform'}
[I 2026-06-01 12:24:14,150] Trial 72 finished with value: 0.16493718227070225 and parameters: {'hidden_dims': '[1024, 256]', 'dropout': 0.4753880147276255, 'batch_norm': False, 'lr': 0.00031093702350874184, 'weight_decay': 0.00028166535079393444, 'epochs': 160, 'loss': 'mae', 'optimizer': 'adamw', 'use_snp_selection': False, 'n_pcs': 2000}. Best is trial 16 with value: 0.18445004678898375.
2026-06-01 12:24:14 | INFO | Trial 73 | outer=4 | hidden=[1024, 256] epochs=97 lr=3.702e-04 wd=4.324e-04 n_pcs=4500 weight={'name': 'uniform'}
[I 2026-06-01 12:24:25,206] Trial 73 finished with value: 0.18095532054015034 and parameters: {'hidden_dims': '[1024, 256]', 'dropout': 0.5279369042544261, 'batch_norm': False, 'lr': 0.0003701735955462827, 'weight_decay': 0.00043235869504592184, 'epochs': 97, 'loss': 'mae', 'optimizer': 'adamw', 'use_snp_selection': False, 'n_pcs': 4500}. Best is trial 16 with value: 0.18445004678898375.
2026-06-01 12:24:25 | INFO | Trial 74 | outer=4 | hidden=[1024, 256] epochs=98 lr=2.458e-04 wd=6.315e-04 n_pcs=4500 weight={'name': 'uniform'}
[I 2026-06-01 12:24:36,356] Trial 74 finished with value: 0.17957930196229013 and parameters: {'hidden_dims': '[1024, 256]', 'dropout': 0.5321381190997452, 'batch_norm': False, 'lr': 0.0002458474860458305, 'weight_decay': 0.0006315157193096886, 'epochs': 98, 'loss': 'mae', 'optimizer': 'adamw', 'use_snp_selection': False, 'n_pcs': 4500}. Best is trial 16 with value: 0.18445004678898375.
2026-06-01 12:24:36 | INFO | Trial 75 | outer=4 | hidden=[1024, 256] epochs=97 lr=4.998e-04 wd=4.242e-04 n_pcs=5000 weight={'name': 'uniform'}
