[I 2026-06-01 12:24:48,240] Trial 75 finished with value: 0.1886931964090641 and parameters: {'hidden_dims': '[1024, 256]', 'dropout': 0.5853573699975327, 'batch_norm': False, 'lr': 0.0004998168338311065, 'weight_decay': 0.00042424506100628614, 'epochs': 97, 'loss': 'mae', 'optimizer': 'adamw', 'use_snp_selection': False, 'n_pcs': 5000}. Best is trial 75 with value: 0.1886931964090641.
2026-06-01 12:24:48 | INFO | Trial 76 | outer=4 | hidden=[1024, 256] epochs=70 lr=4.989e-04 wd=1.139e-04 n_pcs=5000 weight={'name': 'uniform'}
[I 2026-06-01 12:24:57,509] Trial 76 finished with value: 0.17197106037018084 and parameters: {'hidden_dims': '[1024, 256]', 'dropout': 0.5278858276013882, 'batch_norm': False, 'lr': 0.0004988506269982266, 'weight_decay': 0.00011388812315577931, 'epochs': 70, 'loss': 'mae', 'optimizer': 'adamw', 'use_snp_selection': False, 'n_pcs': 5000}. Best is trial 75 with value: 0.1886931964090641.
2026-06-01 12:24:57 | INFO | Trial 77 | outer=4 | hidden=[1024, 256] epochs=97 lr=2.142e-04 wd=1.380e-04 n_pcs=4500 weight={'name': 'uniform'}
[I 2026-06-01 12:25:08,556] Trial 77 finished with value: 0.1703015125981672 and parameters: {'hidden_dims': '[1024, 256]', 'dropout': 0.4585620428493472, 'batch_norm': False, 'lr': 0.00021420391633219837, 'weight_decay': 0.00013802312591229722, 'epochs': 97, 'loss': 'mae', 'optimizer': 'adam', 'use_snp_selection': False, 'n_pcs': 4500}. Best is trial 75 with value: 0.1886931964090641.
2026-06-01 12:25:08 | INFO | Trial 78 | outer=4 | hidden=[1024, 256] epochs=85 lr=4.472e-04 wd=4.309e-04 n_pcs=4000 weight={'name': 'uniform'}
[I 2026-06-01 12:25:17,711] Trial 78 finished with value: 0.16891302310260897 and parameters: {'hidden_dims': '[1024, 256]', 'dropout': 0.5584150472450711, 'batch_norm': False, 'lr': 0.0004472182360082694, 'weight_decay': 0.0004308829164332577, 'epochs': 85, 'loss': 'mae', 'optimizer': 'adamw', 'use_snp_selection': False, 'n_pcs': 4000}. Best is trial 75 with value: 0.1886931964090641.
2026-06-01 12:25:17 | INFO | Trial 79 | outer=4 | hidden=[1024, 256] epochs=100 lr=3.267e-04 wd=6.758e-04 n_pcs=4500 weight={'name': 'uniform'}
[I 2026-06-01 12:25:29,012] Trial 79 finished with value: 0.1736139209894368 and parameters: {'hidden_dims': '[1024, 256]', 'dropout': 0.5853481082787552, 'batch_norm': False, 'lr': 0.0003267076307677458, 'weight_decay': 0.0006757631545976854, 'epochs': 100, 'loss': 'mae', 'optimizer': 'adamw', 'use_snp_selection': False, 'n_pcs': 4500}. Best is trial 75 with value: 0.1886931964090641.
2026-06-01 12:25:29 | INFO | Trial 80 | outer=4 | hidden=[1024, 256] epochs=53 lr=2.460e-04 wd=7.024e-05 n_pcs=3500 weight={'name': 'uniform'}
[I 2026-06-01 12:25:35,046] Trial 80 finished with value: 0.16922584825836479 and parameters: {'hidden_dims': '[1024, 256]', 'dropout': 0.5249294375418985, 'batch_norm': False, 'lr': 0.00024603992032309934, 'weight_decay': 7.023565039450157e-05, 'epochs': 53, 'loss': 'mae', 'optimizer': 'adam', 'use_snp_selection': False, 'n_pcs': 3500}. Best is trial 75 with value: 0.1886931964090641.
2026-06-01 12:25:35 | INFO | Trial 81 | outer=4 | hidden=[512, 128] epochs=90 lr=4.199e-04 wd=3.216e-04 n_pcs=5000 weight={'name': 'uniform'}
[I 2026-06-01 12:25:39,666] Trial 81 pruned. 
2026-06-01 12:25:39 | INFO | Trial 82 | outer=4 | hidden=[512, 128] epochs=67 lr=2.895e-04 wd=2.006e-04 n_pcs=5000 weight={'name': 'uniform'}
[I 2026-06-01 12:25:43,530] Trial 82 pruned. 
2026-06-01 12:25:43 | INFO | Trial 83 | outer=4 | hidden=[256, 64] epochs=104 lr=3.954e-04 wd=4.457e-04 n_pcs=5000 weight={'name': 'uniform'}
[I 2026-06-01 12:25:48,415] Trial 83 finished with value: 0.16922959402509197 and parameters: {'hidden_dims': '[256, 64]', 'dropout': 0.5804107398187202, 'batch_norm': False, 'lr': 0.00039540380973102703, 'weight_decay': 0.00044568610944684914, 'epochs': 104, 'loss': 'mae', 'optimizer': 'adamw', 'use_snp_selection': False, 'n_pcs': 5000}. Best is trial 75 with value: 0.1886931964090641.
2026-06-01 12:25:48 | INFO | Trial 84 | outer=4 | hidden=[512, 128] epochs=194 lr=4.674e-04 wd=6.700e-04 n_pcs=4500 weight={'name': 'uniform'}
[I 2026-06-01 12:25:59,343] Trial 84 finished with value: 0.18157644116130506 and parameters: {'hidden_dims': '[512, 128]', 'dropout': 0.5329032931655235, 'batch_norm': False, 'lr': 0.00046735865564045617, 'weight_decay': 0.000670040870147939, 'epochs': 194, 'loss': 'mae', 'optimizer': 'adamw', 'use_snp_selection': False, 'n_pcs': 4500}. Best is trial 75 with value: 0.1886931964090641.
2026-06-01 12:25:59 | INFO | Trial 85 | outer=4 | hidden=[512, 256] epochs=171 lr=4.606e-04 wd=2.788e-04 n_pcs=4500 weight={'name': 'uniform'}
[I 2026-06-01 12:26:09,716] Trial 85 finished with value: 0.17661195927540768 and parameters: {'hidden_dims': '[512, 256]', 'dropout': 0.48957560463239436, 'batch_norm': False, 'lr': 0.0004605700372889503, 'weight_decay': 0.00027876580853824687, 'epochs': 171, 'loss': 'mae', 'optimizer': 'adamw', 'use_snp_selection': False, 'n_pcs': 4500}. Best is trial 75 with value: 0.1886931964090641.
2026-06-01 12:26:09 | INFO | Trial 86 | outer=4 | hidden=[1024, 256] epochs=193 lr=3.320e-04 wd=5.643e-04 n_pcs=4500 weight={'name': 'uniform'}
[I 2026-06-01 12:26:29,276] Trial 86 finished with value: 0.18361701696483856 and parameters: {'hidden_dims': '[1024, 256]', 'dropout': 0.1307113374505738, 'batch_norm': False, 'lr': 0.0003319665693748209, 'weight_decay': 0.0005642914137989483, 'epochs': 193, 'loss': 'mae', 'optimizer': 'adamw', 'use_snp_selection': False, 'n_pcs': 4500}. Best is trial 75 with value: 0.1886931964090641.
2026-06-01 12:26:29 | INFO | Trial 87 | outer=4 | hidden=[1024, 256] epochs=202 lr=2.520e-04 wd=7.087e-04 n_pcs=4000 weight={'name': 'uniform'}
[I 2026-06-01 12:26:47,902] Trial 87 finished with value: 0.17808636364163147 and parameters: {'hidden_dims': '[1024, 256]', 'dropout': 0.07163026689370489, 'batch_norm': False, 'lr': 0.0002520297291810461, 'weight_decay': 0.0007086905145160565, 'epochs': 202, 'loss': 'mae', 'optimizer': 'adam', 'use_snp_selection': False, 'n_pcs': 4000}. Best is trial 75 with value: 0.1886931964090641.
2026-06-01 12:26:47 | INFO | Trial 88 | outer=4 | hidden=[1024, 256] epochs=180 lr=4.570e-04 wd=1.629e-04 n_pcs=4500 weight={'name': 'uniform'}
[I 2026-06-01 12:27:06,319] Trial 88 finished with value: 0.18617705545635302 and parameters: {'hidden_dims': '[1024, 256]', 'dropout': 0.1573799109611538, 'batch_norm': False, 'lr': 0.000456992936303115, 'weight_decay': 0.00016290661901219544, 'epochs': 180, 'loss': 'mae', 'optimizer': 'adamw', 'use_snp_selection': False, 'n_pcs': 4500}. Best is trial 75 with value: 0.1886931964090641.
2026-06-01 12:27:06 | INFO | Trial 89 | outer=4 | hidden=[1024, 256] epochs=196 lr=4.637e-04 wd=1.726e-04 n_pcs=4000 weight={'name': 'uniform'}
[I 2026-06-01 12:27:24,427] Trial 89 finished with value: 0.1652645338666765 and parameters: {'hidden_dims': '[1024, 256]', 'dropout': 0.15080509164357828, 'batch_norm': False, 'lr': 0.00046368923024743775, 'weight_decay': 0.00017264910227909443, 'epochs': 196, 'loss': 'mae', 'optimizer': 'adamw', 'use_snp_selection': False, 'n_pcs': 4000}. Best is trial 75 with value: 0.1886931964090641.
2026-06-01 12:27:24 | INFO | Trial 90 | outer=4 | hidden=[1024, 256] epochs=182 lr=4.932e-04 wd=5.189e-04 n_pcs=4500 weight={'name': 'uniform'}
[I 2026-06-01 12:27:43,018] Trial 90 finished with value: 0.19782220964272978 and parameters: {'hidden_dims': '[1024, 256]', 'dropout': 0.20267320840238626, 'batch_norm': False, 'lr': 0.0004931955675738154, 'weight_decay': 0.000518933324763904, 'epochs': 182, 'loss': 'mae', 'optimizer': 'adamw', 'use_snp_selection': False, 'n_pcs': 4500}. Best is trial 90 with value: 0.19782220964272978.
2026-06-01 12:27:43 | INFO | Trial 91 | outer=4 | hidden=[1024, 256] epochs=184 lr=4.941e-04 wd=5.005e-04 n_pcs=4500 weight={'name': 'uniform'}
[I 2026-06-01 12:28:01,781] Trial 91 finished with value: 0.1791551773148431 and parameters: {'hidden_dims': '[1024, 256]', 'dropout': 0.12611051102334658, 'batch_norm': False, 'lr': 0.00049406912715869, 'weight_decay': 0.0005005120382264118, 'epochs': 184, 'loss': 'mae', 'optimizer': 'adamw', 'use_snp_selection': False, 'n_pcs': 4500}. Best is trial 90 with value: 0.19782220964272978.
2026-06-01 12:28:01 | INFO | Trial 92 | outer=4 | hidden=[1024, 256] epochs=195 lr=4.186e-04 wd=3.266e-04 n_pcs=4500 weight={'name': 'uniform'}
[I 2026-06-01 12:28:21,524] Trial 92 finished with value: 0.17932612845620846 and parameters: {'hidden_dims': '[1024, 256]', 'dropout': 0.2042113839768153, 'batch_norm': False, 'lr': 0.0004185676671818626, 'weight_decay': 0.00032662603753760725, 'epochs': 195, 'loss': 'mae', 'optimizer': 'adamw', 'use_snp_selection': False, 'n_pcs': 4500}. Best is trial 90 with value: 0.19782220964272978.
2026-06-01 12:28:21 | INFO | Trial 93 | outer=4 | hidden=[1024, 256] epochs=177 lr=3.342e-04 wd=2.496e-04 n_pcs=4000 weight={'name': 'uniform'}
[I 2026-06-01 12:28:38,102] Trial 93 finished with value: 0.17977196059058193 and parameters: {'hidden_dims': '[1024, 256]', 'dropout': 0.1858001764581804, 'batch_norm': False, 'lr': 0.0003342429495991333, 'weight_decay': 0.0002495863232340484, 'epochs': 177, 'loss': 'mae', 'optimizer': 'adamw', 'use_snp_selection': False, 'n_pcs': 4000}. Best is trial 90 with value: 0.19782220964272978.
2026-06-01 12:28:38 | INFO | Trial 94 | outer=4 | hidden=[1024, 256] epochs=190 lr=3.479e-04 wd=2.517e-04 n_pcs=4000 weight={'name': 'uniform'}
[I 2026-06-01 12:28:50,353] Trial 94 pruned. 
2026-06-01 12:28:50 | INFO | Trial 95 | outer=4 | hidden=[1024, 256] epochs=212 lr=3.273e-04 wd=5.996e-04 n_pcs=3000 weight={'name': 'uniform'}
[I 2026-06-01 12:29:06,025] Trial 95 finished with value: 0.16691135736540139 and parameters: {'hidden_dims': '[1024, 256]', 'dropout': 0.19904057339519377, 'batch_norm': False, 'lr': 0.0003272905963337866, 'weight_decay': 0.0005995542731219921, 'epochs': 212, 'loss': 'mae', 'optimizer': 'adamw', 'use_snp_selection': False, 'n_pcs': 3000}. Best is trial 90 with value: 0.19782220964272978.
2026-06-01 12:29:06 | INFO | Trial 96 | outer=4 | hidden=[1024, 256] epochs=156 lr=3.911e-04 wd=9.523e-04 n_pcs=4500 weight={'name': 'uniform'}
[I 2026-06-01 12:29:22,300] Trial 96 finished with value: 0.18710821044577133 and parameters: {'hidden_dims': '[1024, 256]', 'dropout': 0.22449391378913752, 'batch_norm': False, 'lr': 0.00039114143319130625, 'weight_decay': 0.000952259328711919, 'epochs': 156, 'loss': 'mae', 'optimizer': 'adamw', 'use_snp_selection': False, 'n_pcs': 4500}. Best is trial 90 with value: 0.19782220964272978.
2026-06-01 12:29:22 | INFO | Trial 97 | outer=4 | hidden=[1024, 256] epochs=178 lr=3.951e-04 wd=9.632e-04 n_pcs=4500 weight={'name': 'uniform'}
[I 2026-06-01 12:29:40,527] Trial 97 finished with value: 0.1857674727963125 and parameters: {'hidden_dims': '[1024, 256]', 'dropout': 0.22414709691626922, 'batch_norm': False, 'lr': 0.0003951006323121923, 'weight_decay': 0.0009631667396106788, 'epochs': 178, 'loss': 'mae', 'optimizer': 'adamw', 'use_snp_selection': False, 'n_pcs': 4500}. Best is trial 90 with value: 0.19782220964272978.
2026-06-01 12:29:40 | INFO | Trial 98 | outer=4 | hidden=[1024, 256] epochs=181 lr=3.932e-04 wd=9.129e-04 n_pcs=4500 weight={'name': 'uniform'}
[I 2026-06-01 12:29:59,018] Trial 98 finished with value: 0.17583844619730413 and parameters: {'hidden_dims': '[1024, 256]', 'dropout': 0.2131070516186077, 'batch_norm': False, 'lr': 0.00039321114834342253, 'weight_decay': 0.000912896594783644, 'epochs': 181, 'loss': 'mae', 'optimizer': 'adamw', 'use_snp_selection': False, 'n_pcs': 4500}. Best is trial 90 with value: 0.19782220964272978.
2026-06-01 12:29:59 | INFO | Trial 99 | outer=4 | hidden=[128, 64] epochs=167 lr=4.332e-04 wd=9.904e-04 n_pcs=4500 weight={'name': 'uniform'}
[I 2026-06-01 12:30:03,489] Trial 99 finished with value: 0.16900887020944236 and parameters: {'hidden_dims': '[128, 64]', 'dropout': 0.23562180603270022, 'batch_norm': False, 'lr': 0.00043316333990004943, 'weight_decay': 0.0009903543895840724, 'epochs': 167, 'loss': 'mae', 'optimizer': 'adamw', 'use_snp_selection': False, 'n_pcs': 4500}. Best is trial 90 with value: 0.19782220964272978.
2026-06-01 12:30:03 | INFO | Trial 100 | outer=4 | hidden=[1024, 256] epochs=155 lr=4.983e-04 wd=3.650e-04 n_pcs=4500 weight={'name': 'uniform'}
[I 2026-06-01 12:30:14,770] Trial 100 pruned. 
2026-06-01 12:30:14 | INFO | Trial 101 | outer=4 | hidden=[1024, 256] epochs=177 lr=3.952e-04 wd=4.860e-04 n_pcs=4000 weight={'name': 'uniform'}
[I 2026-06-01 12:30:31,342] Trial 101 finished with value: 0.1723671868571966 and parameters: {'hidden_dims': '[1024, 256]', 'dropout': 0.17635713808990294, 'batch_norm': False, 'lr': 0.0003952126733713906, 'weight_decay': 0.00048603872946202545, 'epochs': 177, 'loss': 'mae', 'optimizer': 'adamw', 'use_snp_selection': False, 'n_pcs': 4000}. Best is trial 90 with value: 0.19782220964272978.
2026-06-01 12:30:31 | INFO | Trial 102 | outer=4 | hidden=[1024, 256] epochs=205 lr=4.465e-04 wd=2.418e-04 n_pcs=4500 weight={'name': 'uniform'}
[I 2026-06-01 12:30:51,983] Trial 102 finished with value: 0.18362647066546706 and parameters: {'hidden_dims': '[1024, 256]', 'dropout': 0.1354138237996185, 'batch_norm': False, 'lr': 0.0004464838801004021, 'weight_decay': 0.000241829785900517, 'epochs': 205, 'loss': 'mae', 'optimizer': 'adamw', 'use_snp_selection': False, 'n_pcs': 4500}. Best is trial 90 with value: 0.19782220964272978.
2026-06-01 12:30:52 | INFO | Trial 103 | outer=4 | hidden=[1024, 256] epochs=209 lr=4.462e-04 wd=7.289e-04 n_pcs=4500 weight={'name': 'uniform'}
[I 2026-06-01 12:31:12,988] Trial 103 finished with value: 0.18996995041246909 and parameters: {'hidden_dims': '[1024, 256]', 'dropout': 0.13168624413636876, 'batch_norm': False, 'lr': 0.0004461875446514077, 'weight_decay': 0.0007288880073857827, 'epochs': 209, 'loss': 'mae', 'optimizer': 'adamw', 'use_snp_selection': False, 'n_pcs': 4500}. Best is trial 90 with value: 0.19782220964272978.
2026-06-01 12:31:13 | INFO | Trial 104 | outer=4 | hidden=[1024, 256] epochs=204 lr=4.524e-04 wd=7.041e-04 n_pcs=4500 weight={'name': 'uniform'}
[I 2026-06-01 12:31:33,536] Trial 104 finished with value: 0.1880019109949732 and parameters: {'hidden_dims': '[1024, 256]', 'dropout': 0.08877899582458387, 'batch_norm': False, 'lr': 0.00045244970340751925, 'weight_decay': 0.0007040739110645582, 'epochs': 204, 'loss': 'mae', 'optimizer': 'adamw', 'use_snp_selection': False, 'n_pcs': 4500}. Best is trial 90 with value: 0.19782220964272978.
2026-06-01 12:31:33 | INFO | Trial 105 | outer=4 | hidden=[1024, 256] epochs=208 lr=4.200e-04 wd=3.681e-04 n_pcs=5000 weight={'name': 'uniform'}
[I 2026-06-01 12:31:56,115] Trial 105 finished with value: 0.19066997660440604 and parameters: {'hidden_dims': '[1024, 256]', 'dropout': 0.07372036541217938, 'batch_norm': False, 'lr': 0.0004200173916959456, 'weight_decay': 0.0003681181346213299, 'epochs': 208, 'loss': 'mae', 'optimizer': 'adamw', 'use_snp_selection': False, 'n_pcs': 5000}. Best is trial 90 with value: 0.19782220964272978.
2026-06-01 12:31:56 | INFO | Trial 106 | outer=4 | hidden=[1024, 256] epochs=232 lr=4.598e-04 wd=1.567e-04 n_pcs=5000 weight={'name': 'uniform'}
[I 2026-06-01 12:32:13,411] Trial 106 pruned. 
2026-06-01 12:32:13 | INFO | Trial 107 | outer=4 | hidden=[1024, 256] epochs=207 lr=4.155e-04 wd=2.160e-04 n_pcs=5000 weight={'name': 'uniform'}
[I 2026-06-01 12:32:35,892] Trial 107 finished with value: 0.18011141685239096 and parameters: {'hidden_dims': '[1024, 256]', 'dropout': 0.07601105729835675, 'batch_norm': False, 'lr': 0.00041554349692198033, 'weight_decay': 0.00021600714730162895, 'epochs': 207, 'loss': 'mae', 'optimizer': 'adamw', 'use_snp_selection': False, 'n_pcs': 5000}. Best is trial 90 with value: 0.19782220964272978.
2026-06-01 12:32:35 | INFO | Trial 108 | outer=4 | hidden=[1024, 256] epochs=201 lr=4.373e-04 wd=7.504e-04 n_pcs=5000 weight={'name': 'uniform'}
[I 2026-06-01 12:32:57,771] Trial 108 finished with value: 0.1848638917376601 and parameters: {'hidden_dims': '[1024, 256]', 'dropout': 0.050484662596269186, 'batch_norm': False, 'lr': 0.0004372899734547777, 'weight_decay': 0.0007504383306113381, 'epochs': 201, 'loss': 'mae', 'optimizer': 'adamw', 'use_snp_selection': False, 'n_pcs': 5000}. Best is trial 90 with value: 0.19782220964272978.
2026-06-01 12:32:57 | INFO | Trial 109 | outer=4 | hidden=[1024, 256] epochs=215 lr=3.963e-04 wd=7.468e-04 n_pcs=5000 weight={'name': 'uniform'}
[I 2026-06-01 12:33:21,025] Trial 109 finished with value: 0.18461802378284636 and parameters: {'hidden_dims': '[1024, 256]', 'dropout': 0.059930880134250256, 'batch_norm': False, 'lr': 0.0003962525109986312, 'weight_decay': 0.0007468381071159404, 'epochs': 215, 'loss': 'mae', 'optimizer': 'adamw', 'use_snp_selection': False, 'n_pcs': 5000}. Best is trial 90 with value: 0.19782220964272978.
2026-06-01 12:33:21 | INFO | Trial 110 | outer=4 | hidden=[1024, 256] epochs=213 lr=3.006e-04 wd=8.244e-04 n_pcs=5000 weight={'name': 'uniform'}
[I 2026-06-01 12:33:44,080] Trial 110 finished with value: 0.18176378253561537 and parameters: {'hidden_dims': '[1024, 256]', 'dropout': 0.049319794928153055, 'batch_norm': False, 'lr': 0.00030063941165952494, 'weight_decay': 0.0008244081422526576, 'epochs': 213, 'loss': 'mae', 'optimizer': 'adamw', 'use_snp_selection': False, 'n_pcs': 5000}. Best is trial 90 with value: 0.19782220964272978.
2026-06-01 12:33:44 | INFO | Trial 111 | outer=4 | hidden=[1024, 256] epochs=220 lr=3.771e-04 wd=3.625e-04 n_pcs=5000 weight={'name': 'uniform'}
[I 2026-06-01 12:34:07,815] Trial 111 finished with value: 0.17734686109296022 and parameters: {'hidden_dims': '[1024, 256]', 'dropout': 0.03969433084441669, 'batch_norm': False, 'lr': 0.0003771365551966641, 'weight_decay': 0.0003624906302115397, 'epochs': 220, 'loss': 'mae', 'optimizer': 'adamw', 'use_snp_selection': False, 'n_pcs': 5000}. Best is trial 90 with value: 0.19782220964272978.
2026-06-01 12:34:07 | INFO | Trial 112 | outer=4 | hidden=[1024, 256] epochs=200 lr=4.265e-04 wd=7.005e-04 n_pcs=5000 weight={'name': 'uniform'}
[I 2026-06-01 12:34:29,639] Trial 112 finished with value: 0.1891058534564721 and parameters: {'hidden_dims': '[1024, 256]', 'dropout': 0.09206644879635761, 'batch_norm': False, 'lr': 0.000426511034261489, 'weight_decay': 0.0007004853153415011, 'epochs': 200, 'loss': 'mae', 'optimizer': 'adamw', 'use_snp_selection': False, 'n_pcs': 5000}. Best is trial 90 with value: 0.19782220964272978.
2026-06-01 12:34:29 | INFO | Trial 113 | outer=4 | hidden=[1024, 256] epochs=215 lr=4.136e-04 wd=9.960e-04 n_pcs=5000 weight={'name': 'uniform'}
[I 2026-06-01 12:34:52,878] Trial 113 finished with value: 0.19348223046035562 and parameters: {'hidden_dims': '[1024, 256]', 'dropout': 0.08698541356222109, 'batch_norm': False, 'lr': 0.0004135977273750112, 'weight_decay': 0.0009960161816433125, 'epochs': 215, 'loss': 'mae', 'optimizer': 'adamw', 'use_snp_selection': False, 'n_pcs': 5000}. Best is trial 90 with value: 0.19782220964272978.
2026-06-01 12:34:52 | INFO | Trial 114 | outer=4 | hidden=[1024, 256] epochs=227 lr=4.050e-04 wd=7.418e-04 n_pcs=5000 weight={'name': 'uniform'}
[I 2026-06-01 12:35:17,284] Trial 114 finished with value: 0.1774591832418444 and parameters: {'hidden_dims': '[1024, 256]', 'dropout': 0.0912605636168107, 'batch_norm': False, 'lr': 0.0004050498595997297, 'weight_decay': 0.0007417602659918784, 'epochs': 227, 'loss': 'mae', 'optimizer': 'adamw', 'use_snp_selection': False, 'n_pcs': 5000}. Best is trial 90 with value: 0.19782220964272978.
2026-06-01 12:35:17 | INFO | Trial 115 | outer=4 | hidden=[1024, 256] epochs=242 lr=4.999e-04 wd=9.853e-04 n_pcs=5000 weight={'name': 'uniform'}
[I 2026-06-01 12:35:43,160] Trial 115 finished with value: 0.18011995540591122 and parameters: {'hidden_dims': '[1024, 256]', 'dropout': 0.06823176304266929, 'batch_norm': False, 'lr': 0.0004999056605879183, 'weight_decay': 0.0009853325512263133, 'epochs': 242, 'loss': 'mae', 'optimizer': 'adamw', 'use_snp_selection': False, 'n_pcs': 5000}. Best is trial 90 with value: 0.19782220964272978.
2026-06-01 12:35:43 | INFO | Trial 116 | outer=4 | hidden=[1024, 256] epochs=201 lr=3.541e-04 wd=7.488e-04 n_pcs=5000 weight={'name': 'uniform'}
[I 2026-06-01 12:36:05,054] Trial 116 finished with value: 0.17692282724129257 and parameters: {'hidden_dims': '[1024, 256]', 'dropout': 0.10461074219874567, 'batch_norm': False, 'lr': 0.0003541190812461387, 'weight_decay': 0.0007488295051342571, 'epochs': 201, 'loss': 'mae', 'optimizer': 'adamw', 'use_snp_selection': False, 'n_pcs': 5000}. Best is trial 90 with value: 0.19782220964272978.
2026-06-01 12:36:05 | INFO | Trial 117 | outer=4 | hidden=[1024, 256] epochs=214 lr=4.295e-04 wd=5.174e-04 n_pcs=5000 weight={'name': 'uniform'}
[I 2026-06-01 12:36:28,213] Trial 117 finished with value: 0.18504005780128926 and parameters: {'hidden_dims': '[1024, 256]', 'dropout': 0.04713527722956996, 'batch_norm': False, 'lr': 0.00042948546210846744, 'weight_decay': 0.0005174476650864397, 'epochs': 214, 'loss': 'mae', 'optimizer': 'adamw', 'use_snp_selection': False, 'n_pcs': 5000}. Best is trial 90 with value: 0.19782220964272978.
2026-06-01 12:36:28 | INFO | Trial 118 | outer=4 | hidden=[1024, 256] epochs=200 lr=4.281e-04 wd=5.340e-04 n_pcs=5000 weight={'name': 'uniform'}
[I 2026-06-01 12:36:50,033] Trial 118 finished with value: 0.19331148889248656 and parameters: {'hidden_dims': '[1024, 256]', 'dropout': 0.003484151992621816, 'batch_norm': False, 'lr': 0.00042814346588922165, 'weight_decay': 0.0005340054515945303, 'epochs': 200, 'loss': 'mae', 'optimizer': 'adamw', 'use_snp_selection': False, 'n_pcs': 5000}. Best is trial 90 with value: 0.19782220964272978.
2026-06-01 12:36:50 | INFO | Trial 119 | outer=4 | hidden=[1024, 256] epochs=206 lr=7.484e-05 wd=5.200e-04 n_pcs=5000 weight={'name': 'uniform'}
