[I 2026-06-01 15:22:26,965] Trial 40 finished with value: 0.18606151687393296 and parameters: {'hidden_dims': '[256, 128]', 'dropout': 0.38466175913023876, 'batch_norm': False, 'lr': 4.668976744276585e-05, 'weight_decay': 2.7057071476008626e-05, 'epochs': 183, 'loss': 'mse', 'optimizer': 'adam', 'use_snp_selection': False, 'n_pcs': 1500}. Best is trial 38 with value: 0.21419786323691362.
2026-06-01 15:22:26 | INFO | Trial 41 | outer=13 | hidden=[512, 256] epochs=103 lr=1.329e-04 wd=6.108e-05 n_pcs=1000 weight={'name': 'uniform'}
[I 2026-06-01 15:22:30,307] Trial 41 finished with value: 0.19710923587120763 and parameters: {'hidden_dims': '[512, 256]', 'dropout': 0.4552574993159882, 'batch_norm': False, 'lr': 0.00013288790183205477, 'weight_decay': 6.107727094322606e-05, 'epochs': 103, 'loss': 'mse', 'optimizer': 'adam', 'use_snp_selection': False, 'n_pcs': 1000}. Best is trial 38 with value: 0.21419786323691362.
2026-06-01 15:22:30 | INFO | Trial 42 | outer=13 | hidden=[512, 256] epochs=148 lr=9.079e-05 wd=4.160e-06 n_pcs=1000 weight={'name': 'uniform'}
[I 2026-06-01 15:22:34,421] Trial 42 finished with value: 0.20797404918138604 and parameters: {'hidden_dims': '[512, 256]', 'dropout': 0.49658706439796485, 'batch_norm': False, 'lr': 9.078860065002375e-05, 'weight_decay': 4.1595090792397825e-06, 'epochs': 148, 'loss': 'mse', 'optimizer': 'adam', 'use_snp_selection': False, 'n_pcs': 1000}. Best is trial 38 with value: 0.21419786323691362.
2026-06-01 15:22:34 | INFO | Trial 43 | outer=13 | hidden=[512, 256] epochs=145 lr=8.672e-05 wd=4.793e-06 n_pcs=5000 weight={'name': 'uniform'}
[I 2026-06-01 15:22:40,063] Trial 43 pruned. 
2026-06-01 15:22:40 | INFO | Trial 44 | outer=13 | hidden=[512, 256] epochs=206 lr=8.904e-05 wd=8.711e-06 n_pcs=500 weight={'name': 'uniform'}
[I 2026-06-01 15:22:44,231] Trial 44 finished with value: 0.18951406625026368 and parameters: {'hidden_dims': '[512, 256]', 'dropout': 0.4835233749577969, 'batch_norm': False, 'lr': 8.904007963189048e-05, 'weight_decay': 8.711178439778322e-06, 'epochs': 206, 'loss': 'mse', 'optimizer': 'adam', 'use_snp_selection': False, 'n_pcs': 500}. Best is trial 38 with value: 0.21419786323691362.
2026-06-01 15:22:44 | INFO | Trial 45 | outer=13 | hidden=[512, 64] epochs=170 lr=6.222e-05 wd=5.010e-08 n_pcs=1000 weight={'name': 'uniform'}
[I 2026-06-01 15:22:48,167] Trial 45 finished with value: 0.20394714990514 and parameters: {'hidden_dims': '[512, 64]', 'dropout': 0.3661102668613666, 'batch_norm': False, 'lr': 6.221795050465943e-05, 'weight_decay': 5.009573110315823e-08, 'epochs': 170, 'loss': 'mse', 'optimizer': 'adam', 'use_snp_selection': False, 'n_pcs': 1000}. Best is trial 38 with value: 0.21419786323691362.
2026-06-01 15:22:48 | INFO | Trial 46 | outer=13 | hidden=[512, 256] epochs=155 lr=1.030e-05 wd=3.625e-06 n_pcs=500 weight={'name': 'uniform'}
[I 2026-06-01 15:22:50,312] Trial 46 pruned. 
2026-06-01 15:22:50 | INFO | Trial 47 | outer=13 | hidden=[128, 64] epochs=135 lr=1.480e-04 wd=1.035e-05 n_pcs=1500 weight={'name': 'uniform'}
[I 2026-06-01 15:22:53,623] Trial 47 finished with value: 0.18084680391881383 and parameters: {'hidden_dims': '[128, 64]', 'dropout': 0.46408157134062356, 'batch_norm': False, 'lr': 0.000148008757967005, 'weight_decay': 1.0352534081168127e-05, 'epochs': 135, 'loss': 'mse', 'optimizer': 'adam', 'use_snp_selection': False, 'n_pcs': 1500}. Best is trial 38 with value: 0.21419786323691362.
2026-06-01 15:22:53 | INFO | Trial 48 | outer=13 | hidden=[256, 64] epochs=189 lr=1.254e-04 wd=4.788e-07 n_pcs=4500 weight={'name': 'uniform'}
[I 2026-06-01 15:23:00,159] Trial 48 finished with value: 0.1879715536179265 and parameters: {'hidden_dims': '[256, 64]', 'dropout': 0.5043756974354543, 'batch_norm': False, 'lr': 0.00012535615649835849, 'weight_decay': 4.788287222037821e-07, 'epochs': 189, 'loss': 'mse', 'optimizer': 'adam', 'use_snp_selection': False, 'n_pcs': 4500}. Best is trial 38 with value: 0.21419786323691362.
2026-06-01 15:23:00 | INFO | Trial 49 | outer=13 | hidden=[512, 256] epochs=102 lr=1.119e-04 wd=3.077e-06 n_pcs=1000 weight={'name': 'uniform'}
[I 2026-06-01 15:23:03,507] Trial 49 finished with value: 0.20011646689857504 and parameters: {'hidden_dims': '[512, 256]', 'dropout': 0.4318685798635766, 'batch_norm': False, 'lr': 0.00011185572337721501, 'weight_decay': 3.0766000898626515e-06, 'epochs': 102, 'loss': 'mse', 'optimizer': 'adam', 'use_snp_selection': False, 'n_pcs': 1000}. Best is trial 38 with value: 0.21419786323691362.
2026-06-01 15:23:03 | INFO | Trial 50 | outer=13 | hidden=[512, 256] epochs=147 lr=4.708e-05 wd=2.410e-05 n_pcs=1500 weight={'name': 'uniform'}
[I 2026-06-01 15:23:08,301] Trial 50 finished with value: 0.20054624648523722 and parameters: {'hidden_dims': '[512, 256]', 'dropout': 0.012391056927232802, 'batch_norm': False, 'lr': 4.708147807835887e-05, 'weight_decay': 2.410284475539059e-05, 'epochs': 147, 'loss': 'mse', 'optimizer': 'adam', 'use_snp_selection': False, 'n_pcs': 1500}. Best is trial 38 with value: 0.21419786323691362.
2026-06-01 15:23:08 | INFO | Trial 51 | outer=13 | hidden=[512, 256] epochs=123 lr=1.580e-04 wd=6.355e-05 n_pcs=1000 weight={'name': 'uniform'}
[I 2026-06-01 15:23:11,984] Trial 51 finished with value: 0.21659556752698053 and parameters: {'hidden_dims': '[512, 256]', 'dropout': 0.4318114691494992, 'batch_norm': False, 'lr': 0.000158036810105468, 'weight_decay': 6.355428715988835e-05, 'epochs': 123, 'loss': 'mse', 'optimizer': 'adam', 'use_snp_selection': False, 'n_pcs': 1000}. Best is trial 51 with value: 0.21659556752698053.
2026-06-01 15:23:11 | INFO | Trial 52 | outer=13 | hidden=[512, 256] epochs=113 lr=1.652e-04 wd=5.895e-06 n_pcs=1000 weight={'name': 'uniform'}
[I 2026-06-01 15:23:14,132] Trial 52 pruned. 
2026-06-01 15:23:14 | INFO | Trial 53 | outer=13 | hidden=[512, 256] epochs=138 lr=2.134e-04 wd=4.653e-05 n_pcs=1500 weight={'name': 'uniform'}
[I 2026-06-01 15:23:16,932] Trial 53 pruned. 
2026-06-01 15:23:16 | INFO | Trial 54 | outer=13 | hidden=[512, 256] epochs=169 lr=1.533e-04 wd=1.607e-05 n_pcs=500 weight={'name': 'uniform'}
[I 2026-06-01 15:23:20,617] Trial 54 finished with value: 0.17365661536784177 and parameters: {'hidden_dims': '[512, 256]', 'dropout': 0.44794319839807767, 'batch_norm': False, 'lr': 0.000153316865175582, 'weight_decay': 1.607177998155403e-05, 'epochs': 169, 'loss': 'mse', 'optimizer': 'adam', 'use_snp_selection': False, 'n_pcs': 500}. Best is trial 51 with value: 0.21659556752698053.
2026-06-01 15:23:20 | INFO | Trial 55 | outer=13 | hidden=[256, 128] epochs=220 lr=9.196e-05 wd=1.589e-07 n_pcs=1000 weight={'name': 'uniform'}
[I 2026-06-01 15:23:24,717] Trial 55 finished with value: 0.21253117709239416 and parameters: {'hidden_dims': '[256, 128]', 'dropout': 0.49152016849130953, 'batch_norm': False, 'lr': 9.195717015845829e-05, 'weight_decay': 1.5887069837518883e-07, 'epochs': 220, 'loss': 'mse', 'optimizer': 'adam', 'use_snp_selection': False, 'n_pcs': 1000}. Best is trial 51 with value: 0.21659556752698053.
2026-06-01 15:23:24 | INFO | Trial 56 | outer=13 | hidden=[256, 64] epochs=247 lr=1.183e-04 wd=1.389e-07 n_pcs=1500 weight={'name': 'uniform'}
[I 2026-06-01 15:23:27,428] Trial 56 pruned. 
2026-06-01 15:23:27 | INFO | Trial 57 | outer=13 | hidden=[256, 128] epochs=226 lr=7.162e-05 wd=3.696e-08 n_pcs=500 weight={'name': 'uniform'}
[I 2026-06-01 15:23:31,641] Trial 57 finished with value: 0.17878408901570494 and parameters: {'hidden_dims': '[256, 128]', 'dropout': 0.36430615819733214, 'batch_norm': False, 'lr': 7.161828261709046e-05, 'weight_decay': 3.6962005189461096e-08, 'epochs': 226, 'loss': 'mse', 'optimizer': 'adam', 'use_snp_selection': False, 'n_pcs': 500}. Best is trial 51 with value: 0.21659556752698053.
2026-06-01 15:23:31 | INFO | Trial 58 | outer=13 | hidden=[256, 128] epochs=224 lr=2.157e-04 wd=7.840e-08 n_pcs=1000 weight={'name': 'uniform'}
[I 2026-06-01 15:23:35,823] Trial 58 finished with value: 0.19823658702259442 and parameters: {'hidden_dims': '[256, 128]', 'dropout': 0.5222710005339476, 'batch_norm': False, 'lr': 0.0002157388018594414, 'weight_decay': 7.839977858955569e-08, 'epochs': 224, 'loss': 'mse', 'optimizer': 'adam', 'use_snp_selection': False, 'n_pcs': 1000}. Best is trial 51 with value: 0.21659556752698053.
2026-06-01 15:23:35 | INFO | Trial 59 | outer=13 | hidden=[256, 128] epochs=121 lr=2.772e-04 wd=4.393e-04 n_pcs=1500 weight={'name': 'uniform'}
[I 2026-06-01 15:23:37,689] Trial 59 pruned. 
2026-06-01 15:23:37 | INFO | Trial 60 | outer=13 | hidden=[128, 64] epochs=279 lr=1.420e-04 wd=2.202e-07 n_pcs=3500 weight={'name': 'uniform'}
[I 2026-06-01 15:23:40,946] Trial 60 pruned. 
2026-06-01 15:23:40 | INFO | Trial 61 | outer=13 | hidden=[256, 128] epochs=152 lr=9.199e-05 wd=1.562e-06 n_pcs=1000 weight={'name': 'uniform'}
[I 2026-06-01 15:23:44,269] Trial 61 finished with value: 0.20480188360866824 and parameters: {'hidden_dims': '[256, 128]', 'dropout': 0.4819161861988764, 'batch_norm': False, 'lr': 9.199423944912073e-05, 'weight_decay': 1.5620493192704573e-06, 'epochs': 152, 'loss': 'mse', 'optimizer': 'adam', 'use_snp_selection': False, 'n_pcs': 1000}. Best is trial 51 with value: 0.21659556752698053.
2026-06-01 15:23:44 | INFO | Trial 62 | outer=13 | hidden=[512, 256] epochs=179 lr=9.396e-05 wd=4.101e-05 n_pcs=1000 weight={'name': 'uniform'}
[I 2026-06-01 15:23:48,904] Trial 62 finished with value: 0.19471528987306794 and parameters: {'hidden_dims': '[512, 256]', 'dropout': 0.5043545944889609, 'batch_norm': False, 'lr': 9.396373716111742e-05, 'weight_decay': 4.1008800560142217e-05, 'epochs': 179, 'loss': 'mse', 'optimizer': 'adam', 'use_snp_selection': False, 'n_pcs': 1000}. Best is trial 51 with value: 0.21659556752698053.
2026-06-01 15:23:48 | INFO | Trial 63 | outer=13 | hidden=[512, 64] epochs=97 lr=8.196e-05 wd=1.062e-04 n_pcs=1000 weight={'name': 'uniform'}
[I 2026-06-01 15:23:50,682] Trial 63 pruned. 
2026-06-01 15:23:50 | INFO | Trial 64 | outer=13 | hidden=[512, 256] epochs=128 lr=1.176e-04 wd=1.667e-04 n_pcs=1500 weight={'name': 'uniform'}
[I 2026-06-01 15:23:53,358] Trial 64 pruned. 
2026-06-01 15:23:53 | INFO | Trial 65 | outer=13 | hidden=[512, 256] epochs=108 lr=1.669e-04 wd=2.486e-05 n_pcs=500 weight={'name': 'uniform'}
[I 2026-06-01 15:23:55,137] Trial 65 pruned. 
2026-06-01 15:23:55 | INFO | Trial 66 | outer=13 | hidden=[512, 256] epochs=83 lr=1.010e-04 wd=4.491e-07 n_pcs=1000 weight={'name': 'uniform'}
[I 2026-06-01 15:23:58,164] Trial 66 finished with value: 0.19758104128596635 and parameters: {'hidden_dims': '[512, 256]', 'dropout': 0.442934213447759, 'batch_norm': False, 'lr': 0.00010103552986600933, 'weight_decay': 4.490890789774453e-07, 'epochs': 83, 'loss': 'mse', 'optimizer': 'adam', 'use_snp_selection': False, 'n_pcs': 1000}. Best is trial 51 with value: 0.21659556752698053.
2026-06-01 15:23:58 | INFO | Trial 67 | outer=13 | hidden=[256, 128] epochs=164 lr=6.699e-05 wd=2.908e-08 n_pcs=2000 weight={'name': 'uniform'}
[I 2026-06-01 15:24:00,540] Trial 67 pruned. 
2026-06-01 15:24:00 | INFO | Trial 68 | outer=13 | hidden=[512, 256] epochs=136 lr=3.623e-04 wd=1.341e-07 n_pcs=1500 weight={'name': 'uniform'}
[I 2026-06-01 15:24:03,322] Trial 68 pruned. 
2026-06-01 15:24:03 | INFO | Trial 69 | outer=13 | hidden=[256, 64] epochs=266 lr=2.446e-04 wd=1.117e-05 n_pcs=500 weight={'name': 'uniform'}
[I 2026-06-01 15:24:06,081] Trial 69 pruned. 
2026-06-01 15:24:06 | INFO | Trial 70 | outer=13 | hidden=[512, 128] epochs=199 lr=7.845e-05 wd=4.842e-06 n_pcs=1000 weight={'name': 'uniform'}
[I 2026-06-01 15:24:10,607] Trial 70 finished with value: 0.2060889573192144 and parameters: {'hidden_dims': '[512, 128]', 'dropout': 0.4747097957507901, 'batch_norm': False, 'lr': 7.844534392581267e-05, 'weight_decay': 4.841960552814659e-06, 'epochs': 199, 'loss': 'mae', 'optimizer': 'adamw', 'use_snp_selection': False, 'n_pcs': 1000}. Best is trial 51 with value: 0.21659556752698053.
2026-06-01 15:24:10 | INFO | Trial 71 | outer=13 | hidden=[512, 256] epochs=124 lr=1.883e-04 wd=5.759e-05 n_pcs=1000 weight={'name': 'uniform'}
[I 2026-06-01 15:24:14,309] Trial 71 finished with value: 0.22019119234091403 and parameters: {'hidden_dims': '[512, 256]', 'dropout': 0.4203575421611455, 'batch_norm': False, 'lr': 0.0001882941349859572, 'weight_decay': 5.758828890364278e-05, 'epochs': 124, 'loss': 'mae', 'optimizer': 'adamw', 'use_snp_selection': False, 'n_pcs': 1000}. Best is trial 71 with value: 0.22019119234091403.
2026-06-01 15:24:14 | INFO | Trial 72 | outer=13 | hidden=[512, 256] epochs=122 lr=1.923e-04 wd=8.360e-05 n_pcs=1000 weight={'name': 'uniform'}
[I 2026-06-01 15:24:17,981] Trial 72 finished with value: 0.2077756782444975 and parameters: {'hidden_dims': '[512, 256]', 'dropout': 0.4914573553744738, 'batch_norm': False, 'lr': 0.00019234912720724086, 'weight_decay': 8.359839636080527e-05, 'epochs': 122, 'loss': 'mae', 'optimizer': 'adamw', 'use_snp_selection': False, 'n_pcs': 1000}. Best is trial 71 with value: 0.22019119234091403.
2026-06-01 15:24:17 | INFO | Trial 73 | outer=13 | hidden=[512, 256] epochs=110 lr=1.437e-04 wd=5.981e-05 n_pcs=500 weight={'name': 'uniform'}
[I 2026-06-01 15:24:20,914] Trial 73 finished with value: 0.16182664162754581 and parameters: {'hidden_dims': '[512, 256]', 'dropout': 0.4226119300528875, 'batch_norm': False, 'lr': 0.00014370151062919115, 'weight_decay': 5.9812473453010815e-05, 'epochs': 110, 'loss': 'mae', 'optimizer': 'adamw', 'use_snp_selection': False, 'n_pcs': 500}. Best is trial 71 with value: 0.22019119234091403.
2026-06-01 15:24:20 | INFO | Trial 74 | outer=13 | hidden=[512, 256] epochs=118 lr=2.542e-05 wd=3.123e-05 n_pcs=1000 weight={'name': 'uniform'}
[I 2026-06-01 15:24:23,108] Trial 74 pruned. 
2026-06-01 15:24:23 | INFO | Trial 75 | outer=13 | hidden=[512, 256] epochs=133 lr=1.284e-04 wd=1.812e-04 n_pcs=1500 weight={'name': 'uniform'}
[I 2026-06-01 15:24:27,587] Trial 75 finished with value: 0.18307864566879709 and parameters: {'hidden_dims': '[512, 256]', 'dropout': 0.4476102008971609, 'batch_norm': False, 'lr': 0.0001284187936481799, 'weight_decay': 0.00018117996393373376, 'epochs': 133, 'loss': 'mae', 'optimizer': 'adamw', 'use_snp_selection': False, 'n_pcs': 1500}. Best is trial 71 with value: 0.22019119234091403.
2026-06-01 15:24:27 | INFO | Trial 76 | outer=13 | hidden=[128, 64] epochs=145 lr=1.777e-04 wd=1.921e-05 n_pcs=1000 weight={'name': 'uniform'}
[I 2026-06-01 15:24:30,861] Trial 76 finished with value: 0.20202071412818395 and parameters: {'hidden_dims': '[128, 64]', 'dropout': 0.4596518934662084, 'batch_norm': False, 'lr': 0.00017772742803485412, 'weight_decay': 1.920589153766268e-05, 'epochs': 145, 'loss': 'mae', 'optimizer': 'adamw', 'use_snp_selection': False, 'n_pcs': 1000}. Best is trial 71 with value: 0.22019119234091403.
2026-06-01 15:24:30 | INFO | Trial 77 | outer=13 | hidden=[512, 256] epochs=100 lr=2.026e-04 wd=7.078e-07 n_pcs=500 weight={'name': 'uniform'}
[I 2026-06-01 15:24:33,669] Trial 77 finished with value: 0.17427241794351633 and parameters: {'hidden_dims': '[512, 256]', 'dropout': 0.511562121720809, 'batch_norm': False, 'lr': 0.0002025597429453092, 'weight_decay': 7.078223785722369e-07, 'epochs': 100, 'loss': 'mae', 'optimizer': 'adamw', 'use_snp_selection': False, 'n_pcs': 500}. Best is trial 71 with value: 0.22019119234091403.
2026-06-01 15:24:33 | INFO | Trial 78 | outer=13 | hidden=[512, 256] epochs=164 lr=2.417e-04 wd=4.672e-05 n_pcs=1500 weight={'name': 'uniform'}
[I 2026-06-01 15:24:36,811] Trial 78 pruned. 
2026-06-01 15:24:36 | INFO | Trial 79 | outer=13 | hidden=[512, 64] epochs=62 lr=1.606e-04 wd=4.100e-04 n_pcs=1000 weight={'name': 'uniform'}
[I 2026-06-01 15:24:39,259] Trial 79 finished with value: 0.20590777100104335 and parameters: {'hidden_dims': '[512, 64]', 'dropout': 0.4208373390483354, 'batch_norm': False, 'lr': 0.00016060570695653584, 'weight_decay': 0.0004099779174584724, 'epochs': 62, 'loss': 'mse', 'optimizer': 'adamw', 'use_snp_selection': False, 'n_pcs': 1000}. Best is trial 71 with value: 0.22019119234091403.
2026-06-01 15:24:39 | INFO | Trial 80 | outer=13 | hidden=[512, 256] epochs=90 lr=1.021e-04 wd=1.312e-04 n_pcs=1000 weight={'name': 'uniform'}
[I 2026-06-01 15:24:42,391] Trial 80 finished with value: 0.18721605616091505 and parameters: {'hidden_dims': '[512, 256]', 'dropout': 0.28849066008638685, 'batch_norm': False, 'lr': 0.00010208694067260578, 'weight_decay': 0.0001311613297994295, 'epochs': 90, 'loss': 'mse', 'optimizer': 'adam', 'use_snp_selection': False, 'n_pcs': 1000}. Best is trial 71 with value: 0.22019119234091403.
2026-06-01 15:24:42 | INFO | Trial 81 | outer=13 | hidden=[512, 256] epochs=124 lr=1.803e-04 wd=8.219e-05 n_pcs=1000 weight={'name': 'uniform'}
[I 2026-06-01 15:24:46,095] Trial 81 finished with value: 0.2112596103405462 and parameters: {'hidden_dims': '[512, 256]', 'dropout': 0.48710254605031555, 'batch_norm': False, 'lr': 0.00018034973091729127, 'weight_decay': 8.218950749208039e-05, 'epochs': 124, 'loss': 'mae', 'optimizer': 'adamw', 'use_snp_selection': False, 'n_pcs': 1000}. Best is trial 71 with value: 0.22019119234091403.
2026-06-01 15:24:46 | INFO | Trial 82 | outer=13 | hidden=[512, 256] epochs=114 lr=1.347e-04 wd=7.251e-05 n_pcs=1000 weight={'name': 'uniform'}
[I 2026-06-01 15:24:49,629] Trial 82 finished with value: 0.19814328058254616 and parameters: {'hidden_dims': '[512, 256]', 'dropout': 0.4905119571524887, 'batch_norm': False, 'lr': 0.00013472393762208965, 'weight_decay': 7.251336456098877e-05, 'epochs': 114, 'loss': 'mae', 'optimizer': 'adamw', 'use_snp_selection': False, 'n_pcs': 1000}. Best is trial 71 with value: 0.22019119234091403.
2026-06-01 15:24:49 | INFO | Trial 83 | outer=13 | hidden=[512, 256] epochs=128 lr=1.876e-04 wd=2.826e-04 n_pcs=500 weight={'name': 'uniform'}
[I 2026-06-01 15:24:51,558] Trial 83 pruned. 
2026-06-01 15:24:51 | INFO | Trial 84 | outer=13 | hidden=[512, 256] epochs=143 lr=1.118e-04 wd=1.120e-05 n_pcs=1500 weight={'name': 'uniform'}
[I 2026-06-01 15:24:56,264] Trial 84 finished with value: 0.17799078987875033 and parameters: {'hidden_dims': '[512, 256]', 'dropout': 0.528985277225561, 'batch_norm': False, 'lr': 0.00011178684039090963, 'weight_decay': 1.1196735213005725e-05, 'epochs': 143, 'loss': 'mae', 'optimizer': 'adamw', 'use_snp_selection': False, 'n_pcs': 1500}. Best is trial 71 with value: 0.22019119234091403.
2026-06-01 15:24:56 | INFO | Trial 85 | outer=13 | hidden=[1024, 256] epochs=126 lr=2.988e-04 wd=2.043e-05 n_pcs=500 weight={'name': 'uniform'}
[I 2026-06-01 15:25:00,530] Trial 85 finished with value: 0.1735561221473357 and parameters: {'hidden_dims': '[1024, 256]', 'dropout': 0.3982862565813342, 'batch_norm': False, 'lr': 0.0002987821804376029, 'weight_decay': 2.0433705364001426e-05, 'epochs': 126, 'loss': 'mae', 'optimizer': 'adamw', 'use_snp_selection': False, 'n_pcs': 500}. Best is trial 71 with value: 0.22019119234091403.
2026-06-01 15:25:00 | INFO | Trial 86 | outer=13 | hidden=[512, 256] epochs=138 lr=1.561e-04 wd=3.404e-05 n_pcs=1000 weight={'name': 'uniform'}
[I 2026-06-01 15:25:04,473] Trial 86 finished with value: 0.20524008595585036 and parameters: {'hidden_dims': '[512, 256]', 'dropout': 0.4391575920113018, 'batch_norm': False, 'lr': 0.00015607963426114994, 'weight_decay': 3.404284127317537e-05, 'epochs': 138, 'loss': 'mae', 'optimizer': 'adamw', 'use_snp_selection': False, 'n_pcs': 1000}. Best is trial 71 with value: 0.22019119234091403.
2026-06-01 15:25:04 | INFO | Trial 87 | outer=13 | hidden=[256, 128] epochs=152 lr=2.204e-04 wd=3.385e-07 n_pcs=1000 weight={'name': 'uniform'}
[I 2026-06-01 15:25:07,766] Trial 87 finished with value: 0.20889756825662298 and parameters: {'hidden_dims': '[256, 128]', 'dropout': 0.5483951432771818, 'batch_norm': False, 'lr': 0.0002204236306726405, 'weight_decay': 3.384977065220027e-07, 'epochs': 152, 'loss': 'mae', 'optimizer': 'adam', 'use_snp_selection': False, 'n_pcs': 1000}. Best is trial 71 with value: 0.22019119234091403.
2026-06-01 15:25:07 | INFO | Trial 88 | outer=13 | hidden=[256, 128] epochs=104 lr=2.424e-04 wd=3.199e-07 n_pcs=2000 weight={'name': 'uniform'}
[I 2026-06-01 15:25:10,895] Trial 88 finished with value: 0.20130545217575607 and parameters: {'hidden_dims': '[256, 128]', 'dropout': 0.5651080812439953, 'batch_norm': False, 'lr': 0.00024244799370481574, 'weight_decay': 3.198759144075216e-07, 'epochs': 104, 'loss': 'mae', 'optimizer': 'adamw', 'use_snp_selection': False, 'n_pcs': 2000}. Best is trial 71 with value: 0.22019119234091403.
2026-06-01 15:25:10 | INFO | Trial 89 | outer=13 | hidden=[256, 128] epochs=153 lr=2.720e-04 wd=9.620e-08 n_pcs=3000 weight={'name': 'uniform'}
[I 2026-06-01 15:25:15,491] Trial 89 finished with value: 0.17563046657310694 and parameters: {'hidden_dims': '[256, 128]', 'dropout': 0.5818483585594018, 'batch_norm': False, 'lr': 0.00027200571216515207, 'weight_decay': 9.619691124160939e-08, 'epochs': 153, 'loss': 'mae', 'optimizer': 'adam', 'use_snp_selection': False, 'n_pcs': 3000}. Best is trial 71 with value: 0.22019119234091403.
2026-06-01 15:25:15 | INFO | Trial 90 | outer=13 | hidden=[256, 128] epochs=117 lr=1.727e-04 wd=1.950e-07 n_pcs=1500 weight={'name': 'uniform'}
[I 2026-06-01 15:25:18,506] Trial 90 finished with value: 0.18804793943046078 and parameters: {'hidden_dims': '[256, 128]', 'dropout': 0.548296656381712, 'batch_norm': False, 'lr': 0.00017273544620689815, 'weight_decay': 1.9504009832686196e-07, 'epochs': 117, 'loss': 'mae', 'optimizer': 'adamw', 'use_snp_selection': False, 'n_pcs': 1500}. Best is trial 71 with value: 0.22019119234091403.
2026-06-01 15:25:18 | INFO | Trial 91 | outer=13 | hidden=[256, 128] epochs=150 lr=2.131e-04 wd=1.618e-07 n_pcs=1000 weight={'name': 'uniform'}
