[I 2026-06-01 14:36:32,292] Trial 112 finished with value: 0.19728845252531985 and parameters: {'hidden_dims': '[512, 128]', 'dropout': 0.3619276652111216, 'batch_norm': False, 'lr': 0.00043512132785483384, 'weight_decay': 1.683806019125713e-08, 'epochs': 159, 'loss': 'mae', 'optimizer': 'adamw', 'use_snp_selection': False, 'n_pcs': 5000}. Best is trial 79 with value: 0.20987859194971764.
2026-06-01 14:36:32 | INFO | Trial 113 | outer=10 | hidden=[512, 128] epochs=151 lr=3.103e-04 wd=2.313e-08 n_pcs=5000 weight={'name': 'uniform'}
[I 2026-06-01 14:36:41,913] Trial 113 finished with value: 0.18721553439508934 and parameters: {'hidden_dims': '[512, 128]', 'dropout': 0.41629153434835947, 'batch_norm': False, 'lr': 0.00031032353170225735, 'weight_decay': 2.3132143379090576e-08, 'epochs': 151, 'loss': 'mae', 'optimizer': 'adamw', 'use_snp_selection': False, 'n_pcs': 5000}. Best is trial 79 with value: 0.20987859194971764.
2026-06-01 14:36:41 | INFO | Trial 114 | outer=10 | hidden=[512, 128] epochs=260 lr=2.791e-04 wd=2.227e-04 n_pcs=4500 weight={'name': 'uniform'}
[I 2026-06-01 14:36:55,970] Trial 114 finished with value: 0.20036709381399712 and parameters: {'hidden_dims': '[512, 128]', 'dropout': 0.37719810859048564, 'batch_norm': False, 'lr': 0.0002791242021225145, 'weight_decay': 0.00022270270319800132, 'epochs': 260, 'loss': 'mae', 'optimizer': 'adamw', 'use_snp_selection': False, 'n_pcs': 4500}. Best is trial 79 with value: 0.20987859194971764.
2026-06-01 14:36:55 | INFO | Trial 115 | outer=10 | hidden=[512, 128] epochs=57 lr=4.987e-04 wd=1.192e-08 n_pcs=4500 weight={'name': 'uniform'}
[I 2026-06-01 14:37:00,834] Trial 115 finished with value: 0.1916882991487913 and parameters: {'hidden_dims': '[512, 128]', 'dropout': 0.3321925406466273, 'batch_norm': False, 'lr': 0.0004987245557570931, 'weight_decay': 1.1920977889711229e-08, 'epochs': 57, 'loss': 'mae', 'optimizer': 'adamw', 'use_snp_selection': False, 'n_pcs': 4500}. Best is trial 79 with value: 0.20987859194971764.
2026-06-01 14:37:00 | INFO | Trial 116 | outer=10 | hidden=[256, 128] epochs=144 lr=4.042e-04 wd=3.774e-08 n_pcs=5000 weight={'name': 'uniform'}
[I 2026-06-01 14:37:06,857] Trial 116 finished with value: 0.17575305891174792 and parameters: {'hidden_dims': '[256, 128]', 'dropout': 0.3829307563562269, 'batch_norm': False, 'lr': 0.0004042405352177204, 'weight_decay': 3.774214828158834e-08, 'epochs': 144, 'loss': 'mae', 'optimizer': 'adamw', 'use_snp_selection': False, 'n_pcs': 5000}. Best is trial 79 with value: 0.20987859194971764.
2026-06-01 14:37:06 | INFO | Trial 117 | outer=10 | hidden=[512, 256] epochs=168 lr=7.344e-05 wd=9.874e-04 n_pcs=1000 weight={'name': 'uniform'}
[I 2026-06-01 14:37:11,450] Trial 117 finished with value: 0.2028518348903357 and parameters: {'hidden_dims': '[512, 256]', 'dropout': 0.3531015209301973, 'batch_norm': False, 'lr': 7.344251168916129e-05, 'weight_decay': 0.0009874062523591155, 'epochs': 168, 'loss': 'mae', 'optimizer': 'adamw', 'use_snp_selection': False, 'n_pcs': 1000}. Best is trial 79 with value: 0.20987859194971764.
2026-06-01 14:37:11 | INFO | Trial 118 | outer=10 | hidden=[512, 256] epochs=171 lr=8.806e-05 wd=8.076e-04 n_pcs=1000 weight={'name': 'uniform'}
[I 2026-06-01 14:37:16,095] Trial 118 finished with value: 0.20230064951436916 and parameters: {'hidden_dims': '[512, 256]', 'dropout': 0.3071397979393798, 'batch_norm': False, 'lr': 8.805866861139976e-05, 'weight_decay': 0.0008075917637058607, 'epochs': 171, 'loss': 'mse', 'optimizer': 'adamw', 'use_snp_selection': False, 'n_pcs': 1000}. Best is trial 79 with value: 0.20987859194971764.
2026-06-01 14:37:16 | INFO | Trial 119 | outer=10 | hidden=[512, 256] epochs=189 lr=7.484e-05 wd=3.539e-04 n_pcs=1000 weight={'name': 'uniform'}
[I 2026-06-01 14:37:21,053] Trial 119 finished with value: 0.19930655654811993 and parameters: {'hidden_dims': '[512, 256]', 'dropout': 0.3237431298347992, 'batch_norm': False, 'lr': 7.484426851448642e-05, 'weight_decay': 0.00035391949439295904, 'epochs': 189, 'loss': 'mae', 'optimizer': 'adamw', 'use_snp_selection': False, 'n_pcs': 1000}. Best is trial 79 with value: 0.20987859194971764.
2026-06-01 14:37:21 | INFO | Trial 120 | outer=10 | hidden=[512, 256] epochs=177 lr=3.470e-04 wd=4.636e-05 n_pcs=500 weight={'name': 'uniform'}
[I 2026-06-01 14:37:24,936] Trial 120 finished with value: 0.17716551716642423 and parameters: {'hidden_dims': '[512, 256]', 'dropout': 0.34534381615849175, 'batch_norm': False, 'lr': 0.0003469794290737487, 'weight_decay': 4.636353177334982e-05, 'epochs': 177, 'loss': 'mae', 'optimizer': 'adamw', 'use_snp_selection': False, 'n_pcs': 500}. Best is trial 79 with value: 0.20987859194971764.
2026-06-01 14:37:24 | INFO | Trial 121 | outer=10 | hidden=[512, 256] epochs=169 lr=6.477e-05 wd=9.859e-04 n_pcs=1000 weight={'name': 'uniform'}
[I 2026-06-01 14:37:29,552] Trial 121 finished with value: 0.21456182118244618 and parameters: {'hidden_dims': '[512, 256]', 'dropout': 0.35989714812995827, 'batch_norm': False, 'lr': 6.476683381113913e-05, 'weight_decay': 0.0009858505052704782, 'epochs': 169, 'loss': 'mae', 'optimizer': 'adamw', 'use_snp_selection': False, 'n_pcs': 1000}. Best is trial 121 with value: 0.21456182118244618.
2026-06-01 14:37:29 | INFO | Trial 122 | outer=10 | hidden=[512, 256] epochs=168 lr=5.290e-05 wd=9.712e-04 n_pcs=1500 weight={'name': 'uniform'}
[I 2026-06-01 14:37:34,965] Trial 122 finished with value: 0.20318866073823122 and parameters: {'hidden_dims': '[512, 256]', 'dropout': 0.3554078662024271, 'batch_norm': False, 'lr': 5.289609013172206e-05, 'weight_decay': 0.0009712278601999003, 'epochs': 168, 'loss': 'mae', 'optimizer': 'adamw', 'use_snp_selection': False, 'n_pcs': 1500}. Best is trial 121 with value: 0.21456182118244618.
2026-06-01 14:37:34 | INFO | Trial 123 | outer=10 | hidden=[512, 256] epochs=167 lr=4.570e-05 wd=9.991e-04 n_pcs=1500 weight={'name': 'uniform'}
[I 2026-06-01 14:37:39,279] Trial 123 pruned. 
2026-06-01 14:37:39 | INFO | Trial 124 | outer=10 | hidden=[512, 256] epochs=160 lr=5.568e-05 wd=5.827e-04 n_pcs=1000 weight={'name': 'uniform'}
[I 2026-06-01 14:37:43,748] Trial 124 finished with value: 0.18905379492818833 and parameters: {'hidden_dims': '[512, 256]', 'dropout': 0.4037043692855036, 'batch_norm': False, 'lr': 5.568161912882559e-05, 'weight_decay': 0.000582702888032619, 'epochs': 160, 'loss': 'mae', 'optimizer': 'adamw', 'use_snp_selection': False, 'n_pcs': 1000}. Best is trial 121 with value: 0.21456182118244618.
2026-06-01 14:37:43 | INFO | Trial 125 | outer=10 | hidden=[512, 256] epochs=172 lr=5.318e-05 wd=7.675e-04 n_pcs=1000 weight={'name': 'uniform'}
[I 2026-06-01 14:37:47,018] Trial 125 pruned. 
2026-06-01 14:37:47 | INFO | Trial 126 | outer=10 | hidden=[512, 256] epochs=165 lr=5.960e-05 wd=4.654e-04 n_pcs=2000 weight={'name': 'uniform'}
[I 2026-06-01 14:37:53,021] Trial 126 finished with value: 0.18811829002812275 and parameters: {'hidden_dims': '[512, 256]', 'dropout': 0.3743906272445593, 'batch_norm': False, 'lr': 5.9603230027478095e-05, 'weight_decay': 0.0004653990635498268, 'epochs': 165, 'loss': 'mae', 'optimizer': 'adamw', 'use_snp_selection': False, 'n_pcs': 2000}. Best is trial 121 with value: 0.21456182118244618.
2026-06-01 14:37:53 | INFO | Trial 127 | outer=10 | hidden=[512, 256] epochs=181 lr=6.607e-05 wd=6.722e-04 n_pcs=1500 weight={'name': 'uniform'}
[I 2026-06-01 14:37:58,733] Trial 127 finished with value: 0.17971670472784798 and parameters: {'hidden_dims': '[512, 256]', 'dropout': 0.2899246028050984, 'batch_norm': False, 'lr': 6.606757947356716e-05, 'weight_decay': 0.0006721764891089488, 'epochs': 181, 'loss': 'mae', 'optimizer': 'adamw', 'use_snp_selection': False, 'n_pcs': 1500}. Best is trial 121 with value: 0.21456182118244618.
2026-06-01 14:37:58 | INFO | Trial 128 | outer=10 | hidden=[512, 256] epochs=138 lr=6.259e-05 wd=3.998e-04 n_pcs=500 weight={'name': 'uniform'}
[I 2026-06-01 14:38:00,771] Trial 128 pruned. 
2026-06-01 14:38:00 | INFO | Trial 129 | outer=10 | hidden=[512, 256] epochs=154 lr=7.895e-05 wd=9.944e-04 n_pcs=1000 weight={'name': 'uniform'}
[I 2026-06-01 14:38:05,123] Trial 129 finished with value: 0.20686727202264682 and parameters: {'hidden_dims': '[512, 256]', 'dropout': 0.3371856145743103, 'batch_norm': False, 'lr': 7.894724788956104e-05, 'weight_decay': 0.0009944098419318898, 'epochs': 154, 'loss': 'mae', 'optimizer': 'adamw', 'use_snp_selection': False, 'n_pcs': 1000}. Best is trial 121 with value: 0.21456182118244618.
2026-06-01 14:38:05 | INFO | Trial 130 | outer=10 | hidden=[128, 64] epochs=154 lr=7.981e-05 wd=4.677e-04 n_pcs=2000 weight={'name': 'uniform'}
[I 2026-06-01 14:38:08,803] Trial 130 finished with value: 0.1542669555585721 and parameters: {'hidden_dims': '[128, 64]', 'dropout': 0.3294318296744928, 'batch_norm': False, 'lr': 7.981124276234203e-05, 'weight_decay': 0.0004676980083886848, 'epochs': 154, 'loss': 'mae', 'optimizer': 'adamw', 'use_snp_selection': False, 'n_pcs': 2000}. Best is trial 121 with value: 0.21456182118244618.
2026-06-01 14:38:08 | INFO | Trial 131 | outer=10 | hidden=[512, 256] epochs=175 lr=6.961e-05 wd=9.277e-04 n_pcs=1000 weight={'name': 'uniform'}
[I 2026-06-01 14:38:13,527] Trial 131 finished with value: 0.19982931453186306 and parameters: {'hidden_dims': '[512, 256]', 'dropout': 0.3820686448006406, 'batch_norm': False, 'lr': 6.960654723538317e-05, 'weight_decay': 0.0009276997187917022, 'epochs': 175, 'loss': 'mae', 'optimizer': 'adamw', 'use_snp_selection': False, 'n_pcs': 1000}. Best is trial 121 with value: 0.21456182118244618.
2026-06-01 14:38:13 | INFO | Trial 132 | outer=10 | hidden=[512, 256] epochs=162 lr=7.201e-05 wd=6.907e-04 n_pcs=1000 weight={'name': 'uniform'}
[I 2026-06-01 14:38:18,026] Trial 132 finished with value: 0.19360726048540014 and parameters: {'hidden_dims': '[512, 256]', 'dropout': 0.35527552282539554, 'batch_norm': False, 'lr': 7.200924893758762e-05, 'weight_decay': 0.0006906952285261078, 'epochs': 162, 'loss': 'mae', 'optimizer': 'adamw', 'use_snp_selection': False, 'n_pcs': 1000}. Best is trial 121 with value: 0.21456182118244618.
2026-06-01 14:38:18 | INFO | Trial 133 | outer=10 | hidden=[512, 256] epochs=148 lr=7.829e-05 wd=9.874e-04 n_pcs=1000 weight={'name': 'uniform'}
[I 2026-06-01 14:38:22,274] Trial 133 finished with value: 0.20113574232545695 and parameters: {'hidden_dims': '[512, 256]', 'dropout': 0.3402100638402268, 'batch_norm': False, 'lr': 7.829328985359599e-05, 'weight_decay': 0.0009873683918988543, 'epochs': 148, 'loss': 'mae', 'optimizer': 'adamw', 'use_snp_selection': False, 'n_pcs': 1000}. Best is trial 121 with value: 0.21456182118244618.
2026-06-01 14:38:22 | INFO | Trial 134 | outer=10 | hidden=[512, 256] epochs=169 lr=1.006e-04 wd=5.725e-04 n_pcs=1500 weight={'name': 'uniform'}
[I 2026-06-01 14:38:27,715] Trial 134 finished with value: 0.1949291343755607 and parameters: {'hidden_dims': '[512, 256]', 'dropout': 0.3161460804041947, 'batch_norm': False, 'lr': 0.00010064590086571115, 'weight_decay': 0.0005725032878541467, 'epochs': 169, 'loss': 'mae', 'optimizer': 'adamw', 'use_snp_selection': False, 'n_pcs': 1500}. Best is trial 121 with value: 0.21456182118244618.
2026-06-01 14:38:27 | INFO | Trial 135 | outer=10 | hidden=[256, 64] epochs=178 lr=3.889e-05 wd=7.078e-04 n_pcs=500 weight={'name': 'uniform'}
[I 2026-06-01 14:38:29,977] Trial 135 pruned. 
2026-06-01 14:38:29 | INFO | Trial 136 | outer=10 | hidden=[512, 256] epochs=156 lr=8.938e-05 wd=3.023e-04 n_pcs=1500 weight={'name': 'uniform'}
[I 2026-06-01 14:38:35,138] Trial 136 finished with value: 0.1737652846857741 and parameters: {'hidden_dims': '[512, 256]', 'dropout': 0.3642773161168275, 'batch_norm': False, 'lr': 8.937654928459285e-05, 'weight_decay': 0.0003022650181342037, 'epochs': 156, 'loss': 'mae', 'optimizer': 'adamw', 'use_snp_selection': False, 'n_pcs': 1500}. Best is trial 121 with value: 0.21456182118244618.
2026-06-01 14:38:35 | INFO | Trial 137 | outer=10 | hidden=[512, 64] epochs=83 lr=2.577e-04 wd=2.599e-06 n_pcs=1000 weight={'name': 'uniform'}
[I 2026-06-01 14:38:37,948] Trial 137 finished with value: 0.20421388111655223 and parameters: {'hidden_dims': '[512, 64]', 'dropout': 0.3458072943585496, 'batch_norm': False, 'lr': 0.0002577382472134223, 'weight_decay': 2.5994489202978825e-06, 'epochs': 83, 'loss': 'mae', 'optimizer': 'adamw', 'use_snp_selection': False, 'n_pcs': 1000}. Best is trial 121 with value: 0.21456182118244618.
2026-06-01 14:38:37 | INFO | Trial 138 | outer=10 | hidden=[512, 64] epochs=60 lr=2.498e-04 wd=1.463e-08 n_pcs=1500 weight={'name': 'uniform'}
[I 2026-06-01 14:38:40,761] Trial 138 finished with value: 0.18727466119115405 and parameters: {'hidden_dims': '[512, 64]', 'dropout': 0.36933233349341443, 'batch_norm': False, 'lr': 0.0002497530171120148, 'weight_decay': 1.462616849997442e-08, 'epochs': 60, 'loss': 'mae', 'optimizer': 'adamw', 'use_snp_selection': False, 'n_pcs': 1500}. Best is trial 121 with value: 0.21456182118244618.
2026-06-01 14:38:40 | INFO | Trial 139 | outer=10 | hidden=[512, 64] epochs=94 lr=2.225e-04 wd=3.231e-06 n_pcs=1000 weight={'name': 'uniform'}
[I 2026-06-01 14:38:43,751] Trial 139 finished with value: 0.19609854541999322 and parameters: {'hidden_dims': '[512, 64]', 'dropout': 0.3391539293607915, 'batch_norm': False, 'lr': 0.00022249243437002107, 'weight_decay': 3.2310160545689445e-06, 'epochs': 94, 'loss': 'mse', 'optimizer': 'adamw', 'use_snp_selection': False, 'n_pcs': 1000}. Best is trial 121 with value: 0.21456182118244618.
2026-06-01 14:38:43 | INFO | Trial 140 | outer=10 | hidden=[512, 64] epochs=64 lr=2.728e-04 wd=4.307e-06 n_pcs=1000 weight={'name': 'uniform'}
[I 2026-06-01 14:38:46,307] Trial 140 finished with value: 0.2160538817395518 and parameters: {'hidden_dims': '[512, 64]', 'dropout': 0.5467721529500428, 'batch_norm': False, 'lr': 0.00027284339488698546, 'weight_decay': 4.307104220300311e-06, 'epochs': 64, 'loss': 'mae', 'optimizer': 'adamw', 'use_snp_selection': False, 'n_pcs': 1000}. Best is trial 140 with value: 0.2160538817395518.
2026-06-01 14:38:46 | INFO | Trial 141 | outer=10 | hidden=[512, 64] epochs=74 lr=2.870e-04 wd=6.092e-07 n_pcs=1000 weight={'name': 'uniform'}
[I 2026-06-01 14:38:49,007] Trial 141 finished with value: 0.199917700072951 and parameters: {'hidden_dims': '[512, 64]', 'dropout': 0.5425912739219586, 'batch_norm': False, 'lr': 0.000287009342669147, 'weight_decay': 6.091582948490605e-07, 'epochs': 74, 'loss': 'mae', 'optimizer': 'adamw', 'use_snp_selection': False, 'n_pcs': 1000}. Best is trial 140 with value: 0.2160538817395518.
2026-06-01 14:38:49 | INFO | Trial 142 | outer=10 | hidden=[512, 64] epochs=51 lr=2.712e-04 wd=2.275e-06 n_pcs=500 weight={'name': 'uniform'}
[I 2026-06-01 14:38:50,340] Trial 142 pruned. 
2026-06-01 14:38:50 | INFO | Trial 143 | outer=10 | hidden=[512, 64] epochs=80 lr=3.086e-04 wd=1.983e-05 n_pcs=1000 weight={'name': 'uniform'}
[I 2026-06-01 14:38:53,127] Trial 143 finished with value: 0.2018990289215114 and parameters: {'hidden_dims': '[512, 64]', 'dropout': 0.5501716745928033, 'batch_norm': False, 'lr': 0.00030863056197286115, 'weight_decay': 1.9829442301605066e-05, 'epochs': 80, 'loss': 'mae', 'optimizer': 'adamw', 'use_snp_selection': False, 'n_pcs': 1000}. Best is trial 140 with value: 0.2160538817395518.
2026-06-01 14:38:53 | INFO | Trial 144 | outer=10 | hidden=[512, 64] epochs=78 lr=2.526e-04 wd=8.088e-06 n_pcs=1000 weight={'name': 'uniform'}
[I 2026-06-01 14:38:55,888] Trial 144 finished with value: 0.20319758569358431 and parameters: {'hidden_dims': '[512, 64]', 'dropout': 0.5665740317925022, 'batch_norm': False, 'lr': 0.0002525755572980612, 'weight_decay': 8.08834387979953e-06, 'epochs': 78, 'loss': 'mae', 'optimizer': 'adamw', 'use_snp_selection': False, 'n_pcs': 1000}. Best is trial 140 with value: 0.2160538817395518.
2026-06-01 14:38:55 | INFO | Trial 145 | outer=10 | hidden=[512, 64] epochs=70 lr=2.407e-04 wd=5.971e-06 n_pcs=1000 weight={'name': 'uniform'}
[I 2026-06-01 14:38:58,530] Trial 145 finished with value: 0.20022492247642765 and parameters: {'hidden_dims': '[512, 64]', 'dropout': 0.5658048933634545, 'batch_norm': False, 'lr': 0.0002406928708945898, 'weight_decay': 5.97105554562468e-06, 'epochs': 70, 'loss': 'mae', 'optimizer': 'adamw', 'use_snp_selection': False, 'n_pcs': 1000}. Best is trial 140 with value: 0.2160538817395518.
2026-06-01 14:38:58 | INFO | Trial 146 | outer=10 | hidden=[512, 64] epochs=79 lr=2.093e-04 wd=4.565e-06 n_pcs=1000 weight={'name': 'uniform'}
[I 2026-06-01 14:39:01,303] Trial 146 finished with value: 0.19943594821797808 and parameters: {'hidden_dims': '[512, 64]', 'dropout': 0.5998886696608685, 'batch_norm': False, 'lr': 0.00020926092499303487, 'weight_decay': 4.564731229479525e-06, 'epochs': 79, 'loss': 'mae', 'optimizer': 'adamw', 'use_snp_selection': False, 'n_pcs': 1000}. Best is trial 140 with value: 0.2160538817395518.
2026-06-01 14:39:01 | INFO | Trial 147 | outer=10 | hidden=[512, 64] epochs=68 lr=3.640e-04 wd=1.977e-06 n_pcs=1000 weight={'name': 'uniform'}
[I 2026-06-01 14:39:03,915] Trial 147 finished with value: 0.21607886620581276 and parameters: {'hidden_dims': '[512, 64]', 'dropout': 0.5768237034870017, 'batch_norm': False, 'lr': 0.00036402969999145145, 'weight_decay': 1.977120426968339e-06, 'epochs': 68, 'loss': 'mae', 'optimizer': 'adamw', 'use_snp_selection': False, 'n_pcs': 1000}. Best is trial 147 with value: 0.21607886620581276.
2026-06-01 14:39:03 | INFO | Trial 148 | outer=10 | hidden=[512, 64] epochs=68 lr=3.673e-04 wd=1.117e-06 n_pcs=1000 weight={'name': 'uniform'}
[I 2026-06-01 14:39:06,527] Trial 148 finished with value: 0.2148662491094806 and parameters: {'hidden_dims': '[512, 64]', 'dropout': 0.5780478220218381, 'batch_norm': False, 'lr': 0.00036727508705652965, 'weight_decay': 1.1169417707755014e-06, 'epochs': 68, 'loss': 'mae', 'optimizer': 'adamw', 'use_snp_selection': False, 'n_pcs': 1000}. Best is trial 147 with value: 0.21607886620581276.
2026-06-01 14:39:06 | INFO | Trial 149 | outer=10 | hidden=[512, 64] epochs=63 lr=3.888e-04 wd=1.841e-06 n_pcs=500 weight={'name': 'uniform'}
[I 2026-06-01 14:39:08,883] Trial 149 finished with value: 0.19576565995328488 and parameters: {'hidden_dims': '[512, 64]', 'dropout': 0.5540450252079561, 'batch_norm': False, 'lr': 0.00038881417275541704, 'weight_decay': 1.8411214024666215e-06, 'epochs': 63, 'loss': 'mae', 'optimizer': 'adamw', 'use_snp_selection': False, 'n_pcs': 500}. Best is trial 147 with value: 0.21607886620581276.
2026-06-01 14:39:08 | INFO | OUTER 10 best (inner mean r=0.2161): model={'hidden_dims': [512, 64], 'dropout': 0.5768237034870017, 'batch_norm': False, 'lr': 0.00036402969999145145, 'weight_decay': 1.977120426968339e-06, 'epochs': 68, 'loss': 'mae', 'optimizer': 'adamw', 'use_snp_selection': False, 'n_pcs': 1000} weighting={'name': 'uniform'}
2026-06-01 14:39:09 | INFO | OUTER 10 TEST r = 0.1736
2026-06-01 14:39:09 | INFO | OUTER 10 incremental summary saved to outputs/final_results/e8_pc_mlp_uniform/thr_wing/e8_pc_mlp_uniform_thr_wing_results.json
2026-06-01 14:39:09 | INFO | OUTER 11: test_size=173 island=10 (Aldra)
2026-06-01 14:39:09 | INFO | OUTER 11: inner LOIO validation islands: 0(Nesøy), 1(Myken), 2(Træna), 3(Selvær), 4(Gjerøy), 5(Hestmannøy), 6(Indre Kvarøy), 7(Onøy og Lurøy), 8(Lovund), 9(Sleneset), 11(Leka), 12(Vega), 13(Vikna), 14(Lauvøya)
2026-06-01 14:39:09 | INFO | OUTER 11: using top 10 related inner validation islands for tuning: 4(Gjerøy, avgGRM=0.0011), 7(Onøy og Lurøy, avgGRM=0.0011), 0(Nesøy, avgGRM=-0.0006), 5(Hestmannøy, avgGRM=-0.0021), 6(Indre Kvarøy, avgGRM=-0.0026), 3(Selvær, avgGRM=-0.0035), 1(Myken, avgGRM=-0.0036), 8(Lovund, avgGRM=-0.0039), 12(Vega, avgGRM=-0.0048), 9(Sleneset, avgGRM=-0.0048)
[I 2026-06-01 14:39:09,445] A new study created in memory with name: mlp_importance_inner_outer10
2026-06-01 14:39:09 | INFO | Trial 0 | outer=11 | hidden=[256, 64] epochs=252 lr=8.243e-05 wd=1.277e-07 n_pcs=1500 weight={'name': 'uniform'}
[I 2026-06-01 14:39:14,290] Trial 0 finished with value: 0.17801116448903756 and parameters: {'hidden_dims': '[256, 64]', 'dropout': 0.19097065492325918, 'batch_norm': False, 'lr': 8.242985198911028e-05, 'weight_decay': 1.277246473139888e-07, 'epochs': 252, 'loss': 'mae', 'optimizer': 'adamw', 'use_snp_selection': False, 'n_pcs': 1500}. Best is trial 0 with value: 0.17801116448903756.
2026-06-01 14:39:14 | INFO | Trial 1 | outer=11 | hidden=[1024, 256] epochs=225 lr=1.391e-04 wd=1.941e-07 n_pcs=500 weight={'name': 'uniform'}
[I 2026-06-01 14:39:20,805] Trial 1 finished with value: 0.15249455210097052 and parameters: {'hidden_dims': '[1024, 256]', 'dropout': 0.2849434595702811, 'batch_norm': False, 'lr': 0.00013909108684683413, 'weight_decay': 1.9407167964924495e-07, 'epochs': 225, 'loss': 'mse', 'optimizer': 'adamw', 'use_snp_selection': False, 'n_pcs': 500}. Best is trial 0 with value: 0.17801116448903756.
2026-06-01 14:39:20 | INFO | Trial 2 | outer=11 | hidden=[256, 64] epochs=139 lr=3.957e-05 wd=3.750e-05 n_pcs=2500 weight={'name': 'uniform'}
[I 2026-06-01 14:39:24,720] Trial 2 finished with value: 0.19950429900259914 and parameters: {'hidden_dims': '[256, 64]', 'dropout': 0.11392712587675291, 'batch_norm': False, 'lr': 3.9573351157697276e-05, 'weight_decay': 3.7502337000845044e-05, 'epochs': 139, 'loss': 'mae', 'optimizer': 'adam', 'use_snp_selection': False, 'n_pcs': 2500}. Best is trial 2 with value: 0.19950429900259914.
2026-06-01 14:39:24 | INFO | Trial 3 | outer=11 | hidden=[128, 64] epochs=164 lr=1.538e-05 wd=3.248e-06 n_pcs=3000 weight={'name': 'uniform'}
