[I 2026-06-01 13:15:21,451] Trial 36 finished with value: 0.17576015039193466 and parameters: {'hidden_dims': '[256, 128]', 'dropout': 0.38657152254533794, 'batch_norm': False, 'lr': 8.92462086644188e-05, 'weight_decay': 0.00037557864684457053, 'epochs': 86, 'loss': 'mae', 'optimizer': 'adamw', 'use_snp_selection': False, 'n_pcs': 2500}. Best is trial 10 with value: 0.20408155490563423.
2026-06-01 13:15:21 | INFO | Trial 37 | outer=6 | hidden=[512, 128] epochs=237 lr=1.642e-04 wd=4.743e-08 n_pcs=3500 weight={'name': 'uniform'}
[I 2026-06-01 13:15:30,845] Trial 37 finished with value: 0.17175677044430165 and parameters: {'hidden_dims': '[512, 128]', 'dropout': 0.3119130651120395, 'batch_norm': False, 'lr': 0.00016423485418340646, 'weight_decay': 4.7429116593469384e-08, 'epochs': 237, 'loss': 'mse', 'optimizer': 'adam', 'use_snp_selection': False, 'n_pcs': 3500}. Best is trial 10 with value: 0.20408155490563423.
2026-06-01 13:15:30 | INFO | Trial 38 | outer=6 | hidden=[512, 64] epochs=184 lr=4.286e-04 wd=2.632e-05 n_pcs=500 weight={'name': 'uniform'}
[I 2026-06-01 13:15:34,461] Trial 38 finished with value: 0.17427917085206557 and parameters: {'hidden_dims': '[512, 64]', 'dropout': 0.46118456315657913, 'batch_norm': False, 'lr': 0.00042861165981540806, 'weight_decay': 2.632348482148206e-05, 'epochs': 184, 'loss': 'mse', 'optimizer': 'adamw', 'use_snp_selection': False, 'n_pcs': 500}. Best is trial 10 with value: 0.20408155490563423.
2026-06-01 13:15:34 | INFO | Trial 39 | outer=6 | hidden=[256, 128] epochs=71 lr=7.158e-05 wd=2.465e-06 n_pcs=4500 weight={'name': 'uniform'}
[I 2026-06-01 13:15:36,947] Trial 39 pruned. 
2026-06-01 13:15:36 | INFO | Trial 40 | outer=6 | hidden=[256, 64] epochs=136 lr=2.933e-04 wd=1.470e-07 n_pcs=1500 weight={'name': 'uniform'}
[I 2026-06-01 13:15:40,064] Trial 40 finished with value: 0.18642381632807287 and parameters: {'hidden_dims': '[256, 64]', 'dropout': 0.41153045206777206, 'batch_norm': False, 'lr': 0.00029332185062302274, 'weight_decay': 1.470463662238823e-07, 'epochs': 136, 'loss': 'mae', 'optimizer': 'adam', 'use_snp_selection': False, 'n_pcs': 1500}. Best is trial 10 with value: 0.20408155490563423.
2026-06-01 13:15:40 | INFO | Trial 41 | outer=6 | hidden=[256, 128] epochs=96 lr=2.324e-04 wd=1.286e-08 n_pcs=1000 weight={'name': 'uniform'}
[I 2026-06-01 13:15:42,663] Trial 41 finished with value: 0.17772269807640978 and parameters: {'hidden_dims': '[256, 128]', 'dropout': 0.3859304435173758, 'batch_norm': False, 'lr': 0.00023243974627818777, 'weight_decay': 1.285618929250554e-08, 'epochs': 96, 'loss': 'mse', 'optimizer': 'adamw', 'use_snp_selection': False, 'n_pcs': 1000}. Best is trial 10 with value: 0.20408155490563423.
2026-06-01 13:15:42 | INFO | Trial 42 | outer=6 | hidden=[256, 128] epochs=89 lr=3.532e-04 wd=1.023e-08 n_pcs=1000 weight={'name': 'uniform'}
[I 2026-06-01 13:15:44,432] Trial 42 pruned. 
2026-06-01 13:15:44 | INFO | Trial 43 | outer=6 | hidden=[256, 128] epochs=115 lr=1.917e-04 wd=1.797e-08 n_pcs=1000 weight={'name': 'uniform'}
[I 2026-06-01 13:15:47,248] Trial 43 finished with value: 0.19226368816372186 and parameters: {'hidden_dims': '[256, 128]', 'dropout': 0.2825027477470957, 'batch_norm': False, 'lr': 0.00019168574628469832, 'weight_decay': 1.79704644558585e-08, 'epochs': 115, 'loss': 'mse', 'optimizer': 'adamw', 'use_snp_selection': False, 'n_pcs': 1000}. Best is trial 10 with value: 0.20408155490563423.
2026-06-01 13:15:47 | INFO | Trial 44 | outer=6 | hidden=[1024, 256] epochs=94 lr=2.542e-04 wd=2.611e-08 n_pcs=500 weight={'name': 'uniform'}
[I 2026-06-01 13:15:50,557] Trial 44 finished with value: 0.18141032380403335 and parameters: {'hidden_dims': '[1024, 256]', 'dropout': 0.5035328641295578, 'batch_norm': False, 'lr': 0.00025416698483851955, 'weight_decay': 2.6112715657856297e-08, 'epochs': 94, 'loss': 'mse', 'optimizer': 'adamw', 'use_snp_selection': False, 'n_pcs': 500}. Best is trial 10 with value: 0.20408155490563423.
2026-06-01 13:15:50 | INFO | Trial 45 | outer=6 | hidden=[128, 64] epochs=102 lr=3.910e-05 wd=4.451e-08 n_pcs=1500 weight={'name': 'uniform'}
[I 2026-06-01 13:15:52,243] Trial 45 pruned. 
2026-06-01 13:15:52 | INFO | Trial 46 | outer=6 | hidden=[256, 128] epochs=120 lr=1.030e-05 wd=8.013e-08 n_pcs=2000 weight={'name': 'uniform'}
[I 2026-06-01 13:15:54,083] Trial 46 pruned. 
2026-06-01 13:15:54 | INFO | Trial 47 | outer=6 | hidden=[1024, 256] epochs=71 lr=4.294e-04 wd=1.035e-05 n_pcs=1000 weight={'name': 'uniform'}
[I 2026-06-01 13:15:57,587] Trial 47 finished with value: 0.18893951701054498 and parameters: {'hidden_dims': '[1024, 256]', 'dropout': 0.4166170513900234, 'batch_norm': False, 'lr': 0.00042935800736570187, 'weight_decay': 1.0352534081168127e-05, 'epochs': 71, 'loss': 'mse', 'optimizer': 'adamw', 'use_snp_selection': False, 'n_pcs': 1000}. Best is trial 10 with value: 0.20408155490563423.
2026-06-01 13:15:57 | INFO | Trial 48 | outer=6 | hidden=[512, 128] epochs=61 lr=2.860e-04 wd=3.716e-07 n_pcs=1500 weight={'name': 'uniform'}
[I 2026-06-01 13:16:00,225] Trial 48 finished with value: 0.15989579214261887 and parameters: {'hidden_dims': '[512, 128]', 'dropout': 0.12504631557458878, 'batch_norm': False, 'lr': 0.00028596817252327745, 'weight_decay': 3.7157373223519444e-07, 'epochs': 61, 'loss': 'mse', 'optimizer': 'adamw', 'use_snp_selection': False, 'n_pcs': 1500}. Best is trial 10 with value: 0.20408155490563423.
2026-06-01 13:16:00 | INFO | Trial 49 | outer=6 | hidden=[512, 64] epochs=153 lr=2.161e-04 wd=1.070e-08 n_pcs=2500 weight={'name': 'uniform'}
[I 2026-06-01 13:16:05,480] Trial 49 finished with value: 0.17745690435269915 and parameters: {'hidden_dims': '[512, 64]', 'dropout': 0.46533485390765184, 'batch_norm': False, 'lr': 0.00021608096407925467, 'weight_decay': 1.069857266847285e-08, 'epochs': 153, 'loss': 'mse', 'optimizer': 'adam', 'use_snp_selection': False, 'n_pcs': 2500}. Best is trial 10 with value: 0.20408155490563423.
2026-06-01 13:16:05 | INFO | Trial 50 | outer=6 | hidden=[256, 128] epochs=202 lr=1.446e-04 wd=5.168e-05 n_pcs=500 weight={'name': 'uniform'}
[I 2026-06-01 13:16:09,215] Trial 50 finished with value: 0.1580959009527926 and parameters: {'hidden_dims': '[256, 128]', 'dropout': 0.5983163816404976, 'batch_norm': False, 'lr': 0.00014463466474129352, 'weight_decay': 5.16757646279195e-05, 'epochs': 202, 'loss': 'mae', 'optimizer': 'adamw', 'use_snp_selection': False, 'n_pcs': 500}. Best is trial 10 with value: 0.20408155490563423.
2026-06-01 13:16:09 | INFO | Trial 51 | outer=6 | hidden=[512, 256] epochs=133 lr=3.256e-04 wd=1.879e-08 n_pcs=1000 weight={'name': 'uniform'}
[I 2026-06-01 13:16:11,739] Trial 51 pruned. 
2026-06-01 13:16:11 | INFO | Trial 52 | outer=6 | hidden=[512, 256] epochs=220 lr=2.976e-04 wd=3.707e-08 n_pcs=1000 weight={'name': 'uniform'}
[I 2026-06-01 13:16:16,715] Trial 52 finished with value: 0.17913423063627443 and parameters: {'hidden_dims': '[512, 256]', 'dropout': 0.3943735159914316, 'batch_norm': False, 'lr': 0.00029763570566980474, 'weight_decay': 3.7071934933784594e-08, 'epochs': 220, 'loss': 'mse', 'optimizer': 'adamw', 'use_snp_selection': False, 'n_pcs': 1000}. Best is trial 10 with value: 0.20408155490563423.
2026-06-01 13:16:16 | INFO | Trial 53 | outer=6 | hidden=[512, 256] epochs=164 lr=1.795e-04 wd=1.008e-08 n_pcs=500 weight={'name': 'uniform'}
[I 2026-06-01 13:16:20,276] Trial 53 finished with value: 0.17152937332503382 and parameters: {'hidden_dims': '[512, 256]', 'dropout': 0.44046216030934304, 'batch_norm': False, 'lr': 0.00017949065710802306, 'weight_decay': 1.0084990301509008e-08, 'epochs': 164, 'loss': 'mse', 'optimizer': 'adamw', 'use_snp_selection': False, 'n_pcs': 500}. Best is trial 10 with value: 0.20408155490563423.
2026-06-01 13:16:20 | INFO | Trial 54 | outer=6 | hidden=[512, 256] epochs=271 lr=3.817e-04 wd=1.531e-08 n_pcs=1000 weight={'name': 'uniform'}
[I 2026-06-01 13:16:26,040] Trial 54 finished with value: 0.1843863077398189 and parameters: {'hidden_dims': '[512, 256]', 'dropout': 0.34766656453737727, 'batch_norm': False, 'lr': 0.00038171861215478446, 'weight_decay': 1.5306600950353832e-08, 'epochs': 271, 'loss': 'mse', 'optimizer': 'adamw', 'use_snp_selection': False, 'n_pcs': 1000}. Best is trial 10 with value: 0.20408155490563423.
2026-06-01 13:16:26 | INFO | Trial 55 | outer=6 | hidden=[128, 64] epochs=82 lr=4.670e-04 wd=1.126e-07 n_pcs=1500 weight={'name': 'uniform'}
[I 2026-06-01 13:16:28,557] Trial 55 finished with value: 0.1926383773849395 and parameters: {'hidden_dims': '[128, 64]', 'dropout': 0.48779314372299676, 'batch_norm': False, 'lr': 0.00046699277225651417, 'weight_decay': 1.126272404619968e-07, 'epochs': 82, 'loss': 'mse', 'optimizer': 'adamw', 'use_snp_selection': False, 'n_pcs': 1500}. Best is trial 10 with value: 0.20408155490563423.
2026-06-01 13:16:28 | INFO | Trial 56 | outer=6 | hidden=[256, 128] epochs=102 lr=2.147e-04 wd=2.256e-08 n_pcs=3500 weight={'name': 'uniform'}
[I 2026-06-01 13:16:32,151] Trial 56 finished with value: 0.1915384074550138 and parameters: {'hidden_dims': '[256, 128]', 'dropout': 0.5642467536416259, 'batch_norm': False, 'lr': 0.00021467605211600483, 'weight_decay': 2.2555796578697917e-08, 'epochs': 102, 'loss': 'mse', 'optimizer': 'adamw', 'use_snp_selection': False, 'n_pcs': 3500}. Best is trial 10 with value: 0.20408155490563423.
2026-06-01 13:16:32 | INFO | Trial 57 | outer=6 | hidden=[1024, 256] epochs=111 lr=1.157e-04 wd=3.226e-04 n_pcs=500 weight={'name': 'uniform'}
[I 2026-06-01 13:16:35,789] Trial 57 finished with value: 0.1748147856029604 and parameters: {'hidden_dims': '[1024, 256]', 'dropout': 0.3702470879580715, 'batch_norm': False, 'lr': 0.00011566105151043284, 'weight_decay': 0.0003225745470607436, 'epochs': 111, 'loss': 'mse', 'optimizer': 'adamw', 'use_snp_selection': False, 'n_pcs': 500}. Best is trial 10 with value: 0.20408155490563423.
2026-06-01 13:16:35 | INFO | Trial 58 | outer=6 | hidden=[512, 256] epochs=123 lr=3.400e-04 wd=8.482e-08 n_pcs=1500 weight={'name': 'uniform'}
[I 2026-06-01 13:16:39,741] Trial 58 finished with value: 0.16917011180442448 and parameters: {'hidden_dims': '[512, 256]', 'dropout': 0.43866910990418617, 'batch_norm': False, 'lr': 0.0003399868654802502, 'weight_decay': 8.481624112273879e-08, 'epochs': 123, 'loss': 'mse', 'optimizer': 'adamw', 'use_snp_selection': False, 'n_pcs': 1500}. Best is trial 10 with value: 0.20408155490563423.
2026-06-01 13:16:39 | INFO | Trial 59 | outer=6 | hidden=[256, 128] epochs=159 lr=2.785e-04 wd=3.112e-08 n_pcs=2000 weight={'name': 'uniform'}
[I 2026-06-01 13:16:43,395] Trial 59 finished with value: 0.19044811176948354 and parameters: {'hidden_dims': '[256, 128]', 'dropout': 0.5099268339225268, 'batch_norm': False, 'lr': 0.00027848894662876606, 'weight_decay': 3.111965125819511e-08, 'epochs': 159, 'loss': 'mse', 'optimizer': 'adamw', 'use_snp_selection': False, 'n_pcs': 2000}. Best is trial 10 with value: 0.20408155490563423.
2026-06-01 13:16:43 | INFO | Trial 60 | outer=6 | hidden=[256, 128] epochs=80 lr=2.323e-05 wd=1.874e-08 n_pcs=500 weight={'name': 'uniform'}
[I 2026-06-01 13:16:44,908] Trial 60 pruned. 
2026-06-01 13:16:44 | INFO | Trial 61 | outer=6 | hidden=[128, 64] epochs=82 lr=4.927e-04 wd=1.403e-07 n_pcs=1000 weight={'name': 'uniform'}
[I 2026-06-01 13:16:47,561] Trial 61 finished with value: 0.1781389617340395 and parameters: {'hidden_dims': '[128, 64]', 'dropout': 0.4833914167594515, 'batch_norm': False, 'lr': 0.0004927138715465874, 'weight_decay': 1.4031827450722746e-07, 'epochs': 82, 'loss': 'mse', 'optimizer': 'adamw', 'use_snp_selection': False, 'n_pcs': 1000}. Best is trial 10 with value: 0.20408155490563423.
2026-06-01 13:16:47 | INFO | Trial 62 | outer=6 | hidden=[128, 64] epochs=66 lr=4.461e-04 wd=1.454e-08 n_pcs=1500 weight={'name': 'uniform'}
[I 2026-06-01 13:16:49,982] Trial 62 finished with value: 0.16575388979588204 and parameters: {'hidden_dims': '[128, 64]', 'dropout': 0.40513188985623855, 'batch_norm': False, 'lr': 0.00044607657617018107, 'weight_decay': 1.4541127738220787e-08, 'epochs': 66, 'loss': 'mse', 'optimizer': 'adamw', 'use_snp_selection': False, 'n_pcs': 1500}. Best is trial 10 with value: 0.20408155490563423.
2026-06-01 13:16:49 | INFO | Trial 63 | outer=6 | hidden=[128, 64] epochs=90 lr=3.832e-04 wd=3.821e-08 n_pcs=1000 weight={'name': 'uniform'}
[I 2026-06-01 13:16:52,661] Trial 63 finished with value: 0.19531913704528364 and parameters: {'hidden_dims': '[128, 64]', 'dropout': 0.45526691829722754, 'batch_norm': False, 'lr': 0.00038315856584876946, 'weight_decay': 3.8210668164992274e-08, 'epochs': 90, 'loss': 'mse', 'optimizer': 'adamw', 'use_snp_selection': False, 'n_pcs': 1000}. Best is trial 10 with value: 0.20408155490563423.
2026-06-01 13:16:52 | INFO | Trial 64 | outer=6 | hidden=[128, 64] epochs=100 lr=2.397e-04 wd=5.306e-08 n_pcs=1000 weight={'name': 'uniform'}
[I 2026-06-01 13:16:54,348] Trial 64 pruned. 
2026-06-01 13:16:54 | INFO | Trial 65 | outer=6 | hidden=[1024, 256] epochs=193 lr=3.755e-04 wd=3.594e-08 n_pcs=1000 weight={'name': 'uniform'}
[I 2026-06-01 13:17:01,206] Trial 65 finished with value: 0.18881956520172707 and parameters: {'hidden_dims': '[1024, 256]', 'dropout': 0.4193781090256758, 'batch_norm': False, 'lr': 0.0003754764308162568, 'weight_decay': 3.593624496696474e-08, 'epochs': 193, 'loss': 'mse', 'optimizer': 'adamw', 'use_snp_selection': False, 'n_pcs': 1000}. Best is trial 10 with value: 0.20408155490563423.
2026-06-01 13:17:01 | INFO | Trial 66 | outer=6 | hidden=[512, 64] epochs=92 lr=3.308e-04 wd=2.314e-08 n_pcs=5000 weight={'name': 'uniform'}
[I 2026-06-01 13:17:07,120] Trial 66 finished with value: 0.20265736884026567 and parameters: {'hidden_dims': '[512, 64]', 'dropout': 0.37681374661723993, 'batch_norm': False, 'lr': 0.00033078361239996816, 'weight_decay': 2.313996065451798e-08, 'epochs': 92, 'loss': 'mae', 'optimizer': 'adamw', 'use_snp_selection': False, 'n_pcs': 5000}. Best is trial 10 with value: 0.20408155490563423.
2026-06-01 13:17:07 | INFO | Trial 67 | outer=6 | hidden=[512, 64] epochs=90 lr=3.273e-04 wd=2.233e-08 n_pcs=5000 weight={'name': 'uniform'}
[I 2026-06-01 13:17:12,951] Trial 67 finished with value: 0.20448357058762237 and parameters: {'hidden_dims': '[512, 64]', 'dropout': 0.33401851871420163, 'batch_norm': False, 'lr': 0.00032732705817663504, 'weight_decay': 2.2330204135557946e-08, 'epochs': 90, 'loss': 'mae', 'optimizer': 'adamw', 'use_snp_selection': False, 'n_pcs': 5000}. Best is trial 67 with value: 0.20448357058762237.
2026-06-01 13:17:12 | INFO | Trial 68 | outer=6 | hidden=[512, 64] epochs=88 lr=3.273e-04 wd=2.326e-08 n_pcs=5000 weight={'name': 'uniform'}
[I 2026-06-01 13:17:18,709] Trial 68 finished with value: 0.19268246258246377 and parameters: {'hidden_dims': '[512, 64]', 'dropout': 0.3288419575761339, 'batch_norm': False, 'lr': 0.0003272622294477526, 'weight_decay': 2.3261085055583705e-08, 'epochs': 88, 'loss': 'mae', 'optimizer': 'adamw', 'use_snp_selection': False, 'n_pcs': 5000}. Best is trial 67 with value: 0.20448357058762237.
2026-06-01 13:17:18 | INFO | Trial 69 | outer=6 | hidden=[512, 64] epochs=52 lr=3.873e-04 wd=1.760e-04 n_pcs=4500 weight={'name': 'uniform'}
[I 2026-06-01 13:17:22,842] Trial 69 finished with value: 0.1996286214918292 and parameters: {'hidden_dims': '[512, 64]', 'dropout': 0.31007926697023364, 'batch_norm': False, 'lr': 0.00038727038527603454, 'weight_decay': 0.00017603086844597047, 'epochs': 52, 'loss': 'mae', 'optimizer': 'adamw', 'use_snp_selection': False, 'n_pcs': 4500}. Best is trial 67 with value: 0.20448357058762237.
2026-06-01 13:17:22 | INFO | Trial 70 | outer=6 | hidden=[512, 64] epochs=55 lr=4.031e-04 wd=1.939e-04 n_pcs=5000 weight={'name': 'uniform'}
[I 2026-06-01 13:17:27,259] Trial 70 finished with value: 0.20449956450427056 and parameters: {'hidden_dims': '[512, 64]', 'dropout': 0.2614679698061269, 'batch_norm': False, 'lr': 0.0004030618704011348, 'weight_decay': 0.00019392643786855695, 'epochs': 55, 'loss': 'mae', 'optimizer': 'adamw', 'use_snp_selection': False, 'n_pcs': 5000}. Best is trial 70 with value: 0.20449956450427056.
2026-06-01 13:17:27 | INFO | Trial 71 | outer=6 | hidden=[512, 64] epochs=50 lr=4.126e-04 wd=2.051e-04 n_pcs=5000 weight={'name': 'uniform'}
[I 2026-06-01 13:17:31,474] Trial 71 finished with value: 0.19305853169024395 and parameters: {'hidden_dims': '[512, 64]', 'dropout': 0.29879012288596896, 'batch_norm': False, 'lr': 0.00041260437752463006, 'weight_decay': 0.0002050668314638112, 'epochs': 50, 'loss': 'mae', 'optimizer': 'adamw', 'use_snp_selection': False, 'n_pcs': 5000}. Best is trial 70 with value: 0.20449956450427056.
2026-06-01 13:17:31 | INFO | Trial 72 | outer=6 | hidden=[512, 64] epochs=58 lr=3.244e-04 wd=5.467e-04 n_pcs=4500 weight={'name': 'uniform'}
[I 2026-06-01 13:17:35,847] Trial 72 finished with value: 0.2083593527241959 and parameters: {'hidden_dims': '[512, 64]', 'dropout': 0.25267346270663726, 'batch_norm': False, 'lr': 0.0003244413679411355, 'weight_decay': 0.0005466855785950937, 'epochs': 58, 'loss': 'mae', 'optimizer': 'adamw', 'use_snp_selection': False, 'n_pcs': 4500}. Best is trial 72 with value: 0.2083593527241959.
2026-06-01 13:17:35 | INFO | Trial 73 | outer=6 | hidden=[512, 64] epochs=58 lr=3.370e-04 wd=4.324e-04 n_pcs=4500 weight={'name': 'uniform'}
[I 2026-06-01 13:17:40,217] Trial 73 finished with value: 0.18952802944998653 and parameters: {'hidden_dims': '[512, 64]', 'dropout': 0.25503561916127326, 'batch_norm': False, 'lr': 0.00033701087325628364, 'weight_decay': 0.00043235869504592184, 'epochs': 58, 'loss': 'mae', 'optimizer': 'adamw', 'use_snp_selection': False, 'n_pcs': 4500}. Best is trial 72 with value: 0.2083593527241959.
2026-06-01 13:17:40 | INFO | Trial 74 | outer=6 | hidden=[512, 64] epochs=75 lr=2.736e-04 wd=5.914e-04 n_pcs=4500 weight={'name': 'uniform'}
[I 2026-06-01 13:17:45,248] Trial 74 finished with value: 0.18804990006752817 and parameters: {'hidden_dims': '[512, 64]', 'dropout': 0.19502088141563792, 'batch_norm': False, 'lr': 0.0002735560771692542, 'weight_decay': 0.0005913633385269588, 'epochs': 75, 'loss': 'mae', 'optimizer': 'adamw', 'use_snp_selection': False, 'n_pcs': 4500}. Best is trial 72 with value: 0.2083593527241959.
2026-06-01 13:17:45 | INFO | Trial 75 | outer=6 | hidden=[512, 64] epochs=65 lr=5.745e-05 wd=1.884e-04 n_pcs=5000 weight={'name': 'uniform'}
[I 2026-06-01 13:17:50,076] Trial 75 finished with value: 0.1463312491716159 and parameters: {'hidden_dims': '[512, 64]', 'dropout': 0.26378552151802614, 'batch_norm': False, 'lr': 5.7452220881513246e-05, 'weight_decay': 0.00018841218170689828, 'epochs': 65, 'loss': 'mae', 'optimizer': 'adamw', 'use_snp_selection': False, 'n_pcs': 5000}. Best is trial 72 with value: 0.2083593527241959.
2026-06-01 13:17:50 | INFO | Trial 76 | outer=6 | hidden=[512, 64] epochs=54 lr=2.188e-04 wd=8.195e-04 n_pcs=4500 weight={'name': 'uniform'}
[I 2026-06-01 13:17:54,296] Trial 76 finished with value: 0.19324721820626162 and parameters: {'hidden_dims': '[512, 64]', 'dropout': 0.23147166035990926, 'batch_norm': False, 'lr': 0.0002188261608822434, 'weight_decay': 0.0008194912109781588, 'epochs': 54, 'loss': 'mae', 'optimizer': 'adamw', 'use_snp_selection': False, 'n_pcs': 4500}. Best is trial 72 with value: 0.2083593527241959.
2026-06-01 13:17:54 | INFO | Trial 77 | outer=6 | hidden=[512, 64] epochs=69 lr=4.063e-04 wd=8.334e-05 n_pcs=4000 weight={'name': 'uniform'}
[I 2026-06-01 13:17:58,753] Trial 77 finished with value: 0.19173684761725412 and parameters: {'hidden_dims': '[512, 64]', 'dropout': 0.2968328662345593, 'batch_norm': False, 'lr': 0.0004062502941180613, 'weight_decay': 8.333671116074031e-05, 'epochs': 69, 'loss': 'mae', 'optimizer': 'adamw', 'use_snp_selection': False, 'n_pcs': 4000}. Best is trial 72 with value: 0.2083593527241959.
2026-06-01 13:17:58 | INFO | Trial 78 | outer=6 | hidden=[512, 64] epochs=60 lr=2.467e-04 wd=2.252e-04 n_pcs=5000 weight={'name': 'uniform'}
[I 2026-06-01 13:18:03,387] Trial 78 finished with value: 0.22255274480452733 and parameters: {'hidden_dims': '[512, 64]', 'dropout': 0.17756710624281732, 'batch_norm': False, 'lr': 0.00024674418358631566, 'weight_decay': 0.00022524720279863895, 'epochs': 60, 'loss': 'mae', 'optimizer': 'adam', 'use_snp_selection': False, 'n_pcs': 5000}. Best is trial 78 with value: 0.22255274480452733.
2026-06-01 13:18:03 | INFO | Trial 79 | outer=6 | hidden=[512, 64] epochs=56 lr=3.123e-04 wd=2.604e-04 n_pcs=5000 weight={'name': 'uniform'}
[I 2026-06-01 13:18:07,854] Trial 79 finished with value: 0.19524672260233156 and parameters: {'hidden_dims': '[512, 64]', 'dropout': 0.20486372169985986, 'batch_norm': False, 'lr': 0.0003123291281228101, 'weight_decay': 0.0002604419109261215, 'epochs': 56, 'loss': 'mae', 'optimizer': 'adam', 'use_snp_selection': False, 'n_pcs': 5000}. Best is trial 78 with value: 0.22255274480452733.
2026-06-01 13:18:07 | INFO | Trial 80 | outer=6 | hidden=[512, 64] epochs=76 lr=2.462e-04 wd=5.794e-04 n_pcs=4500 weight={'name': 'uniform'}
[I 2026-06-01 13:18:12,947] Trial 80 finished with value: 0.1903015970084388 and parameters: {'hidden_dims': '[512, 64]', 'dropout': 0.17156047642523126, 'batch_norm': False, 'lr': 0.0002461514423947776, 'weight_decay': 0.0005794330997867117, 'epochs': 76, 'loss': 'mae', 'optimizer': 'adam', 'use_snp_selection': False, 'n_pcs': 4500}. Best is trial 78 with value: 0.22255274480452733.
2026-06-01 13:18:12 | INFO | Trial 81 | outer=6 | hidden=[512, 64] epochs=62 lr=3.534e-04 wd=1.403e-04 n_pcs=5000 weight={'name': 'uniform'}
