[I 2026-06-01 14:03:18,239] Trial 113 finished with value: 0.18660529110263505 and parameters: {'hidden_dims': '[1024, 256]', 'dropout': 0.34040275544481313, 'batch_norm': False, 'lr': 0.00010597237514101227, 'weight_decay': 0.0003663654092879204, 'epochs': 209, 'loss': 'mae', 'optimizer': 'adam', 'use_snp_selection': False, 'n_pcs': 5000}. Best is trial 73 with value: 0.21325370510446945.
2026-06-01 14:03:18 | INFO | Trial 114 | outer=8 | hidden=[1024, 256] epochs=218 lr=7.955e-05 wd=7.653e-04 n_pcs=4000 weight={'name': 'uniform'}
[I 2026-06-01 14:03:38,097] Trial 114 finished with value: 0.19075199639214127 and parameters: {'hidden_dims': '[1024, 256]', 'dropout': 0.36029432422882707, 'batch_norm': False, 'lr': 7.954971529354967e-05, 'weight_decay': 0.000765308611752221, 'epochs': 218, 'loss': 'mae', 'optimizer': 'adam', 'use_snp_selection': False, 'n_pcs': 4000}. Best is trial 73 with value: 0.21325370510446945.
2026-06-01 14:03:38 | INFO | Trial 115 | outer=8 | hidden=[1024, 256] epochs=235 lr=5.144e-05 wd=6.098e-04 n_pcs=4500 weight={'name': 'uniform'}
[I 2026-06-01 14:04:01,245] Trial 115 finished with value: 0.1964435112377912 and parameters: {'hidden_dims': '[1024, 256]', 'dropout': 0.38954347574531784, 'batch_norm': False, 'lr': 5.1443546094696375e-05, 'weight_decay': 0.0006098024541699082, 'epochs': 235, 'loss': 'mae', 'optimizer': 'adam', 'use_snp_selection': False, 'n_pcs': 4500}. Best is trial 73 with value: 0.21325370510446945.
2026-06-01 14:04:01 | INFO | Trial 116 | outer=8 | hidden=[1024, 256] epochs=236 lr=5.294e-05 wd=6.158e-04 n_pcs=4500 weight={'name': 'uniform'}
[I 2026-06-01 14:04:24,511] Trial 116 finished with value: 0.17457806478804022 and parameters: {'hidden_dims': '[1024, 256]', 'dropout': 0.3870912021763428, 'batch_norm': False, 'lr': 5.294011966494233e-05, 'weight_decay': 0.0006157905501703711, 'epochs': 236, 'loss': 'mae', 'optimizer': 'adam', 'use_snp_selection': False, 'n_pcs': 4500}. Best is trial 73 with value: 0.21325370510446945.
2026-06-01 14:04:24 | INFO | Trial 117 | outer=8 | hidden=[1024, 256] epochs=190 lr=1.187e-04 wd=3.094e-04 n_pcs=4500 weight={'name': 'uniform'}
[I 2026-06-01 14:04:43,684] Trial 117 finished with value: 0.18669468467758582 and parameters: {'hidden_dims': '[1024, 256]', 'dropout': 0.288263657189971, 'batch_norm': False, 'lr': 0.00011870742603068946, 'weight_decay': 0.00030940954043654016, 'epochs': 190, 'loss': 'mae', 'optimizer': 'adam', 'use_snp_selection': False, 'n_pcs': 4500}. Best is trial 73 with value: 0.21325370510446945.
2026-06-01 14:04:43 | INFO | Trial 118 | outer=8 | hidden=[1024, 256] epochs=179 lr=4.562e-05 wd=1.861e-04 n_pcs=5000 weight={'name': 'uniform'}
[I 2026-06-01 14:05:03,461] Trial 118 finished with value: 0.1762799766913638 and parameters: {'hidden_dims': '[1024, 256]', 'dropout': 0.4200663173253269, 'batch_norm': False, 'lr': 4.5620188593469163e-05, 'weight_decay': 0.0001860770602150799, 'epochs': 179, 'loss': 'mae', 'optimizer': 'adam', 'use_snp_selection': False, 'n_pcs': 5000}. Best is trial 73 with value: 0.21325370510446945.
2026-06-01 14:05:03 | INFO | Trial 119 | outer=8 | hidden=[128, 64] epochs=204 lr=4.089e-05 wd=4.414e-04 n_pcs=4500 weight={'name': 'uniform'}
[I 2026-06-01 14:05:06,434] Trial 119 pruned. 
2026-06-01 14:05:06 | INFO | Trial 120 | outer=8 | hidden=[256, 64] epochs=221 lr=6.936e-05 wd=9.597e-04 n_pcs=4000 weight={'name': 'uniform'}
[I 2026-06-01 14:05:13,197] Trial 120 finished with value: 0.16623838902462298 and parameters: {'hidden_dims': '[256, 64]', 'dropout': 0.3243002965927104, 'batch_norm': False, 'lr': 6.936379951780398e-05, 'weight_decay': 0.0009596591079291823, 'epochs': 221, 'loss': 'mae', 'optimizer': 'adam', 'use_snp_selection': False, 'n_pcs': 4000}. Best is trial 73 with value: 0.21325370510446945.
2026-06-01 14:05:13 | INFO | Trial 121 | outer=8 | hidden=[1024, 256] epochs=169 lr=5.766e-05 wd=5.461e-04 n_pcs=5000 weight={'name': 'uniform'}
[I 2026-06-01 14:05:31,980] Trial 121 finished with value: 0.18587111665012787 and parameters: {'hidden_dims': '[1024, 256]', 'dropout': 0.4011321168871056, 'batch_norm': False, 'lr': 5.765512310823007e-05, 'weight_decay': 0.0005461220076419722, 'epochs': 169, 'loss': 'mae', 'optimizer': 'adam', 'use_snp_selection': False, 'n_pcs': 5000}. Best is trial 73 with value: 0.21325370510446945.
2026-06-01 14:05:31 | INFO | Trial 122 | outer=8 | hidden=[1024, 256] epochs=229 lr=1.029e-04 wd=8.294e-07 n_pcs=4500 weight={'name': 'uniform'}
[I 2026-06-01 14:05:54,572] Trial 122 finished with value: 0.19346932024345065 and parameters: {'hidden_dims': '[1024, 256]', 'dropout': 0.44636205821339026, 'batch_norm': False, 'lr': 0.00010294441701903993, 'weight_decay': 8.293573359059154e-07, 'epochs': 229, 'loss': 'mae', 'optimizer': 'adam', 'use_snp_selection': False, 'n_pcs': 4500}. Best is trial 73 with value: 0.21325370510446945.
2026-06-01 14:05:54 | INFO | Trial 123 | outer=8 | hidden=[1024, 256] epochs=212 lr=8.804e-05 wd=3.423e-04 n_pcs=4000 weight={'name': 'uniform'}
[I 2026-06-01 14:06:13,938] Trial 123 finished with value: 0.1989824667940398 and parameters: {'hidden_dims': '[1024, 256]', 'dropout': 0.2760106501773005, 'batch_norm': False, 'lr': 8.803991151927182e-05, 'weight_decay': 0.0003423151906586352, 'epochs': 212, 'loss': 'mae', 'optimizer': 'adam', 'use_snp_selection': False, 'n_pcs': 4000}. Best is trial 73 with value: 0.21325370510446945.
2026-06-01 14:06:13 | INFO | Trial 124 | outer=8 | hidden=[1024, 256] epochs=213 lr=8.680e-05 wd=3.114e-04 n_pcs=4000 weight={'name': 'uniform'}
[I 2026-06-01 14:06:33,392] Trial 124 finished with value: 0.1620707054297426 and parameters: {'hidden_dims': '[1024, 256]', 'dropout': 0.27684729191411156, 'batch_norm': False, 'lr': 8.680170239573931e-05, 'weight_decay': 0.0003113775275355929, 'epochs': 213, 'loss': 'mae', 'optimizer': 'adam', 'use_snp_selection': False, 'n_pcs': 4000}. Best is trial 73 with value: 0.21325370510446945.
2026-06-01 14:06:33 | INFO | Trial 125 | outer=8 | hidden=[1024, 256] epochs=208 lr=1.361e-04 wd=1.560e-04 n_pcs=4500 weight={'name': 'uniform'}
[I 2026-06-01 14:06:54,149] Trial 125 finished with value: 0.19726000115709705 and parameters: {'hidden_dims': '[1024, 256]', 'dropout': 0.3464627940340314, 'batch_norm': False, 'lr': 0.00013613296858565717, 'weight_decay': 0.00015595827989028823, 'epochs': 208, 'loss': 'mae', 'optimizer': 'adam', 'use_snp_selection': False, 'n_pcs': 4500}. Best is trial 73 with value: 0.21325370510446945.
2026-06-01 14:06:54 | INFO | Trial 126 | outer=8 | hidden=[1024, 256] epochs=199 lr=1.188e-04 wd=2.196e-04 n_pcs=5000 weight={'name': 'uniform'}
[I 2026-06-01 14:07:15,814] Trial 126 finished with value: 0.18699634360737988 and parameters: {'hidden_dims': '[1024, 256]', 'dropout': 0.34424127626375445, 'batch_norm': False, 'lr': 0.00011877628692680029, 'weight_decay': 0.0002195635049171042, 'epochs': 199, 'loss': 'mae', 'optimizer': 'adam', 'use_snp_selection': False, 'n_pcs': 5000}. Best is trial 73 with value: 0.21325370510446945.
2026-06-01 14:07:15 | INFO | Trial 127 | outer=8 | hidden=[1024, 256] epochs=208 lr=1.367e-04 wd=1.228e-04 n_pcs=4000 weight={'name': 'uniform'}
[I 2026-06-01 14:07:34,825] Trial 127 finished with value: 0.19416085208626524 and parameters: {'hidden_dims': '[1024, 256]', 'dropout': 0.30605448486379033, 'batch_norm': False, 'lr': 0.00013665752846158581, 'weight_decay': 0.0001227704287282165, 'epochs': 208, 'loss': 'mae', 'optimizer': 'adamw', 'use_snp_selection': False, 'n_pcs': 4000}. Best is trial 73 with value: 0.21325370510446945.
2026-06-01 14:07:34 | INFO | Trial 128 | outer=8 | hidden=[1024, 256] epochs=234 lr=1.091e-04 wd=2.446e-04 n_pcs=4500 weight={'name': 'uniform'}
[I 2026-06-01 14:07:57,873] Trial 128 finished with value: 0.19715228698483422 and parameters: {'hidden_dims': '[1024, 256]', 'dropout': 0.32853740060353454, 'batch_norm': False, 'lr': 0.00010913606242475785, 'weight_decay': 0.00024464010659043886, 'epochs': 234, 'loss': 'mae', 'optimizer': 'adam', 'use_snp_selection': False, 'n_pcs': 4500}. Best is trial 73 with value: 0.21325370510446945.
2026-06-01 14:07:57 | INFO | Trial 129 | outer=8 | hidden=[1024, 256] epochs=231 lr=7.462e-05 wd=1.569e-04 n_pcs=5000 weight={'name': 'uniform'}
[I 2026-06-01 14:08:22,625] Trial 129 finished with value: 0.18761001438853184 and parameters: {'hidden_dims': '[1024, 256]', 'dropout': 0.2504571843956035, 'batch_norm': False, 'lr': 7.462087746087878e-05, 'weight_decay': 0.00015689216752063788, 'epochs': 231, 'loss': 'mae', 'optimizer': 'adam', 'use_snp_selection': False, 'n_pcs': 5000}. Best is trial 73 with value: 0.21325370510446945.
2026-06-01 14:08:22 | INFO | Trial 130 | outer=8 | hidden=[256, 128] epochs=257 lr=1.307e-04 wd=2.218e-04 n_pcs=4000 weight={'name': 'uniform'}
[I 2026-06-01 14:08:30,301] Trial 130 finished with value: 0.17479389900321857 and parameters: {'hidden_dims': '[256, 128]', 'dropout': 0.33346208675795064, 'batch_norm': False, 'lr': 0.00013071888655285334, 'weight_decay': 0.00022184881759132423, 'epochs': 257, 'loss': 'mae', 'optimizer': 'adam', 'use_snp_selection': False, 'n_pcs': 4000}. Best is trial 73 with value: 0.21325370510446945.
2026-06-01 14:08:30 | INFO | Trial 131 | outer=8 | hidden=[1024, 256] epochs=239 lr=1.068e-04 wd=3.024e-04 n_pcs=4500 weight={'name': 'uniform'}
[I 2026-06-01 14:08:53,775] Trial 131 finished with value: 0.19205918450090456 and parameters: {'hidden_dims': '[1024, 256]', 'dropout': 0.32216319833055884, 'batch_norm': False, 'lr': 0.0001067641516114922, 'weight_decay': 0.000302433674494925, 'epochs': 239, 'loss': 'mae', 'optimizer': 'adam', 'use_snp_selection': False, 'n_pcs': 4500}. Best is trial 73 with value: 0.21325370510446945.
2026-06-01 14:08:53 | INFO | Trial 132 | outer=8 | hidden=[1024, 256] epochs=226 lr=1.177e-04 wd=6.911e-04 n_pcs=4500 weight={'name': 'uniform'}
[I 2026-06-01 14:09:16,114] Trial 132 finished with value: 0.18854051999235708 and parameters: {'hidden_dims': '[1024, 256]', 'dropout': 0.3711836016289446, 'batch_norm': False, 'lr': 0.00011767551506762348, 'weight_decay': 0.0006911131617935855, 'epochs': 226, 'loss': 'mae', 'optimizer': 'adam', 'use_snp_selection': False, 'n_pcs': 4500}. Best is trial 73 with value: 0.21325370510446945.
2026-06-01 14:09:16 | INFO | Trial 133 | outer=8 | hidden=[1024, 256] epochs=191 lr=9.379e-05 wd=3.783e-04 n_pcs=4500 weight={'name': 'uniform'}
[I 2026-06-01 14:09:35,351] Trial 133 finished with value: 0.17550994337109296 and parameters: {'hidden_dims': '[1024, 256]', 'dropout': 0.35326440629432476, 'batch_norm': False, 'lr': 9.378844655335956e-05, 'weight_decay': 0.0003782609238450931, 'epochs': 191, 'loss': 'mae', 'optimizer': 'adam', 'use_snp_selection': False, 'n_pcs': 4500}. Best is trial 73 with value: 0.21325370510446945.
2026-06-01 14:09:35 | INFO | Trial 134 | outer=8 | hidden=[1024, 256] epochs=205 lr=8.122e-05 wd=1.769e-04 n_pcs=4500 weight={'name': 'uniform'}
[I 2026-06-01 14:09:55,840] Trial 134 finished with value: 0.18920435244150746 and parameters: {'hidden_dims': '[1024, 256]', 'dropout': 0.3362174884932849, 'batch_norm': False, 'lr': 8.121796913833189e-05, 'weight_decay': 0.00017685849792784114, 'epochs': 205, 'loss': 'mae', 'optimizer': 'adam', 'use_snp_selection': False, 'n_pcs': 4500}. Best is trial 73 with value: 0.21325370510446945.
2026-06-01 14:09:55 | INFO | Trial 135 | outer=8 | hidden=[1024, 256] epochs=220 lr=1.419e-04 wd=7.823e-05 n_pcs=4000 weight={'name': 'uniform'}
[I 2026-06-01 14:10:15,920] Trial 135 finished with value: 0.19317398355414936 and parameters: {'hidden_dims': '[1024, 256]', 'dropout': 0.37796935261358944, 'batch_norm': False, 'lr': 0.00014188522204731303, 'weight_decay': 7.822788140302099e-05, 'epochs': 220, 'loss': 'mae', 'optimizer': 'adam', 'use_snp_selection': False, 'n_pcs': 4000}. Best is trial 73 with value: 0.21325370510446945.
2026-06-01 14:10:15 | INFO | Trial 136 | outer=8 | hidden=[1024, 256] epochs=213 lr=1.141e-04 wd=2.607e-04 n_pcs=5000 weight={'name': 'uniform'}
[I 2026-06-01 14:10:38,911] Trial 136 finished with value: 0.1861559346006106 and parameters: {'hidden_dims': '[1024, 256]', 'dropout': 0.2976247176997556, 'batch_norm': False, 'lr': 0.0001140997711239093, 'weight_decay': 0.0002606599990054981, 'epochs': 213, 'loss': 'mae', 'optimizer': 'adam', 'use_snp_selection': False, 'n_pcs': 5000}. Best is trial 73 with value: 0.21325370510446945.
2026-06-01 14:10:38 | INFO | Trial 137 | outer=8 | hidden=[128, 64] epochs=282 lr=1.017e-04 wd=3.760e-04 n_pcs=4500 weight={'name': 'uniform'}
[I 2026-06-01 14:10:45,010] Trial 137 finished with value: 0.19631943980822997 and parameters: {'hidden_dims': '[128, 64]', 'dropout': 0.4117869185583927, 'batch_norm': False, 'lr': 0.00010167133025108694, 'weight_decay': 0.00037600326292961783, 'epochs': 282, 'loss': 'mae', 'optimizer': 'adam', 'use_snp_selection': False, 'n_pcs': 4500}. Best is trial 73 with value: 0.21325370510446945.
2026-06-01 14:10:45 | INFO | Trial 138 | outer=8 | hidden=[128, 64] epochs=278 lr=3.143e-05 wd=5.692e-04 n_pcs=4500 weight={'name': 'uniform'}
[I 2026-06-01 14:10:48,619] Trial 138 pruned. 
2026-06-01 14:10:48 | INFO | Trial 139 | outer=8 | hidden=[128, 64] epochs=255 lr=9.012e-05 wd=7.087e-04 n_pcs=5000 weight={'name': 'uniform'}
[I 2026-06-01 14:10:54,519] Trial 139 finished with value: 0.16916014958561504 and parameters: {'hidden_dims': '[128, 64]', 'dropout': 0.38738615545301697, 'batch_norm': False, 'lr': 9.011961636062074e-05, 'weight_decay': 0.0007087355204329911, 'epochs': 255, 'loss': 'mae', 'optimizer': 'adam', 'use_snp_selection': False, 'n_pcs': 5000}. Best is trial 73 with value: 0.21325370510446945.
2026-06-01 14:10:54 | INFO | Trial 140 | outer=8 | hidden=[128, 64] epochs=288 lr=7.337e-05 wd=1.978e-08 n_pcs=4500 weight={'name': 'uniform'}
[I 2026-06-01 14:11:00,628] Trial 140 finished with value: 0.17521306049904178 and parameters: {'hidden_dims': '[128, 64]', 'dropout': 0.43363453534842206, 'batch_norm': False, 'lr': 7.33652574306312e-05, 'weight_decay': 1.9783584068866098e-08, 'epochs': 288, 'loss': 'mae', 'optimizer': 'adam', 'use_snp_selection': False, 'n_pcs': 4500}. Best is trial 73 with value: 0.21325370510446945.
2026-06-01 14:11:00 | INFO | Trial 141 | outer=8 | hidden=[128, 64] epochs=160 lr=1.271e-04 wd=3.566e-04 n_pcs=4500 weight={'name': 'uniform'}
[I 2026-06-01 14:11:04,985] Trial 141 finished with value: 0.1743867858110893 and parameters: {'hidden_dims': '[128, 64]', 'dropout': 0.36106020553111795, 'batch_norm': False, 'lr': 0.00012710046230217134, 'weight_decay': 0.0003565605389220241, 'epochs': 160, 'loss': 'mae', 'optimizer': 'adam', 'use_snp_selection': False, 'n_pcs': 4500}. Best is trial 73 with value: 0.21325370510446945.
2026-06-01 14:11:05 | INFO | Trial 142 | outer=8 | hidden=[1024, 256] epochs=207 lr=1.066e-04 wd=2.389e-04 n_pcs=4500 weight={'name': 'uniform'}
[I 2026-06-01 14:11:25,652] Trial 142 finished with value: 0.17456285796581322 and parameters: {'hidden_dims': '[1024, 256]', 'dropout': 0.31678623840217085, 'batch_norm': False, 'lr': 0.00010659392101727676, 'weight_decay': 0.00023889696606529053, 'epochs': 207, 'loss': 'mae', 'optimizer': 'adam', 'use_snp_selection': False, 'n_pcs': 4500}. Best is trial 73 with value: 0.21325370510446945.
2026-06-01 14:11:25 | INFO | Trial 143 | outer=8 | hidden=[256, 64] epochs=194 lr=1.008e-04 wd=4.730e-04 n_pcs=4500 weight={'name': 'uniform'}
[I 2026-06-01 14:11:32,489] Trial 143 finished with value: 0.1750503790988787 and parameters: {'hidden_dims': '[256, 64]', 'dropout': 0.3426374647512056, 'batch_norm': False, 'lr': 0.0001008154432551391, 'weight_decay': 0.0004730322628189573, 'epochs': 194, 'loss': 'mae', 'optimizer': 'adam', 'use_snp_selection': False, 'n_pcs': 4500}. Best is trial 73 with value: 0.21325370510446945.
2026-06-01 14:11:32 | INFO | Trial 144 | outer=8 | hidden=[1024, 256] epochs=185 lr=8.434e-05 wd=1.413e-04 n_pcs=1000 weight={'name': 'uniform'}
[I 2026-06-01 14:11:39,902] Trial 144 finished with value: 0.1949408310680295 and parameters: {'hidden_dims': '[1024, 256]', 'dropout': 0.3512844690910078, 'batch_norm': False, 'lr': 8.434496982088051e-05, 'weight_decay': 0.0001412770890604211, 'epochs': 185, 'loss': 'mae', 'optimizer': 'adam', 'use_snp_selection': False, 'n_pcs': 1000}. Best is trial 73 with value: 0.21325370510446945.
2026-06-01 14:11:39 | INFO | Trial 145 | outer=8 | hidden=[1024, 256] epochs=201 lr=1.221e-04 wd=3.281e-04 n_pcs=4000 weight={'name': 'uniform'}
[I 2026-06-01 14:11:58,424] Trial 145 finished with value: 0.17688404036631816 and parameters: {'hidden_dims': '[1024, 256]', 'dropout': 0.3680136173293048, 'batch_norm': False, 'lr': 0.0001220975464826008, 'weight_decay': 0.0003281346694461927, 'epochs': 201, 'loss': 'mae', 'optimizer': 'adam', 'use_snp_selection': False, 'n_pcs': 4000}. Best is trial 73 with value: 0.21325370510446945.
2026-06-01 14:11:58 | INFO | Trial 146 | outer=8 | hidden=[512, 128] epochs=296 lr=1.515e-04 wd=1.338e-06 n_pcs=4500 weight={'name': 'uniform'}
[I 2026-06-01 14:12:13,947] Trial 146 finished with value: 0.1862503625738296 and parameters: {'hidden_dims': '[512, 128]', 'dropout': 0.38558618154190866, 'batch_norm': False, 'lr': 0.00015148542680281857, 'weight_decay': 1.3378250851974933e-06, 'epochs': 296, 'loss': 'mae', 'optimizer': 'adam', 'use_snp_selection': False, 'n_pcs': 4500}. Best is trial 73 with value: 0.21325370510446945.
2026-06-01 14:12:13 | INFO | Trial 147 | outer=8 | hidden=[1024, 256] epochs=224 lr=1.369e-04 wd=4.293e-04 n_pcs=5000 weight={'name': 'uniform'}
[I 2026-06-01 14:12:38,036] Trial 147 finished with value: 0.18625337206193684 and parameters: {'hidden_dims': '[1024, 256]', 'dropout': 0.19665823732728646, 'batch_norm': False, 'lr': 0.00013688678495747293, 'weight_decay': 0.000429315099795159, 'epochs': 224, 'loss': 'mae', 'optimizer': 'adam', 'use_snp_selection': False, 'n_pcs': 5000}. Best is trial 73 with value: 0.21325370510446945.
2026-06-01 14:12:38 | INFO | Trial 148 | outer=8 | hidden=[1024, 256] epochs=231 lr=1.111e-04 wd=8.493e-04 n_pcs=500 weight={'name': 'uniform'}
[I 2026-06-01 14:12:44,647] Trial 148 finished with value: 0.1708855749833957 and parameters: {'hidden_dims': '[1024, 256]', 'dropout': 0.4647415455237771, 'batch_norm': False, 'lr': 0.00011111545465253739, 'weight_decay': 0.0008492544858993196, 'epochs': 231, 'loss': 'mae', 'optimizer': 'adam', 'use_snp_selection': False, 'n_pcs': 500}. Best is trial 73 with value: 0.21325370510446945.
2026-06-01 14:12:44 | INFO | Trial 149 | outer=8 | hidden=[128, 64] epochs=219 lr=9.411e-05 wd=2.006e-04 n_pcs=4500 weight={'name': 'uniform'}
[I 2026-06-01 14:12:49,813] Trial 149 finished with value: 0.16399096152640996 and parameters: {'hidden_dims': '[128, 64]', 'dropout': 0.3075067445111368, 'batch_norm': False, 'lr': 9.410900692870109e-05, 'weight_decay': 0.0002006083260272998, 'epochs': 219, 'loss': 'mae', 'optimizer': 'adamw', 'use_snp_selection': False, 'n_pcs': 4500}. Best is trial 73 with value: 0.21325370510446945.
2026-06-01 14:12:49 | INFO | OUTER 8 best (inner mean r=0.2133): model={'hidden_dims': [1024, 256], 'dropout': 0.5762817410080047, 'batch_norm': False, 'lr': 0.00021004473711251116, 'weight_decay': 0.00027260244545928246, 'epochs': 56, 'loss': 'mse', 'optimizer': 'adam', 'use_snp_selection': False, 'n_pcs': 2500} weighting={'name': 'uniform'}
2026-06-01 14:12:50 | INFO | OUTER 8 TEST r = 0.2723
2026-06-01 14:12:50 | INFO | OUTER 8 incremental summary saved to outputs/final_results/e8_pc_mlp_uniform/thr_wing/e8_pc_mlp_uniform_thr_wing_results.json
2026-06-01 14:12:50 | INFO | OUTER 9: test_size=151 island=8 (Lovund)
2026-06-01 14:12:50 | INFO | OUTER 9: inner LOIO validation islands: 0(Nesøy), 1(Myken), 2(Træna), 3(Selvær), 4(Gjerøy), 5(Hestmannøy), 6(Indre Kvarøy), 7(Onøy og Lurøy), 9(Sleneset), 10(Aldra), 11(Leka), 12(Vega), 13(Vikna), 14(Lauvøya)
2026-06-01 14:12:50 | INFO | OUTER 9: using top 10 related inner validation islands for tuning: 9(Sleneset, avgGRM=0.0219), 2(Træna, avgGRM=0.0119), 3(Selvær, avgGRM=0.0087), 1(Myken, avgGRM=0.0084), 7(Onøy og Lurøy, avgGRM=0.0058), 0(Nesøy, avgGRM=0.0024), 6(Indre Kvarøy, avgGRM=0.0023), 5(Hestmannøy, avgGRM=-0.0006), 12(Vega, avgGRM=-0.0012), 4(Gjerøy, avgGRM=-0.0020)
[I 2026-06-01 14:12:50,652] A new study created in memory with name: mlp_importance_inner_outer8
2026-06-01 14:12:50 | INFO | Trial 0 | outer=9 | hidden=[256, 64] epochs=252 lr=8.243e-05 wd=1.277e-07 n_pcs=1500 weight={'name': 'uniform'}
[I 2026-06-01 14:12:55,250] Trial 0 finished with value: 0.19453126730248602 and parameters: {'hidden_dims': '[256, 64]', 'dropout': 0.19097065492325918, 'batch_norm': False, 'lr': 8.242985198911028e-05, 'weight_decay': 1.277246473139888e-07, 'epochs': 252, 'loss': 'mae', 'optimizer': 'adamw', 'use_snp_selection': False, 'n_pcs': 1500}. Best is trial 0 with value: 0.19453126730248602.
2026-06-01 14:12:55 | INFO | Trial 1 | outer=9 | hidden=[1024, 256] epochs=225 lr=1.391e-04 wd=1.941e-07 n_pcs=500 weight={'name': 'uniform'}
[I 2026-06-01 14:13:01,770] Trial 1 finished with value: 0.17129716785549326 and parameters: {'hidden_dims': '[1024, 256]', 'dropout': 0.2849434595702811, 'batch_norm': False, 'lr': 0.00013909108684683413, 'weight_decay': 1.9407167964924495e-07, 'epochs': 225, 'loss': 'mse', 'optimizer': 'adamw', 'use_snp_selection': False, 'n_pcs': 500}. Best is trial 0 with value: 0.19453126730248602.
2026-06-01 14:13:01 | INFO | Trial 2 | outer=9 | hidden=[256, 64] epochs=139 lr=3.957e-05 wd=3.750e-05 n_pcs=2500 weight={'name': 'uniform'}
