[I 2026-06-01 12:10:18,281] Trial 83 finished with value: 0.1797172937551277 and parameters: {'hidden_dims': '[256, 128]', 'dropout': 0.4942694762357942, 'batch_norm': False, 'lr': 0.0001556274717764096, 'weight_decay': 2.1704875970817645e-07, 'epochs': 289, 'loss': 'mae', 'optimizer': 'adam', 'use_snp_selection': False, 'n_pcs': 2000}. Best is trial 64 with value: 0.19082431425353114.
2026-06-01 12:10:18 | INFO | Trial 84 | outer=3 | hidden=[256, 128] epochs=270 lr=1.624e-04 wd=2.087e-07 n_pcs=2000 weight={'name': 'uniform'}
[I 2026-06-01 12:10:23,576] Trial 84 finished with value: 0.16050188846595542 and parameters: {'hidden_dims': '[256, 128]', 'dropout': 0.5297410615851538, 'batch_norm': False, 'lr': 0.00016237674996811088, 'weight_decay': 2.0869181575436674e-07, 'epochs': 270, 'loss': 'mae', 'optimizer': 'adam', 'use_snp_selection': False, 'n_pcs': 2000}. Best is trial 64 with value: 0.19082431425353114.
2026-06-01 12:10:23 | INFO | Trial 85 | outer=3 | hidden=[256, 64] epochs=165 lr=1.176e-04 wd=4.419e-07 n_pcs=2000 weight={'name': 'uniform'}
[I 2026-06-01 12:10:27,418] Trial 85 finished with value: 0.19026486563201334 and parameters: {'hidden_dims': '[256, 64]', 'dropout': 0.5878646028845951, 'batch_norm': False, 'lr': 0.00011761799235811232, 'weight_decay': 4.418691382477608e-07, 'epochs': 165, 'loss': 'mae', 'optimizer': 'adam', 'use_snp_selection': False, 'n_pcs': 2000}. Best is trial 64 with value: 0.19082431425353114.
2026-06-01 12:10:27 | INFO | Trial 86 | outer=3 | hidden=[256, 64] epochs=174 lr=1.033e-04 wd=4.999e-07 n_pcs=2500 weight={'name': 'uniform'}
[I 2026-06-01 12:10:31,781] Trial 86 finished with value: 0.1355171162164501 and parameters: {'hidden_dims': '[256, 64]', 'dropout': 0.5903566586983945, 'batch_norm': False, 'lr': 0.00010334202587152148, 'weight_decay': 4.999251183355843e-07, 'epochs': 174, 'loss': 'mae', 'optimizer': 'adam', 'use_snp_selection': False, 'n_pcs': 2500}. Best is trial 64 with value: 0.19082431425353114.
2026-06-01 12:10:31 | INFO | Trial 87 | outer=3 | hidden=[256, 64] epochs=163 lr=1.192e-04 wd=1.034e-07 n_pcs=2000 weight={'name': 'uniform'}
[I 2026-06-01 12:10:34,472] Trial 87 pruned. 
2026-06-01 12:10:34 | INFO | Trial 88 | outer=3 | hidden=[256, 64] epochs=141 lr=1.902e-05 wd=1.235e-06 n_pcs=1500 weight={'name': 'uniform'}
[I 2026-06-01 12:10:36,453] Trial 88 pruned. 
2026-06-01 12:10:36 | INFO | Trial 89 | outer=3 | hidden=[256, 64] epochs=152 lr=1.293e-04 wd=6.130e-08 n_pcs=3000 weight={'name': 'uniform'}
[I 2026-06-01 12:10:40,947] Trial 89 finished with value: 0.15737018200059721 and parameters: {'hidden_dims': '[256, 64]', 'dropout': 0.5984567947119174, 'batch_norm': False, 'lr': 0.0001292955120101749, 'weight_decay': 6.130351673072964e-08, 'epochs': 152, 'loss': 'mae', 'optimizer': 'adam', 'use_snp_selection': False, 'n_pcs': 3000}. Best is trial 64 with value: 0.19082431425353114.
2026-06-01 12:10:40 | INFO | Trial 90 | outer=3 | hidden=[512, 256] epochs=123 lr=1.907e-04 wd=1.220e-08 n_pcs=1500 weight={'name': 'uniform'}
[I 2026-06-01 12:10:45,279] Trial 90 finished with value: 0.16190765771805335 and parameters: {'hidden_dims': '[512, 256]', 'dropout': 0.43509641895774737, 'batch_norm': False, 'lr': 0.0001907099019230085, 'weight_decay': 1.2195597348220237e-08, 'epochs': 123, 'loss': 'mae', 'optimizer': 'adam', 'use_snp_selection': False, 'n_pcs': 1500}. Best is trial 64 with value: 0.19082431425353114.
2026-06-01 12:10:45 | INFO | Trial 91 | outer=3 | hidden=[256, 128] epochs=106 lr=1.398e-04 wd=6.900e-07 n_pcs=2000 weight={'name': 'uniform'}
[I 2026-06-01 12:10:48,394] Trial 91 finished with value: 0.16946757227499912 and parameters: {'hidden_dims': '[256, 128]', 'dropout': 0.5521673707397933, 'batch_norm': False, 'lr': 0.00013977687481376753, 'weight_decay': 6.899903721409206e-07, 'epochs': 106, 'loss': 'mae', 'optimizer': 'adam', 'use_snp_selection': False, 'n_pcs': 2000}. Best is trial 64 with value: 0.19082431425353114.
2026-06-01 12:10:48 | INFO | Trial 92 | outer=3 | hidden=[256, 128] epochs=168 lr=1.760e-04 wd=3.169e-07 n_pcs=2000 weight={'name': 'uniform'}
[I 2026-06-01 12:10:51,144] Trial 92 pruned. 
2026-06-01 12:10:51 | INFO | Trial 93 | outer=3 | hidden=[1024, 256] epochs=277 lr=1.546e-04 wd=1.838e-07 n_pcs=2500 weight={'name': 'uniform'}
[I 2026-06-01 12:11:08,204] Trial 93 finished with value: 0.1592994650996823 and parameters: {'hidden_dims': '[1024, 256]', 'dropout': 0.2808455198359725, 'batch_norm': False, 'lr': 0.00015461356861788236, 'weight_decay': 1.838034903229845e-07, 'epochs': 277, 'loss': 'mae', 'optimizer': 'adam', 'use_snp_selection': False, 'n_pcs': 2500}. Best is trial 64 with value: 0.19082431425353114.
2026-06-01 12:11:08 | INFO | Trial 94 | outer=3 | hidden=[256, 128] epochs=254 lr=1.179e-04 wd=1.012e-06 n_pcs=2000 weight={'name': 'uniform'}
[I 2026-06-01 12:11:13,271] Trial 94 finished with value: 0.16629039515690555 and parameters: {'hidden_dims': '[256, 128]', 'dropout': 0.4914851375628939, 'batch_norm': False, 'lr': 0.00011789457426709088, 'weight_decay': 1.0121555383835667e-06, 'epochs': 254, 'loss': 'mae', 'optimizer': 'adam', 'use_snp_selection': False, 'n_pcs': 2000}. Best is trial 64 with value: 0.19082431425353114.
2026-06-01 12:11:13 | INFO | Trial 95 | outer=3 | hidden=[512, 128] epochs=176 lr=9.806e-05 wd=5.239e-07 n_pcs=2500 weight={'name': 'uniform'}
[I 2026-06-01 12:11:19,796] Trial 95 finished with value: 0.16971676292580512 and parameters: {'hidden_dims': '[512, 128]', 'dropout': 0.5438427336837875, 'batch_norm': False, 'lr': 9.80630016557246e-05, 'weight_decay': 5.239328353215964e-07, 'epochs': 176, 'loss': 'mae', 'optimizer': 'adam', 'use_snp_selection': False, 'n_pcs': 2500}. Best is trial 64 with value: 0.19082431425353114.
2026-06-01 12:11:19 | INFO | Trial 96 | outer=3 | hidden=[256, 128] epochs=235 lr=2.030e-04 wd=4.248e-07 n_pcs=1500 weight={'name': 'uniform'}
[I 2026-06-01 12:11:24,448] Trial 96 finished with value: 0.1664792159615458 and parameters: {'hidden_dims': '[256, 128]', 'dropout': 0.4720996749406742, 'batch_norm': False, 'lr': 0.00020297835276232885, 'weight_decay': 4.2482794955586203e-07, 'epochs': 235, 'loss': 'mae', 'optimizer': 'adam', 'use_snp_selection': False, 'n_pcs': 1500}. Best is trial 64 with value: 0.19082431425353114.
2026-06-01 12:11:24 | INFO | Trial 97 | outer=3 | hidden=[256, 64] epochs=205 lr=2.824e-04 wd=2.821e-08 n_pcs=2000 weight={'name': 'uniform'}
[I 2026-06-01 12:11:28,826] Trial 97 finished with value: 0.17094653836087254 and parameters: {'hidden_dims': '[256, 64]', 'dropout': 0.585912602052864, 'batch_norm': False, 'lr': 0.0002824165129580177, 'weight_decay': 2.8208245494276804e-08, 'epochs': 205, 'loss': 'mae', 'optimizer': 'adam', 'use_snp_selection': False, 'n_pcs': 2000}. Best is trial 64 with value: 0.19082431425353114.
2026-06-01 12:11:28 | INFO | Trial 98 | outer=3 | hidden=[512, 64] epochs=245 lr=7.666e-05 wd=1.830e-08 n_pcs=2000 weight={'name': 'uniform'}
[I 2026-06-01 12:11:35,904] Trial 98 finished with value: 0.17882188785126749 and parameters: {'hidden_dims': '[512, 64]', 'dropout': 0.4141424207077139, 'batch_norm': False, 'lr': 7.665662143360864e-05, 'weight_decay': 1.8296037975281755e-08, 'epochs': 245, 'loss': 'mae', 'optimizer': 'adam', 'use_snp_selection': False, 'n_pcs': 2000}. Best is trial 64 with value: 0.19082431425353114.
2026-06-01 12:11:35 | INFO | Trial 99 | outer=3 | hidden=[512, 64] epochs=299 lr=8.088e-05 wd=1.455e-08 n_pcs=1500 weight={'name': 'uniform'}
[I 2026-06-01 12:11:40,913] Trial 99 pruned. 
2026-06-01 12:11:40 | INFO | Trial 100 | outer=3 | hidden=[512, 64] epochs=223 lr=6.021e-05 wd=1.814e-08 n_pcs=4000 weight={'name': 'uniform'}
[I 2026-06-01 12:11:51,691] Trial 100 finished with value: 0.1664514412601798 and parameters: {'hidden_dims': '[512, 64]', 'dropout': 0.4177259143436157, 'batch_norm': False, 'lr': 6.020844821405522e-05, 'weight_decay': 1.8135869582889265e-08, 'epochs': 223, 'loss': 'mae', 'optimizer': 'adam', 'use_snp_selection': False, 'n_pcs': 4000}. Best is trial 64 with value: 0.19082431425353114.
2026-06-01 12:11:51 | INFO | Trial 101 | outer=3 | hidden=[512, 64] epochs=260 lr=1.243e-04 wd=1.023e-08 n_pcs=2000 weight={'name': 'uniform'}
[I 2026-06-01 12:11:59,109] Trial 101 finished with value: 0.17535594783351555 and parameters: {'hidden_dims': '[512, 64]', 'dropout': 0.3669971656999479, 'batch_norm': False, 'lr': 0.0001242649946264707, 'weight_decay': 1.0230492413317113e-08, 'epochs': 260, 'loss': 'mae', 'optimizer': 'adam', 'use_snp_selection': False, 'n_pcs': 2000}. Best is trial 64 with value: 0.19082431425353114.
2026-06-01 12:11:59 | INFO | Trial 102 | outer=3 | hidden=[512, 64] epochs=135 lr=1.459e-04 wd=3.421e-08 n_pcs=2000 weight={'name': 'uniform'}
[I 2026-06-01 12:12:03,797] Trial 102 finished with value: 0.17096386528398025 and parameters: {'hidden_dims': '[512, 64]', 'dropout': 0.5164956057419079, 'batch_norm': False, 'lr': 0.00014585712842545397, 'weight_decay': 3.4211568824281606e-08, 'epochs': 135, 'loss': 'mae', 'optimizer': 'adam', 'use_snp_selection': False, 'n_pcs': 2000}. Best is trial 64 with value: 0.19082431425353114.
2026-06-01 12:12:03 | INFO | Trial 103 | outer=3 | hidden=[256, 128] epochs=242 lr=8.923e-05 wd=1.996e-08 n_pcs=2500 weight={'name': 'uniform'}
[I 2026-06-01 12:12:09,270] Trial 103 finished with value: 0.177822109069045 and parameters: {'hidden_dims': '[256, 128]', 'dropout': 0.5660724151713566, 'batch_norm': False, 'lr': 8.923154331656634e-05, 'weight_decay': 1.9962922576083955e-08, 'epochs': 242, 'loss': 'mae', 'optimizer': 'adam', 'use_snp_selection': False, 'n_pcs': 2500}. Best is trial 64 with value: 0.19082431425353114.
2026-06-01 12:12:09 | INFO | Trial 104 | outer=3 | hidden=[128, 64] epochs=160 lr=1.673e-04 wd=4.940e-08 n_pcs=2000 weight={'name': 'uniform'}
[I 2026-06-01 12:12:12,770] Trial 104 finished with value: 0.1632379344758434 and parameters: {'hidden_dims': '[128, 64]', 'dropout': 0.5347549792094024, 'batch_norm': False, 'lr': 0.00016732418778924444, 'weight_decay': 4.9403614657809194e-08, 'epochs': 160, 'loss': 'mae', 'optimizer': 'adam', 'use_snp_selection': False, 'n_pcs': 2000}. Best is trial 64 with value: 0.19082431425353114.
2026-06-01 12:12:12 | INFO | Trial 105 | outer=3 | hidden=[256, 128] epochs=115 lr=1.024e-04 wd=1.085e-07 n_pcs=2000 weight={'name': 'uniform'}
[I 2026-06-01 12:12:15,993] Trial 105 finished with value: 0.1774226931148925 and parameters: {'hidden_dims': '[256, 128]', 'dropout': 0.20291739440490503, 'batch_norm': False, 'lr': 0.00010241685813156479, 'weight_decay': 1.084714489227986e-07, 'epochs': 115, 'loss': 'mae', 'optimizer': 'adam', 'use_snp_selection': False, 'n_pcs': 2000}. Best is trial 64 with value: 0.19082431425353114.
2026-06-01 12:12:16 | INFO | Trial 106 | outer=3 | hidden=[256, 128] epochs=127 lr=7.375e-05 wd=2.516e-07 n_pcs=2500 weight={'name': 'uniform'}
[I 2026-06-01 12:12:19,715] Trial 106 finished with value: 0.18109548575311007 and parameters: {'hidden_dims': '[256, 128]', 'dropout': 0.4914102756012777, 'batch_norm': False, 'lr': 7.375125383737556e-05, 'weight_decay': 2.5161373998876403e-07, 'epochs': 127, 'loss': 'mae', 'optimizer': 'adamw', 'use_snp_selection': False, 'n_pcs': 2500}. Best is trial 64 with value: 0.19082431425353114.
2026-06-01 12:12:19 | INFO | Trial 107 | outer=3 | hidden=[256, 128] epochs=130 lr=2.474e-04 wd=2.706e-07 n_pcs=3500 weight={'name': 'uniform'}
[I 2026-06-01 12:12:24,248] Trial 107 finished with value: 0.15301217342949708 and parameters: {'hidden_dims': '[256, 128]', 'dropout': 0.48992993449971234, 'batch_norm': False, 'lr': 0.00024742318061908743, 'weight_decay': 2.7059004163506743e-07, 'epochs': 130, 'loss': 'mae', 'optimizer': 'adamw', 'use_snp_selection': False, 'n_pcs': 3500}. Best is trial 64 with value: 0.19082431425353114.
2026-06-01 12:12:24 | INFO | Trial 108 | outer=3 | hidden=[256, 64] epochs=125 lr=6.598e-05 wd=7.509e-08 n_pcs=2500 weight={'name': 'uniform'}
[I 2026-06-01 12:12:27,886] Trial 108 finished with value: 0.1619523010037942 and parameters: {'hidden_dims': '[256, 64]', 'dropout': 0.3956623131145994, 'batch_norm': False, 'lr': 6.598239193534204e-05, 'weight_decay': 7.509203838477704e-08, 'epochs': 125, 'loss': 'mae', 'optimizer': 'adamw', 'use_snp_selection': False, 'n_pcs': 2500}. Best is trial 64 with value: 0.19082431425353114.
2026-06-01 12:12:27 | INFO | Trial 109 | outer=3 | hidden=[256, 128] epochs=143 lr=5.430e-05 wd=2.489e-08 n_pcs=2500 weight={'name': 'uniform'}
[I 2026-06-01 12:12:31,849] Trial 109 finished with value: 0.1580049239444905 and parameters: {'hidden_dims': '[256, 128]', 'dropout': 0.4471975813480877, 'batch_norm': False, 'lr': 5.4298361586411706e-05, 'weight_decay': 2.4892098244559472e-08, 'epochs': 143, 'loss': 'mae', 'optimizer': 'adamw', 'use_snp_selection': False, 'n_pcs': 2500}. Best is trial 64 with value: 0.19082431425353114.
2026-06-01 12:12:31 | INFO | Trial 110 | outer=3 | hidden=[512, 256] epochs=168 lr=7.439e-05 wd=1.744e-07 n_pcs=3000 weight={'name': 'uniform'}
[I 2026-06-01 12:12:39,376] Trial 110 finished with value: 0.14464684397916194 and parameters: {'hidden_dims': '[512, 256]', 'dropout': 0.4277271769085018, 'batch_norm': False, 'lr': 7.439041568924428e-05, 'weight_decay': 1.7437028434848888e-07, 'epochs': 168, 'loss': 'mae', 'optimizer': 'adamw', 'use_snp_selection': False, 'n_pcs': 3000}. Best is trial 64 with value: 0.19082431425353114.
2026-06-01 12:12:39 | INFO | Trial 111 | outer=3 | hidden=[256, 128] epochs=248 lr=1.144e-04 wd=7.345e-07 n_pcs=2500 weight={'name': 'uniform'}
[I 2026-06-01 12:12:44,952] Trial 111 finished with value: 0.15220703789454798 and parameters: {'hidden_dims': '[256, 128]', 'dropout': 0.5045014691511037, 'batch_norm': False, 'lr': 0.00011439161243110175, 'weight_decay': 7.345191843137414e-07, 'epochs': 248, 'loss': 'mae', 'optimizer': 'adamw', 'use_snp_selection': False, 'n_pcs': 2500}. Best is trial 64 with value: 0.19082431425353114.
2026-06-01 12:12:44 | INFO | Trial 112 | outer=3 | hidden=[256, 128] epochs=147 lr=1.373e-04 wd=1.408e-06 n_pcs=2000 weight={'name': 'uniform'}
[I 2026-06-01 12:12:47,510] Trial 112 pruned. 
2026-06-01 12:12:47 | INFO | Trial 113 | outer=3 | hidden=[256, 128] epochs=187 lr=1.822e-04 wd=3.858e-07 n_pcs=2000 weight={'name': 'uniform'}
[I 2026-06-01 12:12:50,879] Trial 113 pruned. 
2026-06-01 12:12:50 | INFO | Trial 114 | outer=3 | hidden=[256, 128] epochs=155 lr=3.426e-04 wd=2.474e-07 n_pcs=1500 weight={'name': 'uniform'}
[I 2026-06-01 12:12:54,472] Trial 114 finished with value: 0.15243444976642925 and parameters: {'hidden_dims': '[256, 128]', 'dropout': 0.51822684731639, 'batch_norm': False, 'lr': 0.0003425932496212822, 'weight_decay': 2.474000582734843e-07, 'epochs': 155, 'loss': 'mae', 'optimizer': 'adam', 'use_snp_selection': False, 'n_pcs': 1500}. Best is trial 64 with value: 0.19082431425353114.
2026-06-01 12:12:54 | INFO | Trial 115 | outer=3 | hidden=[512, 64] epochs=118 lr=1.559e-04 wd=5.407e-07 n_pcs=2500 weight={'name': 'uniform'}
[I 2026-06-01 12:12:59,324] Trial 115 finished with value: 0.15089212068108354 and parameters: {'hidden_dims': '[512, 64]', 'dropout': 0.47927248761518937, 'batch_norm': False, 'lr': 0.00015592674692918904, 'weight_decay': 5.407438305724278e-07, 'epochs': 118, 'loss': 'mae', 'optimizer': 'adam', 'use_snp_selection': False, 'n_pcs': 2500}. Best is trial 64 with value: 0.19082431425353114.
2026-06-01 12:12:59 | INFO | Trial 116 | outer=3 | hidden=[256, 128] epochs=104 lr=1.305e-04 wd=3.859e-08 n_pcs=2000 weight={'name': 'uniform'}
[I 2026-06-01 12:13:02,406] Trial 116 finished with value: 0.16593003775205342 and parameters: {'hidden_dims': '[256, 128]', 'dropout': 0.5557326099949551, 'batch_norm': False, 'lr': 0.00013045231681734442, 'weight_decay': 3.858699611859573e-08, 'epochs': 104, 'loss': 'mae', 'optimizer': 'adamw', 'use_snp_selection': False, 'n_pcs': 2000}. Best is trial 64 with value: 0.19082431425353114.
2026-06-01 12:13:02 | INFO | Trial 117 | outer=3 | hidden=[1024, 256] epochs=216 lr=7.830e-05 wd=3.187e-07 n_pcs=2500 weight={'name': 'uniform'}
[I 2026-06-01 12:13:16,117] Trial 117 finished with value: 0.15972596538569733 and parameters: {'hidden_dims': '[1024, 256]', 'dropout': 0.5265465381948897, 'batch_norm': False, 'lr': 7.830448636631602e-05, 'weight_decay': 3.1865161700456466e-07, 'epochs': 216, 'loss': 'mae', 'optimizer': 'adam', 'use_snp_selection': False, 'n_pcs': 2500}. Best is trial 64 with value: 0.19082431425353114.
2026-06-01 12:13:16 | INFO | Trial 118 | outer=3 | hidden=[256, 64] epochs=230 lr=6.747e-05 wd=4.217e-04 n_pcs=2000 weight={'name': 'uniform'}
[I 2026-06-01 12:13:20,823] Trial 118 finished with value: 0.1883844438169923 and parameters: {'hidden_dims': '[256, 64]', 'dropout': 0.5429177310355497, 'batch_norm': False, 'lr': 6.74731195670035e-05, 'weight_decay': 0.00042168660245592206, 'epochs': 230, 'loss': 'mse', 'optimizer': 'adam', 'use_snp_selection': False, 'n_pcs': 2000}. Best is trial 64 with value: 0.19082431425353114.
2026-06-01 12:13:20 | INFO | Trial 119 | outer=3 | hidden=[256, 64] epochs=240 lr=5.363e-05 wd=2.424e-05 n_pcs=1000 weight={'name': 'uniform'}
[I 2026-06-01 12:13:23,631] Trial 119 pruned. 
2026-06-01 12:13:23 | INFO | Trial 120 | outer=3 | hidden=[256, 64] epochs=264 lr=6.818e-05 wd=1.333e-08 n_pcs=2000 weight={'name': 'uniform'}
[I 2026-06-01 12:13:28,713] Trial 120 finished with value: 0.1715085786224514 and parameters: {'hidden_dims': '[256, 64]', 'dropout': 0.5656328759164728, 'batch_norm': False, 'lr': 6.818236489728772e-05, 'weight_decay': 1.3328317168581128e-08, 'epochs': 264, 'loss': 'mse', 'optimizer': 'adam', 'use_snp_selection': False, 'n_pcs': 2000}. Best is trial 64 with value: 0.19082431425353114.
2026-06-01 12:13:28 | INFO | Trial 121 | outer=3 | hidden=[256, 64] epochs=231 lr=1.076e-04 wd=2.247e-07 n_pcs=2000 weight={'name': 'uniform'}
[I 2026-06-01 12:13:33,374] Trial 121 finished with value: 0.18052213340558249 and parameters: {'hidden_dims': '[256, 64]', 'dropout': 0.5002766433659686, 'batch_norm': False, 'lr': 0.00010762273313206948, 'weight_decay': 2.247293230767502e-07, 'epochs': 231, 'loss': 'mse', 'optimizer': 'adam', 'use_snp_selection': False, 'n_pcs': 2000}. Best is trial 64 with value: 0.19082431425353114.
2026-06-01 12:13:33 | INFO | Trial 122 | outer=3 | hidden=[256, 64] epochs=230 lr=9.298e-05 wd=8.290e-05 n_pcs=2000 weight={'name': 'uniform'}
[I 2026-06-01 12:13:38,020] Trial 122 finished with value: 0.16869822837607298 and parameters: {'hidden_dims': '[256, 64]', 'dropout': 0.5441058874876306, 'batch_norm': False, 'lr': 9.298384683424998e-05, 'weight_decay': 8.290480440184017e-05, 'epochs': 230, 'loss': 'mse', 'optimizer': 'adam', 'use_snp_selection': False, 'n_pcs': 2000}. Best is trial 64 with value: 0.19082431425353114.
2026-06-01 12:13:38 | INFO | Trial 123 | outer=3 | hidden=[256, 64] epochs=227 lr=1.081e-04 wd=5.658e-05 n_pcs=2000 weight={'name': 'uniform'}
[I 2026-06-01 12:13:42,710] Trial 123 finished with value: 0.1628436400286524 and parameters: {'hidden_dims': '[256, 64]', 'dropout': 0.4908499789634046, 'batch_norm': False, 'lr': 0.00010814595625759693, 'weight_decay': 5.6579633549542975e-05, 'epochs': 227, 'loss': 'mse', 'optimizer': 'adam', 'use_snp_selection': False, 'n_pcs': 2000}. Best is trial 64 with value: 0.19082431425353114.
2026-06-01 12:13:42 | INFO | Trial 124 | outer=3 | hidden=[256, 64] epochs=252 lr=5.801e-05 wd=2.208e-07 n_pcs=4500 weight={'name': 'uniform'}
[I 2026-06-01 12:13:50,851] Trial 124 finished with value: 0.15133731257367 and parameters: {'hidden_dims': '[256, 64]', 'dropout': 0.5031675426748417, 'batch_norm': False, 'lr': 5.800827868347746e-05, 'weight_decay': 2.207756997778422e-07, 'epochs': 252, 'loss': 'mse', 'optimizer': 'adam', 'use_snp_selection': False, 'n_pcs': 4500}. Best is trial 64 with value: 0.19082431425353114.
2026-06-01 12:13:50 | INFO | Trial 125 | outer=3 | hidden=[256, 64] epochs=291 lr=1.012e-04 wd=1.613e-04 n_pcs=1500 weight={'name': 'uniform'}
[I 2026-06-01 12:13:56,321] Trial 125 finished with value: 0.16154694338272155 and parameters: {'hidden_dims': '[256, 64]', 'dropout': 0.5743828256882832, 'batch_norm': False, 'lr': 0.00010116782166919755, 'weight_decay': 0.00016131546006019782, 'epochs': 291, 'loss': 'mse', 'optimizer': 'adam', 'use_snp_selection': False, 'n_pcs': 1500}. Best is trial 64 with value: 0.19082431425353114.
2026-06-01 12:13:56 | INFO | Trial 126 | outer=3 | hidden=[256, 64] epochs=172 lr=8.284e-05 wd=1.383e-07 n_pcs=2500 weight={'name': 'uniform'}
[I 2026-06-01 12:14:00,688] Trial 126 finished with value: 0.16086789806393623 and parameters: {'hidden_dims': '[256, 64]', 'dropout': 0.5420031806981805, 'batch_norm': False, 'lr': 8.284017101348533e-05, 'weight_decay': 1.3826687453579617e-07, 'epochs': 172, 'loss': 'mse', 'optimizer': 'adam', 'use_snp_selection': False, 'n_pcs': 2500}. Best is trial 64 with value: 0.19082431425353114.
2026-06-01 12:14:00 | INFO | Trial 127 | outer=3 | hidden=[256, 64] epochs=277 lr=1.241e-04 wd=5.976e-04 n_pcs=2000 weight={'name': 'uniform'}
[I 2026-06-01 12:14:06,062] Trial 127 finished with value: 0.16659930780585525 and parameters: {'hidden_dims': '[256, 64]', 'dropout': 0.5984567908804083, 'batch_norm': False, 'lr': 0.0001241427467594972, 'weight_decay': 0.0005976411834378273, 'epochs': 277, 'loss': 'mse', 'optimizer': 'adam', 'use_snp_selection': False, 'n_pcs': 2000}. Best is trial 64 with value: 0.19082431425353114.
2026-06-01 12:14:06 | INFO | Trial 128 | outer=3 | hidden=[512, 128] epochs=249 lr=7.216e-05 wd=4.194e-06 n_pcs=1500 weight={'name': 'uniform'}
[I 2026-06-01 12:14:09,930] Trial 128 pruned. 
2026-06-01 12:14:09 | INFO | Trial 129 | outer=3 | hidden=[256, 64] epochs=234 lr=1.105e-04 wd=3.166e-04 n_pcs=2000 weight={'name': 'uniform'}
