[I 2026-06-01 12:06:44,011] Trial 34 finished with value: 0.1639147979983547 and parameters: {'hidden_dims': '[1024, 256]', 'dropout': 0.46221885715903366, 'batch_norm': False, 'lr': 0.00011767453401910172, 'weight_decay': 1.1231599260160431e-08, 'epochs': 127, 'loss': 'mse', 'optimizer': 'adam', 'use_snp_selection': False, 'n_pcs': 2500}. Best is trial 23 with value: 0.17882329200643524.
2026-06-01 12:06:44 | INFO | Trial 35 | outer=3 | hidden=[256, 128] epochs=155 lr=6.075e-05 wd=2.258e-08 n_pcs=500 weight={'name': 'uniform'}
[I 2026-06-01 12:06:46,043] Trial 35 pruned. 
2026-06-01 12:06:46 | INFO | Trial 36 | outer=3 | hidden=[256, 64] epochs=109 lr=3.070e-04 wd=1.690e-06 n_pcs=1500 weight={'name': 'uniform'}
[I 2026-06-01 12:06:48,155] Trial 36 pruned. 
2026-06-01 12:06:48 | INFO | Trial 37 | outer=3 | hidden=[256, 128] epochs=262 lr=7.947e-05 wd=2.333e-07 n_pcs=1000 weight={'name': 'uniform'}
[I 2026-06-01 12:06:51,177] Trial 37 pruned. 
2026-06-01 12:06:51 | INFO | Trial 38 | outer=3 | hidden=[512, 128] epochs=189 lr=1.637e-04 wd=6.424e-08 n_pcs=5000 weight={'name': 'uniform'}
[I 2026-06-01 12:07:02,322] Trial 38 finished with value: 0.16304152515554057 and parameters: {'hidden_dims': '[512, 128]', 'dropout': 0.4950378672600014, 'batch_norm': False, 'lr': 0.00016368326218775463, 'weight_decay': 6.423623810527742e-08, 'epochs': 189, 'loss': 'mae', 'optimizer': 'adamw', 'use_snp_selection': False, 'n_pcs': 5000}. Best is trial 23 with value: 0.17882329200643524.
2026-06-01 12:07:02 | INFO | Trial 39 | outer=3 | hidden=[512, 64] epochs=220 lr=4.186e-05 wd=5.057e-08 n_pcs=3500 weight={'name': 'uniform'}
[I 2026-06-01 12:07:12,023] Trial 39 finished with value: 0.17187138175522707 and parameters: {'hidden_dims': '[512, 64]', 'dropout': 0.5729858535295109, 'batch_norm': False, 'lr': 4.186312587120931e-05, 'weight_decay': 5.056935954111039e-08, 'epochs': 220, 'loss': 'mse', 'optimizer': 'adam', 'use_snp_selection': False, 'n_pcs': 3500}. Best is trial 23 with value: 0.17882329200643524.
2026-06-01 12:07:12 | INFO | Trial 40 | outer=3 | hidden=[256, 128] epochs=160 lr=1.240e-04 wd=1.683e-08 n_pcs=2500 weight={'name': 'uniform'}
[I 2026-06-01 12:07:16,243] Trial 40 finished with value: 0.14338325994448964 and parameters: {'hidden_dims': '[256, 128]', 'dropout': 0.33350733351066475, 'batch_norm': False, 'lr': 0.00012400590638137856, 'weight_decay': 1.6832179962508283e-08, 'epochs': 160, 'loss': 'mae', 'optimizer': 'adam', 'use_snp_selection': False, 'n_pcs': 2500}. Best is trial 23 with value: 0.17882329200643524.
2026-06-01 12:07:16 | INFO | Trial 41 | outer=3 | hidden=[256, 128] epochs=174 lr=2.594e-04 wd=1.068e-06 n_pcs=2000 weight={'name': 'uniform'}
[I 2026-06-01 12:07:20,245] Trial 41 finished with value: 0.18162740069850541 and parameters: {'hidden_dims': '[256, 128]', 'dropout': 0.5904074648842371, 'batch_norm': False, 'lr': 0.0002594480405934283, 'weight_decay': 1.0684153014848606e-06, 'epochs': 174, 'loss': 'mae', 'optimizer': 'adam', 'use_snp_selection': False, 'n_pcs': 2000}. Best is trial 41 with value: 0.18162740069850541.
2026-06-01 12:07:20 | INFO | Trial 42 | outer=3 | hidden=[256, 128] epochs=197 lr=1.956e-04 wd=1.692e-06 n_pcs=3000 weight={'name': 'uniform'}
[I 2026-06-01 12:07:25,586] Trial 42 finished with value: 0.14274303526466897 and parameters: {'hidden_dims': '[256, 128]', 'dropout': 0.5998949508534304, 'batch_norm': False, 'lr': 0.0001955531048205332, 'weight_decay': 1.6917447960664384e-06, 'epochs': 197, 'loss': 'mae', 'optimizer': 'adam', 'use_snp_selection': False, 'n_pcs': 3000}. Best is trial 41 with value: 0.18162740069850541.
2026-06-01 12:07:25 | INFO | Trial 43 | outer=3 | hidden=[256, 128] epochs=181 lr=2.826e-04 wd=3.073e-06 n_pcs=2000 weight={'name': 'uniform'}
[I 2026-06-01 12:07:29,683] Trial 43 finished with value: 0.1628060657305484 and parameters: {'hidden_dims': '[256, 128]', 'dropout': 0.5304699173906032, 'batch_norm': False, 'lr': 0.0002826100450918043, 'weight_decay': 3.0728261302854655e-06, 'epochs': 181, 'loss': 'mae', 'optimizer': 'adam', 'use_snp_selection': False, 'n_pcs': 2000}. Best is trial 41 with value: 0.18162740069850541.
2026-06-01 12:07:29 | INFO | Trial 44 | outer=3 | hidden=[256, 128] epochs=289 lr=1.437e-04 wd=1.390e-07 n_pcs=2000 weight={'name': 'uniform'}
[I 2026-06-01 12:07:35,214] Trial 44 finished with value: 0.1783254825424994 and parameters: {'hidden_dims': '[256, 128]', 'dropout': 0.4999332688052314, 'batch_norm': False, 'lr': 0.0001437349892703755, 'weight_decay': 1.3895328771151326e-07, 'epochs': 289, 'loss': 'mae', 'optimizer': 'adam', 'use_snp_selection': False, 'n_pcs': 2000}. Best is trial 41 with value: 0.18162740069850541.
2026-06-01 12:07:35 | INFO | Trial 45 | outer=3 | hidden=[128, 64] epochs=285 lr=1.721e-04 wd=1.229e-07 n_pcs=4500 weight={'name': 'uniform'}
[I 2026-06-01 12:07:41,252] Trial 45 finished with value: 0.1535435495320864 and parameters: {'hidden_dims': '[128, 64]', 'dropout': 0.44299312517780903, 'batch_norm': False, 'lr': 0.00017210248208893663, 'weight_decay': 1.229201671170757e-07, 'epochs': 285, 'loss': 'mse', 'optimizer': 'adam', 'use_snp_selection': False, 'n_pcs': 4500}. Best is trial 41 with value: 0.18162740069850541.
2026-06-01 12:07:41 | INFO | Trial 46 | outer=3 | hidden=[256, 128] epochs=295 lr=1.030e-05 wd=5.497e-07 n_pcs=2500 weight={'name': 'uniform'}
[I 2026-06-01 12:07:44,993] Trial 46 pruned. 
2026-06-01 12:07:45 | INFO | Trial 47 | outer=3 | hidden=[1024, 256] epochs=277 lr=3.658e-04 wd=2.631e-07 n_pcs=1500 weight={'name': 'uniform'}
[I 2026-06-01 12:07:57,452] Trial 47 finished with value: 0.165074284302467 and parameters: {'hidden_dims': '[1024, 256]', 'dropout': 0.24628229809402435, 'batch_norm': False, 'lr': 0.00036579877587473417, 'weight_decay': 2.630624468968068e-07, 'epochs': 277, 'loss': 'mae', 'optimizer': 'adam', 'use_snp_selection': False, 'n_pcs': 1500}. Best is trial 41 with value: 0.18162740069850541.
2026-06-01 12:07:57 | INFO | Trial 48 | outer=3 | hidden=[256, 64] epochs=257 lr=2.575e-04 wd=1.160e-06 n_pcs=3000 weight={'name': 'uniform'}
[I 2026-06-01 12:08:03,749] Trial 48 finished with value: 0.15184354960847962 and parameters: {'hidden_dims': '[256, 64]', 'dropout': 0.4678045548060455, 'batch_norm': False, 'lr': 0.0002575078612426025, 'weight_decay': 1.1602386570824539e-06, 'epochs': 257, 'loss': 'mae', 'optimizer': 'adam', 'use_snp_selection': False, 'n_pcs': 3000}. Best is trial 41 with value: 0.18162740069850541.
2026-06-01 12:08:03 | INFO | Trial 49 | outer=3 | hidden=[256, 128] epochs=238 lr=6.626e-05 wd=1.346e-07 n_pcs=1500 weight={'name': 'uniform'}
[I 2026-06-01 12:08:08,205] Trial 49 finished with value: 0.1634115692801445 and parameters: {'hidden_dims': '[256, 128]', 'dropout': 0.5372041644447524, 'batch_norm': False, 'lr': 6.626175175515354e-05, 'weight_decay': 1.3459236553417079e-07, 'epochs': 238, 'loss': 'mae', 'optimizer': 'adam', 'use_snp_selection': False, 'n_pcs': 1500}. Best is trial 41 with value: 0.18162740069850541.
2026-06-01 12:08:08 | INFO | Trial 50 | outer=3 | hidden=[512, 128] epochs=218 lr=1.100e-04 wd=3.452e-06 n_pcs=1000 weight={'name': 'uniform'}
[I 2026-06-01 12:08:11,116] Trial 50 pruned. 
2026-06-01 12:08:11 | INFO | Trial 51 | outer=3 | hidden=[256, 128] epochs=151 lr=2.132e-04 wd=4.893e-08 n_pcs=2000 weight={'name': 'uniform'}
[I 2026-06-01 12:08:14,831] Trial 51 finished with value: 0.18931892681768156 and parameters: {'hidden_dims': '[256, 128]', 'dropout': 0.5791484122781254, 'batch_norm': False, 'lr': 0.00021315414765628633, 'weight_decay': 4.892687931799683e-08, 'epochs': 151, 'loss': 'mae', 'optimizer': 'adam', 'use_snp_selection': False, 'n_pcs': 2000}. Best is trial 51 with value: 0.18931892681768156.
2026-06-01 12:08:14 | INFO | Trial 52 | outer=3 | hidden=[256, 128] epochs=150 lr=2.033e-04 wd=8.743e-08 n_pcs=2000 weight={'name': 'uniform'}
[I 2026-06-01 12:08:18,516] Trial 52 finished with value: 0.16917207914034665 and parameters: {'hidden_dims': '[256, 128]', 'dropout': 0.5653063744386709, 'batch_norm': False, 'lr': 0.00020330997950015055, 'weight_decay': 8.743376109371522e-08, 'epochs': 150, 'loss': 'mae', 'optimizer': 'adam', 'use_snp_selection': False, 'n_pcs': 2000}. Best is trial 51 with value: 0.18931892681768156.
2026-06-01 12:08:18 | INFO | Trial 53 | outer=3 | hidden=[256, 128] epochs=131 lr=1.480e-04 wd=3.964e-08 n_pcs=2500 weight={'name': 'uniform'}
[I 2026-06-01 12:08:22,293] Trial 53 finished with value: 0.17038239118429233 and parameters: {'hidden_dims': '[256, 128]', 'dropout': 0.5125645371434051, 'batch_norm': False, 'lr': 0.0001479677529493211, 'weight_decay': 3.9635106377391603e-08, 'epochs': 131, 'loss': 'mae', 'optimizer': 'adam', 'use_snp_selection': False, 'n_pcs': 2500}. Best is trial 51 with value: 0.18931892681768156.
2026-06-01 12:08:22 | INFO | Trial 54 | outer=3 | hidden=[256, 128] epochs=201 lr=3.466e-04 wd=1.595e-07 n_pcs=1500 weight={'name': 'uniform'}
[I 2026-06-01 12:08:25,213] Trial 54 pruned. 
2026-06-01 12:08:25 | INFO | Trial 55 | outer=3 | hidden=[128, 64] epochs=87 lr=2.263e-04 wd=3.229e-07 n_pcs=2000 weight={'name': 'uniform'}
[I 2026-06-01 12:08:28,038] Trial 55 finished with value: 0.16944624942443792 and parameters: {'hidden_dims': '[128, 64]', 'dropout': 0.5439196191625031, 'batch_norm': False, 'lr': 0.00022631468262904864, 'weight_decay': 3.22920591145005e-07, 'epochs': 87, 'loss': 'mae', 'optimizer': 'adam', 'use_snp_selection': False, 'n_pcs': 2000}. Best is trial 51 with value: 0.18931892681768156.
2026-06-01 12:08:28 | INFO | Trial 56 | outer=3 | hidden=[512, 64] epochs=75 lr=2.583e-04 wd=8.374e-07 n_pcs=1000 weight={'name': 'uniform'}
[I 2026-06-01 12:08:29,614] Trial 56 pruned. 
2026-06-01 12:08:29 | INFO | Trial 57 | outer=3 | hidden=[256, 128] epochs=108 lr=1.840e-04 wd=3.995e-07 n_pcs=3000 weight={'name': 'uniform'}
[I 2026-06-01 12:08:33,399] Trial 57 finished with value: 0.1527374963654388 and parameters: {'hidden_dims': '[256, 128]', 'dropout': 0.4870393763455334, 'batch_norm': False, 'lr': 0.00018396219730487182, 'weight_decay': 3.9954813225699435e-07, 'epochs': 108, 'loss': 'mae', 'optimizer': 'adam', 'use_snp_selection': False, 'n_pcs': 3000}. Best is trial 51 with value: 0.18931892681768156.
2026-06-01 12:08:33 | INFO | Trial 58 | outer=3 | hidden=[256, 128] epochs=210 lr=1.447e-04 wd=8.100e-08 n_pcs=500 weight={'name': 'uniform'}
[I 2026-06-01 12:08:35,790] Trial 58 pruned. 
2026-06-01 12:08:35 | INFO | Trial 59 | outer=3 | hidden=[256, 128] epochs=183 lr=8.666e-05 wd=1.931e-08 n_pcs=2000 weight={'name': 'uniform'}
[I 2026-06-01 12:08:39,911] Trial 59 finished with value: 0.17397825477902112 and parameters: {'hidden_dims': '[256, 128]', 'dropout': 0.5220278266318614, 'batch_norm': False, 'lr': 8.666282644351389e-05, 'weight_decay': 1.9308921102725726e-08, 'epochs': 183, 'loss': 'mae', 'optimizer': 'adamw', 'use_snp_selection': False, 'n_pcs': 2000}. Best is trial 51 with value: 0.18931892681768156.
2026-06-01 12:08:39 | INFO | Trial 60 | outer=3 | hidden=[256, 128] epochs=137 lr=4.221e-04 wd=1.014e-05 n_pcs=3500 weight={'name': 'uniform'}
[I 2026-06-01 12:08:44,567] Trial 60 finished with value: 0.1469788297301377 and parameters: {'hidden_dims': '[256, 128]', 'dropout': 0.4008092358776735, 'batch_norm': False, 'lr': 0.00042208562108081595, 'weight_decay': 1.0136156472874628e-05, 'epochs': 137, 'loss': 'mae', 'optimizer': 'adam', 'use_snp_selection': False, 'n_pcs': 3500}. Best is trial 51 with value: 0.18931892681768156.
2026-06-01 12:08:44 | INFO | Trial 61 | outer=3 | hidden=[256, 128] epochs=168 lr=1.423e-04 wd=1.540e-08 n_pcs=2500 weight={'name': 'uniform'}
[I 2026-06-01 12:08:48,908] Trial 61 finished with value: 0.1846139369916558 and parameters: {'hidden_dims': '[256, 128]', 'dropout': 0.594169025684768, 'batch_norm': False, 'lr': 0.00014225728555008877, 'weight_decay': 1.5401112917270282e-08, 'epochs': 168, 'loss': 'mae', 'optimizer': 'adam', 'use_snp_selection': False, 'n_pcs': 2500}. Best is trial 51 with value: 0.18931892681768156.
2026-06-01 12:08:48 | INFO | Trial 62 | outer=3 | hidden=[256, 128] epochs=164 lr=2.090e-04 wd=5.209e-08 n_pcs=2500 weight={'name': 'uniform'}
[I 2026-06-01 12:08:53,188] Trial 62 finished with value: 0.17569045840604466 and parameters: {'hidden_dims': '[256, 128]', 'dropout': 0.5786511203888527, 'batch_norm': False, 'lr': 0.00020896458119134496, 'weight_decay': 5.208660986380527e-08, 'epochs': 164, 'loss': 'mae', 'optimizer': 'adam', 'use_snp_selection': False, 'n_pcs': 2500}. Best is trial 51 with value: 0.18931892681768156.
2026-06-01 12:08:53 | INFO | Trial 63 | outer=3 | hidden=[256, 128] epochs=171 lr=1.076e-04 wd=2.767e-08 n_pcs=1500 weight={'name': 'uniform'}
[I 2026-06-01 12:08:56,973] Trial 63 finished with value: 0.17103330727620722 and parameters: {'hidden_dims': '[256, 128]', 'dropout': 0.5540851896518478, 'batch_norm': False, 'lr': 0.00010761124764841775, 'weight_decay': 2.7667094678303503e-08, 'epochs': 171, 'loss': 'mae', 'optimizer': 'adam', 'use_snp_selection': False, 'n_pcs': 1500}. Best is trial 51 with value: 0.18931892681768156.
2026-06-01 12:08:56 | INFO | Trial 64 | outer=3 | hidden=[256, 128] epochs=148 lr=1.304e-04 wd=4.487e-08 n_pcs=2500 weight={'name': 'uniform'}
[I 2026-06-01 12:09:01,010] Trial 64 finished with value: 0.19082431425353114 and parameters: {'hidden_dims': '[256, 128]', 'dropout': 0.5997527962430281, 'batch_norm': False, 'lr': 0.0001303763175914142, 'weight_decay': 4.487411932939923e-08, 'epochs': 148, 'loss': 'mae', 'optimizer': 'adam', 'use_snp_selection': False, 'n_pcs': 2500}. Best is trial 64 with value: 0.19082431425353114.
2026-06-01 12:09:01 | INFO | Trial 65 | outer=3 | hidden=[256, 128] epochs=158 lr=1.268e-04 wd=4.743e-08 n_pcs=2500 weight={'name': 'uniform'}
[I 2026-06-01 12:09:05,211] Trial 65 finished with value: 0.16642041089763163 and parameters: {'hidden_dims': '[256, 128]', 'dropout': 0.5374793045446277, 'batch_norm': False, 'lr': 0.00012677260582996848, 'weight_decay': 4.7428345701112226e-08, 'epochs': 158, 'loss': 'mae', 'optimizer': 'adam', 'use_snp_selection': False, 'n_pcs': 2500}. Best is trial 64 with value: 0.19082431425353114.
2026-06-01 12:09:05 | INFO | Trial 66 | outer=3 | hidden=[1024, 256] epochs=146 lr=1.513e-04 wd=8.409e-08 n_pcs=3000 weight={'name': 'uniform'}
[I 2026-06-01 12:09:16,418] Trial 66 finished with value: 0.15787432927039752 and parameters: {'hidden_dims': '[1024, 256]', 'dropout': 0.5069786543569061, 'batch_norm': False, 'lr': 0.00015126757426642262, 'weight_decay': 8.409438076057157e-08, 'epochs': 146, 'loss': 'mae', 'optimizer': 'adam', 'use_snp_selection': False, 'n_pcs': 3000}. Best is trial 64 with value: 0.19082431425353114.
2026-06-01 12:09:16 | INFO | Trial 67 | outer=3 | hidden=[256, 128] epochs=165 lr=8.562e-05 wd=1.569e-07 n_pcs=2500 weight={'name': 'uniform'}
[I 2026-06-01 12:09:20,736] Trial 67 finished with value: 0.14367712158967244 and parameters: {'hidden_dims': '[256, 128]', 'dropout': 0.5853872877028821, 'batch_norm': False, 'lr': 8.562276184532294e-05, 'weight_decay': 1.5690710457484439e-07, 'epochs': 165, 'loss': 'mae', 'optimizer': 'adam', 'use_snp_selection': False, 'n_pcs': 2500}. Best is trial 64 with value: 0.19082431425353114.
2026-06-01 12:09:20 | INFO | Trial 68 | outer=3 | hidden=[512, 256] epochs=136 lr=1.067e-04 wd=1.543e-08 n_pcs=2000 weight={'name': 'uniform'}
[I 2026-06-01 12:09:25,894] Trial 68 finished with value: 0.17737077252370398 and parameters: {'hidden_dims': '[512, 256]', 'dropout': 0.5563741827833597, 'batch_norm': False, 'lr': 0.00010665824496891295, 'weight_decay': 1.542746957324335e-08, 'epochs': 136, 'loss': 'mae', 'optimizer': 'adam', 'use_snp_selection': False, 'n_pcs': 2000}. Best is trial 64 with value: 0.19082431425353114.
2026-06-01 12:09:25 | INFO | Trial 69 | outer=3 | hidden=[256, 64] epochs=120 lr=1.326e-04 wd=4.672e-07 n_pcs=2000 weight={'name': 'uniform'}
[I 2026-06-01 12:09:29,170] Trial 69 finished with value: 0.18456452661276213 and parameters: {'hidden_dims': '[256, 64]', 'dropout': 0.4766081827378992, 'batch_norm': False, 'lr': 0.00013258396972064103, 'weight_decay': 4.671566506564156e-07, 'epochs': 120, 'loss': 'mae', 'optimizer': 'adam', 'use_snp_selection': False, 'n_pcs': 2000}. Best is trial 64 with value: 0.19082431425353114.
2026-06-01 12:09:29 | INFO | Trial 70 | outer=3 | hidden=[256, 64] epochs=122 lr=7.377e-05 wd=3.391e-06 n_pcs=2000 weight={'name': 'uniform'}
[I 2026-06-01 12:09:32,493] Trial 70 finished with value: 0.15303083815786167 and parameters: {'hidden_dims': '[256, 64]', 'dropout': 0.45133668162871565, 'batch_norm': False, 'lr': 7.377433128740669e-05, 'weight_decay': 3.3908628838937936e-06, 'epochs': 122, 'loss': 'mse', 'optimizer': 'adam', 'use_snp_selection': False, 'n_pcs': 2000}. Best is trial 64 with value: 0.19082431425353114.
2026-06-01 12:09:32 | INFO | Trial 71 | outer=3 | hidden=[256, 64] epochs=114 lr=1.360e-04 wd=4.772e-07 n_pcs=2000 weight={'name': 'uniform'}
[I 2026-06-01 12:09:35,671] Trial 71 finished with value: 0.17961807251743162 and parameters: {'hidden_dims': '[256, 64]', 'dropout': 0.47176725857048923, 'batch_norm': False, 'lr': 0.00013596396117145556, 'weight_decay': 4.772108393735469e-07, 'epochs': 114, 'loss': 'mae', 'optimizer': 'adam', 'use_snp_selection': False, 'n_pcs': 2000}. Best is trial 64 with value: 0.19082431425353114.
2026-06-01 12:09:35 | INFO | Trial 72 | outer=3 | hidden=[256, 64] epochs=118 lr=1.752e-04 wd=9.695e-07 n_pcs=2500 weight={'name': 'uniform'}
[I 2026-06-01 12:09:39,199] Trial 72 finished with value: 0.17764365412923927 and parameters: {'hidden_dims': '[256, 64]', 'dropout': 0.47698814120258237, 'batch_norm': False, 'lr': 0.00017516061536067162, 'weight_decay': 9.694679519198298e-07, 'epochs': 118, 'loss': 'mae', 'optimizer': 'adam', 'use_snp_selection': False, 'n_pcs': 2500}. Best is trial 64 with value: 0.19082431425353114.
2026-06-01 12:09:39 | INFO | Trial 73 | outer=3 | hidden=[256, 64] epochs=100 lr=2.350e-04 wd=2.318e-06 n_pcs=2000 weight={'name': 'uniform'}
[I 2026-06-01 12:09:42,196] Trial 73 finished with value: 0.17746533904779369 and parameters: {'hidden_dims': '[256, 64]', 'dropout': 0.5310483080354782, 'batch_norm': False, 'lr': 0.00023499657968249267, 'weight_decay': 2.317738031109586e-06, 'epochs': 100, 'loss': 'mae', 'optimizer': 'adam', 'use_snp_selection': False, 'n_pcs': 2000}. Best is trial 64 with value: 0.19082431425353114.
2026-06-01 12:09:42 | INFO | Trial 74 | outer=3 | hidden=[256, 64] epochs=113 lr=1.316e-04 wd=4.938e-07 n_pcs=2500 weight={'name': 'uniform'}
[I 2026-06-01 12:09:45,657] Trial 74 finished with value: 0.13972400663064274 and parameters: {'hidden_dims': '[256, 64]', 'dropout': 0.5620698939461415, 'batch_norm': False, 'lr': 0.00013156727354416353, 'weight_decay': 4.937601143967084e-07, 'epochs': 113, 'loss': 'mae', 'optimizer': 'adam', 'use_snp_selection': False, 'n_pcs': 2500}. Best is trial 64 with value: 0.19082431425353114.
2026-06-01 12:09:45 | INFO | Trial 75 | outer=3 | hidden=[256, 64] epochs=151 lr=9.287e-05 wd=7.030e-07 n_pcs=2000 weight={'name': 'uniform'}
[I 2026-06-01 12:09:49,311] Trial 75 finished with value: 0.1535872687187924 and parameters: {'hidden_dims': '[256, 64]', 'dropout': 0.5966361493320455, 'batch_norm': False, 'lr': 9.287015573503813e-05, 'weight_decay': 7.030013687599425e-07, 'epochs': 151, 'loss': 'mae', 'optimizer': 'adam', 'use_snp_selection': False, 'n_pcs': 2000}. Best is trial 64 with value: 0.19082431425353114.
2026-06-01 12:09:49 | INFO | Trial 76 | outer=3 | hidden=[256, 64] epochs=144 lr=1.147e-04 wd=2.437e-08 n_pcs=2500 weight={'name': 'uniform'}
[I 2026-06-01 12:09:51,659] Trial 76 pruned. 
2026-06-01 12:09:51 | INFO | Trial 77 | outer=3 | hidden=[256, 64] epochs=131 lr=4.717e-05 wd=2.823e-07 n_pcs=3000 weight={'name': 'uniform'}
[I 2026-06-01 12:09:55,785] Trial 77 finished with value: 0.10568041857600408 and parameters: {'hidden_dims': '[256, 64]', 'dropout': 0.5181971691314486, 'batch_norm': False, 'lr': 4.716986927357949e-05, 'weight_decay': 2.8229197863878354e-07, 'epochs': 131, 'loss': 'mae', 'optimizer': 'adam', 'use_snp_selection': False, 'n_pcs': 3000}. Best is trial 64 with value: 0.19082431425353114.
2026-06-01 12:09:55 | INFO | Trial 78 | outer=3 | hidden=[512, 128] epochs=179 lr=1.567e-04 wd=3.966e-07 n_pcs=1500 weight={'name': 'uniform'}
[I 2026-06-01 12:09:59,343] Trial 78 pruned. 
2026-06-01 12:09:59 | INFO | Trial 79 | outer=3 | hidden=[512, 64] epochs=96 lr=3.355e-05 wd=7.722e-06 n_pcs=2000 weight={'name': 'uniform'}
[I 2026-06-01 12:10:03,158] Trial 79 finished with value: 0.1269845525461245 and parameters: {'hidden_dims': '[512, 64]', 'dropout': 0.32934886959903403, 'batch_norm': False, 'lr': 3.354628627858533e-05, 'weight_decay': 7.722476279213771e-06, 'epochs': 96, 'loss': 'mae', 'optimizer': 'adam', 'use_snp_selection': False, 'n_pcs': 2000}. Best is trial 64 with value: 0.19082431425353114.
2026-06-01 12:10:03 | INFO | Trial 80 | outer=3 | hidden=[128, 64] epochs=186 lr=1.893e-04 wd=1.913e-06 n_pcs=2500 weight={'name': 'uniform'}
[I 2026-06-01 12:10:06,054] Trial 80 pruned. 
2026-06-01 12:10:06 | INFO | Trial 81 | outer=3 | hidden=[256, 128] epochs=156 lr=1.358e-04 wd=3.907e-08 n_pcs=2000 weight={'name': 'uniform'}
[I 2026-06-01 12:10:09,846] Trial 81 finished with value: 0.1742371307725455 and parameters: {'hidden_dims': '[256, 128]', 'dropout': 0.5060948427929041, 'batch_norm': False, 'lr': 0.00013582142838770148, 'weight_decay': 3.9065612399629234e-08, 'epochs': 156, 'loss': 'mae', 'optimizer': 'adam', 'use_snp_selection': False, 'n_pcs': 2000}. Best is trial 64 with value: 0.19082431425353114.
2026-06-01 12:10:09 | INFO | Trial 82 | outer=3 | hidden=[256, 128] epochs=195 lr=2.167e-04 wd=8.579e-07 n_pcs=1500 weight={'name': 'uniform'}
[I 2026-06-01 12:10:12,721] Trial 82 pruned. 
2026-06-01 12:10:12 | INFO | Trial 83 | outer=3 | hidden=[256, 128] epochs=289 lr=1.556e-04 wd=2.170e-07 n_pcs=2000 weight={'name': 'uniform'}
