[I 2026-06-01 13:30:30,632] Trial 13 finished with value: 0.20470495077044823 and parameters: {'hidden_dims': '[256, 128]', 'dropout': 0.07072683308275612, 'batch_norm': False, 'lr': 0.00010413592731312783, 'weight_decay': 9.167336532775233e-07, 'epochs': 238, 'loss': 'mae', 'optimizer': 'adam', 'use_snp_selection': False, 'n_pcs': 500}. Best is trial 13 with value: 0.20470495077044823.
2026-06-01 13:30:30 | INFO | Trial 14 | outer=7 | hidden=[512, 256] epochs=241 lr=1.618e-04 wd=1.247e-06 n_pcs=1000 weight={'name': 'uniform'}
[I 2026-06-01 13:30:36,349] Trial 14 finished with value: 0.1739043039297215 and parameters: {'hidden_dims': '[512, 256]', 'dropout': 0.00019595351402655614, 'batch_norm': False, 'lr': 0.00016178957859723424, 'weight_decay': 1.2466997294266124e-06, 'epochs': 241, 'loss': 'mae', 'optimizer': 'adamw', 'use_snp_selection': False, 'n_pcs': 1000}. Best is trial 13 with value: 0.20470495077044823.
2026-06-01 13:30:36 | INFO | Trial 15 | outer=7 | hidden=[256, 128] epochs=168 lr=3.251e-04 wd=7.042e-07 n_pcs=500 weight={'name': 'uniform'}
[I 2026-06-01 13:30:40,019] Trial 15 finished with value: 0.17013369085372826 and parameters: {'hidden_dims': '[256, 128]', 'dropout': 0.371592006519317, 'batch_norm': False, 'lr': 0.0003250645570589828, 'weight_decay': 7.042341982313891e-07, 'epochs': 168, 'loss': 'mae', 'optimizer': 'adam', 'use_snp_selection': False, 'n_pcs': 500}. Best is trial 13 with value: 0.20470495077044823.
2026-06-01 13:30:40 | INFO | Trial 16 | outer=7 | hidden=[512, 256] epochs=258 lr=9.934e-05 wd=2.566e-08 n_pcs=2000 weight={'name': 'uniform'}
[I 2026-06-01 13:30:48,148] Trial 16 finished with value: 0.17299944382111396 and parameters: {'hidden_dims': '[512, 256]', 'dropout': 0.22294330072154328, 'batch_norm': False, 'lr': 9.93353275582122e-05, 'weight_decay': 2.5663990522498568e-08, 'epochs': 258, 'loss': 'mae', 'optimizer': 'adam', 'use_snp_selection': False, 'n_pcs': 2000}. Best is trial 13 with value: 0.20470495077044823.
2026-06-01 13:30:48 | INFO | Trial 17 | outer=7 | hidden=[512, 128] epochs=53 lr=2.963e-04 wd=1.184e-08 n_pcs=500 weight={'name': 'uniform'}
[I 2026-06-01 13:30:49,470] Trial 17 pruned. 
2026-06-01 13:30:49 | INFO | Trial 18 | outer=7 | hidden=[512, 64] epochs=190 lr=2.176e-04 wd=6.422e-07 n_pcs=1000 weight={'name': 'uniform'}
[I 2026-06-01 13:30:53,719] Trial 18 finished with value: 0.17703041864314065 and parameters: {'hidden_dims': '[512, 64]', 'dropout': 0.07900305611322384, 'batch_norm': False, 'lr': 0.00021755794951169996, 'weight_decay': 6.422464038724231e-07, 'epochs': 190, 'loss': 'mae', 'optimizer': 'adamw', 'use_snp_selection': False, 'n_pcs': 1000}. Best is trial 13 with value: 0.20470495077044823.
2026-06-01 13:30:53 | INFO | Trial 19 | outer=7 | hidden=[1024, 256] epochs=227 lr=1.197e-04 wd=2.716e-05 n_pcs=2000 weight={'name': 'uniform'}
[I 2026-06-01 13:31:06,670] Trial 19 finished with value: 0.19697223585761217 and parameters: {'hidden_dims': '[1024, 256]', 'dropout': 0.0725391837700908, 'batch_norm': False, 'lr': 0.00011972304995003554, 'weight_decay': 2.7159922652308696e-05, 'epochs': 227, 'loss': 'mae', 'optimizer': 'adam', 'use_snp_selection': False, 'n_pcs': 2000}. Best is trial 13 with value: 0.20470495077044823.
2026-06-01 13:31:06 | INFO | Trial 20 | outer=7 | hidden=[1024, 256] epochs=144 lr=5.361e-05 wd=6.859e-05 n_pcs=4000 weight={'name': 'uniform'}
[I 2026-06-01 13:31:20,342] Trial 20 finished with value: 0.16865987700355062 and parameters: {'hidden_dims': '[1024, 256]', 'dropout': 0.23259495311764988, 'batch_norm': False, 'lr': 5.36090870882572e-05, 'weight_decay': 6.85910942925486e-05, 'epochs': 144, 'loss': 'mae', 'optimizer': 'adam', 'use_snp_selection': False, 'n_pcs': 4000}. Best is trial 13 with value: 0.20470495077044823.
2026-06-01 13:31:20 | INFO | Trial 21 | outer=7 | hidden=[1024, 256] epochs=229 lr=1.125e-04 wd=2.260e-05 n_pcs=2000 weight={'name': 'uniform'}
[I 2026-06-01 13:31:33,437] Trial 21 finished with value: 0.17002704461900647 and parameters: {'hidden_dims': '[1024, 256]', 'dropout': 0.09135896711972043, 'batch_norm': False, 'lr': 0.00011250465680472488, 'weight_decay': 2.2600214171062816e-05, 'epochs': 229, 'loss': 'mae', 'optimizer': 'adam', 'use_snp_selection': False, 'n_pcs': 2000}. Best is trial 13 with value: 0.20470495077044823.
2026-06-01 13:31:33 | INFO | Trial 22 | outer=7 | hidden=[256, 128] epochs=230 lr=1.171e-04 wd=2.438e-04 n_pcs=1000 weight={'name': 'uniform'}
[I 2026-06-01 13:31:38,088] Trial 22 finished with value: 0.18539917799157973 and parameters: {'hidden_dims': '[256, 128]', 'dropout': 0.059671072034469, 'batch_norm': False, 'lr': 0.00011705708634123653, 'weight_decay': 0.00024384857512223642, 'epochs': 230, 'loss': 'mae', 'optimizer': 'adam', 'use_snp_selection': False, 'n_pcs': 1000}. Best is trial 13 with value: 0.20470495077044823.
2026-06-01 13:31:38 | INFO | Trial 23 | outer=7 | hidden=[256, 128] epochs=272 lr=2.546e-04 wd=2.842e-04 n_pcs=1000 weight={'name': 'uniform'}
[I 2026-06-01 13:31:43,162] Trial 23 finished with value: 0.19036984169247018 and parameters: {'hidden_dims': '[256, 128]', 'dropout': 0.13966043937999828, 'batch_norm': False, 'lr': 0.00025459976678827935, 'weight_decay': 0.0002842314013997564, 'epochs': 272, 'loss': 'mae', 'optimizer': 'adam', 'use_snp_selection': False, 'n_pcs': 1000}. Best is trial 13 with value: 0.20470495077044823.
2026-06-01 13:31:43 | INFO | Trial 24 | outer=7 | hidden=[256, 128] epochs=268 lr=2.225e-04 wd=2.230e-04 n_pcs=2000 weight={'name': 'uniform'}
[I 2026-06-01 13:31:48,521] Trial 24 finished with value: 0.1742165385336116 and parameters: {'hidden_dims': '[256, 128]', 'dropout': 0.13159514185733479, 'batch_norm': False, 'lr': 0.00022250398832208116, 'weight_decay': 0.0002229672969031897, 'epochs': 268, 'loss': 'mae', 'optimizer': 'adam', 'use_snp_selection': False, 'n_pcs': 2000}. Best is trial 13 with value: 0.20470495077044823.
2026-06-01 13:31:48 | INFO | Trial 25 | outer=7 | hidden=[1024, 256] epochs=293 lr=2.630e-04 wd=2.179e-04 n_pcs=1000 weight={'name': 'uniform'}
[I 2026-06-01 13:31:59,124] Trial 25 finished with value: 0.19165682770715128 and parameters: {'hidden_dims': '[1024, 256]', 'dropout': 0.16061995836206938, 'batch_norm': False, 'lr': 0.00026298936899478236, 'weight_decay': 0.00021788905287180866, 'epochs': 293, 'loss': 'mae', 'optimizer': 'adam', 'use_snp_selection': False, 'n_pcs': 1000}. Best is trial 13 with value: 0.20470495077044823.
2026-06-01 13:31:59 | INFO | Trial 26 | outer=7 | hidden=[1024, 256] epochs=300 lr=4.561e-04 wd=1.759e-05 n_pcs=500 weight={'name': 'uniform'}
[I 2026-06-01 13:32:07,135] Trial 26 finished with value: 0.1721583152702468 and parameters: {'hidden_dims': '[1024, 256]', 'dropout': 0.22160288127836963, 'batch_norm': False, 'lr': 0.00045605966293510214, 'weight_decay': 1.759225147659887e-05, 'epochs': 300, 'loss': 'mae', 'optimizer': 'adam', 'use_snp_selection': False, 'n_pcs': 500}. Best is trial 13 with value: 0.20470495077044823.
2026-06-01 13:32:07 | INFO | Trial 27 | outer=7 | hidden=[1024, 256] epochs=249 lr=6.158e-05 wd=8.004e-04 n_pcs=1000 weight={'name': 'uniform'}
[I 2026-06-01 13:32:16,398] Trial 27 finished with value: 0.19351104334532185 and parameters: {'hidden_dims': '[1024, 256]', 'dropout': 0.18304747346321423, 'batch_norm': False, 'lr': 6.157648998053895e-05, 'weight_decay': 0.0008003912166139065, 'epochs': 249, 'loss': 'mae', 'optimizer': 'adam', 'use_snp_selection': False, 'n_pcs': 1000}. Best is trial 13 with value: 0.20470495077044823.
2026-06-01 13:32:16 | INFO | Trial 28 | outer=7 | hidden=[1024, 256] epochs=247 lr=4.857e-05 wd=1.395e-06 n_pcs=2000 weight={'name': 'uniform'}
[I 2026-06-01 13:32:30,399] Trial 28 finished with value: 0.182022793172461 and parameters: {'hidden_dims': '[1024, 256]', 'dropout': 0.06133861369127393, 'batch_norm': False, 'lr': 4.8571474793724186e-05, 'weight_decay': 1.3948901440391052e-06, 'epochs': 247, 'loss': 'mae', 'optimizer': 'adam', 'use_snp_selection': False, 'n_pcs': 2000}. Best is trial 13 with value: 0.20470495077044823.
2026-06-01 13:32:30 | INFO | Trial 29 | outer=7 | hidden=[256, 64] epochs=185 lr=8.140e-05 wd=1.280e-05 n_pcs=1500 weight={'name': 'uniform'}
[I 2026-06-01 13:32:34,176] Trial 29 finished with value: 0.17871865436139162 and parameters: {'hidden_dims': '[256, 64]', 'dropout': 0.200035592360289, 'batch_norm': False, 'lr': 8.14013657692417e-05, 'weight_decay': 1.2798863159336526e-05, 'epochs': 185, 'loss': 'mae', 'optimizer': 'adam', 'use_snp_selection': False, 'n_pcs': 1500}. Best is trial 13 with value: 0.20470495077044823.
2026-06-01 13:32:34 | INFO | Trial 30 | outer=7 | hidden=[1024, 256] epochs=215 lr=6.197e-05 wd=6.332e-04 n_pcs=1500 weight={'name': 'uniform'}
[I 2026-06-01 13:32:44,233] Trial 30 finished with value: 0.17619866310466817 and parameters: {'hidden_dims': '[1024, 256]', 'dropout': 0.25431366044033554, 'batch_norm': False, 'lr': 6.196818806886457e-05, 'weight_decay': 0.000633164290835999, 'epochs': 215, 'loss': 'mae', 'optimizer': 'adam', 'use_snp_selection': False, 'n_pcs': 1500}. Best is trial 13 with value: 0.20470495077044823.
2026-06-01 13:32:44 | INFO | Trial 31 | outer=7 | hidden=[1024, 256] epochs=250 lr=1.522e-04 wd=1.241e-04 n_pcs=1000 weight={'name': 'uniform'}
[I 2026-06-01 13:32:53,528] Trial 31 finished with value: 0.19910855704848615 and parameters: {'hidden_dims': '[1024, 256]', 'dropout': 0.1646760222259237, 'batch_norm': False, 'lr': 0.00015224784096756023, 'weight_decay': 0.00012407534481586284, 'epochs': 250, 'loss': 'mae', 'optimizer': 'adam', 'use_snp_selection': False, 'n_pcs': 1000}. Best is trial 13 with value: 0.20470495077044823.
2026-06-01 13:32:53 | INFO | Trial 32 | outer=7 | hidden=[1024, 256] epochs=251 lr=1.515e-04 wd=1.346e-04 n_pcs=500 weight={'name': 'uniform'}
[I 2026-06-01 13:33:00,494] Trial 32 finished with value: 0.1817270237916657 and parameters: {'hidden_dims': '[1024, 256]', 'dropout': 0.18463607758932954, 'batch_norm': False, 'lr': 0.00015153221897235992, 'weight_decay': 0.00013455756733070953, 'epochs': 251, 'loss': 'mae', 'optimizer': 'adam', 'use_snp_selection': False, 'n_pcs': 500}. Best is trial 13 with value: 0.20470495077044823.
2026-06-01 13:33:00 | INFO | Trial 33 | outer=7 | hidden=[1024, 256] epochs=240 lr=9.167e-05 wd=5.191e-04 n_pcs=1000 weight={'name': 'uniform'}
[I 2026-06-01 13:33:09,485] Trial 33 finished with value: 0.18879760695621683 and parameters: {'hidden_dims': '[1024, 256]', 'dropout': 0.10811379704535107, 'batch_norm': False, 'lr': 9.167329356851134e-05, 'weight_decay': 0.0005191199591811119, 'epochs': 240, 'loss': 'mae', 'optimizer': 'adam', 'use_snp_selection': False, 'n_pcs': 1000}. Best is trial 13 with value: 0.20470495077044823.
2026-06-01 13:33:09 | INFO | Trial 34 | outer=7 | hidden=[1024, 256] epochs=259 lr=3.707e-05 wd=9.061e-05 n_pcs=2500 weight={'name': 'uniform'}
[I 2026-06-01 13:33:25,426] Trial 34 finished with value: 0.16893906626238214 and parameters: {'hidden_dims': '[1024, 256]', 'dropout': 0.31478190681319457, 'batch_norm': False, 'lr': 3.707177417032147e-05, 'weight_decay': 9.061423568829891e-05, 'epochs': 259, 'loss': 'mse', 'optimizer': 'adam', 'use_snp_selection': False, 'n_pcs': 2500}. Best is trial 13 with value: 0.20470495077044823.
2026-06-01 13:33:25 | INFO | Trial 35 | outer=7 | hidden=[256, 64] epochs=224 lr=1.256e-04 wd=3.247e-05 n_pcs=500 weight={'name': 'uniform'}
[I 2026-06-01 13:33:29,496] Trial 35 finished with value: 0.16895927885141007 and parameters: {'hidden_dims': '[256, 64]', 'dropout': 0.11568788506483521, 'batch_norm': False, 'lr': 0.00012560907366996533, 'weight_decay': 3.247442640636137e-05, 'epochs': 224, 'loss': 'mae', 'optimizer': 'adam', 'use_snp_selection': False, 'n_pcs': 500}. Best is trial 13 with value: 0.20470495077044823.
2026-06-01 13:33:29 | INFO | Trial 36 | outer=7 | hidden=[1024, 256] epochs=277 lr=7.200e-05 wd=2.498e-06 n_pcs=1000 weight={'name': 'uniform'}
[I 2026-06-01 13:33:39,626] Trial 36 finished with value: 0.18041571501106404 and parameters: {'hidden_dims': '[1024, 256]', 'dropout': 0.15142248555752885, 'batch_norm': False, 'lr': 7.200372461186409e-05, 'weight_decay': 2.4984675814416116e-06, 'epochs': 277, 'loss': 'mae', 'optimizer': 'adam', 'use_snp_selection': False, 'n_pcs': 1000}. Best is trial 13 with value: 0.20470495077044823.
2026-06-01 13:33:39 | INFO | Trial 37 | outer=7 | hidden=[512, 128] epochs=186 lr=1.676e-04 wd=2.978e-07 n_pcs=500 weight={'name': 'uniform'}
[I 2026-06-01 13:33:43,361] Trial 37 finished with value: 0.18365174468271217 and parameters: {'hidden_dims': '[512, 128]', 'dropout': 0.26889582051902106, 'batch_norm': False, 'lr': 0.0001676331680821613, 'weight_decay': 2.9780645143048277e-07, 'epochs': 186, 'loss': 'mse', 'optimizer': 'adam', 'use_snp_selection': False, 'n_pcs': 500}. Best is trial 13 with value: 0.20470495077044823.
2026-06-01 13:33:43 | INFO | Trial 38 | outer=7 | hidden=[512, 64] epochs=216 lr=4.340e-05 wd=4.453e-04 n_pcs=3500 weight={'name': 'uniform'}
[I 2026-06-01 13:33:52,911] Trial 38 finished with value: 0.1698432059478532 and parameters: {'hidden_dims': '[512, 64]', 'dropout': 0.34856701167391974, 'batch_norm': False, 'lr': 4.339647267125263e-05, 'weight_decay': 0.0004453027171347315, 'epochs': 216, 'loss': 'mae', 'optimizer': 'adam', 'use_snp_selection': False, 'n_pcs': 3500}. Best is trial 13 with value: 0.20470495077044823.
2026-06-01 13:33:52 | INFO | Trial 39 | outer=7 | hidden=[1024, 256] epochs=261 lr=6.379e-05 wd=4.063e-05 n_pcs=1500 weight={'name': 'uniform'}
[I 2026-06-01 13:34:04,747] Trial 39 finished with value: 0.17642790174514308 and parameters: {'hidden_dims': '[1024, 256]', 'dropout': 0.02600445806646106, 'batch_norm': False, 'lr': 6.379061005391866e-05, 'weight_decay': 4.0627318063428984e-05, 'epochs': 261, 'loss': 'mse', 'optimizer': 'adam', 'use_snp_selection': False, 'n_pcs': 1500}. Best is trial 13 with value: 0.20470495077044823.
2026-06-01 13:34:04 | INFO | Trial 40 | outer=7 | hidden=[256, 64] epochs=199 lr=3.276e-05 wd=1.035e-04 n_pcs=2000 weight={'name': 'uniform'}
[I 2026-06-01 13:34:07,698] Trial 40 pruned. 
2026-06-01 13:34:07 | INFO | Trial 41 | outer=7 | hidden=[1024, 256] epochs=294 lr=1.423e-04 wd=1.264e-04 n_pcs=1000 weight={'name': 'uniform'}
[I 2026-06-01 13:34:18,369] Trial 41 finished with value: 0.17923512531149516 and parameters: {'hidden_dims': '[1024, 256]', 'dropout': 0.1558622487244478, 'batch_norm': False, 'lr': 0.0001422882561464502, 'weight_decay': 0.00012640237600194387, 'epochs': 294, 'loss': 'mae', 'optimizer': 'adam', 'use_snp_selection': False, 'n_pcs': 1000}. Best is trial 13 with value: 0.20470495077044823.
2026-06-01 13:34:18 | INFO | Trial 42 | outer=7 | hidden=[1024, 256] epochs=288 lr=1.936e-04 wd=8.694e-04 n_pcs=1000 weight={'name': 'uniform'}
[I 2026-06-01 13:34:28,826] Trial 42 finished with value: 0.1927568350487659 and parameters: {'hidden_dims': '[1024, 256]', 'dropout': 0.17024726416562236, 'batch_norm': False, 'lr': 0.00019363316570774036, 'weight_decay': 0.0008693509043159985, 'epochs': 288, 'loss': 'mae', 'optimizer': 'adam', 'use_snp_selection': False, 'n_pcs': 1000}. Best is trial 13 with value: 0.20470495077044823.
2026-06-01 13:34:28 | INFO | Trial 43 | outer=7 | hidden=[1024, 256] epochs=284 lr=9.739e-05 wd=9.238e-04 n_pcs=5000 weight={'name': 'uniform'}
[I 2026-06-01 13:34:58,083] Trial 43 finished with value: 0.19996646276748745 and parameters: {'hidden_dims': '[1024, 256]', 'dropout': 0.12813075149933634, 'batch_norm': False, 'lr': 9.738811429695376e-05, 'weight_decay': 0.0009238248518951519, 'epochs': 284, 'loss': 'mae', 'optimizer': 'adam', 'use_snp_selection': False, 'n_pcs': 5000}. Best is trial 13 with value: 0.20470495077044823.
2026-06-01 13:34:58 | INFO | Trial 44 | outer=7 | hidden=[128, 64] epochs=242 lr=8.998e-05 wd=3.994e-04 n_pcs=5000 weight={'name': 'uniform'}
[I 2026-06-01 13:35:03,683] Trial 44 finished with value: 0.17359058083551912 and parameters: {'hidden_dims': '[128, 64]', 'dropout': 0.08101427187089211, 'batch_norm': False, 'lr': 8.997585202032622e-05, 'weight_decay': 0.00039940499503563485, 'epochs': 242, 'loss': 'mae', 'optimizer': 'adam', 'use_snp_selection': False, 'n_pcs': 5000}. Best is trial 13 with value: 0.20470495077044823.
2026-06-01 13:35:03 | INFO | Trial 45 | outer=7 | hidden=[1024, 256] epochs=279 lr=7.941e-05 wd=8.363e-06 n_pcs=4500 weight={'name': 'uniform'}
[I 2026-06-01 13:35:30,277] Trial 45 finished with value: 0.19700201334297918 and parameters: {'hidden_dims': '[1024, 256]', 'dropout': 0.10812834720287631, 'batch_norm': False, 'lr': 7.94051882153161e-05, 'weight_decay': 8.362633992805875e-06, 'epochs': 279, 'loss': 'mse', 'optimizer': 'adam', 'use_snp_selection': False, 'n_pcs': 4500}. Best is trial 13 with value: 0.20470495077044823.
2026-06-01 13:35:30 | INFO | Trial 46 | outer=7 | hidden=[256, 128] epochs=281 lr=1.030e-05 wd=8.906e-06 n_pcs=4500 weight={'name': 'uniform'}
[I 2026-06-01 13:35:39,214] Trial 46 finished with value: 0.1406146817403067 and parameters: {'hidden_dims': '[256, 128]', 'dropout': 0.124523750916915, 'batch_norm': False, 'lr': 1.0299678577025006e-05, 'weight_decay': 8.905608936817933e-06, 'epochs': 281, 'loss': 'mse', 'optimizer': 'adam', 'use_snp_selection': False, 'n_pcs': 4500}. Best is trial 13 with value: 0.20470495077044823.
2026-06-01 13:35:39 | INFO | Trial 47 | outer=7 | hidden=[512, 128] epochs=266 lr=7.928e-05 wd=2.894e-06 n_pcs=5000 weight={'name': 'uniform'}
[I 2026-06-01 13:35:47,983] Trial 47 pruned. 
2026-06-01 13:35:47 | INFO | Trial 48 | outer=7 | hidden=[512, 64] epochs=281 lr=1.295e-04 wd=4.319e-06 n_pcs=3500 weight={'name': 'uniform'}
[I 2026-06-01 13:35:59,800] Trial 48 finished with value: 0.16952473978004073 and parameters: {'hidden_dims': '[512, 64]', 'dropout': 0.09996737399284215, 'batch_norm': False, 'lr': 0.00012945446390774795, 'weight_decay': 4.319118732317734e-06, 'epochs': 281, 'loss': 'mse', 'optimizer': 'adamw', 'use_snp_selection': False, 'n_pcs': 3500}. Best is trial 13 with value: 0.20470495077044823.
2026-06-01 13:35:59 | INFO | Trial 49 | outer=7 | hidden=[1024, 256] epochs=234 lr=1.015e-04 wd=9.244e-06 n_pcs=4500 weight={'name': 'uniform'}
[I 2026-06-01 13:36:22,483] Trial 49 finished with value: 0.1827786345210287 and parameters: {'hidden_dims': '[1024, 256]', 'dropout': 0.016747305870791304, 'batch_norm': False, 'lr': 0.00010147967802007445, 'weight_decay': 9.243780755259748e-06, 'epochs': 234, 'loss': 'mse', 'optimizer': 'adam', 'use_snp_selection': False, 'n_pcs': 4500}. Best is trial 13 with value: 0.20470495077044823.
2026-06-01 13:36:22 | INFO | Trial 50 | outer=7 | hidden=[128, 64] epochs=257 lr=1.725e-04 wd=4.920e-05 n_pcs=4500 weight={'name': 'uniform'}
[I 2026-06-01 13:36:28,094] Trial 50 finished with value: 0.19134920453680407 and parameters: {'hidden_dims': '[128, 64]', 'dropout': 0.0715706316018801, 'batch_norm': False, 'lr': 0.00017251593084730292, 'weight_decay': 4.920225419995508e-05, 'epochs': 257, 'loss': 'mse', 'optimizer': 'adamw', 'use_snp_selection': False, 'n_pcs': 4500}. Best is trial 13 with value: 0.20470495077044823.
2026-06-01 13:36:28 | INFO | Trial 51 | outer=7 | hidden=[1024, 256] epochs=250 lr=1.019e-04 wd=9.956e-04 n_pcs=4500 weight={'name': 'uniform'}
[I 2026-06-01 13:36:52,150] Trial 51 finished with value: 0.19796487201585156 and parameters: {'hidden_dims': '[1024, 256]', 'dropout': 0.12520330907349575, 'batch_norm': False, 'lr': 0.00010189018518722203, 'weight_decay': 0.0009955637822418213, 'epochs': 250, 'loss': 'mae', 'optimizer': 'adam', 'use_snp_selection': False, 'n_pcs': 4500}. Best is trial 13 with value: 0.20470495077044823.
2026-06-01 13:36:52 | INFO | Trial 52 | outer=7 | hidden=[1024, 256] epochs=272 lr=1.033e-04 wd=1.311e-06 n_pcs=5000 weight={'name': 'uniform'}
[I 2026-06-01 13:37:20,274] Trial 52 finished with value: 0.18180888156397515 and parameters: {'hidden_dims': '[1024, 256]', 'dropout': 0.04218795907300184, 'batch_norm': False, 'lr': 0.00010331725935771155, 'weight_decay': 1.3110391278041883e-06, 'epochs': 272, 'loss': 'mae', 'optimizer': 'adam', 'use_snp_selection': False, 'n_pcs': 5000}. Best is trial 13 with value: 0.20470495077044823.
2026-06-01 13:37:20 | INFO | Trial 53 | outer=7 | hidden=[1024, 256] epochs=145 lr=1.341e-04 wd=2.229e-05 n_pcs=4500 weight={'name': 'uniform'}
[I 2026-06-01 13:37:35,241] Trial 53 finished with value: 0.20088042745720752 and parameters: {'hidden_dims': '[1024, 256]', 'dropout': 0.11096167101115227, 'batch_norm': False, 'lr': 0.0001341474769409825, 'weight_decay': 2.2290945964996153e-05, 'epochs': 145, 'loss': 'mae', 'optimizer': 'adam', 'use_snp_selection': False, 'n_pcs': 4500}. Best is trial 13 with value: 0.20470495077044823.
2026-06-01 13:37:35 | INFO | Trial 54 | outer=7 | hidden=[512, 256] epochs=139 lr=1.455e-04 wd=3.028e-07 n_pcs=4500 weight={'name': 'uniform'}
[I 2026-06-01 13:37:43,928] Trial 54 finished with value: 0.20772389733331345 and parameters: {'hidden_dims': '[512, 256]', 'dropout': 0.12497408194013149, 'batch_norm': False, 'lr': 0.00014550314739530867, 'weight_decay': 3.0276605750284613e-07, 'epochs': 139, 'loss': 'mse', 'optimizer': 'adam', 'use_snp_selection': False, 'n_pcs': 4500}. Best is trial 54 with value: 0.20772389733331345.
2026-06-01 13:37:43 | INFO | Trial 55 | outer=7 | hidden=[512, 256] epochs=136 lr=1.392e-04 wd=1.941e-07 n_pcs=4000 weight={'name': 'uniform'}
[I 2026-06-01 13:37:51,745] Trial 55 finished with value: 0.18921326002423647 and parameters: {'hidden_dims': '[512, 256]', 'dropout': 0.1316640098149292, 'batch_norm': False, 'lr': 0.00013923504670668846, 'weight_decay': 1.9414469559257229e-07, 'epochs': 136, 'loss': 'mae', 'optimizer': 'adam', 'use_snp_selection': False, 'n_pcs': 4000}. Best is trial 54 with value: 0.20772389733331345.
2026-06-01 13:37:51 | INFO | Trial 56 | outer=7 | hidden=[512, 256] epochs=149 lr=1.772e-04 wd=7.448e-08 n_pcs=3500 weight={'name': 'uniform'}
