[I 2026-06-01 14:16:02,195] Trial 45 finished with value: 0.15986996747100687 and parameters: {'hidden_dims': '[256, 128]', 'dropout': 0.2722771421638383, 'batch_norm': False, 'lr': 0.0004907197251459064, 'weight_decay': 1.8479496649009844e-07, 'epochs': 187, 'loss': 'mse', 'optimizer': 'adamw', 'use_snp_selection': False, 'n_pcs': 500}. Best is trial 15 with value: 0.21987372120888282.
2026-06-01 14:16:02 | INFO | Trial 46 | outer=9 | hidden=[512, 128] epochs=51 lr=1.030e-05 wd=2.053e-05 n_pcs=1500 weight={'name': 'uniform'}
[I 2026-06-01 14:16:03,819] Trial 46 pruned. 
2026-06-01 14:16:03 | INFO | Trial 47 | outer=9 | hidden=[1024, 256] epochs=225 lr=2.694e-04 wd=6.962e-06 n_pcs=3500 weight={'name': 'uniform'}
[I 2026-06-01 14:16:22,411] Trial 47 finished with value: 0.19805643880444307 and parameters: {'hidden_dims': '[1024, 256]', 'dropout': 0.16142289153659348, 'batch_norm': False, 'lr': 0.00026935858399748457, 'weight_decay': 6.961733550734795e-06, 'epochs': 225, 'loss': 'mae', 'optimizer': 'adamw', 'use_snp_selection': False, 'n_pcs': 3500}. Best is trial 15 with value: 0.21987372120888282.
2026-06-01 14:16:22 | INFO | Trial 48 | outer=9 | hidden=[256, 64] epochs=82 lr=1.619e-04 wd=3.168e-06 n_pcs=4500 weight={'name': 'uniform'}
[I 2026-06-01 14:16:26,603] Trial 48 finished with value: 0.17258139406153203 and parameters: {'hidden_dims': '[256, 64]', 'dropout': 0.42095742084824594, 'batch_norm': False, 'lr': 0.00016194887574851903, 'weight_decay': 3.1684862260386607e-06, 'epochs': 82, 'loss': 'mae', 'optimizer': 'adamw', 'use_snp_selection': False, 'n_pcs': 4500}. Best is trial 15 with value: 0.21987372120888282.
2026-06-01 14:16:26 | INFO | Trial 49 | outer=9 | hidden=[512, 64] epochs=73 lr=6.917e-05 wd=7.032e-05 n_pcs=1500 weight={'name': 'uniform'}
[I 2026-06-01 14:16:29,673] Trial 49 finished with value: 0.1551381577296928 and parameters: {'hidden_dims': '[512, 64]', 'dropout': 0.3833737980013255, 'batch_norm': False, 'lr': 6.917396130397899e-05, 'weight_decay': 7.031839592484595e-05, 'epochs': 73, 'loss': 'mae', 'optimizer': 'adam', 'use_snp_selection': False, 'n_pcs': 1500}. Best is trial 15 with value: 0.21987372120888282.
2026-06-01 14:16:29 | INFO | Trial 50 | outer=9 | hidden=[512, 256] epochs=105 lr=2.261e-04 wd=1.459e-04 n_pcs=2500 weight={'name': 'uniform'}
[I 2026-06-01 14:16:34,694] Trial 50 finished with value: 0.1884481344230705 and parameters: {'hidden_dims': '[512, 256]', 'dropout': 0.21567966696810642, 'batch_norm': False, 'lr': 0.00022613053202875772, 'weight_decay': 0.0001458646633515904, 'epochs': 105, 'loss': 'mse', 'optimizer': 'adamw', 'use_snp_selection': False, 'n_pcs': 2500}. Best is trial 15 with value: 0.21987372120888282.
2026-06-01 14:16:34 | INFO | Trial 51 | outer=9 | hidden=[1024, 256] epochs=64 lr=3.491e-04 wd=1.374e-06 n_pcs=1000 weight={'name': 'uniform'}
[I 2026-06-01 14:16:38,369] Trial 51 finished with value: 0.21833589796140615 and parameters: {'hidden_dims': '[1024, 256]', 'dropout': 0.42402113240835126, 'batch_norm': False, 'lr': 0.0003491362913501283, 'weight_decay': 1.3742730733582032e-06, 'epochs': 64, 'loss': 'mae', 'optimizer': 'adamw', 'use_snp_selection': False, 'n_pcs': 1000}. Best is trial 15 with value: 0.21987372120888282.
2026-06-01 14:16:38 | INFO | Trial 52 | outer=9 | hidden=[1024, 256] epochs=88 lr=3.424e-04 wd=8.973e-07 n_pcs=1000 weight={'name': 'uniform'}
[I 2026-06-01 14:16:42,804] Trial 52 finished with value: 0.20618466268577113 and parameters: {'hidden_dims': '[1024, 256]', 'dropout': 0.3422077597428646, 'batch_norm': False, 'lr': 0.0003424471638686304, 'weight_decay': 8.972980380513534e-07, 'epochs': 88, 'loss': 'mae', 'optimizer': 'adamw', 'use_snp_selection': False, 'n_pcs': 1000}. Best is trial 15 with value: 0.21987372120888282.
2026-06-01 14:16:42 | INFO | Trial 53 | outer=9 | hidden=[1024, 256] epochs=65 lr=3.940e-04 wd=1.585e-07 n_pcs=1000 weight={'name': 'uniform'}
[I 2026-06-01 14:16:46,509] Trial 53 finished with value: 0.19757971424219523 and parameters: {'hidden_dims': '[1024, 256]', 'dropout': 0.4182757222222577, 'batch_norm': False, 'lr': 0.0003940127190284954, 'weight_decay': 1.5854994915626149e-07, 'epochs': 65, 'loss': 'mae', 'optimizer': 'adamw', 'use_snp_selection': False, 'n_pcs': 1000}. Best is trial 15 with value: 0.21987372120888282.
2026-06-01 14:16:46 | INFO | Trial 54 | outer=9 | hidden=[128, 64] epochs=59 lr=4.366e-04 wd=1.246e-05 n_pcs=500 weight={'name': 'uniform'}
[I 2026-06-01 14:16:48,843] Trial 54 finished with value: 0.1711352052514919 and parameters: {'hidden_dims': '[128, 64]', 'dropout': 0.2970871442339985, 'batch_norm': False, 'lr': 0.00043659010613032105, 'weight_decay': 1.2457614744027731e-05, 'epochs': 59, 'loss': 'mae', 'optimizer': 'adamw', 'use_snp_selection': False, 'n_pcs': 500}. Best is trial 15 with value: 0.21987372120888282.
2026-06-01 14:16:48 | INFO | Trial 55 | outer=9 | hidden=[1024, 256] epochs=74 lr=3.077e-04 wd=1.211e-06 n_pcs=1500 weight={'name': 'uniform'}
[I 2026-06-01 14:16:53,555] Trial 55 finished with value: 0.18029387072241848 and parameters: {'hidden_dims': '[1024, 256]', 'dropout': 0.4392347591403786, 'batch_norm': False, 'lr': 0.00030767560688458933, 'weight_decay': 1.2105065710629465e-06, 'epochs': 74, 'loss': 'mae', 'optimizer': 'adamw', 'use_snp_selection': False, 'n_pcs': 1500}. Best is trial 15 with value: 0.21987372120888282.
2026-06-01 14:16:53 | INFO | Trial 56 | outer=9 | hidden=[256, 64] epochs=268 lr=2.219e-04 wd=2.470e-06 n_pcs=500 weight={'name': 'uniform'}
[I 2026-06-01 14:16:58,501] Trial 56 finished with value: 0.1769258432242834 and parameters: {'hidden_dims': '[256, 64]', 'dropout': 0.37170810613889604, 'batch_norm': False, 'lr': 0.0002218524401748307, 'weight_decay': 2.4703089784601067e-06, 'epochs': 268, 'loss': 'mae', 'optimizer': 'adamw', 'use_snp_selection': False, 'n_pcs': 500}. Best is trial 15 with value: 0.21987372120888282.
2026-06-01 14:16:58 | INFO | Trial 57 | outer=9 | hidden=[1024, 256] epochs=91 lr=1.334e-04 wd=8.697e-08 n_pcs=1000 weight={'name': 'uniform'}
[I 2026-06-01 14:17:03,018] Trial 57 finished with value: 0.21353819907835261 and parameters: {'hidden_dims': '[1024, 256]', 'dropout': 0.5046348793181888, 'batch_norm': False, 'lr': 0.00013343347003967463, 'weight_decay': 8.696789963949362e-08, 'epochs': 91, 'loss': 'mae', 'optimizer': 'adamw', 'use_snp_selection': False, 'n_pcs': 1000}. Best is trial 15 with value: 0.21987372120888282.
2026-06-01 14:17:03 | INFO | Trial 58 | outer=9 | hidden=[512, 256] epochs=123 lr=1.274e-04 wd=7.945e-08 n_pcs=1000 weight={'name': 'uniform'}
[I 2026-06-01 14:17:06,838] Trial 58 finished with value: 0.2152749741847105 and parameters: {'hidden_dims': '[512, 256]', 'dropout': 0.5061751707070716, 'batch_norm': False, 'lr': 0.00012739498379671615, 'weight_decay': 7.944695943583233e-08, 'epochs': 123, 'loss': 'mae', 'optimizer': 'adam', 'use_snp_selection': False, 'n_pcs': 1000}. Best is trial 15 with value: 0.21987372120888282.
2026-06-01 14:17:06 | INFO | Trial 59 | outer=9 | hidden=[512, 256] epochs=134 lr=1.242e-04 wd=6.843e-08 n_pcs=1000 weight={'name': 'uniform'}
[I 2026-06-01 14:17:10,852] Trial 59 finished with value: 0.19608505674013876 and parameters: {'hidden_dims': '[512, 256]', 'dropout': 0.5060310435658106, 'batch_norm': False, 'lr': 0.0001242179915899088, 'weight_decay': 6.843022135585877e-08, 'epochs': 134, 'loss': 'mae', 'optimizer': 'adam', 'use_snp_selection': False, 'n_pcs': 1000}. Best is trial 15 with value: 0.21987372120888282.
2026-06-01 14:17:10 | INFO | Trial 60 | outer=9 | hidden=[512, 256] epochs=111 lr=9.306e-05 wd=9.028e-08 n_pcs=2000 weight={'name': 'uniform'}
[I 2026-06-01 14:17:15,534] Trial 60 finished with value: 0.18089335695765504 and parameters: {'hidden_dims': '[512, 256]', 'dropout': 0.5918524770729445, 'batch_norm': False, 'lr': 9.305529159965544e-05, 'weight_decay': 9.027696524326436e-08, 'epochs': 111, 'loss': 'mae', 'optimizer': 'adam', 'use_snp_selection': False, 'n_pcs': 2000}. Best is trial 15 with value: 0.21987372120888282.
2026-06-01 14:17:15 | INFO | Trial 61 | outer=9 | hidden=[512, 256] epochs=92 lr=1.373e-04 wd=5.513e-08 n_pcs=1000 weight={'name': 'uniform'}
[I 2026-06-01 14:17:18,799] Trial 61 finished with value: 0.19459656582230356 and parameters: {'hidden_dims': '[512, 256]', 'dropout': 0.5480707264268185, 'batch_norm': False, 'lr': 0.00013734007995051912, 'weight_decay': 5.5134278773635324e-08, 'epochs': 92, 'loss': 'mae', 'optimizer': 'adam', 'use_snp_selection': False, 'n_pcs': 1000}. Best is trial 15 with value: 0.21987372120888282.
2026-06-01 14:17:18 | INFO | Trial 62 | outer=9 | hidden=[512, 256] epochs=117 lr=1.609e-04 wd=2.723e-08 n_pcs=1000 weight={'name': 'uniform'}
[I 2026-06-01 14:17:22,506] Trial 62 finished with value: 0.20520031318597703 and parameters: {'hidden_dims': '[512, 256]', 'dropout': 0.5618091641036806, 'batch_norm': False, 'lr': 0.00016087555719764427, 'weight_decay': 2.7230672997999625e-08, 'epochs': 117, 'loss': 'mae', 'optimizer': 'adam', 'use_snp_selection': False, 'n_pcs': 1000}. Best is trial 15 with value: 0.21987372120888282.
2026-06-01 14:17:22 | INFO | Trial 63 | outer=9 | hidden=[1024, 256] epochs=85 lr=1.995e-04 wd=2.844e-07 n_pcs=500 weight={'name': 'uniform'}
[I 2026-06-01 14:17:25,962] Trial 63 finished with value: 0.19711664400589374 and parameters: {'hidden_dims': '[1024, 256]', 'dropout': 0.5214674744544027, 'batch_norm': False, 'lr': 0.0001995438340657419, 'weight_decay': 2.8437892962498833e-07, 'epochs': 85, 'loss': 'mae', 'optimizer': 'adam', 'use_snp_selection': False, 'n_pcs': 500}. Best is trial 15 with value: 0.21987372120888282.
2026-06-01 14:17:25 | INFO | Trial 64 | outer=9 | hidden=[256, 64] epochs=50 lr=2.646e-04 wd=6.060e-07 n_pcs=1000 weight={'name': 'uniform'}
[I 2026-06-01 14:17:28,204] Trial 64 finished with value: 0.1695995261570576 and parameters: {'hidden_dims': '[256, 64]', 'dropout': 0.46583692363917556, 'batch_norm': False, 'lr': 0.0002645635225961992, 'weight_decay': 6.060342945586082e-07, 'epochs': 50, 'loss': 'mae', 'optimizer': 'adamw', 'use_snp_selection': False, 'n_pcs': 1000}. Best is trial 15 with value: 0.21987372120888282.
2026-06-01 14:17:28 | INFO | Trial 65 | outer=9 | hidden=[512, 256] epochs=78 lr=1.356e-04 wd=1.080e-08 n_pcs=1500 weight={'name': 'uniform'}
[I 2026-06-01 14:17:31,644] Trial 65 finished with value: 0.19813601117441001 and parameters: {'hidden_dims': '[512, 256]', 'dropout': 0.4969595072140528, 'batch_norm': False, 'lr': 0.00013555482571010462, 'weight_decay': 1.0798511156208874e-08, 'epochs': 78, 'loss': 'mae', 'optimizer': 'adamw', 'use_snp_selection': False, 'n_pcs': 1500}. Best is trial 15 with value: 0.21987372120888282.
2026-06-01 14:17:31 | INFO | Trial 66 | outer=9 | hidden=[512, 128] epochs=57 lr=8.172e-05 wd=1.267e-07 n_pcs=500 weight={'name': 'uniform'}
[I 2026-06-01 14:17:33,012] Trial 66 pruned. 
2026-06-01 14:17:33 | INFO | Trial 67 | outer=9 | hidden=[256, 128] epochs=72 lr=5.075e-05 wd=4.023e-08 n_pcs=1000 weight={'name': 'uniform'}
[I 2026-06-01 14:17:34,541] Trial 67 pruned. 
2026-06-01 14:17:34 | INFO | Trial 68 | outer=9 | hidden=[512, 64] epochs=97 lr=2.387e-04 wd=4.147e-07 n_pcs=1500 weight={'name': 'uniform'}
[I 2026-06-01 14:17:38,061] Trial 68 finished with value: 0.19244823179743598 and parameters: {'hidden_dims': '[512, 64]', 'dropout': 0.532899078091682, 'batch_norm': False, 'lr': 0.0002386513466507989, 'weight_decay': 4.146634366092623e-07, 'epochs': 97, 'loss': 'mae', 'optimizer': 'adamw', 'use_snp_selection': False, 'n_pcs': 1500}. Best is trial 15 with value: 0.21987372120888282.
2026-06-01 14:17:38 | INFO | Trial 69 | outer=9 | hidden=[1024, 256] epochs=147 lr=9.989e-05 wd=2.073e-08 n_pcs=500 weight={'name': 'uniform'}
[I 2026-06-01 14:17:42,889] Trial 69 finished with value: 0.20145873989505922 and parameters: {'hidden_dims': '[1024, 256]', 'dropout': 0.49097355865374276, 'batch_norm': False, 'lr': 9.989021333749533e-05, 'weight_decay': 2.0731877769397213e-08, 'epochs': 147, 'loss': 'mae', 'optimizer': 'adamw', 'use_snp_selection': False, 'n_pcs': 500}. Best is trial 15 with value: 0.21987372120888282.
2026-06-01 14:17:42 | INFO | Trial 70 | outer=9 | hidden=[1024, 256] epochs=126 lr=4.299e-04 wd=8.364e-07 n_pcs=1000 weight={'name': 'uniform'}
[I 2026-06-01 14:17:48,520] Trial 70 finished with value: 0.19559735243212473 and parameters: {'hidden_dims': '[1024, 256]', 'dropout': 0.43024680455456166, 'batch_norm': False, 'lr': 0.0004298878987685098, 'weight_decay': 8.363865199506704e-07, 'epochs': 126, 'loss': 'mse', 'optimizer': 'adamw', 'use_snp_selection': False, 'n_pcs': 1000}. Best is trial 15 with value: 0.21987372120888282.
2026-06-01 14:17:48 | INFO | Trial 71 | outer=9 | hidden=[1024, 256] epochs=66 lr=3.262e-04 wd=3.085e-05 n_pcs=1000 weight={'name': 'uniform'}
[I 2026-06-01 14:17:52,265] Trial 71 finished with value: 0.20176543649612594 and parameters: {'hidden_dims': '[1024, 256]', 'dropout': 0.3970160261699358, 'batch_norm': False, 'lr': 0.00032620817074683245, 'weight_decay': 3.084703985446813e-05, 'epochs': 66, 'loss': 'mae', 'optimizer': 'adamw', 'use_snp_selection': False, 'n_pcs': 1000}. Best is trial 15 with value: 0.21987372120888282.
2026-06-01 14:17:52 | INFO | Trial 72 | outer=9 | hidden=[1024, 256] epochs=57 lr=2.764e-04 wd=1.455e-06 n_pcs=1500 weight={'name': 'uniform'}
[I 2026-06-01 14:17:56,298] Trial 72 finished with value: 0.1760012874431908 and parameters: {'hidden_dims': '[1024, 256]', 'dropout': 0.330352322860487, 'batch_norm': False, 'lr': 0.00027639522113790755, 'weight_decay': 1.454959787830686e-06, 'epochs': 57, 'loss': 'mae', 'optimizer': 'adamw', 'use_snp_selection': False, 'n_pcs': 1500}. Best is trial 15 with value: 0.21987372120888282.
2026-06-01 14:17:56 | INFO | Trial 73 | outer=9 | hidden=[1024, 256] epochs=75 lr=1.738e-04 wd=5.052e-06 n_pcs=1000 weight={'name': 'uniform'}
[I 2026-06-01 14:18:00,338] Trial 73 finished with value: 0.20454787301039282 and parameters: {'hidden_dims': '[1024, 256]', 'dropout': 0.3517957264137073, 'batch_norm': False, 'lr': 0.00017380812015090373, 'weight_decay': 5.052132216595286e-06, 'epochs': 75, 'loss': 'mae', 'optimizer': 'adamw', 'use_snp_selection': False, 'n_pcs': 1000}. Best is trial 15 with value: 0.21987372120888282.
2026-06-01 14:18:00 | INFO | Trial 74 | outer=9 | hidden=[1024, 256] epochs=87 lr=2.000e-04 wd=2.095e-06 n_pcs=1500 weight={'name': 'uniform'}
[I 2026-06-01 14:18:05,568] Trial 74 finished with value: 0.1958530807418029 and parameters: {'hidden_dims': '[1024, 256]', 'dropout': 0.41378485939331616, 'batch_norm': False, 'lr': 0.00020002303983031607, 'weight_decay': 2.0946973780772855e-06, 'epochs': 87, 'loss': 'mae', 'optimizer': 'adamw', 'use_snp_selection': False, 'n_pcs': 1500}. Best is trial 15 with value: 0.21987372120888282.
2026-06-01 14:18:05 | INFO | Trial 75 | outer=9 | hidden=[512, 256] epochs=65 lr=3.958e-04 wd=3.788e-06 n_pcs=500 weight={'name': 'uniform'}
[I 2026-06-01 14:18:07,992] Trial 75 finished with value: 0.19964165325911815 and parameters: {'hidden_dims': '[512, 256]', 'dropout': 0.45974077767753235, 'batch_norm': False, 'lr': 0.00039575415635036143, 'weight_decay': 3.7883036324526636e-06, 'epochs': 65, 'loss': 'mae', 'optimizer': 'adamw', 'use_snp_selection': False, 'n_pcs': 500}. Best is trial 15 with value: 0.21987372120888282.
2026-06-01 14:18:08 | INFO | Trial 76 | outer=9 | hidden=[128, 64] epochs=80 lr=3.317e-04 wd=3.085e-07 n_pcs=3000 weight={'name': 'uniform'}
[I 2026-06-01 14:18:10,963] Trial 76 finished with value: 0.19350582423538387 and parameters: {'hidden_dims': '[128, 64]', 'dropout': 0.47165607634096196, 'batch_norm': False, 'lr': 0.0003316575766416265, 'weight_decay': 3.085044012922807e-07, 'epochs': 80, 'loss': 'mae', 'optimizer': 'adamw', 'use_snp_selection': False, 'n_pcs': 3000}. Best is trial 15 with value: 0.21987372120888282.
2026-06-01 14:18:10 | INFO | Trial 77 | outer=9 | hidden=[1024, 256] epochs=58 lr=1.499e-04 wd=6.734e-06 n_pcs=1000 weight={'name': 'uniform'}
[I 2026-06-01 14:18:14,452] Trial 77 finished with value: 0.2120268414464792 and parameters: {'hidden_dims': '[1024, 256]', 'dropout': 0.387214729833428, 'batch_norm': False, 'lr': 0.0001499491523843798, 'weight_decay': 6.7342341266885134e-06, 'epochs': 58, 'loss': 'mae', 'optimizer': 'adamw', 'use_snp_selection': False, 'n_pcs': 1000}. Best is trial 15 with value: 0.21987372120888282.
2026-06-01 14:18:14 | INFO | Trial 78 | outer=9 | hidden=[256, 64] epochs=94 lr=2.108e-05 wd=5.099e-07 n_pcs=1500 weight={'name': 'uniform'}
[I 2026-06-01 14:18:16,189] Trial 78 pruned. 
2026-06-01 14:18:16 | INFO | Trial 79 | outer=9 | hidden=[1024, 256] epochs=70 lr=3.729e-04 wd=9.810e-06 n_pcs=2000 weight={'name': 'uniform'}
[I 2026-06-01 14:18:21,578] Trial 79 finished with value: 0.19625790615319133 and parameters: {'hidden_dims': '[1024, 256]', 'dropout': 0.5619659468355486, 'batch_norm': False, 'lr': 0.00037286520748090805, 'weight_decay': 9.809799768062852e-06, 'epochs': 70, 'loss': 'mae', 'optimizer': 'adam', 'use_snp_selection': False, 'n_pcs': 2000}. Best is trial 15 with value: 0.21987372120888282.
2026-06-01 14:18:21 | INFO | Trial 80 | outer=9 | hidden=[512, 256] epochs=105 lr=4.592e-04 wd=9.962e-07 n_pcs=1000 weight={'name': 'uniform'}
[I 2026-06-01 14:18:25,082] Trial 80 finished with value: 0.19947687701138786 and parameters: {'hidden_dims': '[512, 256]', 'dropout': 0.4850003370935267, 'batch_norm': False, 'lr': 0.00045920759319431967, 'weight_decay': 9.961973432743153e-07, 'epochs': 105, 'loss': 'mse', 'optimizer': 'adamw', 'use_snp_selection': False, 'n_pcs': 1000}. Best is trial 15 with value: 0.21987372120888282.
2026-06-01 14:18:25 | INFO | Trial 81 | outer=9 | hidden=[1024, 256] epochs=59 lr=1.483e-04 wd=6.257e-06 n_pcs=1000 weight={'name': 'uniform'}
[I 2026-06-01 14:18:28,599] Trial 81 finished with value: 0.2106976306754854 and parameters: {'hidden_dims': '[1024, 256]', 'dropout': 0.38441277533749707, 'batch_norm': False, 'lr': 0.00014825128059101588, 'weight_decay': 6.256862403600482e-06, 'epochs': 59, 'loss': 'mae', 'optimizer': 'adamw', 'use_snp_selection': False, 'n_pcs': 1000}. Best is trial 15 with value: 0.21987372120888282.
2026-06-01 14:18:28 | INFO | Trial 82 | outer=9 | hidden=[1024, 256] epochs=50 lr=2.436e-04 wd=2.500e-05 n_pcs=1000 weight={'name': 'uniform'}
[I 2026-06-01 14:18:31,843] Trial 82 finished with value: 0.21362700157329279 and parameters: {'hidden_dims': '[1024, 256]', 'dropout': 0.3227443245982131, 'batch_norm': False, 'lr': 0.00024356659198129386, 'weight_decay': 2.5000710079964725e-05, 'epochs': 50, 'loss': 'mae', 'optimizer': 'adamw', 'use_snp_selection': False, 'n_pcs': 1000}. Best is trial 15 with value: 0.21987372120888282.
2026-06-01 14:18:31 | INFO | Trial 83 | outer=9 | hidden=[1024, 256] epochs=52 lr=2.829e-04 wd=5.756e-05 n_pcs=1000 weight={'name': 'uniform'}
[I 2026-06-01 14:18:35,143] Trial 83 finished with value: 0.1939196933374961 and parameters: {'hidden_dims': '[1024, 256]', 'dropout': 0.31516743129359487, 'batch_norm': False, 'lr': 0.00028288160940023114, 'weight_decay': 5.756195425006017e-05, 'epochs': 52, 'loss': 'mae', 'optimizer': 'adamw', 'use_snp_selection': False, 'n_pcs': 1000}. Best is trial 15 with value: 0.21987372120888282.
2026-06-01 14:18:35 | INFO | Trial 84 | outer=9 | hidden=[1024, 256] epochs=68 lr=2.375e-04 wd=2.074e-05 n_pcs=500 weight={'name': 'uniform'}
[I 2026-06-01 14:18:38,236] Trial 84 finished with value: 0.18544361720901778 and parameters: {'hidden_dims': '[1024, 256]', 'dropout': 0.2382674211946732, 'batch_norm': False, 'lr': 0.00023753663746464454, 'weight_decay': 2.0737493052505574e-05, 'epochs': 68, 'loss': 'mae', 'optimizer': 'adamw', 'use_snp_selection': False, 'n_pcs': 500}. Best is trial 15 with value: 0.21987372120888282.
2026-06-01 14:18:38 | INFO | Trial 85 | outer=9 | hidden=[1024, 256] epochs=83 lr=2.062e-04 wd=3.370e-05 n_pcs=1500 weight={'name': 'uniform'}
[I 2026-06-01 14:18:43,290] Trial 85 finished with value: 0.20224680787195032 and parameters: {'hidden_dims': '[1024, 256]', 'dropout': 0.2891527952454678, 'batch_norm': False, 'lr': 0.00020622090057808028, 'weight_decay': 3.370283103147758e-05, 'epochs': 83, 'loss': 'mae', 'optimizer': 'adamw', 'use_snp_selection': False, 'n_pcs': 1500}. Best is trial 15 with value: 0.21987372120888282.
2026-06-01 14:18:43 | INFO | Trial 86 | outer=9 | hidden=[256, 128] epochs=64 lr=3.021e-04 wd=1.657e-05 n_pcs=1000 weight={'name': 'uniform'}
[I 2026-06-01 14:18:45,713] Trial 86 finished with value: 0.19262704233657896 and parameters: {'hidden_dims': '[256, 128]', 'dropout': 0.259143624706267, 'batch_norm': False, 'lr': 0.0003021268824063014, 'weight_decay': 1.6566906418587713e-05, 'epochs': 64, 'loss': 'mae', 'optimizer': 'adamw', 'use_snp_selection': False, 'n_pcs': 1000}. Best is trial 15 with value: 0.21987372120888282.
2026-06-01 14:18:45 | INFO | Trial 87 | outer=9 | hidden=[512, 128] epochs=73 lr=2.547e-04 wd=1.363e-06 n_pcs=500 weight={'name': 'uniform'}
[I 2026-06-01 14:18:48,193] Trial 87 finished with value: 0.19299588425984016 and parameters: {'hidden_dims': '[512, 128]', 'dropout': 0.35632170028872845, 'batch_norm': False, 'lr': 0.0002546630338563819, 'weight_decay': 1.3626684528394963e-06, 'epochs': 73, 'loss': 'mae', 'optimizer': 'adamw', 'use_snp_selection': False, 'n_pcs': 500}. Best is trial 15 with value: 0.21987372120888282.
2026-06-01 14:18:48 | INFO | Trial 88 | outer=9 | hidden=[512, 64] epochs=184 lr=3.313e-04 wd=2.619e-05 n_pcs=1500 weight={'name': 'uniform'}
