[I 2026-06-01 15:28:17,122] Trial 136 finished with value: 0.20511994934504812 and parameters: {'hidden_dims': '[512, 256]', 'dropout': 0.5249652888286651, 'batch_norm': False, 'lr': 0.00010334642723703946, 'weight_decay': 5.2174517710740975e-05, 'epochs': 128, 'loss': 'mse', 'optimizer': 'adam', 'use_snp_selection': False, 'n_pcs': 1000}. Best is trial 126 with value: 0.23213441655500158.
2026-06-01 15:28:17 | INFO | Trial 137 | outer=13 | hidden=[1024, 256] epochs=236 lr=7.415e-05 wd=4.425e-08 n_pcs=1000 weight={'name': 'uniform'}
[I 2026-06-01 15:28:25,899] Trial 137 finished with value: 0.21986223827237153 and parameters: {'hidden_dims': '[1024, 256]', 'dropout': 0.5749143042267143, 'batch_norm': False, 'lr': 7.414917085543203e-05, 'weight_decay': 4.424698856769122e-08, 'epochs': 236, 'loss': 'mse', 'optimizer': 'adam', 'use_snp_selection': False, 'n_pcs': 1000}. Best is trial 126 with value: 0.23213441655500158.
2026-06-01 15:28:25 | INFO | Trial 138 | outer=13 | hidden=[1024, 256] epochs=245 lr=7.732e-05 wd=1.022e-08 n_pcs=3000 weight={'name': 'uniform'}
[I 2026-06-01 15:28:36,369] Trial 138 pruned. 
2026-06-01 15:28:36 | INFO | Trial 139 | outer=13 | hidden=[1024, 256] epochs=230 lr=6.305e-05 wd=4.648e-08 n_pcs=1000 weight={'name': 'uniform'}
[I 2026-06-01 15:28:44,962] Trial 139 finished with value: 0.20892388721463528 and parameters: {'hidden_dims': '[1024, 256]', 'dropout': 0.5516549177344477, 'batch_norm': False, 'lr': 6.304509722692024e-05, 'weight_decay': 4.6476064873098466e-08, 'epochs': 230, 'loss': 'mse', 'optimizer': 'adam', 'use_snp_selection': False, 'n_pcs': 1000}. Best is trial 126 with value: 0.23213441655500158.
2026-06-01 15:28:44 | INFO | Trial 140 | outer=13 | hidden=[1024, 256] epochs=252 lr=7.293e-05 wd=3.822e-08 n_pcs=1500 weight={'name': 'uniform'}
[I 2026-06-01 15:28:56,325] Trial 140 finished with value: 0.18070986174019146 and parameters: {'hidden_dims': '[1024, 256]', 'dropout': 0.5745380788619004, 'batch_norm': False, 'lr': 7.292758839352623e-05, 'weight_decay': 3.822273484127333e-08, 'epochs': 252, 'loss': 'mse', 'optimizer': 'adam', 'use_snp_selection': False, 'n_pcs': 1500}. Best is trial 126 with value: 0.23213441655500158.
2026-06-01 15:28:56 | INFO | Trial 141 | outer=13 | hidden=[1024, 256] epochs=166 lr=8.612e-05 wd=3.109e-08 n_pcs=1000 weight={'name': 'uniform'}
[I 2026-06-01 15:29:02,993] Trial 141 finished with value: 0.2198186097275594 and parameters: {'hidden_dims': '[1024, 256]', 'dropout': 0.5027740346407694, 'batch_norm': False, 'lr': 8.612323490407391e-05, 'weight_decay': 3.109466987736596e-08, 'epochs': 166, 'loss': 'mse', 'optimizer': 'adam', 'use_snp_selection': False, 'n_pcs': 1000}. Best is trial 126 with value: 0.23213441655500158.
2026-06-01 15:29:03 | INFO | Trial 142 | outer=13 | hidden=[1024, 256] epochs=169 lr=5.620e-05 wd=1.940e-08 n_pcs=1000 weight={'name': 'uniform'}
[I 2026-06-01 15:29:09,757] Trial 142 finished with value: 0.21959734184452992 and parameters: {'hidden_dims': '[1024, 256]', 'dropout': 0.5037646362348494, 'batch_norm': False, 'lr': 5.6198223824298925e-05, 'weight_decay': 1.9401335733557585e-08, 'epochs': 169, 'loss': 'mse', 'optimizer': 'adam', 'use_snp_selection': False, 'n_pcs': 1000}. Best is trial 126 with value: 0.23213441655500158.
2026-06-01 15:29:09 | INFO | Trial 143 | outer=13 | hidden=[1024, 256] epochs=237 lr=5.356e-05 wd=2.326e-08 n_pcs=1000 weight={'name': 'uniform'}
[I 2026-06-01 15:29:18,586] Trial 143 finished with value: 0.22876202705565613 and parameters: {'hidden_dims': '[1024, 256]', 'dropout': 0.5343581466733737, 'batch_norm': False, 'lr': 5.355527245889343e-05, 'weight_decay': 2.325922068831477e-08, 'epochs': 237, 'loss': 'mse', 'optimizer': 'adam', 'use_snp_selection': False, 'n_pcs': 1000}. Best is trial 126 with value: 0.23213441655500158.
2026-06-01 15:29:18 | INFO | Trial 144 | outer=13 | hidden=[1024, 256] epochs=173 lr=4.416e-05 wd=3.105e-08 n_pcs=1000 weight={'name': 'uniform'}
[I 2026-06-01 15:29:25,487] Trial 144 finished with value: 0.18569078577018688 and parameters: {'hidden_dims': '[1024, 256]', 'dropout': 0.5437290682885507, 'batch_norm': False, 'lr': 4.416384560515239e-05, 'weight_decay': 3.1052456931978135e-08, 'epochs': 173, 'loss': 'mse', 'optimizer': 'adam', 'use_snp_selection': False, 'n_pcs': 1000}. Best is trial 126 with value: 0.23213441655500158.
2026-06-01 15:29:25 | INFO | Trial 145 | outer=13 | hidden=[1024, 256] epochs=168 lr=5.372e-05 wd=1.973e-08 n_pcs=1000 weight={'name': 'uniform'}
[I 2026-06-01 15:29:32,237] Trial 145 finished with value: 0.19889677435209163 and parameters: {'hidden_dims': '[1024, 256]', 'dropout': 0.5291485951247261, 'batch_norm': False, 'lr': 5.371688918964602e-05, 'weight_decay': 1.9730901236602138e-08, 'epochs': 168, 'loss': 'mse', 'optimizer': 'adam', 'use_snp_selection': False, 'n_pcs': 1000}. Best is trial 126 with value: 0.23213441655500158.
2026-06-01 15:29:32 | INFO | Trial 146 | outer=13 | hidden=[1024, 256] epochs=241 lr=5.543e-05 wd=2.587e-08 n_pcs=500 weight={'name': 'uniform'}
[I 2026-06-01 15:29:38,974] Trial 146 finished with value: 0.16297153738950546 and parameters: {'hidden_dims': '[1024, 256]', 'dropout': 0.5614188129761993, 'batch_norm': False, 'lr': 5.543228081292352e-05, 'weight_decay': 2.5865457151586876e-08, 'epochs': 241, 'loss': 'mse', 'optimizer': 'adam', 'use_snp_selection': False, 'n_pcs': 500}. Best is trial 126 with value: 0.23213441655500158.
2026-06-01 15:29:38 | INFO | Trial 147 | outer=13 | hidden=[1024, 256] epochs=261 lr=3.453e-05 wd=1.423e-08 n_pcs=1000 weight={'name': 'uniform'}
[I 2026-06-01 15:29:48,514] Trial 147 finished with value: 0.20972008728398328 and parameters: {'hidden_dims': '[1024, 256]', 'dropout': 0.5023276831084961, 'batch_norm': False, 'lr': 3.4528416485987156e-05, 'weight_decay': 1.4229909277753039e-08, 'epochs': 261, 'loss': 'mse', 'optimizer': 'adam', 'use_snp_selection': False, 'n_pcs': 1000}. Best is trial 126 with value: 0.23213441655500158.
2026-06-01 15:29:48 | INFO | Trial 148 | outer=13 | hidden=[1024, 256] epochs=235 lr=5.210e-05 wd=1.819e-08 n_pcs=1000 weight={'name': 'uniform'}
[I 2026-06-01 15:29:57,272] Trial 148 finished with value: 0.21352280159098774 and parameters: {'hidden_dims': '[1024, 256]', 'dropout': 0.5158424891069157, 'batch_norm': False, 'lr': 5.209545286017793e-05, 'weight_decay': 1.8192277252749557e-08, 'epochs': 235, 'loss': 'mse', 'optimizer': 'adam', 'use_snp_selection': False, 'n_pcs': 1000}. Best is trial 126 with value: 0.23213441655500158.
2026-06-01 15:29:57 | INFO | Trial 149 | outer=13 | hidden=[1024, 256] epochs=238 lr=4.933e-05 wd=1.851e-08 n_pcs=500 weight={'name': 'uniform'}
[I 2026-06-01 15:30:03,947] Trial 149 finished with value: 0.17429115228686137 and parameters: {'hidden_dims': '[1024, 256]', 'dropout': 0.5358039595762084, 'batch_norm': False, 'lr': 4.932757639238823e-05, 'weight_decay': 1.8505550965275894e-08, 'epochs': 238, 'loss': 'mse', 'optimizer': 'adam', 'use_snp_selection': False, 'n_pcs': 500}. Best is trial 126 with value: 0.23213441655500158.
2026-06-01 15:30:03 | INFO | OUTER 13 best (inner mean r=0.2321): model={'hidden_dims': [512, 128], 'dropout': 0.5382826275600533, 'batch_norm': False, 'lr': 0.00010870866698166614, 'weight_decay': 1.3972131300703576e-08, 'epochs': 139, 'loss': 'mse', 'optimizer': 'adam', 'use_snp_selection': False, 'n_pcs': 1000} weighting={'name': 'uniform'}
2026-06-01 15:30:04 | INFO | OUTER 13 TEST r = 0.1160
2026-06-01 15:30:04 | INFO | OUTER 13 incremental summary saved to outputs/final_results/e8_pc_mlp_uniform/thr_wing/e8_pc_mlp_uniform_thr_wing_results.json
2026-06-01 15:30:04 | INFO | OUTER 14: test_size=583 island=13 (Vikna)
2026-06-01 15:30:04 | INFO | OUTER 14: inner LOIO validation islands: 0(Nesøy), 1(Myken), 2(Træna), 3(Selvær), 4(Gjerøy), 5(Hestmannøy), 6(Indre Kvarøy), 7(Onøy og Lurøy), 8(Lovund), 9(Sleneset), 10(Aldra), 11(Leka), 12(Vega), 14(Lauvøya)
2026-06-01 15:30:04 | INFO | OUTER 14: using top 10 related inner validation islands for tuning: 11(Leka, avgGRM=0.0117), 14(Lauvøya, avgGRM=0.0105), 12(Vega, avgGRM=0.0006), 8(Lovund, avgGRM=-0.0064), 9(Sleneset, avgGRM=-0.0070), 3(Selvær, avgGRM=-0.0075), 2(Træna, avgGRM=-0.0077), 7(Onøy og Lurøy, avgGRM=-0.0081), 0(Nesøy, avgGRM=-0.0083), 1(Myken, avgGRM=-0.0085)
[I 2026-06-01 15:30:04,674] A new study created in memory with name: mlp_importance_inner_outer13
2026-06-01 15:30:04 | INFO | Trial 0 | outer=14 | hidden=[256, 64] epochs=252 lr=8.243e-05 wd=1.277e-07 n_pcs=1500 weight={'name': 'uniform'}
[I 2026-06-01 15:30:09,106] Trial 0 finished with value: 0.17015205643023185 and parameters: {'hidden_dims': '[256, 64]', 'dropout': 0.19097065492325918, 'batch_norm': False, 'lr': 8.242985198911028e-05, 'weight_decay': 1.277246473139888e-07, 'epochs': 252, 'loss': 'mae', 'optimizer': 'adamw', 'use_snp_selection': False, 'n_pcs': 1500}. Best is trial 0 with value: 0.17015205643023185.
2026-06-01 15:30:09 | INFO | Trial 1 | outer=14 | hidden=[1024, 256] epochs=225 lr=1.391e-04 wd=1.941e-07 n_pcs=500 weight={'name': 'uniform'}
[I 2026-06-01 15:30:15,320] Trial 1 finished with value: 0.1683484750408891 and parameters: {'hidden_dims': '[1024, 256]', 'dropout': 0.2849434595702811, 'batch_norm': False, 'lr': 0.00013909108684683413, 'weight_decay': 1.9407167964924495e-07, 'epochs': 225, 'loss': 'mse', 'optimizer': 'adamw', 'use_snp_selection': False, 'n_pcs': 500}. Best is trial 0 with value: 0.17015205643023185.
2026-06-01 15:30:15 | INFO | Trial 2 | outer=14 | hidden=[256, 64] epochs=139 lr=3.957e-05 wd=3.750e-05 n_pcs=2500 weight={'name': 'uniform'}
[I 2026-06-01 15:30:19,092] Trial 2 finished with value: 0.1566947879953714 and parameters: {'hidden_dims': '[256, 64]', 'dropout': 0.11392712587675291, 'batch_norm': False, 'lr': 3.9573351157697276e-05, 'weight_decay': 3.7502337000845044e-05, 'epochs': 139, 'loss': 'mae', 'optimizer': 'adam', 'use_snp_selection': False, 'n_pcs': 2500}. Best is trial 0 with value: 0.17015205643023185.
2026-06-01 15:30:19 | INFO | Trial 3 | outer=14 | hidden=[128, 64] epochs=164 lr=1.538e-05 wd=3.248e-06 n_pcs=3000 weight={'name': 'uniform'}
[I 2026-06-01 15:30:22,862] Trial 3 finished with value: 0.08182382990569842 and parameters: {'hidden_dims': '[128, 64]', 'dropout': 0.1479874991503876, 'batch_norm': False, 'lr': 1.5380732370316375e-05, 'weight_decay': 3.2478890969962294e-06, 'epochs': 164, 'loss': 'mse', 'optimizer': 'adam', 'use_snp_selection': False, 'n_pcs': 3000}. Best is trial 0 with value: 0.17015205643023185.
2026-06-01 15:30:22 | INFO | Trial 4 | outer=14 | hidden=[256, 128] epochs=210 lr=7.298e-05 wd=7.875e-06 n_pcs=3000 weight={'name': 'uniform'}
[I 2026-06-01 15:30:28,317] Trial 4 finished with value: 0.14281923804707175 and parameters: {'hidden_dims': '[256, 128]', 'dropout': 0.09917626474860408, 'batch_norm': False, 'lr': 7.298380589156323e-05, 'weight_decay': 7.875094299510188e-06, 'epochs': 210, 'loss': 'mae', 'optimizer': 'adam', 'use_snp_selection': False, 'n_pcs': 3000}. Best is trial 0 with value: 0.17015205643023185.
2026-06-01 15:30:28 | INFO | Trial 5 | outer=14 | hidden=[512, 128] epochs=284 lr=5.467e-05 wd=5.496e-06 n_pcs=4000 weight={'name': 'uniform'}
[I 2026-06-01 15:30:41,279] Trial 5 finished with value: 0.18554791846963375 and parameters: {'hidden_dims': '[512, 128]', 'dropout': 0.3143696126156032, 'batch_norm': False, 'lr': 5.46667545989349e-05, 'weight_decay': 5.496446859789657e-06, 'epochs': 284, 'loss': 'mse', 'optimizer': 'adamw', 'use_snp_selection': False, 'n_pcs': 4000}. Best is trial 5 with value: 0.18554791846963375.
2026-06-01 15:30:41 | INFO | Trial 6 | outer=14 | hidden=[512, 64] epochs=90 lr=3.103e-05 wd=6.607e-08 n_pcs=5000 weight={'name': 'uniform'}
[I 2026-06-01 15:30:45,029] Trial 6 pruned. 
2026-06-01 15:30:45 | INFO | Trial 7 | outer=14 | hidden=[128, 64] epochs=272 lr=1.348e-05 wd=1.075e-07 n_pcs=4000 weight={'name': 'uniform'}
[I 2026-06-01 15:30:48,218] Trial 7 pruned. 
2026-06-01 15:30:48 | INFO | Trial 8 | outer=14 | hidden=[128, 64] epochs=205 lr=1.815e-05 wd=5.764e-06 n_pcs=3000 weight={'name': 'uniform'}
[I 2026-06-01 15:30:50,761] Trial 8 pruned. 
2026-06-01 15:30:50 | INFO | Trial 9 | outer=14 | hidden=[128, 64] epochs=296 lr=2.338e-05 wd=1.066e-07 n_pcs=2500 weight={'name': 'uniform'}
[I 2026-06-01 15:30:53,968] Trial 9 pruned. 
2026-06-01 15:30:53 | INFO | Trial 10 | outer=14 | hidden=[512, 128] epochs=110 lr=3.984e-04 wd=9.453e-04 n_pcs=5000 weight={'name': 'uniform'}
[I 2026-06-01 15:31:01,141] Trial 10 finished with value: 0.1765917712406113 and parameters: {'hidden_dims': '[512, 128]', 'dropout': 0.5941683348553323, 'batch_norm': False, 'lr': 0.0003983594610602333, 'weight_decay': 0.0009452683165453212, 'epochs': 110, 'loss': 'mse', 'optimizer': 'adamw', 'use_snp_selection': False, 'n_pcs': 5000}. Best is trial 5 with value: 0.18554791846963375.
2026-06-01 15:31:01 | INFO | Trial 11 | outer=14 | hidden=[512, 128] epochs=55 lr=3.985e-04 wd=9.792e-04 n_pcs=5000 weight={'name': 'uniform'}
[I 2026-06-01 15:31:05,877] Trial 11 finished with value: 0.17248612410465186 and parameters: {'hidden_dims': '[512, 128]', 'dropout': 0.5588382083491101, 'batch_norm': False, 'lr': 0.00039850138867195595, 'weight_decay': 0.0009792126502143, 'epochs': 55, 'loss': 'mse', 'optimizer': 'adamw', 'use_snp_selection': False, 'n_pcs': 5000}. Best is trial 5 with value: 0.18554791846963375.
2026-06-01 15:31:05 | INFO | Trial 12 | outer=14 | hidden=[512, 128] epochs=117 lr=4.981e-04 wd=8.865e-04 n_pcs=4000 weight={'name': 'uniform'}
[I 2026-06-01 15:31:12,466] Trial 12 finished with value: 0.19175657979593275 and parameters: {'hidden_dims': '[512, 128]', 'dropout': 0.39928504380457036, 'batch_norm': False, 'lr': 0.000498069436842805, 'weight_decay': 0.0008865268327078721, 'epochs': 117, 'loss': 'mse', 'optimizer': 'adamw', 'use_snp_selection': False, 'n_pcs': 4000}. Best is trial 12 with value: 0.19175657979593275.
2026-06-01 15:31:12 | INFO | Trial 13 | outer=14 | hidden=[512, 128] epochs=169 lr=1.855e-04 wd=3.450e-05 n_pcs=4000 weight={'name': 'uniform'}
[I 2026-06-01 15:31:21,044] Trial 13 finished with value: 0.17283897840197535 and parameters: {'hidden_dims': '[512, 128]', 'dropout': 0.37915031380596187, 'batch_norm': False, 'lr': 0.0001854924135720776, 'weight_decay': 3.450179419731025e-05, 'epochs': 169, 'loss': 'mse', 'optimizer': 'adamw', 'use_snp_selection': False, 'n_pcs': 4000}. Best is trial 12 with value: 0.19175657979593275.
2026-06-01 15:31:21 | INFO | Trial 14 | outer=14 | hidden=[512, 256] epochs=123 lr=1.840e-04 wd=1.338e-04 n_pcs=4000 weight={'name': 'uniform'}
[I 2026-06-01 15:31:28,134] Trial 14 finished with value: 0.1859748612338116 and parameters: {'hidden_dims': '[512, 256]', 'dropout': 0.005944493043843646, 'batch_norm': False, 'lr': 0.0001839757081557677, 'weight_decay': 0.00013375076999927368, 'epochs': 123, 'loss': 'mse', 'optimizer': 'adamw', 'use_snp_selection': False, 'n_pcs': 4000}. Best is trial 12 with value: 0.19175657979593275.
2026-06-01 15:31:28 | INFO | Trial 15 | outer=14 | hidden=[512, 256] epochs=116 lr=2.292e-04 wd=9.313e-05 n_pcs=4000 weight={'name': 'uniform'}
[I 2026-06-01 15:31:34,934] Trial 15 finished with value: 0.18698489839896765 and parameters: {'hidden_dims': '[512, 256]', 'dropout': 0.371592006519317, 'batch_norm': False, 'lr': 0.00022924891726923787, 'weight_decay': 9.312808984762823e-05, 'epochs': 116, 'loss': 'mse', 'optimizer': 'adamw', 'use_snp_selection': False, 'n_pcs': 4000}. Best is trial 12 with value: 0.19175657979593275.
2026-06-01 15:31:34 | INFO | Trial 16 | outer=14 | hidden=[512, 256] epochs=72 lr=4.846e-04 wd=1.742e-04 n_pcs=3500 weight={'name': 'uniform'}
[I 2026-06-01 15:31:39,573] Trial 16 finished with value: 0.188003443357982 and parameters: {'hidden_dims': '[512, 256]', 'dropout': 0.39369049194897354, 'batch_norm': False, 'lr': 0.0004845729743728352, 'weight_decay': 0.00017416232297649785, 'epochs': 72, 'loss': 'mse', 'optimizer': 'adamw', 'use_snp_selection': False, 'n_pcs': 3500}. Best is trial 12 with value: 0.19175657979593275.
2026-06-01 15:31:39 | INFO | Trial 17 | outer=14 | hidden=[512, 256] epochs=51 lr=4.453e-04 wd=1.184e-08 n_pcs=1500 weight={'name': 'uniform'}
[I 2026-06-01 15:31:42,274] Trial 17 finished with value: 0.19945171985381954 and parameters: {'hidden_dims': '[512, 256]', 'dropout': 0.4917650347156559, 'batch_norm': False, 'lr': 0.00044533067513612227, 'weight_decay': 1.1840058441529551e-08, 'epochs': 51, 'loss': 'mse', 'optimizer': 'adamw', 'use_snp_selection': False, 'n_pcs': 1500}. Best is trial 17 with value: 0.19945171985381954.
2026-06-01 15:31:42 | INFO | Trial 18 | outer=14 | hidden=[512, 64] epochs=50 lr=2.701e-04 wd=6.452e-07 n_pcs=1500 weight={'name': 'uniform'}
[I 2026-06-01 15:31:44,791] Trial 18 finished with value: 0.18767738147459442 and parameters: {'hidden_dims': '[512, 64]', 'dropout': 0.49083793056397773, 'batch_norm': False, 'lr': 0.00027014608636381494, 'weight_decay': 6.45226711189004e-07, 'epochs': 50, 'loss': 'mae', 'optimizer': 'adamw', 'use_snp_selection': False, 'n_pcs': 1500}. Best is trial 17 with value: 0.19945171985381954.
2026-06-01 15:31:44 | INFO | Trial 19 | outer=14 | hidden=[256, 128] epochs=91 lr=1.232e-04 wd=1.453e-08 n_pcs=1500 weight={'name': 'uniform'}
[I 2026-06-01 15:31:47,557] Trial 19 finished with value: 0.18857111418556544 and parameters: {'hidden_dims': '[256, 128]', 'dropout': 0.48508462943840014, 'batch_norm': False, 'lr': 0.0001232294101281243, 'weight_decay': 1.4526511192558723e-08, 'epochs': 91, 'loss': 'mse', 'optimizer': 'adamw', 'use_snp_selection': False, 'n_pcs': 1500}. Best is trial 17 with value: 0.19945171985381954.
2026-06-01 15:31:47 | INFO | Trial 20 | outer=14 | hidden=[1024, 256] epochs=144 lr=3.337e-04 wd=1.167e-08 n_pcs=500 weight={'name': 'uniform'}
[I 2026-06-01 15:31:52,117] Trial 20 finished with value: 0.17069397488760502 and parameters: {'hidden_dims': '[1024, 256]', 'dropout': 0.5399024980499485, 'batch_norm': False, 'lr': 0.00033365172261412806, 'weight_decay': 1.1671218099165326e-08, 'epochs': 144, 'loss': 'mse', 'optimizer': 'adamw', 'use_snp_selection': False, 'n_pcs': 500}. Best is trial 17 with value: 0.19945171985381954.
2026-06-01 15:31:52 | INFO | Trial 21 | outer=14 | hidden=[256, 128] epochs=94 lr=1.185e-04 wd=1.111e-08 n_pcs=1500 weight={'name': 'uniform'}
[I 2026-06-01 15:31:54,980] Trial 21 finished with value: 0.1981509207872388 and parameters: {'hidden_dims': '[256, 128]', 'dropout': 0.45724501665189454, 'batch_norm': False, 'lr': 0.00011850211277549386, 'weight_decay': 1.1111072568872263e-08, 'epochs': 94, 'loss': 'mse', 'optimizer': 'adamw', 'use_snp_selection': False, 'n_pcs': 1500}. Best is trial 17 with value: 0.19945171985381954.
2026-06-01 15:31:54 | INFO | Trial 22 | outer=14 | hidden=[256, 128] epochs=83 lr=1.198e-04 wd=7.287e-07 n_pcs=2000 weight={'name': 'uniform'}
[I 2026-06-01 15:31:57,859] Trial 22 finished with value: 0.17423671128019852 and parameters: {'hidden_dims': '[256, 128]', 'dropout': 0.4421778273339076, 'batch_norm': False, 'lr': 0.00011983911257831814, 'weight_decay': 7.287426866455611e-07, 'epochs': 83, 'loss': 'mse', 'optimizer': 'adamw', 'use_snp_selection': False, 'n_pcs': 2000}. Best is trial 17 with value: 0.19945171985381954.
2026-06-01 15:31:57 | INFO | Trial 23 | outer=14 | hidden=[512, 256] epochs=70 lr=4.902e-04 wd=3.475e-08 n_pcs=1000 weight={'name': 'uniform'}
[I 2026-06-01 15:31:59,540] Trial 23 pruned. 
2026-06-01 15:31:59 | INFO | Trial 24 | outer=14 | hidden=[256, 128] epochs=103 lr=2.726e-04 wd=7.725e-07 n_pcs=2000 weight={'name': 'uniform'}
[I 2026-06-01 15:32:02,610] Trial 24 finished with value: 0.17295835068528737 and parameters: {'hidden_dims': '[256, 128]', 'dropout': 0.43148689057173817, 'batch_norm': False, 'lr': 0.00027256904828477067, 'weight_decay': 7.725289295513367e-07, 'epochs': 103, 'loss': 'mse', 'optimizer': 'adamw', 'use_snp_selection': False, 'n_pcs': 2000}. Best is trial 17 with value: 0.19945171985381954.
2026-06-01 15:32:02 | INFO | Trial 25 | outer=14 | hidden=[512, 256] epochs=146 lr=9.544e-05 wd=3.096e-08 n_pcs=1000 weight={'name': 'uniform'}
[I 2026-06-01 15:32:06,625] Trial 25 finished with value: 0.18623400658340894 and parameters: {'hidden_dims': '[512, 256]', 'dropout': 0.24686860296108687, 'batch_norm': False, 'lr': 9.543604077650888e-05, 'weight_decay': 3.0963832622392925e-08, 'epochs': 146, 'loss': 'mse', 'optimizer': 'adamw', 'use_snp_selection': False, 'n_pcs': 1000}. Best is trial 17 with value: 0.19945171985381954.
2026-06-01 15:32:06 | INFO | Trial 26 | outer=14 | hidden=[256, 128] epochs=70 lr=5.262e-05 wd=2.590e-07 n_pcs=2000 weight={'name': 'uniform'}
[I 2026-06-01 15:32:08,211] Trial 26 pruned. 
2026-06-01 15:32:08 | INFO | Trial 27 | outer=14 | hidden=[512, 128] epochs=128 lr=1.779e-04 wd=2.821e-08 n_pcs=1000 weight={'name': 'uniform'}
[I 2026-06-01 15:32:11,645] Trial 27 finished with value: 0.18275767714841099 and parameters: {'hidden_dims': '[512, 128]', 'dropout': 0.41269316859760174, 'batch_norm': False, 'lr': 0.00017791354427333875, 'weight_decay': 2.820742108614804e-08, 'epochs': 128, 'loss': 'mae', 'optimizer': 'adam', 'use_snp_selection': False, 'n_pcs': 1000}. Best is trial 17 with value: 0.19945171985381954.
2026-06-01 15:32:11 | INFO | Trial 28 | outer=14 | hidden=[1024, 256] epochs=99 lr=3.222e-04 wd=1.743e-05 n_pcs=4500 weight={'name': 'uniform'}
[I 2026-06-01 15:32:22,311] Trial 28 finished with value: 0.19788929417696324 and parameters: {'hidden_dims': '[1024, 256]', 'dropout': 0.5971022368404446, 'batch_norm': False, 'lr': 0.00032219442205986924, 'weight_decay': 1.7429837363954494e-05, 'epochs': 99, 'loss': 'mse', 'optimizer': 'adamw', 'use_snp_selection': False, 'n_pcs': 4500}. Best is trial 17 with value: 0.19945171985381954.
2026-06-01 15:32:22 | INFO | Trial 29 | outer=14 | hidden=[1024, 256] epochs=184 lr=2.899e-04 wd=2.069e-05 n_pcs=1500 weight={'name': 'uniform'}
