[I 2026-06-01 11:02:54,375] Trial 38 finished with value: 0.1659004558848483 and parameters: {'hidden_dims': '[256, 64]', 'dropout': 0.13659044908434437, 'batch_norm': False, 'lr': 0.00010356452118530546, 'weight_decay': 3.2643639647880274e-07, 'epochs': 71, 'loss': 'mse', 'optimizer': 'adamw', 'use_snp_selection': False, 'n_pcs': 3000}. Best is trial 11 with value: 0.22631097742542755.
2026-06-01 11:02:54 | INFO | Trial 39 | outer=1 | hidden=[512, 128] epochs=85 lr=4.593e-05 wd=2.691e-06 n_pcs=2500 weight={'name': 'uniform'}
[I 2026-06-01 11:02:56,901] Trial 39 pruned. 
2026-06-01 11:02:56 | INFO | Trial 40 | outer=1 | hidden=[512, 256] epochs=194 lr=3.425e-04 wd=8.823e-06 n_pcs=4000 weight={'name': 'uniform'}
[I 2026-06-01 11:03:07,503] Trial 40 finished with value: 0.2126622876548981 and parameters: {'hidden_dims': '[512, 256]', 'dropout': 0.2844507901797708, 'batch_norm': False, 'lr': 0.00034247016717313, 'weight_decay': 8.82323936209869e-06, 'epochs': 194, 'loss': 'mse', 'optimizer': 'adam', 'use_snp_selection': False, 'n_pcs': 4000}. Best is trial 11 with value: 0.22631097742542755.
2026-06-01 11:03:07 | INFO | Trial 41 | outer=1 | hidden=[512, 64] epochs=125 lr=2.730e-04 wd=3.085e-05 n_pcs=4500 weight={'name': 'uniform'}
[I 2026-06-01 11:03:15,390] Trial 41 finished with value: 0.2267203562406873 and parameters: {'hidden_dims': '[512, 64]', 'dropout': 0.058692049452539224, 'batch_norm': False, 'lr': 0.00027295786295225777, 'weight_decay': 3.08537174887297e-05, 'epochs': 125, 'loss': 'mae', 'optimizer': 'adamw', 'use_snp_selection': False, 'n_pcs': 4500}. Best is trial 41 with value: 0.2267203562406873.
2026-06-01 11:03:15 | INFO | Trial 42 | outer=1 | hidden=[1024, 256] epochs=148 lr=1.937e-04 wd=6.337e-05 n_pcs=4500 weight={'name': 'uniform'}
[I 2026-06-01 11:03:31,157] Trial 42 finished with value: 0.21892907104592485 and parameters: {'hidden_dims': '[1024, 256]', 'dropout': 0.11788724343194355, 'batch_norm': False, 'lr': 0.0001936540280551238, 'weight_decay': 6.33704669127206e-05, 'epochs': 148, 'loss': 'mae', 'optimizer': 'adamw', 'use_snp_selection': False, 'n_pcs': 4500}. Best is trial 41 with value: 0.2267203562406873.
2026-06-01 11:03:31 | INFO | Trial 43 | outer=1 | hidden=[1024, 256] epochs=151 lr=1.715e-04 wd=6.274e-05 n_pcs=5000 weight={'name': 'uniform'}
[I 2026-06-01 11:03:48,516] Trial 43 finished with value: 0.20165063729745114 and parameters: {'hidden_dims': '[1024, 256]', 'dropout': 0.1016555377774053, 'batch_norm': False, 'lr': 0.0001715187567270547, 'weight_decay': 6.274394336228581e-05, 'epochs': 151, 'loss': 'mae', 'optimizer': 'adamw', 'use_snp_selection': False, 'n_pcs': 5000}. Best is trial 41 with value: 0.2267203562406873.
2026-06-01 11:03:48 | INFO | Trial 44 | outer=1 | hidden=[1024, 256] epochs=170 lr=1.361e-04 wd=3.137e-05 n_pcs=4500 weight={'name': 'uniform'}
[I 2026-06-01 11:04:06,289] Trial 44 finished with value: 0.22065477001872633 and parameters: {'hidden_dims': '[1024, 256]', 'dropout': 0.16297984486605135, 'batch_norm': False, 'lr': 0.00013614005080405354, 'weight_decay': 3.136951016960207e-05, 'epochs': 170, 'loss': 'mae', 'optimizer': 'adamw', 'use_snp_selection': False, 'n_pcs': 4500}. Best is trial 41 with value: 0.2267203562406873.
2026-06-01 11:04:06 | INFO | Trial 45 | outer=1 | hidden=[1024, 256] epochs=167 lr=8.641e-05 wd=2.417e-05 n_pcs=5000 weight={'name': 'uniform'}
[I 2026-06-01 11:04:25,245] Trial 45 finished with value: 0.20331919004551519 and parameters: {'hidden_dims': '[1024, 256]', 'dropout': 0.058317561073171154, 'batch_norm': False, 'lr': 8.641047620131396e-05, 'weight_decay': 2.4174536335888952e-05, 'epochs': 167, 'loss': 'mae', 'optimizer': 'adamw', 'use_snp_selection': False, 'n_pcs': 5000}. Best is trial 41 with value: 0.2267203562406873.
2026-06-01 11:04:25 | INFO | Trial 46 | outer=1 | hidden=[1024, 256] epochs=212 lr=1.030e-05 wd=7.816e-06 n_pcs=4500 weight={'name': 'uniform'}
[I 2026-06-01 11:04:37,971] Trial 46 pruned. 
2026-06-01 11:04:37 | INFO | Trial 47 | outer=1 | hidden=[1024, 256] epochs=195 lr=1.360e-04 wd=4.333e-06 n_pcs=5000 weight={'name': 'uniform'}
[I 2026-06-01 11:04:59,675] Trial 47 finished with value: 0.21201096707100509 and parameters: {'hidden_dims': '[1024, 256]', 'dropout': 0.07940822757100974, 'batch_norm': False, 'lr': 0.00013601473079750945, 'weight_decay': 4.33323984275227e-06, 'epochs': 195, 'loss': 'mae', 'optimizer': 'adamw', 'use_snp_selection': False, 'n_pcs': 5000}. Best is trial 41 with value: 0.2267203562406873.
2026-06-01 11:04:59 | INFO | Trial 48 | outer=1 | hidden=[1024, 256] epochs=170 lr=1.954e-04 wd=3.286e-05 n_pcs=4500 weight={'name': 'uniform'}
[I 2026-06-01 11:05:17,459] Trial 48 finished with value: 0.22781586596570666 and parameters: {'hidden_dims': '[1024, 256]', 'dropout': 0.1317954479554155, 'batch_norm': False, 'lr': 0.0001953535976309893, 'weight_decay': 3.2864138751855047e-05, 'epochs': 170, 'loss': 'mae', 'optimizer': 'adamw', 'use_snp_selection': False, 'n_pcs': 4500}. Best is trial 48 with value: 0.22781586596570666.
2026-06-01 11:05:17 | INFO | Trial 49 | outer=1 | hidden=[1024, 256] epochs=170 lr=1.960e-04 wd=3.208e-05 n_pcs=4500 weight={'name': 'uniform'}
[I 2026-06-01 11:05:35,233] Trial 49 finished with value: 0.22766820379132327 and parameters: {'hidden_dims': '[1024, 256]', 'dropout': 0.12614743822003183, 'batch_norm': False, 'lr': 0.00019596694471406327, 'weight_decay': 3.2084514856696705e-05, 'epochs': 170, 'loss': 'mae', 'optimizer': 'adam', 'use_snp_selection': False, 'n_pcs': 4500}. Best is trial 48 with value: 0.22781586596570666.
2026-06-01 11:05:35 | INFO | Trial 50 | outer=1 | hidden=[1024, 256] epochs=171 lr=1.180e-04 wd=3.371e-05 n_pcs=5000 weight={'name': 'uniform'}
[I 2026-06-01 11:05:54,605] Trial 50 finished with value: 0.2081485470298082 and parameters: {'hidden_dims': '[1024, 256]', 'dropout': 0.1934765174702094, 'batch_norm': False, 'lr': 0.00011798346142286953, 'weight_decay': 3.37123789302785e-05, 'epochs': 171, 'loss': 'mae', 'optimizer': 'adam', 'use_snp_selection': False, 'n_pcs': 5000}. Best is trial 48 with value: 0.22781586596570666.
2026-06-01 11:05:54 | INFO | Trial 51 | outer=1 | hidden=[1024, 256] epochs=180 lr=2.008e-04 wd=1.471e-04 n_pcs=4500 weight={'name': 'uniform'}
[I 2026-06-01 11:06:13,273] Trial 51 finished with value: 0.23802587712824383 and parameters: {'hidden_dims': '[1024, 256]', 'dropout': 0.12842724857062368, 'batch_norm': False, 'lr': 0.00020078687124001776, 'weight_decay': 0.00014711022106574686, 'epochs': 180, 'loss': 'mae', 'optimizer': 'adam', 'use_snp_selection': False, 'n_pcs': 4500}. Best is trial 51 with value: 0.23802587712824383.
2026-06-01 11:06:13 | INFO | Trial 52 | outer=1 | hidden=[1024, 256] epochs=221 lr=2.438e-04 wd=1.193e-04 n_pcs=4500 weight={'name': 'uniform'}
[I 2026-06-01 11:06:35,667] Trial 52 finished with value: 0.23247241452507755 and parameters: {'hidden_dims': '[1024, 256]', 'dropout': 0.07414491429274177, 'batch_norm': False, 'lr': 0.00024377279252008285, 'weight_decay': 0.00011925986954177309, 'epochs': 221, 'loss': 'mae', 'optimizer': 'adam', 'use_snp_selection': False, 'n_pcs': 4500}. Best is trial 51 with value: 0.23802587712824383.
2026-06-01 11:06:35 | INFO | Trial 53 | outer=1 | hidden=[1024, 256] epochs=244 lr=2.627e-04 wd=1.370e-04 n_pcs=5000 weight={'name': 'uniform'}
[I 2026-06-01 11:07:02,209] Trial 53 finished with value: 0.22638480967980512 and parameters: {'hidden_dims': '[1024, 256]', 'dropout': 0.07292278283784694, 'batch_norm': False, 'lr': 0.0002626827597565498, 'weight_decay': 0.00013702031063445245, 'epochs': 244, 'loss': 'mae', 'optimizer': 'adam', 'use_snp_selection': False, 'n_pcs': 5000}. Best is trial 51 with value: 0.23802587712824383.
2026-06-01 11:07:02 | INFO | Trial 54 | outer=1 | hidden=[1024, 256] epochs=262 lr=2.507e-04 wd=1.214e-04 n_pcs=4500 weight={'name': 'uniform'}
[I 2026-06-01 11:07:28,309] Trial 54 finished with value: 0.19686657022754417 and parameters: {'hidden_dims': '[1024, 256]', 'dropout': 0.00012083754767340527, 'batch_norm': False, 'lr': 0.0002507386474220356, 'weight_decay': 0.00012139301839466064, 'epochs': 262, 'loss': 'mae', 'optimizer': 'adam', 'use_snp_selection': False, 'n_pcs': 4500}. Best is trial 51 with value: 0.23802587712824383.
2026-06-01 11:07:28 | INFO | Trial 55 | outer=1 | hidden=[1024, 256] epochs=235 lr=1.998e-04 wd=1.702e-04 n_pcs=4000 weight={'name': 'uniform'}
[I 2026-06-01 11:07:50,017] Trial 55 finished with value: 0.20313656964225463 and parameters: {'hidden_dims': '[1024, 256]', 'dropout': 0.07624230585732338, 'batch_norm': False, 'lr': 0.0001997514580449917, 'weight_decay': 0.0001701936987143297, 'epochs': 235, 'loss': 'mae', 'optimizer': 'adam', 'use_snp_selection': False, 'n_pcs': 4000}. Best is trial 51 with value: 0.23802587712824383.
2026-06-01 11:07:50 | INFO | Trial 56 | outer=1 | hidden=[128, 64] epochs=218 lr=3.108e-05 wd=9.888e-05 n_pcs=5000 weight={'name': 'uniform'}
[I 2026-06-01 11:07:53,239] Trial 56 pruned. 
2026-06-01 11:07:53 | INFO | Trial 57 | outer=1 | hidden=[1024, 256] epochs=249 lr=2.898e-04 wd=1.752e-04 n_pcs=4500 weight={'name': 'uniform'}
[I 2026-06-01 11:08:18,152] Trial 57 finished with value: 0.2263504306950855 and parameters: {'hidden_dims': '[1024, 256]', 'dropout': 0.061955864430587634, 'batch_norm': False, 'lr': 0.00028978373743138186, 'weight_decay': 0.0001751514539042211, 'epochs': 249, 'loss': 'mae', 'optimizer': 'adam', 'use_snp_selection': False, 'n_pcs': 4500}. Best is trial 51 with value: 0.23802587712824383.
2026-06-01 11:08:18 | INFO | Trial 58 | outer=1 | hidden=[1024, 256] epochs=223 lr=2.271e-04 wd=1.184e-05 n_pcs=2000 weight={'name': 'uniform'}
[I 2026-06-01 11:08:31,432] Trial 58 finished with value: 0.2206083196883573 and parameters: {'hidden_dims': '[1024, 256]', 'dropout': 0.2016884226055527, 'batch_norm': False, 'lr': 0.00022707404487426456, 'weight_decay': 1.1844690527204829e-05, 'epochs': 223, 'loss': 'mae', 'optimizer': 'adam', 'use_snp_selection': False, 'n_pcs': 2000}. Best is trial 51 with value: 0.23802587712824383.
2026-06-01 11:08:31 | INFO | Trial 59 | outer=1 | hidden=[1024, 256] epochs=287 lr=1.562e-04 wd=4.042e-04 n_pcs=4000 weight={'name': 'uniform'}
[I 2026-06-01 11:08:57,423] Trial 59 finished with value: 0.22144699371811533 and parameters: {'hidden_dims': '[1024, 256]', 'dropout': 0.09290979181401621, 'batch_norm': False, 'lr': 0.00015619019658489553, 'weight_decay': 0.0004042296981565859, 'epochs': 287, 'loss': 'mae', 'optimizer': 'adam', 'use_snp_selection': False, 'n_pcs': 4000}. Best is trial 51 with value: 0.23802587712824383.
2026-06-01 11:08:57 | INFO | Trial 60 | outer=1 | hidden=[1024, 256] epochs=203 lr=1.951e-04 wd=3.239e-05 n_pcs=5000 weight={'name': 'uniform'}
[I 2026-06-01 11:09:19,934] Trial 60 finished with value: 0.21193506092948783 and parameters: {'hidden_dims': '[1024, 256]', 'dropout': 0.0464705265875163, 'batch_norm': False, 'lr': 0.00019514018726466502, 'weight_decay': 3.238805511053609e-05, 'epochs': 203, 'loss': 'mae', 'optimizer': 'adam', 'use_snp_selection': False, 'n_pcs': 5000}. Best is trial 51 with value: 0.23802587712824383.
2026-06-01 11:09:19 | INFO | Trial 61 | outer=1 | hidden=[1024, 256] epochs=252 lr=2.881e-04 wd=2.051e-04 n_pcs=4500 weight={'name': 'uniform'}
[I 2026-06-01 11:09:45,102] Trial 61 finished with value: 0.22781620364358784 and parameters: {'hidden_dims': '[1024, 256]', 'dropout': 0.06453988228665876, 'batch_norm': False, 'lr': 0.00028807682496518765, 'weight_decay': 0.0002050535295531942, 'epochs': 252, 'loss': 'mae', 'optimizer': 'adam', 'use_snp_selection': False, 'n_pcs': 4500}. Best is trial 51 with value: 0.23802587712824383.
2026-06-01 11:09:45 | INFO | Trial 62 | outer=1 | hidden=[1024, 256] epochs=255 lr=2.660e-04 wd=2.621e-04 n_pcs=4500 weight={'name': 'uniform'}
[I 2026-06-01 11:10:10,540] Trial 62 finished with value: 0.2160868735352759 and parameters: {'hidden_dims': '[1024, 256]', 'dropout': 0.10662921577064835, 'batch_norm': False, 'lr': 0.0002660240240543997, 'weight_decay': 0.0002621286008818175, 'epochs': 255, 'loss': 'mae', 'optimizer': 'adam', 'use_snp_selection': False, 'n_pcs': 4500}. Best is trial 51 with value: 0.23802587712824383.
2026-06-01 11:10:10 | INFO | Trial 63 | outer=1 | hidden=[512, 64] epochs=236 lr=3.131e-04 wd=1.260e-04 n_pcs=4500 weight={'name': 'uniform'}
[I 2026-06-01 11:10:23,405] Trial 63 finished with value: 0.21862651901360222 and parameters: {'hidden_dims': '[512, 64]', 'dropout': 0.14724092098438005, 'batch_norm': False, 'lr': 0.00031313923174704434, 'weight_decay': 0.00012598851981331915, 'epochs': 236, 'loss': 'mae', 'optimizer': 'adam', 'use_snp_selection': False, 'n_pcs': 4500}. Best is trial 51 with value: 0.23802587712824383.
2026-06-01 11:10:23 | INFO | Trial 64 | outer=1 | hidden=[256, 128] epochs=274 lr=2.124e-04 wd=8.107e-05 n_pcs=1000 weight={'name': 'uniform'}
[I 2026-06-01 11:10:28,366] Trial 64 finished with value: 0.1870429159507168 and parameters: {'hidden_dims': '[256, 128]', 'dropout': 0.0035647063948638785, 'batch_norm': False, 'lr': 0.0002124356249947373, 'weight_decay': 8.107221120058131e-05, 'epochs': 274, 'loss': 'mae', 'optimizer': 'adam', 'use_snp_selection': False, 'n_pcs': 1000}. Best is trial 51 with value: 0.23802587712824383.
2026-06-01 11:10:28 | INFO | Trial 65 | outer=1 | hidden=[1024, 256] epochs=183 lr=2.499e-04 wd=4.561e-05 n_pcs=4000 weight={'name': 'uniform'}
[I 2026-06-01 11:10:45,778] Trial 65 finished with value: 0.22581582620122242 and parameters: {'hidden_dims': '[1024, 256]', 'dropout': 0.07816959388913214, 'batch_norm': False, 'lr': 0.00024986685190274687, 'weight_decay': 4.561124758847418e-05, 'epochs': 183, 'loss': 'mae', 'optimizer': 'adam', 'use_snp_selection': False, 'n_pcs': 4000}. Best is trial 51 with value: 0.23802587712824383.
2026-06-01 11:10:45 | INFO | Trial 66 | outer=1 | hidden=[128, 64] epochs=244 lr=4.344e-04 wd=3.437e-04 n_pcs=4500 weight={'name': 'uniform'}
[I 2026-06-01 11:10:51,395] Trial 66 finished with value: 0.23264417865320414 and parameters: {'hidden_dims': '[128, 64]', 'dropout': 0.0274829357461243, 'batch_norm': False, 'lr': 0.00043442742980685117, 'weight_decay': 0.0003437213369452601, 'epochs': 244, 'loss': 'mae', 'optimizer': 'adam', 'use_snp_selection': False, 'n_pcs': 4500}. Best is trial 51 with value: 0.23802587712824383.
2026-06-01 11:10:51 | INFO | Trial 67 | outer=1 | hidden=[128, 64] epochs=267 lr=4.153e-04 wd=3.235e-04 n_pcs=3500 weight={'name': 'uniform'}
[I 2026-06-01 11:10:57,013] Trial 67 finished with value: 0.19474096216559206 and parameters: {'hidden_dims': '[128, 64]', 'dropout': 0.01682600130468362, 'batch_norm': False, 'lr': 0.00041530844971428396, 'weight_decay': 0.00032348757905351674, 'epochs': 267, 'loss': 'mae', 'optimizer': 'adam', 'use_snp_selection': False, 'n_pcs': 3500}. Best is trial 51 with value: 0.23802587712824383.
2026-06-01 11:10:57 | INFO | Trial 68 | outer=1 | hidden=[128, 64] epochs=228 lr=4.345e-04 wd=7.118e-04 n_pcs=4500 weight={'name': 'uniform'}
[I 2026-06-01 11:11:02,371] Trial 68 finished with value: 0.21617474961959388 and parameters: {'hidden_dims': '[128, 64]', 'dropout': 0.04470932575613597, 'batch_norm': False, 'lr': 0.00043454303233654877, 'weight_decay': 0.0007117955159040715, 'epochs': 228, 'loss': 'mae', 'optimizer': 'adam', 'use_snp_selection': False, 'n_pcs': 4500}. Best is trial 51 with value: 0.23802587712824383.
2026-06-01 11:11:02 | INFO | Trial 69 | outer=1 | hidden=[128, 64] epochs=200 lr=3.410e-04 wd=2.036e-04 n_pcs=4000 weight={'name': 'uniform'}
[I 2026-06-01 11:11:07,078] Trial 69 finished with value: 0.2182652995781979 and parameters: {'hidden_dims': '[128, 64]', 'dropout': 0.12412025027963461, 'batch_norm': False, 'lr': 0.0003409529350290194, 'weight_decay': 0.00020360213196096374, 'epochs': 200, 'loss': 'mae', 'optimizer': 'adam', 'use_snp_selection': False, 'n_pcs': 4000}. Best is trial 51 with value: 0.23802587712824383.
2026-06-01 11:11:07 | INFO | Trial 70 | outer=1 | hidden=[512, 256] epochs=190 lr=1.548e-04 wd=4.776e-04 n_pcs=4500 weight={'name': 'uniform'}
[I 2026-06-01 11:11:18,526] Trial 70 finished with value: 0.2015941032431443 and parameters: {'hidden_dims': '[512, 256]', 'dropout': 0.030120031270023828, 'batch_norm': False, 'lr': 0.0001547525654654835, 'weight_decay': 0.00047755422775005204, 'epochs': 190, 'loss': 'mae', 'optimizer': 'adam', 'use_snp_selection': False, 'n_pcs': 4500}. Best is trial 51 with value: 0.23802587712824383.
2026-06-01 11:11:18 | INFO | Trial 71 | outer=1 | hidden=[512, 64] epochs=240 lr=2.853e-04 wd=1.312e-04 n_pcs=5000 weight={'name': 'uniform'}
[I 2026-06-01 11:11:32,347] Trial 71 finished with value: 0.2400360030720047 and parameters: {'hidden_dims': '[512, 64]', 'dropout': 0.059625910114991895, 'batch_norm': False, 'lr': 0.0002852843900352057, 'weight_decay': 0.00013121921845828872, 'epochs': 240, 'loss': 'mae', 'optimizer': 'adam', 'use_snp_selection': False, 'n_pcs': 5000}. Best is trial 71 with value: 0.2400360030720047.
2026-06-01 11:11:32 | INFO | Trial 72 | outer=1 | hidden=[512, 64] epochs=177 lr=2.939e-04 wd=1.075e-04 n_pcs=4500 weight={'name': 'uniform'}
[I 2026-06-01 11:11:42,596] Trial 72 finished with value: 0.21383384109830889 and parameters: {'hidden_dims': '[512, 64]', 'dropout': 0.09318609015975238, 'batch_norm': False, 'lr': 0.0002938610031072821, 'weight_decay': 0.00010748472781834738, 'epochs': 177, 'loss': 'mae', 'optimizer': 'adam', 'use_snp_selection': False, 'n_pcs': 4500}. Best is trial 71 with value: 0.2400360030720047.
2026-06-01 11:11:42 | INFO | Trial 73 | outer=1 | hidden=[512, 64] epochs=255 lr=3.610e-04 wd=7.561e-05 n_pcs=5000 weight={'name': 'uniform'}
[I 2026-06-01 11:11:57,151] Trial 73 finished with value: 0.23078671646289525 and parameters: {'hidden_dims': '[512, 64]', 'dropout': 0.05654179502761038, 'batch_norm': False, 'lr': 0.00036100225549120087, 'weight_decay': 7.561287074340012e-05, 'epochs': 255, 'loss': 'mae', 'optimizer': 'adam', 'use_snp_selection': False, 'n_pcs': 5000}. Best is trial 71 with value: 0.2400360030720047.
2026-06-01 11:11:57 | INFO | Trial 74 | outer=1 | hidden=[512, 64] epochs=256 lr=4.519e-04 wd=7.930e-05 n_pcs=5000 weight={'name': 'uniform'}
[I 2026-06-01 11:12:11,737] Trial 74 finished with value: 0.23547791596687245 and parameters: {'hidden_dims': '[512, 64]', 'dropout': 0.15046851617168638, 'batch_norm': False, 'lr': 0.00045192624407241686, 'weight_decay': 7.930321454781801e-05, 'epochs': 256, 'loss': 'mae', 'optimizer': 'adam', 'use_snp_selection': False, 'n_pcs': 5000}. Best is trial 71 with value: 0.2400360030720047.
2026-06-01 11:12:11 | INFO | Trial 75 | outer=1 | hidden=[512, 64] epochs=280 lr=4.643e-04 wd=7.795e-05 n_pcs=5000 weight={'name': 'uniform'}
[I 2026-06-01 11:12:27,507] Trial 75 finished with value: 0.22513446590109978 and parameters: {'hidden_dims': '[512, 64]', 'dropout': 0.036948755781057774, 'batch_norm': False, 'lr': 0.0004643253943860606, 'weight_decay': 7.794744208467848e-05, 'epochs': 280, 'loss': 'mae', 'optimizer': 'adam', 'use_snp_selection': False, 'n_pcs': 5000}. Best is trial 71 with value: 0.2400360030720047.
2026-06-01 11:12:27 | INFO | Trial 76 | outer=1 | hidden=[512, 64] epochs=262 lr=3.555e-04 wd=3.475e-04 n_pcs=5000 weight={'name': 'uniform'}
[I 2026-06-01 11:12:42,394] Trial 76 finished with value: 0.2216952489991899 and parameters: {'hidden_dims': '[512, 64]', 'dropout': 0.14582774274852828, 'batch_norm': False, 'lr': 0.00035550638792947935, 'weight_decay': 0.00034748457631492656, 'epochs': 262, 'loss': 'mae', 'optimizer': 'adam', 'use_snp_selection': False, 'n_pcs': 5000}. Best is trial 71 with value: 0.2400360030720047.
2026-06-01 11:12:42 | INFO | Trial 77 | outer=1 | hidden=[512, 64] epochs=253 lr=3.205e-04 wd=5.691e-04 n_pcs=5000 weight={'name': 'uniform'}
[I 2026-06-01 11:12:56,857] Trial 77 finished with value: 0.2190205121791125 and parameters: {'hidden_dims': '[512, 64]', 'dropout': 0.17220493733239847, 'batch_norm': False, 'lr': 0.00032051950021301864, 'weight_decay': 0.0005690603011395245, 'epochs': 253, 'loss': 'mae', 'optimizer': 'adam', 'use_snp_selection': False, 'n_pcs': 5000}. Best is trial 71 with value: 0.2400360030720047.
2026-06-01 11:12:56 | INFO | Trial 78 | outer=1 | hidden=[512, 64] epochs=248 lr=4.301e-04 wd=1.113e-08 n_pcs=5000 weight={'name': 'uniform'}
[I 2026-06-01 11:13:11,090] Trial 78 finished with value: 0.22719589809550586 and parameters: {'hidden_dims': '[512, 64]', 'dropout': 0.09076400487523764, 'batch_norm': False, 'lr': 0.0004300817228501594, 'weight_decay': 1.1132256429416085e-08, 'epochs': 248, 'loss': 'mae', 'optimizer': 'adam', 'use_snp_selection': False, 'n_pcs': 5000}. Best is trial 71 with value: 0.2400360030720047.
2026-06-01 11:13:11 | INFO | Trial 79 | outer=1 | hidden=[512, 64] epochs=241 lr=3.769e-04 wd=2.200e-04 n_pcs=5000 weight={'name': 'uniform'}
[I 2026-06-01 11:13:24,985] Trial 79 finished with value: 0.23861223477797883 and parameters: {'hidden_dims': '[512, 64]', 'dropout': 0.11125005539991469, 'batch_norm': False, 'lr': 0.0003769104744517647, 'weight_decay': 0.00021998010021508758, 'epochs': 241, 'loss': 'mae', 'optimizer': 'adam', 'use_snp_selection': False, 'n_pcs': 5000}. Best is trial 71 with value: 0.2400360030720047.
2026-06-01 11:13:25 | INFO | Trial 80 | outer=1 | hidden=[512, 64] epochs=230 lr=3.707e-04 wd=2.338e-04 n_pcs=5000 weight={'name': 'uniform'}
[I 2026-06-01 11:13:38,336] Trial 80 finished with value: 0.22191360978809604 and parameters: {'hidden_dims': '[512, 64]', 'dropout': 0.1100467981566969, 'batch_norm': False, 'lr': 0.00037073926871726803, 'weight_decay': 0.00023376202641032032, 'epochs': 230, 'loss': 'mae', 'optimizer': 'adam', 'use_snp_selection': False, 'n_pcs': 5000}. Best is trial 71 with value: 0.2400360030720047.
2026-06-01 11:13:38 | INFO | Trial 81 | outer=1 | hidden=[512, 64] epochs=240 lr=4.981e-04 wd=1.582e-04 n_pcs=5000 weight={'name': 'uniform'}
