[I 2026-06-01 13:18:17,665] Trial 81 finished with value: 0.17763003344523282 and parameters: {'hidden_dims': '[512, 64]', 'dropout': 0.15303607993027676, 'batch_norm': False, 'lr': 0.0003534327623825595, 'weight_decay': 0.00014027828556483133, 'epochs': 62, 'loss': 'mae', 'optimizer': 'adam', 'use_snp_selection': False, 'n_pcs': 5000}. Best is trial 78 with value: 0.22255274480452733.
2026-06-01 13:18:17 | INFO | Trial 82 | outer=6 | hidden=[512, 64] epochs=53 lr=2.724e-04 wd=9.407e-04 n_pcs=5000 weight={'name': 'uniform'}
[I 2026-06-01 13:18:22,012] Trial 82 finished with value: 0.18133403701167702 and parameters: {'hidden_dims': '[512, 64]', 'dropout': 0.09745981469192046, 'batch_norm': False, 'lr': 0.00027240081208609494, 'weight_decay': 0.0009407430828494173, 'epochs': 53, 'loss': 'mae', 'optimizer': 'adam', 'use_snp_selection': False, 'n_pcs': 5000}. Best is trial 78 with value: 0.22255274480452733.
2026-06-01 13:18:22 | INFO | Trial 83 | outer=6 | hidden=[512, 64] epochs=68 lr=1.916e-04 wd=6.676e-05 n_pcs=4500 weight={'name': 'uniform'}
[I 2026-06-01 13:18:26,775] Trial 83 finished with value: 0.2035012577308474 and parameters: {'hidden_dims': '[512, 64]', 'dropout': 0.3107081317351481, 'batch_norm': False, 'lr': 0.00019158247051665156, 'weight_decay': 6.675679615692668e-05, 'epochs': 68, 'loss': 'mae', 'optimizer': 'adam', 'use_snp_selection': False, 'n_pcs': 4500}. Best is trial 78 with value: 0.22255274480452733.
2026-06-01 13:18:26 | INFO | Trial 84 | outer=6 | hidden=[512, 64] epochs=68 lr=1.825e-04 wd=5.287e-05 n_pcs=4000 weight={'name': 'uniform'}
[I 2026-06-01 13:18:31,204] Trial 84 finished with value: 0.18883659175545425 and parameters: {'hidden_dims': '[512, 64]', 'dropout': 0.3098687685573759, 'batch_norm': False, 'lr': 0.0001825077287576127, 'weight_decay': 5.286905643484542e-05, 'epochs': 68, 'loss': 'mae', 'optimizer': 'adam', 'use_snp_selection': False, 'n_pcs': 4000}. Best is trial 78 with value: 0.22255274480452733.
2026-06-01 13:18:31 | INFO | Trial 85 | outer=6 | hidden=[512, 64] epochs=60 lr=1.647e-04 wd=4.686e-04 n_pcs=4500 weight={'name': 'uniform'}
[I 2026-06-01 13:18:35,662] Trial 85 finished with value: 0.18462090637271567 and parameters: {'hidden_dims': '[512, 64]', 'dropout': 0.33944972769276144, 'batch_norm': False, 'lr': 0.00016471973050241566, 'weight_decay': 0.0004685693770911154, 'epochs': 60, 'loss': 'mae', 'optimizer': 'adam', 'use_snp_selection': False, 'n_pcs': 4500}. Best is trial 78 with value: 0.22255274480452733.
2026-06-01 13:18:35 | INFO | Trial 86 | outer=6 | hidden=[512, 64] epochs=75 lr=4.578e-04 wd=1.522e-04 n_pcs=5000 weight={'name': 'uniform'}
[I 2026-06-01 13:18:40,894] Trial 86 finished with value: 0.1992818831572693 and parameters: {'hidden_dims': '[512, 64]', 'dropout': 0.2634496821505666, 'batch_norm': False, 'lr': 0.00045784270863694125, 'weight_decay': 0.00015218977213699746, 'epochs': 75, 'loss': 'mae', 'optimizer': 'adam', 'use_snp_selection': False, 'n_pcs': 5000}. Best is trial 78 with value: 0.22255274480452733.
2026-06-01 13:18:40 | INFO | Trial 87 | outer=6 | hidden=[512, 64] epochs=85 lr=2.003e-04 wd=8.876e-05 n_pcs=4500 weight={'name': 'uniform'}
[I 2026-06-01 13:18:46,334] Trial 87 finished with value: 0.1930471581214624 and parameters: {'hidden_dims': '[512, 64]', 'dropout': 0.07163026689370489, 'batch_norm': False, 'lr': 0.00020028977867018763, 'weight_decay': 8.876147961400837e-05, 'epochs': 85, 'loss': 'mae', 'optimizer': 'adam', 'use_snp_selection': False, 'n_pcs': 4500}. Best is trial 78 with value: 0.22255274480452733.
2026-06-01 13:18:46 | INFO | Trial 88 | outer=6 | hidden=[512, 64] epochs=57 lr=2.948e-04 wd=2.595e-04 n_pcs=4000 weight={'name': 'uniform'}
[I 2026-06-01 13:18:50,372] Trial 88 finished with value: 0.17968873653090117 and parameters: {'hidden_dims': '[512, 64]', 'dropout': 0.2853013817672555, 'batch_norm': False, 'lr': 0.00029483127888585984, 'weight_decay': 0.00025948326163311835, 'epochs': 57, 'loss': 'mae', 'optimizer': 'adam', 'use_snp_selection': False, 'n_pcs': 4000}. Best is trial 78 with value: 0.22255274480452733.
2026-06-01 13:18:50 | INFO | Trial 89 | outer=6 | hidden=[512, 64] epochs=107 lr=2.303e-04 wd=6.646e-05 n_pcs=5000 weight={'name': 'uniform'}
[I 2026-06-01 13:18:56,928] Trial 89 finished with value: 0.1844297435153168 and parameters: {'hidden_dims': '[512, 64]', 'dropout': 0.22354428022545475, 'batch_norm': False, 'lr': 0.00023033073788793977, 'weight_decay': 6.64621396886277e-05, 'epochs': 107, 'loss': 'mae', 'optimizer': 'adam', 'use_snp_selection': False, 'n_pcs': 5000}. Best is trial 78 with value: 0.22255274480452733.
2026-06-01 13:18:56 | INFO | Trial 90 | outer=6 | hidden=[256, 64] epochs=65 lr=4.130e-04 wd=6.981e-04 n_pcs=4500 weight={'name': 'uniform'}
[I 2026-06-01 13:19:00,360] Trial 90 finished with value: 0.20073756740509432 and parameters: {'hidden_dims': '[256, 64]', 'dropout': 0.24817812285073093, 'batch_norm': False, 'lr': 0.00041295331562947246, 'weight_decay': 0.0006981439869564643, 'epochs': 65, 'loss': 'mae', 'optimizer': 'adam', 'use_snp_selection': False, 'n_pcs': 4500}. Best is trial 78 with value: 0.22255274480452733.
2026-06-01 13:19:00 | INFO | Trial 91 | outer=6 | hidden=[256, 64] epochs=65 lr=3.587e-04 wd=3.466e-04 n_pcs=4500 weight={'name': 'uniform'}
[I 2026-06-01 13:19:02,751] Trial 91 pruned. 
2026-06-01 13:19:02 | INFO | Trial 92 | outer=6 | hidden=[512, 64] epochs=73 lr=4.262e-04 wd=6.479e-04 n_pcs=5000 weight={'name': 'uniform'}
[I 2026-06-01 13:19:07,903] Trial 92 finished with value: 0.1892352507247343 and parameters: {'hidden_dims': '[512, 64]', 'dropout': 0.27307452791877995, 'batch_norm': False, 'lr': 0.0004261645935420876, 'weight_decay': 0.0006479215555385125, 'epochs': 73, 'loss': 'mae', 'optimizer': 'adam', 'use_snp_selection': False, 'n_pcs': 5000}. Best is trial 78 with value: 0.22255274480452733.
2026-06-01 13:19:07 | INFO | Trial 93 | outer=6 | hidden=[256, 64] epochs=78 lr=3.071e-04 wd=2.265e-04 n_pcs=3500 weight={'name': 'uniform'}
[I 2026-06-01 13:19:11,103] Trial 93 finished with value: 0.1760463777465077 and parameters: {'hidden_dims': '[256, 64]', 'dropout': 0.24985895672287894, 'batch_norm': False, 'lr': 0.0003070967087944616, 'weight_decay': 0.00022649419202633574, 'epochs': 78, 'loss': 'mae', 'optimizer': 'adam', 'use_snp_selection': False, 'n_pcs': 3500}. Best is trial 78 with value: 0.22255274480452733.
2026-06-01 13:19:11 | INFO | Trial 94 | outer=6 | hidden=[256, 64] epochs=53 lr=4.020e-04 wd=7.713e-04 n_pcs=4500 weight={'name': 'uniform'}
[I 2026-06-01 13:19:14,275] Trial 94 finished with value: 0.18936480745587475 and parameters: {'hidden_dims': '[256, 64]', 'dropout': 0.21271051999520385, 'batch_norm': False, 'lr': 0.00040204791096964243, 'weight_decay': 0.0007713052303418788, 'epochs': 53, 'loss': 'mae', 'optimizer': 'adam', 'use_snp_selection': False, 'n_pcs': 4500}. Best is trial 78 with value: 0.22255274480452733.
2026-06-01 13:19:14 | INFO | Trial 95 | outer=6 | hidden=[512, 128] epochs=62 lr=2.614e-04 wd=1.189e-04 n_pcs=5000 weight={'name': 'uniform'}
[I 2026-06-01 13:19:19,042] Trial 95 finished with value: 0.18489756031094196 and parameters: {'hidden_dims': '[512, 128]', 'dropout': 0.29313167778799387, 'batch_norm': False, 'lr': 0.00026141934237207257, 'weight_decay': 0.00011893814759843433, 'epochs': 62, 'loss': 'mae', 'optimizer': 'adam', 'use_snp_selection': False, 'n_pcs': 5000}. Best is trial 78 with value: 0.22255274480452733.
2026-06-01 13:19:19 | INFO | Trial 96 | outer=6 | hidden=[512, 64] epochs=85 lr=3.518e-04 wd=4.367e-04 n_pcs=4000 weight={'name': 'uniform'}
[I 2026-06-01 13:19:24,074] Trial 96 finished with value: 0.1958481622407695 and parameters: {'hidden_dims': '[512, 64]', 'dropout': 0.30598248355800556, 'batch_norm': False, 'lr': 0.00035181763867034316, 'weight_decay': 0.0004367145359291287, 'epochs': 85, 'loss': 'mae', 'optimizer': 'adamw', 'use_snp_selection': False, 'n_pcs': 4000}. Best is trial 78 with value: 0.22255274480452733.
2026-06-01 13:19:24 | INFO | Trial 97 | outer=6 | hidden=[256, 64] epochs=67 lr=4.669e-04 wd=1.204e-05 n_pcs=3000 weight={'name': 'uniform'}
[I 2026-06-01 13:19:26,907] Trial 97 finished with value: 0.1716320770012573 and parameters: {'hidden_dims': '[256, 64]', 'dropout': 0.3490512804962344, 'batch_norm': False, 'lr': 0.00046690105861023926, 'weight_decay': 1.2036305451566443e-05, 'epochs': 67, 'loss': 'mae', 'optimizer': 'adamw', 'use_snp_selection': False, 'n_pcs': 3000}. Best is trial 78 with value: 0.22255274480452733.
2026-06-01 13:19:26 | INFO | Trial 98 | outer=6 | hidden=[1024, 256] epochs=50 lr=3.191e-04 wd=2.970e-04 n_pcs=4500 weight={'name': 'uniform'}
[I 2026-06-01 13:19:33,073] Trial 98 finished with value: 0.2049352916486718 and parameters: {'hidden_dims': '[1024, 256]', 'dropout': 0.17518121412031878, 'batch_norm': False, 'lr': 0.0003191289002543794, 'weight_decay': 0.00029695975083103484, 'epochs': 50, 'loss': 'mae', 'optimizer': 'adam', 'use_snp_selection': False, 'n_pcs': 4500}. Best is trial 78 with value: 0.22255274480452733.
2026-06-01 13:19:33 | INFO | Trial 99 | outer=6 | hidden=[1024, 256] epochs=95 lr=3.244e-04 wd=2.952e-06 n_pcs=5000 weight={'name': 'uniform'}
[I 2026-06-01 13:19:43,302] Trial 99 finished with value: 0.21486248683653314 and parameters: {'hidden_dims': '[1024, 256]', 'dropout': 0.1460140552647087, 'batch_norm': False, 'lr': 0.0003244023740013199, 'weight_decay': 2.9519164840972755e-06, 'epochs': 95, 'loss': 'mae', 'optimizer': 'adam', 'use_snp_selection': False, 'n_pcs': 5000}. Best is trial 78 with value: 0.22255274480452733.
2026-06-01 13:19:43 | INFO | Trial 100 | outer=6 | hidden=[1024, 256] epochs=115 lr=2.834e-04 wd=5.034e-06 n_pcs=5000 weight={'name': 'uniform'}
[I 2026-06-01 13:19:55,188] Trial 100 finished with value: 0.21320955964981025 and parameters: {'hidden_dims': '[1024, 256]', 'dropout': 0.13811435678317946, 'batch_norm': False, 'lr': 0.0002834371577883527, 'weight_decay': 5.033807285725636e-06, 'epochs': 115, 'loss': 'mae', 'optimizer': 'adam', 'use_snp_selection': False, 'n_pcs': 5000}. Best is trial 78 with value: 0.22255274480452733.
2026-06-01 13:19:55 | INFO | Trial 101 | outer=6 | hidden=[1024, 256] epochs=117 lr=3.193e-04 wd=1.308e-06 n_pcs=5000 weight={'name': 'uniform'}
[I 2026-06-01 13:20:07,238] Trial 101 finished with value: 0.20259169990704629 and parameters: {'hidden_dims': '[1024, 256]', 'dropout': 0.1425835411873936, 'batch_norm': False, 'lr': 0.0003192527600696346, 'weight_decay': 1.308322452469928e-06, 'epochs': 117, 'loss': 'mae', 'optimizer': 'adam', 'use_snp_selection': False, 'n_pcs': 5000}. Best is trial 78 with value: 0.22255274480452733.
2026-06-01 13:20:07 | INFO | Trial 102 | outer=6 | hidden=[1024, 256] epochs=110 lr=2.483e-04 wd=3.232e-05 n_pcs=5000 weight={'name': 'uniform'}
[I 2026-06-01 13:20:18,715] Trial 102 finished with value: 0.18512512742000076 and parameters: {'hidden_dims': '[1024, 256]', 'dropout': 0.17193865729071045, 'batch_norm': False, 'lr': 0.0002483320066850965, 'weight_decay': 3.2324613784582185e-05, 'epochs': 110, 'loss': 'mae', 'optimizer': 'adam', 'use_snp_selection': False, 'n_pcs': 5000}. Best is trial 78 with value: 0.22255274480452733.
2026-06-01 13:20:18 | INFO | Trial 103 | outer=6 | hidden=[1024, 256] epochs=98 lr=2.915e-04 wd=6.189e-06 n_pcs=5000 weight={'name': 'uniform'}
[I 2026-06-01 13:20:29,193] Trial 103 finished with value: 0.20362857463336206 and parameters: {'hidden_dims': '[1024, 256]', 'dropout': 0.0994685249295748, 'batch_norm': False, 'lr': 0.0002914586657064464, 'weight_decay': 6.188986545665452e-06, 'epochs': 98, 'loss': 'mae', 'optimizer': 'adam', 'use_snp_selection': False, 'n_pcs': 5000}. Best is trial 78 with value: 0.22255274480452733.
2026-06-01 13:20:29 | INFO | Trial 104 | outer=6 | hidden=[1024, 256] epochs=102 lr=2.810e-04 wd=2.212e-06 n_pcs=5000 weight={'name': 'uniform'}
[I 2026-06-01 13:20:40,008] Trial 104 finished with value: 0.19096596078047906 and parameters: {'hidden_dims': '[1024, 256]', 'dropout': 0.07620037348671466, 'batch_norm': False, 'lr': 0.000281021205290605, 'weight_decay': 2.2120786869721464e-06, 'epochs': 102, 'loss': 'mae', 'optimizer': 'adam', 'use_snp_selection': False, 'n_pcs': 5000}. Best is trial 78 with value: 0.22255274480452733.
2026-06-01 13:20:40 | INFO | Trial 105 | outer=6 | hidden=[1024, 256] epochs=96 lr=2.253e-04 wd=5.075e-06 n_pcs=5000 weight={'name': 'uniform'}
[I 2026-06-01 13:20:50,345] Trial 105 finished with value: 0.18742730424364204 and parameters: {'hidden_dims': '[1024, 256]', 'dropout': 0.12267713448958273, 'batch_norm': False, 'lr': 0.00022527251670159792, 'weight_decay': 5.075019609957425e-06, 'epochs': 96, 'loss': 'mae', 'optimizer': 'adam', 'use_snp_selection': False, 'n_pcs': 5000}. Best is trial 78 with value: 0.22255274480452733.
2026-06-01 13:20:50 | INFO | Trial 106 | outer=6 | hidden=[1024, 256] epochs=81 lr=1.960e-04 wd=4.292e-06 n_pcs=4500 weight={'name': 'uniform'}
[I 2026-06-01 13:20:58,913] Trial 106 finished with value: 0.20704223979778996 and parameters: {'hidden_dims': '[1024, 256]', 'dropout': 0.14643043678244175, 'batch_norm': False, 'lr': 0.00019595797280609, 'weight_decay': 4.291675289937349e-06, 'epochs': 81, 'loss': 'mae', 'optimizer': 'adam', 'use_snp_selection': False, 'n_pcs': 4500}. Best is trial 78 with value: 0.22255274480452733.
2026-06-01 13:20:58 | INFO | Trial 107 | outer=6 | hidden=[1024, 256] epochs=124 lr=2.597e-04 wd=6.035e-06 n_pcs=5000 weight={'name': 'uniform'}
[I 2026-06-01 13:21:11,560] Trial 107 finished with value: 0.19067800049340422 and parameters: {'hidden_dims': '[1024, 256]', 'dropout': 0.15250641156641906, 'batch_norm': False, 'lr': 0.0002596604363065309, 'weight_decay': 6.034655388554869e-06, 'epochs': 124, 'loss': 'mae', 'optimizer': 'adam', 'use_snp_selection': False, 'n_pcs': 5000}. Best is trial 78 with value: 0.22255274480452733.
2026-06-01 13:21:11 | INFO | Trial 108 | outer=6 | hidden=[1024, 256] epochs=109 lr=3.000e-04 wd=3.713e-06 n_pcs=5000 weight={'name': 'uniform'}
[I 2026-06-01 13:21:22,946] Trial 108 finished with value: 0.20492858212685733 and parameters: {'hidden_dims': '[1024, 256]', 'dropout': 0.13830681543528628, 'batch_norm': False, 'lr': 0.00029998521039932406, 'weight_decay': 3.713451363216917e-06, 'epochs': 109, 'loss': 'mae', 'optimizer': 'adam', 'use_snp_selection': False, 'n_pcs': 5000}. Best is trial 78 with value: 0.22255274480452733.
2026-06-01 13:21:22 | INFO | Trial 109 | outer=6 | hidden=[1024, 256] epochs=132 lr=2.019e-04 wd=2.648e-06 n_pcs=4500 weight={'name': 'uniform'}
[I 2026-06-01 13:21:35,508] Trial 109 finished with value: 0.21012121982137705 and parameters: {'hidden_dims': '[1024, 256]', 'dropout': 0.1400699909407687, 'batch_norm': False, 'lr': 0.00020194542122577188, 'weight_decay': 2.647638481435625e-06, 'epochs': 132, 'loss': 'mae', 'optimizer': 'adam', 'use_snp_selection': False, 'n_pcs': 4500}. Best is trial 78 with value: 0.22255274480452733.
2026-06-01 13:21:35 | INFO | Trial 110 | outer=6 | hidden=[1024, 256] epochs=129 lr=2.304e-04 wd=4.566e-06 n_pcs=4500 weight={'name': 'uniform'}
[I 2026-06-01 13:21:47,803] Trial 110 finished with value: 0.2015170756786485 and parameters: {'hidden_dims': '[1024, 256]', 'dropout': 0.13793112366099275, 'batch_norm': False, 'lr': 0.00023035019278175648, 'weight_decay': 4.5657196532053625e-06, 'epochs': 129, 'loss': 'mae', 'optimizer': 'adam', 'use_snp_selection': False, 'n_pcs': 4500}. Best is trial 78 with value: 0.22255274480452733.
2026-06-01 13:21:47 | INFO | Trial 111 | outer=6 | hidden=[1024, 256] epochs=113 lr=2.047e-04 wd=2.889e-06 n_pcs=4500 weight={'name': 'uniform'}
[I 2026-06-01 13:21:58,857] Trial 111 finished with value: 0.20818656721736056 and parameters: {'hidden_dims': '[1024, 256]', 'dropout': 0.17593558729508504, 'batch_norm': False, 'lr': 0.0002047090447101891, 'weight_decay': 2.8885087476851967e-06, 'epochs': 113, 'loss': 'mae', 'optimizer': 'adam', 'use_snp_selection': False, 'n_pcs': 4500}. Best is trial 78 with value: 0.22255274480452733.
2026-06-01 13:21:58 | INFO | Trial 112 | outer=6 | hidden=[1024, 256] epochs=139 lr=2.002e-04 wd=2.797e-06 n_pcs=4500 weight={'name': 'uniform'}
[I 2026-06-01 13:22:11,936] Trial 112 finished with value: 0.18315949515030244 and parameters: {'hidden_dims': '[1024, 256]', 'dropout': 0.17830104735498897, 'batch_norm': False, 'lr': 0.00020019043286046483, 'weight_decay': 2.7967231108674918e-06, 'epochs': 139, 'loss': 'mae', 'optimizer': 'adam', 'use_snp_selection': False, 'n_pcs': 4500}. Best is trial 78 with value: 0.22255274480452733.
2026-06-01 13:22:11 | INFO | Trial 113 | outer=6 | hidden=[1024, 256] epochs=106 lr=1.416e-04 wd=3.710e-06 n_pcs=4000 weight={'name': 'uniform'}
[I 2026-06-01 13:22:21,576] Trial 113 finished with value: 0.19620745068225515 and parameters: {'hidden_dims': '[1024, 256]', 'dropout': 0.1865127620902488, 'batch_norm': False, 'lr': 0.00014156215960287296, 'weight_decay': 3.7098738091712332e-06, 'epochs': 106, 'loss': 'mae', 'optimizer': 'adam', 'use_snp_selection': False, 'n_pcs': 4000}. Best is trial 78 with value: 0.22255274480452733.
2026-06-01 13:22:21 | INFO | Trial 114 | outer=6 | hidden=[1024, 256] epochs=121 lr=1.522e-04 wd=1.160e-06 n_pcs=4500 weight={'name': 'uniform'}
[I 2026-06-01 13:22:33,250] Trial 114 finished with value: 0.1978268301788548 and parameters: {'hidden_dims': '[1024, 256]', 'dropout': 0.10829607472642491, 'batch_norm': False, 'lr': 0.0001521759444477684, 'weight_decay': 1.1596787835337666e-06, 'epochs': 121, 'loss': 'mae', 'optimizer': 'adam', 'use_snp_selection': False, 'n_pcs': 4500}. Best is trial 78 with value: 0.22255274480452733.
2026-06-01 13:22:33 | INFO | Trial 115 | outer=6 | hidden=[1024, 256] epochs=114 lr=2.042e-04 wd=1.804e-06 n_pcs=4500 weight={'name': 'uniform'}
[I 2026-06-01 13:22:44,388] Trial 115 finished with value: 0.19872852670778857 and parameters: {'hidden_dims': '[1024, 256]', 'dropout': 0.13174051262469694, 'batch_norm': False, 'lr': 0.00020418122547304174, 'weight_decay': 1.803610149197757e-06, 'epochs': 114, 'loss': 'mae', 'optimizer': 'adam', 'use_snp_selection': False, 'n_pcs': 4500}. Best is trial 78 with value: 0.22255274480452733.
2026-06-01 13:22:44 | INFO | Trial 116 | outer=6 | hidden=[1024, 256] epochs=108 lr=2.426e-04 wd=8.061e-06 n_pcs=5000 weight={'name': 'uniform'}
[I 2026-06-01 13:22:55,709] Trial 116 finished with value: 0.19724488109150815 and parameters: {'hidden_dims': '[1024, 256]', 'dropout': 0.1611353450657831, 'batch_norm': False, 'lr': 0.00024258035237975761, 'weight_decay': 8.061363474712959e-06, 'epochs': 108, 'loss': 'mae', 'optimizer': 'adam', 'use_snp_selection': False, 'n_pcs': 5000}. Best is trial 78 with value: 0.22255274480452733.
2026-06-01 13:22:55 | INFO | Trial 117 | outer=6 | hidden=[1024, 256] epochs=133 lr=1.763e-04 wd=3.659e-06 n_pcs=5000 weight={'name': 'uniform'}
[I 2026-06-01 13:23:09,078] Trial 117 finished with value: 0.20753069034100133 and parameters: {'hidden_dims': '[1024, 256]', 'dropout': 0.16368344715473523, 'batch_norm': False, 'lr': 0.00017625882097231627, 'weight_decay': 3.658529854449394e-06, 'epochs': 133, 'loss': 'mae', 'optimizer': 'adam', 'use_snp_selection': False, 'n_pcs': 5000}. Best is trial 78 with value: 0.22255274480452733.
2026-06-01 13:23:09 | INFO | Trial 118 | outer=6 | hidden=[1024, 256] epochs=130 lr=1.275e-04 wd=1.457e-05 n_pcs=5000 weight={'name': 'uniform'}
[I 2026-06-01 13:23:22,221] Trial 118 finished with value: 0.20432658666191134 and parameters: {'hidden_dims': '[1024, 256]', 'dropout': 0.19699167881706442, 'batch_norm': False, 'lr': 0.00012747585094760773, 'weight_decay': 1.4574244456405803e-05, 'epochs': 130, 'loss': 'mae', 'optimizer': 'adam', 'use_snp_selection': False, 'n_pcs': 5000}. Best is trial 78 with value: 0.22255274480452733.
2026-06-01 13:23:22 | INFO | Trial 119 | outer=6 | hidden=[1024, 256] epochs=136 lr=1.786e-04 wd=3.871e-06 n_pcs=5000 weight={'name': 'uniform'}
[I 2026-06-01 13:23:35,887] Trial 119 finished with value: 0.1970101782838278 and parameters: {'hidden_dims': '[1024, 256]', 'dropout': 0.15943714227339686, 'batch_norm': False, 'lr': 0.00017857334948180226, 'weight_decay': 3.8712188095987916e-06, 'epochs': 136, 'loss': 'mae', 'optimizer': 'adam', 'use_snp_selection': False, 'n_pcs': 5000}. Best is trial 78 with value: 0.22255274480452733.
2026-06-01 13:23:35 | INFO | Trial 120 | outer=6 | hidden=[1024, 256] epochs=144 lr=1.651e-04 wd=7.765e-06 n_pcs=4500 weight={'name': 'uniform'}
[I 2026-06-01 13:23:49,343] Trial 120 finished with value: 0.19366029863507556 and parameters: {'hidden_dims': '[1024, 256]', 'dropout': 0.07955596773763639, 'batch_norm': False, 'lr': 0.00016507887954000204, 'weight_decay': 7.764813319218455e-06, 'epochs': 144, 'loss': 'mae', 'optimizer': 'adam', 'use_snp_selection': False, 'n_pcs': 4500}. Best is trial 78 with value: 0.22255274480452733.
2026-06-01 13:23:49 | INFO | Trial 121 | outer=6 | hidden=[1024, 256] epochs=129 lr=9.164e-05 wd=1.220e-05 n_pcs=5000 weight={'name': 'uniform'}
[I 2026-06-01 13:23:58,452] Trial 121 pruned. 
2026-06-01 13:23:58 | INFO | Trial 122 | outer=6 | hidden=[1024, 256] epochs=152 lr=1.330e-04 wd=1.605e-05 n_pcs=5000 weight={'name': 'uniform'}
[I 2026-06-01 13:24:13,407] Trial 122 finished with value: 0.18888352491144342 and parameters: {'hidden_dims': '[1024, 256]', 'dropout': 0.20400998270636353, 'batch_norm': False, 'lr': 0.00013301950408650516, 'weight_decay': 1.6046859449816225e-05, 'epochs': 152, 'loss': 'mae', 'optimizer': 'adam', 'use_snp_selection': False, 'n_pcs': 5000}. Best is trial 78 with value: 0.22255274480452733.
2026-06-01 13:24:13 | INFO | Trial 123 | outer=6 | hidden=[1024, 256] epochs=118 lr=1.510e-04 wd=2.084e-06 n_pcs=5000 weight={'name': 'uniform'}
