[I 2026-06-01 15:47:13,994] Trial 117 finished with value: 0.1916024992555274 and parameters: {'hidden_dims': '[1024, 256]', 'dropout': 0.13925922156524745, 'batch_norm': False, 'lr': 0.00011778849905846806, 'weight_decay': 2.305927120893879e-08, 'epochs': 169, 'loss': 'mae', 'optimizer': 'adam', 'use_snp_selection': False, 'n_pcs': 4000}. Best is trial 103 with value: 0.20818817647636187.
2026-06-01 15:47:14 | INFO | Trial 118 | outer=14 | hidden=[512, 128] epochs=163 lr=1.022e-04 wd=1.303e-08 n_pcs=4500 weight={'name': 'uniform'}
[I 2026-06-01 15:47:19,560] Trial 118 pruned. 
2026-06-01 15:47:19 | INFO | Trial 119 | outer=14 | hidden=[1024, 256] epochs=153 lr=1.936e-04 wd=5.602e-08 n_pcs=5000 weight={'name': 'uniform'}
[I 2026-06-01 15:47:35,739] Trial 119 finished with value: 0.19367991636773813 and parameters: {'hidden_dims': '[1024, 256]', 'dropout': 0.198092939213931, 'batch_norm': False, 'lr': 0.00019360813805314602, 'weight_decay': 5.602081265263723e-08, 'epochs': 153, 'loss': 'mae', 'optimizer': 'adam', 'use_snp_selection': False, 'n_pcs': 5000}. Best is trial 103 with value: 0.20818817647636187.
2026-06-01 15:47:35 | INFO | Trial 120 | outer=14 | hidden=[256, 64] epochs=180 lr=1.623e-04 wd=3.953e-08 n_pcs=4000 weight={'name': 'uniform'}
[I 2026-06-01 15:47:41,423] Trial 120 finished with value: 0.18852148690681622 and parameters: {'hidden_dims': '[256, 64]', 'dropout': 0.0923334372106715, 'batch_norm': False, 'lr': 0.0001622881110485599, 'weight_decay': 3.952994218356441e-08, 'epochs': 180, 'loss': 'mae', 'optimizer': 'adam', 'use_snp_selection': False, 'n_pcs': 4000}. Best is trial 103 with value: 0.20818817647636187.
2026-06-01 15:47:41 | INFO | Trial 121 | outer=14 | hidden=[1024, 256] epochs=134 lr=8.750e-05 wd=1.766e-08 n_pcs=4500 weight={'name': 'uniform'}
[I 2026-06-01 15:47:55,068] Trial 121 finished with value: 0.18113914614967314 and parameters: {'hidden_dims': '[1024, 256]', 'dropout': 0.177864825377387, 'batch_norm': False, 'lr': 8.750215509244367e-05, 'weight_decay': 1.7661617561782112e-08, 'epochs': 134, 'loss': 'mae', 'optimizer': 'adam', 'use_snp_selection': False, 'n_pcs': 4500}. Best is trial 103 with value: 0.20818817647636187.
2026-06-01 15:47:55 | INFO | Trial 122 | outer=14 | hidden=[1024, 256] epochs=147 lr=2.088e-04 wd=2.305e-08 n_pcs=4500 weight={'name': 'uniform'}
[I 2026-06-01 15:48:09,809] Trial 122 finished with value: 0.18697771675258182 and parameters: {'hidden_dims': '[1024, 256]', 'dropout': 0.19845408955848748, 'batch_norm': False, 'lr': 0.0002087732733713874, 'weight_decay': 2.3045441124778664e-08, 'epochs': 147, 'loss': 'mae', 'optimizer': 'adam', 'use_snp_selection': False, 'n_pcs': 4500}. Best is trial 103 with value: 0.20818817647636187.
2026-06-01 15:48:09 | INFO | Trial 123 | outer=14 | hidden=[1024, 256] epochs=141 lr=1.329e-04 wd=4.845e-08 n_pcs=4500 weight={'name': 'uniform'}
[I 2026-06-01 15:48:24,035] Trial 123 finished with value: 0.20457509363266219 and parameters: {'hidden_dims': '[1024, 256]', 'dropout': 0.16082921194134275, 'batch_norm': False, 'lr': 0.0001328874493376688, 'weight_decay': 4.845332656013152e-08, 'epochs': 141, 'loss': 'mae', 'optimizer': 'adam', 'use_snp_selection': False, 'n_pcs': 4500}. Best is trial 103 with value: 0.20818817647636187.
2026-06-01 15:48:24 | INFO | Trial 124 | outer=14 | hidden=[1024, 256] epochs=121 lr=1.272e-04 wd=4.918e-08 n_pcs=4500 weight={'name': 'uniform'}
[I 2026-06-01 15:48:36,580] Trial 124 finished with value: 0.20064964834068083 and parameters: {'hidden_dims': '[1024, 256]', 'dropout': 0.15970783529838756, 'batch_norm': False, 'lr': 0.0001271945534474889, 'weight_decay': 4.9182274378088923e-08, 'epochs': 121, 'loss': 'mae', 'optimizer': 'adam', 'use_snp_selection': False, 'n_pcs': 4500}. Best is trial 103 with value: 0.20818817647636187.
2026-06-01 15:48:36 | INFO | Trial 125 | outer=14 | hidden=[256, 128] epochs=108 lr=1.281e-04 wd=1.309e-08 n_pcs=5000 weight={'name': 'uniform'}
[I 2026-06-01 15:48:39,531] Trial 125 pruned. 
2026-06-01 15:48:39 | INFO | Trial 126 | outer=14 | hidden=[1024, 256] epochs=126 lr=1.343e-04 wd=2.985e-08 n_pcs=4500 weight={'name': 'uniform'}
[I 2026-06-01 15:48:52,502] Trial 126 finished with value: 0.19983607389827765 and parameters: {'hidden_dims': '[1024, 256]', 'dropout': 0.15748803018366084, 'batch_norm': False, 'lr': 0.00013431357626359834, 'weight_decay': 2.9846882410990535e-08, 'epochs': 126, 'loss': 'mae', 'optimizer': 'adam', 'use_snp_selection': False, 'n_pcs': 4500}. Best is trial 103 with value: 0.20818817647636187.
2026-06-01 15:48:52 | INFO | Trial 127 | outer=14 | hidden=[1024, 256] epochs=122 lr=1.799e-04 wd=1.932e-08 n_pcs=4000 weight={'name': 'uniform'}
[I 2026-06-01 15:49:03,951] Trial 127 finished with value: 0.19449081693828357 and parameters: {'hidden_dims': '[1024, 256]', 'dropout': 0.2213689205643335, 'batch_norm': False, 'lr': 0.00017987310848547743, 'weight_decay': 1.931859625142483e-08, 'epochs': 122, 'loss': 'mae', 'optimizer': 'adam', 'use_snp_selection': False, 'n_pcs': 4000}. Best is trial 103 with value: 0.20818817647636187.
2026-06-01 15:49:03 | INFO | Trial 128 | outer=14 | hidden=[512, 64] epochs=139 lr=1.721e-04 wd=6.462e-05 n_pcs=5000 weight={'name': 'uniform'}
[I 2026-06-01 15:49:12,337] Trial 128 finished with value: 0.1835752862606171 and parameters: {'hidden_dims': '[512, 64]', 'dropout': 0.14887697494396757, 'batch_norm': False, 'lr': 0.0001721069301275297, 'weight_decay': 6.462105346537155e-05, 'epochs': 139, 'loss': 'mae', 'optimizer': 'adam', 'use_snp_selection': False, 'n_pcs': 5000}. Best is trial 103 with value: 0.20818817647636187.
2026-06-01 15:49:12 | INFO | Trial 129 | outer=14 | hidden=[1024, 256] epochs=114 lr=1.454e-04 wd=1.140e-07 n_pcs=3500 weight={'name': 'uniform'}
[I 2026-06-01 15:49:22,332] Trial 129 finished with value: 0.1855611218622748 and parameters: {'hidden_dims': '[1024, 256]', 'dropout': 0.36138287422854964, 'batch_norm': False, 'lr': 0.00014544616955000235, 'weight_decay': 1.1396429335721392e-07, 'epochs': 114, 'loss': 'mae', 'optimizer': 'adam', 'use_snp_selection': False, 'n_pcs': 3500}. Best is trial 103 with value: 0.20818817647636187.
2026-06-01 15:49:22 | INFO | Trial 130 | outer=14 | hidden=[1024, 256] epochs=101 lr=1.203e-04 wd=3.650e-08 n_pcs=4500 weight={'name': 'uniform'}
[I 2026-06-01 15:49:33,223] Trial 130 finished with value: 0.19396112623752193 and parameters: {'hidden_dims': '[1024, 256]', 'dropout': 0.16365073456067397, 'batch_norm': False, 'lr': 0.00012029216080669224, 'weight_decay': 3.649725633403473e-08, 'epochs': 101, 'loss': 'mae', 'optimizer': 'adam', 'use_snp_selection': False, 'n_pcs': 4500}. Best is trial 103 with value: 0.20818817647636187.
2026-06-01 15:49:33 | INFO | Trial 131 | outer=14 | hidden=[1024, 256] epochs=155 lr=9.553e-05 wd=5.026e-08 n_pcs=4500 weight={'name': 'uniform'}
[I 2026-06-01 15:49:42,621] Trial 131 pruned. 
2026-06-01 15:49:42 | INFO | Trial 132 | outer=14 | hidden=[1024, 256] epochs=159 lr=7.471e-05 wd=2.544e-08 n_pcs=4500 weight={'name': 'uniform'}
[I 2026-06-01 15:49:58,409] Trial 132 finished with value: 0.19544352066331047 and parameters: {'hidden_dims': '[1024, 256]', 'dropout': 0.18815163165684023, 'batch_norm': False, 'lr': 7.470995107136483e-05, 'weight_decay': 2.5441766562438386e-08, 'epochs': 159, 'loss': 'mae', 'optimizer': 'adam', 'use_snp_selection': False, 'n_pcs': 4500}. Best is trial 103 with value: 0.20818817647636187.
2026-06-01 15:49:58 | INFO | Trial 133 | outer=14 | hidden=[1024, 256] epochs=143 lr=1.649e-04 wd=7.079e-08 n_pcs=4500 weight={'name': 'uniform'}
[I 2026-06-01 15:50:12,825] Trial 133 finished with value: 0.19969960325811817 and parameters: {'hidden_dims': '[1024, 256]', 'dropout': 0.20802735651235588, 'batch_norm': False, 'lr': 0.00016485323500735634, 'weight_decay': 7.078703781386165e-08, 'epochs': 143, 'loss': 'mae', 'optimizer': 'adam', 'use_snp_selection': False, 'n_pcs': 4500}. Best is trial 103 with value: 0.20818817647636187.
2026-06-01 15:50:12 | INFO | Trial 134 | outer=14 | hidden=[1024, 256] epochs=171 lr=1.525e-04 wd=1.472e-08 n_pcs=5000 weight={'name': 'uniform'}
[I 2026-06-01 15:50:23,715] Trial 134 pruned. 
2026-06-01 15:50:23 | INFO | Trial 135 | outer=14 | hidden=[256, 64] epochs=119 lr=1.999e-04 wd=4.647e-08 n_pcs=4500 weight={'name': 'uniform'}
[I 2026-06-01 15:50:28,585] Trial 135 finished with value: 0.17401609222306821 and parameters: {'hidden_dims': '[256, 64]', 'dropout': 0.5866914194665813, 'batch_norm': False, 'lr': 0.00019985722978990548, 'weight_decay': 4.647269369630837e-08, 'epochs': 119, 'loss': 'mae', 'optimizer': 'adam', 'use_snp_selection': False, 'n_pcs': 4500}. Best is trial 103 with value: 0.20818817647636187.
2026-06-01 15:50:28 | INFO | Trial 136 | outer=14 | hidden=[1024, 256] epochs=165 lr=2.222e-04 wd=1.009e-08 n_pcs=4000 weight={'name': 'uniform'}
[I 2026-06-01 15:50:43,257] Trial 136 finished with value: 0.18946364516938688 and parameters: {'hidden_dims': '[1024, 256]', 'dropout': 0.5604815776168486, 'batch_norm': False, 'lr': 0.00022222578415247846, 'weight_decay': 1.0088760158248768e-08, 'epochs': 165, 'loss': 'mae', 'optimizer': 'adam', 'use_snp_selection': False, 'n_pcs': 4000}. Best is trial 103 with value: 0.20818817647636187.
2026-06-01 15:50:43 | INFO | Trial 137 | outer=14 | hidden=[1024, 256] epochs=149 lr=1.088e-04 wd=1.887e-08 n_pcs=4500 weight={'name': 'uniform'}
[I 2026-06-01 15:50:58,177] Trial 137 finished with value: 0.19281717278515817 and parameters: {'hidden_dims': '[1024, 256]', 'dropout': 0.1714491632059669, 'batch_norm': False, 'lr': 0.00010879492480059436, 'weight_decay': 1.8868759204671755e-08, 'epochs': 149, 'loss': 'mae', 'optimizer': 'adam', 'use_snp_selection': False, 'n_pcs': 4500}. Best is trial 103 with value: 0.20818817647636187.
2026-06-01 15:50:58 | INFO | Trial 138 | outer=14 | hidden=[1024, 256] epochs=137 lr=1.385e-04 wd=3.265e-08 n_pcs=5000 weight={'name': 'uniform'}
[I 2026-06-01 15:51:12,966] Trial 138 finished with value: 0.19644940034441347 and parameters: {'hidden_dims': '[1024, 256]', 'dropout': 0.17906478776724322, 'batch_norm': False, 'lr': 0.00013846975835316307, 'weight_decay': 3.264638855907256e-08, 'epochs': 137, 'loss': 'mae', 'optimizer': 'adam', 'use_snp_selection': False, 'n_pcs': 5000}. Best is trial 103 with value: 0.20818817647636187.
2026-06-01 15:51:12 | INFO | Trial 139 | outer=14 | hidden=[512, 128] epochs=153 lr=6.875e-05 wd=5.761e-08 n_pcs=4000 weight={'name': 'uniform'}
[I 2026-06-01 15:51:20,968] Trial 139 finished with value: 0.16206570314486712 and parameters: {'hidden_dims': '[512, 128]', 'dropout': 0.15561472185474906, 'batch_norm': False, 'lr': 6.874757520582573e-05, 'weight_decay': 5.761339982951027e-08, 'epochs': 153, 'loss': 'mse', 'optimizer': 'adamw', 'use_snp_selection': False, 'n_pcs': 4000}. Best is trial 103 with value: 0.20818817647636187.
2026-06-01 15:51:20 | INFO | Trial 140 | outer=14 | hidden=[1024, 256] epochs=159 lr=8.993e-05 wd=2.375e-08 n_pcs=4500 weight={'name': 'uniform'}
[I 2026-06-01 15:51:30,576] Trial 140 pruned. 
2026-06-01 15:51:30 | INFO | Trial 141 | outer=14 | hidden=[1024, 256] epochs=129 lr=2.382e-04 wd=6.961e-08 n_pcs=4500 weight={'name': 'uniform'}
[I 2026-06-01 15:51:43,832] Trial 141 finished with value: 0.1898867958413026 and parameters: {'hidden_dims': '[1024, 256]', 'dropout': 0.20297743461990914, 'batch_norm': False, 'lr': 0.000238150804399962, 'weight_decay': 6.960657147069076e-08, 'epochs': 129, 'loss': 'mae', 'optimizer': 'adam', 'use_snp_selection': False, 'n_pcs': 4500}. Best is trial 103 with value: 0.20818817647636187.
2026-06-01 15:51:43 | INFO | Trial 142 | outer=14 | hidden=[1024, 256] epochs=131 lr=3.152e-04 wd=7.853e-08 n_pcs=4500 weight={'name': 'uniform'}
[I 2026-06-01 15:51:57,261] Trial 142 finished with value: 0.19803976468727402 and parameters: {'hidden_dims': '[1024, 256]', 'dropout': 0.21682551795629848, 'batch_norm': False, 'lr': 0.00031520252409767926, 'weight_decay': 7.853213923252057e-08, 'epochs': 131, 'loss': 'mae', 'optimizer': 'adam', 'use_snp_selection': False, 'n_pcs': 4500}. Best is trial 103 with value: 0.20818817647636187.
2026-06-01 15:51:57 | INFO | Trial 143 | outer=14 | hidden=[1024, 256] epochs=141 lr=2.715e-04 wd=3.976e-08 n_pcs=4500 weight={'name': 'uniform'}
[I 2026-06-01 15:52:11,515] Trial 143 finished with value: 0.19875000548875726 and parameters: {'hidden_dims': '[1024, 256]', 'dropout': 0.18449334742554752, 'batch_norm': False, 'lr': 0.00027154518302476997, 'weight_decay': 3.9761428097782217e-08, 'epochs': 141, 'loss': 'mae', 'optimizer': 'adam', 'use_snp_selection': False, 'n_pcs': 4500}. Best is trial 103 with value: 0.20818817647636187.
2026-06-01 15:52:11 | INFO | Trial 144 | outer=14 | hidden=[1024, 256] epochs=146 lr=1.181e-04 wd=1.021e-07 n_pcs=5000 weight={'name': 'uniform'}
[I 2026-06-01 15:52:27,101] Trial 144 finished with value: 0.17019829403961684 and parameters: {'hidden_dims': '[1024, 256]', 'dropout': 0.19872705846699829, 'batch_norm': False, 'lr': 0.00011808953698536983, 'weight_decay': 1.0205796421809152e-07, 'epochs': 146, 'loss': 'mae', 'optimizer': 'adam', 'use_snp_selection': False, 'n_pcs': 5000}. Best is trial 103 with value: 0.20818817647636187.
2026-06-01 15:52:27 | INFO | Trial 145 | outer=14 | hidden=[1024, 256] epochs=134 lr=1.912e-04 wd=1.387e-08 n_pcs=4500 weight={'name': 'uniform'}
[I 2026-06-01 15:52:40,773] Trial 145 finished with value: 0.2064171389964989 and parameters: {'hidden_dims': '[1024, 256]', 'dropout': 0.22601261539039497, 'batch_norm': False, 'lr': 0.00019116786576250792, 'weight_decay': 1.3867189519307956e-08, 'epochs': 134, 'loss': 'mae', 'optimizer': 'adam', 'use_snp_selection': False, 'n_pcs': 4500}. Best is trial 103 with value: 0.20818817647636187.
2026-06-01 15:52:40 | INFO | Trial 146 | outer=14 | hidden=[256, 64] epochs=136 lr=1.845e-04 wd=1.302e-08 n_pcs=4500 weight={'name': 'uniform'}
[I 2026-06-01 15:52:46,018] Trial 146 finished with value: 0.18637246286228862 and parameters: {'hidden_dims': '[256, 64]', 'dropout': 0.2445311899530937, 'batch_norm': False, 'lr': 0.00018445743186224425, 'weight_decay': 1.3024614850755834e-08, 'epochs': 136, 'loss': 'mae', 'optimizer': 'adam', 'use_snp_selection': False, 'n_pcs': 4500}. Best is trial 103 with value: 0.20818817647636187.
2026-06-01 15:52:46 | INFO | Trial 147 | outer=14 | hidden=[1024, 256] epochs=79 lr=1.606e-04 wd=1.599e-08 n_pcs=4500 weight={'name': 'uniform'}
[I 2026-06-01 15:52:55,081] Trial 147 finished with value: 0.19585509976795723 and parameters: {'hidden_dims': '[1024, 256]', 'dropout': 0.22392464013306662, 'batch_norm': False, 'lr': 0.00016055655712768203, 'weight_decay': 1.598570312326315e-08, 'epochs': 79, 'loss': 'mae', 'optimizer': 'adam', 'use_snp_selection': False, 'n_pcs': 4500}. Best is trial 103 with value: 0.20818817647636187.
2026-06-01 15:52:55 | INFO | Trial 148 | outer=14 | hidden=[512, 256] epochs=125 lr=2.180e-04 wd=1.994e-08 n_pcs=4000 weight={'name': 'uniform'}
[I 2026-06-01 15:53:02,292] Trial 148 finished with value: 0.21158263311162787 and parameters: {'hidden_dims': '[512, 256]', 'dropout': 0.23747930932730807, 'batch_norm': False, 'lr': 0.00021800870078582494, 'weight_decay': 1.994112965186501e-08, 'epochs': 125, 'loss': 'mse', 'optimizer': 'adamw', 'use_snp_selection': False, 'n_pcs': 4000}. Best is trial 148 with value: 0.21158263311162787.
2026-06-01 15:53:02 | INFO | Trial 149 | outer=14 | hidden=[512, 256] epochs=112 lr=2.114e-04 wd=1.868e-08 n_pcs=4000 weight={'name': 'uniform'}
[I 2026-06-01 15:53:06,340] Trial 149 pruned. 
2026-06-01 15:53:06 | INFO | OUTER 14 best (inner mean r=0.2116): model={'hidden_dims': [512, 256], 'dropout': 0.23747930932730807, 'batch_norm': False, 'lr': 0.00021800870078582494, 'weight_decay': 1.994112965186501e-08, 'epochs': 125, 'loss': 'mse', 'optimizer': 'adamw', 'use_snp_selection': False, 'n_pcs': 4000} weighting={'name': 'uniform'}
2026-06-01 15:53:06 | INFO | OUTER 14 TEST r = 0.0619
2026-06-01 15:53:07 | INFO | OUTER 14 incremental summary saved to outputs/final_results/e8_pc_mlp_uniform/thr_wing/e8_pc_mlp_uniform_thr_wing_results.json
2026-06-01 15:53:07 | INFO | OUTER 15: test_size=688 island=14 (Lauvøya)
2026-06-01 15:53:07 | INFO | OUTER 15: inner LOIO validation islands: 0(Nesøy), 1(Myken), 2(Træna), 3(Selvær), 4(Gjerøy), 5(Hestmannøy), 6(Indre Kvarøy), 7(Onøy og Lurøy), 8(Lovund), 9(Sleneset), 10(Aldra), 11(Leka), 12(Vega), 13(Vikna)
2026-06-01 15:53:07 | INFO | OUTER 15: using top 10 related inner validation islands for tuning: 13(Vikna, avgGRM=0.0105), 11(Leka, avgGRM=0.0077), 12(Vega, avgGRM=0.0007), 8(Lovund, avgGRM=-0.0074), 2(Træna, avgGRM=-0.0077), 3(Selvær, avgGRM=-0.0080), 9(Sleneset, avgGRM=-0.0086), 0(Nesøy, avgGRM=-0.0099), 7(Onøy og Lurøy, avgGRM=-0.0099), 1(Myken, avgGRM=-0.0102)
[I 2026-06-01 15:53:07,467] A new study created in memory with name: mlp_importance_inner_outer14
2026-06-01 15:53:07 | INFO | Trial 0 | outer=15 | hidden=[256, 64] epochs=252 lr=8.243e-05 wd=1.277e-07 n_pcs=1500 weight={'name': 'uniform'}
[I 2026-06-01 15:53:12,294] Trial 0 finished with value: 0.19649774530248504 and parameters: {'hidden_dims': '[256, 64]', 'dropout': 0.19097065492325918, 'batch_norm': False, 'lr': 8.242985198911028e-05, 'weight_decay': 1.277246473139888e-07, 'epochs': 252, 'loss': 'mae', 'optimizer': 'adamw', 'use_snp_selection': False, 'n_pcs': 1500}. Best is trial 0 with value: 0.19649774530248504.
2026-06-01 15:53:12 | INFO | Trial 1 | outer=15 | hidden=[1024, 256] epochs=225 lr=1.391e-04 wd=1.941e-07 n_pcs=500 weight={'name': 'uniform'}
[I 2026-06-01 15:53:18,802] Trial 1 finished with value: 0.15844829326931537 and parameters: {'hidden_dims': '[1024, 256]', 'dropout': 0.2849434595702811, 'batch_norm': False, 'lr': 0.00013909108684683413, 'weight_decay': 1.9407167964924495e-07, 'epochs': 225, 'loss': 'mse', 'optimizer': 'adamw', 'use_snp_selection': False, 'n_pcs': 500}. Best is trial 0 with value: 0.19649774530248504.
2026-06-01 15:53:18 | INFO | Trial 2 | outer=15 | hidden=[256, 64] epochs=139 lr=3.957e-05 wd=3.750e-05 n_pcs=2500 weight={'name': 'uniform'}
[I 2026-06-01 15:53:22,526] Trial 2 finished with value: 0.17737363115695365 and parameters: {'hidden_dims': '[256, 64]', 'dropout': 0.11392712587675291, 'batch_norm': False, 'lr': 3.9573351157697276e-05, 'weight_decay': 3.7502337000845044e-05, 'epochs': 139, 'loss': 'mae', 'optimizer': 'adam', 'use_snp_selection': False, 'n_pcs': 2500}. Best is trial 0 with value: 0.19649774530248504.
2026-06-01 15:53:22 | INFO | Trial 3 | outer=15 | hidden=[128, 64] epochs=164 lr=1.538e-05 wd=3.248e-06 n_pcs=3000 weight={'name': 'uniform'}
[I 2026-06-01 15:53:26,248] Trial 3 finished with value: 0.08818072381772732 and parameters: {'hidden_dims': '[128, 64]', 'dropout': 0.1479874991503876, 'batch_norm': False, 'lr': 1.5380732370316375e-05, 'weight_decay': 3.2478890969962294e-06, 'epochs': 164, 'loss': 'mse', 'optimizer': 'adam', 'use_snp_selection': False, 'n_pcs': 3000}. Best is trial 0 with value: 0.19649774530248504.
2026-06-01 15:53:26 | INFO | Trial 4 | outer=15 | hidden=[256, 128] epochs=210 lr=7.298e-05 wd=7.875e-06 n_pcs=3000 weight={'name': 'uniform'}
[I 2026-06-01 15:53:31,600] Trial 4 finished with value: 0.15327453435913782 and parameters: {'hidden_dims': '[256, 128]', 'dropout': 0.09917626474860408, 'batch_norm': False, 'lr': 7.298380589156323e-05, 'weight_decay': 7.875094299510188e-06, 'epochs': 210, 'loss': 'mae', 'optimizer': 'adam', 'use_snp_selection': False, 'n_pcs': 3000}. Best is trial 0 with value: 0.19649774530248504.
2026-06-01 15:53:31 | INFO | Trial 5 | outer=15 | hidden=[512, 128] epochs=284 lr=5.467e-05 wd=5.496e-06 n_pcs=4000 weight={'name': 'uniform'}
[I 2026-06-01 15:53:44,573] Trial 5 finished with value: 0.17475377914437684 and parameters: {'hidden_dims': '[512, 128]', 'dropout': 0.3143696126156032, 'batch_norm': False, 'lr': 5.46667545989349e-05, 'weight_decay': 5.496446859789657e-06, 'epochs': 284, 'loss': 'mse', 'optimizer': 'adamw', 'use_snp_selection': False, 'n_pcs': 4000}. Best is trial 0 with value: 0.19649774530248504.
2026-06-01 15:53:44 | INFO | Trial 6 | outer=15 | hidden=[512, 64] epochs=90 lr=3.103e-05 wd=6.607e-08 n_pcs=5000 weight={'name': 'uniform'}
[I 2026-06-01 15:53:48,300] Trial 6 pruned. 
2026-06-01 15:53:48 | INFO | Trial 7 | outer=15 | hidden=[128, 64] epochs=272 lr=1.348e-05 wd=1.075e-07 n_pcs=4000 weight={'name': 'uniform'}
[I 2026-06-01 15:53:53,604] Trial 7 finished with value: 0.10265213797903132 and parameters: {'hidden_dims': '[128, 64]', 'dropout': 0.43850529998545856, 'batch_norm': False, 'lr': 1.3475345125648628e-05, 'weight_decay': 1.0749576404800894e-07, 'epochs': 272, 'loss': 'mse', 'optimizer': 'adamw', 'use_snp_selection': False, 'n_pcs': 4000}. Best is trial 0 with value: 0.19649774530248504.
2026-06-01 15:53:53 | INFO | Trial 8 | outer=15 | hidden=[128, 64] epochs=205 lr=1.815e-05 wd=5.764e-06 n_pcs=3000 weight={'name': 'uniform'}
[I 2026-06-01 15:53:56,120] Trial 8 pruned. 
2026-06-01 15:53:56 | INFO | Trial 9 | outer=15 | hidden=[128, 64] epochs=296 lr=2.338e-05 wd=1.066e-07 n_pcs=2500 weight={'name': 'uniform'}
[I 2026-06-01 15:54:01,660] Trial 9 finished with value: 0.14906062089593008 and parameters: {'hidden_dims': '[128, 64]', 'dropout': 0.17607378181405245, 'batch_norm': False, 'lr': 2.3379083621874488e-05, 'weight_decay': 1.0663581123617794e-07, 'epochs': 296, 'loss': 'mae', 'optimizer': 'adam', 'use_snp_selection': False, 'n_pcs': 2500}. Best is trial 0 with value: 0.19649774530248504.
2026-06-01 15:54:01 | INFO | Trial 10 | outer=15 | hidden=[512, 256] epochs=242 lr=3.984e-04 wd=9.453e-04 n_pcs=500 weight={'name': 'uniform'}
