[I 2026-06-01 15:39:05,253] Trial 71 finished with value: 0.19477297393997633 and parameters: {'hidden_dims': '[512, 256]', 'dropout': 0.24428958192338202, 'batch_norm': False, 'lr': 0.0002454685067021234, 'weight_decay': 9.010319502314158e-08, 'epochs': 179, 'loss': 'mae', 'optimizer': 'adam', 'use_snp_selection': False, 'n_pcs': 5000}. Best is trial 32 with value: 0.20516065035920028.
2026-06-01 15:39:05 | INFO | Trial 72 | outer=14 | hidden=[128, 64] epochs=195 lr=2.845e-04 wd=6.817e-08 n_pcs=5000 weight={'name': 'uniform'}
[I 2026-06-01 15:39:10,100] Trial 72 finished with value: 0.19566409505744503 and parameters: {'hidden_dims': '[128, 64]', 'dropout': 0.2699838187900785, 'batch_norm': False, 'lr': 0.00028452706930050183, 'weight_decay': 6.816963523998e-08, 'epochs': 195, 'loss': 'mae', 'optimizer': 'adam', 'use_snp_selection': False, 'n_pcs': 5000}. Best is trial 32 with value: 0.20516065035920028.
2026-06-01 15:39:10 | INFO | Trial 73 | outer=14 | hidden=[128, 64] epochs=169 lr=2.264e-05 wd=1.493e-08 n_pcs=4500 weight={'name': 'uniform'}
[I 2026-06-01 15:39:12,724] Trial 73 pruned. 
2026-06-01 15:39:12 | INFO | Trial 74 | outer=14 | hidden=[128, 64] epochs=103 lr=2.409e-04 wd=1.908e-07 n_pcs=5000 weight={'name': 'uniform'}
[I 2026-06-01 15:39:14,897] Trial 74 pruned. 
2026-06-01 15:39:14 | INFO | Trial 75 | outer=14 | hidden=[128, 64] epochs=61 lr=3.615e-04 wd=2.273e-08 n_pcs=4500 weight={'name': 'uniform'}
[I 2026-06-01 15:39:16,665] Trial 75 pruned. 
2026-06-01 15:39:16 | INFO | Trial 76 | outer=14 | hidden=[1024, 256] epochs=160 lr=3.026e-04 wd=2.964e-07 n_pcs=5000 weight={'name': 'uniform'}
[I 2026-06-01 15:39:33,476] Trial 76 finished with value: 0.19289160072945213 and parameters: {'hidden_dims': '[1024, 256]', 'dropout': 0.1697594448019154, 'batch_norm': False, 'lr': 0.0003025542067035833, 'weight_decay': 2.963762816119946e-07, 'epochs': 160, 'loss': 'mse', 'optimizer': 'adamw', 'use_snp_selection': False, 'n_pcs': 5000}. Best is trial 32 with value: 0.20516065035920028.
2026-06-01 15:39:33 | INFO | Trial 77 | outer=14 | hidden=[128, 64] epochs=145 lr=1.967e-04 wd=4.554e-07 n_pcs=4500 weight={'name': 'uniform'}
[I 2026-06-01 15:39:37,487] Trial 77 finished with value: 0.18471441121964252 and parameters: {'hidden_dims': '[128, 64]', 'dropout': 0.32246254774706856, 'batch_norm': False, 'lr': 0.00019670139945671803, 'weight_decay': 4.553833426541463e-07, 'epochs': 145, 'loss': 'mae', 'optimizer': 'adam', 'use_snp_selection': False, 'n_pcs': 4500}. Best is trial 32 with value: 0.20516065035920028.
2026-06-01 15:39:37 | INFO | Trial 78 | outer=14 | hidden=[1024, 256] epochs=203 lr=4.719e-04 wd=1.097e-07 n_pcs=5000 weight={'name': 'uniform'}
[I 2026-06-01 15:39:58,093] Trial 78 finished with value: 0.1966941961105187 and parameters: {'hidden_dims': '[1024, 256]', 'dropout': 0.581874707714034, 'batch_norm': False, 'lr': 0.00047187513669056427, 'weight_decay': 1.097194753925237e-07, 'epochs': 203, 'loss': 'mse', 'optimizer': 'adamw', 'use_snp_selection': False, 'n_pcs': 5000}. Best is trial 32 with value: 0.20516065035920028.
2026-06-01 15:39:58 | INFO | Trial 79 | outer=14 | hidden=[512, 128] epochs=185 lr=1.054e-04 wd=4.373e-08 n_pcs=4000 weight={'name': 'uniform'}
[I 2026-06-01 15:40:07,308] Trial 79 finished with value: 0.19094316723361798 and parameters: {'hidden_dims': '[512, 128]', 'dropout': 0.37432075174491436, 'batch_norm': False, 'lr': 0.00010535881754228976, 'weight_decay': 4.3730890191867264e-08, 'epochs': 185, 'loss': 'mae', 'optimizer': 'adam', 'use_snp_selection': False, 'n_pcs': 4000}. Best is trial 32 with value: 0.20516065035920028.
2026-06-01 15:40:07 | INFO | Trial 80 | outer=14 | hidden=[1024, 256] epochs=177 lr=3.974e-04 wd=1.071e-08 n_pcs=4000 weight={'name': 'uniform'}
[I 2026-06-01 15:40:22,825] Trial 80 finished with value: 0.18968796839481583 and parameters: {'hidden_dims': '[1024, 256]', 'dropout': 0.19610323795428777, 'batch_norm': False, 'lr': 0.00039744985811313634, 'weight_decay': 1.070838572654658e-08, 'epochs': 177, 'loss': 'mse', 'optimizer': 'adamw', 'use_snp_selection': False, 'n_pcs': 4000}. Best is trial 32 with value: 0.20516065035920028.
2026-06-01 15:40:22 | INFO | Trial 81 | outer=14 | hidden=[512, 256] epochs=75 lr=3.496e-04 wd=1.452e-08 n_pcs=4500 weight={'name': 'uniform'}
[I 2026-06-01 15:40:28,390] Trial 81 finished with value: 0.1823851047882926 and parameters: {'hidden_dims': '[512, 256]', 'dropout': 0.5428877916593883, 'batch_norm': False, 'lr': 0.0003495789467610843, 'weight_decay': 1.4523020081312273e-08, 'epochs': 75, 'loss': 'mse', 'optimizer': 'adamw', 'use_snp_selection': False, 'n_pcs': 4500}. Best is trial 32 with value: 0.20516065035920028.
2026-06-01 15:40:28 | INFO | Trial 82 | outer=14 | hidden=[512, 256] epochs=56 lr=4.289e-04 wd=2.805e-08 n_pcs=3000 weight={'name': 'uniform'}
[I 2026-06-01 15:40:30,691] Trial 82 pruned. 
2026-06-01 15:40:30 | INFO | Trial 83 | outer=14 | hidden=[512, 256] epochs=60 lr=2.829e-04 wd=1.299e-08 n_pcs=5000 weight={'name': 'uniform'}
[I 2026-06-01 15:40:35,794] Trial 83 finished with value: 0.18349555893147493 and parameters: {'hidden_dims': '[512, 256]', 'dropout': 0.5164012027508756, 'batch_norm': False, 'lr': 0.00028288160940023114, 'weight_decay': 1.2994668568660004e-08, 'epochs': 60, 'loss': 'mse', 'optimizer': 'adamw', 'use_snp_selection': False, 'n_pcs': 5000}. Best is trial 32 with value: 0.20516065035920028.
2026-06-01 15:40:35 | INFO | Trial 84 | outer=14 | hidden=[512, 256] epochs=55 lr=3.315e-04 wd=2.007e-08 n_pcs=4500 weight={'name': 'uniform'}
[I 2026-06-01 15:40:40,466] Trial 84 finished with value: 0.17906172562180023 and parameters: {'hidden_dims': '[512, 256]', 'dropout': 0.4704263619696803, 'batch_norm': False, 'lr': 0.0003315036859300402, 'weight_decay': 2.007009953952831e-08, 'epochs': 55, 'loss': 'mse', 'optimizer': 'adamw', 'use_snp_selection': False, 'n_pcs': 4500}. Best is trial 32 with value: 0.20516065035920028.
2026-06-01 15:40:40 | INFO | Trial 85 | outer=14 | hidden=[256, 64] epochs=168 lr=4.894e-04 wd=5.738e-08 n_pcs=5000 weight={'name': 'uniform'}
[I 2026-06-01 15:40:46,677] Trial 85 finished with value: 0.1897259687480268 and parameters: {'hidden_dims': '[256, 64]', 'dropout': 0.2529540549050919, 'batch_norm': False, 'lr': 0.0004893774574780832, 'weight_decay': 5.7375159749553686e-08, 'epochs': 168, 'loss': 'mse', 'optimizer': 'adamw', 'use_snp_selection': False, 'n_pcs': 5000}. Best is trial 32 with value: 0.20516065035920028.
2026-06-01 15:40:46 | INFO | Trial 86 | outer=14 | hidden=[1024, 256] epochs=281 lr=2.342e-04 wd=3.344e-08 n_pcs=4500 weight={'name': 'uniform'}
[I 2026-06-01 15:41:12,662] Trial 86 finished with value: 0.19630021307818624 and parameters: {'hidden_dims': '[1024, 256]', 'dropout': 0.4251269485231354, 'batch_norm': False, 'lr': 0.00023423133061702071, 'weight_decay': 3.3435769241951366e-08, 'epochs': 281, 'loss': 'mae', 'optimizer': 'adam', 'use_snp_selection': False, 'n_pcs': 4500}. Best is trial 32 with value: 0.20516065035920028.
2026-06-01 15:41:12 | INFO | Trial 87 | outer=14 | hidden=[256, 128] epochs=86 lr=1.416e-04 wd=1.204e-08 n_pcs=500 weight={'name': 'uniform'}
[I 2026-06-01 15:41:14,190] Trial 87 pruned. 
2026-06-01 15:41:14 | INFO | Trial 88 | outer=14 | hidden=[512, 256] epochs=64 lr=3.820e-04 wd=8.259e-06 n_pcs=1000 weight={'name': 'uniform'}
[I 2026-06-01 15:41:16,859] Trial 88 finished with value: 0.19257359013593012 and parameters: {'hidden_dims': '[512, 256]', 'dropout': 0.28106362521045936, 'batch_norm': False, 'lr': 0.0003819758430040529, 'weight_decay': 8.258818178453937e-06, 'epochs': 64, 'loss': 'mae', 'optimizer': 'adam', 'use_snp_selection': False, 'n_pcs': 1000}. Best is trial 32 with value: 0.20516065035920028.
2026-06-01 15:41:16 | INFO | Trial 89 | outer=14 | hidden=[1024, 256] epochs=51 lr=2.669e-04 wd=1.001e-08 n_pcs=5000 weight={'name': 'uniform'}
[I 2026-06-01 15:41:21,148] Trial 89 pruned. 
2026-06-01 15:41:21 | INFO | Trial 90 | outer=14 | hidden=[512, 64] epochs=150 lr=4.409e-04 wd=1.964e-08 n_pcs=4500 weight={'name': 'uniform'}
[I 2026-06-01 15:41:29,593] Trial 90 finished with value: 0.19564317509754353 and parameters: {'hidden_dims': '[512, 64]', 'dropout': 0.18324662699442676, 'batch_norm': False, 'lr': 0.00044090234707261545, 'weight_decay': 1.964378169850961e-08, 'epochs': 150, 'loss': 'mae', 'optimizer': 'adam', 'use_snp_selection': False, 'n_pcs': 4500}. Best is trial 32 with value: 0.20516065035920028.
2026-06-01 15:41:29 | INFO | Trial 91 | outer=14 | hidden=[1024, 256] epochs=133 lr=1.716e-04 wd=1.844e-08 n_pcs=4500 weight={'name': 'uniform'}
[I 2026-06-01 15:41:43,170] Trial 91 finished with value: 0.18953299459868558 and parameters: {'hidden_dims': '[1024, 256]', 'dropout': 0.25514926110326885, 'batch_norm': False, 'lr': 0.00017164685713464043, 'weight_decay': 1.844450923971083e-08, 'epochs': 133, 'loss': 'mae', 'optimizer': 'adam', 'use_snp_selection': False, 'n_pcs': 4500}. Best is trial 32 with value: 0.20516065035920028.
2026-06-01 15:41:43 | INFO | Trial 92 | outer=14 | hidden=[1024, 256] epochs=132 lr=2.090e-04 wd=2.495e-08 n_pcs=4500 weight={'name': 'uniform'}
[I 2026-06-01 15:41:56,657] Trial 92 finished with value: 0.19097125155429134 and parameters: {'hidden_dims': '[1024, 256]', 'dropout': 0.23555032077397695, 'batch_norm': False, 'lr': 0.00020897502574096592, 'weight_decay': 2.4950981531824496e-08, 'epochs': 132, 'loss': 'mae', 'optimizer': 'adam', 'use_snp_selection': False, 'n_pcs': 4500}. Best is trial 32 with value: 0.20516065035920028.
2026-06-01 15:41:56 | INFO | Trial 93 | outer=14 | hidden=[1024, 256] epochs=156 lr=1.556e-04 wd=1.052e-08 n_pcs=4000 weight={'name': 'uniform'}
[I 2026-06-01 15:42:10,649] Trial 93 finished with value: 0.19909955885577432 and parameters: {'hidden_dims': '[1024, 256]', 'dropout': 0.20402826186261216, 'batch_norm': False, 'lr': 0.0001556097597166185, 'weight_decay': 1.0522327414553462e-08, 'epochs': 156, 'loss': 'mae', 'optimizer': 'adam', 'use_snp_selection': False, 'n_pcs': 4000}. Best is trial 32 with value: 0.20516065035920028.
2026-06-01 15:42:10 | INFO | Trial 94 | outer=14 | hidden=[1024, 256] epochs=156 lr=1.334e-04 wd=4.014e-08 n_pcs=3500 weight={'name': 'uniform'}
[I 2026-06-01 15:42:23,516] Trial 94 finished with value: 0.20275551842318285 and parameters: {'hidden_dims': '[1024, 256]', 'dropout': 0.5532690442969753, 'batch_norm': False, 'lr': 0.00013339397147417976, 'weight_decay': 4.0140545539215866e-08, 'epochs': 156, 'loss': 'mae', 'optimizer': 'adam', 'use_snp_selection': False, 'n_pcs': 3500}. Best is trial 32 with value: 0.20516065035920028.
2026-06-01 15:42:23 | INFO | Trial 95 | outer=14 | hidden=[1024, 256] epochs=166 lr=2.986e-04 wd=8.862e-08 n_pcs=4000 weight={'name': 'uniform'}
[I 2026-06-01 15:42:38,271] Trial 95 finished with value: 0.19721600551380516 and parameters: {'hidden_dims': '[1024, 256]', 'dropout': 0.5518618233324984, 'batch_norm': False, 'lr': 0.00029856285330284726, 'weight_decay': 8.86247835353451e-08, 'epochs': 166, 'loss': 'mae', 'optimizer': 'adam', 'use_snp_selection': False, 'n_pcs': 4000}. Best is trial 32 with value: 0.20516065035920028.
2026-06-01 15:42:38 | INFO | Trial 96 | outer=14 | hidden=[256, 64] epochs=139 lr=1.276e-04 wd=4.149e-08 n_pcs=3500 weight={'name': 'uniform'}
[I 2026-06-01 15:42:41,036] Trial 96 pruned. 
2026-06-01 15:42:41 | INFO | Trial 97 | outer=14 | hidden=[512, 256] epochs=69 lr=2.239e-04 wd=5.400e-08 n_pcs=3500 weight={'name': 'uniform'}
[I 2026-06-01 15:42:45,612] Trial 97 finished with value: 0.18244567440611065 and parameters: {'hidden_dims': '[512, 256]', 'dropout': 0.5242623746704603, 'batch_norm': False, 'lr': 0.00022391262307307924, 'weight_decay': 5.400389773758556e-08, 'epochs': 69, 'loss': 'mae', 'optimizer': 'adam', 'use_snp_selection': False, 'n_pcs': 3500}. Best is trial 32 with value: 0.20516065035920028.
2026-06-01 15:42:45 | INFO | Trial 98 | outer=14 | hidden=[128, 64] epochs=93 lr=6.077e-05 wd=1.451e-07 n_pcs=2500 weight={'name': 'uniform'}
[I 2026-06-01 15:42:47,444] Trial 98 pruned. 
2026-06-01 15:42:47 | INFO | Trial 99 | outer=14 | hidden=[1024, 256] epochs=160 lr=2.559e-04 wd=3.016e-08 n_pcs=3000 weight={'name': 'uniform'}
[I 2026-06-01 15:42:59,152] Trial 99 finished with value: 0.1821531158356531 and parameters: {'hidden_dims': '[1024, 256]', 'dropout': 0.22646311594273588, 'batch_norm': False, 'lr': 0.0002559414808860464, 'weight_decay': 3.015712503718317e-08, 'epochs': 160, 'loss': 'mae', 'optimizer': 'adam', 'use_snp_selection': False, 'n_pcs': 3000}. Best is trial 32 with value: 0.20516065035920028.
2026-06-01 15:42:59 | INFO | Trial 100 | outer=14 | hidden=[512, 256] epochs=192 lr=3.383e-04 wd=6.507e-08 n_pcs=5000 weight={'name': 'uniform'}
[I 2026-06-01 15:43:10,427] Trial 100 finished with value: 0.19462232653704428 and parameters: {'hidden_dims': '[512, 256]', 'dropout': 0.5673974094470505, 'batch_norm': False, 'lr': 0.0003382985507950983, 'weight_decay': 6.506542308664482e-08, 'epochs': 192, 'loss': 'mae', 'optimizer': 'adam', 'use_snp_selection': False, 'n_pcs': 5000}. Best is trial 32 with value: 0.20516065035920028.
2026-06-01 15:43:10 | INFO | Trial 101 | outer=14 | hidden=[1024, 256] epochs=156 lr=1.559e-04 wd=1.282e-08 n_pcs=4000 weight={'name': 'uniform'}
[I 2026-06-01 15:43:24,422] Trial 101 finished with value: 0.19265423336648574 and parameters: {'hidden_dims': '[1024, 256]', 'dropout': 0.20905963288898594, 'batch_norm': False, 'lr': 0.0001559399923295479, 'weight_decay': 1.2819103334876546e-08, 'epochs': 156, 'loss': 'mae', 'optimizer': 'adam', 'use_snp_selection': False, 'n_pcs': 4000}. Best is trial 32 with value: 0.20516065035920028.
2026-06-01 15:43:24 | INFO | Trial 102 | outer=14 | hidden=[1024, 256] epochs=149 lr=1.102e-04 wd=1.679e-08 n_pcs=3500 weight={'name': 'uniform'}
[I 2026-06-01 15:43:36,797] Trial 102 finished with value: 0.19653731502824864 and parameters: {'hidden_dims': '[1024, 256]', 'dropout': 0.15623290316884045, 'batch_norm': False, 'lr': 0.00011022481309636321, 'weight_decay': 1.679090872321724e-08, 'epochs': 149, 'loss': 'mae', 'optimizer': 'adam', 'use_snp_selection': False, 'n_pcs': 3500}. Best is trial 32 with value: 0.20516065035920028.
2026-06-01 15:43:36 | INFO | Trial 103 | outer=14 | hidden=[1024, 256] epochs=141 lr=1.931e-04 wd=2.272e-08 n_pcs=4000 weight={'name': 'uniform'}
[I 2026-06-01 15:43:49,646] Trial 103 finished with value: 0.20818817647636187 and parameters: {'hidden_dims': '[1024, 256]', 'dropout': 0.2018515925591926, 'batch_norm': False, 'lr': 0.0001931470219172281, 'weight_decay': 2.2721245911051864e-08, 'epochs': 141, 'loss': 'mae', 'optimizer': 'adam', 'use_snp_selection': False, 'n_pcs': 4000}. Best is trial 103 with value: 0.20818817647636187.
2026-06-01 15:43:49 | INFO | Trial 104 | outer=14 | hidden=[1024, 256] epochs=117 lr=1.885e-04 wd=3.742e-08 n_pcs=4000 weight={'name': 'uniform'}
[I 2026-06-01 15:44:00,697] Trial 104 finished with value: 0.18413369680170227 and parameters: {'hidden_dims': '[1024, 256]', 'dropout': 0.542994956779816, 'batch_norm': False, 'lr': 0.0001884533836497402, 'weight_decay': 3.74243856216525e-08, 'epochs': 117, 'loss': 'mae', 'optimizer': 'adam', 'use_snp_selection': False, 'n_pcs': 4000}. Best is trial 103 with value: 0.20818817647636187.
2026-06-01 15:44:00 | INFO | Trial 105 | outer=14 | hidden=[1024, 256] epochs=174 lr=1.739e-04 wd=2.422e-08 n_pcs=4500 weight={'name': 'uniform'}
[I 2026-06-01 15:44:17,693] Trial 105 finished with value: 0.20432457869924883 and parameters: {'hidden_dims': '[1024, 256]', 'dropout': 0.18145956348182868, 'batch_norm': False, 'lr': 0.00017390560891697302, 'weight_decay': 2.4220450461334108e-08, 'epochs': 174, 'loss': 'mae', 'optimizer': 'adam', 'use_snp_selection': False, 'n_pcs': 4500}. Best is trial 103 with value: 0.20818817647636187.
2026-06-01 15:44:17 | INFO | Trial 106 | outer=14 | hidden=[1024, 256] epochs=141 lr=1.727e-04 wd=2.368e-08 n_pcs=4500 weight={'name': 'uniform'}
[I 2026-06-01 15:44:31,907] Trial 106 finished with value: 0.20648492527438922 and parameters: {'hidden_dims': '[1024, 256]', 'dropout': 0.18538507546274122, 'batch_norm': False, 'lr': 0.00017266886020523924, 'weight_decay': 2.3677548064188835e-08, 'epochs': 141, 'loss': 'mae', 'optimizer': 'adam', 'use_snp_selection': False, 'n_pcs': 4500}. Best is trial 103 with value: 0.20818817647636187.
2026-06-01 15:44:31 | INFO | Trial 107 | outer=14 | hidden=[1024, 256] epochs=141 lr=1.376e-04 wd=2.135e-08 n_pcs=4500 weight={'name': 'uniform'}
[I 2026-06-01 15:44:46,135] Trial 107 finished with value: 0.17853925735913706 and parameters: {'hidden_dims': '[1024, 256]', 'dropout': 0.1844367437513292, 'batch_norm': False, 'lr': 0.00013761196543164378, 'weight_decay': 2.1345854269250517e-08, 'epochs': 141, 'loss': 'mae', 'optimizer': 'adam', 'use_snp_selection': False, 'n_pcs': 4500}. Best is trial 103 with value: 0.20818817647636187.
2026-06-01 15:44:46 | INFO | Trial 108 | outer=14 | hidden=[1024, 256] epochs=127 lr=1.753e-04 wd=2.881e-08 n_pcs=4000 weight={'name': 'uniform'}
[I 2026-06-01 15:44:57,934] Trial 108 finished with value: 0.18893861005527576 and parameters: {'hidden_dims': '[1024, 256]', 'dropout': 0.13141746675673288, 'batch_norm': False, 'lr': 0.00017531799145366632, 'weight_decay': 2.8812228468003173e-08, 'epochs': 127, 'loss': 'mae', 'optimizer': 'adam', 'use_snp_selection': False, 'n_pcs': 4000}. Best is trial 103 with value: 0.20818817647636187.
2026-06-01 15:44:57 | INFO | Trial 109 | outer=14 | hidden=[1024, 256] epochs=164 lr=8.606e-05 wd=4.814e-08 n_pcs=4500 weight={'name': 'uniform'}
[I 2026-06-01 15:45:14,117] Trial 109 finished with value: 0.20045117068620644 and parameters: {'hidden_dims': '[1024, 256]', 'dropout': 0.17420157680396822, 'batch_norm': False, 'lr': 8.605915142722812e-05, 'weight_decay': 4.813973639039358e-08, 'epochs': 164, 'loss': 'mae', 'optimizer': 'adam', 'use_snp_selection': False, 'n_pcs': 4500}. Best is trial 103 with value: 0.20818817647636187.
2026-06-01 15:45:14 | INFO | Trial 110 | outer=14 | hidden=[1024, 256] epochs=174 lr=1.125e-04 wd=2.436e-08 n_pcs=4500 weight={'name': 'uniform'}
[I 2026-06-01 15:45:31,150] Trial 110 finished with value: 0.1847689660521339 and parameters: {'hidden_dims': '[1024, 256]', 'dropout': 0.1062463658215668, 'batch_norm': False, 'lr': 0.00011254238561635606, 'weight_decay': 2.4359859059123713e-08, 'epochs': 174, 'loss': 'mae', 'optimizer': 'adam', 'use_snp_selection': False, 'n_pcs': 4500}. Best is trial 103 with value: 0.20818817647636187.
2026-06-01 15:45:31 | INFO | Trial 111 | outer=14 | hidden=[1024, 256] epochs=148 lr=8.901e-05 wd=1.689e-08 n_pcs=4500 weight={'name': 'uniform'}
[I 2026-06-01 15:45:45,985] Trial 111 finished with value: 0.20184345496681586 and parameters: {'hidden_dims': '[1024, 256]', 'dropout': 0.16419048905564, 'batch_norm': False, 'lr': 8.901123344433963e-05, 'weight_decay': 1.689348520587571e-08, 'epochs': 148, 'loss': 'mae', 'optimizer': 'adam', 'use_snp_selection': False, 'n_pcs': 4500}. Best is trial 103 with value: 0.20818817647636187.
2026-06-01 15:45:46 | INFO | Trial 112 | outer=14 | hidden=[1024, 256] epochs=163 lr=8.621e-05 wd=1.696e-08 n_pcs=4500 weight={'name': 'uniform'}
[I 2026-06-01 15:46:02,073] Trial 112 finished with value: 0.18766050310144655 and parameters: {'hidden_dims': '[1024, 256]', 'dropout': 0.16384573971952965, 'batch_norm': False, 'lr': 8.620907785491646e-05, 'weight_decay': 1.6963744173852775e-08, 'epochs': 163, 'loss': 'mae', 'optimizer': 'adam', 'use_snp_selection': False, 'n_pcs': 4500}. Best is trial 103 with value: 0.20818817647636187.
2026-06-01 15:46:02 | INFO | Trial 113 | outer=14 | hidden=[1024, 256] epochs=187 lr=8.202e-05 wd=4.585e-08 n_pcs=4000 weight={'name': 'uniform'}
[I 2026-06-01 15:46:18,393] Trial 113 finished with value: 0.183652727474433 and parameters: {'hidden_dims': '[1024, 256]', 'dropout': 0.1376436392753006, 'batch_norm': False, 'lr': 8.201798918509713e-05, 'weight_decay': 4.5854733390341826e-08, 'epochs': 187, 'loss': 'mae', 'optimizer': 'adam', 'use_snp_selection': False, 'n_pcs': 4000}. Best is trial 103 with value: 0.20818817647636187.
2026-06-01 15:46:18 | INFO | Trial 114 | outer=14 | hidden=[1024, 256] epochs=149 lr=6.805e-05 wd=3.472e-08 n_pcs=4500 weight={'name': 'uniform'}
[I 2026-06-01 15:46:27,481] Trial 114 pruned. 
2026-06-01 15:46:27 | INFO | Trial 115 | outer=14 | hidden=[1024, 256] epochs=143 lr=4.190e-05 wd=1.591e-08 n_pcs=4500 weight={'name': 'uniform'}
[I 2026-06-01 15:46:41,909] Trial 115 finished with value: 0.17732440170019875 and parameters: {'hidden_dims': '[1024, 256]', 'dropout': 0.22556638592063344, 'batch_norm': False, 'lr': 4.1897172384406366e-05, 'weight_decay': 1.591472468779164e-08, 'epochs': 143, 'loss': 'mae', 'optimizer': 'adam', 'use_snp_selection': False, 'n_pcs': 4500}. Best is trial 103 with value: 0.20818817647636187.
2026-06-01 15:46:41 | INFO | Trial 116 | outer=14 | hidden=[1024, 256] epochs=175 lr=1.453e-04 wd=2.872e-08 n_pcs=4500 weight={'name': 'uniform'}
[I 2026-06-01 15:46:59,028] Trial 116 finished with value: 0.19676031754359347 and parameters: {'hidden_dims': '[1024, 256]', 'dropout': 0.18682746890300342, 'batch_norm': False, 'lr': 0.0001452876861940987, 'weight_decay': 2.8721788517243292e-08, 'epochs': 175, 'loss': 'mae', 'optimizer': 'adam', 'use_snp_selection': False, 'n_pcs': 4500}. Best is trial 103 with value: 0.20818817647636187.
2026-06-01 15:46:59 | INFO | Trial 117 | outer=14 | hidden=[1024, 256] epochs=169 lr=1.178e-04 wd=2.306e-08 n_pcs=4000 weight={'name': 'uniform'}
