[I 2026-06-01 15:25:21,776] Trial 91 finished with value: 0.20799105535764184 and parameters: {'hidden_dims': '[256, 128]', 'dropout': 0.500296933492624, 'batch_norm': False, 'lr': 0.0002130995427213551, 'weight_decay': 1.618318251770815e-07, 'epochs': 150, 'loss': 'mae', 'optimizer': 'adam', 'use_snp_selection': False, 'n_pcs': 1000}. Best is trial 71 with value: 0.22019119234091403.
2026-06-01 15:25:21 | INFO | Trial 92 | outer=13 | hidden=[256, 128] epochs=172 lr=2.268e-04 wd=2.834e-07 n_pcs=1000 weight={'name': 'uniform'}
[I 2026-06-01 15:25:25,295] Trial 92 finished with value: 0.1912857056882433 and parameters: {'hidden_dims': '[256, 128]', 'dropout': 0.5305293861400231, 'batch_norm': False, 'lr': 0.00022679414986801678, 'weight_decay': 2.834275865712256e-07, 'epochs': 172, 'loss': 'mae', 'optimizer': 'adam', 'use_snp_selection': False, 'n_pcs': 1000}. Best is trial 71 with value: 0.22019119234091403.
2026-06-01 15:25:25 | INFO | Trial 93 | outer=13 | hidden=[256, 128] epochs=161 lr=2.098e-04 wd=6.489e-08 n_pcs=1000 weight={'name': 'uniform'}
[I 2026-06-01 15:25:28,689] Trial 93 finished with value: 0.21329453813554902 and parameters: {'hidden_dims': '[256, 128]', 'dropout': 0.5135675064512457, 'batch_norm': False, 'lr': 0.00020977912209511597, 'weight_decay': 6.488654255428737e-08, 'epochs': 161, 'loss': 'mae', 'optimizer': 'adam', 'use_snp_selection': False, 'n_pcs': 1000}. Best is trial 71 with value: 0.22019119234091403.
2026-06-01 15:25:28 | INFO | Trial 94 | outer=13 | hidden=[256, 128] epochs=157 lr=2.184e-04 wd=5.482e-08 n_pcs=1000 weight={'name': 'uniform'}
[I 2026-06-01 15:25:32,039] Trial 94 finished with value: 0.2167825281294533 and parameters: {'hidden_dims': '[256, 128]', 'dropout': 0.5113180680306082, 'batch_norm': False, 'lr': 0.00021844702480797068, 'weight_decay': 5.481552218116545e-08, 'epochs': 157, 'loss': 'mae', 'optimizer': 'adam', 'use_snp_selection': False, 'n_pcs': 1000}. Best is trial 71 with value: 0.22019119234091403.
2026-06-01 15:25:32 | INFO | Trial 95 | outer=13 | hidden=[256, 128] epochs=158 lr=3.042e-04 wd=4.038e-08 n_pcs=1000 weight={'name': 'uniform'}
[I 2026-06-01 15:25:35,400] Trial 95 finished with value: 0.20921778049355258 and parameters: {'hidden_dims': '[256, 128]', 'dropout': 0.596808741243213, 'batch_norm': False, 'lr': 0.00030416889007937544, 'weight_decay': 4.037695203783388e-08, 'epochs': 158, 'loss': 'mae', 'optimizer': 'adam', 'use_snp_selection': False, 'n_pcs': 1000}. Best is trial 71 with value: 0.22019119234091403.
2026-06-01 15:25:35 | INFO | Trial 96 | outer=13 | hidden=[256, 128] epochs=161 lr=4.014e-04 wd=5.429e-08 n_pcs=1500 weight={'name': 'uniform'}
[I 2026-06-01 15:25:37,547] Trial 96 pruned. 
2026-06-01 15:25:37 | INFO | Trial 97 | outer=13 | hidden=[256, 128] epochs=179 lr=3.179e-04 wd=1.627e-08 n_pcs=500 weight={'name': 'uniform'}
[I 2026-06-01 15:25:41,077] Trial 97 finished with value: 0.17367931874029302 and parameters: {'hidden_dims': '[256, 128]', 'dropout': 0.5960947764996153, 'batch_norm': False, 'lr': 0.000317857927685213, 'weight_decay': 1.6274334713805085e-08, 'epochs': 179, 'loss': 'mae', 'optimizer': 'adam', 'use_snp_selection': False, 'n_pcs': 500}. Best is trial 71 with value: 0.22019119234091403.
2026-06-01 15:25:41 | INFO | Trial 98 | outer=13 | hidden=[256, 128] epochs=185 lr=1.480e-04 wd=3.599e-08 n_pcs=3500 weight={'name': 'uniform'}
[I 2026-06-01 15:25:46,645] Trial 98 finished with value: 0.1882489155873567 and parameters: {'hidden_dims': '[256, 128]', 'dropout': 0.5117749984064522, 'batch_norm': False, 'lr': 0.00014799137576544875, 'weight_decay': 3.599145663898036e-08, 'epochs': 185, 'loss': 'mae', 'optimizer': 'adam', 'use_snp_selection': False, 'n_pcs': 3500}. Best is trial 71 with value: 0.22019119234091403.
2026-06-01 15:25:46 | INFO | Trial 99 | outer=13 | hidden=[256, 128] epochs=196 lr=2.555e-04 wd=8.241e-08 n_pcs=1000 weight={'name': 'uniform'}
[I 2026-06-01 15:25:48,926] Trial 99 pruned. 
2026-06-01 15:25:48 | INFO | Trial 100 | outer=13 | hidden=[256, 128] epochs=229 lr=1.239e-04 wd=6.540e-08 n_pcs=500 weight={'name': 'uniform'}
[I 2026-06-01 15:25:53,032] Trial 100 finished with value: 0.17567909312368024 and parameters: {'hidden_dims': '[256, 128]', 'dropout': 0.472935508487481, 'batch_norm': False, 'lr': 0.00012393030866648196, 'weight_decay': 6.539818728021214e-08, 'epochs': 229, 'loss': 'mae', 'optimizer': 'adam', 'use_snp_selection': False, 'n_pcs': 500}. Best is trial 71 with value: 0.22019119234091403.
2026-06-01 15:25:53 | INFO | Trial 101 | outer=13 | hidden=[256, 128] epochs=169 lr=1.840e-04 wd=2.240e-08 n_pcs=1000 weight={'name': 'uniform'}
[I 2026-06-01 15:25:56,517] Trial 101 finished with value: 0.19032714840047765 and parameters: {'hidden_dims': '[256, 128]', 'dropout': 0.5572452970485198, 'batch_norm': False, 'lr': 0.00018402416456259784, 'weight_decay': 2.2398070691316232e-08, 'epochs': 169, 'loss': 'mae', 'optimizer': 'adam', 'use_snp_selection': False, 'n_pcs': 1000}. Best is trial 71 with value: 0.22019119234091403.
2026-06-01 15:25:56 | INFO | Trial 102 | outer=13 | hidden=[256, 128] epochs=157 lr=2.146e-04 wd=1.060e-07 n_pcs=1000 weight={'name': 'uniform'}
[I 2026-06-01 15:25:59,867] Trial 102 finished with value: 0.2047349030820782 and parameters: {'hidden_dims': '[256, 128]', 'dropout': 0.5420920131486183, 'batch_norm': False, 'lr': 0.0002145543847953083, 'weight_decay': 1.0597994575181681e-07, 'epochs': 157, 'loss': 'mae', 'optimizer': 'adam', 'use_snp_selection': False, 'n_pcs': 1000}. Best is trial 71 with value: 0.22019119234091403.
2026-06-01 15:25:59 | INFO | Trial 103 | outer=13 | hidden=[512, 128] epochs=142 lr=3.579e-04 wd=1.147e-08 n_pcs=1000 weight={'name': 'uniform'}
[I 2026-06-01 15:26:03,567] Trial 103 finished with value: 0.20778086303649723 and parameters: {'hidden_dims': '[512, 128]', 'dropout': 0.5623065600245019, 'batch_norm': False, 'lr': 0.0003578603026357382, 'weight_decay': 1.146726589198863e-08, 'epochs': 142, 'loss': 'mae', 'optimizer': 'adam', 'use_snp_selection': False, 'n_pcs': 1000}. Best is trial 71 with value: 0.22019119234091403.
2026-06-01 15:26:03 | INFO | Trial 104 | outer=13 | hidden=[256, 128] epochs=132 lr=2.928e-04 wd=3.246e-08 n_pcs=1000 weight={'name': 'uniform'}
[I 2026-06-01 15:26:06,638] Trial 104 finished with value: 0.2109442503645786 and parameters: {'hidden_dims': '[256, 128]', 'dropout': 0.4861182975236615, 'batch_norm': False, 'lr': 0.0002928110374510591, 'weight_decay': 3.246154918418497e-08, 'epochs': 132, 'loss': 'mae', 'optimizer': 'adam', 'use_snp_selection': False, 'n_pcs': 1000}. Best is trial 71 with value: 0.22019119234091403.
2026-06-01 15:26:06 | INFO | Trial 105 | outer=13 | hidden=[256, 128] epochs=216 lr=2.902e-04 wd=4.337e-08 n_pcs=1000 weight={'name': 'uniform'}
[I 2026-06-01 15:26:10,651] Trial 105 finished with value: 0.19396202563442747 and parameters: {'hidden_dims': '[256, 128]', 'dropout': 0.48516098296231297, 'batch_norm': False, 'lr': 0.00029022180847044934, 'weight_decay': 4.337419922666717e-08, 'epochs': 216, 'loss': 'mae', 'optimizer': 'adam', 'use_snp_selection': False, 'n_pcs': 1000}. Best is trial 71 with value: 0.22019119234091403.
2026-06-01 15:26:10 | INFO | Trial 106 | outer=13 | hidden=[256, 64] epochs=133 lr=2.033e-04 wd=2.076e-08 n_pcs=1500 weight={'name': 'uniform'}
[I 2026-06-01 15:26:13,822] Trial 106 finished with value: 0.17732005853246685 and parameters: {'hidden_dims': '[256, 64]', 'dropout': 0.45644895025311716, 'batch_norm': False, 'lr': 0.00020327226896340987, 'weight_decay': 2.0761852466423616e-08, 'epochs': 133, 'loss': 'mae', 'optimizer': 'adam', 'use_snp_selection': False, 'n_pcs': 1500}. Best is trial 71 with value: 0.22019119234091403.
2026-06-01 15:26:13 | INFO | Trial 107 | outer=13 | hidden=[128, 64] epochs=123 lr=3.256e-04 wd=3.053e-08 n_pcs=4500 weight={'name': 'uniform'}
[I 2026-06-01 15:26:17,583] Trial 107 finished with value: 0.18655450215761715 and parameters: {'hidden_dims': '[128, 64]', 'dropout': 0.5123686731385458, 'batch_norm': False, 'lr': 0.0003256443903872476, 'weight_decay': 3.0531735140722073e-08, 'epochs': 123, 'loss': 'mae', 'optimizer': 'adam', 'use_snp_selection': False, 'n_pcs': 4500}. Best is trial 71 with value: 0.22019119234091403.
2026-06-01 15:26:17 | INFO | Trial 108 | outer=13 | hidden=[256, 128] epochs=164 lr=2.591e-04 wd=5.032e-08 n_pcs=500 weight={'name': 'uniform'}
[I 2026-06-01 15:26:20,980] Trial 108 finished with value: 0.1802600102403676 and parameters: {'hidden_dims': '[256, 128]', 'dropout': 0.46747905940692286, 'batch_norm': False, 'lr': 0.00025912543346622886, 'weight_decay': 5.0324107160345175e-08, 'epochs': 164, 'loss': 'mse', 'optimizer': 'adam', 'use_snp_selection': False, 'n_pcs': 500}. Best is trial 71 with value: 0.22019119234091403.
2026-06-01 15:26:20 | INFO | Trial 109 | outer=13 | hidden=[512, 64] epochs=132 lr=1.369e-04 wd=7.036e-08 n_pcs=1500 weight={'name': 'uniform'}
[I 2026-06-01 15:26:25,019] Trial 109 finished with value: 0.1942452282298554 and parameters: {'hidden_dims': '[512, 64]', 'dropout': 0.42948265256519297, 'batch_norm': False, 'lr': 0.00013693704385737347, 'weight_decay': 7.036409478586583e-08, 'epochs': 132, 'loss': 'mae', 'optimizer': 'adam', 'use_snp_selection': False, 'n_pcs': 1500}. Best is trial 71 with value: 0.22019119234091403.
2026-06-01 15:26:25 | INFO | Trial 110 | outer=13 | hidden=[1024, 256] epochs=139 lr=1.578e-04 wd=1.403e-08 n_pcs=1000 weight={'name': 'uniform'}
[I 2026-06-01 15:26:30,867] Trial 110 finished with value: 0.21358712056785842 and parameters: {'hidden_dims': '[1024, 256]', 'dropout': 0.4935612517429027, 'batch_norm': False, 'lr': 0.00015782041300453555, 'weight_decay': 1.4026988354713451e-08, 'epochs': 139, 'loss': 'mse', 'optimizer': 'adam', 'use_snp_selection': False, 'n_pcs': 1000}. Best is trial 71 with value: 0.22019119234091403.
2026-06-01 15:26:30 | INFO | Trial 111 | outer=13 | hidden=[256, 128] epochs=142 lr=1.684e-04 wd=1.564e-08 n_pcs=1000 weight={'name': 'uniform'}
[I 2026-06-01 15:26:34,218] Trial 111 finished with value: 0.20365937783410307 and parameters: {'hidden_dims': '[256, 128]', 'dropout': 0.49103043326542556, 'batch_norm': False, 'lr': 0.00016842334061630552, 'weight_decay': 1.5638037917375277e-08, 'epochs': 142, 'loss': 'mse', 'optimizer': 'adam', 'use_snp_selection': False, 'n_pcs': 1000}. Best is trial 71 with value: 0.22019119234091403.
2026-06-01 15:26:34 | INFO | Trial 112 | outer=13 | hidden=[1024, 256] epochs=160 lr=1.544e-04 wd=1.016e-04 n_pcs=1000 weight={'name': 'uniform'}
[I 2026-06-01 15:26:40,708] Trial 112 finished with value: 0.20348609441404672 and parameters: {'hidden_dims': '[1024, 256]', 'dropout': 0.47558453521645855, 'batch_norm': False, 'lr': 0.00015437127471895412, 'weight_decay': 0.00010155580890381875, 'epochs': 160, 'loss': 'mse', 'optimizer': 'adam', 'use_snp_selection': False, 'n_pcs': 1000}. Best is trial 71 with value: 0.22019119234091403.
2026-06-01 15:26:40 | INFO | Trial 113 | outer=13 | hidden=[1024, 256] epochs=137 lr=1.785e-04 wd=2.523e-08 n_pcs=1000 weight={'name': 'uniform'}
[I 2026-06-01 15:26:46,487] Trial 113 finished with value: 0.2132978362966913 and parameters: {'hidden_dims': '[1024, 256]', 'dropout': 0.5197089104229731, 'batch_norm': False, 'lr': 0.00017847298819563136, 'weight_decay': 2.5227101865605108e-08, 'epochs': 137, 'loss': 'mse', 'optimizer': 'adam', 'use_snp_selection': False, 'n_pcs': 1000}. Best is trial 71 with value: 0.22019119234091403.
2026-06-01 15:26:46 | INFO | Trial 114 | outer=13 | hidden=[1024, 256] epochs=129 lr=1.796e-04 wd=2.738e-08 n_pcs=1000 weight={'name': 'uniform'}
[I 2026-06-01 15:26:52,031] Trial 114 finished with value: 0.20219109900438692 and parameters: {'hidden_dims': '[1024, 256]', 'dropout': 0.5176429872013315, 'batch_norm': False, 'lr': 0.0001796377422420177, 'weight_decay': 2.738217201263415e-08, 'epochs': 129, 'loss': 'mse', 'optimizer': 'adam', 'use_snp_selection': False, 'n_pcs': 1000}. Best is trial 71 with value: 0.22019119234091403.
2026-06-01 15:26:52 | INFO | Trial 115 | outer=13 | hidden=[1024, 256] epochs=136 lr=1.955e-04 wd=1.949e-08 n_pcs=1000 weight={'name': 'uniform'}
[I 2026-06-01 15:26:57,799] Trial 115 finished with value: 0.20753111315739275 and parameters: {'hidden_dims': '[1024, 256]', 'dropout': 0.531295614027448, 'batch_norm': False, 'lr': 0.00019550222283900182, 'weight_decay': 1.9486017843824233e-08, 'epochs': 136, 'loss': 'mse', 'optimizer': 'adam', 'use_snp_selection': False, 'n_pcs': 1000}. Best is trial 71 with value: 0.22019119234091403.
2026-06-01 15:26:57 | INFO | Trial 116 | outer=13 | hidden=[1024, 256] epochs=148 lr=1.422e-04 wd=1.099e-08 n_pcs=1000 weight={'name': 'uniform'}
[I 2026-06-01 15:27:03,924] Trial 116 finished with value: 0.20060451468633386 and parameters: {'hidden_dims': '[1024, 256]', 'dropout': 0.508581961682873, 'batch_norm': False, 'lr': 0.0001421544378959335, 'weight_decay': 1.0991754552199998e-08, 'epochs': 148, 'loss': 'mse', 'optimizer': 'adam', 'use_snp_selection': False, 'n_pcs': 1000}. Best is trial 71 with value: 0.22019119234091403.
2026-06-01 15:27:03 | INFO | Trial 117 | outer=13 | hidden=[1024, 256] epochs=118 lr=1.600e-04 wd=2.609e-08 n_pcs=500 weight={'name': 'uniform'}
[I 2026-06-01 15:27:08,014] Trial 117 finished with value: 0.17725846258065395 and parameters: {'hidden_dims': '[1024, 256]', 'dropout': 0.4960239491896498, 'batch_norm': False, 'lr': 0.00016002585111588448, 'weight_decay': 2.609320586587e-08, 'epochs': 118, 'loss': 'mse', 'optimizer': 'adam', 'use_snp_selection': False, 'n_pcs': 500}. Best is trial 71 with value: 0.22019119234091403.
2026-06-01 15:27:08 | INFO | Trial 118 | outer=13 | hidden=[1024, 256] epochs=123 lr=2.314e-04 wd=4.569e-05 n_pcs=1500 weight={'name': 'uniform'}
[I 2026-06-01 15:27:11,946] Trial 118 pruned. 
2026-06-01 15:27:11 | INFO | Trial 119 | outer=13 | hidden=[1024, 256] epochs=108 lr=1.723e-04 wd=6.228e-08 n_pcs=500 weight={'name': 'uniform'}
[I 2026-06-01 15:27:15,811] Trial 119 finished with value: 0.17492755351749423 and parameters: {'hidden_dims': '[1024, 256]', 'dropout': 0.44142020746317245, 'batch_norm': False, 'lr': 0.00017230362909678517, 'weight_decay': 6.228363058703973e-08, 'epochs': 108, 'loss': 'mse', 'optimizer': 'adam', 'use_snp_selection': False, 'n_pcs': 500}. Best is trial 71 with value: 0.22019119234091403.
2026-06-01 15:27:15 | INFO | Trial 120 | outer=13 | hidden=[512, 256] epochs=139 lr=1.171e-04 wd=7.015e-05 n_pcs=1000 weight={'name': 'uniform'}
[I 2026-06-01 15:27:19,776] Trial 120 finished with value: 0.21104043280142096 and parameters: {'hidden_dims': '[512, 256]', 'dropout': 0.4802726892580551, 'batch_norm': False, 'lr': 0.0001171268964120619, 'weight_decay': 7.015430324720685e-05, 'epochs': 139, 'loss': 'mse', 'optimizer': 'adam', 'use_snp_selection': False, 'n_pcs': 1000}. Best is trial 71 with value: 0.22019119234091403.
2026-06-01 15:27:19 | INFO | Trial 121 | outer=13 | hidden=[512, 256] epochs=139 lr=1.238e-04 wd=1.460e-08 n_pcs=1000 weight={'name': 'uniform'}
[I 2026-06-01 15:27:23,743] Trial 121 finished with value: 0.2149861545872373 and parameters: {'hidden_dims': '[512, 256]', 'dropout': 0.4858716851526155, 'batch_norm': False, 'lr': 0.00012382101579135445, 'weight_decay': 1.4598194212306754e-08, 'epochs': 139, 'loss': 'mse', 'optimizer': 'adam', 'use_snp_selection': False, 'n_pcs': 1000}. Best is trial 71 with value: 0.22019119234091403.
2026-06-01 15:27:23 | INFO | Trial 122 | outer=13 | hidden=[512, 256] epochs=139 lr=1.132e-04 wd=1.682e-08 n_pcs=1000 weight={'name': 'uniform'}
[I 2026-06-01 15:27:27,707] Trial 122 finished with value: 0.2009858300320837 and parameters: {'hidden_dims': '[512, 256]', 'dropout': 0.4878319799494964, 'batch_norm': False, 'lr': 0.00011315128348049175, 'weight_decay': 1.682340077956943e-08, 'epochs': 139, 'loss': 'mse', 'optimizer': 'adam', 'use_snp_selection': False, 'n_pcs': 1000}. Best is trial 71 with value: 0.22019119234091403.
2026-06-01 15:27:27 | INFO | Trial 123 | outer=13 | hidden=[512, 256] epochs=149 lr=1.215e-04 wd=6.839e-05 n_pcs=1000 weight={'name': 'uniform'}
[I 2026-06-01 15:27:31,842] Trial 123 finished with value: 0.19550236051023023 and parameters: {'hidden_dims': '[512, 256]', 'dropout': 0.5019466611292858, 'batch_norm': False, 'lr': 0.00012149486511726473, 'weight_decay': 6.83931208073464e-05, 'epochs': 149, 'loss': 'mse', 'optimizer': 'adam', 'use_snp_selection': False, 'n_pcs': 1000}. Best is trial 71 with value: 0.22019119234091403.
2026-06-01 15:27:31 | INFO | Trial 124 | outer=13 | hidden=[512, 256] epochs=126 lr=1.007e-04 wd=1.399e-08 n_pcs=1000 weight={'name': 'uniform'}
[I 2026-06-01 15:27:35,594] Trial 124 finished with value: 0.2210447774666803 and parameters: {'hidden_dims': '[512, 256]', 'dropout': 0.5199887745458134, 'batch_norm': False, 'lr': 0.00010069683560859669, 'weight_decay': 1.3985420247425849e-08, 'epochs': 126, 'loss': 'mse', 'optimizer': 'adam', 'use_snp_selection': False, 'n_pcs': 1000}. Best is trial 124 with value: 0.2210447774666803.
2026-06-01 15:27:35 | INFO | Trial 125 | outer=13 | hidden=[512, 256] epochs=126 lr=1.012e-04 wd=1.320e-08 n_pcs=1500 weight={'name': 'uniform'}
[I 2026-06-01 15:27:38,252] Trial 125 pruned. 
2026-06-01 15:27:38 | INFO | Trial 126 | outer=13 | hidden=[512, 128] epochs=139 lr=1.087e-04 wd=1.397e-08 n_pcs=1000 weight={'name': 'uniform'}
[I 2026-06-01 15:27:41,909] Trial 126 finished with value: 0.23213441655500158 and parameters: {'hidden_dims': '[512, 128]', 'dropout': 0.5382826275600533, 'batch_norm': False, 'lr': 0.00010870866698166614, 'weight_decay': 1.3972131300703576e-08, 'epochs': 139, 'loss': 'mse', 'optimizer': 'adam', 'use_snp_selection': False, 'n_pcs': 1000}. Best is trial 126 with value: 0.23213441655500158.
2026-06-01 15:27:41 | INFO | Trial 127 | outer=13 | hidden=[512, 128] epochs=139 lr=9.341e-05 wd=1.083e-08 n_pcs=1000 weight={'name': 'uniform'}
[I 2026-06-01 15:27:44,134] Trial 127 pruned. 
2026-06-01 15:27:44 | INFO | Trial 128 | outer=13 | hidden=[512, 128] epochs=142 lr=7.995e-05 wd=1.387e-08 n_pcs=500 weight={'name': 'uniform'}
[I 2026-06-01 15:27:47,293] Trial 128 finished with value: 0.16644665142290221 and parameters: {'hidden_dims': '[512, 128]', 'dropout': 0.5180696177563588, 'batch_norm': False, 'lr': 7.99517721499301e-05, 'weight_decay': 1.3871342319568331e-08, 'epochs': 142, 'loss': 'mse', 'optimizer': 'adam', 'use_snp_selection': False, 'n_pcs': 500}. Best is trial 126 with value: 0.23213441655500158.
2026-06-01 15:27:47 | INFO | Trial 129 | outer=13 | hidden=[512, 128] epochs=154 lr=1.142e-04 wd=2.449e-08 n_pcs=1000 weight={'name': 'uniform'}
[I 2026-06-01 15:27:51,168] Trial 129 finished with value: 0.20131501824478573 and parameters: {'hidden_dims': '[512, 128]', 'dropout': 0.4640392666513754, 'batch_norm': False, 'lr': 0.0001142084007664947, 'weight_decay': 2.449220196726985e-08, 'epochs': 154, 'loss': 'mse', 'optimizer': 'adam', 'use_snp_selection': False, 'n_pcs': 1000}. Best is trial 126 with value: 0.23213441655500158.
2026-06-01 15:27:51 | INFO | Trial 130 | outer=13 | hidden=[512, 128] epochs=176 lr=1.355e-04 wd=1.780e-08 n_pcs=1500 weight={'name': 'uniform'}
[I 2026-06-01 15:27:56,200] Trial 130 finished with value: 0.1919759751521055 and parameters: {'hidden_dims': '[512, 128]', 'dropout': 0.5397279094927879, 'batch_norm': False, 'lr': 0.00013545384776537738, 'weight_decay': 1.7800123804566626e-08, 'epochs': 176, 'loss': 'mse', 'optimizer': 'adam', 'use_snp_selection': False, 'n_pcs': 1500}. Best is trial 126 with value: 0.23213441655500158.
2026-06-01 15:27:56 | INFO | Trial 131 | outer=13 | hidden=[512, 256] epochs=135 lr=9.859e-05 wd=3.490e-08 n_pcs=1000 weight={'name': 'uniform'}
[I 2026-06-01 15:28:00,099] Trial 131 finished with value: 0.21786427641311001 and parameters: {'hidden_dims': '[512, 256]', 'dropout': 0.4805690893160297, 'batch_norm': False, 'lr': 9.858511588502417e-05, 'weight_decay': 3.490245834203082e-08, 'epochs': 135, 'loss': 'mse', 'optimizer': 'adam', 'use_snp_selection': False, 'n_pcs': 1000}. Best is trial 126 with value: 0.23213441655500158.
2026-06-01 15:28:00 | INFO | Trial 132 | outer=13 | hidden=[512, 256] epochs=146 lr=1.075e-04 wd=1.349e-04 n_pcs=1000 weight={'name': 'uniform'}
[I 2026-06-01 15:28:02,609] Trial 132 pruned. 
2026-06-01 15:28:02 | INFO | Trial 133 | outer=13 | hidden=[512, 256] epochs=136 lr=1.262e-04 wd=1.388e-08 n_pcs=1000 weight={'name': 'uniform'}
[I 2026-06-01 15:28:06,534] Trial 133 finished with value: 0.19777344893099072 and parameters: {'hidden_dims': '[512, 256]', 'dropout': 0.49655710913644946, 'batch_norm': False, 'lr': 0.00012621189521129267, 'weight_decay': 1.388080447698454e-08, 'epochs': 136, 'loss': 'mse', 'optimizer': 'adam', 'use_snp_selection': False, 'n_pcs': 1000}. Best is trial 126 with value: 0.23213441655500158.
2026-06-01 15:28:06 | INFO | Trial 134 | outer=13 | hidden=[512, 256] epochs=115 lr=8.542e-05 wd=8.337e-05 n_pcs=1000 weight={'name': 'uniform'}
[I 2026-06-01 15:28:10,092] Trial 134 finished with value: 0.2005840779122054 and parameters: {'hidden_dims': '[512, 256]', 'dropout': 0.5093289104438065, 'batch_norm': False, 'lr': 8.542353093602426e-05, 'weight_decay': 8.337202017094318e-05, 'epochs': 115, 'loss': 'mse', 'optimizer': 'adam', 'use_snp_selection': False, 'n_pcs': 1000}. Best is trial 126 with value: 0.23213441655500158.
2026-06-01 15:28:10 | INFO | Trial 135 | outer=13 | hidden=[512, 256] epochs=121 lr=9.615e-05 wd=2.177e-08 n_pcs=2500 weight={'name': 'uniform'}
[I 2026-06-01 15:28:13,329] Trial 135 pruned. 
2026-06-01 15:28:13 | INFO | Trial 136 | outer=13 | hidden=[512, 256] epochs=128 lr=1.033e-04 wd=5.217e-05 n_pcs=1000 weight={'name': 'uniform'}
