[I 2026-06-01 13:54:13,064] Trial 72 finished with value: 0.16534045544049286 and parameters: {'hidden_dims': '[512, 64]', 'dropout': 0.5467175862306419, 'batch_norm': False, 'lr': 0.0002675258628970229, 'weight_decay': 0.00015749388047635684, 'epochs': 70, 'loss': 'mse', 'optimizer': 'adam', 'use_snp_selection': False, 'n_pcs': 2000}. Best is trial 31 with value: 0.20845276367668492.
2026-06-01 13:54:13 | INFO | Trial 73 | outer=8 | hidden=[1024, 256] epochs=56 lr=2.100e-04 wd=2.726e-04 n_pcs=2500 weight={'name': 'uniform'}
[I 2026-06-01 13:54:18,142] Trial 73 finished with value: 0.21325370510446945 and parameters: {'hidden_dims': '[1024, 256]', 'dropout': 0.5762817410080047, 'batch_norm': False, 'lr': 0.00021004473711251116, 'weight_decay': 0.00027260244545928246, 'epochs': 56, 'loss': 'mse', 'optimizer': 'adam', 'use_snp_selection': False, 'n_pcs': 2500}. Best is trial 73 with value: 0.21325370510446945.
2026-06-01 13:54:18 | INFO | Trial 74 | outer=8 | hidden=[1024, 256] epochs=65 lr=1.762e-04 wd=2.763e-04 n_pcs=3000 weight={'name': 'uniform'}
[I 2026-06-01 13:54:24,363] Trial 74 finished with value: 0.19387523216897543 and parameters: {'hidden_dims': '[1024, 256]', 'dropout': 0.5677520112645168, 'batch_norm': False, 'lr': 0.00017624381376369526, 'weight_decay': 0.00027631268787656004, 'epochs': 65, 'loss': 'mse', 'optimizer': 'adam', 'use_snp_selection': False, 'n_pcs': 3000}. Best is trial 73 with value: 0.21325370510446945.
2026-06-01 13:54:24 | INFO | Trial 75 | outer=8 | hidden=[1024, 256] epochs=65 lr=1.284e-04 wd=2.736e-04 n_pcs=3000 weight={'name': 'uniform'}
[I 2026-06-01 13:54:30,579] Trial 75 finished with value: 0.17487883630198395 and parameters: {'hidden_dims': '[1024, 256]', 'dropout': 0.5709011618434318, 'batch_norm': False, 'lr': 0.00012840138828096748, 'weight_decay': 0.0002735707999538635, 'epochs': 65, 'loss': 'mse', 'optimizer': 'adam', 'use_snp_selection': False, 'n_pcs': 3000}. Best is trial 73 with value: 0.21325370510446945.
2026-06-01 13:54:30 | INFO | Trial 76 | outer=8 | hidden=[1024, 256] epochs=183 lr=2.050e-04 wd=7.550e-05 n_pcs=2500 weight={'name': 'uniform'}
[I 2026-06-01 13:54:42,658] Trial 76 finished with value: 0.18275642782780496 and parameters: {'hidden_dims': '[1024, 256]', 'dropout': 0.5355953610668869, 'batch_norm': False, 'lr': 0.00020500129141503545, 'weight_decay': 7.550050108280744e-05, 'epochs': 183, 'loss': 'mse', 'optimizer': 'adamw', 'use_snp_selection': False, 'n_pcs': 2500}. Best is trial 73 with value: 0.21325370510446945.
2026-06-01 13:54:42 | INFO | Trial 77 | outer=8 | hidden=[1024, 256] epochs=56 lr=1.763e-04 wd=6.769e-04 n_pcs=2500 weight={'name': 'uniform'}
[I 2026-06-01 13:54:47,753] Trial 77 finished with value: 0.18497987738295163 and parameters: {'hidden_dims': '[1024, 256]', 'dropout': 0.5789148780233284, 'batch_norm': False, 'lr': 0.00017629999887479848, 'weight_decay': 0.000676919089400707, 'epochs': 56, 'loss': 'mse', 'optimizer': 'adam', 'use_snp_selection': False, 'n_pcs': 2500}. Best is trial 73 with value: 0.21325370510446945.
2026-06-01 13:54:47 | INFO | Trial 78 | outer=8 | hidden=[1024, 256] epochs=92 lr=3.661e-04 wd=1.397e-04 n_pcs=3000 weight={'name': 'uniform'}
[I 2026-06-01 13:54:55,692] Trial 78 finished with value: 0.17122163201637375 and parameters: {'hidden_dims': '[1024, 256]', 'dropout': 0.5995390947261785, 'batch_norm': False, 'lr': 0.0003661285177876989, 'weight_decay': 0.00013966920460649823, 'epochs': 92, 'loss': 'mse', 'optimizer': 'adam', 'use_snp_selection': False, 'n_pcs': 3000}. Best is trial 73 with value: 0.21325370510446945.
2026-06-01 13:54:55 | INFO | Trial 79 | outer=8 | hidden=[1024, 256] epochs=82 lr=2.966e-04 wd=4.716e-04 n_pcs=2000 weight={'name': 'uniform'}
[I 2026-06-01 13:55:01,588] Trial 79 finished with value: 0.1896804220575641 and parameters: {'hidden_dims': '[1024, 256]', 'dropout': 0.5031800506111493, 'batch_norm': False, 'lr': 0.0002966287275512521, 'weight_decay': 0.0004716283899480663, 'epochs': 82, 'loss': 'mse', 'optimizer': 'adam', 'use_snp_selection': False, 'n_pcs': 2000}. Best is trial 73 with value: 0.21325370510446945.
2026-06-01 13:55:01 | INFO | Trial 80 | outer=8 | hidden=[1024, 256] epochs=103 lr=1.435e-04 wd=2.728e-04 n_pcs=3000 weight={'name': 'uniform'}
[I 2026-06-01 13:55:10,242] Trial 80 finished with value: 0.17515105089065944 and parameters: {'hidden_dims': '[1024, 256]', 'dropout': 0.5372016918845531, 'batch_norm': False, 'lr': 0.00014350106312837176, 'weight_decay': 0.0002727639483944279, 'epochs': 103, 'loss': 'mse', 'optimizer': 'adam', 'use_snp_selection': False, 'n_pcs': 3000}. Best is trial 73 with value: 0.21325370510446945.
2026-06-01 13:55:10 | INFO | Trial 81 | outer=8 | hidden=[1024, 256] epochs=77 lr=1.770e-04 wd=1.135e-06 n_pcs=3500 weight={'name': 'uniform'}
[I 2026-06-01 13:55:18,015] Trial 81 finished with value: 0.16798365373268612 and parameters: {'hidden_dims': '[1024, 256]', 'dropout': 0.5648118068598937, 'batch_norm': False, 'lr': 0.0001770175369673217, 'weight_decay': 1.1353896597068895e-06, 'epochs': 77, 'loss': 'mse', 'optimizer': 'adam', 'use_snp_selection': False, 'n_pcs': 3500}. Best is trial 73 with value: 0.21325370510446945.
2026-06-01 13:55:18 | INFO | Trial 82 | outer=8 | hidden=[128, 64] epochs=64 lr=2.200e-04 wd=4.261e-06 n_pcs=2500 weight={'name': 'uniform'}
[I 2026-06-01 13:55:20,702] Trial 82 finished with value: 0.16702394398308976 and parameters: {'hidden_dims': '[128, 64]', 'dropout': 0.4754359246255103, 'batch_norm': False, 'lr': 0.00022001079913500676, 'weight_decay': 4.261456736495068e-06, 'epochs': 64, 'loss': 'mse', 'optimizer': 'adam', 'use_snp_selection': False, 'n_pcs': 2500}. Best is trial 73 with value: 0.21325370510446945.
2026-06-01 13:55:20 | INFO | Trial 83 | outer=8 | hidden=[256, 64] epochs=76 lr=1.109e-04 wd=4.767e-05 n_pcs=3500 weight={'name': 'uniform'}
[I 2026-06-01 13:55:24,215] Trial 83 finished with value: 0.16926838281730572 and parameters: {'hidden_dims': '[256, 64]', 'dropout': 0.5155550693122555, 'batch_norm': False, 'lr': 0.0001108825477994167, 'weight_decay': 4.766970554309323e-05, 'epochs': 76, 'loss': 'mse', 'optimizer': 'adam', 'use_snp_selection': False, 'n_pcs': 3500}. Best is trial 73 with value: 0.21325370510446945.
2026-06-01 13:55:24 | INFO | Trial 84 | outer=8 | hidden=[1024, 256] epochs=50 lr=2.456e-04 wd=4.881e-07 n_pcs=3000 weight={'name': 'uniform'}
[I 2026-06-01 13:55:29,481] Trial 84 finished with value: 0.19392228680659523 and parameters: {'hidden_dims': '[1024, 256]', 'dropout': 0.549232657535893, 'batch_norm': False, 'lr': 0.0002455803047365799, 'weight_decay': 4.881274376989909e-07, 'epochs': 50, 'loss': 'mse', 'optimizer': 'adam', 'use_snp_selection': False, 'n_pcs': 3000}. Best is trial 73 with value: 0.21325370510446945.
2026-06-01 13:55:29 | INFO | Trial 85 | outer=8 | hidden=[1024, 256] epochs=55 lr=2.387e-04 wd=4.972e-07 n_pcs=3000 weight={'name': 'uniform'}
[I 2026-06-01 13:55:35,073] Trial 85 finished with value: 0.1803150714771543 and parameters: {'hidden_dims': '[1024, 256]', 'dropout': 0.5481120451455119, 'batch_norm': False, 'lr': 0.00023870555396520303, 'weight_decay': 4.972189306069381e-07, 'epochs': 55, 'loss': 'mse', 'optimizer': 'adam', 'use_snp_selection': False, 'n_pcs': 3000}. Best is trial 73 with value: 0.21325370510446945.
2026-06-01 13:55:35 | INFO | Trial 86 | outer=8 | hidden=[1024, 256] epochs=66 lr=2.575e-04 wd=8.894e-07 n_pcs=2500 weight={'name': 'uniform'}
[I 2026-06-01 13:55:40,724] Trial 86 finished with value: 0.16783222362093278 and parameters: {'hidden_dims': '[1024, 256]', 'dropout': 0.5779082821833884, 'batch_norm': False, 'lr': 0.0002575404066901672, 'weight_decay': 8.893661954967532e-07, 'epochs': 66, 'loss': 'mse', 'optimizer': 'adam', 'use_snp_selection': False, 'n_pcs': 2500}. Best is trial 73 with value: 0.21325370510446945.
2026-06-01 13:55:40 | INFO | Trial 87 | outer=8 | hidden=[1024, 256] epochs=51 lr=6.237e-05 wd=6.945e-08 n_pcs=3000 weight={'name': 'uniform'}
[I 2026-06-01 13:55:46,075] Trial 87 finished with value: 0.149077425100407 and parameters: {'hidden_dims': '[1024, 256]', 'dropout': 0.5254594151045522, 'batch_norm': False, 'lr': 6.237168746903664e-05, 'weight_decay': 6.944841373620405e-08, 'epochs': 51, 'loss': 'mse', 'optimizer': 'adam', 'use_snp_selection': False, 'n_pcs': 3000}. Best is trial 73 with value: 0.21325370510446945.
2026-06-01 13:55:46 | INFO | Trial 88 | outer=8 | hidden=[1024, 256] epochs=60 lr=4.336e-04 wd=2.395e-07 n_pcs=2500 weight={'name': 'uniform'}
[I 2026-06-01 13:55:51,376] Trial 88 finished with value: 0.18588401837320362 and parameters: {'hidden_dims': '[1024, 256]', 'dropout': 0.5887123412400482, 'batch_norm': False, 'lr': 0.0004336234506492983, 'weight_decay': 2.395368475137134e-07, 'epochs': 60, 'loss': 'mse', 'optimizer': 'adamw', 'use_snp_selection': False, 'n_pcs': 2500}. Best is trial 73 with value: 0.21325370510446945.
2026-06-01 13:55:51 | INFO | Trial 89 | outer=8 | hidden=[512, 256] epochs=86 lr=2.071e-04 wd=3.586e-04 n_pcs=2000 weight={'name': 'uniform'}
[I 2026-06-01 13:55:55,320] Trial 89 finished with value: 0.1890132705393357 and parameters: {'hidden_dims': '[512, 256]', 'dropout': 0.5638584505679837, 'batch_norm': False, 'lr': 0.00020713748978864536, 'weight_decay': 0.0003586011124766374, 'epochs': 86, 'loss': 'mse', 'optimizer': 'adam', 'use_snp_selection': False, 'n_pcs': 2000}. Best is trial 73 with value: 0.21325370510446945.
2026-06-01 13:55:55 | INFO | Trial 90 | outer=8 | hidden=[512, 64] epochs=71 lr=1.470e-04 wd=2.719e-06 n_pcs=2500 weight={'name': 'uniform'}
[I 2026-06-01 13:55:59,033] Trial 90 finished with value: 0.17181485497074364 and parameters: {'hidden_dims': '[512, 64]', 'dropout': 0.42710805000055324, 'batch_norm': False, 'lr': 0.0001470472730160147, 'weight_decay': 2.7185903449414392e-06, 'epochs': 71, 'loss': 'mse', 'optimizer': 'adam', 'use_snp_selection': False, 'n_pcs': 2500}. Best is trial 73 with value: 0.21325370510446945.
2026-06-01 13:55:59 | INFO | Trial 91 | outer=8 | hidden=[512, 128] epochs=56 lr=1.644e-04 wd=2.231e-06 n_pcs=3500 weight={'name': 'uniform'}
[I 2026-06-01 13:56:03,149] Trial 91 finished with value: 0.16125075784488407 and parameters: {'hidden_dims': '[512, 128]', 'dropout': 0.500296933492624, 'batch_norm': False, 'lr': 0.00016441874918439445, 'weight_decay': 2.2305004975935516e-06, 'epochs': 56, 'loss': 'mse', 'optimizer': 'adam', 'use_snp_selection': False, 'n_pcs': 3500}. Best is trial 73 with value: 0.21325370510446945.
2026-06-01 13:56:03 | INFO | Trial 92 | outer=8 | hidden=[512, 128] epochs=264 lr=1.909e-04 wd=1.345e-06 n_pcs=3500 weight={'name': 'uniform'}
[I 2026-06-01 13:56:14,781] Trial 92 finished with value: 0.17488233935477562 and parameters: {'hidden_dims': '[512, 128]', 'dropout': 0.3086676200718899, 'batch_norm': False, 'lr': 0.00019086526937402672, 'weight_decay': 1.3453303599830006e-06, 'epochs': 264, 'loss': 'mae', 'optimizer': 'adam', 'use_snp_selection': False, 'n_pcs': 3500}. Best is trial 73 with value: 0.21325370510446945.
2026-06-01 13:56:14 | INFO | Trial 93 | outer=8 | hidden=[512, 64] epochs=72 lr=3.068e-04 wd=3.943e-07 n_pcs=3000 weight={'name': 'uniform'}
[I 2026-06-01 13:56:18,952] Trial 93 finished with value: 0.1837944747753134 and parameters: {'hidden_dims': '[512, 64]', 'dropout': 0.5569066345957678, 'batch_norm': False, 'lr': 0.00030678385522947435, 'weight_decay': 3.9428525853742607e-07, 'epochs': 72, 'loss': 'mae', 'optimizer': 'adam', 'use_snp_selection': False, 'n_pcs': 3000}. Best is trial 73 with value: 0.21325370510446945.
2026-06-01 13:56:18 | INFO | Trial 94 | outer=8 | hidden=[256, 128] epochs=64 lr=1.740e-04 wd=1.343e-04 n_pcs=3000 weight={'name': 'uniform'}
[I 2026-06-01 13:56:22,050] Trial 94 finished with value: 0.17134700119346993 and parameters: {'hidden_dims': '[256, 128]', 'dropout': 0.5386104868429537, 'batch_norm': False, 'lr': 0.0001740391391701233, 'weight_decay': 0.00013425010478472716, 'epochs': 64, 'loss': 'mse', 'optimizer': 'adam', 'use_snp_selection': False, 'n_pcs': 3000}. Best is trial 73 with value: 0.21325370510446945.
2026-06-01 13:56:22 | INFO | Trial 95 | outer=8 | hidden=[1024, 256] epochs=212 lr=9.305e-05 wd=7.707e-04 n_pcs=4000 weight={'name': 'uniform'}
[I 2026-06-01 13:56:41,457] Trial 95 finished with value: 0.20212065694850442 and parameters: {'hidden_dims': '[1024, 256]', 'dropout': 0.38728350295526015, 'batch_norm': False, 'lr': 9.305442773995062e-05, 'weight_decay': 0.0007706941565151688, 'epochs': 212, 'loss': 'mae', 'optimizer': 'adam', 'use_snp_selection': False, 'n_pcs': 4000}. Best is trial 73 with value: 0.21325370510446945.
2026-06-01 13:56:41 | INFO | Trial 96 | outer=8 | hidden=[1024, 256] epochs=243 lr=9.652e-05 wd=8.146e-04 n_pcs=4500 weight={'name': 'uniform'}
[I 2026-06-01 13:57:05,351] Trial 96 finished with value: 0.19277460146566364 and parameters: {'hidden_dims': '[1024, 256]', 'dropout': 0.391883401106059, 'batch_norm': False, 'lr': 9.651921511934178e-05, 'weight_decay': 0.0008146036062146395, 'epochs': 243, 'loss': 'mae', 'optimizer': 'adam', 'use_snp_selection': False, 'n_pcs': 4500}. Best is trial 73 with value: 0.21325370510446945.
2026-06-01 13:57:05 | INFO | Trial 97 | outer=8 | hidden=[1024, 256] epochs=198 lr=7.703e-05 wd=9.685e-04 n_pcs=4500 weight={'name': 'uniform'}
[I 2026-06-01 13:57:25,252] Trial 97 finished with value: 0.17958182418070726 and parameters: {'hidden_dims': '[1024, 256]', 'dropout': 0.37889782242308107, 'batch_norm': False, 'lr': 7.702603939933853e-05, 'weight_decay': 0.0009684597843010891, 'epochs': 198, 'loss': 'mae', 'optimizer': 'adam', 'use_snp_selection': False, 'n_pcs': 4500}. Best is trial 73 with value: 0.21325370510446945.
2026-06-01 13:57:25 | INFO | Trial 98 | outer=8 | hidden=[1024, 256] epochs=225 lr=9.890e-05 wd=7.276e-04 n_pcs=4000 weight={'name': 'uniform'}
[I 2026-06-01 13:57:45,731] Trial 98 finished with value: 0.18425500960024357 and parameters: {'hidden_dims': '[1024, 256]', 'dropout': 0.3806149356799869, 'batch_norm': False, 'lr': 9.890471144370239e-05, 'weight_decay': 0.0007275734816600958, 'epochs': 225, 'loss': 'mae', 'optimizer': 'adam', 'use_snp_selection': False, 'n_pcs': 4000}. Best is trial 73 with value: 0.21325370510446945.
2026-06-01 13:57:45 | INFO | Trial 99 | outer=8 | hidden=[1024, 256] epochs=245 lr=8.472e-05 wd=5.815e-04 n_pcs=5000 weight={'name': 'uniform'}
[I 2026-06-01 13:58:11,814] Trial 99 finished with value: 0.1781377503251434 and parameters: {'hidden_dims': '[1024, 256]', 'dropout': 0.3340454208808289, 'batch_norm': False, 'lr': 8.471883473418573e-05, 'weight_decay': 0.0005814505778434191, 'epochs': 245, 'loss': 'mae', 'optimizer': 'adam', 'use_snp_selection': False, 'n_pcs': 5000}. Best is trial 73 with value: 0.21325370510446945.
2026-06-01 13:58:11 | INFO | Trial 100 | outer=8 | hidden=[1024, 256] epochs=210 lr=1.146e-04 wd=3.179e-04 n_pcs=4500 weight={'name': 'uniform'}
[I 2026-06-01 13:58:32,739] Trial 100 finished with value: 0.20362486119265596 and parameters: {'hidden_dims': '[1024, 256]', 'dropout': 0.3464701254263406, 'batch_norm': False, 'lr': 0.00011459432422595429, 'weight_decay': 0.0003179145272430121, 'epochs': 210, 'loss': 'mae', 'optimizer': 'adam', 'use_snp_selection': False, 'n_pcs': 4500}. Best is trial 73 with value: 0.21325370510446945.
2026-06-01 13:58:32 | INFO | Trial 101 | outer=8 | hidden=[1024, 256] epochs=203 lr=1.202e-04 wd=3.232e-04 n_pcs=4500 weight={'name': 'uniform'}
[I 2026-06-01 13:58:53,039] Trial 101 finished with value: 0.19623961979424126 and parameters: {'hidden_dims': '[1024, 256]', 'dropout': 0.35486492891741905, 'batch_norm': False, 'lr': 0.00012016517467043317, 'weight_decay': 0.00032319071537186304, 'epochs': 203, 'loss': 'mae', 'optimizer': 'adam', 'use_snp_selection': False, 'n_pcs': 4500}. Best is trial 73 with value: 0.21325370510446945.
2026-06-01 13:58:53 | INFO | Trial 102 | outer=8 | hidden=[1024, 256] epochs=202 lr=9.302e-05 wd=3.459e-04 n_pcs=4500 weight={'name': 'uniform'}
[I 2026-06-01 13:59:13,256] Trial 102 finished with value: 0.17711171377206433 and parameters: {'hidden_dims': '[1024, 256]', 'dropout': 0.35487695187578344, 'batch_norm': False, 'lr': 9.302145970485113e-05, 'weight_decay': 0.0003458817098884538, 'epochs': 202, 'loss': 'mae', 'optimizer': 'adam', 'use_snp_selection': False, 'n_pcs': 4500}. Best is trial 73 with value: 0.21325370510446945.
2026-06-01 13:59:13 | INFO | Trial 103 | outer=8 | hidden=[1024, 256] epochs=217 lr=6.391e-05 wd=4.549e-04 n_pcs=4500 weight={'name': 'uniform'}
[I 2026-06-01 13:59:34,776] Trial 103 finished with value: 0.19584843970060642 and parameters: {'hidden_dims': '[1024, 256]', 'dropout': 0.39626154645971606, 'batch_norm': False, 'lr': 6.391400797278103e-05, 'weight_decay': 0.00045490196920266155, 'epochs': 217, 'loss': 'mae', 'optimizer': 'adam', 'use_snp_selection': False, 'n_pcs': 4500}. Best is trial 73 with value: 0.21325370510446945.
2026-06-01 13:59:34 | INFO | Trial 104 | outer=8 | hidden=[1024, 256] epochs=215 lr=7.522e-05 wd=4.484e-04 n_pcs=5000 weight={'name': 'uniform'}
[I 2026-06-01 13:59:57,997] Trial 104 finished with value: 0.20046044475172087 and parameters: {'hidden_dims': '[1024, 256]', 'dropout': 0.312892543824842, 'batch_norm': False, 'lr': 7.522488267065076e-05, 'weight_decay': 0.0004484233919704998, 'epochs': 215, 'loss': 'mae', 'optimizer': 'adam', 'use_snp_selection': False, 'n_pcs': 5000}. Best is trial 73 with value: 0.21325370510446945.
2026-06-01 13:59:58 | INFO | Trial 105 | outer=8 | hidden=[1024, 256] epochs=216 lr=7.564e-05 wd=4.161e-04 n_pcs=5000 weight={'name': 'uniform'}
[I 2026-06-01 14:00:21,615] Trial 105 finished with value: 0.18219712552436612 and parameters: {'hidden_dims': '[1024, 256]', 'dropout': 0.3135013307329917, 'batch_norm': False, 'lr': 7.564310684431983e-05, 'weight_decay': 0.000416144382311639, 'epochs': 216, 'loss': 'mae', 'optimizer': 'adam', 'use_snp_selection': False, 'n_pcs': 5000}. Best is trial 73 with value: 0.21325370510446945.
2026-06-01 14:00:21 | INFO | Trial 106 | outer=8 | hidden=[1024, 256] epochs=215 lr=5.715e-05 wd=5.439e-04 n_pcs=5000 weight={'name': 'uniform'}
[I 2026-06-01 14:00:44,816] Trial 106 finished with value: 0.17120829406405252 and parameters: {'hidden_dims': '[1024, 256]', 'dropout': 0.35038566382858377, 'batch_norm': False, 'lr': 5.715051222665064e-05, 'weight_decay': 0.000543874431838927, 'epochs': 215, 'loss': 'mae', 'optimizer': 'adam', 'use_snp_selection': False, 'n_pcs': 5000}. Best is trial 73 with value: 0.21325370510446945.
2026-06-01 14:00:44 | INFO | Trial 107 | outer=8 | hidden=[1024, 256] epochs=195 lr=6.763e-05 wd=6.032e-07 n_pcs=4000 weight={'name': 'uniform'}
[I 2026-06-01 14:01:02,773] Trial 107 finished with value: 0.17111609117426396 and parameters: {'hidden_dims': '[1024, 256]', 'dropout': 0.2984982450545298, 'batch_norm': False, 'lr': 6.763267899272863e-05, 'weight_decay': 6.031695794647218e-07, 'epochs': 195, 'loss': 'mae', 'optimizer': 'adamw', 'use_snp_selection': False, 'n_pcs': 4000}. Best is trial 73 with value: 0.21325370510446945.
2026-06-01 14:01:02 | INFO | Trial 108 | outer=8 | hidden=[1024, 256] epochs=234 lr=4.961e-05 wd=5.181e-04 n_pcs=4500 weight={'name': 'uniform'}
[I 2026-06-01 14:01:25,834] Trial 108 finished with value: 0.1887456702204109 and parameters: {'hidden_dims': '[1024, 256]', 'dropout': 0.4058930633599581, 'batch_norm': False, 'lr': 4.961164009662698e-05, 'weight_decay': 0.0005180799396284103, 'epochs': 234, 'loss': 'mae', 'optimizer': 'adam', 'use_snp_selection': False, 'n_pcs': 4500}. Best is trial 73 with value: 0.21325370510446945.
2026-06-01 14:01:25 | INFO | Trial 109 | outer=8 | hidden=[1024, 256] epochs=214 lr=1.056e-04 wd=3.670e-04 n_pcs=5000 weight={'name': 'uniform'}
[I 2026-06-01 14:01:48,947] Trial 109 finished with value: 0.19849930370816427 and parameters: {'hidden_dims': '[1024, 256]', 'dropout': 0.3642856809212623, 'batch_norm': False, 'lr': 0.00010555531734895759, 'weight_decay': 0.0003669727586327754, 'epochs': 214, 'loss': 'mae', 'optimizer': 'adam', 'use_snp_selection': False, 'n_pcs': 5000}. Best is trial 73 with value: 0.21325370510446945.
2026-06-01 14:01:48 | INFO | Trial 110 | outer=8 | hidden=[1024, 256] epochs=210 lr=9.020e-05 wd=4.314e-04 n_pcs=5000 weight={'name': 'uniform'}
[I 2026-06-01 14:02:11,699] Trial 110 finished with value: 0.17470686485463038 and parameters: {'hidden_dims': '[1024, 256]', 'dropout': 0.36335227987347524, 'batch_norm': False, 'lr': 9.020023863173798e-05, 'weight_decay': 0.00043140520933408874, 'epochs': 210, 'loss': 'mae', 'optimizer': 'adam', 'use_snp_selection': False, 'n_pcs': 5000}. Best is trial 73 with value: 0.21325370510446945.
2026-06-01 14:02:11 | INFO | Trial 111 | outer=8 | hidden=[1024, 256] epochs=220 lr=6.644e-05 wd=3.122e-04 n_pcs=4500 weight={'name': 'uniform'}
[I 2026-06-01 14:02:33,508] Trial 111 finished with value: 0.2083346252658828 and parameters: {'hidden_dims': '[1024, 256]', 'dropout': 0.3309331659298894, 'batch_norm': False, 'lr': 6.64384019638538e-05, 'weight_decay': 0.0003121751569784293, 'epochs': 220, 'loss': 'mae', 'optimizer': 'adam', 'use_snp_selection': False, 'n_pcs': 4500}. Best is trial 73 with value: 0.21325370510446945.
2026-06-01 14:02:33 | INFO | Trial 112 | outer=8 | hidden=[1024, 256] epochs=223 lr=6.502e-05 wd=2.247e-04 n_pcs=4500 weight={'name': 'uniform'}
[I 2026-06-01 14:02:55,605] Trial 112 finished with value: 0.1819800709329549 and parameters: {'hidden_dims': '[1024, 256]', 'dropout': 0.32516927412241625, 'batch_norm': False, 'lr': 6.502024632388333e-05, 'weight_decay': 0.0002247394293601786, 'epochs': 223, 'loss': 'mae', 'optimizer': 'adam', 'use_snp_selection': False, 'n_pcs': 4500}. Best is trial 73 with value: 0.21325370510446945.
2026-06-01 14:02:55 | INFO | Trial 113 | outer=8 | hidden=[1024, 256] epochs=209 lr=1.060e-04 wd=3.664e-04 n_pcs=5000 weight={'name': 'uniform'}
