[I 2026-06-01 15:57:58,932] Trial 59 finished with value: 0.18322855933556342 and parameters: {'hidden_dims': '[128, 64]', 'dropout': 0.20485362835227544, 'batch_norm': False, 'lr': 6.941481205962077e-05, 'weight_decay': 0.0003620905497530382, 'epochs': 248, 'loss': 'mae', 'optimizer': 'adamw', 'use_snp_selection': False, 'n_pcs': 2500}. Best is trial 54 with value: 0.1971201374024811.
2026-06-01 15:57:58 | INFO | Trial 60 | outer=15 | hidden=[256, 64] epochs=260 lr=5.308e-05 wd=5.611e-05 n_pcs=1000 weight={'name': 'uniform'}
[I 2026-06-01 15:58:03,378] Trial 60 finished with value: 0.17226851596967113 and parameters: {'hidden_dims': '[256, 64]', 'dropout': 0.45289902304433177, 'batch_norm': False, 'lr': 5.3078244821225185e-05, 'weight_decay': 5.611073940365717e-05, 'epochs': 260, 'loss': 'mae', 'optimizer': 'adamw', 'use_snp_selection': False, 'n_pcs': 1000}. Best is trial 54 with value: 0.1971201374024811.
2026-06-01 15:58:03 | INFO | Trial 61 | outer=15 | hidden=[1024, 256] epochs=191 lr=4.064e-04 wd=2.268e-04 n_pcs=1000 weight={'name': 'uniform'}
[I 2026-06-01 15:58:10,493] Trial 61 finished with value: 0.19207609045936097 and parameters: {'hidden_dims': '[1024, 256]', 'dropout': 0.2553249382242804, 'batch_norm': False, 'lr': 0.00040643750544510705, 'weight_decay': 0.00022680997848087815, 'epochs': 191, 'loss': 'mae', 'optimizer': 'adamw', 'use_snp_selection': False, 'n_pcs': 1000}. Best is trial 54 with value: 0.1971201374024811.
2026-06-01 15:58:10 | INFO | Trial 62 | outer=15 | hidden=[1024, 256] epochs=189 lr=4.063e-05 wd=2.231e-04 n_pcs=1500 weight={'name': 'uniform'}
[I 2026-06-01 15:58:19,065] Trial 62 finished with value: 0.17915445458986853 and parameters: {'hidden_dims': '[1024, 256]', 'dropout': 0.23174849943278852, 'batch_norm': False, 'lr': 4.063127869105581e-05, 'weight_decay': 0.00022314338051417716, 'epochs': 189, 'loss': 'mae', 'optimizer': 'adamw', 'use_snp_selection': False, 'n_pcs': 1500}. Best is trial 54 with value: 0.1971201374024811.
2026-06-01 15:58:19 | INFO | Trial 63 | outer=15 | hidden=[1024, 256] epochs=174 lr=3.617e-04 wd=1.489e-04 n_pcs=500 weight={'name': 'uniform'}
[I 2026-06-01 15:58:24,167] Trial 63 finished with value: 0.15564259410031875 and parameters: {'hidden_dims': '[1024, 256]', 'dropout': 0.4179534656865353, 'batch_norm': False, 'lr': 0.00036166421915891344, 'weight_decay': 0.0001489096965310095, 'epochs': 174, 'loss': 'mae', 'optimizer': 'adamw', 'use_snp_selection': False, 'n_pcs': 500}. Best is trial 54 with value: 0.1971201374024811.
2026-06-01 15:58:24 | INFO | Trial 64 | outer=15 | hidden=[512, 256] epochs=174 lr=3.230e-05 wd=7.753e-05 n_pcs=1000 weight={'name': 'uniform'}
[I 2026-06-01 15:58:28,585] Trial 64 finished with value: 0.18744557799684453 and parameters: {'hidden_dims': '[512, 256]', 'dropout': 0.18639898993804296, 'batch_norm': False, 'lr': 3.229658678661089e-05, 'weight_decay': 7.75300438466987e-05, 'epochs': 174, 'loss': 'mae', 'optimizer': 'adamw', 'use_snp_selection': False, 'n_pcs': 1000}. Best is trial 54 with value: 0.1971201374024811.
2026-06-01 15:58:28 | INFO | Trial 65 | outer=15 | hidden=[256, 128] epochs=223 lr=4.189e-04 wd=3.059e-04 n_pcs=1500 weight={'name': 'uniform'}
[I 2026-06-01 15:58:32,724] Trial 65 finished with value: 0.1827200474111345 and parameters: {'hidden_dims': '[256, 128]', 'dropout': 0.2889006788509888, 'batch_norm': False, 'lr': 0.00041890660107072556, 'weight_decay': 0.0003058933789234089, 'epochs': 223, 'loss': 'mae', 'optimizer': 'adamw', 'use_snp_selection': False, 'n_pcs': 1500}. Best is trial 54 with value: 0.1971201374024811.
2026-06-01 15:58:32 | INFO | Trial 66 | outer=15 | hidden=[512, 128] epochs=235 lr=8.755e-05 wd=9.452e-04 n_pcs=500 weight={'name': 'uniform'}
[I 2026-06-01 15:58:36,819] Trial 66 finished with value: 0.15542802412531193 and parameters: {'hidden_dims': '[512, 128]', 'dropout': 0.37174852576284023, 'batch_norm': False, 'lr': 8.755457226745496e-05, 'weight_decay': 0.0009452456717540087, 'epochs': 235, 'loss': 'mae', 'optimizer': 'adamw', 'use_snp_selection': False, 'n_pcs': 500}. Best is trial 54 with value: 0.1971201374024811.
2026-06-01 15:58:36 | INFO | Trial 67 | outer=15 | hidden=[512, 64] epochs=124 lr=1.175e-04 wd=1.325e-05 n_pcs=2000 weight={'name': 'uniform'}
[I 2026-06-01 15:58:41,113] Trial 67 finished with value: 0.17803436303723874 and parameters: {'hidden_dims': '[512, 64]', 'dropout': 0.21817717178863616, 'batch_norm': False, 'lr': 0.00011749867198463012, 'weight_decay': 1.3249405425926619e-05, 'epochs': 124, 'loss': 'mse', 'optimizer': 'adamw', 'use_snp_selection': False, 'n_pcs': 2000}. Best is trial 54 with value: 0.1971201374024811.
2026-06-01 15:58:41 | INFO | Trial 68 | outer=15 | hidden=[1024, 256] epochs=266 lr=5.565e-05 wd=6.252e-04 n_pcs=1000 weight={'name': 'uniform'}
[I 2026-06-01 15:58:50,426] Trial 68 finished with value: 0.19885035360957712 and parameters: {'hidden_dims': '[1024, 256]', 'dropout': 0.4029872207535242, 'batch_norm': False, 'lr': 5.5652846506560596e-05, 'weight_decay': 0.000625219500773196, 'epochs': 266, 'loss': 'mae', 'optimizer': 'adam', 'use_snp_selection': False, 'n_pcs': 1000}. Best is trial 68 with value: 0.19885035360957712.
2026-06-01 15:58:50 | INFO | Trial 69 | outer=15 | hidden=[256, 64] epochs=266 lr=7.018e-05 wd=5.704e-04 n_pcs=1000 weight={'name': 'uniform'}
[I 2026-06-01 15:58:54,994] Trial 69 finished with value: 0.202766379161958 and parameters: {'hidden_dims': '[256, 64]', 'dropout': 0.408024943557273, 'batch_norm': False, 'lr': 7.017803180010296e-05, 'weight_decay': 0.0005703703177680537, 'epochs': 266, 'loss': 'mae', 'optimizer': 'adam', 'use_snp_selection': False, 'n_pcs': 1000}. Best is trial 69 with value: 0.202766379161958.
2026-06-01 15:58:55 | INFO | Trial 70 | outer=15 | hidden=[256, 64] epochs=286 lr=7.013e-05 wd=7.054e-04 n_pcs=500 weight={'name': 'uniform'}
[I 2026-06-01 15:58:57,835] Trial 70 pruned. 
2026-06-01 15:58:57 | INFO | Trial 71 | outer=15 | hidden=[256, 64] epochs=266 lr=5.642e-05 wd=4.962e-04 n_pcs=1000 weight={'name': 'uniform'}
[I 2026-06-01 15:59:02,409] Trial 71 finished with value: 0.15578262565792872 and parameters: {'hidden_dims': '[256, 64]', 'dropout': 0.43389425617352295, 'batch_norm': False, 'lr': 5.642216572062466e-05, 'weight_decay': 0.0004961929244569669, 'epochs': 266, 'loss': 'mae', 'optimizer': 'adam', 'use_snp_selection': False, 'n_pcs': 1000}. Best is trial 69 with value: 0.202766379161958.
2026-06-01 15:59:02 | INFO | Trial 72 | outer=15 | hidden=[256, 64] epochs=282 lr=9.318e-05 wd=6.533e-04 n_pcs=1000 weight={'name': 'uniform'}
[I 2026-06-01 15:59:07,158] Trial 72 finished with value: 0.19817798944991122 and parameters: {'hidden_dims': '[256, 64]', 'dropout': 0.33302040456552107, 'batch_norm': False, 'lr': 9.31839969390746e-05, 'weight_decay': 0.0006532812572581461, 'epochs': 282, 'loss': 'mae', 'optimizer': 'adam', 'use_snp_selection': False, 'n_pcs': 1000}. Best is trial 69 with value: 0.202766379161958.
2026-06-01 15:59:07 | INFO | Trial 73 | outer=15 | hidden=[256, 64] epochs=294 lr=1.031e-04 wd=3.625e-04 n_pcs=1000 weight={'name': 'uniform'}
[I 2026-06-01 15:59:12,040] Trial 73 finished with value: 0.18250204199557737 and parameters: {'hidden_dims': '[256, 64]', 'dropout': 0.33538130281869294, 'batch_norm': False, 'lr': 0.00010314106145601322, 'weight_decay': 0.0003625453134905358, 'epochs': 294, 'loss': 'mae', 'optimizer': 'adam', 'use_snp_selection': False, 'n_pcs': 1000}. Best is trial 69 with value: 0.202766379161958.
2026-06-01 15:59:12 | INFO | Trial 74 | outer=15 | hidden=[256, 64] epochs=278 lr=9.085e-05 wd=6.259e-04 n_pcs=1000 weight={'name': 'uniform'}
[I 2026-06-01 15:59:16,745] Trial 74 finished with value: 0.16985545312584274 and parameters: {'hidden_dims': '[256, 64]', 'dropout': 0.3608167732370485, 'batch_norm': False, 'lr': 9.084749103828364e-05, 'weight_decay': 0.0006259071170652079, 'epochs': 278, 'loss': 'mae', 'optimizer': 'adam', 'use_snp_selection': False, 'n_pcs': 1000}. Best is trial 69 with value: 0.202766379161958.
2026-06-01 15:59:16 | INFO | Trial 75 | outer=15 | hidden=[256, 64] epochs=253 lr=1.352e-04 wd=9.810e-04 n_pcs=4500 weight={'name': 'uniform'}
[I 2026-06-01 15:59:24,500] Trial 75 finished with value: 0.19038011885104833 and parameters: {'hidden_dims': '[256, 64]', 'dropout': 0.3891782585882937, 'batch_norm': False, 'lr': 0.00013519044093602222, 'weight_decay': 0.0009809998986929224, 'epochs': 253, 'loss': 'mae', 'optimizer': 'adam', 'use_snp_selection': False, 'n_pcs': 4500}. Best is trial 69 with value: 0.202766379161958.
2026-06-01 15:59:24 | INFO | Trial 76 | outer=15 | hidden=[256, 64] epochs=281 lr=6.378e-05 wd=1.108e-04 n_pcs=500 weight={'name': 'uniform'}
[I 2026-06-01 15:59:29,176] Trial 76 finished with value: 0.17400590678794797 and parameters: {'hidden_dims': '[256, 64]', 'dropout': 0.32363314769470436, 'batch_norm': False, 'lr': 6.378005724486816e-05, 'weight_decay': 0.00011077557603677782, 'epochs': 281, 'loss': 'mae', 'optimizer': 'adam', 'use_snp_selection': False, 'n_pcs': 500}. Best is trial 69 with value: 0.202766379161958.
2026-06-01 15:59:29 | INFO | Trial 77 | outer=15 | hidden=[256, 64] epochs=270 lr=7.454e-05 wd=1.130e-06 n_pcs=1500 weight={'name': 'uniform'}
[I 2026-06-01 15:59:33,848] Trial 77 finished with value: 0.1852050129095997 and parameters: {'hidden_dims': '[256, 64]', 'dropout': 0.46190791267114806, 'batch_norm': False, 'lr': 7.453902056394642e-05, 'weight_decay': 1.1295876492620124e-06, 'epochs': 270, 'loss': 'mae', 'optimizer': 'adam', 'use_snp_selection': False, 'n_pcs': 1500}. Best is trial 69 with value: 0.202766379161958.
2026-06-01 15:59:33 | INFO | Trial 78 | outer=15 | hidden=[128, 64] epochs=290 lr=9.478e-05 wd=4.110e-04 n_pcs=1000 weight={'name': 'uniform'}
[I 2026-06-01 15:59:38,866] Trial 78 finished with value: 0.1851252121592361 and parameters: {'hidden_dims': '[128, 64]', 'dropout': 0.42154201314319706, 'batch_norm': False, 'lr': 9.478032139223085e-05, 'weight_decay': 0.0004110209550658557, 'epochs': 290, 'loss': 'mse', 'optimizer': 'adam', 'use_snp_selection': False, 'n_pcs': 1000}. Best is trial 69 with value: 0.202766379161958.
2026-06-01 15:59:38 | INFO | Trial 79 | outer=15 | hidden=[256, 64] epochs=251 lr=7.920e-05 wd=7.045e-04 n_pcs=500 weight={'name': 'uniform'}
[I 2026-06-01 15:59:43,614] Trial 79 finished with value: 0.15870127842166565 and parameters: {'hidden_dims': '[256, 64]', 'dropout': 0.5007875190551166, 'batch_norm': False, 'lr': 7.920231838733531e-05, 'weight_decay': 0.0007044570579322698, 'epochs': 251, 'loss': 'mae', 'optimizer': 'adam', 'use_snp_selection': False, 'n_pcs': 500}. Best is trial 69 with value: 0.202766379161958.
2026-06-01 15:59:43 | INFO | Trial 80 | outer=15 | hidden=[256, 64] epochs=264 lr=1.329e-04 wd=2.802e-04 n_pcs=1000 weight={'name': 'uniform'}
[I 2026-06-01 15:59:48,613] Trial 80 finished with value: 0.17315491681437817 and parameters: {'hidden_dims': '[256, 64]', 'dropout': 0.38662651099719797, 'batch_norm': False, 'lr': 0.00013288879369189458, 'weight_decay': 0.00028023573416940744, 'epochs': 264, 'loss': 'mae', 'optimizer': 'adam', 'use_snp_selection': False, 'n_pcs': 1000}. Best is trial 69 with value: 0.202766379161958.
2026-06-01 15:59:48 | INFO | Trial 81 | outer=15 | hidden=[1024, 256] epochs=299 lr=2.988e-04 wd=2.591e-04 n_pcs=1000 weight={'name': 'uniform'}
[I 2026-06-01 15:59:58,923] Trial 81 finished with value: 0.1717923005738714 and parameters: {'hidden_dims': '[1024, 256]', 'dropout': 0.3096288762966958, 'batch_norm': False, 'lr': 0.00029876274007543317, 'weight_decay': 0.00025905562556069705, 'epochs': 299, 'loss': 'mae', 'optimizer': 'adam', 'use_snp_selection': False, 'n_pcs': 1000}. Best is trial 69 with value: 0.202766379161958.
2026-06-01 15:59:58 | INFO | Trial 82 | outer=15 | hidden=[1024, 256] epochs=62 lr=2.380e-04 wd=2.005e-04 n_pcs=1000 weight={'name': 'uniform'}
[I 2026-06-01 16:00:02,349] Trial 82 finished with value: 0.18189929837544025 and parameters: {'hidden_dims': '[1024, 256]', 'dropout': 0.35464771021801106, 'batch_norm': False, 'lr': 0.0002380264034966438, 'weight_decay': 0.00020052266593806152, 'epochs': 62, 'loss': 'mae', 'optimizer': 'adam', 'use_snp_selection': False, 'n_pcs': 1000}. Best is trial 69 with value: 0.202766379161958.
2026-06-01 16:00:02 | INFO | Trial 83 | outer=15 | hidden=[1024, 256] epochs=241 lr=5.381e-05 wd=5.352e-04 n_pcs=1000 weight={'name': 'uniform'}
[I 2026-06-01 16:00:10,936] Trial 83 finished with value: 0.1669566412209788 and parameters: {'hidden_dims': '[1024, 256]', 'dropout': 0.33806049862317145, 'batch_norm': False, 'lr': 5.3806190796660094e-05, 'weight_decay': 0.0005351995683182862, 'epochs': 241, 'loss': 'mae', 'optimizer': 'adam', 'use_snp_selection': False, 'n_pcs': 1000}. Best is trial 69 with value: 0.202766379161958.
2026-06-01 16:00:10 | INFO | Trial 84 | outer=15 | hidden=[1024, 256] epochs=258 lr=6.691e-05 wd=8.399e-05 n_pcs=1500 weight={'name': 'uniform'}
[I 2026-06-01 16:00:22,077] Trial 84 finished with value: 0.19528677738882244 and parameters: {'hidden_dims': '[1024, 256]', 'dropout': 0.40147517762362417, 'batch_norm': False, 'lr': 6.691325941859877e-05, 'weight_decay': 8.398869146430775e-05, 'epochs': 258, 'loss': 'mae', 'optimizer': 'adam', 'use_snp_selection': False, 'n_pcs': 1500}. Best is trial 69 with value: 0.202766379161958.
2026-06-01 16:00:22 | INFO | Trial 85 | outer=15 | hidden=[256, 128] epochs=260 lr=6.568e-05 wd=8.453e-05 n_pcs=1500 weight={'name': 'uniform'}
[I 2026-06-01 16:00:27,069] Trial 85 finished with value: 0.1768742493455588 and parameters: {'hidden_dims': '[256, 128]', 'dropout': 0.40679327176088415, 'batch_norm': False, 'lr': 6.56778110007531e-05, 'weight_decay': 8.452677341456958e-05, 'epochs': 260, 'loss': 'mae', 'optimizer': 'adam', 'use_snp_selection': False, 'n_pcs': 1500}. Best is trial 69 with value: 0.202766379161958.
2026-06-01 16:00:27 | INFO | Trial 86 | outer=15 | hidden=[128, 64] epochs=273 lr=3.782e-05 wd=1.840e-05 n_pcs=1500 weight={'name': 'uniform'}
[I 2026-06-01 16:00:30,170] Trial 86 pruned. 
2026-06-01 16:00:30 | INFO | Trial 87 | outer=15 | hidden=[1024, 256] epochs=253 lr=4.477e-05 wd=3.099e-05 n_pcs=2000 weight={'name': 'uniform'}
[I 2026-06-01 16:00:43,583] Trial 87 finished with value: 0.19750082766519955 and parameters: {'hidden_dims': '[1024, 256]', 'dropout': 0.44010968849218146, 'batch_norm': False, 'lr': 4.47734058368034e-05, 'weight_decay': 3.098517371668773e-05, 'epochs': 253, 'loss': 'mae', 'optimizer': 'adam', 'use_snp_selection': False, 'n_pcs': 2000}. Best is trial 69 with value: 0.202766379161958.
2026-06-01 16:00:43 | INFO | Trial 88 | outer=15 | hidden=[512, 128] epochs=256 lr=4.550e-05 wd=3.348e-05 n_pcs=2000 weight={'name': 'uniform'}
[I 2026-06-01 16:00:50,840] Trial 88 finished with value: 0.20071537251088825 and parameters: {'hidden_dims': '[512, 128]', 'dropout': 0.4771337166765439, 'batch_norm': False, 'lr': 4.5495816430139366e-05, 'weight_decay': 3.347683316700162e-05, 'epochs': 256, 'loss': 'mae', 'optimizer': 'adam', 'use_snp_selection': False, 'n_pcs': 2000}. Best is trial 69 with value: 0.202766379161958.
2026-06-01 16:00:50 | INFO | Trial 89 | outer=15 | hidden=[512, 128] epochs=257 lr=4.404e-05 wd=3.901e-05 n_pcs=2500 weight={'name': 'uniform'}
[I 2026-06-01 16:00:59,130] Trial 89 finished with value: 0.18367415084491828 and parameters: {'hidden_dims': '[512, 128]', 'dropout': 0.4409410751369559, 'batch_norm': False, 'lr': 4.404043897635116e-05, 'weight_decay': 3.901103498825851e-05, 'epochs': 257, 'loss': 'mae', 'optimizer': 'adam', 'use_snp_selection': False, 'n_pcs': 2500}. Best is trial 69 with value: 0.202766379161958.
2026-06-01 16:00:59 | INFO | Trial 90 | outer=15 | hidden=[512, 128] epochs=244 lr=3.181e-05 wd=1.570e-08 n_pcs=2000 weight={'name': 'uniform'}
[I 2026-06-01 16:01:06,129] Trial 90 finished with value: 0.18078886683890133 and parameters: {'hidden_dims': '[512, 128]', 'dropout': 0.4822993907513621, 'batch_norm': False, 'lr': 3.1811009433748166e-05, 'weight_decay': 1.57002670025104e-08, 'epochs': 244, 'loss': 'mae', 'optimizer': 'adam', 'use_snp_selection': False, 'n_pcs': 2000}. Best is trial 69 with value: 0.202766379161958.
2026-06-01 16:01:06 | INFO | Trial 91 | outer=15 | hidden=[512, 128] epochs=256 lr=5.489e-05 wd=2.644e-05 n_pcs=2000 weight={'name': 'uniform'}
[I 2026-06-01 16:01:10,546] Trial 91 pruned. 
2026-06-01 16:01:10 | INFO | Trial 92 | outer=15 | hidden=[512, 128] epochs=281 lr=5.063e-05 wd=4.971e-05 n_pcs=2500 weight={'name': 'uniform'}
[I 2026-06-01 16:01:15,955] Trial 92 pruned. 
2026-06-01 16:01:15 | INFO | Trial 93 | outer=15 | hidden=[512, 64] epochs=270 lr=5.750e-05 wd=3.310e-05 n_pcs=2000 weight={'name': 'uniform'}
[I 2026-06-01 16:01:23,253] Trial 93 finished with value: 0.1982612170622008 and parameters: {'hidden_dims': '[512, 64]', 'dropout': 0.5202174219551828, 'batch_norm': False, 'lr': 5.7499761810967756e-05, 'weight_decay': 3.3098050837569425e-05, 'epochs': 270, 'loss': 'mae', 'optimizer': 'adam', 'use_snp_selection': False, 'n_pcs': 2000}. Best is trial 69 with value: 0.202766379161958.
2026-06-01 16:01:23 | INFO | Trial 94 | outer=15 | hidden=[512, 64] epochs=267 lr=3.882e-05 wd=6.571e-06 n_pcs=2000 weight={'name': 'uniform'}
[I 2026-06-01 16:01:30,503] Trial 94 finished with value: 0.16967685183509304 and parameters: {'hidden_dims': '[512, 64]', 'dropout': 0.5419582122141631, 'batch_norm': False, 'lr': 3.882351802823994e-05, 'weight_decay': 6.571418726382842e-06, 'epochs': 267, 'loss': 'mae', 'optimizer': 'adam', 'use_snp_selection': False, 'n_pcs': 2000}. Best is trial 69 with value: 0.202766379161958.
2026-06-01 16:01:30 | INFO | Trial 95 | outer=15 | hidden=[512, 64] epochs=275 lr=4.561e-05 wd=3.103e-05 n_pcs=2000 weight={'name': 'uniform'}
[I 2026-06-01 16:01:37,924] Trial 95 finished with value: 0.17536645473006263 and parameters: {'hidden_dims': '[512, 64]', 'dropout': 0.5720984621167876, 'batch_norm': False, 'lr': 4.560981012958532e-05, 'weight_decay': 3.103452743159628e-05, 'epochs': 275, 'loss': 'mae', 'optimizer': 'adam', 'use_snp_selection': False, 'n_pcs': 2000}. Best is trial 69 with value: 0.202766379161958.
2026-06-01 16:01:37 | INFO | Trial 96 | outer=15 | hidden=[512, 64] epochs=240 lr=7.518e-05 wd=4.327e-07 n_pcs=1500 weight={'name': 'uniform'}
[I 2026-06-01 16:01:43,761] Trial 96 finished with value: 0.18984269686939473 and parameters: {'hidden_dims': '[512, 64]', 'dropout': 0.5268902056715523, 'batch_norm': False, 'lr': 7.517555688875184e-05, 'weight_decay': 4.327484219848218e-07, 'epochs': 240, 'loss': 'mse', 'optimizer': 'adam', 'use_snp_selection': False, 'n_pcs': 1500}. Best is trial 69 with value: 0.202766379161958.
2026-06-01 16:01:43 | INFO | Trial 97 | outer=15 | hidden=[512, 64] epochs=248 lr=5.864e-05 wd=1.167e-05 n_pcs=2500 weight={'name': 'uniform'}
[I 2026-06-01 16:01:51,600] Trial 97 finished with value: 0.18733689299664802 and parameters: {'hidden_dims': '[512, 64]', 'dropout': 0.40049583455687304, 'batch_norm': False, 'lr': 5.864345230532816e-05, 'weight_decay': 1.1665708811751444e-05, 'epochs': 248, 'loss': 'mae', 'optimizer': 'adam', 'use_snp_selection': False, 'n_pcs': 2500}. Best is trial 69 with value: 0.202766379161958.
2026-06-01 16:01:51 | INFO | Trial 98 | outer=15 | hidden=[1024, 256] epochs=263 lr=1.107e-04 wd=2.046e-05 n_pcs=2000 weight={'name': 'uniform'}
[I 2026-06-01 16:02:05,494] Trial 98 finished with value: 0.18590721105067737 and parameters: {'hidden_dims': '[1024, 256]', 'dropout': 0.42964538946919023, 'batch_norm': False, 'lr': 0.00011065420144768524, 'weight_decay': 2.0462680464874628e-05, 'epochs': 263, 'loss': 'mae', 'optimizer': 'adam', 'use_snp_selection': False, 'n_pcs': 2000}. Best is trial 69 with value: 0.202766379161958.
2026-06-01 16:02:05 | INFO | Trial 99 | outer=15 | hidden=[512, 256] epochs=291 lr=6.556e-05 wd=1.436e-05 n_pcs=1500 weight={'name': 'uniform'}
[I 2026-06-01 16:02:13,072] Trial 99 finished with value: 0.18808331073001233 and parameters: {'hidden_dims': '[512, 256]', 'dropout': 0.48227513652497483, 'batch_norm': False, 'lr': 6.555954584334382e-05, 'weight_decay': 1.4356856501666572e-05, 'epochs': 291, 'loss': 'mae', 'optimizer': 'adam', 'use_snp_selection': False, 'n_pcs': 1500}. Best is trial 69 with value: 0.202766379161958.
2026-06-01 16:02:13 | INFO | Trial 100 | outer=15 | hidden=[1024, 256] epochs=270 lr=4.216e-05 wd=7.097e-05 n_pcs=1500 weight={'name': 'uniform'}
[I 2026-06-01 16:02:24,649] Trial 100 finished with value: 0.18427159355649594 and parameters: {'hidden_dims': '[1024, 256]', 'dropout': 0.45480058079079505, 'batch_norm': False, 'lr': 4.216421146735213e-05, 'weight_decay': 7.097446408027482e-05, 'epochs': 270, 'loss': 'mae', 'optimizer': 'adam', 'use_snp_selection': False, 'n_pcs': 1500}. Best is trial 69 with value: 0.202766379161958.
2026-06-01 16:02:24 | INFO | Trial 101 | outer=15 | hidden=[256, 64] epochs=232 lr=4.866e-05 wd=4.392e-05 n_pcs=2000 weight={'name': 'uniform'}
[I 2026-06-01 16:02:27,413] Trial 101 pruned. 
2026-06-01 16:02:27 | INFO | Trial 102 | outer=15 | hidden=[128, 64] epochs=260 lr=8.685e-05 wd=6.576e-05 n_pcs=3000 weight={'name': 'uniform'}
[I 2026-06-01 16:02:32,206] Trial 102 finished with value: 0.17674553102365131 and parameters: {'hidden_dims': '[128, 64]', 'dropout': 0.37209523604273587, 'batch_norm': False, 'lr': 8.685428855106961e-05, 'weight_decay': 6.576251659077688e-05, 'epochs': 260, 'loss': 'mae', 'optimizer': 'adam', 'use_snp_selection': False, 'n_pcs': 3000}. Best is trial 69 with value: 0.202766379161958.
2026-06-01 16:02:32 | INFO | Trial 103 | outer=15 | hidden=[1024, 256] epochs=253 lr=6.787e-05 wd=1.317e-04 n_pcs=1500 weight={'name': 'uniform'}
[I 2026-06-01 16:02:38,845] Trial 103 pruned. 
2026-06-01 16:02:38 | INFO | Trial 104 | outer=15 | hidden=[256, 64] epochs=227 lr=5.951e-05 wd=2.504e-05 n_pcs=1500 weight={'name': 'uniform'}
