[I 2026-06-01 15:32:30,785] Trial 29 finished with value: 0.18515822020729003 and parameters: {'hidden_dims': '[1024, 256]', 'dropout': 0.5982856027015098, 'batch_norm': False, 'lr': 0.00028993472997124853, 'weight_decay': 2.069176322216874e-05, 'epochs': 184, 'loss': 'mae', 'optimizer': 'adamw', 'use_snp_selection': False, 'n_pcs': 1500}. Best is trial 17 with value: 0.19945171985381954.
2026-06-01 15:32:30 | INFO | Trial 30 | outer=14 | hidden=[256, 64] epochs=95 lr=2.270e-04 wd=1.618e-06 n_pcs=4500 weight={'name': 'uniform'}
[I 2026-06-01 15:32:35,061] Trial 30 finished with value: 0.15454827479595484 and parameters: {'hidden_dims': '[256, 64]', 'dropout': 0.4717755062216572, 'batch_norm': False, 'lr': 0.00022703886697664923, 'weight_decay': 1.6176427169333544e-06, 'epochs': 95, 'loss': 'mse', 'optimizer': 'adamw', 'use_snp_selection': False, 'n_pcs': 4500}. Best is trial 17 with value: 0.19945171985381954.
2026-06-01 15:32:35 | INFO | Trial 31 | outer=14 | hidden=[1024, 256] epochs=63 lr=3.687e-04 wd=1.063e-08 n_pcs=4500 weight={'name': 'uniform'}
[I 2026-06-01 15:32:42,716] Trial 31 finished with value: 0.20060781150536813 and parameters: {'hidden_dims': '[1024, 256]', 'dropout': 0.52214740941299, 'batch_norm': False, 'lr': 0.0003687320606403515, 'weight_decay': 1.0629155153705722e-08, 'epochs': 63, 'loss': 'mse', 'optimizer': 'adamw', 'use_snp_selection': False, 'n_pcs': 4500}. Best is trial 31 with value: 0.20060781150536813.
2026-06-01 15:32:42 | INFO | Trial 32 | outer=14 | hidden=[1024, 256] epochs=61 lr=3.556e-04 wd=1.445e-08 n_pcs=4500 weight={'name': 'uniform'}
[I 2026-06-01 15:32:50,203] Trial 32 finished with value: 0.20516065035920028 and parameters: {'hidden_dims': '[1024, 256]', 'dropout': 0.5612056038589075, 'batch_norm': False, 'lr': 0.0003556198385994788, 'weight_decay': 1.4454658317519822e-08, 'epochs': 61, 'loss': 'mse', 'optimizer': 'adamw', 'use_snp_selection': False, 'n_pcs': 4500}. Best is trial 32 with value: 0.20516065035920028.
2026-06-01 15:32:50 | INFO | Trial 33 | outer=14 | hidden=[1024, 256] epochs=60 lr=9.470e-05 wd=1.657e-08 n_pcs=4500 weight={'name': 'uniform'}
[I 2026-06-01 15:32:57,605] Trial 33 finished with value: 0.17304323860694457 and parameters: {'hidden_dims': '[1024, 256]', 'dropout': 0.5266756341378809, 'batch_norm': False, 'lr': 9.470078362507614e-05, 'weight_decay': 1.6573300390201664e-08, 'epochs': 60, 'loss': 'mse', 'optimizer': 'adamw', 'use_snp_selection': False, 'n_pcs': 4500}. Best is trial 32 with value: 0.20516065035920028.
2026-06-01 15:32:57 | INFO | Trial 34 | outer=14 | hidden=[1024, 256] epochs=77 lr=1.478e-04 wd=1.017e-08 n_pcs=3500 weight={'name': 'uniform'}
[I 2026-06-01 15:33:05,019] Trial 34 finished with value: 0.19133824038862973 and parameters: {'hidden_dims': '[1024, 256]', 'dropout': 0.5636133214257063, 'batch_norm': False, 'lr': 0.0001478325478058167, 'weight_decay': 1.0168604606307086e-08, 'epochs': 77, 'loss': 'mse', 'optimizer': 'adamw', 'use_snp_selection': False, 'n_pcs': 3500}. Best is trial 32 with value: 0.20516065035920028.
2026-06-01 15:33:05 | INFO | Trial 35 | outer=14 | hidden=[1024, 256] epochs=50 lr=3.917e-04 wd=5.350e-08 n_pcs=500 weight={'name': 'uniform'}
[I 2026-06-01 15:33:07,605] Trial 35 finished with value: 0.19025704804261798 and parameters: {'hidden_dims': '[1024, 256]', 'dropout': 0.5125574367473972, 'batch_norm': False, 'lr': 0.0003916857882883054, 'weight_decay': 5.350265865119711e-08, 'epochs': 50, 'loss': 'mse', 'optimizer': 'adam', 'use_snp_selection': False, 'n_pcs': 500}. Best is trial 32 with value: 0.20516065035920028.
2026-06-01 15:33:07 | INFO | Trial 36 | outer=14 | hidden=[256, 64] epochs=68 lr=2.301e-04 wd=2.198e-07 n_pcs=2500 weight={'name': 'uniform'}
[I 2026-06-01 15:33:10,391] Trial 36 finished with value: 0.18176982788146706 and parameters: {'hidden_dims': '[256, 64]', 'dropout': 0.4551596283753147, 'batch_norm': False, 'lr': 0.00023010536360633615, 'weight_decay': 2.1983169608230684e-07, 'epochs': 68, 'loss': 'mae', 'optimizer': 'adamw', 'use_snp_selection': False, 'n_pcs': 2500}. Best is trial 32 with value: 0.20516065035920028.
2026-06-01 15:33:10 | INFO | Trial 37 | outer=14 | hidden=[1024, 256] epochs=237 lr=5.874e-05 wd=2.305e-08 n_pcs=3500 weight={'name': 'uniform'}
[I 2026-06-01 15:33:28,777] Trial 37 finished with value: 0.17322527193796924 and parameters: {'hidden_dims': '[1024, 256]', 'dropout': 0.5527334137140195, 'batch_norm': False, 'lr': 5.874324941253176e-05, 'weight_decay': 2.305417866914064e-08, 'epochs': 237, 'loss': 'mse', 'optimizer': 'adam', 'use_snp_selection': False, 'n_pcs': 3500}. Best is trial 32 with value: 0.20516065035920028.
2026-06-01 15:33:28 | INFO | Trial 38 | outer=14 | hidden=[512, 64] epochs=83 lr=3.712e-04 wd=5.653e-08 n_pcs=2000 weight={'name': 'uniform'}
[I 2026-06-01 15:33:32,258] Trial 38 finished with value: 0.1777987098883352 and parameters: {'hidden_dims': '[512, 64]', 'dropout': 0.34856701167391974, 'batch_norm': False, 'lr': 0.00037119670480020313, 'weight_decay': 5.653378976413249e-08, 'epochs': 83, 'loss': 'mse', 'optimizer': 'adamw', 'use_snp_selection': False, 'n_pcs': 2000}. Best is trial 32 with value: 0.20516065035920028.
2026-06-01 15:33:32 | INFO | Trial 39 | outer=14 | hidden=[256, 128] epochs=65 lr=3.781e-05 wd=1.200e-07 n_pcs=2500 weight={'name': 'uniform'}
[I 2026-06-01 15:33:33,942] Trial 39 pruned. 
2026-06-01 15:33:33 | INFO | Trial 40 | outer=14 | hidden=[1024, 256] epochs=133 lr=1.511e-04 wd=1.001e-08 n_pcs=4500 weight={'name': 'uniform'}
[I 2026-06-01 15:33:47,493] Trial 40 finished with value: 0.19871941772686735 and parameters: {'hidden_dims': '[1024, 256]', 'dropout': 0.2508688143510346, 'batch_norm': False, 'lr': 0.00015105363823475433, 'weight_decay': 1.000764085000092e-08, 'epochs': 133, 'loss': 'mae', 'optimizer': 'adam', 'use_snp_selection': False, 'n_pcs': 4500}. Best is trial 32 with value: 0.20516065035920028.
2026-06-01 15:33:47 | INFO | Trial 41 | outer=14 | hidden=[1024, 256] epochs=154 lr=1.551e-04 wd=2.087e-08 n_pcs=4500 weight={'name': 'uniform'}
[I 2026-06-01 15:34:02,811] Trial 41 finished with value: 0.20204277628094966 and parameters: {'hidden_dims': '[1024, 256]', 'dropout': 0.23896644254519755, 'batch_norm': False, 'lr': 0.0001550862355597251, 'weight_decay': 2.0866277558090066e-08, 'epochs': 154, 'loss': 'mae', 'optimizer': 'adam', 'use_snp_selection': False, 'n_pcs': 4500}. Best is trial 32 with value: 0.20516065035920028.
2026-06-01 15:34:02 | INFO | Trial 42 | outer=14 | hidden=[1024, 256] epochs=151 lr=1.553e-04 wd=2.049e-08 n_pcs=4500 weight={'name': 'uniform'}
[I 2026-06-01 15:34:17,887] Trial 42 finished with value: 0.1823551158453631 and parameters: {'hidden_dims': '[1024, 256]', 'dropout': 0.22122301041898848, 'batch_norm': False, 'lr': 0.00015531374743438613, 'weight_decay': 2.049443109478602e-08, 'epochs': 151, 'loss': 'mae', 'optimizer': 'adam', 'use_snp_selection': False, 'n_pcs': 4500}. Best is trial 32 with value: 0.20516065035920028.
2026-06-01 15:34:17 | INFO | Trial 43 | outer=14 | hidden=[1024, 256] epochs=190 lr=2.168e-04 wd=4.874e-08 n_pcs=5000 weight={'name': 'uniform'}
[I 2026-06-01 15:34:37,382] Trial 43 finished with value: 0.18442077213304678 and parameters: {'hidden_dims': '[1024, 256]', 'dropout': 0.27073795925212585, 'batch_norm': False, 'lr': 0.00021680401061478254, 'weight_decay': 4.873966888186888e-08, 'epochs': 190, 'loss': 'mae', 'optimizer': 'adam', 'use_snp_selection': False, 'n_pcs': 5000}. Best is trial 32 with value: 0.20516065035920028.
2026-06-01 15:34:37 | INFO | Trial 44 | outer=14 | hidden=[1024, 256] epochs=134 lr=3.264e-04 wd=8.310e-08 n_pcs=4500 weight={'name': 'uniform'}
[I 2026-06-01 15:34:51,044] Trial 44 finished with value: 0.20023991550143103 and parameters: {'hidden_dims': '[1024, 256]', 'dropout': 0.19654114929052888, 'batch_norm': False, 'lr': 0.000326374569736473, 'weight_decay': 8.30950277435404e-08, 'epochs': 134, 'loss': 'mae', 'optimizer': 'adam', 'use_snp_selection': False, 'n_pcs': 4500}. Best is trial 32 with value: 0.20516065035920028.
2026-06-01 15:34:51 | INFO | Trial 45 | outer=14 | hidden=[1024, 256] epochs=163 lr=3.137e-04 wd=3.401e-07 n_pcs=5000 weight={'name': 'uniform'}
[I 2026-06-01 15:35:08,126] Trial 45 finished with value: 0.18911278820736205 and parameters: {'hidden_dims': '[1024, 256]', 'dropout': 0.1481722691658535, 'batch_norm': False, 'lr': 0.00031371669211545513, 'weight_decay': 3.4014673639264795e-07, 'epochs': 163, 'loss': 'mae', 'optimizer': 'adam', 'use_snp_selection': False, 'n_pcs': 5000}. Best is trial 32 with value: 0.20516065035920028.
2026-06-01 15:35:08 | INFO | Trial 46 | outer=14 | hidden=[1024, 256] epochs=212 lr=1.030e-05 wd=9.358e-08 n_pcs=4500 weight={'name': 'uniform'}
[I 2026-06-01 15:35:28,343] Trial 46 finished with value: 0.1640731431146921 and parameters: {'hidden_dims': '[1024, 256]', 'dropout': 0.19020819670753866, 'batch_norm': False, 'lr': 1.0299678577025006e-05, 'weight_decay': 9.357934049730414e-08, 'epochs': 212, 'loss': 'mae', 'optimizer': 'adam', 'use_snp_selection': False, 'n_pcs': 4500}. Best is trial 32 with value: 0.20516065035920028.
2026-06-01 15:35:28 | INFO | Trial 47 | outer=14 | hidden=[128, 64] epochs=163 lr=4.300e-04 wd=7.594e-08 n_pcs=3500 weight={'name': 'uniform'}
[I 2026-06-01 15:35:32,293] Trial 47 finished with value: 0.18757456578493018 and parameters: {'hidden_dims': '[128, 64]', 'dropout': 0.07347765388715025, 'batch_norm': False, 'lr': 0.0004299987495850334, 'weight_decay': 7.594149270552843e-08, 'epochs': 163, 'loss': 'mae', 'optimizer': 'adam', 'use_snp_selection': False, 'n_pcs': 3500}. Best is trial 32 with value: 0.20516065035920028.
2026-06-01 15:35:32 | INFO | Trial 48 | outer=14 | hidden=[1024, 256] epochs=249 lr=3.576e-04 wd=3.602e-08 n_pcs=4000 weight={'name': 'uniform'}
[I 2026-06-01 15:35:53,232] Trial 48 finished with value: 0.19642047906489613 and parameters: {'hidden_dims': '[1024, 256]', 'dropout': 0.1472881536006735, 'batch_norm': False, 'lr': 0.00035761292682998184, 'weight_decay': 3.6017477040226535e-08, 'epochs': 249, 'loss': 'mae', 'optimizer': 'adam', 'use_snp_selection': False, 'n_pcs': 4000}. Best is trial 32 with value: 0.20516065035920028.
2026-06-01 15:35:53 | INFO | Trial 49 | outer=14 | hidden=[512, 256] epochs=155 lr=2.667e-04 wd=2.276e-08 n_pcs=5000 weight={'name': 'uniform'}
[I 2026-06-01 15:36:02,788] Trial 49 finished with value: 0.20176935503811774 and parameters: {'hidden_dims': '[512, 256]', 'dropout': 0.31765776641674537, 'batch_norm': False, 'lr': 0.0002667345358342356, 'weight_decay': 2.2763907483172532e-08, 'epochs': 155, 'loss': 'mae', 'optimizer': 'adam', 'use_snp_selection': False, 'n_pcs': 5000}. Best is trial 32 with value: 0.20516065035920028.
2026-06-01 15:36:02 | INFO | Trial 50 | outer=14 | hidden=[256, 64] epochs=177 lr=2.464e-04 wd=1.426e-07 n_pcs=5000 weight={'name': 'uniform'}
[I 2026-06-01 15:36:09,222] Trial 50 finished with value: 0.20475996648987532 and parameters: {'hidden_dims': '[256, 64]', 'dropout': 0.21141321891362794, 'batch_norm': False, 'lr': 0.000246361770264454, 'weight_decay': 1.4260201542488056e-07, 'epochs': 177, 'loss': 'mae', 'optimizer': 'adam', 'use_snp_selection': False, 'n_pcs': 5000}. Best is trial 32 with value: 0.20516065035920028.
2026-06-01 15:36:09 | INFO | Trial 51 | outer=14 | hidden=[256, 64] epochs=183 lr=2.614e-04 wd=1.623e-07 n_pcs=5000 weight={'name': 'uniform'}
[I 2026-06-01 15:36:15,797] Trial 51 finished with value: 0.19062780578266075 and parameters: {'hidden_dims': '[256, 64]', 'dropout': 0.21584803163767602, 'batch_norm': False, 'lr': 0.0002614418852697798, 'weight_decay': 1.6227678813093424e-07, 'epochs': 183, 'loss': 'mae', 'optimizer': 'adam', 'use_snp_selection': False, 'n_pcs': 5000}. Best is trial 32 with value: 0.20516065035920028.
2026-06-01 15:36:15 | INFO | Trial 52 | outer=14 | hidden=[256, 64] epochs=198 lr=2.107e-04 wd=2.041e-08 n_pcs=5000 weight={'name': 'uniform'}
[I 2026-06-01 15:36:22,724] Trial 52 finished with value: 0.18411793458726436 and parameters: {'hidden_dims': '[256, 64]', 'dropout': 0.3115040959941693, 'batch_norm': False, 'lr': 0.000210670413926893, 'weight_decay': 2.0405476172419075e-08, 'epochs': 198, 'loss': 'mae', 'optimizer': 'adam', 'use_snp_selection': False, 'n_pcs': 5000}. Best is trial 32 with value: 0.20516065035920028.
2026-06-01 15:36:22 | INFO | Trial 53 | outer=14 | hidden=[256, 64] epochs=153 lr=2.649e-04 wd=4.552e-08 n_pcs=4500 weight={'name': 'uniform'}
[I 2026-06-01 15:36:28,315] Trial 53 finished with value: 0.1808524841048103 and parameters: {'hidden_dims': '[256, 64]', 'dropout': 0.16958446917328712, 'batch_norm': False, 'lr': 0.0002648820530705753, 'weight_decay': 4.551768956435814e-08, 'epochs': 153, 'loss': 'mae', 'optimizer': 'adam', 'use_snp_selection': False, 'n_pcs': 4500}. Best is trial 32 with value: 0.20516065035920028.
2026-06-01 15:36:28 | INFO | Trial 54 | outer=14 | hidden=[512, 64] epochs=171 lr=1.875e-04 wd=1.937e-08 n_pcs=5000 weight={'name': 'uniform'}
[I 2026-06-01 15:36:38,058] Trial 54 finished with value: 0.19107590868993993 and parameters: {'hidden_dims': '[512, 64]', 'dropout': 0.21773859179865998, 'batch_norm': False, 'lr': 0.00018749527031063169, 'weight_decay': 1.937223883291034e-08, 'epochs': 171, 'loss': 'mae', 'optimizer': 'adam', 'use_snp_selection': False, 'n_pcs': 5000}. Best is trial 32 with value: 0.20516065035920028.
2026-06-01 15:36:38 | INFO | Trial 55 | outer=14 | hidden=[512, 256] epochs=220 lr=3.156e-04 wd=1.407e-07 n_pcs=5000 weight={'name': 'uniform'}
[I 2026-06-01 15:36:50,637] Trial 55 finished with value: 0.1934151668371376 and parameters: {'hidden_dims': '[512, 256]', 'dropout': 0.0932627583664693, 'batch_norm': False, 'lr': 0.00031558188868457704, 'weight_decay': 1.4074361448889554e-07, 'epochs': 220, 'loss': 'mae', 'optimizer': 'adam', 'use_snp_selection': False, 'n_pcs': 5000}. Best is trial 32 with value: 0.20516065035920028.
2026-06-01 15:36:50 | INFO | Trial 56 | outer=14 | hidden=[1024, 256] epochs=137 lr=3.630e-04 wd=3.274e-08 n_pcs=4000 weight={'name': 'uniform'}
[I 2026-06-01 15:37:03,186] Trial 56 finished with value: 0.19649016661238455 and parameters: {'hidden_dims': '[1024, 256]', 'dropout': 0.26597173206085867, 'batch_norm': False, 'lr': 0.000362969897073529, 'weight_decay': 3.2736981676959764e-08, 'epochs': 137, 'loss': 'mae', 'optimizer': 'adam', 'use_snp_selection': False, 'n_pcs': 4000}. Best is trial 32 with value: 0.20516065035920028.
2026-06-01 15:37:03 | INFO | Trial 57 | outer=14 | hidden=[256, 64] epochs=158 lr=4.482e-04 wd=3.625e-07 n_pcs=4500 weight={'name': 'uniform'}
[I 2026-06-01 15:37:06,653] Trial 57 pruned. 
2026-06-01 15:37:06 | INFO | Trial 58 | outer=14 | hidden=[128, 64] epochs=181 lr=2.532e-04 wd=8.270e-08 n_pcs=5000 weight={'name': 'uniform'}
[I 2026-06-01 15:37:11,310] Trial 58 finished with value: 0.19966786877931872 and parameters: {'hidden_dims': '[128, 64]', 'dropout': 0.2394675797451686, 'batch_norm': False, 'lr': 0.00025315704788494823, 'weight_decay': 8.269705865710595e-08, 'epochs': 181, 'loss': 'mae', 'optimizer': 'adam', 'use_snp_selection': False, 'n_pcs': 5000}. Best is trial 32 with value: 0.20516065035920028.
2026-06-01 15:37:11 | INFO | Trial 59 | outer=14 | hidden=[512, 256] epochs=108 lr=1.936e-04 wd=1.507e-08 n_pcs=4000 weight={'name': 'uniform'}
[I 2026-06-01 15:37:17,808] Trial 59 finished with value: 0.2037032167617001 and parameters: {'hidden_dims': '[512, 256]', 'dropout': 0.1974651872799097, 'batch_norm': False, 'lr': 0.00019356201355393186, 'weight_decay': 1.5068308286894667e-08, 'epochs': 108, 'loss': 'mae', 'optimizer': 'adam', 'use_snp_selection': False, 'n_pcs': 4000}. Best is trial 32 with value: 0.20516065035920028.
2026-06-01 15:37:17 | INFO | Trial 60 | outer=14 | hidden=[512, 256] epochs=113 lr=1.715e-04 wd=1.678e-08 n_pcs=3000 weight={'name': 'uniform'}
[I 2026-06-01 15:37:23,443] Trial 60 finished with value: 0.16597683680607503 and parameters: {'hidden_dims': '[512, 256]', 'dropout': 0.30167291120185424, 'batch_norm': False, 'lr': 0.0001715227398693971, 'weight_decay': 1.6782093874297877e-08, 'epochs': 113, 'loss': 'mae', 'optimizer': 'adam', 'use_snp_selection': False, 'n_pcs': 3000}. Best is trial 32 with value: 0.20516065035920028.
2026-06-01 15:37:23 | INFO | Trial 61 | outer=14 | hidden=[512, 256] epochs=123 lr=1.956e-04 wd=2.568e-08 n_pcs=4500 weight={'name': 'uniform'}
[I 2026-06-01 15:37:31,173] Trial 61 finished with value: 0.18904502356533331 and parameters: {'hidden_dims': '[512, 256]', 'dropout': 0.18901143484312188, 'batch_norm': False, 'lr': 0.00019561200113255047, 'weight_decay': 2.5675432573510933e-08, 'epochs': 123, 'loss': 'mae', 'optimizer': 'adam', 'use_snp_selection': False, 'n_pcs': 4500}. Best is trial 32 with value: 0.20516065035920028.
2026-06-01 15:37:31 | INFO | Trial 62 | outer=14 | hidden=[512, 256] epochs=108 lr=2.927e-04 wd=1.468e-08 n_pcs=4000 weight={'name': 'uniform'}
[I 2026-06-01 15:37:37,682] Trial 62 finished with value: 0.18339452811795745 and parameters: {'hidden_dims': '[512, 256]', 'dropout': 0.17182748267358863, 'batch_norm': False, 'lr': 0.00029267861491886826, 'weight_decay': 1.4682927968368766e-08, 'epochs': 108, 'loss': 'mae', 'optimizer': 'adam', 'use_snp_selection': False, 'n_pcs': 4000}. Best is trial 32 with value: 0.20516065035920028.
2026-06-01 15:37:37 | INFO | Trial 63 | outer=14 | hidden=[512, 256] epochs=145 lr=2.493e-04 wd=4.308e-08 n_pcs=4500 weight={'name': 'uniform'}
[I 2026-06-01 15:37:46,389] Trial 63 finished with value: 0.19174640113659344 and parameters: {'hidden_dims': '[512, 256]', 'dropout': 0.21245436829489642, 'batch_norm': False, 'lr': 0.00024926424494715616, 'weight_decay': 4.3076601548181596e-08, 'epochs': 145, 'loss': 'mae', 'optimizer': 'adam', 'use_snp_selection': False, 'n_pcs': 4500}. Best is trial 32 with value: 0.20516065035920028.
2026-06-01 15:37:46 | INFO | Trial 64 | outer=14 | hidden=[1024, 256] epochs=174 lr=1.321e-04 wd=6.918e-08 n_pcs=5000 weight={'name': 'uniform'}
[I 2026-06-01 15:38:04,502] Trial 64 finished with value: 0.19561114552339193 and parameters: {'hidden_dims': '[1024, 256]', 'dropout': 0.2893964466864116, 'batch_norm': False, 'lr': 0.00013205629944049166, 'weight_decay': 6.918098952500254e-08, 'epochs': 174, 'loss': 'mae', 'optimizer': 'adam', 'use_snp_selection': False, 'n_pcs': 5000}. Best is trial 32 with value: 0.20516065035920028.
2026-06-01 15:38:04 | INFO | Trial 65 | outer=14 | hidden=[512, 128] epochs=128 lr=3.277e-04 wd=2.623e-08 n_pcs=4500 weight={'name': 'uniform'}
[I 2026-06-01 15:38:12,167] Trial 65 finished with value: 0.1956287988035057 and parameters: {'hidden_dims': '[512, 128]', 'dropout': 0.04204227923791537, 'batch_norm': False, 'lr': 0.0003276583014462193, 'weight_decay': 2.6228638312109337e-08, 'epochs': 128, 'loss': 'mae', 'optimizer': 'adam', 'use_snp_selection': False, 'n_pcs': 4500}. Best is trial 32 with value: 0.20516065035920028.
2026-06-01 15:38:12 | INFO | Trial 66 | outer=14 | hidden=[512, 256] epochs=137 lr=4.086e-04 wd=3.432e-06 n_pcs=4000 weight={'name': 'uniform'}
[I 2026-06-01 15:38:19,862] Trial 66 finished with value: 0.18670037325988792 and parameters: {'hidden_dims': '[512, 256]', 'dropout': 0.23460647285474728, 'batch_norm': False, 'lr': 0.00040862306137965716, 'weight_decay': 3.432395686721205e-06, 'epochs': 137, 'loss': 'mae', 'optimizer': 'adam', 'use_snp_selection': False, 'n_pcs': 4000}. Best is trial 32 with value: 0.20516065035920028.
2026-06-01 15:38:19 | INFO | Trial 67 | outer=14 | hidden=[1024, 256] epochs=85 lr=9.801e-05 wd=1.454e-08 n_pcs=5000 weight={'name': 'uniform'}
[I 2026-06-01 15:38:29,977] Trial 67 finished with value: 0.18221639638063525 and parameters: {'hidden_dims': '[1024, 256]', 'dropout': 0.5735695425684408, 'batch_norm': False, 'lr': 9.801112564340087e-05, 'weight_decay': 1.4536214459798872e-08, 'epochs': 85, 'loss': 'mae', 'optimizer': 'adam', 'use_snp_selection': False, 'n_pcs': 5000}. Best is trial 32 with value: 0.20516065035920028.
2026-06-01 15:38:29 | INFO | Trial 68 | outer=14 | hidden=[1024, 256] epochs=154 lr=2.081e-04 wd=1.265e-06 n_pcs=4500 weight={'name': 'uniform'}
[I 2026-06-01 15:38:45,315] Trial 68 finished with value: 0.18879821813604544 and parameters: {'hidden_dims': '[1024, 256]', 'dropout': 0.1473585987087173, 'batch_norm': False, 'lr': 0.00020805220438983646, 'weight_decay': 1.2653681538130658e-06, 'epochs': 154, 'loss': 'mae', 'optimizer': 'adam', 'use_snp_selection': False, 'n_pcs': 4500}. Best is trial 32 with value: 0.20516065035920028.
2026-06-01 15:38:45 | INFO | Trial 69 | outer=14 | hidden=[256, 64] epochs=122 lr=7.579e-05 wd=3.530e-08 n_pcs=3500 weight={'name': 'uniform'}
[I 2026-06-01 15:38:49,536] Trial 69 finished with value: 0.18352574675044922 and parameters: {'hidden_dims': '[256, 64]', 'dropout': 0.34534051519826214, 'batch_norm': False, 'lr': 7.579170083624393e-05, 'weight_decay': 3.53047708486637e-08, 'epochs': 122, 'loss': 'mae', 'optimizer': 'adam', 'use_snp_selection': False, 'n_pcs': 3500}. Best is trial 32 with value: 0.20516065035920028.
2026-06-01 15:38:49 | INFO | Trial 70 | outer=14 | hidden=[512, 64] epochs=78 lr=1.632e-04 wd=4.558e-04 n_pcs=4000 weight={'name': 'uniform'}
[I 2026-06-01 15:38:54,577] Trial 70 finished with value: 0.1885016898965531 and parameters: {'hidden_dims': '[512, 64]', 'dropout': 0.2111138635075405, 'batch_norm': False, 'lr': 0.0001632347136260926, 'weight_decay': 0.0004558476022454299, 'epochs': 78, 'loss': 'mae', 'optimizer': 'adam', 'use_snp_selection': False, 'n_pcs': 4000}. Best is trial 32 with value: 0.20516065035920028.
2026-06-01 15:38:54 | INFO | Trial 71 | outer=14 | hidden=[512, 256] epochs=179 lr=2.455e-04 wd=9.010e-08 n_pcs=5000 weight={'name': 'uniform'}
