[I 2026-06-01 14:47:55,120] Trial 91 finished with value: 0.19395719650283788 and parameters: {'hidden_dims': '[1024, 256]', 'dropout': 0.5347514488516173, 'batch_norm': False, 'lr': 0.00018546819892380058, 'weight_decay': 1.6610485740348767e-06, 'epochs': 206, 'loss': 'mae', 'optimizer': 'adam', 'use_snp_selection': False, 'n_pcs': 1000}. Best is trial 72 with value: 0.2100215564874496.
2026-06-01 14:47:55 | INFO | Trial 92 | outer=11 | hidden=[512, 256] epochs=165 lr=1.568e-04 wd=2.582e-06 n_pcs=1000 weight={'name': 'uniform'}
[I 2026-06-01 14:47:59,675] Trial 92 finished with value: 0.20356434242166035 and parameters: {'hidden_dims': '[512, 256]', 'dropout': 0.4611294362418625, 'batch_norm': False, 'lr': 0.000156837257571798, 'weight_decay': 2.5822812672135588e-06, 'epochs': 165, 'loss': 'mae', 'optimizer': 'adam', 'use_snp_selection': False, 'n_pcs': 1000}. Best is trial 72 with value: 0.2100215564874496.
2026-06-01 14:47:59 | INFO | Trial 93 | outer=11 | hidden=[512, 128] epochs=166 lr=1.539e-04 wd=2.302e-06 n_pcs=2500 weight={'name': 'uniform'}
[I 2026-06-01 14:48:06,043] Trial 93 finished with value: 0.1850145993343138 and parameters: {'hidden_dims': '[512, 128]', 'dropout': 0.4620430968084103, 'batch_norm': False, 'lr': 0.00015390671686038037, 'weight_decay': 2.302068255253379e-06, 'epochs': 166, 'loss': 'mae', 'optimizer': 'adam', 'use_snp_selection': False, 'n_pcs': 2500}. Best is trial 72 with value: 0.2100215564874496.
2026-06-01 14:48:06 | INFO | Trial 94 | outer=11 | hidden=[256, 64] epochs=178 lr=1.385e-04 wd=3.517e-06 n_pcs=500 weight={'name': 'uniform'}
[I 2026-06-01 14:48:09,823] Trial 94 finished with value: 0.16888270623466548 and parameters: {'hidden_dims': '[256, 64]', 'dropout': 0.05047678055016755, 'batch_norm': False, 'lr': 0.00013845193787158087, 'weight_decay': 3.51704682485324e-06, 'epochs': 178, 'loss': 'mae', 'optimizer': 'adam', 'use_snp_selection': False, 'n_pcs': 500}. Best is trial 72 with value: 0.2100215564874496.
2026-06-01 14:48:09 | INFO | Trial 95 | outer=11 | hidden=[1024, 256] epochs=152 lr=1.953e-05 wd=8.023e-06 n_pcs=1500 weight={'name': 'uniform'}
[I 2026-06-01 14:48:14,442] Trial 95 pruned. 
2026-06-01 14:48:14 | INFO | Trial 96 | outer=11 | hidden=[128, 64] epochs=191 lr=7.792e-05 wd=3.770e-08 n_pcs=2000 weight={'name': 'uniform'}
[I 2026-06-01 14:48:18,697] Trial 96 finished with value: 0.18378182800432158 and parameters: {'hidden_dims': '[128, 64]', 'dropout': 0.18940242650123748, 'batch_norm': False, 'lr': 7.792340018553337e-05, 'weight_decay': 3.7703116064301825e-08, 'epochs': 191, 'loss': 'mae', 'optimizer': 'adam', 'use_snp_selection': False, 'n_pcs': 2000}. Best is trial 72 with value: 0.2100215564874496.
2026-06-01 14:48:18 | INFO | Trial 97 | outer=11 | hidden=[512, 256] epochs=163 lr=1.281e-04 wd=1.277e-05 n_pcs=1000 weight={'name': 'uniform'}
[I 2026-06-01 14:48:23,216] Trial 97 finished with value: 0.20676848943546475 and parameters: {'hidden_dims': '[512, 256]', 'dropout': 0.44850106562315634, 'batch_norm': False, 'lr': 0.00012807489762213485, 'weight_decay': 1.2772035201157167e-05, 'epochs': 163, 'loss': 'mae', 'optimizer': 'adam', 'use_snp_selection': False, 'n_pcs': 1000}. Best is trial 72 with value: 0.2100215564874496.
2026-06-01 14:48:23 | INFO | Trial 98 | outer=11 | hidden=[512, 256] epochs=160 lr=1.256e-04 wd=3.656e-05 n_pcs=1000 weight={'name': 'uniform'}
[I 2026-06-01 14:48:27,666] Trial 98 finished with value: 0.20234336515300894 and parameters: {'hidden_dims': '[512, 256]', 'dropout': 0.4376636260234698, 'batch_norm': False, 'lr': 0.0001256029952783894, 'weight_decay': 3.655914359655934e-05, 'epochs': 160, 'loss': 'mae', 'optimizer': 'adam', 'use_snp_selection': False, 'n_pcs': 1000}. Best is trial 72 with value: 0.2100215564874496.
2026-06-01 14:48:27 | INFO | Trial 99 | outer=11 | hidden=[512, 256] epochs=175 lr=1.263e-04 wd=2.533e-05 n_pcs=1000 weight={'name': 'uniform'}
[I 2026-06-01 14:48:32,401] Trial 99 finished with value: 0.18428409083297975 and parameters: {'hidden_dims': '[512, 256]', 'dropout': 0.44851788964049677, 'batch_norm': False, 'lr': 0.00012630716688546206, 'weight_decay': 2.53291510438371e-05, 'epochs': 175, 'loss': 'mae', 'optimizer': 'adam', 'use_snp_selection': False, 'n_pcs': 1000}. Best is trial 72 with value: 0.2100215564874496.
2026-06-01 14:48:32 | INFO | Trial 100 | outer=11 | hidden=[512, 256] epochs=145 lr=1.577e-04 wd=5.767e-05 n_pcs=500 weight={'name': 'uniform'}
[I 2026-06-01 14:48:35,910] Trial 100 finished with value: 0.18655468280215257 and parameters: {'hidden_dims': '[512, 256]', 'dropout': 0.46472194332155714, 'batch_norm': False, 'lr': 0.0001577195010329081, 'weight_decay': 5.7672958609184036e-05, 'epochs': 145, 'loss': 'mae', 'optimizer': 'adam', 'use_snp_selection': False, 'n_pcs': 500}. Best is trial 72 with value: 0.2100215564874496.
2026-06-01 14:48:35 | INFO | Trial 101 | outer=11 | hidden=[512, 256] epochs=156 lr=9.466e-05 wd=3.936e-05 n_pcs=1000 weight={'name': 'uniform'}
[I 2026-06-01 14:48:40,291] Trial 101 finished with value: 0.18803966013032056 and parameters: {'hidden_dims': '[512, 256]', 'dropout': 0.42874601638120213, 'batch_norm': False, 'lr': 9.465597413983208e-05, 'weight_decay': 3.9357968722016784e-05, 'epochs': 156, 'loss': 'mae', 'optimizer': 'adam', 'use_snp_selection': False, 'n_pcs': 1000}. Best is trial 72 with value: 0.2100215564874496.
2026-06-01 14:48:40 | INFO | Trial 102 | outer=11 | hidden=[512, 256] epochs=161 lr=1.101e-04 wd=2.133e-05 n_pcs=1000 weight={'name': 'uniform'}
[I 2026-06-01 14:48:44,776] Trial 102 finished with value: 0.21095734031917818 and parameters: {'hidden_dims': '[512, 256]', 'dropout': 0.43564147518759627, 'batch_norm': False, 'lr': 0.00011012467282175815, 'weight_decay': 2.1330154376256272e-05, 'epochs': 161, 'loss': 'mae', 'optimizer': 'adam', 'use_snp_selection': False, 'n_pcs': 1000}. Best is trial 102 with value: 0.21095734031917818.
2026-06-01 14:48:44 | INFO | Trial 103 | outer=11 | hidden=[512, 256] epochs=202 lr=1.077e-04 wd=2.372e-05 n_pcs=1000 weight={'name': 'uniform'}
[I 2026-06-01 14:48:49,977] Trial 103 finished with value: 0.20643006104144668 and parameters: {'hidden_dims': '[512, 256]', 'dropout': 0.47511810106299623, 'batch_norm': False, 'lr': 0.00010772185728704472, 'weight_decay': 2.3721709892426742e-05, 'epochs': 202, 'loss': 'mae', 'optimizer': 'adam', 'use_snp_selection': False, 'n_pcs': 1000}. Best is trial 102 with value: 0.21095734031917818.
2026-06-01 14:48:49 | INFO | Trial 104 | outer=11 | hidden=[512, 256] epochs=221 lr=1.117e-04 wd=1.170e-05 n_pcs=1000 weight={'name': 'uniform'}
[I 2026-06-01 14:48:55,527] Trial 104 finished with value: 0.19199219750514543 and parameters: {'hidden_dims': '[512, 256]', 'dropout': 0.4750121876700308, 'batch_norm': False, 'lr': 0.00011170193013246445, 'weight_decay': 1.1696354582032423e-05, 'epochs': 221, 'loss': 'mae', 'optimizer': 'adam', 'use_snp_selection': False, 'n_pcs': 1000}. Best is trial 102 with value: 0.21095734031917818.
2026-06-01 14:48:55 | INFO | Trial 105 | outer=11 | hidden=[512, 256] epochs=213 lr=1.212e-04 wd=2.460e-05 n_pcs=1000 weight={'name': 'uniform'}
[I 2026-06-01 14:49:00,942] Trial 105 finished with value: 0.2098319668468743 and parameters: {'hidden_dims': '[512, 256]', 'dropout': 0.433919739543724, 'batch_norm': False, 'lr': 0.00012115036969716577, 'weight_decay': 2.4604089715598283e-05, 'epochs': 213, 'loss': 'mae', 'optimizer': 'adam', 'use_snp_selection': False, 'n_pcs': 1000}. Best is trial 102 with value: 0.21095734031917818.
2026-06-01 14:49:00 | INFO | Trial 106 | outer=11 | hidden=[512, 256] epochs=182 lr=1.214e-04 wd=2.112e-05 n_pcs=1000 weight={'name': 'uniform'}
[I 2026-06-01 14:49:05,778] Trial 106 finished with value: 0.18662713735275066 and parameters: {'hidden_dims': '[512, 256]', 'dropout': 0.4002787293905853, 'batch_norm': False, 'lr': 0.00012140418900864644, 'weight_decay': 2.1119782345423984e-05, 'epochs': 182, 'loss': 'mae', 'optimizer': 'adam', 'use_snp_selection': False, 'n_pcs': 1000}. Best is trial 102 with value: 0.21095734031917818.
2026-06-01 14:49:05 | INFO | Trial 107 | outer=11 | hidden=[512, 256] epochs=199 lr=1.049e-04 wd=1.298e-05 n_pcs=1000 weight={'name': 'uniform'}
[I 2026-06-01 14:49:10,947] Trial 107 finished with value: 0.2130216801215427 and parameters: {'hidden_dims': '[512, 256]', 'dropout': 0.4386631674732557, 'batch_norm': False, 'lr': 0.00010494232955383234, 'weight_decay': 1.298313222730759e-05, 'epochs': 199, 'loss': 'mae', 'optimizer': 'adam', 'use_snp_selection': False, 'n_pcs': 1000}. Best is trial 107 with value: 0.2130216801215427.
2026-06-01 14:49:10 | INFO | Trial 108 | outer=11 | hidden=[512, 256] epochs=201 lr=1.069e-04 wd=1.429e-05 n_pcs=1000 weight={'name': 'uniform'}
[I 2026-06-01 14:49:16,165] Trial 108 finished with value: 0.19386749058331115 and parameters: {'hidden_dims': '[512, 256]', 'dropout': 0.43890850797125375, 'batch_norm': False, 'lr': 0.00010690099968480545, 'weight_decay': 1.428700857473119e-05, 'epochs': 201, 'loss': 'mae', 'optimizer': 'adam', 'use_snp_selection': False, 'n_pcs': 1000}. Best is trial 107 with value: 0.2130216801215427.
2026-06-01 14:49:16 | INFO | Trial 109 | outer=11 | hidden=[512, 256] epochs=215 lr=1.375e-04 wd=2.684e-05 n_pcs=500 weight={'name': 'uniform'}
[I 2026-06-01 14:49:20,637] Trial 109 finished with value: 0.1936782941642582 and parameters: {'hidden_dims': '[512, 256]', 'dropout': 0.42124443777710796, 'batch_norm': False, 'lr': 0.00013754337824989506, 'weight_decay': 2.6836762076045808e-05, 'epochs': 215, 'loss': 'mae', 'optimizer': 'adam', 'use_snp_selection': False, 'n_pcs': 500}. Best is trial 107 with value: 0.2130216801215427.
2026-06-01 14:49:20 | INFO | Trial 110 | outer=11 | hidden=[512, 256] epochs=209 lr=9.887e-05 wd=1.032e-04 n_pcs=1000 weight={'name': 'uniform'}
[I 2026-06-01 14:49:24,385] Trial 110 pruned. 
2026-06-01 14:49:24 | INFO | Trial 111 | outer=11 | hidden=[512, 256] epochs=202 lr=1.476e-04 wd=1.449e-05 n_pcs=1000 weight={'name': 'uniform'}
[I 2026-06-01 14:49:29,585] Trial 111 finished with value: 0.19769002271390923 and parameters: {'hidden_dims': '[512, 256]', 'dropout': 0.4521450352113065, 'batch_norm': False, 'lr': 0.00014762249705902594, 'weight_decay': 1.4491887216214882e-05, 'epochs': 202, 'loss': 'mae', 'optimizer': 'adam', 'use_snp_selection': False, 'n_pcs': 1000}. Best is trial 107 with value: 0.2130216801215427.
2026-06-01 14:49:29 | INFO | Trial 112 | outer=11 | hidden=[512, 256] epochs=195 lr=1.644e-04 wd=5.462e-05 n_pcs=500 weight={'name': 'uniform'}
[I 2026-06-01 14:49:33,781] Trial 112 finished with value: 0.19475350298951932 and parameters: {'hidden_dims': '[512, 256]', 'dropout': 0.5297340431321899, 'batch_norm': False, 'lr': 0.0001643817766262961, 'weight_decay': 5.461835006681753e-05, 'epochs': 195, 'loss': 'mae', 'optimizer': 'adam', 'use_snp_selection': False, 'n_pcs': 500}. Best is trial 107 with value: 0.2130216801215427.
2026-06-01 14:49:33 | INFO | Trial 113 | outer=11 | hidden=[512, 256] epochs=184 lr=1.155e-04 wd=3.309e-05 n_pcs=1000 weight={'name': 'uniform'}
[I 2026-06-01 14:49:38,676] Trial 113 finished with value: 0.1912144913129792 and parameters: {'hidden_dims': '[512, 256]', 'dropout': 0.47191309137441584, 'batch_norm': False, 'lr': 0.00011546138848154039, 'weight_decay': 3.308946376730924e-05, 'epochs': 184, 'loss': 'mae', 'optimizer': 'adam', 'use_snp_selection': False, 'n_pcs': 1000}. Best is trial 107 with value: 0.2130216801215427.
2026-06-01 14:49:38 | INFO | Trial 114 | outer=11 | hidden=[512, 256] epochs=161 lr=1.319e-04 wd=7.107e-06 n_pcs=1000 weight={'name': 'uniform'}
[I 2026-06-01 14:49:43,185] Trial 114 finished with value: 0.19718904365611192 and parameters: {'hidden_dims': '[512, 256]', 'dropout': 0.43550370027052904, 'batch_norm': False, 'lr': 0.00013187783982540017, 'weight_decay': 7.106638349662717e-06, 'epochs': 161, 'loss': 'mae', 'optimizer': 'adam', 'use_snp_selection': False, 'n_pcs': 1000}. Best is trial 107 with value: 0.2130216801215427.
2026-06-01 14:49:43 | INFO | Trial 115 | outer=11 | hidden=[512, 256] epochs=191 lr=8.965e-05 wd=7.628e-05 n_pcs=1500 weight={'name': 'uniform'}
[I 2026-06-01 14:49:49,140] Trial 115 finished with value: 0.18081794785574581 and parameters: {'hidden_dims': '[512, 256]', 'dropout': 0.49848646399561103, 'batch_norm': False, 'lr': 8.96498613336039e-05, 'weight_decay': 7.628176426077382e-05, 'epochs': 191, 'loss': 'mae', 'optimizer': 'adam', 'use_snp_selection': False, 'n_pcs': 1500}. Best is trial 107 with value: 0.2130216801215427.
2026-06-01 14:49:49 | INFO | Trial 116 | outer=11 | hidden=[512, 256] epochs=210 lr=1.080e-04 wd=4.208e-05 n_pcs=1000 weight={'name': 'uniform'}
[I 2026-06-01 14:49:54,486] Trial 116 finished with value: 0.19831515932985844 and parameters: {'hidden_dims': '[512, 256]', 'dropout': 0.4562044804700712, 'batch_norm': False, 'lr': 0.00010799526622296378, 'weight_decay': 4.208058315751178e-05, 'epochs': 210, 'loss': 'mae', 'optimizer': 'adam', 'use_snp_selection': False, 'n_pcs': 1000}. Best is trial 107 with value: 0.2130216801215427.
2026-06-01 14:49:54 | INFO | Trial 117 | outer=11 | hidden=[512, 256] epochs=200 lr=1.469e-04 wd=2.120e-05 n_pcs=500 weight={'name': 'uniform'}
[I 2026-06-01 14:49:58,706] Trial 117 finished with value: 0.19807510978974083 and parameters: {'hidden_dims': '[512, 256]', 'dropout': 0.44326331297236243, 'batch_norm': False, 'lr': 0.00014689707556094812, 'weight_decay': 2.1204114729957335e-05, 'epochs': 200, 'loss': 'mae', 'optimizer': 'adam', 'use_snp_selection': False, 'n_pcs': 500}. Best is trial 107 with value: 0.2130216801215427.
2026-06-01 14:49:58 | INFO | Trial 118 | outer=11 | hidden=[512, 256] epochs=170 lr=1.716e-04 wd=2.345e-05 n_pcs=1000 weight={'name': 'uniform'}
[I 2026-06-01 14:50:03,350] Trial 118 finished with value: 0.17923554853728288 and parameters: {'hidden_dims': '[512, 256]', 'dropout': 0.39755762403769224, 'batch_norm': False, 'lr': 0.00017158659275649227, 'weight_decay': 2.345310780912636e-05, 'epochs': 170, 'loss': 'mae', 'optimizer': 'adam', 'use_snp_selection': False, 'n_pcs': 1000}. Best is trial 107 with value: 0.2130216801215427.
2026-06-01 14:50:03 | INFO | Trial 119 | outer=11 | hidden=[512, 256] epochs=236 lr=8.340e-05 wd=1.320e-05 n_pcs=1500 weight={'name': 'uniform'}
[I 2026-06-01 14:50:10,286] Trial 119 finished with value: 0.19211732605435622 and parameters: {'hidden_dims': '[512, 256]', 'dropout': 0.4697828420675756, 'batch_norm': False, 'lr': 8.340455528040494e-05, 'weight_decay': 1.3199905947385973e-05, 'epochs': 236, 'loss': 'mae', 'optimizer': 'adam', 'use_snp_selection': False, 'n_pcs': 1500}. Best is trial 107 with value: 0.2130216801215427.
2026-06-01 14:50:10 | INFO | Trial 120 | outer=11 | hidden=[512, 256] epochs=164 lr=9.878e-05 wd=5.123e-06 n_pcs=1000 weight={'name': 'uniform'}
[I 2026-06-01 14:50:14,827] Trial 120 finished with value: 0.2026432885960979 and parameters: {'hidden_dims': '[512, 256]', 'dropout': 0.4233496691966598, 'batch_norm': False, 'lr': 9.877758010349868e-05, 'weight_decay': 5.122787934636799e-06, 'epochs': 164, 'loss': 'mae', 'optimizer': 'adam', 'use_snp_selection': False, 'n_pcs': 1000}. Best is trial 107 with value: 0.2130216801215427.
2026-06-01 14:50:14 | INFO | Trial 121 | outer=11 | hidden=[512, 256] epochs=173 lr=9.934e-05 wd=9.604e-06 n_pcs=1000 weight={'name': 'uniform'}
[I 2026-06-01 14:50:19,553] Trial 121 finished with value: 0.21629387946261183 and parameters: {'hidden_dims': '[512, 256]', 'dropout': 0.42639866917000446, 'batch_norm': False, 'lr': 9.934053214720901e-05, 'weight_decay': 9.60416888326054e-06, 'epochs': 173, 'loss': 'mae', 'optimizer': 'adam', 'use_snp_selection': False, 'n_pcs': 1000}. Best is trial 121 with value: 0.21629387946261183.
2026-06-01 14:50:19 | INFO | Trial 122 | outer=11 | hidden=[512, 256] epochs=176 lr=1.009e-04 wd=5.078e-06 n_pcs=1000 weight={'name': 'uniform'}
[I 2026-06-01 14:50:24,309] Trial 122 finished with value: 0.181854512890212 and parameters: {'hidden_dims': '[512, 256]', 'dropout': 0.42189412307303553, 'batch_norm': False, 'lr': 0.00010094932169539389, 'weight_decay': 5.077546737566286e-06, 'epochs': 176, 'loss': 'mae', 'optimizer': 'adam', 'use_snp_selection': False, 'n_pcs': 1000}. Best is trial 121 with value: 0.21629387946261183.
2026-06-01 14:50:24 | INFO | Trial 123 | outer=11 | hidden=[512, 256] epochs=165 lr=7.144e-05 wd=9.017e-06 n_pcs=1000 weight={'name': 'uniform'}
[I 2026-06-01 14:50:28,892] Trial 123 finished with value: 0.21297014108210913 and parameters: {'hidden_dims': '[512, 256]', 'dropout': 0.3863845227498312, 'batch_norm': False, 'lr': 7.143785541151276e-05, 'weight_decay': 9.017051041438801e-06, 'epochs': 165, 'loss': 'mae', 'optimizer': 'adam', 'use_snp_selection': False, 'n_pcs': 1000}. Best is trial 121 with value: 0.21629387946261183.
2026-06-01 14:50:28 | INFO | Trial 124 | outer=11 | hidden=[512, 256] epochs=163 lr=6.544e-05 wd=8.858e-06 n_pcs=500 weight={'name': 'uniform'}
[I 2026-06-01 14:50:32,640] Trial 124 finished with value: 0.19874951794175696 and parameters: {'hidden_dims': '[512, 256]', 'dropout': 0.4149416857576081, 'batch_norm': False, 'lr': 6.544175437175822e-05, 'weight_decay': 8.858198022759528e-06, 'epochs': 163, 'loss': 'mae', 'optimizer': 'adam', 'use_snp_selection': False, 'n_pcs': 500}. Best is trial 121 with value: 0.21629387946261183.
2026-06-01 14:50:32 | INFO | Trial 125 | outer=11 | hidden=[512, 256] epochs=165 lr=7.185e-05 wd=1.052e-05 n_pcs=1000 weight={'name': 'uniform'}
[I 2026-06-01 14:50:37,219] Trial 125 finished with value: 0.18793119089398097 and parameters: {'hidden_dims': '[512, 256]', 'dropout': 0.3822230963052018, 'batch_norm': False, 'lr': 7.184694836068771e-05, 'weight_decay': 1.0519599234480867e-05, 'epochs': 165, 'loss': 'mae', 'optimizer': 'adam', 'use_snp_selection': False, 'n_pcs': 1000}. Best is trial 121 with value: 0.21629387946261183.
2026-06-01 14:50:37 | INFO | Trial 126 | outer=11 | hidden=[512, 256] epochs=153 lr=8.671e-05 wd=3.091e-05 n_pcs=1000 weight={'name': 'uniform'}
[I 2026-06-01 14:50:41,585] Trial 126 finished with value: 0.19005906704700387 and parameters: {'hidden_dims': '[512, 256]', 'dropout': 0.3936388815419316, 'batch_norm': False, 'lr': 8.6712605923633e-05, 'weight_decay': 3.0910553705237064e-05, 'epochs': 153, 'loss': 'mae', 'optimizer': 'adam', 'use_snp_selection': False, 'n_pcs': 1000}. Best is trial 121 with value: 0.21629387946261183.
2026-06-01 14:50:41 | INFO | Trial 127 | outer=11 | hidden=[512, 256] epochs=159 lr=9.547e-05 wd=6.404e-06 n_pcs=1000 weight={'name': 'uniform'}
[I 2026-06-01 14:50:46,047] Trial 127 finished with value: 0.19760019901585713 and parameters: {'hidden_dims': '[512, 256]', 'dropout': 0.4394279005657098, 'batch_norm': False, 'lr': 9.547393356033662e-05, 'weight_decay': 6.404301502766285e-06, 'epochs': 159, 'loss': 'mae', 'optimizer': 'adam', 'use_snp_selection': False, 'n_pcs': 1000}. Best is trial 121 with value: 0.21629387946261183.
2026-06-01 14:50:46 | INFO | Trial 128 | outer=11 | hidden=[256, 128] epochs=170 lr=1.145e-04 wd=1.735e-05 n_pcs=500 weight={'name': 'uniform'}
[I 2026-06-01 14:50:49,665] Trial 128 finished with value: 0.1930619183897898 and parameters: {'hidden_dims': '[256, 128]', 'dropout': 0.3673489441754651, 'batch_norm': False, 'lr': 0.00011448976355233436, 'weight_decay': 1.735089462017932e-05, 'epochs': 170, 'loss': 'mae', 'optimizer': 'adam', 'use_snp_selection': False, 'n_pcs': 500}. Best is trial 121 with value: 0.21629387946261183.
2026-06-01 14:50:49 | INFO | Trial 129 | outer=11 | hidden=[512, 256] epochs=148 lr=7.684e-05 wd=1.588e-05 n_pcs=1000 weight={'name': 'uniform'}
[I 2026-06-01 14:50:53,916] Trial 129 finished with value: 0.18226538042211288 and parameters: {'hidden_dims': '[512, 256]', 'dropout': 0.42388636799666435, 'batch_norm': False, 'lr': 7.683790842004197e-05, 'weight_decay': 1.588059912759174e-05, 'epochs': 148, 'loss': 'mae', 'optimizer': 'adam', 'use_snp_selection': False, 'n_pcs': 1000}. Best is trial 121 with value: 0.21629387946261183.
2026-06-01 14:50:53 | INFO | Trial 130 | outer=11 | hidden=[512, 64] epochs=180 lr=1.056e-04 wd=4.000e-06 n_pcs=1000 weight={'name': 'uniform'}
[I 2026-06-01 14:50:58,123] Trial 130 finished with value: 0.19647351971318675 and parameters: {'hidden_dims': '[512, 64]', 'dropout': 0.44658452245708796, 'batch_norm': False, 'lr': 0.00010556818804892386, 'weight_decay': 3.99984497897512e-06, 'epochs': 180, 'loss': 'mae', 'optimizer': 'adam', 'use_snp_selection': False, 'n_pcs': 1000}. Best is trial 121 with value: 0.21629387946261183.
2026-06-01 14:50:58 | INFO | Trial 131 | outer=11 | hidden=[512, 256] epochs=186 lr=1.248e-04 wd=2.960e-06 n_pcs=1000 weight={'name': 'uniform'}
[I 2026-06-01 14:51:03,039] Trial 131 finished with value: 0.19329818588175912 and parameters: {'hidden_dims': '[512, 256]', 'dropout': 0.4871230806213326, 'batch_norm': False, 'lr': 0.0001247931191741616, 'weight_decay': 2.9599155545722793e-06, 'epochs': 186, 'loss': 'mae', 'optimizer': 'adam', 'use_snp_selection': False, 'n_pcs': 1000}. Best is trial 121 with value: 0.21629387946261183.
2026-06-01 14:51:03 | INFO | Trial 132 | outer=11 | hidden=[512, 256] epochs=191 lr=1.230e-04 wd=8.512e-06 n_pcs=1500 weight={'name': 'uniform'}
[I 2026-06-01 14:51:08,980] Trial 132 finished with value: 0.1768909497036637 and parameters: {'hidden_dims': '[512, 256]', 'dropout': 0.4045781458803358, 'batch_norm': False, 'lr': 0.00012300067121501844, 'weight_decay': 8.511613755713474e-06, 'epochs': 191, 'loss': 'mae', 'optimizer': 'adam', 'use_snp_selection': False, 'n_pcs': 1500}. Best is trial 121 with value: 0.21629387946261183.
2026-06-01 14:51:08 | INFO | Trial 133 | outer=11 | hidden=[256, 128] epochs=174 lr=1.344e-04 wd=6.432e-06 n_pcs=1000 weight={'name': 'uniform'}
