[I 2026-06-01 14:25:43,050] Trial 25 finished with value: 0.17421355862320262 and parameters: {'hidden_dims': '[256, 64]', 'dropout': 0.4743806656701142, 'batch_norm': False, 'lr': 0.00030592092010051206, 'weight_decay': 3.038639080878546e-07, 'epochs': 198, 'loss': 'mae', 'optimizer': 'adamw', 'use_snp_selection': False, 'n_pcs': 3500}. Best is trial 13 with value: 0.20607333657125215.
2026-06-01 14:25:43 | INFO | Trial 26 | outer=10 | hidden=[512, 64] epochs=115 lr=4.840e-04 wd=4.252e-08 n_pcs=1000 weight={'name': 'uniform'}
[I 2026-06-01 14:25:46,325] Trial 26 finished with value: 0.18983110750354412 and parameters: {'hidden_dims': '[512, 64]', 'dropout': 0.5579172283680757, 'batch_norm': False, 'lr': 0.0004839656915551397, 'weight_decay': 4.251676639259512e-08, 'epochs': 115, 'loss': 'mae', 'optimizer': 'adamw', 'use_snp_selection': False, 'n_pcs': 1000}. Best is trial 13 with value: 0.20607333657125215.
2026-06-01 14:25:46 | INFO | Trial 27 | outer=10 | hidden=[256, 64] epochs=148 lr=1.679e-04 wd=2.921e-07 n_pcs=2500 weight={'name': 'uniform'}
[I 2026-06-01 14:25:50,397] Trial 27 finished with value: 0.1613349582283195 and parameters: {'hidden_dims': '[256, 64]', 'dropout': 0.39113305193528586, 'batch_norm': False, 'lr': 0.00016794513771772356, 'weight_decay': 2.920953601546122e-07, 'epochs': 148, 'loss': 'mae', 'optimizer': 'adam', 'use_snp_selection': False, 'n_pcs': 2500}. Best is trial 13 with value: 0.20607333657125215.
2026-06-01 14:25:50 | INFO | Trial 28 | outer=10 | hidden=[512, 128] epochs=194 lr=6.038e-05 wd=5.466e-08 n_pcs=4500 weight={'name': 'uniform'}
[I 2026-06-01 14:26:01,491] Trial 28 finished with value: 0.1988443246909802 and parameters: {'hidden_dims': '[512, 128]', 'dropout': 0.49121134883958106, 'batch_norm': False, 'lr': 6.0379959384620195e-05, 'weight_decay': 5.4657761659861786e-08, 'epochs': 194, 'loss': 'mae', 'optimizer': 'adamw', 'use_snp_selection': False, 'n_pcs': 4500}. Best is trial 13 with value: 0.20607333657125215.
2026-06-01 14:26:01 | INFO | Trial 29 | outer=10 | hidden=[512, 128] epochs=195 lr=5.999e-05 wd=1.498e-06 n_pcs=4500 weight={'name': 'uniform'}
[I 2026-06-01 14:26:12,672] Trial 29 finished with value: 0.19437659508755553 and parameters: {'hidden_dims': '[512, 128]', 'dropout': 0.34702396611416564, 'batch_norm': False, 'lr': 5.998850743257e-05, 'weight_decay': 1.4977346031605366e-06, 'epochs': 195, 'loss': 'mae', 'optimizer': 'adamw', 'use_snp_selection': False, 'n_pcs': 4500}. Best is trial 13 with value: 0.20607333657125215.
2026-06-01 14:26:12 | INFO | Trial 30 | outer=10 | hidden=[512, 128] epochs=220 lr=4.359e-05 wd=1.020e-07 n_pcs=1000 weight={'name': 'uniform'}
[I 2026-06-01 14:26:17,688] Trial 30 finished with value: 0.19109328373692155 and parameters: {'hidden_dims': '[512, 128]', 'dropout': 0.43038679032223504, 'batch_norm': False, 'lr': 4.359117743351319e-05, 'weight_decay': 1.0200323534784603e-07, 'epochs': 220, 'loss': 'mae', 'optimizer': 'adamw', 'use_snp_selection': False, 'n_pcs': 1000}. Best is trial 13 with value: 0.20607333657125215.
2026-06-01 14:26:17 | INFO | Trial 31 | outer=10 | hidden=[512, 128] epochs=193 lr=9.325e-05 wd=1.419e-06 n_pcs=4500 weight={'name': 'uniform'}
[I 2026-06-01 14:26:28,774] Trial 31 finished with value: 0.18025231823114646 and parameters: {'hidden_dims': '[512, 128]', 'dropout': 0.337980117905617, 'batch_norm': False, 'lr': 9.325323200119389e-05, 'weight_decay': 1.4193488547485244e-06, 'epochs': 193, 'loss': 'mae', 'optimizer': 'adamw', 'use_snp_selection': False, 'n_pcs': 4500}. Best is trial 13 with value: 0.20607333657125215.
2026-06-01 14:26:28 | INFO | Trial 32 | outer=10 | hidden=[512, 128] epochs=188 lr=6.570e-05 wd=2.639e-05 n_pcs=4500 weight={'name': 'uniform'}
[I 2026-06-01 14:26:39,641] Trial 32 finished with value: 0.17631025245139836 and parameters: {'hidden_dims': '[512, 128]', 'dropout': 0.4788934435683856, 'batch_norm': False, 'lr': 6.570490813448454e-05, 'weight_decay': 2.638544994720361e-05, 'epochs': 188, 'loss': 'mae', 'optimizer': 'adamw', 'use_snp_selection': False, 'n_pcs': 4500}. Best is trial 13 with value: 0.20607333657125215.
2026-06-01 14:26:39 | INFO | Trial 33 | outer=10 | hidden=[512, 128] epochs=261 lr=3.716e-05 wd=5.191e-04 n_pcs=4500 weight={'name': 'uniform'}
[I 2026-06-01 14:26:53,881] Trial 33 finished with value: 0.16879991998242194 and parameters: {'hidden_dims': '[512, 128]', 'dropout': 0.23479715924383554, 'batch_norm': False, 'lr': 3.716483908499579e-05, 'weight_decay': 0.0005191199591811132, 'epochs': 261, 'loss': 'mae', 'optimizer': 'adamw', 'use_snp_selection': False, 'n_pcs': 4500}. Best is trial 13 with value: 0.20607333657125215.
2026-06-01 14:26:53 | INFO | Trial 34 | outer=10 | hidden=[1024, 256] epochs=221 lr=5.908e-05 wd=2.576e-07 n_pcs=2000 weight={'name': 'uniform'}
[I 2026-06-01 14:27:07,036] Trial 34 finished with value: 0.17695758322653704 and parameters: {'hidden_dims': '[1024, 256]', 'dropout': 0.3352988651408603, 'batch_norm': False, 'lr': 5.908244141151402e-05, 'weight_decay': 2.576001786187768e-07, 'epochs': 221, 'loss': 'mse', 'optimizer': 'adamw', 'use_snp_selection': False, 'n_pcs': 2000}. Best is trial 13 with value: 0.20607333657125215.
2026-06-01 14:27:07 | INFO | Trial 35 | outer=10 | hidden=[512, 128] epochs=155 lr=1.760e-04 wd=1.940e-08 n_pcs=5000 weight={'name': 'uniform'}
[I 2026-06-01 14:27:16,931] Trial 35 finished with value: 0.20252366881825107 and parameters: {'hidden_dims': '[512, 128]', 'dropout': 0.4437761209099359, 'batch_norm': False, 'lr': 0.0001760389053704505, 'weight_decay': 1.9402270351667533e-08, 'epochs': 155, 'loss': 'mae', 'optimizer': 'adam', 'use_snp_selection': False, 'n_pcs': 5000}. Best is trial 13 with value: 0.20607333657125215.
2026-06-01 14:27:16 | INFO | Trial 36 | outer=10 | hidden=[256, 64] epochs=71 lr=2.964e-04 wd=2.097e-08 n_pcs=5000 weight={'name': 'uniform'}
[I 2026-06-01 14:27:21,050] Trial 36 finished with value: 0.18603593978412122 and parameters: {'hidden_dims': '[256, 64]', 'dropout': 0.4488354426111739, 'batch_norm': False, 'lr': 0.0002963672337922891, 'weight_decay': 2.096535570953567e-08, 'epochs': 71, 'loss': 'mae', 'optimizer': 'adam', 'use_snp_selection': False, 'n_pcs': 5000}. Best is trial 13 with value: 0.20607333657125215.
2026-06-01 14:27:21 | INFO | Trial 37 | outer=10 | hidden=[256, 128] epochs=156 lr=1.799e-04 wd=6.874e-08 n_pcs=5000 weight={'name': 'uniform'}
[I 2026-06-01 14:27:27,430] Trial 37 finished with value: 0.19021051896679234 and parameters: {'hidden_dims': '[256, 128]', 'dropout': 0.4049806350044957, 'batch_norm': False, 'lr': 0.00017994888065931075, 'weight_decay': 6.874375165579095e-08, 'epochs': 156, 'loss': 'mse', 'optimizer': 'adam', 'use_snp_selection': False, 'n_pcs': 5000}. Best is trial 13 with value: 0.20607333657125215.
2026-06-01 14:27:27 | INFO | Trial 38 | outer=10 | hidden=[512, 128] epochs=111 lr=7.417e-05 wd=1.010e-08 n_pcs=2500 weight={'name': 'uniform'}
[I 2026-06-01 14:27:32,326] Trial 38 finished with value: 0.19736835070155964 and parameters: {'hidden_dims': '[512, 128]', 'dropout': 0.5020364675360471, 'batch_norm': False, 'lr': 7.417054479958781e-05, 'weight_decay': 1.010390416047598e-08, 'epochs': 111, 'loss': 'mae', 'optimizer': 'adam', 'use_snp_selection': False, 'n_pcs': 2500}. Best is trial 13 with value: 0.20607333657125215.
2026-06-01 14:27:32 | INFO | Trial 39 | outer=10 | hidden=[512, 256] epochs=132 lr=1.818e-04 wd=1.439e-07 n_pcs=3000 weight={'name': 'uniform'}
[I 2026-06-01 14:27:38,849] Trial 39 finished with value: 0.16976247551172743 and parameters: {'hidden_dims': '[512, 256]', 'dropout': 0.5611052142433243, 'batch_norm': False, 'lr': 0.0001817645154731492, 'weight_decay': 1.4392691019889782e-07, 'epochs': 132, 'loss': 'mse', 'optimizer': 'adam', 'use_snp_selection': False, 'n_pcs': 3000}. Best is trial 13 with value: 0.20607333657125215.
2026-06-01 14:27:38 | INFO | Trial 40 | outer=10 | hidden=[256, 64] epochs=210 lr=1.226e-04 wd=1.960e-08 n_pcs=4000 weight={'name': 'uniform'}
[I 2026-06-01 14:27:45,455] Trial 40 finished with value: 0.17384627459438812 and parameters: {'hidden_dims': '[256, 64]', 'dropout': 0.5691994638760882, 'batch_norm': False, 'lr': 0.00012257946716195625, 'weight_decay': 1.9601423695695636e-08, 'epochs': 210, 'loss': 'mae', 'optimizer': 'adam', 'use_snp_selection': False, 'n_pcs': 4000}. Best is trial 13 with value: 0.20607333657125215.
2026-06-01 14:27:45 | INFO | Trial 41 | outer=10 | hidden=[512, 128] epochs=97 lr=7.500e-05 wd=1.078e-08 n_pcs=2000 weight={'name': 'uniform'}
[I 2026-06-01 14:27:49,503] Trial 41 finished with value: 0.15607810115970402 and parameters: {'hidden_dims': '[512, 128]', 'dropout': 0.5021540763467233, 'batch_norm': False, 'lr': 7.499826014913749e-05, 'weight_decay': 1.0778462681067747e-08, 'epochs': 97, 'loss': 'mae', 'optimizer': 'adam', 'use_snp_selection': False, 'n_pcs': 2000}. Best is trial 13 with value: 0.20607333657125215.
2026-06-01 14:27:49 | INFO | Trial 42 | outer=10 | hidden=[512, 128] epochs=111 lr=4.137e-05 wd=7.010e-08 n_pcs=2500 weight={'name': 'uniform'}
[I 2026-06-01 14:27:54,399] Trial 42 finished with value: 0.1779688053958225 and parameters: {'hidden_dims': '[512, 128]', 'dropout': 0.485330561380016, 'batch_norm': False, 'lr': 4.136596080549538e-05, 'weight_decay': 7.009627815184532e-08, 'epochs': 111, 'loss': 'mae', 'optimizer': 'adam', 'use_snp_selection': False, 'n_pcs': 2500}. Best is trial 13 with value: 0.20607333657125215.
2026-06-01 14:27:54 | INFO | Trial 43 | outer=10 | hidden=[512, 128] epochs=72 lr=3.124e-05 wd=1.838e-08 n_pcs=2500 weight={'name': 'uniform'}
[I 2026-06-01 14:27:57,091] Trial 43 pruned. 
2026-06-01 14:27:57 | INFO | Trial 44 | outer=10 | hidden=[512, 128] epochs=149 lr=8.586e-05 wd=3.780e-08 n_pcs=3000 weight={'name': 'uniform'}
[I 2026-06-01 14:28:03,856] Trial 44 finished with value: 0.18268033473120604 and parameters: {'hidden_dims': '[512, 128]', 'dropout': 0.4509309646009051, 'batch_norm': False, 'lr': 8.58582518405107e-05, 'weight_decay': 3.780063576221177e-08, 'epochs': 149, 'loss': 'mae', 'optimizer': 'adam', 'use_snp_selection': False, 'n_pcs': 3000}. Best is trial 13 with value: 0.20607333657125215.
2026-06-01 14:28:03 | INFO | Trial 45 | outer=10 | hidden=[1024, 256] epochs=166 lr=1.537e-04 wd=1.596e-08 n_pcs=1500 weight={'name': 'uniform'}
[I 2026-06-01 14:28:12,230] Trial 45 finished with value: 0.1818623057240013 and parameters: {'hidden_dims': '[1024, 256]', 'dropout': 0.49911477719131386, 'batch_norm': False, 'lr': 0.0001537059072605559, 'weight_decay': 1.5960835357623213e-08, 'epochs': 166, 'loss': 'mse', 'optimizer': 'adam', 'use_snp_selection': False, 'n_pcs': 1500}. Best is trial 13 with value: 0.20607333657125215.
2026-06-01 14:28:12 | INFO | Trial 46 | outer=10 | hidden=[128, 64] epochs=74 lr=1.030e-05 wd=7.280e-08 n_pcs=1500 weight={'name': 'uniform'}
[I 2026-06-01 14:28:13,774] Trial 46 pruned. 
2026-06-01 14:28:13 | INFO | Trial 47 | outer=10 | hidden=[512, 128] epochs=138 lr=2.654e-04 wd=3.520e-08 n_pcs=2000 weight={'name': 'uniform'}
[I 2026-06-01 14:28:18,771] Trial 47 finished with value: 0.18083482808576118 and parameters: {'hidden_dims': '[512, 128]', 'dropout': 0.5944928872207353, 'batch_norm': False, 'lr': 0.00026543517903783063, 'weight_decay': 3.520338256924736e-08, 'epochs': 138, 'loss': 'mae', 'optimizer': 'adam', 'use_snp_selection': False, 'n_pcs': 2000}. Best is trial 13 with value: 0.20607333657125215.
2026-06-01 14:28:18 | INFO | Trial 48 | outer=10 | hidden=[256, 64] epochs=179 lr=2.317e-05 wd=1.022e-08 n_pcs=1000 weight={'name': 'uniform'}
[I 2026-06-01 14:28:20,986] Trial 48 pruned. 
2026-06-01 14:28:21 | INFO | Trial 49 | outer=10 | hidden=[256, 128] epochs=104 lr=1.405e-04 wd=1.856e-07 n_pcs=2500 weight={'name': 'uniform'}
[I 2026-06-01 14:28:23,765] Trial 49 pruned. 
2026-06-01 14:28:23 | INFO | Trial 50 | outer=10 | hidden=[512, 128] epochs=84 lr=4.825e-05 wd=1.617e-08 n_pcs=5000 weight={'name': 'uniform'}
[I 2026-06-01 14:28:30,190] Trial 50 finished with value: 0.18921330205551257 and parameters: {'hidden_dims': '[512, 128]', 'dropout': 0.3857807874985572, 'batch_norm': False, 'lr': 4.825460872475504e-05, 'weight_decay': 1.6170444902417326e-08, 'epochs': 84, 'loss': 'mse', 'optimizer': 'adamw', 'use_snp_selection': False, 'n_pcs': 5000}. Best is trial 13 with value: 0.20607333657125215.
2026-06-01 14:28:30 | INFO | Trial 51 | outer=10 | hidden=[512, 128] epochs=187 lr=7.452e-05 wd=1.375e-04 n_pcs=4500 weight={'name': 'uniform'}
[I 2026-06-01 14:28:40,952] Trial 51 finished with value: 0.20266226613370503 and parameters: {'hidden_dims': '[512, 128]', 'dropout': 0.3500645994149325, 'batch_norm': False, 'lr': 7.451554996436886e-05, 'weight_decay': 0.00013754354174782486, 'epochs': 187, 'loss': 'mae', 'optimizer': 'adamw', 'use_snp_selection': False, 'n_pcs': 4500}. Best is trial 13 with value: 0.20607333657125215.
2026-06-01 14:28:40 | INFO | Trial 52 | outer=10 | hidden=[512, 128] epochs=185 lr=7.631e-05 wd=1.193e-04 n_pcs=4500 weight={'name': 'uniform'}
[I 2026-06-01 14:28:51,633] Trial 52 finished with value: 0.20287082619845406 and parameters: {'hidden_dims': '[512, 128]', 'dropout': 0.3592228843867078, 'batch_norm': False, 'lr': 7.630505722978536e-05, 'weight_decay': 0.00011925986954177309, 'epochs': 185, 'loss': 'mae', 'optimizer': 'adamw', 'use_snp_selection': False, 'n_pcs': 4500}. Best is trial 13 with value: 0.20607333657125215.
2026-06-01 14:28:51 | INFO | Trial 53 | outer=10 | hidden=[512, 128] epochs=205 lr=9.825e-05 wd=1.815e-04 n_pcs=4500 weight={'name': 'uniform'}
[I 2026-06-01 14:29:03,257] Trial 53 finished with value: 0.19512134935637135 and parameters: {'hidden_dims': '[512, 128]', 'dropout': 0.25491509959242836, 'batch_norm': False, 'lr': 9.824867092515246e-05, 'weight_decay': 0.00018149812498393416, 'epochs': 205, 'loss': 'mae', 'optimizer': 'adamw', 'use_snp_selection': False, 'n_pcs': 4500}. Best is trial 13 with value: 0.20607333657125215.
2026-06-01 14:29:03 | INFO | Trial 54 | outer=10 | hidden=[512, 256] epochs=185 lr=1.204e-04 wd=1.287e-04 n_pcs=4500 weight={'name': 'uniform'}
[I 2026-06-01 14:29:14,417] Trial 54 finished with value: 0.18586267330760617 and parameters: {'hidden_dims': '[512, 256]', 'dropout': 0.3098134796731844, 'batch_norm': False, 'lr': 0.00012037780775601167, 'weight_decay': 0.00012870182976194936, 'epochs': 185, 'loss': 'mae', 'optimizer': 'adamw', 'use_snp_selection': False, 'n_pcs': 4500}. Best is trial 13 with value: 0.20607333657125215.
2026-06-01 14:29:14 | INFO | Trial 55 | outer=10 | hidden=[128, 64] epochs=163 lr=1.931e-04 wd=1.025e-05 n_pcs=4000 weight={'name': 'uniform'}
[I 2026-06-01 14:29:18,552] Trial 55 finished with value: 0.1855367121009388 and parameters: {'hidden_dims': '[128, 64]', 'dropout': 0.36336957328576835, 'batch_norm': False, 'lr': 0.00019308503887641152, 'weight_decay': 1.024941699727957e-05, 'epochs': 163, 'loss': 'mae', 'optimizer': 'adamw', 'use_snp_selection': False, 'n_pcs': 4000}. Best is trial 13 with value: 0.20607333657125215.
2026-06-01 14:29:18 | INFO | Trial 56 | outer=10 | hidden=[256, 64] epochs=227 lr=4.902e-05 wd=1.482e-04 n_pcs=4000 weight={'name': 'uniform'}
[I 2026-06-01 14:29:25,508] Trial 56 finished with value: 0.1809286637995968 and parameters: {'hidden_dims': '[256, 64]', 'dropout': 0.3994601893760879, 'batch_norm': False, 'lr': 4.901942300029014e-05, 'weight_decay': 0.00014824288193413833, 'epochs': 227, 'loss': 'mae', 'optimizer': 'adamw', 'use_snp_selection': False, 'n_pcs': 4000}. Best is trial 13 with value: 0.20607333657125215.
2026-06-01 14:29:25 | INFO | Trial 57 | outer=10 | hidden=[512, 128] epochs=206 lr=8.159e-05 wd=3.226e-04 n_pcs=5000 weight={'name': 'uniform'}
[I 2026-06-01 14:29:37,857] Trial 57 finished with value: 0.1886817664715743 and parameters: {'hidden_dims': '[512, 128]', 'dropout': 0.28697107291685436, 'batch_norm': False, 'lr': 8.159461121254163e-05, 'weight_decay': 0.0003225745470607436, 'epochs': 206, 'loss': 'mae', 'optimizer': 'adamw', 'use_snp_selection': False, 'n_pcs': 5000}. Best is trial 13 with value: 0.20607333657125215.
2026-06-01 14:29:37 | INFO | Trial 58 | outer=10 | hidden=[256, 64] epochs=169 lr=1.350e-04 wd=5.754e-05 n_pcs=4500 weight={'name': 'uniform'}
[I 2026-06-01 14:29:44,176] Trial 58 finished with value: 0.19460060494767734 and parameters: {'hidden_dims': '[256, 64]', 'dropout': 0.31938504433573545, 'batch_norm': False, 'lr': 0.0001350467434359707, 'weight_decay': 5.7536563407542557e-05, 'epochs': 169, 'loss': 'mae', 'optimizer': 'adamw', 'use_snp_selection': False, 'n_pcs': 4500}. Best is trial 13 with value: 0.20607333657125215.
2026-06-01 14:29:44 | INFO | Trial 59 | outer=10 | hidden=[1024, 256] epochs=214 lr=3.399e-05 wd=1.814e-05 n_pcs=5000 weight={'name': 'uniform'}
[I 2026-06-01 14:30:07,504] Trial 59 finished with value: 0.17252101283578963 and parameters: {'hidden_dims': '[1024, 256]', 'dropout': 0.45817509111349997, 'batch_norm': False, 'lr': 3.3992745277095824e-05, 'weight_decay': 1.813905705946905e-05, 'epochs': 214, 'loss': 'mae', 'optimizer': 'adamw', 'use_snp_selection': False, 'n_pcs': 5000}. Best is trial 13 with value: 0.20607333657125215.
2026-06-01 14:30:07 | INFO | Trial 60 | outer=10 | hidden=[512, 128] epochs=234 lr=2.528e-05 wd=8.919e-04 n_pcs=3500 weight={'name': 'uniform'}
[I 2026-06-01 14:30:18,272] Trial 60 finished with value: 0.1733291443595748 and parameters: {'hidden_dims': '[512, 128]', 'dropout': 0.3591807127496446, 'batch_norm': False, 'lr': 2.5283738982157017e-05, 'weight_decay': 0.000891904852083247, 'epochs': 234, 'loss': 'mae', 'optimizer': 'adamw', 'use_snp_selection': False, 'n_pcs': 3500}. Best is trial 13 with value: 0.20607333657125215.
2026-06-01 14:30:18 | INFO | Trial 61 | outer=10 | hidden=[512, 128] epochs=183 lr=7.383e-05 wd=6.805e-05 n_pcs=1500 weight={'name': 'uniform'}
[I 2026-06-01 14:30:23,613] Trial 61 finished with value: 0.18546737681705755 and parameters: {'hidden_dims': '[512, 128]', 'dropout': 0.4092572687145355, 'batch_norm': False, 'lr': 7.383095489413896e-05, 'weight_decay': 6.804911950554994e-05, 'epochs': 183, 'loss': 'mae', 'optimizer': 'adamw', 'use_snp_selection': False, 'n_pcs': 1500}. Best is trial 13 with value: 0.20607333657125215.
2026-06-01 14:30:23 | INFO | Trial 62 | outer=10 | hidden=[512, 128] epochs=63 lr=5.145e-05 wd=2.903e-06 n_pcs=4500 weight={'name': 'uniform'}
[I 2026-06-01 14:30:26,707] Trial 62 pruned. 
2026-06-01 14:30:26 | INFO | Trial 63 | outer=10 | hidden=[512, 128] epochs=198 lr=6.710e-05 wd=3.107e-08 n_pcs=2000 weight={'name': 'uniform'}
[I 2026-06-01 14:30:33,092] Trial 63 finished with value: 0.1976828347435276 and parameters: {'hidden_dims': '[512, 128]', 'dropout': 0.4351783213357176, 'batch_norm': False, 'lr': 6.709698790411762e-05, 'weight_decay': 3.106719455970687e-08, 'epochs': 198, 'loss': 'mae', 'optimizer': 'adamw', 'use_snp_selection': False, 'n_pcs': 2000}. Best is trial 13 with value: 0.20607333657125215.
2026-06-01 14:30:33 | INFO | Trial 64 | outer=10 | hidden=[512, 128] epochs=202 lr=6.829e-05 wd=3.372e-08 n_pcs=4000 weight={'name': 'uniform'}
[I 2026-06-01 14:30:43,491] Trial 64 finished with value: 0.19377117580575812 and parameters: {'hidden_dims': '[512, 128]', 'dropout': 0.44143278109937395, 'batch_norm': False, 'lr': 6.829088155486936e-05, 'weight_decay': 3.372446400402375e-08, 'epochs': 202, 'loss': 'mae', 'optimizer': 'adamw', 'use_snp_selection': False, 'n_pcs': 4000}. Best is trial 13 with value: 0.20607333657125215.
2026-06-01 14:30:43 | INFO | Trial 65 | outer=10 | hidden=[256, 64] epochs=193 lr=1.591e-04 wd=5.081e-08 n_pcs=2000 weight={'name': 'uniform'}
[I 2026-06-01 14:30:47,763] Trial 65 finished with value: 0.17397446753202925 and parameters: {'hidden_dims': '[256, 64]', 'dropout': 0.4234655673622454, 'batch_norm': False, 'lr': 0.00015907519857459164, 'weight_decay': 5.081419370776176e-08, 'epochs': 193, 'loss': 'mae', 'optimizer': 'adamw', 'use_snp_selection': False, 'n_pcs': 2000}. Best is trial 13 with value: 0.20607333657125215.
2026-06-01 14:30:47 | INFO | Trial 66 | outer=10 | hidden=[256, 128] epochs=162 lr=1.042e-04 wd=2.647e-04 n_pcs=5000 weight={'name': 'uniform'}
[I 2026-06-01 14:30:54,254] Trial 66 finished with value: 0.20609455490485815 and parameters: {'hidden_dims': '[256, 128]', 'dropout': 0.38298744488578534, 'batch_norm': False, 'lr': 0.00010423970062806524, 'weight_decay': 0.0002646865964781943, 'epochs': 162, 'loss': 'mae', 'optimizer': 'adamw', 'use_snp_selection': False, 'n_pcs': 5000}. Best is trial 66 with value: 0.20609455490485815.
2026-06-01 14:30:54 | INFO | Trial 67 | outer=10 | hidden=[256, 128] epochs=157 lr=1.056e-04 wd=2.757e-04 n_pcs=5000 weight={'name': 'uniform'}
[I 2026-06-01 14:30:58,696] Trial 67 pruned. 
2026-06-01 14:30:58 | INFO | Trial 68 | outer=10 | hidden=[256, 128] epochs=146 lr=2.053e-04 wd=3.552e-04 n_pcs=5000 weight={'name': 'uniform'}
[I 2026-06-01 14:31:04,776] Trial 68 finished with value: 0.16743565990103587 and parameters: {'hidden_dims': '[256, 128]', 'dropout': 0.3846719279732318, 'batch_norm': False, 'lr': 0.00020530217891330134, 'weight_decay': 0.00035522610165013546, 'epochs': 146, 'loss': 'mae', 'optimizer': 'adamw', 'use_snp_selection': False, 'n_pcs': 5000}. Best is trial 66 with value: 0.20609455490485815.
2026-06-01 14:31:04 | INFO | Trial 69 | outer=10 | hidden=[256, 128] epochs=173 lr=2.388e-04 wd=2.166e-04 n_pcs=4500 weight={'name': 'uniform'}
[I 2026-06-01 14:31:11,249] Trial 69 finished with value: 0.16975521265558138 and parameters: {'hidden_dims': '[256, 128]', 'dropout': 0.27145730355221687, 'batch_norm': False, 'lr': 0.00023875962163986096, 'weight_decay': 0.00021659537096843922, 'epochs': 173, 'loss': 'mse', 'optimizer': 'adamw', 'use_snp_selection': False, 'n_pcs': 4500}. Best is trial 66 with value: 0.20609455490485815.
2026-06-01 14:31:11 | INFO | Trial 70 | outer=10 | hidden=[256, 128] epochs=126 lr=9.360e-05 wd=9.073e-05 n_pcs=500 weight={'name': 'uniform'}
