[I 2026-06-01 13:50:58,474] Trial 28 finished with value: 0.16779348480078674 and parameters: {'hidden_dims': '[512, 128]', 'dropout': 0.32672818741310733, 'batch_norm': False, 'lr': 6.0379959384620195e-05, 'weight_decay': 2.11460732658227e-06, 'epochs': 149, 'loss': 'mae', 'optimizer': 'adam', 'use_snp_selection': False, 'n_pcs': 4000}. Best is trial 22 with value: 0.1997743824855363.
2026-06-01 13:50:58 | INFO | Trial 29 | outer=8 | hidden=[512, 128] epochs=102 lr=9.853e-05 wd=1.567e-05 n_pcs=5000 weight={'name': 'uniform'}
[I 2026-06-01 13:51:05,631] Trial 29 finished with value: 0.15841035625949937 and parameters: {'hidden_dims': '[512, 128]', 'dropout': 0.4564134229805255, 'batch_norm': False, 'lr': 9.852845801519632e-05, 'weight_decay': 1.566567916168197e-05, 'epochs': 102, 'loss': 'mae', 'optimizer': 'adamw', 'use_snp_selection': False, 'n_pcs': 5000}. Best is trial 22 with value: 0.1997743824855363.
2026-06-01 13:51:05 | INFO | Trial 30 | outer=8 | hidden=[512, 128] epochs=75 lr=1.654e-04 wd=1.851e-06 n_pcs=3500 weight={'name': 'uniform'}
[I 2026-06-01 13:51:10,426] Trial 30 finished with value: 0.19149417298588337 and parameters: {'hidden_dims': '[512, 128]', 'dropout': 0.5071707418262119, 'batch_norm': False, 'lr': 0.00016542887706893944, 'weight_decay': 1.8514253444048866e-06, 'epochs': 75, 'loss': 'mae', 'optimizer': 'adam', 'use_snp_selection': False, 'n_pcs': 3500}. Best is trial 22 with value: 0.1997743824855363.
2026-06-01 13:51:10 | INFO | Trial 31 | outer=8 | hidden=[512, 128] epochs=80 lr=1.697e-04 wd=1.850e-06 n_pcs=3500 weight={'name': 'uniform'}
[I 2026-06-01 13:51:15,396] Trial 31 finished with value: 0.20845276367668492 and parameters: {'hidden_dims': '[512, 128]', 'dropout': 0.5762370633693702, 'batch_norm': False, 'lr': 0.00016970159200094254, 'weight_decay': 1.850231988279093e-06, 'epochs': 80, 'loss': 'mae', 'optimizer': 'adam', 'use_snp_selection': False, 'n_pcs': 3500}. Best is trial 31 with value: 0.20845276367668492.
2026-06-01 13:51:15 | INFO | Trial 32 | outer=8 | hidden=[512, 128] epochs=74 lr=1.642e-04 wd=2.565e-07 n_pcs=3500 weight={'name': 'uniform'}
[I 2026-06-01 13:51:20,153] Trial 32 finished with value: 0.1663458042137399 and parameters: {'hidden_dims': '[512, 128]', 'dropout': 0.5653508868675114, 'batch_norm': False, 'lr': 0.0001641972517046529, 'weight_decay': 2.565230720945449e-07, 'epochs': 74, 'loss': 'mae', 'optimizer': 'adam', 'use_snp_selection': False, 'n_pcs': 3500}. Best is trial 31 with value: 0.20845276367668492.
2026-06-01 13:51:20 | INFO | Trial 33 | outer=8 | hidden=[512, 128] epochs=80 lr=1.550e-04 wd=3.096e-06 n_pcs=4500 weight={'name': 'uniform'}
[I 2026-06-01 13:51:25,971] Trial 33 finished with value: 0.17746855919522145 and parameters: {'hidden_dims': '[512, 128]', 'dropout': 0.5330586614924413, 'batch_norm': False, 'lr': 0.0001550033950679115, 'weight_decay': 3.09646529600371e-06, 'epochs': 80, 'loss': 'mae', 'optimizer': 'adam', 'use_snp_selection': False, 'n_pcs': 4500}. Best is trial 31 with value: 0.20845276367668492.
2026-06-01 13:51:25 | INFO | Trial 34 | outer=8 | hidden=[1024, 256] epochs=188 lr=1.331e-04 wd=1.387e-05 n_pcs=3000 weight={'name': 'uniform'}
[I 2026-06-01 13:51:40,012] Trial 34 finished with value: 0.16656576860732927 and parameters: {'hidden_dims': '[1024, 256]', 'dropout': 0.5151676409418777, 'batch_norm': False, 'lr': 0.00013308057266733317, 'weight_decay': 1.387313416570137e-05, 'epochs': 188, 'loss': 'mse', 'optimizer': 'adam', 'use_snp_selection': False, 'n_pcs': 3000}. Best is trial 31 with value: 0.20845276367668492.
2026-06-01 13:51:40 | INFO | Trial 35 | outer=8 | hidden=[512, 128] epochs=60 lr=3.372e-04 wd=2.848e-07 n_pcs=3500 weight={'name': 'uniform'}
[I 2026-06-01 13:51:44,275] Trial 35 finished with value: 0.18640114586717557 and parameters: {'hidden_dims': '[512, 128]', 'dropout': 0.4200445827231377, 'batch_norm': False, 'lr': 0.00033724508301619013, 'weight_decay': 2.8476625589326977e-07, 'epochs': 60, 'loss': 'mae', 'optimizer': 'adam', 'use_snp_selection': False, 'n_pcs': 3500}. Best is trial 31 with value: 0.20845276367668492.
2026-06-01 13:51:44 | INFO | Trial 36 | outer=8 | hidden=[512, 128] epochs=250 lr=8.561e-05 wd=1.319e-06 n_pcs=2500 weight={'name': 'uniform'}
[I 2026-06-01 13:51:52,829] Trial 36 finished with value: 0.15937177486363507 and parameters: {'hidden_dims': '[512, 128]', 'dropout': 0.583520063593651, 'batch_norm': False, 'lr': 8.560666697676671e-05, 'weight_decay': 1.3186817247189602e-06, 'epochs': 250, 'loss': 'mae', 'optimizer': 'adamw', 'use_snp_selection': False, 'n_pcs': 2500}. Best is trial 31 with value: 0.20845276367668492.
2026-06-01 13:51:52 | INFO | Trial 37 | outer=8 | hidden=[256, 128] epochs=112 lr=1.953e-04 wd=4.633e-08 n_pcs=4500 weight={'name': 'uniform'}
[I 2026-06-01 13:51:57,760] Trial 37 finished with value: 0.1610657619862103 and parameters: {'hidden_dims': '[256, 128]', 'dropout': 0.5527334137140195, 'batch_norm': False, 'lr': 0.00019527040565331394, 'weight_decay': 4.633171291243744e-08, 'epochs': 112, 'loss': 'mse', 'optimizer': 'adam', 'use_snp_selection': False, 'n_pcs': 4500}. Best is trial 31 with value: 0.20845276367668492.
2026-06-01 13:51:57 | INFO | Trial 38 | outer=8 | hidden=[512, 128] epochs=153 lr=2.293e-04 wd=3.364e-06 n_pcs=3000 weight={'name': 'uniform'}
[I 2026-06-01 13:52:04,529] Trial 38 finished with value: 0.1824830417040528 and parameters: {'hidden_dims': '[512, 128]', 'dropout': 0.4873238255875292, 'batch_norm': False, 'lr': 0.0002293047148634451, 'weight_decay': 3.364441466677939e-06, 'epochs': 153, 'loss': 'mae', 'optimizer': 'adamw', 'use_snp_selection': False, 'n_pcs': 3000}. Best is trial 31 with value: 0.20845276367668492.
2026-06-01 13:52:04 | INFO | Trial 39 | outer=8 | hidden=[1024, 256] epochs=85 lr=4.593e-05 wd=6.252e-06 n_pcs=2500 weight={'name': 'uniform'}
[I 2026-06-01 13:52:11,211] Trial 39 finished with value: 0.18079250441398406 and parameters: {'hidden_dims': '[1024, 256]', 'dropout': 0.40120540911659575, 'batch_norm': False, 'lr': 4.5927545745343627e-05, 'weight_decay': 6.2524934410279395e-06, 'epochs': 85, 'loss': 'mse', 'optimizer': 'adam', 'use_snp_selection': False, 'n_pcs': 2500}. Best is trial 31 with value: 0.20845276367668492.
2026-06-01 13:52:11 | INFO | Trial 40 | outer=8 | hidden=[512, 64] epochs=69 lr=7.077e-05 wd=2.495e-05 n_pcs=4000 weight={'name': 'uniform'}
[I 2026-06-01 13:52:16,076] Trial 40 finished with value: 0.16616347481665614 and parameters: {'hidden_dims': '[512, 64]', 'dropout': 0.14129838127372968, 'batch_norm': False, 'lr': 7.077201798143731e-05, 'weight_decay': 2.4952663643615798e-05, 'epochs': 69, 'loss': 'mae', 'optimizer': 'adam', 'use_snp_selection': False, 'n_pcs': 4000}. Best is trial 31 with value: 0.20845276367668492.
2026-06-01 13:52:16 | INFO | Trial 41 | outer=8 | hidden=[512, 128] epochs=108 lr=1.130e-04 wd=1.861e-06 n_pcs=3500 weight={'name': 'uniform'}
[I 2026-06-01 13:52:22,072] Trial 41 finished with value: 0.17647609192005403 and parameters: {'hidden_dims': '[512, 128]', 'dropout': 0.29241235119458553, 'batch_norm': False, 'lr': 0.00011303861948456922, 'weight_decay': 1.861103983246938e-06, 'epochs': 108, 'loss': 'mae', 'optimizer': 'adam', 'use_snp_selection': False, 'n_pcs': 3500}. Best is trial 31 with value: 0.20845276367668492.
2026-06-01 13:52:22 | INFO | Trial 42 | outer=8 | hidden=[512, 128] epochs=63 lr=1.732e-04 wd=8.481e-06 n_pcs=3500 weight={'name': 'uniform'}
[I 2026-06-01 13:52:26,443] Trial 42 finished with value: 0.18306059198277455 and parameters: {'hidden_dims': '[512, 128]', 'dropout': 0.327024700852894, 'batch_norm': False, 'lr': 0.00017322213083920267, 'weight_decay': 8.481439576282548e-06, 'epochs': 63, 'loss': 'mae', 'optimizer': 'adam', 'use_snp_selection': False, 'n_pcs': 3500}. Best is trial 31 with value: 0.20845276367668492.
2026-06-01 13:52:26 | INFO | Trial 43 | outer=8 | hidden=[512, 128] epochs=90 lr=1.095e-04 wd=3.073e-06 n_pcs=4000 weight={'name': 'uniform'}
[I 2026-06-01 13:52:32,201] Trial 43 finished with value: 0.17035798923466486 and parameters: {'hidden_dims': '[512, 128]', 'dropout': 0.4861487621368909, 'batch_norm': False, 'lr': 0.00010948873381937922, 'weight_decay': 3.0728261302854655e-06, 'epochs': 90, 'loss': 'mae', 'optimizer': 'adam', 'use_snp_selection': False, 'n_pcs': 4000}. Best is trial 31 with value: 0.20845276367668492.
2026-06-01 13:52:32 | INFO | Trial 44 | outer=8 | hidden=[256, 64] epochs=134 lr=3.285e-04 wd=7.634e-07 n_pcs=3000 weight={'name': 'uniform'}
[I 2026-06-01 13:52:36,476] Trial 44 finished with value: 0.17961476250391656 and parameters: {'hidden_dims': '[256, 64]', 'dropout': 0.2743017828541756, 'batch_norm': False, 'lr': 0.00032846741697805683, 'weight_decay': 7.634105003861719e-07, 'epochs': 134, 'loss': 'mae', 'optimizer': 'adam', 'use_snp_selection': False, 'n_pcs': 3000}. Best is trial 31 with value: 0.20845276367668492.
2026-06-01 13:52:36 | INFO | Trial 45 | outer=8 | hidden=[128, 64] epochs=83 lr=1.435e-04 wd=1.592e-06 n_pcs=2500 weight={'name': 'uniform'}
[I 2026-06-01 13:52:39,304] Trial 45 finished with value: 0.16259548122984757 and parameters: {'hidden_dims': '[128, 64]', 'dropout': 0.06633179349181609, 'batch_norm': False, 'lr': 0.00014348377901220768, 'weight_decay': 1.5920553073017376e-06, 'epochs': 83, 'loss': 'mse', 'optimizer': 'adam', 'use_snp_selection': False, 'n_pcs': 2500}. Best is trial 31 with value: 0.20845276367668492.
2026-06-01 13:52:39 | INFO | Trial 46 | outer=8 | hidden=[512, 128] epochs=113 lr=1.030e-05 wd=3.676e-07 n_pcs=4500 weight={'name': 'uniform'}
[I 2026-06-01 13:52:43,655] Trial 46 pruned. 
2026-06-01 13:52:43 | INFO | Trial 47 | outer=8 | hidden=[256, 128] epochs=65 lr=8.397e-05 wd=1.035e-05 n_pcs=3500 weight={'name': 'uniform'}
[I 2026-06-01 13:52:45,642] Trial 47 pruned. 
2026-06-01 13:52:45 | INFO | Trial 48 | outer=8 | hidden=[512, 64] epochs=229 lr=1.862e-04 wd=1.491e-07 n_pcs=4000 weight={'name': 'uniform'}
[I 2026-06-01 13:52:56,704] Trial 48 finished with value: 0.18500440584564634 and parameters: {'hidden_dims': '[512, 64]', 'dropout': 0.34667533802064726, 'batch_norm': False, 'lr': 0.00018618118461901468, 'weight_decay': 1.4908260642698826e-07, 'epochs': 229, 'loss': 'mae', 'optimizer': 'adam', 'use_snp_selection': False, 'n_pcs': 4000}. Best is trial 31 with value: 0.20845276367668492.
2026-06-01 13:52:56 | INFO | Trial 49 | outer=8 | hidden=[512, 128] epochs=98 lr=2.281e-04 wd=4.690e-06 n_pcs=3000 weight={'name': 'uniform'}
[I 2026-06-01 13:53:01,770] Trial 49 finished with value: 0.1804028143499637 and parameters: {'hidden_dims': '[512, 128]', 'dropout': 0.40515897645586935, 'batch_norm': False, 'lr': 0.0002280928484016342, 'weight_decay': 4.6904189931474504e-06, 'epochs': 98, 'loss': 'mae', 'optimizer': 'adam', 'use_snp_selection': False, 'n_pcs': 3000}. Best is trial 31 with value: 0.20845276367668492.
2026-06-01 13:53:01 | INFO | Trial 50 | outer=8 | hidden=[128, 64] epochs=125 lr=3.504e-04 wd=3.697e-05 n_pcs=2000 weight={'name': 'uniform'}
[I 2026-06-01 13:53:05,021] Trial 50 finished with value: 0.16844580432144968 and parameters: {'hidden_dims': '[128, 64]', 'dropout': 0.4612657146837485, 'batch_norm': False, 'lr': 0.00035044453621191265, 'weight_decay': 3.6974920412734224e-05, 'epochs': 125, 'loss': 'mse', 'optimizer': 'adam', 'use_snp_selection': False, 'n_pcs': 2000}. Best is trial 31 with value: 0.20845276367668492.
2026-06-01 13:53:05 | INFO | Trial 51 | outer=8 | hidden=[512, 64] epochs=55 lr=2.220e-04 wd=7.013e-07 n_pcs=1500 weight={'name': 'uniform'}
[I 2026-06-01 13:53:07,722] Trial 51 finished with value: 0.17183093087987145 and parameters: {'hidden_dims': '[512, 64]', 'dropout': 0.17154956488826917, 'batch_norm': False, 'lr': 0.0002219695917875498, 'weight_decay': 7.012804273382251e-07, 'epochs': 55, 'loss': 'mae', 'optimizer': 'adam', 'use_snp_selection': False, 'n_pcs': 1500}. Best is trial 31 with value: 0.20845276367668492.
2026-06-01 13:53:07 | INFO | Trial 52 | outer=8 | hidden=[512, 64] epochs=50 lr=2.591e-04 wd=2.777e-04 n_pcs=2000 weight={'name': 'uniform'}
[I 2026-06-01 13:53:10,582] Trial 52 finished with value: 0.19295087169068842 and parameters: {'hidden_dims': '[512, 64]', 'dropout': 0.13685399056500758, 'batch_norm': False, 'lr': 0.0002591403041484041, 'weight_decay': 0.00027772175992645074, 'epochs': 50, 'loss': 'mae', 'optimizer': 'adam', 'use_snp_selection': False, 'n_pcs': 2000}. Best is trial 31 with value: 0.20845276367668492.
2026-06-01 13:53:10 | INFO | Trial 53 | outer=8 | hidden=[512, 64] epochs=78 lr=2.532e-04 wd=3.091e-04 n_pcs=2500 weight={'name': 'uniform'}
[I 2026-06-01 13:53:14,465] Trial 53 finished with value: 0.16347469936463677 and parameters: {'hidden_dims': '[512, 64]', 'dropout': 0.06386470862847402, 'batch_norm': False, 'lr': 0.00025318781621554257, 'weight_decay': 0.00030912176170011513, 'epochs': 78, 'loss': 'mae', 'optimizer': 'adam', 'use_snp_selection': False, 'n_pcs': 2500}. Best is trial 31 with value: 0.20845276367668492.
2026-06-01 13:53:14 | INFO | Trial 54 | outer=8 | hidden=[512, 64] epochs=64 lr=4.905e-04 wd=3.604e-04 n_pcs=1500 weight={'name': 'uniform'}
[I 2026-06-01 13:53:17,328] Trial 54 finished with value: 0.1809483367758717 and parameters: {'hidden_dims': '[512, 64]', 'dropout': 0.12659218362061164, 'batch_norm': False, 'lr': 0.000490455617506729, 'weight_decay': 0.0003604037127744456, 'epochs': 64, 'loss': 'mae', 'optimizer': 'adam', 'use_snp_selection': False, 'n_pcs': 1500}. Best is trial 31 with value: 0.20845276367668492.
2026-06-01 13:53:17 | INFO | Trial 55 | outer=8 | hidden=[512, 256] epochs=86 lr=1.263e-04 wd=1.881e-04 n_pcs=2000 weight={'name': 'uniform'}
[I 2026-06-01 13:53:21,278] Trial 55 finished with value: 0.1927652442009206 and parameters: {'hidden_dims': '[512, 256]', 'dropout': 0.2630594906658848, 'batch_norm': False, 'lr': 0.0001262526435514772, 'weight_decay': 0.0001881055962325507, 'epochs': 86, 'loss': 'mae', 'optimizer': 'adam', 'use_snp_selection': False, 'n_pcs': 2000}. Best is trial 31 with value: 0.20845276367668492.
2026-06-01 13:53:21 | INFO | Trial 56 | outer=8 | hidden=[512, 256] epochs=51 lr=3.108e-05 wd=1.650e-04 n_pcs=2000 weight={'name': 'uniform'}
[I 2026-06-01 13:53:24,333] Trial 56 finished with value: 0.1093217695204352 and parameters: {'hidden_dims': '[512, 256]', 'dropout': 0.0637567909434012, 'batch_norm': False, 'lr': 3.108041501420272e-05, 'weight_decay': 0.00016496575346743793, 'epochs': 51, 'loss': 'mae', 'optimizer': 'adam', 'use_snp_selection': False, 'n_pcs': 2000}. Best is trial 31 with value: 0.20845276367668492.
2026-06-01 13:53:24 | INFO | Trial 57 | outer=8 | hidden=[512, 256] epochs=84 lr=3.966e-04 wd=1.861e-04 n_pcs=2000 weight={'name': 'uniform'}
[I 2026-06-01 13:53:28,222] Trial 57 finished with value: 0.17561447068706487 and parameters: {'hidden_dims': '[512, 256]', 'dropout': 0.26366735544088626, 'batch_norm': False, 'lr': 0.0003966035894499535, 'weight_decay': 0.00018612294996496695, 'epochs': 84, 'loss': 'mae', 'optimizer': 'adam', 'use_snp_selection': False, 'n_pcs': 2000}. Best is trial 31 with value: 0.20845276367668492.
2026-06-01 13:53:28 | INFO | Trial 58 | outer=8 | hidden=[512, 256] epochs=71 lr=1.969e-04 wd=7.339e-05 n_pcs=1500 weight={'name': 'uniform'}
[I 2026-06-01 13:53:31,462] Trial 58 finished with value: 0.165211987222412 and parameters: {'hidden_dims': '[512, 256]', 'dropout': 0.21006781423334525, 'batch_norm': False, 'lr': 0.00019687605446349138, 'weight_decay': 7.338735974233252e-05, 'epochs': 71, 'loss': 'mae', 'optimizer': 'adam', 'use_snp_selection': False, 'n_pcs': 1500}. Best is trial 31 with value: 0.20845276367668492.
2026-06-01 13:53:31 | INFO | Trial 59 | outer=8 | hidden=[256, 64] epochs=92 lr=2.750e-04 wd=7.194e-04 n_pcs=2500 weight={'name': 'uniform'}
[I 2026-06-01 13:53:34,661] Trial 59 finished with value: 0.16186381614004502 and parameters: {'hidden_dims': '[256, 64]', 'dropout': 0.1625334882040722, 'batch_norm': False, 'lr': 0.0002749994251625349, 'weight_decay': 0.0007194110478934528, 'epochs': 92, 'loss': 'mae', 'optimizer': 'adamw', 'use_snp_selection': False, 'n_pcs': 2500}. Best is trial 31 with value: 0.20845276367668492.
2026-06-01 13:53:34 | INFO | Trial 60 | outer=8 | hidden=[512, 64] epochs=60 lr=1.589e-04 wd=2.736e-04 n_pcs=1000 weight={'name': 'uniform'}
[I 2026-06-01 13:53:37,131] Trial 60 finished with value: 0.20244679075857705 and parameters: {'hidden_dims': '[512, 64]', 'dropout': 0.046608384123485794, 'batch_norm': False, 'lr': 0.00015891910421529515, 'weight_decay': 0.00027363725098864385, 'epochs': 60, 'loss': 'mae', 'optimizer': 'adam', 'use_snp_selection': False, 'n_pcs': 1000}. Best is trial 31 with value: 0.20845276367668492.
2026-06-01 13:53:37 | INFO | Trial 61 | outer=8 | hidden=[512, 64] epochs=59 lr=1.345e-04 wd=2.601e-04 n_pcs=500 weight={'name': 'uniform'}
[I 2026-06-01 13:53:38,753] Trial 61 pruned. 
2026-06-01 13:53:38 | INFO | Trial 62 | outer=8 | hidden=[512, 64] epochs=68 lr=1.590e-04 wd=5.697e-04 n_pcs=1000 weight={'name': 'uniform'}
[I 2026-06-01 13:53:41,334] Trial 62 finished with value: 0.18750932359269618 and parameters: {'hidden_dims': '[512, 64]', 'dropout': 0.12543946325103636, 'batch_norm': False, 'lr': 0.00015899849110312546, 'weight_decay': 0.0005696668042662875, 'epochs': 68, 'loss': 'mae', 'optimizer': 'adam', 'use_snp_selection': False, 'n_pcs': 1000}. Best is trial 31 with value: 0.20845276367668492.
2026-06-01 13:53:41 | INFO | Trial 63 | outer=8 | hidden=[512, 64] epochs=50 lr=2.447e-04 wd=4.900e-05 n_pcs=1500 weight={'name': 'uniform'}
[I 2026-06-01 13:53:43,943] Trial 63 finished with value: 0.17727089761687492 and parameters: {'hidden_dims': '[512, 64]', 'dropout': 0.08990429357283818, 'batch_norm': False, 'lr': 0.0002447372056040216, 'weight_decay': 4.89993330625493e-05, 'epochs': 50, 'loss': 'mae', 'optimizer': 'adam', 'use_snp_selection': False, 'n_pcs': 1500}. Best is trial 31 with value: 0.20845276367668492.
2026-06-01 13:53:43 | INFO | Trial 64 | outer=8 | hidden=[512, 256] epochs=80 lr=1.845e-04 wd=1.033e-04 n_pcs=500 weight={'name': 'uniform'}
[I 2026-06-01 13:53:46,564] Trial 64 finished with value: 0.15786829671800906 and parameters: {'hidden_dims': '[512, 256]', 'dropout': 0.5570382461868971, 'batch_norm': False, 'lr': 0.00018449562238837179, 'weight_decay': 0.00010329330339675104, 'epochs': 80, 'loss': 'mae', 'optimizer': 'adam', 'use_snp_selection': False, 'n_pcs': 500}. Best is trial 31 with value: 0.20845276367668492.
2026-06-01 13:53:46 | INFO | Trial 65 | outer=8 | hidden=[512, 64] epochs=59 lr=1.234e-04 wd=2.016e-04 n_pcs=1000 weight={'name': 'uniform'}
[I 2026-06-01 13:53:49,034] Trial 65 finished with value: 0.17206601624095788 and parameters: {'hidden_dims': '[512, 64]', 'dropout': 0.0370297074285134, 'batch_norm': False, 'lr': 0.00012339487865697815, 'weight_decay': 0.00020163793430104477, 'epochs': 59, 'loss': 'mae', 'optimizer': 'adam', 'use_snp_selection': False, 'n_pcs': 1000}. Best is trial 31 with value: 0.20845276367668492.
2026-06-01 13:53:49 | INFO | Trial 66 | outer=8 | hidden=[512, 64] epochs=72 lr=3.155e-04 wd=4.734e-04 n_pcs=2000 weight={'name': 'uniform'}
[I 2026-06-01 13:53:52,375] Trial 66 finished with value: 0.17005746952459658 and parameters: {'hidden_dims': '[512, 64]', 'dropout': 0.013551258859097547, 'batch_norm': False, 'lr': 0.0003154506287639449, 'weight_decay': 0.00047338139717496353, 'epochs': 72, 'loss': 'mae', 'optimizer': 'adam', 'use_snp_selection': False, 'n_pcs': 2000}. Best is trial 31 with value: 0.20845276367668492.
2026-06-01 13:53:52 | INFO | Trial 67 | outer=8 | hidden=[512, 64] epochs=97 lr=2.071e-04 wd=9.491e-04 n_pcs=2000 weight={'name': 'uniform'}
[I 2026-06-01 13:53:56,266] Trial 67 finished with value: 0.16722332503689094 and parameters: {'hidden_dims': '[512, 64]', 'dropout': 0.10964489687371859, 'batch_norm': False, 'lr': 0.00020710964617018908, 'weight_decay': 0.0009490769814616646, 'epochs': 97, 'loss': 'mae', 'optimizer': 'adam', 'use_snp_selection': False, 'n_pcs': 2000}. Best is trial 31 with value: 0.20845276367668492.
2026-06-01 13:53:56 | INFO | Trial 68 | outer=8 | hidden=[512, 256] epochs=87 lr=9.874e-05 wd=1.026e-04 n_pcs=3000 weight={'name': 'uniform'}
[I 2026-06-01 13:54:01,195] Trial 68 finished with value: 0.15023429941754726 and parameters: {'hidden_dims': '[512, 256]', 'dropout': 0.04056610742337855, 'batch_norm': False, 'lr': 9.874346432046767e-05, 'weight_decay': 0.00010261407677807663, 'epochs': 87, 'loss': 'mae', 'optimizer': 'adam', 'use_snp_selection': False, 'n_pcs': 3000}. Best is trial 31 with value: 0.20845276367668492.
2026-06-01 13:54:01 | INFO | Trial 69 | outer=8 | hidden=[512, 64] epochs=77 lr=1.556e-04 wd=2.461e-04 n_pcs=2500 weight={'name': 'uniform'}
[I 2026-06-01 13:54:05,059] Trial 69 finished with value: 0.19194498634430057 and parameters: {'hidden_dims': '[512, 64]', 'dropout': 0.5977075505430323, 'batch_norm': False, 'lr': 0.00015562876700161537, 'weight_decay': 0.000246064654933253, 'epochs': 77, 'loss': 'mse', 'optimizer': 'adam', 'use_snp_selection': False, 'n_pcs': 2500}. Best is trial 31 with value: 0.20845276367668492.
2026-06-01 13:54:05 | INFO | Trial 70 | outer=8 | hidden=[256, 128] epochs=77 lr=1.604e-04 wd=4.224e-04 n_pcs=2500 weight={'name': 'uniform'}
[I 2026-06-01 13:54:08,088] Trial 70 finished with value: 0.16922694634887364 and parameters: {'hidden_dims': '[256, 128]', 'dropout': 0.5840636307751002, 'batch_norm': False, 'lr': 0.00016035290974325737, 'weight_decay': 0.00042235682432688803, 'epochs': 77, 'loss': 'mse', 'optimizer': 'adam', 'use_snp_selection': False, 'n_pcs': 2500}. Best is trial 31 with value: 0.20845276367668492.
2026-06-01 13:54:08 | INFO | Trial 71 | outer=8 | hidden=[512, 64] epochs=60 lr=1.513e-04 wd=2.146e-04 n_pcs=1500 weight={'name': 'uniform'}
[I 2026-06-01 13:54:09,760] Trial 71 pruned. 
2026-06-01 13:54:09 | INFO | Trial 72 | outer=8 | hidden=[512, 64] epochs=70 lr=2.675e-04 wd=1.575e-04 n_pcs=2000 weight={'name': 'uniform'}
