[I 2026-06-01 14:13:05,737] Trial 2 finished with value: 0.17941679794368456 and parameters: {'hidden_dims': '[256, 64]', 'dropout': 0.11392712587675291, 'batch_norm': False, 'lr': 3.9573351157697276e-05, 'weight_decay': 3.7502337000845044e-05, 'epochs': 139, 'loss': 'mae', 'optimizer': 'adam', 'use_snp_selection': False, 'n_pcs': 2500}. Best is trial 0 with value: 0.19453126730248602.
2026-06-01 14:13:05 | INFO | Trial 3 | outer=9 | hidden=[128, 64] epochs=164 lr=1.538e-05 wd=3.248e-06 n_pcs=3000 weight={'name': 'uniform'}
[I 2026-06-01 14:13:09,590] Trial 3 finished with value: 0.09681968037874317 and parameters: {'hidden_dims': '[128, 64]', 'dropout': 0.1479874991503876, 'batch_norm': False, 'lr': 1.5380732370316375e-05, 'weight_decay': 3.2478890969962294e-06, 'epochs': 164, 'loss': 'mse', 'optimizer': 'adam', 'use_snp_selection': False, 'n_pcs': 3000}. Best is trial 0 with value: 0.19453126730248602.
2026-06-01 14:13:09 | INFO | Trial 4 | outer=9 | hidden=[256, 128] epochs=210 lr=7.298e-05 wd=7.875e-06 n_pcs=3000 weight={'name': 'uniform'}
[I 2026-06-01 14:13:15,346] Trial 4 finished with value: 0.1683605766515126 and parameters: {'hidden_dims': '[256, 128]', 'dropout': 0.09917626474860408, 'batch_norm': False, 'lr': 7.298380589156323e-05, 'weight_decay': 7.875094299510188e-06, 'epochs': 210, 'loss': 'mae', 'optimizer': 'adam', 'use_snp_selection': False, 'n_pcs': 3000}. Best is trial 0 with value: 0.19453126730248602.
2026-06-01 14:13:15 | INFO | Trial 5 | outer=9 | hidden=[512, 128] epochs=284 lr=5.467e-05 wd=5.496e-06 n_pcs=4000 weight={'name': 'uniform'}
[I 2026-06-01 14:13:28,981] Trial 5 finished with value: 0.1646814673564398 and parameters: {'hidden_dims': '[512, 128]', 'dropout': 0.3143696126156032, 'batch_norm': False, 'lr': 5.46667545989349e-05, 'weight_decay': 5.496446859789657e-06, 'epochs': 284, 'loss': 'mse', 'optimizer': 'adamw', 'use_snp_selection': False, 'n_pcs': 4000}. Best is trial 0 with value: 0.19453126730248602.
2026-06-01 14:13:28 | INFO | Trial 6 | outer=9 | hidden=[512, 64] epochs=90 lr=3.103e-05 wd=6.607e-08 n_pcs=5000 weight={'name': 'uniform'}
[I 2026-06-01 14:13:35,572] Trial 6 finished with value: 0.1356357179888133 and parameters: {'hidden_dims': '[512, 64]', 'dropout': 0.4941304802762902, 'batch_norm': False, 'lr': 3.103455600245868e-05, 'weight_decay': 6.606788619980135e-08, 'epochs': 90, 'loss': 'mse', 'optimizer': 'adamw', 'use_snp_selection': False, 'n_pcs': 5000}. Best is trial 0 with value: 0.19453126730248602.
2026-06-01 14:13:35 | INFO | Trial 7 | outer=9 | hidden=[128, 64] epochs=272 lr=1.348e-05 wd=1.075e-07 n_pcs=4000 weight={'name': 'uniform'}
[I 2026-06-01 14:13:41,085] Trial 7 finished with value: 0.07790247690742434 and parameters: {'hidden_dims': '[128, 64]', 'dropout': 0.43850529998545856, 'batch_norm': False, 'lr': 1.3475345125648628e-05, 'weight_decay': 1.0749576404800894e-07, 'epochs': 272, 'loss': 'mse', 'optimizer': 'adamw', 'use_snp_selection': False, 'n_pcs': 4000}. Best is trial 0 with value: 0.19453126730248602.
2026-06-01 14:13:41 | INFO | Trial 8 | outer=9 | hidden=[128, 64] epochs=205 lr=1.815e-05 wd=5.764e-06 n_pcs=3000 weight={'name': 'uniform'}
[I 2026-06-01 14:13:43,680] Trial 8 pruned. 
2026-06-01 14:13:43 | INFO | Trial 9 | outer=9 | hidden=[128, 64] epochs=296 lr=2.338e-05 wd=1.066e-07 n_pcs=2500 weight={'name': 'uniform'}
[I 2026-06-01 14:13:49,002] Trial 9 finished with value: 0.14275818226366166 and parameters: {'hidden_dims': '[128, 64]', 'dropout': 0.17607378181405245, 'batch_norm': False, 'lr': 2.3379083621874488e-05, 'weight_decay': 1.0663581123617794e-07, 'epochs': 296, 'loss': 'mae', 'optimizer': 'adam', 'use_snp_selection': False, 'n_pcs': 2500}. Best is trial 0 with value: 0.19453126730248602.
2026-06-01 14:13:49 | INFO | Trial 10 | outer=9 | hidden=[512, 256] epochs=242 lr=3.984e-04 wd=9.453e-04 n_pcs=500 weight={'name': 'uniform'}
[I 2026-06-01 14:13:53,749] Trial 10 finished with value: 0.15982008330724964 and parameters: {'hidden_dims': '[512, 256]', 'dropout': 0.02309895975550147, 'batch_norm': False, 'lr': 0.0003983594610602333, 'weight_decay': 0.0009452683165453212, 'epochs': 242, 'loss': 'mae', 'optimizer': 'adamw', 'use_snp_selection': False, 'n_pcs': 500}. Best is trial 0 with value: 0.19453126730248602.
2026-06-01 14:13:53 | INFO | Trial 11 | outer=9 | hidden=[256, 64] epochs=139 lr=1.427e-04 wd=2.043e-04 n_pcs=1500 weight={'name': 'uniform'}
[I 2026-06-01 14:13:57,066] Trial 11 finished with value: 0.18868855345910057 and parameters: {'hidden_dims': '[256, 64]', 'dropout': 0.21514980816254725, 'batch_norm': False, 'lr': 0.00014267949767729298, 'weight_decay': 0.00020429937181073188, 'epochs': 139, 'loss': 'mae', 'optimizer': 'adam', 'use_snp_selection': False, 'n_pcs': 1500}. Best is trial 0 with value: 0.19453126730248602.
2026-06-01 14:13:57 | INFO | Trial 12 | outer=9 | hidden=[256, 64] epochs=116 lr=1.486e-04 wd=1.415e-08 n_pcs=1500 weight={'name': 'uniform'}
[I 2026-06-01 14:14:00,107] Trial 12 finished with value: 0.1606308695433269 and parameters: {'hidden_dims': '[256, 64]', 'dropout': 0.23620305245312762, 'batch_norm': False, 'lr': 0.00014862880265578126, 'weight_decay': 1.4151425112137584e-08, 'epochs': 116, 'loss': 'mae', 'optimizer': 'adam', 'use_snp_selection': False, 'n_pcs': 1500}. Best is trial 0 with value: 0.19453126730248602.
2026-06-01 14:14:00 | INFO | Trial 13 | outer=9 | hidden=[256, 64] epochs=184 lr=1.171e-04 wd=4.515e-04 n_pcs=1500 weight={'name': 'uniform'}
[I 2026-06-01 14:14:03,929] Trial 13 finished with value: 0.17063959575232762 and parameters: {'hidden_dims': '[256, 64]', 'dropout': 0.3532976672109823, 'batch_norm': False, 'lr': 0.00011714694867355428, 'weight_decay': 0.00045147119708784003, 'epochs': 184, 'loss': 'mae', 'optimizer': 'adamw', 'use_snp_selection': False, 'n_pcs': 1500}. Best is trial 0 with value: 0.19453126730248602.
2026-06-01 14:14:03 | INFO | Trial 14 | outer=9 | hidden=[256, 64] epochs=148 lr=3.524e-04 wd=9.636e-05 n_pcs=1500 weight={'name': 'uniform'}
[I 2026-06-01 14:14:07,344] Trial 14 finished with value: 0.15107770152428263 and parameters: {'hidden_dims': '[256, 64]', 'dropout': 0.000513486434039534, 'batch_norm': False, 'lr': 0.0003523813947110091, 'weight_decay': 9.635580997250426e-05, 'epochs': 148, 'loss': 'mae', 'optimizer': 'adam', 'use_snp_selection': False, 'n_pcs': 1500}. Best is trial 0 with value: 0.19453126730248602.
2026-06-01 14:14:07 | INFO | Trial 15 | outer=9 | hidden=[256, 64] epochs=67 lr=2.108e-04 wd=7.042e-07 n_pcs=1000 weight={'name': 'uniform'}
[I 2026-06-01 14:14:09,718] Trial 15 finished with value: 0.21987372120888282 and parameters: {'hidden_dims': '[256, 64]', 'dropout': 0.21194168837101618, 'batch_norm': False, 'lr': 0.00021080032626599382, 'weight_decay': 7.042341982313891e-07, 'epochs': 67, 'loss': 'mae', 'optimizer': 'adamw', 'use_snp_selection': False, 'n_pcs': 1000}. Best is trial 15 with value: 0.21987372120888282.
2026-06-01 14:14:09 | INFO | Trial 16 | outer=9 | hidden=[512, 256] epochs=53 lr=2.476e-04 wd=4.814e-07 n_pcs=1000 weight={'name': 'uniform'}
[I 2026-06-01 14:14:12,276] Trial 16 finished with value: 0.2035312632495568 and parameters: {'hidden_dims': '[512, 256]', 'dropout': 0.3890859488986131, 'batch_norm': False, 'lr': 0.0002476016868339357, 'weight_decay': 4.8144763747045e-07, 'epochs': 53, 'loss': 'mae', 'optimizer': 'adamw', 'use_snp_selection': False, 'n_pcs': 1000}. Best is trial 15 with value: 0.21987372120888282.
2026-06-01 14:14:12 | INFO | Trial 17 | outer=9 | hidden=[512, 256] epochs=51 lr=2.467e-04 wd=4.451e-07 n_pcs=500 weight={'name': 'uniform'}
[I 2026-06-01 14:14:13,609] Trial 17 pruned. 
2026-06-01 14:14:13 | INFO | Trial 18 | outer=9 | hidden=[512, 256] epochs=50 lr=2.439e-04 wd=9.764e-07 n_pcs=1000 weight={'name': 'uniform'}
[I 2026-06-01 14:14:16,130] Trial 18 finished with value: 0.21344044250006072 and parameters: {'hidden_dims': '[512, 256]', 'dropout': 0.3962855800621149, 'batch_norm': False, 'lr': 0.00024391542091374105, 'weight_decay': 9.764409559966487e-07, 'epochs': 50, 'loss': 'mae', 'optimizer': 'adamw', 'use_snp_selection': False, 'n_pcs': 1000}. Best is trial 15 with value: 0.21987372120888282.
2026-06-01 14:14:16 | INFO | Trial 19 | outer=9 | hidden=[256, 128] epochs=89 lr=2.221e-04 wd=9.799e-07 n_pcs=2000 weight={'name': 'uniform'}
[I 2026-06-01 14:14:19,113] Trial 19 finished with value: 0.20275750543517698 and parameters: {'hidden_dims': '[256, 128]', 'dropout': 0.5096779750790416, 'batch_norm': False, 'lr': 0.00022208737009496869, 'weight_decay': 9.798898041148077e-07, 'epochs': 89, 'loss': 'mae', 'optimizer': 'adamw', 'use_snp_selection': False, 'n_pcs': 2000}. Best is trial 15 with value: 0.21987372120888282.
2026-06-01 14:14:19 | INFO | Trial 20 | outer=9 | hidden=[1024, 256] epochs=77 lr=4.524e-04 wd=2.003e-05 n_pcs=1000 weight={'name': 'uniform'}
[I 2026-06-01 14:14:23,184] Trial 20 finished with value: 0.21455243046251155 and parameters: {'hidden_dims': '[1024, 256]', 'dropout': 0.41337256613380197, 'batch_norm': False, 'lr': 0.0004523785449461215, 'weight_decay': 2.0032956300257072e-05, 'epochs': 77, 'loss': 'mae', 'optimizer': 'adamw', 'use_snp_selection': False, 'n_pcs': 1000}. Best is trial 15 with value: 0.21987372120888282.
2026-06-01 14:14:23 | INFO | Trial 21 | outer=9 | hidden=[1024, 256] epochs=79 lr=4.886e-04 wd=1.736e-05 n_pcs=1000 weight={'name': 'uniform'}
[I 2026-06-01 14:14:27,324] Trial 21 finished with value: 0.20230485367771694 and parameters: {'hidden_dims': '[1024, 256]', 'dropout': 0.42176756107792795, 'batch_norm': False, 'lr': 0.000488560175059908, 'weight_decay': 1.7360940099534982e-05, 'epochs': 79, 'loss': 'mae', 'optimizer': 'adamw', 'use_snp_selection': False, 'n_pcs': 1000}. Best is trial 15 with value: 0.21987372120888282.
2026-06-01 14:14:27 | INFO | Trial 22 | outer=9 | hidden=[1024, 256] epochs=69 lr=3.092e-04 wd=1.379e-06 n_pcs=1000 weight={'name': 'uniform'}
[I 2026-06-01 14:14:31,145] Trial 22 finished with value: 0.20691129577284167 and parameters: {'hidden_dims': '[1024, 256]', 'dropout': 0.48010553092656627, 'batch_norm': False, 'lr': 0.0003091871954439659, 'weight_decay': 1.3787226724074323e-06, 'epochs': 69, 'loss': 'mae', 'optimizer': 'adamw', 'use_snp_selection': False, 'n_pcs': 1000}. Best is trial 15 with value: 0.21987372120888282.
2026-06-01 14:14:31 | INFO | Trial 23 | outer=9 | hidden=[512, 64] epochs=111 lr=1.862e-04 wd=2.012e-05 n_pcs=1000 weight={'name': 'uniform'}
[I 2026-06-01 14:14:34,348] Trial 23 finished with value: 0.2035585465265469 and parameters: {'hidden_dims': '[512, 64]', 'dropout': 0.3422037378766032, 'batch_norm': False, 'lr': 0.0001862108161151365, 'weight_decay': 2.0115294096575177e-05, 'epochs': 111, 'loss': 'mae', 'optimizer': 'adamw', 'use_snp_selection': False, 'n_pcs': 1000}. Best is trial 15 with value: 0.21987372120888282.
2026-06-01 14:14:34 | INFO | Trial 24 | outer=9 | hidden=[512, 128] epochs=109 lr=4.305e-04 wd=1.013e-06 n_pcs=2000 weight={'name': 'uniform'}
[I 2026-06-01 14:14:38,690] Trial 24 finished with value: 0.19186313904426802 and parameters: {'hidden_dims': '[512, 128]', 'dropout': 0.5455474756930324, 'batch_norm': False, 'lr': 0.00043048561955720684, 'weight_decay': 1.0126014621639037e-06, 'epochs': 109, 'loss': 'mae', 'optimizer': 'adamw', 'use_snp_selection': False, 'n_pcs': 2000}. Best is trial 15 with value: 0.21987372120888282.
2026-06-01 14:14:38 | INFO | Trial 25 | outer=9 | hidden=[512, 256] epochs=72 lr=1.044e-04 wd=1.870e-08 n_pcs=2000 weight={'name': 'uniform'}
[I 2026-06-01 14:14:42,342] Trial 25 finished with value: 0.18701334677659595 and parameters: {'hidden_dims': '[512, 256]', 'dropout': 0.39730261353917434, 'batch_norm': False, 'lr': 0.00010443256693115089, 'weight_decay': 1.8701609250806448e-08, 'epochs': 72, 'loss': 'mae', 'optimizer': 'adamw', 'use_snp_selection': False, 'n_pcs': 2000}. Best is trial 15 with value: 0.21987372120888282.
2026-06-01 14:14:42 | INFO | Trial 26 | outer=9 | hidden=[1024, 256] epochs=100 lr=3.035e-04 wd=1.898e-06 n_pcs=500 weight={'name': 'uniform'}
[I 2026-06-01 14:14:46,095] Trial 26 finished with value: 0.1969342138552828 and parameters: {'hidden_dims': '[1024, 256]', 'dropout': 0.44297662022983275, 'batch_norm': False, 'lr': 0.0003034800945281136, 'weight_decay': 1.898438318917749e-06, 'epochs': 100, 'loss': 'mae', 'optimizer': 'adamw', 'use_snp_selection': False, 'n_pcs': 500}. Best is trial 15 with value: 0.21987372120888282.
2026-06-01 14:14:46 | INFO | Trial 27 | outer=9 | hidden=[1024, 256] epochs=63 lr=1.892e-04 wd=3.869e-07 n_pcs=1000 weight={'name': 'uniform'}
[I 2026-06-01 14:14:49,714] Trial 27 finished with value: 0.18940191916140686 and parameters: {'hidden_dims': '[1024, 256]', 'dropout': 0.269418717393102, 'batch_norm': False, 'lr': 0.00018924201293233397, 'weight_decay': 3.8693771035201964e-07, 'epochs': 63, 'loss': 'mae', 'optimizer': 'adamw', 'use_snp_selection': False, 'n_pcs': 1000}. Best is trial 15 with value: 0.21987372120888282.
2026-06-01 14:14:49 | INFO | Trial 28 | outer=9 | hidden=[512, 256] epochs=130 lr=2.939e-04 wd=4.011e-05 n_pcs=2000 weight={'name': 'uniform'}
[I 2026-06-01 14:14:54,847] Trial 28 finished with value: 0.19201264107486055 and parameters: {'hidden_dims': '[512, 256]', 'dropout': 0.36551381939390337, 'batch_norm': False, 'lr': 0.000293907732696851, 'weight_decay': 4.010577643859115e-05, 'epochs': 130, 'loss': 'mae', 'optimizer': 'adamw', 'use_snp_selection': False, 'n_pcs': 2000}. Best is trial 15 with value: 0.21987372120888282.
2026-06-01 14:14:54 | INFO | Trial 29 | outer=9 | hidden=[512, 128] epochs=85 lr=9.324e-05 wd=1.196e-05 n_pcs=3500 weight={'name': 'uniform'}
[I 2026-06-01 14:15:00,045] Trial 29 finished with value: 0.18131547692766864 and parameters: {'hidden_dims': '[512, 128]', 'dropout': 0.240877212393257, 'batch_norm': False, 'lr': 9.323507126507648e-05, 'weight_decay': 1.1964622966373958e-05, 'epochs': 85, 'loss': 'mae', 'optimizer': 'adamw', 'use_snp_selection': False, 'n_pcs': 3500}. Best is trial 15 with value: 0.21987372120888282.
2026-06-01 14:15:00 | INFO | Trial 30 | outer=9 | hidden=[512, 64] epochs=60 lr=4.821e-04 wd=4.147e-08 n_pcs=5000 weight={'name': 'uniform'}
[I 2026-06-01 14:15:05,207] Trial 30 finished with value: 0.19383279378920576 and parameters: {'hidden_dims': '[512, 64]', 'dropout': 0.30954711995564665, 'batch_norm': False, 'lr': 0.0004820891333843855, 'weight_decay': 4.1467458355596777e-08, 'epochs': 60, 'loss': 'mae', 'optimizer': 'adamw', 'use_snp_selection': False, 'n_pcs': 5000}. Best is trial 15 with value: 0.21987372120888282.
2026-06-01 14:15:05 | INFO | Trial 31 | outer=9 | hidden=[1024, 256] epochs=68 lr=3.567e-04 wd=1.645e-06 n_pcs=1000 weight={'name': 'uniform'}
[I 2026-06-01 14:15:09,011] Trial 31 finished with value: 0.20991283932413038 and parameters: {'hidden_dims': '[1024, 256]', 'dropout': 0.4822572993349566, 'batch_norm': False, 'lr': 0.0003566690267905748, 'weight_decay': 1.6449827612816607e-06, 'epochs': 68, 'loss': 'mae', 'optimizer': 'adamw', 'use_snp_selection': False, 'n_pcs': 1000}. Best is trial 15 with value: 0.21987372120888282.
2026-06-01 14:15:09 | INFO | Trial 32 | outer=9 | hidden=[1024, 256] epochs=78 lr=3.544e-04 wd=2.291e-07 n_pcs=500 weight={'name': 'uniform'}
[I 2026-06-01 14:15:12,282] Trial 32 finished with value: 0.1981904789563124 and parameters: {'hidden_dims': '[1024, 256]', 'dropout': 0.5387283699285276, 'batch_norm': False, 'lr': 0.00035438909617763485, 'weight_decay': 2.2913775998662982e-07, 'epochs': 78, 'loss': 'mae', 'optimizer': 'adamw', 'use_snp_selection': False, 'n_pcs': 500}. Best is trial 15 with value: 0.21987372120888282.
2026-06-01 14:15:12 | INFO | Trial 33 | outer=9 | hidden=[1024, 256] epochs=52 lr=1.890e-04 wd=2.757e-06 n_pcs=1000 weight={'name': 'uniform'}
[I 2026-06-01 14:15:15,559] Trial 33 finished with value: 0.20144388966229793 and parameters: {'hidden_dims': '[1024, 256]', 'dropout': 0.46288494272874914, 'batch_norm': False, 'lr': 0.00018902200409220483, 'weight_decay': 2.7573844070097273e-06, 'epochs': 52, 'loss': 'mae', 'optimizer': 'adamw', 'use_snp_selection': False, 'n_pcs': 1000}. Best is trial 15 with value: 0.21987372120888282.
2026-06-01 14:15:15 | INFO | Trial 34 | outer=9 | hidden=[1024, 256] epochs=100 lr=5.908e-05 wd=6.820e-07 n_pcs=1500 weight={'name': 'uniform'}
[I 2026-06-01 14:15:21,287] Trial 34 finished with value: 0.1814646366611932 and parameters: {'hidden_dims': '[1024, 256]', 'dropout': 0.406608998541627, 'batch_norm': False, 'lr': 5.908244141151402e-05, 'weight_decay': 6.820327510228454e-07, 'epochs': 100, 'loss': 'mse', 'optimizer': 'adamw', 'use_snp_selection': False, 'n_pcs': 1500}. Best is trial 15 with value: 0.21987372120888282.
2026-06-01 14:15:21 | INFO | Trial 35 | outer=9 | hidden=[256, 128] epochs=123 lr=2.548e-04 wd=2.940e-06 n_pcs=500 weight={'name': 'uniform'}
[I 2026-06-01 14:15:24,212] Trial 35 finished with value: 0.181200359120176 and parameters: {'hidden_dims': '[256, 128]', 'dropout': 0.5797943666664487, 'batch_norm': False, 'lr': 0.0002547592559234292, 'weight_decay': 2.9402807890893257e-06, 'epochs': 123, 'loss': 'mae', 'optimizer': 'adamw', 'use_snp_selection': False, 'n_pcs': 500}. Best is trial 15 with value: 0.21987372120888282.
2026-06-01 14:15:24 | INFO | Trial 36 | outer=9 | hidden=[256, 64] epochs=168 lr=3.642e-04 wd=4.701e-05 n_pcs=2500 weight={'name': 'uniform'}
[I 2026-06-01 14:15:28,592] Trial 36 finished with value: 0.17936196828140166 and parameters: {'hidden_dims': '[256, 64]', 'dropout': 0.32753760979371416, 'batch_norm': False, 'lr': 0.00036423281421964383, 'weight_decay': 4.700938466455848e-05, 'epochs': 168, 'loss': 'mae', 'optimizer': 'adamw', 'use_snp_selection': False, 'n_pcs': 2500}. Best is trial 15 with value: 0.21987372120888282.
2026-06-01 14:15:28 | INFO | Trial 37 | outer=9 | hidden=[1024, 256] epochs=98 lr=1.689e-04 wd=2.978e-07 n_pcs=1500 weight={'name': 'uniform'}
[I 2026-06-01 14:15:34,248] Trial 37 finished with value: 0.17381443430060908 and parameters: {'hidden_dims': '[1024, 256]', 'dropout': 0.12259502913803602, 'batch_norm': False, 'lr': 0.00016894783147727087, 'weight_decay': 2.9780645143048277e-07, 'epochs': 98, 'loss': 'mse', 'optimizer': 'adamw', 'use_snp_selection': False, 'n_pcs': 1500}. Best is trial 15 with value: 0.21987372120888282.
2026-06-01 14:15:34 | INFO | Trial 38 | outer=9 | hidden=[512, 256] epochs=66 lr=2.154e-04 wd=4.442e-06 n_pcs=1000 weight={'name': 'uniform'}
[I 2026-06-01 14:15:37,026] Trial 38 finished with value: 0.18363424350591 and parameters: {'hidden_dims': '[512, 256]', 'dropout': 0.5167324583583006, 'batch_norm': False, 'lr': 0.00021543771641948612, 'weight_decay': 4.442212483104191e-06, 'epochs': 66, 'loss': 'mae', 'optimizer': 'adamw', 'use_snp_selection': False, 'n_pcs': 1000}. Best is trial 15 with value: 0.21987372120888282.
2026-06-01 14:15:37 | INFO | Trial 39 | outer=9 | hidden=[1024, 256] epochs=80 lr=1.180e-04 wd=9.709e-06 n_pcs=500 weight={'name': 'uniform'}
[I 2026-06-01 14:15:40,343] Trial 39 finished with value: 0.1731913112105839 and parameters: {'hidden_dims': '[1024, 256]', 'dropout': 0.449251487501851, 'batch_norm': False, 'lr': 0.00011800641763534973, 'weight_decay': 9.709185036752759e-06, 'epochs': 80, 'loss': 'mse', 'optimizer': 'adamw', 'use_snp_selection': False, 'n_pcs': 500}. Best is trial 15 with value: 0.21987372120888282.
2026-06-01 14:15:40 | INFO | Trial 40 | outer=9 | hidden=[256, 64] epochs=153 lr=2.933e-04 wd=1.825e-06 n_pcs=2000 weight={'name': 'uniform'}
[I 2026-06-01 14:15:44,112] Trial 40 finished with value: 0.18905436817200288 and parameters: {'hidden_dims': '[256, 64]', 'dropout': 0.18870213882923928, 'batch_norm': False, 'lr': 0.00029332185062302274, 'weight_decay': 1.8254489551368144e-06, 'epochs': 153, 'loss': 'mae', 'optimizer': 'adam', 'use_snp_selection': False, 'n_pcs': 2000}. Best is trial 15 with value: 0.21987372120888282.
2026-06-01 14:15:44 | INFO | Trial 41 | outer=9 | hidden=[1024, 256] epochs=68 lr=3.132e-04 wd=1.403e-06 n_pcs=1000 weight={'name': 'uniform'}
[I 2026-06-01 14:15:47,895] Trial 41 finished with value: 0.2120776389230144 and parameters: {'hidden_dims': '[1024, 256]', 'dropout': 0.48178265344942794, 'batch_norm': False, 'lr': 0.00031317741777024335, 'weight_decay': 1.4033658354728115e-06, 'epochs': 68, 'loss': 'mae', 'optimizer': 'adamw', 'use_snp_selection': False, 'n_pcs': 1000}. Best is trial 15 with value: 0.21987372120888282.
2026-06-01 14:15:47 | INFO | Trial 42 | outer=9 | hidden=[1024, 256] epochs=93 lr=4.136e-04 wd=6.559e-07 n_pcs=1000 weight={'name': 'uniform'}
[I 2026-06-01 14:15:52,455] Trial 42 finished with value: 0.1969714362895843 and parameters: {'hidden_dims': '[1024, 256]', 'dropout': 0.4773447528711038, 'batch_norm': False, 'lr': 0.00041363376135026685, 'weight_decay': 6.558999937441929e-07, 'epochs': 93, 'loss': 'mae', 'optimizer': 'adamw', 'use_snp_selection': False, 'n_pcs': 1000}. Best is trial 15 with value: 0.21987372120888282.
2026-06-01 14:15:52 | INFO | Trial 43 | outer=9 | hidden=[1024, 256] epochs=66 lr=3.372e-04 wd=5.570e-06 n_pcs=1500 weight={'name': 'uniform'}
[I 2026-06-01 14:15:56,821] Trial 43 finished with value: 0.21207425129617336 and parameters: {'hidden_dims': '[1024, 256]', 'dropout': 0.36615095975259404, 'batch_norm': False, 'lr': 0.00033716867243113665, 'weight_decay': 5.570196040809285e-06, 'epochs': 66, 'loss': 'mae', 'optimizer': 'adamw', 'use_snp_selection': False, 'n_pcs': 1500}. Best is trial 15 with value: 0.21987372120888282.
2026-06-01 14:15:56 | INFO | Trial 44 | outer=9 | hidden=[128, 64] epochs=60 lr=3.323e-05 wd=4.725e-06 n_pcs=1500 weight={'name': 'uniform'}
[I 2026-06-01 14:15:58,284] Trial 44 pruned. 
2026-06-01 14:15:58 | INFO | Trial 45 | outer=9 | hidden=[256, 128] epochs=187 lr=4.907e-04 wd=1.848e-07 n_pcs=500 weight={'name': 'uniform'}
