[I 2026-06-01 12:48:19,572] Trial 14 finished with value: 0.21545202520202192 and parameters: {'hidden_dims': '[512, 256]', 'dropout': 0.3744153728266738, 'batch_norm': False, 'lr': 0.0001839757081557677, 'weight_decay': 0.00013375076999927368, 'epochs': 103, 'loss': 'mse', 'optimizer': 'adamw', 'use_snp_selection': False, 'n_pcs': 4500}. Best is trial 10 with value: 0.2157542229500935.
2026-06-01 12:48:19 | INFO | Trial 15 | outer=5 | hidden=[512, 256] epochs=83 lr=2.106e-04 wd=9.571e-05 n_pcs=5000 weight={'name': 'uniform'}
[I 2026-06-01 12:48:25,743] Trial 15 finished with value: 0.21740370402059045 and parameters: {'hidden_dims': '[512, 256]', 'dropout': 0.5452498906747084, 'batch_norm': False, 'lr': 0.00021056330214809507, 'weight_decay': 9.571452484523231e-05, 'epochs': 83, 'loss': 'mse', 'optimizer': 'adamw', 'use_snp_selection': False, 'n_pcs': 5000}. Best is trial 15 with value: 0.21740370402059045.
2026-06-01 12:48:25 | INFO | Trial 16 | outer=5 | hidden=[512, 256] epochs=52 lr=2.898e-04 wd=1.742e-04 n_pcs=5000 weight={'name': 'uniform'}
[I 2026-06-01 12:48:30,477] Trial 16 finished with value: 0.1890860089752011 and parameters: {'hidden_dims': '[512, 256]', 'dropout': 0.587014770527661, 'batch_norm': False, 'lr': 0.0002898136591829948, 'weight_decay': 0.00017416232297649785, 'epochs': 52, 'loss': 'mse', 'optimizer': 'adamw', 'use_snp_selection': False, 'n_pcs': 5000}. Best is trial 15 with value: 0.21740370402059045.
2026-06-01 12:48:30 | INFO | Trial 17 | outer=5 | hidden=[512, 256] epochs=80 lr=2.588e-04 wd=1.184e-08 n_pcs=4500 weight={'name': 'uniform'}
[I 2026-06-01 12:48:36,261] Trial 17 finished with value: 0.20103172316335835 and parameters: {'hidden_dims': '[512, 256]', 'dropout': 0.49608622640645167, 'batch_norm': False, 'lr': 0.0002587786856585776, 'weight_decay': 1.1840058441529551e-08, 'epochs': 80, 'loss': 'mse', 'optimizer': 'adamw', 'use_snp_selection': False, 'n_pcs': 4500}. Best is trial 15 with value: 0.21740370402059045.
2026-06-01 12:48:36 | INFO | Trial 18 | outer=5 | hidden=[512, 64] epochs=140 lr=1.295e-04 wd=2.442e-04 n_pcs=1500 weight={'name': 'uniform'}
[I 2026-06-01 12:48:40,332] Trial 18 finished with value: 0.19802444763349647 and parameters: {'hidden_dims': '[512, 64]', 'dropout': 0.5228323794879333, 'batch_norm': False, 'lr': 0.00012946030873462993, 'weight_decay': 0.0002441606412327356, 'epochs': 140, 'loss': 'mae', 'optimizer': 'adamw', 'use_snp_selection': False, 'n_pcs': 1500}. Best is trial 15 with value: 0.21740370402059045.
2026-06-01 12:48:40 | INFO | Trial 19 | outer=5 | hidden=[256, 128] epochs=128 lr=3.567e-04 wd=3.389e-05 n_pcs=3500 weight={'name': 'uniform'}
[I 2026-06-01 12:48:44,686] Trial 19 finished with value: 0.1887967831789226 and parameters: {'hidden_dims': '[256, 128]', 'dropout': 0.591075974708041, 'batch_norm': False, 'lr': 0.00035671867692910566, 'weight_decay': 3.388627446573428e-05, 'epochs': 128, 'loss': 'mse', 'optimizer': 'adamw', 'use_snp_selection': False, 'n_pcs': 3500}. Best is trial 15 with value: 0.21740370402059045.
2026-06-01 12:48:44 | INFO | Trial 20 | outer=5 | hidden=[1024, 256] epochs=78 lr=1.205e-04 wd=3.762e-04 n_pcs=4500 weight={'name': 'uniform'}
[I 2026-06-01 12:48:53,645] Trial 20 finished with value: 0.19063038570301166 and parameters: {'hidden_dims': '[1024, 256]', 'dropout': 0.45310990983692423, 'batch_norm': False, 'lr': 0.0001205007941596907, 'weight_decay': 0.0003762417561528185, 'epochs': 78, 'loss': 'mse', 'optimizer': 'adamw', 'use_snp_selection': False, 'n_pcs': 4500}. Best is trial 15 with value: 0.21740370402059045.
2026-06-01 12:48:53 | INFO | Trial 21 | outer=5 | hidden=[512, 256] epochs=105 lr=2.018e-04 wd=9.643e-05 n_pcs=4500 weight={'name': 'uniform'}
[I 2026-06-01 12:49:00,535] Trial 21 finished with value: 0.18527526248130474 and parameters: {'hidden_dims': '[512, 256]', 'dropout': 0.3667723237511644, 'batch_norm': False, 'lr': 0.00020182393018868086, 'weight_decay': 9.642978158930767e-05, 'epochs': 105, 'loss': 'mse', 'optimizer': 'adamw', 'use_snp_selection': False, 'n_pcs': 4500}. Best is trial 15 with value: 0.21740370402059045.
2026-06-01 12:49:00 | INFO | Trial 22 | outer=5 | hidden=[512, 256] epochs=90 lr=1.894e-04 wd=9.974e-05 n_pcs=5000 weight={'name': 'uniform'}
[I 2026-06-01 12:49:07,030] Trial 22 finished with value: 0.19454841206832515 and parameters: {'hidden_dims': '[512, 256]', 'dropout': 0.532426263045599, 'batch_norm': False, 'lr': 0.0001893675339997014, 'weight_decay': 9.974499671757187e-05, 'epochs': 90, 'loss': 'mse', 'optimizer': 'adamw', 'use_snp_selection': False, 'n_pcs': 5000}. Best is trial 15 with value: 0.21740370402059045.
2026-06-01 12:49:07 | INFO | Trial 23 | outer=5 | hidden=[512, 256] epochs=108 lr=4.876e-04 wd=1.679e-05 n_pcs=4500 weight={'name': 'uniform'}
[I 2026-06-01 12:49:14,050] Trial 23 finished with value: 0.21924216063615357 and parameters: {'hidden_dims': '[512, 256]', 'dropout': 0.35592145275620635, 'batch_norm': False, 'lr': 0.00048762021389719837, 'weight_decay': 1.6794332811029697e-05, 'epochs': 108, 'loss': 'mse', 'optimizer': 'adamw', 'use_snp_selection': False, 'n_pcs': 4500}. Best is trial 23 with value: 0.21924216063615357.
2026-06-01 12:49:14 | INFO | Trial 24 | outer=5 | hidden=[512, 256] epochs=152 lr=4.289e-04 wd=2.335e-05 n_pcs=3500 weight={'name': 'uniform'}
[I 2026-06-01 12:49:21,574] Trial 24 finished with value: 0.18692359747085424 and parameters: {'hidden_dims': '[512, 256]', 'dropout': 0.45753063404867866, 'batch_norm': False, 'lr': 0.0004289089548880018, 'weight_decay': 2.334973957374772e-05, 'epochs': 152, 'loss': 'mse', 'optimizer': 'adamw', 'use_snp_selection': False, 'n_pcs': 3500}. Best is trial 23 with value: 0.21924216063615357.
2026-06-01 12:49:21 | INFO | Trial 25 | outer=5 | hidden=[512, 256] epochs=68 lr=2.984e-04 wd=4.273e-04 n_pcs=5000 weight={'name': 'uniform'}
[I 2026-06-01 12:49:27,028] Trial 25 finished with value: 0.18871698103007034 and parameters: {'hidden_dims': '[512, 256]', 'dropout': 0.5936574567793828, 'batch_norm': False, 'lr': 0.00029835779380990595, 'weight_decay': 0.00042728140316878796, 'epochs': 68, 'loss': 'mse', 'optimizer': 'adamw', 'use_snp_selection': False, 'n_pcs': 5000}. Best is trial 23 with value: 0.21924216063615357.
2026-06-01 12:49:27 | INFO | Trial 26 | outer=5 | hidden=[512, 128] epochs=120 lr=4.852e-04 wd=1.359e-06 n_pcs=4500 weight={'name': 'uniform'}
[I 2026-06-01 12:49:34,311] Trial 26 finished with value: 0.2282589829782725 and parameters: {'hidden_dims': '[512, 128]', 'dropout': 0.23879420023061243, 'batch_norm': False, 'lr': 0.0004852455914501801, 'weight_decay': 1.3592710844041344e-06, 'epochs': 120, 'loss': 'mse', 'optimizer': 'adamw', 'use_snp_selection': False, 'n_pcs': 4500}. Best is trial 26 with value: 0.2282589829782725.
2026-06-01 12:49:34 | INFO | Trial 27 | outer=5 | hidden=[512, 256] epochs=126 lr=2.669e-04 wd=8.892e-07 n_pcs=3500 weight={'name': 'uniform'}
[I 2026-06-01 12:49:40,902] Trial 27 finished with value: 0.20461121455032286 and parameters: {'hidden_dims': '[512, 256]', 'dropout': 0.22864006894156455, 'batch_norm': False, 'lr': 0.0002669043878325438, 'weight_decay': 8.891775140974194e-07, 'epochs': 126, 'loss': 'mae', 'optimizer': 'adam', 'use_snp_selection': False, 'n_pcs': 3500}. Best is trial 26 with value: 0.2282589829782725.
2026-06-01 12:49:40 | INFO | Trial 28 | outer=5 | hidden=[512, 64] epochs=177 lr=3.312e-04 wd=7.659e-07 n_pcs=4500 weight={'name': 'uniform'}
[I 2026-06-01 12:49:50,412] Trial 28 finished with value: 0.2230116442692668 and parameters: {'hidden_dims': '[512, 64]', 'dropout': 0.23280892999832734, 'batch_norm': False, 'lr': 0.00033124767195975017, 'weight_decay': 7.658739152709899e-07, 'epochs': 177, 'loss': 'mse', 'optimizer': 'adamw', 'use_snp_selection': False, 'n_pcs': 4500}. Best is trial 26 with value: 0.2282589829782725.
2026-06-01 12:49:50 | INFO | Trial 29 | outer=5 | hidden=[512, 64] epochs=184 lr=1.034e-04 wd=1.056e-06 n_pcs=1500 weight={'name': 'uniform'}
[I 2026-06-01 12:49:53,294] Trial 29 pruned. 
2026-06-01 12:49:53 | INFO | Trial 30 | outer=5 | hidden=[256, 64] epochs=177 lr=4.618e-04 wd=8.955e-07 n_pcs=4500 weight={'name': 'uniform'}
[I 2026-06-01 12:49:59,402] Trial 30 finished with value: 0.21779465883186483 and parameters: {'hidden_dims': '[256, 64]', 'dropout': 0.3365558564977478, 'batch_norm': False, 'lr': 0.0004618320234021363, 'weight_decay': 8.954801150603805e-07, 'epochs': 177, 'loss': 'mse', 'optimizer': 'adamw', 'use_snp_selection': False, 'n_pcs': 4500}. Best is trial 26 with value: 0.2282589829782725.
2026-06-01 12:49:59 | INFO | Trial 31 | outer=5 | hidden=[256, 64] epochs=186 lr=4.804e-04 wd=8.356e-07 n_pcs=4500 weight={'name': 'uniform'}
[I 2026-06-01 12:50:05,720] Trial 31 finished with value: 0.20243883596965895 and parameters: {'hidden_dims': '[256, 64]', 'dropout': 0.32770368934529487, 'batch_norm': False, 'lr': 0.0004804448992047225, 'weight_decay': 8.355765284009335e-07, 'epochs': 186, 'loss': 'mse', 'optimizer': 'adamw', 'use_snp_selection': False, 'n_pcs': 4500}. Best is trial 26 with value: 0.2282589829782725.
2026-06-01 12:50:05 | INFO | Trial 32 | outer=5 | hidden=[256, 64] epochs=206 lr=3.422e-04 wd=4.495e-07 n_pcs=4000 weight={'name': 'uniform'}
[I 2026-06-01 12:50:11,912] Trial 32 finished with value: 0.20851783213230943 and parameters: {'hidden_dims': '[256, 64]', 'dropout': 0.24098325484026267, 'batch_norm': False, 'lr': 0.000342175351286508, 'weight_decay': 4.495172423066423e-07, 'epochs': 206, 'loss': 'mse', 'optimizer': 'adamw', 'use_snp_selection': False, 'n_pcs': 4000}. Best is trial 26 with value: 0.2282589829782725.
2026-06-01 12:50:11 | INFO | Trial 33 | outer=5 | hidden=[256, 64] epochs=233 lr=4.786e-04 wd=1.962e-06 n_pcs=1000 weight={'name': 'uniform'}
[I 2026-06-01 12:50:16,216] Trial 33 finished with value: 0.18794475767004276 and parameters: {'hidden_dims': '[256, 64]', 'dropout': 0.2739635306734217, 'batch_norm': False, 'lr': 0.00047862685247888534, 'weight_decay': 1.9624497918650815e-06, 'epochs': 233, 'loss': 'mse', 'optimizer': 'adamw', 'use_snp_selection': False, 'n_pcs': 1000}. Best is trial 26 with value: 0.2282589829782725.
2026-06-01 12:50:16 | INFO | Trial 34 | outer=5 | hidden=[512, 64] epochs=147 lr=3.426e-04 wd=1.305e-05 n_pcs=2000 weight={'name': 'uniform'}
[I 2026-06-01 12:50:21,026] Trial 34 finished with value: 0.19433977820789974 and parameters: {'hidden_dims': '[512, 64]', 'dropout': 0.33500393222331615, 'batch_norm': False, 'lr': 0.0003426214186298123, 'weight_decay': 1.3049952564925135e-05, 'epochs': 147, 'loss': 'mse', 'optimizer': 'adamw', 'use_snp_selection': False, 'n_pcs': 2000}. Best is trial 26 with value: 0.2282589829782725.
2026-06-01 12:50:21 | INFO | Trial 35 | outer=5 | hidden=[1024, 256] epochs=173 lr=1.558e-04 wd=3.065e-07 n_pcs=3500 weight={'name': 'uniform'}
[I 2026-06-01 12:50:35,012] Trial 35 finished with value: 0.18623705454291176 and parameters: {'hidden_dims': '[1024, 256]', 'dropout': 0.20812801019972912, 'batch_norm': False, 'lr': 0.00015581468389661503, 'weight_decay': 3.0654561803742376e-07, 'epochs': 173, 'loss': 'mse', 'optimizer': 'adam', 'use_snp_selection': False, 'n_pcs': 3500}. Best is trial 26 with value: 0.2282589829782725.
2026-06-01 12:50:35 | INFO | Trial 36 | outer=5 | hidden=[256, 64] epochs=191 lr=5.374e-05 wd=2.352e-06 n_pcs=4500 weight={'name': 'uniform'}
[I 2026-06-01 12:50:39,506] Trial 36 pruned. 
2026-06-01 12:50:39 | INFO | Trial 37 | outer=5 | hidden=[512, 64] epochs=237 lr=2.459e-04 wd=4.670e-08 n_pcs=500 weight={'name': 'uniform'}
[I 2026-06-01 12:50:42,100] Trial 37 pruned. 
2026-06-01 12:50:42 | INFO | Trial 38 | outer=5 | hidden=[256, 128] epochs=158 lr=3.268e-04 wd=3.211e-06 n_pcs=4000 weight={'name': 'uniform'}
[I 2026-06-01 12:50:47,388] Trial 38 finished with value: 0.2066607916424011 and parameters: {'hidden_dims': '[256, 128]', 'dropout': 0.267227178400089, 'batch_norm': False, 'lr': 0.00032682754003945794, 'weight_decay': 3.2105972992542436e-06, 'epochs': 158, 'loss': 'mse', 'optimizer': 'adamw', 'use_snp_selection': False, 'n_pcs': 4000}. Best is trial 26 with value: 0.2282589829782725.
2026-06-01 12:50:47 | INFO | Trial 39 | outer=5 | hidden=[256, 64] epochs=130 lr=4.039e-04 wd=4.009e-07 n_pcs=3000 weight={'name': 'uniform'}
[I 2026-06-01 12:50:51,384] Trial 39 finished with value: 0.1867838873217209 and parameters: {'hidden_dims': '[256, 64]', 'dropout': 0.30466803411264687, 'batch_norm': False, 'lr': 0.00040386320324193247, 'weight_decay': 4.009251794455057e-07, 'epochs': 130, 'loss': 'mse', 'optimizer': 'adamw', 'use_snp_selection': False, 'n_pcs': 3000}. Best is trial 26 with value: 0.2282589829782725.
2026-06-01 12:50:51 | INFO | Trial 40 | outer=5 | hidden=[512, 128] epochs=220 lr=9.345e-05 wd=1.322e-05 n_pcs=4500 weight={'name': 'uniform'}
[I 2026-06-01 12:51:02,936] Trial 40 finished with value: 0.19284179829147813 and parameters: {'hidden_dims': '[512, 128]', 'dropout': 0.41158605068261167, 'batch_norm': False, 'lr': 9.344849169373414e-05, 'weight_decay': 1.3223100499610223e-05, 'epochs': 220, 'loss': 'mae', 'optimizer': 'adam', 'use_snp_selection': False, 'n_pcs': 4500}. Best is trial 26 with value: 0.2282589829782725.
2026-06-01 12:51:02 | INFO | Trial 41 | outer=5 | hidden=[512, 64] epochs=192 lr=2.240e-04 wd=6.942e-05 n_pcs=5000 weight={'name': 'uniform'}
[I 2026-06-01 12:51:13,572] Trial 41 finished with value: 0.2071500705711628 and parameters: {'hidden_dims': '[512, 64]', 'dropout': 0.19287404400891722, 'batch_norm': False, 'lr': 0.0002239613794466761, 'weight_decay': 6.941747975762049e-05, 'epochs': 192, 'loss': 'mse', 'optimizer': 'adamw', 'use_snp_selection': False, 'n_pcs': 5000}. Best is trial 26 with value: 0.2282589829782725.
2026-06-01 12:51:13 | INFO | Trial 42 | outer=5 | hidden=[1024, 256] epochs=91 lr=1.586e-04 wd=1.581e-06 n_pcs=4500 weight={'name': 'uniform'}
[I 2026-06-01 12:51:23,649] Trial 42 finished with value: 0.2253353311777023 and parameters: {'hidden_dims': '[1024, 256]', 'dropout': 0.147013372642067, 'batch_norm': False, 'lr': 0.00015861858531344354, 'weight_decay': 1.580631474224288e-06, 'epochs': 91, 'loss': 'mse', 'optimizer': 'adamw', 'use_snp_selection': False, 'n_pcs': 4500}. Best is trial 26 with value: 0.2282589829782725.
2026-06-01 12:51:23 | INFO | Trial 43 | outer=5 | hidden=[1024, 256] epochs=103 lr=1.673e-04 wd=1.808e-06 n_pcs=4000 weight={'name': 'uniform'}
[I 2026-06-01 12:51:33,701] Trial 43 finished with value: 0.20903730305358822 and parameters: {'hidden_dims': '[1024, 256]', 'dropout': 0.052730467321757096, 'batch_norm': False, 'lr': 0.00016729221547066107, 'weight_decay': 1.8082097732945876e-06, 'epochs': 103, 'loss': 'mse', 'optimizer': 'adamw', 'use_snp_selection': False, 'n_pcs': 4000}. Best is trial 26 with value: 0.2282589829782725.
2026-06-01 12:51:33 | INFO | Trial 44 | outer=5 | hidden=[1024, 256] epochs=173 lr=3.905e-04 wd=5.392e-06 n_pcs=4500 weight={'name': 'uniform'}
[I 2026-06-01 12:51:50,695] Trial 44 finished with value: 0.22425936096674937 and parameters: {'hidden_dims': '[1024, 256]', 'dropout': 0.14160551273569566, 'batch_norm': False, 'lr': 0.0003905084691399103, 'weight_decay': 5.391818491151401e-06, 'epochs': 173, 'loss': 'mse', 'optimizer': 'adamw', 'use_snp_selection': False, 'n_pcs': 4500}. Best is trial 26 with value: 0.2282589829782725.
2026-06-01 12:51:50 | INFO | Trial 45 | outer=5 | hidden=[1024, 256] epochs=66 lr=3.854e-04 wd=6.430e-06 n_pcs=4000 weight={'name': 'uniform'}
[I 2026-06-01 12:51:57,913] Trial 45 finished with value: 0.21815459823482014 and parameters: {'hidden_dims': '[1024, 256]', 'dropout': 0.1571884912639619, 'batch_norm': False, 'lr': 0.00038541790307751906, 'weight_decay': 6.429618779242154e-06, 'epochs': 66, 'loss': 'mse', 'optimizer': 'adamw', 'use_snp_selection': False, 'n_pcs': 4000}. Best is trial 26 with value: 0.2282589829782725.
2026-06-01 12:51:57 | INFO | Trial 46 | outer=5 | hidden=[1024, 256] epochs=91 lr=1.030e-05 wd=1.026e-05 n_pcs=4500 weight={'name': 'uniform'}
[I 2026-06-01 12:52:03,881] Trial 46 pruned. 
2026-06-01 12:52:03 | INFO | Trial 47 | outer=5 | hidden=[1024, 256] epochs=119 lr=7.036e-05 wd=4.580e-06 n_pcs=3500 weight={'name': 'uniform'}
[I 2026-06-01 12:52:14,129] Trial 47 finished with value: 0.1935280636049423 and parameters: {'hidden_dims': '[1024, 256]', 'dropout': 0.14227792296758704, 'batch_norm': False, 'lr': 7.03553977779309e-05, 'weight_decay': 4.580203106181452e-06, 'epochs': 119, 'loss': 'mse', 'optimizer': 'adamw', 'use_snp_selection': False, 'n_pcs': 3500}. Best is trial 26 with value: 0.2282589829782725.
2026-06-01 12:52:14 | INFO | Trial 48 | outer=5 | hidden=[1024, 256] epochs=249 lr=3.035e-04 wd=1.950e-05 n_pcs=4000 weight={'name': 'uniform'}
[I 2026-06-01 12:52:35,148] Trial 48 finished with value: 0.21561379404071035 and parameters: {'hidden_dims': '[1024, 256]', 'dropout': 0.1307912659294487, 'batch_norm': False, 'lr': 0.0003035443256439836, 'weight_decay': 1.9503961539184455e-05, 'epochs': 249, 'loss': 'mse', 'optimizer': 'adamw', 'use_snp_selection': False, 'n_pcs': 4000}. Best is trial 26 with value: 0.2282589829782725.
2026-06-01 12:52:35 | INFO | Trial 49 | outer=5 | hidden=[128, 64] epochs=139 lr=3.952e-04 wd=1.728e-07 n_pcs=5000 weight={'name': 'uniform'}
[I 2026-06-01 12:52:37,592] Trial 49 pruned. 
2026-06-01 12:52:37 | INFO | Trial 50 | outer=5 | hidden=[512, 128] epochs=165 lr=2.375e-04 wd=1.372e-06 n_pcs=2500 weight={'name': 'uniform'}
[I 2026-06-01 12:52:43,639] Trial 50 finished with value: 0.1901420837507149 and parameters: {'hidden_dims': '[512, 128]', 'dropout': 0.20235184886093888, 'batch_norm': False, 'lr': 0.00023747152045592025, 'weight_decay': 1.3719273026023104e-06, 'epochs': 165, 'loss': 'mse', 'optimizer': 'adamw', 'use_snp_selection': False, 'n_pcs': 2500}. Best is trial 26 with value: 0.2282589829782725.
2026-06-01 12:52:43 | INFO | Trial 51 | outer=5 | hidden=[1024, 256] epochs=69 lr=3.696e-04 wd=6.070e-06 n_pcs=4000 weight={'name': 'uniform'}
[I 2026-06-01 12:52:51,096] Trial 51 finished with value: 0.21625047985325613 and parameters: {'hidden_dims': '[1024, 256]', 'dropout': 0.1522181613564291, 'batch_norm': False, 'lr': 0.00036955748280373814, 'weight_decay': 6.070304191952192e-06, 'epochs': 69, 'loss': 'mse', 'optimizer': 'adamw', 'use_snp_selection': False, 'n_pcs': 4000}. Best is trial 26 with value: 0.2282589829782725.
2026-06-01 12:52:51 | INFO | Trial 52 | outer=5 | hidden=[1024, 256] epochs=63 lr=4.346e-04 wd=4.536e-06 n_pcs=4500 weight={'name': 'uniform'}
[I 2026-06-01 12:52:58,782] Trial 52 finished with value: 0.22817493839525665 and parameters: {'hidden_dims': '[1024, 256]', 'dropout': 0.16915289103242628, 'batch_norm': False, 'lr': 0.0004345912750019182, 'weight_decay': 4.536492044133772e-06, 'epochs': 63, 'loss': 'mse', 'optimizer': 'adamw', 'use_snp_selection': False, 'n_pcs': 4500}. Best is trial 26 with value: 0.2282589829782725.
2026-06-01 12:52:58 | INFO | Trial 53 | outer=5 | hidden=[1024, 256] epochs=92 lr=2.852e-04 wd=3.343e-06 n_pcs=4500 weight={'name': 'uniform'}
[I 2026-06-01 12:53:08,916] Trial 53 finished with value: 0.21918102937399034 and parameters: {'hidden_dims': '[1024, 256]', 'dropout': 0.17964565972576158, 'batch_norm': False, 'lr': 0.0002852127209098272, 'weight_decay': 3.3432929496241125e-06, 'epochs': 92, 'loss': 'mse', 'optimizer': 'adamw', 'use_snp_selection': False, 'n_pcs': 4500}. Best is trial 26 with value: 0.2282589829782725.
2026-06-01 12:53:08 | INFO | Trial 54 | outer=5 | hidden=[1024, 256] epochs=114 lr=4.905e-04 wd=4.800e-07 n_pcs=5000 weight={'name': 'uniform'}
[I 2026-06-01 12:53:21,643] Trial 54 finished with value: 0.2227366533771454 and parameters: {'hidden_dims': '[1024, 256]', 'dropout': 0.11319747271961789, 'batch_norm': False, 'lr': 0.000490455617506729, 'weight_decay': 4.799608672866786e-07, 'epochs': 114, 'loss': 'mse', 'optimizer': 'adamw', 'use_snp_selection': False, 'n_pcs': 5000}. Best is trial 26 with value: 0.2282589829782725.
2026-06-01 12:53:21 | INFO | Trial 55 | outer=5 | hidden=[1024, 256] epochs=59 lr=4.171e-04 wd=4.554e-07 n_pcs=5000 weight={'name': 'uniform'}
[I 2026-06-01 12:53:27,051] Trial 55 pruned. 
2026-06-01 12:53:27 | INFO | Trial 56 | outer=5 | hidden=[1024, 256] epochs=117 lr=3.108e-05 wd=6.414e-07 n_pcs=5000 weight={'name': 'uniform'}
[I 2026-06-01 12:53:40,019] Trial 56 finished with value: 0.13196711482960194 and parameters: {'hidden_dims': '[1024, 256]', 'dropout': 0.049930081350670355, 'batch_norm': False, 'lr': 3.108041501420272e-05, 'weight_decay': 6.413905001149867e-07, 'epochs': 117, 'loss': 'mae', 'optimizer': 'adamw', 'use_snp_selection': False, 'n_pcs': 5000}. Best is trial 26 with value: 0.2282589829782725.
2026-06-01 12:53:40 | INFO | Trial 57 | outer=5 | hidden=[1024, 256] epochs=98 lr=3.254e-04 wd=2.916e-07 n_pcs=4500 weight={'name': 'uniform'}
[I 2026-06-01 12:53:50,667] Trial 57 finished with value: 0.22477338770770325 and parameters: {'hidden_dims': '[1024, 256]', 'dropout': 0.24858308413319, 'batch_norm': False, 'lr': 0.0003253520132823515, 'weight_decay': 2.916351129997807e-07, 'epochs': 98, 'loss': 'mse', 'optimizer': 'adamw', 'use_snp_selection': False, 'n_pcs': 4500}. Best is trial 26 with value: 0.2282589829782725.
2026-06-01 12:53:50 | INFO | Trial 58 | outer=5 | hidden=[512, 128] epochs=98 lr=1.534e-04 wd=2.800e-07 n_pcs=4500 weight={'name': 'uniform'}
[I 2026-06-01 12:53:57,035] Trial 58 finished with value: 0.20607257573012783 and parameters: {'hidden_dims': '[512, 128]', 'dropout': 0.2539881992626264, 'batch_norm': False, 'lr': 0.0001534163069545412, 'weight_decay': 2.8001900613067234e-07, 'epochs': 98, 'loss': 'mse', 'optimizer': 'adamw', 'use_snp_selection': False, 'n_pcs': 4500}. Best is trial 26 with value: 0.2282589829782725.
2026-06-01 12:53:57 | INFO | Trial 59 | outer=5 | hidden=[256, 128] epochs=50 lr=3.078e-04 wd=5.842e-08 n_pcs=4000 weight={'name': 'uniform'}
