[I 2026-06-01 12:37:12,420] Trial 119 finished with value: 0.15368289815945707 and parameters: {'hidden_dims': '[1024, 256]', 'dropout': 0.0054388786965648556, 'batch_norm': False, 'lr': 7.484426851448642e-05, 'weight_decay': 0.0005199770627586437, 'epochs': 206, 'loss': 'mae', 'optimizer': 'adamw', 'use_snp_selection': False, 'n_pcs': 5000}. Best is trial 90 with value: 0.19782220964272978.
2026-06-01 12:37:12 | INFO | Trial 120 | outer=4 | hidden=[1024, 256] epochs=220 lr=4.668e-04 wd=3.693e-04 n_pcs=5000 weight={'name': 'uniform'}
[I 2026-06-01 12:37:28,934] Trial 120 pruned. 
2026-06-01 12:37:28 | INFO | Trial 121 | outer=4 | hidden=[1024, 256] epochs=199 lr=4.311e-04 wd=5.138e-04 n_pcs=5000 weight={'name': 'uniform'}
[I 2026-06-01 12:37:50,681] Trial 121 finished with value: 0.17391900632595195 and parameters: {'hidden_dims': '[1024, 256]', 'dropout': 0.018107816515006148, 'batch_norm': False, 'lr': 0.00043109532295952874, 'weight_decay': 0.0005137652587041107, 'epochs': 199, 'loss': 'mae', 'optimizer': 'adamw', 'use_snp_selection': False, 'n_pcs': 5000}. Best is trial 90 with value: 0.19782220964272978.
2026-06-01 12:37:50 | INFO | Trial 122 | outer=4 | hidden=[1024, 256] epochs=208 lr=3.703e-04 wd=6.426e-04 n_pcs=5000 weight={'name': 'uniform'}
[I 2026-06-01 12:38:13,282] Trial 122 finished with value: 0.17498179786410237 and parameters: {'hidden_dims': '[1024, 256]', 'dropout': 0.08402330162414903, 'batch_norm': False, 'lr': 0.00037026510426822263, 'weight_decay': 0.0006426142482115745, 'epochs': 208, 'loss': 'mae', 'optimizer': 'adamw', 'use_snp_selection': False, 'n_pcs': 5000}. Best is trial 90 with value: 0.19782220964272978.
2026-06-01 12:38:13 | INFO | Trial 123 | outer=4 | hidden=[1024, 256] epochs=187 lr=4.139e-04 wd=9.999e-04 n_pcs=5000 weight={'name': 'uniform'}
[I 2026-06-01 12:38:33,845] Trial 123 finished with value: 0.17533661500562905 and parameters: {'hidden_dims': '[1024, 256]', 'dropout': 0.04010552742527263, 'batch_norm': False, 'lr': 0.0004139276453662006, 'weight_decay': 0.00099988080119785, 'epochs': 187, 'loss': 'mae', 'optimizer': 'adamw', 'use_snp_selection': False, 'n_pcs': 5000}. Best is trial 90 with value: 0.19782220964272978.
2026-06-01 12:38:33 | INFO | Trial 124 | outer=4 | hidden=[1024, 256] epochs=201 lr=4.502e-04 wd=4.303e-04 n_pcs=5000 weight={'name': 'uniform'}
[I 2026-06-01 12:38:55,758] Trial 124 finished with value: 0.18249058000184443 and parameters: {'hidden_dims': '[1024, 256]', 'dropout': 0.14929387254110288, 'batch_norm': False, 'lr': 0.00045018034388339675, 'weight_decay': 0.0004303100487604694, 'epochs': 201, 'loss': 'mae', 'optimizer': 'adamw', 'use_snp_selection': False, 'n_pcs': 5000}. Best is trial 90 with value: 0.19782220964272978.
2026-06-01 12:38:55 | INFO | Trial 125 | outer=4 | hidden=[1024, 256] epochs=215 lr=3.499e-04 wd=5.554e-04 n_pcs=5000 weight={'name': 'uniform'}
[I 2026-06-01 12:39:19,031] Trial 125 finished with value: 0.1881601870832934 and parameters: {'hidden_dims': '[1024, 256]', 'dropout': 0.22648838110657915, 'batch_norm': False, 'lr': 0.0003498557992766423, 'weight_decay': 0.0005554337988354435, 'epochs': 215, 'loss': 'mae', 'optimizer': 'adamw', 'use_snp_selection': False, 'n_pcs': 5000}. Best is trial 90 with value: 0.19782220964272978.
2026-06-01 12:39:19 | INFO | Trial 126 | outer=4 | hidden=[256, 64] epochs=224 lr=5.379e-05 wd=3.337e-04 n_pcs=5000 weight={'name': 'uniform'}
[I 2026-06-01 12:39:23,733] Trial 126 pruned. 
2026-06-01 12:39:23 | INFO | Trial 127 | outer=4 | hidden=[1024, 256] epochs=215 lr=3.530e-04 wd=5.560e-04 n_pcs=2000 weight={'name': 'uniform'}
[I 2026-06-01 12:39:36,290] Trial 127 finished with value: 0.17370133442722463 and parameters: {'hidden_dims': '[1024, 256]', 'dropout': 0.26550132749775973, 'batch_norm': False, 'lr': 0.0003530159608493461, 'weight_decay': 0.0005559695441036562, 'epochs': 215, 'loss': 'mae', 'optimizer': 'adamw', 'use_snp_selection': False, 'n_pcs': 2000}. Best is trial 90 with value: 0.19782220964272978.
2026-06-01 12:39:36 | INFO | Trial 128 | outer=4 | hidden=[512, 256] epochs=230 lr=3.784e-04 wd=3.954e-04 n_pcs=1000 weight={'name': 'uniform'}
[I 2026-06-01 12:39:39,683] Trial 128 pruned. 
2026-06-01 12:39:39 | INFO | Trial 129 | outer=4 | hidden=[1024, 256] epochs=211 lr=3.205e-04 wd=2.945e-04 n_pcs=5000 weight={'name': 'uniform'}
[I 2026-06-01 12:40:02,573] Trial 129 finished with value: 0.1761826175049801 and parameters: {'hidden_dims': '[1024, 256]', 'dropout': 0.28296566763550546, 'batch_norm': False, 'lr': 0.00032054871668857967, 'weight_decay': 0.00029446545219752454, 'epochs': 211, 'loss': 'mae', 'optimizer': 'adamw', 'use_snp_selection': False, 'n_pcs': 5000}. Best is trial 90 with value: 0.19782220964272978.
2026-06-01 12:40:02 | INFO | Trial 130 | outer=4 | hidden=[1024, 256] epochs=191 lr=4.755e-04 wd=5.858e-04 n_pcs=5000 weight={'name': 'uniform'}
[I 2026-06-01 12:40:17,146] Trial 130 pruned. 
2026-06-01 12:40:17 | INFO | Trial 131 | outer=4 | hidden=[1024, 256] epochs=198 lr=4.384e-04 wd=8.002e-04 n_pcs=5000 weight={'name': 'uniform'}
[I 2026-06-01 12:40:32,176] Trial 131 pruned. 
2026-06-01 12:40:32 | INFO | Trial 132 | outer=4 | hidden=[1024, 256] epochs=218 lr=3.999e-04 wd=7.725e-04 n_pcs=5000 weight={'name': 'uniform'}
[I 2026-06-01 12:40:55,707] Trial 132 finished with value: 0.17815720619549694 and parameters: {'hidden_dims': '[1024, 256]', 'dropout': 0.001456660860128231, 'batch_norm': False, 'lr': 0.0003999127272235245, 'weight_decay': 0.0007725180041660539, 'epochs': 218, 'loss': 'mae', 'optimizer': 'adamw', 'use_snp_selection': False, 'n_pcs': 5000}. Best is trial 90 with value: 0.19782220964272978.
2026-06-01 12:40:55 | INFO | Trial 133 | outer=4 | hidden=[1024, 256] epochs=182 lr=4.280e-04 wd=4.498e-04 n_pcs=5000 weight={'name': 'uniform'}
[I 2026-06-01 12:41:09,667] Trial 133 pruned. 
2026-06-01 12:41:09 | INFO | Trial 134 | outer=4 | hidden=[128, 64] epochs=204 lr=4.693e-04 wd=1.472e-08 n_pcs=5000 weight={'name': 'uniform'}
[I 2026-06-01 12:41:13,286] Trial 134 pruned. 
2026-06-01 12:41:13 | INFO | Trial 135 | outer=4 | hidden=[1024, 256] epochs=209 lr=3.544e-04 wd=6.082e-04 n_pcs=4500 weight={'name': 'uniform'}
[I 2026-06-01 12:41:34,298] Trial 135 finished with value: 0.19189089287360214 and parameters: {'hidden_dims': '[1024, 256]', 'dropout': 0.09715482139479648, 'batch_norm': False, 'lr': 0.0003544382079368246, 'weight_decay': 0.0006082233411946398, 'epochs': 209, 'loss': 'mae', 'optimizer': 'adamw', 'use_snp_selection': False, 'n_pcs': 4500}. Best is trial 90 with value: 0.19782220964272978.
2026-06-01 12:41:34 | INFO | Trial 136 | outer=4 | hidden=[1024, 256] epochs=209 lr=3.421e-04 wd=5.457e-04 n_pcs=4500 weight={'name': 'uniform'}
[I 2026-06-01 12:41:55,304] Trial 136 finished with value: 0.18365378371640012 and parameters: {'hidden_dims': '[1024, 256]', 'dropout': 0.09599390240391546, 'batch_norm': False, 'lr': 0.0003420519026337673, 'weight_decay': 0.0005456977474731409, 'epochs': 209, 'loss': 'mae', 'optimizer': 'adamw', 'use_snp_selection': False, 'n_pcs': 4500}. Best is trial 90 with value: 0.19782220964272978.
2026-06-01 12:41:55 | INFO | Trial 137 | outer=4 | hidden=[1024, 256] epochs=237 lr=3.039e-04 wd=9.742e-04 n_pcs=4500 weight={'name': 'uniform'}
[I 2026-06-01 12:42:18,788] Trial 137 finished with value: 0.18296505075389394 and parameters: {'hidden_dims': '[1024, 256]', 'dropout': 0.11967396922363369, 'batch_norm': False, 'lr': 0.0003039340265194067, 'weight_decay': 0.0009741552918711195, 'epochs': 237, 'loss': 'mae', 'optimizer': 'adamw', 'use_snp_selection': False, 'n_pcs': 4500}. Best is trial 90 with value: 0.19782220964272978.
2026-06-01 12:42:18 | INFO | Trial 138 | outer=4 | hidden=[1024, 256] epochs=225 lr=3.900e-04 wd=6.244e-04 n_pcs=4500 weight={'name': 'uniform'}
[I 2026-06-01 12:42:41,212] Trial 138 finished with value: 0.18344784946466164 and parameters: {'hidden_dims': '[1024, 256]', 'dropout': 0.0808301941322323, 'batch_norm': False, 'lr': 0.0003900182908359565, 'weight_decay': 0.0006244395677295824, 'epochs': 225, 'loss': 'mae', 'optimizer': 'adamw', 'use_snp_selection': False, 'n_pcs': 4500}. Best is trial 90 with value: 0.19782220964272978.
2026-06-01 12:42:41 | INFO | Trial 139 | outer=4 | hidden=[1024, 256] epochs=188 lr=1.831e-05 wd=3.103e-04 n_pcs=4500 weight={'name': 'uniform'}
[I 2026-06-01 12:42:54,551] Trial 139 pruned. 
2026-06-01 12:42:54 | INFO | Trial 140 | outer=4 | hidden=[1024, 256] epochs=244 lr=4.958e-04 wd=4.188e-04 n_pcs=4500 weight={'name': 'uniform'}
[I 2026-06-01 12:43:18,677] Trial 140 finished with value: 0.19289507799406533 and parameters: {'hidden_dims': '[1024, 256]', 'dropout': 0.1437001024382759, 'batch_norm': False, 'lr': 0.0004957855954544979, 'weight_decay': 0.00041879567941536784, 'epochs': 244, 'loss': 'mae', 'optimizer': 'adamw', 'use_snp_selection': False, 'n_pcs': 4500}. Best is trial 90 with value: 0.19782220964272978.
2026-06-01 12:43:18 | INFO | Trial 141 | outer=4 | hidden=[1024, 256] epochs=258 lr=4.946e-04 wd=4.586e-04 n_pcs=4500 weight={'name': 'uniform'}
[I 2026-06-01 12:43:44,042] Trial 141 finished with value: 0.18460176652124122 and parameters: {'hidden_dims': '[1024, 256]', 'dropout': 0.15796245474196063, 'batch_norm': False, 'lr': 0.0004945970774765203, 'weight_decay': 0.0004586303491625017, 'epochs': 258, 'loss': 'mae', 'optimizer': 'adamw', 'use_snp_selection': False, 'n_pcs': 4500}. Best is trial 90 with value: 0.19782220964272978.
2026-06-01 12:43:44 | INFO | Trial 142 | outer=4 | hidden=[1024, 256] epochs=217 lr=3.667e-04 wd=3.758e-04 n_pcs=4500 weight={'name': 'uniform'}
[I 2026-06-01 12:44:05,752] Trial 142 finished with value: 0.19150168274230916 and parameters: {'hidden_dims': '[1024, 256]', 'dropout': 0.10317853194906038, 'batch_norm': False, 'lr': 0.00036665348861839026, 'weight_decay': 0.0003757933966750832, 'epochs': 217, 'loss': 'mae', 'optimizer': 'adamw', 'use_snp_selection': False, 'n_pcs': 4500}. Best is trial 90 with value: 0.19782220964272978.
2026-06-01 12:44:05 | INFO | Trial 143 | outer=4 | hidden=[1024, 256] epochs=268 lr=3.636e-04 wd=3.743e-04 n_pcs=4500 weight={'name': 'uniform'}
[I 2026-06-01 12:44:31,998] Trial 143 finished with value: 0.17368698189416992 and parameters: {'hidden_dims': '[1024, 256]', 'dropout': 0.14076803420235817, 'batch_norm': False, 'lr': 0.00036364629652860193, 'weight_decay': 0.0003742595023222965, 'epochs': 268, 'loss': 'mae', 'optimizer': 'adamw', 'use_snp_selection': False, 'n_pcs': 4500}. Best is trial 90 with value: 0.19782220964272978.
2026-06-01 12:44:32 | INFO | Trial 144 | outer=4 | hidden=[1024, 256] epochs=244 lr=3.950e-04 wd=7.021e-04 n_pcs=4500 weight={'name': 'uniform'}
[I 2026-06-01 12:44:56,113] Trial 144 finished with value: 0.18851791943184049 and parameters: {'hidden_dims': '[1024, 256]', 'dropout': 0.10446683246282204, 'batch_norm': False, 'lr': 0.00039503434290417223, 'weight_decay': 0.0007020562159565881, 'epochs': 244, 'loss': 'mae', 'optimizer': 'adamw', 'use_snp_selection': False, 'n_pcs': 4500}. Best is trial 90 with value: 0.19782220964272978.
2026-06-01 12:44:56 | INFO | Trial 145 | outer=4 | hidden=[1024, 256] epochs=262 lr=3.471e-04 wd=1.906e-04 n_pcs=4500 weight={'name': 'uniform'}
[I 2026-06-01 12:45:21,835] Trial 145 finished with value: 0.18314796280032902 and parameters: {'hidden_dims': '[1024, 256]', 'dropout': 0.10339593394590835, 'batch_norm': False, 'lr': 0.0003470903390090223, 'weight_decay': 0.00019059407980742454, 'epochs': 262, 'loss': 'mae', 'optimizer': 'adamw', 'use_snp_selection': False, 'n_pcs': 4500}. Best is trial 90 with value: 0.19782220964272978.
2026-06-01 12:45:21 | INFO | Trial 146 | outer=4 | hidden=[1024, 256] epochs=296 lr=4.999e-04 wd=6.726e-04 n_pcs=4500 weight={'name': 'uniform'}
[I 2026-06-01 12:45:50,569] Trial 146 finished with value: 0.19016207954225867 and parameters: {'hidden_dims': '[1024, 256]', 'dropout': 0.12638302329148907, 'batch_norm': False, 'lr': 0.0004998756634545378, 'weight_decay': 0.0006726153082138731, 'epochs': 296, 'loss': 'mae', 'optimizer': 'adamw', 'use_snp_selection': False, 'n_pcs': 4500}. Best is trial 90 with value: 0.19782220964272978.
2026-06-01 12:45:50 | INFO | Trial 147 | outer=4 | hidden=[1024, 256] epochs=297 lr=4.830e-04 wd=6.804e-04 n_pcs=4500 weight={'name': 'uniform'}
[I 2026-06-01 12:46:19,385] Trial 147 finished with value: 0.18779187697571129 and parameters: {'hidden_dims': '[1024, 256]', 'dropout': 0.12454556037261472, 'batch_norm': False, 'lr': 0.0004829713139184653, 'weight_decay': 0.0006803814238932572, 'epochs': 297, 'loss': 'mae', 'optimizer': 'adamw', 'use_snp_selection': False, 'n_pcs': 4500}. Best is trial 90 with value: 0.19782220964272978.
2026-06-01 12:46:19 | INFO | Trial 148 | outer=4 | hidden=[256, 64] epochs=296 lr=4.838e-04 wd=6.648e-04 n_pcs=4500 weight={'name': 'uniform'}
[I 2026-06-01 12:46:28,697] Trial 148 finished with value: 0.18387221720637173 and parameters: {'hidden_dims': '[256, 64]', 'dropout': 0.12368313095497377, 'batch_norm': False, 'lr': 0.00048384008220699753, 'weight_decay': 0.0006648495342356299, 'epochs': 296, 'loss': 'mae', 'optimizer': 'adamw', 'use_snp_selection': False, 'n_pcs': 4500}. Best is trial 90 with value: 0.19782220964272978.
2026-06-01 12:46:28 | INFO | Trial 149 | outer=4 | hidden=[1024, 256] epochs=243 lr=4.189e-04 wd=2.546e-04 n_pcs=4500 weight={'name': 'uniform'}
[I 2026-06-01 12:46:52,714] Trial 149 finished with value: 0.1780507814642432 and parameters: {'hidden_dims': '[1024, 256]', 'dropout': 0.14128671699699663, 'batch_norm': False, 'lr': 0.000418931699986329, 'weight_decay': 0.0002545676940443661, 'epochs': 243, 'loss': 'mae', 'optimizer': 'adamw', 'use_snp_selection': False, 'n_pcs': 4500}. Best is trial 90 with value: 0.19782220964272978.
2026-06-01 12:46:52 | INFO | OUTER 4 best (inner mean r=0.1978): model={'hidden_dims': [1024, 256], 'dropout': 0.20267320840238626, 'batch_norm': False, 'lr': 0.0004931955675738154, 'weight_decay': 0.000518933324763904, 'epochs': 182, 'loss': 'mae', 'optimizer': 'adamw', 'use_snp_selection': False, 'n_pcs': 4500} weighting={'name': 'uniform'}
2026-06-01 12:46:54 | INFO | OUTER 4 TEST r = 0.2828
2026-06-01 12:46:54 | INFO | OUTER 4 incremental summary saved to outputs/final_results/e8_pc_mlp_uniform/thr_wing/e8_pc_mlp_uniform_thr_wing_results.json
2026-06-01 12:46:54 | INFO | OUTER 5: test_size=553 island=4 (Gjerøy)
2026-06-01 12:46:54 | INFO | OUTER 5: inner LOIO validation islands: 0(Nesøy), 1(Myken), 2(Træna), 3(Selvær), 5(Hestmannøy), 6(Indre Kvarøy), 7(Onøy og Lurøy), 8(Lovund), 9(Sleneset), 10(Aldra), 11(Leka), 12(Vega), 13(Vikna), 14(Lauvøya)
2026-06-01 12:46:54 | INFO | OUTER 5: using top 10 related inner validation islands for tuning: 5(Hestmannøy, avgGRM=0.0047), 6(Indre Kvarøy, avgGRM=0.0043), 0(Nesøy, avgGRM=0.0039), 10(Aldra, avgGRM=0.0011), 7(Onøy og Lurøy, avgGRM=0.0002), 1(Myken, avgGRM=-0.0004), 3(Selvær, avgGRM=-0.0013), 2(Træna, avgGRM=-0.0020), 8(Lovund, avgGRM=-0.0020), 9(Sleneset, avgGRM=-0.0024)
[I 2026-06-01 12:46:54,857] A new study created in memory with name: mlp_importance_inner_outer4
2026-06-01 12:46:54 | INFO | Trial 0 | outer=5 | hidden=[256, 64] epochs=252 lr=8.243e-05 wd=1.277e-07 n_pcs=1500 weight={'name': 'uniform'}
[I 2026-06-01 12:46:59,402] Trial 0 finished with value: 0.18974689744970125 and parameters: {'hidden_dims': '[256, 64]', 'dropout': 0.19097065492325918, 'batch_norm': False, 'lr': 8.242985198911028e-05, 'weight_decay': 1.277246473139888e-07, 'epochs': 252, 'loss': 'mae', 'optimizer': 'adamw', 'use_snp_selection': False, 'n_pcs': 1500}. Best is trial 0 with value: 0.18974689744970125.
2026-06-01 12:46:59 | INFO | Trial 1 | outer=5 | hidden=[1024, 256] epochs=225 lr=1.391e-04 wd=1.941e-07 n_pcs=500 weight={'name': 'uniform'}
[I 2026-06-01 12:47:05,626] Trial 1 finished with value: 0.19610425157279346 and parameters: {'hidden_dims': '[1024, 256]', 'dropout': 0.2849434595702811, 'batch_norm': False, 'lr': 0.00013909108684683413, 'weight_decay': 1.9407167964924495e-07, 'epochs': 225, 'loss': 'mse', 'optimizer': 'adamw', 'use_snp_selection': False, 'n_pcs': 500}. Best is trial 1 with value: 0.19610425157279346.
2026-06-01 12:47:05 | INFO | Trial 2 | outer=5 | hidden=[256, 64] epochs=139 lr=3.957e-05 wd=3.750e-05 n_pcs=2500 weight={'name': 'uniform'}
[I 2026-06-01 12:47:09,322] Trial 2 finished with value: 0.18070596019907703 and parameters: {'hidden_dims': '[256, 64]', 'dropout': 0.11392712587675291, 'batch_norm': False, 'lr': 3.9573351157697276e-05, 'weight_decay': 3.7502337000845044e-05, 'epochs': 139, 'loss': 'mae', 'optimizer': 'adam', 'use_snp_selection': False, 'n_pcs': 2500}. Best is trial 1 with value: 0.19610425157279346.
2026-06-01 12:47:09 | INFO | Trial 3 | outer=5 | hidden=[128, 64] epochs=164 lr=1.538e-05 wd=3.248e-06 n_pcs=3000 weight={'name': 'uniform'}
[I 2026-06-01 12:47:12,994] Trial 3 finished with value: 0.09526897141649553 and parameters: {'hidden_dims': '[128, 64]', 'dropout': 0.1479874991503876, 'batch_norm': False, 'lr': 1.5380732370316375e-05, 'weight_decay': 3.2478890969962294e-06, 'epochs': 164, 'loss': 'mse', 'optimizer': 'adam', 'use_snp_selection': False, 'n_pcs': 3000}. Best is trial 1 with value: 0.19610425157279346.
2026-06-01 12:47:12 | INFO | Trial 4 | outer=5 | hidden=[256, 128] epochs=210 lr=7.298e-05 wd=7.875e-06 n_pcs=3000 weight={'name': 'uniform'}
[I 2026-06-01 12:47:18,368] Trial 4 finished with value: 0.19774989557688666 and parameters: {'hidden_dims': '[256, 128]', 'dropout': 0.09917626474860408, 'batch_norm': False, 'lr': 7.298380589156323e-05, 'weight_decay': 7.875094299510188e-06, 'epochs': 210, 'loss': 'mae', 'optimizer': 'adam', 'use_snp_selection': False, 'n_pcs': 3000}. Best is trial 4 with value: 0.19774989557688666.
2026-06-01 12:47:18 | INFO | Trial 5 | outer=5 | hidden=[512, 128] epochs=284 lr=5.467e-05 wd=5.496e-06 n_pcs=4000 weight={'name': 'uniform'}
[I 2026-06-01 12:47:31,300] Trial 5 finished with value: 0.2136318057225315 and parameters: {'hidden_dims': '[512, 128]', 'dropout': 0.3143696126156032, 'batch_norm': False, 'lr': 5.46667545989349e-05, 'weight_decay': 5.496446859789657e-06, 'epochs': 284, 'loss': 'mse', 'optimizer': 'adamw', 'use_snp_selection': False, 'n_pcs': 4000}. Best is trial 5 with value: 0.2136318057225315.
2026-06-01 12:47:31 | INFO | Trial 6 | outer=5 | hidden=[512, 64] epochs=90 lr=3.103e-05 wd=6.607e-08 n_pcs=5000 weight={'name': 'uniform'}
[I 2026-06-01 12:47:34,978] Trial 6 pruned. 
2026-06-01 12:47:34 | INFO | Trial 7 | outer=5 | hidden=[128, 64] epochs=272 lr=1.348e-05 wd=1.075e-07 n_pcs=4000 weight={'name': 'uniform'}
[I 2026-06-01 12:47:38,142] Trial 7 pruned. 
2026-06-01 12:47:38 | INFO | Trial 8 | outer=5 | hidden=[128, 64] epochs=205 lr=1.815e-05 wd=5.764e-06 n_pcs=3000 weight={'name': 'uniform'}
[I 2026-06-01 12:47:40,633] Trial 8 pruned. 
2026-06-01 12:47:40 | INFO | Trial 9 | outer=5 | hidden=[128, 64] epochs=296 lr=2.338e-05 wd=1.066e-07 n_pcs=2500 weight={'name': 'uniform'}
[I 2026-06-01 12:47:45,852] Trial 9 finished with value: 0.18308700951579743 and parameters: {'hidden_dims': '[128, 64]', 'dropout': 0.17607378181405245, 'batch_norm': False, 'lr': 2.3379083621874488e-05, 'weight_decay': 1.0663581123617794e-07, 'epochs': 296, 'loss': 'mae', 'optimizer': 'adam', 'use_snp_selection': False, 'n_pcs': 2500}. Best is trial 5 with value: 0.2136318057225315.
2026-06-01 12:47:45 | INFO | Trial 10 | outer=5 | hidden=[512, 128] epochs=110 lr=3.984e-04 wd=9.453e-04 n_pcs=5000 weight={'name': 'uniform'}
[I 2026-06-01 12:47:53,018] Trial 10 finished with value: 0.2157542229500935 and parameters: {'hidden_dims': '[512, 128]', 'dropout': 0.5941683348553323, 'batch_norm': False, 'lr': 0.0003983594610602333, 'weight_decay': 0.0009452683165453212, 'epochs': 110, 'loss': 'mse', 'optimizer': 'adamw', 'use_snp_selection': False, 'n_pcs': 5000}. Best is trial 10 with value: 0.2157542229500935.
2026-06-01 12:47:53 | INFO | Trial 11 | outer=5 | hidden=[512, 128] epochs=55 lr=3.985e-04 wd=9.792e-04 n_pcs=5000 weight={'name': 'uniform'}
[I 2026-06-01 12:47:57,753] Trial 11 finished with value: 0.20687929473085154 and parameters: {'hidden_dims': '[512, 128]', 'dropout': 0.5588382083491101, 'batch_norm': False, 'lr': 0.00039850138867195595, 'weight_decay': 0.0009792126502143, 'epochs': 55, 'loss': 'mse', 'optimizer': 'adamw', 'use_snp_selection': False, 'n_pcs': 5000}. Best is trial 10 with value: 0.2157542229500935.
2026-06-01 12:47:57 | INFO | Trial 12 | outer=5 | hidden=[512, 128] epochs=117 lr=4.981e-04 wd=8.865e-04 n_pcs=4000 weight={'name': 'uniform'}
[I 2026-06-01 12:48:04,327] Trial 12 finished with value: 0.20854447988972935 and parameters: {'hidden_dims': '[512, 128]', 'dropout': 0.39928504380457036, 'batch_norm': False, 'lr': 0.000498069436842805, 'weight_decay': 0.0008865268327078721, 'epochs': 117, 'loss': 'mse', 'optimizer': 'adamw', 'use_snp_selection': False, 'n_pcs': 4000}. Best is trial 10 with value: 0.2157542229500935.
2026-06-01 12:48:04 | INFO | Trial 13 | outer=5 | hidden=[512, 128] epochs=166 lr=2.031e-04 wd=3.464e-05 n_pcs=4000 weight={'name': 'uniform'}
[I 2026-06-01 12:48:12,778] Trial 13 finished with value: 0.18755515684115773 and parameters: {'hidden_dims': '[512, 128]', 'dropout': 0.021626435995423465, 'batch_norm': False, 'lr': 0.00020306910221716762, 'weight_decay': 3.4643570652494856e-05, 'epochs': 166, 'loss': 'mse', 'optimizer': 'adamw', 'use_snp_selection': False, 'n_pcs': 4000}. Best is trial 10 with value: 0.2157542229500935.
2026-06-01 12:48:12 | INFO | Trial 14 | outer=5 | hidden=[512, 256] epochs=103 lr=1.840e-04 wd=1.338e-04 n_pcs=4500 weight={'name': 'uniform'}
