[I 2026-06-01 11:29:08,662] Trial 14 finished with value: 0.1632659021733468 and parameters: {'hidden_dims': '[1024, 256]', 'dropout': 0.2277857572779503, 'batch_norm': False, 'lr': 1.0155746531700295e-05, 'weight_decay': 1.7169009323508448e-08, 'epochs': 299, 'loss': 'mae', 'optimizer': 'adamw', 'use_snp_selection': False, 'n_pcs': 4000}. Best is trial 9 with value: 0.18820694761241152.
2026-06-01 11:29:08 | INFO | Trial 15 | outer=2 | hidden=[256, 128] epochs=182 lr=1.446e-04 wd=7.042e-07 n_pcs=5000 weight={'name': 'uniform'}
[I 2026-06-01 11:29:15,727] Trial 15 finished with value: 0.20197064154166008 and parameters: {'hidden_dims': '[256, 128]', 'dropout': 0.5188270535367553, 'batch_norm': False, 'lr': 0.00014459844967448893, 'weight_decay': 7.042341982313891e-07, 'epochs': 182, 'loss': 'mae', 'optimizer': 'adam', 'use_snp_selection': False, 'n_pcs': 5000}. Best is trial 15 with value: 0.20197064154166008.
2026-06-01 11:29:15 | INFO | Trial 16 | outer=2 | hidden=[256, 128] epochs=58 lr=1.980e-04 wd=7.836e-07 n_pcs=500 weight={'name': 'uniform'}
[I 2026-06-01 11:29:17,923] Trial 16 finished with value: 0.14757219340849553 and parameters: {'hidden_dims': '[256, 128]', 'dropout': 0.3765920836653018, 'batch_norm': False, 'lr': 0.00019803760331863027, 'weight_decay': 7.835646321981816e-07, 'epochs': 58, 'loss': 'mae', 'optimizer': 'adam', 'use_snp_selection': False, 'n_pcs': 500}. Best is trial 15 with value: 0.20197064154166008.
2026-06-01 11:29:17 | INFO | Trial 17 | outer=2 | hidden=[256, 128] epochs=177 lr=1.791e-04 wd=5.149e-07 n_pcs=2000 weight={'name': 'uniform'}
[I 2026-06-01 11:29:22,069] Trial 17 finished with value: 0.1877579361209088 and parameters: {'hidden_dims': '[256, 128]', 'dropout': 0.49608622640645167, 'batch_norm': False, 'lr': 0.00017914267713688985, 'weight_decay': 5.149128563500694e-07, 'epochs': 177, 'loss': 'mae', 'optimizer': 'adam', 'use_snp_selection': False, 'n_pcs': 2000}. Best is trial 15 with value: 0.20197064154166008.
2026-06-01 11:29:22 | INFO | Trial 18 | outer=2 | hidden=[512, 256] epochs=188 lr=3.235e-04 wd=5.822e-05 n_pcs=3500 weight={'name': 'uniform'}
[I 2026-06-01 11:29:31,636] Trial 18 finished with value: 0.17614258310089287 and parameters: {'hidden_dims': '[512, 256]', 'dropout': 0.022941868683026556, 'batch_norm': False, 'lr': 0.0003234670796880383, 'weight_decay': 5.822056129371213e-05, 'epochs': 188, 'loss': 'mae', 'optimizer': 'adam', 'use_snp_selection': False, 'n_pcs': 3500}. Best is trial 15 with value: 0.20197064154166008.
2026-06-01 11:29:31 | INFO | Trial 19 | outer=2 | hidden=[512, 64] epochs=147 lr=1.078e-04 wd=9.275e-07 n_pcs=2500 weight={'name': 'uniform'}
[I 2026-06-01 11:29:37,380] Trial 19 finished with value: 0.18489354062258595 and parameters: {'hidden_dims': '[512, 64]', 'dropout': 0.23134664962649043, 'batch_norm': False, 'lr': 0.00010782526796228184, 'weight_decay': 9.275432116241259e-07, 'epochs': 147, 'loss': 'mae', 'optimizer': 'adam', 'use_snp_selection': False, 'n_pcs': 2500}. Best is trial 15 with value: 0.20197064154166008.
2026-06-01 11:29:37 | INFO | Trial 20 | outer=2 | hidden=[256, 128] epochs=252 lr=2.738e-04 wd=4.197e-08 n_pcs=3500 weight={'name': 'uniform'}
[I 2026-06-01 11:29:44,536] Trial 20 finished with value: 0.18603321605731743 and parameters: {'hidden_dims': '[256, 128]', 'dropout': 0.34589653772335416, 'batch_norm': False, 'lr': 0.00027375634002369757, 'weight_decay': 4.196811659654145e-08, 'epochs': 252, 'loss': 'mae', 'optimizer': 'adam', 'use_snp_selection': False, 'n_pcs': 3500}. Best is trial 15 with value: 0.20197064154166008.
2026-06-01 11:29:44 | INFO | Trial 21 | outer=2 | hidden=[256, 128] epochs=169 lr=1.766e-04 wd=5.740e-07 n_pcs=1500 weight={'name': 'uniform'}
[I 2026-06-01 11:29:48,241] Trial 21 finished with value: 0.1829324110631515 and parameters: {'hidden_dims': '[256, 128]', 'dropout': 0.5008196794118791, 'batch_norm': False, 'lr': 0.0001765705281425666, 'weight_decay': 5.740142867621343e-07, 'epochs': 169, 'loss': 'mae', 'optimizer': 'adam', 'use_snp_selection': False, 'n_pcs': 1500}. Best is trial 15 with value: 0.20197064154166008.
2026-06-01 11:29:48 | INFO | Trial 22 | outer=2 | hidden=[256, 128] epochs=134 lr=2.047e-04 wd=3.282e-07 n_pcs=2000 weight={'name': 'uniform'}
[I 2026-06-01 11:29:51,805] Trial 22 finished with value: 0.19129589020098545 and parameters: {'hidden_dims': '[256, 128]', 'dropout': 0.5016442995926729, 'batch_norm': False, 'lr': 0.00020467848673103974, 'weight_decay': 3.281907285958011e-07, 'epochs': 134, 'loss': 'mae', 'optimizer': 'adam', 'use_snp_selection': False, 'n_pcs': 2000}. Best is trial 15 with value: 0.20197064154166008.
2026-06-01 11:29:51 | INFO | Trial 23 | outer=2 | hidden=[128, 64] epochs=119 lr=1.088e-04 wd=2.319e-07 n_pcs=2000 weight={'name': 'uniform'}
[I 2026-06-01 11:29:53,695] Trial 23 pruned. 
2026-06-01 11:29:53 | INFO | Trial 24 | outer=2 | hidden=[256, 128] epochs=57 lr=2.225e-04 wd=1.895e-06 n_pcs=2500 weight={'name': 'uniform'}
[I 2026-06-01 11:29:56,399] Trial 24 finished with value: 0.19127722864376712 and parameters: {'hidden_dims': '[256, 128]', 'dropout': 0.4338989376621718, 'batch_norm': False, 'lr': 0.00022250398832208116, 'weight_decay': 1.8947104797453575e-06, 'epochs': 57, 'loss': 'mae', 'optimizer': 'adam', 'use_snp_selection': False, 'n_pcs': 2500}. Best is trial 15 with value: 0.20197064154166008.
2026-06-01 11:29:56 | INFO | Trial 25 | outer=2 | hidden=[256, 128] epochs=65 lr=2.493e-04 wd=1.711e-05 n_pcs=1000 weight={'name': 'uniform'}
[I 2026-06-01 11:29:58,744] Trial 25 finished with value: 0.19654802381989916 and parameters: {'hidden_dims': '[256, 128]', 'dropout': 0.4362976570783369, 'batch_norm': False, 'lr': 0.0002492871406700532, 'weight_decay': 1.7114533707256265e-05, 'epochs': 65, 'loss': 'mae', 'optimizer': 'adam', 'use_snp_selection': False, 'n_pcs': 1000}. Best is trial 15 with value: 0.20197064154166008.
2026-06-01 11:29:58 | INFO | Trial 26 | outer=2 | hidden=[256, 128] epochs=77 lr=4.837e-04 wd=2.320e-05 n_pcs=1000 weight={'name': 'uniform'}
[I 2026-06-01 11:30:01,171] Trial 26 finished with value: 0.18632566655311794 and parameters: {'hidden_dims': '[256, 128]', 'dropout': 0.44315636319892887, 'batch_norm': False, 'lr': 0.0004837166254286967, 'weight_decay': 2.320471484045109e-05, 'epochs': 77, 'loss': 'mae', 'optimizer': 'adam', 'use_snp_selection': False, 'n_pcs': 1000}. Best is trial 15 with value: 0.20197064154166008.
2026-06-01 11:30:01 | INFO | Trial 27 | outer=2 | hidden=[256, 128] epochs=108 lr=2.727e-04 wd=2.099e-04 n_pcs=1000 weight={'name': 'uniform'}
[I 2026-06-01 11:30:03,949] Trial 27 finished with value: 0.19801392893387582 and parameters: {'hidden_dims': '[256, 128]', 'dropout': 0.5098392429025053, 'batch_norm': False, 'lr': 0.00027266642232184993, 'weight_decay': 0.00020990825457469387, 'epochs': 108, 'loss': 'mae', 'optimizer': 'adam', 'use_snp_selection': False, 'n_pcs': 1000}. Best is trial 15 with value: 0.20197064154166008.
2026-06-01 11:30:03 | INFO | Trial 28 | outer=2 | hidden=[256, 128] epochs=91 lr=2.939e-04 wd=3.192e-04 n_pcs=1000 weight={'name': 'uniform'}
[I 2026-06-01 11:30:06,534] Trial 28 finished with value: 0.18284727305531756 and parameters: {'hidden_dims': '[256, 128]', 'dropout': 0.535299162981138, 'batch_norm': False, 'lr': 0.000293907732696851, 'weight_decay': 0.00031915698481219974, 'epochs': 91, 'loss': 'mae', 'optimizer': 'adam', 'use_snp_selection': False, 'n_pcs': 1000}. Best is trial 15 with value: 0.20197064154166008.
2026-06-01 11:30:06 | INFO | Trial 29 | outer=2 | hidden=[256, 64] epochs=74 lr=1.252e-04 wd=1.475e-04 n_pcs=1000 weight={'name': 'uniform'}
[I 2026-06-01 11:30:07,976] Trial 29 pruned. 
2026-06-01 11:30:07 | INFO | Trial 30 | outer=2 | hidden=[256, 128] epochs=94 lr=8.429e-05 wd=1.514e-05 n_pcs=500 weight={'name': 'uniform'}
[I 2026-06-01 11:30:09,509] Trial 30 pruned. 
2026-06-01 11:30:09 | INFO | Trial 31 | outer=2 | hidden=[256, 128] epochs=133 lr=2.605e-04 wd=1.112e-04 n_pcs=1500 weight={'name': 'uniform'}
[I 2026-06-01 11:30:12,786] Trial 31 finished with value: 0.18589203897713824 and parameters: {'hidden_dims': '[256, 128]', 'dropout': 0.4778899825212936, 'batch_norm': False, 'lr': 0.0002604769580547439, 'weight_decay': 0.00011121149265392542, 'epochs': 133, 'loss': 'mae', 'optimizer': 'adam', 'use_snp_selection': False, 'n_pcs': 1500}. Best is trial 15 with value: 0.20197064154166008.
2026-06-01 11:30:12 | INFO | Trial 32 | outer=2 | hidden=[256, 128] epochs=120 lr=1.537e-04 wd=1.846e-06 n_pcs=1000 weight={'name': 'uniform'}
[I 2026-06-01 11:30:15,700] Trial 32 finished with value: 0.19197463131628117 and parameters: {'hidden_dims': '[256, 128]', 'dropout': 0.5267372365881224, 'batch_norm': False, 'lr': 0.00015374220668926345, 'weight_decay': 1.846378993259688e-06, 'epochs': 120, 'loss': 'mae', 'optimizer': 'adam', 'use_snp_selection': False, 'n_pcs': 1000}. Best is trial 15 with value: 0.20197064154166008.
2026-06-01 11:30:15 | INFO | Trial 33 | outer=2 | hidden=[1024, 256] epochs=114 lr=1.525e-04 wd=1.792e-06 n_pcs=1000 weight={'name': 'uniform'}
[I 2026-06-01 11:30:20,942] Trial 33 finished with value: 0.18536546043791058 and parameters: {'hidden_dims': '[1024, 256]', 'dropout': 0.5452657069206389, 'batch_norm': False, 'lr': 0.00015248707677628867, 'weight_decay': 1.7915003847964348e-06, 'epochs': 114, 'loss': 'mae', 'optimizer': 'adam', 'use_snp_selection': False, 'n_pcs': 1000}. Best is trial 15 with value: 0.20197064154166008.
2026-06-01 11:30:20 | INFO | Trial 34 | outer=2 | hidden=[256, 64] epochs=148 lr=3.516e-04 wd=1.413e-05 n_pcs=500 weight={'name': 'uniform'}
[I 2026-06-01 11:30:22,864] Trial 34 pruned. 
2026-06-01 11:30:22 | INFO | Trial 35 | outer=2 | hidden=[256, 128] epochs=50 lr=5.443e-05 wd=3.415e-04 n_pcs=1000 weight={'name': 'uniform'}
[I 2026-06-01 11:30:24,143] Trial 35 pruned. 
2026-06-01 11:30:24 | INFO | Trial 36 | outer=2 | hidden=[256, 128] epochs=155 lr=1.445e-04 wd=2.777e-06 n_pcs=500 weight={'name': 'uniform'}
[I 2026-06-01 11:30:27,381] Trial 36 finished with value: 0.17184618941573765 and parameters: {'hidden_dims': '[256, 128]', 'dropout': 0.3997062430594493, 'batch_norm': False, 'lr': 0.00014447078576719437, 'weight_decay': 2.777116554044785e-06, 'epochs': 155, 'loss': 'mae', 'optimizer': 'adam', 'use_snp_selection': False, 'n_pcs': 500}. Best is trial 15 with value: 0.20197064154166008.
2026-06-01 11:30:27 | INFO | Trial 37 | outer=2 | hidden=[512, 64] epochs=102 lr=9.184e-05 wd=5.561e-05 n_pcs=1500 weight={'name': 'uniform'}
[I 2026-06-01 11:30:30,961] Trial 37 finished with value: 0.1873541333736159 and parameters: {'hidden_dims': '[512, 64]', 'dropout': 0.3478241363112363, 'batch_norm': False, 'lr': 9.183632572043083e-05, 'weight_decay': 5.561181610453774e-05, 'epochs': 102, 'loss': 'mse', 'optimizer': 'adam', 'use_snp_selection': False, 'n_pcs': 1500}. Best is trial 15 with value: 0.20197064154166008.
2026-06-01 11:30:30 | INFO | Trial 38 | outer=2 | hidden=[256, 128] epochs=73 lr=5.940e-05 wd=8.425e-06 n_pcs=4500 weight={'name': 'uniform'}
[I 2026-06-01 11:30:33,756] Trial 38 pruned. 
2026-06-01 11:30:33 | INFO | Trial 39 | outer=2 | hidden=[512, 256] epochs=193 lr=2.426e-04 wd=1.444e-06 n_pcs=1500 weight={'name': 'uniform'}
[I 2026-06-01 11:30:39,708] Trial 39 finished with value: 0.17866023263569875 and parameters: {'hidden_dims': '[512, 256]', 'dropout': 0.5205672026151992, 'batch_norm': False, 'lr': 0.0002426187825806785, 'weight_decay': 1.4443200823752448e-06, 'epochs': 193, 'loss': 'mse', 'optimizer': 'adam', 'use_snp_selection': False, 'n_pcs': 1500}. Best is trial 15 with value: 0.20197064154166008.
2026-06-01 11:30:39 | INFO | Trial 40 | outer=2 | hidden=[1024, 256] epochs=222 lr=3.755e-04 wd=3.777e-06 n_pcs=1000 weight={'name': 'uniform'}
[I 2026-06-01 11:30:48,385] Trial 40 finished with value: 0.1864476662262304 and parameters: {'hidden_dims': '[1024, 256]', 'dropout': 0.567545090164865, 'batch_norm': False, 'lr': 0.0003755139589729228, 'weight_decay': 3.7766959216046144e-06, 'epochs': 222, 'loss': 'mae', 'optimizer': 'adam', 'use_snp_selection': False, 'n_pcs': 1000}. Best is trial 15 with value: 0.20197064154166008.
2026-06-01 11:30:48 | INFO | Trial 41 | outer=2 | hidden=[256, 128] epochs=129 lr=2.073e-04 wd=2.205e-07 n_pcs=2000 weight={'name': 'uniform'}
[I 2026-06-01 11:30:51,879] Trial 41 finished with value: 0.20559434600218193 and parameters: {'hidden_dims': '[256, 128]', 'dropout': 0.5129101758045584, 'batch_norm': False, 'lr': 0.00020728276275262922, 'weight_decay': 2.2052664415962146e-07, 'epochs': 129, 'loss': 'mae', 'optimizer': 'adam', 'use_snp_selection': False, 'n_pcs': 2000}. Best is trial 41 with value: 0.20559434600218193.
2026-06-01 11:30:51 | INFO | Trial 42 | outer=2 | hidden=[256, 128] epochs=130 lr=1.618e-04 wd=2.842e-07 n_pcs=2000 weight={'name': 'uniform'}
[I 2026-06-01 11:30:55,383] Trial 42 finished with value: 0.19392819148387574 and parameters: {'hidden_dims': '[256, 128]', 'dropout': 0.5994426728343394, 'batch_norm': False, 'lr': 0.00016178777333597074, 'weight_decay': 2.841573106169727e-07, 'epochs': 130, 'loss': 'mae', 'optimizer': 'adam', 'use_snp_selection': False, 'n_pcs': 2000}. Best is trial 41 with value: 0.20559434600218193.
2026-06-01 11:30:55 | INFO | Trial 43 | outer=2 | hidden=[256, 128] epochs=126 lr=4.458e-04 wd=2.763e-07 n_pcs=2000 weight={'name': 'uniform'}
[I 2026-06-01 11:30:58,853] Trial 43 finished with value: 0.19839147797789086 and parameters: {'hidden_dims': '[256, 128]', 'dropout': 0.5962648213435954, 'batch_norm': False, 'lr': 0.00044583599460757697, 'weight_decay': 2.7627961920443636e-07, 'epochs': 126, 'loss': 'mae', 'optimizer': 'adam', 'use_snp_selection': False, 'n_pcs': 2000}. Best is trial 41 with value: 0.20559434600218193.
2026-06-01 11:30:58 | INFO | Trial 44 | outer=2 | hidden=[256, 128] epochs=161 lr=4.100e-04 wd=4.938e-08 n_pcs=3000 weight={'name': 'uniform'}
[I 2026-06-01 11:31:03,766] Trial 44 finished with value: 0.16390519415352778 and parameters: {'hidden_dims': '[256, 128]', 'dropout': 0.5588981046845257, 'batch_norm': False, 'lr': 0.00040995448230475904, 'weight_decay': 4.9381349140432933e-08, 'epochs': 161, 'loss': 'mae', 'optimizer': 'adam', 'use_snp_selection': False, 'n_pcs': 3000}. Best is trial 41 with value: 0.20559434600218193.
2026-06-01 11:31:03 | INFO | Trial 45 | outer=2 | hidden=[256, 64] epochs=181 lr=4.766e-04 wd=1.013e-07 n_pcs=2500 weight={'name': 'uniform'}
[I 2026-06-01 11:31:08,343] Trial 45 finished with value: 0.15568261454765545 and parameters: {'hidden_dims': '[256, 64]', 'dropout': 0.453848765262654, 'batch_norm': False, 'lr': 0.00047657777919808426, 'weight_decay': 1.0134413657322781e-07, 'epochs': 181, 'loss': 'mse', 'optimizer': 'adamw', 'use_snp_selection': False, 'n_pcs': 2500}. Best is trial 41 with value: 0.20559434600218193.
2026-06-01 11:31:08 | INFO | Trial 46 | outer=2 | hidden=[256, 128] epochs=106 lr=2.303e-04 wd=1.546e-07 n_pcs=3000 weight={'name': 'uniform'}
[I 2026-06-01 11:31:12,243] Trial 46 finished with value: 0.16170849648454017 and parameters: {'hidden_dims': '[256, 128]', 'dropout': 0.4850820173645904, 'batch_norm': False, 'lr': 0.00023031570383618986, 'weight_decay': 1.5463150272105239e-07, 'epochs': 106, 'loss': 'mae', 'optimizer': 'adam', 'use_snp_selection': False, 'n_pcs': 3000}. Best is trial 41 with value: 0.20559434600218193.
2026-06-01 11:31:12 | INFO | Trial 47 | outer=2 | hidden=[512, 64] epochs=204 lr=3.103e-04 wd=3.842e-07 n_pcs=3500 weight={'name': 'uniform'}
[I 2026-06-01 11:31:21,703] Trial 47 finished with value: 0.18449707185397649 and parameters: {'hidden_dims': '[512, 64]', 'dropout': 0.5152204784788899, 'batch_norm': False, 'lr': 0.000310261633851064, 'weight_decay': 3.842202419813283e-07, 'epochs': 204, 'loss': 'mae', 'optimizer': 'adam', 'use_snp_selection': False, 'n_pcs': 3500}. Best is trial 41 with value: 0.20559434600218193.
2026-06-01 11:31:21 | INFO | Trial 48 | outer=2 | hidden=[256, 128] epochs=79 lr=4.278e-04 wd=2.364e-08 n_pcs=2000 weight={'name': 'uniform'}
[I 2026-06-01 11:31:24,540] Trial 48 finished with value: 0.20280141106429692 and parameters: {'hidden_dims': '[256, 128]', 'dropout': 0.5750054119904708, 'batch_norm': False, 'lr': 0.0004277902906270505, 'weight_decay': 2.364387042622304e-08, 'epochs': 79, 'loss': 'mae', 'optimizer': 'adamw', 'use_snp_selection': False, 'n_pcs': 2000}. Best is trial 41 with value: 0.20559434600218193.
2026-06-01 11:31:24 | INFO | Trial 49 | outer=2 | hidden=[512, 128] epochs=126 lr=4.252e-04 wd=2.581e-08 n_pcs=2000 weight={'name': 'uniform'}
[I 2026-06-01 11:31:29,269] Trial 49 finished with value: 0.18721197384337493 and parameters: {'hidden_dims': '[512, 128]', 'dropout': 0.5799181250735514, 'batch_norm': False, 'lr': 0.00042518719816474903, 'weight_decay': 2.5805327776160533e-08, 'epochs': 126, 'loss': 'mae', 'optimizer': 'adamw', 'use_snp_selection': False, 'n_pcs': 2000}. Best is trial 41 with value: 0.20559434600218193.
2026-06-01 11:31:29 | INFO | Trial 50 | outer=2 | hidden=[512, 256] epochs=87 lr=3.523e-04 wd=7.745e-08 n_pcs=4500 weight={'name': 'uniform'}
[I 2026-06-01 11:31:35,750] Trial 50 finished with value: 0.1772798944847902 and parameters: {'hidden_dims': '[512, 256]', 'dropout': 0.0715706316018801, 'batch_norm': False, 'lr': 0.0003522710168862434, 'weight_decay': 7.745179657463083e-08, 'epochs': 87, 'loss': 'mse', 'optimizer': 'adamw', 'use_snp_selection': False, 'n_pcs': 4500}. Best is trial 41 with value: 0.20559434600218193.
2026-06-01 11:31:35 | INFO | Trial 51 | outer=2 | hidden=[256, 128] epochs=81 lr=2.942e-04 wd=9.904e-04 n_pcs=2500 weight={'name': 'uniform'}
[I 2026-06-01 11:31:38,859] Trial 51 finished with value: 0.16503079860603592 and parameters: {'hidden_dims': '[256, 128]', 'dropout': 0.5522915019494689, 'batch_norm': False, 'lr': 0.0002941535610230945, 'weight_decay': 0.0009904061042468437, 'epochs': 81, 'loss': 'mae', 'optimizer': 'adamw', 'use_snp_selection': False, 'n_pcs': 2500}. Best is trial 41 with value: 0.20559434600218193.
2026-06-01 11:31:38 | INFO | Trial 52 | outer=2 | hidden=[256, 128] epochs=68 lr=2.551e-04 wd=1.050e-06 n_pcs=1500 weight={'name': 'uniform'}
[I 2026-06-01 11:31:41,340] Trial 52 finished with value: 0.20270723492597167 and parameters: {'hidden_dims': '[256, 128]', 'dropout': 0.5805858751257714, 'batch_norm': False, 'lr': 0.00025513061183042536, 'weight_decay': 1.0504311367704408e-06, 'epochs': 68, 'loss': 'mae', 'optimizer': 'adamw', 'use_snp_selection': False, 'n_pcs': 1500}. Best is trial 41 with value: 0.20559434600218193.
2026-06-01 11:31:41 | INFO | Trial 53 | outer=2 | hidden=[256, 128] epochs=143 lr=4.082e-04 wd=1.147e-06 n_pcs=1500 weight={'name': 'uniform'}
[I 2026-06-01 11:31:44,740] Trial 53 finished with value: 0.17943678978092267 and parameters: {'hidden_dims': '[256, 128]', 'dropout': 0.5799360896449683, 'batch_norm': False, 'lr': 0.0004081629576015175, 'weight_decay': 1.1467080392326361e-06, 'epochs': 143, 'loss': 'mae', 'optimizer': 'adamw', 'use_snp_selection': False, 'n_pcs': 1500}. Best is trial 41 with value: 0.20559434600218193.
2026-06-01 11:31:44 | INFO | Trial 54 | outer=2 | hidden=[128, 64] epochs=102 lr=1.875e-04 wd=1.818e-07 n_pcs=2000 weight={'name': 'uniform'}
[I 2026-06-01 11:31:47,657] Trial 54 finished with value: 0.17493444067328573 and parameters: {'hidden_dims': '[128, 64]', 'dropout': 0.5983119752741196, 'batch_norm': False, 'lr': 0.00018749527031063169, 'weight_decay': 1.8180014508547377e-07, 'epochs': 102, 'loss': 'mae', 'optimizer': 'adamw', 'use_snp_selection': False, 'n_pcs': 2000}. Best is trial 41 with value: 0.20559434600218193.
2026-06-01 11:31:47 | INFO | Trial 55 | outer=2 | hidden=[256, 128] epochs=97 lr=4.864e-04 wd=3.204e-08 n_pcs=1500 weight={'name': 'uniform'}
[I 2026-06-01 11:31:50,497] Trial 55 finished with value: 0.1808097077390735 and parameters: {'hidden_dims': '[256, 128]', 'dropout': 0.5147258705220035, 'batch_norm': False, 'lr': 0.0004863919730351024, 'weight_decay': 3.2038152513838734e-08, 'epochs': 97, 'loss': 'mae', 'optimizer': 'adamw', 'use_snp_selection': False, 'n_pcs': 1500}. Best is trial 41 with value: 0.20559434600218193.
2026-06-01 11:31:50 | INFO | Trial 56 | outer=2 | hidden=[256, 128] epochs=62 lr=2.124e-04 wd=5.535e-07 n_pcs=2000 weight={'name': 'uniform'}
[I 2026-06-01 11:31:52,054] Trial 56 pruned. 
2026-06-01 11:31:52 | INFO | Trial 57 | outer=2 | hidden=[256, 128] epochs=84 lr=1.242e-04 wd=9.214e-07 n_pcs=2500 weight={'name': 'uniform'}
[I 2026-06-01 11:31:55,205] Trial 57 finished with value: 0.1739036075926731 and parameters: {'hidden_dims': '[256, 128]', 'dropout': 0.4975609928703711, 'batch_norm': False, 'lr': 0.0001241912805967731, 'weight_decay': 9.213568535745911e-07, 'epochs': 84, 'loss': 'mae', 'optimizer': 'adamw', 'use_snp_selection': False, 'n_pcs': 2500}. Best is trial 41 with value: 0.20559434600218193.
2026-06-01 11:31:55 | INFO | Trial 58 | outer=2 | hidden=[512, 128] epochs=110 lr=3.392e-04 wd=1.891e-08 n_pcs=1500 weight={'name': 'uniform'}
[I 2026-06-01 11:31:59,067] Trial 58 finished with value: 0.18671843885822278 and parameters: {'hidden_dims': '[512, 128]', 'dropout': 0.5757172997260184, 'batch_norm': False, 'lr': 0.0003391851034527247, 'weight_decay': 1.890959874219312e-08, 'epochs': 110, 'loss': 'mae', 'optimizer': 'adamw', 'use_snp_selection': False, 'n_pcs': 1500}. Best is trial 41 with value: 0.20559434600218193.
2026-06-01 11:31:59 | INFO | Trial 59 | outer=2 | hidden=[1024, 256] epochs=169 lr=2.706e-04 wd=3.546e-07 n_pcs=5000 weight={'name': 'uniform'}
