[I 2026-06-01 14:18:53,360] Trial 88 finished with value: 0.18491867766419182 and parameters: {'hidden_dims': '[512, 64]', 'dropout': 0.3149303770154301, 'batch_norm': False, 'lr': 0.00033134657943250837, 'weight_decay': 2.6193449180308855e-05, 'epochs': 184, 'loss': 'mae', 'optimizer': 'adamw', 'use_snp_selection': False, 'n_pcs': 1500}. Best is trial 15 with value: 0.21987372120888282.
2026-06-01 14:18:53 | INFO | Trial 89 | outer=9 | hidden=[256, 64] epochs=56 lr=3.709e-04 wd=2.243e-06 n_pcs=1000 weight={'name': 'uniform'}
[I 2026-06-01 14:18:55,683] Trial 89 finished with value: 0.20485770368560038 and parameters: {'hidden_dims': '[256, 64]', 'dropout': 0.4469469248730601, 'batch_norm': False, 'lr': 0.00037088159243344127, 'weight_decay': 2.2425941326200893e-06, 'epochs': 56, 'loss': 'mae', 'optimizer': 'adamw', 'use_snp_selection': False, 'n_pcs': 1000}. Best is trial 15 with value: 0.21987372120888282.
2026-06-01 14:18:55 | INFO | Trial 90 | outer=9 | hidden=[1024, 256] epochs=62 lr=1.798e-04 wd=1.158e-04 n_pcs=500 weight={'name': 'uniform'}
[I 2026-06-01 14:18:57,747] Trial 90 pruned. 
2026-06-01 14:18:57 | INFO | Trial 91 | outer=9 | hidden=[1024, 256] epochs=55 lr=1.085e-04 wd=1.545e-05 n_pcs=1000 weight={'name': 'uniform'}
[I 2026-06-01 14:19:01,143] Trial 91 finished with value: 0.19203946473971845 and parameters: {'hidden_dims': '[1024, 256]', 'dropout': 0.3758184994626338, 'batch_norm': False, 'lr': 0.00010845261069723623, 'weight_decay': 1.5449880546295446e-05, 'epochs': 55, 'loss': 'mae', 'optimizer': 'adamw', 'use_snp_selection': False, 'n_pcs': 1000}. Best is trial 15 with value: 0.21987372120888282.
2026-06-01 14:19:01 | INFO | Trial 92 | outer=9 | hidden=[1024, 256] epochs=77 lr=1.261e-04 wd=1.044e-05 n_pcs=1000 weight={'name': 'uniform'}
[I 2026-06-01 14:19:05,227] Trial 92 finished with value: 0.2089562919502712 and parameters: {'hidden_dims': '[1024, 256]', 'dropout': 0.3938081822923375, 'batch_norm': False, 'lr': 0.0001261408192820842, 'weight_decay': 1.0443751613613456e-05, 'epochs': 77, 'loss': 'mae', 'optimizer': 'adamw', 'use_snp_selection': False, 'n_pcs': 1000}. Best is trial 15 with value: 0.21987372120888282.
2026-06-01 14:19:05 | INFO | Trial 93 | outer=9 | hidden=[1024, 256] epochs=62 lr=2.236e-04 wd=8.012e-06 n_pcs=1000 weight={'name': 'uniform'}
[I 2026-06-01 14:19:08,848] Trial 93 finished with value: 0.21776081367300254 and parameters: {'hidden_dims': '[1024, 256]', 'dropout': 0.35899889576919125, 'batch_norm': False, 'lr': 0.0002236099364946673, 'weight_decay': 8.012066456712409e-06, 'epochs': 62, 'loss': 'mae', 'optimizer': 'adamw', 'use_snp_selection': False, 'n_pcs': 1000}. Best is trial 15 with value: 0.21987372120888282.
2026-06-01 14:19:08 | INFO | Trial 94 | outer=9 | hidden=[1024, 256] epochs=70 lr=2.281e-04 wd=3.733e-06 n_pcs=1500 weight={'name': 'uniform'}
[I 2026-06-01 14:19:13,407] Trial 94 finished with value: 0.19849294860195493 and parameters: {'hidden_dims': '[1024, 256]', 'dropout': 0.35946329120981513, 'batch_norm': False, 'lr': 0.00022811079305785881, 'weight_decay': 3.7329338580288e-06, 'epochs': 70, 'loss': 'mae', 'optimizer': 'adamw', 'use_snp_selection': False, 'n_pcs': 1500}. Best is trial 15 with value: 0.21987372120888282.
2026-06-01 14:19:13 | INFO | Trial 95 | outer=9 | hidden=[1024, 256] epochs=50 lr=2.745e-04 wd=7.486e-06 n_pcs=1000 weight={'name': 'uniform'}
[I 2026-06-01 14:19:16,649] Trial 95 finished with value: 0.23197170253801733 and parameters: {'hidden_dims': '[1024, 256]', 'dropout': 0.33473705246437047, 'batch_norm': False, 'lr': 0.0002744553589107389, 'weight_decay': 7.486452812504172e-06, 'epochs': 50, 'loss': 'mae', 'optimizer': 'adamw', 'use_snp_selection': False, 'n_pcs': 1000}. Best is trial 95 with value: 0.23197170253801733.
2026-06-01 14:19:16 | INFO | Trial 96 | outer=9 | hidden=[512, 256] epochs=53 lr=2.524e-04 wd=2.428e-05 n_pcs=1000 weight={'name': 'uniform'}
[I 2026-06-01 14:19:19,224] Trial 96 finished with value: 0.19914891067795215 and parameters: {'hidden_dims': '[512, 256]', 'dropout': 0.5002831450818438, 'batch_norm': False, 'lr': 0.00025244915592964693, 'weight_decay': 2.4282922614804053e-05, 'epochs': 53, 'loss': 'mae', 'optimizer': 'adamw', 'use_snp_selection': False, 'n_pcs': 1000}. Best is trial 95 with value: 0.23197170253801733.
2026-06-01 14:19:19 | INFO | Trial 97 | outer=9 | hidden=[1024, 256] epochs=51 lr=2.824e-04 wd=2.156e-07 n_pcs=1000 weight={'name': 'uniform'}
[I 2026-06-01 14:19:22,492] Trial 97 finished with value: 0.2121660632029397 and parameters: {'hidden_dims': '[1024, 256]', 'dropout': 0.34395252843378815, 'batch_norm': False, 'lr': 0.0002824165129580177, 'weight_decay': 2.1557190503092546e-07, 'epochs': 51, 'loss': 'mae', 'optimizer': 'adamw', 'use_snp_selection': False, 'n_pcs': 1000}. Best is trial 95 with value: 0.23197170253801733.
2026-06-01 14:19:22 | INFO | Trial 98 | outer=9 | hidden=[128, 64] epochs=50 lr=2.094e-04 wd=9.194e-08 n_pcs=500 weight={'name': 'uniform'}
[I 2026-06-01 14:19:23,804] Trial 98 pruned. 
2026-06-01 14:19:23 | INFO | Trial 99 | outer=9 | hidden=[1024, 256] epochs=61 lr=2.719e-04 wd=5.312e-08 n_pcs=1000 weight={'name': 'uniform'}
[I 2026-06-01 14:19:27,396] Trial 99 finished with value: 0.21178267968571776 and parameters: {'hidden_dims': '[1024, 256]', 'dropout': 0.34652959081995993, 'batch_norm': False, 'lr': 0.00027191561205037725, 'weight_decay': 5.31225546041753e-08, 'epochs': 61, 'loss': 'mae', 'optimizer': 'adamw', 'use_snp_selection': False, 'n_pcs': 1000}. Best is trial 95 with value: 0.23197170253801733.
2026-06-01 14:19:27 | INFO | Trial 100 | outer=9 | hidden=[256, 64] epochs=50 lr=1.792e-04 wd=1.661e-07 n_pcs=1000 weight={'name': 'uniform'}
[I 2026-06-01 14:19:29,206] Trial 100 pruned. 
2026-06-01 14:19:29 | INFO | Trial 101 | outer=9 | hidden=[1024, 256] epochs=61 lr=3.078e-04 wd=7.515e-07 n_pcs=1000 weight={'name': 'uniform'}
[I 2026-06-01 14:19:32,789] Trial 101 finished with value: 0.1950433367943066 and parameters: {'hidden_dims': '[1024, 256]', 'dropout': 0.3206175990282235, 'batch_norm': False, 'lr': 0.00030775509840446816, 'weight_decay': 7.514932119597465e-07, 'epochs': 61, 'loss': 'mae', 'optimizer': 'adamw', 'use_snp_selection': False, 'n_pcs': 1000}. Best is trial 95 with value: 0.23197170253801733.
2026-06-01 14:19:32 | INFO | Trial 102 | outer=9 | hidden=[1024, 256] epochs=69 lr=2.844e-04 wd=1.384e-05 n_pcs=4000 weight={'name': 'uniform'}
[I 2026-06-01 14:19:40,760] Trial 102 finished with value: 0.21430991690390794 and parameters: {'hidden_dims': '[1024, 256]', 'dropout': 0.298835568038634, 'batch_norm': False, 'lr': 0.0002844415351438535, 'weight_decay': 1.3839661395920918e-05, 'epochs': 69, 'loss': 'mae', 'optimizer': 'adamw', 'use_snp_selection': False, 'n_pcs': 4000}. Best is trial 95 with value: 0.23197170253801733.
2026-06-01 14:19:40 | INFO | Trial 103 | outer=9 | hidden=[1024, 256] epochs=83 lr=2.387e-04 wd=1.116e-05 n_pcs=4000 weight={'name': 'uniform'}
[I 2026-06-01 14:19:49,857] Trial 103 finished with value: 0.20605927836234886 and parameters: {'hidden_dims': '[1024, 256]', 'dropout': 0.3024340041208458, 'batch_norm': False, 'lr': 0.0002387147173815396, 'weight_decay': 1.1159045782317752e-05, 'epochs': 83, 'loss': 'mae', 'optimizer': 'adamw', 'use_snp_selection': False, 'n_pcs': 4000}. Best is trial 95 with value: 0.23197170253801733.
2026-06-01 14:19:49 | INFO | Trial 104 | outer=9 | hidden=[1024, 256] epochs=90 lr=1.947e-04 wd=8.389e-06 n_pcs=3500 weight={'name': 'uniform'}
[I 2026-06-01 14:19:58,649] Trial 104 finished with value: 0.20821056672360044 and parameters: {'hidden_dims': '[1024, 256]', 'dropout': 0.2519215112765925, 'batch_norm': False, 'lr': 0.00019468839660095503, 'weight_decay': 8.389207035457421e-06, 'epochs': 90, 'loss': 'mae', 'optimizer': 'adamw', 'use_snp_selection': False, 'n_pcs': 3500}. Best is trial 95 with value: 0.23197170253801733.
2026-06-01 14:19:58 | INFO | Trial 105 | outer=9 | hidden=[1024, 256] epochs=76 lr=2.877e-04 wd=2.195e-07 n_pcs=5000 weight={'name': 'uniform'}
[I 2026-06-01 14:20:08,605] Trial 105 finished with value: 0.21271896403659718 and parameters: {'hidden_dims': '[1024, 256]', 'dropout': 0.20291739440490503, 'batch_norm': False, 'lr': 0.00028772164814075944, 'weight_decay': 2.1946269016620782e-07, 'epochs': 76, 'loss': 'mae', 'optimizer': 'adamw', 'use_snp_selection': False, 'n_pcs': 5000}. Best is trial 95 with value: 0.23197170253801733.
2026-06-01 14:20:08 | INFO | Trial 106 | outer=9 | hidden=[512, 256] epochs=74 lr=2.197e-04 wd=3.842e-05 n_pcs=4500 weight={'name': 'uniform'}
[I 2026-06-01 14:20:14,438] Trial 106 finished with value: 0.1992911816971888 and parameters: {'hidden_dims': '[512, 256]', 'dropout': 0.22052258059989652, 'batch_norm': False, 'lr': 0.00021970037816023465, 'weight_decay': 3.8418568312730376e-05, 'epochs': 74, 'loss': 'mae', 'optimizer': 'adamw', 'use_snp_selection': False, 'n_pcs': 4500}. Best is trial 95 with value: 0.23197170253801733.
2026-06-01 14:20:14 | INFO | Trial 107 | outer=9 | hidden=[1024, 256] epochs=80 lr=3.593e-04 wd=1.260e-07 n_pcs=5000 weight={'name': 'uniform'}
[I 2026-06-01 14:20:24,792] Trial 107 finished with value: 0.2060793390677703 and parameters: {'hidden_dims': '[1024, 256]', 'dropout': 0.20196765055018948, 'batch_norm': False, 'lr': 0.000359332071781535, 'weight_decay': 1.2601503075734665e-07, 'epochs': 80, 'loss': 'mae', 'optimizer': 'adamw', 'use_snp_selection': False, 'n_pcs': 5000}. Best is trial 95 with value: 0.23197170253801733.
2026-06-01 14:20:24 | INFO | Trial 108 | outer=9 | hidden=[1024, 256] epochs=68 lr=3.982e-04 wd=1.492e-05 n_pcs=4500 weight={'name': 'uniform'}
[I 2026-06-01 14:20:33,307] Trial 108 finished with value: 0.19706640871220182 and parameters: {'hidden_dims': '[1024, 256]', 'dropout': 0.17420505427715446, 'batch_norm': False, 'lr': 0.00039817658406252114, 'weight_decay': 1.4922457681994853e-05, 'epochs': 68, 'loss': 'mae', 'optimizer': 'adamw', 'use_snp_selection': False, 'n_pcs': 4500}. Best is trial 95 with value: 0.23197170253801733.
2026-06-01 14:20:33 | INFO | Trial 109 | outer=9 | hidden=[512, 128] epochs=117 lr=1.587e-04 wd=8.538e-06 n_pcs=3500 weight={'name': 'uniform'}
[I 2026-06-01 14:20:39,729] Trial 109 finished with value: 0.19577592166877852 and parameters: {'hidden_dims': '[512, 128]', 'dropout': 0.11324596569106916, 'batch_norm': False, 'lr': 0.00015873846311582386, 'weight_decay': 8.538018149802027e-06, 'epochs': 117, 'loss': 'mae', 'optimizer': 'adamw', 'use_snp_selection': False, 'n_pcs': 3500}. Best is trial 95 with value: 0.23197170253801733.
2026-06-01 14:20:39 | INFO | Trial 110 | outer=9 | hidden=[512, 256] epochs=100 lr=2.590e-04 wd=3.419e-08 n_pcs=5000 weight={'name': 'uniform'}
[I 2026-06-01 14:20:47,202] Trial 110 finished with value: 0.20121752582637914 and parameters: {'hidden_dims': '[512, 256]', 'dropout': 0.15006753617643803, 'batch_norm': False, 'lr': 0.00025903870142995075, 'weight_decay': 3.418861655981564e-08, 'epochs': 100, 'loss': 'mae', 'optimizer': 'adam', 'use_snp_selection': False, 'n_pcs': 5000}. Best is trial 95 with value: 0.23197170253801733.
2026-06-01 14:20:47 | INFO | Trial 111 | outer=9 | hidden=[1024, 256] epochs=55 lr=2.921e-04 wd=6.623e-08 n_pcs=4500 weight={'name': 'uniform'}
[I 2026-06-01 14:20:54,548] Trial 111 finished with value: 0.19191925966378104 and parameters: {'hidden_dims': '[1024, 256]', 'dropout': 0.33649303780869605, 'batch_norm': False, 'lr': 0.0002921396669435779, 'weight_decay': 6.622836552651378e-08, 'epochs': 55, 'loss': 'mae', 'optimizer': 'adamw', 'use_snp_selection': False, 'n_pcs': 4500}. Best is trial 95 with value: 0.23197170253801733.
2026-06-01 14:20:54 | INFO | Trial 112 | outer=9 | hidden=[1024, 256] epochs=299 lr=2.792e-04 wd=2.490e-07 n_pcs=4000 weight={'name': 'uniform'}
[I 2026-06-01 14:21:21,184] Trial 112 finished with value: 0.19500480182530247 and parameters: {'hidden_dims': '[1024, 256]', 'dropout': 0.30415750149122794, 'batch_norm': False, 'lr': 0.0002792193143499593, 'weight_decay': 2.490333722176128e-07, 'epochs': 299, 'loss': 'mae', 'optimizer': 'adamw', 'use_snp_selection': False, 'n_pcs': 4000}. Best is trial 95 with value: 0.23197170253801733.
2026-06-01 14:21:21 | INFO | Trial 113 | outer=9 | hidden=[1024, 256] epochs=63 lr=3.198e-04 wd=2.154e-07 n_pcs=3000 weight={'name': 'uniform'}
[I 2026-06-01 14:21:27,389] Trial 113 finished with value: 0.20004511796897306 and parameters: {'hidden_dims': '[1024, 256]', 'dropout': 0.2247645741411171, 'batch_norm': False, 'lr': 0.00031977893396898397, 'weight_decay': 2.154306748798902e-07, 'epochs': 63, 'loss': 'mae', 'optimizer': 'adamw', 'use_snp_selection': False, 'n_pcs': 3000}. Best is trial 95 with value: 0.23197170253801733.
2026-06-01 14:21:27 | INFO | Trial 114 | outer=9 | hidden=[1024, 256] epochs=76 lr=4.633e-04 wd=1.280e-05 n_pcs=5000 weight={'name': 'uniform'}
[I 2026-06-01 14:21:37,341] Trial 114 finished with value: 0.2100619821066904 and parameters: {'hidden_dims': '[1024, 256]', 'dropout': 0.20016231657473466, 'batch_norm': False, 'lr': 0.00046328536022645876, 'weight_decay': 1.2803365066878492e-05, 'epochs': 76, 'loss': 'mae', 'optimizer': 'adamw', 'use_snp_selection': False, 'n_pcs': 5000}. Best is trial 95 with value: 0.23197170253801733.
2026-06-01 14:21:37 | INFO | Trial 115 | outer=9 | hidden=[1024, 256] epochs=58 lr=4.992e-04 wd=3.655e-07 n_pcs=2500 weight={'name': 'uniform'}
[I 2026-06-01 14:21:42,583] Trial 115 finished with value: 0.19313792597854687 and parameters: {'hidden_dims': '[1024, 256]', 'dropout': 0.28900057431484416, 'batch_norm': False, 'lr': 0.0004991636264538678, 'weight_decay': 3.655086136230787e-07, 'epochs': 58, 'loss': 'mae', 'optimizer': 'adamw', 'use_snp_selection': False, 'n_pcs': 2500}. Best is trial 95 with value: 0.23197170253801733.
2026-06-01 14:21:42 | INFO | Trial 116 | outer=9 | hidden=[256, 128] epochs=200 lr=2.417e-04 wd=5.040e-07 n_pcs=4000 weight={'name': 'uniform'}
[I 2026-06-01 14:21:49,098] Trial 116 finished with value: 0.1835554007213065 and parameters: {'hidden_dims': '[256, 128]', 'dropout': 0.40648356626186266, 'batch_norm': False, 'lr': 0.00024167880451842727, 'weight_decay': 5.040422616055162e-07, 'epochs': 200, 'loss': 'mae', 'optimizer': 'adamw', 'use_snp_selection': False, 'n_pcs': 4000}. Best is trial 95 with value: 0.23197170253801733.
2026-06-01 14:21:49 | INFO | Trial 117 | outer=9 | hidden=[512, 64] epochs=69 lr=7.468e-05 wd=8.834e-08 n_pcs=1000 weight={'name': 'uniform'}
[I 2026-06-01 14:21:51,196] Trial 117 pruned. 
2026-06-01 14:21:51 | INFO | Trial 118 | outer=9 | hidden=[256, 64] epochs=87 lr=4.562e-05 wd=4.217e-04 n_pcs=1000 weight={'name': 'uniform'}
[I 2026-06-01 14:21:52,835] Trial 118 pruned. 
2026-06-01 14:21:52 | INFO | Trial 119 | outer=9 | hidden=[1024, 256] epochs=63 lr=2.167e-04 wd=1.466e-07 n_pcs=500 weight={'name': 'uniform'}
[I 2026-06-01 14:21:55,804] Trial 119 finished with value: 0.20544853903818033 and parameters: {'hidden_dims': '[1024, 256]', 'dropout': 0.34404321032441476, 'batch_norm': False, 'lr': 0.00021667320492452523, 'weight_decay': 1.4656728876137812e-07, 'epochs': 63, 'loss': 'mae', 'optimizer': 'adamw', 'use_snp_selection': False, 'n_pcs': 500}. Best is trial 95 with value: 0.23197170253801733.
2026-06-01 14:21:55 | INFO | Trial 120 | outer=9 | hidden=[1024, 256] epochs=159 lr=2.883e-04 wd=1.107e-06 n_pcs=1500 weight={'name': 'uniform'}
[I 2026-06-01 14:22:03,893] Trial 120 finished with value: 0.19970011552539485 and parameters: {'hidden_dims': '[1024, 256]', 'dropout': 0.2629195233187951, 'batch_norm': False, 'lr': 0.0002883144448850534, 'weight_decay': 1.1065274246657044e-06, 'epochs': 159, 'loss': 'mae', 'optimizer': 'adam', 'use_snp_selection': False, 'n_pcs': 1500}. Best is trial 95 with value: 0.23197170253801733.
2026-06-01 14:22:03 | INFO | Trial 121 | outer=9 | hidden=[1024, 256] epochs=55 lr=3.427e-04 wd=1.533e-06 n_pcs=1000 weight={'name': 'uniform'}
[I 2026-06-01 14:22:07,294] Trial 121 finished with value: 0.20121752496928919 and parameters: {'hidden_dims': '[1024, 256]', 'dropout': 0.41408128531302163, 'batch_norm': False, 'lr': 0.00034269246489330795, 'weight_decay': 1.5327915008264749e-06, 'epochs': 55, 'loss': 'mae', 'optimizer': 'adamw', 'use_snp_selection': False, 'n_pcs': 1000}. Best is trial 95 with value: 0.23197170253801733.
2026-06-01 14:22:07 | INFO | Trial 122 | outer=9 | hidden=[1024, 256] epochs=71 lr=3.808e-04 wd=2.702e-06 n_pcs=1000 weight={'name': 'uniform'}
[I 2026-06-01 14:22:11,197] Trial 122 finished with value: 0.21596428487546807 and parameters: {'hidden_dims': '[1024, 256]', 'dropout': 0.5172745835400563, 'batch_norm': False, 'lr': 0.0003807676836174755, 'weight_decay': 2.7022369131573754e-06, 'epochs': 71, 'loss': 'mae', 'optimizer': 'adamw', 'use_snp_selection': False, 'n_pcs': 1000}. Best is trial 95 with value: 0.23197170253801733.
2026-06-01 14:22:11 | INFO | Trial 123 | outer=9 | hidden=[1024, 256] epochs=72 lr=3.877e-04 wd=1.077e-07 n_pcs=1000 weight={'name': 'uniform'}
[I 2026-06-01 14:22:15,152] Trial 123 finished with value: 0.18233199418398863 and parameters: {'hidden_dims': '[1024, 256]', 'dropout': 0.050782560687681166, 'batch_norm': False, 'lr': 0.00038772570525230345, 'weight_decay': 1.0765319895652164e-07, 'epochs': 72, 'loss': 'mae', 'optimizer': 'adamw', 'use_snp_selection': False, 'n_pcs': 1000}. Best is trial 95 with value: 0.23197170253801733.
2026-06-01 14:22:15 | INFO | Trial 124 | outer=9 | hidden=[1024, 256] epochs=79 lr=2.647e-04 wd=2.655e-06 n_pcs=1000 weight={'name': 'uniform'}
[I 2026-06-01 14:22:19,306] Trial 124 finished with value: 0.20272683368458183 and parameters: {'hidden_dims': '[1024, 256]', 'dropout': 0.3611868344353163, 'batch_norm': False, 'lr': 0.00026472549241810813, 'weight_decay': 2.6546317172648512e-06, 'epochs': 79, 'loss': 'mae', 'optimizer': 'adamw', 'use_snp_selection': False, 'n_pcs': 1000}. Best is trial 95 with value: 0.23197170253801733.
2026-06-01 14:22:19 | INFO | Trial 125 | outer=9 | hidden=[512, 256] epochs=50 lr=4.315e-04 wd=1.772e-06 n_pcs=1000 weight={'name': 'uniform'}
[I 2026-06-01 14:22:21,829] Trial 125 finished with value: 0.2156336917983055 and parameters: {'hidden_dims': '[512, 256]', 'dropout': 0.5543697288741413, 'batch_norm': False, 'lr': 0.0004314839062261069, 'weight_decay': 1.7724925857976355e-06, 'epochs': 50, 'loss': 'mae', 'optimizer': 'adamw', 'use_snp_selection': False, 'n_pcs': 1000}. Best is trial 95 with value: 0.23197170253801733.
2026-06-01 14:22:21 | INFO | Trial 126 | outer=9 | hidden=[512, 256] epochs=65 lr=4.265e-04 wd=3.747e-06 n_pcs=1500 weight={'name': 'uniform'}
[I 2026-06-01 14:22:24,994] Trial 126 finished with value: 0.19582141043005993 and parameters: {'hidden_dims': '[512, 256]', 'dropout': 0.5686727225963106, 'batch_norm': False, 'lr': 0.0004264801427280527, 'weight_decay': 3.7468616435211505e-06, 'epochs': 65, 'loss': 'mae', 'optimizer': 'adamw', 'use_snp_selection': False, 'n_pcs': 1500}. Best is trial 95 with value: 0.23197170253801733.
2026-06-01 14:22:25 | INFO | Trial 127 | outer=9 | hidden=[512, 256] epochs=242 lr=4.445e-04 wd=1.873e-06 n_pcs=500 weight={'name': 'uniform'}
[I 2026-06-01 14:22:29,787] Trial 127 finished with value: 0.18009968341523508 and parameters: {'hidden_dims': '[512, 256]', 'dropout': 0.542361009752141, 'batch_norm': False, 'lr': 0.00044452150765592096, 'weight_decay': 1.8728982751316015e-06, 'epochs': 242, 'loss': 'mae', 'optimizer': 'adamw', 'use_snp_selection': False, 'n_pcs': 500}. Best is trial 95 with value: 0.23197170253801733.
2026-06-01 14:22:29 | INFO | Trial 128 | outer=9 | hidden=[512, 256] epochs=59 lr=3.608e-04 wd=4.800e-06 n_pcs=1000 weight={'name': 'uniform'}
[I 2026-06-01 14:22:32,470] Trial 128 finished with value: 0.2220645587896036 and parameters: {'hidden_dims': '[512, 256]', 'dropout': 0.5145963494482984, 'batch_norm': False, 'lr': 0.00036084082729048175, 'weight_decay': 4.800375212757348e-06, 'epochs': 59, 'loss': 'mae', 'optimizer': 'adamw', 'use_snp_selection': False, 'n_pcs': 1000}. Best is trial 95 with value: 0.23197170253801733.
2026-06-01 14:22:32 | INFO | Trial 129 | outer=9 | hidden=[512, 256] epochs=59 lr=3.960e-04 wd=4.770e-06 n_pcs=1000 weight={'name': 'uniform'}
[I 2026-06-01 14:22:35,154] Trial 129 finished with value: 0.20164028893843816 and parameters: {'hidden_dims': '[512, 256]', 'dropout': 0.5812845265172083, 'batch_norm': False, 'lr': 0.0003959753812413925, 'weight_decay': 4.769539343434174e-06, 'epochs': 59, 'loss': 'mae', 'optimizer': 'adamw', 'use_snp_selection': False, 'n_pcs': 1000}. Best is trial 95 with value: 0.23197170253801733.
2026-06-01 14:22:35 | INFO | Trial 130 | outer=9 | hidden=[512, 256] epochs=55 lr=3.622e-04 wd=7.229e-06 n_pcs=1000 weight={'name': 'uniform'}
[I 2026-06-01 14:22:37,769] Trial 130 finished with value: 0.20377642712113744 and parameters: {'hidden_dims': '[512, 256]', 'dropout': 0.5072694658668462, 'batch_norm': False, 'lr': 0.0003621979739776963, 'weight_decay': 7.229420421436294e-06, 'epochs': 55, 'loss': 'mae', 'optimizer': 'adamw', 'use_snp_selection': False, 'n_pcs': 1000}. Best is trial 95 with value: 0.23197170253801733.
2026-06-01 14:22:37 | INFO | Trial 131 | outer=9 | hidden=[512, 256] epochs=69 lr=4.247e-04 wd=3.073e-06 n_pcs=1000 weight={'name': 'uniform'}
[I 2026-06-01 14:22:40,631] Trial 131 finished with value: 0.21079380373269618 and parameters: {'hidden_dims': '[512, 256]', 'dropout': 0.5179799475495664, 'batch_norm': False, 'lr': 0.0004247370753098987, 'weight_decay': 3.0729674568909725e-06, 'epochs': 69, 'loss': 'mae', 'optimizer': 'adamw', 'use_snp_selection': False, 'n_pcs': 1000}. Best is trial 95 with value: 0.23197170253801733.
2026-06-01 14:22:40 | INFO | Trial 132 | outer=9 | hidden=[512, 256] epochs=62 lr=3.304e-04 wd=5.674e-06 n_pcs=1000 weight={'name': 'uniform'}
