[I 2026-06-01 14:54:50,521] Trial 24 finished with value: 0.16455863207419097 and parameters: {'hidden_dims': '[256, 128]', 'dropout': 0.3576027095878981, 'batch_norm': False, 'lr': 5.317979648126966e-05, 'weight_decay': 5.020181508887581e-07, 'epochs': 183, 'loss': 'mae', 'optimizer': 'adamw', 'use_snp_selection': False, 'n_pcs': 4000}. Best is trial 21 with value: 0.18466940506899376.
2026-06-01 14:54:50 | INFO | Trial 25 | outer=12 | hidden=[1024, 256] epochs=148 lr=1.993e-04 wd=1.229e-05 n_pcs=3500 weight={'name': 'uniform'}
[I 2026-06-01 14:55:02,809] Trial 25 finished with value: 0.1680091022278521 and parameters: {'hidden_dims': '[1024, 256]', 'dropout': 0.23281379138560432, 'batch_norm': False, 'lr': 0.00019927749043161574, 'weight_decay': 1.2293320228543048e-05, 'epochs': 148, 'loss': 'mae', 'optimizer': 'adamw', 'use_snp_selection': False, 'n_pcs': 3500}. Best is trial 21 with value: 0.18466940506899376.
2026-06-01 14:55:02 | INFO | Trial 26 | outer=12 | hidden=[512, 64] epochs=186 lr=9.298e-05 wd=1.097e-06 n_pcs=4500 weight={'name': 'uniform'}
[I 2026-06-01 14:55:12,744] Trial 26 finished with value: 0.18853673515632413 and parameters: {'hidden_dims': '[512, 64]', 'dropout': 0.46095693921768954, 'batch_norm': False, 'lr': 9.297610884822239e-05, 'weight_decay': 1.0965343741312825e-06, 'epochs': 186, 'loss': 'mae', 'optimizer': 'adamw', 'use_snp_selection': False, 'n_pcs': 4500}. Best is trial 26 with value: 0.18853673515632413.
2026-06-01 14:55:12 | INFO | Trial 27 | outer=12 | hidden=[512, 64] epochs=184 lr=9.074e-05 wd=1.326e-06 n_pcs=5000 weight={'name': 'uniform'}
[I 2026-06-01 14:55:23,048] Trial 27 finished with value: 0.178983946669604 and parameters: {'hidden_dims': '[512, 64]', 'dropout': 0.5125725810667463, 'batch_norm': False, 'lr': 9.073506261806406e-05, 'weight_decay': 1.3260613450801725e-06, 'epochs': 184, 'loss': 'mae', 'optimizer': 'adam', 'use_snp_selection': False, 'n_pcs': 5000}. Best is trial 26 with value: 0.18853673515632413.
2026-06-01 14:55:23 | INFO | Trial 28 | outer=12 | hidden=[512, 64] epochs=114 lr=5.836e-05 wd=1.966e-06 n_pcs=2000 weight={'name': 'uniform'}
[I 2026-06-01 14:55:25,555] Trial 28 pruned. 
2026-06-01 14:55:25 | INFO | Trial 29 | outer=12 | hidden=[256, 64] epochs=232 lr=8.560e-05 wd=6.562e-05 n_pcs=1000 weight={'name': 'uniform'}
[I 2026-06-01 14:55:28,316] Trial 29 pruned. 
2026-06-01 14:55:28 | INFO | Trial 30 | outer=12 | hidden=[512, 256] epochs=81 lr=3.400e-04 wd=3.812e-04 n_pcs=4000 weight={'name': 'uniform'}
[I 2026-06-01 14:55:33,726] Trial 30 finished with value: 0.17942733838561517 and parameters: {'hidden_dims': '[512, 256]', 'dropout': 0.5380544827651745, 'batch_norm': False, 'lr': 0.00033998098318466143, 'weight_decay': 0.0003811784491378252, 'epochs': 81, 'loss': 'mae', 'optimizer': 'adamw', 'use_snp_selection': False, 'n_pcs': 4000}. Best is trial 26 with value: 0.18853673515632413.
2026-06-01 14:55:33 | INFO | Trial 31 | outer=12 | hidden=[512, 256] epochs=83 lr=3.286e-04 wd=4.142e-04 n_pcs=4000 weight={'name': 'uniform'}
[I 2026-06-01 14:55:39,206] Trial 31 finished with value: 0.17383541987840606 and parameters: {'hidden_dims': '[512, 256]', 'dropout': 0.547170856382776, 'batch_norm': False, 'lr': 0.0003286340468609189, 'weight_decay': 0.0004141801055858745, 'epochs': 83, 'loss': 'mae', 'optimizer': 'adamw', 'use_snp_selection': False, 'n_pcs': 4000}. Best is trial 26 with value: 0.18853673515632413.
2026-06-01 14:55:39 | INFO | Trial 32 | outer=12 | hidden=[512, 256] epochs=124 lr=2.108e-04 wd=3.349e-04 n_pcs=4500 weight={'name': 'uniform'}
[I 2026-06-01 14:55:46,958] Trial 32 finished with value: 0.16663711143943744 and parameters: {'hidden_dims': '[512, 256]', 'dropout': 0.5539061525293074, 'batch_norm': False, 'lr': 0.0002107503503558034, 'weight_decay': 0.00033490191656346805, 'epochs': 124, 'loss': 'mae', 'optimizer': 'adamw', 'use_snp_selection': False, 'n_pcs': 4500}. Best is trial 26 with value: 0.18853673515632413.
2026-06-01 14:55:46 | INFO | Trial 33 | outer=12 | hidden=[1024, 256] epochs=78 lr=1.482e-04 wd=3.676e-04 n_pcs=3500 weight={'name': 'uniform'}
[I 2026-06-01 14:55:54,455] Trial 33 finished with value: 0.1640876760864761 and parameters: {'hidden_dims': '[1024, 256]', 'dropout': 0.46288494272874914, 'batch_norm': False, 'lr': 0.00014818752798943102, 'weight_decay': 0.000367589495818145, 'epochs': 78, 'loss': 'mae', 'optimizer': 'adamw', 'use_snp_selection': False, 'n_pcs': 3500}. Best is trial 26 with value: 0.18853673515632413.
2026-06-01 14:55:54 | INFO | Trial 34 | outer=12 | hidden=[256, 64] epochs=193 lr=4.917e-04 wd=7.586e-05 n_pcs=5000 weight={'name': 'uniform'}
[I 2026-06-01 14:56:01,259] Trial 34 finished with value: 0.1711758625300614 and parameters: {'hidden_dims': '[256, 64]', 'dropout': 0.5374049263374892, 'batch_norm': False, 'lr': 0.0004917030971028565, 'weight_decay': 7.586089209588488e-05, 'epochs': 193, 'loss': 'mae', 'optimizer': 'adamw', 'use_snp_selection': False, 'n_pcs': 5000}. Best is trial 26 with value: 0.18853673515632413.
2026-06-01 14:56:01 | INFO | Trial 35 | outer=12 | hidden=[512, 256] epochs=100 lr=4.410e-05 wd=3.200e-07 n_pcs=4500 weight={'name': 'uniform'}
[I 2026-06-01 14:56:07,948] Trial 35 finished with value: 0.1431531944685996 and parameters: {'hidden_dims': '[512, 256]', 'dropout': 0.5720756128015367, 'batch_norm': False, 'lr': 4.410377971168912e-05, 'weight_decay': 3.2001365636122985e-07, 'epochs': 100, 'loss': 'mae', 'optimizer': 'adam', 'use_snp_selection': False, 'n_pcs': 4500}. Best is trial 26 with value: 0.18853673515632413.
2026-06-01 14:56:07 | INFO | Trial 36 | outer=12 | hidden=[512, 256] epochs=227 lr=3.276e-04 wd=1.272e-05 n_pcs=4000 weight={'name': 'uniform'}
[I 2026-06-01 14:56:19,235] Trial 36 finished with value: 0.18104745416320817 and parameters: {'hidden_dims': '[512, 256]', 'dropout': 0.5016272560791708, 'batch_norm': False, 'lr': 0.00032762862185644167, 'weight_decay': 1.2723242659184115e-05, 'epochs': 227, 'loss': 'mae', 'optimizer': 'adamw', 'use_snp_selection': False, 'n_pcs': 4000}. Best is trial 26 with value: 0.18853673515632413.
2026-06-01 14:56:19 | INFO | Trial 37 | outer=12 | hidden=[256, 128] epochs=237 lr=2.331e-04 wd=1.188e-05 n_pcs=500 weight={'name': 'uniform'}
[I 2026-06-01 14:56:23,849] Trial 37 finished with value: 0.14786030979090806 and parameters: {'hidden_dims': '[256, 128]', 'dropout': 0.4976813266734522, 'batch_norm': False, 'lr': 0.00023308355206606095, 'weight_decay': 1.1879723452390286e-05, 'epochs': 237, 'loss': 'mae', 'optimizer': 'adam', 'use_snp_selection': False, 'n_pcs': 500}. Best is trial 26 with value: 0.18853673515632413.
2026-06-01 14:56:23 | INFO | Trial 38 | outer=12 | hidden=[1024, 256] epochs=257 lr=1.637e-04 wd=2.962e-06 n_pcs=5000 weight={'name': 'uniform'}
[I 2026-06-01 14:56:49,289] Trial 38 finished with value: 0.1824467734824379 and parameters: {'hidden_dims': '[1024, 256]', 'dropout': 0.42795608712178734, 'batch_norm': False, 'lr': 0.00016368326218775463, 'weight_decay': 2.9618253860130415e-06, 'epochs': 257, 'loss': 'mae', 'optimizer': 'adamw', 'use_snp_selection': False, 'n_pcs': 5000}. Best is trial 26 with value: 0.18853673515632413.
2026-06-01 14:56:49 | INFO | Trial 39 | outer=12 | hidden=[1024, 256] epochs=262 lr=6.753e-05 wd=2.995e-06 n_pcs=5000 weight={'name': 'uniform'}
[I 2026-06-01 14:57:15,165] Trial 39 finished with value: 0.16893564297998725 and parameters: {'hidden_dims': '[1024, 256]', 'dropout': 0.272231835501525, 'batch_norm': False, 'lr': 6.752726129441162e-05, 'weight_decay': 2.9949634424198254e-06, 'epochs': 262, 'loss': 'mae', 'optimizer': 'adamw', 'use_snp_selection': False, 'n_pcs': 5000}. Best is trial 26 with value: 0.18853673515632413.
2026-06-01 14:57:15 | INFO | Trial 40 | outer=12 | hidden=[1024, 256] epochs=251 lr=1.668e-04 wd=1.153e-06 n_pcs=5000 weight={'name': 'uniform'}
[I 2026-06-01 14:57:40,118] Trial 40 finished with value: 0.1686535591557526 and parameters: {'hidden_dims': '[1024, 256]', 'dropout': 0.4206383266978628, 'batch_norm': False, 'lr': 0.0001667932995606746, 'weight_decay': 1.153082025297218e-06, 'epochs': 251, 'loss': 'mse', 'optimizer': 'adam', 'use_snp_selection': False, 'n_pcs': 5000}. Best is trial 26 with value: 0.18853673515632413.
2026-06-01 14:57:40 | INFO | Trial 41 | outer=12 | hidden=[1024, 256] epochs=222 lr=3.252e-04 wd=2.975e-06 n_pcs=4500 weight={'name': 'uniform'}
[I 2026-06-01 14:58:01,149] Trial 41 finished with value: 0.1804270720629537 and parameters: {'hidden_dims': '[1024, 256]', 'dropout': 0.38468431049860663, 'batch_norm': False, 'lr': 0.00032524376831699934, 'weight_decay': 2.975449367333389e-06, 'epochs': 222, 'loss': 'mae', 'optimizer': 'adamw', 'use_snp_selection': False, 'n_pcs': 4500}. Best is trial 26 with value: 0.18853673515632413.
2026-06-01 14:58:01 | INFO | Trial 42 | outer=12 | hidden=[512, 64] epochs=211 lr=9.104e-05 wd=8.316e-06 n_pcs=4000 weight={'name': 'uniform'}
[I 2026-06-01 14:58:11,155] Trial 42 finished with value: 0.1669963740763923 and parameters: {'hidden_dims': '[512, 64]', 'dropout': 0.3237836072966592, 'batch_norm': False, 'lr': 9.103912250964736e-05, 'weight_decay': 8.315592983987533e-06, 'epochs': 211, 'loss': 'mae', 'optimizer': 'adamw', 'use_snp_selection': False, 'n_pcs': 4000}. Best is trial 26 with value: 0.18853673515632413.
2026-06-01 14:58:11 | INFO | Trial 43 | outer=12 | hidden=[256, 64] epochs=244 lr=1.467e-04 wd=1.726e-05 n_pcs=5000 weight={'name': 'uniform'}
[I 2026-06-01 14:58:19,160] Trial 43 finished with value: 0.18043726793085924 and parameters: {'hidden_dims': '[256, 64]', 'dropout': 0.4345008507715614, 'batch_norm': False, 'lr': 0.00014673943523420112, 'weight_decay': 1.7256734832276017e-05, 'epochs': 244, 'loss': 'mae', 'optimizer': 'adamw', 'use_snp_selection': False, 'n_pcs': 5000}. Best is trial 26 with value: 0.18853673515632413.
2026-06-01 14:58:19 | INFO | Trial 44 | outer=12 | hidden=[128, 64] epochs=220 lr=3.919e-04 wd=3.925e-06 n_pcs=4500 weight={'name': 'uniform'}
[I 2026-06-01 14:58:24,162] Trial 44 finished with value: 0.16761841398278965 and parameters: {'hidden_dims': '[128, 64]', 'dropout': 0.4932864356125461, 'batch_norm': False, 'lr': 0.00039187912380110704, 'weight_decay': 3.9250426764701845e-06, 'epochs': 220, 'loss': 'mae', 'optimizer': 'adamw', 'use_snp_selection': False, 'n_pcs': 4500}. Best is trial 26 with value: 0.18853673515632413.
2026-06-01 14:58:24 | INFO | Trial 45 | outer=12 | hidden=[512, 128] epochs=275 lr=1.773e-04 wd=8.413e-07 n_pcs=3000 weight={'name': 'uniform'}
[I 2026-06-01 14:58:34,440] Trial 45 finished with value: 0.15055757739357925 and parameters: {'hidden_dims': '[512, 128]', 'dropout': 0.4703868895864301, 'batch_norm': False, 'lr': 0.00017733643789055517, 'weight_decay': 8.413489636554601e-07, 'epochs': 275, 'loss': 'mse', 'optimizer': 'adamw', 'use_snp_selection': False, 'n_pcs': 3000}. Best is trial 26 with value: 0.18853673515632413.
2026-06-01 14:58:34 | INFO | Trial 46 | outer=12 | hidden=[1024, 256] epochs=202 lr=1.030e-05 wd=5.709e-05 n_pcs=5000 weight={'name': 'uniform'}
[I 2026-06-01 14:58:46,991] Trial 46 pruned. 
2026-06-01 14:58:47 | INFO | Trial 47 | outer=12 | hidden=[256, 128] epochs=290 lr=6.997e-05 wd=2.896e-07 n_pcs=4500 weight={'name': 'uniform'}
[I 2026-06-01 14:58:55,796] Trial 47 finished with value: 0.1649410706461844 and parameters: {'hidden_dims': '[256, 128]', 'dropout': 0.3763017312129212, 'batch_norm': False, 'lr': 6.9967836939169e-05, 'weight_decay': 2.8958109656065855e-07, 'epochs': 290, 'loss': 'mse', 'optimizer': 'adamw', 'use_snp_selection': False, 'n_pcs': 4500}. Best is trial 26 with value: 0.18853673515632413.
2026-06-01 14:58:55 | INFO | Trial 48 | outer=12 | hidden=[512, 128] epochs=169 lr=3.291e-05 wd=3.420e-08 n_pcs=4000 weight={'name': 'uniform'}
[I 2026-06-01 14:59:00,997] Trial 48 pruned. 
2026-06-01 14:59:01 | INFO | Trial 49 | outer=12 | hidden=[512, 64] epochs=157 lr=2.727e-04 wd=5.641e-06 n_pcs=5000 weight={'name': 'uniform'}
[I 2026-06-01 14:59:10,146] Trial 49 finished with value: 0.19278381368024503 and parameters: {'hidden_dims': '[512, 64]', 'dropout': 0.3099269533328145, 'batch_norm': False, 'lr': 0.0002726607241303901, 'weight_decay': 5.641295817455868e-06, 'epochs': 157, 'loss': 'mse', 'optimizer': 'adam', 'use_snp_selection': False, 'n_pcs': 5000}. Best is trial 49 with value: 0.19278381368024503.
2026-06-01 14:59:10 | INFO | Trial 50 | outer=12 | hidden=[512, 64] epochs=154 lr=2.301e-04 wd=6.155e-06 n_pcs=5000 weight={'name': 'uniform'}
[I 2026-06-01 14:59:19,170] Trial 50 finished with value: 0.1789803618131778 and parameters: {'hidden_dims': '[512, 64]', 'dropout': 0.20021348846585374, 'batch_norm': False, 'lr': 0.00023005213029705097, 'weight_decay': 6.154831427465576e-06, 'epochs': 154, 'loss': 'mse', 'optimizer': 'adam', 'use_snp_selection': False, 'n_pcs': 5000}. Best is trial 49 with value: 0.19278381368024503.
2026-06-01 14:59:19 | INFO | Trial 51 | outer=12 | hidden=[512, 64] epochs=132 lr=4.296e-04 wd=1.589e-06 n_pcs=5000 weight={'name': 'uniform'}
[I 2026-06-01 14:59:27,226] Trial 51 finished with value: 0.18291525172617007 and parameters: {'hidden_dims': '[512, 64]', 'dropout': 0.310715128550272, 'batch_norm': False, 'lr': 0.00042963099448396785, 'weight_decay': 1.5885236262807235e-06, 'epochs': 132, 'loss': 'mse', 'optimizer': 'adam', 'use_snp_selection': False, 'n_pcs': 5000}. Best is trial 49 with value: 0.19278381368024503.
2026-06-01 14:59:27 | INFO | Trial 52 | outer=12 | hidden=[512, 64] epochs=131 lr=4.201e-04 wd=1.922e-06 n_pcs=5000 weight={'name': 'uniform'}
[I 2026-06-01 14:59:35,257] Trial 52 finished with value: 0.18521191707941614 and parameters: {'hidden_dims': '[512, 64]', 'dropout': 0.29603537954407555, 'batch_norm': False, 'lr': 0.00042012963030068246, 'weight_decay': 1.922074622961947e-06, 'epochs': 131, 'loss': 'mse', 'optimizer': 'adam', 'use_snp_selection': False, 'n_pcs': 5000}. Best is trial 49 with value: 0.19278381368024503.
2026-06-01 14:59:35 | INFO | Trial 53 | outer=12 | hidden=[512, 64] epochs=128 lr=4.562e-04 wd=1.617e-06 n_pcs=5000 weight={'name': 'uniform'}
[I 2026-06-01 14:59:43,140] Trial 53 finished with value: 0.15796608324774492 and parameters: {'hidden_dims': '[512, 64]', 'dropout': 0.3007592292176605, 'batch_norm': False, 'lr': 0.00045623295152284374, 'weight_decay': 1.6166638158184941e-06, 'epochs': 128, 'loss': 'mse', 'optimizer': 'adam', 'use_snp_selection': False, 'n_pcs': 5000}. Best is trial 49 with value: 0.19278381368024503.
2026-06-01 14:59:43 | INFO | Trial 54 | outer=12 | hidden=[512, 64] epochs=137 lr=3.965e-04 wd=4.354e-07 n_pcs=4500 weight={'name': 'uniform'}
[I 2026-06-01 14:59:51,064] Trial 54 finished with value: 0.16538112507942665 and parameters: {'hidden_dims': '[512, 64]', 'dropout': 0.2699257026265457, 'batch_norm': False, 'lr': 0.0003965363489412906, 'weight_decay': 4.353811810035379e-07, 'epochs': 137, 'loss': 'mse', 'optimizer': 'adam', 'use_snp_selection': False, 'n_pcs': 4500}. Best is trial 49 with value: 0.19278381368024503.
2026-06-01 14:59:51 | INFO | Trial 55 | outer=12 | hidden=[512, 64] epochs=118 lr=2.774e-04 wd=1.941e-07 n_pcs=5000 weight={'name': 'uniform'}
[I 2026-06-01 14:59:58,525] Trial 55 finished with value: 0.1568775204179816 and parameters: {'hidden_dims': '[512, 64]', 'dropout': 0.29199695675817355, 'batch_norm': False, 'lr': 0.00027739493757754716, 'weight_decay': 1.9414469559257229e-07, 'epochs': 118, 'loss': 'mse', 'optimizer': 'adam', 'use_snp_selection': False, 'n_pcs': 5000}. Best is trial 49 with value: 0.19278381368024503.
2026-06-01 14:59:58 | INFO | Trial 56 | outer=12 | hidden=[512, 64] epochs=153 lr=4.373e-04 wd=8.374e-07 n_pcs=4500 weight={'name': 'uniform'}
[I 2026-06-01 15:00:07,113] Trial 56 finished with value: 0.17309072271499035 and parameters: {'hidden_dims': '[512, 64]', 'dropout': 0.23340470687958173, 'batch_norm': False, 'lr': 0.00043725180229393603, 'weight_decay': 8.373786432268121e-07, 'epochs': 153, 'loss': 'mse', 'optimizer': 'adam', 'use_snp_selection': False, 'n_pcs': 4500}. Best is trial 49 with value: 0.19278381368024503.
2026-06-01 15:00:07 | INFO | Trial 57 | outer=12 | hidden=[512, 64] epochs=175 lr=3.753e-04 wd=4.999e-06 n_pcs=2500 weight={'name': 'uniform'}
[I 2026-06-01 15:00:10,860] Trial 57 pruned. 
2026-06-01 15:00:10 | INFO | Trial 58 | outer=12 | hidden=[512, 64] epochs=133 lr=2.701e-04 wd=1.790e-06 n_pcs=5000 weight={'name': 'uniform'}
[I 2026-06-01 15:00:18,962] Trial 58 finished with value: 0.16279236182383836 and parameters: {'hidden_dims': '[512, 64]', 'dropout': 0.21172560596518245, 'batch_norm': False, 'lr': 0.00027007924160325026, 'weight_decay': 1.7900587860494413e-06, 'epochs': 133, 'loss': 'mse', 'optimizer': 'adam', 'use_snp_selection': False, 'n_pcs': 5000}. Best is trial 49 with value: 0.19278381368024503.
2026-06-01 15:00:18 | INFO | Trial 59 | outer=12 | hidden=[512, 64] epochs=147 lr=4.945e-04 wd=8.261e-06 n_pcs=4500 weight={'name': 'uniform'}
[I 2026-06-01 15:00:27,279] Trial 59 finished with value: 0.1657283751560538 and parameters: {'hidden_dims': '[512, 64]', 'dropout': 0.32489256678936757, 'batch_norm': False, 'lr': 0.0004944591344432969, 'weight_decay': 8.261347134670988e-06, 'epochs': 147, 'loss': 'mse', 'optimizer': 'adam', 'use_snp_selection': False, 'n_pcs': 4500}. Best is trial 49 with value: 0.19278381368024503.
2026-06-01 15:00:27 | INFO | Trial 60 | outer=12 | hidden=[512, 64] epochs=100 lr=1.060e-04 wd=2.373e-06 n_pcs=5000 weight={'name': 'uniform'}
[I 2026-06-01 15:00:33,923] Trial 60 finished with value: 0.14874318612663456 and parameters: {'hidden_dims': '[512, 64]', 'dropout': 0.1467115075679307, 'batch_norm': False, 'lr': 0.00010603461779286096, 'weight_decay': 2.372610009827717e-06, 'epochs': 100, 'loss': 'mse', 'optimizer': 'adam', 'use_snp_selection': False, 'n_pcs': 5000}. Best is trial 49 with value: 0.19278381368024503.
2026-06-01 15:00:33 | INFO | Trial 61 | outer=12 | hidden=[512, 128] epochs=122 lr=1.313e-04 wd=9.383e-07 n_pcs=5000 weight={'name': 'uniform'}
[I 2026-06-01 15:00:41,643] Trial 61 finished with value: 0.13933800451428008 and parameters: {'hidden_dims': '[512, 128]', 'dropout': 0.36530530268261785, 'batch_norm': False, 'lr': 0.00013128364545339965, 'weight_decay': 9.383435452504101e-07, 'epochs': 122, 'loss': 'mse', 'optimizer': 'adam', 'use_snp_selection': False, 'n_pcs': 5000}. Best is trial 49 with value: 0.19278381368024503.
2026-06-01 15:00:41 | INFO | Trial 62 | outer=12 | hidden=[128, 64] epochs=108 lr=2.933e-04 wd=4.555e-06 n_pcs=5000 weight={'name': 'uniform'}
[I 2026-06-01 15:00:45,315] Trial 62 finished with value: 0.1439673874794263 and parameters: {'hidden_dims': '[128, 64]', 'dropout': 0.40058862157939484, 'batch_norm': False, 'lr': 0.0002933396804247883, 'weight_decay': 4.554685328473377e-06, 'epochs': 108, 'loss': 'mse', 'optimizer': 'adam', 'use_snp_selection': False, 'n_pcs': 5000}. Best is trial 49 with value: 0.19278381368024503.
2026-06-01 15:00:45 | INFO | Trial 63 | outer=12 | hidden=[512, 64] epochs=157 lr=3.603e-04 wd=2.729e-06 n_pcs=2000 weight={'name': 'uniform'}
[I 2026-06-01 15:00:50,362] Trial 63 finished with value: 0.17479507472858052 and parameters: {'hidden_dims': '[512, 64]', 'dropout': 0.34601142684416375, 'batch_norm': False, 'lr': 0.00036030351790145216, 'weight_decay': 2.7290885444816282e-06, 'epochs': 157, 'loss': 'mse', 'optimizer': 'adam', 'use_snp_selection': False, 'n_pcs': 2000}. Best is trial 49 with value: 0.19278381368024503.
2026-06-01 15:00:50 | INFO | Trial 64 | outer=12 | hidden=[512, 64] epochs=138 lr=2.346e-04 wd=6.255e-07 n_pcs=4500 weight={'name': 'uniform'}
[I 2026-06-01 15:00:58,303] Trial 64 finished with value: 0.17993951803797498 and parameters: {'hidden_dims': '[512, 64]', 'dropout': 0.2567120329512491, 'batch_norm': False, 'lr': 0.0002345688868566926, 'weight_decay': 6.254780918494447e-07, 'epochs': 138, 'loss': 'mse', 'optimizer': 'adam', 'use_snp_selection': False, 'n_pcs': 4500}. Best is trial 49 with value: 0.19278381368024503.
2026-06-01 15:00:58 | INFO | Trial 65 | outer=12 | hidden=[512, 128] epochs=165 lr=3.014e-04 wd=1.390e-06 n_pcs=5000 weight={'name': 'uniform'}
[I 2026-06-01 15:01:07,935] Trial 65 finished with value: 0.16665783638931908 and parameters: {'hidden_dims': '[512, 128]', 'dropout': 0.04204227923791537, 'batch_norm': False, 'lr': 0.000301400722400285, 'weight_decay': 1.3904256232317355e-06, 'epochs': 165, 'loss': 'mse', 'optimizer': 'adam', 'use_snp_selection': False, 'n_pcs': 5000}. Best is trial 49 with value: 0.19278381368024503.
2026-06-01 15:01:07 | INFO | Trial 66 | outer=12 | hidden=[512, 64] epochs=184 lr=1.955e-04 wd=7.644e-08 n_pcs=4500 weight={'name': 'uniform'}
[I 2026-06-01 15:01:17,804] Trial 66 finished with value: 0.1611113228567906 and parameters: {'hidden_dims': '[512, 64]', 'dropout': 0.41910590247692914, 'batch_norm': False, 'lr': 0.0001954778906770421, 'weight_decay': 7.643630421381524e-08, 'epochs': 184, 'loss': 'mse', 'optimizer': 'adam', 'use_snp_selection': False, 'n_pcs': 4500}. Best is trial 49 with value: 0.19278381368024503.
2026-06-01 15:01:17 | INFO | Trial 67 | outer=12 | hidden=[512, 64] epochs=129 lr=1.150e-04 wd=2.007e-06 n_pcs=5000 weight={'name': 'uniform'}
[I 2026-06-01 15:01:25,713] Trial 67 finished with value: 0.1557918752124343 and parameters: {'hidden_dims': '[512, 64]', 'dropout': 0.3019439246379262, 'batch_norm': False, 'lr': 0.0001149566319916287, 'weight_decay': 2.00718265052171e-06, 'epochs': 129, 'loss': 'mse', 'optimizer': 'adamw', 'use_snp_selection': False, 'n_pcs': 5000}. Best is trial 49 with value: 0.19278381368024503.
2026-06-01 15:01:25 | INFO | Trial 68 | outer=12 | hidden=[1024, 256] epochs=115 lr=9.874e-05 wd=5.834e-04 n_pcs=4500 weight={'name': 'uniform'}
