[I 2026-06-01 13:12:26,259] Trial 144 finished with value: 0.24125459184305065 and parameters: {'hidden_dims': '[1024, 256]', 'dropout': 0.14536233346739147, 'batch_norm': False, 'lr': 0.00038960774831983203, 'weight_decay': 1.3657473679445865e-06, 'epochs': 69, 'loss': 'mse', 'optimizer': 'adamw', 'use_snp_selection': False, 'n_pcs': 5000}. Best is trial 144 with value: 0.24125459184305065.
2026-06-01 13:12:26 | INFO | Trial 145 | outer=5 | hidden=[1024, 256] epochs=66 lr=3.386e-04 wd=2.161e-06 n_pcs=5000 weight={'name': 'uniform'}
[I 2026-06-01 13:12:34,664] Trial 145 finished with value: 0.20607164441129672 and parameters: {'hidden_dims': '[1024, 256]', 'dropout': 0.1439460018424682, 'batch_norm': False, 'lr': 0.00033859566999255635, 'weight_decay': 2.161056898596784e-06, 'epochs': 66, 'loss': 'mse', 'optimizer': 'adamw', 'use_snp_selection': False, 'n_pcs': 5000}. Best is trial 144 with value: 0.24125459184305065.
2026-06-01 13:12:34 | INFO | Trial 146 | outer=5 | hidden=[1024, 256] epochs=61 lr=3.865e-04 wd=1.270e-06 n_pcs=5000 weight={'name': 'uniform'}
[I 2026-06-01 13:12:42,628] Trial 146 finished with value: 0.21809234427580643 and parameters: {'hidden_dims': '[1024, 256]', 'dropout': 0.080571360022041, 'batch_norm': False, 'lr': 0.0003864611199153317, 'weight_decay': 1.270284404786174e-06, 'epochs': 61, 'loss': 'mse', 'optimizer': 'adamw', 'use_snp_selection': False, 'n_pcs': 5000}. Best is trial 144 with value: 0.24125459184305065.
2026-06-01 13:12:42 | INFO | Trial 147 | outer=5 | hidden=[1024, 256] epochs=56 lr=4.576e-04 wd=3.691e-06 n_pcs=5000 weight={'name': 'uniform'}
[I 2026-06-01 13:12:50,157] Trial 147 finished with value: 0.2258382537054402 and parameters: {'hidden_dims': '[1024, 256]', 'dropout': 0.10558881069729044, 'batch_norm': False, 'lr': 0.000457572226052875, 'weight_decay': 3.6912594113530352e-06, 'epochs': 56, 'loss': 'mse', 'optimizer': 'adamw', 'use_snp_selection': False, 'n_pcs': 5000}. Best is trial 144 with value: 0.24125459184305065.
2026-06-01 13:12:50 | INFO | Trial 148 | outer=5 | hidden=[1024, 256] epochs=50 lr=3.422e-05 wd=6.200e-06 n_pcs=5000 weight={'name': 'uniform'}
[I 2026-06-01 13:12:54,322] Trial 148 pruned. 
2026-06-01 13:12:54 | INFO | Trial 149 | outer=5 | hidden=[1024, 256] epochs=58 lr=4.071e-04 wd=4.268e-06 n_pcs=5000 weight={'name': 'uniform'}
[I 2026-06-01 13:13:02,034] Trial 149 finished with value: 0.22562423783586474 and parameters: {'hidden_dims': '[1024, 256]', 'dropout': 0.4919174944484813, 'batch_norm': False, 'lr': 0.00040710571178656773, 'weight_decay': 4.2678654129297005e-06, 'epochs': 58, 'loss': 'mse', 'optimizer': 'adamw', 'use_snp_selection': False, 'n_pcs': 5000}. Best is trial 144 with value: 0.24125459184305065.
2026-06-01 13:13:02 | INFO | OUTER 5 best (inner mean r=0.2413): model={'hidden_dims': [1024, 256], 'dropout': 0.14536233346739147, 'batch_norm': False, 'lr': 0.00038960774831983203, 'weight_decay': 1.3657473679445865e-06, 'epochs': 69, 'loss': 'mse', 'optimizer': 'adamw', 'use_snp_selection': False, 'n_pcs': 5000} weighting={'name': 'uniform'}
2026-06-01 13:13:02 | INFO | OUTER 5 TEST r = 0.0846
2026-06-01 13:13:03 | INFO | OUTER 5 incremental summary saved to outputs/final_results/e8_pc_mlp_uniform/thr_wing/e8_pc_mlp_uniform_thr_wing_results.json
2026-06-01 13:13:03 | INFO | OUTER 6: test_size=1055 island=5 (Hestmannøy)
2026-06-01 13:13:03 | INFO | OUTER 6: inner LOIO validation islands: 0(Nesøy), 1(Myken), 2(Træna), 3(Selvær), 4(Gjerøy), 6(Indre Kvarøy), 7(Onøy og Lurøy), 8(Lovund), 9(Sleneset), 10(Aldra), 11(Leka), 12(Vega), 13(Vikna), 14(Lauvøya)
2026-06-01 13:13:03 | INFO | OUTER 6: using top 10 related inner validation islands for tuning: 4(Gjerøy, avgGRM=0.0047), 0(Nesøy, avgGRM=0.0045), 6(Indre Kvarøy, avgGRM=0.0039), 7(Onøy og Lurøy, avgGRM=0.0026), 1(Myken, avgGRM=0.0014), 3(Selvær, avgGRM=-0.0000), 2(Træna, avgGRM=-0.0005), 8(Lovund, avgGRM=-0.0006), 9(Sleneset, avgGRM=-0.0009), 10(Aldra, avgGRM=-0.0021)
[I 2026-06-01 13:13:03,179] A new study created in memory with name: mlp_importance_inner_outer5
2026-06-01 13:13:03 | INFO | Trial 0 | outer=6 | hidden=[256, 64] epochs=252 lr=8.243e-05 wd=1.277e-07 n_pcs=1500 weight={'name': 'uniform'}
[I 2026-06-01 13:13:07,594] Trial 0 finished with value: 0.17027104376675978 and parameters: {'hidden_dims': '[256, 64]', 'dropout': 0.19097065492325918, 'batch_norm': False, 'lr': 8.242985198911028e-05, 'weight_decay': 1.277246473139888e-07, 'epochs': 252, 'loss': 'mae', 'optimizer': 'adamw', 'use_snp_selection': False, 'n_pcs': 1500}. Best is trial 0 with value: 0.17027104376675978.
2026-06-01 13:13:07 | INFO | Trial 1 | outer=6 | hidden=[1024, 256] epochs=225 lr=1.391e-04 wd=1.941e-07 n_pcs=500 weight={'name': 'uniform'}
[I 2026-06-01 13:13:13,426] Trial 1 finished with value: 0.1764861301503817 and parameters: {'hidden_dims': '[1024, 256]', 'dropout': 0.2849434595702811, 'batch_norm': False, 'lr': 0.00013909108684683413, 'weight_decay': 1.9407167964924495e-07, 'epochs': 225, 'loss': 'mse', 'optimizer': 'adamw', 'use_snp_selection': False, 'n_pcs': 500}. Best is trial 1 with value: 0.1764861301503817.
2026-06-01 13:13:13 | INFO | Trial 2 | outer=6 | hidden=[256, 64] epochs=139 lr=3.957e-05 wd=3.750e-05 n_pcs=2500 weight={'name': 'uniform'}
[I 2026-06-01 13:13:16,928] Trial 2 finished with value: 0.1561892179563539 and parameters: {'hidden_dims': '[256, 64]', 'dropout': 0.11392712587675291, 'batch_norm': False, 'lr': 3.9573351157697276e-05, 'weight_decay': 3.7502337000845044e-05, 'epochs': 139, 'loss': 'mae', 'optimizer': 'adam', 'use_snp_selection': False, 'n_pcs': 2500}. Best is trial 1 with value: 0.1764861301503817.
2026-06-01 13:13:16 | INFO | Trial 3 | outer=6 | hidden=[128, 64] epochs=164 lr=1.538e-05 wd=3.248e-06 n_pcs=3000 weight={'name': 'uniform'}
[I 2026-06-01 13:13:20,541] Trial 3 finished with value: 0.1159277609074519 and parameters: {'hidden_dims': '[128, 64]', 'dropout': 0.1479874991503876, 'batch_norm': False, 'lr': 1.5380732370316375e-05, 'weight_decay': 3.2478890969962294e-06, 'epochs': 164, 'loss': 'mse', 'optimizer': 'adam', 'use_snp_selection': False, 'n_pcs': 3000}. Best is trial 1 with value: 0.1764861301503817.
2026-06-01 13:13:20 | INFO | Trial 4 | outer=6 | hidden=[256, 128] epochs=210 lr=7.298e-05 wd=7.875e-06 n_pcs=3000 weight={'name': 'uniform'}
[I 2026-06-01 13:13:25,598] Trial 4 finished with value: 0.1355730923681702 and parameters: {'hidden_dims': '[256, 128]', 'dropout': 0.09917626474860408, 'batch_norm': False, 'lr': 7.298380589156323e-05, 'weight_decay': 7.875094299510188e-06, 'epochs': 210, 'loss': 'mae', 'optimizer': 'adam', 'use_snp_selection': False, 'n_pcs': 3000}. Best is trial 1 with value: 0.1764861301503817.
2026-06-01 13:13:25 | INFO | Trial 5 | outer=6 | hidden=[512, 128] epochs=284 lr=5.467e-05 wd=5.496e-06 n_pcs=4000 weight={'name': 'uniform'}
[I 2026-06-01 13:13:37,805] Trial 5 finished with value: 0.16909772084294852 and parameters: {'hidden_dims': '[512, 128]', 'dropout': 0.3143696126156032, 'batch_norm': False, 'lr': 5.46667545989349e-05, 'weight_decay': 5.496446859789657e-06, 'epochs': 284, 'loss': 'mse', 'optimizer': 'adamw', 'use_snp_selection': False, 'n_pcs': 4000}. Best is trial 1 with value: 0.1764861301503817.
2026-06-01 13:13:37 | INFO | Trial 6 | outer=6 | hidden=[512, 64] epochs=90 lr=3.103e-05 wd=6.607e-08 n_pcs=5000 weight={'name': 'uniform'}
[I 2026-06-01 13:13:43,598] Trial 6 finished with value: 0.13645007502307976 and parameters: {'hidden_dims': '[512, 64]', 'dropout': 0.4941304802762902, 'batch_norm': False, 'lr': 3.103455600245868e-05, 'weight_decay': 6.606788619980135e-08, 'epochs': 90, 'loss': 'mse', 'optimizer': 'adamw', 'use_snp_selection': False, 'n_pcs': 5000}. Best is trial 1 with value: 0.1764861301503817.
2026-06-01 13:13:43 | INFO | Trial 7 | outer=6 | hidden=[128, 64] epochs=272 lr=1.348e-05 wd=1.075e-07 n_pcs=4000 weight={'name': 'uniform'}
[I 2026-06-01 13:13:46,625] Trial 7 pruned. 
2026-06-01 13:13:46 | INFO | Trial 8 | outer=6 | hidden=[128, 64] epochs=205 lr=1.815e-05 wd=5.764e-06 n_pcs=3000 weight={'name': 'uniform'}
[I 2026-06-01 13:13:50,726] Trial 8 finished with value: 0.1571841834420061 and parameters: {'hidden_dims': '[128, 64]', 'dropout': 0.28461331600914713, 'batch_norm': False, 'lr': 1.8153829433867716e-05, 'weight_decay': 5.764148698871099e-06, 'epochs': 205, 'loss': 'mse', 'optimizer': 'adam', 'use_snp_selection': False, 'n_pcs': 3000}. Best is trial 1 with value: 0.1764861301503817.
2026-06-01 13:13:50 | INFO | Trial 9 | outer=6 | hidden=[128, 64] epochs=296 lr=2.338e-05 wd=1.066e-07 n_pcs=2500 weight={'name': 'uniform'}
[I 2026-06-01 13:13:55,861] Trial 9 finished with value: 0.15341134045548352 and parameters: {'hidden_dims': '[128, 64]', 'dropout': 0.17607378181405245, 'batch_norm': False, 'lr': 2.3379083621874488e-05, 'weight_decay': 1.0663581123617794e-07, 'epochs': 296, 'loss': 'mae', 'optimizer': 'adam', 'use_snp_selection': False, 'n_pcs': 2500}. Best is trial 1 with value: 0.1764861301503817.
2026-06-01 13:13:55 | INFO | Trial 10 | outer=6 | hidden=[1024, 256] epochs=110 lr=2.690e-04 wd=9.453e-04 n_pcs=500 weight={'name': 'uniform'}
[I 2026-06-01 13:13:59,477] Trial 10 finished with value: 0.20408155490563423 and parameters: {'hidden_dims': '[1024, 256]', 'dropout': 0.5927822108596128, 'batch_norm': False, 'lr': 0.0002689980240661103, 'weight_decay': 0.0009452683165453212, 'epochs': 110, 'loss': 'mse', 'optimizer': 'adamw', 'use_snp_selection': False, 'n_pcs': 500}. Best is trial 10 with value: 0.20408155490563423.
2026-06-01 13:13:59 | INFO | Trial 11 | outer=6 | hidden=[1024, 256] epochs=55 lr=3.282e-04 wd=6.233e-04 n_pcs=500 weight={'name': 'uniform'}
[I 2026-06-01 13:14:02,031] Trial 11 finished with value: 0.18123025014817584 and parameters: {'hidden_dims': '[1024, 256]', 'dropout': 0.35854788955918454, 'batch_norm': False, 'lr': 0.00032816119983366604, 'weight_decay': 0.0006233435290733272, 'epochs': 55, 'loss': 'mse', 'optimizer': 'adamw', 'use_snp_selection': False, 'n_pcs': 500}. Best is trial 10 with value: 0.20408155490563423.
2026-06-01 13:14:02 | INFO | Trial 12 | outer=6 | hidden=[1024, 256] epochs=60 lr=4.985e-04 wd=8.865e-04 n_pcs=500 weight={'name': 'uniform'}
[I 2026-06-01 13:14:04,676] Trial 12 finished with value: 0.18518185088419678 and parameters: {'hidden_dims': '[1024, 256]', 'dropout': 0.5805033330349405, 'batch_norm': False, 'lr': 0.0004985224055917456, 'weight_decay': 0.0008865268327078721, 'epochs': 60, 'loss': 'mse', 'optimizer': 'adamw', 'use_snp_selection': False, 'n_pcs': 500}. Best is trial 10 with value: 0.20408155490563423.
2026-06-01 13:14:04 | INFO | Trial 13 | outer=6 | hidden=[1024, 256] epochs=110 lr=4.093e-04 wd=9.072e-04 n_pcs=1500 weight={'name': 'uniform'}
[I 2026-06-01 13:14:10,109] Trial 13 finished with value: 0.18653477264801133 and parameters: {'hidden_dims': '[1024, 256]', 'dropout': 0.5965846649278046, 'batch_norm': False, 'lr': 0.00040932826429398376, 'weight_decay': 0.000907204068706384, 'epochs': 110, 'loss': 'mse', 'optimizer': 'adamw', 'use_snp_selection': False, 'n_pcs': 1500}. Best is trial 10 with value: 0.20408155490563423.
2026-06-01 13:14:10 | INFO | Trial 14 | outer=6 | hidden=[512, 256] epochs=122 lr=1.931e-04 wd=1.266e-04 n_pcs=1500 weight={'name': 'uniform'}
[I 2026-06-01 13:14:14,033] Trial 14 finished with value: 0.18835636849062937 and parameters: {'hidden_dims': '[512, 256]', 'dropout': 0.5584519445696304, 'batch_norm': False, 'lr': 0.00019309266231643026, 'weight_decay': 0.00012663736825721254, 'epochs': 122, 'loss': 'mse', 'optimizer': 'adamw', 'use_snp_selection': False, 'n_pcs': 1500}. Best is trial 10 with value: 0.20408155490563423.
2026-06-01 13:14:14 | INFO | Trial 15 | outer=6 | hidden=[512, 256] epochs=129 lr=1.716e-04 wd=9.571e-05 n_pcs=1500 weight={'name': 'uniform'}
[I 2026-06-01 13:14:18,094] Trial 15 finished with value: 0.1826476793084125 and parameters: {'hidden_dims': '[512, 256]', 'dropout': 0.49449841460928273, 'batch_norm': False, 'lr': 0.0001716454934544582, 'weight_decay': 9.571452484523231e-05, 'epochs': 129, 'loss': 'mse', 'optimizer': 'adamw', 'use_snp_selection': False, 'n_pcs': 1500}. Best is trial 10 with value: 0.20408155490563423.
2026-06-01 13:14:18 | INFO | Trial 16 | outer=6 | hidden=[512, 256] epochs=168 lr=2.348e-04 wd=1.119e-04 n_pcs=1000 weight={'name': 'uniform'}
[I 2026-06-01 13:14:22,245] Trial 16 finished with value: 0.19253353977545423 and parameters: {'hidden_dims': '[512, 256]', 'dropout': 0.5197870242698653, 'batch_norm': False, 'lr': 0.00023484280141310024, 'weight_decay': 0.00011186459842967428, 'epochs': 168, 'loss': 'mse', 'optimizer': 'adamw', 'use_snp_selection': False, 'n_pcs': 1000}. Best is trial 10 with value: 0.20408155490563423.
2026-06-01 13:14:22 | INFO | Trial 17 | outer=6 | hidden=[512, 256] epochs=168 lr=3.007e-04 wd=1.184e-08 n_pcs=1000 weight={'name': 'uniform'}
[I 2026-06-01 13:14:26,393] Trial 17 finished with value: 0.1927772761473336 and parameters: {'hidden_dims': '[512, 256]', 'dropout': 0.43802071893191974, 'batch_norm': False, 'lr': 0.00030073331008248006, 'weight_decay': 1.1840058441529551e-08, 'epochs': 168, 'loss': 'mse', 'optimizer': 'adamw', 'use_snp_selection': False, 'n_pcs': 1000}. Best is trial 10 with value: 0.20408155490563423.
2026-06-01 13:14:26 | INFO | Trial 18 | outer=6 | hidden=[512, 64] epochs=182 lr=1.085e-04 wd=6.452e-07 n_pcs=2000 weight={'name': 'uniform'}
[I 2026-06-01 13:14:31,558] Trial 18 finished with value: 0.16947189120369474 and parameters: {'hidden_dims': '[512, 64]', 'dropout': 0.022941868683026556, 'batch_norm': False, 'lr': 0.0001085110751771146, 'weight_decay': 6.45226711189004e-07, 'epochs': 182, 'loss': 'mae', 'optimizer': 'adamw', 'use_snp_selection': False, 'n_pcs': 2000}. Best is trial 10 with value: 0.20408155490563423.
2026-06-01 13:14:31 | INFO | Trial 19 | outer=6 | hidden=[256, 128] epochs=98 lr=3.106e-04 wd=1.453e-08 n_pcs=1000 weight={'name': 'uniform'}
[I 2026-06-01 13:14:34,226] Trial 19 finished with value: 0.1965346680036709 and parameters: {'hidden_dims': '[256, 128]', 'dropout': 0.4278465437451042, 'batch_norm': False, 'lr': 0.0003106225601856698, 'weight_decay': 1.4526511192558723e-08, 'epochs': 98, 'loss': 'mse', 'optimizer': 'adamw', 'use_snp_selection': False, 'n_pcs': 1000}. Best is trial 10 with value: 0.20408155490563423.
2026-06-01 13:14:34 | INFO | Trial 20 | outer=6 | hidden=[256, 128] epochs=90 lr=2.898e-04 wd=1.167e-08 n_pcs=1000 weight={'name': 'uniform'}
[I 2026-06-01 13:14:36,755] Trial 20 finished with value: 0.20375246411316555 and parameters: {'hidden_dims': '[256, 128]', 'dropout': 0.40724538615490785, 'batch_norm': False, 'lr': 0.00028979610312983084, 'weight_decay': 1.1669655169591443e-08, 'epochs': 90, 'loss': 'mse', 'optimizer': 'adamw', 'use_snp_selection': False, 'n_pcs': 1000}. Best is trial 10 with value: 0.20408155490563423.
2026-06-01 13:14:36 | INFO | Trial 21 | outer=6 | hidden=[256, 128] epochs=94 lr=2.556e-04 wd=1.048e-08 n_pcs=1000 weight={'name': 'uniform'}
[I 2026-06-01 13:14:39,333] Trial 21 finished with value: 0.19387766958101185 and parameters: {'hidden_dims': '[256, 128]', 'dropout': 0.3886092209810854, 'batch_norm': False, 'lr': 0.00025555191970629866, 'weight_decay': 1.0477912424661996e-08, 'epochs': 94, 'loss': 'mse', 'optimizer': 'adamw', 'use_snp_selection': False, 'n_pcs': 1000}. Best is trial 10 with value: 0.20408155490563423.
2026-06-01 13:14:39 | INFO | Trial 22 | outer=6 | hidden=[256, 128] epochs=81 lr=1.313e-04 wd=2.882e-08 n_pcs=500 weight={'name': 'uniform'}
[I 2026-06-01 13:14:41,018] Trial 22 pruned. 
2026-06-01 13:14:41 | INFO | Trial 23 | outer=6 | hidden=[256, 128] epochs=72 lr=3.866e-04 wd=5.979e-07 n_pcs=2000 weight={'name': 'uniform'}
[I 2026-06-01 13:14:43,519] Trial 23 finished with value: 0.1800069626982482 and parameters: {'hidden_dims': '[256, 128]', 'dropout': 0.23704121326941746, 'batch_norm': False, 'lr': 0.0003866322403134903, 'weight_decay': 5.978634202882156e-07, 'epochs': 72, 'loss': 'mse', 'optimizer': 'adamw', 'use_snp_selection': False, 'n_pcs': 2000}. Best is trial 10 with value: 0.20408155490563423.
2026-06-01 13:14:43 | INFO | Trial 24 | outer=6 | hidden=[256, 128] epochs=143 lr=2.135e-04 wd=7.533e-07 n_pcs=1000 weight={'name': 'uniform'}
[I 2026-06-01 13:14:46,648] Trial 24 finished with value: 0.17079822616820825 and parameters: {'hidden_dims': '[256, 128]', 'dropout': 0.3525218234824151, 'batch_norm': False, 'lr': 0.0002134808498278975, 'weight_decay': 7.532935744602946e-07, 'epochs': 143, 'loss': 'mse', 'optimizer': 'adamw', 'use_snp_selection': False, 'n_pcs': 1000}. Best is trial 10 with value: 0.20408155490563423.
2026-06-01 13:14:46 | INFO | Trial 25 | outer=6 | hidden=[256, 128] epochs=105 lr=3.089e-04 wd=3.041e-08 n_pcs=2000 weight={'name': 'uniform'}
[I 2026-06-01 13:14:49,530] Trial 25 finished with value: 0.18596032148141423 and parameters: {'hidden_dims': '[256, 128]', 'dropout': 0.5365557539118078, 'batch_norm': False, 'lr': 0.0003089096850521603, 'weight_decay': 3.041458295364741e-08, 'epochs': 105, 'loss': 'mse', 'optimizer': 'adamw', 'use_snp_selection': False, 'n_pcs': 2000}. Best is trial 10 with value: 0.20408155490563423.
2026-06-01 13:14:49 | INFO | Trial 26 | outer=6 | hidden=[512, 128] epochs=105 lr=4.913e-04 wd=2.013e-05 n_pcs=1000 weight={'name': 'uniform'}
[I 2026-06-01 13:14:52,484] Trial 26 finished with value: 0.1871829677848318 and parameters: {'hidden_dims': '[512, 128]', 'dropout': 0.475961979066168, 'batch_norm': False, 'lr': 0.0004912637115713309, 'weight_decay': 2.0128084276502834e-05, 'epochs': 105, 'loss': 'mse', 'optimizer': 'adamw', 'use_snp_selection': False, 'n_pcs': 1000}. Best is trial 10 with value: 0.20408155490563423.
2026-06-01 13:14:52 | INFO | Trial 27 | outer=6 | hidden=[256, 128] epochs=77 lr=9.917e-05 wd=2.860e-08 n_pcs=500 weight={'name': 'uniform'}
[I 2026-06-01 13:14:54,817] Trial 27 finished with value: 0.122968700321563 and parameters: {'hidden_dims': '[256, 128]', 'dropout': 0.39113305193528586, 'batch_norm': False, 'lr': 9.916819485434304e-05, 'weight_decay': 2.860489582352366e-08, 'epochs': 77, 'loss': 'mae', 'optimizer': 'adam', 'use_snp_selection': False, 'n_pcs': 500}. Best is trial 10 with value: 0.20408155490563423.
2026-06-01 13:14:54 | INFO | Trial 28 | outer=6 | hidden=[1024, 256] epochs=146 lr=1.524e-04 wd=1.413e-06 n_pcs=1500 weight={'name': 'uniform'}
[I 2026-06-01 13:15:01,487] Trial 28 finished with value: 0.1707589740851369 and parameters: {'hidden_dims': '[1024, 256]', 'dropout': 0.46248174753897053, 'batch_norm': False, 'lr': 0.00015244232028205885, 'weight_decay': 1.4128219928777428e-06, 'epochs': 146, 'loss': 'mse', 'optimizer': 'adamw', 'use_snp_selection': False, 'n_pcs': 1500}. Best is trial 10 with value: 0.20408155490563423.
2026-06-01 13:15:01 | INFO | Trial 29 | outer=6 | hidden=[256, 64] epochs=64 lr=5.539e-05 wd=2.452e-07 n_pcs=2000 weight={'name': 'uniform'}
[I 2026-06-01 13:15:02,907] Trial 29 pruned. 
2026-06-01 13:15:02 | INFO | Trial 30 | outer=6 | hidden=[256, 128] epochs=114 lr=2.631e-04 wd=5.263e-08 n_pcs=1000 weight={'name': 'uniform'}
[I 2026-06-01 13:15:05,718] Trial 30 finished with value: 0.18830258920051152 and parameters: {'hidden_dims': '[256, 128]', 'dropout': 0.4110679807338079, 'batch_norm': False, 'lr': 0.00026308869624343034, 'weight_decay': 5.263056222724349e-08, 'epochs': 114, 'loss': 'mse', 'optimizer': 'adamw', 'use_snp_selection': False, 'n_pcs': 1000}. Best is trial 10 with value: 0.20408155490563423.
2026-06-01 13:15:05 | INFO | Trial 31 | outer=6 | hidden=[256, 128] epochs=93 lr=2.123e-04 wd=1.064e-08 n_pcs=1000 weight={'name': 'uniform'}
[I 2026-06-01 13:15:08,283] Trial 31 finished with value: 0.19787915288071772 and parameters: {'hidden_dims': '[256, 128]', 'dropout': 0.3749799338027736, 'batch_norm': False, 'lr': 0.0002123305980391859, 'weight_decay': 1.0642670001618189e-08, 'epochs': 93, 'loss': 'mse', 'optimizer': 'adamw', 'use_snp_selection': False, 'n_pcs': 1000}. Best is trial 10 with value: 0.20408155490563423.
2026-06-01 13:15:08 | INFO | Trial 32 | outer=6 | hidden=[256, 128] epochs=95 lr=3.635e-04 wd=1.446e-08 n_pcs=500 weight={'name': 'uniform'}
[I 2026-06-01 13:15:10,804] Trial 32 finished with value: 0.1751048974952199 and parameters: {'hidden_dims': '[256, 128]', 'dropout': 0.3353726942441075, 'batch_norm': False, 'lr': 0.00036349607581748217, 'weight_decay': 1.4457199952887352e-08, 'epochs': 95, 'loss': 'mse', 'optimizer': 'adamw', 'use_snp_selection': False, 'n_pcs': 500}. Best is trial 10 with value: 0.20408155490563423.
2026-06-01 13:15:10 | INFO | Trial 33 | outer=6 | hidden=[256, 128] epochs=127 lr=1.933e-04 wd=2.004e-08 n_pcs=1000 weight={'name': 'uniform'}
[I 2026-06-01 13:15:12,875] Trial 33 pruned. 
2026-06-01 13:15:12 | INFO | Trial 34 | outer=6 | hidden=[256, 64] epochs=149 lr=1.256e-04 wd=2.249e-07 n_pcs=1500 weight={'name': 'uniform'}
[I 2026-06-01 13:15:16,134] Trial 34 finished with value: 0.16845326988761766 and parameters: {'hidden_dims': '[256, 64]', 'dropout': 0.3624818974491646, 'batch_norm': False, 'lr': 0.00012564949558250066, 'weight_decay': 2.2490694305460104e-07, 'epochs': 149, 'loss': 'mse', 'optimizer': 'adamw', 'use_snp_selection': False, 'n_pcs': 1500}. Best is trial 10 with value: 0.20408155490563423.
2026-06-01 13:15:16 | INFO | Trial 35 | outer=6 | hidden=[1024, 256] epochs=50 lr=2.567e-04 wd=6.637e-08 n_pcs=500 weight={'name': 'uniform'}
[I 2026-06-01 13:15:18,589] Trial 35 finished with value: 0.19090721463266536 and parameters: {'hidden_dims': '[1024, 256]', 'dropout': 0.5280721818594347, 'batch_norm': False, 'lr': 0.0002567216335927263, 'weight_decay': 6.636510743470325e-08, 'epochs': 50, 'loss': 'mse', 'optimizer': 'adam', 'use_snp_selection': False, 'n_pcs': 500}. Best is trial 10 with value: 0.20408155490563423.
2026-06-01 13:15:18 | INFO | Trial 36 | outer=6 | hidden=[256, 128] epochs=86 lr=8.925e-05 wd=3.756e-04 n_pcs=2500 weight={'name': 'uniform'}
