[I 2026-06-01 13:37:59,448] Trial 56 finished with value: 0.18769659898767635 and parameters: {'hidden_dims': '[512, 256]', 'dropout': 0.5820400161846933, 'batch_norm': False, 'lr': 0.00017716880518414596, 'weight_decay': 7.44812867895123e-08, 'epochs': 149, 'loss': 'mae', 'optimizer': 'adam', 'use_snp_selection': False, 'n_pcs': 3500}. Best is trial 54 with value: 0.20772389733331345.
2026-06-01 13:37:59 | INFO | Trial 57 | outer=7 | hidden=[512, 256] epochs=120 lr=2.061e-04 wd=2.699e-07 n_pcs=4500 weight={'name': 'uniform'}
[I 2026-06-01 13:38:07,230] Trial 57 finished with value: 0.20197149448059473 and parameters: {'hidden_dims': '[512, 256]', 'dropout': 0.42278381044728, 'batch_norm': False, 'lr': 0.0002060516861472554, 'weight_decay': 2.698750436455626e-07, 'epochs': 120, 'loss': 'mae', 'optimizer': 'adam', 'use_snp_selection': False, 'n_pcs': 4500}. Best is trial 54 with value: 0.20772389733331345.
2026-06-01 13:38:07 | INFO | Trial 58 | outer=7 | hidden=[512, 256] epochs=123 lr=3.426e-04 wd=3.675e-07 n_pcs=4500 weight={'name': 'uniform'}
[I 2026-06-01 13:38:15,138] Trial 58 finished with value: 0.1897713571516734 and parameters: {'hidden_dims': '[512, 256]', 'dropout': 0.4495030119281494, 'batch_norm': False, 'lr': 0.00034256494723541674, 'weight_decay': 3.6747152824005446e-07, 'epochs': 123, 'loss': 'mae', 'optimizer': 'adamw', 'use_snp_selection': False, 'n_pcs': 4500}. Best is trial 54 with value: 0.20772389733331345.
2026-06-01 13:38:15 | INFO | Trial 59 | outer=7 | hidden=[512, 256] epochs=107 lr=2.119e-04 wd=2.028e-07 n_pcs=4000 weight={'name': 'uniform'}
[I 2026-06-01 13:38:21,735] Trial 59 finished with value: 0.18584922801959425 and parameters: {'hidden_dims': '[512, 256]', 'dropout': 0.5468194006015571, 'batch_norm': False, 'lr': 0.00021191978585727184, 'weight_decay': 2.027960570413387e-07, 'epochs': 107, 'loss': 'mse', 'optimizer': 'adam', 'use_snp_selection': False, 'n_pcs': 4000}. Best is trial 54 with value: 0.20772389733331345.
2026-06-01 13:38:21 | INFO | Trial 60 | outer=7 | hidden=[512, 256] epochs=156 lr=2.580e-04 wd=9.091e-07 n_pcs=5000 weight={'name': 'uniform'}
[I 2026-06-01 13:38:31,669] Trial 60 finished with value: 0.19469589139298124 and parameters: {'hidden_dims': '[512, 256]', 'dropout': 0.4440305824838855, 'batch_norm': False, 'lr': 0.00025799030407845853, 'weight_decay': 9.091375199710975e-07, 'epochs': 156, 'loss': 'mae', 'optimizer': 'adam', 'use_snp_selection': False, 'n_pcs': 5000}. Best is trial 54 with value: 0.20772389733331345.
2026-06-01 13:38:31 | INFO | Trial 61 | outer=7 | hidden=[512, 256] epochs=106 lr=1.462e-04 wd=4.163e-07 n_pcs=4500 weight={'name': 'uniform'}
[I 2026-06-01 13:38:38,805] Trial 61 finished with value: 0.21227609177202855 and parameters: {'hidden_dims': '[512, 256]', 'dropout': 0.4053300936565041, 'batch_norm': False, 'lr': 0.00014621579348642286, 'weight_decay': 4.163377254491822e-07, 'epochs': 106, 'loss': 'mae', 'optimizer': 'adam', 'use_snp_selection': False, 'n_pcs': 4500}. Best is trial 61 with value: 0.21227609177202855.
2026-06-01 13:38:38 | INFO | Trial 62 | outer=7 | hidden=[512, 256] epochs=81 lr=1.464e-04 wd=4.468e-07 n_pcs=5000 weight={'name': 'uniform'}
[I 2026-06-01 13:38:45,102] Trial 62 finished with value: 0.17234661335842988 and parameters: {'hidden_dims': '[512, 256]', 'dropout': 0.4051028178489797, 'batch_norm': False, 'lr': 0.00014643671077242936, 'weight_decay': 4.4682876788019816e-07, 'epochs': 81, 'loss': 'mae', 'optimizer': 'adam', 'use_snp_selection': False, 'n_pcs': 5000}. Best is trial 61 with value: 0.21227609177202855.
2026-06-01 13:38:45 | INFO | Trial 63 | outer=7 | hidden=[512, 256] epochs=120 lr=2.123e-04 wd=5.402e-08 n_pcs=4000 weight={'name': 'uniform'}
[I 2026-06-01 13:38:52,246] Trial 63 finished with value: 0.20857929007760015 and parameters: {'hidden_dims': '[512, 256]', 'dropout': 0.4695647942785042, 'batch_norm': False, 'lr': 0.00021231370899995326, 'weight_decay': 5.402111033840619e-08, 'epochs': 120, 'loss': 'mae', 'optimizer': 'adam', 'use_snp_selection': False, 'n_pcs': 4000}. Best is trial 61 with value: 0.21227609177202855.
2026-06-01 13:38:52 | INFO | Trial 64 | outer=7 | hidden=[512, 256] epochs=118 lr=2.108e-04 wd=3.372e-08 n_pcs=4000 weight={'name': 'uniform'}
[I 2026-06-01 13:38:59,301] Trial 64 finished with value: 0.18731633918301938 and parameters: {'hidden_dims': '[512, 256]', 'dropout': 0.4808158702077416, 'batch_norm': False, 'lr': 0.00021077037107727984, 'weight_decay': 3.372446400402375e-08, 'epochs': 118, 'loss': 'mae', 'optimizer': 'adam', 'use_snp_selection': False, 'n_pcs': 4000}. Best is trial 61 with value: 0.21227609177202855.
2026-06-01 13:38:59 | INFO | Trial 65 | outer=7 | hidden=[512, 256] epochs=81 lr=2.876e-04 wd=1.184e-07 n_pcs=4500 weight={'name': 'uniform'}
[I 2026-06-01 13:39:05,292] Trial 65 finished with value: 0.18764572797887052 and parameters: {'hidden_dims': '[512, 256]', 'dropout': 0.39569846343173964, 'batch_norm': False, 'lr': 0.00028763945135213087, 'weight_decay': 1.1842751591875194e-07, 'epochs': 81, 'loss': 'mae', 'optimizer': 'adam', 'use_snp_selection': False, 'n_pcs': 4500}. Best is trial 61 with value: 0.21227609177202855.
2026-06-01 13:39:05 | INFO | Trial 66 | outer=7 | hidden=[512, 256] epochs=131 lr=2.305e-04 wd=4.557e-08 n_pcs=4000 weight={'name': 'uniform'}
[I 2026-06-01 13:39:12,887] Trial 66 finished with value: 0.1860758810644457 and parameters: {'hidden_dims': '[512, 256]', 'dropout': 0.5101228048080134, 'batch_norm': False, 'lr': 0.00023050264767111376, 'weight_decay': 4.5569362616955623e-08, 'epochs': 131, 'loss': 'mae', 'optimizer': 'adam', 'use_snp_selection': False, 'n_pcs': 4000}. Best is trial 61 with value: 0.21227609177202855.
2026-06-01 13:39:12 | INFO | Trial 67 | outer=7 | hidden=[256, 128] epochs=104 lr=3.639e-04 wd=1.507e-08 n_pcs=5000 weight={'name': 'uniform'}
[I 2026-06-01 13:39:17,767] Trial 67 finished with value: 0.21274226476569685 and parameters: {'hidden_dims': '[256, 128]', 'dropout': 0.3602608296801891, 'batch_norm': False, 'lr': 0.0003638810917483642, 'weight_decay': 1.5074273624704296e-08, 'epochs': 104, 'loss': 'mae', 'optimizer': 'adam', 'use_snp_selection': False, 'n_pcs': 5000}. Best is trial 67 with value: 0.21274226476569685.
2026-06-01 13:39:17 | INFO | Trial 68 | outer=7 | hidden=[256, 128] epochs=101 lr=3.968e-04 wd=1.169e-08 n_pcs=4500 weight={'name': 'uniform'}
[I 2026-06-01 13:39:22,358] Trial 68 finished with value: 0.18294042599525 and parameters: {'hidden_dims': '[256, 128]', 'dropout': 0.41526779470599423, 'batch_norm': False, 'lr': 0.0003967900396378449, 'weight_decay': 1.1691993469193975e-08, 'epochs': 101, 'loss': 'mae', 'optimizer': 'adamw', 'use_snp_selection': False, 'n_pcs': 4500}. Best is trial 67 with value: 0.21274226476569685.
2026-06-01 13:39:22 | INFO | Trial 69 | outer=7 | hidden=[256, 128] epochs=165 lr=3.479e-04 wd=1.766e-08 n_pcs=3000 weight={'name': 'uniform'}
[I 2026-06-01 13:39:27,206] Trial 69 finished with value: 0.18164486590321827 and parameters: {'hidden_dims': '[256, 128]', 'dropout': 0.34534051519826214, 'batch_norm': False, 'lr': 0.0003478913921088099, 'weight_decay': 1.766111599293712e-08, 'epochs': 165, 'loss': 'mae', 'optimizer': 'adam', 'use_snp_selection': False, 'n_pcs': 3000}. Best is trial 67 with value: 0.21274226476569685.
2026-06-01 13:39:27 | INFO | Trial 70 | outer=7 | hidden=[256, 128] epochs=94 lr=4.946e-04 wd=1.835e-06 n_pcs=4500 weight={'name': 'uniform'}
[I 2026-06-01 13:39:31,637] Trial 70 finished with value: 0.1799918322792152 and parameters: {'hidden_dims': '[256, 128]', 'dropout': 0.4671046411169527, 'batch_norm': False, 'lr': 0.0004945992068480699, 'weight_decay': 1.8353262772517904e-06, 'epochs': 94, 'loss': 'mae', 'optimizer': 'adam', 'use_snp_selection': False, 'n_pcs': 4500}. Best is trial 67 with value: 0.21274226476569685.
2026-06-01 13:39:31 | INFO | Trial 71 | outer=7 | hidden=[512, 256] epochs=122 lr=1.171e-04 wd=6.762e-08 n_pcs=5000 weight={'name': 'uniform'}
[I 2026-06-01 13:39:39,909] Trial 71 finished with value: 0.18420500464406436 and parameters: {'hidden_dims': '[512, 256]', 'dropout': 0.3697170621664675, 'batch_norm': False, 'lr': 0.00011711367251910574, 'weight_decay': 6.761693635812939e-08, 'epochs': 122, 'loss': 'mae', 'optimizer': 'adam', 'use_snp_selection': False, 'n_pcs': 5000}. Best is trial 67 with value: 0.21274226476569685.
2026-06-01 13:39:39 | INFO | Trial 72 | outer=7 | hidden=[256, 128] epochs=109 lr=1.266e-04 wd=7.956e-07 n_pcs=5000 weight={'name': 'uniform'}
[I 2026-06-01 13:39:44,926] Trial 72 finished with value: 0.1894563643575537 and parameters: {'hidden_dims': '[256, 128]', 'dropout': 0.3845443375892387, 'batch_norm': False, 'lr': 0.00012664165707977046, 'weight_decay': 7.955572758364761e-07, 'epochs': 109, 'loss': 'mae', 'optimizer': 'adam', 'use_snp_selection': False, 'n_pcs': 5000}. Best is trial 67 with value: 0.21274226476569685.
2026-06-01 13:39:44 | INFO | Trial 73 | outer=7 | hidden=[512, 256] epochs=113 lr=1.972e-04 wd=2.493e-07 n_pcs=5000 weight={'name': 'uniform'}
[I 2026-06-01 13:39:52,762] Trial 73 finished with value: 0.1830527626591824 and parameters: {'hidden_dims': '[512, 256]', 'dropout': 0.3008298459174802, 'batch_norm': False, 'lr': 0.00019721833377781277, 'weight_decay': 2.4931406818653305e-07, 'epochs': 113, 'loss': 'mae', 'optimizer': 'adam', 'use_snp_selection': False, 'n_pcs': 5000}. Best is trial 67 with value: 0.21274226476569685.
2026-06-01 13:39:52 | INFO | Trial 74 | outer=7 | hidden=[512, 256] epochs=153 lr=2.402e-04 wd=1.878e-08 n_pcs=4500 weight={'name': 'uniform'}
[I 2026-06-01 13:40:02,047] Trial 74 finished with value: 0.19877090610482448 and parameters: {'hidden_dims': '[512, 256]', 'dropout': 0.4259187662211425, 'batch_norm': False, 'lr': 0.00024021948493804958, 'weight_decay': 1.8775034090235335e-08, 'epochs': 153, 'loss': 'mae', 'optimizer': 'adam', 'use_snp_selection': False, 'n_pcs': 4500}. Best is trial 67 with value: 0.21274226476569685.
2026-06-01 13:40:02 | INFO | Trial 75 | outer=7 | hidden=[256, 128] epochs=128 lr=2.951e-04 wd=9.054e-08 n_pcs=5000 weight={'name': 'uniform'}
[I 2026-06-01 13:40:07,528] Trial 75 finished with value: 0.18453181894390294 and parameters: {'hidden_dims': '[256, 128]', 'dropout': 0.3479042634232608, 'batch_norm': False, 'lr': 0.00029507561358721706, 'weight_decay': 9.053945946590044e-08, 'epochs': 128, 'loss': 'mae', 'optimizer': 'adam', 'use_snp_selection': False, 'n_pcs': 5000}. Best is trial 67 with value: 0.21274226476569685.
2026-06-01 13:40:07 | INFO | Trial 76 | outer=7 | hidden=[512, 256] epochs=70 lr=1.613e-04 wd=1.570e-07 n_pcs=4000 weight={'name': 'uniform'}
[I 2026-06-01 13:40:12,603] Trial 76 finished with value: 0.200040514728193 and parameters: {'hidden_dims': '[512, 256]', 'dropout': 0.45780395558271303, 'batch_norm': False, 'lr': 0.00016132891684360781, 'weight_decay': 1.5696840296175208e-07, 'epochs': 70, 'loss': 'mae', 'optimizer': 'adam', 'use_snp_selection': False, 'n_pcs': 4000}. Best is trial 67 with value: 0.21274226476569685.
2026-06-01 13:40:12 | INFO | Trial 77 | outer=7 | hidden=[512, 256] epochs=62 lr=1.615e-04 wd=1.345e-07 n_pcs=3500 weight={'name': 'uniform'}
[I 2026-06-01 13:40:17,022] Trial 77 finished with value: 0.19572873865948312 and parameters: {'hidden_dims': '[512, 256]', 'dropout': 0.5047037800871181, 'batch_norm': False, 'lr': 0.00016153357917179353, 'weight_decay': 1.345093841323526e-07, 'epochs': 62, 'loss': 'mae', 'optimizer': 'adam', 'use_snp_selection': False, 'n_pcs': 3500}. Best is trial 67 with value: 0.21274226476569685.
2026-06-01 13:40:17 | INFO | Trial 78 | outer=7 | hidden=[512, 256] epochs=70 lr=1.801e-04 wd=4.925e-07 n_pcs=4000 weight={'name': 'uniform'}
[I 2026-06-01 13:40:22,096] Trial 78 finished with value: 0.17415579191562497 and parameters: {'hidden_dims': '[512, 256]', 'dropout': 0.4661124889227241, 'batch_norm': False, 'lr': 0.0001801138744981353, 'weight_decay': 4.924576771481741e-07, 'epochs': 70, 'loss': 'mse', 'optimizer': 'adam', 'use_snp_selection': False, 'n_pcs': 4000}. Best is trial 67 with value: 0.21274226476569685.
2026-06-01 13:40:22 | INFO | Trial 79 | outer=7 | hidden=[512, 256] epochs=96 lr=3.932e-04 wd=4.993e-08 n_pcs=4000 weight={'name': 'uniform'}
[I 2026-06-01 13:40:28,243] Trial 79 finished with value: 0.19440594058356403 and parameters: {'hidden_dims': '[512, 256]', 'dropout': 0.5288535435831974, 'batch_norm': False, 'lr': 0.0003931534137235, 'weight_decay': 4.992937639079894e-08, 'epochs': 96, 'loss': 'mae', 'optimizer': 'adam', 'use_snp_selection': False, 'n_pcs': 4000}. Best is trial 67 with value: 0.21274226476569685.
2026-06-01 13:40:28 | INFO | Trial 80 | outer=7 | hidden=[512, 128] epochs=139 lr=1.334e-04 wd=1.459e-07 n_pcs=4000 weight={'name': 'uniform'}
[I 2026-06-01 13:40:35,865] Trial 80 finished with value: 0.17339545317570174 and parameters: {'hidden_dims': '[512, 128]', 'dropout': 0.36865698815173015, 'batch_norm': False, 'lr': 0.00013340909644096892, 'weight_decay': 1.4585840218051321e-07, 'epochs': 139, 'loss': 'mae', 'optimizer': 'adam', 'use_snp_selection': False, 'n_pcs': 4000}. Best is trial 67 with value: 0.21274226476569685.
2026-06-01 13:40:35 | INFO | Trial 81 | outer=7 | hidden=[256, 64] epochs=173 lr=9.057e-05 wd=3.116e-07 n_pcs=4500 weight={'name': 'uniform'}
[I 2026-06-01 13:40:40,204] Trial 81 pruned. 
2026-06-01 13:40:40 | INFO | Trial 82 | outer=7 | hidden=[512, 64] epochs=81 lr=1.083e-04 wd=1.716e-07 n_pcs=4500 weight={'name': 'uniform'}
[I 2026-06-01 13:40:45,932] Trial 82 finished with value: 0.2018432855831235 and parameters: {'hidden_dims': '[512, 64]', 'dropout': 0.456877367651264, 'batch_norm': False, 'lr': 0.00010831564410255824, 'weight_decay': 1.7161760234674835e-07, 'epochs': 81, 'loss': 'mae', 'optimizer': 'adam', 'use_snp_selection': False, 'n_pcs': 4500}. Best is trial 67 with value: 0.21274226476569685.
2026-06-01 13:40:45 | INFO | Trial 83 | outer=7 | hidden=[512, 64] epochs=84 lr=1.128e-04 wd=1.814e-07 n_pcs=4500 weight={'name': 'uniform'}
[I 2026-06-01 13:40:51,794] Trial 83 finished with value: 0.1970238334455746 and parameters: {'hidden_dims': '[512, 64]', 'dropout': 0.46961452469966697, 'batch_norm': False, 'lr': 0.00011280053623388624, 'weight_decay': 1.8144716671154496e-07, 'epochs': 84, 'loss': 'mae', 'optimizer': 'adam', 'use_snp_selection': False, 'n_pcs': 4500}. Best is trial 67 with value: 0.21274226476569685.
2026-06-01 13:40:51 | INFO | Trial 84 | outer=7 | hidden=[512, 64] epochs=68 lr=1.502e-04 wd=3.915e-07 n_pcs=4000 weight={'name': 'uniform'}
[I 2026-06-01 13:40:56,567] Trial 84 finished with value: 0.17862956180066442 and parameters: {'hidden_dims': '[512, 64]', 'dropout': 0.43251952555914874, 'batch_norm': False, 'lr': 0.00015015664873449232, 'weight_decay': 3.915085022180724e-07, 'epochs': 68, 'loss': 'mae', 'optimizer': 'adam', 'use_snp_selection': False, 'n_pcs': 4000}. Best is trial 67 with value: 0.21274226476569685.
2026-06-01 13:40:56 | INFO | Trial 85 | outer=7 | hidden=[512, 64] epochs=52 lr=1.950e-04 wd=5.553e-07 n_pcs=4500 weight={'name': 'uniform'}
[I 2026-06-01 13:41:01,047] Trial 85 finished with value: 0.19308959502758055 and parameters: {'hidden_dims': '[512, 64]', 'dropout': 0.4483242135990166, 'batch_norm': False, 'lr': 0.00019503686969140398, 'weight_decay': 5.552554134460129e-07, 'epochs': 52, 'loss': 'mae', 'optimizer': 'adam', 'use_snp_selection': False, 'n_pcs': 4500}. Best is trial 67 with value: 0.21274226476569685.
2026-06-01 13:41:01 | INFO | Trial 86 | outer=7 | hidden=[256, 128] epochs=88 lr=1.576e-04 wd=4.675e-08 n_pcs=3500 weight={'name': 'uniform'}
[I 2026-06-01 13:41:04,787] Trial 86 finished with value: 0.16684460881959742 and parameters: {'hidden_dims': '[256, 128]', 'dropout': 0.41158547812713897, 'batch_norm': False, 'lr': 0.00015760749159637505, 'weight_decay': 4.674659993920165e-08, 'epochs': 88, 'loss': 'mae', 'optimizer': 'adam', 'use_snp_selection': False, 'n_pcs': 3500}. Best is trial 67 with value: 0.21274226476569685.
2026-06-01 13:41:04 | INFO | Trial 87 | outer=7 | hidden=[512, 256] epochs=101 lr=1.211e-04 wd=9.472e-08 n_pcs=2500 weight={'name': 'uniform'}
[I 2026-06-01 13:41:09,573] Trial 87 finished with value: 0.17629955906591294 and parameters: {'hidden_dims': '[512, 256]', 'dropout': 0.32681265326892495, 'batch_norm': False, 'lr': 0.00012106528988627122, 'weight_decay': 9.472237575766542e-08, 'epochs': 101, 'loss': 'mse', 'optimizer': 'adam', 'use_snp_selection': False, 'n_pcs': 2500}. Best is trial 67 with value: 0.21274226476569685.
2026-06-01 13:41:09 | INFO | Trial 88 | outer=7 | hidden=[128, 64] epochs=118 lr=1.097e-04 wd=2.948e-08 n_pcs=3000 weight={'name': 'uniform'}
[I 2026-06-01 13:41:12,997] Trial 88 finished with value: 0.15305460220309505 and parameters: {'hidden_dims': '[128, 64]', 'dropout': 0.48997039599928904, 'batch_norm': False, 'lr': 0.00010967312910448625, 'weight_decay': 2.947531565508169e-08, 'epochs': 118, 'loss': 'mae', 'optimizer': 'adamw', 'use_snp_selection': False, 'n_pcs': 3000}. Best is trial 67 with value: 0.21274226476569685.
2026-06-01 13:41:13 | INFO | Trial 89 | outer=7 | hidden=[512, 64] epochs=75 lr=1.702e-04 wd=2.536e-07 n_pcs=4500 weight={'name': 'uniform'}
[I 2026-06-01 13:41:18,457] Trial 89 finished with value: 0.18692149273080283 and parameters: {'hidden_dims': '[512, 64]', 'dropout': 0.3807669676160214, 'batch_norm': False, 'lr': 0.00017022882816035203, 'weight_decay': 2.5361854873574493e-07, 'epochs': 75, 'loss': 'mae', 'optimizer': 'adam', 'use_snp_selection': False, 'n_pcs': 4500}. Best is trial 67 with value: 0.21274226476569685.
2026-06-01 13:41:18 | INFO | Trial 90 | outer=7 | hidden=[512, 256] epochs=133 lr=2.748e-04 wd=1.007e-06 n_pcs=4000 weight={'name': 'uniform'}
[I 2026-06-01 13:41:26,135] Trial 90 finished with value: 0.2014500592633564 and parameters: {'hidden_dims': '[512, 256]', 'dropout': 0.45579702083210305, 'batch_norm': False, 'lr': 0.0002747605203724027, 'weight_decay': 1.0068066534584857e-06, 'epochs': 133, 'loss': 'mae', 'optimizer': 'adam', 'use_snp_selection': False, 'n_pcs': 4000}. Best is trial 67 with value: 0.21274226476569685.
2026-06-01 13:41:26 | INFO | Trial 91 | outer=7 | hidden=[512, 256] epochs=143 lr=2.629e-04 wd=9.536e-07 n_pcs=4000 weight={'name': 'uniform'}
[I 2026-06-01 13:41:34,227] Trial 91 finished with value: 0.1913552339540986 and parameters: {'hidden_dims': '[512, 256]', 'dropout': 0.4793509883497894, 'batch_norm': False, 'lr': 0.0002629062164574819, 'weight_decay': 9.535998177096716e-07, 'epochs': 143, 'loss': 'mae', 'optimizer': 'adam', 'use_snp_selection': False, 'n_pcs': 4000}. Best is trial 67 with value: 0.21274226476569685.
2026-06-01 13:41:34 | INFO | Trial 92 | outer=7 | hidden=[512, 256] epochs=135 lr=3.201e-04 wd=7.041e-07 n_pcs=4000 weight={'name': 'uniform'}
[I 2026-06-01 13:41:41,988] Trial 92 finished with value: 0.1895018796484761 and parameters: {'hidden_dims': '[512, 256]', 'dropout': 0.5295351313081446, 'batch_norm': False, 'lr': 0.0003201441572024419, 'weight_decay': 7.041073382970171e-07, 'epochs': 135, 'loss': 'mae', 'optimizer': 'adam', 'use_snp_selection': False, 'n_pcs': 4000}. Best is trial 67 with value: 0.21274226476569685.
2026-06-01 13:41:42 | INFO | Trial 93 | outer=7 | hidden=[512, 256] epochs=126 lr=2.368e-04 wd=1.852e-06 n_pcs=3500 weight={'name': 'uniform'}
[I 2026-06-01 13:41:48,821] Trial 93 finished with value: 0.18143745512745552 and parameters: {'hidden_dims': '[512, 256]', 'dropout': 0.457716803092899, 'batch_norm': False, 'lr': 0.00023678406817444987, 'weight_decay': 1.8517397534578923e-06, 'epochs': 126, 'loss': 'mae', 'optimizer': 'adam', 'use_snp_selection': False, 'n_pcs': 3500}. Best is trial 67 with value: 0.21274226476569685.
2026-06-01 13:41:48 | INFO | Trial 94 | outer=7 | hidden=[512, 256] epochs=158 lr=1.393e-04 wd=1.697e-07 n_pcs=4500 weight={'name': 'uniform'}
[I 2026-06-01 13:41:58,340] Trial 94 finished with value: 0.195270173141736 and parameters: {'hidden_dims': '[512, 256]', 'dropout': 0.4001374137092399, 'batch_norm': False, 'lr': 0.00013933693122026303, 'weight_decay': 1.6968666633933128e-07, 'epochs': 158, 'loss': 'mae', 'optimizer': 'adam', 'use_snp_selection': False, 'n_pcs': 4500}. Best is trial 67 with value: 0.21274226476569685.
2026-06-01 13:41:58 | INFO | Trial 95 | outer=7 | hidden=[256, 128] epochs=113 lr=1.997e-04 wd=1.129e-06 n_pcs=4500 weight={'name': 'uniform'}
[I 2026-06-01 13:42:03,233] Trial 95 finished with value: 0.18442373519033256 and parameters: {'hidden_dims': '[256, 128]', 'dropout': 0.44431960427396017, 'batch_norm': False, 'lr': 0.00019973716474839308, 'weight_decay': 1.1288534986730824e-06, 'epochs': 113, 'loss': 'mae', 'optimizer': 'adam', 'use_snp_selection': False, 'n_pcs': 4500}. Best is trial 67 with value: 0.21274226476569685.
2026-06-01 13:42:03 | INFO | Trial 96 | outer=7 | hidden=[512, 256] epochs=59 lr=4.393e-04 wd=2.919e-07 n_pcs=4000 weight={'name': 'uniform'}
[I 2026-06-01 13:42:07,848] Trial 96 finished with value: 0.18945604743349415 and parameters: {'hidden_dims': '[512, 256]', 'dropout': 0.42560686405269943, 'batch_norm': False, 'lr': 0.0004393022048277481, 'weight_decay': 2.9191736664317653e-07, 'epochs': 59, 'loss': 'mse', 'optimizer': 'adam', 'use_snp_selection': False, 'n_pcs': 4000}. Best is trial 67 with value: 0.21274226476569685.
2026-06-01 13:42:07 | INFO | Trial 97 | outer=7 | hidden=[512, 64] epochs=102 lr=2.824e-04 wd=5.750e-07 n_pcs=5000 weight={'name': 'uniform'}
[I 2026-06-01 13:42:14,822] Trial 97 finished with value: 0.21220101492632154 and parameters: {'hidden_dims': '[512, 64]', 'dropout': 0.503610808888376, 'batch_norm': False, 'lr': 0.0002824165129580177, 'weight_decay': 5.750102663585889e-07, 'epochs': 102, 'loss': 'mae', 'optimizer': 'adam', 'use_snp_selection': False, 'n_pcs': 5000}. Best is trial 67 with value: 0.21274226476569685.
2026-06-01 13:42:14 | INFO | Trial 98 | outer=7 | hidden=[512, 64] epochs=105 lr=2.811e-04 wd=1.760e-06 n_pcs=5000 weight={'name': 'uniform'}
