[I 2026-06-01 15:54:06,208] Trial 10 finished with value: 0.14767063548488074 and parameters: {'hidden_dims': '[512, 256]', 'dropout': 0.02309895975550147, 'batch_norm': False, 'lr': 0.0003983594610602333, 'weight_decay': 0.0009452683165453212, 'epochs': 242, 'loss': 'mae', 'optimizer': 'adamw', 'use_snp_selection': False, 'n_pcs': 500}. Best is trial 0 with value: 0.19649774530248504.
2026-06-01 15:54:06 | INFO | Trial 11 | outer=15 | hidden=[256, 64] epochs=139 lr=1.427e-04 wd=2.043e-04 n_pcs=1500 weight={'name': 'uniform'}
[I 2026-06-01 15:54:08,130] Trial 11 pruned. 
2026-06-01 15:54:08 | INFO | Trial 12 | outer=15 | hidden=[256, 64] epochs=116 lr=5.119e-05 wd=6.135e-05 n_pcs=1500 weight={'name': 'uniform'}
[I 2026-06-01 15:54:11,063] Trial 12 finished with value: 0.16262182566243202 and parameters: {'hidden_dims': '[256, 64]', 'dropout': 0.03906050655392038, 'batch_norm': False, 'lr': 5.1194350971378755e-05, 'weight_decay': 6.134980726027285e-05, 'epochs': 116, 'loss': 'mae', 'optimizer': 'adam', 'use_snp_selection': False, 'n_pcs': 1500}. Best is trial 0 with value: 0.19649774530248504.
2026-06-01 15:54:11 | INFO | Trial 13 | outer=15 | hidden=[256, 64] epochs=184 lr=1.171e-04 wd=1.332e-08 n_pcs=2000 weight={'name': 'uniform'}
[I 2026-06-01 15:54:15,008] Trial 13 finished with value: 0.17020820743654028 and parameters: {'hidden_dims': '[256, 64]', 'dropout': 0.10166190351819882, 'batch_norm': False, 'lr': 0.00011714694867355428, 'weight_decay': 1.332124587498989e-08, 'epochs': 184, 'loss': 'mae', 'optimizer': 'adamw', 'use_snp_selection': False, 'n_pcs': 2000}. Best is trial 0 with value: 0.19649774530248504.
2026-06-01 15:54:15 | INFO | Trial 14 | outer=15 | hidden=[256, 64] epochs=148 lr=3.646e-04 wd=4.212e-05 n_pcs=1500 weight={'name': 'uniform'}
[I 2026-06-01 15:54:18,303] Trial 14 finished with value: 0.1654526064067136 and parameters: {'hidden_dims': '[256, 64]', 'dropout': 0.37754290385964673, 'batch_norm': False, 'lr': 0.00036462899077818376, 'weight_decay': 4.211701849345666e-05, 'epochs': 148, 'loss': 'mae', 'optimizer': 'adam', 'use_snp_selection': False, 'n_pcs': 1500}. Best is trial 0 with value: 0.19649774530248504.
2026-06-01 15:54:18 | INFO | Trial 15 | outer=15 | hidden=[256, 64] epochs=67 lr=3.545e-05 wd=7.042e-07 n_pcs=2000 weight={'name': 'uniform'}
[I 2026-06-01 15:54:19,831] Trial 15 pruned. 
2026-06-01 15:54:19 | INFO | Trial 16 | outer=15 | hidden=[512, 256] epochs=257 lr=2.066e-04 wd=6.088e-07 n_pcs=1000 weight={'name': 'uniform'}
[I 2026-06-01 15:54:25,628] Trial 16 finished with value: 0.17556353082917212 and parameters: {'hidden_dims': '[512, 256]', 'dropout': 0.09746038237406997, 'batch_norm': False, 'lr': 0.0002065835862805616, 'weight_decay': 6.088225732050425e-07, 'epochs': 257, 'loss': 'mae', 'optimizer': 'adam', 'use_snp_selection': False, 'n_pcs': 1000}. Best is trial 0 with value: 0.19649774530248504.
2026-06-01 15:54:25 | INFO | Trial 17 | outer=15 | hidden=[512, 64] epochs=115 lr=7.475e-05 wd=1.184e-08 n_pcs=4000 weight={'name': 'uniform'}
[I 2026-06-01 15:54:32,041] Trial 17 finished with value: 0.1328813926545693 and parameters: {'hidden_dims': '[512, 64]', 'dropout': 0.5998375031807794, 'batch_norm': False, 'lr': 7.475222383226776e-05, 'weight_decay': 1.1840058441529551e-08, 'epochs': 115, 'loss': 'mae', 'optimizer': 'adamw', 'use_snp_selection': False, 'n_pcs': 4000}. Best is trial 0 with value: 0.19649774530248504.
2026-06-01 15:54:32 | INFO | Trial 18 | outer=15 | hidden=[512, 128] epochs=52 lr=3.586e-05 wd=3.486e-05 n_pcs=2500 weight={'name': 'uniform'}
[I 2026-06-01 15:54:33,950] Trial 18 pruned. 
2026-06-01 15:54:33 | INFO | Trial 19 | outer=15 | hidden=[256, 128] epochs=183 lr=1.036e-05 wd=8.835e-07 n_pcs=3500 weight={'name': 'uniform'}
[I 2026-06-01 15:54:37,216] Trial 19 pruned. 
2026-06-01 15:54:37 | INFO | Trial 20 | outer=15 | hidden=[1024, 256] epochs=121 lr=1.034e-04 wd=2.471e-04 n_pcs=2000 weight={'name': 'uniform'}
[I 2026-06-01 15:54:44,511] Trial 20 finished with value: 0.18072509724492744 and parameters: {'hidden_dims': '[1024, 256]', 'dropout': 0.12363485469608741, 'batch_norm': False, 'lr': 0.00010338968265267587, 'weight_decay': 0.00024712569921570937, 'epochs': 121, 'loss': 'mae', 'optimizer': 'adamw', 'use_snp_selection': False, 'n_pcs': 2000}. Best is trial 0 with value: 0.19649774530248504.
2026-06-01 15:54:44 | INFO | Trial 21 | outer=15 | hidden=[1024, 256] epochs=134 lr=9.848e-05 wd=3.128e-04 n_pcs=2000 weight={'name': 'uniform'}
[I 2026-06-01 15:54:52,416] Trial 21 finished with value: 0.1803419783924772 and parameters: {'hidden_dims': '[1024, 256]', 'dropout': 0.13320927672675167, 'batch_norm': False, 'lr': 9.847584325685778e-05, 'weight_decay': 0.00031277744313702277, 'epochs': 134, 'loss': 'mae', 'optimizer': 'adamw', 'use_snp_selection': False, 'n_pcs': 2000}. Best is trial 0 with value: 0.19649774530248504.
2026-06-01 15:54:52 | INFO | Trial 22 | outer=15 | hidden=[1024, 256] epochs=108 lr=9.854e-05 wd=7.906e-04 n_pcs=2000 weight={'name': 'uniform'}
[I 2026-06-01 15:54:59,136] Trial 22 finished with value: 0.19073538474054336 and parameters: {'hidden_dims': '[1024, 256]', 'dropout': 0.23546337265680323, 'batch_norm': False, 'lr': 9.854057278986552e-05, 'weight_decay': 0.0007905665505875738, 'epochs': 108, 'loss': 'mae', 'optimizer': 'adamw', 'use_snp_selection': False, 'n_pcs': 2000}. Best is trial 0 with value: 0.19649774530248504.
2026-06-01 15:54:59 | INFO | Trial 23 | outer=15 | hidden=[1024, 256] epochs=95 lr=2.137e-04 wd=7.627e-04 n_pcs=1000 weight={'name': 'uniform'}
[I 2026-06-01 15:55:03,496] Trial 23 finished with value: 0.17626420541676097 and parameters: {'hidden_dims': '[1024, 256]', 'dropout': 0.2341790720867384, 'batch_norm': False, 'lr': 0.00021369498246990575, 'weight_decay': 0.0007626787425847728, 'epochs': 95, 'loss': 'mae', 'optimizer': 'adamw', 'use_snp_selection': False, 'n_pcs': 1000}. Best is trial 0 with value: 0.19649774530248504.
2026-06-01 15:55:03 | INFO | Trial 24 | outer=15 | hidden=[1024, 256] epochs=82 lr=2.003e-04 wd=9.570e-05 n_pcs=2000 weight={'name': 'uniform'}
[I 2026-06-01 15:55:09,033] Trial 24 finished with value: 0.19081620123878867 and parameters: {'hidden_dims': '[1024, 256]', 'dropout': 0.3330753071422585, 'batch_norm': False, 'lr': 0.0002002778716620478, 'weight_decay': 9.57009719686801e-05, 'epochs': 82, 'loss': 'mae', 'optimizer': 'adamw', 'use_snp_selection': False, 'n_pcs': 2000}. Best is trial 0 with value: 0.19649774530248504.
2026-06-01 15:55:09 | INFO | Trial 25 | outer=15 | hidden=[1024, 256] epochs=87 lr=2.173e-04 wd=2.903e-04 n_pcs=1000 weight={'name': 'uniform'}
[I 2026-06-01 15:55:13,159] Trial 25 finished with value: 0.1932512179927655 and parameters: {'hidden_dims': '[1024, 256]', 'dropout': 0.33713347591449605, 'batch_norm': False, 'lr': 0.00021729593768878534, 'weight_decay': 0.00029034898769320425, 'epochs': 87, 'loss': 'mae', 'optimizer': 'adamw', 'use_snp_selection': False, 'n_pcs': 1000}. Best is trial 0 with value: 0.19649774530248504.
2026-06-01 15:55:13 | INFO | Trial 26 | outer=15 | hidden=[1024, 256] epochs=76 lr=2.695e-04 wd=1.523e-05 n_pcs=1000 weight={'name': 'uniform'}
[I 2026-06-01 15:55:16,984] Trial 26 finished with value: 0.1961564893993519 and parameters: {'hidden_dims': '[1024, 256]', 'dropout': 0.3640199307793607, 'batch_norm': False, 'lr': 0.000269494269435833, 'weight_decay': 1.523245980576102e-05, 'epochs': 76, 'loss': 'mae', 'optimizer': 'adamw', 'use_snp_selection': False, 'n_pcs': 1000}. Best is trial 0 with value: 0.19649774530248504.
2026-06-01 15:55:16 | INFO | Trial 27 | outer=15 | hidden=[1024, 256] epochs=81 lr=2.691e-04 wd=1.665e-05 n_pcs=1000 weight={'name': 'uniform'}
[I 2026-06-01 15:55:20,956] Trial 27 finished with value: 0.1886122181594328 and parameters: {'hidden_dims': '[1024, 256]', 'dropout': 0.39113305193528586, 'batch_norm': False, 'lr': 0.0002691253393097476, 'weight_decay': 1.66546229557799e-05, 'epochs': 81, 'loss': 'mae', 'optimizer': 'adamw', 'use_snp_selection': False, 'n_pcs': 1000}. Best is trial 0 with value: 0.19649774530248504.
2026-06-01 15:55:20 | INFO | Trial 28 | outer=15 | hidden=[1024, 256] epochs=164 lr=2.947e-04 wd=1.578e-06 n_pcs=500 weight={'name': 'uniform'}
[I 2026-06-01 15:55:25,853] Trial 28 finished with value: 0.170353439781099 and parameters: {'hidden_dims': '[1024, 256]', 'dropout': 0.48467842139327244, 'batch_norm': False, 'lr': 0.0002947489717892103, 'weight_decay': 1.5782570041039941e-06, 'epochs': 164, 'loss': 'mae', 'optimizer': 'adamw', 'use_snp_selection': False, 'n_pcs': 500}. Best is trial 0 with value: 0.19649774530248504.
2026-06-01 15:55:25 | INFO | Trial 29 | outer=15 | hidden=[1024, 256] epochs=61 lr=1.436e-04 wd=2.731e-07 n_pcs=500 weight={'name': 'uniform'}
[I 2026-06-01 15:55:28,641] Trial 29 finished with value: 0.15537676467474465 and parameters: {'hidden_dims': '[1024, 256]', 'dropout': 0.28008264091467605, 'batch_norm': False, 'lr': 0.00014364370653356372, 'weight_decay': 2.7314863974202296e-07, 'epochs': 61, 'loss': 'mse', 'optimizer': 'adamw', 'use_snp_selection': False, 'n_pcs': 500}. Best is trial 0 with value: 0.19649774530248504.
2026-06-01 15:55:28 | INFO | Trial 30 | outer=15 | hidden=[512, 256] epochs=231 lr=4.670e-04 wd=1.278e-05 n_pcs=1000 weight={'name': 'uniform'}
[I 2026-06-01 15:55:33,976] Trial 30 finished with value: 0.18289272960714342 and parameters: {'hidden_dims': '[512, 256]', 'dropout': 0.3790899313228056, 'batch_norm': False, 'lr': 0.00046698091419749026, 'weight_decay': 1.2777857820805823e-05, 'epochs': 231, 'loss': 'mae', 'optimizer': 'adamw', 'use_snp_selection': False, 'n_pcs': 1000}. Best is trial 0 with value: 0.19649774530248504.
2026-06-01 15:55:33 | INFO | Trial 31 | outer=15 | hidden=[1024, 256] epochs=73 lr=1.864e-04 wd=9.717e-05 n_pcs=1500 weight={'name': 'uniform'}
[I 2026-06-01 15:55:38,335] Trial 31 finished with value: 0.188932620065476 and parameters: {'hidden_dims': '[1024, 256]', 'dropout': 0.3241571996502731, 'batch_norm': False, 'lr': 0.00018638508479034284, 'weight_decay': 9.716941936667986e-05, 'epochs': 73, 'loss': 'mae', 'optimizer': 'adamw', 'use_snp_selection': False, 'n_pcs': 1500}. Best is trial 0 with value: 0.19649774530248504.
2026-06-01 15:55:38 | INFO | Trial 32 | outer=15 | hidden=[1024, 256] epochs=97 lr=2.715e-04 wd=1.301e-04 n_pcs=1000 weight={'name': 'uniform'}
[I 2026-06-01 15:55:42,749] Trial 32 finished with value: 0.1784935504619311 and parameters: {'hidden_dims': '[1024, 256]', 'dropout': 0.3424782502464829, 'batch_norm': False, 'lr': 0.00027154721405714323, 'weight_decay': 0.00013007381530889413, 'epochs': 97, 'loss': 'mae', 'optimizer': 'adamw', 'use_snp_selection': False, 'n_pcs': 1000}. Best is trial 0 with value: 0.19649774530248504.
2026-06-01 15:55:42 | INFO | Trial 33 | outer=15 | hidden=[1024, 256] epochs=52 lr=1.691e-04 wd=2.211e-05 n_pcs=1500 weight={'name': 'uniform'}
[I 2026-06-01 15:55:46,349] Trial 33 finished with value: 0.18618965632330065 and parameters: {'hidden_dims': '[1024, 256]', 'dropout': 0.4283067789786954, 'batch_norm': False, 'lr': 0.00016911058948490212, 'weight_decay': 2.21082113793806e-05, 'epochs': 52, 'loss': 'mae', 'optimizer': 'adamw', 'use_snp_selection': False, 'n_pcs': 1500}. Best is trial 0 with value: 0.19649774530248504.
2026-06-01 15:55:46 | INFO | Trial 34 | outer=15 | hidden=[256, 128] epochs=84 lr=3.200e-04 wd=4.293e-04 n_pcs=500 weight={'name': 'uniform'}
[I 2026-06-01 15:55:48,823] Trial 34 finished with value: 0.15989390566551737 and parameters: {'hidden_dims': '[256, 128]', 'dropout': 0.2701918672724884, 'batch_norm': False, 'lr': 0.00032001220072620454, 'weight_decay': 0.00042925608148610794, 'epochs': 84, 'loss': 'mae', 'optimizer': 'adamw', 'use_snp_selection': False, 'n_pcs': 500}. Best is trial 0 with value: 0.19649774530248504.
2026-06-01 15:55:48 | INFO | Trial 35 | outer=15 | hidden=[512, 128] epochs=74 lr=2.363e-04 wd=3.199e-08 n_pcs=2500 weight={'name': 'uniform'}
[I 2026-06-01 15:55:52,513] Trial 35 finished with value: 0.18900740782582998 and parameters: {'hidden_dims': '[512, 128]', 'dropout': 0.3528485142983265, 'batch_norm': False, 'lr': 0.00023631523569463578, 'weight_decay': 3.199095312041324e-08, 'epochs': 74, 'loss': 'mae', 'optimizer': 'adamw', 'use_snp_selection': False, 'n_pcs': 2500}. Best is trial 0 with value: 0.19649774530248504.
2026-06-01 15:55:52 | INFO | Trial 36 | outer=15 | hidden=[512, 64] epochs=100 lr=6.143e-05 wd=1.177e-04 n_pcs=1500 weight={'name': 'uniform'}
[I 2026-06-01 15:55:55,905] Trial 36 finished with value: 0.17075562160487578 and parameters: {'hidden_dims': '[512, 64]', 'dropout': 0.4469679129401771, 'batch_norm': False, 'lr': 6.142871705044981e-05, 'weight_decay': 0.0001177493569533505, 'epochs': 100, 'loss': 'mse', 'optimizer': 'adamw', 'use_snp_selection': False, 'n_pcs': 1500}. Best is trial 0 with value: 0.19649774530248504.
2026-06-01 15:55:55 | INFO | Trial 37 | outer=15 | hidden=[1024, 256] epochs=202 lr=4.704e-04 wd=2.870e-06 n_pcs=1000 weight={'name': 'uniform'}
[I 2026-06-01 15:56:03,360] Trial 37 finished with value: 0.19098587752894872 and parameters: {'hidden_dims': '[1024, 256]', 'dropout': 0.26151399064565994, 'batch_norm': False, 'lr': 0.0004704306559941617, 'weight_decay': 2.8704757139337507e-06, 'epochs': 202, 'loss': 'mae', 'optimizer': 'adamw', 'use_snp_selection': False, 'n_pcs': 1000}. Best is trial 0 with value: 0.19649774530248504.
2026-06-01 15:56:03 | INFO | Trial 38 | outer=15 | hidden=[256, 64] epochs=202 lr=4.120e-04 wd=2.662e-06 n_pcs=1000 weight={'name': 'uniform'}
[I 2026-06-01 15:56:05,777] Trial 38 pruned. 
2026-06-01 15:56:05 | INFO | Trial 39 | outer=15 | hidden=[1024, 256] epochs=262 lr=4.881e-04 wd=3.039e-07 n_pcs=500 weight={'name': 'uniform'}
[I 2026-06-01 15:56:09,976] Trial 39 pruned. 
2026-06-01 15:56:09 | INFO | Trial 40 | outer=15 | hidden=[256, 128] epochs=217 lr=3.373e-04 wd=8.579e-06 n_pcs=1000 weight={'name': 'uniform'}
[I 2026-06-01 15:56:14,045] Trial 40 finished with value: 0.17248965460983637 and parameters: {'hidden_dims': '[256, 128]', 'dropout': 0.3005533248623952, 'batch_norm': False, 'lr': 0.00033725227959119196, 'weight_decay': 8.579148433007266e-06, 'epochs': 217, 'loss': 'mse', 'optimizer': 'adamw', 'use_snp_selection': False, 'n_pcs': 1000}. Best is trial 0 with value: 0.19649774530248504.
2026-06-01 15:56:14 | INFO | Trial 41 | outer=15 | hidden=[1024, 256] epochs=242 lr=1.649e-04 wd=3.254e-06 n_pcs=1500 weight={'name': 'uniform'}
[I 2026-06-01 15:56:24,584] Trial 41 finished with value: 0.18818818741620538 and parameters: {'hidden_dims': '[1024, 256]', 'dropout': 0.3178347106772543, 'batch_norm': False, 'lr': 0.00016490204567402462, 'weight_decay': 3.2541047676449922e-06, 'epochs': 242, 'loss': 'mae', 'optimizer': 'adamw', 'use_snp_selection': False, 'n_pcs': 1500}. Best is trial 0 with value: 0.19649774530248504.
2026-06-01 15:56:24 | INFO | Trial 42 | outer=15 | hidden=[1024, 256] epochs=153 lr=2.441e-04 wd=7.949e-05 n_pcs=1000 weight={'name': 'uniform'}
[I 2026-06-01 15:56:30,606] Trial 42 finished with value: 0.17786083620092366 and parameters: {'hidden_dims': '[1024, 256]', 'dropout': 0.4110225976485011, 'batch_norm': False, 'lr': 0.0002441439513319562, 'weight_decay': 7.949424666836952e-05, 'epochs': 153, 'loss': 'mae', 'optimizer': 'adamw', 'use_snp_selection': False, 'n_pcs': 1000}. Best is trial 0 with value: 0.19649774530248504.
2026-06-01 15:56:30 | INFO | Trial 43 | outer=15 | hidden=[128, 64] epochs=195 lr=1.183e-04 wd=3.199e-05 n_pcs=5000 weight={'name': 'uniform'}
[I 2026-06-01 15:56:33,499] Trial 43 pruned. 
2026-06-01 15:56:33 | INFO | Trial 44 | outer=15 | hidden=[1024, 256] epochs=295 lr=8.071e-05 wd=3.993e-08 n_pcs=2000 weight={'name': 'uniform'}
[I 2026-06-01 15:56:48,779] Trial 44 finished with value: 0.1883912018148764 and parameters: {'hidden_dims': '[1024, 256]', 'dropout': 0.16297984486605135, 'batch_norm': False, 'lr': 8.071234317672636e-05, 'weight_decay': 3.993229009553129e-08, 'epochs': 295, 'loss': 'mae', 'optimizer': 'adamw', 'use_snp_selection': False, 'n_pcs': 2000}. Best is trial 0 with value: 0.19649774530248504.
2026-06-01 15:56:48 | INFO | Trial 45 | outer=15 | hidden=[1024, 256] epochs=221 lr=4.824e-05 wd=1.740e-04 n_pcs=1500 weight={'name': 'uniform'}
[I 2026-06-01 15:56:58,511] Trial 45 finished with value: 0.1917273108205996 and parameters: {'hidden_dims': '[1024, 256]', 'dropout': 0.2566401574628291, 'batch_norm': False, 'lr': 4.8241091906103226e-05, 'weight_decay': 0.00017404120903434257, 'epochs': 221, 'loss': 'mae', 'optimizer': 'adamw', 'use_snp_selection': False, 'n_pcs': 1500}. Best is trial 0 with value: 0.19649774530248504.
2026-06-01 15:56:58 | INFO | Trial 46 | outer=15 | hidden=[256, 64] epochs=219 lr=4.696e-05 wd=5.612e-04 n_pcs=500 weight={'name': 'uniform'}
[I 2026-06-01 15:57:02,433] Trial 46 finished with value: 0.18252619050405366 and parameters: {'hidden_dims': '[256, 64]', 'dropout': 0.19635596935721872, 'batch_norm': False, 'lr': 4.6960149256017076e-05, 'weight_decay': 0.0005611599381701372, 'epochs': 219, 'loss': 'mae', 'optimizer': 'adamw', 'use_snp_selection': False, 'n_pcs': 500}. Best is trial 0 with value: 0.19649774530248504.
2026-06-01 15:57:02 | INFO | Trial 47 | outer=15 | hidden=[512, 128] epochs=253 lr=4.469e-05 wd=1.146e-07 n_pcs=1500 weight={'name': 'uniform'}
[I 2026-06-01 15:57:08,705] Trial 47 finished with value: 0.1787135442383177 and parameters: {'hidden_dims': '[512, 128]', 'dropout': 0.2518176179941448, 'batch_norm': False, 'lr': 4.469400429335341e-05, 'weight_decay': 1.145644775693735e-07, 'epochs': 253, 'loss': 'mae', 'optimizer': 'adam', 'use_snp_selection': False, 'n_pcs': 1500}. Best is trial 0 with value: 0.19649774530248504.
2026-06-01 15:57:08 | INFO | Trial 48 | outer=15 | hidden=[512, 64] epochs=277 lr=2.585e-05 wd=1.729e-04 n_pcs=3000 weight={'name': 'uniform'}
[I 2026-06-01 15:57:18,540] Trial 48 finished with value: 0.18563749232518456 and parameters: {'hidden_dims': '[512, 64]', 'dropout': 0.2872641794037081, 'batch_norm': False, 'lr': 2.5850729494176903e-05, 'weight_decay': 0.00017288864253285182, 'epochs': 277, 'loss': 'mse', 'optimizer': 'adamw', 'use_snp_selection': False, 'n_pcs': 3000}. Best is trial 0 with value: 0.19649774530248504.
2026-06-01 15:57:18 | INFO | Trial 49 | outer=15 | hidden=[128, 64] epochs=232 lr=5.958e-05 wd=6.025e-05 n_pcs=1000 weight={'name': 'uniform'}
[I 2026-06-01 15:57:22,821] Trial 49 finished with value: 0.19509952235806938 and parameters: {'hidden_dims': '[128, 64]', 'dropout': 0.46924219760578556, 'batch_norm': False, 'lr': 5.957567473944905e-05, 'weight_decay': 6.025345945179591e-05, 'epochs': 232, 'loss': 'mae', 'optimizer': 'adamw', 'use_snp_selection': False, 'n_pcs': 1000}. Best is trial 0 with value: 0.19649774530248504.
2026-06-01 15:57:22 | INFO | Trial 50 | outer=15 | hidden=[128, 64] epochs=230 lr=6.416e-05 wd=5.992e-05 n_pcs=1500 weight={'name': 'uniform'}
[I 2026-06-01 15:57:25,470] Trial 50 pruned. 
2026-06-01 15:57:25 | INFO | Trial 51 | outer=15 | hidden=[128, 64] epochs=236 lr=5.875e-05 wd=9.283e-06 n_pcs=1000 weight={'name': 'uniform'}
[I 2026-06-01 15:57:27,977] Trial 51 pruned. 
2026-06-01 15:57:27 | INFO | Trial 52 | outer=15 | hidden=[128, 64] epochs=208 lr=2.854e-05 wd=4.855e-06 n_pcs=500 weight={'name': 'uniform'}
[I 2026-06-01 15:57:30,370] Trial 52 pruned. 
2026-06-01 15:57:30 | INFO | Trial 53 | outer=15 | hidden=[512, 256] epochs=246 lr=4.201e-05 wd=4.653e-05 n_pcs=1000 weight={'name': 'uniform'}
[I 2026-06-01 15:57:33,771] Trial 53 pruned. 
2026-06-01 15:57:33 | INFO | Trial 54 | outer=15 | hidden=[256, 64] epochs=265 lr=5.112e-05 wd=1.838e-04 n_pcs=1500 weight={'name': 'uniform'}
[I 2026-06-01 15:57:38,331] Trial 54 finished with value: 0.1971201374024811 and parameters: {'hidden_dims': '[256, 64]', 'dropout': 0.36548228955656165, 'batch_norm': False, 'lr': 5.11230837511843e-05, 'weight_decay': 0.00018384517594257727, 'epochs': 265, 'loss': 'mae', 'optimizer': 'adamw', 'use_snp_selection': False, 'n_pcs': 1500}. Best is trial 54 with value: 0.1971201374024811.
2026-06-01 15:57:38 | INFO | Trial 55 | outer=15 | hidden=[256, 64] epochs=274 lr=2.014e-05 wd=2.685e-04 n_pcs=1500 weight={'name': 'uniform'}
[I 2026-06-01 15:57:41,135] Trial 55 pruned. 
2026-06-01 15:57:41 | INFO | Trial 56 | outer=15 | hidden=[256, 64] epochs=268 lr=8.294e-05 wd=2.591e-05 n_pcs=3500 weight={'name': 'uniform'}
[I 2026-06-01 15:57:45,245] Trial 56 pruned. 
2026-06-01 15:57:45 | INFO | Trial 57 | outer=15 | hidden=[256, 64] epochs=286 lr=3.550e-05 wd=4.834e-04 n_pcs=1500 weight={'name': 'uniform'}
[I 2026-06-01 15:57:50,044] Trial 57 finished with value: 0.1552644893506548 and parameters: {'hidden_dims': '[256, 64]', 'dropout': 0.5394374249576955, 'batch_norm': False, 'lr': 3.549890800788968e-05, 'weight_decay': 0.00048344998668150554, 'epochs': 286, 'loss': 'mae', 'optimizer': 'adamw', 'use_snp_selection': False, 'n_pcs': 1500}. Best is trial 54 with value: 0.1971201374024811.
2026-06-01 15:57:50 | INFO | Trial 58 | outer=15 | hidden=[256, 64] epochs=218 lr=4.989e-05 wd=1.640e-04 n_pcs=2000 weight={'name': 'uniform'}
[I 2026-06-01 15:57:54,403] Trial 58 finished with value: 0.183987316012091 and parameters: {'hidden_dims': '[256, 64]', 'dropout': 0.3045796286096527, 'batch_norm': False, 'lr': 4.989292250174783e-05, 'weight_decay': 0.00016398221292406544, 'epochs': 218, 'loss': 'mae', 'optimizer': 'adam', 'use_snp_selection': False, 'n_pcs': 2000}. Best is trial 54 with value: 0.1971201374024811.
2026-06-01 15:57:54 | INFO | Trial 59 | outer=15 | hidden=[128, 64] epochs=248 lr=6.941e-05 wd=3.621e-04 n_pcs=2500 weight={'name': 'uniform'}
