[I 2026-06-01 11:21:42,055] Trial 122 finished with value: 0.22710154413469175 and parameters: {'hidden_dims': '[512, 64]', 'dropout': 0.05270475759645018, 'batch_norm': False, 'lr': 0.00038195986272227596, 'weight_decay': 0.00012943885784794893, 'epochs': 264, 'loss': 'mae', 'optimizer': 'adam', 'use_snp_selection': False, 'n_pcs': 5000}. Best is trial 88 with value: 0.24047213959271357.
2026-06-01 11:21:42 | INFO | Trial 123 | outer=1 | hidden=[512, 64] epochs=256 lr=3.125e-04 wd=5.597e-05 n_pcs=5000 weight={'name': 'uniform'}
[I 2026-06-01 11:21:56,667] Trial 123 finished with value: 0.2156093824720501 and parameters: {'hidden_dims': '[512, 64]', 'dropout': 0.037282057976549536, 'batch_norm': False, 'lr': 0.0003124888973835993, 'weight_decay': 5.5969415833901213e-05, 'epochs': 256, 'loss': 'mae', 'optimizer': 'adam', 'use_snp_selection': False, 'n_pcs': 5000}. Best is trial 88 with value: 0.24047213959271357.
2026-06-01 11:21:56 | INFO | Trial 124 | outer=1 | hidden=[512, 64] epochs=289 lr=4.176e-04 wd=8.533e-05 n_pcs=5000 weight={'name': 'uniform'}
[I 2026-06-01 11:22:12,856] Trial 124 finished with value: 0.21682008513294462 and parameters: {'hidden_dims': '[512, 64]', 'dropout': 0.05873864583614485, 'batch_norm': False, 'lr': 0.0004175531731916875, 'weight_decay': 8.532883419844458e-05, 'epochs': 289, 'loss': 'mae', 'optimizer': 'adam', 'use_snp_selection': False, 'n_pcs': 5000}. Best is trial 88 with value: 0.24047213959271357.
2026-06-01 11:22:12 | INFO | Trial 125 | outer=1 | hidden=[512, 64] epochs=244 lr=4.643e-04 wd=1.588e-04 n_pcs=4500 weight={'name': 'uniform'}
[I 2026-06-01 11:22:26,050] Trial 125 finished with value: 0.212005893966074 and parameters: {'hidden_dims': '[512, 64]', 'dropout': 0.21637574508003943, 'batch_norm': False, 'lr': 0.00046425534376285234, 'weight_decay': 0.00015882419198108672, 'epochs': 244, 'loss': 'mae', 'optimizer': 'adam', 'use_snp_selection': False, 'n_pcs': 4500}. Best is trial 88 with value: 0.24047213959271357.
2026-06-01 11:22:26 | INFO | Trial 126 | outer=1 | hidden=[512, 64] epochs=270 lr=3.528e-04 wd=2.772e-05 n_pcs=5000 weight={'name': 'uniform'}
[I 2026-06-01 11:22:41,296] Trial 126 finished with value: 0.23091148121873073 and parameters: {'hidden_dims': '[512, 64]', 'dropout': 0.1148348742487926, 'batch_norm': False, 'lr': 0.00035282353699275245, 'weight_decay': 2.771958732909284e-05, 'epochs': 270, 'loss': 'mae', 'optimizer': 'adam', 'use_snp_selection': False, 'n_pcs': 5000}. Best is trial 88 with value: 0.24047213959271357.
2026-06-01 11:22:41 | INFO | Trial 127 | outer=1 | hidden=[128, 64] epochs=270 lr=2.834e-04 wd=2.674e-05 n_pcs=4500 weight={'name': 'uniform'}
[I 2026-06-01 11:22:47,226] Trial 127 finished with value: 0.19462976266084342 and parameters: {'hidden_dims': '[128, 64]', 'dropout': 0.12898378050946702, 'batch_norm': False, 'lr': 0.0002833951651979729, 'weight_decay': 2.6743306918182653e-05, 'epochs': 270, 'loss': 'mae', 'optimizer': 'adam', 'use_snp_selection': False, 'n_pcs': 4500}. Best is trial 88 with value: 0.24047213959271357.
2026-06-01 11:22:47 | INFO | Trial 128 | outer=1 | hidden=[512, 64] epochs=261 lr=2.423e-04 wd=4.246e-05 n_pcs=500 weight={'name': 'uniform'}
[I 2026-06-01 11:22:51,668] Trial 128 finished with value: 0.17902212250222396 and parameters: {'hidden_dims': '[512, 64]', 'dropout': 0.32595093697405253, 'batch_norm': False, 'lr': 0.0002422773509818269, 'weight_decay': 4.24636684849004e-05, 'epochs': 261, 'loss': 'mae', 'optimizer': 'adam', 'use_snp_selection': False, 'n_pcs': 500}. Best is trial 88 with value: 0.24047213959271357.
2026-06-01 11:22:51 | INFO | Trial 129 | outer=1 | hidden=[512, 128] epochs=238 lr=3.398e-04 wd=1.060e-04 n_pcs=5000 weight={'name': 'uniform'}
[I 2026-06-01 11:23:05,628] Trial 129 finished with value: 0.21974251970126946 and parameters: {'hidden_dims': '[512, 128]', 'dropout': 0.11308031595243394, 'batch_norm': False, 'lr': 0.0003397542761883663, 'weight_decay': 0.00010599060625104907, 'epochs': 238, 'loss': 'mae', 'optimizer': 'adam', 'use_snp_selection': False, 'n_pcs': 5000}. Best is trial 88 with value: 0.24047213959271357.
2026-06-01 11:23:05 | INFO | Trial 130 | outer=1 | hidden=[512, 64] epochs=225 lr=4.069e-04 wd=1.668e-05 n_pcs=5000 weight={'name': 'uniform'}
[I 2026-06-01 11:23:18,730] Trial 130 finished with value: 0.21874689813127088 and parameters: {'hidden_dims': '[512, 64]', 'dropout': 0.1564021365373857, 'batch_norm': False, 'lr': 0.00040685626087890803, 'weight_decay': 1.6681187805258048e-05, 'epochs': 225, 'loss': 'mae', 'optimizer': 'adam', 'use_snp_selection': False, 'n_pcs': 5000}. Best is trial 88 with value: 0.24047213959271357.
2026-06-01 11:23:18 | INFO | Trial 131 | outer=1 | hidden=[512, 64] epochs=254 lr=3.628e-04 wd=6.799e-05 n_pcs=5000 weight={'name': 'uniform'}
[I 2026-06-01 11:23:33,247] Trial 131 finished with value: 0.213891971709313 and parameters: {'hidden_dims': '[512, 64]', 'dropout': 0.0899110126572702, 'batch_norm': False, 'lr': 0.0003627502164870122, 'weight_decay': 6.799382726772389e-05, 'epochs': 254, 'loss': 'mae', 'optimizer': 'adam', 'use_snp_selection': False, 'n_pcs': 5000}. Best is trial 88 with value: 0.24047213959271357.
2026-06-01 11:23:33 | INFO | Trial 132 | outer=1 | hidden=[512, 64] epochs=250 lr=3.861e-04 wd=5.103e-05 n_pcs=5000 weight={'name': 'uniform'}
[I 2026-06-01 11:23:47,579] Trial 132 finished with value: 0.22993370661707008 and parameters: {'hidden_dims': '[512, 64]', 'dropout': 0.0723006284348834, 'batch_norm': False, 'lr': 0.0003860938452076267, 'weight_decay': 5.103469228058158e-05, 'epochs': 250, 'loss': 'mae', 'optimizer': 'adam', 'use_snp_selection': False, 'n_pcs': 5000}. Best is trial 88 with value: 0.24047213959271357.
2026-06-01 11:23:47 | INFO | Trial 133 | outer=1 | hidden=[512, 64] epochs=247 lr=3.019e-04 wd=1.241e-04 n_pcs=5000 weight={'name': 'uniform'}
[I 2026-06-01 11:24:01,779] Trial 133 finished with value: 0.24275988731879766 and parameters: {'hidden_dims': '[512, 64]', 'dropout': 0.021314926210468717, 'batch_norm': False, 'lr': 0.0003018943687785321, 'weight_decay': 0.00012409901961963937, 'epochs': 247, 'loss': 'mae', 'optimizer': 'adam', 'use_snp_selection': False, 'n_pcs': 5000}. Best is trial 133 with value: 0.24275988731879766.
2026-06-01 11:24:01 | INFO | Trial 134 | outer=1 | hidden=[512, 64] epochs=159 lr=2.606e-04 wd=2.040e-04 n_pcs=5000 weight={'name': 'uniform'}
[I 2026-06-01 11:24:11,766] Trial 134 finished with value: 0.2160205918743539 and parameters: {'hidden_dims': '[512, 64]', 'dropout': 0.020411801269025136, 'batch_norm': False, 'lr': 0.00026055005553128754, 'weight_decay': 0.00020397185953928217, 'epochs': 159, 'loss': 'mae', 'optimizer': 'adam', 'use_snp_selection': False, 'n_pcs': 5000}. Best is trial 133 with value: 0.24275988731879766.
2026-06-01 11:24:11 | INFO | Trial 135 | outer=1 | hidden=[512, 64] epochs=244 lr=3.049e-04 wd=2.999e-04 n_pcs=4500 weight={'name': 'uniform'}
[I 2026-06-01 11:24:24,974] Trial 135 finished with value: 0.2110364410833069 and parameters: {'hidden_dims': '[512, 64]', 'dropout': 0.18539683356035103, 'batch_norm': False, 'lr': 0.0003048638458323778, 'weight_decay': 0.00029986653590525407, 'epochs': 244, 'loss': 'mae', 'optimizer': 'adam', 'use_snp_selection': False, 'n_pcs': 4500}. Best is trial 133 with value: 0.24275988731879766.
2026-06-01 11:24:24 | INFO | Trial 136 | outer=1 | hidden=[256, 64] epochs=233 lr=3.245e-04 wd=1.354e-04 n_pcs=5000 weight={'name': 'uniform'}
[I 2026-06-01 11:24:29,892] Trial 136 pruned. 
2026-06-01 11:24:29 | INFO | Trial 137 | outer=1 | hidden=[512, 64] epochs=267 lr=4.357e-04 wd=1.816e-04 n_pcs=5000 weight={'name': 'uniform'}
[I 2026-06-01 11:24:45,027] Trial 137 finished with value: 0.2313170644921753 and parameters: {'hidden_dims': '[512, 64]', 'dropout': 0.04537915303936614, 'batch_norm': False, 'lr': 0.000435653122367362, 'weight_decay': 0.00018156899533184627, 'epochs': 267, 'loss': 'mae', 'optimizer': 'adam', 'use_snp_selection': False, 'n_pcs': 5000}. Best is trial 133 with value: 0.24275988731879766.
2026-06-01 11:24:45 | INFO | Trial 138 | outer=1 | hidden=[256, 128] epochs=229 lr=4.451e-04 wd=1.776e-04 n_pcs=4500 weight={'name': 'uniform'}
[I 2026-06-01 11:24:52,963] Trial 138 finished with value: 0.2016445725582848 and parameters: {'hidden_dims': '[256, 128]', 'dropout': 0.0323464005783007, 'batch_norm': False, 'lr': 0.0004450540592071835, 'weight_decay': 0.00017756576733930394, 'epochs': 229, 'loss': 'mae', 'optimizer': 'adam', 'use_snp_selection': False, 'n_pcs': 4500}. Best is trial 133 with value: 0.24275988731879766.
2026-06-01 11:24:52 | INFO | Trial 139 | outer=1 | hidden=[512, 256] epochs=238 lr=4.232e-04 wd=2.429e-04 n_pcs=4000 weight={'name': 'uniform'}
[I 2026-06-01 11:25:05,445] Trial 139 finished with value: 0.2107636139110193 and parameters: {'hidden_dims': '[512, 256]', 'dropout': 0.04707282449609823, 'batch_norm': False, 'lr': 0.00042324437928486873, 'weight_decay': 0.00024287920785040024, 'epochs': 238, 'loss': 'mse', 'optimizer': 'adam', 'use_snp_selection': False, 'n_pcs': 4000}. Best is trial 133 with value: 0.24275988731879766.
2026-06-01 11:25:05 | INFO | Trial 140 | outer=1 | hidden=[512, 64] epochs=198 lr=4.769e-04 wd=1.677e-06 n_pcs=5000 weight={'name': 'uniform'}
[I 2026-06-01 11:25:17,240] Trial 140 finished with value: 0.21720347381107952 and parameters: {'hidden_dims': '[512, 64]', 'dropout': 0.35881450414720073, 'batch_norm': False, 'lr': 0.0004769160196226953, 'weight_decay': 1.6772668471741768e-06, 'epochs': 198, 'loss': 'mae', 'optimizer': 'adam', 'use_snp_selection': False, 'n_pcs': 5000}. Best is trial 133 with value: 0.24275988731879766.
2026-06-01 11:25:17 | INFO | Trial 141 | outer=1 | hidden=[512, 64] epochs=269 lr=2.871e-04 wd=1.010e-04 n_pcs=5000 weight={'name': 'uniform'}
[I 2026-06-01 11:25:32,478] Trial 141 finished with value: 0.21875652085353897 and parameters: {'hidden_dims': '[512, 64]', 'dropout': 0.01620884240125507, 'batch_norm': False, 'lr': 0.0002870989005729885, 'weight_decay': 0.00010099803649974833, 'epochs': 269, 'loss': 'mae', 'optimizer': 'adam', 'use_snp_selection': False, 'n_pcs': 5000}. Best is trial 133 with value: 0.24275988731879766.
2026-06-01 11:25:32 | INFO | Trial 142 | outer=1 | hidden=[512, 64] epochs=276 lr=3.468e-04 wd=1.238e-04 n_pcs=5000 weight={'name': 'uniform'}
[I 2026-06-01 11:25:48,033] Trial 142 finished with value: 0.2300636404644763 and parameters: {'hidden_dims': '[512, 64]', 'dropout': 0.07182826840671958, 'batch_norm': False, 'lr': 0.00034683084561638595, 'weight_decay': 0.00012378073836211297, 'epochs': 276, 'loss': 'mae', 'optimizer': 'adam', 'use_snp_selection': False, 'n_pcs': 5000}. Best is trial 133 with value: 0.24275988731879766.
2026-06-01 11:25:48 | INFO | Trial 143 | outer=1 | hidden=[512, 64] epochs=263 lr=3.846e-04 wd=4.643e-04 n_pcs=5000 weight={'name': 'uniform'}
[I 2026-06-01 11:26:02,993] Trial 143 finished with value: 0.23093557181343466 and parameters: {'hidden_dims': '[512, 64]', 'dropout': 0.13926943419967644, 'batch_norm': False, 'lr': 0.0003845775815808827, 'weight_decay': 0.00046428754444839785, 'epochs': 263, 'loss': 'mae', 'optimizer': 'adam', 'use_snp_selection': False, 'n_pcs': 5000}. Best is trial 133 with value: 0.24275988731879766.
2026-06-01 11:26:03 | INFO | Trial 144 | outer=1 | hidden=[512, 64] epochs=263 lr=3.905e-04 wd=5.919e-04 n_pcs=5000 weight={'name': 'uniform'}
[I 2026-06-01 11:26:17,931] Trial 144 finished with value: 0.23660430918328101 and parameters: {'hidden_dims': '[512, 64]', 'dropout': 0.1433072508740286, 'batch_norm': False, 'lr': 0.0003904788621704993, 'weight_decay': 0.0005918543235846594, 'epochs': 263, 'loss': 'mae', 'optimizer': 'adam', 'use_snp_selection': False, 'n_pcs': 5000}. Best is trial 133 with value: 0.24275988731879766.
2026-06-01 11:26:17 | INFO | Trial 145 | outer=1 | hidden=[1024, 256] epochs=249 lr=8.938e-05 wd=7.813e-04 n_pcs=1500 weight={'name': 'uniform'}
[I 2026-06-01 11:26:29,682] Trial 145 finished with value: 0.2111437173358155 and parameters: {'hidden_dims': '[1024, 256]', 'dropout': 0.038154762314174126, 'batch_norm': False, 'lr': 8.937953819597939e-05, 'weight_decay': 0.0007813114829543246, 'epochs': 249, 'loss': 'mae', 'optimizer': 'adam', 'use_snp_selection': False, 'n_pcs': 1500}. Best is trial 133 with value: 0.24275988731879766.
2026-06-01 11:26:29 | INFO | Trial 146 | outer=1 | hidden=[128, 64] epochs=221 lr=4.976e-04 wd=5.873e-04 n_pcs=4500 weight={'name': 'uniform'}
[I 2026-06-01 11:26:34,939] Trial 146 finished with value: 0.20964452834141806 and parameters: {'hidden_dims': '[128, 64]', 'dropout': 0.0852660999600653, 'batch_norm': False, 'lr': 0.0004976060186657756, 'weight_decay': 0.0005872866908590551, 'epochs': 221, 'loss': 'mae', 'optimizer': 'adam', 'use_snp_selection': False, 'n_pcs': 4500}. Best is trial 133 with value: 0.24275988731879766.
2026-06-01 11:26:34 | INFO | Trial 147 | outer=1 | hidden=[512, 64] epochs=244 lr=4.447e-04 wd=9.764e-04 n_pcs=1000 weight={'name': 'uniform'}
[I 2026-06-01 11:26:40,086] Trial 147 finished with value: 0.20380955705261378 and parameters: {'hidden_dims': '[512, 64]', 'dropout': 0.02680056767420576, 'batch_norm': False, 'lr': 0.0004446690356011002, 'weight_decay': 0.000976440827828931, 'epochs': 244, 'loss': 'mse', 'optimizer': 'adam', 'use_snp_selection': False, 'n_pcs': 1000}. Best is trial 133 with value: 0.24275988731879766.
2026-06-01 11:26:40 | INFO | Trial 148 | outer=1 | hidden=[512, 64] epochs=260 lr=3.422e-05 wd=3.607e-04 n_pcs=2500 weight={'name': 'uniform'}
[I 2026-06-01 11:26:48,805] Trial 148 finished with value: 0.18916465574225022 and parameters: {'hidden_dims': '[512, 64]', 'dropout': 0.060326920435408465, 'batch_norm': False, 'lr': 3.42191149014976e-05, 'weight_decay': 0.00036069093313176277, 'epochs': 260, 'loss': 'mae', 'optimizer': 'adam', 'use_snp_selection': False, 'n_pcs': 2500}. Best is trial 133 with value: 0.24275988731879766.
2026-06-01 11:26:48 | INFO | Trial 149 | outer=1 | hidden=[512, 64] epochs=251 lr=2.282e-04 wd=2.981e-04 n_pcs=5000 weight={'name': 'uniform'}
[I 2026-06-01 11:27:03,144] Trial 149 finished with value: 0.21373163536129508 and parameters: {'hidden_dims': '[512, 64]', 'dropout': 0.1540564362009877, 'batch_norm': False, 'lr': 0.0002282031793062184, 'weight_decay': 0.0002981261601422174, 'epochs': 251, 'loss': 'mae', 'optimizer': 'adam', 'use_snp_selection': False, 'n_pcs': 5000}. Best is trial 133 with value: 0.24275988731879766.
2026-06-01 11:27:03 | INFO | OUTER 1 best (inner mean r=0.2428): model={'hidden_dims': [512, 64], 'dropout': 0.021314926210468717, 'batch_norm': False, 'lr': 0.0003018943687785321, 'weight_decay': 0.00012409901961963937, 'epochs': 247, 'loss': 'mae', 'optimizer': 'adam', 'use_snp_selection': False, 'n_pcs': 5000} weighting={'name': 'uniform'}
2026-06-01 11:27:04 | INFO | OUTER 1 TEST r = 0.2449
2026-06-01 11:27:04 | INFO | OUTER 1 incremental summary saved to outputs/final_results/e8_pc_mlp_uniform/thr_wing/e8_pc_mlp_uniform_thr_wing_results.json
2026-06-01 11:27:04 | INFO | OUTER 2: test_size=92 island=1 (Myken)
2026-06-01 11:27:04 | INFO | OUTER 2: inner LOIO validation islands: 0(Nesøy), 2(Træna), 3(Selvær), 4(Gjerøy), 5(Hestmannøy), 6(Indre Kvarøy), 7(Onøy og Lurøy), 8(Lovund), 9(Sleneset), 10(Aldra), 11(Leka), 12(Vega), 13(Vikna), 14(Lauvøya)
2026-06-01 11:27:04 | INFO | OUTER 2: using top 10 related inner validation islands for tuning: 3(Selvær, avgGRM=0.0212), 2(Træna, avgGRM=0.0152), 8(Lovund, avgGRM=0.0084), 0(Nesøy, avgGRM=0.0066), 9(Sleneset, avgGRM=0.0044), 7(Onøy og Lurøy, avgGRM=0.0024), 5(Hestmannøy, avgGRM=0.0014), 6(Indre Kvarøy, avgGRM=0.0009), 4(Gjerøy, avgGRM=-0.0004), 10(Aldra, avgGRM=-0.0036)
[I 2026-06-01 11:27:04,709] A new study created in memory with name: mlp_importance_inner_outer1
2026-06-01 11:27:04 | INFO | Trial 0 | outer=2 | hidden=[256, 64] epochs=252 lr=8.243e-05 wd=1.277e-07 n_pcs=1500 weight={'name': 'uniform'}
[I 2026-06-01 11:27:09,319] Trial 0 finished with value: 0.17892794662298242 and parameters: {'hidden_dims': '[256, 64]', 'dropout': 0.19097065492325918, 'batch_norm': False, 'lr': 8.242985198911028e-05, 'weight_decay': 1.277246473139888e-07, 'epochs': 252, 'loss': 'mae', 'optimizer': 'adamw', 'use_snp_selection': False, 'n_pcs': 1500}. Best is trial 0 with value: 0.17892794662298242.
2026-06-01 11:27:09 | INFO | Trial 1 | outer=2 | hidden=[1024, 256] epochs=225 lr=1.391e-04 wd=1.941e-07 n_pcs=500 weight={'name': 'uniform'}
[I 2026-06-01 11:27:15,855] Trial 1 finished with value: 0.15305818675906918 and parameters: {'hidden_dims': '[1024, 256]', 'dropout': 0.2849434595702811, 'batch_norm': False, 'lr': 0.00013909108684683413, 'weight_decay': 1.9407167964924495e-07, 'epochs': 225, 'loss': 'mse', 'optimizer': 'adamw', 'use_snp_selection': False, 'n_pcs': 500}. Best is trial 0 with value: 0.17892794662298242.
2026-06-01 11:27:15 | INFO | Trial 2 | outer=2 | hidden=[256, 64] epochs=139 lr=3.957e-05 wd=3.750e-05 n_pcs=2500 weight={'name': 'uniform'}
[I 2026-06-01 11:27:19,776] Trial 2 finished with value: 0.15760619823991082 and parameters: {'hidden_dims': '[256, 64]', 'dropout': 0.11392712587675291, 'batch_norm': False, 'lr': 3.9573351157697276e-05, 'weight_decay': 3.7502337000845044e-05, 'epochs': 139, 'loss': 'mae', 'optimizer': 'adam', 'use_snp_selection': False, 'n_pcs': 2500}. Best is trial 0 with value: 0.17892794662298242.
2026-06-01 11:27:19 | INFO | Trial 3 | outer=2 | hidden=[128, 64] epochs=164 lr=1.538e-05 wd=3.248e-06 n_pcs=3000 weight={'name': 'uniform'}
[I 2026-06-01 11:27:23,575] Trial 3 finished with value: 0.09681957143261535 and parameters: {'hidden_dims': '[128, 64]', 'dropout': 0.1479874991503876, 'batch_norm': False, 'lr': 1.5380732370316375e-05, 'weight_decay': 3.2478890969962294e-06, 'epochs': 164, 'loss': 'mse', 'optimizer': 'adam', 'use_snp_selection': False, 'n_pcs': 3000}. Best is trial 0 with value: 0.17892794662298242.
2026-06-01 11:27:23 | INFO | Trial 4 | outer=2 | hidden=[256, 128] epochs=210 lr=7.298e-05 wd=7.875e-06 n_pcs=3000 weight={'name': 'uniform'}
[I 2026-06-01 11:27:29,367] Trial 4 finished with value: 0.16992584151440634 and parameters: {'hidden_dims': '[256, 128]', 'dropout': 0.09917626474860408, 'batch_norm': False, 'lr': 7.298380589156323e-05, 'weight_decay': 7.875094299510188e-06, 'epochs': 210, 'loss': 'mae', 'optimizer': 'adam', 'use_snp_selection': False, 'n_pcs': 3000}. Best is trial 0 with value: 0.17892794662298242.
2026-06-01 11:27:29 | INFO | Trial 5 | outer=2 | hidden=[512, 128] epochs=284 lr=5.467e-05 wd=5.496e-06 n_pcs=4000 weight={'name': 'uniform'}
[I 2026-06-01 11:27:43,156] Trial 5 finished with value: 0.18508117496488147 and parameters: {'hidden_dims': '[512, 128]', 'dropout': 0.3143696126156032, 'batch_norm': False, 'lr': 5.46667545989349e-05, 'weight_decay': 5.496446859789657e-06, 'epochs': 284, 'loss': 'mse', 'optimizer': 'adamw', 'use_snp_selection': False, 'n_pcs': 4000}. Best is trial 5 with value: 0.18508117496488147.
2026-06-01 11:27:43 | INFO | Trial 6 | outer=2 | hidden=[512, 64] epochs=90 lr=3.103e-05 wd=6.607e-08 n_pcs=5000 weight={'name': 'uniform'}
[I 2026-06-01 11:27:47,084] Trial 6 pruned. 
2026-06-01 11:27:47 | INFO | Trial 7 | outer=2 | hidden=[128, 64] epochs=272 lr=1.348e-05 wd=1.075e-07 n_pcs=4000 weight={'name': 'uniform'}
[I 2026-06-01 11:27:50,382] Trial 7 pruned. 
2026-06-01 11:27:50 | INFO | Trial 8 | outer=2 | hidden=[128, 64] epochs=205 lr=1.815e-05 wd=5.764e-06 n_pcs=3000 weight={'name': 'uniform'}
[I 2026-06-01 11:27:52,935] Trial 8 pruned. 
2026-06-01 11:27:52 | INFO | Trial 9 | outer=2 | hidden=[128, 64] epochs=296 lr=2.338e-05 wd=1.066e-07 n_pcs=2500 weight={'name': 'uniform'}
[I 2026-06-01 11:27:58,352] Trial 9 finished with value: 0.18820694761241152 and parameters: {'hidden_dims': '[128, 64]', 'dropout': 0.17607378181405245, 'batch_norm': False, 'lr': 2.3379083621874488e-05, 'weight_decay': 1.0663581123617794e-07, 'epochs': 296, 'loss': 'mae', 'optimizer': 'adam', 'use_snp_selection': False, 'n_pcs': 2500}. Best is trial 9 with value: 0.18820694761241152.
2026-06-01 11:27:58 | INFO | Trial 10 | outer=2 | hidden=[512, 256] epochs=110 lr=3.984e-04 wd=9.453e-04 n_pcs=1500 weight={'name': 'uniform'}
[I 2026-06-01 11:28:02,503] Trial 10 finished with value: 0.17352979597861234 and parameters: {'hidden_dims': '[512, 256]', 'dropout': 0.02309895975550147, 'batch_norm': False, 'lr': 0.0003983594610602333, 'weight_decay': 0.0009452683165453212, 'epochs': 110, 'loss': 'mae', 'optimizer': 'adam', 'use_snp_selection': False, 'n_pcs': 1500}. Best is trial 9 with value: 0.18820694761241152.
2026-06-01 11:28:02 | INFO | Trial 11 | outer=2 | hidden=[512, 128] epochs=295 lr=3.379e-05 wd=6.674e-07 n_pcs=4500 weight={'name': 'uniform'}
[I 2026-06-01 11:28:18,260] Trial 11 finished with value: 0.1866543207621397 and parameters: {'hidden_dims': '[512, 128]', 'dropout': 0.38350063812581786, 'batch_norm': False, 'lr': 3.3788163816477563e-05, 'weight_decay': 6.674217827105988e-07, 'epochs': 295, 'loss': 'mae', 'optimizer': 'adamw', 'use_snp_selection': False, 'n_pcs': 4500}. Best is trial 9 with value: 0.18820694761241152.
2026-06-01 11:28:18 | INFO | Trial 12 | outer=2 | hidden=[512, 128] epochs=294 lr=2.627e-05 wd=1.415e-08 n_pcs=5000 weight={'name': 'uniform'}
[I 2026-06-01 11:28:34,910] Trial 12 finished with value: 0.18702658757950946 and parameters: {'hidden_dims': '[512, 128]', 'dropout': 0.5771900703787537, 'batch_norm': False, 'lr': 2.6268979821751546e-05, 'weight_decay': 1.4151425112137584e-08, 'epochs': 294, 'loss': 'mae', 'optimizer': 'adamw', 'use_snp_selection': False, 'n_pcs': 5000}. Best is trial 9 with value: 0.18820694761241152.
2026-06-01 11:28:34 | INFO | Trial 13 | outer=2 | hidden=[512, 128] epochs=245 lr=2.270e-05 wd=1.072e-08 n_pcs=2000 weight={'name': 'uniform'}
[I 2026-06-01 11:28:41,662] Trial 13 pruned. 
2026-06-01 11:28:41 | INFO | Trial 14 | outer=2 | hidden=[1024, 256] epochs=299 lr=1.016e-05 wd=1.717e-08 n_pcs=4000 weight={'name': 'uniform'}
