[I 2026-06-01 11:32:18,303] Trial 59 finished with value: 0.20672914208998444 and parameters: {'hidden_dims': '[1024, 256]', 'dropout': 0.30467653627877833, 'batch_norm': False, 'lr': 0.00027056881147555375, 'weight_decay': 3.5458909214055717e-07, 'epochs': 169, 'loss': 'mae', 'optimizer': 'adamw', 'use_snp_selection': False, 'n_pcs': 5000}. Best is trial 59 with value: 0.20672914208998444.
2026-06-01 11:32:18 | INFO | Trial 60 | outer=2 | hidden=[1024, 256] epochs=169 lr=3.175e-04 wd=3.559e-07 n_pcs=5000 weight={'name': 'uniform'}
[I 2026-06-01 11:32:37,528] Trial 60 finished with value: 0.2216237857210345 and parameters: {'hidden_dims': '[1024, 256]', 'dropout': 0.2738724669219241, 'batch_norm': False, 'lr': 0.0003175202613636029, 'weight_decay': 3.559427975136885e-07, 'epochs': 169, 'loss': 'mae', 'optimizer': 'adamw', 'use_snp_selection': False, 'n_pcs': 5000}. Best is trial 60 with value: 0.2216237857210345.
2026-06-01 11:32:37 | INFO | Trial 61 | outer=2 | hidden=[1024, 256] epochs=165 lr=3.168e-04 wd=4.132e-07 n_pcs=5000 weight={'name': 'uniform'}
[I 2026-06-01 11:32:56,377] Trial 61 finished with value: 0.2172519026890694 and parameters: {'hidden_dims': '[1024, 256]', 'dropout': 0.2566792771792898, 'batch_norm': False, 'lr': 0.00031676553628037486, 'weight_decay': 4.1322970041499593e-07, 'epochs': 165, 'loss': 'mae', 'optimizer': 'adamw', 'use_snp_selection': False, 'n_pcs': 5000}. Best is trial 60 with value: 0.2216237857210345.
2026-06-01 11:32:56 | INFO | Trial 62 | outer=2 | hidden=[1024, 256] epochs=172 lr=3.094e-04 wd=4.447e-07 n_pcs=5000 weight={'name': 'uniform'}
[I 2026-06-01 11:33:15,899] Trial 62 finished with value: 0.20710302285213902 and parameters: {'hidden_dims': '[1024, 256]', 'dropout': 0.257608369264525, 'batch_norm': False, 'lr': 0.0003094443687120517, 'weight_decay': 4.4474227779680834e-07, 'epochs': 172, 'loss': 'mae', 'optimizer': 'adamw', 'use_snp_selection': False, 'n_pcs': 5000}. Best is trial 60 with value: 0.2216237857210345.
2026-06-01 11:33:15 | INFO | Trial 63 | outer=2 | hidden=[1024, 256] epochs=169 lr=3.131e-04 wd=4.451e-07 n_pcs=5000 weight={'name': 'uniform'}
[I 2026-06-01 11:33:35,121] Trial 63 finished with value: 0.21220985785039467 and parameters: {'hidden_dims': '[1024, 256]', 'dropout': 0.2720028774586787, 'batch_norm': False, 'lr': 0.00031313923174704434, 'weight_decay': 4.4509766907775863e-07, 'epochs': 169, 'loss': 'mae', 'optimizer': 'adamw', 'use_snp_selection': False, 'n_pcs': 5000}. Best is trial 60 with value: 0.2216237857210345.
2026-06-01 11:33:35 | INFO | Trial 64 | outer=2 | hidden=[1024, 256] epochs=171 lr=3.297e-04 wd=4.636e-07 n_pcs=5000 weight={'name': 'uniform'}
[I 2026-06-01 11:33:54,542] Trial 64 finished with value: 0.21127536365035976 and parameters: {'hidden_dims': '[1024, 256]', 'dropout': 0.2587816803855375, 'batch_norm': False, 'lr': 0.0003297320086787424, 'weight_decay': 4.635647388138091e-07, 'epochs': 171, 'loss': 'mae', 'optimizer': 'adamw', 'use_snp_selection': False, 'n_pcs': 5000}. Best is trial 60 with value: 0.2216237857210345.
2026-06-01 11:33:54 | INFO | Trial 65 | outer=2 | hidden=[1024, 256] epochs=168 lr=3.214e-04 wd=4.155e-07 n_pcs=5000 weight={'name': 'uniform'}
[I 2026-06-01 11:34:13,676] Trial 65 finished with value: 0.2136733430037559 and parameters: {'hidden_dims': '[1024, 256]', 'dropout': 0.2654562923220434, 'batch_norm': False, 'lr': 0.0003214452186455556, 'weight_decay': 4.155387793707579e-07, 'epochs': 168, 'loss': 'mae', 'optimizer': 'adamw', 'use_snp_selection': False, 'n_pcs': 5000}. Best is trial 60 with value: 0.2216237857210345.
2026-06-01 11:34:13 | INFO | Trial 66 | outer=2 | hidden=[1024, 256] epochs=167 lr=3.080e-04 wd=4.248e-07 n_pcs=5000 weight={'name': 'uniform'}
[I 2026-06-01 11:34:32,678] Trial 66 finished with value: 0.21655525424731983 and parameters: {'hidden_dims': '[1024, 256]', 'dropout': 0.2607116839846935, 'batch_norm': False, 'lr': 0.0003079751477466888, 'weight_decay': 4.247566973123614e-07, 'epochs': 167, 'loss': 'mae', 'optimizer': 'adamw', 'use_snp_selection': False, 'n_pcs': 5000}. Best is trial 60 with value: 0.2216237857210345.
2026-06-01 11:34:32 | INFO | Trial 67 | outer=2 | hidden=[1024, 256] epochs=197 lr=3.215e-04 wd=4.447e-07 n_pcs=5000 weight={'name': 'uniform'}
[I 2026-06-01 11:34:54,640] Trial 67 finished with value: 0.21099573298140079 and parameters: {'hidden_dims': '[1024, 256]', 'dropout': 0.26130715561162704, 'batch_norm': False, 'lr': 0.00032145144674859325, 'weight_decay': 4.447238083985248e-07, 'epochs': 197, 'loss': 'mae', 'optimizer': 'adamw', 'use_snp_selection': False, 'n_pcs': 5000}. Best is trial 60 with value: 0.2216237857210345.
2026-06-01 11:34:54 | INFO | Trial 68 | outer=2 | hidden=[1024, 256] epochs=191 lr=3.795e-04 wd=1.327e-07 n_pcs=4500 weight={'name': 'uniform'}
[I 2026-06-01 11:35:14,347] Trial 68 finished with value: 0.20538585806874185 and parameters: {'hidden_dims': '[1024, 256]', 'dropout': 0.193682798230003, 'batch_norm': False, 'lr': 0.0003795498228145364, 'weight_decay': 1.3274212873876043e-07, 'epochs': 191, 'loss': 'mae', 'optimizer': 'adamw', 'use_snp_selection': False, 'n_pcs': 4500}. Best is trial 60 with value: 0.2216237857210345.
2026-06-01 11:35:14 | INFO | Trial 69 | outer=2 | hidden=[1024, 256] epochs=199 lr=3.343e-04 wd=6.079e-07 n_pcs=5000 weight={'name': 'uniform'}
[I 2026-06-01 11:35:36,521] Trial 69 finished with value: 0.22061307455351797 and parameters: {'hidden_dims': '[1024, 256]', 'dropout': 0.2769528053505883, 'batch_norm': False, 'lr': 0.00033433069999601496, 'weight_decay': 6.079249251641951e-07, 'epochs': 199, 'loss': 'mae', 'optimizer': 'adamw', 'use_snp_selection': False, 'n_pcs': 5000}. Best is trial 60 with value: 0.2216237857210345.
2026-06-01 11:35:36 | INFO | Trial 70 | outer=2 | hidden=[1024, 256] epochs=158 lr=2.297e-04 wd=6.743e-07 n_pcs=4500 weight={'name': 'uniform'}
[I 2026-06-01 11:35:53,231] Trial 70 finished with value: 0.20466014388364204 and parameters: {'hidden_dims': '[1024, 256]', 'dropout': 0.28145321464718265, 'batch_norm': False, 'lr': 0.0002296921213971337, 'weight_decay': 6.742793989293689e-07, 'epochs': 158, 'loss': 'mae', 'optimizer': 'adamw', 'use_snp_selection': False, 'n_pcs': 4500}. Best is trial 60 with value: 0.2216237857210345.
2026-06-01 11:35:53 | INFO | Trial 71 | outer=2 | hidden=[1024, 256] epochs=196 lr=3.230e-04 wd=4.968e-07 n_pcs=5000 weight={'name': 'uniform'}
[I 2026-06-01 11:36:15,118] Trial 71 finished with value: 0.21131840575124455 and parameters: {'hidden_dims': '[1024, 256]', 'dropout': 0.2367726719000531, 'batch_norm': False, 'lr': 0.00032296836796287374, 'weight_decay': 4.968278009487377e-07, 'epochs': 196, 'loss': 'mae', 'optimizer': 'adamw', 'use_snp_selection': False, 'n_pcs': 5000}. Best is trial 60 with value: 0.2216237857210345.
2026-06-01 11:36:15 | INFO | Trial 72 | outer=2 | hidden=[1024, 256] epochs=217 lr=3.536e-04 wd=2.070e-07 n_pcs=5000 weight={'name': 'uniform'}
[I 2026-06-01 11:36:39,064] Trial 72 finished with value: 0.2183009761800141 and parameters: {'hidden_dims': '[1024, 256]', 'dropout': 0.21954738988825154, 'batch_norm': False, 'lr': 0.00035358783106144816, 'weight_decay': 2.06976195896958e-07, 'epochs': 217, 'loss': 'mae', 'optimizer': 'adamw', 'use_snp_selection': False, 'n_pcs': 5000}. Best is trial 60 with value: 0.2216237857210345.
2026-06-01 11:36:39 | INFO | Trial 73 | outer=2 | hidden=[1024, 256] epochs=217 lr=3.611e-04 wd=2.008e-07 n_pcs=5000 weight={'name': 'uniform'}
[I 2026-06-01 11:37:03,003] Trial 73 finished with value: 0.20158721129164334 and parameters: {'hidden_dims': '[1024, 256]', 'dropout': 0.21220642298484887, 'batch_norm': False, 'lr': 0.00036114276167129267, 'weight_decay': 2.0080501157514116e-07, 'epochs': 217, 'loss': 'mae', 'optimizer': 'adamw', 'use_snp_selection': False, 'n_pcs': 5000}. Best is trial 60 with value: 0.2216237857210345.
2026-06-01 11:37:03 | INFO | Trial 74 | outer=2 | hidden=[1024, 256] epochs=230 lr=2.691e-04 wd=7.946e-08 n_pcs=4500 weight={'name': 'uniform'}
[I 2026-06-01 11:37:26,221] Trial 74 finished with value: 0.20427408350249143 and parameters: {'hidden_dims': '[1024, 256]', 'dropout': 0.16191739870705896, 'batch_norm': False, 'lr': 0.0002690740092111467, 'weight_decay': 7.945857822034593e-08, 'epochs': 230, 'loss': 'mae', 'optimizer': 'adamw', 'use_snp_selection': False, 'n_pcs': 4500}. Best is trial 60 with value: 0.2216237857210345.
2026-06-01 11:37:26 | INFO | Trial 75 | outer=2 | hidden=[1024, 256] epochs=236 lr=2.873e-04 wd=1.072e-07 n_pcs=5000 weight={'name': 'uniform'}
[I 2026-06-01 11:37:52,039] Trial 75 finished with value: 0.20920970766472324 and parameters: {'hidden_dims': '[1024, 256]', 'dropout': 0.23757946067859645, 'batch_norm': False, 'lr': 0.0002872920414687337, 'weight_decay': 1.0723046701573167e-07, 'epochs': 236, 'loss': 'mae', 'optimizer': 'adamw', 'use_snp_selection': False, 'n_pcs': 5000}. Best is trial 60 with value: 0.2216237857210345.
2026-06-01 11:37:52 | INFO | Trial 76 | outer=2 | hidden=[1024, 256] epochs=184 lr=3.943e-04 wd=7.859e-07 n_pcs=4000 weight={'name': 'uniform'}
[I 2026-06-01 11:38:09,540] Trial 76 finished with value: 0.19377103899563505 and parameters: {'hidden_dims': '[1024, 256]', 'dropout': 0.3292195975360462, 'batch_norm': False, 'lr': 0.0003943412995593159, 'weight_decay': 7.859211265972001e-07, 'epochs': 184, 'loss': 'mse', 'optimizer': 'adamw', 'use_snp_selection': False, 'n_pcs': 4000}. Best is trial 60 with value: 0.2216237857210345.
2026-06-01 11:38:09 | INFO | Trial 77 | outer=2 | hidden=[1024, 256] epochs=198 lr=1.782e-04 wd=2.752e-06 n_pcs=5000 weight={'name': 'uniform'}
[I 2026-06-01 11:38:31,619] Trial 77 finished with value: 0.20580049968179698 and parameters: {'hidden_dims': '[1024, 256]', 'dropout': 0.2798374363457225, 'batch_norm': False, 'lr': 0.00017819135642060962, 'weight_decay': 2.75210508048445e-06, 'epochs': 198, 'loss': 'mae', 'optimizer': 'adamw', 'use_snp_selection': False, 'n_pcs': 5000}. Best is trial 60 with value: 0.2216237857210345.
2026-06-01 11:38:31 | INFO | Trial 78 | outer=2 | hidden=[1024, 256] epochs=207 lr=3.550e-04 wd=2.861e-07 n_pcs=4500 weight={'name': 'uniform'}
[I 2026-06-01 11:38:52,767] Trial 78 finished with value: 0.2132965081364513 and parameters: {'hidden_dims': '[1024, 256]', 'dropout': 0.2122081230799392, 'batch_norm': False, 'lr': 0.0003550320646404138, 'weight_decay': 2.8607297114064315e-07, 'epochs': 207, 'loss': 'mae', 'optimizer': 'adamw', 'use_snp_selection': False, 'n_pcs': 4500}. Best is trial 60 with value: 0.2216237857210345.
2026-06-01 11:38:52 | INFO | Trial 79 | outer=2 | hidden=[1024, 256] epochs=211 lr=4.919e-04 wd=2.737e-07 n_pcs=4500 weight={'name': 'uniform'}
[I 2026-06-01 11:39:14,262] Trial 79 finished with value: 0.21333842718447132 and parameters: {'hidden_dims': '[1024, 256]', 'dropout': 0.13487397832318165, 'batch_norm': False, 'lr': 0.000491859937167499, 'weight_decay': 2.7368004053783446e-07, 'epochs': 211, 'loss': 'mae', 'optimizer': 'adamw', 'use_snp_selection': False, 'n_pcs': 4500}. Best is trial 60 with value: 0.2216237857210345.
2026-06-01 11:39:14 | INFO | Trial 80 | outer=2 | hidden=[1024, 256] epochs=211 lr=4.535e-04 wd=2.518e-07 n_pcs=4000 weight={'name': 'uniform'}
[I 2026-06-01 11:39:33,986] Trial 80 finished with value: 0.20560252781914415 and parameters: {'hidden_dims': '[1024, 256]', 'dropout': 0.12947687203558816, 'batch_norm': False, 'lr': 0.00045351890199856056, 'weight_decay': 2.5184108761731257e-07, 'epochs': 211, 'loss': 'mae', 'optimizer': 'adamw', 'use_snp_selection': False, 'n_pcs': 4000}. Best is trial 60 with value: 0.2216237857210345.
2026-06-01 11:39:34 | INFO | Trial 81 | outer=2 | hidden=[1024, 256] epochs=270 lr=4.991e-04 wd=1.601e-07 n_pcs=4500 weight={'name': 'uniform'}
[I 2026-06-01 11:40:00,820] Trial 81 finished with value: 0.21527783143325802 and parameters: {'hidden_dims': '[1024, 256]', 'dropout': 0.20428282261211317, 'batch_norm': False, 'lr': 0.0004990638767583566, 'weight_decay': 1.6013417717243916e-07, 'epochs': 270, 'loss': 'mae', 'optimizer': 'adamw', 'use_snp_selection': False, 'n_pcs': 4500}. Best is trial 60 with value: 0.2216237857210345.
2026-06-01 11:40:00 | INFO | Trial 82 | outer=2 | hidden=[1024, 256] epochs=265 lr=4.967e-04 wd=5.314e-08 n_pcs=4500 weight={'name': 'uniform'}
[I 2026-06-01 11:40:27,201] Trial 82 finished with value: 0.21693277476136266 and parameters: {'hidden_dims': '[1024, 256]', 'dropout': 0.20338534637362382, 'batch_norm': False, 'lr': 0.0004967191847779794, 'weight_decay': 5.3140561747087806e-08, 'epochs': 265, 'loss': 'mae', 'optimizer': 'adamw', 'use_snp_selection': False, 'n_pcs': 4500}. Best is trial 60 with value: 0.2216237857210345.
2026-06-01 11:40:27 | INFO | Trial 83 | outer=2 | hidden=[1024, 256] epochs=262 lr=4.715e-04 wd=4.442e-08 n_pcs=4500 weight={'name': 'uniform'}
[I 2026-06-01 11:40:53,333] Trial 83 finished with value: 0.20051748989896878 and parameters: {'hidden_dims': '[1024, 256]', 'dropout': 0.17935063959542707, 'batch_norm': False, 'lr': 0.0004715178212717662, 'weight_decay': 4.441879813768007e-08, 'epochs': 262, 'loss': 'mae', 'optimizer': 'adamw', 'use_snp_selection': False, 'n_pcs': 4500}. Best is trial 60 with value: 0.2216237857210345.
2026-06-01 11:40:53 | INFO | Trial 84 | outer=2 | hidden=[1024, 256] epochs=274 lr=4.030e-04 wd=1.623e-07 n_pcs=4500 weight={'name': 'uniform'}
[I 2026-06-01 11:41:20,527] Trial 84 finished with value: 0.2039310782615859 and parameters: {'hidden_dims': '[1024, 256]', 'dropout': 0.2978431426860131, 'batch_norm': False, 'lr': 0.00040301621320624104, 'weight_decay': 1.6225111459266978e-07, 'epochs': 274, 'loss': 'mae', 'optimizer': 'adamw', 'use_snp_selection': False, 'n_pcs': 4500}. Best is trial 60 with value: 0.2216237857210345.
2026-06-01 11:41:20 | INFO | Trial 85 | outer=2 | hidden=[1024, 256] epochs=255 lr=4.062e-05 wd=5.920e-08 n_pcs=5000 weight={'name': 'uniform'}
[I 2026-06-01 11:41:48,218] Trial 85 finished with value: 0.19461504622954248 and parameters: {'hidden_dims': '[1024, 256]', 'dropout': 0.2101967957009004, 'batch_norm': False, 'lr': 4.0620572494900804e-05, 'weight_decay': 5.920461136002164e-08, 'epochs': 255, 'loss': 'mae', 'optimizer': 'adamw', 'use_snp_selection': False, 'n_pcs': 5000}. Best is trial 60 with value: 0.2216237857210345.
2026-06-01 11:41:48 | INFO | Trial 86 | outer=2 | hidden=[1024, 256] epochs=284 lr=4.920e-04 wd=1.318e-07 n_pcs=4500 weight={'name': 'uniform'}
[I 2026-06-01 11:42:16,326] Trial 86 finished with value: 0.20614267289513039 and parameters: {'hidden_dims': '[1024, 256]', 'dropout': 0.1307113374505738, 'batch_norm': False, 'lr': 0.0004919529669474435, 'weight_decay': 1.317521408794496e-07, 'epochs': 284, 'loss': 'mae', 'optimizer': 'adamw', 'use_snp_selection': False, 'n_pcs': 4500}. Best is trial 60 with value: 0.2216237857210345.
2026-06-01 11:42:16 | INFO | Trial 87 | outer=2 | hidden=[1024, 256] epochs=152 lr=4.301e-04 wd=9.990e-08 n_pcs=5000 weight={'name': 'uniform'}
[I 2026-06-01 11:42:33,874] Trial 87 finished with value: 0.19947764727556883 and parameters: {'hidden_dims': '[1024, 256]', 'dropout': 0.07163026689370489, 'batch_norm': False, 'lr': 0.00043013152282925146, 'weight_decay': 9.989629381445627e-08, 'epochs': 152, 'loss': 'mse', 'optimizer': 'adamw', 'use_snp_selection': False, 'n_pcs': 5000}. Best is trial 60 with value: 0.2216237857210345.
2026-06-01 11:42:33 | INFO | Trial 88 | outer=2 | hidden=[1024, 256] epochs=163 lr=3.873e-04 wd=1.311e-06 n_pcs=4000 weight={'name': 'uniform'}
[I 2026-06-01 11:42:49,629] Trial 88 finished with value: 0.19926229767217163 and parameters: {'hidden_dims': '[1024, 256]', 'dropout': 0.24940753130634105, 'batch_norm': False, 'lr': 0.00038733684310576257, 'weight_decay': 1.3114837221121053e-06, 'epochs': 163, 'loss': 'mae', 'optimizer': 'adamw', 'use_snp_selection': False, 'n_pcs': 4000}. Best is trial 60 with value: 0.2216237857210345.
2026-06-01 11:42:49 | INFO | Trial 89 | outer=2 | hidden=[1024, 256] epochs=177 lr=4.463e-04 wd=2.057e-07 n_pcs=4500 weight={'name': 'uniform'}
[I 2026-06-01 11:43:08,063] Trial 89 finished with value: 0.20838269612149612 and parameters: {'hidden_dims': '[1024, 256]', 'dropout': 0.32011802811485657, 'batch_norm': False, 'lr': 0.000446342341967874, 'weight_decay': 2.0571604244370077e-07, 'epochs': 177, 'loss': 'mae', 'optimizer': 'adamw', 'use_snp_selection': False, 'n_pcs': 4500}. Best is trial 60 with value: 0.2216237857210345.
2026-06-01 11:43:08 | INFO | Trial 90 | outer=2 | hidden=[128, 64] epochs=232 lr=1.023e-05 wd=3.365e-07 n_pcs=5000 weight={'name': 'uniform'}
[I 2026-06-01 11:43:11,409] Trial 90 pruned. 
2026-06-01 11:43:11 | INFO | Trial 91 | outer=2 | hidden=[1024, 256] epochs=206 lr=3.692e-04 wd=2.838e-07 n_pcs=4500 weight={'name': 'uniform'}
[I 2026-06-01 11:43:32,481] Trial 91 finished with value: 0.20294882957528002 and parameters: {'hidden_dims': '[1024, 256]', 'dropout': 0.2142636914365198, 'batch_norm': False, 'lr': 0.0003691609308100758, 'weight_decay': 2.837756262968672e-07, 'epochs': 206, 'loss': 'mae', 'optimizer': 'adamw', 'use_snp_selection': False, 'n_pcs': 4500}. Best is trial 60 with value: 0.2216237857210345.
2026-06-01 11:43:32 | INFO | Trial 92 | outer=2 | hidden=[1024, 256] epochs=217 lr=3.566e-04 wd=6.171e-07 n_pcs=4500 weight={'name': 'uniform'}
[I 2026-06-01 11:43:54,546] Trial 92 finished with value: 0.20004643863069735 and parameters: {'hidden_dims': '[1024, 256]', 'dropout': 0.16867060497447614, 'batch_norm': False, 'lr': 0.000356617751511607, 'weight_decay': 6.170712333745609e-07, 'epochs': 217, 'loss': 'mae', 'optimizer': 'adamw', 'use_snp_selection': False, 'n_pcs': 4500}. Best is trial 60 with value: 0.2216237857210345.
2026-06-01 11:43:54 | INFO | Trial 93 | outer=2 | hidden=[1024, 256] epochs=241 lr=2.399e-04 wd=1.636e-07 n_pcs=4000 weight={'name': 'uniform'}
[I 2026-06-01 11:44:16,771] Trial 93 finished with value: 0.19930345176427203 and parameters: {'hidden_dims': '[1024, 256]', 'dropout': 0.22703245430159075, 'batch_norm': False, 'lr': 0.00023990021719773853, 'weight_decay': 1.636061709673382e-07, 'epochs': 241, 'loss': 'mae', 'optimizer': 'adamw', 'use_snp_selection': False, 'n_pcs': 4000}. Best is trial 60 with value: 0.2216237857210345.
2026-06-01 11:44:16 | INFO | Trial 94 | outer=2 | hidden=[1024, 256] epochs=186 lr=2.892e-04 wd=6.595e-08 n_pcs=5000 weight={'name': 'uniform'}
[I 2026-06-01 11:44:37,669] Trial 94 finished with value: 0.20762191538563232 and parameters: {'hidden_dims': '[1024, 256]', 'dropout': 0.29524585518109336, 'batch_norm': False, 'lr': 0.00028924456574081885, 'weight_decay': 6.595400968797272e-08, 'epochs': 186, 'loss': 'mae', 'optimizer': 'adamw', 'use_snp_selection': False, 'n_pcs': 5000}. Best is trial 60 with value: 0.2216237857210345.
2026-06-01 11:44:37 | INFO | Trial 95 | outer=2 | hidden=[512, 64] epochs=270 lr=4.395e-04 wd=3.368e-07 n_pcs=5000 weight={'name': 'uniform'}
[I 2026-06-01 11:44:52,971] Trial 95 finished with value: 0.21216181760767835 and parameters: {'hidden_dims': '[512, 64]', 'dropout': 0.21982485775679958, 'batch_norm': False, 'lr': 0.0004395463020798046, 'weight_decay': 3.36785168271777e-07, 'epochs': 270, 'loss': 'mae', 'optimizer': 'adamw', 'use_snp_selection': False, 'n_pcs': 5000}. Best is trial 60 with value: 0.2216237857210345.
2026-06-01 11:44:52 | INFO | Trial 96 | outer=2 | hidden=[256, 64] epochs=178 lr=3.399e-04 wd=2.481e-07 n_pcs=4500 weight={'name': 'uniform'}
[I 2026-06-01 11:44:59,565] Trial 96 finished with value: 0.19806344992587552 and parameters: {'hidden_dims': '[256, 64]', 'dropout': 0.14961731448196186, 'batch_norm': False, 'lr': 0.0003399114368502671, 'weight_decay': 2.4812755179403976e-07, 'epochs': 178, 'loss': 'mae', 'optimizer': 'adamw', 'use_snp_selection': False, 'n_pcs': 4500}. Best is trial 60 with value: 0.2216237857210345.
2026-06-01 11:44:59 | INFO | Trial 97 | outer=2 | hidden=[512, 256] epochs=284 lr=4.877e-04 wd=7.690e-07 n_pcs=4000 weight={'name': 'uniform'}
[I 2026-06-01 11:45:14,050] Trial 97 finished with value: 0.19729216707458536 and parameters: {'hidden_dims': '[512, 256]', 'dropout': 0.24262679076846888, 'batch_norm': False, 'lr': 0.00048774687452222504, 'weight_decay': 7.68950997678036e-07, 'epochs': 284, 'loss': 'mae', 'optimizer': 'adamw', 'use_snp_selection': False, 'n_pcs': 4000}. Best is trial 60 with value: 0.2216237857210345.
2026-06-01 11:45:14 | INFO | Trial 98 | outer=2 | hidden=[1024, 256] epochs=249 lr=3.956e-04 wd=9.214e-08 n_pcs=5000 weight={'name': 'uniform'}
[I 2026-06-01 11:45:41,166] Trial 98 finished with value: 0.22534808392827754 and parameters: {'hidden_dims': '[1024, 256]', 'dropout': 0.19842165304061796, 'batch_norm': False, 'lr': 0.0003955933153839819, 'weight_decay': 9.21386310907454e-08, 'epochs': 249, 'loss': 'mae', 'optimizer': 'adamw', 'use_snp_selection': False, 'n_pcs': 5000}. Best is trial 98 with value: 0.22534808392827754.
2026-06-01 11:45:41 | INFO | Trial 99 | outer=2 | hidden=[1024, 256] epochs=251 lr=4.039e-04 wd=8.010e-08 n_pcs=5000 weight={'name': 'uniform'}
[I 2026-06-01 11:46:08,479] Trial 99 finished with value: 0.20522349203920273 and parameters: {'hidden_dims': '[1024, 256]', 'dropout': 0.1833438488019078, 'batch_norm': False, 'lr': 0.0004039269548693319, 'weight_decay': 8.009796462037127e-08, 'epochs': 251, 'loss': 'mae', 'optimizer': 'adamw', 'use_snp_selection': False, 'n_pcs': 5000}. Best is trial 98 with value: 0.22534808392827754.
2026-06-01 11:46:08 | INFO | Trial 100 | outer=2 | hidden=[1024, 256] epochs=263 lr=4.992e-04 wd=1.168e-07 n_pcs=5000 weight={'name': 'uniform'}
