[I 2026-06-01 13:47:32,775] Trial 139 finished with value: 0.19251532844744318 and parameters: {'hidden_dims': '[512, 64]', 'dropout': 0.2471231021486087, 'batch_norm': False, 'lr': 0.0003043699097966391, 'weight_decay': 3.851647147177697e-08, 'epochs': 88, 'loss': 'mse', 'optimizer': 'adam', 'use_snp_selection': False, 'n_pcs': 5000}. Best is trial 114 with value: 0.21889059107650932.
2026-06-01 13:47:32 | INFO | Trial 140 | outer=7 | hidden=[512, 64] epochs=100 lr=2.667e-04 wd=2.610e-08 n_pcs=4500 weight={'name': 'uniform'}
[I 2026-06-01 13:47:39,308] Trial 140 finished with value: 0.20343172633503648 and parameters: {'hidden_dims': '[512, 64]', 'dropout': 0.31215997057437894, 'batch_norm': False, 'lr': 0.000266712888820518, 'weight_decay': 2.6100608078825294e-08, 'epochs': 100, 'loss': 'mse', 'optimizer': 'adam', 'use_snp_selection': False, 'n_pcs': 4500}. Best is trial 114 with value: 0.21889059107650932.
2026-06-01 13:47:39 | INFO | Trial 141 | outer=7 | hidden=[512, 64] epochs=108 lr=2.077e-04 wd=6.866e-06 n_pcs=4500 weight={'name': 'uniform'}
[I 2026-06-01 13:47:46,182] Trial 141 finished with value: 0.1906415299727297 and parameters: {'hidden_dims': '[512, 64]', 'dropout': 0.2825459157728793, 'batch_norm': False, 'lr': 0.00020774630216257559, 'weight_decay': 6.865571038676303e-06, 'epochs': 108, 'loss': 'mse', 'optimizer': 'adam', 'use_snp_selection': False, 'n_pcs': 4500}. Best is trial 114 with value: 0.21889059107650932.
2026-06-01 13:47:46 | INFO | Trial 142 | outer=7 | hidden=[512, 64] epochs=92 lr=2.543e-04 wd=4.701e-06 n_pcs=4500 weight={'name': 'uniform'}
[I 2026-06-01 13:47:52,368] Trial 142 finished with value: 0.20240225894050679 and parameters: {'hidden_dims': '[512, 64]', 'dropout': 0.26832777307912165, 'batch_norm': False, 'lr': 0.0002542633328785361, 'weight_decay': 4.701431201468584e-06, 'epochs': 92, 'loss': 'mse', 'optimizer': 'adam', 'use_snp_selection': False, 'n_pcs': 4500}. Best is trial 114 with value: 0.21889059107650932.
2026-06-01 13:47:52 | INFO | Trial 143 | outer=7 | hidden=[512, 64] epochs=103 lr=3.113e-04 wd=1.799e-08 n_pcs=5000 weight={'name': 'uniform'}
[I 2026-06-01 13:47:59,389] Trial 143 finished with value: 0.18824379636415128 and parameters: {'hidden_dims': '[512, 64]', 'dropout': 0.27485662520356036, 'batch_norm': False, 'lr': 0.00031127267279035367, 'weight_decay': 1.799226838883436e-08, 'epochs': 103, 'loss': 'mse', 'optimizer': 'adam', 'use_snp_selection': False, 'n_pcs': 5000}. Best is trial 114 with value: 0.21889059107650932.
2026-06-01 13:47:59 | INFO | Trial 144 | outer=7 | hidden=[512, 64] epochs=114 lr=2.854e-04 wd=2.893e-06 n_pcs=4500 weight={'name': 'uniform'}
[I 2026-06-01 13:48:06,519] Trial 144 finished with value: 0.20214256273165568 and parameters: {'hidden_dims': '[512, 64]', 'dropout': 0.23361585585736672, 'batch_norm': False, 'lr': 0.00028541202809405093, 'weight_decay': 2.8931147880056757e-06, 'epochs': 114, 'loss': 'mse', 'optimizer': 'adam', 'use_snp_selection': False, 'n_pcs': 4500}. Best is trial 114 with value: 0.21889059107650932.
2026-06-01 13:48:06 | INFO | Trial 145 | outer=7 | hidden=[512, 64] epochs=124 lr=2.305e-04 wd=3.056e-08 n_pcs=5000 weight={'name': 'uniform'}
[I 2026-06-01 13:48:14,503] Trial 145 finished with value: 0.2048941736764455 and parameters: {'hidden_dims': '[512, 64]', 'dropout': 0.2947699183401665, 'batch_norm': False, 'lr': 0.00023045544477506933, 'weight_decay': 3.0564186513405034e-08, 'epochs': 124, 'loss': 'mse', 'optimizer': 'adam', 'use_snp_selection': False, 'n_pcs': 5000}. Best is trial 114 with value: 0.21889059107650932.
2026-06-01 13:48:14 | INFO | Trial 146 | outer=7 | hidden=[512, 64] epochs=97 lr=2.491e-04 wd=7.465e-08 n_pcs=4500 weight={'name': 'uniform'}
[I 2026-06-01 13:48:20,921] Trial 146 finished with value: 0.20431661319847455 and parameters: {'hidden_dims': '[512, 64]', 'dropout': 0.5075223897663836, 'batch_norm': False, 'lr': 0.0002491467872647845, 'weight_decay': 7.465382563015763e-08, 'epochs': 97, 'loss': 'mse', 'optimizer': 'adam', 'use_snp_selection': False, 'n_pcs': 4500}. Best is trial 114 with value: 0.21889059107650932.
2026-06-01 13:48:20 | INFO | Trial 147 | outer=7 | hidden=[512, 64] epochs=109 lr=3.561e-04 wd=1.067e-05 n_pcs=5000 weight={'name': 'uniform'}
[I 2026-06-01 13:48:28,243] Trial 147 finished with value: 0.19280655929888332 and parameters: {'hidden_dims': '[512, 64]', 'dropout': 0.2505116143675543, 'batch_norm': False, 'lr': 0.00035614555696813474, 'weight_decay': 1.0671602086960444e-05, 'epochs': 109, 'loss': 'mse', 'optimizer': 'adam', 'use_snp_selection': False, 'n_pcs': 5000}. Best is trial 114 with value: 0.21889059107650932.
2026-06-01 13:48:28 | INFO | Trial 148 | outer=7 | hidden=[512, 64] epochs=120 lr=1.965e-04 wd=6.192e-08 n_pcs=5000 weight={'name': 'uniform'}
[I 2026-06-01 13:48:36,040] Trial 148 finished with value: 0.19454371566372708 and parameters: {'hidden_dims': '[512, 64]', 'dropout': 0.5547729798007203, 'batch_norm': False, 'lr': 0.00019649057624047706, 'weight_decay': 6.192496338615094e-08, 'epochs': 120, 'loss': 'mse', 'optimizer': 'adam', 'use_snp_selection': False, 'n_pcs': 5000}. Best is trial 114 with value: 0.21889059107650932.
2026-06-01 13:48:36 | INFO | Trial 149 | outer=7 | hidden=[512, 128] epochs=134 lr=2.708e-04 wd=4.721e-08 n_pcs=4500 weight={'name': 'uniform'}
[I 2026-06-01 13:48:44,155] Trial 149 finished with value: 0.20701295924518065 and parameters: {'hidden_dims': '[512, 128]', 'dropout': 0.4739230433977791, 'batch_norm': False, 'lr': 0.00027082299726073026, 'weight_decay': 4.7214244455608216e-08, 'epochs': 134, 'loss': 'mse', 'optimizer': 'adamw', 'use_snp_selection': False, 'n_pcs': 4500}. Best is trial 114 with value: 0.21889059107650932.
2026-06-01 13:48:44 | INFO | OUTER 7 best (inner mean r=0.2189): model={'hidden_dims': [512, 64], 'dropout': 0.5842635974896627, 'batch_norm': False, 'lr': 0.00024787315653993126, 'weight_decay': 1.5834887906903942e-08, 'epochs': 141, 'loss': 'mae', 'optimizer': 'adam', 'use_snp_selection': False, 'n_pcs': 5000} weighting={'name': 'uniform'}
2026-06-01 13:48:45 | INFO | OUTER 7 TEST r = 0.2576
2026-06-01 13:48:45 | INFO | OUTER 7 incremental summary saved to outputs/final_results/e8_pc_mlp_uniform/thr_wing/e8_pc_mlp_uniform_thr_wing_results.json
2026-06-01 13:48:45 | INFO | OUTER 8: test_size=256 island=7 (Onøy og Lurøy)
2026-06-01 13:48:45 | INFO | OUTER 8: inner LOIO validation islands: 0(Nesøy), 1(Myken), 2(Træna), 3(Selvær), 4(Gjerøy), 5(Hestmannøy), 6(Indre Kvarøy), 8(Lovund), 9(Sleneset), 10(Aldra), 11(Leka), 12(Vega), 13(Vikna), 14(Lauvøya)
2026-06-01 13:48:45 | INFO | OUTER 8: using top 10 related inner validation islands for tuning: 9(Sleneset, avgGRM=0.0092), 8(Lovund, avgGRM=0.0058), 6(Indre Kvarøy, avgGRM=0.0042), 5(Hestmannøy, avgGRM=0.0026), 0(Nesøy, avgGRM=0.0025), 1(Myken, avgGRM=0.0024), 2(Træna, avgGRM=0.0024), 3(Selvær, avgGRM=0.0018), 10(Aldra, avgGRM=0.0011), 4(Gjerøy, avgGRM=0.0002)
[I 2026-06-01 13:48:45,360] A new study created in memory with name: mlp_importance_inner_outer7
2026-06-01 13:48:45 | INFO | Trial 0 | outer=8 | hidden=[256, 64] epochs=252 lr=8.243e-05 wd=1.277e-07 n_pcs=1500 weight={'name': 'uniform'}
[I 2026-06-01 13:48:50,206] Trial 0 finished with value: 0.17244313481993054 and parameters: {'hidden_dims': '[256, 64]', 'dropout': 0.19097065492325918, 'batch_norm': False, 'lr': 8.242985198911028e-05, 'weight_decay': 1.277246473139888e-07, 'epochs': 252, 'loss': 'mae', 'optimizer': 'adamw', 'use_snp_selection': False, 'n_pcs': 1500}. Best is trial 0 with value: 0.17244313481993054.
2026-06-01 13:48:50 | INFO | Trial 1 | outer=8 | hidden=[1024, 256] epochs=225 lr=1.391e-04 wd=1.941e-07 n_pcs=500 weight={'name': 'uniform'}
[I 2026-06-01 13:48:56,651] Trial 1 finished with value: 0.14702808554178096 and parameters: {'hidden_dims': '[1024, 256]', 'dropout': 0.2849434595702811, 'batch_norm': False, 'lr': 0.00013909108684683413, 'weight_decay': 1.9407167964924495e-07, 'epochs': 225, 'loss': 'mse', 'optimizer': 'adamw', 'use_snp_selection': False, 'n_pcs': 500}. Best is trial 0 with value: 0.17244313481993054.
2026-06-01 13:48:56 | INFO | Trial 2 | outer=8 | hidden=[256, 64] epochs=139 lr=3.957e-05 wd=3.750e-05 n_pcs=2500 weight={'name': 'uniform'}
[I 2026-06-01 13:49:00,538] Trial 2 finished with value: 0.17784518769986438 and parameters: {'hidden_dims': '[256, 64]', 'dropout': 0.11392712587675291, 'batch_norm': False, 'lr': 3.9573351157697276e-05, 'weight_decay': 3.7502337000845044e-05, 'epochs': 139, 'loss': 'mae', 'optimizer': 'adam', 'use_snp_selection': False, 'n_pcs': 2500}. Best is trial 2 with value: 0.17784518769986438.
2026-06-01 13:49:00 | INFO | Trial 3 | outer=8 | hidden=[128, 64] epochs=164 lr=1.538e-05 wd=3.248e-06 n_pcs=3000 weight={'name': 'uniform'}
[I 2026-06-01 13:49:04,588] Trial 3 finished with value: 0.005033791076308799 and parameters: {'hidden_dims': '[128, 64]', 'dropout': 0.1479874991503876, 'batch_norm': False, 'lr': 1.5380732370316375e-05, 'weight_decay': 3.2478890969962294e-06, 'epochs': 164, 'loss': 'mse', 'optimizer': 'adam', 'use_snp_selection': False, 'n_pcs': 3000}. Best is trial 2 with value: 0.17784518769986438.
2026-06-01 13:49:04 | INFO | Trial 4 | outer=8 | hidden=[256, 128] epochs=210 lr=7.298e-05 wd=7.875e-06 n_pcs=3000 weight={'name': 'uniform'}
[I 2026-06-01 13:49:10,281] Trial 4 finished with value: 0.15114574567573044 and parameters: {'hidden_dims': '[256, 128]', 'dropout': 0.09917626474860408, 'batch_norm': False, 'lr': 7.298380589156323e-05, 'weight_decay': 7.875094299510188e-06, 'epochs': 210, 'loss': 'mae', 'optimizer': 'adam', 'use_snp_selection': False, 'n_pcs': 3000}. Best is trial 2 with value: 0.17784518769986438.
2026-06-01 13:49:10 | INFO | Trial 5 | outer=8 | hidden=[512, 128] epochs=284 lr=5.467e-05 wd=5.496e-06 n_pcs=4000 weight={'name': 'uniform'}
[I 2026-06-01 13:49:23,756] Trial 5 finished with value: 0.13789794461301746 and parameters: {'hidden_dims': '[512, 128]', 'dropout': 0.3143696126156032, 'batch_norm': False, 'lr': 5.46667545989349e-05, 'weight_decay': 5.496446859789657e-06, 'epochs': 284, 'loss': 'mse', 'optimizer': 'adamw', 'use_snp_selection': False, 'n_pcs': 4000}. Best is trial 2 with value: 0.17784518769986438.
2026-06-01 13:49:23 | INFO | Trial 6 | outer=8 | hidden=[512, 64] epochs=90 lr=3.103e-05 wd=6.607e-08 n_pcs=5000 weight={'name': 'uniform'}
[I 2026-06-01 13:49:28,259] Trial 6 pruned. 
2026-06-01 13:49:28 | INFO | Trial 7 | outer=8 | hidden=[128, 64] epochs=272 lr=1.348e-05 wd=1.075e-07 n_pcs=4000 weight={'name': 'uniform'}
[I 2026-06-01 13:49:34,021] Trial 7 finished with value: 0.0837692237269949 and parameters: {'hidden_dims': '[128, 64]', 'dropout': 0.43850529998545856, 'batch_norm': False, 'lr': 1.3475345125648628e-05, 'weight_decay': 1.0749576404800894e-07, 'epochs': 272, 'loss': 'mse', 'optimizer': 'adamw', 'use_snp_selection': False, 'n_pcs': 4000}. Best is trial 2 with value: 0.17784518769986438.
2026-06-01 13:49:34 | INFO | Trial 8 | outer=8 | hidden=[128, 64] epochs=205 lr=1.815e-05 wd=5.764e-06 n_pcs=3000 weight={'name': 'uniform'}
[I 2026-06-01 13:49:38,603] Trial 8 finished with value: 0.1516276008264712 and parameters: {'hidden_dims': '[128, 64]', 'dropout': 0.28461331600914713, 'batch_norm': False, 'lr': 1.8153829433867716e-05, 'weight_decay': 5.764148698871099e-06, 'epochs': 205, 'loss': 'mse', 'optimizer': 'adam', 'use_snp_selection': False, 'n_pcs': 3000}. Best is trial 2 with value: 0.17784518769986438.
2026-06-01 13:49:38 | INFO | Trial 9 | outer=8 | hidden=[128, 64] epochs=296 lr=2.338e-05 wd=1.066e-07 n_pcs=2500 weight={'name': 'uniform'}
[I 2026-06-01 13:49:44,337] Trial 9 finished with value: 0.14516831211822429 and parameters: {'hidden_dims': '[128, 64]', 'dropout': 0.17607378181405245, 'batch_norm': False, 'lr': 2.3379083621874488e-05, 'weight_decay': 1.0663581123617794e-07, 'epochs': 296, 'loss': 'mae', 'optimizer': 'adam', 'use_snp_selection': False, 'n_pcs': 2500}. Best is trial 2 with value: 0.17784518769986438.
2026-06-01 13:49:44 | INFO | Trial 10 | outer=8 | hidden=[512, 256] epochs=121 lr=3.984e-04 wd=6.166e-04 n_pcs=1500 weight={'name': 'uniform'}
[I 2026-06-01 13:49:48,667] Trial 10 finished with value: 0.18084197397772056 and parameters: {'hidden_dims': '[512, 256]', 'dropout': 0.023098959755501636, 'batch_norm': False, 'lr': 0.0003983594610602333, 'weight_decay': 0.0006165568464880608, 'epochs': 121, 'loss': 'mae', 'optimizer': 'adam', 'use_snp_selection': False, 'n_pcs': 1500}. Best is trial 10 with value: 0.18084197397772056.
2026-06-01 13:49:48 | INFO | Trial 11 | outer=8 | hidden=[512, 256] epochs=120 lr=3.985e-04 wd=6.080e-04 n_pcs=1500 weight={'name': 'uniform'}
[I 2026-06-01 13:49:52,971] Trial 11 finished with value: 0.16827507782173853 and parameters: {'hidden_dims': '[512, 256]', 'dropout': 0.034453903981306294, 'batch_norm': False, 'lr': 0.00039850138867195595, 'weight_decay': 0.0006080096140690285, 'epochs': 120, 'loss': 'mae', 'optimizer': 'adam', 'use_snp_selection': False, 'n_pcs': 1500}. Best is trial 10 with value: 0.18084197397772056.
2026-06-01 13:49:52 | INFO | Trial 12 | outer=8 | hidden=[256, 64] epochs=133 lr=4.981e-04 wd=3.714e-04 n_pcs=1500 weight={'name': 'uniform'}
[I 2026-06-01 13:49:56,346] Trial 12 finished with value: 0.18264737980521792 and parameters: {'hidden_dims': '[256, 64]', 'dropout': 0.02323342726289353, 'batch_norm': False, 'lr': 0.000498069436842805, 'weight_decay': 0.0003714482006573334, 'epochs': 133, 'loss': 'mae', 'optimizer': 'adam', 'use_snp_selection': False, 'n_pcs': 1500}. Best is trial 12 with value: 0.18264737980521792.
2026-06-01 13:49:56 | INFO | Trial 13 | outer=8 | hidden=[512, 256] epochs=76 lr=4.127e-04 wd=8.959e-04 n_pcs=1000 weight={'name': 'uniform'}
[I 2026-06-01 13:49:59,290] Trial 13 finished with value: 0.1566421941637057 and parameters: {'hidden_dims': '[512, 256]', 'dropout': 0.005094141176843786, 'batch_norm': False, 'lr': 0.00041268707845253474, 'weight_decay': 0.0008959282106793052, 'epochs': 76, 'loss': 'mae', 'optimizer': 'adam', 'use_snp_selection': False, 'n_pcs': 1000}. Best is trial 12 with value: 0.18264737980521792.
2026-06-01 13:49:59 | INFO | Trial 14 | outer=8 | hidden=[512, 256] epochs=122 lr=2.117e-04 wd=1.266e-04 n_pcs=1500 weight={'name': 'uniform'}
[I 2026-06-01 13:50:03,639] Trial 14 finished with value: 0.18399650149140617 and parameters: {'hidden_dims': '[512, 256]', 'dropout': 0.00019086357403489546, 'batch_norm': False, 'lr': 0.0002117467631760809, 'weight_decay': 0.00012663736825721254, 'epochs': 122, 'loss': 'mae', 'optimizer': 'adam', 'use_snp_selection': False, 'n_pcs': 1500}. Best is trial 14 with value: 0.18399650149140617.
2026-06-01 13:50:03 | INFO | Trial 15 | outer=8 | hidden=[256, 64] epochs=168 lr=1.742e-04 wd=6.168e-05 n_pcs=500 weight={'name': 'uniform'}
[I 2026-06-01 13:50:07,427] Trial 15 finished with value: 0.16057091391746686 and parameters: {'hidden_dims': '[256, 64]', 'dropout': 0.371592006519317, 'batch_norm': False, 'lr': 0.00017416272932245372, 'weight_decay': 6.168185109270037e-05, 'epochs': 168, 'loss': 'mae', 'optimizer': 'adam', 'use_snp_selection': False, 'n_pcs': 500}. Best is trial 14 with value: 0.18399650149140617.
2026-06-01 13:50:07 | INFO | Trial 16 | outer=8 | hidden=[512, 64] epochs=55 lr=2.298e-04 wd=1.119e-04 n_pcs=2000 weight={'name': 'uniform'}
[I 2026-06-01 13:50:10,393] Trial 16 finished with value: 0.19068587619516802 and parameters: {'hidden_dims': '[512, 64]', 'dropout': 0.08200375198681364, 'batch_norm': False, 'lr': 0.00022982385423343883, 'weight_decay': 0.00011186459842967428, 'epochs': 55, 'loss': 'mae', 'optimizer': 'adam', 'use_snp_selection': False, 'n_pcs': 2000}. Best is trial 16 with value: 0.19068587619516802.
2026-06-01 13:50:10 | INFO | Trial 17 | outer=8 | hidden=[512, 64] epochs=51 lr=1.995e-04 wd=9.409e-05 n_pcs=2000 weight={'name': 'uniform'}
[I 2026-06-01 13:50:13,266] Trial 17 finished with value: 0.15842284055970401 and parameters: {'hidden_dims': '[512, 64]', 'dropout': 0.5998375031807794, 'batch_norm': False, 'lr': 0.0001994968748245115, 'weight_decay': 9.408687410195745e-05, 'epochs': 51, 'loss': 'mae', 'optimizer': 'adam', 'use_snp_selection': False, 'n_pcs': 2000}. Best is trial 16 with value: 0.19068587619516802.
2026-06-01 13:50:13 | INFO | Trial 18 | outer=8 | hidden=[512, 64] epochs=50 lr=2.348e-04 wd=6.422e-07 n_pcs=2000 weight={'name': 'uniform'}
[I 2026-06-01 13:50:16,119] Trial 18 finished with value: 0.18736497721524695 and parameters: {'hidden_dims': '[512, 64]', 'dropout': 0.23697476348987884, 'batch_norm': False, 'lr': 0.00023477308928817505, 'weight_decay': 6.422464038724231e-07, 'epochs': 50, 'loss': 'mae', 'optimizer': 'adam', 'use_snp_selection': False, 'n_pcs': 2000}. Best is trial 16 with value: 0.19068587619516802.
2026-06-01 13:50:16 | INFO | Trial 19 | outer=8 | hidden=[512, 64] epochs=58 lr=9.690e-05 wd=5.481e-07 n_pcs=3500 weight={'name': 'uniform'}
[I 2026-06-01 13:50:20,247] Trial 19 finished with value: 0.183454091853906 and parameters: {'hidden_dims': '[512, 64]', 'dropout': 0.22355552413457075, 'batch_norm': False, 'lr': 9.690235084400252e-05, 'weight_decay': 5.48149950221435e-07, 'epochs': 58, 'loss': 'mae', 'optimizer': 'adam', 'use_snp_selection': False, 'n_pcs': 3500}. Best is trial 16 with value: 0.19068587619516802.
2026-06-01 13:50:20 | INFO | Trial 20 | outer=8 | hidden=[512, 64] epochs=94 lr=2.859e-04 wd=1.471e-08 n_pcs=2000 weight={'name': 'uniform'}
[I 2026-06-01 13:50:24,066] Trial 20 finished with value: 0.187303861016296 and parameters: {'hidden_dims': '[512, 64]', 'dropout': 0.24625251516520963, 'batch_norm': False, 'lr': 0.0002858815369086786, 'weight_decay': 1.4711837140928265e-08, 'epochs': 94, 'loss': 'mae', 'optimizer': 'adam', 'use_snp_selection': False, 'n_pcs': 2000}. Best is trial 16 with value: 0.19068587619516802.
2026-06-01 13:50:24 | INFO | Trial 21 | outer=8 | hidden=[512, 64] epochs=90 lr=2.594e-04 wd=1.082e-08 n_pcs=2000 weight={'name': 'uniform'}
[I 2026-06-01 13:50:27,798] Trial 21 finished with value: 0.1831547077335242 and parameters: {'hidden_dims': '[512, 64]', 'dropout': 0.23791365808676385, 'batch_norm': False, 'lr': 0.0002593944020452517, 'weight_decay': 1.0817354554574032e-08, 'epochs': 90, 'loss': 'mae', 'optimizer': 'adam', 'use_snp_selection': False, 'n_pcs': 2000}. Best is trial 16 with value: 0.19068587619516802.
2026-06-01 13:50:27 | INFO | Trial 22 | outer=8 | hidden=[512, 64] epochs=69 lr=2.739e-04 wd=1.002e-06 n_pcs=2000 weight={'name': 'uniform'}
[I 2026-06-01 13:50:31,072] Trial 22 finished with value: 0.1997743824855363 and parameters: {'hidden_dims': '[512, 64]', 'dropout': 0.366549603031628, 'batch_norm': False, 'lr': 0.00027386823506876244, 'weight_decay': 1.0022975201406217e-06, 'epochs': 69, 'loss': 'mae', 'optimizer': 'adam', 'use_snp_selection': False, 'n_pcs': 2000}. Best is trial 22 with value: 0.1997743824855363.
2026-06-01 13:50:31 | INFO | Trial 23 | outer=8 | hidden=[512, 64] epochs=69 lr=1.212e-04 wd=9.720e-07 n_pcs=2500 weight={'name': 'uniform'}
[I 2026-06-01 13:50:34,721] Trial 23 finished with value: 0.1718881214485153 and parameters: {'hidden_dims': '[512, 64]', 'dropout': 0.371727279869865, 'batch_norm': False, 'lr': 0.00012120317971325876, 'weight_decay': 9.720334564799308e-07, 'epochs': 69, 'loss': 'mae', 'optimizer': 'adam', 'use_snp_selection': False, 'n_pcs': 2500}. Best is trial 22 with value: 0.1997743824855363.
2026-06-01 13:50:34 | INFO | Trial 24 | outer=8 | hidden=[512, 64] epochs=52 lr=2.823e-04 wd=1.943e-05 n_pcs=2000 weight={'name': 'uniform'}
[I 2026-06-01 13:50:37,622] Trial 24 finished with value: 0.17790057860264913 and parameters: {'hidden_dims': '[512, 64]', 'dropout': 0.3670825680890132, 'batch_norm': False, 'lr': 0.0002823401035536845, 'weight_decay': 1.9426682064842465e-05, 'epochs': 52, 'loss': 'mae', 'optimizer': 'adam', 'use_snp_selection': False, 'n_pcs': 2000}. Best is trial 22 with value: 0.1997743824855363.
2026-06-01 13:50:37 | INFO | Trial 25 | outer=8 | hidden=[256, 128] epochs=100 lr=1.416e-04 wd=1.049e-06 n_pcs=1000 weight={'name': 'uniform'}
[I 2026-06-01 13:50:40,548] Trial 25 finished with value: 0.1656416683498452 and parameters: {'hidden_dims': '[256, 128]', 'dropout': 0.4468513447946231, 'batch_norm': False, 'lr': 0.00014158867395317628, 'weight_decay': 1.0487145565470258e-06, 'epochs': 100, 'loss': 'mae', 'optimizer': 'adam', 'use_snp_selection': False, 'n_pcs': 1000}. Best is trial 22 with value: 0.1997743824855363.
2026-06-01 13:50:40 | INFO | Trial 26 | outer=8 | hidden=[1024, 256] epochs=74 lr=2.977e-04 wd=4.143e-07 n_pcs=1000 weight={'name': 'uniform'}
[I 2026-06-01 13:50:44,495] Trial 26 finished with value: 0.16552566554852743 and parameters: {'hidden_dims': '[1024, 256]', 'dropout': 0.09956833630312151, 'batch_norm': False, 'lr': 0.0002977139260840574, 'weight_decay': 4.1432648320669126e-07, 'epochs': 74, 'loss': 'mae', 'optimizer': 'adamw', 'use_snp_selection': False, 'n_pcs': 1000}. Best is trial 22 with value: 0.1997743824855363.
2026-06-01 13:50:44 | INFO | Trial 27 | outer=8 | hidden=[512, 128] epochs=105 lr=1.117e-04 wd=1.668e-06 n_pcs=3500 weight={'name': 'uniform'}
[I 2026-06-01 13:50:50,371] Trial 27 finished with value: 0.18741279762791369 and parameters: {'hidden_dims': '[512, 128]', 'dropout': 0.3418737051982071, 'batch_norm': False, 'lr': 0.00011171673092787342, 'weight_decay': 1.6683857790940416e-06, 'epochs': 105, 'loss': 'mae', 'optimizer': 'adam', 'use_snp_selection': False, 'n_pcs': 3500}. Best is trial 22 with value: 0.1997743824855363.
2026-06-01 13:50:50 | INFO | Trial 28 | outer=8 | hidden=[512, 128] epochs=149 lr=6.038e-05 wd=2.115e-06 n_pcs=4000 weight={'name': 'uniform'}
