[I 2026-06-01 12:00:31,539] Trial 141 finished with value: 0.21005247344928524 and parameters: {'hidden_dims': '[1024, 256]', 'dropout': 0.37928834414855106, 'batch_norm': False, 'lr': 0.00044971461312683927, 'weight_decay': 5.3297112858683184e-08, 'epochs': 291, 'loss': 'mae', 'optimizer': 'adamw', 'use_snp_selection': False, 'n_pcs': 5000}. Best is trial 98 with value: 0.22534808392827754.
2026-06-01 12:00:31 | INFO | Trial 142 | outer=2 | hidden=[1024, 256] epochs=283 lr=4.163e-04 wd=4.157e-08 n_pcs=5000 weight={'name': 'uniform'}
[I 2026-06-01 12:01:02,010] Trial 142 finished with value: 0.21787199736644475 and parameters: {'hidden_dims': '[1024, 256]', 'dropout': 0.3425993879055217, 'batch_norm': False, 'lr': 0.00041628758617451615, 'weight_decay': 4.15702912558371e-08, 'epochs': 283, 'loss': 'mae', 'optimizer': 'adamw', 'use_snp_selection': False, 'n_pcs': 5000}. Best is trial 98 with value: 0.22534808392827754.
2026-06-01 12:01:02 | INFO | Trial 143 | outer=2 | hidden=[1024, 256] epochs=280 lr=4.575e-04 wd=4.035e-08 n_pcs=5000 weight={'name': 'uniform'}
[I 2026-06-01 12:01:32,183] Trial 143 finished with value: 0.2129667703746391 and parameters: {'hidden_dims': '[1024, 256]', 'dropout': 0.34954282625030797, 'batch_norm': False, 'lr': 0.000457453689896721, 'weight_decay': 4.035327873841014e-08, 'epochs': 280, 'loss': 'mae', 'optimizer': 'adamw', 'use_snp_selection': False, 'n_pcs': 5000}. Best is trial 98 with value: 0.22534808392827754.
2026-06-01 12:01:32 | INFO | Trial 144 | outer=2 | hidden=[1024, 256] epochs=287 lr=4.273e-04 wd=3.223e-08 n_pcs=5000 weight={'name': 'uniform'}
[I 2026-06-01 12:02:03,038] Trial 144 finished with value: 0.2126673622916977 and parameters: {'hidden_dims': '[1024, 256]', 'dropout': 0.3600239311968766, 'batch_norm': False, 'lr': 0.0004272772854537398, 'weight_decay': 3.222994942532407e-08, 'epochs': 287, 'loss': 'mae', 'optimizer': 'adamw', 'use_snp_selection': False, 'n_pcs': 5000}. Best is trial 98 with value: 0.22534808392827754.
2026-06-01 12:02:03 | INFO | Trial 145 | outer=2 | hidden=[1024, 256] epochs=293 lr=3.618e-04 wd=6.752e-08 n_pcs=5000 weight={'name': 'uniform'}
[I 2026-06-01 12:02:34,491] Trial 145 finished with value: 0.21201737982420193 and parameters: {'hidden_dims': '[1024, 256]', 'dropout': 0.415236805407158, 'batch_norm': False, 'lr': 0.00036180066218212165, 'weight_decay': 6.752360988222891e-08, 'epochs': 293, 'loss': 'mae', 'optimizer': 'adamw', 'use_snp_selection': False, 'n_pcs': 5000}. Best is trial 98 with value: 0.22534808392827754.
2026-06-01 12:02:34 | INFO | Trial 146 | outer=2 | hidden=[1024, 256] epochs=296 lr=4.031e-04 wd=5.979e-08 n_pcs=5000 weight={'name': 'uniform'}
[I 2026-06-01 12:03:06,220] Trial 146 finished with value: 0.21124408097890668 and parameters: {'hidden_dims': '[1024, 256]', 'dropout': 0.32946013264316415, 'batch_norm': False, 'lr': 0.00040308187942211175, 'weight_decay': 5.979269796783836e-08, 'epochs': 296, 'loss': 'mae', 'optimizer': 'adamw', 'use_snp_selection': False, 'n_pcs': 5000}. Best is trial 98 with value: 0.22534808392827754.
2026-06-01 12:03:06 | INFO | Trial 147 | outer=2 | hidden=[512, 256] epochs=277 lr=3.701e-04 wd=4.012e-08 n_pcs=4500 weight={'name': 'uniform'}
[I 2026-06-01 12:03:21,873] Trial 147 finished with value: 0.19781524605614068 and parameters: {'hidden_dims': '[512, 256]', 'dropout': 0.3360000591813808, 'batch_norm': False, 'lr': 0.0003700623243849119, 'weight_decay': 4.011960734157134e-08, 'epochs': 277, 'loss': 'mse', 'optimizer': 'adamw', 'use_snp_selection': False, 'n_pcs': 4500}. Best is trial 98 with value: 0.22534808392827754.
2026-06-01 12:03:21 | INFO | Trial 148 | outer=2 | hidden=[256, 64] epochs=285 lr=3.214e-04 wd=2.819e-08 n_pcs=5000 weight={'name': 'uniform'}
[I 2026-06-01 12:03:31,527] Trial 148 finished with value: 0.19960031029499062 and parameters: {'hidden_dims': '[256, 64]', 'dropout': 0.2986091620131522, 'batch_norm': False, 'lr': 0.0003213678133140557, 'weight_decay': 2.81934830466077e-08, 'epochs': 285, 'loss': 'mae', 'optimizer': 'adamw', 'use_snp_selection': False, 'n_pcs': 5000}. Best is trial 98 with value: 0.22534808392827754.
2026-06-01 12:03:31 | INFO | Trial 149 | outer=2 | hidden=[1024, 256] epochs=282 lr=4.168e-04 wd=9.241e-08 n_pcs=5000 weight={'name': 'uniform'}
[I 2026-06-01 12:04:01,908] Trial 149 finished with value: 0.21739612484993703 and parameters: {'hidden_dims': '[1024, 256]', 'dropout': 0.25761211803401257, 'batch_norm': False, 'lr': 0.0004168407756876436, 'weight_decay': 9.241382273663963e-08, 'epochs': 282, 'loss': 'mae', 'optimizer': 'adamw', 'use_snp_selection': False, 'n_pcs': 5000}. Best is trial 98 with value: 0.22534808392827754.
2026-06-01 12:04:01 | INFO | OUTER 2 best (inner mean r=0.2253): model={'hidden_dims': [1024, 256], 'dropout': 0.19842165304061796, 'batch_norm': False, 'lr': 0.0003955933153839819, 'weight_decay': 9.21386310907454e-08, 'epochs': 249, 'loss': 'mae', 'optimizer': 'adamw', 'use_snp_selection': False, 'n_pcs': 5000} weighting={'name': 'uniform'}
2026-06-01 12:04:04 | INFO | OUTER 2 TEST r = 0.2787
2026-06-01 12:04:04 | INFO | OUTER 2 incremental summary saved to outputs/final_results/e8_pc_mlp_uniform/thr_wing/e8_pc_mlp_uniform_thr_wing_results.json
2026-06-01 12:04:04 | INFO | OUTER 3: test_size=286 island=2 (Træna)
2026-06-01 12:04:04 | INFO | OUTER 3: inner LOIO validation islands: 0(Nesøy), 1(Myken), 3(Selvær), 4(Gjerøy), 5(Hestmannøy), 6(Indre Kvarøy), 7(Onøy og Lurøy), 8(Lovund), 9(Sleneset), 10(Aldra), 11(Leka), 12(Vega), 13(Vikna), 14(Lauvøya)
2026-06-01 12:04:04 | INFO | OUTER 3: using top 10 related inner validation islands for tuning: 3(Selvær, avgGRM=0.0194), 1(Myken, avgGRM=0.0152), 8(Lovund, avgGRM=0.0119), 9(Sleneset, avgGRM=0.0084), 0(Nesøy, avgGRM=0.0030), 7(Onøy og Lurøy, avgGRM=0.0024), 6(Indre Kvarøy, avgGRM=0.0015), 5(Hestmannøy, avgGRM=-0.0005), 4(Gjerøy, avgGRM=-0.0020), 12(Vega, avgGRM=-0.0032)
[I 2026-06-01 12:04:04,835] A new study created in memory with name: mlp_importance_inner_outer2
2026-06-01 12:04:04 | INFO | Trial 0 | outer=3 | hidden=[256, 64] epochs=252 lr=8.243e-05 wd=1.277e-07 n_pcs=1500 weight={'name': 'uniform'}
[I 2026-06-01 12:04:09,588] Trial 0 finished with value: 0.13870191945983476 and parameters: {'hidden_dims': '[256, 64]', 'dropout': 0.19097065492325918, 'batch_norm': False, 'lr': 8.242985198911028e-05, 'weight_decay': 1.277246473139888e-07, 'epochs': 252, 'loss': 'mae', 'optimizer': 'adamw', 'use_snp_selection': False, 'n_pcs': 1500}. Best is trial 0 with value: 0.13870191945983476.
2026-06-01 12:04:09 | INFO | Trial 1 | outer=3 | hidden=[1024, 256] epochs=225 lr=1.391e-04 wd=1.941e-07 n_pcs=500 weight={'name': 'uniform'}
[I 2026-06-01 12:04:15,964] Trial 1 finished with value: 0.13790065185657238 and parameters: {'hidden_dims': '[1024, 256]', 'dropout': 0.2849434595702811, 'batch_norm': False, 'lr': 0.00013909108684683413, 'weight_decay': 1.9407167964924495e-07, 'epochs': 225, 'loss': 'mse', 'optimizer': 'adamw', 'use_snp_selection': False, 'n_pcs': 500}. Best is trial 0 with value: 0.13870191945983476.
2026-06-01 12:04:15 | INFO | Trial 2 | outer=3 | hidden=[256, 64] epochs=139 lr=3.957e-05 wd=3.750e-05 n_pcs=2500 weight={'name': 'uniform'}
[I 2026-06-01 12:04:19,819] Trial 2 finished with value: 0.15186450915093958 and parameters: {'hidden_dims': '[256, 64]', 'dropout': 0.11392712587675291, 'batch_norm': False, 'lr': 3.9573351157697276e-05, 'weight_decay': 3.7502337000845044e-05, 'epochs': 139, 'loss': 'mae', 'optimizer': 'adam', 'use_snp_selection': False, 'n_pcs': 2500}. Best is trial 2 with value: 0.15186450915093958.
2026-06-01 12:04:19 | INFO | Trial 3 | outer=3 | hidden=[128, 64] epochs=164 lr=1.538e-05 wd=3.248e-06 n_pcs=3000 weight={'name': 'uniform'}
[I 2026-06-01 12:04:23,605] Trial 3 finished with value: 0.08804969632676293 and parameters: {'hidden_dims': '[128, 64]', 'dropout': 0.1479874991503876, 'batch_norm': False, 'lr': 1.5380732370316375e-05, 'weight_decay': 3.2478890969962294e-06, 'epochs': 164, 'loss': 'mse', 'optimizer': 'adam', 'use_snp_selection': False, 'n_pcs': 3000}. Best is trial 2 with value: 0.15186450915093958.
2026-06-01 12:04:23 | INFO | Trial 4 | outer=3 | hidden=[256, 128] epochs=210 lr=7.298e-05 wd=7.875e-06 n_pcs=3000 weight={'name': 'uniform'}
[I 2026-06-01 12:04:29,199] Trial 4 finished with value: 0.13417903196599093 and parameters: {'hidden_dims': '[256, 128]', 'dropout': 0.09917626474860408, 'batch_norm': False, 'lr': 7.298380589156323e-05, 'weight_decay': 7.875094299510188e-06, 'epochs': 210, 'loss': 'mae', 'optimizer': 'adam', 'use_snp_selection': False, 'n_pcs': 3000}. Best is trial 2 with value: 0.15186450915093958.
2026-06-01 12:04:29 | INFO | Trial 5 | outer=3 | hidden=[512, 128] epochs=284 lr=5.467e-05 wd=5.496e-06 n_pcs=4000 weight={'name': 'uniform'}
[I 2026-06-01 12:04:42,494] Trial 5 finished with value: 0.13053422247803703 and parameters: {'hidden_dims': '[512, 128]', 'dropout': 0.3143696126156032, 'batch_norm': False, 'lr': 5.46667545989349e-05, 'weight_decay': 5.496446859789657e-06, 'epochs': 284, 'loss': 'mse', 'optimizer': 'adamw', 'use_snp_selection': False, 'n_pcs': 4000}. Best is trial 2 with value: 0.15186450915093958.
2026-06-01 12:04:42 | INFO | Trial 6 | outer=3 | hidden=[512, 64] epochs=90 lr=3.103e-05 wd=6.607e-08 n_pcs=5000 weight={'name': 'uniform'}
[I 2026-06-01 12:04:48,898] Trial 6 finished with value: 0.0786899942972027 and parameters: {'hidden_dims': '[512, 64]', 'dropout': 0.4941304802762902, 'batch_norm': False, 'lr': 3.103455600245868e-05, 'weight_decay': 6.606788619980135e-08, 'epochs': 90, 'loss': 'mse', 'optimizer': 'adamw', 'use_snp_selection': False, 'n_pcs': 5000}. Best is trial 2 with value: 0.15186450915093958.
2026-06-01 12:04:48 | INFO | Trial 7 | outer=3 | hidden=[128, 64] epochs=272 lr=1.348e-05 wd=1.075e-07 n_pcs=4000 weight={'name': 'uniform'}
[I 2026-06-01 12:04:52,831] Trial 7 pruned. 
2026-06-01 12:04:52 | INFO | Trial 8 | outer=3 | hidden=[128, 64] epochs=205 lr=1.815e-05 wd=5.764e-06 n_pcs=3000 weight={'name': 'uniform'}
[I 2026-06-01 12:04:57,362] Trial 8 finished with value: 0.1009225938892051 and parameters: {'hidden_dims': '[128, 64]', 'dropout': 0.28461331600914713, 'batch_norm': False, 'lr': 1.8153829433867716e-05, 'weight_decay': 5.764148698871099e-06, 'epochs': 205, 'loss': 'mse', 'optimizer': 'adam', 'use_snp_selection': False, 'n_pcs': 3000}. Best is trial 2 with value: 0.15186450915093958.
2026-06-01 12:04:57 | INFO | Trial 9 | outer=3 | hidden=[128, 64] epochs=296 lr=2.338e-05 wd=1.066e-07 n_pcs=2500 weight={'name': 'uniform'}
[I 2026-06-01 12:05:03,172] Trial 9 finished with value: 0.14968467145055836 and parameters: {'hidden_dims': '[128, 64]', 'dropout': 0.17607378181405245, 'batch_norm': False, 'lr': 2.3379083621874488e-05, 'weight_decay': 1.0663581123617794e-07, 'epochs': 296, 'loss': 'mae', 'optimizer': 'adam', 'use_snp_selection': False, 'n_pcs': 2500}. Best is trial 2 with value: 0.15186450915093958.
2026-06-01 12:05:03 | INFO | Trial 10 | outer=3 | hidden=[512, 256] epochs=121 lr=3.984e-04 wd=6.166e-04 n_pcs=1500 weight={'name': 'uniform'}
[I 2026-06-01 12:05:07,448] Trial 10 finished with value: 0.15636318474723265 and parameters: {'hidden_dims': '[512, 256]', 'dropout': 0.023098959755501636, 'batch_norm': False, 'lr': 0.0003983594610602333, 'weight_decay': 0.0006165568464880608, 'epochs': 121, 'loss': 'mae', 'optimizer': 'adam', 'use_snp_selection': False, 'n_pcs': 1500}. Best is trial 10 with value: 0.15636318474723265.
2026-06-01 12:05:07 | INFO | Trial 11 | outer=3 | hidden=[512, 256] epochs=120 lr=3.985e-04 wd=6.080e-04 n_pcs=1500 weight={'name': 'uniform'}
[I 2026-06-01 12:05:11,703] Trial 11 finished with value: 0.16998310233892416 and parameters: {'hidden_dims': '[512, 256]', 'dropout': 0.034453903981306294, 'batch_norm': False, 'lr': 0.00039850138867195595, 'weight_decay': 0.0006080096140690285, 'epochs': 120, 'loss': 'mae', 'optimizer': 'adam', 'use_snp_selection': False, 'n_pcs': 1500}. Best is trial 11 with value: 0.16998310233892416.
2026-06-01 12:05:11 | INFO | Trial 12 | outer=3 | hidden=[512, 256] epochs=63 lr=4.988e-04 wd=8.865e-04 n_pcs=1000 weight={'name': 'uniform'}
[I 2026-06-01 12:05:14,365] Trial 12 finished with value: 0.16898861367691043 and parameters: {'hidden_dims': '[512, 256]', 'dropout': 0.039159465533104454, 'batch_norm': False, 'lr': 0.0004987709837145536, 'weight_decay': 0.0008865268327078721, 'epochs': 63, 'loss': 'mae', 'optimizer': 'adam', 'use_snp_selection': False, 'n_pcs': 1000}. Best is trial 11 with value: 0.16998310233892416.
2026-06-01 12:05:14 | INFO | Trial 13 | outer=3 | hidden=[512, 256] epochs=70 lr=4.127e-04 wd=8.331e-04 n_pcs=500 weight={'name': 'uniform'}
[I 2026-06-01 12:05:15,832] Trial 13 pruned. 
2026-06-01 12:05:15 | INFO | Trial 14 | outer=3 | hidden=[512, 256] epochs=100 lr=2.119e-04 wd=1.266e-04 n_pcs=1500 weight={'name': 'uniform'}
[I 2026-06-01 12:05:18,117] Trial 14 pruned. 
2026-06-01 12:05:18 | INFO | Trial 15 | outer=3 | hidden=[512, 256] epochs=55 lr=2.279e-04 wd=1.125e-04 n_pcs=1000 weight={'name': 'uniform'}
[I 2026-06-01 12:05:20,639] Trial 15 finished with value: 0.16763120424555641 and parameters: {'hidden_dims': '[512, 256]', 'dropout': 0.23108467442505315, 'batch_norm': False, 'lr': 0.00022793071054320622, 'weight_decay': 0.00011247744525966537, 'epochs': 55, 'loss': 'mae', 'optimizer': 'adam', 'use_snp_selection': False, 'n_pcs': 1000}. Best is trial 11 with value: 0.16998310233892416.
2026-06-01 12:05:20 | INFO | Trial 16 | outer=3 | hidden=[512, 256] epochs=140 lr=4.846e-04 wd=1.742e-04 n_pcs=2000 weight={'name': 'uniform'}
[I 2026-06-01 12:05:25,865] Trial 16 finished with value: 0.16783201651935686 and parameters: {'hidden_dims': '[512, 256]', 'dropout': 0.4144224352576258, 'batch_norm': False, 'lr': 0.0004845729743728352, 'weight_decay': 0.00017416232297649785, 'epochs': 140, 'loss': 'mae', 'optimizer': 'adam', 'use_snp_selection': False, 'n_pcs': 2000}. Best is trial 11 with value: 0.16998310233892416.
2026-06-01 12:05:25 | INFO | Trial 17 | outer=3 | hidden=[256, 128] epochs=97 lr=2.724e-04 wd=1.184e-08 n_pcs=1000 weight={'name': 'uniform'}
[I 2026-06-01 12:05:28,692] Trial 17 finished with value: 0.17636131479717382 and parameters: {'hidden_dims': '[256, 128]', 'dropout': 0.5998375031807794, 'batch_norm': False, 'lr': 0.0002723819199129278, 'weight_decay': 1.1840058441529551e-08, 'epochs': 97, 'loss': 'mae', 'optimizer': 'adam', 'use_snp_selection': False, 'n_pcs': 1000}. Best is trial 17 with value: 0.17636131479717382.
2026-06-01 12:05:28 | INFO | Trial 18 | outer=3 | hidden=[256, 128] epochs=171 lr=2.478e-04 wd=6.452e-07 n_pcs=2000 weight={'name': 'uniform'}
[I 2026-06-01 12:05:32,675] Trial 18 finished with value: 0.17265976833602134 and parameters: {'hidden_dims': '[256, 128]', 'dropout': 0.5842505243526348, 'batch_norm': False, 'lr': 0.00024782952030278266, 'weight_decay': 6.45226711189004e-07, 'epochs': 171, 'loss': 'mae', 'optimizer': 'adam', 'use_snp_selection': False, 'n_pcs': 2000}. Best is trial 17 with value: 0.17636131479717382.
2026-06-01 12:05:32 | INFO | Trial 19 | outer=3 | hidden=[256, 128] epochs=174 lr=1.364e-04 wd=1.453e-08 n_pcs=2000 weight={'name': 'uniform'}
[I 2026-06-01 12:05:36,675] Trial 19 finished with value: 0.17594693537475495 and parameters: {'hidden_dims': '[256, 128]', 'dropout': 0.5911513520687532, 'batch_norm': False, 'lr': 0.00013642496326773194, 'weight_decay': 1.4526511192558723e-08, 'epochs': 174, 'loss': 'mae', 'optimizer': 'adam', 'use_snp_selection': False, 'n_pcs': 2000}. Best is trial 17 with value: 0.17636131479717382.
2026-06-01 12:05:36 | INFO | Trial 20 | outer=3 | hidden=[256, 128] epochs=178 lr=1.226e-04 wd=1.167e-08 n_pcs=3500 weight={'name': 'uniform'}
[I 2026-06-01 12:05:42,124] Trial 20 finished with value: 0.1474268457567759 and parameters: {'hidden_dims': '[256, 128]', 'dropout': 0.5984966851717791, 'batch_norm': False, 'lr': 0.00012255111666392953, 'weight_decay': 1.1669655169591443e-08, 'epochs': 178, 'loss': 'mae', 'optimizer': 'adam', 'use_snp_selection': False, 'n_pcs': 3500}. Best is trial 17 with value: 0.17636131479717382.
2026-06-01 12:05:42 | INFO | Trial 21 | outer=3 | hidden=[256, 128] epochs=169 lr=2.328e-04 wd=1.033e-08 n_pcs=2000 weight={'name': 'uniform'}
[I 2026-06-01 12:05:46,066] Trial 21 finished with value: 0.15582760088424374 and parameters: {'hidden_dims': '[256, 128]', 'dropout': 0.5956378118674369, 'batch_norm': False, 'lr': 0.00023276505928984873, 'weight_decay': 1.0334036243030554e-08, 'epochs': 169, 'loss': 'mae', 'optimizer': 'adam', 'use_snp_selection': False, 'n_pcs': 2000}. Best is trial 17 with value: 0.17636131479717382.
2026-06-01 12:05:46 | INFO | Trial 22 | outer=3 | hidden=[256, 128] epochs=190 lr=1.478e-04 wd=6.380e-07 n_pcs=2000 weight={'name': 'uniform'}
[I 2026-06-01 12:05:50,300] Trial 22 finished with value: 0.1786418686751212 and parameters: {'hidden_dims': '[256, 128]', 'dropout': 0.5297548937252166, 'batch_norm': False, 'lr': 0.00014784168445079575, 'weight_decay': 6.37993514143594e-07, 'epochs': 190, 'loss': 'mae', 'optimizer': 'adam', 'use_snp_selection': False, 'n_pcs': 2000}. Best is trial 22 with value: 0.1786418686751212.
2026-06-01 12:05:50 | INFO | Trial 23 | outer=3 | hidden=[256, 128] epochs=243 lr=1.321e-04 wd=3.054e-08 n_pcs=1000 weight={'name': 'uniform'}
[I 2026-06-01 12:05:54,933] Trial 23 finished with value: 0.17882329200643524 and parameters: {'hidden_dims': '[256, 128]', 'dropout': 0.5197702393626625, 'batch_norm': False, 'lr': 0.00013206782680302143, 'weight_decay': 3.053777270351716e-08, 'epochs': 243, 'loss': 'mae', 'optimizer': 'adam', 'use_snp_selection': False, 'n_pcs': 1000}. Best is trial 23 with value: 0.17882329200643524.
2026-06-01 12:05:54 | INFO | Trial 24 | outer=3 | hidden=[256, 128] epochs=245 lr=9.738e-05 wd=3.370e-08 n_pcs=1000 weight={'name': 'uniform'}
[I 2026-06-01 12:05:59,606] Trial 24 finished with value: 0.16844010544111435 and parameters: {'hidden_dims': '[256, 128]', 'dropout': 0.524159999997123, 'batch_norm': False, 'lr': 9.737957544481419e-05, 'weight_decay': 3.369630206295562e-08, 'epochs': 245, 'loss': 'mae', 'optimizer': 'adam', 'use_snp_selection': False, 'n_pcs': 1000}. Best is trial 23 with value: 0.17882329200643524.
2026-06-01 12:05:59 | INFO | Trial 25 | outer=3 | hidden=[256, 128] epochs=210 lr=1.872e-04 wd=3.709e-07 n_pcs=500 weight={'name': 'uniform'}
[I 2026-06-01 12:06:03,800] Trial 25 finished with value: 0.1583939146226368 and parameters: {'hidden_dims': '[256, 128]', 'dropout': 0.5172625988857698, 'batch_norm': False, 'lr': 0.00018723546038926732, 'weight_decay': 3.7089403068941993e-07, 'epochs': 210, 'loss': 'mae', 'optimizer': 'adam', 'use_snp_selection': False, 'n_pcs': 500}. Best is trial 23 with value: 0.17882329200643524.
2026-06-01 12:06:03 | INFO | Trial 26 | outer=3 | hidden=[1024, 256] epochs=248 lr=3.089e-04 wd=6.145e-07 n_pcs=1000 weight={'name': 'uniform'}
[I 2026-06-01 12:06:09,304] Trial 26 pruned. 
2026-06-01 12:06:09 | INFO | Trial 27 | outer=3 | hidden=[512, 64] epochs=192 lr=1.636e-04 wd=2.993e-08 n_pcs=1000 weight={'name': 'uniform'}
[I 2026-06-01 12:06:11,860] Trial 27 pruned. 
2026-06-01 12:06:11 | INFO | Trial 28 | outer=3 | hidden=[512, 128] epochs=229 lr=5.555e-05 wd=1.350e-06 n_pcs=500 weight={'name': 'uniform'}
[I 2026-06-01 12:06:16,258] Trial 28 finished with value: 0.1570597389249236 and parameters: {'hidden_dims': '[512, 128]', 'dropout': 0.5486641400414755, 'batch_norm': False, 'lr': 5.554873360099073e-05, 'weight_decay': 1.3504119127973736e-06, 'epochs': 229, 'loss': 'mae', 'optimizer': 'adam', 'use_snp_selection': False, 'n_pcs': 500}. Best is trial 23 with value: 0.17882329200643524.
2026-06-01 12:06:16 | INFO | Trial 29 | outer=3 | hidden=[256, 64] epochs=146 lr=9.654e-05 wd=3.463e-08 n_pcs=1500 weight={'name': 'uniform'}
[I 2026-06-01 12:06:18,353] Trial 29 pruned. 
2026-06-01 12:06:18 | INFO | Trial 30 | outer=3 | hidden=[256, 128] epochs=267 lr=3.021e-04 wd=1.877e-05 n_pcs=2500 weight={'name': 'uniform'}
[I 2026-06-01 12:06:24,232] Trial 30 finished with value: 0.1445080997910039 and parameters: {'hidden_dims': '[256, 128]', 'dropout': 0.46509631337475443, 'batch_norm': False, 'lr': 0.00030211826709879955, 'weight_decay': 1.8765189051196377e-05, 'epochs': 267, 'loss': 'mae', 'optimizer': 'adam', 'use_snp_selection': False, 'n_pcs': 2500}. Best is trial 23 with value: 0.17882329200643524.
2026-06-01 12:06:24 | INFO | Trial 31 | outer=3 | hidden=[256, 128] epochs=232 lr=1.379e-04 wd=2.208e-08 n_pcs=2000 weight={'name': 'uniform'}
[I 2026-06-01 12:06:29,024] Trial 31 finished with value: 0.17245107711428256 and parameters: {'hidden_dims': '[256, 128]', 'dropout': 0.5537220047507738, 'batch_norm': False, 'lr': 0.0001379213933334804, 'weight_decay': 2.2079836879871667e-08, 'epochs': 232, 'loss': 'mae', 'optimizer': 'adam', 'use_snp_selection': False, 'n_pcs': 2000}. Best is trial 23 with value: 0.17882329200643524.
2026-06-01 12:06:29 | INFO | Trial 32 | outer=3 | hidden=[256, 128] epochs=190 lr=9.704e-05 wd=2.053e-07 n_pcs=2000 weight={'name': 'uniform'}
[I 2026-06-01 12:06:33,261] Trial 32 finished with value: 0.16958583458159332 and parameters: {'hidden_dims': '[256, 128]', 'dropout': 0.5411379957228574, 'batch_norm': False, 'lr': 9.704264231083031e-05, 'weight_decay': 2.0530210492449263e-07, 'epochs': 190, 'loss': 'mae', 'optimizer': 'adam', 'use_snp_selection': False, 'n_pcs': 2000}. Best is trial 23 with value: 0.17882329200643524.
2026-06-01 12:06:33 | INFO | Trial 33 | outer=3 | hidden=[256, 128] epochs=83 lr=1.657e-04 wd=6.622e-08 n_pcs=1500 weight={'name': 'uniform'}
[I 2026-06-01 12:06:35,152] Trial 33 pruned. 
2026-06-01 12:06:35 | INFO | Trial 34 | outer=3 | hidden=[1024, 256] epochs=127 lr=1.177e-04 wd=1.123e-08 n_pcs=2500 weight={'name': 'uniform'}
