[I 2026-04-22 15:07:57,254] Trial 68 finished with value: 0.1803324292754708 and parameters: {'alpha': 7912198.150812033, 'use_snp_selection': False, 'weight_scheme': 'exponential', 'weight_clip_max': None, 'weight_exponential_beta': 1.9161094224923683}. Best is trial 11 with value: 0.19046321988602072.
[I 2026-04-22 15:08:54,524] Trial 69 finished with value: 0.18516117589594996 and parameters: {'alpha': 253004.57458729396, 'use_snp_selection': False, 'weight_scheme': 'top-heavy', 'weight_clip_max': None, 'weight_topheavy_top_frac': 0.25899001867237376, 'weight_topheavy_low': 0.8174449436680493, 'weight_topheavy_high': 3.637317440114518}. Best is trial 11 with value: 0.19046321988602072.
[I 2026-04-22 15:09:53,805] Trial 70 finished with value: 0.14505228834197934 and parameters: {'alpha': 7668.437183232372, 'use_snp_selection': False, 'weight_scheme': 'minmax', 'weight_clip_max': None, 'weight_minmax_eps': 0.04096728050004119}. Best is trial 11 with value: 0.19046321988602072.
[I 2026-04-22 15:10:52,522] Trial 71 finished with value: 0.19012319491392402 and parameters: {'alpha': 748178.6285058506, 'use_snp_selection': False, 'weight_scheme': 'minmax', 'weight_clip_max': None, 'weight_minmax_eps': 0.06202620843074218}. Best is trial 11 with value: 0.19046321988602072.
[I 2026-04-22 15:11:49,061] Trial 72 finished with value: 0.19022455108166544 and parameters: {'alpha': 494672.42823503364, 'use_snp_selection': False, 'weight_scheme': 'minmax', 'weight_clip_max': None, 'weight_minmax_eps': 0.04127240442889836}. Best is trial 11 with value: 0.19046321988602072.
[I 2026-04-22 15:12:47,069] Trial 73 finished with value: 0.1879451170976769 and parameters: {'alpha': 266468.25956481847, 'use_snp_selection': False, 'weight_scheme': 'minmax', 'weight_clip_max': None, 'weight_minmax_eps': 0.025102524784878517}. Best is trial 11 with value: 0.19046321988602072.
[I 2026-04-22 15:13:44,054] Trial 74 finished with value: 0.1903700722187958 and parameters: {'alpha': 611509.513912107, 'use_snp_selection': False, 'weight_scheme': 'minmax', 'weight_clip_max': None, 'weight_minmax_eps': 0.04360798419417049}. Best is trial 11 with value: 0.19046321988602072.
[I 2026-04-22 15:14:42,024] Trial 75 finished with value: 0.18222325612289098 and parameters: {'alpha': 126628.64763500972, 'use_snp_selection': False, 'weight_scheme': 'minmax', 'weight_clip_max': None, 'weight_minmax_eps': 0.014562318467854992}. Best is trial 11 with value: 0.19046321988602072.
[I 2026-04-22 15:15:40,393] Trial 76 finished with value: 0.17624840176325682 and parameters: {'alpha': 1429927.9916468475, 'use_snp_selection': False, 'weight_scheme': 'exponential', 'weight_clip_max': 10.0, 'weight_exponential_beta': 5.322828666648146}. Best is trial 11 with value: 0.19046321988602072.
[I 2026-04-22 15:16:38,129] Trial 77 finished with value: 0.12170569747974488 and parameters: {'alpha': 24.38150925667361, 'use_snp_selection': False, 'weight_scheme': 'minmax', 'weight_clip_max': None, 'weight_minmax_eps': 0.04245300373051374}. Best is trial 11 with value: 0.19046321988602072.
[I 2026-04-22 15:18:19,583] Trial 78 finished with value: 0.16904113471031504 and parameters: {'alpha': 191467.86021654453, 'use_snp_selection': True, 'num_snps': 25609, 'weight_scheme': 'uniform', 'weight_clip_max': None}. Best is trial 11 with value: 0.19046321988602072.
[I 2026-04-22 15:19:18,037] Trial 79 finished with value: 0.19033543790499585 and parameters: {'alpha': 549585.6985751484, 'use_snp_selection': False, 'weight_scheme': 'minmax', 'weight_clip_max': 5.0, 'weight_minmax_eps': 0.06347643229154805}. Best is trial 11 with value: 0.19046321988602072.
[I 2026-04-22 15:20:14,807] Trial 80 finished with value: 0.17793644664557043 and parameters: {'alpha': 81917.3071308534, 'use_snp_selection': False, 'weight_scheme': 'minmax', 'weight_clip_max': 5.0, 'weight_minmax_eps': 0.06513027691757113}. Best is trial 11 with value: 0.19046321988602072.
[I 2026-04-22 15:21:12,477] Trial 81 finished with value: 0.1902375844628756 and parameters: {'alpha': 593317.0084466556, 'use_snp_selection': False, 'weight_scheme': 'minmax', 'weight_clip_max': 5.0, 'weight_minmax_eps': 0.08124611873406862}. Best is trial 11 with value: 0.19046321988602072.
[I 2026-04-22 15:22:10,315] Trial 82 finished with value: 0.19024187038091814 and parameters: {'alpha': 590861.288609858, 'use_snp_selection': False, 'weight_scheme': 'minmax', 'weight_clip_max': 5.0, 'weight_minmax_eps': 0.08068820151178392}. Best is trial 11 with value: 0.19046321988602072.
[I 2026-04-22 15:23:07,759] Trial 83 finished with value: 0.19023027259905986 and parameters: {'alpha': 551204.0401962067, 'use_snp_selection': False, 'weight_scheme': 'minmax', 'weight_clip_max': 5.0, 'weight_minmax_eps': 0.08351274432068918}. Best is trial 11 with value: 0.19046321988602072.
[I 2026-04-22 15:24:05,324] Trial 84 finished with value: 0.18839160824593879 and parameters: {'alpha': 274063.26636976335, 'use_snp_selection': False, 'weight_scheme': 'minmax', 'weight_clip_max': 5.0, 'weight_minmax_eps': 0.08967876627493292}. Best is trial 11 with value: 0.19046321988602072.
[I 2026-04-22 15:25:02,888] Trial 85 finished with value: 0.18454439018871224 and parameters: {'alpha': 597673.9543022581, 'use_snp_selection': False, 'weight_scheme': 'linear', 'weight_clip_max': 5.0, 'weight_linear_min_weight': 0.9770357444625603, 'weight_linear_max_weight': 2.2763941704844957}. Best is trial 11 with value: 0.19046321988602072.
[I 2026-04-22 15:26:01,062] Trial 86 finished with value: 0.18219882210007698 and parameters: {'alpha': 1113862.3434601082, 'use_snp_selection': False, 'weight_scheme': 'top-heavy', 'weight_clip_max': 5.0, 'weight_topheavy_top_frac': 0.25094364200168456, 'weight_topheavy_low': 0.817379247358118, 'weight_topheavy_high': 3.4277953289335255}. Best is trial 11 with value: 0.19046321988602072.
[I 2026-04-22 15:26:59,198] Trial 87 finished with value: 0.1858608723581163 and parameters: {'alpha': 1861127.9969724831, 'use_snp_selection': False, 'weight_scheme': 'minmax', 'weight_clip_max': 5.0, 'weight_minmax_eps': 0.08382304547489708}. Best is trial 11 with value: 0.19046321988602072.
[I 2026-04-22 15:27:57,012] Trial 88 finished with value: 0.16239271207830203 and parameters: {'alpha': 26872.670026960168, 'use_snp_selection': False, 'weight_scheme': 'exponential', 'weight_clip_max': 5.0, 'weight_exponential_beta': 3.1239697762312715}. Best is trial 11 with value: 0.19046321988602072.
[I 2026-04-22 15:28:53,921] Trial 89 finished with value: 0.18931292973700534 and parameters: {'alpha': 339939.77164161165, 'use_snp_selection': False, 'weight_scheme': 'minmax', 'weight_clip_max': 5.0, 'weight_minmax_eps': 0.07354005926672436}. Best is trial 11 with value: 0.19046321988602072.
[I 2026-04-22 15:30:18,549] Trial 90 finished with value: 0.1739380367848642 and parameters: {'alpha': 1068482.1648081029, 'use_snp_selection': True, 'num_snps': 14059, 'weight_scheme': 'minmax', 'weight_clip_max': 5.0, 'weight_minmax_eps': 0.09804807869840013}. Best is trial 11 with value: 0.19046321988602072.
[I 2026-04-22 15:31:15,717] Trial 91 finished with value: 0.19023707648582608 and parameters: {'alpha': 607689.0259046446, 'use_snp_selection': False, 'weight_scheme': 'minmax', 'weight_clip_max': 5.0, 'weight_minmax_eps': 0.07969550302620351}. Best is trial 11 with value: 0.19046321988602072.
[I 2026-04-22 15:32:11,241] Trial 92 finished with value: 0.1902435283750431 and parameters: {'alpha': 599719.5089281197, 'use_snp_selection': False, 'weight_scheme': 'minmax', 'weight_clip_max': 5.0, 'weight_minmax_eps': 0.07951765622872224}. Best is trial 11 with value: 0.19046321988602072.
[I 2026-04-22 15:33:06,869] Trial 93 finished with value: 0.1842033124355645 and parameters: {'alpha': 2485242.66626422, 'use_snp_selection': False, 'weight_scheme': 'minmax', 'weight_clip_max': 5.0, 'weight_minmax_eps': 0.06711535732278781}. Best is trial 11 with value: 0.19046321988602072.
[I 2026-04-22 15:34:03,100] Trial 94 finished with value: 0.1868391644282688 and parameters: {'alpha': 213946.1007282788, 'use_snp_selection': False, 'weight_scheme': 'minmax', 'weight_clip_max': 5.0, 'weight_minmax_eps': 0.19586385370501766}. Best is trial 11 with value: 0.19046321988602072.
[I 2026-04-22 15:34:59,099] Trial 95 finished with value: 0.18043463797633652 and parameters: {'alpha': 1446543.6522360444, 'use_snp_selection': False, 'weight_scheme': 'linear', 'weight_clip_max': 5.0, 'weight_linear_min_weight': 0.6951767542890472, 'weight_linear_max_weight': 1.7496344585675179}. Best is trial 11 with value: 0.19046321988602072.
[I 2026-04-22 15:35:54,164] Trial 96 finished with value: 0.1890905022675309 and parameters: {'alpha': 320828.1853420745, 'use_snp_selection': False, 'weight_scheme': 'minmax', 'weight_clip_max': 5.0, 'weight_minmax_eps': 0.07430399843598438}. Best is trial 11 with value: 0.19046321988602072.
[I 2026-04-22 15:36:48,611] Trial 97 finished with value: 0.18519704418244304 and parameters: {'alpha': 167827.48588231913, 'use_snp_selection': False, 'weight_scheme': 'minmax', 'weight_clip_max': 5.0, 'weight_minmax_eps': 0.168688478890306}. Best is trial 11 with value: 0.19046321988602072.
[I 2026-04-22 15:37:42,330] Trial 98 finished with value: 0.1874924311439102 and parameters: {'alpha': 639921.4280269515, 'use_snp_selection': False, 'weight_scheme': 'exponential', 'weight_clip_max': 5.0, 'weight_exponential_beta': 1.1975777648687091}. Best is trial 11 with value: 0.19046321988602072.
[I 2026-04-22 15:38:36,020] Trial 99 finished with value: 0.13397275186207205 and parameters: {'alpha': 2935.9543972627475, 'use_snp_selection': False, 'weight_scheme': 'minmax', 'weight_clip_max': 5.0, 'weight_minmax_eps': 0.10910809479339652}. Best is trial 11 with value: 0.19046321988602072.
