[I 2026-04-21 19:10:51,029] Trial 0 finished with value: -0.025554142464105156 and parameters: {'hidden_dims': '[256, 128]', 'dropout': 0.18584155530312246, 'batch_norm': True, 'lr': 9.012665953349533e-06, 'weight_decay': 4.96591963698479e-06, 'epochs': 105, 'loss': 'mse', 'optimizer': 'sgd', 'use_snp_selection': True, 'num_snps': 25583, 'weight_scheme': 'minmax', 'weight_clip_max': 5.0, 'weight_minmax_eps': 0.14026014881292506}. Best is trial 0 with value: -0.025554142464105156.
[I 2026-04-21 19:10:59,158] Trial 36 finished with value: 0.08579376890906036 and parameters: {'hidden_dims': '[256, 64]', 'dropout': 0.29273775973188876, 'batch_norm': True, 'lr': 2.8727258792310164e-05, 'weight_decay': 5.10403431325084e-07, 'epochs': 68, 'loss': 'mae', 'optimizer': 'sgd', 'use_snp_selection': False, 'weight_scheme': 'top-heavy', 'weight_clip_max': None, 'weight_topheavy_top_frac': 0.44406076488667146, 'weight_topheavy_low': 0.512462779629931, 'weight_topheavy_high': 5.943336978604515}. Best is trial 2 with value: 0.15149538719366348.
[I 2026-04-21 19:11:03,365] Trial 1 finished with value: 0.06393616192708387 and parameters: {'hidden_dims': '[256, 64]', 'dropout': 0.05000949662985405, 'batch_norm': True, 'lr': 0.00015647443054904835, 'weight_decay': 5.158896024962846e-05, 'epochs': 152, 'loss': 'mse', 'optimizer': 'sgd', 'use_snp_selection': False, 'weight_scheme': 'linear', 'weight_clip_max': None, 'weight_linear_min_weight': 0.21922985165550554, 'weight_linear_max_weight': 1.6260435767424388}. Best is trial 1 with value: 0.06393616192708387.
[I 2026-04-21 19:11:25,571] Trial 2 finished with value: 0.015344602042256126 and parameters: {'hidden_dims': '[512, 128]', 'dropout': 0.2736730891340176, 'batch_norm': True, 'lr': 7.298114623433994e-05, 'weight_decay': 5.6346010385734023e-08, 'epochs': 185, 'loss': 'mae', 'optimizer': 'sgd', 'use_snp_selection': True, 'num_snps': 14091, 'weight_scheme': 'minmax', 'weight_clip_max': 10.0, 'weight_minmax_eps': 0.045780660776687306}. Best is trial 1 with value: 0.06393616192708387.
[I 2026-04-21 19:11:37,141] Trial 37 finished with value: 0.10444394832774269 and parameters: {'hidden_dims': '[512, 64]', 'dropout': 0.16082173701717992, 'batch_norm': True, 'lr': 1.5224608631730574e-06, 'weight_decay': 2.6428090482932645e-06, 'epochs': 237, 'loss': 'mse', 'optimizer': 'adam', 'use_snp_selection': False, 'weight_scheme': 'minmax', 'weight_clip_max': None, 'weight_minmax_eps': 0.15148629507964284}. Best is trial 2 with value: 0.15149538719366348.
[I 2026-04-21 19:12:00,425] Trial 38 finished with value: 0.04771835629141206 and parameters: {'hidden_dims': '[256, 64]', 'dropout': 0.19862445266587125, 'batch_norm': False, 'lr': 3.732368915606845e-05, 'weight_decay': 1.3945299534054238e-07, 'epochs': 278, 'loss': 'mae', 'optimizer': 'sgd', 'use_snp_selection': False, 'weight_scheme': 'exponential', 'weight_clip_max': 5.0, 'weight_exponential_beta': 7.887640538040634}. Best is trial 2 with value: 0.15149538719366348.
[I 2026-04-21 19:12:03,751] Trial 3 finished with value: 0.03531117628909853 and parameters: {'hidden_dims': '[512, 64]', 'dropout': 0.30157795416637295, 'batch_norm': False, 'lr': 2.007492282795256e-05, 'weight_decay': 5.496446859789657e-06, 'epochs': 284, 'loss': 'mse', 'optimizer': 'sgd', 'use_snp_selection': False, 'weight_scheme': 'linear', 'weight_clip_max': None, 'weight_linear_min_weight': 0.24682154527102826, 'weight_linear_max_weight': 1.8338910783134623}. Best is trial 1 with value: 0.06393616192708387.
[I 2026-04-21 19:12:15,763] Trial 4 finished with value: 0.03421813927161497 and parameters: {'hidden_dims': '[256, 64]', 'dropout': 0.18128694708490736, 'batch_norm': False, 'lr': 8.951826748007403e-05, 'weight_decay': 2.1781541495465197e-07, 'epochs': 147, 'loss': 'mse', 'optimizer': 'sgd', 'use_snp_selection': False, 'weight_scheme': 'top-heavy', 'weight_clip_max': 5.0, 'weight_topheavy_top_frac': 0.1724888194073277, 'weight_topheavy_low': 1.1620865802171172, 'weight_topheavy_high': 3.476906528073177}. Best is trial 1 with value: 0.06393616192708387.
[I 2026-04-21 19:12:22,281] Trial 39 finished with value: 0.10271058044355459 and parameters: {'hidden_dims': '[512, 128]', 'dropout': 0.29317244956942834, 'batch_norm': False, 'lr': 9.037248813434402e-05, 'weight_decay': 8.268781125533374e-06, 'epochs': 132, 'loss': 'mae', 'optimizer': 'adam', 'use_snp_selection': False, 'weight_scheme': 'linear', 'weight_clip_max': 10.0, 'weight_linear_min_weight': 0.5594252957157683, 'weight_linear_max_weight': 2.536383614588311}. Best is trial 2 with value: 0.15149538719366348.
[I 2026-04-21 19:12:26,060] Trial 5 finished with value: 0.03580823742101565 and parameters: {'hidden_dims': '[256, 64]', 'dropout': 0.2571412946970998, 'batch_norm': True, 'lr': 3.546238022482882e-05, 'weight_decay': 1.0185234767613396e-06, 'epochs': 119, 'loss': 'mse', 'optimizer': 'sgd', 'use_snp_selection': False, 'weight_scheme': 'linear', 'weight_clip_max': 10.0, 'weight_linear_min_weight': 0.9405832045183805, 'weight_linear_max_weight': 3.413610925325811}. Best is trial 1 with value: 0.06393616192708387.
[I 2026-04-21 19:12:44,729] Trial 6 finished with value: 0.09611617317736637 and parameters: {'hidden_dims': '[256, 64]', 'dropout': 0.037961443806696214, 'batch_norm': True, 'lr': 3.644202049829694e-05, 'weight_decay': 9.73334309820277e-06, 'epochs': 243, 'loss': 'mae', 'optimizer': 'adam', 'use_snp_selection': False, 'weight_scheme': 'minmax', 'weight_clip_max': None, 'weight_minmax_eps': 0.08689611239934374}. Best is trial 6 with value: 0.09611617317736637.
[I 2026-04-21 19:13:12,679] Trial 0 finished with value: 0.02991540182180027 and parameters: {'hidden_dims': '[256, 128]', 'dropout': 0.18584155530312246, 'batch_norm': True, 'lr': 9.012665953349533e-06, 'weight_decay': 4.96591963698479e-06, 'epochs': 105, 'loss': 'mse', 'optimizer': 'sgd', 'use_snp_selection': True, 'num_snps': 25583, 'weight_scheme': 'minmax', 'weight_clip_max': 5.0, 'weight_minmax_eps': 0.14026014881292506}. Best is trial 0 with value: 0.02991540182180027.
[I 2026-04-21 19:13:25,636] Trial 1 finished with value: 0.16141829819381512 and parameters: {'hidden_dims': '[256, 64]', 'dropout': 0.05000949662985405, 'batch_norm': True, 'lr': 0.00015647443054904835, 'weight_decay': 5.158896024962846e-05, 'epochs': 152, 'loss': 'mse', 'optimizer': 'sgd', 'use_snp_selection': False, 'weight_scheme': 'linear', 'weight_clip_max': None, 'weight_linear_min_weight': 0.21922985165550554, 'weight_linear_max_weight': 1.6260435767424388}. Best is trial 1 with value: 0.16141829819381512.
[I 2026-04-21 19:13:28,967] Trial 7 finished with value: 0.004556562570181011 and parameters: {'hidden_dims': '[512, 128]', 'dropout': 0.1304538168539244, 'batch_norm': False, 'lr': 1.5408060926311233e-05, 'weight_decay': 2.1989735568314356e-08, 'epochs': 250, 'loss': 'mse', 'optimizer': 'sgd', 'use_snp_selection': True, 'num_snps': 42550, 'weight_scheme': 'exponential', 'weight_clip_max': 10.0, 'weight_exponential_beta': 2.758850226029358}. Best is trial 6 with value: 0.09611617317736637.
[I 2026-04-21 19:13:48,631] Trial 2 finished with value: 0.06983311214957054 and parameters: {'hidden_dims': '[512, 128]', 'dropout': 0.2736730891340176, 'batch_norm': True, 'lr': 7.298114623433994e-05, 'weight_decay': 5.6346010385734023e-08, 'epochs': 185, 'loss': 'mae', 'optimizer': 'sgd', 'use_snp_selection': True, 'num_snps': 14091, 'weight_scheme': 'minmax', 'weight_clip_max': 10.0, 'weight_minmax_eps': 0.045780660776687306}. Best is trial 1 with value: 0.16141829819381512.
[I 2026-04-21 19:13:50,940] Trial 8 finished with value: 0.0644517650301942 and parameters: {'hidden_dims': '[256, 128]', 'dropout': 0.05742396906738376, 'batch_norm': False, 'lr': 1.9761509510575143e-06, 'weight_decay': 2.933492239224291e-07, 'epochs': 82, 'loss': 'mae', 'optimizer': 'adam', 'use_snp_selection': True, 'num_snps': 29883, 'weight_scheme': 'minmax', 'weight_clip_max': 5.0, 'weight_minmax_eps': 0.0051288771726799584}. Best is trial 6 with value: 0.09611617317736637.
[I 2026-04-21 19:14:17,992] Trial 9 finished with value: 0.029126246071771774 and parameters: {'hidden_dims': '[256, 128]', 'dropout': 0.5795930447285386, 'batch_norm': False, 'lr': 0.00011782025260263196, 'weight_decay': 0.0005562063174273634, 'epochs': 218, 'loss': 'mae', 'optimizer': 'adamw', 'use_snp_selection': True, 'num_snps': 32226, 'weight_scheme': 'minmax', 'weight_clip_max': 5.0, 'weight_minmax_eps': 0.09600289105543994}. Best is trial 6 with value: 0.09611617317736637.
[I 2026-04-21 19:14:28,783] Trial 3 finished with value: 0.05024760905599799 and parameters: {'hidden_dims': '[512, 64]', 'dropout': 0.30157795416637295, 'batch_norm': False, 'lr': 2.007492282795256e-05, 'weight_decay': 5.496446859789657e-06, 'epochs': 284, 'loss': 'mse', 'optimizer': 'sgd', 'use_snp_selection': False, 'weight_scheme': 'linear', 'weight_clip_max': None, 'weight_linear_min_weight': 0.24682154527102826, 'weight_linear_max_weight': 1.8338910783134623}. Best is trial 1 with value: 0.16141829819381512.
[I 2026-04-21 19:14:41,354] Trial 4 finished with value: 0.12796772796374442 and parameters: {'hidden_dims': '[256, 64]', 'dropout': 0.18128694708490736, 'batch_norm': False, 'lr': 8.951826748007403e-05, 'weight_decay': 2.1781541495465197e-07, 'epochs': 147, 'loss': 'mse', 'optimizer': 'sgd', 'use_snp_selection': False, 'weight_scheme': 'top-heavy', 'weight_clip_max': 5.0, 'weight_topheavy_top_frac': 0.1724888194073277, 'weight_topheavy_low': 1.1620865802171172, 'weight_topheavy_high': 3.476906528073177}. Best is trial 1 with value: 0.16141829819381512.
[I 2026-04-21 19:14:52,158] Trial 5 finished with value: 0.05595726958659591 and parameters: {'hidden_dims': '[256, 64]', 'dropout': 0.2571412946970998, 'batch_norm': True, 'lr': 3.546238022482882e-05, 'weight_decay': 1.0185234767613396e-06, 'epochs': 119, 'loss': 'mse', 'optimizer': 'sgd', 'use_snp_selection': False, 'weight_scheme': 'linear', 'weight_clip_max': 10.0, 'weight_linear_min_weight': 0.9405832045183805, 'weight_linear_max_weight': 3.413610925325811}. Best is trial 1 with value: 0.16141829819381512.
[I 2026-04-21 19:14:58,411] Trial 10 finished with value: 0.02654550367489149 and parameters: {'hidden_dims': '[512, 64]', 'dropout': 0.4338375928678635, 'batch_norm': True, 'lr': 0.0009667920285641304, 'weight_decay': 6.976468597792388e-05, 'epochs': 294, 'loss': 'mae', 'optimizer': 'adam', 'use_snp_selection': False, 'weight_scheme': 'uniform', 'weight_clip_max': None}. Best is trial 6 with value: 0.09611617317736637.
[I 2026-04-21 19:15:11,631] Trial 6 finished with value: 0.1856241360339532 and parameters: {'hidden_dims': '[256, 64]', 'dropout': 0.037961443806696214, 'batch_norm': True, 'lr': 3.644202049829694e-05, 'weight_decay': 9.73334309820277e-06, 'epochs': 243, 'loss': 'mae', 'optimizer': 'adam', 'use_snp_selection': False, 'weight_scheme': 'minmax', 'weight_clip_max': None, 'weight_minmax_eps': 0.08689611239934374}. Best is trial 6 with value: 0.1856241360339532.
[I 2026-04-21 19:15:26,325] Trial 11 finished with value: 0.04929371728387569 and parameters: {'hidden_dims': '[256, 128]', 'dropout': 0.009590830567787208, 'batch_norm': False, 'lr': 1.0272166034929754e-06, 'weight_decay': 6.639177970949987e-07, 'epochs': 50, 'loss': 'mae', 'optimizer': 'adam', 'use_snp_selection': True, 'num_snps': 57843, 'weight_scheme': 'minmax', 'weight_clip_max': 5.0, 'weight_minmax_eps': 0.011584305851229494}. Best is trial 6 with value: 0.09611617317736637.
[I 2026-04-21 19:15:43,129] Trial 12 finished with value: 0.05597300851801933 and parameters: {'hidden_dims': '[256, 64]', 'dropout': 0.0851395157391335, 'batch_norm': True, 'lr': 3.174224067518343e-06, 'weight_decay': 1.7200309243424394e-05, 'epochs': 221, 'loss': 'mae', 'optimizer': 'adam', 'use_snp_selection': False, 'weight_scheme': 'minmax', 'weight_clip_max': None, 'weight_minmax_eps': 0.19711170525101931}. Best is trial 6 with value: 0.09611617317736637.
[I 2026-04-21 19:15:56,235] Trial 7 finished with value: 0.018132049682072146 and parameters: {'hidden_dims': '[512, 128]', 'dropout': 0.1304538168539244, 'batch_norm': False, 'lr': 1.5408060926311233e-05, 'weight_decay': 2.1989735568314356e-08, 'epochs': 250, 'loss': 'mse', 'optimizer': 'sgd', 'use_snp_selection': True, 'num_snps': 42550, 'weight_scheme': 'exponential', 'weight_clip_max': 10.0, 'weight_exponential_beta': 2.758850226029358}. Best is trial 6 with value: 0.1856241360339532.
[I 2026-04-21 19:15:59,571] Trial 13 finished with value: 0.09163720372258118 and parameters: {'hidden_dims': '[256, 128]', 'dropout': 0.014105125164896815, 'batch_norm': False, 'lr': 4.388139282372581e-06, 'weight_decay': 1.7198099217695898e-07, 'epochs': 86, 'loss': 'mae', 'optimizer': 'adam', 'use_snp_selection': True, 'num_snps': 6999, 'weight_scheme': 'top-heavy', 'weight_clip_max': 5.0, 'weight_topheavy_top_frac': 0.48398486394237283, 'weight_topheavy_low': 0.5666436580870186, 'weight_topheavy_high': 5.961546164133656}. Best is trial 6 with value: 0.09611617317736637.
[I 2026-04-21 19:16:14,130] Trial 14 finished with value: 0.007082579305718308 and parameters: {'hidden_dims': '[256, 64]', 'dropout': 0.004604992563343272, 'batch_norm': True, 'lr': 6.720450407604876e-06, 'weight_decay': 8.351712916957603e-08, 'epochs': 186, 'loss': 'mae', 'optimizer': 'adam', 'use_snp_selection': False, 'weight_scheme': 'top-heavy', 'weight_clip_max': None, 'weight_topheavy_top_frac': 0.45150309351023465, 'weight_topheavy_low': 0.501144286437094, 'weight_topheavy_high': 5.935923097358641}. Best is trial 6 with value: 0.09611617317736637.
[I 2026-04-21 19:16:18,817] Trial 8 finished with value: 0.1780906370827704 and parameters: {'hidden_dims': '[256, 128]', 'dropout': 0.05742396906738376, 'batch_norm': False, 'lr': 1.9761509510575143e-06, 'weight_decay': 2.933492239224291e-07, 'epochs': 82, 'loss': 'mae', 'optimizer': 'adam', 'use_snp_selection': True, 'num_snps': 29883, 'weight_scheme': 'minmax', 'weight_clip_max': 5.0, 'weight_minmax_eps': 0.0051288771726799584}. Best is trial 6 with value: 0.1856241360339532.
[I 2026-04-21 19:16:31,277] Trial 15 finished with value: 0.018886445730866012 and parameters: {'hidden_dims': '[256, 128]', 'dropout': 0.4202958557646419, 'batch_norm': False, 'lr': 0.00032904630222322853, 'weight_decay': 2.3863911176337085e-06, 'epochs': 254, 'loss': 'mae', 'optimizer': 'adamw', 'use_snp_selection': True, 'num_snps': 5496, 'weight_scheme': 'top-heavy', 'weight_clip_max': 5.0, 'weight_topheavy_top_frac': 0.49828636888917044, 'weight_topheavy_low': 0.5141248854977607, 'weight_topheavy_high': 5.968750904626171}. Best is trial 6 with value: 0.09611617317736637.
[I 2026-04-21 19:16:46,606] Trial 9 finished with value: 0.17458086593317632 and parameters: {'hidden_dims': '[256, 128]', 'dropout': 0.5795930447285386, 'batch_norm': False, 'lr': 0.00011782025260263196, 'weight_decay': 0.0005562063174273634, 'epochs': 218, 'loss': 'mae', 'optimizer': 'adamw', 'use_snp_selection': True, 'num_snps': 32226, 'weight_scheme': 'minmax', 'weight_clip_max': 5.0, 'weight_minmax_eps': 0.09600289105543994}. Best is trial 6 with value: 0.1856241360339532.
[I 2026-04-21 19:17:00,811] Trial 16 finished with value: 0.10136691122917292 and parameters: {'hidden_dims': '[512, 128]', 'dropout': 0.1265550655154745, 'batch_norm': False, 'lr': 3.403926613344191e-05, 'weight_decay': 1.5654316857179317e-08, 'epochs': 212, 'loss': 'mae', 'optimizer': 'adam', 'use_snp_selection': False, 'weight_scheme': 'exponential', 'weight_clip_max': None, 'weight_exponential_beta': 7.904946460581973}. Best is trial 16 with value: 0.10136691122917292.
[I 2026-04-21 19:17:29,342] Trial 10 finished with value: 0.16539551958323356 and parameters: {'hidden_dims': '[512, 64]', 'dropout': 0.4338375928678635, 'batch_norm': True, 'lr': 0.0009667920285641304, 'weight_decay': 6.976468597792388e-05, 'epochs': 294, 'loss': 'mae', 'optimizer': 'adam', 'use_snp_selection': False, 'weight_scheme': 'uniform', 'weight_clip_max': None}. Best is trial 6 with value: 0.1856241360339532.
[I 2026-04-21 19:17:32,140] Trial 17 finished with value: 0.07937264421097816 and parameters: {'hidden_dims': '[512, 128]', 'dropout': 0.15126115631930018, 'batch_norm': True, 'lr': 4.8311404065538575e-05, 'weight_decay': 1.2499319282139304e-08, 'epochs': 219, 'loss': 'mae', 'optimizer': 'adam', 'use_snp_selection': False, 'weight_scheme': 'exponential', 'weight_clip_max': None, 'weight_exponential_beta': 7.931697697672623}. Best is trial 16 with value: 0.10136691122917292.
[I 2026-04-21 19:17:57,540] Trial 11 finished with value: 0.1118060758824382 and parameters: {'hidden_dims': '[256, 128]', 'dropout': 0.009590830567787208, 'batch_norm': False, 'lr': 1.0272166034929754e-06, 'weight_decay': 6.639177970949987e-07, 'epochs': 50, 'loss': 'mae', 'optimizer': 'adam', 'use_snp_selection': True, 'num_snps': 57843, 'weight_scheme': 'minmax', 'weight_clip_max': 5.0, 'weight_minmax_eps': 0.011584305851229494}. Best is trial 6 with value: 0.1856241360339532.
[I 2026-04-21 19:18:08,192] Trial 18 finished with value: 0.09973254984574746 and parameters: {'hidden_dims': '[512, 128]', 'dropout': 0.10778926715258721, 'batch_norm': False, 'lr': 0.00028866242461780296, 'weight_decay': 0.0005182261535368475, 'epochs': 264, 'loss': 'mae', 'optimizer': 'adam', 'use_snp_selection': False, 'weight_scheme': 'exponential', 'weight_clip_max': None, 'weight_exponential_beta': 7.643369768490661}. Best is trial 16 with value: 0.10136691122917292.
[I 2026-04-21 19:18:15,316] Trial 12 finished with value: 0.10747876345283199 and parameters: {'hidden_dims': '[256, 64]', 'dropout': 0.0851395157391335, 'batch_norm': True, 'lr': 3.174224067518343e-06, 'weight_decay': 1.7200309243424394e-05, 'epochs': 221, 'loss': 'mae', 'optimizer': 'adam', 'use_snp_selection': False, 'weight_scheme': 'minmax', 'weight_clip_max': None, 'weight_minmax_eps': 0.19711170525101931}. Best is trial 6 with value: 0.1856241360339532.
[I 2026-04-21 19:18:32,272] Trial 13 finished with value: 0.11073838983960134 and parameters: {'hidden_dims': '[256, 128]', 'dropout': 0.014105125164896815, 'batch_norm': False, 'lr': 4.388139282372581e-06, 'weight_decay': 1.7198099217695898e-07, 'epochs': 86, 'loss': 'mae', 'optimizer': 'adam', 'use_snp_selection': True, 'num_snps': 6999, 'weight_scheme': 'top-heavy', 'weight_clip_max': 5.0, 'weight_topheavy_top_frac': 0.48398486394237283, 'weight_topheavy_low': 0.5666436580870186, 'weight_topheavy_high': 5.961546164133656}. Best is trial 6 with value: 0.1856241360339532.
[I 2026-04-21 19:18:44,028] Trial 19 finished with value: 0.10093937608085757 and parameters: {'hidden_dims': '[512, 128]', 'dropout': 0.22675749594133815, 'batch_norm': False, 'lr': 0.0003253865359817978, 'weight_decay': 0.0007408238070256205, 'epochs': 263, 'loss': 'mae', 'optimizer': 'adamw', 'use_snp_selection': False, 'weight_scheme': 'exponential', 'weight_clip_max': None, 'weight_exponential_beta': 7.640916564466167}. Best is trial 16 with value: 0.10136691122917292.
[I 2026-04-21 19:18:47,797] Trial 14 finished with value: 0.12126278057676464 and parameters: {'hidden_dims': '[256, 64]', 'dropout': 0.3716328732968822, 'batch_norm': True, 'lr': 1.0478194488285765e-06, 'weight_decay': 1.1235705674309915e-06, 'epochs': 188, 'loss': 'mae', 'optimizer': 'adam', 'use_snp_selection': False, 'weight_scheme': 'exponential', 'weight_clip_max': None, 'weight_exponential_beta': 6.512744308642654}. Best is trial 6 with value: 0.1856241360339532.
[I 2026-04-21 19:19:12,937] Trial 20 finished with value: 0.09510242664600445 and parameters: {'hidden_dims': '[512, 128]', 'dropout': 0.3640199307793606, 'batch_norm': False, 'lr': 0.000808957335040618, 'weight_decay': 0.00010968533683425355, 'epochs': 208, 'loss': 'mae', 'optimizer': 'adamw', 'use_snp_selection': False, 'weight_scheme': 'exponential', 'weight_clip_max': None, 'weight_exponential_beta': 5.9611832418222725}. Best is trial 16 with value: 0.10136691122917292.
[I 2026-04-21 19:19:13,290] Trial 15 finished with value: 0.1403349739706152 and parameters: {'hidden_dims': '[256, 128]', 'dropout': 0.12633136665698683, 'batch_norm': False, 'lr': 0.0003335938699102399, 'weight_decay': 0.0005451494304155803, 'epochs': 51, 'loss': 'mae', 'optimizer': 'adamw', 'use_snp_selection': True, 'num_snps': 46148, 'weight_scheme': 'uniform', 'weight_clip_max': 5.0}. Best is trial 6 with value: 0.1856241360339532.
[I 2026-04-21 19:19:49,739] Trial 21 finished with value: 0.10149380128188851 and parameters: {'hidden_dims': '[512, 128]', 'dropout': 0.22188712632024443, 'batch_norm': False, 'lr': 0.00028661053929823543, 'weight_decay': 0.0008225361604111407, 'epochs': 273, 'loss': 'mae', 'optimizer': 'adamw', 'use_snp_selection': False, 'weight_scheme': 'exponential', 'weight_clip_max': None, 'weight_exponential_beta': 7.9414494040785435}. Best is trial 21 with value: 0.10149380128188851.
[I 2026-04-21 19:19:50,129] Trial 16 finished with value: 0.13792608396755168 and parameters: {'hidden_dims': '[512, 128]', 'dropout': 0.18824368999851368, 'batch_norm': True, 'lr': 4.169960002188825e-06, 'weight_decay': 1.3993273814463104e-08, 'epochs': 252, 'loss': 'mae', 'optimizer': 'adam', 'use_snp_selection': False, 'weight_scheme': 'minmax', 'weight_clip_max': None, 'weight_minmax_eps': 0.08634997281730797}. Best is trial 6 with value: 0.1856241360339532.
[I 2026-04-21 19:20:18,485] Trial 17 finished with value: 0.1803251663675154 and parameters: {'hidden_dims': '[512, 64]', 'dropout': 0.49090300440704104, 'batch_norm': False, 'lr': 5.3027649478634894e-05, 'weight_decay': 1.2381867007752605e-05, 'epochs': 217, 'loss': 'mae', 'optimizer': 'adam', 'use_snp_selection': True, 'num_snps': 21228, 'weight_scheme': 'minmax', 'weight_clip_max': 5.0, 'weight_minmax_eps': 0.002530142025860993}. Best is trial 6 with value: 0.1856241360339532.
