Running from this directory: /cluster/work/simennes/Master_thesis
Name of job: ncv_ridge_iw
ID of job: 24378205
Array task ID: 6
The job was run on these nodes: idun-03-31
[I 2026-05-04 00:16:53,649] Trial 0 finished with value: 0.18903726359344558 and parameters: {'alpha': 574323.565896313, 'use_snp_selection': False, 'iw_method': 'pc_logistic', 'iw_clip_max': 2.0, 'iw_prob_clip': 0.005989214663243749, 'iw_n_components': 20, 'iw_logistic_c': 2.8870927958158354, 'iw_pca_fit': 'combined', 'iw_solver': 'lbfgs', 'iw_rho': 1.0}. Best is trial 0 with value: 0.18903726359344558.
[I 2026-05-04 00:19:13,407] Trial 1 finished with value: 0.1746416769590688 and parameters: {'alpha': 145427.84270397192, 'use_snp_selection': False, 'iw_method': 'pc_logistic', 'iw_clip_max': 2.0, 'iw_prob_clip': 0.0022034134189735897, 'iw_n_components': 10, 'iw_logistic_c': 8.53225823447423, 'iw_pca_fit': 'combined', 'iw_solver': 'lbfgs', 'iw_rho': 1.0}. Best is trial 0 with value: 0.18903726359344558.
[I 2026-05-04 00:21:41,723] Trial 2 finished with value: 0.19396602418677863 and parameters: {'alpha': 337268.1824826383, 'use_snp_selection': False, 'iw_method': 'pc_logistic', 'iw_clip_max': 1.25, 'iw_prob_clip': 0.0011214380556681478, 'iw_n_components': 40, 'iw_logistic_c': 0.0004456301044046966, 'iw_pca_fit': 'combined', 'iw_solver': 'lbfgs', 'iw_rho': 0.5}. Best is trial 2 with value: 0.19396602418677863.
[I 2026-05-04 00:24:09,396] Trial 3 finished with value: 0.1845275618049676 and parameters: {'alpha': 623873.8362358484, 'use_snp_selection': False, 'iw_method': 'pc_logistic', 'iw_clip_max': 2.0, 'iw_prob_clip': 0.0010704282286164728, 'iw_n_components': 30, 'iw_logistic_c': 0.003649078989687946, 'iw_pca_fit': 'combined', 'iw_solver': 'lbfgs', 'iw_rho': 0.9}. Best is trial 2 with value: 0.19396602418677863.
[I 2026-05-04 00:24:33,652] Trial 4 finished with value: 0.1815775262861317 and parameters: {'alpha': 1199521.094898443, 'use_snp_selection': False, 'iw_method': 'uniform'}. Best is trial 2 with value: 0.19396602418677863.
[I 2026-05-04 00:27:07,017] Trial 5 finished with value: 0.1931762937631672 and parameters: {'alpha': 594205.5826125565, 'use_snp_selection': False, 'iw_method': 'pc_logistic', 'iw_clip_max': 1.5, 'iw_prob_clip': 0.017782866059784724, 'iw_n_components': 40, 'iw_logistic_c': 0.3876202021284575, 'iw_pca_fit': 'combined', 'iw_solver': 'lbfgs', 'iw_rho': 0.5}. Best is trial 2 with value: 0.19396602418677863.
[I 2026-05-04 00:29:25,397] Trial 6 finished with value: 0.19286804062310697 and parameters: {'alpha': 102431.18633356069, 'use_snp_selection': False, 'iw_method': 'pc_logistic', 'iw_clip_max': 1.25, 'iw_prob_clip': 0.0017147683107745938, 'iw_n_components': 20, 'iw_logistic_c': 4.32601466983518e-06, 'iw_pca_fit': 'combined', 'iw_solver': 'lbfgs', 'iw_rho': 0.9}. Best is trial 2 with value: 0.19396602418677863.
[I 2026-05-04 00:31:50,936] Trial 7 finished with value: 0.18150657726021238 and parameters: {'alpha': 1830941.3950631474, 'use_snp_selection': False, 'iw_method': 'pc_logistic', 'iw_clip_max': 2.0, 'iw_prob_clip': 0.006357173651119782, 'iw_n_components': 40, 'iw_logistic_c': 1.7003213055010015e-05, 'iw_pca_fit': 'combined', 'iw_solver': 'lbfgs', 'iw_rho': 0.5}. Best is trial 2 with value: 0.19396602418677863.
[I 2026-05-04 00:32:14,964] Trial 8 finished with value: 0.18141191262174164 and parameters: {'alpha': 1221444.8156569519, 'use_snp_selection': False, 'iw_method': 'uniform'}. Best is trial 2 with value: 0.19396602418677863.
[I 2026-05-04 00:32:39,044] Trial 9 finished with value: 0.19444470573600545 and parameters: {'alpha': 201218.30977627521, 'use_snp_selection': False, 'iw_method': 'uniform'}. Best is trial 9 with value: 0.19444470573600545.
[I 2026-05-04 00:33:03,231] Trial 10 finished with value: 0.19392976242289078 and parameters: {'alpha': 246439.41354436372, 'use_snp_selection': False, 'iw_method': 'uniform'}. Best is trial 9 with value: 0.19444470573600545.
[I 2026-05-04 00:33:27,314] Trial 11 finished with value: 0.1937495136337796 and parameters: {'alpha': 258797.99050519007, 'use_snp_selection': False, 'iw_method': 'uniform'}. Best is trial 9 with value: 0.19444470573600545.
[I 2026-05-04 00:33:51,402] Trial 12 finished with value: 0.19312438283038535 and parameters: {'alpha': 297497.83935658244, 'use_snp_selection': False, 'iw_method': 'uniform'}. Best is trial 9 with value: 0.19444470573600545.
[I 2026-05-04 00:34:14,631] Trial 13 finished with value: 0.19233685821387198 and parameters: {'alpha': 342454.3862236704, 'use_snp_selection': False, 'iw_method': 'uniform'}. Best is trial 9 with value: 0.19444470573600545.
[I 2026-05-04 00:36:34,829] Trial 14 finished with value: 0.19494557066954107 and parameters: {'alpha': 172640.14022320343, 'use_snp_selection': False, 'iw_method': 'pc_logistic', 'iw_clip_max': 1.25, 'iw_prob_clip': 0.0006845131669118436, 'iw_n_components': 80, 'iw_logistic_c': 1.266722508279006e-07, 'iw_pca_fit': 'combined', 'iw_solver': 'lbfgs', 'iw_rho': 0.75}. Best is trial 14 with value: 0.19494557066954107.
[I 2026-05-04 00:36:57,215] Trial 15 finished with value: 0.19423157275954472 and parameters: {'alpha': 131357.26759290198, 'use_snp_selection': False, 'iw_method': 'uniform'}. Best is trial 14 with value: 0.19494557066954107.
[I 2026-05-04 00:39:17,436] Trial 16 finished with value: 0.19510589174263243 and parameters: {'alpha': 181482.32761434576, 'use_snp_selection': False, 'iw_method': 'pc_logistic', 'iw_clip_max': 5.0, 'iw_prob_clip': 0.0005831776459704333, 'iw_n_components': 80, 'iw_logistic_c': 1.7980438109298446e-07, 'iw_pca_fit': 'combined', 'iw_solver': 'lbfgs', 'iw_rho': 0.75}. Best is trial 16 with value: 0.19510589174263243.
[I 2026-05-04 00:41:37,631] Trial 17 finished with value: 0.19525131233919069 and parameters: {'alpha': 172915.3355723007, 'use_snp_selection': False, 'iw_method': 'pc_logistic', 'iw_clip_max': 5.0, 'iw_prob_clip': 0.0005141790347143442, 'iw_n_components': 80, 'iw_logistic_c': 2.4563923067581173e-07, 'iw_pca_fit': 'combined', 'iw_solver': 'lbfgs', 'iw_rho': 0.75}. Best is trial 17 with value: 0.19525131233919069.
[I 2026-05-04 00:43:58,129] Trial 18 finished with value: 0.1918258420008731 and parameters: {'alpha': 409563.2032924972, 'use_snp_selection': False, 'iw_method': 'pc_logistic', 'iw_clip_max': 5.0, 'iw_prob_clip': 0.0005074775873880956, 'iw_n_components': 80, 'iw_logistic_c': 1.8958423190691082e-07, 'iw_pca_fit': 'combined', 'iw_solver': 'lbfgs', 'iw_rho': 0.75}. Best is trial 17 with value: 0.19525131233919069.
[I 2026-05-04 00:46:12,801] Trial 19 finished with value: 0.19126471376019075 and parameters: {'alpha': 118629.7573683748, 'use_snp_selection': False, 'iw_method': 'pc_logistic', 'iw_clip_max': 5.0, 'iw_prob_clip': 0.003079365998095506, 'iw_n_components': 60, 'iw_logistic_c': 7.476236896813374e-06, 'iw_pca_fit': 'combined', 'iw_solver': 'lbfgs', 'iw_rho': 0.75}. Best is trial 17 with value: 0.19525131233919069.
[I 2026-05-04 00:48:33,151] Trial 20 finished with value: 0.18466208658688116 and parameters: {'alpha': 882093.4911400706, 'use_snp_selection': False, 'iw_method': 'pc_logistic', 'iw_clip_max': 5.0, 'iw_prob_clip': 0.042441587678024924, 'iw_n_components': 80, 'iw_logistic_c': 1.2101756913701844e-06, 'iw_pca_fit': 'combined', 'iw_solver': 'lbfgs', 'iw_rho': 0.75}. Best is trial 17 with value: 0.19525131233919069.
[I 2026-05-04 00:50:53,031] Trial 21 finished with value: 0.19499677142136754 and parameters: {'alpha': 182585.64319844698, 'use_snp_selection': False, 'iw_method': 'pc_logistic', 'iw_clip_max': 3.0, 'iw_prob_clip': 0.000640847425283516, 'iw_n_components': 80, 'iw_logistic_c': 1.4517347588223768e-07, 'iw_pca_fit': 'combined', 'iw_solver': 'lbfgs', 'iw_rho': 0.75}. Best is trial 17 with value: 0.19525131233919069.
[I 2026-05-04 00:53:13,429] Trial 22 finished with value: 0.19513721047431742 and parameters: {'alpha': 189487.8120011814, 'use_snp_selection': False, 'iw_method': 'pc_logistic', 'iw_clip_max': 3.0, 'iw_prob_clip': 0.000507158130886473, 'iw_n_components': 80, 'iw_logistic_c': 2.0154034760136836e-07, 'iw_pca_fit': 'combined', 'iw_solver': 'lbfgs', 'iw_rho': 0.75}. Best is trial 17 with value: 0.19525131233919069.
[I 2026-05-04 00:55:29,480] Trial 23 finished with value: 0.19320924323130426 and parameters: {'alpha': 211153.37033328624, 'use_snp_selection': False, 'iw_method': 'pc_logistic', 'iw_clip_max': 3.0, 'iw_prob_clip': 0.000990970933387158, 'iw_n_components': 50, 'iw_logistic_c': 9.524766479600941e-05, 'iw_pca_fit': 'combined', 'iw_solver': 'lbfgs', 'iw_rho': 0.75}. Best is trial 17 with value: 0.19525131233919069.
[I 2026-05-04 00:57:49,142] Trial 24 finished with value: 0.19655805822393563 and parameters: {'alpha': 153128.42002139377, 'use_snp_selection': False, 'iw_method': 'pc_logistic', 'iw_clip_max': 5.0, 'iw_prob_clip': 0.00056489548537419, 'iw_n_components': 80, 'iw_logistic_c': 1.466926515720803e-06, 'iw_pca_fit': 'combined', 'iw_solver': 'lbfgs', 'iw_rho': 0.75}. Best is trial 24 with value: 0.19655805822393563.
[I 2026-05-04 01:00:09,127] Trial 25 finished with value: 0.17657508101529645 and parameters: {'alpha': 2855380.24438861, 'use_snp_selection': False, 'iw_method': 'pc_logistic', 'iw_clip_max': 3.0, 'iw_prob_clip': 0.0014232791032939983, 'iw_n_components': 80, 'iw_logistic_c': 1.4118731738173165e-06, 'iw_pca_fit': 'combined', 'iw_solver': 'lbfgs', 'iw_rho': 0.75}. Best is trial 24 with value: 0.19655805822393563.
[I 2026-05-04 01:02:38,751] Trial 26 finished with value: 0.17648930428558657 and parameters: {'alpha': 406004.86786278535, 'use_snp_selection': False, 'iw_method': 'pc_logistic', 'iw_clip_max': 5.0, 'iw_prob_clip': 0.003407768225488547, 'iw_n_components': 80, 'iw_logistic_c': 0.015825492508794392, 'iw_pca_fit': 'combined', 'iw_solver': 'lbfgs', 'iw_rho': 0.75}. Best is trial 24 with value: 0.19655805822393563.
[I 2026-05-04 01:04:54,545] Trial 27 finished with value: 0.19180783283213648 and parameters: {'alpha': 103643.5405726588, 'use_snp_selection': False, 'iw_method': 'pc_logistic', 'iw_clip_max': 1.5, 'iw_prob_clip': 0.0008187260141041234, 'iw_n_components': 60, 'iw_logistic_c': 5.80582208878875e-05, 'iw_pca_fit': 'combined', 'iw_solver': 'lbfgs', 'iw_rho': 0.75}. Best is trial 24 with value: 0.19655805822393563.
[I 2026-05-04 01:07:05,093] Trial 28 finished with value: 0.19699341358124398 and parameters: {'alpha': 151336.78486547305, 'use_snp_selection': False, 'iw_method': 'pc_logistic', 'iw_clip_max': 3.0, 'iw_prob_clip': 0.0005003045708976166, 'iw_n_components': 30, 'iw_logistic_c': 1.4514742430008085e-06, 'iw_pca_fit': 'combined', 'iw_solver': 'lbfgs', 'iw_rho': 0.9}. Best is trial 28 with value: 0.19699341358124398.
[I 2026-05-04 01:09:15,546] Trial 29 finished with value: 0.19629112228507822 and parameters: {'alpha': 130266.36553059675, 'use_snp_selection': False, 'iw_method': 'pc_logistic', 'iw_clip_max': 5.0, 'iw_prob_clip': 0.009405661578256262, 'iw_n_components': 30, 'iw_logistic_c': 2.0872621807893745e-06, 'iw_pca_fit': 'combined', 'iw_solver': 'lbfgs', 'iw_rho': 0.9}. Best is trial 28 with value: 0.19699341358124398.
[I 2026-05-04 01:11:25,581] Trial 30 finished with value: 0.19678173499140134 and parameters: {'alpha': 141931.02215652657, 'use_snp_selection': False, 'iw_method': 'pc_logistic', 'iw_clip_max': 5.0, 'iw_prob_clip': 0.017800007853580505, 'iw_n_components': 30, 'iw_logistic_c': 1.4154294406528037e-06, 'iw_pca_fit': 'combined', 'iw_solver': 'lbfgs', 'iw_rho': 0.9}. Best is trial 28 with value: 0.19699341358124398.
[I 2026-05-04 01:13:35,692] Trial 31 finished with value: 0.19702467147353256 and parameters: {'alpha': 143984.23633410147, 'use_snp_selection': False, 'iw_method': 'pc_logistic', 'iw_clip_max': 5.0, 'iw_prob_clip': 0.010722969643346352, 'iw_n_components': 30, 'iw_logistic_c': 1.9614966251032187e-06, 'iw_pca_fit': 'combined', 'iw_solver': 'lbfgs', 'iw_rho': 0.9}. Best is trial 31 with value: 0.19702467147353256.
[I 2026-05-04 01:15:46,920] Trial 32 finished with value: 0.18719441881009674 and parameters: {'alpha': 143916.0432565688, 'use_snp_selection': False, 'iw_method': 'pc_logistic', 'iw_clip_max': 5.0, 'iw_prob_clip': 0.015275203070330118, 'iw_n_components': 30, 'iw_logistic_c': 2.9169008256044467e-05, 'iw_pca_fit': 'combined', 'iw_solver': 'lbfgs', 'iw_rho': 0.9}. Best is trial 31 with value: 0.19702467147353256.
[I 2026-05-04 01:17:57,926] Trial 33 finished with value: 0.19767528680956023 and parameters: {'alpha': 144442.92956767362, 'use_snp_selection': False, 'iw_method': 'pc_logistic', 'iw_clip_max': 5.0, 'iw_prob_clip': 0.025261154428776144, 'iw_n_components': 30, 'iw_logistic_c': 1.1199610950352549e-06, 'iw_pca_fit': 'combined', 'iw_solver': 'lbfgs', 'iw_rho': 0.9}. Best is trial 33 with value: 0.19767528680956023.
[I 2026-05-04 01:20:14,617] Trial 34 finished with value: 0.1983207656845727 and parameters: {'alpha': 238087.23876365263, 'use_snp_selection': False, 'iw_method': 'pc_logistic', 'iw_clip_max': 3.0, 'iw_prob_clip': 0.028640679469462405, 'iw_n_components': 30, 'iw_logistic_c': 0.00026156202771260284, 'iw_pca_fit': 'combined', 'iw_solver': 'lbfgs', 'iw_rho': 0.9}. Best is trial 34 with value: 0.1983207656845727.
[I 2026-05-04 01:22:28,642] Trial 35 finished with value: 0.19485349707327188 and parameters: {'alpha': 241775.74834377895, 'use_snp_selection': False, 'iw_method': 'pc_logistic', 'iw_clip_max': 3.0, 'iw_prob_clip': 0.03367150022236787, 'iw_n_components': 30, 'iw_logistic_c': 0.0005952262707714399, 'iw_pca_fit': 'combined', 'iw_solver': 'lbfgs', 'iw_rho': 0.9}. Best is trial 34 with value: 0.1983207656845727.
[I 2026-05-04 01:24:40,312] Trial 36 finished with value: 0.19758182791594475 and parameters: {'alpha': 433450.43950841634, 'use_snp_selection': False, 'iw_method': 'pc_logistic', 'iw_clip_max': 3.0, 'iw_prob_clip': 0.0272168769211628, 'iw_n_components': 30, 'iw_logistic_c': 0.0001415416017238387, 'iw_pca_fit': 'combined', 'iw_solver': 'lbfgs', 'iw_rho': 0.9}. Best is trial 34 with value: 0.1983207656845727.
[I 2026-05-04 01:26:51,853] Trial 37 finished with value: 0.19414293832014098 and parameters: {'alpha': 732228.7699353468, 'use_snp_selection': False, 'iw_method': 'pc_logistic', 'iw_clip_max': 3.0, 'iw_prob_clip': 0.02476402630357096, 'iw_n_components': 30, 'iw_logistic_c': 0.00012494909862620227, 'iw_pca_fit': 'combined', 'iw_solver': 'lbfgs', 'iw_rho': 0.9}. Best is trial 34 with value: 0.1983207656845727.
[I 2026-05-04 01:29:08,207] Trial 38 finished with value: 0.19314255490507068 and parameters: {'alpha': 434615.62075095804, 'use_snp_selection': False, 'iw_method': 'pc_logistic', 'iw_clip_max': 3.0, 'iw_prob_clip': 0.012708605909810091, 'iw_n_components': 30, 'iw_logistic_c': 0.004841433063181381, 'iw_pca_fit': 'combined', 'iw_solver': 'lbfgs', 'iw_rho': 0.9}. Best is trial 34 with value: 0.1983207656845727.
[I 2026-05-04 01:31:24,746] Trial 39 finished with value: 0.1920904555215319 and parameters: {'alpha': 525377.8655151653, 'use_snp_selection': False, 'iw_method': 'pc_logistic', 'iw_clip_max': 1.5, 'iw_prob_clip': 0.026777916680333084, 'iw_n_components': 30, 'iw_logistic_c': 0.08712692195264017, 'iw_pca_fit': 'combined', 'iw_solver': 'lbfgs', 'iw_rho': 1.0}. Best is trial 34 with value: 0.1983207656845727.
[I 2026-05-04 01:33:32,834] Trial 40 finished with value: 0.18917300465218861 and parameters: {'alpha': 275225.8101568204, 'use_snp_selection': False, 'iw_method': 'pc_logistic', 'iw_clip_max': 3.0, 'iw_prob_clip': 0.045814689773783626, 'iw_n_components': 10, 'iw_logistic_c': 0.00025331681548503075, 'iw_pca_fit': 'combined', 'iw_solver': 'lbfgs', 'iw_rho': 0.9}. Best is trial 34 with value: 0.1983207656845727.
[I 2026-05-04 01:35:42,951] Trial 41 finished with value: 0.19111281365562274 and parameters: {'alpha': 112773.86867070016, 'use_snp_selection': False, 'iw_method': 'pc_logistic', 'iw_clip_max': 3.0, 'iw_prob_clip': 0.00921623079917899, 'iw_n_components': 30, 'iw_logistic_c': 1.5790355484520502e-05, 'iw_pca_fit': 'combined', 'iw_solver': 'lbfgs', 'iw_rho': 0.9}. Best is trial 34 with value: 0.1983207656845727.
[I 2026-05-04 01:37:57,142] Trial 42 finished with value: 0.19542641915798042 and parameters: {'alpha': 324366.1640030437, 'use_snp_selection': False, 'iw_method': 'pc_logistic', 'iw_clip_max': 3.0, 'iw_prob_clip': 0.024510883626206296, 'iw_n_components': 30, 'iw_logistic_c': 0.0016598635095873048, 'iw_pca_fit': 'combined', 'iw_solver': 'lbfgs', 'iw_rho': 0.9}. Best is trial 34 with value: 0.1983207656845727.
[I 2026-05-04 01:40:06,990] Trial 43 finished with value: 0.19898973584127239 and parameters: {'alpha': 204732.65702852793, 'use_snp_selection': False, 'iw_method': 'pc_logistic', 'iw_clip_max': 3.0, 'iw_prob_clip': 0.03577289754591283, 'iw_n_components': 30, 'iw_logistic_c': 6.198885520860806e-06, 'iw_pca_fit': 'combined', 'iw_solver': 'lbfgs', 'iw_rho': 0.9}. Best is trial 43 with value: 0.19898973584127239.
[I 2026-05-04 01:42:21,649] Trial 44 finished with value: 0.1987011008790341 and parameters: {'alpha': 206193.18077732393, 'use_snp_selection': False, 'iw_method': 'pc_logistic', 'iw_clip_max': 2.0, 'iw_prob_clip': 0.032956481321874426, 'iw_n_components': 50, 'iw_logistic_c': 7.18648712451988e-06, 'iw_pca_fit': 'combined', 'iw_solver': 'lbfgs', 'iw_rho': 1.0}. Best is trial 43 with value: 0.19898973584127239.
[I 2026-05-04 01:44:36,483] Trial 45 finished with value: 0.19802390174957257 and parameters: {'alpha': 225950.51511493785, 'use_snp_selection': False, 'iw_method': 'pc_logistic', 'iw_clip_max': 2.0, 'iw_prob_clip': 0.032524201590445105, 'iw_n_components': 50, 'iw_logistic_c': 6.638295290394601e-06, 'iw_pca_fit': 'combined', 'iw_solver': 'lbfgs', 'iw_rho': 1.0}. Best is trial 43 with value: 0.19898973584127239.
[I 2026-05-04 01:46:51,407] Trial 46 finished with value: 0.19932006179765496 and parameters: {'alpha': 228793.4437580078, 'use_snp_selection': False, 'iw_method': 'pc_logistic', 'iw_clip_max': 2.0, 'iw_prob_clip': 0.03563160355096715, 'iw_n_components': 50, 'iw_logistic_c': 5.697855560675741e-06, 'iw_pca_fit': 'combined', 'iw_solver': 'lbfgs', 'iw_rho': 1.0}. Best is trial 46 with value: 0.19932006179765496.
[I 2026-05-04 01:47:13,709] Trial 47 finished with value: 0.19427013249446098 and parameters: {'alpha': 219538.67069132265, 'use_snp_selection': False, 'iw_method': 'uniform'}. Best is trial 46 with value: 0.19932006179765496.
[I 2026-05-04 01:49:28,382] Trial 48 finished with value: 0.1985615091017956 and parameters: {'alpha': 304035.36123895994, 'use_snp_selection': False, 'iw_method': 'pc_logistic', 'iw_clip_max': 2.0, 'iw_prob_clip': 0.03732218360656206, 'iw_n_components': 50, 'iw_logistic_c': 7.574237082871493e-06, 'iw_pca_fit': 'combined', 'iw_solver': 'lbfgs', 'iw_rho': 1.0}. Best is trial 46 with value: 0.19932006179765496.
[I 2026-05-04 01:49:50,692] Trial 49 finished with value: 0.19317666855142632 and parameters: {'alpha': 294413.3856131884, 'use_snp_selection': False, 'iw_method': 'uniform'}. Best is trial 46 with value: 0.19932006179765496.
[I 2026-05-04 01:52:07,046] Trial 50 finished with value: 0.19552206935282376 and parameters: {'alpha': 340531.67829429783, 'use_snp_selection': False, 'iw_method': 'pc_logistic', 'iw_clip_max': 2.0, 'iw_prob_clip': 0.03711845232231033, 'iw_n_components': 50, 'iw_logistic_c': 3.619190968690911e-05, 'iw_pca_fit': 'combined', 'iw_solver': 'lbfgs', 'iw_rho': 1.0}. Best is trial 46 with value: 0.19932006179765496.
[I 2026-05-04 01:54:21,938] Trial 51 finished with value: 0.1980354623312773 and parameters: {'alpha': 234060.96621930407, 'use_snp_selection': False, 'iw_method': 'pc_logistic', 'iw_clip_max': 2.0, 'iw_prob_clip': 0.03137755331362603, 'iw_n_components': 50, 'iw_logistic_c': 6.407253465193565e-06, 'iw_pca_fit': 'combined', 'iw_solver': 'lbfgs', 'iw_rho': 1.0}. Best is trial 46 with value: 0.19932006179765496.
[I 2026-05-04 01:56:37,121] Trial 52 finished with value: 0.1987898207676986 and parameters: {'alpha': 262321.57427059143, 'use_snp_selection': False, 'iw_method': 'pc_logistic', 'iw_clip_max': 2.0, 'iw_prob_clip': 0.049498875562785385, 'iw_n_components': 50, 'iw_logistic_c': 1.2192188211061307e-05, 'iw_pca_fit': 'combined', 'iw_solver': 'lbfgs', 'iw_rho': 1.0}. Best is trial 46 with value: 0.19932006179765496.
[I 2026-05-04 01:58:51,766] Trial 53 finished with value: 0.19900173578068464 and parameters: {'alpha': 270579.81499202887, 'use_snp_selection': False, 'iw_method': 'pc_logistic', 'iw_clip_max': 2.0, 'iw_prob_clip': 0.04628370843555093, 'iw_n_components': 50, 'iw_logistic_c': 1.7473751860012153e-05, 'iw_pca_fit': 'combined', 'iw_solver': 'lbfgs', 'iw_rho': 1.0}. Best is trial 46 with value: 0.19932006179765496.
[I 2026-05-04 02:01:06,539] Trial 54 finished with value: 0.19867551202958886 and parameters: {'alpha': 367501.5583581513, 'use_snp_selection': False, 'iw_method': 'pc_logistic', 'iw_clip_max': 2.0, 'iw_prob_clip': 0.04780370069894758, 'iw_n_components': 50, 'iw_logistic_c': 1.457758384121286e-05, 'iw_pca_fit': 'combined', 'iw_solver': 'lbfgs', 'iw_rho': 1.0}. Best is trial 46 with value: 0.19932006179765496.
[I 2026-05-04 02:03:21,137] Trial 55 finished with value: 0.1987514108736455 and parameters: {'alpha': 367703.06159271253, 'use_snp_selection': False, 'iw_method': 'pc_logistic', 'iw_clip_max': 2.0, 'iw_prob_clip': 0.04701047643430626, 'iw_n_components': 50, 'iw_logistic_c': 1.2657649804123874e-05, 'iw_pca_fit': 'combined', 'iw_solver': 'lbfgs', 'iw_rho': 1.0}. Best is trial 46 with value: 0.19932006179765496.
[I 2026-05-04 02:05:35,447] Trial 56 finished with value: 0.19442429911757647 and parameters: {'alpha': 494219.7648714261, 'use_snp_selection': False, 'iw_method': 'pc_logistic', 'iw_clip_max': 2.0, 'iw_prob_clip': 0.019976578417199024, 'iw_n_components': 50, 'iw_logistic_c': 3.521277725102664e-06, 'iw_pca_fit': 'combined', 'iw_solver': 'lbfgs', 'iw_rho': 1.0}. Best is trial 46 with value: 0.19932006179765496.
