[I 2026-05-04 02:32:01,315] Trial 57 finished with value: 0.2166119789064221 and parameters: {'alpha': 247391.29558335693, 'use_snp_selection': False, 'iw_method': 'pc_logistic', 'iw_clip_max': 1.25, 'iw_prob_clip': 0.0108788059489624, 'iw_n_components': 80, 'iw_logistic_c': 0.1622644457672286, 'iw_pca_fit': 'combined', 'iw_solver': 'lbfgs', 'iw_rho': 0.9}. Best is trial 57 with value: 0.2166119789064221.
[I 2026-05-04 02:34:58,286] Trial 58 finished with value: 0.19697353414760607 and parameters: {'alpha': 238356.23640305223, 'use_snp_selection': False, 'iw_method': 'pc_logistic', 'iw_clip_max': 5.0, 'iw_prob_clip': 0.011318152634663757, 'iw_n_components': 80, 'iw_logistic_c': 6.761253407389934, 'iw_pca_fit': 'combined', 'iw_solver': 'lbfgs', 'iw_rho': 0.75}. Best is trial 57 with value: 0.2166119789064221.
[I 2026-05-04 02:35:27,824] Trial 59 finished with value: 0.21118619818399273 and parameters: {'alpha': 203373.14221841466, 'use_snp_selection': False, 'iw_method': 'uniform'}. Best is trial 57 with value: 0.2166119789064221.
[I 2026-05-04 02:38:23,819] Trial 60 finished with value: 0.20861649400985477 and parameters: {'alpha': 159333.24608633254, 'use_snp_selection': False, 'iw_method': 'pc_logistic', 'iw_clip_max': 2.0, 'iw_prob_clip': 0.017805800506586984, 'iw_n_components': 80, 'iw_logistic_c': 0.13151069341776178, 'iw_pca_fit': 'combined', 'iw_solver': 'lbfgs', 'iw_rho': 0.9}. Best is trial 57 with value: 0.2166119789064221.
[I 2026-05-04 02:41:18,611] Trial 61 finished with value: 0.21793425562094138 and parameters: {'alpha': 321909.6485838295, 'use_snp_selection': False, 'iw_method': 'pc_logistic', 'iw_clip_max': 1.25, 'iw_prob_clip': 0.005621114976307976, 'iw_n_components': 80, 'iw_logistic_c': 0.030273775003017023, 'iw_pca_fit': 'combined', 'iw_solver': 'lbfgs', 'iw_rho': 0.9}. Best is trial 61 with value: 0.21793425562094138.
[I 2026-05-04 02:44:16,635] Trial 62 finished with value: 0.21614426730784486 and parameters: {'alpha': 378714.21742880397, 'use_snp_selection': False, 'iw_method': 'pc_logistic', 'iw_clip_max': 1.25, 'iw_prob_clip': 0.005571858530682648, 'iw_n_components': 80, 'iw_logistic_c': 0.10230415484941223, 'iw_pca_fit': 'combined', 'iw_solver': 'lbfgs', 'iw_rho': 0.9}. Best is trial 61 with value: 0.21793425562094138.
[I 2026-05-04 02:47:12,195] Trial 63 finished with value: 0.21491252372249003 and parameters: {'alpha': 369631.4208148844, 'use_snp_selection': False, 'iw_method': 'pc_logistic', 'iw_clip_max': 1.25, 'iw_prob_clip': 0.005950059174347082, 'iw_n_components': 80, 'iw_logistic_c': 0.8230343331826874, 'iw_pca_fit': 'combined', 'iw_solver': 'lbfgs', 'iw_rho': 0.9}. Best is trial 61 with value: 0.21793425562094138.
[I 2026-05-04 02:50:07,505] Trial 64 finished with value: 0.21656293255494985 and parameters: {'alpha': 449306.2248971351, 'use_snp_selection': False, 'iw_method': 'pc_logistic', 'iw_clip_max': 1.25, 'iw_prob_clip': 0.005911166026858185, 'iw_n_components': 80, 'iw_logistic_c': 0.11796833880847572, 'iw_pca_fit': 'combined', 'iw_solver': 'lbfgs', 'iw_rho': 0.9}. Best is trial 61 with value: 0.21793425562094138.
[I 2026-05-04 02:53:04,638] Trial 65 finished with value: 0.21084770306731754 and parameters: {'alpha': 471259.35942370014, 'use_snp_selection': False, 'iw_method': 'pc_logistic', 'iw_clip_max': 1.25, 'iw_prob_clip': 0.007624879150719257, 'iw_n_components': 80, 'iw_logistic_c': 0.15549801374624966, 'iw_pca_fit': 'combined', 'iw_solver': 'lbfgs', 'iw_rho': 0.9}. Best is trial 61 with value: 0.21793425562094138.
[I 2026-05-04 02:56:00,106] Trial 66 finished with value: 0.21538427464577742 and parameters: {'alpha': 404781.9949224553, 'use_snp_selection': False, 'iw_method': 'pc_logistic', 'iw_clip_max': 1.25, 'iw_prob_clip': 0.0058866907933263525, 'iw_n_components': 80, 'iw_logistic_c': 0.05431099814571725, 'iw_pca_fit': 'combined', 'iw_solver': 'lbfgs', 'iw_rho': 0.75}. Best is trial 61 with value: 0.21793425562094138.
[I 2026-05-04 02:58:56,482] Trial 67 finished with value: 0.2123075376783151 and parameters: {'alpha': 638748.054165758, 'use_snp_selection': False, 'iw_method': 'pc_logistic', 'iw_clip_max': 1.25, 'iw_prob_clip': 0.005807302560789527, 'iw_n_components': 80, 'iw_logistic_c': 0.06417108356329318, 'iw_pca_fit': 'combined', 'iw_solver': 'lbfgs', 'iw_rho': 0.75}. Best is trial 61 with value: 0.21793425562094138.
[I 2026-05-04 03:01:51,908] Trial 68 finished with value: 0.21273168108652643 and parameters: {'alpha': 455321.7615069944, 'use_snp_selection': False, 'iw_method': 'pc_logistic', 'iw_clip_max': 1.5, 'iw_prob_clip': 0.004781572197854101, 'iw_n_components': 80, 'iw_logistic_c': 0.3797068106387954, 'iw_pca_fit': 'combined', 'iw_solver': 'lbfgs', 'iw_rho': 0.75}. Best is trial 61 with value: 0.21793425562094138.
[I 2026-05-04 03:04:48,536] Trial 69 finished with value: 0.21518392958849436 and parameters: {'alpha': 391521.8926688336, 'use_snp_selection': False, 'iw_method': 'pc_logistic', 'iw_clip_max': 1.25, 'iw_prob_clip': 0.0026987998864250367, 'iw_n_components': 80, 'iw_logistic_c': 0.039819460098970784, 'iw_pca_fit': 'combined', 'iw_solver': 'lbfgs', 'iw_rho': 0.75}. Best is trial 61 with value: 0.21793425562094138.
[I 2026-05-04 03:07:45,143] Trial 70 finished with value: 0.21596639990303496 and parameters: {'alpha': 331812.61321351724, 'use_snp_selection': False, 'iw_method': 'pc_logistic', 'iw_clip_max': 1.25, 'iw_prob_clip': 0.006187199321284175, 'iw_n_components': 80, 'iw_logistic_c': 1.4565400465723022, 'iw_pca_fit': 'combined', 'iw_solver': 'lbfgs', 'iw_rho': 0.75}. Best is trial 61 with value: 0.21793425562094138.
[I 2026-05-04 03:10:42,588] Trial 71 finished with value: 0.2148156439601221 and parameters: {'alpha': 336160.32171865314, 'use_snp_selection': False, 'iw_method': 'pc_logistic', 'iw_clip_max': 1.25, 'iw_prob_clip': 0.006122716367316079, 'iw_n_components': 80, 'iw_logistic_c': 1.2501035173932957, 'iw_pca_fit': 'combined', 'iw_solver': 'lbfgs', 'iw_rho': 0.75}. Best is trial 61 with value: 0.21793425562094138.
[I 2026-05-04 03:13:37,865] Trial 72 finished with value: 0.2105979017479132 and parameters: {'alpha': 495166.34022260684, 'use_snp_selection': False, 'iw_method': 'pc_logistic', 'iw_clip_max': 1.25, 'iw_prob_clip': 0.004675207311197015, 'iw_n_components': 80, 'iw_logistic_c': 2.6665605080918873, 'iw_pca_fit': 'combined', 'iw_solver': 'lbfgs', 'iw_rho': 0.75}. Best is trial 61 with value: 0.21793425562094138.
[I 2026-05-04 03:16:46,776] Trial 73 finished with value: 0.21507900075937578 and parameters: {'alpha': 400693.04001654853, 'use_snp_selection': False, 'iw_method': 'pc_logistic', 'iw_clip_max': 1.25, 'iw_prob_clip': 0.003505311605812915, 'iw_n_components': 80, 'iw_logistic_c': 0.09140841029262856, 'iw_pca_fit': 'combined', 'iw_solver': 'lbfgs', 'iw_rho': 0.75}. Best is trial 61 with value: 0.21793425562094138.
[I 2026-05-04 03:19:57,289] Trial 74 finished with value: 0.21708228527101317 and parameters: {'alpha': 256818.86224129837, 'use_snp_selection': False, 'iw_method': 'pc_logistic', 'iw_clip_max': 1.25, 'iw_prob_clip': 0.0016709967103956237, 'iw_n_components': 80, 'iw_logistic_c': 0.19822882757496255, 'iw_pca_fit': 'combined', 'iw_solver': 'lbfgs', 'iw_rho': 0.75}. Best is trial 61 with value: 0.21793425562094138.
[I 2026-05-04 03:23:07,393] Trial 75 finished with value: 0.21437587201919595 and parameters: {'alpha': 434978.41985569225, 'use_snp_selection': False, 'iw_method': 'pc_logistic', 'iw_clip_max': 1.25, 'iw_prob_clip': 0.00202433965858106, 'iw_n_components': 80, 'iw_logistic_c': 0.5109853767195871, 'iw_pca_fit': 'combined', 'iw_solver': 'lbfgs', 'iw_rho': 0.75}. Best is trial 61 with value: 0.21793425562094138.
[I 2026-05-04 03:26:16,296] Trial 76 finished with value: 0.19532346328124175 and parameters: {'alpha': 250296.17760758594, 'use_snp_selection': False, 'iw_method': 'pc_logistic', 'iw_clip_max': 5.0, 'iw_prob_clip': 0.010839692226181346, 'iw_n_components': 80, 'iw_logistic_c': 0.20255992738923356, 'iw_pca_fit': 'combined', 'iw_solver': 'lbfgs', 'iw_rho': 0.75}. Best is trial 61 with value: 0.21793425562094138.
[I 2026-05-04 03:29:16,234] Trial 77 finished with value: 0.19922868120268103 and parameters: {'alpha': 1837490.7176954332, 'use_snp_selection': False, 'iw_method': 'pc_logistic', 'iw_clip_max': 3.0, 'iw_prob_clip': 0.005580998460641808, 'iw_n_components': 40, 'iw_logistic_c': 5.240228452358194, 'iw_pca_fit': 'combined', 'iw_solver': 'lbfgs', 'iw_rho': 0.75}. Best is trial 61 with value: 0.21793425562094138.
[I 2026-05-04 03:29:48,011] Trial 78 finished with value: 0.21036326561314325 and parameters: {'alpha': 323620.21798160387, 'use_snp_selection': False, 'iw_method': 'uniform'}. Best is trial 61 with value: 0.21793425562094138.
[I 2026-05-04 03:33:01,098] Trial 79 finished with value: 0.21254428021799518 and parameters: {'alpha': 570863.9160882726, 'use_snp_selection': False, 'iw_method': 'pc_logistic', 'iw_clip_max': 1.25, 'iw_prob_clip': 0.0012711347870934919, 'iw_n_components': 80, 'iw_logistic_c': 1.3437557466889811, 'iw_pca_fit': 'combined', 'iw_solver': 'lbfgs', 'iw_rho': 0.75}. Best is trial 61 with value: 0.21793425562094138.
[I 2026-05-04 03:36:11,881] Trial 80 finished with value: 0.21185353507348567 and parameters: {'alpha': 722792.5967906102, 'use_snp_selection': False, 'iw_method': 'pc_logistic', 'iw_clip_max': 1.25, 'iw_prob_clip': 0.00735758275002373, 'iw_n_components': 80, 'iw_logistic_c': 0.3509401798812726, 'iw_pca_fit': 'combined', 'iw_solver': 'lbfgs', 'iw_rho': 0.75}. Best is trial 61 with value: 0.21793425562094138.
[I 2026-05-04 03:39:23,924] Trial 81 finished with value: 0.22042911056351472 and parameters: {'alpha': 226622.39538970313, 'use_snp_selection': False, 'iw_method': 'pc_logistic', 'iw_clip_max': 1.25, 'iw_prob_clip': 0.006416381175792726, 'iw_n_components': 80, 'iw_logistic_c': 0.025651066391551045, 'iw_pca_fit': 'combined', 'iw_solver': 'lbfgs', 'iw_rho': 0.9}. Best is trial 81 with value: 0.22042911056351472.
[I 2026-05-04 03:42:36,057] Trial 82 finished with value: 0.19981266582275267 and parameters: {'alpha': 193384.2050106403, 'use_snp_selection': False, 'iw_method': 'pc_logistic', 'iw_clip_max': 1.25, 'iw_prob_clip': 0.006549108012757947, 'iw_n_components': 80, 'iw_logistic_c': 0.02424832280361633, 'iw_pca_fit': 'combined', 'iw_solver': 'lbfgs', 'iw_rho': 1.0}. Best is trial 81 with value: 0.22042911056351472.
[I 2026-05-04 03:45:46,835] Trial 83 finished with value: 0.21622505283525434 and parameters: {'alpha': 270481.92470435327, 'use_snp_selection': False, 'iw_method': 'pc_logistic', 'iw_clip_max': 1.25, 'iw_prob_clip': 0.00761983171739555, 'iw_n_components': 80, 'iw_logistic_c': 0.0507377305603066, 'iw_pca_fit': 'combined', 'iw_solver': 'lbfgs', 'iw_rho': 0.9}. Best is trial 81 with value: 0.22042911056351472.
[I 2026-05-04 03:48:58,731] Trial 84 finished with value: 0.21418229130217173 and parameters: {'alpha': 263277.55060800747, 'use_snp_selection': False, 'iw_method': 'pc_logistic', 'iw_clip_max': 1.25, 'iw_prob_clip': 0.01441556119880097, 'iw_n_components': 80, 'iw_logistic_c': 0.12808698382499875, 'iw_pca_fit': 'combined', 'iw_solver': 'lbfgs', 'iw_rho': 0.9}. Best is trial 81 with value: 0.22042911056351472.
[I 2026-05-04 03:52:09,730] Trial 85 finished with value: 0.21625850411868736 and parameters: {'alpha': 294934.40357914235, 'use_snp_selection': False, 'iw_method': 'pc_logistic', 'iw_clip_max': 1.25, 'iw_prob_clip': 0.008130812193253113, 'iw_n_components': 80, 'iw_logistic_c': 0.03531830804165619, 'iw_pca_fit': 'combined', 'iw_solver': 'lbfgs', 'iw_rho': 0.9}. Best is trial 81 with value: 0.22042911056351472.
[I 2026-05-04 03:55:21,080] Trial 86 finished with value: 0.21438147499217494 and parameters: {'alpha': 305670.94054097915, 'use_snp_selection': False, 'iw_method': 'pc_logistic', 'iw_clip_max': 1.25, 'iw_prob_clip': 0.010144400311769382, 'iw_n_components': 80, 'iw_logistic_c': 0.021652477008960308, 'iw_pca_fit': 'combined', 'iw_solver': 'lbfgs', 'iw_rho': 0.9}. Best is trial 81 with value: 0.22042911056351472.
[I 2026-05-04 03:58:31,599] Trial 87 finished with value: 0.21832797290026412 and parameters: {'alpha': 223307.53228734963, 'use_snp_selection': False, 'iw_method': 'pc_logistic', 'iw_clip_max': 1.25, 'iw_prob_clip': 0.007940590671017937, 'iw_n_components': 80, 'iw_logistic_c': 0.0370255070008555, 'iw_pca_fit': 'combined', 'iw_solver': 'lbfgs', 'iw_rho': 0.9}. Best is trial 81 with value: 0.22042911056351472.
[I 2026-05-04 04:01:17,742] Trial 88 finished with value: 0.21074296958955574 and parameters: {'alpha': 180079.61395973153, 'use_snp_selection': False, 'iw_method': 'pc_logistic', 'iw_clip_max': 1.25, 'iw_prob_clip': 0.00814134207821714, 'iw_n_components': 10, 'iw_logistic_c': 0.03559878156750085, 'iw_pca_fit': 'combined', 'iw_solver': 'lbfgs', 'iw_rho': 0.9}. Best is trial 81 with value: 0.22042911056351472.
[I 2026-05-04 04:04:29,563] Trial 89 finished with value: 0.2151285516663084 and parameters: {'alpha': 220942.35337663305, 'use_snp_selection': False, 'iw_method': 'pc_logistic', 'iw_clip_max': 1.25, 'iw_prob_clip': 0.015279222277234144, 'iw_n_components': 80, 'iw_logistic_c': 0.09144205096010939, 'iw_pca_fit': 'combined', 'iw_solver': 'lbfgs', 'iw_rho': 0.9}. Best is trial 81 with value: 0.22042911056351472.
[I 2026-05-04 04:07:40,181] Trial 90 finished with value: 0.21714655900643218 and parameters: {'alpha': 246786.55811661878, 'use_snp_selection': False, 'iw_method': 'pc_logistic', 'iw_clip_max': 1.25, 'iw_prob_clip': 0.01193949330753459, 'iw_n_components': 80, 'iw_logistic_c': 0.04409844647556038, 'iw_pca_fit': 'combined', 'iw_solver': 'lbfgs', 'iw_rho': 0.9}. Best is trial 81 with value: 0.22042911056351472.
[I 2026-05-04 04:10:50,317] Trial 91 finished with value: 0.21498914860369678 and parameters: {'alpha': 249501.1983318827, 'use_snp_selection': False, 'iw_method': 'pc_logistic', 'iw_clip_max': 1.25, 'iw_prob_clip': 0.011768743174042497, 'iw_n_components': 80, 'iw_logistic_c': 0.04103948186162037, 'iw_pca_fit': 'combined', 'iw_solver': 'lbfgs', 'iw_rho': 0.9}. Best is trial 81 with value: 0.22042911056351472.
[I 2026-05-04 04:14:00,390] Trial 92 finished with value: 0.2151499288526851 and parameters: {'alpha': 167413.36323264215, 'use_snp_selection': False, 'iw_method': 'pc_logistic', 'iw_clip_max': 1.25, 'iw_prob_clip': 0.009706988916027724, 'iw_n_components': 80, 'iw_logistic_c': 0.0196578884624135, 'iw_pca_fit': 'combined', 'iw_solver': 'lbfgs', 'iw_rho': 0.9}. Best is trial 81 with value: 0.22042911056351472.
[I 2026-05-04 04:17:12,151] Trial 93 finished with value: 0.21889219168950785 and parameters: {'alpha': 201788.97249778037, 'use_snp_selection': False, 'iw_method': 'pc_logistic', 'iw_clip_max': 1.25, 'iw_prob_clip': 0.007793941479380252, 'iw_n_components': 80, 'iw_logistic_c': 0.09923174503136628, 'iw_pca_fit': 'combined', 'iw_solver': 'lbfgs', 'iw_rho': 0.9}. Best is trial 81 with value: 0.22042911056351472.
[I 2026-05-04 04:20:22,912] Trial 94 finished with value: 0.21571369144183322 and parameters: {'alpha': 204193.345252117, 'use_snp_selection': False, 'iw_method': 'pc_logistic', 'iw_clip_max': 1.25, 'iw_prob_clip': 0.008293883564137555, 'iw_n_components': 80, 'iw_logistic_c': 0.0582494775602261, 'iw_pca_fit': 'combined', 'iw_solver': 'lbfgs', 'iw_rho': 0.9}. Best is trial 81 with value: 0.22042911056351472.
[I 2026-05-04 04:23:22,702] Trial 95 finished with value: 0.20979175814893924 and parameters: {'alpha': 129662.64253078419, 'use_snp_selection': False, 'iw_method': 'pc_logistic', 'iw_clip_max': 2.0, 'iw_prob_clip': 0.012772841554932223, 'iw_n_components': 40, 'iw_logistic_c': 0.24011856008065138, 'iw_pca_fit': 'combined', 'iw_solver': 'lbfgs', 'iw_rho': 0.9}. Best is trial 81 with value: 0.22042911056351472.
[I 2026-05-04 04:23:54,672] Trial 96 finished with value: 0.21115934163945793 and parameters: {'alpha': 234753.18554117365, 'use_snp_selection': False, 'iw_method': 'uniform'}. Best is trial 81 with value: 0.22042911056351472.
[I 2026-05-04 04:27:04,971] Trial 97 finished with value: 0.2167472311863344 and parameters: {'alpha': 221319.59171774168, 'use_snp_selection': False, 'iw_method': 'pc_logistic', 'iw_clip_max': 1.25, 'iw_prob_clip': 0.006850846209757349, 'iw_n_components': 80, 'iw_logistic_c': 0.007975710059411775, 'iw_pca_fit': 'combined', 'iw_solver': 'lbfgs', 'iw_rho': 0.9}. Best is trial 81 with value: 0.22042911056351472.
[I 2026-05-04 04:29:54,463] Trial 98 finished with value: 0.211800342363077 and parameters: {'alpha': 197734.14609661268, 'use_snp_selection': False, 'iw_method': 'pc_logistic', 'iw_clip_max': 1.25, 'iw_prob_clip': 0.006889362428533273, 'iw_n_components': 20, 'iw_logistic_c': 0.006928457426870785, 'iw_pca_fit': 'combined', 'iw_solver': 'lbfgs', 'iw_rho': 0.9}. Best is trial 81 with value: 0.22042911056351472.
[I 2026-05-04 04:33:05,433] Trial 99 finished with value: 0.21410341083889825 and parameters: {'alpha': 171963.64664310866, 'use_snp_selection': False, 'iw_method': 'pc_logistic', 'iw_clip_max': 1.25, 'iw_prob_clip': 0.01554788330752014, 'iw_n_components': 80, 'iw_logistic_c': 0.01116089316212162, 'iw_pca_fit': 'combined', 'iw_solver': 'lbfgs', 'iw_rho': 0.9}. Best is trial 81 with value: 0.22042911056351472.
[I 2026-05-04 04:36:07,997] Trial 100 finished with value: 0.20785101855120086 and parameters: {'alpha': 214412.55765856148, 'use_snp_selection': False, 'iw_method': 'pc_logistic', 'iw_clip_max': 1.25, 'iw_prob_clip': 0.0006903941597534329, 'iw_n_components': 60, 'iw_logistic_c': 0.015849806746801445, 'iw_pca_fit': 'combined', 'iw_solver': 'lbfgs', 'iw_rho': 0.9}. Best is trial 81 with value: 0.22042911056351472.
[I 2026-05-04 04:39:21,234] Trial 101 finished with value: 0.21489469692869329 and parameters: {'alpha': 288188.4472865877, 'use_snp_selection': False, 'iw_method': 'pc_logistic', 'iw_clip_max': 1.25, 'iw_prob_clip': 0.007435705947906623, 'iw_n_components': 80, 'iw_logistic_c': 0.0341340399108898, 'iw_pca_fit': 'combined', 'iw_solver': 'lbfgs', 'iw_rho': 0.9}. Best is trial 81 with value: 0.22042911056351472.
[I 2026-05-04 04:42:30,209] Trial 102 finished with value: 0.21717965986371843 and parameters: {'alpha': 249286.61394200524, 'use_snp_selection': False, 'iw_method': 'pc_logistic', 'iw_clip_max': 1.25, 'iw_prob_clip': 0.010557251190355341, 'iw_n_components': 80, 'iw_logistic_c': 0.07271168796668047, 'iw_pca_fit': 'combined', 'iw_solver': 'lbfgs', 'iw_rho': 0.9}. Best is trial 81 with value: 0.22042911056351472.
[I 2026-05-04 04:45:38,788] Trial 103 finished with value: 0.217605165825666 and parameters: {'alpha': 223375.1858584232, 'use_snp_selection': False, 'iw_method': 'pc_logistic', 'iw_clip_max': 1.25, 'iw_prob_clip': 0.010138707501623994, 'iw_n_components': 80, 'iw_logistic_c': 0.08359542280412227, 'iw_pca_fit': 'combined', 'iw_solver': 'lbfgs', 'iw_rho': 0.9}. Best is trial 81 with value: 0.22042911056351472.
[I 2026-05-04 04:48:39,457] Trial 104 finished with value: 0.20657533703656314 and parameters: {'alpha': 229360.29241754638, 'use_snp_selection': False, 'iw_method': 'pc_logistic', 'iw_clip_max': 3.0, 'iw_prob_clip': 0.01004225169649679, 'iw_n_components': 50, 'iw_logistic_c': 0.08784911996203454, 'iw_pca_fit': 'combined', 'iw_solver': 'lbfgs', 'iw_rho': 0.9}. Best is trial 81 with value: 0.22042911056351472.
[I 2026-05-04 04:51:48,885] Trial 105 finished with value: 0.19486620436499086 and parameters: {'alpha': 249445.64835997182, 'use_snp_selection': False, 'iw_method': 'pc_logistic', 'iw_clip_max': 5.0, 'iw_prob_clip': 0.02030868369487719, 'iw_n_components': 80, 'iw_logistic_c': 0.16234248198348808, 'iw_pca_fit': 'combined', 'iw_solver': 'lbfgs', 'iw_rho': 0.9}. Best is trial 81 with value: 0.22042911056351472.
[I 2026-05-04 04:54:59,377] Trial 106 finished with value: 0.21428253239208256 and parameters: {'alpha': 191402.82648686031, 'use_snp_selection': False, 'iw_method': 'pc_logistic', 'iw_clip_max': 1.25, 'iw_prob_clip': 0.010821764598443837, 'iw_n_components': 80, 'iw_logistic_c': 0.5484057107119873, 'iw_pca_fit': 'combined', 'iw_solver': 'lbfgs', 'iw_rho': 0.9}. Best is trial 81 with value: 0.22042911056351472.
[I 2026-05-04 04:57:43,778] Trial 107 finished with value: 0.21198312744834108 and parameters: {'alpha': 211482.0049323548, 'use_snp_selection': False, 'iw_method': 'pc_logistic', 'iw_clip_max': 1.25, 'iw_prob_clip': 0.00899998882250425, 'iw_n_components': 10, 'iw_logistic_c': 0.30398584363233844, 'iw_pca_fit': 'combined', 'iw_solver': 'lbfgs', 'iw_rho': 0.9}. Best is trial 81 with value: 0.22042911056351472.
[I 2026-05-04 05:00:52,021] Trial 108 finished with value: 0.21339407372143407 and parameters: {'alpha': 228650.92413799715, 'use_snp_selection': False, 'iw_method': 'pc_logistic', 'iw_clip_max': 1.25, 'iw_prob_clip': 0.012476201136460635, 'iw_n_components': 80, 'iw_logistic_c': 0.06346703147609793, 'iw_pca_fit': 'combined', 'iw_solver': 'lbfgs', 'iw_rho': 0.5}. Best is trial 81 with value: 0.22042911056351472.
[I 2026-05-04 05:04:02,679] Trial 109 finished with value: 0.20082566673309588 and parameters: {'alpha': 162968.45630628333, 'use_snp_selection': False, 'iw_method': 'pc_logistic', 'iw_clip_max': 1.25, 'iw_prob_clip': 0.009422294188160475, 'iw_n_components': 80, 'iw_logistic_c': 0.12447959985166519, 'iw_pca_fit': 'combined', 'iw_solver': 'lbfgs', 'iw_rho': 1.0}. Best is trial 81 with value: 0.22042911056351472.
[I 2026-05-04 05:04:34,404] Trial 110 finished with value: 0.20980441827900584 and parameters: {'alpha': 130005.7629598246, 'use_snp_selection': False, 'iw_method': 'uniform'}. Best is trial 81 with value: 0.22042911056351472.
[I 2026-05-04 05:07:36,670] Trial 111 finished with value: 0.21222868744080206 and parameters: {'alpha': 300936.83176701126, 'use_snp_selection': False, 'iw_method': 'pc_logistic', 'iw_clip_max': 1.25, 'iw_prob_clip': 0.008441882355726443, 'iw_n_components': 80, 'iw_logistic_c': 4.5981347652661467e-07, 'iw_pca_fit': 'combined', 'iw_solver': 'lbfgs', 'iw_rho': 0.9}. Best is trial 81 with value: 0.22042911056351472.
