[I 2026-04-24 16:11:01,731] Trial 57 finished with value: 0.16780368417079963 and parameters: {'alpha': 54974.71673257205, 'use_snp_selection': True, 'num_snps': 46295, 'iw_method': 'uniform', 'iw_clip_max': 20.0, 'iw_prob_clip': 0.006393940328116761}. Best is trial 47 with value: 0.17115191981018898.
[I 2026-04-24 16:12:31,621] Trial 58 finished with value: 0.15816315056113417 and parameters: {'alpha': 560016.3710455656, 'use_snp_selection': True, 'num_snps': 31791, 'iw_method': 'uniform', 'iw_clip_max': 20.0, 'iw_prob_clip': 0.008631358068294338}. Best is trial 47 with value: 0.17115191981018898.
[I 2026-04-24 16:14:10,809] Trial 59 finished with value: 0.1573663466202183 and parameters: {'alpha': 24918.44144827434, 'use_snp_selection': True, 'num_snps': 39065, 'iw_method': 'uniform', 'iw_clip_max': 20.0, 'iw_prob_clip': 0.007895180751237876}. Best is trial 47 with value: 0.17115191981018898.
[I 2026-04-24 16:16:01,721] Trial 60 finished with value: 0.1398666067564108 and parameters: {'alpha': 7957.09966190605, 'use_snp_selection': True, 'num_snps': 49507, 'iw_method': 'uniform', 'iw_clip_max': 20.0, 'iw_prob_clip': 0.005054390343642054}. Best is trial 47 with value: 0.17115191981018898.
[I 2026-04-24 16:17:44,369] Trial 61 finished with value: 0.17057553221811175 and parameters: {'alpha': 128172.77181476384, 'use_snp_selection': True, 'num_snps': 46703, 'iw_method': 'uniform', 'iw_clip_max': 20.0, 'iw_prob_clip': 0.006719401624028374}. Best is trial 47 with value: 0.17115191981018898.
[I 2026-04-24 16:19:27,843] Trial 62 finished with value: 0.16920553898026985 and parameters: {'alpha': 103214.65956191497, 'use_snp_selection': True, 'num_snps': 47671, 'iw_method': 'uniform', 'iw_clip_max': 20.0, 'iw_prob_clip': 0.005906727889659197}. Best is trial 47 with value: 0.17115191981018898.
[I 2026-04-24 16:21:06,824] Trial 63 finished with value: 0.1699331333569811 and parameters: {'alpha': 182064.8588699778, 'use_snp_selection': True, 'num_snps': 43452, 'iw_method': 'uniform', 'iw_clip_max': 20.0, 'iw_prob_clip': 0.006801483227154953}. Best is trial 47 with value: 0.17115191981018898.
[I 2026-04-24 16:22:59,147] Trial 64 finished with value: 0.1558632758428317 and parameters: {'alpha': 1416486.590584016, 'use_snp_selection': True, 'num_snps': 53601, 'iw_method': 'uniform', 'iw_clip_max': 20.0, 'iw_prob_clip': 0.005585600282817033}. Best is trial 47 with value: 0.17115191981018898.
[I 2026-04-24 16:24:42,248] Trial 65 finished with value: 0.164710919657182 and parameters: {'alpha': 461217.1382979027, 'use_snp_selection': True, 'num_snps': 44578, 'iw_method': 'uniform', 'iw_clip_max': 20.0, 'iw_prob_clip': 0.0063528014223149425}. Best is trial 47 with value: 0.17115191981018898.
[I 2026-04-24 16:26:20,437] Trial 66 finished with value: 0.16354031865581284 and parameters: {'alpha': 45888.66373672309, 'use_snp_selection': True, 'num_snps': 40204, 'iw_method': 'uniform', 'iw_clip_max': 10.0, 'iw_prob_clip': 0.007379159254872784}. Best is trial 47 with value: 0.17115191981018898.
[I 2026-04-24 16:28:18,322] Trial 67 finished with value: 0.1611417358712983 and parameters: {'alpha': 93755.39769844236, 'use_snp_selection': True, 'num_snps': 58862, 'iw_method': 'uniform', 'iw_clip_max': 2.0, 'iw_prob_clip': 0.009145673933493557}. Best is trial 47 with value: 0.17115191981018898.
[I 2026-04-24 16:29:48,655] Trial 68 finished with value: 0.11520911816745168 and parameters: {'alpha': 856.7035803138656, 'use_snp_selection': True, 'num_snps': 34901, 'iw_method': 'uniform', 'iw_clip_max': 20.0, 'iw_prob_clip': 0.00828284730952143}. Best is trial 47 with value: 0.17115191981018898.
[I 2026-04-24 16:31:13,961] Trial 69 finished with value: 0.16407768174884182 and parameters: {'alpha': 166954.52459417807, 'use_snp_selection': True, 'num_snps': 28509, 'iw_method': 'uniform', 'iw_clip_max': 20.0, 'iw_prob_clip': 0.005717213388275915}. Best is trial 47 with value: 0.17115191981018898.
[I 2026-04-24 16:32:13,748] Trial 70 finished with value: 0.05991600315724986 and parameters: {'alpha': 11.488953977652624, 'use_snp_selection': True, 'num_snps': 6758, 'iw_method': 'uniform', 'iw_clip_max': 20.0, 'iw_prob_clip': 0.006504349193214353}. Best is trial 47 with value: 0.17115191981018898.
[I 2026-04-24 16:33:53,392] Trial 71 finished with value: 0.16898743561144608 and parameters: {'alpha': 217995.7311139833, 'use_snp_selection': True, 'num_snps': 42014, 'iw_method': 'uniform', 'iw_clip_max': 20.0, 'iw_prob_clip': 0.007195819940761979}. Best is trial 47 with value: 0.17115191981018898.
[I 2026-04-24 16:35:34,357] Trial 72 finished with value: 0.1703716151029126 and parameters: {'alpha': 158401.9138279058, 'use_snp_selection': True, 'num_snps': 43237, 'iw_method': 'uniform', 'iw_clip_max': 20.0, 'iw_prob_clip': 0.006784225941036935}. Best is trial 47 with value: 0.17115191981018898.
[I 2026-04-24 16:37:22,309] Trial 73 finished with value: 0.16699705403030465 and parameters: {'alpha': 88094.36791146312, 'use_snp_selection': True, 'num_snps': 49678, 'iw_method': 'uniform', 'iw_clip_max': 20.0, 'iw_prob_clip': 0.007711317498221961}. Best is trial 47 with value: 0.17115191981018898.
[I 2026-04-24 16:39:01,821] Trial 74 finished with value: 0.16068748245148604 and parameters: {'alpha': 786876.3214256122, 'use_snp_selection': True, 'num_snps': 42296, 'iw_method': 'uniform', 'iw_clip_max': 20.0, 'iw_prob_clip': 0.010225097264872347}. Best is trial 47 with value: 0.17115191981018898.
[I 2026-04-24 16:40:43,572] Trial 75 finished with value: 0.16613800425596204 and parameters: {'alpha': 375210.5552562657, 'use_snp_selection': True, 'num_snps': 44942, 'iw_method': 'uniform', 'iw_clip_max': 20.0, 'iw_prob_clip': 0.0059820885876761135}. Best is trial 47 with value: 0.17115191981018898.
[I 2026-04-24 16:42:31,838] Trial 76 finished with value: 0.16082760713279293 and parameters: {'alpha': 43595.21101236723, 'use_snp_selection': True, 'num_snps': 51220, 'iw_method': 'uniform', 'iw_clip_max': 2.0, 'iw_prob_clip': 0.012133988429372288}. Best is trial 47 with value: 0.17115191981018898.
[I 2026-04-24 16:44:12,532] Trial 77 finished with value: 0.15917249757236235 and parameters: {'alpha': 29547.518789696052, 'use_snp_selection': True, 'num_snps': 48654, 'iw_method': 'uniform', 'iw_clip_max': 10.0, 'iw_prob_clip': 0.005428431007389147}. Best is trial 47 with value: 0.17115191981018898.
[I 2026-04-24 16:45:59,694] Trial 78 finished with value: 0.1531954792072282 and parameters: {'alpha': 2151861.1391207594, 'use_snp_selection': True, 'num_snps': 54696, 'iw_method': 'uniform', 'iw_clip_max': 20.0, 'iw_prob_clip': 0.0065840272181407495}. Best is trial 47 with value: 0.17115191981018898.
[I 2026-04-24 16:47:28,771] Trial 79 finished with value: 0.16833456003302183 and parameters: {'alpha': 157762.33769633799, 'use_snp_selection': True, 'num_snps': 38087, 'iw_method': 'uniform', 'iw_clip_max': 5.0, 'iw_prob_clip': 0.006180534106075516}. Best is trial 47 with value: 0.17115191981018898.
[I 2026-04-24 16:49:07,424] Trial 80 finished with value: 0.16989293161742963 and parameters: {'alpha': 77598.92333152132, 'use_snp_selection': True, 'num_snps': 45013, 'iw_method': 'uniform', 'iw_clip_max': 20.0, 'iw_prob_clip': 0.007059260554581712}. Best is trial 47 with value: 0.17115191981018898.
[I 2026-04-24 16:50:42,491] Trial 81 finished with value: 0.17026829203459154 and parameters: {'alpha': 196712.2796360843, 'use_snp_selection': True, 'num_snps': 42931, 'iw_method': 'uniform', 'iw_clip_max': 20.0, 'iw_prob_clip': 0.006780048693218771}. Best is trial 47 with value: 0.17115191981018898.
[I 2026-04-24 16:52:15,126] Trial 82 finished with value: 0.166074617554946 and parameters: {'alpha': 315995.50839257386, 'use_snp_selection': True, 'num_snps': 41262, 'iw_method': 'uniform', 'iw_clip_max': 20.0, 'iw_prob_clip': 0.0077552568361144705}. Best is trial 47 with value: 0.17115191981018898.
[I 2026-04-24 16:53:51,355] Trial 83 finished with value: 0.16387033934351689 and parameters: {'alpha': 498551.610811297, 'use_snp_selection': True, 'num_snps': 44138, 'iw_method': 'uniform', 'iw_clip_max': 20.0, 'iw_prob_clip': 0.008195268846447938}. Best is trial 47 with value: 0.17115191981018898.
[I 2026-04-24 16:55:51,218] Trial 84 finished with value: 0.16666967261491827 and parameters: {'alpha': 253000.31442990268, 'use_snp_selection': True, 'num_snps': 51453, 'iw_method': 'uniform', 'iw_clip_max': 20.0, 'iw_prob_clip': 0.0053379305921429305}. Best is trial 47 with value: 0.17115191981018898.
[I 2026-04-24 16:57:56,245] Trial 85 finished with value: 0.1696155752966818 and parameters: {'alpha': 129478.07958342502, 'use_snp_selection': True, 'num_snps': 47560, 'iw_method': 'uniform', 'iw_clip_max': 20.0, 'iw_prob_clip': 0.006935600549384788}. Best is trial 47 with value: 0.17115191981018898.
[I 2026-04-24 16:59:44,622] Trial 86 finished with value: 0.1542881982904269 and parameters: {'alpha': 16023.291794444707, 'use_snp_selection': True, 'num_snps': 41363, 'iw_method': 'uniform', 'iw_clip_max': 5.0, 'iw_prob_clip': 0.006022462920522905}. Best is trial 47 with value: 0.17115191981018898.
[I 2026-04-24 17:01:21,080] Trial 87 finished with value: 0.166016437462634 and parameters: {'alpha': 65606.55538129703, 'use_snp_selection': True, 'num_snps': 35050, 'iw_method': 'uniform', 'iw_clip_max': 20.0, 'iw_prob_clip': 0.03622910322799122}. Best is trial 47 with value: 0.17115191981018898.
[I 2026-04-24 17:03:10,745] Trial 88 finished with value: 0.17053472909882636 and parameters: {'alpha': 125654.6289828328, 'use_snp_selection': True, 'num_snps': 45690, 'iw_method': 'uniform', 'iw_clip_max': 20.0, 'iw_prob_clip': 0.00754310371243286}. Best is trial 47 with value: 0.17115191981018898.
[I 2026-04-24 17:04:33,356] Trial 89 finished with value: 0.15234753988079727 and parameters: {'alpha': 1257697.4606312662, 'use_snp_selection': True, 'num_snps': 22333, 'iw_method': 'uniform', 'iw_clip_max': 5.0, 'iw_prob_clip': 0.008804689947561997}. Best is trial 47 with value: 0.17115191981018898.
[I 2026-04-24 17:06:33,093] Trial 90 finished with value: 0.16919881214307889 and parameters: {'alpha': 209809.68039236538, 'use_snp_selection': True, 'num_snps': 45273, 'iw_method': 'uniform', 'iw_clip_max': 2.0, 'iw_prob_clip': 0.007591138711485197}. Best is trial 47 with value: 0.17115191981018898.
[I 2026-04-24 17:08:55,250] Trial 91 finished with value: 0.1705537471627339 and parameters: {'alpha': 109448.91742027608, 'use_snp_selection': True, 'num_snps': 46538, 'iw_method': 'uniform', 'iw_clip_max': 20.0, 'iw_prob_clip': 0.00656732904046095}. Best is trial 47 with value: 0.17115191981018898.
[I 2026-04-24 17:11:14,153] Trial 92 finished with value: 0.16820125377341938 and parameters: {'alpha': 47975.39143384854, 'use_snp_selection': True, 'num_snps': 43030, 'iw_method': 'uniform', 'iw_clip_max': 20.0, 'iw_prob_clip': 0.006572653199329336}. Best is trial 47 with value: 0.17115191981018898.
[I 2026-04-24 17:13:28,455] Trial 93 finished with value: 0.16492465836254 and parameters: {'alpha': 312956.53216282517, 'use_snp_selection': True, 'num_snps': 40084, 'iw_method': 'uniform', 'iw_clip_max': 20.0, 'iw_prob_clip': 0.0058562807173003235}. Best is trial 47 with value: 0.17115191981018898.
[I 2026-04-24 17:15:43,904] Trial 94 finished with value: 0.1696698228923634 and parameters: {'alpha': 73825.36534199025, 'use_snp_selection': True, 'num_snps': 46516, 'iw_method': 'uniform', 'iw_clip_max': 20.0, 'iw_prob_clip': 0.006172384637983811}. Best is trial 47 with value: 0.17115191981018898.
[I 2026-04-24 17:18:09,254] Trial 95 finished with value: 0.1684568702831185 and parameters: {'alpha': 154662.39190763343, 'use_snp_selection': True, 'num_snps': 49496, 'iw_method': 'uniform', 'iw_clip_max': 20.0, 'iw_prob_clip': 0.007323407031819097}. Best is trial 47 with value: 0.17115191981018898.
[I 2026-04-24 17:24:04,401] Trial 96 finished with value: 0.15959930658224797 and parameters: {'alpha': 707974.2845712611, 'use_snp_selection': True, 'num_snps': 52234, 'iw_method': 'pc_logistic', 'iw_clip_max': 20.0, 'iw_prob_clip': 0.005485668116768743, 'iw_n_components': 3, 'iw_logistic_c': 0.016835414776095278, 'iw_pca_fit': 'source', 'iw_solver': 'lbfgs', 'iw_rho': 0.1}. Best is trial 47 with value: 0.17115191981018898.
[I 2026-04-24 17:24:44,588] Trial 97 finished with value: 0.10884878150768514 and parameters: {'alpha': 68.00680219623987, 'use_snp_selection': False, 'iw_method': 'uniform', 'iw_clip_max': 10.0, 'iw_prob_clip': 0.005063443733387127}. Best is trial 47 with value: 0.17115191981018898.
[I 2026-04-24 17:26:30,278] Trial 98 finished with value: 0.1682514796902839 and parameters: {'alpha': 109445.66811574688, 'use_snp_selection': True, 'num_snps': 37404, 'iw_method': 'uniform', 'iw_clip_max': 20.0, 'iw_prob_clip': 0.00656085730106827}. Best is trial 47 with value: 0.17115191981018898.
[I 2026-04-24 17:32:19,467] Trial 99 finished with value: 0.16508425384054007 and parameters: {'alpha': 428677.3396114176, 'use_snp_selection': True, 'num_snps': 48229, 'iw_method': 'pc_logistic', 'iw_clip_max': 3.0, 'iw_prob_clip': 0.008009667798617382, 'iw_n_components': 20, 'iw_logistic_c': 0.0037622561386526517, 'iw_pca_fit': 'source', 'iw_solver': 'lbfgs', 'iw_rho': 0.1}. Best is trial 47 with value: 0.17115191981018898.
