Running from this directory: /cluster/work/simennes/Master_thesis
Name of job: ncv_mlp_iw
ID of job: 24388830
The job was run on these nodes: idun-11-16
Config path: config/nested_cv_importance_weighted_mlp_uniform_config.json
[I 2026-05-05 16:35:30,938] Trial 0 finished with value: 0.15543481152761685 and parameters: {'hidden_dims': '[256, 128]', 'dropout': 0.18584155530312246, 'batch_norm': False, 'lr': 0.0007461243578022468, 'weight_decay': 3.677761493113531e-06, 'epochs': 129, 'loss': 'mse', 'optimizer': 'adam', 'use_snp_selection': False}. Best is trial 0 with value: 0.15543481152761685.
[I 2026-05-05 16:36:52,403] Trial 1 finished with value: 0.21233028035022156 and parameters: {'hidden_dims': '[256, 128]', 'dropout': 0.5595345557272271, 'batch_norm': False, 'lr': 1.3265824528578217e-05, 'weight_decay': 5.782219985187962e-05, 'epochs': 241, 'loss': 'mse', 'optimizer': 'adamw', 'use_snp_selection': False}. Best is trial 1 with value: 0.21233028035022156.
[I 2026-05-05 16:37:22,837] Trial 2 finished with value: 0.20932461170814892 and parameters: {'hidden_dims': '[256, 128]', 'dropout': 0.10920465462713655, 'batch_norm': False, 'lr': 9.251006337777395e-06, 'weight_decay': 0.0002739600801554822, 'epochs': 70, 'loss': 'mse', 'optimizer': 'adamw', 'use_snp_selection': False}. Best is trial 1 with value: 0.21233028035022156.
[I 2026-05-05 16:38:10,723] Trial 3 finished with value: 0.18535326951701464 and parameters: {'hidden_dims': '[512, 64]', 'dropout': 0.21097588325962954, 'batch_norm': False, 'lr': 0.00013945529197043052, 'weight_decay': 6.125997514421991e-07, 'epochs': 62, 'loss': 'mae', 'optimizer': 'adamw', 'use_snp_selection': False}. Best is trial 1 with value: 0.21233028035022156.
[I 2026-05-05 16:39:26,946] Trial 4 finished with value: 0.22230829425989077 and parameters: {'hidden_dims': '[512, 64]', 'dropout': 0.07948656777033702, 'batch_norm': False, 'lr': 4.227110266060512e-06, 'weight_decay': 0.0009515677674579354, 'epochs': 111, 'loss': 'mae', 'optimizer': 'adamw', 'use_snp_selection': False}. Best is trial 4 with value: 0.22230829425989077.
[I 2026-05-05 16:41:10,614] Trial 5 finished with value: 0.20353919927459319 and parameters: {'hidden_dims': '[512, 64]', 'dropout': 0.07220834610702047, 'batch_norm': False, 'lr': 2.8779057444450007e-06, 'weight_decay': 1.7819387991359787e-06, 'epochs': 157, 'loss': 'mse', 'optimizer': 'adam', 'use_snp_selection': False}. Best is trial 4 with value: 0.22230829425989077.
[I 2026-05-05 16:42:17,752] Trial 6 finished with value: 0.20215356215501767 and parameters: {'hidden_dims': '[256, 128]', 'dropout': 0.2505465890537582, 'batch_norm': False, 'lr': 2.5144473235736295e-05, 'weight_decay': 2.6022323891275268e-08, 'epochs': 193, 'loss': 'mse', 'optimizer': 'adam', 'use_snp_selection': False}. Best is trial 4 with value: 0.22230829425989077.
[I 2026-05-05 16:45:25,317] Trial 7 finished with value: 0.19468917202197683 and parameters: {'hidden_dims': '[512, 128]', 'dropout': 0.26053077688769005, 'batch_norm': False, 'lr': 4.4060479596036606e-05, 'weight_decay': 0.0004731892192938172, 'epochs': 299, 'loss': 'mse', 'optimizer': 'adamw', 'use_snp_selection': False}. Best is trial 4 with value: 0.22230829425989077.
[I 2026-05-05 16:46:51,432] Trial 8 finished with value: 0.19753300547384275 and parameters: {'hidden_dims': '[256, 64]', 'dropout': 0.14217118023780909, 'batch_norm': False, 'lr': 1.5072012341348237e-05, 'weight_decay': 2.5901569052680897e-08, 'epochs': 256, 'loss': 'mse', 'optimizer': 'adamw', 'use_snp_selection': False}. Best is trial 4 with value: 0.22230829425989077.
[I 2026-05-05 16:48:04,406] Trial 9 finished with value: 0.20329330616624222 and parameters: {'hidden_dims': '[256, 64]', 'dropout': 0.18128694708490736, 'batch_norm': False, 'lr': 2.644789330745559e-05, 'weight_decay': 5.030108342609318e-05, 'epochs': 213, 'loss': 'mae', 'optimizer': 'adam', 'use_snp_selection': False}. Best is trial 4 with value: 0.22230829425989077.
[I 2026-05-05 16:49:24,856] Trial 10 finished with value: 0.18585757986612056 and parameters: {'hidden_dims': '[512, 64]', 'dropout': 0.3938620828116577, 'batch_norm': False, 'lr': 1.754019878913446e-06, 'weight_decay': 1.7181525161124372e-05, 'epochs': 118, 'loss': 'mae', 'optimizer': 'adamw', 'use_snp_selection': False}. Best is trial 4 with value: 0.22230829425989077.
[I 2026-05-05 16:51:56,409] Trial 11 finished with value: 0.2177894462706773 and parameters: {'hidden_dims': '[512, 128]', 'dropout': 0.584402433195127, 'batch_norm': False, 'lr': 4.390805107803812e-06, 'weight_decay': 0.0005486058615380661, 'epochs': 238, 'loss': 'mae', 'optimizer': 'adamw', 'use_snp_selection': False}. Best is trial 4 with value: 0.22230829425989077.
[I 2026-05-05 16:52:41,632] Trial 12 pruned. 
[I 2026-05-05 16:54:29,467] Trial 13 finished with value: 0.20562922951215779 and parameters: {'hidden_dims': '[512, 128]', 'dropout': 0.5839700237872605, 'batch_norm': False, 'lr': 3.890202288134033e-06, 'weight_decay': 0.0001592260894871643, 'epochs': 164, 'loss': 'mae', 'optimizer': 'adamw', 'use_snp_selection': False}. Best is trial 4 with value: 0.22230829425989077.
[I 2026-05-05 16:57:33,037] Trial 14 finished with value: 0.20908654181989855 and parameters: {'hidden_dims': '[512, 128]', 'dropout': 0.35552009770735504, 'batch_norm': False, 'lr': 5.312498972918806e-06, 'weight_decay': 1.4656814272338477e-05, 'epochs': 292, 'loss': 'mae', 'optimizer': 'adamw', 'use_snp_selection': False}. Best is trial 4 with value: 0.22230829425989077.
[I 2026-05-05 16:59:57,817] Trial 15 finished with value: 0.2138991844772619 and parameters: {'hidden_dims': '[512, 64]', 'dropout': 0.4980555007405065, 'batch_norm': False, 'lr': 0.0001071350552358348, 'weight_decay': 0.0009399086985141015, 'epochs': 227, 'loss': 'mae', 'optimizer': 'adamw', 'use_snp_selection': False}. Best is trial 4 with value: 0.22230829425989077.
[I 2026-05-05 17:01:05,336] Trial 16 finished with value: 0.20640167988455738 and parameters: {'hidden_dims': '[512, 128]', 'dropout': 0.06000135667192001, 'batch_norm': False, 'lr': 7.055616325475806e-06, 'weight_decay': 2.2426502366345458e-07, 'epochs': 96, 'loss': 'mae', 'optimizer': 'adamw', 'use_snp_selection': False}. Best is trial 4 with value: 0.22230829425989077.
[I 2026-05-05 17:03:51,954] Trial 17 finished with value: 0.21585564499563184 and parameters: {'hidden_dims': '[512, 64]', 'dropout': 0.02110667597661109, 'batch_norm': False, 'lr': 2.1378800137654058e-06, 'weight_decay': 0.00011746952886405773, 'epochs': 264, 'loss': 'mae', 'optimizer': 'adamw', 'use_snp_selection': False}. Best is trial 4 with value: 0.22230829425989077.
[I 2026-05-05 17:04:59,589] Trial 18 finished with value: 0.2084086140541493 and parameters: {'hidden_dims': '[256, 64]', 'dropout': 0.4918637495099607, 'batch_norm': False, 'lr': 5.034918165142005e-05, 'weight_decay': 1.4066080819923217e-05, 'epochs': 195, 'loss': 'mae', 'optimizer': 'adam', 'use_snp_selection': False}. Best is trial 4 with value: 0.22230829425989077.
[I 2026-05-05 17:06:37,089] Trial 19 finished with value: 0.1703424497957318 and parameters: {'hidden_dims': '[512, 64]', 'dropout': 0.3423958107202608, 'batch_norm': False, 'lr': 1.302294910860255e-06, 'weight_decay': 5.690836360932578e-05, 'epochs': 147, 'loss': 'mae', 'optimizer': 'adamw', 'use_snp_selection': False}. Best is trial 4 with value: 0.22230829425989077.
[I 2026-05-05 17:07:40,460] Trial 20 finished with value: 0.1957044194339384 and parameters: {'hidden_dims': '[512, 128]', 'dropout': 0.49720019884855926, 'batch_norm': False, 'lr': 0.0006391401029609942, 'weight_decay': 1.5587772677943032e-07, 'epochs': 89, 'loss': 'mae', 'optimizer': 'adamw', 'use_snp_selection': False}. Best is trial 4 with value: 0.22230829425989077.
[I 2026-05-05 17:10:12,298] Trial 21 finished with value: 0.1978189683235298 and parameters: {'hidden_dims': '[512, 64]', 'dropout': 0.0032381689172097834, 'batch_norm': False, 'lr': 2.278630299723864e-06, 'weight_decay': 0.00017227825411246658, 'epochs': 239, 'loss': 'mae', 'optimizer': 'adamw', 'use_snp_selection': False}. Best is trial 4 with value: 0.22230829425989077.
[I 2026-05-05 17:12:58,962] Trial 22 finished with value: 0.2285486169827562 and parameters: {'hidden_dims': '[512, 64]', 'dropout': 0.03329713879710783, 'batch_norm': False, 'lr': 4.4656696114418025e-06, 'weight_decay': 0.00015252380547665033, 'epochs': 264, 'loss': 'mae', 'optimizer': 'adamw', 'use_snp_selection': False}. Best is trial 22 with value: 0.2285486169827562.
[I 2026-05-05 17:15:51,437] Trial 23 finished with value: 0.21109924087419016 and parameters: {'hidden_dims': '[512, 64]', 'dropout': 0.1208561423357392, 'batch_norm': False, 'lr': 5.32470011916953e-06, 'weight_decay': 0.0003626625640897904, 'epochs': 274, 'loss': 'mae', 'optimizer': 'adamw', 'use_snp_selection': False}. Best is trial 22 with value: 0.2285486169827562.
[I 2026-05-05 17:17:53,782] Trial 24 finished with value: 0.22232025963249855 and parameters: {'hidden_dims': '[512, 64]', 'dropout': 0.07383283701909603, 'batch_norm': False, 'lr': 1.2065700781555336e-05, 'weight_decay': 0.0007319693529658588, 'epochs': 189, 'loss': 'mae', 'optimizer': 'adamw', 'use_snp_selection': False}. Best is trial 22 with value: 0.2285486169827562.
[I 2026-05-05 17:19:54,469] Trial 25 finished with value: 0.21997035085221822 and parameters: {'hidden_dims': '[512, 64]', 'dropout': 0.0506754174466852, 'batch_norm': False, 'lr': 1.2054364339755185e-05, 'weight_decay': 0.0009107263819896565, 'epochs': 186, 'loss': 'mae', 'optimizer': 'adamw', 'use_snp_selection': False}. Best is trial 22 with value: 0.2285486169827562.
[I 2026-05-05 17:21:25,191] Trial 26 finished with value: 0.21923605948848673 and parameters: {'hidden_dims': '[512, 64]', 'dropout': 0.0890397862931701, 'batch_norm': False, 'lr': 1.6017503942875445e-05, 'weight_decay': 9.576275053271104e-05, 'epochs': 135, 'loss': 'mae', 'optimizer': 'adam', 'use_snp_selection': False}. Best is trial 22 with value: 0.2285486169827562.
[I 2026-05-05 17:22:26,281] Trial 27 finished with value: 0.20534431545844786 and parameters: {'hidden_dims': '[512, 64]', 'dropout': 0.1520697399783695, 'batch_norm': False, 'lr': 3.441252537568025e-06, 'weight_decay': 0.00024051970896008085, 'epochs': 85, 'loss': 'mae', 'optimizer': 'adamw', 'use_snp_selection': False}. Best is trial 22 with value: 0.2285486169827562.
[I 2026-05-05 17:24:44,104] Trial 28 finished with value: 0.21527374658298254 and parameters: {'hidden_dims': '[512, 64]', 'dropout': 0.022406127047594038, 'batch_norm': False, 'lr': 8.516158557080314e-05, 'weight_decay': 4.6735997002562755e-06, 'epochs': 215, 'loss': 'mae', 'optimizer': 'adamw', 'use_snp_selection': False}. Best is trial 22 with value: 0.2285486169827562.
[I 2026-05-05 17:26:37,410] Trial 29 finished with value: 0.21325146995803895 and parameters: {'hidden_dims': '[512, 64]', 'dropout': 0.19242269615351304, 'batch_norm': False, 'lr': 7.278054211725617e-06, 'weight_decay': 2.4245810605286476e-05, 'epochs': 173, 'loss': 'mae', 'optimizer': 'adam', 'use_snp_selection': False}. Best is trial 22 with value: 0.2285486169827562.
[I 2026-05-05 17:28:09,215] Trial 30 finished with value: 0.19129669300243415 and parameters: {'hidden_dims': '[512, 64]', 'dropout': 0.24710713423363673, 'batch_norm': False, 'lr': 0.00019802094314807996, 'weight_decay': 4.089332029039177e-06, 'epochs': 137, 'loss': 'mae', 'optimizer': 'adamw', 'use_snp_selection': False}. Best is trial 22 with value: 0.2285486169827562.
[I 2026-05-05 17:30:14,644] Trial 31 finished with value: 0.21621985944460492 and parameters: {'hidden_dims': '[512, 64]', 'dropout': 0.04994270917863107, 'batch_norm': False, 'lr': 1.0612114065113286e-05, 'weight_decay': 0.0008921909958212225, 'epochs': 194, 'loss': 'mae', 'optimizer': 'adamw', 'use_snp_selection': False}. Best is trial 22 with value: 0.2285486169827562.
[I 2026-05-05 17:32:27,079] Trial 32 finished with value: 0.21406742281662372 and parameters: {'hidden_dims': '[512, 64]', 'dropout': 0.05225927796715456, 'batch_norm': False, 'lr': 2.113534722348607e-05, 'weight_decay': 0.0003851160328180137, 'epochs': 206, 'loss': 'mae', 'optimizer': 'adamw', 'use_snp_selection': False}. Best is trial 22 with value: 0.2285486169827562.
[I 2026-05-05 17:33:31,386] Trial 33 finished with value: 0.21788072932078578 and parameters: {'hidden_dims': '[256, 128]', 'dropout': 0.0944272768411802, 'batch_norm': False, 'lr': 9.644728475068458e-06, 'weight_decay': 0.0002769929833662853, 'epochs': 182, 'loss': 'mae', 'optimizer': 'adamw', 'use_snp_selection': False}. Best is trial 22 with value: 0.2285486169827562.
[I 2026-05-05 17:35:25,970] Trial 34 finished with value: 0.22062807340131582 and parameters: {'hidden_dims': '[512, 64]', 'dropout': 0.1400935957431544, 'batch_norm': False, 'lr': 6.980289117316361e-06, 'weight_decay': 0.000955016704611007, 'epochs': 176, 'loss': 'mae', 'optimizer': 'adamw', 'use_snp_selection': False}. Best is trial 22 with value: 0.2285486169827562.
[I 2026-05-05 17:36:22,318] Trial 35 finished with value: 0.2053994078122965 and parameters: {'hidden_dims': '[256, 128]', 'dropout': 0.13928274150246509, 'batch_norm': False, 'lr': 5.712527282285506e-06, 'weight_decay': 9.234599657768044e-05, 'epochs': 155, 'loss': 'mse', 'optimizer': 'adamw', 'use_snp_selection': False}. Best is trial 22 with value: 0.2285486169827562.
[I 2026-05-05 17:37:40,937] Trial 36 finished with value: 0.20603680334750174 and parameters: {'hidden_dims': '[512, 64]', 'dropout': 0.10428469031566703, 'batch_norm': False, 'lr': 2.964275950871258e-06, 'weight_decay': 3.382259825763543e-05, 'epochs': 115, 'loss': 'mse', 'optimizer': 'adamw', 'use_snp_selection': False}. Best is trial 22 with value: 0.2285486169827562.
[I 2026-05-05 17:38:25,375] Trial 37 finished with value: 0.20533915863464042 and parameters: {'hidden_dims': '[512, 64]', 'dropout': 0.17214453915781208, 'batch_norm': False, 'lr': 4.1991787461760016e-05, 'weight_decay': 0.0005529962692028478, 'epochs': 57, 'loss': 'mae', 'optimizer': 'adam', 'use_snp_selection': False}. Best is trial 22 with value: 0.2285486169827562.
[I 2026-05-05 17:39:26,650] Trial 38 finished with value: 0.2087238306566738 and parameters: {'hidden_dims': '[256, 64]', 'dropout': 0.20976012042902115, 'batch_norm': False, 'lr': 8.485422205950842e-06, 'weight_decay': 0.0002097659355373657, 'epochs': 172, 'loss': 'mse', 'optimizer': 'adamw', 'use_snp_selection': False}. Best is trial 22 with value: 0.2285486169827562.
[I 2026-05-05 17:39:58,890] Trial 39 finished with value: 0.21807999072698464 and parameters: {'hidden_dims': '[256, 128]', 'dropout': 0.0015881857107821196, 'batch_norm': False, 'lr': 1.8775410084482562e-05, 'weight_decay': 7.1975400780480005e-06, 'epochs': 74, 'loss': 'mae', 'optimizer': 'adamw', 'use_snp_selection': False}. Best is trial 22 with value: 0.2285486169827562.
[I 2026-05-05 17:41:04,771] Trial 0 finished with value: 0.14869073313849984 and parameters: {'hidden_dims': '[256, 128]', 'dropout': 0.18584155530312246, 'batch_norm': False, 'lr': 0.0007461243578022468, 'weight_decay': 3.677761493113531e-06, 'epochs': 129, 'loss': 'mse', 'optimizer': 'adam', 'use_snp_selection': False}. Best is trial 0 with value: 0.14869073313849984.
[I 2026-05-05 17:42:26,506] Trial 1 finished with value: 0.17290714173801486 and parameters: {'hidden_dims': '[256, 128]', 'dropout': 0.5595345557272271, 'batch_norm': False, 'lr': 1.3265824528578217e-05, 'weight_decay': 5.782219985187962e-05, 'epochs': 241, 'loss': 'mse', 'optimizer': 'adamw', 'use_snp_selection': False}. Best is trial 1 with value: 0.17290714173801486.
[I 2026-05-05 17:42:57,196] Trial 2 finished with value: 0.17901720015199502 and parameters: {'hidden_dims': '[256, 128]', 'dropout': 0.10920465462713655, 'batch_norm': False, 'lr': 9.251006337777395e-06, 'weight_decay': 0.0002739600801554822, 'epochs': 70, 'loss': 'mse', 'optimizer': 'adamw', 'use_snp_selection': False}. Best is trial 2 with value: 0.17901720015199502.
[I 2026-05-05 17:43:44,724] Trial 3 finished with value: 0.14298597164527488 and parameters: {'hidden_dims': '[512, 64]', 'dropout': 0.21097588325962954, 'batch_norm': False, 'lr': 0.00013945529197043052, 'weight_decay': 6.125997514421991e-07, 'epochs': 62, 'loss': 'mae', 'optimizer': 'adamw', 'use_snp_selection': False}. Best is trial 2 with value: 0.17901720015199502.
[I 2026-05-05 17:45:01,279] Trial 4 finished with value: 0.176201112648802 and parameters: {'hidden_dims': '[512, 64]', 'dropout': 0.07948656777033702, 'batch_norm': False, 'lr': 4.227110266060512e-06, 'weight_decay': 0.0009515677674579354, 'epochs': 111, 'loss': 'mae', 'optimizer': 'adamw', 'use_snp_selection': False}. Best is trial 2 with value: 0.17901720015199502.
[I 2026-05-05 17:46:45,311] Trial 5 finished with value: 0.17883374014271675 and parameters: {'hidden_dims': '[512, 64]', 'dropout': 0.07220834610702047, 'batch_norm': False, 'lr': 2.8779057444450007e-06, 'weight_decay': 1.7819387991359787e-06, 'epochs': 157, 'loss': 'mse', 'optimizer': 'adam', 'use_snp_selection': False}. Best is trial 2 with value: 0.17901720015199502.
[I 2026-05-05 17:47:52,635] Trial 6 finished with value: 0.17946127837574424 and parameters: {'hidden_dims': '[256, 128]', 'dropout': 0.2505465890537582, 'batch_norm': False, 'lr': 2.5144473235736295e-05, 'weight_decay': 2.6022323891275268e-08, 'epochs': 193, 'loss': 'mse', 'optimizer': 'adam', 'use_snp_selection': False}. Best is trial 6 with value: 0.17946127837574424.
[I 2026-05-05 17:51:00,894] Trial 7 finished with value: 0.18617717744222642 and parameters: {'hidden_dims': '[512, 128]', 'dropout': 0.26053077688769005, 'batch_norm': False, 'lr': 4.4060479596036606e-05, 'weight_decay': 0.0004731892192938172, 'epochs': 299, 'loss': 'mse', 'optimizer': 'adamw', 'use_snp_selection': False}. Best is trial 7 with value: 0.18617717744222642.
[I 2026-05-05 17:52:27,358] Trial 8 finished with value: 0.18418776823754604 and parameters: {'hidden_dims': '[256, 64]', 'dropout': 0.14217118023780909, 'batch_norm': False, 'lr': 1.5072012341348237e-05, 'weight_decay': 2.5901569052680897e-08, 'epochs': 256, 'loss': 'mse', 'optimizer': 'adamw', 'use_snp_selection': False}. Best is trial 7 with value: 0.18617717744222642.
[I 2026-05-05 17:53:40,857] Trial 9 finished with value: 0.19601754279393552 and parameters: {'hidden_dims': '[256, 64]', 'dropout': 0.18128694708490736, 'batch_norm': False, 'lr': 2.644789330745559e-05, 'weight_decay': 5.030108342609318e-05, 'epochs': 213, 'loss': 'mae', 'optimizer': 'adam', 'use_snp_selection': False}. Best is trial 9 with value: 0.19601754279393552.
[I 2026-05-05 17:54:52,622] Trial 10 finished with value: 0.18906987755103385 and parameters: {'hidden_dims': '[256, 64]', 'dropout': 0.3938620828116578, 'batch_norm': False, 'lr': 0.00017483153375413737, 'weight_decay': 2.2485273624420345e-05, 'epochs': 207, 'loss': 'mae', 'optimizer': 'adam', 'use_snp_selection': False}. Best is trial 9 with value: 0.19601754279393552.
[I 2026-05-05 17:56:03,017] Trial 11 finished with value: 0.18675158282938814 and parameters: {'hidden_dims': '[256, 64]', 'dropout': 0.42317097275309223, 'batch_norm': False, 'lr': 0.0001437279445492769, 'weight_decay': 2.1898026593496918e-05, 'epochs': 203, 'loss': 'mae', 'optimizer': 'adam', 'use_snp_selection': False}. Best is trial 9 with value: 0.19601754279393552.
[I 2026-05-05 17:57:21,221] Trial 12 finished with value: 0.19194937963950362 and parameters: {'hidden_dims': '[256, 64]', 'dropout': 0.38612840177664126, 'batch_norm': False, 'lr': 0.00010657633883801231, 'weight_decay': 2.1250803965901395e-05, 'epochs': 229, 'loss': 'mae', 'optimizer': 'adam', 'use_snp_selection': False}. Best is trial 9 with value: 0.19601754279393552.
[I 2026-05-05 17:58:44,221] Trial 13 finished with value: 0.19334558505645516 and parameters: {'hidden_dims': '[256, 64]', 'dropout': 0.3862424045964289, 'batch_norm': False, 'lr': 4.278811488147198e-05, 'weight_decay': 6.79747107624376e-05, 'epochs': 245, 'loss': 'mae', 'optimizer': 'adam', 'use_snp_selection': False}. Best is trial 9 with value: 0.19601754279393552.
[I 2026-05-05 17:59:40,605] Trial 14 pruned. 
[I 2026-05-05 18:01:28,006] Trial 15 finished with value: 0.19010652604567777 and parameters: {'hidden_dims': '[512, 128]', 'dropout': 0.5138689187979693, 'batch_norm': False, 'lr': 4.133643192849605e-05, 'weight_decay': 4.049799747139729e-06, 'epochs': 162, 'loss': 'mae', 'optimizer': 'adam', 'use_snp_selection': False}. Best is trial 9 with value: 0.19601754279393552.
[I 2026-05-05 18:02:57,599] Trial 16 finished with value: 0.1877159825722499 and parameters: {'hidden_dims': '[256, 64]', 'dropout': 0.49636237383629367, 'batch_norm': False, 'lr': 6.330829504299615e-05, 'weight_decay': 2.2426502366345458e-07, 'epochs': 267, 'loss': 'mae', 'optimizer': 'adam', 'use_snp_selection': False}. Best is trial 9 with value: 0.19601754279393552.
[I 2026-05-05 18:04:14,880] Trial 17 finished with value: 0.19011096014071305 and parameters: {'hidden_dims': '[256, 64]', 'dropout': 0.2943245036542529, 'batch_norm': False, 'lr': 0.000566022139196402, 'weight_decay': 0.00010790563581654594, 'epochs': 226, 'loss': 'mae', 'optimizer': 'adam', 'use_snp_selection': False}. Best is trial 9 with value: 0.19601754279393552.
[I 2026-05-05 18:05:20,670] Trial 18 finished with value: 0.19715763307247752 and parameters: {'hidden_dims': '[256, 64]', 'dropout': 0.3204969569621835, 'batch_norm': False, 'lr': 6.702658611905047e-06, 'weight_decay': 1.1146178077955329e-05, 'epochs': 186, 'loss': 'mae', 'optimizer': 'adam', 'use_snp_selection': False}. Best is trial 18 with value: 0.19715763307247752.
[I 2026-05-05 18:06:51,941] Trial 19 finished with value: 0.18349895993569115 and parameters: {'hidden_dims': '[512, 128]', 'dropout': 0.17085324118848258, 'batch_norm': False, 'lr': 5.8101908800130424e-06, 'weight_decay': 9.080401511624432e-06, 'epochs': 135, 'loss': 'mae', 'optimizer': 'adam', 'use_snp_selection': False}. Best is trial 18 with value: 0.19715763307247752.
