Running from this directory: /cluster/work/simennes/Master_thesis
Name of job: ncv_ridge_avggrm
ID of job: 24332644
Array task ID: 12
The job was run on these nodes: idun-03-08
[I 2026-04-22 13:51:13,110] Trial 0 finished with value: 0.14367805316874127 and parameters: {'alpha': 12124.394605078569, 'use_snp_selection': True, 'num_snps': 5442, 'weight_scheme': 'linear', 'weight_clip_max': 5.0, 'weight_linear_min_weight': 0.5849999641604302, 'weight_linear_max_weight': 1.017621356653175}. Best is trial 0 with value: 0.14367805316874127.
[I 2026-04-22 13:52:52,364] Trial 1 finished with value: 0.17769763621079918 and parameters: {'alpha': 109374.19486700959, 'use_snp_selection': True, 'num_snps': 25583, 'weight_scheme': 'minmax', 'weight_clip_max': 5.0, 'weight_minmax_eps': 0.14026014881292506}. Best is trial 1 with value: 0.17769763621079918.
[I 2026-04-22 13:55:13,169] Trial 2 finished with value: 0.181144612863079 and parameters: {'alpha': 87498.4492964452, 'use_snp_selection': True, 'num_snps': 53815, 'weight_scheme': 'linear', 'weight_clip_max': 5.0, 'weight_linear_min_weight': 0.27089068881512934, 'weight_linear_max_weight': 2.0548794162981476}. Best is trial 2 with value: 0.181144612863079.
[I 2026-04-22 13:56:13,791] Trial 3 finished with value: 0.18630541088697491 and parameters: {'alpha': 194477.78458557956, 'use_snp_selection': False, 'weight_scheme': 'linear', 'weight_clip_max': None, 'weight_linear_min_weight': 0.21922985165550554, 'weight_linear_max_weight': 1.6260435767424388}. Best is trial 3 with value: 0.18630541088697491.
[I 2026-04-22 13:57:15,861] Trial 4 finished with value: 0.17453011319134173 and parameters: {'alpha': 9421665.195468841, 'use_snp_selection': False, 'weight_scheme': 'minmax', 'weight_clip_max': 5.0, 'weight_minmax_eps': 0.030689801852077123}. Best is trial 3 with value: 0.18630541088697491.
[I 2026-04-22 13:58:32,403] Trial 5 finished with value: 0.13788745013294143 and parameters: {'alpha': 5024.251153421461, 'use_snp_selection': True, 'num_snps': 9046, 'weight_scheme': 'top-heavy', 'weight_clip_max': 10.0, 'weight_topheavy_top_frac': 0.08738114702774886, 'weight_topheavy_low': 0.8991910356358707, 'weight_topheavy_high': 2.2968843007908903}. Best is trial 3 with value: 0.18630541088697491.
[I 2026-04-22 13:59:24,578] Trial 6 finished with value: 0.12163278494884439 and parameters: {'alpha': 16.382429914774185, 'use_snp_selection': False, 'weight_scheme': 'uniform', 'weight_clip_max': 10.0}. Best is trial 3 with value: 0.18630541088697491.
[I 2026-04-22 14:01:37,639] Trial 7 finished with value: 0.18202098720305152 and parameters: {'alpha': 94169.1049689093, 'use_snp_selection': True, 'num_snps': 47654, 'weight_scheme': 'exponential', 'weight_clip_max': 10.0, 'weight_exponential_beta': 2.3870207999558124}. Best is trial 3 with value: 0.18630541088697491.
[I 2026-04-22 14:02:48,778] Trial 8 finished with value: 0.041572269144920175 and parameters: {'alpha': 96.38034897458088, 'use_snp_selection': True, 'num_snps': 5388, 'weight_scheme': 'minmax', 'weight_clip_max': None, 'weight_minmax_eps': 0.07791532902904205}. Best is trial 3 with value: 0.18630541088697491.
[I 2026-04-22 14:03:48,862] Trial 9 finished with value: 0.1763130533266305 and parameters: {'alpha': 2700506.792350819, 'use_snp_selection': False, 'weight_scheme': 'linear', 'weight_clip_max': 5.0, 'weight_linear_min_weight': 0.8693390069349902, 'weight_linear_max_weight': 2.1394245284712112}. Best is trial 3 with value: 0.18630541088697491.
[I 2026-04-22 14:04:37,371] Trial 10 finished with value: 0.12593769241209732 and parameters: {'alpha': 859.5702697532038, 'use_snp_selection': False, 'weight_scheme': 'uniform', 'weight_clip_max': None}. Best is trial 3 with value: 0.18630541088697491.
[I 2026-04-22 14:05:37,436] Trial 11 finished with value: 0.19046321988602072 and parameters: {'alpha': 409602.6639259898, 'use_snp_selection': False, 'weight_scheme': 'exponential', 'weight_clip_max': None, 'weight_exponential_beta': 1.976306722397911}. Best is trial 11 with value: 0.19046321988602072.
[I 2026-04-22 14:06:38,863] Trial 12 finished with value: 0.17705321983475145 and parameters: {'alpha': 680962.8765783042, 'use_snp_selection': False, 'weight_scheme': 'exponential', 'weight_clip_max': None, 'weight_exponential_beta': 0.14549224357588808}. Best is trial 11 with value: 0.19046321988602072.
[I 2026-04-22 14:07:38,812] Trial 13 finished with value: 0.15772175003030015 and parameters: {'alpha': 606844.9385713676, 'use_snp_selection': False, 'weight_scheme': 'exponential', 'weight_clip_max': None, 'weight_exponential_beta': 7.893036257468982}. Best is trial 11 with value: 0.19046321988602072.
[I 2026-04-22 14:08:42,982] Trial 14 finished with value: 0.15135161526424135 and parameters: {'alpha': 9623.523179910808, 'use_snp_selection': False, 'weight_scheme': 'top-heavy', 'weight_clip_max': None, 'weight_topheavy_top_frac': 0.4895739776974001, 'weight_topheavy_low': 0.5303602048894995, 'weight_topheavy_high': 5.909143202235775}. Best is trial 11 with value: 0.19046321988602072.
[I 2026-04-22 14:09:50,801] Trial 15 finished with value: 0.19028650027065105 and parameters: {'alpha': 715721.3874792199, 'use_snp_selection': False, 'weight_scheme': 'linear', 'weight_clip_max': None, 'weight_linear_min_weight': 0.14113035286925918, 'weight_linear_max_weight': 3.64355612642742}. Best is trial 11 with value: 0.19046321988602072.
[I 2026-04-22 14:10:50,887] Trial 16 finished with value: 0.1787681859808642 and parameters: {'alpha': 2403105.9446239355, 'use_snp_selection': False, 'weight_scheme': 'exponential', 'weight_clip_max': None, 'weight_exponential_beta': 4.006553618932866}. Best is trial 11 with value: 0.19046321988602072.
[I 2026-04-22 14:11:50,964] Trial 17 finished with value: 0.16646512989148593 and parameters: {'alpha': 35136.64217601225, 'use_snp_selection': False, 'weight_scheme': 'exponential', 'weight_clip_max': None, 'weight_exponential_beta': 1.3022176600104531}. Best is trial 11 with value: 0.19046321988602072.
[I 2026-04-22 14:12:50,271] Trial 18 finished with value: 0.12901152915080213 and parameters: {'alpha': 1372.558621803536, 'use_snp_selection': False, 'weight_scheme': 'linear', 'weight_clip_max': None, 'weight_linear_min_weight': 0.13336618896534694, 'weight_linear_max_weight': 3.984486295912658}. Best is trial 11 with value: 0.19046321988602072.
[I 2026-04-22 14:13:37,974] Trial 19 finished with value: 0.17529822445300802 and parameters: {'alpha': 686558.4753828485, 'use_snp_selection': False, 'weight_scheme': 'uniform', 'weight_clip_max': None}. Best is trial 11 with value: 0.19046321988602072.
[I 2026-04-22 14:14:38,428] Trial 20 finished with value: 0.1662813360696481 and parameters: {'alpha': 9239144.019991277, 'use_snp_selection': False, 'weight_scheme': 'top-heavy', 'weight_clip_max': 10.0, 'weight_topheavy_top_frac': 0.3105689455947959, 'weight_topheavy_low': 1.1998104203775761, 'weight_topheavy_high': 4.8726329766710075}. Best is trial 11 with value: 0.19046321988602072.
[I 2026-04-22 14:15:38,036] Trial 21 finished with value: 0.1877228238323131 and parameters: {'alpha': 242226.0703956862, 'use_snp_selection': False, 'weight_scheme': 'linear', 'weight_clip_max': None, 'weight_linear_min_weight': 0.3237404288657081, 'weight_linear_max_weight': 3.9590881229398134}. Best is trial 11 with value: 0.19046321988602072.
[I 2026-04-22 14:16:36,599] Trial 22 finished with value: 0.1865081923085426 and parameters: {'alpha': 1502656.303562496, 'use_snp_selection': False, 'weight_scheme': 'linear', 'weight_clip_max': None, 'weight_linear_min_weight': 0.4321902038751166, 'weight_linear_max_weight': 3.8643154151318218}. Best is trial 11 with value: 0.19046321988602072.
[I 2026-04-22 14:17:35,353] Trial 23 finished with value: 0.18784904529797097 and parameters: {'alpha': 250455.24317934812, 'use_snp_selection': False, 'weight_scheme': 'linear', 'weight_clip_max': None, 'weight_linear_min_weight': 0.42746963966086127, 'weight_linear_max_weight': 3.1888253128154793}. Best is trial 11 with value: 0.19046321988602072.
[I 2026-04-22 14:18:34,699] Trial 24 finished with value: 0.16198481158638825 and parameters: {'alpha': 26057.673807564384, 'use_snp_selection': False, 'weight_scheme': 'linear', 'weight_clip_max': None, 'weight_linear_min_weight': 0.6045264404214132, 'weight_linear_max_weight': 3.105949424938981}. Best is trial 11 with value: 0.19046321988602072.
[I 2026-04-22 14:19:34,992] Trial 25 finished with value: 0.1687274192872623 and parameters: {'alpha': 620361.7687286027, 'use_snp_selection': False, 'weight_scheme': 'exponential', 'weight_clip_max': None, 'weight_exponential_beta': 6.083367043325115}. Best is trial 11 with value: 0.19046321988602072.
[I 2026-04-22 14:20:36,737] Trial 26 finished with value: 0.17844755698419534 and parameters: {'alpha': 3216779.4477701676, 'use_snp_selection': False, 'weight_scheme': 'linear', 'weight_clip_max': None, 'weight_linear_min_weight': 0.7787048221564035, 'weight_linear_max_weight': 3.0542139880758556}. Best is trial 11 with value: 0.19046321988602072.
[I 2026-04-22 14:21:37,797] Trial 27 finished with value: 0.1687869853378506 and parameters: {'alpha': 40875.15988444205, 'use_snp_selection': False, 'weight_scheme': 'linear', 'weight_clip_max': None, 'weight_linear_min_weight': 0.41636521989037334, 'weight_linear_max_weight': 3.252105493433519}. Best is trial 11 with value: 0.19046321988602072.
[I 2026-04-22 14:22:36,632] Trial 28 finished with value: 0.185499521487176 and parameters: {'alpha': 325736.8198801494, 'use_snp_selection': False, 'weight_scheme': 'exponential', 'weight_clip_max': None, 'weight_exponential_beta': 3.46371412823932}. Best is trial 11 with value: 0.19046321988602072.
[I 2026-04-22 14:24:42,936] Trial 29 finished with value: 0.12545186133334366 and parameters: {'alpha': 1912.7580430981598, 'use_snp_selection': True, 'num_snps': 35465, 'weight_scheme': 'linear', 'weight_clip_max': 10.0, 'weight_linear_min_weight': 0.12711886047894355, 'weight_linear_max_weight': 3.4109613042842817}. Best is trial 11 with value: 0.19046321988602072.
[I 2026-04-22 14:25:49,346] Trial 30 finished with value: 0.15296843421221568 and parameters: {'alpha': 14614.574920098006, 'use_snp_selection': False, 'weight_scheme': 'uniform', 'weight_clip_max': 5.0}. Best is trial 11 with value: 0.19046321988602072.
[I 2026-04-22 14:26:48,750] Trial 31 finished with value: 0.18938120812798298 and parameters: {'alpha': 349312.00041644514, 'use_snp_selection': False, 'weight_scheme': 'linear', 'weight_clip_max': None, 'weight_linear_min_weight': 0.3520757180347046, 'weight_linear_max_weight': 3.732522237663184}. Best is trial 11 with value: 0.19046321988602072.
[I 2026-04-22 14:27:50,775] Trial 32 finished with value: 0.1856450776344828 and parameters: {'alpha': 1505119.4986403205, 'use_snp_selection': False, 'weight_scheme': 'linear', 'weight_clip_max': None, 'weight_linear_min_weight': 0.4260892252855162, 'weight_linear_max_weight': 2.798268529326844}. Best is trial 11 with value: 0.19046321988602072.
[I 2026-04-22 14:28:57,095] Trial 33 finished with value: 0.17896964828366663 and parameters: {'alpha': 89161.37727191306, 'use_snp_selection': False, 'weight_scheme': 'linear', 'weight_clip_max': None, 'weight_linear_min_weight': 0.2966819129547963, 'weight_linear_max_weight': 3.532184586438931}. Best is trial 11 with value: 0.19046321988602072.
[I 2026-04-22 14:30:45,083] Trial 34 finished with value: 0.17721388809703817 and parameters: {'alpha': 189454.6576174577, 'use_snp_selection': True, 'num_snps': 23670, 'weight_scheme': 'minmax', 'weight_clip_max': None, 'weight_minmax_eps': 0.19110140424105435}. Best is trial 11 with value: 0.19046321988602072.
[I 2026-04-22 14:31:46,372] Trial 35 finished with value: 0.18773247291525388 and parameters: {'alpha': 248156.18472127174, 'use_snp_selection': False, 'weight_scheme': 'linear', 'weight_clip_max': 5.0, 'weight_linear_min_weight': 0.5315524470901097, 'weight_linear_max_weight': 3.5252874785854256}. Best is trial 11 with value: 0.19046321988602072.
[I 2026-04-22 14:32:43,118] Trial 36 finished with value: 0.18855132454287932 and parameters: {'alpha': 1168062.047082014, 'use_snp_selection': False, 'weight_scheme': 'linear', 'weight_clip_max': None, 'weight_linear_min_weight': 0.19733617834825262, 'weight_linear_max_weight': 2.722629296022644}. Best is trial 11 with value: 0.19046321988602072.
[I 2026-04-22 14:34:49,615] Trial 37 finished with value: 0.1622120386968817 and parameters: {'alpha': 5164500.790023428, 'use_snp_selection': True, 'num_snps': 39811, 'weight_scheme': 'top-heavy', 'weight_clip_max': 5.0, 'weight_topheavy_top_frac': 0.1148785677311325, 'weight_topheavy_low': 0.5029807285243505, 'weight_topheavy_high': 1.3033046421274381}. Best is trial 11 with value: 0.19046321988602072.
[I 2026-04-22 14:35:46,106] Trial 38 finished with value: 0.18895193220998285 and parameters: {'alpha': 1234717.9208181782, 'use_snp_selection': False, 'weight_scheme': 'minmax', 'weight_clip_max': None, 'weight_minmax_eps': 0.014698948990272478}. Best is trial 11 with value: 0.19046321988602072.
[I 2026-04-22 14:38:20,497] Trial 39 finished with value: 0.1767609990243442 and parameters: {'alpha': 64586.88758407176, 'use_snp_selection': True, 'num_snps': 59880, 'weight_scheme': 'minmax', 'weight_clip_max': 10.0, 'weight_minmax_eps': 0.00750812199949786}. Best is trial 11 with value: 0.19046321988602072.
[I 2026-04-22 14:39:17,879] Trial 40 finished with value: 0.17858690847147832 and parameters: {'alpha': 5648067.988858254, 'use_snp_selection': False, 'weight_scheme': 'minmax', 'weight_clip_max': None, 'weight_minmax_eps': 0.07089824784925916}. Best is trial 11 with value: 0.19046321988602072.
[I 2026-04-22 14:40:15,305] Trial 41 finished with value: 0.19016257429800743 and parameters: {'alpha': 789085.0380344094, 'use_snp_selection': False, 'weight_scheme': 'minmax', 'weight_clip_max': None, 'weight_minmax_eps': 0.036714710213079926}. Best is trial 11 with value: 0.19046321988602072.
[I 2026-04-22 14:41:13,303] Trial 42 finished with value: 0.1891121316888257 and parameters: {'alpha': 1144099.4914677152, 'use_snp_selection': False, 'weight_scheme': 'minmax', 'weight_clip_max': None, 'weight_minmax_eps': 0.03524034357271849}. Best is trial 11 with value: 0.19046321988602072.
[I 2026-04-22 14:42:20,239] Trial 43 finished with value: 0.19014892508146178 and parameters: {'alpha': 467288.9559049154, 'use_snp_selection': False, 'weight_scheme': 'minmax', 'weight_clip_max': None, 'weight_minmax_eps': 0.05166178404236842}. Best is trial 11 with value: 0.19046321988602072.
[I 2026-04-22 14:43:22,578] Trial 44 finished with value: 0.18397902181776396 and parameters: {'alpha': 146857.21662694513, 'use_snp_selection': False, 'weight_scheme': 'minmax', 'weight_clip_max': None, 'weight_minmax_eps': 0.0715389949256651}. Best is trial 11 with value: 0.19046321988602072.
[I 2026-04-22 14:44:22,628] Trial 45 finished with value: 0.18974515347639023 and parameters: {'alpha': 401716.9173633712, 'use_snp_selection': False, 'weight_scheme': 'minmax', 'weight_clip_max': None, 'weight_minmax_eps': 0.10895224857123945}. Best is trial 11 with value: 0.19046321988602072.
[I 2026-04-22 14:45:19,660] Trial 46 finished with value: 0.12240755046523884 and parameters: {'alpha': 143.5089049818606, 'use_snp_selection': False, 'weight_scheme': 'minmax', 'weight_clip_max': 5.0, 'weight_minmax_eps': 0.125757821410181}. Best is trial 11 with value: 0.19046321988602072.
[I 2026-04-22 14:46:16,511] Trial 47 finished with value: 0.1819502412154275 and parameters: {'alpha': 117500.98655698645, 'use_snp_selection': False, 'weight_scheme': 'minmax', 'weight_clip_max': 10.0, 'weight_minmax_eps': 0.09753105569371333}. Best is trial 11 with value: 0.19046321988602072.
[I 2026-04-22 14:47:45,084] Trial 48 finished with value: 0.17583961684336474 and parameters: {'alpha': 521511.4975345528, 'use_snp_selection': True, 'num_snps': 17348, 'weight_scheme': 'minmax', 'weight_clip_max': None, 'weight_minmax_eps': 0.04893959122789636}. Best is trial 11 with value: 0.19046321988602072.
[I 2026-04-22 14:48:42,741] Trial 49 finished with value: 0.18380121200148541 and parameters: {'alpha': 2304212.087413613, 'use_snp_selection': False, 'weight_scheme': 'minmax', 'weight_clip_max': None, 'weight_minmax_eps': 0.12229730480519718}. Best is trial 11 with value: 0.19046321988602072.
[I 2026-04-22 14:49:40,386] Trial 50 finished with value: 0.1733382878990774 and parameters: {'alpha': 63334.96483503915, 'use_snp_selection': False, 'weight_scheme': 'exponential', 'weight_clip_max': None, 'weight_exponential_beta': 5.548602722107475}. Best is trial 11 with value: 0.19046321988602072.
[I 2026-04-22 14:50:37,823] Trial 51 finished with value: 0.1897969594155053 and parameters: {'alpha': 398140.64862961066, 'use_snp_selection': False, 'weight_scheme': 'minmax', 'weight_clip_max': None, 'weight_minmax_eps': 0.0549876492641938}. Best is trial 11 with value: 0.19046321988602072.
[I 2026-04-22 14:51:36,567] Trial 52 finished with value: 0.18980133523880344 and parameters: {'alpha': 398457.46025633113, 'use_snp_selection': False, 'weight_scheme': 'minmax', 'weight_clip_max': None, 'weight_minmax_eps': 0.05626545093262882}. Best is trial 11 with value: 0.19046321988602072.
[I 2026-04-22 14:52:35,457] Trial 53 finished with value: 0.1903208774180193 and parameters: {'alpha': 653114.1643554447, 'use_snp_selection': False, 'weight_scheme': 'minmax', 'weight_clip_max': None, 'weight_minmax_eps': 0.0541459364477406}. Best is trial 11 with value: 0.19046321988602072.
[I 2026-04-22 14:53:34,235] Trial 54 finished with value: 0.19019436154895017 and parameters: {'alpha': 760397.0158975387, 'use_snp_selection': False, 'weight_scheme': 'minmax', 'weight_clip_max': None, 'weight_minmax_eps': 0.04397964479919899}. Best is trial 11 with value: 0.19046321988602072.
[I 2026-04-22 14:54:33,471] Trial 55 finished with value: 0.18229441944698338 and parameters: {'alpha': 3480842.275617055, 'use_snp_selection': False, 'weight_scheme': 'minmax', 'weight_clip_max': None, 'weight_minmax_eps': 0.03611434982268946}. Best is trial 11 with value: 0.19046321988602072.
[I 2026-04-22 14:55:21,070] Trial 56 finished with value: 0.17319846683015427 and parameters: {'alpha': 958160.7957865515, 'use_snp_selection': False, 'weight_scheme': 'uniform', 'weight_clip_max': None}. Best is trial 11 with value: 0.19046321988602072.
[I 2026-04-22 14:56:18,889] Trial 57 finished with value: 0.18007360034310207 and parameters: {'alpha': 767370.2663251784, 'use_snp_selection': False, 'weight_scheme': 'top-heavy', 'weight_clip_max': None, 'weight_topheavy_top_frac': 0.45792927801586275, 'weight_topheavy_low': 1.1939054250248757, 'weight_topheavy_high': 3.54349893412191}. Best is trial 11 with value: 0.19046321988602072.
[I 2026-04-22 14:57:16,759] Trial 58 finished with value: 0.18826361109460404 and parameters: {'alpha': 2072540.2484115646, 'use_snp_selection': False, 'weight_scheme': 'exponential', 'weight_clip_max': 10.0, 'weight_exponential_beta': 2.348932861234715}. Best is trial 11 with value: 0.19046321988602072.
[I 2026-04-22 14:58:13,321] Trial 59 finished with value: 0.17925119319946214 and parameters: {'alpha': 5546946.28120092, 'use_snp_selection': False, 'weight_scheme': 'minmax', 'weight_clip_max': None, 'weight_minmax_eps': 0.02268698917429395}. Best is trial 11 with value: 0.19046321988602072.
[I 2026-04-22 14:59:10,352] Trial 60 finished with value: 0.17930571801030568 and parameters: {'alpha': 159448.22526475316, 'use_snp_selection': False, 'weight_scheme': 'exponential', 'weight_clip_max': None, 'weight_exponential_beta': 0.12487904848407139}. Best is trial 11 with value: 0.19046321988602072.
[I 2026-04-22 15:00:08,048] Trial 61 finished with value: 0.19011219901288154 and parameters: {'alpha': 457223.8364664524, 'use_snp_selection': False, 'weight_scheme': 'minmax', 'weight_clip_max': None, 'weight_minmax_eps': 0.05399912222521031}. Best is trial 11 with value: 0.19046321988602072.
[I 2026-04-22 15:01:05,777] Trial 62 finished with value: 0.19029058634809887 and parameters: {'alpha': 691428.3235879745, 'use_snp_selection': False, 'weight_scheme': 'minmax', 'weight_clip_max': None, 'weight_minmax_eps': 0.04987282281971187}. Best is trial 11 with value: 0.19046321988602072.
[I 2026-04-22 15:02:02,475] Trial 63 finished with value: 0.19018064134374166 and parameters: {'alpha': 763869.7423828385, 'use_snp_selection': False, 'weight_scheme': 'minmax', 'weight_clip_max': None, 'weight_minmax_eps': 0.0016478160015818352}. Best is trial 11 with value: 0.19046321988602072.
[I 2026-04-22 15:02:59,055] Trial 64 finished with value: 0.1865450924480406 and parameters: {'alpha': 1995583.788125353, 'use_snp_selection': False, 'weight_scheme': 'minmax', 'weight_clip_max': None, 'weight_minmax_eps': 0.0029235594712565846}. Best is trial 11 with value: 0.19046321988602072.
[I 2026-04-22 15:03:56,614] Trial 65 finished with value: 0.19006179582271082 and parameters: {'alpha': 848248.037939067, 'use_snp_selection': False, 'weight_scheme': 'minmax', 'weight_clip_max': None, 'weight_minmax_eps': 0.025819975656864304}. Best is trial 11 with value: 0.19046321988602072.
[I 2026-04-22 15:04:54,875] Trial 66 finished with value: 0.18134417142835485 and parameters: {'alpha': 3579230.6858521807, 'use_snp_selection': False, 'weight_scheme': 'minmax', 'weight_clip_max': None, 'weight_minmax_eps': 0.08645572761300037}. Best is trial 11 with value: 0.19046321988602072.
[I 2026-04-22 15:06:58,757] Trial 67 finished with value: 0.16690540597163686 and parameters: {'alpha': 1555236.5206043692, 'use_snp_selection': True, 'num_snps': 43745, 'weight_scheme': 'uniform', 'weight_clip_max': 5.0}. Best is trial 11 with value: 0.19046321988602072.
