[I 2026-04-22 15:53:05,448] Trial 67 finished with value: 0.16597350220370446 and parameters: {'alpha': 2166883.4833328244, 'use_snp_selection': True, 'num_snps': 52925, 'weight_scheme': 'linear', 'weight_clip_max': 10.0, 'weight_linear_min_weight': 0.9975850379889102, 'weight_linear_max_weight': 3.8608109338662135}. Best is trial 61 with value: 0.1808243734277741.
[I 2026-04-22 15:53:55,822] Trial 68 finished with value: 0.18032084344023516 and parameters: {'alpha': 660170.9245910703, 'use_snp_selection': False, 'weight_scheme': 'minmax', 'weight_clip_max': 10.0, 'weight_minmax_eps': 0.018736801045661118}. Best is trial 61 with value: 0.1808243734277741.
[I 2026-04-22 15:54:37,604] Trial 69 finished with value: 0.12631864101522222 and parameters: {'alpha': 29.52399414076599, 'use_snp_selection': False, 'weight_scheme': 'uniform', 'weight_clip_max': 10.0}. Best is trial 61 with value: 0.1808243734277741.
[I 2026-04-22 15:55:27,981] Trial 70 finished with value: 0.18036514944680093 and parameters: {'alpha': 731749.3917518492, 'use_snp_selection': False, 'weight_scheme': 'minmax', 'weight_clip_max': 10.0, 'weight_minmax_eps': 0.021113056322246363}. Best is trial 61 with value: 0.1808243734277741.
[I 2026-04-22 15:56:18,369] Trial 71 finished with value: 0.18038098522885967 and parameters: {'alpha': 792996.5241898176, 'use_snp_selection': False, 'weight_scheme': 'minmax', 'weight_clip_max': 10.0, 'weight_minmax_eps': 0.019509640062401704}. Best is trial 61 with value: 0.1808243734277741.
[I 2026-04-22 15:57:08,744] Trial 72 finished with value: 0.18025919553032355 and parameters: {'alpha': 627825.1457761226, 'use_snp_selection': False, 'weight_scheme': 'minmax', 'weight_clip_max': 10.0, 'weight_minmax_eps': 0.020480375924970297}. Best is trial 61 with value: 0.1808243734277741.
[I 2026-04-22 15:57:59,123] Trial 73 finished with value: 0.18012106551032925 and parameters: {'alpha': 612958.3834949061, 'use_snp_selection': False, 'weight_scheme': 'minmax', 'weight_clip_max': 10.0, 'weight_minmax_eps': 0.03790666622711423}. Best is trial 61 with value: 0.1808243734277741.
[I 2026-04-22 15:58:49,509] Trial 74 finished with value: 0.1801575733478775 and parameters: {'alpha': 629185.6078193547, 'use_snp_selection': False, 'weight_scheme': 'minmax', 'weight_clip_max': 10.0, 'weight_minmax_eps': 0.036340350161452775}. Best is trial 61 with value: 0.1808243734277741.
[I 2026-04-22 15:59:39,926] Trial 75 finished with value: 0.1801815652174411 and parameters: {'alpha': 586675.276676003, 'use_snp_selection': False, 'weight_scheme': 'minmax', 'weight_clip_max': 10.0, 'weight_minmax_eps': 0.014228414857384117}. Best is trial 61 with value: 0.1808243734277741.
[I 2026-04-22 16:00:30,319] Trial 76 finished with value: 0.17545404115564167 and parameters: {'alpha': 2972574.834764186, 'use_snp_selection': False, 'weight_scheme': 'minmax', 'weight_clip_max': 10.0, 'weight_minmax_eps': 0.012647788018219964}. Best is trial 61 with value: 0.1808243734277741.
[I 2026-04-22 16:01:20,682] Trial 77 finished with value: 0.17759462202344908 and parameters: {'alpha': 2029454.8349494168, 'use_snp_selection': False, 'weight_scheme': 'minmax', 'weight_clip_max': 10.0, 'weight_minmax_eps': 0.01778241749473797}. Best is trial 61 with value: 0.1808243734277741.
[I 2026-04-22 16:02:11,052] Trial 78 finished with value: 0.17610335133810176 and parameters: {'alpha': 581054.4747679551, 'use_snp_selection': False, 'weight_scheme': 'linear', 'weight_clip_max': 10.0, 'weight_linear_min_weight': 0.7384365911233802, 'weight_linear_max_weight': 3.0575419696296704}. Best is trial 61 with value: 0.1808243734277741.
[I 2026-04-22 16:03:01,438] Trial 79 finished with value: 0.17001946546432434 and parameters: {'alpha': 6213689.291682783, 'use_snp_selection': False, 'weight_scheme': 'minmax', 'weight_clip_max': 10.0, 'weight_minmax_eps': 0.027764588879136846}. Best is trial 61 with value: 0.1808243734277741.
[I 2026-04-22 16:03:51,849] Trial 80 finished with value: 0.1748024645774428 and parameters: {'alpha': 175697.26905741665, 'use_snp_selection': False, 'weight_scheme': 'minmax', 'weight_clip_max': 10.0, 'weight_minmax_eps': 0.043178605945356836}. Best is trial 61 with value: 0.1808243734277741.
[I 2026-04-22 16:04:42,243] Trial 81 finished with value: 0.1800902534806455 and parameters: {'alpha': 585709.9165296428, 'use_snp_selection': False, 'weight_scheme': 'minmax', 'weight_clip_max': 10.0, 'weight_minmax_eps': 0.03499912927814768}. Best is trial 61 with value: 0.1808243734277741.
[I 2026-04-22 16:05:32,648] Trial 82 finished with value: 0.1803646199513578 and parameters: {'alpha': 671841.5424754709, 'use_snp_selection': False, 'weight_scheme': 'minmax', 'weight_clip_max': 10.0, 'weight_minmax_eps': 0.013005673098712207}. Best is trial 61 with value: 0.1808243734277741.
[I 2026-04-22 16:06:23,053] Trial 83 finished with value: 0.1742037242786486 and parameters: {'alpha': 3570682.0823217975, 'use_snp_selection': False, 'weight_scheme': 'minmax', 'weight_clip_max': 10.0, 'weight_minmax_eps': 0.013453158457162316}. Best is trial 61 with value: 0.1808243734277741.
[I 2026-04-22 16:07:13,461] Trial 84 finished with value: 0.17872368239286535 and parameters: {'alpha': 1692489.0261616062, 'use_snp_selection': False, 'weight_scheme': 'minmax', 'weight_clip_max': 10.0, 'weight_minmax_eps': 0.010036400549375143}. Best is trial 61 with value: 0.1808243734277741.
[I 2026-04-22 16:08:03,853] Trial 85 finished with value: 0.1798705672299639 and parameters: {'alpha': 1098214.3052215904, 'use_snp_selection': False, 'weight_scheme': 'minmax', 'weight_clip_max': 10.0, 'weight_minmax_eps': 0.02570103632892544}. Best is trial 61 with value: 0.1808243734277741.
[I 2026-04-22 16:08:54,226] Trial 86 finished with value: 0.1768879375412048 and parameters: {'alpha': 249835.39006666245, 'use_snp_selection': False, 'weight_scheme': 'minmax', 'weight_clip_max': 10.0, 'weight_minmax_eps': 0.015511245256031139}. Best is trial 61 with value: 0.1808243734277741.
[I 2026-04-22 16:09:44,593] Trial 87 finished with value: 0.13524341127385947 and parameters: {'alpha': 2244.229629657118, 'use_snp_selection': False, 'weight_scheme': 'minmax', 'weight_clip_max': 10.0, 'weight_minmax_eps': 0.001961682438915752}. Best is trial 61 with value: 0.1808243734277741.
[I 2026-04-22 16:10:34,955] Trial 88 finished with value: 0.16406381371583106 and parameters: {'alpha': 73781.70820046609, 'use_snp_selection': False, 'weight_scheme': 'top-heavy', 'weight_clip_max': 10.0, 'weight_topheavy_top_frac': 0.3219616136253789, 'weight_topheavy_low': 0.7588513420160746, 'weight_topheavy_high': 5.9941069175356185}. Best is trial 61 with value: 0.1808243734277741.
[I 2026-04-22 16:11:16,858] Trial 89 finished with value: 0.15745301266046585 and parameters: {'alpha': 40108.78798435119, 'use_snp_selection': False, 'weight_scheme': 'uniform', 'weight_clip_max': 10.0}. Best is trial 61 with value: 0.1808243734277741.
[I 2026-04-22 16:12:07,287] Trial 90 finished with value: 0.17789668599824676 and parameters: {'alpha': 296894.12846949697, 'use_snp_selection': False, 'weight_scheme': 'minmax', 'weight_clip_max': 10.0, 'weight_minmax_eps': 0.026904486816365144}. Best is trial 61 with value: 0.1808243734277741.
[I 2026-04-22 16:12:57,670] Trial 91 finished with value: 0.18005803870604692 and parameters: {'alpha': 639259.4828705767, 'use_snp_selection': False, 'weight_scheme': 'minmax', 'weight_clip_max': 10.0, 'weight_minmax_eps': 0.04813817449157859}. Best is trial 61 with value: 0.1808243734277741.
[I 2026-04-22 16:13:48,061] Trial 92 finished with value: 0.1799188357655635 and parameters: {'alpha': 527074.9212085434, 'use_snp_selection': False, 'weight_scheme': 'minmax', 'weight_clip_max': 10.0, 'weight_minmax_eps': 0.035190518393150017}. Best is trial 61 with value: 0.1808243734277741.
[I 2026-04-22 16:14:38,446] Trial 93 finished with value: 0.17921626461548712 and parameters: {'alpha': 1249282.4697396571, 'use_snp_selection': False, 'weight_scheme': 'minmax', 'weight_clip_max': 10.0, 'weight_minmax_eps': 0.03889164086245602}. Best is trial 61 with value: 0.1808243734277741.
[I 2026-04-22 16:15:28,832] Trial 94 finished with value: 0.12890565639015567 and parameters: {'alpha': 477.8912316735791, 'use_snp_selection': False, 'weight_scheme': 'minmax', 'weight_clip_max': 10.0, 'weight_minmax_eps': 0.02051769866522004}. Best is trial 61 with value: 0.1808243734277741.
[I 2026-04-22 16:16:19,214] Trial 95 finished with value: 0.16386633483563834 and parameters: {'alpha': 647968.6990444815, 'use_snp_selection': False, 'weight_scheme': 'exponential', 'weight_clip_max': 10.0, 'weight_exponential_beta': 0.2422944879924005}. Best is trial 61 with value: 0.1808243734277741.
[I 2026-04-22 16:17:09,583] Trial 96 finished with value: 0.17660863840034516 and parameters: {'alpha': 1840288.8986586742, 'use_snp_selection': False, 'weight_scheme': 'minmax', 'weight_clip_max': 10.0, 'weight_minmax_eps': 0.06740198441449372}. Best is trial 61 with value: 0.1808243734277741.
[I 2026-04-22 16:17:59,999] Trial 97 finished with value: 0.17881923703708277 and parameters: {'alpha': 363627.79833193426, 'use_snp_selection': False, 'weight_scheme': 'minmax', 'weight_clip_max': 10.0, 'weight_minmax_eps': 0.03075534060172839}. Best is trial 61 with value: 0.1808243734277741.
[I 2026-04-22 16:18:50,366] Trial 98 finished with value: 0.17196195887808052 and parameters: {'alpha': 125646.93647767996, 'use_snp_selection': False, 'weight_scheme': 'minmax', 'weight_clip_max': 10.0, 'weight_minmax_eps': 0.008980305189928898}. Best is trial 61 with value: 0.1808243734277741.
[I 2026-04-22 16:19:40,751] Trial 99 finished with value: 0.18009509058789624 and parameters: {'alpha': 731911.4995800939, 'use_snp_selection': False, 'weight_scheme': 'minmax', 'weight_clip_max': 10.0, 'weight_minmax_eps': 0.04630995131259588}. Best is trial 61 with value: 0.1808243734277741.
