[I 2026-04-24 16:09:14,525] Trial 55 finished with value: 0.18828431611787014 and parameters: {'alpha': 347258.0045305113, 'use_snp_selection': False, 'iw_method': 'pc_logistic', 'iw_clip_max': 2.0, 'iw_prob_clip': 0.012146714602933845, 'iw_n_components': 3, 'iw_logistic_c': 1.7915317239226615e-05, 'iw_pca_fit': 'source', 'iw_solver': 'lbfgs', 'iw_rho': 0.5}. Best is trial 14 with value: 0.19186546426289391.
[I 2026-04-24 16:12:51,487] Trial 56 finished with value: 0.18224857710350104 and parameters: {'alpha': 55983.80543571111, 'use_snp_selection': False, 'iw_method': 'pc_logistic', 'iw_clip_max': 3.0, 'iw_prob_clip': 0.017504755018018063, 'iw_n_components': 1, 'iw_logistic_c': 0.0031528396910177974, 'iw_pca_fit': 'combined', 'iw_solver': 'lbfgs', 'iw_rho': 1.0}. Best is trial 14 with value: 0.19186546426289391.
[I 2026-04-24 16:16:22,560] Trial 57 finished with value: 0.18752545717600735 and parameters: {'alpha': 127327.90265523473, 'use_snp_selection': False, 'iw_method': 'pc_logistic', 'iw_clip_max': 10.0, 'iw_prob_clip': 0.015333859273809192, 'iw_n_components': 5, 'iw_logistic_c': 0.0002557967724755427, 'iw_pca_fit': 'source', 'iw_solver': 'lbfgs', 'iw_rho': 0.75}. Best is trial 14 with value: 0.19186546426289391.
[I 2026-04-24 16:20:06,809] Trial 58 finished with value: 0.167194773156227 and parameters: {'alpha': 22889.39798507603, 'use_snp_selection': False, 'iw_method': 'pc_logistic', 'iw_clip_max': 3.0, 'iw_prob_clip': 0.010166518070429746, 'iw_n_components': 2, 'iw_logistic_c': 0.00011648307162536112, 'iw_pca_fit': 'combined', 'iw_solver': 'lbfgs', 'iw_rho': 0.1}. Best is trial 14 with value: 0.19186546426289391.
[I 2026-04-24 16:24:34,238] Trial 59 finished with value: 0.17713832642444155 and parameters: {'alpha': 1915463.5322874438, 'use_snp_selection': False, 'iw_method': 'pc_logistic', 'iw_clip_max': 5.0, 'iw_prob_clip': 0.01354988525878916, 'iw_n_components': 20, 'iw_logistic_c': 4.901625331548906e-05, 'iw_pca_fit': 'combined', 'iw_solver': 'lbfgs', 'iw_rho': 0.25}. Best is trial 14 with value: 0.19186546426289391.
[I 2026-04-24 16:27:57,440] Trial 60 finished with value: 0.18142743427990238 and parameters: {'alpha': 773809.3342068789, 'use_snp_selection': False, 'iw_method': 'pc_logistic', 'iw_clip_max': 3.0, 'iw_prob_clip': 0.008125711753156338, 'iw_n_components': 1, 'iw_logistic_c': 0.9323845578848166, 'iw_pca_fit': 'source', 'iw_solver': 'lbfgs', 'iw_rho': 1.0}. Best is trial 14 with value: 0.19186546426289391.
[I 2026-04-24 16:31:28,512] Trial 61 finished with value: 0.19008800913275894 and parameters: {'alpha': 183479.80689988533, 'use_snp_selection': False, 'iw_method': 'pc_logistic', 'iw_clip_max': 3.0, 'iw_prob_clip': 0.010893662938940434, 'iw_n_components': 1, 'iw_logistic_c': 1.5635382026967747e-05, 'iw_pca_fit': 'source', 'iw_solver': 'lbfgs', 'iw_rho': 0.75}. Best is trial 14 with value: 0.19186546426289391.
[I 2026-04-24 16:34:53,164] Trial 62 finished with value: 0.1900576973372057 and parameters: {'alpha': 228749.27339282935, 'use_snp_selection': False, 'iw_method': 'pc_logistic', 'iw_clip_max': 3.0, 'iw_prob_clip': 0.011113413555502723, 'iw_n_components': 1, 'iw_logistic_c': 2.414476687648327e-05, 'iw_pca_fit': 'source', 'iw_solver': 'lbfgs', 'iw_rho': 0.75}. Best is trial 14 with value: 0.19186546426289391.
[I 2026-04-24 16:38:24,766] Trial 63 finished with value: 0.1304996895390121 and parameters: {'alpha': 518.7983348507602, 'use_snp_selection': False, 'iw_method': 'pc_logistic', 'iw_clip_max': 3.0, 'iw_prob_clip': 0.009509452948856233, 'iw_n_components': 1, 'iw_logistic_c': 2.4534010451642917e-05, 'iw_pca_fit': 'source', 'iw_solver': 'lbfgs', 'iw_rho': 0.75}. Best is trial 14 with value: 0.19186546426289391.
[I 2026-04-24 16:42:01,243] Trial 64 finished with value: 0.19000404428229828 and parameters: {'alpha': 240220.2443488597, 'use_snp_selection': False, 'iw_method': 'pc_logistic', 'iw_clip_max': 3.0, 'iw_prob_clip': 0.010932819192792364, 'iw_n_components': 1, 'iw_logistic_c': 6.157011961273264e-05, 'iw_pca_fit': 'source', 'iw_solver': 'lbfgs', 'iw_rho': 0.75}. Best is trial 14 with value: 0.19186546426289391.
[I 2026-04-24 16:45:46,469] Trial 65 finished with value: 0.17688568020045956 and parameters: {'alpha': 38925.06597856236, 'use_snp_selection': False, 'iw_method': 'pc_logistic', 'iw_clip_max': 10.0, 'iw_prob_clip': 0.011018559394323101, 'iw_n_components': 5, 'iw_logistic_c': 6.194952860414071e-05, 'iw_pca_fit': 'source', 'iw_solver': 'lbfgs', 'iw_rho': 0.75}. Best is trial 14 with value: 0.19186546426289391.
[I 2026-04-24 16:49:15,503] Trial 66 finished with value: 0.18880691646668504 and parameters: {'alpha': 99254.21223999739, 'use_snp_selection': False, 'iw_method': 'pc_logistic', 'iw_clip_max': 3.0, 'iw_prob_clip': 0.010448624186416622, 'iw_n_components': 1, 'iw_logistic_c': 2.9996256974590545e-05, 'iw_pca_fit': 'combined', 'iw_solver': 'lbfgs', 'iw_rho': 0.5}. Best is trial 14 with value: 0.19186546426289391.
[I 2026-04-24 16:52:36,853] Trial 67 finished with value: 0.18755304738273132 and parameters: {'alpha': 342793.3576580041, 'use_snp_selection': False, 'iw_method': 'pc_logistic', 'iw_clip_max': 20.0, 'iw_prob_clip': 0.011562949779657916, 'iw_n_components': 1, 'iw_logistic_c': 0.00010043397221100207, 'iw_pca_fit': 'source', 'iw_solver': 'lbfgs', 'iw_rho': 0.75}. Best is trial 14 with value: 0.19186546426289391.
[I 2026-04-24 16:56:38,559] Trial 68 finished with value: 0.18353673047629437 and parameters: {'alpha': 60625.47318061147, 'use_snp_selection': False, 'iw_method': 'pc_logistic', 'iw_clip_max': 3.0, 'iw_prob_clip': 0.009766123464529184, 'iw_n_components': 5, 'iw_logistic_c': 0.0005289259690887301, 'iw_pca_fit': 'combined', 'iw_solver': 'lbfgs', 'iw_rho': 1.0}. Best is trial 14 with value: 0.19186546426289391.
[I 2026-04-24 16:58:30,429] Trial 69 finished with value: 0.1768713678183697 and parameters: {'alpha': 1014468.8849004043, 'use_snp_selection': True, 'num_snps': 36924, 'iw_method': 'uniform', 'iw_clip_max': 2.0, 'iw_prob_clip': 0.00900529962124352}. Best is trial 14 with value: 0.19186546426289391.
[I 2026-04-24 17:02:00,658] Trial 70 finished with value: 0.18382085708511456 and parameters: {'alpha': 478136.85216439434, 'use_snp_selection': False, 'iw_method': 'pc_logistic', 'iw_clip_max': 3.0, 'iw_prob_clip': 0.045171003501616375, 'iw_n_components': 1, 'iw_logistic_c': 4.086901242072085e-05, 'iw_pca_fit': 'source', 'iw_solver': 'lbfgs', 'iw_rho': 0.75}. Best is trial 14 with value: 0.19186546426289391.
[I 2026-04-24 17:05:21,831] Trial 71 finished with value: 0.1900457016696637 and parameters: {'alpha': 192868.09377944667, 'use_snp_selection': False, 'iw_method': 'pc_logistic', 'iw_clip_max': 3.0, 'iw_prob_clip': 0.01254186160119856, 'iw_n_components': 1, 'iw_logistic_c': 1.749977221737043e-05, 'iw_pca_fit': 'source', 'iw_solver': 'lbfgs', 'iw_rho': 0.75}. Best is trial 14 with value: 0.19186546426289391.
[I 2026-04-24 17:08:47,403] Trial 72 finished with value: 0.1900791201751286 and parameters: {'alpha': 189313.87482836022, 'use_snp_selection': False, 'iw_method': 'pc_logistic', 'iw_clip_max': 3.0, 'iw_prob_clip': 0.01220321004435383, 'iw_n_components': 1, 'iw_logistic_c': 1.8391394696828447e-05, 'iw_pca_fit': 'source', 'iw_solver': 'lbfgs', 'iw_rho': 0.75}. Best is trial 14 with value: 0.19186546426289391.
[I 2026-04-24 17:12:15,013] Trial 73 finished with value: 0.18870908052682955 and parameters: {'alpha': 114157.76172613354, 'use_snp_selection': False, 'iw_method': 'pc_logistic', 'iw_clip_max': 3.0, 'iw_prob_clip': 0.014337310179476485, 'iw_n_components': 1, 'iw_logistic_c': 1.934141316951213e-05, 'iw_pca_fit': 'source', 'iw_solver': 'lbfgs', 'iw_rho': 0.75}. Best is trial 14 with value: 0.19186546426289391.
[I 2026-04-24 17:15:39,207] Trial 74 finished with value: 0.18773452766939097 and parameters: {'alpha': 296535.5760748873, 'use_snp_selection': False, 'iw_method': 'pc_logistic', 'iw_clip_max': 3.0, 'iw_prob_clip': 0.011633707121690458, 'iw_n_components': 3, 'iw_logistic_c': 6.026057342283597e-05, 'iw_pca_fit': 'source', 'iw_solver': 'lbfgs', 'iw_rho': 0.75}. Best is trial 14 with value: 0.19186546426289391.
[I 2026-04-24 17:19:03,219] Trial 75 finished with value: 0.19030524397728288 and parameters: {'alpha': 171517.33225072018, 'use_snp_selection': False, 'iw_method': 'pc_logistic', 'iw_clip_max': 3.0, 'iw_prob_clip': 0.010728407042983175, 'iw_n_components': 1, 'iw_logistic_c': 3.5973140698893735e-05, 'iw_pca_fit': 'source', 'iw_solver': 'lbfgs', 'iw_rho': 0.75}. Best is trial 14 with value: 0.19186546426289391.
[I 2026-04-24 17:22:37,146] Trial 76 finished with value: 0.17603109691896995 and parameters: {'alpha': 1447189.753516925, 'use_snp_selection': False, 'iw_method': 'pc_logistic', 'iw_clip_max': 3.0, 'iw_prob_clip': 0.01067201475895384, 'iw_n_components': 1, 'iw_logistic_c': 0.00020610870659095164, 'iw_pca_fit': 'source', 'iw_solver': 'lbfgs', 'iw_rho': 0.75}. Best is trial 14 with value: 0.19186546426289391.
[I 2026-04-24 17:26:13,255] Trial 77 finished with value: 0.18819231363912026 and parameters: {'alpha': 195235.88854501722, 'use_snp_selection': False, 'iw_method': 'pc_logistic', 'iw_clip_max': 10.0, 'iw_prob_clip': 0.007793118848012332, 'iw_n_components': 2, 'iw_logistic_c': 3.342503115205491e-05, 'iw_pca_fit': 'source', 'iw_solver': 'lbfgs', 'iw_rho': 0.75}. Best is trial 14 with value: 0.19186546426289391.
[I 2026-04-24 17:29:54,977] Trial 78 finished with value: 0.17999893946324694 and parameters: {'alpha': 43427.38491734552, 'use_snp_selection': False, 'iw_method': 'pc_logistic', 'iw_clip_max': 3.0, 'iw_prob_clip': 0.008552539046025175, 'iw_n_components': 1, 'iw_logistic_c': 0.02749768672828817, 'iw_pca_fit': 'combined', 'iw_solver': 'lbfgs', 'iw_rho': 0.75}. Best is trial 14 with value: 0.19186546426289391.
[I 2026-04-24 17:33:14,497] Trial 79 finished with value: 0.18116317702804569 and parameters: {'alpha': 65201.79501936341, 'use_snp_selection': False, 'iw_method': 'pc_logistic', 'iw_clip_max': 5.0, 'iw_prob_clip': 0.009955847121815936, 'iw_n_components': 1, 'iw_logistic_c': 1.7163274555599557e-05, 'iw_pca_fit': 'source', 'iw_solver': 'lbfgs', 'iw_rho': 0.25}. Best is trial 14 with value: 0.19186546426289391.
[I 2026-04-24 17:37:25,540] Trial 80 finished with value: 0.1821447032462527 and parameters: {'alpha': 702040.6526909079, 'use_snp_selection': False, 'iw_method': 'pc_logistic', 'iw_clip_max': 3.0, 'iw_prob_clip': 0.012716320839988646, 'iw_n_components': 20, 'iw_logistic_c': 0.015105405897510938, 'iw_pca_fit': 'source', 'iw_solver': 'lbfgs', 'iw_rho': 0.1}. Best is trial 14 with value: 0.19186546426289391.
[I 2026-04-24 17:40:50,372] Trial 81 finished with value: 0.18986204954855826 and parameters: {'alpha': 153487.9097300401, 'use_snp_selection': False, 'iw_method': 'pc_logistic', 'iw_clip_max': 3.0, 'iw_prob_clip': 0.013916739896440497, 'iw_n_components': 1, 'iw_logistic_c': 2.6334451396219176e-05, 'iw_pca_fit': 'source', 'iw_solver': 'lbfgs', 'iw_rho': 0.75}. Best is trial 14 with value: 0.19186546426289391.
[I 2026-04-24 17:44:12,240] Trial 82 finished with value: 0.18723483763477936 and parameters: {'alpha': 418452.65729421703, 'use_snp_selection': False, 'iw_method': 'pc_logistic', 'iw_clip_max': 3.0, 'iw_prob_clip': 0.011768135179120143, 'iw_n_components': 1, 'iw_logistic_c': 6.628608815679825e-05, 'iw_pca_fit': 'source', 'iw_solver': 'lbfgs', 'iw_rho': 0.75}. Best is trial 14 with value: 0.19186546426289391.
[I 2026-04-24 17:47:30,068] Trial 83 finished with value: 0.18894894757615394 and parameters: {'alpha': 118663.76128622178, 'use_snp_selection': False, 'iw_method': 'pc_logistic', 'iw_clip_max': 3.0, 'iw_prob_clip': 0.015125116028366097, 'iw_n_components': 1, 'iw_logistic_c': 0.0010445410696920778, 'iw_pca_fit': 'source', 'iw_solver': 'lbfgs', 'iw_rho': 0.75}. Best is trial 14 with value: 0.19186546426289391.
[I 2026-04-24 17:50:49,260] Trial 84 finished with value: 0.1790210722720194 and parameters: {'alpha': 32931.327432168095, 'use_snp_selection': False, 'iw_method': 'pc_logistic', 'iw_clip_max': 3.0, 'iw_prob_clip': 0.01098529402074903, 'iw_n_components': 1, 'iw_logistic_c': 4.4071685477185246e-05, 'iw_pca_fit': 'source', 'iw_solver': 'lbfgs', 'iw_rho': 1.0}. Best is trial 14 with value: 0.19186546426289391.
[I 2026-04-24 17:55:00,590] Trial 85 finished with value: 0.18704673962786764 and parameters: {'alpha': 84641.10230289033, 'use_snp_selection': False, 'iw_method': 'pc_logistic', 'iw_clip_max': 20.0, 'iw_prob_clip': 0.012446651003918176, 'iw_n_components': 10, 'iw_logistic_c': 1.490953773338071e-05, 'iw_pca_fit': 'combined', 'iw_solver': 'lbfgs', 'iw_rho': 0.75}. Best is trial 14 with value: 0.19186546426289391.
[I 2026-04-24 17:56:33,538] Trial 86 finished with value: 0.17602357833818633 and parameters: {'alpha': 290001.28311938344, 'use_snp_selection': True, 'num_snps': 23403, 'iw_method': 'uniform', 'iw_clip_max': 3.0, 'iw_prob_clip': 0.009444625560518886}. Best is trial 14 with value: 0.19186546426289391.
[I 2026-04-24 18:00:07,921] Trial 87 finished with value: 0.18856922085196903 and parameters: {'alpha': 171055.02764365036, 'use_snp_selection': False, 'iw_method': 'pc_logistic', 'iw_clip_max': 10.0, 'iw_prob_clip': 0.011157002876458053, 'iw_n_components': 5, 'iw_logistic_c': 0.00015490648796488167, 'iw_pca_fit': 'source', 'iw_solver': 'lbfgs', 'iw_rho': 0.75}. Best is trial 14 with value: 0.19186546426289391.
[I 2026-04-24 18:03:34,862] Trial 88 finished with value: 0.1858906586904429 and parameters: {'alpha': 484059.4943776929, 'use_snp_selection': False, 'iw_method': 'pc_logistic', 'iw_clip_max': 3.0, 'iw_prob_clip': 0.010391912162207606, 'iw_n_components': 1, 'iw_logistic_c': 2.218795860952463e-05, 'iw_pca_fit': 'source', 'iw_solver': 'lbfgs', 'iw_rho': 0.5}. Best is trial 14 with value: 0.19186546426289391.
[I 2026-04-24 18:07:23,482] Trial 89 finished with value: 0.18849972927264497 and parameters: {'alpha': 210612.53348521504, 'use_snp_selection': False, 'iw_method': 'pc_logistic', 'iw_clip_max': 2.0, 'iw_prob_clip': 0.03585277363052596, 'iw_n_components': 1, 'iw_logistic_c': 0.04800788253117451, 'iw_pca_fit': 'combined', 'iw_solver': 'lbfgs', 'iw_rho': 0.75}. Best is trial 14 with value: 0.19186546426289391.
[I 2026-04-24 18:10:54,559] Trial 90 finished with value: 0.15970145863225219 and parameters: {'alpha': 11811.85990325194, 'use_snp_selection': False, 'iw_method': 'pc_logistic', 'iw_clip_max': 3.0, 'iw_prob_clip': 0.012687737816766685, 'iw_n_components': 1, 'iw_logistic_c': 1.4174921347310952e-05, 'iw_pca_fit': 'source', 'iw_solver': 'lbfgs', 'iw_rho': 0.75}. Best is trial 14 with value: 0.19186546426289391.
[I 2026-04-24 18:14:27,109] Trial 91 finished with value: 0.18969359638931302 and parameters: {'alpha': 250547.04069052121, 'use_snp_selection': False, 'iw_method': 'pc_logistic', 'iw_clip_max': 3.0, 'iw_prob_clip': 0.013738255152941553, 'iw_n_components': 1, 'iw_logistic_c': 3.382487205310076e-05, 'iw_pca_fit': 'source', 'iw_solver': 'lbfgs', 'iw_rho': 0.75}. Best is trial 14 with value: 0.19186546426289391.
[I 2026-04-24 18:18:01,433] Trial 92 finished with value: 0.1896857615580053 and parameters: {'alpha': 152326.86188222427, 'use_snp_selection': False, 'iw_method': 'pc_logistic', 'iw_clip_max': 3.0, 'iw_prob_clip': 0.012440246093014836, 'iw_n_components': 1, 'iw_logistic_c': 1.34713288548961e-05, 'iw_pca_fit': 'source', 'iw_solver': 'lbfgs', 'iw_rho': 0.75}. Best is trial 14 with value: 0.19186546426289391.
[I 2026-04-24 18:21:29,518] Trial 93 finished with value: 0.18833428920645134 and parameters: {'alpha': 363413.3667206843, 'use_snp_selection': False, 'iw_method': 'pc_logistic', 'iw_clip_max': 3.0, 'iw_prob_clip': 0.011330402340591206, 'iw_n_components': 1, 'iw_logistic_c': 2.3964871252075672e-05, 'iw_pca_fit': 'source', 'iw_solver': 'lbfgs', 'iw_rho': 0.75}. Best is trial 14 with value: 0.19186546426289391.
[I 2026-04-24 18:24:57,504] Trial 94 finished with value: 0.18572214986928587 and parameters: {'alpha': 76788.15186149439, 'use_snp_selection': False, 'iw_method': 'pc_logistic', 'iw_clip_max': 3.0, 'iw_prob_clip': 0.014755672467872379, 'iw_n_components': 1, 'iw_logistic_c': 1.339465317718793e-05, 'iw_pca_fit': 'source', 'iw_solver': 'lbfgs', 'iw_rho': 0.75}. Best is trial 14 with value: 0.19186546426289391.
[I 2026-04-24 18:28:31,663] Trial 95 finished with value: 0.1866775466797582 and parameters: {'alpha': 117587.20314533988, 'use_snp_selection': False, 'iw_method': 'pc_logistic', 'iw_clip_max': 3.0, 'iw_prob_clip': 0.01184173234827962, 'iw_n_components': 3, 'iw_logistic_c': 8.237457614326699e-05, 'iw_pca_fit': 'source', 'iw_solver': 'lbfgs', 'iw_rho': 1.0}. Best is trial 14 with value: 0.19186546426289391.
[I 2026-04-24 18:31:59,481] Trial 96 finished with value: 0.18443419776852218 and parameters: {'alpha': 583902.8731847397, 'use_snp_selection': False, 'iw_method': 'pc_logistic', 'iw_clip_max': 3.0, 'iw_prob_clip': 0.01675559639416726, 'iw_n_components': 1, 'iw_logistic_c': 4.195684633253157e-05, 'iw_pca_fit': 'source', 'iw_solver': 'lbfgs', 'iw_rho': 0.75}. Best is trial 14 with value: 0.19186546426289391.
[I 2026-04-24 18:35:53,192] Trial 97 finished with value: 0.1948226079180827 and parameters: {'alpha': 202244.53801500835, 'use_snp_selection': False, 'iw_method': 'pc_logistic', 'iw_clip_max': 10.0, 'iw_prob_clip': 0.013151920146978085, 'iw_n_components': 5, 'iw_logistic_c': 2.018669300840027e-05, 'iw_pca_fit': 'combined', 'iw_solver': 'lbfgs', 'iw_rho': 0.75}. Best is trial 97 with value: 0.1948226079180827.
[I 2026-04-24 18:41:16,633] Trial 98 finished with value: 0.1829919743983308 and parameters: {'alpha': 869784.644383499, 'use_snp_selection': True, 'num_snps': 48304, 'iw_method': 'pc_logistic', 'iw_clip_max': 10.0, 'iw_prob_clip': 0.013275485663976174, 'iw_n_components': 5, 'iw_logistic_c': 0.00011871622672801244, 'iw_pca_fit': 'combined', 'iw_solver': 'lbfgs', 'iw_rho': 0.75}. Best is trial 97 with value: 0.1948226079180827.
[I 2026-04-24 18:42:03,579] Trial 99 finished with value: 0.1775473442993071 and parameters: {'alpha': 53232.183135816274, 'use_snp_selection': False, 'iw_method': 'uniform', 'iw_clip_max': 10.0, 'iw_prob_clip': 0.010601882360810016}. Best is trial 97 with value: 0.1948226079180827.
