[I 2026-04-30 01:14:35,492] Trial 112 finished with value: 0.21456085787294477 and parameters: {'alpha': 397132.8729008385, 'use_snp_selection': False, 'iw_method': 'pc_logistic', 'iw_clip_max': 1.5, 'iw_prob_clip': 0.0025032132833916368, 'iw_n_components': 40, 'iw_logistic_c': 0.9917541590524211, 'iw_pca_fit': 'combined', 'iw_solver': 'lbfgs', 'iw_rho': 0.5}. Best is trial 83 with value: 0.21780754985550677.
[I 2026-04-30 01:18:25,643] Trial 113 finished with value: 0.21440713920647672 and parameters: {'alpha': 352099.2155098651, 'use_snp_selection': False, 'iw_method': 'pc_logistic', 'iw_clip_max': 1.5, 'iw_prob_clip': 0.002094288209010102, 'iw_n_components': 40, 'iw_logistic_c': 9.922562073710457, 'iw_pca_fit': 'combined', 'iw_solver': 'lbfgs', 'iw_rho': 0.5}. Best is trial 83 with value: 0.21780754985550677.
[I 2026-04-30 01:22:14,253] Trial 114 finished with value: 0.21446271850426948 and parameters: {'alpha': 383984.94782132586, 'use_snp_selection': False, 'iw_method': 'pc_logistic', 'iw_clip_max': 1.5, 'iw_prob_clip': 0.003123905789180531, 'iw_n_components': 40, 'iw_logistic_c': 0.23386565599917708, 'iw_pca_fit': 'combined', 'iw_solver': 'lbfgs', 'iw_rho': 0.5}. Best is trial 83 with value: 0.21780754985550677.
[I 2026-04-30 01:26:05,648] Trial 115 finished with value: 0.21535157134268465 and parameters: {'alpha': 335993.28812441777, 'use_snp_selection': False, 'iw_method': 'pc_logistic', 'iw_clip_max': 1.5, 'iw_prob_clip': 0.0017119774651025018, 'iw_n_components': 40, 'iw_logistic_c': 0.7077299207365303, 'iw_pca_fit': 'combined', 'iw_solver': 'lbfgs', 'iw_rho': 0.5}. Best is trial 83 with value: 0.21780754985550677.
[I 2026-04-30 01:29:56,258] Trial 116 finished with value: 0.21355754874407826 and parameters: {'alpha': 483139.60887915635, 'use_snp_selection': False, 'iw_method': 'pc_logistic', 'iw_clip_max': 1.5, 'iw_prob_clip': 0.0024327600629953368, 'iw_n_components': 40, 'iw_logistic_c': 0.45496043675254716, 'iw_pca_fit': 'combined', 'iw_solver': 'lbfgs', 'iw_rho': 0.5}. Best is trial 83 with value: 0.21780754985550677.
[I 2026-04-30 01:33:06,678] Trial 117 finished with value: 0.2088830638913525 and parameters: {'alpha': 256635.91999745715, 'use_snp_selection': False, 'iw_method': 'pc_logistic', 'iw_clip_max': 1.5, 'iw_prob_clip': 0.002037610659214463, 'iw_n_components': 5, 'iw_logistic_c': 0.168797121623519, 'iw_pca_fit': 'combined', 'iw_solver': 'lbfgs', 'iw_rho': 0.5}. Best is trial 83 with value: 0.21780754985550677.
[I 2026-04-30 01:36:48,222] Trial 118 finished with value: 0.1971138833963014 and parameters: {'alpha': 429175.1061814605, 'use_snp_selection': False, 'iw_method': 'pc_logistic', 'iw_clip_max': 5.0, 'iw_prob_clip': 0.0018177500894882134, 'iw_n_components': 30, 'iw_logistic_c': 0.11874784451596239, 'iw_pca_fit': 'combined', 'iw_solver': 'lbfgs', 'iw_rho': 0.5}. Best is trial 83 with value: 0.21780754985550677.
[I 2026-04-30 01:40:36,710] Trial 119 finished with value: 0.214993607207593 and parameters: {'alpha': 364668.80222270836, 'use_snp_selection': False, 'iw_method': 'pc_logistic', 'iw_clip_max': 1.5, 'iw_prob_clip': 0.002688496325720476, 'iw_n_components': 40, 'iw_logistic_c': 0.29214841279546533, 'iw_pca_fit': 'combined', 'iw_solver': 'lbfgs', 'iw_rho': 0.5}. Best is trial 83 with value: 0.21780754985550677.
[I 2026-04-30 01:41:13,182] Trial 120 finished with value: 0.21044892784622804 and parameters: {'alpha': 316415.1121231412, 'use_snp_selection': False, 'iw_method': 'uniform'}. Best is trial 83 with value: 0.21780754985550677.
[I 2026-04-30 01:45:01,653] Trial 121 finished with value: 0.21353795672096085 and parameters: {'alpha': 394467.4246408188, 'use_snp_selection': False, 'iw_method': 'pc_logistic', 'iw_clip_max': 1.5, 'iw_prob_clip': 0.003619401449615454, 'iw_n_components': 40, 'iw_logistic_c': 3.872224111070392, 'iw_pca_fit': 'combined', 'iw_solver': 'lbfgs', 'iw_rho': 0.5}. Best is trial 83 with value: 0.21780754985550677.
[I 2026-04-30 01:48:54,407] Trial 122 finished with value: 0.21519212615072275 and parameters: {'alpha': 458081.3554095723, 'use_snp_selection': False, 'iw_method': 'pc_logistic', 'iw_clip_max': 1.5, 'iw_prob_clip': 0.0019117050806314382, 'iw_n_components': 40, 'iw_logistic_c': 1.6609329213073798, 'iw_pca_fit': 'combined', 'iw_solver': 'lbfgs', 'iw_rho': 0.5}. Best is trial 83 with value: 0.21780754985550677.
[I 2026-04-30 01:52:44,874] Trial 123 finished with value: 0.21529905193876084 and parameters: {'alpha': 419996.5246350302, 'use_snp_selection': False, 'iw_method': 'pc_logistic', 'iw_clip_max': 1.5, 'iw_prob_clip': 0.001646356754844713, 'iw_n_components': 40, 'iw_logistic_c': 0.8507554858726594, 'iw_pca_fit': 'combined', 'iw_solver': 'lbfgs', 'iw_rho': 0.5}. Best is trial 83 with value: 0.21780754985550677.
[I 2026-04-30 01:56:33,424] Trial 124 finished with value: 0.21614778431275478 and parameters: {'alpha': 368912.3983306309, 'use_snp_selection': False, 'iw_method': 'pc_logistic', 'iw_clip_max': 1.5, 'iw_prob_clip': 0.0023673109695435558, 'iw_n_components': 40, 'iw_logistic_c': 0.08198812103828834, 'iw_pca_fit': 'combined', 'iw_solver': 'lbfgs', 'iw_rho': 0.5}. Best is trial 83 with value: 0.21780754985550677.
[I 2026-04-30 01:59:30,334] Trial 125 finished with value: 0.2082100130485116 and parameters: {'alpha': 345519.3753946554, 'use_snp_selection': False, 'iw_method': 'pc_logistic', 'iw_clip_max': 1.5, 'iw_prob_clip': 0.002209403142651598, 'iw_n_components': 1, 'iw_logistic_c': 0.046216848463215054, 'iw_pca_fit': 'combined', 'iw_solver': 'lbfgs', 'iw_rho': 0.5}. Best is trial 83 with value: 0.21780754985550677.
[I 2026-04-30 02:03:21,030] Trial 126 finished with value: 0.2162582673632901 and parameters: {'alpha': 374864.4767116789, 'use_snp_selection': False, 'iw_method': 'pc_logistic', 'iw_clip_max': 1.5, 'iw_prob_clip': 0.004183287645160607, 'iw_n_components': 40, 'iw_logistic_c': 0.08385829139956208, 'iw_pca_fit': 'combined', 'iw_solver': 'lbfgs', 'iw_rho': 0.5}. Best is trial 83 with value: 0.21780754985550677.
[I 2026-04-30 02:07:10,167] Trial 127 finished with value: 0.19892407876271817 and parameters: {'alpha': 323757.0747782548, 'use_snp_selection': False, 'iw_method': 'pc_logistic', 'iw_clip_max': 1.5, 'iw_prob_clip': 0.004694652495472375, 'iw_n_components': 40, 'iw_logistic_c': 0.08693277176682367, 'iw_pca_fit': 'combined', 'iw_solver': 'lbfgs', 'iw_rho': 1.0}. Best is trial 83 with value: 0.21780754985550677.
[I 2026-04-30 02:10:39,209] Trial 128 finished with value: 0.21229269169003967 and parameters: {'alpha': 284862.3769229657, 'use_snp_selection': False, 'iw_method': 'pc_logistic', 'iw_clip_max': 1.5, 'iw_prob_clip': 0.004237066599637378, 'iw_n_components': 10, 'iw_logistic_c': 0.0669657150827702, 'iw_pca_fit': 'combined', 'iw_solver': 'lbfgs', 'iw_rho': 0.5}. Best is trial 83 with value: 0.21780754985550677.
[I 2026-04-30 02:14:28,844] Trial 129 finished with value: 0.2114334593399004 and parameters: {'alpha': 371225.3960250091, 'use_snp_selection': False, 'iw_method': 'pc_logistic', 'iw_clip_max': 2.0, 'iw_prob_clip': 0.002958831308307461, 'iw_n_components': 40, 'iw_logistic_c': 0.5139021566368812, 'iw_pca_fit': 'combined', 'iw_solver': 'lbfgs', 'iw_rho': 0.5}. Best is trial 83 with value: 0.21780754985550677.
[I 2026-04-30 02:18:21,884] Trial 130 finished with value: 0.2142893805439973 and parameters: {'alpha': 394593.46425323613, 'use_snp_selection': False, 'iw_method': 'pc_logistic', 'iw_clip_max': 1.5, 'iw_prob_clip': 0.005838611178261823, 'iw_n_components': 40, 'iw_logistic_c': 0.1206833216915947, 'iw_pca_fit': 'combined', 'iw_solver': 'lbfgs', 'iw_rho': 0.9}. Best is trial 83 with value: 0.21780754985550677.
[I 2026-04-30 02:22:13,735] Trial 131 finished with value: 0.21358212548638847 and parameters: {'alpha': 441238.6796993246, 'use_snp_selection': False, 'iw_method': 'pc_logistic', 'iw_clip_max': 1.5, 'iw_prob_clip': 0.0024437723977670392, 'iw_n_components': 40, 'iw_logistic_c': 0.19678314145999823, 'iw_pca_fit': 'combined', 'iw_solver': 'lbfgs', 'iw_rho': 0.5}. Best is trial 83 with value: 0.21780754985550677.
[I 2026-04-30 02:26:04,157] Trial 132 finished with value: 0.21610773246558504 and parameters: {'alpha': 354931.76863759325, 'use_snp_selection': False, 'iw_method': 'pc_logistic', 'iw_clip_max': 1.5, 'iw_prob_clip': 0.0038695624186239046, 'iw_n_components': 40, 'iw_logistic_c': 0.033949641783669694, 'iw_pca_fit': 'combined', 'iw_solver': 'lbfgs', 'iw_rho': 0.5}. Best is trial 83 with value: 0.21780754985550677.
[I 2026-04-30 02:29:54,865] Trial 133 finished with value: 0.21513567929062188 and parameters: {'alpha': 301962.1854283163, 'use_snp_selection': False, 'iw_method': 'pc_logistic', 'iw_clip_max': 1.5, 'iw_prob_clip': 0.008798188237752818, 'iw_n_components': 40, 'iw_logistic_c': 0.04700410769015241, 'iw_pca_fit': 'combined', 'iw_solver': 'lbfgs', 'iw_rho': 0.5}. Best is trial 83 with value: 0.21780754985550677.
[I 2026-04-30 02:33:41,028] Trial 134 finished with value: 0.2141799841519207 and parameters: {'alpha': 336300.8676937272, 'use_snp_selection': False, 'iw_method': 'pc_logistic', 'iw_clip_max': 1.5, 'iw_prob_clip': 0.002270967336718244, 'iw_n_components': 40, 'iw_logistic_c': 0.030996030446282425, 'iw_pca_fit': 'combined', 'iw_solver': 'lbfgs', 'iw_rho': 0.5}. Best is trial 83 with value: 0.21780754985550677.
[I 2026-04-30 02:37:33,171] Trial 135 finished with value: 0.21534905915512298 and parameters: {'alpha': 359449.87677489273, 'use_snp_selection': False, 'iw_method': 'pc_logistic', 'iw_clip_max': 1.5, 'iw_prob_clip': 0.003933640892905745, 'iw_n_components': 40, 'iw_logistic_c': 0.01496737791942744, 'iw_pca_fit': 'combined', 'iw_solver': 'lbfgs', 'iw_rho': 0.5}. Best is trial 83 with value: 0.21780754985550677.
[I 2026-04-30 02:41:27,727] Trial 136 finished with value: 0.21391324783617996 and parameters: {'alpha': 406646.50162942655, 'use_snp_selection': False, 'iw_method': 'pc_logistic', 'iw_clip_max': 1.5, 'iw_prob_clip': 0.002767698650255328, 'iw_n_components': 50, 'iw_logistic_c': 0.0900486651273117, 'iw_pca_fit': 'combined', 'iw_solver': 'lbfgs', 'iw_rho': 0.5}. Best is trial 83 with value: 0.21780754985550677.
[I 2026-04-30 02:45:17,240] Trial 137 finished with value: 0.20731119305322002 and parameters: {'alpha': 372792.52936788456, 'use_snp_selection': False, 'iw_method': 'pc_logistic', 'iw_clip_max': 3.0, 'iw_prob_clip': 0.003219933709854742, 'iw_n_components': 40, 'iw_logistic_c': 0.3148077186765016, 'iw_pca_fit': 'combined', 'iw_solver': 'lbfgs', 'iw_rho': 0.5}. Best is trial 83 with value: 0.21780754985550677.
[I 2026-04-30 02:49:09,072] Trial 138 finished with value: 0.21596800176690353 and parameters: {'alpha': 167681.9963990906, 'use_snp_selection': False, 'iw_method': 'pc_logistic', 'iw_clip_max': 1.5, 'iw_prob_clip': 0.001405339068489075, 'iw_n_components': 40, 'iw_logistic_c': 0.0652608748344956, 'iw_pca_fit': 'combined', 'iw_solver': 'lbfgs', 'iw_rho': 0.5}. Best is trial 83 with value: 0.21780754985550677.
[I 2026-04-30 02:52:41,599] Trial 139 finished with value: 0.21124016017184144 and parameters: {'alpha': 331330.9785234836, 'use_snp_selection': False, 'iw_method': 'pc_logistic', 'iw_clip_max': 1.5, 'iw_prob_clip': 0.0012282537155210288, 'iw_n_components': 20, 'iw_logistic_c': 0.02542339312507037, 'iw_pca_fit': 'combined', 'iw_solver': 'lbfgs', 'iw_rho': 0.5}. Best is trial 83 with value: 0.21780754985550677.
[I 2026-04-30 02:56:33,247] Trial 140 finished with value: 0.21241336162429283 and parameters: {'alpha': 490129.79974024463, 'use_snp_selection': False, 'iw_method': 'pc_logistic', 'iw_clip_max': 1.5, 'iw_prob_clip': 0.0038817617438248963, 'iw_n_components': 40, 'iw_logistic_c': 0.03988291335267794, 'iw_pca_fit': 'combined', 'iw_solver': 'lbfgs', 'iw_rho': 0.5}. Best is trial 83 with value: 0.21780754985550677.
[I 2026-04-30 03:00:23,151] Trial 141 finished with value: 0.21431365773323646 and parameters: {'alpha': 158108.86364605877, 'use_snp_selection': False, 'iw_method': 'pc_logistic', 'iw_clip_max': 1.5, 'iw_prob_clip': 0.0013785056196942097, 'iw_n_components': 40, 'iw_logistic_c': 0.06723512675891917, 'iw_pca_fit': 'combined', 'iw_solver': 'lbfgs', 'iw_rho': 0.5}. Best is trial 83 with value: 0.21780754985550677.
[I 2026-04-30 03:04:11,295] Trial 142 finished with value: 0.21143833637642145 and parameters: {'alpha': 105749.73512043392, 'use_snp_selection': False, 'iw_method': 'pc_logistic', 'iw_clip_max': 1.5, 'iw_prob_clip': 0.0010643309903594492, 'iw_n_components': 40, 'iw_logistic_c': 0.1299180519578459, 'iw_pca_fit': 'combined', 'iw_solver': 'lbfgs', 'iw_rho': 0.5}. Best is trial 83 with value: 0.21780754985550677.
[I 2026-04-30 03:08:00,236] Trial 143 finished with value: 0.21249341560669946 and parameters: {'alpha': 141841.4882414702, 'use_snp_selection': False, 'iw_method': 'pc_logistic', 'iw_clip_max': 1.5, 'iw_prob_clip': 0.0014941585014190339, 'iw_n_components': 40, 'iw_logistic_c': 0.2554679114427546, 'iw_pca_fit': 'combined', 'iw_solver': 'lbfgs', 'iw_rho': 0.5}. Best is trial 83 with value: 0.21780754985550677.
[I 2026-04-30 03:11:51,833] Trial 144 finished with value: 0.2157429490172357 and parameters: {'alpha': 177176.9009001607, 'use_snp_selection': False, 'iw_method': 'pc_logistic', 'iw_clip_max': 1.5, 'iw_prob_clip': 0.001991026862049422, 'iw_n_components': 40, 'iw_logistic_c': 0.07051405602870177, 'iw_pca_fit': 'combined', 'iw_solver': 'lbfgs', 'iw_rho': 0.5}. Best is trial 83 with value: 0.21780754985550677.
[I 2026-04-30 03:15:46,553] Trial 145 finished with value: 0.2013517315262364 and parameters: {'alpha': 354059.8355275236, 'use_snp_selection': False, 'iw_method': 'pc_logistic', 'iw_clip_max': 5.0, 'iw_prob_clip': 0.0011901477206484679, 'iw_n_components': 40, 'iw_logistic_c': 0.40884756189637494, 'iw_pca_fit': 'combined', 'iw_solver': 'lbfgs', 'iw_rho': 0.5}. Best is trial 83 with value: 0.21780754985550677.
[I 2026-04-30 03:19:35,904] Trial 146 finished with value: 0.21562232943109247 and parameters: {'alpha': 189601.26994560595, 'use_snp_selection': False, 'iw_method': 'pc_logistic', 'iw_clip_max': 1.5, 'iw_prob_clip': 0.0017446993646467507, 'iw_n_components': 40, 'iw_logistic_c': 0.019126653220509306, 'iw_pca_fit': 'combined', 'iw_solver': 'lbfgs', 'iw_rho': 0.5}. Best is trial 83 with value: 0.21780754985550677.
[I 2026-04-30 03:20:12,477] Trial 147 finished with value: 0.2094439109252732 and parameters: {'alpha': 394746.9049283202, 'use_snp_selection': False, 'iw_method': 'uniform'}. Best is trial 83 with value: 0.21780754985550677.
[I 2026-04-30 03:24:00,804] Trial 148 finished with value: 0.20943333064115577 and parameters: {'alpha': 377258.24164204084, 'use_snp_selection': False, 'iw_method': 'pc_logistic', 'iw_clip_max': 1.5, 'iw_prob_clip': 0.029998465500745093, 'iw_n_components': 40, 'iw_logistic_c': 0.15017357555925037, 'iw_pca_fit': 'combined', 'iw_solver': 'lbfgs', 'iw_rho': 1.0}. Best is trial 83 with value: 0.21780754985550677.
[I 2026-04-30 03:27:09,224] Trial 149 finished with value: 0.20825919505964463 and parameters: {'alpha': 272118.18174029724, 'use_snp_selection': False, 'iw_method': 'pc_logistic', 'iw_clip_max': 1.5, 'iw_prob_clip': 0.0064744078426370874, 'iw_n_components': 5, 'iw_logistic_c': 1.1088486766550427, 'iw_pca_fit': 'combined', 'iw_solver': 'lbfgs', 'iw_rho': 0.5}. Best is trial 83 with value: 0.21780754985550677.
