[I 2026-04-21 19:49:21,492] Trial 11 finished with value: 0.12355896839785159 and parameters: {'hidden_dims': '[256, 128]', 'dropout': 0.5754294922465415, 'batch_norm': False, 'lr': 0.00040305090043403, 'weight_decay': 0.0006508442861563287, 'epochs': 214, 'loss': 'mae', 'optimizer': 'adamw', 'use_snp_selection': True, 'num_snps': 57843, 'weight_scheme': 'minmax', 'weight_clip_max': 5.0, 'weight_minmax_eps': 0.09687781180927992}. Best is trial 6 with value: 0.15606481181215068.
[I 2026-04-21 19:49:39,731] Trial 12 finished with value: 0.10422506387910081 and parameters: {'hidden_dims': '[256, 64]', 'dropout': 0.5756846183148884, 'batch_norm': True, 'lr': 3.7845926154118877e-06, 'weight_decay': 0.0009247869841802029, 'epochs': 226, 'loss': 'mae', 'optimizer': 'adamw', 'use_snp_selection': False, 'weight_scheme': 'minmax', 'weight_clip_max': None, 'weight_minmax_eps': 0.09627310711891753}. Best is trial 6 with value: 0.15606481181215068.
[I 2026-04-21 19:49:57,880] Trial 13 finished with value: 0.1078290067503123 and parameters: {'hidden_dims': '[256, 128]', 'dropout': 0.4109743180873037, 'batch_norm': False, 'lr': 0.00019243083671191828, 'weight_decay': 6.096790772247348e-05, 'epochs': 250, 'loss': 'mae', 'optimizer': 'adam', 'use_snp_selection': True, 'num_snps': 7358, 'weight_scheme': 'top-heavy', 'weight_clip_max': 5.0, 'weight_topheavy_top_frac': 0.48398486394237283, 'weight_topheavy_low': 0.5666436580870186, 'weight_topheavy_high': 5.961546164133656}. Best is trial 6 with value: 0.15606481181215068.
[I 2026-04-21 19:50:13,766] Trial 14 finished with value: 0.18486824431858043 and parameters: {'hidden_dims': '[256, 64]', 'dropout': 0.41996135168270726, 'batch_norm': True, 'lr': 4.7705458014471745e-05, 'weight_decay': 1.9482920075226874e-05, 'epochs': 191, 'loss': 'mae', 'optimizer': 'adamw', 'use_snp_selection': False, 'weight_scheme': 'exponential', 'weight_clip_max': None, 'weight_exponential_beta': 6.512744308642654}. Best is trial 14 with value: 0.18486824431858043.
[I 2026-04-21 19:50:20,235] Trial 15 finished with value: 0.1700792887551786 and parameters: {'hidden_dims': '[256, 64]', 'dropout': 0.4369791033049462, 'batch_norm': True, 'lr': 4.044907397418171e-05, 'weight_decay': 1.23249326220073e-05, 'epochs': 52, 'loss': 'mae', 'optimizer': 'adamw', 'use_snp_selection': False, 'weight_scheme': 'exponential', 'weight_clip_max': None, 'weight_exponential_beta': 7.4589635458449575}. Best is trial 14 with value: 0.18486824431858043.
[I 2026-04-21 19:50:26,775] Trial 16 finished with value: 0.08241104662891652 and parameters: {'hidden_dims': '[256, 64]', 'dropout': 0.4580941350939555, 'batch_norm': True, 'lr': 6.2681182545713725e-06, 'weight_decay': 1.68539783543097e-05, 'epochs': 53, 'loss': 'mae', 'optimizer': 'adamw', 'use_snp_selection': False, 'weight_scheme': 'exponential', 'weight_clip_max': None, 'weight_exponential_beta': 7.749701004618775}. Best is trial 14 with value: 0.18486824431858043.
[I 2026-04-21 19:50:41,905] Trial 17 finished with value: 0.18609999980185254 and parameters: {'hidden_dims': '[256, 64]', 'dropout': 0.3609441076665659, 'batch_norm': True, 'lr': 4.862118238580926e-05, 'weight_decay': 1.2781936316090211e-06, 'epochs': 179, 'loss': 'mae', 'optimizer': 'adamw', 'use_snp_selection': False, 'weight_scheme': 'exponential', 'weight_clip_max': None, 'weight_exponential_beta': 7.56189651547864}. Best is trial 17 with value: 0.18609999980185254.
[I 2026-04-21 19:50:57,568] Trial 18 finished with value: 0.1796901395962205 and parameters: {'hidden_dims': '[256, 64]', 'dropout': 0.32475799391875465, 'batch_norm': True, 'lr': 0.00039388503445025234, 'weight_decay': 8.643431539227287e-07, 'epochs': 186, 'loss': 'mae', 'optimizer': 'adamw', 'use_snp_selection': False, 'weight_scheme': 'exponential', 'weight_clip_max': None, 'weight_exponential_beta': 5.861091896699593}. Best is trial 17 with value: 0.18609999980185254.
[I 2026-04-21 19:51:23,054] Trial 19 finished with value: 0.13278260586296423 and parameters: {'hidden_dims': '[512, 64]', 'dropout': 0.36753991663729646, 'batch_norm': True, 'lr': 1.5199622431506276e-05, 'weight_decay': 1.1303648437939511e-06, 'epochs': 163, 'loss': 'mae', 'optimizer': 'adamw', 'use_snp_selection': False, 'weight_scheme': 'exponential', 'weight_clip_max': None, 'weight_exponential_beta': 0.18525436333077394}. Best is trial 17 with value: 0.18609999980185254.
[I 2026-04-21 19:51:44,270] Trial 20 finished with value: 0.1446247951357497 and parameters: {'hidden_dims': '[512, 128]', 'dropout': 0.5052147816803326, 'batch_norm': True, 'lr': 0.0002922905114135789, 'weight_decay': 0.00013483491870944946, 'epochs': 132, 'loss': 'mae', 'optimizer': 'adamw', 'use_snp_selection': False, 'weight_scheme': 'uniform', 'weight_clip_max': None}. Best is trial 17 with value: 0.18609999980185254.
[I 2026-04-21 19:52:00,729] Trial 21 finished with value: 0.20169042955499458 and parameters: {'hidden_dims': '[256, 64]', 'dropout': 0.36759891250707566, 'batch_norm': True, 'lr': 0.0008746794920897344, 'weight_decay': 1.3157263361163423e-06, 'epochs': 195, 'loss': 'mae', 'optimizer': 'adamw', 'use_snp_selection': False, 'weight_scheme': 'exponential', 'weight_clip_max': None, 'weight_exponential_beta': 5.842992077133646}. Best is trial 21 with value: 0.20169042955499458.
[I 2026-04-21 19:52:17,260] Trial 22 finished with value: 0.19858526128549361 and parameters: {'hidden_dims': '[256, 64]', 'dropout': 0.3605521156880995, 'batch_norm': True, 'lr': 0.0007801897144260633, 'weight_decay': 2.0318521304419845e-06, 'epochs': 194, 'loss': 'mae', 'optimizer': 'adamw', 'use_snp_selection': False, 'weight_scheme': 'exponential', 'weight_clip_max': None, 'weight_exponential_beta': 5.384815814086777}. Best is trial 21 with value: 0.20169042955499458.
[I 2026-04-21 19:52:34,019] Trial 23 finished with value: 0.16611455315263315 and parameters: {'hidden_dims': '[256, 64]', 'dropout': 0.37548777743856415, 'batch_norm': True, 'lr': 0.000996107438081615, 'weight_decay': 2.058959411705117e-06, 'epochs': 205, 'loss': 'mae', 'optimizer': 'adamw', 'use_snp_selection': False, 'weight_scheme': 'exponential', 'weight_clip_max': None, 'weight_exponential_beta': 4.695879379773055}. Best is trial 21 with value: 0.20169042955499458.
[I 2026-04-21 19:52:48,618] Trial 24 finished with value: 0.19537192413157167 and parameters: {'hidden_dims': '[256, 64]', 'dropout': 0.34867142634436654, 'batch_norm': True, 'lr': 0.0005745252272342308, 'weight_decay': 2.9139453944283276e-07, 'epochs': 174, 'loss': 'mae', 'optimizer': 'adamw', 'use_snp_selection': False, 'weight_scheme': 'exponential', 'weight_clip_max': None, 'weight_exponential_beta': 5.026786277110496}. Best is trial 21 with value: 0.20169042955499458.
[I 2026-04-21 19:53:02,328] Trial 25 finished with value: 0.17403024548530252 and parameters: {'hidden_dims': '[256, 64]', 'dropout': 0.22867262388729448, 'batch_norm': True, 'lr': 0.0005528180919887744, 'weight_decay': 2.552227095983154e-07, 'epochs': 161, 'loss': 'mae', 'optimizer': 'adamw', 'use_snp_selection': False, 'weight_scheme': 'exponential', 'weight_clip_max': 10.0, 'weight_exponential_beta': 4.322457949894417}. Best is trial 21 with value: 0.20169042955499458.
[I 2026-04-21 19:53:18,512] Trial 26 finished with value: 0.19141065436976923 and parameters: {'hidden_dims': '[256, 64]', 'dropout': 0.4992720981441364, 'batch_norm': True, 'lr': 0.0006723988847271375, 'weight_decay': 1.0744188222439954e-07, 'epochs': 198, 'loss': 'mae', 'optimizer': 'adamw', 'use_snp_selection': False, 'weight_scheme': 'exponential', 'weight_clip_max': None, 'weight_exponential_beta': 5.475114773266666}. Best is trial 21 with value: 0.20169042955499458.
[I 2026-04-21 19:53:37,403] Trial 27 finished with value: 0.17119873751758996 and parameters: {'hidden_dims': '[256, 64]', 'dropout': 0.3310355415257719, 'batch_norm': True, 'lr': 0.0002442917283720779, 'weight_decay': 4.880688762381114e-07, 'epochs': 238, 'loss': 'mae', 'optimizer': 'adamw', 'use_snp_selection': False, 'weight_scheme': 'exponential', 'weight_clip_max': None, 'weight_exponential_beta': 3.0415562992089606}. Best is trial 21 with value: 0.20169042955499458.
[I 2026-04-21 19:54:16,461] Trial 28 finished with value: 0.1274051512985985 and parameters: {'hidden_dims': '[512, 128]', 'dropout': 0.4995561427088755, 'batch_norm': True, 'lr': 0.0005801539351135326, 'weight_decay': 5.128039386271912e-08, 'epochs': 267, 'loss': 'mae', 'optimizer': 'adamw', 'use_snp_selection': False, 'weight_scheme': 'uniform', 'weight_clip_max': None}. Best is trial 21 with value: 0.20169042955499458.
[I 2026-04-21 19:54:32,806] Trial 29 finished with value: 0.14193912480659082 and parameters: {'hidden_dims': '[512, 64]', 'dropout': 0.20667428402516902, 'batch_norm': True, 'lr': 0.0003493095422749148, 'weight_decay': 3.826160501105646e-06, 'epochs': 99, 'loss': 'mse', 'optimizer': 'adamw', 'use_snp_selection': False, 'weight_scheme': 'top-heavy', 'weight_clip_max': 10.0, 'weight_topheavy_top_frac': 0.0793189588776625, 'weight_topheavy_low': 0.9515087538485021, 'weight_topheavy_high': 1.5108127877398965}. Best is trial 21 with value: 0.20169042955499458.
[I 2026-04-21 19:54:45,057] Trial 30 finished with value: 0.20046699897743747 and parameters: {'hidden_dims': '[256, 64]', 'dropout': 0.15202903041579147, 'batch_norm': True, 'lr': 0.000655876072450644, 'weight_decay': 2.816231027423771e-06, 'epochs': 141, 'loss': 'mae', 'optimizer': 'adam', 'use_snp_selection': False, 'weight_scheme': 'exponential', 'weight_clip_max': None, 'weight_exponential_beta': 5.595605788871015}. Best is trial 21 with value: 0.20169042955499458.
[I 2026-04-21 19:54:57,173] Trial 31 finished with value: 0.18826049088579774 and parameters: {'hidden_dims': '[256, 64]', 'dropout': 0.14284672523595707, 'batch_norm': True, 'lr': 0.0007239440844275625, 'weight_decay': 3.2478041993292995e-06, 'epochs': 139, 'loss': 'mae', 'optimizer': 'adam', 'use_snp_selection': False, 'weight_scheme': 'exponential', 'weight_clip_max': None, 'weight_exponential_beta': 5.0207260207384925}. Best is trial 21 with value: 0.20169042955499458.
[I 2026-04-21 19:55:11,621] Trial 32 finished with value: 0.18607290586519096 and parameters: {'hidden_dims': '[256, 64]', 'dropout': 0.2861756596850078, 'batch_norm': True, 'lr': 0.00016714970707101877, 'weight_decay': 6.20032012523645e-07, 'epochs': 173, 'loss': 'mae', 'optimizer': 'adam', 'use_snp_selection': False, 'weight_scheme': 'exponential', 'weight_clip_max': None, 'weight_exponential_beta': 6.132485844084657}. Best is trial 21 with value: 0.20169042955499458.
[I 2026-04-21 19:55:25,598] Trial 33 finished with value: 0.17741881116066796 and parameters: {'hidden_dims': '[256, 64]', 'dropout': 0.0028104748986335637, 'batch_norm': True, 'lr': 0.00043908623369136356, 'weight_decay': 6.429618779242154e-06, 'epochs': 166, 'loss': 'mae', 'optimizer': 'adam', 'use_snp_selection': False, 'weight_scheme': 'exponential', 'weight_clip_max': None, 'weight_exponential_beta': 3.2744128763648632}. Best is trial 21 with value: 0.20169042955499458.
[I 2026-04-21 19:55:36,073] Trial 34 finished with value: 0.16657840792663378 and parameters: {'hidden_dims': '[256, 64]', 'dropout': 0.32807975843859805, 'batch_norm': True, 'lr': 0.00023470663850627804, 'weight_decay': 1.6739781345164445e-06, 'epochs': 115, 'loss': 'mse', 'optimizer': 'adam', 'use_snp_selection': False, 'weight_scheme': 'linear', 'weight_clip_max': None, 'weight_linear_min_weight': 0.98051737503335, 'weight_linear_max_weight': 3.8192486263350465}. Best is trial 21 with value: 0.20169042955499458.
[I 2026-04-21 19:55:49,069] Trial 35 finished with value: 0.1952973295273169 and parameters: {'hidden_dims': '[256, 64]', 'dropout': 0.2495437756521991, 'batch_norm': True, 'lr': 0.0008652676172447064, 'weight_decay': 1.484230360925495e-07, 'epochs': 152, 'loss': 'mae', 'optimizer': 'adam', 'use_snp_selection': False, 'weight_scheme': 'exponential', 'weight_clip_max': None, 'weight_exponential_beta': 6.384059479599944}. Best is trial 21 with value: 0.20169042955499458.
[I 2026-04-21 19:56:05,413] Trial 36 finished with value: 0.09228680137922725 and parameters: {'hidden_dims': '[256, 64]', 'dropout': 0.38951119304717374, 'batch_norm': True, 'lr': 0.00010722811671396355, 'weight_decay': 2.3645550994432215e-06, 'epochs': 206, 'loss': 'mse', 'optimizer': 'sgd', 'use_snp_selection': False, 'weight_scheme': 'linear', 'weight_clip_max': None, 'weight_linear_min_weight': 0.5711635345745357, 'weight_linear_max_weight': 2.8567623620010907}. Best is trial 21 with value: 0.20169042955499458.
[I 2026-04-21 19:56:45,429] Trial 37 finished with value: 0.19232058702285545 and parameters: {'hidden_dims': '[512, 128]', 'dropout': 0.09809910656356252, 'batch_norm': True, 'lr': 0.0005184648898052188, 'weight_decay': 4.945373243762327e-07, 'epochs': 122, 'loss': 'mae', 'optimizer': 'adamw', 'use_snp_selection': True, 'num_snps': 58170, 'weight_scheme': 'top-heavy', 'weight_clip_max': 10.0, 'weight_topheavy_top_frac': 0.41265503767783973, 'weight_topheavy_low': 0.5029963207144073, 'weight_topheavy_high': 5.800498590635664}. Best is trial 21 with value: 0.20169042955499458.
[I 2026-04-21 19:57:07,185] Trial 38 finished with value: -0.035489236070853636 and parameters: {'hidden_dims': '[512, 64]', 'dropout': 0.30558523045254044, 'batch_norm': True, 'lr': 1.0345924080281691e-06, 'weight_decay': 6.467163776192729e-06, 'epochs': 143, 'loss': 'mae', 'optimizer': 'sgd', 'use_snp_selection': False, 'weight_scheme': 'exponential', 'weight_clip_max': None, 'weight_exponential_beta': 3.914703635327667}. Best is trial 21 with value: 0.20169042955499458.
[I 2026-04-21 19:57:21,913] Trial 39 finished with value: 0.14907666717942383 and parameters: {'hidden_dims': '[256, 64]', 'dropout': 0.19682505395721428, 'batch_norm': False, 'lr': 0.00014416512398786365, 'weight_decay': 1.08223755536163e-08, 'epochs': 184, 'loss': 'mse', 'optimizer': 'adam', 'use_snp_selection': False, 'weight_scheme': 'exponential', 'weight_clip_max': 5.0, 'weight_exponential_beta': 5.221943969413641}. Best is trial 21 with value: 0.20169042955499458.
