Running from this directory: /cluster/work/simennes/Master_thesis
Name of job: ncv_ridge_iw
ID of job: 24335600
Array task ID: 6
The job was run on these nodes: idun-03-09
[I 2026-04-23 15:38:54,233] Trial 0 finished with value: 0.15386881312768447 and parameters: {'alpha': 113703.38004442609, 'use_snp_selection': True, 'num_snps': 5442, 'iw_method': 'pc_logistic', 'iw_clip_max': 10.0, 'iw_n_components': 5, 'iw_logistic_c': 4.927310296129143, 'iw_pca_fit': 'source', 'iw_solver': 'lbfgs'}. Best is trial 0 with value: 0.15386881312768447.
[I 2026-04-23 15:44:14,393] Trial 1 finished with value: 0.1542525831366029 and parameters: {'alpha': 31403.568254918682, 'use_snp_selection': True, 'num_snps': 52878, 'iw_method': 'pc_logistic', 'iw_clip_max': 25.0, 'iw_n_components': 50, 'iw_logistic_c': 0.0215474878351802, 'iw_pca_fit': 'combined', 'iw_solver': 'lbfgs'}. Best is trial 1 with value: 0.1542525831366029.
[I 2026-04-23 15:44:48,976] Trial 2 finished with value: 0.15872820804322318 and parameters: {'alpha': 843188.1730429748, 'use_snp_selection': False, 'iw_method': 'uniform', 'iw_clip_max': 10.0}. Best is trial 2 with value: 0.15872820804322318.
[I 2026-04-23 15:47:31,399] Trial 3 finished with value: 0.12762163436769688 and parameters: {'alpha': 1608.6968668824506, 'use_snp_selection': True, 'num_snps': 20835, 'iw_method': 'pc_logistic', 'iw_clip_max': None, 'iw_n_components': 10, 'iw_logistic_c': 1.0216001618506627, 'iw_pca_fit': 'source', 'iw_solver': 'lbfgs'}. Best is trial 2 with value: 0.15872820804322318.
[I 2026-04-23 15:48:05,716] Trial 4 finished with value: 0.16284857737579317 and parameters: {'alpha': 304631.0485153137, 'use_snp_selection': False, 'iw_method': 'uniform', 'iw_clip_max': 25.0}. Best is trial 4 with value: 0.16284857737579317.
[I 2026-04-23 15:51:21,310] Trial 5 finished with value: 0.13292784234295138 and parameters: {'alpha': 1969.1835550007406, 'use_snp_selection': False, 'iw_method': 'pc_logistic', 'iw_clip_max': None, 'iw_n_components': 10, 'iw_logistic_c': 72.13019609570544, 'iw_pca_fit': 'source', 'iw_solver': 'lbfgs'}. Best is trial 4 with value: 0.16284857737579317.
[I 2026-04-23 15:54:27,997] Trial 6 finished with value: 0.16204454735634574 and parameters: {'alpha': 102451.8239242939, 'use_snp_selection': True, 'num_snps': 28882, 'iw_method': 'pc_logistic', 'iw_clip_max': None, 'iw_n_components': 5, 'iw_logistic_c': 74.89693291900525, 'iw_pca_fit': 'source', 'iw_solver': 'lbfgs'}. Best is trial 4 with value: 0.16284857737579317.
[I 2026-04-23 15:55:02,356] Trial 7 finished with value: 0.11686813774060203 and parameters: {'alpha': 2141.2178673431476, 'use_snp_selection': False, 'iw_method': 'uniform', 'iw_clip_max': 25.0}. Best is trial 4 with value: 0.16284857737579317.
[I 2026-04-23 15:56:41,256] Trial 8 finished with value: 0.14966901481620465 and parameters: {'alpha': 5044402.471344981, 'use_snp_selection': True, 'num_snps': 45718, 'iw_method': 'uniform', 'iw_clip_max': 5.0}. Best is trial 4 with value: 0.16284857737579317.
[I 2026-04-23 16:00:05,909] Trial 9 finished with value: 0.14601701650465396 and parameters: {'alpha': 6685.17962248224, 'use_snp_selection': False, 'iw_method': 'pc_logistic', 'iw_clip_max': 25.0, 'iw_n_components': 10, 'iw_logistic_c': 60.72281367077526, 'iw_pca_fit': 'combined', 'iw_solver': 'lbfgs'}. Best is trial 4 with value: 0.16284857737579317.
[I 2026-04-23 16:00:41,949] Trial 10 finished with value: 0.15861246304191273 and parameters: {'alpha': 860571.7420672657, 'use_snp_selection': False, 'iw_method': 'uniform', 'iw_clip_max': 5.0}. Best is trial 4 with value: 0.16284857737579317.
[I 2026-04-23 16:02:08,787] Trial 11 finished with value: 0.16373621808296485 and parameters: {'alpha': 146725.17844355197, 'use_snp_selection': True, 'num_snps': 30178, 'iw_method': 'uniform', 'iw_clip_max': None}. Best is trial 11 with value: 0.16373621808296485.
[I 2026-04-23 16:03:41,404] Trial 12 finished with value: 0.1610560986482651 and parameters: {'alpha': 591768.0844457166, 'use_snp_selection': True, 'num_snps': 38552, 'iw_method': 'uniform', 'iw_clip_max': 25.0}. Best is trial 11 with value: 0.16373621808296485.
[I 2026-04-23 16:04:16,116] Trial 13 finished with value: 0.1479085283949608 and parameters: {'alpha': 30448.10954542319, 'use_snp_selection': False, 'iw_method': 'uniform', 'iw_clip_max': None}. Best is trial 11 with value: 0.16373621808296485.
[I 2026-04-23 16:05:26,476] Trial 14 finished with value: 0.1435764614802177 and parameters: {'alpha': 6266755.363843986, 'use_snp_selection': True, 'num_snps': 18192, 'iw_method': 'uniform', 'iw_clip_max': None}. Best is trial 11 with value: 0.16373621808296485.
[I 2026-04-23 16:06:01,335] Trial 15 finished with value: 0.16288866710063205 and parameters: {'alpha': 296185.78334472293, 'use_snp_selection': False, 'iw_method': 'uniform', 'iw_clip_max': 25.0}. Best is trial 11 with value: 0.16373621808296485.
[I 2026-04-23 16:06:36,158] Trial 16 finished with value: 0.1448700695738136 and parameters: {'alpha': 24188.852120578795, 'use_snp_selection': False, 'iw_method': 'uniform', 'iw_clip_max': 10.0}. Best is trial 11 with value: 0.16373621808296485.
[I 2026-04-23 16:08:01,002] Trial 17 finished with value: 0.15226760197216754 and parameters: {'alpha': 1927502.6144482074, 'use_snp_selection': True, 'num_snps': 32006, 'iw_method': 'uniform', 'iw_clip_max': 5.0}. Best is trial 11 with value: 0.16373621808296485.
[I 2026-04-23 16:08:35,576] Trial 18 finished with value: 0.16295273711174685 and parameters: {'alpha': 214446.61631478707, 'use_snp_selection': False, 'iw_method': 'uniform', 'iw_clip_max': 25.0}. Best is trial 11 with value: 0.16373621808296485.
[I 2026-04-23 16:09:32,628] Trial 19 finished with value: 0.15298695738500587 and parameters: {'alpha': 13509.234336709696, 'use_snp_selection': True, 'num_snps': 6485, 'iw_method': 'uniform', 'iw_clip_max': None}. Best is trial 11 with value: 0.16373621808296485.
[I 2026-04-23 16:11:27,443] Trial 20 finished with value: 0.16379769298763422 and parameters: {'alpha': 208512.15643117408, 'use_snp_selection': True, 'num_snps': 58808, 'iw_method': 'uniform', 'iw_clip_max': 25.0}. Best is trial 20 with value: 0.16379769298763422.
[I 2026-04-23 16:13:23,845] Trial 21 finished with value: 0.16330840011724196 and parameters: {'alpha': 183938.8284212429, 'use_snp_selection': True, 'num_snps': 59709, 'iw_method': 'uniform', 'iw_clip_max': 25.0}. Best is trial 20 with value: 0.16379769298763422.
[I 2026-04-23 16:15:20,700] Trial 22 finished with value: 0.15759668521582376 and parameters: {'alpha': 62599.52211830997, 'use_snp_selection': True, 'num_snps': 59997, 'iw_method': 'uniform', 'iw_clip_max': 25.0}. Best is trial 20 with value: 0.16379769298763422.
[I 2026-04-23 16:17:13,383] Trial 23 finished with value: 0.16457149331614426 and parameters: {'alpha': 173660.09719087827, 'use_snp_selection': True, 'num_snps': 57138, 'iw_method': 'uniform', 'iw_clip_max': 25.0}. Best is trial 23 with value: 0.16457149331614426.
[I 2026-04-23 16:18:55,892] Trial 24 finished with value: 0.16773770921100292 and parameters: {'alpha': 61626.967758732215, 'use_snp_selection': True, 'num_snps': 47289, 'iw_method': 'uniform', 'iw_clip_max': 25.0}. Best is trial 24 with value: 0.16773770921100292.
[I 2026-04-23 16:20:39,238] Trial 25 finished with value: 0.1398440075775409 and parameters: {'alpha': 6498.938795276289, 'use_snp_selection': True, 'num_snps': 48069, 'iw_method': 'uniform', 'iw_clip_max': 25.0}. Best is trial 24 with value: 0.16773770921100292.
[I 2026-04-23 16:22:26,167] Trial 26 finished with value: 0.1618176746342593 and parameters: {'alpha': 61792.32531550497, 'use_snp_selection': True, 'num_snps': 52280, 'iw_method': 'uniform', 'iw_clip_max': 25.0}. Best is trial 24 with value: 0.16773770921100292.
[I 2026-04-23 16:24:05,429] Trial 27 finished with value: 0.15468598750474108 and parameters: {'alpha': 1925770.1334294947, 'use_snp_selection': True, 'num_snps': 43025, 'iw_method': 'uniform', 'iw_clip_max': 25.0}. Best is trial 24 with value: 0.16773770921100292.
[I 2026-04-23 16:25:56,067] Trial 28 finished with value: 0.16230268748076213 and parameters: {'alpha': 520991.83472521923, 'use_snp_selection': True, 'num_snps': 53740, 'iw_method': 'uniform', 'iw_clip_max': 25.0}. Best is trial 24 with value: 0.16773770921100292.
[I 2026-04-23 16:31:10,010] Trial 29 finished with value: 0.15489406030605785 and parameters: {'alpha': 67097.14487740488, 'use_snp_selection': True, 'num_snps': 55899, 'iw_method': 'pc_logistic', 'iw_clip_max': 10.0, 'iw_n_components': 20, 'iw_logistic_c': 0.013807485687030918, 'iw_pca_fit': 'combined', 'iw_solver': 'lbfgs'}. Best is trial 24 with value: 0.16773770921100292.
[I 2026-04-23 16:32:44,540] Trial 30 finished with value: 0.15294673936017097 and parameters: {'alpha': 17109.57451564603, 'use_snp_selection': True, 'num_snps': 39954, 'iw_method': 'uniform', 'iw_clip_max': 25.0}. Best is trial 24 with value: 0.16773770921100292.
[I 2026-04-23 16:34:00,166] Trial 31 finished with value: 0.16452129088237605 and parameters: {'alpha': 142652.8216681079, 'use_snp_selection': True, 'num_snps': 23571, 'iw_method': 'uniform', 'iw_clip_max': None}. Best is trial 24 with value: 0.16773770921100292.
[I 2026-04-23 16:35:16,516] Trial 32 finished with value: 0.16461415709090282 and parameters: {'alpha': 96608.8434340197, 'use_snp_selection': True, 'num_snps': 24186, 'iw_method': 'uniform', 'iw_clip_max': 5.0}. Best is trial 24 with value: 0.16773770921100292.
[I 2026-04-23 16:36:32,609] Trial 33 finished with value: 0.16360742534099634 and parameters: {'alpha': 60073.975001158135, 'use_snp_selection': True, 'num_snps': 23872, 'iw_method': 'uniform', 'iw_clip_max': 5.0}. Best is trial 24 with value: 0.16773770921100292.
[I 2026-04-23 16:39:00,278] Trial 34 finished with value: 0.15781412739512274 and parameters: {'alpha': 96241.03496538626, 'use_snp_selection': True, 'num_snps': 14777, 'iw_method': 'pc_logistic', 'iw_clip_max': 5.0, 'iw_n_components': 20, 'iw_logistic_c': 0.19008568218202637, 'iw_pca_fit': 'combined', 'iw_solver': 'lbfgs'}. Best is trial 24 with value: 0.16773770921100292.
[I 2026-04-23 16:40:15,922] Trial 35 finished with value: 0.16134083500914467 and parameters: {'alpha': 40563.87305378134, 'use_snp_selection': True, 'num_snps': 24810, 'iw_method': 'uniform', 'iw_clip_max': 5.0}. Best is trial 24 with value: 0.16773770921100292.
[I 2026-04-23 16:41:19,570] Trial 36 finished with value: 0.14686263993682194 and parameters: {'alpha': 492562.09600117174, 'use_snp_selection': True, 'num_snps': 13746, 'iw_method': 'uniform', 'iw_clip_max': 10.0}. Best is trial 24 with value: 0.16773770921100292.
[I 2026-04-23 16:45:25,575] Trial 37 finished with value: 0.15306746468680868 and parameters: {'alpha': 116577.87628775951, 'use_snp_selection': True, 'num_snps': 36770, 'iw_method': 'pc_logistic', 'iw_clip_max': 5.0, 'iw_n_components': 50, 'iw_logistic_c': 6.430100430195212, 'iw_pca_fit': 'combined', 'iw_solver': 'lbfgs'}. Best is trial 24 with value: 0.16773770921100292.
[I 2026-04-23 16:46:42,985] Trial 38 finished with value: 0.16222532842370477 and parameters: {'alpha': 373635.92825031094, 'use_snp_selection': True, 'num_snps': 26434, 'iw_method': 'uniform', 'iw_clip_max': None}. Best is trial 24 with value: 0.16773770921100292.
[I 2026-04-23 16:47:53,764] Trial 39 finished with value: 0.14950507515624964 and parameters: {'alpha': 1272729.417355298, 'use_snp_selection': True, 'num_snps': 20293, 'iw_method': 'uniform', 'iw_clip_max': None}. Best is trial 24 with value: 0.16773770921100292.
[I 2026-04-23 16:52:21,990] Trial 40 finished with value: 0.14505902141089655 and parameters: {'alpha': 14163.177098690843, 'use_snp_selection': True, 'num_snps': 49079, 'iw_method': 'pc_logistic', 'iw_clip_max': 10.0, 'iw_n_components': 20, 'iw_logistic_c': 0.11711048115645671, 'iw_pca_fit': 'source', 'iw_solver': 'lbfgs'}. Best is trial 24 with value: 0.16773770921100292.
[I 2026-04-23 16:54:11,507] Trial 41 finished with value: 0.16408911920011565 and parameters: {'alpha': 234254.35655537972, 'use_snp_selection': True, 'num_snps': 58518, 'iw_method': 'uniform', 'iw_clip_max': 25.0}. Best is trial 24 with value: 0.16773770921100292.
[I 2026-04-23 16:55:57,643] Trial 42 finished with value: 0.16302022856483858 and parameters: {'alpha': 93298.67855578575, 'use_snp_selection': True, 'num_snps': 55539, 'iw_method': 'uniform', 'iw_clip_max': 25.0}. Best is trial 24 with value: 0.16773770921100292.
[I 2026-04-23 16:57:38,263] Trial 43 finished with value: 0.16687821707130296 and parameters: {'alpha': 278645.996493728, 'use_snp_selection': True, 'num_snps': 49827, 'iw_method': 'uniform', 'iw_clip_max': 5.0}. Best is trial 24 with value: 0.16773770921100292.
[I 2026-04-23 16:59:02,604] Trial 44 finished with value: 0.1617174392566285 and parameters: {'alpha': 38599.85795952262, 'use_snp_selection': True, 'num_snps': 34476, 'iw_method': 'uniform', 'iw_clip_max': 5.0}. Best is trial 24 with value: 0.16773770921100292.
[I 2026-04-23 17:00:37,137] Trial 45 finished with value: 0.17034997228976026 and parameters: {'alpha': 139933.6011211738, 'use_snp_selection': True, 'num_snps': 44455, 'iw_method': 'uniform', 'iw_clip_max': 5.0}. Best is trial 45 with value: 0.17034997228976026.
[I 2026-04-23 17:02:18,502] Trial 46 finished with value: 0.1598706578668801 and parameters: {'alpha': 816650.8955835341, 'use_snp_selection': True, 'num_snps': 50344, 'iw_method': 'uniform', 'iw_clip_max': 5.0}. Best is trial 45 with value: 0.17034997228976026.
[I 2026-04-23 17:03:51,974] Trial 47 finished with value: 0.16699879178560886 and parameters: {'alpha': 341200.6772002461, 'use_snp_selection': True, 'num_snps': 43077, 'iw_method': 'uniform', 'iw_clip_max': 5.0}. Best is trial 45 with value: 0.17034997228976026.
[I 2026-04-23 17:08:15,526] Trial 48 finished with value: 0.15544043499811686 and parameters: {'alpha': 334122.0452147658, 'use_snp_selection': True, 'num_snps': 43961, 'iw_method': 'pc_logistic', 'iw_clip_max': 5.0, 'iw_n_components': 50, 'iw_logistic_c': 5.460466841134473, 'iw_pca_fit': 'source', 'iw_solver': 'lbfgs'}. Best is trial 45 with value: 0.17034997228976026.
[I 2026-04-23 17:08:49,714] Trial 49 finished with value: 0.1564136947201416 and parameters: {'alpha': 1256512.2489487003, 'use_snp_selection': False, 'iw_method': 'uniform', 'iw_clip_max': 5.0}. Best is trial 45 with value: 0.17034997228976026.
