[I 2026-04-21 19:29:24,430] Trial 38 finished with value: 0.047979158985395266 and parameters: {'hidden_dims': '[512, 128]', 'dropout': 0.10893517825018983, 'batch_norm': False, 'lr': 0.0006591480430548357, 'weight_decay': 0.0001237500434326979, 'epochs': 191, 'loss': 'mae', 'optimizer': 'sgd', 'use_snp_selection': False, 'weight_scheme': 'linear', 'weight_clip_max': 10.0, 'weight_linear_min_weight': 0.6094132233157401, 'weight_linear_max_weight': 2.806277545154238}. Best is trial 22 with value: 0.10514417658216253.
[I 2026-04-21 19:29:28,958] Trial 4 finished with value: 0.0044736102005517525 and parameters: {'hidden_dims': '[256, 64]', 'dropout': 0.18128694708490736, 'batch_norm': False, 'lr': 8.951826748007403e-05, 'weight_decay': 2.1781541495465197e-07, 'epochs': 147, 'loss': 'mse', 'optimizer': 'sgd', 'use_snp_selection': False, 'weight_scheme': 'top-heavy', 'weight_clip_max': 5.0, 'weight_topheavy_top_frac': 0.1724888194073277, 'weight_topheavy_low': 1.1620865802171172, 'weight_topheavy_high': 3.476906528073177}. Best is trial 2 with value: 0.1163736564021506.
[I 2026-04-21 19:29:39,410] Trial 5 finished with value: 0.08190238100216474 and parameters: {'hidden_dims': '[256, 64]', 'dropout': 0.2571412946970998, 'batch_norm': True, 'lr': 3.546238022482882e-05, 'weight_decay': 1.0185234767613396e-06, 'epochs': 119, 'loss': 'mse', 'optimizer': 'sgd', 'use_snp_selection': False, 'weight_scheme': 'linear', 'weight_clip_max': 10.0, 'weight_linear_min_weight': 0.9405832045183805, 'weight_linear_max_weight': 3.413610925325811}. Best is trial 2 with value: 0.1163736564021506.
[I 2026-04-21 19:29:43,670] Trial 39 finished with value: 0.1053131199849166 and parameters: {'hidden_dims': '[512, 64]', 'dropout': 0.25489183040089, 'batch_norm': True, 'lr': 9.267268952153715e-05, 'weight_decay': 1.0438195258628846e-05, 'epochs': 127, 'loss': 'mse', 'optimizer': 'adam', 'use_snp_selection': False, 'weight_scheme': 'exponential', 'weight_clip_max': None, 'weight_exponential_beta': 7.1351742950072286}. Best is trial 39 with value: 0.1053131199849166.
[I 2026-04-21 19:29:58,344] Trial 6 finished with value: 0.08491570360413751 and parameters: {'hidden_dims': '[256, 64]', 'dropout': 0.037961443806696214, 'batch_norm': True, 'lr': 3.644202049829694e-05, 'weight_decay': 9.73334309820277e-06, 'epochs': 243, 'loss': 'mae', 'optimizer': 'adam', 'use_snp_selection': False, 'weight_scheme': 'minmax', 'weight_clip_max': None, 'weight_minmax_eps': 0.08689611239934374}. Best is trial 2 with value: 0.1163736564021506.
[I 2026-04-21 19:30:31,032] Trial 0 finished with value: -0.018832594183701028 and parameters: {'hidden_dims': '[256, 128]', 'dropout': 0.18584155530312246, 'batch_norm': True, 'lr': 9.012665953349533e-06, 'weight_decay': 4.96591963698479e-06, 'epochs': 105, 'loss': 'mse', 'optimizer': 'sgd', 'use_snp_selection': True, 'num_snps': 25583, 'weight_scheme': 'minmax', 'weight_clip_max': 5.0, 'weight_minmax_eps': 0.14026014881292506}. Best is trial 0 with value: -0.018832594183701028.
[I 2026-04-21 19:30:42,631] Trial 7 finished with value: 0.04956618940058551 and parameters: {'hidden_dims': '[512, 128]', 'dropout': 0.1304538168539244, 'batch_norm': False, 'lr': 1.5408060926311233e-05, 'weight_decay': 2.1989735568314356e-08, 'epochs': 250, 'loss': 'mse', 'optimizer': 'sgd', 'use_snp_selection': True, 'num_snps': 42550, 'weight_scheme': 'exponential', 'weight_clip_max': 10.0, 'weight_exponential_beta': 2.758850226029358}. Best is trial 2 with value: 0.1163736564021506.
[I 2026-04-21 19:30:43,338] Trial 1 finished with value: 0.05307083732470833 and parameters: {'hidden_dims': '[256, 64]', 'dropout': 0.05000949662985405, 'batch_norm': True, 'lr': 0.00015647443054904835, 'weight_decay': 5.158896024962846e-05, 'epochs': 152, 'loss': 'mse', 'optimizer': 'sgd', 'use_snp_selection': False, 'weight_scheme': 'linear', 'weight_clip_max': None, 'weight_linear_min_weight': 0.21922985165550554, 'weight_linear_max_weight': 1.6260435767424388}. Best is trial 1 with value: 0.05307083732470833.
[I 2026-04-21 19:31:04,764] Trial 8 finished with value: 0.088407839966411 and parameters: {'hidden_dims': '[256, 128]', 'dropout': 0.05742396906738376, 'batch_norm': False, 'lr': 1.9761509510575143e-06, 'weight_decay': 2.933492239224291e-07, 'epochs': 82, 'loss': 'mae', 'optimizer': 'adam', 'use_snp_selection': True, 'num_snps': 29883, 'weight_scheme': 'minmax', 'weight_clip_max': 5.0, 'weight_minmax_eps': 0.0051288771726799584}. Best is trial 2 with value: 0.1163736564021506.
[I 2026-04-21 19:31:05,386] Trial 2 finished with value: 0.09394907181172425 and parameters: {'hidden_dims': '[512, 128]', 'dropout': 0.2736730891340176, 'batch_norm': True, 'lr': 7.298114623433994e-05, 'weight_decay': 5.6346010385734023e-08, 'epochs': 185, 'loss': 'mae', 'optimizer': 'sgd', 'use_snp_selection': True, 'num_snps': 14091, 'weight_scheme': 'minmax', 'weight_clip_max': 10.0, 'weight_minmax_eps': 0.045780660776687306}. Best is trial 2 with value: 0.09394907181172425.
[I 2026-04-21 19:31:32,116] Trial 9 finished with value: 0.08242893334830985 and parameters: {'hidden_dims': '[256, 128]', 'dropout': 0.5795930447285386, 'batch_norm': False, 'lr': 0.00011782025260263196, 'weight_decay': 0.0005562063174273634, 'epochs': 218, 'loss': 'mae', 'optimizer': 'adamw', 'use_snp_selection': True, 'num_snps': 32226, 'weight_scheme': 'minmax', 'weight_clip_max': 5.0, 'weight_minmax_eps': 0.09600289105543994}. Best is trial 2 with value: 0.1163736564021506.
[I 2026-04-21 19:31:43,752] Trial 3 finished with value: 0.06858175004590365 and parameters: {'hidden_dims': '[512, 64]', 'dropout': 0.30157795416637295, 'batch_norm': False, 'lr': 2.007492282795256e-05, 'weight_decay': 5.496446859789657e-06, 'epochs': 284, 'loss': 'mse', 'optimizer': 'sgd', 'use_snp_selection': False, 'weight_scheme': 'linear', 'weight_clip_max': None, 'weight_linear_min_weight': 0.24682154527102826, 'weight_linear_max_weight': 1.8338910783134623}. Best is trial 2 with value: 0.09394907181172425.
[I 2026-04-21 19:31:51,584] Trial 10 finished with value: 0.1006795588348603 and parameters: {'hidden_dims': '[512, 128]', 'dropout': 0.41166285385449597, 'batch_norm': True, 'lr': 0.0009667920285641304, 'weight_decay': 1.8454339711163535e-08, 'epochs': 193, 'loss': 'mae', 'optimizer': 'adamw', 'use_snp_selection': True, 'num_snps': 8051, 'weight_scheme': 'uniform', 'weight_clip_max': 10.0}. Best is trial 2 with value: 0.1163736564021506.
[I 2026-04-21 19:31:55,858] Trial 4 finished with value: 0.019459506781926584 and parameters: {'hidden_dims': '[256, 64]', 'dropout': 0.18128694708490736, 'batch_norm': False, 'lr': 8.951826748007403e-05, 'weight_decay': 2.1781541495465197e-07, 'epochs': 147, 'loss': 'mse', 'optimizer': 'sgd', 'use_snp_selection': False, 'weight_scheme': 'top-heavy', 'weight_clip_max': 5.0, 'weight_topheavy_top_frac': 0.1724888194073277, 'weight_topheavy_low': 1.1620865802171172, 'weight_topheavy_high': 3.476906528073177}. Best is trial 2 with value: 0.09394907181172425.
[I 2026-04-21 19:32:06,272] Trial 5 finished with value: 0.05714460962925933 and parameters: {'hidden_dims': '[256, 64]', 'dropout': 0.2571412946970998, 'batch_norm': True, 'lr': 3.546238022482882e-05, 'weight_decay': 1.0185234767613396e-06, 'epochs': 119, 'loss': 'mse', 'optimizer': 'sgd', 'use_snp_selection': False, 'weight_scheme': 'linear', 'weight_clip_max': 10.0, 'weight_linear_min_weight': 0.9405832045183805, 'weight_linear_max_weight': 3.413610925325811}. Best is trial 2 with value: 0.09394907181172425.
[I 2026-04-21 19:32:09,405] Trial 11 finished with value: 0.08259727775486518 and parameters: {'hidden_dims': '[512, 128]', 'dropout': 0.42470474492882904, 'batch_norm': True, 'lr': 0.0007728340671580595, 'weight_decay': 1.0192947037878257e-08, 'epochs': 194, 'loss': 'mae', 'optimizer': 'adamw', 'use_snp_selection': True, 'num_snps': 5247, 'weight_scheme': 'uniform', 'weight_clip_max': 10.0}. Best is trial 2 with value: 0.1163736564021506.
[I 2026-04-21 19:32:24,994] Trial 6 finished with value: 0.08491604951247061 and parameters: {'hidden_dims': '[256, 64]', 'dropout': 0.037961443806696214, 'batch_norm': True, 'lr': 3.644202049829694e-05, 'weight_decay': 9.73334309820277e-06, 'epochs': 243, 'loss': 'mae', 'optimizer': 'adam', 'use_snp_selection': False, 'weight_scheme': 'minmax', 'weight_clip_max': None, 'weight_minmax_eps': 0.08689611239934374}. Best is trial 2 with value: 0.09394907181172425.
[I 2026-04-21 19:32:27,394] Trial 12 finished with value: 0.0888107584976862 and parameters: {'hidden_dims': '[512, 128]', 'dropout': 0.4270113821844665, 'batch_norm': True, 'lr': 0.0008029050102141502, 'weight_decay': 1.0762937822958243e-07, 'epochs': 193, 'loss': 'mae', 'optimizer': 'adamw', 'use_snp_selection': True, 'num_snps': 5369, 'weight_scheme': 'uniform', 'weight_clip_max': 10.0}. Best is trial 2 with value: 0.1163736564021506.
[I 2026-04-21 19:32:49,731] Trial 13 finished with value: 0.07499331554729448 and parameters: {'hidden_dims': '[512, 128]', 'dropout': 0.3647704791917715, 'batch_norm': True, 'lr': 0.0003488661704648464, 'weight_decay': 4.9202129452262136e-08, 'epochs': 159, 'loss': 'mae', 'optimizer': 'adamw', 'use_snp_selection': True, 'num_snps': 16890, 'weight_scheme': 'uniform', 'weight_clip_max': 10.0}. Best is trial 2 with value: 0.1163736564021506.
[I 2026-04-21 19:33:07,333] Trial 7 finished with value: -0.03899874637479289 and parameters: {'hidden_dims': '[512, 128]', 'dropout': 0.1304538168539244, 'batch_norm': False, 'lr': 1.5408060926311233e-05, 'weight_decay': 2.1989735568314356e-08, 'epochs': 250, 'loss': 'mse', 'optimizer': 'sgd', 'use_snp_selection': True, 'num_snps': 42550, 'weight_scheme': 'exponential', 'weight_clip_max': 10.0, 'weight_exponential_beta': 2.758850226029358}. Best is trial 2 with value: 0.09394907181172425.
[I 2026-04-21 19:33:20,769] Trial 14 finished with value: 0.019950078743870267 and parameters: {'hidden_dims': '[512, 128]', 'dropout': 0.5294738426639388, 'batch_norm': True, 'lr': 2.728215332689289e-06, 'weight_decay': 5.313590347943404e-07, 'epochs': 57, 'loss': 'mae', 'optimizer': 'adamw', 'use_snp_selection': True, 'num_snps': 59986, 'weight_scheme': 'exponential', 'weight_clip_max': 10.0, 'weight_exponential_beta': 7.6462424998639165}. Best is trial 2 with value: 0.1163736564021506.
[I 2026-04-21 19:33:29,614] Trial 8 finished with value: -1.5316068224459817e-05 and parameters: {'hidden_dims': '[256, 128]', 'dropout': 0.05742396906738376, 'batch_norm': False, 'lr': 1.9761509510575143e-06, 'weight_decay': 2.933492239224291e-07, 'epochs': 82, 'loss': 'mae', 'optimizer': 'adam', 'use_snp_selection': True, 'num_snps': 29883, 'weight_scheme': 'minmax', 'weight_clip_max': 5.0, 'weight_minmax_eps': 0.0051288771726799584}. Best is trial 2 with value: 0.09394907181172425.
[I 2026-04-21 19:33:45,070] Trial 15 finished with value: 0.09519906518246406 and parameters: {'hidden_dims': '[512, 64]', 'dropout': 0.46548449070647346, 'batch_norm': True, 'lr': 0.0003070889904693636, 'weight_decay': 4.553641128212676e-08, 'epochs': 225, 'loss': 'mae', 'optimizer': 'adam', 'use_snp_selection': True, 'num_snps': 16176, 'weight_scheme': 'top-heavy', 'weight_clip_max': 10.0, 'weight_topheavy_top_frac': 0.48798503166068097, 'weight_topheavy_low': 0.5063177435501478, 'weight_topheavy_high': 5.83657946905849}. Best is trial 2 with value: 0.1163736564021506.
[I 2026-04-21 19:33:56,842] Trial 9 finished with value: 0.03573070204669033 and parameters: {'hidden_dims': '[256, 128]', 'dropout': 0.5795930447285386, 'batch_norm': False, 'lr': 0.00011782025260263196, 'weight_decay': 0.0005562063174273634, 'epochs': 218, 'loss': 'mae', 'optimizer': 'adamw', 'use_snp_selection': True, 'num_snps': 32226, 'weight_scheme': 'minmax', 'weight_clip_max': 5.0, 'weight_minmax_eps': 0.09600289105543994}. Best is trial 2 with value: 0.09394907181172425.
[I 2026-04-21 19:34:11,736] Trial 16 finished with value: 0.08792694991255594 and parameters: {'hidden_dims': '[512, 128]', 'dropout': 0.31470423399849934, 'batch_norm': True, 'lr': 6.365125466072458e-06, 'weight_decay': 1.1476517125980609e-08, 'epochs': 298, 'loss': 'mae', 'optimizer': 'adamw', 'use_snp_selection': True, 'num_snps': 16079, 'weight_scheme': 'uniform', 'weight_clip_max': 10.0}. Best is trial 2 with value: 0.1163736564021506.
[I 2026-04-21 19:34:16,069] Trial 10 finished with value: 0.09642297943116569 and parameters: {'hidden_dims': '[512, 128]', 'dropout': 0.41166285385449597, 'batch_norm': True, 'lr': 0.0009667920285641304, 'weight_decay': 1.8454339711163535e-08, 'epochs': 193, 'loss': 'mae', 'optimizer': 'adamw', 'use_snp_selection': True, 'num_snps': 8051, 'weight_scheme': 'uniform', 'weight_clip_max': 10.0}. Best is trial 10 with value: 0.09642297943116569.
[I 2026-04-21 19:34:32,548] Trial 17 finished with value: 0.10961301858175565 and parameters: {'hidden_dims': '[512, 128]', 'dropout': 0.35866086873974606, 'batch_norm': True, 'lr': 7.172518564501266e-05, 'weight_decay': 1.175141534227236e-06, 'epochs': 181, 'loss': 'mae', 'optimizer': 'adamw', 'use_snp_selection': True, 'num_snps': 12149, 'weight_scheme': 'minmax', 'weight_clip_max': 10.0, 'weight_minmax_eps': 0.014507033252367796}. Best is trial 2 with value: 0.1163736564021506.
[I 2026-04-21 19:34:33,760] Trial 11 finished with value: 0.08207593045383502 and parameters: {'hidden_dims': '[512, 128]', 'dropout': 0.42470474492882904, 'batch_norm': True, 'lr': 0.0007728340671580595, 'weight_decay': 1.0192947037878257e-08, 'epochs': 194, 'loss': 'mae', 'optimizer': 'adamw', 'use_snp_selection': True, 'num_snps': 5247, 'weight_scheme': 'uniform', 'weight_clip_max': 10.0}. Best is trial 10 with value: 0.09642297943116569.
[I 2026-04-21 19:34:51,459] Trial 12 finished with value: 0.08628744003596221 and parameters: {'hidden_dims': '[512, 128]', 'dropout': 0.4270113821844665, 'batch_norm': True, 'lr': 0.0008029050102141502, 'weight_decay': 1.0762937822958243e-07, 'epochs': 193, 'loss': 'mae', 'optimizer': 'adamw', 'use_snp_selection': True, 'num_snps': 5369, 'weight_scheme': 'uniform', 'weight_clip_max': 10.0}. Best is trial 10 with value: 0.09642297943116569.
[I 2026-04-21 19:35:04,703] Trial 18 finished with value: -0.02157518352968262 and parameters: {'hidden_dims': '[512, 128]', 'dropout': 0.23802894161001004, 'batch_norm': True, 'lr': 7.698026101039986e-05, 'weight_decay': 1.2920412304540244e-06, 'epochs': 128, 'loss': 'mae', 'optimizer': 'sgd', 'use_snp_selection': True, 'num_snps': 42558, 'weight_scheme': 'minmax', 'weight_clip_max': 10.0, 'weight_minmax_eps': 0.010019308695946364}. Best is trial 2 with value: 0.1163736564021506.
[I 2026-04-21 19:35:14,188] Trial 13 finished with value: 0.04679918264167127 and parameters: {'hidden_dims': '[512, 128]', 'dropout': 0.3647704791917715, 'batch_norm': True, 'lr': 0.0003488661704648464, 'weight_decay': 4.9202129452262136e-08, 'epochs': 159, 'loss': 'mae', 'optimizer': 'adamw', 'use_snp_selection': True, 'num_snps': 16890, 'weight_scheme': 'uniform', 'weight_clip_max': 10.0}. Best is trial 10 with value: 0.09642297943116569.
[I 2026-04-21 19:35:29,491] Trial 19 finished with value: 0.1099384815148667 and parameters: {'hidden_dims': '[512, 64]', 'dropout': 0.3486247318451462, 'batch_norm': True, 'lr': 4.4933691438955196e-05, 'weight_decay': 1.6496550238839968e-05, 'epochs': 176, 'loss': 'mae', 'optimizer': 'adam', 'use_snp_selection': True, 'num_snps': 20619, 'weight_scheme': 'minmax', 'weight_clip_max': 10.0, 'weight_minmax_eps': 0.04484026867261232}. Best is trial 2 with value: 0.1163736564021506.
[I 2026-04-21 19:35:46,363] Trial 14 finished with value: 0.01834500792291061 and parameters: {'hidden_dims': '[512, 128]', 'dropout': 0.5294738426639388, 'batch_norm': True, 'lr': 2.728215332689289e-06, 'weight_decay': 5.313590347943404e-07, 'epochs': 57, 'loss': 'mae', 'optimizer': 'adamw', 'use_snp_selection': True, 'num_snps': 59986, 'weight_scheme': 'exponential', 'weight_clip_max': 10.0, 'weight_exponential_beta': 7.6462424998639165}. Best is trial 10 with value: 0.09642297943116569.
[I 2026-04-21 19:36:00,239] Trial 20 finished with value: 0.09436265752058243 and parameters: {'hidden_dims': '[512, 64]', 'dropout': 0.4951663828240415, 'batch_norm': True, 'lr': 0.00021701083846522746, 'weight_decay': 3.763326466687129e-05, 'epochs': 265, 'loss': 'mae', 'optimizer': 'adam', 'use_snp_selection': True, 'num_snps': 23597, 'weight_scheme': 'minmax', 'weight_clip_max': None, 'weight_minmax_eps': 0.05869167584256934}. Best is trial 2 with value: 0.1163736564021506.
[I 2026-04-21 19:36:11,117] Trial 15 finished with value: 0.03741564576143472 and parameters: {'hidden_dims': '[512, 64]', 'dropout': 0.46548449070647346, 'batch_norm': True, 'lr': 0.0003070889904693636, 'weight_decay': 4.553641128212676e-08, 'epochs': 225, 'loss': 'mae', 'optimizer': 'adam', 'use_snp_selection': True, 'num_snps': 16176, 'weight_scheme': 'top-heavy', 'weight_clip_max': 10.0, 'weight_topheavy_top_frac': 0.48798503166068097, 'weight_topheavy_low': 0.5063177435501478, 'weight_topheavy_high': 5.83657946905849}. Best is trial 10 with value: 0.09642297943116569.
[I 2026-04-21 19:36:21,434] Trial 21 finished with value: 0.08700249982010362 and parameters: {'hidden_dims': '[512, 64]', 'dropout': 0.3289547385797702, 'batch_norm': True, 'lr': 5.923063732533879e-05, 'weight_decay': 3.3373832931406905e-05, 'epochs': 174, 'loss': 'mae', 'optimizer': 'adam', 'use_snp_selection': True, 'num_snps': 13734, 'weight_scheme': 'minmax', 'weight_clip_max': 10.0, 'weight_minmax_eps': 0.04414702969873783}. Best is trial 2 with value: 0.1163736564021506.
[I 2026-04-21 19:36:38,263] Trial 16 finished with value: -0.009403261351788072 and parameters: {'hidden_dims': '[512, 128]', 'dropout': 0.31470423399849934, 'batch_norm': True, 'lr': 6.365125466072458e-06, 'weight_decay': 1.1476517125980609e-08, 'epochs': 298, 'loss': 'mae', 'optimizer': 'adamw', 'use_snp_selection': True, 'num_snps': 16079, 'weight_scheme': 'uniform', 'weight_clip_max': 10.0}. Best is trial 10 with value: 0.09642297943116569.
[I 2026-04-21 19:36:49,365] Trial 22 finished with value: 0.10382429078339406 and parameters: {'hidden_dims': '[512, 64]', 'dropout': 0.3703933656420346, 'batch_norm': True, 'lr': 4.691276195322706e-05, 'weight_decay': 0.00011329460192010424, 'epochs': 215, 'loss': 'mae', 'optimizer': 'adam', 'use_snp_selection': True, 'num_snps': 22502, 'weight_scheme': 'minmax', 'weight_clip_max': 10.0, 'weight_minmax_eps': 0.043994978059905814}. Best is trial 2 with value: 0.1163736564021506.
[I 2026-04-21 19:36:59,389] Trial 17 finished with value: 0.03372239330466713 and parameters: {'hidden_dims': '[512, 128]', 'dropout': 0.35866086873974606, 'batch_norm': True, 'lr': 7.172518564501266e-05, 'weight_decay': 1.175141534227236e-06, 'epochs': 181, 'loss': 'mae', 'optimizer': 'adamw', 'use_snp_selection': True, 'num_snps': 12149, 'weight_scheme': 'minmax', 'weight_clip_max': 10.0, 'weight_minmax_eps': 0.014507033252367796}. Best is trial 10 with value: 0.09642297943116569.
[I 2026-04-21 19:37:09,576] Trial 23 finished with value: 0.08488168127345173 and parameters: {'hidden_dims': '[512, 64]', 'dropout': 0.25885936378571156, 'batch_norm': True, 'lr': 1.9962341704404667e-05, 'weight_decay': 2.0062047990424204e-06, 'epochs': 176, 'loss': 'mae', 'optimizer': 'adam', 'use_snp_selection': True, 'num_snps': 11851, 'weight_scheme': 'minmax', 'weight_clip_max': 10.0, 'weight_minmax_eps': 0.19925379113751063}. Best is trial 2 with value: 0.1163736564021506.
[I 2026-04-21 19:37:31,460] Trial 18 finished with value: 0.0362088112431728 and parameters: {'hidden_dims': '[512, 128]', 'dropout': 0.23802894161001004, 'batch_norm': True, 'lr': 1.0016647419327724e-06, 'weight_decay': 6.70399962241207e-08, 'epochs': 128, 'loss': 'mae', 'optimizer': 'sgd', 'use_snp_selection': True, 'num_snps': 42558, 'weight_scheme': 'uniform', 'weight_clip_max': 10.0}. Best is trial 10 with value: 0.09642297943116569.
[I 2026-04-21 19:37:34,233] Trial 24 finished with value: 0.03417024264531034 and parameters: {'hidden_dims': '[512, 128]', 'dropout': 0.3671435778189758, 'batch_norm': True, 'lr': 1.1192834421525218e-05, 'weight_decay': 9.706833505595627e-06, 'epochs': 174, 'loss': 'mae', 'optimizer': 'adam', 'use_snp_selection': True, 'num_snps': 20556, 'weight_scheme': 'minmax', 'weight_clip_max': 10.0, 'weight_minmax_eps': 0.02981147562439836}. Best is trial 2 with value: 0.1163736564021506.
[I 2026-04-21 19:37:52,761] Trial 25 finished with value: -0.042363607339692966 and parameters: {'hidden_dims': '[512, 128]', 'dropout': 0.22344283266825543, 'batch_norm': True, 'lr': 4.2079997366043784e-06, 'weight_decay': 0.00020121400593237928, 'epochs': 141, 'loss': 'mae', 'optimizer': 'sgd', 'use_snp_selection': True, 'num_snps': 9944, 'weight_scheme': 'top-heavy', 'weight_clip_max': 10.0, 'weight_topheavy_top_frac': 0.05164181623660338, 'weight_topheavy_low': 0.8138979599891084, 'weight_topheavy_high': 1.6928433109808914}. Best is trial 2 with value: 0.1163736564021506.
[I 2026-04-21 19:37:57,670] Trial 19 finished with value: 0.06888166920202103 and parameters: {'hidden_dims': '[512, 64]', 'dropout': 0.49526566084459034, 'batch_norm': True, 'lr': 0.00031586897808138776, 'weight_decay': 1.924399445966327e-05, 'epochs': 202, 'loss': 'mae', 'optimizer': 'adam', 'use_snp_selection': True, 'num_snps': 20932, 'weight_scheme': 'exponential', 'weight_clip_max': None, 'weight_exponential_beta': 7.866257738706708}. Best is trial 10 with value: 0.09642297943116569.
