[I 2026-04-21 17:45:25,196] Trial 38 finished with value: 0.08932216389055525 and parameters: {'hidden_dims': '[256, 128]', 'dropout': 0.15138163981576164, 'batch_norm': False, 'lr': 5.354790633421166e-05, 'weight_decay': 4.601873355768461e-06, 'epochs': 144, 'loss': 'mae', 'optimizer': 'sgd', 'use_snp_selection': True, 'num_snps': 53903, 'weight_scheme': 'uniform', 'weight_clip_max': 10.0}. Best is trial 37 with value: 0.2684685150466404.
[I 2026-04-21 17:45:33,214] Trial 9 finished with value: 0.26434146346170073 and parameters: {'hidden_dims': '[256, 128]', 'dropout': 0.5795930447285386, 'batch_norm': False, 'lr': 0.00011782025260263196, 'weight_decay': 0.0005562063174273634, 'epochs': 218, 'loss': 'mae', 'optimizer': 'adamw', 'use_snp_selection': True, 'num_snps': 32226, 'weight_scheme': 'minmax', 'weight_clip_max': 5.0, 'weight_minmax_eps': 0.09600289105543994}. Best is trial 8 with value: 0.311927808073811.
[I 2026-04-21 17:45:55,367] Trial 39 finished with value: 0.21888618464427764 and parameters: {'hidden_dims': '[256, 128]', 'dropout': 0.2309867685338674, 'batch_norm': False, 'lr': 2.750677801767521e-05, 'weight_decay': 6.00035864517244e-08, 'epochs': 125, 'loss': 'mse', 'optimizer': 'adamw', 'use_snp_selection': True, 'num_snps': 42328, 'weight_scheme': 'linear', 'weight_clip_max': 10.0, 'weight_linear_min_weight': 0.5870911360170412, 'weight_linear_max_weight': 2.701472044595163}. Best is trial 37 with value: 0.2684685150466404.
[I 2026-04-21 17:46:03,146] Trial 10 finished with value: 0.17544415792953547 and parameters: {'hidden_dims': '[256, 128]', 'dropout': 0.4338375928678635, 'batch_norm': False, 'lr': 1.459239318238064e-06, 'weight_decay': 3.891313547330106e-07, 'epochs': 68, 'loss': 'mae', 'optimizer': 'adam', 'use_snp_selection': True, 'num_snps': 53871, 'weight_scheme': 'uniform', 'weight_clip_max': 5.0}. Best is trial 8 with value: 0.311927808073811.
[I 2026-04-21 17:46:31,800] Trial 11 finished with value: 0.1379887940951023 and parameters: {'hidden_dims': '[256, 128]', 'dropout': 0.5977959517479471, 'batch_norm': False, 'lr': 0.0007728340671580595, 'weight_decay': 0.0004164439942178998, 'epochs': 200, 'loss': 'mae', 'optimizer': 'adamw', 'use_snp_selection': True, 'num_snps': 30988, 'weight_scheme': 'minmax', 'weight_clip_max': 5.0, 'weight_minmax_eps': 0.005209797941978697}. Best is trial 8 with value: 0.311927808073811.
[I 2026-04-21 17:46:50,430] Trial 0 finished with value: 0.10018843670311835 and parameters: {'hidden_dims': '[256, 128]', 'dropout': 0.18584155530312246, 'batch_norm': True, 'lr': 9.012665953349533e-06, 'weight_decay': 4.96591963698479e-06, 'epochs': 105, 'loss': 'mse', 'optimizer': 'sgd', 'use_snp_selection': True, 'num_snps': 25583, 'weight_scheme': 'minmax', 'weight_clip_max': 5.0, 'weight_minmax_eps': 0.14026014881292506}. Best is trial 0 with value: 0.10018843670311835.
[I 2026-04-21 17:46:53,696] Trial 12 finished with value: 0.1346336646941391 and parameters: {'hidden_dims': '[256, 128]', 'dropout': 0.49224381548015783, 'batch_norm': False, 'lr': 1.6672985638477092e-06, 'weight_decay': 0.000985776838336091, 'epochs': 61, 'loss': 'mae', 'optimizer': 'adamw', 'use_snp_selection': True, 'num_snps': 22869, 'weight_scheme': 'minmax', 'weight_clip_max': 5.0, 'weight_minmax_eps': 0.1815169394876332}. Best is trial 8 with value: 0.311927808073811.
[I 2026-04-21 17:47:04,797] Trial 1 finished with value: 0.17926371090912027 and parameters: {'hidden_dims': '[256, 64]', 'dropout': 0.05000949662985405, 'batch_norm': True, 'lr': 0.00015647443054904835, 'weight_decay': 5.158896024962846e-05, 'epochs': 152, 'loss': 'mse', 'optimizer': 'sgd', 'use_snp_selection': False, 'weight_scheme': 'linear', 'weight_clip_max': None, 'weight_linear_min_weight': 0.21922985165550554, 'weight_linear_max_weight': 1.6260435767424388}. Best is trial 1 with value: 0.17926371090912027.
[I 2026-04-21 17:47:26,835] Trial 13 finished with value: 0.30747466669559176 and parameters: {'hidden_dims': '[256, 128]', 'dropout': 0.39617155092414635, 'batch_norm': False, 'lr': 5.5499656564214575e-06, 'weight_decay': 4.026950095019044e-05, 'epochs': 219, 'loss': 'mae', 'optimizer': 'adam', 'use_snp_selection': True, 'num_snps': 40015, 'weight_scheme': 'top-heavy', 'weight_clip_max': 5.0, 'weight_topheavy_top_frac': 0.4963949528875303, 'weight_topheavy_low': 0.550088064868268, 'weight_topheavy_high': 5.953811342115056}. Best is trial 8 with value: 0.311927808073811.
[I 2026-04-21 17:47:29,398] Trial 2 finished with value: 0.12421685258806787 and parameters: {'hidden_dims': '[512, 128]', 'dropout': 0.2736730891340176, 'batch_norm': True, 'lr': 7.298114623433994e-05, 'weight_decay': 5.6346010385734023e-08, 'epochs': 185, 'loss': 'mae', 'optimizer': 'sgd', 'use_snp_selection': True, 'num_snps': 14091, 'weight_scheme': 'minmax', 'weight_clip_max': 10.0, 'weight_minmax_eps': 0.045780660776687306}. Best is trial 1 with value: 0.17926371090912027.
[I 2026-04-21 17:48:14,111] Trial 3 finished with value: 0.057919010856212934 and parameters: {'hidden_dims': '[512, 64]', 'dropout': 0.30157795416637295, 'batch_norm': False, 'lr': 2.007492282795256e-05, 'weight_decay': 5.496446859789657e-06, 'epochs': 284, 'loss': 'mse', 'optimizer': 'sgd', 'use_snp_selection': False, 'weight_scheme': 'linear', 'weight_clip_max': None, 'weight_linear_min_weight': 0.24682154527102826, 'weight_linear_max_weight': 1.8338910783134623}. Best is trial 1 with value: 0.17926371090912027.
[I 2026-04-21 17:48:19,685] Trial 14 finished with value: 0.2697912147122281 and parameters: {'hidden_dims': '[512, 64]', 'dropout': 0.38413708238452904, 'batch_norm': False, 'lr': 4.524744578502248e-06, 'weight_decay': 4.873331327451282e-05, 'epochs': 290, 'loss': 'mae', 'optimizer': 'adam', 'use_snp_selection': True, 'num_snps': 44094, 'weight_scheme': 'top-heavy', 'weight_clip_max': 5.0, 'weight_topheavy_top_frac': 0.4881878932644761, 'weight_topheavy_low': 0.5186849366402682, 'weight_topheavy_high': 5.887016439143736}. Best is trial 8 with value: 0.311927808073811.
[I 2026-04-21 17:48:28,292] Trial 4 finished with value: 0.16538637279026844 and parameters: {'hidden_dims': '[256, 64]', 'dropout': 0.18128694708490736, 'batch_norm': False, 'lr': 8.951826748007403e-05, 'weight_decay': 2.1781541495465197e-07, 'epochs': 147, 'loss': 'mse', 'optimizer': 'sgd', 'use_snp_selection': False, 'weight_scheme': 'top-heavy', 'weight_clip_max': 5.0, 'weight_topheavy_top_frac': 0.1724888194073277, 'weight_topheavy_low': 1.1620865802171172, 'weight_topheavy_high': 3.476906528073177}. Best is trial 1 with value: 0.17926371090912027.
[I 2026-04-21 17:48:40,344] Trial 5 finished with value: 0.09915568138023308 and parameters: {'hidden_dims': '[256, 64]', 'dropout': 0.2571412946970998, 'batch_norm': True, 'lr': 3.546238022482882e-05, 'weight_decay': 1.0185234767613396e-06, 'epochs': 119, 'loss': 'mse', 'optimizer': 'sgd', 'use_snp_selection': False, 'weight_scheme': 'linear', 'weight_clip_max': 10.0, 'weight_linear_min_weight': 0.9405832045183805, 'weight_linear_max_weight': 3.413610925325811}. Best is trial 1 with value: 0.17926371090912027.
[I 2026-04-21 17:48:48,429] Trial 15 finished with value: 0.2313563243058967 and parameters: {'hidden_dims': '[256, 128]', 'dropout': 0.3614358725351987, 'batch_norm': False, 'lr': 3.7713591516718997e-06, 'weight_decay': 3.611960120550373e-05, 'epochs': 103, 'loss': 'mae', 'optimizer': 'adam', 'use_snp_selection': True, 'num_snps': 41282, 'weight_scheme': 'top-heavy', 'weight_clip_max': 5.0, 'weight_topheavy_top_frac': 0.4934631047373426, 'weight_topheavy_low': 0.5083011009089765, 'weight_topheavy_high': 5.864317018097108}. Best is trial 8 with value: 0.311927808073811.
[I 2026-04-21 17:49:02,400] Trial 6 finished with value: 0.266724702478778 and parameters: {'hidden_dims': '[256, 64]', 'dropout': 0.037961443806696214, 'batch_norm': True, 'lr': 3.644202049829694e-05, 'weight_decay': 9.73334309820277e-06, 'epochs': 243, 'loss': 'mae', 'optimizer': 'adam', 'use_snp_selection': False, 'weight_scheme': 'minmax', 'weight_clip_max': None, 'weight_minmax_eps': 0.08689611239934374}. Best is trial 6 with value: 0.266724702478778.
[I 2026-04-21 17:49:25,007] Trial 16 finished with value: 0.2385491977375238 and parameters: {'hidden_dims': '[256, 128]', 'dropout': 0.4639001418581067, 'batch_norm': False, 'lr': 1.0269722470731624e-06, 'weight_decay': 9.693509439159435e-07, 'epochs': 154, 'loss': 'mae', 'optimizer': 'adam', 'use_snp_selection': True, 'num_snps': 56385, 'weight_scheme': 'uniform', 'weight_clip_max': 5.0}. Best is trial 8 with value: 0.311927808073811.
[I 2026-04-21 17:49:43,860] Trial 17 finished with value: 0.25763650299569346 and parameters: {'hidden_dims': '[256, 128]', 'dropout': 0.12172326112044618, 'batch_norm': False, 'lr': 3.825815682104746e-06, 'weight_decay': 1.4482685783208249e-07, 'epochs': 227, 'loss': 'mae', 'optimizer': 'adam', 'use_snp_selection': True, 'num_snps': 5013, 'weight_scheme': 'exponential', 'weight_clip_max': 5.0, 'weight_exponential_beta': 7.27113181250397}. Best is trial 8 with value: 0.311927808073811.
[I 2026-04-21 17:49:50,332] Trial 7 finished with value: 0.08654070478373473 and parameters: {'hidden_dims': '[512, 128]', 'dropout': 0.1304538168539244, 'batch_norm': False, 'lr': 1.5408060926311233e-05, 'weight_decay': 2.1989735568314356e-08, 'epochs': 250, 'loss': 'mse', 'optimizer': 'sgd', 'use_snp_selection': True, 'num_snps': 42550, 'weight_scheme': 'exponential', 'weight_clip_max': 10.0, 'weight_exponential_beta': 2.758850226029358}. Best is trial 6 with value: 0.266724702478778.
[I 2026-04-21 17:50:14,510] Trial 8 finished with value: 0.2775438798006226 and parameters: {'hidden_dims': '[256, 128]', 'dropout': 0.05742396906738376, 'batch_norm': False, 'lr': 1.9761509510575143e-06, 'weight_decay': 2.933492239224291e-07, 'epochs': 82, 'loss': 'mae', 'optimizer': 'adam', 'use_snp_selection': True, 'num_snps': 29883, 'weight_scheme': 'minmax', 'weight_clip_max': 5.0, 'weight_minmax_eps': 0.0051288771726799584}. Best is trial 8 with value: 0.2775438798006226.
[I 2026-04-21 17:50:29,524] Trial 18 finished with value: 0.2737287524277392 and parameters: {'hidden_dims': '[512, 64]', 'dropout': 0.3746141160425769, 'batch_norm': False, 'lr': 6.701152200847052e-06, 'weight_decay': 1.221562835646178e-08, 'epochs': 266, 'loss': 'mae', 'optimizer': 'adam', 'use_snp_selection': True, 'num_snps': 38817, 'weight_scheme': 'top-heavy', 'weight_clip_max': 10.0, 'weight_topheavy_top_frac': 0.32229589440842443, 'weight_topheavy_low': 0.8127667748839191, 'weight_topheavy_high': 1.2518001194921156}. Best is trial 8 with value: 0.311927808073811.
[I 2026-04-21 17:50:44,584] Trial 9 finished with value: 0.28783177050932224 and parameters: {'hidden_dims': '[256, 128]', 'dropout': 0.5795930447285386, 'batch_norm': False, 'lr': 0.00011782025260263196, 'weight_decay': 0.0005562063174273634, 'epochs': 218, 'loss': 'mae', 'optimizer': 'adamw', 'use_snp_selection': True, 'num_snps': 32226, 'weight_scheme': 'minmax', 'weight_clip_max': 5.0, 'weight_minmax_eps': 0.09600289105543994}. Best is trial 9 with value: 0.28783177050932224.
[I 2026-04-21 17:51:15,135] Trial 19 finished with value: 0.2913259994273303 and parameters: {'hidden_dims': '[512, 128]', 'dropout': 0.519463299702004, 'batch_norm': False, 'lr': 1.747938408387215e-06, 'weight_decay': 0.0001826536338525152, 'epochs': 188, 'loss': 'mae', 'optimizer': 'adam', 'use_snp_selection': True, 'num_snps': 48407, 'weight_scheme': 'top-heavy', 'weight_clip_max': None, 'weight_topheavy_top_frac': 0.3368048067044985, 'weight_topheavy_low': 0.7847803370055814, 'weight_topheavy_high': 4.090329931934454}. Best is trial 8 with value: 0.311927808073811.
[I 2026-04-21 17:51:22,947] Trial 10 finished with value: 0.0 and parameters: {'hidden_dims': '[256, 128]', 'dropout': 0.5982265091674299, 'batch_norm': False, 'lr': 0.0009667920285641304, 'weight_decay': 0.0007065067205778983, 'epochs': 203, 'loss': 'mae', 'optimizer': 'adamw', 'use_snp_selection': True, 'num_snps': 54689, 'weight_scheme': 'uniform', 'weight_clip_max': 5.0}. Best is trial 9 with value: 0.28783177050932224.
[I 2026-04-21 17:51:37,258] Trial 20 finished with value: 0.25962807579693004 and parameters: {'hidden_dims': '[256, 128]', 'dropout': 0.31870325620468937, 'batch_norm': False, 'lr': 2.6555876840359365e-06, 'weight_decay': 1.9881424794583757e-05, 'epochs': 85, 'loss': 'mae', 'optimizer': 'adam', 'use_snp_selection': True, 'num_snps': 22382, 'weight_scheme': 'exponential', 'weight_clip_max': 5.0, 'weight_exponential_beta': 0.8545723917658798}. Best is trial 8 with value: 0.311927808073811.
[I 2026-04-21 17:51:47,270] Trial 11 finished with value: 0.08003930767272982 and parameters: {'hidden_dims': '[256, 128]', 'dropout': 0.48179236930737634, 'batch_norm': False, 'lr': 1.1830949396742993e-06, 'weight_decay': 0.0004164439942178998, 'epochs': 80, 'loss': 'mae', 'optimizer': 'adam', 'use_snp_selection': True, 'num_snps': 30988, 'weight_scheme': 'minmax', 'weight_clip_max': 5.0, 'weight_minmax_eps': 0.005209797941978697}. Best is trial 9 with value: 0.28783177050932224.
[I 2026-04-21 17:52:12,917] Trial 12 finished with value: 0.17894967326280073 and parameters: {'hidden_dims': '[256, 128]', 'dropout': 0.433539489022426, 'batch_norm': False, 'lr': 1.6672985638477092e-06, 'weight_decay': 6.689606431240055e-07, 'epochs': 61, 'loss': 'mae', 'optimizer': 'adamw', 'use_snp_selection': True, 'num_snps': 39224, 'weight_scheme': 'minmax', 'weight_clip_max': 5.0, 'weight_minmax_eps': 0.1815169394876332}. Best is trial 9 with value: 0.28783177050932224.
[I 2026-04-21 17:52:21,924] Trial 21 finished with value: 0.2900175157422699 and parameters: {'hidden_dims': '[512, 128]', 'dropout': 0.5244336267448296, 'batch_norm': False, 'lr': 2.1616606842463478e-06, 'weight_decay': 0.00020047597512377164, 'epochs': 187, 'loss': 'mae', 'optimizer': 'adam', 'use_snp_selection': True, 'num_snps': 49177, 'weight_scheme': 'top-heavy', 'weight_clip_max': None, 'weight_topheavy_top_frac': 0.32798876890307904, 'weight_topheavy_low': 0.7934345799739425, 'weight_topheavy_high': 4.023622377382603}. Best is trial 8 with value: 0.311927808073811.
[I 2026-04-21 17:52:37,080] Trial 13 finished with value: 0.2927175038146237 and parameters: {'hidden_dims': '[256, 128]', 'dropout': 0.39617155092414635, 'batch_norm': False, 'lr': 4.064964875006351e-06, 'weight_decay': 4.026950095019044e-05, 'epochs': 219, 'loss': 'mae', 'optimizer': 'adam', 'use_snp_selection': True, 'num_snps': 19345, 'weight_scheme': 'top-heavy', 'weight_clip_max': 5.0, 'weight_topheavy_top_frac': 0.4963949528875303, 'weight_topheavy_low': 0.550088064868268, 'weight_topheavy_high': 5.953811342115056}. Best is trial 13 with value: 0.2927175038146237.
[I 2026-04-21 17:52:57,169] Trial 14 finished with value: 0.2857318298576981 and parameters: {'hidden_dims': '[512, 64]', 'dropout': 0.5838641223835469, 'batch_norm': False, 'lr': 4.498531431287445e-06, 'weight_decay': 6.272557910831268e-05, 'epochs': 219, 'loss': 'mae', 'optimizer': 'adamw', 'use_snp_selection': True, 'num_snps': 6357, 'weight_scheme': 'top-heavy', 'weight_clip_max': 5.0, 'weight_topheavy_top_frac': 0.4881878932644761, 'weight_topheavy_low': 0.5186849366402682, 'weight_topheavy_high': 5.887016439143736}. Best is trial 13 with value: 0.2927175038146237.
[I 2026-04-21 17:53:11,223] Trial 22 finished with value: 0.2772010638133809 and parameters: {'hidden_dims': '[512, 128]', 'dropout': 0.4399737635408029, 'batch_norm': False, 'lr': 7.921667986425213e-06, 'weight_decay': 0.0001467411154483958, 'epochs': 217, 'loss': 'mae', 'optimizer': 'adam', 'use_snp_selection': True, 'num_snps': 50150, 'weight_scheme': 'top-heavy', 'weight_clip_max': None, 'weight_topheavy_top_frac': 0.3862247199310327, 'weight_topheavy_low': 0.6788321855286736, 'weight_topheavy_high': 4.019894430326275}. Best is trial 8 with value: 0.311927808073811.
[I 2026-04-21 17:53:23,510] Trial 15 finished with value: 0.24496696248902272 and parameters: {'hidden_dims': '[256, 128]', 'dropout': 0.40965405536846, 'batch_norm': False, 'lr': 0.0003855414002929558, 'weight_decay': 9.110857767307e-05, 'epochs': 293, 'loss': 'mae', 'optimizer': 'adam', 'use_snp_selection': True, 'num_snps': 20796, 'weight_scheme': 'top-heavy', 'weight_clip_max': 5.0, 'weight_topheavy_top_frac': 0.4934631047373426, 'weight_topheavy_low': 0.5083011009089765, 'weight_topheavy_high': 5.864317018097108}. Best is trial 13 with value: 0.2927175038146237.
[I 2026-04-21 17:53:45,991] Trial 16 finished with value: 0.2814550353766217 and parameters: {'hidden_dims': '[256, 128]', 'dropout': 0.5156608340936006, 'batch_norm': False, 'lr': 4.594334080849598e-06, 'weight_decay': 0.0001383469425476121, 'epochs': 247, 'loss': 'mae', 'optimizer': 'adamw', 'use_snp_selection': True, 'num_snps': 14699, 'weight_scheme': 'uniform', 'weight_clip_max': 5.0}. Best is trial 13 with value: 0.2927175038146237.
[I 2026-04-21 17:53:47,508] Trial 23 finished with value: 0.25733684269847934 and parameters: {'hidden_dims': '[512, 128]', 'dropout': 0.5348919040177501, 'batch_norm': False, 'lr': 1.0383012544773797e-06, 'weight_decay': 0.00013079222169655813, 'epochs': 173, 'loss': 'mae', 'optimizer': 'adam', 'use_snp_selection': True, 'num_snps': 36406, 'weight_scheme': 'top-heavy', 'weight_clip_max': None, 'weight_topheavy_top_frac': 0.07353716508242492, 'weight_topheavy_low': 1.0051280016184463, 'weight_topheavy_high': 5.00126045440838}. Best is trial 8 with value: 0.311927808073811.
[I 2026-04-21 17:54:16,190] Trial 17 finished with value: 0.2833431851264578 and parameters: {'hidden_dims': '[256, 128]', 'dropout': 0.35834956058625744, 'batch_norm': False, 'lr': 0.00020443838492516264, 'weight_decay': 1.7558369224528136e-05, 'epochs': 171, 'loss': 'mae', 'optimizer': 'adamw', 'use_snp_selection': True, 'num_snps': 38974, 'weight_scheme': 'exponential', 'weight_clip_max': 5.0, 'weight_exponential_beta': 7.27113181250397}. Best is trial 13 with value: 0.2927175038146237.
[I 2026-04-21 17:54:29,806] Trial 24 finished with value: 0.25512713613732496 and parameters: {'hidden_dims': '[512, 128]', 'dropout': 0.4189370551640803, 'batch_norm': False, 'lr': 2.5101358306784074e-06, 'weight_decay': 1.7799098940303896e-06, 'epochs': 124, 'loss': 'mae', 'optimizer': 'adam', 'use_snp_selection': True, 'num_snps': 58871, 'weight_scheme': 'top-heavy', 'weight_clip_max': None, 'weight_topheavy_top_frac': 0.2278101689464145, 'weight_topheavy_low': 0.6559839824701373, 'weight_topheavy_high': 2.5438780020929332}. Best is trial 8 with value: 0.311927808073811.
[I 2026-04-21 17:55:04,222] Trial 25 finished with value: 0.2890150137098437 and parameters: {'hidden_dims': '[256, 128]', 'dropout': 0.009024184092968845, 'batch_norm': False, 'lr': 1.3095514824371148e-05, 'weight_decay': 1.3874600665319258e-05, 'epochs': 202, 'loss': 'mae', 'optimizer': 'adam', 'use_snp_selection': True, 'num_snps': 47420, 'weight_scheme': 'uniform', 'weight_clip_max': None}. Best is trial 8 with value: 0.311927808073811.
[I 2026-04-21 17:55:06,915] Trial 18 finished with value: 0.3001101630596679 and parameters: {'hidden_dims': '[512, 64]', 'dropout': 0.5421209625055308, 'batch_norm': False, 'lr': 5.801667557491868e-06, 'weight_decay': 0.0002818049496875481, 'epochs': 216, 'loss': 'mae', 'optimizer': 'adam', 'use_snp_selection': True, 'num_snps': 50758, 'weight_scheme': 'top-heavy', 'weight_clip_max': 10.0, 'weight_topheavy_top_frac': 0.32229589440842443, 'weight_topheavy_low': 0.8127667748839191, 'weight_topheavy_high': 1.2518001194921156}. Best is trial 18 with value: 0.3001101630596679.
[I 2026-04-21 17:55:31,603] Trial 26 finished with value: 0.19096358517116596 and parameters: {'hidden_dims': '[512, 128]', 'dropout': 0.4886801804636921, 'batch_norm': True, 'lr': 5.798157624326023e-06, 'weight_decay': 8.992712691694051e-05, 'epochs': 168, 'loss': 'mae', 'optimizer': 'adamw', 'use_snp_selection': False, 'weight_scheme': 'top-heavy', 'weight_clip_max': 5.0, 'weight_topheavy_top_frac': 0.4123031252544045, 'weight_topheavy_low': 0.9650207128756032, 'weight_topheavy_high': 4.9380984745440735}. Best is trial 8 with value: 0.311927808073811.
[I 2026-04-21 17:56:10,607] Trial 19 finished with value: 0.29465560789925305 and parameters: {'hidden_dims': '[512, 64]', 'dropout': 0.49398809927612813, 'batch_norm': False, 'lr': 4.003175045721197e-06, 'weight_decay': 1.805035590676873e-05, 'epochs': 268, 'loss': 'mae', 'optimizer': 'adam', 'use_snp_selection': True, 'num_snps': 59896, 'weight_scheme': 'top-heavy', 'weight_clip_max': 10.0, 'weight_topheavy_top_frac': 0.35167489710072086, 'weight_topheavy_low': 0.8422079086312008, 'weight_topheavy_high': 1.9357987569521864}. Best is trial 18 with value: 0.3001101630596679.
[I 2026-04-21 17:56:10,929] Trial 27 finished with value: 0.262229424461502 and parameters: {'hidden_dims': '[512, 64]', 'dropout': 0.23789233426343318, 'batch_norm': False, 'lr': 2.9699815371725772e-06, 'weight_decay': 0.0003100551921742246, 'epochs': 237, 'loss': 'mae', 'optimizer': 'adam', 'use_snp_selection': True, 'num_snps': 33202, 'weight_scheme': 'top-heavy', 'weight_clip_max': 5.0, 'weight_topheavy_top_frac': 0.4228444952830065, 'weight_topheavy_low': 0.6802679928208032, 'weight_topheavy_high': 2.809802589129951}. Best is trial 8 with value: 0.311927808073811.
[I 2026-04-21 17:56:39,119] Trial 28 finished with value: 0.31501852155860727 and parameters: {'hidden_dims': '[256, 128]', 'dropout': 0.3416767053954203, 'batch_norm': False, 'lr': 1.845647606403707e-06, 'weight_decay': 2.3902963605400828e-06, 'epochs': 263, 'loss': 'mae', 'optimizer': 'adam', 'use_snp_selection': True, 'num_snps': 27453, 'weight_scheme': 'minmax', 'weight_clip_max': None, 'weight_minmax_eps': 0.0029465178944929845}. Best is trial 28 with value: 0.31501852155860727.
