[I 2026-04-29 23:03:34,949] Trial 57 finished with value: 0.1808792038143373 and parameters: {'alpha': 467069.01386022597, 'use_snp_selection': False, 'iw_method': 'pc_logistic', 'iw_clip_max': 2.0, 'iw_prob_clip': 0.034035299335857215, 'iw_n_components': 10, 'iw_logistic_c': 0.017676625296682593, 'iw_pca_fit': 'combined', 'iw_solver': 'lbfgs', 'iw_rho': 0.5}. Best is trial 22 with value: 0.1853277333747545.
[I 2026-04-29 23:04:35,215] Trial 58 finished with value: 0.17814523769577623 and parameters: {'alpha': 389047.06780568167, 'use_snp_selection': False, 'iw_method': 'uniform'}. Best is trial 22 with value: 0.1853277333747545.
[I 2026-04-29 23:09:41,905] Trial 59 finished with value: 0.18258703466334386 and parameters: {'alpha': 281910.8743429753, 'use_snp_selection': False, 'iw_method': 'pc_logistic', 'iw_clip_max': 2.0, 'iw_prob_clip': 0.044274280669084703, 'iw_n_components': 20, 'iw_logistic_c': 1.8759024826111224, 'iw_pca_fit': 'combined', 'iw_solver': 'lbfgs', 'iw_rho': 0.5}. Best is trial 22 with value: 0.1853277333747545.
[I 2026-04-29 23:13:45,752] Trial 60 finished with value: 0.17581624763730397 and parameters: {'alpha': 505137.7484081936, 'use_snp_selection': False, 'iw_method': 'pc_logistic', 'iw_clip_max': 2.0, 'iw_prob_clip': 0.0287348121112829, 'iw_n_components': 5, 'iw_logistic_c': 0.004833977313229158, 'iw_pca_fit': 'combined', 'iw_solver': 'lbfgs', 'iw_rho': 0.5}. Best is trial 22 with value: 0.1853277333747545.
[I 2026-04-29 23:18:59,074] Trial 61 finished with value: 0.18331755346668066 and parameters: {'alpha': 528305.9928878786, 'use_snp_selection': False, 'iw_method': 'pc_logistic', 'iw_clip_max': 2.0, 'iw_prob_clip': 0.02884206059597871, 'iw_n_components': 30, 'iw_logistic_c': 0.011192446655360897, 'iw_pca_fit': 'combined', 'iw_solver': 'lbfgs', 'iw_rho': 0.5}. Best is trial 22 with value: 0.1853277333747545.
[I 2026-04-29 23:24:09,365] Trial 62 finished with value: 0.18446175442525262 and parameters: {'alpha': 695412.2371963476, 'use_snp_selection': False, 'iw_method': 'pc_logistic', 'iw_clip_max': 2.0, 'iw_prob_clip': 0.03343973923787766, 'iw_n_components': 30, 'iw_logistic_c': 0.001858484914143459, 'iw_pca_fit': 'combined', 'iw_solver': 'lbfgs', 'iw_rho': 0.5}. Best is trial 22 with value: 0.1853277333747545.
[I 2026-04-29 23:29:21,105] Trial 63 finished with value: 0.18310397893550226 and parameters: {'alpha': 691352.5233623969, 'use_snp_selection': False, 'iw_method': 'pc_logistic', 'iw_clip_max': 2.0, 'iw_prob_clip': 0.01932965815699096, 'iw_n_components': 30, 'iw_logistic_c': 0.00045430984931871135, 'iw_pca_fit': 'combined', 'iw_solver': 'lbfgs', 'iw_rho': 0.5}. Best is trial 22 with value: 0.1853277333747545.
[I 2026-04-29 23:33:15,357] Trial 64 finished with value: 0.1654680219520283 and parameters: {'alpha': 50207.26422256814, 'use_snp_selection': False, 'iw_method': 'pc_logistic', 'iw_clip_max': 2.0, 'iw_prob_clip': 0.037906183246296424, 'iw_n_components': 1, 'iw_logistic_c': 0.001486370185212809, 'iw_pca_fit': 'combined', 'iw_solver': 'lbfgs', 'iw_rho': 1.0}. Best is trial 22 with value: 0.1853277333747545.
[I 2026-04-29 23:38:27,512] Trial 65 finished with value: 0.18148202338062275 and parameters: {'alpha': 859903.0071258548, 'use_snp_selection': False, 'iw_method': 'pc_logistic', 'iw_clip_max': 3.0, 'iw_prob_clip': 0.025643168901784405, 'iw_n_components': 30, 'iw_logistic_c': 0.002986877478411846, 'iw_pca_fit': 'combined', 'iw_solver': 'lbfgs', 'iw_rho': 0.5}. Best is trial 22 with value: 0.1853277333747545.
[I 2026-04-29 23:43:44,151] Trial 66 finished with value: 0.1795228621752316 and parameters: {'alpha': 597730.0462506458, 'use_snp_selection': False, 'iw_method': 'pc_logistic', 'iw_clip_max': 1.5, 'iw_prob_clip': 0.0012870657124615915, 'iw_n_components': 40, 'iw_logistic_c': 4.749663690848105e-05, 'iw_pca_fit': 'combined', 'iw_solver': 'lbfgs', 'iw_rho': 0.5}. Best is trial 22 with value: 0.1853277333747545.
[I 2026-04-29 23:48:51,029] Trial 67 finished with value: 0.1852164147991175 and parameters: {'alpha': 435644.1643993682, 'use_snp_selection': False, 'iw_method': 'pc_logistic', 'iw_clip_max': 2.0, 'iw_prob_clip': 0.034024875616260816, 'iw_n_components': 20, 'iw_logistic_c': 0.041144824948238554, 'iw_pca_fit': 'combined', 'iw_solver': 'lbfgs', 'iw_rho': 0.75}. Best is trial 22 with value: 0.1853277333747545.
[I 2026-04-29 23:53:57,143] Trial 68 finished with value: 0.18045020984434396 and parameters: {'alpha': 347193.4742963231, 'use_snp_selection': False, 'iw_method': 'pc_logistic', 'iw_clip_max': 2.0, 'iw_prob_clip': 0.005629986433529809, 'iw_n_components': 20, 'iw_logistic_c': 0.039318312439369, 'iw_pca_fit': 'combined', 'iw_solver': 'lbfgs', 'iw_rho': 0.75}. Best is trial 22 with value: 0.1853277333747545.
[I 2026-04-29 23:59:02,630] Trial 69 finished with value: 0.1712356227003506 and parameters: {'alpha': 182292.76265917253, 'use_snp_selection': False, 'iw_method': 'pc_logistic', 'iw_clip_max': 5.0, 'iw_prob_clip': 0.022507719209084946, 'iw_n_components': 20, 'iw_logistic_c': 0.22145688388156315, 'iw_pca_fit': 'combined', 'iw_solver': 'lbfgs', 'iw_rho': 0.75}. Best is trial 22 with value: 0.1853277333747545.
[I 2026-04-30 00:00:02,846] Trial 70 finished with value: 0.17651810503817916 and parameters: {'alpha': 665623.3134836425, 'use_snp_selection': False, 'iw_method': 'uniform'}. Best is trial 22 with value: 0.1853277333747545.
[I 2026-04-30 00:05:09,493] Trial 71 finished with value: 0.1840968134321746 and parameters: {'alpha': 449557.3894861149, 'use_snp_selection': False, 'iw_method': 'pc_logistic', 'iw_clip_max': 2.0, 'iw_prob_clip': 0.03439059203354817, 'iw_n_components': 20, 'iw_logistic_c': 0.02167362207319338, 'iw_pca_fit': 'combined', 'iw_solver': 'lbfgs', 'iw_rho': 0.75}. Best is trial 22 with value: 0.1853277333747545.
[I 2026-04-30 00:10:33,291] Trial 72 finished with value: 0.18319280906593802 and parameters: {'alpha': 412505.12687034236, 'use_snp_selection': False, 'iw_method': 'pc_logistic', 'iw_clip_max': 2.0, 'iw_prob_clip': 0.031013855853877673, 'iw_n_components': 50, 'iw_logistic_c': 0.0871202242231754, 'iw_pca_fit': 'combined', 'iw_solver': 'lbfgs', 'iw_rho': 0.75}. Best is trial 22 with value: 0.1853277333747545.
[I 2026-04-30 00:15:40,241] Trial 73 finished with value: 0.18290818711275697 and parameters: {'alpha': 586984.7461349976, 'use_snp_selection': False, 'iw_method': 'pc_logistic', 'iw_clip_max': 2.0, 'iw_prob_clip': 0.04243127734816848, 'iw_n_components': 20, 'iw_logistic_c': 0.008239441105171432, 'iw_pca_fit': 'combined', 'iw_solver': 'lbfgs', 'iw_rho': 0.9}. Best is trial 22 with value: 0.1853277333747545.
[I 2026-04-30 00:20:54,420] Trial 74 finished with value: 0.18438774629753968 and parameters: {'alpha': 483635.7562706187, 'use_snp_selection': False, 'iw_method': 'pc_logistic', 'iw_clip_max': 2.0, 'iw_prob_clip': 0.036926196760970746, 'iw_n_components': 30, 'iw_logistic_c': 0.45293081794531864, 'iw_pca_fit': 'combined', 'iw_solver': 'lbfgs', 'iw_rho': 0.5}. Best is trial 22 with value: 0.1853277333747545.
[I 2026-04-30 00:25:58,046] Trial 75 finished with value: 0.18552589486069934 and parameters: {'alpha': 548689.6806342319, 'use_snp_selection': False, 'iw_method': 'pc_logistic', 'iw_clip_max': 2.0, 'iw_prob_clip': 0.026995744125965965, 'iw_n_components': 20, 'iw_logistic_c': 0.48411241971013624, 'iw_pca_fit': 'combined', 'iw_solver': 'lbfgs', 'iw_rho': 0.5}. Best is trial 75 with value: 0.18552589486069934.
[I 2026-04-30 00:31:06,392] Trial 76 finished with value: 0.18412662268974928 and parameters: {'alpha': 554836.7270974556, 'use_snp_selection': False, 'iw_method': 'pc_logistic', 'iw_clip_max': 2.0, 'iw_prob_clip': 0.026911899499252313, 'iw_n_components': 20, 'iw_logistic_c': 1.642460424942179, 'iw_pca_fit': 'combined', 'iw_solver': 'lbfgs', 'iw_rho': 0.5}. Best is trial 75 with value: 0.18552589486069934.
[I 2026-04-30 00:36:12,830] Trial 77 finished with value: 0.18129565426178756 and parameters: {'alpha': 712250.7536152002, 'use_snp_selection': False, 'iw_method': 'pc_logistic', 'iw_clip_max': 2.0, 'iw_prob_clip': 0.021738373839020483, 'iw_n_components': 20, 'iw_logistic_c': 0.1444924908016179, 'iw_pca_fit': 'combined', 'iw_solver': 'lbfgs', 'iw_rho': 0.75}. Best is trial 75 with value: 0.18552589486069934.
[I 2026-04-30 00:41:19,909] Trial 78 finished with value: 0.18354361147621 and parameters: {'alpha': 967963.1236524171, 'use_snp_selection': False, 'iw_method': 'pc_logistic', 'iw_clip_max': 2.0, 'iw_prob_clip': 0.002860150166691859, 'iw_n_components': 20, 'iw_logistic_c': 0.4227920017415741, 'iw_pca_fit': 'combined', 'iw_solver': 'lbfgs', 'iw_rho': 0.5}. Best is trial 75 with value: 0.18552589486069934.
[I 2026-04-30 00:46:26,651] Trial 79 finished with value: 0.18065524952339357 and parameters: {'alpha': 625717.8387359797, 'use_snp_selection': False, 'iw_method': 'pc_logistic', 'iw_clip_max': 3.0, 'iw_prob_clip': 0.023950722928342306, 'iw_n_components': 20, 'iw_logistic_c': 0.05511465492205542, 'iw_pca_fit': 'combined', 'iw_solver': 'lbfgs', 'iw_rho': 0.5}. Best is trial 75 with value: 0.18552589486069934.
[I 2026-04-30 00:51:34,068] Trial 80 finished with value: 0.18033011339074723 and parameters: {'alpha': 827517.9706950069, 'use_snp_selection': False, 'iw_method': 'pc_logistic', 'iw_clip_max': 2.0, 'iw_prob_clip': 0.018925566688883348, 'iw_n_components': 20, 'iw_logistic_c': 3.82750879959608, 'iw_pca_fit': 'combined', 'iw_solver': 'lbfgs', 'iw_rho': 1.0}. Best is trial 75 with value: 0.18552589486069934.
[I 2026-04-30 00:56:47,502] Trial 81 finished with value: 0.18453139358845178 and parameters: {'alpha': 488921.9257320803, 'use_snp_selection': False, 'iw_method': 'pc_logistic', 'iw_clip_max': 2.0, 'iw_prob_clip': 0.03708699257455272, 'iw_n_components': 30, 'iw_logistic_c': 0.5673474432133404, 'iw_pca_fit': 'combined', 'iw_solver': 'lbfgs', 'iw_rho': 0.5}. Best is trial 75 with value: 0.18552589486069934.
[I 2026-04-30 01:01:50,659] Trial 82 finished with value: 0.18472328655960318 and parameters: {'alpha': 384490.31290559494, 'use_snp_selection': False, 'iw_method': 'pc_logistic', 'iw_clip_max': 2.0, 'iw_prob_clip': 0.029876669453296742, 'iw_n_components': 20, 'iw_logistic_c': 9.103903809238094, 'iw_pca_fit': 'combined', 'iw_solver': 'lbfgs', 'iw_rho': 0.5}. Best is trial 75 with value: 0.18552589486069934.
[I 2026-04-30 01:06:55,935] Trial 83 finished with value: 0.18229510734104162 and parameters: {'alpha': 418665.41825388686, 'use_snp_selection': False, 'iw_method': 'pc_logistic', 'iw_clip_max': 2.0, 'iw_prob_clip': 0.04739883543498438, 'iw_n_components': 20, 'iw_logistic_c': 0.8085693101538101, 'iw_pca_fit': 'combined', 'iw_solver': 'lbfgs', 'iw_rho': 0.5}. Best is trial 75 with value: 0.18552589486069934.
[I 2026-04-30 01:12:02,696] Trial 84 finished with value: 0.18293767927579438 and parameters: {'alpha': 375536.46572482307, 'use_snp_selection': False, 'iw_method': 'pc_logistic', 'iw_clip_max': 2.0, 'iw_prob_clip': 0.028865022455228945, 'iw_n_components': 20, 'iw_logistic_c': 9.399880420713854, 'iw_pca_fit': 'combined', 'iw_solver': 'lbfgs', 'iw_rho': 0.5}. Best is trial 75 with value: 0.18552589486069934.
[I 2026-04-30 01:17:10,833] Trial 85 finished with value: 0.18434233875338746 and parameters: {'alpha': 490567.6674461722, 'use_snp_selection': False, 'iw_method': 'pc_logistic', 'iw_clip_max': 1.5, 'iw_prob_clip': 0.025688471775716617, 'iw_n_components': 20, 'iw_logistic_c': 0.1681146875848536, 'iw_pca_fit': 'combined', 'iw_solver': 'lbfgs', 'iw_rho': 0.5}. Best is trial 75 with value: 0.18552589486069934.
[I 2026-04-30 01:18:11,141] Trial 86 finished with value: 0.17845174934024538 and parameters: {'alpha': 328111.27712752466, 'use_snp_selection': False, 'iw_method': 'uniform'}. Best is trial 75 with value: 0.18552589486069934.
[I 2026-04-30 01:23:09,486] Trial 87 finished with value: 0.18052577081872084 and parameters: {'alpha': 548869.1580307115, 'use_snp_selection': False, 'iw_method': 'pc_logistic', 'iw_clip_max': 2.0, 'iw_prob_clip': 0.031437922964360994, 'iw_n_components': 10, 'iw_logistic_c': 3.4770743124548313, 'iw_pca_fit': 'combined', 'iw_solver': 'lbfgs', 'iw_rho': 0.5}. Best is trial 75 with value: 0.18552589486069934.
[I 2026-04-30 01:28:15,418] Trial 88 finished with value: 0.18311738578464387 and parameters: {'alpha': 449468.3323846177, 'use_snp_selection': False, 'iw_method': 'pc_logistic', 'iw_clip_max': 2.0, 'iw_prob_clip': 0.04118503025618526, 'iw_n_components': 20, 'iw_logistic_c': 0.35059644015810415, 'iw_pca_fit': 'combined', 'iw_solver': 'lbfgs', 'iw_rho': 0.5}. Best is trial 75 with value: 0.18552589486069934.
[I 2026-04-30 01:33:21,819] Trial 89 finished with value: 0.18256522125638278 and parameters: {'alpha': 399109.7185268418, 'use_snp_selection': False, 'iw_method': 'pc_logistic', 'iw_clip_max': 2.0, 'iw_prob_clip': 0.03710949857359995, 'iw_n_components': 20, 'iw_logistic_c': 0.9674573323361692, 'iw_pca_fit': 'combined', 'iw_solver': 'lbfgs', 'iw_rho': 0.9}. Best is trial 75 with value: 0.18552589486069934.
[I 2026-04-30 01:37:22,704] Trial 90 finished with value: 0.1689685520556344 and parameters: {'alpha': 514478.7953489425, 'use_snp_selection': False, 'iw_method': 'pc_logistic', 'iw_clip_max': 5.0, 'iw_prob_clip': 0.02044477856737538, 'iw_n_components': 5, 'iw_logistic_c': 4.224001339176846, 'iw_pca_fit': 'combined', 'iw_solver': 'lbfgs', 'iw_rho': 0.5}. Best is trial 75 with value: 0.18552589486069934.
[I 2026-04-30 01:42:34,201] Trial 91 finished with value: 0.18268106445334428 and parameters: {'alpha': 564760.5346552046, 'use_snp_selection': False, 'iw_method': 'pc_logistic', 'iw_clip_max': 2.0, 'iw_prob_clip': 0.03198225250733414, 'iw_n_components': 30, 'iw_logistic_c': 0.02723891781119195, 'iw_pca_fit': 'combined', 'iw_solver': 'lbfgs', 'iw_rho': 0.5}. Best is trial 75 with value: 0.18552589486069934.
[I 2026-04-30 01:46:30,276] Trial 92 finished with value: 0.1723193675251695 and parameters: {'alpha': 775533.8193696348, 'use_snp_selection': False, 'iw_method': 'pc_logistic', 'iw_clip_max': 2.0, 'iw_prob_clip': 0.028073804761728254, 'iw_n_components': 1, 'iw_logistic_c': 0.07759651475229536, 'iw_pca_fit': 'combined', 'iw_solver': 'lbfgs', 'iw_rho': 0.5}. Best is trial 75 with value: 0.18552589486069934.
[I 2026-04-30 01:51:54,149] Trial 93 finished with value: 0.18288732590930748 and parameters: {'alpha': 478329.0412616398, 'use_snp_selection': False, 'iw_method': 'pc_logistic', 'iw_clip_max': 2.0, 'iw_prob_clip': 0.04573675844704788, 'iw_n_components': 50, 'iw_logistic_c': 0.00653296496501594, 'iw_pca_fit': 'combined', 'iw_solver': 'lbfgs', 'iw_rho': 0.5}. Best is trial 75 with value: 0.18552589486069934.
[I 2026-04-30 01:57:07,341] Trial 94 finished with value: 0.1808002915479942 and parameters: {'alpha': 627505.178551511, 'use_snp_selection': False, 'iw_method': 'pc_logistic', 'iw_clip_max': 2.0, 'iw_prob_clip': 0.0021079881411640664, 'iw_n_components': 30, 'iw_logistic_c': 0.12148463420817528, 'iw_pca_fit': 'combined', 'iw_solver': 'lbfgs', 'iw_rho': 0.5}. Best is trial 75 with value: 0.18552589486069934.
[I 2026-04-30 02:02:11,580] Trial 95 finished with value: 0.18448181550371 and parameters: {'alpha': 733828.7492314365, 'use_snp_selection': False, 'iw_method': 'pc_logistic', 'iw_clip_max': 2.0, 'iw_prob_clip': 0.02377908120029585, 'iw_n_components': 20, 'iw_logistic_c': 0.0027544748958830785, 'iw_pca_fit': 'combined', 'iw_solver': 'lbfgs', 'iw_rho': 0.5}. Best is trial 75 with value: 0.18552589486069934.
[I 2026-04-30 02:07:17,690] Trial 96 finished with value: 0.1845071599514505 and parameters: {'alpha': 366347.07409865386, 'use_snp_selection': False, 'iw_method': 'pc_logistic', 'iw_clip_max': 2.0, 'iw_prob_clip': 0.025328248557715895, 'iw_n_components': 20, 'iw_logistic_c': 0.03959663371381861, 'iw_pca_fit': 'combined', 'iw_solver': 'lbfgs', 'iw_rho': 0.75}. Best is trial 75 with value: 0.18552589486069934.
[I 2026-04-30 02:12:24,578] Trial 97 finished with value: 0.1841713151363726 and parameters: {'alpha': 359040.8770478192, 'use_snp_selection': False, 'iw_method': 'pc_logistic', 'iw_clip_max': 2.0, 'iw_prob_clip': 0.016030252393225874, 'iw_n_components': 20, 'iw_logistic_c': 0.04211856301736773, 'iw_pca_fit': 'combined', 'iw_solver': 'lbfgs', 'iw_rho': 0.75}. Best is trial 75 with value: 0.18552589486069934.
[I 2026-04-30 02:17:45,717] Trial 98 finished with value: 0.18443065563014308 and parameters: {'alpha': 429912.1813898166, 'use_snp_selection': False, 'iw_method': 'pc_logistic', 'iw_clip_max': 2.0, 'iw_prob_clip': 0.026556644668674054, 'iw_n_components': 40, 'iw_logistic_c': 0.017765360267840428, 'iw_pca_fit': 'combined', 'iw_solver': 'lbfgs', 'iw_rho': 0.75}. Best is trial 75 with value: 0.18552589486069934.
[I 2026-04-30 02:18:45,807] Trial 99 finished with value: 0.1781827274926306 and parameters: {'alpha': 382318.7340747226, 'use_snp_selection': False, 'iw_method': 'uniform'}. Best is trial 75 with value: 0.18552589486069934.
[I 2026-04-30 02:23:50,676] Trial 100 finished with value: 0.1813263782781147 and parameters: {'alpha': 254250.2340196157, 'use_snp_selection': False, 'iw_method': 'pc_logistic', 'iw_clip_max': 2.0, 'iw_prob_clip': 0.021817546631579608, 'iw_n_components': 20, 'iw_logistic_c': 0.2956595651070655, 'iw_pca_fit': 'combined', 'iw_solver': 'lbfgs', 'iw_rho': 0.75}. Best is trial 75 with value: 0.18552589486069934.
[I 2026-04-30 02:28:54,116] Trial 101 finished with value: 0.1838408831290565 and parameters: {'alpha': 518780.41413208743, 'use_snp_selection': False, 'iw_method': 'pc_logistic', 'iw_clip_max': 2.0, 'iw_prob_clip': 0.02385902380301819, 'iw_n_components': 20, 'iw_logistic_c': 0.005157854678807293, 'iw_pca_fit': 'combined', 'iw_solver': 'lbfgs', 'iw_rho': 0.75}. Best is trial 75 with value: 0.18552589486069934.
[I 2026-04-30 02:33:59,378] Trial 102 finished with value: 0.18116962737278694 and parameters: {'alpha': 300856.83810594014, 'use_snp_selection': False, 'iw_method': 'pc_logistic', 'iw_clip_max': 2.0, 'iw_prob_clip': 0.031095689102087418, 'iw_n_components': 20, 'iw_logistic_c': 0.06736179530130998, 'iw_pca_fit': 'combined', 'iw_solver': 'lbfgs', 'iw_rho': 0.5}. Best is trial 75 with value: 0.18552589486069934.
[I 2026-04-30 02:39:03,343] Trial 103 finished with value: 0.18494598584719107 and parameters: {'alpha': 456884.28833733016, 'use_snp_selection': False, 'iw_method': 'pc_logistic', 'iw_clip_max': 2.0, 'iw_prob_clip': 0.024825883175026098, 'iw_n_components': 20, 'iw_logistic_c': 0.0034253972232525763, 'iw_pca_fit': 'combined', 'iw_solver': 'lbfgs', 'iw_rho': 0.5}. Best is trial 75 with value: 0.18552589486069934.
[I 2026-04-30 02:44:09,773] Trial 104 finished with value: 0.18274868621508036 and parameters: {'alpha': 472331.8621870984, 'use_snp_selection': False, 'iw_method': 'pc_logistic', 'iw_clip_max': 2.0, 'iw_prob_clip': 0.01768616985386161, 'iw_n_components': 20, 'iw_logistic_c': 0.013993683718034302, 'iw_pca_fit': 'combined', 'iw_solver': 'lbfgs', 'iw_rho': 0.5}. Best is trial 75 with value: 0.18552589486069934.
[I 2026-04-30 02:49:14,095] Trial 105 finished with value: 0.18144420839684264 and parameters: {'alpha': 416576.58704662835, 'use_snp_selection': False, 'iw_method': 'pc_logistic', 'iw_clip_max': 2.0, 'iw_prob_clip': 0.03559851051855704, 'iw_n_components': 20, 'iw_logistic_c': 1.305935268446591, 'iw_pca_fit': 'combined', 'iw_solver': 'lbfgs', 'iw_rho': 1.0}. Best is trial 75 with value: 0.18552589486069934.
[I 2026-04-30 02:54:20,038] Trial 106 finished with value: 0.18477434279653054 and parameters: {'alpha': 578266.5472806926, 'use_snp_selection': False, 'iw_method': 'pc_logistic', 'iw_clip_max': 1.5, 'iw_prob_clip': 0.03002473365791007, 'iw_n_components': 20, 'iw_logistic_c': 0.025188311276786238, 'iw_pca_fit': 'combined', 'iw_solver': 'lbfgs', 'iw_rho': 0.75}. Best is trial 75 with value: 0.18552589486069934.
[I 2026-04-30 02:59:23,895] Trial 107 finished with value: 0.18375175861237814 and parameters: {'alpha': 578343.9102260983, 'use_snp_selection': False, 'iw_method': 'pc_logistic', 'iw_clip_max': 1.5, 'iw_prob_clip': 0.029601137924577126, 'iw_n_components': 20, 'iw_logistic_c': 0.028597955324621935, 'iw_pca_fit': 'combined', 'iw_solver': 'lbfgs', 'iw_rho': 0.5}. Best is trial 75 with value: 0.18552589486069934.
[I 2026-04-30 03:04:28,056] Trial 108 finished with value: 0.1791752048356393 and parameters: {'alpha': 121859.3234101269, 'use_snp_selection': False, 'iw_method': 'pc_logistic', 'iw_clip_max': 1.5, 'iw_prob_clip': 0.03927698598988393, 'iw_n_components': 20, 'iw_logistic_c': 0.004134258184295819, 'iw_pca_fit': 'combined', 'iw_solver': 'lbfgs', 'iw_rho': 0.5}. Best is trial 75 with value: 0.18552589486069934.
[I 2026-04-30 03:09:25,057] Trial 109 finished with value: 0.18073260989224532 and parameters: {'alpha': 517899.2173887261, 'use_snp_selection': False, 'iw_method': 'pc_logistic', 'iw_clip_max': 1.5, 'iw_prob_clip': 0.036217972048942906, 'iw_n_components': 10, 'iw_logistic_c': 0.008812056860713707, 'iw_pca_fit': 'combined', 'iw_solver': 'lbfgs', 'iw_rho': 0.5}. Best is trial 75 with value: 0.18552589486069934.
[I 2026-04-30 03:14:31,369] Trial 110 finished with value: 0.18535328889232452 and parameters: {'alpha': 438230.70906804584, 'use_snp_selection': False, 'iw_method': 'pc_logistic', 'iw_clip_max': 1.5, 'iw_prob_clip': 0.027141305123638302, 'iw_n_components': 20, 'iw_logistic_c': 0.5977430288821751, 'iw_pca_fit': 'combined', 'iw_solver': 'lbfgs', 'iw_rho': 0.9}. Best is trial 75 with value: 0.18552589486069934.
[I 2026-04-30 03:19:36,178] Trial 111 finished with value: 0.18360360753006066 and parameters: {'alpha': 450593.77199253725, 'use_snp_selection': False, 'iw_method': 'pc_logistic', 'iw_clip_max': 1.5, 'iw_prob_clip': 0.027928314487694072, 'iw_n_components': 20, 'iw_logistic_c': 0.1966534329447241, 'iw_pca_fit': 'combined', 'iw_solver': 'lbfgs', 'iw_rho': 0.9}. Best is trial 75 with value: 0.18552589486069934.
