[I 2026-04-21 19:01:00,558] Trial 19 finished with value: 0.14043722991393223 and parameters: {'hidden_dims': '[512, 64]', 'dropout': 0.3611830575945544, 'batch_norm': True, 'lr': 2.938656081842103e-06, 'weight_decay': 1.8884632239496208e-06, 'epochs': 192, 'loss': 'mae', 'optimizer': 'adam', 'use_snp_selection': False, 'weight_scheme': 'uniform', 'weight_clip_max': None}. Best is trial 6 with value: 0.20382757753501488.
[I 2026-04-21 19:01:17,285] Trial 13 finished with value: 0.08208731039151602 and parameters: {'hidden_dims': '[512, 128]', 'dropout': 0.39617155092414635, 'batch_norm': False, 'lr': 5.5499656564214575e-06, 'weight_decay': 8.977197921256364e-08, 'epochs': 171, 'loss': 'mae', 'optimizer': 'adam', 'use_snp_selection': True, 'num_snps': 17238, 'weight_scheme': 'top-heavy', 'weight_clip_max': 10.0, 'weight_topheavy_top_frac': 0.4963949528875303, 'weight_topheavy_low': 0.550088064868268, 'weight_topheavy_high': 5.953811342115056}. Best is trial 2 with value: 0.15149538719366348.
[I 2026-04-21 19:01:20,972] Trial 20 finished with value: 0.13710365575761266 and parameters: {'hidden_dims': '[256, 64]', 'dropout': 0.13353142750080285, 'batch_norm': True, 'lr': 1.0113497329813407e-05, 'weight_decay': 1.86245405137557e-05, 'epochs': 233, 'loss': 'mae', 'optimizer': 'adamw', 'use_snp_selection': False, 'weight_scheme': 'exponential', 'weight_clip_max': 10.0, 'weight_exponential_beta': 0.5791266793192458}. Best is trial 6 with value: 0.20382757753501488.
[I 2026-04-21 19:01:39,344] Trial 21 finished with value: 0.18177746495276423 and parameters: {'hidden_dims': '[256, 128]', 'dropout': 0.5826613778652056, 'batch_norm': False, 'lr': 0.00017569142110588896, 'weight_decay': 0.0009769004423973628, 'epochs': 271, 'loss': 'mae', 'optimizer': 'adamw', 'use_snp_selection': True, 'num_snps': 5420, 'weight_scheme': 'minmax', 'weight_clip_max': 5.0, 'weight_minmax_eps': 0.11101477035873417}. Best is trial 6 with value: 0.20382757753501488.
[I 2026-04-21 19:01:43,321] Trial 14 finished with value: 0.06153651896883789 and parameters: {'hidden_dims': '[512, 128]', 'dropout': 0.5593992231258815, 'batch_norm': False, 'lr': 0.0004084446691088672, 'weight_decay': 6.625947704431648e-07, 'epochs': 192, 'loss': 'mae', 'optimizer': 'adam', 'use_snp_selection': True, 'num_snps': 17991, 'weight_scheme': 'exponential', 'weight_clip_max': 5.0, 'weight_exponential_beta': 7.792631903976359}. Best is trial 2 with value: 0.15149538719366348.
[I 2026-04-21 19:01:59,725] Trial 22 finished with value: 0.16895859186425932 and parameters: {'hidden_dims': '[256, 128]', 'dropout': 0.525988804208465, 'batch_norm': False, 'lr': 0.000274691428715055, 'weight_decay': 0.0008220292730825433, 'epochs': 272, 'loss': 'mae', 'optimizer': 'adamw', 'use_snp_selection': True, 'num_snps': 10080, 'weight_scheme': 'minmax', 'weight_clip_max': 5.0, 'weight_minmax_eps': 0.13328205321292907}. Best is trial 6 with value: 0.20382757753501488.
[I 2026-04-21 19:02:18,226] Trial 23 finished with value: 0.18278479176788642 and parameters: {'hidden_dims': '[256, 128]', 'dropout': 0.5978384496843239, 'batch_norm': False, 'lr': 6.140635700718028e-05, 'weight_decay': 0.00021930613404808348, 'epochs': 267, 'loss': 'mae', 'optimizer': 'adamw', 'use_snp_selection': True, 'num_snps': 5763, 'weight_scheme': 'minmax', 'weight_clip_max': 5.0, 'weight_minmax_eps': 0.06766374473279113}. Best is trial 6 with value: 0.20382757753501488.
[I 2026-04-21 19:02:24,825] Trial 15 finished with value: 0.09295917401447773 and parameters: {'hidden_dims': '[512, 64]', 'dropout': 0.31944698569757696, 'batch_norm': True, 'lr': 5.07341268273934e-06, 'weight_decay': 3.504132313163254e-08, 'epochs': 120, 'loss': 'mae', 'optimizer': 'adamw', 'use_snp_selection': True, 'num_snps': 58128, 'weight_scheme': 'uniform', 'weight_clip_max': 5.0}. Best is trial 2 with value: 0.15149538719366348.
[I 2026-04-21 19:02:37,112] Trial 24 finished with value: 0.18546428713984034 and parameters: {'hidden_dims': '[256, 128]', 'dropout': 0.49352280030344137, 'batch_norm': False, 'lr': 5.451788799000617e-05, 'weight_decay': 0.0002622624916942673, 'epochs': 300, 'loss': 'mae', 'optimizer': 'adamw', 'use_snp_selection': True, 'num_snps': 6210, 'weight_scheme': 'minmax', 'weight_clip_max': 5.0, 'weight_minmax_eps': 0.052831337928891824}. Best is trial 6 with value: 0.20382757753501488.
[I 2026-04-21 19:02:45,278] Trial 16 finished with value: 0.06595911497835766 and parameters: {'hidden_dims': '[512, 128]', 'dropout': 0.48703854959759774, 'batch_norm': True, 'lr': 1.085066048984918e-06, 'weight_decay': 1.0919337823019357e-06, 'epochs': 53, 'loss': 'mae', 'optimizer': 'adam', 'use_snp_selection': True, 'num_snps': 16870, 'weight_scheme': 'minmax', 'weight_clip_max': 10.0, 'weight_minmax_eps': 0.04704205361910894}. Best is trial 2 with value: 0.15149538719366348.
[I 2026-04-21 19:03:01,846] Trial 25 finished with value: 0.1579973396450084 and parameters: {'hidden_dims': '[256, 128]', 'dropout': 0.4894968122949714, 'batch_norm': False, 'lr': 4.3303561072363065e-05, 'weight_decay': 0.00019307006751599428, 'epochs': 288, 'loss': 'mae', 'optimizer': 'adamw', 'use_snp_selection': True, 'num_snps': 18210, 'weight_scheme': 'top-heavy', 'weight_clip_max': 5.0, 'weight_topheavy_top_frac': 0.07016163772926179, 'weight_topheavy_low': 0.7993468918419773, 'weight_topheavy_high': 1.5210219265792069}. Best is trial 6 with value: 0.20382757753501488.
[I 2026-04-21 19:03:21,739] Trial 26 finished with value: 0.15708683853089064 and parameters: {'hidden_dims': '[256, 128]', 'dropout': 0.39011063475894947, 'batch_norm': False, 'lr': 5.964415208726229e-05, 'weight_decay': 1.602095705059041e-05, 'epochs': 50, 'loss': 'mae', 'optimizer': 'adam', 'use_snp_selection': True, 'num_snps': 19700, 'weight_scheme': 'minmax', 'weight_clip_max': 5.0, 'weight_minmax_eps': 0.04925576196436048}. Best is trial 6 with value: 0.20382757753501488.
[I 2026-04-21 19:03:37,023] Trial 17 finished with value: 0.10596419946894925 and parameters: {'hidden_dims': '[512, 128]', 'dropout': 0.36148606277268513, 'batch_norm': False, 'lr': 0.0002637584018874893, 'weight_decay': 1.1440163587131493e-08, 'epochs': 298, 'loss': 'mae', 'optimizer': 'sgd', 'use_snp_selection': True, 'num_snps': 43233, 'weight_scheme': 'minmax', 'weight_clip_max': 5.0, 'weight_minmax_eps': 0.043795555850857426}. Best is trial 2 with value: 0.15149538719366348.
[I 2026-04-21 19:03:40,489] Trial 27 finished with value: 0.18457235487816315 and parameters: {'hidden_dims': '[256, 128]', 'dropout': 0.4680675460561884, 'batch_norm': False, 'lr': 2.0796188854240293e-05, 'weight_decay': 8.948144335581161e-05, 'epochs': 300, 'loss': 'mae', 'optimizer': 'adamw', 'use_snp_selection': True, 'num_snps': 6117, 'weight_scheme': 'minmax', 'weight_clip_max': 5.0, 'weight_minmax_eps': 0.050894665555342264}. Best is trial 6 with value: 0.20382757753501488.
[I 2026-04-21 19:03:59,092] Trial 18 finished with value: 0.05678497879941253 and parameters: {'hidden_dims': '[512, 128]', 'dropout': 0.4886714735114618, 'batch_norm': False, 'lr': 6.524525825420982e-05, 'weight_decay': 7.993215211163833e-08, 'epochs': 148, 'loss': 'mae', 'optimizer': 'adam', 'use_snp_selection': True, 'num_snps': 13088, 'weight_scheme': 'minmax', 'weight_clip_max': 10.0, 'weight_minmax_eps': 0.048706468073068616}. Best is trial 2 with value: 0.15149538719366348.
[I 2026-04-21 19:04:19,935] Trial 28 finished with value: 0.1787910338852491 and parameters: {'hidden_dims': '[256, 128]', 'dropout': 0.4708694327585582, 'batch_norm': False, 'lr': 2.207347898971067e-05, 'weight_decay': 8.759889775054586e-05, 'epochs': 299, 'loss': 'mae', 'optimizer': 'adam', 'use_snp_selection': True, 'num_snps': 47847, 'weight_scheme': 'minmax', 'weight_clip_max': 5.0, 'weight_minmax_eps': 0.020539477830502962}. Best is trial 6 with value: 0.20382757753501488.
[I 2026-04-21 19:04:31,060] Trial 19 finished with value: 0.08082867686333679 and parameters: {'hidden_dims': '[512, 64]', 'dropout': 0.2383077181800748, 'batch_norm': True, 'lr': 1.041689618787969e-06, 'weight_decay': 6.313466147584312e-05, 'epochs': 225, 'loss': 'mae', 'optimizer': 'adamw', 'use_snp_selection': True, 'num_snps': 24357, 'weight_scheme': 'uniform', 'weight_clip_max': None}. Best is trial 2 with value: 0.15149538719366348.
[I 2026-04-21 19:04:44,554] Trial 29 finished with value: 0.13864738468333668 and parameters: {'hidden_dims': '[256, 128]', 'dropout': 0.22527063367873518, 'batch_norm': False, 'lr': 1.1320977519076634e-05, 'weight_decay': 2.6473659004375662e-05, 'epochs': 246, 'loss': 'mse', 'optimizer': 'adamw', 'use_snp_selection': True, 'num_snps': 20429, 'weight_scheme': 'minmax', 'weight_clip_max': 5.0, 'weight_minmax_eps': 0.03996050208609887}. Best is trial 6 with value: 0.20382757753501488.
[I 2026-04-21 19:05:00,621] Trial 20 finished with value: 0.05750010007234688 and parameters: {'hidden_dims': '[512, 128]', 'dropout': 0.4791502973071136, 'batch_norm': True, 'lr': 4.981120864994171e-05, 'weight_decay': 3.155612428951291e-07, 'epochs': 80, 'loss': 'mae', 'optimizer': 'sgd', 'use_snp_selection': True, 'num_snps': 39693, 'weight_scheme': 'exponential', 'weight_clip_max': 10.0, 'weight_exponential_beta': 0.13062455500080494}. Best is trial 2 with value: 0.15149538719366348.
[I 2026-04-21 19:05:09,702] Trial 30 finished with value: 0.1815257843052017 and parameters: {'hidden_dims': '[512, 128]', 'dropout': 0.33996632227637014, 'batch_norm': False, 'lr': 2.4101196842135292e-05, 'weight_decay': 6.572808971884228e-06, 'epochs': 300, 'loss': 'mae', 'optimizer': 'adam', 'use_snp_selection': True, 'num_snps': 11530, 'weight_scheme': 'exponential', 'weight_clip_max': 5.0, 'weight_exponential_beta': 7.9714397274306865}. Best is trial 6 with value: 0.20382757753501488.
[I 2026-04-21 19:05:23,640] Trial 21 finished with value: 0.06763178741386823 and parameters: {'hidden_dims': '[256, 128]', 'dropout': 0.11229639432308547, 'batch_norm': False, 'lr': 2.4563397506171504e-06, 'weight_decay': 2.8070003738996406e-07, 'epochs': 90, 'loss': 'mae', 'optimizer': 'adam', 'use_snp_selection': True, 'num_snps': 27141, 'weight_scheme': 'minmax', 'weight_clip_max': 5.0, 'weight_minmax_eps': 0.0062252910971775585}. Best is trial 2 with value: 0.15149538719366348.
[I 2026-04-21 19:05:29,571] Trial 31 finished with value: 0.17968298944982294 and parameters: {'hidden_dims': '[256, 128]', 'dropout': 0.5304699173906032, 'batch_norm': False, 'lr': 5.705460832495673e-05, 'weight_decay': 0.0003329883542123584, 'epochs': 269, 'loss': 'mae', 'optimizer': 'adamw', 'use_snp_selection': True, 'num_snps': 8904, 'weight_scheme': 'minmax', 'weight_clip_max': 5.0, 'weight_minmax_eps': 0.06825216243263973}. Best is trial 6 with value: 0.20382757753501488.
[I 2026-04-21 19:05:41,971] Trial 22 finished with value: 0.09899522755645311 and parameters: {'hidden_dims': '[256, 128]', 'dropout': 0.09503701958665689, 'batch_norm': False, 'lr': 1.8520617087057932e-06, 'weight_decay': 1.582631301413401e-06, 'epochs': 74, 'loss': 'mae', 'optimizer': 'adam', 'use_snp_selection': True, 'num_snps': 11125, 'weight_scheme': 'minmax', 'weight_clip_max': 5.0, 'weight_minmax_eps': 0.001387629172727201}. Best is trial 2 with value: 0.15149538719366348.
[I 2026-04-21 19:05:48,214] Trial 32 finished with value: 0.17111191561664096 and parameters: {'hidden_dims': '[256, 128]', 'dropout': 0.43003292353042594, 'batch_norm': False, 'lr': 1.4030681129869838e-05, 'weight_decay': 0.00012685804006507898, 'epochs': 279, 'loss': 'mae', 'optimizer': 'adamw', 'use_snp_selection': True, 'num_snps': 6149, 'weight_scheme': 'minmax', 'weight_clip_max': 5.0, 'weight_minmax_eps': 0.06842632726910367}. Best is trial 6 with value: 0.20382757753501488.
[I 2026-04-21 19:06:03,534] Trial 23 finished with value: 0.0942842554643385 and parameters: {'hidden_dims': '[256, 128]', 'dropout': 0.2526117295803452, 'batch_norm': False, 'lr': 5.213099312241789e-06, 'weight_decay': 8.862391401158124e-08, 'epochs': 98, 'loss': 'mae', 'optimizer': 'adam', 'use_snp_selection': True, 'num_snps': 21509, 'weight_scheme': 'minmax', 'weight_clip_max': 5.0, 'weight_minmax_eps': 0.03168045234987376}. Best is trial 2 with value: 0.15149538719366348.
[I 2026-04-21 19:06:10,512] Trial 33 finished with value: 0.1608402645332032 and parameters: {'hidden_dims': '[256, 128]', 'dropout': 0.5250780772373752, 'batch_norm': False, 'lr': 0.0001059581045792741, 'weight_decay': 0.0003157300488590699, 'epochs': 252, 'loss': 'mae', 'optimizer': 'adamw', 'use_snp_selection': True, 'num_snps': 14685, 'weight_scheme': 'linear', 'weight_clip_max': 5.0, 'weight_linear_min_weight': 0.98051737503335, 'weight_linear_max_weight': 3.8192486263350465}. Best is trial 6 with value: 0.20382757753501488.
[I 2026-04-21 19:06:29,002] Trial 34 finished with value: 0.1500446338301328 and parameters: {'hidden_dims': '[256, 128]', 'dropout': 0.3931060539951235, 'batch_norm': False, 'lr': 0.00016665439178278177, 'weight_decay': 3.6913542079641575e-05, 'epochs': 283, 'loss': 'mse', 'optimizer': 'adamw', 'use_snp_selection': True, 'num_snps': 5471, 'weight_scheme': 'minmax', 'weight_clip_max': 5.0, 'weight_minmax_eps': 0.07125484052357087}. Best is trial 6 with value: 0.20382757753501488.
[I 2026-04-21 19:06:29,467] Trial 24 finished with value: 0.09323851596027154 and parameters: {'hidden_dims': '[256, 128]', 'dropout': 0.0010139619332426297, 'batch_norm': False, 'lr': 1.5258232121976605e-05, 'weight_decay': 3.485051840009599e-07, 'epochs': 122, 'loss': 'mae', 'optimizer': 'adam', 'use_snp_selection': True, 'num_snps': 32946, 'weight_scheme': 'minmax', 'weight_clip_max': 5.0, 'weight_minmax_eps': 0.07319361349760192}. Best is trial 2 with value: 0.15149538719366348.
[I 2026-04-21 19:07:13,458] Trial 25 finished with value: 0.09349351334680844 and parameters: {'hidden_dims': '[512, 128]', 'dropout': 0.3420610120436014, 'batch_norm': False, 'lr': 1.7983122158352716e-06, 'weight_decay': 4.672048684798394e-08, 'epochs': 166, 'loss': 'mae', 'optimizer': 'adam', 'use_snp_selection': True, 'num_snps': 51058, 'weight_scheme': 'minmax', 'weight_clip_max': 5.0, 'weight_minmax_eps': 0.17856549956299916}. Best is trial 2 with value: 0.15149538719366348.
[I 2026-04-21 19:07:14,885] Trial 35 finished with value: 0.18505762034534048 and parameters: {'hidden_dims': '[512, 64]', 'dropout': 0.30277687386378555, 'batch_norm': False, 'lr': 3.13468877420575e-05, 'weight_decay': 8.449289401097764e-05, 'epochs': 261, 'loss': 'mae', 'optimizer': 'adamw', 'use_snp_selection': True, 'num_snps': 40077, 'weight_scheme': 'minmax', 'weight_clip_max': 10.0, 'weight_minmax_eps': 0.03748571093622816}. Best is trial 6 with value: 0.20382757753501488.
[I 2026-04-21 19:07:36,286] Trial 26 finished with value: 0.08416945515647163 and parameters: {'hidden_dims': '[256, 128]', 'dropout': 0.1886672871493251, 'batch_norm': False, 'lr': 3.5443175178187925e-06, 'weight_decay': 1.696323987811259e-07, 'epochs': 50, 'loss': 'mae', 'optimizer': 'adam', 'use_snp_selection': True, 'num_snps': 31574, 'weight_scheme': 'top-heavy', 'weight_clip_max': 5.0, 'weight_topheavy_top_frac': 0.051598064370283137, 'weight_topheavy_low': 0.8792750097370348, 'weight_topheavy_high': 1.4890091591583912}. Best is trial 2 with value: 0.15149538719366348.
[I 2026-04-21 19:07:59,022] Trial 27 finished with value: 0.10173408065318944 and parameters: {'hidden_dims': '[512, 64]', 'dropout': 0.4593940182815277, 'batch_norm': False, 'lr': 7.88410901448141e-06, 'weight_decay': 1.893532906815516e-06, 'epochs': 136, 'loss': 'mae', 'optimizer': 'adam', 'use_snp_selection': False, 'weight_scheme': 'minmax', 'weight_clip_max': 5.0, 'weight_minmax_eps': 0.027715895480991255}. Best is trial 2 with value: 0.15149538719366348.
[I 2026-04-21 19:08:00,990] Trial 36 finished with value: 0.052501065848936636 and parameters: {'hidden_dims': '[512, 64]', 'dropout': 0.30009623169683447, 'batch_norm': False, 'lr': 2.7348393251399353e-05, 'weight_decay': 2.7171007830747174e-06, 'epochs': 259, 'loss': 'mse', 'optimizer': 'sgd', 'use_snp_selection': True, 'num_snps': 40603, 'weight_scheme': 'top-heavy', 'weight_clip_max': 10.0, 'weight_topheavy_top_frac': 0.40939752297464516, 'weight_topheavy_low': 1.170906044467701, 'weight_topheavy_high': 5.780473171157389}. Best is trial 6 with value: 0.20382757753501488.
[I 2026-04-21 19:08:22,590] Trial 28 finished with value: 0.06811587423078076 and parameters: {'hidden_dims': '[512, 128]', 'dropout': 0.5298914564027608, 'batch_norm': True, 'lr': 2.3693352065135337e-05, 'weight_decay': 6.890667462799421e-07, 'epochs': 188, 'loss': 'mae', 'optimizer': 'adamw', 'use_snp_selection': True, 'num_snps': 13072, 'weight_scheme': 'minmax', 'weight_clip_max': 10.0, 'weight_minmax_eps': 0.0647940582318984}. Best is trial 2 with value: 0.15149538719366348.
[I 2026-04-21 19:08:39,967] Trial 29 finished with value: 0.08476071548390078 and parameters: {'hidden_dims': '[256, 128]', 'dropout': 0.1543044728602174, 'batch_norm': True, 'lr': 8.495941193351116e-06, 'weight_decay': 4.934975504573765e-06, 'epochs': 103, 'loss': 'mse', 'optimizer': 'sgd', 'use_snp_selection': True, 'num_snps': 5940, 'weight_scheme': 'minmax', 'weight_clip_max': None, 'weight_minmax_eps': 0.019023208938659233}. Best is trial 2 with value: 0.15149538719366348.
[I 2026-04-21 19:08:45,016] Trial 37 finished with value: 0.19038243419285736 and parameters: {'hidden_dims': '[512, 64]', 'dropout': 0.1722301067081916, 'batch_norm': False, 'lr': 1.782195004172914e-05, 'weight_decay': 6.376039608610075e-05, 'epochs': 239, 'loss': 'mae', 'optimizer': 'adamw', 'use_snp_selection': True, 'num_snps': 38046, 'weight_scheme': 'linear', 'weight_clip_max': 10.0, 'weight_linear_min_weight': 0.5645515530175399, 'weight_linear_max_weight': 2.7384751170798594}. Best is trial 6 with value: 0.20382757753501488.
[I 2026-04-21 19:09:05,495] Trial 30 finished with value: 0.03526441731878276 and parameters: {'hidden_dims': '[256, 128]', 'dropout': 0.22160270027604856, 'batch_norm': False, 'lr': 0.00028476233504926625, 'weight_decay': 3.9151125066605206e-08, 'epochs': 82, 'loss': 'mae', 'optimizer': 'sgd', 'use_snp_selection': True, 'num_snps': 36928, 'weight_scheme': 'uniform', 'weight_clip_max': 5.0}. Best is trial 2 with value: 0.15149538719366348.
[I 2026-04-21 19:09:22,832] Trial 38 finished with value: 0.09054866199410595 and parameters: {'hidden_dims': '[512, 64]', 'dropout': 0.11425064138426827, 'batch_norm': False, 'lr': 4.005925853645336e-05, 'weight_decay': 1.0249416997279532e-05, 'epochs': 162, 'loss': 'mse', 'optimizer': 'sgd', 'use_snp_selection': True, 'num_snps': 39634, 'weight_scheme': 'linear', 'weight_clip_max': 10.0, 'weight_linear_min_weight': 0.5958007245222191, 'weight_linear_max_weight': 2.698353876919636}. Best is trial 6 with value: 0.20382757753501488.
[I 2026-04-21 19:09:27,001] Trial 31 finished with value: 0.1368018128578892 and parameters: {'hidden_dims': '[256, 64]', 'dropout': 0.04710011375433573, 'batch_norm': True, 'lr': 3.8238447156686565e-05, 'weight_decay': 1.1419716239521521e-05, 'epochs': 250, 'loss': 'mae', 'optimizer': 'adam', 'use_snp_selection': False, 'weight_scheme': 'minmax', 'weight_clip_max': None, 'weight_minmax_eps': 0.11237124524683464}. Best is trial 2 with value: 0.15149538719366348.
[I 2026-04-21 19:09:50,101] Trial 32 finished with value: 0.12253402283478805 and parameters: {'hidden_dims': '[256, 64]', 'dropout': 0.0810233278716872, 'batch_norm': True, 'lr': 8.535916189275389e-05, 'weight_decay': 2.3684121265528014e-05, 'epochs': 269, 'loss': 'mae', 'optimizer': 'adam', 'use_snp_selection': False, 'weight_scheme': 'minmax', 'weight_clip_max': None, 'weight_minmax_eps': 0.12389191946842207}. Best is trial 2 with value: 0.15149538719366348.
[I 2026-04-21 19:10:02,236] Trial 39 finished with value: 0.19877901305024057 and parameters: {'hidden_dims': '[512, 64]', 'dropout': 0.18432213483733487, 'batch_norm': False, 'lr': 1.4946642559245538e-05, 'weight_decay': 4.595493739571276e-05, 'epochs': 202, 'loss': 'mae', 'optimizer': 'adamw', 'use_snp_selection': True, 'num_snps': 36208, 'weight_scheme': 'linear', 'weight_clip_max': 10.0, 'weight_linear_min_weight': 0.5746322622908712, 'weight_linear_max_weight': 2.671732277107949}. Best is trial 6 with value: 0.20382757753501488.
[I 2026-04-21 19:10:09,732] Trial 33 finished with value: 0.11419412025761226 and parameters: {'hidden_dims': '[256, 64]', 'dropout': 0.04192600333339924, 'batch_norm': True, 'lr': 0.00015491214313955357, 'weight_decay': 0.00015887114906419934, 'epochs': 221, 'loss': 'mae', 'optimizer': 'adam', 'use_snp_selection': False, 'weight_scheme': 'linear', 'weight_clip_max': None, 'weight_linear_min_weight': 0.9123560386820551, 'weight_linear_max_weight': 3.835501445770653}. Best is trial 2 with value: 0.15149538719366348.
[I 2026-04-21 19:10:28,519] Trial 34 finished with value: 0.10454181593747323 and parameters: {'hidden_dims': '[256, 64]', 'dropout': 0.017353638276675996, 'batch_norm': True, 'lr': 1.4581279288676409e-05, 'weight_decay': 1.278423310825104e-05, 'epochs': 208, 'loss': 'mse', 'optimizer': 'adam', 'use_snp_selection': False, 'weight_scheme': 'minmax', 'weight_clip_max': None, 'weight_minmax_eps': 0.11532581947124579}. Best is trial 2 with value: 0.15149538719366348.
[I 2026-04-21 19:10:50,977] Trial 35 finished with value: 0.06879156356641013 and parameters: {'hidden_dims': '[256, 64]', 'dropout': 0.08139106601281203, 'batch_norm': True, 'lr': 5.332296190645931e-05, 'weight_decay': 4.079565403650312e-06, 'epochs': 258, 'loss': 'mse', 'optimizer': 'sgd', 'use_snp_selection': False, 'weight_scheme': 'linear', 'weight_clip_max': None, 'weight_linear_min_weight': 0.5513202596821666, 'weight_linear_max_weight': 2.7668177738515127}. Best is trial 2 with value: 0.15149538719366348.
