[I 2026-04-18 13:30:02,055] Trial 20 finished with value: 0.18334443956972243 and parameters: {'hidden_dims': '[512, 64]', 'dropout': 0.4990876777783814, 'batch_norm': False, 'lr': 1.012406932834051e-06, 'weight_decay': 1.5650668987169637e-05, 'epochs': 223, 'loss': 'mae', 'optimizer': 'adam', 'use_snp_selection': True, 'num_snps': 54156, 'weight_scheme': 'uniform', 'weight_clip_max': 10.0}. Best is trial 17 with value: 0.2404235916659899.
[I 2026-04-18 13:30:54,067] Trial 23 finished with value: 0.22588747554988667 and parameters: {'hidden_dims': '[256, 128]', 'dropout': 0.5192108330278871, 'batch_norm': False, 'lr': 5.244728781418976e-06, 'weight_decay': 1.3874672922159307e-06, 'epochs': 271, 'loss': 'mae', 'optimizer': 'adamw', 'use_snp_selection': True, 'num_snps': 57878, 'weight_scheme': 'exponential', 'weight_clip_max': None, 'weight_exponential_beta': 0.23482218177396344}. Best is trial 23 with value: 0.22588747554988667.
[I 2026-04-18 13:31:29,619] Trial 21 finished with value: 0.21744308257793551 and parameters: {'hidden_dims': '[512, 64]', 'dropout': 0.5232163153052397, 'batch_norm': False, 'lr': 2.6259729578214623e-06, 'weight_decay': 0.00022677646200119263, 'epochs': 161, 'loss': 'mae', 'optimizer': 'adam', 'use_snp_selection': True, 'num_snps': 59500, 'weight_scheme': 'exponential', 'weight_clip_max': 10.0, 'weight_exponential_beta': 7.907369663047676}. Best is trial 17 with value: 0.2404235916659899.
[I 2026-04-18 13:32:13,963] Trial 24 finished with value: 0.22083836033037246 and parameters: {'hidden_dims': '[256, 128]', 'dropout': 0.4301764097109119, 'batch_norm': False, 'lr': 5.379906519908517e-06, 'weight_decay': 1.4240762951485045e-06, 'epochs': 281, 'loss': 'mae', 'optimizer': 'adamw', 'use_snp_selection': True, 'num_snps': 59774, 'weight_scheme': 'exponential', 'weight_clip_max': None, 'weight_exponential_beta': 0.1609150045398643}. Best is trial 23 with value: 0.22588747554988667.
[I 2026-04-18 13:33:04,309] Trial 22 finished with value: 0.21294270423576647 and parameters: {'hidden_dims': '[512, 64]', 'dropout': 0.4551815643738759, 'batch_norm': False, 'lr': 2.600394072414689e-06, 'weight_decay': 0.0001467411154483958, 'epochs': 189, 'loss': 'mae', 'optimizer': 'adam', 'use_snp_selection': True, 'num_snps': 59204, 'weight_scheme': 'exponential', 'weight_clip_max': 10.0, 'weight_exponential_beta': 6.7076703964845175}. Best is trial 17 with value: 0.2404235916659899.
[I 2026-04-18 13:33:36,034] Trial 25 finished with value: 0.22661856103687686 and parameters: {'hidden_dims': '[256, 128]', 'dropout': 0.4361677657268741, 'batch_norm': False, 'lr': 1.4896125464300406e-06, 'weight_decay': 2.0534356889587117e-06, 'epochs': 298, 'loss': 'mae', 'optimizer': 'adamw', 'use_snp_selection': True, 'num_snps': 59651, 'weight_scheme': 'exponential', 'weight_clip_max': None, 'weight_exponential_beta': 0.1175483610164596}. Best is trial 25 with value: 0.22661856103687686.
[I 2026-04-18 13:34:18,690] Trial 23 finished with value: 0.18847112627170562 and parameters: {'hidden_dims': '[512, 64]', 'dropout': 0.5423234463444823, 'batch_norm': False, 'lr': 1.0054687461251674e-06, 'weight_decay': 0.0001674427407243019, 'epochs': 135, 'loss': 'mae', 'optimizer': 'adam', 'use_snp_selection': True, 'num_snps': 52027, 'weight_scheme': 'exponential', 'weight_clip_max': 10.0, 'weight_exponential_beta': 5.028651691989747}. Best is trial 17 with value: 0.2404235916659899.
[I 2026-04-18 13:34:48,804] Trial 26 finished with value: 0.2112635119747866 and parameters: {'hidden_dims': '[256, 128]', 'dropout': 0.3424542204707788, 'batch_norm': False, 'lr': 1.3500391132842813e-06, 'weight_decay': 3.6348798175627656e-07, 'epochs': 297, 'loss': 'mae', 'optimizer': 'adam', 'use_snp_selection': True, 'num_snps': 49567, 'weight_scheme': 'exponential', 'weight_clip_max': None, 'weight_exponential_beta': 2.012344082160263}. Best is trial 25 with value: 0.22661856103687686.
[I 2026-04-18 13:35:40,275] Trial 24 finished with value: 0.21107744215006558 and parameters: {'hidden_dims': '[512, 64]', 'dropout': 0.4629887708749669, 'batch_norm': False, 'lr': 8.975152240947877e-06, 'weight_decay': 0.00031182978071005933, 'epochs': 175, 'loss': 'mae', 'optimizer': 'adam', 'use_snp_selection': True, 'num_snps': 50749, 'weight_scheme': 'top-heavy', 'weight_clip_max': 10.0, 'weight_topheavy_top_frac': 0.28245260572441344, 'weight_topheavy_low': 0.8263579423031415, 'weight_topheavy_high': 1.3535822320267994}. Best is trial 17 with value: 0.2404235916659899.
[I 2026-04-18 13:35:59,358] Trial 27 finished with value: 0.21627712202511318 and parameters: {'hidden_dims': '[256, 128]', 'dropout': 0.43605825279115784, 'batch_norm': False, 'lr': 1.1754061704617303e-06, 'weight_decay': 2.8704757139337507e-06, 'epochs': 279, 'loss': 'mae', 'optimizer': 'adamw', 'use_snp_selection': True, 'num_snps': 49206, 'weight_scheme': 'exponential', 'weight_clip_max': None, 'weight_exponential_beta': 1.7898106278383574}. Best is trial 25 with value: 0.22661856103687686.
[I 2026-04-18 13:37:13,662] Trial 28 finished with value: 0.2036419561545079 and parameters: {'hidden_dims': '[256, 128]', 'dropout': 0.5008228524040595, 'batch_norm': False, 'lr': 2.681141353092326e-06, 'weight_decay': 1.1059486475604243e-07, 'epochs': 241, 'loss': 'mae', 'optimizer': 'adamw', 'use_snp_selection': True, 'num_snps': 59097, 'weight_scheme': 'exponential', 'weight_clip_max': None, 'weight_exponential_beta': 4.537138796473211}. Best is trial 25 with value: 0.22661856103687686.
[I 2026-04-18 13:37:17,767] Trial 25 finished with value: 0.20803630128919964 and parameters: {'hidden_dims': '[512, 64]', 'dropout': 0.3267338647409063, 'batch_norm': False, 'lr': 2.6772482855105903e-06, 'weight_decay': 0.0009792549949513415, 'epochs': 204, 'loss': 'mae', 'optimizer': 'adam', 'use_snp_selection': True, 'num_snps': 58465, 'weight_scheme': 'top-heavy', 'weight_clip_max': 10.0, 'weight_topheavy_top_frac': 0.3387330254107948, 'weight_topheavy_low': 0.7773833080675051, 'weight_topheavy_high': 1.2986005920771913}. Best is trial 17 with value: 0.2404235916659899.
[I 2026-04-18 13:38:25,633] Trial 29 finished with value: 0.1971170186264103 and parameters: {'hidden_dims': '[256, 128]', 'dropout': 0.34276260095004996, 'batch_norm': False, 'lr': 9.298168118519917e-06, 'weight_decay': 3.3026878571840963e-06, 'epochs': 300, 'loss': 'mse', 'optimizer': 'adamw', 'use_snp_selection': True, 'num_snps': 48046, 'weight_scheme': 'exponential', 'weight_clip_max': None, 'weight_exponential_beta': 0.12360591248807046}. Best is trial 25 with value: 0.22661856103687686.
[I 2026-04-18 13:38:52,631] Trial 26 finished with value: 0.1931553897932442 and parameters: {'hidden_dims': '[512, 128]', 'dropout': 0.5605124529439253, 'batch_norm': True, 'lr': 1.3620070357684698e-06, 'weight_decay': 1.893532906815516e-06, 'epochs': 240, 'loss': 'mae', 'optimizer': 'adamw', 'use_snp_selection': True, 'num_snps': 48725, 'weight_scheme': 'exponential', 'weight_clip_max': 10.0, 'weight_exponential_beta': 0.4384971872811594}. Best is trial 17 with value: 0.2404235916659899.
[I 2026-04-18 13:39:44,548] Trial 30 finished with value: 0.21053055310733634 and parameters: {'hidden_dims': '[256, 128]', 'dropout': 0.44006618888979576, 'batch_norm': False, 'lr': 8.527941361907807e-06, 'weight_decay': 1.0586720838182889e-05, 'epochs': 272, 'loss': 'mae', 'optimizer': 'adam', 'use_snp_selection': True, 'num_snps': 59953, 'weight_scheme': 'exponential', 'weight_clip_max': None, 'weight_exponential_beta': 1.8994623066330418}. Best is trial 25 with value: 0.22661856103687686.
[I 2026-04-18 13:39:52,525] Trial 27 finished with value: 0.2085515566905703 and parameters: {'hidden_dims': '[512, 64]', 'dropout': 0.4288906786394804, 'batch_norm': False, 'lr': 9.082061293410684e-06, 'weight_decay': 0.00010378315670871823, 'epochs': 175, 'loss': 'mae', 'optimizer': 'adam', 'use_snp_selection': False, 'weight_scheme': 'top-heavy', 'weight_clip_max': None, 'weight_topheavy_top_frac': 0.3653283954525062, 'weight_topheavy_low': 0.704599458922622, 'weight_topheavy_high': 2.4689936380997466}. Best is trial 17 with value: 0.2404235916659899.
[I 2026-04-18 13:41:00,046] Trial 31 finished with value: 0.21897320834916917 and parameters: {'hidden_dims': '[256, 128]', 'dropout': 0.4293937457222449, 'batch_norm': False, 'lr': 4.155882370307585e-06, 'weight_decay': 1.8115768833025897e-06, 'epochs': 281, 'loss': 'mae', 'optimizer': 'adamw', 'use_snp_selection': True, 'num_snps': 54822, 'weight_scheme': 'exponential', 'weight_clip_max': None, 'weight_exponential_beta': 0.19985788878607025}. Best is trial 25 with value: 0.22661856103687686.
[I 2026-04-18 13:41:41,855] Trial 28 finished with value: 0.04950624940937357 and parameters: {'hidden_dims': '[512, 64]', 'dropout': 0.49679360051333893, 'batch_norm': False, 'lr': 0.0009189945419575109, 'weight_decay': 1.8674285205916116e-05, 'epochs': 264, 'loss': 'mae', 'optimizer': 'adam', 'use_snp_selection': True, 'num_snps': 55705, 'weight_scheme': 'uniform', 'weight_clip_max': 10.0}. Best is trial 17 with value: 0.2404235916659899.
[I 2026-04-18 13:42:20,085] Trial 32 finished with value: 0.21460192014760238 and parameters: {'hidden_dims': '[256, 128]', 'dropout': 0.507552364769688, 'batch_norm': False, 'lr': 8.580087657449513e-06, 'weight_decay': 6.095756830415247e-07, 'epochs': 284, 'loss': 'mae', 'optimizer': 'adamw', 'use_snp_selection': True, 'num_snps': 59435, 'weight_scheme': 'exponential', 'weight_clip_max': None, 'weight_exponential_beta': 1.185660487280429}. Best is trial 25 with value: 0.22661856103687686.
[I 2026-04-18 13:42:41,135] Trial 29 finished with value: 0.18505043108647085 and parameters: {'hidden_dims': '[512, 64]', 'dropout': 0.5282296960610382, 'batch_norm': True, 'lr': 8.48780428886238e-06, 'weight_decay': 5.0622531610124425e-06, 'epochs': 119, 'loss': 'mse', 'optimizer': 'adam', 'use_snp_selection': True, 'num_snps': 37137, 'weight_scheme': 'exponential', 'weight_clip_max': 10.0, 'weight_exponential_beta': 4.931239238370835}. Best is trial 17 with value: 0.2404235916659899.
[I 2026-04-18 13:43:13,812] Trial 30 finished with value: 0.15746953048882786 and parameters: {'hidden_dims': '[512, 64]', 'dropout': 0.3444193604592972, 'batch_norm': False, 'lr': 3.7057522690463807e-06, 'weight_decay': 1.8542863388293473e-05, 'epochs': 93, 'loss': 'mae', 'optimizer': 'adamw', 'use_snp_selection': True, 'num_snps': 7233, 'weight_scheme': 'top-heavy', 'weight_clip_max': None, 'weight_topheavy_top_frac': 0.38175655724614155, 'weight_topheavy_low': 0.9915939652442145, 'weight_topheavy_high': 2.3143583899431963}. Best is trial 17 with value: 0.2404235916659899.
[I 2026-04-18 13:43:30,919] Trial 33 finished with value: 0.217103950446545 and parameters: {'hidden_dims': '[256, 128]', 'dropout': 0.33827452246609546, 'batch_norm': False, 'lr': 2.0577888170749675e-06, 'weight_decay': 5.4208444238586734e-06, 'epochs': 254, 'loss': 'mae', 'optimizer': 'adamw', 'use_snp_selection': True, 'num_snps': 52421, 'weight_scheme': 'exponential', 'weight_clip_max': None, 'weight_exponential_beta': 3.376137407327825}. Best is trial 25 with value: 0.22661856103687686.
[I 2026-04-18 13:44:13,135] Trial 31 finished with value: 0.227962269388452 and parameters: {'hidden_dims': '[256, 128]', 'dropout': 0.41063791455656273, 'batch_norm': False, 'lr': 7.061499959845175e-06, 'weight_decay': 9.330579490070292e-05, 'epochs': 220, 'loss': 'mae', 'optimizer': 'adam', 'use_snp_selection': True, 'num_snps': 39377, 'weight_scheme': 'top-heavy', 'weight_clip_max': 5.0, 'weight_topheavy_top_frac': 0.211216156639568, 'weight_topheavy_low': 0.6697674882544516, 'weight_topheavy_high': 4.610591807902888}. Best is trial 17 with value: 0.2404235916659899.
[I 2026-04-18 13:44:51,706] Trial 34 finished with value: 0.17852681399947185 and parameters: {'hidden_dims': '[512, 128]', 'dropout': 0.550211132894281, 'batch_norm': False, 'lr': 1.750839821179821e-05, 'weight_decay': 2.5095632729363312e-06, 'epochs': 269, 'loss': 'mse', 'optimizer': 'adamw', 'use_snp_selection': True, 'num_snps': 37562, 'weight_scheme': 'exponential', 'weight_clip_max': None, 'weight_exponential_beta': 1.108912776690781}. Best is trial 25 with value: 0.22661856103687686.
[I 2026-04-18 13:45:21,000] Trial 32 finished with value: 0.24573920071075142 and parameters: {'hidden_dims': '[256, 128]', 'dropout': 0.47030856988966996, 'batch_norm': False, 'lr': 2.17923100304713e-06, 'weight_decay': 9.313882495533073e-05, 'epochs': 232, 'loss': 'mae', 'optimizer': 'adam', 'use_snp_selection': True, 'num_snps': 48117, 'weight_scheme': 'top-heavy', 'weight_clip_max': 5.0, 'weight_topheavy_top_frac': 0.16592174619931108, 'weight_topheavy_low': 0.668623164868025, 'weight_topheavy_high': 4.443362764728696}. Best is trial 32 with value: 0.24573920071075142.
[I 2026-04-18 13:46:02,302] Trial 35 finished with value: 0.21435271976931633 and parameters: {'hidden_dims': '[256, 128]', 'dropout': 0.4540816926363235, 'batch_norm': False, 'lr': 3.5904984834719035e-06, 'weight_decay': 4.220891405183351e-07, 'epochs': 235, 'loss': 'mae', 'optimizer': 'adamw', 'use_snp_selection': True, 'num_snps': 55572, 'weight_scheme': 'top-heavy', 'weight_clip_max': 10.0, 'weight_topheavy_top_frac': 0.07903859823640436, 'weight_topheavy_low': 0.9306731776003226, 'weight_topheavy_high': 1.5302081046827536}. Best is trial 25 with value: 0.22661856103687686.
[I 2026-04-18 13:46:19,969] Trial 33 finished with value: 0.1957812917316158 and parameters: {'hidden_dims': '[256, 128]', 'dropout': 0.4612140337321669, 'batch_norm': False, 'lr': 1.5378689058236275e-05, 'weight_decay': 9.534157297925132e-05, 'epochs': 232, 'loss': 'mae', 'optimizer': 'adam', 'use_snp_selection': True, 'num_snps': 37518, 'weight_scheme': 'top-heavy', 'weight_clip_max': 5.0, 'weight_topheavy_top_frac': 0.1416882539239205, 'weight_topheavy_low': 0.6650500370245755, 'weight_topheavy_high': 4.570523010055369}. Best is trial 32 with value: 0.24573920071075142.
[I 2026-04-18 13:47:06,148] Trial 34 finished with value: 0.2001783058086386 and parameters: {'hidden_dims': '[256, 128]', 'dropout': 0.420624700682152, 'batch_norm': True, 'lr': 2.099784177584212e-06, 'weight_decay': 0.0004946239960757431, 'epochs': 259, 'loss': 'mse', 'optimizer': 'adam', 'use_snp_selection': False, 'weight_scheme': 'top-heavy', 'weight_clip_max': 5.0, 'weight_topheavy_top_frac': 0.20368554071637995, 'weight_topheavy_low': 0.6716044112003855, 'weight_topheavy_high': 4.4603834667520585}. Best is trial 32 with value: 0.24573920071075142.
[I 2026-04-18 13:47:11,090] Trial 36 finished with value: 0.05523063981684384 and parameters: {'hidden_dims': '[256, 64]', 'dropout': 0.23580661939850583, 'batch_norm': False, 'lr': 6.761428795468789e-06, 'weight_decay': 1.229931536344161e-07, 'epochs': 290, 'loss': 'mse', 'optimizer': 'sgd', 'use_snp_selection': True, 'num_snps': 46751, 'weight_scheme': 'linear', 'weight_clip_max': None, 'weight_linear_min_weight': 0.9020572175968914, 'weight_linear_max_weight': 3.9645856116278226}. Best is trial 25 with value: 0.22661856103687686.
[I 2026-04-18 13:48:10,838] Trial 35 finished with value: 0.21353279421294022 and parameters: {'hidden_dims': '[256, 128]', 'dropout': 0.47270379000987395, 'batch_norm': False, 'lr': 0.0003047834854190633, 'weight_decay': 6.221364892291517e-05, 'epochs': 205, 'loss': 'mae', 'optimizer': 'adam', 'use_snp_selection': True, 'num_snps': 47845, 'weight_scheme': 'top-heavy', 'weight_clip_max': 5.0, 'weight_topheavy_top_frac': 0.053089034050956635, 'weight_topheavy_low': 0.756407946037512, 'weight_topheavy_high': 4.475052307975918}. Best is trial 32 with value: 0.24573920071075142.
[I 2026-04-18 13:48:23,695] Trial 37 finished with value: 0.22004079783437222 and parameters: {'hidden_dims': '[256, 128]', 'dropout': 0.5132934197239225, 'batch_norm': False, 'lr': 1.2448030736928463e-05, 'weight_decay': 8.814857445860232e-06, 'epochs': 277, 'loss': 'mae', 'optimizer': 'adamw', 'use_snp_selection': True, 'num_snps': 51545, 'weight_scheme': 'exponential', 'weight_clip_max': None, 'weight_exponential_beta': 0.13001638629395723}. Best is trial 25 with value: 0.22661856103687686.
[I 2026-04-18 13:49:38,930] Trial 38 finished with value: -0.002519167026505636 and parameters: {'hidden_dims': '[256, 64]', 'dropout': 0.3930005195121021, 'batch_norm': False, 'lr': 2.4513797514741797e-05, 'weight_decay': 1.177943590280227e-06, 'epochs': 251, 'loss': 'mae', 'optimizer': 'sgd', 'use_snp_selection': True, 'num_snps': 59984, 'weight_scheme': 'linear', 'weight_clip_max': 10.0, 'weight_linear_min_weight': 0.5790524649539364, 'weight_linear_max_weight': 1.0453193848451452}. Best is trial 25 with value: 0.22661856103687686.
[I 2026-04-18 13:49:39,343] Trial 36 finished with value: 0.03639458624150298 and parameters: {'hidden_dims': '[512, 128]', 'dropout': 0.2422725813413705, 'batch_norm': False, 'lr': 6.57774276731251e-06, 'weight_decay': 8.634793222595773e-06, 'epochs': 276, 'loss': 'mse', 'optimizer': 'sgd', 'use_snp_selection': False, 'weight_scheme': 'linear', 'weight_clip_max': 5.0, 'weight_linear_min_weight': 0.99977294574399, 'weight_linear_max_weight': 3.833283228532535}. Best is trial 32 with value: 0.24573920071075142.
[I 2026-04-18 13:50:48,757] Trial 37 finished with value: 0.2206289460251485 and parameters: {'hidden_dims': '[256, 64]', 'dropout': 0.34769965565848315, 'batch_norm': True, 'lr': 2.9912694150723326e-06, 'weight_decay': 3.054888951780446e-05, 'epochs': 232, 'loss': 'mae', 'optimizer': 'adam', 'use_snp_selection': True, 'num_snps': 50633, 'weight_scheme': 'top-heavy', 'weight_clip_max': 5.0, 'weight_topheavy_top_frac': 0.2431959300694031, 'weight_topheavy_low': 0.9162392356264363, 'weight_topheavy_high': 2.032269185452606}. Best is trial 32 with value: 0.24573920071075142.
[I 2026-04-18 13:51:22,306] Trial 38 finished with value: -0.03447684559736831 and parameters: {'hidden_dims': '[256, 128]', 'dropout': 0.30483587750873853, 'batch_norm': False, 'lr': 2.268933232451071e-05, 'weight_decay': 2.0400570949503207e-06, 'epochs': 188, 'loss': 'mae', 'optimizer': 'sgd', 'use_snp_selection': False, 'weight_scheme': 'top-heavy', 'weight_clip_max': None, 'weight_topheavy_top_frac': 0.31686386204794115, 'weight_topheavy_low': 0.6303157271509303, 'weight_topheavy_high': 3.7978576277591225}. Best is trial 32 with value: 0.24573920071075142.
[I 2026-04-18 13:51:31,918] Trial 39 finished with value: 0.2167573231374445 and parameters: {'hidden_dims': '[512, 128]', 'dropout': 0.4117681377802702, 'batch_norm': False, 'lr': 1.607544520508136e-06, 'weight_decay': 3.527319058593865e-08, 'epochs': 300, 'loss': 'mse', 'optimizer': 'adamw', 'use_snp_selection': True, 'num_snps': 55906, 'weight_scheme': 'exponential', 'weight_clip_max': None, 'weight_exponential_beta': 1.188051516672195}. Best is trial 25 with value: 0.22661856103687686.
[I 2026-04-18 13:52:26,243] Trial 39 finished with value: 0.19748129673572834 and parameters: {'hidden_dims': '[256, 64]', 'dropout': 0.5595929988340698, 'batch_norm': True, 'lr': 1.1834660713798884e-05, 'weight_decay': 0.00012410726641762576, 'epochs': 213, 'loss': 'mse', 'optimizer': 'adam', 'use_snp_selection': True, 'num_snps': 46115, 'weight_scheme': 'linear', 'weight_clip_max': 5.0, 'weight_linear_min_weight': 0.6350665734288926, 'weight_linear_max_weight': 1.0638654236280154}. Best is trial 32 with value: 0.24573920071075142.
[I 2026-04-18 13:52:57,422] Trial 0 finished with value: 0.11636796610402549 and parameters: {'hidden_dims': '[256, 128]', 'dropout': 0.18584155530312246, 'batch_norm': True, 'lr': 9.012665953349533e-06, 'weight_decay': 4.96591963698479e-06, 'epochs': 105, 'loss': 'mse', 'optimizer': 'sgd', 'use_snp_selection': True, 'num_snps': 25583, 'weight_scheme': 'minmax', 'weight_clip_max': 5.0, 'weight_minmax_eps': 0.14026014881292506}. Best is trial 0 with value: 0.11636796610402549.
[I 2026-04-18 13:53:25,093] Trial 1 finished with value: 0.16246195333308883 and parameters: {'hidden_dims': '[256, 64]', 'dropout': 0.05000949662985405, 'batch_norm': True, 'lr': 0.00015647443054904835, 'weight_decay': 5.158896024962846e-05, 'epochs': 152, 'loss': 'mse', 'optimizer': 'sgd', 'use_snp_selection': False, 'weight_scheme': 'linear', 'weight_clip_max': None, 'weight_linear_min_weight': 0.21922985165550554, 'weight_linear_max_weight': 1.6260435767424388}. Best is trial 1 with value: 0.16246195333308883.
[I 2026-04-18 13:53:42,635] Trial 0 finished with value: 0.11608452861980915 and parameters: {'hidden_dims': '[256, 128]', 'dropout': 0.18584155530312246, 'batch_norm': True, 'lr': 9.012665953349533e-06, 'weight_decay': 4.96591963698479e-06, 'epochs': 105, 'loss': 'mse', 'optimizer': 'sgd', 'use_snp_selection': True, 'num_snps': 25583, 'weight_scheme': 'minmax', 'weight_clip_max': 5.0, 'weight_minmax_eps': 0.14026014881292506}. Best is trial 0 with value: 0.11608452861980915.
[I 2026-04-18 13:54:07,402] Trial 2 finished with value: 0.10621731062685594 and parameters: {'hidden_dims': '[512, 128]', 'dropout': 0.2736730891340176, 'batch_norm': True, 'lr': 7.298114623433994e-05, 'weight_decay': 5.6346010385734023e-08, 'epochs': 185, 'loss': 'mae', 'optimizer': 'sgd', 'use_snp_selection': True, 'num_snps': 14091, 'weight_scheme': 'minmax', 'weight_clip_max': 10.0, 'weight_minmax_eps': 0.045780660776687306}. Best is trial 1 with value: 0.16246195333308883.
[I 2026-04-18 13:54:10,597] Trial 1 finished with value: 0.17883567194342959 and parameters: {'hidden_dims': '[256, 64]', 'dropout': 0.05000949662985405, 'batch_norm': True, 'lr': 0.00015647443054904835, 'weight_decay': 5.158896024962846e-05, 'epochs': 152, 'loss': 'mse', 'optimizer': 'sgd', 'use_snp_selection': False, 'weight_scheme': 'linear', 'weight_clip_max': None, 'weight_linear_min_weight': 0.21922985165550554, 'weight_linear_max_weight': 1.6260435767424388}. Best is trial 1 with value: 0.17883567194342959.
