[I 2026-04-18 17:00:41,573] Trial 30 finished with value: 0.1892232130873026 and parameters: {'hidden_dims': '[512, 128]', 'dropout': 0.1895224304597129, 'batch_norm': False, 'lr': 0.00011098483611457222, 'weight_decay': 5.85834629020608e-06, 'epochs': 268, 'loss': 'mae', 'optimizer': 'adamw', 'use_snp_selection': False, 'weight_scheme': 'top-heavy', 'weight_clip_max': 5.0, 'weight_topheavy_top_frac': 0.19323490650066688, 'weight_topheavy_low': 0.8361831446659233, 'weight_topheavy_high': 5.082876013906091}. Best is trial 22 with value: 0.20812651967210466.
[I 2026-04-18 17:01:10,700] Trial 13 finished with value: 0.12568291492687883 and parameters: {'hidden_dims': '[256, 128]', 'dropout': 0.39617155092414635, 'batch_norm': False, 'lr': 5.5499656564214575e-06, 'weight_decay': 4.026950095019044e-05, 'epochs': 219, 'loss': 'mae', 'optimizer': 'adam', 'use_snp_selection': True, 'num_snps': 40015, 'weight_scheme': 'top-heavy', 'weight_clip_max': 5.0, 'weight_topheavy_top_frac': 0.4963949528875303, 'weight_topheavy_low': 0.550088064868268, 'weight_topheavy_high': 5.953811342115056}. Best is trial 8 with value: 0.1451433957964678.
[I 2026-04-18 17:01:37,884] Trial 31 finished with value: 0.19256655451603724 and parameters: {'hidden_dims': '[512, 128]', 'dropout': 0.4049545971173133, 'batch_norm': True, 'lr': 0.0004685526711970397, 'weight_decay': 4.924408941546008e-08, 'epochs': 179, 'loss': 'mae', 'optimizer': 'adamw', 'use_snp_selection': False, 'weight_scheme': 'top-heavy', 'weight_clip_max': None, 'weight_topheavy_top_frac': 0.4425872228992812, 'weight_topheavy_low': 0.5782241102367293, 'weight_topheavy_high': 4.959014867934954}. Best is trial 22 with value: 0.20812651967210466.
[I 2026-04-18 17:01:44,541] Trial 14 finished with value: 0.11162810796702885 and parameters: {'hidden_dims': '[512, 64]', 'dropout': 0.5844173028921046, 'batch_norm': False, 'lr': 0.0003290988605002151, 'weight_decay': 0.00012556383722493912, 'epochs': 290, 'loss': 'mae', 'optimizer': 'adamw', 'use_snp_selection': True, 'num_snps': 6357, 'weight_scheme': 'exponential', 'weight_clip_max': 5.0, 'weight_exponential_beta': 7.792631903976359}. Best is trial 8 with value: 0.1451433957964678.
[I 2026-04-18 17:02:27,390] Trial 15 finished with value: 0.11049773354398447 and parameters: {'hidden_dims': '[256, 128]', 'dropout': 0.36868497888545293, 'batch_norm': False, 'lr': 3.7842230635858817e-06, 'weight_decay': 8.617262078255802e-07, 'epochs': 95, 'loss': 'mae', 'optimizer': 'adamw', 'use_snp_selection': True, 'num_snps': 39426, 'weight_scheme': 'uniform', 'weight_clip_max': 5.0}. Best is trial 8 with value: 0.1451433957964678.
[I 2026-04-18 17:02:48,394] Trial 32 finished with value: 0.19569241055198772 and parameters: {'hidden_dims': '[512, 128]', 'dropout': 0.48763558223209746, 'batch_norm': False, 'lr': 0.0002100554991782394, 'weight_decay': 2.5286610313340937e-05, 'epochs': 230, 'loss': 'mae', 'optimizer': 'adamw', 'use_snp_selection': False, 'weight_scheme': 'top-heavy', 'weight_clip_max': None, 'weight_topheavy_top_frac': 0.3100065035154855, 'weight_topheavy_low': 0.599811651405757, 'weight_topheavy_high': 4.07154924043423}. Best is trial 22 with value: 0.20812651967210466.
[I 2026-04-18 17:03:04,582] Trial 16 finished with value: 0.1480403823748978 and parameters: {'hidden_dims': '[256, 128]', 'dropout': 0.5074161249524229, 'batch_norm': False, 'lr': 0.00018431027588064128, 'weight_decay': 9.318332791938701e-08, 'epochs': 157, 'loss': 'mae', 'optimizer': 'adam', 'use_snp_selection': True, 'num_snps': 21474, 'weight_scheme': 'minmax', 'weight_clip_max': 5.0, 'weight_minmax_eps': 0.08873980216139242}. Best is trial 16 with value: 0.1480403823748978.
[I 2026-04-18 17:03:38,769] Trial 17 finished with value: 0.1437647873805267 and parameters: {'hidden_dims': '[256, 128]', 'dropout': 0.4665896816738963, 'batch_norm': False, 'lr': 0.000991967319484892, 'weight_decay': 1.1109152535015896e-08, 'epochs': 142, 'loss': 'mae', 'optimizer': 'adam', 'use_snp_selection': True, 'num_snps': 17421, 'weight_scheme': 'minmax', 'weight_clip_max': 5.0, 'weight_minmax_eps': 0.03132521321327279}. Best is trial 16 with value: 0.1480403823748978.
[I 2026-04-18 17:03:52,121] Trial 33 finished with value: 0.1964456794138587 and parameters: {'hidden_dims': '[512, 128]', 'dropout': 0.5469648019890749, 'batch_norm': True, 'lr': 0.0006353339603389246, 'weight_decay': 9.973370776888043e-08, 'epochs': 205, 'loss': 'mae', 'optimizer': 'adamw', 'use_snp_selection': False, 'weight_scheme': 'linear', 'weight_clip_max': None, 'weight_linear_min_weight': 0.9979463074712633, 'weight_linear_max_weight': 3.9175596925117713}. Best is trial 22 with value: 0.20812651967210466.
[I 2026-04-18 17:04:10,075] Trial 18 finished with value: 0.1414327683616033 and parameters: {'hidden_dims': '[512, 128]', 'dropout': 0.5136945313724723, 'batch_norm': False, 'lr': 0.0002929400255345142, 'weight_decay': 8.986308928338856e-08, 'epochs': 85, 'loss': 'mae', 'optimizer': 'adam', 'use_snp_selection': True, 'num_snps': 11217, 'weight_scheme': 'minmax', 'weight_clip_max': 10.0, 'weight_minmax_eps': 0.05911841600066412}. Best is trial 16 with value: 0.1480403823748978.
[I 2026-04-18 17:04:45,009] Trial 19 finished with value: 0.10526289887179929 and parameters: {'hidden_dims': '[512, 64]', 'dropout': 0.099358168927311, 'batch_norm': False, 'lr': 3.0032849443935244e-06, 'weight_decay': 8.461464375506128e-08, 'epochs': 52, 'loss': 'mae', 'optimizer': 'adam', 'use_snp_selection': True, 'num_snps': 21615, 'weight_scheme': 'uniform', 'weight_clip_max': None}. Best is trial 16 with value: 0.1480403823748978.
[I 2026-04-18 17:04:49,674] Trial 34 finished with value: 0.19927795219389846 and parameters: {'hidden_dims': '[512, 128]', 'dropout': 0.24464650903023916, 'batch_norm': True, 'lr': 0.00025277091244658295, 'weight_decay': 6.095663700599763e-07, 'epochs': 183, 'loss': 'mse', 'optimizer': 'adamw', 'use_snp_selection': False, 'weight_scheme': 'top-heavy', 'weight_clip_max': None, 'weight_topheavy_top_frac': 0.459612046848771, 'weight_topheavy_low': 0.8039943378543931, 'weight_topheavy_high': 5.316902333943423}. Best is trial 22 with value: 0.20812651967210466.
[I 2026-04-18 17:05:42,775] Trial 35 finished with value: 0.19952247142776078 and parameters: {'hidden_dims': '[512, 128]', 'dropout': 0.3295881045260372, 'batch_norm': False, 'lr': 0.00013534755418522545, 'weight_decay': 2.7634206854659097e-06, 'epochs': 168, 'loss': 'mae', 'optimizer': 'adamw', 'use_snp_selection': False, 'weight_scheme': 'top-heavy', 'weight_clip_max': None, 'weight_topheavy_top_frac': 0.20454327917284487, 'weight_topheavy_low': 0.9321810885185261, 'weight_topheavy_high': 3.0205496537463796}. Best is trial 22 with value: 0.20812651967210466.
[I 2026-04-18 17:05:43,795] Trial 20 finished with value: 0.1226342668134303 and parameters: {'hidden_dims': '[256, 128]', 'dropout': 0.333363655202904, 'batch_norm': False, 'lr': 0.0003691450440380083, 'weight_decay': 1.198401540618479e-06, 'epochs': 169, 'loss': 'mae', 'optimizer': 'adam', 'use_snp_selection': True, 'num_snps': 55404, 'weight_scheme': 'exponential', 'weight_clip_max': 5.0, 'weight_exponential_beta': 0.13062455500080494}. Best is trial 16 with value: 0.1480403823748978.
[I 2026-04-18 17:06:17,718] Trial 21 finished with value: 0.13337053464895474 and parameters: {'hidden_dims': '[256, 128]', 'dropout': 0.4768637348940928, 'batch_norm': False, 'lr': 0.0009554544156762355, 'weight_decay': 1.5214245993676792e-08, 'epochs': 131, 'loss': 'mae', 'optimizer': 'adam', 'use_snp_selection': True, 'num_snps': 17186, 'weight_scheme': 'minmax', 'weight_clip_max': 5.0, 'weight_minmax_eps': 0.00859901796358926}. Best is trial 16 with value: 0.1480403823748978.
[I 2026-04-18 17:06:26,715] Trial 36 finished with value: 0.20489969558006887 and parameters: {'hidden_dims': '[512, 128]', 'dropout': 0.010661409479660877, 'batch_norm': True, 'lr': 0.0006161332373804793, 'weight_decay': 8.033973907169943e-06, 'epochs': 135, 'loss': 'mse', 'optimizer': 'adamw', 'use_snp_selection': False, 'weight_scheme': 'linear', 'weight_clip_max': None, 'weight_linear_min_weight': 0.5792655271220406, 'weight_linear_max_weight': 2.7718033711350993}. Best is trial 22 with value: 0.20812651967210466.
[I 2026-04-18 17:06:57,038] Trial 22 finished with value: 0.12828206344754994 and parameters: {'hidden_dims': '[256, 128]', 'dropout': 0.4366945259833055, 'batch_norm': False, 'lr': 0.0006264429171840311, 'weight_decay': 1.1601009644325623e-08, 'epochs': 132, 'loss': 'mae', 'optimizer': 'adam', 'use_snp_selection': True, 'num_snps': 27074, 'weight_scheme': 'minmax', 'weight_clip_max': 5.0, 'weight_minmax_eps': 0.037766426260483286}. Best is trial 16 with value: 0.1480403823748978.
[I 2026-04-18 17:07:32,140] Trial 23 finished with value: 0.14687669177325527 and parameters: {'hidden_dims': '[256, 128]', 'dropout': 0.5317107755492196, 'batch_norm': False, 'lr': 0.0002301144998353301, 'weight_decay': 3.5219220128634754e-08, 'epochs': 163, 'loss': 'mae', 'optimizer': 'adam', 'use_snp_selection': True, 'num_snps': 17167, 'weight_scheme': 'minmax', 'weight_clip_max': 5.0, 'weight_minmax_eps': 0.003892874767166251}. Best is trial 16 with value: 0.1480403823748978.
[I 2026-04-18 17:07:43,141] Trial 37 finished with value: 0.13743311683188106 and parameters: {'hidden_dims': '[512, 128]', 'dropout': 0.008456701899376251, 'batch_norm': True, 'lr': 0.000645782759687988, 'weight_decay': 8.238465828074527e-06, 'epochs': 140, 'loss': 'mse', 'optimizer': 'sgd', 'use_snp_selection': True, 'num_snps': 59218, 'weight_scheme': 'linear', 'weight_clip_max': 10.0, 'weight_linear_min_weight': 0.6152595789784101, 'weight_linear_max_weight': 2.7448285946159583}. Best is trial 22 with value: 0.20812651967210466.
[I 2026-04-18 17:08:01,367] Trial 24 finished with value: 0.12172062437698435 and parameters: {'hidden_dims': '[256, 128]', 'dropout': 0.5348919040177501, 'batch_norm': False, 'lr': 0.00019954384936120948, 'weight_decay': 2.318015755502608e-07, 'epochs': 183, 'loss': 'mae', 'optimizer': 'adam', 'use_snp_selection': True, 'num_snps': 7611, 'weight_scheme': 'minmax', 'weight_clip_max': 5.0, 'weight_minmax_eps': 0.14143814331183444}. Best is trial 16 with value: 0.1480403823748978.
[I 2026-04-18 17:08:04,759] Trial 38 finished with value: 0.18109722110522247 and parameters: {'hidden_dims': '[256, 128]', 'dropout': 0.10831588020909366, 'batch_norm': False, 'lr': 1.3089818308659964e-05, 'weight_decay': 9.877385036445563e-05, 'epochs': 116, 'loss': 'mse', 'optimizer': 'adamw', 'use_snp_selection': False, 'weight_scheme': 'linear', 'weight_clip_max': None, 'weight_linear_min_weight': 0.612912291115955, 'weight_linear_max_weight': 2.66100990539936}. Best is trial 22 with value: 0.20812651967210466.
[I 2026-04-18 17:08:36,585] Trial 39 finished with value: 0.08933676970457598 and parameters: {'hidden_dims': '[512, 128]', 'dropout': 0.002650538453342982, 'batch_norm': True, 'lr': 2.5439417634762217e-05, 'weight_decay': 2.788932066364639e-05, 'epochs': 95, 'loss': 'mse', 'optimizer': 'sgd', 'use_snp_selection': False, 'weight_scheme': 'linear', 'weight_clip_max': 5.0, 'weight_linear_min_weight': 0.4833019506142998, 'weight_linear_max_weight': 1.0157593722084353}. Best is trial 22 with value: 0.20812651967210466.
[I 2026-04-18 17:08:37,593] Trial 25 finished with value: 0.12904889126347824 and parameters: {'hidden_dims': '[256, 128]', 'dropout': 0.22137687366757053, 'batch_norm': False, 'lr': 5.206094055677976e-05, 'weight_decay': 4.672048684798394e-08, 'epochs': 166, 'loss': 'mae', 'optimizer': 'adam', 'use_snp_selection': True, 'num_snps': 19031, 'weight_scheme': 'minmax', 'weight_clip_max': 5.0, 'weight_minmax_eps': 0.069703376780678}. Best is trial 16 with value: 0.1480403823748978.
[I 2026-04-18 17:09:14,412] Trial 26 finished with value: 0.11721804913944052 and parameters: {'hidden_dims': '[256, 128]', 'dropout': 0.5524257972768702, 'batch_norm': True, 'lr': 1.422818713048195e-05, 'weight_decay': 1.696323987811259e-07, 'epochs': 74, 'loss': 'mae', 'optimizer': 'adam', 'use_snp_selection': True, 'num_snps': 28637, 'weight_scheme': 'top-heavy', 'weight_clip_max': 5.0, 'weight_topheavy_top_frac': 0.051598064370283137, 'weight_topheavy_low': 0.8792750097370348, 'weight_topheavy_high': 1.4890091591583912}. Best is trial 16 with value: 0.1480403823748978.
[I 2026-04-18 17:09:49,559] Trial 27 finished with value: 0.1443196206856991 and parameters: {'hidden_dims': '[512, 64]', 'dropout': 0.3708837787935253, 'batch_norm': False, 'lr': 0.00018978455021013486, 'weight_decay': 5.294838527038949e-07, 'epochs': 108, 'loss': 'mae', 'optimizer': 'adam', 'use_snp_selection': False, 'weight_scheme': 'minmax', 'weight_clip_max': 5.0, 'weight_minmax_eps': 0.13057470501265916}. Best is trial 16 with value: 0.1480403823748978.
[I 2026-04-18 17:09:50,052] Trial 0 finished with value: 0.04087572073368646 and parameters: {'hidden_dims': '[256, 128]', 'dropout': 0.18584155530312246, 'batch_norm': True, 'lr': 9.012665953349533e-06, 'weight_decay': 4.96591963698479e-06, 'epochs': 105, 'loss': 'mse', 'optimizer': 'sgd', 'use_snp_selection': True, 'num_snps': 25583, 'weight_scheme': 'minmax', 'weight_clip_max': 5.0, 'weight_minmax_eps': 0.14026014881292506}. Best is trial 0 with value: 0.04087572073368646.
[I 2026-04-18 17:10:15,835] Trial 1 finished with value: 0.07868040614828944 and parameters: {'hidden_dims': '[256, 64]', 'dropout': 0.05000949662985405, 'batch_norm': True, 'lr': 0.00015647443054904835, 'weight_decay': 5.158896024962846e-05, 'epochs': 152, 'loss': 'mse', 'optimizer': 'sgd', 'use_snp_selection': False, 'weight_scheme': 'linear', 'weight_clip_max': None, 'weight_linear_min_weight': 0.21922985165550554, 'weight_linear_max_weight': 1.6260435767424388}. Best is trial 1 with value: 0.07868040614828944.
[I 2026-04-18 17:10:53,377] Trial 28 finished with value: 0.1363825675142259 and parameters: {'hidden_dims': '[512, 128]', 'dropout': 0.005024785499739275, 'batch_norm': False, 'lr': 0.0004745860547862348, 'weight_decay': 3.452746321341793e-08, 'epochs': 203, 'loss': 'mae', 'optimizer': 'adam', 'use_snp_selection': True, 'num_snps': 35845, 'weight_scheme': 'minmax', 'weight_clip_max': 10.0, 'weight_minmax_eps': 0.00025886831793660303}. Best is trial 16 with value: 0.1480403823748978.
[I 2026-04-18 17:10:55,513] Trial 2 finished with value: 0.05735950777623753 and parameters: {'hidden_dims': '[512, 128]', 'dropout': 0.2736730891340176, 'batch_norm': True, 'lr': 7.298114623433994e-05, 'weight_decay': 5.6346010385734023e-08, 'epochs': 185, 'loss': 'mae', 'optimizer': 'sgd', 'use_snp_selection': True, 'num_snps': 14091, 'weight_scheme': 'minmax', 'weight_clip_max': 10.0, 'weight_minmax_eps': 0.045780660776687306}. Best is trial 1 with value: 0.07868040614828944.
[I 2026-04-18 17:11:23,390] Trial 29 finished with value: 0.12583223257876552 and parameters: {'hidden_dims': '[256, 128]', 'dropout': 0.16710401627908544, 'batch_norm': True, 'lr': 6.535273816978656e-05, 'weight_decay': 2.2181800912912134e-06, 'epochs': 97, 'loss': 'mse', 'optimizer': 'adam', 'use_snp_selection': True, 'num_snps': 12777, 'weight_scheme': 'minmax', 'weight_clip_max': None, 'weight_minmax_eps': 0.019684509470822315}. Best is trial 16 with value: 0.1480403823748978.
[I 2026-04-18 17:12:11,822] Trial 30 finished with value: 0.13585168767216632 and parameters: {'hidden_dims': '[256, 128]', 'dropout': 0.42157533994314306, 'batch_norm': False, 'lr': 6.266598189912153e-06, 'weight_decay': 1.2324238588606992e-07, 'epochs': 111, 'loss': 'mae', 'optimizer': 'adam', 'use_snp_selection': True, 'num_snps': 48254, 'weight_scheme': 'top-heavy', 'weight_clip_max': 5.0, 'weight_topheavy_top_frac': 0.42502649469974096, 'weight_topheavy_low': 0.5969813796204919, 'weight_topheavy_high': 5.550294442665827}. Best is trial 16 with value: 0.1480403823748978.
[I 2026-04-18 17:12:17,407] Trial 3 finished with value: 0.035353489986000346 and parameters: {'hidden_dims': '[512, 64]', 'dropout': 0.30157795416637295, 'batch_norm': False, 'lr': 2.007492282795256e-05, 'weight_decay': 5.496446859789657e-06, 'epochs': 284, 'loss': 'mse', 'optimizer': 'sgd', 'use_snp_selection': False, 'weight_scheme': 'linear', 'weight_clip_max': None, 'weight_linear_min_weight': 0.24682154527102826, 'weight_linear_max_weight': 1.8338910783134623}. Best is trial 1 with value: 0.07868040614828944.
[I 2026-04-18 17:12:42,217] Trial 4 finished with value: 0.08249975659791263 and parameters: {'hidden_dims': '[256, 64]', 'dropout': 0.18128694708490736, 'batch_norm': False, 'lr': 8.951826748007403e-05, 'weight_decay': 2.1781541495465197e-07, 'epochs': 147, 'loss': 'mse', 'optimizer': 'sgd', 'use_snp_selection': False, 'weight_scheme': 'top-heavy', 'weight_clip_max': 5.0, 'weight_topheavy_top_frac': 0.1724888194073277, 'weight_topheavy_low': 1.1620865802171172, 'weight_topheavy_high': 3.476906528073177}. Best is trial 4 with value: 0.08249975659791263.
[I 2026-04-18 17:12:51,027] Trial 31 finished with value: 0.15678558224551004 and parameters: {'hidden_dims': '[512, 64]', 'dropout': 0.32609983766189055, 'batch_norm': False, 'lr': 0.00020147103366091915, 'weight_decay': 5.231039854966144e-07, 'epochs': 123, 'loss': 'mae', 'optimizer': 'adam', 'use_snp_selection': False, 'weight_scheme': 'minmax', 'weight_clip_max': 5.0, 'weight_minmax_eps': 0.13734032161372725}. Best is trial 31 with value: 0.15678558224551004.
[I 2026-04-18 17:13:03,524] Trial 5 finished with value: 0.09495320586655975 and parameters: {'hidden_dims': '[256, 64]', 'dropout': 0.2571412946970998, 'batch_norm': True, 'lr': 3.546238022482882e-05, 'weight_decay': 1.0185234767613396e-06, 'epochs': 119, 'loss': 'mse', 'optimizer': 'sgd', 'use_snp_selection': False, 'weight_scheme': 'linear', 'weight_clip_max': 10.0, 'weight_linear_min_weight': 0.9405832045183805, 'weight_linear_max_weight': 3.413610925325811}. Best is trial 5 with value: 0.09495320586655975.
[I 2026-04-18 17:13:39,048] Trial 32 finished with value: 0.15113465247129992 and parameters: {'hidden_dims': '[512, 64]', 'dropout': 0.3281647284303079, 'batch_norm': False, 'lr': 0.00013352411008989298, 'weight_decay': 3.8817346842328994e-07, 'epochs': 155, 'loss': 'mae', 'optimizer': 'adam', 'use_snp_selection': False, 'weight_scheme': 'minmax', 'weight_clip_max': 5.0, 'weight_minmax_eps': 0.11945606965278643}. Best is trial 31 with value: 0.15678558224551004.
[I 2026-04-18 17:13:42,991] Trial 6 finished with value: 0.12003044906243235 and parameters: {'hidden_dims': '[256, 64]', 'dropout': 0.037961443806696214, 'batch_norm': True, 'lr': 3.644202049829694e-05, 'weight_decay': 9.73334309820277e-06, 'epochs': 243, 'loss': 'mae', 'optimizer': 'adam', 'use_snp_selection': False, 'weight_scheme': 'minmax', 'weight_clip_max': None, 'weight_minmax_eps': 0.08689611239934374}. Best is trial 6 with value: 0.12003044906243235.
[I 2026-04-18 17:14:30,876] Trial 33 finished with value: 0.14192241466098826 and parameters: {'hidden_dims': '[512, 64]', 'dropout': 0.34050319412534974, 'batch_norm': False, 'lr': 0.00013367241229514571, 'weight_decay': 2.748189673535945e-06, 'epochs': 168, 'loss': 'mae', 'optimizer': 'adam', 'use_snp_selection': False, 'weight_scheme': 'linear', 'weight_clip_max': 5.0, 'weight_linear_min_weight': 0.9873362156766972, 'weight_linear_max_weight': 3.957328567431956}. Best is trial 31 with value: 0.15678558224551004.
[I 2026-04-18 17:15:00,991] Trial 7 finished with value: 0.04353740727031136 and parameters: {'hidden_dims': '[512, 128]', 'dropout': 0.1304538168539244, 'batch_norm': False, 'lr': 1.5408060926311233e-05, 'weight_decay': 2.1989735568314356e-08, 'epochs': 250, 'loss': 'mse', 'optimizer': 'sgd', 'use_snp_selection': True, 'num_snps': 42550, 'weight_scheme': 'exponential', 'weight_clip_max': 10.0, 'weight_exponential_beta': 2.758850226029358}. Best is trial 6 with value: 0.12003044906243235.
[I 2026-04-18 17:15:19,558] Trial 34 finished with value: 0.14596302320930843 and parameters: {'hidden_dims': '[512, 64]', 'dropout': 0.24263231028869553, 'batch_norm': True, 'lr': 0.00023817567572493095, 'weight_decay': 4.4269292316719745e-08, 'epochs': 156, 'loss': 'mse', 'optimizer': 'adam', 'use_snp_selection': False, 'weight_scheme': 'minmax', 'weight_clip_max': 5.0, 'weight_minmax_eps': 0.1149119576083837}. Best is trial 31 with value: 0.15678558224551004.
[I 2026-04-18 17:15:38,737] Trial 8 finished with value: 0.10483747883147569 and parameters: {'hidden_dims': '[256, 128]', 'dropout': 0.05742396906738376, 'batch_norm': False, 'lr': 1.9761509510575143e-06, 'weight_decay': 2.933492239224291e-07, 'epochs': 82, 'loss': 'mae', 'optimizer': 'adam', 'use_snp_selection': True, 'num_snps': 29883, 'weight_scheme': 'minmax', 'weight_clip_max': 5.0, 'weight_minmax_eps': 0.0051288771726799584}. Best is trial 6 with value: 0.12003044906243235.
[I 2026-04-18 17:16:00,195] Trial 35 finished with value: 0.1520819304294355 and parameters: {'hidden_dims': '[512, 64]', 'dropout': 0.2997545790387678, 'batch_norm': False, 'lr': 0.00010537071077434519, 'weight_decay': 8.617265867785736e-06, 'epochs': 127, 'loss': 'mae', 'optimizer': 'adam', 'use_snp_selection': False, 'weight_scheme': 'minmax', 'weight_clip_max': None, 'weight_minmax_eps': 0.16822655028603198}. Best is trial 31 with value: 0.15678558224551004.
[I 2026-04-18 17:16:26,768] Trial 9 finished with value: 0.11066010787473952 and parameters: {'hidden_dims': '[256, 128]', 'dropout': 0.5795930447285386, 'batch_norm': False, 'lr': 0.00011782025260263196, 'weight_decay': 0.0005562063174273634, 'epochs': 218, 'loss': 'mae', 'optimizer': 'adamw', 'use_snp_selection': True, 'num_snps': 32226, 'weight_scheme': 'minmax', 'weight_clip_max': 5.0, 'weight_minmax_eps': 0.09600289105543994}. Best is trial 6 with value: 0.12003044906243235.
