[I 2026-04-22 15:12:43,526] Trial 70 finished with value: 0.16411027164528777 and parameters: {'alpha': 25540.769143191726, 'use_snp_selection': False, 'weight_scheme': 'minmax', 'weight_clip_max': None, 'weight_minmax_eps': 0.1888333064595815}. Best is trial 57 with value: 0.18897998148901726.
[I 2026-04-22 15:13:44,441] Trial 71 finished with value: 0.18860144384915148 and parameters: {'alpha': 386016.7008394424, 'use_snp_selection': False, 'weight_scheme': 'minmax', 'weight_clip_max': None, 'weight_minmax_eps': 0.19066673028153985}. Best is trial 57 with value: 0.18897998148901726.
[I 2026-04-22 15:14:45,268] Trial 72 finished with value: 0.1871224183784219 and parameters: {'alpha': 203023.9329091345, 'use_snp_selection': False, 'weight_scheme': 'minmax', 'weight_clip_max': None, 'weight_minmax_eps': 0.18926058340332325}. Best is trial 57 with value: 0.18897998148901726.
[I 2026-04-22 15:15:46,248] Trial 73 finished with value: 0.1851351880431679 and parameters: {'alpha': 1035910.0097285763, 'use_snp_selection': False, 'weight_scheme': 'minmax', 'weight_clip_max': None, 'weight_minmax_eps': 0.19027936346959762}. Best is trial 57 with value: 0.18897998148901726.
[I 2026-04-22 15:16:47,160] Trial 74 finished with value: 0.18968590170565564 and parameters: {'alpha': 411940.6936113563, 'use_snp_selection': False, 'weight_scheme': 'minmax', 'weight_clip_max': None, 'weight_minmax_eps': 0.07164231424627517}. Best is trial 74 with value: 0.18968590170565564.
[I 2026-04-22 15:17:48,080] Trial 75 finished with value: 0.18966290195055388 and parameters: {'alpha': 557102.6416320939, 'use_snp_selection': False, 'weight_scheme': 'minmax', 'weight_clip_max': None, 'weight_minmax_eps': 0.0417322370783728}. Best is trial 74 with value: 0.18968590170565564.
[I 2026-04-22 15:18:49,249] Trial 76 finished with value: 0.1840662986511612 and parameters: {'alpha': 1588445.1632118837, 'use_snp_selection': False, 'weight_scheme': 'minmax', 'weight_clip_max': None, 'weight_minmax_eps': 0.06957910894338103}. Best is trial 74 with value: 0.18968590170565564.
[I 2026-04-22 15:19:50,049] Trial 77 finished with value: 0.17340136217751434 and parameters: {'alpha': 6379786.285496087, 'use_snp_selection': False, 'weight_scheme': 'minmax', 'weight_clip_max': 10.0, 'weight_minmax_eps': 0.036610940168956455}. Best is trial 74 with value: 0.18968590170565564.
[I 2026-04-22 15:21:54,500] Trial 78 finished with value: 0.18354644746579354 and parameters: {'alpha': 776817.9223226644, 'use_snp_selection': True, 'num_snps': 33389, 'weight_scheme': 'linear', 'weight_clip_max': None, 'weight_linear_min_weight': 0.3561855186030619, 'weight_linear_max_weight': 3.091019276247231}. Best is trial 74 with value: 0.18968590170565564.
[I 2026-04-22 15:22:55,370] Trial 79 finished with value: 0.18758965007158565 and parameters: {'alpha': 203389.3602320931, 'use_snp_selection': False, 'weight_scheme': 'minmax', 'weight_clip_max': 5.0, 'weight_minmax_eps': 0.057851284655842494}. Best is trial 74 with value: 0.18968590170565564.
[I 2026-04-22 15:23:56,239] Trial 80 finished with value: 0.17983806778179912 and parameters: {'alpha': 562428.3978891638, 'use_snp_selection': False, 'weight_scheme': 'top-heavy', 'weight_clip_max': None, 'weight_topheavy_top_frac': 0.4935997774833273, 'weight_topheavy_low': 0.7053894561486598, 'weight_topheavy_high': 3.696017273460284}. Best is trial 74 with value: 0.18968590170565564.
[I 2026-04-22 15:24:57,256] Trial 81 finished with value: 0.18983861274711603 and parameters: {'alpha': 453040.36597709445, 'use_snp_selection': False, 'weight_scheme': 'minmax', 'weight_clip_max': None, 'weight_minmax_eps': 0.04465900880901485}. Best is trial 81 with value: 0.18983861274711603.
[I 2026-04-22 15:25:58,283] Trial 82 finished with value: 0.18285132375873328 and parameters: {'alpha': 1986032.9806713513, 'use_snp_selection': False, 'weight_scheme': 'minmax', 'weight_clip_max': None, 'weight_minmax_eps': 0.03527471987447224}. Best is trial 81 with value: 0.18983861274711603.
[I 2026-04-22 15:26:59,244] Trial 83 finished with value: 0.1897778489414344 and parameters: {'alpha': 385471.03042584774, 'use_snp_selection': False, 'weight_scheme': 'minmax', 'weight_clip_max': None, 'weight_minmax_eps': 0.04451106912729639}. Best is trial 81 with value: 0.18983861274711603.
[I 2026-04-22 15:28:00,073] Trial 84 finished with value: 0.18834220921109837 and parameters: {'alpha': 237680.5642173798, 'use_snp_selection': False, 'weight_scheme': 'minmax', 'weight_clip_max': None, 'weight_minmax_eps': 0.008489929832301374}. Best is trial 81 with value: 0.18983861274711603.
[I 2026-04-22 15:29:00,967] Trial 85 finished with value: 0.1866056114131392 and parameters: {'alpha': 1157887.2168387538, 'use_snp_selection': False, 'weight_scheme': 'minmax', 'weight_clip_max': None, 'weight_minmax_eps': 0.048600806250076733}. Best is trial 81 with value: 0.18983861274711603.
[I 2026-04-22 15:29:50,415] Trial 86 finished with value: 0.17489871969279863 and parameters: {'alpha': 92209.06348138335, 'use_snp_selection': False, 'weight_scheme': 'uniform', 'weight_clip_max': None}. Best is trial 81 with value: 0.18983861274711603.
[I 2026-04-22 15:30:51,018] Trial 87 finished with value: 0.18888072812248083 and parameters: {'alpha': 639342.1668394452, 'use_snp_selection': False, 'weight_scheme': 'minmax', 'weight_clip_max': None, 'weight_minmax_eps': 0.09055679410823508}. Best is trial 81 with value: 0.18983861274711603.
[I 2026-04-22 15:31:51,981] Trial 88 finished with value: 0.17533129215070406 and parameters: {'alpha': 690418.3292006635, 'use_snp_selection': False, 'weight_scheme': 'exponential', 'weight_clip_max': None, 'weight_exponential_beta': 0.15950714175505398}. Best is trial 81 with value: 0.18983861274711603.
[I 2026-04-22 15:32:52,581] Trial 89 finished with value: 0.12639370945246348 and parameters: {'alpha': 809.3892619903352, 'use_snp_selection': False, 'weight_scheme': 'minmax', 'weight_clip_max': None, 'weight_minmax_eps': 0.08405649850972972}. Best is trial 81 with value: 0.18983861274711603.
[I 2026-04-22 15:35:13,136] Trial 90 finished with value: 0.1043861044614324 and parameters: {'alpha': 30.67693205959959, 'use_snp_selection': True, 'num_snps': 43616, 'weight_scheme': 'minmax', 'weight_clip_max': None, 'weight_minmax_eps': 0.09843898068596096}. Best is trial 81 with value: 0.18983861274711603.
[I 2026-04-22 15:36:13,701] Trial 91 finished with value: 0.1895313836824362 and parameters: {'alpha': 327838.19782813266, 'use_snp_selection': False, 'weight_scheme': 'minmax', 'weight_clip_max': None, 'weight_minmax_eps': 0.04189058502867797}. Best is trial 81 with value: 0.18983861274711603.
[I 2026-04-22 15:37:14,207] Trial 92 finished with value: 0.18905053814543044 and parameters: {'alpha': 275623.40128229, 'use_snp_selection': False, 'weight_scheme': 'minmax', 'weight_clip_max': None, 'weight_minmax_eps': 0.04713785214723675}. Best is trial 81 with value: 0.18983861274711603.
[I 2026-04-22 15:38:15,030] Trial 93 finished with value: 0.18471964759825393 and parameters: {'alpha': 131978.43697004524, 'use_snp_selection': False, 'weight_scheme': 'minmax', 'weight_clip_max': None, 'weight_minmax_eps': 0.042126418531393366}. Best is trial 81 with value: 0.18983861274711603.
[I 2026-04-22 15:39:15,955] Trial 94 finished with value: 0.1889471059436297 and parameters: {'alpha': 270410.92977734905, 'use_snp_selection': False, 'weight_scheme': 'minmax', 'weight_clip_max': None, 'weight_minmax_eps': 0.02152394593479308}. Best is trial 81 with value: 0.18983861274711603.
[I 2026-04-22 15:40:16,706] Trial 95 finished with value: 0.18929343806530047 and parameters: {'alpha': 300358.49308881303, 'use_snp_selection': False, 'weight_scheme': 'minmax', 'weight_clip_max': None, 'weight_minmax_eps': 0.02226750205173418}. Best is trial 81 with value: 0.18983861274711603.
[I 2026-04-22 15:41:17,436] Trial 96 finished with value: 0.18886596533318142 and parameters: {'alpha': 264967.13115468604, 'use_snp_selection': False, 'weight_scheme': 'minmax', 'weight_clip_max': 10.0, 'weight_minmax_eps': 0.020129870387034666}. Best is trial 81 with value: 0.18983861274711603.
[I 2026-04-22 15:42:18,265] Trial 97 finished with value: 0.17911075813500635 and parameters: {'alpha': 74969.97133706408, 'use_snp_selection': False, 'weight_scheme': 'minmax', 'weight_clip_max': None, 'weight_minmax_eps': 0.04973349951402578}. Best is trial 81 with value: 0.18983861274711603.
[I 2026-04-22 15:43:19,271] Trial 98 finished with value: 0.1864951887027964 and parameters: {'alpha': 169599.92064455064, 'use_snp_selection': False, 'weight_scheme': 'minmax', 'weight_clip_max': None, 'weight_minmax_eps': 0.016854802176355887}. Best is trial 81 with value: 0.18983861274711603.
[I 2026-04-22 15:44:20,273] Trial 99 finished with value: 0.18929977984950092 and parameters: {'alpha': 590966.052770922, 'use_snp_selection': False, 'weight_scheme': 'minmax', 'weight_clip_max': 5.0, 'weight_minmax_eps': 0.06492588699240807}. Best is trial 81 with value: 0.18983861274711603.
