[I 2026-05-04 04:59:49,073] Trial 112 finished with value: 0.20069208416752699 and parameters: {'alpha': 462367.2572729333, 'use_snp_selection': False, 'iw_method': 'pc_logistic', 'iw_clip_max': 2.0, 'iw_prob_clip': 0.002664806265557027, 'iw_n_components': 10, 'iw_logistic_c': 0.3210275977240993, 'iw_pca_fit': 'combined', 'iw_solver': 'lbfgs', 'iw_rho': 1.0}. Best is trial 109 with value: 0.20900188172275155.
[I 2026-05-04 05:02:33,960] Trial 113 finished with value: 0.20758914867429873 and parameters: {'alpha': 408182.61185240437, 'use_snp_selection': False, 'iw_method': 'pc_logistic', 'iw_clip_max': 2.0, 'iw_prob_clip': 0.017871652140221354, 'iw_n_components': 10, 'iw_logistic_c': 0.747094461680233, 'iw_pca_fit': 'combined', 'iw_solver': 'lbfgs', 'iw_rho': 1.0}. Best is trial 109 with value: 0.20900188172275155.
[I 2026-05-04 05:05:18,280] Trial 114 finished with value: 0.20772341586806348 and parameters: {'alpha': 405073.49034946325, 'use_snp_selection': False, 'iw_method': 'pc_logistic', 'iw_clip_max': 2.0, 'iw_prob_clip': 0.016812725956128004, 'iw_n_components': 10, 'iw_logistic_c': 0.9054002498165225, 'iw_pca_fit': 'combined', 'iw_solver': 'lbfgs', 'iw_rho': 1.0}. Best is trial 109 with value: 0.20900188172275155.
[I 2026-05-04 05:08:03,324] Trial 115 finished with value: 0.20730375760494044 and parameters: {'alpha': 458042.40997822257, 'use_snp_selection': False, 'iw_method': 'pc_logistic', 'iw_clip_max': 2.0, 'iw_prob_clip': 0.017180063539604468, 'iw_n_components': 10, 'iw_logistic_c': 0.06259783158531496, 'iw_pca_fit': 'combined', 'iw_solver': 'lbfgs', 'iw_rho': 1.0}. Best is trial 109 with value: 0.20900188172275155.
[I 2026-05-04 05:10:48,035] Trial 116 finished with value: 0.20805236117153206 and parameters: {'alpha': 408781.57923756033, 'use_snp_selection': False, 'iw_method': 'pc_logistic', 'iw_clip_max': 2.0, 'iw_prob_clip': 0.015434944315360124, 'iw_n_components': 10, 'iw_logistic_c': 0.9536608247659217, 'iw_pca_fit': 'combined', 'iw_solver': 'lbfgs', 'iw_rho': 1.0}. Best is trial 109 with value: 0.20900188172275155.
[I 2026-05-04 05:13:35,022] Trial 117 finished with value: 0.20563289216931624 and parameters: {'alpha': 418517.97915712703, 'use_snp_selection': False, 'iw_method': 'pc_logistic', 'iw_clip_max': 2.0, 'iw_prob_clip': 0.013518843408022528, 'iw_n_components': 10, 'iw_logistic_c': 0.9638424800268725, 'iw_pca_fit': 'combined', 'iw_solver': 'lbfgs', 'iw_rho': 1.0}. Best is trial 109 with value: 0.20900188172275155.
[I 2026-05-04 05:16:22,456] Trial 118 finished with value: 0.20724306480144722 and parameters: {'alpha': 399322.6867389375, 'use_snp_selection': False, 'iw_method': 'pc_logistic', 'iw_clip_max': 2.0, 'iw_prob_clip': 0.015332064974239048, 'iw_n_components': 10, 'iw_logistic_c': 4.306168287522107, 'iw_pca_fit': 'combined', 'iw_solver': 'lbfgs', 'iw_rho': 1.0}. Best is trial 109 with value: 0.20900188172275155.
[I 2026-05-04 05:19:10,697] Trial 119 finished with value: 0.20519285421201397 and parameters: {'alpha': 367731.84962568834, 'use_snp_selection': False, 'iw_method': 'pc_logistic', 'iw_clip_max': 2.0, 'iw_prob_clip': 0.011154800185960632, 'iw_n_components': 10, 'iw_logistic_c': 0.6412392954282873, 'iw_pca_fit': 'combined', 'iw_solver': 'lbfgs', 'iw_rho': 1.0}. Best is trial 109 with value: 0.20900188172275155.
[I 2026-05-04 05:21:58,866] Trial 120 finished with value: 0.2074995273593298 and parameters: {'alpha': 521291.50922717794, 'use_snp_selection': False, 'iw_method': 'pc_logistic', 'iw_clip_max': 2.0, 'iw_prob_clip': 0.01777427566614005, 'iw_n_components': 10, 'iw_logistic_c': 2.199321735907781, 'iw_pca_fit': 'combined', 'iw_solver': 'lbfgs', 'iw_rho': 1.0}. Best is trial 109 with value: 0.20900188172275155.
[I 2026-05-04 05:24:45,960] Trial 121 finished with value: 0.204465147283363 and parameters: {'alpha': 514002.0412744071, 'use_snp_selection': False, 'iw_method': 'pc_logistic', 'iw_clip_max': 2.0, 'iw_prob_clip': 0.020742931268305724, 'iw_n_components': 10, 'iw_logistic_c': 1.8641340385639058, 'iw_pca_fit': 'combined', 'iw_solver': 'lbfgs', 'iw_rho': 1.0}. Best is trial 109 with value: 0.20900188172275155.
[I 2026-05-04 05:27:31,997] Trial 122 finished with value: 0.2066036220040392 and parameters: {'alpha': 496892.8287268154, 'use_snp_selection': False, 'iw_method': 'pc_logistic', 'iw_clip_max': 2.0, 'iw_prob_clip': 0.017611841111631926, 'iw_n_components': 10, 'iw_logistic_c': 0.18205005471172706, 'iw_pca_fit': 'combined', 'iw_solver': 'lbfgs', 'iw_rho': 1.0}. Best is trial 109 with value: 0.20900188172275155.
[I 2026-05-04 05:30:18,250] Trial 123 finished with value: 0.20488797950293675 and parameters: {'alpha': 626965.6448799636, 'use_snp_selection': False, 'iw_method': 'pc_logistic', 'iw_clip_max': 2.0, 'iw_prob_clip': 0.012326996695933205, 'iw_n_components': 10, 'iw_logistic_c': 1.0200515661173262, 'iw_pca_fit': 'combined', 'iw_solver': 'lbfgs', 'iw_rho': 1.0}. Best is trial 109 with value: 0.20900188172275155.
[I 2026-05-04 05:33:04,634] Trial 124 finished with value: 0.20244818821038937 and parameters: {'alpha': 436240.8198557129, 'use_snp_selection': False, 'iw_method': 'pc_logistic', 'iw_clip_max': 2.0, 'iw_prob_clip': 0.008141964481813299, 'iw_n_components': 10, 'iw_logistic_c': 2.9173832645907414, 'iw_pca_fit': 'combined', 'iw_solver': 'lbfgs', 'iw_rho': 1.0}. Best is trial 109 with value: 0.20900188172275155.
[I 2026-05-04 05:35:50,952] Trial 125 finished with value: 0.20624449264470415 and parameters: {'alpha': 549618.8511387513, 'use_snp_selection': False, 'iw_method': 'pc_logistic', 'iw_clip_max': 2.0, 'iw_prob_clip': 0.02236369485180302, 'iw_n_components': 10, 'iw_logistic_c': 9.529050921456559, 'iw_pca_fit': 'combined', 'iw_solver': 'lbfgs', 'iw_rho': 1.0}. Best is trial 109 with value: 0.20900188172275155.
[I 2026-05-04 05:38:37,307] Trial 126 finished with value: 0.20404580253532312 and parameters: {'alpha': 395750.1859906566, 'use_snp_selection': False, 'iw_method': 'pc_logistic', 'iw_clip_max': 2.0, 'iw_prob_clip': 0.0163284622442202, 'iw_n_components': 10, 'iw_logistic_c': 1.752194125939237, 'iw_pca_fit': 'combined', 'iw_solver': 'lbfgs', 'iw_rho': 1.0}. Best is trial 109 with value: 0.20900188172275155.
[I 2026-05-04 05:39:08,416] Trial 127 finished with value: 0.19277456653246222 and parameters: {'alpha': 693339.0755581878, 'use_snp_selection': False, 'iw_method': 'uniform'}. Best is trial 109 with value: 0.20900188172275155.
[I 2026-05-04 05:41:55,883] Trial 128 finished with value: 0.2077229048908212 and parameters: {'alpha': 447937.01906531834, 'use_snp_selection': False, 'iw_method': 'pc_logistic', 'iw_clip_max': 2.0, 'iw_prob_clip': 0.01828538820565099, 'iw_n_components': 10, 'iw_logistic_c': 0.7218378862402887, 'iw_pca_fit': 'combined', 'iw_solver': 'lbfgs', 'iw_rho': 1.0}. Best is trial 109 with value: 0.20900188172275155.
[I 2026-05-04 05:44:45,103] Trial 129 finished with value: 0.20721244823937748 and parameters: {'alpha': 375298.70577673125, 'use_snp_selection': False, 'iw_method': 'pc_logistic', 'iw_clip_max': 2.0, 'iw_prob_clip': 0.01945943120097953, 'iw_n_components': 10, 'iw_logistic_c': 0.628775801245867, 'iw_pca_fit': 'combined', 'iw_solver': 'lbfgs', 'iw_rho': 1.0}. Best is trial 109 with value: 0.20900188172275155.
[I 2026-05-04 05:47:32,614] Trial 130 finished with value: 0.2079691509060598 and parameters: {'alpha': 442471.6747784096, 'use_snp_selection': False, 'iw_method': 'pc_logistic', 'iw_clip_max': 2.0, 'iw_prob_clip': 0.014947150520970377, 'iw_n_components': 10, 'iw_logistic_c': 0.37866311108430356, 'iw_pca_fit': 'combined', 'iw_solver': 'lbfgs', 'iw_rho': 1.0}. Best is trial 109 with value: 0.20900188172275155.
[I 2026-05-04 05:50:20,270] Trial 131 finished with value: 0.2064265362460497 and parameters: {'alpha': 443239.4770455144, 'use_snp_selection': False, 'iw_method': 'pc_logistic', 'iw_clip_max': 2.0, 'iw_prob_clip': 0.013621434499120937, 'iw_n_components': 10, 'iw_logistic_c': 0.34408729975177776, 'iw_pca_fit': 'combined', 'iw_solver': 'lbfgs', 'iw_rho': 1.0}. Best is trial 109 with value: 0.20900188172275155.
[I 2026-05-04 05:53:07,457] Trial 132 finished with value: 0.2065390008694834 and parameters: {'alpha': 481768.0851438416, 'use_snp_selection': False, 'iw_method': 'pc_logistic', 'iw_clip_max': 2.0, 'iw_prob_clip': 0.015003736134612857, 'iw_n_components': 10, 'iw_logistic_c': 0.8313912922637133, 'iw_pca_fit': 'combined', 'iw_solver': 'lbfgs', 'iw_rho': 1.0}. Best is trial 109 with value: 0.20900188172275155.
[I 2026-05-04 05:55:54,132] Trial 133 finished with value: 0.20750377829336825 and parameters: {'alpha': 415188.0811531906, 'use_snp_selection': False, 'iw_method': 'pc_logistic', 'iw_clip_max': 2.0, 'iw_prob_clip': 0.020898447095366066, 'iw_n_components': 10, 'iw_logistic_c': 0.18945579873236884, 'iw_pca_fit': 'combined', 'iw_solver': 'lbfgs', 'iw_rho': 1.0}. Best is trial 109 with value: 0.20900188172275155.
[I 2026-05-04 05:58:41,405] Trial 134 finished with value: 0.2020069232864516 and parameters: {'alpha': 600682.0277013902, 'use_snp_selection': False, 'iw_method': 'pc_logistic', 'iw_clip_max': 2.0, 'iw_prob_clip': 0.011134449398977885, 'iw_n_components': 10, 'iw_logistic_c': 0.41707170924739706, 'iw_pca_fit': 'combined', 'iw_solver': 'lbfgs', 'iw_rho': 1.0}. Best is trial 109 with value: 0.20900188172275155.
[I 2026-05-04 06:01:25,273] Trial 135 finished with value: 0.2037108133701048 and parameters: {'alpha': 353505.192724228, 'use_snp_selection': False, 'iw_method': 'pc_logistic', 'iw_clip_max': 2.0, 'iw_prob_clip': 0.023448645430206746, 'iw_n_components': 10, 'iw_logistic_c': 5.696351742375821e-07, 'iw_pca_fit': 'combined', 'iw_solver': 'lbfgs', 'iw_rho': 0.75}. Best is trial 109 with value: 0.20900188172275155.
[I 2026-05-04 06:04:22,165] Trial 136 finished with value: 0.20589697348791464 and parameters: {'alpha': 390515.63189864514, 'use_snp_selection': False, 'iw_method': 'pc_logistic', 'iw_clip_max': 2.0, 'iw_prob_clip': 0.016047347038820707, 'iw_n_components': 30, 'iw_logistic_c': 1.261321272464055, 'iw_pca_fit': 'combined', 'iw_solver': 'lbfgs', 'iw_rho': 1.0}. Best is trial 109 with value: 0.20900188172275155.
[I 2026-05-04 06:07:05,959] Trial 137 finished with value: 0.2024752452939916 and parameters: {'alpha': 444083.830060166, 'use_snp_selection': False, 'iw_method': 'pc_logistic', 'iw_clip_max': 2.0, 'iw_prob_clip': 0.0061064057606132075, 'iw_n_components': 10, 'iw_logistic_c': 8.786305011010395e-07, 'iw_pca_fit': 'combined', 'iw_solver': 'lbfgs', 'iw_rho': 0.9}. Best is trial 109 with value: 0.20900188172275155.
[I 2026-05-04 06:09:53,079] Trial 138 finished with value: 0.20090870120584509 and parameters: {'alpha': 490063.2167059706, 'use_snp_selection': False, 'iw_method': 'pc_logistic', 'iw_clip_max': 2.0, 'iw_prob_clip': 0.013018925208537294, 'iw_n_components': 20, 'iw_logistic_c': 2.183580105940131e-06, 'iw_pca_fit': 'combined', 'iw_solver': 'lbfgs', 'iw_rho': 0.75}. Best is trial 109 with value: 0.20900188172275155.
[I 2026-05-04 06:12:40,164] Trial 139 finished with value: 0.20687816648927004 and parameters: {'alpha': 327158.15518574277, 'use_snp_selection': False, 'iw_method': 'pc_logistic', 'iw_clip_max': 2.0, 'iw_prob_clip': 0.01849901588371943, 'iw_n_components': 10, 'iw_logistic_c': 5.859614152234077, 'iw_pca_fit': 'combined', 'iw_solver': 'lbfgs', 'iw_rho': 1.0}. Best is trial 109 with value: 0.20900188172275155.
[I 2026-05-04 06:15:53,111] Trial 140 finished with value: 0.20381345911671253 and parameters: {'alpha': 413693.50631950976, 'use_snp_selection': False, 'iw_method': 'pc_logistic', 'iw_clip_max': 1.25, 'iw_prob_clip': 0.009274121644062812, 'iw_n_components': 80, 'iw_logistic_c': 3.9627024153992814, 'iw_pca_fit': 'combined', 'iw_solver': 'lbfgs', 'iw_rho': 1.0}. Best is trial 109 with value: 0.20900188172275155.
[I 2026-05-04 06:18:39,871] Trial 141 finished with value: 0.20873451053242142 and parameters: {'alpha': 425293.34461073467, 'use_snp_selection': False, 'iw_method': 'pc_logistic', 'iw_clip_max': 2.0, 'iw_prob_clip': 0.02070936108209261, 'iw_n_components': 10, 'iw_logistic_c': 0.15053050409435506, 'iw_pca_fit': 'combined', 'iw_solver': 'lbfgs', 'iw_rho': 1.0}. Best is trial 109 with value: 0.20900188172275155.
[I 2026-05-04 06:21:26,705] Trial 142 finished with value: 0.20712802347302922 and parameters: {'alpha': 450646.47277246136, 'use_snp_selection': False, 'iw_method': 'pc_logistic', 'iw_clip_max': 2.0, 'iw_prob_clip': 0.027492454877397366, 'iw_n_components': 10, 'iw_logistic_c': 0.1081291352952983, 'iw_pca_fit': 'combined', 'iw_solver': 'lbfgs', 'iw_rho': 1.0}. Best is trial 109 with value: 0.20900188172275155.
[I 2026-05-04 06:24:12,923] Trial 143 finished with value: 0.20618156654727704 and parameters: {'alpha': 355403.3440817607, 'use_snp_selection': False, 'iw_method': 'pc_logistic', 'iw_clip_max': 2.0, 'iw_prob_clip': 0.01476729800525161, 'iw_n_components': 10, 'iw_logistic_c': 0.24675672571757704, 'iw_pca_fit': 'combined', 'iw_solver': 'lbfgs', 'iw_rho': 1.0}. Best is trial 109 with value: 0.20900188172275155.
[I 2026-05-04 06:26:59,216] Trial 144 finished with value: 0.20445109917921375 and parameters: {'alpha': 474950.70729875064, 'use_snp_selection': False, 'iw_method': 'pc_logistic', 'iw_clip_max': 2.0, 'iw_prob_clip': 0.020188057283454366, 'iw_n_components': 10, 'iw_logistic_c': 0.4485011905473016, 'iw_pca_fit': 'combined', 'iw_solver': 'lbfgs', 'iw_rho': 0.75}. Best is trial 109 with value: 0.20900188172275155.
[I 2026-05-04 06:29:45,385] Trial 145 finished with value: 0.20568949390973762 and parameters: {'alpha': 552840.1671497396, 'use_snp_selection': False, 'iw_method': 'pc_logistic', 'iw_clip_max': 2.0, 'iw_prob_clip': 0.016987073274193448, 'iw_n_components': 10, 'iw_logistic_c': 0.0769175407765765, 'iw_pca_fit': 'combined', 'iw_solver': 'lbfgs', 'iw_rho': 1.0}. Best is trial 109 with value: 0.20900188172275155.
[I 2026-05-04 06:32:39,680] Trial 146 finished with value: 0.20322839513206298 and parameters: {'alpha': 399647.1751933365, 'use_snp_selection': False, 'iw_method': 'pc_logistic', 'iw_clip_max': 2.0, 'iw_prob_clip': 0.023696523198343172, 'iw_n_components': 40, 'iw_logistic_c': 3.7679501604674697e-06, 'iw_pca_fit': 'combined', 'iw_solver': 'lbfgs', 'iw_rho': 1.0}. Best is trial 109 with value: 0.20900188172275155.
[I 2026-05-04 06:35:14,277] Trial 147 finished with value: 0.20549898946681688 and parameters: {'alpha': 430170.34204613545, 'use_snp_selection': False, 'iw_method': 'pc_logistic', 'iw_clip_max': 2.0, 'iw_prob_clip': 0.014908448747156813, 'iw_n_components': 10, 'iw_logistic_c': 0.02547948160410922, 'iw_pca_fit': 'combined', 'iw_solver': 'lbfgs', 'iw_rho': 0.75}. Best is trial 109 with value: 0.20900188172275155.
[I 2026-05-04 06:37:44,230] Trial 148 finished with value: 0.20932806191180608 and parameters: {'alpha': 299756.64554505306, 'use_snp_selection': False, 'iw_method': 'pc_logistic', 'iw_clip_max': 2.0, 'iw_prob_clip': 0.021726772729493665, 'iw_n_components': 10, 'iw_logistic_c': 0.8809014416579536, 'iw_pca_fit': 'combined', 'iw_solver': 'lbfgs', 'iw_rho': 1.0}. Best is trial 148 with value: 0.20932806191180608.
[I 2026-05-04 06:40:14,081] Trial 149 finished with value: 0.20845679396804423 and parameters: {'alpha': 308114.19632063375, 'use_snp_selection': False, 'iw_method': 'pc_logistic', 'iw_clip_max': 2.0, 'iw_prob_clip': 0.02249209981561087, 'iw_n_components': 10, 'iw_logistic_c': 1.0664569589482247, 'iw_pca_fit': 'combined', 'iw_solver': 'lbfgs', 'iw_rho': 1.0}. Best is trial 148 with value: 0.20932806191180608.
