[I 2026-04-18 16:43:00,311] Trial 29 finished with value: 0.07619937214955058 and parameters: {'hidden_dims': '[256, 128]', 'dropout': 0.4744983040569868, 'batch_norm': True, 'lr': 1.3444456047101768e-06, 'weight_decay': 2.377466861055299e-06, 'epochs': 201, 'loss': 'mse', 'optimizer': 'adamw', 'use_snp_selection': True, 'num_snps': 8583, 'weight_scheme': 'exponential', 'weight_clip_max': 5.0, 'weight_exponential_beta': 6.484643560797201}. Best is trial 21 with value: 0.16639477977593442.
[I 2026-04-18 16:43:18,192] Trial 30 finished with value: 0.10672414820218128 and parameters: {'hidden_dims': '[256, 128]', 'dropout': 0.33844144586536395, 'batch_norm': True, 'lr': 6.644941342357248e-06, 'weight_decay': 4.0561421279169915e-05, 'epochs': 94, 'loss': 'mse', 'optimizer': 'adam', 'use_snp_selection': False, 'weight_scheme': 'exponential', 'weight_clip_max': 5.0, 'weight_exponential_beta': 2.0450464282808745}. Best is trial 21 with value: 0.16639477977593442.
[I 2026-04-18 16:43:49,303] Trial 12 finished with value: 0.18777542360081195 and parameters: {'hidden_dims': '[512, 64]', 'dropout': 0.437522405165119, 'batch_norm': True, 'lr': 0.0008484935542405446, 'weight_decay': 5.229627468514555e-05, 'epochs': 241, 'loss': 'mae', 'optimizer': 'adam', 'use_snp_selection': False, 'weight_scheme': 'uniform', 'weight_clip_max': None}. Best is trial 6 with value: 0.1943071537897549.
[I 2026-04-18 16:44:08,948] Trial 31 finished with value: 0.1425180308680459 and parameters: {'hidden_dims': '[512, 128]', 'dropout': 0.5463149609769811, 'batch_norm': True, 'lr': 5.648536435530014e-05, 'weight_decay': 0.00041948563328267986, 'epochs': 165, 'loss': 'mse', 'optimizer': 'adamw', 'use_snp_selection': False, 'weight_scheme': 'exponential', 'weight_clip_max': 10.0, 'weight_exponential_beta': 5.20029894228866}. Best is trial 21 with value: 0.16639477977593442.
[I 2026-04-18 16:44:54,202] Trial 32 finished with value: 0.14798492142564662 and parameters: {'hidden_dims': '[512, 128]', 'dropout': 0.5458345202787583, 'batch_norm': True, 'lr': 0.00017434911466219634, 'weight_decay': 0.00043384619202745806, 'epochs': 145, 'loss': 'mse', 'optimizer': 'adamw', 'use_snp_selection': False, 'weight_scheme': 'exponential', 'weight_clip_max': 10.0, 'weight_exponential_beta': 5.036759115006763}. Best is trial 21 with value: 0.16639477977593442.
[I 2026-04-18 16:44:59,012] Trial 13 finished with value: 0.18727497077736457 and parameters: {'hidden_dims': '[512, 64]', 'dropout': 0.44665667317896396, 'batch_norm': True, 'lr': 0.0003213486734418829, 'weight_decay': 0.0005469422623397416, 'epochs': 226, 'loss': 'mae', 'optimizer': 'adam', 'use_snp_selection': False, 'weight_scheme': 'uniform', 'weight_clip_max': None}. Best is trial 6 with value: 0.1943071537897549.
[I 2026-04-18 16:45:39,257] Trial 14 finished with value: 0.13702567161398024 and parameters: {'hidden_dims': '[256, 64]', 'dropout': 0.3637180261127826, 'batch_norm': True, 'lr': 3.4085525899291203e-06, 'weight_decay': 1.4779383150687764e-05, 'epochs': 242, 'loss': 'mae', 'optimizer': 'adam', 'use_snp_selection': False, 'weight_scheme': 'exponential', 'weight_clip_max': None, 'weight_exponential_beta': 7.948849485427058}. Best is trial 6 with value: 0.1943071537897549.
[I 2026-04-18 16:45:48,523] Trial 33 finished with value: 0.147137302507412 and parameters: {'hidden_dims': '[512, 128]', 'dropout': 0.46668074388376535, 'batch_norm': True, 'lr': 6.0387921575017406e-05, 'weight_decay': 0.00015511129630764437, 'epochs': 178, 'loss': 'mse', 'optimizer': 'adamw', 'use_snp_selection': False, 'weight_scheme': 'exponential', 'weight_clip_max': 10.0, 'weight_exponential_beta': 4.432956514721151}. Best is trial 21 with value: 0.16639477977593442.
[I 2026-04-18 16:46:35,734] Trial 34 finished with value: 0.15348292052448256 and parameters: {'hidden_dims': '[512, 128]', 'dropout': 0.5509646200613995, 'batch_norm': True, 'lr': 0.00012105907027733164, 'weight_decay': 0.0002972045369490036, 'epochs': 152, 'loss': 'mse', 'optimizer': 'adamw', 'use_snp_selection': False, 'weight_scheme': 'exponential', 'weight_clip_max': 10.0, 'weight_exponential_beta': 7.106462118267089}. Best is trial 21 with value: 0.16639477977593442.
[I 2026-04-18 16:46:40,269] Trial 15 finished with value: 0.2028821499915602 and parameters: {'hidden_dims': '[512, 64]', 'dropout': 0.5998375031807794, 'batch_norm': True, 'lr': 0.00033334767961698097, 'weight_decay': 0.00016274713702826268, 'epochs': 196, 'loss': 'mae', 'optimizer': 'adamw', 'use_snp_selection': False, 'weight_scheme': 'top-heavy', 'weight_clip_max': None, 'weight_topheavy_top_frac': 0.48091952196914134, 'weight_topheavy_low': 0.5054522954723732, 'weight_topheavy_high': 5.647529144674392}. Best is trial 15 with value: 0.2028821499915602.
[I 2026-04-18 16:47:13,100] Trial 16 finished with value: 0.16907182873689316 and parameters: {'hidden_dims': '[256, 64]', 'dropout': 0.598700750155559, 'batch_norm': True, 'lr': 5.196015503468652e-06, 'weight_decay': 0.00018888181535050004, 'epochs': 193, 'loss': 'mae', 'optimizer': 'adamw', 'use_snp_selection': False, 'weight_scheme': 'top-heavy', 'weight_clip_max': None, 'weight_topheavy_top_frac': 0.4979496293827915, 'weight_topheavy_low': 0.5230104201773819, 'weight_topheavy_high': 5.831773413894172}. Best is trial 15 with value: 0.2028821499915602.
[I 2026-04-18 16:47:16,606] Trial 35 finished with value: 0.10253685544241761 and parameters: {'hidden_dims': '[512, 128]', 'dropout': 0.49666387032829096, 'batch_norm': True, 'lr': 2.5340725923496066e-05, 'weight_decay': 0.0008585302937839129, 'epochs': 129, 'loss': 'mse', 'optimizer': 'adamw', 'use_snp_selection': False, 'weight_scheme': 'top-heavy', 'weight_clip_max': None, 'weight_topheavy_top_frac': 0.43884667715975556, 'weight_topheavy_low': 1.062963189179154, 'weight_topheavy_high': 5.850947199911836}. Best is trial 21 with value: 0.16639477977593442.
[I 2026-04-18 16:48:09,957] Trial 36 finished with value: 0.08568980683988271 and parameters: {'hidden_dims': '[512, 128]', 'dropout': 0.5984253772338162, 'batch_norm': False, 'lr': 7.904091605633391e-05, 'weight_decay': 9.510916113052432e-05, 'epochs': 180, 'loss': 'mse', 'optimizer': 'sgd', 'use_snp_selection': False, 'weight_scheme': 'linear', 'weight_clip_max': 10.0, 'weight_linear_min_weight': 0.6019004314554074, 'weight_linear_max_weight': 1.0037445746839393}. Best is trial 21 with value: 0.16639477977593442.
[I 2026-04-18 16:48:15,936] Trial 17 finished with value: 0.20500989584850618 and parameters: {'hidden_dims': '[512, 128]', 'dropout': 0.01653231709747962, 'batch_norm': True, 'lr': 0.00030519803944241577, 'weight_decay': 1.519291105924544e-05, 'epochs': 202, 'loss': 'mae', 'optimizer': 'adamw', 'use_snp_selection': False, 'weight_scheme': 'top-heavy', 'weight_clip_max': None, 'weight_topheavy_top_frac': 0.49874528076422553, 'weight_topheavy_low': 0.5135903521094615, 'weight_topheavy_high': 5.58406405648394}. Best is trial 17 with value: 0.20500989584850618.
[I 2026-04-18 16:49:08,633] Trial 18 finished with value: 0.20344030940635163 and parameters: {'hidden_dims': '[512, 128]', 'dropout': 0.5264544266672053, 'batch_norm': True, 'lr': 0.0003606096477315593, 'weight_decay': 9.62885204369578e-07, 'epochs': 166, 'loss': 'mae', 'optimizer': 'adamw', 'use_snp_selection': False, 'weight_scheme': 'top-heavy', 'weight_clip_max': None, 'weight_topheavy_top_frac': 0.4952063878279899, 'weight_topheavy_low': 0.5152104294735822, 'weight_topheavy_high': 5.9794642579215065}. Best is trial 17 with value: 0.20500989584850618.
[I 2026-04-18 16:49:28,482] Trial 37 finished with value: 0.1512579163696817 and parameters: {'hidden_dims': '[512, 128]', 'dropout': 0.2550604536715181, 'batch_norm': True, 'lr': 4.198859831112631e-05, 'weight_decay': 3.445858555822495e-05, 'epochs': 157, 'loss': 'mse', 'optimizer': 'adamw', 'use_snp_selection': True, 'num_snps': 59903, 'weight_scheme': 'exponential', 'weight_clip_max': 10.0, 'weight_exponential_beta': 4.514144908457898}. Best is trial 21 with value: 0.16639477977593442.
[I 2026-04-18 16:49:57,576] Trial 19 finished with value: 0.20214593851345025 and parameters: {'hidden_dims': '[512, 128]', 'dropout': 0.5243297959972698, 'batch_norm': True, 'lr': 0.00032214177552271247, 'weight_decay': 9.681466092282602e-07, 'epochs': 153, 'loss': 'mae', 'optimizer': 'adamw', 'use_snp_selection': False, 'weight_scheme': 'top-heavy', 'weight_clip_max': 10.0, 'weight_topheavy_top_frac': 0.36899886794169323, 'weight_topheavy_low': 0.7038640860299127, 'weight_topheavy_high': 5.918738879214201}. Best is trial 17 with value: 0.20500989584850618.
[I 2026-04-18 16:50:12,058] Trial 38 finished with value: 0.07222419354449613 and parameters: {'hidden_dims': '[512, 64]', 'dropout': 0.40965065098772474, 'batch_norm': True, 'lr': 7.64613387345076e-05, 'weight_decay': 7.505542407159258e-06, 'epochs': 144, 'loss': 'mse', 'optimizer': 'sgd', 'use_snp_selection': False, 'weight_scheme': 'uniform', 'weight_clip_max': 10.0}. Best is trial 21 with value: 0.16639477977593442.
[I 2026-04-18 16:50:32,355] Trial 39 finished with value: 0.13831618909364504 and parameters: {'hidden_dims': '[256, 64]', 'dropout': 0.5647102964377987, 'batch_norm': False, 'lr': 1.2088867931047801e-05, 'weight_decay': 0.000580994445428994, 'epochs': 112, 'loss': 'mse', 'optimizer': 'adamw', 'use_snp_selection': False, 'weight_scheme': 'minmax', 'weight_clip_max': None, 'weight_minmax_eps': 0.19739375643159887}. Best is trial 21 with value: 0.16639477977593442.
[I 2026-04-18 16:50:49,579] Trial 20 finished with value: 0.19510389852478116 and parameters: {'hidden_dims': '[512, 128]', 'dropout': 0.36251151193512077, 'batch_norm': True, 'lr': 0.00041385576703162504, 'weight_decay': 1.4388467946274297e-06, 'epochs': 164, 'loss': 'mae', 'optimizer': 'adamw', 'use_snp_selection': False, 'weight_scheme': 'top-heavy', 'weight_clip_max': None, 'weight_topheavy_top_frac': 0.35018434864346193, 'weight_topheavy_low': 0.7494832338246669, 'weight_topheavy_high': 1.4133254426206618}. Best is trial 17 with value: 0.20500989584850618.
[I 2026-04-18 16:51:40,424] Trial 0 finished with value: 0.04970499167700776 and parameters: {'hidden_dims': '[256, 128]', 'dropout': 0.18584155530312246, 'batch_norm': True, 'lr': 9.012665953349533e-06, 'weight_decay': 4.96591963698479e-06, 'epochs': 105, 'loss': 'mse', 'optimizer': 'sgd', 'use_snp_selection': True, 'num_snps': 25583, 'weight_scheme': 'minmax', 'weight_clip_max': 5.0, 'weight_minmax_eps': 0.14026014881292506}. Best is trial 0 with value: 0.04970499167700776.
[I 2026-04-18 16:51:52,101] Trial 21 finished with value: 0.2032837124515389 and parameters: {'hidden_dims': '[512, 128]', 'dropout': 0.5426900319099275, 'batch_norm': True, 'lr': 0.00020503923628504515, 'weight_decay': 2.394837164226039e-05, 'epochs': 201, 'loss': 'mae', 'optimizer': 'adamw', 'use_snp_selection': False, 'weight_scheme': 'top-heavy', 'weight_clip_max': None, 'weight_topheavy_top_frac': 0.49719949616839854, 'weight_topheavy_low': 0.501760380087914, 'weight_topheavy_high': 5.436030249204217}. Best is trial 17 with value: 0.20500989584850618.
[I 2026-04-18 16:52:05,797] Trial 1 finished with value: 0.08575299396366656 and parameters: {'hidden_dims': '[256, 64]', 'dropout': 0.05000949662985405, 'batch_norm': True, 'lr': 0.00015647443054904835, 'weight_decay': 5.158896024962846e-05, 'epochs': 152, 'loss': 'mse', 'optimizer': 'sgd', 'use_snp_selection': False, 'weight_scheme': 'linear', 'weight_clip_max': None, 'weight_linear_min_weight': 0.21922985165550554, 'weight_linear_max_weight': 1.6260435767424388}. Best is trial 1 with value: 0.08575299396366656.
[I 2026-04-18 16:52:44,291] Trial 2 finished with value: 0.05673423083971487 and parameters: {'hidden_dims': '[512, 128]', 'dropout': 0.2736730891340176, 'batch_norm': True, 'lr': 7.298114623433994e-05, 'weight_decay': 5.6346010385734023e-08, 'epochs': 185, 'loss': 'mae', 'optimizer': 'sgd', 'use_snp_selection': True, 'num_snps': 14091, 'weight_scheme': 'minmax', 'weight_clip_max': 10.0, 'weight_minmax_eps': 0.045780660776687306}. Best is trial 1 with value: 0.08575299396366656.
[I 2026-04-18 16:52:56,262] Trial 22 finished with value: 0.20812651967210466 and parameters: {'hidden_dims': '[512, 128]', 'dropout': 0.5049873103302791, 'batch_norm': True, 'lr': 0.00019447045452074645, 'weight_decay': 1.9834660283041252e-05, 'epochs': 207, 'loss': 'mae', 'optimizer': 'adamw', 'use_snp_selection': False, 'weight_scheme': 'top-heavy', 'weight_clip_max': None, 'weight_topheavy_top_frac': 0.49812870626061206, 'weight_topheavy_low': 0.5098592543207461, 'weight_topheavy_high': 4.520140668545897}. Best is trial 22 with value: 0.20812651967210466.
[I 2026-04-18 16:53:50,499] Trial 23 finished with value: 0.20306117277405553 and parameters: {'hidden_dims': '[512, 128]', 'dropout': 0.4822572993349566, 'batch_norm': True, 'lr': 6.113471111044204e-05, 'weight_decay': 2.421953651751553e-06, 'epochs': 172, 'loss': 'mae', 'optimizer': 'adamw', 'use_snp_selection': False, 'weight_scheme': 'top-heavy', 'weight_clip_max': None, 'weight_topheavy_top_frac': 0.415651951776751, 'weight_topheavy_low': 0.6425858725881123, 'weight_topheavy_high': 4.471660350226596}. Best is trial 22 with value: 0.20812651967210466.
[I 2026-04-18 16:54:05,100] Trial 3 finished with value: 0.050611844526584314 and parameters: {'hidden_dims': '[512, 64]', 'dropout': 0.30157795416637295, 'batch_norm': False, 'lr': 2.007492282795256e-05, 'weight_decay': 5.496446859789657e-06, 'epochs': 284, 'loss': 'mse', 'optimizer': 'sgd', 'use_snp_selection': False, 'weight_scheme': 'linear', 'weight_clip_max': None, 'weight_linear_min_weight': 0.24682154527102826, 'weight_linear_max_weight': 1.8338910783134623}. Best is trial 1 with value: 0.08575299396366656.
[I 2026-04-18 16:54:29,575] Trial 4 finished with value: 0.08249591793451914 and parameters: {'hidden_dims': '[256, 64]', 'dropout': 0.18128694708490736, 'batch_norm': False, 'lr': 8.951826748007403e-05, 'weight_decay': 2.1781541495465197e-07, 'epochs': 147, 'loss': 'mse', 'optimizer': 'sgd', 'use_snp_selection': False, 'weight_scheme': 'top-heavy', 'weight_clip_max': 5.0, 'weight_topheavy_top_frac': 0.1724888194073277, 'weight_topheavy_low': 1.1620865802171172, 'weight_topheavy_high': 3.476906528073177}. Best is trial 1 with value: 0.08575299396366656.
[I 2026-04-18 16:54:32,333] Trial 24 finished with value: 0.1955314151805025 and parameters: {'hidden_dims': '[512, 128]', 'dropout': 0.38321501859292023, 'batch_norm': True, 'lr': 0.0005545037951931712, 'weight_decay': 4.326636473034079e-07, 'epochs': 128, 'loss': 'mae', 'optimizer': 'adamw', 'use_snp_selection': False, 'weight_scheme': 'top-heavy', 'weight_clip_max': None, 'weight_topheavy_top_frac': 0.07353716508242492, 'weight_topheavy_low': 0.9528699874994752, 'weight_topheavy_high': 4.414597977781185}. Best is trial 22 with value: 0.20812651967210466.
[I 2026-04-18 16:54:50,356] Trial 5 finished with value: 0.1080353410844497 and parameters: {'hidden_dims': '[256, 64]', 'dropout': 0.2571412946970998, 'batch_norm': True, 'lr': 3.546238022482882e-05, 'weight_decay': 1.0185234767613396e-06, 'epochs': 119, 'loss': 'mse', 'optimizer': 'sgd', 'use_snp_selection': False, 'weight_scheme': 'linear', 'weight_clip_max': 10.0, 'weight_linear_min_weight': 0.9405832045183805, 'weight_linear_max_weight': 3.413610925325811}. Best is trial 5 with value: 0.1080353410844497.
[I 2026-04-18 16:54:52,118] Trial 25 finished with value: 0.19661524787850698 and parameters: {'hidden_dims': '[512, 128]', 'dropout': 0.5152593492725969, 'batch_norm': True, 'lr': 0.00023861828173266165, 'weight_decay': 1.5531909047171303e-05, 'epochs': 50, 'loss': 'mae', 'optimizer': 'adamw', 'use_snp_selection': False, 'weight_scheme': 'top-heavy', 'weight_clip_max': None, 'weight_topheavy_top_frac': 0.4103881878934288, 'weight_topheavy_low': 0.6177885119676654, 'weight_topheavy_high': 4.541098353909874}. Best is trial 22 with value: 0.20812651967210466.
[I 2026-04-18 16:55:29,144] Trial 6 finished with value: 0.12721636597820524 and parameters: {'hidden_dims': '[256, 64]', 'dropout': 0.037961443806696214, 'batch_norm': True, 'lr': 3.644202049829694e-05, 'weight_decay': 9.73334309820277e-06, 'epochs': 243, 'loss': 'mae', 'optimizer': 'adam', 'use_snp_selection': False, 'weight_scheme': 'minmax', 'weight_clip_max': None, 'weight_minmax_eps': 0.08689611239934374}. Best is trial 6 with value: 0.12721636597820524.
[I 2026-04-18 16:56:00,149] Trial 26 finished with value: 0.20630624679911463 and parameters: {'hidden_dims': '[512, 128]', 'dropout': 0.31411021036264575, 'batch_norm': False, 'lr': 0.0005454541003849601, 'weight_decay': 7.711101629077797e-08, 'epochs': 221, 'loss': 'mae', 'optimizer': 'adamw', 'use_snp_selection': False, 'weight_scheme': 'top-heavy', 'weight_clip_max': None, 'weight_topheavy_top_frac': 0.2561475034164545, 'weight_topheavy_low': 0.8516614145730934, 'weight_topheavy_high': 4.939317778469862}. Best is trial 22 with value: 0.20812651967210466.
[I 2026-04-18 16:56:47,125] Trial 7 finished with value: -0.00973862922469389 and parameters: {'hidden_dims': '[512, 128]', 'dropout': 0.1304538168539244, 'batch_norm': False, 'lr': 1.5408060926311233e-05, 'weight_decay': 2.1989735568314356e-08, 'epochs': 250, 'loss': 'mse', 'optimizer': 'sgd', 'use_snp_selection': True, 'num_snps': 42550, 'weight_scheme': 'exponential', 'weight_clip_max': 10.0, 'weight_exponential_beta': 2.758850226029358}. Best is trial 6 with value: 0.12721636597820524.
[I 2026-04-18 16:57:24,518] Trial 8 finished with value: 0.1451433957964678 and parameters: {'hidden_dims': '[256, 128]', 'dropout': 0.05742396906738376, 'batch_norm': False, 'lr': 1.9761509510575143e-06, 'weight_decay': 2.933492239224291e-07, 'epochs': 82, 'loss': 'mae', 'optimizer': 'adam', 'use_snp_selection': True, 'num_snps': 29883, 'weight_scheme': 'minmax', 'weight_clip_max': 5.0, 'weight_minmax_eps': 0.0051288771726799584}. Best is trial 8 with value: 0.1451433957964678.
[I 2026-04-18 16:57:41,531] Trial 27 finished with value: 0.18539885695218813 and parameters: {'hidden_dims': '[512, 128]', 'dropout': 0.10510811432379644, 'batch_norm': False, 'lr': 0.0005852491564565478, 'weight_decay': 1.340745438300075e-08, 'epochs': 263, 'loss': 'mae', 'optimizer': 'adamw', 'use_snp_selection': True, 'num_snps': 56263, 'weight_scheme': 'top-heavy', 'weight_clip_max': None, 'weight_topheavy_top_frac': 0.26137288823089844, 'weight_topheavy_low': 1.0027683181417026, 'weight_topheavy_high': 5.000249285934223}. Best is trial 22 with value: 0.20812651967210466.
[I 2026-04-18 16:58:11,946] Trial 9 finished with value: 0.13955707067327644 and parameters: {'hidden_dims': '[256, 128]', 'dropout': 0.5795930447285386, 'batch_norm': False, 'lr': 0.00011782025260263196, 'weight_decay': 0.0005562063174273634, 'epochs': 218, 'loss': 'mae', 'optimizer': 'adamw', 'use_snp_selection': True, 'num_snps': 32226, 'weight_scheme': 'minmax', 'weight_clip_max': 5.0, 'weight_minmax_eps': 0.09600289105543994}. Best is trial 8 with value: 0.1451433957964678.
[I 2026-04-18 16:58:47,289] Trial 28 finished with value: 0.18597058004798409 and parameters: {'hidden_dims': '[512, 128]', 'dropout': 0.31989887107975523, 'batch_norm': False, 'lr': 0.0001623206682655264, 'weight_decay': 3.437733857396934e-06, 'epochs': 213, 'loss': 'mae', 'optimizer': 'adamw', 'use_snp_selection': False, 'weight_scheme': 'exponential', 'weight_clip_max': 10.0, 'weight_exponential_beta': 0.6130409589717423}. Best is trial 22 with value: 0.20812651967210466.
[I 2026-04-18 16:58:58,261] Trial 10 finished with value: 0.057762335603737294 and parameters: {'hidden_dims': '[256, 128]', 'dropout': 0.4338375928678635, 'batch_norm': False, 'lr': 1.459239318238064e-06, 'weight_decay': 3.891313547330106e-07, 'epochs': 68, 'loss': 'mae', 'optimizer': 'adam', 'use_snp_selection': True, 'num_snps': 53871, 'weight_scheme': 'uniform', 'weight_clip_max': 5.0}. Best is trial 8 with value: 0.1451433957964678.
[I 2026-04-18 16:59:20,321] Trial 29 finished with value: 0.13206976870085863 and parameters: {'hidden_dims': '[256, 128]', 'dropout': 0.21351435672202118, 'batch_norm': False, 'lr': 5.037758474573747e-05, 'weight_decay': 1.1574533217535599e-07, 'epochs': 212, 'loss': 'mse', 'optimizer': 'adamw', 'use_snp_selection': True, 'num_snps': 10358, 'weight_scheme': 'top-heavy', 'weight_clip_max': 5.0, 'weight_topheavy_top_frac': 0.2591242393812232, 'weight_topheavy_low': 0.8508183562590996, 'weight_topheavy_high': 3.522380645994488}. Best is trial 22 with value: 0.20812651967210466.
[I 2026-04-18 16:59:43,825] Trial 11 finished with value: 0.041669070722928594 and parameters: {'hidden_dims': '[256, 128]', 'dropout': 0.5977959517479471, 'batch_norm': False, 'lr': 0.0007728340671580595, 'weight_decay': 0.0004164439942178998, 'epochs': 200, 'loss': 'mae', 'optimizer': 'adamw', 'use_snp_selection': True, 'num_snps': 30988, 'weight_scheme': 'minmax', 'weight_clip_max': 5.0, 'weight_minmax_eps': 0.005209797941978697}. Best is trial 8 with value: 0.1451433957964678.
[I 2026-04-18 17:00:17,193] Trial 12 finished with value: 0.0319508706667872 and parameters: {'hidden_dims': '[256, 128]', 'dropout': 0.49224381548015783, 'batch_norm': False, 'lr': 1.6672985638477092e-06, 'weight_decay': 0.000985776838336091, 'epochs': 61, 'loss': 'mae', 'optimizer': 'adamw', 'use_snp_selection': True, 'num_snps': 22869, 'weight_scheme': 'minmax', 'weight_clip_max': 5.0, 'weight_minmax_eps': 0.1815169394876332}. Best is trial 8 with value: 0.1451433957964678.
