[I 2026-05-04 03:05:01,434] Trial 57 finished with value: 0.21834206507900839 and parameters: {'alpha': 292775.8645757278, 'use_snp_selection': False, 'iw_method': 'pc_logistic', 'iw_clip_max': 1.5, 'iw_prob_clip': 0.04917248550440465, 'iw_n_components': 20, 'iw_logistic_c': 3.892867397553557e-07, 'iw_pca_fit': 'combined', 'iw_solver': 'lbfgs', 'iw_rho': 0.5}. Best is trial 34 with value: 0.22685457286385718.
[I 2026-05-04 03:08:30,469] Trial 58 finished with value: 0.21883091659852166 and parameters: {'alpha': 170391.823944791, 'use_snp_selection': False, 'iw_method': 'pc_logistic', 'iw_clip_max': 3.0, 'iw_prob_clip': 0.01564714295348179, 'iw_n_components': 50, 'iw_logistic_c': 0.0009978070409382407, 'iw_pca_fit': 'combined', 'iw_solver': 'lbfgs', 'iw_rho': 0.9}. Best is trial 34 with value: 0.22685457286385718.
[I 2026-05-04 03:08:59,107] Trial 59 finished with value: 0.21644715416381838 and parameters: {'alpha': 370339.564183298, 'use_snp_selection': False, 'iw_method': 'uniform'}. Best is trial 34 with value: 0.22685457286385718.
[I 2026-05-04 03:12:12,573] Trial 60 finished with value: 0.20320777085370723 and parameters: {'alpha': 1718797.1072668165, 'use_snp_selection': False, 'iw_method': 'pc_logistic', 'iw_clip_max': 1.25, 'iw_prob_clip': 0.03787055251026527, 'iw_n_components': 50, 'iw_logistic_c': 2.1601135527086439e-07, 'iw_pca_fit': 'combined', 'iw_solver': 'lbfgs', 'iw_rho': 0.5}. Best is trial 34 with value: 0.22685457286385718.
[I 2026-05-04 03:15:33,776] Trial 61 finished with value: 0.22392807749331417 and parameters: {'alpha': 165396.682548216, 'use_snp_selection': False, 'iw_method': 'pc_logistic', 'iw_clip_max': 3.0, 'iw_prob_clip': 0.02406279798034037, 'iw_n_components': 50, 'iw_logistic_c': 3.6444481258837664e-06, 'iw_pca_fit': 'combined', 'iw_solver': 'lbfgs', 'iw_rho': 0.5}. Best is trial 34 with value: 0.22685457286385718.
[I 2026-05-04 03:18:54,339] Trial 62 finished with value: 0.22428268987074204 and parameters: {'alpha': 193350.1462821288, 'use_snp_selection': False, 'iw_method': 'pc_logistic', 'iw_clip_max': 3.0, 'iw_prob_clip': 0.02637161430948199, 'iw_n_components': 50, 'iw_logistic_c': 9.400511583890938e-06, 'iw_pca_fit': 'combined', 'iw_solver': 'lbfgs', 'iw_rho': 0.5}. Best is trial 34 with value: 0.22685457286385718.
[I 2026-05-04 03:22:15,745] Trial 63 finished with value: 0.22470400459437173 and parameters: {'alpha': 238575.05015858804, 'use_snp_selection': False, 'iw_method': 'pc_logistic', 'iw_clip_max': 3.0, 'iw_prob_clip': 0.03326488735320759, 'iw_n_components': 50, 'iw_logistic_c': 1.118714502107231e-05, 'iw_pca_fit': 'combined', 'iw_solver': 'lbfgs', 'iw_rho': 0.5}. Best is trial 34 with value: 0.22685457286385718.
[I 2026-05-04 03:25:29,905] Trial 64 finished with value: 0.22416642974283413 and parameters: {'alpha': 229554.71364165915, 'use_snp_selection': False, 'iw_method': 'pc_logistic', 'iw_clip_max': 3.0, 'iw_prob_clip': 0.040783514173275956, 'iw_n_components': 40, 'iw_logistic_c': 1.2531269876108346e-05, 'iw_pca_fit': 'combined', 'iw_solver': 'lbfgs', 'iw_rho': 0.5}. Best is trial 34 with value: 0.22685457286385718.
[I 2026-05-04 03:28:49,387] Trial 65 finished with value: 0.2236474099932631 and parameters: {'alpha': 195818.2918032747, 'use_snp_selection': False, 'iw_method': 'pc_logistic', 'iw_clip_max': 3.0, 'iw_prob_clip': 0.033014643054083324, 'iw_n_components': 50, 'iw_logistic_c': 7.73176260408485e-05, 'iw_pca_fit': 'combined', 'iw_solver': 'lbfgs', 'iw_rho': 0.5}. Best is trial 34 with value: 0.22685457286385718.
[I 2026-05-04 03:32:18,839] Trial 66 finished with value: 0.22240156788298365 and parameters: {'alpha': 319744.16377295635, 'use_snp_selection': False, 'iw_method': 'pc_logistic', 'iw_clip_max': 2.0, 'iw_prob_clip': 0.018369147854084857, 'iw_n_components': 80, 'iw_logistic_c': 6.756643477277277e-07, 'iw_pca_fit': 'combined', 'iw_solver': 'lbfgs', 'iw_rho': 1.0}. Best is trial 34 with value: 0.22685457286385718.
[I 2026-05-04 03:35:42,432] Trial 67 finished with value: 0.22395698967110925 and parameters: {'alpha': 277879.8492054766, 'use_snp_selection': False, 'iw_method': 'pc_logistic', 'iw_clip_max': 3.0, 'iw_prob_clip': 0.030912455395351104, 'iw_n_components': 50, 'iw_logistic_c': 9.265205377040036e-06, 'iw_pca_fit': 'combined', 'iw_solver': 'lbfgs', 'iw_rho': 0.75}. Best is trial 34 with value: 0.22685457286385718.
[I 2026-05-04 03:38:40,349] Trial 68 finished with value: 0.21961367556774453 and parameters: {'alpha': 186798.30721360494, 'use_snp_selection': False, 'iw_method': 'pc_logistic', 'iw_clip_max': 3.0, 'iw_prob_clip': 0.0014561579770412086, 'iw_n_components': 10, 'iw_logistic_c': 1.5403766761777692e-05, 'iw_pca_fit': 'combined', 'iw_solver': 'lbfgs', 'iw_rho': 0.9}. Best is trial 34 with value: 0.22685457286385718.
[I 2026-05-04 03:41:55,788] Trial 69 finished with value: 0.2210244001938131 and parameters: {'alpha': 131796.67394215416, 'use_snp_selection': False, 'iw_method': 'pc_logistic', 'iw_clip_max': 1.5, 'iw_prob_clip': 0.011355089312608077, 'iw_n_components': 30, 'iw_logistic_c': 1.067099092302639e-06, 'iw_pca_fit': 'combined', 'iw_solver': 'lbfgs', 'iw_rho': 0.75}. Best is trial 34 with value: 0.22685457286385718.
[I 2026-05-04 03:45:23,207] Trial 70 finished with value: 0.2247478818876091 and parameters: {'alpha': 243104.284512225, 'use_snp_selection': False, 'iw_method': 'pc_logistic', 'iw_clip_max': 3.0, 'iw_prob_clip': 0.03937654463550348, 'iw_n_components': 50, 'iw_logistic_c': 2.421944858398963e-05, 'iw_pca_fit': 'combined', 'iw_solver': 'lbfgs', 'iw_rho': 0.5}. Best is trial 34 with value: 0.22685457286385718.
[I 2026-05-04 03:48:46,642] Trial 71 finished with value: 0.22475666744723824 and parameters: {'alpha': 235622.65843237468, 'use_snp_selection': False, 'iw_method': 'pc_logistic', 'iw_clip_max': 3.0, 'iw_prob_clip': 0.04341745562482856, 'iw_n_components': 50, 'iw_logistic_c': 2.7161039276272525e-05, 'iw_pca_fit': 'combined', 'iw_solver': 'lbfgs', 'iw_rho': 0.5}. Best is trial 34 with value: 0.22685457286385718.
[I 2026-05-04 03:52:14,299] Trial 72 finished with value: 0.22235297728625664 and parameters: {'alpha': 233785.68133277932, 'use_snp_selection': False, 'iw_method': 'pc_logistic', 'iw_clip_max': 3.0, 'iw_prob_clip': 0.043405471154980335, 'iw_n_components': 50, 'iw_logistic_c': 0.000379853772386156, 'iw_pca_fit': 'combined', 'iw_solver': 'lbfgs', 'iw_rho': 0.5}. Best is trial 34 with value: 0.22685457286385718.
[I 2026-05-04 03:55:33,839] Trial 73 finished with value: 0.22395681670536244 and parameters: {'alpha': 249205.43137093738, 'use_snp_selection': False, 'iw_method': 'pc_logistic', 'iw_clip_max': 3.0, 'iw_prob_clip': 0.03633648199239157, 'iw_n_components': 50, 'iw_logistic_c': 2.4815855235463058e-05, 'iw_pca_fit': 'combined', 'iw_solver': 'lbfgs', 'iw_rho': 0.5}. Best is trial 34 with value: 0.22685457286385718.
[I 2026-05-04 03:59:00,488] Trial 74 finished with value: 0.22002861366809126 and parameters: {'alpha': 468778.74543931877, 'use_snp_selection': False, 'iw_method': 'pc_logistic', 'iw_clip_max': 3.0, 'iw_prob_clip': 0.04374683222344914, 'iw_n_components': 50, 'iw_logistic_c': 8.950891058052606e-05, 'iw_pca_fit': 'combined', 'iw_solver': 'lbfgs', 'iw_rho': 0.75}. Best is trial 34 with value: 0.22685457286385718.
[I 2026-05-04 04:02:04,668] Trial 75 finished with value: 0.2170583828028581 and parameters: {'alpha': 388769.71100412705, 'use_snp_selection': False, 'iw_method': 'pc_logistic', 'iw_clip_max': 1.25, 'iw_prob_clip': 0.007069517347114652, 'iw_n_components': 20, 'iw_logistic_c': 2.3858022757856883e-06, 'iw_pca_fit': 'combined', 'iw_solver': 'lbfgs', 'iw_rho': 0.5}. Best is trial 34 with value: 0.22685457286385718.
[I 2026-05-04 04:05:48,157] Trial 76 finished with value: 0.22012253272873425 and parameters: {'alpha': 308533.2997238476, 'use_snp_selection': False, 'iw_method': 'pc_logistic', 'iw_clip_max': 5.0, 'iw_prob_clip': 0.04791445809564976, 'iw_n_components': 50, 'iw_logistic_c': 3.934069370341794e-05, 'iw_pca_fit': 'combined', 'iw_solver': 'lbfgs', 'iw_rho': 0.75}. Best is trial 34 with value: 0.22685457286385718.
[I 2026-05-04 04:06:16,376] Trial 77 finished with value: 0.21940683139565179 and parameters: {'alpha': 211008.7058785178, 'use_snp_selection': False, 'iw_method': 'uniform'}. Best is trial 34 with value: 0.22685457286385718.
[I 2026-05-04 04:10:28,432] Trial 78 finished with value: 0.2254376562386479 and parameters: {'alpha': 178377.61284475322, 'use_snp_selection': False, 'iw_method': 'pc_logistic', 'iw_clip_max': 3.0, 'iw_prob_clip': 0.03127186262558562, 'iw_n_components': 80, 'iw_logistic_c': 7.048881936031285e-06, 'iw_pca_fit': 'combined', 'iw_solver': 'lbfgs', 'iw_rho': 0.75}. Best is trial 34 with value: 0.22685457286385718.
[I 2026-05-04 04:14:42,876] Trial 79 finished with value: 0.2259438494544288 and parameters: {'alpha': 180077.2021846993, 'use_snp_selection': False, 'iw_method': 'pc_logistic', 'iw_clip_max': 3.0, 'iw_prob_clip': 0.03552553481976417, 'iw_n_components': 80, 'iw_logistic_c': 7.694665586959775e-06, 'iw_pca_fit': 'combined', 'iw_solver': 'lbfgs', 'iw_rho': 0.5}. Best is trial 34 with value: 0.22685457286385718.
[I 2026-05-04 04:18:36,487] Trial 80 finished with value: 0.22670253471762852 and parameters: {'alpha': 176229.89278876007, 'use_snp_selection': False, 'iw_method': 'pc_logistic', 'iw_clip_max': 3.0, 'iw_prob_clip': 0.04013440154070971, 'iw_n_components': 80, 'iw_logistic_c': 6.607640416558699e-06, 'iw_pca_fit': 'combined', 'iw_solver': 'lbfgs', 'iw_rho': 0.75}. Best is trial 34 with value: 0.22685457286385718.
[I 2026-05-04 04:22:47,526] Trial 81 finished with value: 0.22665956232344958 and parameters: {'alpha': 176518.25485638203, 'use_snp_selection': False, 'iw_method': 'pc_logistic', 'iw_clip_max': 3.0, 'iw_prob_clip': 0.03932774577259978, 'iw_n_components': 80, 'iw_logistic_c': 6.600855102137816e-06, 'iw_pca_fit': 'combined', 'iw_solver': 'lbfgs', 'iw_rho': 0.75}. Best is trial 34 with value: 0.22685457286385718.
[I 2026-05-04 04:27:07,015] Trial 82 finished with value: 0.22666932813534807 and parameters: {'alpha': 176497.0865504422, 'use_snp_selection': False, 'iw_method': 'pc_logistic', 'iw_clip_max': 3.0, 'iw_prob_clip': 0.029558259440385926, 'iw_n_components': 80, 'iw_logistic_c': 3.839191247606464e-06, 'iw_pca_fit': 'combined', 'iw_solver': 'lbfgs', 'iw_rho': 0.75}. Best is trial 34 with value: 0.22685457286385718.
[I 2026-05-04 04:31:18,206] Trial 83 finished with value: 0.22519006060264476 and parameters: {'alpha': 180609.8720149374, 'use_snp_selection': False, 'iw_method': 'pc_logistic', 'iw_clip_max': 3.0, 'iw_prob_clip': 0.02966579371783478, 'iw_n_components': 80, 'iw_logistic_c': 7.157447619633716e-06, 'iw_pca_fit': 'combined', 'iw_solver': 'lbfgs', 'iw_rho': 0.75}. Best is trial 34 with value: 0.22685457286385718.
[I 2026-05-04 04:35:35,783] Trial 84 finished with value: 0.22585685017131815 and parameters: {'alpha': 181896.2267319996, 'use_snp_selection': False, 'iw_method': 'pc_logistic', 'iw_clip_max': 3.0, 'iw_prob_clip': 0.028676922515505344, 'iw_n_components': 80, 'iw_logistic_c': 5.246024347517718e-06, 'iw_pca_fit': 'combined', 'iw_solver': 'lbfgs', 'iw_rho': 0.75}. Best is trial 34 with value: 0.22685457286385718.
[I 2026-05-04 04:39:47,371] Trial 85 finished with value: 0.2249826657966167 and parameters: {'alpha': 138779.10289194205, 'use_snp_selection': False, 'iw_method': 'pc_logistic', 'iw_clip_max': 3.0, 'iw_prob_clip': 0.035046439411401356, 'iw_n_components': 80, 'iw_logistic_c': 6.418251694597873e-06, 'iw_pca_fit': 'combined', 'iw_solver': 'lbfgs', 'iw_rho': 0.75}. Best is trial 34 with value: 0.22685457286385718.
[I 2026-05-04 04:43:44,241] Trial 86 finished with value: 0.22619913849141798 and parameters: {'alpha': 175412.48671415867, 'use_snp_selection': False, 'iw_method': 'pc_logistic', 'iw_clip_max': 3.0, 'iw_prob_clip': 0.027906737844190004, 'iw_n_components': 80, 'iw_logistic_c': 1.3420742672499732e-06, 'iw_pca_fit': 'combined', 'iw_solver': 'lbfgs', 'iw_rho': 0.75}. Best is trial 34 with value: 0.22685457286385718.
[I 2026-05-04 04:47:57,800] Trial 87 finished with value: 0.22397554086266314 and parameters: {'alpha': 153650.97736271765, 'use_snp_selection': False, 'iw_method': 'pc_logistic', 'iw_clip_max': 3.0, 'iw_prob_clip': 0.020768971435340573, 'iw_n_components': 80, 'iw_logistic_c': 6.759837824843983e-07, 'iw_pca_fit': 'combined', 'iw_solver': 'lbfgs', 'iw_rho': 0.75}. Best is trial 34 with value: 0.22685457286385718.
[I 2026-05-04 04:52:02,899] Trial 88 finished with value: 0.22584208099836528 and parameters: {'alpha': 144588.78123875897, 'use_snp_selection': False, 'iw_method': 'pc_logistic', 'iw_clip_max': 3.0, 'iw_prob_clip': 0.02674751242752055, 'iw_n_components': 80, 'iw_logistic_c': 1.4059433540844088e-06, 'iw_pca_fit': 'combined', 'iw_solver': 'lbfgs', 'iw_rho': 0.75}. Best is trial 34 with value: 0.22685457286385718.
[I 2026-05-04 04:56:07,701] Trial 89 finished with value: 0.22523685702646196 and parameters: {'alpha': 120690.1497781535, 'use_snp_selection': False, 'iw_method': 'pc_logistic', 'iw_clip_max': 3.0, 'iw_prob_clip': 0.028512147242718236, 'iw_n_components': 80, 'iw_logistic_c': 3.3097059764191876e-06, 'iw_pca_fit': 'combined', 'iw_solver': 'lbfgs', 'iw_rho': 0.75}. Best is trial 34 with value: 0.22685457286385718.
[I 2026-05-04 04:56:38,167] Trial 90 finished with value: 0.21927091710984117 and parameters: {'alpha': 106870.15662861489, 'use_snp_selection': False, 'iw_method': 'uniform'}. Best is trial 34 with value: 0.22685457286385718.
[I 2026-05-04 05:00:41,184] Trial 91 finished with value: 0.2249749034265875 and parameters: {'alpha': 149448.30204710353, 'use_snp_selection': False, 'iw_method': 'pc_logistic', 'iw_clip_max': 3.0, 'iw_prob_clip': 0.02603661557964317, 'iw_n_components': 80, 'iw_logistic_c': 9.87287139649063e-07, 'iw_pca_fit': 'combined', 'iw_solver': 'lbfgs', 'iw_rho': 0.75}. Best is trial 34 with value: 0.22685457286385718.
[I 2026-05-04 05:04:48,456] Trial 92 finished with value: 0.2207909562007783 and parameters: {'alpha': 171433.69898162718, 'use_snp_selection': False, 'iw_method': 'pc_logistic', 'iw_clip_max': 3.0, 'iw_prob_clip': 0.03739066912270274, 'iw_n_components': 80, 'iw_logistic_c': 2.1857366642213696e-07, 'iw_pca_fit': 'combined', 'iw_solver': 'lbfgs', 'iw_rho': 0.75}. Best is trial 34 with value: 0.22685457286385718.
[I 2026-05-04 05:08:50,716] Trial 93 finished with value: 0.22524350403567656 and parameters: {'alpha': 208389.75836670937, 'use_snp_selection': False, 'iw_method': 'pc_logistic', 'iw_clip_max': 3.0, 'iw_prob_clip': 0.02169763242770426, 'iw_n_components': 80, 'iw_logistic_c': 1.6928886072741583e-06, 'iw_pca_fit': 'combined', 'iw_solver': 'lbfgs', 'iw_rho': 0.75}. Best is trial 34 with value: 0.22685457286385718.
[I 2026-05-04 05:13:08,899] Trial 94 finished with value: 0.2237451059964206 and parameters: {'alpha': 138916.5357010725, 'use_snp_selection': False, 'iw_method': 'pc_logistic', 'iw_clip_max': 3.0, 'iw_prob_clip': 0.0496356000361497, 'iw_n_components': 80, 'iw_logistic_c': 1.2715724707898825e-06, 'iw_pca_fit': 'combined', 'iw_solver': 'lbfgs', 'iw_rho': 0.75}. Best is trial 34 with value: 0.22685457286385718.
[I 2026-05-04 05:17:08,512] Trial 95 finished with value: 0.22311042230464784 and parameters: {'alpha': 125873.5472846281, 'use_snp_selection': False, 'iw_method': 'pc_logistic', 'iw_clip_max': 2.0, 'iw_prob_clip': 0.028575304160438058, 'iw_n_components': 80, 'iw_logistic_c': 4.793214641247585e-06, 'iw_pca_fit': 'combined', 'iw_solver': 'lbfgs', 'iw_rho': 0.75}. Best is trial 34 with value: 0.22685457286385718.
[I 2026-05-04 05:21:07,370] Trial 96 finished with value: 0.2239470945026975 and parameters: {'alpha': 162976.79018280163, 'use_snp_selection': False, 'iw_method': 'pc_logistic', 'iw_clip_max': 3.0, 'iw_prob_clip': 0.0033008769027039393, 'iw_n_components': 80, 'iw_logistic_c': 1.8832325637795379e-06, 'iw_pca_fit': 'combined', 'iw_solver': 'lbfgs', 'iw_rho': 0.75}. Best is trial 34 with value: 0.22685457286385718.
[I 2026-05-04 05:25:23,308] Trial 97 finished with value: 0.21906803525021604 and parameters: {'alpha': 183452.4654286448, 'use_snp_selection': False, 'iw_method': 'pc_logistic', 'iw_clip_max': 3.0, 'iw_prob_clip': 0.033785561294395215, 'iw_n_components': 80, 'iw_logistic_c': 0.008702796768516544, 'iw_pca_fit': 'combined', 'iw_solver': 'lbfgs', 'iw_rho': 0.75}. Best is trial 34 with value: 0.22685457286385718.
[I 2026-05-04 05:29:32,676] Trial 98 finished with value: 0.2193244628815653 and parameters: {'alpha': 876017.5824844434, 'use_snp_selection': False, 'iw_method': 'pc_logistic', 'iw_clip_max': 3.0, 'iw_prob_clip': 0.042779077257970796, 'iw_n_components': 80, 'iw_logistic_c': 2.8426781296423983e-06, 'iw_pca_fit': 'combined', 'iw_solver': 'lbfgs', 'iw_rho': 0.75}. Best is trial 34 with value: 0.22685457286385718.
[I 2026-05-04 05:33:44,710] Trial 99 finished with value: 0.22241772884129601 and parameters: {'alpha': 218003.52648497917, 'use_snp_selection': False, 'iw_method': 'pc_logistic', 'iw_clip_max': 1.5, 'iw_prob_clip': 0.023600376810991076, 'iw_n_components': 80, 'iw_logistic_c': 8.056780406456745e-07, 'iw_pca_fit': 'combined', 'iw_solver': 'lbfgs', 'iw_rho': 0.75}. Best is trial 34 with value: 0.22685457286385718.
[I 2026-05-04 05:37:32,136] Trial 100 finished with value: 0.2217740715307662 and parameters: {'alpha': 198953.69530413247, 'use_snp_selection': False, 'iw_method': 'pc_logistic', 'iw_clip_max': 3.0, 'iw_prob_clip': 0.019263428841541686, 'iw_n_components': 80, 'iw_logistic_c': 1.4658400859208628e-05, 'iw_pca_fit': 'combined', 'iw_solver': 'lbfgs', 'iw_rho': 0.75}. Best is trial 34 with value: 0.22685457286385718.
[I 2026-05-04 05:41:33,120] Trial 101 finished with value: 0.22279275471825627 and parameters: {'alpha': 180927.05224274338, 'use_snp_selection': False, 'iw_method': 'pc_logistic', 'iw_clip_max': 3.0, 'iw_prob_clip': 0.0007316127253318132, 'iw_n_components': 80, 'iw_logistic_c': 7.216061033096768e-06, 'iw_pca_fit': 'combined', 'iw_solver': 'lbfgs', 'iw_rho': 0.75}. Best is trial 34 with value: 0.22685457286385718.
[I 2026-05-04 05:45:28,207] Trial 102 finished with value: 0.226976747229137 and parameters: {'alpha': 173977.7918191964, 'use_snp_selection': False, 'iw_method': 'pc_logistic', 'iw_clip_max': 3.0, 'iw_prob_clip': 0.03220023121523298, 'iw_n_components': 80, 'iw_logistic_c': 3.890507271233662e-06, 'iw_pca_fit': 'combined', 'iw_solver': 'lbfgs', 'iw_rho': 0.75}. Best is trial 102 with value: 0.226976747229137.
[I 2026-05-04 05:49:29,329] Trial 103 finished with value: 0.22311409724374665 and parameters: {'alpha': 151604.41797143145, 'use_snp_selection': False, 'iw_method': 'pc_logistic', 'iw_clip_max': 3.0, 'iw_prob_clip': 0.02757773948410994, 'iw_n_components': 80, 'iw_logistic_c': 4.967366240828209e-07, 'iw_pca_fit': 'combined', 'iw_solver': 'lbfgs', 'iw_rho': 0.75}. Best is trial 102 with value: 0.226976747229137.
[I 2026-05-04 05:53:41,559] Trial 104 finished with value: 0.22722517757028554 and parameters: {'alpha': 163275.61067732653, 'use_snp_selection': False, 'iw_method': 'pc_logistic', 'iw_clip_max': 3.0, 'iw_prob_clip': 0.037558234831921805, 'iw_n_components': 80, 'iw_logistic_c': 4.054284620485458e-06, 'iw_pca_fit': 'combined', 'iw_solver': 'lbfgs', 'iw_rho': 0.75}. Best is trial 104 with value: 0.22722517757028554.
[I 2026-05-04 05:56:50,938] Trial 105 finished with value: 0.22839972362683358 and parameters: {'alpha': 160550.71305670653, 'use_snp_selection': False, 'iw_method': 'pc_logistic', 'iw_clip_max': 3.0, 'iw_prob_clip': 0.03995669334963349, 'iw_n_components': 80, 'iw_logistic_c': 3.531854019519595e-06, 'iw_pca_fit': 'combined', 'iw_solver': 'lbfgs', 'iw_rho': 1.0}. Best is trial 105 with value: 0.22839972362683358.
[I 2026-05-04 06:00:13,470] Trial 106 finished with value: 0.22212402130450118 and parameters: {'alpha': 165153.29358272618, 'use_snp_selection': False, 'iw_method': 'pc_logistic', 'iw_clip_max': 1.25, 'iw_prob_clip': 0.03899224382357496, 'iw_n_components': 80, 'iw_logistic_c': 3.8018923518630998e-06, 'iw_pca_fit': 'combined', 'iw_solver': 'lbfgs', 'iw_rho': 1.0}. Best is trial 105 with value: 0.22839972362683358.
[I 2026-05-04 06:03:13,899] Trial 107 finished with value: 0.22740823342627267 and parameters: {'alpha': 202806.04818801815, 'use_snp_selection': False, 'iw_method': 'pc_logistic', 'iw_clip_max': 3.0, 'iw_prob_clip': 0.035216528612660995, 'iw_n_components': 40, 'iw_logistic_c': 2.4616736117199604e-06, 'iw_pca_fit': 'combined', 'iw_solver': 'lbfgs', 'iw_rho': 1.0}. Best is trial 105 with value: 0.22839972362683358.
[I 2026-05-04 06:03:44,162] Trial 108 finished with value: 0.21830426788614915 and parameters: {'alpha': 275517.3341330932, 'use_snp_selection': False, 'iw_method': 'uniform'}. Best is trial 105 with value: 0.22839972362683358.
[I 2026-05-04 06:06:51,435] Trial 109 finished with value: 0.22806847591221815 and parameters: {'alpha': 199060.55745715596, 'use_snp_selection': False, 'iw_method': 'pc_logistic', 'iw_clip_max': 3.0, 'iw_prob_clip': 0.04537103348213259, 'iw_n_components': 40, 'iw_logistic_c': 2.724846070463893e-06, 'iw_pca_fit': 'combined', 'iw_solver': 'lbfgs', 'iw_rho': 1.0}. Best is trial 105 with value: 0.22839972362683358.
[I 2026-05-04 06:09:55,631] Trial 110 finished with value: 0.2273382948580925 and parameters: {'alpha': 216561.15878685398, 'use_snp_selection': False, 'iw_method': 'pc_logistic', 'iw_clip_max': 3.0, 'iw_prob_clip': 0.046436121200534586, 'iw_n_components': 40, 'iw_logistic_c': 2.2332324870726698e-06, 'iw_pca_fit': 'combined', 'iw_solver': 'lbfgs', 'iw_rho': 1.0}. Best is trial 105 with value: 0.22839972362683358.
