[I 2026-04-21 17:30:50,223] Trial 21 finished with value: 0.23111250390373395 and parameters: {'hidden_dims': '[512, 64]', 'dropout': 0.35345339360407524, 'batch_norm': True, 'lr': 0.00020816626190416486, 'weight_decay': 0.00013883144427955248, 'epochs': 196, 'loss': 'mae', 'optimizer': 'adamw', 'use_snp_selection': False, 'weight_scheme': 'top-heavy', 'weight_clip_max': None, 'weight_topheavy_top_frac': 0.499988774693457, 'weight_topheavy_low': 0.568064075610189, 'weight_topheavy_high': 5.884837775623847}. Best is trial 12 with value: 0.24153346255848498.
[I 2026-04-21 17:31:10,908] Trial 22 finished with value: 0.18263446720899187 and parameters: {'hidden_dims': '[512, 64]', 'dropout': 0.5457722938108711, 'batch_norm': False, 'lr': 0.0008507479907354046, 'weight_decay': 0.00027624040742872766, 'epochs': 264, 'loss': 'mae', 'optimizer': 'adamw', 'use_snp_selection': True, 'num_snps': 49041, 'weight_scheme': 'exponential', 'weight_clip_max': 5.0, 'weight_exponential_beta': 7.663852726020036}. Best is trial 13 with value: 0.24190516444657253.
[I 2026-04-21 17:31:27,549] Trial 22 finished with value: 0.23777069687908362 and parameters: {'hidden_dims': '[512, 64]', 'dropout': 0.42744199975221925, 'batch_norm': True, 'lr': 0.0005461128340301466, 'weight_decay': 0.0002232981320187196, 'epochs': 225, 'loss': 'mae', 'optimizer': 'adamw', 'use_snp_selection': False, 'weight_scheme': 'top-heavy', 'weight_clip_max': None, 'weight_topheavy_top_frac': 0.484907978425221, 'weight_topheavy_low': 0.5512244876219575, 'weight_topheavy_high': 5.762233091036252}. Best is trial 12 with value: 0.24153346255848498.
[I 2026-04-21 17:31:46,251] Trial 23 finished with value: 0.23048180559833675 and parameters: {'hidden_dims': '[512, 64]', 'dropout': 0.4737139311690988, 'batch_norm': False, 'lr': 0.0003105350137438012, 'weight_decay': 2.4825977205180345e-05, 'epochs': 213, 'loss': 'mae', 'optimizer': 'adamw', 'use_snp_selection': True, 'num_snps': 32383, 'weight_scheme': 'exponential', 'weight_clip_max': 5.0, 'weight_exponential_beta': 5.384394701072248}. Best is trial 13 with value: 0.24190516444657253.
[I 2026-04-21 17:32:11,227] Trial 23 finished with value: 0.25473066334952205 and parameters: {'hidden_dims': '[512, 64]', 'dropout': 0.3077334054220296, 'batch_norm': True, 'lr': 5.3274087183832526e-05, 'weight_decay': 3.724935488850716e-05, 'epochs': 267, 'loss': 'mae', 'optimizer': 'adamw', 'use_snp_selection': False, 'weight_scheme': 'top-heavy', 'weight_clip_max': None, 'weight_topheavy_top_frac': 0.3384545428117869, 'weight_topheavy_low': 0.97102071867973, 'weight_topheavy_high': 4.058060582890546}. Best is trial 23 with value: 0.25473066334952205.
[I 2026-04-21 17:32:24,134] Trial 24 finished with value: 0.23090219760479333 and parameters: {'hidden_dims': '[512, 64]', 'dropout': 0.4432826290451943, 'batch_norm': False, 'lr': 0.0002860119041361712, 'weight_decay': 1.916370227423421e-05, 'epochs': 199, 'loss': 'mae', 'optimizer': 'adamw', 'use_snp_selection': True, 'num_snps': 37715, 'weight_scheme': 'exponential', 'weight_clip_max': 5.0, 'weight_exponential_beta': 5.162899602186275}. Best is trial 13 with value: 0.24190516444657253.
[I 2026-04-21 17:32:55,395] Trial 24 finished with value: 0.24272333527049547 and parameters: {'hidden_dims': '[512, 64]', 'dropout': 0.2262231761514784, 'batch_norm': True, 'lr': 5.380220103391126e-05, 'weight_decay': 2.713510913332338e-05, 'epochs': 270, 'loss': 'mae', 'optimizer': 'adamw', 'use_snp_selection': False, 'weight_scheme': 'minmax', 'weight_clip_max': None, 'weight_minmax_eps': 0.08278744365837906}. Best is trial 23 with value: 0.25473066334952205.
[I 2026-04-21 17:32:57,976] Trial 25 finished with value: 0.19377535490336006 and parameters: {'hidden_dims': '[512, 64]', 'dropout': 0.4361598163473564, 'batch_norm': False, 'lr': 0.0005361406196086654, 'weight_decay': 3.0194023494097854e-05, 'epochs': 166, 'loss': 'mae', 'optimizer': 'adamw', 'use_snp_selection': True, 'num_snps': 35194, 'weight_scheme': 'exponential', 'weight_clip_max': None, 'weight_exponential_beta': 4.8751538177379725}. Best is trial 13 with value: 0.24190516444657253.
[I 2026-04-21 17:33:28,046] Trial 26 finished with value: 0.20878278312676182 and parameters: {'hidden_dims': '[512, 64]', 'dropout': 0.3290728716286402, 'batch_norm': False, 'lr': 0.00030946328245094534, 'weight_decay': 1.8065015960467178e-05, 'epochs': 198, 'loss': 'mae', 'optimizer': 'adam', 'use_snp_selection': True, 'num_snps': 24282, 'weight_scheme': 'exponential', 'weight_clip_max': 5.0, 'weight_exponential_beta': 5.103530400716064}. Best is trial 13 with value: 0.24190516444657253.
[I 2026-04-21 17:33:39,386] Trial 25 finished with value: 0.23892958920509066 and parameters: {'hidden_dims': '[512, 64]', 'dropout': 0.21613582315074814, 'batch_norm': True, 'lr': 7.43414339649304e-05, 'weight_decay': 3.2566763227573975e-05, 'epochs': 269, 'loss': 'mae', 'optimizer': 'adamw', 'use_snp_selection': False, 'weight_scheme': 'top-heavy', 'weight_clip_max': None, 'weight_topheavy_top_frac': 0.3127821219297849, 'weight_topheavy_low': 1.055484583543303, 'weight_topheavy_high': 3.5824219816332783}. Best is trial 23 with value: 0.25473066334952205.
[I 2026-04-21 17:34:01,929] Trial 27 finished with value: 0.23919977335798426 and parameters: {'hidden_dims': '[512, 64]', 'dropout': 0.4820657774942242, 'batch_norm': False, 'lr': 5.698466120288828e-05, 'weight_decay': 1.3292704002757076e-06, 'epochs': 150, 'loss': 'mae', 'optimizer': 'adamw', 'use_snp_selection': True, 'num_snps': 36466, 'weight_scheme': 'exponential', 'weight_clip_max': 5.0, 'weight_exponential_beta': 5.700066548377294}. Best is trial 13 with value: 0.24190516444657253.
[I 2026-04-21 17:34:22,001] Trial 26 finished with value: 0.2630868472316528 and parameters: {'hidden_dims': '[512, 64]', 'dropout': 0.31867902566089673, 'batch_norm': False, 'lr': 5.930262574618304e-05, 'weight_decay': 3.015812085738207e-05, 'epochs': 269, 'loss': 'mae', 'optimizer': 'adamw', 'use_snp_selection': False, 'weight_scheme': 'uniform', 'weight_clip_max': None}. Best is trial 26 with value: 0.2630868472316528.
[I 2026-04-21 17:34:35,077] Trial 28 finished with value: 0.22286473710659496 and parameters: {'hidden_dims': '[512, 64]', 'dropout': 0.408132897033913, 'batch_norm': False, 'lr': 5.225293756321091e-05, 'weight_decay': 1.3102279284143802e-06, 'epochs': 137, 'loss': 'mae', 'optimizer': 'adamw', 'use_snp_selection': True, 'num_snps': 37696, 'weight_scheme': 'uniform', 'weight_clip_max': None}. Best is trial 13 with value: 0.24190516444657253.
[I 2026-04-21 17:35:14,235] Trial 29 finished with value: 0.2280763938446164 and parameters: {'hidden_dims': '[512, 64]', 'dropout': 0.3563896893843109, 'batch_norm': False, 'lr': 7.834749590438748e-06, 'weight_decay': 5.2089165354760035e-06, 'epochs': 126, 'loss': 'mse', 'optimizer': 'adamw', 'use_snp_selection': True, 'num_snps': 50902, 'weight_scheme': 'top-heavy', 'weight_clip_max': 10.0, 'weight_topheavy_top_frac': 0.05821081532817288, 'weight_topheavy_low': 0.6720294775888462, 'weight_topheavy_high': 4.238064124744974}. Best is trial 13 with value: 0.24190516444657253.
[I 2026-04-21 17:35:25,340] Trial 27 finished with value: 0.2631283196910279 and parameters: {'hidden_dims': '[512, 64]', 'dropout': 0.3266496107420462, 'batch_norm': False, 'lr': 6.279640764925702e-05, 'weight_decay': 0.0009421145058822307, 'epochs': 277, 'loss': 'mae', 'optimizer': 'adamw', 'use_snp_selection': True, 'num_snps': 58369, 'weight_scheme': 'uniform', 'weight_clip_max': None}. Best is trial 27 with value: 0.2631283196910279.
[I 2026-04-21 17:35:40,208] Trial 30 finished with value: 0.22084223819557414 and parameters: {'hidden_dims': '[512, 64]', 'dropout': 0.4702030314726287, 'batch_norm': False, 'lr': 1.8619106981704415e-05, 'weight_decay': 2.791918127350766e-06, 'epochs': 101, 'loss': 'mae', 'optimizer': 'adam', 'use_snp_selection': True, 'num_snps': 25542, 'weight_scheme': 'exponential', 'weight_clip_max': 5.0, 'weight_exponential_beta': 6.228624189655225}. Best is trial 13 with value: 0.24190516444657253.
[I 2026-04-21 17:36:13,536] Trial 31 finished with value: 0.2212611115135291 and parameters: {'hidden_dims': '[512, 64]', 'dropout': 0.4852403657811808, 'batch_norm': False, 'lr': 0.0003250513332042969, 'weight_decay': 1.1634067672427331e-05, 'epochs': 191, 'loss': 'mae', 'optimizer': 'adamw', 'use_snp_selection': True, 'num_snps': 30725, 'weight_scheme': 'exponential', 'weight_clip_max': 5.0, 'weight_exponential_beta': 5.631162810177157}. Best is trial 13 with value: 0.24190516444657253.
[I 2026-04-21 17:36:29,521] Trial 28 finished with value: 0.2617957500835546 and parameters: {'hidden_dims': '[512, 64]', 'dropout': 0.3184350951125624, 'batch_norm': False, 'lr': 2.042531669308363e-05, 'weight_decay': 0.0006904358112551057, 'epochs': 272, 'loss': 'mae', 'optimizer': 'adamw', 'use_snp_selection': True, 'num_snps': 58955, 'weight_scheme': 'uniform', 'weight_clip_max': 5.0}. Best is trial 27 with value: 0.2631283196910279.
[I 2026-04-21 17:36:47,540] Trial 32 finished with value: 0.051387398332237794 and parameters: {'hidden_dims': '[512, 64]', 'dropout': 0.4153781967051112, 'batch_norm': False, 'lr': 0.0006191257732744651, 'weight_decay': 5.789697661333351e-05, 'epochs': 162, 'loss': 'mae', 'optimizer': 'adamw', 'use_snp_selection': True, 'num_snps': 35703, 'weight_scheme': 'exponential', 'weight_clip_max': 5.0, 'weight_exponential_beta': 3.9211251060845225}. Best is trial 13 with value: 0.24190516444657253.
[I 2026-04-21 17:37:11,104] Trial 33 finished with value: 0.21042161492072373 and parameters: {'hidden_dims': '[512, 64]', 'dropout': 0.46261403898707454, 'batch_norm': False, 'lr': 0.00012931668294562695, 'weight_decay': 4.244860770047211e-05, 'epochs': 238, 'loss': 'mae', 'optimizer': 'adamw', 'use_snp_selection': True, 'num_snps': 11739, 'weight_scheme': 'exponential', 'weight_clip_max': 5.0, 'weight_exponential_beta': 6.552453271285815}. Best is trial 13 with value: 0.24190516444657253.
[I 2026-04-21 17:37:16,251] Trial 29 finished with value: 0.2249874302149771 and parameters: {'hidden_dims': '[256, 128]', 'dropout': 0.32374554941430794, 'batch_norm': False, 'lr': 9.872904570719762e-06, 'weight_decay': 0.0007386079619724701, 'epochs': 300, 'loss': 'mse', 'optimizer': 'adamw', 'use_snp_selection': True, 'num_snps': 56985, 'weight_scheme': 'uniform', 'weight_clip_max': 5.0}. Best is trial 27 with value: 0.2631283196910279.
[I 2026-04-21 17:37:57,815] Trial 34 finished with value: 0.232703219640772 and parameters: {'hidden_dims': '[512, 128]', 'dropout': 0.5479466379685163, 'batch_norm': True, 'lr': 0.00024518349301697767, 'weight_decay': 2.772863853918818e-07, 'epochs': 214, 'loss': 'mse', 'optimizer': 'adamw', 'use_snp_selection': True, 'num_snps': 47569, 'weight_scheme': 'linear', 'weight_clip_max': 5.0, 'weight_linear_min_weight': 0.9983116049987149, 'weight_linear_max_weight': 3.656733702382821}. Best is trial 13 with value: 0.24190516444657253.
[I 2026-04-21 17:38:21,978] Trial 30 finished with value: 0.26333420625066184 and parameters: {'hidden_dims': '[512, 64]', 'dropout': 0.25202724941985843, 'batch_norm': False, 'lr': 2.0621326303897562e-05, 'weight_decay': 0.0003257675900391535, 'epochs': 281, 'loss': 'mae', 'optimizer': 'adamw', 'use_snp_selection': True, 'num_snps': 59059, 'weight_scheme': 'uniform', 'weight_clip_max': 5.0}. Best is trial 30 with value: 0.26333420625066184.
[I 2026-04-21 17:38:38,339] Trial 35 finished with value: 0.22706989267929698 and parameters: {'hidden_dims': '[512, 128]', 'dropout': 0.5524467442656165, 'batch_norm': True, 'lr': 5.6220128300855895e-05, 'weight_decay': 2.2431192922660888e-07, 'epochs': 152, 'loss': 'mse', 'optimizer': 'adamw', 'use_snp_selection': True, 'num_snps': 48097, 'weight_scheme': 'linear', 'weight_clip_max': None, 'weight_linear_min_weight': 0.976832601744724, 'weight_linear_max_weight': 3.8152481154310984}. Best is trial 13 with value: 0.24190516444657253.
[I 2026-04-21 17:39:05,544] Trial 36 finished with value: 0.14265796277034912 and parameters: {'hidden_dims': '[512, 128]', 'dropout': 0.26764256717136825, 'batch_norm': True, 'lr': 0.00018379903620732504, 'weight_decay': 4.908217199597056e-07, 'epochs': 182, 'loss': 'mse', 'optimizer': 'sgd', 'use_snp_selection': False, 'weight_scheme': 'linear', 'weight_clip_max': 5.0, 'weight_linear_min_weight': 0.6663899958673892, 'weight_linear_max_weight': 2.9833526582208143}. Best is trial 13 with value: 0.24190516444657253.
[I 2026-04-21 17:39:27,826] Trial 31 finished with value: 0.2588529727199291 and parameters: {'hidden_dims': '[512, 64]', 'dropout': 0.25486205036289006, 'batch_norm': False, 'lr': 2.0246555375757284e-05, 'weight_decay': 0.0003089823128114567, 'epochs': 279, 'loss': 'mae', 'optimizer': 'adamw', 'use_snp_selection': True, 'num_snps': 59129, 'weight_scheme': 'uniform', 'weight_clip_max': 5.0}. Best is trial 30 with value: 0.26333420625066184.
[I 2026-04-21 17:39:52,512] Trial 37 finished with value: 0.2251107126354143 and parameters: {'hidden_dims': '[512, 128]', 'dropout': 0.3262303236877114, 'batch_norm': True, 'lr': 1.1022586343891372e-06, 'weight_decay': 8.041049548645144e-08, 'epochs': 226, 'loss': 'mse', 'optimizer': 'adamw', 'use_snp_selection': True, 'num_snps': 46119, 'weight_scheme': 'linear', 'weight_clip_max': 10.0, 'weight_linear_min_weight': 0.5956551943456955, 'weight_linear_max_weight': 2.3510221858485387}. Best is trial 13 with value: 0.24190516444657253.
[I 2026-04-21 17:40:08,587] Trial 38 finished with value: 0.1515627013009029 and parameters: {'hidden_dims': '[256, 64]', 'dropout': 0.5111890236350783, 'batch_norm': True, 'lr': 2.725869018415854e-05, 'weight_decay': 2.866323413373902e-06, 'epochs': 197, 'loss': 'mse', 'optimizer': 'sgd', 'use_snp_selection': False, 'weight_scheme': 'linear', 'weight_clip_max': None, 'weight_linear_min_weight': 0.7717798665085063, 'weight_linear_max_weight': 3.9356410936181483}. Best is trial 13 with value: 0.24190516444657253.
[I 2026-04-21 17:40:25,654] Trial 32 finished with value: 0.24633424214997002 and parameters: {'hidden_dims': '[512, 64]', 'dropout': 0.3316344643344241, 'batch_norm': False, 'lr': 1.0911092790012752e-05, 'weight_decay': 0.00037774928450184675, 'epochs': 281, 'loss': 'mae', 'optimizer': 'adamw', 'use_snp_selection': True, 'num_snps': 49205, 'weight_scheme': 'uniform', 'weight_clip_max': 5.0}. Best is trial 30 with value: 0.26333420625066184.
[I 2026-04-21 17:40:44,898] Trial 39 finished with value: 0.2278152837943096 and parameters: {'hidden_dims': '[512, 128]', 'dropout': 0.5500141943608398, 'batch_norm': True, 'lr': 8.382426848311634e-05, 'weight_decay': 5.899954988284943e-07, 'epochs': 152, 'loss': 'mse', 'optimizer': 'adamw', 'use_snp_selection': True, 'num_snps': 39976, 'weight_scheme': 'linear', 'weight_clip_max': 5.0, 'weight_linear_min_weight': 0.4234301832873276, 'weight_linear_max_weight': 1.0213985995318575}. Best is trial 13 with value: 0.24190516444657253.
[I 2026-04-21 17:41:20,546] Trial 33 finished with value: 0.23784012916513084 and parameters: {'hidden_dims': '[512, 64]', 'dropout': 0.18584829468156372, 'batch_norm': False, 'lr': 2.4863853036938008e-05, 'weight_decay': 0.000776386207119953, 'epochs': 257, 'loss': 'mae', 'optimizer': 'adamw', 'use_snp_selection': True, 'num_snps': 49363, 'weight_scheme': 'uniform', 'weight_clip_max': 5.0}. Best is trial 30 with value: 0.26333420625066184.
[I 2026-04-21 17:41:41,691] Trial 0 finished with value: 0.1242070510409649 and parameters: {'hidden_dims': '[256, 128]', 'dropout': 0.18584155530312246, 'batch_norm': True, 'lr': 9.012665953349533e-06, 'weight_decay': 4.96591963698479e-06, 'epochs': 105, 'loss': 'mse', 'optimizer': 'sgd', 'use_snp_selection': True, 'num_snps': 25583, 'weight_scheme': 'minmax', 'weight_clip_max': 5.0, 'weight_minmax_eps': 0.14026014881292506}. Best is trial 0 with value: 0.1242070510409649.
[I 2026-04-21 17:41:55,957] Trial 1 finished with value: 0.1870704869075315 and parameters: {'hidden_dims': '[256, 64]', 'dropout': 0.05000949662985405, 'batch_norm': True, 'lr': 0.00015647443054904835, 'weight_decay': 5.158896024962846e-05, 'epochs': 152, 'loss': 'mse', 'optimizer': 'sgd', 'use_snp_selection': False, 'weight_scheme': 'linear', 'weight_clip_max': None, 'weight_linear_min_weight': 0.21922985165550554, 'weight_linear_max_weight': 1.6260435767424388}. Best is trial 1 with value: 0.1870704869075315.
[I 2026-04-21 17:42:20,865] Trial 2 finished with value: 0.14766512181937158 and parameters: {'hidden_dims': '[512, 128]', 'dropout': 0.2736730891340176, 'batch_norm': True, 'lr': 7.298114623433994e-05, 'weight_decay': 5.6346010385734023e-08, 'epochs': 185, 'loss': 'mae', 'optimizer': 'sgd', 'use_snp_selection': True, 'num_snps': 14091, 'weight_scheme': 'minmax', 'weight_clip_max': 10.0, 'weight_minmax_eps': 0.045780660776687306}. Best is trial 1 with value: 0.1870704869075315.
[I 2026-04-21 17:42:30,449] Trial 34 finished with value: 0.23983347165041802 and parameters: {'hidden_dims': '[512, 128]', 'dropout': 0.278348508583402, 'batch_norm': False, 'lr': 5.396225920802665e-06, 'weight_decay': 0.0009677837989937992, 'epochs': 300, 'loss': 'mse', 'optimizer': 'adamw', 'use_snp_selection': True, 'num_snps': 59522, 'weight_scheme': 'uniform', 'weight_clip_max': 5.0}. Best is trial 30 with value: 0.26333420625066184.
[I 2026-04-21 17:43:04,115] Trial 3 finished with value: 0.05110254794549927 and parameters: {'hidden_dims': '[512, 64]', 'dropout': 0.30157795416637295, 'batch_norm': False, 'lr': 2.007492282795256e-05, 'weight_decay': 5.496446859789657e-06, 'epochs': 284, 'loss': 'mse', 'optimizer': 'sgd', 'use_snp_selection': False, 'weight_scheme': 'linear', 'weight_clip_max': None, 'weight_linear_min_weight': 0.24682154527102826, 'weight_linear_max_weight': 1.8338910783134623}. Best is trial 1 with value: 0.1870704869075315.
[I 2026-04-21 17:43:18,014] Trial 4 finished with value: 0.16341940050283033 and parameters: {'hidden_dims': '[256, 64]', 'dropout': 0.18128694708490736, 'batch_norm': False, 'lr': 8.951826748007403e-05, 'weight_decay': 2.1781541495465197e-07, 'epochs': 147, 'loss': 'mse', 'optimizer': 'sgd', 'use_snp_selection': False, 'weight_scheme': 'top-heavy', 'weight_clip_max': 5.0, 'weight_topheavy_top_frac': 0.1724888194073277, 'weight_topheavy_low': 1.1620865802171172, 'weight_topheavy_high': 3.476906528073177}. Best is trial 1 with value: 0.1870704869075315.
[I 2026-04-21 17:43:27,518] Trial 35 finished with value: 0.23874076323133261 and parameters: {'hidden_dims': '[512, 64]', 'dropout': 0.4005313430742858, 'batch_norm': False, 'lr': 0.0001381374492106186, 'weight_decay': 9.176078622940965e-05, 'epochs': 282, 'loss': 'mae', 'optimizer': 'adamw', 'use_snp_selection': True, 'num_snps': 48583, 'weight_scheme': 'uniform', 'weight_clip_max': 5.0}. Best is trial 30 with value: 0.26333420625066184.
[I 2026-04-21 17:43:29,939] Trial 5 finished with value: 0.09748388544738741 and parameters: {'hidden_dims': '[256, 64]', 'dropout': 0.2571412946970998, 'batch_norm': True, 'lr': 3.546238022482882e-05, 'weight_decay': 1.0185234767613396e-06, 'epochs': 119, 'loss': 'mse', 'optimizer': 'sgd', 'use_snp_selection': False, 'weight_scheme': 'linear', 'weight_clip_max': 10.0, 'weight_linear_min_weight': 0.9405832045183805, 'weight_linear_max_weight': 3.413610925325811}. Best is trial 1 with value: 0.1870704869075315.
[I 2026-04-21 17:43:51,765] Trial 6 finished with value: 0.2587559884363757 and parameters: {'hidden_dims': '[256, 64]', 'dropout': 0.037961443806696214, 'batch_norm': True, 'lr': 3.644202049829694e-05, 'weight_decay': 9.73334309820277e-06, 'epochs': 243, 'loss': 'mae', 'optimizer': 'adam', 'use_snp_selection': False, 'weight_scheme': 'minmax', 'weight_clip_max': None, 'weight_minmax_eps': 0.08689611239934374}. Best is trial 6 with value: 0.2587559884363757.
[I 2026-04-21 17:44:14,481] Trial 36 finished with value: 0.20437197671063115 and parameters: {'hidden_dims': '[512, 64]', 'dropout': 0.276561068225114, 'batch_norm': False, 'lr': 1.4476405433305682e-05, 'weight_decay': 0.0003190724964525034, 'epochs': 234, 'loss': 'mse', 'optimizer': 'adamw', 'use_snp_selection': True, 'num_snps': 41715, 'weight_scheme': 'linear', 'weight_clip_max': 5.0, 'weight_linear_min_weight': 0.9227657239231647, 'weight_linear_max_weight': 3.961327169017454}. Best is trial 30 with value: 0.26333420625066184.
[I 2026-04-21 17:44:38,929] Trial 7 finished with value: 0.024894069885477727 and parameters: {'hidden_dims': '[512, 128]', 'dropout': 0.1304538168539244, 'batch_norm': False, 'lr': 1.5408060926311233e-05, 'weight_decay': 2.1989735568314356e-08, 'epochs': 250, 'loss': 'mse', 'optimizer': 'sgd', 'use_snp_selection': True, 'num_snps': 42550, 'weight_scheme': 'exponential', 'weight_clip_max': 10.0, 'weight_exponential_beta': 2.758850226029358}. Best is trial 6 with value: 0.2587559884363757.
[I 2026-04-21 17:44:50,420] Trial 37 finished with value: 0.2684685150466404 and parameters: {'hidden_dims': '[256, 128]', 'dropout': 0.22546088007443799, 'batch_norm': False, 'lr': 2.6499061616627173e-05, 'weight_decay': 3.3109290636685267e-06, 'epochs': 163, 'loss': 'mae', 'optimizer': 'adamw', 'use_snp_selection': True, 'num_snps': 53405, 'weight_scheme': 'uniform', 'weight_clip_max': 10.0}. Best is trial 37 with value: 0.2684685150466404.
[I 2026-04-21 17:45:03,203] Trial 8 finished with value: 0.311927808073811 and parameters: {'hidden_dims': '[256, 128]', 'dropout': 0.05742396906738376, 'batch_norm': False, 'lr': 1.9761509510575143e-06, 'weight_decay': 2.933492239224291e-07, 'epochs': 82, 'loss': 'mae', 'optimizer': 'adam', 'use_snp_selection': True, 'num_snps': 29883, 'weight_scheme': 'minmax', 'weight_clip_max': 5.0, 'weight_minmax_eps': 0.0051288771726799584}. Best is trial 8 with value: 0.311927808073811.
