Running from this directory: /cluster/work/simennes/Master_thesis
Name of job: ncv_ridge_avggrm
ID of job: 24332633
Array task ID: 1
The job was run on these nodes: idun-03-06
[I 2026-04-22 13:51:19,838] Trial 0 finished with value: 0.1583007127755346 and parameters: {'alpha': 12124.394605078569, 'use_snp_selection': True, 'num_snps': 5442, 'weight_scheme': 'linear', 'weight_clip_max': 5.0, 'weight_linear_min_weight': 0.5849999641604302, 'weight_linear_max_weight': 1.017621356653175}. Best is trial 0 with value: 0.1583007127755346.
[I 2026-04-22 13:53:13,266] Trial 1 finished with value: 0.1849746789590238 and parameters: {'alpha': 109374.19486700959, 'use_snp_selection': True, 'num_snps': 25583, 'weight_scheme': 'minmax', 'weight_clip_max': 5.0, 'weight_minmax_eps': 0.14026014881292506}. Best is trial 1 with value: 0.1849746789590238.
[I 2026-04-22 13:55:52,276] Trial 2 finished with value: 0.183057815721442 and parameters: {'alpha': 87498.4492964452, 'use_snp_selection': True, 'num_snps': 53815, 'weight_scheme': 'linear', 'weight_clip_max': 5.0, 'weight_linear_min_weight': 0.27089068881512934, 'weight_linear_max_weight': 2.0548794162981476}. Best is trial 1 with value: 0.1849746789590238.
[I 2026-04-22 13:56:53,402] Trial 3 finished with value: 0.1871085240095348 and parameters: {'alpha': 194477.78458557956, 'use_snp_selection': False, 'weight_scheme': 'linear', 'weight_clip_max': None, 'weight_linear_min_weight': 0.21922985165550554, 'weight_linear_max_weight': 1.6260435767424388}. Best is trial 3 with value: 0.1871085240095348.
[I 2026-04-22 13:57:54,569] Trial 4 finished with value: 0.16897836752289228 and parameters: {'alpha': 9421665.195468841, 'use_snp_selection': False, 'weight_scheme': 'minmax', 'weight_clip_max': 5.0, 'weight_minmax_eps': 0.030689801852077123}. Best is trial 3 with value: 0.1871085240095348.
[I 2026-04-22 13:59:19,120] Trial 5 finished with value: 0.15260742466725838 and parameters: {'alpha': 5024.251153421461, 'use_snp_selection': True, 'num_snps': 9046, 'weight_scheme': 'top-heavy', 'weight_clip_max': 10.0, 'weight_topheavy_top_frac': 0.08738114702774886, 'weight_topheavy_low': 0.8991910356358707, 'weight_topheavy_high': 2.2968843007908903}. Best is trial 3 with value: 0.1871085240095348.
[I 2026-04-22 14:00:08,757] Trial 6 finished with value: 0.12116447928156997 and parameters: {'alpha': 16.382429914774185, 'use_snp_selection': False, 'weight_scheme': 'uniform', 'weight_clip_max': 10.0}. Best is trial 3 with value: 0.1871085240095348.
[I 2026-04-22 14:02:37,745] Trial 7 finished with value: 0.18446634874081935 and parameters: {'alpha': 94169.1049689093, 'use_snp_selection': True, 'num_snps': 47654, 'weight_scheme': 'exponential', 'weight_clip_max': 10.0, 'weight_exponential_beta': 2.3870207999558124}. Best is trial 3 with value: 0.1871085240095348.
[I 2026-04-22 14:03:56,080] Trial 8 finished with value: 0.0650338155728287 and parameters: {'alpha': 96.38034897458088, 'use_snp_selection': True, 'num_snps': 5388, 'weight_scheme': 'minmax', 'weight_clip_max': None, 'weight_minmax_eps': 0.07791532902904205}. Best is trial 3 with value: 0.1871085240095348.
[I 2026-04-22 14:04:57,257] Trial 9 finished with value: 0.17357490759593802 and parameters: {'alpha': 2700506.792350819, 'use_snp_selection': False, 'weight_scheme': 'linear', 'weight_clip_max': 5.0, 'weight_linear_min_weight': 0.8693390069349902, 'weight_linear_max_weight': 2.1394245284712112}. Best is trial 3 with value: 0.1871085240095348.
[I 2026-04-22 14:05:46,956] Trial 10 finished with value: 0.1260286510564928 and parameters: {'alpha': 859.5702697532038, 'use_snp_selection': False, 'weight_scheme': 'uniform', 'weight_clip_max': None}. Best is trial 3 with value: 0.1871085240095348.
[I 2026-04-22 14:06:48,157] Trial 11 finished with value: 0.1885352634353867 and parameters: {'alpha': 409602.6639259898, 'use_snp_selection': False, 'weight_scheme': 'minmax', 'weight_clip_max': None, 'weight_minmax_eps': 0.1948034106595098}. Best is trial 11 with value: 0.1885352634353867.
[I 2026-04-22 14:07:49,097] Trial 12 finished with value: 0.17850277048538074 and parameters: {'alpha': 680962.8765783042, 'use_snp_selection': False, 'weight_scheme': 'top-heavy', 'weight_clip_max': None, 'weight_topheavy_top_frac': 0.49699410181949777, 'weight_topheavy_low': 0.5005758546501398, 'weight_topheavy_high': 5.820938012616832}. Best is trial 11 with value: 0.1885352634353867.
[I 2026-04-22 14:08:50,179] Trial 13 finished with value: 0.16284773590080986 and parameters: {'alpha': 575201.7605703112, 'use_snp_selection': False, 'weight_scheme': 'exponential', 'weight_clip_max': None, 'weight_exponential_beta': 7.690114690430509}. Best is trial 11 with value: 0.1885352634353867.
[I 2026-04-22 14:09:51,499] Trial 14 finished with value: 0.1543099873803781 and parameters: {'alpha': 12688.447315130805, 'use_snp_selection': False, 'weight_scheme': 'linear', 'weight_clip_max': None, 'weight_linear_min_weight': 0.11327358503875218, 'weight_linear_max_weight': 3.1125420448481593}. Best is trial 11 with value: 0.1885352634353867.
[I 2026-04-22 14:10:52,876] Trial 15 finished with value: 0.18767218371572905 and parameters: {'alpha': 615136.1283403845, 'use_snp_selection': False, 'weight_scheme': 'minmax', 'weight_clip_max': None, 'weight_minmax_eps': 0.195505069056512}. Best is trial 11 with value: 0.1885352634353867.
[I 2026-04-22 14:11:54,491] Trial 16 finished with value: 0.17924121361878764 and parameters: {'alpha': 2277110.2749443445, 'use_snp_selection': False, 'weight_scheme': 'minmax', 'weight_clip_max': None, 'weight_minmax_eps': 0.19832517063898217}. Best is trial 11 with value: 0.1885352634353867.
[I 2026-04-22 14:12:55,979] Trial 17 finished with value: 0.13010835838322776 and parameters: {'alpha': 1628.3038614117438, 'use_snp_selection': False, 'weight_scheme': 'minmax', 'weight_clip_max': None, 'weight_minmax_eps': 0.1799761838000124}. Best is trial 11 with value: 0.1885352634353867.
[I 2026-04-22 14:13:57,384] Trial 18 finished with value: 0.18857107628907152 and parameters: {'alpha': 578553.2200691149, 'use_snp_selection': False, 'weight_scheme': 'minmax', 'weight_clip_max': None, 'weight_minmax_eps': 0.140015530863199}. Best is trial 18 with value: 0.18857107628907152.
[I 2026-04-22 14:14:58,968] Trial 19 finished with value: 0.170833996339041 and parameters: {'alpha': 9223350.256863186, 'use_snp_selection': False, 'weight_scheme': 'minmax', 'weight_clip_max': None, 'weight_minmax_eps': 0.1248505449976196}. Best is trial 18 with value: 0.18857107628907152.
[I 2026-04-22 14:16:00,471] Trial 20 finished with value: 0.17115404691843172 and parameters: {'alpha': 41023.511378747935, 'use_snp_selection': False, 'weight_scheme': 'minmax', 'weight_clip_max': 10.0, 'weight_minmax_eps': 0.1479800394899743}. Best is trial 18 with value: 0.18857107628907152.
[I 2026-04-22 14:17:01,971] Trial 21 finished with value: 0.1878502188584756 and parameters: {'alpha': 572625.4434319544, 'use_snp_selection': False, 'weight_scheme': 'minmax', 'weight_clip_max': None, 'weight_minmax_eps': 0.1999986837840563}. Best is trial 18 with value: 0.18857107628907152.
[I 2026-04-22 14:18:03,614] Trial 22 finished with value: 0.1811503216698385 and parameters: {'alpha': 1901457.6015134729, 'use_snp_selection': False, 'weight_scheme': 'minmax', 'weight_clip_max': None, 'weight_minmax_eps': 0.1636923143233335}. Best is trial 18 with value: 0.18857107628907152.
[I 2026-04-22 14:19:05,291] Trial 23 finished with value: 0.18844962535746176 and parameters: {'alpha': 329679.2896006506, 'use_snp_selection': False, 'weight_scheme': 'minmax', 'weight_clip_max': None, 'weight_minmax_eps': 0.19956713326016048}. Best is trial 18 with value: 0.18857107628907152.
[I 2026-04-22 14:20:06,898] Trial 24 finished with value: 0.16721162368741124 and parameters: {'alpha': 30873.195462384927, 'use_snp_selection': False, 'weight_scheme': 'minmax', 'weight_clip_max': None, 'weight_minmax_eps': 0.09166355421372314}. Best is trial 18 with value: 0.18857107628907152.
[I 2026-04-22 14:21:08,155] Trial 25 finished with value: 0.1782910829555817 and parameters: {'alpha': 282292.50034087326, 'use_snp_selection': False, 'weight_scheme': 'top-heavy', 'weight_clip_max': None, 'weight_topheavy_top_frac': 0.3575103152810156, 'weight_topheavy_low': 1.1802128984724949, 'weight_topheavy_high': 1.3166292117379128}. Best is trial 18 with value: 0.18857107628907152.
[I 2026-04-22 14:21:57,983] Trial 26 finished with value: 0.16785071771733895 and parameters: {'alpha': 1801516.6072259308, 'use_snp_selection': False, 'weight_scheme': 'uniform', 'weight_clip_max': None}. Best is trial 18 with value: 0.18857107628907152.
[I 2026-04-22 14:22:59,315] Trial 27 finished with value: 0.1671425999620876 and parameters: {'alpha': 36324.51901844697, 'use_snp_selection': False, 'weight_scheme': 'exponential', 'weight_clip_max': None, 'weight_exponential_beta': 0.29703663720294715}. Best is trial 18 with value: 0.18857107628907152.
[I 2026-04-22 14:24:00,389] Trial 28 finished with value: 0.1750854066813056 and parameters: {'alpha': 4212227.972204566, 'use_snp_selection': False, 'weight_scheme': 'minmax', 'weight_clip_max': None, 'weight_minmax_eps': 0.1665032745691033}. Best is trial 18 with value: 0.18857107628907152.
[I 2026-04-22 14:26:09,927] Trial 29 finished with value: 0.13894340562506297 and parameters: {'alpha': 4329.142373943202, 'use_snp_selection': True, 'num_snps': 36017, 'weight_scheme': 'minmax', 'weight_clip_max': 10.0, 'weight_minmax_eps': 0.12663984995125763}. Best is trial 18 with value: 0.18857107628907152.
[I 2026-04-22 14:27:11,153] Trial 30 finished with value: 0.1878026535369644 and parameters: {'alpha': 229296.16200675577, 'use_snp_selection': False, 'weight_scheme': 'minmax', 'weight_clip_max': 5.0, 'weight_minmax_eps': 0.16714750258311775}. Best is trial 18 with value: 0.18857107628907152.
[I 2026-04-22 14:28:12,385] Trial 31 finished with value: 0.18764690194436123 and parameters: {'alpha': 615544.1434972349, 'use_snp_selection': False, 'weight_scheme': 'minmax', 'weight_clip_max': None, 'weight_minmax_eps': 0.19728581184447355}. Best is trial 18 with value: 0.18857107628907152.
[I 2026-04-22 14:29:13,544] Trial 32 finished with value: 0.1834004627588487 and parameters: {'alpha': 1367414.8022455948, 'use_snp_selection': False, 'weight_scheme': 'minmax', 'weight_clip_max': None, 'weight_minmax_eps': 0.18000123709158783}. Best is trial 18 with value: 0.18857107628907152.
[I 2026-04-22 14:30:14,721] Trial 33 finished with value: 0.1881809135423529 and parameters: {'alpha': 277644.75724658126, 'use_snp_selection': False, 'weight_scheme': 'minmax', 'weight_clip_max': None, 'weight_minmax_eps': 0.19754648061991836}. Best is trial 18 with value: 0.18857107628907152.
[I 2026-04-22 14:32:05,661] Trial 34 finished with value: 0.1869915321252997 and parameters: {'alpha': 137723.9718165686, 'use_snp_selection': True, 'num_snps': 25029, 'weight_scheme': 'minmax', 'weight_clip_max': None, 'weight_minmax_eps': 0.05991811105863624}. Best is trial 18 with value: 0.18857107628907152.
[I 2026-04-22 14:33:06,655] Trial 35 finished with value: 0.17971328225048655 and parameters: {'alpha': 80836.46431965777, 'use_snp_selection': False, 'weight_scheme': 'minmax', 'weight_clip_max': 5.0, 'weight_minmax_eps': 0.1783745355253919}. Best is trial 18 with value: 0.18857107628907152.
[I 2026-04-22 14:34:07,695] Trial 36 finished with value: 0.1784461553519254 and parameters: {'alpha': 308674.7545020681, 'use_snp_selection': False, 'weight_scheme': 'top-heavy', 'weight_clip_max': None, 'weight_topheavy_top_frac': 0.06999926024568706, 'weight_topheavy_low': 0.5901369169466679, 'weight_topheavy_high': 5.019813029955817}. Best is trial 18 with value: 0.18857107628907152.
[I 2026-04-22 14:36:55,069] Trial 37 finished with value: 0.14926101286103982 and parameters: {'alpha': 9979.02474863895, 'use_snp_selection': True, 'num_snps': 59067, 'weight_scheme': 'linear', 'weight_clip_max': 5.0, 'weight_linear_min_weight': 0.9394726444493654, 'weight_linear_max_weight': 3.9784680583856997}. Best is trial 18 with value: 0.18857107628907152.
[I 2026-04-22 14:37:44,745] Trial 38 finished with value: 0.1634201813480686 and parameters: {'alpha': 4650297.84773027, 'use_snp_selection': False, 'weight_scheme': 'uniform', 'weight_clip_max': None}. Best is trial 18 with value: 0.18857107628907152.
[I 2026-04-22 14:40:03,265] Trial 39 finished with value: 0.175411545632915 and parameters: {'alpha': 66030.05575055802, 'use_snp_selection': True, 'num_snps': 41537, 'weight_scheme': 'exponential', 'weight_clip_max': 10.0, 'weight_exponential_beta': 7.368012541832943}. Best is trial 18 with value: 0.18857107628907152.
[I 2026-04-22 14:41:04,269] Trial 40 finished with value: 0.18433540680730198 and parameters: {'alpha': 1263338.4564381104, 'use_snp_selection': False, 'weight_scheme': 'minmax', 'weight_clip_max': None, 'weight_minmax_eps': 0.15624142129487226}. Best is trial 18 with value: 0.18857107628907152.
[I 2026-04-22 14:42:05,307] Trial 41 finished with value: 0.18850973747266953 and parameters: {'alpha': 376042.12444477726, 'use_snp_selection': False, 'weight_scheme': 'minmax', 'weight_clip_max': None, 'weight_minmax_eps': 0.19998809509209037}. Best is trial 18 with value: 0.18857107628907152.
[I 2026-04-22 14:43:06,256] Trial 42 finished with value: 0.1857553469792653 and parameters: {'alpha': 159016.35644342887, 'use_snp_selection': False, 'weight_scheme': 'minmax', 'weight_clip_max': None, 'weight_minmax_eps': 0.1836445189292705}. Best is trial 18 with value: 0.18857107628907152.
[I 2026-04-22 14:44:07,189] Trial 43 finished with value: 0.1882141554761873 and parameters: {'alpha': 269088.5891961648, 'use_snp_selection': False, 'weight_scheme': 'minmax', 'weight_clip_max': None, 'weight_minmax_eps': 0.18368422953734942}. Best is trial 18 with value: 0.18857107628907152.
[I 2026-04-22 14:45:08,069] Trial 44 finished with value: 0.15879745529284509 and parameters: {'alpha': 17950.637103786477, 'use_snp_selection': False, 'weight_scheme': 'minmax', 'weight_clip_max': None, 'weight_minmax_eps': 0.17809205203748052}. Best is trial 18 with value: 0.18857107628907152.
[I 2026-04-22 14:46:08,997] Trial 45 finished with value: 0.12240197198129735 and parameters: {'alpha': 197.3715982889226, 'use_snp_selection': False, 'weight_scheme': 'linear', 'weight_clip_max': None, 'weight_linear_min_weight': 0.5639488308298756, 'weight_linear_max_weight': 3.06210089237051}. Best is trial 18 with value: 0.18857107628907152.
[I 2026-04-22 14:47:09,917] Trial 46 finished with value: 0.18589717215401982 and parameters: {'alpha': 1055621.4816994935, 'use_snp_selection': False, 'weight_scheme': 'minmax', 'weight_clip_max': 5.0, 'weight_minmax_eps': 0.13284394816361741}. Best is trial 18 with value: 0.18857107628907152.
[I 2026-04-22 14:48:10,903] Trial 47 finished with value: 0.18130844433616264 and parameters: {'alpha': 337442.20808040316, 'use_snp_selection': False, 'weight_scheme': 'top-heavy', 'weight_clip_max': 10.0, 'weight_topheavy_top_frac': 0.25596773936852407, 'weight_topheavy_low': 1.1883727609564365, 'weight_topheavy_high': 3.7802438435361614}. Best is trial 18 with value: 0.18857107628907152.
[I 2026-04-22 14:49:51,926] Trial 48 finished with value: 0.1728493474416153 and parameters: {'alpha': 103729.34760044135, 'use_snp_selection': True, 'num_snps': 21873, 'weight_scheme': 'uniform', 'weight_clip_max': None}. Best is trial 18 with value: 0.18857107628907152.
[I 2026-04-22 14:50:52,906] Trial 49 finished with value: 0.16411425931910106 and parameters: {'alpha': 3844531.648447193, 'use_snp_selection': False, 'weight_scheme': 'exponential', 'weight_clip_max': None, 'weight_exponential_beta': 4.681337128577174}. Best is trial 18 with value: 0.18857107628907152.
[I 2026-04-22 14:51:53,847] Trial 50 finished with value: 0.18603561985809114 and parameters: {'alpha': 904605.4208408032, 'use_snp_selection': False, 'weight_scheme': 'minmax', 'weight_clip_max': None, 'weight_minmax_eps': 0.18442226550162422}. Best is trial 18 with value: 0.18857107628907152.
[I 2026-04-22 14:52:54,917] Trial 51 finished with value: 0.18848563785543224 and parameters: {'alpha': 345383.39740069356, 'use_snp_selection': False, 'weight_scheme': 'minmax', 'weight_clip_max': None, 'weight_minmax_eps': 0.19976955406563404}. Best is trial 18 with value: 0.18857107628907152.
[I 2026-04-22 14:53:56,124] Trial 52 finished with value: 0.18852468766469746 and parameters: {'alpha': 446403.7989890597, 'use_snp_selection': False, 'weight_scheme': 'minmax', 'weight_clip_max': None, 'weight_minmax_eps': 0.18835321973406147}. Best is trial 18 with value: 0.18857107628907152.
[I 2026-04-22 14:54:58,159] Trial 53 finished with value: 0.18842989398691196 and parameters: {'alpha': 436142.6357169364, 'use_snp_selection': False, 'weight_scheme': 'minmax', 'weight_clip_max': None, 'weight_minmax_eps': 0.19948000746070457}. Best is trial 18 with value: 0.18857107628907152.
[I 2026-04-22 14:55:59,628] Trial 54 finished with value: 0.18593532749000877 and parameters: {'alpha': 155996.51528407435, 'use_snp_selection': False, 'weight_scheme': 'minmax', 'weight_clip_max': None, 'weight_minmax_eps': 0.11446298925888854}. Best is trial 18 with value: 0.18857107628907152.
[I 2026-04-22 14:57:01,267] Trial 55 finished with value: 0.17667370471976665 and parameters: {'alpha': 62155.46839955284, 'use_snp_selection': False, 'weight_scheme': 'minmax', 'weight_clip_max': None, 'weight_minmax_eps': 0.15689372759063486}. Best is trial 18 with value: 0.18857107628907152.
[I 2026-04-22 14:58:02,894] Trial 56 finished with value: 0.1870402664626768 and parameters: {'alpha': 775644.4290919247, 'use_snp_selection': False, 'weight_scheme': 'minmax', 'weight_clip_max': None, 'weight_minmax_eps': 0.17080745699206684}. Best is trial 18 with value: 0.18857107628907152.
[I 2026-04-22 14:59:04,295] Trial 57 finished with value: 0.18897998148901726 and parameters: {'alpha': 447096.8654858291, 'use_snp_selection': False, 'weight_scheme': 'minmax', 'weight_clip_max': None, 'weight_minmax_eps': 0.14641506913776478}. Best is trial 57 with value: 0.18897998148901726.
[I 2026-04-22 15:00:05,626] Trial 58 finished with value: 0.1706602851252099 and parameters: {'alpha': 8445509.68147697, 'use_snp_selection': False, 'weight_scheme': 'linear', 'weight_clip_max': 10.0, 'weight_linear_min_weight': 0.7416510756815495, 'weight_linear_max_weight': 3.997067882351814}. Best is trial 57 with value: 0.18897998148901726.
[I 2026-04-22 15:01:07,098] Trial 59 finished with value: 0.17777472122592922 and parameters: {'alpha': 3029419.6628230717, 'use_snp_selection': False, 'weight_scheme': 'minmax', 'weight_clip_max': None, 'weight_minmax_eps': 0.1437410602598814}. Best is trial 57 with value: 0.18897998148901726.
[I 2026-04-22 15:02:08,496] Trial 60 finished with value: 0.12118108226704923 and parameters: {'alpha': 13.316275037142926, 'use_snp_selection': False, 'weight_scheme': 'top-heavy', 'weight_clip_max': None, 'weight_topheavy_top_frac': 0.24204858736723744, 'weight_topheavy_low': 0.8837555989122982, 'weight_topheavy_high': 3.573941540607456}. Best is trial 57 with value: 0.18897998148901726.
[I 2026-04-22 15:03:10,449] Trial 61 finished with value: 0.1884181278300881 and parameters: {'alpha': 478417.5246766711, 'use_snp_selection': False, 'weight_scheme': 'minmax', 'weight_clip_max': None, 'weight_minmax_eps': 0.18869091446765812}. Best is trial 57 with value: 0.18897998148901726.
[I 2026-04-22 15:04:11,945] Trial 62 finished with value: 0.1868035776012393 and parameters: {'alpha': 176798.1949756979, 'use_snp_selection': False, 'weight_scheme': 'minmax', 'weight_clip_max': None, 'weight_minmax_eps': 0.10319990122768417}. Best is trial 57 with value: 0.18897998148901726.
[I 2026-04-22 15:05:13,426] Trial 63 finished with value: 0.18203429129013504 and parameters: {'alpha': 1612101.1589303764, 'use_snp_selection': False, 'weight_scheme': 'minmax', 'weight_clip_max': None, 'weight_minmax_eps': 0.1894150086617045}. Best is trial 57 with value: 0.18897998148901726.
[I 2026-04-22 15:06:14,987] Trial 64 finished with value: 0.1884936105552174 and parameters: {'alpha': 451611.18763564946, 'use_snp_selection': False, 'weight_scheme': 'minmax', 'weight_clip_max': None, 'weight_minmax_eps': 0.18982273326880297}. Best is trial 57 with value: 0.18897998148901726.
[I 2026-04-22 15:07:16,477] Trial 65 finished with value: 0.18739901576166884 and parameters: {'alpha': 756642.0767433321, 'use_snp_selection': False, 'weight_scheme': 'minmax', 'weight_clip_max': None, 'weight_minmax_eps': 0.15368295556317935}. Best is trial 57 with value: 0.18897998148901726.
[I 2026-04-22 15:08:06,437] Trial 66 finished with value: 0.17570653500894923 and parameters: {'alpha': 457795.0921675107, 'use_snp_selection': False, 'weight_scheme': 'uniform', 'weight_clip_max': None}. Best is trial 57 with value: 0.18897998148901726.
[I 2026-04-22 15:09:40,705] Trial 67 finished with value: 0.17440148333803746 and parameters: {'alpha': 46373.87427076128, 'use_snp_selection': True, 'num_snps': 15404, 'weight_scheme': 'minmax', 'weight_clip_max': 5.0, 'weight_minmax_eps': 0.024800709732303625}. Best is trial 57 with value: 0.18897998148901726.
[I 2026-04-22 15:10:41,645] Trial 68 finished with value: 0.18132489518211706 and parameters: {'alpha': 116127.7871214266, 'use_snp_selection': False, 'weight_scheme': 'exponential', 'weight_clip_max': None, 'weight_exponential_beta': 4.379608755567791}. Best is trial 57 with value: 0.18897998148901726.
[I 2026-04-22 15:11:42,594] Trial 69 finished with value: 0.1785182779406465 and parameters: {'alpha': 2610150.7116013947, 'use_snp_selection': False, 'weight_scheme': 'minmax', 'weight_clip_max': None, 'weight_minmax_eps': 0.1740483201244272}. Best is trial 57 with value: 0.18897998148901726.
