[I 2026-04-18 13:54:53,217] Trial 2 finished with value: 0.10317463359063042 and parameters: {'hidden_dims': '[512, 128]', 'dropout': 0.2736730891340176, 'batch_norm': True, 'lr': 7.298114623433994e-05, 'weight_decay': 5.6346010385734023e-08, 'epochs': 185, 'loss': 'mae', 'optimizer': 'sgd', 'use_snp_selection': True, 'num_snps': 14091, 'weight_scheme': 'minmax', 'weight_clip_max': 10.0, 'weight_minmax_eps': 0.045780660776687306}. Best is trial 1 with value: 0.17883567194342959.
[I 2026-04-18 13:55:35,956] Trial 3 finished with value: 0.10511665404536366 and parameters: {'hidden_dims': '[512, 64]', 'dropout': 0.30157795416637295, 'batch_norm': False, 'lr': 2.007492282795256e-05, 'weight_decay': 5.496446859789657e-06, 'epochs': 284, 'loss': 'mse', 'optimizer': 'sgd', 'use_snp_selection': False, 'weight_scheme': 'linear', 'weight_clip_max': None, 'weight_linear_min_weight': 0.24682154527102826, 'weight_linear_max_weight': 1.8338910783134623}. Best is trial 1 with value: 0.16246195333308883.
[I 2026-04-18 13:56:02,695] Trial 4 finished with value: 0.19255504220164643 and parameters: {'hidden_dims': '[256, 64]', 'dropout': 0.18128694708490736, 'batch_norm': False, 'lr': 8.951826748007403e-05, 'weight_decay': 2.1781541495465197e-07, 'epochs': 147, 'loss': 'mse', 'optimizer': 'sgd', 'use_snp_selection': False, 'weight_scheme': 'top-heavy', 'weight_clip_max': 5.0, 'weight_topheavy_top_frac': 0.1724888194073277, 'weight_topheavy_low': 1.1620865802171172, 'weight_topheavy_high': 3.476906528073177}. Best is trial 4 with value: 0.19255504220164643.
[I 2026-04-18 13:56:22,827] Trial 3 finished with value: 0.11234908280491598 and parameters: {'hidden_dims': '[512, 64]', 'dropout': 0.30157795416637295, 'batch_norm': False, 'lr': 2.007492282795256e-05, 'weight_decay': 5.496446859789657e-06, 'epochs': 284, 'loss': 'mse', 'optimizer': 'sgd', 'use_snp_selection': False, 'weight_scheme': 'linear', 'weight_clip_max': None, 'weight_linear_min_weight': 0.24682154527102826, 'weight_linear_max_weight': 1.8338910783134623}. Best is trial 1 with value: 0.17883567194342959.
[I 2026-04-18 13:56:25,336] Trial 5 finished with value: 0.12577075932845183 and parameters: {'hidden_dims': '[256, 64]', 'dropout': 0.2571412946970998, 'batch_norm': True, 'lr': 3.546238022482882e-05, 'weight_decay': 1.0185234767613396e-06, 'epochs': 119, 'loss': 'mse', 'optimizer': 'sgd', 'use_snp_selection': False, 'weight_scheme': 'linear', 'weight_clip_max': 10.0, 'weight_linear_min_weight': 0.9405832045183805, 'weight_linear_max_weight': 3.413610925325811}. Best is trial 4 with value: 0.19255504220164643.
[I 2026-04-18 13:56:49,797] Trial 4 finished with value: 0.1854286321283784 and parameters: {'hidden_dims': '[256, 64]', 'dropout': 0.18128694708490736, 'batch_norm': False, 'lr': 8.951826748007403e-05, 'weight_decay': 2.1781541495465197e-07, 'epochs': 147, 'loss': 'mse', 'optimizer': 'sgd', 'use_snp_selection': False, 'weight_scheme': 'top-heavy', 'weight_clip_max': 5.0, 'weight_topheavy_top_frac': 0.1724888194073277, 'weight_topheavy_low': 1.1620865802171172, 'weight_topheavy_high': 3.476906528073177}. Best is trial 4 with value: 0.1854286321283784.
[I 2026-04-18 13:57:07,913] Trial 6 finished with value: 0.23880690817170472 and parameters: {'hidden_dims': '[256, 64]', 'dropout': 0.037961443806696214, 'batch_norm': True, 'lr': 3.644202049829694e-05, 'weight_decay': 9.73334309820277e-06, 'epochs': 243, 'loss': 'mae', 'optimizer': 'adam', 'use_snp_selection': False, 'weight_scheme': 'minmax', 'weight_clip_max': None, 'weight_minmax_eps': 0.08689611239934374}. Best is trial 6 with value: 0.23880690817170472.
[I 2026-04-18 13:57:12,865] Trial 5 finished with value: 0.1140614798939514 and parameters: {'hidden_dims': '[256, 64]', 'dropout': 0.2571412946970998, 'batch_norm': True, 'lr': 3.546238022482882e-05, 'weight_decay': 1.0185234767613396e-06, 'epochs': 119, 'loss': 'mse', 'optimizer': 'sgd', 'use_snp_selection': False, 'weight_scheme': 'linear', 'weight_clip_max': 10.0, 'weight_linear_min_weight': 0.9405832045183805, 'weight_linear_max_weight': 3.413610925325811}. Best is trial 4 with value: 0.1854286321283784.
[I 2026-04-18 13:57:55,954] Trial 6 finished with value: 0.22608653695842693 and parameters: {'hidden_dims': '[256, 64]', 'dropout': 0.037961443806696214, 'batch_norm': True, 'lr': 3.644202049829694e-05, 'weight_decay': 9.73334309820277e-06, 'epochs': 243, 'loss': 'mae', 'optimizer': 'adam', 'use_snp_selection': False, 'weight_scheme': 'minmax', 'weight_clip_max': None, 'weight_minmax_eps': 0.08689611239934374}. Best is trial 6 with value: 0.22608653695842693.
[I 2026-04-18 13:58:32,783] Trial 7 finished with value: 0.05275161028041679 and parameters: {'hidden_dims': '[512, 128]', 'dropout': 0.1304538168539244, 'batch_norm': False, 'lr': 1.5408060926311233e-05, 'weight_decay': 2.1989735568314356e-08, 'epochs': 250, 'loss': 'mse', 'optimizer': 'sgd', 'use_snp_selection': True, 'num_snps': 42550, 'weight_scheme': 'exponential', 'weight_clip_max': 10.0, 'weight_exponential_beta': 2.758850226029358}. Best is trial 6 with value: 0.23880690817170472.
[I 2026-04-18 13:59:13,483] Trial 8 finished with value: 0.23376591575756156 and parameters: {'hidden_dims': '[256, 128]', 'dropout': 0.05742396906738376, 'batch_norm': False, 'lr': 1.9761509510575143e-06, 'weight_decay': 2.933492239224291e-07, 'epochs': 82, 'loss': 'mae', 'optimizer': 'adam', 'use_snp_selection': True, 'num_snps': 29883, 'weight_scheme': 'minmax', 'weight_clip_max': 5.0, 'weight_minmax_eps': 0.0051288771726799584}. Best is trial 6 with value: 0.23880690817170472.
[I 2026-04-18 13:59:23,035] Trial 7 finished with value: 0.12184092493563506 and parameters: {'hidden_dims': '[512, 128]', 'dropout': 0.1304538168539244, 'batch_norm': False, 'lr': 1.5408060926311233e-05, 'weight_decay': 2.1989735568314356e-08, 'epochs': 250, 'loss': 'mse', 'optimizer': 'sgd', 'use_snp_selection': True, 'num_snps': 42550, 'weight_scheme': 'exponential', 'weight_clip_max': 10.0, 'weight_exponential_beta': 2.758850226029358}. Best is trial 6 with value: 0.22608653695842693.
[I 2026-04-18 14:00:04,865] Trial 8 finished with value: 0.1953821973760321 and parameters: {'hidden_dims': '[256, 128]', 'dropout': 0.05742396906738376, 'batch_norm': False, 'lr': 1.9761509510575143e-06, 'weight_decay': 2.933492239224291e-07, 'epochs': 82, 'loss': 'mae', 'optimizer': 'adam', 'use_snp_selection': True, 'num_snps': 29883, 'weight_scheme': 'minmax', 'weight_clip_max': 5.0, 'weight_minmax_eps': 0.0051288771726799584}. Best is trial 6 with value: 0.22608653695842693.
[I 2026-04-18 14:00:05,734] Trial 9 finished with value: 0.2288823858576338 and parameters: {'hidden_dims': '[256, 128]', 'dropout': 0.5795930447285386, 'batch_norm': False, 'lr': 0.00011782025260263196, 'weight_decay': 0.0005562063174273634, 'epochs': 218, 'loss': 'mae', 'optimizer': 'adamw', 'use_snp_selection': True, 'num_snps': 32226, 'weight_scheme': 'minmax', 'weight_clip_max': 5.0, 'weight_minmax_eps': 0.09600289105543994}. Best is trial 6 with value: 0.23880690817170472.
[I 2026-04-18 14:00:57,760] Trial 9 finished with value: 0.23523436147154436 and parameters: {'hidden_dims': '[256, 128]', 'dropout': 0.5795930447285386, 'batch_norm': False, 'lr': 0.00011782025260263196, 'weight_decay': 0.0005562063174273634, 'epochs': 218, 'loss': 'mae', 'optimizer': 'adamw', 'use_snp_selection': True, 'num_snps': 32226, 'weight_scheme': 'minmax', 'weight_clip_max': 5.0, 'weight_minmax_eps': 0.09600289105543994}. Best is trial 9 with value: 0.23523436147154436.
[I 2026-04-18 14:01:39,967] Trial 10 finished with value: 0.24330979487980864 and parameters: {'hidden_dims': '[512, 64]', 'dropout': 0.4338375928678635, 'batch_norm': True, 'lr': 0.0009667920285641304, 'weight_decay': 6.976468597792388e-05, 'epochs': 294, 'loss': 'mae', 'optimizer': 'adam', 'use_snp_selection': False, 'weight_scheme': 'uniform', 'weight_clip_max': None}. Best is trial 10 with value: 0.24330979487980864.
[I 2026-04-18 14:02:04,966] Trial 10 finished with value: 0.0 and parameters: {'hidden_dims': '[256, 128]', 'dropout': 0.5982265091674299, 'batch_norm': False, 'lr': 0.0009667920285641304, 'weight_decay': 0.0007065067205778983, 'epochs': 203, 'loss': 'mae', 'optimizer': 'adamw', 'use_snp_selection': True, 'num_snps': 54689, 'weight_scheme': 'uniform', 'weight_clip_max': 5.0}. Best is trial 9 with value: 0.23523436147154436.
[I 2026-04-18 14:03:13,020] Trial 11 finished with value: 0.24037990496063716 and parameters: {'hidden_dims': '[512, 64]', 'dropout': 0.4516805843717058, 'batch_norm': True, 'lr': 0.0009928478748470076, 'weight_decay': 5.547084226283487e-05, 'epochs': 290, 'loss': 'mae', 'optimizer': 'adam', 'use_snp_selection': False, 'weight_scheme': 'uniform', 'weight_clip_max': None}. Best is trial 10 with value: 0.24330979487980864.
[I 2026-04-18 14:03:21,188] Trial 11 finished with value: 0.21766698819953995 and parameters: {'hidden_dims': '[512, 64]', 'dropout': 0.48179236930737634, 'batch_norm': True, 'lr': 0.0003590005130816133, 'weight_decay': 0.0004864760243946446, 'epochs': 231, 'loss': 'mae', 'optimizer': 'adam', 'use_snp_selection': False, 'weight_scheme': 'minmax', 'weight_clip_max': None, 'weight_minmax_eps': 0.09687781180927992}. Best is trial 9 with value: 0.23523436147154436.
[I 2026-04-18 14:04:13,193] Trial 12 finished with value: 0.2430259798767347 and parameters: {'hidden_dims': '[256, 64]', 'dropout': 0.4270113821844665, 'batch_norm': True, 'lr': 3.7845926154118877e-06, 'weight_decay': 5.752278551765894e-05, 'epochs': 300, 'loss': 'mae', 'optimizer': 'adamw', 'use_snp_selection': False, 'weight_scheme': 'minmax', 'weight_clip_max': None, 'weight_minmax_eps': 0.09627310711891753}. Best is trial 12 with value: 0.2430259798767347.
[I 2026-04-18 14:04:46,757] Trial 13 finished with value: 0.20204140177634117 and parameters: {'hidden_dims': '[256, 128]', 'dropout': 0.4414464212842517, 'batch_norm': False, 'lr': 4.392786235718156e-06, 'weight_decay': 5.5957031840961935e-05, 'epochs': 269, 'loss': 'mae', 'optimizer': 'adamw', 'use_snp_selection': True, 'num_snps': 7358, 'weight_scheme': 'top-heavy', 'weight_clip_max': None, 'weight_topheavy_top_frac': 0.48398486394237283, 'weight_topheavy_low': 0.5666436580870186, 'weight_topheavy_high': 5.961546164133656}. Best is trial 12 with value: 0.2430259798767347.
[I 2026-04-18 14:04:48,497] Trial 12 finished with value: 0.24107558056411152 and parameters: {'hidden_dims': '[512, 64]', 'dropout': 0.4444937594410006, 'batch_norm': True, 'lr': 0.0009303372228740359, 'weight_decay': 0.0001742399725238446, 'epochs': 298, 'loss': 'mae', 'optimizer': 'adam', 'use_snp_selection': False, 'weight_scheme': 'uniform', 'weight_clip_max': None}. Best is trial 10 with value: 0.24330979487980864.
[I 2026-04-18 14:05:38,024] Trial 14 finished with value: 0.1771189556430098 and parameters: {'hidden_dims': '[256, 64]', 'dropout': 0.5945075742976721, 'batch_norm': True, 'lr': 1.0478194488285765e-06, 'weight_decay': 0.00010625064958282123, 'epochs': 297, 'loss': 'mae', 'optimizer': 'adamw', 'use_snp_selection': False, 'weight_scheme': 'exponential', 'weight_clip_max': 5.0, 'weight_exponential_beta': 6.512744308642654}. Best is trial 12 with value: 0.2430259798767347.
[I 2026-04-18 14:06:24,618] Trial 13 finished with value: 0.23723803314422817 and parameters: {'hidden_dims': '[512, 64]', 'dropout': 0.42933380764659934, 'batch_norm': True, 'lr': 0.0009640000854205, 'weight_decay': 0.0006749750917295526, 'epochs': 300, 'loss': 'mae', 'optimizer': 'adam', 'use_snp_selection': False, 'weight_scheme': 'uniform', 'weight_clip_max': None}. Best is trial 10 with value: 0.24330979487980864.
[I 2026-04-18 14:06:38,559] Trial 15 finished with value: 0.2548995404422824 and parameters: {'hidden_dims': '[256, 128]', 'dropout': 0.45211926803775504, 'batch_norm': False, 'lr': 5.462077788863865e-06, 'weight_decay': 0.00015571205929942576, 'epochs': 207, 'loss': 'mae', 'optimizer': 'adamw', 'use_snp_selection': True, 'num_snps': 44135, 'weight_scheme': 'uniform', 'weight_clip_max': None}. Best is trial 15 with value: 0.2548995404422824.
[I 2026-04-18 14:07:00,384] Trial 16 finished with value: 0.18618230316215284 and parameters: {'hidden_dims': '[512, 128]', 'dropout': 0.3981221573736238, 'batch_norm': True, 'lr': 4.49543761117991e-06, 'weight_decay': 1.9977362151781117e-05, 'epochs': 53, 'loss': 'mae', 'optimizer': 'adamw', 'use_snp_selection': False, 'weight_scheme': 'uniform', 'weight_clip_max': None}. Best is trial 15 with value: 0.2548995404422824.
[I 2026-04-18 14:07:44,970] Trial 14 finished with value: 0.23656692698272566 and parameters: {'hidden_dims': '[512, 64]', 'dropout': 0.4328311199460203, 'batch_norm': True, 'lr': 0.0003803384436947449, 'weight_decay': 0.0001072913254870465, 'epochs': 248, 'loss': 'mae', 'optimizer': 'adam', 'use_snp_selection': False, 'weight_scheme': 'uniform', 'weight_clip_max': None}. Best is trial 10 with value: 0.24330979487980864.
[I 2026-04-18 14:08:31,048] Trial 17 finished with value: 0.25647430679676864 and parameters: {'hidden_dims': '[512, 64]', 'dropout': 0.3766614352502795, 'batch_norm': False, 'lr': 5.493455815750079e-06, 'weight_decay': 0.00015106818573642851, 'epochs': 178, 'loss': 'mae', 'optimizer': 'adamw', 'use_snp_selection': True, 'num_snps': 59755, 'weight_scheme': 'uniform', 'weight_clip_max': None}. Best is trial 17 with value: 0.25647430679676864.
[I 2026-04-18 14:08:52,162] Trial 15 finished with value: 0.24366939964801757 and parameters: {'hidden_dims': '[512, 64]', 'dropout': 0.5486864395572766, 'batch_norm': True, 'lr': 0.0003583493834580348, 'weight_decay': 0.00016549842378096877, 'epochs': 205, 'loss': 'mae', 'optimizer': 'adamw', 'use_snp_selection': False, 'weight_scheme': 'uniform', 'weight_clip_max': None}. Best is trial 15 with value: 0.24366939964801757.
[I 2026-04-18 14:09:57,865] Trial 18 finished with value: 0.2470580628309814 and parameters: {'hidden_dims': '[512, 64]', 'dropout': 0.3606739954762437, 'batch_norm': False, 'lr': 1.060702883292142e-05, 'weight_decay': 0.0002116487950836202, 'epochs': 169, 'loss': 'mae', 'optimizer': 'adamw', 'use_snp_selection': True, 'num_snps': 58281, 'weight_scheme': 'uniform', 'weight_clip_max': None}. Best is trial 17 with value: 0.25647430679676864.
[I 2026-04-18 14:09:57,874] Trial 16 finished with value: 0.2352479531909352 and parameters: {'hidden_dims': '[512, 64]', 'dropout': 0.5901532327251294, 'batch_norm': True, 'lr': 0.0003197162818221312, 'weight_decay': 1.8333884709695134e-05, 'epochs': 200, 'loss': 'mae', 'optimizer': 'adamw', 'use_snp_selection': False, 'weight_scheme': 'uniform', 'weight_clip_max': None}. Best is trial 15 with value: 0.24366939964801757.
[I 2026-04-18 14:10:20,903] Trial 17 finished with value: 0.21238646821991644 and parameters: {'hidden_dims': '[512, 64]', 'dropout': 0.5203123209051908, 'batch_norm': True, 'lr': 0.0003185267250801042, 'weight_decay': 0.00021171278842874235, 'epochs': 58, 'loss': 'mae', 'optimizer': 'adamw', 'use_snp_selection': False, 'weight_scheme': 'top-heavy', 'weight_clip_max': None, 'weight_topheavy_top_frac': 0.4797339435528436, 'weight_topheavy_low': 0.5377307466599707, 'weight_topheavy_high': 5.889503437003148}. Best is trial 15 with value: 0.24366939964801757.
[I 2026-04-18 14:11:17,626] Trial 19 finished with value: 0.24329144948486353 and parameters: {'hidden_dims': '[512, 64]', 'dropout': 0.5305101802663821, 'batch_norm': False, 'lr': 1.8865418145487576e-06, 'weight_decay': 1.1001541779363816e-06, 'epochs': 191, 'loss': 'mae', 'optimizer': 'adamw', 'use_snp_selection': True, 'num_snps': 46505, 'weight_scheme': 'uniform', 'weight_clip_max': None}. Best is trial 17 with value: 0.25647430679676864.
[I 2026-04-18 14:11:32,427] Trial 18 finished with value: 0.19365594293731161 and parameters: {'hidden_dims': '[512, 64]', 'dropout': 0.35355959567605255, 'batch_norm': True, 'lr': 0.0004782736813299778, 'weight_decay': 2.48818367879602e-05, 'epochs': 219, 'loss': 'mae', 'optimizer': 'adamw', 'use_snp_selection': False, 'weight_scheme': 'exponential', 'weight_clip_max': None, 'weight_exponential_beta': 7.4215849993730245}. Best is trial 15 with value: 0.24366939964801757.
[I 2026-04-18 14:12:25,020] Trial 20 finished with value: 0.24915986409976418 and parameters: {'hidden_dims': '[512, 64]', 'dropout': 0.4972587668673179, 'batch_norm': False, 'lr': 7.860788233218338e-06, 'weight_decay': 2.0491524511833767e-05, 'epochs': 133, 'loss': 'mae', 'optimizer': 'adamw', 'use_snp_selection': True, 'num_snps': 44827, 'weight_scheme': 'uniform', 'weight_clip_max': None}. Best is trial 17 with value: 0.25647430679676864.
[I 2026-04-18 14:12:57,820] Trial 19 finished with value: 0.2470670029495004 and parameters: {'hidden_dims': '[512, 128]', 'dropout': 0.5115472202364015, 'batch_norm': True, 'lr': 2.2597292210017662e-06, 'weight_decay': 0.0003262469190574229, 'epochs': 265, 'loss': 'mae', 'optimizer': 'adamw', 'use_snp_selection': False, 'weight_scheme': 'uniform', 'weight_clip_max': 10.0}. Best is trial 19 with value: 0.2470670029495004.
[I 2026-04-18 14:13:31,974] Trial 21 finished with value: 0.2567965864302793 and parameters: {'hidden_dims': '[512, 64]', 'dropout': 0.5029305421337948, 'batch_norm': False, 'lr': 7.040236847638778e-06, 'weight_decay': 1.57759699667849e-05, 'epochs': 131, 'loss': 'mae', 'optimizer': 'adamw', 'use_snp_selection': True, 'num_snps': 44688, 'weight_scheme': 'uniform', 'weight_clip_max': None}. Best is trial 21 with value: 0.2567965864302793.
[I 2026-04-18 14:14:22,111] Trial 20 finished with value: 0.16998452114879894 and parameters: {'hidden_dims': '[512, 128]', 'dropout': 0.5253075776738049, 'batch_norm': True, 'lr': 1.3893045506654246e-06, 'weight_decay': 0.0009865562249192304, 'epochs': 261, 'loss': 'mae', 'optimizer': 'adamw', 'use_snp_selection': False, 'weight_scheme': 'uniform', 'weight_clip_max': 10.0}. Best is trial 19 with value: 0.2470670029495004.
[I 2026-04-18 14:14:48,550] Trial 22 finished with value: 0.2541563634937519 and parameters: {'hidden_dims': '[512, 64]', 'dropout': 0.3351466627095841, 'batch_norm': False, 'lr': 2.9754410870754897e-06, 'weight_decay': 0.00020960015816455133, 'epochs': 158, 'loss': 'mae', 'optimizer': 'adamw', 'use_snp_selection': True, 'num_snps': 49769, 'weight_scheme': 'uniform', 'weight_clip_max': None}. Best is trial 21 with value: 0.2567965864302793.
[I 2026-04-18 14:15:49,686] Trial 21 finished with value: 0.2285480571459652 and parameters: {'hidden_dims': '[512, 128]', 'dropout': 0.5226230844736613, 'batch_norm': True, 'lr': 3.965045728378732e-06, 'weight_decay': 0.00022555804642007988, 'epochs': 272, 'loss': 'mae', 'optimizer': 'adamw', 'use_snp_selection': False, 'weight_scheme': 'uniform', 'weight_clip_max': 10.0}. Best is trial 19 with value: 0.2470670029495004.
[I 2026-04-18 14:16:01,931] Trial 23 finished with value: 0.24043619530022586 and parameters: {'hidden_dims': '[512, 64]', 'dropout': 0.39165226125461533, 'batch_norm': False, 'lr': 6.24129833721919e-06, 'weight_decay': 2.3200704378163687e-05, 'epochs': 205, 'loss': 'mae', 'optimizer': 'adamw', 'use_snp_selection': True, 'num_snps': 38066, 'weight_scheme': 'uniform', 'weight_clip_max': None}. Best is trial 21 with value: 0.2567965864302793.
[I 2026-04-18 14:17:02,520] Trial 22 finished with value: 0.22866180128917418 and parameters: {'hidden_dims': '[512, 128]', 'dropout': 0.37010727601522003, 'batch_norm': True, 'lr': 5.583009282971966e-06, 'weight_decay': 6.2985509760851e-05, 'epochs': 223, 'loss': 'mae', 'optimizer': 'adamw', 'use_snp_selection': False, 'weight_scheme': 'uniform', 'weight_clip_max': 10.0}. Best is trial 19 with value: 0.2470670029495004.
[I 2026-04-18 14:17:14,075] Trial 24 finished with value: 0.2738436418206443 and parameters: {'hidden_dims': '[512, 64]', 'dropout': 0.4707159012349661, 'batch_norm': False, 'lr': 1.9184075588862502e-05, 'weight_decay': 0.00018306602764629155, 'epochs': 104, 'loss': 'mae', 'optimizer': 'adamw', 'use_snp_selection': True, 'num_snps': 59309, 'weight_scheme': 'uniform', 'weight_clip_max': None}. Best is trial 24 with value: 0.2738436418206443.
[I 2026-04-18 14:17:58,664] Trial 23 finished with value: 0.24359554000316494 and parameters: {'hidden_dims': '[512, 128]', 'dropout': 0.498242538728111, 'batch_norm': True, 'lr': 0.0001762556656245529, 'weight_decay': 1.4285240858432287e-06, 'epochs': 168, 'loss': 'mae', 'optimizer': 'adamw', 'use_snp_selection': False, 'weight_scheme': 'uniform', 'weight_clip_max': 10.0}. Best is trial 19 with value: 0.2470670029495004.
[I 2026-04-18 14:18:21,038] Trial 25 finished with value: 0.26188896154411245 and parameters: {'hidden_dims': '[512, 64]', 'dropout': 0.5316522904052581, 'batch_norm': False, 'lr': 2.266522681181932e-05, 'weight_decay': 2.0625863123735435e-06, 'epochs': 88, 'loss': 'mae', 'optimizer': 'adamw', 'use_snp_selection': True, 'num_snps': 57464, 'weight_scheme': 'uniform', 'weight_clip_max': 10.0}. Best is trial 24 with value: 0.2738436418206443.
[I 2026-04-18 14:18:52,373] Trial 24 finished with value: 0.2472374754752887 and parameters: {'hidden_dims': '[512, 128]', 'dropout': 0.49233242035101793, 'batch_norm': True, 'lr': 0.000202857430800567, 'weight_decay': 1.2517779442526279e-06, 'epochs': 160, 'loss': 'mae', 'optimizer': 'adamw', 'use_snp_selection': False, 'weight_scheme': 'uniform', 'weight_clip_max': 10.0}. Best is trial 24 with value: 0.2472374754752887.
[I 2026-04-18 14:19:25,053] Trial 26 finished with value: 0.26436512087466574 and parameters: {'hidden_dims': '[512, 64]', 'dropout': 0.5305133425302259, 'batch_norm': False, 'lr': 2.1098521325249524e-05, 'weight_decay': 1.2423402127681288e-06, 'epochs': 89, 'loss': 'mae', 'optimizer': 'adam', 'use_snp_selection': True, 'num_snps': 52536, 'weight_scheme': 'uniform', 'weight_clip_max': 10.0}. Best is trial 24 with value: 0.2738436418206443.
