Running from this directory: /cluster/work/simennes/Master_thesis
Name of job: ncv_ridge_avggrm
ID of job: 24332639
Array task ID: 7
The job was run on these nodes: idun-03-24
[I 2026-04-22 13:51:06,120] Trial 0 finished with value: 0.1733147326441928 and parameters: {'alpha': 12124.394605078569, 'use_snp_selection': True, 'num_snps': 5442, 'weight_scheme': 'linear', 'weight_clip_max': 5.0, 'weight_linear_min_weight': 0.5849999641604302, 'weight_linear_max_weight': 1.017621356653175}. Best is trial 0 with value: 0.1733147326441928.
[I 2026-04-22 13:52:41,639] Trial 1 finished with value: 0.17293765563005953 and parameters: {'alpha': 109374.19486700959, 'use_snp_selection': True, 'num_snps': 25583, 'weight_scheme': 'minmax', 'weight_clip_max': 5.0, 'weight_minmax_eps': 0.14026014881292506}. Best is trial 0 with value: 0.1733147326441928.
[I 2026-04-22 13:54:58,195] Trial 2 finished with value: 0.17113635853826545 and parameters: {'alpha': 87498.4492964452, 'use_snp_selection': True, 'num_snps': 53815, 'weight_scheme': 'linear', 'weight_clip_max': 5.0, 'weight_linear_min_weight': 0.27089068881512934, 'weight_linear_max_weight': 2.0548794162981476}. Best is trial 0 with value: 0.1733147326441928.
[I 2026-04-22 13:55:53,121] Trial 3 finished with value: 0.17536894167527164 and parameters: {'alpha': 194477.78458557956, 'use_snp_selection': False, 'weight_scheme': 'linear', 'weight_clip_max': None, 'weight_linear_min_weight': 0.21922985165550554, 'weight_linear_max_weight': 1.6260435767424388}. Best is trial 3 with value: 0.17536894167527164.
[I 2026-04-22 13:56:48,028] Trial 4 finished with value: 0.16481183123360696 and parameters: {'alpha': 9421665.195468841, 'use_snp_selection': False, 'weight_scheme': 'minmax', 'weight_clip_max': 5.0, 'weight_minmax_eps': 0.030689801852077123}. Best is trial 3 with value: 0.17536894167527164.
[I 2026-04-22 13:57:59,349] Trial 5 finished with value: 0.14114917624259668 and parameters: {'alpha': 5024.251153421461, 'use_snp_selection': True, 'num_snps': 9046, 'weight_scheme': 'top-heavy', 'weight_clip_max': 10.0, 'weight_topheavy_top_frac': 0.08738114702774886, 'weight_topheavy_low': 0.8991910356358707, 'weight_topheavy_high': 2.2968843007908903}. Best is trial 3 with value: 0.17536894167527164.
[I 2026-04-22 13:58:44,562] Trial 6 finished with value: 0.1262658015527627 and parameters: {'alpha': 16.382429914774185, 'use_snp_selection': False, 'weight_scheme': 'uniform', 'weight_clip_max': 10.0}. Best is trial 3 with value: 0.17536894167527164.
[I 2026-04-22 14:00:51,605] Trial 7 finished with value: 0.1729162931806296 and parameters: {'alpha': 94169.1049689093, 'use_snp_selection': True, 'num_snps': 47654, 'weight_scheme': 'exponential', 'weight_clip_max': 10.0, 'weight_exponential_beta': 2.3870207999558124}. Best is trial 3 with value: 0.17536894167527164.
[I 2026-04-22 14:01:57,634] Trial 8 finished with value: 0.08261460084944239 and parameters: {'alpha': 96.38034897458088, 'use_snp_selection': True, 'num_snps': 5388, 'weight_scheme': 'minmax', 'weight_clip_max': None, 'weight_minmax_eps': 0.07791532902904205}. Best is trial 3 with value: 0.17536894167527164.
[I 2026-04-22 14:02:52,266] Trial 9 finished with value: 0.16278570889710234 and parameters: {'alpha': 2700506.792350819, 'use_snp_selection': False, 'weight_scheme': 'linear', 'weight_clip_max': 5.0, 'weight_linear_min_weight': 0.8693390069349902, 'weight_linear_max_weight': 2.1394245284712112}. Best is trial 3 with value: 0.17536894167527164.
[I 2026-04-22 14:03:37,754] Trial 10 finished with value: 0.1292808598502984 and parameters: {'alpha': 859.5702697532038, 'use_snp_selection': False, 'weight_scheme': 'uniform', 'weight_clip_max': None}. Best is trial 3 with value: 0.17536894167527164.
[I 2026-04-22 14:04:32,660] Trial 11 finished with value: 0.14247981565460882 and parameters: {'alpha': 7964.448184189758, 'use_snp_selection': False, 'weight_scheme': 'linear', 'weight_clip_max': None, 'weight_linear_min_weight': 0.49928669268146664, 'weight_linear_max_weight': 1.0852050072311035}. Best is trial 3 with value: 0.17536894167527164.
[I 2026-04-22 14:06:13,635] Trial 12 finished with value: 0.170574293700358 and parameters: {'alpha': 774371.0299413771, 'use_snp_selection': True, 'num_snps': 28155, 'weight_scheme': 'linear', 'weight_clip_max': None, 'weight_linear_min_weight': 0.12190587904068445, 'weight_linear_max_weight': 1.0095056466222279}. Best is trial 3 with value: 0.17536894167527164.
[I 2026-04-22 14:07:08,559] Trial 13 finished with value: 0.13010751938319254 and parameters: {'alpha': 1024.8612833019015, 'use_snp_selection': False, 'weight_scheme': 'linear', 'weight_clip_max': 5.0, 'weight_linear_min_weight': 0.5864614997435256, 'weight_linear_max_weight': 3.446574617306518}. Best is trial 3 with value: 0.17536894167527164.
[I 2026-04-22 14:08:32,529] Trial 14 finished with value: 0.15768343931426704 and parameters: {'alpha': 237259.74082206105, 'use_snp_selection': True, 'num_snps': 16689, 'weight_scheme': 'exponential', 'weight_clip_max': None, 'weight_exponential_beta': 7.946345899724217}. Best is trial 3 with value: 0.17536894167527164.
[I 2026-04-22 14:09:27,591] Trial 15 finished with value: 0.15091031035766972 and parameters: {'alpha': 19630.331529149233, 'use_snp_selection': False, 'weight_scheme': 'top-heavy', 'weight_clip_max': 5.0, 'weight_topheavy_top_frac': 0.44494734039210965, 'weight_topheavy_low': 0.5041038070788557, 'weight_topheavy_high': 5.991313146001774}. Best is trial 3 with value: 0.17536894167527164.
[I 2026-04-22 14:10:22,577] Trial 16 finished with value: 0.15263064082834712 and parameters: {'alpha': 20829.351294398723, 'use_snp_selection': False, 'weight_scheme': 'linear', 'weight_clip_max': None, 'weight_linear_min_weight': 0.547089501445288, 'weight_linear_max_weight': 1.6059434205144663}. Best is trial 3 with value: 0.17536894167527164.
[I 2026-04-22 14:12:21,698] Trial 17 finished with value: 0.1273918295133626 and parameters: {'alpha': 1372.558621803536, 'use_snp_selection': True, 'num_snps': 40569, 'weight_scheme': 'linear', 'weight_clip_max': None, 'weight_linear_min_weight': 0.3975232325062984, 'weight_linear_max_weight': 2.789042418423373}. Best is trial 3 with value: 0.17536894167527164.
[I 2026-04-22 14:13:48,562] Trial 18 finished with value: 0.15648413609613832 and parameters: {'alpha': 675321.318521562, 'use_snp_selection': True, 'num_snps': 18635, 'weight_scheme': 'linear', 'weight_clip_max': 5.0, 'weight_linear_min_weight': 0.7731039391805046, 'weight_linear_max_weight': 1.581406165805288}. Best is trial 3 with value: 0.17536894167527164.
[I 2026-04-22 14:14:43,569] Trial 19 finished with value: 0.12700526365271617 and parameters: {'alpha': 203.99897811911615, 'use_snp_selection': False, 'weight_scheme': 'exponential', 'weight_clip_max': 10.0, 'weight_exponential_beta': 0.20426468913900786}. Best is trial 3 with value: 0.17536894167527164.
[I 2026-04-22 14:15:38,371] Trial 20 finished with value: 0.15748090591338848 and parameters: {'alpha': 39840.368108815244, 'use_snp_selection': False, 'weight_scheme': 'top-heavy', 'weight_clip_max': None, 'weight_topheavy_top_frac': 0.06720640151226995, 'weight_topheavy_low': 1.143359482515616, 'weight_topheavy_high': 4.81447333255307}. Best is trial 3 with value: 0.17536894167527164.
[I 2026-04-22 14:17:22,805] Trial 21 finished with value: 0.17402057696366416 and parameters: {'alpha': 263385.2911355607, 'use_snp_selection': True, 'num_snps': 30563, 'weight_scheme': 'minmax', 'weight_clip_max': 5.0, 'weight_minmax_eps': 0.19466268406437814}. Best is trial 3 with value: 0.17536894167527164.
[I 2026-04-22 14:19:15,041] Trial 22 finished with value: 0.17338134674967168 and parameters: {'alpha': 569270.0149755138, 'use_snp_selection': True, 'num_snps': 36032, 'weight_scheme': 'minmax', 'weight_clip_max': 5.0, 'weight_minmax_eps': 0.19869997484304597}. Best is trial 3 with value: 0.17536894167527164.
[I 2026-04-22 14:21:08,318] Trial 23 finished with value: 0.17277035530345658 and parameters: {'alpha': 696071.9669147031, 'use_snp_selection': True, 'num_snps': 37455, 'weight_scheme': 'minmax', 'weight_clip_max': 5.0, 'weight_minmax_eps': 0.19834971274208985}. Best is trial 3 with value: 0.17536894167527164.
[I 2026-04-22 14:22:56,589] Trial 24 finished with value: 0.16212451382597928 and parameters: {'alpha': 2914592.262934538, 'use_snp_selection': True, 'num_snps': 33803, 'weight_scheme': 'minmax', 'weight_clip_max': 5.0, 'weight_minmax_eps': 0.19867577487844465}. Best is trial 3 with value: 0.17536894167527164.
[I 2026-04-22 14:25:02,418] Trial 25 finished with value: 0.17709192932350437 and parameters: {'alpha': 266056.01541567384, 'use_snp_selection': True, 'num_snps': 45189, 'weight_scheme': 'minmax', 'weight_clip_max': 5.0, 'weight_minmax_eps': 0.14615895747367674}. Best is trial 25 with value: 0.17709192932350437.
[I 2026-04-22 14:27:07,526] Trial 26 finished with value: 0.17606356540728121 and parameters: {'alpha': 198066.13263669854, 'use_snp_selection': True, 'num_snps': 46017, 'weight_scheme': 'minmax', 'weight_clip_max': 5.0, 'weight_minmax_eps': 0.14309163952844633}. Best is trial 25 with value: 0.17709192932350437.
[I 2026-04-22 14:29:32,915] Trial 27 finished with value: 0.17106766319438355 and parameters: {'alpha': 2862438.2439060216, 'use_snp_selection': True, 'num_snps': 58983, 'weight_scheme': 'minmax', 'weight_clip_max': 5.0, 'weight_minmax_eps': 0.12610469686860193}. Best is trial 25 with value: 0.17709192932350437.
[I 2026-04-22 14:30:16,823] Trial 28 finished with value: 0.16012591128382386 and parameters: {'alpha': 55677.01514856701, 'use_snp_selection': False, 'weight_scheme': 'uniform', 'weight_clip_max': 10.0}. Best is trial 25 with value: 0.17709192932350437.
[I 2026-04-22 14:32:21,110] Trial 29 finished with value: 0.17672504899488228 and parameters: {'alpha': 207739.06261573356, 'use_snp_selection': True, 'num_snps': 45119, 'weight_scheme': 'minmax', 'weight_clip_max': None, 'weight_minmax_eps': 0.13982326623550623}. Best is trial 25 with value: 0.17709192932350437.
[I 2026-04-22 14:34:29,167] Trial 30 finished with value: 0.13744649792117608 and parameters: {'alpha': 3922.9411144002243, 'use_snp_selection': True, 'num_snps': 48284, 'weight_scheme': 'minmax', 'weight_clip_max': 5.0, 'weight_minmax_eps': 0.14293492733458588}. Best is trial 25 with value: 0.17709192932350437.
[I 2026-04-22 14:36:33,874] Trial 31 finished with value: 0.17569470988995908 and parameters: {'alpha': 187487.71683242233, 'use_snp_selection': True, 'num_snps': 44471, 'weight_scheme': 'minmax', 'weight_clip_max': None, 'weight_minmax_eps': 0.11775363469682272}. Best is trial 25 with value: 0.17709192932350437.
[I 2026-04-22 14:38:38,218] Trial 32 finished with value: 0.17285388763517137 and parameters: {'alpha': 1455739.6346554738, 'use_snp_selection': True, 'num_snps': 44211, 'weight_scheme': 'minmax', 'weight_clip_max': None, 'weight_minmax_eps': 0.11155474360681256}. Best is trial 25 with value: 0.17709192932350437.
[I 2026-04-22 14:40:57,033] Trial 33 finished with value: 0.1767354621006531 and parameters: {'alpha': 247512.11686596714, 'use_snp_selection': True, 'num_snps': 51610, 'weight_scheme': 'minmax', 'weight_clip_max': None, 'weight_minmax_eps': 0.15183450351918054}. Best is trial 25 with value: 0.17709192932350437.
[I 2026-04-22 14:43:16,297] Trial 34 finished with value: 0.1610803007304483 and parameters: {'alpha': 36268.049036994526, 'use_snp_selection': True, 'num_snps': 53220, 'weight_scheme': 'minmax', 'weight_clip_max': None, 'weight_minmax_eps': 0.16524872219730968}. Best is trial 25 with value: 0.17709192932350437.
[I 2026-04-22 14:45:38,468] Trial 35 finished with value: 0.17813005540646124 and parameters: {'alpha': 302261.304200758, 'use_snp_selection': True, 'num_snps': 53354, 'weight_scheme': 'minmax', 'weight_clip_max': 5.0, 'weight_minmax_eps': 0.15895061134774308}. Best is trial 35 with value: 0.17813005540646124.
[I 2026-04-22 14:48:02,188] Trial 36 finished with value: 0.1630208769955491 and parameters: {'alpha': 9666531.852963442, 'use_snp_selection': True, 'num_snps': 54435, 'weight_scheme': 'minmax', 'weight_clip_max': None, 'weight_minmax_eps': 0.16493024222605496}. Best is trial 35 with value: 0.17813005540646124.
[I 2026-04-22 14:50:23,139] Trial 37 finished with value: 0.17133410835728374 and parameters: {'alpha': 97213.73468242603, 'use_snp_selection': True, 'num_snps': 52595, 'weight_scheme': 'minmax', 'weight_clip_max': 5.0, 'weight_minmax_eps': 0.16157973495737857}. Best is trial 35 with value: 0.17813005540646124.
[I 2026-04-22 14:52:52,700] Trial 38 finished with value: 0.17789123324297557 and parameters: {'alpha': 300271.553518773, 'use_snp_selection': True, 'num_snps': 58238, 'weight_scheme': 'minmax', 'weight_clip_max': None, 'weight_minmax_eps': 0.16719735439106792}. Best is trial 35 with value: 0.17813005540646124.
[I 2026-04-22 14:55:24,828] Trial 39 finished with value: 0.17672593331495096 and parameters: {'alpha': 1523362.363251753, 'use_snp_selection': True, 'num_snps': 59828, 'weight_scheme': 'minmax', 'weight_clip_max': 10.0, 'weight_minmax_eps': 0.08386857530925101}. Best is trial 35 with value: 0.17813005540646124.
[I 2026-04-22 14:57:51,920] Trial 40 finished with value: 0.16990175155633377 and parameters: {'alpha': 418366.796708466, 'use_snp_selection': True, 'num_snps': 56654, 'weight_scheme': 'top-heavy', 'weight_clip_max': 5.0, 'weight_topheavy_top_frac': 0.4922303046471226, 'weight_topheavy_low': 0.5143802815079619, 'weight_topheavy_high': 1.498916118881517}. Best is trial 35 with value: 0.17813005540646124.
[I 2026-04-22 15:00:16,373] Trial 41 finished with value: 0.17725621690573887 and parameters: {'alpha': 1570574.3018420876, 'use_snp_selection': True, 'num_snps': 59599, 'weight_scheme': 'minmax', 'weight_clip_max': 10.0, 'weight_minmax_eps': 0.06279457267782282}. Best is trial 35 with value: 0.17813005540646124.
[I 2026-04-22 15:02:26,230] Trial 42 finished with value: 0.17645158501139088 and parameters: {'alpha': 1463466.5918575872, 'use_snp_selection': True, 'num_snps': 50078, 'weight_scheme': 'minmax', 'weight_clip_max': 10.0, 'weight_minmax_eps': 0.04756422096872716}. Best is trial 35 with value: 0.17813005540646124.
[I 2026-04-22 15:04:45,525] Trial 43 finished with value: 0.1665575842920739 and parameters: {'alpha': 4505966.8275103, 'use_snp_selection': True, 'num_snps': 56394, 'weight_scheme': 'minmax', 'weight_clip_max': 10.0, 'weight_minmax_eps': 0.172924428422451}. Best is trial 35 with value: 0.17813005540646124.
[I 2026-04-22 15:06:48,411] Trial 44 finished with value: 0.16233146406342022 and parameters: {'alpha': 71634.77859269497, 'use_snp_selection': True, 'num_snps': 50641, 'weight_scheme': 'uniform', 'weight_clip_max': 10.0}. Best is trial 35 with value: 0.17813005540646124.
[I 2026-04-22 15:09:12,607] Trial 45 finished with value: 0.16903506094357906 and parameters: {'alpha': 5829562.632731447, 'use_snp_selection': True, 'num_snps': 59958, 'weight_scheme': 'minmax', 'weight_clip_max': 10.0, 'weight_minmax_eps': 0.055133615643518735}. Best is trial 35 with value: 0.17813005540646124.
[I 2026-04-22 15:11:30,192] Trial 46 finished with value: 0.16722413028077837 and parameters: {'alpha': 104617.50721957433, 'use_snp_selection': True, 'num_snps': 55708, 'weight_scheme': 'exponential', 'weight_clip_max': None, 'weight_exponential_beta': 7.254019140327532}. Best is trial 35 with value: 0.17813005540646124.
[I 2026-04-22 15:13:27,555] Trial 47 finished with value: 0.17937702079591267 and parameters: {'alpha': 377549.4798409126, 'use_snp_selection': True, 'num_snps': 41291, 'weight_scheme': 'minmax', 'weight_clip_max': 10.0, 'weight_minmax_eps': 0.005333159916085184}. Best is trial 47 with value: 0.17937702079591267.
[I 2026-04-22 15:15:22,730] Trial 48 finished with value: 0.176610882422718 and parameters: {'alpha': 1159957.4689500157, 'use_snp_selection': True, 'num_snps': 40097, 'weight_scheme': 'minmax', 'weight_clip_max': 10.0, 'weight_minmax_eps': 0.0031795540462701078}. Best is trial 47 with value: 0.17937702079591267.
[I 2026-04-22 15:17:13,202] Trial 49 finished with value: 0.1612227120400556 and parameters: {'alpha': 464975.1598658516, 'use_snp_selection': True, 'num_snps': 41621, 'weight_scheme': 'uniform', 'weight_clip_max': 10.0}. Best is trial 47 with value: 0.17937702079591267.
[I 2026-04-22 15:19:19,306] Trial 50 finished with value: 0.15355398800158976 and parameters: {'alpha': 16942.480093766313, 'use_snp_selection': True, 'num_snps': 48026, 'weight_scheme': 'minmax', 'weight_clip_max': 10.0, 'weight_minmax_eps': 0.006306844143885259}. Best is trial 47 with value: 0.17937702079591267.
[I 2026-04-22 15:21:30,383] Trial 51 finished with value: 0.177184324093835 and parameters: {'alpha': 383803.25190615986, 'use_snp_selection': True, 'num_snps': 51623, 'weight_scheme': 'minmax', 'weight_clip_max': 10.0, 'weight_minmax_eps': 0.17769580026359355}. Best is trial 47 with value: 0.17937702079591267.
[I 2026-04-22 15:23:48,957] Trial 52 finished with value: 0.17771089993074227 and parameters: {'alpha': 452768.7349808415, 'use_snp_selection': True, 'num_snps': 57026, 'weight_scheme': 'minmax', 'weight_clip_max': 10.0, 'weight_minmax_eps': 0.18124191579689514}. Best is trial 47 with value: 0.17937702079591267.
[I 2026-04-22 15:26:08,184] Trial 53 finished with value: 0.1749817027155996 and parameters: {'alpha': 1159269.4788993946, 'use_snp_selection': True, 'num_snps': 57176, 'weight_scheme': 'minmax', 'weight_clip_max': 10.0, 'weight_minmax_eps': 0.17639521970201452}. Best is trial 47 with value: 0.17937702079591267.
[I 2026-04-22 15:28:23,273] Trial 54 finished with value: 0.17245330786781118 and parameters: {'alpha': 132312.37729984525, 'use_snp_selection': True, 'num_snps': 54349, 'weight_scheme': 'exponential', 'weight_clip_max': 10.0, 'weight_exponential_beta': 4.343487417312242}. Best is trial 47 with value: 0.17937702079591267.
[I 2026-04-22 15:30:43,588] Trial 55 finished with value: 0.12277213416499376 and parameters: {'alpha': 15.445778881515272, 'use_snp_selection': True, 'num_snps': 58086, 'weight_scheme': 'top-heavy', 'weight_clip_max': 10.0, 'weight_topheavy_top_frac': 0.28246260234429255, 'weight_topheavy_low': 1.1852499280007707, 'weight_topheavy_high': 3.268928574692534}. Best is trial 47 with value: 0.17937702079591267.
[I 2026-04-22 15:32:46,008] Trial 56 finished with value: 0.17734046484342408 and parameters: {'alpha': 395064.7008073432, 'use_snp_selection': True, 'num_snps': 49923, 'weight_scheme': 'minmax', 'weight_clip_max': 10.0, 'weight_minmax_eps': 0.17893720427969567}. Best is trial 47 with value: 0.17937702079591267.
[I 2026-04-22 15:34:46,893] Trial 57 finished with value: 0.16448891368621668 and parameters: {'alpha': 4772631.003175461, 'use_snp_selection': True, 'num_snps': 49110, 'weight_scheme': 'minmax', 'weight_clip_max': 10.0, 'weight_minmax_eps': 0.18288708262443332}. Best is trial 47 with value: 0.17937702079591267.
[I 2026-04-22 15:36:55,905] Trial 58 finished with value: 0.1807256893695865 and parameters: {'alpha': 782558.8557811974, 'use_snp_selection': True, 'num_snps': 55020, 'weight_scheme': 'minmax', 'weight_clip_max': 10.0, 'weight_minmax_eps': 0.038539635743571665}. Best is trial 58 with value: 0.1807256893695865.
[I 2026-04-22 15:39:03,888] Trial 59 finished with value: 0.18011093028139322 and parameters: {'alpha': 877588.4372964522, 'use_snp_selection': True, 'num_snps': 54273, 'weight_scheme': 'minmax', 'weight_clip_max': 10.0, 'weight_minmax_eps': 0.037787983649156864}. Best is trial 58 with value: 0.1807256893695865.
[I 2026-04-22 15:39:54,326] Trial 60 finished with value: 0.17216002521037804 and parameters: {'alpha': 851182.8980757393, 'use_snp_selection': False, 'weight_scheme': 'exponential', 'weight_clip_max': 10.0, 'weight_exponential_beta': 4.79444491299676}. Best is trial 58 with value: 0.1807256893695865.
[I 2026-04-22 15:42:03,377] Trial 61 finished with value: 0.1808243734277741 and parameters: {'alpha': 410181.5803387552, 'use_snp_selection': True, 'num_snps': 55068, 'weight_scheme': 'minmax', 'weight_clip_max': 10.0, 'weight_minmax_eps': 0.022373670571529895}. Best is trial 61 with value: 0.1808243734277741.
[I 2026-04-22 15:43:31,711] Trial 62 finished with value: 0.1656609172898968 and parameters: {'alpha': 2566703.9979819483, 'use_snp_selection': True, 'num_snps': 25016, 'weight_scheme': 'minmax', 'weight_clip_max': 10.0, 'weight_minmax_eps': 0.021670101486073776}. Best is trial 61 with value: 0.1808243734277741.
[I 2026-04-22 15:45:40,636] Trial 63 finished with value: 0.175847553872558 and parameters: {'alpha': 149821.14707928957, 'use_snp_selection': True, 'num_snps': 55024, 'weight_scheme': 'minmax', 'weight_clip_max': 10.0, 'weight_minmax_eps': 0.032490051153593824}. Best is trial 61 with value: 0.1808243734277741.
[I 2026-04-22 15:47:47,147] Trial 64 finished with value: 0.18007227803136022 and parameters: {'alpha': 919507.4407086775, 'use_snp_selection': True, 'num_snps': 53121, 'weight_scheme': 'minmax', 'weight_clip_max': 10.0, 'weight_minmax_eps': 0.024197394503815226}. Best is trial 61 with value: 0.1808243734277741.
[I 2026-04-22 15:49:53,534] Trial 65 finished with value: 0.18010674971932367 and parameters: {'alpha': 891914.9617630191, 'use_snp_selection': True, 'num_snps': 53012, 'weight_scheme': 'minmax', 'weight_clip_max': 10.0, 'weight_minmax_eps': 0.01993209878487119}. Best is trial 61 with value: 0.1808243734277741.
[I 2026-04-22 15:50:59,276] Trial 66 finished with value: 0.1570634753544054 and parameters: {'alpha': 912930.8759537783, 'use_snp_selection': True, 'num_snps': 8816, 'weight_scheme': 'top-heavy', 'weight_clip_max': 10.0, 'weight_topheavy_top_frac': 0.25888062132062306, 'weight_topheavy_low': 0.8039609176875543, 'weight_topheavy_high': 4.071104247459776}. Best is trial 61 with value: 0.1808243734277741.
