[I 2026-04-18 17:16:38,532] Trial 36 finished with value: 0.0337914988541909 and parameters: {'hidden_dims': '[512, 64]', 'dropout': 0.3077439605581497, 'batch_norm': False, 'lr': 0.00010975797488376811, 'weight_decay': 7.707474626276057e-06, 'epochs': 122, 'loss': 'mse', 'optimizer': 'sgd', 'use_snp_selection': False, 'weight_scheme': 'linear', 'weight_clip_max': None, 'weight_linear_min_weight': 0.6019160147387111, 'weight_linear_max_weight': 2.781075838939694}. Best is trial 31 with value: 0.15678558224551004.
[I 2026-04-18 17:17:21,940] Trial 37 finished with value: 0.1291492316890796 and parameters: {'hidden_dims': '[512, 64]', 'dropout': 0.27118779926320746, 'batch_norm': True, 'lr': 6.379056135198738e-05, 'weight_decay': 1.661610204825586e-05, 'epochs': 139, 'loss': 'mae', 'optimizer': 'adam', 'use_snp_selection': False, 'weight_scheme': 'minmax', 'weight_clip_max': None, 'weight_minmax_eps': 0.177050638341898}. Best is trial 31 with value: 0.15678558224551004.
[I 2026-04-18 17:17:53,924] Trial 10 finished with value: 0.09344724740506005 and parameters: {'hidden_dims': '[512, 64]', 'dropout': 0.4338375928678635, 'batch_norm': True, 'lr': 0.0009667920285641304, 'weight_decay': 6.976468597792388e-05, 'epochs': 294, 'loss': 'mae', 'optimizer': 'adam', 'use_snp_selection': False, 'weight_scheme': 'uniform', 'weight_clip_max': None}. Best is trial 6 with value: 0.12003044906243235.
[I 2026-04-18 17:18:06,721] Trial 38 finished with value: 0.12914903470309305 and parameters: {'hidden_dims': '[512, 64]', 'dropout': 0.20299457335667437, 'batch_norm': False, 'lr': 2.6657807310040757e-05, 'weight_decay': 1.6316668458457462e-06, 'epochs': 150, 'loss': 'mae', 'optimizer': 'sgd', 'use_snp_selection': False, 'weight_scheme': 'exponential', 'weight_clip_max': None, 'weight_exponential_beta': 7.792343453093756}. Best is trial 31 with value: 0.15678558224551004.
[I 2026-04-18 17:18:59,994] Trial 11 finished with value: 0.10825173371005876 and parameters: {'hidden_dims': '[256, 128]', 'dropout': 0.5754294922465415, 'batch_norm': False, 'lr': 0.00040305090043403, 'weight_decay': 0.0006508442861563287, 'epochs': 214, 'loss': 'mae', 'optimizer': 'adamw', 'use_snp_selection': True, 'num_snps': 57843, 'weight_scheme': 'minmax', 'weight_clip_max': 5.0, 'weight_minmax_eps': 0.09687781180927992}. Best is trial 6 with value: 0.12003044906243235.
[I 2026-04-18 17:19:01,334] Trial 39 finished with value: 0.10721183375305474 and parameters: {'hidden_dims': '[512, 64]', 'dropout': 0.3100433491632163, 'batch_norm': True, 'lr': 9.825707512916361e-05, 'weight_decay': 5.947497201375658e-07, 'epochs': 181, 'loss': 'mse', 'optimizer': 'adam', 'use_snp_selection': False, 'weight_scheme': 'uniform', 'weight_clip_max': None}. Best is trial 31 with value: 0.15678558224551004.
[I 2026-04-18 17:19:36,768] Trial 12 finished with value: 0.06472391291393535 and parameters: {'hidden_dims': '[256, 64]', 'dropout': 0.5756846183148884, 'batch_norm': True, 'lr': 3.7845926154118877e-06, 'weight_decay': 0.0009247869841802029, 'epochs': 226, 'loss': 'mae', 'optimizer': 'adamw', 'use_snp_selection': False, 'weight_scheme': 'minmax', 'weight_clip_max': None, 'weight_minmax_eps': 0.09627310711891753}. Best is trial 6 with value: 0.12003044906243235.
[I 2026-04-18 17:20:07,778] Trial 13 finished with value: 0.09685147006417112 and parameters: {'hidden_dims': '[256, 128]', 'dropout': 0.4109743180873037, 'batch_norm': False, 'lr': 0.00019243083671191828, 'weight_decay': 6.096790772247348e-05, 'epochs': 250, 'loss': 'mae', 'optimizer': 'adam', 'use_snp_selection': True, 'num_snps': 7358, 'weight_scheme': 'top-heavy', 'weight_clip_max': 5.0, 'weight_topheavy_top_frac': 0.48398486394237283, 'weight_topheavy_low': 0.5666436580870186, 'weight_topheavy_high': 5.961546164133656}. Best is trial 6 with value: 0.12003044906243235.
[I 2026-04-18 17:20:10,119] Trial 0 finished with value: 0.06226371715076508 and parameters: {'hidden_dims': '[256, 128]', 'dropout': 0.18584155530312246, 'batch_norm': True, 'lr': 9.012665953349533e-06, 'weight_decay': 4.96591963698479e-06, 'epochs': 105, 'loss': 'mse', 'optimizer': 'sgd', 'use_snp_selection': True, 'num_snps': 25583, 'weight_scheme': 'minmax', 'weight_clip_max': 5.0, 'weight_minmax_eps': 0.14026014881292506}. Best is trial 0 with value: 0.06226371715076508.
[I 2026-04-18 17:20:36,943] Trial 1 finished with value: 0.11414124255481077 and parameters: {'hidden_dims': '[256, 64]', 'dropout': 0.05000949662985405, 'batch_norm': True, 'lr': 0.00015647443054904835, 'weight_decay': 5.158896024962846e-05, 'epochs': 152, 'loss': 'mse', 'optimizer': 'sgd', 'use_snp_selection': False, 'weight_scheme': 'linear', 'weight_clip_max': None, 'weight_linear_min_weight': 0.21922985165550554, 'weight_linear_max_weight': 1.6260435767424388}. Best is trial 1 with value: 0.11414124255481077.
[I 2026-04-18 17:20:39,593] Trial 14 finished with value: 0.11934014076954949 and parameters: {'hidden_dims': '[256, 64]', 'dropout': 0.41996135168270726, 'batch_norm': True, 'lr': 4.7705458014471745e-05, 'weight_decay': 1.9482920075226874e-05, 'epochs': 191, 'loss': 'mae', 'optimizer': 'adamw', 'use_snp_selection': False, 'weight_scheme': 'exponential', 'weight_clip_max': None, 'weight_exponential_beta': 6.512744308642654}. Best is trial 6 with value: 0.12003044906243235.
[I 2026-04-18 17:20:51,804] Trial 15 finished with value: 0.126989398501844 and parameters: {'hidden_dims': '[256, 64]', 'dropout': 0.4369791033049462, 'batch_norm': True, 'lr': 4.044907397418171e-05, 'weight_decay': 1.23249326220073e-05, 'epochs': 52, 'loss': 'mae', 'optimizer': 'adamw', 'use_snp_selection': False, 'weight_scheme': 'exponential', 'weight_clip_max': None, 'weight_exponential_beta': 7.4589635458449575}. Best is trial 15 with value: 0.126989398501844.
[I 2026-04-18 17:21:04,220] Trial 16 finished with value: 0.08739224861152634 and parameters: {'hidden_dims': '[256, 64]', 'dropout': 0.4904370579503655, 'batch_norm': True, 'lr': 7.716178700655355e-06, 'weight_decay': 1.5917334076864815e-05, 'epochs': 53, 'loss': 'mae', 'optimizer': 'adam', 'use_snp_selection': False, 'weight_scheme': 'exponential', 'weight_clip_max': None, 'weight_exponential_beta': 7.749701004618775}. Best is trial 15 with value: 0.126989398501844.
[I 2026-04-18 17:21:16,417] Trial 17 finished with value: 0.10197035087357928 and parameters: {'hidden_dims': '[256, 64]', 'dropout': 0.3609441076665659, 'batch_norm': True, 'lr': 2.2339341883968927e-05, 'weight_decay': 1.2640525335321207e-06, 'epochs': 53, 'loss': 'mae', 'optimizer': 'adamw', 'use_snp_selection': False, 'weight_scheme': 'uniform', 'weight_clip_max': None}. Best is trial 15 with value: 0.126989398501844.
[I 2026-04-18 17:21:17,788] Trial 2 finished with value: 0.0722983573719129 and parameters: {'hidden_dims': '[512, 128]', 'dropout': 0.2736730891340176, 'batch_norm': True, 'lr': 7.298114623433994e-05, 'weight_decay': 5.6346010385734023e-08, 'epochs': 185, 'loss': 'mae', 'optimizer': 'sgd', 'use_snp_selection': True, 'num_snps': 14091, 'weight_scheme': 'minmax', 'weight_clip_max': 10.0, 'weight_minmax_eps': 0.045780660776687306}. Best is trial 1 with value: 0.11414124255481077.
[I 2026-04-18 17:21:42,057] Trial 18 finished with value: 0.07521746332452786 and parameters: {'hidden_dims': '[256, 64]', 'dropout': 0.007294073114139932, 'batch_norm': True, 'lr': 1.0499431617351935e-06, 'weight_decay': 0.0002116487950836202, 'epochs': 147, 'loss': 'mae', 'optimizer': 'adam', 'use_snp_selection': False, 'weight_scheme': 'exponential', 'weight_clip_max': None, 'weight_exponential_beta': 4.9855410344230675}. Best is trial 15 with value: 0.126989398501844.
[I 2026-04-18 17:22:43,421] Trial 3 finished with value: 0.0790064655526261 and parameters: {'hidden_dims': '[512, 64]', 'dropout': 0.30157795416637295, 'batch_norm': False, 'lr': 2.007492282795256e-05, 'weight_decay': 5.496446859789657e-06, 'epochs': 284, 'loss': 'mse', 'optimizer': 'sgd', 'use_snp_selection': False, 'weight_scheme': 'linear', 'weight_clip_max': None, 'weight_linear_min_weight': 0.24682154527102826, 'weight_linear_max_weight': 1.8338910783134623}. Best is trial 1 with value: 0.11414124255481077.
[I 2026-04-18 17:23:00,625] Trial 19 finished with value: 0.09744060266001071 and parameters: {'hidden_dims': '[512, 128]', 'dropout': 0.4769143229694264, 'batch_norm': True, 'lr': 0.0003169365753816738, 'weight_decay': 1.6931582255613915e-06, 'epochs': 263, 'loss': 'mae', 'optimizer': 'adamw', 'use_snp_selection': False, 'weight_scheme': 'exponential', 'weight_clip_max': None, 'weight_exponential_beta': 0.11581089864343275}. Best is trial 15 with value: 0.126989398501844.
[I 2026-04-18 17:23:09,398] Trial 4 finished with value: 0.13095826161567264 and parameters: {'hidden_dims': '[256, 64]', 'dropout': 0.18128694708490736, 'batch_norm': False, 'lr': 8.951826748007403e-05, 'weight_decay': 2.1781541495465197e-07, 'epochs': 147, 'loss': 'mse', 'optimizer': 'sgd', 'use_snp_selection': False, 'weight_scheme': 'top-heavy', 'weight_clip_max': 5.0, 'weight_topheavy_top_frac': 0.1724888194073277, 'weight_topheavy_low': 1.1620865802171172, 'weight_topheavy_high': 3.476906528073177}. Best is trial 4 with value: 0.13095826161567264.
[I 2026-04-18 17:23:29,327] Trial 20 finished with value: 0.09878579421094595 and parameters: {'hidden_dims': '[512, 64]', 'dropout': 0.1291137293483536, 'batch_norm': True, 'lr': 4.42268519588594e-05, 'weight_decay': 1.6430900325870037e-05, 'epochs': 84, 'loss': 'mae', 'optimizer': 'adam', 'use_snp_selection': False, 'weight_scheme': 'uniform', 'weight_clip_max': None}. Best is trial 15 with value: 0.126989398501844.
[I 2026-04-18 17:23:31,510] Trial 5 finished with value: 0.1391366553877623 and parameters: {'hidden_dims': '[256, 64]', 'dropout': 0.2571412946970998, 'batch_norm': True, 'lr': 3.546238022482882e-05, 'weight_decay': 1.0185234767613396e-06, 'epochs': 119, 'loss': 'mse', 'optimizer': 'sgd', 'use_snp_selection': False, 'weight_scheme': 'linear', 'weight_clip_max': 10.0, 'weight_linear_min_weight': 0.9405832045183805, 'weight_linear_max_weight': 3.413610925325811}. Best is trial 5 with value: 0.1391366553877623.
[I 2026-04-18 17:24:00,366] Trial 21 finished with value: 0.14887093100988508 and parameters: {'hidden_dims': '[256, 64]', 'dropout': 0.3588428722015051, 'batch_norm': True, 'lr': 5.770028711553932e-05, 'weight_decay': 1.8173647472058502e-05, 'epochs': 185, 'loss': 'mae', 'optimizer': 'adamw', 'use_snp_selection': False, 'weight_scheme': 'exponential', 'weight_clip_max': None, 'weight_exponential_beta': 7.865944899267008}. Best is trial 21 with value: 0.14887093100988508.
[I 2026-04-18 17:24:12,587] Trial 6 finished with value: 0.18121122003015105 and parameters: {'hidden_dims': '[256, 64]', 'dropout': 0.037961443806696214, 'batch_norm': True, 'lr': 3.644202049829694e-05, 'weight_decay': 9.73334309820277e-06, 'epochs': 243, 'loss': 'mae', 'optimizer': 'adam', 'use_snp_selection': False, 'weight_scheme': 'minmax', 'weight_clip_max': None, 'weight_minmax_eps': 0.08689611239934374}. Best is trial 6 with value: 0.18121122003015105.
[I 2026-04-18 17:24:29,420] Trial 22 finished with value: 0.1367163660976952 and parameters: {'hidden_dims': '[256, 64]', 'dropout': 0.3473196933366074, 'batch_norm': True, 'lr': 1.1734353041964137e-05, 'weight_decay': 5.472408865805977e-06, 'epochs': 171, 'loss': 'mae', 'optimizer': 'adamw', 'use_snp_selection': False, 'weight_scheme': 'exponential', 'weight_clip_max': None, 'weight_exponential_beta': 7.994766273720784}. Best is trial 21 with value: 0.14887093100988508.
[I 2026-04-18 17:24:58,016] Trial 23 finished with value: 0.08985686962048477 and parameters: {'hidden_dims': '[256, 64]', 'dropout': 0.34213438962344755, 'batch_norm': True, 'lr': 8.964217771094432e-06, 'weight_decay': 2.6961518646149836e-06, 'epochs': 167, 'loss': 'mae', 'optimizer': 'adamw', 'use_snp_selection': False, 'weight_scheme': 'exponential', 'weight_clip_max': None, 'weight_exponential_beta': 7.999294297245055}. Best is trial 21 with value: 0.14887093100988508.
[I 2026-04-18 17:25:20,331] Trial 24 finished with value: 0.10930694579071772 and parameters: {'hidden_dims': '[256, 64]', 'dropout': 0.3611958464267788, 'batch_norm': True, 'lr': 1.3935328419449432e-05, 'weight_decay': 0.00014719093675637568, 'epochs': 123, 'loss': 'mae', 'optimizer': 'adamw', 'use_snp_selection': False, 'weight_scheme': 'exponential', 'weight_clip_max': None, 'weight_exponential_beta': 6.432495072541277}. Best is trial 21 with value: 0.14887093100988508.
[I 2026-04-18 17:25:34,654] Trial 7 finished with value: 0.07482498790547198 and parameters: {'hidden_dims': '[512, 128]', 'dropout': 0.1304538168539244, 'batch_norm': False, 'lr': 1.5408060926311233e-05, 'weight_decay': 2.1989735568314356e-08, 'epochs': 250, 'loss': 'mse', 'optimizer': 'sgd', 'use_snp_selection': True, 'num_snps': 42550, 'weight_scheme': 'exponential', 'weight_clip_max': 10.0, 'weight_exponential_beta': 2.758850226029358}. Best is trial 6 with value: 0.18121122003015105.
[I 2026-04-18 17:25:53,560] Trial 25 finished with value: 0.10438320891509804 and parameters: {'hidden_dims': '[256, 64]', 'dropout': 0.5258983125506463, 'batch_norm': True, 'lr': 3.709086362179838e-06, 'weight_decay': 3.431299656942348e-05, 'epochs': 200, 'loss': 'mae', 'optimizer': 'adamw', 'use_snp_selection': False, 'weight_scheme': 'exponential', 'weight_clip_max': 10.0, 'weight_exponential_beta': 7.825532658066787}. Best is trial 21 with value: 0.14887093100988508.
[I 2026-04-18 17:26:14,723] Trial 8 finished with value: 0.1286572605099777 and parameters: {'hidden_dims': '[256, 128]', 'dropout': 0.05742396906738376, 'batch_norm': False, 'lr': 1.9761509510575143e-06, 'weight_decay': 2.933492239224291e-07, 'epochs': 82, 'loss': 'mae', 'optimizer': 'adam', 'use_snp_selection': True, 'num_snps': 29883, 'weight_scheme': 'minmax', 'weight_clip_max': 5.0, 'weight_minmax_eps': 0.0051288771726799584}. Best is trial 6 with value: 0.18121122003015105.
[I 2026-04-18 17:26:22,714] Trial 26 finished with value: 0.0823403912733385 and parameters: {'hidden_dims': '[256, 64]', 'dropout': 0.3126246501280562, 'batch_norm': True, 'lr': 4.773723943726658e-06, 'weight_decay': 5.524452663961685e-07, 'epochs': 171, 'loss': 'mae', 'optimizer': 'adamw', 'use_snp_selection': False, 'weight_scheme': 'exponential', 'weight_clip_max': None, 'weight_exponential_beta': 6.125723871370922}. Best is trial 21 with value: 0.14887093100988508.
[I 2026-04-18 17:26:39,491] Trial 27 finished with value: 0.11712673076989591 and parameters: {'hidden_dims': '[256, 64]', 'dropout': 0.3937927609764037, 'batch_norm': True, 'lr': 6.483985451567912e-05, 'weight_decay': 6.640011049818846e-06, 'epochs': 84, 'loss': 'mae', 'optimizer': 'adamw', 'use_snp_selection': False, 'weight_scheme': 'exponential', 'weight_clip_max': None, 'weight_exponential_beta': 6.79797672411745}. Best is trial 21 with value: 0.14887093100988508.
[I 2026-04-18 17:27:05,592] Trial 9 finished with value: 0.1631873972004681 and parameters: {'hidden_dims': '[256, 128]', 'dropout': 0.5795930447285386, 'batch_norm': False, 'lr': 0.00011782025260263196, 'weight_decay': 0.0005562063174273634, 'epochs': 218, 'loss': 'mae', 'optimizer': 'adamw', 'use_snp_selection': True, 'num_snps': 32226, 'weight_scheme': 'minmax', 'weight_clip_max': 5.0, 'weight_minmax_eps': 0.09600289105543994}. Best is trial 6 with value: 0.18121122003015105.
[I 2026-04-18 17:27:20,771] Trial 28 finished with value: 0.12565006404977902 and parameters: {'hidden_dims': '[512, 64]', 'dropout': 0.22584593828751343, 'batch_norm': True, 'lr': 2.5216751162266327e-05, 'weight_decay': 0.00016606869202086768, 'epochs': 129, 'loss': 'mae', 'optimizer': 'adamw', 'use_snp_selection': False, 'weight_scheme': 'exponential', 'weight_clip_max': None, 'weight_exponential_beta': 4.797347061517285}. Best is trial 21 with value: 0.14887093100988508.
[I 2026-04-18 17:27:54,864] Trial 29 finished with value: 0.1401068673884678 and parameters: {'hidden_dims': '[512, 128]', 'dropout': 0.4758435220605489, 'batch_norm': True, 'lr': 1.1759053026991705e-05, 'weight_decay': 2.4920576324741172e-06, 'epochs': 103, 'loss': 'mse', 'optimizer': 'adamw', 'use_snp_selection': False, 'weight_scheme': 'top-heavy', 'weight_clip_max': 10.0, 'weight_topheavy_top_frac': 0.0793189588776625, 'weight_topheavy_low': 0.9515087538485021, 'weight_topheavy_high': 1.5108127877398965}. Best is trial 21 with value: 0.14887093100988508.
[I 2026-04-18 17:28:30,109] Trial 30 finished with value: 0.1010620924140548 and parameters: {'hidden_dims': '[512, 128]', 'dropout': 0.49980912760501245, 'batch_norm': True, 'lr': 7.434268420932458e-06, 'weight_decay': 3.379979208969771e-06, 'epochs': 107, 'loss': 'mse', 'optimizer': 'adamw', 'use_snp_selection': False, 'weight_scheme': 'top-heavy', 'weight_clip_max': 10.0, 'weight_topheavy_top_frac': 0.08021726733211118, 'weight_topheavy_low': 0.9511223383455218, 'weight_topheavy_high': 1.4002362587873618}. Best is trial 21 with value: 0.14887093100988508.
[I 2026-04-18 17:28:36,932] Trial 10 finished with value: 0.16090664958826667 and parameters: {'hidden_dims': '[512, 64]', 'dropout': 0.4338375928678635, 'batch_norm': True, 'lr': 0.0009667920285641304, 'weight_decay': 6.976468597792388e-05, 'epochs': 294, 'loss': 'mae', 'optimizer': 'adam', 'use_snp_selection': False, 'weight_scheme': 'uniform', 'weight_clip_max': None}. Best is trial 6 with value: 0.18121122003015105.
[I 2026-04-18 17:28:44,093] Trial 31 finished with value: 0.07923267244373713 and parameters: {'hidden_dims': '[256, 64]', 'dropout': 0.44427128881219774, 'batch_norm': True, 'lr': 1.3537175098011859e-05, 'weight_decay': 9.22540582738394e-06, 'epochs': 64, 'loss': 'mse', 'optimizer': 'adamw', 'use_snp_selection': False, 'weight_scheme': 'top-heavy', 'weight_clip_max': 10.0, 'weight_topheavy_top_frac': 0.3126125363826026, 'weight_topheavy_low': 0.8211253612831281, 'weight_topheavy_high': 1.3510478506235506}. Best is trial 21 with value: 0.14887093100988508.
[I 2026-04-18 17:29:18,449] Trial 32 finished with value: 0.0801115759140307 and parameters: {'hidden_dims': '[512, 128]', 'dropout': 0.3768526100443172, 'batch_norm': True, 'lr': 5.513005233749462e-06, 'weight_decay': 3.957015882021439e-06, 'epochs': 104, 'loss': 'mse', 'optimizer': 'adamw', 'use_snp_selection': False, 'weight_scheme': 'top-heavy', 'weight_clip_max': 10.0, 'weight_topheavy_top_frac': 0.066692913858662, 'weight_topheavy_low': 0.911376250344502, 'weight_topheavy_high': 3.1632495665989557}. Best is trial 21 with value: 0.14887093100988508.
[I 2026-04-18 17:29:48,537] Trial 11 finished with value: 0.161773001353484 and parameters: {'hidden_dims': '[256, 128]', 'dropout': 0.5754294922465415, 'batch_norm': False, 'lr': 0.00040305090043403, 'weight_decay': 0.0006508442861563287, 'epochs': 214, 'loss': 'mae', 'optimizer': 'adamw', 'use_snp_selection': True, 'num_snps': 57843, 'weight_scheme': 'minmax', 'weight_clip_max': 5.0, 'weight_minmax_eps': 0.09687781180927992}. Best is trial 6 with value: 0.18121122003015105.
[I 2026-04-18 17:30:06,804] Trial 33 finished with value: 0.11315966702425842 and parameters: {'hidden_dims': '[512, 128]', 'dropout': 0.529226476635298, 'batch_norm': True, 'lr': 1.1574615868539866e-05, 'weight_decay': 3.959607202861741e-05, 'epochs': 154, 'loss': 'mse', 'optimizer': 'adamw', 'use_snp_selection': False, 'weight_scheme': 'top-heavy', 'weight_clip_max': 10.0, 'weight_topheavy_top_frac': 0.27304332902421696, 'weight_topheavy_low': 1.1889107448105642, 'weight_topheavy_high': 2.4776235258189825}. Best is trial 21 with value: 0.14887093100988508.
[I 2026-04-18 17:30:26,956] Trial 12 finished with value: 0.12430584865890668 and parameters: {'hidden_dims': '[256, 64]', 'dropout': 0.5756846183148884, 'batch_norm': True, 'lr': 3.7845926154118877e-06, 'weight_decay': 0.0009247869841802029, 'epochs': 226, 'loss': 'mae', 'optimizer': 'adamw', 'use_snp_selection': False, 'weight_scheme': 'minmax', 'weight_clip_max': None, 'weight_minmax_eps': 0.09627310711891753}. Best is trial 6 with value: 0.18121122003015105.
[I 2026-04-18 17:30:39,220] Trial 34 finished with value: 0.0983181029432691 and parameters: {'hidden_dims': '[512, 128]', 'dropout': 0.32505789071084334, 'batch_norm': True, 'lr': 5.94704420537924e-05, 'weight_decay': 7.09127638305141e-07, 'epochs': 97, 'loss': 'mse', 'optimizer': 'adamw', 'use_snp_selection': False, 'weight_scheme': 'linear', 'weight_clip_max': None, 'weight_linear_min_weight': 0.9873362156766972, 'weight_linear_max_weight': 3.957328567431956}. Best is trial 21 with value: 0.14887093100988508.
[I 2026-04-18 17:30:59,018] Trial 13 finished with value: 0.12719761567929103 and parameters: {'hidden_dims': '[256, 128]', 'dropout': 0.4109743180873037, 'batch_norm': False, 'lr': 0.00019243083671191828, 'weight_decay': 6.096790772247348e-05, 'epochs': 250, 'loss': 'mae', 'optimizer': 'adam', 'use_snp_selection': True, 'num_snps': 7358, 'weight_scheme': 'top-heavy', 'weight_clip_max': 5.0, 'weight_topheavy_top_frac': 0.48398486394237283, 'weight_topheavy_low': 0.5666436580870186, 'weight_topheavy_high': 5.961546164133656}. Best is trial 6 with value: 0.18121122003015105.
[I 2026-04-18 17:31:22,557] Trial 35 finished with value: 0.13129238893987147 and parameters: {'hidden_dims': '[512, 128]', 'dropout': 0.4645734606396695, 'batch_norm': True, 'lr': 2.2881104854099815e-05, 'weight_decay': 2.482786503389925e-06, 'epochs': 136, 'loss': 'mse', 'optimizer': 'adamw', 'use_snp_selection': False, 'weight_scheme': 'exponential', 'weight_clip_max': 10.0, 'weight_exponential_beta': 7.09139118601893}. Best is trial 21 with value: 0.14887093100988508.
