[I 2026-05-04 05:40:10,504] Trial 110 finished with value: 0.1951084390113766 and parameters: {'alpha': 209515.77019280643, 'use_snp_selection': False, 'iw_method': 'pc_logistic', 'iw_clip_max': 3.0, 'iw_prob_clip': 0.0026383888423788383, 'iw_n_components': 60, 'iw_logistic_c': 3.3065688065411646e-07, 'iw_pca_fit': 'combined', 'iw_solver': 'lbfgs', 'iw_rho': 1.0}. Best is trial 57 with value: 0.20366183229811924.
[I 2026-05-04 05:43:12,507] Trial 111 finished with value: 0.19881465639690127 and parameters: {'alpha': 282855.7983631287, 'use_snp_selection': False, 'iw_method': 'pc_logistic', 'iw_clip_max': 5.0, 'iw_prob_clip': 0.0013221422978473077, 'iw_n_components': 60, 'iw_logistic_c': 5.8962073071094315e-06, 'iw_pca_fit': 'combined', 'iw_solver': 'lbfgs', 'iw_rho': 1.0}. Best is trial 57 with value: 0.20366183229811924.
[I 2026-05-04 05:46:14,871] Trial 112 finished with value: 0.20039988977480744 and parameters: {'alpha': 224083.397969018, 'use_snp_selection': False, 'iw_method': 'pc_logistic', 'iw_clip_max': 5.0, 'iw_prob_clip': 0.033398464651503944, 'iw_n_components': 60, 'iw_logistic_c': 1.8838134645872148e-05, 'iw_pca_fit': 'combined', 'iw_solver': 'lbfgs', 'iw_rho': 1.0}. Best is trial 57 with value: 0.20366183229811924.
[I 2026-05-04 05:49:16,470] Trial 113 finished with value: 0.19971970398858702 and parameters: {'alpha': 292828.19141007727, 'use_snp_selection': False, 'iw_method': 'pc_logistic', 'iw_clip_max': 5.0, 'iw_prob_clip': 0.00739139960737014, 'iw_n_components': 60, 'iw_logistic_c': 4.129596320775739e-06, 'iw_pca_fit': 'combined', 'iw_solver': 'lbfgs', 'iw_rho': 1.0}. Best is trial 57 with value: 0.20366183229811924.
[I 2026-05-04 05:52:17,982] Trial 114 finished with value: 0.19706067561725232 and parameters: {'alpha': 241904.86539105407, 'use_snp_selection': False, 'iw_method': 'pc_logistic', 'iw_clip_max': 5.0, 'iw_prob_clip': 0.04967759971884009, 'iw_n_components': 60, 'iw_logistic_c': 1.915005889229189e-06, 'iw_pca_fit': 'combined', 'iw_solver': 'lbfgs', 'iw_rho': 1.0}. Best is trial 57 with value: 0.20366183229811924.
[I 2026-05-04 05:56:03,325] Trial 115 finished with value: 0.20056905715093723 and parameters: {'alpha': 268871.71093082905, 'use_snp_selection': False, 'iw_method': 'pc_logistic', 'iw_clip_max': 5.0, 'iw_prob_clip': 0.02929763019267446, 'iw_n_components': 40, 'iw_logistic_c': 7.890651945531271e-06, 'iw_pca_fit': 'combined', 'iw_solver': 'lbfgs', 'iw_rho': 1.0}. Best is trial 57 with value: 0.20366183229811924.
[I 2026-05-04 05:59:26,352] Trial 116 finished with value: 0.19854640892331088 and parameters: {'alpha': 175187.7146813939, 'use_snp_selection': False, 'iw_method': 'pc_logistic', 'iw_clip_max': 2.0, 'iw_prob_clip': 0.03909785484815944, 'iw_n_components': 10, 'iw_logistic_c': 3.0093497747904487e-06, 'iw_pca_fit': 'combined', 'iw_solver': 'lbfgs', 'iw_rho': 1.0}. Best is trial 57 with value: 0.20366183229811924.
[I 2026-05-04 06:03:23,308] Trial 117 finished with value: 0.19517153182536628 and parameters: {'alpha': 242943.05132679286, 'use_snp_selection': False, 'iw_method': 'pc_logistic', 'iw_clip_max': 5.0, 'iw_prob_clip': 0.04460078063736784, 'iw_n_components': 60, 'iw_logistic_c': 9.805590616684511e-07, 'iw_pca_fit': 'combined', 'iw_solver': 'lbfgs', 'iw_rho': 0.9}. Best is trial 57 with value: 0.20366183229811924.
[I 2026-05-04 06:07:20,095] Trial 118 finished with value: 0.19874110286621122 and parameters: {'alpha': 186170.1550308261, 'use_snp_selection': False, 'iw_method': 'pc_logistic', 'iw_clip_max': 5.0, 'iw_prob_clip': 0.0257835713669174, 'iw_n_components': 60, 'iw_logistic_c': 2.804932715873765e-05, 'iw_pca_fit': 'combined', 'iw_solver': 'lbfgs', 'iw_rho': 1.0}. Best is trial 57 with value: 0.20366183229811924.
[I 2026-05-04 06:10:58,864] Trial 119 finished with value: 0.19555836603767848 and parameters: {'alpha': 1806546.9967876065, 'use_snp_selection': False, 'iw_method': 'pc_logistic', 'iw_clip_max': 5.0, 'iw_prob_clip': 0.035937191197818893, 'iw_n_components': 30, 'iw_logistic_c': 1.6018909593625417e-05, 'iw_pca_fit': 'combined', 'iw_solver': 'lbfgs', 'iw_rho': 1.0}. Best is trial 57 with value: 0.20366183229811924.
[I 2026-05-04 06:14:54,723] Trial 120 finished with value: 0.20303696842473423 and parameters: {'alpha': 199974.7229133149, 'use_snp_selection': False, 'iw_method': 'pc_logistic', 'iw_clip_max': 3.0, 'iw_prob_clip': 0.03146155134022358, 'iw_n_components': 80, 'iw_logistic_c': 4.810160736342143e-06, 'iw_pca_fit': 'combined', 'iw_solver': 'lbfgs', 'iw_rho': 1.0}. Best is trial 57 with value: 0.20366183229811924.
[I 2026-05-04 06:19:08,325] Trial 121 finished with value: 0.20310700545050953 and parameters: {'alpha': 200142.9165497361, 'use_snp_selection': False, 'iw_method': 'pc_logistic', 'iw_clip_max': 3.0, 'iw_prob_clip': 0.0320591197285963, 'iw_n_components': 80, 'iw_logistic_c': 5.23928607376707e-06, 'iw_pca_fit': 'combined', 'iw_solver': 'lbfgs', 'iw_rho': 1.0}. Best is trial 57 with value: 0.20366183229811924.
[I 2026-05-04 06:23:00,477] Trial 122 finished with value: 0.2018277186882751 and parameters: {'alpha': 136529.3041567418, 'use_snp_selection': False, 'iw_method': 'pc_logistic', 'iw_clip_max': 3.0, 'iw_prob_clip': 0.030329669410654587, 'iw_n_components': 80, 'iw_logistic_c': 5.7270879523888535e-06, 'iw_pca_fit': 'combined', 'iw_solver': 'lbfgs', 'iw_rho': 1.0}. Best is trial 57 with value: 0.20366183229811924.
[I 2026-05-04 06:26:53,035] Trial 123 finished with value: 0.20160576811985034 and parameters: {'alpha': 200806.43443548435, 'use_snp_selection': False, 'iw_method': 'pc_logistic', 'iw_clip_max': 3.0, 'iw_prob_clip': 0.031758125318015716, 'iw_n_components': 80, 'iw_logistic_c': 1.8542133370114908e-06, 'iw_pca_fit': 'combined', 'iw_solver': 'lbfgs', 'iw_rho': 1.0}. Best is trial 57 with value: 0.20366183229811924.
[I 2026-05-04 06:30:59,148] Trial 124 finished with value: 0.20257670902409966 and parameters: {'alpha': 167252.07750138515, 'use_snp_selection': False, 'iw_method': 'pc_logistic', 'iw_clip_max': 3.0, 'iw_prob_clip': 0.03983651225117704, 'iw_n_components': 80, 'iw_logistic_c': 3.3914235387470164e-06, 'iw_pca_fit': 'combined', 'iw_solver': 'lbfgs', 'iw_rho': 1.0}. Best is trial 57 with value: 0.20366183229811924.
[I 2026-05-04 06:34:53,949] Trial 125 finished with value: 0.20265761129899684 and parameters: {'alpha': 223079.23790586746, 'use_snp_selection': False, 'iw_method': 'pc_logistic', 'iw_clip_max': 3.0, 'iw_prob_clip': 0.028111204308547213, 'iw_n_components': 80, 'iw_logistic_c': 9.252495214562786e-06, 'iw_pca_fit': 'combined', 'iw_solver': 'lbfgs', 'iw_rho': 0.75}. Best is trial 57 with value: 0.20366183229811924.
[I 2026-05-04 06:38:45,213] Trial 126 finished with value: 0.20283348856008582 and parameters: {'alpha': 204868.27380896985, 'use_snp_selection': False, 'iw_method': 'pc_logistic', 'iw_clip_max': 3.0, 'iw_prob_clip': 0.03611357237143492, 'iw_n_components': 80, 'iw_logistic_c': 4.7313419100812445e-06, 'iw_pca_fit': 'combined', 'iw_solver': 'lbfgs', 'iw_rho': 1.0}. Best is trial 57 with value: 0.20366183229811924.
[I 2026-05-04 06:42:41,652] Trial 127 finished with value: 0.1976537858587904 and parameters: {'alpha': 256886.28721941382, 'use_snp_selection': False, 'iw_method': 'pc_logistic', 'iw_clip_max': 3.0, 'iw_prob_clip': 0.023920823975516443, 'iw_n_components': 80, 'iw_logistic_c': 7.127521595299939e-07, 'iw_pca_fit': 'combined', 'iw_solver': 'lbfgs', 'iw_rho': 1.0}. Best is trial 57 with value: 0.20366183229811924.
[I 2026-05-04 06:46:56,774] Trial 128 finished with value: 0.19960583069295593 and parameters: {'alpha': 235325.60995752653, 'use_snp_selection': False, 'iw_method': 'pc_logistic', 'iw_clip_max': 3.0, 'iw_prob_clip': 0.03187931971629494, 'iw_n_components': 80, 'iw_logistic_c': 1.283977173340496e-06, 'iw_pca_fit': 'combined', 'iw_solver': 'lbfgs', 'iw_rho': 1.0}. Best is trial 57 with value: 0.20366183229811924.
[I 2026-05-04 06:47:34,388] Trial 129 finished with value: 0.19209613103569162 and parameters: {'alpha': 190583.60168436478, 'use_snp_selection': False, 'iw_method': 'uniform'}. Best is trial 57 with value: 0.20366183229811924.
[I 2026-05-04 06:51:21,564] Trial 130 finished with value: 0.2025641372636961 and parameters: {'alpha': 212738.75983965793, 'use_snp_selection': False, 'iw_method': 'pc_logistic', 'iw_clip_max': 3.0, 'iw_prob_clip': 0.03954069711645976, 'iw_n_components': 50, 'iw_logistic_c': 3.2143847563662683e-06, 'iw_pca_fit': 'combined', 'iw_solver': 'lbfgs', 'iw_rho': 1.0}. Best is trial 57 with value: 0.20366183229811924.
[I 2026-05-04 06:55:05,895] Trial 131 finished with value: 0.2030203768442595 and parameters: {'alpha': 281788.2245564315, 'use_snp_selection': False, 'iw_method': 'pc_logistic', 'iw_clip_max': 5.0, 'iw_prob_clip': 0.04516084230548936, 'iw_n_components': 60, 'iw_logistic_c': 7.734437381316684e-06, 'iw_pca_fit': 'combined', 'iw_solver': 'lbfgs', 'iw_rho': 1.0}. Best is trial 57 with value: 0.20366183229811924.
[I 2026-05-04 06:59:04,955] Trial 132 finished with value: 0.20328753262726576 and parameters: {'alpha': 293987.72840087774, 'use_snp_selection': False, 'iw_method': 'pc_logistic', 'iw_clip_max': 5.0, 'iw_prob_clip': 0.04526001006712455, 'iw_n_components': 60, 'iw_logistic_c': 7.679843867167317e-06, 'iw_pca_fit': 'combined', 'iw_solver': 'lbfgs', 'iw_rho': 1.0}. Best is trial 57 with value: 0.20366183229811924.
[I 2026-05-04 07:02:59,627] Trial 133 finished with value: 0.20125709742481948 and parameters: {'alpha': 153121.45550538864, 'use_snp_selection': False, 'iw_method': 'pc_logistic', 'iw_clip_max': 5.0, 'iw_prob_clip': 0.03413428415652495, 'iw_n_components': 60, 'iw_logistic_c': 2.2631757825794703e-06, 'iw_pca_fit': 'combined', 'iw_solver': 'lbfgs', 'iw_rho': 1.0}. Best is trial 57 with value: 0.20366183229811924.
[I 2026-05-04 07:06:23,534] Trial 134 finished with value: 0.20234182229486505 and parameters: {'alpha': 265527.9720111254, 'use_snp_selection': False, 'iw_method': 'pc_logistic', 'iw_clip_max': 5.0, 'iw_prob_clip': 0.03967701402954822, 'iw_n_components': 20, 'iw_logistic_c': 5.494133074538175e-06, 'iw_pca_fit': 'combined', 'iw_solver': 'lbfgs', 'iw_rho': 1.0}. Best is trial 57 with value: 0.20366183229811924.
[I 2026-05-04 07:10:30,301] Trial 135 finished with value: 0.19959223531848846 and parameters: {'alpha': 300542.50493913237, 'use_snp_selection': False, 'iw_method': 'pc_logistic', 'iw_clip_max': 5.0, 'iw_prob_clip': 0.004767658511595485, 'iw_n_components': 80, 'iw_logistic_c': 1.0204332241507463e-05, 'iw_pca_fit': 'combined', 'iw_solver': 'lbfgs', 'iw_rho': 0.5}. Best is trial 57 with value: 0.20366183229811924.
[I 2026-05-04 07:14:22,769] Trial 136 finished with value: 0.20289022736519544 and parameters: {'alpha': 223547.78382796608, 'use_snp_selection': False, 'iw_method': 'pc_logistic', 'iw_clip_max': 3.0, 'iw_prob_clip': 0.04683069616246912, 'iw_n_components': 60, 'iw_logistic_c': 6.7211124030917245e-06, 'iw_pca_fit': 'combined', 'iw_solver': 'lbfgs', 'iw_rho': 1.0}. Best is trial 57 with value: 0.20366183229811924.
[I 2026-05-04 07:17:44,539] Trial 137 finished with value: 0.2026511003048018 and parameters: {'alpha': 247759.8713045336, 'use_snp_selection': False, 'iw_method': 'pc_logistic', 'iw_clip_max': 5.0, 'iw_prob_clip': 0.03571755039412118, 'iw_n_components': 60, 'iw_logistic_c': 1.967411230194488e-05, 'iw_pca_fit': 'combined', 'iw_solver': 'lbfgs', 'iw_rho': 0.75}. Best is trial 57 with value: 0.20366183229811924.
[I 2026-05-04 07:21:27,107] Trial 138 finished with value: 0.19604600479320483 and parameters: {'alpha': 313509.44945523184, 'use_snp_selection': False, 'iw_method': 'pc_logistic', 'iw_clip_max': 1.5, 'iw_prob_clip': 0.027102813969276357, 'iw_n_components': 60, 'iw_logistic_c': 3.1605147996248215e-06, 'iw_pca_fit': 'combined', 'iw_solver': 'lbfgs', 'iw_rho': 1.0}. Best is trial 57 with value: 0.20366183229811924.
[I 2026-05-04 07:24:43,665] Trial 139 finished with value: 0.19442161301783406 and parameters: {'alpha': 176936.37064028514, 'use_snp_selection': False, 'iw_method': 'pc_logistic', 'iw_clip_max': 1.25, 'iw_prob_clip': 0.042152687176575734, 'iw_n_components': 60, 'iw_logistic_c': 1.4860871254708758e-06, 'iw_pca_fit': 'combined', 'iw_solver': 'lbfgs', 'iw_rho': 1.0}. Best is trial 57 with value: 0.20366183229811924.
[I 2026-05-04 07:28:33,110] Trial 140 finished with value: 0.20494589453301254 and parameters: {'alpha': 268703.6622211908, 'use_snp_selection': False, 'iw_method': 'pc_logistic', 'iw_clip_max': 5.0, 'iw_prob_clip': 0.0327888734256515, 'iw_n_components': 80, 'iw_logistic_c': 4.523687104467111e-06, 'iw_pca_fit': 'combined', 'iw_solver': 'lbfgs', 'iw_rho': 1.0}. Best is trial 140 with value: 0.20494589453301254.
[I 2026-05-04 07:32:12,091] Trial 141 finished with value: 0.20481409849365026 and parameters: {'alpha': 291005.19959556113, 'use_snp_selection': False, 'iw_method': 'pc_logistic', 'iw_clip_max': 5.0, 'iw_prob_clip': 0.03235364962636659, 'iw_n_components': 80, 'iw_logistic_c': 4.177732356214374e-06, 'iw_pca_fit': 'combined', 'iw_solver': 'lbfgs', 'iw_rho': 1.0}. Best is trial 140 with value: 0.20494589453301254.
[I 2026-05-04 07:36:02,910] Trial 142 finished with value: 0.20485351570195226 and parameters: {'alpha': 292063.5647364349, 'use_snp_selection': False, 'iw_method': 'pc_logistic', 'iw_clip_max': 5.0, 'iw_prob_clip': 0.03788103738467004, 'iw_n_components': 80, 'iw_logistic_c': 1.1898541118440502e-05, 'iw_pca_fit': 'combined', 'iw_solver': 'lbfgs', 'iw_rho': 1.0}. Best is trial 140 with value: 0.20494589453301254.
[I 2026-05-04 07:39:38,214] Trial 143 finished with value: 0.20389024640935868 and parameters: {'alpha': 279108.10619638563, 'use_snp_selection': False, 'iw_method': 'pc_logistic', 'iw_clip_max': 5.0, 'iw_prob_clip': 0.038209386729915154, 'iw_n_components': 80, 'iw_logistic_c': 1.2807650160077066e-05, 'iw_pca_fit': 'combined', 'iw_solver': 'lbfgs', 'iw_rho': 1.0}. Best is trial 140 with value: 0.20494589453301254.
[I 2026-05-04 07:43:13,830] Trial 144 finished with value: 0.20485102147550488 and parameters: {'alpha': 292984.73158401507, 'use_snp_selection': False, 'iw_method': 'pc_logistic', 'iw_clip_max': 5.0, 'iw_prob_clip': 0.0383684122286606, 'iw_n_components': 80, 'iw_logistic_c': 1.2475254178256684e-05, 'iw_pca_fit': 'combined', 'iw_solver': 'lbfgs', 'iw_rho': 1.0}. Best is trial 140 with value: 0.20494589453301254.
[I 2026-05-04 07:46:51,346] Trial 145 finished with value: 0.20399210143626392 and parameters: {'alpha': 296217.21512796904, 'use_snp_selection': False, 'iw_method': 'pc_logistic', 'iw_clip_max': 5.0, 'iw_prob_clip': 0.04918789317848103, 'iw_n_components': 80, 'iw_logistic_c': 3.357187215246113e-05, 'iw_pca_fit': 'combined', 'iw_solver': 'lbfgs', 'iw_rho': 1.0}. Best is trial 140 with value: 0.20494589453301254.
[I 2026-05-04 07:50:29,511] Trial 146 finished with value: 0.20429674131512526 and parameters: {'alpha': 322994.43913805584, 'use_snp_selection': False, 'iw_method': 'pc_logistic', 'iw_clip_max': 5.0, 'iw_prob_clip': 0.049735003212920695, 'iw_n_components': 80, 'iw_logistic_c': 3.384176936237003e-05, 'iw_pca_fit': 'combined', 'iw_solver': 'lbfgs', 'iw_rho': 0.9}. Best is trial 140 with value: 0.20494589453301254.
[I 2026-05-04 07:53:38,000] Trial 147 finished with value: 0.2034554492877157 and parameters: {'alpha': 370041.59100079036, 'use_snp_selection': False, 'iw_method': 'pc_logistic', 'iw_clip_max': 5.0, 'iw_prob_clip': 0.0499958118566962, 'iw_n_components': 80, 'iw_logistic_c': 2.9540479817609488e-05, 'iw_pca_fit': 'combined', 'iw_solver': 'lbfgs', 'iw_rho': 0.75}. Best is trial 140 with value: 0.20494589453301254.
[I 2026-05-04 07:56:47,539] Trial 148 finished with value: 0.20393374415059906 and parameters: {'alpha': 376825.14511503367, 'use_snp_selection': False, 'iw_method': 'pc_logistic', 'iw_clip_max': 5.0, 'iw_prob_clip': 0.047176460629112044, 'iw_n_components': 80, 'iw_logistic_c': 9.955057300717168e-05, 'iw_pca_fit': 'combined', 'iw_solver': 'lbfgs', 'iw_rho': 0.9}. Best is trial 140 with value: 0.20494589453301254.
[I 2026-05-04 07:59:57,614] Trial 149 finished with value: 0.20576683118294747 and parameters: {'alpha': 382381.21665275434, 'use_snp_selection': False, 'iw_method': 'pc_logistic', 'iw_clip_max': 5.0, 'iw_prob_clip': 0.04910226683107838, 'iw_n_components': 80, 'iw_logistic_c': 0.00010919613321818539, 'iw_pca_fit': 'combined', 'iw_solver': 'lbfgs', 'iw_rho': 0.9}. Best is trial 149 with value: 0.20576683118294747.
