[I 2026-04-21 19:38:19,493] Trial 20 finished with value: 0.05181698439756182 and parameters: {'hidden_dims': '[512, 128]', 'dropout': 0.37527526097597047, 'batch_norm': True, 'lr': 0.0009622428885133619, 'weight_decay': 0.000377271187218291, 'epochs': 267, 'loss': 'mae', 'optimizer': 'sgd', 'use_snp_selection': True, 'num_snps': 10629, 'weight_scheme': 'top-heavy', 'weight_clip_max': 10.0, 'weight_topheavy_top_frac': 0.06770045511137568, 'weight_topheavy_low': 0.7949679259790858, 'weight_topheavy_high': 1.8180817162057235}. Best is trial 10 with value: 0.09642297943116569.
[I 2026-04-21 19:38:29,057] Trial 26 finished with value: 0.07800958161744091 and parameters: {'hidden_dims': '[512, 64]', 'dropout': 0.14004784447266685, 'batch_norm': True, 'lr': 2.6159114688382958e-05, 'weight_decay': 1.975617159113114e-05, 'epochs': 210, 'loss': 'mae', 'optimizer': 'adamw', 'use_snp_selection': True, 'num_snps': 36694, 'weight_scheme': 'minmax', 'weight_clip_max': 10.0, 'weight_minmax_eps': 0.07220355822954272}. Best is trial 2 with value: 0.1163736564021506.
[I 2026-04-21 19:38:37,343] Trial 21 finished with value: 0.0994604997513081 and parameters: {'hidden_dims': '[512, 128]', 'dropout': 0.405488503577918, 'batch_norm': True, 'lr': 0.0005600984471499919, 'weight_decay': 1.1989769006614083e-07, 'epochs': 174, 'loss': 'mae', 'optimizer': 'adamw', 'use_snp_selection': True, 'num_snps': 6683, 'weight_scheme': 'uniform', 'weight_clip_max': 10.0}. Best is trial 21 with value: 0.0994604997513081.
[I 2026-04-21 19:38:42,334] Trial 27 finished with value: 0.03501299104464362 and parameters: {'hidden_dims': '[256, 128]', 'dropout': 0.2874529623487053, 'batch_norm': False, 'lr': 0.00014446316318496056, 'weight_decay': 4.932081744680779e-07, 'epochs': 170, 'loss': 'mae', 'optimizer': 'adam', 'use_snp_selection': False, 'weight_scheme': 'exponential', 'weight_clip_max': 10.0, 'weight_exponential_beta': 0.1264577158532152}. Best is trial 2 with value: 0.1163736564021506.
[I 2026-04-21 19:38:56,404] Trial 22 finished with value: 0.07644817171572994 and parameters: {'hidden_dims': '[512, 128]', 'dropout': 0.42097285389968264, 'batch_norm': True, 'lr': 0.00040298681201443576, 'weight_decay': 1.424167791921787e-07, 'epochs': 176, 'loss': 'mae', 'optimizer': 'adamw', 'use_snp_selection': True, 'num_snps': 8667, 'weight_scheme': 'uniform', 'weight_clip_max': 10.0}. Best is trial 21 with value: 0.0994604997513081.
[I 2026-04-21 19:39:06,610] Trial 28 finished with value: 0.10194986380538411 and parameters: {'hidden_dims': '[512, 128]', 'dropout': 0.3390550570196102, 'batch_norm': True, 'lr': 0.0004461257406926649, 'weight_decay': 9.132511622862546e-08, 'epochs': 101, 'loss': 'mae', 'optimizer': 'adamw', 'use_snp_selection': True, 'num_snps': 27422, 'weight_scheme': 'minmax', 'weight_clip_max': None, 'weight_minmax_eps': 0.12793476575604087}. Best is trial 2 with value: 0.1163736564021506.
[I 2026-04-21 19:39:23,540] Trial 23 finished with value: 0.0421363861340428 and parameters: {'hidden_dims': '[512, 128]', 'dropout': 0.2576596628230684, 'batch_norm': True, 'lr': 0.00017856202414710896, 'weight_decay': 2.2178385195792366e-08, 'epochs': 218, 'loss': 'mae', 'optimizer': 'adamw', 'use_snp_selection': True, 'num_snps': 21287, 'weight_scheme': 'uniform', 'weight_clip_max': 10.0}. Best is trial 21 with value: 0.0994604997513081.
[I 2026-04-21 19:39:28,669] Trial 29 finished with value: -0.024362984341633614 and parameters: {'hidden_dims': '[256, 128]', 'dropout': 0.1941792643278591, 'batch_norm': True, 'lr': 1.0742623697320967e-06, 'weight_decay': 3.629258986571133e-06, 'epochs': 239, 'loss': 'mse', 'optimizer': 'sgd', 'use_snp_selection': True, 'num_snps': 19543, 'weight_scheme': 'minmax', 'weight_clip_max': 5.0, 'weight_minmax_eps': 0.028404293288739606}. Best is trial 2 with value: 0.1163736564021506.
[I 2026-04-21 19:39:44,054] Trial 24 finished with value: 0.05708645864765206 and parameters: {'hidden_dims': '[512, 128]', 'dropout': 0.33151819097823976, 'batch_norm': True, 'lr': 0.0005373629217899956, 'weight_decay': 1.1665284353039617e-06, 'epochs': 164, 'loss': 'mae', 'optimizer': 'adamw', 'use_snp_selection': True, 'num_snps': 12458, 'weight_scheme': 'uniform', 'weight_clip_max': 10.0}. Best is trial 21 with value: 0.0994604997513081.
[I 2026-04-21 19:39:49,375] Trial 30 finished with value: 0.03738432003927301 and parameters: {'hidden_dims': '[512, 64]', 'dropout': 0.39725558643769215, 'batch_norm': True, 'lr': 6.831954991808394e-05, 'weight_decay': 0.0009751318074070424, 'epochs': 199, 'loss': 'mae', 'optimizer': 'sgd', 'use_snp_selection': True, 'num_snps': 12096, 'weight_scheme': 'minmax', 'weight_clip_max': 5.0, 'weight_minmax_eps': 0.006390513612426679}. Best is trial 2 with value: 0.1163736564021506.
[I 2026-04-21 19:40:01,072] Trial 25 finished with value: 0.10325264438974974 and parameters: {'hidden_dims': '[512, 128]', 'dropout': 0.5459381054019431, 'batch_norm': True, 'lr': 0.0002180778859314402, 'weight_decay': 2.5275617200176485e-08, 'epochs': 136, 'loss': 'mae', 'optimizer': 'adamw', 'use_snp_selection': True, 'num_snps': 5972, 'weight_scheme': 'minmax', 'weight_clip_max': 10.0, 'weight_minmax_eps': 0.188991881060241}. Best is trial 25 with value: 0.10325264438974974.
[I 2026-04-21 19:40:18,173] Trial 31 finished with value: 0.06919321264797969 and parameters: {'hidden_dims': '[512, 64]', 'dropout': 0.37812116229674286, 'batch_norm': True, 'lr': 4.7688464947175454e-05, 'weight_decay': 0.00011933387357001546, 'epochs': 210, 'loss': 'mae', 'optimizer': 'adam', 'use_snp_selection': True, 'num_snps': 24807, 'weight_scheme': 'minmax', 'weight_clip_max': 10.0, 'weight_minmax_eps': 0.04781193066556378}. Best is trial 2 with value: 0.1163736564021506.
[I 2026-04-21 19:40:20,338] Trial 26 finished with value: 0.015391713549512307 and parameters: {'hidden_dims': '[512, 128]', 'dropout': 0.5486301963348392, 'batch_norm': False, 'lr': 0.00019349532546278846, 'weight_decay': 2.5140887681051534e-08, 'epochs': 132, 'loss': 'mae', 'optimizer': 'adamw', 'use_snp_selection': False, 'weight_scheme': 'uniform', 'weight_clip_max': 10.0}. Best is trial 25 with value: 0.10325264438974974.
[I 2026-04-21 19:40:36,544] Trial 27 finished with value: 0.10210298186479244 and parameters: {'hidden_dims': '[256, 128]', 'dropout': 0.5926204501725206, 'batch_norm': True, 'lr': 0.0005572417856710735, 'weight_decay': 4.6670597585609703e-07, 'epochs': 103, 'loss': 'mae', 'optimizer': 'adamw', 'use_snp_selection': True, 'num_snps': 6818, 'weight_scheme': 'uniform', 'weight_clip_max': 10.0}. Best is trial 25 with value: 0.10325264438974974.
[I 2026-04-21 19:40:44,939] Trial 32 finished with value: 0.09057297113562429 and parameters: {'hidden_dims': '[512, 64]', 'dropout': 0.4582686637917455, 'batch_norm': True, 'lr': 4.431175169467801e-05, 'weight_decay': 0.00016020578810622952, 'epochs': 229, 'loss': 'mae', 'optimizer': 'adam', 'use_snp_selection': True, 'num_snps': 20199, 'weight_scheme': 'minmax', 'weight_clip_max': 10.0, 'weight_minmax_eps': 0.028907128033480105}. Best is trial 2 with value: 0.1163736564021506.
[I 2026-04-21 19:40:56,343] Trial 28 finished with value: 0.058535919354784804 and parameters: {'hidden_dims': '[256, 128]', 'dropout': 0.5821318977960341, 'batch_norm': True, 'lr': 0.00047646019696746334, 'weight_decay': 4.967231695391968e-07, 'epochs': 94, 'loss': 'mae', 'optimizer': 'adamw', 'use_snp_selection': True, 'num_snps': 20613, 'weight_scheme': 'minmax', 'weight_clip_max': None, 'weight_minmax_eps': 0.1924363342493717}. Best is trial 25 with value: 0.10325264438974974.
[I 2026-04-21 19:41:10,456] Trial 33 finished with value: 0.08959169561713483 and parameters: {'hidden_dims': '[512, 64]', 'dropout': 0.33866666150616187, 'batch_norm': True, 'lr': 0.00011437771390412134, 'weight_decay': 6.225291534366238e-05, 'epochs': 159, 'loss': 'mae', 'optimizer': 'adam', 'use_snp_selection': True, 'num_snps': 23069, 'weight_scheme': 'linear', 'weight_clip_max': 10.0, 'weight_linear_min_weight': 0.9994591269187902, 'weight_linear_max_weight': 3.9577873855889907}. Best is trial 2 with value: 0.1163736564021506.
[I 2026-04-21 19:41:21,733] Trial 29 finished with value: 0.05722778009922353 and parameters: {'hidden_dims': '[256, 128]', 'dropout': 0.48567222056514314, 'batch_norm': True, 'lr': 0.00023386312965685058, 'weight_decay': 3.170357598239063e-06, 'epochs': 108, 'loss': 'mse', 'optimizer': 'adamw', 'use_snp_selection': True, 'num_snps': 39099, 'weight_scheme': 'minmax', 'weight_clip_max': 5.0, 'weight_minmax_eps': 0.194960428077226}. Best is trial 25 with value: 0.10325264438974974.
[I 2026-04-21 19:41:47,875] Trial 34 finished with value: 0.08390425132543822 and parameters: {'hidden_dims': '[512, 64]', 'dropout': 0.2858480243595694, 'batch_norm': True, 'lr': 0.0001686411777206465, 'weight_decay': 9.36316034909576e-06, 'epochs': 264, 'loss': 'mse', 'optimizer': 'adam', 'use_snp_selection': False, 'weight_scheme': 'minmax', 'weight_clip_max': None, 'weight_minmax_eps': 0.06847947871067991}. Best is trial 2 with value: 0.1163736564021506.
[I 2026-04-21 19:41:49,247] Trial 30 finished with value: 0.04791185634403381 and parameters: {'hidden_dims': '[256, 128]', 'dropout': 0.5966966561729566, 'batch_norm': True, 'lr': 0.0005590748813301388, 'weight_decay': 1.3432004949189998e-07, 'epochs': 76, 'loss': 'mae', 'optimizer': 'adamw', 'use_snp_selection': True, 'num_snps': 53728, 'weight_scheme': 'exponential', 'weight_clip_max': 5.0, 'weight_exponential_beta': 0.2637706295058977}. Best is trial 25 with value: 0.10325264438974974.
[I 2026-04-21 19:41:58,916] Trial 35 finished with value: 0.026248263260713018 and parameters: {'hidden_dims': '[256, 64]', 'dropout': 0.28581682235589356, 'batch_norm': False, 'lr': 9.080569523459588e-05, 'weight_decay': 0.00036302501875640073, 'epochs': 133, 'loss': 'mse', 'optimizer': 'sgd', 'use_snp_selection': False, 'weight_scheme': 'linear', 'weight_clip_max': 10.0, 'weight_linear_min_weight': 0.5859364371907332, 'weight_linear_max_weight': 1.0143787942256455}. Best is trial 2 with value: 0.1163736564021506.
[I 2026-04-21 19:42:05,692] Trial 31 finished with value: 0.10552439175591244 and parameters: {'hidden_dims': '[256, 128]', 'dropout': 0.5304699173906032, 'batch_norm': True, 'lr': 0.0009535726463291776, 'weight_decay': 2.9186927172396915e-08, 'epochs': 137, 'loss': 'mae', 'optimizer': 'adamw', 'use_snp_selection': True, 'num_snps': 6759, 'weight_scheme': 'uniform', 'weight_clip_max': 10.0}. Best is trial 31 with value: 0.10552439175591244.
[I 2026-04-21 19:42:22,180] Trial 32 finished with value: 0.08087072453936998 and parameters: {'hidden_dims': '[256, 128]', 'dropout': 0.5358690594036053, 'batch_norm': True, 'lr': 0.0005804208837431456, 'weight_decay': 4.059429265545908e-07, 'epochs': 140, 'loss': 'mae', 'optimizer': 'adamw', 'use_snp_selection': True, 'num_snps': 6655, 'weight_scheme': 'uniform', 'weight_clip_max': 10.0}. Best is trial 31 with value: 0.10552439175591244.
[I 2026-04-21 19:42:24,472] Trial 36 finished with value: 0.036242797750200915 and parameters: {'hidden_dims': '[256, 64]', 'dropout': 0.3491510109776827, 'batch_norm': True, 'lr': 2.527534293006258e-05, 'weight_decay': 1.904924191165758e-05, 'epochs': 153, 'loss': 'mae', 'optimizer': 'sgd', 'use_snp_selection': True, 'num_snps': 35930, 'weight_scheme': 'minmax', 'weight_clip_max': 10.0, 'weight_minmax_eps': 0.038008983682499345}. Best is trial 2 with value: 0.1163736564021506.
[I 2026-04-21 19:42:39,604] Trial 33 finished with value: 0.07183450845181062 and parameters: {'hidden_dims': '[256, 128]', 'dropout': 0.49897038858154397, 'batch_norm': True, 'lr': 0.0002648385588814114, 'weight_decay': 8.168908135621353e-08, 'epochs': 117, 'loss': 'mae', 'optimizer': 'adamw', 'use_snp_selection': True, 'num_snps': 10670, 'weight_scheme': 'uniform', 'weight_clip_max': 10.0}. Best is trial 31 with value: 0.10552439175591244.
[I 2026-04-21 19:42:48,490] Trial 34 finished with value: 0.049913376982731884 and parameters: {'hidden_dims': '[256, 128]', 'dropout': 0.5543449948637178, 'batch_norm': True, 'lr': 0.0001271095247693495, 'weight_decay': 3.69919757124109e-08, 'epochs': 95, 'loss': 'mse', 'optimizer': 'adamw', 'use_snp_selection': False, 'weight_scheme': 'linear', 'weight_clip_max': 10.0, 'weight_linear_min_weight': 0.9871985702295868, 'weight_linear_max_weight': 3.905696651803039}. Best is trial 31 with value: 0.10552439175591244.
[I 2026-04-21 19:42:51,230] Trial 37 finished with value: 0.06033212411057237 and parameters: {'hidden_dims': '[512, 64]', 'dropout': 0.1918883318021424, 'batch_norm': True, 'lr': 1.3607291408574068e-05, 'weight_decay': 5.216425356693702e-06, 'epochs': 183, 'loss': 'mse', 'optimizer': 'adam', 'use_snp_selection': False, 'weight_scheme': 'top-heavy', 'weight_clip_max': 10.0, 'weight_topheavy_top_frac': 0.43627451962353336, 'weight_topheavy_low': 1.190490308880046, 'weight_topheavy_high': 5.896831762125853}. Best is trial 2 with value: 0.1163736564021506.
[I 2026-04-21 19:43:04,629] Trial 35 finished with value: 0.0912942238609381 and parameters: {'hidden_dims': '[256, 128]', 'dropout': 0.45975736940031975, 'batch_norm': True, 'lr': 0.0005869690466662474, 'weight_decay': 2.0081479247253194e-07, 'epochs': 156, 'loss': 'mae', 'optimizer': 'adamw', 'use_snp_selection': True, 'num_snps': 5578, 'weight_scheme': 'uniform', 'weight_clip_max': None}. Best is trial 31 with value: 0.10552439175591244.
[I 2026-04-21 19:43:14,442] Trial 38 finished with value: 0.07752350661344361 and parameters: {'hidden_dims': '[512, 128]', 'dropout': 0.3842098199523137, 'batch_norm': False, 'lr': 3.399034026603007e-05, 'weight_decay': 8.007273825896472e-05, 'epochs': 205, 'loss': 'mae', 'optimizer': 'sgd', 'use_snp_selection': True, 'num_snps': 16256, 'weight_scheme': 'exponential', 'weight_clip_max': None, 'weight_exponential_beta': 7.560979168469012}. Best is trial 2 with value: 0.1163736564021506.
[I 2026-04-21 19:43:25,154] Trial 36 finished with value: 0.12451556463388795 and parameters: {'hidden_dims': '[512, 64]', 'dropout': 0.517338835843909, 'batch_norm': False, 'lr': 0.0003967468177424165, 'weight_decay': 8.026541408875629e-07, 'epochs': 142, 'loss': 'mse', 'optimizer': 'adamw', 'use_snp_selection': False, 'weight_scheme': 'linear', 'weight_clip_max': 10.0, 'weight_linear_min_weight': 0.5943821567890559, 'weight_linear_max_weight': 2.7311112714576016}. Best is trial 36 with value: 0.12451556463388795.
[I 2026-04-21 19:43:35,716] Trial 39 finished with value: 0.07875957210757821 and parameters: {'hidden_dims': '[256, 64]', 'dropout': 0.2575199477534848, 'batch_norm': True, 'lr': 5.749968679728759e-05, 'weight_decay': 1.998246694548194e-05, 'epochs': 110, 'loss': 'mae', 'optimizer': 'adam', 'use_snp_selection': True, 'num_snps': 27368, 'weight_scheme': 'minmax', 'weight_clip_max': 5.0, 'weight_minmax_eps': 0.059020929846624465}. Best is trial 2 with value: 0.1163736564021506.
[I 2026-04-21 19:43:45,165] Trial 37 finished with value: 0.030718339342106018 and parameters: {'hidden_dims': '[512, 64]', 'dropout': 0.5204736939500251, 'batch_norm': False, 'lr': 6.667578324701038e-05, 'weight_decay': 2.0808852786852315e-06, 'epochs': 136, 'loss': 'mse', 'optimizer': 'adam', 'use_snp_selection': False, 'weight_scheme': 'linear', 'weight_clip_max': 10.0, 'weight_linear_min_weight': 0.6142536671437511, 'weight_linear_max_weight': 2.6884417280400608}. Best is trial 36 with value: 0.12451556463388795.
[I 2026-04-21 19:44:03,308] Trial 38 finished with value: 0.11153876685551918 and parameters: {'hidden_dims': '[512, 64]', 'dropout': 0.562787909100698, 'batch_norm': False, 'lr': 0.00017433716570340187, 'weight_decay': 3.0268109112091238e-05, 'epochs': 118, 'loss': 'mse', 'optimizer': 'adamw', 'use_snp_selection': False, 'weight_scheme': 'linear', 'weight_clip_max': 10.0, 'weight_linear_min_weight': 0.5778532037726983, 'weight_linear_max_weight': 2.571984563824175}. Best is trial 36 with value: 0.12451556463388795.
[I 2026-04-21 19:44:24,616] Trial 39 finished with value: 0.05058354165621637 and parameters: {'hidden_dims': '[512, 64]', 'dropout': 0.45878154613368405, 'batch_norm': False, 'lr': 0.00012781346767508418, 'weight_decay': 0.00017201272188177374, 'epochs': 147, 'loss': 'mse', 'optimizer': 'adamw', 'use_snp_selection': False, 'weight_scheme': 'linear', 'weight_clip_max': None, 'weight_linear_min_weight': 0.5943376021939059, 'weight_linear_max_weight': 2.6752500233419756}. Best is trial 36 with value: 0.12451556463388795.
[I 2026-04-21 19:44:25,852] Trial 0 finished with value: 0.029549606781492033 and parameters: {'hidden_dims': '[256, 128]', 'dropout': 0.18584155530312246, 'batch_norm': True, 'lr': 9.012665953349533e-06, 'weight_decay': 4.96591963698479e-06, 'epochs': 105, 'loss': 'mse', 'optimizer': 'sgd', 'use_snp_selection': True, 'num_snps': 25583, 'weight_scheme': 'minmax', 'weight_clip_max': 5.0, 'weight_minmax_eps': 0.14026014881292506}. Best is trial 0 with value: 0.029549606781492033.
[I 2026-04-21 19:44:38,784] Trial 1 finished with value: 0.08894432781337998 and parameters: {'hidden_dims': '[256, 64]', 'dropout': 0.05000949662985405, 'batch_norm': True, 'lr': 0.00015647443054904835, 'weight_decay': 5.158896024962846e-05, 'epochs': 152, 'loss': 'mse', 'optimizer': 'sgd', 'use_snp_selection': False, 'weight_scheme': 'linear', 'weight_clip_max': None, 'weight_linear_min_weight': 0.21922985165550554, 'weight_linear_max_weight': 1.6260435767424388}. Best is trial 1 with value: 0.08894432781337998.
[I 2026-04-21 19:45:01,983] Trial 2 finished with value: 0.09238632026063276 and parameters: {'hidden_dims': '[512, 128]', 'dropout': 0.2736730891340176, 'batch_norm': True, 'lr': 7.298114623433994e-05, 'weight_decay': 5.6346010385734023e-08, 'epochs': 185, 'loss': 'mae', 'optimizer': 'sgd', 'use_snp_selection': True, 'num_snps': 14091, 'weight_scheme': 'minmax', 'weight_clip_max': 10.0, 'weight_minmax_eps': 0.045780660776687306}. Best is trial 2 with value: 0.09238632026063276.
[I 2026-04-21 19:45:42,347] Trial 3 finished with value: 0.1026954231172017 and parameters: {'hidden_dims': '[512, 64]', 'dropout': 0.30157795416637295, 'batch_norm': False, 'lr': 2.007492282795256e-05, 'weight_decay': 5.496446859789657e-06, 'epochs': 284, 'loss': 'mse', 'optimizer': 'sgd', 'use_snp_selection': False, 'weight_scheme': 'linear', 'weight_clip_max': None, 'weight_linear_min_weight': 0.24682154527102826, 'weight_linear_max_weight': 1.8338910783134623}. Best is trial 3 with value: 0.1026954231172017.
[I 2026-04-21 19:45:55,079] Trial 4 finished with value: 0.05716058449905331 and parameters: {'hidden_dims': '[256, 64]', 'dropout': 0.18128694708490736, 'batch_norm': False, 'lr': 8.951826748007403e-05, 'weight_decay': 2.1781541495465197e-07, 'epochs': 147, 'loss': 'mse', 'optimizer': 'sgd', 'use_snp_selection': False, 'weight_scheme': 'top-heavy', 'weight_clip_max': 5.0, 'weight_topheavy_top_frac': 0.1724888194073277, 'weight_topheavy_low': 1.1620865802171172, 'weight_topheavy_high': 3.476906528073177}. Best is trial 3 with value: 0.1026954231172017.
[I 2026-04-21 19:46:06,012] Trial 5 finished with value: 0.06217055716013873 and parameters: {'hidden_dims': '[256, 64]', 'dropout': 0.2571412946970998, 'batch_norm': True, 'lr': 3.546238022482882e-05, 'weight_decay': 1.0185234767613396e-06, 'epochs': 119, 'loss': 'mse', 'optimizer': 'sgd', 'use_snp_selection': False, 'weight_scheme': 'linear', 'weight_clip_max': 10.0, 'weight_linear_min_weight': 0.9405832045183805, 'weight_linear_max_weight': 3.413610925325811}. Best is trial 3 with value: 0.1026954231172017.
[I 2026-04-21 19:46:25,681] Trial 6 finished with value: 0.15606481181215068 and parameters: {'hidden_dims': '[256, 64]', 'dropout': 0.037961443806696214, 'batch_norm': True, 'lr': 3.644202049829694e-05, 'weight_decay': 9.73334309820277e-06, 'epochs': 243, 'loss': 'mae', 'optimizer': 'adam', 'use_snp_selection': False, 'weight_scheme': 'minmax', 'weight_clip_max': None, 'weight_minmax_eps': 0.08689611239934374}. Best is trial 6 with value: 0.15606481181215068.
[I 2026-04-21 19:47:10,158] Trial 7 finished with value: 0.06796779841386885 and parameters: {'hidden_dims': '[512, 128]', 'dropout': 0.1304538168539244, 'batch_norm': False, 'lr': 1.5408060926311233e-05, 'weight_decay': 2.1989735568314356e-08, 'epochs': 250, 'loss': 'mse', 'optimizer': 'sgd', 'use_snp_selection': True, 'num_snps': 42550, 'weight_scheme': 'exponential', 'weight_clip_max': 10.0, 'weight_exponential_beta': 2.758850226029358}. Best is trial 6 with value: 0.15606481181215068.
[I 2026-04-21 19:47:32,878] Trial 8 finished with value: 0.07895523500931319 and parameters: {'hidden_dims': '[256, 128]', 'dropout': 0.05742396906738376, 'batch_norm': False, 'lr': 1.9761509510575143e-06, 'weight_decay': 2.933492239224291e-07, 'epochs': 82, 'loss': 'mae', 'optimizer': 'adam', 'use_snp_selection': True, 'num_snps': 29883, 'weight_scheme': 'minmax', 'weight_clip_max': 5.0, 'weight_minmax_eps': 0.0051288771726799584}. Best is trial 6 with value: 0.15606481181215068.
[I 2026-04-21 19:48:00,852] Trial 9 finished with value: 0.13294115348560023 and parameters: {'hidden_dims': '[256, 128]', 'dropout': 0.5795930447285386, 'batch_norm': False, 'lr': 0.00011782025260263196, 'weight_decay': 0.0005562063174273634, 'epochs': 218, 'loss': 'mae', 'optimizer': 'adamw', 'use_snp_selection': True, 'num_snps': 32226, 'weight_scheme': 'minmax', 'weight_clip_max': 5.0, 'weight_minmax_eps': 0.09600289105543994}. Best is trial 6 with value: 0.15606481181215068.
[I 2026-04-21 19:48:43,777] Trial 10 finished with value: 0.13057690237978647 and parameters: {'hidden_dims': '[512, 64]', 'dropout': 0.4338375928678635, 'batch_norm': True, 'lr': 0.0009667920285641304, 'weight_decay': 6.976468597792388e-05, 'epochs': 294, 'loss': 'mae', 'optimizer': 'adam', 'use_snp_selection': False, 'weight_scheme': 'uniform', 'weight_clip_max': None}. Best is trial 6 with value: 0.15606481181215068.
