Running from this directory: /cluster/work/simennes/Master_thesis
Name of job: ncv_ridge_iw
ID of job: 24378200
Array task ID: 1
The job was run on these nodes: idun-05-34
[I 2026-05-04 00:18:07,996] Trial 0 finished with value: 0.2155871251137817 and parameters: {'alpha': 574323.565896313, 'use_snp_selection': False, 'iw_method': 'pc_logistic', 'iw_clip_max': 2.0, 'iw_prob_clip': 0.005989214663243749, 'iw_n_components': 20, 'iw_logistic_c': 2.8870927958158354, 'iw_pca_fit': 'combined', 'iw_solver': 'lbfgs', 'iw_rho': 1.0}. Best is trial 0 with value: 0.2155871251137817.
[I 2026-05-04 00:21:30,693] Trial 1 finished with value: 0.20607160335499336 and parameters: {'alpha': 145427.84270397192, 'use_snp_selection': False, 'iw_method': 'pc_logistic', 'iw_clip_max': 2.0, 'iw_prob_clip': 0.0022034134189735897, 'iw_n_components': 10, 'iw_logistic_c': 8.53225823447423, 'iw_pca_fit': 'combined', 'iw_solver': 'lbfgs', 'iw_rho': 1.0}. Best is trial 0 with value: 0.2155871251137817.
[I 2026-05-04 00:25:08,139] Trial 2 finished with value: 0.21983956178220526 and parameters: {'alpha': 337268.1824826383, 'use_snp_selection': False, 'iw_method': 'pc_logistic', 'iw_clip_max': 1.25, 'iw_prob_clip': 0.0011214380556681478, 'iw_n_components': 40, 'iw_logistic_c': 0.0004456301044046966, 'iw_pca_fit': 'combined', 'iw_solver': 'lbfgs', 'iw_rho': 0.5}. Best is trial 2 with value: 0.21983956178220526.
[I 2026-05-04 00:28:44,187] Trial 3 finished with value: 0.21481007236687946 and parameters: {'alpha': 623873.8362358484, 'use_snp_selection': False, 'iw_method': 'pc_logistic', 'iw_clip_max': 2.0, 'iw_prob_clip': 0.0010704282286164728, 'iw_n_components': 30, 'iw_logistic_c': 0.003649078989687946, 'iw_pca_fit': 'combined', 'iw_solver': 'lbfgs', 'iw_rho': 0.9}. Best is trial 2 with value: 0.21983956178220526.
[I 2026-05-04 00:29:13,029] Trial 4 finished with value: 0.20584542118133645 and parameters: {'alpha': 1199521.094898443, 'use_snp_selection': False, 'iw_method': 'uniform'}. Best is trial 2 with value: 0.21983956178220526.
[I 2026-05-04 00:33:00,555] Trial 5 finished with value: 0.2191225141536109 and parameters: {'alpha': 594205.5826125565, 'use_snp_selection': False, 'iw_method': 'pc_logistic', 'iw_clip_max': 1.5, 'iw_prob_clip': 0.017782866059784724, 'iw_n_components': 40, 'iw_logistic_c': 0.3876202021284575, 'iw_pca_fit': 'combined', 'iw_solver': 'lbfgs', 'iw_rho': 0.5}. Best is trial 2 with value: 0.21983956178220526.
[I 2026-05-04 00:36:17,716] Trial 6 finished with value: 0.21863408370204515 and parameters: {'alpha': 102431.18633356069, 'use_snp_selection': False, 'iw_method': 'pc_logistic', 'iw_clip_max': 1.25, 'iw_prob_clip': 0.0017147683107745938, 'iw_n_components': 20, 'iw_logistic_c': 4.32601466983518e-06, 'iw_pca_fit': 'combined', 'iw_solver': 'lbfgs', 'iw_rho': 0.9}. Best is trial 2 with value: 0.21983956178220526.
[I 2026-05-04 00:39:50,578] Trial 7 finished with value: 0.2038200351777996 and parameters: {'alpha': 1830941.3950631474, 'use_snp_selection': False, 'iw_method': 'pc_logistic', 'iw_clip_max': 2.0, 'iw_prob_clip': 0.006357173651119782, 'iw_n_components': 40, 'iw_logistic_c': 1.7003213055010015e-05, 'iw_pca_fit': 'combined', 'iw_solver': 'lbfgs', 'iw_rho': 0.5}. Best is trial 2 with value: 0.21983956178220526.
[I 2026-05-04 00:40:19,404] Trial 8 finished with value: 0.205679028468216 and parameters: {'alpha': 1221444.8156569519, 'use_snp_selection': False, 'iw_method': 'uniform'}. Best is trial 2 with value: 0.21983956178220526.
[I 2026-05-04 00:40:47,226] Trial 9 finished with value: 0.21953896543180437 and parameters: {'alpha': 201218.30977627521, 'use_snp_selection': False, 'iw_method': 'uniform'}. Best is trial 2 with value: 0.21983956178220526.
[I 2026-05-04 00:41:14,777] Trial 10 finished with value: 0.21784484100717755 and parameters: {'alpha': 299360.6349531665, 'use_snp_selection': False, 'iw_method': 'uniform'}. Best is trial 2 with value: 0.21983956178220526.
[I 2026-05-04 00:41:43,491] Trial 11 finished with value: 0.21861577709091723 and parameters: {'alpha': 258797.99050519007, 'use_snp_selection': False, 'iw_method': 'uniform'}. Best is trial 2 with value: 0.21983956178220526.
[I 2026-05-04 00:42:10,732] Trial 12 finished with value: 0.2189354165935795 and parameters: {'alpha': 240795.7407033407, 'use_snp_selection': False, 'iw_method': 'uniform'}. Best is trial 2 with value: 0.21983956178220526.
[I 2026-05-04 00:42:39,563] Trial 13 finished with value: 0.21699580214423717 and parameters: {'alpha': 342454.3862236704, 'use_snp_selection': False, 'iw_method': 'uniform'}. Best is trial 2 with value: 0.21983956178220526.
[I 2026-05-04 00:46:41,515] Trial 14 finished with value: 0.22064829312827888 and parameters: {'alpha': 172640.14022320343, 'use_snp_selection': False, 'iw_method': 'pc_logistic', 'iw_clip_max': 1.25, 'iw_prob_clip': 0.0006845131669118436, 'iw_n_components': 80, 'iw_logistic_c': 1.266722508279006e-07, 'iw_pca_fit': 'combined', 'iw_solver': 'lbfgs', 'iw_rho': 0.75}. Best is trial 14 with value: 0.22064829312827888.
[I 2026-05-04 00:50:41,453] Trial 15 finished with value: 0.2171555726184164 and parameters: {'alpha': 408193.9854346712, 'use_snp_selection': False, 'iw_method': 'pc_logistic', 'iw_clip_max': 1.25, 'iw_prob_clip': 0.000595758483751843, 'iw_n_components': 80, 'iw_logistic_c': 3.2307650532713104e-07, 'iw_pca_fit': 'combined', 'iw_solver': 'lbfgs', 'iw_rho': 0.75}. Best is trial 14 with value: 0.22064829312827888.
[I 2026-05-04 00:54:57,928] Trial 16 finished with value: 0.21881651646993747 and parameters: {'alpha': 130819.02725146757, 'use_snp_selection': False, 'iw_method': 'pc_logistic', 'iw_clip_max': 3.0, 'iw_prob_clip': 0.0005371591708140125, 'iw_n_components': 80, 'iw_logistic_c': 0.001376228686835329, 'iw_pca_fit': 'combined', 'iw_solver': 'lbfgs', 'iw_rho': 0.75}. Best is trial 14 with value: 0.22064829312827888.
[I 2026-05-04 00:58:37,598] Trial 17 finished with value: 0.22057372037943757 and parameters: {'alpha': 171617.64991891297, 'use_snp_selection': False, 'iw_method': 'pc_logistic', 'iw_clip_max': 5.0, 'iw_prob_clip': 0.0027696358108387285, 'iw_n_components': 60, 'iw_logistic_c': 1.1471907618711869e-07, 'iw_pca_fit': 'combined', 'iw_solver': 'lbfgs', 'iw_rho': 0.75}. Best is trial 14 with value: 0.22064829312827888.
[I 2026-05-04 01:02:15,354] Trial 18 finished with value: 0.22020789667024357 and parameters: {'alpha': 190409.92486762188, 'use_snp_selection': False, 'iw_method': 'pc_logistic', 'iw_clip_max': 5.0, 'iw_prob_clip': 0.03921739620720018, 'iw_n_components': 60, 'iw_logistic_c': 1.6148150754309058e-07, 'iw_pca_fit': 'combined', 'iw_solver': 'lbfgs', 'iw_rho': 0.75}. Best is trial 14 with value: 0.22064829312827888.
[I 2026-05-04 01:06:06,286] Trial 19 finished with value: 0.21925384517521612 and parameters: {'alpha': 148703.9944794531, 'use_snp_selection': False, 'iw_method': 'pc_logistic', 'iw_clip_max': 5.0, 'iw_prob_clip': 0.003124798736546205, 'iw_n_components': 60, 'iw_logistic_c': 6.709127187766471e-06, 'iw_pca_fit': 'combined', 'iw_solver': 'lbfgs', 'iw_rho': 0.75}. Best is trial 14 with value: 0.22064829312827888.
[I 2026-05-04 01:09:55,977] Trial 20 finished with value: 0.20210658952634458 and parameters: {'alpha': 2919360.4328581505, 'use_snp_selection': False, 'iw_method': 'pc_logistic', 'iw_clip_max': 5.0, 'iw_prob_clip': 0.012671634654340128, 'iw_n_components': 50, 'iw_logistic_c': 7.118660094766404e-07, 'iw_pca_fit': 'combined', 'iw_solver': 'lbfgs', 'iw_rho': 0.75}. Best is trial 14 with value: 0.22064829312827888.
[I 2026-05-04 01:13:45,098] Trial 21 finished with value: 0.22010050560923075 and parameters: {'alpha': 183278.01579414605, 'use_snp_selection': False, 'iw_method': 'pc_logistic', 'iw_clip_max': 5.0, 'iw_prob_clip': 0.04459798659117626, 'iw_n_components': 60, 'iw_logistic_c': 1.0588413134626869e-07, 'iw_pca_fit': 'combined', 'iw_solver': 'lbfgs', 'iw_rho': 0.75}. Best is trial 14 with value: 0.22064829312827888.
[I 2026-05-04 01:17:49,217] Trial 22 finished with value: 0.22363486004521277 and parameters: {'alpha': 181331.47432491992, 'use_snp_selection': False, 'iw_method': 'pc_logistic', 'iw_clip_max': 5.0, 'iw_prob_clip': 0.04369680347506808, 'iw_n_components': 60, 'iw_logistic_c': 9.733925099104796e-07, 'iw_pca_fit': 'combined', 'iw_solver': 'lbfgs', 'iw_rho': 0.75}. Best is trial 22 with value: 0.22363486004521277.
[I 2026-05-04 01:21:06,843] Trial 23 finished with value: 0.22438526949467968 and parameters: {'alpha': 132723.77244428764, 'use_snp_selection': False, 'iw_method': 'pc_logistic', 'iw_clip_max': 5.0, 'iw_prob_clip': 0.012421347550749102, 'iw_n_components': 60, 'iw_logistic_c': 1.6832252968482856e-06, 'iw_pca_fit': 'combined', 'iw_solver': 'lbfgs', 'iw_rho': 0.75}. Best is trial 23 with value: 0.22438526949467968.
[I 2026-05-04 01:24:41,142] Trial 24 finished with value: 0.22052197947251645 and parameters: {'alpha': 100524.11666171951, 'use_snp_selection': False, 'iw_method': 'pc_logistic', 'iw_clip_max': 1.5, 'iw_prob_clip': 0.02105212675489889, 'iw_n_components': 80, 'iw_logistic_c': 5.253702471349059e-05, 'iw_pca_fit': 'combined', 'iw_solver': 'lbfgs', 'iw_rho': 0.75}. Best is trial 23 with value: 0.22438526949467968.
[I 2026-05-04 01:28:03,392] Trial 25 finished with value: 0.22309657418410564 and parameters: {'alpha': 125373.00920998256, 'use_snp_selection': False, 'iw_method': 'pc_logistic', 'iw_clip_max': 3.0, 'iw_prob_clip': 0.008574876973780904, 'iw_n_components': 60, 'iw_logistic_c': 1.6194362588675237e-06, 'iw_pca_fit': 'combined', 'iw_solver': 'lbfgs', 'iw_rho': 0.75}. Best is trial 23 with value: 0.22438526949467968.
[I 2026-05-04 01:31:22,279] Trial 26 finished with value: 0.22235817715041256 and parameters: {'alpha': 112794.20049518322, 'use_snp_selection': False, 'iw_method': 'pc_logistic', 'iw_clip_max': 3.0, 'iw_prob_clip': 0.010104403350650798, 'iw_n_components': 60, 'iw_logistic_c': 1.7257545693059922e-06, 'iw_pca_fit': 'combined', 'iw_solver': 'lbfgs', 'iw_rho': 0.75}. Best is trial 23 with value: 0.22438526949467968.
[I 2026-05-04 01:34:40,494] Trial 27 finished with value: 0.22106713594852131 and parameters: {'alpha': 436279.3930001438, 'use_snp_selection': False, 'iw_method': 'pc_logistic', 'iw_clip_max': 3.0, 'iw_prob_clip': 0.022100195582211192, 'iw_n_components': 60, 'iw_logistic_c': 5.005128457935125e-05, 'iw_pca_fit': 'combined', 'iw_solver': 'lbfgs', 'iw_rho': 0.9}. Best is trial 23 with value: 0.22438526949467968.
[I 2026-05-04 01:38:10,708] Trial 28 finished with value: 0.21414056571244125 and parameters: {'alpha': 239870.3557436769, 'use_snp_selection': False, 'iw_method': 'pc_logistic', 'iw_clip_max': 3.0, 'iw_prob_clip': 0.008944573679938174, 'iw_n_components': 60, 'iw_logistic_c': 0.00016478574862787923, 'iw_pca_fit': 'combined', 'iw_solver': 'lbfgs', 'iw_rho': 1.0}. Best is trial 23 with value: 0.22438526949467968.
[I 2026-05-04 01:41:27,887] Trial 29 finished with value: 0.21387107665371885 and parameters: {'alpha': 146881.61512073886, 'use_snp_selection': False, 'iw_method': 'pc_logistic', 'iw_clip_max': 5.0, 'iw_prob_clip': 0.029541005821386978, 'iw_n_components': 30, 'iw_logistic_c': 0.011104390134899911, 'iw_pca_fit': 'combined', 'iw_solver': 'lbfgs', 'iw_rho': 0.75}. Best is trial 23 with value: 0.22438526949467968.
[I 2026-05-04 01:44:19,602] Trial 30 finished with value: 0.21735931551009613 and parameters: {'alpha': 726362.2756053621, 'use_snp_selection': False, 'iw_method': 'pc_logistic', 'iw_clip_max': 5.0, 'iw_prob_clip': 0.014760487698939381, 'iw_n_components': 10, 'iw_logistic_c': 1.8607475338423075e-06, 'iw_pca_fit': 'combined', 'iw_solver': 'lbfgs', 'iw_rho': 0.75}. Best is trial 23 with value: 0.22438526949467968.
[I 2026-05-04 01:47:37,719] Trial 31 finished with value: 0.22308349192422933 and parameters: {'alpha': 121878.73133774353, 'use_snp_selection': False, 'iw_method': 'pc_logistic', 'iw_clip_max': 3.0, 'iw_prob_clip': 0.009714519478393874, 'iw_n_components': 60, 'iw_logistic_c': 1.3491780414178244e-06, 'iw_pca_fit': 'combined', 'iw_solver': 'lbfgs', 'iw_rho': 0.75}. Best is trial 23 with value: 0.22438526949467968.
[I 2026-05-04 01:50:58,507] Trial 32 finished with value: 0.22287031026386273 and parameters: {'alpha': 117418.2880441394, 'use_snp_selection': False, 'iw_method': 'pc_logistic', 'iw_clip_max': 3.0, 'iw_prob_clip': 0.004420649478667617, 'iw_n_components': 60, 'iw_logistic_c': 9.707698782552943e-07, 'iw_pca_fit': 'combined', 'iw_solver': 'lbfgs', 'iw_rho': 0.75}. Best is trial 23 with value: 0.22438526949467968.
[I 2026-05-04 01:54:18,122] Trial 33 finished with value: 0.22076917620544476 and parameters: {'alpha': 134431.37778563073, 'use_snp_selection': False, 'iw_method': 'pc_logistic', 'iw_clip_max': 3.0, 'iw_prob_clip': 0.009043431208304984, 'iw_n_components': 60, 'iw_logistic_c': 1.1269277552706372e-05, 'iw_pca_fit': 'combined', 'iw_solver': 'lbfgs', 'iw_rho': 0.75}. Best is trial 23 with value: 0.22438526949467968.
[I 2026-05-04 01:57:35,848] Trial 34 finished with value: 0.22685457286385718 and parameters: {'alpha': 217503.6237709583, 'use_snp_selection': False, 'iw_method': 'pc_logistic', 'iw_clip_max': 3.0, 'iw_prob_clip': 0.03067129631058233, 'iw_n_components': 50, 'iw_logistic_c': 2.781804370650304e-06, 'iw_pca_fit': 'combined', 'iw_solver': 'lbfgs', 'iw_rho': 0.75}. Best is trial 34 with value: 0.22685457286385718.
[I 2026-05-04 02:00:55,156] Trial 35 finished with value: 0.22391722714733803 and parameters: {'alpha': 208482.0802977843, 'use_snp_selection': False, 'iw_method': 'pc_logistic', 'iw_clip_max': 3.0, 'iw_prob_clip': 0.028405873981226355, 'iw_n_components': 50, 'iw_logistic_c': 3.0111925476925615e-05, 'iw_pca_fit': 'combined', 'iw_solver': 'lbfgs', 'iw_rho': 0.75}. Best is trial 34 with value: 0.22685457286385718.
[I 2026-05-04 02:04:14,734] Trial 36 finished with value: 0.22081620445959643 and parameters: {'alpha': 222707.22606020063, 'use_snp_selection': False, 'iw_method': 'pc_logistic', 'iw_clip_max': 5.0, 'iw_prob_clip': 0.03383500576678626, 'iw_n_components': 50, 'iw_logistic_c': 3.4479094512766936e-05, 'iw_pca_fit': 'combined', 'iw_solver': 'lbfgs', 'iw_rho': 0.75}. Best is trial 34 with value: 0.22685457286385718.
[I 2026-05-04 02:07:36,516] Trial 37 finished with value: 0.22282858921847065 and parameters: {'alpha': 295219.11882434407, 'use_snp_selection': False, 'iw_method': 'pc_logistic', 'iw_clip_max': 1.5, 'iw_prob_clip': 0.0284895952421261, 'iw_n_components': 50, 'iw_logistic_c': 0.00013241827254329225, 'iw_pca_fit': 'combined', 'iw_solver': 'lbfgs', 'iw_rho': 1.0}. Best is trial 34 with value: 0.22685457286385718.
[I 2026-05-04 02:10:56,616] Trial 38 finished with value: 0.2221946779455307 and parameters: {'alpha': 496688.5363092342, 'use_snp_selection': False, 'iw_method': 'pc_logistic', 'iw_clip_max': 3.0, 'iw_prob_clip': 0.04872018098219137, 'iw_n_components': 50, 'iw_logistic_c': 5.351515464088415e-06, 'iw_pca_fit': 'combined', 'iw_solver': 'lbfgs', 'iw_rho': 0.5}. Best is trial 34 with value: 0.22685457286385718.
[I 2026-05-04 02:14:11,854] Trial 39 finished with value: 0.2211898709854187 and parameters: {'alpha': 322917.36756559217, 'use_snp_selection': False, 'iw_method': 'pc_logistic', 'iw_clip_max': 5.0, 'iw_prob_clip': 0.02547153068922235, 'iw_n_components': 50, 'iw_logistic_c': 3.824866750994791e-07, 'iw_pca_fit': 'combined', 'iw_solver': 'lbfgs', 'iw_rho': 1.0}. Best is trial 34 with value: 0.22685457286385718.
[I 2026-05-04 02:17:16,541] Trial 40 finished with value: 0.2190494404499926 and parameters: {'alpha': 153000.1496334294, 'use_snp_selection': False, 'iw_method': 'pc_logistic', 'iw_clip_max': 2.0, 'iw_prob_clip': 0.015822407401152046, 'iw_n_components': 20, 'iw_logistic_c': 2.0557134731682482e-05, 'iw_pca_fit': 'combined', 'iw_solver': 'lbfgs', 'iw_rho': 0.9}. Best is trial 34 with value: 0.22685457286385718.
[I 2026-05-04 02:20:44,543] Trial 41 finished with value: 0.2268017016341696 and parameters: {'alpha': 216000.8839965568, 'use_snp_selection': False, 'iw_method': 'pc_logistic', 'iw_clip_max': 3.0, 'iw_prob_clip': 0.0351908294887209, 'iw_n_components': 50, 'iw_logistic_c': 3.33536700193289e-06, 'iw_pca_fit': 'combined', 'iw_solver': 'lbfgs', 'iw_rho': 0.75}. Best is trial 34 with value: 0.22685457286385718.
[I 2026-05-04 02:24:06,242] Trial 42 finished with value: 0.22616203091221024 and parameters: {'alpha': 203044.86175588486, 'use_snp_selection': False, 'iw_method': 'pc_logistic', 'iw_clip_max': 3.0, 'iw_prob_clip': 0.036356702333362745, 'iw_n_components': 50, 'iw_logistic_c': 4.7838534638527355e-06, 'iw_pca_fit': 'combined', 'iw_solver': 'lbfgs', 'iw_rho': 0.75}. Best is trial 34 with value: 0.22685457286385718.
[I 2026-05-04 02:27:22,852] Trial 43 finished with value: 0.21759173684845656 and parameters: {'alpha': 798721.2329048052, 'use_snp_selection': False, 'iw_method': 'pc_logistic', 'iw_clip_max': 3.0, 'iw_prob_clip': 0.03143909631651424, 'iw_n_components': 50, 'iw_logistic_c': 5.714563334535945e-06, 'iw_pca_fit': 'combined', 'iw_solver': 'lbfgs', 'iw_rho': 0.75}. Best is trial 34 with value: 0.22685457286385718.
[I 2026-05-04 02:27:56,880] Trial 44 finished with value: 0.21931943570697782 and parameters: {'alpha': 217007.93317269135, 'use_snp_selection': False, 'iw_method': 'uniform'}. Best is trial 34 with value: 0.22685457286385718.
[I 2026-05-04 02:31:17,852] Trial 45 finished with value: 0.2224695620861643 and parameters: {'alpha': 271259.5672519196, 'use_snp_selection': False, 'iw_method': 'pc_logistic', 'iw_clip_max': 3.0, 'iw_prob_clip': 0.019684080738491035, 'iw_n_components': 50, 'iw_logistic_c': 0.00020191794755399352, 'iw_pca_fit': 'combined', 'iw_solver': 'lbfgs', 'iw_rho': 0.75}. Best is trial 34 with value: 0.22685457286385718.
[I 2026-05-04 02:34:46,262] Trial 46 finished with value: 0.22119319644849428 and parameters: {'alpha': 359397.5424346709, 'use_snp_selection': False, 'iw_method': 'pc_logistic', 'iw_clip_max': 3.0, 'iw_prob_clip': 0.035213408469005975, 'iw_n_components': 50, 'iw_logistic_c': 0.06491183447146529, 'iw_pca_fit': 'combined', 'iw_solver': 'lbfgs', 'iw_rho': 0.75}. Best is trial 34 with value: 0.22685457286385718.
[I 2026-05-04 02:35:16,784] Trial 47 finished with value: 0.2193543833645896 and parameters: {'alpha': 214645.4402328496, 'use_snp_selection': False, 'iw_method': 'uniform'}. Best is trial 34 with value: 0.22685457286385718.
[I 2026-05-04 02:38:33,854] Trial 48 finished with value: 0.22402488541661972 and parameters: {'alpha': 160663.9608621751, 'use_snp_selection': False, 'iw_method': 'pc_logistic', 'iw_clip_max': 3.0, 'iw_prob_clip': 0.02589751751631434, 'iw_n_components': 50, 'iw_logistic_c': 4.293317734186569e-06, 'iw_pca_fit': 'combined', 'iw_solver': 'lbfgs', 'iw_rho': 0.5}. Best is trial 34 with value: 0.22685457286385718.
[I 2026-05-04 02:41:36,865] Trial 49 finished with value: 0.22090511973558838 and parameters: {'alpha': 162816.81314727265, 'use_snp_selection': False, 'iw_method': 'pc_logistic', 'iw_clip_max': 3.0, 'iw_prob_clip': 0.012936370228594018, 'iw_n_components': 10, 'iw_logistic_c': 2.334613613896724, 'iw_pca_fit': 'combined', 'iw_solver': 'lbfgs', 'iw_rho': 0.5}. Best is trial 34 with value: 0.22685457286385718.
[I 2026-05-04 02:42:06,625] Trial 50 finished with value: 0.2185340332276847 and parameters: {'alpha': 263246.0767501071, 'use_snp_selection': False, 'iw_method': 'uniform'}. Best is trial 34 with value: 0.22685457286385718.
[I 2026-05-04 02:45:23,246] Trial 51 finished with value: 0.22475653844448176 and parameters: {'alpha': 201707.4589335097, 'use_snp_selection': False, 'iw_method': 'pc_logistic', 'iw_clip_max': 3.0, 'iw_prob_clip': 0.025297030711024255, 'iw_n_components': 50, 'iw_logistic_c': 3.1474227274705565e-06, 'iw_pca_fit': 'combined', 'iw_solver': 'lbfgs', 'iw_rho': 0.5}. Best is trial 34 with value: 0.22685457286385718.
[I 2026-05-04 02:48:44,050] Trial 52 finished with value: 0.22423170964882852 and parameters: {'alpha': 156866.5746107131, 'use_snp_selection': False, 'iw_method': 'pc_logistic', 'iw_clip_max': 3.0, 'iw_prob_clip': 0.023260808903540243, 'iw_n_components': 50, 'iw_logistic_c': 2.614243122812782e-06, 'iw_pca_fit': 'combined', 'iw_solver': 'lbfgs', 'iw_rho': 0.5}. Best is trial 34 with value: 0.22685457286385718.
[I 2026-05-04 02:52:07,058] Trial 53 finished with value: 0.22177614655882188 and parameters: {'alpha': 193794.3669104347, 'use_snp_selection': False, 'iw_method': 'pc_logistic', 'iw_clip_max': 2.0, 'iw_prob_clip': 0.018350468977394053, 'iw_n_components': 50, 'iw_logistic_c': 4.883446841592544e-07, 'iw_pca_fit': 'combined', 'iw_solver': 'lbfgs', 'iw_rho': 0.5}. Best is trial 34 with value: 0.22685457286385718.
[I 2026-05-04 02:55:24,570] Trial 54 finished with value: 0.22037159163628323 and parameters: {'alpha': 141995.8022641821, 'use_snp_selection': False, 'iw_method': 'pc_logistic', 'iw_clip_max': 1.25, 'iw_prob_clip': 0.022388164900767657, 'iw_n_components': 40, 'iw_logistic_c': 4.306300891174308e-06, 'iw_pca_fit': 'combined', 'iw_solver': 'lbfgs', 'iw_rho': 0.5}. Best is trial 34 with value: 0.22685457286385718.
[I 2026-05-04 02:58:39,641] Trial 55 finished with value: 0.22391499944338436 and parameters: {'alpha': 249894.09957934057, 'use_snp_selection': False, 'iw_method': 'pc_logistic', 'iw_clip_max': 3.0, 'iw_prob_clip': 0.03839462513230799, 'iw_n_components': 30, 'iw_logistic_c': 1.1228031335915238e-05, 'iw_pca_fit': 'combined', 'iw_solver': 'lbfgs', 'iw_rho': 0.5}. Best is trial 34 with value: 0.22685457286385718.
[I 2026-05-04 03:01:57,608] Trial 56 finished with value: 0.22169754617981274 and parameters: {'alpha': 110175.91486462137, 'use_snp_selection': False, 'iw_method': 'pc_logistic', 'iw_clip_max': 3.0, 'iw_prob_clip': 0.005830657426844035, 'iw_n_components': 50, 'iw_logistic_c': 2.3107089946454564e-06, 'iw_pca_fit': 'combined', 'iw_solver': 'lbfgs', 'iw_rho': 0.5}. Best is trial 34 with value: 0.22685457286385718.
