[I 2026-04-22 15:06:07,753] Trial 66 finished with value: 0.18433487229672976 and parameters: {'alpha': 715885.5842294685, 'use_snp_selection': False, 'weight_scheme': 'linear', 'weight_clip_max': 5.0, 'weight_linear_min_weight': 0.5609728400610136, 'weight_linear_max_weight': 2.5530067334930235}. Best is trial 15 with value: 0.18472927322599988.
[I 2026-04-22 15:08:19,575] Trial 67 finished with value: 0.17150080892808478 and parameters: {'alpha': 46201.68992980904, 'use_snp_selection': True, 'num_snps': 43872, 'weight_scheme': 'linear', 'weight_clip_max': 5.0, 'weight_linear_min_weight': 0.6034853401463004, 'weight_linear_max_weight': 2.443250735605749}. Best is trial 15 with value: 0.18472927322599988.
[I 2026-04-22 15:09:17,427] Trial 68 finished with value: 0.17762476418653625 and parameters: {'alpha': 8404439.802681325, 'use_snp_selection': False, 'weight_scheme': 'linear', 'weight_clip_max': 5.0, 'weight_linear_min_weight': 0.5822857435116655, 'weight_linear_max_weight': 2.8880518362938994}. Best is trial 15 with value: 0.18472927322599988.
[I 2026-04-22 15:10:17,274] Trial 69 finished with value: 0.18460602361221104 and parameters: {'alpha': 569844.7292064854, 'use_snp_selection': False, 'weight_scheme': 'linear', 'weight_clip_max': 5.0, 'weight_linear_min_weight': 0.5529602754210464, 'weight_linear_max_weight': 2.58712434629348}. Best is trial 15 with value: 0.18472927322599988.
[I 2026-04-22 15:11:18,591] Trial 70 finished with value: 0.18460933604547275 and parameters: {'alpha': 614008.2152053255, 'use_snp_selection': False, 'weight_scheme': 'linear', 'weight_clip_max': 5.0, 'weight_linear_min_weight': 0.5434412448649021, 'weight_linear_max_weight': 2.609657932043575}. Best is trial 15 with value: 0.18472927322599988.
[I 2026-04-22 15:12:19,346] Trial 71 finished with value: 0.18461225603268852 and parameters: {'alpha': 622878.2779836656, 'use_snp_selection': False, 'weight_scheme': 'linear', 'weight_clip_max': 5.0, 'weight_linear_min_weight': 0.5359718413091042, 'weight_linear_max_weight': 2.5944767314772847}. Best is trial 15 with value: 0.18472927322599988.
[I 2026-04-22 15:13:20,879] Trial 72 finished with value: 0.18267226348225055 and parameters: {'alpha': 245085.12007959755, 'use_snp_selection': False, 'weight_scheme': 'linear', 'weight_clip_max': 5.0, 'weight_linear_min_weight': 0.5489250793939949, 'weight_linear_max_weight': 2.2360430127140565}. Best is trial 15 with value: 0.18472927322599988.
[I 2026-04-22 15:14:22,088] Trial 73 finished with value: 0.17723329900383897 and parameters: {'alpha': 117217.16729619906, 'use_snp_selection': False, 'weight_scheme': 'linear', 'weight_clip_max': 5.0, 'weight_linear_min_weight': 0.4872255933970385, 'weight_linear_max_weight': 1.8416586343756207}. Best is trial 15 with value: 0.18472927322599988.
[I 2026-04-22 15:15:23,475] Trial 74 finished with value: 0.18312350156423168 and parameters: {'alpha': 1618437.0615667708, 'use_snp_selection': False, 'weight_scheme': 'linear', 'weight_clip_max': 5.0, 'weight_linear_min_weight': 0.10727937578100352, 'weight_linear_max_weight': 2.5991216891406164}. Best is trial 15 with value: 0.18472927322599988.
[I 2026-04-22 15:16:25,230] Trial 75 finished with value: 0.18503541579815538 and parameters: {'alpha': 589877.9181883109, 'use_snp_selection': False, 'weight_scheme': 'linear', 'weight_clip_max': 5.0, 'weight_linear_min_weight': 0.18815311128287593, 'weight_linear_max_weight': 2.292879849732275}. Best is trial 75 with value: 0.18503541579815538.
[I 2026-04-22 15:17:25,455] Trial 76 finished with value: 0.18489922226450364 and parameters: {'alpha': 494526.2821754006, 'use_snp_selection': False, 'weight_scheme': 'linear', 'weight_clip_max': 5.0, 'weight_linear_min_weight': 0.18738046801202196, 'weight_linear_max_weight': 2.3021702667097235}. Best is trial 75 with value: 0.18503541579815538.
[I 2026-04-22 15:18:25,892] Trial 77 finished with value: 0.18497367826529723 and parameters: {'alpha': 518919.1314747069, 'use_snp_selection': False, 'weight_scheme': 'linear', 'weight_clip_max': 5.0, 'weight_linear_min_weight': 0.19223937348510858, 'weight_linear_max_weight': 2.2260297336559622}. Best is trial 75 with value: 0.18503541579815538.
[I 2026-04-22 15:19:25,132] Trial 78 finished with value: 0.18351599672296287 and parameters: {'alpha': 286325.1170716877, 'use_snp_selection': False, 'weight_scheme': 'linear', 'weight_clip_max': 5.0, 'weight_linear_min_weight': 0.21759704376478617, 'weight_linear_max_weight': 1.9713940538185648}. Best is trial 75 with value: 0.18503541579815538.
[I 2026-04-22 15:20:57,122] Trial 79 finished with value: 0.17602089498466142 and parameters: {'alpha': 536652.4057307083, 'use_snp_selection': True, 'num_snps': 16262, 'weight_scheme': 'linear', 'weight_clip_max': 5.0, 'weight_linear_min_weight': 0.20393258213971122, 'weight_linear_max_weight': 2.289487850246816}. Best is trial 75 with value: 0.18503541579815538.
[I 2026-04-22 15:21:55,487] Trial 80 finished with value: 0.18061339420298994 and parameters: {'alpha': 172692.66643097144, 'use_snp_selection': False, 'weight_scheme': 'linear', 'weight_clip_max': 5.0, 'weight_linear_min_weight': 0.1662375988535406, 'weight_linear_max_weight': 1.1482799976073763}. Best is trial 75 with value: 0.18503541579815538.
[I 2026-04-22 15:22:54,387] Trial 81 finished with value: 0.1849677714455038 and parameters: {'alpha': 504750.1985170541, 'use_snp_selection': False, 'weight_scheme': 'linear', 'weight_clip_max': 5.0, 'weight_linear_min_weight': 0.3123998615320772, 'weight_linear_max_weight': 2.1295184803552365}. Best is trial 75 with value: 0.18503541579815538.
[I 2026-04-22 15:23:54,380] Trial 82 finished with value: 0.18502697084934472 and parameters: {'alpha': 531910.4244181411, 'use_snp_selection': False, 'weight_scheme': 'linear', 'weight_clip_max': 5.0, 'weight_linear_min_weight': 0.27969697583319975, 'weight_linear_max_weight': 2.069290085919827}. Best is trial 75 with value: 0.18503541579815538.
[I 2026-04-22 15:24:55,602] Trial 83 finished with value: 0.18296950952502616 and parameters: {'alpha': 1612194.0339399832, 'use_snp_selection': False, 'weight_scheme': 'linear', 'weight_clip_max': 5.0, 'weight_linear_min_weight': 0.2985816808109835, 'weight_linear_max_weight': 2.0798332252507885}. Best is trial 75 with value: 0.18503541579815538.
[I 2026-04-22 15:25:56,096] Trial 84 finished with value: 0.14046346026736387 and parameters: {'alpha': 6085.676247845376, 'use_snp_selection': False, 'weight_scheme': 'linear', 'weight_clip_max': 5.0, 'weight_linear_min_weight': 0.250418136396483, 'weight_linear_max_weight': 1.9036575184862325}. Best is trial 75 with value: 0.18503541579815538.
[I 2026-04-22 15:26:57,371] Trial 85 finished with value: 0.18444259310772487 and parameters: {'alpha': 1043591.036871814, 'use_snp_selection': False, 'weight_scheme': 'linear', 'weight_clip_max': 5.0, 'weight_linear_min_weight': 0.1603712661901907, 'weight_linear_max_weight': 2.19277875470138}. Best is trial 75 with value: 0.18503541579815538.
[I 2026-04-22 15:27:58,171] Trial 86 finished with value: 0.1837700751121466 and parameters: {'alpha': 321379.84597431123, 'use_snp_selection': False, 'weight_scheme': 'linear', 'weight_clip_max': 5.0, 'weight_linear_min_weight': 0.3971723059228172, 'weight_linear_max_weight': 1.687252739687482}. Best is trial 75 with value: 0.18503541579815538.
[I 2026-04-22 15:28:58,793] Trial 87 finished with value: 0.18150951101596569 and parameters: {'alpha': 2636072.7791336174, 'use_snp_selection': False, 'weight_scheme': 'linear', 'weight_clip_max': 5.0, 'weight_linear_min_weight': 0.26155454582470966, 'weight_linear_max_weight': 2.346249716404674}. Best is trial 75 with value: 0.18503541579815538.
[I 2026-04-22 15:29:47,592] Trial 88 finished with value: 0.17216318713592255 and parameters: {'alpha': 1340309.0328066584, 'use_snp_selection': False, 'weight_scheme': 'uniform', 'weight_clip_max': 5.0}. Best is trial 75 with value: 0.18503541579815538.
[I 2026-04-22 15:30:47,839] Trial 89 finished with value: 0.18490188189593118 and parameters: {'alpha': 513592.06094134407, 'use_snp_selection': False, 'weight_scheme': 'linear', 'weight_clip_max': 5.0, 'weight_linear_min_weight': 0.1513639787184483, 'weight_linear_max_weight': 2.0505725446333964}. Best is trial 75 with value: 0.18503541579815538.
[I 2026-04-22 15:31:48,025] Trial 90 finished with value: 0.18213061502738198 and parameters: {'alpha': 226291.30819726555, 'use_snp_selection': False, 'weight_scheme': 'linear', 'weight_clip_max': 5.0, 'weight_linear_min_weight': 0.16877698791059337, 'weight_linear_max_weight': 2.08810072667643}. Best is trial 75 with value: 0.18503541579815538.
[I 2026-04-22 15:32:46,035] Trial 91 finished with value: 0.18472128710115204 and parameters: {'alpha': 586950.6721139739, 'use_snp_selection': False, 'weight_scheme': 'linear', 'weight_clip_max': 5.0, 'weight_linear_min_weight': 0.10666138888391272, 'weight_linear_max_weight': 2.4576650910338107}. Best is trial 75 with value: 0.18503541579815538.
[I 2026-04-22 15:33:45,173] Trial 92 finished with value: 0.1843360165906768 and parameters: {'alpha': 435687.6807893638, 'use_snp_selection': False, 'weight_scheme': 'linear', 'weight_clip_max': 5.0, 'weight_linear_min_weight': 0.10743342200537892, 'weight_linear_max_weight': 2.4284461784638323}. Best is trial 75 with value: 0.18503541579815538.
[I 2026-04-22 15:34:45,128] Trial 93 finished with value: 0.18454756434614586 and parameters: {'alpha': 995136.2032168501, 'use_snp_selection': False, 'weight_scheme': 'linear', 'weight_clip_max': 5.0, 'weight_linear_min_weight': 0.19923470732711224, 'weight_linear_max_weight': 2.1877059581126432}. Best is trial 75 with value: 0.18503541579815538.
[I 2026-04-22 15:35:44,776] Trial 94 finished with value: 0.17880328826298367 and parameters: {'alpha': 137761.80059541573, 'use_snp_selection': False, 'weight_scheme': 'linear', 'weight_clip_max': 5.0, 'weight_linear_min_weight': 0.3447839930935622, 'weight_linear_max_weight': 1.9654052790585463}. Best is trial 75 with value: 0.18503541579815538.
[I 2026-04-22 15:36:45,246] Trial 95 finished with value: 0.17845514389757203 and parameters: {'alpha': 765263.5682490676, 'use_snp_selection': False, 'weight_scheme': 'top-heavy', 'weight_clip_max': 5.0, 'weight_topheavy_top_frac': 0.28019107017926037, 'weight_topheavy_low': 0.9420006547305891, 'weight_topheavy_high': 5.184722280423535}. Best is trial 75 with value: 0.18503541579815538.
[I 2026-04-22 15:38:43,337] Trial 96 finished with value: 0.18368777739515715 and parameters: {'alpha': 307772.6773686053, 'use_snp_selection': True, 'num_snps': 30982, 'weight_scheme': 'linear', 'weight_clip_max': 5.0, 'weight_linear_min_weight': 0.14102187796559967, 'weight_linear_max_weight': 1.7481812518925852}. Best is trial 75 with value: 0.18503541579815538.
[I 2026-04-22 15:39:40,587] Trial 97 finished with value: 0.1849533071958593 and parameters: {'alpha': 504408.86317035346, 'use_snp_selection': False, 'weight_scheme': 'linear', 'weight_clip_max': 5.0, 'weight_linear_min_weight': 0.238476981618324, 'weight_linear_max_weight': 2.6940661956889196}. Best is trial 75 with value: 0.18503541579815538.
[I 2026-04-22 15:40:37,354] Trial 98 finished with value: 0.18120080109752287 and parameters: {'alpha': 194859.74272438395, 'use_snp_selection': False, 'weight_scheme': 'linear', 'weight_clip_max': 5.0, 'weight_linear_min_weight': 0.22815028028208503, 'weight_linear_max_weight': 2.7383634656804543}. Best is trial 75 with value: 0.18503541579815538.
[I 2026-04-22 15:41:34,906] Trial 99 finished with value: 0.12821031964845842 and parameters: {'alpha': 1046.5263296735855, 'use_snp_selection': False, 'weight_scheme': 'linear', 'weight_clip_max': 5.0, 'weight_linear_min_weight': 0.2962860204634479, 'weight_linear_max_weight': 2.31584469911723}. Best is trial 75 with value: 0.18503541579815538.
