[I 2026-04-21 18:10:14,645] Trial 34 finished with value: 0.27743483289630966 and parameters: {'hidden_dims': '[512, 64]', 'dropout': 0.4883308456654951, 'batch_norm': True, 'lr': 2.5626181515095094e-05, 'weight_decay': 0.0003848565900438639, 'epochs': 286, 'loss': 'mse', 'optimizer': 'adam', 'use_snp_selection': False, 'weight_scheme': 'uniform', 'weight_clip_max': 10.0}. Best is trial 20 with value: 0.3221917433415758.
[I 2026-04-21 18:10:18,405] Trial 18 finished with value: 0.13435976862032803 and parameters: {'hidden_dims': '[256, 64]', 'dropout': 0.007294073114139932, 'batch_norm': True, 'lr': 1.0387835278604118e-06, 'weight_decay': 1.3362472918395443e-06, 'epochs': 265, 'loss': 'mae', 'optimizer': 'adamw', 'use_snp_selection': False, 'weight_scheme': 'top-heavy', 'weight_clip_max': None, 'weight_topheavy_top_frac': 0.32555176360549987, 'weight_topheavy_low': 0.8300335921644134, 'weight_topheavy_high': 1.3079116154551826}. Best is trial 15 with value: 0.22784091341196588.
[I 2026-04-21 18:10:43,276] Trial 19 finished with value: 0.21257540474970738 and parameters: {'hidden_dims': '[512, 64]', 'dropout': 0.5244021532051006, 'batch_norm': True, 'lr': 4.081222551499373e-05, 'weight_decay': 0.00014824664391464745, 'epochs': 178, 'loss': 'mae', 'optimizer': 'adamw', 'use_snp_selection': False, 'weight_scheme': 'minmax', 'weight_clip_max': 10.0, 'weight_minmax_eps': 0.1915360679585659}. Best is trial 15 with value: 0.22784091341196588.
[I 2026-04-21 18:10:58,557] Trial 20 finished with value: 0.21896524692837457 and parameters: {'hidden_dims': '[256, 64]', 'dropout': 0.3424369809187238, 'batch_norm': True, 'lr': 0.00028080974126493634, 'weight_decay': 1.648439064521615e-05, 'epochs': 202, 'loss': 'mae', 'optimizer': 'adamw', 'use_snp_selection': False, 'weight_scheme': 'top-heavy', 'weight_clip_max': None, 'weight_topheavy_top_frac': 0.3379588987117065, 'weight_topheavy_low': 0.796315213731648, 'weight_topheavy_high': 4.162504575596352}. Best is trial 15 with value: 0.22784091341196588.
[I 2026-04-21 18:11:11,541] Trial 35 finished with value: 0.29690681117701817 and parameters: {'hidden_dims': '[512, 64]', 'dropout': 0.24782572725775504, 'batch_norm': False, 'lr': 2.999124602542834e-06, 'weight_decay': 6.0147131928101695e-05, 'epochs': 236, 'loss': 'mae', 'optimizer': 'adam', 'use_snp_selection': True, 'num_snps': 56569, 'weight_scheme': 'linear', 'weight_clip_max': 10.0, 'weight_linear_min_weight': 0.9787133879292096, 'weight_linear_max_weight': 3.9439447894500463}. Best is trial 20 with value: 0.3221917433415758.
[I 2026-04-21 18:11:13,792] Trial 21 finished with value: 0.20668477820379771 and parameters: {'hidden_dims': '[256, 64]', 'dropout': 0.34561663698222944, 'batch_norm': True, 'lr': 0.0003188510747513095, 'weight_decay': 1.443090050215805e-05, 'epochs': 202, 'loss': 'mae', 'optimizer': 'adamw', 'use_snp_selection': False, 'weight_scheme': 'top-heavy', 'weight_clip_max': None, 'weight_topheavy_top_frac': 0.334264527857428, 'weight_topheavy_low': 0.7973851373233325, 'weight_topheavy_high': 4.290723815026614}. Best is trial 15 with value: 0.22784091341196588.
[I 2026-04-21 18:11:30,747] Trial 22 finished with value: 0.20864153465115112 and parameters: {'hidden_dims': '[256, 64]', 'dropout': 0.19835890960166336, 'batch_norm': True, 'lr': 0.00019657556877694543, 'weight_decay': 1.947720652161072e-06, 'epochs': 229, 'loss': 'mae', 'optimizer': 'adamw', 'use_snp_selection': False, 'weight_scheme': 'top-heavy', 'weight_clip_max': None, 'weight_topheavy_top_frac': 0.41694926549655487, 'weight_topheavy_low': 0.6977388069391084, 'weight_topheavy_high': 4.135390541717544}. Best is trial 15 with value: 0.22784091341196588.
[I 2026-04-21 18:11:45,836] Trial 23 finished with value: 0.20674483616087347 and parameters: {'hidden_dims': '[256, 64]', 'dropout': 0.36071380676804193, 'batch_norm': True, 'lr': 0.0004473528775189816, 'weight_decay': 0.00018410569957686874, 'epochs': 199, 'loss': 'mae', 'optimizer': 'adamw', 'use_snp_selection': False, 'weight_scheme': 'top-heavy', 'weight_clip_max': None, 'weight_topheavy_top_frac': 0.16817850575484317, 'weight_topheavy_low': 1.0277304428963518, 'weight_topheavy_high': 2.923197323788337}. Best is trial 15 with value: 0.22784091341196588.
[I 2026-04-21 18:11:55,975] Trial 36 finished with value: 0.14200439078758928 and parameters: {'hidden_dims': '[512, 128]', 'dropout': 0.3174116159668228, 'batch_norm': False, 'lr': 6.038347142069955e-05, 'weight_decay': 1.6445304345105707e-06, 'epochs': 283, 'loss': 'mse', 'optimizer': 'sgd', 'use_snp_selection': False, 'weight_scheme': 'uniform', 'weight_clip_max': None}. Best is trial 20 with value: 0.3221917433415758.
[I 2026-04-21 18:12:05,146] Trial 24 finished with value: 0.22078354443210854 and parameters: {'hidden_dims': '[256, 64]', 'dropout': 0.12854035876011682, 'batch_norm': True, 'lr': 6.28110710531897e-05, 'weight_decay': 2.0423357714951458e-05, 'epochs': 266, 'loss': 'mae', 'optimizer': 'adamw', 'use_snp_selection': False, 'weight_scheme': 'top-heavy', 'weight_clip_max': None, 'weight_topheavy_top_frac': 0.2672844144076877, 'weight_topheavy_low': 0.6267805095414278, 'weight_topheavy_high': 4.989123193064462}. Best is trial 15 with value: 0.22784091341196588.
[I 2026-04-21 18:12:41,043] Trial 25 finished with value: 0.21570996716363988 and parameters: {'hidden_dims': '[512, 64]', 'dropout': 0.12481514079228903, 'batch_norm': True, 'lr': 5.6756775904776406e-05, 'weight_decay': 0.0009294258595420031, 'epochs': 267, 'loss': 'mae', 'optimizer': 'adamw', 'use_snp_selection': False, 'weight_scheme': 'exponential', 'weight_clip_max': None, 'weight_exponential_beta': 0.4432453910753549}. Best is trial 15 with value: 0.22784091341196588.
[I 2026-04-21 18:12:59,005] Trial 37 finished with value: 0.2780315570929368 and parameters: {'hidden_dims': '[512, 64]', 'dropout': 0.4451360708850515, 'batch_norm': True, 'lr': 1.1382842560631076e-05, 'weight_decay': 0.00046784080909012174, 'epochs': 262, 'loss': 'mae', 'optimizer': 'adam', 'use_snp_selection': True, 'num_snps': 59987, 'weight_scheme': 'exponential', 'weight_clip_max': 10.0, 'weight_exponential_beta': 0.5635023502861256}. Best is trial 20 with value: 0.3221917433415758.
[I 2026-04-21 18:13:00,490] Trial 26 finished with value: 0.20262509249579774 and parameters: {'hidden_dims': '[256, 128]', 'dropout': 0.10269933185411495, 'batch_norm': True, 'lr': 1.642390673989613e-05, 'weight_decay': 2.855799241020756e-05, 'epochs': 267, 'loss': 'mae', 'optimizer': 'adam', 'use_snp_selection': False, 'weight_scheme': 'minmax', 'weight_clip_max': None, 'weight_minmax_eps': 0.08948157406310688}. Best is trial 15 with value: 0.22784091341196588.
[I 2026-04-21 18:13:12,406] Trial 38 finished with value: -0.08155317503110175 and parameters: {'hidden_dims': '[256, 64]', 'dropout': 0.22047819120741763, 'batch_norm': False, 'lr': 3.1081417842951194e-05, 'weight_decay': 8.165196269827468e-05, 'epochs': 140, 'loss': 'mae', 'optimizer': 'sgd', 'use_snp_selection': False, 'weight_scheme': 'linear', 'weight_clip_max': 10.0, 'weight_linear_min_weight': 0.5953053773971442, 'weight_linear_max_weight': 1.062999744237596}. Best is trial 20 with value: 0.3221917433415758.
[I 2026-04-21 18:13:49,960] Trial 27 finished with value: 0.18605581171332783 and parameters: {'hidden_dims': '[512, 128]', 'dropout': 0.001428482243268303, 'batch_norm': False, 'lr': 2.3676455656959038e-05, 'weight_decay': 8.517391512949271e-06, 'epochs': 274, 'loss': 'mae', 'optimizer': 'adamw', 'use_snp_selection': True, 'num_snps': 51414, 'weight_scheme': 'top-heavy', 'weight_clip_max': None, 'weight_topheavy_top_frac': 0.05683227425980952, 'weight_topheavy_low': 0.6327775040546544, 'weight_topheavy_high': 5.141347905731582}. Best is trial 15 with value: 0.22784091341196588.
[I 2026-04-21 18:14:07,642] Trial 28 finished with value: 0.21614542486427546 and parameters: {'hidden_dims': '[256, 64]', 'dropout': 0.05642792042161087, 'batch_norm': True, 'lr': 5.203589041060111e-05, 'weight_decay': 5.593592292238151e-07, 'epochs': 241, 'loss': 'mae', 'optimizer': 'adam', 'use_snp_selection': False, 'weight_scheme': 'top-heavy', 'weight_clip_max': 10.0, 'weight_topheavy_top_frac': 0.2090596747030878, 'weight_topheavy_low': 0.6325469041434981, 'weight_topheavy_high': 5.13308822133437}. Best is trial 15 with value: 0.22784091341196588.
[I 2026-04-21 18:14:08,921] Trial 39 finished with value: 0.245032799587903 and parameters: {'hidden_dims': '[512, 64]', 'dropout': 0.34408958417584645, 'batch_norm': True, 'lr': 6.441741200951348e-06, 'weight_decay': 2.8650159808390674e-05, 'epochs': 253, 'loss': 'mse', 'optimizer': 'adam', 'use_snp_selection': True, 'num_snps': 53387, 'weight_scheme': 'uniform', 'weight_clip_max': None}. Best is trial 20 with value: 0.3221917433415758.
[I 2026-04-21 18:14:40,110] Trial 29 finished with value: 0.1638604883246753 and parameters: {'hidden_dims': '[256, 128]', 'dropout': 0.2091511411454141, 'batch_norm': True, 'lr': 9.954700290020822e-06, 'weight_decay': 5.006289275847993e-06, 'epochs': 153, 'loss': 'mse', 'optimizer': 'adamw', 'use_snp_selection': True, 'num_snps': 59731, 'weight_scheme': 'minmax', 'weight_clip_max': 5.0, 'weight_minmax_eps': 0.15603542120935585}. Best is trial 15 with value: 0.22784091341196588.
[I 2026-04-21 18:15:07,986] Trial 0 finished with value: 0.007578451921825373 and parameters: {'hidden_dims': '[256, 128]', 'dropout': 0.18584155530312246, 'batch_norm': True, 'lr': 9.012665953349533e-06, 'weight_decay': 4.96591963698479e-06, 'epochs': 105, 'loss': 'mse', 'optimizer': 'sgd', 'use_snp_selection': True, 'num_snps': 25583, 'weight_scheme': 'minmax', 'weight_clip_max': 5.0, 'weight_minmax_eps': 0.14026014881292506}. Best is trial 0 with value: 0.007578451921825373.
[I 2026-04-21 18:15:13,319] Trial 30 finished with value: 0.2218620465872426 and parameters: {'hidden_dims': '[512, 64]', 'dropout': 0.09117439003470434, 'batch_norm': True, 'lr': 0.0005640307673450297, 'weight_decay': 0.00012669629291447648, 'epochs': 247, 'loss': 'mae', 'optimizer': 'adam', 'use_snp_selection': False, 'weight_scheme': 'minmax', 'weight_clip_max': 5.0, 'weight_minmax_eps': 0.05616841709370354}. Best is trial 15 with value: 0.22784091341196588.
[I 2026-04-21 18:15:19,417] Trial 1 finished with value: 0.06680233909956966 and parameters: {'hidden_dims': '[256, 64]', 'dropout': 0.05000949662985405, 'batch_norm': True, 'lr': 0.00015647443054904835, 'weight_decay': 5.158896024962846e-05, 'epochs': 152, 'loss': 'mse', 'optimizer': 'sgd', 'use_snp_selection': False, 'weight_scheme': 'linear', 'weight_clip_max': None, 'weight_linear_min_weight': 0.21922985165550554, 'weight_linear_max_weight': 1.6260435767424388}. Best is trial 1 with value: 0.06680233909956966.
[I 2026-04-21 18:15:22,423] Trial 31 finished with value: 0.21505807074065206 and parameters: {'hidden_dims': '[512, 64]', 'dropout': 0.09412231676345574, 'batch_norm': True, 'lr': 0.0006166911453140427, 'weight_decay': 0.00012265560089725952, 'epochs': 51, 'loss': 'mae', 'optimizer': 'adam', 'use_snp_selection': False, 'weight_scheme': 'minmax', 'weight_clip_max': 5.0, 'weight_minmax_eps': 0.0460409523379721}. Best is trial 15 with value: 0.22784091341196588.
[I 2026-04-21 18:15:39,382] Trial 2 finished with value: 0.02033235662755637 and parameters: {'hidden_dims': '[512, 128]', 'dropout': 0.2736730891340176, 'batch_norm': True, 'lr': 7.298114623433994e-05, 'weight_decay': 5.6346010385734023e-08, 'epochs': 185, 'loss': 'mae', 'optimizer': 'sgd', 'use_snp_selection': True, 'num_snps': 14091, 'weight_scheme': 'minmax', 'weight_clip_max': 10.0, 'weight_minmax_eps': 0.045780660776687306}. Best is trial 1 with value: 0.06680233909956966.
[I 2026-04-21 18:15:56,497] Trial 32 finished with value: 0.21378084651436688 and parameters: {'hidden_dims': '[512, 64]', 'dropout': 0.15708547753071317, 'batch_norm': True, 'lr': 0.00018194158614206235, 'weight_decay': 0.0003257339462255264, 'epochs': 252, 'loss': 'mae', 'optimizer': 'adam', 'use_snp_selection': False, 'weight_scheme': 'minmax', 'weight_clip_max': 5.0, 'weight_minmax_eps': 0.061549401297947184}. Best is trial 15 with value: 0.22784091341196588.
[I 2026-04-21 18:16:14,864] Trial 3 finished with value: 0.029519919971189867 and parameters: {'hidden_dims': '[512, 64]', 'dropout': 0.30157795416637295, 'batch_norm': False, 'lr': 2.007492282795256e-05, 'weight_decay': 5.496446859789657e-06, 'epochs': 284, 'loss': 'mse', 'optimizer': 'sgd', 'use_snp_selection': False, 'weight_scheme': 'linear', 'weight_clip_max': None, 'weight_linear_min_weight': 0.24682154527102826, 'weight_linear_max_weight': 1.8338910783134623}. Best is trial 1 with value: 0.06680233909956966.
[I 2026-04-21 18:16:26,078] Trial 4 finished with value: 0.019226293547034992 and parameters: {'hidden_dims': '[256, 64]', 'dropout': 0.18128694708490736, 'batch_norm': False, 'lr': 8.951826748007403e-05, 'weight_decay': 2.1781541495465197e-07, 'epochs': 147, 'loss': 'mse', 'optimizer': 'sgd', 'use_snp_selection': False, 'weight_scheme': 'top-heavy', 'weight_clip_max': 5.0, 'weight_topheavy_top_frac': 0.1724888194073277, 'weight_topheavy_low': 1.1620865802171172, 'weight_topheavy_high': 3.476906528073177}. Best is trial 1 with value: 0.06680233909956966.
[I 2026-04-21 18:16:28,407] Trial 33 finished with value: 0.22350854834022002 and parameters: {'hidden_dims': '[512, 64]', 'dropout': 0.038594504033199195, 'batch_norm': True, 'lr': 0.00012470032254024597, 'weight_decay': 3.0747803299782116e-05, 'epochs': 235, 'loss': 'mae', 'optimizer': 'adam', 'use_snp_selection': False, 'weight_scheme': 'minmax', 'weight_clip_max': 5.0, 'weight_minmax_eps': 0.004318024745187693}. Best is trial 15 with value: 0.22784091341196588.
[I 2026-04-21 18:16:35,682] Trial 5 finished with value: 0.095482288571566 and parameters: {'hidden_dims': '[256, 64]', 'dropout': 0.2571412946970998, 'batch_norm': True, 'lr': 3.546238022482882e-05, 'weight_decay': 1.0185234767613396e-06, 'epochs': 119, 'loss': 'mse', 'optimizer': 'sgd', 'use_snp_selection': False, 'weight_scheme': 'linear', 'weight_clip_max': 10.0, 'weight_linear_min_weight': 0.9405832045183805, 'weight_linear_max_weight': 3.413610925325811}. Best is trial 5 with value: 0.095482288571566.
[I 2026-04-21 18:16:53,120] Trial 6 finished with value: 0.13368144013261166 and parameters: {'hidden_dims': '[256, 64]', 'dropout': 0.037961443806696214, 'batch_norm': True, 'lr': 3.644202049829694e-05, 'weight_decay': 9.73334309820277e-06, 'epochs': 243, 'loss': 'mae', 'optimizer': 'adam', 'use_snp_selection': False, 'weight_scheme': 'minmax', 'weight_clip_max': None, 'weight_minmax_eps': 0.08689611239934374}. Best is trial 6 with value: 0.13368144013261166.
[I 2026-04-21 18:17:06,098] Trial 34 finished with value: 0.22436486514392376 and parameters: {'hidden_dims': '[512, 64]', 'dropout': 0.2411679189304085, 'batch_norm': True, 'lr': 0.00011713174813834774, 'weight_decay': 9.202040372309341e-05, 'epochs': 281, 'loss': 'mse', 'optimizer': 'adam', 'use_snp_selection': False, 'weight_scheme': 'linear', 'weight_clip_max': 5.0, 'weight_linear_min_weight': 0.9979463074712633, 'weight_linear_max_weight': 3.9175596925117713}. Best is trial 15 with value: 0.22784091341196588.
[I 2026-04-21 18:17:32,035] Trial 7 finished with value: 0.10931476646201094 and parameters: {'hidden_dims': '[512, 128]', 'dropout': 0.1304538168539244, 'batch_norm': False, 'lr': 1.5408060926311233e-05, 'weight_decay': 2.1989735568314356e-08, 'epochs': 250, 'loss': 'mse', 'optimizer': 'sgd', 'use_snp_selection': True, 'num_snps': 42550, 'weight_scheme': 'exponential', 'weight_clip_max': 10.0, 'weight_exponential_beta': 2.758850226029358}. Best is trial 6 with value: 0.13368144013261166.
[I 2026-04-21 18:17:43,517] Trial 35 finished with value: 0.22296755975450588 and parameters: {'hidden_dims': '[512, 64]', 'dropout': 0.23738386320440108, 'batch_norm': True, 'lr': 0.00010337988226021973, 'weight_decay': 8.087617263453774e-05, 'epochs': 279, 'loss': 'mse', 'optimizer': 'adam', 'use_snp_selection': False, 'weight_scheme': 'linear', 'weight_clip_max': 5.0, 'weight_linear_min_weight': 0.9417109146712358, 'weight_linear_max_weight': 3.971059638735451}. Best is trial 15 with value: 0.22784091341196588.
[I 2026-04-21 18:17:51,669] Trial 8 finished with value: 0.12004005829912258 and parameters: {'hidden_dims': '[256, 128]', 'dropout': 0.05742396906738376, 'batch_norm': False, 'lr': 1.9761509510575143e-06, 'weight_decay': 2.933492239224291e-07, 'epochs': 82, 'loss': 'mae', 'optimizer': 'adam', 'use_snp_selection': True, 'num_snps': 29883, 'weight_scheme': 'minmax', 'weight_clip_max': 5.0, 'weight_minmax_eps': 0.0051288771726799584}. Best is trial 6 with value: 0.13368144013261166.
[I 2026-04-21 18:18:15,864] Trial 9 finished with value: 0.11512913911696358 and parameters: {'hidden_dims': '[256, 128]', 'dropout': 0.5795930447285386, 'batch_norm': False, 'lr': 0.00011782025260263196, 'weight_decay': 0.0005562063174273634, 'epochs': 218, 'loss': 'mae', 'optimizer': 'adamw', 'use_snp_selection': True, 'num_snps': 32226, 'weight_scheme': 'minmax', 'weight_clip_max': 5.0, 'weight_minmax_eps': 0.09600289105543994}. Best is trial 6 with value: 0.13368144013261166.
[I 2026-04-21 18:18:20,374] Trial 36 finished with value: 0.19996556065680737 and parameters: {'hidden_dims': '[512, 64]', 'dropout': 0.23580661939850583, 'batch_norm': False, 'lr': 0.00010879980153561414, 'weight_decay': 3.444607136505716e-05, 'epochs': 283, 'loss': 'mse', 'optimizer': 'adam', 'use_snp_selection': False, 'weight_scheme': 'linear', 'weight_clip_max': 5.0, 'weight_linear_min_weight': 0.9877750214321319, 'weight_linear_max_weight': 3.8163044256592373}. Best is trial 15 with value: 0.22784091341196588.
[I 2026-04-21 18:18:39,988] Trial 37 finished with value: 0.17102995685612798 and parameters: {'hidden_dims': '[512, 64]', 'dropout': 0.3131178714067911, 'batch_norm': True, 'lr': 0.00013447571257343177, 'weight_decay': 8.019634531673586e-05, 'epochs': 221, 'loss': 'mse', 'optimizer': 'adam', 'use_snp_selection': True, 'num_snps': 9746, 'weight_scheme': 'linear', 'weight_clip_max': 5.0, 'weight_linear_min_weight': 0.7185252608310468, 'weight_linear_max_weight': 3.9870571417406406}. Best is trial 15 with value: 0.22784091341196588.
[I 2026-04-21 18:18:53,243] Trial 10 finished with value: 0.11439876001104904 and parameters: {'hidden_dims': '[512, 64]', 'dropout': 0.4338375928678635, 'batch_norm': True, 'lr': 0.0009667920285641304, 'weight_decay': 6.976468597792388e-05, 'epochs': 294, 'loss': 'mae', 'optimizer': 'adam', 'use_snp_selection': False, 'weight_scheme': 'uniform', 'weight_clip_max': None}. Best is trial 6 with value: 0.13368144013261166.
[I 2026-04-21 18:19:16,536] Trial 38 finished with value: 0.17966463626956805 and parameters: {'hidden_dims': '[512, 64]', 'dropout': 0.27166831889132237, 'batch_norm': True, 'lr': 0.00020329069367818793, 'weight_decay': 0.0003339776578616859, 'epochs': 280, 'loss': 'mse', 'optimizer': 'sgd', 'use_snp_selection': False, 'weight_scheme': 'linear', 'weight_clip_max': 5.0, 'weight_linear_min_weight': 0.733102497270729, 'weight_linear_max_weight': 2.922141947069891}. Best is trial 15 with value: 0.22784091341196588.
[I 2026-04-21 18:19:17,275] Trial 11 finished with value: 0.0702324212083036 and parameters: {'hidden_dims': '[256, 128]', 'dropout': 0.009590830567787208, 'batch_norm': False, 'lr': 1.0272166034929754e-06, 'weight_decay': 6.639177970949987e-07, 'epochs': 50, 'loss': 'mae', 'optimizer': 'adam', 'use_snp_selection': True, 'num_snps': 57843, 'weight_scheme': 'minmax', 'weight_clip_max': 5.0, 'weight_minmax_eps': 0.011584305851229494}. Best is trial 6 with value: 0.13368144013261166.
[I 2026-04-21 18:19:33,237] Trial 12 finished with value: 0.11493441151275581 and parameters: {'hidden_dims': '[256, 64]', 'dropout': 0.0851395157391335, 'batch_norm': True, 'lr': 3.174224067518343e-06, 'weight_decay': 1.7200309243424394e-05, 'epochs': 221, 'loss': 'mae', 'optimizer': 'adam', 'use_snp_selection': False, 'weight_scheme': 'minmax', 'weight_clip_max': None, 'weight_minmax_eps': 0.19711170525101931}. Best is trial 6 with value: 0.13368144013261166.
[I 2026-04-21 18:19:47,512] Trial 13 finished with value: 0.157849987116606 and parameters: {'hidden_dims': '[256, 128]', 'dropout': 0.014105125164896815, 'batch_norm': False, 'lr': 4.388139282372581e-06, 'weight_decay': 1.7198099217695898e-07, 'epochs': 86, 'loss': 'mae', 'optimizer': 'adam', 'use_snp_selection': True, 'num_snps': 6999, 'weight_scheme': 'top-heavy', 'weight_clip_max': 5.0, 'weight_topheavy_top_frac': 0.48398486394237283, 'weight_topheavy_low': 0.5666436580870186, 'weight_topheavy_high': 5.961546164133656}. Best is trial 13 with value: 0.157849987116606.
[I 2026-04-21 18:19:53,341] Trial 39 finished with value: 0.1931887142568136 and parameters: {'hidden_dims': '[512, 64]', 'dropout': 0.2210215527515259, 'batch_norm': False, 'lr': 7.30344942075477e-05, 'weight_decay': 3.4537181560749928e-06, 'epochs': 282, 'loss': 'mse', 'optimizer': 'adam', 'use_snp_selection': False, 'weight_scheme': 'linear', 'weight_clip_max': 5.0, 'weight_linear_min_weight': 0.8193978707360713, 'weight_linear_max_weight': 2.996181415275289}. Best is trial 15 with value: 0.22784091341196588.
[I 2026-04-21 18:20:01,261] Trial 14 finished with value: 0.06467696652944023 and parameters: {'hidden_dims': '[256, 64]', 'dropout': 0.004604992563343272, 'batch_norm': True, 'lr': 6.720450407604876e-06, 'weight_decay': 8.351712916957603e-08, 'epochs': 186, 'loss': 'mae', 'optimizer': 'adam', 'use_snp_selection': False, 'weight_scheme': 'top-heavy', 'weight_clip_max': None, 'weight_topheavy_top_frac': 0.45150309351023465, 'weight_topheavy_low': 0.501144286437094, 'weight_topheavy_high': 5.935923097358641}. Best is trial 13 with value: 0.157849987116606.
