[I 2026-04-18 15:47:58,622] Trial 0 finished with value: 0.04759740913037055 and parameters: {'hidden_dims': '[256, 128]', 'dropout': 0.18584155530312246, 'batch_norm': True, 'lr': 9.012665953349533e-06, 'weight_decay': 4.96591963698479e-06, 'epochs': 105, 'loss': 'mse', 'optimizer': 'sgd', 'use_snp_selection': True, 'num_snps': 25583, 'weight_scheme': 'minmax', 'weight_clip_max': 5.0, 'weight_minmax_eps': 0.14026014881292506}. Best is trial 0 with value: 0.04759740913037055.
[I 2026-04-18 15:48:26,611] Trial 1 finished with value: 0.11613514534130757 and parameters: {'hidden_dims': '[256, 64]', 'dropout': 0.05000949662985405, 'batch_norm': True, 'lr': 0.00015647443054904835, 'weight_decay': 5.158896024962846e-05, 'epochs': 152, 'loss': 'mse', 'optimizer': 'sgd', 'use_snp_selection': False, 'weight_scheme': 'linear', 'weight_clip_max': None, 'weight_linear_min_weight': 0.21922985165550554, 'weight_linear_max_weight': 1.6260435767424388}. Best is trial 1 with value: 0.11613514534130757.
[I 2026-04-18 15:48:40,659] Trial 27 finished with value: 0.16518516386751317 and parameters: {'hidden_dims': '[256, 128]', 'dropout': 0.08380856166613451, 'batch_norm': False, 'lr': 2.710157817165008e-06, 'weight_decay': 2.7805350005271008e-06, 'epochs': 198, 'loss': 'mae', 'optimizer': 'adamw', 'use_snp_selection': True, 'num_snps': 32546, 'weight_scheme': 'uniform', 'weight_clip_max': 5.0}. Best is trial 8 with value: 0.18314114671235524.
[I 2026-04-18 15:49:10,003] Trial 2 finished with value: 0.09167810444645114 and parameters: {'hidden_dims': '[512, 128]', 'dropout': 0.2736730891340176, 'batch_norm': True, 'lr': 7.298114623433994e-05, 'weight_decay': 5.6346010385734023e-08, 'epochs': 185, 'loss': 'mae', 'optimizer': 'sgd', 'use_snp_selection': True, 'num_snps': 14091, 'weight_scheme': 'minmax', 'weight_clip_max': 10.0, 'weight_minmax_eps': 0.045780660776687306}. Best is trial 1 with value: 0.11613514534130757.
[I 2026-04-18 15:49:37,216] Trial 28 finished with value: 0.1657793987001176 and parameters: {'hidden_dims': '[256, 128]', 'dropout': 0.2111403113309487, 'batch_norm': False, 'lr': 6.000682120710622e-06, 'weight_decay': 3.456394328382416e-08, 'epochs': 127, 'loss': 'mae', 'optimizer': 'adam', 'use_snp_selection': True, 'num_snps': 49379, 'weight_scheme': 'uniform', 'weight_clip_max': 10.0}. Best is trial 8 with value: 0.18314114671235524.
[I 2026-04-18 15:50:21,700] Trial 29 finished with value: 0.10030345336257081 and parameters: {'hidden_dims': '[256, 128]', 'dropout': 0.30844991745539907, 'batch_norm': True, 'lr': 9.977724458923335e-06, 'weight_decay': 7.183812820019485e-06, 'epochs': 102, 'loss': 'mse', 'optimizer': 'adamw', 'use_snp_selection': True, 'num_snps': 31946, 'weight_scheme': 'minmax', 'weight_clip_max': None, 'weight_minmax_eps': 0.007332982440443431}. Best is trial 8 with value: 0.18314114671235524.
[I 2026-04-18 15:50:39,479] Trial 3 finished with value: 0.08690316743808692 and parameters: {'hidden_dims': '[512, 64]', 'dropout': 0.30157795416637295, 'batch_norm': False, 'lr': 2.007492282795256e-05, 'weight_decay': 5.496446859789657e-06, 'epochs': 284, 'loss': 'mse', 'optimizer': 'sgd', 'use_snp_selection': False, 'weight_scheme': 'linear', 'weight_clip_max': None, 'weight_linear_min_weight': 0.24682154527102826, 'weight_linear_max_weight': 1.8338910783134623}. Best is trial 1 with value: 0.11613514534130757.
[I 2026-04-18 15:51:06,531] Trial 4 finished with value: 0.20920078528954317 and parameters: {'hidden_dims': '[256, 64]', 'dropout': 0.18128694708490736, 'batch_norm': False, 'lr': 8.951826748007403e-05, 'weight_decay': 2.1781541495465197e-07, 'epochs': 147, 'loss': 'mse', 'optimizer': 'sgd', 'use_snp_selection': False, 'weight_scheme': 'top-heavy', 'weight_clip_max': 5.0, 'weight_topheavy_top_frac': 0.1724888194073277, 'weight_topheavy_low': 1.1620865802171172, 'weight_topheavy_high': 3.476906528073177}. Best is trial 4 with value: 0.20920078528954317.
[I 2026-04-18 15:51:19,325] Trial 30 finished with value: 0.15997685388239746 and parameters: {'hidden_dims': '[512, 128]', 'dropout': 0.5926625864111126, 'batch_norm': False, 'lr': 1.9754129750220507e-05, 'weight_decay': 2.6277446660773446e-07, 'epochs': 76, 'loss': 'mae', 'optimizer': 'adam', 'use_snp_selection': True, 'num_snps': 47228, 'weight_scheme': 'minmax', 'weight_clip_max': 5.0, 'weight_minmax_eps': 0.05320888886641972}. Best is trial 8 with value: 0.18314114671235524.
[I 2026-04-18 15:51:29,503] Trial 5 finished with value: 0.15106912830949973 and parameters: {'hidden_dims': '[256, 64]', 'dropout': 0.2571412946970998, 'batch_norm': True, 'lr': 3.546238022482882e-05, 'weight_decay': 1.0185234767613396e-06, 'epochs': 119, 'loss': 'mse', 'optimizer': 'sgd', 'use_snp_selection': False, 'weight_scheme': 'linear', 'weight_clip_max': 10.0, 'weight_linear_min_weight': 0.9405832045183805, 'weight_linear_max_weight': 3.413610925325811}. Best is trial 4 with value: 0.20920078528954317.
[I 2026-04-18 15:51:46,264] Trial 31 finished with value: 0.16722065241716794 and parameters: {'hidden_dims': '[512, 64]', 'dropout': 0.024470964995865825, 'batch_norm': False, 'lr': 0.0003163400666555659, 'weight_decay': 1.3061306513397727e-07, 'epochs': 70, 'loss': 'mae', 'optimizer': 'adam', 'use_snp_selection': False, 'weight_scheme': 'top-heavy', 'weight_clip_max': 5.0, 'weight_topheavy_top_frac': 0.2866481011193702, 'weight_topheavy_low': 0.8680654185975533, 'weight_topheavy_high': 3.5493112512503724}. Best is trial 8 with value: 0.18314114671235524.
[I 2026-04-18 15:52:12,182] Trial 6 finished with value: 0.2055908810161223 and parameters: {'hidden_dims': '[256, 64]', 'dropout': 0.037961443806696214, 'batch_norm': True, 'lr': 3.644202049829694e-05, 'weight_decay': 9.73334309820277e-06, 'epochs': 243, 'loss': 'mae', 'optimizer': 'adam', 'use_snp_selection': False, 'weight_scheme': 'minmax', 'weight_clip_max': None, 'weight_minmax_eps': 0.08689611239934374}. Best is trial 4 with value: 0.20920078528954317.
[I 2026-04-18 15:52:24,450] Trial 32 finished with value: 0.16315782485675642 and parameters: {'hidden_dims': '[512, 64]', 'dropout': 0.007103243772639943, 'batch_norm': False, 'lr': 0.00032056414278049046, 'weight_decay': 7.485314052689943e-07, 'epochs': 107, 'loss': 'mae', 'optimizer': 'adam', 'use_snp_selection': False, 'weight_scheme': 'top-heavy', 'weight_clip_max': 5.0, 'weight_topheavy_top_frac': 0.23217015525939616, 'weight_topheavy_low': 0.9097835951950451, 'weight_topheavy_high': 2.029896604504816}. Best is trial 8 with value: 0.18314114671235524.
[I 2026-04-18 15:52:56,857] Trial 33 finished with value: 0.13585166748135802 and parameters: {'hidden_dims': '[512, 64]', 'dropout': 0.059874171680922315, 'batch_norm': False, 'lr': 4.64730961241018e-05, 'weight_decay': 6.90146286602832e-08, 'epochs': 88, 'loss': 'mae', 'optimizer': 'adam', 'use_snp_selection': False, 'weight_scheme': 'top-heavy', 'weight_clip_max': 5.0, 'weight_topheavy_top_frac': 0.05473977339388855, 'weight_topheavy_low': 0.5864957319290272, 'weight_topheavy_high': 5.242708054589905}. Best is trial 8 with value: 0.18314114671235524.
[I 2026-04-18 15:53:21,686] Trial 34 finished with value: 0.13386191348433676 and parameters: {'hidden_dims': '[512, 64]', 'dropout': 0.0019513857828764858, 'batch_norm': True, 'lr': 0.00021383536145282595, 'weight_decay': 2.9248372514629955e-06, 'epochs': 63, 'loss': 'mse', 'optimizer': 'adam', 'use_snp_selection': False, 'weight_scheme': 'top-heavy', 'weight_clip_max': 5.0, 'weight_topheavy_top_frac': 0.3950288990916307, 'weight_topheavy_low': 1.026892628367289, 'weight_topheavy_high': 4.281097712791091}. Best is trial 8 with value: 0.18314114671235524.
[I 2026-04-18 15:53:37,917] Trial 7 finished with value: 0.0846911817884142 and parameters: {'hidden_dims': '[512, 128]', 'dropout': 0.1304538168539244, 'batch_norm': False, 'lr': 1.5408060926311233e-05, 'weight_decay': 2.1989735568314356e-08, 'epochs': 250, 'loss': 'mse', 'optimizer': 'sgd', 'use_snp_selection': True, 'num_snps': 42550, 'weight_scheme': 'exponential', 'weight_clip_max': 10.0, 'weight_exponential_beta': 2.758850226029358}. Best is trial 4 with value: 0.20920078528954317.
[I 2026-04-18 15:54:15,147] Trial 35 finished with value: 0.1544783254802859 and parameters: {'hidden_dims': '[256, 64]', 'dropout': 0.07847610066740161, 'batch_norm': False, 'lr': 1.2495785002978861e-05, 'weight_decay': 2.6521492439000907e-07, 'epochs': 150, 'loss': 'mae', 'optimizer': 'adam', 'use_snp_selection': True, 'num_snps': 40980, 'weight_scheme': 'linear', 'weight_clip_max': None, 'weight_linear_min_weight': 0.8970201107148463, 'weight_linear_max_weight': 3.971059638735451}. Best is trial 8 with value: 0.18314114671235524.
[I 2026-04-18 15:54:19,413] Trial 8 finished with value: 0.155826621386834 and parameters: {'hidden_dims': '[256, 128]', 'dropout': 0.05742396906738376, 'batch_norm': False, 'lr': 1.9761509510575143e-06, 'weight_decay': 2.933492239224291e-07, 'epochs': 82, 'loss': 'mae', 'optimizer': 'adam', 'use_snp_selection': True, 'num_snps': 29883, 'weight_scheme': 'minmax', 'weight_clip_max': 5.0, 'weight_minmax_eps': 0.0051288771726799584}. Best is trial 4 with value: 0.20920078528954317.
[I 2026-04-18 15:54:37,163] Trial 36 finished with value: 0.04833419442628898 and parameters: {'hidden_dims': '[256, 128]', 'dropout': 0.15269092253312563, 'batch_norm': False, 'lr': 5.644424882304939e-05, 'weight_decay': 3.954440506470654e-08, 'epochs': 113, 'loss': 'mse', 'optimizer': 'sgd', 'use_snp_selection': False, 'weight_scheme': 'linear', 'weight_clip_max': 5.0, 'weight_linear_min_weight': 0.5933912229816198, 'weight_linear_max_weight': 2.7436776520078707}. Best is trial 8 with value: 0.18314114671235524.
[I 2026-04-18 15:55:11,900] Trial 9 finished with value: 0.2022011001425706 and parameters: {'hidden_dims': '[256, 128]', 'dropout': 0.5795930447285386, 'batch_norm': False, 'lr': 0.00011782025260263196, 'weight_decay': 0.0005562063174273634, 'epochs': 218, 'loss': 'mae', 'optimizer': 'adamw', 'use_snp_selection': True, 'num_snps': 32226, 'weight_scheme': 'minmax', 'weight_clip_max': 5.0, 'weight_minmax_eps': 0.09600289105543994}. Best is trial 4 with value: 0.20920078528954317.
[I 2026-04-18 15:55:32,945] Trial 37 finished with value: 0.1358069877366295 and parameters: {'hidden_dims': '[512, 128]', 'dropout': 0.042498117854722205, 'batch_norm': True, 'lr': 8.03840522230795e-06, 'weight_decay': 1.0052993499944763e-07, 'epochs': 164, 'loss': 'mae', 'optimizer': 'adamw', 'use_snp_selection': False, 'weight_scheme': 'minmax', 'weight_clip_max': 10.0, 'weight_minmax_eps': 0.14973212975731748}. Best is trial 8 with value: 0.18314114671235524.
[I 2026-04-18 15:56:04,935] Trial 10 finished with value: 0.08012701651973805 and parameters: {'hidden_dims': '[512, 64]', 'dropout': 0.4338375928678635, 'batch_norm': False, 'lr': 0.0009667920285641304, 'weight_decay': 1.6238905019587032e-07, 'epochs': 156, 'loss': 'mse', 'optimizer': 'adamw', 'use_snp_selection': False, 'weight_scheme': 'top-heavy', 'weight_clip_max': 5.0, 'weight_topheavy_top_frac': 0.1655564683143657, 'weight_topheavy_low': 1.1713527187377861, 'weight_topheavy_high': 3.510875134959609}. Best is trial 4 with value: 0.20920078528954317.
[I 2026-04-18 15:56:23,679] Trial 38 finished with value: -0.055566590117884326 and parameters: {'hidden_dims': '[256, 64]', 'dropout': 0.2483976032892553, 'batch_norm': False, 'lr': 2.166709097453243e-05, 'weight_decay': 1.2858328036034488e-06, 'epochs': 51, 'loss': 'mae', 'optimizer': 'sgd', 'use_snp_selection': True, 'num_snps': 56356, 'weight_scheme': 'exponential', 'weight_clip_max': 5.0, 'weight_exponential_beta': 7.887640538040634}. Best is trial 8 with value: 0.18314114671235524.
[I 2026-04-18 15:56:44,403] Trial 11 finished with value: 0.21923586567862915 and parameters: {'hidden_dims': '[256, 64]', 'dropout': 0.012566753472985293, 'batch_norm': True, 'lr': 0.00041602458624906413, 'weight_decay': 4.7666069391840636e-05, 'epochs': 223, 'loss': 'mae', 'optimizer': 'adam', 'use_snp_selection': False, 'weight_scheme': 'uniform', 'weight_clip_max': None}. Best is trial 11 with value: 0.21923586567862915.
[I 2026-04-18 15:57:19,556] Trial 12 finished with value: 0.1890511701151295 and parameters: {'hidden_dims': '[256, 64]', 'dropout': 0.146620035528068, 'batch_norm': True, 'lr': 0.0005921341375658096, 'weight_decay': 8.833416210863743e-05, 'epochs': 195, 'loss': 'mae', 'optimizer': 'adam', 'use_snp_selection': False, 'weight_scheme': 'uniform', 'weight_clip_max': None}. Best is trial 11 with value: 0.21923586567862915.
[I 2026-04-18 15:57:45,974] Trial 13 finished with value: 0.18556841644299094 and parameters: {'hidden_dims': '[256, 64]', 'dropout': 0.3946508459297612, 'batch_norm': False, 'lr': 0.00034896056308154135, 'weight_decay': 3.726044378944049e-05, 'epochs': 139, 'loss': 'mae', 'optimizer': 'adam', 'use_snp_selection': False, 'weight_scheme': 'top-heavy', 'weight_clip_max': None, 'weight_topheavy_top_frac': 0.3723183354868327, 'weight_topheavy_low': 1.0223954166266562, 'weight_topheavy_high': 1.6569850840252704}. Best is trial 11 with value: 0.21923586567862915.
[I 2026-04-18 15:57:57,725] Trial 39 finished with value: 0.1370270991324351 and parameters: {'hidden_dims': '[512, 64]', 'dropout': 0.16269263700579942, 'batch_norm': True, 'lr': 1.9743947292567704e-06, 'weight_decay': 2.1745137500407536e-07, 'epochs': 289, 'loss': 'mse', 'optimizer': 'adam', 'use_snp_selection': False, 'weight_scheme': 'top-heavy', 'weight_clip_max': None, 'weight_topheavy_top_frac': 0.17867112610349528, 'weight_topheavy_low': 0.7178085478484688, 'weight_topheavy_high': 2.6248335258396525}. Best is trial 8 with value: 0.18314114671235524.
[I 2026-04-18 15:58:37,444] Trial 14 finished with value: 0.2140413583754633 and parameters: {'hidden_dims': '[256, 64]', 'dropout': 0.12599388122585703, 'batch_norm': True, 'lr': 0.00019328892806934797, 'weight_decay': 0.0006478099506244089, 'epochs': 299, 'loss': 'mse', 'optimizer': 'adam', 'use_snp_selection': False, 'weight_scheme': 'uniform', 'weight_clip_max': 5.0}. Best is trial 11 with value: 0.21923586567862915.
[I 2026-04-18 15:59:06,569] Trial 0 finished with value: 0.03284566162944197 and parameters: {'hidden_dims': '[256, 128]', 'dropout': 0.18584155530312246, 'batch_norm': True, 'lr': 9.012665953349533e-06, 'weight_decay': 4.96591963698479e-06, 'epochs': 105, 'loss': 'mse', 'optimizer': 'sgd', 'use_snp_selection': True, 'num_snps': 25583, 'weight_scheme': 'minmax', 'weight_clip_max': 5.0, 'weight_minmax_eps': 0.14026014881292506}. Best is trial 0 with value: 0.03284566162944197.
[I 2026-04-18 15:59:27,175] Trial 15 finished with value: 0.22258311507391132 and parameters: {'hidden_dims': '[256, 64]', 'dropout': 0.002417289791742272, 'batch_norm': True, 'lr': 0.0003146113636154284, 'weight_decay': 0.0007391870837661021, 'epochs': 289, 'loss': 'mae', 'optimizer': 'adam', 'use_snp_selection': False, 'weight_scheme': 'uniform', 'weight_clip_max': 5.0}. Best is trial 15 with value: 0.22258311507391132.
[I 2026-04-18 15:59:33,543] Trial 1 finished with value: 0.12083277743002194 and parameters: {'hidden_dims': '[256, 64]', 'dropout': 0.05000949662985405, 'batch_norm': True, 'lr': 0.00015647443054904835, 'weight_decay': 5.158896024962846e-05, 'epochs': 152, 'loss': 'mse', 'optimizer': 'sgd', 'use_snp_selection': False, 'weight_scheme': 'linear', 'weight_clip_max': None, 'weight_linear_min_weight': 0.21922985165550554, 'weight_linear_max_weight': 1.6260435767424388}. Best is trial 1 with value: 0.12083277743002194.
[I 2026-04-18 16:00:13,066] Trial 16 finished with value: 0.2076754189177646 and parameters: {'hidden_dims': '[256, 64]', 'dropout': 0.0042019672727627855, 'batch_norm': True, 'lr': 0.00034143904920266204, 'weight_decay': 0.0001409005526083406, 'epochs': 264, 'loss': 'mae', 'optimizer': 'adam', 'use_snp_selection': False, 'weight_scheme': 'uniform', 'weight_clip_max': None}. Best is trial 15 with value: 0.22258311507391132.
[I 2026-04-18 16:00:14,870] Trial 2 finished with value: 0.09652995341795031 and parameters: {'hidden_dims': '[512, 128]', 'dropout': 0.2736730891340176, 'batch_norm': True, 'lr': 7.298114623433994e-05, 'weight_decay': 5.6346010385734023e-08, 'epochs': 185, 'loss': 'mae', 'optimizer': 'sgd', 'use_snp_selection': True, 'num_snps': 14091, 'weight_scheme': 'minmax', 'weight_clip_max': 10.0, 'weight_minmax_eps': 0.045780660776687306}. Best is trial 1 with value: 0.12083277743002194.
[I 2026-04-18 16:01:26,359] Trial 17 finished with value: 0.17942443942444689 and parameters: {'hidden_dims': '[512, 128]', 'dropout': 0.10616181967384387, 'batch_norm': True, 'lr': 5.597569864798512e-06, 'weight_decay': 0.0002638916847307817, 'epochs': 222, 'loss': 'mae', 'optimizer': 'adam', 'use_snp_selection': False, 'weight_scheme': 'uniform', 'weight_clip_max': 5.0}. Best is trial 15 with value: 0.22258311507391132.
[I 2026-04-18 16:01:40,270] Trial 3 finished with value: 0.09575631001493991 and parameters: {'hidden_dims': '[512, 64]', 'dropout': 0.30157795416637295, 'batch_norm': False, 'lr': 2.007492282795256e-05, 'weight_decay': 5.496446859789657e-06, 'epochs': 284, 'loss': 'mse', 'optimizer': 'sgd', 'use_snp_selection': False, 'weight_scheme': 'linear', 'weight_clip_max': None, 'weight_linear_min_weight': 0.24682154527102826, 'weight_linear_max_weight': 1.8338910783134623}. Best is trial 1 with value: 0.12083277743002194.
[I 2026-04-18 16:01:48,023] Trial 18 finished with value: 0.20935432349413435 and parameters: {'hidden_dims': '[512, 64]', 'dropout': 0.002670718560558526, 'batch_norm': True, 'lr': 0.0004092170259335199, 'weight_decay': 1.811149521079738e-05, 'epochs': 53, 'loss': 'mae', 'optimizer': 'adam', 'use_snp_selection': False, 'weight_scheme': 'uniform', 'weight_clip_max': None}. Best is trial 15 with value: 0.22258311507391132.
[I 2026-04-18 16:02:06,337] Trial 4 finished with value: 0.11136158969393821 and parameters: {'hidden_dims': '[256, 64]', 'dropout': 0.18128694708490736, 'batch_norm': False, 'lr': 8.951826748007403e-05, 'weight_decay': 2.1781541495465197e-07, 'epochs': 147, 'loss': 'mse', 'optimizer': 'sgd', 'use_snp_selection': False, 'weight_scheme': 'top-heavy', 'weight_clip_max': 5.0, 'weight_topheavy_top_frac': 0.1724888194073277, 'weight_topheavy_low': 1.1620865802171172, 'weight_topheavy_high': 3.476906528073177}. Best is trial 1 with value: 0.12083277743002194.
[I 2026-04-18 16:02:28,577] Trial 5 finished with value: 0.09696117956275342 and parameters: {'hidden_dims': '[256, 64]', 'dropout': 0.2571412946970998, 'batch_norm': True, 'lr': 3.546238022482882e-05, 'weight_decay': 1.0185234767613396e-06, 'epochs': 119, 'loss': 'mse', 'optimizer': 'sgd', 'use_snp_selection': False, 'weight_scheme': 'linear', 'weight_clip_max': 10.0, 'weight_linear_min_weight': 0.9405832045183805, 'weight_linear_max_weight': 3.413610925325811}. Best is trial 1 with value: 0.12083277743002194.
[I 2026-04-18 16:02:35,079] Trial 19 finished with value: 0.2019947224056823 and parameters: {'hidden_dims': '[256, 64]', 'dropout': 0.5512798602350959, 'batch_norm': True, 'lr': 0.0008983248011541679, 'weight_decay': 0.0008762009477422267, 'epochs': 272, 'loss': 'mae', 'optimizer': 'adamw', 'use_snp_selection': False, 'weight_scheme': 'exponential', 'weight_clip_max': 10.0, 'weight_exponential_beta': 7.77902467877072}. Best is trial 15 with value: 0.22258311507391132.
[I 2026-04-18 16:03:09,799] Trial 6 finished with value: 0.16356938308738572 and parameters: {'hidden_dims': '[256, 64]', 'dropout': 0.037961443806696214, 'batch_norm': True, 'lr': 3.644202049829694e-05, 'weight_decay': 9.73334309820277e-06, 'epochs': 243, 'loss': 'mae', 'optimizer': 'adam', 'use_snp_selection': False, 'weight_scheme': 'minmax', 'weight_clip_max': None, 'weight_minmax_eps': 0.08689611239934374}. Best is trial 6 with value: 0.16356938308738572.
[I 2026-04-18 16:03:12,067] Trial 20 finished with value: 0.20239971714726845 and parameters: {'hidden_dims': '[256, 64]', 'dropout': 0.35839775342032926, 'batch_norm': True, 'lr': 0.00023713694301425722, 'weight_decay': 1.2918807082627144e-06, 'epochs': 207, 'loss': 'mae', 'optimizer': 'adam', 'use_snp_selection': False, 'weight_scheme': 'uniform', 'weight_clip_max': None}. Best is trial 15 with value: 0.22258311507391132.
[I 2026-04-18 16:04:02,934] Trial 21 finished with value: 0.1989819474021895 and parameters: {'hidden_dims': '[256, 64]', 'dropout': 0.09702508070920501, 'batch_norm': True, 'lr': 0.00019345241035879408, 'weight_decay': 0.0003149760986138051, 'epochs': 296, 'loss': 'mse', 'optimizer': 'adam', 'use_snp_selection': False, 'weight_scheme': 'uniform', 'weight_clip_max': 5.0}. Best is trial 15 with value: 0.22258311507391132.
[I 2026-04-18 16:04:32,200] Trial 7 finished with value: 0.05479181305216478 and parameters: {'hidden_dims': '[512, 128]', 'dropout': 0.1304538168539244, 'batch_norm': False, 'lr': 1.5408060926311233e-05, 'weight_decay': 2.1989735568314356e-08, 'epochs': 250, 'loss': 'mse', 'optimizer': 'sgd', 'use_snp_selection': True, 'num_snps': 42550, 'weight_scheme': 'exponential', 'weight_clip_max': 10.0, 'weight_exponential_beta': 2.758850226029358}. Best is trial 6 with value: 0.16356938308738572.
[I 2026-04-18 16:04:53,839] Trial 22 finished with value: 0.21099950253830474 and parameters: {'hidden_dims': '[256, 64]', 'dropout': 0.07726021452571541, 'batch_norm': True, 'lr': 7.35963495969492e-05, 'weight_decay': 0.0008607227223592576, 'epochs': 296, 'loss': 'mae', 'optimizer': 'adam', 'use_snp_selection': False, 'weight_scheme': 'uniform', 'weight_clip_max': 5.0}. Best is trial 15 with value: 0.22258311507391132.
