[I 2026-04-21 19:20:26,799] Trial 22 finished with value: 0.10514417658216253 and parameters: {'hidden_dims': '[512, 128]', 'dropout': 0.22473760354567426, 'batch_norm': False, 'lr': 0.00033659441197671225, 'weight_decay': 0.0009938307879359654, 'epochs': 275, 'loss': 'mae', 'optimizer': 'adamw', 'use_snp_selection': False, 'weight_scheme': 'exponential', 'weight_clip_max': None, 'weight_exponential_beta': 7.803035226517436}. Best is trial 22 with value: 0.10514417658216253.
[I 2026-04-21 19:20:44,737] Trial 18 finished with value: 0.17772092506685686 and parameters: {'hidden_dims': '[512, 64]', 'dropout': 0.5695431295018886, 'batch_norm': True, 'lr': 4.127720429081454e-05, 'weight_decay': 7.68992102416835e-05, 'epochs': 219, 'loss': 'mae', 'optimizer': 'adam', 'use_snp_selection': True, 'num_snps': 17494, 'weight_scheme': 'minmax', 'weight_clip_max': None, 'weight_minmax_eps': 0.05825428845536241}. Best is trial 6 with value: 0.1856241360339532.
[I 2026-04-21 19:21:05,432] Trial 23 finished with value: 0.07334313115454114 and parameters: {'hidden_dims': '[512, 128]', 'dropout': 0.20552964476150845, 'batch_norm': False, 'lr': 0.00020444974510040446, 'weight_decay': 0.00023758917986901114, 'epochs': 287, 'loss': 'mae', 'optimizer': 'adamw', 'use_snp_selection': False, 'weight_scheme': 'exponential', 'weight_clip_max': None, 'weight_exponential_beta': 5.237860606372429}. Best is trial 22 with value: 0.10514417658216253.
[I 2026-04-21 19:21:20,584] Trial 19 finished with value: 0.1621505350194418 and parameters: {'hidden_dims': '[512, 64]', 'dropout': 0.49526566084459034, 'batch_norm': False, 'lr': 0.00031457451268752625, 'weight_decay': 1.501374277892819e-05, 'epochs': 256, 'loss': 'mae', 'optimizer': 'adamw', 'use_snp_selection': False, 'weight_scheme': 'uniform', 'weight_clip_max': 10.0}. Best is trial 6 with value: 0.1856241360339532.
[I 2026-04-21 19:21:37,103] Trial 24 finished with value: 0.07995220335826475 and parameters: {'hidden_dims': '[512, 128]', 'dropout': 0.31549610899369157, 'batch_norm': False, 'lr': 0.0005513841229383978, 'weight_decay': 0.000190139676947789, 'epochs': 232, 'loss': 'mae', 'optimizer': 'adamw', 'use_snp_selection': False, 'weight_scheme': 'exponential', 'weight_clip_max': None, 'weight_exponential_beta': 6.182424356950991}. Best is trial 22 with value: 0.10514417658216253.
[I 2026-04-21 19:21:50,520] Trial 20 finished with value: 0.18901444022294756 and parameters: {'hidden_dims': '[512, 64]', 'dropout': 0.387069517559059, 'batch_norm': False, 'lr': 1.066687871792931e-05, 'weight_decay': 0.00021265556909062138, 'epochs': 202, 'loss': 'mae', 'optimizer': 'adam', 'use_snp_selection': False, 'weight_scheme': 'top-heavy', 'weight_clip_max': None, 'weight_topheavy_top_frac': 0.06438924599073062, 'weight_topheavy_low': 0.9401698370890014, 'weight_topheavy_high': 1.9636134277662323}. Best is trial 20 with value: 0.18901444022294756.
[I 2026-04-21 19:22:14,976] Trial 25 finished with value: 0.015343600330004786 and parameters: {'hidden_dims': '[512, 128]', 'dropout': 0.36420898111050415, 'batch_norm': False, 'lr': 0.0006004107455221032, 'weight_decay': 2.25460848498713e-05, 'epochs': 284, 'loss': 'mae', 'optimizer': 'adamw', 'use_snp_selection': False, 'weight_scheme': 'uniform', 'weight_clip_max': None}. Best is trial 22 with value: 0.10514417658216253.
[I 2026-04-21 19:22:20,512] Trial 21 finished with value: 0.1739118221743571 and parameters: {'hidden_dims': '[512, 64]', 'dropout': 0.4167457555345565, 'batch_norm': False, 'lr': 1.0604289514674176e-05, 'weight_decay': 0.00019834418096328037, 'epochs': 202, 'loss': 'mae', 'optimizer': 'adam', 'use_snp_selection': False, 'weight_scheme': 'top-heavy', 'weight_clip_max': None, 'weight_topheavy_top_frac': 0.05611670442750766, 'weight_topheavy_low': 0.9459557436154625, 'weight_topheavy_high': 1.2077983591035168}. Best is trial 20 with value: 0.18901444022294756.
[I 2026-04-21 19:22:51,428] Trial 26 finished with value: 0.00803111384061479 and parameters: {'hidden_dims': '[512, 128]', 'dropout': 0.15688302097492154, 'batch_norm': False, 'lr': 6.68448398799366e-05, 'weight_decay': 2.8918256867512117e-05, 'epochs': 271, 'loss': 'mae', 'optimizer': 'adamw', 'use_snp_selection': False, 'weight_scheme': 'exponential', 'weight_clip_max': 10.0, 'weight_exponential_beta': 0.40043463387830336}. Best is trial 22 with value: 0.10514417658216253.
[I 2026-04-21 19:22:54,359] Trial 22 finished with value: 0.18054135121231374 and parameters: {'hidden_dims': '[512, 64]', 'dropout': 0.4983214099914036, 'batch_norm': False, 'lr': 4.746752643438106e-05, 'weight_decay': 1.4802336025418313e-05, 'epochs': 237, 'loss': 'mae', 'optimizer': 'adam', 'use_snp_selection': False, 'weight_scheme': 'top-heavy', 'weight_clip_max': None, 'weight_topheavy_top_frac': 0.32798876890307904, 'weight_topheavy_low': 0.8317341945423252, 'weight_topheavy_high': 1.5636692556119267}. Best is trial 20 with value: 0.18901444022294756.
[I 2026-04-21 19:23:19,121] Trial 27 finished with value: 0.09080711104747803 and parameters: {'hidden_dims': '[512, 64]', 'dropout': 0.24217678256743894, 'batch_norm': False, 'lr': 0.0002059851513160924, 'weight_decay': 0.0003304922014150719, 'epochs': 200, 'loss': 'mae', 'optimizer': 'adamw', 'use_snp_selection': False, 'weight_scheme': 'exponential', 'weight_clip_max': None, 'weight_exponential_beta': 6.676310947781584}. Best is trial 22 with value: 0.10514417658216253.
[I 2026-04-21 19:23:32,675] Trial 23 finished with value: 0.16631319200913985 and parameters: {'hidden_dims': '[512, 64]', 'dropout': 0.3412580643280937, 'batch_norm': False, 'lr': 2.211001753923586e-05, 'weight_decay': 0.00018410569957686874, 'epochs': 268, 'loss': 'mae', 'optimizer': 'adam', 'use_snp_selection': False, 'weight_scheme': 'top-heavy', 'weight_clip_max': None, 'weight_topheavy_top_frac': 0.3550607898088277, 'weight_topheavy_low': 0.8414277863867716, 'weight_topheavy_high': 1.3405310266144503}. Best is trial 20 with value: 0.18901444022294756.
[I 2026-04-21 19:23:51,592] Trial 28 finished with value: 0.07314905199505177 and parameters: {'hidden_dims': '[512, 128]', 'dropout': 0.34110556356871735, 'batch_norm': False, 'lr': 0.00045907918129208024, 'weight_decay': 0.0001340965759136047, 'epochs': 240, 'loss': 'mae', 'optimizer': 'adamw', 'use_snp_selection': False, 'weight_scheme': 'exponential', 'weight_clip_max': None, 'weight_exponential_beta': 4.039965717889794}. Best is trial 22 with value: 0.10514417658216253.
[I 2026-04-21 19:24:07,312] Trial 24 finished with value: 0.17176406433917044 and parameters: {'hidden_dims': '[512, 64]', 'dropout': 0.5099693013188675, 'batch_norm': False, 'lr': 1.0702262926708443e-05, 'weight_decay': 3.582938603786336e-05, 'epochs': 237, 'loss': 'mae', 'optimizer': 'adam', 'use_snp_selection': False, 'weight_scheme': 'top-heavy', 'weight_clip_max': None, 'weight_topheavy_top_frac': 0.29347465424257135, 'weight_topheavy_low': 0.8497854825627323, 'weight_topheavy_high': 2.7850845033337115}. Best is trial 20 with value: 0.18901444022294756.
[I 2026-04-21 19:24:15,561] Trial 29 finished with value: 0.008440766023266525 and parameters: {'hidden_dims': '[512, 128]', 'dropout': 0.18898398369186747, 'batch_norm': False, 'lr': 2.1292627949842534e-05, 'weight_decay': 0.0009228074649257511, 'epochs': 168, 'loss': 'mse', 'optimizer': 'adamw', 'use_snp_selection': False, 'weight_scheme': 'uniform', 'weight_clip_max': None}. Best is trial 22 with value: 0.10514417658216253.
[I 2026-04-21 19:24:21,172] Trial 25 finished with value: 0.18773801094336795 and parameters: {'hidden_dims': '[256, 64]', 'dropout': 0.4334059480319356, 'batch_norm': False, 'lr': 6.4752033278166145e-06, 'weight_decay': 2.8273717018375123e-06, 'epochs': 163, 'loss': 'mae', 'optimizer': 'adam', 'use_snp_selection': False, 'weight_scheme': 'top-heavy', 'weight_clip_max': None, 'weight_topheavy_top_frac': 0.17661100748053804, 'weight_topheavy_low': 0.9952861761206544, 'weight_topheavy_high': 2.1751213502169335}. Best is trial 20 with value: 0.18901444022294756.
[I 2026-04-21 19:24:34,848] Trial 26 finished with value: 0.16243659337167643 and parameters: {'hidden_dims': '[256, 64]', 'dropout': 0.3997062430594493, 'batch_norm': True, 'lr': 6.910774336205933e-06, 'weight_decay': 2.438955674824449e-06, 'epochs': 160, 'loss': 'mae', 'optimizer': 'adamw', 'use_snp_selection': False, 'weight_scheme': 'top-heavy', 'weight_clip_max': None, 'weight_topheavy_top_frac': 0.07243858083282859, 'weight_topheavy_low': 1.045270618932825, 'weight_topheavy_high': 2.5821175881942855}. Best is trial 20 with value: 0.18901444022294756.
[I 2026-04-21 19:24:49,134] Trial 27 finished with value: 0.18312458556882164 and parameters: {'hidden_dims': '[256, 64]', 'dropout': 0.33404725874409036, 'batch_norm': False, 'lr': 6.338393324940553e-06, 'weight_decay': 2.5200478098692215e-06, 'epochs': 170, 'loss': 'mae', 'optimizer': 'adam', 'use_snp_selection': False, 'weight_scheme': 'top-heavy', 'weight_clip_max': None, 'weight_topheavy_top_frac': 0.1753611507957734, 'weight_topheavy_low': 1.0331330145204483, 'weight_topheavy_high': 2.566434822717512}. Best is trial 20 with value: 0.18901444022294756.
[I 2026-04-21 19:24:53,926] Trial 30 finished with value: 0.07916952393049667 and parameters: {'hidden_dims': '[512, 128]', 'dropout': 0.08682814356630056, 'batch_norm': False, 'lr': 9.540835086988968e-06, 'weight_decay': 1.1795869330846555e-06, 'epochs': 279, 'loss': 'mae', 'optimizer': 'adamw', 'use_snp_selection': False, 'weight_scheme': 'exponential', 'weight_clip_max': 10.0, 'weight_exponential_beta': 7.998131415117266}. Best is trial 22 with value: 0.10514417658216253.
[I 2026-04-21 19:25:01,515] Trial 28 finished with value: 0.16124105487494822 and parameters: {'hidden_dims': '[256, 64]', 'dropout': 0.44248113120842825, 'batch_norm': True, 'lr': 2.3864569886887386e-05, 'weight_decay': 0.00017161210224249404, 'epochs': 141, 'loss': 'mae', 'optimizer': 'adam', 'use_snp_selection': False, 'weight_scheme': 'exponential', 'weight_clip_max': None, 'weight_exponential_beta': 0.2169737340046498}. Best is trial 20 with value: 0.18901444022294756.
[I 2026-04-21 19:25:17,564] Trial 29 finished with value: 0.17837718862552254 and parameters: {'hidden_dims': '[256, 64]', 'dropout': 0.23274706043026666, 'batch_norm': True, 'lr': 1.3194829836317959e-05, 'weight_decay': 0.0009175839939248457, 'epochs': 195, 'loss': 'mse', 'optimizer': 'adam', 'use_snp_selection': False, 'weight_scheme': 'top-heavy', 'weight_clip_max': None, 'weight_topheavy_top_frac': 0.17614172714521176, 'weight_topheavy_low': 0.706335020441248, 'weight_topheavy_high': 4.823451245952377}. Best is trial 20 with value: 0.18901444022294756.
[I 2026-04-21 19:25:28,870] Trial 30 finished with value: 0.19052977374575297 and parameters: {'hidden_dims': '[256, 64]', 'dropout': 0.3306976590250042, 'batch_norm': False, 'lr': 1.7938091592077064e-06, 'weight_decay': 4.214178285104862e-06, 'epochs': 126, 'loss': 'mae', 'optimizer': 'adamw', 'use_snp_selection': False, 'weight_scheme': 'top-heavy', 'weight_clip_max': None, 'weight_topheavy_top_frac': 0.12672552429588876, 'weight_topheavy_low': 0.995136398162155, 'weight_topheavy_high': 2.118673406540468}. Best is trial 30 with value: 0.19052977374575297.
[I 2026-04-21 19:25:33,906] Trial 31 finished with value: 0.10133482637192519 and parameters: {'hidden_dims': '[512, 128]', 'dropout': 0.211853589512504, 'batch_norm': False, 'lr': 0.0002558388339267223, 'weight_decay': 0.0009751318074070424, 'epochs': 300, 'loss': 'mae', 'optimizer': 'adamw', 'use_snp_selection': False, 'weight_scheme': 'exponential', 'weight_clip_max': None, 'weight_exponential_beta': 7.06353843623617}. Best is trial 22 with value: 0.10514417658216253.
[I 2026-04-21 19:25:40,628] Trial 31 finished with value: 0.155548477678524 and parameters: {'hidden_dims': '[256, 64]', 'dropout': 0.3635180896739939, 'batch_norm': False, 'lr': 2.02693309040495e-06, 'weight_decay': 5.81696355605038e-06, 'epochs': 133, 'loss': 'mae', 'optimizer': 'adamw', 'use_snp_selection': False, 'weight_scheme': 'top-heavy', 'weight_clip_max': None, 'weight_topheavy_top_frac': 0.12574940198717788, 'weight_topheavy_low': 1.0012867331522384, 'weight_topheavy_high': 2.1310102095167642}. Best is trial 30 with value: 0.19052977374575297.
[I 2026-04-21 19:25:51,542] Trial 32 finished with value: 0.2055267647358514 and parameters: {'hidden_dims': '[256, 64]', 'dropout': 0.2955239360290975, 'batch_norm': False, 'lr': 2.2557882393126584e-06, 'weight_decay': 4.353529223905852e-06, 'epochs': 120, 'loss': 'mae', 'optimizer': 'adamw', 'use_snp_selection': False, 'weight_scheme': 'top-heavy', 'weight_clip_max': None, 'weight_topheavy_top_frac': 0.1197613483861116, 'weight_topheavy_low': 1.1689830441359281, 'weight_topheavy_high': 3.4198090309553755}. Best is trial 32 with value: 0.2055267647358514.
[I 2026-04-21 19:26:01,299] Trial 33 finished with value: 0.15354264136689408 and parameters: {'hidden_dims': '[256, 64]', 'dropout': 0.4545137724646128, 'batch_norm': False, 'lr': 2.048880783560766e-06, 'weight_decay': 1.8723782508730919e-06, 'epochs': 102, 'loss': 'mae', 'optimizer': 'adamw', 'use_snp_selection': False, 'weight_scheme': 'top-heavy', 'weight_clip_max': None, 'weight_topheavy_top_frac': 0.11573752247136238, 'weight_topheavy_low': 1.1737876083376333, 'weight_topheavy_high': 3.46776017477018}. Best is trial 32 with value: 0.2055267647358514.
[I 2026-04-21 19:26:11,874] Trial 34 finished with value: 0.18022724484591368 and parameters: {'hidden_dims': '[256, 64]', 'dropout': 0.324144811558956, 'batch_norm': False, 'lr': 3.253171499974134e-06, 'weight_decay': 4.895909434993597e-06, 'epochs': 115, 'loss': 'mse', 'optimizer': 'adamw', 'use_snp_selection': False, 'weight_scheme': 'top-heavy', 'weight_clip_max': None, 'weight_topheavy_top_frac': 0.2214075605502345, 'weight_topheavy_low': 0.953224174521009, 'weight_topheavy_high': 1.9714129611693463}. Best is trial 32 with value: 0.2055267647358514.
[I 2026-04-21 19:26:13,713] Trial 32 finished with value: 0.08746604698236386 and parameters: {'hidden_dims': '[512, 128]', 'dropout': 0.2259982340774504, 'batch_norm': False, 'lr': 0.00012943704504718944, 'weight_decay': 0.00037789626641159386, 'epochs': 298, 'loss': 'mae', 'optimizer': 'adamw', 'use_snp_selection': False, 'weight_scheme': 'exponential', 'weight_clip_max': None, 'weight_exponential_beta': 6.741728397453792}. Best is trial 22 with value: 0.10514417658216253.
[I 2026-04-21 19:26:37,848] Trial 35 finished with value: 0.1804342576447159 and parameters: {'hidden_dims': '[512, 128]', 'dropout': 0.2789512290513981, 'batch_norm': False, 'lr': 6.682221708652372e-06, 'weight_decay': 3.406431851973037e-05, 'epochs': 171, 'loss': 'mae', 'optimizer': 'adamw', 'use_snp_selection': False, 'weight_scheme': 'linear', 'weight_clip_max': 10.0, 'weight_linear_min_weight': 0.9625934857441871, 'weight_linear_max_weight': 3.8627957319733683}. Best is trial 32 with value: 0.2055267647358514.
[I 2026-04-21 19:26:49,732] Trial 36 finished with value: 0.1942876124561236 and parameters: {'hidden_dims': '[256, 64]', 'dropout': 0.3770595535535422, 'batch_norm': False, 'lr': 2.7803511193332832e-06, 'weight_decay': 4.8352593901201706e-08, 'epochs': 134, 'loss': 'mse', 'optimizer': 'adamw', 'use_snp_selection': False, 'weight_scheme': 'top-heavy', 'weight_clip_max': None, 'weight_topheavy_top_frac': 0.10578994320803191, 'weight_topheavy_low': 1.1130198506600897, 'weight_topheavy_high': 2.165505880305605}. Best is trial 32 with value: 0.2055267647358514.
[I 2026-04-21 19:26:53,300] Trial 33 finished with value: 0.09734757745533552 and parameters: {'hidden_dims': '[512, 128]', 'dropout': 0.27340374632674463, 'batch_norm': False, 'lr': 0.00022794888822405215, 'weight_decay': 5.962750434997923e-05, 'epochs': 297, 'loss': 'mae', 'optimizer': 'adamw', 'use_snp_selection': False, 'weight_scheme': 'exponential', 'weight_clip_max': None, 'weight_exponential_beta': 6.973376686902527}. Best is trial 22 with value: 0.10514417658216253.
[I 2026-04-21 19:27:00,975] Trial 37 finished with value: 0.17111934814378835 and parameters: {'hidden_dims': '[256, 64]', 'dropout': 0.24367665923877935, 'batch_norm': False, 'lr': 1.87154583413214e-06, 'weight_decay': 1.0093592747243959e-07, 'epochs': 124, 'loss': 'mse', 'optimizer': 'adamw', 'use_snp_selection': False, 'weight_scheme': 'top-heavy', 'weight_clip_max': None, 'weight_topheavy_top_frac': 0.10767434602933482, 'weight_topheavy_low': 1.108536469148443, 'weight_topheavy_high': 3.0454658167214044}. Best is trial 32 with value: 0.2055267647358514.
[I 2026-04-21 19:27:10,462] Trial 38 finished with value: 0.20955121560250192 and parameters: {'hidden_dims': '[256, 64]', 'dropout': 0.29868907010294066, 'batch_norm': False, 'lr': 1.5777647515714437e-06, 'weight_decay': 3.454983670124758e-08, 'epochs': 98, 'loss': 'mse', 'optimizer': 'adamw', 'use_snp_selection': False, 'weight_scheme': 'linear', 'weight_clip_max': 10.0, 'weight_linear_min_weight': 0.589123322689787, 'weight_linear_max_weight': 2.58210754096957}. Best is trial 38 with value: 0.20955121560250192.
[I 2026-04-21 19:27:19,942] Trial 39 finished with value: 0.1593247348969828 and parameters: {'hidden_dims': '[256, 64]', 'dropout': 0.212242525647325, 'batch_norm': False, 'lr': 1.5043935543430806e-06, 'weight_decay': 4.764022859766007e-08, 'epochs': 98, 'loss': 'mse', 'optimizer': 'adamw', 'use_snp_selection': False, 'weight_scheme': 'linear', 'weight_clip_max': 10.0, 'weight_linear_min_weight': 0.593133596016567, 'weight_linear_max_weight': 2.66574881425109}. Best is trial 38 with value: 0.20955121560250192.
[I 2026-04-21 19:27:29,770] Trial 34 finished with value: 0.02613433970392544 and parameters: {'hidden_dims': '[512, 128]', 'dropout': 0.16144892099989194, 'batch_norm': False, 'lr': 0.00014485592185306466, 'weight_decay': 0.0009764628609172725, 'epochs': 271, 'loss': 'mse', 'optimizer': 'adamw', 'use_snp_selection': False, 'weight_scheme': 'linear', 'weight_clip_max': None, 'weight_linear_min_weight': 0.9470017544340705, 'weight_linear_max_weight': 3.936260204993686}. Best is trial 22 with value: 0.10514417658216253.
[I 2026-04-21 19:28:03,766] Trial 0 finished with value: -0.019573290606087482 and parameters: {'hidden_dims': '[256, 128]', 'dropout': 0.18584155530312246, 'batch_norm': True, 'lr': 9.012665953349533e-06, 'weight_decay': 4.96591963698479e-06, 'epochs': 105, 'loss': 'mse', 'optimizer': 'sgd', 'use_snp_selection': True, 'num_snps': 25583, 'weight_scheme': 'minmax', 'weight_clip_max': 5.0, 'weight_minmax_eps': 0.14026014881292506}. Best is trial 0 with value: -0.019573290606087482.
[I 2026-04-21 19:28:03,787] Trial 35 finished with value: 0.08887035891319006 and parameters: {'hidden_dims': '[512, 64]', 'dropout': 0.19846620771787582, 'batch_norm': False, 'lr': 0.00043616895456223277, 'weight_decay': 0.0002602811271524571, 'epochs': 252, 'loss': 'mae', 'optimizer': 'adamw', 'use_snp_selection': False, 'weight_scheme': 'exponential', 'weight_clip_max': None, 'weight_exponential_beta': 7.03377074719916}. Best is trial 22 with value: 0.10514417658216253.
[I 2026-04-21 19:28:16,166] Trial 1 finished with value: 0.052460521953988044 and parameters: {'hidden_dims': '[256, 64]', 'dropout': 0.05000949662985405, 'batch_norm': True, 'lr': 0.00015647443054904835, 'weight_decay': 5.158896024962846e-05, 'epochs': 152, 'loss': 'mse', 'optimizer': 'sgd', 'use_snp_selection': False, 'weight_scheme': 'linear', 'weight_clip_max': None, 'weight_linear_min_weight': 0.21922985165550554, 'weight_linear_max_weight': 1.6260435767424388}. Best is trial 1 with value: 0.052460521953988044.
[I 2026-04-21 19:28:35,480] Trial 36 finished with value: 0.08284078416469055 and parameters: {'hidden_dims': '[512, 128]', 'dropout': 0.1392151113425995, 'batch_norm': False, 'lr': 8.986907058523852e-05, 'weight_decay': 4.0114748905062265e-06, 'epochs': 232, 'loss': 'mse', 'optimizer': 'sgd', 'use_snp_selection': False, 'weight_scheme': 'exponential', 'weight_clip_max': None, 'weight_exponential_beta': 5.214958541022817}. Best is trial 22 with value: 0.10514417658216253.
[I 2026-04-21 19:28:38,021] Trial 2 finished with value: 0.1163736564021506 and parameters: {'hidden_dims': '[512, 128]', 'dropout': 0.2736730891340176, 'batch_norm': True, 'lr': 7.298114623433994e-05, 'weight_decay': 5.6346010385734023e-08, 'epochs': 185, 'loss': 'mae', 'optimizer': 'sgd', 'use_snp_selection': True, 'num_snps': 14091, 'weight_scheme': 'minmax', 'weight_clip_max': 10.0, 'weight_minmax_eps': 0.045780660776687306}. Best is trial 2 with value: 0.1163736564021506.
[I 2026-04-21 19:28:57,804] Trial 37 finished with value: 0.08492299260431439 and parameters: {'hidden_dims': '[512, 128]', 'dropout': 0.28711065230741517, 'batch_norm': False, 'lr': 5.154669343349464e-05, 'weight_decay': 4.496463051846363e-08, 'epochs': 156, 'loss': 'mae', 'optimizer': 'adamw', 'use_snp_selection': False, 'weight_scheme': 'exponential', 'weight_clip_max': None, 'weight_exponential_beta': 7.958465276129237}. Best is trial 22 with value: 0.10514417658216253.
[I 2026-04-21 19:29:16,778] Trial 3 finished with value: 0.08634532305192888 and parameters: {'hidden_dims': '[512, 64]', 'dropout': 0.30157795416637295, 'batch_norm': False, 'lr': 2.007492282795256e-05, 'weight_decay': 5.496446859789657e-06, 'epochs': 284, 'loss': 'mse', 'optimizer': 'sgd', 'use_snp_selection': False, 'weight_scheme': 'linear', 'weight_clip_max': None, 'weight_linear_min_weight': 0.24682154527102826, 'weight_linear_max_weight': 1.8338910783134623}. Best is trial 2 with value: 0.1163736564021506.
