Running from this directory: /cluster/work/simennes/Master_thesis
Name of job: ncv_ridge_iw
ID of job: 24337363
Array task ID: 15
The job was run on these nodes: idun-03-23
[I 2026-04-24 13:08:09,289] Trial 0 finished with value: 0.14634687815049682 and parameters: {'alpha': 12124.394605078569, 'use_snp_selection': True, 'num_snps': 5442, 'iw_method': 'pc_logistic', 'iw_clip_max': 20.0, 'iw_prob_clip': 0.010995744247886997, 'iw_n_components': 10, 'iw_logistic_c': 0.32697423511716517, 'iw_pca_fit': 'source', 'iw_solver': 'lbfgs', 'iw_rho': 0.75}. Best is trial 0 with value: 0.14634687815049682.
[I 2026-04-24 13:11:36,111] Trial 1 finished with value: 0.17989479064442024 and parameters: {'alpha': 161030.4172882474, 'use_snp_selection': False, 'iw_method': 'pc_logistic', 'iw_clip_max': 3.0, 'iw_prob_clip': 0.01279044980782762, 'iw_n_components': 1, 'iw_logistic_c': 2.0403812501143454e-05, 'iw_pca_fit': 'source', 'iw_solver': 'lbfgs', 'iw_rho': 0.75}. Best is trial 1 with value: 0.17989479064442024.
[I 2026-04-24 13:13:54,329] Trial 2 finished with value: 0.13046892134033536 and parameters: {'alpha': 188.160412035082, 'use_snp_selection': True, 'num_snps': 59763, 'iw_method': 'uniform', 'iw_clip_max': 5.0, 'iw_prob_clip': 0.0070654957343389896}. Best is trial 1 with value: 0.17989479064442024.
[I 2026-04-24 13:17:50,834] Trial 3 finished with value: 0.16272618255885002 and parameters: {'alpha': 16968.649375900754, 'use_snp_selection': True, 'num_snps': 29760, 'iw_method': 'pc_logistic', 'iw_clip_max': 20.0, 'iw_prob_clip': 0.0217559440148749, 'iw_n_components': 10, 'iw_logistic_c': 1.6382429914774194e-05, 'iw_pca_fit': 'combined', 'iw_solver': 'lbfgs', 'iw_rho': 0.1}. Best is trial 1 with value: 0.17989479064442024.
[I 2026-04-24 13:22:16,978] Trial 4 finished with value: 0.15720021638591228 and parameters: {'alpha': 19413.258622327583, 'use_snp_selection': True, 'num_snps': 41428, 'iw_method': 'pc_logistic', 'iw_clip_max': 20.0, 'iw_prob_clip': 0.008628235125022405, 'iw_n_components': 3, 'iw_logistic_c': 0.0004653526127488538, 'iw_pca_fit': 'source', 'iw_solver': 'lbfgs', 'iw_rho': 0.25}. Best is trial 1 with value: 0.17989479064442024.
[I 2026-04-24 13:24:27,734] Trial 5 finished with value: 0.17303787263914022 and parameters: {'alpha': 80135.2021263408, 'use_snp_selection': True, 'num_snps': 54789, 'iw_method': 'uniform', 'iw_clip_max': 3.0, 'iw_prob_clip': 0.012917216126205406}. Best is trial 1 with value: 0.17989479064442024.
[I 2026-04-24 13:25:59,838] Trial 6 finished with value: 0.16311396433713138 and parameters: {'alpha': 340178.6469095632, 'use_snp_selection': True, 'num_snps': 25889, 'iw_method': 'uniform', 'iw_clip_max': 3.0, 'iw_prob_clip': 0.020875611672958067}. Best is trial 1 with value: 0.17989479064442024.
[I 2026-04-24 13:27:18,719] Trial 7 finished with value: 0.15705925519838038 and parameters: {'alpha': 1242108.5193641477, 'use_snp_selection': True, 'num_snps': 15763, 'iw_method': 'uniform', 'iw_clip_max': 3.0, 'iw_prob_clip': 0.027212938580450624}. Best is trial 1 with value: 0.17989479064442024.
[I 2026-04-24 13:28:06,523] Trial 8 finished with value: 0.13598155969012046 and parameters: {'alpha': 576.4183768413645, 'use_snp_selection': False, 'iw_method': 'uniform', 'iw_clip_max': 2.0, 'iw_prob_clip': 0.0429488305231488}. Best is trial 1 with value: 0.17989479064442024.
[I 2026-04-24 13:29:30,812] Trial 9 finished with value: 0.15971448522514323 and parameters: {'alpha': 671771.9265477946, 'use_snp_selection': True, 'num_snps': 19046, 'iw_method': 'uniform', 'iw_clip_max': 20.0, 'iw_prob_clip': 0.016752592804942974}. Best is trial 1 with value: 0.17989479064442024.
[I 2026-04-24 13:32:53,551] Trial 10 finished with value: 0.15340939334965104 and parameters: {'alpha': 9837161.102143044, 'use_snp_selection': False, 'iw_method': 'pc_logistic', 'iw_clip_max': 10.0, 'iw_prob_clip': 0.006412966308601717, 'iw_n_components': 1, 'iw_logistic_c': 0.007218341230724956, 'iw_pca_fit': 'source', 'iw_solver': 'lbfgs', 'iw_rho': 0.75}. Best is trial 1 with value: 0.17989479064442024.
[I 2026-04-24 13:36:35,181] Trial 11 finished with value: 0.18197711897437566 and parameters: {'alpha': 96010.95041477351, 'use_snp_selection': False, 'iw_method': 'pc_logistic', 'iw_clip_max': 3.0, 'iw_prob_clip': 0.011944786904542556, 'iw_n_components': 1, 'iw_logistic_c': 1.399713636282935e-05, 'iw_pca_fit': 'combined', 'iw_solver': 'lbfgs', 'iw_rho': 1.0}. Best is trial 11 with value: 0.18197711897437566.
[I 2026-04-24 13:40:16,071] Trial 12 finished with value: 0.1430902902556096 and parameters: {'alpha': 1917.5398603560736, 'use_snp_selection': False, 'iw_method': 'pc_logistic', 'iw_clip_max': 3.0, 'iw_prob_clip': 0.010287462279084293, 'iw_n_components': 1, 'iw_logistic_c': 1.4405825011316045e-05, 'iw_pca_fit': 'combined', 'iw_solver': 'lbfgs', 'iw_rho': 1.0}. Best is trial 11 with value: 0.18197711897437566.
[I 2026-04-24 13:43:58,180] Trial 13 finished with value: 0.1333863492691384 and parameters: {'alpha': 14.10762195162507, 'use_snp_selection': False, 'iw_method': 'pc_logistic', 'iw_clip_max': 3.0, 'iw_prob_clip': 0.005395008891956986, 'iw_n_components': 1, 'iw_logistic_c': 0.00020825293604129918, 'iw_pca_fit': 'combined', 'iw_solver': 'lbfgs', 'iw_rho': 0.5}. Best is trial 11 with value: 0.18197711897437566.
[I 2026-04-24 13:47:48,532] Trial 14 finished with value: 0.1740995739381231 and parameters: {'alpha': 179221.73356350392, 'use_snp_selection': False, 'iw_method': 'pc_logistic', 'iw_clip_max': 10.0, 'iw_prob_clip': 0.013228018135264173, 'iw_n_components': 5, 'iw_logistic_c': 0.0003955104018201011, 'iw_pca_fit': 'combined', 'iw_solver': 'lbfgs', 'iw_rho': 0.75}. Best is trial 11 with value: 0.18197711897437566.
[I 2026-04-24 13:51:57,869] Trial 15 finished with value: 0.15810833240276878 and parameters: {'alpha': 2774334.877269089, 'use_snp_selection': False, 'iw_method': 'pc_logistic', 'iw_clip_max': 2.0, 'iw_prob_clip': 0.017844256990520953, 'iw_n_components': 20, 'iw_logistic_c': 4.9377880086220145, 'iw_pca_fit': 'source', 'iw_solver': 'lbfgs', 'iw_rho': 1.0}. Best is trial 11 with value: 0.18197711897437566.
[I 2026-04-24 13:55:30,450] Trial 16 finished with value: 0.1768283682866782 and parameters: {'alpha': 72017.9757818239, 'use_snp_selection': False, 'iw_method': 'pc_logistic', 'iw_clip_max': 5.0, 'iw_prob_clip': 0.02911399978601723, 'iw_n_components': 2, 'iw_logistic_c': 1.058664801935072e-05, 'iw_pca_fit': 'source', 'iw_solver': 'lbfgs', 'iw_rho': 1.0}. Best is trial 11 with value: 0.18197711897437566.
[I 2026-04-24 13:59:10,571] Trial 17 finished with value: 0.1433367316555388 and parameters: {'alpha': 2876.6005892193916, 'use_snp_selection': False, 'iw_method': 'pc_logistic', 'iw_clip_max': 3.0, 'iw_prob_clip': 0.008404032820353733, 'iw_n_components': 1, 'iw_logistic_c': 0.005166654903338709, 'iw_pca_fit': 'combined', 'iw_solver': 'lbfgs', 'iw_rho': 0.25}. Best is trial 11 with value: 0.18197711897437566.
[I 2026-04-24 14:02:52,244] Trial 18 finished with value: 0.1742357207525668 and parameters: {'alpha': 63002.25801346508, 'use_snp_selection': False, 'iw_method': 'pc_logistic', 'iw_clip_max': 3.0, 'iw_prob_clip': 0.01362062594994728, 'iw_n_components': 1, 'iw_logistic_c': 0.00010890955786338982, 'iw_pca_fit': 'combined', 'iw_solver': 'lbfgs', 'iw_rho': 0.1}. Best is trial 11 with value: 0.18197711897437566.
[I 2026-04-24 14:06:24,103] Trial 19 finished with value: 0.16005138154287116 and parameters: {'alpha': 3037076.5261862474, 'use_snp_selection': False, 'iw_method': 'pc_logistic', 'iw_clip_max': 3.0, 'iw_prob_clip': 0.009755138676947226, 'iw_n_components': 2, 'iw_logistic_c': 0.08532133167237173, 'iw_pca_fit': 'source', 'iw_solver': 'lbfgs', 'iw_rho': 0.5}. Best is trial 11 with value: 0.18197711897437566.
[I 2026-04-24 14:10:46,518] Trial 20 finished with value: 0.14505117350000601 and parameters: {'alpha': 3383.186230189727, 'use_snp_selection': False, 'iw_method': 'pc_logistic', 'iw_clip_max': 5.0, 'iw_prob_clip': 0.048142952016839415, 'iw_n_components': 20, 'iw_logistic_c': 0.0014838224275716776, 'iw_pca_fit': 'combined', 'iw_solver': 'lbfgs', 'iw_rho': 0.75}. Best is trial 11 with value: 0.18197711897437566.
[I 2026-04-24 14:14:18,502] Trial 21 finished with value: 0.177187290666433 and parameters: {'alpha': 76850.02324903259, 'use_snp_selection': False, 'iw_method': 'pc_logistic', 'iw_clip_max': 5.0, 'iw_prob_clip': 0.03245960485786484, 'iw_n_components': 2, 'iw_logistic_c': 1.277148156442027e-05, 'iw_pca_fit': 'source', 'iw_solver': 'lbfgs', 'iw_rho': 1.0}. Best is trial 11 with value: 0.18197711897437566.
[I 2026-04-24 14:17:53,860] Trial 22 finished with value: 0.17674040782850145 and parameters: {'alpha': 207203.30182706434, 'use_snp_selection': False, 'iw_method': 'pc_logistic', 'iw_clip_max': 5.0, 'iw_prob_clip': 0.038811437433407626, 'iw_n_components': 2, 'iw_logistic_c': 6.579703962282517e-05, 'iw_pca_fit': 'source', 'iw_solver': 'lbfgs', 'iw_rho': 1.0}. Best is trial 11 with value: 0.18197711897437566.
[I 2026-04-24 14:21:32,340] Trial 23 finished with value: 0.1706625680215015 and parameters: {'alpha': 45496.99227342319, 'use_snp_selection': False, 'iw_method': 'pc_logistic', 'iw_clip_max': 5.0, 'iw_prob_clip': 0.030754428330198896, 'iw_n_components': 5, 'iw_logistic_c': 5.490125509906084e-05, 'iw_pca_fit': 'source', 'iw_solver': 'lbfgs', 'iw_rho': 1.0}. Best is trial 11 with value: 0.18197711897437566.
[I 2026-04-24 14:25:03,600] Trial 24 finished with value: 0.1688745032154836 and parameters: {'alpha': 526548.6281421774, 'use_snp_selection': False, 'iw_method': 'pc_logistic', 'iw_clip_max': 10.0, 'iw_prob_clip': 0.020754743785762843, 'iw_n_components': 3, 'iw_logistic_c': 4.438510615673502e-05, 'iw_pca_fit': 'source', 'iw_solver': 'lbfgs', 'iw_rho': 1.0}. Best is trial 11 with value: 0.18197711897437566.
[I 2026-04-24 14:28:37,303] Trial 25 finished with value: 0.15141692105206714 and parameters: {'alpha': 6190.889184146747, 'use_snp_selection': False, 'iw_method': 'pc_logistic', 'iw_clip_max': 2.0, 'iw_prob_clip': 0.014817472112927858, 'iw_n_components': 2, 'iw_logistic_c': 1.0137415364193937e-05, 'iw_pca_fit': 'source', 'iw_solver': 'lbfgs', 'iw_rho': 1.0}. Best is trial 11 with value: 0.18197711897437566.
[I 2026-04-24 14:32:06,945] Trial 26 finished with value: 0.17041724593287638 and parameters: {'alpha': 31884.838406127205, 'use_snp_selection': False, 'iw_method': 'pc_logistic', 'iw_clip_max': 5.0, 'iw_prob_clip': 0.01191521540384323, 'iw_n_components': 1, 'iw_logistic_c': 0.001256818666919331, 'iw_pca_fit': 'source', 'iw_solver': 'lbfgs', 'iw_rho': 0.75}. Best is trial 11 with value: 0.18197711897437566.
[I 2026-04-24 14:35:50,199] Trial 27 finished with value: 0.16597576046976348 and parameters: {'alpha': 1364136.6044364085, 'use_snp_selection': False, 'iw_method': 'pc_logistic', 'iw_clip_max': 3.0, 'iw_prob_clip': 0.03405882801566085, 'iw_n_components': 1, 'iw_logistic_c': 0.056869285831492755, 'iw_pca_fit': 'combined', 'iw_solver': 'lbfgs', 'iw_rho': 1.0}. Best is trial 11 with value: 0.18197711897437566.
[I 2026-04-24 14:39:21,115] Trial 28 finished with value: 0.17762755145567788 and parameters: {'alpha': 167230.4752534512, 'use_snp_selection': False, 'iw_method': 'pc_logistic', 'iw_clip_max': 3.0, 'iw_prob_clip': 0.023548024190507586, 'iw_n_components': 2, 'iw_logistic_c': 3.2825669190758516e-05, 'iw_pca_fit': 'source', 'iw_solver': 'lbfgs', 'iw_rho': 0.25}. Best is trial 11 with value: 0.18197711897437566.
[I 2026-04-24 14:43:03,787] Trial 29 finished with value: 0.15377203450175803 and parameters: {'alpha': 8774.46624675895, 'use_snp_selection': False, 'iw_method': 'pc_logistic', 'iw_clip_max': 3.0, 'iw_prob_clip': 0.02435515792625325, 'iw_n_components': 1, 'iw_logistic_c': 4.2293906089247716e-05, 'iw_pca_fit': 'combined', 'iw_solver': 'lbfgs', 'iw_rho': 0.25}. Best is trial 11 with value: 0.18197711897437566.
[I 2026-04-24 14:46:40,323] Trial 30 finished with value: 0.17667030058171151 and parameters: {'alpha': 195618.69780398862, 'use_snp_selection': False, 'iw_method': 'pc_logistic', 'iw_clip_max': 3.0, 'iw_prob_clip': 0.018907222766564744, 'iw_n_components': 5, 'iw_logistic_c': 0.00022738336224842166, 'iw_pca_fit': 'source', 'iw_solver': 'lbfgs', 'iw_rho': 0.25}. Best is trial 11 with value: 0.18197711897437566.
[I 2026-04-24 14:50:10,906] Trial 31 finished with value: 0.1772306723904168 and parameters: {'alpha': 126550.34125732466, 'use_snp_selection': False, 'iw_method': 'pc_logistic', 'iw_clip_max': 3.0, 'iw_prob_clip': 0.024414615178920837, 'iw_n_components': 2, 'iw_logistic_c': 3.106237868362478e-05, 'iw_pca_fit': 'source', 'iw_solver': 'lbfgs', 'iw_rho': 0.25}. Best is trial 11 with value: 0.18197711897437566.
[I 2026-04-24 14:53:42,232] Trial 32 finished with value: 0.17755923832259904 and parameters: {'alpha': 139097.9659568677, 'use_snp_selection': False, 'iw_method': 'pc_logistic', 'iw_clip_max': 3.0, 'iw_prob_clip': 0.015727620580584037, 'iw_n_components': 2, 'iw_logistic_c': 3.443511467562805e-05, 'iw_pca_fit': 'source', 'iw_solver': 'lbfgs', 'iw_rho': 0.25}. Best is trial 11 with value: 0.18197711897437566.
[I 2026-04-24 14:57:14,576] Trial 33 finished with value: 0.16487068240350838 and parameters: {'alpha': 24123.755358935912, 'use_snp_selection': False, 'iw_method': 'pc_logistic', 'iw_clip_max': 3.0, 'iw_prob_clip': 0.01561893194297204, 'iw_n_components': 2, 'iw_logistic_c': 0.0001610533205091914, 'iw_pca_fit': 'source', 'iw_solver': 'lbfgs', 'iw_rho': 0.25}. Best is trial 11 with value: 0.18197711897437566.
[I 2026-04-24 15:00:47,390] Trial 34 finished with value: 0.1753828410623099 and parameters: {'alpha': 396297.26894992363, 'use_snp_selection': False, 'iw_method': 'pc_logistic', 'iw_clip_max': 3.0, 'iw_prob_clip': 0.008176680887208255, 'iw_n_components': 2, 'iw_logistic_c': 0.0008059421763600303, 'iw_pca_fit': 'source', 'iw_solver': 'lbfgs', 'iw_rho': 0.25}. Best is trial 11 with value: 0.18197711897437566.
[I 2026-04-24 15:02:48,383] Trial 35 finished with value: 0.1570451621576743 and parameters: {'alpha': 12813.373116614737, 'use_snp_selection': True, 'num_snps': 42891, 'iw_method': 'uniform', 'iw_clip_max': 20.0, 'iw_prob_clip': 0.010846496700560109}. Best is trial 11 with value: 0.18197711897437566.
[I 2026-04-24 15:06:46,728] Trial 36 finished with value: 0.17025936961031615 and parameters: {'alpha': 985707.0476539658, 'use_snp_selection': False, 'iw_method': 'pc_logistic', 'iw_clip_max': 3.0, 'iw_prob_clip': 0.011625384813816933, 'iw_n_components': 20, 'iw_logistic_c': 3.065159211671686e-05, 'iw_pca_fit': 'source', 'iw_solver': 'lbfgs', 'iw_rho': 0.25}. Best is trial 11 with value: 0.18197711897437566.
[I 2026-04-24 15:08:40,192] Trial 37 finished with value: 0.16288886331108454 and parameters: {'alpha': 2430728.1708469465, 'use_snp_selection': True, 'num_snps': 39999, 'iw_method': 'uniform', 'iw_clip_max': 3.0, 'iw_prob_clip': 0.014619879564133907}. Best is trial 11 with value: 0.18197711897437566.
[I 2026-04-24 15:12:42,282] Trial 38 finished with value: 0.17505990198709254 and parameters: {'alpha': 358109.5606832926, 'use_snp_selection': False, 'iw_method': 'pc_logistic', 'iw_clip_max': 3.0, 'iw_prob_clip': 0.018938317313234008, 'iw_n_components': 10, 'iw_logistic_c': 8.445509681476944, 'iw_pca_fit': 'source', 'iw_solver': 'lbfgs', 'iw_rho': 0.75}. Best is trial 11 with value: 0.18197711897437566.
[I 2026-04-24 15:14:52,338] Trial 39 finished with value: 0.17413443318471386 and parameters: {'alpha': 133752.34154052314, 'use_snp_selection': True, 'num_snps': 51093, 'iw_method': 'uniform', 'iw_clip_max': 20.0, 'iw_prob_clip': 0.025070436886883693}. Best is trial 11 with value: 0.18197711897437566.
[I 2026-04-24 15:18:24,568] Trial 40 finished with value: 0.15967640519703022 and parameters: {'alpha': 8141694.839161899, 'use_snp_selection': False, 'iw_method': 'pc_logistic', 'iw_clip_max': 2.0, 'iw_prob_clip': 0.009574043734300559, 'iw_n_components': 3, 'iw_logistic_c': 8.724211478397497e-05, 'iw_pca_fit': 'source', 'iw_solver': 'lbfgs', 'iw_rho': 0.1}. Best is trial 11 with value: 0.18197711897437566.
[I 2026-04-24 15:21:55,196] Trial 41 finished with value: 0.17764281324530753 and parameters: {'alpha': 165224.41000021852, 'use_snp_selection': False, 'iw_method': 'pc_logistic', 'iw_clip_max': 3.0, 'iw_prob_clip': 0.022924070920242106, 'iw_n_components': 2, 'iw_logistic_c': 2.963284688072781e-05, 'iw_pca_fit': 'source', 'iw_solver': 'lbfgs', 'iw_rho': 0.25}. Best is trial 11 with value: 0.18197711897437566.
[I 2026-04-24 15:25:26,613] Trial 42 finished with value: 0.16843275732593338 and parameters: {'alpha': 33823.779513176356, 'use_snp_selection': False, 'iw_method': 'pc_logistic', 'iw_clip_max': 3.0, 'iw_prob_clip': 0.02177587592132381, 'iw_n_components': 2, 'iw_logistic_c': 2.7353837388331396e-05, 'iw_pca_fit': 'source', 'iw_solver': 'lbfgs', 'iw_rho': 0.25}. Best is trial 11 with value: 0.18197711897437566.
[I 2026-04-24 15:29:25,070] Trial 43 finished with value: 0.17722990054980717 and parameters: {'alpha': 125296.28747676365, 'use_snp_selection': False, 'iw_method': 'pc_logistic', 'iw_clip_max': 3.0, 'iw_prob_clip': 0.016608647966150105, 'iw_n_components': 10, 'iw_logistic_c': 2.358646943276758e-05, 'iw_pca_fit': 'source', 'iw_solver': 'lbfgs', 'iw_rho': 0.25}. Best is trial 11 with value: 0.18197711897437566.
[I 2026-04-24 15:32:54,558] Trial 44 finished with value: 0.17667525210385693 and parameters: {'alpha': 306248.0769334483, 'use_snp_selection': False, 'iw_method': 'pc_logistic', 'iw_clip_max': 3.0, 'iw_prob_clip': 0.012185902211333696, 'iw_n_components': 2, 'iw_logistic_c': 0.0001024719228171961, 'iw_pca_fit': 'source', 'iw_solver': 'lbfgs', 'iw_rho': 0.25}. Best is trial 11 with value: 0.18197711897437566.
[I 2026-04-24 15:34:46,888] Trial 45 finished with value: 0.1509591746208228 and parameters: {'alpha': 771590.9004454581, 'use_snp_selection': True, 'num_snps': 5575, 'iw_method': 'pc_logistic', 'iw_clip_max': 10.0, 'iw_prob_clip': 0.021618921886707578, 'iw_n_components': 2, 'iw_logistic_c': 0.00031736228123882033, 'iw_pca_fit': 'combined', 'iw_solver': 'lbfgs', 'iw_rho': 0.5}. Best is trial 11 with value: 0.18197711897437566.
[I 2026-04-24 15:35:37,347] Trial 46 finished with value: 0.16181730958263632 and parameters: {'alpha': 19087.362916646674, 'use_snp_selection': False, 'iw_method': 'uniform', 'iw_clip_max': 3.0, 'iw_prob_clip': 0.014046956933051177}. Best is trial 11 with value: 0.18197711897437566.
[I 2026-04-24 15:39:05,928] Trial 47 finished with value: 0.1336057644395331 and parameters: {'alpha': 51.964447728280796, 'use_snp_selection': False, 'iw_method': 'pc_logistic', 'iw_clip_max': 3.0, 'iw_prob_clip': 0.0073156252798231465, 'iw_n_components': 1, 'iw_logistic_c': 2.2231018171633765e-05, 'iw_pca_fit': 'source', 'iw_solver': 'lbfgs', 'iw_rho': 0.75}. Best is trial 11 with value: 0.18197711897437566.
[I 2026-04-24 15:42:45,399] Trial 48 finished with value: 0.17343223415072911 and parameters: {'alpha': 59979.39362898117, 'use_snp_selection': False, 'iw_method': 'pc_logistic', 'iw_clip_max': 20.0, 'iw_prob_clip': 0.018656883763085004, 'iw_n_components': 1, 'iw_logistic_c': 1.0112470663228315, 'iw_pca_fit': 'combined', 'iw_solver': 'lbfgs', 'iw_rho': 0.1}. Best is trial 11 with value: 0.18197711897437566.
[I 2026-04-24 15:46:36,536] Trial 49 finished with value: 0.17801112482701612 and parameters: {'alpha': 248418.45546311393, 'use_snp_selection': False, 'iw_method': 'pc_logistic', 'iw_clip_max': 3.0, 'iw_prob_clip': 0.01724063801677038, 'iw_n_components': 10, 'iw_logistic_c': 7.504414324756078e-05, 'iw_pca_fit': 'source', 'iw_solver': 'lbfgs', 'iw_rho': 0.25}. Best is trial 11 with value: 0.18197711897437566.
[I 2026-04-24 15:48:02,332] Trial 50 finished with value: 0.1591541984998451 and parameters: {'alpha': 259175.30983377382, 'use_snp_selection': True, 'num_snps': 16677, 'iw_method': 'uniform', 'iw_clip_max': 3.0, 'iw_prob_clip': 0.01715828995290577}. Best is trial 11 with value: 0.18197711897437566.
[I 2026-04-24 15:52:00,733] Trial 51 finished with value: 0.17723390069158723 and parameters: {'alpha': 106661.69861463287, 'use_snp_selection': False, 'iw_method': 'pc_logistic', 'iw_clip_max': 3.0, 'iw_prob_clip': 0.027930611372499012, 'iw_n_components': 10, 'iw_logistic_c': 1.6987069039686845e-05, 'iw_pca_fit': 'source', 'iw_solver': 'lbfgs', 'iw_rho': 0.25}. Best is trial 11 with value: 0.18197711897437566.
[I 2026-04-24 15:55:34,832] Trial 52 finished with value: 0.17298859263495367 and parameters: {'alpha': 543257.4601755566, 'use_snp_selection': False, 'iw_method': 'pc_logistic', 'iw_clip_max': 3.0, 'iw_prob_clip': 0.013051879158181269, 'iw_n_components': 3, 'iw_logistic_c': 5.8843754537162825e-05, 'iw_pca_fit': 'source', 'iw_solver': 'lbfgs', 'iw_rho': 0.25}. Best is trial 11 with value: 0.18197711897437566.
[I 2026-04-24 15:59:28,442] Trial 53 finished with value: 0.16718358826066834 and parameters: {'alpha': 1702848.7922928547, 'use_snp_selection': False, 'iw_method': 'pc_logistic', 'iw_clip_max': 3.0, 'iw_prob_clip': 0.015621823226675938, 'iw_n_components': 10, 'iw_logistic_c': 0.00010235764718492917, 'iw_pca_fit': 'source', 'iw_solver': 'lbfgs', 'iw_rho': 0.25}. Best is trial 11 with value: 0.18197711897437566.
[I 2026-04-24 16:03:24,845] Trial 54 finished with value: 0.17021968511186814 and parameters: {'alpha': 44140.90775325836, 'use_snp_selection': False, 'iw_method': 'pc_logistic', 'iw_clip_max': 3.0, 'iw_prob_clip': 0.020361827204172723, 'iw_n_components': 10, 'iw_logistic_c': 1.823478186227206e-05, 'iw_pca_fit': 'source', 'iw_solver': 'lbfgs', 'iw_rho': 0.75}. Best is trial 11 with value: 0.18197711897437566.
