[I 2026-05-04 05:08:33,487] Trial 110 finished with value: 0.16309970951454342 and parameters: {'alpha': 1409999.4878001208, 'use_snp_selection': False, 'iw_method': 'uniform'}. Best is trial 82 with value: 0.19487877016443284.
[I 2026-05-04 05:11:30,861] Trial 111 finished with value: 0.1848233561231882 and parameters: {'alpha': 1541277.1146282863, 'use_snp_selection': False, 'iw_method': 'pc_logistic', 'iw_clip_max': 5.0, 'iw_prob_clip': 0.03858335515392635, 'iw_n_components': 60, 'iw_logistic_c': 1.782655357714602e-06, 'iw_pca_fit': 'combined', 'iw_solver': 'lbfgs', 'iw_rho': 0.9}. Best is trial 82 with value: 0.19487877016443284.
[I 2026-05-04 05:14:28,883] Trial 112 finished with value: 0.194357859502453 and parameters: {'alpha': 2093947.5499919492, 'use_snp_selection': False, 'iw_method': 'pc_logistic', 'iw_clip_max': 5.0, 'iw_prob_clip': 0.03461601159607898, 'iw_n_components': 60, 'iw_logistic_c': 6.623943372961204e-06, 'iw_pca_fit': 'combined', 'iw_solver': 'lbfgs', 'iw_rho': 0.9}. Best is trial 82 with value: 0.19487877016443284.
[I 2026-05-04 05:17:27,395] Trial 113 finished with value: 0.19042249123561245 and parameters: {'alpha': 2145243.9281750387, 'use_snp_selection': False, 'iw_method': 'pc_logistic', 'iw_clip_max': 5.0, 'iw_prob_clip': 0.03183656597345236, 'iw_n_components': 60, 'iw_logistic_c': 2.758473086099651e-05, 'iw_pca_fit': 'combined', 'iw_solver': 'lbfgs', 'iw_rho': 0.9}. Best is trial 82 with value: 0.19487877016443284.
[I 2026-05-04 05:20:24,872] Trial 114 finished with value: 0.1919348915725628 and parameters: {'alpha': 1921024.4373451462, 'use_snp_selection': False, 'iw_method': 'pc_logistic', 'iw_clip_max': 5.0, 'iw_prob_clip': 0.045452761952572265, 'iw_n_components': 60, 'iw_logistic_c': 3.981389797771837e-06, 'iw_pca_fit': 'combined', 'iw_solver': 'lbfgs', 'iw_rho': 0.9}. Best is trial 82 with value: 0.19487877016443284.
[I 2026-05-04 05:23:17,024] Trial 115 finished with value: 0.19083024946608235 and parameters: {'alpha': 1659174.502768869, 'use_snp_selection': False, 'iw_method': 'pc_logistic', 'iw_clip_max': 5.0, 'iw_prob_clip': 0.025778184703369775, 'iw_n_components': 30, 'iw_logistic_c': 2.6246409069747644e-06, 'iw_pca_fit': 'combined', 'iw_solver': 'lbfgs', 'iw_rho': 0.9}. Best is trial 82 with value: 0.19487877016443284.
[I 2026-05-04 05:26:21,479] Trial 116 finished with value: 0.18100556340115276 and parameters: {'alpha': 2309230.112767678, 'use_snp_selection': False, 'iw_method': 'pc_logistic', 'iw_clip_max': 1.5, 'iw_prob_clip': 0.03563052236121177, 'iw_n_components': 80, 'iw_logistic_c': 6.708113864352021e-06, 'iw_pca_fit': 'combined', 'iw_solver': 'lbfgs', 'iw_rho': 1.0}. Best is trial 82 with value: 0.19487877016443284.
[I 2026-05-04 05:29:19,582] Trial 117 finished with value: 0.19253973206136032 and parameters: {'alpha': 1264273.4148422037, 'use_snp_selection': False, 'iw_method': 'pc_logistic', 'iw_clip_max': 5.0, 'iw_prob_clip': 0.04257997355439457, 'iw_n_components': 60, 'iw_logistic_c': 1.5192813685965675e-05, 'iw_pca_fit': 'combined', 'iw_solver': 'lbfgs', 'iw_rho': 0.9}. Best is trial 82 with value: 0.19487877016443284.
[I 2026-05-04 05:32:25,864] Trial 118 finished with value: 0.19426378472685393 and parameters: {'alpha': 1120468.2070474564, 'use_snp_selection': False, 'iw_method': 'pc_logistic', 'iw_clip_max': 5.0, 'iw_prob_clip': 0.03316783466457694, 'iw_n_components': 80, 'iw_logistic_c': 7.135753593041674e-06, 'iw_pca_fit': 'combined', 'iw_solver': 'lbfgs', 'iw_rho': 0.9}. Best is trial 82 with value: 0.19487877016443284.
[I 2026-05-04 05:35:13,893] Trial 119 finished with value: 0.189355721918622 and parameters: {'alpha': 1989446.655592902, 'use_snp_selection': False, 'iw_method': 'pc_logistic', 'iw_clip_max': 5.0, 'iw_prob_clip': 0.03976723063504312, 'iw_n_components': 10, 'iw_logistic_c': 1.2864809044641444e-05, 'iw_pca_fit': 'combined', 'iw_solver': 'lbfgs', 'iw_rho': 0.9}. Best is trial 82 with value: 0.19487877016443284.
[I 2026-05-04 05:38:21,377] Trial 120 finished with value: 0.1796137638900231 and parameters: {'alpha': 1404579.8035026928, 'use_snp_selection': False, 'iw_method': 'pc_logistic', 'iw_clip_max': 3.0, 'iw_prob_clip': 0.0491370580060168, 'iw_n_components': 80, 'iw_logistic_c': 1.330340111987929e-06, 'iw_pca_fit': 'combined', 'iw_solver': 'lbfgs', 'iw_rho': 0.9}. Best is trial 82 with value: 0.19487877016443284.
[I 2026-05-04 05:41:29,439] Trial 121 finished with value: 0.195004151931307 and parameters: {'alpha': 1147640.5247295646, 'use_snp_selection': False, 'iw_method': 'pc_logistic', 'iw_clip_max': 5.0, 'iw_prob_clip': 0.029467283423002522, 'iw_n_components': 80, 'iw_logistic_c': 6.715256063760714e-06, 'iw_pca_fit': 'combined', 'iw_solver': 'lbfgs', 'iw_rho': 0.9}. Best is trial 121 with value: 0.195004151931307.
[I 2026-05-04 05:44:38,460] Trial 122 finished with value: 0.19441444384939294 and parameters: {'alpha': 1083844.2886424977, 'use_snp_selection': False, 'iw_method': 'pc_logistic', 'iw_clip_max': 5.0, 'iw_prob_clip': 0.03368147821564893, 'iw_n_components': 80, 'iw_logistic_c': 7.496572061997819e-06, 'iw_pca_fit': 'combined', 'iw_solver': 'lbfgs', 'iw_rho': 0.9}. Best is trial 121 with value: 0.195004151931307.
[I 2026-05-04 05:47:47,944] Trial 123 finished with value: 0.19241174240463224 and parameters: {'alpha': 1097178.71776827, 'use_snp_selection': False, 'iw_method': 'pc_logistic', 'iw_clip_max': 5.0, 'iw_prob_clip': 0.03159549525425084, 'iw_n_components': 80, 'iw_logistic_c': 3.112867683091185e-05, 'iw_pca_fit': 'combined', 'iw_solver': 'lbfgs', 'iw_rho': 0.9}. Best is trial 121 with value: 0.195004151931307.
[I 2026-05-04 05:50:56,442] Trial 124 finished with value: 0.19300943736757908 and parameters: {'alpha': 1155373.4962308183, 'use_snp_selection': False, 'iw_method': 'pc_logistic', 'iw_clip_max': 5.0, 'iw_prob_clip': 0.02670024875121701, 'iw_n_components': 80, 'iw_logistic_c': 1.928882660137321e-05, 'iw_pca_fit': 'combined', 'iw_solver': 'lbfgs', 'iw_rho': 0.9}. Best is trial 121 with value: 0.195004151931307.
[I 2026-05-04 05:54:01,727] Trial 125 finished with value: 0.1934685240259529 and parameters: {'alpha': 996198.7973161945, 'use_snp_selection': False, 'iw_method': 'pc_logistic', 'iw_clip_max': 5.0, 'iw_prob_clip': 0.03557240404683199, 'iw_n_components': 80, 'iw_logistic_c': 3.866925306303309e-06, 'iw_pca_fit': 'combined', 'iw_solver': 'lbfgs', 'iw_rho': 0.9}. Best is trial 121 with value: 0.195004151931307.
[I 2026-05-04 05:57:08,574] Trial 126 finished with value: 0.19460476969652474 and parameters: {'alpha': 1488259.4009743712, 'use_snp_selection': False, 'iw_method': 'pc_logistic', 'iw_clip_max': 5.0, 'iw_prob_clip': 0.03014304000332948, 'iw_n_components': 80, 'iw_logistic_c': 8.129028164783529e-06, 'iw_pca_fit': 'combined', 'iw_solver': 'lbfgs', 'iw_rho': 0.9}. Best is trial 121 with value: 0.195004151931307.
[I 2026-05-04 06:00:00,043] Trial 127 finished with value: 0.18413059917119515 and parameters: {'alpha': 1627637.092454606, 'use_snp_selection': False, 'iw_method': 'pc_logistic', 'iw_clip_max': 2.0, 'iw_prob_clip': 0.03139444719981059, 'iw_n_components': 20, 'iw_logistic_c': 1.1101162150418639e-05, 'iw_pca_fit': 'combined', 'iw_solver': 'lbfgs', 'iw_rho': 0.9}. Best is trial 121 with value: 0.195004151931307.
[I 2026-05-04 06:03:10,112] Trial 128 finished with value: 0.18304290049934518 and parameters: {'alpha': 1862329.5446969492, 'use_snp_selection': False, 'iw_method': 'pc_logistic', 'iw_clip_max': 5.0, 'iw_prob_clip': 0.03422007944276425, 'iw_n_components': 60, 'iw_logistic_c': 0.47425853219119374, 'iw_pca_fit': 'combined', 'iw_solver': 'lbfgs', 'iw_rho': 0.5}. Best is trial 121 with value: 0.195004151931307.
[I 2026-05-04 06:06:10,786] Trial 129 finished with value: 0.18999304245365806 and parameters: {'alpha': 1051133.9827619856, 'use_snp_selection': False, 'iw_method': 'pc_logistic', 'iw_clip_max': 5.0, 'iw_prob_clip': 0.029660556307524708, 'iw_n_components': 50, 'iw_logistic_c': 2.2760956176131237e-06, 'iw_pca_fit': 'combined', 'iw_solver': 'lbfgs', 'iw_rho': 0.9}. Best is trial 121 with value: 0.195004151931307.
[I 2026-05-04 06:09:18,856] Trial 130 finished with value: 0.19274292694733577 and parameters: {'alpha': 925795.6227470298, 'use_snp_selection': False, 'iw_method': 'pc_logistic', 'iw_clip_max': 5.0, 'iw_prob_clip': 0.025054150892315663, 'iw_n_components': 80, 'iw_logistic_c': 3.3241913172749634e-06, 'iw_pca_fit': 'combined', 'iw_solver': 'lbfgs', 'iw_rho': 0.9}. Best is trial 121 with value: 0.195004151931307.
[I 2026-05-04 06:12:27,081] Trial 131 finished with value: 0.1947542172540749 and parameters: {'alpha': 1492228.1167265258, 'use_snp_selection': False, 'iw_method': 'pc_logistic', 'iw_clip_max': 5.0, 'iw_prob_clip': 0.027716293539329563, 'iw_n_components': 80, 'iw_logistic_c': 7.407206818820128e-06, 'iw_pca_fit': 'combined', 'iw_solver': 'lbfgs', 'iw_rho': 0.9}. Best is trial 121 with value: 0.195004151931307.
[I 2026-05-04 06:15:33,630] Trial 132 finished with value: 0.19328631661249898 and parameters: {'alpha': 1726229.3738997516, 'use_snp_selection': False, 'iw_method': 'pc_logistic', 'iw_clip_max': 5.0, 'iw_prob_clip': 0.021284588511713935, 'iw_n_components': 80, 'iw_logistic_c': 4.756779319422343e-06, 'iw_pca_fit': 'combined', 'iw_solver': 'lbfgs', 'iw_rho': 0.9}. Best is trial 121 with value: 0.195004151931307.
[I 2026-05-04 06:18:38,994] Trial 133 finished with value: 0.19366912042958762 and parameters: {'alpha': 1436346.1752619755, 'use_snp_selection': False, 'iw_method': 'pc_logistic', 'iw_clip_max': 5.0, 'iw_prob_clip': 0.037720334182828004, 'iw_n_components': 80, 'iw_logistic_c': 8.11402653946145e-06, 'iw_pca_fit': 'combined', 'iw_solver': 'lbfgs', 'iw_rho': 0.9}. Best is trial 121 with value: 0.195004151931307.
[I 2026-05-04 06:21:44,840] Trial 134 finished with value: 0.1932205448334566 and parameters: {'alpha': 1590728.220762857, 'use_snp_selection': False, 'iw_method': 'pc_logistic', 'iw_clip_max': 5.0, 'iw_prob_clip': 0.028672747983162678, 'iw_n_components': 80, 'iw_logistic_c': 1.1955683891066131e-05, 'iw_pca_fit': 'combined', 'iw_solver': 'lbfgs', 'iw_rho': 0.9}. Best is trial 121 with value: 0.195004151931307.
[I 2026-05-04 06:22:17,182] Trial 135 finished with value: 0.16353285074792004 and parameters: {'alpha': 1214250.2112463117, 'use_snp_selection': False, 'iw_method': 'uniform'}. Best is trial 121 with value: 0.195004151931307.
[I 2026-05-04 06:25:23,052] Trial 136 finished with value: 0.17432726531972104 and parameters: {'alpha': 250850.6111290614, 'use_snp_selection': False, 'iw_method': 'pc_logistic', 'iw_clip_max': 1.25, 'iw_prob_clip': 0.032902927080859276, 'iw_n_components': 80, 'iw_logistic_c': 1.6696223253272742e-05, 'iw_pca_fit': 'combined', 'iw_solver': 'lbfgs', 'iw_rho': 0.9}. Best is trial 121 with value: 0.195004151931307.
[I 2026-05-04 06:28:28,710] Trial 137 finished with value: 0.18706923879467416 and parameters: {'alpha': 1355401.3955367527, 'use_snp_selection': False, 'iw_method': 'pc_logistic', 'iw_clip_max': 5.0, 'iw_prob_clip': 0.030610747769932934, 'iw_n_components': 80, 'iw_logistic_c': 1.903347880072514e-06, 'iw_pca_fit': 'combined', 'iw_solver': 'lbfgs', 'iw_rho': 0.9}. Best is trial 121 with value: 0.195004151931307.
[I 2026-05-04 06:31:34,456] Trial 138 finished with value: 0.18507188049229922 and parameters: {'alpha': 162850.77451996863, 'use_snp_selection': False, 'iw_method': 'pc_logistic', 'iw_clip_max': 5.0, 'iw_prob_clip': 0.024424553242807755, 'iw_n_components': 80, 'iw_logistic_c': 7.516810257120332e-06, 'iw_pca_fit': 'combined', 'iw_solver': 'lbfgs', 'iw_rho': 0.9}. Best is trial 121 with value: 0.195004151931307.
[I 2026-05-04 06:34:39,771] Trial 139 finished with value: 0.193212370162129 and parameters: {'alpha': 2498926.54125484, 'use_snp_selection': False, 'iw_method': 'pc_logistic', 'iw_clip_max': 5.0, 'iw_prob_clip': 0.02233802743001013, 'iw_n_components': 80, 'iw_logistic_c': 4.467556069938266e-06, 'iw_pca_fit': 'combined', 'iw_solver': 'lbfgs', 'iw_rho': 1.0}. Best is trial 121 with value: 0.195004151931307.
[I 2026-05-04 06:37:36,777] Trial 140 finished with value: 0.17631385274471342 and parameters: {'alpha': 1128586.6375103213, 'use_snp_selection': False, 'iw_method': 'pc_logistic', 'iw_clip_max': 1.5, 'iw_prob_clip': 0.03897818831548319, 'iw_n_components': 40, 'iw_logistic_c': 2.966092270886315e-06, 'iw_pca_fit': 'combined', 'iw_solver': 'lbfgs', 'iw_rho': 0.75}. Best is trial 121 with value: 0.195004151931307.
[I 2026-05-04 06:40:41,799] Trial 141 finished with value: 0.1941851394135604 and parameters: {'alpha': 1501062.2535820391, 'use_snp_selection': False, 'iw_method': 'pc_logistic', 'iw_clip_max': 5.0, 'iw_prob_clip': 0.02728254309901795, 'iw_n_components': 80, 'iw_logistic_c': 7.904832659007608e-06, 'iw_pca_fit': 'combined', 'iw_solver': 'lbfgs', 'iw_rho': 0.9}. Best is trial 121 with value: 0.195004151931307.
[I 2026-05-04 06:43:47,078] Trial 142 finished with value: 0.19377375818848047 and parameters: {'alpha': 1512990.5168828454, 'use_snp_selection': False, 'iw_method': 'pc_logistic', 'iw_clip_max': 5.0, 'iw_prob_clip': 0.027847106592584988, 'iw_n_components': 80, 'iw_logistic_c': 1.0386104472088297e-05, 'iw_pca_fit': 'combined', 'iw_solver': 'lbfgs', 'iw_rho': 0.9}. Best is trial 121 with value: 0.195004151931307.
[I 2026-05-04 06:46:52,614] Trial 143 finished with value: 0.1919407988821255 and parameters: {'alpha': 1772959.0503554891, 'use_snp_selection': False, 'iw_method': 'pc_logistic', 'iw_clip_max': 5.0, 'iw_prob_clip': 0.034819523147253235, 'iw_n_components': 80, 'iw_logistic_c': 2.279742516609424e-05, 'iw_pca_fit': 'combined', 'iw_solver': 'lbfgs', 'iw_rho': 0.9}. Best is trial 121 with value: 0.195004151931307.
[I 2026-05-04 06:49:45,660] Trial 144 finished with value: 0.19335500264835362 and parameters: {'alpha': 1294338.2270836364, 'use_snp_selection': False, 'iw_method': 'pc_logistic', 'iw_clip_max': 5.0, 'iw_prob_clip': 0.02462642434219143, 'iw_n_components': 30, 'iw_logistic_c': 5.1239884967836446e-06, 'iw_pca_fit': 'combined', 'iw_solver': 'lbfgs', 'iw_rho': 0.9}. Best is trial 121 with value: 0.195004151931307.
[I 2026-05-04 06:52:51,286] Trial 145 finished with value: 0.19430111278715276 and parameters: {'alpha': 1466865.0774473532, 'use_snp_selection': False, 'iw_method': 'pc_logistic', 'iw_clip_max': 5.0, 'iw_prob_clip': 0.031925619686009404, 'iw_n_components': 80, 'iw_logistic_c': 8.045717756297734e-06, 'iw_pca_fit': 'combined', 'iw_solver': 'lbfgs', 'iw_rho': 0.9}. Best is trial 121 with value: 0.195004151931307.
[I 2026-05-04 06:55:56,448] Trial 146 finished with value: 0.19338806874229955 and parameters: {'alpha': 1429956.4678711167, 'use_snp_selection': False, 'iw_method': 'pc_logistic', 'iw_clip_max': 5.0, 'iw_prob_clip': 0.03238863016540832, 'iw_n_components': 80, 'iw_logistic_c': 1.4456913365480984e-05, 'iw_pca_fit': 'combined', 'iw_solver': 'lbfgs', 'iw_rho': 0.9}. Best is trial 121 with value: 0.195004151931307.
[I 2026-05-04 06:58:54,816] Trial 147 finished with value: 0.18869333568188099 and parameters: {'alpha': 1186976.3080627357, 'use_snp_selection': False, 'iw_method': 'pc_logistic', 'iw_clip_max': 5.0, 'iw_prob_clip': 0.02922130821906094, 'iw_n_components': 60, 'iw_logistic_c': 5.911298463994242e-05, 'iw_pca_fit': 'combined', 'iw_solver': 'lbfgs', 'iw_rho': 0.9}. Best is trial 121 with value: 0.195004151931307.
[I 2026-05-04 07:01:59,564] Trial 148 finished with value: 0.19446382719812644 and parameters: {'alpha': 1556874.7609903712, 'use_snp_selection': False, 'iw_method': 'pc_logistic', 'iw_clip_max': 5.0, 'iw_prob_clip': 0.03632509519334189, 'iw_n_components': 80, 'iw_logistic_c': 5.560701669950274e-06, 'iw_pca_fit': 'combined', 'iw_solver': 'lbfgs', 'iw_rho': 0.9}. Best is trial 121 with value: 0.195004151931307.
[I 2026-05-04 07:04:48,771] Trial 149 finished with value: 0.19182715473613315 and parameters: {'alpha': 1330894.4452821556, 'use_snp_selection': False, 'iw_method': 'pc_logistic', 'iw_clip_max': 5.0, 'iw_prob_clip': 0.026941373116869186, 'iw_n_components': 80, 'iw_logistic_c': 2.985879409244038e-06, 'iw_pca_fit': 'combined', 'iw_solver': 'lbfgs', 'iw_rho': 0.9}. Best is trial 121 with value: 0.195004151931307.
