[I 2026-04-24 16:07:06,153] Trial 55 finished with value: 0.17865529068943592 and parameters: {'alpha': 184753.1319337574, 'use_snp_selection': False, 'iw_method': 'pc_logistic', 'iw_clip_max': 10.0, 'iw_prob_clip': 0.025995091271824682, 'iw_n_components': 1, 'iw_logistic_c': 1.0080088460428563e-05, 'iw_pca_fit': 'combined', 'iw_solver': 'lbfgs', 'iw_rho': 0.25}. Best is trial 11 with value: 0.18197711897437566.
[I 2026-04-24 16:10:48,522] Trial 56 finished with value: 0.14567099801798314 and parameters: {'alpha': 5414222.317537102, 'use_snp_selection': False, 'iw_method': 'pc_logistic', 'iw_clip_max': 10.0, 'iw_prob_clip': 0.025981895817641133, 'iw_n_components': 1, 'iw_logistic_c': 0.0031528396910177974, 'iw_pca_fit': 'combined', 'iw_solver': 'lbfgs', 'iw_rho': 0.5}. Best is trial 11 with value: 0.18197711897437566.
[I 2026-04-24 16:14:32,260] Trial 57 finished with value: 0.17272123159139238 and parameters: {'alpha': 663375.1444759419, 'use_snp_selection': False, 'iw_method': 'pc_logistic', 'iw_clip_max': 10.0, 'iw_prob_clip': 0.03609678437044444, 'iw_n_components': 1, 'iw_logistic_c': 1.09372703208672e-05, 'iw_pca_fit': 'combined', 'iw_solver': 'lbfgs', 'iw_rho': 0.25}. Best is trial 11 with value: 0.18197711897437566.
[I 2026-04-24 16:18:14,060] Trial 58 finished with value: 0.17755773376104653 and parameters: {'alpha': 85448.27962175632, 'use_snp_selection': False, 'iw_method': 'pc_logistic', 'iw_clip_max': 10.0, 'iw_prob_clip': 0.02263495757470887, 'iw_n_components': 1, 'iw_logistic_c': 0.022670755190023262, 'iw_pca_fit': 'combined', 'iw_solver': 'lbfgs', 'iw_rho': 0.75}. Best is trial 11 with value: 0.18197711897437566.
[I 2026-04-24 16:21:54,495] Trial 59 finished with value: 0.1789125724787223 and parameters: {'alpha': 251558.25363437482, 'use_snp_selection': False, 'iw_method': 'pc_logistic', 'iw_clip_max': 2.0, 'iw_prob_clip': 0.023046755352319495, 'iw_n_components': 1, 'iw_logistic_c': 1.0272857539604201e-05, 'iw_pca_fit': 'combined', 'iw_solver': 'lbfgs', 'iw_rho': 0.25}. Best is trial 11 with value: 0.18197711897437566.
[I 2026-04-24 16:25:35,175] Trial 60 finished with value: 0.1757908615063188 and parameters: {'alpha': 416578.71706867614, 'use_snp_selection': False, 'iw_method': 'pc_logistic', 'iw_clip_max': 2.0, 'iw_prob_clip': 0.028492526124675385, 'iw_n_components': 1, 'iw_logistic_c': 1.7399249064385802e-05, 'iw_pca_fit': 'combined', 'iw_solver': 'lbfgs', 'iw_rho': 0.1}. Best is trial 11 with value: 0.18197711897437566.
[I 2026-04-24 16:29:17,480] Trial 61 finished with value: 0.17908753807584052 and parameters: {'alpha': 180942.0930100882, 'use_snp_selection': False, 'iw_method': 'pc_logistic', 'iw_clip_max': 2.0, 'iw_prob_clip': 0.02677396511203515, 'iw_n_components': 1, 'iw_logistic_c': 5.411936073806335e-05, 'iw_pca_fit': 'combined', 'iw_solver': 'lbfgs', 'iw_rho': 0.25}. Best is trial 11 with value: 0.18197711897437566.
[I 2026-04-24 16:32:57,768] Trial 62 finished with value: 0.1787202456371259 and parameters: {'alpha': 244860.10803516806, 'use_snp_selection': False, 'iw_method': 'pc_logistic', 'iw_clip_max': 2.0, 'iw_prob_clip': 0.030508476711086904, 'iw_n_components': 1, 'iw_logistic_c': 1.1930317916437122e-05, 'iw_pca_fit': 'combined', 'iw_solver': 'lbfgs', 'iw_rho': 0.25}. Best is trial 11 with value: 0.18197711897437566.
[I 2026-04-24 16:36:41,351] Trial 63 finished with value: 0.13573431257748567 and parameters: {'alpha': 518.7983348507602, 'use_snp_selection': False, 'iw_method': 'pc_logistic', 'iw_clip_max': 2.0, 'iw_prob_clip': 0.03129053275870428, 'iw_n_components': 1, 'iw_logistic_c': 1.0134190837725242e-05, 'iw_pca_fit': 'combined', 'iw_solver': 'lbfgs', 'iw_rho': 0.25}. Best is trial 11 with value: 0.18197711897437566.
[I 2026-04-24 16:40:21,088] Trial 64 finished with value: 0.17828070883185176 and parameters: {'alpha': 256677.20766685175, 'use_snp_selection': False, 'iw_method': 'pc_logistic', 'iw_clip_max': 2.0, 'iw_prob_clip': 0.03552138984511761, 'iw_n_components': 1, 'iw_logistic_c': 0.00014423607576284712, 'iw_pca_fit': 'combined', 'iw_solver': 'lbfgs', 'iw_rho': 0.25}. Best is trial 11 with value: 0.18197711897437566.
[I 2026-04-24 16:44:01,158] Trial 65 finished with value: 0.17162489857112082 and parameters: {'alpha': 871228.561124234, 'use_snp_selection': False, 'iw_method': 'pc_logistic', 'iw_clip_max': 2.0, 'iw_prob_clip': 0.038913382089603994, 'iw_n_components': 1, 'iw_logistic_c': 0.00017850033195169305, 'iw_pca_fit': 'combined', 'iw_solver': 'lbfgs', 'iw_rho': 1.0}. Best is trial 11 with value: 0.18197711897437566.
[I 2026-04-24 16:47:40,661] Trial 66 finished with value: 0.17535420398409104 and parameters: {'alpha': 73941.4433294741, 'use_snp_selection': False, 'iw_method': 'pc_logistic', 'iw_clip_max': 2.0, 'iw_prob_clip': 0.04939877073821753, 'iw_n_components': 1, 'iw_logistic_c': 1.4699016222704496e-05, 'iw_pca_fit': 'combined', 'iw_solver': 'lbfgs', 'iw_rho': 0.75}. Best is trial 11 with value: 0.18197711897437566.
[I 2026-04-24 16:51:21,026] Trial 67 finished with value: 0.1662472942707876 and parameters: {'alpha': 1813000.6708571147, 'use_snp_selection': False, 'iw_method': 'pc_logistic', 'iw_clip_max': 2.0, 'iw_prob_clip': 0.03448729519836261, 'iw_n_components': 1, 'iw_logistic_c': 5.447381191598163e-05, 'iw_pca_fit': 'combined', 'iw_solver': 'lbfgs', 'iw_rho': 0.5}. Best is trial 11 with value: 0.18197711897437566.
[I 2026-04-24 16:55:01,693] Trial 68 finished with value: 0.17942956707434662 and parameters: {'alpha': 251087.34871070785, 'use_snp_selection': False, 'iw_method': 'pc_logistic', 'iw_clip_max': 2.0, 'iw_prob_clip': 0.041968021696452, 'iw_n_components': 1, 'iw_logistic_c': 1.06477522140759e-05, 'iw_pca_fit': 'combined', 'iw_solver': 'lbfgs', 'iw_rho': 1.0}. Best is trial 11 with value: 0.18197711897437566.
[I 2026-04-24 16:59:08,510] Trial 69 finished with value: 0.17363508940601255 and parameters: {'alpha': 50765.23385848766, 'use_snp_selection': False, 'iw_method': 'pc_logistic', 'iw_clip_max': 2.0, 'iw_prob_clip': 0.043317809363880584, 'iw_n_components': 1, 'iw_logistic_c': 1.3971621712863048e-05, 'iw_pca_fit': 'combined', 'iw_solver': 'lbfgs', 'iw_rho': 1.0}. Best is trial 11 with value: 0.18197711897437566.
[I 2026-04-24 17:01:20,752] Trial 70 finished with value: 0.1676676342195285 and parameters: {'alpha': 577650.8813841753, 'use_snp_selection': True, 'num_snps': 36654, 'iw_method': 'uniform', 'iw_clip_max': 2.0, 'iw_prob_clip': 0.030130498975228015}. Best is trial 11 with value: 0.18197711897437566.
[I 2026-04-24 17:05:34,052] Trial 71 finished with value: 0.17797429187085972 and parameters: {'alpha': 336039.3108203094, 'use_snp_selection': False, 'iw_method': 'pc_logistic', 'iw_clip_max': 2.0, 'iw_prob_clip': 0.04409645778432712, 'iw_n_components': 1, 'iw_logistic_c': 1.993400926319776e-05, 'iw_pca_fit': 'combined', 'iw_solver': 'lbfgs', 'iw_rho': 1.0}. Best is trial 11 with value: 0.18197711897437566.
[I 2026-04-24 17:09:39,608] Trial 72 finished with value: 0.1801875792866477 and parameters: {'alpha': 207414.62140010318, 'use_snp_selection': False, 'iw_method': 'pc_logistic', 'iw_clip_max': 2.0, 'iw_prob_clip': 0.04014271112868625, 'iw_n_components': 1, 'iw_logistic_c': 4.542763746615698e-05, 'iw_pca_fit': 'combined', 'iw_solver': 'lbfgs', 'iw_rho': 1.0}. Best is trial 11 with value: 0.18197711897437566.
[I 2026-04-24 17:13:48,414] Trial 73 finished with value: 0.1782639782525227 and parameters: {'alpha': 90074.28529786947, 'use_snp_selection': False, 'iw_method': 'pc_logistic', 'iw_clip_max': 2.0, 'iw_prob_clip': 0.038508905521719365, 'iw_n_components': 1, 'iw_logistic_c': 4.097303965871375e-05, 'iw_pca_fit': 'combined', 'iw_solver': 'lbfgs', 'iw_rho': 1.0}. Best is trial 11 with value: 0.18197711897437566.
[I 2026-04-24 17:17:50,266] Trial 74 finished with value: 0.17220808008506974 and parameters: {'alpha': 1142302.2198948811, 'use_snp_selection': False, 'iw_method': 'pc_logistic', 'iw_clip_max': 2.0, 'iw_prob_clip': 0.026749105617043776, 'iw_n_components': 1, 'iw_logistic_c': 1.097846424705363e-05, 'iw_pca_fit': 'combined', 'iw_solver': 'lbfgs', 'iw_rho': 1.0}. Best is trial 11 with value: 0.18197711897437566.
[I 2026-04-24 17:21:57,316] Trial 75 finished with value: 0.16958764575778387 and parameters: {'alpha': 29736.51117405702, 'use_snp_selection': False, 'iw_method': 'pc_logistic', 'iw_clip_max': 2.0, 'iw_prob_clip': 0.039850311034332564, 'iw_n_components': 5, 'iw_logistic_c': 4.840716339688747e-05, 'iw_pca_fit': 'combined', 'iw_solver': 'lbfgs', 'iw_rho': 1.0}. Best is trial 11 with value: 0.18197711897437566.
[I 2026-04-24 17:26:11,487] Trial 76 finished with value: 0.18222737477216427 and parameters: {'alpha': 194310.71498641302, 'use_snp_selection': False, 'iw_method': 'pc_logistic', 'iw_clip_max': 2.0, 'iw_prob_clip': 0.031238502050691782, 'iw_n_components': 1, 'iw_logistic_c': 2.18877565231222e-05, 'iw_pca_fit': 'combined', 'iw_solver': 'lbfgs', 'iw_rho': 1.0}. Best is trial 76 with value: 0.18222737477216427.
[I 2026-04-24 17:30:58,078] Trial 77 finished with value: 0.18186039403578294 and parameters: {'alpha': 433563.31694821233, 'use_snp_selection': False, 'iw_method': 'pc_logistic', 'iw_clip_max': 2.0, 'iw_prob_clip': 0.04142972870809973, 'iw_n_components': 20, 'iw_logistic_c': 0.0006291664607735823, 'iw_pca_fit': 'combined', 'iw_solver': 'lbfgs', 'iw_rho': 1.0}. Best is trial 76 with value: 0.18222737477216427.
[I 2026-04-24 17:35:18,894] Trial 78 finished with value: 0.18280762111807272 and parameters: {'alpha': 434474.9715093879, 'use_snp_selection': False, 'iw_method': 'pc_logistic', 'iw_clip_max': 2.0, 'iw_prob_clip': 0.047114990417966685, 'iw_n_components': 20, 'iw_logistic_c': 7.011620688440164e-05, 'iw_pca_fit': 'combined', 'iw_solver': 'lbfgs', 'iw_rho': 1.0}. Best is trial 78 with value: 0.18280762111807272.
[I 2026-04-24 17:39:47,846] Trial 79 finished with value: 0.18118302343600698 and parameters: {'alpha': 440860.90655290295, 'use_snp_selection': False, 'iw_method': 'pc_logistic', 'iw_clip_max': 2.0, 'iw_prob_clip': 0.045678109876518304, 'iw_n_components': 20, 'iw_logistic_c': 0.0005426376455282757, 'iw_pca_fit': 'combined', 'iw_solver': 'lbfgs', 'iw_rho': 1.0}. Best is trial 78 with value: 0.18280762111807272.
[I 2026-04-24 17:44:12,441] Trial 80 finished with value: 0.16644610137168328 and parameters: {'alpha': 3355994.1776436926, 'use_snp_selection': False, 'iw_method': 'pc_logistic', 'iw_clip_max': 2.0, 'iw_prob_clip': 0.04596617748393033, 'iw_n_components': 20, 'iw_logistic_c': 0.001084358560321353, 'iw_pca_fit': 'combined', 'iw_solver': 'lbfgs', 'iw_rho': 1.0}. Best is trial 78 with value: 0.18280762111807272.
[I 2026-04-24 17:48:35,073] Trial 81 finished with value: 0.18146271832143604 and parameters: {'alpha': 518928.6757083794, 'use_snp_selection': False, 'iw_method': 'pc_logistic', 'iw_clip_max': 2.0, 'iw_prob_clip': 0.04081948308935105, 'iw_n_components': 20, 'iw_logistic_c': 0.0006334998699653269, 'iw_pca_fit': 'combined', 'iw_solver': 'lbfgs', 'iw_rho': 1.0}. Best is trial 78 with value: 0.18280762111807272.
[I 2026-04-24 17:52:58,282] Trial 82 finished with value: 0.18000114755693702 and parameters: {'alpha': 577318.056709002, 'use_snp_selection': False, 'iw_method': 'pc_logistic', 'iw_clip_max': 2.0, 'iw_prob_clip': 0.041446959878607824, 'iw_n_components': 20, 'iw_logistic_c': 0.000610792182776214, 'iw_pca_fit': 'combined', 'iw_solver': 'lbfgs', 'iw_rho': 1.0}. Best is trial 78 with value: 0.18280762111807272.
[I 2026-04-24 17:57:21,008] Trial 83 finished with value: 0.18014380033595423 and parameters: {'alpha': 523832.32402446895, 'use_snp_selection': False, 'iw_method': 'pc_logistic', 'iw_clip_max': 2.0, 'iw_prob_clip': 0.04690428213465124, 'iw_n_components': 20, 'iw_logistic_c': 0.0005084512313115099, 'iw_pca_fit': 'combined', 'iw_solver': 'lbfgs', 'iw_rho': 1.0}. Best is trial 78 with value: 0.18280762111807272.
[I 2026-04-24 18:01:44,833] Trial 84 finished with value: 0.17887495866927206 and parameters: {'alpha': 509750.1315729505, 'use_snp_selection': False, 'iw_method': 'pc_logistic', 'iw_clip_max': 2.0, 'iw_prob_clip': 0.047149345559472054, 'iw_n_components': 20, 'iw_logistic_c': 0.002843418289118906, 'iw_pca_fit': 'combined', 'iw_solver': 'lbfgs', 'iw_rho': 1.0}. Best is trial 78 with value: 0.18280762111807272.
[I 2026-04-24 18:06:05,833] Trial 85 finished with value: 0.1751623054467829 and parameters: {'alpha': 1384237.2249523401, 'use_snp_selection': False, 'iw_method': 'pc_logistic', 'iw_clip_max': 2.0, 'iw_prob_clip': 0.04081207797629288, 'iw_n_components': 20, 'iw_logistic_c': 0.0006529736300333256, 'iw_pca_fit': 'combined', 'iw_solver': 'lbfgs', 'iw_rho': 1.0}. Best is trial 78 with value: 0.18280762111807272.
[I 2026-04-24 18:10:26,417] Trial 86 finished with value: 0.1782890477908795 and parameters: {'alpha': 868128.9682125169, 'use_snp_selection': False, 'iw_method': 'pc_logistic', 'iw_clip_max': 2.0, 'iw_prob_clip': 0.037290340958625406, 'iw_n_components': 20, 'iw_logistic_c': 0.0004792732696657217, 'iw_pca_fit': 'combined', 'iw_solver': 'lbfgs', 'iw_rho': 1.0}. Best is trial 78 with value: 0.18280762111807272.
[I 2026-04-24 18:14:51,370] Trial 87 finished with value: 0.18108192667389258 and parameters: {'alpha': 441988.257472726, 'use_snp_selection': False, 'iw_method': 'pc_logistic', 'iw_clip_max': 2.0, 'iw_prob_clip': 0.04543682986740816, 'iw_n_components': 20, 'iw_logistic_c': 0.00044723710763184394, 'iw_pca_fit': 'combined', 'iw_solver': 'lbfgs', 'iw_rho': 1.0}. Best is trial 78 with value: 0.18280762111807272.
[I 2026-04-24 18:17:00,758] Trial 88 finished with value: 0.17174012965182925 and parameters: {'alpha': 392101.5741628284, 'use_snp_selection': True, 'num_snps': 48232, 'iw_method': 'uniform', 'iw_clip_max': 2.0, 'iw_prob_clip': 0.045802468011795924}. Best is trial 78 with value: 0.18280762111807272.
[I 2026-04-24 18:21:25,569] Trial 89 finished with value: 0.16968564191291732 and parameters: {'alpha': 1929308.84366331, 'use_snp_selection': False, 'iw_method': 'pc_logistic', 'iw_clip_max': 2.0, 'iw_prob_clip': 0.04931592080620223, 'iw_n_components': 20, 'iw_logistic_c': 0.0016920635633992625, 'iw_pca_fit': 'combined', 'iw_solver': 'lbfgs', 'iw_rho': 1.0}. Best is trial 78 with value: 0.18280762111807272.
[I 2026-04-24 18:25:37,254] Trial 90 finished with value: 0.16019019191309797 and parameters: {'alpha': 3877220.789325311, 'use_snp_selection': False, 'iw_method': 'pc_logistic', 'iw_clip_max': 5.0, 'iw_prob_clip': 0.04477719126776599, 'iw_n_components': 20, 'iw_logistic_c': 0.00027674897604739205, 'iw_pca_fit': 'combined', 'iw_solver': 'lbfgs', 'iw_rho': 1.0}. Best is trial 78 with value: 0.18280762111807272.
[I 2026-04-24 18:29:59,566] Trial 91 finished with value: 0.18261432526273202 and parameters: {'alpha': 490422.5180474443, 'use_snp_selection': False, 'iw_method': 'pc_logistic', 'iw_clip_max': 2.0, 'iw_prob_clip': 0.04145027924399699, 'iw_n_components': 20, 'iw_logistic_c': 0.000603857820174007, 'iw_pca_fit': 'combined', 'iw_solver': 'lbfgs', 'iw_rho': 1.0}. Best is trial 78 with value: 0.18280762111807272.
[I 2026-04-24 18:34:19,943] Trial 92 finished with value: 0.1766329124451381 and parameters: {'alpha': 1184061.8260864755, 'use_snp_selection': False, 'iw_method': 'pc_logistic', 'iw_clip_max': 2.0, 'iw_prob_clip': 0.04251280415211497, 'iw_n_components': 20, 'iw_logistic_c': 0.0003801755893850626, 'iw_pca_fit': 'combined', 'iw_solver': 'lbfgs', 'iw_rho': 1.0}. Best is trial 78 with value: 0.18280762111807272.
[I 2026-04-24 18:38:49,549] Trial 93 finished with value: 0.18135983057561847 and parameters: {'alpha': 440041.7893197298, 'use_snp_selection': False, 'iw_method': 'pc_logistic', 'iw_clip_max': 2.0, 'iw_prob_clip': 0.03368886757722218, 'iw_n_components': 20, 'iw_logistic_c': 0.001986178339971751, 'iw_pca_fit': 'combined', 'iw_solver': 'lbfgs', 'iw_rho': 1.0}. Best is trial 78 with value: 0.18280762111807272.
[I 2026-04-24 18:43:15,385] Trial 94 finished with value: 0.17980772194208886 and parameters: {'alpha': 747888.5218166948, 'use_snp_selection': False, 'iw_method': 'pc_logistic', 'iw_clip_max': 2.0, 'iw_prob_clip': 0.033219025846591844, 'iw_n_components': 20, 'iw_logistic_c': 0.0010321869605020044, 'iw_pca_fit': 'combined', 'iw_solver': 'lbfgs', 'iw_rho': 1.0}. Best is trial 78 with value: 0.18280762111807272.
[I 2026-04-24 18:47:39,174] Trial 95 finished with value: 0.17795593839082324 and parameters: {'alpha': 107686.78940150431, 'use_snp_selection': False, 'iw_method': 'pc_logistic', 'iw_clip_max': 2.0, 'iw_prob_clip': 0.03703495243555908, 'iw_n_components': 20, 'iw_logistic_c': 0.009898242642878072, 'iw_pca_fit': 'combined', 'iw_solver': 'lbfgs', 'iw_rho': 1.0}. Best is trial 78 with value: 0.18280762111807272.
[I 2026-04-24 18:52:01,695] Trial 96 finished with value: 0.1634120186948466 and parameters: {'alpha': 352003.49538610707, 'use_snp_selection': False, 'iw_method': 'pc_logistic', 'iw_clip_max': 20.0, 'iw_prob_clip': 0.032278404879222025, 'iw_n_components': 20, 'iw_logistic_c': 0.002508438007280549, 'iw_pca_fit': 'combined', 'iw_solver': 'lbfgs', 'iw_rho': 1.0}. Best is trial 78 with value: 0.18280762111807272.
[I 2026-04-24 18:56:23,085] Trial 97 finished with value: 0.18160702124549266 and parameters: {'alpha': 429496.1373056003, 'use_snp_selection': False, 'iw_method': 'pc_logistic', 'iw_clip_max': 2.0, 'iw_prob_clip': 0.03987467316191732, 'iw_n_components': 20, 'iw_logistic_c': 0.0015170969404686332, 'iw_pca_fit': 'combined', 'iw_solver': 'lbfgs', 'iw_rho': 1.0}. Best is trial 78 with value: 0.18280762111807272.
[I 2026-04-24 19:00:44,509] Trial 98 finished with value: 0.17928338627377774 and parameters: {'alpha': 464666.84932699066, 'use_snp_selection': False, 'iw_method': 'pc_logistic', 'iw_clip_max': 2.0, 'iw_prob_clip': 0.005195848645860328, 'iw_n_components': 20, 'iw_logistic_c': 0.0014815797789463762, 'iw_pca_fit': 'combined', 'iw_solver': 'lbfgs', 'iw_rho': 1.0}. Best is trial 78 with value: 0.18280762111807272.
[I 2026-04-24 19:04:50,833] Trial 99 finished with value: 0.1764291424602043 and parameters: {'alpha': 923910.0976309757, 'use_snp_selection': False, 'iw_method': 'pc_logistic', 'iw_clip_max': 2.0, 'iw_prob_clip': 0.03539414753854999, 'iw_n_components': 20, 'iw_logistic_c': 0.00514787429659926, 'iw_pca_fit': 'combined', 'iw_solver': 'lbfgs', 'iw_rho': 1.0}. Best is trial 78 with value: 0.18280762111807272.
