Running from this directory: /cluster/work/simennes/Master_thesis
Name of job: ncv_ridge_iw
ID of job: 24337351
Array task ID: 3
The job was run on these nodes: idun-03-08
[I 2026-04-24 13:08:28,665] Trial 0 finished with value: 0.1581232481034395 and parameters: {'alpha': 12124.394605078569, 'use_snp_selection': True, 'num_snps': 5442, 'iw_method': 'pc_logistic', 'iw_clip_max': 20.0, 'iw_prob_clip': 0.010995744247886997, 'iw_n_components': 10, 'iw_logistic_c': 0.32697423511716517, 'iw_pca_fit': 'source', 'iw_solver': 'lbfgs', 'iw_rho': 0.75}. Best is trial 0 with value: 0.1581232481034395.
[I 2026-04-24 13:11:55,275] Trial 1 finished with value: 0.18993030931145619 and parameters: {'alpha': 161030.4172882474, 'use_snp_selection': False, 'iw_method': 'pc_logistic', 'iw_clip_max': 3.0, 'iw_prob_clip': 0.01279044980782762, 'iw_n_components': 1, 'iw_logistic_c': 2.0403812501143454e-05, 'iw_pca_fit': 'source', 'iw_solver': 'lbfgs', 'iw_rho': 0.75}. Best is trial 1 with value: 0.18993030931145619.
[I 2026-04-24 13:14:15,505] Trial 2 finished with value: 0.12878928674376017 and parameters: {'alpha': 188.160412035082, 'use_snp_selection': True, 'num_snps': 59763, 'iw_method': 'uniform', 'iw_clip_max': 5.0, 'iw_prob_clip': 0.0070654957343389896}. Best is trial 1 with value: 0.18993030931145619.
[I 2026-04-24 13:18:24,232] Trial 3 finished with value: 0.1663983416569622 and parameters: {'alpha': 16968.649375900754, 'use_snp_selection': True, 'num_snps': 29760, 'iw_method': 'pc_logistic', 'iw_clip_max': 20.0, 'iw_prob_clip': 0.0217559440148749, 'iw_n_components': 10, 'iw_logistic_c': 1.6382429914774194e-05, 'iw_pca_fit': 'combined', 'iw_solver': 'lbfgs', 'iw_rho': 0.1}. Best is trial 1 with value: 0.18993030931145619.
[I 2026-04-24 13:22:53,857] Trial 4 finished with value: 0.1711115996877689 and parameters: {'alpha': 19413.258622327583, 'use_snp_selection': True, 'num_snps': 41428, 'iw_method': 'pc_logistic', 'iw_clip_max': 20.0, 'iw_prob_clip': 0.008628235125022405, 'iw_n_components': 3, 'iw_logistic_c': 0.0004653526127488538, 'iw_pca_fit': 'source', 'iw_solver': 'lbfgs', 'iw_rho': 0.25}. Best is trial 1 with value: 0.18993030931145619.
[I 2026-04-24 13:25:07,356] Trial 5 finished with value: 0.18625707664546567 and parameters: {'alpha': 80135.2021263408, 'use_snp_selection': True, 'num_snps': 54789, 'iw_method': 'uniform', 'iw_clip_max': 3.0, 'iw_prob_clip': 0.012917216126205406}. Best is trial 1 with value: 0.18993030931145619.
[I 2026-04-24 13:26:44,966] Trial 6 finished with value: 0.17760531430933213 and parameters: {'alpha': 340178.6469095632, 'use_snp_selection': True, 'num_snps': 25889, 'iw_method': 'uniform', 'iw_clip_max': 3.0, 'iw_prob_clip': 0.020875611672958067}. Best is trial 1 with value: 0.18993030931145619.
[I 2026-04-24 13:28:10,067] Trial 7 finished with value: 0.16812376348385932 and parameters: {'alpha': 1242108.5193641477, 'use_snp_selection': True, 'num_snps': 15763, 'iw_method': 'uniform', 'iw_clip_max': 3.0, 'iw_prob_clip': 0.027212938580450624}. Best is trial 1 with value: 0.18993030931145619.
[I 2026-04-24 13:28:57,762] Trial 8 finished with value: 0.13035364467498164 and parameters: {'alpha': 576.4183768413645, 'use_snp_selection': False, 'iw_method': 'uniform', 'iw_clip_max': 2.0, 'iw_prob_clip': 0.0429488305231488}. Best is trial 1 with value: 0.18993030931145619.
[I 2026-04-24 13:30:27,593] Trial 9 finished with value: 0.17094961335136424 and parameters: {'alpha': 671771.9265477946, 'use_snp_selection': True, 'num_snps': 19046, 'iw_method': 'uniform', 'iw_clip_max': 20.0, 'iw_prob_clip': 0.016752592804942974}. Best is trial 1 with value: 0.18993030931145619.
[I 2026-04-24 13:33:51,864] Trial 10 finished with value: 0.16064989675283273 and parameters: {'alpha': 9837161.102143044, 'use_snp_selection': False, 'iw_method': 'pc_logistic', 'iw_clip_max': 10.0, 'iw_prob_clip': 0.006412966308601717, 'iw_n_components': 1, 'iw_logistic_c': 0.007218341230724956, 'iw_pca_fit': 'source', 'iw_solver': 'lbfgs', 'iw_rho': 0.75}. Best is trial 1 with value: 0.18993030931145619.
[I 2026-04-24 13:37:31,225] Trial 11 finished with value: 0.1916530208017844 and parameters: {'alpha': 96010.95041477351, 'use_snp_selection': False, 'iw_method': 'pc_logistic', 'iw_clip_max': 3.0, 'iw_prob_clip': 0.011944786904542556, 'iw_n_components': 1, 'iw_logistic_c': 1.399713636282935e-05, 'iw_pca_fit': 'combined', 'iw_solver': 'lbfgs', 'iw_rho': 1.0}. Best is trial 11 with value: 0.1916530208017844.
[I 2026-04-24 13:40:58,342] Trial 12 finished with value: 0.140396006273535 and parameters: {'alpha': 1917.5398603560736, 'use_snp_selection': False, 'iw_method': 'pc_logistic', 'iw_clip_max': 3.0, 'iw_prob_clip': 0.010287462279084293, 'iw_n_components': 1, 'iw_logistic_c': 1.4405825011316045e-05, 'iw_pca_fit': 'combined', 'iw_solver': 'lbfgs', 'iw_rho': 1.0}. Best is trial 11 with value: 0.1916530208017844.
[I 2026-04-24 13:44:36,145] Trial 13 finished with value: 0.12710066642295903 and parameters: {'alpha': 14.10762195162507, 'use_snp_selection': False, 'iw_method': 'pc_logistic', 'iw_clip_max': 3.0, 'iw_prob_clip': 0.005395008891956986, 'iw_n_components': 1, 'iw_logistic_c': 0.00020825293604129918, 'iw_pca_fit': 'combined', 'iw_solver': 'lbfgs', 'iw_rho': 0.5}. Best is trial 11 with value: 0.1916530208017844.
[I 2026-04-24 13:48:36,003] Trial 14 finished with value: 0.19186546426289391 and parameters: {'alpha': 179221.73356350392, 'use_snp_selection': False, 'iw_method': 'pc_logistic', 'iw_clip_max': 10.0, 'iw_prob_clip': 0.013228018135264173, 'iw_n_components': 5, 'iw_logistic_c': 0.0003955104018201011, 'iw_pca_fit': 'combined', 'iw_solver': 'lbfgs', 'iw_rho': 0.75}. Best is trial 14 with value: 0.19186546426289391.
[I 2026-04-24 13:52:36,213] Trial 15 finished with value: 0.16895026398822596 and parameters: {'alpha': 2243013.4503346873, 'use_snp_selection': False, 'iw_method': 'pc_logistic', 'iw_clip_max': 10.0, 'iw_prob_clip': 0.03814401537476811, 'iw_n_components': 5, 'iw_logistic_c': 0.0016704198717383005, 'iw_pca_fit': 'combined', 'iw_solver': 'lbfgs', 'iw_rho': 1.0}. Best is trial 14 with value: 0.19186546426289391.
[I 2026-04-24 13:56:23,565] Trial 16 finished with value: 0.1848395422339571 and parameters: {'alpha': 78751.73615299331, 'use_snp_selection': False, 'iw_method': 'pc_logistic', 'iw_clip_max': 10.0, 'iw_prob_clip': 0.016337217546298858, 'iw_n_components': 2, 'iw_logistic_c': 0.1491506486997185, 'iw_pca_fit': 'combined', 'iw_solver': 'lbfgs', 'iw_rho': 1.0}. Best is trial 14 with value: 0.19186546426289391.
[I 2026-04-24 14:01:00,674] Trial 17 finished with value: 0.13995115045371717 and parameters: {'alpha': 2876.6005892193916, 'use_snp_selection': False, 'iw_method': 'pc_logistic', 'iw_clip_max': 5.0, 'iw_prob_clip': 0.008404032820353733, 'iw_n_components': 20, 'iw_logistic_c': 0.00014364663654457723, 'iw_pca_fit': 'combined', 'iw_solver': 'lbfgs', 'iw_rho': 0.25}. Best is trial 14 with value: 0.19186546426289391.
[I 2026-04-24 14:04:56,549] Trial 18 finished with value: 0.1709670828745758 and parameters: {'alpha': 5536540.224665724, 'use_snp_selection': False, 'iw_method': 'pc_logistic', 'iw_clip_max': 2.0, 'iw_prob_clip': 0.030180635633727644, 'iw_n_components': 5, 'iw_logistic_c': 0.02444376533593859, 'iw_pca_fit': 'combined', 'iw_solver': 'lbfgs', 'iw_rho': 0.1}. Best is trial 14 with value: 0.19186546426289391.
[I 2026-04-24 14:08:55,847] Trial 19 finished with value: 0.18274766651470722 and parameters: {'alpha': 50796.41781511711, 'use_snp_selection': False, 'iw_method': 'pc_logistic', 'iw_clip_max': 10.0, 'iw_prob_clip': 0.019782677725256267, 'iw_n_components': 5, 'iw_logistic_c': 4.578484789170886, 'iw_pca_fit': 'combined', 'iw_solver': 'lbfgs', 'iw_rho': 0.5}. Best is trial 14 with value: 0.19186546426289391.
[I 2026-04-24 14:12:48,910] Trial 20 finished with value: 0.18845355928400334 and parameters: {'alpha': 300932.8295696652, 'use_snp_selection': False, 'iw_method': 'pc_logistic', 'iw_clip_max': 10.0, 'iw_prob_clip': 0.0132208114299853, 'iw_n_components': 2, 'iw_logistic_c': 7.660556642438239e-05, 'iw_pca_fit': 'combined', 'iw_solver': 'lbfgs', 'iw_rho': 1.0}. Best is trial 14 with value: 0.19186546426289391.
[I 2026-04-24 14:16:17,936] Trial 21 finished with value: 0.18976841894249186 and parameters: {'alpha': 167577.16240657217, 'use_snp_selection': False, 'iw_method': 'pc_logistic', 'iw_clip_max': 3.0, 'iw_prob_clip': 0.01288074042841002, 'iw_n_components': 1, 'iw_logistic_c': 1.1437775400944561e-05, 'iw_pca_fit': 'source', 'iw_solver': 'lbfgs', 'iw_rho': 0.75}. Best is trial 14 with value: 0.19186546426289391.
[I 2026-04-24 14:19:50,689] Trial 22 finished with value: 0.18286137932880914 and parameters: {'alpha': 52348.29053954271, 'use_snp_selection': False, 'iw_method': 'pc_logistic', 'iw_clip_max': 3.0, 'iw_prob_clip': 0.010024853244516081, 'iw_n_components': 1, 'iw_logistic_c': 6.163799783857561e-05, 'iw_pca_fit': 'source', 'iw_solver': 'lbfgs', 'iw_rho': 0.75}. Best is trial 14 with value: 0.19186546426289391.
[I 2026-04-24 14:24:13,916] Trial 23 finished with value: 0.1409245252395139 and parameters: {'alpha': 3186.7139427935876, 'use_snp_selection': False, 'iw_method': 'pc_logistic', 'iw_clip_max': 3.0, 'iw_prob_clip': 0.015016843960674917, 'iw_n_components': 20, 'iw_logistic_c': 0.0011913863851473387, 'iw_pca_fit': 'source', 'iw_solver': 'lbfgs', 'iw_rho': 0.75}. Best is trial 14 with value: 0.19186546426289391.
[I 2026-04-24 14:28:02,496] Trial 24 finished with value: 0.16848473984104778 and parameters: {'alpha': 2392302.1656883457, 'use_snp_selection': False, 'iw_method': 'pc_logistic', 'iw_clip_max': 5.0, 'iw_prob_clip': 0.008337097930288287, 'iw_n_components': 3, 'iw_logistic_c': 4.924069458664797e-05, 'iw_pca_fit': 'combined', 'iw_solver': 'lbfgs', 'iw_rho': 0.75}. Best is trial 14 with value: 0.19186546426289391.
[I 2026-04-24 14:31:37,677] Trial 25 finished with value: 0.18748425250032838 and parameters: {'alpha': 459530.0820375483, 'use_snp_selection': False, 'iw_method': 'pc_logistic', 'iw_clip_max': 2.0, 'iw_prob_clip': 0.011234014614399832, 'iw_n_components': 5, 'iw_logistic_c': 0.0007382862817812205, 'iw_pca_fit': 'source', 'iw_solver': 'lbfgs', 'iw_rho': 0.75}. Best is trial 14 with value: 0.19186546426289391.
[I 2026-04-24 14:35:11,838] Trial 26 finished with value: 0.18716397532688214 and parameters: {'alpha': 133286.17565853114, 'use_snp_selection': False, 'iw_method': 'pc_logistic', 'iw_clip_max': 10.0, 'iw_prob_clip': 0.01707730524671956, 'iw_n_components': 1, 'iw_logistic_c': 0.0038340652971076937, 'iw_pca_fit': 'combined', 'iw_solver': 'lbfgs', 'iw_rho': 1.0}. Best is trial 14 with value: 0.19186546426289391.
[I 2026-04-24 14:38:30,344] Trial 27 finished with value: 0.17213152515040137 and parameters: {'alpha': 26906.66736994706, 'use_snp_selection': False, 'iw_method': 'pc_logistic', 'iw_clip_max': 3.0, 'iw_prob_clip': 0.023454144076628103, 'iw_n_components': 1, 'iw_logistic_c': 4.3642006094972576e-05, 'iw_pca_fit': 'source', 'iw_solver': 'lbfgs', 'iw_rho': 0.75}. Best is trial 14 with value: 0.19186546426289391.
[I 2026-04-24 14:42:21,689] Trial 28 finished with value: 0.1452332173326637 and parameters: {'alpha': 4700.532275470839, 'use_snp_selection': False, 'iw_method': 'pc_logistic', 'iw_clip_max': 3.0, 'iw_prob_clip': 0.014226904945634703, 'iw_n_components': 5, 'iw_logistic_c': 0.00041081816659444746, 'iw_pca_fit': 'combined', 'iw_solver': 'lbfgs', 'iw_rho': 0.25}. Best is trial 14 with value: 0.19186546426289391.
[I 2026-04-24 14:45:46,160] Trial 29 finished with value: 0.1540866439593282 and parameters: {'alpha': 8774.46624675895, 'use_snp_selection': False, 'iw_method': 'pc_logistic', 'iw_clip_max': 10.0, 'iw_prob_clip': 0.011943566798295824, 'iw_n_components': 1, 'iw_logistic_c': 3.175603522411313e-05, 'iw_pca_fit': 'source', 'iw_solver': 'lbfgs', 'iw_rho': 0.5}. Best is trial 14 with value: 0.19186546426289391.
[I 2026-04-24 14:49:37,427] Trial 30 finished with value: 0.17984511243461074 and parameters: {'alpha': 1108884.9364995023, 'use_snp_selection': False, 'iw_method': 'pc_logistic', 'iw_clip_max': 5.0, 'iw_prob_clip': 0.010238412771703065, 'iw_n_components': 3, 'iw_logistic_c': 0.0001440344994593162, 'iw_pca_fit': 'combined', 'iw_solver': 'lbfgs', 'iw_rho': 0.1}. Best is trial 14 with value: 0.19186546426289391.
[I 2026-04-24 14:53:12,542] Trial 31 finished with value: 0.18990366374269124 and parameters: {'alpha': 191975.83599458646, 'use_snp_selection': False, 'iw_method': 'pc_logistic', 'iw_clip_max': 3.0, 'iw_prob_clip': 0.012386737479885338, 'iw_n_components': 1, 'iw_logistic_c': 1.094208554199256e-05, 'iw_pca_fit': 'source', 'iw_solver': 'lbfgs', 'iw_rho': 0.75}. Best is trial 14 with value: 0.19186546426289391.
[I 2026-04-24 14:56:38,775] Trial 32 finished with value: 0.18926365199522735 and parameters: {'alpha': 164026.77525711892, 'use_snp_selection': False, 'iw_method': 'pc_logistic', 'iw_clip_max': 3.0, 'iw_prob_clip': 0.01804482177181605, 'iw_n_components': 1, 'iw_logistic_c': 1.0100484794788254e-05, 'iw_pca_fit': 'source', 'iw_solver': 'lbfgs', 'iw_rho': 0.75}. Best is trial 14 with value: 0.19186546426289391.
[I 2026-04-24 15:00:06,109] Trial 33 finished with value: 0.1753560661570063 and parameters: {'alpha': 30485.567737959842, 'use_snp_selection': False, 'iw_method': 'pc_logistic', 'iw_clip_max': 3.0, 'iw_prob_clip': 0.00919120501825674, 'iw_n_components': 1, 'iw_logistic_c': 3.124316521301121e-05, 'iw_pca_fit': 'source', 'iw_solver': 'lbfgs', 'iw_rho': 0.75}. Best is trial 14 with value: 0.19186546426289391.
[I 2026-04-24 15:03:35,240] Trial 34 finished with value: 0.1895764069341422 and parameters: {'alpha': 226394.86001764846, 'use_snp_selection': False, 'iw_method': 'pc_logistic', 'iw_clip_max': 20.0, 'iw_prob_clip': 0.00763518191343256, 'iw_n_components': 1, 'iw_logistic_c': 0.000161178389216857, 'iw_pca_fit': 'source', 'iw_solver': 'lbfgs', 'iw_rho': 0.75}. Best is trial 14 with value: 0.19186546426289391.
[I 2026-04-24 15:05:41,776] Trial 35 finished with value: 0.1572357967161065 and parameters: {'alpha': 7941.507983833459, 'use_snp_selection': True, 'num_snps': 42891, 'iw_method': 'uniform', 'iw_clip_max': 3.0, 'iw_prob_clip': 0.01441773987596284}. Best is trial 14 with value: 0.19186546426289391.
[I 2026-04-24 15:09:20,125] Trial 36 finished with value: 0.18678236260907372 and parameters: {'alpha': 85415.45763293073, 'use_snp_selection': False, 'iw_method': 'pc_logistic', 'iw_clip_max': 3.0, 'iw_prob_clip': 0.01157375869928963, 'iw_n_components': 2, 'iw_logistic_c': 2.478559230679065e-05, 'iw_pca_fit': 'source', 'iw_solver': 'lbfgs', 'iw_rho': 1.0}. Best is trial 14 with value: 0.19186546426289391.
[I 2026-04-24 15:11:21,452] Trial 37 finished with value: 0.17842077311094895 and parameters: {'alpha': 795840.4086531076, 'use_snp_selection': True, 'num_snps': 39999, 'iw_method': 'uniform', 'iw_clip_max': 20.0, 'iw_prob_clip': 0.01890810336004539}. Best is trial 14 with value: 0.19186546426289391.
[I 2026-04-24 15:15:28,735] Trial 38 finished with value: 0.16468632365320507 and parameters: {'alpha': 16984.91708147541, 'use_snp_selection': False, 'iw_method': 'pc_logistic', 'iw_clip_max': 2.0, 'iw_prob_clip': 0.007204991408205321, 'iw_n_components': 10, 'iw_logistic_c': 0.028101045797807353, 'iw_pca_fit': 'source', 'iw_solver': 'lbfgs', 'iw_rho': 0.75}. Best is trial 14 with value: 0.19186546426289391.
[I 2026-04-24 15:17:36,544] Trial 39 finished with value: 0.1732201564742824 and parameters: {'alpha': 1968619.2749239898, 'use_snp_selection': True, 'num_snps': 51093, 'iw_method': 'uniform', 'iw_clip_max': 3.0, 'iw_prob_clip': 0.025070436886883693}. Best is trial 14 with value: 0.19186546426289391.
[I 2026-04-24 15:22:13,189] Trial 40 finished with value: 0.12744760435351968 and parameters: {'alpha': 55.83441674584838, 'use_snp_selection': False, 'iw_method': 'pc_logistic', 'iw_clip_max': 3.0, 'iw_prob_clip': 0.0121620336024789, 'iw_n_components': 20, 'iw_logistic_c': 9.09300791827229, 'iw_pca_fit': 'combined', 'iw_solver': 'lbfgs', 'iw_rho': 0.75}. Best is trial 14 with value: 0.19186546426289391.
[I 2026-04-24 15:25:36,986] Trial 41 finished with value: 0.1897237307345767 and parameters: {'alpha': 165224.41000021852, 'use_snp_selection': False, 'iw_method': 'pc_logistic', 'iw_clip_max': 3.0, 'iw_prob_clip': 0.013099755595763738, 'iw_n_components': 1, 'iw_logistic_c': 1.1320333668115241e-05, 'iw_pca_fit': 'source', 'iw_solver': 'lbfgs', 'iw_rho': 0.75}. Best is trial 14 with value: 0.19186546426289391.
[I 2026-04-24 15:29:01,886] Trial 42 finished with value: 0.18766510819869148 and parameters: {'alpha': 411986.7030492352, 'use_snp_selection': False, 'iw_method': 'pc_logistic', 'iw_clip_max': 3.0, 'iw_prob_clip': 0.009581339679084656, 'iw_n_components': 1, 'iw_logistic_c': 2.0110083273509855e-05, 'iw_pca_fit': 'source', 'iw_solver': 'lbfgs', 'iw_rho': 0.75}. Best is trial 14 with value: 0.19186546426289391.
[I 2026-04-24 15:33:07,201] Trial 43 finished with value: 0.17727414509520162 and parameters: {'alpha': 40245.96977170305, 'use_snp_selection': False, 'iw_method': 'pc_logistic', 'iw_clip_max': 3.0, 'iw_prob_clip': 0.01310928966300668, 'iw_n_components': 10, 'iw_logistic_c': 1.0562061846586796e-05, 'iw_pca_fit': 'source', 'iw_solver': 'lbfgs', 'iw_rho': 0.75}. Best is trial 14 with value: 0.19186546426289391.
[I 2026-04-24 15:36:35,299] Trial 44 finished with value: 0.18921163097599597 and parameters: {'alpha': 127969.66324995461, 'use_snp_selection': False, 'iw_method': 'pc_logistic', 'iw_clip_max': 3.0, 'iw_prob_clip': 0.015727242131616612, 'iw_n_components': 1, 'iw_logistic_c': 8.485409976009087e-05, 'iw_pca_fit': 'source', 'iw_solver': 'lbfgs', 'iw_rho': 0.75}. Best is trial 14 with value: 0.19186546426289391.
[I 2026-04-24 15:38:25,259] Trial 45 finished with value: 0.16419989109908018 and parameters: {'alpha': 572037.1979817948, 'use_snp_selection': True, 'num_snps': 5575, 'iw_method': 'pc_logistic', 'iw_clip_max': 20.0, 'iw_prob_clip': 0.014610238646206497, 'iw_n_components': 1, 'iw_logistic_c': 0.00031736228123882033, 'iw_pca_fit': 'source', 'iw_solver': 'lbfgs', 'iw_rho': 0.1}. Best is trial 14 with value: 0.19186546426289391.
[I 2026-04-24 15:39:11,834] Trial 46 finished with value: 0.18122473831717317 and parameters: {'alpha': 78314.44129488683, 'use_snp_selection': False, 'iw_method': 'uniform', 'iw_clip_max': 10.0, 'iw_prob_clip': 0.011027575191457547}. Best is trial 14 with value: 0.19186546426289391.
[I 2026-04-24 15:42:34,121] Trial 47 finished with value: 0.18722640960868142 and parameters: {'alpha': 235448.2460145344, 'use_snp_selection': False, 'iw_method': 'pc_logistic', 'iw_clip_max': 5.0, 'iw_prob_clip': 0.008950133871882303, 'iw_n_components': 1, 'iw_logistic_c': 3.005613257764646e-05, 'iw_pca_fit': 'source', 'iw_solver': 'lbfgs', 'iw_rho': 0.25}. Best is trial 14 with value: 0.19186546426289391.
[I 2026-04-24 15:46:24,140] Trial 48 finished with value: 0.16832119905412685 and parameters: {'alpha': 14981.1825473981, 'use_snp_selection': False, 'iw_method': 'pc_logistic', 'iw_clip_max': 3.0, 'iw_prob_clip': 0.006400126870817441, 'iw_n_components': 5, 'iw_logistic_c': 1.841416668715795e-05, 'iw_pca_fit': 'combined', 'iw_solver': 'lbfgs', 'iw_rho': 1.0}. Best is trial 14 with value: 0.19186546426289391.
[I 2026-04-24 15:50:24,180] Trial 49 finished with value: 0.1781264043898633 and parameters: {'alpha': 1091313.8299973966, 'use_snp_selection': False, 'iw_method': 'pc_logistic', 'iw_clip_max': 3.0, 'iw_prob_clip': 0.02172520797610717, 'iw_n_components': 10, 'iw_logistic_c': 8.824631578774305e-05, 'iw_pca_fit': 'source', 'iw_solver': 'lbfgs', 'iw_rho': 0.75}. Best is trial 14 with value: 0.19186546426289391.
[I 2026-04-24 15:51:52,211] Trial 50 finished with value: 0.1733595137902446 and parameters: {'alpha': 86452.55100020002, 'use_snp_selection': True, 'num_snps': 16677, 'iw_method': 'uniform', 'iw_clip_max': 10.0, 'iw_prob_clip': 0.010785370414935248}. Best is trial 14 with value: 0.19186546426289391.
[I 2026-04-24 15:55:15,541] Trial 51 finished with value: 0.18977565293965099 and parameters: {'alpha': 217988.3234715135, 'use_snp_selection': False, 'iw_method': 'pc_logistic', 'iw_clip_max': 3.0, 'iw_prob_clip': 0.013173914498411687, 'iw_n_components': 1, 'iw_logistic_c': 1.0146057013578235e-05, 'iw_pca_fit': 'source', 'iw_solver': 'lbfgs', 'iw_rho': 0.75}. Best is trial 14 with value: 0.19186546426289391.
[I 2026-04-24 15:58:43,573] Trial 52 finished with value: 0.18944000741237618 and parameters: {'alpha': 271110.9138561067, 'use_snp_selection': False, 'iw_method': 'pc_logistic', 'iw_clip_max': 3.0, 'iw_prob_clip': 0.013646523361230225, 'iw_n_components': 1, 'iw_logistic_c': 1.645221934603853e-05, 'iw_pca_fit': 'source', 'iw_solver': 'lbfgs', 'iw_rho': 0.75}. Best is trial 14 with value: 0.19186546426289391.
[I 2026-04-24 16:02:09,585] Trial 53 finished with value: 0.17099140596539425 and parameters: {'alpha': 3895715.200964809, 'use_snp_selection': False, 'iw_method': 'pc_logistic', 'iw_clip_max': 3.0, 'iw_prob_clip': 0.01223874725515625, 'iw_n_components': 1, 'iw_logistic_c': 1.0784890547205949e-05, 'iw_pca_fit': 'source', 'iw_solver': 'lbfgs', 'iw_rho': 0.75}. Best is trial 14 with value: 0.19186546426289391.
[I 2026-04-24 16:05:46,960] Trial 54 finished with value: 0.1863887603823369 and parameters: {'alpha': 577240.4006541207, 'use_snp_selection': False, 'iw_method': 'pc_logistic', 'iw_clip_max': 3.0, 'iw_prob_clip': 0.016244225118025955, 'iw_n_components': 1, 'iw_logistic_c': 4.478332926439645e-05, 'iw_pca_fit': 'combined', 'iw_solver': 'lbfgs', 'iw_rho': 0.75}. Best is trial 14 with value: 0.19186546426289391.
