[I 2026-05-04 02:11:17,427] Trial 64 finished with value: 0.24818966989726715 and parameters: {'alpha': 252496.77800150728, 'use_snp_selection': False, 'iw_method': 'pc_logistic', 'iw_clip_max': 5.0, 'iw_prob_clip': 0.007250296888891768, 'iw_n_components': 30, 'iw_logistic_c': 1.3608715772685933e-05, 'iw_pca_fit': 'combined', 'iw_solver': 'lbfgs', 'iw_rho': 1.0}. Best is trial 46 with value: 0.26045509895470215.
[I 2026-05-04 02:14:01,127] Trial 65 finished with value: 0.25442478500372423 and parameters: {'alpha': 196286.58178333123, 'use_snp_selection': False, 'iw_method': 'pc_logistic', 'iw_clip_max': 1.5, 'iw_prob_clip': 0.003873888298839597, 'iw_n_components': 80, 'iw_logistic_c': 3.896618900829827e-07, 'iw_pca_fit': 'combined', 'iw_solver': 'lbfgs', 'iw_rho': 0.75}. Best is trial 46 with value: 0.26045509895470215.
[I 2026-05-04 02:16:28,663] Trial 66 finished with value: 0.25828541463388743 and parameters: {'alpha': 224482.6947294313, 'use_snp_selection': False, 'iw_method': 'pc_logistic', 'iw_clip_max': 5.0, 'iw_prob_clip': 0.0005512926030115375, 'iw_n_components': 10, 'iw_logistic_c': 2.072163222230669e-06, 'iw_pca_fit': 'combined', 'iw_solver': 'lbfgs', 'iw_rho': 0.5}. Best is trial 46 with value: 0.26045509895470215.
[I 2026-05-04 02:19:13,905] Trial 67 finished with value: 0.2567144820747641 and parameters: {'alpha': 142291.07865078544, 'use_snp_selection': False, 'iw_method': 'pc_logistic', 'iw_clip_max': 2.0, 'iw_prob_clip': 0.0319203726227731, 'iw_n_components': 30, 'iw_logistic_c': 0.031195985636540965, 'iw_pca_fit': 'combined', 'iw_solver': 'lbfgs', 'iw_rho': 0.9}. Best is trial 46 with value: 0.26045509895470215.
[I 2026-05-04 02:22:26,871] Trial 68 finished with value: 0.24847030171483095 and parameters: {'alpha': 346255.3792793554, 'use_snp_selection': False, 'iw_method': 'pc_logistic', 'iw_clip_max': 3.0, 'iw_prob_clip': 0.01681413183741481, 'iw_n_components': 80, 'iw_logistic_c': 2.663776130819584e-05, 'iw_pca_fit': 'combined', 'iw_solver': 'lbfgs', 'iw_rho': 0.75}. Best is trial 46 with value: 0.26045509895470215.
[I 2026-05-04 02:25:32,401] Trial 69 finished with value: 0.2522198385742734 and parameters: {'alpha': 261267.64656358317, 'use_snp_selection': False, 'iw_method': 'pc_logistic', 'iw_clip_max': 1.25, 'iw_prob_clip': 0.006389863354433144, 'iw_n_components': 40, 'iw_logistic_c': 5.443577609382363e-06, 'iw_pca_fit': 'combined', 'iw_solver': 'lbfgs', 'iw_rho': 1.0}. Best is trial 46 with value: 0.26045509895470215.
[I 2026-05-04 02:28:28,517] Trial 70 finished with value: 0.22630728352432966 and parameters: {'alpha': 2191858.4046218665, 'use_snp_selection': False, 'iw_method': 'pc_logistic', 'iw_clip_max': 2.0, 'iw_prob_clip': 0.011476211008366642, 'iw_n_components': 20, 'iw_logistic_c': 2.690930414124961e-07, 'iw_pca_fit': 'combined', 'iw_solver': 'lbfgs', 'iw_rho': 0.5}. Best is trial 46 with value: 0.26045509895470215.
[I 2026-05-04 02:31:42,543] Trial 71 finished with value: 0.25859941028639877 and parameters: {'alpha': 213718.9133032212, 'use_snp_selection': False, 'iw_method': 'pc_logistic', 'iw_clip_max': 5.0, 'iw_prob_clip': 0.009596883147498554, 'iw_n_components': 80, 'iw_logistic_c': 1.0004468132557142e-06, 'iw_pca_fit': 'combined', 'iw_solver': 'lbfgs', 'iw_rho': 0.75}. Best is trial 46 with value: 0.26045509895470215.
[I 2026-05-04 02:34:56,887] Trial 72 finished with value: 0.2608799341701323 and parameters: {'alpha': 193496.05297010113, 'use_snp_selection': False, 'iw_method': 'pc_logistic', 'iw_clip_max': 5.0, 'iw_prob_clip': 0.008301075379641752, 'iw_n_components': 80, 'iw_logistic_c': 1.8368499862011085e-06, 'iw_pca_fit': 'combined', 'iw_solver': 'lbfgs', 'iw_rho': 0.75}. Best is trial 72 with value: 0.2608799341701323.
[I 2026-05-04 02:38:11,319] Trial 73 finished with value: 0.26024379599600733 and parameters: {'alpha': 163318.07275991852, 'use_snp_selection': False, 'iw_method': 'pc_logistic', 'iw_clip_max': 5.0, 'iw_prob_clip': 0.007229865142878434, 'iw_n_components': 80, 'iw_logistic_c': 2.4228639483818545e-06, 'iw_pca_fit': 'combined', 'iw_solver': 'lbfgs', 'iw_rho': 0.75}. Best is trial 72 with value: 0.2608799341701323.
[I 2026-05-04 02:41:25,625] Trial 74 finished with value: 0.26071651253914824 and parameters: {'alpha': 163168.42822845507, 'use_snp_selection': False, 'iw_method': 'pc_logistic', 'iw_clip_max': 5.0, 'iw_prob_clip': 0.005718476877682273, 'iw_n_components': 80, 'iw_logistic_c': 2.090601259945246e-06, 'iw_pca_fit': 'combined', 'iw_solver': 'lbfgs', 'iw_rho': 0.75}. Best is trial 72 with value: 0.2608799341701323.
[I 2026-05-04 02:44:49,889] Trial 75 finished with value: 0.2424269789909046 and parameters: {'alpha': 155909.98678589443, 'use_snp_selection': False, 'iw_method': 'pc_logistic', 'iw_clip_max': 5.0, 'iw_prob_clip': 0.005691720308125185, 'iw_n_components': 80, 'iw_logistic_c': 4.578796190877981, 'iw_pca_fit': 'combined', 'iw_solver': 'lbfgs', 'iw_rho': 0.75}. Best is trial 72 with value: 0.2608799341701323.
[I 2026-05-04 02:48:04,280] Trial 76 finished with value: 0.25313406037756625 and parameters: {'alpha': 136714.7166684038, 'use_snp_selection': False, 'iw_method': 'pc_logistic', 'iw_clip_max': 5.0, 'iw_prob_clip': 0.003483058540693548, 'iw_n_components': 80, 'iw_logistic_c': 9.219340971477821e-06, 'iw_pca_fit': 'combined', 'iw_solver': 'lbfgs', 'iw_rho': 0.75}. Best is trial 72 with value: 0.2608799341701323.
[I 2026-05-04 02:51:05,021] Trial 77 finished with value: 0.2547437450922977 and parameters: {'alpha': 170356.96117712662, 'use_snp_selection': False, 'iw_method': 'pc_logistic', 'iw_clip_max': 3.0, 'iw_prob_clip': 0.007734110254838617, 'iw_n_components': 30, 'iw_logistic_c': 2.684236724992076e-07, 'iw_pca_fit': 'combined', 'iw_solver': 'lbfgs', 'iw_rho': 0.75}. Best is trial 72 with value: 0.2608799341701323.
[I 2026-05-04 02:54:18,996] Trial 78 finished with value: 0.26043165325602713 and parameters: {'alpha': 195446.97249611074, 'use_snp_selection': False, 'iw_method': 'pc_logistic', 'iw_clip_max': 5.0, 'iw_prob_clip': 0.006172057318467722, 'iw_n_components': 80, 'iw_logistic_c': 2.5787415901668882e-06, 'iw_pca_fit': 'combined', 'iw_solver': 'lbfgs', 'iw_rho': 0.9}. Best is trial 72 with value: 0.2608799341701323.
[I 2026-05-04 02:57:30,817] Trial 79 finished with value: 0.25663226070042383 and parameters: {'alpha': 188613.59024280173, 'use_snp_selection': False, 'iw_method': 'pc_logistic', 'iw_clip_max': 1.5, 'iw_prob_clip': 0.004590502375985934, 'iw_n_components': 40, 'iw_logistic_c': 0.5982695633507344, 'iw_pca_fit': 'combined', 'iw_solver': 'lbfgs', 'iw_rho': 0.9}. Best is trial 72 with value: 0.2608799341701323.
[I 2026-05-04 03:00:36,657] Trial 80 finished with value: 0.2425195106029979 and parameters: {'alpha': 1042093.9209989194, 'use_snp_selection': False, 'iw_method': 'pc_logistic', 'iw_clip_max': 5.0, 'iw_prob_clip': 0.005538008800915777, 'iw_n_components': 50, 'iw_logistic_c': 5.8300743574261375e-06, 'iw_pca_fit': 'combined', 'iw_solver': 'lbfgs', 'iw_rho': 0.9}. Best is trial 72 with value: 0.2608799341701323.
[I 2026-05-04 03:03:51,945] Trial 81 finished with value: 0.2590247827310347 and parameters: {'alpha': 167986.055090067, 'use_snp_selection': False, 'iw_method': 'pc_logistic', 'iw_clip_max': 5.0, 'iw_prob_clip': 0.006505496499369207, 'iw_n_components': 80, 'iw_logistic_c': 3.0333966164677672e-06, 'iw_pca_fit': 'combined', 'iw_solver': 'lbfgs', 'iw_rho': 0.9}. Best is trial 72 with value: 0.2608799341701323.
[I 2026-05-04 03:07:05,988] Trial 82 finished with value: 0.2608412298130144 and parameters: {'alpha': 187239.73808194656, 'use_snp_selection': False, 'iw_method': 'pc_logistic', 'iw_clip_max': 5.0, 'iw_prob_clip': 0.008043765817193686, 'iw_n_components': 80, 'iw_logistic_c': 1.8039289680204485e-06, 'iw_pca_fit': 'combined', 'iw_solver': 'lbfgs', 'iw_rho': 0.75}. Best is trial 72 with value: 0.2608799341701323.
[I 2026-05-04 03:10:20,194] Trial 83 finished with value: 0.2604985259540492 and parameters: {'alpha': 243353.61340214455, 'use_snp_selection': False, 'iw_method': 'pc_logistic', 'iw_clip_max': 5.0, 'iw_prob_clip': 0.007941514855563731, 'iw_n_components': 80, 'iw_logistic_c': 2.287354347510548e-06, 'iw_pca_fit': 'combined', 'iw_solver': 'lbfgs', 'iw_rho': 0.75}. Best is trial 72 with value: 0.2608799341701323.
[I 2026-05-04 03:13:34,412] Trial 84 finished with value: 0.2575355485369322 and parameters: {'alpha': 146649.87885087804, 'use_snp_selection': False, 'iw_method': 'pc_logistic', 'iw_clip_max': 5.0, 'iw_prob_clip': 0.0026883069193752687, 'iw_n_components': 80, 'iw_logistic_c': 5.403961386897875e-07, 'iw_pca_fit': 'combined', 'iw_solver': 'lbfgs', 'iw_rho': 0.9}. Best is trial 72 with value: 0.2608799341701323.
[I 2026-05-04 03:16:48,055] Trial 85 finished with value: 0.25312386756392646 and parameters: {'alpha': 193538.04487193, 'use_snp_selection': False, 'iw_method': 'pc_logistic', 'iw_clip_max': 5.0, 'iw_prob_clip': 0.008092172088697887, 'iw_n_components': 80, 'iw_logistic_c': 1.467224592043675e-07, 'iw_pca_fit': 'combined', 'iw_solver': 'lbfgs', 'iw_rho': 0.75}. Best is trial 72 with value: 0.2608799341701323.
[I 2026-05-04 03:19:55,377] Trial 86 finished with value: 0.25941045528359846 and parameters: {'alpha': 246253.5200884162, 'use_snp_selection': False, 'iw_method': 'pc_logistic', 'iw_clip_max': 5.0, 'iw_prob_clip': 0.006402600329907891, 'iw_n_components': 60, 'iw_logistic_c': 2.0363021989411836e-06, 'iw_pca_fit': 'combined', 'iw_solver': 'lbfgs', 'iw_rho': 0.5}. Best is trial 72 with value: 0.2608799341701323.
[I 2026-05-04 03:23:14,260] Trial 87 finished with value: 0.2568851401209702 and parameters: {'alpha': 159379.57208792766, 'use_snp_selection': False, 'iw_method': 'pc_logistic', 'iw_clip_max': 1.25, 'iw_prob_clip': 0.004826536354879019, 'iw_n_components': 80, 'iw_logistic_c': 0.0011923767091241368, 'iw_pca_fit': 'combined', 'iw_solver': 'lbfgs', 'iw_rho': 0.75}. Best is trial 72 with value: 0.2608799341701323.
[I 2026-05-04 03:26:28,808] Trial 88 finished with value: 0.2548373764705267 and parameters: {'alpha': 137547.00700970195, 'use_snp_selection': False, 'iw_method': 'pc_logistic', 'iw_clip_max': 5.0, 'iw_prob_clip': 0.008434277580600284, 'iw_n_components': 80, 'iw_logistic_c': 6.658589102971015e-06, 'iw_pca_fit': 'combined', 'iw_solver': 'lbfgs', 'iw_rho': 0.75}. Best is trial 72 with value: 0.2608799341701323.
[I 2026-05-04 03:29:43,331] Trial 89 finished with value: 0.2510755301106159 and parameters: {'alpha': 239217.94534835662, 'use_snp_selection': False, 'iw_method': 'pc_logistic', 'iw_clip_max': 5.0, 'iw_prob_clip': 0.014217382763324776, 'iw_n_components': 80, 'iw_logistic_c': 2.025977964847779e-05, 'iw_pca_fit': 'combined', 'iw_solver': 'lbfgs', 'iw_rho': 0.75}. Best is trial 72 with value: 0.2608799341701323.
[I 2026-05-04 03:32:37,279] Trial 90 finished with value: 0.25599136445775306 and parameters: {'alpha': 185385.77203146726, 'use_snp_selection': False, 'iw_method': 'pc_logistic', 'iw_clip_max': 2.0, 'iw_prob_clip': 0.006930193256460686, 'iw_n_components': 10, 'iw_logistic_c': 6.343514458218831e-07, 'iw_pca_fit': 'combined', 'iw_solver': 'lbfgs', 'iw_rho': 0.75}. Best is trial 72 with value: 0.2608799341701323.
[I 2026-05-04 03:35:50,779] Trial 91 finished with value: 0.25983385026213635 and parameters: {'alpha': 290421.8127002626, 'use_snp_selection': False, 'iw_method': 'pc_logistic', 'iw_clip_max': 5.0, 'iw_prob_clip': 0.006039906241344549, 'iw_n_components': 80, 'iw_logistic_c': 2.3419221100958942e-06, 'iw_pca_fit': 'combined', 'iw_solver': 'lbfgs', 'iw_rho': 0.75}. Best is trial 72 with value: 0.2608799341701323.
[I 2026-05-04 03:39:02,541] Trial 92 finished with value: 0.2570711583808939 and parameters: {'alpha': 319489.82810974825, 'use_snp_selection': False, 'iw_method': 'pc_logistic', 'iw_clip_max': 5.0, 'iw_prob_clip': 0.0056437043813849985, 'iw_n_components': 80, 'iw_logistic_c': 3.7617451182954234e-06, 'iw_pca_fit': 'combined', 'iw_solver': 'lbfgs', 'iw_rho': 0.75}. Best is trial 72 with value: 0.2608799341701323.
[I 2026-05-04 03:42:14,201] Trial 93 finished with value: 0.25732257169211314 and parameters: {'alpha': 374319.9482969472, 'use_snp_selection': False, 'iw_method': 'pc_logistic', 'iw_clip_max': 5.0, 'iw_prob_clip': 0.009677520761938431, 'iw_n_components': 80, 'iw_logistic_c': 1.5471257120860817e-06, 'iw_pca_fit': 'combined', 'iw_solver': 'lbfgs', 'iw_rho': 0.75}. Best is trial 72 with value: 0.2608799341701323.
[I 2026-05-04 03:45:25,827] Trial 94 finished with value: 0.25103997003841577 and parameters: {'alpha': 304381.5576317277, 'use_snp_selection': False, 'iw_method': 'pc_logistic', 'iw_clip_max': 5.0, 'iw_prob_clip': 0.003972521699362329, 'iw_n_components': 80, 'iw_logistic_c': 1.0463880134450909e-05, 'iw_pca_fit': 'combined', 'iw_solver': 'lbfgs', 'iw_rho': 0.75}. Best is trial 72 with value: 0.2608799341701323.
[I 2026-05-04 03:48:37,117] Trial 95 finished with value: 0.258140312405661 and parameters: {'alpha': 199163.97057167962, 'use_snp_selection': False, 'iw_method': 'pc_logistic', 'iw_clip_max': 5.0, 'iw_prob_clip': 0.007802335219426786, 'iw_n_components': 80, 'iw_logistic_c': 3.913481406768887e-06, 'iw_pca_fit': 'combined', 'iw_solver': 'lbfgs', 'iw_rho': 0.75}. Best is trial 72 with value: 0.2608799341701323.
[I 2026-05-04 03:51:49,474] Trial 96 finished with value: 0.24565047449344304 and parameters: {'alpha': 265039.9059124458, 'use_snp_selection': False, 'iw_method': 'pc_logistic', 'iw_clip_max': 5.0, 'iw_prob_clip': 0.005222345236527126, 'iw_n_components': 80, 'iw_logistic_c': 5.0619557638334764e-05, 'iw_pca_fit': 'combined', 'iw_solver': 'lbfgs', 'iw_rho': 0.75}. Best is trial 72 with value: 0.2608799341701323.
[I 2026-05-04 03:54:52,965] Trial 97 finished with value: 0.26089367245416184 and parameters: {'alpha': 234832.27088145245, 'use_snp_selection': False, 'iw_method': 'pc_logistic', 'iw_clip_max': 5.0, 'iw_prob_clip': 0.0059576394364601925, 'iw_n_components': 50, 'iw_logistic_c': 1.7330827938919845e-06, 'iw_pca_fit': 'combined', 'iw_solver': 'lbfgs', 'iw_rho': 1.0}. Best is trial 97 with value: 0.26089367245416184.
[I 2026-05-04 03:57:56,317] Trial 98 finished with value: 0.2576608196693763 and parameters: {'alpha': 127953.08307934843, 'use_snp_selection': False, 'iw_method': 'pc_logistic', 'iw_clip_max': 5.0, 'iw_prob_clip': 0.008798604444575767, 'iw_n_components': 50, 'iw_logistic_c': 6.569202503187485e-07, 'iw_pca_fit': 'combined', 'iw_solver': 'lbfgs', 'iw_rho': 0.75}. Best is trial 97 with value: 0.26089367245416184.
[I 2026-05-04 04:01:00,088] Trial 99 finished with value: 0.25805962201242344 and parameters: {'alpha': 228893.4931904722, 'use_snp_selection': False, 'iw_method': 'pc_logistic', 'iw_clip_max': 3.0, 'iw_prob_clip': 0.006737808531617298, 'iw_n_components': 50, 'iw_logistic_c': 1.5824751506207118e-06, 'iw_pca_fit': 'combined', 'iw_solver': 'lbfgs', 'iw_rho': 0.75}. Best is trial 97 with value: 0.26089367245416184.
[I 2026-05-04 04:04:03,780] Trial 100 finished with value: 0.25271276744373566 and parameters: {'alpha': 154239.65990445812, 'use_snp_selection': False, 'iw_method': 'pc_logistic', 'iw_clip_max': 5.0, 'iw_prob_clip': 0.004177121759660772, 'iw_n_components': 50, 'iw_logistic_c': 6.858354711371276e-06, 'iw_pca_fit': 'combined', 'iw_solver': 'lbfgs', 'iw_rho': 0.9}. Best is trial 97 with value: 0.26089367245416184.
[I 2026-05-04 04:07:14,727] Trial 101 finished with value: 0.26115674533355865 and parameters: {'alpha': 181336.74819382236, 'use_snp_selection': False, 'iw_method': 'pc_logistic', 'iw_clip_max': 5.0, 'iw_prob_clip': 0.005878194368632997, 'iw_n_components': 80, 'iw_logistic_c': 1.678990545545593e-06, 'iw_pca_fit': 'combined', 'iw_solver': 'lbfgs', 'iw_rho': 1.0}. Best is trial 101 with value: 0.26115674533355865.
[I 2026-05-04 04:10:26,286] Trial 102 finished with value: 0.25880543104450093 and parameters: {'alpha': 178883.9616060273, 'use_snp_selection': False, 'iw_method': 'pc_logistic', 'iw_clip_max': 5.0, 'iw_prob_clip': 0.00722154926181283, 'iw_n_components': 80, 'iw_logistic_c': 3.1652851205065975e-06, 'iw_pca_fit': 'combined', 'iw_solver': 'lbfgs', 'iw_rho': 1.0}. Best is trial 101 with value: 0.26115674533355865.
[I 2026-05-04 04:13:37,674] Trial 103 finished with value: 0.2599677342765961 and parameters: {'alpha': 198963.97493798102, 'use_snp_selection': False, 'iw_method': 'pc_logistic', 'iw_clip_max': 5.0, 'iw_prob_clip': 0.004959164495242558, 'iw_n_components': 80, 'iw_logistic_c': 1.0762111796934214e-06, 'iw_pca_fit': 'combined', 'iw_solver': 'lbfgs', 'iw_rho': 1.0}. Best is trial 101 with value: 0.26115674533355865.
[I 2026-05-04 04:16:49,038] Trial 104 finished with value: 0.25893315338843215 and parameters: {'alpha': 110380.2323191649, 'use_snp_selection': False, 'iw_method': 'pc_logistic', 'iw_clip_max': 5.0, 'iw_prob_clip': 0.0048766666851519395, 'iw_n_components': 80, 'iw_logistic_c': 9.269554642296928e-07, 'iw_pca_fit': 'combined', 'iw_solver': 'lbfgs', 'iw_rho': 1.0}. Best is trial 101 with value: 0.26115674533355865.
[I 2026-05-04 04:19:42,484] Trial 105 finished with value: 0.25380365320177095 and parameters: {'alpha': 201591.5456979697, 'use_snp_selection': False, 'iw_method': 'pc_logistic', 'iw_clip_max': 5.0, 'iw_prob_clip': 0.010423638890210795, 'iw_n_components': 20, 'iw_logistic_c': 1.948615683834702e-07, 'iw_pca_fit': 'combined', 'iw_solver': 'lbfgs', 'iw_rho': 1.0}. Best is trial 101 with value: 0.26115674533355865.
[I 2026-05-04 04:22:53,741] Trial 106 finished with value: 0.25523424148818974 and parameters: {'alpha': 166282.69205795092, 'use_snp_selection': False, 'iw_method': 'pc_logistic', 'iw_clip_max': 1.5, 'iw_prob_clip': 0.01285188062670578, 'iw_n_components': 80, 'iw_logistic_c': 1.3496930037199474e-06, 'iw_pca_fit': 'combined', 'iw_solver': 'lbfgs', 'iw_rho': 1.0}. Best is trial 101 with value: 0.26115674533355865.
[I 2026-05-04 04:26:05,363] Trial 107 finished with value: 0.2564049670042182 and parameters: {'alpha': 183720.06861505721, 'use_snp_selection': False, 'iw_method': 'pc_logistic', 'iw_clip_max': 5.0, 'iw_prob_clip': 0.003418610379543497, 'iw_n_components': 80, 'iw_logistic_c': 4.13116321913865e-07, 'iw_pca_fit': 'combined', 'iw_solver': 'lbfgs', 'iw_rho': 1.0}. Best is trial 101 with value: 0.26115674533355865.
[I 2026-05-04 04:29:09,970] Trial 108 finished with value: 0.2588433442949286 and parameters: {'alpha': 217901.37012611996, 'use_snp_selection': False, 'iw_method': 'pc_logistic', 'iw_clip_max': 5.0, 'iw_prob_clip': 0.0014777250738525723, 'iw_n_components': 60, 'iw_logistic_c': 8.670998994094167e-07, 'iw_pca_fit': 'combined', 'iw_solver': 'lbfgs', 'iw_rho': 1.0}. Best is trial 101 with value: 0.26115674533355865.
[I 2026-05-04 04:32:21,496] Trial 109 finished with value: 0.25579262548459714 and parameters: {'alpha': 240881.70596420788, 'use_snp_selection': False, 'iw_method': 'pc_logistic', 'iw_clip_max': 5.0, 'iw_prob_clip': 0.008914715973887528, 'iw_n_components': 80, 'iw_logistic_c': 4.044168808011634e-06, 'iw_pca_fit': 'combined', 'iw_solver': 'lbfgs', 'iw_rho': 1.0}. Best is trial 101 with value: 0.26115674533355865.
[I 2026-05-04 04:35:25,926] Trial 110 finished with value: 0.26108866202097086 and parameters: {'alpha': 150334.751471097, 'use_snp_selection': False, 'iw_method': 'pc_logistic', 'iw_clip_max': 5.0, 'iw_prob_clip': 0.0028646196194698987, 'iw_n_components': 50, 'iw_logistic_c': 1.9013730871701581e-06, 'iw_pca_fit': 'combined', 'iw_solver': 'lbfgs', 'iw_rho': 1.0}. Best is trial 101 with value: 0.26115674533355865.
[I 2026-05-04 04:38:30,370] Trial 111 finished with value: 0.25935814893274917 and parameters: {'alpha': 151627.9619215729, 'use_snp_selection': False, 'iw_method': 'pc_logistic', 'iw_clip_max': 5.0, 'iw_prob_clip': 0.002158898947558574, 'iw_n_components': 50, 'iw_logistic_c': 2.523246380373784e-06, 'iw_pca_fit': 'combined', 'iw_solver': 'lbfgs', 'iw_rho': 1.0}. Best is trial 101 with value: 0.26115674533355865.
[I 2026-05-04 04:41:35,477] Trial 112 finished with value: 0.2608555440415502 and parameters: {'alpha': 191197.2195720944, 'use_snp_selection': False, 'iw_method': 'pc_logistic', 'iw_clip_max': 5.0, 'iw_prob_clip': 0.006095132989895171, 'iw_n_components': 50, 'iw_logistic_c': 1.703838927994854e-06, 'iw_pca_fit': 'combined', 'iw_solver': 'lbfgs', 'iw_rho': 1.0}. Best is trial 101 with value: 0.26115674533355865.
[I 2026-05-04 04:44:40,977] Trial 113 finished with value: 0.26101414470506196 and parameters: {'alpha': 162349.62853720543, 'use_snp_selection': False, 'iw_method': 'pc_logistic', 'iw_clip_max': 5.0, 'iw_prob_clip': 0.006081356274970155, 'iw_n_components': 50, 'iw_logistic_c': 1.5337579855555126e-06, 'iw_pca_fit': 'combined', 'iw_solver': 'lbfgs', 'iw_rho': 1.0}. Best is trial 101 with value: 0.26115674533355865.
[I 2026-05-04 04:47:46,787] Trial 114 finished with value: 0.2604524657400142 and parameters: {'alpha': 134419.2430721877, 'use_snp_selection': False, 'iw_method': 'pc_logistic', 'iw_clip_max': 5.0, 'iw_prob_clip': 0.0072120612700971075, 'iw_n_components': 50, 'iw_logistic_c': 1.4453765169146627e-06, 'iw_pca_fit': 'combined', 'iw_solver': 'lbfgs', 'iw_rho': 1.0}. Best is trial 101 with value: 0.26115674533355865.
[I 2026-05-04 04:50:49,985] Trial 115 finished with value: 0.25460043991233344 and parameters: {'alpha': 119350.67565700247, 'use_snp_selection': False, 'iw_method': 'pc_logistic', 'iw_clip_max': 1.25, 'iw_prob_clip': 0.005782199412008574, 'iw_n_components': 50, 'iw_logistic_c': 6.229121813964977e-07, 'iw_pca_fit': 'combined', 'iw_solver': 'lbfgs', 'iw_rho': 1.0}. Best is trial 101 with value: 0.26115674533355865.
[I 2026-05-04 04:53:53,590] Trial 116 finished with value: 0.2601598549111945 and parameters: {'alpha': 132538.584761359, 'use_snp_selection': False, 'iw_method': 'pc_logistic', 'iw_clip_max': 5.0, 'iw_prob_clip': 0.008161966699748585, 'iw_n_components': 50, 'iw_logistic_c': 1.6768512509996522e-06, 'iw_pca_fit': 'combined', 'iw_solver': 'lbfgs', 'iw_rho': 1.0}. Best is trial 101 with value: 0.26115674533355865.
