Running from this directory: /cluster/work/simennes/Master_thesis
Name of job: ncv_ridge_iw
ID of job: 24335605
Array task ID: 11
The job was run on these nodes: idun-03-21
[I 2026-04-23 15:39:22,638] Trial 0 finished with value: 0.16624865555119828 and parameters: {'alpha': 113703.38004442609, 'use_snp_selection': True, 'num_snps': 5442, 'iw_method': 'pc_logistic', 'iw_clip_max': 10.0, 'iw_n_components': 5, 'iw_logistic_c': 4.927310296129143, 'iw_pca_fit': 'source', 'iw_solver': 'lbfgs'}. Best is trial 0 with value: 0.16624865555119828.
[I 2026-04-23 15:46:06,298] Trial 1 finished with value: 0.16201565448751903 and parameters: {'alpha': 31403.568254918682, 'use_snp_selection': True, 'num_snps': 52878, 'iw_method': 'pc_logistic', 'iw_clip_max': 25.0, 'iw_n_components': 50, 'iw_logistic_c': 0.0215474878351802, 'iw_pca_fit': 'combined', 'iw_solver': 'lbfgs'}. Best is trial 0 with value: 0.16624865555119828.
[I 2026-04-23 15:46:55,167] Trial 2 finished with value: 0.17398685214446352 and parameters: {'alpha': 843188.1730429748, 'use_snp_selection': False, 'iw_method': 'uniform', 'iw_clip_max': 10.0}. Best is trial 2 with value: 0.17398685214446352.
[I 2026-04-23 15:50:24,554] Trial 3 finished with value: 0.12119750743915211 and parameters: {'alpha': 1608.6968668824506, 'use_snp_selection': True, 'num_snps': 20835, 'iw_method': 'pc_logistic', 'iw_clip_max': None, 'iw_n_components': 10, 'iw_logistic_c': 1.0216001618506627, 'iw_pca_fit': 'source', 'iw_solver': 'lbfgs'}. Best is trial 2 with value: 0.17398685214446352.
[I 2026-04-23 15:51:14,027] Trial 4 finished with value: 0.17661206881076588 and parameters: {'alpha': 304631.0485153137, 'use_snp_selection': False, 'iw_method': 'uniform', 'iw_clip_max': 25.0}. Best is trial 4 with value: 0.17661206881076588.
[I 2026-04-23 15:55:44,827] Trial 5 finished with value: 0.14547009091095292 and parameters: {'alpha': 1969.1835550007406, 'use_snp_selection': False, 'iw_method': 'pc_logistic', 'iw_clip_max': None, 'iw_n_components': 10, 'iw_logistic_c': 72.13019609570544, 'iw_pca_fit': 'source', 'iw_solver': 'lbfgs'}. Best is trial 4 with value: 0.17661206881076588.
[I 2026-04-23 15:59:42,417] Trial 6 finished with value: 0.16486502928313654 and parameters: {'alpha': 102451.8239242939, 'use_snp_selection': True, 'num_snps': 28882, 'iw_method': 'pc_logistic', 'iw_clip_max': None, 'iw_n_components': 5, 'iw_logistic_c': 74.89693291900525, 'iw_pca_fit': 'source', 'iw_solver': 'lbfgs'}. Best is trial 4 with value: 0.17661206881076588.
[I 2026-04-23 16:00:29,713] Trial 7 finished with value: 0.13173823567098022 and parameters: {'alpha': 2141.2178673431476, 'use_snp_selection': False, 'iw_method': 'uniform', 'iw_clip_max': 25.0}. Best is trial 4 with value: 0.17661206881076588.
[I 2026-04-23 16:02:44,061] Trial 8 finished with value: 0.16782323789617629 and parameters: {'alpha': 5044402.471344981, 'use_snp_selection': True, 'num_snps': 45718, 'iw_method': 'uniform', 'iw_clip_max': 5.0}. Best is trial 4 with value: 0.17661206881076588.
[I 2026-04-23 16:07:30,770] Trial 9 finished with value: 0.16480770097143477 and parameters: {'alpha': 6685.17962248224, 'use_snp_selection': False, 'iw_method': 'pc_logistic', 'iw_clip_max': 25.0, 'iw_n_components': 10, 'iw_logistic_c': 60.72281367077526, 'iw_pca_fit': 'combined', 'iw_solver': 'lbfgs'}. Best is trial 4 with value: 0.17661206881076588.
[I 2026-04-23 16:08:22,780] Trial 10 finished with value: 0.17390739700735278 and parameters: {'alpha': 860571.7420672657, 'use_snp_selection': False, 'iw_method': 'uniform', 'iw_clip_max': 5.0}. Best is trial 4 with value: 0.17661206881076588.
[I 2026-04-23 16:09:13,196] Trial 11 finished with value: 0.1742432439256094 and parameters: {'alpha': 788941.4897203294, 'use_snp_selection': False, 'iw_method': 'uniform', 'iw_clip_max': 10.0}. Best is trial 4 with value: 0.17661206881076588.
[I 2026-04-23 16:10:03,724] Trial 12 finished with value: 0.1748903698784546 and parameters: {'alpha': 662429.7344273377, 'use_snp_selection': False, 'iw_method': 'uniform', 'iw_clip_max': 10.0}. Best is trial 4 with value: 0.17661206881076588.
[I 2026-04-23 16:10:54,971] Trial 13 finished with value: 0.16763914311053915 and parameters: {'alpha': 6288680.884093956, 'use_snp_selection': False, 'iw_method': 'uniform', 'iw_clip_max': 25.0}. Best is trial 4 with value: 0.17661206881076588.
[I 2026-04-23 16:11:45,559] Trial 14 finished with value: 0.17661754671459504 and parameters: {'alpha': 285374.8412309771, 'use_snp_selection': False, 'iw_method': 'uniform', 'iw_clip_max': 10.0}. Best is trial 14 with value: 0.17661754671459504.
[I 2026-04-23 16:12:36,160] Trial 15 finished with value: 0.16182573245966927 and parameters: {'alpha': 36021.612679774575, 'use_snp_selection': False, 'iw_method': 'uniform', 'iw_clip_max': 25.0}. Best is trial 14 with value: 0.17661754671459504.
[I 2026-04-23 16:13:26,844] Trial 16 finished with value: 0.17659951984121589 and parameters: {'alpha': 314464.6358887838, 'use_snp_selection': False, 'iw_method': 'uniform', 'iw_clip_max': 10.0}. Best is trial 14 with value: 0.17661754671459504.
[I 2026-04-23 16:14:17,468] Trial 17 finished with value: 0.17019162701016655 and parameters: {'alpha': 2320042.028519574, 'use_snp_selection': False, 'iw_method': 'uniform', 'iw_clip_max': 5.0}. Best is trial 14 with value: 0.17661754671459504.
[I 2026-04-23 16:15:07,993] Trial 18 finished with value: 0.15826116570936896 and parameters: {'alpha': 27007.985396542343, 'use_snp_selection': False, 'iw_method': 'uniform', 'iw_clip_max': 25.0}. Best is trial 14 with value: 0.17661754671459504.
[I 2026-04-23 16:15:58,735] Trial 19 finished with value: 0.17661340407360698 and parameters: {'alpha': 279485.34672008036, 'use_snp_selection': False, 'iw_method': 'uniform', 'iw_clip_max': 10.0}. Best is trial 14 with value: 0.17661754671459504.
[I 2026-04-23 16:16:49,074] Trial 20 finished with value: 0.17633341754875076 and parameters: {'alpha': 218440.3724252272, 'use_snp_selection': False, 'iw_method': 'uniform', 'iw_clip_max': 10.0}. Best is trial 14 with value: 0.17661754671459504.
[I 2026-04-23 16:17:39,256] Trial 21 finished with value: 0.17656711848715811 and parameters: {'alpha': 257125.92219158183, 'use_snp_selection': False, 'iw_method': 'uniform', 'iw_clip_max': 10.0}. Best is trial 14 with value: 0.17661754671459504.
[I 2026-04-23 16:18:28,989] Trial 22 finished with value: 0.1708190207962383 and parameters: {'alpha': 1927130.7298349522, 'use_snp_selection': False, 'iw_method': 'uniform', 'iw_clip_max': 10.0}. Best is trial 14 with value: 0.17661754671459504.
[I 2026-04-23 16:19:18,295] Trial 23 finished with value: 0.16620086947385096 and parameters: {'alpha': 52379.465924825876, 'use_snp_selection': False, 'iw_method': 'uniform', 'iw_clip_max': 10.0}. Best is trial 14 with value: 0.17661754671459504.
[I 2026-04-23 16:20:07,964] Trial 24 finished with value: 0.15014734155732687 and parameters: {'alpha': 14156.596085560506, 'use_snp_selection': False, 'iw_method': 'uniform', 'iw_clip_max': 10.0}. Best is trial 14 with value: 0.17661754671459504.
[I 2026-04-23 16:20:58,667] Trial 25 finished with value: 0.17639969716870496 and parameters: {'alpha': 380216.4465511375, 'use_snp_selection': False, 'iw_method': 'uniform', 'iw_clip_max': 25.0}. Best is trial 14 with value: 0.17661754671459504.
[I 2026-04-23 16:22:18,838] Trial 26 finished with value: 0.17245802015447076 and parameters: {'alpha': 134092.85293479793, 'use_snp_selection': True, 'num_snps': 7641, 'iw_method': 'uniform', 'iw_clip_max': None}. Best is trial 14 with value: 0.17661754671459504.
[I 2026-04-23 16:23:07,088] Trial 27 finished with value: 0.17064796916069688 and parameters: {'alpha': 2024495.1704106322, 'use_snp_selection': False, 'iw_method': 'uniform', 'iw_clip_max': 5.0}. Best is trial 14 with value: 0.17661754671459504.
[I 2026-04-23 16:23:53,921] Trial 28 finished with value: 0.16838603476297662 and parameters: {'alpha': 64224.67809918259, 'use_snp_selection': False, 'iw_method': 'uniform', 'iw_clip_max': 10.0}. Best is trial 14 with value: 0.17661754671459504.
[I 2026-04-23 16:30:52,275] Trial 29 finished with value: 0.1611546967138026 and parameters: {'alpha': 125322.26245952384, 'use_snp_selection': True, 'num_snps': 59351, 'iw_method': 'pc_logistic', 'iw_clip_max': 10.0, 'iw_n_components': 20, 'iw_logistic_c': 0.012508090354298252, 'iw_pca_fit': 'combined', 'iw_solver': 'lbfgs'}. Best is trial 14 with value: 0.17661754671459504.
[I 2026-04-23 16:31:39,611] Trial 30 finished with value: 0.1762323503269032 and parameters: {'alpha': 417033.41096874856, 'use_snp_selection': False, 'iw_method': 'uniform', 'iw_clip_max': 25.0}. Best is trial 14 with value: 0.17661754671459504.
[I 2026-04-23 16:32:27,851] Trial 31 finished with value: 0.17625758075019968 and parameters: {'alpha': 210924.99754249767, 'use_snp_selection': False, 'iw_method': 'uniform', 'iw_clip_max': 10.0}. Best is trial 14 with value: 0.17661754671459504.
[I 2026-04-23 16:33:15,632] Trial 32 finished with value: 0.17604560658845664 and parameters: {'alpha': 453580.5227974925, 'use_snp_selection': False, 'iw_method': 'uniform', 'iw_clip_max': 10.0}. Best is trial 14 with value: 0.17661754671459504.
[I 2026-04-23 16:34:04,794] Trial 33 finished with value: 0.176171402174843 and parameters: {'alpha': 203583.90576639338, 'use_snp_selection': False, 'iw_method': 'uniform', 'iw_clip_max': 10.0}. Best is trial 14 with value: 0.17661754671459504.
[I 2026-04-23 16:39:40,405] Trial 34 finished with value: 0.14640558831360123 and parameters: {'alpha': 1435644.2800371416, 'use_snp_selection': True, 'num_snps': 39816, 'iw_method': 'pc_logistic', 'iw_clip_max': 10.0, 'iw_n_components': 50, 'iw_logistic_c': 0.11088291658462143, 'iw_pca_fit': 'combined', 'iw_solver': 'lbfgs'}. Best is trial 14 with value: 0.17661754671459504.
[I 2026-04-23 16:40:30,586] Trial 35 finished with value: 0.16839366514901297 and parameters: {'alpha': 64272.413679495, 'use_snp_selection': False, 'iw_method': 'uniform', 'iw_clip_max': 10.0}. Best is trial 14 with value: 0.17661754671459504.
[I 2026-04-23 16:45:17,475] Trial 36 finished with value: 0.1201506985200668 and parameters: {'alpha': 3490340.917437751, 'use_snp_selection': False, 'iw_method': 'pc_logistic', 'iw_clip_max': None, 'iw_n_components': 20, 'iw_logistic_c': 2.450859166450563, 'iw_pca_fit': 'combined', 'iw_solver': 'lbfgs'}. Best is trial 14 with value: 0.17661754671459504.
[I 2026-04-23 16:46:55,785] Trial 37 finished with value: 0.16845862594766423 and parameters: {'alpha': 1026119.8949101826, 'use_snp_selection': True, 'num_snps': 19401, 'iw_method': 'uniform', 'iw_clip_max': 25.0}. Best is trial 14 with value: 0.17661754671459504.
[I 2026-04-23 16:47:46,610] Trial 38 finished with value: 0.17646863919719344 and parameters: {'alpha': 362603.8924245954, 'use_snp_selection': False, 'iw_method': 'uniform', 'iw_clip_max': 10.0}. Best is trial 14 with value: 0.17661754671459504.
[I 2026-04-23 16:52:32,523] Trial 39 finished with value: 0.15804192172423057 and parameters: {'alpha': 136008.7178898217, 'use_snp_selection': False, 'iw_method': 'pc_logistic', 'iw_clip_max': None, 'iw_n_components': 50, 'iw_logistic_c': 0.09004632774032269, 'iw_pca_fit': 'source', 'iw_solver': 'lbfgs'}. Best is trial 14 with value: 0.17661754671459504.
[I 2026-04-23 16:54:35,405] Trial 40 finished with value: 0.17428900423528484 and parameters: {'alpha': 83725.27292790748, 'use_snp_selection': True, 'num_snps': 33990, 'iw_method': 'uniform', 'iw_clip_max': 5.0}. Best is trial 14 with value: 0.17661754671459504.
[I 2026-04-23 16:55:26,914] Trial 41 finished with value: 0.17631162772531125 and parameters: {'alpha': 216157.8764807642, 'use_snp_selection': False, 'iw_method': 'uniform', 'iw_clip_max': 10.0}. Best is trial 14 with value: 0.17661754671459504.
[I 2026-04-23 16:56:16,496] Trial 42 finished with value: 0.17661880278747835 and parameters: {'alpha': 290273.08280423016, 'use_snp_selection': False, 'iw_method': 'uniform', 'iw_clip_max': 10.0}. Best is trial 42 with value: 0.17661880278747835.
[I 2026-04-23 16:57:03,467] Trial 43 finished with value: 0.1752637070361788 and parameters: {'alpha': 594288.7484246953, 'use_snp_selection': False, 'iw_method': 'uniform', 'iw_clip_max': 10.0}. Best is trial 42 with value: 0.17661880278747835.
[I 2026-04-23 16:57:49,933] Trial 44 finished with value: 0.17264265099027687 and parameters: {'alpha': 1185461.7294721245, 'use_snp_selection': False, 'iw_method': 'uniform', 'iw_clip_max': 10.0}. Best is trial 42 with value: 0.17661880278747835.
[I 2026-04-23 16:58:37,011] Trial 45 finished with value: 0.17521419707852284 and parameters: {'alpha': 603189.4661715555, 'use_snp_selection': False, 'iw_method': 'uniform', 'iw_clip_max': 25.0}. Best is trial 42 with value: 0.17661880278747835.
[I 2026-04-23 16:59:23,827] Trial 46 finished with value: 0.1765349951150555 and parameters: {'alpha': 342575.63687196875, 'use_snp_selection': False, 'iw_method': 'uniform', 'iw_clip_max': 10.0}. Best is trial 42 with value: 0.17661880278747835.
[I 2026-04-23 17:03:49,053] Trial 47 finished with value: 0.1610878928163337 and parameters: {'alpha': 164751.9425899244, 'use_snp_selection': False, 'iw_method': 'pc_logistic', 'iw_clip_max': 10.0, 'iw_n_components': 20, 'iw_logistic_c': 9.092628649818078, 'iw_pca_fit': 'combined', 'iw_solver': 'lbfgs'}. Best is trial 42 with value: 0.17661880278747835.
[I 2026-04-23 17:04:36,123] Trial 48 finished with value: 0.17661618215786082 and parameters: {'alpha': 299465.7739161122, 'use_snp_selection': False, 'iw_method': 'uniform', 'iw_clip_max': 25.0}. Best is trial 42 with value: 0.17661880278747835.
[I 2026-04-23 17:05:23,157] Trial 49 finished with value: 0.17087800062629066 and parameters: {'alpha': 83152.77485969316, 'use_snp_selection': False, 'iw_method': 'uniform', 'iw_clip_max': 25.0}. Best is trial 42 with value: 0.17661880278747835.
