Running from this directory: /cluster/work/simennes/Master_thesis
Name of job: ncv_ridge_iw
ID of job: 24351989
Array task ID: 14
The job was run on these nodes: idun-05-18
[I 2026-04-28 16:19:10,891] Trial 0 finished with value: 0.17255102440565942 and parameters: {'alpha': 233144.78773166405, 'use_snp_selection': False, 'iw_method': 'pc_logistic', 'iw_clip_max': 10.0, 'iw_prob_clip': 0.010431250548547025, 'iw_n_components': 5, 'iw_logistic_c': 0.024278386754340225, 'iw_pca_fit': 'source', 'iw_solver': 'lbfgs', 'iw_rho': 1.0}. Best is trial 0 with value: 0.17255102440565942.
[I 2026-04-28 16:22:56,940] Trial 1 finished with value: 0.1686299862199715 and parameters: {'alpha': 69538.92138947408, 'use_snp_selection': False, 'iw_method': 'pc_logistic', 'iw_clip_max': 10.0, 'iw_prob_clip': 0.016575882684432525, 'iw_n_components': 3, 'iw_logistic_c': 0.08711457855994918, 'iw_pca_fit': 'source', 'iw_solver': 'lbfgs', 'iw_rho': 1.0}. Best is trial 0 with value: 0.17255102440565942.
[I 2026-04-28 16:27:31,489] Trial 2 finished with value: 0.18222627917849368 and parameters: {'alpha': 145882.8144740121, 'use_snp_selection': False, 'iw_method': 'pc_logistic', 'iw_clip_max': 3.0, 'iw_prob_clip': 0.02132508176927039, 'iw_n_components': 20, 'iw_logistic_c': 7.593207514996604e-07, 'iw_pca_fit': 'combined', 'iw_solver': 'lbfgs', 'iw_rho': 0.5}. Best is trial 2 with value: 0.18222627917849368.
[I 2026-04-28 16:31:48,996] Trial 3 finished with value: 0.17145321908817895 and parameters: {'alpha': 250773.322847116, 'use_snp_selection': False, 'iw_method': 'pc_logistic', 'iw_clip_max': 10.0, 'iw_prob_clip': 0.0025344201278108985, 'iw_n_components': 10, 'iw_logistic_c': 0.0005426420500638965, 'iw_pca_fit': 'source', 'iw_solver': 'lbfgs', 'iw_rho': 0.9}. Best is trial 2 with value: 0.18222627917849368.
[I 2026-04-28 16:35:49,688] Trial 4 finished with value: 0.17465914004969896 and parameters: {'alpha': 446012.16977835365, 'use_snp_selection': False, 'iw_method': 'pc_logistic', 'iw_clip_max': 10.0, 'iw_prob_clip': 0.04056146617412456, 'iw_n_components': 1, 'iw_logistic_c': 0.016318809798031245, 'iw_pca_fit': 'combined', 'iw_solver': 'lbfgs', 'iw_rho': 0.9}. Best is trial 2 with value: 0.18222627917849368.
[I 2026-04-28 16:40:21,684] Trial 5 finished with value: 0.1758170978122611 and parameters: {'alpha': 81721.51867877056, 'use_snp_selection': False, 'iw_method': 'pc_logistic', 'iw_clip_max': 10.0, 'iw_prob_clip': 0.03936465613829859, 'iw_n_components': 30, 'iw_logistic_c': 0.07026472213126639, 'iw_pca_fit': 'source', 'iw_solver': 'lbfgs', 'iw_rho': 0.5}. Best is trial 2 with value: 0.18222627917849368.
[I 2026-04-28 16:44:26,433] Trial 6 finished with value: 0.17745203034180176 and parameters: {'alpha': 171891.01091076114, 'use_snp_selection': False, 'iw_method': 'pc_logistic', 'iw_clip_max': 3.0, 'iw_prob_clip': 0.0030407243789378874, 'iw_n_components': 2, 'iw_logistic_c': 0.00026825671125139223, 'iw_pca_fit': 'combined', 'iw_solver': 'lbfgs', 'iw_rho': 1.0}. Best is trial 2 with value: 0.18222627917849368.
[I 2026-04-28 16:48:26,535] Trial 7 finished with value: 0.18057372754184098 and parameters: {'alpha': 63478.43463469358, 'use_snp_selection': False, 'iw_method': 'pc_logistic', 'iw_clip_max': 3.0, 'iw_prob_clip': 0.003876317688577816, 'iw_n_components': 1, 'iw_logistic_c': 2.9638123735696538, 'iw_pca_fit': 'combined', 'iw_solver': 'lbfgs', 'iw_rho': 0.9}. Best is trial 2 with value: 0.18222627917849368.
[I 2026-04-28 16:53:07,436] Trial 8 finished with value: 0.1874882891583994 and parameters: {'alpha': 276996.3899943781, 'use_snp_selection': False, 'iw_method': 'pc_logistic', 'iw_clip_max': 5.0, 'iw_prob_clip': 0.015656629950125976, 'iw_n_components': 20, 'iw_logistic_c': 4.238531380010707, 'iw_pca_fit': 'combined', 'iw_solver': 'lbfgs', 'iw_rho': 0.5}. Best is trial 8 with value: 0.1874882891583994.
[I 2026-04-28 16:56:53,145] Trial 9 finished with value: 0.17705811494332183 and parameters: {'alpha': 488065.6830993011, 'use_snp_selection': False, 'iw_method': 'pc_logistic', 'iw_clip_max': 2.0, 'iw_prob_clip': 0.004540379253837699, 'iw_n_components': 3, 'iw_logistic_c': 1.3099285637594641e-05, 'iw_pca_fit': 'source', 'iw_solver': 'lbfgs', 'iw_rho': 0.9}. Best is trial 8 with value: 0.1874882891583994.
[I 2026-04-28 17:01:34,409] Trial 10 finished with value: 0.1818299981445742 and parameters: {'alpha': 994176.4485109039, 'use_snp_selection': False, 'iw_method': 'pc_logistic', 'iw_clip_max': 5.0, 'iw_prob_clip': 0.0076335953335939215, 'iw_n_components': 20, 'iw_logistic_c': 5.73569534988433, 'iw_pca_fit': 'combined', 'iw_solver': 'lbfgs', 'iw_rho': 0.75}. Best is trial 8 with value: 0.1874882891583994.
[I 2026-04-28 17:06:08,208] Trial 11 finished with value: 0.17924841302977387 and parameters: {'alpha': 129992.63514826028, 'use_snp_selection': False, 'iw_method': 'pc_logistic', 'iw_clip_max': 1.5, 'iw_prob_clip': 0.020436572847999893, 'iw_n_components': 20, 'iw_logistic_c': 3.5127497232666824e-07, 'iw_pca_fit': 'combined', 'iw_solver': 'lbfgs', 'iw_rho': 0.5}. Best is trial 8 with value: 0.1874882891583994.
[I 2026-04-28 17:10:41,578] Trial 12 finished with value: 0.1810104410908707 and parameters: {'alpha': 356107.01097453985, 'use_snp_selection': False, 'iw_method': 'pc_logistic', 'iw_clip_max': 5.0, 'iw_prob_clip': 0.021122271974874467, 'iw_n_components': 20, 'iw_logistic_c': 4.418712960095315e-07, 'iw_pca_fit': 'combined', 'iw_solver': 'lbfgs', 'iw_rho': 0.5}. Best is trial 8 with value: 0.1874882891583994.
[I 2026-04-28 17:15:18,905] Trial 13 finished with value: 0.1832324087663568 and parameters: {'alpha': 123189.13706134514, 'use_snp_selection': False, 'iw_method': 'pc_logistic', 'iw_clip_max': 5.0, 'iw_prob_clip': 0.011341139641193142, 'iw_n_components': 20, 'iw_logistic_c': 5.015433519427594e-06, 'iw_pca_fit': 'combined', 'iw_solver': 'lbfgs', 'iw_rho': 0.5}. Best is trial 8 with value: 0.1874882891583994.
[I 2026-04-28 17:19:57,080] Trial 14 finished with value: 0.17913962186671795 and parameters: {'alpha': 98924.50269765589, 'use_snp_selection': False, 'iw_method': 'pc_logistic', 'iw_clip_max': 5.0, 'iw_prob_clip': 0.008442290725742627, 'iw_n_components': 20, 'iw_logistic_c': 2.9581512668049326e-05, 'iw_pca_fit': 'combined', 'iw_solver': 'lbfgs', 'iw_rho': 0.5}. Best is trial 8 with value: 0.1874882891583994.
[I 2026-04-28 17:24:31,436] Trial 15 finished with value: 0.18776256334449054 and parameters: {'alpha': 304496.47544039565, 'use_snp_selection': False, 'iw_method': 'pc_logistic', 'iw_clip_max': 5.0, 'iw_prob_clip': 0.012849305341540057, 'iw_n_components': 10, 'iw_logistic_c': 8.162098259134667e-06, 'iw_pca_fit': 'combined', 'iw_solver': 'lbfgs', 'iw_rho': 0.75}. Best is trial 15 with value: 0.18776256334449054.
[I 2026-04-28 17:29:09,372] Trial 16 finished with value: 0.1817312836944027 and parameters: {'alpha': 668462.4394344718, 'use_snp_selection': False, 'iw_method': 'pc_logistic', 'iw_clip_max': 5.0, 'iw_prob_clip': 0.00556619216153462, 'iw_n_components': 10, 'iw_logistic_c': 0.003342045081556647, 'iw_pca_fit': 'combined', 'iw_solver': 'lbfgs', 'iw_rho': 0.75}. Best is trial 15 with value: 0.18776256334449054.
[I 2026-04-28 17:33:49,715] Trial 17 finished with value: 0.18667588888222783 and parameters: {'alpha': 300408.72070795135, 'use_snp_selection': False, 'iw_method': 'pc_logistic', 'iw_clip_max': 2.0, 'iw_prob_clip': 0.014908539076811257, 'iw_n_components': 10, 'iw_logistic_c': 0.5077114740809019, 'iw_pca_fit': 'combined', 'iw_solver': 'lbfgs', 'iw_rho': 0.75}. Best is trial 15 with value: 0.18776256334449054.
[I 2026-04-28 17:37:58,424] Trial 18 finished with value: 0.18083268390240298 and parameters: {'alpha': 198175.32712400545, 'use_snp_selection': False, 'iw_method': 'pc_logistic', 'iw_clip_max': 1.5, 'iw_prob_clip': 0.033659906949872066, 'iw_n_components': 5, 'iw_logistic_c': 0.00017329682846072228, 'iw_pca_fit': 'combined', 'iw_solver': 'lbfgs', 'iw_rho': 0.75}. Best is trial 15 with value: 0.18776256334449054.
[I 2026-04-28 17:42:05,400] Trial 19 finished with value: 0.17248521082986112 and parameters: {'alpha': 642657.6844690122, 'use_snp_selection': False, 'iw_method': 'pc_logistic', 'iw_clip_max': 5.0, 'iw_prob_clip': 0.027837696598704612, 'iw_n_components': 2, 'iw_logistic_c': 0.0028926223014032974, 'iw_pca_fit': 'combined', 'iw_solver': 'lbfgs', 'iw_rho': 0.75}. Best is trial 15 with value: 0.18776256334449054.
[I 2026-04-28 17:46:52,641] Trial 20 finished with value: 0.19063128915400027 and parameters: {'alpha': 340522.40836304263, 'use_snp_selection': False, 'iw_method': 'pc_logistic', 'iw_clip_max': 5.0, 'iw_prob_clip': 0.01344162583253929, 'iw_n_components': 30, 'iw_logistic_c': 3.45207259429111e-06, 'iw_pca_fit': 'combined', 'iw_solver': 'lbfgs', 'iw_rho': 0.75}. Best is trial 20 with value: 0.19063128915400027.
[I 2026-04-28 17:51:40,442] Trial 21 finished with value: 0.19049307004088967 and parameters: {'alpha': 370498.9690576573, 'use_snp_selection': False, 'iw_method': 'pc_logistic', 'iw_clip_max': 5.0, 'iw_prob_clip': 0.013158563726510137, 'iw_n_components': 30, 'iw_logistic_c': 3.100245873803219e-06, 'iw_pca_fit': 'combined', 'iw_solver': 'lbfgs', 'iw_rho': 0.75}. Best is trial 20 with value: 0.19063128915400027.
[I 2026-04-28 17:56:26,429] Trial 22 finished with value: 0.1908640360190079 and parameters: {'alpha': 385076.17602477275, 'use_snp_selection': False, 'iw_method': 'pc_logistic', 'iw_clip_max': 5.0, 'iw_prob_clip': 0.01236769189387398, 'iw_n_components': 30, 'iw_logistic_c': 2.6741857228965054e-06, 'iw_pca_fit': 'combined', 'iw_solver': 'lbfgs', 'iw_rho': 0.75}. Best is trial 22 with value: 0.1908640360190079.
[I 2026-04-28 18:01:14,415] Trial 23 finished with value: 0.17791442452557865 and parameters: {'alpha': 436519.0637873728, 'use_snp_selection': False, 'iw_method': 'pc_logistic', 'iw_clip_max': 5.0, 'iw_prob_clip': 0.007015009788156976, 'iw_n_components': 30, 'iw_logistic_c': 1.1753608486407782e-07, 'iw_pca_fit': 'combined', 'iw_solver': 'lbfgs', 'iw_rho': 0.75}. Best is trial 22 with value: 0.1908640360190079.
[I 2026-04-28 18:05:58,059] Trial 24 finished with value: 0.18801769266931811 and parameters: {'alpha': 610825.4190444081, 'use_snp_selection': False, 'iw_method': 'pc_logistic', 'iw_clip_max': 5.0, 'iw_prob_clip': 0.00951491817462657, 'iw_n_components': 30, 'iw_logistic_c': 1.7261823982168391e-06, 'iw_pca_fit': 'combined', 'iw_solver': 'lbfgs', 'iw_rho': 0.75}. Best is trial 22 with value: 0.1908640360190079.
[I 2026-04-28 18:10:45,365] Trial 25 finished with value: 0.1858200608748082 and parameters: {'alpha': 375881.4416726455, 'use_snp_selection': False, 'iw_method': 'pc_logistic', 'iw_clip_max': 5.0, 'iw_prob_clip': 0.005900202182398882, 'iw_n_components': 30, 'iw_logistic_c': 6.436491383715063e-05, 'iw_pca_fit': 'combined', 'iw_solver': 'lbfgs', 'iw_rho': 0.75}. Best is trial 22 with value: 0.1908640360190079.
[I 2026-04-28 18:15:31,705] Trial 26 finished with value: 0.1849536321095059 and parameters: {'alpha': 509147.4792729845, 'use_snp_selection': False, 'iw_method': 'pc_logistic', 'iw_clip_max': 2.0, 'iw_prob_clip': 0.02568273893810239, 'iw_n_components': 30, 'iw_logistic_c': 2.0573912813551423e-06, 'iw_pca_fit': 'combined', 'iw_solver': 'lbfgs', 'iw_rho': 0.75}. Best is trial 22 with value: 0.1908640360190079.
[I 2026-04-28 18:19:54,364] Trial 27 finished with value: 0.17288155108781247 and parameters: {'alpha': 857713.2545169322, 'use_snp_selection': False, 'iw_method': 'pc_logistic', 'iw_clip_max': 1.5, 'iw_prob_clip': 0.012204423966152936, 'iw_n_components': 30, 'iw_logistic_c': 1.3811670384309202e-07, 'iw_pca_fit': 'source', 'iw_solver': 'lbfgs', 'iw_rho': 0.75}. Best is trial 22 with value: 0.1908640360190079.
[I 2026-04-28 18:24:40,261] Trial 28 finished with value: 0.1869349289404406 and parameters: {'alpha': 343324.17226948857, 'use_snp_selection': False, 'iw_method': 'pc_logistic', 'iw_clip_max': 5.0, 'iw_prob_clip': 0.017635282513289486, 'iw_n_components': 30, 'iw_logistic_c': 5.92931208867862e-05, 'iw_pca_fit': 'combined', 'iw_solver': 'lbfgs', 'iw_rho': 0.75}. Best is trial 22 with value: 0.1908640360190079.
[I 2026-04-28 18:28:28,817] Trial 29 finished with value: 0.17905687073271365 and parameters: {'alpha': 188508.40966217537, 'use_snp_selection': False, 'iw_method': 'pc_logistic', 'iw_clip_max': 5.0, 'iw_prob_clip': 0.009320533988852488, 'iw_n_components': 5, 'iw_logistic_c': 3.7064743840691825e-06, 'iw_pca_fit': 'source', 'iw_solver': 'lbfgs', 'iw_rho': 1.0}. Best is trial 22 with value: 0.1908640360190079.
[I 2026-04-28 18:33:18,029] Trial 30 finished with value: 0.18501822019147154 and parameters: {'alpha': 221036.97012607133, 'use_snp_selection': False, 'iw_method': 'pc_logistic', 'iw_clip_max': 5.0, 'iw_prob_clip': 0.012630947351408978, 'iw_n_components': 30, 'iw_logistic_c': 2.060273136980834e-05, 'iw_pca_fit': 'combined', 'iw_solver': 'lbfgs', 'iw_rho': 0.75}. Best is trial 22 with value: 0.1908640360190079.
[I 2026-04-28 18:38:03,031] Trial 31 finished with value: 0.18688281836497922 and parameters: {'alpha': 644307.245254091, 'use_snp_selection': False, 'iw_method': 'pc_logistic', 'iw_clip_max': 5.0, 'iw_prob_clip': 0.010038513999216549, 'iw_n_components': 30, 'iw_logistic_c': 1.4877117295072834e-06, 'iw_pca_fit': 'combined', 'iw_solver': 'lbfgs', 'iw_rho': 0.75}. Best is trial 22 with value: 0.1908640360190079.
[I 2026-04-28 18:42:48,450] Trial 32 finished with value: 0.18559700871670456 and parameters: {'alpha': 570417.8753597088, 'use_snp_selection': False, 'iw_method': 'pc_logistic', 'iw_clip_max': 5.0, 'iw_prob_clip': 0.010030549825348688, 'iw_n_components': 30, 'iw_logistic_c': 1.0970982181007393e-06, 'iw_pca_fit': 'combined', 'iw_solver': 'lbfgs', 'iw_rho': 0.75}. Best is trial 22 with value: 0.1908640360190079.
[I 2026-04-28 18:47:33,813] Trial 33 finished with value: 0.18579201883032198 and parameters: {'alpha': 785087.4066538602, 'use_snp_selection': False, 'iw_method': 'pc_logistic', 'iw_clip_max': 5.0, 'iw_prob_clip': 0.014608693517475018, 'iw_n_components': 30, 'iw_logistic_c': 5.2604290203096146e-06, 'iw_pca_fit': 'combined', 'iw_solver': 'lbfgs', 'iw_rho': 1.0}. Best is trial 22 with value: 0.1908640360190079.
[I 2026-04-28 18:51:19,415] Trial 34 finished with value: 0.17700922929342963 and parameters: {'alpha': 406270.8681549389, 'use_snp_selection': False, 'iw_method': 'pc_logistic', 'iw_clip_max': 3.0, 'iw_prob_clip': 0.006885645598451573, 'iw_n_components': 3, 'iw_logistic_c': 3.822460939713157e-07, 'iw_pca_fit': 'source', 'iw_solver': 'lbfgs', 'iw_rho': 0.75}. Best is trial 22 with value: 0.1908640360190079.
[I 2026-04-28 18:56:08,169] Trial 35 finished with value: 0.181966824809847 and parameters: {'alpha': 249296.85433421127, 'use_snp_selection': False, 'iw_method': 'pc_logistic', 'iw_clip_max': 10.0, 'iw_prob_clip': 0.01957075383093371, 'iw_n_components': 30, 'iw_logistic_c': 6.134157533136712e-05, 'iw_pca_fit': 'combined', 'iw_solver': 'lbfgs', 'iw_rho': 0.75}. Best is trial 22 with value: 0.1908640360190079.
[I 2026-04-28 19:00:55,369] Trial 36 finished with value: 0.18914172365382617 and parameters: {'alpha': 492812.2759512558, 'use_snp_selection': False, 'iw_method': 'pc_logistic', 'iw_clip_max': 5.0, 'iw_prob_clip': 0.008150218601719024, 'iw_n_components': 30, 'iw_logistic_c': 1.8797640020847582e-06, 'iw_pca_fit': 'combined', 'iw_solver': 'lbfgs', 'iw_rho': 0.75}. Best is trial 22 with value: 0.1908640360190079.
[I 2026-04-28 19:04:37,780] Trial 37 finished with value: 0.17553618712242908 and parameters: {'alpha': 522724.49076431297, 'use_snp_selection': False, 'iw_method': 'pc_logistic', 'iw_clip_max': 10.0, 'iw_prob_clip': 0.005853401202928336, 'iw_n_components': 1, 'iw_logistic_c': 0.0011112820657224283, 'iw_pca_fit': 'source', 'iw_solver': 'lbfgs', 'iw_rho': 0.9}. Best is trial 22 with value: 0.1908640360190079.
[I 2026-04-28 19:08:43,604] Trial 38 finished with value: 0.17552815762986365 and parameters: {'alpha': 337161.6322963691, 'use_snp_selection': False, 'iw_method': 'pc_logistic', 'iw_clip_max': 3.0, 'iw_prob_clip': 0.048987269194150786, 'iw_n_components': 2, 'iw_logistic_c': 0.00017648657514006142, 'iw_pca_fit': 'combined', 'iw_solver': 'lbfgs', 'iw_rho': 1.0}. Best is trial 22 with value: 0.1908640360190079.
[I 2026-04-28 19:13:30,181] Trial 39 finished with value: 0.18256026624166447 and parameters: {'alpha': 269073.5956413384, 'use_snp_selection': False, 'iw_method': 'pc_logistic', 'iw_clip_max': 1.5, 'iw_prob_clip': 0.024547922836677175, 'iw_n_components': 30, 'iw_logistic_c': 5.844871416866665e-07, 'iw_pca_fit': 'combined', 'iw_solver': 'lbfgs', 'iw_rho': 0.75}. Best is trial 22 with value: 0.1908640360190079.
[I 2026-04-28 19:18:14,947] Trial 40 finished with value: 0.18436445514979258 and parameters: {'alpha': 432582.01154799596, 'use_snp_selection': False, 'iw_method': 'pc_logistic', 'iw_clip_max': 2.0, 'iw_prob_clip': 0.01697939271296651, 'iw_n_components': 30, 'iw_logistic_c': 1.1491503155778317e-05, 'iw_pca_fit': 'combined', 'iw_solver': 'lbfgs', 'iw_rho': 0.9}. Best is trial 22 with value: 0.1908640360190079.
[I 2026-04-28 19:22:57,894] Trial 41 finished with value: 0.1900729649664474 and parameters: {'alpha': 566232.0935765418, 'use_snp_selection': False, 'iw_method': 'pc_logistic', 'iw_clip_max': 5.0, 'iw_prob_clip': 0.008409166699986766, 'iw_n_components': 30, 'iw_logistic_c': 2.2670412900622753e-06, 'iw_pca_fit': 'combined', 'iw_solver': 'lbfgs', 'iw_rho': 0.75}. Best is trial 22 with value: 0.1908640360190079.
[I 2026-04-28 19:27:40,463] Trial 42 finished with value: 0.1902704432649908 and parameters: {'alpha': 496012.68397310004, 'use_snp_selection': False, 'iw_method': 'pc_logistic', 'iw_clip_max': 5.0, 'iw_prob_clip': 0.008096029151704959, 'iw_n_components': 30, 'iw_logistic_c': 3.4146524516625455e-06, 'iw_pca_fit': 'combined', 'iw_solver': 'lbfgs', 'iw_rho': 0.75}. Best is trial 22 with value: 0.1908640360190079.
[I 2026-04-28 19:31:47,400] Trial 43 finished with value: 0.17699843269600218 and parameters: {'alpha': 380191.5245220604, 'use_snp_selection': False, 'iw_method': 'pc_logistic', 'iw_clip_max': 5.0, 'iw_prob_clip': 0.013988943675448513, 'iw_n_components': 3, 'iw_logistic_c': 2.8555144072999807e-05, 'iw_pca_fit': 'combined', 'iw_solver': 'lbfgs', 'iw_rho': 0.75}. Best is trial 22 with value: 0.1908640360190079.
[I 2026-04-28 19:35:47,925] Trial 44 finished with value: 0.17361474324018944 and parameters: {'alpha': 785964.0960116005, 'use_snp_selection': False, 'iw_method': 'pc_logistic', 'iw_clip_max': 5.0, 'iw_prob_clip': 0.003990304221728573, 'iw_n_components': 1, 'iw_logistic_c': 1.951471460604097e-07, 'iw_pca_fit': 'combined', 'iw_solver': 'lbfgs', 'iw_rho': 0.75}. Best is trial 22 with value: 0.1908640360190079.
[I 2026-04-28 19:40:31,706] Trial 45 finished with value: 0.18972589647140656 and parameters: {'alpha': 312683.20549663535, 'use_snp_selection': False, 'iw_method': 'pc_logistic', 'iw_clip_max': 5.0, 'iw_prob_clip': 0.011169000927990216, 'iw_n_components': 30, 'iw_logistic_c': 3.4150808640614677e-06, 'iw_pca_fit': 'combined', 'iw_solver': 'lbfgs', 'iw_rho': 0.75}. Best is trial 22 with value: 0.1908640360190079.
[I 2026-04-28 19:44:19,415] Trial 46 finished with value: 0.17679532849623006 and parameters: {'alpha': 454441.86966027034, 'use_snp_selection': False, 'iw_method': 'pc_logistic', 'iw_clip_max': 10.0, 'iw_prob_clip': 0.004881228530579965, 'iw_n_components': 5, 'iw_logistic_c': 7.250052665745311e-07, 'iw_pca_fit': 'source', 'iw_solver': 'lbfgs', 'iw_rho': 0.75}. Best is trial 22 with value: 0.1908640360190079.
[I 2026-04-28 19:49:05,461] Trial 47 finished with value: 0.17361903953510993 and parameters: {'alpha': 54605.31168640951, 'use_snp_selection': False, 'iw_method': 'pc_logistic', 'iw_clip_max': 5.0, 'iw_prob_clip': 0.002560469365434127, 'iw_n_components': 30, 'iw_logistic_c': 1.0466641100348262e-05, 'iw_pca_fit': 'combined', 'iw_solver': 'lbfgs', 'iw_rho': 0.9}. Best is trial 22 with value: 0.1908640360190079.
[I 2026-04-28 19:53:47,490] Trial 48 finished with value: 0.1862312027759791 and parameters: {'alpha': 556354.42160728, 'use_snp_selection': False, 'iw_method': 'pc_logistic', 'iw_clip_max': 3.0, 'iw_prob_clip': 0.006927176360236532, 'iw_n_components': 30, 'iw_logistic_c': 4.2289547665535726e-06, 'iw_pca_fit': 'combined', 'iw_solver': 'lbfgs', 'iw_rho': 1.0}. Best is trial 22 with value: 0.1908640360190079.
[I 2026-04-28 19:57:52,063] Trial 49 finished with value: 0.17562620522201244 and parameters: {'alpha': 744076.2763462169, 'use_snp_selection': False, 'iw_method': 'pc_logistic', 'iw_clip_max': 5.0, 'iw_prob_clip': 0.011239545079170899, 'iw_n_components': 2, 'iw_logistic_c': 1.740180945029896e-05, 'iw_pca_fit': 'combined', 'iw_solver': 'lbfgs', 'iw_rho': 0.75}. Best is trial 22 with value: 0.1908640360190079.
[I 2026-04-28 20:02:37,706] Trial 50 finished with value: 0.1801081574012208 and parameters: {'alpha': 222076.28469446293, 'use_snp_selection': False, 'iw_method': 'pc_logistic', 'iw_clip_max': 5.0, 'iw_prob_clip': 0.00851389004669612, 'iw_n_components': 30, 'iw_logistic_c': 2.5072453119073846e-07, 'iw_pca_fit': 'combined', 'iw_solver': 'lbfgs', 'iw_rho': 0.5}. Best is trial 22 with value: 0.1908640360190079.
[I 2026-04-28 20:07:22,663] Trial 51 finished with value: 0.18991531586795973 and parameters: {'alpha': 301005.0792155783, 'use_snp_selection': False, 'iw_method': 'pc_logistic', 'iw_clip_max': 5.0, 'iw_prob_clip': 0.01111168332015901, 'iw_n_components': 30, 'iw_logistic_c': 3.4200590537845788e-06, 'iw_pca_fit': 'combined', 'iw_solver': 'lbfgs', 'iw_rho': 0.75}. Best is trial 22 with value: 0.1908640360190079.
