Running from this directory: /cluster/work/simennes/Master_thesis
Name of job: ncv_ridge_iw
ID of job: 24337354
Array task ID: 6
The job was run on these nodes: idun-03-05
[I 2026-04-24 13:08:22,154] Trial 0 finished with value: 0.14138712480656962 and parameters: {'alpha': 12124.394605078569, 'use_snp_selection': True, 'num_snps': 5442, 'iw_method': 'pc_logistic', 'iw_clip_max': 20.0, 'iw_prob_clip': 0.010995744247886997, 'iw_n_components': 10, 'iw_logistic_c': 0.32697423511716517, 'iw_pca_fit': 'source', 'iw_solver': 'lbfgs', 'iw_rho': 0.75}. Best is trial 0 with value: 0.14138712480656962.
[I 2026-04-24 13:11:35,976] Trial 1 finished with value: 0.16635793192409162 and parameters: {'alpha': 161030.4172882474, 'use_snp_selection': False, 'iw_method': 'pc_logistic', 'iw_clip_max': 3.0, 'iw_prob_clip': 0.01279044980782762, 'iw_n_components': 1, 'iw_logistic_c': 2.0403812501143454e-05, 'iw_pca_fit': 'source', 'iw_solver': 'lbfgs', 'iw_rho': 0.75}. Best is trial 1 with value: 0.16635793192409162.
[I 2026-04-24 13:13:29,403] Trial 2 finished with value: 0.1094659089754523 and parameters: {'alpha': 188.160412035082, 'use_snp_selection': True, 'num_snps': 59763, 'iw_method': 'uniform', 'iw_clip_max': 5.0, 'iw_prob_clip': 0.0070654957343389896}. Best is trial 1 with value: 0.16635793192409162.
[I 2026-04-24 13:17:31,983] Trial 3 finished with value: 0.15212161972164787 and parameters: {'alpha': 16968.649375900754, 'use_snp_selection': True, 'num_snps': 29760, 'iw_method': 'pc_logistic', 'iw_clip_max': 20.0, 'iw_prob_clip': 0.0217559440148749, 'iw_n_components': 10, 'iw_logistic_c': 1.6382429914774194e-05, 'iw_pca_fit': 'combined', 'iw_solver': 'lbfgs', 'iw_rho': 0.1}. Best is trial 1 with value: 0.16635793192409162.
[I 2026-04-24 13:21:48,769] Trial 4 finished with value: 0.15671153678421854 and parameters: {'alpha': 19413.258622327583, 'use_snp_selection': True, 'num_snps': 41428, 'iw_method': 'pc_logistic', 'iw_clip_max': 20.0, 'iw_prob_clip': 0.008628235125022405, 'iw_n_components': 3, 'iw_logistic_c': 0.0004653526127488538, 'iw_pca_fit': 'source', 'iw_solver': 'lbfgs', 'iw_rho': 0.25}. Best is trial 1 with value: 0.16635793192409162.
[I 2026-04-24 13:23:40,703] Trial 5 finished with value: 0.16194497564411806 and parameters: {'alpha': 80135.2021263408, 'use_snp_selection': True, 'num_snps': 54789, 'iw_method': 'uniform', 'iw_clip_max': 3.0, 'iw_prob_clip': 0.012917216126205406}. Best is trial 1 with value: 0.16635793192409162.
[I 2026-04-24 13:25:01,874] Trial 6 finished with value: 0.16254430464730887 and parameters: {'alpha': 340178.6469095632, 'use_snp_selection': True, 'num_snps': 25889, 'iw_method': 'uniform', 'iw_clip_max': 3.0, 'iw_prob_clip': 0.020875611672958067}. Best is trial 1 with value: 0.16635793192409162.
[I 2026-04-24 13:26:11,144] Trial 7 finished with value: 0.14318264528962693 and parameters: {'alpha': 1242108.5193641477, 'use_snp_selection': True, 'num_snps': 15763, 'iw_method': 'uniform', 'iw_clip_max': 3.0, 'iw_prob_clip': 0.027212938580450624}. Best is trial 1 with value: 0.16635793192409162.
[I 2026-04-24 13:26:51,387] Trial 8 finished with value: 0.11113732781480973 and parameters: {'alpha': 576.4183768413645, 'use_snp_selection': False, 'iw_method': 'uniform', 'iw_clip_max': 2.0, 'iw_prob_clip': 0.0429488305231488}. Best is trial 1 with value: 0.16635793192409162.
[I 2026-04-24 13:28:06,170] Trial 9 finished with value: 0.14926964400442053 and parameters: {'alpha': 671771.9265477946, 'use_snp_selection': True, 'num_snps': 19046, 'iw_method': 'uniform', 'iw_clip_max': 20.0, 'iw_prob_clip': 0.016752592804942974}. Best is trial 1 with value: 0.16635793192409162.
[I 2026-04-24 13:31:21,107] Trial 10 finished with value: 0.14215495988574076 and parameters: {'alpha': 9837161.102143044, 'use_snp_selection': False, 'iw_method': 'pc_logistic', 'iw_clip_max': 10.0, 'iw_prob_clip': 0.006412966308601717, 'iw_n_components': 1, 'iw_logistic_c': 0.007218341230724956, 'iw_pca_fit': 'source', 'iw_solver': 'lbfgs', 'iw_rho': 0.75}. Best is trial 1 with value: 0.16635793192409162.
[I 2026-04-24 13:34:59,958] Trial 11 finished with value: 0.1673820822354255 and parameters: {'alpha': 319455.00215845375, 'use_snp_selection': False, 'iw_method': 'pc_logistic', 'iw_clip_max': 3.0, 'iw_prob_clip': 0.02786576308643991, 'iw_n_components': 1, 'iw_logistic_c': 1.399713636282935e-05, 'iw_pca_fit': 'combined', 'iw_solver': 'lbfgs', 'iw_rho': 1.0}. Best is trial 11 with value: 0.1673820822354255.
[I 2026-04-24 13:38:36,900] Trial 12 finished with value: 0.1182592225200564 and parameters: {'alpha': 1917.5398603560736, 'use_snp_selection': False, 'iw_method': 'pc_logistic', 'iw_clip_max': 3.0, 'iw_prob_clip': 0.03690470911463918, 'iw_n_components': 1, 'iw_logistic_c': 1.4405825011316045e-05, 'iw_pca_fit': 'combined', 'iw_solver': 'lbfgs', 'iw_rho': 1.0}. Best is trial 11 with value: 0.1673820822354255.
[I 2026-04-24 13:42:17,019] Trial 13 finished with value: 0.10859782892041742 and parameters: {'alpha': 14.10762195162507, 'use_snp_selection': False, 'iw_method': 'pc_logistic', 'iw_clip_max': 3.0, 'iw_prob_clip': 0.033129794978272405, 'iw_n_components': 1, 'iw_logistic_c': 0.00020825293604129918, 'iw_pca_fit': 'combined', 'iw_solver': 'lbfgs', 'iw_rho': 0.5}. Best is trial 11 with value: 0.1673820822354255.
[I 2026-04-24 13:45:58,141] Trial 14 finished with value: 0.12911271696523965 and parameters: {'alpha': 7516314.333182465, 'use_snp_selection': False, 'iw_method': 'pc_logistic', 'iw_clip_max': 10.0, 'iw_prob_clip': 0.014083297501754058, 'iw_n_components': 5, 'iw_logistic_c': 0.0003955104018201011, 'iw_pca_fit': 'combined', 'iw_solver': 'lbfgs', 'iw_rho': 0.75}. Best is trial 11 with value: 0.1673820822354255.
[I 2026-04-24 13:50:09,114] Trial 15 finished with value: 0.160874458929219 and parameters: {'alpha': 118862.23776255993, 'use_snp_selection': False, 'iw_method': 'pc_logistic', 'iw_clip_max': 2.0, 'iw_prob_clip': 0.02076849192183654, 'iw_n_components': 20, 'iw_logistic_c': 4.9377880086220145, 'iw_pca_fit': 'source', 'iw_solver': 'lbfgs', 'iw_rho': 1.0}. Best is trial 11 with value: 0.1673820822354255.
[I 2026-04-24 13:53:35,361] Trial 16 finished with value: 0.15249191601359566 and parameters: {'alpha': 1697092.6575438946, 'use_snp_selection': False, 'iw_method': 'pc_logistic', 'iw_clip_max': 5.0, 'iw_prob_clip': 0.009584285341458675, 'iw_n_components': 2, 'iw_logistic_c': 1.058664801935072e-05, 'iw_pca_fit': 'source', 'iw_solver': 'lbfgs', 'iw_rho': 1.0}. Best is trial 11 with value: 0.1673820822354255.
[I 2026-04-24 13:57:11,708] Trial 17 finished with value: 0.1602218644281341 and parameters: {'alpha': 79420.60461919021, 'use_snp_selection': False, 'iw_method': 'pc_logistic', 'iw_clip_max': 3.0, 'iw_prob_clip': 0.02831296042797304, 'iw_n_components': 1, 'iw_logistic_c': 0.005166654903338709, 'iw_pca_fit': 'combined', 'iw_solver': 'lbfgs', 'iw_rho': 0.25}. Best is trial 11 with value: 0.1673820822354255.
[I 2026-04-24 14:00:43,574] Trial 18 finished with value: 0.12103572930741167 and parameters: {'alpha': 3551.6116296842347, 'use_snp_selection': False, 'iw_method': 'pc_logistic', 'iw_clip_max': 3.0, 'iw_prob_clip': 0.04953687907162852, 'iw_n_components': 1, 'iw_logistic_c': 0.00010890955786338982, 'iw_pca_fit': 'combined', 'iw_solver': 'lbfgs', 'iw_rho': 0.1}. Best is trial 11 with value: 0.1673820822354255.
[I 2026-04-24 14:04:10,393] Trial 19 finished with value: 0.16313281173086513 and parameters: {'alpha': 190335.8786938149, 'use_snp_selection': False, 'iw_method': 'pc_logistic', 'iw_clip_max': 3.0, 'iw_prob_clip': 0.01729408482142867, 'iw_n_components': 2, 'iw_logistic_c': 0.08532133167237173, 'iw_pca_fit': 'source', 'iw_solver': 'lbfgs', 'iw_rho': 0.5}. Best is trial 11 with value: 0.1673820822354255.
[I 2026-04-24 14:08:50,412] Trial 20 finished with value: 0.1638678158275659 and parameters: {'alpha': 1902670.0495711463, 'use_snp_selection': False, 'iw_method': 'pc_logistic', 'iw_clip_max': 5.0, 'iw_prob_clip': 0.005377377890134129, 'iw_n_components': 20, 'iw_logistic_c': 0.0014838224275716776, 'iw_pca_fit': 'combined', 'iw_solver': 'lbfgs', 'iw_rho': 0.75}. Best is trial 11 with value: 0.1673820822354255.
[I 2026-04-24 14:13:19,339] Trial 21 finished with value: 0.16121414429397346 and parameters: {'alpha': 2703781.1803027904, 'use_snp_selection': False, 'iw_method': 'pc_logistic', 'iw_clip_max': 5.0, 'iw_prob_clip': 0.005897145670343041, 'iw_n_components': 20, 'iw_logistic_c': 7.807393366386798e-05, 'iw_pca_fit': 'combined', 'iw_solver': 'lbfgs', 'iw_rho': 0.75}. Best is trial 11 with value: 0.1673820822354255.
[I 2026-04-24 14:17:52,076] Trial 22 finished with value: 0.17033932301806917 and parameters: {'alpha': 448285.35220695235, 'use_snp_selection': False, 'iw_method': 'pc_logistic', 'iw_clip_max': 5.0, 'iw_prob_clip': 0.00505611701050328, 'iw_n_components': 20, 'iw_logistic_c': 0.001991683702659816, 'iw_pca_fit': 'combined', 'iw_solver': 'lbfgs', 'iw_rho': 0.75}. Best is trial 22 with value: 0.17033932301806917.
[I 2026-04-24 14:21:36,204] Trial 23 finished with value: 0.16372535686352793 and parameters: {'alpha': 443132.7715188224, 'use_snp_selection': False, 'iw_method': 'pc_logistic', 'iw_clip_max': 5.0, 'iw_prob_clip': 0.008044485887681517, 'iw_n_components': 5, 'iw_logistic_c': 4.1490569527149234e-05, 'iw_pca_fit': 'combined', 'iw_solver': 'lbfgs', 'iw_rho': 1.0}. Best is trial 22 with value: 0.17033932301806917.
[I 2026-04-24 14:25:27,293] Trial 24 finished with value: 0.16059686768143472 and parameters: {'alpha': 72242.64417408158, 'use_snp_selection': False, 'iw_method': 'pc_logistic', 'iw_clip_max': 10.0, 'iw_prob_clip': 0.012701349978043662, 'iw_n_components': 3, 'iw_logistic_c': 0.07671400335051898, 'iw_pca_fit': 'combined', 'iw_solver': 'lbfgs', 'iw_rho': 0.75}. Best is trial 22 with value: 0.17033932301806917.
[I 2026-04-24 14:29:43,414] Trial 25 finished with value: 0.14988046649321543 and parameters: {'alpha': 35560.58818599676, 'use_snp_selection': False, 'iw_method': 'pc_logistic', 'iw_clip_max': 2.0, 'iw_prob_clip': 0.025456793014502575, 'iw_n_components': 20, 'iw_logistic_c': 0.0012730379804829182, 'iw_pca_fit': 'source', 'iw_solver': 'lbfgs', 'iw_rho': 0.75}. Best is trial 22 with value: 0.17033932301806917.
[I 2026-04-24 14:33:14,891] Trial 26 finished with value: 0.1674543890136199 and parameters: {'alpha': 282305.94020052603, 'use_snp_selection': False, 'iw_method': 'pc_logistic', 'iw_clip_max': 5.0, 'iw_prob_clip': 0.010033633207464077, 'iw_n_components': 1, 'iw_logistic_c': 3.972105100007667e-05, 'iw_pca_fit': 'combined', 'iw_solver': 'lbfgs', 'iw_rho': 1.0}. Best is trial 22 with value: 0.17033932301806917.
[I 2026-04-24 14:36:44,181] Trial 27 finished with value: 0.1289508378228153 and parameters: {'alpha': 4699.386861796043, 'use_snp_selection': False, 'iw_method': 'pc_logistic', 'iw_clip_max': 5.0, 'iw_prob_clip': 0.010075001977143077, 'iw_n_components': 1, 'iw_logistic_c': 0.028368615174731476, 'iw_pca_fit': 'combined', 'iw_solver': 'lbfgs', 'iw_rho': 1.0}. Best is trial 22 with value: 0.17033932301806917.
[I 2026-04-24 14:41:17,119] Trial 28 finished with value: 0.16051404929905502 and parameters: {'alpha': 637336.8401461751, 'use_snp_selection': False, 'iw_method': 'pc_logistic', 'iw_clip_max': 5.0, 'iw_prob_clip': 0.007500783565069178, 'iw_n_components': 20, 'iw_logistic_c': 0.0016669666286374429, 'iw_pca_fit': 'combined', 'iw_solver': 'lbfgs', 'iw_rho': 1.0}. Best is trial 22 with value: 0.17033932301806917.
[I 2026-04-24 14:44:50,119] Trial 29 finished with value: 0.15601651838018943 and parameters: {'alpha': 34220.4411459638, 'use_snp_selection': False, 'iw_method': 'pc_logistic', 'iw_clip_max': 5.0, 'iw_prob_clip': 0.005288652027113013, 'iw_n_components': 1, 'iw_logistic_c': 6.149549723779829e-05, 'iw_pca_fit': 'combined', 'iw_solver': 'lbfgs', 'iw_rho': 1.0}. Best is trial 22 with value: 0.17033932301806917.
[I 2026-04-24 14:48:39,013] Trial 30 finished with value: 0.13420088459010743 and parameters: {'alpha': 3732766.4978110385, 'use_snp_selection': False, 'iw_method': 'pc_logistic', 'iw_clip_max': 5.0, 'iw_prob_clip': 0.011039263967630823, 'iw_n_components': 5, 'iw_logistic_c': 0.00018621818961236258, 'iw_pca_fit': 'combined', 'iw_solver': 'lbfgs', 'iw_rho': 1.0}. Best is trial 22 with value: 0.17033932301806917.
[I 2026-04-24 14:51:53,868] Trial 31 finished with value: 0.16675966040432055 and parameters: {'alpha': 219656.5329670008, 'use_snp_selection': False, 'iw_method': 'pc_logistic', 'iw_clip_max': 3.0, 'iw_prob_clip': 0.014868429209585704, 'iw_n_components': 1, 'iw_logistic_c': 3.106237868362478e-05, 'iw_pca_fit': 'source', 'iw_solver': 'lbfgs', 'iw_rho': 0.75}. Best is trial 22 with value: 0.17033932301806917.
[I 2026-04-24 14:55:23,861] Trial 32 finished with value: 0.16557414234319529 and parameters: {'alpha': 168589.75611009068, 'use_snp_selection': False, 'iw_method': 'pc_logistic', 'iw_clip_max': 3.0, 'iw_prob_clip': 0.015359526354357826, 'iw_n_components': 1, 'iw_logistic_c': 3.443511467562805e-05, 'iw_pca_fit': 'combined', 'iw_solver': 'lbfgs', 'iw_rho': 0.5}. Best is trial 22 with value: 0.17033932301806917.
[I 2026-04-24 14:58:51,357] Trial 33 finished with value: 0.1638557337268314 and parameters: {'alpha': 329001.7764294273, 'use_snp_selection': False, 'iw_method': 'pc_logistic', 'iw_clip_max': 5.0, 'iw_prob_clip': 0.01126193343286907, 'iw_n_components': 1, 'iw_logistic_c': 0.0005493548308365471, 'iw_pca_fit': 'combined', 'iw_solver': 'lbfgs', 'iw_rho': 0.1}. Best is trial 22 with value: 0.17033932301806917.
[I 2026-04-24 15:02:15,067] Trial 34 finished with value: 0.16136108231970114 and parameters: {'alpha': 691050.9464156261, 'use_snp_selection': False, 'iw_method': 'pc_logistic', 'iw_clip_max': 3.0, 'iw_prob_clip': 0.01833717108469846, 'iw_n_components': 1, 'iw_logistic_c': 5.469978395984007e-05, 'iw_pca_fit': 'source', 'iw_solver': 'lbfgs', 'iw_rho': 1.0}. Best is trial 22 with value: 0.17033932301806917.
[I 2026-04-24 15:05:48,460] Trial 35 finished with value: 0.13008458410195475 and parameters: {'alpha': 7673.677543939058, 'use_snp_selection': False, 'iw_method': 'pc_logistic', 'iw_clip_max': 20.0, 'iw_prob_clip': 0.009427791729342699, 'iw_n_components': 2, 'iw_logistic_c': 1.0139035293992391e-05, 'iw_pca_fit': 'combined', 'iw_solver': 'lbfgs', 'iw_rho': 0.25}. Best is trial 22 with value: 0.17033932301806917.
[I 2026-04-24 15:06:29,301] Trial 36 finished with value: 0.15042788612194197 and parameters: {'alpha': 37218.59086194925, 'use_snp_selection': False, 'iw_method': 'uniform', 'iw_clip_max': 5.0, 'iw_prob_clip': 0.024272841709762127}. Best is trial 22 with value: 0.17033932301806917.
[I 2026-04-24 15:11:20,825] Trial 37 finished with value: 0.1677989135679305 and parameters: {'alpha': 255217.29632726515, 'use_snp_selection': True, 'num_snps': 42833, 'iw_method': 'pc_logistic', 'iw_clip_max': 3.0, 'iw_prob_clip': 0.006348216101746526, 'iw_n_components': 10, 'iw_logistic_c': 1.2763138007768189, 'iw_pca_fit': 'source', 'iw_solver': 'lbfgs', 'iw_rho': 0.75}. Best is trial 22 with value: 0.17033932301806917.
[I 2026-04-24 15:13:09,351] Trial 38 finished with value: 0.15827162110391876 and parameters: {'alpha': 1075046.1805391961, 'use_snp_selection': True, 'num_snps': 43653, 'iw_method': 'uniform', 'iw_clip_max': 20.0, 'iw_prob_clip': 0.006834173169638913}. Best is trial 22 with value: 0.17033932301806917.
[I 2026-04-24 15:18:12,673] Trial 39 finished with value: 0.15465953440106706 and parameters: {'alpha': 4565630.140143459, 'use_snp_selection': True, 'num_snps': 43106, 'iw_method': 'pc_logistic', 'iw_clip_max': 2.0, 'iw_prob_clip': 0.008403506092434773, 'iw_n_components': 10, 'iw_logistic_c': 3.2850969853145844, 'iw_pca_fit': 'combined', 'iw_solver': 'lbfgs', 'iw_rho': 0.75}. Best is trial 22 with value: 0.17033932301806917.
[I 2026-04-24 15:19:40,616] Trial 40 finished with value: 0.15501127934118428 and parameters: {'alpha': 17587.84511001722, 'use_snp_selection': True, 'num_snps': 36313, 'iw_method': 'uniform', 'iw_clip_max': 10.0, 'iw_prob_clip': 0.005973558678854637}. Best is trial 22 with value: 0.17033932301806917.
[I 2026-04-24 15:25:23,408] Trial 41 finished with value: 0.16703441584725423 and parameters: {'alpha': 249950.35452718622, 'use_snp_selection': True, 'num_snps': 51158, 'iw_method': 'pc_logistic', 'iw_clip_max': 3.0, 'iw_prob_clip': 0.005221864188761771, 'iw_n_components': 10, 'iw_logistic_c': 0.8119701767085937, 'iw_pca_fit': 'source', 'iw_solver': 'lbfgs', 'iw_rho': 0.75}. Best is trial 22 with value: 0.17033932301806917.
[I 2026-04-24 15:30:53,425] Trial 42 finished with value: 0.16484431102456773 and parameters: {'alpha': 368289.06806228805, 'use_snp_selection': True, 'num_snps': 51053, 'iw_method': 'pc_logistic', 'iw_clip_max': 3.0, 'iw_prob_clip': 0.005075164753035549, 'iw_n_components': 10, 'iw_logistic_c': 1.461101426558764, 'iw_pca_fit': 'source', 'iw_solver': 'lbfgs', 'iw_rho': 0.75}. Best is trial 22 with value: 0.17033932301806917.
[I 2026-04-24 15:36:10,278] Trial 43 finished with value: 0.162514442528827 and parameters: {'alpha': 61885.59422041308, 'use_snp_selection': True, 'num_snps': 49487, 'iw_method': 'pc_logistic', 'iw_clip_max': 3.0, 'iw_prob_clip': 0.00615551496699722, 'iw_n_components': 10, 'iw_logistic_c': 0.7730492699082374, 'iw_pca_fit': 'source', 'iw_solver': 'lbfgs', 'iw_rho': 0.75}. Best is trial 22 with value: 0.17033932301806917.
[I 2026-04-24 15:40:42,378] Trial 44 finished with value: 0.15994117836639468 and parameters: {'alpha': 924250.7010543384, 'use_snp_selection': True, 'num_snps': 35897, 'iw_method': 'pc_logistic', 'iw_clip_max': 3.0, 'iw_prob_clip': 0.007330930754312097, 'iw_n_components': 10, 'iw_logistic_c': 0.2457173012920555, 'iw_pca_fit': 'source', 'iw_solver': 'lbfgs', 'iw_rho': 0.75}. Best is trial 22 with value: 0.17033932301806917.
[I 2026-04-24 15:46:00,918] Trial 45 finished with value: 0.1683168104541066 and parameters: {'alpha': 137198.4642194533, 'use_snp_selection': True, 'num_snps': 47021, 'iw_method': 'pc_logistic', 'iw_clip_max': 3.0, 'iw_prob_clip': 0.006768472754682843, 'iw_n_components': 10, 'iw_logistic_c': 0.612444422181933, 'iw_pca_fit': 'source', 'iw_solver': 'lbfgs', 'iw_rho': 0.75}. Best is trial 22 with value: 0.17033932301806917.
[I 2026-04-24 15:51:06,397] Trial 46 finished with value: 0.17110917936002215 and parameters: {'alpha': 122438.51381150188, 'use_snp_selection': True, 'num_snps': 44247, 'iw_method': 'pc_logistic', 'iw_clip_max': 3.0, 'iw_prob_clip': 0.006872622798615716, 'iw_n_components': 10, 'iw_logistic_c': 0.020908551400729253, 'iw_pca_fit': 'source', 'iw_solver': 'lbfgs', 'iw_rho': 0.1}. Best is trial 46 with value: 0.17110917936002215.
[I 2026-04-24 15:52:53,835] Trial 47 finished with value: 0.17115191981018898 and parameters: {'alpha': 109427.0561505807, 'use_snp_selection': True, 'num_snps': 42545, 'iw_method': 'uniform', 'iw_clip_max': 20.0, 'iw_prob_clip': 0.006622468550886439}. Best is trial 47 with value: 0.17115191981018898.
[I 2026-04-24 15:54:42,070] Trial 48 finished with value: 0.17085000517977048 and parameters: {'alpha': 138624.57303184734, 'use_snp_selection': True, 'num_snps': 44674, 'iw_method': 'uniform', 'iw_clip_max': 20.0, 'iw_prob_clip': 0.006414006357764051}. Best is trial 47 with value: 0.17115191981018898.
[I 2026-04-24 15:56:33,804] Trial 49 finished with value: 0.17003094645246022 and parameters: {'alpha': 121782.79386804228, 'use_snp_selection': True, 'num_snps': 47399, 'iw_method': 'uniform', 'iw_clip_max': 20.0, 'iw_prob_clip': 0.00684181023095685}. Best is trial 47 with value: 0.17115191981018898.
[I 2026-04-24 15:58:12,777] Trial 50 finished with value: 0.15889603082565354 and parameters: {'alpha': 25774.015838543284, 'use_snp_selection': True, 'num_snps': 37746, 'iw_method': 'uniform', 'iw_clip_max': 20.0, 'iw_prob_clip': 0.007771526231914552}. Best is trial 47 with value: 0.17115191981018898.
[I 2026-04-24 16:00:01,419] Trial 51 finished with value: 0.17055797238424478 and parameters: {'alpha': 111931.93349044106, 'use_snp_selection': True, 'num_snps': 46851, 'iw_method': 'uniform', 'iw_clip_max': 20.0, 'iw_prob_clip': 0.006888395025395911}. Best is trial 47 with value: 0.17115191981018898.
[I 2026-04-24 16:01:51,491] Trial 52 finished with value: 0.15026371685968812 and parameters: {'alpha': 11818.015984516236, 'use_snp_selection': True, 'num_snps': 46966, 'iw_method': 'uniform', 'iw_clip_max': 20.0, 'iw_prob_clip': 0.005641133200339648}. Best is trial 47 with value: 0.17115191981018898.
[I 2026-04-24 16:03:46,805] Trial 53 finished with value: 0.16110616030723826 and parameters: {'alpha': 59632.743868854974, 'use_snp_selection': True, 'num_snps': 53393, 'iw_method': 'uniform', 'iw_clip_max': 20.0, 'iw_prob_clip': 0.008828385330259444}. Best is trial 47 with value: 0.17115191981018898.
[I 2026-04-24 16:05:26,238] Trial 54 finished with value: 0.16750137304470414 and parameters: {'alpha': 99390.82853888601, 'use_snp_selection': True, 'num_snps': 40150, 'iw_method': 'uniform', 'iw_clip_max': 20.0, 'iw_prob_clip': 0.0068429399112442295}. Best is trial 47 with value: 0.17115191981018898.
[I 2026-04-24 16:07:13,367] Trial 55 finished with value: 0.1200866679033116 and parameters: {'alpha': 134.03887616256677, 'use_snp_selection': True, 'num_snps': 46398, 'iw_method': 'uniform', 'iw_clip_max': 20.0, 'iw_prob_clip': 0.005598647885842805}. Best is trial 47 with value: 0.17115191981018898.
[I 2026-04-24 16:09:15,461] Trial 56 finished with value: 0.1638636179305948 and parameters: {'alpha': 125306.9728924675, 'use_snp_selection': True, 'num_snps': 57175, 'iw_method': 'uniform', 'iw_clip_max': 20.0, 'iw_prob_clip': 0.007221023578763819}. Best is trial 47 with value: 0.17115191981018898.
