[I 2026-04-28 22:37:49,353] Trial 106 finished with value: 0.1859533379981066 and parameters: {'alpha': 207606.94361445215, 'use_snp_selection': False, 'iw_method': 'pc_logistic', 'iw_clip_max': 1.5, 'iw_prob_clip': 0.008051272241770725, 'iw_n_components': 30, 'iw_logistic_c': 0.0001941387493846102, 'iw_pca_fit': 'combined', 'iw_solver': 'lbfgs', 'iw_rho': 0.9}. Best is trial 98 with value: 0.18965974258810434.
[I 2026-04-28 22:40:52,125] Trial 107 finished with value: 0.1863569133728152 and parameters: {'alpha': 187874.69035019178, 'use_snp_selection': False, 'iw_method': 'pc_logistic', 'iw_clip_max': 1.5, 'iw_prob_clip': 0.011839815737381612, 'iw_n_components': 1, 'iw_logistic_c': 8.213919770304757e-05, 'iw_pca_fit': 'source', 'iw_solver': 'lbfgs', 'iw_rho': 0.9}. Best is trial 98 with value: 0.18965974258810434.
[I 2026-04-28 22:44:09,009] Trial 108 finished with value: 0.18788991548894976 and parameters: {'alpha': 290999.3749566515, 'use_snp_selection': False, 'iw_method': 'pc_logistic', 'iw_clip_max': 1.5, 'iw_prob_clip': 0.0101435693180075, 'iw_n_components': 1, 'iw_logistic_c': 0.0003419208601984667, 'iw_pca_fit': 'combined', 'iw_solver': 'lbfgs', 'iw_rho': 0.9}. Best is trial 98 with value: 0.18965974258810434.
[I 2026-04-28 22:48:00,453] Trial 109 finished with value: 0.185274049770822 and parameters: {'alpha': 228077.84928834136, 'use_snp_selection': False, 'iw_method': 'pc_logistic', 'iw_clip_max': 1.5, 'iw_prob_clip': 0.008619066504487129, 'iw_n_components': 20, 'iw_logistic_c': 5.467095666422434e-05, 'iw_pca_fit': 'combined', 'iw_solver': 'lbfgs', 'iw_rho': 0.9}. Best is trial 98 with value: 0.18965974258810434.
[I 2026-04-28 22:51:17,241] Trial 110 finished with value: 0.18066682777642892 and parameters: {'alpha': 518475.51983097865, 'use_snp_selection': False, 'iw_method': 'pc_logistic', 'iw_clip_max': 5.0, 'iw_prob_clip': 0.0068760617993615806, 'iw_n_components': 1, 'iw_logistic_c': 0.00010951200701287436, 'iw_pca_fit': 'combined', 'iw_solver': 'lbfgs', 'iw_rho': 0.75}. Best is trial 98 with value: 0.18965974258810434.
[I 2026-04-28 22:54:35,782] Trial 111 finished with value: 0.1892779610660214 and parameters: {'alpha': 334660.6840415206, 'use_snp_selection': False, 'iw_method': 'pc_logistic', 'iw_clip_max': 1.5, 'iw_prob_clip': 0.007952458877099985, 'iw_n_components': 1, 'iw_logistic_c': 7.9231771883939e-05, 'iw_pca_fit': 'combined', 'iw_solver': 'lbfgs', 'iw_rho': 0.9}. Best is trial 98 with value: 0.18965974258810434.
[I 2026-04-28 22:57:52,941] Trial 112 finished with value: 0.18790419336687833 and parameters: {'alpha': 336855.92466973234, 'use_snp_selection': False, 'iw_method': 'pc_logistic', 'iw_clip_max': 1.5, 'iw_prob_clip': 0.007590752972469856, 'iw_n_components': 1, 'iw_logistic_c': 0.000993389156936246, 'iw_pca_fit': 'combined', 'iw_solver': 'lbfgs', 'iw_rho': 0.9}. Best is trial 98 with value: 0.18965974258810434.
[I 2026-04-28 23:01:10,034] Trial 113 finished with value: 0.18866847231401376 and parameters: {'alpha': 278860.94694683753, 'use_snp_selection': False, 'iw_method': 'pc_logistic', 'iw_clip_max': 1.5, 'iw_prob_clip': 0.008982901876798455, 'iw_n_components': 1, 'iw_logistic_c': 0.00022718085851152156, 'iw_pca_fit': 'combined', 'iw_solver': 'lbfgs', 'iw_rho': 0.9}. Best is trial 98 with value: 0.18965974258810434.
[I 2026-04-28 23:04:27,610] Trial 114 finished with value: 0.18873105571890766 and parameters: {'alpha': 350819.84984660684, 'use_snp_selection': False, 'iw_method': 'pc_logistic', 'iw_clip_max': 1.5, 'iw_prob_clip': 0.009787611301434174, 'iw_n_components': 1, 'iw_logistic_c': 4.609984149836357e-05, 'iw_pca_fit': 'combined', 'iw_solver': 'lbfgs', 'iw_rho': 0.9}. Best is trial 98 with value: 0.18965974258810434.
[I 2026-04-28 23:07:50,638] Trial 115 finished with value: 0.183910506296262 and parameters: {'alpha': 371469.00155985367, 'use_snp_selection': False, 'iw_method': 'pc_logistic', 'iw_clip_max': 1.5, 'iw_prob_clip': 0.009169669723866927, 'iw_n_components': 3, 'iw_logistic_c': 6.636156530964225e-05, 'iw_pca_fit': 'combined', 'iw_solver': 'lbfgs', 'iw_rho': 0.9}. Best is trial 98 with value: 0.18965974258810434.
[I 2026-04-28 23:11:07,687] Trial 116 finished with value: 0.18821152033149918 and parameters: {'alpha': 401209.76656594384, 'use_snp_selection': False, 'iw_method': 'pc_logistic', 'iw_clip_max': 1.5, 'iw_prob_clip': 0.009813478481725856, 'iw_n_components': 1, 'iw_logistic_c': 3.5176614056214205e-05, 'iw_pca_fit': 'combined', 'iw_solver': 'lbfgs', 'iw_rho': 1.0}. Best is trial 98 with value: 0.18965974258810434.
[I 2026-04-28 23:14:24,688] Trial 117 finished with value: 0.18065268256935602 and parameters: {'alpha': 353788.97259383654, 'use_snp_selection': False, 'iw_method': 'pc_logistic', 'iw_clip_max': 10.0, 'iw_prob_clip': 0.007825732299916085, 'iw_n_components': 1, 'iw_logistic_c': 0.04352706379288866, 'iw_pca_fit': 'combined', 'iw_solver': 'lbfgs', 'iw_rho': 0.9}. Best is trial 98 with value: 0.18965974258810434.
[I 2026-04-28 23:17:41,945] Trial 118 finished with value: 0.1896656383273079 and parameters: {'alpha': 324747.92746447586, 'use_snp_selection': False, 'iw_method': 'pc_logistic', 'iw_clip_max': 1.5, 'iw_prob_clip': 0.006606379516880447, 'iw_n_components': 1, 'iw_logistic_c': 0.00011972147001726162, 'iw_pca_fit': 'combined', 'iw_solver': 'lbfgs', 'iw_rho': 0.9}. Best is trial 118 with value: 0.1896656383273079.
[I 2026-04-28 23:21:07,575] Trial 119 finished with value: 0.1812477793178636 and parameters: {'alpha': 306800.31326227164, 'use_snp_selection': False, 'iw_method': 'pc_logistic', 'iw_clip_max': 3.0, 'iw_prob_clip': 0.005271591109276012, 'iw_n_components': 5, 'iw_logistic_c': 0.0004921845017705485, 'iw_pca_fit': 'combined', 'iw_solver': 'lbfgs', 'iw_rho': 0.5}. Best is trial 118 with value: 0.1896656383273079.
[I 2026-04-28 23:24:24,828] Trial 120 finished with value: 0.18405545801347417 and parameters: {'alpha': 318536.7867427737, 'use_snp_selection': False, 'iw_method': 'pc_logistic', 'iw_clip_max': 5.0, 'iw_prob_clip': 0.0055109461269735845, 'iw_n_components': 1, 'iw_logistic_c': 0.00013571744829665532, 'iw_pca_fit': 'combined', 'iw_solver': 'lbfgs', 'iw_rho': 0.9}. Best is trial 118 with value: 0.1896656383273079.
[I 2026-04-28 23:27:42,011] Trial 121 finished with value: 0.1897631748421533 and parameters: {'alpha': 258226.60732107615, 'use_snp_selection': False, 'iw_method': 'pc_logistic', 'iw_clip_max': 1.5, 'iw_prob_clip': 0.006441397579720831, 'iw_n_components': 1, 'iw_logistic_c': 4.763442336123836e-05, 'iw_pca_fit': 'combined', 'iw_solver': 'lbfgs', 'iw_rho': 0.9}. Best is trial 121 with value: 0.1897631748421533.
[I 2026-04-28 23:30:59,242] Trial 122 finished with value: 0.1897454525028794 and parameters: {'alpha': 260757.70205404403, 'use_snp_selection': False, 'iw_method': 'pc_logistic', 'iw_clip_max': 1.5, 'iw_prob_clip': 0.006635856002880124, 'iw_n_components': 1, 'iw_logistic_c': 4.724072639733511e-05, 'iw_pca_fit': 'combined', 'iw_solver': 'lbfgs', 'iw_rho': 0.9}. Best is trial 121 with value: 0.1897631748421533.
[I 2026-04-28 23:34:16,519] Trial 123 finished with value: 0.1896918058174649 and parameters: {'alpha': 264991.5277531696, 'use_snp_selection': False, 'iw_method': 'pc_logistic', 'iw_clip_max': 1.5, 'iw_prob_clip': 0.006568719925375127, 'iw_n_components': 1, 'iw_logistic_c': 0.00021271126578002885, 'iw_pca_fit': 'combined', 'iw_solver': 'lbfgs', 'iw_rho': 0.9}. Best is trial 121 with value: 0.1897631748421533.
[I 2026-04-28 23:37:33,735] Trial 124 finished with value: 0.1894864195245808 and parameters: {'alpha': 245323.01781182882, 'use_snp_selection': False, 'iw_method': 'pc_logistic', 'iw_clip_max': 1.5, 'iw_prob_clip': 0.006785846472315557, 'iw_n_components': 1, 'iw_logistic_c': 0.0002867748273460604, 'iw_pca_fit': 'combined', 'iw_solver': 'lbfgs', 'iw_rho': 0.9}. Best is trial 121 with value: 0.1897631748421533.
[I 2026-04-28 23:41:26,777] Trial 125 finished with value: 0.18746512374579313 and parameters: {'alpha': 257051.10034501448, 'use_snp_selection': False, 'iw_method': 'pc_logistic', 'iw_clip_max': 1.5, 'iw_prob_clip': 0.006587074196905459, 'iw_n_components': 20, 'iw_logistic_c': 0.0002662377463654441, 'iw_pca_fit': 'combined', 'iw_solver': 'lbfgs', 'iw_rho': 0.9}. Best is trial 121 with value: 0.1897631748421533.
[I 2026-04-28 23:44:44,236] Trial 126 finished with value: 0.18906873662854012 and parameters: {'alpha': 242588.781298552, 'use_snp_selection': False, 'iw_method': 'pc_logistic', 'iw_clip_max': 1.5, 'iw_prob_clip': 0.00681371952112313, 'iw_n_components': 1, 'iw_logistic_c': 0.000563531823867301, 'iw_pca_fit': 'combined', 'iw_solver': 'lbfgs', 'iw_rho': 0.9}. Best is trial 121 with value: 0.1897631748421533.
[I 2026-04-28 23:48:01,694] Trial 127 finished with value: 0.1893456319644819 and parameters: {'alpha': 228617.95617147643, 'use_snp_selection': False, 'iw_method': 'pc_logistic', 'iw_clip_max': 1.5, 'iw_prob_clip': 0.00609121773679105, 'iw_n_components': 1, 'iw_logistic_c': 0.000590110091925632, 'iw_pca_fit': 'combined', 'iw_solver': 'lbfgs', 'iw_rho': 0.9}. Best is trial 121 with value: 0.1897631748421533.
[I 2026-04-28 23:51:05,533] Trial 128 finished with value: 0.18611550331120214 and parameters: {'alpha': 244836.40824381093, 'use_snp_selection': False, 'iw_method': 'pc_logistic', 'iw_clip_max': 1.5, 'iw_prob_clip': 0.005981575797521797, 'iw_n_components': 1, 'iw_logistic_c': 0.0019833649542385485, 'iw_pca_fit': 'source', 'iw_solver': 'lbfgs', 'iw_rho': 0.75}. Best is trial 121 with value: 0.1897631748421533.
[I 2026-04-28 23:54:22,991] Trial 129 finished with value: 0.18969803036248864 and parameters: {'alpha': 225462.74957184048, 'use_snp_selection': False, 'iw_method': 'pc_logistic', 'iw_clip_max': 1.5, 'iw_prob_clip': 0.004804544288380918, 'iw_n_components': 1, 'iw_logistic_c': 0.0008784492530929268, 'iw_pca_fit': 'combined', 'iw_solver': 'lbfgs', 'iw_rho': 0.9}. Best is trial 121 with value: 0.1897631748421533.
[I 2026-04-28 23:57:45,574] Trial 130 finished with value: 0.18316257011324621 and parameters: {'alpha': 220488.70825962548, 'use_snp_selection': False, 'iw_method': 'pc_logistic', 'iw_clip_max': 1.5, 'iw_prob_clip': 0.005005934219241358, 'iw_n_components': 2, 'iw_logistic_c': 0.0008470241446553828, 'iw_pca_fit': 'combined', 'iw_solver': 'lbfgs', 'iw_rho': 0.9}. Best is trial 121 with value: 0.1897631748421533.
[I 2026-04-29 00:01:02,384] Trial 131 finished with value: 0.18884382332572838 and parameters: {'alpha': 235103.10917547112, 'use_snp_selection': False, 'iw_method': 'pc_logistic', 'iw_clip_max': 1.5, 'iw_prob_clip': 0.006237876760309356, 'iw_n_components': 1, 'iw_logistic_c': 0.0012572792876903755, 'iw_pca_fit': 'combined', 'iw_solver': 'lbfgs', 'iw_rho': 0.9}. Best is trial 121 with value: 0.1897631748421533.
[I 2026-04-29 00:04:15,895] Trial 132 finished with value: 0.1898323573344027 and parameters: {'alpha': 207491.03939564663, 'use_snp_selection': False, 'iw_method': 'pc_logistic', 'iw_clip_max': 1.5, 'iw_prob_clip': 0.004787062786930874, 'iw_n_components': 1, 'iw_logistic_c': 0.000618762411057949, 'iw_pca_fit': 'combined', 'iw_solver': 'lbfgs', 'iw_rho': 0.9}. Best is trial 132 with value: 0.1898323573344027.
[I 2026-04-29 00:07:29,305] Trial 133 finished with value: 0.1892210310662437 and parameters: {'alpha': 207802.37345229022, 'use_snp_selection': False, 'iw_method': 'pc_logistic', 'iw_clip_max': 1.5, 'iw_prob_clip': 0.004687624454574461, 'iw_n_components': 1, 'iw_logistic_c': 0.003221773183368566, 'iw_pca_fit': 'combined', 'iw_solver': 'lbfgs', 'iw_rho': 0.9}. Best is trial 132 with value: 0.1898323573344027.
[I 2026-04-29 00:10:42,022] Trial 134 finished with value: 0.1890967084194393 and parameters: {'alpha': 166255.19180869288, 'use_snp_selection': False, 'iw_method': 'pc_logistic', 'iw_clip_max': 1.5, 'iw_prob_clip': 0.003970088821928559, 'iw_n_components': 1, 'iw_logistic_c': 0.002982339841735983, 'iw_pca_fit': 'combined', 'iw_solver': 'lbfgs', 'iw_rho': 0.9}. Best is trial 132 with value: 0.1898323573344027.
[I 2026-04-29 00:13:54,760] Trial 135 finished with value: 0.18415492798296423 and parameters: {'alpha': 204954.09404494544, 'use_snp_selection': False, 'iw_method': 'pc_logistic', 'iw_clip_max': 5.0, 'iw_prob_clip': 0.004699859919444015, 'iw_n_components': 1, 'iw_logistic_c': 0.00883747035453145, 'iw_pca_fit': 'combined', 'iw_solver': 'lbfgs', 'iw_rho': 0.9}. Best is trial 132 with value: 0.1898323573344027.
[I 2026-04-29 00:17:48,507] Trial 136 finished with value: 0.1868914629421049 and parameters: {'alpha': 176110.68967216127, 'use_snp_selection': False, 'iw_method': 'pc_logistic', 'iw_clip_max': 1.5, 'iw_prob_clip': 0.0054325969897695, 'iw_n_components': 30, 'iw_logistic_c': 0.0004014668449617854, 'iw_pca_fit': 'combined', 'iw_solver': 'lbfgs', 'iw_rho': 0.9}. Best is trial 132 with value: 0.1898323573344027.
[I 2026-04-29 00:21:01,887] Trial 137 finished with value: 0.1889897158131514 and parameters: {'alpha': 217664.18501507744, 'use_snp_selection': False, 'iw_method': 'pc_logistic', 'iw_clip_max': 1.5, 'iw_prob_clip': 0.0047157632286662305, 'iw_n_components': 1, 'iw_logistic_c': 5.922754295793078, 'iw_pca_fit': 'combined', 'iw_solver': 'lbfgs', 'iw_rho': 0.9}. Best is trial 132 with value: 0.1898323573344027.
[I 2026-04-29 00:24:15,159] Trial 138 finished with value: 0.18950738816222898 and parameters: {'alpha': 194947.61844176284, 'use_snp_selection': False, 'iw_method': 'pc_logistic', 'iw_clip_max': 1.5, 'iw_prob_clip': 0.004251989442085506, 'iw_n_components': 1, 'iw_logistic_c': 0.0015620416976254217, 'iw_pca_fit': 'combined', 'iw_solver': 'lbfgs', 'iw_rho': 0.9}. Best is trial 132 with value: 0.1898323573344027.
[I 2026-04-29 00:28:06,782] Trial 139 finished with value: -1.0 and parameters: {'alpha': 192496.4496310365, 'use_snp_selection': False, 'iw_method': 'pc_logistic', 'iw_clip_max': 10.0, 'iw_prob_clip': 0.004285657552292929, 'iw_n_components': 20, 'iw_logistic_c': 0.001440535342739269, 'iw_pca_fit': 'combined', 'iw_solver': 'lbfgs', 'iw_rho': 1.0}. Best is trial 132 with value: 0.1898323573344027.
[I 2026-04-29 00:31:20,068] Trial 140 finished with value: 0.19021099151597312 and parameters: {'alpha': 228036.704834159, 'use_snp_selection': False, 'iw_method': 'pc_logistic', 'iw_clip_max': 1.5, 'iw_prob_clip': 0.004264858363264718, 'iw_n_components': 1, 'iw_logistic_c': 0.000537444632484202, 'iw_pca_fit': 'combined', 'iw_solver': 'lbfgs', 'iw_rho': 0.9}. Best is trial 140 with value: 0.19021099151597312.
[I 2026-04-29 00:34:34,420] Trial 141 finished with value: 0.1904513377222744 and parameters: {'alpha': 229386.38357874402, 'use_snp_selection': False, 'iw_method': 'pc_logistic', 'iw_clip_max': 1.5, 'iw_prob_clip': 0.003616794839306531, 'iw_n_components': 1, 'iw_logistic_c': 0.000510901512147753, 'iw_pca_fit': 'combined', 'iw_solver': 'lbfgs', 'iw_rho': 0.9}. Best is trial 141 with value: 0.1904513377222744.
[I 2026-04-29 00:37:48,665] Trial 142 finished with value: 0.18962861302332165 and parameters: {'alpha': 226453.48369730412, 'use_snp_selection': False, 'iw_method': 'pc_logistic', 'iw_clip_max': 1.5, 'iw_prob_clip': 0.004222437221809919, 'iw_n_components': 1, 'iw_logistic_c': 0.0018223682753759434, 'iw_pca_fit': 'combined', 'iw_solver': 'lbfgs', 'iw_rho': 0.9}. Best is trial 141 with value: 0.1904513377222744.
[I 2026-04-29 00:41:02,965] Trial 143 finished with value: 0.19008278525761063 and parameters: {'alpha': 230651.83568554386, 'use_snp_selection': False, 'iw_method': 'pc_logistic', 'iw_clip_max': 1.5, 'iw_prob_clip': 0.0029619636402268266, 'iw_n_components': 1, 'iw_logistic_c': 0.0020944237538957637, 'iw_pca_fit': 'combined', 'iw_solver': 'lbfgs', 'iw_rho': 0.9}. Best is trial 141 with value: 0.1904513377222744.
[I 2026-04-29 00:44:17,190] Trial 144 finished with value: 0.1900655096713468 and parameters: {'alpha': 229516.56428328974, 'use_snp_selection': False, 'iw_method': 'pc_logistic', 'iw_clip_max': 1.5, 'iw_prob_clip': 0.00299530895560566, 'iw_n_components': 1, 'iw_logistic_c': 0.002122631577346572, 'iw_pca_fit': 'combined', 'iw_solver': 'lbfgs', 'iw_rho': 0.9}. Best is trial 141 with value: 0.1904513377222744.
[I 2026-04-29 00:47:31,068] Trial 145 finished with value: 0.18983519966688572 and parameters: {'alpha': 195757.85979025473, 'use_snp_selection': False, 'iw_method': 'pc_logistic', 'iw_clip_max': 1.5, 'iw_prob_clip': 0.0027631855799763773, 'iw_n_components': 1, 'iw_logistic_c': 0.006789980077015481, 'iw_pca_fit': 'combined', 'iw_solver': 'lbfgs', 'iw_rho': 0.9}. Best is trial 141 with value: 0.1904513377222744.
[I 2026-04-29 00:50:44,287] Trial 146 finished with value: 0.18964948634483556 and parameters: {'alpha': 178707.09796647698, 'use_snp_selection': False, 'iw_method': 'pc_logistic', 'iw_clip_max': 1.5, 'iw_prob_clip': 0.0028007470141521115, 'iw_n_components': 1, 'iw_logistic_c': 0.006055654259089812, 'iw_pca_fit': 'combined', 'iw_solver': 'lbfgs', 'iw_rho': 0.9}. Best is trial 141 with value: 0.1904513377222744.
[I 2026-04-29 00:53:57,409] Trial 147 finished with value: 0.18896743735241048 and parameters: {'alpha': 145326.92854144116, 'use_snp_selection': False, 'iw_method': 'pc_logistic', 'iw_clip_max': 1.5, 'iw_prob_clip': 0.0028077033897770704, 'iw_n_components': 1, 'iw_logistic_c': 0.005716868318928875, 'iw_pca_fit': 'combined', 'iw_solver': 'lbfgs', 'iw_rho': 0.9}. Best is trial 141 with value: 0.1904513377222744.
[I 2026-04-29 00:57:10,649] Trial 148 finished with value: 0.18985839211815092 and parameters: {'alpha': 180260.99737286087, 'use_snp_selection': False, 'iw_method': 'pc_logistic', 'iw_clip_max': 1.5, 'iw_prob_clip': 0.002155406766583952, 'iw_n_components': 1, 'iw_logistic_c': 0.012815481668548144, 'iw_pca_fit': 'combined', 'iw_solver': 'lbfgs', 'iw_rho': 0.9}. Best is trial 141 with value: 0.1904513377222744.
[I 2026-04-29 01:00:23,810] Trial 149 finished with value: 0.18994720625951209 and parameters: {'alpha': 183630.3386410238, 'use_snp_selection': False, 'iw_method': 'pc_logistic', 'iw_clip_max': 1.5, 'iw_prob_clip': 0.0021366377293766375, 'iw_n_components': 1, 'iw_logistic_c': 0.0063211999609137, 'iw_pca_fit': 'combined', 'iw_solver': 'lbfgs', 'iw_rho': 0.9}. Best is trial 141 with value: 0.1904513377222744.
