[I 2026-05-06 01:54:29,736] Trial 27 finished with value: 0.12748649902043538 and parameters: {'hidden_dims': '[256, 128]', 'dropout': 0.23006880577466218, 'batch_norm': False, 'lr': 2.132969748234868e-06, 'weight_decay': 0.00032187445513068156, 'epochs': 52, 'loss': 'mse', 'optimizer': 'adamw', 'use_snp_selection': False}. Best is trial 25 with value: 0.20803346788729318.
[I 2026-05-06 01:56:21,153] Trial 28 finished with value: 0.1894615127943537 and parameters: {'hidden_dims': '[512, 128]', 'dropout': 0.29470202001153034, 'batch_norm': False, 'lr': 1.560256836316412e-05, 'weight_decay': 0.0009645861890560591, 'epochs': 172, 'loss': 'mse', 'optimizer': 'adamw', 'use_snp_selection': False}. Best is trial 25 with value: 0.20803346788729318.
[I 2026-05-06 01:57:11,155] Trial 29 finished with value: 0.19984328836070092 and parameters: {'hidden_dims': '[256, 128]', 'dropout': 0.18707126781168967, 'batch_norm': False, 'lr': 8.356469641180147e-06, 'weight_decay': 0.00010777746261084818, 'epochs': 135, 'loss': 'mse', 'optimizer': 'adamw', 'use_snp_selection': False}. Best is trial 25 with value: 0.20803346788729318.
[I 2026-05-06 01:58:04,083] Trial 30 finished with value: 0.207234277346061 and parameters: {'hidden_dims': '[512, 64]', 'dropout': 0.18448941240253885, 'batch_norm': False, 'lr': 2.0045032785535153e-05, 'weight_decay': 0.0003530459523175648, 'epochs': 72, 'loss': 'mse', 'optimizer': 'adamw', 'use_snp_selection': False}. Best is trial 25 with value: 0.20803346788729318.
[I 2026-05-06 01:58:56,444] Trial 31 finished with value: 0.20792101365574361 and parameters: {'hidden_dims': '[512, 64]', 'dropout': 0.16065876946590837, 'batch_norm': False, 'lr': 2.1116954982171174e-05, 'weight_decay': 0.0003537493756124961, 'epochs': 71, 'loss': 'mse', 'optimizer': 'adamw', 'use_snp_selection': False}. Best is trial 25 with value: 0.20803346788729318.
[I 2026-05-06 01:59:49,956] Trial 32 finished with value: 0.20781749713075817 and parameters: {'hidden_dims': '[512, 64]', 'dropout': 0.1855915139104646, 'batch_norm': False, 'lr': 2.0896633441334e-05, 'weight_decay': 0.00014258450396990887, 'epochs': 73, 'loss': 'mse', 'optimizer': 'adamw', 'use_snp_selection': False}. Best is trial 25 with value: 0.20803346788729318.
[I 2026-05-06 02:00:42,877] Trial 33 finished with value: 0.20659360634335874 and parameters: {'hidden_dims': '[512, 64]', 'dropout': 0.21162709686833214, 'batch_norm': False, 'lr': 3.9148127652244784e-05, 'weight_decay': 9.741295338052089e-05, 'epochs': 72, 'loss': 'mse', 'optimizer': 'adamw', 'use_snp_selection': False}. Best is trial 25 with value: 0.20803346788729318.
[I 2026-05-06 02:01:50,913] Trial 34 finished with value: 0.20454288121971193 and parameters: {'hidden_dims': '[512, 64]', 'dropout': 0.26146411860826174, 'batch_norm': False, 'lr': 1.3464208541925834e-05, 'weight_decay': 0.00017937054974324587, 'epochs': 98, 'loss': 'mse', 'optimizer': 'adamw', 'use_snp_selection': False}. Best is trial 25 with value: 0.20803346788729318.
[I 2026-05-06 02:02:40,804] Trial 35 finished with value: 0.19187637004729402 and parameters: {'hidden_dims': '[512, 64]', 'dropout': 0.08032669473262205, 'batch_norm': False, 'lr': 5.28853195461042e-05, 'weight_decay': 0.0009579336872109443, 'epochs': 67, 'loss': 'mae', 'optimizer': 'adamw', 'use_snp_selection': False}. Best is trial 25 with value: 0.20803346788729318.
[I 2026-05-06 02:03:50,728] Trial 36 finished with value: 0.19427613875748906 and parameters: {'hidden_dims': '[512, 64]', 'dropout': 0.5790677458292788, 'batch_norm': False, 'lr': 2.0230201762841583e-05, 'weight_decay': 0.0004968572212311182, 'epochs': 101, 'loss': 'mse', 'optimizer': 'adamw', 'use_snp_selection': False}. Best is trial 25 with value: 0.20803346788729318.
[I 2026-05-06 02:04:32,055] Trial 37 finished with value: 0.19823281612447807 and parameters: {'hidden_dims': '[512, 64]', 'dropout': 0.21323505846289184, 'batch_norm': False, 'lr': 3.119198689808882e-05, 'weight_decay': 0.00021480562235584222, 'epochs': 52, 'loss': 'mse', 'optimizer': 'adam', 'use_snp_selection': False}. Best is trial 25 with value: 0.20803346788729318.
[I 2026-05-06 02:05:26,724] Trial 38 finished with value: 0.20770451665310477 and parameters: {'hidden_dims': '[512, 64]', 'dropout': 0.1607651165664883, 'batch_norm': False, 'lr': 1.0996031414015433e-05, 'weight_decay': 1.2202929969884317e-07, 'epochs': 75, 'loss': 'mse', 'optimizer': 'adamw', 'use_snp_selection': False}. Best is trial 25 with value: 0.20803346788729318.
[I 2026-05-06 02:06:39,549] Trial 39 finished with value: 0.18197517732317114 and parameters: {'hidden_dims': '[512, 64]', 'dropout': 0.06643128171885734, 'batch_norm': False, 'lr': 3.848460486791211e-06, 'weight_decay': 2.687524469521877e-06, 'epochs': 106, 'loss': 'mae', 'optimizer': 'adamw', 'use_snp_selection': False}. Best is trial 25 with value: 0.20803346788729318.
[I 2026-05-06 02:07:33,043] Trial 0 finished with value: 0.17412431723893013 and parameters: {'hidden_dims': '[256, 128]', 'dropout': 0.18584155530312246, 'batch_norm': False, 'lr': 0.0007461243578022468, 'weight_decay': 3.677761493113531e-06, 'epochs': 129, 'loss': 'mse', 'optimizer': 'adam', 'use_snp_selection': False}. Best is trial 0 with value: 0.17412431723893013.
[I 2026-05-06 02:08:48,802] Trial 1 finished with value: 0.163750879443177 and parameters: {'hidden_dims': '[256, 128]', 'dropout': 0.5595345557272271, 'batch_norm': False, 'lr': 1.3265824528578217e-05, 'weight_decay': 5.782219985187962e-05, 'epochs': 241, 'loss': 'mse', 'optimizer': 'adamw', 'use_snp_selection': False}. Best is trial 0 with value: 0.17412431723893013.
[I 2026-05-06 02:09:17,144] Trial 2 finished with value: 0.16562510152497953 and parameters: {'hidden_dims': '[256, 128]', 'dropout': 0.10920465462713655, 'batch_norm': False, 'lr': 9.251006337777395e-06, 'weight_decay': 0.0002739600801554822, 'epochs': 70, 'loss': 'mse', 'optimizer': 'adamw', 'use_snp_selection': False}. Best is trial 0 with value: 0.17412431723893013.
[I 2026-05-06 02:10:01,379] Trial 3 finished with value: 0.12599222647097513 and parameters: {'hidden_dims': '[512, 64]', 'dropout': 0.21097588325962954, 'batch_norm': False, 'lr': 0.00013945529197043052, 'weight_decay': 6.125997514421991e-07, 'epochs': 62, 'loss': 'mae', 'optimizer': 'adamw', 'use_snp_selection': False}. Best is trial 0 with value: 0.17412431723893013.
[I 2026-05-06 02:11:12,615] Trial 4 finished with value: 0.1737013546088459 and parameters: {'hidden_dims': '[512, 64]', 'dropout': 0.07948656777033702, 'batch_norm': False, 'lr': 4.227110266060512e-06, 'weight_decay': 0.0009515677674579354, 'epochs': 111, 'loss': 'mae', 'optimizer': 'adamw', 'use_snp_selection': False}. Best is trial 0 with value: 0.17412431723893013.
[I 2026-05-06 02:12:49,438] Trial 5 finished with value: 0.15667556321695142 and parameters: {'hidden_dims': '[512, 64]', 'dropout': 0.07220834610702047, 'batch_norm': False, 'lr': 2.8779057444450007e-06, 'weight_decay': 1.7819387991359787e-06, 'epochs': 157, 'loss': 'mse', 'optimizer': 'adam', 'use_snp_selection': False}. Best is trial 0 with value: 0.17412431723893013.
[I 2026-05-06 02:13:27,592] Trial 6 pruned. 
[I 2026-05-06 02:15:14,647] Trial 7 pruned. 
[I 2026-05-06 02:16:34,888] Trial 8 finished with value: 0.15335252724949713 and parameters: {'hidden_dims': '[256, 64]', 'dropout': 0.14217118023780909, 'batch_norm': False, 'lr': 1.5072012341348237e-05, 'weight_decay': 2.5901569052680897e-08, 'epochs': 256, 'loss': 'mse', 'optimizer': 'adamw', 'use_snp_selection': False}. Best is trial 0 with value: 0.17412431723893013.
[I 2026-05-06 02:17:43,104] Trial 9 finished with value: 0.15849724066110532 and parameters: {'hidden_dims': '[256, 64]', 'dropout': 0.18128694708490736, 'batch_norm': False, 'lr': 2.644789330745559e-05, 'weight_decay': 5.030108342609318e-05, 'epochs': 213, 'loss': 'mae', 'optimizer': 'adam', 'use_snp_selection': False}. Best is trial 0 with value: 0.17412431723893013.
[I 2026-05-06 02:18:35,574] Trial 10 pruned. 
[I 2026-05-06 02:19:47,644] Trial 11 finished with value: 0.17186228452440483 and parameters: {'hidden_dims': '[512, 64]', 'dropout': 0.0066972824748103565, 'batch_norm': False, 'lr': 0.0008060831574777627, 'weight_decay': 1.3246139464665943e-05, 'epochs': 112, 'loss': 'mae', 'optimizer': 'adam', 'use_snp_selection': False}. Best is trial 0 with value: 0.17412431723893013.
[I 2026-05-06 02:20:11,838] Trial 12 pruned. 
[I 2026-05-06 02:21:19,353] Trial 13 finished with value: 0.16395528770612694 and parameters: {'hidden_dims': '[512, 64]', 'dropout': 0.00882576656860476, 'batch_norm': False, 'lr': 0.00017229008843525155, 'weight_decay': 8.982294151061445e-06, 'epochs': 103, 'loss': 'mae', 'optimizer': 'adamw', 'use_snp_selection': False}. Best is trial 0 with value: 0.17412431723893013.
[I 2026-05-06 02:22:54,280] Trial 14 finished with value: 0.1516368713172674 and parameters: {'hidden_dims': '[512, 64]', 'dropout': 0.36038940903309347, 'batch_norm': False, 'lr': 3.0338541799792495e-06, 'weight_decay': 1.2456268360755086e-07, 'epochs': 154, 'loss': 'mse', 'optimizer': 'adamw', 'use_snp_selection': False}. Best is trial 0 with value: 0.17412431723893013.
[I 2026-05-06 02:23:29,397] Trial 15 finished with value: 0.15899814937068119 and parameters: {'hidden_dims': '[256, 128]', 'dropout': 0.08072062891637034, 'batch_norm': False, 'lr': 0.00017179673872996657, 'weight_decay': 0.00010005685765687193, 'epochs': 95, 'loss': 'mae', 'optimizer': 'adam', 'use_snp_selection': False}. Best is trial 0 with value: 0.17412431723893013.
[I 2026-05-06 02:24:56,444] Trial 16 finished with value: 0.14611714103705503 and parameters: {'hidden_dims': '[512, 128]', 'dropout': 0.49972833233087566, 'batch_norm': False, 'lr': 4.842121767791636e-06, 'weight_decay': 7.86363040379479e-06, 'epochs': 138, 'loss': 'mae', 'optimizer': 'adam', 'use_snp_selection': False}. Best is trial 0 with value: 0.17412431723893013.
[I 2026-05-06 02:25:54,014] Trial 17 finished with value: 0.15461267561657888 and parameters: {'hidden_dims': '[256, 64]', 'dropout': 0.16476759624383114, 'batch_norm': False, 'lr': 7.450651879242968e-05, 'weight_decay': 1.1316746529475349e-07, 'epochs': 176, 'loss': 'mse', 'optimizer': 'adamw', 'use_snp_selection': False}. Best is trial 0 with value: 0.17412431723893013.
[I 2026-05-06 02:26:17,115] Trial 18 finished with value: 0.12926372947835013 and parameters: {'hidden_dims': '[256, 128]', 'dropout': 0.3242816103563779, 'batch_norm': False, 'lr': 0.00034057660424941823, 'weight_decay': 2.2262149901035603e-06, 'epochs': 52, 'loss': 'mse', 'optimizer': 'adamw', 'use_snp_selection': False}. Best is trial 0 with value: 0.17412431723893013.
[I 2026-05-06 02:26:51,551] Trial 19 pruned. 
[I 2026-05-06 02:27:35,556] Trial 20 finished with value: 0.17164336611156095 and parameters: {'hidden_dims': '[256, 128]', 'dropout': 0.2662086979865264, 'batch_norm': False, 'lr': 6.102159839091194e-06, 'weight_decay': 1.0839678313447978e-08, 'epochs': 126, 'loss': 'mse', 'optimizer': 'adamw', 'use_snp_selection': False}. Best is trial 0 with value: 0.17412431723893013.
[I 2026-05-06 02:28:49,213] Trial 21 finished with value: 0.1681247495072566 and parameters: {'hidden_dims': '[512, 64]', 'dropout': 0.000651940476751045, 'batch_norm': False, 'lr': 0.0006577933984092442, 'weight_decay': 0.00014168333700560545, 'epochs': 115, 'loss': 'mae', 'optimizer': 'adam', 'use_snp_selection': False}. Best is trial 0 with value: 0.17412431723893013.
[I 2026-05-06 02:29:47,022] Trial 22 finished with value: 0.1551121228853025 and parameters: {'hidden_dims': '[512, 64]', 'dropout': 0.04362837735501778, 'batch_norm': False, 'lr': 0.00041211826977630606, 'weight_decay': 1.887475635829044e-05, 'epochs': 86, 'loss': 'mae', 'optimizer': 'adam', 'use_snp_selection': False}. Best is trial 0 with value: 0.17412431723893013.
[I 2026-05-06 02:30:48,871] Trial 23 pruned. 
[I 2026-05-06 02:32:14,117] Trial 24 finished with value: 0.16514208115473944 and parameters: {'hidden_dims': '[512, 64]', 'dropout': 0.0392706352923876, 'batch_norm': False, 'lr': 0.0004414029183560788, 'weight_decay': 7.673745727844902e-07, 'epochs': 136, 'loss': 'mae', 'optimizer': 'adam', 'use_snp_selection': False}. Best is trial 0 with value: 0.17412431723893013.
[I 2026-05-06 02:34:05,901] Trial 25 finished with value: 0.16003538761980557 and parameters: {'hidden_dims': '[512, 64]', 'dropout': 0.14319441225859122, 'batch_norm': False, 'lr': 6.311664487239229e-05, 'weight_decay': 2.4597965849677796e-05, 'epochs': 184, 'loss': 'mae', 'optimizer': 'adam', 'use_snp_selection': False}. Best is trial 0 with value: 0.17412431723893013.
[I 2026-05-06 02:35:21,533] Trial 26 finished with value: 0.16171306977571312 and parameters: {'hidden_dims': '[512, 128]', 'dropout': 0.2131102994919757, 'batch_norm': False, 'lr': 0.00025795657894723395, 'weight_decay': 3.743142270521145e-06, 'epochs': 118, 'loss': 'mae', 'optimizer': 'adam', 'use_snp_selection': False}. Best is trial 0 with value: 0.17412431723893013.
[I 2026-05-06 02:35:52,108] Trial 27 finished with value: 0.1313610290486124 and parameters: {'hidden_dims': '[256, 64]', 'dropout': 0.09531209482709589, 'batch_norm': False, 'lr': 0.0006352442281267169, 'weight_decay': 0.00019100605719450715, 'epochs': 78, 'loss': 'mae', 'optimizer': 'adam', 'use_snp_selection': False}. Best is trial 0 with value: 0.17412431723893013.
[I 2026-05-06 02:37:23,937] Trial 28 finished with value: 0.15763504484446372 and parameters: {'hidden_dims': '[512, 64]', 'dropout': 0.05652491594559448, 'batch_norm': False, 'lr': 9.065980290419478e-05, 'weight_decay': 0.0008990741243351185, 'epochs': 148, 'loss': 'mse', 'optimizer': 'adamw', 'use_snp_selection': False}. Best is trial 0 with value: 0.17412431723893013.
[I 2026-05-06 02:38:05,499] Trial 29 pruned. 
[I 2026-05-06 02:38:43,228] Trial 30 finished with value: 0.14789449746779593 and parameters: {'hidden_dims': '[256, 128]', 'dropout': 0.20050617123249773, 'batch_norm': False, 'lr': 1.3496637928831254e-05, 'weight_decay': 1.2134449463547788e-06, 'epochs': 103, 'loss': 'mae', 'optimizer': 'adam', 'use_snp_selection': False}. Best is trial 0 with value: 0.17412431723893013.
[I 2026-05-06 02:39:26,864] Trial 31 finished with value: 0.15366812523000953 and parameters: {'hidden_dims': '[256, 128]', 'dropout': 0.2585603708232714, 'batch_norm': False, 'lr': 6.685055817376096e-06, 'weight_decay': 2.069320008706505e-07, 'epochs': 124, 'loss': 'mse', 'optimizer': 'adamw', 'use_snp_selection': False}. Best is trial 0 with value: 0.17412431723893013.
[I 2026-05-06 02:40:11,504] Trial 32 finished with value: 0.15721641514905674 and parameters: {'hidden_dims': '[256, 128]', 'dropout': 0.13253549843815124, 'batch_norm': False, 'lr': 5.25813646592198e-06, 'weight_decay': 5.258634360159778e-08, 'epochs': 127, 'loss': 'mse', 'optimizer': 'adamw', 'use_snp_selection': False}. Best is trial 0 with value: 0.17412431723893013.
[I 2026-05-06 02:40:41,011] Trial 33 finished with value: 0.1573545656416891 and parameters: {'hidden_dims': '[256, 128]', 'dropout': 0.3011279058895899, 'batch_norm': False, 'lr': 8.459100707502945e-06, 'weight_decay': 2.5118974828904994e-07, 'epochs': 74, 'loss': 'mse', 'optimizer': 'adamw', 'use_snp_selection': False}. Best is trial 0 with value: 0.17412431723893013.
[I 2026-05-06 02:41:17,108] Trial 34 finished with value: 0.14981598025316847 and parameters: {'hidden_dims': '[256, 128]', 'dropout': 0.22917810039347228, 'batch_norm': False, 'lr': 2.8008391229022393e-06, 'weight_decay': 1.133728112547455e-05, 'epochs': 98, 'loss': 'mse', 'optimizer': 'adamw', 'use_snp_selection': False}. Best is trial 0 with value: 0.17412431723893013.
[I 2026-05-06 02:42:58,216] Trial 35 finished with value: 0.1590162591501255 and parameters: {'hidden_dims': '[512, 64]', 'dropout': 0.16968876583930306, 'batch_norm': False, 'lr': 1.7000769097142543e-05, 'weight_decay': 8.914850715502796e-05, 'epochs': 165, 'loss': 'mse', 'optimizer': 'adamw', 'use_snp_selection': False}. Best is trial 0 with value: 0.17412431723893013.
[I 2026-05-06 02:43:14,608] Trial 36 pruned. 
[I 2026-05-06 02:44:47,012] Trial 37 finished with value: 0.15326181411332146 and parameters: {'hidden_dims': '[512, 64]', 'dropout': 0.12136878284706656, 'batch_norm': False, 'lr': 3.8787749808978415e-05, 'weight_decay': 0.0003658154418838714, 'epochs': 149, 'loss': 'mse', 'optimizer': 'adamw', 'use_snp_selection': False}. Best is trial 0 with value: 0.17412431723893013.
[I 2026-05-06 02:45:32,344] Trial 38 finished with value: 0.1605565072285395 and parameters: {'hidden_dims': '[256, 128]', 'dropout': 0.027792547987433545, 'batch_norm': False, 'lr': 4.0603455188420906e-06, 'weight_decay': 1.7230512843325475e-08, 'epochs': 129, 'loss': 'mse', 'optimizer': 'adam', 'use_snp_selection': False}. Best is trial 0 with value: 0.17412431723893013.
[I 2026-05-06 02:46:37,607] Trial 39 finished with value: 0.15695793700495006 and parameters: {'hidden_dims': '[256, 64]', 'dropout': 0.06836665166179118, 'batch_norm': False, 'lr': 0.00011616145527483223, 'weight_decay': 1.3277190068207583e-06, 'epochs': 203, 'loss': 'mae', 'optimizer': 'adamw', 'use_snp_selection': False}. Best is trial 0 with value: 0.17412431723893013.
[I 2026-05-06 02:47:28,771] Trial 0 finished with value: 0.17368461081113332 and parameters: {'hidden_dims': '[256, 128]', 'dropout': 0.18584155530312246, 'batch_norm': False, 'lr': 0.0007461243578022468, 'weight_decay': 3.677761493113531e-06, 'epochs': 129, 'loss': 'mse', 'optimizer': 'adam', 'use_snp_selection': False}. Best is trial 0 with value: 0.17368461081113332.
[I 2026-05-06 02:48:47,139] Trial 1 finished with value: 0.18421019489848334 and parameters: {'hidden_dims': '[256, 128]', 'dropout': 0.5595345557272271, 'batch_norm': False, 'lr': 1.3265824528578217e-05, 'weight_decay': 5.782219985187962e-05, 'epochs': 241, 'loss': 'mse', 'optimizer': 'adamw', 'use_snp_selection': False}. Best is trial 1 with value: 0.18421019489848334.
[I 2026-05-06 02:49:16,315] Trial 2 finished with value: 0.1905753594493224 and parameters: {'hidden_dims': '[256, 128]', 'dropout': 0.10920465462713655, 'batch_norm': False, 'lr': 9.251006337777395e-06, 'weight_decay': 0.0002739600801554822, 'epochs': 70, 'loss': 'mse', 'optimizer': 'adamw', 'use_snp_selection': False}. Best is trial 2 with value: 0.1905753594493224.
[I 2026-05-06 02:50:01,772] Trial 3 finished with value: 0.15657312045404997 and parameters: {'hidden_dims': '[512, 64]', 'dropout': 0.21097588325962954, 'batch_norm': False, 'lr': 0.00013945529197043052, 'weight_decay': 6.125997514421991e-07, 'epochs': 62, 'loss': 'mae', 'optimizer': 'adamw', 'use_snp_selection': False}. Best is trial 2 with value: 0.1905753594493224.
[I 2026-05-06 02:51:15,032] Trial 4 finished with value: 0.17270949232785118 and parameters: {'hidden_dims': '[512, 64]', 'dropout': 0.07948656777033702, 'batch_norm': False, 'lr': 4.227110266060512e-06, 'weight_decay': 0.0009515677674579354, 'epochs': 111, 'loss': 'mae', 'optimizer': 'adamw', 'use_snp_selection': False}. Best is trial 2 with value: 0.1905753594493224.
[I 2026-05-06 02:52:54,633] Trial 5 finished with value: 0.18885359706695692 and parameters: {'hidden_dims': '[512, 64]', 'dropout': 0.07220834610702047, 'batch_norm': False, 'lr': 2.8779057444450007e-06, 'weight_decay': 1.7819387991359787e-06, 'epochs': 157, 'loss': 'mse', 'optimizer': 'adam', 'use_snp_selection': False}. Best is trial 2 with value: 0.1905753594493224.
[I 2026-05-06 02:53:59,269] Trial 6 finished with value: 0.17695055429712425 and parameters: {'hidden_dims': '[256, 128]', 'dropout': 0.2505465890537582, 'batch_norm': False, 'lr': 2.5144473235736295e-05, 'weight_decay': 2.6022323891275268e-08, 'epochs': 193, 'loss': 'mse', 'optimizer': 'adam', 'use_snp_selection': False}. Best is trial 2 with value: 0.1905753594493224.
[I 2026-05-06 02:56:59,561] Trial 7 finished with value: 0.16023812453359984 and parameters: {'hidden_dims': '[512, 128]', 'dropout': 0.26053077688769005, 'batch_norm': False, 'lr': 4.4060479596036606e-05, 'weight_decay': 0.0004731892192938172, 'epochs': 299, 'loss': 'mse', 'optimizer': 'adamw', 'use_snp_selection': False}. Best is trial 2 with value: 0.1905753594493224.
[I 2026-05-06 02:58:22,558] Trial 8 finished with value: 0.17260847271964572 and parameters: {'hidden_dims': '[256, 64]', 'dropout': 0.14217118023780909, 'batch_norm': False, 'lr': 1.5072012341348237e-05, 'weight_decay': 2.5901569052680897e-08, 'epochs': 256, 'loss': 'mse', 'optimizer': 'adamw', 'use_snp_selection': False}. Best is trial 2 with value: 0.1905753594493224.
[I 2026-05-06 02:59:32,782] Trial 9 finished with value: 0.1666008219782975 and parameters: {'hidden_dims': '[256, 64]', 'dropout': 0.18128694708490736, 'batch_norm': False, 'lr': 2.644789330745559e-05, 'weight_decay': 5.030108342609318e-05, 'epochs': 213, 'loss': 'mae', 'optimizer': 'adam', 'use_snp_selection': False}. Best is trial 2 with value: 0.1905753594493224.
[I 2026-05-06 03:00:00,601] Trial 10 pruned. 
[I 2026-05-06 03:01:34,601] Trial 11 finished with value: 0.17415269092169505 and parameters: {'hidden_dims': '[512, 64]', 'dropout': 0.003807762971456685, 'batch_norm': False, 'lr': 3.4969864824280087e-06, 'weight_decay': 9.022511360279957e-07, 'epochs': 147, 'loss': 'mse', 'optimizer': 'adam', 'use_snp_selection': False}. Best is trial 2 with value: 0.1905753594493224.
[I 2026-05-06 03:02:11,513] Trial 12 finished with value: 0.1406804757856795 and parameters: {'hidden_dims': '[256, 128]', 'dropout': 0.014603919360456297, 'batch_norm': False, 'lr': 1.016983558209549e-06, 'weight_decay': 5.893141369169225e-06, 'epochs': 96, 'loss': 'mse', 'optimizer': 'adam', 'use_snp_selection': False}. Best is trial 2 with value: 0.1905753594493224.
