[I 2026-04-21 18:38:48,989] Trial 4 finished with value: 0.1337845907624914 and parameters: {'hidden_dims': '[256, 64]', 'dropout': 0.18128694708490736, 'batch_norm': False, 'lr': 8.951826748007403e-05, 'weight_decay': 2.1781541495465197e-07, 'epochs': 147, 'loss': 'mse', 'optimizer': 'sgd', 'use_snp_selection': False, 'weight_scheme': 'top-heavy', 'weight_clip_max': 5.0, 'weight_topheavy_top_frac': 0.1724888194073277, 'weight_topheavy_low': 1.1620865802171172, 'weight_topheavy_high': 3.476906528073177}. Best is trial 2 with value: 0.15943527835139917.
[I 2026-04-21 18:39:00,799] Trial 5 finished with value: 0.06380995358011504 and parameters: {'hidden_dims': '[256, 64]', 'dropout': 0.2571412946970998, 'batch_norm': True, 'lr': 3.546238022482882e-05, 'weight_decay': 1.0185234767613396e-06, 'epochs': 119, 'loss': 'mse', 'optimizer': 'sgd', 'use_snp_selection': False, 'weight_scheme': 'linear', 'weight_clip_max': 10.0, 'weight_linear_min_weight': 0.9405832045183805, 'weight_linear_max_weight': 3.413610925325811}. Best is trial 2 with value: 0.15943527835139917.
[I 2026-04-21 18:39:16,952] Trial 18 finished with value: 0.17321412038902761 and parameters: {'hidden_dims': '[512, 64]', 'dropout': 0.5182358951304527, 'batch_norm': True, 'lr': 0.0002662603083906583, 'weight_decay': 1.303638387992091e-06, 'epochs': 219, 'loss': 'mae', 'optimizer': 'adam', 'use_snp_selection': False, 'weight_scheme': 'exponential', 'weight_clip_max': None, 'weight_exponential_beta': 7.4215849993730245}. Best is trial 16 with value: 0.2503929208347688.
[I 2026-04-21 18:39:22,116] Trial 6 finished with value: 0.13605434412554043 and parameters: {'hidden_dims': '[256, 64]', 'dropout': 0.037961443806696214, 'batch_norm': True, 'lr': 3.644202049829694e-05, 'weight_decay': 9.73334309820277e-06, 'epochs': 243, 'loss': 'mae', 'optimizer': 'adam', 'use_snp_selection': False, 'weight_scheme': 'minmax', 'weight_clip_max': None, 'weight_minmax_eps': 0.08689611239934374}. Best is trial 2 with value: 0.15943527835139917.
[I 2026-04-21 18:39:27,207] Trial 19 finished with value: 0.13685552075807425 and parameters: {'hidden_dims': '[512, 128]', 'dropout': 0.3469112774050703, 'batch_norm': True, 'lr': 2.2597292210017662e-06, 'weight_decay': 1.6656595424526278e-05, 'epochs': 51, 'loss': 'mae', 'optimizer': 'adamw', 'use_snp_selection': False, 'weight_scheme': 'uniform', 'weight_clip_max': 10.0}. Best is trial 16 with value: 0.2503929208347688.
[I 2026-04-21 18:39:53,362] Trial 20 finished with value: 0.2428658738516349 and parameters: {'hidden_dims': '[512, 64]', 'dropout': 0.3675243812667375, 'batch_norm': True, 'lr': 0.0005477665485112682, 'weight_decay': 1.4793601039471338e-06, 'epochs': 160, 'loss': 'mae', 'optimizer': 'adam', 'use_snp_selection': False, 'weight_scheme': 'uniform', 'weight_clip_max': None}. Best is trial 16 with value: 0.2503929208347688.
[I 2026-04-21 18:40:08,923] Trial 7 finished with value: -0.005126370189041191 and parameters: {'hidden_dims': '[512, 128]', 'dropout': 0.1304538168539244, 'batch_norm': False, 'lr': 1.5408060926311233e-05, 'weight_decay': 2.1989735568314356e-08, 'epochs': 250, 'loss': 'mse', 'optimizer': 'sgd', 'use_snp_selection': True, 'num_snps': 42550, 'weight_scheme': 'exponential', 'weight_clip_max': 10.0, 'weight_exponential_beta': 2.758850226029358}. Best is trial 2 with value: 0.15943527835139917.
[I 2026-04-21 18:40:32,834] Trial 8 finished with value: 0.16371437480017356 and parameters: {'hidden_dims': '[256, 128]', 'dropout': 0.05742396906738376, 'batch_norm': False, 'lr': 1.9761509510575143e-06, 'weight_decay': 2.933492239224291e-07, 'epochs': 82, 'loss': 'mae', 'optimizer': 'adam', 'use_snp_selection': True, 'num_snps': 29883, 'weight_scheme': 'minmax', 'weight_clip_max': 5.0, 'weight_minmax_eps': 0.0051288771726799584}. Best is trial 8 with value: 0.16371437480017356.
[I 2026-04-21 18:40:35,540] Trial 21 finished with value: 0.25341631940882203 and parameters: {'hidden_dims': '[512, 64]', 'dropout': 0.4824870638641663, 'batch_norm': True, 'lr': 0.000662887276005284, 'weight_decay': 0.0001529451777457775, 'epochs': 269, 'loss': 'mae', 'optimizer': 'adam', 'use_snp_selection': False, 'weight_scheme': 'uniform', 'weight_clip_max': None}. Best is trial 21 with value: 0.25341631940882203.
[I 2026-04-21 18:41:03,078] Trial 9 finished with value: 0.14208508886485907 and parameters: {'hidden_dims': '[256, 128]', 'dropout': 0.5795930447285386, 'batch_norm': False, 'lr': 0.00011782025260263196, 'weight_decay': 0.0005562063174273634, 'epochs': 218, 'loss': 'mae', 'optimizer': 'adamw', 'use_snp_selection': True, 'num_snps': 32226, 'weight_scheme': 'minmax', 'weight_clip_max': 5.0, 'weight_minmax_eps': 0.09600289105543994}. Best is trial 8 with value: 0.16371437480017356.
[I 2026-04-21 18:41:15,623] Trial 22 finished with value: 0.23475526899757104 and parameters: {'hidden_dims': '[512, 64]', 'dropout': 0.4941615790668539, 'batch_norm': True, 'lr': 0.0005527274588767623, 'weight_decay': 0.00018843766614374846, 'epochs': 255, 'loss': 'mae', 'optimizer': 'adam', 'use_snp_selection': False, 'weight_scheme': 'uniform', 'weight_clip_max': None}. Best is trial 21 with value: 0.25341631940882203.
[I 2026-04-21 18:41:32,499] Trial 10 finished with value: 0.04377350689886501 and parameters: {'hidden_dims': '[256, 128]', 'dropout': 0.4338375928678635, 'batch_norm': False, 'lr': 1.459239318238064e-06, 'weight_decay': 3.891313547330106e-07, 'epochs': 68, 'loss': 'mae', 'optimizer': 'adam', 'use_snp_selection': True, 'num_snps': 53871, 'weight_scheme': 'uniform', 'weight_clip_max': 5.0}. Best is trial 8 with value: 0.16371437480017356.
[I 2026-04-21 18:41:52,553] Trial 11 finished with value: 0.1422456952187705 and parameters: {'hidden_dims': '[512, 128]', 'dropout': 0.3685125094728514, 'batch_norm': True, 'lr': 0.0007728340671580595, 'weight_decay': 1.803837951274707e-08, 'epochs': 190, 'loss': 'mae', 'optimizer': 'adam', 'use_snp_selection': True, 'num_snps': 6393, 'weight_scheme': 'minmax', 'weight_clip_max': 10.0, 'weight_minmax_eps': 0.006627383097415861}. Best is trial 8 with value: 0.16371437480017356.
[I 2026-04-21 18:41:57,979] Trial 23 finished with value: 0.23446154544113407 and parameters: {'hidden_dims': '[512, 64]', 'dropout': 0.3892122098389874, 'batch_norm': True, 'lr': 0.0001752792525685164, 'weight_decay': 0.0001827026178374167, 'epochs': 271, 'loss': 'mae', 'optimizer': 'adam', 'use_snp_selection': False, 'weight_scheme': 'uniform', 'weight_clip_max': None}. Best is trial 21 with value: 0.25341631940882203.
[I 2026-04-21 18:42:12,670] Trial 12 finished with value: 0.10899759061895238 and parameters: {'hidden_dims': '[512, 128]', 'dropout': 0.5130588659509716, 'batch_norm': True, 'lr': 2.44644422390969e-06, 'weight_decay': 7.313772140220299e-08, 'epochs': 61, 'loss': 'mae', 'optimizer': 'adamw', 'use_snp_selection': True, 'num_snps': 13520, 'weight_scheme': 'minmax', 'weight_clip_max': 10.0, 'weight_minmax_eps': 0.0047993575341047645}. Best is trial 8 with value: 0.16371437480017356.
[I 2026-04-21 18:42:35,036] Trial 24 finished with value: 0.23482933259356176 and parameters: {'hidden_dims': '[512, 64]', 'dropout': 0.48440175115492173, 'batch_norm': True, 'lr': 0.0005453401822989825, 'weight_decay': 2.2478566006625873e-05, 'epochs': 235, 'loss': 'mae', 'optimizer': 'adam', 'use_snp_selection': False, 'weight_scheme': 'uniform', 'weight_clip_max': None}. Best is trial 21 with value: 0.25341631940882203.
[I 2026-04-21 18:42:40,271] Trial 13 finished with value: 0.14430123516204543 and parameters: {'hidden_dims': '[512, 64]', 'dropout': 0.11814759607505772, 'batch_norm': False, 'lr': 4.04309888754607e-06, 'weight_decay': 1.0793146335670519e-07, 'epochs': 193, 'loss': 'mae', 'optimizer': 'adam', 'use_snp_selection': True, 'num_snps': 19713, 'weight_scheme': 'top-heavy', 'weight_clip_max': 10.0, 'weight_topheavy_top_frac': 0.4963949528875303, 'weight_topheavy_low': 0.550088064868268, 'weight_topheavy_high': 5.953811342115056}. Best is trial 8 with value: 0.16371437480017356.
[I 2026-04-21 18:43:06,160] Trial 25 finished with value: 0.23764997661225365 and parameters: {'hidden_dims': '[512, 64]', 'dropout': 0.3080452832735975, 'batch_norm': True, 'lr': 0.00024320443070550513, 'weight_decay': 0.0007919672713574703, 'epochs': 194, 'loss': 'mae', 'optimizer': 'adam', 'use_snp_selection': False, 'weight_scheme': 'top-heavy', 'weight_clip_max': None, 'weight_topheavy_top_frac': 0.08280251806204128, 'weight_topheavy_low': 0.8406671463838434, 'weight_topheavy_high': 1.2157447502335406}. Best is trial 21 with value: 0.25341631940882203.
[I 2026-04-21 18:43:11,697] Trial 14 finished with value: 0.14460449815803733 and parameters: {'hidden_dims': '[512, 128]', 'dropout': 0.00405729104619551, 'batch_norm': False, 'lr': 0.0004084446691088672, 'weight_decay': 9.011134688678686e-07, 'epochs': 110, 'loss': 'mae', 'optimizer': 'adam', 'use_snp_selection': True, 'num_snps': 36564, 'weight_scheme': 'exponential', 'weight_clip_max': 5.0, 'weight_exponential_beta': 7.792631903976359}. Best is trial 8 with value: 0.16371437480017356.
[I 2026-04-21 18:43:35,148] Trial 15 finished with value: 0.10671032120138944 and parameters: {'hidden_dims': '[256, 128]', 'dropout': 0.2801071888952091, 'batch_norm': True, 'lr': 6.3482389119633635e-06, 'weight_decay': 3.504132313163254e-08, 'epochs': 154, 'loss': 'mae', 'optimizer': 'adamw', 'use_snp_selection': True, 'num_snps': 21024, 'weight_scheme': 'uniform', 'weight_clip_max': 5.0}. Best is trial 8 with value: 0.16371437480017356.
[I 2026-04-21 18:43:46,480] Trial 26 finished with value: 0.2656646039080835 and parameters: {'hidden_dims': '[512, 64]', 'dropout': 0.582354706143896, 'batch_norm': False, 'lr': 5.9213655812922363e-05, 'weight_decay': 0.00012281283096719854, 'epochs': 268, 'loss': 'mae', 'optimizer': 'adamw', 'use_snp_selection': False, 'weight_scheme': 'uniform', 'weight_clip_max': None}. Best is trial 26 with value: 0.2656646039080835.
[I 2026-04-21 18:43:55,111] Trial 16 finished with value: 0.07785202617412262 and parameters: {'hidden_dims': '[512, 128]', 'dropout': 0.38720429181815186, 'batch_norm': True, 'lr': 1.0861353644599177e-06, 'weight_decay': 6.57289132935677e-07, 'epochs': 91, 'loss': 'mae', 'optimizer': 'adam', 'use_snp_selection': True, 'num_snps': 8648, 'weight_scheme': 'minmax', 'weight_clip_max': 10.0, 'weight_minmax_eps': 0.04704205361910894}. Best is trial 8 with value: 0.16371437480017356.
[I 2026-04-21 18:44:32,705] Trial 17 finished with value: 0.09531122158690776 and parameters: {'hidden_dims': '[256, 128]', 'dropout': 0.21499546074125545, 'batch_norm': False, 'lr': 7.302631233306561e-05, 'weight_decay': 1.186328535983127e-08, 'epochs': 219, 'loss': 'mae', 'optimizer': 'sgd', 'use_snp_selection': True, 'num_snps': 49426, 'weight_scheme': 'minmax', 'weight_clip_max': 5.0, 'weight_minmax_eps': 0.043795555850857426}. Best is trial 8 with value: 0.16371437480017356.
[I 2026-04-21 18:44:44,237] Trial 27 finished with value: 0.26253868935875807 and parameters: {'hidden_dims': '[512, 128]', 'dropout': 0.5984302506970917, 'batch_norm': False, 'lr': 5.305637088491361e-05, 'weight_decay': 0.0002461345551333703, 'epochs': 268, 'loss': 'mae', 'optimizer': 'adamw', 'use_snp_selection': True, 'num_snps': 56030, 'weight_scheme': 'exponential', 'weight_clip_max': None, 'weight_exponential_beta': 0.9111379493227183}. Best is trial 26 with value: 0.2656646039080835.
[I 2026-04-21 18:45:05,484] Trial 18 finished with value: 0.12795753058988382 and parameters: {'hidden_dims': '[512, 64]', 'dropout': 0.13490520080920834, 'batch_norm': False, 'lr': 0.0003180937650649426, 'weight_decay': 2.459796584967784e-05, 'epochs': 172, 'loss': 'mae', 'optimizer': 'adam', 'use_snp_selection': True, 'num_snps': 29483, 'weight_scheme': 'minmax', 'weight_clip_max': 10.0, 'weight_minmax_eps': 0.048706468073068616}. Best is trial 8 with value: 0.16371437480017356.
[I 2026-04-21 18:45:29,350] Trial 19 finished with value: 0.15992850084576943 and parameters: {'hidden_dims': '[512, 128]', 'dropout': 0.4654350568766814, 'batch_norm': True, 'lr': 1.7111770960239672e-05, 'weight_decay': 1.0019418613245756e-07, 'epochs': 129, 'loss': 'mae', 'optimizer': 'adamw', 'use_snp_selection': True, 'num_snps': 16044, 'weight_scheme': 'uniform', 'weight_clip_max': None}. Best is trial 8 with value: 0.16371437480017356.
[I 2026-04-21 18:45:44,375] Trial 28 finished with value: 0.2844231492572949 and parameters: {'hidden_dims': '[512, 128]', 'dropout': 0.5864028712569803, 'batch_norm': False, 'lr': 5.185765581615032e-06, 'weight_decay': 0.00028662204495049975, 'epochs': 271, 'loss': 'mae', 'optimizer': 'adamw', 'use_snp_selection': True, 'num_snps': 58465, 'weight_scheme': 'exponential', 'weight_clip_max': 10.0, 'weight_exponential_beta': 0.1280549078338611}. Best is trial 28 with value: 0.2844231492572949.
[I 2026-04-21 18:45:56,307] Trial 20 finished with value: 0.18670887737261158 and parameters: {'hidden_dims': '[256, 128]', 'dropout': 0.47081425493935214, 'batch_norm': False, 'lr': 3.3693056661812253e-06, 'weight_decay': 1.62487314753422e-07, 'epochs': 87, 'loss': 'mae', 'optimizer': 'adamw', 'use_snp_selection': True, 'num_snps': 39693, 'weight_scheme': 'uniform', 'weight_clip_max': None}. Best is trial 20 with value: 0.18670887737261158.
[I 2026-04-21 18:46:23,041] Trial 21 finished with value: 0.11349609141720506 and parameters: {'hidden_dims': '[256, 128]', 'dropout': 0.49988367412341644, 'batch_norm': False, 'lr': 3.170485184102793e-06, 'weight_decay': 1.7946701217051545e-07, 'epochs': 84, 'loss': 'mae', 'optimizer': 'adamw', 'use_snp_selection': True, 'num_snps': 39962, 'weight_scheme': 'uniform', 'weight_clip_max': None}. Best is trial 20 with value: 0.18670887737261158.
[I 2026-04-21 18:46:43,023] Trial 29 finished with value: 0.26685132510563775 and parameters: {'hidden_dims': '[512, 128]', 'dropout': 0.5987868474741638, 'batch_norm': False, 'lr': 9.804170764906364e-06, 'weight_decay': 0.0005139161403820408, 'epochs': 266, 'loss': 'mse', 'optimizer': 'adamw', 'use_snp_selection': True, 'num_snps': 57132, 'weight_scheme': 'exponential', 'weight_clip_max': 10.0, 'weight_exponential_beta': 0.1896212183708651}. Best is trial 28 with value: 0.2844231492572949.
[I 2026-04-21 18:46:49,694] Trial 22 finished with value: 0.11262383748922933 and parameters: {'hidden_dims': '[256, 128]', 'dropout': 0.47076016251085345, 'batch_norm': False, 'lr': 7.368628597242139e-06, 'weight_decay': 1.744649980436953e-06, 'epochs': 51, 'loss': 'mae', 'optimizer': 'adamw', 'use_snp_selection': True, 'num_snps': 46287, 'weight_scheme': 'uniform', 'weight_clip_max': None}. Best is trial 20 with value: 0.18670887737261158.
[I 2026-04-21 18:47:17,096] Trial 23 finished with value: 0.10962967800089425 and parameters: {'hidden_dims': '[256, 128]', 'dropout': 0.568612100829423, 'batch_norm': False, 'lr': 2.14763252491612e-06, 'weight_decay': 2.684940454765368e-07, 'epochs': 130, 'loss': 'mae', 'optimizer': 'adamw', 'use_snp_selection': True, 'num_snps': 35978, 'weight_scheme': 'uniform', 'weight_clip_max': None}. Best is trial 20 with value: 0.18670887737261158.
[I 2026-04-21 18:47:37,223] Trial 30 finished with value: 0.28915543064622323 and parameters: {'hidden_dims': '[512, 128]', 'dropout': 0.5588661095580056, 'batch_norm': False, 'lr': 4.288733173047889e-06, 'weight_decay': 0.0004192936230691701, 'epochs': 230, 'loss': 'mse', 'optimizer': 'adamw', 'use_snp_selection': True, 'num_snps': 56786, 'weight_scheme': 'exponential', 'weight_clip_max': 10.0, 'weight_exponential_beta': 0.14464829441407082}. Best is trial 30 with value: 0.28915543064622323.
[I 2026-04-21 18:47:39,958] Trial 24 finished with value: 0.16321745257350734 and parameters: {'hidden_dims': '[256, 128]', 'dropout': 0.344110750890377, 'batch_norm': False, 'lr': 4.9103361207724025e-06, 'weight_decay': 7.692561778049853e-08, 'epochs': 87, 'loss': 'mae', 'optimizer': 'adamw', 'use_snp_selection': True, 'num_snps': 26290, 'weight_scheme': 'uniform', 'weight_clip_max': None}. Best is trial 20 with value: 0.18670887737261158.
[I 2026-04-21 18:48:03,190] Trial 25 finished with value: 0.07551679307044434 and parameters: {'hidden_dims': '[256, 128]', 'dropout': 0.34739852779372116, 'batch_norm': False, 'lr': 1.6264866780426195e-06, 'weight_decay': 2.008368721275454e-06, 'epochs': 82, 'loss': 'mae', 'optimizer': 'adamw', 'use_snp_selection': True, 'num_snps': 27788, 'weight_scheme': 'uniform', 'weight_clip_max': None}. Best is trial 20 with value: 0.18670887737261158.
[I 2026-04-21 18:48:12,935] Trial 26 finished with value: 0.17319908499325176 and parameters: {'hidden_dims': '[256, 128]', 'dropout': 0.40913761821938593, 'batch_norm': False, 'lr': 4.5935176124171545e-06, 'weight_decay': 5.073819869141047e-07, 'epochs': 93, 'loss': 'mae', 'optimizer': 'adamw', 'use_snp_selection': False, 'weight_scheme': 'uniform', 'weight_clip_max': None}. Best is trial 20 with value: 0.18670887737261158.
[I 2026-04-21 18:48:21,046] Trial 27 finished with value: 0.08911566482699486 and parameters: {'hidden_dims': '[256, 128]', 'dropout': 0.41466946762237655, 'batch_norm': False, 'lr': 1.0402940034968106e-06, 'weight_decay': 7.227893013816922e-07, 'epochs': 70, 'loss': 'mae', 'optimizer': 'adamw', 'use_snp_selection': False, 'weight_scheme': 'top-heavy', 'weight_clip_max': None, 'weight_topheavy_top_frac': 0.0720028071924142, 'weight_topheavy_low': 0.8830221057836086, 'weight_topheavy_high': 1.667609236517643}. Best is trial 20 with value: 0.18670887737261158.
[I 2026-04-21 18:48:31,533] Trial 28 finished with value: 0.15232861149217095 and parameters: {'hidden_dims': '[256, 128]', 'dropout': 0.5246201824030308, 'batch_norm': False, 'lr': 1.0759679648483954e-05, 'weight_decay': 3.7942875667698154e-07, 'epochs': 102, 'loss': 'mae', 'optimizer': 'adamw', 'use_snp_selection': False, 'weight_scheme': 'exponential', 'weight_clip_max': None, 'weight_exponential_beta': 0.6197700611680284}. Best is trial 20 with value: 0.18670887737261158.
[I 2026-04-21 18:48:33,269] Trial 31 finished with value: 0.2875839854437014 and parameters: {'hidden_dims': '[512, 128]', 'dropout': 0.5491042725578338, 'batch_norm': False, 'lr': 4.570572628743229e-06, 'weight_decay': 0.0004217102659263887, 'epochs': 230, 'loss': 'mse', 'optimizer': 'adamw', 'use_snp_selection': True, 'num_snps': 58853, 'weight_scheme': 'exponential', 'weight_clip_max': 10.0, 'weight_exponential_beta': 0.14349454501214134}. Best is trial 30 with value: 0.28915543064622323.
[I 2026-04-21 18:48:38,150] Trial 29 finished with value: 0.06534533304956792 and parameters: {'hidden_dims': '[256, 128]', 'dropout': 0.4341628046118113, 'batch_norm': False, 'lr': 2.8492601235879292e-06, 'weight_decay': 3.170357598239063e-06, 'epochs': 50, 'loss': 'mse', 'optimizer': 'adam', 'use_snp_selection': False, 'weight_scheme': 'uniform', 'weight_clip_max': 5.0}. Best is trial 20 with value: 0.18670887737261158.
[I 2026-04-21 18:48:48,923] Trial 30 finished with value: 0.12733420639005452 and parameters: {'hidden_dims': '[256, 128]', 'dropout': 0.32435652575783736, 'batch_norm': False, 'lr': 9.488914459748506e-06, 'weight_decay': 0.0004277147205235671, 'epochs': 105, 'loss': 'mae', 'optimizer': 'adamw', 'use_snp_selection': False, 'weight_scheme': 'uniform', 'weight_clip_max': 5.0}. Best is trial 20 with value: 0.18670887737261158.
[I 2026-04-21 18:49:11,088] Trial 31 finished with value: 0.14773850145586453 and parameters: {'hidden_dims': '[256, 128]', 'dropout': 0.3967562231340346, 'batch_norm': False, 'lr': 4.76929197283634e-06, 'weight_decay': 3.790673345729691e-08, 'epochs': 89, 'loss': 'mae', 'optimizer': 'adamw', 'use_snp_selection': True, 'num_snps': 24192, 'weight_scheme': 'uniform', 'weight_clip_max': None}. Best is trial 20 with value: 0.18670887737261158.
[I 2026-04-21 18:49:19,490] Trial 32 finished with value: 0.13835583974329493 and parameters: {'hidden_dims': '[256, 128]', 'dropout': 0.3453172396817785, 'batch_norm': False, 'lr': 4.3474664976930985e-06, 'weight_decay': 1.3772435407321484e-07, 'epochs': 74, 'loss': 'mae', 'optimizer': 'adamw', 'use_snp_selection': False, 'weight_scheme': 'uniform', 'weight_clip_max': None}. Best is trial 20 with value: 0.18670887737261158.
[I 2026-04-21 18:49:29,758] Trial 32 finished with value: 0.2816068905491332 and parameters: {'hidden_dims': '[512, 128]', 'dropout': 0.5435301677613102, 'batch_norm': False, 'lr': 4.6107585777708025e-06, 'weight_decay': 0.0009881595267744972, 'epochs': 231, 'loss': 'mse', 'optimizer': 'adamw', 'use_snp_selection': True, 'num_snps': 59224, 'weight_scheme': 'exponential', 'weight_clip_max': 10.0, 'weight_exponential_beta': 0.11281268509054551}. Best is trial 30 with value: 0.28915543064622323.
[I 2026-04-21 18:49:45,212] Trial 33 finished with value: 0.14792500018221125 and parameters: {'hidden_dims': '[256, 128]', 'dropout': 0.24200752184201116, 'batch_norm': False, 'lr': 5.749096280894427e-06, 'weight_decay': 4.273221297971198e-07, 'epochs': 98, 'loss': 'mae', 'optimizer': 'adamw', 'use_snp_selection': True, 'num_snps': 34629, 'weight_scheme': 'uniform', 'weight_clip_max': None}. Best is trial 20 with value: 0.18670887737261158.
[I 2026-04-21 18:49:57,428] Trial 34 finished with value: 0.1466865074665286 and parameters: {'hidden_dims': '[256, 128]', 'dropout': 0.30994780883813466, 'batch_norm': False, 'lr': 1.8041989809216508e-06, 'weight_decay': 5.688369399569989e-08, 'epochs': 124, 'loss': 'mse', 'optimizer': 'adamw', 'use_snp_selection': False, 'weight_scheme': 'linear', 'weight_clip_max': None, 'weight_linear_min_weight': 0.9808780614981059, 'weight_linear_max_weight': 3.7078534622735164}. Best is trial 20 with value: 0.18670887737261158.
