Running from this directory: /cluster/work/simennes/Master_thesis
Name of job: ncv_avggrm
ID of job: 24330219
The job was run on these nodes: idun-07-07
[I 2026-04-21 17:20:27,745] Trial 0 finished with value: 0.011392359726227012 and parameters: {'hidden_dims': '[256, 128]', 'dropout': 0.18584155530312246, 'batch_norm': True, 'lr': 9.012665953349533e-06, 'weight_decay': 4.96591963698479e-06, 'epochs': 105, 'loss': 'mse', 'optimizer': 'sgd', 'use_snp_selection': True, 'num_snps': 25583, 'weight_scheme': 'minmax', 'weight_clip_max': 5.0, 'weight_minmax_eps': 0.14026014881292506}. Best is trial 0 with value: 0.011392359726227012.
[I 2026-04-21 17:20:28,776] Trial 0 finished with value: 0.09680347716476818 and parameters: {'hidden_dims': '[256, 128]', 'dropout': 0.18584155530312246, 'batch_norm': True, 'lr': 9.012665953349533e-06, 'weight_decay': 4.96591963698479e-06, 'epochs': 105, 'loss': 'mse', 'optimizer': 'sgd', 'use_snp_selection': True, 'num_snps': 25583, 'weight_scheme': 'minmax', 'weight_clip_max': 5.0, 'weight_minmax_eps': 0.14026014881292506}. Best is trial 0 with value: 0.09680347716476818.
[I 2026-04-21 17:20:40,554] Trial 1 finished with value: 0.16166506032994638 and parameters: {'hidden_dims': '[256, 64]', 'dropout': 0.05000949662985405, 'batch_norm': True, 'lr': 0.00015647443054904835, 'weight_decay': 5.158896024962846e-05, 'epochs': 152, 'loss': 'mse', 'optimizer': 'sgd', 'use_snp_selection': False, 'weight_scheme': 'linear', 'weight_clip_max': None, 'weight_linear_min_weight': 0.21922985165550554, 'weight_linear_max_weight': 1.6260435767424388}. Best is trial 1 with value: 0.16166506032994638.
[I 2026-04-21 17:20:43,298] Trial 1 finished with value: 0.13073748187919224 and parameters: {'hidden_dims': '[256, 64]', 'dropout': 0.05000949662985405, 'batch_norm': True, 'lr': 0.00015647443054904835, 'weight_decay': 5.158896024962846e-05, 'epochs': 152, 'loss': 'mse', 'optimizer': 'sgd', 'use_snp_selection': False, 'weight_scheme': 'linear', 'weight_clip_max': None, 'weight_linear_min_weight': 0.21922985165550554, 'weight_linear_max_weight': 1.6260435767424388}. Best is trial 1 with value: 0.13073748187919224.
[I 2026-04-21 17:21:04,151] Trial 2 finished with value: 0.044561931044891374 and parameters: {'hidden_dims': '[512, 128]', 'dropout': 0.2736730891340176, 'batch_norm': True, 'lr': 7.298114623433994e-05, 'weight_decay': 5.6346010385734023e-08, 'epochs': 185, 'loss': 'mae', 'optimizer': 'sgd', 'use_snp_selection': True, 'num_snps': 14091, 'weight_scheme': 'minmax', 'weight_clip_max': 10.0, 'weight_minmax_eps': 0.045780660776687306}. Best is trial 1 with value: 0.16166506032994638.
[I 2026-04-21 17:21:08,396] Trial 2 finished with value: 0.2171525791920154 and parameters: {'hidden_dims': '[512, 128]', 'dropout': 0.2736730891340176, 'batch_norm': True, 'lr': 7.298114623433994e-05, 'weight_decay': 5.6346010385734023e-08, 'epochs': 185, 'loss': 'mae', 'optimizer': 'sgd', 'use_snp_selection': True, 'num_snps': 14091, 'weight_scheme': 'minmax', 'weight_clip_max': 10.0, 'weight_minmax_eps': 0.045780660776687306}. Best is trial 2 with value: 0.2171525791920154.
[I 2026-04-21 17:21:44,208] Trial 3 finished with value: 0.0015849776947461647 and parameters: {'hidden_dims': '[512, 64]', 'dropout': 0.30157795416637295, 'batch_norm': False, 'lr': 2.007492282795256e-05, 'weight_decay': 5.496446859789657e-06, 'epochs': 284, 'loss': 'mse', 'optimizer': 'sgd', 'use_snp_selection': False, 'weight_scheme': 'linear', 'weight_clip_max': None, 'weight_linear_min_weight': 0.24682154527102826, 'weight_linear_max_weight': 1.8338910783134623}. Best is trial 1 with value: 0.16166506032994638.
[I 2026-04-21 17:21:53,150] Trial 3 finished with value: 0.1360773046527992 and parameters: {'hidden_dims': '[512, 64]', 'dropout': 0.30157795416637295, 'batch_norm': False, 'lr': 2.007492282795256e-05, 'weight_decay': 5.496446859789657e-06, 'epochs': 284, 'loss': 'mse', 'optimizer': 'sgd', 'use_snp_selection': False, 'weight_scheme': 'linear', 'weight_clip_max': None, 'weight_linear_min_weight': 0.24682154527102826, 'weight_linear_max_weight': 1.8338910783134623}. Best is trial 2 with value: 0.2171525791920154.
[I 2026-04-21 17:21:56,715] Trial 4 finished with value: 0.10423302525070625 and parameters: {'hidden_dims': '[256, 64]', 'dropout': 0.18128694708490736, 'batch_norm': False, 'lr': 8.951826748007403e-05, 'weight_decay': 2.1781541495465197e-07, 'epochs': 147, 'loss': 'mse', 'optimizer': 'sgd', 'use_snp_selection': False, 'weight_scheme': 'top-heavy', 'weight_clip_max': 5.0, 'weight_topheavy_top_frac': 0.1724888194073277, 'weight_topheavy_low': 1.1620865802171172, 'weight_topheavy_high': 3.476906528073177}. Best is trial 1 with value: 0.16166506032994638.
[I 2026-04-21 17:22:07,409] Trial 5 finished with value: 0.06514637297459412 and parameters: {'hidden_dims': '[256, 64]', 'dropout': 0.2571412946970998, 'batch_norm': True, 'lr': 3.546238022482882e-05, 'weight_decay': 1.0185234767613396e-06, 'epochs': 119, 'loss': 'mse', 'optimizer': 'sgd', 'use_snp_selection': False, 'weight_scheme': 'linear', 'weight_clip_max': 10.0, 'weight_linear_min_weight': 0.9405832045183805, 'weight_linear_max_weight': 3.413610925325811}. Best is trial 1 with value: 0.16166506032994638.
[I 2026-04-21 17:22:07,420] Trial 4 finished with value: 0.2091894115262296 and parameters: {'hidden_dims': '[256, 64]', 'dropout': 0.18128694708490736, 'batch_norm': False, 'lr': 8.951826748007403e-05, 'weight_decay': 2.1781541495465197e-07, 'epochs': 147, 'loss': 'mse', 'optimizer': 'sgd', 'use_snp_selection': False, 'weight_scheme': 'top-heavy', 'weight_clip_max': 5.0, 'weight_topheavy_top_frac': 0.1724888194073277, 'weight_topheavy_low': 1.1620865802171172, 'weight_topheavy_high': 3.476906528073177}. Best is trial 2 with value: 0.2171525791920154.
[I 2026-04-21 17:22:19,628] Trial 5 finished with value: 0.09929075358566854 and parameters: {'hidden_dims': '[256, 64]', 'dropout': 0.2571412946970998, 'batch_norm': True, 'lr': 3.546238022482882e-05, 'weight_decay': 1.0185234767613396e-06, 'epochs': 119, 'loss': 'mse', 'optimizer': 'sgd', 'use_snp_selection': False, 'weight_scheme': 'linear', 'weight_clip_max': 10.0, 'weight_linear_min_weight': 0.9405832045183805, 'weight_linear_max_weight': 3.413610925325811}. Best is trial 2 with value: 0.2171525791920154.
[I 2026-04-21 17:22:27,726] Trial 6 finished with value: 0.19226294945566239 and parameters: {'hidden_dims': '[256, 64]', 'dropout': 0.037961443806696214, 'batch_norm': True, 'lr': 3.644202049829694e-05, 'weight_decay': 9.73334309820277e-06, 'epochs': 243, 'loss': 'mae', 'optimizer': 'adam', 'use_snp_selection': False, 'weight_scheme': 'minmax', 'weight_clip_max': None, 'weight_minmax_eps': 0.08689611239934374}. Best is trial 6 with value: 0.19226294945566239.
[I 2026-04-21 17:22:41,874] Trial 6 finished with value: 0.24120900364870135 and parameters: {'hidden_dims': '[256, 64]', 'dropout': 0.037961443806696214, 'batch_norm': True, 'lr': 3.644202049829694e-05, 'weight_decay': 9.73334309820277e-06, 'epochs': 243, 'loss': 'mae', 'optimizer': 'adam', 'use_snp_selection': False, 'weight_scheme': 'minmax', 'weight_clip_max': None, 'weight_minmax_eps': 0.08689611239934374}. Best is trial 6 with value: 0.24120900364870135.
[I 2026-04-21 17:23:11,920] Trial 7 finished with value: -0.00829859602239152 and parameters: {'hidden_dims': '[512, 128]', 'dropout': 0.1304538168539244, 'batch_norm': False, 'lr': 1.5408060926311233e-05, 'weight_decay': 2.1989735568314356e-08, 'epochs': 250, 'loss': 'mse', 'optimizer': 'sgd', 'use_snp_selection': True, 'num_snps': 42550, 'weight_scheme': 'exponential', 'weight_clip_max': 10.0, 'weight_exponential_beta': 2.758850226029358}. Best is trial 6 with value: 0.19226294945566239.
[I 2026-04-21 17:23:30,451] Trial 7 finished with value: 0.12730319204796922 and parameters: {'hidden_dims': '[512, 128]', 'dropout': 0.1304538168539244, 'batch_norm': False, 'lr': 1.5408060926311233e-05, 'weight_decay': 2.1989735568314356e-08, 'epochs': 250, 'loss': 'mse', 'optimizer': 'sgd', 'use_snp_selection': True, 'num_snps': 42550, 'weight_scheme': 'exponential', 'weight_clip_max': 10.0, 'weight_exponential_beta': 2.758850226029358}. Best is trial 6 with value: 0.24120900364870135.
[I 2026-04-21 17:23:34,889] Trial 8 finished with value: 0.16232549923661532 and parameters: {'hidden_dims': '[256, 128]', 'dropout': 0.05742396906738376, 'batch_norm': False, 'lr': 1.9761509510575143e-06, 'weight_decay': 2.933492239224291e-07, 'epochs': 82, 'loss': 'mae', 'optimizer': 'adam', 'use_snp_selection': True, 'num_snps': 29883, 'weight_scheme': 'minmax', 'weight_clip_max': 5.0, 'weight_minmax_eps': 0.0051288771726799584}. Best is trial 6 with value: 0.19226294945566239.
[I 2026-04-21 17:23:54,615] Trial 8 finished with value: 0.23326694945211215 and parameters: {'hidden_dims': '[256, 128]', 'dropout': 0.05742396906738376, 'batch_norm': False, 'lr': 1.9761509510575143e-06, 'weight_decay': 2.933492239224291e-07, 'epochs': 82, 'loss': 'mae', 'optimizer': 'adam', 'use_snp_selection': True, 'num_snps': 29883, 'weight_scheme': 'minmax', 'weight_clip_max': 5.0, 'weight_minmax_eps': 0.0051288771726799584}. Best is trial 6 with value: 0.24120900364870135.
[I 2026-04-21 17:24:03,037] Trial 9 finished with value: 0.22725254793461855 and parameters: {'hidden_dims': '[256, 128]', 'dropout': 0.5795930447285386, 'batch_norm': False, 'lr': 0.00011782025260263196, 'weight_decay': 0.0005562063174273634, 'epochs': 218, 'loss': 'mae', 'optimizer': 'adamw', 'use_snp_selection': True, 'num_snps': 32226, 'weight_scheme': 'minmax', 'weight_clip_max': 5.0, 'weight_minmax_eps': 0.09600289105543994}. Best is trial 9 with value: 0.22725254793461855.
[I 2026-04-21 17:24:24,303] Trial 9 finished with value: 0.2347949752987348 and parameters: {'hidden_dims': '[256, 128]', 'dropout': 0.5795930447285386, 'batch_norm': False, 'lr': 0.00011782025260263196, 'weight_decay': 0.0005562063174273634, 'epochs': 218, 'loss': 'mae', 'optimizer': 'adamw', 'use_snp_selection': True, 'num_snps': 32226, 'weight_scheme': 'minmax', 'weight_clip_max': 5.0, 'weight_minmax_eps': 0.09600289105543994}. Best is trial 6 with value: 0.24120900364870135.
[I 2026-04-21 17:24:38,988] Trial 10 finished with value: 0.0 and parameters: {'hidden_dims': '[256, 128]', 'dropout': 0.5982265091674299, 'batch_norm': False, 'lr': 0.0009667920285641304, 'weight_decay': 0.0007065067205778983, 'epochs': 203, 'loss': 'mae', 'optimizer': 'adamw', 'use_snp_selection': True, 'num_snps': 54689, 'weight_scheme': 'uniform', 'weight_clip_max': 5.0}. Best is trial 9 with value: 0.22725254793461855.
[I 2026-04-21 17:25:12,217] Trial 10 finished with value: 0.2360873097687053 and parameters: {'hidden_dims': '[512, 64]', 'dropout': 0.4338375928678635, 'batch_norm': True, 'lr': 0.0009667920285641304, 'weight_decay': 6.976468597792388e-05, 'epochs': 294, 'loss': 'mae', 'optimizer': 'adam', 'use_snp_selection': False, 'weight_scheme': 'uniform', 'weight_clip_max': None}. Best is trial 6 with value: 0.24120900364870135.
[I 2026-04-21 17:25:13,121] Trial 11 finished with value: 0.21218584224038609 and parameters: {'hidden_dims': '[512, 64]', 'dropout': 0.48179236930737634, 'batch_norm': True, 'lr': 0.0003590005130816133, 'weight_decay': 0.0004864760243946446, 'epochs': 231, 'loss': 'mae', 'optimizer': 'adam', 'use_snp_selection': False, 'weight_scheme': 'minmax', 'weight_clip_max': None, 'weight_minmax_eps': 0.09687781180927992}. Best is trial 9 with value: 0.22725254793461855.
[I 2026-04-21 17:25:46,242] Trial 12 finished with value: 0.21463348025739437 and parameters: {'hidden_dims': '[512, 64]', 'dropout': 0.5756846183148884, 'batch_norm': True, 'lr': 0.0004604776265397854, 'weight_decay': 0.0009430578454129051, 'epochs': 222, 'loss': 'mae', 'optimizer': 'adamw', 'use_snp_selection': False, 'weight_scheme': 'minmax', 'weight_clip_max': None, 'weight_minmax_eps': 0.11646824613661988}. Best is trial 9 with value: 0.22725254793461855.
[I 2026-04-21 17:25:59,741] Trial 11 finished with value: 0.2253057956680072 and parameters: {'hidden_dims': '[512, 64]', 'dropout': 0.4516805843717058, 'batch_norm': True, 'lr': 0.0009928478748470076, 'weight_decay': 5.547084226283487e-05, 'epochs': 290, 'loss': 'mae', 'optimizer': 'adam', 'use_snp_selection': False, 'weight_scheme': 'uniform', 'weight_clip_max': None}. Best is trial 6 with value: 0.24120900364870135.
[I 2026-04-21 17:26:05,925] Trial 13 finished with value: 0.24190516444657253 and parameters: {'hidden_dims': '[512, 64]', 'dropout': 0.4734218573103429, 'batch_norm': False, 'lr': 0.00040255722523826283, 'weight_decay': 9.409850265366299e-05, 'epochs': 210, 'loss': 'mae', 'optimizer': 'adamw', 'use_snp_selection': True, 'num_snps': 7358, 'weight_scheme': 'top-heavy', 'weight_clip_max': None, 'weight_topheavy_top_frac': 0.48398486394237283, 'weight_topheavy_low': 0.5666436580870186, 'weight_topheavy_high': 5.961546164133656}. Best is trial 13 with value: 0.24190516444657253.
[I 2026-04-21 17:26:25,441] Trial 14 finished with value: 0.21638531294448837 and parameters: {'hidden_dims': '[512, 64]', 'dropout': 0.4441442022665172, 'batch_norm': False, 'lr': 0.0002146626619784876, 'weight_decay': 0.00010625064958282123, 'epochs': 297, 'loss': 'mae', 'optimizer': 'adamw', 'use_snp_selection': True, 'num_snps': 5396, 'weight_scheme': 'top-heavy', 'weight_clip_max': 5.0, 'weight_topheavy_top_frac': 0.488519822323704, 'weight_topheavy_low': 0.5559387356295834, 'weight_topheavy_high': 5.874004194821078}. Best is trial 13 with value: 0.24190516444657253.
[I 2026-04-21 17:26:39,856] Trial 12 finished with value: 0.24153346255848498 and parameters: {'hidden_dims': '[512, 64]', 'dropout': 0.4134640118922238, 'batch_norm': True, 'lr': 0.0008477822420198197, 'weight_decay': 5.229627468514555e-05, 'epochs': 241, 'loss': 'mae', 'optimizer': 'adam', 'use_snp_selection': False, 'weight_scheme': 'uniform', 'weight_clip_max': None}. Best is trial 12 with value: 0.24153346255848498.
[I 2026-04-21 17:26:47,489] Trial 15 finished with value: 0.2056037310764854 and parameters: {'hidden_dims': '[256, 128]', 'dropout': 0.4433188919670272, 'batch_norm': False, 'lr': 0.0006021514207947097, 'weight_decay': 7.231309922642261e-05, 'epochs': 173, 'loss': 'mae', 'optimizer': 'adamw', 'use_snp_selection': True, 'num_snps': 19738, 'weight_scheme': 'top-heavy', 'weight_clip_max': None, 'weight_topheavy_top_frac': 0.4875965714561166, 'weight_topheavy_low': 0.5215303150024653, 'weight_topheavy_high': 5.930273117198321}. Best is trial 13 with value: 0.24190516444657253.
[I 2026-04-21 17:27:17,587] Trial 13 finished with value: 0.23857116620461286 and parameters: {'hidden_dims': '[512, 64]', 'dropout': 0.373346775713204, 'batch_norm': True, 'lr': 0.00032136660566298907, 'weight_decay': 0.0005469422623397416, 'epochs': 226, 'loss': 'mae', 'optimizer': 'adam', 'use_snp_selection': False, 'weight_scheme': 'uniform', 'weight_clip_max': None}. Best is trial 12 with value: 0.24153346255848498.
[I 2026-04-21 17:27:33,471] Trial 16 finished with value: 0.22342348814123306 and parameters: {'hidden_dims': '[512, 64]', 'dropout': 0.5043726058302346, 'batch_norm': False, 'lr': 0.00017983793180791378, 'weight_decay': 0.00015251366376037946, 'epochs': 266, 'loss': 'mae', 'optimizer': 'adamw', 'use_snp_selection': True, 'num_snps': 43772, 'weight_scheme': 'exponential', 'weight_clip_max': 5.0, 'weight_exponential_beta': 7.967940813562971}. Best is trial 13 with value: 0.24190516444657253.
[I 2026-04-21 17:27:39,606] Trial 14 finished with value: 0.19876377138719792 and parameters: {'hidden_dims': '[256, 64]', 'dropout': 0.4928337936061808, 'batch_norm': True, 'lr': 3.4099043105337243e-06, 'weight_decay': 1.4779383150687764e-05, 'epochs': 242, 'loss': 'mae', 'optimizer': 'adam', 'use_snp_selection': False, 'weight_scheme': 'exponential', 'weight_clip_max': None, 'weight_exponential_beta': 7.948849485427058}. Best is trial 12 with value: 0.24153346255848498.
[I 2026-04-21 17:27:59,041] Trial 17 finished with value: 0.11978728583469912 and parameters: {'hidden_dims': '[256, 128]', 'dropout': 0.3710544793137437, 'batch_norm': False, 'lr': 4.574956780383876e-06, 'weight_decay': 1.8301614194948813e-05, 'epochs': 53, 'loss': 'mae', 'optimizer': 'adamw', 'use_snp_selection': True, 'num_snps': 39816, 'weight_scheme': 'uniform', 'weight_clip_max': None}. Best is trial 13 with value: 0.24190516444657253.
[I 2026-04-21 17:28:12,681] Trial 15 finished with value: 0.2386856935579245 and parameters: {'hidden_dims': '[512, 64]', 'dropout': 0.3604537737625728, 'batch_norm': True, 'lr': 0.0003333652749373343, 'weight_decay': 0.00016274713702826268, 'epochs': 196, 'loss': 'mae', 'optimizer': 'adamw', 'use_snp_selection': False, 'weight_scheme': 'top-heavy', 'weight_clip_max': None, 'weight_topheavy_top_frac': 0.48091952196914134, 'weight_topheavy_low': 0.5054522954723732, 'weight_topheavy_high': 5.647529144674392}. Best is trial 12 with value: 0.24153346255848498.
[I 2026-04-21 17:28:18,558] Trial 18 finished with value: 0.21173837294508124 and parameters: {'hidden_dims': '[512, 128]', 'dropout': 0.5338329042278919, 'batch_norm': False, 'lr': 6.968130318654499e-05, 'weight_decay': 0.0002567689371055279, 'epochs': 209, 'loss': 'mae', 'optimizer': 'adamw', 'use_snp_selection': True, 'num_snps': 5886, 'weight_scheme': 'top-heavy', 'weight_clip_max': 5.0, 'weight_topheavy_top_frac': 0.318798315065247, 'weight_topheavy_low': 0.8337920942373751, 'weight_topheavy_high': 1.3992050465680768}. Best is trial 13 with value: 0.24190516444657253.
[I 2026-04-21 17:28:35,612] Trial 16 finished with value: 0.1507058274809003 and parameters: {'hidden_dims': '[256, 64]', 'dropout': 0.598700750155559, 'batch_norm': True, 'lr': 1.0495662000758798e-06, 'weight_decay': 1.4697686387872783e-05, 'epochs': 254, 'loss': 'mae', 'optimizer': 'adam', 'use_snp_selection': False, 'weight_scheme': 'uniform', 'weight_clip_max': None}. Best is trial 12 with value: 0.24153346255848498.
[I 2026-04-21 17:29:08,003] Trial 19 finished with value: 0.20221246827694714 and parameters: {'hidden_dims': '[512, 64]', 'dropout': 0.3753236073560836, 'batch_norm': False, 'lr': 0.0002977403462086033, 'weight_decay': 3.323968822817809e-05, 'epochs': 183, 'loss': 'mae', 'optimizer': 'adamw', 'use_snp_selection': True, 'num_snps': 59139, 'weight_scheme': 'top-heavy', 'weight_clip_max': 10.0, 'weight_topheavy_top_frac': 0.330469395613764, 'weight_topheavy_low': 0.7882888102608336, 'weight_topheavy_high': 4.259251271514651}. Best is trial 13 with value: 0.24190516444657253.
[I 2026-04-21 17:29:10,026] Trial 17 finished with value: 0.1861155346434437 and parameters: {'hidden_dims': '[512, 128]', 'dropout': 0.01972321729489873, 'batch_norm': True, 'lr': 7.163990919414793e-06, 'weight_decay': 1.3850136836425067e-06, 'epochs': 205, 'loss': 'mae', 'optimizer': 'adam', 'use_snp_selection': False, 'weight_scheme': 'minmax', 'weight_clip_max': None, 'weight_minmax_eps': 0.18977688210047033}. Best is trial 12 with value: 0.24153346255848498.
[I 2026-04-21 17:29:26,160] Trial 18 finished with value: 0.22961528666510025 and parameters: {'hidden_dims': '[256, 64]', 'dropout': 0.5218763581129175, 'batch_norm': True, 'lr': 4.064244260864157e-05, 'weight_decay': 1.4633504690210525e-05, 'epochs': 168, 'loss': 'mae', 'optimizer': 'adam', 'use_snp_selection': False, 'weight_scheme': 'uniform', 'weight_clip_max': None}. Best is trial 12 with value: 0.24153346255848498.
[I 2026-04-21 17:29:31,347] Trial 20 finished with value: 0.18015146066742282 and parameters: {'hidden_dims': '[256, 128]', 'dropout': 0.3895031127374059, 'batch_norm': False, 'lr': 0.00011269346340491405, 'weight_decay': 1.1390571153766523e-06, 'epochs': 267, 'loss': 'mae', 'optimizer': 'adamw', 'use_snp_selection': True, 'num_snps': 16136, 'weight_scheme': 'exponential', 'weight_clip_max': 5.0, 'weight_exponential_beta': 1.3927536435145016}. Best is trial 13 with value: 0.24190516444657253.
[I 2026-04-21 17:30:09,483] Trial 19 finished with value: 0.23784169768555427 and parameters: {'hidden_dims': '[512, 64]', 'dropout': 0.37350865440682024, 'batch_norm': True, 'lr': 0.0003307239231208325, 'weight_decay': 0.00015731317176735857, 'epochs': 264, 'loss': 'mae', 'optimizer': 'adamw', 'use_snp_selection': False, 'weight_scheme': 'exponential', 'weight_clip_max': 10.0, 'weight_exponential_beta': 0.19325067234615112}. Best is trial 12 with value: 0.24153346255848498.
[I 2026-04-21 17:30:17,304] Trial 20 finished with value: 0.22669018122889853 and parameters: {'hidden_dims': '[256, 64]', 'dropout': 0.1246584364339248, 'batch_norm': True, 'lr': 0.0004836789969258903, 'weight_decay': 1.1519818485369447e-06, 'epochs': 62, 'loss': 'mae', 'optimizer': 'adam', 'use_snp_selection': False, 'weight_scheme': 'top-heavy', 'weight_clip_max': None, 'weight_topheavy_top_frac': 0.06658927267553982, 'weight_topheavy_low': 0.7338907103434135, 'weight_topheavy_high': 1.3596202699013604}. Best is trial 12 with value: 0.24153346255848498.
[I 2026-04-21 17:30:19,016] Trial 21 finished with value: 0.2298583615933203 and parameters: {'hidden_dims': '[512, 64]', 'dropout': 0.5215880558938789, 'batch_norm': False, 'lr': 0.00017796934082710996, 'weight_decay': 0.0002289702170389584, 'epochs': 264, 'loss': 'mae', 'optimizer': 'adamw', 'use_snp_selection': True, 'num_snps': 44262, 'weight_scheme': 'exponential', 'weight_clip_max': 5.0, 'weight_exponential_beta': 7.99090546560455}. Best is trial 13 with value: 0.24190516444657253.
