[I 2026-04-18 16:25:02,434] Trial 30 finished with value: 0.11549423296979884 and parameters: {'hidden_dims': '[256, 64]', 'dropout': 0.10917592132437118, 'batch_norm': True, 'lr': 1.0142070338800189e-05, 'weight_decay': 4.2529886070549054e-07, 'epochs': 191, 'loss': 'mae', 'optimizer': 'adam', 'use_snp_selection': False, 'weight_scheme': 'minmax', 'weight_clip_max': 10.0, 'weight_minmax_eps': 0.11364355834001055}. Best is trial 22 with value: 0.16913238283218474.
[I 2026-04-18 16:25:02,524] Trial 6 finished with value: 0.12895609950055145 and parameters: {'hidden_dims': '[256, 64]', 'dropout': 0.037961443806696214, 'batch_norm': True, 'lr': 3.644202049829694e-05, 'weight_decay': 9.73334309820277e-06, 'epochs': 243, 'loss': 'mae', 'optimizer': 'adam', 'use_snp_selection': False, 'weight_scheme': 'minmax', 'weight_clip_max': None, 'weight_minmax_eps': 0.08689611239934374}. Best is trial 6 with value: 0.12895609950055145.
[I 2026-04-18 16:25:25,887] Trial 31 finished with value: 0.13382123923600647 and parameters: {'hidden_dims': '[512, 64]', 'dropout': 0.30525691488208967, 'batch_norm': True, 'lr': 1.3032766812318678e-05, 'weight_decay': 2.3258391158439606e-05, 'epochs': 61, 'loss': 'mae', 'optimizer': 'adam', 'use_snp_selection': False, 'weight_scheme': 'minmax', 'weight_clip_max': 10.0, 'weight_minmax_eps': 0.0661181873056319}. Best is trial 22 with value: 0.16913238283218474.
[I 2026-04-18 16:25:57,709] Trial 32 finished with value: 0.1687245227264331 and parameters: {'hidden_dims': '[512, 64]', 'dropout': 0.22960573475158066, 'batch_norm': True, 'lr': 2.791455866407177e-05, 'weight_decay': 0.00010739801779637274, 'epochs': 90, 'loss': 'mae', 'optimizer': 'adam', 'use_snp_selection': False, 'weight_scheme': 'minmax', 'weight_clip_max': 10.0, 'weight_minmax_eps': 0.06444564594015957}. Best is trial 22 with value: 0.16913238283218474.
[I 2026-04-18 16:26:20,011] Trial 7 finished with value: 0.04644549692415856 and parameters: {'hidden_dims': '[512, 128]', 'dropout': 0.1304538168539244, 'batch_norm': False, 'lr': 1.5408060926311233e-05, 'weight_decay': 2.1989735568314356e-08, 'epochs': 250, 'loss': 'mse', 'optimizer': 'sgd', 'use_snp_selection': True, 'num_snps': 42550, 'weight_scheme': 'exponential', 'weight_clip_max': 10.0, 'weight_exponential_beta': 2.758850226029358}. Best is trial 6 with value: 0.12895609950055145.
[I 2026-04-18 16:26:44,106] Trial 33 finished with value: 0.17256046319234397 and parameters: {'hidden_dims': '[512, 64]', 'dropout': 0.2125480013677792, 'batch_norm': True, 'lr': 2.5664695395055e-05, 'weight_decay': 0.0003953665708824673, 'epochs': 140, 'loss': 'mae', 'optimizer': 'adam', 'use_snp_selection': False, 'weight_scheme': 'minmax', 'weight_clip_max': 10.0, 'weight_minmax_eps': 0.08598240380782167}. Best is trial 33 with value: 0.17256046319234397.
[I 2026-04-18 16:26:57,091] Trial 8 finished with value: 0.10049869986707845 and parameters: {'hidden_dims': '[256, 128]', 'dropout': 0.05742396906738376, 'batch_norm': False, 'lr': 1.9761509510575143e-06, 'weight_decay': 2.933492239224291e-07, 'epochs': 82, 'loss': 'mae', 'optimizer': 'adam', 'use_snp_selection': True, 'num_snps': 29883, 'weight_scheme': 'minmax', 'weight_clip_max': 5.0, 'weight_minmax_eps': 0.0051288771726799584}. Best is trial 6 with value: 0.12895609950055145.
[I 2026-04-18 16:27:37,187] Trial 34 finished with value: 0.1612616066475513 and parameters: {'hidden_dims': '[512, 64]', 'dropout': 0.21961930682905528, 'batch_norm': True, 'lr': 3.0186642009745105e-05, 'weight_decay': 0.00010101523432464608, 'epochs': 163, 'loss': 'mse', 'optimizer': 'adam', 'use_snp_selection': False, 'weight_scheme': 'minmax', 'weight_clip_max': 10.0, 'weight_minmax_eps': 0.030681256997395337}. Best is trial 33 with value: 0.17256046319234397.
[I 2026-04-18 16:27:44,416] Trial 9 finished with value: 0.11962520347883798 and parameters: {'hidden_dims': '[256, 128]', 'dropout': 0.5795930447285386, 'batch_norm': False, 'lr': 0.00011782025260263196, 'weight_decay': 0.0005562063174273634, 'epochs': 218, 'loss': 'mae', 'optimizer': 'adamw', 'use_snp_selection': True, 'num_snps': 32226, 'weight_scheme': 'minmax', 'weight_clip_max': 5.0, 'weight_minmax_eps': 0.09600289105543994}. Best is trial 6 with value: 0.12895609950055145.
[I 2026-04-18 16:28:09,033] Trial 35 finished with value: 0.1503856855136727 and parameters: {'hidden_dims': '[512, 64]', 'dropout': 0.06355349660485213, 'batch_norm': True, 'lr': 8.194721275229856e-05, 'weight_decay': 0.00032023826533008714, 'epochs': 90, 'loss': 'mae', 'optimizer': 'adam', 'use_snp_selection': False, 'weight_scheme': 'linear', 'weight_clip_max': 10.0, 'weight_linear_min_weight': 0.9979463074712633, 'weight_linear_max_weight': 3.9175596925117713}. Best is trial 33 with value: 0.17256046319234397.
[I 2026-04-18 16:28:29,350] Trial 36 finished with value: 0.13600183872664176 and parameters: {'hidden_dims': '[256, 64]', 'dropout': 0.2556525338714259, 'batch_norm': False, 'lr': 0.00016359521334434644, 'weight_decay': 3.464100969169806e-06, 'epochs': 104, 'loss': 'mse', 'optimizer': 'adam', 'use_snp_selection': False, 'weight_scheme': 'minmax', 'weight_clip_max': 10.0, 'weight_minmax_eps': 0.07934477998162422}. Best is trial 33 with value: 0.17256046319234397.
[I 2026-04-18 16:29:10,749] Trial 10 finished with value: 0.09947678062854665 and parameters: {'hidden_dims': '[512, 64]', 'dropout': 0.4338375928678635, 'batch_norm': True, 'lr': 0.0009667920285641304, 'weight_decay': 6.976468597792388e-05, 'epochs': 294, 'loss': 'mae', 'optimizer': 'adam', 'use_snp_selection': False, 'weight_scheme': 'uniform', 'weight_clip_max': None}. Best is trial 6 with value: 0.12895609950055145.
[I 2026-04-18 16:29:31,599] Trial 11 finished with value: 0.11715594144930737 and parameters: {'hidden_dims': '[256, 64]', 'dropout': 0.3318834994634357, 'batch_norm': True, 'lr': 4.094262521298281e-06, 'weight_decay': 9.621963799188086e-07, 'epochs': 115, 'loss': 'mae', 'optimizer': 'adam', 'use_snp_selection': False, 'weight_scheme': 'linear', 'weight_clip_max': 10.0, 'weight_linear_min_weight': 0.9759377758669522, 'weight_linear_max_weight': 3.9304931846493334}. Best is trial 6 with value: 0.12895609950055145.
[I 2026-04-18 16:29:47,652] Trial 37 finished with value: 0.05371314105760276 and parameters: {'hidden_dims': '[512, 128]', 'dropout': 0.17491998842047293, 'batch_norm': True, 'lr': 4.23583872495978e-05, 'weight_decay': 9.400351755776169e-05, 'epochs': 146, 'loss': 'mae', 'optimizer': 'sgd', 'use_snp_selection': True, 'num_snps': 58588, 'weight_scheme': 'linear', 'weight_clip_max': 5.0, 'weight_linear_min_weight': 0.5933912229816198, 'weight_linear_max_weight': 2.757146034810728}. Best is trial 33 with value: 0.17256046319234397.
[I 2026-04-18 16:30:05,433] Trial 12 finished with value: 0.14727361307827938 and parameters: {'hidden_dims': '[256, 64]', 'dropout': 0.44024047229207874, 'batch_norm': True, 'lr': 0.00043999208327472284, 'weight_decay': 2.477520167966841e-05, 'epochs': 208, 'loss': 'mse', 'optimizer': 'adamw', 'use_snp_selection': False, 'weight_scheme': 'exponential', 'weight_clip_max': 10.0, 'weight_exponential_beta': 7.985702886127922}. Best is trial 12 with value: 0.14727361307827938.
[I 2026-04-18 16:30:39,938] Trial 38 finished with value: 0.14498529747420782 and parameters: {'hidden_dims': '[512, 64]', 'dropout': 0.09976543152014794, 'batch_norm': False, 'lr': 3.149820058180751e-05, 'weight_decay': 3.205986837563244e-05, 'epochs': 161, 'loss': 'mse', 'optimizer': 'adam', 'use_snp_selection': False, 'weight_scheme': 'minmax', 'weight_clip_max': 10.0, 'weight_minmax_eps': 0.0414605276194144}. Best is trial 33 with value: 0.17256046319234397.
[I 2026-04-18 16:30:40,617] Trial 13 finished with value: 0.14667216563328983 and parameters: {'hidden_dims': '[256, 64]', 'dropout': 0.48506980381971104, 'batch_norm': True, 'lr': 0.0006051751539277806, 'weight_decay': 2.3310278401171432e-05, 'epochs': 218, 'loss': 'mae', 'optimizer': 'adamw', 'use_snp_selection': False, 'weight_scheme': 'exponential', 'weight_clip_max': None, 'weight_exponential_beta': 7.9601156846073255}. Best is trial 12 with value: 0.14727361307827938.
[I 2026-04-18 16:31:12,614] Trial 14 finished with value: 0.15252363486437176 and parameters: {'hidden_dims': '[256, 64]', 'dropout': 0.5115993516218007, 'batch_norm': True, 'lr': 0.000907845807073624, 'weight_decay': 5.8481847235944864e-05, 'epochs': 195, 'loss': 'mse', 'optimizer': 'adamw', 'use_snp_selection': False, 'weight_scheme': 'exponential', 'weight_clip_max': 10.0, 'weight_exponential_beta': 7.957484502662135}. Best is trial 14 with value: 0.15252363486437176.
[I 2026-04-18 16:31:44,367] Trial 15 finished with value: 0.15750876972982958 and parameters: {'hidden_dims': '[256, 64]', 'dropout': 0.42563127433609693, 'batch_norm': True, 'lr': 0.00036076720604485176, 'weight_decay': 0.0006001038966395169, 'epochs': 193, 'loss': 'mse', 'optimizer': 'adamw', 'use_snp_selection': False, 'weight_scheme': 'exponential', 'weight_clip_max': 10.0, 'weight_exponential_beta': 7.98289321038153}. Best is trial 15 with value: 0.15750876972982958.
[I 2026-04-18 16:31:47,130] Trial 39 finished with value: 0.0997164934515452 and parameters: {'hidden_dims': '[256, 64]', 'dropout': 0.004118712067942121, 'batch_norm': True, 'lr': 6.186220344342737e-06, 'weight_decay': 1.0249416997279532e-05, 'epochs': 274, 'loss': 'mae', 'optimizer': 'adam', 'use_snp_selection': True, 'num_snps': 46338, 'weight_scheme': 'minmax', 'weight_clip_max': 10.0, 'weight_minmax_eps': 0.10665480855306973}. Best is trial 33 with value: 0.17256046319234397.
[I 2026-04-18 16:32:12,593] Trial 16 finished with value: 0.1499880027941872 and parameters: {'hidden_dims': '[256, 64]', 'dropout': 0.5849094854171062, 'batch_norm': True, 'lr': 0.0003027235381113088, 'weight_decay': 0.000980959879438918, 'epochs': 168, 'loss': 'mse', 'optimizer': 'adamw', 'use_snp_selection': False, 'weight_scheme': 'exponential', 'weight_clip_max': 10.0, 'weight_exponential_beta': 5.4110523916255895}. Best is trial 15 with value: 0.15750876972982958.
[I 2026-04-18 16:32:55,400] Trial 0 finished with value: 0.032727128616564224 and parameters: {'hidden_dims': '[256, 128]', 'dropout': 0.18584155530312246, 'batch_norm': True, 'lr': 9.012665953349533e-06, 'weight_decay': 4.96591963698479e-06, 'epochs': 105, 'loss': 'mse', 'optimizer': 'sgd', 'use_snp_selection': True, 'num_snps': 25583, 'weight_scheme': 'minmax', 'weight_clip_max': 5.0, 'weight_minmax_eps': 0.14026014881292506}. Best is trial 0 with value: 0.032727128616564224.
[I 2026-04-18 16:33:10,017] Trial 17 finished with value: 0.1561825922923213 and parameters: {'hidden_dims': '[512, 128]', 'dropout': 0.5144305207646869, 'batch_norm': True, 'lr': 0.0002543769580657175, 'weight_decay': 0.0002344551667318395, 'epochs': 189, 'loss': 'mse', 'optimizer': 'adamw', 'use_snp_selection': False, 'weight_scheme': 'exponential', 'weight_clip_max': 10.0, 'weight_exponential_beta': 6.136111798146191}. Best is trial 15 with value: 0.15750876972982958.
[I 2026-04-18 16:33:21,635] Trial 1 finished with value: 0.13726364662215806 and parameters: {'hidden_dims': '[256, 64]', 'dropout': 0.05000949662985405, 'batch_norm': True, 'lr': 0.00015647443054904835, 'weight_decay': 5.158896024962846e-05, 'epochs': 152, 'loss': 'mse', 'optimizer': 'sgd', 'use_snp_selection': False, 'weight_scheme': 'linear', 'weight_clip_max': None, 'weight_linear_min_weight': 0.21922985165550554, 'weight_linear_max_weight': 1.6260435767424388}. Best is trial 1 with value: 0.13726364662215806.
[I 2026-04-18 16:33:29,307] Trial 18 finished with value: 0.09534525038806267 and parameters: {'hidden_dims': '[512, 128]', 'dropout': 0.3691360652466414, 'batch_norm': True, 'lr': 0.0001786921578983882, 'weight_decay': 0.00023872070858077093, 'epochs': 51, 'loss': 'mse', 'optimizer': 'adamw', 'use_snp_selection': False, 'weight_scheme': 'uniform', 'weight_clip_max': 10.0}. Best is trial 15 with value: 0.15750876972982958.
[I 2026-04-18 16:34:01,469] Trial 2 finished with value: 0.08366138321842476 and parameters: {'hidden_dims': '[512, 128]', 'dropout': 0.2736730891340176, 'batch_norm': True, 'lr': 7.298114623433994e-05, 'weight_decay': 5.6346010385734023e-08, 'epochs': 185, 'loss': 'mae', 'optimizer': 'sgd', 'use_snp_selection': True, 'num_snps': 14091, 'weight_scheme': 'minmax', 'weight_clip_max': 10.0, 'weight_minmax_eps': 0.045780660776687306}. Best is trial 1 with value: 0.13726364662215806.
[I 2026-04-18 16:34:47,370] Trial 19 finished with value: 0.12565221912869706 and parameters: {'hidden_dims': '[512, 128]', 'dropout': 0.39467891563918944, 'batch_norm': True, 'lr': 0.0002829830830644836, 'weight_decay': 0.00021587204398158133, 'epochs': 264, 'loss': 'mse', 'optimizer': 'adamw', 'use_snp_selection': False, 'weight_scheme': 'top-heavy', 'weight_clip_max': 10.0, 'weight_topheavy_top_frac': 0.49909847832023785, 'weight_topheavy_low': 0.6798227631561391, 'weight_topheavy_high': 5.774564658948648}. Best is trial 15 with value: 0.15750876972982958.
[I 2026-04-18 16:35:24,758] Trial 3 finished with value: 0.09876403611792578 and parameters: {'hidden_dims': '[512, 64]', 'dropout': 0.30157795416637295, 'batch_norm': False, 'lr': 2.007492282795256e-05, 'weight_decay': 5.496446859789657e-06, 'epochs': 284, 'loss': 'mse', 'optimizer': 'sgd', 'use_snp_selection': False, 'weight_scheme': 'linear', 'weight_clip_max': None, 'weight_linear_min_weight': 0.24682154527102826, 'weight_linear_max_weight': 1.8338910783134623}. Best is trial 1 with value: 0.13726364662215806.
[I 2026-04-18 16:35:38,188] Trial 20 finished with value: 0.15986908334076994 and parameters: {'hidden_dims': '[512, 128]', 'dropout': 0.515768173540022, 'batch_norm': True, 'lr': 5.6717474038898236e-05, 'weight_decay': 0.0002885056572007529, 'epochs': 165, 'loss': 'mse', 'optimizer': 'adamw', 'use_snp_selection': False, 'weight_scheme': 'exponential', 'weight_clip_max': 10.0, 'weight_exponential_beta': 5.383264448330888}. Best is trial 20 with value: 0.15986908334076994.
[I 2026-04-18 16:35:50,065] Trial 4 finished with value: 0.15446681861347455 and parameters: {'hidden_dims': '[256, 64]', 'dropout': 0.18128694708490736, 'batch_norm': False, 'lr': 8.951826748007403e-05, 'weight_decay': 2.1781541495465197e-07, 'epochs': 147, 'loss': 'mse', 'optimizer': 'sgd', 'use_snp_selection': False, 'weight_scheme': 'top-heavy', 'weight_clip_max': 5.0, 'weight_topheavy_top_frac': 0.1724888194073277, 'weight_topheavy_low': 1.1620865802171172, 'weight_topheavy_high': 3.476906528073177}. Best is trial 4 with value: 0.15446681861347455.
[I 2026-04-18 16:36:11,722] Trial 5 finished with value: 0.10533985413961353 and parameters: {'hidden_dims': '[256, 64]', 'dropout': 0.2571412946970998, 'batch_norm': True, 'lr': 3.546238022482882e-05, 'weight_decay': 1.0185234767613396e-06, 'epochs': 119, 'loss': 'mse', 'optimizer': 'sgd', 'use_snp_selection': False, 'weight_scheme': 'linear', 'weight_clip_max': 10.0, 'weight_linear_min_weight': 0.9405832045183805, 'weight_linear_max_weight': 3.413610925325811}. Best is trial 4 with value: 0.15446681861347455.
[I 2026-04-18 16:36:26,579] Trial 21 finished with value: 0.16639477977593442 and parameters: {'hidden_dims': '[512, 128]', 'dropout': 0.515831928122497, 'batch_norm': True, 'lr': 5.960052854591623e-05, 'weight_decay': 0.0002444737467118162, 'epochs': 156, 'loss': 'mse', 'optimizer': 'adamw', 'use_snp_selection': False, 'weight_scheme': 'exponential', 'weight_clip_max': 10.0, 'weight_exponential_beta': 5.175805030415959}. Best is trial 21 with value: 0.16639477977593442.
[I 2026-04-18 16:36:51,957] Trial 6 finished with value: 0.1943071537897549 and parameters: {'hidden_dims': '[256, 64]', 'dropout': 0.037961443806696214, 'batch_norm': True, 'lr': 3.644202049829694e-05, 'weight_decay': 9.73334309820277e-06, 'epochs': 243, 'loss': 'mae', 'optimizer': 'adam', 'use_snp_selection': False, 'weight_scheme': 'minmax', 'weight_clip_max': None, 'weight_minmax_eps': 0.08689611239934374}. Best is trial 6 with value: 0.1943071537897549.
[I 2026-04-18 16:37:12,494] Trial 22 finished with value: 0.15714085597889155 and parameters: {'hidden_dims': '[512, 128]', 'dropout': 0.5409894116799743, 'batch_norm': True, 'lr': 5.628858635195001e-05, 'weight_decay': 0.00043598184143972784, 'epochs': 147, 'loss': 'mse', 'optimizer': 'adamw', 'use_snp_selection': False, 'weight_scheme': 'exponential', 'weight_clip_max': 10.0, 'weight_exponential_beta': 4.75068857560686}. Best is trial 21 with value: 0.16639477977593442.
[I 2026-04-18 16:38:01,986] Trial 23 finished with value: 0.1333458702686951 and parameters: {'hidden_dims': '[512, 128]', 'dropout': 0.44624669572113823, 'batch_norm': True, 'lr': 1.4096495564834618e-05, 'weight_decay': 0.00013415237363591652, 'epochs': 160, 'loss': 'mse', 'optimizer': 'adamw', 'use_snp_selection': False, 'weight_scheme': 'exponential', 'weight_clip_max': 10.0, 'weight_exponential_beta': 0.30548059248605286}. Best is trial 21 with value: 0.16639477977593442.
[I 2026-04-18 16:38:11,700] Trial 7 finished with value: 0.05428806581591944 and parameters: {'hidden_dims': '[512, 128]', 'dropout': 0.1304538168539244, 'batch_norm': False, 'lr': 1.5408060926311233e-05, 'weight_decay': 2.1989735568314356e-08, 'epochs': 250, 'loss': 'mse', 'optimizer': 'sgd', 'use_snp_selection': True, 'num_snps': 42550, 'weight_scheme': 'exponential', 'weight_clip_max': 10.0, 'weight_exponential_beta': 2.758850226029358}. Best is trial 6 with value: 0.1943071537897549.
[I 2026-04-18 16:38:45,091] Trial 24 finished with value: 0.14968766780438253 and parameters: {'hidden_dims': '[512, 128]', 'dropout': 0.4833426218133685, 'batch_norm': True, 'lr': 5.19186556514548e-05, 'weight_decay': 0.0007655808288217385, 'epochs': 137, 'loss': 'mse', 'optimizer': 'adamw', 'use_snp_selection': False, 'weight_scheme': 'exponential', 'weight_clip_max': 10.0, 'weight_exponential_beta': 3.2925011514909013}. Best is trial 21 with value: 0.16639477977593442.
[I 2026-04-18 16:38:50,045] Trial 8 finished with value: 0.18221173989174821 and parameters: {'hidden_dims': '[256, 128]', 'dropout': 0.05742396906738376, 'batch_norm': False, 'lr': 1.9761509510575143e-06, 'weight_decay': 2.933492239224291e-07, 'epochs': 82, 'loss': 'mae', 'optimizer': 'adam', 'use_snp_selection': True, 'num_snps': 29883, 'weight_scheme': 'minmax', 'weight_clip_max': 5.0, 'weight_minmax_eps': 0.0051288771726799584}. Best is trial 6 with value: 0.1943071537897549.
[I 2026-04-18 16:39:38,817] Trial 25 finished with value: 0.10543640173676347 and parameters: {'hidden_dims': '[512, 64]', 'dropout': 0.3741249463868406, 'batch_norm': True, 'lr': 5.9233452238911625e-06, 'weight_decay': 0.00012161727253329487, 'epochs': 176, 'loss': 'mse', 'optimizer': 'adamw', 'use_snp_selection': False, 'weight_scheme': 'exponential', 'weight_clip_max': 10.0, 'weight_exponential_beta': 6.289072466270264}. Best is trial 21 with value: 0.16639477977593442.
[I 2026-04-18 16:39:39,026] Trial 9 finished with value: 0.17810264616948915 and parameters: {'hidden_dims': '[256, 128]', 'dropout': 0.5795930447285386, 'batch_norm': False, 'lr': 0.00011782025260263196, 'weight_decay': 0.0005562063174273634, 'epochs': 218, 'loss': 'mae', 'optimizer': 'adamw', 'use_snp_selection': True, 'num_snps': 32226, 'weight_scheme': 'minmax', 'weight_clip_max': 5.0, 'weight_minmax_eps': 0.09600289105543994}. Best is trial 6 with value: 0.1943071537897549.
[I 2026-04-18 16:40:49,085] Trial 26 finished with value: 0.11284758336895322 and parameters: {'hidden_dims': '[512, 128]', 'dropout': 0.5318010767518515, 'batch_norm': False, 'lr': 0.00010794752243805583, 'weight_decay': 1.6757533665413427e-05, 'epochs': 129, 'loss': 'mse', 'optimizer': 'adamw', 'use_snp_selection': True, 'num_snps': 58369, 'weight_scheme': 'uniform', 'weight_clip_max': 10.0}. Best is trial 21 with value: 0.16639477977593442.
[I 2026-04-18 16:41:07,927] Trial 10 finished with value: 0.1857246658349922 and parameters: {'hidden_dims': '[512, 64]', 'dropout': 0.4338375928678635, 'batch_norm': True, 'lr': 0.0009667920285641304, 'weight_decay': 6.976468597792388e-05, 'epochs': 294, 'loss': 'mae', 'optimizer': 'adam', 'use_snp_selection': False, 'weight_scheme': 'uniform', 'weight_clip_max': None}. Best is trial 6 with value: 0.1943071537897549.
[I 2026-04-18 16:41:21,669] Trial 27 finished with value: 0.1395442178303163 and parameters: {'hidden_dims': '[512, 128]', 'dropout': 0.590743567596734, 'batch_norm': True, 'lr': 3.173900295435586e-05, 'weight_decay': 0.0003894636175996531, 'epochs': 99, 'loss': 'mse', 'optimizer': 'adamw', 'use_snp_selection': False, 'weight_scheme': 'exponential', 'weight_clip_max': 10.0, 'weight_exponential_beta': 3.9353163005619454}. Best is trial 21 with value: 0.16639477977593442.
[I 2026-04-18 16:42:29,759] Trial 28 finished with value: 0.11801366785734191 and parameters: {'hidden_dims': '[512, 64]', 'dropout': 0.40961482435736585, 'batch_norm': True, 'lr': 2.1881452827401626e-05, 'weight_decay': 8.399489772518847e-05, 'epochs': 228, 'loss': 'mse', 'optimizer': 'adamw', 'use_snp_selection': False, 'weight_scheme': 'top-heavy', 'weight_clip_max': 10.0, 'weight_topheavy_top_frac': 0.050200742398910314, 'weight_topheavy_low': 0.5472134732410052, 'weight_topheavy_high': 1.272877592104635}. Best is trial 21 with value: 0.16639477977593442.
[I 2026-04-18 16:42:35,607] Trial 11 finished with value: 0.18764634410397435 and parameters: {'hidden_dims': '[512, 64]', 'dropout': 0.4516805843717058, 'batch_norm': True, 'lr': 0.0009928478748470076, 'weight_decay': 5.547084226283487e-05, 'epochs': 290, 'loss': 'mae', 'optimizer': 'adam', 'use_snp_selection': False, 'weight_scheme': 'uniform', 'weight_clip_max': None}. Best is trial 6 with value: 0.1943071537897549.
