[I 2026-04-22 15:09:37,687] Trial 68 finished with value: 0.17500819162243514 and parameters: {'alpha': 62503.8334877641, 'use_snp_selection': False, 'weight_scheme': 'minmax', 'weight_clip_max': None, 'weight_minmax_eps': 0.15602092245529486}. Best is trial 11 with value: 0.18740141983407127.
[I 2026-04-22 15:10:25,889] Trial 69 finished with value: 0.1673769034360068 and parameters: {'alpha': 1819424.8777305533, 'use_snp_selection': False, 'weight_scheme': 'uniform', 'weight_clip_max': None}. Best is trial 11 with value: 0.18740141983407127.
[I 2026-04-22 15:11:24,693] Trial 70 finished with value: 0.18669840052586387 and parameters: {'alpha': 434437.6441670876, 'use_snp_selection': False, 'weight_scheme': 'minmax', 'weight_clip_max': None, 'weight_minmax_eps': 0.09555385891224798}. Best is trial 11 with value: 0.18740141983407127.
[I 2026-04-22 15:12:23,691] Trial 71 finished with value: 0.18663359433583981 and parameters: {'alpha': 370739.8482134777, 'use_snp_selection': False, 'weight_scheme': 'minmax', 'weight_clip_max': None, 'weight_minmax_eps': 0.0916203290379137}. Best is trial 11 with value: 0.18740141983407127.
[I 2026-04-22 15:13:22,556] Trial 72 finished with value: 0.1845672925322855 and parameters: {'alpha': 1075703.2594586455, 'use_snp_selection': False, 'weight_scheme': 'minmax', 'weight_clip_max': None, 'weight_minmax_eps': 0.09011947280626535}. Best is trial 11 with value: 0.18740141983407127.
[I 2026-04-22 15:14:21,431] Trial 73 finished with value: 0.18532711197277296 and parameters: {'alpha': 787431.6915203577, 'use_snp_selection': False, 'weight_scheme': 'minmax', 'weight_clip_max': None, 'weight_minmax_eps': 0.13993119416411193}. Best is trial 11 with value: 0.18740141983407127.
[I 2026-04-22 15:15:20,285] Trial 74 finished with value: 0.18538792512013488 and parameters: {'alpha': 225032.6638307008, 'use_snp_selection': False, 'weight_scheme': 'minmax', 'weight_clip_max': None, 'weight_minmax_eps': 0.10376492226171119}. Best is trial 11 with value: 0.18740141983407127.
[I 2026-04-22 15:16:19,022] Trial 75 finished with value: 0.17226136517514098 and parameters: {'alpha': 380000.2372241976, 'use_snp_selection': False, 'weight_scheme': 'exponential', 'weight_clip_max': None, 'weight_exponential_beta': 5.606818604186748}. Best is trial 11 with value: 0.18740141983407127.
[I 2026-04-22 15:17:17,634] Trial 76 finished with value: 0.1767014643289917 and parameters: {'alpha': 181221.21765348272, 'use_snp_selection': False, 'weight_scheme': 'top-heavy', 'weight_clip_max': None, 'weight_topheavy_top_frac': 0.28227577650876995, 'weight_topheavy_low': 1.1515687429748105, 'weight_topheavy_high': 3.9015528367883867}. Best is trial 11 with value: 0.18740141983407127.
[I 2026-04-22 15:18:15,835] Trial 77 finished with value: 0.12404550695578544 and parameters: {'alpha': 239.3747473607814, 'use_snp_selection': False, 'weight_scheme': 'minmax', 'weight_clip_max': 10.0, 'weight_minmax_eps': 0.12142622983174423}. Best is trial 11 with value: 0.18740141983407127.
[I 2026-04-22 15:19:14,615] Trial 78 finished with value: 0.12269845065498106 and parameters: {'alpha': 15.913576071174457, 'use_snp_selection': False, 'weight_scheme': 'minmax', 'weight_clip_max': None, 'weight_minmax_eps': 0.08651135991272021}. Best is trial 11 with value: 0.18740141983407127.
[I 2026-04-22 15:21:03,049] Trial 79 finished with value: 0.17928474509057263 and parameters: {'alpha': 282791.8452183262, 'use_snp_selection': True, 'num_snps': 26688, 'weight_scheme': 'minmax', 'weight_clip_max': None, 'weight_minmax_eps': 0.1473624783853378}. Best is trial 11 with value: 0.18740141983407127.
[I 2026-04-22 15:22:01,236] Trial 80 finished with value: 0.1439755135523676 and parameters: {'alpha': 6616.319763324549, 'use_snp_selection': False, 'weight_scheme': 'exponential', 'weight_clip_max': 5.0, 'weight_exponential_beta': 2.7769099099247683}. Best is trial 11 with value: 0.18740141983407127.
[I 2026-04-22 15:22:59,579] Trial 81 finished with value: 0.18661412249864107 and parameters: {'alpha': 455363.8947322826, 'use_snp_selection': False, 'weight_scheme': 'minmax', 'weight_clip_max': None, 'weight_minmax_eps': 0.01644245446506911}. Best is trial 11 with value: 0.18740141983407127.
[I 2026-04-22 15:23:57,695] Trial 82 finished with value: 0.18602872278455 and parameters: {'alpha': 538474.3287594885, 'use_snp_selection': False, 'weight_scheme': 'minmax', 'weight_clip_max': None, 'weight_minmax_eps': 0.17289452766850272}. Best is trial 11 with value: 0.18740141983407127.
[I 2026-04-22 15:24:55,856] Trial 83 finished with value: 0.1824070763165358 and parameters: {'alpha': 1558437.899543342, 'use_snp_selection': False, 'weight_scheme': 'minmax', 'weight_clip_max': None, 'weight_minmax_eps': 0.11395723437646718}. Best is trial 11 with value: 0.18740141983407127.
[I 2026-04-22 15:25:54,454] Trial 84 finished with value: 0.18608932294736016 and parameters: {'alpha': 757883.4477363421, 'use_snp_selection': False, 'weight_scheme': 'minmax', 'weight_clip_max': None, 'weight_minmax_eps': 0.016006671847024014}. Best is trial 11 with value: 0.18740141983407127.
[I 2026-04-22 15:26:52,779] Trial 85 finished with value: 0.18238010455967504 and parameters: {'alpha': 133453.66982547197, 'use_snp_selection': False, 'weight_scheme': 'minmax', 'weight_clip_max': None, 'weight_minmax_eps': 0.0778056730229456}. Best is trial 11 with value: 0.18740141983407127.
[I 2026-04-22 15:27:50,934] Trial 86 finished with value: 0.17852478207154326 and parameters: {'alpha': 85689.20739624636, 'use_snp_selection': False, 'weight_scheme': 'minmax', 'weight_clip_max': None, 'weight_minmax_eps': 0.09381111023438318}. Best is trial 11 with value: 0.18740141983407127.
[I 2026-04-22 15:28:38,357] Trial 87 finished with value: 0.1758246525260762 and parameters: {'alpha': 374037.95017273724, 'use_snp_selection': False, 'weight_scheme': 'uniform', 'weight_clip_max': None}. Best is trial 11 with value: 0.18740141983407127.
[I 2026-04-22 15:29:36,539] Trial 88 finished with value: 0.18516698975581652 and parameters: {'alpha': 214533.1170025495, 'use_snp_selection': False, 'weight_scheme': 'minmax', 'weight_clip_max': None, 'weight_minmax_eps': 0.12560299489674187}. Best is trial 11 with value: 0.18740141983407127.
[I 2026-04-22 15:30:35,474] Trial 89 finished with value: 0.17956520166372322 and parameters: {'alpha': 2790940.6993347206, 'use_snp_selection': False, 'weight_scheme': 'minmax', 'weight_clip_max': None, 'weight_minmax_eps': 0.04906601687691328}. Best is trial 11 with value: 0.18740141983407127.
[I 2026-04-22 15:31:34,507] Trial 90 finished with value: 0.1753425266540168 and parameters: {'alpha': 973597.7455392136, 'use_snp_selection': False, 'weight_scheme': 'top-heavy', 'weight_clip_max': 10.0, 'weight_topheavy_top_frac': 0.18762440190814117, 'weight_topheavy_low': 0.7179114160908115, 'weight_topheavy_high': 1.2514222651365667}. Best is trial 11 with value: 0.18740141983407127.
[I 2026-04-22 15:32:33,395] Trial 91 finished with value: 0.18664189901465894 and parameters: {'alpha': 456454.2558328327, 'use_snp_selection': False, 'weight_scheme': 'minmax', 'weight_clip_max': None, 'weight_minmax_eps': 0.020028930024007748}. Best is trial 11 with value: 0.18740141983407127.
[I 2026-04-22 15:33:32,304] Trial 92 finished with value: 0.1866163287415468 and parameters: {'alpha': 522805.6208264883, 'use_snp_selection': False, 'weight_scheme': 'minmax', 'weight_clip_max': None, 'weight_minmax_eps': 0.018158373838663523}. Best is trial 11 with value: 0.18740141983407127.
[I 2026-04-22 15:34:31,058] Trial 93 finished with value: 0.18656217397834765 and parameters: {'alpha': 581373.4178976986, 'use_snp_selection': False, 'weight_scheme': 'minmax', 'weight_clip_max': None, 'weight_minmax_eps': 0.022685628522633047}. Best is trial 11 with value: 0.18740141983407127.
[I 2026-04-22 15:35:29,900] Trial 94 finished with value: 0.18401649995672312 and parameters: {'alpha': 1340835.5197748905, 'use_snp_selection': False, 'weight_scheme': 'minmax', 'weight_clip_max': None, 'weight_minmax_eps': 0.023709127115072077}. Best is trial 11 with value: 0.18740141983407127.
[I 2026-04-22 15:36:28,890] Trial 95 finished with value: 0.1865995921980125 and parameters: {'alpha': 551329.9686843617, 'use_snp_selection': False, 'weight_scheme': 'minmax', 'weight_clip_max': None, 'weight_minmax_eps': 0.02066850291737729}. Best is trial 11 with value: 0.18740141983407127.
[I 2026-04-22 15:38:06,148] Trial 96 finished with value: 0.17406393839265644 and parameters: {'alpha': 276188.8070589833, 'use_snp_selection': True, 'num_snps': 18743, 'weight_scheme': 'exponential', 'weight_clip_max': None, 'weight_exponential_beta': 1.2590831095166442}. Best is trial 11 with value: 0.18740141983407127.
[I 2026-04-22 15:39:05,048] Trial 97 finished with value: 0.18585928430273257 and parameters: {'alpha': 827982.3908140311, 'use_snp_selection': False, 'weight_scheme': 'minmax', 'weight_clip_max': None, 'weight_minmax_eps': 0.013544762181761694}. Best is trial 11 with value: 0.18740141983407127.
[I 2026-04-22 15:40:03,846] Trial 98 finished with value: 0.18662552579664812 and parameters: {'alpha': 573466.5117836619, 'use_snp_selection': False, 'weight_scheme': 'minmax', 'weight_clip_max': None, 'weight_minmax_eps': 0.041760882501204834}. Best is trial 11 with value: 0.18740141983407127.
[I 2026-04-22 15:41:02,585] Trial 99 finished with value: 0.17562320921575417 and parameters: {'alpha': 4364190.748851504, 'use_snp_selection': False, 'weight_scheme': 'minmax', 'weight_clip_max': 5.0, 'weight_minmax_eps': 0.043644515646700584}. Best is trial 11 with value: 0.18740141983407127.
