[I 2026-04-18 15:13:20,639] Trial 1 finished with value: 0.19002813946211514 and parameters: {'hidden_dims': '[256, 64]', 'dropout': 0.05000949662985405, 'batch_norm': True, 'lr': 0.00015647443054904835, 'weight_decay': 5.158896024962846e-05, 'epochs': 152, 'loss': 'mse', 'optimizer': 'sgd', 'use_snp_selection': False, 'weight_scheme': 'linear', 'weight_clip_max': None, 'weight_linear_min_weight': 0.21922985165550554, 'weight_linear_max_weight': 1.6260435767424388}. Best is trial 1 with value: 0.19002813946211514.
[I 2026-04-18 15:13:26,331] Trial 21 finished with value: 0.11278953844600074 and parameters: {'hidden_dims': '[256, 128]', 'dropout': 0.07491935754325339, 'batch_norm': False, 'lr': 2.1214544029228847e-06, 'weight_decay': 2.487812533444407e-07, 'epochs': 55, 'loss': 'mae', 'optimizer': 'adam', 'use_snp_selection': True, 'num_snps': 59033, 'weight_scheme': 'minmax', 'weight_clip_max': 5.0, 'weight_minmax_eps': 0.00036877015617304675}. Best is trial 4 with value: 0.15262103126410306.
[I 2026-04-18 15:13:56,168] Trial 22 finished with value: 0.11457155754115889 and parameters: {'hidden_dims': '[256, 128]', 'dropout': 0.060858649401543605, 'batch_norm': False, 'lr': 3.2599949832164515e-06, 'weight_decay': 7.176880251620404e-08, 'epochs': 86, 'loss': 'mae', 'optimizer': 'adam', 'use_snp_selection': True, 'num_snps': 10146, 'weight_scheme': 'minmax', 'weight_clip_max': 5.0, 'weight_minmax_eps': 0.06529207185480682}. Best is trial 4 with value: 0.15262103126410306.
[I 2026-04-18 15:14:02,148] Trial 2 finished with value: 0.1182140704147939 and parameters: {'hidden_dims': '[512, 128]', 'dropout': 0.2736730891340176, 'batch_norm': True, 'lr': 7.298114623433994e-05, 'weight_decay': 5.6346010385734023e-08, 'epochs': 185, 'loss': 'mae', 'optimizer': 'sgd', 'use_snp_selection': True, 'num_snps': 14091, 'weight_scheme': 'minmax', 'weight_clip_max': 10.0, 'weight_minmax_eps': 0.045780660776687306}. Best is trial 1 with value: 0.19002813946211514.
[I 2026-04-18 15:14:40,427] Trial 23 finished with value: 0.10050202778755772 and parameters: {'hidden_dims': '[256, 128]', 'dropout': 0.16146183302960115, 'batch_norm': False, 'lr': 1.1968248686099757e-06, 'weight_decay': 2.118383938162848e-06, 'epochs': 72, 'loss': 'mae', 'optimizer': 'adam', 'use_snp_selection': True, 'num_snps': 44460, 'weight_scheme': 'minmax', 'weight_clip_max': 5.0, 'weight_minmax_eps': 0.0031624268240843774}. Best is trial 4 with value: 0.15262103126410306.
[I 2026-04-18 15:15:15,699] Trial 24 finished with value: 0.133247304353608 and parameters: {'hidden_dims': '[256, 128]', 'dropout': 0.09900676652070331, 'batch_norm': False, 'lr': 5.1012046077338273e-05, 'weight_decay': 4.231904088943358e-07, 'epochs': 101, 'loss': 'mae', 'optimizer': 'adam', 'use_snp_selection': True, 'num_snps': 20723, 'weight_scheme': 'minmax', 'weight_clip_max': 5.0, 'weight_minmax_eps': 0.13030164794375718}. Best is trial 4 with value: 0.15262103126410306.
[I 2026-04-18 15:15:27,707] Trial 3 finished with value: 0.09083902239507444 and parameters: {'hidden_dims': '[512, 64]', 'dropout': 0.30157795416637295, 'batch_norm': False, 'lr': 2.007492282795256e-05, 'weight_decay': 5.496446859789657e-06, 'epochs': 284, 'loss': 'mse', 'optimizer': 'sgd', 'use_snp_selection': False, 'weight_scheme': 'linear', 'weight_clip_max': None, 'weight_linear_min_weight': 0.24682154527102826, 'weight_linear_max_weight': 1.8338910783134623}. Best is trial 1 with value: 0.19002813946211514.
[I 2026-04-18 15:15:53,788] Trial 4 finished with value: 0.17452241449255293 and parameters: {'hidden_dims': '[256, 64]', 'dropout': 0.18128694708490736, 'batch_norm': False, 'lr': 8.951826748007403e-05, 'weight_decay': 2.1781541495465197e-07, 'epochs': 147, 'loss': 'mse', 'optimizer': 'sgd', 'use_snp_selection': False, 'weight_scheme': 'top-heavy', 'weight_clip_max': 5.0, 'weight_topheavy_top_frac': 0.1724888194073277, 'weight_topheavy_low': 1.1620865802171172, 'weight_topheavy_high': 3.476906528073177}. Best is trial 1 with value: 0.19002813946211514.
[I 2026-04-18 15:16:04,009] Trial 25 finished with value: 0.13924044702242844 and parameters: {'hidden_dims': '[256, 128]', 'dropout': 0.03662577289878108, 'batch_norm': False, 'lr': 8.727128587300868e-05, 'weight_decay': 1.0967967964079559e-07, 'epochs': 130, 'loss': 'mae', 'optimizer': 'adam', 'use_snp_selection': True, 'num_snps': 41702, 'weight_scheme': 'top-heavy', 'weight_clip_max': None, 'weight_topheavy_top_frac': 0.19833076136917757, 'weight_topheavy_low': 0.8593820326309014, 'weight_topheavy_high': 1.841872293927039}. Best is trial 4 with value: 0.15262103126410306.
[I 2026-04-18 15:16:15,903] Trial 5 finished with value: 0.13942997539976382 and parameters: {'hidden_dims': '[256, 64]', 'dropout': 0.2571412946970998, 'batch_norm': True, 'lr': 3.546238022482882e-05, 'weight_decay': 1.0185234767613396e-06, 'epochs': 119, 'loss': 'mse', 'optimizer': 'sgd', 'use_snp_selection': False, 'weight_scheme': 'linear', 'weight_clip_max': 10.0, 'weight_linear_min_weight': 0.9405832045183805, 'weight_linear_max_weight': 3.413610925325811}. Best is trial 1 with value: 0.19002813946211514.
[I 2026-04-18 15:16:57,011] Trial 6 finished with value: 0.24136004433841474 and parameters: {'hidden_dims': '[256, 64]', 'dropout': 0.037961443806696214, 'batch_norm': True, 'lr': 3.644202049829694e-05, 'weight_decay': 9.73334309820277e-06, 'epochs': 243, 'loss': 'mae', 'optimizer': 'adam', 'use_snp_selection': False, 'weight_scheme': 'minmax', 'weight_clip_max': None, 'weight_minmax_eps': 0.08689611239934374}. Best is trial 6 with value: 0.24136004433841474.
[I 2026-04-18 15:17:04,393] Trial 26 finished with value: 0.1239501933987676 and parameters: {'hidden_dims': '[512, 128]', 'dropout': 0.232192139643932, 'batch_norm': True, 'lr': 2.8011201593465527e-05, 'weight_decay': 4.880688762381114e-07, 'epochs': 79, 'loss': 'mse', 'optimizer': 'adam', 'use_snp_selection': True, 'num_snps': 57411, 'weight_scheme': 'minmax', 'weight_clip_max': 5.0, 'weight_minmax_eps': 0.041482111929038806}. Best is trial 4 with value: 0.15262103126410306.
[I 2026-04-18 15:18:07,129] Trial 27 finished with value: 0.12266228602884226 and parameters: {'hidden_dims': '[512, 64]', 'dropout': 0.16843472391901212, 'batch_norm': False, 'lr': 4.014702843509802e-06, 'weight_decay': 3.638152833487268e-08, 'epochs': 204, 'loss': 'mae', 'optimizer': 'adam', 'use_snp_selection': False, 'weight_scheme': 'minmax', 'weight_clip_max': 5.0, 'weight_minmax_eps': 0.08731071501928518}. Best is trial 4 with value: 0.15262103126410306.
[I 2026-04-18 15:18:19,187] Trial 7 finished with value: 0.134818295639233 and parameters: {'hidden_dims': '[512, 128]', 'dropout': 0.1304538168539244, 'batch_norm': False, 'lr': 1.5408060926311233e-05, 'weight_decay': 2.1989735568314356e-08, 'epochs': 250, 'loss': 'mse', 'optimizer': 'sgd', 'use_snp_selection': True, 'num_snps': 42550, 'weight_scheme': 'exponential', 'weight_clip_max': 10.0, 'weight_exponential_beta': 2.758850226029358}. Best is trial 6 with value: 0.24136004433841474.
[I 2026-04-18 15:18:52,400] Trial 28 finished with value: 0.045006875145877194 and parameters: {'hidden_dims': '[256, 64]', 'dropout': 0.003681090841681174, 'batch_norm': True, 'lr': 0.00023634210660741686, 'weight_decay': 2.6908330943157117e-06, 'epochs': 149, 'loss': 'mse', 'optimizer': 'sgd', 'use_snp_selection': True, 'num_snps': 33576, 'weight_scheme': 'top-heavy', 'weight_clip_max': 10.0, 'weight_topheavy_top_frac': 0.05012642343572163, 'weight_topheavy_low': 0.5111233031756558, 'weight_topheavy_high': 2.6685701760482243}. Best is trial 4 with value: 0.15262103126410306.
[I 2026-04-18 15:18:58,854] Trial 8 finished with value: 0.19044926106285012 and parameters: {'hidden_dims': '[256, 128]', 'dropout': 0.05742396906738376, 'batch_norm': False, 'lr': 1.9761509510575143e-06, 'weight_decay': 2.933492239224291e-07, 'epochs': 82, 'loss': 'mae', 'optimizer': 'adam', 'use_snp_selection': True, 'num_snps': 29883, 'weight_scheme': 'minmax', 'weight_clip_max': 5.0, 'weight_minmax_eps': 0.0051288771726799584}. Best is trial 6 with value: 0.24136004433841474.
[I 2026-04-18 15:19:20,557] Trial 29 finished with value: 0.125822149947792 and parameters: {'hidden_dims': '[256, 128]', 'dropout': 0.11639417256343411, 'batch_norm': True, 'lr': 1.045441979906036e-05, 'weight_decay': 6.790327092667405e-06, 'epochs': 103, 'loss': 'mse', 'optimizer': 'adamw', 'use_snp_selection': True, 'num_snps': 5460, 'weight_scheme': 'minmax', 'weight_clip_max': None, 'weight_minmax_eps': 0.14281917146891915}. Best is trial 4 with value: 0.15262103126410306.
[I 2026-04-18 15:19:49,320] Trial 9 finished with value: 0.230097256502611 and parameters: {'hidden_dims': '[256, 128]', 'dropout': 0.5795930447285386, 'batch_norm': False, 'lr': 0.00011782025260263196, 'weight_decay': 0.0005562063174273634, 'epochs': 218, 'loss': 'mae', 'optimizer': 'adamw', 'use_snp_selection': True, 'num_snps': 32226, 'weight_scheme': 'minmax', 'weight_clip_max': 5.0, 'weight_minmax_eps': 0.09600289105543994}. Best is trial 6 with value: 0.24136004433841474.
[I 2026-04-18 15:19:57,637] Trial 30 finished with value: 0.018222546121131535 and parameters: {'hidden_dims': '[256, 128]', 'dropout': 0.18313475883457545, 'batch_norm': False, 'lr': 1.2081461142394696e-05, 'weight_decay': 0.00018374792300839031, 'epochs': 235, 'loss': 'mae', 'optimizer': 'sgd', 'use_snp_selection': False, 'weight_scheme': 'uniform', 'weight_clip_max': 5.0}. Best is trial 4 with value: 0.15262103126410306.
[I 2026-04-18 15:20:47,038] Trial 31 finished with value: 0.13385670760563131 and parameters: {'hidden_dims': '[256, 128]', 'dropout': 0.027297101272280678, 'batch_norm': False, 'lr': 9.43075930314791e-05, 'weight_decay': 1.9247139518986017e-07, 'epochs': 126, 'loss': 'mae', 'optimizer': 'adam', 'use_snp_selection': True, 'num_snps': 44722, 'weight_scheme': 'top-heavy', 'weight_clip_max': None, 'weight_topheavy_top_frac': 0.21369709063504472, 'weight_topheavy_low': 0.8478302189994471, 'weight_topheavy_high': 1.4445878544156758}. Best is trial 4 with value: 0.15262103126410306.
[I 2026-04-18 15:21:20,332] Trial 10 finished with value: 0.23236234549985818 and parameters: {'hidden_dims': '[512, 64]', 'dropout': 0.4338375928678635, 'batch_norm': True, 'lr': 0.0009667920285641304, 'weight_decay': 6.976468597792388e-05, 'epochs': 294, 'loss': 'mae', 'optimizer': 'adam', 'use_snp_selection': False, 'weight_scheme': 'uniform', 'weight_clip_max': None}. Best is trial 6 with value: 0.24136004433841474.
[I 2026-04-18 15:21:33,348] Trial 32 finished with value: 0.1423160274575123 and parameters: {'hidden_dims': '[256, 128]', 'dropout': 0.05018852441679217, 'batch_norm': False, 'lr': 8.189470472724441e-05, 'weight_decay': 8.686557428414996e-08, 'epochs': 136, 'loss': 'mae', 'optimizer': 'adam', 'use_snp_selection': True, 'num_snps': 37197, 'weight_scheme': 'top-heavy', 'weight_clip_max': None, 'weight_topheavy_top_frac': 0.15534480143396687, 'weight_topheavy_low': 1.0149533667057649, 'weight_topheavy_high': 2.4837646839957768}. Best is trial 4 with value: 0.15262103126410306.
[I 2026-04-18 15:22:20,169] Trial 33 finished with value: 0.13926484067955588 and parameters: {'hidden_dims': '[256, 128]', 'dropout': 0.06578659431899106, 'batch_norm': False, 'lr': 2.392132914269089e-05, 'weight_decay': 2.9612017600315794e-08, 'epochs': 167, 'loss': 'mae', 'optimizer': 'adam', 'use_snp_selection': True, 'num_snps': 34706, 'weight_scheme': 'top-heavy', 'weight_clip_max': None, 'weight_topheavy_top_frac': 0.14403628656621176, 'weight_topheavy_low': 1.0297336670310149, 'weight_topheavy_high': 2.9665393562595215}. Best is trial 4 with value: 0.15262103126410306.
[I 2026-04-18 15:22:50,096] Trial 11 finished with value: 0.23628728145748687 and parameters: {'hidden_dims': '[512, 64]', 'dropout': 0.4516805843717058, 'batch_norm': True, 'lr': 0.0009928478748470076, 'weight_decay': 5.547084226283487e-05, 'epochs': 290, 'loss': 'mae', 'optimizer': 'adam', 'use_snp_selection': False, 'weight_scheme': 'uniform', 'weight_clip_max': None}. Best is trial 6 with value: 0.24136004433841474.
[I 2026-04-18 15:22:59,107] Trial 34 finished with value: 0.14029281001831656 and parameters: {'hidden_dims': '[256, 128]', 'dropout': 0.04330005531841434, 'batch_norm': False, 'lr': 5.31308926232524e-05, 'weight_decay': 7.487716107231957e-08, 'epochs': 141, 'loss': 'mae', 'optimizer': 'adam', 'use_snp_selection': True, 'num_snps': 24449, 'weight_scheme': 'linear', 'weight_clip_max': None, 'weight_linear_min_weight': 0.9929929746669073, 'weight_linear_max_weight': 3.9180331019542383}. Best is trial 4 with value: 0.15262103126410306.
[I 2026-04-18 15:23:35,637] Trial 35 finished with value: 0.06079931179996082 and parameters: {'hidden_dims': '[256, 64]', 'dropout': 0.29971463033846235, 'batch_norm': True, 'lr': 5.9985768471060355e-05, 'weight_decay': 7.363561373730468e-08, 'epochs': 146, 'loss': 'mae', 'optimizer': 'sgd', 'use_snp_selection': True, 'num_snps': 19978, 'weight_scheme': 'linear', 'weight_clip_max': None, 'weight_linear_min_weight': 0.9659635830614904, 'weight_linear_max_weight': 3.9574565331818867}. Best is trial 4 with value: 0.15262103126410306.
[I 2026-04-18 15:24:05,592] Trial 12 finished with value: 0.2324662385975545 and parameters: {'hidden_dims': '[512, 64]', 'dropout': 0.437522405165119, 'batch_norm': True, 'lr': 0.0008484935542405446, 'weight_decay': 5.229627468514555e-05, 'epochs': 241, 'loss': 'mae', 'optimizer': 'adam', 'use_snp_selection': False, 'weight_scheme': 'uniform', 'weight_clip_max': None}. Best is trial 6 with value: 0.24136004433841474.
[I 2026-04-18 15:24:43,903] Trial 36 finished with value: 0.1155528635947836 and parameters: {'hidden_dims': '[512, 128]', 'dropout': 0.09543154484695282, 'batch_norm': False, 'lr': 4.256151571656256e-05, 'weight_decay': 1.0583162842144971e-08, 'epochs': 140, 'loss': 'mse', 'optimizer': 'sgd', 'use_snp_selection': True, 'num_snps': 51421, 'weight_scheme': 'linear', 'weight_clip_max': None, 'weight_linear_min_weight': 0.6418832635462715, 'weight_linear_max_weight': 2.834932216036024}. Best is trial 4 with value: 0.15262103126410306.
[I 2026-04-18 15:25:12,998] Trial 37 finished with value: 0.13940412006853165 and parameters: {'hidden_dims': '[256, 64]', 'dropout': 0.13473444744300084, 'batch_norm': False, 'lr': 0.00017086386682761123, 'weight_decay': 5.399636959154587e-07, 'epochs': 172, 'loss': 'mse', 'optimizer': 'adam', 'use_snp_selection': False, 'weight_scheme': 'linear', 'weight_clip_max': None, 'weight_linear_min_weight': 0.6342103610368595, 'weight_linear_max_weight': 2.594902492916078}. Best is trial 4 with value: 0.15262103126410306.
[I 2026-04-18 15:25:26,871] Trial 13 finished with value: 0.23981099321176683 and parameters: {'hidden_dims': '[512, 64]', 'dropout': 0.44665667317896396, 'batch_norm': True, 'lr': 0.0003178528726442646, 'weight_decay': 0.0005542332600613432, 'epochs': 261, 'loss': 'mae', 'optimizer': 'adam', 'use_snp_selection': False, 'weight_scheme': 'uniform', 'weight_clip_max': None}. Best is trial 6 with value: 0.24136004433841474.
[I 2026-04-18 15:25:56,586] Trial 38 finished with value: 0.07934325170814376 and parameters: {'hidden_dims': '[512, 64]', 'dropout': 0.24249613408013818, 'batch_norm': True, 'lr': 7.351331626090417e-05, 'weight_decay': 5.0426286179457135e-08, 'epochs': 114, 'loss': 'mae', 'optimizer': 'sgd', 'use_snp_selection': True, 'num_snps': 24665, 'weight_scheme': 'linear', 'weight_clip_max': None, 'weight_linear_min_weight': 0.4415112371174241, 'weight_linear_max_weight': 1.0656103336700777}. Best is trial 4 with value: 0.15262103126410306.
[I 2026-04-18 15:26:01,982] Trial 14 finished with value: 0.20570763624151572 and parameters: {'hidden_dims': '[256, 64]', 'dropout': 0.3602577257990951, 'batch_norm': True, 'lr': 0.000271148338673807, 'weight_decay': 0.0006638256720328278, 'epochs': 204, 'loss': 'mae', 'optimizer': 'adam', 'use_snp_selection': False, 'weight_scheme': 'exponential', 'weight_clip_max': None, 'weight_exponential_beta': 7.948849485427058}. Best is trial 6 with value: 0.24136004433841474.
[I 2026-04-18 15:26:29,043] Trial 39 finished with value: 0.12966909199052293 and parameters: {'hidden_dims': '[256, 128]', 'dropout': 0.0584945626002616, 'batch_norm': False, 'lr': 0.0001260234576149988, 'weight_decay': 1.1913045987506689e-07, 'epochs': 195, 'loss': 'mae', 'optimizer': 'adam', 'use_snp_selection': False, 'weight_scheme': 'linear', 'weight_clip_max': 10.0, 'weight_linear_min_weight': 0.7745107981693078, 'weight_linear_max_weight': 3.965089401750962}. Best is trial 4 with value: 0.15262103126410306.
[I 2026-04-18 15:27:20,443] Trial 15 finished with value: 0.20266319855046683 and parameters: {'hidden_dims': '[512, 64]', 'dropout': 0.5998375031807794, 'batch_norm': True, 'lr': 2.960482242380571e-06, 'weight_decay': 1.3318423029679498e-05, 'epochs': 251, 'loss': 'mae', 'optimizer': 'adamw', 'use_snp_selection': False, 'weight_scheme': 'top-heavy', 'weight_clip_max': None, 'weight_topheavy_top_frac': 0.48091952196914134, 'weight_topheavy_low': 0.5054522954723732, 'weight_topheavy_high': 5.647529144674392}. Best is trial 6 with value: 0.24136004433841474.
[I 2026-04-18 15:27:35,526] Trial 0 finished with value: -0.009976206394780704 and parameters: {'hidden_dims': '[256, 128]', 'dropout': 0.18584155530312246, 'batch_norm': True, 'lr': 9.012665953349533e-06, 'weight_decay': 4.96591963698479e-06, 'epochs': 105, 'loss': 'mse', 'optimizer': 'sgd', 'use_snp_selection': True, 'num_snps': 25583, 'weight_scheme': 'minmax', 'weight_clip_max': 5.0, 'weight_minmax_eps': 0.14026014881292506}. Best is trial 0 with value: -0.009976206394780704.
[I 2026-04-18 15:27:58,224] Trial 16 finished with value: 0.2199339312394625 and parameters: {'hidden_dims': '[256, 64]', 'dropout': 0.5193295683583827, 'batch_norm': True, 'lr': 5.196015503468652e-06, 'weight_decay': 0.0002454180311733718, 'epochs': 222, 'loss': 'mae', 'optimizer': 'adam', 'use_snp_selection': False, 'weight_scheme': 'uniform', 'weight_clip_max': None}. Best is trial 6 with value: 0.24136004433841474.
[I 2026-04-18 15:28:03,600] Trial 1 finished with value: 0.056859303535834925 and parameters: {'hidden_dims': '[256, 64]', 'dropout': 0.05000949662985405, 'batch_norm': True, 'lr': 0.00015647443054904835, 'weight_decay': 5.158896024962846e-05, 'epochs': 152, 'loss': 'mse', 'optimizer': 'sgd', 'use_snp_selection': False, 'weight_scheme': 'linear', 'weight_clip_max': None, 'weight_linear_min_weight': 0.21922985165550554, 'weight_linear_max_weight': 1.6260435767424388}. Best is trial 1 with value: 0.056859303535834925.
[I 2026-04-18 15:28:46,811] Trial 2 finished with value: 0.10368140223755015 and parameters: {'hidden_dims': '[512, 128]', 'dropout': 0.2736730891340176, 'batch_norm': True, 'lr': 7.298114623433994e-05, 'weight_decay': 5.6346010385734023e-08, 'epochs': 185, 'loss': 'mae', 'optimizer': 'sgd', 'use_snp_selection': True, 'num_snps': 14091, 'weight_scheme': 'minmax', 'weight_clip_max': 10.0, 'weight_minmax_eps': 0.045780660776687306}. Best is trial 2 with value: 0.10368140223755015.
[I 2026-04-18 15:29:21,953] Trial 17 finished with value: 0.23463423839869785 and parameters: {'hidden_dims': '[512, 128]', 'dropout': 0.3564603394702534, 'batch_norm': True, 'lr': 0.0003300425321394909, 'weight_decay': 1.3850136836425067e-06, 'epochs': 268, 'loss': 'mae', 'optimizer': 'adam', 'use_snp_selection': False, 'weight_scheme': 'minmax', 'weight_clip_max': None, 'weight_minmax_eps': 0.18977688210047033}. Best is trial 6 with value: 0.24136004433841474.
[I 2026-04-18 15:29:55,217] Trial 18 finished with value: 0.214976795539694 and parameters: {'hidden_dims': '[256, 64]', 'dropout': 0.00563586163337744, 'batch_norm': True, 'lr': 4.097677425228083e-05, 'weight_decay': 1.307834195883967e-05, 'epochs': 192, 'loss': 'mae', 'optimizer': 'adam', 'use_snp_selection': False, 'weight_scheme': 'uniform', 'weight_clip_max': None}. Best is trial 6 with value: 0.24136004433841474.
[I 2026-04-18 15:30:16,525] Trial 3 finished with value: 0.0384358056793888 and parameters: {'hidden_dims': '[512, 64]', 'dropout': 0.30157795416637295, 'batch_norm': False, 'lr': 2.007492282795256e-05, 'weight_decay': 5.496446859789657e-06, 'epochs': 284, 'loss': 'mse', 'optimizer': 'sgd', 'use_snp_selection': False, 'weight_scheme': 'linear', 'weight_clip_max': None, 'weight_linear_min_weight': 0.24682154527102826, 'weight_linear_max_weight': 1.8338910783134623}. Best is trial 2 with value: 0.10368140223755015.
[I 2026-04-18 15:30:43,599] Trial 4 finished with value: 0.1712585289862065 and parameters: {'hidden_dims': '[256, 64]', 'dropout': 0.18128694708490736, 'batch_norm': False, 'lr': 8.951826748007403e-05, 'weight_decay': 2.1781541495465197e-07, 'epochs': 147, 'loss': 'mse', 'optimizer': 'sgd', 'use_snp_selection': False, 'weight_scheme': 'top-heavy', 'weight_clip_max': 5.0, 'weight_topheavy_top_frac': 0.1724888194073277, 'weight_topheavy_low': 1.1620865802171172, 'weight_topheavy_high': 3.476906528073177}. Best is trial 4 with value: 0.1712585289862065.
[I 2026-04-18 15:30:48,597] Trial 19 finished with value: 0.2050315310370042 and parameters: {'hidden_dims': '[512, 64]', 'dropout': 0.5122030531988881, 'batch_norm': True, 'lr': 1.1188800032780953e-06, 'weight_decay': 0.00020367605067585137, 'epochs': 163, 'loss': 'mae', 'optimizer': 'adamw', 'use_snp_selection': False, 'weight_scheme': 'exponential', 'weight_clip_max': 10.0, 'weight_exponential_beta': 0.19325067234615112}. Best is trial 6 with value: 0.24136004433841474.
