[I 2026-05-04 02:35:48,184] Trial 57 finished with value: 0.20429570960168322 and parameters: {'alpha': 665383.050003273, 'use_snp_selection': False, 'iw_method': 'pc_logistic', 'iw_clip_max': 2.0, 'iw_prob_clip': 0.038376802500460556, 'iw_n_components': 20, 'iw_logistic_c': 0.006669214262140404, 'iw_pca_fit': 'combined', 'iw_solver': 'lbfgs', 'iw_rho': 0.5}. Best is trial 23 with value: 0.2087999053068894.
[I 2026-05-04 02:38:18,600] Trial 58 finished with value: 0.20742110943858058 and parameters: {'alpha': 333351.73932508845, 'use_snp_selection': False, 'iw_method': 'pc_logistic', 'iw_clip_max': 1.5, 'iw_prob_clip': 0.02448427946645137, 'iw_n_components': 10, 'iw_logistic_c': 0.0014793934069205026, 'iw_pca_fit': 'combined', 'iw_solver': 'lbfgs', 'iw_rho': 1.0}. Best is trial 23 with value: 0.2087999053068894.
[I 2026-05-04 02:38:47,136] Trial 59 finished with value: 0.19111817137219175 and parameters: {'alpha': 810087.7709480096, 'use_snp_selection': False, 'iw_method': 'uniform'}. Best is trial 23 with value: 0.2087999053068894.
[I 2026-05-04 02:41:30,903] Trial 60 finished with value: 0.20282962345858543 and parameters: {'alpha': 475092.4388648369, 'use_snp_selection': False, 'iw_method': 'pc_logistic', 'iw_clip_max': 5.0, 'iw_prob_clip': 0.012576886840146505, 'iw_n_components': 40, 'iw_logistic_c': 0.743510885917446, 'iw_pca_fit': 'combined', 'iw_solver': 'lbfgs', 'iw_rho': 0.5}. Best is trial 23 with value: 0.2087999053068894.
[I 2026-05-04 02:44:13,684] Trial 61 finished with value: 0.20291894643987424 and parameters: {'alpha': 321909.6485838295, 'use_snp_selection': False, 'iw_method': 'pc_logistic', 'iw_clip_max': 3.0, 'iw_prob_clip': 0.0016047706173391004, 'iw_n_components': 50, 'iw_logistic_c': 3.221878098491923, 'iw_pca_fit': 'combined', 'iw_solver': 'lbfgs', 'iw_rho': 0.5}. Best is trial 23 with value: 0.2087999053068894.
[I 2026-05-04 02:46:58,701] Trial 62 finished with value: 0.20448549860071785 and parameters: {'alpha': 259370.82471506778, 'use_snp_selection': False, 'iw_method': 'pc_logistic', 'iw_clip_max': 1.25, 'iw_prob_clip': 0.0379262802940269, 'iw_n_components': 50, 'iw_logistic_c': 1.676521803065091, 'iw_pca_fit': 'combined', 'iw_solver': 'lbfgs', 'iw_rho': 0.9}. Best is trial 23 with value: 0.2087999053068894.
[I 2026-05-04 02:49:26,127] Trial 63 finished with value: 0.2034169306845735 and parameters: {'alpha': 226167.79756071058, 'use_snp_selection': False, 'iw_method': 'pc_logistic', 'iw_clip_max': 5.0, 'iw_prob_clip': 0.003211891636757927, 'iw_n_components': 10, 'iw_logistic_c': 3.322812647692063e-07, 'iw_pca_fit': 'combined', 'iw_solver': 'lbfgs', 'iw_rho': 0.5}. Best is trial 23 with value: 0.2087999053068894.
[I 2026-05-04 02:52:12,749] Trial 64 finished with value: 0.20194213159952992 and parameters: {'alpha': 395129.53843523934, 'use_snp_selection': False, 'iw_method': 'pc_logistic', 'iw_clip_max': 2.0, 'iw_prob_clip': 0.007047547220102959, 'iw_n_components': 80, 'iw_logistic_c': 0.00031868387744343665, 'iw_pca_fit': 'combined', 'iw_solver': 'lbfgs', 'iw_rho': 0.5}. Best is trial 23 with value: 0.2087999053068894.
[I 2026-05-04 02:54:57,624] Trial 65 finished with value: 0.20156709941665824 and parameters: {'alpha': 191390.40893195418, 'use_snp_selection': False, 'iw_method': 'pc_logistic', 'iw_clip_max': 3.0, 'iw_prob_clip': 0.016400844907036888, 'iw_n_components': 50, 'iw_logistic_c': 9.901568636621857, 'iw_pca_fit': 'combined', 'iw_solver': 'lbfgs', 'iw_rho': 1.0}. Best is trial 23 with value: 0.2087999053068894.
[I 2026-05-04 02:57:36,257] Trial 66 finished with value: 0.19609121045890715 and parameters: {'alpha': 306334.0568218836, 'use_snp_selection': False, 'iw_method': 'pc_logistic', 'iw_clip_max': 5.0, 'iw_prob_clip': 0.002230745614469439, 'iw_n_components': 30, 'iw_logistic_c': 0.04731594245065728, 'iw_pca_fit': 'combined', 'iw_solver': 'lbfgs', 'iw_rho': 0.75}. Best is trial 23 with value: 0.2087999053068894.
[I 2026-05-04 03:00:06,119] Trial 67 finished with value: 0.2022544531776614 and parameters: {'alpha': 169782.30256617078, 'use_snp_selection': False, 'iw_method': 'pc_logistic', 'iw_clip_max': 1.5, 'iw_prob_clip': 0.02114231894630823, 'iw_n_components': 20, 'iw_logistic_c': 3.1015415277671576e-06, 'iw_pca_fit': 'combined', 'iw_solver': 'lbfgs', 'iw_rho': 0.9}. Best is trial 23 with value: 0.2087999053068894.
[I 2026-05-04 03:02:44,047] Trial 68 finished with value: 0.2044962068570612 and parameters: {'alpha': 260805.9322595532, 'use_snp_selection': False, 'iw_method': 'pc_logistic', 'iw_clip_max': 3.0, 'iw_prob_clip': 0.03139227113280417, 'iw_n_components': 50, 'iw_logistic_c': 1.4838538153944087e-05, 'iw_pca_fit': 'combined', 'iw_solver': 'lbfgs', 'iw_rho': 0.75}. Best is trial 23 with value: 0.2087999053068894.
[I 2026-05-04 03:05:28,739] Trial 69 finished with value: 0.2037209039358821 and parameters: {'alpha': 207987.9238274915, 'use_snp_selection': False, 'iw_method': 'pc_logistic', 'iw_clip_max': 5.0, 'iw_prob_clip': 0.011355089312608077, 'iw_n_components': 60, 'iw_logistic_c': 5.085323499708129, 'iw_pca_fit': 'combined', 'iw_solver': 'lbfgs', 'iw_rho': 0.5}. Best is trial 23 with value: 0.2087999053068894.
[I 2026-05-04 03:07:59,058] Trial 70 finished with value: 0.2005888981940999 and parameters: {'alpha': 571459.7478632331, 'use_snp_selection': False, 'iw_method': 'pc_logistic', 'iw_clip_max': 1.25, 'iw_prob_clip': 0.014129627612033664, 'iw_n_components': 10, 'iw_logistic_c': 0.43660471414954394, 'iw_pca_fit': 'combined', 'iw_solver': 'lbfgs', 'iw_rho': 0.75}. Best is trial 23 with value: 0.2087999053068894.
[I 2026-05-04 03:10:29,812] Trial 71 finished with value: 0.20686392047829122 and parameters: {'alpha': 343177.3485683412, 'use_snp_selection': False, 'iw_method': 'pc_logistic', 'iw_clip_max': 1.5, 'iw_prob_clip': 0.025112258276234412, 'iw_n_components': 10, 'iw_logistic_c': 0.00198857894037889, 'iw_pca_fit': 'combined', 'iw_solver': 'lbfgs', 'iw_rho': 1.0}. Best is trial 23 with value: 0.2087999053068894.
[I 2026-05-04 03:12:59,672] Trial 72 finished with value: 0.20324823701100886 and parameters: {'alpha': 416671.9866666699, 'use_snp_selection': False, 'iw_method': 'pc_logistic', 'iw_clip_max': 1.5, 'iw_prob_clip': 0.025036834615663833, 'iw_n_components': 10, 'iw_logistic_c': 0.0007305036398728182, 'iw_pca_fit': 'combined', 'iw_solver': 'lbfgs', 'iw_rho': 1.0}. Best is trial 23 with value: 0.2087999053068894.
[I 2026-05-04 03:15:27,109] Trial 73 finished with value: 0.20042411461662138 and parameters: {'alpha': 374745.85629537405, 'use_snp_selection': False, 'iw_method': 'pc_logistic', 'iw_clip_max': 1.5, 'iw_prob_clip': 0.036655308648483174, 'iw_n_components': 10, 'iw_logistic_c': 1.844210494778933e-07, 'iw_pca_fit': 'combined', 'iw_solver': 'lbfgs', 'iw_rho': 1.0}. Best is trial 23 with value: 0.2087999053068894.
[I 2026-05-04 03:18:05,238] Trial 74 finished with value: 0.20053097400112868 and parameters: {'alpha': 279083.84650465334, 'use_snp_selection': False, 'iw_method': 'pc_logistic', 'iw_clip_max': 1.5, 'iw_prob_clip': 0.019015926019971464, 'iw_n_components': 60, 'iw_logistic_c': 5.885525098549915e-05, 'iw_pca_fit': 'combined', 'iw_solver': 'lbfgs', 'iw_rho': 1.0}. Best is trial 23 with value: 0.2087999053068894.
[I 2026-05-04 03:20:36,681] Trial 75 finished with value: 0.20181807441707839 and parameters: {'alpha': 140672.87759661776, 'use_snp_selection': False, 'iw_method': 'pc_logistic', 'iw_clip_max': 3.0, 'iw_prob_clip': 0.003834328440380769, 'iw_n_components': 10, 'iw_logistic_c': 0.011266024002373474, 'iw_pca_fit': 'combined', 'iw_solver': 'lbfgs', 'iw_rho': 0.75}. Best is trial 23 with value: 0.2087999053068894.
[I 2026-05-04 03:23:28,598] Trial 76 finished with value: 0.19230150746098756 and parameters: {'alpha': 109333.4866978532, 'use_snp_selection': False, 'iw_method': 'pc_logistic', 'iw_clip_max': 5.0, 'iw_prob_clip': 0.0418685258296387, 'iw_n_components': 80, 'iw_logistic_c': 0.024113155243922445, 'iw_pca_fit': 'combined', 'iw_solver': 'lbfgs', 'iw_rho': 1.0}. Best is trial 23 with value: 0.2087999053068894.
[I 2026-05-04 03:23:57,133] Trial 77 finished with value: 0.18269063928587445 and parameters: {'alpha': 1837490.7176954332, 'use_snp_selection': False, 'iw_method': 'uniform'}. Best is trial 23 with value: 0.2087999053068894.
[I 2026-05-04 03:26:36,195] Trial 78 finished with value: 0.20402364780204976 and parameters: {'alpha': 469486.4020617824, 'use_snp_selection': False, 'iw_method': 'pc_logistic', 'iw_clip_max': 3.0, 'iw_prob_clip': 0.027549185745898475, 'iw_n_components': 50, 'iw_logistic_c': 0.00010555025631119142, 'iw_pca_fit': 'combined', 'iw_solver': 'lbfgs', 'iw_rho': 0.75}. Best is trial 23 with value: 0.2087999053068894.
[I 2026-05-04 03:29:21,743] Trial 79 finished with value: 0.2041395834104353 and parameters: {'alpha': 326344.03320397635, 'use_snp_selection': False, 'iw_method': 'pc_logistic', 'iw_clip_max': 2.0, 'iw_prob_clip': 0.0052726521344881126, 'iw_n_components': 60, 'iw_logistic_c': 0.1286501500196602, 'iw_pca_fit': 'combined', 'iw_solver': 'lbfgs', 'iw_rho': 0.5}. Best is trial 23 with value: 0.2087999053068894.
[I 2026-05-04 03:31:57,889] Trial 80 finished with value: 0.20419615085047288 and parameters: {'alpha': 238153.5080893674, 'use_snp_selection': False, 'iw_method': 'pc_logistic', 'iw_clip_max': 3.0, 'iw_prob_clip': 0.02358507978810906, 'iw_n_components': 40, 'iw_logistic_c': 6.607640416558699e-06, 'iw_pca_fit': 'combined', 'iw_solver': 'lbfgs', 'iw_rho': 0.75}. Best is trial 23 with value: 0.2087999053068894.
[I 2026-05-04 03:34:39,553] Trial 81 finished with value: 0.2054258944917707 and parameters: {'alpha': 124027.4503360744, 'use_snp_selection': False, 'iw_method': 'pc_logistic', 'iw_clip_max': 3.0, 'iw_prob_clip': 0.04936202504006774, 'iw_n_components': 50, 'iw_logistic_c': 1.176910351831061, 'iw_pca_fit': 'combined', 'iw_solver': 'lbfgs', 'iw_rho': 0.5}. Best is trial 23 with value: 0.2087999053068894.
[I 2026-05-04 03:37:22,054] Trial 82 finished with value: 0.20610152408438404 and parameters: {'alpha': 185656.47463942005, 'use_snp_selection': False, 'iw_method': 'pc_logistic', 'iw_clip_max': 3.0, 'iw_prob_clip': 0.03313807111196713, 'iw_n_components': 50, 'iw_logistic_c': 0.24287126130673217, 'iw_pca_fit': 'combined', 'iw_solver': 'lbfgs', 'iw_rho': 0.5}. Best is trial 23 with value: 0.2087999053068894.
[I 2026-05-04 03:40:03,289] Trial 83 finished with value: 0.20724114981396796 and parameters: {'alpha': 165018.25160292917, 'use_snp_selection': False, 'iw_method': 'pc_logistic', 'iw_clip_max': 3.0, 'iw_prob_clip': 0.04345978284257414, 'iw_n_components': 50, 'iw_logistic_c': 2.399401012186603, 'iw_pca_fit': 'combined', 'iw_solver': 'lbfgs', 'iw_rho': 0.5}. Best is trial 23 with value: 0.2087999053068894.
[I 2026-05-04 03:42:52,128] Trial 84 finished with value: 0.20696544024369046 and parameters: {'alpha': 155213.7404346373, 'use_snp_selection': False, 'iw_method': 'pc_logistic', 'iw_clip_max': 3.0, 'iw_prob_clip': 0.04364431338324448, 'iw_n_components': 50, 'iw_logistic_c': 2.413880991119809, 'iw_pca_fit': 'combined', 'iw_solver': 'lbfgs', 'iw_rho': 0.5}. Best is trial 23 with value: 0.2087999053068894.
[I 2026-05-04 03:45:55,814] Trial 85 finished with value: 0.20239920014333007 and parameters: {'alpha': 176552.85952090748, 'use_snp_selection': False, 'iw_method': 'pc_logistic', 'iw_clip_max': 5.0, 'iw_prob_clip': 0.02907466293811186, 'iw_n_components': 60, 'iw_logistic_c': 0.4476658734184947, 'iw_pca_fit': 'combined', 'iw_solver': 'lbfgs', 'iw_rho': 0.5}. Best is trial 23 with value: 0.2087999053068894.
[I 2026-05-04 03:48:49,241] Trial 86 finished with value: 0.2026986049138996 and parameters: {'alpha': 628011.1481862419, 'use_snp_selection': False, 'iw_method': 'pc_logistic', 'iw_clip_max': 3.0, 'iw_prob_clip': 0.0188279175746644, 'iw_n_components': 50, 'iw_logistic_c': 7.774610946205106e-07, 'iw_pca_fit': 'combined', 'iw_solver': 'lbfgs', 'iw_rho': 0.75}. Best is trial 23 with value: 0.2087999053068894.
[I 2026-05-04 03:51:34,111] Trial 87 finished with value: 0.20653050975753193 and parameters: {'alpha': 135406.61536910708, 'use_snp_selection': False, 'iw_method': 'pc_logistic', 'iw_clip_max': 1.5, 'iw_prob_clip': 0.039982004130747956, 'iw_n_components': 10, 'iw_logistic_c': 5.670245226890683, 'iw_pca_fit': 'combined', 'iw_solver': 'lbfgs', 'iw_rho': 0.5}. Best is trial 23 with value: 0.2087999053068894.
[I 2026-05-04 03:52:05,087] Trial 88 finished with value: 0.20195847889983867 and parameters: {'alpha': 202270.47013008967, 'use_snp_selection': False, 'iw_method': 'uniform'}. Best is trial 23 with value: 0.2087999053068894.
[I 2026-05-04 03:54:58,827] Trial 89 finished with value: 0.2009888795302975 and parameters: {'alpha': 291111.1280700249, 'use_snp_selection': False, 'iw_method': 'pc_logistic', 'iw_clip_max': 2.0, 'iw_prob_clip': 0.0008862351615537082, 'iw_n_components': 50, 'iw_logistic_c': 2.983002782692184e-05, 'iw_pca_fit': 'combined', 'iw_solver': 'lbfgs', 'iw_rho': 0.5}. Best is trial 23 with value: 0.2087999053068894.
[I 2026-05-04 03:57:51,665] Trial 90 finished with value: 0.20120212567901335 and parameters: {'alpha': 428798.19005526486, 'use_snp_selection': False, 'iw_method': 'pc_logistic', 'iw_clip_max': 5.0, 'iw_prob_clip': 0.01602624040893058, 'iw_n_components': 30, 'iw_logistic_c': 0.0032088708617073886, 'iw_pca_fit': 'combined', 'iw_solver': 'lbfgs', 'iw_rho': 0.75}. Best is trial 23 with value: 0.2087999053068894.
[I 2026-05-04 04:00:45,042] Trial 91 finished with value: 0.20497701323852677 and parameters: {'alpha': 492287.77595847944, 'use_snp_selection': False, 'iw_method': 'pc_logistic', 'iw_clip_max': 3.0, 'iw_prob_clip': 0.04802390164132208, 'iw_n_components': 50, 'iw_logistic_c': 2.3656765489023003e-06, 'iw_pca_fit': 'combined', 'iw_solver': 'lbfgs', 'iw_rho': 0.5}. Best is trial 23 with value: 0.2087999053068894.
[I 2026-05-04 04:03:45,039] Trial 92 finished with value: 0.20627769163891446 and parameters: {'alpha': 163069.90264271418, 'use_snp_selection': False, 'iw_method': 'pc_logistic', 'iw_clip_max': 3.0, 'iw_prob_clip': 0.035534324989084744, 'iw_n_components': 50, 'iw_logistic_c': 1.1364478389627783, 'iw_pca_fit': 'combined', 'iw_solver': 'lbfgs', 'iw_rho': 0.5}. Best is trial 23 with value: 0.2087999053068894.
[I 2026-05-04 04:06:45,690] Trial 93 finished with value: 0.2067459470100767 and parameters: {'alpha': 158892.20295151704, 'use_snp_selection': False, 'iw_method': 'pc_logistic', 'iw_clip_max': 3.0, 'iw_prob_clip': 0.03193660025592987, 'iw_n_components': 50, 'iw_logistic_c': 2.4852307057390965, 'iw_pca_fit': 'combined', 'iw_solver': 'lbfgs', 'iw_rho': 0.5}. Best is trial 23 with value: 0.2087999053068894.
[I 2026-05-04 04:09:48,088] Trial 94 finished with value: 0.20509153459633445 and parameters: {'alpha': 107308.16645346579, 'use_snp_selection': False, 'iw_method': 'pc_logistic', 'iw_clip_max': 3.0, 'iw_prob_clip': 0.049839421514502324, 'iw_n_components': 60, 'iw_logistic_c': 0.2803751054767617, 'iw_pca_fit': 'combined', 'iw_solver': 'lbfgs', 'iw_rho': 0.5}. Best is trial 23 with value: 0.2087999053068894.
[I 2026-05-04 04:12:48,348] Trial 95 finished with value: 0.20611838309642488 and parameters: {'alpha': 145748.59186676552, 'use_snp_selection': False, 'iw_method': 'pc_logistic', 'iw_clip_max': 2.0, 'iw_prob_clip': 0.041558217646529054, 'iw_n_components': 50, 'iw_logistic_c': 6.128511832947122, 'iw_pca_fit': 'combined', 'iw_solver': 'lbfgs', 'iw_rho': 0.9}. Best is trial 23 with value: 0.2087999053068894.
[I 2026-05-04 04:15:29,868] Trial 96 finished with value: 0.2065468928352645 and parameters: {'alpha': 128579.24322611916, 'use_snp_selection': False, 'iw_method': 'pc_logistic', 'iw_clip_max': 3.0, 'iw_prob_clip': 0.022477206990734983, 'iw_n_components': 10, 'iw_logistic_c': 1.1691694890585733e-06, 'iw_pca_fit': 'combined', 'iw_solver': 'lbfgs', 'iw_rho': 0.5}. Best is trial 23 with value: 0.2087999053068894.
[I 2026-05-04 04:18:29,715] Trial 97 finished with value: 0.20297241095365565 and parameters: {'alpha': 241119.78142363188, 'use_snp_selection': False, 'iw_method': 'pc_logistic', 'iw_clip_max': 3.0, 'iw_prob_clip': 0.01024977752534114, 'iw_n_components': 50, 'iw_logistic_c': 0.49075520304282927, 'iw_pca_fit': 'combined', 'iw_solver': 'lbfgs', 'iw_rho': 0.5}. Best is trial 23 with value: 0.2087999053068894.
[I 2026-05-04 04:21:13,327] Trial 98 finished with value: 0.20081919617541572 and parameters: {'alpha': 377495.80094346014, 'use_snp_selection': False, 'iw_method': 'pc_logistic', 'iw_clip_max': 1.25, 'iw_prob_clip': 0.014040524101493234, 'iw_n_components': 20, 'iw_logistic_c': 4.864694674545022e-07, 'iw_pca_fit': 'combined', 'iw_solver': 'lbfgs', 'iw_rho': 1.0}. Best is trial 23 with value: 0.2087999053068894.
[I 2026-05-04 04:23:57,931] Trial 99 finished with value: 0.20437538437210634 and parameters: {'alpha': 535138.5529295697, 'use_snp_selection': False, 'iw_method': 'pc_logistic', 'iw_clip_max': 2.0, 'iw_prob_clip': 0.026250958414088844, 'iw_n_components': 10, 'iw_logistic_c': 3.2756004236497267, 'iw_pca_fit': 'combined', 'iw_solver': 'lbfgs', 'iw_rho': 0.75}. Best is trial 23 with value: 0.2087999053068894.
[I 2026-05-04 04:26:58,751] Trial 100 finished with value: 0.20721199863200823 and parameters: {'alpha': 222642.74324097857, 'use_snp_selection': False, 'iw_method': 'pc_logistic', 'iw_clip_max': 5.0, 'iw_prob_clip': 0.04410139550042647, 'iw_n_components': 60, 'iw_logistic_c': 1.3084360680607947, 'iw_pca_fit': 'combined', 'iw_solver': 'lbfgs', 'iw_rho': 0.5}. Best is trial 23 with value: 0.2087999053068894.
[I 2026-05-04 04:30:01,558] Trial 101 finished with value: 0.20630887576894952 and parameters: {'alpha': 199012.03341409654, 'use_snp_selection': False, 'iw_method': 'pc_logistic', 'iw_clip_max': 5.0, 'iw_prob_clip': 0.04299669937167703, 'iw_n_components': 60, 'iw_logistic_c': 1.4540425231191854, 'iw_pca_fit': 'combined', 'iw_solver': 'lbfgs', 'iw_rho': 0.5}. Best is trial 23 with value: 0.2087999053068894.
[I 2026-05-04 04:33:05,051] Trial 102 finished with value: 0.20558415272055508 and parameters: {'alpha': 217401.7425944412, 'use_snp_selection': False, 'iw_method': 'pc_logistic', 'iw_clip_max': 5.0, 'iw_prob_clip': 0.030830454742486586, 'iw_n_components': 60, 'iw_logistic_c': 0.1372376506602134, 'iw_pca_fit': 'combined', 'iw_solver': 'lbfgs', 'iw_rho': 0.5}. Best is trial 23 with value: 0.2087999053068894.
[I 2026-05-04 04:36:09,798] Trial 103 finished with value: 0.19925912810846658 and parameters: {'alpha': 315117.59497064183, 'use_snp_selection': False, 'iw_method': 'pc_logistic', 'iw_clip_max': 5.0, 'iw_prob_clip': 0.004536565411533719, 'iw_n_components': 60, 'iw_logistic_c': 0.7369235749340393, 'iw_pca_fit': 'combined', 'iw_solver': 'lbfgs', 'iw_rho': 0.5}. Best is trial 23 with value: 0.2087999053068894.
[I 2026-05-04 04:39:15,518] Trial 104 finished with value: 0.20442828141097272 and parameters: {'alpha': 179291.86792442593, 'use_snp_selection': False, 'iw_method': 'pc_logistic', 'iw_clip_max': 5.0, 'iw_prob_clip': 0.0378674496344632, 'iw_n_components': 60, 'iw_logistic_c': 3.5714191547618923, 'iw_pca_fit': 'combined', 'iw_solver': 'lbfgs', 'iw_rho': 0.5}. Best is trial 23 with value: 0.2087999053068894.
[I 2026-05-04 04:42:29,068] Trial 105 finished with value: 0.2005191235783331 and parameters: {'alpha': 116963.62068103658, 'use_snp_selection': False, 'iw_method': 'pc_logistic', 'iw_clip_max': 3.0, 'iw_prob_clip': 0.034632189143849176, 'iw_n_components': 80, 'iw_logistic_c': 7.429097320767166, 'iw_pca_fit': 'combined', 'iw_solver': 'lbfgs', 'iw_rho': 0.5}. Best is trial 23 with value: 0.2087999053068894.
[I 2026-05-04 04:42:59,925] Trial 106 finished with value: 0.19922445163706842 and parameters: {'alpha': 343858.54996177583, 'use_snp_selection': False, 'iw_method': 'uniform'}. Best is trial 23 with value: 0.2087999053068894.
[I 2026-05-04 04:45:51,938] Trial 107 finished with value: 0.20461836161322053 and parameters: {'alpha': 148389.44600152774, 'use_snp_selection': False, 'iw_method': 'pc_logistic', 'iw_clip_max': 5.0, 'iw_prob_clip': 0.01972182809646133, 'iw_n_components': 50, 'iw_logistic_c': 2.6382079408552085e-07, 'iw_pca_fit': 'combined', 'iw_solver': 'lbfgs', 'iw_rho': 0.75}. Best is trial 23 with value: 0.2087999053068894.
[I 2026-05-04 04:48:51,426] Trial 108 finished with value: 0.20470506790031834 and parameters: {'alpha': 265391.1049656529, 'use_snp_selection': False, 'iw_method': 'pc_logistic', 'iw_clip_max': 1.5, 'iw_prob_clip': 0.0449493690851415, 'iw_n_components': 40, 'iw_logistic_c': 1.8720348444864212, 'iw_pca_fit': 'combined', 'iw_solver': 'lbfgs', 'iw_rho': 0.5}. Best is trial 23 with value: 0.2087999053068894.
[I 2026-05-04 04:51:35,278] Trial 109 finished with value: 0.20900188172275155 and parameters: {'alpha': 448513.1442924557, 'use_snp_selection': False, 'iw_method': 'pc_logistic', 'iw_clip_max': 2.0, 'iw_prob_clip': 0.022593056303586236, 'iw_n_components': 10, 'iw_logistic_c': 1.0219840107349103, 'iw_pca_fit': 'combined', 'iw_solver': 'lbfgs', 'iw_rho': 1.0}. Best is trial 109 with value: 0.20900188172275155.
[I 2026-05-04 04:54:19,648] Trial 110 finished with value: 0.19987792517993994 and parameters: {'alpha': 569622.46332276, 'use_snp_selection': False, 'iw_method': 'pc_logistic', 'iw_clip_max': 2.0, 'iw_prob_clip': 0.0034736221584776125, 'iw_n_components': 10, 'iw_logistic_c': 0.5645835495104641, 'iw_pca_fit': 'combined', 'iw_solver': 'lbfgs', 'iw_rho': 1.0}. Best is trial 109 with value: 0.20900188172275155.
[I 2026-05-04 04:57:04,386] Trial 111 finished with value: 0.207973843528073 and parameters: {'alpha': 441332.29401664186, 'use_snp_selection': False, 'iw_method': 'pc_logistic', 'iw_clip_max': 2.0, 'iw_prob_clip': 0.017643820095617525, 'iw_n_components': 10, 'iw_logistic_c': 0.9217722458814318, 'iw_pca_fit': 'combined', 'iw_solver': 'lbfgs', 'iw_rho': 1.0}. Best is trial 109 with value: 0.20900188172275155.
