[I 2026-05-04 04:55:59,887] Trial 110 finished with value: 0.21489168145359291 and parameters: {'alpha': 737569.2108771942, 'use_snp_selection': False, 'iw_method': 'pc_logistic', 'iw_clip_max': 1.5, 'iw_prob_clip': 0.0006714963469019341, 'iw_n_components': 40, 'iw_logistic_c': 0.0001921039863114815, 'iw_pca_fit': 'combined', 'iw_solver': 'lbfgs', 'iw_rho': 0.9}. Best is trial 72 with value: 0.21867141343040916.
[I 2026-05-04 04:58:36,467] Trial 111 finished with value: 0.21884317706651898 and parameters: {'alpha': 463890.8997165489, 'use_snp_selection': False, 'iw_method': 'pc_logistic', 'iw_clip_max': 1.25, 'iw_prob_clip': 0.000553790516059665, 'iw_n_components': 30, 'iw_logistic_c': 0.03550395431817128, 'iw_pca_fit': 'combined', 'iw_solver': 'lbfgs', 'iw_rho': 0.9}. Best is trial 111 with value: 0.21884317706651898.
[I 2026-05-04 05:01:12,436] Trial 112 finished with value: 0.2160031922425638 and parameters: {'alpha': 238046.2005088657, 'use_snp_selection': False, 'iw_method': 'pc_logistic', 'iw_clip_max': 1.25, 'iw_prob_clip': 0.0005592794512019724, 'iw_n_components': 30, 'iw_logistic_c': 0.02728576300590466, 'iw_pca_fit': 'combined', 'iw_solver': 'lbfgs', 'iw_rho': 0.9}. Best is trial 111 with value: 0.21884317706651898.
[I 2026-05-04 05:03:47,873] Trial 113 finished with value: 0.2163816552818103 and parameters: {'alpha': 420061.27340993885, 'use_snp_selection': False, 'iw_method': 'pc_logistic', 'iw_clip_max': 1.25, 'iw_prob_clip': 0.000552413806022415, 'iw_n_components': 30, 'iw_logistic_c': 0.014044070132110287, 'iw_pca_fit': 'combined', 'iw_solver': 'lbfgs', 'iw_rho': 0.9}. Best is trial 111 with value: 0.21884317706651898.
[I 2026-05-04 05:06:22,528] Trial 114 finished with value: 0.21827084903923288 and parameters: {'alpha': 421760.185448863, 'use_snp_selection': False, 'iw_method': 'pc_logistic', 'iw_clip_max': 1.25, 'iw_prob_clip': 0.0005023884529254152, 'iw_n_components': 30, 'iw_logistic_c': 0.014892125395071783, 'iw_pca_fit': 'combined', 'iw_solver': 'lbfgs', 'iw_rho': 0.9}. Best is trial 111 with value: 0.21884317706651898.
[I 2026-05-04 05:08:57,767] Trial 115 finished with value: 0.21587737222503126 and parameters: {'alpha': 456708.9405335305, 'use_snp_selection': False, 'iw_method': 'pc_logistic', 'iw_clip_max': 1.25, 'iw_prob_clip': 0.0005378773549612119, 'iw_n_components': 30, 'iw_logistic_c': 0.06014081883310036, 'iw_pca_fit': 'combined', 'iw_solver': 'lbfgs', 'iw_rho': 0.9}. Best is trial 111 with value: 0.21884317706651898.
[I 2026-05-04 05:11:32,889] Trial 116 finished with value: 0.2062586621628441 and parameters: {'alpha': 126320.58697019813, 'use_snp_selection': False, 'iw_method': 'pc_logistic', 'iw_clip_max': 1.25, 'iw_prob_clip': 0.0005975966881248662, 'iw_n_components': 30, 'iw_logistic_c': 0.01163404898698989, 'iw_pca_fit': 'combined', 'iw_solver': 'lbfgs', 'iw_rho': 0.75}. Best is trial 111 with value: 0.21884317706651898.
[I 2026-05-04 05:14:08,531] Trial 117 finished with value: 0.2152463108669839 and parameters: {'alpha': 364307.07732827717, 'use_snp_selection': False, 'iw_method': 'pc_logistic', 'iw_clip_max': 1.25, 'iw_prob_clip': 0.0005029370641597737, 'iw_n_components': 30, 'iw_logistic_c': 0.012773405573673857, 'iw_pca_fit': 'combined', 'iw_solver': 'lbfgs', 'iw_rho': 0.9}. Best is trial 111 with value: 0.21884317706651898.
[I 2026-05-04 05:16:44,856] Trial 118 finished with value: 0.21652149793232475 and parameters: {'alpha': 520260.7316360631, 'use_snp_selection': False, 'iw_method': 'pc_logistic', 'iw_clip_max': 1.25, 'iw_prob_clip': 0.000660817517089814, 'iw_n_components': 30, 'iw_logistic_c': 0.08041673275137544, 'iw_pca_fit': 'combined', 'iw_solver': 'lbfgs', 'iw_rho': 0.9}. Best is trial 111 with value: 0.21884317706651898.
[I 2026-05-04 05:19:13,224] Trial 119 finished with value: 0.2142164359953354 and parameters: {'alpha': 618778.9426322181, 'use_snp_selection': False, 'iw_method': 'pc_logistic', 'iw_clip_max': 1.25, 'iw_prob_clip': 0.0006601093608353112, 'iw_n_components': 10, 'iw_logistic_c': 0.17349673922588854, 'iw_pca_fit': 'combined', 'iw_solver': 'lbfgs', 'iw_rho': 0.9}. Best is trial 111 with value: 0.21884317706651898.
[I 2026-05-04 05:21:49,294] Trial 120 finished with value: 0.21084603298968654 and parameters: {'alpha': 474528.1796475314, 'use_snp_selection': False, 'iw_method': 'pc_logistic', 'iw_clip_max': 1.25, 'iw_prob_clip': 0.000811634376622048, 'iw_n_components': 30, 'iw_logistic_c': 0.04019215907633415, 'iw_pca_fit': 'combined', 'iw_solver': 'lbfgs', 'iw_rho': 0.5}. Best is trial 111 with value: 0.21884317706651898.
[I 2026-05-04 05:24:25,265] Trial 121 finished with value: 0.21827456710999077 and parameters: {'alpha': 520532.8822997369, 'use_snp_selection': False, 'iw_method': 'pc_logistic', 'iw_clip_max': 1.25, 'iw_prob_clip': 0.000559698213373345, 'iw_n_components': 30, 'iw_logistic_c': 0.05818509537805514, 'iw_pca_fit': 'combined', 'iw_solver': 'lbfgs', 'iw_rho': 0.9}. Best is trial 111 with value: 0.21884317706651898.
[I 2026-05-04 05:27:00,802] Trial 122 finished with value: 0.21727232701594174 and parameters: {'alpha': 526825.2167886319, 'use_snp_selection': False, 'iw_method': 'pc_logistic', 'iw_clip_max': 1.25, 'iw_prob_clip': 0.0006286311915516947, 'iw_n_components': 30, 'iw_logistic_c': 0.06823851470059282, 'iw_pca_fit': 'combined', 'iw_solver': 'lbfgs', 'iw_rho': 0.9}. Best is trial 111 with value: 0.21884317706651898.
[I 2026-05-04 05:29:36,444] Trial 123 finished with value: 0.21637080148457763 and parameters: {'alpha': 584870.0763403929, 'use_snp_selection': False, 'iw_method': 'pc_logistic', 'iw_clip_max': 1.25, 'iw_prob_clip': 0.0006045812470106284, 'iw_n_components': 30, 'iw_logistic_c': 0.13780174115421023, 'iw_pca_fit': 'combined', 'iw_solver': 'lbfgs', 'iw_rho': 0.9}. Best is trial 111 with value: 0.21884317706651898.
[I 2026-05-04 05:32:13,391] Trial 124 finished with value: 0.21795230883218503 and parameters: {'alpha': 541461.7105230781, 'use_snp_selection': False, 'iw_method': 'pc_logistic', 'iw_clip_max': 1.25, 'iw_prob_clip': 0.0007050929179078872, 'iw_n_components': 30, 'iw_logistic_c': 0.04352706379288866, 'iw_pca_fit': 'combined', 'iw_solver': 'lbfgs', 'iw_rho': 0.9}. Best is trial 111 with value: 0.21884317706651898.
[I 2026-05-04 05:34:48,383] Trial 125 finished with value: 0.21762338691870103 and parameters: {'alpha': 546089.7410176456, 'use_snp_selection': False, 'iw_method': 'pc_logistic', 'iw_clip_max': 1.25, 'iw_prob_clip': 0.000756026645814559, 'iw_n_components': 30, 'iw_logistic_c': 0.053768349103009046, 'iw_pca_fit': 'combined', 'iw_solver': 'lbfgs', 'iw_rho': 0.9}. Best is trial 111 with value: 0.21884317706651898.
[I 2026-05-04 05:37:23,892] Trial 126 finished with value: 0.21784062077467287 and parameters: {'alpha': 537995.801362914, 'use_snp_selection': False, 'iw_method': 'pc_logistic', 'iw_clip_max': 1.25, 'iw_prob_clip': 0.0007422577225133293, 'iw_n_components': 30, 'iw_logistic_c': 0.06616901164672309, 'iw_pca_fit': 'combined', 'iw_solver': 'lbfgs', 'iw_rho': 0.9}. Best is trial 111 with value: 0.21884317706651898.
[I 2026-05-04 05:40:01,073] Trial 127 finished with value: 0.21744248635452598 and parameters: {'alpha': 526976.776898942, 'use_snp_selection': False, 'iw_method': 'pc_logistic', 'iw_clip_max': 1.25, 'iw_prob_clip': 0.0007228978863365304, 'iw_n_components': 30, 'iw_logistic_c': 0.2934189074363273, 'iw_pca_fit': 'combined', 'iw_solver': 'lbfgs', 'iw_rho': 0.9}. Best is trial 111 with value: 0.21884317706651898.
[I 2026-05-04 05:42:35,789] Trial 128 finished with value: 0.21556309038799965 and parameters: {'alpha': 709221.7454545792, 'use_snp_selection': False, 'iw_method': 'pc_logistic', 'iw_clip_max': 1.25, 'iw_prob_clip': 0.0007365409133178405, 'iw_n_components': 30, 'iw_logistic_c': 0.47425853219119374, 'iw_pca_fit': 'combined', 'iw_solver': 'lbfgs', 'iw_rho': 0.9}. Best is trial 111 with value: 0.21884317706651898.
[I 2026-05-04 05:43:03,344] Trial 129 finished with value: 0.19871884654787678 and parameters: {'alpha': 377629.1789724211, 'use_snp_selection': False, 'iw_method': 'uniform'}. Best is trial 111 with value: 0.21884317706651898.
[I 2026-05-04 05:45:38,165] Trial 130 finished with value: 0.20643406828073824 and parameters: {'alpha': 496384.423963025, 'use_snp_selection': False, 'iw_method': 'pc_logistic', 'iw_clip_max': 1.25, 'iw_prob_clip': 0.0008392179132821432, 'iw_n_components': 30, 'iw_logistic_c': 0.3578098976584664, 'iw_pca_fit': 'combined', 'iw_solver': 'lbfgs', 'iw_rho': 1.0}. Best is trial 111 with value: 0.21884317706651898.
[I 2026-05-04 05:48:14,002] Trial 131 finished with value: 0.21698310299984644 and parameters: {'alpha': 542472.0428688857, 'use_snp_selection': False, 'iw_method': 'pc_logistic', 'iw_clip_max': 1.25, 'iw_prob_clip': 0.0005568028440361961, 'iw_n_components': 30, 'iw_logistic_c': 0.9291592777151912, 'iw_pca_fit': 'combined', 'iw_solver': 'lbfgs', 'iw_rho': 0.9}. Best is trial 111 with value: 0.21884317706651898.
[I 2026-05-04 05:50:50,803] Trial 132 finished with value: 0.21583364245711442 and parameters: {'alpha': 445700.3347971944, 'use_snp_selection': False, 'iw_method': 'pc_logistic', 'iw_clip_max': 1.25, 'iw_prob_clip': 0.0007630395513003879, 'iw_n_components': 30, 'iw_logistic_c': 0.05018279600772254, 'iw_pca_fit': 'combined', 'iw_solver': 'lbfgs', 'iw_rho': 0.9}. Best is trial 111 with value: 0.21884317706651898.
[I 2026-05-04 05:53:32,447] Trial 133 finished with value: 0.21620464662679328 and parameters: {'alpha': 521370.0765375774, 'use_snp_selection': False, 'iw_method': 'pc_logistic', 'iw_clip_max': 1.25, 'iw_prob_clip': 0.0006300940125739062, 'iw_n_components': 30, 'iw_logistic_c': 0.24272837506664224, 'iw_pca_fit': 'combined', 'iw_solver': 'lbfgs', 'iw_rho': 0.9}. Best is trial 111 with value: 0.21884317706651898.
[I 2026-05-04 05:56:33,867] Trial 134 finished with value: 0.21801045688807813 and parameters: {'alpha': 620787.1960761104, 'use_snp_selection': False, 'iw_method': 'pc_logistic', 'iw_clip_max': 1.25, 'iw_prob_clip': 0.0006935280539999767, 'iw_n_components': 30, 'iw_logistic_c': 0.07993030709987764, 'iw_pca_fit': 'combined', 'iw_solver': 'lbfgs', 'iw_rho': 0.9}. Best is trial 111 with value: 0.21884317706651898.
[I 2026-05-04 05:59:35,175] Trial 135 finished with value: 0.21472547741291942 and parameters: {'alpha': 654918.7822173863, 'use_snp_selection': False, 'iw_method': 'pc_logistic', 'iw_clip_max': 1.25, 'iw_prob_clip': 0.0005018999122116632, 'iw_n_components': 30, 'iw_logistic_c': 0.10651622738364541, 'iw_pca_fit': 'combined', 'iw_solver': 'lbfgs', 'iw_rho': 0.9}. Best is trial 111 with value: 0.21884317706651898.
[I 2026-05-04 06:02:37,204] Trial 136 finished with value: 0.21525150556738198 and parameters: {'alpha': 780166.6656738394, 'use_snp_selection': False, 'iw_method': 'pc_logistic', 'iw_clip_max': 1.25, 'iw_prob_clip': 0.0006995834469585797, 'iw_n_components': 30, 'iw_logistic_c': 0.03431100322001001, 'iw_pca_fit': 'combined', 'iw_solver': 'lbfgs', 'iw_rho': 0.9}. Best is trial 111 with value: 0.21884317706651898.
[I 2026-05-04 06:05:38,432] Trial 137 finished with value: 0.2131999352159107 and parameters: {'alpha': 843490.6837790809, 'use_snp_selection': False, 'iw_method': 'pc_logistic', 'iw_clip_max': 1.25, 'iw_prob_clip': 0.000902001370642743, 'iw_n_components': 30, 'iw_logistic_c': 0.019186940238134095, 'iw_pca_fit': 'combined', 'iw_solver': 'lbfgs', 'iw_rho': 0.9}. Best is trial 111 with value: 0.21884317706651898.
[I 2026-05-04 06:08:58,105] Trial 138 finished with value: 0.20807000083336344 and parameters: {'alpha': 619388.6241045716, 'use_snp_selection': False, 'iw_method': 'pc_logistic', 'iw_clip_max': 1.25, 'iw_prob_clip': 0.0005729527013113685, 'iw_n_components': 80, 'iw_logistic_c': 0.023678722662029018, 'iw_pca_fit': 'combined', 'iw_solver': 'lbfgs', 'iw_rho': 0.9}. Best is trial 111 with value: 0.21884317706651898.
[I 2026-05-04 06:11:59,612] Trial 139 finished with value: 0.21560032463402554 and parameters: {'alpha': 714349.7065828296, 'use_snp_selection': False, 'iw_method': 'pc_logistic', 'iw_clip_max': 1.25, 'iw_prob_clip': 0.000988310344777541, 'iw_n_components': 30, 'iw_logistic_c': 0.044437608234843634, 'iw_pca_fit': 'combined', 'iw_solver': 'lbfgs', 'iw_rho': 0.9}. Best is trial 111 with value: 0.21884317706651898.
[I 2026-05-04 06:15:00,780] Trial 140 finished with value: 0.2145089946500983 and parameters: {'alpha': 464821.76637504285, 'use_snp_selection': False, 'iw_method': 'pc_logistic', 'iw_clip_max': 1.25, 'iw_prob_clip': 0.0007593694037633583, 'iw_n_components': 30, 'iw_logistic_c': 0.18568890993592174, 'iw_pca_fit': 'combined', 'iw_solver': 'lbfgs', 'iw_rho': 0.75}. Best is trial 111 with value: 0.21884317706651898.
[I 2026-05-04 06:18:02,884] Trial 141 finished with value: 0.2141654118105795 and parameters: {'alpha': 557123.3769193162, 'use_snp_selection': False, 'iw_method': 'pc_logistic', 'iw_clip_max': 1.25, 'iw_prob_clip': 0.000623186471072077, 'iw_n_components': 30, 'iw_logistic_c': 0.06518364047465068, 'iw_pca_fit': 'combined', 'iw_solver': 'lbfgs', 'iw_rho': 0.9}. Best is trial 111 with value: 0.21884317706651898.
[I 2026-05-04 06:21:04,273] Trial 142 finished with value: 0.22023027003868592 and parameters: {'alpha': 670683.8701260977, 'use_snp_selection': False, 'iw_method': 'pc_logistic', 'iw_clip_max': 1.25, 'iw_prob_clip': 0.0006830972040990112, 'iw_n_components': 30, 'iw_logistic_c': 0.08527011340298163, 'iw_pca_fit': 'combined', 'iw_solver': 'lbfgs', 'iw_rho': 0.9}. Best is trial 142 with value: 0.22023027003868592.
[I 2026-05-04 06:24:05,236] Trial 143 finished with value: 0.21589333605505373 and parameters: {'alpha': 676849.2107269338, 'use_snp_selection': False, 'iw_method': 'pc_logistic', 'iw_clip_max': 1.25, 'iw_prob_clip': 0.0006849900501634882, 'iw_n_components': 30, 'iw_logistic_c': 3.4815423221006063, 'iw_pca_fit': 'combined', 'iw_solver': 'lbfgs', 'iw_rho': 0.9}. Best is trial 142 with value: 0.22023027003868592.
[I 2026-05-04 06:27:06,527] Trial 144 finished with value: 0.20199201560569863 and parameters: {'alpha': 749706.3696126695, 'use_snp_selection': False, 'iw_method': 'pc_logistic', 'iw_clip_max': 5.0, 'iw_prob_clip': 0.0005428473129267681, 'iw_n_components': 30, 'iw_logistic_c': 0.11209117464904539, 'iw_pca_fit': 'combined', 'iw_solver': 'lbfgs', 'iw_rho': 0.9}. Best is trial 142 with value: 0.22023027003868592.
[I 2026-05-04 06:30:15,831] Trial 145 finished with value: 0.21164081011006072 and parameters: {'alpha': 628756.91504077, 'use_snp_selection': False, 'iw_method': 'pc_logistic', 'iw_clip_max': 1.25, 'iw_prob_clip': 0.0008376190798563254, 'iw_n_components': 60, 'iw_logistic_c': 0.025435445444310808, 'iw_pca_fit': 'combined', 'iw_solver': 'lbfgs', 'iw_rho': 0.9}. Best is trial 142 with value: 0.22023027003868592.
[I 2026-05-04 06:33:17,407] Trial 146 finished with value: 0.2126645493447535 and parameters: {'alpha': 835301.4768529638, 'use_snp_selection': False, 'iw_method': 'pc_logistic', 'iw_clip_max': 1.25, 'iw_prob_clip': 0.000586331685531872, 'iw_n_components': 30, 'iw_logistic_c': 0.05049466644297032, 'iw_pca_fit': 'combined', 'iw_solver': 'lbfgs', 'iw_rho': 0.9}. Best is trial 142 with value: 0.22023027003868592.
[I 2026-05-04 06:36:17,829] Trial 147 finished with value: 0.21358658585454707 and parameters: {'alpha': 593225.058640426, 'use_snp_selection': False, 'iw_method': 'pc_logistic', 'iw_clip_max': 1.25, 'iw_prob_clip': 0.0007065742216787728, 'iw_n_components': 30, 'iw_logistic_c': 0.2749669626751273, 'iw_pca_fit': 'combined', 'iw_solver': 'lbfgs', 'iw_rho': 0.9}. Best is trial 142 with value: 0.22023027003868592.
[I 2026-05-04 06:39:27,130] Trial 148 finished with value: 0.2112021824450372 and parameters: {'alpha': 423822.72865286533, 'use_snp_selection': False, 'iw_method': 'pc_logistic', 'iw_clip_max': 1.25, 'iw_prob_clip': 0.0007696696258922774, 'iw_n_components': 50, 'iw_logistic_c': 0.09652833886996624, 'iw_pca_fit': 'combined', 'iw_solver': 'lbfgs', 'iw_rho': 0.9}. Best is trial 142 with value: 0.22023027003868592.
[I 2026-05-04 06:42:27,593] Trial 149 finished with value: 0.21676247317050618 and parameters: {'alpha': 670347.4464560647, 'use_snp_selection': False, 'iw_method': 'pc_logistic', 'iw_clip_max': 1.25, 'iw_prob_clip': 0.0005138290567224754, 'iw_n_components': 30, 'iw_logistic_c': 0.006641808870126739, 'iw_pca_fit': 'combined', 'iw_solver': 'lbfgs', 'iw_rho': 0.9}. Best is trial 142 with value: 0.22023027003868592.
