Running from this directory: /cluster/work/simennes/Master_thesis
Name of job: ncv_ridge_iw
ID of job: 24378206
Array task ID: 7
The job was run on these nodes: idun-04-04
[I 2026-05-04 00:17:20,681] Trial 0 finished with value: 0.1973825962872914 and parameters: {'alpha': 574323.565896313, 'use_snp_selection': False, 'iw_method': 'pc_logistic', 'iw_clip_max': 2.0, 'iw_prob_clip': 0.005989214663243749, 'iw_n_components': 20, 'iw_logistic_c': 2.8870927958158354, 'iw_pca_fit': 'combined', 'iw_solver': 'lbfgs', 'iw_rho': 1.0}. Best is trial 0 with value: 0.1973825962872914.
[I 2026-05-04 00:20:09,559] Trial 1 finished with value: 0.19716077174980512 and parameters: {'alpha': 145427.84270397192, 'use_snp_selection': False, 'iw_method': 'pc_logistic', 'iw_clip_max': 2.0, 'iw_prob_clip': 0.0022034134189735897, 'iw_n_components': 10, 'iw_logistic_c': 8.53225823447423, 'iw_pca_fit': 'combined', 'iw_solver': 'lbfgs', 'iw_rho': 1.0}. Best is trial 0 with value: 0.1973825962872914.
[I 2026-05-04 00:23:09,278] Trial 2 finished with value: 0.20221382863388188 and parameters: {'alpha': 337268.1824826383, 'use_snp_selection': False, 'iw_method': 'pc_logistic', 'iw_clip_max': 1.25, 'iw_prob_clip': 0.0011214380556681478, 'iw_n_components': 40, 'iw_logistic_c': 0.0004456301044046966, 'iw_pca_fit': 'combined', 'iw_solver': 'lbfgs', 'iw_rho': 0.5}. Best is trial 2 with value: 0.20221382863388188.
[I 2026-05-04 00:26:06,000] Trial 3 finished with value: 0.19937876964703008 and parameters: {'alpha': 623873.8362358484, 'use_snp_selection': False, 'iw_method': 'pc_logistic', 'iw_clip_max': 2.0, 'iw_prob_clip': 0.0010704282286164728, 'iw_n_components': 30, 'iw_logistic_c': 0.003649078989687946, 'iw_pca_fit': 'combined', 'iw_solver': 'lbfgs', 'iw_rho': 0.9}. Best is trial 2 with value: 0.20221382863388188.
[I 2026-05-04 00:26:37,297] Trial 4 finished with value: 0.18692233728462734 and parameters: {'alpha': 1199521.094898443, 'use_snp_selection': False, 'iw_method': 'uniform'}. Best is trial 2 with value: 0.20221382863388188.
[I 2026-05-04 00:29:39,651] Trial 5 finished with value: 0.20083247540481697 and parameters: {'alpha': 594205.5826125565, 'use_snp_selection': False, 'iw_method': 'pc_logistic', 'iw_clip_max': 1.5, 'iw_prob_clip': 0.017782866059784724, 'iw_n_components': 40, 'iw_logistic_c': 0.3876202021284575, 'iw_pca_fit': 'combined', 'iw_solver': 'lbfgs', 'iw_rho': 0.5}. Best is trial 2 with value: 0.20221382863388188.
[I 2026-05-04 00:32:27,890] Trial 6 finished with value: 0.20163183601993798 and parameters: {'alpha': 102431.18633356069, 'use_snp_selection': False, 'iw_method': 'pc_logistic', 'iw_clip_max': 1.25, 'iw_prob_clip': 0.0017147683107745938, 'iw_n_components': 20, 'iw_logistic_c': 4.32601466983518e-06, 'iw_pca_fit': 'combined', 'iw_solver': 'lbfgs', 'iw_rho': 0.9}. Best is trial 2 with value: 0.20221382863388188.
[I 2026-05-04 00:35:23,405] Trial 7 finished with value: 0.18791956937965995 and parameters: {'alpha': 1830941.3950631474, 'use_snp_selection': False, 'iw_method': 'pc_logistic', 'iw_clip_max': 2.0, 'iw_prob_clip': 0.006357173651119782, 'iw_n_components': 40, 'iw_logistic_c': 1.7003213055010015e-05, 'iw_pca_fit': 'combined', 'iw_solver': 'lbfgs', 'iw_rho': 0.5}. Best is trial 2 with value: 0.20221382863388188.
[I 2026-05-04 00:35:54,640] Trial 8 finished with value: 0.18673293311569833 and parameters: {'alpha': 1221444.8156569519, 'use_snp_selection': False, 'iw_method': 'uniform'}. Best is trial 2 with value: 0.20221382863388188.
[I 2026-05-04 00:36:25,905] Trial 9 finished with value: 0.2019734120819759 and parameters: {'alpha': 201218.30977627521, 'use_snp_selection': False, 'iw_method': 'uniform'}. Best is trial 2 with value: 0.20221382863388188.
[I 2026-05-04 00:36:57,119] Trial 10 finished with value: 0.2001593510498481 and parameters: {'alpha': 299360.6349531665, 'use_snp_selection': False, 'iw_method': 'uniform'}. Best is trial 2 with value: 0.20221382863388188.
[I 2026-05-04 00:37:28,335] Trial 11 finished with value: 0.20097972741517944 and parameters: {'alpha': 258797.99050519007, 'use_snp_selection': False, 'iw_method': 'uniform'}. Best is trial 2 with value: 0.20221382863388188.
[I 2026-05-04 00:37:59,556] Trial 12 finished with value: 0.20132073162634728 and parameters: {'alpha': 240795.7407033407, 'use_snp_selection': False, 'iw_method': 'uniform'}. Best is trial 2 with value: 0.20221382863388188.
[I 2026-05-04 00:38:30,791] Trial 13 finished with value: 0.19925406711777666 and parameters: {'alpha': 342454.3862236704, 'use_snp_selection': False, 'iw_method': 'uniform'}. Best is trial 2 with value: 0.20221382863388188.
[I 2026-05-04 00:41:32,668] Trial 14 finished with value: 0.20326574348076223 and parameters: {'alpha': 172640.14022320343, 'use_snp_selection': False, 'iw_method': 'pc_logistic', 'iw_clip_max': 1.25, 'iw_prob_clip': 0.0006845131669118436, 'iw_n_components': 80, 'iw_logistic_c': 1.266722508279006e-07, 'iw_pca_fit': 'combined', 'iw_solver': 'lbfgs', 'iw_rho': 0.75}. Best is trial 14 with value: 0.20326574348076223.
[I 2026-05-04 00:44:35,722] Trial 15 finished with value: 0.1998586806425899 and parameters: {'alpha': 408193.9854346712, 'use_snp_selection': False, 'iw_method': 'pc_logistic', 'iw_clip_max': 1.25, 'iw_prob_clip': 0.000595758483751843, 'iw_n_components': 80, 'iw_logistic_c': 3.2307650532713104e-07, 'iw_pca_fit': 'combined', 'iw_solver': 'lbfgs', 'iw_rho': 0.75}. Best is trial 14 with value: 0.20326574348076223.
[I 2026-05-04 00:47:44,557] Trial 16 finished with value: 0.19291528348818202 and parameters: {'alpha': 130819.02725146757, 'use_snp_selection': False, 'iw_method': 'pc_logistic', 'iw_clip_max': 3.0, 'iw_prob_clip': 0.0005371591708140125, 'iw_n_components': 80, 'iw_logistic_c': 0.001376228686835329, 'iw_pca_fit': 'combined', 'iw_solver': 'lbfgs', 'iw_rho': 0.75}. Best is trial 14 with value: 0.20326574348076223.
[I 2026-05-04 00:50:40,102] Trial 17 finished with value: 0.20322957813843093 and parameters: {'alpha': 171617.64991891297, 'use_snp_selection': False, 'iw_method': 'pc_logistic', 'iw_clip_max': 5.0, 'iw_prob_clip': 0.0027696358108387285, 'iw_n_components': 60, 'iw_logistic_c': 1.1471907618711869e-07, 'iw_pca_fit': 'combined', 'iw_solver': 'lbfgs', 'iw_rho': 0.75}. Best is trial 14 with value: 0.20326574348076223.
[I 2026-05-04 00:53:35,166] Trial 18 finished with value: 0.20272375154767483 and parameters: {'alpha': 190409.92486762188, 'use_snp_selection': False, 'iw_method': 'pc_logistic', 'iw_clip_max': 5.0, 'iw_prob_clip': 0.03921739620720018, 'iw_n_components': 60, 'iw_logistic_c': 1.6148150754309058e-07, 'iw_pca_fit': 'combined', 'iw_solver': 'lbfgs', 'iw_rho': 0.75}. Best is trial 14 with value: 0.20326574348076223.
[I 2026-05-04 00:56:31,776] Trial 19 finished with value: 0.2025816405735891 and parameters: {'alpha': 148703.9944794531, 'use_snp_selection': False, 'iw_method': 'pc_logistic', 'iw_clip_max': 5.0, 'iw_prob_clip': 0.003124798736546205, 'iw_n_components': 60, 'iw_logistic_c': 6.709127187766471e-06, 'iw_pca_fit': 'combined', 'iw_solver': 'lbfgs', 'iw_rho': 0.75}. Best is trial 14 with value: 0.20326574348076223.
[I 2026-05-04 00:59:28,413] Trial 20 finished with value: 0.18702550590249717 and parameters: {'alpha': 2919360.4328581505, 'use_snp_selection': False, 'iw_method': 'pc_logistic', 'iw_clip_max': 5.0, 'iw_prob_clip': 0.012671634654340128, 'iw_n_components': 50, 'iw_logistic_c': 7.118660094766404e-07, 'iw_pca_fit': 'combined', 'iw_solver': 'lbfgs', 'iw_rho': 0.75}. Best is trial 14 with value: 0.20326574348076223.
[I 2026-05-04 01:02:25,707] Trial 21 finished with value: 0.20259870299859833 and parameters: {'alpha': 183278.01579414605, 'use_snp_selection': False, 'iw_method': 'pc_logistic', 'iw_clip_max': 5.0, 'iw_prob_clip': 0.04459798659117626, 'iw_n_components': 60, 'iw_logistic_c': 1.0588413134626869e-07, 'iw_pca_fit': 'combined', 'iw_solver': 'lbfgs', 'iw_rho': 0.75}. Best is trial 14 with value: 0.20326574348076223.
[I 2026-05-04 01:05:21,108] Trial 22 finished with value: 0.2076652320069511 and parameters: {'alpha': 181331.47432491992, 'use_snp_selection': False, 'iw_method': 'pc_logistic', 'iw_clip_max': 5.0, 'iw_prob_clip': 0.04369680347506808, 'iw_n_components': 60, 'iw_logistic_c': 9.733925099104796e-07, 'iw_pca_fit': 'combined', 'iw_solver': 'lbfgs', 'iw_rho': 0.75}. Best is trial 22 with value: 0.2076652320069511.
[I 2026-05-04 01:08:16,704] Trial 23 finished with value: 0.2087999053068894 and parameters: {'alpha': 132723.77244428764, 'use_snp_selection': False, 'iw_method': 'pc_logistic', 'iw_clip_max': 5.0, 'iw_prob_clip': 0.012421347550749102, 'iw_n_components': 60, 'iw_logistic_c': 1.6832252968482856e-06, 'iw_pca_fit': 'combined', 'iw_solver': 'lbfgs', 'iw_rho': 0.75}. Best is trial 23 with value: 0.2087999053068894.
[I 2026-05-04 01:11:21,538] Trial 24 finished with value: 0.20082893009041128 and parameters: {'alpha': 100524.11666171951, 'use_snp_selection': False, 'iw_method': 'pc_logistic', 'iw_clip_max': 1.5, 'iw_prob_clip': 0.02105212675489889, 'iw_n_components': 80, 'iw_logistic_c': 5.253702471349059e-05, 'iw_pca_fit': 'combined', 'iw_solver': 'lbfgs', 'iw_rho': 0.75}. Best is trial 23 with value: 0.2087999053068894.
[I 2026-05-04 01:14:18,560] Trial 25 finished with value: 0.20658691090951303 and parameters: {'alpha': 125373.00920998256, 'use_snp_selection': False, 'iw_method': 'pc_logistic', 'iw_clip_max': 3.0, 'iw_prob_clip': 0.008574876973780904, 'iw_n_components': 60, 'iw_logistic_c': 1.6194362588675237e-06, 'iw_pca_fit': 'combined', 'iw_solver': 'lbfgs', 'iw_rho': 0.75}. Best is trial 23 with value: 0.2087999053068894.
[I 2026-05-04 01:17:15,877] Trial 26 finished with value: 0.20596378292430334 and parameters: {'alpha': 112794.20049518322, 'use_snp_selection': False, 'iw_method': 'pc_logistic', 'iw_clip_max': 3.0, 'iw_prob_clip': 0.010104403350650798, 'iw_n_components': 60, 'iw_logistic_c': 1.7257545693059922e-06, 'iw_pca_fit': 'combined', 'iw_solver': 'lbfgs', 'iw_rho': 0.75}. Best is trial 23 with value: 0.2087999053068894.
[I 2026-05-04 01:20:14,011] Trial 27 finished with value: 0.20201809223835113 and parameters: {'alpha': 436279.3930001438, 'use_snp_selection': False, 'iw_method': 'pc_logistic', 'iw_clip_max': 3.0, 'iw_prob_clip': 0.022100195582211192, 'iw_n_components': 60, 'iw_logistic_c': 5.005128457935125e-05, 'iw_pca_fit': 'combined', 'iw_solver': 'lbfgs', 'iw_rho': 0.9}. Best is trial 23 with value: 0.2087999053068894.
[I 2026-05-04 01:23:13,113] Trial 28 finished with value: 0.19223745032085934 and parameters: {'alpha': 239870.3557436769, 'use_snp_selection': False, 'iw_method': 'pc_logistic', 'iw_clip_max': 3.0, 'iw_prob_clip': 0.008944573679938174, 'iw_n_components': 60, 'iw_logistic_c': 0.00016478574862787923, 'iw_pca_fit': 'combined', 'iw_solver': 'lbfgs', 'iw_rho': 1.0}. Best is trial 23 with value: 0.2087999053068894.
[I 2026-05-04 01:26:10,564] Trial 29 finished with value: 0.19923382553406693 and parameters: {'alpha': 146881.61512073886, 'use_snp_selection': False, 'iw_method': 'pc_logistic', 'iw_clip_max': 5.0, 'iw_prob_clip': 0.029541005821386978, 'iw_n_components': 30, 'iw_logistic_c': 0.011104390134899911, 'iw_pca_fit': 'combined', 'iw_solver': 'lbfgs', 'iw_rho': 0.75}. Best is trial 23 with value: 0.2087999053068894.
[I 2026-05-04 01:28:54,666] Trial 30 finished with value: 0.2045868717811687 and parameters: {'alpha': 726362.2756053621, 'use_snp_selection': False, 'iw_method': 'pc_logistic', 'iw_clip_max': 5.0, 'iw_prob_clip': 0.014760487698939381, 'iw_n_components': 10, 'iw_logistic_c': 1.8607475338423075e-06, 'iw_pca_fit': 'combined', 'iw_solver': 'lbfgs', 'iw_rho': 0.75}. Best is trial 23 with value: 0.2087999053068894.
[I 2026-05-04 01:31:51,674] Trial 31 finished with value: 0.20707140931350265 and parameters: {'alpha': 121878.73133774353, 'use_snp_selection': False, 'iw_method': 'pc_logistic', 'iw_clip_max': 3.0, 'iw_prob_clip': 0.009714519478393874, 'iw_n_components': 60, 'iw_logistic_c': 1.3491780414178244e-06, 'iw_pca_fit': 'combined', 'iw_solver': 'lbfgs', 'iw_rho': 0.75}. Best is trial 23 with value: 0.2087999053068894.
[I 2026-05-04 01:34:48,521] Trial 32 finished with value: 0.20680788898056135 and parameters: {'alpha': 117418.2880441394, 'use_snp_selection': False, 'iw_method': 'pc_logistic', 'iw_clip_max': 3.0, 'iw_prob_clip': 0.004420649478667617, 'iw_n_components': 60, 'iw_logistic_c': 9.707698782552943e-07, 'iw_pca_fit': 'combined', 'iw_solver': 'lbfgs', 'iw_rho': 0.75}. Best is trial 23 with value: 0.2087999053068894.
[I 2026-05-04 01:37:45,823] Trial 33 finished with value: 0.20016628412829934 and parameters: {'alpha': 134166.7297467753, 'use_snp_selection': False, 'iw_method': 'pc_logistic', 'iw_clip_max': 3.0, 'iw_prob_clip': 0.004183436676684386, 'iw_n_components': 60, 'iw_logistic_c': 1.3461871876575296e-05, 'iw_pca_fit': 'combined', 'iw_solver': 'lbfgs', 'iw_rho': 0.75}. Best is trial 23 with value: 0.2087999053068894.
[I 2026-05-04 01:40:39,228] Trial 34 finished with value: 0.2076090019385429 and parameters: {'alpha': 217503.6237709583, 'use_snp_selection': False, 'iw_method': 'pc_logistic', 'iw_clip_max': 3.0, 'iw_prob_clip': 0.003920087066533977, 'iw_n_components': 50, 'iw_logistic_c': 7.683450426301704e-07, 'iw_pca_fit': 'combined', 'iw_solver': 'lbfgs', 'iw_rho': 0.75}. Best is trial 23 with value: 0.2087999053068894.
[I 2026-05-04 01:43:32,616] Trial 35 finished with value: 0.20715102596177687 and parameters: {'alpha': 208482.0802977843, 'use_snp_selection': False, 'iw_method': 'pc_logistic', 'iw_clip_max': 3.0, 'iw_prob_clip': 0.029114935585298107, 'iw_n_components': 50, 'iw_logistic_c': 6.428920186223538e-07, 'iw_pca_fit': 'combined', 'iw_solver': 'lbfgs', 'iw_rho': 0.75}. Best is trial 23 with value: 0.2087999053068894.
[I 2026-05-04 01:46:26,152] Trial 36 finished with value: 0.2050520797513339 and parameters: {'alpha': 222707.22606020063, 'use_snp_selection': False, 'iw_method': 'pc_logistic', 'iw_clip_max': 5.0, 'iw_prob_clip': 0.027457658467189134, 'iw_n_components': 50, 'iw_logistic_c': 3.985604373250303e-07, 'iw_pca_fit': 'combined', 'iw_solver': 'lbfgs', 'iw_rho': 0.75}. Best is trial 23 with value: 0.2087999053068894.
[I 2026-05-04 01:49:19,397] Trial 37 finished with value: 0.20502672657341253 and parameters: {'alpha': 295219.11882434407, 'use_snp_selection': False, 'iw_method': 'pc_logistic', 'iw_clip_max': 1.5, 'iw_prob_clip': 0.033186494685956594, 'iw_n_components': 50, 'iw_logistic_c': 4.734533079954793e-06, 'iw_pca_fit': 'combined', 'iw_solver': 'lbfgs', 'iw_rho': 1.0}. Best is trial 23 with value: 0.2087999053068894.
[I 2026-05-04 01:52:20,205] Trial 38 finished with value: 0.20860060038476305 and parameters: {'alpha': 496688.5363092342, 'use_snp_selection': False, 'iw_method': 'pc_logistic', 'iw_clip_max': 3.0, 'iw_prob_clip': 0.04874828717600016, 'iw_n_components': 50, 'iw_logistic_c': 0.06152554054678664, 'iw_pca_fit': 'combined', 'iw_solver': 'lbfgs', 'iw_rho': 0.5}. Best is trial 23 with value: 0.2087999053068894.
[I 2026-05-04 01:55:20,964] Trial 39 finished with value: 0.20509868513781093 and parameters: {'alpha': 870023.1688233908, 'use_snp_selection': False, 'iw_method': 'pc_logistic', 'iw_clip_max': 5.0, 'iw_prob_clip': 0.045744668778063484, 'iw_n_components': 50, 'iw_logistic_c': 0.2067603999300341, 'iw_pca_fit': 'combined', 'iw_solver': 'lbfgs', 'iw_rho': 0.5}. Best is trial 23 with value: 0.2087999053068894.
[I 2026-05-04 01:58:10,560] Trial 40 finished with value: 0.20250267705432382 and parameters: {'alpha': 438478.4212886487, 'use_snp_selection': False, 'iw_method': 'pc_logistic', 'iw_clip_max': 2.0, 'iw_prob_clip': 0.0056007092416394825, 'iw_n_components': 20, 'iw_logistic_c': 0.03322731647984572, 'iw_pca_fit': 'combined', 'iw_solver': 'lbfgs', 'iw_rho': 0.5}. Best is trial 23 with value: 0.2087999053068894.
[I 2026-05-04 02:00:52,595] Trial 41 finished with value: 0.2072129325675196 and parameters: {'alpha': 156893.4303756926, 'use_snp_selection': False, 'iw_method': 'pc_logistic', 'iw_clip_max': 3.0, 'iw_prob_clip': 0.04925689297041663, 'iw_n_components': 50, 'iw_logistic_c': 0.2933654265797147, 'iw_pca_fit': 'combined', 'iw_solver': 'lbfgs', 'iw_rho': 0.5}. Best is trial 23 with value: 0.2087999053068894.
[I 2026-05-04 02:03:35,464] Trial 42 finished with value: 0.20624076084154788 and parameters: {'alpha': 160698.56663567183, 'use_snp_selection': False, 'iw_method': 'pc_logistic', 'iw_clip_max': 3.0, 'iw_prob_clip': 0.04780778754441143, 'iw_n_components': 50, 'iw_logistic_c': 1.4902779999268854, 'iw_pca_fit': 'combined', 'iw_solver': 'lbfgs', 'iw_rho': 0.5}. Best is trial 23 with value: 0.2087999053068894.
[I 2026-05-04 02:06:19,028] Trial 43 finished with value: 0.20588561232334407 and parameters: {'alpha': 519307.0962704126, 'use_snp_selection': False, 'iw_method': 'pc_logistic', 'iw_clip_max': 3.0, 'iw_prob_clip': 0.03450173188173706, 'iw_n_components': 50, 'iw_logistic_c': 0.0905274932288445, 'iw_pca_fit': 'combined', 'iw_solver': 'lbfgs', 'iw_rho': 0.5}. Best is trial 23 with value: 0.2087999053068894.
[I 2026-05-04 02:06:47,224] Trial 44 finished with value: 0.20060155874048213 and parameters: {'alpha': 277825.5915943987, 'use_snp_selection': False, 'iw_method': 'uniform'}. Best is trial 23 with value: 0.2087999053068894.
[I 2026-05-04 02:09:29,492] Trial 45 finished with value: 0.20762114817558489 and parameters: {'alpha': 338357.65080064593, 'use_snp_selection': False, 'iw_method': 'pc_logistic', 'iw_clip_max': 3.0, 'iw_prob_clip': 0.022212725689661043, 'iw_n_components': 50, 'iw_logistic_c': 5.528372456658004, 'iw_pca_fit': 'combined', 'iw_solver': 'lbfgs', 'iw_rho': 0.5}. Best is trial 23 with value: 0.2087999053068894.
[I 2026-05-04 02:11:58,677] Trial 46 finished with value: 0.20812415497169182 and parameters: {'alpha': 374655.741017901, 'use_snp_selection': False, 'iw_method': 'pc_logistic', 'iw_clip_max': 2.0, 'iw_prob_clip': 0.02180135421472756, 'iw_n_components': 10, 'iw_logistic_c': 3.6085529758281525, 'iw_pca_fit': 'combined', 'iw_solver': 'lbfgs', 'iw_rho': 0.5}. Best is trial 23 with value: 0.2087999053068894.
[I 2026-05-04 02:12:26,894] Trial 47 finished with value: 0.19896567280985794 and parameters: {'alpha': 356128.81127935176, 'use_snp_selection': False, 'iw_method': 'uniform'}. Best is trial 23 with value: 0.2087999053068894.
[I 2026-05-04 02:14:56,238] Trial 48 finished with value: 0.204963968650888 and parameters: {'alpha': 699942.7866362078, 'use_snp_selection': False, 'iw_method': 'pc_logistic', 'iw_clip_max': 2.0, 'iw_prob_clip': 0.02085108194480158, 'iw_n_components': 10, 'iw_logistic_c': 8.630739853496985, 'iw_pca_fit': 'combined', 'iw_solver': 'lbfgs', 'iw_rho': 0.5}. Best is trial 23 with value: 0.2087999053068894.
[I 2026-05-04 02:17:25,323] Trial 49 finished with value: 0.20798357025535497 and parameters: {'alpha': 501060.152712184, 'use_snp_selection': False, 'iw_method': 'pc_logistic', 'iw_clip_max': 2.0, 'iw_prob_clip': 0.015734776410154663, 'iw_n_components': 10, 'iw_logistic_c': 2.009359343820191, 'iw_pca_fit': 'combined', 'iw_solver': 'lbfgs', 'iw_rho': 0.5}. Best is trial 23 with value: 0.2087999053068894.
[I 2026-05-04 02:17:53,479] Trial 50 finished with value: 0.19538212447022177 and parameters: {'alpha': 536782.0105509775, 'use_snp_selection': False, 'iw_method': 'uniform'}. Best is trial 23 with value: 0.2087999053068894.
[I 2026-05-04 02:20:22,370] Trial 51 finished with value: 0.20268986352663157 and parameters: {'alpha': 985906.9054095638, 'use_snp_selection': False, 'iw_method': 'pc_logistic', 'iw_clip_max': 2.0, 'iw_prob_clip': 0.015214573361173987, 'iw_n_components': 10, 'iw_logistic_c': 1.9459855002111481, 'iw_pca_fit': 'combined', 'iw_solver': 'lbfgs', 'iw_rho': 0.5}. Best is trial 23 with value: 0.2087999053068894.
[I 2026-05-04 02:22:51,467] Trial 52 finished with value: 0.20703930476582993 and parameters: {'alpha': 510348.1022625082, 'use_snp_selection': False, 'iw_method': 'pc_logistic', 'iw_clip_max': 2.0, 'iw_prob_clip': 0.024980945336166734, 'iw_n_components': 10, 'iw_logistic_c': 0.7796752893051022, 'iw_pca_fit': 'combined', 'iw_solver': 'lbfgs', 'iw_rho': 0.5}. Best is trial 23 with value: 0.2087999053068894.
[I 2026-05-04 02:25:22,138] Trial 53 finished with value: 0.20707185525887292 and parameters: {'alpha': 393075.5876187313, 'use_snp_selection': False, 'iw_method': 'pc_logistic', 'iw_clip_max': 2.0, 'iw_prob_clip': 0.017328278446489636, 'iw_n_components': 10, 'iw_logistic_c': 3.9228858671735662, 'iw_pca_fit': 'combined', 'iw_solver': 'lbfgs', 'iw_rho': 0.5}. Best is trial 23 with value: 0.2087999053068894.
[I 2026-05-04 02:28:05,475] Trial 54 finished with value: 0.20423576242153446 and parameters: {'alpha': 595545.9910459411, 'use_snp_selection': False, 'iw_method': 'pc_logistic', 'iw_clip_max': 2.0, 'iw_prob_clip': 0.012092596356615724, 'iw_n_components': 40, 'iw_logistic_c': 4.982815420390108, 'iw_pca_fit': 'combined', 'iw_solver': 'lbfgs', 'iw_rho': 0.5}. Best is trial 23 with value: 0.2087999053068894.
[I 2026-05-04 02:30:35,926] Trial 55 finished with value: 0.20270811154864146 and parameters: {'alpha': 365415.70547666017, 'use_snp_selection': False, 'iw_method': 'pc_logistic', 'iw_clip_max': 1.25, 'iw_prob_clip': 0.007377466398169232, 'iw_n_components': 10, 'iw_logistic_c': 0.09748985863092549, 'iw_pca_fit': 'combined', 'iw_solver': 'lbfgs', 'iw_rho': 0.9}. Best is trial 23 with value: 0.2087999053068894.
[I 2026-05-04 02:33:14,277] Trial 56 finished with value: 0.20507554207331496 and parameters: {'alpha': 464072.2557673235, 'use_snp_selection': False, 'iw_method': 'pc_logistic', 'iw_clip_max': 2.0, 'iw_prob_clip': 0.018692985222420373, 'iw_n_components': 30, 'iw_logistic_c': 0.8346067835124376, 'iw_pca_fit': 'combined', 'iw_solver': 'lbfgs', 'iw_rho': 0.5}. Best is trial 23 with value: 0.2087999053068894.
