Running from this directory: /cluster/work/simennes/Master_thesis
Name of job: ncv_ridge_avggrm
ID of job: 24332641
Array task ID: 9
The job was run on these nodes: idun-03-08
[I 2026-04-22 13:51:13,909] Trial 0 finished with value: 0.13272745900715713 and parameters: {'alpha': 12124.394605078569, 'use_snp_selection': True, 'num_snps': 5442, 'weight_scheme': 'linear', 'weight_clip_max': 5.0, 'weight_linear_min_weight': 0.5849999641604302, 'weight_linear_max_weight': 1.017621356653175}. Best is trial 0 with value: 0.13272745900715713.
[I 2026-04-22 13:53:00,616] Trial 1 finished with value: 0.15681928450035462 and parameters: {'alpha': 109374.19486700959, 'use_snp_selection': True, 'num_snps': 25583, 'weight_scheme': 'minmax', 'weight_clip_max': 5.0, 'weight_minmax_eps': 0.14026014881292506}. Best is trial 1 with value: 0.15681928450035462.
[I 2026-04-22 13:55:35,135] Trial 2 finished with value: 0.1603284237364328 and parameters: {'alpha': 87498.4492964452, 'use_snp_selection': True, 'num_snps': 53815, 'weight_scheme': 'linear', 'weight_clip_max': 5.0, 'weight_linear_min_weight': 0.27089068881512934, 'weight_linear_max_weight': 2.0548794162981476}. Best is trial 2 with value: 0.1603284237364328.
[I 2026-04-22 13:56:38,297] Trial 3 finished with value: 0.16631694521545828 and parameters: {'alpha': 194477.78458557956, 'use_snp_selection': False, 'weight_scheme': 'linear', 'weight_clip_max': None, 'weight_linear_min_weight': 0.21922985165550554, 'weight_linear_max_weight': 1.6260435767424388}. Best is trial 3 with value: 0.16631694521545828.
[I 2026-04-22 13:57:39,345] Trial 4 finished with value: 0.1572097971725069 and parameters: {'alpha': 9421665.195468841, 'use_snp_selection': False, 'weight_scheme': 'minmax', 'weight_clip_max': 5.0, 'weight_minmax_eps': 0.030689801852077123}. Best is trial 3 with value: 0.16631694521545828.
[I 2026-04-22 13:59:01,606] Trial 5 finished with value: 0.13029194760628593 and parameters: {'alpha': 5024.251153421461, 'use_snp_selection': True, 'num_snps': 9046, 'weight_scheme': 'top-heavy', 'weight_clip_max': 10.0, 'weight_topheavy_top_frac': 0.08738114702774886, 'weight_topheavy_low': 0.8991910356358707, 'weight_topheavy_high': 2.2968843007908903}. Best is trial 3 with value: 0.16631694521545828.
[I 2026-04-22 13:59:51,465] Trial 6 finished with value: 0.11804595758810903 and parameters: {'alpha': 16.382429914774185, 'use_snp_selection': False, 'weight_scheme': 'uniform', 'weight_clip_max': 10.0}. Best is trial 3 with value: 0.16631694521545828.
[I 2026-04-22 14:02:09,764] Trial 7 finished with value: 0.1624693911452544 and parameters: {'alpha': 94169.1049689093, 'use_snp_selection': True, 'num_snps': 47654, 'weight_scheme': 'exponential', 'weight_clip_max': 10.0, 'weight_exponential_beta': 2.3870207999558124}. Best is trial 3 with value: 0.16631694521545828.
[I 2026-04-22 14:03:24,289] Trial 8 finished with value: 0.0681364474601315 and parameters: {'alpha': 96.38034897458088, 'use_snp_selection': True, 'num_snps': 5388, 'weight_scheme': 'minmax', 'weight_clip_max': None, 'weight_minmax_eps': 0.07791532902904205}. Best is trial 3 with value: 0.16631694521545828.
[I 2026-04-22 14:04:28,501] Trial 9 finished with value: 0.15874710077064305 and parameters: {'alpha': 2700506.792350819, 'use_snp_selection': False, 'weight_scheme': 'linear', 'weight_clip_max': 5.0, 'weight_linear_min_weight': 0.8693390069349902, 'weight_linear_max_weight': 2.1394245284712112}. Best is trial 3 with value: 0.16631694521545828.
[I 2026-04-22 14:05:20,184] Trial 10 finished with value: 0.12090448265843645 and parameters: {'alpha': 859.5702697532038, 'use_snp_selection': False, 'weight_scheme': 'uniform', 'weight_clip_max': None}. Best is trial 3 with value: 0.16631694521545828.
[I 2026-04-22 14:06:21,252] Trial 11 finished with value: 0.1693971057052775 and parameters: {'alpha': 409602.6639259898, 'use_snp_selection': False, 'weight_scheme': 'exponential', 'weight_clip_max': None, 'weight_exponential_beta': 1.976306722397911}. Best is trial 11 with value: 0.1693971057052775.
[I 2026-04-22 14:07:22,195] Trial 12 finished with value: 0.15712550051228635 and parameters: {'alpha': 680962.8765783042, 'use_snp_selection': False, 'weight_scheme': 'exponential', 'weight_clip_max': None, 'weight_exponential_beta': 0.14549224357588808}. Best is trial 11 with value: 0.1693971057052775.
[I 2026-04-22 14:08:23,807] Trial 13 finished with value: 0.14277085229022993 and parameters: {'alpha': 606844.9385713676, 'use_snp_selection': False, 'weight_scheme': 'exponential', 'weight_clip_max': None, 'weight_exponential_beta': 7.893036257468982}. Best is trial 11 with value: 0.1693971057052775.
[I 2026-04-22 14:09:25,065] Trial 14 finished with value: 0.13889069541897417 and parameters: {'alpha': 9623.523179910808, 'use_snp_selection': False, 'weight_scheme': 'top-heavy', 'weight_clip_max': None, 'weight_topheavy_top_frac': 0.4895739776974001, 'weight_topheavy_low': 0.5303602048894995, 'weight_topheavy_high': 5.909143202235775}. Best is trial 11 with value: 0.1693971057052775.
[I 2026-04-22 14:10:26,466] Trial 15 finished with value: 0.16959709723921176 and parameters: {'alpha': 715721.3874792199, 'use_snp_selection': False, 'weight_scheme': 'linear', 'weight_clip_max': None, 'weight_linear_min_weight': 0.14113035286925918, 'weight_linear_max_weight': 3.64355612642742}. Best is trial 15 with value: 0.16959709723921176.
[I 2026-04-22 14:11:27,289] Trial 16 finished with value: 0.15636788591987133 and parameters: {'alpha': 2403105.9446239355, 'use_snp_selection': False, 'weight_scheme': 'exponential', 'weight_clip_max': None, 'weight_exponential_beta': 4.006553618932866}. Best is trial 15 with value: 0.16959709723921176.
[I 2026-04-22 14:12:29,319] Trial 17 finished with value: 0.14932469036946291 and parameters: {'alpha': 35136.64217601225, 'use_snp_selection': False, 'weight_scheme': 'exponential', 'weight_clip_max': None, 'weight_exponential_beta': 1.3022176600104531}. Best is trial 15 with value: 0.16959709723921176.
[I 2026-04-22 14:13:31,940] Trial 18 finished with value: 0.12382426458826296 and parameters: {'alpha': 1372.558621803536, 'use_snp_selection': False, 'weight_scheme': 'linear', 'weight_clip_max': None, 'weight_linear_min_weight': 0.13336618896534694, 'weight_linear_max_weight': 3.984486295912658}. Best is trial 15 with value: 0.16959709723921176.
[I 2026-04-22 14:14:23,895] Trial 19 finished with value: 0.15548152015865818 and parameters: {'alpha': 686558.4753828485, 'use_snp_selection': False, 'weight_scheme': 'uniform', 'weight_clip_max': None}. Best is trial 15 with value: 0.16959709723921176.
[I 2026-04-22 14:15:28,081] Trial 20 finished with value: 0.15105820330968373 and parameters: {'alpha': 9239144.019991277, 'use_snp_selection': False, 'weight_scheme': 'top-heavy', 'weight_clip_max': 10.0, 'weight_topheavy_top_frac': 0.3105689455947959, 'weight_topheavy_low': 1.1998104203775761, 'weight_topheavy_high': 4.8726329766710075}. Best is trial 15 with value: 0.16959709723921176.
[I 2026-04-22 14:16:32,210] Trial 21 finished with value: 0.16775950243976115 and parameters: {'alpha': 242226.0703956862, 'use_snp_selection': False, 'weight_scheme': 'linear', 'weight_clip_max': None, 'weight_linear_min_weight': 0.3237404288657081, 'weight_linear_max_weight': 3.9590881229398134}. Best is trial 15 with value: 0.16959709723921176.
[I 2026-04-22 14:17:35,732] Trial 22 finished with value: 0.1666485347355662 and parameters: {'alpha': 1502656.303562496, 'use_snp_selection': False, 'weight_scheme': 'linear', 'weight_clip_max': None, 'weight_linear_min_weight': 0.4321902038751166, 'weight_linear_max_weight': 3.8643154151318218}. Best is trial 15 with value: 0.16959709723921176.
[I 2026-04-22 14:18:38,722] Trial 23 finished with value: 0.1675127458748797 and parameters: {'alpha': 250455.24317934812, 'use_snp_selection': False, 'weight_scheme': 'linear', 'weight_clip_max': None, 'weight_linear_min_weight': 0.42746963966086127, 'weight_linear_max_weight': 3.1888253128154793}. Best is trial 15 with value: 0.16959709723921176.
[I 2026-04-22 14:19:42,163] Trial 24 finished with value: 0.148291318517446 and parameters: {'alpha': 26123.769454513407, 'use_snp_selection': False, 'weight_scheme': 'linear', 'weight_clip_max': None, 'weight_linear_min_weight': 0.10858513812770607, 'weight_linear_max_weight': 3.1686351735319507}. Best is trial 15 with value: 0.16959709723921176.
[I 2026-04-22 14:20:44,711] Trial 25 finished with value: 0.15120139568060273 and parameters: {'alpha': 610372.0237945298, 'use_snp_selection': False, 'weight_scheme': 'exponential', 'weight_clip_max': None, 'weight_exponential_beta': 6.083367043325115}. Best is trial 15 with value: 0.16959709723921176.
[I 2026-04-22 14:21:49,321] Trial 26 finished with value: 0.16307844829258195 and parameters: {'alpha': 3170562.5089928084, 'use_snp_selection': False, 'weight_scheme': 'linear', 'weight_clip_max': None, 'weight_linear_min_weight': 0.3690991414990106, 'weight_linear_max_weight': 3.2477716201001714}. Best is trial 15 with value: 0.16959709723921176.
[I 2026-04-22 14:22:53,375] Trial 27 finished with value: 0.15187084977175594 and parameters: {'alpha': 40875.15988444205, 'use_snp_selection': False, 'weight_scheme': 'linear', 'weight_clip_max': None, 'weight_linear_min_weight': 0.6263504192909412, 'weight_linear_max_weight': 3.5578250785600303}. Best is trial 15 with value: 0.16959709723921176.
[I 2026-04-22 14:23:52,463] Trial 28 finished with value: 0.16583027631592703 and parameters: {'alpha': 321247.9722042909, 'use_snp_selection': False, 'weight_scheme': 'exponential', 'weight_clip_max': None, 'weight_exponential_beta': 3.46371412823932}. Best is trial 15 with value: 0.16959709723921176.
[I 2026-04-22 14:25:58,670] Trial 29 finished with value: 0.13766496743191312 and parameters: {'alpha': 10501.131189073287, 'use_snp_selection': True, 'num_snps': 35465, 'weight_scheme': 'linear', 'weight_clip_max': 10.0, 'weight_linear_min_weight': 0.29664260046200647, 'weight_linear_max_weight': 2.6271200152203913}. Best is trial 15 with value: 0.16959709723921176.
[I 2026-04-22 14:26:49,832] Trial 30 finished with value: 0.1265041855562312 and parameters: {'alpha': 3295.069087306639, 'use_snp_selection': False, 'weight_scheme': 'uniform', 'weight_clip_max': 5.0}. Best is trial 15 with value: 0.16959709723921176.
[I 2026-04-22 14:27:53,572] Trial 31 finished with value: 0.16847834513052082 and parameters: {'alpha': 349312.00041644514, 'use_snp_selection': False, 'weight_scheme': 'linear', 'weight_clip_max': None, 'weight_linear_min_weight': 0.4279846476099573, 'weight_linear_max_weight': 3.107516918965431}. Best is trial 15 with value: 0.16959709723921176.
[I 2026-04-22 14:28:56,200] Trial 32 finished with value: 0.16619144040602024 and parameters: {'alpha': 1505119.4986403205, 'use_snp_selection': False, 'weight_scheme': 'linear', 'weight_clip_max': None, 'weight_linear_min_weight': 0.5006553508322841, 'weight_linear_max_weight': 3.5820135952761483}. Best is trial 15 with value: 0.16959709723921176.
[I 2026-04-22 14:29:53,502] Trial 33 finished with value: 0.16459285609889093 and parameters: {'alpha': 141350.61037619092, 'use_snp_selection': False, 'weight_scheme': 'linear', 'weight_clip_max': None, 'weight_linear_min_weight': 0.27298033130700794, 'weight_linear_max_weight': 2.8884759645725087}. Best is trial 15 with value: 0.16959709723921176.
[I 2026-04-22 14:31:37,238] Trial 34 finished with value: 0.15193653323853865 and parameters: {'alpha': 64831.47086435599, 'use_snp_selection': True, 'num_snps': 23670, 'weight_scheme': 'minmax', 'weight_clip_max': None, 'weight_minmax_eps': 0.19110140424105435}. Best is trial 15 with value: 0.16959709723921176.
[I 2026-04-22 14:32:38,579] Trial 35 finished with value: 0.16663262285297883 and parameters: {'alpha': 248156.18472127174, 'use_snp_selection': False, 'weight_scheme': 'linear', 'weight_clip_max': 5.0, 'weight_linear_min_weight': 0.7661648678516985, 'weight_linear_max_weight': 3.5579359367127625}. Best is trial 15 with value: 0.16959709723921176.
[I 2026-04-22 14:33:35,845] Trial 36 finished with value: 0.1684380516820017 and parameters: {'alpha': 1168062.047082014, 'use_snp_selection': False, 'weight_scheme': 'linear', 'weight_clip_max': None, 'weight_linear_min_weight': 0.185969392771271, 'weight_linear_max_weight': 3.9805052518252655}. Best is trial 15 with value: 0.16959709723921176.
[I 2026-04-22 14:35:46,504] Trial 37 finished with value: 0.1467847736472487 and parameters: {'alpha': 5164500.790023428, 'use_snp_selection': True, 'num_snps': 39811, 'weight_scheme': 'top-heavy', 'weight_clip_max': 5.0, 'weight_topheavy_top_frac': 0.1148785677311325, 'weight_topheavy_low': 0.5029807285243505, 'weight_topheavy_high': 1.3033046421274381}. Best is trial 15 with value: 0.16959709723921176.
[I 2026-04-22 14:36:44,788] Trial 38 finished with value: 0.16847179309000804 and parameters: {'alpha': 1234717.9208181782, 'use_snp_selection': False, 'weight_scheme': 'minmax', 'weight_clip_max': None, 'weight_minmax_eps': 0.014698948990272478}. Best is trial 15 with value: 0.16959709723921176.
[I 2026-04-22 14:39:25,811] Trial 39 finished with value: 0.15897418791053317 and parameters: {'alpha': 77578.04588068658, 'use_snp_selection': True, 'num_snps': 59880, 'weight_scheme': 'minmax', 'weight_clip_max': 10.0, 'weight_minmax_eps': 0.00750812199949786}. Best is trial 15 with value: 0.16959709723921176.
[I 2026-04-22 14:40:27,810] Trial 40 finished with value: 0.16080520205218254 and parameters: {'alpha': 5648067.988858254, 'use_snp_selection': False, 'weight_scheme': 'minmax', 'weight_clip_max': None, 'weight_minmax_eps': 0.07089824784925916}. Best is trial 15 with value: 0.16959709723921176.
[I 2026-04-22 14:41:30,024] Trial 41 finished with value: 0.16948146085459218 and parameters: {'alpha': 789085.0380344094, 'use_snp_selection': False, 'weight_scheme': 'minmax', 'weight_clip_max': None, 'weight_minmax_eps': 0.036714710213079926}. Best is trial 15 with value: 0.16959709723921176.
[I 2026-04-22 14:42:31,878] Trial 42 finished with value: 0.16860692701975777 and parameters: {'alpha': 1144099.4914677152, 'use_snp_selection': False, 'weight_scheme': 'minmax', 'weight_clip_max': None, 'weight_minmax_eps': 0.03524034357271849}. Best is trial 15 with value: 0.16959709723921176.
[I 2026-04-22 14:43:33,408] Trial 43 finished with value: 0.16943082476262608 and parameters: {'alpha': 406489.9587679156, 'use_snp_selection': False, 'weight_scheme': 'minmax', 'weight_clip_max': None, 'weight_minmax_eps': 0.05166178404236842}. Best is trial 15 with value: 0.16959709723921176.
[I 2026-04-22 14:44:35,243] Trial 44 finished with value: 0.16511663588716455 and parameters: {'alpha': 146857.21662694513, 'use_snp_selection': False, 'weight_scheme': 'minmax', 'weight_clip_max': None, 'weight_minmax_eps': 0.048791912425817256}. Best is trial 15 with value: 0.16959709723921176.
[I 2026-04-22 14:45:38,276] Trial 45 finished with value: 0.16968090137311337 and parameters: {'alpha': 538086.1570148697, 'use_snp_selection': False, 'weight_scheme': 'minmax', 'weight_clip_max': None, 'weight_minmax_eps': 0.052368193154811414}. Best is trial 45 with value: 0.16968090137311337.
[I 2026-04-22 14:46:39,166] Trial 46 finished with value: 0.16928361408843096 and parameters: {'alpha': 446476.4882725509, 'use_snp_selection': False, 'weight_scheme': 'minmax', 'weight_clip_max': 5.0, 'weight_minmax_eps': 0.10155799959065874}. Best is trial 45 with value: 0.16968090137311337.
[I 2026-04-22 14:47:37,100] Trial 47 finished with value: 0.1185599520090415 and parameters: {'alpha': 111.12678645750782, 'use_snp_selection': False, 'weight_scheme': 'minmax', 'weight_clip_max': 10.0, 'weight_minmax_eps': 0.0636473800617667}. Best is trial 45 with value: 0.16968090137311337.
[I 2026-04-22 14:49:18,211] Trial 48 finished with value: 0.15427926707033826 and parameters: {'alpha': 2780280.301140697, 'use_snp_selection': True, 'num_snps': 17348, 'weight_scheme': 'minmax', 'weight_clip_max': None, 'weight_minmax_eps': 0.10430628019728151}. Best is trial 45 with value: 0.16968090137311337.
[I 2026-04-22 14:50:20,536] Trial 49 finished with value: 0.16253949711601068 and parameters: {'alpha': 104617.50721957433, 'use_snp_selection': False, 'weight_scheme': 'minmax', 'weight_clip_max': None, 'weight_minmax_eps': 0.04941536938216741}. Best is trial 45 with value: 0.16968090137311337.
[I 2026-04-22 14:51:22,138] Trial 50 finished with value: 0.15229164236646014 and parameters: {'alpha': 748475.8251195925, 'use_snp_selection': False, 'weight_scheme': 'exponential', 'weight_clip_max': None, 'weight_exponential_beta': 5.548602722107475}. Best is trial 45 with value: 0.16968090137311337.
[I 2026-04-22 14:52:23,097] Trial 51 finished with value: 0.1692631069524468 and parameters: {'alpha': 610761.6220868867, 'use_snp_selection': False, 'weight_scheme': 'minmax', 'weight_clip_max': 5.0, 'weight_minmax_eps': 0.10783767388487107}. Best is trial 45 with value: 0.16968090137311337.
[I 2026-04-22 14:53:25,172] Trial 52 finished with value: 0.16881652363009678 and parameters: {'alpha': 368805.7543308738, 'use_snp_selection': False, 'weight_scheme': 'minmax', 'weight_clip_max': 5.0, 'weight_minmax_eps': 0.12929144714519825}. Best is trial 45 with value: 0.16968090137311337.
[I 2026-04-22 14:54:27,084] Trial 53 finished with value: 0.16942065065552792 and parameters: {'alpha': 455008.19484593056, 'use_snp_selection': False, 'weight_scheme': 'minmax', 'weight_clip_max': 5.0, 'weight_minmax_eps': 0.08368112664795305}. Best is trial 45 with value: 0.16968090137311337.
[I 2026-04-22 14:55:28,882] Trial 54 finished with value: 0.14483160954358934 and parameters: {'alpha': 20285.20362146132, 'use_snp_selection': False, 'weight_scheme': 'minmax', 'weight_clip_max': 5.0, 'weight_minmax_eps': 0.07482873322685128}. Best is trial 45 with value: 0.16968090137311337.
[I 2026-04-22 14:56:30,752] Trial 55 finished with value: 0.15637308158840452 and parameters: {'alpha': 55008.732948061166, 'use_snp_selection': False, 'weight_scheme': 'minmax', 'weight_clip_max': 5.0, 'weight_minmax_eps': 0.04588071703172335}. Best is trial 45 with value: 0.16968090137311337.
[I 2026-04-22 14:57:21,410] Trial 56 finished with value: 0.15691437996365504 and parameters: {'alpha': 165567.34369184266, 'use_snp_selection': False, 'weight_scheme': 'uniform', 'weight_clip_max': None}. Best is trial 45 with value: 0.16968090137311337.
[I 2026-04-22 14:58:22,935] Trial 57 finished with value: 0.15319308582355257 and parameters: {'alpha': 5212276.718712801, 'use_snp_selection': False, 'weight_scheme': 'top-heavy', 'weight_clip_max': None, 'weight_topheavy_top_frac': 0.45792927801586275, 'weight_topheavy_low': 1.1939054250248757, 'weight_topheavy_high': 3.54349893412191}. Best is trial 45 with value: 0.16968090137311337.
[I 2026-04-22 14:59:24,656] Trial 58 finished with value: 0.16737808304916973 and parameters: {'alpha': 2201282.9760102816, 'use_snp_selection': False, 'weight_scheme': 'exponential', 'weight_clip_max': 10.0, 'weight_exponential_beta': 2.348932861234715}. Best is trial 45 with value: 0.16968090137311337.
[I 2026-04-22 15:00:27,126] Trial 59 finished with value: 0.16936499450241474 and parameters: {'alpha': 868874.5993221034, 'use_snp_selection': False, 'weight_scheme': 'minmax', 'weight_clip_max': None, 'weight_minmax_eps': 0.02374889636377813}. Best is trial 45 with value: 0.16968090137311337.
[I 2026-04-22 15:01:29,549] Trial 60 finished with value: 0.15289935712616204 and parameters: {'alpha': 1799782.5442603899, 'use_snp_selection': False, 'weight_scheme': 'exponential', 'weight_clip_max': 5.0, 'weight_exponential_beta': 0.12487904848407139}. Best is trial 45 with value: 0.16968090137311337.
[I 2026-04-22 15:02:30,857] Trial 61 finished with value: 0.16935956684961279 and parameters: {'alpha': 868868.8514060953, 'use_snp_selection': False, 'weight_scheme': 'minmax', 'weight_clip_max': None, 'weight_minmax_eps': 0.025337625264067454}. Best is trial 45 with value: 0.16968090137311337.
[I 2026-04-22 15:03:33,196] Trial 62 finished with value: 0.16952072490887055 and parameters: {'alpha': 433730.95321412844, 'use_snp_selection': False, 'weight_scheme': 'minmax', 'weight_clip_max': None, 'weight_minmax_eps': 0.002391689586562884}. Best is trial 45 with value: 0.16968090137311337.
[I 2026-04-22 15:04:35,136] Trial 63 finished with value: 0.16964958586728554 and parameters: {'alpha': 483846.8806906319, 'use_snp_selection': False, 'weight_scheme': 'minmax', 'weight_clip_max': None, 'weight_minmax_eps': 0.002313990580567908}. Best is trial 45 with value: 0.16968090137311337.
[I 2026-04-22 15:05:35,134] Trial 64 finished with value: 0.1667642489644981 and parameters: {'alpha': 191206.960967997, 'use_snp_selection': False, 'weight_scheme': 'minmax', 'weight_clip_max': None, 'weight_minmax_eps': 0.0021830853832983076}. Best is trial 45 with value: 0.16968090137311337.
[I 2026-04-22 15:06:34,464] Trial 65 finished with value: 0.1695950196067579 and parameters: {'alpha': 463328.82241147506, 'use_snp_selection': False, 'weight_scheme': 'minmax', 'weight_clip_max': None, 'weight_minmax_eps': 0.0001698080903895366}. Best is trial 45 with value: 0.16968090137311337.
[I 2026-04-22 15:07:32,142] Trial 66 finished with value: 0.1627478605635466 and parameters: {'alpha': 104144.74531236444, 'use_snp_selection': False, 'weight_scheme': 'minmax', 'weight_clip_max': None, 'weight_minmax_eps': 0.0038441204429195824}. Best is trial 45 with value: 0.16968090137311337.
[I 2026-04-22 15:09:48,965] Trial 67 finished with value: 0.16700016699489056 and parameters: {'alpha': 270239.0376061703, 'use_snp_selection': True, 'num_snps': 43745, 'weight_scheme': 'minmax', 'weight_clip_max': None, 'weight_minmax_eps': 0.016653943940095645}. Best is trial 45 with value: 0.16968090137311337.
