[I 2026-05-04 04:56:57,023] Trial 117 finished with value: 0.25482291954680947 and parameters: {'alpha': 175865.55849055757, 'use_snp_selection': False, 'iw_method': 'pc_logistic', 'iw_clip_max': 5.0, 'iw_prob_clip': 0.006310021456189832, 'iw_n_components': 50, 'iw_logistic_c': 2.2945371154689484e-07, 'iw_pca_fit': 'combined', 'iw_solver': 'lbfgs', 'iw_rho': 1.0}. Best is trial 101 with value: 0.26115674533355865.
[I 2026-05-04 05:00:00,752] Trial 118 finished with value: 0.25667954459966824 and parameters: {'alpha': 141792.23683867577, 'use_snp_selection': False, 'iw_method': 'pc_logistic', 'iw_clip_max': 2.0, 'iw_prob_clip': 0.00985288564189307, 'iw_n_components': 50, 'iw_logistic_c': 3.8589336223659154e-07, 'iw_pca_fit': 'combined', 'iw_solver': 'lbfgs', 'iw_rho': 1.0}. Best is trial 101 with value: 0.26115674533355865.
[I 2026-05-04 05:03:01,707] Trial 119 finished with value: 0.2544288858549583 and parameters: {'alpha': 148536.02935184597, 'use_snp_selection': False, 'iw_method': 'pc_logistic', 'iw_clip_max': 5.0, 'iw_prob_clip': 0.002795363299754178, 'iw_n_components': 50, 'iw_logistic_c': 5.024248096187511e-06, 'iw_pca_fit': 'combined', 'iw_solver': 'lbfgs', 'iw_rho': 1.0}. Best is trial 101 with value: 0.26115674533355865.
[I 2026-05-04 05:05:38,141] Trial 120 finished with value: 0.25447906240240764 and parameters: {'alpha': 112952.21760269674, 'use_snp_selection': False, 'iw_method': 'pc_logistic', 'iw_clip_max': 5.0, 'iw_prob_clip': 0.006972341514249387, 'iw_n_components': 50, 'iw_logistic_c': 1.0883622187610839e-07, 'iw_pca_fit': 'combined', 'iw_solver': 'lbfgs', 'iw_rho': 1.0}. Best is trial 101 with value: 0.26115674533355865.
[I 2026-05-04 05:08:14,490] Trial 121 finished with value: 0.2604994722131413 and parameters: {'alpha': 162520.16429587873, 'use_snp_selection': False, 'iw_method': 'pc_logistic', 'iw_clip_max': 5.0, 'iw_prob_clip': 0.00748779838447878, 'iw_n_components': 50, 'iw_logistic_c': 2.167988378809968e-06, 'iw_pca_fit': 'combined', 'iw_solver': 'lbfgs', 'iw_rho': 1.0}. Best is trial 101 with value: 0.26115674533355865.
[I 2026-05-04 05:10:51,144] Trial 122 finished with value: 0.2602847823783071 and parameters: {'alpha': 125282.64216203318, 'use_snp_selection': False, 'iw_method': 'pc_logistic', 'iw_clip_max': 5.0, 'iw_prob_clip': 0.004405090007749025, 'iw_n_components': 50, 'iw_logistic_c': 1.5330841708365085e-06, 'iw_pca_fit': 'combined', 'iw_solver': 'lbfgs', 'iw_rho': 1.0}. Best is trial 101 with value: 0.26115674533355865.
[I 2026-05-04 05:13:28,072] Trial 123 finished with value: 0.2511510786127298 and parameters: {'alpha': 160886.74080068152, 'use_snp_selection': False, 'iw_method': 'pc_logistic', 'iw_clip_max': 5.0, 'iw_prob_clip': 0.005329233443536706, 'iw_n_components': 50, 'iw_logistic_c': 7.800163164214754e-06, 'iw_pca_fit': 'combined', 'iw_solver': 'lbfgs', 'iw_rho': 1.0}. Best is trial 101 with value: 0.26115674533355865.
[I 2026-05-04 05:16:04,359] Trial 124 finished with value: 0.2594321706956301 and parameters: {'alpha': 186535.05815486555, 'use_snp_selection': False, 'iw_method': 'pc_logistic', 'iw_clip_max': 5.0, 'iw_prob_clip': 0.008041382871737073, 'iw_n_components': 50, 'iw_logistic_c': 8.47467126195291e-07, 'iw_pca_fit': 'combined', 'iw_solver': 'lbfgs', 'iw_rho': 1.0}. Best is trial 101 with value: 0.26115674533355865.
[I 2026-05-04 05:18:40,830] Trial 125 finished with value: 0.25913517401139796 and parameters: {'alpha': 174491.4865109567, 'use_snp_selection': False, 'iw_method': 'pc_logistic', 'iw_clip_max': 5.0, 'iw_prob_clip': 0.005979897086050061, 'iw_n_components': 50, 'iw_logistic_c': 3.2549889230394018e-06, 'iw_pca_fit': 'combined', 'iw_solver': 'lbfgs', 'iw_rho': 0.5}. Best is trial 101 with value: 0.26115674533355865.
[I 2026-05-04 05:21:17,926] Trial 126 finished with value: 0.2602807218061919 and parameters: {'alpha': 143257.6520034537, 'use_snp_selection': False, 'iw_method': 'pc_logistic', 'iw_clip_max': 5.0, 'iw_prob_clip': 0.0074680069869841065, 'iw_n_components': 40, 'iw_logistic_c': 1.2775035623299033e-06, 'iw_pca_fit': 'combined', 'iw_solver': 'lbfgs', 'iw_rho': 1.0}. Best is trial 101 with value: 0.26115674533355865.
[I 2026-05-04 05:23:55,431] Trial 127 finished with value: 0.25825049588700044 and parameters: {'alpha': 215901.9942178726, 'use_snp_selection': False, 'iw_method': 'pc_logistic', 'iw_clip_max': 3.0, 'iw_prob_clip': 0.006589088784635994, 'iw_n_components': 50, 'iw_logistic_c': 2.054198302427923e-06, 'iw_pca_fit': 'combined', 'iw_solver': 'lbfgs', 'iw_rho': 0.9}. Best is trial 101 with value: 0.26115674533355865.
[I 2026-05-04 05:26:33,132] Trial 128 finished with value: 0.25410126081031464 and parameters: {'alpha': 191290.6018620438, 'use_snp_selection': False, 'iw_method': 'pc_logistic', 'iw_clip_max': 1.5, 'iw_prob_clip': 0.008493624343488796, 'iw_n_components': 50, 'iw_logistic_c': 1.3827568962974509e-05, 'iw_pca_fit': 'combined', 'iw_solver': 'lbfgs', 'iw_rho': 1.0}. Best is trial 101 with value: 0.26115674533355865.
[I 2026-05-04 05:29:00,230] Trial 129 finished with value: 0.25685059565775487 and parameters: {'alpha': 162284.46174110234, 'use_snp_selection': False, 'iw_method': 'pc_logistic', 'iw_clip_max': 5.0, 'iw_prob_clip': 0.009139462236766475, 'iw_n_components': 10, 'iw_logistic_c': 4.723629971636628e-07, 'iw_pca_fit': 'combined', 'iw_solver': 'lbfgs', 'iw_rho': 1.0}. Best is trial 101 with value: 0.26115674533355865.
[I 2026-05-04 05:31:42,835] Trial 130 finished with value: 0.22894868383780675 and parameters: {'alpha': 204407.32429055808, 'use_snp_selection': False, 'iw_method': 'pc_logistic', 'iw_clip_max': 5.0, 'iw_prob_clip': 0.010863953749852072, 'iw_n_components': 50, 'iw_logistic_c': 0.01799613509791429, 'iw_pca_fit': 'combined', 'iw_solver': 'lbfgs', 'iw_rho': 1.0}. Best is trial 101 with value: 0.26115674533355865.
[I 2026-05-04 05:34:20,280] Trial 131 finished with value: 0.2601817155460028 and parameters: {'alpha': 122256.10653541089, 'use_snp_selection': False, 'iw_method': 'pc_logistic', 'iw_clip_max': 5.0, 'iw_prob_clip': 0.004413184061730458, 'iw_n_components': 50, 'iw_logistic_c': 1.4610249289586817e-06, 'iw_pca_fit': 'combined', 'iw_solver': 'lbfgs', 'iw_rho': 1.0}. Best is trial 101 with value: 0.26115674533355865.
[I 2026-05-04 05:36:57,196] Trial 132 finished with value: 0.2588643750618961 and parameters: {'alpha': 129039.03173081939, 'use_snp_selection': False, 'iw_method': 'pc_logistic', 'iw_clip_max': 5.0, 'iw_prob_clip': 0.003898922221701373, 'iw_n_components': 50, 'iw_logistic_c': 7.566142191729383e-07, 'iw_pca_fit': 'combined', 'iw_solver': 'lbfgs', 'iw_rho': 1.0}. Best is trial 101 with value: 0.26115674533355865.
[I 2026-05-04 05:39:34,807] Trial 133 finished with value: 0.2543042463800407 and parameters: {'alpha': 153407.03119636516, 'use_snp_selection': False, 'iw_method': 'pc_logistic', 'iw_clip_max': 5.0, 'iw_prob_clip': 0.005327018634390961, 'iw_n_components': 50, 'iw_logistic_c': 4.903232210430703e-06, 'iw_pca_fit': 'combined', 'iw_solver': 'lbfgs', 'iw_rho': 1.0}. Best is trial 101 with value: 0.26115674533355865.
[I 2026-05-04 05:42:12,437] Trial 134 finished with value: 0.26081071751666995 and parameters: {'alpha': 169775.14272904707, 'use_snp_selection': False, 'iw_method': 'pc_logistic', 'iw_clip_max': 5.0, 'iw_prob_clip': 0.006108170365069982, 'iw_n_components': 50, 'iw_logistic_c': 2.0324616684290627e-06, 'iw_pca_fit': 'combined', 'iw_solver': 'lbfgs', 'iw_rho': 1.0}. Best is trial 101 with value: 0.26115674533355865.
[I 2026-05-04 05:44:41,339] Trial 135 finished with value: 0.2586543111280877 and parameters: {'alpha': 180405.07606412444, 'use_snp_selection': False, 'iw_method': 'pc_logistic', 'iw_clip_max': 5.0, 'iw_prob_clip': 0.006054016629005446, 'iw_n_components': 20, 'iw_logistic_c': 2.620418031830887e-06, 'iw_pca_fit': 'combined', 'iw_solver': 'lbfgs', 'iw_rho': 0.9}. Best is trial 101 with value: 0.26115674533355865.
[I 2026-05-04 05:47:20,794] Trial 136 finished with value: 0.2368769478172616 and parameters: {'alpha': 169523.70357675882, 'use_snp_selection': False, 'iw_method': 'pc_logistic', 'iw_clip_max': 5.0, 'iw_prob_clip': 0.007285553160022153, 'iw_n_components': 50, 'iw_logistic_c': 0.00018061354514423456, 'iw_pca_fit': 'combined', 'iw_solver': 'lbfgs', 'iw_rho': 1.0}. Best is trial 101 with value: 0.26115674533355865.
[I 2026-05-04 05:49:57,485] Trial 137 finished with value: 0.2597214499865285 and parameters: {'alpha': 137999.40739235413, 'use_snp_selection': False, 'iw_method': 'pc_logistic', 'iw_clip_max': 5.0, 'iw_prob_clip': 0.006895794883013756, 'iw_n_components': 50, 'iw_logistic_c': 2.0257549578195803e-06, 'iw_pca_fit': 'combined', 'iw_solver': 'lbfgs', 'iw_rho': 0.5}. Best is trial 101 with value: 0.26115674533355865.
[I 2026-05-04 05:52:34,476] Trial 138 finished with value: 0.2533042258359429 and parameters: {'alpha': 228444.91548137442, 'use_snp_selection': False, 'iw_method': 'pc_logistic', 'iw_clip_max': 1.25, 'iw_prob_clip': 0.0047612908170090035, 'iw_n_components': 50, 'iw_logistic_c': 9.281820567557074e-06, 'iw_pca_fit': 'combined', 'iw_solver': 'lbfgs', 'iw_rho': 1.0}. Best is trial 101 with value: 0.26115674533355865.
[I 2026-05-04 05:53:02,724] Trial 139 finished with value: 0.227522315618408 and parameters: {'alpha': 1666432.5489056595, 'use_snp_selection': False, 'iw_method': 'uniform'}. Best is trial 101 with value: 0.26115674533355865.
[I 2026-05-04 05:55:39,223] Trial 140 finished with value: 0.25597292970605967 and parameters: {'alpha': 193380.33788261565, 'use_snp_selection': False, 'iw_method': 'pc_logistic', 'iw_clip_max': 5.0, 'iw_prob_clip': 0.005489738917339661, 'iw_n_components': 40, 'iw_logistic_c': 4.192727223029554e-06, 'iw_pca_fit': 'combined', 'iw_solver': 'lbfgs', 'iw_rho': 1.0}. Best is trial 101 with value: 0.26115674533355865.
[I 2026-05-04 05:58:16,019] Trial 141 finished with value: 0.2604847741088142 and parameters: {'alpha': 147703.5273274712, 'use_snp_selection': False, 'iw_method': 'pc_logistic', 'iw_clip_max': 5.0, 'iw_prob_clip': 0.007682900121028283, 'iw_n_components': 50, 'iw_logistic_c': 1.3354822689900386e-06, 'iw_pca_fit': 'combined', 'iw_solver': 'lbfgs', 'iw_rho': 1.0}. Best is trial 101 with value: 0.26115674533355865.
[I 2026-05-04 06:00:52,372] Trial 142 finished with value: 0.26041026718340454 and parameters: {'alpha': 156627.97013381263, 'use_snp_selection': False, 'iw_method': 'pc_logistic', 'iw_clip_max': 5.0, 'iw_prob_clip': 0.007594791115955622, 'iw_n_components': 50, 'iw_logistic_c': 1.2024611895962462e-06, 'iw_pca_fit': 'combined', 'iw_solver': 'lbfgs', 'iw_rho': 1.0}. Best is trial 101 with value: 0.26115674533355865.
[I 2026-05-04 06:03:28,444] Trial 143 finished with value: 0.2585477561086741 and parameters: {'alpha': 169669.97265917173, 'use_snp_selection': False, 'iw_method': 'pc_logistic', 'iw_clip_max': 5.0, 'iw_prob_clip': 0.006593432533906693, 'iw_n_components': 60, 'iw_logistic_c': 6.799610685048406e-07, 'iw_pca_fit': 'combined', 'iw_solver': 'lbfgs', 'iw_rho': 1.0}. Best is trial 101 with value: 0.26115674533355865.
[I 2026-05-04 06:06:05,271] Trial 144 finished with value: 0.2578997753410136 and parameters: {'alpha': 147397.2234127595, 'use_snp_selection': False, 'iw_method': 'pc_logistic', 'iw_clip_max': 5.0, 'iw_prob_clip': 0.00982954799753114, 'iw_n_components': 50, 'iw_logistic_c': 3.1742879464181763e-06, 'iw_pca_fit': 'combined', 'iw_solver': 'lbfgs', 'iw_rho': 1.0}. Best is trial 101 with value: 0.26115674533355865.
[I 2026-05-04 06:08:47,892] Trial 145 finished with value: 0.25982598950513563 and parameters: {'alpha': 204971.32776300775, 'use_snp_selection': False, 'iw_method': 'pc_logistic', 'iw_clip_max': 5.0, 'iw_prob_clip': 0.00610594412497422, 'iw_n_components': 80, 'iw_logistic_c': 1.1256968128510866e-06, 'iw_pca_fit': 'combined', 'iw_solver': 'lbfgs', 'iw_rho': 0.9}. Best is trial 101 with value: 0.26115674533355865.
[I 2026-05-04 06:11:24,456] Trial 146 finished with value: 0.2607514586704015 and parameters: {'alpha': 180893.12842289425, 'use_snp_selection': False, 'iw_method': 'pc_logistic', 'iw_clip_max': 5.0, 'iw_prob_clip': 0.011890554280221158, 'iw_n_components': 50, 'iw_logistic_c': 1.9977104409514426e-06, 'iw_pca_fit': 'combined', 'iw_solver': 'lbfgs', 'iw_rho': 0.75}. Best is trial 101 with value: 0.26115674533355865.
[I 2026-05-04 06:14:01,130] Trial 147 finished with value: 0.2528140271777877 and parameters: {'alpha': 653156.9666668526, 'use_snp_selection': False, 'iw_method': 'pc_logistic', 'iw_clip_max': 5.0, 'iw_prob_clip': 0.012338539832598722, 'iw_n_components': 50, 'iw_logistic_c': 1.83373986041616e-06, 'iw_pca_fit': 'combined', 'iw_solver': 'lbfgs', 'iw_rho': 0.75}. Best is trial 101 with value: 0.26115674533355865.
[I 2026-05-04 06:16:38,072] Trial 148 finished with value: 0.2550504817711684 and parameters: {'alpha': 135867.8383145664, 'use_snp_selection': False, 'iw_method': 'pc_logistic', 'iw_clip_max': 2.0, 'iw_prob_clip': 0.008873467423388426, 'iw_n_components': 50, 'iw_logistic_c': 5.449694588321155e-06, 'iw_pca_fit': 'combined', 'iw_solver': 'lbfgs', 'iw_rho': 0.75}. Best is trial 101 with value: 0.26115674533355865.
[I 2026-05-04 06:19:14,439] Trial 149 finished with value: 0.25666787343440445 and parameters: {'alpha': 178127.05870017922, 'use_snp_selection': False, 'iw_method': 'pc_logistic', 'iw_clip_max': 5.0, 'iw_prob_clip': 0.010841185619255364, 'iw_n_components': 50, 'iw_logistic_c': 5.542559891227051e-07, 'iw_pca_fit': 'combined', 'iw_solver': 'lbfgs', 'iw_rho': 0.75}. Best is trial 101 with value: 0.26115674533355865.
