[I 2026-04-18 16:05:11,811] Trial 8 finished with value: 0.09713284098782231 and parameters: {'hidden_dims': '[256, 128]', 'dropout': 0.05742396906738376, 'batch_norm': False, 'lr': 1.9761509510575143e-06, 'weight_decay': 2.933492239224291e-07, 'epochs': 82, 'loss': 'mae', 'optimizer': 'adam', 'use_snp_selection': True, 'num_snps': 29883, 'weight_scheme': 'minmax', 'weight_clip_max': 5.0, 'weight_minmax_eps': 0.0051288771726799584}. Best is trial 6 with value: 0.16356938308738572.
[I 2026-04-18 16:05:36,266] Trial 23 finished with value: 0.20570013213989 and parameters: {'hidden_dims': '[256, 64]', 'dropout': 0.2088776833384242, 'batch_norm': True, 'lr': 0.0005168611821826909, 'weight_decay': 0.00018304781044344224, 'epochs': 241, 'loss': 'mse', 'optimizer': 'adam', 'use_snp_selection': False, 'weight_scheme': 'uniform', 'weight_clip_max': 5.0}. Best is trial 15 with value: 0.22258311507391132.
[I 2026-04-18 16:06:02,363] Trial 9 finished with value: 0.13705858468320656 and parameters: {'hidden_dims': '[256, 128]', 'dropout': 0.5795930447285386, 'batch_norm': False, 'lr': 0.00011782025260263196, 'weight_decay': 0.0005562063174273634, 'epochs': 218, 'loss': 'mae', 'optimizer': 'adamw', 'use_snp_selection': True, 'num_snps': 32226, 'weight_scheme': 'minmax', 'weight_clip_max': 5.0, 'weight_minmax_eps': 0.09600289105543994}. Best is trial 6 with value: 0.16356938308738572.
[I 2026-04-18 16:06:23,893] Trial 24 finished with value: 0.2062590402065449 and parameters: {'hidden_dims': '[256, 64]', 'dropout': 0.017542889562818315, 'batch_norm': True, 'lr': 0.00019362358417488894, 'weight_decay': 2.3886963697654044e-05, 'epochs': 275, 'loss': 'mae', 'optimizer': 'adam', 'use_snp_selection': False, 'weight_scheme': 'uniform', 'weight_clip_max': 5.0}. Best is trial 15 with value: 0.22258311507391132.
[I 2026-04-18 16:07:08,051] Trial 25 finished with value: 0.1951546334399493 and parameters: {'hidden_dims': '[256, 64]', 'dropout': 0.08067059501324364, 'batch_norm': True, 'lr': 0.00026446447947688285, 'weight_decay': 0.00011568952443641915, 'epochs': 253, 'loss': 'mae', 'optimizer': 'adam', 'use_snp_selection': False, 'weight_scheme': 'uniform', 'weight_clip_max': 5.0}. Best is trial 15 with value: 0.22258311507391132.
[I 2026-04-18 16:07:33,392] Trial 10 finished with value: 0.14922002705185697 and parameters: {'hidden_dims': '[512, 64]', 'dropout': 0.4338375928678635, 'batch_norm': True, 'lr': 0.0009667920285641304, 'weight_decay': 6.976468597792388e-05, 'epochs': 294, 'loss': 'mae', 'optimizer': 'adam', 'use_snp_selection': False, 'weight_scheme': 'uniform', 'weight_clip_max': None}. Best is trial 6 with value: 0.16356938308738572.
[I 2026-04-18 16:08:23,578] Trial 26 finished with value: 0.1959495284691785 and parameters: {'hidden_dims': '[512, 64]', 'dropout': 0.1536740897060166, 'batch_norm': True, 'lr': 5.9213655812922363e-05, 'weight_decay': 0.000361248346020331, 'epochs': 230, 'loss': 'mse', 'optimizer': 'adamw', 'use_snp_selection': False, 'weight_scheme': 'uniform', 'weight_clip_max': 5.0}. Best is trial 15 with value: 0.22258311507391132.
[I 2026-04-18 16:09:03,198] Trial 11 finished with value: 0.14663888265556108 and parameters: {'hidden_dims': '[512, 64]', 'dropout': 0.4516805843717058, 'batch_norm': True, 'lr': 0.0009928478748470076, 'weight_decay': 5.547084226283487e-05, 'epochs': 290, 'loss': 'mae', 'optimizer': 'adam', 'use_snp_selection': False, 'weight_scheme': 'uniform', 'weight_clip_max': None}. Best is trial 6 with value: 0.16356938308738572.
[I 2026-04-18 16:10:18,851] Trial 12 finished with value: 0.14748350710698657 and parameters: {'hidden_dims': '[512, 64]', 'dropout': 0.4134640118922238, 'batch_norm': True, 'lr': 0.0008477822420198197, 'weight_decay': 5.229627468514555e-05, 'epochs': 241, 'loss': 'mae', 'optimizer': 'adam', 'use_snp_selection': False, 'weight_scheme': 'uniform', 'weight_clip_max': None}. Best is trial 6 with value: 0.16356938308738572.
[I 2026-04-18 16:10:20,579] Trial 27 finished with value: 0.2009278517154128 and parameters: {'hidden_dims': '[512, 128]', 'dropout': 0.23053985045636513, 'batch_norm': True, 'lr': 0.0005961286591465378, 'weight_decay': 6.240389417676839e-05, 'epochs': 299, 'loss': 'mae', 'optimizer': 'adam', 'use_snp_selection': True, 'num_snps': 56030, 'weight_scheme': 'exponential', 'weight_clip_max': 5.0, 'weight_exponential_beta': 0.9111379493227183}. Best is trial 15 with value: 0.22258311507391132.
[I 2026-04-18 16:11:06,548] Trial 28 finished with value: 0.20508100180641026 and parameters: {'hidden_dims': '[256, 128]', 'dropout': 0.11746995732410896, 'batch_norm': True, 'lr': 0.00013683468484951508, 'weight_decay': 0.00098795695486169, 'epochs': 264, 'loss': 'mse', 'optimizer': 'adam', 'use_snp_selection': False, 'weight_scheme': 'uniform', 'weight_clip_max': None}. Best is trial 15 with value: 0.22258311507391132.
[I 2026-04-18 16:11:37,457] Trial 29 finished with value: 0.1379134804186973 and parameters: {'hidden_dims': '[256, 128]', 'dropout': 0.17687209220536285, 'batch_norm': True, 'lr': 1.5157609854998231e-06, 'weight_decay': 1.2804049513611128e-05, 'epochs': 169, 'loss': 'mse', 'optimizer': 'adam', 'use_snp_selection': True, 'num_snps': 5190, 'weight_scheme': 'uniform', 'weight_clip_max': 10.0}. Best is trial 15 with value: 0.22258311507391132.
[I 2026-04-18 16:11:51,639] Trial 13 finished with value: 0.14048797908283653 and parameters: {'hidden_dims': '[512, 64]', 'dropout': 0.44665667317896396, 'batch_norm': True, 'lr': 0.00031846142052762143, 'weight_decay': 0.0005816188648485889, 'epochs': 300, 'loss': 'mae', 'optimizer': 'adam', 'use_snp_selection': False, 'weight_scheme': 'uniform', 'weight_clip_max': None}. Best is trial 6 with value: 0.16356938308738572.
[I 2026-04-18 16:12:25,895] Trial 30 finished with value: 0.12906258937365306 and parameters: {'hidden_dims': '[256, 64]', 'dropout': 0.04337823180864708, 'batch_norm': True, 'lr': 6.875734938370268e-06, 'weight_decay': 3.0167684061554894e-06, 'epochs': 281, 'loss': 'mae', 'optimizer': 'adamw', 'use_snp_selection': False, 'weight_scheme': 'uniform', 'weight_clip_max': 5.0}. Best is trial 15 with value: 0.22258311507391132.
[I 2026-04-18 16:12:27,297] Trial 14 finished with value: 0.13474264795172156 and parameters: {'hidden_dims': '[256, 64]', 'dropout': 0.3608938911337143, 'batch_norm': True, 'lr': 3.2138990339899728e-06, 'weight_decay': 1.8215183711878244e-05, 'epochs': 205, 'loss': 'mae', 'optimizer': 'adam', 'use_snp_selection': False, 'weight_scheme': 'exponential', 'weight_clip_max': None, 'weight_exponential_beta': 7.948849485427058}. Best is trial 6 with value: 0.16356938308738572.
[I 2026-04-18 16:13:17,346] Trial 31 finished with value: 0.20330555631991673 and parameters: {'hidden_dims': '[256, 64]', 'dropout': 0.07547332491350428, 'batch_norm': True, 'lr': 4.693660664877449e-05, 'weight_decay': 0.0005485772851041415, 'epochs': 300, 'loss': 'mae', 'optimizer': 'adam', 'use_snp_selection': False, 'weight_scheme': 'uniform', 'weight_clip_max': 5.0}. Best is trial 15 with value: 0.22258311507391132.
[I 2026-04-18 16:13:48,074] Trial 15 finished with value: 0.15414932229862005 and parameters: {'hidden_dims': '[512, 64]', 'dropout': 0.5310067954444609, 'batch_norm': True, 'lr': 0.0003305075642335557, 'weight_decay': 0.00018714635954449952, 'epochs': 259, 'loss': 'mae', 'optimizer': 'adamw', 'use_snp_selection': False, 'weight_scheme': 'top-heavy', 'weight_clip_max': None, 'weight_topheavy_top_frac': 0.48091952196914134, 'weight_topheavy_low': 0.5054522954723732, 'weight_topheavy_high': 5.647529144674392}. Best is trial 6 with value: 0.16356938308738572.
[I 2026-04-18 16:14:06,571] Trial 32 finished with value: 0.193539113438648 and parameters: {'hidden_dims': '[256, 64]', 'dropout': 0.06769808306981955, 'batch_norm': True, 'lr': 0.0001294933867582193, 'weight_decay': 0.0009517617648203498, 'epochs': 286, 'loss': 'mae', 'optimizer': 'adam', 'use_snp_selection': False, 'weight_scheme': 'uniform', 'weight_clip_max': 5.0}. Best is trial 15 with value: 0.22258311507391132.
[I 2026-04-18 16:14:30,790] Trial 16 finished with value: 0.13799136619573343 and parameters: {'hidden_dims': '[256, 64]', 'dropout': 0.598700750155559, 'batch_norm': True, 'lr': 5.196015503468652e-06, 'weight_decay': 0.00024636632406639647, 'epochs': 253, 'loss': 'mae', 'optimizer': 'adamw', 'use_snp_selection': False, 'weight_scheme': 'top-heavy', 'weight_clip_max': None, 'weight_topheavy_top_frac': 0.4979496293827915, 'weight_topheavy_low': 0.5230104201773819, 'weight_topheavy_high': 5.831773413894172}. Best is trial 6 with value: 0.16356938308738572.
[I 2026-04-18 16:14:52,036] Trial 33 finished with value: 0.20763105190768147 and parameters: {'hidden_dims': '[256, 64]', 'dropout': 0.03574735799463859, 'batch_norm': True, 'lr': 8.285555473618145e-05, 'weight_decay': 0.000256269915328037, 'epochs': 261, 'loss': 'mae', 'optimizer': 'adam', 'use_snp_selection': False, 'weight_scheme': 'linear', 'weight_clip_max': 5.0, 'weight_linear_min_weight': 0.9156802079998425, 'weight_linear_max_weight': 3.8978088691681005}. Best is trial 15 with value: 0.22258311507391132.
[I 2026-04-18 16:15:41,256] Trial 34 finished with value: 0.16752128348666492 and parameters: {'hidden_dims': '[256, 64]', 'dropout': 0.0007614716723499948, 'batch_norm': True, 'lr': 2.1157484441536234e-05, 'weight_decay': 5.278669624076052e-05, 'epochs': 285, 'loss': 'mae', 'optimizer': 'adam', 'use_snp_selection': False, 'weight_scheme': 'uniform', 'weight_clip_max': 5.0}. Best is trial 15 with value: 0.22258311507391132.
[I 2026-04-18 16:15:42,073] Trial 17 finished with value: 0.1538235977591608 and parameters: {'hidden_dims': '[512, 128]', 'dropout': 0.5055209153461855, 'batch_norm': True, 'lr': 0.00030519803944241577, 'weight_decay': 1.2377129591513016e-05, 'epochs': 226, 'loss': 'mae', 'optimizer': 'adamw', 'use_snp_selection': False, 'weight_scheme': 'top-heavy', 'weight_clip_max': None, 'weight_topheavy_top_frac': 0.49874528076422553, 'weight_topheavy_low': 0.5135903521094615, 'weight_topheavy_high': 5.58406405648394}. Best is trial 6 with value: 0.16356938308738572.
[I 2026-04-18 16:16:16,680] Trial 35 finished with value: 0.2120535715152725 and parameters: {'hidden_dims': '[256, 64]', 'dropout': 0.09827609309424043, 'batch_norm': True, 'lr': 9.353550624786116e-05, 'weight_decay': 0.0004809450594560795, 'epochs': 196, 'loss': 'mae', 'optimizer': 'adam', 'use_snp_selection': False, 'weight_scheme': 'top-heavy', 'weight_clip_max': None, 'weight_topheavy_top_frac': 0.4952154593225446, 'weight_topheavy_low': 0.5457971630824339, 'weight_topheavy_high': 5.981268124330438}. Best is trial 15 with value: 0.22258311507391132.
[I 2026-04-18 16:16:26,627] Trial 18 finished with value: 0.1097109679203282 and parameters: {'hidden_dims': '[256, 64]', 'dropout': 0.007294073114139932, 'batch_norm': True, 'lr': 1.0387835278604118e-06, 'weight_decay': 1.3362472918395443e-06, 'epochs': 265, 'loss': 'mae', 'optimizer': 'adamw', 'use_snp_selection': False, 'weight_scheme': 'top-heavy', 'weight_clip_max': None, 'weight_topheavy_top_frac': 0.32555176360549987, 'weight_topheavy_low': 0.8300335921644134, 'weight_topheavy_high': 1.3079116154551826}. Best is trial 6 with value: 0.16356938308738572.
[I 2026-04-18 16:16:50,236] Trial 36 finished with value: 0.1384479343634955 and parameters: {'hidden_dims': '[256, 64]', 'dropout': 0.3220397314105237, 'batch_norm': True, 'lr': 0.00028571552982290525, 'weight_decay': 0.00013767832891878074, 'epochs': 187, 'loss': 'mse', 'optimizer': 'sgd', 'use_snp_selection': False, 'weight_scheme': 'top-heavy', 'weight_clip_max': None, 'weight_topheavy_top_frac': 0.49216909868126146, 'weight_topheavy_low': 0.5172194101251528, 'weight_topheavy_high': 5.982539252370555}. Best is trial 15 with value: 0.22258311507391132.
[I 2026-04-18 16:17:23,946] Trial 19 finished with value: 0.15409980915257657 and parameters: {'hidden_dims': '[512, 64]', 'dropout': 0.5244021532051006, 'batch_norm': True, 'lr': 4.081222551499373e-05, 'weight_decay': 0.00014824664391464745, 'epochs': 178, 'loss': 'mae', 'optimizer': 'adamw', 'use_snp_selection': False, 'weight_scheme': 'minmax', 'weight_clip_max': 10.0, 'weight_minmax_eps': 0.1915360679585659}. Best is trial 6 with value: 0.16356938308738572.
[I 2026-04-18 16:17:59,086] Trial 20 finished with value: 0.1483753306799655 and parameters: {'hidden_dims': '[256, 64]', 'dropout': 0.3424369809187238, 'batch_norm': True, 'lr': 0.00028080974126493634, 'weight_decay': 1.648439064521615e-05, 'epochs': 202, 'loss': 'mae', 'optimizer': 'adamw', 'use_snp_selection': False, 'weight_scheme': 'top-heavy', 'weight_clip_max': None, 'weight_topheavy_top_frac': 0.3379588987117065, 'weight_topheavy_low': 0.796315213731648, 'weight_topheavy_high': 4.162504575596352}. Best is trial 6 with value: 0.16356938308738572.
[I 2026-04-18 16:18:26,424] Trial 37 finished with value: 0.19981187618212207 and parameters: {'hidden_dims': '[512, 128]', 'dropout': 0.16700667988932755, 'batch_norm': True, 'lr': 0.00010571289566078133, 'weight_decay': 0.0005279410110118928, 'epochs': 207, 'loss': 'mse', 'optimizer': 'adam', 'use_snp_selection': True, 'num_snps': 56695, 'weight_scheme': 'top-heavy', 'weight_clip_max': None, 'weight_topheavy_top_frac': 0.498071440181414, 'weight_topheavy_low': 0.5636743887121695, 'weight_topheavy_high': 5.682605207683844}. Best is trial 15 with value: 0.22258311507391132.
[I 2026-04-18 16:18:53,838] Trial 21 finished with value: 0.15856377459385224 and parameters: {'hidden_dims': '[512, 64]', 'dropout': 0.5186435420891073, 'batch_norm': True, 'lr': 5.909645802309753e-05, 'weight_decay': 0.00019193518798576404, 'epochs': 169, 'loss': 'mae', 'optimizer': 'adamw', 'use_snp_selection': False, 'weight_scheme': 'minmax', 'weight_clip_max': 10.0, 'weight_minmax_eps': 0.19198222187190067}. Best is trial 6 with value: 0.16356938308738572.
[I 2026-04-18 16:19:24,378] Trial 38 finished with value: 0.14468416240179754 and parameters: {'hidden_dims': '[512, 64]', 'dropout': 0.21665319950436004, 'batch_norm': True, 'lr': 0.00018663729307267753, 'weight_decay': 3.163540410709811e-05, 'epochs': 177, 'loss': 'mae', 'optimizer': 'sgd', 'use_snp_selection': False, 'weight_scheme': 'top-heavy', 'weight_clip_max': None, 'weight_topheavy_top_frac': 0.32070023984697443, 'weight_topheavy_low': 0.7447166491794546, 'weight_topheavy_high': 4.756215195146556}. Best is trial 15 with value: 0.22258311507391132.
[I 2026-04-18 16:19:46,163] Trial 22 finished with value: 0.16913238283218474 and parameters: {'hidden_dims': '[512, 64]', 'dropout': 0.5114093724174109, 'batch_norm': True, 'lr': 4.142104037991778e-05, 'weight_decay': 0.0002177102356995484, 'epochs': 161, 'loss': 'mae', 'optimizer': 'adamw', 'use_snp_selection': False, 'weight_scheme': 'minmax', 'weight_clip_max': 10.0, 'weight_minmax_eps': 0.10372791798884451}. Best is trial 22 with value: 0.16913238283218474.
[I 2026-04-18 16:20:05,415] Trial 39 finished with value: 0.17672015225312238 and parameters: {'hidden_dims': '[256, 64]', 'dropout': 0.13021543662910418, 'batch_norm': False, 'lr': 0.0004737759475341092, 'weight_decay': 6.582431577593691e-06, 'epochs': 234, 'loss': 'mse', 'optimizer': 'adam', 'use_snp_selection': False, 'weight_scheme': 'linear', 'weight_clip_max': None, 'weight_linear_min_weight': 0.5869635151175797, 'weight_linear_max_weight': 2.7804674204683004}. Best is trial 15 with value: 0.22258311507391132.
[I 2026-04-18 16:20:35,922] Trial 23 finished with value: 0.15948796617950742 and parameters: {'hidden_dims': '[512, 64]', 'dropout': 0.48926568732873976, 'batch_norm': True, 'lr': 5.108007452994648e-05, 'weight_decay': 0.0006736587667463763, 'epochs': 152, 'loss': 'mae', 'optimizer': 'adamw', 'use_snp_selection': False, 'weight_scheme': 'minmax', 'weight_clip_max': 10.0, 'weight_minmax_eps': 0.09682111851784946}. Best is trial 22 with value: 0.16913238283218474.
[I 2026-04-18 16:21:13,444] Trial 0 finished with value: 0.033991804904581785 and parameters: {'hidden_dims': '[256, 128]', 'dropout': 0.18584155530312246, 'batch_norm': True, 'lr': 9.012665953349533e-06, 'weight_decay': 4.96591963698479e-06, 'epochs': 105, 'loss': 'mse', 'optimizer': 'sgd', 'use_snp_selection': True, 'num_snps': 25583, 'weight_scheme': 'minmax', 'weight_clip_max': 5.0, 'weight_minmax_eps': 0.14026014881292506}. Best is trial 0 with value: 0.033991804904581785.
[I 2026-04-18 16:21:20,771] Trial 24 finished with value: 0.16243222260165963 and parameters: {'hidden_dims': '[512, 64]', 'dropout': 0.38625733223431485, 'batch_norm': True, 'lr': 1.9298676654821534e-05, 'weight_decay': 0.0009579336872109418, 'epochs': 135, 'loss': 'mae', 'optimizer': 'adamw', 'use_snp_selection': False, 'weight_scheme': 'minmax', 'weight_clip_max': 10.0, 'weight_minmax_eps': 0.09623538947665436}. Best is trial 22 with value: 0.16913238283218474.
[I 2026-04-18 16:21:38,898] Trial 1 finished with value: 0.0856052115662557 and parameters: {'hidden_dims': '[256, 64]', 'dropout': 0.05000949662985405, 'batch_norm': True, 'lr': 0.00015647443054904835, 'weight_decay': 5.158896024962846e-05, 'epochs': 152, 'loss': 'mse', 'optimizer': 'sgd', 'use_snp_selection': False, 'weight_scheme': 'linear', 'weight_clip_max': None, 'weight_linear_min_weight': 0.21922985165550554, 'weight_linear_max_weight': 1.6260435767424388}. Best is trial 1 with value: 0.0856052115662557.
[I 2026-04-18 16:22:02,655] Trial 25 finished with value: 0.1580208696583581 and parameters: {'hidden_dims': '[512, 64]', 'dropout': 0.40134643299282896, 'batch_norm': True, 'lr': 1.9799354230848387e-05, 'weight_decay': 0.0008968869392068181, 'epochs': 125, 'loss': 'mae', 'optimizer': 'adamw', 'use_snp_selection': False, 'weight_scheme': 'minmax', 'weight_clip_max': 10.0, 'weight_minmax_eps': 0.07381967110523444}. Best is trial 22 with value: 0.16913238283218474.
[I 2026-04-18 16:22:17,029] Trial 26 finished with value: 0.12767834445418866 and parameters: {'hidden_dims': '[256, 128]', 'dropout': 0.366257220736316, 'batch_norm': False, 'lr': 8.387513915304026e-06, 'weight_decay': 2.022312226685841e-06, 'epochs': 63, 'loss': 'mae', 'optimizer': 'adam', 'use_snp_selection': False, 'weight_scheme': 'minmax', 'weight_clip_max': 10.0, 'weight_minmax_eps': 0.13326879664597324}. Best is trial 22 with value: 0.16913238283218474.
[I 2026-04-18 16:22:17,468] Trial 2 finished with value: 0.103949599491994 and parameters: {'hidden_dims': '[512, 128]', 'dropout': 0.2736730891340176, 'batch_norm': True, 'lr': 7.298114623433994e-05, 'weight_decay': 5.6346010385734023e-08, 'epochs': 185, 'loss': 'mae', 'optimizer': 'sgd', 'use_snp_selection': True, 'num_snps': 14091, 'weight_scheme': 'minmax', 'weight_clip_max': 10.0, 'weight_minmax_eps': 0.045780660776687306}. Best is trial 2 with value: 0.103949599491994.
[I 2026-04-18 16:23:28,706] Trial 27 finished with value: 0.14735521404172056 and parameters: {'hidden_dims': '[512, 128]', 'dropout': 0.14754105642129195, 'batch_norm': True, 'lr': 2.4561674988298003e-05, 'weight_decay': 0.00027708655960287045, 'epochs': 126, 'loss': 'mae', 'optimizer': 'adamw', 'use_snp_selection': True, 'num_snps': 55987, 'weight_scheme': 'minmax', 'weight_clip_max': 10.0, 'weight_minmax_eps': 0.13605267780523886}. Best is trial 22 with value: 0.16913238283218474.
[I 2026-04-18 16:23:38,417] Trial 3 finished with value: 0.016134927453363965 and parameters: {'hidden_dims': '[512, 64]', 'dropout': 0.30157795416637295, 'batch_norm': False, 'lr': 2.007492282795256e-05, 'weight_decay': 5.496446859789657e-06, 'epochs': 284, 'loss': 'mse', 'optimizer': 'sgd', 'use_snp_selection': False, 'weight_scheme': 'linear', 'weight_clip_max': None, 'weight_linear_min_weight': 0.24682154527102826, 'weight_linear_max_weight': 1.8338910783134623}. Best is trial 2 with value: 0.103949599491994.
[I 2026-04-18 16:24:00,271] Trial 28 finished with value: 0.15966957506711588 and parameters: {'hidden_dims': '[512, 64]', 'dropout': 0.30834905307090027, 'batch_norm': True, 'lr': 1.3588288961614317e-05, 'weight_decay': 2.632348482148206e-05, 'epochs': 89, 'loss': 'mae', 'optimizer': 'adam', 'use_snp_selection': False, 'weight_scheme': 'minmax', 'weight_clip_max': 10.0, 'weight_minmax_eps': 0.06336122831240622}. Best is trial 22 with value: 0.16913238283218474.
[I 2026-04-18 16:24:02,886] Trial 4 finished with value: 0.08673753938216508 and parameters: {'hidden_dims': '[256, 64]', 'dropout': 0.18128694708490736, 'batch_norm': False, 'lr': 8.951826748007403e-05, 'weight_decay': 2.1781541495465197e-07, 'epochs': 147, 'loss': 'mse', 'optimizer': 'sgd', 'use_snp_selection': False, 'weight_scheme': 'top-heavy', 'weight_clip_max': 5.0, 'weight_topheavy_top_frac': 0.1724888194073277, 'weight_topheavy_low': 1.1620865802171172, 'weight_topheavy_high': 3.476906528073177}. Best is trial 2 with value: 0.103949599491994.
[I 2026-04-18 16:24:23,756] Trial 5 finished with value: 0.12659965295446013 and parameters: {'hidden_dims': '[256, 64]', 'dropout': 0.2571412946970998, 'batch_norm': True, 'lr': 3.546238022482882e-05, 'weight_decay': 1.0185234767613396e-06, 'epochs': 119, 'loss': 'mse', 'optimizer': 'sgd', 'use_snp_selection': False, 'weight_scheme': 'linear', 'weight_clip_max': 10.0, 'weight_linear_min_weight': 0.9405832045183805, 'weight_linear_max_weight': 3.413610925325811}. Best is trial 5 with value: 0.12659965295446013.
[I 2026-04-18 16:24:29,061] Trial 29 finished with value: 0.09379020954679887 and parameters: {'hidden_dims': '[256, 128]', 'dropout': 0.21555353760536228, 'batch_norm': True, 'lr': 9.332487651544863e-06, 'weight_decay': 7.561290619991455e-06, 'epochs': 109, 'loss': 'mse', 'optimizer': 'adamw', 'use_snp_selection': True, 'num_snps': 5175, 'weight_scheme': 'exponential', 'weight_clip_max': 5.0, 'weight_exponential_beta': 0.2169737340046498}. Best is trial 22 with value: 0.16913238283218474.
