[I 2026-05-04 05:10:47,825] Trial 112 finished with value: 0.21798332421542438 and parameters: {'alpha': 248163.70017405628, 'use_snp_selection': False, 'iw_method': 'pc_logistic', 'iw_clip_max': 1.25, 'iw_prob_clip': 0.006838780840903628, 'iw_n_components': 80, 'iw_logistic_c': 0.02855493026055136, 'iw_pca_fit': 'combined', 'iw_solver': 'lbfgs', 'iw_rho': 0.9}. Best is trial 81 with value: 0.22042911056351472.
[I 2026-05-04 05:13:58,363] Trial 113 finished with value: 0.21332098675754785 and parameters: {'alpha': 180318.57786755433, 'use_snp_selection': False, 'iw_method': 'pc_logistic', 'iw_clip_max': 1.25, 'iw_prob_clip': 0.006611501398536256, 'iw_n_components': 80, 'iw_logistic_c': 0.02291941881247793, 'iw_pca_fit': 'combined', 'iw_solver': 'lbfgs', 'iw_rho': 0.9}. Best is trial 81 with value: 0.22042911056351472.
[I 2026-05-04 05:17:05,687] Trial 114 finished with value: 0.21678588188398887 and parameters: {'alpha': 251179.67218729836, 'use_snp_selection': False, 'iw_method': 'pc_logistic', 'iw_clip_max': 1.25, 'iw_prob_clip': 0.0049607226478315366, 'iw_n_components': 80, 'iw_logistic_c': 0.01588414477286932, 'iw_pca_fit': 'combined', 'iw_solver': 'lbfgs', 'iw_rho': 0.9}. Best is trial 81 with value: 0.22042911056351472.
[I 2026-05-04 05:20:10,867] Trial 115 finished with value: 0.22087868997186372 and parameters: {'alpha': 245582.0485478488, 'use_snp_selection': False, 'iw_method': 'pc_logistic', 'iw_clip_max': 1.25, 'iw_prob_clip': 0.0017107847399804035, 'iw_n_components': 80, 'iw_logistic_c': 0.002327663423467482, 'iw_pca_fit': 'combined', 'iw_solver': 'lbfgs', 'iw_rho': 0.9}. Best is trial 115 with value: 0.22087868997186372.
[I 2026-05-04 05:23:15,813] Trial 116 finished with value: 0.21162099006436877 and parameters: {'alpha': 275394.17207804526, 'use_snp_selection': False, 'iw_method': 'pc_logistic', 'iw_clip_max': 2.0, 'iw_prob_clip': 0.0012643908783915889, 'iw_n_components': 80, 'iw_logistic_c': 0.0028613788221236148, 'iw_pca_fit': 'combined', 'iw_solver': 'lbfgs', 'iw_rho': 0.9}. Best is trial 115 with value: 0.22087868997186372.
[I 2026-05-04 05:26:02,876] Trial 117 finished with value: 0.21287975477454993 and parameters: {'alpha': 217009.14735646822, 'use_snp_selection': False, 'iw_method': 'pc_logistic', 'iw_clip_max': 1.25, 'iw_prob_clip': 0.022797700333431096, 'iw_n_components': 20, 'iw_logistic_c': 0.0074632058276362144, 'iw_pca_fit': 'combined', 'iw_solver': 'lbfgs', 'iw_rho': 0.9}. Best is trial 115 with value: 0.22087868997186372.
[I 2026-05-04 05:29:10,652] Trial 118 finished with value: 0.21267174828614782 and parameters: {'alpha': 200708.87607898758, 'use_snp_selection': False, 'iw_method': 'pc_logistic', 'iw_clip_max': 1.25, 'iw_prob_clip': 0.0016035346830586296, 'iw_n_components': 80, 'iw_logistic_c': 0.015554341525047902, 'iw_pca_fit': 'combined', 'iw_solver': 'lbfgs', 'iw_rho': 0.9}. Best is trial 115 with value: 0.22087868997186372.
[I 2026-05-04 05:32:06,706] Trial 119 finished with value: 0.2130480758527682 and parameters: {'alpha': 256616.3936160272, 'use_snp_selection': False, 'iw_method': 'pc_logistic', 'iw_clip_max': 1.25, 'iw_prob_clip': 0.0014124408516049513, 'iw_n_components': 60, 'iw_logistic_c': 0.0009016880127548489, 'iw_pca_fit': 'combined', 'iw_solver': 'lbfgs', 'iw_rho': 0.9}. Best is trial 115 with value: 0.22087868997186372.
[I 2026-05-04 05:35:11,844] Trial 120 finished with value: 0.216468076760985 and parameters: {'alpha': 237544.48152744194, 'use_snp_selection': False, 'iw_method': 'pc_logistic', 'iw_clip_max': 1.25, 'iw_prob_clip': 0.0005031733415026804, 'iw_n_components': 80, 'iw_logistic_c': 0.004574110048674869, 'iw_pca_fit': 'combined', 'iw_solver': 'lbfgs', 'iw_rho': 0.9}. Best is trial 115 with value: 0.22087868997186372.
[I 2026-05-04 05:38:16,443] Trial 121 finished with value: 0.2158211131163746 and parameters: {'alpha': 253646.05739495112, 'use_snp_selection': False, 'iw_method': 'pc_logistic', 'iw_clip_max': 1.25, 'iw_prob_clip': 0.011314336006213309, 'iw_n_components': 80, 'iw_logistic_c': 0.002334284343479004, 'iw_pca_fit': 'combined', 'iw_solver': 'lbfgs', 'iw_rho': 0.9}. Best is trial 115 with value: 0.22087868997186372.
[I 2026-05-04 05:41:25,850] Trial 122 finished with value: 0.21598408630001686 and parameters: {'alpha': 243858.6623872755, 'use_snp_selection': False, 'iw_method': 'pc_logistic', 'iw_clip_max': 1.25, 'iw_prob_clip': 0.010188240725939357, 'iw_n_components': 80, 'iw_logistic_c': 0.009482637143113983, 'iw_pca_fit': 'combined', 'iw_solver': 'lbfgs', 'iw_rho': 0.9}. Best is trial 115 with value: 0.22087868997186372.
[I 2026-05-04 05:44:35,852] Trial 123 finished with value: 0.21571537836470758 and parameters: {'alpha': 221418.08575472172, 'use_snp_selection': False, 'iw_method': 'pc_logistic', 'iw_clip_max': 1.25, 'iw_prob_clip': 0.013334783051145318, 'iw_n_components': 80, 'iw_logistic_c': 0.030213997116911043, 'iw_pca_fit': 'combined', 'iw_solver': 'lbfgs', 'iw_rho': 0.9}. Best is trial 115 with value: 0.22087868997186372.
[I 2026-05-04 05:47:47,300] Trial 124 finished with value: 0.21260250450084456 and parameters: {'alpha': 276570.50339628017, 'use_snp_selection': False, 'iw_method': 'pc_logistic', 'iw_clip_max': 1.25, 'iw_prob_clip': 0.0018693483317196679, 'iw_n_components': 80, 'iw_logistic_c': 0.04966524729723115, 'iw_pca_fit': 'combined', 'iw_solver': 'lbfgs', 'iw_rho': 0.9}. Best is trial 115 with value: 0.22087868997186372.
[I 2026-05-04 05:50:50,296] Trial 125 finished with value: 0.21272029821930633 and parameters: {'alpha': 186890.58478593026, 'use_snp_selection': False, 'iw_method': 'pc_logistic', 'iw_clip_max': 1.25, 'iw_prob_clip': 0.00223116151154924, 'iw_n_components': 80, 'iw_logistic_c': 0.00022642888885894983, 'iw_pca_fit': 'combined', 'iw_solver': 'lbfgs', 'iw_rho': 0.9}. Best is trial 115 with value: 0.22087868997186372.
[I 2026-05-04 05:53:45,301] Trial 126 finished with value: 0.21683232881175574 and parameters: {'alpha': 319120.85318554786, 'use_snp_selection': False, 'iw_method': 'pc_logistic', 'iw_clip_max': 1.25, 'iw_prob_clip': 0.0068881759803687895, 'iw_n_components': 50, 'iw_logistic_c': 0.07245332599837012, 'iw_pca_fit': 'combined', 'iw_solver': 'lbfgs', 'iw_rho': 0.9}. Best is trial 115 with value: 0.22087868997186372.
[I 2026-05-04 05:56:32,057] Trial 127 finished with value: 0.19944984447759118 and parameters: {'alpha': 346887.8552979415, 'use_snp_selection': False, 'iw_method': 'pc_logistic', 'iw_clip_max': 5.0, 'iw_prob_clip': 0.004331260859326546, 'iw_n_components': 50, 'iw_logistic_c': 0.015311974844601289, 'iw_pca_fit': 'combined', 'iw_solver': 'lbfgs', 'iw_rho': 0.5}. Best is trial 115 with value: 0.22087868997186372.
[I 2026-05-04 05:59:19,604] Trial 128 finished with value: 0.2058027060572893 and parameters: {'alpha': 316307.9431232501, 'use_snp_selection': False, 'iw_method': 'pc_logistic', 'iw_clip_max': 3.0, 'iw_prob_clip': 0.00693142573258554, 'iw_n_components': 50, 'iw_logistic_c': 0.08109431239085915, 'iw_pca_fit': 'combined', 'iw_solver': 'lbfgs', 'iw_rho': 0.9}. Best is trial 115 with value: 0.22087868997186372.
[I 2026-05-04 06:02:04,080] Trial 129 finished with value: 0.21597980527932542 and parameters: {'alpha': 203253.83824480456, 'use_snp_selection': False, 'iw_method': 'pc_logistic', 'iw_clip_max': 1.25, 'iw_prob_clip': 0.005223258917626398, 'iw_n_components': 40, 'iw_logistic_c': 0.024565437415784923, 'iw_pca_fit': 'combined', 'iw_solver': 'lbfgs', 'iw_rho': 0.9}. Best is trial 115 with value: 0.22087868997186372.
[I 2026-05-04 06:04:51,824] Trial 130 finished with value: 0.20291399769330293 and parameters: {'alpha': 271994.6788699706, 'use_snp_selection': False, 'iw_method': 'pc_logistic', 'iw_clip_max': 1.25, 'iw_prob_clip': 0.0076122440851063445, 'iw_n_components': 50, 'iw_logistic_c': 0.048538930912149524, 'iw_pca_fit': 'combined', 'iw_solver': 'lbfgs', 'iw_rho': 1.0}. Best is trial 115 with value: 0.22087868997186372.
[I 2026-05-04 06:07:46,224] Trial 131 finished with value: 0.2188765072083431 and parameters: {'alpha': 233031.36665755927, 'use_snp_selection': False, 'iw_method': 'pc_logistic', 'iw_clip_max': 1.25, 'iw_prob_clip': 0.0009471771275731933, 'iw_n_components': 80, 'iw_logistic_c': 0.17715038208522338, 'iw_pca_fit': 'combined', 'iw_solver': 'lbfgs', 'iw_rho': 0.9}. Best is trial 115 with value: 0.22087868997186372.
[I 2026-05-04 06:10:39,065] Trial 132 finished with value: 0.2113527421508019 and parameters: {'alpha': 213575.77019456762, 'use_snp_selection': False, 'iw_method': 'pc_logistic', 'iw_clip_max': 1.25, 'iw_prob_clip': 0.000683819294952143, 'iw_n_components': 80, 'iw_logistic_c': 0.001281872064354891, 'iw_pca_fit': 'combined', 'iw_solver': 'lbfgs', 'iw_rho': 0.9}. Best is trial 115 with value: 0.22087868997186372.
[I 2026-05-04 06:13:35,241] Trial 133 finished with value: 0.21554757565666036 and parameters: {'alpha': 229910.1839831661, 'use_snp_selection': False, 'iw_method': 'pc_logistic', 'iw_clip_max': 1.25, 'iw_prob_clip': 0.0010091901845239333, 'iw_n_components': 80, 'iw_logistic_c': 0.24516577881449436, 'iw_pca_fit': 'combined', 'iw_solver': 'lbfgs', 'iw_rho': 0.9}. Best is trial 115 with value: 0.22087868997186372.
[I 2026-05-04 06:16:22,780] Trial 134 finished with value: 0.21540045074149622 and parameters: {'alpha': 253538.76363079975, 'use_snp_selection': False, 'iw_method': 'pc_logistic', 'iw_clip_max': 1.25, 'iw_prob_clip': 0.006392169544323654, 'iw_n_components': 50, 'iw_logistic_c': 0.07769352753954466, 'iw_pca_fit': 'combined', 'iw_solver': 'lbfgs', 'iw_rho': 0.9}. Best is trial 115 with value: 0.22087868997186372.
[I 2026-05-04 06:19:19,263] Trial 135 finished with value: 0.2159533662635066 and parameters: {'alpha': 303676.4294744907, 'use_snp_selection': False, 'iw_method': 'pc_logistic', 'iw_clip_max': 1.25, 'iw_prob_clip': 0.000832148186825962, 'iw_n_components': 80, 'iw_logistic_c': 0.029879716531915932, 'iw_pca_fit': 'combined', 'iw_solver': 'lbfgs', 'iw_rho': 0.9}. Best is trial 115 with value: 0.22087868997186372.
[I 2026-05-04 06:19:48,673] Trial 136 finished with value: 0.21116560377216181 and parameters: {'alpha': 233134.3158321784, 'use_snp_selection': False, 'iw_method': 'uniform'}. Best is trial 115 with value: 0.22087868997186372.
[I 2026-05-04 06:22:42,628] Trial 137 finished with value: 0.2159576489517187 and parameters: {'alpha': 195869.15587601412, 'use_snp_selection': False, 'iw_method': 'pc_logistic', 'iw_clip_max': 1.25, 'iw_prob_clip': 0.0011291006911011553, 'iw_n_components': 80, 'iw_logistic_c': 0.004926396216928979, 'iw_pca_fit': 'combined', 'iw_solver': 'lbfgs', 'iw_rho': 0.9}. Best is trial 115 with value: 0.22087868997186372.
[I 2026-05-04 06:25:15,327] Trial 138 finished with value: 0.20617496728652368 and parameters: {'alpha': 282614.6466816347, 'use_snp_selection': False, 'iw_method': 'pc_logistic', 'iw_clip_max': 1.25, 'iw_prob_clip': 0.0008955054988937979, 'iw_n_components': 10, 'iw_logistic_c': 0.17494207488201333, 'iw_pca_fit': 'combined', 'iw_solver': 'lbfgs', 'iw_rho': 0.9}. Best is trial 115 with value: 0.22087868997186372.
[I 2026-05-04 06:28:09,119] Trial 139 finished with value: 0.21864649672365272 and parameters: {'alpha': 176247.52045522892, 'use_snp_selection': False, 'iw_method': 'pc_logistic', 'iw_clip_max': 1.25, 'iw_prob_clip': 0.0031708714985351568, 'iw_n_components': 80, 'iw_logistic_c': 0.011222862313313584, 'iw_pca_fit': 'combined', 'iw_solver': 'lbfgs', 'iw_rho': 0.9}. Best is trial 115 with value: 0.22087868997186372.
[I 2026-05-04 06:31:04,598] Trial 140 finished with value: 0.21638069082925973 and parameters: {'alpha': 264026.29114436416, 'use_snp_selection': False, 'iw_method': 'pc_logistic', 'iw_clip_max': 1.25, 'iw_prob_clip': 0.003097809089852398, 'iw_n_components': 80, 'iw_logistic_c': 0.018433400257909176, 'iw_pca_fit': 'combined', 'iw_solver': 'lbfgs', 'iw_rho': 0.9}. Best is trial 115 with value: 0.22087868997186372.
[I 2026-05-04 06:33:59,156] Trial 141 finished with value: 0.21396657035471342 and parameters: {'alpha': 183503.39046833199, 'use_snp_selection': False, 'iw_method': 'pc_logistic', 'iw_clip_max': 1.25, 'iw_prob_clip': 0.002634297848070878, 'iw_n_components': 80, 'iw_logistic_c': 0.012990754165855318, 'iw_pca_fit': 'combined', 'iw_solver': 'lbfgs', 'iw_rho': 0.9}. Best is trial 115 with value: 0.22087868997186372.
[I 2026-05-04 06:36:53,254] Trial 142 finished with value: 0.2149030771056272 and parameters: {'alpha': 208508.57021299962, 'use_snp_selection': False, 'iw_method': 'pc_logistic', 'iw_clip_max': 1.25, 'iw_prob_clip': 0.0036214531980054356, 'iw_n_components': 80, 'iw_logistic_c': 0.007119386602589193, 'iw_pca_fit': 'combined', 'iw_solver': 'lbfgs', 'iw_rho': 0.9}. Best is trial 115 with value: 0.22087868997186372.
[I 2026-05-04 06:39:49,237] Trial 143 finished with value: 0.2112938997516482 and parameters: {'alpha': 147491.53378900676, 'use_snp_selection': False, 'iw_method': 'pc_logistic', 'iw_clip_max': 1.25, 'iw_prob_clip': 0.001913859499654436, 'iw_n_components': 80, 'iw_logistic_c': 0.04158170812069663, 'iw_pca_fit': 'combined', 'iw_solver': 'lbfgs', 'iw_rho': 0.9}. Best is trial 115 with value: 0.22087868997186372.
[I 2026-05-04 06:42:45,164] Trial 144 finished with value: 0.2045949901517618 and parameters: {'alpha': 2971490.520199221, 'use_snp_selection': False, 'iw_method': 'pc_logistic', 'iw_clip_max': 1.25, 'iw_prob_clip': 0.0049867509028197685, 'iw_n_components': 80, 'iw_logistic_c': 0.06931205670255704, 'iw_pca_fit': 'combined', 'iw_solver': 'lbfgs', 'iw_rho': 0.9}. Best is trial 115 with value: 0.22087868997186372.
[I 2026-05-04 06:45:40,569] Trial 145 finished with value: 0.21105746170979095 and parameters: {'alpha': 169990.44669207916, 'use_snp_selection': False, 'iw_method': 'pc_logistic', 'iw_clip_max': 2.0, 'iw_prob_clip': 0.0037782720560301736, 'iw_n_components': 80, 'iw_logistic_c': 0.010351521361754558, 'iw_pca_fit': 'combined', 'iw_solver': 'lbfgs', 'iw_rho': 0.9}. Best is trial 115 with value: 0.22087868997186372.
[I 2026-05-04 06:48:36,128] Trial 146 finished with value: 0.21556151018916872 and parameters: {'alpha': 242563.2805168369, 'use_snp_selection': False, 'iw_method': 'pc_logistic', 'iw_clip_max': 1.25, 'iw_prob_clip': 0.008927385488460641, 'iw_n_components': 80, 'iw_logistic_c': 0.12417696188479718, 'iw_pca_fit': 'combined', 'iw_solver': 'lbfgs', 'iw_rho': 0.9}. Best is trial 115 with value: 0.22087868997186372.
[I 2026-05-04 06:51:32,391] Trial 147 finished with value: 0.2156923169858175 and parameters: {'alpha': 156871.0047797682, 'use_snp_selection': False, 'iw_method': 'pc_logistic', 'iw_clip_max': 1.25, 'iw_prob_clip': 0.005661984366343547, 'iw_n_components': 80, 'iw_logistic_c': 0.026923190938753238, 'iw_pca_fit': 'combined', 'iw_solver': 'lbfgs', 'iw_rho': 0.9}. Best is trial 115 with value: 0.22087868997186372.
[I 2026-05-04 06:54:09,805] Trial 148 finished with value: 0.20982347650429087 and parameters: {'alpha': 222396.46670129406, 'use_snp_selection': False, 'iw_method': 'pc_logistic', 'iw_clip_max': 1.5, 'iw_prob_clip': 0.00795792114285075, 'iw_n_components': 20, 'iw_logistic_c': 0.10344569351374681, 'iw_pca_fit': 'combined', 'iw_solver': 'lbfgs', 'iw_rho': 0.9}. Best is trial 115 with value: 0.22087868997186372.
[I 2026-05-04 06:57:04,804] Trial 149 finished with value: 0.21606093177038482 and parameters: {'alpha': 195643.79310259182, 'use_snp_selection': False, 'iw_method': 'pc_logistic', 'iw_clip_max': 1.25, 'iw_prob_clip': 0.001434915566141518, 'iw_n_components': 80, 'iw_logistic_c': 0.045021579775346564, 'iw_pca_fit': 'combined', 'iw_solver': 'lbfgs', 'iw_rho': 0.9}. Best is trial 115 with value: 0.22087868997186372.
