Running from this directory: /cluster/work/simennes/Master_thesis
Name of job: ncv_ridge_iw
ID of job: 24378207
Array task ID: 8
The job was run on these nodes: idun-04-25
[I 2026-05-04 00:17:28,347] Trial 0 finished with value: 0.24079186605563357 and parameters: {'alpha': 574323.565896313, 'use_snp_selection': False, 'iw_method': 'pc_logistic', 'iw_clip_max': 2.0, 'iw_prob_clip': 0.005989214663243749, 'iw_n_components': 20, 'iw_logistic_c': 2.8870927958158354, 'iw_pca_fit': 'combined', 'iw_solver': 'lbfgs', 'iw_rho': 1.0}. Best is trial 0 with value: 0.24079186605563357.
[I 2026-05-04 00:20:24,155] Trial 1 finished with value: 0.24360742257195325 and parameters: {'alpha': 145427.84270397192, 'use_snp_selection': False, 'iw_method': 'pc_logistic', 'iw_clip_max': 2.0, 'iw_prob_clip': 0.0022034134189735897, 'iw_n_components': 10, 'iw_logistic_c': 8.53225823447423, 'iw_pca_fit': 'combined', 'iw_solver': 'lbfgs', 'iw_rho': 1.0}. Best is trial 1 with value: 0.24360742257195325.
[I 2026-05-04 00:23:32,394] Trial 2 finished with value: 0.2502572504130269 and parameters: {'alpha': 337268.1824826383, 'use_snp_selection': False, 'iw_method': 'pc_logistic', 'iw_clip_max': 1.25, 'iw_prob_clip': 0.0011214380556681478, 'iw_n_components': 40, 'iw_logistic_c': 0.0004456301044046966, 'iw_pca_fit': 'combined', 'iw_solver': 'lbfgs', 'iw_rho': 0.5}. Best is trial 2 with value: 0.2502572504130269.
[I 2026-05-04 00:26:40,375] Trial 3 finished with value: 0.24316300468956603 and parameters: {'alpha': 623873.8362358484, 'use_snp_selection': False, 'iw_method': 'pc_logistic', 'iw_clip_max': 2.0, 'iw_prob_clip': 0.0010704282286164728, 'iw_n_components': 30, 'iw_logistic_c': 0.003649078989687946, 'iw_pca_fit': 'combined', 'iw_solver': 'lbfgs', 'iw_rho': 0.9}. Best is trial 2 with value: 0.2502572504130269.
[I 2026-05-04 00:27:12,778] Trial 4 finished with value: 0.23129693600784776 and parameters: {'alpha': 1199521.094898443, 'use_snp_selection': False, 'iw_method': 'uniform'}. Best is trial 2 with value: 0.2502572504130269.
[I 2026-05-04 00:30:24,987] Trial 5 finished with value: 0.24528349572092303 and parameters: {'alpha': 594205.5826125565, 'use_snp_selection': False, 'iw_method': 'pc_logistic', 'iw_clip_max': 1.5, 'iw_prob_clip': 0.017782866059784724, 'iw_n_components': 40, 'iw_logistic_c': 0.3876202021284575, 'iw_pca_fit': 'combined', 'iw_solver': 'lbfgs', 'iw_rho': 0.5}. Best is trial 2 with value: 0.2502572504130269.
[I 2026-05-04 00:33:21,431] Trial 6 finished with value: 0.2533308838580309 and parameters: {'alpha': 102431.18633356069, 'use_snp_selection': False, 'iw_method': 'pc_logistic', 'iw_clip_max': 1.25, 'iw_prob_clip': 0.0017147683107745938, 'iw_n_components': 20, 'iw_logistic_c': 4.32601466983518e-06, 'iw_pca_fit': 'combined', 'iw_solver': 'lbfgs', 'iw_rho': 0.9}. Best is trial 6 with value: 0.2533308838580309.
[I 2026-05-04 00:36:04,445] Trial 7 finished with value: 0.22792145048669327 and parameters: {'alpha': 1830941.3950631474, 'use_snp_selection': False, 'iw_method': 'pc_logistic', 'iw_clip_max': 2.0, 'iw_prob_clip': 0.006357173651119782, 'iw_n_components': 40, 'iw_logistic_c': 1.7003213055010015e-05, 'iw_pca_fit': 'combined', 'iw_solver': 'lbfgs', 'iw_rho': 0.5}. Best is trial 6 with value: 0.2533308838580309.
[I 2026-05-04 00:36:32,798] Trial 8 finished with value: 0.23107853296171865 and parameters: {'alpha': 1221444.8156569519, 'use_snp_selection': False, 'iw_method': 'uniform'}. Best is trial 6 with value: 0.2533308838580309.
[I 2026-05-04 00:37:01,154] Trial 9 finished with value: 0.25154108833245725 and parameters: {'alpha': 201218.30977627521, 'use_snp_selection': False, 'iw_method': 'uniform'}. Best is trial 6 with value: 0.2533308838580309.
[I 2026-05-04 00:37:29,507] Trial 10 finished with value: 0.2534403410941194 and parameters: {'alpha': 113520.84261895182, 'use_snp_selection': False, 'iw_method': 'uniform'}. Best is trial 10 with value: 0.2534403410941194.
[I 2026-05-04 00:37:57,851] Trial 11 finished with value: 0.2534354030627205 and parameters: {'alpha': 115281.00532043824, 'use_snp_selection': False, 'iw_method': 'uniform'}. Best is trial 10 with value: 0.2534403410941194.
[I 2026-05-04 00:38:26,187] Trial 12 finished with value: 0.2501152069452827 and parameters: {'alpha': 244890.1753201652, 'use_snp_selection': False, 'iw_method': 'uniform'}. Best is trial 10 with value: 0.2534403410941194.
[I 2026-05-04 00:38:54,537] Trial 13 finished with value: 0.25344238408231323 and parameters: {'alpha': 112183.63809407232, 'use_snp_selection': False, 'iw_method': 'uniform'}. Best is trial 13 with value: 0.25344238408231323.
[I 2026-05-04 00:39:22,913] Trial 14 finished with value: 0.2475229786316066 and parameters: {'alpha': 323433.90207972, 'use_snp_selection': False, 'iw_method': 'uniform'}. Best is trial 13 with value: 0.25344238408231323.
[I 2026-05-04 00:39:51,259] Trial 15 finished with value: 0.25227955645093625 and parameters: {'alpha': 176592.68053347513, 'use_snp_selection': False, 'iw_method': 'uniform'}. Best is trial 13 with value: 0.25344238408231323.
[I 2026-05-04 00:40:19,614] Trial 16 finished with value: 0.24752590197627528 and parameters: {'alpha': 323342.82174020115, 'use_snp_selection': False, 'iw_method': 'uniform'}. Best is trial 13 with value: 0.25344238408231323.
[I 2026-05-04 00:40:47,980] Trial 17 finished with value: 0.2220640480087681 and parameters: {'alpha': 2961325.0298305964, 'use_snp_selection': False, 'iw_method': 'uniform'}. Best is trial 13 with value: 0.25344238408231323.
[I 2026-05-04 00:41:16,346] Trial 18 finished with value: 0.2532224523344787 and parameters: {'alpha': 135878.23432847497, 'use_snp_selection': False, 'iw_method': 'uniform'}. Best is trial 13 with value: 0.25344238408231323.
[I 2026-05-04 00:41:44,720] Trial 19 finished with value: 0.25055818829214344 and parameters: {'alpha': 231565.0396608293, 'use_snp_selection': False, 'iw_method': 'uniform'}. Best is trial 13 with value: 0.25344238408231323.
[I 2026-05-04 00:42:13,093] Trial 20 finished with value: 0.25274956224339074 and parameters: {'alpha': 158818.63816214495, 'use_snp_selection': False, 'iw_method': 'uniform'}. Best is trial 13 with value: 0.25344238408231323.
[I 2026-05-04 00:42:41,464] Trial 21 finished with value: 0.2534117815037614 and parameters: {'alpha': 102927.38282556739, 'use_snp_selection': False, 'iw_method': 'uniform'}. Best is trial 13 with value: 0.25344238408231323.
[I 2026-05-04 00:43:09,845] Trial 22 finished with value: 0.2534228589790251 and parameters: {'alpha': 104486.1122432474, 'use_snp_selection': False, 'iw_method': 'uniform'}. Best is trial 13 with value: 0.25344238408231323.
[I 2026-05-04 00:43:38,245] Trial 23 finished with value: 0.2533035839262639 and parameters: {'alpha': 130379.22851351788, 'use_snp_selection': False, 'iw_method': 'uniform'}. Best is trial 13 with value: 0.25344238408231323.
[I 2026-05-04 00:44:06,639] Trial 24 finished with value: 0.24987661389746516 and parameters: {'alpha': 252035.6108369979, 'use_snp_selection': False, 'iw_method': 'uniform'}. Best is trial 13 with value: 0.25344238408231323.
[I 2026-05-04 00:44:35,042] Trial 25 finished with value: 0.24456194429134542 and parameters: {'alpha': 421488.4704470215, 'use_snp_selection': False, 'iw_method': 'uniform'}. Best is trial 13 with value: 0.25344238408231323.
[I 2026-05-04 00:45:03,429] Trial 26 finished with value: 0.25335159260253337 and parameters: {'alpha': 126462.28631562587, 'use_snp_selection': False, 'iw_method': 'uniform'}. Best is trial 13 with value: 0.25344238408231323.
[I 2026-05-04 00:45:31,801] Trial 27 finished with value: 0.2522052392281583 and parameters: {'alpha': 179203.3374606473, 'use_snp_selection': False, 'iw_method': 'uniform'}. Best is trial 13 with value: 0.25344238408231323.
[I 2026-05-04 00:46:00,173] Trial 28 finished with value: 0.2355021347819221 and parameters: {'alpha': 857865.8024973879, 'use_snp_selection': False, 'iw_method': 'uniform'}. Best is trial 13 with value: 0.25344238408231323.
[I 2026-05-04 00:46:28,555] Trial 29 finished with value: 0.25159647290285014 and parameters: {'alpha': 199449.5046872037, 'use_snp_selection': False, 'iw_method': 'uniform'}. Best is trial 13 with value: 0.25344238408231323.
[I 2026-05-04 00:46:56,932] Trial 30 finished with value: 0.2534201605735876 and parameters: {'alpha': 118506.12599285741, 'use_snp_selection': False, 'iw_method': 'uniform'}. Best is trial 13 with value: 0.25344238408231323.
[I 2026-05-04 00:47:25,316] Trial 31 finished with value: 0.25340501525009984 and parameters: {'alpha': 102119.10177036206, 'use_snp_selection': False, 'iw_method': 'uniform'}. Best is trial 13 with value: 0.25344238408231323.
[I 2026-05-04 00:47:53,682] Trial 32 finished with value: 0.25299010145591855 and parameters: {'alpha': 148274.3224191109, 'use_snp_selection': False, 'iw_method': 'uniform'}. Best is trial 13 with value: 0.25344238408231323.
[I 2026-05-04 00:48:22,053] Trial 33 finished with value: 0.2529559200840168 and parameters: {'alpha': 149872.1225874565, 'use_snp_selection': False, 'iw_method': 'uniform'}. Best is trial 13 with value: 0.25344238408231323.
[I 2026-05-04 00:50:59,440] Trial 34 finished with value: 0.25412584681739886 and parameters: {'alpha': 119890.84004662867, 'use_snp_selection': False, 'iw_method': 'pc_logistic', 'iw_clip_max': 5.0, 'iw_prob_clip': 0.04200285378439828, 'iw_n_components': 50, 'iw_logistic_c': 1.745565217834825e-07, 'iw_pca_fit': 'combined', 'iw_solver': 'lbfgs', 'iw_rho': 0.75}. Best is trial 34 with value: 0.25412584681739886.
[I 2026-05-04 00:53:37,001] Trial 35 finished with value: 0.24571195270065577 and parameters: {'alpha': 401726.1915489457, 'use_snp_selection': False, 'iw_method': 'pc_logistic', 'iw_clip_max': 5.0, 'iw_prob_clip': 0.041233617338008365, 'iw_n_components': 50, 'iw_logistic_c': 1.1432542568282217e-07, 'iw_pca_fit': 'combined', 'iw_solver': 'lbfgs', 'iw_rho': 0.75}. Best is trial 34 with value: 0.25412584681739886.
[I 2026-05-04 00:56:14,599] Trial 36 finished with value: 0.2548318168054509 and parameters: {'alpha': 125159.34558397779, 'use_snp_selection': False, 'iw_method': 'pc_logistic', 'iw_clip_max': 3.0, 'iw_prob_clip': 0.044306939498340005, 'iw_n_components': 50, 'iw_logistic_c': 3.378306734831656e-07, 'iw_pca_fit': 'combined', 'iw_solver': 'lbfgs', 'iw_rho': 0.75}. Best is trial 36 with value: 0.2548318168054509.
[I 2026-05-04 00:58:52,195] Trial 37 finished with value: 0.2532589485404671 and parameters: {'alpha': 159807.52097239695, 'use_snp_selection': False, 'iw_method': 'pc_logistic', 'iw_clip_max': 3.0, 'iw_prob_clip': 0.045529639267509296, 'iw_n_components': 50, 'iw_logistic_c': 1.1808718868539337e-07, 'iw_pca_fit': 'combined', 'iw_solver': 'lbfgs', 'iw_rho': 0.75}. Best is trial 36 with value: 0.2548318168054509.
[I 2026-05-04 01:01:35,776] Trial 38 finished with value: 0.25851246794986155 and parameters: {'alpha': 210693.48771982896, 'use_snp_selection': False, 'iw_method': 'pc_logistic', 'iw_clip_max': 5.0, 'iw_prob_clip': 0.018793634387921553, 'iw_n_components': 80, 'iw_logistic_c': 3.5589167598782464e-06, 'iw_pca_fit': 'combined', 'iw_solver': 'lbfgs', 'iw_rho': 0.75}. Best is trial 38 with value: 0.25851246794986155.
[I 2026-05-04 01:04:18,986] Trial 39 finished with value: 0.25989252911754707 and parameters: {'alpha': 215416.80705698198, 'use_snp_selection': False, 'iw_method': 'pc_logistic', 'iw_clip_max': 5.0, 'iw_prob_clip': 0.020295811033773314, 'iw_n_components': 80, 'iw_logistic_c': 3.0081861886150354e-06, 'iw_pca_fit': 'combined', 'iw_solver': 'lbfgs', 'iw_rho': 0.75}. Best is trial 39 with value: 0.25989252911754707.
[I 2026-05-04 01:07:02,987] Trial 40 finished with value: 0.25884159408833773 and parameters: {'alpha': 218904.35669225865, 'use_snp_selection': False, 'iw_method': 'pc_logistic', 'iw_clip_max': 5.0, 'iw_prob_clip': 0.019133762350624604, 'iw_n_components': 80, 'iw_logistic_c': 3.6648905143823587e-06, 'iw_pca_fit': 'combined', 'iw_solver': 'lbfgs', 'iw_rho': 0.75}. Best is trial 39 with value: 0.25989252911754707.
[I 2026-05-04 01:09:46,938] Trial 41 finished with value: 0.2595700545912309 and parameters: {'alpha': 271522.0697664489, 'use_snp_selection': False, 'iw_method': 'pc_logistic', 'iw_clip_max': 5.0, 'iw_prob_clip': 0.020081327736517558, 'iw_n_components': 80, 'iw_logistic_c': 3.0721325430774626e-06, 'iw_pca_fit': 'combined', 'iw_solver': 'lbfgs', 'iw_rho': 0.75}. Best is trial 39 with value: 0.25989252911754707.
[I 2026-05-04 01:12:30,806] Trial 42 finished with value: 0.2560575696966776 and parameters: {'alpha': 275508.1716599974, 'use_snp_selection': False, 'iw_method': 'pc_logistic', 'iw_clip_max': 5.0, 'iw_prob_clip': 0.015445913443540049, 'iw_n_components': 80, 'iw_logistic_c': 4.863438827091374e-06, 'iw_pca_fit': 'combined', 'iw_solver': 'lbfgs', 'iw_rho': 0.75}. Best is trial 39 with value: 0.25989252911754707.
[I 2026-05-04 01:15:14,546] Trial 43 finished with value: 0.25123234085508844 and parameters: {'alpha': 450486.8892653019, 'use_snp_selection': False, 'iw_method': 'pc_logistic', 'iw_clip_max': 5.0, 'iw_prob_clip': 0.013744936154397026, 'iw_n_components': 80, 'iw_logistic_c': 8.815183123151853e-06, 'iw_pca_fit': 'combined', 'iw_solver': 'lbfgs', 'iw_rho': 0.75}. Best is trial 39 with value: 0.25989252911754707.
[I 2026-05-04 01:17:58,574] Trial 44 finished with value: 0.25580106966818666 and parameters: {'alpha': 256243.03090995247, 'use_snp_selection': False, 'iw_method': 'pc_logistic', 'iw_clip_max': 5.0, 'iw_prob_clip': 0.015949019669992945, 'iw_n_components': 80, 'iw_logistic_c': 5.293706072580568e-06, 'iw_pca_fit': 'combined', 'iw_solver': 'lbfgs', 'iw_rho': 0.75}. Best is trial 39 with value: 0.25989252911754707.
[I 2026-05-04 01:20:43,613] Trial 45 finished with value: 0.2485395909802775 and parameters: {'alpha': 279805.9508517593, 'use_snp_selection': False, 'iw_method': 'pc_logistic', 'iw_clip_max': 5.0, 'iw_prob_clip': 0.02082831838523529, 'iw_n_components': 80, 'iw_logistic_c': 7.288965067253472e-05, 'iw_pca_fit': 'combined', 'iw_solver': 'lbfgs', 'iw_rho': 0.75}. Best is trial 39 with value: 0.25989252911754707.
[I 2026-05-04 01:23:27,290] Trial 46 finished with value: 0.26045509895470215 and parameters: {'alpha': 210956.45991141224, 'use_snp_selection': False, 'iw_method': 'pc_logistic', 'iw_clip_max': 5.0, 'iw_prob_clip': 0.010368577128515907, 'iw_n_components': 80, 'iw_logistic_c': 1.6044181923205664e-06, 'iw_pca_fit': 'combined', 'iw_solver': 'lbfgs', 'iw_rho': 0.75}. Best is trial 46 with value: 0.26045509895470215.
[I 2026-05-04 01:26:10,813] Trial 47 finished with value: 0.25883978980973005 and parameters: {'alpha': 208373.4192405596, 'use_snp_selection': False, 'iw_method': 'pc_logistic', 'iw_clip_max': 5.0, 'iw_prob_clip': 0.009524792928521342, 'iw_n_components': 80, 'iw_logistic_c': 1.02202895263306e-06, 'iw_pca_fit': 'combined', 'iw_solver': 'lbfgs', 'iw_rho': 0.75}. Best is trial 46 with value: 0.26045509895470215.
[I 2026-05-04 01:28:54,749] Trial 48 finished with value: 0.2560294409606635 and parameters: {'alpha': 354474.16161870613, 'use_snp_selection': False, 'iw_method': 'pc_logistic', 'iw_clip_max': 5.0, 'iw_prob_clip': 0.008694791331677098, 'iw_n_components': 80, 'iw_logistic_c': 1.0904555072375487e-06, 'iw_pca_fit': 'combined', 'iw_solver': 'lbfgs', 'iw_rho': 0.75}. Best is trial 46 with value: 0.26045509895470215.
[I 2026-05-04 01:31:33,456] Trial 49 finished with value: 0.2396563970803836 and parameters: {'alpha': 512093.6582408043, 'use_snp_selection': False, 'iw_method': 'pc_logistic', 'iw_clip_max': 5.0, 'iw_prob_clip': 0.009270477578650977, 'iw_n_components': 60, 'iw_logistic_c': 6.442897564031246e-05, 'iw_pca_fit': 'combined', 'iw_solver': 'lbfgs', 'iw_rho': 0.75}. Best is trial 46 with value: 0.26045509895470215.
[I 2026-05-04 01:34:17,354] Trial 50 finished with value: 0.256931302482084 and parameters: {'alpha': 297837.8665614836, 'use_snp_selection': False, 'iw_method': 'pc_logistic', 'iw_clip_max': 5.0, 'iw_prob_clip': 0.026947796954635075, 'iw_n_components': 80, 'iw_logistic_c': 9.380855986695603e-07, 'iw_pca_fit': 'combined', 'iw_solver': 'lbfgs', 'iw_rho': 0.75}. Best is trial 46 with value: 0.26045509895470215.
[I 2026-05-04 01:37:01,345] Trial 51 finished with value: 0.25937508028387724 and parameters: {'alpha': 213065.09366507616, 'use_snp_selection': False, 'iw_method': 'pc_logistic', 'iw_clip_max': 5.0, 'iw_prob_clip': 0.010684372394491942, 'iw_n_components': 80, 'iw_logistic_c': 1.2014982942284895e-06, 'iw_pca_fit': 'combined', 'iw_solver': 'lbfgs', 'iw_rho': 0.75}. Best is trial 46 with value: 0.26045509895470215.
[I 2026-05-04 01:39:44,763] Trial 52 finished with value: 0.2581002976948686 and parameters: {'alpha': 207783.08966072826, 'use_snp_selection': False, 'iw_method': 'pc_logistic', 'iw_clip_max': 5.0, 'iw_prob_clip': 0.010699077352972841, 'iw_n_components': 80, 'iw_logistic_c': 8.6959968679201e-07, 'iw_pca_fit': 'combined', 'iw_solver': 'lbfgs', 'iw_rho': 0.75}. Best is trial 46 with value: 0.26045509895470215.
[I 2026-05-04 01:42:28,286] Trial 53 finished with value: 0.2595577086882218 and parameters: {'alpha': 172825.69536769783, 'use_snp_selection': False, 'iw_method': 'pc_logistic', 'iw_clip_max': 5.0, 'iw_prob_clip': 0.010735315003496105, 'iw_n_components': 80, 'iw_logistic_c': 1.1297048316956373e-06, 'iw_pca_fit': 'combined', 'iw_solver': 'lbfgs', 'iw_rho': 0.75}. Best is trial 46 with value: 0.26045509895470215.
[I 2026-05-04 01:45:12,561] Trial 54 finished with value: 0.25300808850173173 and parameters: {'alpha': 177973.92286564948, 'use_snp_selection': False, 'iw_method': 'pc_logistic', 'iw_clip_max': 5.0, 'iw_prob_clip': 0.026951932565051, 'iw_n_components': 80, 'iw_logistic_c': 3.2324227241269703e-05, 'iw_pca_fit': 'combined', 'iw_solver': 'lbfgs', 'iw_rho': 0.75}. Best is trial 46 with value: 0.26045509895470215.
[I 2026-05-04 01:47:56,013] Trial 55 finished with value: 0.2496487044535002 and parameters: {'alpha': 364097.3575959997, 'use_snp_selection': False, 'iw_method': 'pc_logistic', 'iw_clip_max': 1.5, 'iw_prob_clip': 0.004412820749294643, 'iw_n_components': 80, 'iw_logistic_c': 1.6083151199353027e-06, 'iw_pca_fit': 'combined', 'iw_solver': 'lbfgs', 'iw_rho': 0.75}. Best is trial 46 with value: 0.26045509895470215.
[I 2026-05-04 01:50:39,468] Trial 56 finished with value: 0.25439847332783355 and parameters: {'alpha': 231426.96246446593, 'use_snp_selection': False, 'iw_method': 'pc_logistic', 'iw_clip_max': 5.0, 'iw_prob_clip': 0.02624491887365021, 'iw_n_components': 80, 'iw_logistic_c': 3.978810729383042e-07, 'iw_pca_fit': 'combined', 'iw_solver': 'lbfgs', 'iw_rho': 0.75}. Best is trial 46 with value: 0.26045509895470215.
[I 2026-05-04 01:53:25,165] Trial 57 finished with value: 0.2457344761372847 and parameters: {'alpha': 185995.89480585713, 'use_snp_selection': False, 'iw_method': 'pc_logistic', 'iw_clip_max': 5.0, 'iw_prob_clip': 0.012694374282382117, 'iw_n_components': 80, 'iw_logistic_c': 0.00015951083176697127, 'iw_pca_fit': 'combined', 'iw_solver': 'lbfgs', 'iw_rho': 0.75}. Best is trial 46 with value: 0.26045509895470215.
[I 2026-05-04 01:56:08,604] Trial 58 finished with value: 0.2424223560775923 and parameters: {'alpha': 229441.08029482324, 'use_snp_selection': False, 'iw_method': 'pc_logistic', 'iw_clip_max': 5.0, 'iw_prob_clip': 0.007451616332323414, 'iw_n_components': 60, 'iw_logistic_c': 0.0070483513024998164, 'iw_pca_fit': 'combined', 'iw_solver': 'lbfgs', 'iw_rho': 0.9}. Best is trial 46 with value: 0.26045509895470215.
[I 2026-05-04 01:58:41,943] Trial 59 finished with value: 0.25981159614313976 and parameters: {'alpha': 307235.976813781, 'use_snp_selection': False, 'iw_method': 'pc_logistic', 'iw_clip_max': 5.0, 'iw_prob_clip': 0.005801431903227982, 'iw_n_components': 30, 'iw_logistic_c': 1.9142272981190657e-06, 'iw_pca_fit': 'combined', 'iw_solver': 'lbfgs', 'iw_rho': 1.0}. Best is trial 46 with value: 0.26045509895470215.
[I 2026-05-04 02:01:14,799] Trial 60 finished with value: 0.24790741577267544 and parameters: {'alpha': 288303.7060733596, 'use_snp_selection': False, 'iw_method': 'pc_logistic', 'iw_clip_max': 5.0, 'iw_prob_clip': 0.0051311718174957945, 'iw_n_components': 30, 'iw_logistic_c': 1.292967651857274e-05, 'iw_pca_fit': 'combined', 'iw_solver': 'lbfgs', 'iw_rho': 1.0}. Best is trial 46 with value: 0.26045509895470215.
[I 2026-05-04 02:03:47,735] Trial 61 finished with value: 0.25310161183135615 and parameters: {'alpha': 724709.6009050995, 'use_snp_selection': False, 'iw_method': 'pc_logistic', 'iw_clip_max': 5.0, 'iw_prob_clip': 0.0032306806818945123, 'iw_n_components': 30, 'iw_logistic_c': 2.3212441696979263e-06, 'iw_pca_fit': 'combined', 'iw_solver': 'lbfgs', 'iw_rho': 1.0}. Best is trial 46 with value: 0.26045509895470215.
[I 2026-05-04 02:06:15,009] Trial 62 finished with value: 0.25737641488081414 and parameters: {'alpha': 168839.5626925178, 'use_snp_selection': False, 'iw_method': 'pc_logistic', 'iw_clip_max': 5.0, 'iw_prob_clip': 0.012032715104379131, 'iw_n_components': 10, 'iw_logistic_c': 5.716130665699066e-07, 'iw_pca_fit': 'combined', 'iw_solver': 'lbfgs', 'iw_rho': 1.0}. Best is trial 46 with value: 0.26045509895470215.
[I 2026-05-04 02:08:44,126] Trial 63 finished with value: 0.2488618311568122 and parameters: {'alpha': 312889.03048185684, 'use_snp_selection': False, 'iw_method': 'pc_logistic', 'iw_clip_max': 1.25, 'iw_prob_clip': 0.022698012137182803, 'iw_n_components': 20, 'iw_logistic_c': 2.6383736998980087e-06, 'iw_pca_fit': 'combined', 'iw_solver': 'lbfgs', 'iw_rho': 1.0}. Best is trial 46 with value: 0.26045509895470215.
