[I 2026-04-21 18:20:16,391] Trial 15 finished with value: 0.04740762346771879 and parameters: {'hidden_dims': '[256, 128]', 'dropout': 0.4202958557646419, 'batch_norm': False, 'lr': 0.00032904630222322853, 'weight_decay': 2.3863911176337085e-06, 'epochs': 254, 'loss': 'mae', 'optimizer': 'adamw', 'use_snp_selection': True, 'num_snps': 5496, 'weight_scheme': 'top-heavy', 'weight_clip_max': 5.0, 'weight_topheavy_top_frac': 0.49828636888917044, 'weight_topheavy_low': 0.5141248854977607, 'weight_topheavy_high': 5.968750904626171}. Best is trial 13 with value: 0.157849987116606.
[I 2026-04-21 18:20:43,869] Trial 16 finished with value: 0.13506537066114702 and parameters: {'hidden_dims': '[512, 128]', 'dropout': 0.1265550655154745, 'batch_norm': False, 'lr': 3.403926613344191e-05, 'weight_decay': 1.5654316857179317e-08, 'epochs': 212, 'loss': 'mae', 'optimizer': 'adam', 'use_snp_selection': False, 'weight_scheme': 'exponential', 'weight_clip_max': None, 'weight_exponential_beta': 7.904946460581973}. Best is trial 13 with value: 0.157849987116606.
[I 2026-04-21 18:20:46,093] Trial 0 finished with value: -0.025616311499237196 and parameters: {'hidden_dims': '[256, 128]', 'dropout': 0.18584155530312246, 'batch_norm': True, 'lr': 9.012665953349533e-06, 'weight_decay': 4.96591963698479e-06, 'epochs': 105, 'loss': 'mse', 'optimizer': 'sgd', 'use_snp_selection': True, 'num_snps': 25583, 'weight_scheme': 'minmax', 'weight_clip_max': 5.0, 'weight_minmax_eps': 0.14026014881292506}. Best is trial 0 with value: -0.025616311499237196.
[I 2026-04-21 18:20:58,028] Trial 17 finished with value: 0.08725585668433401 and parameters: {'hidden_dims': '[512, 128]', 'dropout': 0.13950166013726467, 'batch_norm': False, 'lr': 5.191175758629834e-06, 'weight_decay': 1.1420619191013438e-08, 'epochs': 59, 'loss': 'mae', 'optimizer': 'adam', 'use_snp_selection': True, 'num_snps': 5068, 'weight_scheme': 'exponential', 'weight_clip_max': 5.0, 'weight_exponential_beta': 7.81731061091555}. Best is trial 13 with value: 0.157849987116606.
[I 2026-04-21 18:20:58,349] Trial 1 finished with value: 0.04508134733696712 and parameters: {'hidden_dims': '[256, 64]', 'dropout': 0.05000949662985405, 'batch_norm': True, 'lr': 0.00015647443054904835, 'weight_decay': 5.158896024962846e-05, 'epochs': 152, 'loss': 'mse', 'optimizer': 'sgd', 'use_snp_selection': False, 'weight_scheme': 'linear', 'weight_clip_max': None, 'weight_linear_min_weight': 0.21922985165550554, 'weight_linear_max_weight': 1.6260435767424388}. Best is trial 1 with value: 0.04508134733696712.
[I 2026-04-21 18:21:18,664] Trial 18 finished with value: 0.12892876892909738 and parameters: {'hidden_dims': '[512, 128]', 'dropout': 0.35861294974720237, 'batch_norm': False, 'lr': 1.1179233343708463e-05, 'weight_decay': 4.481381781029265e-08, 'epochs': 154, 'loss': 'mae', 'optimizer': 'adam', 'use_snp_selection': False, 'weight_scheme': 'exponential', 'weight_clip_max': None, 'weight_exponential_beta': 7.877787585014977}. Best is trial 13 with value: 0.157849987116606.
[I 2026-04-21 18:21:20,375] Trial 2 finished with value: 0.044419972875657465 and parameters: {'hidden_dims': '[512, 128]', 'dropout': 0.2736730891340176, 'batch_norm': True, 'lr': 7.298114623433994e-05, 'weight_decay': 5.6346010385734023e-08, 'epochs': 185, 'loss': 'mae', 'optimizer': 'sgd', 'use_snp_selection': True, 'num_snps': 14091, 'weight_scheme': 'minmax', 'weight_clip_max': 10.0, 'weight_minmax_eps': 0.045780660776687306}. Best is trial 1 with value: 0.04508134733696712.
[I 2026-04-21 18:21:39,317] Trial 19 finished with value: 0.14182814749981898 and parameters: {'hidden_dims': '[512, 128]', 'dropout': 0.11244640097574995, 'batch_norm': False, 'lr': 2.7752590445794167e-06, 'weight_decay': 1.0075801310428868e-08, 'epochs': 117, 'loss': 'mae', 'optimizer': 'adamw', 'use_snp_selection': True, 'num_snps': 19763, 'weight_scheme': 'uniform', 'weight_clip_max': 10.0}. Best is trial 13 with value: 0.157849987116606.
[I 2026-04-21 18:21:57,862] Trial 3 finished with value: 0.0215367372301883 and parameters: {'hidden_dims': '[512, 64]', 'dropout': 0.30157795416637295, 'batch_norm': False, 'lr': 2.007492282795256e-05, 'weight_decay': 5.496446859789657e-06, 'epochs': 284, 'loss': 'mse', 'optimizer': 'sgd', 'use_snp_selection': False, 'weight_scheme': 'linear', 'weight_clip_max': None, 'weight_linear_min_weight': 0.24682154527102826, 'weight_linear_max_weight': 1.8338910783134623}. Best is trial 1 with value: 0.04508134733696712.
[I 2026-04-21 18:21:58,939] Trial 20 finished with value: 0.08490574872836502 and parameters: {'hidden_dims': '[512, 64]', 'dropout': 0.1919652068619599, 'batch_norm': False, 'lr': 1.2837366486423079e-06, 'weight_decay': 1.62487314753422e-07, 'epochs': 107, 'loss': 'mae', 'optimizer': 'adamw', 'use_snp_selection': True, 'num_snps': 19634, 'weight_scheme': 'uniform', 'weight_clip_max': 10.0}. Best is trial 13 with value: 0.157849987116606.
[I 2026-04-21 18:22:09,836] Trial 4 finished with value: 0.05129022776833917 and parameters: {'hidden_dims': '[256, 64]', 'dropout': 0.18128694708490736, 'batch_norm': False, 'lr': 8.951826748007403e-05, 'weight_decay': 2.1781541495465197e-07, 'epochs': 147, 'loss': 'mse', 'optimizer': 'sgd', 'use_snp_selection': False, 'weight_scheme': 'top-heavy', 'weight_clip_max': 5.0, 'weight_topheavy_top_frac': 0.1724888194073277, 'weight_topheavy_low': 1.1620865802171172, 'weight_topheavy_high': 3.476906528073177}. Best is trial 4 with value: 0.05129022776833917.
[I 2026-04-21 18:22:16,219] Trial 21 finished with value: 0.10096688703509034 and parameters: {'hidden_dims': '[512, 128]', 'dropout': 0.1029368111605984, 'batch_norm': False, 'lr': 3.165436742966833e-06, 'weight_decay': 1.2135210512886926e-08, 'epochs': 77, 'loss': 'mae', 'optimizer': 'adamw', 'use_snp_selection': True, 'num_snps': 15444, 'weight_scheme': 'uniform', 'weight_clip_max': 10.0}. Best is trial 13 with value: 0.157849987116606.
[I 2026-04-21 18:22:20,136] Trial 5 finished with value: 0.041154786607243705 and parameters: {'hidden_dims': '[256, 64]', 'dropout': 0.2571412946970998, 'batch_norm': True, 'lr': 3.546238022482882e-05, 'weight_decay': 1.0185234767613396e-06, 'epochs': 119, 'loss': 'mse', 'optimizer': 'sgd', 'use_snp_selection': False, 'weight_scheme': 'linear', 'weight_clip_max': 10.0, 'weight_linear_min_weight': 0.9405832045183805, 'weight_linear_max_weight': 3.413610925325811}. Best is trial 4 with value: 0.05129022776833917.
[I 2026-04-21 18:22:38,640] Trial 6 finished with value: 0.07829793046657231 and parameters: {'hidden_dims': '[256, 64]', 'dropout': 0.037961443806696214, 'batch_norm': True, 'lr': 3.644202049829694e-05, 'weight_decay': 9.73334309820277e-06, 'epochs': 243, 'loss': 'mae', 'optimizer': 'adam', 'use_snp_selection': False, 'weight_scheme': 'minmax', 'weight_clip_max': None, 'weight_minmax_eps': 0.08689611239934374}. Best is trial 6 with value: 0.07829793046657231.
[I 2026-04-21 18:22:46,192] Trial 22 finished with value: 0.1114081376745542 and parameters: {'hidden_dims': '[512, 128]', 'dropout': 0.22267820178398134, 'batch_norm': False, 'lr': 4.092993642310595e-06, 'weight_decay': 3.264063169834573e-08, 'epochs': 130, 'loss': 'mae', 'optimizer': 'adamw', 'use_snp_selection': True, 'num_snps': 43744, 'weight_scheme': 'exponential', 'weight_clip_max': 10.0, 'weight_exponential_beta': 0.15509576701551442}. Best is trial 13 with value: 0.157849987116606.
[I 2026-04-21 18:23:02,491] Trial 23 finished with value: 0.08683684249568162 and parameters: {'hidden_dims': '[512, 128]', 'dropout': 0.1315568950712564, 'batch_norm': False, 'lr': 2.4062310643763514e-05, 'weight_decay': 7.434570721713857e-08, 'epochs': 82, 'loss': 'mae', 'optimizer': 'adamw', 'use_snp_selection': True, 'num_snps': 11682, 'weight_scheme': 'uniform', 'weight_clip_max': 10.0}. Best is trial 13 with value: 0.157849987116606.
[I 2026-04-21 18:23:20,251] Trial 7 finished with value: 0.012756094461079693 and parameters: {'hidden_dims': '[512, 128]', 'dropout': 0.1304538168539244, 'batch_norm': False, 'lr': 1.5408060926311233e-05, 'weight_decay': 2.1989735568314356e-08, 'epochs': 250, 'loss': 'mse', 'optimizer': 'sgd', 'use_snp_selection': True, 'num_snps': 42550, 'weight_scheme': 'exponential', 'weight_clip_max': 10.0, 'weight_exponential_beta': 2.758850226029358}. Best is trial 6 with value: 0.07829793046657231.
[I 2026-04-21 18:23:26,470] Trial 24 finished with value: 0.11587948790901274 and parameters: {'hidden_dims': '[512, 128]', 'dropout': 0.08709551967216189, 'batch_norm': False, 'lr': 1.93024557705732e-06, 'weight_decay': 1.0106464825445606e-08, 'epochs': 208, 'loss': 'mae', 'optimizer': 'adam', 'use_snp_selection': True, 'num_snps': 20766, 'weight_scheme': 'top-heavy', 'weight_clip_max': 10.0, 'weight_topheavy_top_frac': 0.30663910198430405, 'weight_topheavy_low': 0.8262269236445798, 'weight_topheavy_high': 1.7088735963283874}. Best is trial 13 with value: 0.157849987116606.
[I 2026-04-21 18:23:41,792] Trial 8 finished with value: 0.05444667154581582 and parameters: {'hidden_dims': '[256, 128]', 'dropout': 0.05742396906738376, 'batch_norm': False, 'lr': 1.9761509510575143e-06, 'weight_decay': 2.933492239224291e-07, 'epochs': 82, 'loss': 'mae', 'optimizer': 'adam', 'use_snp_selection': True, 'num_snps': 29883, 'weight_scheme': 'minmax', 'weight_clip_max': 5.0, 'weight_minmax_eps': 0.0051288771726799584}. Best is trial 6 with value: 0.07829793046657231.
[I 2026-04-21 18:23:42,686] Trial 25 finished with value: 0.09930985538853031 and parameters: {'hidden_dims': '[256, 128]', 'dropout': 0.5849235589349904, 'batch_norm': False, 'lr': 4.482349432914413e-05, 'weight_decay': 6.980937253937145e-07, 'epochs': 167, 'loss': 'mae', 'optimizer': 'adam', 'use_snp_selection': True, 'num_snps': 10490, 'weight_scheme': 'top-heavy', 'weight_clip_max': None, 'weight_topheavy_top_frac': 0.34121401426130804, 'weight_topheavy_low': 0.7698339626382612, 'weight_topheavy_high': 4.135018440740476}. Best is trial 13 with value: 0.157849987116606.
[I 2026-04-21 18:24:00,933] Trial 26 finished with value: 0.08777064458959404 and parameters: {'hidden_dims': '[512, 128]', 'dropout': 0.15252596654985182, 'batch_norm': False, 'lr': 9.10837607127447e-06, 'weight_decay': 2.3207303733746226e-08, 'epochs': 134, 'loss': 'mae', 'optimizer': 'adamw', 'use_snp_selection': False, 'weight_scheme': 'uniform', 'weight_clip_max': 5.0}. Best is trial 13 with value: 0.157849987116606.
[I 2026-04-21 18:24:08,290] Trial 9 finished with value: 0.06405645301791218 and parameters: {'hidden_dims': '[256, 128]', 'dropout': 0.5795930447285386, 'batch_norm': False, 'lr': 0.00011782025260263196, 'weight_decay': 0.0005562063174273634, 'epochs': 218, 'loss': 'mae', 'optimizer': 'adamw', 'use_snp_selection': True, 'num_snps': 32226, 'weight_scheme': 'minmax', 'weight_clip_max': 5.0, 'weight_minmax_eps': 0.09600289105543994}. Best is trial 6 with value: 0.07829793046657231.
[I 2026-04-21 18:24:21,051] Trial 27 finished with value: 0.10720197763487165 and parameters: {'hidden_dims': '[512, 128]', 'dropout': 0.08841438067358053, 'batch_norm': False, 'lr': 2.338798494095638e-06, 'weight_decay': 1.1595753357986163e-07, 'epochs': 99, 'loss': 'mae', 'optimizer': 'adam', 'use_snp_selection': True, 'num_snps': 21651, 'weight_scheme': 'exponential', 'weight_clip_max': 10.0, 'weight_exponential_beta': 5.198880530456345}. Best is trial 13 with value: 0.157849987116606.
[I 2026-04-21 18:24:35,149] Trial 28 finished with value: 0.10243378575283597 and parameters: {'hidden_dims': '[256, 128]', 'dropout': 0.23355153746703916, 'batch_norm': False, 'lr': 7.1453213318366335e-06, 'weight_decay': 3.6839671390155744e-07, 'epochs': 195, 'loss': 'mae', 'optimizer': 'adamw', 'use_snp_selection': False, 'weight_scheme': 'uniform', 'weight_clip_max': None}. Best is trial 13 with value: 0.157849987116606.
[I 2026-04-21 18:24:48,240] Trial 10 finished with value: 0.06644939547163899 and parameters: {'hidden_dims': '[512, 64]', 'dropout': 0.4338375928678635, 'batch_norm': True, 'lr': 0.0009667920285641304, 'weight_decay': 6.976468597792388e-05, 'epochs': 294, 'loss': 'mae', 'optimizer': 'adam', 'use_snp_selection': False, 'weight_scheme': 'uniform', 'weight_clip_max': None}. Best is trial 6 with value: 0.07829793046657231.
[I 2026-04-21 18:24:56,629] Trial 29 finished with value: 0.14523945765594273 and parameters: {'hidden_dims': '[256, 128]', 'dropout': 0.3189613804411027, 'batch_norm': False, 'lr': 1.2455432404960814e-05, 'weight_decay': 3.367376213128851e-08, 'epochs': 68, 'loss': 'mse', 'optimizer': 'adam', 'use_snp_selection': True, 'num_snps': 40912, 'weight_scheme': 'top-heavy', 'weight_clip_max': 5.0, 'weight_topheavy_top_frac': 0.053764121058173464, 'weight_topheavy_low': 0.6821718239056227, 'weight_topheavy_high': 4.225483260805266}. Best is trial 13 with value: 0.157849987116606.
[I 2026-04-21 18:25:18,001] Trial 30 finished with value: 0.11586967493035853 and parameters: {'hidden_dims': '[256, 128]', 'dropout': 0.35038718689797493, 'batch_norm': False, 'lr': 1.3205797385707491e-05, 'weight_decay': 3.429319905966355e-08, 'epochs': 70, 'loss': 'mse', 'optimizer': 'adamw', 'use_snp_selection': True, 'num_snps': 39551, 'weight_scheme': 'top-heavy', 'weight_clip_max': 5.0, 'weight_topheavy_top_frac': 0.0641607359959579, 'weight_topheavy_low': 0.7044001404101209, 'weight_topheavy_high': 4.400094141565882}. Best is trial 13 with value: 0.157849987116606.
[I 2026-04-21 18:25:28,113] Trial 11 finished with value: 0.06378820096374326 and parameters: {'hidden_dims': '[512, 64]', 'dropout': 0.4516805843717058, 'batch_norm': True, 'lr': 0.0009928478748470076, 'weight_decay': 5.547084226283487e-05, 'epochs': 290, 'loss': 'mae', 'optimizer': 'adam', 'use_snp_selection': False, 'weight_scheme': 'uniform', 'weight_clip_max': None}. Best is trial 6 with value: 0.07829793046657231.
[I 2026-04-21 18:25:43,531] Trial 31 finished with value: 0.14223112698305215 and parameters: {'hidden_dims': '[256, 128]', 'dropout': 0.31332811447466846, 'batch_norm': False, 'lr': 5.516291918582928e-06, 'weight_decay': 1.775689125431863e-08, 'epochs': 96, 'loss': 'mse', 'optimizer': 'adam', 'use_snp_selection': True, 'num_snps': 53447, 'weight_scheme': 'top-heavy', 'weight_clip_max': 5.0, 'weight_topheavy_top_frac': 0.1812430523939776, 'weight_topheavy_low': 0.6506962048826289, 'weight_topheavy_high': 4.983130279836703}. Best is trial 13 with value: 0.157849987116606.
[I 2026-04-21 18:26:01,810] Trial 12 finished with value: 0.05806851934989093 and parameters: {'hidden_dims': '[512, 64]', 'dropout': 0.4134640118922238, 'batch_norm': True, 'lr': 0.0008477822420198197, 'weight_decay': 5.229627468514555e-05, 'epochs': 241, 'loss': 'mae', 'optimizer': 'adam', 'use_snp_selection': False, 'weight_scheme': 'uniform', 'weight_clip_max': None}. Best is trial 6 with value: 0.07829793046657231.
[I 2026-04-21 18:26:09,203] Trial 32 finished with value: 0.12470364182136263 and parameters: {'hidden_dims': '[256, 128]', 'dropout': 0.3568323352979327, 'batch_norm': False, 'lr': 5.63172900176102e-06, 'weight_decay': 4.959350175409192e-08, 'epochs': 99, 'loss': 'mse', 'optimizer': 'adam', 'use_snp_selection': True, 'num_snps': 53683, 'weight_scheme': 'top-heavy', 'weight_clip_max': 5.0, 'weight_topheavy_top_frac': 0.05074367508828703, 'weight_topheavy_low': 0.6555310376741881, 'weight_topheavy_high': 4.9856950404655}. Best is trial 13 with value: 0.157849987116606.
[I 2026-04-21 18:26:33,915] Trial 33 finished with value: 0.1489174306153805 and parameters: {'hidden_dims': '[256, 128]', 'dropout': 0.2973967573102353, 'batch_norm': False, 'lr': 3.5586154024493098e-06, 'weight_decay': 1.2914484154085832e-07, 'epochs': 113, 'loss': 'mse', 'optimizer': 'adam', 'use_snp_selection': True, 'num_snps': 46625, 'weight_scheme': 'top-heavy', 'weight_clip_max': 5.0, 'weight_topheavy_top_frac': 0.1944971025075975, 'weight_topheavy_low': 0.6313798590647907, 'weight_topheavy_high': 5.270232757642613}. Best is trial 13 with value: 0.157849987116606.
[I 2026-04-21 18:26:42,870] Trial 13 finished with value: 0.06096850892933111 and parameters: {'hidden_dims': '[512, 64]', 'dropout': 0.44665667317896396, 'batch_norm': True, 'lr': 0.00031846142052762143, 'weight_decay': 0.0005816188648485889, 'epochs': 300, 'loss': 'mae', 'optimizer': 'adam', 'use_snp_selection': False, 'weight_scheme': 'uniform', 'weight_clip_max': None}. Best is trial 6 with value: 0.07829793046657231.
[I 2026-04-21 18:26:58,515] Trial 34 finished with value: 0.14991594352592455 and parameters: {'hidden_dims': '[256, 128]', 'dropout': 0.3170089158635267, 'batch_norm': False, 'lr': 4.246969244325804e-06, 'weight_decay': 1.1769598833696831e-07, 'epochs': 92, 'loss': 'mse', 'optimizer': 'adam', 'use_snp_selection': True, 'num_snps': 50254, 'weight_scheme': 'top-heavy', 'weight_clip_max': 5.0, 'weight_topheavy_top_frac': 0.2014534897691331, 'weight_topheavy_low': 0.6238997447569388, 'weight_topheavy_high': 5.149803624798638}. Best is trial 13 with value: 0.157849987116606.
[I 2026-04-21 18:26:58,930] Trial 14 finished with value: 0.06982175187042307 and parameters: {'hidden_dims': '[256, 64]', 'dropout': 0.3608938911337143, 'batch_norm': True, 'lr': 3.2138990339899728e-06, 'weight_decay': 1.8215183711878244e-05, 'epochs': 205, 'loss': 'mae', 'optimizer': 'adam', 'use_snp_selection': False, 'weight_scheme': 'exponential', 'weight_clip_max': None, 'weight_exponential_beta': 7.948849485427058}. Best is trial 6 with value: 0.07829793046657231.
[I 2026-04-21 18:27:14,913] Trial 15 finished with value: -0.0012976504610729273 and parameters: {'hidden_dims': '[256, 64]', 'dropout': 0.3424329592118441, 'batch_norm': True, 'lr': 1.1066551454119695e-06, 'weight_decay': 1.32140027237211e-05, 'epochs': 205, 'loss': 'mae', 'optimizer': 'adamw', 'use_snp_selection': False, 'weight_scheme': 'exponential', 'weight_clip_max': None, 'weight_exponential_beta': 7.813974998058441}. Best is trial 6 with value: 0.07829793046657231.
[I 2026-04-21 18:27:21,014] Trial 16 finished with value: 0.03174330508397294 and parameters: {'hidden_dims': '[256, 64]', 'dropout': 0.5559411430842989, 'batch_norm': True, 'lr': 5.80007261839721e-06, 'weight_decay': 1.3346105630446587e-06, 'epochs': 51, 'loss': 'mae', 'optimizer': 'adam', 'use_snp_selection': False, 'weight_scheme': 'exponential', 'weight_clip_max': None, 'weight_exponential_beta': 7.948561910694334}. Best is trial 6 with value: 0.07829793046657231.
[I 2026-04-21 18:27:21,099] Trial 35 finished with value: 0.13797882683902918 and parameters: {'hidden_dims': '[256, 128]', 'dropout': 0.43259969428270295, 'batch_norm': False, 'lr': 1.805098770422056e-05, 'weight_decay': 1.6968622879733684e-06, 'epochs': 60, 'loss': 'mse', 'optimizer': 'adam', 'use_snp_selection': True, 'num_snps': 48207, 'weight_scheme': 'top-heavy', 'weight_clip_max': 5.0, 'weight_topheavy_top_frac': 0.20256837764422514, 'weight_topheavy_low': 0.6019640343991395, 'weight_topheavy_high': 5.160758341312559}. Best is trial 13 with value: 0.157849987116606.
[I 2026-04-21 18:27:40,196] Trial 17 finished with value: 0.03086915157159982 and parameters: {'hidden_dims': '[256, 64]', 'dropout': 0.00940914844124107, 'batch_norm': True, 'lr': 3.1176059730130553e-06, 'weight_decay': 1.5501220509705764e-05, 'epochs': 255, 'loss': 'mae', 'optimizer': 'adam', 'use_snp_selection': False, 'weight_scheme': 'top-heavy', 'weight_clip_max': None, 'weight_topheavy_top_frac': 0.49458555788125164, 'weight_topheavy_low': 0.5174589425369698, 'weight_topheavy_high': 5.980521000645855}. Best is trial 6 with value: 0.07829793046657231.
[I 2026-04-21 18:27:43,205] Trial 36 finished with value: 0.14639117105682234 and parameters: {'hidden_dims': '[256, 128]', 'dropout': 0.5039124986948795, 'batch_norm': False, 'lr': 8.57120301787703e-06, 'weight_decay': 3.076196618251149e-07, 'epochs': 117, 'loss': 'mse', 'optimizer': 'adam', 'use_snp_selection': True, 'num_snps': 36377, 'weight_scheme': 'top-heavy', 'weight_clip_max': 5.0, 'weight_topheavy_top_frac': 0.23275749442908455, 'weight_topheavy_low': 0.6045461825204475, 'weight_topheavy_high': 5.492664189110692}. Best is trial 13 with value: 0.157849987116606.
[I 2026-04-21 18:27:56,651] Trial 18 finished with value: 0.08081023880245293 and parameters: {'hidden_dims': '[256, 64]', 'dropout': 0.3707801367768836, 'batch_norm': True, 'lr': 5.07184084080806e-05, 'weight_decay': 0.00018012388720211082, 'epochs': 212, 'loss': 'mae', 'optimizer': 'adam', 'use_snp_selection': False, 'weight_scheme': 'exponential', 'weight_clip_max': None, 'weight_exponential_beta': 5.129970231782673}. Best is trial 18 with value: 0.08081023880245293.
[I 2026-04-21 18:28:06,458] Trial 37 finished with value: 0.13566348720341825 and parameters: {'hidden_dims': '[256, 128]', 'dropout': 0.5016614151600125, 'batch_norm': True, 'lr': 4.219732346223896e-06, 'weight_decay': 3.541221847191326e-07, 'epochs': 137, 'loss': 'mse', 'optimizer': 'adam', 'use_snp_selection': True, 'num_snps': 37599, 'weight_scheme': 'linear', 'weight_clip_max': 5.0, 'weight_linear_min_weight': 0.9499849685597606, 'weight_linear_max_weight': 3.6626851977029453}. Best is trial 13 with value: 0.157849987116606.
[I 2026-04-21 18:28:10,675] Trial 19 finished with value: 0.05191183836631404 and parameters: {'hidden_dims': '[256, 64]', 'dropout': 0.5145980787285876, 'batch_norm': True, 'lr': 4.828541349485789e-05, 'weight_decay': 0.0001847200768397268, 'epochs': 174, 'loss': 'mae', 'optimizer': 'adamw', 'use_snp_selection': False, 'weight_scheme': 'exponential', 'weight_clip_max': 10.0, 'weight_exponential_beta': 4.778764542300902}. Best is trial 18 with value: 0.08081023880245293.
