[I 2026-04-18 14:55:21,106] Trial 35 finished with value: 0.14564373749677179 and parameters: {'hidden_dims': '[256, 128]', 'dropout': 0.3175917694153708, 'batch_norm': False, 'lr': 0.0005621898872929857, 'weight_decay': 3.4997232878686607e-06, 'epochs': 180, 'loss': 'mse', 'optimizer': 'adamw', 'use_snp_selection': True, 'num_snps': 28821, 'weight_scheme': 'top-heavy', 'weight_clip_max': 5.0, 'weight_topheavy_top_frac': 0.2910003958489354, 'weight_topheavy_low': 1.1382154121626966, 'weight_topheavy_high': 2.415357655427819}. Best is trial 27 with value: 0.1654378560008301.
[I 2026-04-18 14:55:38,015] Trial 24 finished with value: 0.1623002116356478 and parameters: {'hidden_dims': '[512, 64]', 'dropout': 0.4286092656130711, 'batch_norm': True, 'lr': 5.4047488035995744e-05, 'weight_decay': 1.4542063514006751e-05, 'epochs': 243, 'loss': 'mae', 'optimizer': 'adamw', 'use_snp_selection': False, 'weight_scheme': 'minmax', 'weight_clip_max': 5.0, 'weight_minmax_eps': 0.05427918737554742}. Best is trial 23 with value: 0.18136235350903107.
[I 2026-04-18 14:55:54,660] Trial 36 finished with value: 0.1370853825682806 and parameters: {'hidden_dims': '[256, 128]', 'dropout': 0.2504815764505719, 'batch_norm': False, 'lr': 2.0139274541665384e-05, 'weight_decay': 7.661414850576771e-05, 'epochs': 140, 'loss': 'mse', 'optimizer': 'adamw', 'use_snp_selection': True, 'num_snps': 21427, 'weight_scheme': 'linear', 'weight_clip_max': 5.0, 'weight_linear_min_weight': 0.5933912229816198, 'weight_linear_max_weight': 2.757146034810728}. Best is trial 27 with value: 0.1654378560008301.
[I 2026-04-18 14:56:22,075] Trial 37 finished with value: -0.008620606413508725 and parameters: {'hidden_dims': '[512, 128]', 'dropout': 0.4061870853356627, 'batch_norm': True, 'lr': 4.16602450227564e-05, 'weight_decay': 0.00021004913486440019, 'epochs': 60, 'loss': 'mse', 'optimizer': 'sgd', 'use_snp_selection': True, 'num_snps': 10882, 'weight_scheme': 'top-heavy', 'weight_clip_max': 10.0, 'weight_topheavy_top_frac': 0.19057157652629886, 'weight_topheavy_low': 0.6787762159116587, 'weight_topheavy_high': 5.865806983673032}. Best is trial 27 with value: 0.1654378560008301.
[I 2026-04-18 14:56:36,048] Trial 25 finished with value: 0.16541078129216835 and parameters: {'hidden_dims': '[512, 64]', 'dropout': 0.3313299521983963, 'batch_norm': True, 'lr': 0.0002898699788759862, 'weight_decay': 4.180742640435088e-05, 'epochs': 195, 'loss': 'mae', 'optimizer': 'adamw', 'use_snp_selection': False, 'weight_scheme': 'uniform', 'weight_clip_max': None}. Best is trial 23 with value: 0.18136235350903107.
[I 2026-04-18 14:56:47,550] Trial 38 finished with value: 0.13034822733613036 and parameters: {'hidden_dims': '[512, 64]', 'dropout': 0.19654841678874257, 'batch_norm': False, 'lr': 0.00016229593455797066, 'weight_decay': 0.0004876565590541217, 'epochs': 81, 'loss': 'mse', 'optimizer': 'adamw', 'use_snp_selection': False, 'weight_scheme': 'uniform', 'weight_clip_max': 5.0}. Best is trial 27 with value: 0.1654378560008301.
[I 2026-04-18 14:57:21,631] Trial 39 finished with value: 0.1402185949260214 and parameters: {'hidden_dims': '[256, 128]', 'dropout': 0.3269373778825385, 'batch_norm': True, 'lr': 0.00025483665311005035, 'weight_decay': 1.0393631871865529e-05, 'epochs': 96, 'loss': 'mse', 'optimizer': 'sgd', 'use_snp_selection': True, 'num_snps': 27616, 'weight_scheme': 'exponential', 'weight_clip_max': None, 'weight_exponential_beta': 7.8361866776526155}. Best is trial 27 with value: 0.1654378560008301.
[I 2026-04-18 14:57:35,963] Trial 26 finished with value: 0.12140217633881316 and parameters: {'hidden_dims': '[256, 128]', 'dropout': 0.4335132527954594, 'batch_norm': False, 'lr': 1.0154626042385911e-06, 'weight_decay': 2.022312226685841e-06, 'epochs': 169, 'loss': 'mae', 'optimizer': 'adam', 'use_snp_selection': True, 'num_snps': 56888, 'weight_scheme': 'minmax', 'weight_clip_max': 5.0, 'weight_minmax_eps': 0.055347544099442425}. Best is trial 23 with value: 0.18136235350903107.
[I 2026-04-18 14:58:26,613] Trial 0 finished with value: -0.010013756221503266 and parameters: {'hidden_dims': '[256, 128]', 'dropout': 0.18584155530312246, 'batch_norm': True, 'lr': 9.012665953349533e-06, 'weight_decay': 4.96591963698479e-06, 'epochs': 105, 'loss': 'mse', 'optimizer': 'sgd', 'use_snp_selection': True, 'num_snps': 25583, 'weight_scheme': 'minmax', 'weight_clip_max': 5.0, 'weight_minmax_eps': 0.14026014881292506}. Best is trial 0 with value: -0.010013756221503266.
[I 2026-04-18 14:58:52,774] Trial 1 finished with value: 0.10832620153344327 and parameters: {'hidden_dims': '[256, 64]', 'dropout': 0.05000949662985405, 'batch_norm': True, 'lr': 0.00015647443054904835, 'weight_decay': 5.158896024962846e-05, 'epochs': 152, 'loss': 'mse', 'optimizer': 'sgd', 'use_snp_selection': False, 'weight_scheme': 'linear', 'weight_clip_max': None, 'weight_linear_min_weight': 0.21922985165550554, 'weight_linear_max_weight': 1.6260435767424388}. Best is trial 1 with value: 0.10832620153344327.
[I 2026-04-18 14:58:58,315] Trial 27 finished with value: 0.1620376272370448 and parameters: {'hidden_dims': '[512, 128]', 'dropout': 0.515274010631813, 'batch_norm': True, 'lr': 0.0005476324716622596, 'weight_decay': 7.701786712855344e-06, 'epochs': 283, 'loss': 'mae', 'optimizer': 'adamw', 'use_snp_selection': False, 'weight_scheme': 'minmax', 'weight_clip_max': 5.0, 'weight_minmax_eps': 0.16055336319540076}. Best is trial 23 with value: 0.18136235350903107.
[I 2026-04-18 14:59:32,343] Trial 2 finished with value: 0.06547233530458162 and parameters: {'hidden_dims': '[512, 128]', 'dropout': 0.2736730891340176, 'batch_norm': True, 'lr': 7.298114623433994e-05, 'weight_decay': 5.6346010385734023e-08, 'epochs': 185, 'loss': 'mae', 'optimizer': 'sgd', 'use_snp_selection': True, 'num_snps': 14091, 'weight_scheme': 'minmax', 'weight_clip_max': 10.0, 'weight_minmax_eps': 0.045780660776687306}. Best is trial 1 with value: 0.10832620153344327.
[I 2026-04-18 15:00:16,310] Trial 28 finished with value: 0.17622990031508984 and parameters: {'hidden_dims': '[512, 64]', 'dropout': 0.43777832876895506, 'batch_norm': False, 'lr': 0.00023853073394837588, 'weight_decay': 5.102328873244325e-07, 'epochs': 232, 'loss': 'mae', 'optimizer': 'adamw', 'use_snp_selection': True, 'num_snps': 44960, 'weight_scheme': 'minmax', 'weight_clip_max': 10.0, 'weight_minmax_eps': 0.022611693259875318}. Best is trial 23 with value: 0.18136235350903107.
[I 2026-04-18 15:00:55,428] Trial 3 finished with value: 0.04466721136809967 and parameters: {'hidden_dims': '[512, 64]', 'dropout': 0.30157795416637295, 'batch_norm': False, 'lr': 2.007492282795256e-05, 'weight_decay': 5.496446859789657e-06, 'epochs': 284, 'loss': 'mse', 'optimizer': 'sgd', 'use_snp_selection': False, 'weight_scheme': 'linear', 'weight_clip_max': None, 'weight_linear_min_weight': 0.24682154527102826, 'weight_linear_max_weight': 1.8338910783134623}. Best is trial 1 with value: 0.10832620153344327.
[I 2026-04-18 15:01:18,059] Trial 29 finished with value: 0.17757742623504053 and parameters: {'hidden_dims': '[256, 128]', 'dropout': 0.3369960888894153, 'batch_norm': False, 'lr': 2.3864569886887386e-05, 'weight_decay': 7.580176237190317e-07, 'epochs': 299, 'loss': 'mse', 'optimizer': 'adamw', 'use_snp_selection': True, 'num_snps': 42418, 'weight_scheme': 'minmax', 'weight_clip_max': 10.0, 'weight_minmax_eps': 0.015604079334697173}. Best is trial 23 with value: 0.18136235350903107.
[I 2026-04-18 15:01:20,689] Trial 4 finished with value: 0.15262103126410306 and parameters: {'hidden_dims': '[256, 64]', 'dropout': 0.18128694708490736, 'batch_norm': False, 'lr': 8.951826748007403e-05, 'weight_decay': 2.1781541495465197e-07, 'epochs': 147, 'loss': 'mse', 'optimizer': 'sgd', 'use_snp_selection': False, 'weight_scheme': 'top-heavy', 'weight_clip_max': 5.0, 'weight_topheavy_top_frac': 0.1724888194073277, 'weight_topheavy_low': 1.1620865802171172, 'weight_topheavy_high': 3.476906528073177}. Best is trial 4 with value: 0.15262103126410306.
[I 2026-04-18 15:01:42,269] Trial 5 finished with value: 0.05801697861729953 and parameters: {'hidden_dims': '[256, 64]', 'dropout': 0.2571412946970998, 'batch_norm': True, 'lr': 3.546238022482882e-05, 'weight_decay': 1.0185234767613396e-06, 'epochs': 119, 'loss': 'mse', 'optimizer': 'sgd', 'use_snp_selection': False, 'weight_scheme': 'linear', 'weight_clip_max': 10.0, 'weight_linear_min_weight': 0.9405832045183805, 'weight_linear_max_weight': 3.413610925325811}. Best is trial 4 with value: 0.15262103126410306.
[I 2026-04-18 15:02:19,911] Trial 30 finished with value: 0.17107536269726684 and parameters: {'hidden_dims': '[256, 128]', 'dropout': 0.3401367205271666, 'batch_norm': False, 'lr': 7.952260971893028e-06, 'weight_decay': 3.901095881647371e-07, 'epochs': 296, 'loss': 'mse', 'optimizer': 'adam', 'use_snp_selection': True, 'num_snps': 42860, 'weight_scheme': 'exponential', 'weight_clip_max': 10.0, 'weight_exponential_beta': 7.931218368137884}. Best is trial 23 with value: 0.18136235350903107.
[I 2026-04-18 15:02:22,481] Trial 6 finished with value: 0.14423397959039347 and parameters: {'hidden_dims': '[256, 64]', 'dropout': 0.037961443806696214, 'batch_norm': True, 'lr': 3.644202049829694e-05, 'weight_decay': 9.73334309820277e-06, 'epochs': 243, 'loss': 'mae', 'optimizer': 'adam', 'use_snp_selection': False, 'weight_scheme': 'minmax', 'weight_clip_max': None, 'weight_minmax_eps': 0.08689611239934374}. Best is trial 4 with value: 0.15262103126410306.
[I 2026-04-18 15:03:21,336] Trial 31 finished with value: 0.16859991094883212 and parameters: {'hidden_dims': '[256, 128]', 'dropout': 0.4163823435875475, 'batch_norm': False, 'lr': 1.4205731458394563e-05, 'weight_decay': 6.696628996227557e-07, 'epochs': 254, 'loss': 'mse', 'optimizer': 'adamw', 'use_snp_selection': True, 'num_snps': 47295, 'weight_scheme': 'minmax', 'weight_clip_max': 10.0, 'weight_minmax_eps': 0.005612968110754015}. Best is trial 23 with value: 0.18136235350903107.
[I 2026-04-18 15:03:42,972] Trial 7 finished with value: 0.06512748213018413 and parameters: {'hidden_dims': '[512, 128]', 'dropout': 0.1304538168539244, 'batch_norm': False, 'lr': 1.5408060926311233e-05, 'weight_decay': 2.1989735568314356e-08, 'epochs': 250, 'loss': 'mse', 'optimizer': 'sgd', 'use_snp_selection': True, 'num_snps': 42550, 'weight_scheme': 'exponential', 'weight_clip_max': 10.0, 'weight_exponential_beta': 2.758850226029358}. Best is trial 4 with value: 0.15262103126410306.
[I 2026-04-18 15:04:17,707] Trial 32 finished with value: 0.16856836021577087 and parameters: {'hidden_dims': '[256, 128]', 'dropout': 0.33143332176871415, 'batch_norm': False, 'lr': 2.5517071026713316e-05, 'weight_decay': 1.1522175515852122e-07, 'epochs': 276, 'loss': 'mse', 'optimizer': 'adamw', 'use_snp_selection': True, 'num_snps': 38993, 'weight_scheme': 'minmax', 'weight_clip_max': 10.0, 'weight_minmax_eps': 0.03569162230528811}. Best is trial 23 with value: 0.18136235350903107.
[I 2026-04-18 15:04:21,397] Trial 8 finished with value: 0.1398193764347094 and parameters: {'hidden_dims': '[256, 128]', 'dropout': 0.05742396906738376, 'batch_norm': False, 'lr': 1.9761509510575143e-06, 'weight_decay': 2.933492239224291e-07, 'epochs': 82, 'loss': 'mae', 'optimizer': 'adam', 'use_snp_selection': True, 'num_snps': 29883, 'weight_scheme': 'minmax', 'weight_clip_max': 5.0, 'weight_minmax_eps': 0.0051288771726799584}. Best is trial 4 with value: 0.15262103126410306.
[I 2026-04-18 15:05:10,325] Trial 9 finished with value: 0.12495413418926182 and parameters: {'hidden_dims': '[256, 128]', 'dropout': 0.5795930447285386, 'batch_norm': False, 'lr': 0.00011782025260263196, 'weight_decay': 0.0005562063174273634, 'epochs': 218, 'loss': 'mae', 'optimizer': 'adamw', 'use_snp_selection': True, 'num_snps': 32226, 'weight_scheme': 'minmax', 'weight_clip_max': 5.0, 'weight_minmax_eps': 0.09600289105543994}. Best is trial 4 with value: 0.15262103126410306.
[I 2026-04-18 15:05:19,479] Trial 33 finished with value: 0.1509053527310158 and parameters: {'hidden_dims': '[256, 128]', 'dropout': 0.23999377983389572, 'batch_norm': False, 'lr': 4.565210200784159e-05, 'weight_decay': 2.451938253377165e-06, 'epochs': 237, 'loss': 'mse', 'optimizer': 'adamw', 'use_snp_selection': True, 'num_snps': 50801, 'weight_scheme': 'linear', 'weight_clip_max': 10.0, 'weight_linear_min_weight': 0.9964877733119573, 'weight_linear_max_weight': 3.9144747678208316}. Best is trial 23 with value: 0.18136235350903107.
[I 2026-04-18 15:05:59,770] Trial 10 finished with value: 0.042572772451019966 and parameters: {'hidden_dims': '[512, 64]', 'dropout': 0.4338375928678635, 'batch_norm': False, 'lr': 0.0009667920285641304, 'weight_decay': 1.6238905019587032e-07, 'epochs': 156, 'loss': 'mse', 'optimizer': 'adamw', 'use_snp_selection': False, 'weight_scheme': 'top-heavy', 'weight_clip_max': 5.0, 'weight_topheavy_top_frac': 0.1655564683143657, 'weight_topheavy_low': 1.1713527187377861, 'weight_topheavy_high': 3.510875134959609}. Best is trial 4 with value: 0.15262103126410306.
[I 2026-04-18 15:06:13,222] Trial 34 finished with value: 0.16361028696111896 and parameters: {'hidden_dims': '[256, 128]', 'dropout': 0.4484511819331493, 'batch_norm': False, 'lr': 9.022042824209771e-05, 'weight_decay': 4.135225582559785e-06, 'epochs': 281, 'loss': 'mse', 'optimizer': 'adamw', 'use_snp_selection': True, 'num_snps': 35341, 'weight_scheme': 'minmax', 'weight_clip_max': 10.0, 'weight_minmax_eps': 0.030018777082104424}. Best is trial 23 with value: 0.18136235350903107.
[I 2026-04-18 15:06:37,239] Trial 11 finished with value: 0.11906774169354599 and parameters: {'hidden_dims': '[256, 64]', 'dropout': 0.012566753472985293, 'batch_norm': True, 'lr': 0.00041602458624906413, 'weight_decay': 4.7666069391840636e-05, 'epochs': 223, 'loss': 'mae', 'optimizer': 'adam', 'use_snp_selection': False, 'weight_scheme': 'uniform', 'weight_clip_max': None}. Best is trial 4 with value: 0.15262103126410306.
[I 2026-04-18 15:07:07,521] Trial 35 finished with value: 0.16681278784081002 and parameters: {'hidden_dims': '[256, 64]', 'dropout': 0.29924461773594047, 'batch_norm': False, 'lr': 7.973716194670746e-06, 'weight_decay': 6.548955622310071e-08, 'epochs': 256, 'loss': 'mse', 'optimizer': 'adamw', 'use_snp_selection': True, 'num_snps': 37583, 'weight_scheme': 'minmax', 'weight_clip_max': 10.0, 'weight_minmax_eps': 0.07117676773716725}. Best is trial 23 with value: 0.18136235350903107.
[I 2026-04-18 15:07:25,034] Trial 12 finished with value: 0.11064286523987261 and parameters: {'hidden_dims': '[256, 64]', 'dropout': 0.14369673219464876, 'batch_norm': True, 'lr': 6.536723168823821e-06, 'weight_decay': 2.722157479479287e-05, 'epochs': 295, 'loss': 'mae', 'optimizer': 'adam', 'use_snp_selection': False, 'weight_scheme': 'top-heavy', 'weight_clip_max': None, 'weight_topheavy_top_frac': 0.392134834906246, 'weight_topheavy_low': 1.0224402490019109, 'weight_topheavy_high': 1.6127783013205765}. Best is trial 4 with value: 0.15262103126410306.
[I 2026-04-18 15:07:57,383] Trial 13 finished with value: 0.13437823343801142 and parameters: {'hidden_dims': '[256, 64]', 'dropout': 0.3818740051592507, 'batch_norm': False, 'lr': 5.8285361077833684e-05, 'weight_decay': 9.324833944320273e-07, 'epochs': 191, 'loss': 'mae', 'optimizer': 'adam', 'use_snp_selection': False, 'weight_scheme': 'top-heavy', 'weight_clip_max': None, 'weight_topheavy_top_frac': 0.0537653326586055, 'weight_topheavy_low': 0.584263434104639, 'weight_topheavy_high': 5.953811342115056}. Best is trial 4 with value: 0.15262103126410306.
[I 2026-04-18 15:08:11,437] Trial 14 finished with value: 0.10457094705140453 and parameters: {'hidden_dims': '[256, 64]', 'dropout': 0.11934564603466538, 'batch_norm': True, 'lr': 0.00027748291985282185, 'weight_decay': 0.000996886833038578, 'epochs': 63, 'loss': 'mse', 'optimizer': 'adam', 'use_snp_selection': False, 'weight_scheme': 'exponential', 'weight_clip_max': 5.0, 'weight_exponential_beta': 7.8092158053774465}. Best is trial 4 with value: 0.15262103126410306.
[I 2026-04-18 15:08:38,781] Trial 36 finished with value: 0.15398304506537053 and parameters: {'hidden_dims': '[512, 64]', 'dropout': 0.21584803163767602, 'batch_norm': False, 'lr': 0.00023289856667098555, 'weight_decay': 6.093995730520423e-07, 'epochs': 300, 'loss': 'mse', 'optimizer': 'sgd', 'use_snp_selection': True, 'num_snps': 47354, 'weight_scheme': 'linear', 'weight_clip_max': 10.0, 'weight_linear_min_weight': 0.6110905569776935, 'weight_linear_max_weight': 2.7623152660213814}. Best is trial 23 with value: 0.18136235350903107.
[I 2026-04-18 15:08:52,270] Trial 15 finished with value: 0.1357443418601838 and parameters: {'hidden_dims': '[256, 64]', 'dropout': 0.21227739570077941, 'batch_norm': False, 'lr': 2.0469455824457293e-06, 'weight_decay': 1.2194471231603074e-06, 'epochs': 252, 'loss': 'mae', 'optimizer': 'adamw', 'use_snp_selection': False, 'weight_scheme': 'uniform', 'weight_clip_max': 5.0}. Best is trial 4 with value: 0.15262103126410306.
[I 2026-04-18 15:09:15,700] Trial 16 finished with value: 0.1138632288727633 and parameters: {'hidden_dims': '[256, 64]', 'dropout': 0.08959662580393796, 'batch_norm': False, 'lr': 3.9306043610785806e-05, 'weight_decay': 1.1476517125980609e-08, 'epochs': 129, 'loss': 'mae', 'optimizer': 'adam', 'use_snp_selection': False, 'weight_scheme': 'top-heavy', 'weight_clip_max': None, 'weight_topheavy_top_frac': 0.2619674113102849, 'weight_topheavy_low': 0.8295788558390201, 'weight_topheavy_high': 3.5954700203729044}. Best is trial 4 with value: 0.15262103126410306.
[I 2026-04-18 15:09:54,597] Trial 37 finished with value: 0.1612683606874898 and parameters: {'hidden_dims': '[512, 128]', 'dropout': 0.36715947863728676, 'batch_norm': False, 'lr': 0.00010899401605381863, 'weight_decay': 1.4366911653510071e-07, 'epochs': 179, 'loss': 'mse', 'optimizer': 'adamw', 'use_snp_selection': True, 'num_snps': 52274, 'weight_scheme': 'top-heavy', 'weight_clip_max': 10.0, 'weight_topheavy_top_frac': 0.41264331560273637, 'weight_topheavy_low': 0.5911150268766519, 'weight_topheavy_high': 5.9437045647041735}. Best is trial 23 with value: 0.18136235350903107.
[I 2026-04-18 15:10:21,148] Trial 17 finished with value: 0.07403404848779985 and parameters: {'hidden_dims': '[512, 64]', 'dropout': 0.003559598877807761, 'batch_norm': True, 'lr': 7.352353295903018e-06, 'weight_decay': 8.403513310520455e-06, 'epochs': 211, 'loss': 'mse', 'optimizer': 'adam', 'use_snp_selection': False, 'weight_scheme': 'top-heavy', 'weight_clip_max': None, 'weight_topheavy_top_frac': 0.4619792060161293, 'weight_topheavy_low': 1.171431271307201, 'weight_topheavy_high': 5.0522295477806916}. Best is trial 4 with value: 0.15262103126410306.
[I 2026-04-18 15:10:49,887] Trial 38 finished with value: 0.09398338365152807 and parameters: {'hidden_dims': '[256, 64]', 'dropout': 0.2878879445330912, 'batch_norm': False, 'lr': 8.516449794035464e-05, 'weight_decay': 5.38323621122938e-06, 'epochs': 129, 'loss': 'mae', 'optimizer': 'sgd', 'use_snp_selection': True, 'num_snps': 58958, 'weight_scheme': 'minmax', 'weight_clip_max': 10.0, 'weight_minmax_eps': 0.017398160394616197}. Best is trial 23 with value: 0.18136235350903107.
[I 2026-04-18 15:11:38,409] Trial 18 finished with value: 0.10908768031200586 and parameters: {'hidden_dims': '[512, 128]', 'dropout': 0.35037541745732603, 'batch_norm': True, 'lr': 0.00015177017916706743, 'weight_decay': 0.00013686167096659463, 'epochs': 261, 'loss': 'mae', 'optimizer': 'sgd', 'use_snp_selection': False, 'weight_scheme': 'minmax', 'weight_clip_max': 5.0, 'weight_minmax_eps': 0.19097590085079535}. Best is trial 4 with value: 0.15262103126410306.
[I 2026-04-18 15:11:40,979] Trial 39 finished with value: 0.17038809461731455 and parameters: {'hidden_dims': '[256, 128]', 'dropout': 0.492502580206021, 'batch_norm': False, 'lr': 2.2439965549792446e-05, 'weight_decay': 1.2508227292327163e-05, 'epochs': 208, 'loss': 'mse', 'optimizer': 'adamw', 'use_snp_selection': True, 'num_snps': 39361, 'weight_scheme': 'uniform', 'weight_clip_max': 5.0}. Best is trial 23 with value: 0.18136235350903107.
[I 2026-04-18 15:12:05,973] Trial 19 finished with value: 0.12466012755161338 and parameters: {'hidden_dims': '[256, 64]', 'dropout': 0.19960759741231937, 'batch_norm': False, 'lr': 0.0004420872718074983, 'weight_decay': 2.5143206124723815e-07, 'epochs': 158, 'loss': 'mse', 'optimizer': 'adamw', 'use_snp_selection': False, 'weight_scheme': 'exponential', 'weight_clip_max': 10.0, 'weight_exponential_beta': 0.3912338980817007}. Best is trial 4 with value: 0.15262103126410306.
[I 2026-04-18 15:12:35,869] Trial 20 finished with value: 0.024692632764540662 and parameters: {'hidden_dims': '[256, 64]', 'dropout': 0.523029007228637, 'batch_norm': False, 'lr': 1.769958988078808e-05, 'weight_decay': 1.5148973379795927e-05, 'epochs': 180, 'loss': 'mae', 'optimizer': 'sgd', 'use_snp_selection': False, 'weight_scheme': 'uniform', 'weight_clip_max': 5.0}. Best is trial 4 with value: 0.15262103126410306.
[I 2026-04-18 15:12:53,673] Trial 0 finished with value: 0.041259986619588684 and parameters: {'hidden_dims': '[256, 128]', 'dropout': 0.18584155530312246, 'batch_norm': True, 'lr': 9.012665953349533e-06, 'weight_decay': 4.96591963698479e-06, 'epochs': 105, 'loss': 'mse', 'optimizer': 'sgd', 'use_snp_selection': True, 'num_snps': 25583, 'weight_scheme': 'minmax', 'weight_clip_max': 5.0, 'weight_minmax_eps': 0.14026014881292506}. Best is trial 0 with value: 0.041259986619588684.
