Running from this directory: /cluster/work/simennes/Master_thesis
Name of job: ncv_ridge_avggrm
ID of job: 24332637
Array task ID: 5
The job was run on these nodes: idun-04-31
[I 2026-04-22 13:51:00,488] Trial 0 finished with value: 0.15582563794806087 and parameters: {'alpha': 12124.394605078569, 'use_snp_selection': True, 'num_snps': 5442, 'weight_scheme': 'linear', 'weight_clip_max': 5.0, 'weight_linear_min_weight': 0.5849999641604302, 'weight_linear_max_weight': 1.017621356653175}. Best is trial 0 with value: 0.15582563794806087.
[I 2026-04-22 13:52:27,674] Trial 1 finished with value: 0.19688136954153224 and parameters: {'alpha': 109374.19486700959, 'use_snp_selection': True, 'num_snps': 25583, 'weight_scheme': 'minmax', 'weight_clip_max': 5.0, 'weight_minmax_eps': 0.14026014881292506}. Best is trial 1 with value: 0.19688136954153224.
[I 2026-04-22 13:54:34,073] Trial 2 finished with value: 0.1823337000721537 and parameters: {'alpha': 87498.4492964452, 'use_snp_selection': True, 'num_snps': 53815, 'weight_scheme': 'linear', 'weight_clip_max': 5.0, 'weight_linear_min_weight': 0.27089068881512934, 'weight_linear_max_weight': 2.0548794162981476}. Best is trial 1 with value: 0.19688136954153224.
[I 2026-04-22 13:55:27,435] Trial 3 finished with value: 0.18841441931083425 and parameters: {'alpha': 194477.78458557956, 'use_snp_selection': False, 'weight_scheme': 'linear', 'weight_clip_max': None, 'weight_linear_min_weight': 0.21922985165550554, 'weight_linear_max_weight': 1.6260435767424388}. Best is trial 1 with value: 0.19688136954153224.
[I 2026-04-22 13:56:27,465] Trial 4 finished with value: 0.18886199773054144 and parameters: {'alpha': 9421665.195468841, 'use_snp_selection': False, 'weight_scheme': 'minmax', 'weight_clip_max': 5.0, 'weight_minmax_eps': 0.030689801852077123}. Best is trial 1 with value: 0.19688136954153224.
[I 2026-04-22 13:57:35,764] Trial 5 finished with value: 0.13518665222941492 and parameters: {'alpha': 5024.251153421461, 'use_snp_selection': True, 'num_snps': 9046, 'weight_scheme': 'top-heavy', 'weight_clip_max': 10.0, 'weight_topheavy_top_frac': 0.08738114702774886, 'weight_topheavy_low': 0.8991910356358707, 'weight_topheavy_high': 2.2968843007908903}. Best is trial 1 with value: 0.19688136954153224.
[I 2026-04-22 13:58:34,499] Trial 6 finished with value: 0.1261193036081605 and parameters: {'alpha': 16.382429914774185, 'use_snp_selection': False, 'weight_scheme': 'uniform', 'weight_clip_max': 10.0}. Best is trial 1 with value: 0.19688136954153224.
[I 2026-04-22 14:00:40,628] Trial 7 finished with value: 0.18577544706871052 and parameters: {'alpha': 94169.1049689093, 'use_snp_selection': True, 'num_snps': 47654, 'weight_scheme': 'exponential', 'weight_clip_max': 10.0, 'weight_exponential_beta': 2.3870207999558124}. Best is trial 1 with value: 0.19688136954153224.
[I 2026-04-22 14:01:44,906] Trial 8 finished with value: 0.04709660811524811 and parameters: {'alpha': 96.38034897458088, 'use_snp_selection': True, 'num_snps': 5388, 'weight_scheme': 'minmax', 'weight_clip_max': None, 'weight_minmax_eps': 0.07791532902904205}. Best is trial 1 with value: 0.19688136954153224.
[I 2026-04-22 14:02:40,194] Trial 9 finished with value: 0.18926282519062884 and parameters: {'alpha': 2700506.792350819, 'use_snp_selection': False, 'weight_scheme': 'linear', 'weight_clip_max': 5.0, 'weight_linear_min_weight': 0.8693390069349902, 'weight_linear_max_weight': 2.1394245284712112}. Best is trial 1 with value: 0.19688136954153224.
[I 2026-04-22 14:04:13,731] Trial 10 finished with value: 0.15414885354459365 and parameters: {'alpha': 859.5702697532038, 'use_snp_selection': True, 'num_snps': 27886, 'weight_scheme': 'minmax', 'weight_clip_max': 5.0, 'weight_minmax_eps': 0.19446588700282863}. Best is trial 1 with value: 0.19688136954153224.
[I 2026-04-22 14:04:59,921] Trial 11 finished with value: 0.18042720298974638 and parameters: {'alpha': 5712675.576910181, 'use_snp_selection': False, 'weight_scheme': 'uniform', 'weight_clip_max': 5.0}. Best is trial 1 with value: 0.19688136954153224.
[I 2026-04-22 14:05:54,399] Trial 12 finished with value: 0.188276854643854 and parameters: {'alpha': 774371.0299413771, 'use_snp_selection': False, 'weight_scheme': 'top-heavy', 'weight_clip_max': 5.0, 'weight_topheavy_top_frac': 0.4996369191639481, 'weight_topheavy_low': 0.5170379059205323, 'weight_topheavy_high': 5.352793790969191}. Best is trial 1 with value: 0.19688136954153224.
[I 2026-04-22 14:06:51,172] Trial 13 finished with value: 0.18561807187700186 and parameters: {'alpha': 1420711.4983211306, 'use_snp_selection': False, 'weight_scheme': 'exponential', 'weight_clip_max': 5.0, 'weight_exponential_beta': 7.104149133516018}. Best is trial 1 with value: 0.19688136954153224.
[I 2026-04-22 14:08:38,572] Trial 14 finished with value: 0.1807855903086966 and parameters: {'alpha': 15332.425850988226, 'use_snp_selection': True, 'num_snps': 29357, 'weight_scheme': 'minmax', 'weight_clip_max': 5.0, 'weight_minmax_eps': 0.16582443604613986}. Best is trial 1 with value: 0.19688136954153224.
[I 2026-04-22 14:09:32,564] Trial 15 finished with value: 0.1933634829491017 and parameters: {'alpha': 703307.8681405359, 'use_snp_selection': False, 'weight_scheme': 'linear', 'weight_clip_max': None, 'weight_linear_min_weight': 0.9798876230952135, 'weight_linear_max_weight': 3.2753002858475733}. Best is trial 1 with value: 0.19688136954153224.
[I 2026-04-22 14:10:26,725] Trial 16 finished with value: 0.19147676225462898 and parameters: {'alpha': 292797.07359770924, 'use_snp_selection': False, 'weight_scheme': 'linear', 'weight_clip_max': None, 'weight_linear_min_weight': 0.9912056934138497, 'weight_linear_max_weight': 3.6739284358671687}. Best is trial 1 with value: 0.19688136954153224.
[I 2026-04-22 14:11:46,595] Trial 17 finished with value: 0.13930596848770305 and parameters: {'alpha': 2285.351210863809, 'use_snp_selection': True, 'num_snps': 19963, 'weight_scheme': 'minmax', 'weight_clip_max': None, 'weight_minmax_eps': 0.12385684731663732}. Best is trial 1 with value: 0.19688136954153224.
[I 2026-04-22 14:12:32,712] Trial 18 finished with value: 0.16570752089500723 and parameters: {'alpha': 30286.335127006423, 'use_snp_selection': False, 'weight_scheme': 'uniform', 'weight_clip_max': None}. Best is trial 1 with value: 0.19688136954153224.
[I 2026-04-22 14:14:24,354] Trial 19 finished with value: 0.19347313662259172 and parameters: {'alpha': 624590.0469103758, 'use_snp_selection': True, 'num_snps': 42608, 'weight_scheme': 'exponential', 'weight_clip_max': None, 'weight_exponential_beta': 0.701413775926087}. Best is trial 1 with value: 0.19688136954153224.
[I 2026-04-22 14:16:16,601] Trial 20 finished with value: 0.14072021980571786 and parameters: {'alpha': 532.6454990366137, 'use_snp_selection': True, 'num_snps': 42967, 'weight_scheme': 'exponential', 'weight_clip_max': None, 'weight_exponential_beta': 0.1352814780326983}. Best is trial 1 with value: 0.19688136954153224.
[I 2026-04-22 14:18:07,138] Trial 21 finished with value: 0.19378625611721273 and parameters: {'alpha': 451694.60879296, 'use_snp_selection': True, 'num_snps': 37875, 'weight_scheme': 'exponential', 'weight_clip_max': None, 'weight_exponential_beta': 3.7144892709853616}. Best is trial 1 with value: 0.19688136954153224.
[I 2026-04-22 14:19:53,301] Trial 22 finished with value: 0.18229354144904616 and parameters: {'alpha': 56838.61052632198, 'use_snp_selection': True, 'num_snps': 38656, 'weight_scheme': 'exponential', 'weight_clip_max': None, 'weight_exponential_beta': 4.275371863954602}. Best is trial 1 with value: 0.19688136954153224.
[I 2026-04-22 14:21:36,187] Trial 23 finished with value: 0.19847080807542586 and parameters: {'alpha': 317840.83806740853, 'use_snp_selection': True, 'num_snps': 36032, 'weight_scheme': 'exponential', 'weight_clip_max': None, 'weight_exponential_beta': 2.9120845327086413}. Best is trial 23 with value: 0.19847080807542586.
[I 2026-04-22 14:23:14,184] Trial 24 finished with value: 0.1897319371865937 and parameters: {'alpha': 252412.12484606123, 'use_snp_selection': True, 'num_snps': 33036, 'weight_scheme': 'exponential', 'weight_clip_max': None, 'weight_exponential_beta': 4.25006284386339}. Best is trial 23 with value: 0.19847080807542586.
[I 2026-04-22 14:24:35,642] Trial 25 finished with value: 0.18905429102092167 and parameters: {'alpha': 2365676.88181662, 'use_snp_selection': True, 'num_snps': 18540, 'weight_scheme': 'exponential', 'weight_clip_max': 10.0, 'weight_exponential_beta': 2.8655139087833867}. Best is trial 23 with value: 0.19847080807542586.
[I 2026-04-22 14:26:19,548] Trial 26 finished with value: 0.17688706627063577 and parameters: {'alpha': 30855.96541915734, 'use_snp_selection': True, 'num_snps': 34160, 'weight_scheme': 'exponential', 'weight_clip_max': None, 'weight_exponential_beta': 5.293802266110065}. Best is trial 23 with value: 0.19847080807542586.
[I 2026-04-22 14:27:48,148] Trial 27 finished with value: 0.19004929568672663 and parameters: {'alpha': 226481.72612728455, 'use_snp_selection': True, 'num_snps': 23601, 'weight_scheme': 'top-heavy', 'weight_clip_max': None, 'weight_topheavy_top_frac': 0.36539352618598725, 'weight_topheavy_low': 1.1708267926826912, 'weight_topheavy_high': 1.3536690578491766}. Best is trial 23 with value: 0.19847080807542586.
[I 2026-04-22 14:29:35,381] Trial 28 finished with value: 0.1938113522506874 and parameters: {'alpha': 98468.060161916, 'use_snp_selection': True, 'num_snps': 36923, 'weight_scheme': 'minmax', 'weight_clip_max': None, 'weight_minmax_eps': 0.1163877867706547}. Best is trial 23 with value: 0.19847080807542586.
[I 2026-04-22 14:31:07,234] Trial 29 finished with value: 0.1719693381253105 and parameters: {'alpha': 9637.776731360509, 'use_snp_selection': True, 'num_snps': 25104, 'weight_scheme': 'minmax', 'weight_clip_max': 10.0, 'weight_minmax_eps': 0.12314266322014455}. Best is trial 23 with value: 0.19847080807542586.
[I 2026-04-22 14:33:11,297] Trial 30 finished with value: 0.1751241873125398 and parameters: {'alpha': 38368.73970567721, 'use_snp_selection': True, 'num_snps': 49644, 'weight_scheme': 'minmax', 'weight_clip_max': 5.0, 'weight_minmax_eps': 0.08380487798795021}. Best is trial 23 with value: 0.19847080807542586.
[I 2026-04-22 14:34:57,791] Trial 31 finished with value: 0.19657154100081703 and parameters: {'alpha': 133430.82415429852, 'use_snp_selection': True, 'num_snps': 37021, 'weight_scheme': 'minmax', 'weight_clip_max': None, 'weight_minmax_eps': 0.1564519165663693}. Best is trial 23 with value: 0.19847080807542586.
[I 2026-04-22 14:36:43,381] Trial 32 finished with value: 0.19408509743993035 and parameters: {'alpha': 111503.0453846067, 'use_snp_selection': True, 'num_snps': 37917, 'weight_scheme': 'minmax', 'weight_clip_max': None, 'weight_minmax_eps': 0.14967521202848397}. Best is trial 23 with value: 0.19847080807542586.
[I 2026-04-22 14:38:39,379] Trial 33 finished with value: 0.19273611394814122 and parameters: {'alpha': 131013.5401878608, 'use_snp_selection': True, 'num_snps': 40980, 'weight_scheme': 'minmax', 'weight_clip_max': None, 'weight_minmax_eps': 0.15998860900199344}. Best is trial 23 with value: 0.19847080807542586.
[I 2026-04-22 14:40:16,338] Trial 34 finished with value: 0.1779711336704384 and parameters: {'alpha': 13403.730214053798, 'use_snp_selection': True, 'num_snps': 30631, 'weight_scheme': 'minmax', 'weight_clip_max': None, 'weight_minmax_eps': 0.15773973872357658}. Best is trial 23 with value: 0.19847080807542586.
[I 2026-04-22 14:42:15,382] Trial 35 finished with value: 0.14837229929530948 and parameters: {'alpha': 3851.267708280549, 'use_snp_selection': True, 'num_snps': 45441, 'weight_scheme': 'minmax', 'weight_clip_max': None, 'weight_minmax_eps': 0.1476003114672024}. Best is trial 23 with value: 0.19847080807542586.
[I 2026-04-22 14:44:32,122] Trial 36 finished with value: 0.19359109262865376 and parameters: {'alpha': 1437561.4322161316, 'use_snp_selection': True, 'num_snps': 59248, 'weight_scheme': 'minmax', 'weight_clip_max': 5.0, 'weight_minmax_eps': 0.19756202920982358}. Best is trial 23 with value: 0.19847080807542586.
[I 2026-04-22 14:46:14,117] Trial 37 finished with value: 0.1910251813442244 and parameters: {'alpha': 69479.89013985392, 'use_snp_selection': True, 'num_snps': 34147, 'weight_scheme': 'minmax', 'weight_clip_max': 10.0, 'weight_minmax_eps': 0.14042108032615624}. Best is trial 23 with value: 0.19847080807542586.
[I 2026-04-22 14:47:28,742] Trial 38 finished with value: 0.171977605977824 and parameters: {'alpha': 144658.8007242776, 'use_snp_selection': True, 'num_snps': 14994, 'weight_scheme': 'top-heavy', 'weight_clip_max': None, 'weight_topheavy_top_frac': 0.06181098001481175, 'weight_topheavy_low': 0.5051605471671807, 'weight_topheavy_high': 5.803326872296722}. Best is trial 23 with value: 0.19847080807542586.
[I 2026-04-22 14:48:56,904] Trial 39 finished with value: 0.19240793485639743 and parameters: {'alpha': 406178.42045558564, 'use_snp_selection': True, 'num_snps': 27360, 'weight_scheme': 'uniform', 'weight_clip_max': 5.0}. Best is trial 23 with value: 0.19847080807542586.
[I 2026-04-22 14:50:41,960] Trial 40 finished with value: 0.19319356685218547 and parameters: {'alpha': 5301643.548038846, 'use_snp_selection': True, 'num_snps': 36251, 'weight_scheme': 'minmax', 'weight_clip_max': None, 'weight_minmax_eps': 0.17989700036164777}. Best is trial 23 with value: 0.19847080807542586.
[I 2026-04-22 14:52:30,720] Trial 41 finished with value: 0.19399016820884052 and parameters: {'alpha': 125733.97585126277, 'use_snp_selection': True, 'num_snps': 39089, 'weight_scheme': 'minmax', 'weight_clip_max': None, 'weight_minmax_eps': 0.11068710219631805}. Best is trial 23 with value: 0.19847080807542586.
[I 2026-04-22 14:54:24,316] Trial 42 finished with value: 0.1945032101231353 and parameters: {'alpha': 161283.85759835437, 'use_snp_selection': True, 'num_snps': 40548, 'weight_scheme': 'minmax', 'weight_clip_max': None, 'weight_minmax_eps': 0.09719963629140876}. Best is trial 23 with value: 0.19847080807542586.
[I 2026-04-22 14:56:07,443] Trial 43 finished with value: 0.18249839826062753 and parameters: {'alpha': 25226.93178254078, 'use_snp_selection': True, 'num_snps': 31949, 'weight_scheme': 'minmax', 'weight_clip_max': None, 'weight_minmax_eps': 0.08265221624524707}. Best is trial 23 with value: 0.19847080807542586.
[I 2026-04-22 14:58:18,629] Trial 44 finished with value: 0.1947801958058899 and parameters: {'alpha': 988456.9739527467, 'use_snp_selection': True, 'num_snps': 51906, 'weight_scheme': 'minmax', 'weight_clip_max': None, 'weight_minmax_eps': 0.05816772880375588}. Best is trial 23 with value: 0.19847080807542586.
[I 2026-04-22 15:00:27,173] Trial 45 finished with value: 0.1940202858532912 and parameters: {'alpha': 1517052.443717422, 'use_snp_selection': True, 'num_snps': 52856, 'weight_scheme': 'minmax', 'weight_clip_max': 5.0, 'weight_minmax_eps': 0.05150657340907436}. Best is trial 23 with value: 0.19847080807542586.
[I 2026-04-22 15:02:48,882] Trial 46 finished with value: 0.19379081064744935 and parameters: {'alpha': 1120596.4608225378, 'use_snp_selection': True, 'num_snps': 59941, 'weight_scheme': 'linear', 'weight_clip_max': 10.0, 'weight_linear_min_weight': 0.5876392982333305, 'weight_linear_max_weight': 2.8950763868910196}. Best is trial 23 with value: 0.19847080807542586.
[I 2026-04-22 15:04:48,425] Trial 47 finished with value: 0.19255435252669545 and parameters: {'alpha': 3874482.655564286, 'use_snp_selection': True, 'num_snps': 46767, 'weight_scheme': 'minmax', 'weight_clip_max': None, 'weight_minmax_eps': 0.0009650256376454031}. Best is trial 23 with value: 0.19847080807542586.
[I 2026-04-22 15:06:49,705] Trial 48 finished with value: 0.18742582621552467 and parameters: {'alpha': 334223.9741105947, 'use_snp_selection': True, 'num_snps': 51067, 'weight_scheme': 'uniform', 'weight_clip_max': 5.0}. Best is trial 23 with value: 0.19847080807542586.
[I 2026-04-22 15:07:48,588] Trial 49 finished with value: 0.1752999436350863 and parameters: {'alpha': 57754.04937866965, 'use_snp_selection': False, 'weight_scheme': 'top-heavy', 'weight_clip_max': None, 'weight_topheavy_top_frac': 0.2225772585992909, 'weight_topheavy_low': 1.193848812109647, 'weight_topheavy_high': 3.7359996978665606}. Best is trial 23 with value: 0.19847080807542586.
[I 2026-04-22 15:10:01,685] Trial 50 finished with value: 0.1944575072645198 and parameters: {'alpha': 906991.1962789535, 'use_snp_selection': True, 'num_snps': 56064, 'weight_scheme': 'minmax', 'weight_clip_max': 5.0, 'weight_minmax_eps': 0.05487027305446315}. Best is trial 23 with value: 0.19847080807542586.
[I 2026-04-22 15:12:12,376] Trial 51 finished with value: 0.18990221198214513 and parameters: {'alpha': 9706278.35555465, 'use_snp_selection': True, 'num_snps': 55657, 'weight_scheme': 'minmax', 'weight_clip_max': 5.0, 'weight_minmax_eps': 0.05350234237259179}. Best is trial 23 with value: 0.19847080807542586.
[I 2026-04-22 15:14:22,552] Trial 52 finished with value: 0.19472241621701308 and parameters: {'alpha': 743647.8985471838, 'use_snp_selection': True, 'num_snps': 55600, 'weight_scheme': 'minmax', 'weight_clip_max': 5.0, 'weight_minmax_eps': 0.05586151120408682}. Best is trial 23 with value: 0.19847080807542586.
[I 2026-04-22 15:16:16,742] Trial 53 finished with value: 0.1952558919602652 and parameters: {'alpha': 539136.8318010726, 'use_snp_selection': True, 'num_snps': 44263, 'weight_scheme': 'minmax', 'weight_clip_max': 5.0, 'weight_minmax_eps': 0.030839475907813673}. Best is trial 23 with value: 0.19847080807542586.
[I 2026-04-22 15:18:18,182] Trial 54 finished with value: 0.19547849838027415 and parameters: {'alpha': 546533.65027017, 'use_snp_selection': True, 'num_snps': 49153, 'weight_scheme': 'linear', 'weight_clip_max': 5.0, 'weight_linear_min_weight': 0.38953857918907836, 'weight_linear_max_weight': 3.9948051499019837}. Best is trial 23 with value: 0.19847080807542586.
[I 2026-04-22 15:19:11,532] Trial 55 finished with value: 0.19271203441437032 and parameters: {'alpha': 2375903.410237307, 'use_snp_selection': False, 'weight_scheme': 'linear', 'weight_clip_max': 5.0, 'weight_linear_min_weight': 0.4144125743333378, 'weight_linear_max_weight': 3.9650588150513455}. Best is trial 23 with value: 0.19847080807542586.
[I 2026-04-22 15:21:05,669] Trial 56 finished with value: 0.13786043607796603 and parameters: {'alpha': 10.797161151569496, 'use_snp_selection': True, 'num_snps': 44150, 'weight_scheme': 'linear', 'weight_clip_max': 5.0, 'weight_linear_min_weight': 0.41372210902832995, 'weight_linear_max_weight': 2.8664970154458005}. Best is trial 23 with value: 0.19847080807542586.
[I 2026-04-22 15:23:06,408] Trial 57 finished with value: 0.19468705175136336 and parameters: {'alpha': 545310.7523804411, 'use_snp_selection': True, 'num_snps': 48642, 'weight_scheme': 'linear', 'weight_clip_max': 5.0, 'weight_linear_min_weight': 0.12369868822192875, 'weight_linear_max_weight': 3.28015682763781}. Best is trial 23 with value: 0.19847080807542586.
[I 2026-04-22 15:25:03,829] Trial 58 finished with value: 0.1937885219665225 and parameters: {'alpha': 257831.57450823844, 'use_snp_selection': True, 'num_snps': 45996, 'weight_scheme': 'linear', 'weight_clip_max': 5.0, 'weight_linear_min_weight': 0.6501963052232302, 'weight_linear_max_weight': 3.9761669660077636}. Best is trial 23 with value: 0.19847080807542586.
[I 2026-04-22 15:25:57,362] Trial 59 finished with value: 0.18643958315957648 and parameters: {'alpha': 474471.36515937326, 'use_snp_selection': False, 'weight_scheme': 'exponential', 'weight_clip_max': 5.0, 'weight_exponential_beta': 6.715865071502407}. Best is trial 23 with value: 0.19847080807542586.
[I 2026-04-22 15:28:04,577] Trial 60 finished with value: 0.19136906530075792 and parameters: {'alpha': 1856243.2079336166, 'use_snp_selection': True, 'num_snps': 53236, 'weight_scheme': 'linear', 'weight_clip_max': 5.0, 'weight_linear_min_weight': 0.7420934296722108, 'weight_linear_max_weight': 2.625167881861186}. Best is trial 23 with value: 0.19847080807542586.
[I 2026-04-22 15:30:08,575] Trial 61 finished with value: 0.1946355241677035 and parameters: {'alpha': 836347.5786587482, 'use_snp_selection': True, 'num_snps': 50657, 'weight_scheme': 'minmax', 'weight_clip_max': 5.0, 'weight_minmax_eps': 0.029538895883362646}. Best is trial 23 with value: 0.19847080807542586.
[I 2026-04-22 15:32:21,018] Trial 62 finished with value: 0.19160077933648237 and parameters: {'alpha': 3766057.372648233, 'use_snp_selection': True, 'num_snps': 56853, 'weight_scheme': 'minmax', 'weight_clip_max': 5.0, 'weight_minmax_eps': 0.03576802268560387}. Best is trial 23 with value: 0.19847080807542586.
[I 2026-04-22 15:34:19,724] Trial 63 finished with value: 0.18573826970988289 and parameters: {'alpha': 746000.5206288192, 'use_snp_selection': True, 'num_snps': 51945, 'weight_scheme': 'uniform', 'weight_clip_max': 5.0}. Best is trial 23 with value: 0.19847080807542586.
[I 2026-04-22 15:36:11,631] Trial 64 finished with value: 0.19561918650699633 and parameters: {'alpha': 218346.0697023454, 'use_snp_selection': True, 'num_snps': 42215, 'weight_scheme': 'exponential', 'weight_clip_max': 5.0, 'weight_exponential_beta': 1.7683223164289235}. Best is trial 23 with value: 0.19847080807542586.
[I 2026-04-22 15:38:03,679] Trial 65 finished with value: 0.1950289621135581 and parameters: {'alpha': 203775.82241117125, 'use_snp_selection': True, 'num_snps': 42562, 'weight_scheme': 'exponential', 'weight_clip_max': 5.0, 'weight_exponential_beta': 1.5773639829668102}. Best is trial 23 with value: 0.19847080807542586.
[I 2026-04-22 15:39:56,152] Trial 66 finished with value: 0.19557246442659781 and parameters: {'alpha': 241002.90315496345, 'use_snp_selection': True, 'num_snps': 42470, 'weight_scheme': 'exponential', 'weight_clip_max': 5.0, 'weight_exponential_beta': 1.6864801761693484}. Best is trial 23 with value: 0.19847080807542586.
