Running from this directory: /cluster/work/simennes/Master_thesis
Name of job: ncv_ridge_avggrm
ID of job: 24332643
Array task ID: 11
The job was run on these nodes: idun-03-08
[I 2026-04-22 13:51:10,811] Trial 0 finished with value: 0.15197394646619797 and parameters: {'alpha': 12124.394605078569, 'use_snp_selection': True, 'num_snps': 5442, 'weight_scheme': 'linear', 'weight_clip_max': 5.0, 'weight_linear_min_weight': 0.5849999641604302, 'weight_linear_max_weight': 1.017621356653175}. Best is trial 0 with value: 0.15197394646619797.
[I 2026-04-22 13:52:52,920] Trial 1 finished with value: 0.17562029058244277 and parameters: {'alpha': 109374.19486700959, 'use_snp_selection': True, 'num_snps': 25583, 'weight_scheme': 'minmax', 'weight_clip_max': 5.0, 'weight_minmax_eps': 0.14026014881292506}. Best is trial 1 with value: 0.17562029058244277.
[I 2026-04-22 13:55:18,302] Trial 2 finished with value: 0.17604061235235677 and parameters: {'alpha': 87498.4492964452, 'use_snp_selection': True, 'num_snps': 53815, 'weight_scheme': 'linear', 'weight_clip_max': 5.0, 'weight_linear_min_weight': 0.27089068881512934, 'weight_linear_max_weight': 2.0548794162981476}. Best is trial 2 with value: 0.17604061235235677.
[I 2026-04-22 13:56:19,237] Trial 3 finished with value: 0.18143903961130178 and parameters: {'alpha': 194477.78458557956, 'use_snp_selection': False, 'weight_scheme': 'linear', 'weight_clip_max': None, 'weight_linear_min_weight': 0.21922985165550554, 'weight_linear_max_weight': 1.6260435767424388}. Best is trial 3 with value: 0.18143903961130178.
[I 2026-04-22 13:57:20,103] Trial 4 finished with value: 0.17753875416412698 and parameters: {'alpha': 9421665.195468841, 'use_snp_selection': False, 'weight_scheme': 'minmax', 'weight_clip_max': 5.0, 'weight_minmax_eps': 0.030689801852077123}. Best is trial 3 with value: 0.18143903961130178.
[I 2026-04-22 13:58:35,756] Trial 5 finished with value: 0.13731686029034915 and parameters: {'alpha': 5024.251153421461, 'use_snp_selection': True, 'num_snps': 9046, 'weight_scheme': 'top-heavy', 'weight_clip_max': 10.0, 'weight_topheavy_top_frac': 0.08738114702774886, 'weight_topheavy_low': 0.8991910356358707, 'weight_topheavy_high': 2.2968843007908903}. Best is trial 3 with value: 0.18143903961130178.
[I 2026-04-22 13:59:25,258] Trial 6 finished with value: 0.1236142511979028 and parameters: {'alpha': 16.382429914774185, 'use_snp_selection': False, 'weight_scheme': 'uniform', 'weight_clip_max': 10.0}. Best is trial 3 with value: 0.18143903961130178.
[I 2026-04-22 14:01:41,785] Trial 7 finished with value: 0.17852476509705978 and parameters: {'alpha': 94169.1049689093, 'use_snp_selection': True, 'num_snps': 47654, 'weight_scheme': 'exponential', 'weight_clip_max': 10.0, 'weight_exponential_beta': 2.3870207999558124}. Best is trial 3 with value: 0.18143903961130178.
[I 2026-04-22 14:02:51,737] Trial 8 finished with value: 0.05570001023468521 and parameters: {'alpha': 96.38034897458088, 'use_snp_selection': True, 'num_snps': 5388, 'weight_scheme': 'minmax', 'weight_clip_max': None, 'weight_minmax_eps': 0.07791532902904205}. Best is trial 3 with value: 0.18143903961130178.
[I 2026-04-22 14:03:51,375] Trial 9 finished with value: 0.17778191408003047 and parameters: {'alpha': 2700506.792350819, 'use_snp_selection': False, 'weight_scheme': 'linear', 'weight_clip_max': 5.0, 'weight_linear_min_weight': 0.8693390069349902, 'weight_linear_max_weight': 2.1394245284712112}. Best is trial 3 with value: 0.18143903961130178.
[I 2026-04-22 14:04:41,574] Trial 10 finished with value: 0.12735121775921326 and parameters: {'alpha': 859.5702697532038, 'use_snp_selection': False, 'weight_scheme': 'uniform', 'weight_clip_max': None}. Best is trial 3 with value: 0.18143903961130178.
[I 2026-04-22 14:05:42,548] Trial 11 finished with value: 0.18440303630167565 and parameters: {'alpha': 409602.6639259898, 'use_snp_selection': False, 'weight_scheme': 'exponential', 'weight_clip_max': None, 'weight_exponential_beta': 1.976306722397911}. Best is trial 11 with value: 0.18440303630167565.
[I 2026-04-22 14:06:44,018] Trial 12 finished with value: 0.1762588467101988 and parameters: {'alpha': 680962.8765783042, 'use_snp_selection': False, 'weight_scheme': 'exponential', 'weight_clip_max': None, 'weight_exponential_beta': 0.14549224357588808}. Best is trial 11 with value: 0.18440303630167565.
[I 2026-04-22 14:07:45,914] Trial 13 finished with value: 0.14991425803957129 and parameters: {'alpha': 606844.9385713676, 'use_snp_selection': False, 'weight_scheme': 'exponential', 'weight_clip_max': None, 'weight_exponential_beta': 7.893036257468982}. Best is trial 11 with value: 0.18440303630167565.
[I 2026-04-22 14:08:47,339] Trial 14 finished with value: 0.1446209596173509 and parameters: {'alpha': 9623.523179910808, 'use_snp_selection': False, 'weight_scheme': 'top-heavy', 'weight_clip_max': None, 'weight_topheavy_top_frac': 0.4895739776974001, 'weight_topheavy_low': 0.5303602048894995, 'weight_topheavy_high': 5.909143202235775}. Best is trial 11 with value: 0.18440303630167565.
[I 2026-04-22 14:09:47,572] Trial 15 finished with value: 0.18472927322599988 and parameters: {'alpha': 715721.3874792199, 'use_snp_selection': False, 'weight_scheme': 'linear', 'weight_clip_max': None, 'weight_linear_min_weight': 0.14113035286925918, 'weight_linear_max_weight': 3.64355612642742}. Best is trial 15 with value: 0.18472927322599988.
[I 2026-04-22 14:10:50,089] Trial 16 finished with value: 0.16969768542303346 and parameters: {'alpha': 2403105.9446239355, 'use_snp_selection': False, 'weight_scheme': 'exponential', 'weight_clip_max': None, 'weight_exponential_beta': 4.006553618932866}. Best is trial 15 with value: 0.18472927322599988.
[I 2026-04-22 14:11:50,433] Trial 17 finished with value: 0.16234084034216015 and parameters: {'alpha': 35136.64217601225, 'use_snp_selection': False, 'weight_scheme': 'exponential', 'weight_clip_max': None, 'weight_exponential_beta': 1.3022176600104531}. Best is trial 15 with value: 0.18472927322599988.
[I 2026-04-22 14:12:50,512] Trial 18 finished with value: 0.12995606018708789 and parameters: {'alpha': 1372.558621803536, 'use_snp_selection': False, 'weight_scheme': 'linear', 'weight_clip_max': None, 'weight_linear_min_weight': 0.13336618896534694, 'weight_linear_max_weight': 3.984486295912658}. Best is trial 15 with value: 0.18472927322599988.
[I 2026-04-22 14:13:41,124] Trial 19 finished with value: 0.1747621216512386 and parameters: {'alpha': 686558.4753828485, 'use_snp_selection': False, 'weight_scheme': 'uniform', 'weight_clip_max': None}. Best is trial 15 with value: 0.18472927322599988.
[I 2026-04-22 14:14:42,131] Trial 20 finished with value: 0.17160698342490488 and parameters: {'alpha': 9239144.019991277, 'use_snp_selection': False, 'weight_scheme': 'top-heavy', 'weight_clip_max': 10.0, 'weight_topheavy_top_frac': 0.3105689455947959, 'weight_topheavy_low': 1.1998104203775761, 'weight_topheavy_high': 4.8726329766710075}. Best is trial 15 with value: 0.18472927322599988.
[I 2026-04-22 14:15:45,152] Trial 21 finished with value: 0.18252497423954023 and parameters: {'alpha': 242226.0703956862, 'use_snp_selection': False, 'weight_scheme': 'linear', 'weight_clip_max': None, 'weight_linear_min_weight': 0.3237404288657081, 'weight_linear_max_weight': 3.9590881229398134}. Best is trial 15 with value: 0.18472927322599988.
[I 2026-04-22 14:16:48,067] Trial 22 finished with value: 0.18339501115128257 and parameters: {'alpha': 1502656.303562496, 'use_snp_selection': False, 'weight_scheme': 'linear', 'weight_clip_max': None, 'weight_linear_min_weight': 0.4321902038751166, 'weight_linear_max_weight': 3.8643154151318218}. Best is trial 15 with value: 0.18472927322599988.
[I 2026-04-22 14:17:50,258] Trial 23 finished with value: 0.18189105145369844 and parameters: {'alpha': 2101976.079711437, 'use_snp_selection': False, 'weight_scheme': 'linear', 'weight_clip_max': None, 'weight_linear_min_weight': 0.5195335617826797, 'weight_linear_max_weight': 3.1432923828486397}. Best is trial 15 with value: 0.18472927322599988.
[I 2026-04-22 14:18:51,211] Trial 24 finished with value: 0.18346528175997945 and parameters: {'alpha': 1339277.3278231432, 'use_snp_selection': False, 'weight_scheme': 'linear', 'weight_clip_max': None, 'weight_linear_min_weight': 0.4895763824557633, 'weight_linear_max_weight': 3.1686351735319507}. Best is trial 15 with value: 0.18472927322599988.
[I 2026-04-22 14:19:53,017] Trial 25 finished with value: 0.1632463299178191 and parameters: {'alpha': 36118.97538143288, 'use_snp_selection': False, 'weight_scheme': 'exponential', 'weight_clip_max': None, 'weight_exponential_beta': 6.083367043325115}. Best is trial 15 with value: 0.18472927322599988.
[I 2026-04-22 14:20:56,269] Trial 26 finished with value: 0.1840429396175075 and parameters: {'alpha': 356021.0209670818, 'use_snp_selection': False, 'weight_scheme': 'linear', 'weight_clip_max': None, 'weight_linear_min_weight': 0.7334538746546244, 'weight_linear_max_weight': 3.127945766649149}. Best is trial 15 with value: 0.18472927322599988.
[I 2026-04-22 14:21:58,319] Trial 27 finished with value: 0.18424003329775662 and parameters: {'alpha': 427393.5446407677, 'use_snp_selection': False, 'weight_scheme': 'linear', 'weight_clip_max': None, 'weight_linear_min_weight': 0.7639337008937898, 'weight_linear_max_weight': 3.0672889286579808}. Best is trial 15 with value: 0.18472927322599988.
[I 2026-04-22 14:23:00,599] Trial 28 finished with value: 0.15872076642394553 and parameters: {'alpha': 27491.529211918427, 'use_snp_selection': False, 'weight_scheme': 'exponential', 'weight_clip_max': None, 'weight_exponential_beta': 3.46371412823932}. Best is trial 15 with value: 0.18472927322599988.
[I 2026-04-22 14:25:00,770] Trial 29 finished with value: 0.17293069436022585 and parameters: {'alpha': 5322860.913050088, 'use_snp_selection': True, 'num_snps': 35465, 'weight_scheme': 'linear', 'weight_clip_max': 10.0, 'weight_linear_min_weight': 0.9893794754447522, 'weight_linear_max_weight': 2.737485861459592}. Best is trial 15 with value: 0.18472927322599988.
[I 2026-04-22 14:25:49,516] Trial 30 finished with value: 0.1348447821707209 and parameters: {'alpha': 3295.069087306639, 'use_snp_selection': False, 'weight_scheme': 'uniform', 'weight_clip_max': 5.0}. Best is trial 15 with value: 0.18472927322599988.
[I 2026-04-22 14:26:51,432] Trial 31 finished with value: 0.18408035054656127 and parameters: {'alpha': 349312.00041644514, 'use_snp_selection': False, 'weight_scheme': 'linear', 'weight_clip_max': None, 'weight_linear_min_weight': 0.729563655025511, 'weight_linear_max_weight': 3.3179222914526525}. Best is trial 15 with value: 0.18472927322599988.
[I 2026-04-22 14:27:53,279] Trial 32 finished with value: 0.1829345944254504 and parameters: {'alpha': 252234.39526365197, 'use_snp_selection': False, 'weight_scheme': 'linear', 'weight_clip_max': None, 'weight_linear_min_weight': 0.7154375592122282, 'weight_linear_max_weight': 3.386090972607558}. Best is trial 15 with value: 0.18472927322599988.
[I 2026-04-22 14:28:55,796] Trial 33 finished with value: 0.17202490240558013 and parameters: {'alpha': 72524.95656933227, 'use_snp_selection': False, 'weight_scheme': 'linear', 'weight_clip_max': None, 'weight_linear_min_weight': 0.7174375879970507, 'weight_linear_max_weight': 3.532184586438931}. Best is trial 15 with value: 0.18472927322599988.
[I 2026-04-22 14:30:37,299] Trial 34 finished with value: 0.17986127436461016 and parameters: {'alpha': 581516.0082909643, 'use_snp_selection': True, 'num_snps': 23670, 'weight_scheme': 'minmax', 'weight_clip_max': None, 'weight_minmax_eps': 0.19110140424105435}. Best is trial 15 with value: 0.18472927322599988.
[I 2026-04-22 14:31:36,173] Trial 35 finished with value: 0.17882305039459767 and parameters: {'alpha': 142181.00869989698, 'use_snp_selection': False, 'weight_scheme': 'linear', 'weight_clip_max': 5.0, 'weight_linear_min_weight': 0.8376628307989508, 'weight_linear_max_weight': 2.6547564923389384}. Best is trial 15 with value: 0.18472927322599988.
[I 2026-04-22 14:32:37,315] Trial 36 finished with value: 0.16992943862641557 and parameters: {'alpha': 61254.151939929245, 'use_snp_selection': False, 'weight_scheme': 'linear', 'weight_clip_max': None, 'weight_linear_min_weight': 0.6402317880344096, 'weight_linear_max_weight': 3.557046862087055}. Best is trial 15 with value: 0.18472927322599988.
[I 2026-04-22 14:34:44,305] Trial 37 finished with value: 0.1707376873169881 and parameters: {'alpha': 4302911.380655554, 'use_snp_selection': True, 'num_snps': 39811, 'weight_scheme': 'top-heavy', 'weight_clip_max': 5.0, 'weight_topheavy_top_frac': 0.1148785677311325, 'weight_topheavy_low': 0.5029807285243505, 'weight_topheavy_high': 1.3033046421274381}. Best is trial 15 with value: 0.18472927322599988.
[I 2026-04-22 14:35:44,366] Trial 38 finished with value: 0.18419608423460876 and parameters: {'alpha': 933277.8445046046, 'use_snp_selection': False, 'weight_scheme': 'minmax', 'weight_clip_max': None, 'weight_minmax_eps': 0.014698948990272478}. Best is trial 15 with value: 0.18472927322599988.
[I 2026-04-22 14:38:24,193] Trial 39 finished with value: 0.1839665148788421 and parameters: {'alpha': 1202985.5493008196, 'use_snp_selection': True, 'num_snps': 59880, 'weight_scheme': 'minmax', 'weight_clip_max': 10.0, 'weight_minmax_eps': 0.00750812199949786}. Best is trial 15 with value: 0.18472927322599988.
[I 2026-04-22 14:39:24,041] Trial 40 finished with value: 0.17826104299112205 and parameters: {'alpha': 136027.63770113525, 'use_snp_selection': False, 'weight_scheme': 'minmax', 'weight_clip_max': None, 'weight_minmax_eps': 0.07089824784925916}. Best is trial 15 with value: 0.18472927322599988.
[I 2026-04-22 14:40:26,563] Trial 41 finished with value: 0.18379720294455687 and parameters: {'alpha': 366532.7995620896, 'use_snp_selection': False, 'weight_scheme': 'minmax', 'weight_clip_max': None, 'weight_minmax_eps': 0.036714710213079926}. Best is trial 15 with value: 0.18472927322599988.
[I 2026-04-22 14:41:28,303] Trial 42 finished with value: 0.15289319847091115 and parameters: {'alpha': 17247.838425892132, 'use_snp_selection': False, 'weight_scheme': 'minmax', 'weight_clip_max': None, 'weight_minmax_eps': 0.11960083844000687}. Best is trial 15 with value: 0.18472927322599988.
[I 2026-04-22 14:42:29,858] Trial 43 finished with value: 0.1825636420538861 and parameters: {'alpha': 1062853.146210094, 'use_snp_selection': False, 'weight_scheme': 'linear', 'weight_clip_max': None, 'weight_linear_min_weight': 0.838660971660345, 'weight_linear_max_weight': 2.871639883034081}. Best is trial 15 with value: 0.18472927322599988.
[I 2026-04-22 14:43:31,380] Trial 44 finished with value: 0.1801306651058798 and parameters: {'alpha': 3839384.2568408963, 'use_snp_selection': False, 'weight_scheme': 'minmax', 'weight_clip_max': None, 'weight_minmax_eps': 0.15873052607186622}. Best is trial 15 with value: 0.18472927322599988.
[I 2026-04-22 14:44:34,275] Trial 45 finished with value: 0.1668085184896862 and parameters: {'alpha': 410943.0247273367, 'use_snp_selection': False, 'weight_scheme': 'exponential', 'weight_clip_max': None, 'weight_exponential_beta': 5.427681946365926}. Best is trial 15 with value: 0.18472927322599988.
[I 2026-04-22 14:45:36,096] Trial 46 finished with value: 0.18043267733197188 and parameters: {'alpha': 171084.72411074798, 'use_snp_selection': False, 'weight_scheme': 'linear', 'weight_clip_max': 5.0, 'weight_linear_min_weight': 0.9634724196719863, 'weight_linear_max_weight': 3.6206130828553023}. Best is trial 15 with value: 0.18472927322599988.
[I 2026-04-22 14:46:25,809] Trial 47 finished with value: 0.12375180158417254 and parameters: {'alpha': 44.026360768010036, 'use_snp_selection': False, 'weight_scheme': 'uniform', 'weight_clip_max': 10.0}. Best is trial 15 with value: 0.18472927322599988.
[I 2026-04-22 14:47:58,744] Trial 48 finished with value: 0.1699168351796035 and parameters: {'alpha': 877844.89159795, 'use_snp_selection': True, 'num_snps': 18053, 'weight_scheme': 'top-heavy', 'weight_clip_max': None, 'weight_topheavy_top_frac': 0.49951317178446847, 'weight_topheavy_low': 1.1792308977767514, 'weight_topheavy_high': 3.5600366017671803}. Best is trial 15 with value: 0.18472927322599988.
[I 2026-04-22 14:48:58,493] Trial 49 finished with value: 0.17109126057319526 and parameters: {'alpha': 70735.67916801374, 'use_snp_selection': False, 'weight_scheme': 'exponential', 'weight_clip_max': None, 'weight_exponential_beta': 2.079753567578344}. Best is trial 15 with value: 0.18472927322599988.
[I 2026-04-22 14:50:00,184] Trial 50 finished with value: 0.17849967627136915 and parameters: {'alpha': 6411327.634058538, 'use_snp_selection': False, 'weight_scheme': 'linear', 'weight_clip_max': None, 'weight_linear_min_weight': 0.40022640538225235, 'weight_linear_max_weight': 2.380371500280237}. Best is trial 15 with value: 0.18472927322599988.
[I 2026-04-22 14:51:02,944] Trial 51 finished with value: 0.18406731908342813 and parameters: {'alpha': 358500.8100159068, 'use_snp_selection': False, 'weight_scheme': 'linear', 'weight_clip_max': None, 'weight_linear_min_weight': 0.7145261153327146, 'weight_linear_max_weight': 3.066064494753673}. Best is trial 15 with value: 0.18472927322599988.
[I 2026-04-22 14:52:04,975] Trial 52 finished with value: 0.1845598212484907 and parameters: {'alpha': 455008.19484593056, 'use_snp_selection': False, 'weight_scheme': 'linear', 'weight_clip_max': None, 'weight_linear_min_weight': 0.655077038703077, 'weight_linear_max_weight': 3.072398394788419}. Best is trial 15 with value: 0.18472927322599988.
[I 2026-04-22 14:53:08,108] Trial 53 finished with value: 0.182046476219643 and parameters: {'alpha': 1887950.6925642067, 'use_snp_selection': False, 'weight_scheme': 'linear', 'weight_clip_max': None, 'weight_linear_min_weight': 0.6294513467022892, 'weight_linear_max_weight': 3.383829757742011}. Best is trial 15 with value: 0.18472927322599988.
[I 2026-04-22 14:54:10,585] Trial 54 finished with value: 0.1791476112146989 and parameters: {'alpha': 3163289.5620336575, 'use_snp_selection': False, 'weight_scheme': 'linear', 'weight_clip_max': None, 'weight_linear_min_weight': 0.8156564624187261, 'weight_linear_max_weight': 2.898919464981552}. Best is trial 15 with value: 0.18472927322599988.
[I 2026-04-22 14:55:11,521] Trial 55 finished with value: 0.12528983857114473 and parameters: {'alpha': 262.23200994719707, 'use_snp_selection': False, 'weight_scheme': 'minmax', 'weight_clip_max': None, 'weight_minmax_eps': 0.0023743957249433567}. Best is trial 15 with value: 0.18472927322599988.
[I 2026-04-22 14:56:12,571] Trial 56 finished with value: 0.1779951052231026 and parameters: {'alpha': 515643.21874865406, 'use_snp_selection': False, 'weight_scheme': 'exponential', 'weight_clip_max': None, 'weight_exponential_beta': 0.24414542465014666}. Best is trial 15 with value: 0.18472927322599988.
[I 2026-04-22 14:57:13,730] Trial 57 finished with value: 0.18122266929878458 and parameters: {'alpha': 187159.75542453612, 'use_snp_selection': False, 'weight_scheme': 'linear', 'weight_clip_max': None, 'weight_linear_min_weight': 0.6526182326690867, 'weight_linear_max_weight': 3.3459189428195386}. Best is trial 15 with value: 0.18472927322599988.
[I 2026-04-22 14:58:14,670] Trial 58 finished with value: 0.18430455991565303 and parameters: {'alpha': 808101.7462285816, 'use_snp_selection': False, 'weight_scheme': 'linear', 'weight_clip_max': 10.0, 'weight_linear_min_weight': 0.7591938251367866, 'weight_linear_max_weight': 3.762283777195174}. Best is trial 15 with value: 0.18472927322599988.
[I 2026-04-22 14:59:04,770] Trial 59 finished with value: 0.17440132581526466 and parameters: {'alpha': 756825.7364162615, 'use_snp_selection': False, 'weight_scheme': 'uniform', 'weight_clip_max': 10.0}. Best is trial 15 with value: 0.18472927322599988.
[I 2026-04-22 15:00:05,840] Trial 60 finished with value: 0.17632577738222982 and parameters: {'alpha': 1861264.97575325, 'use_snp_selection': False, 'weight_scheme': 'top-heavy', 'weight_clip_max': 10.0, 'weight_topheavy_top_frac': 0.27368371789899104, 'weight_topheavy_low': 0.7967896288289407, 'weight_topheavy_high': 3.4549377826303265}. Best is trial 15 with value: 0.18472927322599988.
[I 2026-04-22 15:01:06,619] Trial 61 finished with value: 0.18285297318886948 and parameters: {'alpha': 248001.81069287402, 'use_snp_selection': False, 'weight_scheme': 'linear', 'weight_clip_max': 10.0, 'weight_linear_min_weight': 0.7789559297602556, 'weight_linear_max_weight': 3.6876303946291746}. Best is trial 15 with value: 0.18472927322599988.
[I 2026-04-22 15:02:06,901] Trial 62 finished with value: 0.1756217025599502 and parameters: {'alpha': 99695.36452794546, 'use_snp_selection': False, 'weight_scheme': 'linear', 'weight_clip_max': 10.0, 'weight_linear_min_weight': 0.9232450402527906, 'weight_linear_max_weight': 3.7515680479374023}. Best is trial 15 with value: 0.18472927322599988.
[I 2026-04-22 15:03:07,625] Trial 63 finished with value: 0.18306562239106905 and parameters: {'alpha': 1196441.0781813064, 'use_snp_selection': False, 'weight_scheme': 'linear', 'weight_clip_max': 10.0, 'weight_linear_min_weight': 0.7557317062010124, 'weight_linear_max_weight': 3.3459199920232634}. Best is trial 15 with value: 0.18472927322599988.
[I 2026-04-22 15:04:08,111] Trial 64 finished with value: 0.18448706812127239 and parameters: {'alpha': 632232.8415355568, 'use_snp_selection': False, 'weight_scheme': 'linear', 'weight_clip_max': None, 'weight_linear_min_weight': 0.6464310229050332, 'weight_linear_max_weight': 2.9442854722049514}. Best is trial 15 with value: 0.18472927322599988.
[I 2026-04-22 15:05:07,693] Trial 65 finished with value: 0.15790428351621263 and parameters: {'alpha': 2654763.240575166, 'use_snp_selection': False, 'weight_scheme': 'exponential', 'weight_clip_max': None, 'weight_exponential_beta': 5.20620063486996}. Best is trial 15 with value: 0.18472927322599988.
