Running from this directory: /cluster/work/simennes/Master_thesis
Name of job: ncv_ridge_iw
ID of job: 24378210
Array task ID: 11
The job was run on these nodes: idun-04-07
[I 2026-05-04 00:17:18,287] Trial 0 finished with value: 0.19592177014444068 and parameters: {'alpha': 574323.565896313, 'use_snp_selection': False, 'iw_method': 'pc_logistic', 'iw_clip_max': 2.0, 'iw_prob_clip': 0.005989214663243749, 'iw_n_components': 20, 'iw_logistic_c': 2.8870927958158354, 'iw_pca_fit': 'combined', 'iw_solver': 'lbfgs', 'iw_rho': 1.0}. Best is trial 0 with value: 0.19592177014444068.
[I 2026-05-04 00:20:04,685] Trial 1 finished with value: 0.19167100683430066 and parameters: {'alpha': 145427.84270397192, 'use_snp_selection': False, 'iw_method': 'pc_logistic', 'iw_clip_max': 2.0, 'iw_prob_clip': 0.0022034134189735897, 'iw_n_components': 10, 'iw_logistic_c': 8.53225823447423, 'iw_pca_fit': 'combined', 'iw_solver': 'lbfgs', 'iw_rho': 1.0}. Best is trial 0 with value: 0.19592177014444068.
[I 2026-05-04 00:23:01,009] Trial 2 finished with value: 0.21359735966608184 and parameters: {'alpha': 337268.1824826383, 'use_snp_selection': False, 'iw_method': 'pc_logistic', 'iw_clip_max': 1.25, 'iw_prob_clip': 0.0011214380556681478, 'iw_n_components': 40, 'iw_logistic_c': 0.0004456301044046966, 'iw_pca_fit': 'combined', 'iw_solver': 'lbfgs', 'iw_rho': 0.5}. Best is trial 2 with value: 0.21359735966608184.
[I 2026-05-04 00:25:53,757] Trial 3 finished with value: 0.2100194962734916 and parameters: {'alpha': 623873.8362358484, 'use_snp_selection': False, 'iw_method': 'pc_logistic', 'iw_clip_max': 2.0, 'iw_prob_clip': 0.0010704282286164728, 'iw_n_components': 30, 'iw_logistic_c': 0.003649078989687946, 'iw_pca_fit': 'combined', 'iw_solver': 'lbfgs', 'iw_rho': 0.9}. Best is trial 2 with value: 0.21359735966608184.
[I 2026-05-04 00:26:25,496] Trial 4 finished with value: 0.20184101389411963 and parameters: {'alpha': 1199521.094898443, 'use_snp_selection': False, 'iw_method': 'uniform'}. Best is trial 2 with value: 0.21359735966608184.
[I 2026-05-04 00:29:27,406] Trial 5 finished with value: 0.21021993995309876 and parameters: {'alpha': 594205.5826125565, 'use_snp_selection': False, 'iw_method': 'pc_logistic', 'iw_clip_max': 1.5, 'iw_prob_clip': 0.017782866059784724, 'iw_n_components': 40, 'iw_logistic_c': 0.3876202021284575, 'iw_pca_fit': 'combined', 'iw_solver': 'lbfgs', 'iw_rho': 0.5}. Best is trial 2 with value: 0.21359735966608184.
[I 2026-05-04 00:32:13,125] Trial 6 finished with value: 0.20711194373740877 and parameters: {'alpha': 102431.18633356069, 'use_snp_selection': False, 'iw_method': 'pc_logistic', 'iw_clip_max': 1.25, 'iw_prob_clip': 0.0017147683107745938, 'iw_n_components': 20, 'iw_logistic_c': 4.32601466983518e-06, 'iw_pca_fit': 'combined', 'iw_solver': 'lbfgs', 'iw_rho': 0.9}. Best is trial 2 with value: 0.21359735966608184.
[I 2026-05-04 00:35:07,130] Trial 7 finished with value: 0.20022138597937295 and parameters: {'alpha': 1830941.3950631474, 'use_snp_selection': False, 'iw_method': 'pc_logistic', 'iw_clip_max': 2.0, 'iw_prob_clip': 0.006357173651119782, 'iw_n_components': 40, 'iw_logistic_c': 1.7003213055010015e-05, 'iw_pca_fit': 'combined', 'iw_solver': 'lbfgs', 'iw_rho': 0.5}. Best is trial 2 with value: 0.21359735966608184.
[I 2026-05-04 00:35:39,047] Trial 8 finished with value: 0.2017180408715657 and parameters: {'alpha': 1221444.8156569519, 'use_snp_selection': False, 'iw_method': 'uniform'}. Best is trial 2 with value: 0.21359735966608184.
[I 2026-05-04 00:36:10,924] Trial 9 finished with value: 0.21117937524502756 and parameters: {'alpha': 201218.30977627521, 'use_snp_selection': False, 'iw_method': 'uniform'}. Best is trial 2 with value: 0.21359735966608184.
[I 2026-05-04 00:36:42,827] Trial 10 finished with value: 0.21064191070700905 and parameters: {'alpha': 299360.6349531665, 'use_snp_selection': False, 'iw_method': 'uniform'}. Best is trial 2 with value: 0.21359735966608184.
[I 2026-05-04 00:37:14,739] Trial 11 finished with value: 0.21101968450337596 and parameters: {'alpha': 258797.99050519007, 'use_snp_selection': False, 'iw_method': 'uniform'}. Best is trial 2 with value: 0.21359735966608184.
[I 2026-05-04 00:37:46,640] Trial 12 finished with value: 0.21113213559246974 and parameters: {'alpha': 240795.7407033407, 'use_snp_selection': False, 'iw_method': 'uniform'}. Best is trial 2 with value: 0.21359735966608184.
[I 2026-05-04 00:38:18,554] Trial 13 finished with value: 0.21013044746887122 and parameters: {'alpha': 342454.3862236704, 'use_snp_selection': False, 'iw_method': 'uniform'}. Best is trial 2 with value: 0.21359735966608184.
[I 2026-05-04 00:41:20,129] Trial 14 finished with value: 0.21145613895424917 and parameters: {'alpha': 172640.14022320343, 'use_snp_selection': False, 'iw_method': 'pc_logistic', 'iw_clip_max': 1.25, 'iw_prob_clip': 0.0006845131669118436, 'iw_n_components': 80, 'iw_logistic_c': 1.266722508279006e-07, 'iw_pca_fit': 'combined', 'iw_solver': 'lbfgs', 'iw_rho': 0.75}. Best is trial 2 with value: 0.21359735966608184.
[I 2026-05-04 00:44:20,779] Trial 15 finished with value: 0.21062034618965858 and parameters: {'alpha': 408193.9854346712, 'use_snp_selection': False, 'iw_method': 'pc_logistic', 'iw_clip_max': 1.25, 'iw_prob_clip': 0.000595758483751843, 'iw_n_components': 80, 'iw_logistic_c': 3.2307650532713104e-07, 'iw_pca_fit': 'combined', 'iw_solver': 'lbfgs', 'iw_rho': 0.75}. Best is trial 2 with value: 0.21359735966608184.
[I 2026-05-04 00:47:27,117] Trial 16 finished with value: 0.20708621326156235 and parameters: {'alpha': 130819.02725146757, 'use_snp_selection': False, 'iw_method': 'pc_logistic', 'iw_clip_max': 3.0, 'iw_prob_clip': 0.0005371591708140125, 'iw_n_components': 80, 'iw_logistic_c': 0.001376228686835329, 'iw_pca_fit': 'combined', 'iw_solver': 'lbfgs', 'iw_rho': 0.75}. Best is trial 2 with value: 0.21359735966608184.
[I 2026-05-04 00:50:19,651] Trial 17 finished with value: 0.21140679541985308 and parameters: {'alpha': 171617.64991891297, 'use_snp_selection': False, 'iw_method': 'pc_logistic', 'iw_clip_max': 5.0, 'iw_prob_clip': 0.0027696358108387285, 'iw_n_components': 60, 'iw_logistic_c': 1.1471907618711869e-07, 'iw_pca_fit': 'combined', 'iw_solver': 'lbfgs', 'iw_rho': 0.75}. Best is trial 2 with value: 0.21359735966608184.
[I 2026-05-04 00:53:13,568] Trial 18 finished with value: 0.2117165429330455 and parameters: {'alpha': 425456.17297005287, 'use_snp_selection': False, 'iw_method': 'pc_logistic', 'iw_clip_max': 1.25, 'iw_prob_clip': 0.0010197990508027176, 'iw_n_components': 50, 'iw_logistic_c': 6.108758481730344e-05, 'iw_pca_fit': 'combined', 'iw_solver': 'lbfgs', 'iw_rho': 0.5}. Best is trial 2 with value: 0.21359735966608184.
[I 2026-05-04 00:56:07,994] Trial 19 finished with value: 0.20604851995801154 and parameters: {'alpha': 987925.1693656599, 'use_snp_selection': False, 'iw_method': 'pc_logistic', 'iw_clip_max': 1.25, 'iw_prob_clip': 0.02698190602407097, 'iw_n_components': 50, 'iw_logistic_c': 6.489276990114573e-05, 'iw_pca_fit': 'combined', 'iw_solver': 'lbfgs', 'iw_rho': 0.5}. Best is trial 2 with value: 0.21359735966608184.
[I 2026-05-04 00:59:07,462] Trial 20 finished with value: 0.20077537152730543 and parameters: {'alpha': 2919360.4328581505, 'use_snp_selection': False, 'iw_method': 'pc_logistic', 'iw_clip_max': 1.25, 'iw_prob_clip': 0.0015704788099265294, 'iw_n_components': 50, 'iw_logistic_c': 0.01834199109577344, 'iw_pca_fit': 'combined', 'iw_solver': 'lbfgs', 'iw_rho': 0.5}. Best is trial 2 with value: 0.21359735966608184.
[I 2026-05-04 01:02:02,162] Trial 21 finished with value: 0.21215058609226664 and parameters: {'alpha': 412424.4941254392, 'use_snp_selection': False, 'iw_method': 'pc_logistic', 'iw_clip_max': 1.25, 'iw_prob_clip': 0.0008729378362958675, 'iw_n_components': 50, 'iw_logistic_c': 9.343591971399813e-05, 'iw_pca_fit': 'combined', 'iw_solver': 'lbfgs', 'iw_rho': 0.5}. Best is trial 2 with value: 0.21359735966608184.
[I 2026-05-04 01:04:56,219] Trial 22 finished with value: 0.21146078879463484 and parameters: {'alpha': 431094.7294468619, 'use_snp_selection': False, 'iw_method': 'pc_logistic', 'iw_clip_max': 1.25, 'iw_prob_clip': 0.0011736564320623288, 'iw_n_components': 50, 'iw_logistic_c': 0.00015237519759976715, 'iw_pca_fit': 'combined', 'iw_solver': 'lbfgs', 'iw_rho': 0.5}. Best is trial 2 with value: 0.21359735966608184.
[I 2026-05-04 01:07:51,714] Trial 23 finished with value: 0.20716525737371355 and parameters: {'alpha': 818510.7225676036, 'use_snp_selection': False, 'iw_method': 'pc_logistic', 'iw_clip_max': 1.25, 'iw_prob_clip': 0.0030754625069436938, 'iw_n_components': 50, 'iw_logistic_c': 0.0004617153952457246, 'iw_pca_fit': 'combined', 'iw_solver': 'lbfgs', 'iw_rho': 0.5}. Best is trial 2 with value: 0.21359735966608184.
[I 2026-05-04 01:10:30,159] Trial 24 finished with value: 0.210399527989754 and parameters: {'alpha': 409621.2177676726, 'use_snp_selection': False, 'iw_method': 'pc_logistic', 'iw_clip_max': 5.0, 'iw_prob_clip': 0.0010043286489581527, 'iw_n_components': 40, 'iw_logistic_c': 4.698143700721636e-06, 'iw_pca_fit': 'combined', 'iw_solver': 'lbfgs', 'iw_rho': 0.5}. Best is trial 2 with value: 0.21359735966608184.
[I 2026-05-04 01:13:16,485] Trial 25 finished with value: 0.2099812992388001 and parameters: {'alpha': 736653.489983263, 'use_snp_selection': False, 'iw_method': 'pc_logistic', 'iw_clip_max': 1.5, 'iw_prob_clip': 0.0008761185838594268, 'iw_n_components': 50, 'iw_logistic_c': 0.04360596948706038, 'iw_pca_fit': 'combined', 'iw_solver': 'lbfgs', 'iw_rho': 0.5}. Best is trial 2 with value: 0.21359735966608184.
[I 2026-05-04 01:15:46,314] Trial 26 finished with value: 0.20710911003885807 and parameters: {'alpha': 464550.4752319866, 'use_snp_selection': False, 'iw_method': 'pc_logistic', 'iw_clip_max': 3.0, 'iw_prob_clip': 0.01367908503097275, 'iw_n_components': 10, 'iw_logistic_c': 4.165461531459633e-05, 'iw_pca_fit': 'combined', 'iw_solver': 'lbfgs', 'iw_rho': 0.5}. Best is trial 2 with value: 0.21359735966608184.
[I 2026-05-04 01:18:22,703] Trial 27 finished with value: 0.21411566502860518 and parameters: {'alpha': 323832.34992866724, 'use_snp_selection': False, 'iw_method': 'pc_logistic', 'iw_clip_max': 1.25, 'iw_prob_clip': 0.004229018859786499, 'iw_n_components': 30, 'iw_logistic_c': 0.0003979757491671327, 'iw_pca_fit': 'combined', 'iw_solver': 'lbfgs', 'iw_rho': 0.5}. Best is trial 27 with value: 0.21411566502860518.
[I 2026-05-04 01:21:04,084] Trial 28 finished with value: 0.21512242748203264 and parameters: {'alpha': 319781.85600484605, 'use_snp_selection': False, 'iw_method': 'pc_logistic', 'iw_clip_max': 1.25, 'iw_prob_clip': 0.004008810975452402, 'iw_n_components': 30, 'iw_logistic_c': 0.01252210602487806, 'iw_pca_fit': 'combined', 'iw_solver': 'lbfgs', 'iw_rho': 0.9}. Best is trial 28 with value: 0.21512242748203264.
[I 2026-05-04 01:23:43,219] Trial 29 finished with value: 0.2144078229357457 and parameters: {'alpha': 320998.39937524404, 'use_snp_selection': False, 'iw_method': 'pc_logistic', 'iw_clip_max': 1.25, 'iw_prob_clip': 0.004008832460880708, 'iw_n_components': 30, 'iw_logistic_c': 0.009716715898696614, 'iw_pca_fit': 'combined', 'iw_solver': 'lbfgs', 'iw_rho': 0.9}. Best is trial 28 with value: 0.21512242748203264.
[I 2026-05-04 01:26:21,907] Trial 30 finished with value: 0.21536869947355308 and parameters: {'alpha': 229786.16321101054, 'use_snp_selection': False, 'iw_method': 'pc_logistic', 'iw_clip_max': 1.25, 'iw_prob_clip': 0.0044085096387733265, 'iw_n_components': 30, 'iw_logistic_c': 0.010609536664691329, 'iw_pca_fit': 'combined', 'iw_solver': 'lbfgs', 'iw_rho': 0.9}. Best is trial 30 with value: 0.21536869947355308.
[I 2026-05-04 01:29:01,060] Trial 31 finished with value: 0.21278773391010747 and parameters: {'alpha': 216575.48312340217, 'use_snp_selection': False, 'iw_method': 'pc_logistic', 'iw_clip_max': 1.25, 'iw_prob_clip': 0.004286357936635924, 'iw_n_components': 30, 'iw_logistic_c': 0.02339132212458827, 'iw_pca_fit': 'combined', 'iw_solver': 'lbfgs', 'iw_rho': 0.9}. Best is trial 30 with value: 0.21536869947355308.
[I 2026-05-04 01:31:39,843] Trial 32 finished with value: 0.21428524547636565 and parameters: {'alpha': 307251.59907381114, 'use_snp_selection': False, 'iw_method': 'pc_logistic', 'iw_clip_max': 1.25, 'iw_prob_clip': 0.01006344886375612, 'iw_n_components': 30, 'iw_logistic_c': 0.0050312108586001115, 'iw_pca_fit': 'combined', 'iw_solver': 'lbfgs', 'iw_rho': 0.9}. Best is trial 30 with value: 0.21536869947355308.
[I 2026-05-04 01:34:18,723] Trial 33 finished with value: 0.21476368199050766 and parameters: {'alpha': 284954.8604796631, 'use_snp_selection': False, 'iw_method': 'pc_logistic', 'iw_clip_max': 1.25, 'iw_prob_clip': 0.009351365896089788, 'iw_n_components': 30, 'iw_logistic_c': 0.0052592806896462835, 'iw_pca_fit': 'combined', 'iw_solver': 'lbfgs', 'iw_rho': 0.9}. Best is trial 30 with value: 0.21536869947355308.
[I 2026-05-04 01:36:58,144] Trial 34 finished with value: 0.21338647914702177 and parameters: {'alpha': 265100.74199460965, 'use_snp_selection': False, 'iw_method': 'pc_logistic', 'iw_clip_max': 1.5, 'iw_prob_clip': 0.009054843122011016, 'iw_n_components': 30, 'iw_logistic_c': 0.128463000506758, 'iw_pca_fit': 'combined', 'iw_solver': 'lbfgs', 'iw_rho': 0.9}. Best is trial 30 with value: 0.21536869947355308.
[I 2026-05-04 01:39:35,711] Trial 35 finished with value: 0.20084785787305376 and parameters: {'alpha': 145004.9834948702, 'use_snp_selection': False, 'iw_method': 'pc_logistic', 'iw_clip_max': 3.0, 'iw_prob_clip': 0.0069090441792255645, 'iw_n_components': 30, 'iw_logistic_c': 0.006325861381527104, 'iw_pca_fit': 'combined', 'iw_solver': 'lbfgs', 'iw_rho': 0.9}. Best is trial 30 with value: 0.21536869947355308.
[I 2026-05-04 01:42:15,658] Trial 36 finished with value: 0.19635431450209123 and parameters: {'alpha': 522372.9856389697, 'use_snp_selection': False, 'iw_method': 'pc_logistic', 'iw_clip_max': 5.0, 'iw_prob_clip': 0.003295855447902963, 'iw_n_components': 30, 'iw_logistic_c': 0.2900150986809819, 'iw_pca_fit': 'combined', 'iw_solver': 'lbfgs', 'iw_rho': 0.9}. Best is trial 30 with value: 0.21536869947355308.
[I 2026-05-04 01:44:54,852] Trial 37 finished with value: 0.21286759919441917 and parameters: {'alpha': 185759.49361308655, 'use_snp_selection': False, 'iw_method': 'pc_logistic', 'iw_clip_max': 1.25, 'iw_prob_clip': 0.005201686260242302, 'iw_n_components': 30, 'iw_logistic_c': 1.0985259547630992, 'iw_pca_fit': 'combined', 'iw_solver': 'lbfgs', 'iw_rho': 0.9}. Best is trial 30 with value: 0.21536869947355308.
[I 2026-05-04 01:47:34,766] Trial 38 finished with value: 0.20998550664371782 and parameters: {'alpha': 110965.48148473154, 'use_snp_selection': False, 'iw_method': 'pc_logistic', 'iw_clip_max': 1.25, 'iw_prob_clip': 0.008733638731777972, 'iw_n_components': 30, 'iw_logistic_c': 0.0636817824915415, 'iw_pca_fit': 'combined', 'iw_solver': 'lbfgs', 'iw_rho': 0.9}. Best is trial 30 with value: 0.21536869947355308.
[I 2026-05-04 01:50:21,832] Trial 39 finished with value: 0.19028533755424848 and parameters: {'alpha': 223991.6799929227, 'use_snp_selection': False, 'iw_method': 'pc_logistic', 'iw_clip_max': 2.0, 'iw_prob_clip': 0.002261522194734149, 'iw_n_components': 60, 'iw_logistic_c': 0.011406934715766245, 'iw_pca_fit': 'combined', 'iw_solver': 'lbfgs', 'iw_rho': 1.0}. Best is trial 30 with value: 0.21536869947355308.
[I 2026-05-04 01:52:56,904] Trial 40 finished with value: 0.21285461813255613 and parameters: {'alpha': 354774.11948962207, 'use_snp_selection': False, 'iw_method': 'pc_logistic', 'iw_clip_max': 1.25, 'iw_prob_clip': 0.013882209149838986, 'iw_n_components': 20, 'iw_logistic_c': 0.001817845947977238, 'iw_pca_fit': 'combined', 'iw_solver': 'lbfgs', 'iw_rho': 0.9}. Best is trial 30 with value: 0.21536869947355308.
[I 2026-05-04 01:55:35,016] Trial 41 finished with value: 0.2151709522652423 and parameters: {'alpha': 286357.36981206137, 'use_snp_selection': False, 'iw_method': 'pc_logistic', 'iw_clip_max': 1.25, 'iw_prob_clip': 0.008966583990964807, 'iw_n_components': 30, 'iw_logistic_c': 0.004017525376004163, 'iw_pca_fit': 'combined', 'iw_solver': 'lbfgs', 'iw_rho': 0.9}. Best is trial 30 with value: 0.21536869947355308.
[I 2026-05-04 01:58:12,684] Trial 42 finished with value: 0.21282910593169385 and parameters: {'alpha': 261295.85071852742, 'use_snp_selection': False, 'iw_method': 'pc_logistic', 'iw_clip_max': 1.25, 'iw_prob_clip': 0.003946002992105778, 'iw_n_components': 30, 'iw_logistic_c': 0.0016474850165742647, 'iw_pca_fit': 'combined', 'iw_solver': 'lbfgs', 'iw_rho': 0.9}. Best is trial 30 with value: 0.21536869947355308.
[I 2026-05-04 02:00:52,893] Trial 43 finished with value: 0.2096239693118222 and parameters: {'alpha': 568038.7701359178, 'use_snp_selection': False, 'iw_method': 'pc_logistic', 'iw_clip_max': 1.25, 'iw_prob_clip': 0.006622818704895811, 'iw_n_components': 30, 'iw_logistic_c': 0.00883543853029467, 'iw_pca_fit': 'combined', 'iw_solver': 'lbfgs', 'iw_rho': 0.9}. Best is trial 30 with value: 0.21536869947355308.
[I 2026-05-04 02:01:22,422] Trial 44 finished with value: 0.21067902256754484 and parameters: {'alpha': 295908.5980263136, 'use_snp_selection': False, 'iw_method': 'uniform'}. Best is trial 30 with value: 0.21536869947355308.
[I 2026-05-04 02:04:03,913] Trial 45 finished with value: 0.21059844243327275 and parameters: {'alpha': 362242.34167972533, 'use_snp_selection': False, 'iw_method': 'pc_logistic', 'iw_clip_max': 1.25, 'iw_prob_clip': 0.012423923897214742, 'iw_n_components': 30, 'iw_logistic_c': 0.07504057466218354, 'iw_pca_fit': 'combined', 'iw_solver': 'lbfgs', 'iw_rho': 1.0}. Best is trial 30 with value: 0.21536869947355308.
[I 2026-05-04 02:06:37,312] Trial 46 finished with value: 0.21201646082523098 and parameters: {'alpha': 212074.80810742924, 'use_snp_selection': False, 'iw_method': 'pc_logistic', 'iw_clip_max': 2.0, 'iw_prob_clip': 0.018762374849526597, 'iw_n_components': 10, 'iw_logistic_c': 0.0033279422347891057, 'iw_pca_fit': 'combined', 'iw_solver': 'lbfgs', 'iw_rho': 0.9}. Best is trial 30 with value: 0.21536869947355308.
[I 2026-05-04 02:07:06,846] Trial 47 finished with value: 0.2079659114461519 and parameters: {'alpha': 505830.505484963, 'use_snp_selection': False, 'iw_method': 'uniform'}. Best is trial 30 with value: 0.21536869947355308.
[I 2026-05-04 02:09:47,950] Trial 48 finished with value: 0.2158107941121321 and parameters: {'alpha': 273096.952078858, 'use_snp_selection': False, 'iw_method': 'pc_logistic', 'iw_clip_max': 1.5, 'iw_prob_clip': 0.005311109959643377, 'iw_n_components': 30, 'iw_logistic_c': 0.18831570778979756, 'iw_pca_fit': 'combined', 'iw_solver': 'lbfgs', 'iw_rho': 0.9}. Best is trial 48 with value: 0.2158107941121321.
[I 2026-05-04 02:12:29,313] Trial 49 finished with value: 0.21185631062607194 and parameters: {'alpha': 145466.50955148376, 'use_snp_selection': False, 'iw_method': 'pc_logistic', 'iw_clip_max': 1.5, 'iw_prob_clip': 0.005302673751921664, 'iw_n_components': 30, 'iw_logistic_c': 2.334613613896724, 'iw_pca_fit': 'combined', 'iw_solver': 'lbfgs', 'iw_rho': 0.9}. Best is trial 48 with value: 0.2158107941121321.
[I 2026-05-04 02:12:58,844] Trial 50 finished with value: 0.21093061028717633 and parameters: {'alpha': 269923.2364192361, 'use_snp_selection': False, 'iw_method': 'uniform'}. Best is trial 48 with value: 0.2158107941121321.
[I 2026-05-04 02:15:39,279] Trial 51 finished with value: 0.2132415756439087 and parameters: {'alpha': 286008.4762290078, 'use_snp_selection': False, 'iw_method': 'pc_logistic', 'iw_clip_max': 1.5, 'iw_prob_clip': 0.0072006687163058275, 'iw_n_components': 30, 'iw_logistic_c': 0.2315243667105074, 'iw_pca_fit': 'combined', 'iw_solver': 'lbfgs', 'iw_rho': 0.9}. Best is trial 48 with value: 0.2158107941121321.
[I 2026-05-04 02:18:20,243] Trial 52 finished with value: 0.2135743311627379 and parameters: {'alpha': 236259.4522803731, 'use_snp_selection': False, 'iw_method': 'pc_logistic', 'iw_clip_max': 1.5, 'iw_prob_clip': 0.049498875562785385, 'iw_n_components': 30, 'iw_logistic_c': 0.02961347398990014, 'iw_pca_fit': 'combined', 'iw_solver': 'lbfgs', 'iw_rho': 0.9}. Best is trial 48 with value: 0.2158107941121321.
[I 2026-05-04 02:21:01,800] Trial 53 finished with value: 0.21272541871181852 and parameters: {'alpha': 184131.60608320616, 'use_snp_selection': False, 'iw_method': 'pc_logistic', 'iw_clip_max': 1.25, 'iw_prob_clip': 0.002493769670654113, 'iw_n_components': 30, 'iw_logistic_c': 0.5856691229787306, 'iw_pca_fit': 'combined', 'iw_solver': 'lbfgs', 'iw_rho': 0.9}. Best is trial 48 with value: 0.2158107941121321.
[I 2026-05-04 02:23:38,752] Trial 54 finished with value: 0.2082004532429485 and parameters: {'alpha': 367501.5583581513, 'use_snp_selection': False, 'iw_method': 'pc_logistic', 'iw_clip_max': 1.5, 'iw_prob_clip': 0.0034625386049368157, 'iw_n_components': 20, 'iw_logistic_c': 0.0032369093458043947, 'iw_pca_fit': 'combined', 'iw_solver': 'lbfgs', 'iw_rho': 0.9}. Best is trial 48 with value: 0.2158107941121321.
[I 2026-05-04 02:26:17,614] Trial 55 finished with value: 0.20955512845597113 and parameters: {'alpha': 152065.91973738643, 'use_snp_selection': False, 'iw_method': 'pc_logistic', 'iw_clip_max': 1.25, 'iw_prob_clip': 0.00494631676833744, 'iw_n_components': 30, 'iw_logistic_c': 0.0006862722533968691, 'iw_pca_fit': 'combined', 'iw_solver': 'lbfgs', 'iw_rho': 0.9}. Best is trial 48 with value: 0.2158107941121321.
[I 2026-05-04 02:29:04,990] Trial 56 finished with value: 0.18561940214327782 and parameters: {'alpha': 640980.9291881035, 'use_snp_selection': False, 'iw_method': 'pc_logistic', 'iw_clip_max': 3.0, 'iw_prob_clip': 0.008210317900344589, 'iw_n_components': 60, 'iw_logistic_c': 0.01412450742225656, 'iw_pca_fit': 'combined', 'iw_solver': 'lbfgs', 'iw_rho': 1.0}. Best is trial 48 with value: 0.2158107941121321.
