Running from this directory: /cluster/work/simennes/Master_thesis
Name of job: ncv_ridge_iw
ID of job: 24361580
Array task ID: 9
The job was run on these nodes: idun-10-02
[I 2026-04-29 18:54:48,278] Trial 0 finished with value: 0.180623493898944 and parameters: {'alpha': 233144.78773166405, 'use_snp_selection': False, 'iw_method': 'pc_logistic', 'iw_clip_max': 3.0, 'iw_prob_clip': 0.003473407124083527, 'iw_n_components': 10, 'iw_logistic_c': 4.788440522914161e-06, 'iw_pca_fit': 'combined', 'iw_solver': 'lbfgs', 'iw_rho': 0.5}. Best is trial 0 with value: 0.180623493898944.
[I 2026-04-29 18:59:46,508] Trial 1 finished with value: 0.16580176916471445 and parameters: {'alpha': 678446.9694418118, 'use_snp_selection': False, 'iw_method': 'pc_logistic', 'iw_clip_max': 5.0, 'iw_prob_clip': 0.013068429331375598, 'iw_n_components': 10, 'iw_logistic_c': 0.08711457855994918, 'iw_pca_fit': 'combined', 'iw_solver': 'lbfgs', 'iw_rho': 0.75}. Best is trial 0 with value: 0.180623493898944.
[I 2026-04-29 19:00:46,749] Trial 2 finished with value: 0.1774173316358648 and parameters: {'alpha': 143366.13979665696, 'use_snp_selection': False, 'iw_method': 'uniform'}. Best is trial 0 with value: 0.180623493898944.
[I 2026-04-29 19:05:48,461] Trial 3 finished with value: 0.1633502331320377 and parameters: {'alpha': 58361.61366993588, 'use_snp_selection': False, 'iw_method': 'pc_logistic', 'iw_clip_max': 5.0, 'iw_prob_clip': 0.0019861124260693325, 'iw_n_components': 20, 'iw_logistic_c': 0.0004456301044046966, 'iw_pca_fit': 'combined', 'iw_solver': 'lbfgs', 'iw_rho': 0.5}. Best is trial 0 with value: 0.180623493898944.
[I 2026-04-29 19:10:47,728] Trial 4 finished with value: 0.18074789384445725 and parameters: {'alpha': 250773.322847116, 'use_snp_selection': False, 'iw_method': 'pc_logistic', 'iw_clip_max': 3.0, 'iw_prob_clip': 0.002976108514822249, 'iw_n_components': 20, 'iw_logistic_c': 4.619061290318921e-07, 'iw_pca_fit': 'combined', 'iw_solver': 'lbfgs', 'iw_rho': 1.0}. Best is trial 4 with value: 0.18074789384445725.
[I 2026-04-29 19:11:47,972] Trial 5 finished with value: 0.17162416639755146 and parameters: {'alpha': 62532.36213374259, 'use_snp_selection': False, 'iw_method': 'uniform'}. Best is trial 4 with value: 0.18074789384445725.
[I 2026-04-29 19:12:48,152] Trial 6 finished with value: 0.17212179681462197 and parameters: {'alpha': 65987.16623129728, 'use_snp_selection': False, 'iw_method': 'uniform'}. Best is trial 4 with value: 0.18074789384445725.
[I 2026-04-29 19:17:42,981] Trial 7 finished with value: 0.17085583060791684 and parameters: {'alpha': 258199.7322511972, 'use_snp_selection': False, 'iw_method': 'pc_logistic', 'iw_clip_max': 5.0, 'iw_prob_clip': 0.011698400979567373, 'iw_n_components': 10, 'iw_logistic_c': 2.0700004045587807e-05, 'iw_pca_fit': 'combined', 'iw_solver': 'lbfgs', 'iw_rho': 0.9}. Best is trial 4 with value: 0.18074789384445725.
[I 2026-04-29 19:21:43,729] Trial 8 finished with value: 0.17583852850918694 and parameters: {'alpha': 471111.2729113027, 'use_snp_selection': False, 'iw_method': 'pc_logistic', 'iw_clip_max': 3.0, 'iw_prob_clip': 0.0028488821422992545, 'iw_n_components': 5, 'iw_logistic_c': 4.32601466983518e-06, 'iw_pca_fit': 'combined', 'iw_solver': 'lbfgs', 'iw_rho': 0.9}. Best is trial 4 with value: 0.18074789384445725.
[I 2026-04-29 19:26:54,134] Trial 9 finished with value: 0.17560125828961287 and parameters: {'alpha': 647318.353565713, 'use_snp_selection': False, 'iw_method': 'pc_logistic', 'iw_clip_max': 3.0, 'iw_prob_clip': 0.0018153829433867708, 'iw_n_components': 30, 'iw_logistic_c': 0.00016321259509605548, 'iw_pca_fit': 'combined', 'iw_solver': 'lbfgs', 'iw_rho': 0.75}. Best is trial 4 with value: 0.18074789384445725.
[I 2026-04-29 19:27:54,538] Trial 10 finished with value: 0.17702203006360792 and parameters: {'alpha': 131339.8012856921, 'use_snp_selection': False, 'iw_method': 'uniform'}. Best is trial 4 with value: 0.18074789384445725.
[I 2026-04-29 19:31:50,249] Trial 11 finished with value: 0.1790355434186876 and parameters: {'alpha': 271017.1466197349, 'use_snp_selection': False, 'iw_method': 'pc_logistic', 'iw_clip_max': 1.5, 'iw_prob_clip': 0.004510038906137478, 'iw_n_components': 1, 'iw_logistic_c': 3.7041632144622945e-07, 'iw_pca_fit': 'combined', 'iw_solver': 'lbfgs', 'iw_rho': 1.0}. Best is trial 4 with value: 0.18074789384445725.
[I 2026-04-29 19:37:05,344] Trial 12 finished with value: 0.17849906775266733 and parameters: {'alpha': 157027.30093255217, 'use_snp_selection': False, 'iw_method': 'pc_logistic', 'iw_clip_max': 2.0, 'iw_prob_clip': 0.04105912470283634, 'iw_n_components': 40, 'iw_logistic_c': 1.0100811930048086e-07, 'iw_pca_fit': 'combined', 'iw_solver': 'lbfgs', 'iw_rho': 1.0}. Best is trial 4 with value: 0.18074789384445725.
[I 2026-04-29 19:42:30,309] Trial 13 finished with value: 0.17983353636284355 and parameters: {'alpha': 378720.8165945179, 'use_snp_selection': False, 'iw_method': 'pc_logistic', 'iw_clip_max': 3.0, 'iw_prob_clip': 0.0011252292050161592, 'iw_n_components': 50, 'iw_logistic_c': 0.08029098569344131, 'iw_pca_fit': 'combined', 'iw_solver': 'lbfgs', 'iw_rho': 0.5}. Best is trial 4 with value: 0.18074789384445725.
[I 2026-04-29 19:47:36,069] Trial 14 finished with value: 0.1785129202512981 and parameters: {'alpha': 209116.20212828304, 'use_snp_selection': False, 'iw_method': 'pc_logistic', 'iw_clip_max': 3.0, 'iw_prob_clip': 0.0056288899189989245, 'iw_n_components': 20, 'iw_logistic_c': 8.824025081925344, 'iw_pca_fit': 'combined', 'iw_solver': 'lbfgs', 'iw_rho': 0.5}. Best is trial 4 with value: 0.18074789384445725.
[I 2026-04-29 19:52:28,071] Trial 15 finished with value: 0.17460636701446863 and parameters: {'alpha': 106218.88460103914, 'use_snp_selection': False, 'iw_method': 'pc_logistic', 'iw_clip_max': 3.0, 'iw_prob_clip': 0.0037043162227852213, 'iw_n_components': 10, 'iw_logistic_c': 4.931675835284008e-06, 'iw_pca_fit': 'combined', 'iw_solver': 'lbfgs', 'iw_rho': 1.0}. Best is trial 4 with value: 0.18074789384445725.
[I 2026-04-29 19:57:27,553] Trial 16 finished with value: 0.1809644774914207 and parameters: {'alpha': 372507.5832477409, 'use_snp_selection': False, 'iw_method': 'pc_logistic', 'iw_clip_max': 2.0, 'iw_prob_clip': 0.008847280484207704, 'iw_n_components': 20, 'iw_logistic_c': 1.1032929026811047e-06, 'iw_pca_fit': 'combined', 'iw_solver': 'lbfgs', 'iw_rho': 0.5}. Best is trial 16 with value: 0.1809644774914207.
[I 2026-04-29 20:02:29,303] Trial 17 finished with value: 0.18084458880630813 and parameters: {'alpha': 394993.48129017744, 'use_snp_selection': False, 'iw_method': 'pc_logistic', 'iw_clip_max': 2.0, 'iw_prob_clip': 0.010866047798702705, 'iw_n_components': 20, 'iw_logistic_c': 4.823749015798781e-07, 'iw_pca_fit': 'combined', 'iw_solver': 'lbfgs', 'iw_rho': 1.0}. Best is trial 16 with value: 0.1809644774914207.
[I 2026-04-29 20:03:29,897] Trial 18 finished with value: 0.1754405562884665 and parameters: {'alpha': 891060.0874428264, 'use_snp_selection': False, 'iw_method': 'uniform'}. Best is trial 16 with value: 0.1809644774914207.
[I 2026-04-29 20:08:35,875] Trial 19 finished with value: 0.18250770911918662 and parameters: {'alpha': 409452.6683018069, 'use_snp_selection': False, 'iw_method': 'pc_logistic', 'iw_clip_max': 2.0, 'iw_prob_clip': 0.012291468809898013, 'iw_n_components': 20, 'iw_logistic_c': 0.019896323696343296, 'iw_pca_fit': 'combined', 'iw_solver': 'lbfgs', 'iw_rho': 0.5}. Best is trial 19 with value: 0.18250770911918662.
[I 2026-04-29 20:13:42,744] Trial 20 finished with value: 0.18490456121702328 and parameters: {'alpha': 515825.77051617106, 'use_snp_selection': False, 'iw_method': 'pc_logistic', 'iw_clip_max': 2.0, 'iw_prob_clip': 0.028068380318437416, 'iw_n_components': 20, 'iw_logistic_c': 0.01497864667253134, 'iw_pca_fit': 'combined', 'iw_solver': 'lbfgs', 'iw_rho': 0.5}. Best is trial 20 with value: 0.18490456121702328.
[I 2026-04-29 20:18:48,725] Trial 21 finished with value: 0.18509619422378895 and parameters: {'alpha': 508572.5656169228, 'use_snp_selection': False, 'iw_method': 'pc_logistic', 'iw_clip_max': 2.0, 'iw_prob_clip': 0.02647604585585736, 'iw_n_components': 20, 'iw_logistic_c': 0.011636118978926278, 'iw_pca_fit': 'combined', 'iw_solver': 'lbfgs', 'iw_rho': 0.5}. Best is trial 21 with value: 0.18509619422378895.
[I 2026-04-29 20:23:53,297] Trial 22 finished with value: 0.1853277333747545 and parameters: {'alpha': 537162.0189515308, 'use_snp_selection': False, 'iw_method': 'pc_logistic', 'iw_clip_max': 2.0, 'iw_prob_clip': 0.024305497439868158, 'iw_n_components': 20, 'iw_logistic_c': 0.014293249453485667, 'iw_pca_fit': 'combined', 'iw_solver': 'lbfgs', 'iw_rho': 0.5}. Best is trial 22 with value: 0.1853277333747545.
[I 2026-04-29 20:28:57,569] Trial 23 finished with value: 0.18173710931311707 and parameters: {'alpha': 597690.8365458581, 'use_snp_selection': False, 'iw_method': 'pc_logistic', 'iw_clip_max': 2.0, 'iw_prob_clip': 0.028849149784223017, 'iw_n_components': 20, 'iw_logistic_c': 0.005494738887638783, 'iw_pca_fit': 'combined', 'iw_solver': 'lbfgs', 'iw_rho': 0.5}. Best is trial 22 with value: 0.1853277333747545.
[I 2026-04-29 20:32:52,739] Trial 24 finished with value: 0.1710313309286217 and parameters: {'alpha': 912375.6639210174, 'use_snp_selection': False, 'iw_method': 'pc_logistic', 'iw_clip_max': 2.0, 'iw_prob_clip': 0.022456684924233496, 'iw_n_components': 1, 'iw_logistic_c': 0.7363862275230866, 'iw_pca_fit': 'combined', 'iw_solver': 'lbfgs', 'iw_rho': 0.5}. Best is trial 22 with value: 0.1853277333747545.
[I 2026-04-29 20:38:06,621] Trial 25 finished with value: 0.18351766787016707 and parameters: {'alpha': 536142.3830686577, 'use_snp_selection': False, 'iw_method': 'pc_logistic', 'iw_clip_max': 2.0, 'iw_prob_clip': 0.021044233862663544, 'iw_n_components': 30, 'iw_logistic_c': 0.004453886871061806, 'iw_pca_fit': 'combined', 'iw_solver': 'lbfgs', 'iw_rho': 0.5}. Best is trial 22 with value: 0.1853277333747545.
[I 2026-04-29 20:39:06,786] Trial 26 finished with value: 0.17588063419114594 and parameters: {'alpha': 791920.4753100724, 'use_snp_selection': False, 'iw_method': 'uniform'}. Best is trial 22 with value: 0.1853277333747545.
[I 2026-04-29 20:44:30,558] Trial 27 finished with value: 0.1825655807657754 and parameters: {'alpha': 319489.0120952507, 'use_snp_selection': False, 'iw_method': 'pc_logistic', 'iw_clip_max': 1.5, 'iw_prob_clip': 0.040232462720916434, 'iw_n_components': 40, 'iw_logistic_c': 0.46351187738831795, 'iw_pca_fit': 'combined', 'iw_solver': 'lbfgs', 'iw_rho': 0.5}. Best is trial 22 with value: 0.1853277333747545.
[I 2026-04-29 20:48:34,251] Trial 28 finished with value: 0.17375584501261626 and parameters: {'alpha': 494558.2879062756, 'use_snp_selection': False, 'iw_method': 'pc_logistic', 'iw_clip_max': 2.0, 'iw_prob_clip': 0.02134808498278976, 'iw_n_components': 5, 'iw_logistic_c': 0.0030632287071679313, 'iw_pca_fit': 'combined', 'iw_solver': 'lbfgs', 'iw_rho': 0.75}. Best is trial 22 with value: 0.1853277333747545.
[I 2026-04-29 20:53:55,987] Trial 29 finished with value: 0.18127438958896597 and parameters: {'alpha': 195690.35315442234, 'use_snp_selection': False, 'iw_method': 'pc_logistic', 'iw_clip_max': 2.0, 'iw_prob_clip': 0.028775669320435973, 'iw_n_components': 50, 'iw_logistic_c': 0.00013478806915129748, 'iw_pca_fit': 'combined', 'iw_solver': 'lbfgs', 'iw_rho': 0.9}. Best is trial 22 with value: 0.1853277333747545.
[I 2026-04-29 20:59:03,703] Trial 30 finished with value: 0.1828599578242511 and parameters: {'alpha': 711756.4525877184, 'use_snp_selection': False, 'iw_method': 'pc_logistic', 'iw_clip_max': 2.0, 'iw_prob_clip': 0.017447574255173834, 'iw_n_components': 20, 'iw_logistic_c': 0.03009711937329288, 'iw_pca_fit': 'combined', 'iw_solver': 'lbfgs', 'iw_rho': 0.5}. Best is trial 22 with value: 0.1853277333747545.
[I 2026-04-29 21:04:14,539] Trial 31 finished with value: 0.18177130225748991 and parameters: {'alpha': 563714.7551008149, 'use_snp_selection': False, 'iw_method': 'pc_logistic', 'iw_clip_max': 2.0, 'iw_prob_clip': 0.047831000968302284, 'iw_n_components': 30, 'iw_logistic_c': 0.0025229320886003166, 'iw_pca_fit': 'combined', 'iw_solver': 'lbfgs', 'iw_rho': 0.5}. Best is trial 22 with value: 0.1853277333747545.
[I 2026-04-29 21:09:31,004] Trial 32 finished with value: 0.18384197137937197 and parameters: {'alpha': 524153.40609534085, 'use_snp_selection': False, 'iw_method': 'pc_logistic', 'iw_clip_max': 2.0, 'iw_prob_clip': 0.030490098391480213, 'iw_n_components': 30, 'iw_logistic_c': 0.011061501444602809, 'iw_pca_fit': 'combined', 'iw_solver': 'lbfgs', 'iw_rho': 0.5}. Best is trial 22 with value: 0.1853277333747545.
[I 2026-04-29 21:14:46,128] Trial 33 finished with value: 0.18409874774272553 and parameters: {'alpha': 455530.6292460366, 'use_snp_selection': False, 'iw_method': 'pc_logistic', 'iw_clip_max': 2.0, 'iw_prob_clip': 0.033534908794239836, 'iw_n_components': 30, 'iw_logistic_c': 0.014533990083627147, 'iw_pca_fit': 'combined', 'iw_solver': 'lbfgs', 'iw_rho': 0.5}. Best is trial 22 with value: 0.1853277333747545.
[I 2026-04-29 21:19:48,752] Trial 34 finished with value: 0.18296477987334545 and parameters: {'alpha': 311135.7325992779, 'use_snp_selection': False, 'iw_method': 'pc_logistic', 'iw_clip_max': 2.0, 'iw_prob_clip': 0.016407295605600225, 'iw_n_components': 20, 'iw_logistic_c': 0.0007453718430340933, 'iw_pca_fit': 'combined', 'iw_solver': 'lbfgs', 'iw_rho': 0.5}. Best is trial 22 with value: 0.1853277333747545.
[I 2026-04-29 21:25:02,027] Trial 35 finished with value: 0.18254200155950923 and parameters: {'alpha': 765605.5605577433, 'use_snp_selection': False, 'iw_method': 'pc_logistic', 'iw_clip_max': 1.5, 'iw_prob_clip': 0.035628552486224735, 'iw_n_components': 30, 'iw_logistic_c': 0.25876187302969483, 'iw_pca_fit': 'combined', 'iw_solver': 'lbfgs', 'iw_rho': 0.5}. Best is trial 22 with value: 0.1853277333747545.
[I 2026-04-29 21:26:02,398] Trial 36 finished with value: 0.17503265223274414 and parameters: {'alpha': 994327.0833849321, 'use_snp_selection': False, 'iw_method': 'uniform'}. Best is trial 22 with value: 0.1853277333747545.
[I 2026-04-29 21:31:07,847] Trial 37 finished with value: 0.18494641048580154 and parameters: {'alpha': 446982.3246562984, 'use_snp_selection': False, 'iw_method': 'pc_logistic', 'iw_clip_max': 2.0, 'iw_prob_clip': 0.027159694969920475, 'iw_n_components': 20, 'iw_logistic_c': 0.05168356532502022, 'iw_pca_fit': 'combined', 'iw_solver': 'lbfgs', 'iw_rho': 0.5}. Best is trial 22 with value: 0.1853277333747545.
[I 2026-04-29 21:36:14,684] Trial 38 finished with value: 0.18077965199066698 and parameters: {'alpha': 311623.95010407834, 'use_snp_selection': False, 'iw_method': 'pc_logistic', 'iw_clip_max': 2.0, 'iw_prob_clip': 0.024150917103591255, 'iw_n_components': 20, 'iw_logistic_c': 2.136206721551496, 'iw_pca_fit': 'combined', 'iw_solver': 'lbfgs', 'iw_rho': 0.5}. Best is trial 22 with value: 0.1853277333747545.
[I 2026-04-29 21:37:14,865] Trial 39 finished with value: 0.17661590032068217 and parameters: {'alpha': 647681.3820455925, 'use_snp_selection': False, 'iw_method': 'uniform'}. Best is trial 22 with value: 0.1853277333747545.
[I 2026-04-29 21:42:18,643] Trial 40 finished with value: 0.17544741089307253 and parameters: {'alpha': 441051.5040919865, 'use_snp_selection': False, 'iw_method': 'pc_logistic', 'iw_clip_max': 5.0, 'iw_prob_clip': 0.01635862938626212, 'iw_n_components': 20, 'iw_logistic_c': 0.08193927335041841, 'iw_pca_fit': 'combined', 'iw_solver': 'lbfgs', 'iw_rho': 0.75}. Best is trial 22 with value: 0.1853277333747545.
[I 2026-04-29 21:47:24,959] Trial 41 finished with value: 0.18175904500470752 and parameters: {'alpha': 465101.70791086566, 'use_snp_selection': False, 'iw_method': 'pc_logistic', 'iw_clip_max': 2.0, 'iw_prob_clip': 0.04937099978118484, 'iw_n_components': 20, 'iw_logistic_c': 0.03853251908516047, 'iw_pca_fit': 'combined', 'iw_solver': 'lbfgs', 'iw_rho': 0.5}. Best is trial 22 with value: 0.1853277333747545.
[I 2026-04-29 21:52:30,444] Trial 42 finished with value: 0.18365728687376287 and parameters: {'alpha': 615109.4233023289, 'use_snp_selection': False, 'iw_method': 'pc_logistic', 'iw_clip_max': 2.0, 'iw_prob_clip': 0.03351840685518992, 'iw_n_components': 20, 'iw_logistic_c': 0.012340729339994331, 'iw_pca_fit': 'combined', 'iw_solver': 'lbfgs', 'iw_rho': 0.5}. Best is trial 22 with value: 0.1853277333747545.
[I 2026-04-29 21:57:37,173] Trial 43 finished with value: 0.18355825918424903 and parameters: {'alpha': 340922.8892493933, 'use_snp_selection': False, 'iw_method': 'pc_logistic', 'iw_clip_max': 2.0, 'iw_prob_clip': 0.02576944159449852, 'iw_n_components': 20, 'iw_logistic_c': 0.15721084874775565, 'iw_pca_fit': 'combined', 'iw_solver': 'lbfgs', 'iw_rho': 0.5}. Best is trial 22 with value: 0.1853277333747545.
[I 2026-04-29 22:03:00,855] Trial 44 finished with value: 0.17329629639063776 and parameters: {'alpha': 436123.9406213668, 'use_snp_selection': False, 'iw_method': 'pc_logistic', 'iw_clip_max': 5.0, 'iw_prob_clip': 0.017949159653144628, 'iw_n_components': 50, 'iw_logistic_c': 0.0014324070100103494, 'iw_pca_fit': 'combined', 'iw_solver': 'lbfgs', 'iw_rho': 0.5}. Best is trial 22 with value: 0.1853277333747545.
[I 2026-04-29 22:07:03,629] Trial 45 finished with value: 0.17599073145529917 and parameters: {'alpha': 284991.5384577303, 'use_snp_selection': False, 'iw_method': 'pc_logistic', 'iw_clip_max': 2.0, 'iw_prob_clip': 0.038676565117397296, 'iw_n_components': 5, 'iw_logistic_c': 0.008101344588034206, 'iw_pca_fit': 'combined', 'iw_solver': 'lbfgs', 'iw_rho': 0.9}. Best is trial 22 with value: 0.1853277333747545.
[I 2026-04-29 22:12:00,560] Trial 46 finished with value: 0.17815062200957937 and parameters: {'alpha': 733757.3173401447, 'use_snp_selection': False, 'iw_method': 'pc_logistic', 'iw_clip_max': 2.0, 'iw_prob_clip': 0.014814220650161565, 'iw_n_components': 10, 'iw_logistic_c': 0.06077748291675639, 'iw_pca_fit': 'combined', 'iw_solver': 'lbfgs', 'iw_rho': 0.5}. Best is trial 22 with value: 0.1853277333747545.
[I 2026-04-29 22:13:00,736] Trial 47 finished with value: 0.17859743036692996 and parameters: {'alpha': 236632.1342161843, 'use_snp_selection': False, 'iw_method': 'uniform'}. Best is trial 22 with value: 0.1853277333747545.
[I 2026-04-29 22:16:54,425] Trial 48 finished with value: 0.17798602845067119 and parameters: {'alpha': 358881.91797292314, 'use_snp_selection': False, 'iw_method': 'pc_logistic', 'iw_clip_max': 1.5, 'iw_prob_clip': 0.00989036969016349, 'iw_n_components': 1, 'iw_logistic_c': 0.00022126744685695593, 'iw_pca_fit': 'combined', 'iw_solver': 'lbfgs', 'iw_rho': 0.5}. Best is trial 22 with value: 0.1853277333747545.
[I 2026-04-29 22:22:14,629] Trial 49 finished with value: 0.1733364703528494 and parameters: {'alpha': 498170.3161559, 'use_snp_selection': False, 'iw_method': 'pc_logistic', 'iw_clip_max': 5.0, 'iw_prob_clip': 0.007433066614229219, 'iw_n_components': 40, 'iw_logistic_c': 0.0011464863791414298, 'iw_pca_fit': 'combined', 'iw_solver': 'lbfgs', 'iw_rho': 0.75}. Best is trial 22 with value: 0.1853277333747545.
[I 2026-04-29 22:27:29,588] Trial 50 finished with value: 0.17482498634844743 and parameters: {'alpha': 84609.98149445541, 'use_snp_selection': False, 'iw_method': 'pc_logistic', 'iw_clip_max': 2.0, 'iw_prob_clip': 0.03230941463971731, 'iw_n_components': 30, 'iw_logistic_c': 0.02365720049944366, 'iw_pca_fit': 'combined', 'iw_solver': 'lbfgs', 'iw_rho': 0.5}. Best is trial 22 with value: 0.1853277333747545.
[I 2026-04-29 22:32:42,764] Trial 51 finished with value: 0.1826120551397527 and parameters: {'alpha': 542046.3286898293, 'use_snp_selection': False, 'iw_method': 'pc_logistic', 'iw_clip_max': 2.0, 'iw_prob_clip': 0.0266264253914081, 'iw_n_components': 30, 'iw_logistic_c': 0.010932630311215092, 'iw_pca_fit': 'combined', 'iw_solver': 'lbfgs', 'iw_rho': 0.5}. Best is trial 22 with value: 0.1853277333747545.
[I 2026-04-29 22:37:56,635] Trial 52 finished with value: 0.1851504850080456 and parameters: {'alpha': 517366.7207582218, 'use_snp_selection': False, 'iw_method': 'pc_logistic', 'iw_clip_max': 2.0, 'iw_prob_clip': 0.03148103518526792, 'iw_n_components': 30, 'iw_logistic_c': 0.15238286025668643, 'iw_pca_fit': 'combined', 'iw_solver': 'lbfgs', 'iw_rho': 0.5}. Best is trial 22 with value: 0.1853277333747545.
[I 2026-04-29 22:43:11,649] Trial 53 finished with value: 0.18037968923029407 and parameters: {'alpha': 650313.0807059755, 'use_snp_selection': False, 'iw_method': 'pc_logistic', 'iw_clip_max': 2.0, 'iw_prob_clip': 0.020078425648753957, 'iw_n_components': 30, 'iw_logistic_c': 0.8524915212816373, 'iw_pca_fit': 'combined', 'iw_solver': 'lbfgs', 'iw_rho': 0.9}. Best is trial 22 with value: 0.1853277333747545.
[I 2026-04-29 22:48:16,952] Trial 54 finished with value: 0.18352327079050929 and parameters: {'alpha': 415863.428288458, 'use_snp_selection': False, 'iw_method': 'pc_logistic', 'iw_clip_max': 2.0, 'iw_prob_clip': 0.041401619311755004, 'iw_n_components': 20, 'iw_logistic_c': 0.11200451125001948, 'iw_pca_fit': 'combined', 'iw_solver': 'lbfgs', 'iw_rho': 0.5}. Best is trial 22 with value: 0.1853277333747545.
[I 2026-04-29 22:53:31,422] Trial 55 finished with value: 0.1830071047988861 and parameters: {'alpha': 585197.6132669774, 'use_snp_selection': False, 'iw_method': 'pc_logistic', 'iw_clip_max': 2.0, 'iw_prob_clip': 0.013893699241636751, 'iw_n_components': 30, 'iw_logistic_c': 0.23872703638582624, 'iw_pca_fit': 'combined', 'iw_solver': 'lbfgs', 'iw_rho': 0.5}. Best is trial 22 with value: 0.1853277333747545.
[I 2026-04-29 22:58:37,474] Trial 56 finished with value: 0.1742231485767983 and parameters: {'alpha': 812518.5722847991, 'use_snp_selection': False, 'iw_method': 'pc_logistic', 'iw_clip_max': 3.0, 'iw_prob_clip': 0.023683901492628782, 'iw_n_components': 20, 'iw_logistic_c': 0.0446225112909935, 'iw_pca_fit': 'combined', 'iw_solver': 'lbfgs', 'iw_rho': 1.0}. Best is trial 22 with value: 0.1853277333747545.
