[I 2026-04-18 14:38:35,302] Trial 7 finished with value: 0.05446500963740347 and parameters: {'hidden_dims': '[512, 128]', 'dropout': 0.1304538168539244, 'batch_norm': False, 'lr': 1.5408060926311233e-05, 'weight_decay': 2.1989735568314356e-08, 'epochs': 250, 'loss': 'mse', 'optimizer': 'sgd', 'use_snp_selection': True, 'num_snps': 42550, 'weight_scheme': 'exponential', 'weight_clip_max': 10.0, 'weight_exponential_beta': 2.758850226029358}. Best is trial 6 with value: 0.1532404851230473.
[I 2026-04-18 14:38:51,273] Trial 7 finished with value: 0.07286602405826556 and parameters: {'hidden_dims': '[512, 128]', 'dropout': 0.1304538168539244, 'batch_norm': False, 'lr': 1.5408060926311233e-05, 'weight_decay': 2.1989735568314356e-08, 'epochs': 250, 'loss': 'mse', 'optimizer': 'sgd', 'use_snp_selection': True, 'num_snps': 42550, 'weight_scheme': 'exponential', 'weight_clip_max': 10.0, 'weight_exponential_beta': 2.758850226029358}. Best is trial 6 with value: 0.13496898327067905.
[I 2026-04-18 14:39:13,076] Trial 8 finished with value: 0.11948528098904236 and parameters: {'hidden_dims': '[256, 128]', 'dropout': 0.05742396906738376, 'batch_norm': False, 'lr': 1.9761509510575143e-06, 'weight_decay': 2.933492239224291e-07, 'epochs': 82, 'loss': 'mae', 'optimizer': 'adam', 'use_snp_selection': True, 'num_snps': 29883, 'weight_scheme': 'minmax', 'weight_clip_max': 5.0, 'weight_minmax_eps': 0.0051288771726799584}. Best is trial 6 with value: 0.1532404851230473.
[I 2026-04-18 14:39:25,627] Trial 8 finished with value: 0.1397641877963909 and parameters: {'hidden_dims': '[256, 128]', 'dropout': 0.05742396906738376, 'batch_norm': False, 'lr': 1.9761509510575143e-06, 'weight_decay': 2.933492239224291e-07, 'epochs': 82, 'loss': 'mae', 'optimizer': 'adam', 'use_snp_selection': True, 'num_snps': 29883, 'weight_scheme': 'minmax', 'weight_clip_max': 5.0, 'weight_minmax_eps': 0.0051288771726799584}. Best is trial 8 with value: 0.1397641877963909.
[I 2026-04-18 14:40:01,231] Trial 9 finished with value: 0.16955265882146425 and parameters: {'hidden_dims': '[256, 128]', 'dropout': 0.5795930447285386, 'batch_norm': False, 'lr': 0.00011782025260263196, 'weight_decay': 0.0005562063174273634, 'epochs': 218, 'loss': 'mae', 'optimizer': 'adamw', 'use_snp_selection': True, 'num_snps': 32226, 'weight_scheme': 'minmax', 'weight_clip_max': 5.0, 'weight_minmax_eps': 0.09600289105543994}. Best is trial 9 with value: 0.16955265882146425.
[I 2026-04-18 14:40:09,322] Trial 9 finished with value: 0.11151035400131029 and parameters: {'hidden_dims': '[256, 128]', 'dropout': 0.5795930447285386, 'batch_norm': False, 'lr': 0.00011782025260263196, 'weight_decay': 0.0005562063174273634, 'epochs': 218, 'loss': 'mae', 'optimizer': 'adamw', 'use_snp_selection': True, 'num_snps': 32226, 'weight_scheme': 'minmax', 'weight_clip_max': 5.0, 'weight_minmax_eps': 0.09600289105543994}. Best is trial 8 with value: 0.1397641877963909.
[I 2026-04-18 14:40:51,852] Trial 10 finished with value: 0.09500832775345595 and parameters: {'hidden_dims': '[256, 128]', 'dropout': 0.4338375928678635, 'batch_norm': False, 'lr': 1.459239318238064e-06, 'weight_decay': 3.891313547330106e-07, 'epochs': 68, 'loss': 'mae', 'optimizer': 'adam', 'use_snp_selection': True, 'num_snps': 53871, 'weight_scheme': 'uniform', 'weight_clip_max': 5.0}. Best is trial 8 with value: 0.1397641877963909.
[I 2026-04-18 14:41:03,569] Trial 10 finished with value: 0.047270567138337834 and parameters: {'hidden_dims': '[256, 128]', 'dropout': 0.5982265091674299, 'batch_norm': False, 'lr': 0.0009667920285641304, 'weight_decay': 0.0007065067205778983, 'epochs': 203, 'loss': 'mae', 'optimizer': 'adamw', 'use_snp_selection': True, 'num_snps': 54689, 'weight_scheme': 'uniform', 'weight_clip_max': 5.0}. Best is trial 9 with value: 0.16955265882146425.
[I 2026-04-18 14:41:51,137] Trial 11 finished with value: 0.09041383780910926 and parameters: {'hidden_dims': '[512, 64]', 'dropout': 0.002599425762273795, 'batch_norm': True, 'lr': 0.0007728340671580595, 'weight_decay': 2.3957122953452362e-05, 'epochs': 213, 'loss': 'mae', 'optimizer': 'adam', 'use_snp_selection': False, 'weight_scheme': 'minmax', 'weight_clip_max': None, 'weight_minmax_eps': 0.011584305851229494}. Best is trial 8 with value: 0.1397641877963909.
[I 2026-04-18 14:42:12,318] Trial 11 finished with value: 0.16406717167682067 and parameters: {'hidden_dims': '[512, 64]', 'dropout': 0.48179236930737634, 'batch_norm': True, 'lr': 0.0003590005130816133, 'weight_decay': 0.0004864760243946446, 'epochs': 231, 'loss': 'mae', 'optimizer': 'adam', 'use_snp_selection': False, 'weight_scheme': 'minmax', 'weight_clip_max': None, 'weight_minmax_eps': 0.09687781180927992}. Best is trial 9 with value: 0.16955265882146425.
[I 2026-04-18 14:42:33,823] Trial 12 finished with value: 0.09073574131689019 and parameters: {'hidden_dims': '[256, 64]', 'dropout': 0.0851395157391335, 'batch_norm': True, 'lr': 3.174224067518343e-06, 'weight_decay': 5.752278551765894e-05, 'epochs': 296, 'loss': 'mae', 'optimizer': 'adam', 'use_snp_selection': False, 'weight_scheme': 'minmax', 'weight_clip_max': None, 'weight_minmax_eps': 0.19711170525101931}. Best is trial 8 with value: 0.1397641877963909.
[I 2026-04-18 14:42:58,473] Trial 13 finished with value: 0.1056916484771023 and parameters: {'hidden_dims': '[256, 128]', 'dropout': 0.014105125164896815, 'batch_norm': False, 'lr': 5.214544378660367e-06, 'weight_decay': 1.2488729874967977e-06, 'epochs': 86, 'loss': 'mae', 'optimizer': 'adam', 'use_snp_selection': True, 'num_snps': 6999, 'weight_scheme': 'top-heavy', 'weight_clip_max': 5.0, 'weight_topheavy_top_frac': 0.48398486394237283, 'weight_topheavy_low': 0.5666436580870186, 'weight_topheavy_high': 5.961546164133656}. Best is trial 8 with value: 0.1397641877963909.
[I 2026-04-18 14:43:18,436] Trial 12 finished with value: 0.17328287824121572 and parameters: {'hidden_dims': '[512, 64]', 'dropout': 0.5756846183148884, 'batch_norm': True, 'lr': 0.0004604776265397854, 'weight_decay': 0.0009430578454129051, 'epochs': 222, 'loss': 'mae', 'optimizer': 'adamw', 'use_snp_selection': False, 'weight_scheme': 'minmax', 'weight_clip_max': None, 'weight_minmax_eps': 0.11646824613661988}. Best is trial 12 with value: 0.17328287824121572.
[I 2026-04-18 14:43:33,491] Trial 14 finished with value: 0.09359145481957536 and parameters: {'hidden_dims': '[256, 64]', 'dropout': 0.3716328732968822, 'batch_norm': True, 'lr': 1.0478194488285765e-06, 'weight_decay': 1.1310459626593576e-07, 'epochs': 237, 'loss': 'mae', 'optimizer': 'adam', 'use_snp_selection': False, 'weight_scheme': 'exponential', 'weight_clip_max': None, 'weight_exponential_beta': 6.512744308642654}. Best is trial 8 with value: 0.1397641877963909.
[I 2026-04-18 14:43:50,812] Trial 13 finished with value: 0.10899028503007288 and parameters: {'hidden_dims': '[512, 64]', 'dropout': 0.4734218573103429, 'batch_norm': False, 'lr': 0.00040255722523826283, 'weight_decay': 9.409850265366299e-05, 'epochs': 210, 'loss': 'mae', 'optimizer': 'adamw', 'use_snp_selection': True, 'num_snps': 7358, 'weight_scheme': 'top-heavy', 'weight_clip_max': None, 'weight_topheavy_top_frac': 0.48398486394237283, 'weight_topheavy_low': 0.5666436580870186, 'weight_topheavy_high': 5.961546164133656}. Best is trial 12 with value: 0.17328287824121572.
[I 2026-04-18 14:44:03,471] Trial 15 finished with value: 0.15386984197513567 and parameters: {'hidden_dims': '[256, 128]', 'dropout': 0.12633136665698683, 'batch_norm': False, 'lr': 0.0003335938699102399, 'weight_decay': 0.00040944138337943597, 'epochs': 51, 'loss': 'mae', 'optimizer': 'adamw', 'use_snp_selection': True, 'num_snps': 22175, 'weight_scheme': 'uniform', 'weight_clip_max': 5.0}. Best is trial 15 with value: 0.15386984197513567.
[I 2026-04-18 14:44:33,847] Trial 16 finished with value: 0.16211591952426777 and parameters: {'hidden_dims': '[256, 128]', 'dropout': 0.1321292827554862, 'batch_norm': False, 'lr': 0.0008180381580428657, 'weight_decay': 0.0009274652872545433, 'epochs': 53, 'loss': 'mae', 'optimizer': 'adamw', 'use_snp_selection': True, 'num_snps': 23170, 'weight_scheme': 'uniform', 'weight_clip_max': 5.0}. Best is trial 16 with value: 0.16211591952426777.
[I 2026-04-18 14:45:03,224] Trial 17 finished with value: 0.16035854717357084 and parameters: {'hidden_dims': '[256, 128]', 'dropout': 0.14940246227178908, 'batch_norm': False, 'lr': 0.0009506653792868805, 'weight_decay': 0.000926167506082899, 'epochs': 53, 'loss': 'mae', 'optimizer': 'adamw', 'use_snp_selection': True, 'num_snps': 20219, 'weight_scheme': 'uniform', 'weight_clip_max': 5.0}. Best is trial 16 with value: 0.16211591952426777.
[I 2026-04-18 14:45:17,657] Trial 14 finished with value: 0.151234649175146 and parameters: {'hidden_dims': '[512, 64]', 'dropout': 0.5968223630144804, 'batch_norm': True, 'lr': 0.0002731708432294855, 'weight_decay': 0.00010939995191253518, 'epochs': 297, 'loss': 'mae', 'optimizer': 'adamw', 'use_snp_selection': False, 'weight_scheme': 'exponential', 'weight_clip_max': 5.0, 'weight_exponential_beta': 6.512744308642654}. Best is trial 12 with value: 0.17328287824121572.
[I 2026-04-18 14:45:31,479] Trial 18 finished with value: 0.13706026733375237 and parameters: {'hidden_dims': '[256, 128]', 'dropout': 0.2068558066610506, 'batch_norm': False, 'lr': 0.0008591724539604284, 'weight_decay': 0.0009052110854739537, 'epochs': 50, 'loss': 'mae', 'optimizer': 'adamw', 'use_snp_selection': True, 'num_snps': 17737, 'weight_scheme': 'uniform', 'weight_clip_max': 5.0}. Best is trial 16 with value: 0.16211591952426777.
[I 2026-04-18 14:45:58,304] Trial 15 finished with value: 0.10063297954627796 and parameters: {'hidden_dims': '[256, 128]', 'dropout': 0.47172976457024, 'batch_norm': False, 'lr': 0.0007002400263284549, 'weight_decay': 0.0008655392345190722, 'epochs': 52, 'loss': 'mae', 'optimizer': 'adamw', 'use_snp_selection': True, 'num_snps': 44135, 'weight_scheme': 'uniform', 'weight_clip_max': None}. Best is trial 12 with value: 0.17328287824121572.
[I 2026-04-18 14:46:13,532] Trial 19 finished with value: 0.1354686593089545 and parameters: {'hidden_dims': '[256, 128]', 'dropout': 0.3494155419815098, 'batch_norm': False, 'lr': 0.0003360152162445902, 'weight_decay': 0.00017327429269548125, 'epochs': 120, 'loss': 'mae', 'optimizer': 'adamw', 'use_snp_selection': True, 'num_snps': 41335, 'weight_scheme': 'uniform', 'weight_clip_max': 5.0}. Best is trial 16 with value: 0.16211591952426777.
[I 2026-04-18 14:46:43,204] Trial 20 finished with value: 0.1344124474255912 and parameters: {'hidden_dims': '[512, 128]', 'dropout': 0.12017667706343825, 'batch_norm': False, 'lr': 0.00030348824094446157, 'weight_decay': 0.00010324151131260175, 'epochs': 159, 'loss': 'mae', 'optimizer': 'adamw', 'use_snp_selection': True, 'num_snps': 8730, 'weight_scheme': 'uniform', 'weight_clip_max': 5.0}. Best is trial 16 with value: 0.16211591952426777.
[I 2026-04-18 14:47:13,376] Trial 21 finished with value: 0.16472611885524424 and parameters: {'hidden_dims': '[256, 128]', 'dropout': 0.13913213339419475, 'batch_norm': False, 'lr': 0.0004406566646523419, 'weight_decay': 0.000271577641643165, 'epochs': 60, 'loss': 'mae', 'optimizer': 'adamw', 'use_snp_selection': True, 'num_snps': 22174, 'weight_scheme': 'uniform', 'weight_clip_max': 5.0}. Best is trial 21 with value: 0.16472611885524424.
[I 2026-04-18 14:47:16,061] Trial 16 finished with value: 0.17374416968979173 and parameters: {'hidden_dims': '[512, 64]', 'dropout': 0.38619018834660446, 'batch_norm': True, 'lr': 0.00013897147614724386, 'weight_decay': 2.8556887577968485e-05, 'epochs': 267, 'loss': 'mae', 'optimizer': 'adamw', 'use_snp_selection': False, 'weight_scheme': 'minmax', 'weight_clip_max': 5.0, 'weight_minmax_eps': 0.1936664849143409}. Best is trial 16 with value: 0.17374416968979173.
[I 2026-04-18 14:47:43,646] Trial 22 finished with value: 0.14751467514646158 and parameters: {'hidden_dims': '[256, 128]', 'dropout': 0.21736826116699115, 'batch_norm': False, 'lr': 0.0005807514759017747, 'weight_decay': 0.00023427553544651483, 'epochs': 90, 'loss': 'mae', 'optimizer': 'adamw', 'use_snp_selection': True, 'num_snps': 19487, 'weight_scheme': 'uniform', 'weight_clip_max': 5.0}. Best is trial 21 with value: 0.16472611885524424.
[I 2026-04-18 14:48:15,237] Trial 23 finished with value: 0.1519029246255955 and parameters: {'hidden_dims': '[256, 128]', 'dropout': 0.1480524996787856, 'batch_norm': False, 'lr': 0.00044940501437341045, 'weight_decay': 0.0007799382638688001, 'epochs': 66, 'loss': 'mae', 'optimizer': 'adamw', 'use_snp_selection': True, 'num_snps': 25445, 'weight_scheme': 'uniform', 'weight_clip_max': 5.0}. Best is trial 21 with value: 0.16472611885524424.
[I 2026-04-18 14:48:33,722] Trial 17 finished with value: 0.16953471305947937 and parameters: {'hidden_dims': '[512, 64]', 'dropout': 0.37027736804280176, 'batch_norm': True, 'lr': 0.000195328726004433, 'weight_decay': 2.9180212525980848e-05, 'epochs': 266, 'loss': 'mae', 'optimizer': 'adamw', 'use_snp_selection': False, 'weight_scheme': 'minmax', 'weight_clip_max': None, 'weight_minmax_eps': 0.18536585830056135}. Best is trial 16 with value: 0.17374416968979173.
[I 2026-04-18 14:49:02,177] Trial 24 finished with value: 0.14501935241363462 and parameters: {'hidden_dims': '[512, 64]', 'dropout': 0.09916310003988404, 'batch_norm': False, 'lr': 0.00022119947908359874, 'weight_decay': 0.0002575516061724272, 'epochs': 108, 'loss': 'mae', 'optimizer': 'adamw', 'use_snp_selection': True, 'num_snps': 38052, 'weight_scheme': 'uniform', 'weight_clip_max': 5.0}. Best is trial 21 with value: 0.16472611885524424.
[I 2026-04-18 14:49:29,342] Trial 25 finished with value: 0.13577512994228508 and parameters: {'hidden_dims': '[256, 128]', 'dropout': 0.1722648409631612, 'batch_norm': False, 'lr': 0.0009041196150600235, 'weight_decay': 2.21082113793806e-05, 'epochs': 69, 'loss': 'mae', 'optimizer': 'adamw', 'use_snp_selection': True, 'num_snps': 13465, 'weight_scheme': 'uniform', 'weight_clip_max': 10.0}. Best is trial 21 with value: 0.16472611885524424.
[I 2026-04-18 14:49:51,607] Trial 18 finished with value: 0.13826769317324397 and parameters: {'hidden_dims': '[512, 64]', 'dropout': 0.38984284952301673, 'batch_norm': True, 'lr': 4.08247565301244e-06, 'weight_decay': 2.2367479790365374e-05, 'epochs': 267, 'loss': 'mae', 'optimizer': 'adamw', 'use_snp_selection': False, 'weight_scheme': 'minmax', 'weight_clip_max': 5.0, 'weight_minmax_eps': 0.19866426098411924}. Best is trial 16 with value: 0.17374416968979173.
[I 2026-04-18 14:50:04,977] Trial 26 finished with value: 0.12404655332487442 and parameters: {'hidden_dims': '[256, 128]', 'dropout': 0.23603381807779433, 'batch_norm': False, 'lr': 0.0004818570093446971, 'weight_decay': 0.00010747564737006687, 'epochs': 126, 'loss': 'mae', 'optimizer': 'adamw', 'use_snp_selection': True, 'num_snps': 27620, 'weight_scheme': 'uniform', 'weight_clip_max': 5.0}. Best is trial 21 with value: 0.16472611885524424.
[I 2026-04-18 14:50:32,745] Trial 27 finished with value: 0.1654378560008301 and parameters: {'hidden_dims': '[256, 128]', 'dropout': 0.3113343233596703, 'batch_norm': False, 'lr': 0.0002061501746735549, 'weight_decay': 0.0009738319946710279, 'epochs': 50, 'loss': 'mae', 'optimizer': 'adamw', 'use_snp_selection': True, 'num_snps': 16911, 'weight_scheme': 'uniform', 'weight_clip_max': 5.0}. Best is trial 27 with value: 0.1654378560008301.
[I 2026-04-18 14:50:41,200] Trial 19 finished with value: 0.16719423919719265 and parameters: {'hidden_dims': '[512, 64]', 'dropout': 0.5339938340267298, 'batch_norm': True, 'lr': 0.0005500044142011819, 'weight_decay': 0.0002458033232052844, 'epochs': 163, 'loss': 'mae', 'optimizer': 'adamw', 'use_snp_selection': False, 'weight_scheme': 'exponential', 'weight_clip_max': 10.0, 'weight_exponential_beta': 0.18525436333077394}. Best is trial 16 with value: 0.17374416968979173.
[I 2026-04-18 14:51:00,402] Trial 28 finished with value: 0.1292158982919849 and parameters: {'hidden_dims': '[256, 128]', 'dropout': 0.4472515582238128, 'batch_norm': False, 'lr': 0.00018050805900939125, 'weight_decay': 0.0003231307565933341, 'epochs': 101, 'loss': 'mae', 'optimizer': 'adamw', 'use_snp_selection': True, 'num_snps': 12337, 'weight_scheme': 'exponential', 'weight_clip_max': 5.0, 'weight_exponential_beta': 0.1264577158532152}. Best is trial 27 with value: 0.1654378560008301.
[I 2026-04-18 14:51:36,443] Trial 29 finished with value: 0.16053554243339876 and parameters: {'hidden_dims': '[256, 128]', 'dropout': 0.34608088220621536, 'batch_norm': False, 'lr': 6.238210911454567e-05, 'weight_decay': 2.799459982950369e-05, 'epochs': 73, 'loss': 'mse', 'optimizer': 'adamw', 'use_snp_selection': True, 'num_snps': 35572, 'weight_scheme': 'top-heavy', 'weight_clip_max': 5.0, 'weight_topheavy_top_frac': 0.051431913469904805, 'weight_topheavy_low': 0.9259327338686819, 'weight_topheavy_high': 1.2029562693288653}. Best is trial 27 with value: 0.1654378560008301.
[I 2026-04-18 14:51:37,520] Trial 20 finished with value: 0.1638467907903978 and parameters: {'hidden_dims': '[512, 64]', 'dropout': 0.39075065319717744, 'batch_norm': True, 'lr': 6.043979641591539e-05, 'weight_decay': 1.5377057310456422e-06, 'epochs': 188, 'loss': 'mae', 'optimizer': 'adamw', 'use_snp_selection': False, 'weight_scheme': 'top-heavy', 'weight_clip_max': 5.0, 'weight_topheavy_top_frac': 0.06613236709046125, 'weight_topheavy_low': 0.9479360646626545, 'weight_topheavy_high': 1.6168326711413137}. Best is trial 16 with value: 0.17374416968979173.
[I 2026-04-18 14:52:08,354] Trial 30 finished with value: 0.1416207654753177 and parameters: {'hidden_dims': '[512, 128]', 'dropout': 0.30774122315037566, 'batch_norm': False, 'lr': 0.00023395865061790313, 'weight_decay': 0.00013448731300112727, 'epochs': 94, 'loss': 'mae', 'optimizer': 'adamw', 'use_snp_selection': True, 'num_snps': 16024, 'weight_scheme': 'uniform', 'weight_clip_max': 10.0}. Best is trial 27 with value: 0.1654378560008301.
[I 2026-04-18 14:52:17,885] Trial 21 finished with value: 0.16513013989715042 and parameters: {'hidden_dims': '[256, 128]', 'dropout': 0.5285098938500858, 'batch_norm': False, 'lr': 0.0001408144269616007, 'weight_decay': 0.00024456603318375917, 'epochs': 224, 'loss': 'mae', 'optimizer': 'adamw', 'use_snp_selection': True, 'num_snps': 21788, 'weight_scheme': 'minmax', 'weight_clip_max': 5.0, 'weight_minmax_eps': 0.1395736230408579}. Best is trial 16 with value: 0.17374416968979173.
[I 2026-04-18 14:52:49,899] Trial 31 finished with value: 0.1524561328614919 and parameters: {'hidden_dims': '[256, 128]', 'dropout': 0.39584559222933524, 'batch_norm': False, 'lr': 5.927088373730387e-05, 'weight_decay': 3.056908403812188e-05, 'epochs': 73, 'loss': 'mse', 'optimizer': 'adamw', 'use_snp_selection': True, 'num_snps': 49465, 'weight_scheme': 'top-heavy', 'weight_clip_max': 5.0, 'weight_topheavy_top_frac': 0.05369360256066666, 'weight_topheavy_low': 0.9305339222713995, 'weight_topheavy_high': 1.5789669360936658}. Best is trial 27 with value: 0.1654378560008301.
[I 2026-04-18 14:53:25,559] Trial 32 finished with value: 0.15752073256465945 and parameters: {'hidden_dims': '[256, 128]', 'dropout': 0.49458666003280316, 'batch_norm': False, 'lr': 0.00013427235001717928, 'weight_decay': 6.137262274801652e-05, 'epochs': 62, 'loss': 'mse', 'optimizer': 'adamw', 'use_snp_selection': True, 'num_snps': 35890, 'weight_scheme': 'top-heavy', 'weight_clip_max': 5.0, 'weight_topheavy_top_frac': 0.31943346427786534, 'weight_topheavy_low': 0.8288450933002559, 'weight_topheavy_high': 1.4454613006566825}. Best is trial 27 with value: 0.1654378560008301.
[I 2026-04-18 14:53:35,093] Trial 22 finished with value: 0.16353234143290346 and parameters: {'hidden_dims': '[512, 128]', 'dropout': 0.5513552520264204, 'batch_norm': True, 'lr': 0.0001645282375250087, 'weight_decay': 0.00017147568187631508, 'epochs': 264, 'loss': 'mae', 'optimizer': 'adamw', 'use_snp_selection': False, 'weight_scheme': 'minmax', 'weight_clip_max': 5.0, 'weight_minmax_eps': 0.13623445304359733}. Best is trial 16 with value: 0.17374416968979173.
[I 2026-04-18 14:53:57,292] Trial 33 finished with value: 0.14809161525669587 and parameters: {'hidden_dims': '[256, 128]', 'dropout': 0.351243081595753, 'batch_norm': False, 'lr': 6.52936155280011e-05, 'weight_decay': 1.1442070615510306e-05, 'epochs': 78, 'loss': 'mse', 'optimizer': 'adamw', 'use_snp_selection': True, 'num_snps': 23544, 'weight_scheme': 'top-heavy', 'weight_clip_max': 5.0, 'weight_topheavy_top_frac': 0.06774061835511364, 'weight_topheavy_low': 0.8949869300661829, 'weight_topheavy_high': 3.5414848352615573}. Best is trial 27 with value: 0.1654378560008301.
[I 2026-04-18 14:54:26,809] Trial 23 finished with value: 0.18136235350903107 and parameters: {'hidden_dims': '[256, 128]', 'dropout': 0.4649747506524789, 'batch_norm': False, 'lr': 9.347962889391164e-05, 'weight_decay': 2.293819512591039e-05, 'epochs': 213, 'loss': 'mae', 'optimizer': 'adamw', 'use_snp_selection': True, 'num_snps': 39098, 'weight_scheme': 'minmax', 'weight_clip_max': 5.0, 'weight_minmax_eps': 0.0625064798773651}. Best is trial 23 with value: 0.18136235350903107.
[I 2026-04-18 14:54:41,721] Trial 34 finished with value: 0.1395600771370996 and parameters: {'hidden_dims': '[512, 64]', 'dropout': 0.28162530141833547, 'batch_norm': False, 'lr': 9.420494473352875e-05, 'weight_decay': 0.00040621080013792163, 'epochs': 105, 'loss': 'mse', 'optimizer': 'adamw', 'use_snp_selection': True, 'num_snps': 34071, 'weight_scheme': 'linear', 'weight_clip_max': 5.0, 'weight_linear_min_weight': 0.9000134135973141, 'weight_linear_max_weight': 3.9068419999448976}. Best is trial 27 with value: 0.1654378560008301.
