Running from this directory: /cluster/work/simennes/Master_thesis
Name of job: ncv_ridge_iw
ID of job: 24335608
Array task ID: 14
The job was run on these nodes: idun-03-21
[I 2026-04-23 15:39:09,808] Trial 0 finished with value: 0.1481754033259875 and parameters: {'alpha': 113703.38004442609, 'use_snp_selection': True, 'num_snps': 5442, 'iw_method': 'pc_logistic', 'iw_clip_max': 10.0, 'iw_n_components': 5, 'iw_logistic_c': 4.927310296129143, 'iw_pca_fit': 'source', 'iw_solver': 'lbfgs'}. Best is trial 0 with value: 0.1481754033259875.
[I 2026-04-23 15:45:24,336] Trial 1 finished with value: 0.16119657030696377 and parameters: {'alpha': 31403.568254918682, 'use_snp_selection': True, 'num_snps': 52878, 'iw_method': 'pc_logistic', 'iw_clip_max': 25.0, 'iw_n_components': 50, 'iw_logistic_c': 0.0215474878351802, 'iw_pca_fit': 'combined', 'iw_solver': 'lbfgs'}. Best is trial 1 with value: 0.16119657030696377.
[I 2026-04-23 15:46:09,936] Trial 2 finished with value: 0.17246767061122328 and parameters: {'alpha': 843188.1730429748, 'use_snp_selection': False, 'iw_method': 'uniform', 'iw_clip_max': 10.0}. Best is trial 2 with value: 0.17246767061122328.
[I 2026-04-23 15:49:21,699] Trial 3 finished with value: 0.14337021220437246 and parameters: {'alpha': 1608.6968668824506, 'use_snp_selection': True, 'num_snps': 20835, 'iw_method': 'pc_logistic', 'iw_clip_max': None, 'iw_n_components': 10, 'iw_logistic_c': 1.0216001618506627, 'iw_pca_fit': 'source', 'iw_solver': 'lbfgs'}. Best is trial 2 with value: 0.17246767061122328.
[I 2026-04-23 15:50:05,032] Trial 4 finished with value: 0.17767111777620131 and parameters: {'alpha': 304631.0485153137, 'use_snp_selection': False, 'iw_method': 'uniform', 'iw_clip_max': 25.0}. Best is trial 4 with value: 0.17767111777620131.
[I 2026-04-23 15:54:14,635] Trial 5 finished with value: 0.14555688106958123 and parameters: {'alpha': 1969.1835550007406, 'use_snp_selection': False, 'iw_method': 'pc_logistic', 'iw_clip_max': None, 'iw_n_components': 10, 'iw_logistic_c': 72.13019609570544, 'iw_pca_fit': 'source', 'iw_solver': 'lbfgs'}. Best is trial 4 with value: 0.17767111777620131.
[I 2026-04-23 15:58:04,003] Trial 6 finished with value: 0.1763110137369329 and parameters: {'alpha': 102451.8239242939, 'use_snp_selection': True, 'num_snps': 28882, 'iw_method': 'pc_logistic', 'iw_clip_max': None, 'iw_n_components': 5, 'iw_logistic_c': 74.89693291900525, 'iw_pca_fit': 'source', 'iw_solver': 'lbfgs'}. Best is trial 4 with value: 0.17767111777620131.
[I 2026-04-23 15:58:48,020] Trial 7 finished with value: 0.13537970904149202 and parameters: {'alpha': 2141.2178673431476, 'use_snp_selection': False, 'iw_method': 'uniform', 'iw_clip_max': 25.0}. Best is trial 4 with value: 0.17767111777620131.
[I 2026-04-23 16:00:47,287] Trial 8 finished with value: 0.15978438678116574 and parameters: {'alpha': 5044402.471344981, 'use_snp_selection': True, 'num_snps': 45718, 'iw_method': 'uniform', 'iw_clip_max': 5.0}. Best is trial 4 with value: 0.17767111777620131.
[I 2026-04-23 16:05:09,092] Trial 9 finished with value: 0.16678974308977065 and parameters: {'alpha': 6685.17962248224, 'use_snp_selection': False, 'iw_method': 'pc_logistic', 'iw_clip_max': 25.0, 'iw_n_components': 10, 'iw_logistic_c': 60.72281367077526, 'iw_pca_fit': 'combined', 'iw_solver': 'lbfgs'}. Best is trial 4 with value: 0.17767111777620131.
[I 2026-04-23 16:05:53,766] Trial 10 finished with value: 0.17232951698274948 and parameters: {'alpha': 860571.7420672657, 'use_snp_selection': False, 'iw_method': 'uniform', 'iw_clip_max': 5.0}. Best is trial 4 with value: 0.17767111777620131.
[I 2026-04-23 16:07:39,739] Trial 11 finished with value: 0.18035200381245253 and parameters: {'alpha': 146725.17844355197, 'use_snp_selection': True, 'num_snps': 30178, 'iw_method': 'uniform', 'iw_clip_max': None}. Best is trial 11 with value: 0.18035200381245253.
[I 2026-04-23 16:09:36,955] Trial 12 finished with value: 0.17220524094433795 and parameters: {'alpha': 591768.0844457166, 'use_snp_selection': True, 'num_snps': 38552, 'iw_method': 'uniform', 'iw_clip_max': 25.0}. Best is trial 11 with value: 0.18035200381245253.
[I 2026-04-23 16:10:22,834] Trial 13 finished with value: 0.16530654414226706 and parameters: {'alpha': 30448.10954542319, 'use_snp_selection': False, 'iw_method': 'uniform', 'iw_clip_max': None}. Best is trial 11 with value: 0.18035200381245253.
[I 2026-04-23 16:11:53,612] Trial 14 finished with value: 0.16175465537750858 and parameters: {'alpha': 6266755.363843986, 'use_snp_selection': True, 'num_snps': 18192, 'iw_method': 'uniform', 'iw_clip_max': None}. Best is trial 11 with value: 0.18035200381245253.
[I 2026-04-23 16:12:39,517] Trial 15 finished with value: 0.17774000490252703 and parameters: {'alpha': 296185.78334472293, 'use_snp_selection': False, 'iw_method': 'uniform', 'iw_clip_max': 25.0}. Best is trial 11 with value: 0.18035200381245253.
[I 2026-04-23 16:13:25,544] Trial 16 finished with value: 0.16250859101038123 and parameters: {'alpha': 24188.852120578795, 'use_snp_selection': False, 'iw_method': 'uniform', 'iw_clip_max': 10.0}. Best is trial 11 with value: 0.18035200381245253.
[I 2026-04-23 16:15:13,330] Trial 17 finished with value: 0.16251668986086973 and parameters: {'alpha': 1927502.6144482074, 'use_snp_selection': True, 'num_snps': 32006, 'iw_method': 'uniform', 'iw_clip_max': 5.0}. Best is trial 11 with value: 0.18035200381245253.
[I 2026-04-23 16:15:59,392] Trial 18 finished with value: 0.1781372185899097 and parameters: {'alpha': 214446.61631478707, 'use_snp_selection': False, 'iw_method': 'uniform', 'iw_clip_max': 25.0}. Best is trial 11 with value: 0.18035200381245253.
[I 2026-04-23 16:17:12,114] Trial 19 finished with value: 0.15102486383330577 and parameters: {'alpha': 13509.234336709696, 'use_snp_selection': True, 'num_snps': 6485, 'iw_method': 'uniform', 'iw_clip_max': None}. Best is trial 11 with value: 0.18035200381245253.
[I 2026-04-23 16:19:34,917] Trial 20 finished with value: 0.1773249599178873 and parameters: {'alpha': 208512.15643117408, 'use_snp_selection': True, 'num_snps': 58808, 'iw_method': 'uniform', 'iw_clip_max': 25.0}. Best is trial 11 with value: 0.18035200381245253.
[I 2026-04-23 16:20:19,501] Trial 21 finished with value: 0.17783787181672533 and parameters: {'alpha': 283340.2450351258, 'use_snp_selection': False, 'iw_method': 'uniform', 'iw_clip_max': 25.0}. Best is trial 11 with value: 0.18035200381245253.
[I 2026-04-23 16:21:03,555] Trial 22 finished with value: 0.17230868361323898 and parameters: {'alpha': 59619.61381708252, 'use_snp_selection': False, 'iw_method': 'uniform', 'iw_clip_max': 25.0}. Best is trial 11 with value: 0.18035200381245253.
[I 2026-04-23 16:21:47,563] Trial 23 finished with value: 0.1665145373644978 and parameters: {'alpha': 2042379.7506001429, 'use_snp_selection': False, 'iw_method': 'uniform', 'iw_clip_max': 25.0}. Best is trial 11 with value: 0.18035200381245253.
[I 2026-04-23 16:22:31,574] Trial 24 finished with value: 0.17801194936577475 and parameters: {'alpha': 176902.67545939796, 'use_snp_selection': False, 'iw_method': 'uniform', 'iw_clip_max': 25.0}. Best is trial 11 with value: 0.18035200381245253.
[I 2026-04-23 16:23:15,262] Trial 25 finished with value: 0.172735153876883 and parameters: {'alpha': 62642.54661377067, 'use_snp_selection': False, 'iw_method': 'uniform', 'iw_clip_max': None}. Best is trial 11 with value: 0.18035200381245253.
[I 2026-04-23 16:23:58,586] Trial 26 finished with value: 0.1770956502534292 and parameters: {'alpha': 125297.03358757753, 'use_snp_selection': False, 'iw_method': 'uniform', 'iw_clip_max': 5.0}. Best is trial 11 with value: 0.18035200381245253.
[I 2026-04-23 16:24:41,655] Trial 27 finished with value: 0.14964594377902996 and parameters: {'alpha': 8864.312071359007, 'use_snp_selection': False, 'iw_method': 'uniform', 'iw_clip_max': 10.0}. Best is trial 11 with value: 0.18035200381245253.
[I 2026-04-23 16:26:07,842] Trial 28 finished with value: 0.1717146434096167 and parameters: {'alpha': 541512.6679377035, 'use_snp_selection': True, 'num_snps': 19148, 'iw_method': 'uniform', 'iw_clip_max': 25.0}. Best is trial 11 with value: 0.18035200381245253.
[I 2026-04-23 16:31:06,633] Trial 29 finished with value: 0.16581707069660273 and parameters: {'alpha': 60601.795122579664, 'use_snp_selection': True, 'num_snps': 40783, 'iw_method': 'pc_logistic', 'iw_clip_max': 10.0, 'iw_n_components': 20, 'iw_logistic_c': 0.016428740381042656, 'iw_pca_fit': 'combined', 'iw_solver': 'lbfgs'}. Best is trial 11 with value: 0.18035200381245253.
[I 2026-04-23 16:31:50,207] Trial 30 finished with value: 0.17782543249258292 and parameters: {'alpha': 159177.41874604058, 'use_snp_selection': False, 'iw_method': 'uniform', 'iw_clip_max': None}. Best is trial 11 with value: 0.18035200381245253.
[I 2026-04-23 16:32:33,434] Trial 31 finished with value: 0.17687836596136897 and parameters: {'alpha': 387355.51639366825, 'use_snp_selection': False, 'iw_method': 'uniform', 'iw_clip_max': 25.0}. Best is trial 11 with value: 0.18035200381245253.
[I 2026-04-23 16:33:17,147] Trial 32 finished with value: 0.1685411883784819 and parameters: {'alpha': 1494090.5855480907, 'use_snp_selection': False, 'iw_method': 'uniform', 'iw_clip_max': 25.0}. Best is trial 11 with value: 0.18035200381245253.
[I 2026-04-23 16:34:01,198] Trial 33 finished with value: 0.17465638767565753 and parameters: {'alpha': 80292.96630133345, 'use_snp_selection': False, 'iw_method': 'uniform', 'iw_clip_max': 25.0}. Best is trial 11 with value: 0.18035200381245253.
[I 2026-04-23 16:38:45,344] Trial 34 finished with value: 0.15732523588756608 and parameters: {'alpha': 192424.89944909967, 'use_snp_selection': False, 'iw_method': 'pc_logistic', 'iw_clip_max': 25.0, 'iw_n_components': 50, 'iw_logistic_c': 0.14611172002235645, 'iw_pca_fit': 'combined', 'iw_solver': 'lbfgs'}. Best is trial 11 with value: 0.18035200381245253.
[I 2026-04-23 16:39:29,802] Trial 35 finished with value: 0.1725110830522548 and parameters: {'alpha': 837785.0063951112, 'use_snp_selection': False, 'iw_method': 'uniform', 'iw_clip_max': 25.0}. Best is trial 11 with value: 0.18035200381245253.
[I 2026-04-23 16:41:13,161] Trial 36 finished with value: 0.1790249486921998 and parameters: {'alpha': 245085.91664505645, 'use_snp_selection': True, 'num_snps': 26110, 'iw_method': 'uniform', 'iw_clip_max': 25.0}. Best is trial 11 with value: 0.18035200381245253.
[I 2026-04-23 16:44:59,368] Trial 37 finished with value: 0.16651360669166598 and parameters: {'alpha': 41784.26912453835, 'use_snp_selection': True, 'num_snps': 25432, 'iw_method': 'pc_logistic', 'iw_clip_max': 10.0, 'iw_n_components': 20, 'iw_logistic_c': 3.3219294294129758, 'iw_pca_fit': 'source', 'iw_solver': 'lbfgs'}. Best is trial 11 with value: 0.18035200381245253.
[I 2026-04-23 16:46:23,999] Trial 38 finished with value: 0.1861186078119159 and parameters: {'alpha': 120969.13397447931, 'use_snp_selection': True, 'num_snps': 13365, 'iw_method': 'uniform', 'iw_clip_max': None}. Best is trial 38 with value: 0.1861186078119159.
[I 2026-04-23 16:47:47,215] Trial 39 finished with value: 0.1826114268599682 and parameters: {'alpha': 104936.9976475515, 'use_snp_selection': True, 'num_snps': 11516, 'iw_method': 'uniform', 'iw_clip_max': None}. Best is trial 38 with value: 0.1861186078119159.
[I 2026-04-23 16:50:37,322] Trial 40 finished with value: 0.17094835862712646 and parameters: {'alpha': 103655.98313232149, 'use_snp_selection': True, 'num_snps': 13279, 'iw_method': 'pc_logistic', 'iw_clip_max': None, 'iw_n_components': 5, 'iw_logistic_c': 0.1544978537654509, 'iw_pca_fit': 'combined', 'iw_solver': 'lbfgs'}. Best is trial 38 with value: 0.1861186078119159.
[I 2026-04-23 16:51:53,856] Trial 41 finished with value: 0.1833701168654546 and parameters: {'alpha': 110958.8468400317, 'use_snp_selection': True, 'num_snps': 12572, 'iw_method': 'uniform', 'iw_clip_max': None}. Best is trial 38 with value: 0.1861186078119159.
[I 2026-04-23 16:53:15,357] Trial 42 finished with value: 0.17856474868948913 and parameters: {'alpha': 21757.776958016075, 'use_snp_selection': True, 'num_snps': 12257, 'iw_method': 'uniform', 'iw_clip_max': None}. Best is trial 38 with value: 0.1861186078119159.
[I 2026-04-23 16:54:36,881] Trial 43 finished with value: 0.18406141451707458 and parameters: {'alpha': 83641.8116890436, 'use_snp_selection': True, 'num_snps': 12419, 'iw_method': 'uniform', 'iw_clip_max': None}. Best is trial 38 with value: 0.1861186078119159.
[I 2026-04-23 16:56:01,570] Trial 44 finished with value: 0.18628682084414697 and parameters: {'alpha': 41568.317169830334, 'use_snp_selection': True, 'num_snps': 13030, 'iw_method': 'uniform', 'iw_clip_max': None}. Best is trial 44 with value: 0.18628682084414697.
[I 2026-04-23 16:57:21,556] Trial 45 finished with value: 0.1830201109972327 and parameters: {'alpha': 40775.46445849121, 'use_snp_selection': True, 'num_snps': 12225, 'iw_method': 'uniform', 'iw_clip_max': None}. Best is trial 44 with value: 0.18628682084414697.
[I 2026-04-23 16:58:40,564] Trial 46 finished with value: 0.17275089193690035 and parameters: {'alpha': 15293.07476521967, 'use_snp_selection': True, 'num_snps': 14070, 'iw_method': 'uniform', 'iw_clip_max': None}. Best is trial 44 with value: 0.18628682084414697.
[I 2026-04-23 16:59:53,426] Trial 47 finished with value: 0.143052146901825 and parameters: {'alpha': 4019.8058700456922, 'use_snp_selection': True, 'num_snps': 9846, 'iw_method': 'uniform', 'iw_clip_max': None}. Best is trial 44 with value: 0.18628682084414697.
[I 2026-04-23 17:02:43,870] Trial 48 finished with value: 0.16012206049866057 and parameters: {'alpha': 39487.47724590964, 'use_snp_selection': True, 'num_snps': 17225, 'iw_method': 'pc_logistic', 'iw_clip_max': None, 'iw_n_components': 20, 'iw_logistic_c': 10.802917020221672, 'iw_pca_fit': 'source', 'iw_solver': 'lbfgs'}. Best is trial 44 with value: 0.18628682084414697.
[I 2026-04-23 17:03:57,606] Trial 49 finished with value: 0.1752107180272253 and parameters: {'alpha': 47159.617040400495, 'use_snp_selection': True, 'num_snps': 8548, 'iw_method': 'uniform', 'iw_clip_max': None}. Best is trial 44 with value: 0.18628682084414697.
