[I 2026-04-22 15:41:57,091] Trial 67 finished with value: 0.18312028461081908 and parameters: {'alpha': 45823.05052395167, 'use_snp_selection': True, 'num_snps': 41406, 'weight_scheme': 'exponential', 'weight_clip_max': 5.0, 'weight_exponential_beta': 1.7660109422555552}. Best is trial 23 with value: 0.19847080807542586.
[I 2026-04-22 15:43:38,504] Trial 68 finished with value: 0.19890069827621104 and parameters: {'alpha': 342129.51339882147, 'use_snp_selection': True, 'num_snps': 34891, 'weight_scheme': 'exponential', 'weight_clip_max': 5.0, 'weight_exponential_beta': 2.927789934582604}. Best is trial 68 with value: 0.19890069827621104.
[I 2026-04-22 15:45:21,132] Trial 69 finished with value: 0.19205476759315862 and parameters: {'alpha': 91163.00065173864, 'use_snp_selection': True, 'num_snps': 35771, 'weight_scheme': 'exponential', 'weight_clip_max': 5.0, 'weight_exponential_beta': 3.0587980371697543}. Best is trial 68 with value: 0.19890069827621104.
[I 2026-04-22 15:46:14,320] Trial 70 finished with value: 0.1612065616223062 and parameters: {'alpha': 22073.942304811328, 'use_snp_selection': False, 'weight_scheme': 'exponential', 'weight_clip_max': 10.0, 'weight_exponential_beta': 1.2045960564278255}. Best is trial 68 with value: 0.19890069827621104.
[I 2026-04-22 15:48:09,013] Trial 71 finished with value: 0.19547850852326148 and parameters: {'alpha': 357578.1863943387, 'use_snp_selection': True, 'num_snps': 43826, 'weight_scheme': 'exponential', 'weight_clip_max': 5.0, 'weight_exponential_beta': 2.238271286164949}. Best is trial 68 with value: 0.19890069827621104.
[I 2026-04-22 15:49:56,476] Trial 72 finished with value: 0.19852895526830033 and parameters: {'alpha': 299376.3283168693, 'use_snp_selection': True, 'num_snps': 38917, 'weight_scheme': 'exponential', 'weight_clip_max': 5.0, 'weight_exponential_beta': 2.2198110111325495}. Best is trial 68 with value: 0.19890069827621104.
[I 2026-04-22 15:51:45,107] Trial 73 finished with value: 0.19825301671187914 and parameters: {'alpha': 336792.8693500326, 'use_snp_selection': True, 'num_snps': 40145, 'weight_scheme': 'exponential', 'weight_clip_max': 5.0, 'weight_exponential_beta': 2.2109190612548257}. Best is trial 68 with value: 0.19890069827621104.
[I 2026-04-22 15:53:32,995] Trial 74 finished with value: 0.19499361378862934 and parameters: {'alpha': 184802.55469721556, 'use_snp_selection': True, 'num_snps': 39690, 'weight_scheme': 'exponential', 'weight_clip_max': 5.0, 'weight_exponential_beta': 2.4634302696714103}. Best is trial 68 with value: 0.19890069827621104.
[I 2026-04-22 15:55:14,690] Trial 75 finished with value: 0.14736409666253775 and parameters: {'alpha': 83.54147302822275, 'use_snp_selection': True, 'num_snps': 35065, 'weight_scheme': 'exponential', 'weight_clip_max': 5.0, 'weight_exponential_beta': 3.0934278934166617}. Best is trial 68 with value: 0.19890069827621104.
[I 2026-04-22 15:56:47,616] Trial 76 finished with value: 0.19581844017839825 and parameters: {'alpha': 72408.28264348737, 'use_snp_selection': True, 'num_snps': 28757, 'weight_scheme': 'exponential', 'weight_clip_max': 5.0, 'weight_exponential_beta': 1.8398614957057773}. Best is trial 68 with value: 0.19890069827621104.
[I 2026-04-22 15:58:20,150] Trial 77 finished with value: 0.1959131846728181 and parameters: {'alpha': 79026.74704242827, 'use_snp_selection': True, 'num_snps': 28361, 'weight_scheme': 'exponential', 'weight_clip_max': 5.0, 'weight_exponential_beta': 2.0916912036483573}. Best is trial 68 with value: 0.19890069827621104.
[I 2026-04-22 15:59:55,305] Trial 78 finished with value: 0.1739820968387485 and parameters: {'alpha': 8388.647482948778, 'use_snp_selection': True, 'num_snps': 28241, 'weight_scheme': 'exponential', 'weight_clip_max': 5.0, 'weight_exponential_beta': 3.405863499383395}. Best is trial 68 with value: 0.19890069827621104.
[I 2026-04-22 16:01:25,429] Trial 79 finished with value: 0.19276228844354154 and parameters: {'alpha': 80627.31049721404, 'use_snp_selection': True, 'num_snps': 24447, 'weight_scheme': 'exponential', 'weight_clip_max': 10.0, 'weight_exponential_beta': 2.3179028526654695}. Best is trial 68 with value: 0.19890069827621104.
[I 2026-04-22 16:02:50,789] Trial 80 finished with value: 0.17804815707211075 and parameters: {'alpha': 20640.003016366118, 'use_snp_selection': True, 'num_snps': 21514, 'weight_scheme': 'exponential', 'weight_clip_max': 5.0, 'weight_exponential_beta': 1.0942797383027019}. Best is trial 68 with value: 0.19890069827621104.
[I 2026-04-22 16:04:28,882] Trial 81 finished with value: 0.1888674851930439 and parameters: {'alpha': 39352.45486984478, 'use_snp_selection': True, 'num_snps': 31000, 'weight_scheme': 'exponential', 'weight_clip_max': 5.0, 'weight_exponential_beta': 1.8030871878595445}. Best is trial 68 with value: 0.19890069827621104.
[I 2026-04-22 16:05:59,796] Trial 82 finished with value: 0.1968484302969632 and parameters: {'alpha': 141822.4050055807, 'use_snp_selection': True, 'num_snps': 26134, 'weight_scheme': 'exponential', 'weight_clip_max': 5.0, 'weight_exponential_beta': 2.306737142263545}. Best is trial 68 with value: 0.19890069827621104.
[I 2026-04-22 16:07:30,276] Trial 83 finished with value: 0.19508012889643092 and parameters: {'alpha': 118031.35118863086, 'use_snp_selection': True, 'num_snps': 26104, 'weight_scheme': 'exponential', 'weight_clip_max': 5.0, 'weight_exponential_beta': 2.656800517131392}. Best is trial 68 with value: 0.19890069827621104.
[I 2026-04-22 16:09:03,295] Trial 84 finished with value: 0.19300250976035105 and parameters: {'alpha': 56787.640141272976, 'use_snp_selection': True, 'num_snps': 28760, 'weight_scheme': 'exponential', 'weight_clip_max': 5.0, 'weight_exponential_beta': 2.18683538527155}. Best is trial 68 with value: 0.19890069827621104.
[I 2026-04-22 16:10:43,270] Trial 85 finished with value: 0.19565682082800606 and parameters: {'alpha': 154953.10002831186, 'use_snp_selection': True, 'num_snps': 33838, 'weight_scheme': 'exponential', 'weight_clip_max': 5.0, 'weight_exponential_beta': 2.8100172203296685}. Best is trial 68 with value: 0.19890069827621104.
[I 2026-04-22 16:12:18,138] Trial 86 finished with value: 0.20108404384196793 and parameters: {'alpha': 340032.90737047937, 'use_snp_selection': True, 'num_snps': 30095, 'weight_scheme': 'exponential', 'weight_clip_max': 5.0, 'weight_exponential_beta': 2.0982353836719163}. Best is trial 86 with value: 0.20108404384196793.
[I 2026-04-22 16:13:41,757] Trial 87 finished with value: 0.18709712806693415 and parameters: {'alpha': 322006.88546245196, 'use_snp_selection': True, 'num_snps': 21989, 'weight_scheme': 'top-heavy', 'weight_clip_max': 5.0, 'weight_topheavy_top_frac': 0.2674334238452186, 'weight_topheavy_low': 0.7678610724154135, 'weight_topheavy_high': 3.6750606215808364}. Best is trial 86 with value: 0.20108404384196793.
[I 2026-04-22 16:15:27,670] Trial 88 finished with value: 0.19464081571059424 and parameters: {'alpha': 327638.9097243873, 'use_snp_selection': True, 'num_snps': 37877, 'weight_scheme': 'exponential', 'weight_clip_max': None, 'weight_exponential_beta': 3.4714450201441798}. Best is trial 86 with value: 0.20108404384196793.
[I 2026-04-22 16:16:21,411] Trial 89 finished with value: 0.18096685635116697 and parameters: {'alpha': 104444.27945712487, 'use_snp_selection': False, 'weight_scheme': 'exponential', 'weight_clip_max': 5.0, 'weight_exponential_beta': 2.369689457972491}. Best is trial 86 with value: 0.20108404384196793.
[I 2026-04-22 16:17:40,193] Trial 90 finished with value: 0.18229501680378915 and parameters: {'alpha': 1162313.4728974483, 'use_snp_selection': True, 'num_snps': 17861, 'weight_scheme': 'exponential', 'weight_clip_max': 10.0, 'weight_exponential_beta': 1.0355086466893806}. Best is trial 86 with value: 0.20108404384196793.
[I 2026-04-22 16:19:19,548] Trial 91 finished with value: 0.19277180601753105 and parameters: {'alpha': 67862.72022748565, 'use_snp_selection': True, 'num_snps': 32566, 'weight_scheme': 'exponential', 'weight_clip_max': 5.0, 'weight_exponential_beta': 2.050719585708269}. Best is trial 86 with value: 0.20108404384196793.
[I 2026-04-22 16:20:54,472] Trial 92 finished with value: 0.19813844263634678 and parameters: {'alpha': 156835.71464924378, 'use_snp_selection': True, 'num_snps': 29748, 'weight_scheme': 'exponential', 'weight_clip_max': 5.0, 'weight_exponential_beta': 2.578399620534422}. Best is trial 86 with value: 0.20108404384196793.
[I 2026-04-22 16:22:29,446] Trial 93 finished with value: 0.1976649906347746 and parameters: {'alpha': 148518.16739964756, 'use_snp_selection': True, 'num_snps': 30164, 'weight_scheme': 'exponential', 'weight_clip_max': 5.0, 'weight_exponential_beta': 2.6826156544761677}. Best is trial 86 with value: 0.20108404384196793.
[I 2026-04-22 16:24:05,646] Trial 94 finished with value: 0.19572937878355762 and parameters: {'alpha': 165024.79091249206, 'use_snp_selection': True, 'num_snps': 31049, 'weight_scheme': 'exponential', 'weight_clip_max': 5.0, 'weight_exponential_beta': 3.1658219895436654}. Best is trial 86 with value: 0.20108404384196793.
[I 2026-04-22 16:25:33,998] Trial 95 finished with value: 0.19745031928195125 and parameters: {'alpha': 404146.6545404775, 'use_snp_selection': True, 'num_snps': 25728, 'weight_scheme': 'exponential', 'weight_clip_max': 5.0, 'weight_exponential_beta': 3.735033761469502}. Best is trial 86 with value: 0.20108404384196793.
[I 2026-04-22 16:27:04,295] Trial 96 finished with value: 0.1974693312536191 and parameters: {'alpha': 414585.754255749, 'use_snp_selection': True, 'num_snps': 26936, 'weight_scheme': 'exponential', 'weight_clip_max': 5.0, 'weight_exponential_beta': 3.8829218297955306}. Best is trial 86 with value: 0.20108404384196793.
[I 2026-04-22 16:28:38,726] Trial 97 finished with value: 0.19893541255042335 and parameters: {'alpha': 368105.0289912724, 'use_snp_selection': True, 'num_snps': 30110, 'weight_scheme': 'exponential', 'weight_clip_max': 5.0, 'weight_exponential_beta': 3.8795637337706963}. Best is trial 86 with value: 0.20108404384196793.
[I 2026-04-22 16:30:13,280] Trial 98 finished with value: 0.1987398903697858 and parameters: {'alpha': 504757.49340866023, 'use_snp_selection': True, 'num_snps': 30070, 'weight_scheme': 'exponential', 'weight_clip_max': 5.0, 'weight_exponential_beta': 3.8267621600052095}. Best is trial 86 with value: 0.20108404384196793.
[I 2026-04-22 16:31:48,251] Trial 99 finished with value: 0.1987288733133392 and parameters: {'alpha': 610373.8886927654, 'use_snp_selection': True, 'num_snps': 30231, 'weight_scheme': 'exponential', 'weight_clip_max': 5.0, 'weight_exponential_beta': 4.76144675671707}. Best is trial 86 with value: 0.20108404384196793.
