[I 2026-05-05 22:26:21,561] Trial 2 finished with value: 0.1990605451673363 and parameters: {'hidden_dims': '[256, 128]', 'dropout': 0.10920465462713655, 'batch_norm': False, 'lr': 9.251006337777395e-06, 'weight_decay': 0.0002739600801554822, 'epochs': 70, 'loss': 'mse', 'optimizer': 'adamw', 'use_snp_selection': False}. Best is trial 2 with value: 0.1990605451673363.
[I 2026-05-05 22:27:07,458] Trial 3 finished with value: 0.17116585038596033 and parameters: {'hidden_dims': '[512, 64]', 'dropout': 0.21097588325962954, 'batch_norm': False, 'lr': 0.00013945529197043052, 'weight_decay': 6.125997514421991e-07, 'epochs': 62, 'loss': 'mae', 'optimizer': 'adamw', 'use_snp_selection': False}. Best is trial 2 with value: 0.1990605451673363.
[I 2026-05-05 22:28:21,293] Trial 4 finished with value: 0.1973121705411786 and parameters: {'hidden_dims': '[512, 64]', 'dropout': 0.07948656777033702, 'batch_norm': False, 'lr': 4.227110266060512e-06, 'weight_decay': 0.0009515677674579354, 'epochs': 111, 'loss': 'mae', 'optimizer': 'adamw', 'use_snp_selection': False}. Best is trial 2 with value: 0.1990605451673363.
[I 2026-05-05 22:30:01,565] Trial 5 finished with value: 0.19064329426677742 and parameters: {'hidden_dims': '[512, 64]', 'dropout': 0.07220834610702047, 'batch_norm': False, 'lr': 2.8779057444450007e-06, 'weight_decay': 1.7819387991359787e-06, 'epochs': 157, 'loss': 'mse', 'optimizer': 'adam', 'use_snp_selection': False}. Best is trial 2 with value: 0.1990605451673363.
[I 2026-05-05 22:31:06,602] Trial 6 finished with value: 0.18735260366671214 and parameters: {'hidden_dims': '[256, 128]', 'dropout': 0.2505465890537582, 'batch_norm': False, 'lr': 2.5144473235736295e-05, 'weight_decay': 2.6022323891275268e-08, 'epochs': 193, 'loss': 'mse', 'optimizer': 'adam', 'use_snp_selection': False}. Best is trial 2 with value: 0.1990605451673363.
[I 2026-05-05 22:34:07,877] Trial 7 finished with value: 0.1790009727641564 and parameters: {'hidden_dims': '[512, 128]', 'dropout': 0.26053077688769005, 'batch_norm': False, 'lr': 4.4060479596036606e-05, 'weight_decay': 0.0004731892192938172, 'epochs': 299, 'loss': 'mse', 'optimizer': 'adamw', 'use_snp_selection': False}. Best is trial 2 with value: 0.1990605451673363.
[I 2026-05-05 22:35:31,276] Trial 8 finished with value: 0.18409618605904535 and parameters: {'hidden_dims': '[256, 64]', 'dropout': 0.14217118023780909, 'batch_norm': False, 'lr': 1.5072012341348237e-05, 'weight_decay': 2.5901569052680897e-08, 'epochs': 256, 'loss': 'mse', 'optimizer': 'adamw', 'use_snp_selection': False}. Best is trial 2 with value: 0.1990605451673363.
[I 2026-05-05 22:36:42,108] Trial 9 finished with value: 0.19015881576974708 and parameters: {'hidden_dims': '[256, 64]', 'dropout': 0.18128694708490736, 'batch_norm': False, 'lr': 2.644789330745559e-05, 'weight_decay': 5.030108342609318e-05, 'epochs': 213, 'loss': 'mae', 'optimizer': 'adam', 'use_snp_selection': False}. Best is trial 2 with value: 0.1990605451673363.
[I 2026-05-05 22:37:09,231] Trial 10 pruned. 
[I 2026-05-05 22:38:22,902] Trial 11 finished with value: 0.16694563890834294 and parameters: {'hidden_dims': '[512, 64]', 'dropout': 0.003807762971456685, 'batch_norm': False, 'lr': 4.433124584651579e-06, 'weight_decay': 0.0005486058615380661, 'epochs': 111, 'loss': 'mae', 'optimizer': 'adamw', 'use_snp_selection': False}. Best is trial 2 with value: 0.1990605451673363.
[I 2026-05-05 22:38:44,865] Trial 12 pruned. 
[I 2026-05-05 22:40:21,350] Trial 13 finished with value: 0.18389970179596155 and parameters: {'hidden_dims': '[512, 64]', 'dropout': 0.00882576656860476, 'batch_norm': False, 'lr': 6.899154196061949e-06, 'weight_decay': 0.0001592260894871643, 'epochs': 151, 'loss': 'mae', 'optimizer': 'adamw', 'use_snp_selection': False}. Best is trial 2 with value: 0.1990605451673363.
[I 2026-05-05 22:41:24,179] Trial 14 finished with value: 0.20120866037963667 and parameters: {'hidden_dims': '[512, 64]', 'dropout': 0.10381770500161591, 'batch_norm': False, 'lr': 8.50259780678282e-05, 'weight_decay': 9.921055162546952e-06, 'epochs': 92, 'loss': 'mse', 'optimizer': 'adamw', 'use_snp_selection': False}. Best is trial 14 with value: 0.20120866037963667.
[I 2026-05-05 22:41:53,954] Trial 15 finished with value: 0.18008428450220706 and parameters: {'hidden_dims': '[256, 128]', 'dropout': 0.1179182262267227, 'batch_norm': False, 'lr': 8.061651781332312e-05, 'weight_decay': 9.798384819276467e-06, 'epochs': 72, 'loss': 'mse', 'optimizer': 'adamw', 'use_snp_selection': False}. Best is trial 14 with value: 0.20120866037963667.
[I 2026-05-05 22:42:52,900] Trial 16 finished with value: 0.18715971274203252 and parameters: {'hidden_dims': '[512, 128]', 'dropout': 0.34237120727848197, 'batch_norm': False, 'lr': 7.11401698802151e-05, 'weight_decay': 2.2426502366345458e-07, 'epochs': 85, 'loss': 'mse', 'optimizer': 'adamw', 'use_snp_selection': False}. Best is trial 14 with value: 0.20120866037963667.
[I 2026-05-05 22:43:39,416] Trial 17 finished with value: 0.18374395184748735 and parameters: {'hidden_dims': '[256, 64]', 'dropout': 0.4644328537152216, 'batch_norm': False, 'lr': 0.00035040679976642696, 'weight_decay': 1.2500880706480956e-05, 'epochs': 130, 'loss': 'mse', 'optimizer': 'adamw', 'use_snp_selection': False}. Best is trial 14 with value: 0.20120866037963667.
[I 2026-05-05 22:44:03,121] Trial 18 finished with value: 0.17739112761537248 and parameters: {'hidden_dims': '[256, 128]', 'dropout': 0.07073822470628455, 'batch_norm': False, 'lr': 0.00019742202871530007, 'weight_decay': 2.2133632375936766e-07, 'epochs': 51, 'loss': 'mse', 'optimizer': 'adam', 'use_snp_selection': False}. Best is trial 14 with value: 0.20120866037963667.
[I 2026-05-05 22:45:52,858] Trial 19 finished with value: 0.19087926661398838 and parameters: {'hidden_dims': '[512, 64]', 'dropout': 0.27392109651640417, 'batch_norm': False, 'lr': 1.0246362356529771e-05, 'weight_decay': 0.00015344550807253483, 'epochs': 174, 'loss': 'mse', 'optimizer': 'adamw', 'use_snp_selection': False}. Best is trial 14 with value: 0.20120866037963667.
[I 2026-05-05 22:46:27,571] Trial 20 finished with value: 0.1951588683738563 and parameters: {'hidden_dims': '[256, 128]', 'dropout': 0.13024519240359123, 'batch_norm': False, 'lr': 4.595806997550895e-05, 'weight_decay': 1.4204047171298654e-05, 'epochs': 89, 'loss': 'mse', 'optimizer': 'adamw', 'use_snp_selection': False}. Best is trial 14 with value: 0.20120866037963667.
[I 2026-05-05 22:47:41,867] Trial 21 finished with value: 0.19205113204996854 and parameters: {'hidden_dims': '[512, 64]', 'dropout': 0.08834653458237512, 'batch_norm': False, 'lr': 6.074793235412962e-06, 'weight_decay': 0.00020038888898094647, 'epochs': 112, 'loss': 'mae', 'optimizer': 'adamw', 'use_snp_selection': False}. Best is trial 14 with value: 0.20120866037963667.
[I 2026-05-05 22:49:04,656] Trial 22 finished with value: 0.1918402972582946 and parameters: {'hidden_dims': '[512, 64]', 'dropout': 0.04362837735501778, 'batch_norm': False, 'lr': 2.640125441220337e-06, 'weight_decay': 0.0009737273902519814, 'epochs': 127, 'loss': 'mae', 'optimizer': 'adamw', 'use_snp_selection': False}. Best is trial 14 with value: 0.20120866037963667.
[I 2026-05-05 22:50:11,506] Trial 23 finished with value: 0.19142855736358932 and parameters: {'hidden_dims': '[512, 64]', 'dropout': 0.14912257586140398, 'batch_norm': False, 'lr': 1.82993401379295e-05, 'weight_decay': 0.00014152601855691577, 'epochs': 99, 'loss': 'mae', 'optimizer': 'adamw', 'use_snp_selection': False}. Best is trial 14 with value: 0.20120866037963667.
[I 2026-05-05 22:51:05,778] Trial 24 finished with value: 0.19772711190660036 and parameters: {'hidden_dims': '[512, 64]', 'dropout': 0.2165779516435365, 'batch_norm': False, 'lr': 9.546055013512439e-06, 'weight_decay': 0.00031007584918727604, 'epochs': 77, 'loss': 'mse', 'optimizer': 'adamw', 'use_snp_selection': False}. Best is trial 14 with value: 0.20120866037963667.
[I 2026-05-05 22:52:02,902] Trial 25 finished with value: 0.18658732242456996 and parameters: {'hidden_dims': '[512, 64]', 'dropout': 0.2132995279993888, 'batch_norm': False, 'lr': 1.0264972828389297e-05, 'weight_decay': 3.0186826765521705e-05, 'epochs': 82, 'loss': 'mse', 'optimizer': 'adamw', 'use_snp_selection': False}. Best is trial 14 with value: 0.20120866037963667.
[I 2026-05-05 22:52:42,551] Trial 26 finished with value: 0.16424059648755956 and parameters: {'hidden_dims': '[512, 128]', 'dropout': 0.31530640329544235, 'batch_norm': False, 'lr': 0.0001264762781496777, 'weight_decay': 3.743142270521145e-06, 'epochs': 51, 'loss': 'mse', 'optimizer': 'adam', 'use_snp_selection': False}. Best is trial 14 with value: 0.20120866037963667.
[I 2026-05-05 22:53:31,868] Trial 27 finished with value: 0.19052624191472023 and parameters: {'hidden_dims': '[256, 64]', 'dropout': 0.17587875425681, 'batch_norm': False, 'lr': 4.545169625251119e-05, 'weight_decay': 0.00029007076342243347, 'epochs': 139, 'loss': 'mse', 'optimizer': 'adamw', 'use_snp_selection': False}. Best is trial 14 with value: 0.20120866037963667.
[I 2026-05-05 22:54:04,157] Trial 28 pruned. 
[I 2026-05-05 22:54:46,104] Trial 29 finished with value: 0.14393583507826624 and parameters: {'hidden_dims': '[256, 128]', 'dropout': 0.17232742506292006, 'batch_norm': False, 'lr': 0.0007815002245160654, 'weight_decay': 5.167582725592419e-06, 'epochs': 113, 'loss': 'mse', 'optimizer': 'adam', 'use_snp_selection': False}. Best is trial 14 with value: 0.20120866037963667.
[I 2026-05-05 22:55:43,289] Trial 30 finished with value: 0.1951756827383248 and parameters: {'hidden_dims': '[256, 128]', 'dropout': 0.10646602052016244, 'batch_norm': False, 'lr': 0.00041509102998546244, 'weight_decay': 9.104986487685854e-05, 'epochs': 166, 'loss': 'mse', 'optimizer': 'adamw', 'use_snp_selection': False}. Best is trial 14 with value: 0.20120866037963667.
[I 2026-05-05 22:56:53,753] Trial 31 finished with value: 0.19354877576010163 and parameters: {'hidden_dims': '[512, 64]', 'dropout': 0.061099094746940565, 'batch_norm': False, 'lr': 4.947386665988703e-06, 'weight_decay': 0.0003684620038147253, 'epochs': 105, 'loss': 'mse', 'optimizer': 'adamw', 'use_snp_selection': False}. Best is trial 14 with value: 0.20120866037963667.
[I 2026-05-05 22:57:45,945] Trial 32 finished with value: 0.17978173444901582 and parameters: {'hidden_dims': '[512, 64]', 'dropout': 0.1067223469627544, 'batch_norm': False, 'lr': 2.9866775922158466e-06, 'weight_decay': 9.321680025809534e-05, 'epochs': 73, 'loss': 'mae', 'optimizer': 'adamw', 'use_snp_selection': False}. Best is trial 14 with value: 0.20120866037963667.
[I 2026-05-05 22:58:33,575] Trial 33 finished with value: 0.20667793517316788 and parameters: {'hidden_dims': '[512, 64]', 'dropout': 0.03524084934771912, 'batch_norm': False, 'lr': 1.0369216414439117e-05, 'weight_decay': 2.442894674054242e-05, 'epochs': 65, 'loss': 'mse', 'optimizer': 'adamw', 'use_snp_selection': False}. Best is trial 33 with value: 0.20667793517316788.
[I 2026-05-05 22:59:21,811] Trial 34 finished with value: 0.20097427101003834 and parameters: {'hidden_dims': '[512, 64]', 'dropout': 0.04252318761434061, 'batch_norm': False, 'lr': 7.943315016920616e-06, 'weight_decay': 2.0087914533954272e-05, 'epochs': 66, 'loss': 'mse', 'optimizer': 'adamw', 'use_snp_selection': False}. Best is trial 33 with value: 0.20667793517316788.
[I 2026-05-05 23:00:06,431] Trial 35 finished with value: 0.19865227987208192 and parameters: {'hidden_dims': '[512, 64]', 'dropout': 0.02515277142748129, 'batch_norm': False, 'lr': 1.911438081050897e-05, 'weight_decay': 2.5054375627391632e-05, 'epochs': 60, 'loss': 'mse', 'optimizer': 'adamw', 'use_snp_selection': False}. Best is trial 33 with value: 0.20667793517316788.
[I 2026-05-05 23:00:53,858] Trial 36 finished with value: 0.17781539483340833 and parameters: {'hidden_dims': '[512, 64]', 'dropout': 0.5790677458292788, 'batch_norm': False, 'lr': 7.246029106918431e-06, 'weight_decay': 6.116142678354561e-06, 'epochs': 65, 'loss': 'mse', 'optimizer': 'adamw', 'use_snp_selection': False}. Best is trial 33 with value: 0.20667793517316788.
[I 2026-05-05 23:01:29,749] Trial 37 finished with value: 0.19129202875147527 and parameters: {'hidden_dims': '[256, 128]', 'dropout': 0.051264891621869785, 'batch_norm': False, 'lr': 2.9316341212220396e-05, 'weight_decay': 2.1019344759382257e-06, 'epochs': 93, 'loss': 'mse', 'optimizer': 'adam', 'use_snp_selection': False}. Best is trial 33 with value: 0.20667793517316788.
[I 2026-05-05 23:03:33,616] Trial 38 finished with value: 0.18825707318477597 and parameters: {'hidden_dims': '[512, 64]', 'dropout': 0.03417340523225638, 'batch_norm': False, 'lr': 1.3579080377792687e-05, 'weight_decay': 2.108498128831865e-05, 'epochs': 199, 'loss': 'mse', 'optimizer': 'adamw', 'use_snp_selection': False}. Best is trial 33 with value: 0.20667793517316788.
[I 2026-05-05 23:04:54,174] Trial 39 finished with value: 0.20049730896995369 and parameters: {'hidden_dims': '[512, 64]', 'dropout': 0.000611523755885697, 'batch_norm': False, 'lr': 7.996062029593479e-05, 'weight_decay': 7.541070668937272e-05, 'epochs': 122, 'loss': 'mse', 'optimizer': 'adamw', 'use_snp_selection': False}. Best is trial 33 with value: 0.20667793517316788.
[I 2026-05-05 23:05:47,145] Trial 0 finished with value: 0.2163127369867973 and parameters: {'hidden_dims': '[256, 128]', 'dropout': 0.18584155530312246, 'batch_norm': False, 'lr': 0.0007461243578022468, 'weight_decay': 3.677761493113531e-06, 'epochs': 129, 'loss': 'mse', 'optimizer': 'adam', 'use_snp_selection': False}. Best is trial 0 with value: 0.2163127369867973.
[I 2026-05-05 23:07:07,303] Trial 1 finished with value: 0.23928759593700324 and parameters: {'hidden_dims': '[256, 128]', 'dropout': 0.5595345557272271, 'batch_norm': False, 'lr': 1.3265824528578217e-05, 'weight_decay': 5.782219985187962e-05, 'epochs': 241, 'loss': 'mse', 'optimizer': 'adamw', 'use_snp_selection': False}. Best is trial 1 with value: 0.23928759593700324.
[I 2026-05-05 23:07:37,256] Trial 2 finished with value: 0.24049079742824797 and parameters: {'hidden_dims': '[256, 128]', 'dropout': 0.10920465462713655, 'batch_norm': False, 'lr': 9.251006337777395e-06, 'weight_decay': 0.0002739600801554822, 'epochs': 70, 'loss': 'mse', 'optimizer': 'adamw', 'use_snp_selection': False}. Best is trial 2 with value: 0.24049079742824797.
[I 2026-05-05 23:08:24,372] Trial 3 finished with value: 0.22207880309679368 and parameters: {'hidden_dims': '[512, 64]', 'dropout': 0.21097588325962954, 'batch_norm': False, 'lr': 0.00013945529197043052, 'weight_decay': 6.125997514421991e-07, 'epochs': 62, 'loss': 'mae', 'optimizer': 'adamw', 'use_snp_selection': False}. Best is trial 2 with value: 0.24049079742824797.
[I 2026-05-05 23:09:39,109] Trial 4 finished with value: 0.23591637464123974 and parameters: {'hidden_dims': '[512, 64]', 'dropout': 0.07948656777033702, 'batch_norm': False, 'lr': 4.227110266060512e-06, 'weight_decay': 0.0009515677674579354, 'epochs': 111, 'loss': 'mae', 'optimizer': 'adamw', 'use_snp_selection': False}. Best is trial 2 with value: 0.24049079742824797.
[I 2026-05-05 23:11:20,539] Trial 5 finished with value: 0.24164511212271775 and parameters: {'hidden_dims': '[512, 64]', 'dropout': 0.07220834610702047, 'batch_norm': False, 'lr': 2.8779057444450007e-06, 'weight_decay': 1.7819387991359787e-06, 'epochs': 157, 'loss': 'mse', 'optimizer': 'adam', 'use_snp_selection': False}. Best is trial 5 with value: 0.24164511212271775.
[I 2026-05-05 23:12:26,537] Trial 6 finished with value: 0.24048941608436603 and parameters: {'hidden_dims': '[256, 128]', 'dropout': 0.2505465890537582, 'batch_norm': False, 'lr': 2.5144473235736295e-05, 'weight_decay': 2.6022323891275268e-08, 'epochs': 193, 'loss': 'mse', 'optimizer': 'adam', 'use_snp_selection': False}. Best is trial 5 with value: 0.24164511212271775.
[I 2026-05-05 23:15:30,107] Trial 7 finished with value: 0.22945237606312713 and parameters: {'hidden_dims': '[512, 128]', 'dropout': 0.26053077688769005, 'batch_norm': False, 'lr': 4.4060479596036606e-05, 'weight_decay': 0.0004731892192938172, 'epochs': 299, 'loss': 'mse', 'optimizer': 'adamw', 'use_snp_selection': False}. Best is trial 5 with value: 0.24164511212271775.
[I 2026-05-05 23:16:54,490] Trial 8 finished with value: 0.235901815694575 and parameters: {'hidden_dims': '[256, 64]', 'dropout': 0.14217118023780909, 'batch_norm': False, 'lr': 1.5072012341348237e-05, 'weight_decay': 2.5901569052680897e-08, 'epochs': 256, 'loss': 'mse', 'optimizer': 'adamw', 'use_snp_selection': False}. Best is trial 5 with value: 0.24164511212271775.
[I 2026-05-05 23:18:06,245] Trial 9 finished with value: 0.23067965849641384 and parameters: {'hidden_dims': '[256, 64]', 'dropout': 0.18128694708490736, 'batch_norm': False, 'lr': 2.644789330745559e-05, 'weight_decay': 5.030108342609318e-05, 'epochs': 213, 'loss': 'mae', 'optimizer': 'adam', 'use_snp_selection': False}. Best is trial 5 with value: 0.24164511212271775.
[I 2026-05-05 23:19:43,780] Trial 10 finished with value: 0.21142120077897722 and parameters: {'hidden_dims': '[512, 64]', 'dropout': 0.3938620828116577, 'batch_norm': False, 'lr': 1.7297675432102997e-06, 'weight_decay': 7.686263695479997e-07, 'epochs': 150, 'loss': 'mae', 'optimizer': 'adam', 'use_snp_selection': False}. Best is trial 5 with value: 0.24164511212271775.
[I 2026-05-05 23:20:33,426] Trial 11 finished with value: 0.23794059051417094 and parameters: {'hidden_dims': '[512, 128]', 'dropout': 0.003807762971456685, 'batch_norm': False, 'lr': 3.0706404348784916e-06, 'weight_decay': 9.448623939217966e-06, 'epochs': 67, 'loss': 'mse', 'optimizer': 'adam', 'use_snp_selection': False}. Best is trial 5 with value: 0.24164511212271775.
[I 2026-05-05 23:21:11,228] Trial 12 finished with value: 0.16439138313065582 and parameters: {'hidden_dims': '[256, 128]', 'dropout': 0.014603919360456297, 'batch_norm': False, 'lr': 1.016983558209549e-06, 'weight_decay': 3.9347183286287026e-07, 'epochs': 96, 'loss': 'mse', 'optimizer': 'adam', 'use_snp_selection': False}. Best is trial 5 with value: 0.24164511212271775.
[I 2026-05-05 23:22:54,924] Trial 13 finished with value: 0.24228764848094744 and parameters: {'hidden_dims': '[512, 64]', 'dropout': 0.3524222522188903, 'batch_norm': False, 'lr': 5.4719210666897856e-06, 'weight_decay': 3.695308377591839e-05, 'epochs': 161, 'loss': 'mse', 'optimizer': 'adamw', 'use_snp_selection': False}. Best is trial 13 with value: 0.24228764848094744.
[I 2026-05-05 23:24:41,535] Trial 14 finished with value: 0.2451578334621677 and parameters: {'hidden_dims': '[512, 64]', 'dropout': 0.3686697815481095, 'batch_norm': False, 'lr': 4.283786809399494e-06, 'weight_decay': 1.4353410176629029e-05, 'epochs': 166, 'loss': 'mse', 'optimizer': 'adamw', 'use_snp_selection': False}. Best is trial 14 with value: 0.2451578334621677.
[I 2026-05-05 23:26:29,856] Trial 15 finished with value: 0.24139535341868354 and parameters: {'hidden_dims': '[512, 64]', 'dropout': 0.3726939195761462, 'batch_norm': False, 'lr': 6.135332064788386e-06, 'weight_decay': 2.5563308136837127e-05, 'epochs': 169, 'loss': 'mse', 'optimizer': 'adamw', 'use_snp_selection': False}. Best is trial 14 with value: 0.2451578334621677.
[I 2026-05-05 23:28:34,375] Trial 16 finished with value: 0.24247740469034795 and parameters: {'hidden_dims': '[512, 64]', 'dropout': 0.362669272481176, 'batch_norm': False, 'lr': 6.468800656453093e-05, 'weight_decay': 0.00012792289522442087, 'epochs': 197, 'loss': 'mse', 'optimizer': 'adamw', 'use_snp_selection': False}. Best is trial 14 with value: 0.2451578334621677.
[I 2026-05-05 23:30:42,976] Trial 17 finished with value: 0.2387856458555298 and parameters: {'hidden_dims': '[512, 64]', 'dropout': 0.4644328537152216, 'batch_norm': False, 'lr': 8.97160344100306e-05, 'weight_decay': 0.00016588214641830587, 'epochs': 204, 'loss': 'mse', 'optimizer': 'adamw', 'use_snp_selection': False}. Best is trial 14 with value: 0.2451578334621677.
[I 2026-05-05 23:33:09,968] Trial 18 finished with value: 0.24240364530151312 and parameters: {'hidden_dims': '[512, 64]', 'dropout': 0.4722471435935802, 'batch_norm': False, 'lr': 0.00019742202871530007, 'weight_decay': 9.864412457784553e-06, 'epochs': 236, 'loss': 'mae', 'optimizer': 'adamw', 'use_snp_selection': False}. Best is trial 14 with value: 0.2451578334621677.
[I 2026-05-05 23:34:04,479] Trial 19 pruned. 
[I 2026-05-05 23:36:03,933] Trial 20 finished with value: 0.16992389001734745 and parameters: {'hidden_dims': '[512, 128]', 'dropout': 0.4292099699910817, 'batch_norm': False, 'lr': 0.0003409067610812468, 'weight_decay': 9.4021082157015e-05, 'epochs': 188, 'loss': 'mse', 'optimizer': 'adamw', 'use_snp_selection': False}. Best is trial 14 with value: 0.2451578334621677.
[I 2026-05-05 23:38:26,940] Trial 21 finished with value: 0.2404384141232229 and parameters: {'hidden_dims': '[512, 64]', 'dropout': 0.5082818045401867, 'batch_norm': False, 'lr': 0.00015287372715309459, 'weight_decay': 1.0510827622689974e-05, 'epochs': 229, 'loss': 'mae', 'optimizer': 'adamw', 'use_snp_selection': False}. Best is trial 14 with value: 0.2451578334621677.
[I 2026-05-05 23:40:37,675] Trial 22 pruned. 
[I 2026-05-05 23:42:53,760] Trial 23 finished with value: 0.2371595822853331 and parameters: {'hidden_dims': '[512, 64]', 'dropout': 0.5801401587364118, 'batch_norm': False, 'lr': 0.00032472583250120756, 'weight_decay': 2.495594505814588e-06, 'epochs': 217, 'loss': 'mae', 'optimizer': 'adamw', 'use_snp_selection': False}. Best is trial 14 with value: 0.2451578334621677.
[I 2026-05-05 23:44:04,760] Trial 24 pruned. 
[I 2026-05-05 23:46:01,012] Trial 25 finished with value: 0.23534202230983334 and parameters: {'hidden_dims': '[512, 64]', 'dropout': 0.4166674089004462, 'batch_norm': False, 'lr': 8.799112509050014e-05, 'weight_decay': 1.7764593665613073e-05, 'epochs': 183, 'loss': 'mae', 'optimizer': 'adamw', 'use_snp_selection': False}. Best is trial 14 with value: 0.2451578334621677.
