Running from this directory: /cluster/work/simennes/Master_thesis
Name of job: ncv_ridge_iw
ID of job: 24335598
Array task ID: 4
The job was run on these nodes: idun-03-02
[I 2026-04-23 15:40:38,020] Trial 0 finished with value: 0.15660112100584528 and parameters: {'alpha': 113703.38004442609, 'use_snp_selection': True, 'num_snps': 5442, 'iw_method': 'pc_logistic', 'iw_clip_max': 10.0, 'iw_n_components': 5, 'iw_logistic_c': 4.927310296129143, 'iw_pca_fit': 'source', 'iw_solver': 'lbfgs'}. Best is trial 0 with value: 0.15660112100584528.
[I 2026-04-23 15:49:51,197] Trial 1 finished with value: 0.164475551364263 and parameters: {'alpha': 31403.568254918682, 'use_snp_selection': True, 'num_snps': 52878, 'iw_method': 'pc_logistic', 'iw_clip_max': 25.0, 'iw_n_components': 50, 'iw_logistic_c': 0.0215474878351802, 'iw_pca_fit': 'combined', 'iw_solver': 'lbfgs'}. Best is trial 1 with value: 0.164475551364263.
[I 2026-04-23 15:50:51,796] Trial 2 finished with value: 0.17182122507206266 and parameters: {'alpha': 843188.1730429748, 'use_snp_selection': False, 'iw_method': 'uniform', 'iw_clip_max': 10.0}. Best is trial 2 with value: 0.17182122507206266.
[I 2026-04-23 15:55:59,795] Trial 3 finished with value: 0.12072073841453691 and parameters: {'alpha': 1608.6968668824506, 'use_snp_selection': True, 'num_snps': 20835, 'iw_method': 'pc_logistic', 'iw_clip_max': None, 'iw_n_components': 10, 'iw_logistic_c': 1.0216001618506627, 'iw_pca_fit': 'source', 'iw_solver': 'lbfgs'}. Best is trial 2 with value: 0.17182122507206266.
[I 2026-04-23 15:57:01,378] Trial 4 finished with value: 0.17643581242085327 and parameters: {'alpha': 304631.0485153137, 'use_snp_selection': False, 'iw_method': 'uniform', 'iw_clip_max': 25.0}. Best is trial 4 with value: 0.17643581242085327.
[I 2026-04-23 16:02:45,816] Trial 5 finished with value: 0.14920677441010863 and parameters: {'alpha': 1969.1835550007406, 'use_snp_selection': False, 'iw_method': 'pc_logistic', 'iw_clip_max': None, 'iw_n_components': 10, 'iw_logistic_c': 72.13019609570544, 'iw_pca_fit': 'source', 'iw_solver': 'lbfgs'}. Best is trial 4 with value: 0.17643581242085327.
[I 2026-04-23 16:08:27,688] Trial 6 finished with value: 0.17410017903907496 and parameters: {'alpha': 102451.8239242939, 'use_snp_selection': True, 'num_snps': 28882, 'iw_method': 'pc_logistic', 'iw_clip_max': None, 'iw_n_components': 5, 'iw_logistic_c': 74.89693291900525, 'iw_pca_fit': 'source', 'iw_solver': 'lbfgs'}. Best is trial 4 with value: 0.17643581242085327.
[I 2026-04-23 16:09:30,031] Trial 7 finished with value: 0.13194622169171627 and parameters: {'alpha': 2141.2178673431476, 'use_snp_selection': False, 'iw_method': 'uniform', 'iw_clip_max': 25.0}. Best is trial 4 with value: 0.17643581242085327.
[I 2026-04-23 16:12:55,467] Trial 8 finished with value: 0.1616527748482328 and parameters: {'alpha': 5044402.471344981, 'use_snp_selection': True, 'num_snps': 45718, 'iw_method': 'uniform', 'iw_clip_max': 5.0}. Best is trial 4 with value: 0.17643581242085327.
[I 2026-04-23 16:19:15,024] Trial 9 finished with value: 0.17126092896416345 and parameters: {'alpha': 6685.17962248224, 'use_snp_selection': False, 'iw_method': 'pc_logistic', 'iw_clip_max': 25.0, 'iw_n_components': 10, 'iw_logistic_c': 60.72281367077526, 'iw_pca_fit': 'combined', 'iw_solver': 'lbfgs'}. Best is trial 4 with value: 0.17643581242085327.
[I 2026-04-23 16:20:15,688] Trial 10 finished with value: 0.1717026346899991 and parameters: {'alpha': 860571.7420672657, 'use_snp_selection': False, 'iw_method': 'uniform', 'iw_clip_max': 5.0}. Best is trial 4 with value: 0.17643581242085327.
[I 2026-04-23 16:23:09,953] Trial 11 finished with value: 0.17487673844826004 and parameters: {'alpha': 146725.17844355197, 'use_snp_selection': True, 'num_snps': 30178, 'iw_method': 'uniform', 'iw_clip_max': None}. Best is trial 4 with value: 0.17643581242085327.
[I 2026-04-23 16:26:23,594] Trial 12 finished with value: 0.17212407970112883 and parameters: {'alpha': 591768.0844457166, 'use_snp_selection': True, 'num_snps': 38552, 'iw_method': 'uniform', 'iw_clip_max': 25.0}. Best is trial 4 with value: 0.17643581242085327.
[I 2026-04-23 16:27:25,475] Trial 13 finished with value: 0.16330350221877057 and parameters: {'alpha': 30448.10954542319, 'use_snp_selection': False, 'iw_method': 'uniform', 'iw_clip_max': None}. Best is trial 4 with value: 0.17643581242085327.
[I 2026-04-23 16:29:50,095] Trial 14 finished with value: 0.15745800674834315 and parameters: {'alpha': 6266755.363843986, 'use_snp_selection': True, 'num_snps': 18192, 'iw_method': 'uniform', 'iw_clip_max': None}. Best is trial 4 with value: 0.17643581242085327.
[I 2026-04-23 16:30:51,070] Trial 15 finished with value: 0.17650156713640505 and parameters: {'alpha': 296185.78334472293, 'use_snp_selection': False, 'iw_method': 'uniform', 'iw_clip_max': 25.0}. Best is trial 15 with value: 0.17650156713640505.
[I 2026-04-23 16:31:51,413] Trial 16 finished with value: 0.1757237624504979 and parameters: {'alpha': 384672.5880712927, 'use_snp_selection': False, 'iw_method': 'uniform', 'iw_clip_max': 25.0}. Best is trial 15 with value: 0.17650156713640505.
[I 2026-04-23 16:32:51,187] Trial 17 finished with value: 0.1670646632836803 and parameters: {'alpha': 1927502.6144482074, 'use_snp_selection': False, 'iw_method': 'uniform', 'iw_clip_max': 25.0}. Best is trial 15 with value: 0.17650156713640505.
[I 2026-04-23 16:33:51,215] Trial 18 finished with value: 0.16103292425236287 and parameters: {'alpha': 25577.401069438194, 'use_snp_selection': False, 'iw_method': 'uniform', 'iw_clip_max': 25.0}. Best is trial 15 with value: 0.17650156713640505.
[I 2026-04-23 16:34:49,957] Trial 19 finished with value: 0.17667981028846025 and parameters: {'alpha': 270773.7394875237, 'use_snp_selection': False, 'iw_method': 'uniform', 'iw_clip_max': 25.0}. Best is trial 19 with value: 0.17667981028846025.
[I 2026-04-23 16:35:52,782] Trial 20 finished with value: 0.16551804126070324 and parameters: {'alpha': 2612104.8263964076, 'use_snp_selection': False, 'iw_method': 'uniform', 'iw_clip_max': 10.0}. Best is trial 19 with value: 0.17667981028846025.
[I 2026-04-23 16:36:53,946] Trial 21 finished with value: 0.1766527175984934 and parameters: {'alpha': 274975.166841956, 'use_snp_selection': False, 'iw_method': 'uniform', 'iw_clip_max': 25.0}. Best is trial 19 with value: 0.17667981028846025.
[I 2026-04-23 16:37:53,404] Trial 22 finished with value: 0.17679462761269318 and parameters: {'alpha': 250326.34205600002, 'use_snp_selection': False, 'iw_method': 'uniform', 'iw_clip_max': 25.0}. Best is trial 22 with value: 0.17679462761269318.
[I 2026-04-23 16:38:53,144] Trial 23 finished with value: 0.16969060853687062 and parameters: {'alpha': 52825.285760989405, 'use_snp_selection': False, 'iw_method': 'uniform', 'iw_clip_max': 25.0}. Best is trial 22 with value: 0.17679462761269318.
[I 2026-04-23 16:39:57,967] Trial 24 finished with value: 0.17668618241621475 and parameters: {'alpha': 164558.14992817387, 'use_snp_selection': False, 'iw_method': 'uniform', 'iw_clip_max': 5.0}. Best is trial 22 with value: 0.17679462761269318.
[I 2026-04-23 16:40:58,728] Trial 25 finished with value: 0.14807320204269356 and parameters: {'alpha': 9871.926337367311, 'use_snp_selection': False, 'iw_method': 'uniform', 'iw_clip_max': 5.0}. Best is trial 22 with value: 0.17679462761269318.
[I 2026-04-23 16:41:57,984] Trial 26 finished with value: 0.16791648036847429 and parameters: {'alpha': 1649777.9128335246, 'use_snp_selection': False, 'iw_method': 'uniform', 'iw_clip_max': 5.0}. Best is trial 22 with value: 0.17679462761269318.
[I 2026-04-23 16:42:59,158] Trial 27 finished with value: 0.1711799407013493 and parameters: {'alpha': 61588.95109504439, 'use_snp_selection': False, 'iw_method': 'uniform', 'iw_clip_max': 5.0}. Best is trial 22 with value: 0.17679462761269318.
[I 2026-04-23 16:44:00,026] Trial 28 finished with value: 0.17665894290427867 and parameters: {'alpha': 162167.30863292195, 'use_snp_selection': False, 'iw_method': 'uniform', 'iw_clip_max': 5.0}. Best is trial 22 with value: 0.17679462761269318.
[I 2026-04-23 16:50:17,327] Trial 29 finished with value: 0.16651634707409832 and parameters: {'alpha': 68939.36277159055, 'use_snp_selection': False, 'iw_method': 'pc_logistic', 'iw_clip_max': 10.0, 'iw_n_components': 20, 'iw_logistic_c': 0.01624880461850357, 'iw_pca_fit': 'combined', 'iw_solver': 'lbfgs'}. Best is trial 22 with value: 0.17679462761269318.
[I 2026-04-23 16:51:18,694] Trial 30 finished with value: 0.15276194985427632 and parameters: {'alpha': 13960.054920094133, 'use_snp_selection': False, 'iw_method': 'uniform', 'iw_clip_max': 5.0}. Best is trial 22 with value: 0.17679462761269318.
[I 2026-04-23 16:52:20,718] Trial 31 finished with value: 0.17662706745599902 and parameters: {'alpha': 159575.1690231894, 'use_snp_selection': False, 'iw_method': 'uniform', 'iw_clip_max': 5.0}. Best is trial 22 with value: 0.17679462761269318.
[I 2026-04-23 16:53:22,209] Trial 32 finished with value: 0.1767479464531707 and parameters: {'alpha': 170787.28159124003, 'use_snp_selection': False, 'iw_method': 'uniform', 'iw_clip_max': 5.0}. Best is trial 22 with value: 0.17679462761269318.
[I 2026-04-23 16:54:24,187] Trial 33 finished with value: 0.1742003694608267 and parameters: {'alpha': 545541.748520593, 'use_snp_selection': False, 'iw_method': 'uniform', 'iw_clip_max': 5.0}. Best is trial 22 with value: 0.17679462761269318.
[I 2026-04-23 17:01:02,962] Trial 34 finished with value: 0.15312417661524794 and parameters: {'alpha': 1028483.8643381959, 'use_snp_selection': False, 'iw_method': 'pc_logistic', 'iw_clip_max': 10.0, 'iw_n_components': 50, 'iw_logistic_c': 0.11088291658462143, 'iw_pca_fit': 'combined', 'iw_solver': 'lbfgs'}. Best is trial 22 with value: 0.17679462761269318.
[I 2026-04-23 17:02:02,928] Trial 35 finished with value: 0.17684683746118776 and parameters: {'alpha': 185300.56538536996, 'use_snp_selection': False, 'iw_method': 'uniform', 'iw_clip_max': 5.0}. Best is trial 35 with value: 0.17684683746118776.
[I 2026-04-23 17:03:02,442] Trial 36 finished with value: 0.17399631395211168 and parameters: {'alpha': 87603.75781576372, 'use_snp_selection': False, 'iw_method': 'uniform', 'iw_clip_max': 5.0}. Best is trial 35 with value: 0.17684683746118776.
[I 2026-04-23 17:09:07,390] Trial 37 finished with value: 0.16589945827355299 and parameters: {'alpha': 44763.7193441732, 'use_snp_selection': False, 'iw_method': 'pc_logistic', 'iw_clip_max': 5.0, 'iw_n_components': 20, 'iw_logistic_c': 5.843783263081874, 'iw_pca_fit': 'source', 'iw_solver': 'lbfgs'}. Best is trial 35 with value: 0.17684683746118776.
[I 2026-04-23 17:12:48,280] Trial 38 finished with value: 0.17693841479457323 and parameters: {'alpha': 193390.84025515086, 'use_snp_selection': True, 'num_snps': 56234, 'iw_method': 'uniform', 'iw_clip_max': 5.0}. Best is trial 38 with value: 0.17693841479457323.
[I 2026-04-23 17:16:08,207] Trial 39 finished with value: 0.17337328071127042 and parameters: {'alpha': 604184.5234918395, 'use_snp_selection': True, 'num_snps': 58379, 'iw_method': 'uniform', 'iw_clip_max': 5.0}. Best is trial 38 with value: 0.17693841479457323.
[I 2026-04-23 17:24:32,313] Trial 40 finished with value: 0.16876780664010574 and parameters: {'alpha': 197874.73382756955, 'use_snp_selection': True, 'num_snps': 46061, 'iw_method': 'pc_logistic', 'iw_clip_max': 5.0, 'iw_n_components': 50, 'iw_logistic_c': 0.19364484434083637, 'iw_pca_fit': 'combined', 'iw_solver': 'lbfgs'}. Best is trial 38 with value: 0.17693841479457323.
[I 2026-04-23 17:28:18,387] Trial 41 finished with value: 0.17586816966444246 and parameters: {'alpha': 105348.33990371681, 'use_snp_selection': True, 'num_snps': 59067, 'iw_method': 'uniform', 'iw_clip_max': 5.0}. Best is trial 38 with value: 0.17693841479457323.
[I 2026-04-23 17:31:17,201] Trial 42 finished with value: 0.17485854111603266 and parameters: {'alpha': 391773.1493856822, 'use_snp_selection': True, 'num_snps': 39446, 'iw_method': 'uniform', 'iw_clip_max': 5.0}. Best is trial 38 with value: 0.17693841479457323.
[I 2026-04-23 17:34:22,203] Trial 43 finished with value: 0.1770916056495075 and parameters: {'alpha': 205048.86320814225, 'use_snp_selection': True, 'num_snps': 49613, 'iw_method': 'uniform', 'iw_clip_max': 5.0}. Best is trial 43 with value: 0.1770916056495075.
[I 2026-04-23 17:37:40,648] Trial 44 finished with value: 0.16872161767876095 and parameters: {'alpha': 1134518.9748965597, 'use_snp_selection': True, 'num_snps': 50648, 'iw_method': 'uniform', 'iw_clip_max': 5.0}. Best is trial 43 with value: 0.1770916056495075.
[I 2026-04-23 17:41:01,715] Trial 45 finished with value: 0.17609141320202504 and parameters: {'alpha': 104194.95387962727, 'use_snp_selection': True, 'num_snps': 52595, 'iw_method': 'uniform', 'iw_clip_max': 5.0}. Best is trial 43 with value: 0.1770916056495075.
[I 2026-04-23 17:44:08,161] Trial 46 finished with value: 0.17754968599564475 and parameters: {'alpha': 235738.27197101322, 'use_snp_selection': True, 'num_snps': 38470, 'iw_method': 'uniform', 'iw_clip_max': 10.0}. Best is trial 46 with value: 0.17754968599564475.
[I 2026-04-23 17:47:10,620] Trial 47 finished with value: 0.1737840614780724 and parameters: {'alpha': 495935.8370248836, 'use_snp_selection': True, 'num_snps': 40244, 'iw_method': 'uniform', 'iw_clip_max': 10.0}. Best is trial 46 with value: 0.17754968599564475.
[I 2026-04-23 17:54:45,833] Trial 48 finished with value: 0.16183780807183465 and parameters: {'alpha': 39128.8630109311, 'use_snp_selection': True, 'num_snps': 46096, 'iw_method': 'pc_logistic', 'iw_clip_max': 10.0, 'iw_n_components': 20, 'iw_logistic_c': 9.347038217261188, 'iw_pca_fit': 'source', 'iw_solver': 'lbfgs'}. Best is trial 46 with value: 0.17754968599564475.
[I 2026-04-23 17:57:58,313] Trial 49 finished with value: 0.17757331164885126 and parameters: {'alpha': 244681.18959124543, 'use_snp_selection': True, 'num_snps': 34369, 'iw_method': 'uniform', 'iw_clip_max': 10.0}. Best is trial 49 with value: 0.17757331164885126.
