[I 2026-05-04 02:05:57,737] Trial 57 finished with value: 0.1937172383447367 and parameters: {'alpha': 260929.87058945396, 'use_snp_selection': False, 'iw_method': 'uniform'}. Best is trial 46 with value: 0.19932006179765496.
[I 2026-05-04 02:08:04,765] Trial 58 finished with value: 0.19479462947303142 and parameters: {'alpha': 202345.13579313515, 'use_snp_selection': False, 'iw_method': 'pc_logistic', 'iw_clip_max': 2.0, 'iw_prob_clip': 0.04788807938249942, 'iw_n_components': 20, 'iw_logistic_c': 4.7257380310070706e-07, 'iw_pca_fit': 'combined', 'iw_solver': 'lbfgs', 'iw_rho': 1.0}. Best is trial 46 with value: 0.19932006179765496.
[I 2026-05-04 02:10:19,519] Trial 59 finished with value: 0.1984539011603253 and parameters: {'alpha': 168428.67935699844, 'use_snp_selection': False, 'iw_method': 'pc_logistic', 'iw_clip_max': 2.0, 'iw_prob_clip': 0.04027780983959182, 'iw_n_components': 50, 'iw_logistic_c': 2.109342672828485e-05, 'iw_pca_fit': 'combined', 'iw_solver': 'lbfgs', 'iw_rho': 1.0}. Best is trial 46 with value: 0.19932006179765496.
[I 2026-05-04 02:12:33,250] Trial 60 finished with value: 0.1929452160618049 and parameters: {'alpha': 370521.33909775893, 'use_snp_selection': False, 'iw_method': 'pc_logistic', 'iw_clip_max': 2.0, 'iw_prob_clip': 0.020414626092536785, 'iw_n_components': 50, 'iw_logistic_c': 4.6743353195744014e-07, 'iw_pca_fit': 'combined', 'iw_solver': 'lbfgs', 'iw_rho': 0.5}. Best is trial 46 with value: 0.19932006179765496.
[I 2026-05-04 02:14:47,698] Trial 61 finished with value: 0.19744456789155676 and parameters: {'alpha': 370254.5776990111, 'use_snp_selection': False, 'iw_method': 'pc_logistic', 'iw_clip_max': 2.0, 'iw_prob_clip': 0.04853477404983063, 'iw_n_components': 50, 'iw_logistic_c': 1.4034623620634792e-05, 'iw_pca_fit': 'combined', 'iw_solver': 'lbfgs', 'iw_rho': 1.0}. Best is trial 46 with value: 0.19932006179765496.
[I 2026-05-04 02:17:03,516] Trial 62 finished with value: 0.19783816038775912 and parameters: {'alpha': 284013.77772670385, 'use_snp_selection': False, 'iw_method': 'pc_logistic', 'iw_clip_max': 2.0, 'iw_prob_clip': 0.04957689133676983, 'iw_n_components': 50, 'iw_logistic_c': 5.844395285558068e-05, 'iw_pca_fit': 'combined', 'iw_solver': 'lbfgs', 'iw_rho': 1.0}. Best is trial 46 with value: 0.19932006179765496.
[I 2026-05-04 02:19:21,828] Trial 63 finished with value: 0.19234921001321997 and parameters: {'alpha': 607321.4284686225, 'use_snp_selection': False, 'iw_method': 'pc_logistic', 'iw_clip_max': 1.25, 'iw_prob_clip': 0.03887836219986387, 'iw_n_components': 50, 'iw_logistic_c': 1.1248558677135917e-05, 'iw_pca_fit': 'combined', 'iw_solver': 'lbfgs', 'iw_rho': 1.0}. Best is trial 46 with value: 0.19932006179765496.
[I 2026-05-04 02:21:53,545] Trial 64 finished with value: 0.18845494294804777 and parameters: {'alpha': 472048.6107462828, 'use_snp_selection': False, 'iw_method': 'pc_logistic', 'iw_clip_max': 2.0, 'iw_prob_clip': 0.04043485802351923, 'iw_n_components': 40, 'iw_logistic_c': 4.650478608854269, 'iw_pca_fit': 'combined', 'iw_solver': 'lbfgs', 'iw_rho': 1.0}. Best is trial 46 with value: 0.19932006179765496.
[I 2026-05-04 02:24:19,004] Trial 65 finished with value: 0.19871897408682246 and parameters: {'alpha': 201846.63639634478, 'use_snp_selection': False, 'iw_method': 'pc_logistic', 'iw_clip_max': 2.0, 'iw_prob_clip': 0.03311704854899114, 'iw_n_components': 50, 'iw_logistic_c': 3.7908952157112016e-06, 'iw_pca_fit': 'combined', 'iw_solver': 'lbfgs', 'iw_rho': 1.0}. Best is trial 46 with value: 0.19932006179765496.
[I 2026-05-04 02:26:46,032] Trial 66 finished with value: 0.19547510814274804 and parameters: {'alpha': 165821.70458612542, 'use_snp_selection': False, 'iw_method': 'pc_logistic', 'iw_clip_max': 2.0, 'iw_prob_clip': 0.021683713935034113, 'iw_n_components': 50, 'iw_logistic_c': 3.831479535500741e-06, 'iw_pca_fit': 'combined', 'iw_solver': 'lbfgs', 'iw_rho': 1.0}. Best is trial 46 with value: 0.19932006179765496.
[I 2026-05-04 02:27:10,304] Trial 67 finished with value: 0.19372010661511468 and parameters: {'alpha': 260741.27013439816, 'use_snp_selection': False, 'iw_method': 'uniform'}. Best is trial 46 with value: 0.19932006179765496.
[I 2026-05-04 02:29:25,513] Trial 68 finished with value: 0.19699709498064186 and parameters: {'alpha': 203137.06043251985, 'use_snp_selection': False, 'iw_method': 'pc_logistic', 'iw_clip_max': 2.0, 'iw_prob_clip': 0.03348902230121463, 'iw_n_components': 10, 'iw_logistic_c': 3.134091219496553e-06, 'iw_pca_fit': 'combined', 'iw_solver': 'lbfgs', 'iw_rho': 0.5}. Best is trial 46 with value: 0.19932006179765496.
[I 2026-05-04 02:31:41,170] Trial 69 finished with value: 0.196221315516025 and parameters: {'alpha': 178918.06576000876, 'use_snp_selection': False, 'iw_method': 'pc_logistic', 'iw_clip_max': 2.0, 'iw_prob_clip': 0.005821717540775534, 'iw_n_components': 20, 'iw_logistic_c': 5.17862756679081e-07, 'iw_pca_fit': 'combined', 'iw_solver': 'lbfgs', 'iw_rho': 1.0}. Best is trial 46 with value: 0.19932006179765496.
[I 2026-05-04 02:34:06,656] Trial 70 finished with value: 0.19487524078337698 and parameters: {'alpha': 323112.79475606524, 'use_snp_selection': False, 'iw_method': 'pc_logistic', 'iw_clip_max': 1.25, 'iw_prob_clip': 0.030694394686527685, 'iw_n_components': 60, 'iw_logistic_c': 4.6799584458181556e-05, 'iw_pca_fit': 'combined', 'iw_solver': 'lbfgs', 'iw_rho': 1.0}. Best is trial 46 with value: 0.19932006179765496.
[I 2026-05-04 02:36:32,225] Trial 71 finished with value: 0.19839250635745548 and parameters: {'alpha': 382921.2620969167, 'use_snp_selection': False, 'iw_method': 'pc_logistic', 'iw_clip_max': 2.0, 'iw_prob_clip': 0.0420984862391328, 'iw_n_components': 50, 'iw_logistic_c': 9.97763278158756e-06, 'iw_pca_fit': 'combined', 'iw_solver': 'lbfgs', 'iw_rho': 1.0}. Best is trial 46 with value: 0.19932006179765496.
[I 2026-05-04 02:38:57,995] Trial 72 finished with value: 0.19898077879651038 and parameters: {'alpha': 201263.20185464437, 'use_snp_selection': False, 'iw_method': 'pc_logistic', 'iw_clip_max': 2.0, 'iw_prob_clip': 0.04965411769793145, 'iw_n_components': 50, 'iw_logistic_c': 2.3466209888739278e-05, 'iw_pca_fit': 'combined', 'iw_solver': 'lbfgs', 'iw_rho': 1.0}. Best is trial 46 with value: 0.19932006179765496.
[I 2026-05-04 02:41:23,718] Trial 73 finished with value: 0.1988034287749468 and parameters: {'alpha': 256264.28169326537, 'use_snp_selection': False, 'iw_method': 'pc_logistic', 'iw_clip_max': 2.0, 'iw_prob_clip': 0.03635317001143681, 'iw_n_components': 50, 'iw_logistic_c': 2.3907964240870187e-05, 'iw_pca_fit': 'combined', 'iw_solver': 'lbfgs', 'iw_rho': 1.0}. Best is trial 46 with value: 0.19932006179765496.
[I 2026-05-04 02:43:49,786] Trial 74 finished with value: 0.1971934479596565 and parameters: {'alpha': 188837.65593186766, 'use_snp_selection': False, 'iw_method': 'pc_logistic', 'iw_clip_max': 2.0, 'iw_prob_clip': 0.03709091494102373, 'iw_n_components': 50, 'iw_logistic_c': 2.7702353089495372e-05, 'iw_pca_fit': 'combined', 'iw_solver': 'lbfgs', 'iw_rho': 1.0}. Best is trial 46 with value: 0.19932006179765496.
[I 2026-05-04 02:46:16,105] Trial 75 finished with value: 0.19809661301775666 and parameters: {'alpha': 256659.70928494196, 'use_snp_selection': False, 'iw_method': 'pc_logistic', 'iw_clip_max': 1.5, 'iw_prob_clip': 0.04230559546526613, 'iw_n_components': 50, 'iw_logistic_c': 6.232064040218678e-05, 'iw_pca_fit': 'combined', 'iw_solver': 'lbfgs', 'iw_rho': 1.0}. Best is trial 46 with value: 0.19932006179765496.
[I 2026-05-04 02:48:40,587] Trial 76 finished with value: 0.1967831985436622 and parameters: {'alpha': 221206.35357721365, 'use_snp_selection': False, 'iw_method': 'pc_logistic', 'iw_clip_max': 2.0, 'iw_prob_clip': 0.0037945704875900557, 'iw_n_components': 40, 'iw_logistic_c': 7.440092594421497e-07, 'iw_pca_fit': 'combined', 'iw_solver': 'lbfgs', 'iw_rho': 1.0}. Best is trial 46 with value: 0.19932006179765496.
[I 2026-05-04 02:51:05,896] Trial 77 finished with value: 0.19600615578305866 and parameters: {'alpha': 160116.43954261456, 'use_snp_selection': False, 'iw_method': 'pc_logistic', 'iw_clip_max': 2.0, 'iw_prob_clip': 0.02333153572313746, 'iw_n_components': 50, 'iw_logistic_c': 2.942983328993136e-06, 'iw_pca_fit': 'combined', 'iw_solver': 'lbfgs', 'iw_rho': 1.0}. Best is trial 46 with value: 0.19932006179765496.
[I 2026-05-04 02:53:31,832] Trial 78 finished with value: 0.19595029569720074 and parameters: {'alpha': 289036.3921282515, 'use_snp_selection': False, 'iw_method': 'pc_logistic', 'iw_clip_max': 2.0, 'iw_prob_clip': 0.015617669822282885, 'iw_n_components': 50, 'iw_logistic_c': 2.4706049551072223e-05, 'iw_pca_fit': 'combined', 'iw_solver': 'lbfgs', 'iw_rho': 0.5}. Best is trial 46 with value: 0.19932006179765496.
[I 2026-05-04 02:56:06,083] Trial 79 finished with value: 0.18855879666299025 and parameters: {'alpha': 192145.4804382798, 'use_snp_selection': False, 'iw_method': 'pc_logistic', 'iw_clip_max': 2.0, 'iw_prob_clip': 0.02958449905590883, 'iw_n_components': 50, 'iw_logistic_c': 0.9754163888738475, 'iw_pca_fit': 'combined', 'iw_solver': 'lbfgs', 'iw_rho': 1.0}. Best is trial 46 with value: 0.19932006179765496.
[I 2026-05-04 02:58:33,782] Trial 80 finished with value: 0.1929869528434887 and parameters: {'alpha': 244610.1969824235, 'use_snp_selection': False, 'iw_method': 'pc_logistic', 'iw_clip_max': 1.25, 'iw_prob_clip': 0.03493831814279267, 'iw_n_components': 60, 'iw_logistic_c': 0.0002297938385941798, 'iw_pca_fit': 'combined', 'iw_solver': 'lbfgs', 'iw_rho': 1.0}. Best is trial 46 with value: 0.19932006179765496.
[I 2026-05-04 03:00:59,022] Trial 81 finished with value: 0.19722355947869516 and parameters: {'alpha': 199200.45753104115, 'use_snp_selection': False, 'iw_method': 'pc_logistic', 'iw_clip_max': 2.0, 'iw_prob_clip': 0.02862800896936677, 'iw_n_components': 50, 'iw_logistic_c': 5.175441955189714e-06, 'iw_pca_fit': 'combined', 'iw_solver': 'lbfgs', 'iw_rho': 1.0}. Best is trial 46 with value: 0.19932006179765496.
[I 2026-05-04 03:03:24,685] Trial 82 finished with value: 0.19932512808906439 and parameters: {'alpha': 216390.44689928443, 'use_snp_selection': False, 'iw_method': 'pc_logistic', 'iw_clip_max': 2.0, 'iw_prob_clip': 0.04275322566077006, 'iw_n_components': 50, 'iw_logistic_c': 8.966495643569188e-06, 'iw_pca_fit': 'combined', 'iw_solver': 'lbfgs', 'iw_rho': 1.0}. Best is trial 82 with value: 0.19932512808906439.
[I 2026-05-04 03:05:51,750] Trial 83 finished with value: 0.19635469191381616 and parameters: {'alpha': 309887.72631578956, 'use_snp_selection': False, 'iw_method': 'pc_logistic', 'iw_clip_max': 2.0, 'iw_prob_clip': 0.04974290147216585, 'iw_n_components': 50, 'iw_logistic_c': 8.357749442907402e-05, 'iw_pca_fit': 'combined', 'iw_solver': 'lbfgs', 'iw_rho': 1.0}. Best is trial 82 with value: 0.19932512808906439.
[I 2026-05-04 03:08:07,243] Trial 84 finished with value: 0.17803152996849766 and parameters: {'alpha': 1275301.0348016636, 'use_snp_selection': False, 'iw_method': 'pc_logistic', 'iw_clip_max': 2.0, 'iw_prob_clip': 0.04312018547478821, 'iw_n_components': 10, 'iw_logistic_c': 1.703105336073522e-05, 'iw_pca_fit': 'combined', 'iw_solver': 'lbfgs', 'iw_rho': 1.0}. Best is trial 82 with value: 0.19932512808906439.
[I 2026-05-04 03:10:32,583] Trial 85 finished with value: 0.19579993260573259 and parameters: {'alpha': 232553.91173729175, 'use_snp_selection': False, 'iw_method': 'pc_logistic', 'iw_clip_max': 1.5, 'iw_prob_clip': 0.0018144556542292916, 'iw_n_components': 50, 'iw_logistic_c': 2.4167757908524243e-06, 'iw_pca_fit': 'combined', 'iw_solver': 'lbfgs', 'iw_rho': 1.0}. Best is trial 82 with value: 0.19932512808906439.
[I 2026-05-04 03:10:56,718] Trial 86 finished with value: 0.19360031077159381 and parameters: {'alpha': 268495.20461031655, 'use_snp_selection': False, 'iw_method': 'uniform'}. Best is trial 82 with value: 0.19932512808906439.
[I 2026-05-04 03:13:22,355] Trial 87 finished with value: 0.19850715829065005 and parameters: {'alpha': 218528.1051902091, 'use_snp_selection': False, 'iw_method': 'pc_logistic', 'iw_clip_max': 2.0, 'iw_prob_clip': 0.03656356459640116, 'iw_n_components': 50, 'iw_logistic_c': 9.37004187323495e-06, 'iw_pca_fit': 'combined', 'iw_solver': 'lbfgs', 'iw_rho': 1.0}. Best is trial 82 with value: 0.19932512808906439.
[I 2026-05-04 03:15:48,738] Trial 88 finished with value: 0.19649089873773481 and parameters: {'alpha': 132795.5768677595, 'use_snp_selection': False, 'iw_method': 'pc_logistic', 'iw_clip_max': 2.0, 'iw_prob_clip': 0.04270723476998437, 'iw_n_components': 50, 'iw_logistic_c': 3.69917936580809e-05, 'iw_pca_fit': 'combined', 'iw_solver': 'lbfgs', 'iw_rho': 1.0}. Best is trial 82 with value: 0.19932512808906439.
[I 2026-05-04 03:18:14,151] Trial 89 finished with value: 0.1969835218307171 and parameters: {'alpha': 279459.0404650476, 'use_snp_selection': False, 'iw_method': 'pc_logistic', 'iw_clip_max': 2.0, 'iw_prob_clip': 0.027253226500062275, 'iw_n_components': 50, 'iw_logistic_c': 5.138197778336837e-06, 'iw_pca_fit': 'combined', 'iw_solver': 'lbfgs', 'iw_rho': 1.0}. Best is trial 82 with value: 0.19932512808906439.
[I 2026-05-04 03:20:32,935] Trial 90 finished with value: 0.19585770174589212 and parameters: {'alpha': 179214.49359190953, 'use_snp_selection': False, 'iw_method': 'pc_logistic', 'iw_clip_max': 2.0, 'iw_prob_clip': 0.034789810954298804, 'iw_n_components': 20, 'iw_logistic_c': 0.0001389694953931924, 'iw_pca_fit': 'combined', 'iw_solver': 'lbfgs', 'iw_rho': 1.0}. Best is trial 82 with value: 0.19932512808906439.
[I 2026-05-04 03:22:58,085] Trial 91 finished with value: 0.19834375495013476 and parameters: {'alpha': 210729.49223327517, 'use_snp_selection': False, 'iw_method': 'pc_logistic', 'iw_clip_max': 2.0, 'iw_prob_clip': 0.03170191570307861, 'iw_n_components': 50, 'iw_logistic_c': 1.0472597107839851e-05, 'iw_pca_fit': 'combined', 'iw_solver': 'lbfgs', 'iw_rho': 1.0}. Best is trial 82 with value: 0.19932512808906439.
[I 2026-05-04 03:25:22,975] Trial 92 finished with value: 0.1988149940480417 and parameters: {'alpha': 161351.66123960714, 'use_snp_selection': False, 'iw_method': 'pc_logistic', 'iw_clip_max': 2.0, 'iw_prob_clip': 0.04276889093375623, 'iw_n_components': 50, 'iw_logistic_c': 4.858448589569561e-06, 'iw_pca_fit': 'combined', 'iw_solver': 'lbfgs', 'iw_rho': 1.0}. Best is trial 82 with value: 0.19932512808906439.
[I 2026-05-04 03:27:48,016] Trial 93 finished with value: 0.19734730846049578 and parameters: {'alpha': 155817.97233031387, 'use_snp_selection': False, 'iw_method': 'pc_logistic', 'iw_clip_max': 2.0, 'iw_prob_clip': 0.04190787512098936, 'iw_n_components': 50, 'iw_logistic_c': 8.812270338873307e-07, 'iw_pca_fit': 'combined', 'iw_solver': 'lbfgs', 'iw_rho': 1.0}. Best is trial 82 with value: 0.19932512808906439.
[I 2026-05-04 03:30:14,412] Trial 94 finished with value: 0.20008187745869602 and parameters: {'alpha': 245637.28343183073, 'use_snp_selection': False, 'iw_method': 'pc_logistic', 'iw_clip_max': 2.0, 'iw_prob_clip': 0.04982005592347907, 'iw_n_components': 50, 'iw_logistic_c': 2.068726776481951e-06, 'iw_pca_fit': 'combined', 'iw_solver': 'lbfgs', 'iw_rho': 1.0}. Best is trial 94 with value: 0.20008187745869602.
[I 2026-05-04 03:32:40,718] Trial 95 finished with value: 0.19920973341061363 and parameters: {'alpha': 338117.8708129547, 'use_snp_selection': False, 'iw_method': 'pc_logistic', 'iw_clip_max': 2.0, 'iw_prob_clip': 0.04427863239769485, 'iw_n_components': 40, 'iw_logistic_c': 1.7928839741676866e-06, 'iw_pca_fit': 'combined', 'iw_solver': 'lbfgs', 'iw_rho': 1.0}. Best is trial 94 with value: 0.20008187745869602.
[I 2026-05-04 03:35:06,691] Trial 96 finished with value: 0.19779548814407577 and parameters: {'alpha': 241838.26689294225, 'use_snp_selection': False, 'iw_method': 'pc_logistic', 'iw_clip_max': 2.0, 'iw_prob_clip': 0.03785894059940473, 'iw_n_components': 40, 'iw_logistic_c': 1.7995579121246078e-06, 'iw_pca_fit': 'combined', 'iw_solver': 'lbfgs', 'iw_rho': 0.5}. Best is trial 94 with value: 0.20008187745869602.
[I 2026-05-04 03:37:32,417] Trial 97 finished with value: 0.2000178913535414 and parameters: {'alpha': 335089.36448438425, 'use_snp_selection': False, 'iw_method': 'pc_logistic', 'iw_clip_max': 2.0, 'iw_prob_clip': 0.04511065917462915, 'iw_n_components': 40, 'iw_logistic_c': 2.2185495893277253e-06, 'iw_pca_fit': 'combined', 'iw_solver': 'lbfgs', 'iw_rho': 1.0}. Best is trial 94 with value: 0.20008187745869602.
[I 2026-05-04 03:39:58,317] Trial 98 finished with value: 0.19265906024170848 and parameters: {'alpha': 328709.73874361155, 'use_snp_selection': False, 'iw_method': 'pc_logistic', 'iw_clip_max': 2.0, 'iw_prob_clip': 0.04384235313233374, 'iw_n_components': 40, 'iw_logistic_c': 2.3459866539455898e-07, 'iw_pca_fit': 'combined', 'iw_solver': 'lbfgs', 'iw_rho': 1.0}. Best is trial 94 with value: 0.20008187745869602.
[I 2026-05-04 03:40:22,646] Trial 99 finished with value: 0.19414753419886038 and parameters: {'alpha': 127420.32554763605, 'use_snp_selection': False, 'iw_method': 'uniform'}. Best is trial 94 with value: 0.20008187745869602.
[I 2026-05-04 03:42:48,755] Trial 100 finished with value: 0.1933395086456316 and parameters: {'alpha': 421604.2836721434, 'use_snp_selection': False, 'iw_method': 'pc_logistic', 'iw_clip_max': 3.0, 'iw_prob_clip': 0.03858275003134145, 'iw_n_components': 40, 'iw_logistic_c': 9.129354835640078e-07, 'iw_pca_fit': 'combined', 'iw_solver': 'lbfgs', 'iw_rho': 1.0}. Best is trial 94 with value: 0.20008187745869602.
[I 2026-05-04 03:45:14,670] Trial 101 finished with value: 0.1996415930145104 and parameters: {'alpha': 302979.5247550217, 'use_snp_selection': False, 'iw_method': 'pc_logistic', 'iw_clip_max': 2.0, 'iw_prob_clip': 0.049129291439213005, 'iw_n_components': 40, 'iw_logistic_c': 2.0747074292980713e-06, 'iw_pca_fit': 'combined', 'iw_solver': 'lbfgs', 'iw_rho': 1.0}. Best is trial 94 with value: 0.20008187745869602.
[I 2026-05-04 03:47:40,814] Trial 102 finished with value: 0.19546986013518 and parameters: {'alpha': 692528.121290037, 'use_snp_selection': False, 'iw_method': 'pc_logistic', 'iw_clip_max': 2.0, 'iw_prob_clip': 0.04553816790938476, 'iw_n_components': 40, 'iw_logistic_c': 2.492843237148694e-06, 'iw_pca_fit': 'combined', 'iw_solver': 'lbfgs', 'iw_rho': 1.0}. Best is trial 94 with value: 0.20008187745869602.
[I 2026-05-04 03:50:07,030] Trial 103 finished with value: 0.1988618278161376 and parameters: {'alpha': 303393.56845332705, 'use_snp_selection': False, 'iw_method': 'pc_logistic', 'iw_clip_max': 2.0, 'iw_prob_clip': 0.04300229526251885, 'iw_n_components': 40, 'iw_logistic_c': 1.4679669655538762e-06, 'iw_pca_fit': 'combined', 'iw_solver': 'lbfgs', 'iw_rho': 1.0}. Best is trial 94 with value: 0.20008187745869602.
[I 2026-05-04 03:52:33,079] Trial 104 finished with value: 0.19357678292184413 and parameters: {'alpha': 304787.42627589393, 'use_snp_selection': False, 'iw_method': 'pc_logistic', 'iw_clip_max': 2.0, 'iw_prob_clip': 0.04294086537046255, 'iw_n_components': 40, 'iw_logistic_c': 3.253780625059993e-07, 'iw_pca_fit': 'combined', 'iw_solver': 'lbfgs', 'iw_rho': 0.75}. Best is trial 94 with value: 0.20008187745869602.
[I 2026-05-04 03:54:59,446] Trial 105 finished with value: 0.1955870547649932 and parameters: {'alpha': 399880.3052609071, 'use_snp_selection': False, 'iw_method': 'pc_logistic', 'iw_clip_max': 2.0, 'iw_prob_clip': 0.049550645307225846, 'iw_n_components': 40, 'iw_logistic_c': 1.3685466643398916e-06, 'iw_pca_fit': 'combined', 'iw_solver': 'lbfgs', 'iw_rho': 1.0}. Best is trial 94 with value: 0.20008187745869602.
[I 2026-05-04 03:57:25,798] Trial 106 finished with value: 0.1944391607237019 and parameters: {'alpha': 347880.31570779206, 'use_snp_selection': False, 'iw_method': 'pc_logistic', 'iw_clip_max': 1.5, 'iw_prob_clip': 0.02933451648209015, 'iw_n_components': 40, 'iw_logistic_c': 6.55873893033654e-07, 'iw_pca_fit': 'combined', 'iw_solver': 'lbfgs', 'iw_rho': 1.0}. Best is trial 94 with value: 0.20008187745869602.
[I 2026-05-04 03:59:51,437] Trial 107 finished with value: 0.1945581019363753 and parameters: {'alpha': 228372.2127685115, 'use_snp_selection': False, 'iw_method': 'pc_logistic', 'iw_clip_max': 2.0, 'iw_prob_clip': 0.0390817477260688, 'iw_n_components': 40, 'iw_logistic_c': 1.116435468316442e-07, 'iw_pca_fit': 'combined', 'iw_solver': 'lbfgs', 'iw_rho': 1.0}. Best is trial 94 with value: 0.20008187745869602.
[I 2026-05-04 04:02:17,788] Trial 108 finished with value: 0.19342264744623394 and parameters: {'alpha': 462986.47604493087, 'use_snp_selection': False, 'iw_method': 'pc_logistic', 'iw_clip_max': 1.25, 'iw_prob_clip': 0.04382980923327034, 'iw_n_components': 40, 'iw_logistic_c': 1.8982138580861299e-06, 'iw_pca_fit': 'combined', 'iw_solver': 'lbfgs', 'iw_rho': 0.9}. Best is trial 94 with value: 0.20008187745869602.
[I 2026-05-04 04:04:44,211] Trial 109 finished with value: 0.17663173221982326 and parameters: {'alpha': 2720251.725434284, 'use_snp_selection': False, 'iw_method': 'pc_logistic', 'iw_clip_max': 2.0, 'iw_prob_clip': 0.02575087045573257, 'iw_n_components': 40, 'iw_logistic_c': 4.57762247177545e-06, 'iw_pca_fit': 'combined', 'iw_solver': 'lbfgs', 'iw_rho': 1.0}. Best is trial 94 with value: 0.20008187745869602.
[I 2026-05-04 04:07:10,554] Trial 110 finished with value: 0.19845829925411468 and parameters: {'alpha': 281543.07122809853, 'use_snp_selection': False, 'iw_method': 'pc_logistic', 'iw_clip_max': 3.0, 'iw_prob_clip': 0.03488519009680764, 'iw_n_components': 40, 'iw_logistic_c': 1.2217971877089657e-06, 'iw_pca_fit': 'combined', 'iw_solver': 'lbfgs', 'iw_rho': 1.0}. Best is trial 94 with value: 0.20008187745869602.
