[I 2026-04-22 15:08:56,107] Trial 67 finished with value: 0.16813144958510004 and parameters: {'alpha': 2801491.459251661, 'use_snp_selection': False, 'weight_scheme': 'exponential', 'weight_clip_max': 10.0, 'weight_exponential_beta': 0.3067498602873955}. Best is trial 42 with value: 0.18834892861760544.
[I 2026-04-22 15:09:51,378] Trial 68 finished with value: 0.17585265012252058 and parameters: {'alpha': 101732.27885619416, 'use_snp_selection': False, 'weight_scheme': 'top-heavy', 'weight_clip_max': 10.0, 'weight_topheavy_top_frac': 0.2412953402536386, 'weight_topheavy_low': 0.7427909018213565, 'weight_topheavy_high': 4.00523230268182}. Best is trial 42 with value: 0.18834892861760544.
[I 2026-04-22 15:11:45,739] Trial 69 finished with value: 0.17023143514116243 and parameters: {'alpha': 25928.525194500973, 'use_snp_selection': True, 'num_snps': 33708, 'weight_scheme': 'minmax', 'weight_clip_max': 10.0, 'weight_minmax_eps': 0.09460425430784501}. Best is trial 42 with value: 0.18834892861760544.
[I 2026-04-22 15:12:40,992] Trial 70 finished with value: 0.18647585498329414 and parameters: {'alpha': 230582.64826344582, 'use_snp_selection': False, 'weight_scheme': 'minmax', 'weight_clip_max': None, 'weight_minmax_eps': 0.10968767274891755}. Best is trial 42 with value: 0.18834892861760544.
[I 2026-04-22 15:13:36,423] Trial 71 finished with value: 0.18805648339290845 and parameters: {'alpha': 561184.7584515547, 'use_snp_selection': False, 'weight_scheme': 'minmax', 'weight_clip_max': 10.0, 'weight_minmax_eps': 0.14662739631242436}. Best is trial 42 with value: 0.18834892861760544.
[I 2026-04-22 15:14:31,978] Trial 72 finished with value: 0.1881141083986569 and parameters: {'alpha': 390641.7374349922, 'use_snp_selection': False, 'weight_scheme': 'minmax', 'weight_clip_max': 10.0, 'weight_minmax_eps': 0.14849357623497297}. Best is trial 42 with value: 0.18834892861760544.
[I 2026-04-22 15:15:26,196] Trial 73 finished with value: 0.18770184144794497 and parameters: {'alpha': 329099.28846600244, 'use_snp_selection': False, 'weight_scheme': 'minmax', 'weight_clip_max': 10.0, 'weight_minmax_eps': 0.176275334499609}. Best is trial 42 with value: 0.18834892861760544.
[I 2026-04-22 15:16:20,412] Trial 74 finished with value: 0.1844924709153156 and parameters: {'alpha': 1378858.4000088547, 'use_snp_selection': False, 'weight_scheme': 'minmax', 'weight_clip_max': 10.0, 'weight_minmax_eps': 0.11710053419553687}. Best is trial 42 with value: 0.18834892861760544.
[I 2026-04-22 15:17:15,058] Trial 75 finished with value: 0.18717864899390943 and parameters: {'alpha': 839872.891129756, 'use_snp_selection': False, 'weight_scheme': 'linear', 'weight_clip_max': 10.0, 'weight_linear_min_weight': 0.41451085382260716, 'weight_linear_max_weight': 3.955566884591449}. Best is trial 42 with value: 0.18834892861760544.
[I 2026-04-22 15:18:08,998] Trial 76 finished with value: 0.18659728396172906 and parameters: {'alpha': 239512.0150620771, 'use_snp_selection': False, 'weight_scheme': 'minmax', 'weight_clip_max': None, 'weight_minmax_eps': 0.08316647513968958}. Best is trial 42 with value: 0.18834892861760544.
[I 2026-04-22 15:19:03,934] Trial 77 finished with value: 0.18187668338569285 and parameters: {'alpha': 139175.08758323998, 'use_snp_selection': False, 'weight_scheme': 'linear', 'weight_clip_max': 10.0, 'weight_linear_min_weight': 0.9668333986662446, 'weight_linear_max_weight': 2.24132345306707}. Best is trial 42 with value: 0.18834892861760544.
[I 2026-04-22 15:21:21,280] Trial 78 finished with value: 0.17403714933524175 and parameters: {'alpha': 73666.9976854694, 'use_snp_selection': True, 'num_snps': 49242, 'weight_scheme': 'exponential', 'weight_clip_max': None, 'weight_exponential_beta': 4.473992750884982}. Best is trial 42 with value: 0.18834892861760544.
[I 2026-04-22 15:22:16,303] Trial 79 finished with value: 0.17982749458024613 and parameters: {'alpha': 419626.2782542482, 'use_snp_selection': False, 'weight_scheme': 'top-heavy', 'weight_clip_max': 10.0, 'weight_topheavy_top_frac': 0.4952761933662005, 'weight_topheavy_low': 0.7563551299314581, 'weight_topheavy_high': 2.4290824567883407}. Best is trial 42 with value: 0.18834892861760544.
[I 2026-04-22 15:23:11,958] Trial 80 finished with value: 0.15410552518194592 and parameters: {'alpha': 12749.29867334624, 'use_snp_selection': False, 'weight_scheme': 'minmax', 'weight_clip_max': None, 'weight_minmax_eps': 0.061972914180079844}. Best is trial 42 with value: 0.18834892861760544.
[I 2026-04-22 15:24:07,107] Trial 81 finished with value: 0.18814112951648226 and parameters: {'alpha': 525684.8311659099, 'use_snp_selection': False, 'weight_scheme': 'minmax', 'weight_clip_max': 10.0, 'weight_minmax_eps': 0.14655660758951183}. Best is trial 42 with value: 0.18834892861760544.
[I 2026-04-22 15:25:02,174] Trial 82 finished with value: 0.18776740101214315 and parameters: {'alpha': 319115.9694271584, 'use_snp_selection': False, 'weight_scheme': 'minmax', 'weight_clip_max': 10.0, 'weight_minmax_eps': 0.1324670274781022}. Best is trial 42 with value: 0.18834892861760544.
[I 2026-04-22 15:25:56,799] Trial 83 finished with value: 0.1858283949607503 and parameters: {'alpha': 1010525.1497065985, 'use_snp_selection': False, 'weight_scheme': 'minmax', 'weight_clip_max': 10.0, 'weight_minmax_eps': 0.15887946731934874}. Best is trial 42 with value: 0.18834892861760544.
[I 2026-04-22 15:26:41,721] Trial 84 finished with value: 0.16808742154121947 and parameters: {'alpha': 1599340.5178461801, 'use_snp_selection': False, 'weight_scheme': 'uniform', 'weight_clip_max': 10.0}. Best is trial 42 with value: 0.18834892861760544.
[I 2026-04-22 15:27:37,464] Trial 85 finished with value: 0.18846887302076495 and parameters: {'alpha': 473582.3836179786, 'use_snp_selection': False, 'weight_scheme': 'linear', 'weight_clip_max': 5.0, 'weight_linear_min_weight': 0.20163933033927411, 'weight_linear_max_weight': 3.203465775705275}. Best is trial 85 with value: 0.18846887302076495.
[I 2026-04-22 15:28:32,789] Trial 86 finished with value: 0.17991816276004624 and parameters: {'alpha': 2332297.8466783953, 'use_snp_selection': False, 'weight_scheme': 'minmax', 'weight_clip_max': 5.0, 'weight_minmax_eps': 0.16968743171282236}. Best is trial 85 with value: 0.18846887302076495.
[I 2026-04-22 15:29:54,237] Trial 87 finished with value: 0.19162218750743523 and parameters: {'alpha': 172379.3667793694, 'use_snp_selection': True, 'num_snps': 13127, 'weight_scheme': 'linear', 'weight_clip_max': 5.0, 'weight_linear_min_weight': 0.20261118206978557, 'weight_linear_max_weight': 1.2109802954938562}. Best is trial 87 with value: 0.19162218750743523.
[I 2026-04-22 15:31:15,917] Trial 88 finished with value: 0.19332996716097772 and parameters: {'alpha': 103198.77304585415, 'use_snp_selection': True, 'num_snps': 13260, 'weight_scheme': 'linear', 'weight_clip_max': 5.0, 'weight_linear_min_weight': 0.2148706855288023, 'weight_linear_max_weight': 1.0388644659300108}. Best is trial 88 with value: 0.19332996716097772.
[I 2026-04-22 15:32:36,067] Trial 89 finished with value: 0.18816828152554924 and parameters: {'alpha': 55681.09356840625, 'use_snp_selection': True, 'num_snps': 12401, 'weight_scheme': 'linear', 'weight_clip_max': 5.0, 'weight_linear_min_weight': 0.20124372495134962, 'weight_linear_max_weight': 1.0231811644271018}. Best is trial 88 with value: 0.19332996716097772.
[I 2026-04-22 15:33:58,343] Trial 90 finished with value: 0.19033914711560213 and parameters: {'alpha': 45026.11017992849, 'use_snp_selection': True, 'num_snps': 13575, 'weight_scheme': 'linear', 'weight_clip_max': 5.0, 'weight_linear_min_weight': 0.20057092590608352, 'weight_linear_max_weight': 1.029400368630387}. Best is trial 88 with value: 0.19332996716097772.
[I 2026-04-22 15:35:20,516] Trial 91 finished with value: 0.18976068146323916 and parameters: {'alpha': 46120.19883643143, 'use_snp_selection': True, 'num_snps': 13081, 'weight_scheme': 'linear', 'weight_clip_max': 5.0, 'weight_linear_min_weight': 0.19301675236954555, 'weight_linear_max_weight': 1.0376307820120783}. Best is trial 88 with value: 0.19332996716097772.
[I 2026-04-22 15:36:39,234] Trial 92 finished with value: 0.18610188280538792 and parameters: {'alpha': 32520.51773083007, 'use_snp_selection': True, 'num_snps': 13778, 'weight_scheme': 'linear', 'weight_clip_max': 5.0, 'weight_linear_min_weight': 0.19511532314785024, 'weight_linear_max_weight': 1.0428012389998218}. Best is trial 88 with value: 0.19332996716097772.
[I 2026-04-22 15:37:56,483] Trial 93 finished with value: 0.19205321506870057 and parameters: {'alpha': 63349.823999801614, 'use_snp_selection': True, 'num_snps': 13126, 'weight_scheme': 'linear', 'weight_clip_max': 5.0, 'weight_linear_min_weight': 0.18502428106455976, 'weight_linear_max_weight': 1.0958327091119893}. Best is trial 88 with value: 0.19332996716097772.
[I 2026-04-22 15:39:10,045] Trial 94 finished with value: 0.18853134228774018 and parameters: {'alpha': 59726.28322385975, 'use_snp_selection': True, 'num_snps': 12359, 'weight_scheme': 'linear', 'weight_clip_max': 5.0, 'weight_linear_min_weight': 0.1811253221495019, 'weight_linear_max_weight': 1.0827510485160705}. Best is trial 88 with value: 0.19332996716097772.
[I 2026-04-22 15:40:22,371] Trial 95 finished with value: 0.17808051136690647 and parameters: {'alpha': 20723.043862908322, 'use_snp_selection': True, 'num_snps': 14104, 'weight_scheme': 'linear', 'weight_clip_max': 5.0, 'weight_linear_min_weight': 0.250633384053924, 'weight_linear_max_weight': 1.2758594954642877}. Best is trial 88 with value: 0.19332996716097772.
[I 2026-04-22 15:41:28,924] Trial 96 finished with value: 0.1830436580361404 and parameters: {'alpha': 47719.35306091855, 'use_snp_selection': True, 'num_snps': 9884, 'weight_scheme': 'linear', 'weight_clip_max': 5.0, 'weight_linear_min_weight': 0.17160750563401317, 'weight_linear_max_weight': 1.31834980674972}. Best is trial 88 with value: 0.19332996716097772.
[I 2026-04-22 15:42:43,564] Trial 97 finished with value: 0.19202749587346085 and parameters: {'alpha': 113050.17789653047, 'use_snp_selection': True, 'num_snps': 15825, 'weight_scheme': 'linear', 'weight_clip_max': 5.0, 'weight_linear_min_weight': 0.24751480684725652, 'weight_linear_max_weight': 1.2461947889308354}. Best is trial 88 with value: 0.19332996716097772.
[I 2026-04-22 15:43:58,351] Trial 98 finished with value: 0.1914045643206692 and parameters: {'alpha': 98825.0355567207, 'use_snp_selection': True, 'num_snps': 16014, 'weight_scheme': 'linear', 'weight_clip_max': 5.0, 'weight_linear_min_weight': 0.241871430236326, 'weight_linear_max_weight': 1.2333765143545365}. Best is trial 88 with value: 0.19332996716097772.
[I 2026-04-22 15:45:12,601] Trial 99 finished with value: 0.16213535793210543 and parameters: {'alpha': 7958.015446499892, 'use_snp_selection': True, 'num_snps': 15656, 'weight_scheme': 'linear', 'weight_clip_max': 5.0, 'weight_linear_min_weight': 0.2308980570587856, 'weight_linear_max_weight': 1.261916095174652}. Best is trial 88 with value: 0.19332996716097772.
