[I 2026-04-22 15:33:01,305] Trial 64 finished with value: 0.19600121416330116 and parameters: {'alpha': 265763.54863948224, 'use_snp_selection': True, 'num_snps': 19435, 'weight_scheme': 'exponential', 'weight_clip_max': 10.0, 'weight_exponential_beta': 3.0615037352871886}. Best is trial 56 with value: 0.19920788348982438.
[I 2026-04-22 15:34:44,470] Trial 65 finished with value: 0.19044272427037673 and parameters: {'alpha': 96887.39164262179, 'use_snp_selection': True, 'num_snps': 24958, 'weight_scheme': 'exponential', 'weight_clip_max': 10.0, 'weight_exponential_beta': 3.0109461573481404}. Best is trial 56 with value: 0.19920788348982438.
[I 2026-04-22 15:36:11,760] Trial 66 finished with value: 0.1917890967328491 and parameters: {'alpha': 212983.3679816641, 'use_snp_selection': True, 'num_snps': 16094, 'weight_scheme': 'exponential', 'weight_clip_max': 10.0, 'weight_exponential_beta': 3.701745111675088}. Best is trial 56 with value: 0.19920788348982438.
[I 2026-04-22 15:38:08,506] Trial 67 finished with value: 0.19856188038750122 and parameters: {'alpha': 744350.4436658644, 'use_snp_selection': True, 'num_snps': 37963, 'weight_scheme': 'exponential', 'weight_clip_max': 10.0, 'weight_exponential_beta': 2.604031665279986}. Best is trial 56 with value: 0.19920788348982438.
[I 2026-04-22 15:39:58,635] Trial 68 finished with value: 0.196913338105878 and parameters: {'alpha': 795670.5323318546, 'use_snp_selection': True, 'num_snps': 37670, 'weight_scheme': 'exponential', 'weight_clip_max': 10.0, 'weight_exponential_beta': 2.1943539005490655}. Best is trial 56 with value: 0.19920788348982438.
[I 2026-04-22 15:41:44,838] Trial 69 finished with value: 0.189716995131363 and parameters: {'alpha': 3716567.3923505233, 'use_snp_selection': True, 'num_snps': 36778, 'weight_scheme': 'exponential', 'weight_clip_max': 10.0, 'weight_exponential_beta': 2.3341821016586737}. Best is trial 56 with value: 0.19920788348982438.
[I 2026-04-22 15:43:24,816] Trial 70 finished with value: 0.19314320466782714 and parameters: {'alpha': 1699145.8928409352, 'use_snp_selection': True, 'num_snps': 32321, 'weight_scheme': 'exponential', 'weight_clip_max': 10.0, 'weight_exponential_beta': 2.407947474434949}. Best is trial 56 with value: 0.19920788348982438.
[I 2026-04-22 15:45:14,091] Trial 71 finished with value: 0.18977775093419363 and parameters: {'alpha': 841445.1316264784, 'use_snp_selection': True, 'num_snps': 38937, 'weight_scheme': 'exponential', 'weight_clip_max': 10.0, 'weight_exponential_beta': 1.118902538402559}. Best is trial 56 with value: 0.19920788348982438.
[I 2026-04-22 15:47:01,927] Trial 72 finished with value: 0.19887455306651897 and parameters: {'alpha': 627005.0411883177, 'use_snp_selection': True, 'num_snps': 41847, 'weight_scheme': 'exponential', 'weight_clip_max': 10.0, 'weight_exponential_beta': 2.561828099894325}. Best is trial 56 with value: 0.19920788348982438.
[I 2026-04-22 15:48:50,128] Trial 73 finished with value: 0.19873754822908118 and parameters: {'alpha': 671971.2140829978, 'use_snp_selection': True, 'num_snps': 42272, 'weight_scheme': 'exponential', 'weight_clip_max': 10.0, 'weight_exponential_beta': 2.6002682888627215}. Best is trial 56 with value: 0.19920788348982438.
[I 2026-04-22 15:50:38,841] Trial 74 finished with value: 0.19860204953077468 and parameters: {'alpha': 656996.6347534101, 'use_snp_selection': True, 'num_snps': 42613, 'weight_scheme': 'exponential', 'weight_clip_max': 10.0, 'weight_exponential_beta': 2.9136237676815964}. Best is trial 56 with value: 0.19920788348982438.
[I 2026-04-22 15:52:27,443] Trial 75 finished with value: 0.19820963807825992 and parameters: {'alpha': 596408.4397454072, 'use_snp_selection': True, 'num_snps': 42460, 'weight_scheme': 'exponential', 'weight_clip_max': 10.0, 'weight_exponential_beta': 3.0476083709164477}. Best is trial 56 with value: 0.19920788348982438.
[I 2026-04-22 15:54:14,954] Trial 76 finished with value: 0.19822603778625383 and parameters: {'alpha': 604956.1919941055, 'use_snp_selection': True, 'num_snps': 41756, 'weight_scheme': 'exponential', 'weight_clip_max': 10.0, 'weight_exponential_beta': 3.0320950000360622}. Best is trial 56 with value: 0.19920788348982438.
[I 2026-04-22 15:56:03,114] Trial 77 finished with value: 0.1834833640252026 and parameters: {'alpha': 6348404.608659177, 'use_snp_selection': True, 'num_snps': 42155, 'weight_scheme': 'exponential', 'weight_clip_max': 10.0, 'weight_exponential_beta': 3.396124530812855}. Best is trial 56 with value: 0.19920788348982438.
[I 2026-04-22 15:57:52,060] Trial 78 finished with value: 0.19909197028715866 and parameters: {'alpha': 603522.4059981115, 'use_snp_selection': True, 'num_snps': 42816, 'weight_scheme': 'exponential', 'weight_clip_max': 10.0, 'weight_exponential_beta': 2.7659556763955218}. Best is trial 56 with value: 0.19920788348982438.
[I 2026-04-22 15:59:39,649] Trial 79 finished with value: 0.18909386843402926 and parameters: {'alpha': 1594289.6929447402, 'use_snp_selection': True, 'num_snps': 41316, 'weight_scheme': 'exponential', 'weight_clip_max': 5.0, 'weight_exponential_beta': 2.7722581973063387}. Best is trial 56 with value: 0.19920788348982438.
[I 2026-04-22 16:01:31,374] Trial 80 finished with value: 0.19928557371008968 and parameters: {'alpha': 571846.2826842809, 'use_snp_selection': True, 'num_snps': 43265, 'weight_scheme': 'exponential', 'weight_clip_max': 10.0, 'weight_exponential_beta': 2.58301499425853}. Best is trial 80 with value: 0.19928557371008968.
[I 2026-04-22 16:03:23,214] Trial 81 finished with value: 0.19915331471054556 and parameters: {'alpha': 616573.0037458604, 'use_snp_selection': True, 'num_snps': 43032, 'weight_scheme': 'exponential', 'weight_clip_max': 10.0, 'weight_exponential_beta': 2.461853279261411}. Best is trial 80 with value: 0.19928557371008968.
[I 2026-04-22 16:05:11,213] Trial 82 finished with value: 0.1969151201384181 and parameters: {'alpha': 1056236.3667012525, 'use_snp_selection': True, 'num_snps': 40235, 'weight_scheme': 'exponential', 'weight_clip_max': 10.0, 'weight_exponential_beta': 2.5196517944271184}. Best is trial 80 with value: 0.19928557371008968.
[I 2026-04-22 16:07:05,300] Trial 83 finished with value: 0.1913325317824183 and parameters: {'alpha': 3076319.3586617447, 'use_snp_selection': True, 'num_snps': 43525, 'weight_scheme': 'exponential', 'weight_clip_max': 10.0, 'weight_exponential_beta': 2.499345144124227}. Best is trial 80 with value: 0.19928557371008968.
[I 2026-04-22 16:09:05,315] Trial 84 finished with value: 0.19859819267748405 and parameters: {'alpha': 552789.7607825721, 'use_snp_selection': True, 'num_snps': 47959, 'weight_scheme': 'exponential', 'weight_clip_max': 10.0, 'weight_exponential_beta': 2.5268224034224342}. Best is trial 80 with value: 0.19928557371008968.
[I 2026-04-22 16:11:06,586] Trial 85 finished with value: 0.19458930151604184 and parameters: {'alpha': 1168374.401162149, 'use_snp_selection': True, 'num_snps': 48763, 'weight_scheme': 'exponential', 'weight_clip_max': 10.0, 'weight_exponential_beta': 2.0048347695560134}. Best is trial 80 with value: 0.19928557371008968.
[I 2026-04-22 16:13:05,435] Trial 86 finished with value: 0.19644401631056144 and parameters: {'alpha': 162304.81057695666, 'use_snp_selection': True, 'num_snps': 47147, 'weight_scheme': 'exponential', 'weight_clip_max': 10.0, 'weight_exponential_beta': 2.5086957882297947}. Best is trial 80 with value: 0.19928557371008968.
[I 2026-04-22 16:15:02,482] Trial 87 finished with value: 0.18982532622970882 and parameters: {'alpha': 1784369.5551467242, 'use_snp_selection': True, 'num_snps': 45748, 'weight_scheme': 'exponential', 'weight_clip_max': 10.0, 'weight_exponential_beta': 1.6454948977449697}. Best is trial 80 with value: 0.19928557371008968.
[I 2026-04-22 16:16:50,736] Trial 88 finished with value: 0.1733983066829981 and parameters: {'alpha': 4893662.801330207, 'use_snp_selection': True, 'num_snps': 44344, 'weight_scheme': 'uniform', 'weight_clip_max': 10.0}. Best is trial 80 with value: 0.19928557371008968.
[I 2026-04-22 16:18:31,973] Trial 89 finished with value: 0.18965052463198212 and parameters: {'alpha': 120114.25170299412, 'use_snp_selection': True, 'num_snps': 34174, 'weight_scheme': 'exponential', 'weight_clip_max': 10.0, 'weight_exponential_beta': 3.93433220938576}. Best is trial 80 with value: 0.19928557371008968.
[I 2026-04-22 16:20:18,492] Trial 90 finished with value: 0.18475114540530813 and parameters: {'alpha': 782941.9454224902, 'use_snp_selection': True, 'num_snps': 38043, 'weight_scheme': 'top-heavy', 'weight_clip_max': 10.0, 'weight_topheavy_top_frac': 0.3019541258599962, 'weight_topheavy_low': 1.1883218961221718, 'weight_topheavy_high': 3.502237492643018}. Best is trial 80 with value: 0.19928557371008968.
[I 2026-04-22 16:22:09,829] Trial 91 finished with value: 0.199363529324812 and parameters: {'alpha': 474373.5859789714, 'use_snp_selection': True, 'num_snps': 41479, 'weight_scheme': 'exponential', 'weight_clip_max': 10.0, 'weight_exponential_beta': 2.7010833880934273}. Best is trial 91 with value: 0.199363529324812.
[I 2026-04-22 16:23:59,665] Trial 92 finished with value: 0.19910070542669706 and parameters: {'alpha': 560598.1722753512, 'use_snp_selection': True, 'num_snps': 40358, 'weight_scheme': 'exponential', 'weight_clip_max': 10.0, 'weight_exponential_beta': 2.5818981955699276}. Best is trial 91 with value: 0.199363529324812.
[I 2026-04-22 16:25:49,973] Trial 93 finished with value: 0.1987916378892067 and parameters: {'alpha': 511182.27350014995, 'use_snp_selection': True, 'num_snps': 40916, 'weight_scheme': 'exponential', 'weight_clip_max': 10.0, 'weight_exponential_beta': 2.0685045248600886}. Best is trial 91 with value: 0.199363529324812.
[I 2026-04-22 16:27:39,507] Trial 94 finished with value: 0.18556199142061583 and parameters: {'alpha': 2564746.947460836, 'use_snp_selection': True, 'num_snps': 40406, 'weight_scheme': 'minmax', 'weight_clip_max': 10.0, 'weight_minmax_eps': 0.15599364585446507}. Best is trial 91 with value: 0.199363529324812.
[I 2026-04-22 16:29:33,923] Trial 95 finished with value: 0.13443970987226062 and parameters: {'alpha': 282.204356974056, 'use_snp_selection': True, 'num_snps': 43976, 'weight_scheme': 'exponential', 'weight_clip_max': 10.0, 'weight_exponential_beta': 2.118380798164012}. Best is trial 91 with value: 0.199363529324812.
[I 2026-04-22 16:31:24,926] Trial 96 finished with value: 0.19725329559779772 and parameters: {'alpha': 199311.74675473577, 'use_snp_selection': True, 'num_snps': 41378, 'weight_scheme': 'exponential', 'weight_clip_max': 5.0, 'weight_exponential_beta': 1.551675170546919}. Best is trial 91 with value: 0.199363529324812.
[I 2026-04-22 16:33:21,972] Trial 97 finished with value: 0.1355688490121228 and parameters: {'alpha': 30.36862012865213, 'use_snp_selection': True, 'num_snps': 45885, 'weight_scheme': 'exponential', 'weight_clip_max': 10.0, 'weight_exponential_beta': 3.5012244877038845}. Best is trial 91 with value: 0.199363529324812.
[I 2026-04-22 16:35:10,520] Trial 98 finished with value: 0.1914388716719526 and parameters: {'alpha': 501294.0168360892, 'use_snp_selection': True, 'num_snps': 39630, 'weight_scheme': 'exponential', 'weight_clip_max': 10.0, 'weight_exponential_beta': 4.371272539022295}. Best is trial 91 with value: 0.199363529324812.
[I 2026-04-22 16:37:03,967] Trial 99 finished with value: 0.19598966418409797 and parameters: {'alpha': 1015389.1951115349, 'use_snp_selection': True, 'num_snps': 43156, 'weight_scheme': 'exponential', 'weight_clip_max': 10.0, 'weight_exponential_beta': 2.1164041277608088}. Best is trial 91 with value: 0.199363529324812.
