[I 2026-04-18 14:19:53,135] Trial 25 finished with value: 0.24702187871643028 and parameters: {'hidden_dims': '[512, 128]', 'dropout': 0.5685933423106784, 'batch_norm': True, 'lr': 6.535756090740913e-05, 'weight_decay': 1.2662380902576655e-06, 'epochs': 183, 'loss': 'mae', 'optimizer': 'adamw', 'use_snp_selection': False, 'weight_scheme': 'top-heavy', 'weight_clip_max': 10.0, 'weight_topheavy_top_frac': 0.08280251806204128, 'weight_topheavy_low': 0.8406671463838434, 'weight_topheavy_high': 1.2157447502335406}. Best is trial 24 with value: 0.2472374754752887.
[I 2026-04-18 14:20:26,358] Trial 27 finished with value: 0.24895863005390412 and parameters: {'hidden_dims': '[512, 64]', 'dropout': 0.5584843440396488, 'batch_norm': False, 'lr': 5.0373373347797706e-05, 'weight_decay': 2.0899951272250974e-06, 'epochs': 78, 'loss': 'mae', 'optimizer': 'adam', 'use_snp_selection': True, 'num_snps': 52342, 'weight_scheme': 'uniform', 'weight_clip_max': 10.0}. Best is trial 24 with value: 0.2738436418206443.
[I 2026-04-18 14:20:35,610] Trial 26 finished with value: 0.23728893941100826 and parameters: {'hidden_dims': '[512, 128]', 'dropout': 0.4809859881082571, 'batch_norm': False, 'lr': 5.450505323195947e-05, 'weight_decay': 8.296554363977731e-07, 'epochs': 123, 'loss': 'mae', 'optimizer': 'adamw', 'use_snp_selection': False, 'weight_scheme': 'top-heavy', 'weight_clip_max': 10.0, 'weight_topheavy_top_frac': 0.07907430442618388, 'weight_topheavy_low': 0.8368836769982548, 'weight_topheavy_high': 1.3195555125409013}. Best is trial 24 with value: 0.2472374754752887.
[I 2026-04-18 14:21:33,121] Trial 28 finished with value: 0.25512186150423893 and parameters: {'hidden_dims': '[512, 64]', 'dropout': 0.5427451299240562, 'batch_norm': False, 'lr': 2.2711008081206765e-05, 'weight_decay': 3.8118567324664076e-07, 'epochs': 94, 'loss': 'mae', 'optimizer': 'adam', 'use_snp_selection': True, 'num_snps': 54997, 'weight_scheme': 'exponential', 'weight_clip_max': 10.0, 'weight_exponential_beta': 0.21994437033887815}. Best is trial 24 with value: 0.2738436418206443.
[I 2026-04-18 14:22:03,246] Trial 27 finished with value: 0.2453075580697499 and parameters: {'hidden_dims': '[512, 128]', 'dropout': 0.5961857702094413, 'batch_norm': True, 'lr': 1.5381167072372664e-05, 'weight_decay': 1.8951897161925478e-06, 'epochs': 165, 'loss': 'mae', 'optimizer': 'adamw', 'use_snp_selection': True, 'num_snps': 59114, 'weight_scheme': 'top-heavy', 'weight_clip_max': 10.0, 'weight_topheavy_top_frac': 0.3240041601843445, 'weight_topheavy_low': 0.8248203382990688, 'weight_topheavy_high': 1.584906996923303}. Best is trial 24 with value: 0.2472374754752887.
[I 2026-04-18 14:22:34,927] Trial 29 finished with value: 0.259257951447382 and parameters: {'hidden_dims': '[512, 64]', 'dropout': 0.48301253548199896, 'batch_norm': False, 'lr': 1.4759541143724544e-05, 'weight_decay': 3.5859039462030422e-06, 'epochs': 62, 'loss': 'mse', 'optimizer': 'adam', 'use_snp_selection': True, 'num_snps': 59695, 'weight_scheme': 'top-heavy', 'weight_clip_max': 10.0, 'weight_topheavy_top_frac': 0.05015151355791744, 'weight_topheavy_low': 0.9311641888255331, 'weight_topheavy_high': 1.2926748576659879}. Best is trial 24 with value: 0.2738436418206443.
[I 2026-04-18 14:23:05,230] Trial 28 finished with value: 0.17708915957117757 and parameters: {'hidden_dims': '[512, 128]', 'dropout': 0.5489369039173917, 'batch_norm': True, 'lr': 2.721558458329997e-06, 'weight_decay': 3.6671798065057543e-07, 'epochs': 187, 'loss': 'mae', 'optimizer': 'adamw', 'use_snp_selection': False, 'weight_scheme': 'top-heavy', 'weight_clip_max': 10.0, 'weight_topheavy_top_frac': 0.0720028071924142, 'weight_topheavy_low': 1.0923990623012714, 'weight_topheavy_high': 3.135863208369984}. Best is trial 24 with value: 0.2472374754752887.
[I 2026-04-18 14:23:37,264] Trial 29 finished with value: 0.25353191829005295 and parameters: {'hidden_dims': '[512, 128]', 'dropout': 0.3977654688488336, 'batch_norm': True, 'lr': 9.1950099266585e-06, 'weight_decay': 3.891400727024966e-06, 'epochs': 134, 'loss': 'mse', 'optimizer': 'adamw', 'use_snp_selection': True, 'num_snps': 5826, 'weight_scheme': 'exponential', 'weight_clip_max': 10.0, 'weight_exponential_beta': 0.3742067490046863}. Best is trial 29 with value: 0.25353191829005295.
[I 2026-04-18 14:23:41,693] Trial 30 finished with value: 0.252955920212744 and parameters: {'hidden_dims': '[512, 64]', 'dropout': 0.5358260345137973, 'batch_norm': False, 'lr': 5.0882691727742284e-05, 'weight_decay': 7.933618123242022e-07, 'epochs': 109, 'loss': 'mae', 'optimizer': 'adam', 'use_snp_selection': True, 'num_snps': 50783, 'weight_scheme': 'uniform', 'weight_clip_max': 10.0}. Best is trial 24 with value: 0.2738436418206443.
[I 2026-04-18 14:24:07,311] Trial 30 finished with value: 0.20079160029263163 and parameters: {'hidden_dims': '[256, 128]', 'dropout': 0.37407857479286966, 'batch_norm': True, 'lr': 7.4360062734788724e-06, 'weight_decay': 4.580156277108158e-06, 'epochs': 133, 'loss': 'mse', 'optimizer': 'adamw', 'use_snp_selection': True, 'num_snps': 5570, 'weight_scheme': 'exponential', 'weight_clip_max': 10.0, 'weight_exponential_beta': 0.2657733603732908}. Best is trial 29 with value: 0.25353191829005295.
[I 2026-04-18 14:24:42,563] Trial 31 finished with value: 0.2586580371243446 and parameters: {'hidden_dims': '[512, 64]', 'dropout': 0.4680402837699522, 'batch_norm': False, 'lr': 1.331635074840982e-05, 'weight_decay': 3.0967443547497157e-06, 'epochs': 55, 'loss': 'mse', 'optimizer': 'adam', 'use_snp_selection': True, 'num_snps': 59622, 'weight_scheme': 'top-heavy', 'weight_clip_max': 10.0, 'weight_topheavy_top_frac': 0.0641607359959579, 'weight_topheavy_low': 0.9379782448558546, 'weight_topheavy_high': 1.266724396311993}. Best is trial 24 with value: 0.2738436418206443.
[I 2026-04-18 14:24:47,381] Trial 31 finished with value: 0.10408092225261564 and parameters: {'hidden_dims': '[512, 128]', 'dropout': 0.4944577233003671, 'batch_norm': True, 'lr': 1.0519478127406592e-06, 'weight_decay': 9.144297978272733e-08, 'epochs': 106, 'loss': 'mse', 'optimizer': 'adamw', 'use_snp_selection': True, 'num_snps': 16932, 'weight_scheme': 'exponential', 'weight_clip_max': 10.0, 'weight_exponential_beta': 0.2124662056977134}. Best is trial 29 with value: 0.25353191829005295.
[I 2026-04-18 14:25:44,777] Trial 32 finished with value: 0.24953266055807957 and parameters: {'hidden_dims': '[512, 64]', 'dropout': 0.5225085358211351, 'batch_norm': False, 'lr': 2.454765498767248e-05, 'weight_decay': 7.793863405775154e-08, 'epochs': 74, 'loss': 'mse', 'optimizer': 'adam', 'use_snp_selection': True, 'num_snps': 55138, 'weight_scheme': 'top-heavy', 'weight_clip_max': 10.0, 'weight_topheavy_top_frac': 0.34383832766181466, 'weight_topheavy_low': 0.8325576628985734, 'weight_topheavy_high': 1.3526845061531256}. Best is trial 24 with value: 0.2738436418206443.
[I 2026-04-18 14:25:57,191] Trial 32 finished with value: 0.21061166784659052 and parameters: {'hidden_dims': '[512, 128]', 'dropout': 0.40256254940127967, 'batch_norm': True, 'lr': 1.0245190900134177e-05, 'weight_decay': 2.7103905042058195e-06, 'epochs': 149, 'loss': 'mse', 'optimizer': 'adamw', 'use_snp_selection': True, 'num_snps': 44289, 'weight_scheme': 'exponential', 'weight_clip_max': 10.0, 'weight_exponential_beta': 4.103842671115379}. Best is trial 29 with value: 0.25353191829005295.
[I 2026-04-18 14:26:28,419] Trial 33 finished with value: 0.23315829588699694 and parameters: {'hidden_dims': '[512, 128]', 'dropout': 0.3258363578950736, 'batch_norm': True, 'lr': 0.0002154783887453428, 'weight_decay': 5.532234818957201e-07, 'epochs': 90, 'loss': 'mse', 'optimizer': 'adamw', 'use_snp_selection': True, 'num_snps': 6749, 'weight_scheme': 'exponential', 'weight_clip_max': 10.0, 'weight_exponential_beta': 3.223458794603771}. Best is trial 29 with value: 0.25353191829005295.
[I 2026-04-18 14:26:55,609] Trial 33 finished with value: 0.23994295647588443 and parameters: {'hidden_dims': '[512, 64]', 'dropout': 0.41058196092708554, 'batch_norm': False, 'lr': 1.469771324872073e-05, 'weight_decay': 5.845066615951114e-06, 'epochs': 93, 'loss': 'mse', 'optimizer': 'adam', 'use_snp_selection': True, 'num_snps': 59808, 'weight_scheme': 'top-heavy', 'weight_clip_max': 10.0, 'weight_topheavy_top_frac': 0.05079818097838984, 'weight_topheavy_low': 0.8988510747453402, 'weight_topheavy_high': 3.185364937738372}. Best is trial 24 with value: 0.2738436418206443.
[I 2026-04-18 14:27:13,637] Trial 34 finished with value: 0.22643352397802366 and parameters: {'hidden_dims': '[512, 128]', 'dropout': 0.4742641450127967, 'batch_norm': True, 'lr': 6.47108272524488e-05, 'weight_decay': 1.2483781530491141e-05, 'epochs': 137, 'loss': 'mse', 'optimizer': 'adamw', 'use_snp_selection': True, 'num_snps': 20029, 'weight_scheme': 'linear', 'weight_clip_max': 10.0, 'weight_linear_min_weight': 0.9457745879005139, 'weight_linear_max_weight': 3.7586098706488444}. Best is trial 29 with value: 0.25353191829005295.
[I 2026-04-18 14:27:52,191] Trial 34 finished with value: 0.23657119449730274 and parameters: {'hidden_dims': '[512, 128]', 'dropout': 0.4697359792153557, 'batch_norm': False, 'lr': 5.4799217091879265e-05, 'weight_decay': 1.9404082133852286e-06, 'epochs': 65, 'loss': 'mse', 'optimizer': 'adam', 'use_snp_selection': True, 'num_snps': 49638, 'weight_scheme': 'top-heavy', 'weight_clip_max': 10.0, 'weight_topheavy_top_frac': 0.2589418134875527, 'weight_topheavy_low': 1.1222326550201331, 'weight_topheavy_high': 5.270232757642613}. Best is trial 24 with value: 0.2738436418206443.
[I 2026-04-18 14:28:28,016] Trial 35 finished with value: 0.22591163872904488 and parameters: {'hidden_dims': '[512, 128]', 'dropout': 0.5539609338056509, 'batch_norm': True, 'lr': 2.7156178903068567e-05, 'weight_decay': 1.287308153549919e-07, 'epochs': 178, 'loss': 'mse', 'optimizer': 'adamw', 'use_snp_selection': True, 'num_snps': 43443, 'weight_scheme': 'top-heavy', 'weight_clip_max': 10.0, 'weight_topheavy_top_frac': 0.27314367556648633, 'weight_topheavy_low': 0.6339188137120286, 'weight_topheavy_high': 5.235302925461757}. Best is trial 29 with value: 0.25353191829005295.
[I 2026-04-18 14:29:01,185] Trial 35 finished with value: 0.24995848389472744 and parameters: {'hidden_dims': '[512, 64]', 'dropout': 0.5645439138223352, 'batch_norm': False, 'lr': 3.0025606273206644e-05, 'weight_decay': 1.4721172937299107e-07, 'epochs': 105, 'loss': 'mse', 'optimizer': 'adam', 'use_snp_selection': True, 'num_snps': 54989, 'weight_scheme': 'linear', 'weight_clip_max': 10.0, 'weight_linear_min_weight': 0.9883981507052362, 'weight_linear_max_weight': 3.994372016662383}. Best is trial 24 with value: 0.2738436418206443.
[I 2026-04-18 14:29:20,873] Trial 36 finished with value: 0.2583187816066034 and parameters: {'hidden_dims': '[512, 128]', 'dropout': 0.261204123893779, 'batch_norm': False, 'lr': 3.5379791403304568e-06, 'weight_decay': 2.6494806316824304e-08, 'epochs': 157, 'loss': 'mse', 'optimizer': 'adamw', 'use_snp_selection': False, 'weight_scheme': 'linear', 'weight_clip_max': 5.0, 'weight_linear_min_weight': 0.6841232445212857, 'weight_linear_max_weight': 2.770753602824613}. Best is trial 36 with value: 0.2583187816066034.
[I 2026-04-18 14:29:49,079] Trial 37 finished with value: 0.03658542830591961 and parameters: {'hidden_dims': '[256, 64]', 'dropout': 0.24310701842358737, 'batch_norm': False, 'lr': 3.7548091355108958e-06, 'weight_decay': 1.3125502819690852e-08, 'epochs': 156, 'loss': 'mse', 'optimizer': 'sgd', 'use_snp_selection': False, 'weight_scheme': 'linear', 'weight_clip_max': 5.0, 'weight_linear_min_weight': 0.5990209321331165, 'weight_linear_max_weight': 2.6446374099387326}. Best is trial 36 with value: 0.2583187816066034.
[I 2026-04-18 14:30:08,080] Trial 36 finished with value: 0.23836226779454686 and parameters: {'hidden_dims': '[512, 64]', 'dropout': 0.24778187450455982, 'batch_norm': False, 'lr': 0.00022050212750323556, 'weight_decay': 4.6426518505299167e-07, 'epochs': 94, 'loss': 'mse', 'optimizer': 'sgd', 'use_snp_selection': True, 'num_snps': 56407, 'weight_scheme': 'linear', 'weight_clip_max': 10.0, 'weight_linear_min_weight': 0.5990209321331165, 'weight_linear_max_weight': 2.6446374099387326}. Best is trial 24 with value: 0.2738436418206443.
[I 2026-04-18 14:31:01,675] Trial 38 finished with value: 0.24797434022489476 and parameters: {'hidden_dims': '[512, 128]', 'dropout': 0.22212436940545333, 'batch_norm': False, 'lr': 2.1052383873070547e-06, 'weight_decay': 3.33659926284662e-08, 'epochs': 109, 'loss': 'mse', 'optimizer': 'adamw', 'use_snp_selection': True, 'num_snps': 58414, 'weight_scheme': 'linear', 'weight_clip_max': 5.0, 'weight_linear_min_weight': 0.5953232901917942, 'weight_linear_max_weight': 2.7572187298330917}. Best is trial 36 with value: 0.2583187816066034.
[I 2026-04-18 14:31:07,490] Trial 37 finished with value: 0.24896868423699775 and parameters: {'hidden_dims': '[512, 64]', 'dropout': 0.5081318606160461, 'batch_norm': False, 'lr': 1.097471040998135e-05, 'weight_decay': 1.186079066490045e-08, 'epochs': 122, 'loss': 'mse', 'optimizer': 'adam', 'use_snp_selection': True, 'num_snps': 38115, 'weight_scheme': 'top-heavy', 'weight_clip_max': 10.0, 'weight_topheavy_top_frac': 0.17203387240043994, 'weight_topheavy_low': 0.6186118345160401, 'weight_topheavy_high': 2.566322765882997}. Best is trial 24 with value: 0.2738436418206443.
[I 2026-04-18 14:32:04,710] Trial 38 finished with value: -0.0035107195526700454 and parameters: {'hidden_dims': '[512, 128]', 'dropout': 0.34427607916939595, 'batch_norm': False, 'lr': 2.1604819671816775e-05, 'weight_decay': 8.442607382513181e-06, 'epochs': 68, 'loss': 'mse', 'optimizer': 'sgd', 'use_snp_selection': True, 'num_snps': 51035, 'weight_scheme': 'uniform', 'weight_clip_max': 10.0}. Best is trial 24 with value: 0.2738436418206443.
[I 2026-04-18 14:32:14,205] Trial 39 finished with value: 0.2647531774431451 and parameters: {'hidden_dims': '[512, 128]', 'dropout': 0.18889789142406618, 'batch_norm': False, 'lr': 5.512249458917918e-06, 'weight_decay': 5.7661255604157964e-08, 'epochs': 108, 'loss': 'mse', 'optimizer': 'adamw', 'use_snp_selection': True, 'num_snps': 58849, 'weight_scheme': 'linear', 'weight_clip_max': 5.0, 'weight_linear_min_weight': 0.5986166437539578, 'weight_linear_max_weight': 2.768586460473442}. Best is trial 39 with value: 0.2647531774431451.
[I 2026-04-18 14:32:58,950] Trial 39 finished with value: 0.1852047931595099 and parameters: {'hidden_dims': '[512, 64]', 'dropout': 0.3000268759781647, 'batch_norm': True, 'lr': 7.875508615691242e-05, 'weight_decay': 2.7325416162046087e-06, 'epochs': 87, 'loss': 'mse', 'optimizer': 'adam', 'use_snp_selection': True, 'num_snps': 38872, 'weight_scheme': 'exponential', 'weight_clip_max': 10.0, 'weight_exponential_beta': 7.8361866776526155}. Best is trial 24 with value: 0.2738436418206443.
[I 2026-04-18 14:33:30,102] Trial 0 finished with value: -0.039268746460818724 and parameters: {'hidden_dims': '[256, 128]', 'dropout': 0.18584155530312246, 'batch_norm': True, 'lr': 9.012665953349533e-06, 'weight_decay': 4.96591963698479e-06, 'epochs': 105, 'loss': 'mse', 'optimizer': 'sgd', 'use_snp_selection': True, 'num_snps': 25583, 'weight_scheme': 'minmax', 'weight_clip_max': 5.0, 'weight_minmax_eps': 0.14026014881292506}. Best is trial 0 with value: -0.039268746460818724.
[I 2026-04-18 14:33:55,402] Trial 1 finished with value: 0.0992613106175286 and parameters: {'hidden_dims': '[256, 64]', 'dropout': 0.05000949662985405, 'batch_norm': True, 'lr': 0.00015647443054904835, 'weight_decay': 5.158896024962846e-05, 'epochs': 152, 'loss': 'mse', 'optimizer': 'sgd', 'use_snp_selection': False, 'weight_scheme': 'linear', 'weight_clip_max': None, 'weight_linear_min_weight': 0.21922985165550554, 'weight_linear_max_weight': 1.6260435767424388}. Best is trial 1 with value: 0.0992613106175286.
[I 2026-04-18 14:34:09,300] Trial 0 finished with value: 0.02247891907801371 and parameters: {'hidden_dims': '[256, 128]', 'dropout': 0.18584155530312246, 'batch_norm': True, 'lr': 9.012665953349533e-06, 'weight_decay': 4.96591963698479e-06, 'epochs': 105, 'loss': 'mse', 'optimizer': 'sgd', 'use_snp_selection': True, 'num_snps': 25583, 'weight_scheme': 'minmax', 'weight_clip_max': 5.0, 'weight_minmax_eps': 0.14026014881292506}. Best is trial 0 with value: 0.02247891907801371.
[I 2026-04-18 14:34:32,750] Trial 1 finished with value: 0.09811397774289338 and parameters: {'hidden_dims': '[256, 64]', 'dropout': 0.05000949662985405, 'batch_norm': True, 'lr': 0.00015647443054904835, 'weight_decay': 5.158896024962846e-05, 'epochs': 152, 'loss': 'mse', 'optimizer': 'sgd', 'use_snp_selection': False, 'weight_scheme': 'linear', 'weight_clip_max': None, 'weight_linear_min_weight': 0.21922985165550554, 'weight_linear_max_weight': 1.6260435767424388}. Best is trial 1 with value: 0.09811397774289338.
[I 2026-04-18 14:34:33,821] Trial 2 finished with value: 0.11207666031459577 and parameters: {'hidden_dims': '[512, 128]', 'dropout': 0.2736730891340176, 'batch_norm': True, 'lr': 7.298114623433994e-05, 'weight_decay': 5.6346010385734023e-08, 'epochs': 185, 'loss': 'mae', 'optimizer': 'sgd', 'use_snp_selection': True, 'num_snps': 14091, 'weight_scheme': 'minmax', 'weight_clip_max': 10.0, 'weight_minmax_eps': 0.045780660776687306}. Best is trial 2 with value: 0.11207666031459577.
[I 2026-04-18 14:35:08,177] Trial 2 finished with value: 0.09299095014045117 and parameters: {'hidden_dims': '[512, 128]', 'dropout': 0.2736730891340176, 'batch_norm': True, 'lr': 7.298114623433994e-05, 'weight_decay': 5.6346010385734023e-08, 'epochs': 185, 'loss': 'mae', 'optimizer': 'sgd', 'use_snp_selection': True, 'num_snps': 14091, 'weight_scheme': 'minmax', 'weight_clip_max': 10.0, 'weight_minmax_eps': 0.045780660776687306}. Best is trial 1 with value: 0.09811397774289338.
[I 2026-04-18 14:35:54,141] Trial 3 finished with value: 0.07649516101969049 and parameters: {'hidden_dims': '[512, 64]', 'dropout': 0.30157795416637295, 'batch_norm': False, 'lr': 2.007492282795256e-05, 'weight_decay': 5.496446859789657e-06, 'epochs': 284, 'loss': 'mse', 'optimizer': 'sgd', 'use_snp_selection': False, 'weight_scheme': 'linear', 'weight_clip_max': None, 'weight_linear_min_weight': 0.24682154527102826, 'weight_linear_max_weight': 1.8338910783134623}. Best is trial 2 with value: 0.11207666031459577.
[I 2026-04-18 14:36:18,615] Trial 4 finished with value: 0.12515064062048956 and parameters: {'hidden_dims': '[256, 64]', 'dropout': 0.18128694708490736, 'batch_norm': False, 'lr': 8.951826748007403e-05, 'weight_decay': 2.1781541495465197e-07, 'epochs': 147, 'loss': 'mse', 'optimizer': 'sgd', 'use_snp_selection': False, 'weight_scheme': 'top-heavy', 'weight_clip_max': 5.0, 'weight_topheavy_top_frac': 0.1724888194073277, 'weight_topheavy_low': 1.1620865802171172, 'weight_topheavy_high': 3.476906528073177}. Best is trial 4 with value: 0.12515064062048956.
[I 2026-04-18 14:36:22,886] Trial 3 finished with value: 0.08860622566256994 and parameters: {'hidden_dims': '[512, 64]', 'dropout': 0.30157795416637295, 'batch_norm': False, 'lr': 2.007492282795256e-05, 'weight_decay': 5.496446859789657e-06, 'epochs': 284, 'loss': 'mse', 'optimizer': 'sgd', 'use_snp_selection': False, 'weight_scheme': 'linear', 'weight_clip_max': None, 'weight_linear_min_weight': 0.24682154527102826, 'weight_linear_max_weight': 1.8338910783134623}. Best is trial 1 with value: 0.09811397774289338.
[I 2026-04-18 14:36:39,672] Trial 5 finished with value: 0.07231083403490235 and parameters: {'hidden_dims': '[256, 64]', 'dropout': 0.2571412946970998, 'batch_norm': True, 'lr': 3.546238022482882e-05, 'weight_decay': 1.0185234767613396e-06, 'epochs': 119, 'loss': 'mse', 'optimizer': 'sgd', 'use_snp_selection': False, 'weight_scheme': 'linear', 'weight_clip_max': 10.0, 'weight_linear_min_weight': 0.9405832045183805, 'weight_linear_max_weight': 3.413610925325811}. Best is trial 4 with value: 0.12515064062048956.
[I 2026-04-18 14:36:45,444] Trial 4 finished with value: 0.1203172924811737 and parameters: {'hidden_dims': '[256, 64]', 'dropout': 0.18128694708490736, 'batch_norm': False, 'lr': 8.951826748007403e-05, 'weight_decay': 2.1781541495465197e-07, 'epochs': 147, 'loss': 'mse', 'optimizer': 'sgd', 'use_snp_selection': False, 'weight_scheme': 'top-heavy', 'weight_clip_max': 5.0, 'weight_topheavy_top_frac': 0.1724888194073277, 'weight_topheavy_low': 1.1620865802171172, 'weight_topheavy_high': 3.476906528073177}. Best is trial 4 with value: 0.1203172924811737.
[I 2026-04-18 14:37:04,674] Trial 5 finished with value: 0.07515015648642481 and parameters: {'hidden_dims': '[256, 64]', 'dropout': 0.2571412946970998, 'batch_norm': True, 'lr': 3.546238022482882e-05, 'weight_decay': 1.0185234767613396e-06, 'epochs': 119, 'loss': 'mse', 'optimizer': 'sgd', 'use_snp_selection': False, 'weight_scheme': 'linear', 'weight_clip_max': 10.0, 'weight_linear_min_weight': 0.9405832045183805, 'weight_linear_max_weight': 3.413610925325811}. Best is trial 4 with value: 0.1203172924811737.
[I 2026-04-18 14:37:18,380] Trial 6 finished with value: 0.1532404851230473 and parameters: {'hidden_dims': '[256, 64]', 'dropout': 0.037961443806696214, 'batch_norm': True, 'lr': 3.644202049829694e-05, 'weight_decay': 9.73334309820277e-06, 'epochs': 243, 'loss': 'mae', 'optimizer': 'adam', 'use_snp_selection': False, 'weight_scheme': 'minmax', 'weight_clip_max': None, 'weight_minmax_eps': 0.08689611239934374}. Best is trial 6 with value: 0.1532404851230473.
[I 2026-04-18 14:37:40,569] Trial 6 finished with value: 0.13496898327067905 and parameters: {'hidden_dims': '[256, 64]', 'dropout': 0.037961443806696214, 'batch_norm': True, 'lr': 3.644202049829694e-05, 'weight_decay': 9.73334309820277e-06, 'epochs': 243, 'loss': 'mae', 'optimizer': 'adam', 'use_snp_selection': False, 'weight_scheme': 'minmax', 'weight_clip_max': None, 'weight_minmax_eps': 0.08689611239934374}. Best is trial 6 with value: 0.13496898327067905.
