[I 2026-04-22 15:10:51,413] Trial 68 finished with value: 0.16295103065788785 and parameters: {'alpha': 3810083.4026784836, 'use_snp_selection': False, 'weight_scheme': 'minmax', 'weight_clip_max': None, 'weight_minmax_eps': 0.03752783515027791}. Best is trial 45 with value: 0.16968090137311337.
[I 2026-04-22 15:11:41,926] Trial 69 finished with value: 0.14636271355967095 and parameters: {'alpha': 9673559.950114353, 'use_snp_selection': False, 'weight_scheme': 'uniform', 'weight_clip_max': None}. Best is trial 45 with value: 0.16968090137311337.
[I 2026-04-22 15:12:42,796] Trial 70 finished with value: 0.11809618754923583 and parameters: {'alpha': 10.993252254352482, 'use_snp_selection': False, 'weight_scheme': 'minmax', 'weight_clip_max': None, 'weight_minmax_eps': 0.0008601907000891993}. Best is trial 45 with value: 0.16968090137311337.
[I 2026-04-22 15:13:43,953] Trial 71 finished with value: 0.1695609984691364 and parameters: {'alpha': 455601.77856696444, 'use_snp_selection': False, 'weight_scheme': 'minmax', 'weight_clip_max': None, 'weight_minmax_eps': 0.05717475897304627}. Best is trial 45 with value: 0.16968090137311337.
[I 2026-04-22 15:14:45,234] Trial 72 finished with value: 0.16967012266053821 and parameters: {'alpha': 584919.3516147383, 'use_snp_selection': False, 'weight_scheme': 'minmax', 'weight_clip_max': None, 'weight_minmax_eps': 0.05422303447859138}. Best is trial 45 with value: 0.16968090137311337.
[I 2026-04-22 15:15:46,908] Trial 73 finished with value: 0.16898280439457117 and parameters: {'alpha': 936818.0706655671, 'use_snp_selection': False, 'weight_scheme': 'minmax', 'weight_clip_max': None, 'weight_minmax_eps': 0.06020150688341613}. Best is trial 45 with value: 0.16968090137311337.
[I 2026-04-22 15:16:48,515] Trial 74 finished with value: 0.16776833890073878 and parameters: {'alpha': 1491974.5547004968, 'use_snp_selection': False, 'weight_scheme': 'minmax', 'weight_clip_max': None, 'weight_minmax_eps': 0.016682760231191866}. Best is trial 45 with value: 0.16968090137311337.
[I 2026-04-22 15:17:48,617] Trial 75 finished with value: 0.1611183859539727 and parameters: {'alpha': 535170.2295998782, 'use_snp_selection': False, 'weight_scheme': 'top-heavy', 'weight_clip_max': None, 'weight_topheavy_top_frac': 0.2679859206545521, 'weight_topheavy_low': 0.840866499919028, 'weight_topheavy_high': 3.646342987513278}. Best is trial 45 with value: 0.16968090137311337.
[I 2026-04-22 15:18:50,280] Trial 76 finished with value: 0.16669634563503954 and parameters: {'alpha': 188635.0001837324, 'use_snp_selection': False, 'weight_scheme': 'minmax', 'weight_clip_max': None, 'weight_minmax_eps': 0.03521763238554562}. Best is trial 45 with value: 0.16968090137311337.
[I 2026-04-22 15:19:49,337] Trial 77 finished with value: 0.16651073607268568 and parameters: {'alpha': 1960172.677058779, 'use_snp_selection': False, 'weight_scheme': 'minmax', 'weight_clip_max': None, 'weight_minmax_eps': 0.024526196406868615}. Best is trial 45 with value: 0.16968090137311337.
[I 2026-04-22 15:20:49,253] Trial 78 finished with value: 0.12018106589633563 and parameters: {'alpha': 482.30000758425456, 'use_snp_selection': False, 'weight_scheme': 'minmax', 'weight_clip_max': None, 'weight_minmax_eps': 0.08651135991272021}. Best is trial 45 with value: 0.16968090137311337.
[I 2026-04-22 15:22:43,642] Trial 79 finished with value: 0.16167209212437492 and parameters: {'alpha': 299225.4460437758, 'use_snp_selection': True, 'num_snps': 26688, 'weight_scheme': 'minmax', 'weight_clip_max': None, 'weight_minmax_eps': 0.01298851938301467}. Best is trial 45 with value: 0.16968090137311337.
[I 2026-04-22 15:23:45,703] Trial 80 finished with value: 0.16964211981723976 and parameters: {'alpha': 561898.4466477607, 'use_snp_selection': False, 'weight_scheme': 'minmax', 'weight_clip_max': None, 'weight_minmax_eps': 0.0607666951714893}. Best is trial 45 with value: 0.16968090137311337.
[I 2026-04-22 15:24:48,354] Trial 81 finished with value: 0.16957167542799625 and parameters: {'alpha': 660441.8915803356, 'use_snp_selection': False, 'weight_scheme': 'minmax', 'weight_clip_max': None, 'weight_minmax_eps': 0.0598601140470008}. Best is trial 45 with value: 0.16968090137311337.
[I 2026-04-22 15:25:50,366] Trial 82 finished with value: 0.16962022408551272 and parameters: {'alpha': 518794.3078373806, 'use_snp_selection': False, 'weight_scheme': 'minmax', 'weight_clip_max': None, 'weight_minmax_eps': 0.06300181866936973}. Best is trial 45 with value: 0.16968090137311337.
[I 2026-04-22 15:26:52,625] Trial 83 finished with value: 0.16830112103856415 and parameters: {'alpha': 1176100.8469001423, 'use_snp_selection': False, 'weight_scheme': 'minmax', 'weight_clip_max': None, 'weight_minmax_eps': 0.06205583813185855}. Best is trial 45 with value: 0.16968090137311337.
[I 2026-04-22 15:27:56,160] Trial 84 finished with value: 0.1695790849648273 and parameters: {'alpha': 623262.8587125846, 'use_snp_selection': False, 'weight_scheme': 'minmax', 'weight_clip_max': None, 'weight_minmax_eps': 0.06545386096398023}. Best is trial 45 with value: 0.16968090137311337.
[I 2026-04-22 15:28:57,508] Trial 85 finished with value: 0.1671644929972113 and parameters: {'alpha': 237207.66352323, 'use_snp_selection': False, 'weight_scheme': 'minmax', 'weight_clip_max': None, 'weight_minmax_eps': 0.1734010040273215}. Best is trial 45 with value: 0.16968090137311337.
[I 2026-04-22 15:29:47,427] Trial 86 finished with value: 0.14885245610679193 and parameters: {'alpha': 3597147.108158887, 'use_snp_selection': False, 'weight_scheme': 'uniform', 'weight_clip_max': 10.0}. Best is trial 45 with value: 0.16968090137311337.
[I 2026-04-22 15:30:49,333] Trial 87 finished with value: 0.16953214978017392 and parameters: {'alpha': 628064.2239565372, 'use_snp_selection': False, 'weight_scheme': 'minmax', 'weight_clip_max': None, 'weight_minmax_eps': 0.07175090277633404}. Best is trial 45 with value: 0.16968090137311337.
[I 2026-04-22 15:31:50,620] Trial 88 finished with value: 0.1626571242743969 and parameters: {'alpha': 138939.3229502487, 'use_snp_selection': False, 'weight_scheme': 'linear', 'weight_clip_max': None, 'weight_linear_min_weight': 0.6723935293461163, 'weight_linear_max_weight': 2.223809175057192}. Best is trial 45 with value: 0.16968090137311337.
[I 2026-04-22 15:32:50,712] Trial 89 finished with value: 0.158048682622122 and parameters: {'alpha': 1612194.0339399832, 'use_snp_selection': False, 'weight_scheme': 'top-heavy', 'weight_clip_max': None, 'weight_topheavy_top_frac': 0.26000880071315324, 'weight_topheavy_low': 0.8013904219416578, 'weight_topheavy_high': 3.427447075668565}. Best is trial 45 with value: 0.16968090137311337.
[I 2026-04-22 15:33:52,027] Trial 90 finished with value: 0.16832466854468525 and parameters: {'alpha': 1085667.661363051, 'use_snp_selection': False, 'weight_scheme': 'minmax', 'weight_clip_max': None, 'weight_minmax_eps': 0.08612233902644867}. Best is trial 45 with value: 0.16968090137311337.
[I 2026-04-22 15:34:54,177] Trial 91 finished with value: 0.1696568817643647 and parameters: {'alpha': 577307.298694446, 'use_snp_selection': False, 'weight_scheme': 'minmax', 'weight_clip_max': None, 'weight_minmax_eps': 0.057348805510764614}. Best is trial 45 with value: 0.16968090137311337.
[I 2026-04-22 15:35:55,951] Trial 92 finished with value: 0.16957453096267047 and parameters: {'alpha': 618943.8283670297, 'use_snp_selection': False, 'weight_scheme': 'minmax', 'weight_clip_max': None, 'weight_minmax_eps': 0.06680462002251583}. Best is trial 45 with value: 0.16968090137311337.
[I 2026-04-22 15:36:58,099] Trial 93 finished with value: 0.16858672596627822 and parameters: {'alpha': 294231.3788408518, 'use_snp_selection': False, 'weight_scheme': 'minmax', 'weight_clip_max': None, 'weight_minmax_eps': 0.06765462238010153}. Best is trial 45 with value: 0.16968090137311337.
[I 2026-04-22 15:37:58,397] Trial 94 finished with value: 0.16971660410509756 and parameters: {'alpha': 563848.1587902616, 'use_snp_selection': False, 'weight_scheme': 'minmax', 'weight_clip_max': None, 'weight_minmax_eps': 0.04463907678239649}. Best is trial 94 with value: 0.16971660410509756.
[I 2026-04-22 15:38:57,982] Trial 95 finished with value: 0.16778193294572075 and parameters: {'alpha': 235125.42182415686, 'use_snp_selection': False, 'weight_scheme': 'minmax', 'weight_clip_max': None, 'weight_minmax_eps': 0.04426014608940032}. Best is trial 94 with value: 0.16971660410509756.
[I 2026-04-22 15:40:25,432] Trial 96 finished with value: 0.1533945093561564 and parameters: {'alpha': 2440923.3763073636, 'use_snp_selection': True, 'num_snps': 13354, 'weight_scheme': 'minmax', 'weight_clip_max': None, 'weight_minmax_eps': 0.05154077409842883}. Best is trial 94 with value: 0.16971660410509756.
[I 2026-04-22 15:41:25,726] Trial 97 finished with value: 0.16097938159669742 and parameters: {'alpha': 918268.2257771939, 'use_snp_selection': False, 'weight_scheme': 'linear', 'weight_clip_max': None, 'weight_linear_min_weight': 0.8974904745196741, 'weight_linear_max_weight': 1.6978509894512928}. Best is trial 94 with value: 0.16971660410509756.
[I 2026-04-22 15:42:22,506] Trial 98 finished with value: 0.133393428235708 and parameters: {'alpha': 6196.2581078608655, 'use_snp_selection': False, 'weight_scheme': 'minmax', 'weight_clip_max': 10.0, 'weight_minmax_eps': 0.04018662778800294}. Best is trial 94 with value: 0.16971660410509756.
[I 2026-04-22 15:43:16,237] Trial 99 finished with value: 0.16898159389005324 and parameters: {'alpha': 331034.0805870854, 'use_snp_selection': False, 'weight_scheme': 'minmax', 'weight_clip_max': None, 'weight_minmax_eps': 0.05436211844268944}. Best is trial 94 with value: 0.16971660410509756.
