[I 2026-04-30 01:52:29,745] Trial 110 finished with value: 0.1448990724449194 and parameters: {'alpha': 605141.1714631402, 'use_snp_selection': False, 'iw_method': 'pc_logistic', 'iw_clip_max': 5.0, 'iw_prob_clip': 0.04099810631261002, 'iw_n_components': 40, 'iw_logistic_c': 0.0008138088906882148, 'iw_pca_fit': 'combined', 'iw_solver': 'lbfgs', 'iw_rho': 0.75}. Best is trial 76 with value: 0.1624323602744037.
[I 2026-04-30 01:56:31,447] Trial 111 finished with value: 0.15709234401655736 and parameters: {'alpha': 841011.471503249, 'use_snp_selection': False, 'iw_method': 'pc_logistic', 'iw_clip_max': 5.0, 'iw_prob_clip': 0.001425305565603553, 'iw_n_components': 40, 'iw_logistic_c': 0.000293863846261843, 'iw_pca_fit': 'combined', 'iw_solver': 'lbfgs', 'iw_rho': 0.75}. Best is trial 76 with value: 0.1624323602744037.
[I 2026-04-30 02:00:12,369] Trial 112 finished with value: 0.16061450778690495 and parameters: {'alpha': 810815.1387046766, 'use_snp_selection': False, 'iw_method': 'pc_logistic', 'iw_clip_max': 5.0, 'iw_prob_clip': 0.0015284955320520556, 'iw_n_components': 20, 'iw_logistic_c': 0.0002616948469900043, 'iw_pca_fit': 'combined', 'iw_solver': 'lbfgs', 'iw_rho': 0.75}. Best is trial 76 with value: 0.1624323602744037.
[I 2026-04-30 02:04:00,413] Trial 113 finished with value: 0.13982933947637627 and parameters: {'alpha': 75625.78043192513, 'use_snp_selection': False, 'iw_method': 'pc_logistic', 'iw_clip_max': 5.0, 'iw_prob_clip': 0.0010881987174530248, 'iw_n_components': 20, 'iw_logistic_c': 0.00017234739213392038, 'iw_pca_fit': 'combined', 'iw_solver': 'lbfgs', 'iw_rho': 0.75}. Best is trial 76 with value: 0.1624323602744037.
[I 2026-04-30 02:07:57,987] Trial 114 finished with value: 0.1604330816812243 and parameters: {'alpha': 906251.4065275571, 'use_snp_selection': False, 'iw_method': 'pc_logistic', 'iw_clip_max': 5.0, 'iw_prob_clip': 0.0016170387426525424, 'iw_n_components': 40, 'iw_logistic_c': 0.00037503936307659567, 'iw_pca_fit': 'combined', 'iw_solver': 'lbfgs', 'iw_rho': 0.75}. Best is trial 76 with value: 0.1624323602744037.
[I 2026-04-30 02:12:00,186] Trial 115 finished with value: 0.1481215125340742 and parameters: {'alpha': 913166.6114283031, 'use_snp_selection': False, 'iw_method': 'pc_logistic', 'iw_clip_max': 5.0, 'iw_prob_clip': 0.027987513836413437, 'iw_n_components': 40, 'iw_logistic_c': 0.0008109723260322483, 'iw_pca_fit': 'combined', 'iw_solver': 'lbfgs', 'iw_rho': 0.75}. Best is trial 76 with value: 0.1624323602744037.
[I 2026-04-30 02:16:08,606] Trial 116 finished with value: 0.15277020036621314 and parameters: {'alpha': 792769.8455616531, 'use_snp_selection': False, 'iw_method': 'pc_logistic', 'iw_clip_max': 5.0, 'iw_prob_clip': 0.0015557244464296622, 'iw_n_components': 40, 'iw_logistic_c': 0.011268755355701359, 'iw_pca_fit': 'combined', 'iw_solver': 'lbfgs', 'iw_rho': 0.75}. Best is trial 76 with value: 0.1624323602744037.
[I 2026-04-30 02:20:14,207] Trial 117 finished with value: 0.14939974266236764 and parameters: {'alpha': 665479.0986028855, 'use_snp_selection': False, 'iw_method': 'pc_logistic', 'iw_clip_max': 5.0, 'iw_prob_clip': 0.007338916275004704, 'iw_n_components': 40, 'iw_logistic_c': 0.004541518194085481, 'iw_pca_fit': 'combined', 'iw_solver': 'lbfgs', 'iw_rho': 0.75}. Best is trial 76 with value: 0.1624323602744037.
[I 2026-04-30 02:24:06,238] Trial 118 finished with value: 0.15893865152122896 and parameters: {'alpha': 872287.1834622659, 'use_snp_selection': False, 'iw_method': 'pc_logistic', 'iw_clip_max': 5.0, 'iw_prob_clip': 0.001297387861562691, 'iw_n_components': 30, 'iw_logistic_c': 8.814980991322153e-05, 'iw_pca_fit': 'combined', 'iw_solver': 'lbfgs', 'iw_rho': 0.9}. Best is trial 76 with value: 0.1624323602744037.
[I 2026-04-30 02:28:29,103] Trial 119 finished with value: 0.15587149443015938 and parameters: {'alpha': 752161.1195303252, 'use_snp_selection': False, 'iw_method': 'pc_logistic', 'iw_clip_max': 5.0, 'iw_prob_clip': 0.001806624822826455, 'iw_n_components': 40, 'iw_logistic_c': 0.0022885758490269457, 'iw_pca_fit': 'combined', 'iw_solver': 'lbfgs', 'iw_rho': 0.75}. Best is trial 76 with value: 0.1624323602744037.
[I 2026-04-30 02:32:05,804] Trial 120 finished with value: 0.15498608218266016 and parameters: {'alpha': 802426.5695281874, 'use_snp_selection': False, 'iw_method': 'pc_logistic', 'iw_clip_max': 5.0, 'iw_prob_clip': 0.0013595299214357386, 'iw_n_components': 10, 'iw_logistic_c': 0.0004062261209897887, 'iw_pca_fit': 'combined', 'iw_solver': 'lbfgs', 'iw_rho': 0.75}. Best is trial 76 with value: 0.1624323602744037.
[I 2026-04-30 02:35:54,693] Trial 121 finished with value: 0.16036306115083943 and parameters: {'alpha': 999430.4634191914, 'use_snp_selection': False, 'iw_method': 'pc_logistic', 'iw_clip_max': 5.0, 'iw_prob_clip': 0.002108900542698504, 'iw_n_components': 20, 'iw_logistic_c': 0.00016128517718886533, 'iw_pca_fit': 'combined', 'iw_solver': 'lbfgs', 'iw_rho': 0.75}. Best is trial 76 with value: 0.1624323602744037.
[I 2026-04-30 02:39:36,039] Trial 122 finished with value: 0.1625037247174263 and parameters: {'alpha': 899260.0095479371, 'use_snp_selection': False, 'iw_method': 'pc_logistic', 'iw_clip_max': 5.0, 'iw_prob_clip': 0.0021723519120526846, 'iw_n_components': 20, 'iw_logistic_c': 0.00014135060684435715, 'iw_pca_fit': 'combined', 'iw_solver': 'lbfgs', 'iw_rho': 0.75}. Best is trial 122 with value: 0.1625037247174263.
[I 2026-04-30 02:42:30,849] Trial 123 finished with value: 0.14560113667734234 and parameters: {'alpha': 902674.843125716, 'use_snp_selection': False, 'iw_method': 'pc_logistic', 'iw_clip_max': 5.0, 'iw_prob_clip': 0.0016374101944821213, 'iw_n_components': 5, 'iw_logistic_c': 4.1710297002662595e-05, 'iw_pca_fit': 'combined', 'iw_solver': 'lbfgs', 'iw_rho': 0.75}. Best is trial 122 with value: 0.1625037247174263.
[I 2026-04-30 02:46:35,504] Trial 124 finished with value: 0.15869301042593584 and parameters: {'alpha': 998378.1180255412, 'use_snp_selection': False, 'iw_method': 'pc_logistic', 'iw_clip_max': 5.0, 'iw_prob_clip': 0.0021950147532414236, 'iw_n_components': 50, 'iw_logistic_c': 0.00017253039345055393, 'iw_pca_fit': 'combined', 'iw_solver': 'lbfgs', 'iw_rho': 0.75}. Best is trial 122 with value: 0.1625037247174263.
[I 2026-04-30 02:50:28,036] Trial 125 finished with value: 0.15412490917682445 and parameters: {'alpha': 937476.534930627, 'use_snp_selection': False, 'iw_method': 'pc_logistic', 'iw_clip_max': 1.5, 'iw_prob_clip': 0.0018601246714286745, 'iw_n_components': 20, 'iw_logistic_c': 0.00013799324444743993, 'iw_pca_fit': 'combined', 'iw_solver': 'lbfgs', 'iw_rho': 0.75}. Best is trial 122 with value: 0.1625037247174263.
[I 2026-04-30 02:53:02,029] Trial 126 finished with value: 0.13637405038497674 and parameters: {'alpha': 835533.7048769434, 'use_snp_selection': False, 'iw_method': 'pc_logistic', 'iw_clip_max': 5.0, 'iw_prob_clip': 0.001535869578426737, 'iw_n_components': 1, 'iw_logistic_c': 0.0002329184630895414, 'iw_pca_fit': 'combined', 'iw_solver': 'lbfgs', 'iw_rho': 0.75}. Best is trial 122 with value: 0.1625037247174263.
[I 2026-04-30 02:53:29,578] Trial 127 finished with value: 0.13442366549445636 and parameters: {'alpha': 878985.01747216, 'use_snp_selection': False, 'iw_method': 'uniform'}. Best is trial 122 with value: 0.1625037247174263.
[I 2026-04-30 02:57:16,512] Trial 128 finished with value: 0.15329290618483396 and parameters: {'alpha': 306304.1052504077, 'use_snp_selection': False, 'iw_method': 'pc_logistic', 'iw_clip_max': 2.0, 'iw_prob_clip': 0.00218496347315047, 'iw_n_components': 20, 'iw_logistic_c': 0.0002803587604414941, 'iw_pca_fit': 'combined', 'iw_solver': 'lbfgs', 'iw_rho': 0.75}. Best is trial 122 with value: 0.1625037247174263.
[I 2026-04-30 03:01:04,282] Trial 129 finished with value: 0.16226218498903008 and parameters: {'alpha': 937998.7139285422, 'use_snp_selection': False, 'iw_method': 'pc_logistic', 'iw_clip_max': 5.0, 'iw_prob_clip': 0.002483738734716319, 'iw_n_components': 20, 'iw_logistic_c': 9.130122625219379e-05, 'iw_pca_fit': 'combined', 'iw_solver': 'lbfgs', 'iw_rho': 0.9}. Best is trial 122 with value: 0.1625037247174263.
[I 2026-04-30 03:04:51,852] Trial 130 finished with value: 0.16022082009235758 and parameters: {'alpha': 773420.1349942845, 'use_snp_selection': False, 'iw_method': 'pc_logistic', 'iw_clip_max': 5.0, 'iw_prob_clip': 0.002414816846120359, 'iw_n_components': 20, 'iw_logistic_c': 4.8665564231267606e-05, 'iw_pca_fit': 'combined', 'iw_solver': 'lbfgs', 'iw_rho': 0.9}. Best is trial 122 with value: 0.1625037247174263.
[I 2026-04-30 03:08:33,759] Trial 131 finished with value: 0.1590516490183223 and parameters: {'alpha': 781891.4394546394, 'use_snp_selection': False, 'iw_method': 'pc_logistic', 'iw_clip_max': 5.0, 'iw_prob_clip': 0.0025420873849690577, 'iw_n_components': 20, 'iw_logistic_c': 4.940767926188371e-05, 'iw_pca_fit': 'combined', 'iw_solver': 'lbfgs', 'iw_rho': 0.9}. Best is trial 122 with value: 0.1625037247174263.
[I 2026-04-30 03:12:19,082] Trial 132 finished with value: 0.16014546028732565 and parameters: {'alpha': 851796.7816175176, 'use_snp_selection': False, 'iw_method': 'pc_logistic', 'iw_clip_max': 5.0, 'iw_prob_clip': 0.002219286061454937, 'iw_n_components': 20, 'iw_logistic_c': 8.77255605504458e-05, 'iw_pca_fit': 'combined', 'iw_solver': 'lbfgs', 'iw_rho': 0.9}. Best is trial 122 with value: 0.1625037247174263.
[I 2026-04-30 03:16:02,463] Trial 133 finished with value: 0.1608521886472524 and parameters: {'alpha': 927919.3810188923, 'use_snp_selection': False, 'iw_method': 'pc_logistic', 'iw_clip_max': 5.0, 'iw_prob_clip': 0.0019494279527476337, 'iw_n_components': 20, 'iw_logistic_c': 1.8607676134597417e-05, 'iw_pca_fit': 'combined', 'iw_solver': 'lbfgs', 'iw_rho': 0.9}. Best is trial 122 with value: 0.1625037247174263.
[I 2026-04-30 03:19:45,824] Trial 134 finished with value: 0.1603350394491682 and parameters: {'alpha': 931262.8305214039, 'use_snp_selection': False, 'iw_method': 'pc_logistic', 'iw_clip_max': 5.0, 'iw_prob_clip': 0.002415814836572231, 'iw_n_components': 20, 'iw_logistic_c': 1.6988895237189482e-05, 'iw_pca_fit': 'combined', 'iw_solver': 'lbfgs', 'iw_rho': 0.9}. Best is trial 122 with value: 0.1625037247174263.
[I 2026-04-30 03:23:28,326] Trial 135 finished with value: 0.15764904678646852 and parameters: {'alpha': 927445.7439297183, 'use_snp_selection': False, 'iw_method': 'pc_logistic', 'iw_clip_max': 5.0, 'iw_prob_clip': 0.0025289232345775256, 'iw_n_components': 20, 'iw_logistic_c': 4.801858974562676e-06, 'iw_pca_fit': 'combined', 'iw_solver': 'lbfgs', 'iw_rho': 0.9}. Best is trial 122 with value: 0.1625037247174263.
[I 2026-04-30 03:27:24,717] Trial 136 finished with value: 0.16341225076798863 and parameters: {'alpha': 941181.6072456056, 'use_snp_selection': False, 'iw_method': 'pc_logistic', 'iw_clip_max': 5.0, 'iw_prob_clip': 0.0020596679944042628, 'iw_n_components': 20, 'iw_logistic_c': 0.0012377604699006482, 'iw_pca_fit': 'combined', 'iw_solver': 'lbfgs', 'iw_rho': 0.9}. Best is trial 136 with value: 0.16341225076798863.
[I 2026-04-30 03:31:17,373] Trial 137 finished with value: 0.16061185699523634 and parameters: {'alpha': 812199.1889549871, 'use_snp_selection': False, 'iw_method': 'pc_logistic', 'iw_clip_max': 5.0, 'iw_prob_clip': 0.0021079891956923788, 'iw_n_components': 20, 'iw_logistic_c': 3.1413076206868546e-05, 'iw_pca_fit': 'combined', 'iw_solver': 'lbfgs', 'iw_rho': 0.9}. Best is trial 136 with value: 0.16341225076798863.
[I 2026-04-30 03:35:04,909] Trial 138 finished with value: 0.1574745492229002 and parameters: {'alpha': 735364.5198348413, 'use_snp_selection': False, 'iw_method': 'pc_logistic', 'iw_clip_max': 5.0, 'iw_prob_clip': 0.00194062304451683, 'iw_n_components': 20, 'iw_logistic_c': 1.1928266623257047e-05, 'iw_pca_fit': 'combined', 'iw_solver': 'lbfgs', 'iw_rho': 0.9}. Best is trial 136 with value: 0.16341225076798863.
[I 2026-04-30 03:38:50,209] Trial 139 finished with value: 0.1609836106048487 and parameters: {'alpha': 827040.8277244255, 'use_snp_selection': False, 'iw_method': 'pc_logistic', 'iw_clip_max': 5.0, 'iw_prob_clip': 0.001800812530719143, 'iw_n_components': 20, 'iw_logistic_c': 2.5619736448752228e-05, 'iw_pca_fit': 'combined', 'iw_solver': 'lbfgs', 'iw_rho': 0.9}. Best is trial 136 with value: 0.16341225076798863.
[I 2026-04-30 03:42:36,516] Trial 140 finished with value: 0.15820637729113934 and parameters: {'alpha': 684304.5822800015, 'use_snp_selection': False, 'iw_method': 'pc_logistic', 'iw_clip_max': 5.0, 'iw_prob_clip': 0.0017766883347735826, 'iw_n_components': 20, 'iw_logistic_c': 2.3908051755813694e-05, 'iw_pca_fit': 'combined', 'iw_solver': 'lbfgs', 'iw_rho': 0.9}. Best is trial 136 with value: 0.16341225076798863.
[I 2026-04-30 03:46:34,174] Trial 141 finished with value: 0.1588755313421724 and parameters: {'alpha': 818685.4629167162, 'use_snp_selection': False, 'iw_method': 'pc_logistic', 'iw_clip_max': 5.0, 'iw_prob_clip': 0.001962341682668491, 'iw_n_components': 20, 'iw_logistic_c': 0.001219331051409272, 'iw_pca_fit': 'combined', 'iw_solver': 'lbfgs', 'iw_rho': 0.9}. Best is trial 136 with value: 0.16341225076798863.
[I 2026-04-30 03:50:16,800] Trial 142 finished with value: 0.1580312757171248 and parameters: {'alpha': 857271.0640843356, 'use_snp_selection': False, 'iw_method': 'pc_logistic', 'iw_clip_max': 5.0, 'iw_prob_clip': 0.0010099227534016088, 'iw_n_components': 20, 'iw_logistic_c': 1.0512928909883606e-05, 'iw_pca_fit': 'combined', 'iw_solver': 'lbfgs', 'iw_rho': 0.9}. Best is trial 136 with value: 0.16341225076798863.
[I 2026-04-30 03:53:56,773] Trial 143 finished with value: 0.1593488012472368 and parameters: {'alpha': 789484.0170306416, 'use_snp_selection': False, 'iw_method': 'pc_logistic', 'iw_clip_max': 5.0, 'iw_prob_clip': 0.0012238298714469763, 'iw_n_components': 20, 'iw_logistic_c': 3.140618002702686e-05, 'iw_pca_fit': 'combined', 'iw_solver': 'lbfgs', 'iw_rho': 0.9}. Best is trial 136 with value: 0.16341225076798863.
[I 2026-04-30 03:57:46,308] Trial 144 finished with value: 0.15812267828088955 and parameters: {'alpha': 930365.521173248, 'use_snp_selection': False, 'iw_method': 'pc_logistic', 'iw_clip_max': 5.0, 'iw_prob_clip': 0.0016992333332091958, 'iw_n_components': 20, 'iw_logistic_c': 6.965367897458977e-06, 'iw_pca_fit': 'combined', 'iw_solver': 'lbfgs', 'iw_rho': 0.9}. Best is trial 136 with value: 0.16341225076798863.
[I 2026-04-30 04:01:39,491] Trial 145 finished with value: 0.15141530256157473 and parameters: {'alpha': 819775.4252365659, 'use_snp_selection': False, 'iw_method': 'pc_logistic', 'iw_clip_max': 5.0, 'iw_prob_clip': 0.001154053601284597, 'iw_n_components': 20, 'iw_logistic_c': 2.6679493309984563, 'iw_pca_fit': 'combined', 'iw_solver': 'lbfgs', 'iw_rho': 0.9}. Best is trial 136 with value: 0.16341225076798863.
[I 2026-04-30 04:05:11,932] Trial 146 finished with value: 0.15965057598362603 and parameters: {'alpha': 732563.9867109488, 'use_snp_selection': False, 'iw_method': 'pc_logistic', 'iw_clip_max': 5.0, 'iw_prob_clip': 0.0013699787666083716, 'iw_n_components': 10, 'iw_logistic_c': 1.619593342397838e-05, 'iw_pca_fit': 'combined', 'iw_solver': 'lbfgs', 'iw_rho': 0.9}. Best is trial 136 with value: 0.16341225076798863.
[I 2026-04-30 04:08:58,279] Trial 147 finished with value: 0.15552633408729535 and parameters: {'alpha': 895743.4055205185, 'use_snp_selection': False, 'iw_method': 'pc_logistic', 'iw_clip_max': 1.5, 'iw_prob_clip': 0.002101253864611571, 'iw_n_components': 20, 'iw_logistic_c': 0.0004271177365883824, 'iw_pca_fit': 'combined', 'iw_solver': 'lbfgs', 'iw_rho': 0.9}. Best is trial 136 with value: 0.16341225076798863.
[I 2026-04-30 04:12:44,315] Trial 148 finished with value: 0.16053956313415774 and parameters: {'alpha': 638748.2976241319, 'use_snp_selection': False, 'iw_method': 'pc_logistic', 'iw_clip_max': 5.0, 'iw_prob_clip': 0.0025888432346733974, 'iw_n_components': 20, 'iw_logistic_c': 0.000631838305129074, 'iw_pca_fit': 'combined', 'iw_solver': 'lbfgs', 'iw_rho': 0.9}. Best is trial 136 with value: 0.16341225076798863.
[I 2026-04-30 04:13:12,460] Trial 149 finished with value: 0.13467128769126702 and parameters: {'alpha': 629244.9718771961, 'use_snp_selection': False, 'iw_method': 'uniform'}. Best is trial 136 with value: 0.16341225076798863.
