Running from this directory: /cluster/work/simennes/Master_thesis
Name of job: ncv_ridge_iw
ID of job: 24378201
Array task ID: 2
The job was run on these nodes: idun-03-08
[I 2026-05-04 00:17:27,555] Trial 0 finished with value: 0.1957601426130459 and parameters: {'alpha': 574323.565896313, 'use_snp_selection': False, 'iw_method': 'pc_logistic', 'iw_clip_max': 2.0, 'iw_prob_clip': 0.005989214663243749, 'iw_n_components': 20, 'iw_logistic_c': 2.8870927958158354, 'iw_pca_fit': 'combined', 'iw_solver': 'lbfgs', 'iw_rho': 1.0}. Best is trial 0 with value: 0.1957601426130459.
[I 2026-05-04 00:20:20,578] Trial 1 finished with value: 0.19082841840150538 and parameters: {'alpha': 145427.84270397192, 'use_snp_selection': False, 'iw_method': 'pc_logistic', 'iw_clip_max': 2.0, 'iw_prob_clip': 0.0022034134189735897, 'iw_n_components': 10, 'iw_logistic_c': 8.53225823447423, 'iw_pca_fit': 'combined', 'iw_solver': 'lbfgs', 'iw_rho': 1.0}. Best is trial 0 with value: 0.1957601426130459.
[I 2026-05-04 00:23:25,282] Trial 2 finished with value: 0.1918986495245437 and parameters: {'alpha': 337268.1824826383, 'use_snp_selection': False, 'iw_method': 'pc_logistic', 'iw_clip_max': 1.25, 'iw_prob_clip': 0.0011214380556681478, 'iw_n_components': 40, 'iw_logistic_c': 0.0004456301044046966, 'iw_pca_fit': 'combined', 'iw_solver': 'lbfgs', 'iw_rho': 0.5}. Best is trial 0 with value: 0.1957601426130459.
[I 2026-05-04 00:26:27,352] Trial 3 finished with value: 0.1839734370966379 and parameters: {'alpha': 623873.8362358484, 'use_snp_selection': False, 'iw_method': 'pc_logistic', 'iw_clip_max': 2.0, 'iw_prob_clip': 0.0010704282286164728, 'iw_n_components': 30, 'iw_logistic_c': 0.003649078989687946, 'iw_pca_fit': 'combined', 'iw_solver': 'lbfgs', 'iw_rho': 0.9}. Best is trial 0 with value: 0.1957601426130459.
[I 2026-05-04 00:27:00,396] Trial 4 finished with value: 0.18266784089583252 and parameters: {'alpha': 1199521.094898443, 'use_snp_selection': False, 'iw_method': 'uniform'}. Best is trial 0 with value: 0.1957601426130459.
[I 2026-05-04 00:30:07,421] Trial 5 finished with value: 0.1950003000148612 and parameters: {'alpha': 594205.5826125565, 'use_snp_selection': False, 'iw_method': 'pc_logistic', 'iw_clip_max': 1.5, 'iw_prob_clip': 0.017782866059784724, 'iw_n_components': 40, 'iw_logistic_c': 0.3876202021284575, 'iw_pca_fit': 'combined', 'iw_solver': 'lbfgs', 'iw_rho': 0.5}. Best is trial 0 with value: 0.1957601426130459.
[I 2026-05-04 00:32:59,697] Trial 6 finished with value: 0.1929821713682751 and parameters: {'alpha': 102431.18633356069, 'use_snp_selection': False, 'iw_method': 'pc_logistic', 'iw_clip_max': 1.25, 'iw_prob_clip': 0.0017147683107745938, 'iw_n_components': 20, 'iw_logistic_c': 4.32601466983518e-06, 'iw_pca_fit': 'combined', 'iw_solver': 'lbfgs', 'iw_rho': 0.9}. Best is trial 0 with value: 0.1957601426130459.
[I 2026-05-04 00:36:01,230] Trial 7 finished with value: 0.18517508803897903 and parameters: {'alpha': 1830941.3950631474, 'use_snp_selection': False, 'iw_method': 'pc_logistic', 'iw_clip_max': 2.0, 'iw_prob_clip': 0.006357173651119782, 'iw_n_components': 40, 'iw_logistic_c': 1.7003213055010015e-05, 'iw_pca_fit': 'combined', 'iw_solver': 'lbfgs', 'iw_rho': 0.5}. Best is trial 0 with value: 0.1957601426130459.
[I 2026-05-04 00:36:34,250] Trial 8 finished with value: 0.1825574092489206 and parameters: {'alpha': 1221444.8156569519, 'use_snp_selection': False, 'iw_method': 'uniform'}. Best is trial 0 with value: 0.1957601426130459.
[I 2026-05-04 00:37:07,287] Trial 9 finished with value: 0.1919521905565027 and parameters: {'alpha': 201218.30977627521, 'use_snp_selection': False, 'iw_method': 'uniform'}. Best is trial 0 with value: 0.1957601426130459.
[I 2026-05-04 00:37:40,320] Trial 10 finished with value: 0.1777852091200243 and parameters: {'alpha': 2974690.6878723423, 'use_snp_selection': False, 'iw_method': 'uniform'}. Best is trial 0 with value: 0.1957601426130459.
[I 2026-05-04 00:40:49,303] Trial 11 finished with value: 0.19566643575180515 and parameters: {'alpha': 544412.1535787785, 'use_snp_selection': False, 'iw_method': 'pc_logistic', 'iw_clip_max': 1.5, 'iw_prob_clip': 0.03253748775818947, 'iw_n_components': 60, 'iw_logistic_c': 4.194052794089771, 'iw_pca_fit': 'combined', 'iw_solver': 'lbfgs', 'iw_rho': 0.75}. Best is trial 0 with value: 0.1957601426130459.
[I 2026-05-04 00:43:58,374] Trial 12 finished with value: 0.20049461763435614 and parameters: {'alpha': 362139.94542408496, 'use_snp_selection': False, 'iw_method': 'pc_logistic', 'iw_clip_max': 5.0, 'iw_prob_clip': 0.04190794325587595, 'iw_n_components': 60, 'iw_logistic_c': 0.36117805405698045, 'iw_pca_fit': 'combined', 'iw_solver': 'lbfgs', 'iw_rho': 0.75}. Best is trial 12 with value: 0.20049461763435614.
[I 2026-05-04 00:47:08,527] Trial 13 finished with value: 0.19795420410638515 and parameters: {'alpha': 293277.7109185333, 'use_snp_selection': False, 'iw_method': 'pc_logistic', 'iw_clip_max': 5.0, 'iw_prob_clip': 0.006915816998775737, 'iw_n_components': 60, 'iw_logistic_c': 0.08029098569344124, 'iw_pca_fit': 'combined', 'iw_solver': 'lbfgs', 'iw_rho': 0.75}. Best is trial 12 with value: 0.20049461763435614.
[I 2026-05-04 00:50:18,796] Trial 14 finished with value: 0.20106727722829137 and parameters: {'alpha': 303576.926249874, 'use_snp_selection': False, 'iw_method': 'pc_logistic', 'iw_clip_max': 5.0, 'iw_prob_clip': 0.04100893821849808, 'iw_n_components': 60, 'iw_logistic_c': 0.032935910559439376, 'iw_pca_fit': 'combined', 'iw_solver': 'lbfgs', 'iw_rho': 0.75}. Best is trial 14 with value: 0.20106727722829137.
[I 2026-05-04 00:53:28,581] Trial 15 finished with value: 0.20251820288029734 and parameters: {'alpha': 342233.4108791827, 'use_snp_selection': False, 'iw_method': 'pc_logistic', 'iw_clip_max': 5.0, 'iw_prob_clip': 0.04143235470262949, 'iw_n_components': 60, 'iw_logistic_c': 0.021771260507993884, 'iw_pca_fit': 'combined', 'iw_solver': 'lbfgs', 'iw_rho': 0.75}. Best is trial 15 with value: 0.20251820288029734.
[I 2026-05-04 00:56:36,042] Trial 16 finished with value: 0.19546072520809635 and parameters: {'alpha': 214059.0145026405, 'use_snp_selection': False, 'iw_method': 'pc_logistic', 'iw_clip_max': 5.0, 'iw_prob_clip': 0.016402554993722118, 'iw_n_components': 50, 'iw_logistic_c': 0.009051175986396178, 'iw_pca_fit': 'combined', 'iw_solver': 'lbfgs', 'iw_rho': 0.75}. Best is trial 15 with value: 0.20251820288029734.
[I 2026-05-04 00:59:48,198] Trial 17 finished with value: 0.2018549233454559 and parameters: {'alpha': 224327.05598788502, 'use_snp_selection': False, 'iw_method': 'pc_logistic', 'iw_clip_max': 3.0, 'iw_prob_clip': 0.021808188341678955, 'iw_n_components': 80, 'iw_logistic_c': 0.00019274512509973133, 'iw_pca_fit': 'combined', 'iw_solver': 'lbfgs', 'iw_rho': 0.75}. Best is trial 15 with value: 0.20251820288029734.
[I 2026-05-04 01:00:21,163] Trial 18 finished with value: 0.19263661792801398 and parameters: {'alpha': 145370.11325579343, 'use_snp_selection': False, 'iw_method': 'uniform'}. Best is trial 15 with value: 0.20251820288029734.
[I 2026-05-04 01:03:33,083] Trial 19 finished with value: 0.20108233597749714 and parameters: {'alpha': 228259.5093109888, 'use_snp_selection': False, 'iw_method': 'pc_logistic', 'iw_clip_max': 3.0, 'iw_prob_clip': 0.01604991630193283, 'iw_n_components': 80, 'iw_logistic_c': 0.00024333662014302455, 'iw_pca_fit': 'combined', 'iw_solver': 'lbfgs', 'iw_rho': 0.75}. Best is trial 15 with value: 0.20251820288029734.
[I 2026-05-04 01:06:41,799] Trial 20 finished with value: 0.19086001841516478 and parameters: {'alpha': 424843.2347286195, 'use_snp_selection': False, 'iw_method': 'pc_logistic', 'iw_clip_max': 3.0, 'iw_prob_clip': 0.0005118906388926223, 'iw_n_components': 80, 'iw_logistic_c': 2.0225142138745626e-07, 'iw_pca_fit': 'combined', 'iw_solver': 'lbfgs', 'iw_rho': 0.75}. Best is trial 15 with value: 0.20251820288029734.
[I 2026-05-04 01:10:20,674] Trial 21 finished with value: 0.20035848551664953 and parameters: {'alpha': 225541.41044930104, 'use_snp_selection': False, 'iw_method': 'pc_logistic', 'iw_clip_max': 3.0, 'iw_prob_clip': 0.017929981710424696, 'iw_n_components': 80, 'iw_logistic_c': 0.0002515169700319854, 'iw_pca_fit': 'combined', 'iw_solver': 'lbfgs', 'iw_rho': 0.75}. Best is trial 15 with value: 0.20251820288029734.
[I 2026-05-04 01:14:08,770] Trial 22 finished with value: 0.19767817126277826 and parameters: {'alpha': 163739.0932758771, 'use_snp_selection': False, 'iw_method': 'pc_logistic', 'iw_clip_max': 3.0, 'iw_prob_clip': 0.011706196049566027, 'iw_n_components': 80, 'iw_logistic_c': 4.8914414044225696e-05, 'iw_pca_fit': 'combined', 'iw_solver': 'lbfgs', 'iw_rho': 0.75}. Best is trial 15 with value: 0.20251820288029734.
[I 2026-05-04 01:18:28,382] Trial 23 finished with value: 0.1982679902384591 and parameters: {'alpha': 105908.96657144849, 'use_snp_selection': False, 'iw_method': 'pc_logistic', 'iw_clip_max': 3.0, 'iw_prob_clip': 0.026331977157133656, 'iw_n_components': 80, 'iw_logistic_c': 0.0009464831154905116, 'iw_pca_fit': 'combined', 'iw_solver': 'lbfgs', 'iw_rho': 0.75}. Best is trial 15 with value: 0.20251820288029734.
[I 2026-05-04 01:22:21,146] Trial 24 finished with value: 0.19845769973778227 and parameters: {'alpha': 254053.2628533257, 'use_snp_selection': False, 'iw_method': 'pc_logistic', 'iw_clip_max': 3.0, 'iw_prob_clip': 0.012529715168286371, 'iw_n_components': 80, 'iw_logistic_c': 0.000178203529324765, 'iw_pca_fit': 'combined', 'iw_solver': 'lbfgs', 'iw_rho': 0.75}. Best is trial 15 with value: 0.20251820288029734.
[I 2026-05-04 01:25:41,797] Trial 25 finished with value: 0.1960454281462434 and parameters: {'alpha': 467405.65283879486, 'use_snp_selection': False, 'iw_method': 'pc_logistic', 'iw_clip_max': 3.0, 'iw_prob_clip': 0.024122708639120822, 'iw_n_components': 10, 'iw_logistic_c': 2.3594048951535606e-06, 'iw_pca_fit': 'combined', 'iw_solver': 'lbfgs', 'iw_rho': 1.0}. Best is trial 15 with value: 0.20251820288029734.
[I 2026-05-04 01:29:47,589] Trial 26 finished with value: 0.19912489009665033 and parameters: {'alpha': 749820.0408968332, 'use_snp_selection': False, 'iw_method': 'pc_logistic', 'iw_clip_max': 3.0, 'iw_prob_clip': 0.047138489373759244, 'iw_n_components': 50, 'iw_logistic_c': 0.0021916985773488004, 'iw_pca_fit': 'combined', 'iw_solver': 'lbfgs', 'iw_rho': 0.9}. Best is trial 15 with value: 0.20251820288029734.
[I 2026-05-04 01:30:18,806] Trial 27 finished with value: 0.19229378257489593 and parameters: {'alpha': 175383.18461839852, 'use_snp_selection': False, 'iw_method': 'uniform'}. Best is trial 15 with value: 0.20251820288029734.
[I 2026-05-04 01:34:10,734] Trial 28 finished with value: 0.19721169880294603 and parameters: {'alpha': 873445.778876602, 'use_snp_selection': False, 'iw_method': 'pc_logistic', 'iw_clip_max': 5.0, 'iw_prob_clip': 0.008859056088117013, 'iw_n_components': 30, 'iw_logistic_c': 0.016943747365702214, 'iw_pca_fit': 'combined', 'iw_solver': 'lbfgs', 'iw_rho': 0.75}. Best is trial 15 with value: 0.20251820288029734.
[I 2026-05-04 01:38:00,285] Trial 29 finished with value: 0.20178454386997152 and parameters: {'alpha': 386084.4641213495, 'use_snp_selection': False, 'iw_method': 'pc_logistic', 'iw_clip_max': 3.0, 'iw_prob_clip': 0.024852186870287042, 'iw_n_components': 80, 'iw_logistic_c': 1.870370245916868e-05, 'iw_pca_fit': 'combined', 'iw_solver': 'lbfgs', 'iw_rho': 0.75}. Best is trial 15 with value: 0.20251820288029734.
[I 2026-05-04 01:41:50,504] Trial 30 finished with value: 0.19563837366571807 and parameters: {'alpha': 383781.81875331356, 'use_snp_selection': False, 'iw_method': 'pc_logistic', 'iw_clip_max': 1.5, 'iw_prob_clip': 0.02691787106755782, 'iw_n_components': 80, 'iw_logistic_c': 2.926891212639007e-05, 'iw_pca_fit': 'combined', 'iw_solver': 'lbfgs', 'iw_rho': 0.75}. Best is trial 15 with value: 0.20251820288029734.
[I 2026-05-04 01:46:09,357] Trial 31 finished with value: 0.20039325811201336 and parameters: {'alpha': 267114.7999067932, 'use_snp_selection': False, 'iw_method': 'pc_logistic', 'iw_clip_max': 3.0, 'iw_prob_clip': 0.019451417815032426, 'iw_n_components': 80, 'iw_logistic_c': 8.059139659454063e-05, 'iw_pca_fit': 'combined', 'iw_solver': 'lbfgs', 'iw_rho': 0.75}. Best is trial 15 with value: 0.20251820288029734.
[I 2026-05-04 01:50:01,059] Trial 32 finished with value: 0.1991485698659718 and parameters: {'alpha': 409394.1551776428, 'use_snp_selection': False, 'iw_method': 'pc_logistic', 'iw_clip_max': 3.0, 'iw_prob_clip': 0.012018349342439904, 'iw_n_components': 80, 'iw_logistic_c': 1.2556907101698193e-05, 'iw_pca_fit': 'combined', 'iw_solver': 'lbfgs', 'iw_rho': 0.75}. Best is trial 15 with value: 0.20251820288029734.
[I 2026-05-04 01:53:50,864] Trial 33 finished with value: 0.195954795252795 and parameters: {'alpha': 325307.8895875991, 'use_snp_selection': False, 'iw_method': 'pc_logistic', 'iw_clip_max': 3.0, 'iw_prob_clip': 0.03272497380206082, 'iw_n_components': 80, 'iw_logistic_c': 1.0222652564210555e-06, 'iw_pca_fit': 'combined', 'iw_solver': 'lbfgs', 'iw_rho': 0.75}. Best is trial 15 with value: 0.20251820288029734.
[I 2026-05-04 01:57:46,573] Trial 34 finished with value: 0.19240016217567157 and parameters: {'alpha': 145716.67502997792, 'use_snp_selection': False, 'iw_method': 'pc_logistic', 'iw_clip_max': 3.0, 'iw_prob_clip': 0.0036518170208789127, 'iw_n_components': 60, 'iw_logistic_c': 0.000675307429966958, 'iw_pca_fit': 'combined', 'iw_solver': 'lbfgs', 'iw_rho': 0.75}. Best is trial 15 with value: 0.20251820288029734.
[I 2026-05-04 02:01:41,535] Trial 35 finished with value: 0.20224523091395122 and parameters: {'alpha': 245241.76676407078, 'use_snp_selection': False, 'iw_method': 'pc_logistic', 'iw_clip_max': 5.0, 'iw_prob_clip': 0.03166343364954252, 'iw_n_components': 80, 'iw_logistic_c': 0.0027303163388095806, 'iw_pca_fit': 'combined', 'iw_solver': 'lbfgs', 'iw_rho': 0.75}. Best is trial 15 with value: 0.20251820288029734.
[I 2026-05-04 02:04:47,994] Trial 36 finished with value: 0.19212168715407163 and parameters: {'alpha': 472729.67300142173, 'use_snp_selection': False, 'iw_method': 'pc_logistic', 'iw_clip_max': 5.0, 'iw_prob_clip': 0.04729679933411774, 'iw_n_components': 20, 'iw_logistic_c': 0.004779468912243767, 'iw_pca_fit': 'combined', 'iw_solver': 'lbfgs', 'iw_rho': 1.0}. Best is trial 15 with value: 0.20251820288029734.
[I 2026-05-04 02:08:42,949] Trial 37 finished with value: 0.19643328792016593 and parameters: {'alpha': 190581.7890286875, 'use_snp_selection': False, 'iw_method': 'pc_logistic', 'iw_clip_max': 5.0, 'iw_prob_clip': 0.03173794848677009, 'iw_n_components': 80, 'iw_logistic_c': 0.06903889389205853, 'iw_pca_fit': 'combined', 'iw_solver': 'lbfgs', 'iw_rho': 0.5}. Best is trial 15 with value: 0.20251820288029734.
[I 2026-05-04 02:09:17,646] Trial 38 finished with value: 0.18642704582302896 and parameters: {'alpha': 653780.3223377621, 'use_snp_selection': False, 'iw_method': 'uniform'}. Best is trial 15 with value: 0.20251820288029734.
[I 2026-05-04 02:12:23,208] Trial 39 finished with value: 0.18491811442953807 and parameters: {'alpha': 341691.2952053578, 'use_snp_selection': False, 'iw_method': 'pc_logistic', 'iw_clip_max': 5.0, 'iw_prob_clip': 0.004536409179944654, 'iw_n_components': 10, 'iw_logistic_c': 0.0014984045760095058, 'iw_pca_fit': 'combined', 'iw_solver': 'lbfgs', 'iw_rho': 1.0}. Best is trial 15 with value: 0.20251820288029734.
[I 2026-05-04 02:15:53,404] Trial 40 finished with value: 0.19786718808117074 and parameters: {'alpha': 267922.1922167432, 'use_snp_selection': False, 'iw_method': 'pc_logistic', 'iw_clip_max': 1.25, 'iw_prob_clip': 0.02294470033011966, 'iw_n_components': 30, 'iw_logistic_c': 0.4539011766716327, 'iw_pca_fit': 'combined', 'iw_solver': 'lbfgs', 'iw_rho': 0.9}. Best is trial 15 with value: 0.20251820288029734.
[I 2026-05-04 02:19:21,226] Trial 41 finished with value: 0.2006859914880284 and parameters: {'alpha': 238720.7168666446, 'use_snp_selection': False, 'iw_method': 'pc_logistic', 'iw_clip_max': 5.0, 'iw_prob_clip': 0.014301707881453154, 'iw_n_components': 80, 'iw_logistic_c': 0.0001320785072150277, 'iw_pca_fit': 'combined', 'iw_solver': 'lbfgs', 'iw_rho': 0.75}. Best is trial 15 with value: 0.20251820288029734.
[I 2026-05-04 02:23:00,485] Trial 42 finished with value: 0.19948698912616186 and parameters: {'alpha': 143888.53427953736, 'use_snp_selection': False, 'iw_method': 'pc_logistic', 'iw_clip_max': 2.0, 'iw_prob_clip': 0.009379011498369552, 'iw_n_components': 80, 'iw_logistic_c': 0.0003414018260583166, 'iw_pca_fit': 'combined', 'iw_solver': 'lbfgs', 'iw_rho': 0.75}. Best is trial 15 with value: 0.20251820288029734.
[I 2026-05-04 02:26:34,023] Trial 43 finished with value: 0.20342941944393314 and parameters: {'alpha': 294480.3426965656, 'use_snp_selection': False, 'iw_method': 'pc_logistic', 'iw_clip_max': 3.0, 'iw_prob_clip': 0.035504993342461516, 'iw_n_components': 80, 'iw_logistic_c': 6.061085296755118e-06, 'iw_pca_fit': 'combined', 'iw_solver': 'lbfgs', 'iw_rho': 0.75}. Best is trial 43 with value: 0.20342941944393314.
[I 2026-05-04 02:29:52,035] Trial 44 finished with value: 0.19031156659656007 and parameters: {'alpha': 493860.8759029092, 'use_snp_selection': False, 'iw_method': 'pc_logistic', 'iw_clip_max': 1.25, 'iw_prob_clip': 0.03640507348085395, 'iw_n_components': 20, 'iw_logistic_c': 6.503739310986531e-06, 'iw_pca_fit': 'combined', 'iw_solver': 'lbfgs', 'iw_rho': 0.75}. Best is trial 43 with value: 0.20342941944393314.
[I 2026-05-04 02:30:30,811] Trial 45 finished with value: 0.19056503328022528 and parameters: {'alpha': 299007.9089650326, 'use_snp_selection': False, 'iw_method': 'uniform'}. Best is trial 43 with value: 0.20342941944393314.
[I 2026-05-04 02:33:53,638] Trial 46 finished with value: 0.1950935833400944 and parameters: {'alpha': 355290.1818195565, 'use_snp_selection': False, 'iw_method': 'pc_logistic', 'iw_clip_max': 2.0, 'iw_prob_clip': 0.022146409173367652, 'iw_n_components': 40, 'iw_logistic_c': 8.30107513206255e-07, 'iw_pca_fit': 'combined', 'iw_solver': 'lbfgs', 'iw_rho': 0.75}. Best is trial 43 with value: 0.20342941944393314.
[I 2026-05-04 02:37:41,872] Trial 47 finished with value: 0.19632618044849046 and parameters: {'alpha': 117963.05419131374, 'use_snp_selection': False, 'iw_method': 'pc_logistic', 'iw_clip_max': 1.5, 'iw_prob_clip': 0.029791804987159155, 'iw_n_components': 80, 'iw_logistic_c': 2.208788244971353e-05, 'iw_pca_fit': 'combined', 'iw_solver': 'lbfgs', 'iw_rho': 0.5}. Best is trial 43 with value: 0.20342941944393314.
[I 2026-05-04 02:41:01,514] Trial 48 finished with value: 0.19852805579304733 and parameters: {'alpha': 201560.07917895255, 'use_snp_selection': False, 'iw_method': 'pc_logistic', 'iw_clip_max': 3.0, 'iw_prob_clip': 0.04700227286152783, 'iw_n_components': 50, 'iw_logistic_c': 0.004935210375099761, 'iw_pca_fit': 'combined', 'iw_solver': 'lbfgs', 'iw_rho': 0.9}. Best is trial 43 with value: 0.20342941944393314.
[I 2026-05-04 02:41:37,095] Trial 49 finished with value: 0.18761047927898006 and parameters: {'alpha': 535580.5538017801, 'use_snp_selection': False, 'iw_method': 'uniform'}. Best is trial 43 with value: 0.20342941944393314.
[I 2026-05-04 02:45:14,947] Trial 50 finished with value: 0.20348261925254355 and parameters: {'alpha': 272495.00780899916, 'use_snp_selection': False, 'iw_method': 'pc_logistic', 'iw_clip_max': 5.0, 'iw_prob_clip': 0.03578478314759297, 'iw_n_components': 60, 'iw_logistic_c': 6.375946498678496e-06, 'iw_pca_fit': 'combined', 'iw_solver': 'lbfgs', 'iw_rho': 1.0}. Best is trial 50 with value: 0.20348261925254355.
[I 2026-05-04 02:48:34,320] Trial 51 finished with value: 0.203190485989922 and parameters: {'alpha': 286064.4656459267, 'use_snp_selection': False, 'iw_method': 'pc_logistic', 'iw_clip_max': 5.0, 'iw_prob_clip': 0.03623960901444616, 'iw_n_components': 60, 'iw_logistic_c': 6.30587709718021e-06, 'iw_pca_fit': 'combined', 'iw_solver': 'lbfgs', 'iw_rho': 1.0}. Best is trial 50 with value: 0.20348261925254355.
[I 2026-05-04 02:52:12,127] Trial 52 finished with value: 0.2034494719441692 and parameters: {'alpha': 273190.9474625866, 'use_snp_selection': False, 'iw_method': 'pc_logistic', 'iw_clip_max': 5.0, 'iw_prob_clip': 0.037278338193134745, 'iw_n_components': 60, 'iw_logistic_c': 3.5487960547801835e-06, 'iw_pca_fit': 'combined', 'iw_solver': 'lbfgs', 'iw_rho': 1.0}. Best is trial 50 with value: 0.20348261925254355.
[I 2026-05-04 02:55:35,991] Trial 53 finished with value: 0.19235833284119538 and parameters: {'alpha': 280362.4271611615, 'use_snp_selection': False, 'iw_method': 'pc_logistic', 'iw_clip_max': 5.0, 'iw_prob_clip': 0.0368317770584884, 'iw_n_components': 60, 'iw_logistic_c': 2.580980717190413e-07, 'iw_pca_fit': 'combined', 'iw_solver': 'lbfgs', 'iw_rho': 1.0}. Best is trial 50 with value: 0.20348261925254355.
[I 2026-05-04 02:59:12,977] Trial 54 finished with value: 0.2034385793432139 and parameters: {'alpha': 314328.3958996246, 'use_snp_selection': False, 'iw_method': 'pc_logistic', 'iw_clip_max': 5.0, 'iw_prob_clip': 0.037712668062592075, 'iw_n_components': 60, 'iw_logistic_c': 4.088826206536808e-06, 'iw_pca_fit': 'combined', 'iw_solver': 'lbfgs', 'iw_rho': 1.0}. Best is trial 50 with value: 0.20348261925254355.
[I 2026-05-04 03:02:38,484] Trial 55 finished with value: 0.20235193469106746 and parameters: {'alpha': 311692.3737274478, 'use_snp_selection': False, 'iw_method': 'pc_logistic', 'iw_clip_max': 5.0, 'iw_prob_clip': 0.0382371740850763, 'iw_n_components': 60, 'iw_logistic_c': 3.0673339605039814e-06, 'iw_pca_fit': 'combined', 'iw_solver': 'lbfgs', 'iw_rho': 1.0}. Best is trial 50 with value: 0.20348261925254355.
