[I 2026-05-04 06:12:57,694] Trial 111 finished with value: 0.22795393692764937 and parameters: {'alpha': 224159.33050388808, 'use_snp_selection': False, 'iw_method': 'pc_logistic', 'iw_clip_max': 3.0, 'iw_prob_clip': 0.04071051659396631, 'iw_n_components': 40, 'iw_logistic_c': 2.3942254030790653e-06, 'iw_pca_fit': 'combined', 'iw_solver': 'lbfgs', 'iw_rho': 1.0}. Best is trial 105 with value: 0.22839972362683358.
[I 2026-05-04 06:15:54,762] Trial 112 finished with value: 0.22746812102448502 and parameters: {'alpha': 222712.144552041, 'use_snp_selection': False, 'iw_method': 'pc_logistic', 'iw_clip_max': 3.0, 'iw_prob_clip': 0.046189020196684145, 'iw_n_components': 40, 'iw_logistic_c': 2.303990383222188e-06, 'iw_pca_fit': 'combined', 'iw_solver': 'lbfgs', 'iw_rho': 1.0}. Best is trial 105 with value: 0.22839972362683358.
[I 2026-05-04 06:18:57,030] Trial 113 finished with value: 0.2270514028394719 and parameters: {'alpha': 225264.7657407452, 'use_snp_selection': False, 'iw_method': 'pc_logistic', 'iw_clip_max': 3.0, 'iw_prob_clip': 0.04705028336580329, 'iw_n_components': 40, 'iw_logistic_c': 2.2745236755923217e-06, 'iw_pca_fit': 'combined', 'iw_solver': 'lbfgs', 'iw_rho': 1.0}. Best is trial 105 with value: 0.22839972362683358.
[I 2026-05-04 06:21:57,968] Trial 114 finished with value: 0.2264808705301779 and parameters: {'alpha': 260553.84413028977, 'use_snp_selection': False, 'iw_method': 'pc_logistic', 'iw_clip_max': 3.0, 'iw_prob_clip': 0.047169490183521935, 'iw_n_components': 40, 'iw_logistic_c': 2.2658254898232584e-06, 'iw_pca_fit': 'combined', 'iw_solver': 'lbfgs', 'iw_rho': 1.0}. Best is trial 105 with value: 0.22839972362683358.
[I 2026-05-04 06:25:04,115] Trial 115 finished with value: 0.22541537748482118 and parameters: {'alpha': 286886.6162655264, 'use_snp_selection': False, 'iw_method': 'pc_logistic', 'iw_clip_max': 3.0, 'iw_prob_clip': 0.04475470501351787, 'iw_n_components': 40, 'iw_logistic_c': 1.8686971834207175e-06, 'iw_pca_fit': 'combined', 'iw_solver': 'lbfgs', 'iw_rho': 1.0}. Best is trial 105 with value: 0.22839972362683358.
[I 2026-05-04 06:28:03,857] Trial 116 finished with value: 0.22261333071070602 and parameters: {'alpha': 219169.35691805687, 'use_snp_selection': False, 'iw_method': 'pc_logistic', 'iw_clip_max': 3.0, 'iw_prob_clip': 0.04118164320899775, 'iw_n_components': 40, 'iw_logistic_c': 5.639863664827783e-07, 'iw_pca_fit': 'combined', 'iw_solver': 'lbfgs', 'iw_rho': 1.0}. Best is trial 105 with value: 0.22839972362683358.
[I 2026-05-04 06:31:05,311] Trial 117 finished with value: 0.2202141271253791 and parameters: {'alpha': 223716.49446754943, 'use_snp_selection': False, 'iw_method': 'pc_logistic', 'iw_clip_max': 2.0, 'iw_prob_clip': 0.0498186873128637, 'iw_n_components': 40, 'iw_logistic_c': 2.7806817654139874e-07, 'iw_pca_fit': 'combined', 'iw_solver': 'lbfgs', 'iw_rho': 1.0}. Best is trial 105 with value: 0.22839972362683358.
[I 2026-05-04 06:34:09,260] Trial 118 finished with value: 0.22733277081286452 and parameters: {'alpha': 199215.08700266184, 'use_snp_selection': False, 'iw_method': 'pc_logistic', 'iw_clip_max': 3.0, 'iw_prob_clip': 0.03244269766763655, 'iw_n_components': 40, 'iw_logistic_c': 2.841750618950019e-06, 'iw_pca_fit': 'combined', 'iw_solver': 'lbfgs', 'iw_rho': 1.0}. Best is trial 105 with value: 0.22839972362683358.
[I 2026-05-04 06:37:13,666] Trial 119 finished with value: 0.22506932042698877 and parameters: {'alpha': 259109.20331896946, 'use_snp_selection': False, 'iw_method': 'pc_logistic', 'iw_clip_max': 3.0, 'iw_prob_clip': 0.03272980362122056, 'iw_n_components': 40, 'iw_logistic_c': 1.0619685898535069e-06, 'iw_pca_fit': 'combined', 'iw_solver': 'lbfgs', 'iw_rho': 1.0}. Best is trial 105 with value: 0.22839972362683358.
[I 2026-05-04 06:40:26,895] Trial 120 finished with value: 0.22346502381617528 and parameters: {'alpha': 199314.9604153974, 'use_snp_selection': False, 'iw_method': 'pc_logistic', 'iw_clip_max': 1.5, 'iw_prob_clip': 0.045540633494283694, 'iw_n_components': 40, 'iw_logistic_c': 2.226466903824892e-06, 'iw_pca_fit': 'combined', 'iw_solver': 'lbfgs', 'iw_rho': 1.0}. Best is trial 105 with value: 0.22839972362683358.
[I 2026-05-04 06:43:24,019] Trial 121 finished with value: 0.22768296228046467 and parameters: {'alpha': 228177.04375900346, 'use_snp_selection': False, 'iw_method': 'pc_logistic', 'iw_clip_max': 3.0, 'iw_prob_clip': 0.03614575889328487, 'iw_n_components': 40, 'iw_logistic_c': 2.964585142581117e-06, 'iw_pca_fit': 'combined', 'iw_solver': 'lbfgs', 'iw_rho': 1.0}. Best is trial 105 with value: 0.22839972362683358.
[I 2026-05-04 06:46:32,542] Trial 122 finished with value: 0.22715899312945204 and parameters: {'alpha': 225896.80740489572, 'use_snp_selection': False, 'iw_method': 'pc_logistic', 'iw_clip_max': 3.0, 'iw_prob_clip': 0.03585870692459054, 'iw_n_components': 40, 'iw_logistic_c': 3.2319545201075244e-06, 'iw_pca_fit': 'combined', 'iw_solver': 'lbfgs', 'iw_rho': 1.0}. Best is trial 105 with value: 0.22839972362683358.
[I 2026-05-04 06:49:35,592] Trial 123 finished with value: 0.22814070643879134 and parameters: {'alpha': 227006.73490246024, 'use_snp_selection': False, 'iw_method': 'pc_logistic', 'iw_clip_max': 3.0, 'iw_prob_clip': 0.04149921178507022, 'iw_n_components': 40, 'iw_logistic_c': 2.68197689995836e-06, 'iw_pca_fit': 'combined', 'iw_solver': 'lbfgs', 'iw_rho': 1.0}. Best is trial 105 with value: 0.22839972362683358.
[I 2026-05-04 06:52:36,153] Trial 124 finished with value: 0.2281246827711761 and parameters: {'alpha': 253203.706146094, 'use_snp_selection': False, 'iw_method': 'pc_logistic', 'iw_clip_max': 3.0, 'iw_prob_clip': 0.04185012358301131, 'iw_n_components': 40, 'iw_logistic_c': 2.820745274503694e-06, 'iw_pca_fit': 'combined', 'iw_solver': 'lbfgs', 'iw_rho': 1.0}. Best is trial 105 with value: 0.22839972362683358.
[I 2026-05-04 06:55:34,711] Trial 125 finished with value: 0.2218151180198889 and parameters: {'alpha': 332817.91023964447, 'use_snp_selection': False, 'iw_method': 'pc_logistic', 'iw_clip_max': 3.0, 'iw_prob_clip': 0.04219322042440902, 'iw_n_components': 40, 'iw_logistic_c': 8.427792240728044e-07, 'iw_pca_fit': 'combined', 'iw_solver': 'lbfgs', 'iw_rho': 1.0}. Best is trial 105 with value: 0.22839972362683358.
[I 2026-05-04 06:58:35,076] Trial 126 finished with value: 0.22806005744221677 and parameters: {'alpha': 226109.48433374928, 'use_snp_selection': False, 'iw_method': 'pc_logistic', 'iw_clip_max': 3.0, 'iw_prob_clip': 0.045390179422201575, 'iw_n_components': 40, 'iw_logistic_c': 2.888018280648008e-06, 'iw_pca_fit': 'combined', 'iw_solver': 'lbfgs', 'iw_rho': 1.0}. Best is trial 105 with value: 0.22839972362683358.
[I 2026-05-04 07:01:32,521] Trial 127 finished with value: 0.22173951932442354 and parameters: {'alpha': 246183.17737796556, 'use_snp_selection': False, 'iw_method': 'pc_logistic', 'iw_clip_max': 3.0, 'iw_prob_clip': 0.03758340458617286, 'iw_n_components': 40, 'iw_logistic_c': 1.783941549549696e-05, 'iw_pca_fit': 'combined', 'iw_solver': 'lbfgs', 'iw_rho': 1.0}. Best is trial 105 with value: 0.22839972362683358.
[I 2026-05-04 07:04:23,383] Trial 128 finished with value: 0.22504194273410766 and parameters: {'alpha': 204416.10957110507, 'use_snp_selection': False, 'iw_method': 'pc_logistic', 'iw_clip_max': 3.0, 'iw_prob_clip': 0.041694654852749605, 'iw_n_components': 40, 'iw_logistic_c': 1.338509229236341e-06, 'iw_pca_fit': 'combined', 'iw_solver': 'lbfgs', 'iw_rho': 1.0}. Best is trial 105 with value: 0.22839972362683358.
[I 2026-05-04 07:07:30,212] Trial 129 finished with value: 0.21597362170072754 and parameters: {'alpha': 302702.3841620044, 'use_snp_selection': False, 'iw_method': 'pc_logistic', 'iw_clip_max': 3.0, 'iw_prob_clip': 0.03474401296356947, 'iw_n_components': 40, 'iw_logistic_c': 0.4141226819415889, 'iw_pca_fit': 'combined', 'iw_solver': 'lbfgs', 'iw_rho': 1.0}. Best is trial 105 with value: 0.22839972362683358.
[I 2026-05-04 07:10:34,837] Trial 130 finished with value: 0.22106262409627409 and parameters: {'alpha': 273705.11123863905, 'use_snp_selection': False, 'iw_method': 'pc_logistic', 'iw_clip_max': 1.25, 'iw_prob_clip': 0.045929409119885384, 'iw_n_components': 40, 'iw_logistic_c': 2.6271517486914867e-06, 'iw_pca_fit': 'combined', 'iw_solver': 'lbfgs', 'iw_rho': 1.0}. Best is trial 105 with value: 0.22839972362683358.
[I 2026-05-04 07:13:44,347] Trial 131 finished with value: 0.22814667547871234 and parameters: {'alpha': 229365.00898163195, 'use_snp_selection': False, 'iw_method': 'pc_logistic', 'iw_clip_max': 3.0, 'iw_prob_clip': 0.04543597568836865, 'iw_n_components': 40, 'iw_logistic_c': 2.9393668369678717e-06, 'iw_pca_fit': 'combined', 'iw_solver': 'lbfgs', 'iw_rho': 1.0}. Best is trial 105 with value: 0.22839972362683358.
[I 2026-05-04 07:16:49,443] Trial 132 finished with value: 0.22725157683782174 and parameters: {'alpha': 236182.1225983849, 'use_snp_selection': False, 'iw_method': 'pc_logistic', 'iw_clip_max': 3.0, 'iw_prob_clip': 0.0379448786120723, 'iw_n_components': 40, 'iw_logistic_c': 3.584376056062867e-06, 'iw_pca_fit': 'combined', 'iw_solver': 'lbfgs', 'iw_rho': 1.0}. Best is trial 105 with value: 0.22839972362683358.
[I 2026-05-04 07:19:54,217] Trial 133 finished with value: 0.22385613345771746 and parameters: {'alpha': 250969.62609098747, 'use_snp_selection': False, 'iw_method': 'pc_logistic', 'iw_clip_max': 3.0, 'iw_prob_clip': 0.04993301383394425, 'iw_n_components': 40, 'iw_logistic_c': 1.0317960608124915e-05, 'iw_pca_fit': 'combined', 'iw_solver': 'lbfgs', 'iw_rho': 1.0}. Best is trial 105 with value: 0.22839972362683358.
[I 2026-05-04 07:22:57,892] Trial 134 finished with value: 0.22607980976394587 and parameters: {'alpha': 196350.56638382757, 'use_snp_selection': False, 'iw_method': 'pc_logistic', 'iw_clip_max': 3.0, 'iw_prob_clip': 0.040089690272404804, 'iw_n_components': 40, 'iw_logistic_c': 5.012391704525921e-06, 'iw_pca_fit': 'combined', 'iw_solver': 'lbfgs', 'iw_rho': 1.0}. Best is trial 105 with value: 0.22839972362683358.
[I 2026-05-04 07:26:06,242] Trial 135 finished with value: 0.20394667415219306 and parameters: {'alpha': 2929242.4107394954, 'use_snp_selection': False, 'iw_method': 'pc_logistic', 'iw_clip_max': 3.0, 'iw_prob_clip': 0.04423541548556595, 'iw_n_components': 40, 'iw_logistic_c': 1.5844473756170286e-06, 'iw_pca_fit': 'combined', 'iw_solver': 'lbfgs', 'iw_rho': 1.0}. Best is trial 105 with value: 0.22839972362683358.
[I 2026-05-04 07:26:36,814] Trial 136 finished with value: 0.2189987683554206 and parameters: {'alpha': 237076.49191538978, 'use_snp_selection': False, 'iw_method': 'uniform'}. Best is trial 105 with value: 0.22839972362683358.
[I 2026-05-04 07:29:37,895] Trial 137 finished with value: 0.2247054913259808 and parameters: {'alpha': 206780.77567250933, 'use_snp_selection': False, 'iw_method': 'pc_logistic', 'iw_clip_max': 5.0, 'iw_prob_clip': 0.03824601385213154, 'iw_n_components': 40, 'iw_logistic_c': 9.22681833476647e-07, 'iw_pca_fit': 'combined', 'iw_solver': 'lbfgs', 'iw_rho': 1.0}. Best is trial 105 with value: 0.22839972362683358.
[I 2026-05-04 07:32:41,515] Trial 138 finished with value: 0.2219071209893943 and parameters: {'alpha': 262054.86284634814, 'use_snp_selection': False, 'iw_method': 'pc_logistic', 'iw_clip_max': 3.0, 'iw_prob_clip': 0.031547959511871546, 'iw_n_components': 40, 'iw_logistic_c': 3.633817383464802e-07, 'iw_pca_fit': 'combined', 'iw_solver': 'lbfgs', 'iw_rho': 1.0}. Best is trial 105 with value: 0.22839972362683358.
[I 2026-05-04 07:35:47,548] Trial 139 finished with value: 0.22680726146914482 and parameters: {'alpha': 232595.16889733492, 'use_snp_selection': False, 'iw_method': 'pc_logistic', 'iw_clip_max': 3.0, 'iw_prob_clip': 0.04207318286461321, 'iw_n_components': 40, 'iw_logistic_c': 4.81175200984101e-06, 'iw_pca_fit': 'combined', 'iw_solver': 'lbfgs', 'iw_rho': 1.0}. Best is trial 105 with value: 0.22839972362683358.
[I 2026-05-04 07:38:47,486] Trial 140 finished with value: 0.22749531257305833 and parameters: {'alpha': 211834.38605965453, 'use_snp_selection': False, 'iw_method': 'pc_logistic', 'iw_clip_max': 3.0, 'iw_prob_clip': 0.03807470774215286, 'iw_n_components': 40, 'iw_logistic_c': 3.1770346490085542e-06, 'iw_pca_fit': 'combined', 'iw_solver': 'lbfgs', 'iw_rho': 1.0}. Best is trial 105 with value: 0.22839972362683358.
[I 2026-05-04 07:42:00,699] Trial 141 finished with value: 0.22752478496197054 and parameters: {'alpha': 194920.7323628604, 'use_snp_selection': False, 'iw_method': 'pc_logistic', 'iw_clip_max': 3.0, 'iw_prob_clip': 0.03672563219683279, 'iw_n_components': 40, 'iw_logistic_c': 2.9483543186996857e-06, 'iw_pca_fit': 'combined', 'iw_solver': 'lbfgs', 'iw_rho': 1.0}. Best is trial 105 with value: 0.22839972362683358.
[I 2026-05-04 07:45:04,387] Trial 142 finished with value: 0.22811157594018847 and parameters: {'alpha': 193186.7930552069, 'use_snp_selection': False, 'iw_method': 'pc_logistic', 'iw_clip_max': 3.0, 'iw_prob_clip': 0.04525632929860562, 'iw_n_components': 40, 'iw_logistic_c': 2.717027643369074e-06, 'iw_pca_fit': 'combined', 'iw_solver': 'lbfgs', 'iw_rho': 1.0}. Best is trial 105 with value: 0.22839972362683358.
[I 2026-05-04 07:48:09,971] Trial 143 finished with value: 0.22528580971355136 and parameters: {'alpha': 210165.59963759466, 'use_snp_selection': False, 'iw_method': 'pc_logistic', 'iw_clip_max': 3.0, 'iw_prob_clip': 0.04464421645555765, 'iw_n_components': 40, 'iw_logistic_c': 1.450795102013184e-06, 'iw_pca_fit': 'combined', 'iw_solver': 'lbfgs', 'iw_rho': 1.0}. Best is trial 105 with value: 0.22839972362683358.
[I 2026-05-04 07:51:14,582] Trial 144 finished with value: 0.2274980522362823 and parameters: {'alpha': 199498.056356099, 'use_snp_selection': False, 'iw_method': 'pc_logistic', 'iw_clip_max': 3.0, 'iw_prob_clip': 0.033190991726955596, 'iw_n_components': 40, 'iw_logistic_c': 1.9904520529061694e-06, 'iw_pca_fit': 'combined', 'iw_solver': 'lbfgs', 'iw_rho': 1.0}. Best is trial 105 with value: 0.22839972362683358.
[I 2026-05-04 07:54:25,458] Trial 145 finished with value: 0.2262766824155523 and parameters: {'alpha': 190557.20073539554, 'use_snp_selection': False, 'iw_method': 'pc_logistic', 'iw_clip_max': 3.0, 'iw_prob_clip': 0.045752468410731745, 'iw_n_components': 40, 'iw_logistic_c': 1.918879131006334e-06, 'iw_pca_fit': 'combined', 'iw_solver': 'lbfgs', 'iw_rho': 1.0}. Best is trial 105 with value: 0.22839972362683358.
[I 2026-05-04 07:57:27,691] Trial 146 finished with value: 0.22551832072462283 and parameters: {'alpha': 215593.61966892483, 'use_snp_selection': False, 'iw_method': 'pc_logistic', 'iw_clip_max': 3.0, 'iw_prob_clip': 0.034910636144068245, 'iw_n_components': 40, 'iw_logistic_c': 1.064670125572747e-06, 'iw_pca_fit': 'combined', 'iw_solver': 'lbfgs', 'iw_rho': 1.0}. Best is trial 105 with value: 0.22839972362683358.
[I 2026-05-04 08:00:30,843] Trial 147 finished with value: 0.22013735766572276 and parameters: {'alpha': 600764.1059229918, 'use_snp_selection': False, 'iw_method': 'pc_logistic', 'iw_clip_max': 3.0, 'iw_prob_clip': 0.04944187118167595, 'iw_n_components': 40, 'iw_logistic_c': 1.999050163842222e-06, 'iw_pca_fit': 'combined', 'iw_solver': 'lbfgs', 'iw_rho': 1.0}. Best is trial 105 with value: 0.22839972362683358.
[I 2026-05-04 08:03:31,788] Trial 148 finished with value: 0.22322459525026703 and parameters: {'alpha': 195190.48661527774, 'use_snp_selection': False, 'iw_method': 'pc_logistic', 'iw_clip_max': 3.0, 'iw_prob_clip': 0.041206856138933025, 'iw_n_components': 40, 'iw_logistic_c': 6.432463333478895e-07, 'iw_pca_fit': 'combined', 'iw_solver': 'lbfgs', 'iw_rho': 1.0}. Best is trial 105 with value: 0.22839972362683358.
[I 2026-05-04 08:06:34,463] Trial 149 finished with value: 0.2239365892455037 and parameters: {'alpha': 249162.11248526184, 'use_snp_selection': False, 'iw_method': 'pc_logistic', 'iw_clip_max': 2.0, 'iw_prob_clip': 0.04114342261711834, 'iw_n_components': 40, 'iw_logistic_c': 8.49976668556336e-06, 'iw_pca_fit': 'combined', 'iw_solver': 'lbfgs', 'iw_rho': 1.0}. Best is trial 105 with value: 0.22839972362683358.
