[I 2026-05-06 05:25:58,364] Trial 23 finished with value: 0.14354409402953788 and parameters: {'hidden_dims': '[256, 64]', 'dropout': 0.43817989754462205, 'batch_norm': False, 'lr': 1.0399583512708564e-06, 'weight_decay': 1.3504142302613425e-06, 'epochs': 195, 'loss': 'mse', 'optimizer': 'adam', 'use_snp_selection': False}. Best is trial 16 with value: 0.166358668236956.
[I 2026-05-06 05:28:51,473] Trial 24 finished with value: 0.16088222777942943 and parameters: {'hidden_dims': '[512, 128]', 'dropout': 0.5897477982005093, 'batch_norm': False, 'lr': 7.680426823489446e-06, 'weight_decay': 1.0217622074310008e-08, 'epochs': 277, 'loss': 'mse', 'optimizer': 'adam', 'use_snp_selection': False}. Best is trial 16 with value: 0.166358668236956.
[I 2026-05-06 05:29:52,705] Trial 25 finished with value: 0.16454283842740297 and parameters: {'hidden_dims': '[256, 64]', 'dropout': 0.31436444950483533, 'batch_norm': False, 'lr': 3.990301383510223e-06, 'weight_decay': 7.993215211163806e-08, 'epochs': 174, 'loss': 'mse', 'optimizer': 'adam', 'use_snp_selection': False}. Best is trial 16 with value: 0.166358668236956.
[I 2026-05-06 05:30:29,593] Trial 26 pruned. 
[I 2026-05-06 05:31:51,137] Trial 27 finished with value: 0.16236239095668753 and parameters: {'hidden_dims': '[512, 128]', 'dropout': 0.2772932159201212, 'batch_norm': False, 'lr': 1.3059694003652999e-05, 'weight_decay': 2.41125461123892e-07, 'epochs': 121, 'loss': 'mse', 'optimizer': 'adam', 'use_snp_selection': False}. Best is trial 16 with value: 0.166358668236956.
[I 2026-05-06 05:32:43,829] Trial 28 finished with value: 0.07844070400961232 and parameters: {'hidden_dims': '[256, 64]', 'dropout': 0.4155520527656783, 'batch_norm': False, 'lr': 0.000662887276005284, 'weight_decay': 2.4833472856798667e-06, 'epochs': 147, 'loss': 'mse', 'optimizer': 'adam', 'use_snp_selection': False}. Best is trial 16 with value: 0.166358668236956.
[I 2026-05-06 05:33:33,292] Trial 29 finished with value: 0.16795469748854272 and parameters: {'hidden_dims': '[256, 128]', 'dropout': 0.34432733439320123, 'batch_norm': False, 'lr': 3.877049387329731e-06, 'weight_decay': 4.286392614488435e-06, 'epochs': 135, 'loss': 'mse', 'optimizer': 'adam', 'use_snp_selection': False}. Best is trial 29 with value: 0.16795469748854272.
[I 2026-05-06 05:34:13,514] Trial 30 finished with value: 0.15377400772810673 and parameters: {'hidden_dims': '[256, 128]', 'dropout': 0.22188712632024443, 'batch_norm': False, 'lr': 1.0132260317743853e-05, 'weight_decay': 3.828063196171709e-06, 'epochs': 104, 'loss': 'mse', 'optimizer': 'adam', 'use_snp_selection': False}. Best is trial 29 with value: 0.16795469748854272.
[I 2026-05-06 05:34:49,216] Trial 31 finished with value: 0.13953355630067074 and parameters: {'hidden_dims': '[256, 128]', 'dropout': 0.31418951844436394, 'batch_norm': False, 'lr': 3.661198233006219e-06, 'weight_decay': 2.4875752769508814e-05, 'epochs': 88, 'loss': 'mse', 'optimizer': 'adam', 'use_snp_selection': False}. Best is trial 29 with value: 0.16795469748854272.
[I 2026-05-06 05:35:19,899] Trial 32 pruned. 
[I 2026-05-06 05:36:22,404] Trial 33 finished with value: 0.15892725986436437 and parameters: {'hidden_dims': '[256, 128]', 'dropout': 0.29174826086433703, 'batch_norm': False, 'lr': 1.8592490259665503e-05, 'weight_decay': 7.012547065262433e-05, 'epochs': 178, 'loss': 'mse', 'optimizer': 'adam', 'use_snp_selection': False}. Best is trial 29 with value: 0.16795469748854272.
[I 2026-05-06 05:37:40,930] Trial 34 finished with value: 0.16170498021195448 and parameters: {'hidden_dims': '[256, 128]', 'dropout': 0.41294035776297083, 'batch_norm': False, 'lr': 6.980289117316361e-06, 'weight_decay': 5.410057362182668e-07, 'epochs': 232, 'loss': 'mse', 'optimizer': 'adam', 'use_snp_selection': False}. Best is trial 29 with value: 0.16795469748854272.
[I 2026-05-06 05:38:50,649] Trial 35 finished with value: 0.1584355529894153 and parameters: {'hidden_dims': '[256, 128]', 'dropout': 0.5321241952672074, 'batch_norm': False, 'lr': 5.266244130717373e-05, 'weight_decay': 6.42107626360907e-07, 'epochs': 204, 'loss': 'mse', 'optimizer': 'adam', 'use_snp_selection': False}. Best is trial 29 with value: 0.16795469748854272.
[I 2026-05-06 05:40:40,201] Trial 36 finished with value: 0.15401500553164887 and parameters: {'hidden_dims': '[512, 64]', 'dropout': 0.18235959225568557, 'batch_norm': False, 'lr': 2.964275950871258e-06, 'weight_decay': 9.92923530477822e-05, 'epochs': 169, 'loss': 'mae', 'optimizer': 'adam', 'use_snp_selection': False}. Best is trial 29 with value: 0.16795469748854272.
[I 2026-05-06 05:42:08,196] Trial 37 finished with value: 0.1593351158082807 and parameters: {'hidden_dims': '[512, 128]', 'dropout': 0.3312969636567465, 'batch_norm': False, 'lr': 1.0019700603681276e-05, 'weight_decay': 2.7491322347668613e-05, 'epochs': 132, 'loss': 'mse', 'optimizer': 'adam', 'use_snp_selection': False}. Best is trial 29 with value: 0.16795469748854272.
[I 2026-05-06 05:42:23,182] Trial 38 pruned. 
[I 2026-05-06 05:43:28,229] Trial 39 finished with value: 0.1559273955665031 and parameters: {'hidden_dims': '[512, 64]', 'dropout': 0.2866418259196711, 'batch_norm': False, 'lr': 4.106997234420597e-06, 'weight_decay': 2.2418150362827733e-06, 'epochs': 93, 'loss': 'mse', 'optimizer': 'adam', 'use_snp_selection': False}. Best is trial 29 with value: 0.16795469748854272.
