[I 2026-04-30 03:24:43,823] Trial 112 finished with value: 0.18381579080494345 and parameters: {'alpha': 492498.5163244761, 'use_snp_selection': False, 'iw_method': 'pc_logistic', 'iw_clip_max': 1.5, 'iw_prob_clip': 0.03309376757793746, 'iw_n_components': 20, 'iw_logistic_c': 0.697809503254005, 'iw_pca_fit': 'combined', 'iw_solver': 'lbfgs', 'iw_rho': 0.9}. Best is trial 75 with value: 0.18552589486069934.
[I 2026-04-30 03:29:51,759] Trial 113 finished with value: 0.1838600656304222 and parameters: {'alpha': 603934.2968624806, 'use_snp_selection': False, 'iw_method': 'pc_logistic', 'iw_clip_max': 1.5, 'iw_prob_clip': 0.03069038125907695, 'iw_n_components': 20, 'iw_logistic_c': 0.1024742301368834, 'iw_pca_fit': 'combined', 'iw_solver': 'lbfgs', 'iw_rho': 0.9}. Best is trial 75 with value: 0.18552589486069934.
[I 2026-04-30 03:34:57,961] Trial 114 finished with value: 0.18487868790646816 and parameters: {'alpha': 549139.9498968441, 'use_snp_selection': False, 'iw_method': 'pc_logistic', 'iw_clip_max': 1.5, 'iw_prob_clip': 0.021714111530415543, 'iw_n_components': 20, 'iw_logistic_c': 5.854675766726049, 'iw_pca_fit': 'combined', 'iw_solver': 'lbfgs', 'iw_rho': 0.9}. Best is trial 75 with value: 0.18552589486069934.
[I 2026-04-30 03:39:59,581] Trial 115 finished with value: 0.18546866330918083 and parameters: {'alpha': 539853.0487032393, 'use_snp_selection': False, 'iw_method': 'pc_logistic', 'iw_clip_max': 1.5, 'iw_prob_clip': 0.021759243435885894, 'iw_n_components': 20, 'iw_logistic_c': 6.105818978713824, 'iw_pca_fit': 'combined', 'iw_solver': 'lbfgs', 'iw_rho': 0.9}. Best is trial 75 with value: 0.18552589486069934.
[I 2026-04-30 03:45:02,422] Trial 116 finished with value: 0.18412954299560086 and parameters: {'alpha': 549996.4520703264, 'use_snp_selection': False, 'iw_method': 'pc_logistic', 'iw_clip_max': 1.5, 'iw_prob_clip': 0.020749447167435042, 'iw_n_components': 20, 'iw_logistic_c': 4.065330779388122, 'iw_pca_fit': 'combined', 'iw_solver': 'lbfgs', 'iw_rho': 0.9}. Best is trial 75 with value: 0.18552589486069934.
[I 2026-04-30 03:50:00,505] Trial 117 finished with value: 0.18445116421724497 and parameters: {'alpha': 661793.1216331094, 'use_snp_selection': False, 'iw_method': 'pc_logistic', 'iw_clip_max': 1.5, 'iw_prob_clip': 0.022580335506186544, 'iw_n_components': 20, 'iw_logistic_c': 6.785368802126387, 'iw_pca_fit': 'combined', 'iw_solver': 'lbfgs', 'iw_rho': 0.9}. Best is trial 75 with value: 0.18552589486069934.
[I 2026-04-30 03:54:59,570] Trial 118 finished with value: 0.1812440271665039 and parameters: {'alpha': 544032.0959547588, 'use_snp_selection': False, 'iw_method': 'pc_logistic', 'iw_clip_max': 1.5, 'iw_prob_clip': 0.01891040953847737, 'iw_n_components': 20, 'iw_logistic_c': 2.2035835255222644, 'iw_pca_fit': 'combined', 'iw_solver': 'lbfgs', 'iw_rho': 0.9}. Best is trial 75 with value: 0.18552589486069934.
[I 2026-04-30 03:59:02,442] Trial 119 finished with value: 0.17459192227808412 and parameters: {'alpha': 606006.4623774402, 'use_snp_selection': False, 'iw_method': 'pc_logistic', 'iw_clip_max': 1.5, 'iw_prob_clip': 0.024899841853931154, 'iw_n_components': 5, 'iw_logistic_c': 0.016647241879145187, 'iw_pca_fit': 'combined', 'iw_solver': 'lbfgs', 'iw_rho': 0.9}. Best is trial 75 with value: 0.18552589486069934.
[I 2026-04-30 04:00:02,638] Trial 120 finished with value: 0.1778749410197516 and parameters: {'alpha': 435223.617639606, 'use_snp_selection': False, 'iw_method': 'uniform'}. Best is trial 75 with value: 0.18552589486069934.
[I 2026-04-30 04:05:02,553] Trial 121 finished with value: 0.1834792951279774 and parameters: {'alpha': 464969.32723782386, 'use_snp_selection': False, 'iw_method': 'pc_logistic', 'iw_clip_max': 1.5, 'iw_prob_clip': 0.027988676775374935, 'iw_n_components': 20, 'iw_logistic_c': 7.134146731029387, 'iw_pca_fit': 'combined', 'iw_solver': 'lbfgs', 'iw_rho': 0.9}. Best is trial 75 with value: 0.18552589486069934.
[I 2026-04-30 04:10:04,410] Trial 122 finished with value: 0.18578411408701748 and parameters: {'alpha': 395337.11350413243, 'use_snp_selection': False, 'iw_method': 'pc_logistic', 'iw_clip_max': 1.5, 'iw_prob_clip': 0.022629336153056786, 'iw_n_components': 20, 'iw_logistic_c': 1.3320337210322541, 'iw_pca_fit': 'combined', 'iw_solver': 'lbfgs', 'iw_rho': 0.9}. Best is trial 122 with value: 0.18578411408701748.
[I 2026-04-30 04:15:06,661] Trial 123 finished with value: 0.18513286408547885 and parameters: {'alpha': 515665.7260273331, 'use_snp_selection': False, 'iw_method': 'pc_logistic', 'iw_clip_max': 1.5, 'iw_prob_clip': 0.022751123614685495, 'iw_n_components': 20, 'iw_logistic_c': 1.0134772731070205, 'iw_pca_fit': 'combined', 'iw_solver': 'lbfgs', 'iw_rho': 0.9}. Best is trial 122 with value: 0.18578411408701748.
[I 2026-04-30 04:20:05,662] Trial 124 finished with value: 0.18297011932459686 and parameters: {'alpha': 520912.3246081349, 'use_snp_selection': False, 'iw_method': 'pc_logistic', 'iw_clip_max': 1.5, 'iw_prob_clip': 0.01509253927579432, 'iw_n_components': 20, 'iw_logistic_c': 2.359960134415949, 'iw_pca_fit': 'combined', 'iw_solver': 'lbfgs', 'iw_rho': 0.9}. Best is trial 122 with value: 0.18578411408701748.
[I 2026-04-30 04:24:00,375] Trial 125 finished with value: 0.17462198757643443 and parameters: {'alpha': 447412.0962700734, 'use_snp_selection': False, 'iw_method': 'pc_logistic', 'iw_clip_max': 1.5, 'iw_prob_clip': 0.019285149827339337, 'iw_n_components': 1, 'iw_logistic_c': 0.9555099422322327, 'iw_pca_fit': 'combined', 'iw_solver': 'lbfgs', 'iw_rho': 0.9}. Best is trial 122 with value: 0.18578411408701748.
[I 2026-04-30 04:28:59,739] Trial 126 finished with value: 0.18458542638429637 and parameters: {'alpha': 402782.33205144067, 'use_snp_selection': False, 'iw_method': 'pc_logistic', 'iw_clip_max': 1.5, 'iw_prob_clip': 0.022588873294980116, 'iw_n_components': 20, 'iw_logistic_c': 1.295796001420098, 'iw_pca_fit': 'combined', 'iw_solver': 'lbfgs', 'iw_rho': 0.9}. Best is trial 122 with value: 0.18578411408701748.
[I 2026-04-30 04:34:00,742] Trial 127 finished with value: 0.18327362601861716 and parameters: {'alpha': 506853.4419640556, 'use_snp_selection': False, 'iw_method': 'pc_logistic', 'iw_clip_max': 1.5, 'iw_prob_clip': 0.02572762821013495, 'iw_n_components': 20, 'iw_logistic_c': 2.4813353831059817, 'iw_pca_fit': 'combined', 'iw_solver': 'lbfgs', 'iw_rho': 0.9}. Best is trial 122 with value: 0.18578411408701748.
[I 2026-04-30 04:39:18,823] Trial 128 finished with value: 0.18215686364369013 and parameters: {'alpha': 635621.8309354992, 'use_snp_selection': False, 'iw_method': 'pc_logistic', 'iw_clip_max': 3.0, 'iw_prob_clip': 0.016751019633201577, 'iw_n_components': 40, 'iw_logistic_c': 0.6017713939665603, 'iw_pca_fit': 'combined', 'iw_solver': 'lbfgs', 'iw_rho': 0.9}. Best is trial 122 with value: 0.18578411408701748.
[I 2026-04-30 04:44:16,474] Trial 129 finished with value: 0.17807153016355232 and parameters: {'alpha': 476064.50330114685, 'use_snp_selection': False, 'iw_method': 'pc_logistic', 'iw_clip_max': 1.5, 'iw_prob_clip': 0.0035320372919454583, 'iw_n_components': 20, 'iw_logistic_c': 0.3906292814822248, 'iw_pca_fit': 'combined', 'iw_solver': 'lbfgs', 'iw_rho': 0.9}. Best is trial 122 with value: 0.18578411408701748.
[I 2026-04-30 04:49:36,389] Trial 130 finished with value: 0.16814662687466372 and parameters: {'alpha': 337208.71578964737, 'use_snp_selection': False, 'iw_method': 'pc_logistic', 'iw_clip_max': 5.0, 'iw_prob_clip': 0.018143776515645724, 'iw_n_components': 50, 'iw_logistic_c': 5.652518687983773, 'iw_pca_fit': 'combined', 'iw_solver': 'lbfgs', 'iw_rho': 0.9}. Best is trial 122 with value: 0.18578411408701748.
[I 2026-04-30 04:54:37,754] Trial 131 finished with value: 0.18536061552264535 and parameters: {'alpha': 589453.6774538197, 'use_snp_selection': False, 'iw_method': 'pc_logistic', 'iw_clip_max': 1.5, 'iw_prob_clip': 0.02105690474764005, 'iw_n_components': 20, 'iw_logistic_c': 1.4105296970850874, 'iw_pca_fit': 'combined', 'iw_solver': 'lbfgs', 'iw_rho': 0.9}. Best is trial 122 with value: 0.18578411408701748.
[I 2026-04-30 04:59:36,061] Trial 132 finished with value: 0.18419225971227746 and parameters: {'alpha': 545652.3930761771, 'use_snp_selection': False, 'iw_method': 'pc_logistic', 'iw_clip_max': 1.5, 'iw_prob_clip': 0.02081502867501654, 'iw_n_components': 20, 'iw_logistic_c': 1.4876459546963852, 'iw_pca_fit': 'combined', 'iw_solver': 'lbfgs', 'iw_rho': 0.9}. Best is trial 122 with value: 0.18578411408701748.
[I 2026-04-30 05:04:36,742] Trial 133 finished with value: 0.18083167639225817 and parameters: {'alpha': 425895.6191904897, 'use_snp_selection': False, 'iw_method': 'pc_logistic', 'iw_clip_max': 1.5, 'iw_prob_clip': 0.011568516638232246, 'iw_n_components': 20, 'iw_logistic_c': 3.3228106060485487, 'iw_pca_fit': 'combined', 'iw_solver': 'lbfgs', 'iw_rho': 0.9}. Best is trial 122 with value: 0.18578411408701748.
[I 2026-04-30 05:09:35,130] Trial 134 finished with value: 0.18509479702442605 and parameters: {'alpha': 579813.3413613647, 'use_snp_selection': False, 'iw_method': 'pc_logistic', 'iw_clip_max': 1.5, 'iw_prob_clip': 0.023342726307667636, 'iw_n_components': 20, 'iw_logistic_c': 1.0932522976426036, 'iw_pca_fit': 'combined', 'iw_solver': 'lbfgs', 'iw_rho': 0.9}. Best is trial 122 with value: 0.18578411408701748.
[I 2026-04-30 05:14:35,511] Trial 135 finished with value: 0.18491567258079292 and parameters: {'alpha': 586033.891786079, 'use_snp_selection': False, 'iw_method': 'pc_logistic', 'iw_clip_max': 1.5, 'iw_prob_clip': 0.023642825983989764, 'iw_n_components': 20, 'iw_logistic_c': 1.1728112806090092, 'iw_pca_fit': 'combined', 'iw_solver': 'lbfgs', 'iw_rho': 0.9}. Best is trial 122 with value: 0.18578411408701748.
[I 2026-04-30 05:19:33,736] Trial 136 finished with value: 0.18232672097987146 and parameters: {'alpha': 596656.7202911972, 'use_snp_selection': False, 'iw_method': 'pc_logistic', 'iw_clip_max': 1.5, 'iw_prob_clip': 0.023156510767357738, 'iw_n_components': 20, 'iw_logistic_c': 0.9630364670755117, 'iw_pca_fit': 'combined', 'iw_solver': 'lbfgs', 'iw_rho': 0.9}. Best is trial 122 with value: 0.18578411408701748.
[I 2026-04-30 05:24:33,078] Trial 137 finished with value: 0.18577873315457738 and parameters: {'alpha': 666992.1105731888, 'use_snp_selection': False, 'iw_method': 'pc_logistic', 'iw_clip_max': 1.5, 'iw_prob_clip': 0.026236089117893213, 'iw_n_components': 20, 'iw_logistic_c': 0.5298456283369877, 'iw_pca_fit': 'combined', 'iw_solver': 'lbfgs', 'iw_rho': 0.9}. Best is trial 122 with value: 0.18578411408701748.
[I 2026-04-30 05:29:30,256] Trial 138 finished with value: 0.18390960507743842 and parameters: {'alpha': 663306.6362998645, 'use_snp_selection': False, 'iw_method': 'pc_logistic', 'iw_clip_max': 1.5, 'iw_prob_clip': 0.02601395582933619, 'iw_n_components': 20, 'iw_logistic_c': 0.3026228615147935, 'iw_pca_fit': 'combined', 'iw_solver': 'lbfgs', 'iw_rho': 0.9}. Best is trial 122 with value: 0.18578411408701748.
[I 2026-04-30 05:34:29,888] Trial 139 finished with value: 0.1850826503023192 and parameters: {'alpha': 687878.5736312526, 'use_snp_selection': False, 'iw_method': 'pc_logistic', 'iw_clip_max': 1.5, 'iw_prob_clip': 0.027142175905592585, 'iw_n_components': 20, 'iw_logistic_c': 0.4496123500132271, 'iw_pca_fit': 'combined', 'iw_solver': 'lbfgs', 'iw_rho': 0.9}. Best is trial 122 with value: 0.18578411408701748.
[I 2026-04-30 05:35:30,055] Trial 140 finished with value: 0.1762902207505471 and parameters: {'alpha': 708782.6865746101, 'use_snp_selection': False, 'iw_method': 'uniform'}. Best is trial 122 with value: 0.18578411408701748.
[I 2026-04-30 05:40:30,451] Trial 141 finished with value: 0.1852187342733381 and parameters: {'alpha': 749270.0761790808, 'use_snp_selection': False, 'iw_method': 'pc_logistic', 'iw_clip_max': 1.5, 'iw_prob_clip': 0.020064983682515566, 'iw_n_components': 20, 'iw_logistic_c': 0.5815969209858359, 'iw_pca_fit': 'combined', 'iw_solver': 'lbfgs', 'iw_rho': 0.9}. Best is trial 122 with value: 0.18578411408701748.
[I 2026-04-30 05:45:30,539] Trial 142 finished with value: 0.18324224404353023 and parameters: {'alpha': 762122.0005609036, 'use_snp_selection': False, 'iw_method': 'pc_logistic', 'iw_clip_max': 1.5, 'iw_prob_clip': 0.020094360087277708, 'iw_n_components': 20, 'iw_logistic_c': 0.5377184077639671, 'iw_pca_fit': 'combined', 'iw_solver': 'lbfgs', 'iw_rho': 0.9}. Best is trial 122 with value: 0.18578411408701748.
[I 2026-04-30 05:50:30,640] Trial 143 finished with value: 0.18380722942654043 and parameters: {'alpha': 905556.3805386806, 'use_snp_selection': False, 'iw_method': 'pc_logistic', 'iw_clip_max': 1.5, 'iw_prob_clip': 0.02664822912633464, 'iw_n_components': 20, 'iw_logistic_c': 0.22672523231372546, 'iw_pca_fit': 'combined', 'iw_solver': 'lbfgs', 'iw_rho': 0.9}. Best is trial 122 with value: 0.18578411408701748.
[I 2026-04-30 05:55:31,578] Trial 144 finished with value: 0.18458878495633912 and parameters: {'alpha': 638543.399280561, 'use_snp_selection': False, 'iw_method': 'pc_logistic', 'iw_clip_max': 1.5, 'iw_prob_clip': 0.02828092787506153, 'iw_n_components': 20, 'iw_logistic_c': 0.6382771499113391, 'iw_pca_fit': 'combined', 'iw_solver': 'lbfgs', 'iw_rho': 0.9}. Best is trial 122 with value: 0.18578411408701748.
[I 2026-04-30 06:00:28,233] Trial 145 finished with value: 0.18159247250805347 and parameters: {'alpha': 673304.0649616899, 'use_snp_selection': False, 'iw_method': 'pc_logistic', 'iw_clip_max': 1.5, 'iw_prob_clip': 0.0051021344162103955, 'iw_n_components': 20, 'iw_logistic_c': 0.48032868600100037, 'iw_pca_fit': 'combined', 'iw_solver': 'lbfgs', 'iw_rho': 0.9}. Best is trial 122 with value: 0.18578411408701748.
[I 2026-04-30 06:05:28,611] Trial 146 finished with value: 0.18618691974673257 and parameters: {'alpha': 697132.0111070658, 'use_snp_selection': False, 'iw_method': 'pc_logistic', 'iw_clip_max': 1.5, 'iw_prob_clip': 0.021703755373755008, 'iw_n_components': 20, 'iw_logistic_c': 0.1407462458873052, 'iw_pca_fit': 'combined', 'iw_solver': 'lbfgs', 'iw_rho': 0.9}. Best is trial 146 with value: 0.18618691974673257.
[I 2026-04-30 06:10:21,808] Trial 147 finished with value: 0.1743719060238249 and parameters: {'alpha': 808375.0954605471, 'use_snp_selection': False, 'iw_method': 'pc_logistic', 'iw_clip_max': 1.5, 'iw_prob_clip': 0.013329243466865974, 'iw_n_components': 10, 'iw_logistic_c': 0.3318130456225739, 'iw_pca_fit': 'combined', 'iw_solver': 'lbfgs', 'iw_rho': 0.9}. Best is trial 146 with value: 0.18618691974673257.
[I 2026-04-30 06:15:21,614] Trial 148 finished with value: 0.18494754762575558 and parameters: {'alpha': 707231.4427669476, 'use_snp_selection': False, 'iw_method': 'pc_logistic', 'iw_clip_max': 1.5, 'iw_prob_clip': 0.021267098106365637, 'iw_n_components': 20, 'iw_logistic_c': 0.13924476055356194, 'iw_pca_fit': 'combined', 'iw_solver': 'lbfgs', 'iw_rho': 0.9}. Best is trial 146 with value: 0.18618691974673257.
[I 2026-04-30 06:20:19,239] Trial 149 finished with value: 0.184017591479111 and parameters: {'alpha': 834075.300528078, 'use_snp_selection': False, 'iw_method': 'pc_logistic', 'iw_clip_max': 1.5, 'iw_prob_clip': 0.01806765466679011, 'iw_n_components': 20, 'iw_logistic_c': 1.786779741328282, 'iw_pca_fit': 'combined', 'iw_solver': 'lbfgs', 'iw_rho': 0.9}. Best is trial 146 with value: 0.18618691974673257.
