Running from this directory: /cluster/work/simennes/Master_thesis
Name of job: ncv_ridge_iw
ID of job: 24351984
Array task ID: 9
The job was run on these nodes: idun-03-17
[I 2026-04-28 16:18:28,438] Trial 0 finished with value: 0.15959609780786696 and parameters: {'alpha': 233144.78773166405, 'use_snp_selection': False, 'iw_method': 'pc_logistic', 'iw_clip_max': 10.0, 'iw_prob_clip': 0.010431250548547025, 'iw_n_components': 5, 'iw_logistic_c': 0.024278386754340225, 'iw_pca_fit': 'source', 'iw_solver': 'lbfgs', 'iw_rho': 1.0}. Best is trial 0 with value: 0.15959609780786696.
[I 2026-04-28 16:21:32,201] Trial 1 finished with value: 0.15676178475686223 and parameters: {'alpha': 69538.92138947408, 'use_snp_selection': False, 'iw_method': 'pc_logistic', 'iw_clip_max': 10.0, 'iw_prob_clip': 0.016575882684432525, 'iw_n_components': 3, 'iw_logistic_c': 0.08711457855994918, 'iw_pca_fit': 'source', 'iw_solver': 'lbfgs', 'iw_rho': 1.0}. Best is trial 0 with value: 0.15959609780786696.
[I 2026-04-28 16:25:14,410] Trial 2 finished with value: 0.16166607125084592 and parameters: {'alpha': 145882.8144740121, 'use_snp_selection': False, 'iw_method': 'pc_logistic', 'iw_clip_max': 3.0, 'iw_prob_clip': 0.02132508176927039, 'iw_n_components': 20, 'iw_logistic_c': 7.593207514996604e-07, 'iw_pca_fit': 'combined', 'iw_solver': 'lbfgs', 'iw_rho': 0.5}. Best is trial 2 with value: 0.16166607125084592.
[I 2026-04-28 16:28:42,823] Trial 3 finished with value: 0.15434332644633691 and parameters: {'alpha': 250773.322847116, 'use_snp_selection': False, 'iw_method': 'pc_logistic', 'iw_clip_max': 10.0, 'iw_prob_clip': 0.0025344201278108985, 'iw_n_components': 10, 'iw_logistic_c': 0.0005426420500638965, 'iw_pca_fit': 'source', 'iw_solver': 'lbfgs', 'iw_rho': 0.9}. Best is trial 2 with value: 0.16166607125084592.
[I 2026-04-28 16:31:53,232] Trial 4 finished with value: 0.1586518153723093 and parameters: {'alpha': 446012.16977835365, 'use_snp_selection': False, 'iw_method': 'pc_logistic', 'iw_clip_max': 10.0, 'iw_prob_clip': 0.04056146617412456, 'iw_n_components': 1, 'iw_logistic_c': 0.016318809798031245, 'iw_pca_fit': 'combined', 'iw_solver': 'lbfgs', 'iw_rho': 0.9}. Best is trial 2 with value: 0.16166607125084592.
[I 2026-04-28 16:35:32,618] Trial 5 finished with value: 0.1563177675686271 and parameters: {'alpha': 81721.51867877056, 'use_snp_selection': False, 'iw_method': 'pc_logistic', 'iw_clip_max': 10.0, 'iw_prob_clip': 0.03936465613829859, 'iw_n_components': 30, 'iw_logistic_c': 0.07026472213126639, 'iw_pca_fit': 'source', 'iw_solver': 'lbfgs', 'iw_rho': 0.5}. Best is trial 2 with value: 0.16166607125084592.
[I 2026-04-28 16:38:49,089] Trial 6 finished with value: 0.16207337116231954 and parameters: {'alpha': 171891.01091076114, 'use_snp_selection': False, 'iw_method': 'pc_logistic', 'iw_clip_max': 3.0, 'iw_prob_clip': 0.0030407243789378874, 'iw_n_components': 2, 'iw_logistic_c': 0.00026825671125139223, 'iw_pca_fit': 'combined', 'iw_solver': 'lbfgs', 'iw_rho': 1.0}. Best is trial 6 with value: 0.16207337116231954.
[I 2026-04-28 16:41:59,923] Trial 7 finished with value: 0.16312155645273715 and parameters: {'alpha': 63478.43463469358, 'use_snp_selection': False, 'iw_method': 'pc_logistic', 'iw_clip_max': 3.0, 'iw_prob_clip': 0.003876317688577816, 'iw_n_components': 1, 'iw_logistic_c': 2.9638123735696538, 'iw_pca_fit': 'combined', 'iw_solver': 'lbfgs', 'iw_rho': 0.9}. Best is trial 7 with value: 0.16312155645273715.
[I 2026-04-28 16:45:48,919] Trial 8 finished with value: 0.16735105801229533 and parameters: {'alpha': 276996.3899943781, 'use_snp_selection': False, 'iw_method': 'pc_logistic', 'iw_clip_max': 5.0, 'iw_prob_clip': 0.015656629950125976, 'iw_n_components': 20, 'iw_logistic_c': 4.238531380010707, 'iw_pca_fit': 'combined', 'iw_solver': 'lbfgs', 'iw_rho': 0.5}. Best is trial 8 with value: 0.16735105801229533.
[I 2026-04-28 16:48:51,733] Trial 9 finished with value: 0.162746121173924 and parameters: {'alpha': 488065.6830993011, 'use_snp_selection': False, 'iw_method': 'pc_logistic', 'iw_clip_max': 2.0, 'iw_prob_clip': 0.004540379253837699, 'iw_n_components': 3, 'iw_logistic_c': 1.3099285637594641e-05, 'iw_pca_fit': 'source', 'iw_solver': 'lbfgs', 'iw_rho': 0.9}. Best is trial 8 with value: 0.16735105801229533.
[I 2026-04-28 16:52:41,843] Trial 10 finished with value: 0.1691458051254589 and parameters: {'alpha': 994176.4485109039, 'use_snp_selection': False, 'iw_method': 'pc_logistic', 'iw_clip_max': 5.0, 'iw_prob_clip': 0.0076335953335939215, 'iw_n_components': 20, 'iw_logistic_c': 5.73569534988433, 'iw_pca_fit': 'combined', 'iw_solver': 'lbfgs', 'iw_rho': 0.75}. Best is trial 10 with value: 0.1691458051254589.
[I 2026-04-28 16:56:31,185] Trial 11 finished with value: 0.1689216517387045 and parameters: {'alpha': 996612.8793889863, 'use_snp_selection': False, 'iw_method': 'pc_logistic', 'iw_clip_max': 5.0, 'iw_prob_clip': 0.006839992947074335, 'iw_n_components': 20, 'iw_logistic_c': 9.854231878159144, 'iw_pca_fit': 'combined', 'iw_solver': 'lbfgs', 'iw_rho': 0.75}. Best is trial 10 with value: 0.1691458051254589.
[I 2026-04-28 17:00:20,262] Trial 12 finished with value: 0.16704258006527864 and parameters: {'alpha': 998671.6157541228, 'use_snp_selection': False, 'iw_method': 'pc_logistic', 'iw_clip_max': 5.0, 'iw_prob_clip': 0.006478792433884706, 'iw_n_components': 20, 'iw_logistic_c': 9.90485772943595, 'iw_pca_fit': 'combined', 'iw_solver': 'lbfgs', 'iw_rho': 0.75}. Best is trial 10 with value: 0.1691458051254589.
[I 2026-04-28 17:04:11,060] Trial 13 finished with value: 0.16728965756348205 and parameters: {'alpha': 829243.3857665542, 'use_snp_selection': False, 'iw_method': 'pc_logistic', 'iw_clip_max': 5.0, 'iw_prob_clip': 0.0074338257991139155, 'iw_n_components': 20, 'iw_logistic_c': 0.6746251449507465, 'iw_pca_fit': 'combined', 'iw_solver': 'lbfgs', 'iw_rho': 0.75}. Best is trial 10 with value: 0.1691458051254589.
[I 2026-04-28 17:08:00,377] Trial 14 finished with value: 0.166756680760344 and parameters: {'alpha': 604187.7399799703, 'use_snp_selection': False, 'iw_method': 'pc_logistic', 'iw_clip_max': 1.5, 'iw_prob_clip': 0.008877896815989559, 'iw_n_components': 20, 'iw_logistic_c': 0.5262666663801944, 'iw_pca_fit': 'combined', 'iw_solver': 'lbfgs', 'iw_rho': 0.75}. Best is trial 10 with value: 0.1691458051254589.
[I 2026-04-28 17:11:45,755] Trial 15 finished with value: 0.15855336405190418 and parameters: {'alpha': 667351.2877731434, 'use_snp_selection': False, 'iw_method': 'pc_logistic', 'iw_clip_max': 5.0, 'iw_prob_clip': 0.005521784902882029, 'iw_n_components': 10, 'iw_logistic_c': 0.005004308789766709, 'iw_pca_fit': 'combined', 'iw_solver': 'lbfgs', 'iw_rho': 0.75}. Best is trial 10 with value: 0.1691458051254589.
[I 2026-04-28 17:15:06,251] Trial 16 finished with value: 0.15990365381666677 and parameters: {'alpha': 386718.6886170822, 'use_snp_selection': False, 'iw_method': 'pc_logistic', 'iw_clip_max': 5.0, 'iw_prob_clip': 0.011512382530423065, 'iw_n_components': 5, 'iw_logistic_c': 0.3705909432090393, 'iw_pca_fit': 'combined', 'iw_solver': 'lbfgs', 'iw_rho': 0.75}. Best is trial 10 with value: 0.1691458051254589.
[I 2026-04-28 17:18:21,565] Trial 17 finished with value: 0.15733105678740247 and parameters: {'alpha': 783563.0371415005, 'use_snp_selection': False, 'iw_method': 'pc_logistic', 'iw_clip_max': 2.0, 'iw_prob_clip': 0.028146534247412754, 'iw_n_components': 2, 'iw_logistic_c': 3.132324278537236e-05, 'iw_pca_fit': 'combined', 'iw_solver': 'lbfgs', 'iw_rho': 0.75}. Best is trial 10 with value: 0.1691458051254589.
[I 2026-04-28 17:22:11,212] Trial 18 finished with value: 0.15911559184208873 and parameters: {'alpha': 356491.97626682284, 'use_snp_selection': False, 'iw_method': 'pc_logistic', 'iw_clip_max': 1.5, 'iw_prob_clip': 0.0038983522070964774, 'iw_n_components': 30, 'iw_logistic_c': 1.298225007491155e-07, 'iw_pca_fit': 'combined', 'iw_solver': 'lbfgs', 'iw_rho': 0.75}. Best is trial 10 with value: 0.1691458051254589.
[I 2026-04-28 17:26:06,201] Trial 19 finished with value: 0.16164376358527746 and parameters: {'alpha': 105294.74113473411, 'use_snp_selection': False, 'iw_method': 'pc_logistic', 'iw_clip_max': 5.0, 'iw_prob_clip': 0.012084110663649122, 'iw_n_components': 20, 'iw_logistic_c': 1.0478064100704934, 'iw_pca_fit': 'combined', 'iw_solver': 'lbfgs', 'iw_rho': 0.75}. Best is trial 10 with value: 0.1691458051254589.
[I 2026-04-28 17:30:01,955] Trial 20 finished with value: 0.16656500800366822 and parameters: {'alpha': 993130.9764024427, 'use_snp_selection': False, 'iw_method': 'pc_logistic', 'iw_clip_max': 5.0, 'iw_prob_clip': 0.005694845293992653, 'iw_n_components': 20, 'iw_logistic_c': 0.0025140896593601634, 'iw_pca_fit': 'combined', 'iw_solver': 'lbfgs', 'iw_rho': 0.75}. Best is trial 10 with value: 0.1691458051254589.
[I 2026-04-28 17:33:59,622] Trial 21 finished with value: 0.16483236608574606 and parameters: {'alpha': 300908.64766634733, 'use_snp_selection': False, 'iw_method': 'pc_logistic', 'iw_clip_max': 5.0, 'iw_prob_clip': 0.015295112780937132, 'iw_n_components': 20, 'iw_logistic_c': 9.807608291788723, 'iw_pca_fit': 'combined', 'iw_solver': 'lbfgs', 'iw_rho': 0.5}. Best is trial 10 with value: 0.1691458051254589.
[I 2026-04-28 17:37:56,029] Trial 22 finished with value: 0.16983523546598167 and parameters: {'alpha': 534505.0239561105, 'use_snp_selection': False, 'iw_method': 'pc_logistic', 'iw_clip_max': 5.0, 'iw_prob_clip': 0.007761068984604232, 'iw_n_components': 20, 'iw_logistic_c': 2.69760786363129, 'iw_pca_fit': 'combined', 'iw_solver': 'lbfgs', 'iw_rho': 0.5}. Best is trial 22 with value: 0.16983523546598167.
[I 2026-04-28 17:41:47,725] Trial 23 finished with value: 0.16939068986490347 and parameters: {'alpha': 557744.493677032, 'use_snp_selection': False, 'iw_method': 'pc_logistic', 'iw_clip_max': 5.0, 'iw_prob_clip': 0.007827564593835691, 'iw_n_components': 20, 'iw_logistic_c': 0.10185379240684972, 'iw_pca_fit': 'combined', 'iw_solver': 'lbfgs', 'iw_rho': 0.5}. Best is trial 22 with value: 0.16983523546598167.
[I 2026-04-28 17:45:45,038] Trial 24 finished with value: 0.16729078261954602 and parameters: {'alpha': 555177.1498378278, 'use_snp_selection': False, 'iw_method': 'pc_logistic', 'iw_clip_max': 5.0, 'iw_prob_clip': 0.008603474605922251, 'iw_n_components': 20, 'iw_logistic_c': 0.12544776178905692, 'iw_pca_fit': 'combined', 'iw_solver': 'lbfgs', 'iw_rho': 0.5}. Best is trial 22 with value: 0.16983523546598167.
[I 2026-04-28 17:49:39,109] Trial 25 finished with value: 0.16746137032990643 and parameters: {'alpha': 720448.787405034, 'use_snp_selection': False, 'iw_method': 'pc_logistic', 'iw_clip_max': 5.0, 'iw_prob_clip': 0.002107473569986985, 'iw_n_components': 20, 'iw_logistic_c': 2.24112364443575, 'iw_pca_fit': 'combined', 'iw_solver': 'lbfgs', 'iw_rho': 0.5}. Best is trial 22 with value: 0.16983523546598167.
[I 2026-04-28 17:53:00,052] Trial 26 finished with value: 0.1590443908520666 and parameters: {'alpha': 502910.9226162362, 'use_snp_selection': False, 'iw_method': 'pc_logistic', 'iw_clip_max': 2.0, 'iw_prob_clip': 0.004640841045165678, 'iw_n_components': 3, 'iw_logistic_c': 0.18366520888027746, 'iw_pca_fit': 'combined', 'iw_solver': 'lbfgs', 'iw_rho': 0.5}. Best is trial 22 with value: 0.16983523546598167.
[I 2026-04-28 17:56:00,924] Trial 27 finished with value: 0.1637792076566579 and parameters: {'alpha': 378606.9407539831, 'use_snp_selection': False, 'iw_method': 'pc_logistic', 'iw_clip_max': 1.5, 'iw_prob_clip': 0.012603973691126912, 'iw_n_components': 1, 'iw_logistic_c': 0.018819067188966376, 'iw_pca_fit': 'source', 'iw_solver': 'lbfgs', 'iw_rho': 0.5}. Best is trial 22 with value: 0.16983523546598167.
[I 2026-04-28 17:59:49,604] Trial 28 finished with value: 0.1596672406568623 and parameters: {'alpha': 631927.8351448523, 'use_snp_selection': False, 'iw_method': 'pc_logistic', 'iw_clip_max': 5.0, 'iw_prob_clip': 0.008306526191328309, 'iw_n_components': 10, 'iw_logistic_c': 1.2017150181390863, 'iw_pca_fit': 'combined', 'iw_solver': 'lbfgs', 'iw_rho': 0.5}. Best is trial 22 with value: 0.16983523546598167.
[I 2026-04-28 18:02:59,730] Trial 29 finished with value: 0.15974666843621066 and parameters: {'alpha': 173713.994900608, 'use_snp_selection': False, 'iw_method': 'pc_logistic', 'iw_clip_max': 5.0, 'iw_prob_clip': 0.010101699170596131, 'iw_n_components': 5, 'iw_logistic_c': 0.031810872523376464, 'iw_pca_fit': 'source', 'iw_solver': 'lbfgs', 'iw_rho': 1.0}. Best is trial 22 with value: 0.16983523546598167.
[I 2026-04-28 18:06:20,288] Trial 30 finished with value: 0.15742353727158015 and parameters: {'alpha': 815865.5248900747, 'use_snp_selection': False, 'iw_method': 'pc_logistic', 'iw_clip_max': 5.0, 'iw_prob_clip': 0.005419110269731844, 'iw_n_components': 2, 'iw_logistic_c': 0.004692946757462428, 'iw_pca_fit': 'combined', 'iw_solver': 'lbfgs', 'iw_rho': 0.5}. Best is trial 22 with value: 0.16983523546598167.
[I 2026-04-28 18:10:15,222] Trial 31 finished with value: 0.16840000821839599 and parameters: {'alpha': 838674.570070159, 'use_snp_selection': False, 'iw_method': 'pc_logistic', 'iw_clip_max': 5.0, 'iw_prob_clip': 0.006785309382858754, 'iw_n_components': 20, 'iw_logistic_c': 3.7918381741634533, 'iw_pca_fit': 'combined', 'iw_solver': 'lbfgs', 'iw_rho': 0.75}. Best is trial 22 with value: 0.16983523546598167.
[I 2026-04-28 18:14:10,343] Trial 32 finished with value: -1.0 and parameters: {'alpha': 576730.7751121596, 'use_snp_selection': False, 'iw_method': 'pc_logistic', 'iw_clip_max': 5.0, 'iw_prob_clip': 0.007042073418595569, 'iw_n_components': 20, 'iw_logistic_c': 0.2748787475717456, 'iw_pca_fit': 'combined', 'iw_solver': 'lbfgs', 'iw_rho': 1.0}. Best is trial 22 with value: 0.16983523546598167.
[I 2026-04-28 18:18:10,748] Trial 33 finished with value: 0.16577341463322975 and parameters: {'alpha': 997850.6308952271, 'use_snp_selection': False, 'iw_method': 'pc_logistic', 'iw_clip_max': 5.0, 'iw_prob_clip': 0.00829100295165332, 'iw_n_components': 20, 'iw_logistic_c': 9.293750416539742, 'iw_pca_fit': 'combined', 'iw_solver': 'lbfgs', 'iw_rho': 0.5}. Best is trial 22 with value: 0.16983523546598167.
[I 2026-04-28 18:21:54,592] Trial 34 finished with value: 0.1598702722071673 and parameters: {'alpha': 428815.6570255679, 'use_snp_selection': False, 'iw_method': 'pc_logistic', 'iw_clip_max': 3.0, 'iw_prob_clip': 0.018717223056492305, 'iw_n_components': 20, 'iw_logistic_c': 1.6207104412542572, 'iw_pca_fit': 'source', 'iw_solver': 'lbfgs', 'iw_rho': 0.75}. Best is trial 22 with value: 0.16983523546598167.
[I 2026-04-28 18:26:00,623] Trial 35 finished with value: -1.0 and parameters: {'alpha': 222102.56426570387, 'use_snp_selection': False, 'iw_method': 'pc_logistic', 'iw_clip_max': 10.0, 'iw_prob_clip': 0.010269953253623548, 'iw_n_components': 30, 'iw_logistic_c': 0.6851263596335833, 'iw_pca_fit': 'combined', 'iw_solver': 'lbfgs', 'iw_rho': 1.0}. Best is trial 22 with value: 0.16983523546598167.
[I 2026-04-28 18:29:30,663] Trial 36 finished with value: 0.15349578894254007 and parameters: {'alpha': 690747.2053351426, 'use_snp_selection': False, 'iw_method': 'pc_logistic', 'iw_clip_max': 5.0, 'iw_prob_clip': 0.0033184451259844856, 'iw_n_components': 5, 'iw_logistic_c': 0.08820474335411817, 'iw_pca_fit': 'combined', 'iw_solver': 'lbfgs', 'iw_rho': 0.9}. Best is trial 22 with value: 0.16983523546598167.
[I 2026-04-28 18:33:12,681] Trial 37 finished with value: 0.15740584494776053 and parameters: {'alpha': 320640.80530764343, 'use_snp_selection': False, 'iw_method': 'pc_logistic', 'iw_clip_max': 10.0, 'iw_prob_clip': 0.013666778103121877, 'iw_n_components': 20, 'iw_logistic_c': 0.0453266799537878, 'iw_pca_fit': 'source', 'iw_solver': 'lbfgs', 'iw_rho': 0.5}. Best is trial 22 with value: 0.16983523546598167.
[I 2026-04-28 18:36:38,640] Trial 38 finished with value: 0.15622961684392056 and parameters: {'alpha': 868215.5368109207, 'use_snp_selection': False, 'iw_method': 'pc_logistic', 'iw_clip_max': 3.0, 'iw_prob_clip': 0.006020519203124982, 'iw_n_components': 3, 'iw_logistic_c': 3.41722742042794, 'iw_pca_fit': 'combined', 'iw_solver': 'lbfgs', 'iw_rho': 0.5}. Best is trial 22 with value: 0.16983523546598167.
[I 2026-04-28 18:40:29,755] Trial 39 finished with value: 0.16300568600780976 and parameters: {'alpha': 435780.3842836152, 'use_snp_selection': False, 'iw_method': 'pc_logistic', 'iw_clip_max': 1.5, 'iw_prob_clip': 0.02436276149601253, 'iw_n_components': 10, 'iw_logistic_c': 0.00012470825296648658, 'iw_pca_fit': 'combined', 'iw_solver': 'lbfgs', 'iw_rho': 0.75}. Best is trial 22 with value: 0.16983523546598167.
[I 2026-04-28 18:43:48,592] Trial 40 finished with value: 0.16939855248195645 and parameters: {'alpha': 209611.2200935219, 'use_snp_selection': False, 'iw_method': 'pc_logistic', 'iw_clip_max': 2.0, 'iw_prob_clip': 0.004135074451694896, 'iw_n_components': 1, 'iw_logistic_c': 0.19293313639731566, 'iw_pca_fit': 'combined', 'iw_solver': 'lbfgs', 'iw_rho': 0.9}. Best is trial 22 with value: 0.16983523546598167.
[I 2026-04-28 18:47:02,831] Trial 41 finished with value: 0.16850528640525653 and parameters: {'alpha': 149927.85577984093, 'use_snp_selection': False, 'iw_method': 'pc_logistic', 'iw_clip_max': 2.0, 'iw_prob_clip': 0.004862047686401314, 'iw_n_components': 1, 'iw_logistic_c': 0.33144619157771454, 'iw_pca_fit': 'combined', 'iw_solver': 'lbfgs', 'iw_rho': 0.9}. Best is trial 22 with value: 0.16983523546598167.
[I 2026-04-28 18:50:17,139] Trial 42 finished with value: 0.16977671701005184 and parameters: {'alpha': 212629.46612858775, 'use_snp_selection': False, 'iw_method': 'pc_logistic', 'iw_clip_max': 2.0, 'iw_prob_clip': 0.0027448699070390737, 'iw_n_components': 1, 'iw_logistic_c': 4.521636159339777, 'iw_pca_fit': 'combined', 'iw_solver': 'lbfgs', 'iw_rho': 0.9}. Best is trial 22 with value: 0.16983523546598167.
[I 2026-04-28 18:53:31,135] Trial 43 finished with value: 0.16969979141148914 and parameters: {'alpha': 219157.40611105564, 'use_snp_selection': False, 'iw_method': 'pc_logistic', 'iw_clip_max': 2.0, 'iw_prob_clip': 0.0033639238504664165, 'iw_n_components': 1, 'iw_logistic_c': 0.010240969702080147, 'iw_pca_fit': 'combined', 'iw_solver': 'lbfgs', 'iw_rho': 0.9}. Best is trial 22 with value: 0.16983523546598167.
[I 2026-04-28 18:56:43,891] Trial 44 finished with value: 0.16984423458448955 and parameters: {'alpha': 201032.67943835625, 'use_snp_selection': False, 'iw_method': 'pc_logistic', 'iw_clip_max': 2.0, 'iw_prob_clip': 0.002673696249712632, 'iw_n_components': 1, 'iw_logistic_c': 0.01010730735106802, 'iw_pca_fit': 'combined', 'iw_solver': 'lbfgs', 'iw_rho': 0.9}. Best is trial 44 with value: 0.16984423458448955.
[I 2026-04-28 19:00:00,456] Trial 45 finished with value: 0.17000493352485024 and parameters: {'alpha': 228227.70006681996, 'use_snp_selection': False, 'iw_method': 'pc_logistic', 'iw_clip_max': 2.0, 'iw_prob_clip': 0.0024046263784719404, 'iw_n_components': 1, 'iw_logistic_c': 0.00688001011961799, 'iw_pca_fit': 'combined', 'iw_solver': 'lbfgs', 'iw_rho': 0.9}. Best is trial 45 with value: 0.17000493352485024.
[I 2026-04-28 19:03:00,898] Trial 46 finished with value: 0.16692008572661213 and parameters: {'alpha': 122882.99144549177, 'use_snp_selection': False, 'iw_method': 'pc_logistic', 'iw_clip_max': 2.0, 'iw_prob_clip': 0.0026731275357257094, 'iw_n_components': 1, 'iw_logistic_c': 0.0013051976955451214, 'iw_pca_fit': 'source', 'iw_solver': 'lbfgs', 'iw_rho': 0.9}. Best is trial 45 with value: 0.17000493352485024.
[I 2026-04-28 19:06:14,535] Trial 47 finished with value: 0.16997585980215166 and parameters: {'alpha': 187656.4833761984, 'use_snp_selection': False, 'iw_method': 'pc_logistic', 'iw_clip_max': 2.0, 'iw_prob_clip': 0.0020137504007833986, 'iw_n_components': 1, 'iw_logistic_c': 0.009287923524943665, 'iw_pca_fit': 'combined', 'iw_solver': 'lbfgs', 'iw_rho': 0.9}. Best is trial 45 with value: 0.17000493352485024.
[I 2026-04-28 19:09:28,092] Trial 48 finished with value: 0.17076969739757522 and parameters: {'alpha': 184205.23502973816, 'use_snp_selection': False, 'iw_method': 'pc_logistic', 'iw_clip_max': 2.0, 'iw_prob_clip': 0.0020869762296605674, 'iw_n_components': 1, 'iw_logistic_c': 0.0006141482816050169, 'iw_pca_fit': 'combined', 'iw_solver': 'lbfgs', 'iw_rho': 0.9}. Best is trial 48 with value: 0.17076969739757522.
[I 2026-04-28 19:12:43,523] Trial 49 finished with value: 0.17123454764327575 and parameters: {'alpha': 182093.17509621242, 'use_snp_selection': False, 'iw_method': 'pc_logistic', 'iw_clip_max': 2.0, 'iw_prob_clip': 0.0020677761055219713, 'iw_n_components': 1, 'iw_logistic_c': 0.00025685510099125947, 'iw_pca_fit': 'combined', 'iw_solver': 'lbfgs', 'iw_rho': 0.9}. Best is trial 49 with value: 0.17123454764327575.
[I 2026-04-28 19:15:59,259] Trial 50 finished with value: 0.1710265966207225 and parameters: {'alpha': 260539.76884458336, 'use_snp_selection': False, 'iw_method': 'pc_logistic', 'iw_clip_max': 2.0, 'iw_prob_clip': 0.0022536532166740715, 'iw_n_components': 1, 'iw_logistic_c': 0.00040381569424991696, 'iw_pca_fit': 'combined', 'iw_solver': 'lbfgs', 'iw_rho': 0.9}. Best is trial 49 with value: 0.17123454764327575.
[I 2026-04-28 19:19:15,003] Trial 51 finished with value: 0.1713108733597297 and parameters: {'alpha': 253525.16649017093, 'use_snp_selection': False, 'iw_method': 'pc_logistic', 'iw_clip_max': 2.0, 'iw_prob_clip': 0.0020279615882290657, 'iw_n_components': 1, 'iw_logistic_c': 0.0002938405405615041, 'iw_pca_fit': 'combined', 'iw_solver': 'lbfgs', 'iw_rho': 0.9}. Best is trial 51 with value: 0.1713108733597297.
[I 2026-04-28 19:22:30,490] Trial 52 finished with value: 0.1711145466238547 and parameters: {'alpha': 255294.71971027425, 'use_snp_selection': False, 'iw_method': 'pc_logistic', 'iw_clip_max': 2.0, 'iw_prob_clip': 0.002066531710072479, 'iw_n_components': 1, 'iw_logistic_c': 0.0003877586966872173, 'iw_pca_fit': 'combined', 'iw_solver': 'lbfgs', 'iw_rho': 0.9}. Best is trial 51 with value: 0.1713108733597297.
