[I 2026-04-21 17:57:07,601] Trial 29 finished with value: 0.28844354753991125 and parameters: {'hidden_dims': '[256, 128]', 'dropout': 0.20154411229798677, 'batch_norm': True, 'lr': 1.0245190900134177e-05, 'weight_decay': 3.1766965755146034e-06, 'epochs': 269, 'loss': 'mse', 'optimizer': 'adam', 'use_snp_selection': True, 'num_snps': 27062, 'weight_scheme': 'minmax', 'weight_clip_max': 10.0, 'weight_minmax_eps': 0.0002900146206834195}. Best is trial 28 with value: 0.31501852155860727.
[I 2026-04-21 17:57:10,630] Trial 20 finished with value: 0.3221917433415758 and parameters: {'hidden_dims': '[512, 64]', 'dropout': 0.504938386085534, 'batch_norm': False, 'lr': 9.923997968315308e-06, 'weight_decay': 0.00024382426177040257, 'epochs': 262, 'loss': 'mae', 'optimizer': 'adam', 'use_snp_selection': True, 'num_snps': 56302, 'weight_scheme': 'top-heavy', 'weight_clip_max': 10.0, 'weight_topheavy_top_frac': 0.2923144127203675, 'weight_topheavy_low': 0.8806029132680413, 'weight_topheavy_high': 1.2128297622439081}. Best is trial 20 with value: 0.3221917433415758.
[I 2026-04-21 17:57:31,676] Trial 30 finished with value: 0.2254225273075292 and parameters: {'hidden_dims': '[256, 128]', 'dropout': 0.3429568939827908, 'batch_norm': False, 'lr': 2.2981888370076712e-05, 'weight_decay': 5.248896434641009e-07, 'epochs': 261, 'loss': 'mae', 'optimizer': 'adamw', 'use_snp_selection': True, 'num_snps': 17704, 'weight_scheme': 'minmax', 'weight_clip_max': 5.0, 'weight_minmax_eps': 0.047468948861624304}. Best is trial 28 with value: 0.31501852155860727.
[I 2026-04-21 17:58:01,623] Trial 31 finished with value: 0.26977936591180973 and parameters: {'hidden_dims': '[256, 128]', 'dropout': 0.40786010248127996, 'batch_norm': False, 'lr': 1.7269121544211412e-06, 'weight_decay': 6.474265898525228e-06, 'epochs': 195, 'loss': 'mae', 'optimizer': 'adam', 'use_snp_selection': True, 'num_snps': 36146, 'weight_scheme': 'minmax', 'weight_clip_max': None, 'weight_minmax_eps': 0.04427547850585776}. Best is trial 28 with value: 0.31501852155860727.
[I 2026-04-21 17:58:14,002] Trial 21 finished with value: 0.30495114973378834 and parameters: {'hidden_dims': '[512, 64]', 'dropout': 0.5053750838830339, 'batch_norm': False, 'lr': 1.1422244660254316e-05, 'weight_decay': 0.00020216003879364297, 'epochs': 266, 'loss': 'mae', 'optimizer': 'adam', 'use_snp_selection': True, 'num_snps': 59387, 'weight_scheme': 'top-heavy', 'weight_clip_max': 10.0, 'weight_topheavy_top_frac': 0.30598288150593883, 'weight_topheavy_low': 0.8616788410164775, 'weight_topheavy_high': 1.2702239918539222}. Best is trial 20 with value: 0.3221917433415758.
[I 2026-04-21 17:58:32,831] Trial 32 finished with value: 0.32693437570818573 and parameters: {'hidden_dims': '[256, 128]', 'dropout': 0.5372037329965782, 'batch_norm': False, 'lr': 1.3235694408061645e-06, 'weight_decay': 8.77423612574914e-08, 'epochs': 300, 'loss': 'mae', 'optimizer': 'adam', 'use_snp_selection': True, 'num_snps': 30931, 'weight_scheme': 'minmax', 'weight_clip_max': None, 'weight_minmax_eps': 0.030298056636305123}. Best is trial 32 with value: 0.32693437570818573.
[I 2026-04-21 17:59:03,090] Trial 33 finished with value: 0.23912044336026453 and parameters: {'hidden_dims': '[256, 128]', 'dropout': 0.1004481175523444, 'batch_norm': False, 'lr': 4.969528881013267e-06, 'weight_decay': 4.764569748828134e-08, 'epochs': 291, 'loss': 'mae', 'optimizer': 'adam', 'use_snp_selection': True, 'num_snps': 28618, 'weight_scheme': 'minmax', 'weight_clip_max': None, 'weight_minmax_eps': 0.016455914088217165}. Best is trial 32 with value: 0.32693437570818573.
[I 2026-04-21 17:59:10,491] Trial 22 finished with value: 0.28946067589280855 and parameters: {'hidden_dims': '[512, 64]', 'dropout': 0.5303501404687767, 'batch_norm': False, 'lr': 9.142784902700442e-06, 'weight_decay': 0.0002084995154493462, 'epochs': 272, 'loss': 'mae', 'optimizer': 'adam', 'use_snp_selection': True, 'num_snps': 49679, 'weight_scheme': 'top-heavy', 'weight_clip_max': 10.0, 'weight_topheavy_top_frac': 0.2904906018568374, 'weight_topheavy_low': 0.8689022895985283, 'weight_topheavy_high': 1.2036705026094665}. Best is trial 20 with value: 0.3221917433415758.
[I 2026-04-21 17:59:28,378] Trial 34 finished with value: 0.26624546368247265 and parameters: {'hidden_dims': '[256, 128]', 'dropout': 0.29315114354630745, 'batch_norm': True, 'lr': 1.3239327626710991e-06, 'weight_decay': 1.0209813387251802e-07, 'epochs': 300, 'loss': 'mse', 'optimizer': 'adam', 'use_snp_selection': False, 'weight_scheme': 'minmax', 'weight_clip_max': None, 'weight_minmax_eps': 0.028480951509218283}. Best is trial 32 with value: 0.32693437570818573.
[I 2026-04-21 17:59:53,692] Trial 35 finished with value: 0.24231185105972944 and parameters: {'hidden_dims': '[256, 128]', 'dropout': 0.19793503372933596, 'batch_norm': False, 'lr': 0.0005115448013929533, 'weight_decay': 3.2091108061487867e-07, 'epochs': 276, 'loss': 'mae', 'optimizer': 'adam', 'use_snp_selection': True, 'num_snps': 20531, 'weight_scheme': 'linear', 'weight_clip_max': None, 'weight_linear_min_weight': 0.9955659828934942, 'weight_linear_max_weight': 3.920037298687725}. Best is trial 32 with value: 0.32693437570818573.
[I 2026-04-21 18:00:06,965] Trial 23 finished with value: 0.2659744670754159 and parameters: {'hidden_dims': '[512, 64]', 'dropout': 0.4684855836519343, 'batch_norm': False, 'lr': 8.217592035458599e-06, 'weight_decay': 0.00024417392205684384, 'epochs': 262, 'loss': 'mae', 'optimizer': 'adam', 'use_snp_selection': True, 'num_snps': 51535, 'weight_scheme': 'top-heavy', 'weight_clip_max': 10.0, 'weight_topheavy_top_frac': 0.31674913761533935, 'weight_topheavy_low': 0.8521445881325944, 'weight_topheavy_high': 1.328407472369428}. Best is trial 20 with value: 0.3221917433415758.
[I 2026-04-21 18:00:14,904] Trial 36 finished with value: -0.03671283304630265 and parameters: {'hidden_dims': '[256, 128]', 'dropout': 0.23437391620594916, 'batch_norm': False, 'lr': 3.1203204043102037e-06, 'weight_decay': 5.915931455345723e-08, 'epochs': 252, 'loss': 'mse', 'optimizer': 'sgd', 'use_snp_selection': False, 'weight_scheme': 'minmax', 'weight_clip_max': None, 'weight_minmax_eps': 0.06805414210156976}. Best is trial 32 with value: 0.32693437570818573.
[I 2026-04-21 18:00:46,412] Trial 37 finished with value: 0.2547954066598899 and parameters: {'hidden_dims': '[256, 64]', 'dropout': 0.3305962004268108, 'batch_norm': True, 'lr': 0.0002900767366795342, 'weight_decay': 2.641063161263636e-06, 'epochs': 232, 'loss': 'mae', 'optimizer': 'adam', 'use_snp_selection': True, 'num_snps': 35662, 'weight_scheme': 'minmax', 'weight_clip_max': 10.0, 'weight_minmax_eps': 0.02538547680593144}. Best is trial 32 with value: 0.32693437570818573.
[I 2026-04-21 18:01:04,451] Trial 24 finished with value: 0.28534078930102463 and parameters: {'hidden_dims': '[512, 64]', 'dropout': 0.32674748749867477, 'batch_norm': False, 'lr': 1.8951444433301734e-05, 'weight_decay': 0.0008791037417223199, 'epochs': 226, 'loss': 'mae', 'optimizer': 'adam', 'use_snp_selection': True, 'num_snps': 59241, 'weight_scheme': 'top-heavy', 'weight_clip_max': 10.0, 'weight_topheavy_top_frac': 0.21080560414587246, 'weight_topheavy_low': 0.9457737533675193, 'weight_topheavy_high': 2.4397425277902585}. Best is trial 20 with value: 0.3221917433415758.
[I 2026-04-21 18:01:09,540] Trial 38 finished with value: -0.03266937959159557 and parameters: {'hidden_dims': '[256, 128]', 'dropout': 0.5618737369136448, 'batch_norm': False, 'lr': 6.597342997052828e-05, 'weight_decay': 7.635050934164931e-07, 'epochs': 278, 'loss': 'mae', 'optimizer': 'sgd', 'use_snp_selection': False, 'weight_scheme': 'linear', 'weight_clip_max': None, 'weight_linear_min_weight': 0.6093901116214043, 'weight_linear_max_weight': 2.77972780006115}. Best is trial 32 with value: 0.32693437570818573.
[I 2026-04-21 18:01:39,196] Trial 39 finished with value: 0.19120623948991933 and parameters: {'hidden_dims': '[256, 64]', 'dropout': 0.07757723231416486, 'batch_norm': True, 'lr': 2.133519621532898e-06, 'weight_decay': 1.6335285137063293e-07, 'epochs': 300, 'loss': 'mse', 'optimizer': 'adam', 'use_snp_selection': True, 'num_snps': 27496, 'weight_scheme': 'minmax', 'weight_clip_max': 5.0, 'weight_minmax_eps': 0.0029006389692223704}. Best is trial 32 with value: 0.32693437570818573.
[I 2026-04-21 18:01:59,074] Trial 25 finished with value: 0.29897438011727906 and parameters: {'hidden_dims': '[512, 64]', 'dropout': 0.5375049124241088, 'batch_norm': False, 'lr': 2.5705531499509946e-06, 'weight_decay': 0.0002617723655807324, 'epochs': 297, 'loss': 'mae', 'optimizer': 'adam', 'use_snp_selection': True, 'num_snps': 44960, 'weight_scheme': 'top-heavy', 'weight_clip_max': 10.0, 'weight_topheavy_top_frac': 0.3721782584463596, 'weight_topheavy_low': 0.7301542919141454, 'weight_topheavy_high': 2.3930448433123943}. Best is trial 20 with value: 0.3221917433415758.
[I 2026-04-21 18:02:30,019] Trial 0 finished with value: -0.027628625607650798 and parameters: {'hidden_dims': '[256, 128]', 'dropout': 0.18584155530312246, 'batch_norm': True, 'lr': 9.012665953349533e-06, 'weight_decay': 4.96591963698479e-06, 'epochs': 105, 'loss': 'mse', 'optimizer': 'sgd', 'use_snp_selection': True, 'num_snps': 25583, 'weight_scheme': 'minmax', 'weight_clip_max': 5.0, 'weight_minmax_eps': 0.14026014881292506}. Best is trial 0 with value: -0.027628625607650798.
[I 2026-04-21 18:02:31,946] Trial 26 finished with value: 0.2811470732389954 and parameters: {'hidden_dims': '[512, 64]', 'dropout': 0.44635569961291544, 'batch_norm': True, 'lr': 1.0457366141412904e-05, 'weight_decay': 2.802390236425365e-05, 'epochs': 194, 'loss': 'mae', 'optimizer': 'adam', 'use_snp_selection': False, 'weight_scheme': 'top-heavy', 'weight_clip_max': 10.0, 'weight_topheavy_top_frac': 0.0698373398937728, 'weight_topheavy_low': 1.0023909878315227, 'weight_topheavy_high': 1.2502867807926914}. Best is trial 20 with value: 0.3221917433415758.
[I 2026-04-21 18:02:41,872] Trial 1 finished with value: 0.1389520852929943 and parameters: {'hidden_dims': '[256, 64]', 'dropout': 0.05000949662985405, 'batch_norm': True, 'lr': 0.00015647443054904835, 'weight_decay': 5.158896024962846e-05, 'epochs': 152, 'loss': 'mse', 'optimizer': 'sgd', 'use_snp_selection': False, 'weight_scheme': 'linear', 'weight_clip_max': None, 'weight_linear_min_weight': 0.21922985165550554, 'weight_linear_max_weight': 1.6260435767424388}. Best is trial 1 with value: 0.1389520852929943.
[I 2026-04-21 18:03:03,432] Trial 2 finished with value: 0.12343887551814457 and parameters: {'hidden_dims': '[512, 128]', 'dropout': 0.2736730891340176, 'batch_norm': True, 'lr': 7.298114623433994e-05, 'weight_decay': 5.6346010385734023e-08, 'epochs': 185, 'loss': 'mae', 'optimizer': 'sgd', 'use_snp_selection': True, 'num_snps': 14091, 'weight_scheme': 'minmax', 'weight_clip_max': 10.0, 'weight_minmax_eps': 0.045780660776687306}. Best is trial 1 with value: 0.1389520852929943.
[I 2026-04-21 18:03:27,010] Trial 27 finished with value: 0.28415730856950133 and parameters: {'hidden_dims': '[512, 64]', 'dropout': 0.5506872537544152, 'batch_norm': False, 'lr': 4.917462948544445e-05, 'weight_decay': 0.00011389542803133137, 'epochs': 240, 'loss': 'mae', 'optimizer': 'adam', 'use_snp_selection': True, 'num_snps': 53263, 'weight_scheme': 'top-heavy', 'weight_clip_max': 10.0, 'weight_topheavy_top_frac': 0.22610122175178354, 'weight_topheavy_low': 0.7178045882969225, 'weight_topheavy_high': 2.1227043548556255}. Best is trial 20 with value: 0.3221917433415758.
[I 2026-04-21 18:03:40,249] Trial 3 finished with value: 0.10008864258263549 and parameters: {'hidden_dims': '[512, 64]', 'dropout': 0.30157795416637295, 'batch_norm': False, 'lr': 2.007492282795256e-05, 'weight_decay': 5.496446859789657e-06, 'epochs': 284, 'loss': 'mse', 'optimizer': 'sgd', 'use_snp_selection': False, 'weight_scheme': 'linear', 'weight_clip_max': None, 'weight_linear_min_weight': 0.24682154527102826, 'weight_linear_max_weight': 1.8338910783134623}. Best is trial 1 with value: 0.1389520852929943.
[I 2026-04-21 18:03:51,796] Trial 4 finished with value: 0.07512539784172188 and parameters: {'hidden_dims': '[256, 64]', 'dropout': 0.18128694708490736, 'batch_norm': False, 'lr': 8.951826748007403e-05, 'weight_decay': 2.1781541495465197e-07, 'epochs': 147, 'loss': 'mse', 'optimizer': 'sgd', 'use_snp_selection': False, 'weight_scheme': 'top-heavy', 'weight_clip_max': 5.0, 'weight_topheavy_top_frac': 0.1724888194073277, 'weight_topheavy_low': 1.1620865802171172, 'weight_topheavy_high': 3.476906528073177}. Best is trial 1 with value: 0.1389520852929943.
[I 2026-04-21 18:04:01,672] Trial 5 finished with value: 0.13739732501782206 and parameters: {'hidden_dims': '[256, 64]', 'dropout': 0.2571412946970998, 'batch_norm': True, 'lr': 3.546238022482882e-05, 'weight_decay': 1.0185234767613396e-06, 'epochs': 119, 'loss': 'mse', 'optimizer': 'sgd', 'use_snp_selection': False, 'weight_scheme': 'linear', 'weight_clip_max': 10.0, 'weight_linear_min_weight': 0.9405832045183805, 'weight_linear_max_weight': 3.413610925325811}. Best is trial 1 with value: 0.1389520852929943.
[I 2026-04-21 18:04:19,878] Trial 6 finished with value: 0.22076170280695384 and parameters: {'hidden_dims': '[256, 64]', 'dropout': 0.037961443806696214, 'batch_norm': True, 'lr': 3.644202049829694e-05, 'weight_decay': 9.73334309820277e-06, 'epochs': 243, 'loss': 'mae', 'optimizer': 'adam', 'use_snp_selection': False, 'weight_scheme': 'minmax', 'weight_clip_max': None, 'weight_minmax_eps': 0.08689611239934374}. Best is trial 6 with value: 0.22076170280695384.
[I 2026-04-21 18:04:21,860] Trial 28 finished with value: 0.3044817151166493 and parameters: {'hidden_dims': '[512, 64]', 'dropout': 0.3884847813159836, 'batch_norm': False, 'lr': 1.4702973399672009e-05, 'weight_decay': 0.0009627028625397153, 'epochs': 277, 'loss': 'mae', 'optimizer': 'adam', 'use_snp_selection': True, 'num_snps': 47631, 'weight_scheme': 'uniform', 'weight_clip_max': 10.0}. Best is trial 20 with value: 0.3221917433415758.
[I 2026-04-21 18:05:00,567] Trial 7 finished with value: 0.056086378337157454 and parameters: {'hidden_dims': '[512, 128]', 'dropout': 0.1304538168539244, 'batch_norm': False, 'lr': 1.5408060926311233e-05, 'weight_decay': 2.1989735568314356e-08, 'epochs': 250, 'loss': 'mse', 'optimizer': 'sgd', 'use_snp_selection': True, 'num_snps': 42550, 'weight_scheme': 'exponential', 'weight_clip_max': 10.0, 'weight_exponential_beta': 2.758850226029358}. Best is trial 6 with value: 0.22076170280695384.
[I 2026-04-21 18:05:15,785] Trial 29 finished with value: 0.2693826842516271 and parameters: {'hidden_dims': '[512, 128]', 'dropout': 0.3566766913797278, 'batch_norm': True, 'lr': 2.314731862912879e-05, 'weight_decay': 4.7065055603595075e-06, 'epochs': 274, 'loss': 'mse', 'optimizer': 'adam', 'use_snp_selection': True, 'num_snps': 46453, 'weight_scheme': 'uniform', 'weight_clip_max': 10.0}. Best is trial 20 with value: 0.3221917433415758.
[I 2026-04-21 18:05:21,640] Trial 8 finished with value: 0.13691874952763441 and parameters: {'hidden_dims': '[256, 128]', 'dropout': 0.05742396906738376, 'batch_norm': False, 'lr': 1.9761509510575143e-06, 'weight_decay': 2.933492239224291e-07, 'epochs': 82, 'loss': 'mae', 'optimizer': 'adam', 'use_snp_selection': True, 'num_snps': 29883, 'weight_scheme': 'minmax', 'weight_clip_max': 5.0, 'weight_minmax_eps': 0.0051288771726799584}. Best is trial 6 with value: 0.22076170280695384.
[I 2026-04-21 18:05:47,579] Trial 9 finished with value: 0.1926926646525807 and parameters: {'hidden_dims': '[256, 128]', 'dropout': 0.5795930447285386, 'batch_norm': False, 'lr': 0.00011782025260263196, 'weight_decay': 0.0005562063174273634, 'epochs': 218, 'loss': 'mae', 'optimizer': 'adamw', 'use_snp_selection': True, 'num_snps': 32226, 'weight_scheme': 'minmax', 'weight_clip_max': 5.0, 'weight_minmax_eps': 0.09600289105543994}. Best is trial 6 with value: 0.22076170280695384.
[I 2026-04-21 18:06:20,681] Trial 30 finished with value: 0.3079099670607945 and parameters: {'hidden_dims': '[512, 64]', 'dropout': 0.38569532900512127, 'batch_norm': False, 'lr': 1.2342900781628404e-05, 'weight_decay': 0.0006966618650400566, 'epochs': 298, 'loss': 'mae', 'optimizer': 'adam', 'use_snp_selection': True, 'num_snps': 56437, 'weight_scheme': 'uniform', 'weight_clip_max': 10.0}. Best is trial 20 with value: 0.3221917433415758.
[I 2026-04-21 18:06:26,757] Trial 10 finished with value: 0.20787617750442763 and parameters: {'hidden_dims': '[512, 64]', 'dropout': 0.4338375928678635, 'batch_norm': True, 'lr': 0.0009667920285641304, 'weight_decay': 6.976468597792388e-05, 'epochs': 294, 'loss': 'mae', 'optimizer': 'adam', 'use_snp_selection': False, 'weight_scheme': 'uniform', 'weight_clip_max': None}. Best is trial 6 with value: 0.22076170280695384.
[I 2026-04-21 18:07:05,873] Trial 11 finished with value: 0.20421605813543123 and parameters: {'hidden_dims': '[512, 64]', 'dropout': 0.4516805843717058, 'batch_norm': True, 'lr': 0.0009928478748470076, 'weight_decay': 5.547084226283487e-05, 'epochs': 290, 'loss': 'mae', 'optimizer': 'adam', 'use_snp_selection': False, 'weight_scheme': 'uniform', 'weight_clip_max': None}. Best is trial 6 with value: 0.22076170280695384.
[I 2026-04-21 18:07:25,857] Trial 31 finished with value: 0.30144275085431366 and parameters: {'hidden_dims': '[512, 64]', 'dropout': 0.38553240539261086, 'batch_norm': False, 'lr': 1.324922220994408e-05, 'weight_decay': 0.0009092265150793732, 'epochs': 300, 'loss': 'mae', 'optimizer': 'adam', 'use_snp_selection': True, 'num_snps': 56445, 'weight_scheme': 'uniform', 'weight_clip_max': 10.0}. Best is trial 20 with value: 0.3221917433415758.
[I 2026-04-21 18:07:38,818] Trial 12 finished with value: 0.20583179148640016 and parameters: {'hidden_dims': '[512, 64]', 'dropout': 0.4134640118922238, 'batch_norm': True, 'lr': 0.0008477822420198197, 'weight_decay': 5.229627468514555e-05, 'epochs': 241, 'loss': 'mae', 'optimizer': 'adam', 'use_snp_selection': False, 'weight_scheme': 'uniform', 'weight_clip_max': None}. Best is trial 6 with value: 0.22076170280695384.
[I 2026-04-21 18:08:19,118] Trial 13 finished with value: 0.20446710361748313 and parameters: {'hidden_dims': '[512, 64]', 'dropout': 0.44665667317896396, 'batch_norm': True, 'lr': 0.00031846142052762143, 'weight_decay': 0.0005816188648485889, 'epochs': 300, 'loss': 'mae', 'optimizer': 'adam', 'use_snp_selection': False, 'weight_scheme': 'uniform', 'weight_clip_max': None}. Best is trial 6 with value: 0.22076170280695384.
[I 2026-04-21 18:08:29,104] Trial 32 finished with value: 0.3070725407327779 and parameters: {'hidden_dims': '[512, 64]', 'dropout': 0.4424137774776423, 'batch_norm': False, 'lr': 6.995894977621026e-06, 'weight_decay': 0.0004026510626565694, 'epochs': 282, 'loss': 'mae', 'optimizer': 'adam', 'use_snp_selection': True, 'num_snps': 56695, 'weight_scheme': 'uniform', 'weight_clip_max': 10.0}. Best is trial 20 with value: 0.3221917433415758.
[I 2026-04-21 18:08:34,670] Trial 14 finished with value: 0.14532216908320036 and parameters: {'hidden_dims': '[256, 64]', 'dropout': 0.3608938911337143, 'batch_norm': True, 'lr': 3.2138990339899728e-06, 'weight_decay': 1.8215183711878244e-05, 'epochs': 205, 'loss': 'mae', 'optimizer': 'adam', 'use_snp_selection': False, 'weight_scheme': 'exponential', 'weight_clip_max': None, 'weight_exponential_beta': 7.948849485427058}. Best is trial 6 with value: 0.22076170280695384.
[I 2026-04-21 18:09:09,709] Trial 15 finished with value: 0.22784091341196588 and parameters: {'hidden_dims': '[512, 64]', 'dropout': 0.5310067954444609, 'batch_norm': True, 'lr': 0.0003305075642335557, 'weight_decay': 0.00018714635954449952, 'epochs': 259, 'loss': 'mae', 'optimizer': 'adamw', 'use_snp_selection': False, 'weight_scheme': 'top-heavy', 'weight_clip_max': None, 'weight_topheavy_top_frac': 0.48091952196914134, 'weight_topheavy_low': 0.5054522954723732, 'weight_topheavy_high': 5.647529144674392}. Best is trial 15 with value: 0.22784091341196588.
[I 2026-04-21 18:09:28,277] Trial 16 finished with value: 0.20190443000401795 and parameters: {'hidden_dims': '[256, 64]', 'dropout': 0.598700750155559, 'batch_norm': True, 'lr': 5.196015503468652e-06, 'weight_decay': 0.00024636632406639647, 'epochs': 253, 'loss': 'mae', 'optimizer': 'adamw', 'use_snp_selection': False, 'weight_scheme': 'top-heavy', 'weight_clip_max': None, 'weight_topheavy_top_frac': 0.4979496293827915, 'weight_topheavy_low': 0.5230104201773819, 'weight_topheavy_high': 5.831773413894172}. Best is trial 15 with value: 0.22784091341196588.
[I 2026-04-21 18:09:28,586] Trial 33 finished with value: 0.30075882828936124 and parameters: {'hidden_dims': '[512, 64]', 'dropout': 0.4450340180422054, 'batch_norm': False, 'lr': 6.7533249102682055e-06, 'weight_decay': 0.00014590470159045907, 'epochs': 260, 'loss': 'mae', 'optimizer': 'adam', 'use_snp_selection': True, 'num_snps': 56484, 'weight_scheme': 'uniform', 'weight_clip_max': None}. Best is trial 20 with value: 0.3221917433415758.
[I 2026-04-21 18:09:59,149] Trial 17 finished with value: 0.21882562090550448 and parameters: {'hidden_dims': '[512, 128]', 'dropout': 0.5055209153461855, 'batch_norm': True, 'lr': 0.00030519803944241577, 'weight_decay': 1.2377129591513016e-05, 'epochs': 226, 'loss': 'mae', 'optimizer': 'adamw', 'use_snp_selection': False, 'weight_scheme': 'top-heavy', 'weight_clip_max': None, 'weight_topheavy_top_frac': 0.49874528076422553, 'weight_topheavy_low': 0.5135903521094615, 'weight_topheavy_high': 5.58406405648394}. Best is trial 15 with value: 0.22784091341196588.
