Running from this directory: /cluster/work/simennes/Master_thesis
Name of job: ncv_avggrm
ID of job: 24319511
The job was run on these nodes: idun-07-01
[I 2026-04-18 13:07:59,401] Trial 0 finished with value: 0.053789203570612176 and parameters: {'hidden_dims': '[256, 128]', 'dropout': 0.18584155530312246, 'batch_norm': True, 'lr': 9.012665953349533e-06, 'weight_decay': 4.96591963698479e-06, 'epochs': 105, 'loss': 'mse', 'optimizer': 'sgd', 'use_snp_selection': True, 'num_snps': 25583, 'weight_scheme': 'minmax', 'weight_clip_max': 5.0, 'weight_minmax_eps': 0.14026014881292506}. Best is trial 0 with value: 0.053789203570612176.
[I 2026-04-18 13:08:01,288] Trial 0 finished with value: 0.029652216115558083 and parameters: {'hidden_dims': '[256, 128]', 'dropout': 0.18584155530312246, 'batch_norm': True, 'lr': 9.012665953349533e-06, 'weight_decay': 4.96591963698479e-06, 'epochs': 105, 'loss': 'mse', 'optimizer': 'sgd', 'use_snp_selection': True, 'num_snps': 25583, 'weight_scheme': 'minmax', 'weight_clip_max': 5.0, 'weight_minmax_eps': 0.14026014881292506}. Best is trial 0 with value: 0.029652216115558083.
[I 2026-04-18 13:08:26,572] Trial 1 finished with value: 0.11310970252882475 and parameters: {'hidden_dims': '[256, 64]', 'dropout': 0.05000949662985405, 'batch_norm': True, 'lr': 0.00015647443054904835, 'weight_decay': 5.158896024962846e-05, 'epochs': 152, 'loss': 'mse', 'optimizer': 'sgd', 'use_snp_selection': False, 'weight_scheme': 'linear', 'weight_clip_max': None, 'weight_linear_min_weight': 0.21922985165550554, 'weight_linear_max_weight': 1.6260435767424388}. Best is trial 1 with value: 0.11310970252882475.
[I 2026-04-18 13:08:29,819] Trial 1 finished with value: 0.13885387969392354 and parameters: {'hidden_dims': '[256, 64]', 'dropout': 0.05000949662985405, 'batch_norm': True, 'lr': 0.00015647443054904835, 'weight_decay': 5.158896024962846e-05, 'epochs': 152, 'loss': 'mse', 'optimizer': 'sgd', 'use_snp_selection': False, 'weight_scheme': 'linear', 'weight_clip_max': None, 'weight_linear_min_weight': 0.21922985165550554, 'weight_linear_max_weight': 1.6260435767424388}. Best is trial 1 with value: 0.13885387969392354.
[I 2026-04-18 13:09:08,988] Trial 2 finished with value: 0.11506516396284747 and parameters: {'hidden_dims': '[512, 128]', 'dropout': 0.2736730891340176, 'batch_norm': True, 'lr': 7.298114623433994e-05, 'weight_decay': 5.6346010385734023e-08, 'epochs': 185, 'loss': 'mae', 'optimizer': 'sgd', 'use_snp_selection': True, 'num_snps': 14091, 'weight_scheme': 'minmax', 'weight_clip_max': 10.0, 'weight_minmax_eps': 0.045780660776687306}. Best is trial 2 with value: 0.11506516396284747.
[I 2026-04-18 13:09:14,242] Trial 2 finished with value: 0.11489372248494303 and parameters: {'hidden_dims': '[512, 128]', 'dropout': 0.2736730891340176, 'batch_norm': True, 'lr': 7.298114623433994e-05, 'weight_decay': 5.6346010385734023e-08, 'epochs': 185, 'loss': 'mae', 'optimizer': 'sgd', 'use_snp_selection': True, 'num_snps': 14091, 'weight_scheme': 'minmax', 'weight_clip_max': 10.0, 'weight_minmax_eps': 0.045780660776687306}. Best is trial 1 with value: 0.13885387969392354.
[I 2026-04-18 13:10:35,697] Trial 3 finished with value: 0.07347621887994789 and parameters: {'hidden_dims': '[512, 64]', 'dropout': 0.30157795416637295, 'batch_norm': False, 'lr': 2.007492282795256e-05, 'weight_decay': 5.496446859789657e-06, 'epochs': 284, 'loss': 'mse', 'optimizer': 'sgd', 'use_snp_selection': False, 'weight_scheme': 'linear', 'weight_clip_max': None, 'weight_linear_min_weight': 0.24682154527102826, 'weight_linear_max_weight': 1.8338910783134623}. Best is trial 2 with value: 0.11506516396284747.
[I 2026-04-18 13:10:45,121] Trial 3 finished with value: 0.11611469830888325 and parameters: {'hidden_dims': '[512, 64]', 'dropout': 0.30157795416637295, 'batch_norm': False, 'lr': 2.007492282795256e-05, 'weight_decay': 5.496446859789657e-06, 'epochs': 284, 'loss': 'mse', 'optimizer': 'sgd', 'use_snp_selection': False, 'weight_scheme': 'linear', 'weight_clip_max': None, 'weight_linear_min_weight': 0.24682154527102826, 'weight_linear_max_weight': 1.8338910783134623}. Best is trial 1 with value: 0.13885387969392354.
[I 2026-04-18 13:11:02,002] Trial 4 finished with value: 0.1867795804736013 and parameters: {'hidden_dims': '[256, 64]', 'dropout': 0.18128694708490736, 'batch_norm': False, 'lr': 8.951826748007403e-05, 'weight_decay': 2.1781541495465197e-07, 'epochs': 147, 'loss': 'mse', 'optimizer': 'sgd', 'use_snp_selection': False, 'weight_scheme': 'top-heavy', 'weight_clip_max': 5.0, 'weight_topheavy_top_frac': 0.1724888194073277, 'weight_topheavy_low': 1.1620865802171172, 'weight_topheavy_high': 3.476906528073177}. Best is trial 4 with value: 0.1867795804736013.
[I 2026-04-18 13:11:12,551] Trial 4 finished with value: 0.1698202154599673 and parameters: {'hidden_dims': '[256, 64]', 'dropout': 0.18128694708490736, 'batch_norm': False, 'lr': 8.951826748007403e-05, 'weight_decay': 2.1781541495465197e-07, 'epochs': 147, 'loss': 'mse', 'optimizer': 'sgd', 'use_snp_selection': False, 'weight_scheme': 'top-heavy', 'weight_clip_max': 5.0, 'weight_topheavy_top_frac': 0.1724888194073277, 'weight_topheavy_low': 1.1620865802171172, 'weight_topheavy_high': 3.476906528073177}. Best is trial 4 with value: 0.1698202154599673.
[I 2026-04-18 13:11:24,387] Trial 5 finished with value: 0.14063798939806818 and parameters: {'hidden_dims': '[256, 64]', 'dropout': 0.2571412946970998, 'batch_norm': True, 'lr': 3.546238022482882e-05, 'weight_decay': 1.0185234767613396e-06, 'epochs': 119, 'loss': 'mse', 'optimizer': 'sgd', 'use_snp_selection': False, 'weight_scheme': 'linear', 'weight_clip_max': 10.0, 'weight_linear_min_weight': 0.9405832045183805, 'weight_linear_max_weight': 3.413610925325811}. Best is trial 4 with value: 0.1867795804736013.
[I 2026-04-18 13:11:35,924] Trial 5 finished with value: 0.12647147822788782 and parameters: {'hidden_dims': '[256, 64]', 'dropout': 0.2571412946970998, 'batch_norm': True, 'lr': 3.546238022482882e-05, 'weight_decay': 1.0185234767613396e-06, 'epochs': 119, 'loss': 'mse', 'optimizer': 'sgd', 'use_snp_selection': False, 'weight_scheme': 'linear', 'weight_clip_max': 10.0, 'weight_linear_min_weight': 0.9405832045183805, 'weight_linear_max_weight': 3.413610925325811}. Best is trial 4 with value: 0.1698202154599673.
[I 2026-04-18 13:12:06,728] Trial 6 finished with value: 0.1984244435899002 and parameters: {'hidden_dims': '[256, 64]', 'dropout': 0.037961443806696214, 'batch_norm': True, 'lr': 3.644202049829694e-05, 'weight_decay': 9.73334309820277e-06, 'epochs': 243, 'loss': 'mae', 'optimizer': 'adam', 'use_snp_selection': False, 'weight_scheme': 'minmax', 'weight_clip_max': None, 'weight_minmax_eps': 0.08689611239934374}. Best is trial 6 with value: 0.1984244435899002.
[I 2026-04-18 13:12:19,640] Trial 6 finished with value: 0.20253418915435545 and parameters: {'hidden_dims': '[256, 64]', 'dropout': 0.037961443806696214, 'batch_norm': True, 'lr': 3.644202049829694e-05, 'weight_decay': 9.73334309820277e-06, 'epochs': 243, 'loss': 'mae', 'optimizer': 'adam', 'use_snp_selection': False, 'weight_scheme': 'minmax', 'weight_clip_max': None, 'weight_minmax_eps': 0.08689611239934374}. Best is trial 6 with value: 0.20253418915435545.
[I 2026-04-18 13:13:30,459] Trial 7 finished with value: 0.10254584580150154 and parameters: {'hidden_dims': '[512, 128]', 'dropout': 0.1304538168539244, 'batch_norm': False, 'lr': 1.5408060926311233e-05, 'weight_decay': 2.1989735568314356e-08, 'epochs': 250, 'loss': 'mse', 'optimizer': 'sgd', 'use_snp_selection': True, 'num_snps': 42550, 'weight_scheme': 'exponential', 'weight_clip_max': 10.0, 'weight_exponential_beta': 2.758850226029358}. Best is trial 6 with value: 0.1984244435899002.
[I 2026-04-18 13:13:47,595] Trial 7 finished with value: 0.10277160795169157 and parameters: {'hidden_dims': '[512, 128]', 'dropout': 0.1304538168539244, 'batch_norm': False, 'lr': 1.5408060926311233e-05, 'weight_decay': 2.1989735568314356e-08, 'epochs': 250, 'loss': 'mse', 'optimizer': 'sgd', 'use_snp_selection': True, 'num_snps': 42550, 'weight_scheme': 'exponential', 'weight_clip_max': 10.0, 'weight_exponential_beta': 2.758850226029358}. Best is trial 6 with value: 0.20253418915435545.
[I 2026-04-18 13:14:11,649] Trial 8 finished with value: 0.18190847303088822 and parameters: {'hidden_dims': '[256, 128]', 'dropout': 0.05742396906738376, 'batch_norm': False, 'lr': 1.9761509510575143e-06, 'weight_decay': 2.933492239224291e-07, 'epochs': 82, 'loss': 'mae', 'optimizer': 'adam', 'use_snp_selection': True, 'num_snps': 29883, 'weight_scheme': 'minmax', 'weight_clip_max': 5.0, 'weight_minmax_eps': 0.0051288771726799584}. Best is trial 6 with value: 0.1984244435899002.
[I 2026-04-18 13:14:30,214] Trial 8 finished with value: 0.2075416855005578 and parameters: {'hidden_dims': '[256, 128]', 'dropout': 0.05742396906738376, 'batch_norm': False, 'lr': 1.9761509510575143e-06, 'weight_decay': 2.933492239224291e-07, 'epochs': 82, 'loss': 'mae', 'optimizer': 'adam', 'use_snp_selection': True, 'num_snps': 29883, 'weight_scheme': 'minmax', 'weight_clip_max': 5.0, 'weight_minmax_eps': 0.0051288771726799584}. Best is trial 8 with value: 0.2075416855005578.
[I 2026-04-18 13:15:03,513] Trial 9 finished with value: 0.21062538610194056 and parameters: {'hidden_dims': '[256, 128]', 'dropout': 0.5795930447285386, 'batch_norm': False, 'lr': 0.00011782025260263196, 'weight_decay': 0.0005562063174273634, 'epochs': 218, 'loss': 'mae', 'optimizer': 'adamw', 'use_snp_selection': True, 'num_snps': 32226, 'weight_scheme': 'minmax', 'weight_clip_max': 5.0, 'weight_minmax_eps': 0.09600289105543994}. Best is trial 9 with value: 0.21062538610194056.
[I 2026-04-18 13:15:24,395] Trial 9 finished with value: 0.2058913928899666 and parameters: {'hidden_dims': '[256, 128]', 'dropout': 0.5795930447285386, 'batch_norm': False, 'lr': 0.00011782025260263196, 'weight_decay': 0.0005562063174273634, 'epochs': 218, 'loss': 'mae', 'optimizer': 'adamw', 'use_snp_selection': True, 'num_snps': 32226, 'weight_scheme': 'minmax', 'weight_clip_max': 5.0, 'weight_minmax_eps': 0.09600289105543994}. Best is trial 8 with value: 0.2075416855005578.
[I 2026-04-18 13:16:10,403] Trial 10 finished with value: 0.02931034867930931 and parameters: {'hidden_dims': '[256, 128]', 'dropout': 0.5982265091674299, 'batch_norm': False, 'lr': 0.0009667920285641304, 'weight_decay': 0.0007065067205778983, 'epochs': 203, 'loss': 'mae', 'optimizer': 'adamw', 'use_snp_selection': True, 'num_snps': 54689, 'weight_scheme': 'uniform', 'weight_clip_max': 5.0}. Best is trial 9 with value: 0.21062538610194056.
[I 2026-04-18 13:16:17,186] Trial 10 finished with value: 0.048843645303453406 and parameters: {'hidden_dims': '[256, 128]', 'dropout': 0.4338375928678635, 'batch_norm': False, 'lr': 1.459239318238064e-06, 'weight_decay': 3.891313547330106e-07, 'epochs': 68, 'loss': 'mae', 'optimizer': 'adam', 'use_snp_selection': True, 'num_snps': 53871, 'weight_scheme': 'uniform', 'weight_clip_max': 5.0}. Best is trial 8 with value: 0.2075416855005578.
[I 2026-04-18 13:17:08,475] Trial 11 finished with value: 0.18025785984214115 and parameters: {'hidden_dims': '[256, 128]', 'dropout': 0.5977959517479471, 'batch_norm': False, 'lr': 0.0007728340671580595, 'weight_decay': 0.0004164439942178998, 'epochs': 200, 'loss': 'mae', 'optimizer': 'adamw', 'use_snp_selection': True, 'num_snps': 30988, 'weight_scheme': 'minmax', 'weight_clip_max': 5.0, 'weight_minmax_eps': 0.005209797941978697}. Best is trial 8 with value: 0.2075416855005578.
[I 2026-04-18 13:17:24,304] Trial 11 finished with value: 0.20759837573182277 and parameters: {'hidden_dims': '[512, 64]', 'dropout': 0.48179236930737634, 'batch_norm': True, 'lr': 0.0003590005130816133, 'weight_decay': 0.0004864760243946446, 'epochs': 231, 'loss': 'mae', 'optimizer': 'adam', 'use_snp_selection': False, 'weight_scheme': 'minmax', 'weight_clip_max': None, 'weight_minmax_eps': 0.09687781180927992}. Best is trial 9 with value: 0.21062538610194056.
[I 2026-04-18 13:17:45,629] Trial 12 finished with value: 0.1056443133159443 and parameters: {'hidden_dims': '[256, 128]', 'dropout': 0.49224381548015783, 'batch_norm': False, 'lr': 1.6672985638477092e-06, 'weight_decay': 0.000985776838336091, 'epochs': 61, 'loss': 'mae', 'optimizer': 'adamw', 'use_snp_selection': True, 'num_snps': 22869, 'weight_scheme': 'minmax', 'weight_clip_max': 5.0, 'weight_minmax_eps': 0.1815169394876332}. Best is trial 8 with value: 0.2075416855005578.
[I 2026-04-18 13:18:35,811] Trial 12 finished with value: 0.20888673019727694 and parameters: {'hidden_dims': '[512, 64]', 'dropout': 0.5756846183148884, 'batch_norm': True, 'lr': 0.0004604776265397854, 'weight_decay': 0.0009430578454129051, 'epochs': 222, 'loss': 'mae', 'optimizer': 'adamw', 'use_snp_selection': False, 'weight_scheme': 'minmax', 'weight_clip_max': None, 'weight_minmax_eps': 0.11646824613661988}. Best is trial 9 with value: 0.21062538610194056.
[I 2026-04-18 13:18:44,936] Trial 13 finished with value: 0.21797913547512843 and parameters: {'hidden_dims': '[256, 128]', 'dropout': 0.39617155092414635, 'batch_norm': False, 'lr': 5.5499656564214575e-06, 'weight_decay': 4.026950095019044e-05, 'epochs': 219, 'loss': 'mae', 'optimizer': 'adam', 'use_snp_selection': True, 'num_snps': 40015, 'weight_scheme': 'top-heavy', 'weight_clip_max': 5.0, 'weight_topheavy_top_frac': 0.4963949528875303, 'weight_topheavy_low': 0.550088064868268, 'weight_topheavy_high': 5.953811342115056}. Best is trial 13 with value: 0.21797913547512843.
[I 2026-04-18 13:19:11,132] Trial 13 finished with value: 0.20694161657787813 and parameters: {'hidden_dims': '[512, 64]', 'dropout': 0.4734218573103429, 'batch_norm': False, 'lr': 0.00040255722523826283, 'weight_decay': 9.409850265366299e-05, 'epochs': 210, 'loss': 'mae', 'optimizer': 'adamw', 'use_snp_selection': True, 'num_snps': 7358, 'weight_scheme': 'top-heavy', 'weight_clip_max': None, 'weight_topheavy_top_frac': 0.48398486394237283, 'weight_topheavy_low': 0.5666436580870186, 'weight_topheavy_high': 5.961546164133656}. Best is trial 9 with value: 0.21062538610194056.
[I 2026-04-18 13:20:24,106] Trial 14 finished with value: 0.21432959922299707 and parameters: {'hidden_dims': '[512, 64]', 'dropout': 0.38413708238452904, 'batch_norm': False, 'lr': 4.524744578502248e-06, 'weight_decay': 4.873331327451282e-05, 'epochs': 290, 'loss': 'mae', 'optimizer': 'adam', 'use_snp_selection': True, 'num_snps': 44094, 'weight_scheme': 'top-heavy', 'weight_clip_max': 5.0, 'weight_topheavy_top_frac': 0.4881878932644761, 'weight_topheavy_low': 0.5186849366402682, 'weight_topheavy_high': 5.887016439143736}. Best is trial 13 with value: 0.21797913547512843.
[I 2026-04-18 13:20:43,866] Trial 14 finished with value: 0.2054493738013235 and parameters: {'hidden_dims': '[512, 64]', 'dropout': 0.5968223630144804, 'batch_norm': True, 'lr': 0.0002731708432294855, 'weight_decay': 0.00010939995191253518, 'epochs': 297, 'loss': 'mae', 'optimizer': 'adamw', 'use_snp_selection': False, 'weight_scheme': 'exponential', 'weight_clip_max': 5.0, 'weight_exponential_beta': 6.512744308642654}. Best is trial 9 with value: 0.21062538610194056.
[I 2026-04-18 13:21:28,100] Trial 15 finished with value: 0.16312010099300428 and parameters: {'hidden_dims': '[256, 128]', 'dropout': 0.47172976457024, 'batch_norm': False, 'lr': 0.0007002400263284549, 'weight_decay': 0.0008655392345190722, 'epochs': 52, 'loss': 'mae', 'optimizer': 'adamw', 'use_snp_selection': True, 'num_snps': 44135, 'weight_scheme': 'uniform', 'weight_clip_max': None}. Best is trial 9 with value: 0.21062538610194056.
[I 2026-04-18 13:22:07,313] Trial 15 finished with value: 0.2137971862353349 and parameters: {'hidden_dims': '[512, 64]', 'dropout': 0.3852229251542559, 'batch_norm': False, 'lr': 5.366745179740409e-06, 'weight_decay': 3.611960120550373e-05, 'epochs': 298, 'loss': 'mae', 'optimizer': 'adam', 'use_snp_selection': True, 'num_snps': 46687, 'weight_scheme': 'top-heavy', 'weight_clip_max': 5.0, 'weight_topheavy_top_frac': 0.4934631047373426, 'weight_topheavy_low': 0.5047318921272932, 'weight_topheavy_high': 5.879401874253801}. Best is trial 13 with value: 0.21797913547512843.
[I 2026-04-18 13:22:51,854] Trial 16 finished with value: 0.20841370366778228 and parameters: {'hidden_dims': '[512, 64]', 'dropout': 0.38619018834660446, 'batch_norm': True, 'lr': 0.00013897147614724386, 'weight_decay': 2.8556887577968485e-05, 'epochs': 267, 'loss': 'mae', 'optimizer': 'adamw', 'use_snp_selection': False, 'weight_scheme': 'minmax', 'weight_clip_max': 5.0, 'weight_minmax_eps': 0.1936664849143409}. Best is trial 9 with value: 0.21062538610194056.
[I 2026-04-18 13:23:33,317] Trial 17 finished with value: 0.186679367852015 and parameters: {'hidden_dims': '[256, 128]', 'dropout': 0.5309742677886603, 'batch_norm': False, 'lr': 2.8412630735063622e-06, 'weight_decay': 0.00020247607314335622, 'epochs': 169, 'loss': 'mae', 'optimizer': 'adamw', 'use_snp_selection': True, 'num_snps': 22659, 'weight_scheme': 'minmax', 'weight_clip_max': 5.0, 'weight_minmax_eps': 0.13785035227957684}. Best is trial 9 with value: 0.21062538610194056.
[I 2026-04-18 13:23:39,151] Trial 16 finished with value: 0.21279720177052322 and parameters: {'hidden_dims': '[512, 64]', 'dropout': 0.38284390731407814, 'batch_norm': False, 'lr': 4.171516980797218e-06, 'weight_decay': 7.959861739981826e-05, 'epochs': 265, 'loss': 'mae', 'optimizer': 'adam', 'use_snp_selection': True, 'num_snps': 42989, 'weight_scheme': 'top-heavy', 'weight_clip_max': 5.0, 'weight_topheavy_top_frac': 0.49932483943327993, 'weight_topheavy_low': 0.5077578636485416, 'weight_topheavy_high': 5.67666386774667}. Best is trial 13 with value: 0.21797913547512843.
[I 2026-04-18 13:24:49,521] Trial 18 finished with value: 0.20207823323906576 and parameters: {'hidden_dims': '[512, 128]', 'dropout': 0.38583297754590357, 'batch_norm': True, 'lr': 0.00026206468838684216, 'weight_decay': 0.0002582094566513463, 'epochs': 219, 'loss': 'mae', 'optimizer': 'adamw', 'use_snp_selection': True, 'num_snps': 40021, 'weight_scheme': 'minmax', 'weight_clip_max': None, 'weight_minmax_eps': 0.13296635748627791}. Best is trial 9 with value: 0.21062538610194056.
[I 2026-04-18 13:25:17,154] Trial 17 finished with value: 0.2404235916659899 and parameters: {'hidden_dims': '[512, 64]', 'dropout': 0.4746855379802529, 'batch_norm': False, 'lr': 3.5078968819959743e-06, 'weight_decay': 0.00018349721946149452, 'epochs': 220, 'loss': 'mae', 'optimizer': 'adam', 'use_snp_selection': True, 'num_snps': 55694, 'weight_scheme': 'top-heavy', 'weight_clip_max': 5.0, 'weight_topheavy_top_frac': 0.3727882185614029, 'weight_topheavy_low': 0.7110797277368752, 'weight_topheavy_high': 1.2834391789848123}. Best is trial 17 with value: 0.2404235916659899.
[I 2026-04-18 13:25:50,425] Trial 19 finished with value: 0.20818534192747373 and parameters: {'hidden_dims': '[512, 64]', 'dropout': 0.4052551436097037, 'batch_norm': False, 'lr': 6.974554771754855e-05, 'weight_decay': 1.924399445966327e-05, 'epochs': 190, 'loss': 'mae', 'optimizer': 'adamw', 'use_snp_selection': False, 'weight_scheme': 'uniform', 'weight_clip_max': 10.0}. Best is trial 9 with value: 0.21062538610194056.
[I 2026-04-18 13:26:58,734] Trial 18 finished with value: 0.2314578013976948 and parameters: {'hidden_dims': '[512, 64]', 'dropout': 0.49526566084459034, 'batch_norm': False, 'lr': 1.0758508193266798e-06, 'weight_decay': 0.00019699085796564514, 'epochs': 219, 'loss': 'mae', 'optimizer': 'adam', 'use_snp_selection': True, 'num_snps': 57865, 'weight_scheme': 'top-heavy', 'weight_clip_max': 10.0, 'weight_topheavy_top_frac': 0.33065270609390374, 'weight_topheavy_low': 0.7806400697910726, 'weight_topheavy_high': 1.376952241872425}. Best is trial 17 with value: 0.2404235916659899.
[I 2026-04-18 13:27:06,689] Trial 20 finished with value: 0.21919959734311129 and parameters: {'hidden_dims': '[256, 128]', 'dropout': 0.5385841103047647, 'batch_norm': False, 'lr': 5.426392002803483e-06, 'weight_decay': 9.139326474012346e-07, 'epochs': 262, 'loss': 'mae', 'optimizer': 'adamw', 'use_snp_selection': True, 'num_snps': 57137, 'weight_scheme': 'exponential', 'weight_clip_max': None, 'weight_exponential_beta': 0.7860371045867462}. Best is trial 20 with value: 0.21919959734311129.
[I 2026-04-18 13:28:18,689] Trial 21 finished with value: 0.21347488861767022 and parameters: {'hidden_dims': '[256, 128]', 'dropout': 0.5349241677594541, 'batch_norm': False, 'lr': 5.040606381976261e-06, 'weight_decay': 1.1663092959617698e-06, 'epochs': 258, 'loss': 'mae', 'optimizer': 'adamw', 'use_snp_selection': True, 'num_snps': 52530, 'weight_scheme': 'exponential', 'weight_clip_max': None, 'weight_exponential_beta': 0.2081767447337599}. Best is trial 20 with value: 0.21919959734311129.
[I 2026-04-18 13:28:24,577] Trial 19 finished with value: 0.2248588823457785 and parameters: {'hidden_dims': '[512, 64]', 'dropout': 0.5203946634596524, 'batch_norm': False, 'lr': 1.2878697478424467e-06, 'weight_decay': 0.00020040723554907812, 'epochs': 154, 'loss': 'mae', 'optimizer': 'adam', 'use_snp_selection': True, 'num_snps': 58934, 'weight_scheme': 'exponential', 'weight_clip_max': 10.0, 'weight_exponential_beta': 6.404445498892321}. Best is trial 17 with value: 0.2404235916659899.
[I 2026-04-18 13:29:36,549] Trial 22 finished with value: 0.22161102075565792 and parameters: {'hidden_dims': '[256, 128]', 'dropout': 0.5114093724174109, 'batch_norm': False, 'lr': 4.965624791829283e-06, 'weight_decay': 1.4666314167770258e-06, 'epochs': 265, 'loss': 'mae', 'optimizer': 'adamw', 'use_snp_selection': True, 'num_snps': 59565, 'weight_scheme': 'exponential', 'weight_clip_max': None, 'weight_exponential_beta': 0.36350944527742435}. Best is trial 22 with value: 0.22161102075565792.
