[I 2026-04-18 17:31:32,241] Trial 14 finished with value: 0.1826909212021925 and parameters: {'hidden_dims': '[256, 64]', 'dropout': 0.41996135168270726, 'batch_norm': True, 'lr': 4.7705458014471745e-05, 'weight_decay': 1.9482920075226874e-05, 'epochs': 191, 'loss': 'mae', 'optimizer': 'adamw', 'use_snp_selection': False, 'weight_scheme': 'exponential', 'weight_clip_max': None, 'weight_exponential_beta': 6.512744308642654}. Best is trial 14 with value: 0.1826909212021925.
[I 2026-04-18 17:31:45,014] Trial 15 finished with value: 0.18221324289782098 and parameters: {'hidden_dims': '[256, 64]', 'dropout': 0.4369791033049462, 'batch_norm': True, 'lr': 4.044907397418171e-05, 'weight_decay': 1.23249326220073e-05, 'epochs': 52, 'loss': 'mae', 'optimizer': 'adamw', 'use_snp_selection': False, 'weight_scheme': 'exponential', 'weight_clip_max': None, 'weight_exponential_beta': 7.4589635458449575}. Best is trial 14 with value: 0.1826909212021925.
[I 2026-04-18 17:31:57,837] Trial 16 finished with value: 0.13786256923571544 and parameters: {'hidden_dims': '[256, 64]', 'dropout': 0.4580941350939555, 'batch_norm': True, 'lr': 6.2681182545713725e-06, 'weight_decay': 1.68539783543097e-05, 'epochs': 53, 'loss': 'mae', 'optimizer': 'adamw', 'use_snp_selection': False, 'weight_scheme': 'exponential', 'weight_clip_max': None, 'weight_exponential_beta': 7.749701004618775}. Best is trial 14 with value: 0.1826909212021925.
[I 2026-04-18 17:32:04,948] Trial 36 finished with value: 0.1372571227318027 and parameters: {'hidden_dims': '[512, 128]', 'dropout': 0.2589787654196013, 'batch_norm': True, 'lr': 2.124758035056686e-05, 'weight_decay': 3.0911795803204284e-07, 'epochs': 133, 'loss': 'mse', 'optimizer': 'adamw', 'use_snp_selection': False, 'weight_scheme': 'linear', 'weight_clip_max': 10.0, 'weight_linear_min_weight': 0.6262363223254209, 'weight_linear_max_weight': 2.785159042323862}. Best is trial 21 with value: 0.14887093100988508.
[I 2026-04-18 17:32:29,271] Trial 17 finished with value: 0.16927721195030077 and parameters: {'hidden_dims': '[256, 64]', 'dropout': 0.3609441076665659, 'batch_norm': True, 'lr': 4.862118238580926e-05, 'weight_decay': 1.2781936316090211e-06, 'epochs': 179, 'loss': 'mae', 'optimizer': 'adamw', 'use_snp_selection': False, 'weight_scheme': 'exponential', 'weight_clip_max': None, 'weight_exponential_beta': 7.56189651547864}. Best is trial 14 with value: 0.1826909212021925.
[I 2026-04-18 17:32:41,725] Trial 18 finished with value: 0.1834794701635333 and parameters: {'hidden_dims': '[256, 64]', 'dropout': 0.5029718124089521, 'batch_norm': True, 'lr': 0.0003816428213586963, 'weight_decay': 0.0001457384155907778, 'epochs': 50, 'loss': 'mae', 'optimizer': 'adamw', 'use_snp_selection': False, 'weight_scheme': 'exponential', 'weight_clip_max': None, 'weight_exponential_beta': 5.861091896699593}. Best is trial 18 with value: 0.1834794701635333.
[I 2026-04-18 17:33:19,325] Trial 37 finished with value: 0.044038463448886914 and parameters: {'hidden_dims': '[512, 128]', 'dropout': 0.2539406528420335, 'batch_norm': True, 'lr': 1.8171548093603373e-05, 'weight_decay': 4.837336335459686e-08, 'epochs': 162, 'loss': 'mse', 'optimizer': 'sgd', 'use_snp_selection': True, 'num_snps': 54015, 'weight_scheme': 'linear', 'weight_clip_max': 10.0, 'weight_linear_min_weight': 0.6142536671437511, 'weight_linear_max_weight': 2.6884417280400608}. Best is trial 21 with value: 0.14887093100988508.
[I 2026-04-18 17:33:27,839] Trial 19 finished with value: 0.20712568681712992 and parameters: {'hidden_dims': '[512, 64]', 'dropout': 0.512282709594529, 'batch_norm': True, 'lr': 0.0005674997072990822, 'weight_decay': 0.00013641732167449252, 'epochs': 139, 'loss': 'mae', 'optimizer': 'adamw', 'use_snp_selection': False, 'weight_scheme': 'exponential', 'weight_clip_max': None, 'weight_exponential_beta': 4.831170454959709}. Best is trial 19 with value: 0.20712568681712992.
[I 2026-04-18 17:33:59,518] Trial 20 finished with value: 0.16734552007333386 and parameters: {'hidden_dims': '[512, 64]', 'dropout': 0.5236786057235149, 'batch_norm': True, 'lr': 0.0008276564728602698, 'weight_decay': 0.00019551544053652336, 'epochs': 90, 'loss': 'mae', 'optimizer': 'adamw', 'use_snp_selection': False, 'weight_scheme': 'uniform', 'weight_clip_max': None}. Best is trial 19 with value: 0.20712568681712992.
[I 2026-04-18 17:34:16,492] Trial 38 finished with value: 0.12138149691386926 and parameters: {'hidden_dims': '[512, 128]', 'dropout': 0.28258444041447917, 'batch_norm': True, 'lr': 9.100925251608142e-05, 'weight_decay': 8.408627844976014e-08, 'epochs': 186, 'loss': 'mse', 'optimizer': 'adamw', 'use_snp_selection': False, 'weight_scheme': 'linear', 'weight_clip_max': 10.0, 'weight_linear_min_weight': 0.5778532037726983, 'weight_linear_max_weight': 2.571984563824175}. Best is trial 21 with value: 0.14887093100988508.
[I 2026-04-18 17:34:47,380] Trial 21 finished with value: 0.21067420813229756 and parameters: {'hidden_dims': '[512, 64]', 'dropout': 0.5096229816021021, 'batch_norm': True, 'lr': 0.00035415731343371303, 'weight_decay': 0.00020465617168328066, 'epochs': 145, 'loss': 'mae', 'optimizer': 'adamw', 'use_snp_selection': False, 'weight_scheme': 'exponential', 'weight_clip_max': None, 'weight_exponential_beta': 4.73733608736394}. Best is trial 21 with value: 0.21067420813229756.
[I 2026-04-18 17:34:59,320] Trial 39 finished with value: 0.02692409742944531 and parameters: {'hidden_dims': '[512, 128]', 'dropout': 0.1866753532805498, 'batch_norm': False, 'lr': 2.9688766411219554e-05, 'weight_decay': 2.706537418365026e-07, 'epochs': 139, 'loss': 'mse', 'optimizer': 'sgd', 'use_snp_selection': False, 'weight_scheme': 'linear', 'weight_clip_max': 10.0, 'weight_linear_min_weight': 0.7464017228732598, 'weight_linear_max_weight': 3.1149632171777406}. Best is trial 21 with value: 0.14887093100988508.
[I 2026-04-18 17:35:32,327] Trial 22 finished with value: 0.2044859613115814 and parameters: {'hidden_dims': '[512, 64]', 'dropout': 0.5048767329026151, 'batch_norm': True, 'lr': 0.0003784754233999214, 'weight_decay': 0.00018550190114227338, 'epochs': 135, 'loss': 'mae', 'optimizer': 'adamw', 'use_snp_selection': False, 'weight_scheme': 'exponential', 'weight_clip_max': None, 'weight_exponential_beta': 4.550507947152863}. Best is trial 21 with value: 0.21067420813229756.
[I 2026-04-18 17:36:18,421] Trial 23 finished with value: 0.20770457725167768 and parameters: {'hidden_dims': '[512, 64]', 'dropout': 0.5058192359377504, 'batch_norm': True, 'lr': 0.0003515078443065268, 'weight_decay': 0.00024248251599313217, 'epochs': 139, 'loss': 'mae', 'optimizer': 'adamw', 'use_snp_selection': False, 'weight_scheme': 'exponential', 'weight_clip_max': None, 'weight_exponential_beta': 4.39587534420811}. Best is trial 21 with value: 0.21067420813229756.
[I 2026-04-18 17:37:11,191] Trial 24 finished with value: 0.19820053853529931 and parameters: {'hidden_dims': '[512, 64]', 'dropout': 0.35725757286131826, 'batch_norm': True, 'lr': 0.00026723433735584046, 'weight_decay': 0.0002871295410452482, 'epochs': 162, 'loss': 'mae', 'optimizer': 'adamw', 'use_snp_selection': False, 'weight_scheme': 'exponential', 'weight_clip_max': None, 'weight_exponential_beta': 4.2175179456229515}. Best is trial 21 with value: 0.21067420813229756.
[I 2026-04-18 17:37:53,763] Trial 25 finished with value: 0.17525415671844477 and parameters: {'hidden_dims': '[512, 64]', 'dropout': 0.5274198295347625, 'batch_norm': True, 'lr': 0.0006666681085569079, 'weight_decay': 3.76951646216585e-05, 'epochs': 127, 'loss': 'mae', 'optimizer': 'adamw', 'use_snp_selection': False, 'weight_scheme': 'exponential', 'weight_clip_max': 10.0, 'weight_exponential_beta': 0.513208009224793}. Best is trial 21 with value: 0.21067420813229756.
[I 2026-04-18 17:38:47,720] Trial 26 finished with value: 0.2083261086191691 and parameters: {'hidden_dims': '[512, 64]', 'dropout': 0.3687512253854248, 'batch_norm': True, 'lr': 0.0005509347053129851, 'weight_decay': 0.0003535756992529068, 'epochs': 166, 'loss': 'mae', 'optimizer': 'adamw', 'use_snp_selection': False, 'weight_scheme': 'exponential', 'weight_clip_max': None, 'weight_exponential_beta': 2.6850462950055136}. Best is trial 21 with value: 0.21067420813229756.
[I 2026-04-18 17:39:41,334] Trial 27 finished with value: 0.19697837497973744 and parameters: {'hidden_dims': '[512, 64]', 'dropout': 0.3668773050925594, 'batch_norm': True, 'lr': 0.0002442917283720779, 'weight_decay': 0.0003853952074144016, 'epochs': 165, 'loss': 'mae', 'optimizer': 'adamw', 'use_snp_selection': False, 'weight_scheme': 'exponential', 'weight_clip_max': None, 'weight_exponential_beta': 2.750979638112115}. Best is trial 21 with value: 0.21067420813229756.
[I 2026-04-18 17:40:44,412] Trial 28 finished with value: 0.1616540867025516 and parameters: {'hidden_dims': '[512, 64]', 'dropout': 0.31587384825530185, 'batch_norm': True, 'lr': 0.0005228326769427789, 'weight_decay': 8.618489529355957e-05, 'epochs': 198, 'loss': 'mae', 'optimizer': 'adamw', 'use_snp_selection': False, 'weight_scheme': 'uniform', 'weight_clip_max': None}. Best is trial 21 with value: 0.21067420813229756.
[I 2026-04-18 17:41:22,361] Trial 29 finished with value: 0.17381339029168805 and parameters: {'hidden_dims': '[512, 64]', 'dropout': 0.47756814770461353, 'batch_norm': True, 'lr': 0.00013174484228279333, 'weight_decay': 2.465504422652851e-06, 'epochs': 111, 'loss': 'mse', 'optimizer': 'adamw', 'use_snp_selection': False, 'weight_scheme': 'top-heavy', 'weight_clip_max': 10.0, 'weight_topheavy_top_frac': 0.0793189588776625, 'weight_topheavy_low': 0.9515087538485021, 'weight_topheavy_high': 1.5108127877398965}. Best is trial 21 with value: 0.21067420813229756.
[I 2026-04-18 17:41:55,488] Trial 30 finished with value: 0.11637872553071764 and parameters: {'hidden_dims': '[512, 128]', 'dropout': 0.39219299327985835, 'batch_norm': True, 'lr': 1.0436748949003944e-06, 'weight_decay': 0.0003253367625957474, 'epochs': 94, 'loss': 'mae', 'optimizer': 'adam', 'use_snp_selection': False, 'weight_scheme': 'exponential', 'weight_clip_max': None, 'weight_exponential_beta': 3.1094833037012384}. Best is trial 21 with value: 0.21067420813229756.
[I 2026-04-18 17:42:41,824] Trial 31 finished with value: 0.1998026937635931 and parameters: {'hidden_dims': '[512, 64]', 'dropout': 0.548754848583112, 'batch_norm': True, 'lr': 0.0005715623868603855, 'weight_decay': 0.00011493571809113676, 'epochs': 140, 'loss': 'mae', 'optimizer': 'adamw', 'use_snp_selection': False, 'weight_scheme': 'exponential', 'weight_clip_max': None, 'weight_exponential_beta': 5.3880302904294926}. Best is trial 21 with value: 0.21067420813229756.
[I 2026-04-18 17:43:34,869] Trial 32 finished with value: 0.19782986022513457 and parameters: {'hidden_dims': '[512, 64]', 'dropout': 0.4763597374327632, 'batch_norm': True, 'lr': 0.0002831694574522658, 'weight_decay': 0.0009205236612049483, 'epochs': 163, 'loss': 'mae', 'optimizer': 'adamw', 'use_snp_selection': False, 'weight_scheme': 'exponential', 'weight_clip_max': None, 'weight_exponential_beta': 3.756279272445732}. Best is trial 21 with value: 0.21067420813229756.
[I 2026-04-18 17:44:24,795] Trial 33 finished with value: 0.18507910252039525 and parameters: {'hidden_dims': '[512, 64]', 'dropout': 0.596615364320618, 'batch_norm': True, 'lr': 0.00018719969513093356, 'weight_decay': 3.0563005637641895e-05, 'epochs': 152, 'loss': 'mae', 'optimizer': 'adamw', 'use_snp_selection': False, 'weight_scheme': 'exponential', 'weight_clip_max': None, 'weight_exponential_beta': 1.633548594156526}. Best is trial 21 with value: 0.21067420813229756.
[I 2026-04-18 17:45:01,031] Trial 34 finished with value: 0.1844433452283259 and parameters: {'hidden_dims': '[512, 64]', 'dropout': 0.23644795068092156, 'batch_norm': True, 'lr': 0.0005366651376827412, 'weight_decay': 0.00029398450161773586, 'epochs': 105, 'loss': 'mse', 'optimizer': 'adamw', 'use_snp_selection': False, 'weight_scheme': 'linear', 'weight_clip_max': None, 'weight_linear_min_weight': 0.98051737503335, 'weight_linear_max_weight': 3.8192486263350465}. Best is trial 21 with value: 0.21067420813229756.
[I 2026-04-18 17:45:57,586] Trial 35 finished with value: 0.2023033501121687 and parameters: {'hidden_dims': '[512, 64]', 'dropout': 0.545988690889389, 'batch_norm': True, 'lr': 9.420494473352875e-05, 'weight_decay': 0.00012448281243316792, 'epochs': 174, 'loss': 'mae', 'optimizer': 'adamw', 'use_snp_selection': False, 'weight_scheme': 'exponential', 'weight_clip_max': None, 'weight_exponential_beta': 5.480709182390311}. Best is trial 21 with value: 0.21067420813229756.
[I 2026-04-18 17:46:38,846] Trial 36 finished with value: 0.13670504551549958 and parameters: {'hidden_dims': '[512, 64]', 'dropout': 0.33199202245281345, 'batch_norm': True, 'lr': 0.0009953069519361266, 'weight_decay': 3.293016373731519e-05, 'epochs': 126, 'loss': 'mse', 'optimizer': 'sgd', 'use_snp_selection': False, 'weight_scheme': 'linear', 'weight_clip_max': None, 'weight_linear_min_weight': 0.5711635345745357, 'weight_linear_max_weight': 2.8567623620010907}. Best is trial 21 with value: 0.21067420813229756.
[I 2026-04-18 17:47:58,251] Trial 37 finished with value: 0.1891755372891848 and parameters: {'hidden_dims': '[512, 128]', 'dropout': 0.4810498391051926, 'batch_norm': True, 'lr': 0.00033053216006357364, 'weight_decay': 0.0005850314923978083, 'epochs': 149, 'loss': 'mae', 'optimizer': 'adamw', 'use_snp_selection': True, 'num_snps': 58170, 'weight_scheme': 'top-heavy', 'weight_clip_max': 10.0, 'weight_topheavy_top_frac': 0.41265503767783973, 'weight_topheavy_low': 0.5029963207144073, 'weight_topheavy_high': 5.800498590635664}. Best is trial 21 with value: 0.21067420813229756.
[I 2026-04-18 17:49:00,853] Trial 38 finished with value: 0.11451788189161531 and parameters: {'hidden_dims': '[512, 64]', 'dropout': 0.19374763933690578, 'batch_norm': True, 'lr': 6.979842468077428e-05, 'weight_decay': 5.119003691466226e-06, 'epochs': 201, 'loss': 'mae', 'optimizer': 'sgd', 'use_snp_selection': False, 'weight_scheme': 'exponential', 'weight_clip_max': None, 'weight_exponential_beta': 4.707991395426245}. Best is trial 21 with value: 0.21067420813229756.
[I 2026-04-18 17:49:28,910] Trial 39 finished with value: 0.19778689319795378 and parameters: {'hidden_dims': '[512, 64]', 'dropout': 0.2734638255219284, 'batch_norm': False, 'lr': 1.69358117888158e-05, 'weight_decay': 1.08223755536163e-08, 'epochs': 77, 'loss': 'mse', 'optimizer': 'adamw', 'use_snp_selection': False, 'weight_scheme': 'exponential', 'weight_clip_max': 5.0, 'weight_exponential_beta': 3.513101996150424}. Best is trial 21 with value: 0.21067420813229756.
