[I 2026-04-21 18:50:24,457] Trial 33 finished with value: 0.28274162942442427 and parameters: {'hidden_dims': '[512, 128]', 'dropout': 0.5453197725959331, 'batch_norm': False, 'lr': 3.518915929022768e-06, 'weight_decay': 0.0009328884180094295, 'epochs': 224, 'loss': 'mse', 'optimizer': 'adamw', 'use_snp_selection': True, 'num_snps': 58597, 'weight_scheme': 'exponential', 'weight_clip_max': 10.0, 'weight_exponential_beta': 0.43193549504570794}. Best is trial 30 with value: 0.28915543064622323.
[I 2026-04-21 18:50:34,130] Trial 35 finished with value: 0.13053282220257958 and parameters: {'hidden_dims': '[512, 64]', 'dropout': 0.47018339421152133, 'batch_norm': False, 'lr': 1.2532580442860188e-05, 'weight_decay': 1.6836745973288847e-07, 'epochs': 142, 'loss': 'mae', 'optimizer': 'adamw', 'use_snp_selection': True, 'num_snps': 42459, 'weight_scheme': 'uniform', 'weight_clip_max': None}. Best is trial 20 with value: 0.18670887737261158.
[I 2026-04-21 18:50:45,901] Trial 36 finished with value: 0.1343513411612424 and parameters: {'hidden_dims': '[256, 64]', 'dropout': 0.5455536595313901, 'batch_norm': False, 'lr': 2.352143005581114e-05, 'weight_decay': 6.423239724930187e-06, 'epochs': 117, 'loss': 'mse', 'optimizer': 'adam', 'use_snp_selection': False, 'weight_scheme': 'linear', 'weight_clip_max': None, 'weight_linear_min_weight': 0.6841232445212857, 'weight_linear_max_weight': 2.770753602824613}. Best is trial 20 with value: 0.18670887737261158.
[I 2026-04-21 18:51:01,626] Trial 37 finished with value: 0.13043696659538714 and parameters: {'hidden_dims': '[256, 128]', 'dropout': 0.172995821636699, 'batch_norm': False, 'lr': 3.3744541184638076e-06, 'weight_decay': 1.5354778377891047e-06, 'epochs': 169, 'loss': 'mae', 'optimizer': 'adamw', 'use_snp_selection': False, 'weight_scheme': 'top-heavy', 'weight_clip_max': None, 'weight_topheavy_top_frac': 0.40877576240182106, 'weight_topheavy_low': 0.524675000643439, 'weight_topheavy_high': 5.477638493850087}. Best is trial 20 with value: 0.18670887737261158.
[I 2026-04-21 18:51:07,303] Trial 34 finished with value: 0.27922391426691945 and parameters: {'hidden_dims': '[512, 128]', 'dropout': 0.529451571181975, 'batch_norm': False, 'lr': 3.8215820654445555e-06, 'weight_decay': 0.00033261715428993885, 'epochs': 173, 'loss': 'mse', 'optimizer': 'adamw', 'use_snp_selection': True, 'num_snps': 48934, 'weight_scheme': 'exponential', 'weight_clip_max': 10.0, 'weight_exponential_beta': 0.3921096934567269}. Best is trial 30 with value: 0.28915543064622323.
[I 2026-04-21 18:51:32,779] Trial 38 finished with value: 0.0026218298014475485 and parameters: {'hidden_dims': '[256, 64]', 'dropout': 0.09502201032862215, 'batch_norm': False, 'lr': 8.880598760140822e-06, 'weight_decay': 0.00013803388729113474, 'epochs': 74, 'loss': 'mae', 'optimizer': 'sgd', 'use_snp_selection': True, 'num_snps': 59355, 'weight_scheme': 'exponential', 'weight_clip_max': 5.0, 'weight_exponential_beta': 7.093677660257074}. Best is trial 20 with value: 0.18670887737261158.
[I 2026-04-21 18:51:46,511] Trial 39 finished with value: 0.12675043202667338 and parameters: {'hidden_dims': '[256, 128]', 'dropout': 0.3671893248035794, 'batch_norm': False, 'lr': 1.3531716772531242e-06, 'weight_decay': 3.506386291496611e-08, 'epochs': 144, 'loss': 'mse', 'optimizer': 'adamw', 'use_snp_selection': False, 'weight_scheme': 'uniform', 'weight_clip_max': None}. Best is trial 20 with value: 0.18670887737261158.
[I 2026-04-21 18:51:56,167] Trial 35 finished with value: 0.26892232913437925 and parameters: {'hidden_dims': '[512, 128]', 'dropout': 0.5548561717895432, 'batch_norm': False, 'lr': 5.399151437434235e-06, 'weight_decay': 0.0003481485698605451, 'epochs': 228, 'loss': 'mse', 'optimizer': 'adamw', 'use_snp_selection': True, 'num_snps': 48597, 'weight_scheme': 'exponential', 'weight_clip_max': 10.0, 'weight_exponential_beta': 1.9093817741151724}. Best is trial 30 with value: 0.28915543064622323.
[I 2026-04-21 18:52:38,761] Trial 0 finished with value: 0.09812755312623127 and parameters: {'hidden_dims': '[256, 128]', 'dropout': 0.18584155530312246, 'batch_norm': True, 'lr': 9.012665953349533e-06, 'weight_decay': 4.96591963698479e-06, 'epochs': 105, 'loss': 'mse', 'optimizer': 'sgd', 'use_snp_selection': True, 'num_snps': 25583, 'weight_scheme': 'minmax', 'weight_clip_max': 5.0, 'weight_minmax_eps': 0.14026014881292506}. Best is trial 0 with value: 0.09812755312623127.
[I 2026-04-21 18:52:49,096] Trial 36 finished with value: 0.2869254935201891 and parameters: {'hidden_dims': '[512, 128]', 'dropout': 0.5045923160775201, 'batch_norm': False, 'lr': 1.0769554061255602e-06, 'weight_decay': 9.243459840317066e-05, 'epochs': 204, 'loss': 'mse', 'optimizer': 'adamw', 'use_snp_selection': True, 'num_snps': 59165, 'weight_scheme': 'exponential', 'weight_clip_max': 10.0, 'weight_exponential_beta': 0.10036870588979604}. Best is trial 30 with value: 0.28915543064622323.
[I 2026-04-21 18:52:52,910] Trial 1 finished with value: 0.10038403996586183 and parameters: {'hidden_dims': '[256, 64]', 'dropout': 0.05000949662985405, 'batch_norm': True, 'lr': 0.00015647443054904835, 'weight_decay': 5.158896024962846e-05, 'epochs': 152, 'loss': 'mse', 'optimizer': 'sgd', 'use_snp_selection': False, 'weight_scheme': 'linear', 'weight_clip_max': None, 'weight_linear_min_weight': 0.21922985165550554, 'weight_linear_max_weight': 1.6260435767424388}. Best is trial 1 with value: 0.10038403996586183.
[I 2026-04-21 18:53:17,052] Trial 2 finished with value: 0.03852321179444974 and parameters: {'hidden_dims': '[512, 128]', 'dropout': 0.2736730891340176, 'batch_norm': True, 'lr': 7.298114623433994e-05, 'weight_decay': 5.6346010385734023e-08, 'epochs': 185, 'loss': 'mae', 'optimizer': 'sgd', 'use_snp_selection': True, 'num_snps': 14091, 'weight_scheme': 'minmax', 'weight_clip_max': 10.0, 'weight_minmax_eps': 0.045780660776687306}. Best is trial 1 with value: 0.10038403996586183.
[I 2026-04-21 18:53:32,802] Trial 37 finished with value: 0.24184093861713282 and parameters: {'hidden_dims': '[512, 128]', 'dropout': 0.5057047282398, 'batch_norm': False, 'lr': 1.1427523557831738e-06, 'weight_decay': 9.58906961211296e-05, 'epochs': 179, 'loss': 'mse', 'optimizer': 'adamw', 'use_snp_selection': True, 'num_snps': 48951, 'weight_scheme': 'exponential', 'weight_clip_max': 10.0, 'weight_exponential_beta': 1.9223464174806864}. Best is trial 30 with value: 0.28915543064622323.
[I 2026-04-21 18:54:00,659] Trial 3 finished with value: 0.13721795554349658 and parameters: {'hidden_dims': '[512, 64]', 'dropout': 0.30157795416637295, 'batch_norm': False, 'lr': 2.007492282795256e-05, 'weight_decay': 5.496446859789657e-06, 'epochs': 284, 'loss': 'mse', 'optimizer': 'sgd', 'use_snp_selection': False, 'weight_scheme': 'linear', 'weight_clip_max': None, 'weight_linear_min_weight': 0.24682154527102826, 'weight_linear_max_weight': 1.8338910783134623}. Best is trial 3 with value: 0.13721795554349658.
[I 2026-04-21 18:54:14,539] Trial 4 finished with value: 0.15260700380667294 and parameters: {'hidden_dims': '[256, 64]', 'dropout': 0.18128694708490736, 'batch_norm': False, 'lr': 8.951826748007403e-05, 'weight_decay': 2.1781541495465197e-07, 'epochs': 147, 'loss': 'mse', 'optimizer': 'sgd', 'use_snp_selection': False, 'weight_scheme': 'top-heavy', 'weight_clip_max': 5.0, 'weight_topheavy_top_frac': 0.1724888194073277, 'weight_topheavy_low': 1.1620865802171172, 'weight_topheavy_high': 3.476906528073177}. Best is trial 4 with value: 0.15260700380667294.
[I 2026-04-21 18:54:21,922] Trial 38 finished with value: 0.2545617393192607 and parameters: {'hidden_dims': '[512, 128]', 'dropout': 0.4605186886009436, 'batch_norm': False, 'lr': 1.0059853227338525e-06, 'weight_decay': 0.0003880510261658919, 'epochs': 206, 'loss': 'mse', 'optimizer': 'adamw', 'use_snp_selection': True, 'num_snps': 52710, 'weight_scheme': 'linear', 'weight_clip_max': 10.0, 'weight_linear_min_weight': 0.9515127454197789, 'weight_linear_max_weight': 3.9919501266297}. Best is trial 30 with value: 0.28915543064622323.
[I 2026-04-21 18:54:26,401] Trial 5 finished with value: -0.007769852955528902 and parameters: {'hidden_dims': '[256, 64]', 'dropout': 0.2571412946970998, 'batch_norm': True, 'lr': 3.546238022482882e-05, 'weight_decay': 1.0185234767613396e-06, 'epochs': 119, 'loss': 'mse', 'optimizer': 'sgd', 'use_snp_selection': False, 'weight_scheme': 'linear', 'weight_clip_max': 10.0, 'weight_linear_min_weight': 0.9405832045183805, 'weight_linear_max_weight': 3.413610925325811}. Best is trial 4 with value: 0.15260700380667294.
[I 2026-04-21 18:54:47,974] Trial 6 finished with value: 0.20382757753501488 and parameters: {'hidden_dims': '[256, 64]', 'dropout': 0.037961443806696214, 'batch_norm': True, 'lr': 3.644202049829694e-05, 'weight_decay': 9.73334309820277e-06, 'epochs': 243, 'loss': 'mae', 'optimizer': 'adam', 'use_snp_selection': False, 'weight_scheme': 'minmax', 'weight_clip_max': None, 'weight_minmax_eps': 0.08689611239934374}. Best is trial 6 with value: 0.20382757753501488.
[I 2026-04-21 18:55:08,082] Trial 39 finished with value: 0.25315492557786984 and parameters: {'hidden_dims': '[512, 128]', 'dropout': 0.2274709614025996, 'batch_norm': False, 'lr': 8.568807492519333e-06, 'weight_decay': 3.976782950420267e-06, 'epochs': 152, 'loss': 'mse', 'optimizer': 'adamw', 'use_snp_selection': True, 'num_snps': 59831, 'weight_scheme': 'exponential', 'weight_clip_max': 10.0, 'weight_exponential_beta': 4.856904677146977}. Best is trial 30 with value: 0.28915543064622323.
[I 2026-04-21 18:55:34,736] Trial 7 finished with value: 0.06998347034622714 and parameters: {'hidden_dims': '[512, 128]', 'dropout': 0.1304538168539244, 'batch_norm': False, 'lr': 1.5408060926311233e-05, 'weight_decay': 2.1989735568314356e-08, 'epochs': 250, 'loss': 'mse', 'optimizer': 'sgd', 'use_snp_selection': True, 'num_snps': 42550, 'weight_scheme': 'exponential', 'weight_clip_max': 10.0, 'weight_exponential_beta': 2.758850226029358}. Best is trial 6 with value: 0.20382757753501488.
[I 2026-04-21 18:55:59,046] Trial 8 finished with value: 0.1324645973976974 and parameters: {'hidden_dims': '[256, 128]', 'dropout': 0.05742396906738376, 'batch_norm': False, 'lr': 1.9761509510575143e-06, 'weight_decay': 2.933492239224291e-07, 'epochs': 82, 'loss': 'mae', 'optimizer': 'adam', 'use_snp_selection': True, 'num_snps': 29883, 'weight_scheme': 'minmax', 'weight_clip_max': 5.0, 'weight_minmax_eps': 0.0051288771726799584}. Best is trial 6 with value: 0.20382757753501488.
[I 2026-04-21 18:56:09,084] Trial 0 finished with value: -0.008973810039851074 and parameters: {'hidden_dims': '[256, 128]', 'dropout': 0.18584155530312246, 'batch_norm': True, 'lr': 9.012665953349533e-06, 'weight_decay': 4.96591963698479e-06, 'epochs': 105, 'loss': 'mse', 'optimizer': 'sgd', 'use_snp_selection': True, 'num_snps': 25583, 'weight_scheme': 'minmax', 'weight_clip_max': 5.0, 'weight_minmax_eps': 0.14026014881292506}. Best is trial 0 with value: -0.008973810039851074.
[I 2026-04-21 18:56:23,074] Trial 1 finished with value: 0.07446529507148979 and parameters: {'hidden_dims': '[256, 64]', 'dropout': 0.05000949662985405, 'batch_norm': True, 'lr': 0.00015647443054904835, 'weight_decay': 5.158896024962846e-05, 'epochs': 152, 'loss': 'mse', 'optimizer': 'sgd', 'use_snp_selection': False, 'weight_scheme': 'linear', 'weight_clip_max': None, 'weight_linear_min_weight': 0.21922985165550554, 'weight_linear_max_weight': 1.6260435767424388}. Best is trial 1 with value: 0.07446529507148979.
[I 2026-04-21 18:56:28,729] Trial 9 finished with value: 0.1759049835401142 and parameters: {'hidden_dims': '[256, 128]', 'dropout': 0.5795930447285386, 'batch_norm': False, 'lr': 0.00011782025260263196, 'weight_decay': 0.0005562063174273634, 'epochs': 218, 'loss': 'mae', 'optimizer': 'adamw', 'use_snp_selection': True, 'num_snps': 32226, 'weight_scheme': 'minmax', 'weight_clip_max': 5.0, 'weight_minmax_eps': 0.09600289105543994}. Best is trial 6 with value: 0.20382757753501488.
[I 2026-04-21 18:56:47,067] Trial 2 finished with value: 0.15149538719366348 and parameters: {'hidden_dims': '[512, 128]', 'dropout': 0.2736730891340176, 'batch_norm': True, 'lr': 7.298114623433994e-05, 'weight_decay': 5.6346010385734023e-08, 'epochs': 185, 'loss': 'mae', 'optimizer': 'sgd', 'use_snp_selection': True, 'num_snps': 14091, 'weight_scheme': 'minmax', 'weight_clip_max': 10.0, 'weight_minmax_eps': 0.045780660776687306}. Best is trial 2 with value: 0.15149538719366348.
[I 2026-04-21 18:57:14,669] Trial 10 finished with value: 0.15052251077655682 and parameters: {'hidden_dims': '[512, 64]', 'dropout': 0.4338375928678635, 'batch_norm': True, 'lr': 0.0009667920285641304, 'weight_decay': 6.976468597792388e-05, 'epochs': 294, 'loss': 'mae', 'optimizer': 'adam', 'use_snp_selection': False, 'weight_scheme': 'uniform', 'weight_clip_max': None}. Best is trial 6 with value: 0.20382757753501488.
[I 2026-04-21 18:57:30,440] Trial 3 finished with value: 0.06422268458335496 and parameters: {'hidden_dims': '[512, 64]', 'dropout': 0.30157795416637295, 'batch_norm': False, 'lr': 2.007492282795256e-05, 'weight_decay': 5.496446859789657e-06, 'epochs': 284, 'loss': 'mse', 'optimizer': 'sgd', 'use_snp_selection': False, 'weight_scheme': 'linear', 'weight_clip_max': None, 'weight_linear_min_weight': 0.24682154527102826, 'weight_linear_max_weight': 1.8338910783134623}. Best is trial 2 with value: 0.15149538719366348.
[I 2026-04-21 18:57:44,126] Trial 4 finished with value: 0.054758928015919583 and parameters: {'hidden_dims': '[256, 64]', 'dropout': 0.18128694708490736, 'batch_norm': False, 'lr': 8.951826748007403e-05, 'weight_decay': 2.1781541495465197e-07, 'epochs': 147, 'loss': 'mse', 'optimizer': 'sgd', 'use_snp_selection': False, 'weight_scheme': 'top-heavy', 'weight_clip_max': 5.0, 'weight_topheavy_top_frac': 0.1724888194073277, 'weight_topheavy_low': 1.1620865802171172, 'weight_topheavy_high': 3.476906528073177}. Best is trial 2 with value: 0.15149538719366348.
[I 2026-04-21 18:57:53,710] Trial 11 finished with value: 0.08892382227115819 and parameters: {'hidden_dims': '[256, 128]', 'dropout': 0.5754294922465415, 'batch_norm': False, 'lr': 0.00040305090043403, 'weight_decay': 0.0006508442861563287, 'epochs': 214, 'loss': 'mae', 'optimizer': 'adamw', 'use_snp_selection': True, 'num_snps': 57843, 'weight_scheme': 'minmax', 'weight_clip_max': 5.0, 'weight_minmax_eps': 0.09687781180927992}. Best is trial 6 with value: 0.20382757753501488.
[I 2026-04-21 18:57:55,830] Trial 5 finished with value: 0.08724165420806336 and parameters: {'hidden_dims': '[256, 64]', 'dropout': 0.2571412946970998, 'batch_norm': True, 'lr': 3.546238022482882e-05, 'weight_decay': 1.0185234767613396e-06, 'epochs': 119, 'loss': 'mse', 'optimizer': 'sgd', 'use_snp_selection': False, 'weight_scheme': 'linear', 'weight_clip_max': 10.0, 'weight_linear_min_weight': 0.9405832045183805, 'weight_linear_max_weight': 3.413610925325811}. Best is trial 2 with value: 0.15149538719366348.
[I 2026-04-21 18:58:13,463] Trial 12 finished with value: 0.17787004268629655 and parameters: {'hidden_dims': '[256, 64]', 'dropout': 0.5756846183148884, 'batch_norm': True, 'lr': 3.7845926154118877e-06, 'weight_decay': 0.0009247869841802029, 'epochs': 226, 'loss': 'mae', 'optimizer': 'adamw', 'use_snp_selection': False, 'weight_scheme': 'minmax', 'weight_clip_max': None, 'weight_minmax_eps': 0.09627310711891753}. Best is trial 6 with value: 0.20382757753501488.
[I 2026-04-21 18:58:17,132] Trial 6 finished with value: 0.12055973202240457 and parameters: {'hidden_dims': '[256, 64]', 'dropout': 0.037961443806696214, 'batch_norm': True, 'lr': 3.644202049829694e-05, 'weight_decay': 9.73334309820277e-06, 'epochs': 243, 'loss': 'mae', 'optimizer': 'adam', 'use_snp_selection': False, 'weight_scheme': 'minmax', 'weight_clip_max': None, 'weight_minmax_eps': 0.08689611239934374}. Best is trial 2 with value: 0.15149538719366348.
[I 2026-04-21 18:58:34,863] Trial 13 finished with value: 0.13063222378995207 and parameters: {'hidden_dims': '[256, 64]', 'dropout': 0.4109743180873037, 'batch_norm': True, 'lr': 4.392786235718156e-06, 'weight_decay': 4.1502238804684974e-05, 'epochs': 246, 'loss': 'mae', 'optimizer': 'adam', 'use_snp_selection': False, 'weight_scheme': 'exponential', 'weight_clip_max': None, 'weight_exponential_beta': 7.927627053960856}. Best is trial 6 with value: 0.20382757753501488.
[I 2026-04-21 18:58:56,595] Trial 14 finished with value: 0.1286240681398513 and parameters: {'hidden_dims': '[256, 64]', 'dropout': 0.4550862574586839, 'batch_norm': True, 'lr': 1.6554908696800246e-06, 'weight_decay': 0.00016349453492178333, 'epochs': 250, 'loss': 'mae', 'optimizer': 'adamw', 'use_snp_selection': False, 'weight_scheme': 'top-heavy', 'weight_clip_max': None, 'weight_topheavy_top_frac': 0.49560473718785886, 'weight_topheavy_low': 0.5092386433414309, 'weight_topheavy_high': 5.999907343536929}. Best is trial 6 with value: 0.20382757753501488.
[I 2026-04-21 18:59:03,297] Trial 7 finished with value: 0.06242461183763815 and parameters: {'hidden_dims': '[512, 128]', 'dropout': 0.1304538168539244, 'batch_norm': False, 'lr': 1.5408060926311233e-05, 'weight_decay': 2.1989735568314356e-08, 'epochs': 250, 'loss': 'mse', 'optimizer': 'sgd', 'use_snp_selection': True, 'num_snps': 42550, 'weight_scheme': 'exponential', 'weight_clip_max': 10.0, 'weight_exponential_beta': 2.758850226029358}. Best is trial 2 with value: 0.15149538719366348.
[I 2026-04-21 18:59:14,826] Trial 15 finished with value: 0.1287518117816269 and parameters: {'hidden_dims': '[256, 64]', 'dropout': 0.0009710932148685389, 'batch_norm': True, 'lr': 4.908648055233546e-06, 'weight_decay': 7.637846100563068e-06, 'epochs': 204, 'loss': 'mae', 'optimizer': 'adam', 'use_snp_selection': False, 'weight_scheme': 'minmax', 'weight_clip_max': None, 'weight_minmax_eps': 0.1896287421196899}. Best is trial 6 with value: 0.20382757753501488.
[I 2026-04-21 18:59:26,677] Trial 8 finished with value: 0.13640744817290015 and parameters: {'hidden_dims': '[256, 128]', 'dropout': 0.05742396906738376, 'batch_norm': False, 'lr': 1.9761509510575143e-06, 'weight_decay': 2.933492239224291e-07, 'epochs': 82, 'loss': 'mae', 'optimizer': 'adam', 'use_snp_selection': True, 'num_snps': 29883, 'weight_scheme': 'minmax', 'weight_clip_max': 5.0, 'weight_minmax_eps': 0.0051288771726799584}. Best is trial 2 with value: 0.15149538719366348.
[I 2026-04-21 18:59:37,734] Trial 16 finished with value: 0.1566556048605994 and parameters: {'hidden_dims': '[256, 64]', 'dropout': 0.3492998483156089, 'batch_norm': True, 'lr': 3.7981136339874396e-05, 'weight_decay': 1.7257026734966835e-05, 'epochs': 266, 'loss': 'mae', 'optimizer': 'adamw', 'use_snp_selection': False, 'weight_scheme': 'uniform', 'weight_clip_max': None}. Best is trial 6 with value: 0.20382757753501488.
[I 2026-04-21 18:59:53,509] Trial 17 finished with value: 0.08727445085239816 and parameters: {'hidden_dims': '[256, 64]', 'dropout': 0.5230043735659998, 'batch_norm': True, 'lr': 1.0997779413264295e-06, 'weight_decay': 0.00020042984567008692, 'epochs': 172, 'loss': 'mae', 'optimizer': 'adam', 'use_snp_selection': False, 'weight_scheme': 'minmax', 'weight_clip_max': None, 'weight_minmax_eps': 0.07244320800239297}. Best is trial 6 with value: 0.20382757753501488.
[I 2026-04-21 18:59:55,651] Trial 9 finished with value: 0.1046299739601139 and parameters: {'hidden_dims': '[256, 128]', 'dropout': 0.5795930447285386, 'batch_norm': False, 'lr': 0.00011782025260263196, 'weight_decay': 0.0005562063174273634, 'epochs': 218, 'loss': 'mae', 'optimizer': 'adamw', 'use_snp_selection': True, 'num_snps': 32226, 'weight_scheme': 'minmax', 'weight_clip_max': 5.0, 'weight_minmax_eps': 0.09600289105543994}. Best is trial 2 with value: 0.15149538719366348.
[I 2026-04-21 19:00:15,972] Trial 10 finished with value: 0.10178407993674836 and parameters: {'hidden_dims': '[512, 128]', 'dropout': 0.41166285385449597, 'batch_norm': True, 'lr': 0.0009667920285641304, 'weight_decay': 1.8454339711163535e-08, 'epochs': 193, 'loss': 'mae', 'optimizer': 'adamw', 'use_snp_selection': True, 'num_snps': 8051, 'weight_scheme': 'uniform', 'weight_clip_max': 10.0}. Best is trial 2 with value: 0.15149538719366348.
[I 2026-04-21 19:00:29,325] Trial 18 finished with value: 0.13607594619040958 and parameters: {'hidden_dims': '[512, 128]', 'dropout': 0.4972542975847306, 'batch_norm': True, 'lr': 6.841119707099655e-06, 'weight_decay': 7.097554425575014e-07, 'epochs': 223, 'loss': 'mae', 'optimizer': 'adamw', 'use_snp_selection': False, 'weight_scheme': 'minmax', 'weight_clip_max': None, 'weight_minmax_eps': 0.14414982469719478}. Best is trial 6 with value: 0.20382757753501488.
[I 2026-04-21 19:00:35,145] Trial 11 finished with value: 0.13955804033314492 and parameters: {'hidden_dims': '[512, 128]', 'dropout': 0.4031731850638902, 'batch_norm': False, 'lr': 1.1830949396742993e-06, 'weight_decay': 1.718123473810369e-07, 'epochs': 66, 'loss': 'mae', 'optimizer': 'adam', 'use_snp_selection': True, 'num_snps': 12000, 'weight_scheme': 'minmax', 'weight_clip_max': 5.0, 'weight_minmax_eps': 0.006627383097415861}. Best is trial 2 with value: 0.15149538719366348.
[I 2026-04-21 19:00:52,526] Trial 12 finished with value: 0.018200152590409354 and parameters: {'hidden_dims': '[512, 128]', 'dropout': 0.41777280664506494, 'batch_norm': True, 'lr': 2.4751161237331383e-06, 'weight_decay': 1.0147286916569333e-07, 'epochs': 61, 'loss': 'mae', 'optimizer': 'adam', 'use_snp_selection': True, 'num_snps': 6077, 'weight_scheme': 'minmax', 'weight_clip_max': 10.0, 'weight_minmax_eps': 0.0047993575341047645}. Best is trial 2 with value: 0.15149538719366348.
