Running from this directory: /cluster/work/simennes/Master_thesis
Name of job: ncv_ridge_iw
ID of job: 24361690
Array task ID: 14
The job was run on these nodes: idun-10-07
[I 2026-04-29 19:20:17,168] Trial 0 finished with value: 0.155213838079968 and parameters: {'alpha': 233144.78773166405, 'use_snp_selection': False, 'iw_method': 'pc_logistic', 'iw_clip_max': 3.0, 'iw_prob_clip': 0.003473407124083527, 'iw_n_components': 10, 'iw_logistic_c': 4.788440522914161e-06, 'iw_pca_fit': 'combined', 'iw_solver': 'lbfgs', 'iw_rho': 0.5}. Best is trial 0 with value: 0.155213838079968.
[I 2026-04-29 19:25:30,702] Trial 1 finished with value: 0.16631779751940554 and parameters: {'alpha': 678446.9694418118, 'use_snp_selection': False, 'iw_method': 'pc_logistic', 'iw_clip_max': 5.0, 'iw_prob_clip': 0.013068429331375598, 'iw_n_components': 10, 'iw_logistic_c': 0.08711457855994918, 'iw_pca_fit': 'combined', 'iw_solver': 'lbfgs', 'iw_rho': 0.75}. Best is trial 1 with value: 0.16631779751940554.
[I 2026-04-29 19:26:24,938] Trial 2 finished with value: 0.1422696754778634 and parameters: {'alpha': 143366.13979665696, 'use_snp_selection': False, 'iw_method': 'uniform'}. Best is trial 1 with value: 0.16631779751940554.
[I 2026-04-29 19:31:55,953] Trial 3 finished with value: 0.1414244969957594 and parameters: {'alpha': 58361.61366993588, 'use_snp_selection': False, 'iw_method': 'pc_logistic', 'iw_clip_max': 5.0, 'iw_prob_clip': 0.0019861124260693325, 'iw_n_components': 20, 'iw_logistic_c': 0.0004456301044046966, 'iw_pca_fit': 'combined', 'iw_solver': 'lbfgs', 'iw_rho': 0.5}. Best is trial 1 with value: 0.16631779751940554.
[I 2026-04-29 19:37:19,258] Trial 4 finished with value: 0.1497105090828549 and parameters: {'alpha': 250773.322847116, 'use_snp_selection': False, 'iw_method': 'pc_logistic', 'iw_clip_max': 3.0, 'iw_prob_clip': 0.002976108514822249, 'iw_n_components': 20, 'iw_logistic_c': 4.619061290318921e-07, 'iw_pca_fit': 'combined', 'iw_solver': 'lbfgs', 'iw_rho': 1.0}. Best is trial 1 with value: 0.16631779751940554.
[I 2026-04-29 19:38:14,710] Trial 5 finished with value: 0.13926858867659148 and parameters: {'alpha': 62532.36213374259, 'use_snp_selection': False, 'iw_method': 'uniform'}. Best is trial 1 with value: 0.16631779751940554.
[I 2026-04-29 19:39:08,593] Trial 6 finished with value: 0.13955765868646774 and parameters: {'alpha': 65987.16623129728, 'use_snp_selection': False, 'iw_method': 'uniform'}. Best is trial 1 with value: 0.16631779751940554.
[I 2026-04-29 19:44:22,666] Trial 7 finished with value: 0.16133533210199405 and parameters: {'alpha': 258199.7322511972, 'use_snp_selection': False, 'iw_method': 'pc_logistic', 'iw_clip_max': 5.0, 'iw_prob_clip': 0.011698400979567373, 'iw_n_components': 10, 'iw_logistic_c': 2.0700004045587807e-05, 'iw_pca_fit': 'combined', 'iw_solver': 'lbfgs', 'iw_rho': 0.9}. Best is trial 1 with value: 0.16631779751940554.
[I 2026-04-29 19:48:33,680] Trial 8 finished with value: 0.1575080539850581 and parameters: {'alpha': 471111.2729113027, 'use_snp_selection': False, 'iw_method': 'pc_logistic', 'iw_clip_max': 3.0, 'iw_prob_clip': 0.0028488821422992545, 'iw_n_components': 5, 'iw_logistic_c': 4.32601466983518e-06, 'iw_pca_fit': 'combined', 'iw_solver': 'lbfgs', 'iw_rho': 0.9}. Best is trial 1 with value: 0.16631779751940554.
[I 2026-04-29 19:54:16,133] Trial 9 finished with value: 0.16088205215269596 and parameters: {'alpha': 647318.353565713, 'use_snp_selection': False, 'iw_method': 'pc_logistic', 'iw_clip_max': 3.0, 'iw_prob_clip': 0.0018153829433867708, 'iw_n_components': 30, 'iw_logistic_c': 0.00016321259509605548, 'iw_pca_fit': 'combined', 'iw_solver': 'lbfgs', 'iw_rho': 0.75}. Best is trial 1 with value: 0.16631779751940554.
[I 2026-04-29 19:55:11,847] Trial 10 finished with value: 0.14062661157726547 and parameters: {'alpha': 997785.729883789, 'use_snp_selection': False, 'iw_method': 'uniform'}. Best is trial 1 with value: 0.16631779751940554.
[I 2026-04-29 20:00:29,090] Trial 11 finished with value: 0.16429720684917618 and parameters: {'alpha': 389820.9335156141, 'use_snp_selection': False, 'iw_method': 'pc_logistic', 'iw_clip_max': 5.0, 'iw_prob_clip': 0.026225472902741555, 'iw_n_components': 10, 'iw_logistic_c': 1.8122137936936806, 'iw_pca_fit': 'combined', 'iw_solver': 'lbfgs', 'iw_rho': 0.75}. Best is trial 1 with value: 0.16631779751940554.
[I 2026-04-29 20:06:26,569] Trial 12 finished with value: 0.1582811097789763 and parameters: {'alpha': 443008.9365368905, 'use_snp_selection': False, 'iw_method': 'pc_logistic', 'iw_clip_max': 5.0, 'iw_prob_clip': 0.04308581653727975, 'iw_n_components': 40, 'iw_logistic_c': 1.0170838663935287, 'iw_pca_fit': 'combined', 'iw_solver': 'lbfgs', 'iw_rho': 0.75}. Best is trial 1 with value: 0.16631779751940554.
[I 2026-04-29 20:10:31,047] Trial 13 finished with value: 0.14279172144443786 and parameters: {'alpha': 799460.2336483519, 'use_snp_selection': False, 'iw_method': 'pc_logistic', 'iw_clip_max': 2.0, 'iw_prob_clip': 0.019367617644219827, 'iw_n_components': 1, 'iw_logistic_c': 0.40647901108795736, 'iw_pca_fit': 'combined', 'iw_solver': 'lbfgs', 'iw_rho': 0.75}. Best is trial 1 with value: 0.16631779751940554.
[I 2026-04-29 20:16:37,545] Trial 14 finished with value: 0.15236253818669215 and parameters: {'alpha': 444310.20927815104, 'use_snp_selection': False, 'iw_method': 'pc_logistic', 'iw_clip_max': 1.5, 'iw_prob_clip': 0.026945258492154667, 'iw_n_components': 50, 'iw_logistic_c': 0.036093228687829285, 'iw_pca_fit': 'combined', 'iw_solver': 'lbfgs', 'iw_rho': 0.75}. Best is trial 1 with value: 0.16631779751940554.
[I 2026-04-29 20:22:11,647] Trial 15 finished with value: 0.1553990144375004 and parameters: {'alpha': 163030.30089101204, 'use_snp_selection': False, 'iw_method': 'pc_logistic', 'iw_clip_max': 5.0, 'iw_prob_clip': 0.007807757809157142, 'iw_n_components': 10, 'iw_logistic_c': 9.86828056874816, 'iw_pca_fit': 'combined', 'iw_solver': 'lbfgs', 'iw_rho': 0.75}. Best is trial 1 with value: 0.16631779751940554.
[I 2026-04-29 20:27:29,081] Trial 16 finished with value: 0.16077149665922158 and parameters: {'alpha': 597950.8448256816, 'use_snp_selection': False, 'iw_method': 'pc_logistic', 'iw_clip_max': 5.0, 'iw_prob_clip': 0.014740519819478137, 'iw_n_components': 10, 'iw_logistic_c': 0.018788728022097217, 'iw_pca_fit': 'combined', 'iw_solver': 'lbfgs', 'iw_rho': 1.0}. Best is trial 1 with value: 0.16631779751940554.
[I 2026-04-29 20:32:48,451] Trial 17 finished with value: 0.15299132231205542 and parameters: {'alpha': 350997.4599868886, 'use_snp_selection': False, 'iw_method': 'pc_logistic', 'iw_clip_max': 1.5, 'iw_prob_clip': 0.04905684874138176, 'iw_n_components': 10, 'iw_logistic_c': 0.014400888176584352, 'iw_pca_fit': 'combined', 'iw_solver': 'lbfgs', 'iw_rho': 0.75}. Best is trial 1 with value: 0.16631779751940554.
[I 2026-04-29 20:33:46,204] Trial 18 finished with value: 0.1426931581338599 and parameters: {'alpha': 324262.68382601807, 'use_snp_selection': False, 'iw_method': 'uniform'}. Best is trial 1 with value: 0.16631779751940554.
[I 2026-04-29 20:39:41,789] Trial 19 finished with value: 0.15073980640332954 and parameters: {'alpha': 127312.10159566924, 'use_snp_selection': False, 'iw_method': 'pc_logistic', 'iw_clip_max': 2.0, 'iw_prob_clip': 0.006959775753761657, 'iw_n_components': 40, 'iw_logistic_c': 0.39309474444734577, 'iw_pca_fit': 'combined', 'iw_solver': 'lbfgs', 'iw_rho': 0.75}. Best is trial 1 with value: 0.16631779751940554.
[I 2026-04-29 20:45:55,327] Trial 20 finished with value: 0.15677482674808169 and parameters: {'alpha': 649902.9506018835, 'use_snp_selection': False, 'iw_method': 'pc_logistic', 'iw_clip_max': 5.0, 'iw_prob_clip': 0.0010201660087804571, 'iw_n_components': 50, 'iw_logistic_c': 6.166049280238664, 'iw_pca_fit': 'combined', 'iw_solver': 'lbfgs', 'iw_rho': 0.75}. Best is trial 1 with value: 0.16631779751940554.
[I 2026-04-29 20:51:13,478] Trial 21 finished with value: 0.16214895657229572 and parameters: {'alpha': 283603.85684454656, 'use_snp_selection': False, 'iw_method': 'pc_logistic', 'iw_clip_max': 5.0, 'iw_prob_clip': 0.010596640379546263, 'iw_n_components': 10, 'iw_logistic_c': 3.987446967201544e-05, 'iw_pca_fit': 'combined', 'iw_solver': 'lbfgs', 'iw_rho': 0.9}. Best is trial 1 with value: 0.16631779751940554.
[I 2026-04-29 20:56:39,446] Trial 22 finished with value: 0.15814501331681782 and parameters: {'alpha': 176015.0055663588, 'use_snp_selection': False, 'iw_method': 'pc_logistic', 'iw_clip_max': 5.0, 'iw_prob_clip': 0.007782547075286321, 'iw_n_components': 10, 'iw_logistic_c': 0.0017860415218181457, 'iw_pca_fit': 'combined', 'iw_solver': 'lbfgs', 'iw_rho': 0.9}. Best is trial 1 with value: 0.16631779751940554.
[I 2026-04-29 21:01:59,430] Trial 23 finished with value: 0.16313532745150847 and parameters: {'alpha': 364306.5045269106, 'use_snp_selection': False, 'iw_method': 'pc_logistic', 'iw_clip_max': 5.0, 'iw_prob_clip': 0.023229163354852745, 'iw_n_components': 10, 'iw_logistic_c': 0.13204572498977893, 'iw_pca_fit': 'combined', 'iw_solver': 'lbfgs', 'iw_rho': 0.9}. Best is trial 1 with value: 0.16631779751940554.
[I 2026-04-29 21:06:04,086] Trial 24 finished with value: 0.14272381466228268 and parameters: {'alpha': 381703.32699936186, 'use_snp_selection': False, 'iw_method': 'pc_logistic', 'iw_clip_max': 5.0, 'iw_prob_clip': 0.02664167222322247, 'iw_n_components': 1, 'iw_logistic_c': 0.07409986822542651, 'iw_pca_fit': 'combined', 'iw_solver': 'lbfgs', 'iw_rho': 0.9}. Best is trial 1 with value: 0.16631779751940554.
[I 2026-04-29 21:11:45,027] Trial 25 finished with value: 0.1621923862283799 and parameters: {'alpha': 993633.7631604259, 'use_snp_selection': False, 'iw_method': 'pc_logistic', 'iw_clip_max': 5.0, 'iw_prob_clip': 0.02779786120872186, 'iw_n_components': 30, 'iw_logistic_c': 0.002539373653543034, 'iw_pca_fit': 'combined', 'iw_solver': 'lbfgs', 'iw_rho': 1.0}. Best is trial 1 with value: 0.16631779751940554.
[I 2026-04-29 21:12:39,437] Trial 26 finished with value: 0.14104015279485332 and parameters: {'alpha': 92026.58694828376, 'use_snp_selection': False, 'iw_method': 'uniform'}. Best is trial 1 with value: 0.16631779751940554.
[I 2026-04-29 21:16:41,886] Trial 27 finished with value: 0.1556646959028547 and parameters: {'alpha': 504572.3300711337, 'use_snp_selection': False, 'iw_method': 'pc_logistic', 'iw_clip_max': 2.0, 'iw_prob_clip': 0.018536058280968094, 'iw_n_components': 5, 'iw_logistic_c': 1.4193523332765476, 'iw_pca_fit': 'combined', 'iw_solver': 'lbfgs', 'iw_rho': 0.5}. Best is trial 1 with value: 0.16631779751940554.
[I 2026-04-29 21:22:06,178] Trial 28 finished with value: 0.1547642625195337 and parameters: {'alpha': 562523.117647794, 'use_snp_selection': False, 'iw_method': 'pc_logistic', 'iw_clip_max': 1.5, 'iw_prob_clip': 0.03476751511454079, 'iw_n_components': 10, 'iw_logistic_c': 0.176376122728175, 'iw_pca_fit': 'combined', 'iw_solver': 'lbfgs', 'iw_rho': 0.9}. Best is trial 1 with value: 0.16631779751940554.
[I 2026-04-29 21:27:31,705] Trial 29 finished with value: 0.15996183711663584 and parameters: {'alpha': 212086.40983669795, 'use_snp_selection': False, 'iw_method': 'pc_logistic', 'iw_clip_max': 5.0, 'iw_prob_clip': 0.0178090640635199, 'iw_n_components': 10, 'iw_logistic_c': 0.009112952169194789, 'iw_pca_fit': 'combined', 'iw_solver': 'lbfgs', 'iw_rho': 0.75}. Best is trial 1 with value: 0.16631779751940554.
[I 2026-04-29 21:33:06,375] Trial 30 finished with value: 0.16689343007044405 and parameters: {'alpha': 771333.892424561, 'use_snp_selection': False, 'iw_method': 'pc_logistic', 'iw_clip_max': 5.0, 'iw_prob_clip': 0.012392019011573437, 'iw_n_components': 10, 'iw_logistic_c': 2.1672523284217164, 'iw_pca_fit': 'combined', 'iw_solver': 'lbfgs', 'iw_rho': 0.75}. Best is trial 30 with value: 0.16689343007044405.
[I 2026-04-29 21:38:31,117] Trial 31 finished with value: 0.1636504608483586 and parameters: {'alpha': 809387.5864612343, 'use_snp_selection': False, 'iw_method': 'pc_logistic', 'iw_clip_max': 5.0, 'iw_prob_clip': 0.011689499077617346, 'iw_n_components': 10, 'iw_logistic_c': 1.6119858955920943, 'iw_pca_fit': 'combined', 'iw_solver': 'lbfgs', 'iw_rho': 0.75}. Best is trial 30 with value: 0.16689343007044405.
[I 2026-04-29 21:43:55,762] Trial 32 finished with value: 0.16572816972522736 and parameters: {'alpha': 780881.8657088631, 'use_snp_selection': False, 'iw_method': 'pc_logistic', 'iw_clip_max': 5.0, 'iw_prob_clip': 0.011852922253537398, 'iw_n_components': 10, 'iw_logistic_c': 2.32045129748007, 'iw_pca_fit': 'combined', 'iw_solver': 'lbfgs', 'iw_rho': 0.75}. Best is trial 30 with value: 0.16689343007044405.
[I 2026-04-29 21:49:18,708] Trial 33 finished with value: 0.16733702061271666 and parameters: {'alpha': 760895.9161128689, 'use_snp_selection': False, 'iw_method': 'pc_logistic', 'iw_clip_max': 5.0, 'iw_prob_clip': 0.005727914221346744, 'iw_n_components': 10, 'iw_logistic_c': 3.524422997785418, 'iw_pca_fit': 'combined', 'iw_solver': 'lbfgs', 'iw_rho': 0.75}. Best is trial 33 with value: 0.16733702061271666.
[I 2026-04-29 21:54:44,910] Trial 34 finished with value: 0.1678467120986306 and parameters: {'alpha': 776889.3680343478, 'use_snp_selection': False, 'iw_method': 'pc_logistic', 'iw_clip_max': 5.0, 'iw_prob_clip': 0.005495078803157978, 'iw_n_components': 10, 'iw_logistic_c': 4.760980982630149, 'iw_pca_fit': 'combined', 'iw_solver': 'lbfgs', 'iw_rho': 0.75}. Best is trial 34 with value: 0.1678467120986306.
[I 2026-04-29 21:55:38,998] Trial 35 finished with value: 0.14143460796792556 and parameters: {'alpha': 711964.1243169734, 'use_snp_selection': False, 'iw_method': 'uniform'}. Best is trial 34 with value: 0.1678467120986306.
[I 2026-04-29 22:01:25,039] Trial 36 finished with value: 0.1643350723208926 and parameters: {'alpha': 882672.4564471088, 'use_snp_selection': False, 'iw_method': 'pc_logistic', 'iw_clip_max': 5.0, 'iw_prob_clip': 0.005168267310307707, 'iw_n_components': 20, 'iw_logistic_c': 9.905518110649327, 'iw_pca_fit': 'combined', 'iw_solver': 'lbfgs', 'iw_rho': 0.75}. Best is trial 34 with value: 0.1678467120986306.
[I 2026-04-29 22:06:54,552] Trial 37 finished with value: 0.16538931974472765 and parameters: {'alpha': 547280.2834473806, 'use_snp_selection': False, 'iw_method': 'pc_logistic', 'iw_clip_max': 5.0, 'iw_prob_clip': 0.004720655469306957, 'iw_n_components': 10, 'iw_logistic_c': 0.6702186522240887, 'iw_pca_fit': 'combined', 'iw_solver': 'lbfgs', 'iw_rho': 0.5}. Best is trial 34 with value: 0.1678467120986306.
[I 2026-04-29 22:07:49,536] Trial 38 finished with value: 0.14170557957534258 and parameters: {'alpha': 628875.6089888695, 'use_snp_selection': False, 'iw_method': 'uniform'}. Best is trial 34 with value: 0.1678467120986306.
[I 2026-04-29 22:11:57,486] Trial 39 finished with value: 0.15884744718938787 and parameters: {'alpha': 721729.7987476498, 'use_snp_selection': False, 'iw_method': 'pc_logistic', 'iw_clip_max': 2.0, 'iw_prob_clip': 0.004927783796739459, 'iw_n_components': 5, 'iw_logistic_c': 3.772212896574515, 'iw_pca_fit': 'combined', 'iw_solver': 'lbfgs', 'iw_rho': 0.75}. Best is trial 34 with value: 0.1678467120986306.
[I 2026-04-29 22:18:07,966] Trial 40 finished with value: 0.15842227810302895 and parameters: {'alpha': 954178.6194740206, 'use_snp_selection': False, 'iw_method': 'pc_logistic', 'iw_clip_max': 1.5, 'iw_prob_clip': 0.005896222832906093, 'iw_n_components': 40, 'iw_logistic_c': 0.33513944990707556, 'iw_pca_fit': 'combined', 'iw_solver': 'lbfgs', 'iw_rho': 0.75}. Best is trial 34 with value: 0.1678467120986306.
[I 2026-04-29 22:23:33,657] Trial 41 finished with value: 0.1667024164018365 and parameters: {'alpha': 789077.1516025446, 'use_snp_selection': False, 'iw_method': 'pc_logistic', 'iw_clip_max': 5.0, 'iw_prob_clip': 0.009908295961224335, 'iw_n_components': 10, 'iw_logistic_c': 3.4718773736034967, 'iw_pca_fit': 'combined', 'iw_solver': 'lbfgs', 'iw_rho': 0.75}. Best is trial 34 with value: 0.1678467120986306.
[I 2026-04-29 22:28:58,412] Trial 42 finished with value: 0.1660297607383557 and parameters: {'alpha': 680625.4017083864, 'use_snp_selection': False, 'iw_method': 'pc_logistic', 'iw_clip_max': 5.0, 'iw_prob_clip': 0.003816078964403635, 'iw_n_components': 10, 'iw_logistic_c': 3.7388032476682334, 'iw_pca_fit': 'combined', 'iw_solver': 'lbfgs', 'iw_rho': 0.75}. Best is trial 34 with value: 0.1678467120986306.
[I 2026-04-29 22:34:22,060] Trial 43 finished with value: 0.16674205865975641 and parameters: {'alpha': 859638.0645153057, 'use_snp_selection': False, 'iw_method': 'pc_logistic', 'iw_clip_max': 5.0, 'iw_prob_clip': 0.008493106672708405, 'iw_n_components': 10, 'iw_logistic_c': 0.09911792654268553, 'iw_pca_fit': 'combined', 'iw_solver': 'lbfgs', 'iw_rho': 0.75}. Best is trial 34 with value: 0.1678467120986306.
[I 2026-04-29 22:39:52,585] Trial 44 finished with value: 0.16753136881387637 and parameters: {'alpha': 846680.2048201243, 'use_snp_selection': False, 'iw_method': 'pc_logistic', 'iw_clip_max': 5.0, 'iw_prob_clip': 0.009135611240411711, 'iw_n_components': 10, 'iw_logistic_c': 0.7634812964221275, 'iw_pca_fit': 'combined', 'iw_solver': 'lbfgs', 'iw_rho': 0.75}. Best is trial 34 with value: 0.1678467120986306.
[I 2026-04-29 22:45:24,769] Trial 45 finished with value: 0.1646716566981283 and parameters: {'alpha': 888606.1465183072, 'use_snp_selection': False, 'iw_method': 'pc_logistic', 'iw_clip_max': 3.0, 'iw_prob_clip': 0.008790025996410369, 'iw_n_components': 20, 'iw_logistic_c': 0.06558978164751762, 'iw_pca_fit': 'combined', 'iw_solver': 'lbfgs', 'iw_rho': 0.5}. Best is trial 34 with value: 0.1678467120986306.
[I 2026-04-29 22:51:06,769] Trial 46 finished with value: -1.0 and parameters: {'alpha': 520775.43824309093, 'use_snp_selection': False, 'iw_method': 'pc_logistic', 'iw_clip_max': 5.0, 'iw_prob_clip': 0.006531761318526832, 'iw_n_components': 30, 'iw_logistic_c': 0.7683344706439941, 'iw_pca_fit': 'combined', 'iw_solver': 'lbfgs', 'iw_rho': 1.0}. Best is trial 34 with value: 0.1678467120986306.
[I 2026-04-29 22:52:04,913] Trial 47 finished with value: 0.1410069863431125 and parameters: {'alpha': 854618.4933329108, 'use_snp_selection': False, 'iw_method': 'uniform'}. Best is trial 34 with value: 0.1678467120986306.
[I 2026-04-29 22:57:20,806] Trial 48 finished with value: 0.16643606771940134 and parameters: {'alpha': 435851.41179094714, 'use_snp_selection': False, 'iw_method': 'pc_logistic', 'iw_clip_max': 3.0, 'iw_prob_clip': 0.0034553545938785053, 'iw_n_components': 10, 'iw_logistic_c': 0.1883157077897977, 'iw_pca_fit': 'combined', 'iw_solver': 'lbfgs', 'iw_rho': 0.75}. Best is trial 34 with value: 0.1678467120986306.
[I 2026-04-29 23:03:21,839] Trial 49 finished with value: 0.1435025837154111 and parameters: {'alpha': 753084.8862255996, 'use_snp_selection': False, 'iw_method': 'pc_logistic', 'iw_clip_max': 5.0, 'iw_prob_clip': 0.009057406650593302, 'iw_n_components': 50, 'iw_logistic_c': 1.2104893374602576e-07, 'iw_pca_fit': 'combined', 'iw_solver': 'lbfgs', 'iw_rho': 0.75}. Best is trial 34 with value: 0.1678467120986306.
[I 2026-04-29 23:07:24,557] Trial 50 finished with value: 0.1417435584695495 and parameters: {'alpha': 600060.9099787562, 'use_snp_selection': False, 'iw_method': 'pc_logistic', 'iw_clip_max': 5.0, 'iw_prob_clip': 0.002580199528044655, 'iw_n_components': 1, 'iw_logistic_c': 0.9709978982068203, 'iw_pca_fit': 'combined', 'iw_solver': 'lbfgs', 'iw_rho': 0.75}. Best is trial 34 with value: 0.1678467120986306.
[I 2026-04-29 23:12:47,950] Trial 51 finished with value: 0.16756610147685913 and parameters: {'alpha': 881462.3679234331, 'use_snp_selection': False, 'iw_method': 'pc_logistic', 'iw_clip_max': 5.0, 'iw_prob_clip': 0.015005229857343127, 'iw_n_components': 10, 'iw_logistic_c': 3.684936874799137, 'iw_pca_fit': 'combined', 'iw_solver': 'lbfgs', 'iw_rho': 0.75}. Best is trial 34 with value: 0.1678467120986306.
[I 2026-04-29 23:18:12,674] Trial 52 finished with value: 0.16524980095121217 and parameters: {'alpha': 910175.0659660954, 'use_snp_selection': False, 'iw_method': 'pc_logistic', 'iw_clip_max': 5.0, 'iw_prob_clip': 0.013359321194147348, 'iw_n_components': 10, 'iw_logistic_c': 3.9017569394648155, 'iw_pca_fit': 'combined', 'iw_solver': 'lbfgs', 'iw_rho': 0.75}. Best is trial 34 with value: 0.1678467120986306.
[I 2026-04-29 23:23:40,158] Trial 53 finished with value: 0.16551388196171246 and parameters: {'alpha': 988843.9835459824, 'use_snp_selection': False, 'iw_method': 'pc_logistic', 'iw_clip_max': 5.0, 'iw_prob_clip': 0.015278666012388585, 'iw_n_components': 10, 'iw_logistic_c': 0.4015411092674958, 'iw_pca_fit': 'combined', 'iw_solver': 'lbfgs', 'iw_rho': 0.75}. Best is trial 34 with value: 0.1678467120986306.
[I 2026-04-29 23:29:09,328] Trial 54 finished with value: 0.16370492317351817 and parameters: {'alpha': 680972.9650771422, 'use_snp_selection': False, 'iw_method': 'pc_logistic', 'iw_clip_max': 5.0, 'iw_prob_clip': 0.005901800103478584, 'iw_n_components': 10, 'iw_logistic_c': 1.92735822587481, 'iw_pca_fit': 'combined', 'iw_solver': 'lbfgs', 'iw_rho': 0.75}. Best is trial 34 with value: 0.1678467120986306.
[I 2026-04-29 23:34:24,072] Trial 55 finished with value: 0.16663658820047286 and parameters: {'alpha': 817435.9973245518, 'use_snp_selection': False, 'iw_method': 'pc_logistic', 'iw_clip_max': 5.0, 'iw_prob_clip': 0.004044814334629759, 'iw_n_components': 10, 'iw_logistic_c': 6.660014674476381, 'iw_pca_fit': 'combined', 'iw_solver': 'lbfgs', 'iw_rho': 0.75}. Best is trial 34 with value: 0.1678467120986306.
[I 2026-04-29 23:39:42,436] Trial 56 finished with value: 0.16613711161170241 and parameters: {'alpha': 478443.4831902911, 'use_snp_selection': False, 'iw_method': 'pc_logistic', 'iw_clip_max': 3.0, 'iw_prob_clip': 0.008236855347689488, 'iw_n_components': 10, 'iw_logistic_c': 0.6927494866244448, 'iw_pca_fit': 'combined', 'iw_solver': 'lbfgs', 'iw_rho': 0.75}. Best is trial 34 with value: 0.1678467120986306.
