[I 2026-04-30 00:29:53,488] Trial 110 finished with value: 0.23115556956024957 and parameters: {'alpha': 366335.4500084124, 'use_snp_selection': False, 'iw_method': 'pc_logistic', 'iw_clip_max': 3.0, 'iw_prob_clip': 0.022524157760543947, 'iw_n_components': 30, 'iw_logistic_c': 1.756941023331636e-06, 'iw_pca_fit': 'combined', 'iw_solver': 'lbfgs', 'iw_rho': 1.0}. Best is trial 106 with value: 0.2328914411915996.
[I 2026-04-30 00:33:27,450] Trial 111 finished with value: 0.2296633199310035 and parameters: {'alpha': 365670.6895138134, 'use_snp_selection': False, 'iw_method': 'pc_logistic', 'iw_clip_max': 3.0, 'iw_prob_clip': 0.01758942705865991, 'iw_n_components': 30, 'iw_logistic_c': 1.186282000847582e-06, 'iw_pca_fit': 'combined', 'iw_solver': 'lbfgs', 'iw_rho': 1.0}. Best is trial 106 with value: 0.2328914411915996.
[I 2026-04-30 00:37:00,387] Trial 112 finished with value: 0.2332243853747233 and parameters: {'alpha': 449530.6745601727, 'use_snp_selection': False, 'iw_method': 'pc_logistic', 'iw_clip_max': 3.0, 'iw_prob_clip': 0.04539514881049619, 'iw_n_components': 30, 'iw_logistic_c': 2.902279443262324e-06, 'iw_pca_fit': 'combined', 'iw_solver': 'lbfgs', 'iw_rho': 1.0}. Best is trial 112 with value: 0.2332243853747233.
[I 2026-04-30 00:40:34,637] Trial 113 finished with value: 0.2308060242885003 and parameters: {'alpha': 403738.6925994117, 'use_snp_selection': False, 'iw_method': 'pc_logistic', 'iw_clip_max': 3.0, 'iw_prob_clip': 0.04952366607198782, 'iw_n_components': 30, 'iw_logistic_c': 1.9116451305119667e-06, 'iw_pca_fit': 'combined', 'iw_solver': 'lbfgs', 'iw_rho': 1.0}. Best is trial 112 with value: 0.2332243853747233.
[I 2026-04-30 00:44:08,758] Trial 114 finished with value: 0.23126074943637973 and parameters: {'alpha': 395886.7487555562, 'use_snp_selection': False, 'iw_method': 'pc_logistic', 'iw_clip_max': 3.0, 'iw_prob_clip': 0.049895545763237105, 'iw_n_components': 30, 'iw_logistic_c': 2.046722183431274e-06, 'iw_pca_fit': 'combined', 'iw_solver': 'lbfgs', 'iw_rho': 1.0}. Best is trial 112 with value: 0.2332243853747233.
[I 2026-04-30 00:47:42,667] Trial 115 finished with value: 0.22815515783539783 and parameters: {'alpha': 405036.1123790445, 'use_snp_selection': False, 'iw_method': 'pc_logistic', 'iw_clip_max': 3.0, 'iw_prob_clip': 0.048713437296060785, 'iw_n_components': 30, 'iw_logistic_c': 3.8078599996439963e-07, 'iw_pca_fit': 'combined', 'iw_solver': 'lbfgs', 'iw_rho': 1.0}. Best is trial 112 with value: 0.2332243853747233.
[I 2026-04-30 00:51:16,150] Trial 116 finished with value: 0.2325632940407547 and parameters: {'alpha': 437577.6832072453, 'use_snp_selection': False, 'iw_method': 'pc_logistic', 'iw_clip_max': 3.0, 'iw_prob_clip': 0.03407960849619311, 'iw_n_components': 30, 'iw_logistic_c': 1.932552653908003e-06, 'iw_pca_fit': 'combined', 'iw_solver': 'lbfgs', 'iw_rho': 1.0}. Best is trial 112 with value: 0.2332243853747233.
[I 2026-04-30 00:54:50,946] Trial 117 finished with value: 0.23249019901093324 and parameters: {'alpha': 434827.50791268615, 'use_snp_selection': False, 'iw_method': 'pc_logistic', 'iw_clip_max': 3.0, 'iw_prob_clip': 0.0338774385177597, 'iw_n_components': 30, 'iw_logistic_c': 1.789928898361485e-06, 'iw_pca_fit': 'combined', 'iw_solver': 'lbfgs', 'iw_rho': 1.0}. Best is trial 112 with value: 0.2332243853747233.
[I 2026-04-30 00:58:23,618] Trial 118 finished with value: 0.23080600353828337 and parameters: {'alpha': 349814.80772653944, 'use_snp_selection': False, 'iw_method': 'pc_logistic', 'iw_clip_max': 5.0, 'iw_prob_clip': 0.03147653816811613, 'iw_n_components': 30, 'iw_logistic_c': 1.938333730855139e-06, 'iw_pca_fit': 'combined', 'iw_solver': 'lbfgs', 'iw_rho': 1.0}. Best is trial 112 with value: 0.2332243853747233.
[I 2026-04-30 01:01:59,104] Trial 119 finished with value: 0.22822895703723303 and parameters: {'alpha': 426306.5156108321, 'use_snp_selection': False, 'iw_method': 'pc_logistic', 'iw_clip_max': 5.0, 'iw_prob_clip': 0.03344572968927775, 'iw_n_components': 30, 'iw_logistic_c': 7.597013368176561e-07, 'iw_pca_fit': 'combined', 'iw_solver': 'lbfgs', 'iw_rho': 1.0}. Best is trial 112 with value: 0.2332243853747233.
[I 2026-04-30 01:05:34,603] Trial 120 finished with value: 0.23018893234745094 and parameters: {'alpha': 336059.774534282, 'use_snp_selection': False, 'iw_method': 'pc_logistic', 'iw_clip_max': 5.0, 'iw_prob_clip': 0.027508373603268316, 'iw_n_components': 30, 'iw_logistic_c': 1.713157612487714e-06, 'iw_pca_fit': 'combined', 'iw_solver': 'lbfgs', 'iw_rho': 1.0}. Best is trial 112 with value: 0.2332243853747233.
[I 2026-04-30 01:09:08,719] Trial 121 finished with value: 0.2306500345791048 and parameters: {'alpha': 348320.76585641387, 'use_snp_selection': False, 'iw_method': 'pc_logistic', 'iw_clip_max': 5.0, 'iw_prob_clip': 0.031085844415841345, 'iw_n_components': 30, 'iw_logistic_c': 1.7529716768300096e-06, 'iw_pca_fit': 'combined', 'iw_solver': 'lbfgs', 'iw_rho': 1.0}. Best is trial 112 with value: 0.2332243853747233.
[I 2026-04-30 01:12:43,128] Trial 122 finished with value: 0.2295999052677144 and parameters: {'alpha': 377640.8367090254, 'use_snp_selection': False, 'iw_method': 'pc_logistic', 'iw_clip_max': 5.0, 'iw_prob_clip': 0.023417003196324965, 'iw_n_components': 30, 'iw_logistic_c': 1.0151390574847332e-06, 'iw_pca_fit': 'combined', 'iw_solver': 'lbfgs', 'iw_rho': 1.0}. Best is trial 112 with value: 0.2332243853747233.
[I 2026-04-30 01:16:18,551] Trial 123 finished with value: 0.23070174267072527 and parameters: {'alpha': 461300.82685422816, 'use_snp_selection': False, 'iw_method': 'pc_logistic', 'iw_clip_max': 5.0, 'iw_prob_clip': 0.03099433152845505, 'iw_n_components': 30, 'iw_logistic_c': 1.802557461521528e-06, 'iw_pca_fit': 'combined', 'iw_solver': 'lbfgs', 'iw_rho': 1.0}. Best is trial 112 with value: 0.2332243853747233.
[I 2026-04-30 01:19:52,950] Trial 124 finished with value: 0.23100825309507975 and parameters: {'alpha': 458222.95390945236, 'use_snp_selection': False, 'iw_method': 'pc_logistic', 'iw_clip_max': 5.0, 'iw_prob_clip': 0.030517157565231472, 'iw_n_components': 30, 'iw_logistic_c': 1.8748714303082602e-06, 'iw_pca_fit': 'combined', 'iw_solver': 'lbfgs', 'iw_rho': 1.0}. Best is trial 112 with value: 0.2332243853747233.
[I 2026-04-30 01:23:27,483] Trial 125 finished with value: 0.2303660795012865 and parameters: {'alpha': 461828.47399778274, 'use_snp_selection': False, 'iw_method': 'pc_logistic', 'iw_clip_max': 5.0, 'iw_prob_clip': 0.03057578786408879, 'iw_n_components': 30, 'iw_logistic_c': 1.8113808295294747e-06, 'iw_pca_fit': 'combined', 'iw_solver': 'lbfgs', 'iw_rho': 1.0}. Best is trial 112 with value: 0.2332243853747233.
[I 2026-04-30 01:27:02,654] Trial 126 finished with value: 0.22327804493876072 and parameters: {'alpha': 108149.3267775962, 'use_snp_selection': False, 'iw_method': 'pc_logistic', 'iw_clip_max': 5.0, 'iw_prob_clip': 0.02294014932269594, 'iw_n_components': 30, 'iw_logistic_c': 6.89199672867171e-07, 'iw_pca_fit': 'combined', 'iw_solver': 'lbfgs', 'iw_rho': 1.0}. Best is trial 112 with value: 0.2332243853747233.
[I 2026-04-30 01:30:38,560] Trial 127 finished with value: 0.22969696041233675 and parameters: {'alpha': 538921.1269516456, 'use_snp_selection': False, 'iw_method': 'pc_logistic', 'iw_clip_max': 5.0, 'iw_prob_clip': 0.025529285699167525, 'iw_n_components': 30, 'iw_logistic_c': 1.1597718332544253e-06, 'iw_pca_fit': 'combined', 'iw_solver': 'lbfgs', 'iw_rho': 1.0}. Best is trial 112 with value: 0.2332243853747233.
[I 2026-04-30 01:34:13,204] Trial 128 finished with value: 0.22765895837924233 and parameters: {'alpha': 457929.0509714413, 'use_snp_selection': False, 'iw_method': 'pc_logistic', 'iw_clip_max': 5.0, 'iw_prob_clip': 0.034700365483260324, 'iw_n_components': 30, 'iw_logistic_c': 1.4756112808570297e-07, 'iw_pca_fit': 'combined', 'iw_solver': 'lbfgs', 'iw_rho': 1.0}. Best is trial 112 with value: 0.2332243853747233.
[I 2026-04-30 01:34:51,670] Trial 129 finished with value: 0.22741376959612106 and parameters: {'alpha': 316323.5376250231, 'use_snp_selection': False, 'iw_method': 'uniform'}. Best is trial 112 with value: 0.2332243853747233.
[I 2026-04-30 01:38:25,600] Trial 130 finished with value: 0.22919423063681718 and parameters: {'alpha': 376293.84791250137, 'use_snp_selection': False, 'iw_method': 'pc_logistic', 'iw_clip_max': 5.0, 'iw_prob_clip': 0.020424311055632884, 'iw_n_components': 30, 'iw_logistic_c': 4.812767729727408e-07, 'iw_pca_fit': 'combined', 'iw_solver': 'lbfgs', 'iw_rho': 1.0}. Best is trial 112 with value: 0.2332243853747233.
[I 2026-04-30 01:42:00,771] Trial 131 finished with value: 0.230803670075022 and parameters: {'alpha': 461577.5918810318, 'use_snp_selection': False, 'iw_method': 'pc_logistic', 'iw_clip_max': 5.0, 'iw_prob_clip': 0.029975967732650526, 'iw_n_components': 30, 'iw_logistic_c': 1.854653627682419e-06, 'iw_pca_fit': 'combined', 'iw_solver': 'lbfgs', 'iw_rho': 1.0}. Best is trial 112 with value: 0.2332243853747233.
[I 2026-04-30 01:45:34,960] Trial 132 finished with value: 0.23032750751644399 and parameters: {'alpha': 427454.18139107374, 'use_snp_selection': False, 'iw_method': 'pc_logistic', 'iw_clip_max': 5.0, 'iw_prob_clip': 0.031231635701182186, 'iw_n_components': 30, 'iw_logistic_c': 1.6517548351017818e-06, 'iw_pca_fit': 'combined', 'iw_solver': 'lbfgs', 'iw_rho': 1.0}. Best is trial 112 with value: 0.2332243853747233.
[I 2026-04-30 01:49:09,117] Trial 133 finished with value: 0.22835830657776027 and parameters: {'alpha': 345929.1903962011, 'use_snp_selection': False, 'iw_method': 'pc_logistic', 'iw_clip_max': 5.0, 'iw_prob_clip': 0.029102428676114796, 'iw_n_components': 30, 'iw_logistic_c': 3.187987272587288e-07, 'iw_pca_fit': 'combined', 'iw_solver': 'lbfgs', 'iw_rho': 1.0}. Best is trial 112 with value: 0.2332243853747233.
[I 2026-04-30 01:52:44,334] Trial 134 finished with value: 0.22962077450264262 and parameters: {'alpha': 537352.2448010163, 'use_snp_selection': False, 'iw_method': 'pc_logistic', 'iw_clip_max': 5.0, 'iw_prob_clip': 0.036223654422856334, 'iw_n_components': 30, 'iw_logistic_c': 1.8823005380154118e-06, 'iw_pca_fit': 'combined', 'iw_solver': 'lbfgs', 'iw_rho': 1.0}. Best is trial 112 with value: 0.2332243853747233.
[I 2026-04-30 01:56:16,858] Trial 135 finished with value: 0.2285757139116556 and parameters: {'alpha': 455811.68324857805, 'use_snp_selection': False, 'iw_method': 'pc_logistic', 'iw_clip_max': 5.0, 'iw_prob_clip': 0.032187096056771905, 'iw_n_components': 30, 'iw_logistic_c': 1.0178816692458813e-06, 'iw_pca_fit': 'combined', 'iw_solver': 'lbfgs', 'iw_rho': 1.0}. Best is trial 112 with value: 0.2332243853747233.
[I 2026-04-30 01:59:45,929] Trial 136 finished with value: 0.22845698520972438 and parameters: {'alpha': 414435.36321165715, 'use_snp_selection': False, 'iw_method': 'pc_logistic', 'iw_clip_max': 5.0, 'iw_prob_clip': 0.03760984784282323, 'iw_n_components': 30, 'iw_logistic_c': 1.3335510384900753e-06, 'iw_pca_fit': 'combined', 'iw_solver': 'lbfgs', 'iw_rho': 1.0}. Best is trial 112 with value: 0.2332243853747233.
[I 2026-04-30 02:03:10,125] Trial 137 finished with value: 0.22843357171802298 and parameters: {'alpha': 383490.5597768556, 'use_snp_selection': False, 'iw_method': 'pc_logistic', 'iw_clip_max': 5.0, 'iw_prob_clip': 0.03414091292413542, 'iw_n_components': 30, 'iw_logistic_c': 6.389970492027184e-07, 'iw_pca_fit': 'combined', 'iw_solver': 'lbfgs', 'iw_rho': 1.0}. Best is trial 112 with value: 0.2332243853747233.
[I 2026-04-30 02:06:34,669] Trial 138 finished with value: 0.21782943961888074 and parameters: {'alpha': 76826.64113456987, 'use_snp_selection': False, 'iw_method': 'pc_logistic', 'iw_clip_max': 5.0, 'iw_prob_clip': 0.025750650386618668, 'iw_n_components': 30, 'iw_logistic_c': 2.0255063976200228e-06, 'iw_pca_fit': 'combined', 'iw_solver': 'lbfgs', 'iw_rho': 1.0}. Best is trial 112 with value: 0.2332243853747233.
[I 2026-04-30 02:09:59,400] Trial 139 finished with value: 0.22810116182722906 and parameters: {'alpha': 473316.58833419956, 'use_snp_selection': False, 'iw_method': 'pc_logistic', 'iw_clip_max': 5.0, 'iw_prob_clip': 0.04589669438745925, 'iw_n_components': 30, 'iw_logistic_c': 7.582654469939885e-07, 'iw_pca_fit': 'combined', 'iw_solver': 'lbfgs', 'iw_rho': 1.0}. Best is trial 112 with value: 0.2332243853747233.
[I 2026-04-30 02:13:24,108] Trial 140 finished with value: 0.2277790800980763 and parameters: {'alpha': 521923.82469317113, 'use_snp_selection': False, 'iw_method': 'pc_logistic', 'iw_clip_max': 5.0, 'iw_prob_clip': 0.03041174605815425, 'iw_n_components': 30, 'iw_logistic_c': 4.177379083866807e-07, 'iw_pca_fit': 'combined', 'iw_solver': 'lbfgs', 'iw_rho': 1.0}. Best is trial 112 with value: 0.2332243853747233.
[I 2026-04-30 02:16:49,613] Trial 141 finished with value: 0.23062224036825246 and parameters: {'alpha': 455510.64059729216, 'use_snp_selection': False, 'iw_method': 'pc_logistic', 'iw_clip_max': 5.0, 'iw_prob_clip': 0.03082010445421739, 'iw_n_components': 30, 'iw_logistic_c': 2.0746179897235774e-06, 'iw_pca_fit': 'combined', 'iw_solver': 'lbfgs', 'iw_rho': 1.0}. Best is trial 112 with value: 0.2332243853747233.
[I 2026-04-30 02:20:21,841] Trial 142 finished with value: 0.21301366122555215 and parameters: {'alpha': 439180.67813450296, 'use_snp_selection': False, 'iw_method': 'pc_logistic', 'iw_clip_max': 5.0, 'iw_prob_clip': 0.027768790031987324, 'iw_n_components': 30, 'iw_logistic_c': 0.0021019760503990428, 'iw_pca_fit': 'combined', 'iw_solver': 'lbfgs', 'iw_rho': 1.0}. Best is trial 112 with value: 0.2332243853747233.
[I 2026-04-30 02:23:49,432] Trial 143 finished with value: 0.22883309113446426 and parameters: {'alpha': 365677.83751083945, 'use_snp_selection': False, 'iw_method': 'pc_logistic', 'iw_clip_max': 5.0, 'iw_prob_clip': 0.020380323792533794, 'iw_n_components': 30, 'iw_logistic_c': 1.2461017728092801e-06, 'iw_pca_fit': 'combined', 'iw_solver': 'lbfgs', 'iw_rho': 1.0}. Best is trial 112 with value: 0.2332243853747233.
[I 2026-04-30 02:27:14,039] Trial 144 finished with value: 0.23131137658324308 and parameters: {'alpha': 404083.41810484906, 'use_snp_selection': False, 'iw_method': 'pc_logistic', 'iw_clip_max': 5.0, 'iw_prob_clip': 0.03540953058699952, 'iw_n_components': 30, 'iw_logistic_c': 2.2490216129014582e-06, 'iw_pca_fit': 'combined', 'iw_solver': 'lbfgs', 'iw_rho': 1.0}. Best is trial 112 with value: 0.2332243853747233.
[I 2026-04-30 02:30:39,187] Trial 145 finished with value: 0.23187274225253257 and parameters: {'alpha': 399539.85272703937, 'use_snp_selection': False, 'iw_method': 'pc_logistic', 'iw_clip_max': 5.0, 'iw_prob_clip': 0.03817657608335394, 'iw_n_components': 30, 'iw_logistic_c': 2.5858040324089476e-06, 'iw_pca_fit': 'combined', 'iw_solver': 'lbfgs', 'iw_rho': 0.75}. Best is trial 112 with value: 0.2332243853747233.
[I 2026-04-30 02:34:13,751] Trial 146 finished with value: 0.2226984078175859 and parameters: {'alpha': 394514.34130179393, 'use_snp_selection': False, 'iw_method': 'pc_logistic', 'iw_clip_max': 5.0, 'iw_prob_clip': 0.04987500361435834, 'iw_n_components': 30, 'iw_logistic_c': 0.026358884347699563, 'iw_pca_fit': 'combined', 'iw_solver': 'lbfgs', 'iw_rho': 0.75}. Best is trial 112 with value: 0.2332243853747233.
[I 2026-04-30 02:37:38,910] Trial 147 finished with value: 0.22935819995301956 and parameters: {'alpha': 416655.30648949766, 'use_snp_selection': False, 'iw_method': 'pc_logistic', 'iw_clip_max': 3.0, 'iw_prob_clip': 0.0381522606795799, 'iw_n_components': 30, 'iw_logistic_c': 8.342716351113914e-06, 'iw_pca_fit': 'combined', 'iw_solver': 'lbfgs', 'iw_rho': 0.75}. Best is trial 112 with value: 0.2332243853747233.
[I 2026-04-30 02:41:03,442] Trial 148 finished with value: 0.23142196653932925 and parameters: {'alpha': 497016.29604991945, 'use_snp_selection': False, 'iw_method': 'pc_logistic', 'iw_clip_max': 5.0, 'iw_prob_clip': 0.03566257532027393, 'iw_n_components': 30, 'iw_logistic_c': 2.336077800811252e-06, 'iw_pca_fit': 'combined', 'iw_solver': 'lbfgs', 'iw_rho': 0.75}. Best is trial 112 with value: 0.2332243853747233.
[I 2026-04-30 02:44:28,646] Trial 149 finished with value: 0.23298317827192866 and parameters: {'alpha': 495432.8701691968, 'use_snp_selection': False, 'iw_method': 'pc_logistic', 'iw_clip_max': 3.0, 'iw_prob_clip': 0.03552777379406091, 'iw_n_components': 30, 'iw_logistic_c': 3.843256444854676e-06, 'iw_pca_fit': 'combined', 'iw_solver': 'lbfgs', 'iw_rho': 0.75}. Best is trial 112 with value: 0.2332243853747233.
