[I 2026-04-21 18:28:31,317] Trial 38 finished with value: -0.0256794270829109 and parameters: {'hidden_dims': '[256, 128]', 'dropout': 0.4810695506605517, 'batch_norm': False, 'lr': 1.420328789856835e-06, 'weight_decay': 1.6486250431657701e-07, 'epochs': 116, 'loss': 'mse', 'optimizer': 'sgd', 'use_snp_selection': True, 'num_snps': 47572, 'weight_scheme': 'top-heavy', 'weight_clip_max': 5.0, 'weight_topheavy_top_frac': 0.23888905667311605, 'weight_topheavy_low': 0.9710910889158186, 'weight_topheavy_high': 5.498996621788557}. Best is trial 13 with value: 0.157849987116606.
[I 2026-04-21 18:28:42,151] Trial 20 finished with value: 0.069857007155355 and parameters: {'hidden_dims': '[512, 128]', 'dropout': 0.19390238815250446, 'batch_norm': True, 'lr': 0.00020793245991367222, 'weight_decay': 0.0001904290313123342, 'epochs': 225, 'loss': 'mae', 'optimizer': 'adam', 'use_snp_selection': False, 'weight_scheme': 'minmax', 'weight_clip_max': None, 'weight_minmax_eps': 0.19815274403800484}. Best is trial 18 with value: 0.08081023880245293.
[I 2026-04-21 18:28:52,454] Trial 39 finished with value: 0.11748461992519403 and parameters: {'hidden_dims': '[256, 128]', 'dropout': 0.5402802805905929, 'batch_norm': True, 'lr': 9.204982956785549e-06, 'weight_decay': 1.1900699489708985e-06, 'epochs': 87, 'loss': 'mse', 'optimizer': 'adam', 'use_snp_selection': True, 'num_snps': 35953, 'weight_scheme': 'top-heavy', 'weight_clip_max': 5.0, 'weight_topheavy_top_frac': 0.2556366373356765, 'weight_topheavy_low': 0.5798472222393106, 'weight_topheavy_high': 5.489035835000733}. Best is trial 13 with value: 0.157849987116606.
[I 2026-04-21 18:29:14,182] Trial 21 finished with value: 0.06319928094687471 and parameters: {'hidden_dims': '[512, 128]', 'dropout': 0.14443314111417818, 'batch_norm': True, 'lr': 0.0002562426338424543, 'weight_decay': 0.0001512497839951333, 'epochs': 228, 'loss': 'mae', 'optimizer': 'adam', 'use_snp_selection': False, 'weight_scheme': 'minmax', 'weight_clip_max': None, 'weight_minmax_eps': 0.19999501252785037}. Best is trial 18 with value: 0.08081023880245293.
[I 2026-04-21 18:29:39,892] Trial 0 finished with value: 0.04970638010791289 and parameters: {'hidden_dims': '[256, 128]', 'dropout': 0.18584155530312246, 'batch_norm': True, 'lr': 9.012665953349533e-06, 'weight_decay': 4.96591963698479e-06, 'epochs': 105, 'loss': 'mse', 'optimizer': 'sgd', 'use_snp_selection': True, 'num_snps': 25583, 'weight_scheme': 'minmax', 'weight_clip_max': 5.0, 'weight_minmax_eps': 0.14026014881292506}. Best is trial 0 with value: 0.04970638010791289.
[I 2026-04-21 18:29:50,462] Trial 22 finished with value: 0.06709908452901733 and parameters: {'hidden_dims': '[512, 128]', 'dropout': 0.20783889430353997, 'batch_norm': True, 'lr': 0.0003643551347101485, 'weight_decay': 0.00022784835037523577, 'epochs': 260, 'loss': 'mae', 'optimizer': 'adam', 'use_snp_selection': False, 'weight_scheme': 'minmax', 'weight_clip_max': None, 'weight_minmax_eps': 0.11054795803264775}. Best is trial 18 with value: 0.08081023880245293.
[I 2026-04-21 18:29:53,696] Trial 1 finished with value: 0.14934050306521965 and parameters: {'hidden_dims': '[256, 64]', 'dropout': 0.05000949662985405, 'batch_norm': True, 'lr': 0.00015647443054904835, 'weight_decay': 5.158896024962846e-05, 'epochs': 152, 'loss': 'mse', 'optimizer': 'sgd', 'use_snp_selection': False, 'weight_scheme': 'linear', 'weight_clip_max': None, 'weight_linear_min_weight': 0.21922985165550554, 'weight_linear_max_weight': 1.6260435767424388}. Best is trial 1 with value: 0.14934050306521965.
[I 2026-04-21 18:30:16,690] Trial 23 finished with value: 0.046812288618807284 and parameters: {'hidden_dims': '[512, 128]', 'dropout': 0.09337313524660792, 'batch_norm': True, 'lr': 4.867615877598051e-05, 'weight_decay': 0.0006674979268557209, 'epochs': 182, 'loss': 'mae', 'optimizer': 'adam', 'use_snp_selection': False, 'weight_scheme': 'minmax', 'weight_clip_max': None, 'weight_minmax_eps': 0.1952685188836859}. Best is trial 18 with value: 0.08081023880245293.
[I 2026-04-21 18:30:17,697] Trial 2 finished with value: 0.1645186591391428 and parameters: {'hidden_dims': '[512, 128]', 'dropout': 0.2736730891340176, 'batch_norm': True, 'lr': 7.298114623433994e-05, 'weight_decay': 5.6346010385734023e-08, 'epochs': 185, 'loss': 'mae', 'optimizer': 'sgd', 'use_snp_selection': True, 'num_snps': 14091, 'weight_scheme': 'minmax', 'weight_clip_max': 10.0, 'weight_minmax_eps': 0.045780660776687306}. Best is trial 2 with value: 0.1645186591391428.
[I 2026-04-21 18:30:47,455] Trial 24 finished with value: 0.0669377133917663 and parameters: {'hidden_dims': '[512, 128]', 'dropout': 0.22998243402414206, 'batch_norm': True, 'lr': 2.4865821111278614e-05, 'weight_decay': 2.314374869234276e-05, 'epochs': 221, 'loss': 'mae', 'optimizer': 'adam', 'use_snp_selection': False, 'weight_scheme': 'minmax', 'weight_clip_max': None, 'weight_minmax_eps': 0.0696674384388476}. Best is trial 18 with value: 0.08081023880245293.
[I 2026-04-21 18:31:00,568] Trial 3 finished with value: 0.06646157304495524 and parameters: {'hidden_dims': '[512, 64]', 'dropout': 0.30157795416637295, 'batch_norm': False, 'lr': 2.007492282795256e-05, 'weight_decay': 5.496446859789657e-06, 'epochs': 284, 'loss': 'mse', 'optimizer': 'sgd', 'use_snp_selection': False, 'weight_scheme': 'linear', 'weight_clip_max': None, 'weight_linear_min_weight': 0.24682154527102826, 'weight_linear_max_weight': 1.8338910783134623}. Best is trial 2 with value: 0.1645186591391428.
[I 2026-04-21 18:31:07,460] Trial 25 finished with value: 0.06043808117451014 and parameters: {'hidden_dims': '[256, 64]', 'dropout': 0.3433334724206941, 'batch_norm': True, 'lr': 0.0001767124344265874, 'weight_decay': 0.0002412603413324814, 'epochs': 271, 'loss': 'mae', 'optimizer': 'adam', 'use_snp_selection': False, 'weight_scheme': 'top-heavy', 'weight_clip_max': None, 'weight_topheavy_top_frac': 0.07643570456356522, 'weight_topheavy_low': 0.7961398526574939, 'weight_topheavy_high': 1.4229198645515435}. Best is trial 18 with value: 0.08081023880245293.
[I 2026-04-21 18:31:14,041] Trial 4 finished with value: 0.1651862331323891 and parameters: {'hidden_dims': '[256, 64]', 'dropout': 0.18128694708490736, 'batch_norm': False, 'lr': 8.951826748007403e-05, 'weight_decay': 2.1781541495465197e-07, 'epochs': 147, 'loss': 'mse', 'optimizer': 'sgd', 'use_snp_selection': False, 'weight_scheme': 'top-heavy', 'weight_clip_max': 5.0, 'weight_topheavy_top_frac': 0.1724888194073277, 'weight_topheavy_low': 1.1620865802171172, 'weight_topheavy_high': 3.476906528073177}. Best is trial 4 with value: 0.1651862331323891.
[I 2026-04-21 18:31:25,568] Trial 5 finished with value: 0.16904367085248131 and parameters: {'hidden_dims': '[256, 64]', 'dropout': 0.2571412946970998, 'batch_norm': True, 'lr': 3.546238022482882e-05, 'weight_decay': 1.0185234767613396e-06, 'epochs': 119, 'loss': 'mse', 'optimizer': 'sgd', 'use_snp_selection': False, 'weight_scheme': 'linear', 'weight_clip_max': 10.0, 'weight_linear_min_weight': 0.9405832045183805, 'weight_linear_max_weight': 3.413610925325811}. Best is trial 5 with value: 0.16904367085248131.
[I 2026-04-21 18:31:44,789] Trial 26 finished with value: 0.06323327960394216 and parameters: {'hidden_dims': '[256, 64]', 'dropout': 0.00886858667548425, 'batch_norm': True, 'lr': 6.953719842783312e-05, 'weight_decay': 2.200749827215869e-06, 'epochs': 235, 'loss': 'mae', 'optimizer': 'adamw', 'use_snp_selection': True, 'num_snps': 56972, 'weight_scheme': 'exponential', 'weight_clip_max': None, 'weight_exponential_beta': 0.12882299615370307}. Best is trial 18 with value: 0.08081023880245293.
[I 2026-04-21 18:31:46,564] Trial 6 finished with value: 0.24180808721817446 and parameters: {'hidden_dims': '[256, 64]', 'dropout': 0.037961443806696214, 'batch_norm': True, 'lr': 3.644202049829694e-05, 'weight_decay': 9.73334309820277e-06, 'epochs': 243, 'loss': 'mae', 'optimizer': 'adam', 'use_snp_selection': False, 'weight_scheme': 'minmax', 'weight_clip_max': None, 'weight_minmax_eps': 0.08689611239934374}. Best is trial 6 with value: 0.24180808721817446.
[I 2026-04-21 18:32:12,704] Trial 27 finished with value: 0.061576870842276143 and parameters: {'hidden_dims': '[512, 128]', 'dropout': 0.12779284521238798, 'batch_norm': False, 'lr': 9.01732188189523e-06, 'weight_decay': 0.00010450717682068321, 'epochs': 202, 'loss': 'mae', 'optimizer': 'adam', 'use_snp_selection': False, 'weight_scheme': 'minmax', 'weight_clip_max': None, 'weight_minmax_eps': 0.13162286120961847}. Best is trial 18 with value: 0.08081023880245293.
[I 2026-04-21 18:32:25,202] Trial 28 finished with value: 0.06361850050893743 and parameters: {'hidden_dims': '[256, 128]', 'dropout': 0.3703119196261168, 'batch_norm': True, 'lr': 0.0005833323285176177, 'weight_decay': 0.0009590754043149578, 'epochs': 155, 'loss': 'mae', 'optimizer': 'adam', 'use_snp_selection': False, 'weight_scheme': 'minmax', 'weight_clip_max': 5.0, 'weight_minmax_eps': 0.15391630090372793}. Best is trial 18 with value: 0.08081023880245293.
[I 2026-04-21 18:32:31,844] Trial 7 finished with value: 0.11600835640273904 and parameters: {'hidden_dims': '[512, 128]', 'dropout': 0.1304538168539244, 'batch_norm': False, 'lr': 1.5408060926311233e-05, 'weight_decay': 2.1989735568314356e-08, 'epochs': 250, 'loss': 'mse', 'optimizer': 'sgd', 'use_snp_selection': True, 'num_snps': 42550, 'weight_scheme': 'exponential', 'weight_clip_max': 10.0, 'weight_exponential_beta': 2.758850226029358}. Best is trial 6 with value: 0.24180808721817446.
[I 2026-04-21 18:32:42,527] Trial 29 finished with value: 0.04366385355596027 and parameters: {'hidden_dims': '[256, 128]', 'dropout': 0.29376857284626545, 'batch_norm': True, 'lr': 1.2736425739650886e-05, 'weight_decay': 4.109799997011039e-06, 'epochs': 271, 'loss': 'mse', 'optimizer': 'adam', 'use_snp_selection': True, 'num_snps': 6909, 'weight_scheme': 'minmax', 'weight_clip_max': 10.0, 'weight_minmax_eps': 0.06491121899586952}. Best is trial 18 with value: 0.08081023880245293.
[I 2026-04-21 18:32:55,109] Trial 8 finished with value: 0.21523568626991094 and parameters: {'hidden_dims': '[256, 128]', 'dropout': 0.05742396906738376, 'batch_norm': False, 'lr': 1.9761509510575143e-06, 'weight_decay': 2.933492239224291e-07, 'epochs': 82, 'loss': 'mae', 'optimizer': 'adam', 'use_snp_selection': True, 'num_snps': 29883, 'weight_scheme': 'minmax', 'weight_clip_max': 5.0, 'weight_minmax_eps': 0.0051288771726799584}. Best is trial 6 with value: 0.24180808721817446.
[I 2026-04-21 18:32:57,181] Trial 30 finished with value: 0.03798533909381317 and parameters: {'hidden_dims': '[256, 64]', 'dropout': 0.16640477175216595, 'batch_norm': True, 'lr': 3.3945520568368334e-05, 'weight_decay': 1.0739221352118907e-05, 'epochs': 191, 'loss': 'mae', 'optimizer': 'adamw', 'use_snp_selection': False, 'weight_scheme': 'exponential', 'weight_clip_max': 5.0, 'weight_exponential_beta': 4.0772908292429015}. Best is trial 18 with value: 0.08081023880245293.
[I 2026-04-21 18:33:12,826] Trial 31 finished with value: 0.07723882314428682 and parameters: {'hidden_dims': '[256, 64]', 'dropout': 0.38865233110949665, 'batch_norm': True, 'lr': 1.1027532239596198e-05, 'weight_decay': 2.752542236296549e-05, 'epochs': 206, 'loss': 'mae', 'optimizer': 'adam', 'use_snp_selection': False, 'weight_scheme': 'exponential', 'weight_clip_max': None, 'weight_exponential_beta': 5.693696769083063}. Best is trial 18 with value: 0.08081023880245293.
[I 2026-04-21 18:33:25,228] Trial 9 finished with value: 0.23825728905932295 and parameters: {'hidden_dims': '[256, 128]', 'dropout': 0.5795930447285386, 'batch_norm': False, 'lr': 0.00011782025260263196, 'weight_decay': 0.0005562063174273634, 'epochs': 218, 'loss': 'mae', 'optimizer': 'adamw', 'use_snp_selection': True, 'num_snps': 32226, 'weight_scheme': 'minmax', 'weight_clip_max': 5.0, 'weight_minmax_eps': 0.09600289105543994}. Best is trial 6 with value: 0.24180808721817446.
[I 2026-04-21 18:33:26,223] Trial 32 finished with value: 0.06762076987600561 and parameters: {'hidden_dims': '[256, 64]', 'dropout': 0.493140234277056, 'batch_norm': True, 'lr': 7.862024075857788e-06, 'weight_decay': 2.8797922988713063e-05, 'epochs': 170, 'loss': 'mae', 'optimizer': 'adam', 'use_snp_selection': False, 'weight_scheme': 'exponential', 'weight_clip_max': None, 'weight_exponential_beta': 5.485139616222054}. Best is trial 18 with value: 0.08081023880245293.
[I 2026-04-21 18:33:42,772] Trial 33 finished with value: 0.07040075107392683 and parameters: {'hidden_dims': '[256, 64]', 'dropout': 0.41247464793690597, 'batch_norm': True, 'lr': 0.0001505515438975366, 'weight_decay': 7.19031388156677e-06, 'epochs': 219, 'loss': 'mae', 'optimizer': 'adam', 'use_snp_selection': False, 'weight_scheme': 'exponential', 'weight_clip_max': None, 'weight_exponential_beta': 6.046577024576135}. Best is trial 18 with value: 0.08081023880245293.
[I 2026-04-21 18:33:58,831] Trial 34 finished with value: 0.08023964100645092 and parameters: {'hidden_dims': '[256, 64]', 'dropout': 0.4032085546610367, 'batch_norm': True, 'lr': 0.00012253565115327434, 'weight_decay': 7.367189562296079e-06, 'epochs': 211, 'loss': 'mse', 'optimizer': 'adam', 'use_snp_selection': False, 'weight_scheme': 'exponential', 'weight_clip_max': None, 'weight_exponential_beta': 6.0010973302143205}. Best is trial 18 with value: 0.08081023880245293.
[I 2026-04-21 18:34:10,894] Trial 10 finished with value: 0.24604219400775784 and parameters: {'hidden_dims': '[512, 64]', 'dropout': 0.4338375928678635, 'batch_norm': True, 'lr': 0.0009667920285641304, 'weight_decay': 6.976468597792388e-05, 'epochs': 294, 'loss': 'mae', 'optimizer': 'adam', 'use_snp_selection': False, 'weight_scheme': 'uniform', 'weight_clip_max': None}. Best is trial 10 with value: 0.24604219400775784.
[I 2026-04-21 18:34:14,009] Trial 35 finished with value: 0.047851223803438536 and parameters: {'hidden_dims': '[256, 64]', 'dropout': 0.37782479364596044, 'batch_norm': True, 'lr': 5.6768794723489974e-05, 'weight_decay': 3.13887132752336e-06, 'epochs': 197, 'loss': 'mse', 'optimizer': 'adam', 'use_snp_selection': False, 'weight_scheme': 'exponential', 'weight_clip_max': None, 'weight_exponential_beta': 6.31811372980013}. Best is trial 18 with value: 0.08081023880245293.
[I 2026-04-21 18:34:26,159] Trial 36 finished with value: 0.0396360009386411 and parameters: {'hidden_dims': '[256, 64]', 'dropout': 0.32478529656152394, 'batch_norm': False, 'lr': 9.904542540064328e-05, 'weight_decay': 4.82558563630331e-07, 'epochs': 155, 'loss': 'mse', 'optimizer': 'sgd', 'use_snp_selection': False, 'weight_scheme': 'exponential', 'weight_clip_max': None, 'weight_exponential_beta': 2.7910185904828135}. Best is trial 18 with value: 0.08081023880245293.
[I 2026-04-21 18:34:56,421] Trial 11 finished with value: 0.24130097622951044 and parameters: {'hidden_dims': '[512, 64]', 'dropout': 0.4516805843717058, 'batch_norm': True, 'lr': 0.0009928478748470076, 'weight_decay': 5.547084226283487e-05, 'epochs': 290, 'loss': 'mae', 'optimizer': 'adam', 'use_snp_selection': False, 'weight_scheme': 'uniform', 'weight_clip_max': None}. Best is trial 10 with value: 0.24604219400775784.
[I 2026-04-21 18:35:04,579] Trial 37 finished with value: 0.08510363909504653 and parameters: {'hidden_dims': '[256, 64]', 'dropout': 0.4927025025110747, 'batch_norm': True, 'lr': 2.799162981415276e-05, 'weight_decay': 3.57240466438078e-05, 'epochs': 238, 'loss': 'mse', 'optimizer': 'adam', 'use_snp_selection': True, 'num_snps': 59890, 'weight_scheme': 'linear', 'weight_clip_max': 10.0, 'weight_linear_min_weight': 0.9700387320809922, 'weight_linear_max_weight': 3.8035851670655516}. Best is trial 37 with value: 0.08510363909504653.
[I 2026-04-21 18:35:35,048] Trial 12 finished with value: 0.2486800722366711 and parameters: {'hidden_dims': '[512, 64]', 'dropout': 0.4134640118922238, 'batch_norm': True, 'lr': 0.0008477822420198197, 'weight_decay': 5.229627468514555e-05, 'epochs': 241, 'loss': 'mae', 'optimizer': 'adam', 'use_snp_selection': False, 'weight_scheme': 'uniform', 'weight_clip_max': None}. Best is trial 12 with value: 0.2486800722366711.
[I 2026-04-21 18:35:43,912] Trial 38 finished with value: 0.013692706792098337 and parameters: {'hidden_dims': '[256, 64]', 'dropout': 0.48090834073684396, 'batch_norm': False, 'lr': 2.299535227738984e-05, 'weight_decay': 7.65003954665833e-06, 'epochs': 274, 'loss': 'mse', 'optimizer': 'sgd', 'use_snp_selection': True, 'num_snps': 57676, 'weight_scheme': 'linear', 'weight_clip_max': 10.0, 'weight_linear_min_weight': 0.9882521686106566, 'weight_linear_max_weight': 3.9439447894500463}. Best is trial 37 with value: 0.08510363909504653.
[I 2026-04-21 18:36:16,495] Trial 39 finished with value: 0.058802181501136475 and parameters: {'hidden_dims': '[256, 64]', 'dropout': 0.5333603982572173, 'batch_norm': True, 'lr': 3.481874307803659e-05, 'weight_decay': 1.0527052439695493e-07, 'epochs': 243, 'loss': 'mse', 'optimizer': 'adam', 'use_snp_selection': True, 'num_snps': 44761, 'weight_scheme': 'linear', 'weight_clip_max': 10.0, 'weight_linear_min_weight': 0.6536562100559138, 'weight_linear_max_weight': 2.8877423964529036}. Best is trial 37 with value: 0.08510363909504653.
[I 2026-04-21 18:36:22,185] Trial 13 finished with value: 0.24274190255345066 and parameters: {'hidden_dims': '[512, 64]', 'dropout': 0.419375005493241, 'batch_norm': True, 'lr': 0.0009640000854205, 'weight_decay': 0.0005469422623397416, 'epochs': 299, 'loss': 'mae', 'optimizer': 'adam', 'use_snp_selection': False, 'weight_scheme': 'uniform', 'weight_clip_max': None}. Best is trial 12 with value: 0.2486800722366711.
[I 2026-04-21 18:36:57,069] Trial 14 finished with value: 0.24258938683079645 and parameters: {'hidden_dims': '[512, 64]', 'dropout': 0.4328311199460203, 'batch_norm': True, 'lr': 0.0003803384436947449, 'weight_decay': 5.387606063804954e-05, 'epochs': 214, 'loss': 'mae', 'optimizer': 'adam', 'use_snp_selection': False, 'weight_scheme': 'uniform', 'weight_clip_max': None}. Best is trial 12 with value: 0.2486800722366711.
[I 2026-04-21 18:37:13,687] Trial 0 finished with value: -0.007726207079852751 and parameters: {'hidden_dims': '[256, 128]', 'dropout': 0.18584155530312246, 'batch_norm': True, 'lr': 9.012665953349533e-06, 'weight_decay': 4.96591963698479e-06, 'epochs': 105, 'loss': 'mse', 'optimizer': 'sgd', 'use_snp_selection': True, 'num_snps': 25583, 'weight_scheme': 'minmax', 'weight_clip_max': 5.0, 'weight_minmax_eps': 0.14026014881292506}. Best is trial 0 with value: -0.007726207079852751.
[I 2026-04-21 18:37:27,776] Trial 1 finished with value: 0.08443386168209444 and parameters: {'hidden_dims': '[256, 64]', 'dropout': 0.05000949662985405, 'batch_norm': True, 'lr': 0.00015647443054904835, 'weight_decay': 5.158896024962846e-05, 'epochs': 152, 'loss': 'mse', 'optimizer': 'sgd', 'use_snp_selection': False, 'weight_scheme': 'linear', 'weight_clip_max': None, 'weight_linear_min_weight': 0.21922985165550554, 'weight_linear_max_weight': 1.6260435767424388}. Best is trial 1 with value: 0.08443386168209444.
[I 2026-04-21 18:37:38,168] Trial 15 finished with value: 0.2452032556521951 and parameters: {'hidden_dims': '[512, 64]', 'dropout': 0.5434926816097962, 'batch_norm': True, 'lr': 0.0003583493834580348, 'weight_decay': 0.00019157092286075067, 'epochs': 257, 'loss': 'mae', 'optimizer': 'adamw', 'use_snp_selection': False, 'weight_scheme': 'uniform', 'weight_clip_max': None}. Best is trial 12 with value: 0.2486800722366711.
[I 2026-04-21 18:37:52,090] Trial 2 finished with value: 0.15943527835139917 and parameters: {'hidden_dims': '[512, 128]', 'dropout': 0.2736730891340176, 'batch_norm': True, 'lr': 7.298114623433994e-05, 'weight_decay': 5.6346010385734023e-08, 'epochs': 185, 'loss': 'mae', 'optimizer': 'sgd', 'use_snp_selection': True, 'num_snps': 14091, 'weight_scheme': 'minmax', 'weight_clip_max': 10.0, 'weight_minmax_eps': 0.045780660776687306}. Best is trial 2 with value: 0.15943527835139917.
[I 2026-04-21 18:38:11,010] Trial 16 finished with value: 0.2503929208347688 and parameters: {'hidden_dims': '[512, 64]', 'dropout': 0.36868497888545293, 'batch_norm': True, 'lr': 0.000339252165584619, 'weight_decay': 2.117992428155871e-05, 'epochs': 205, 'loss': 'mae', 'optimizer': 'adam', 'use_snp_selection': False, 'weight_scheme': 'uniform', 'weight_clip_max': None}. Best is trial 16 with value: 0.2503929208347688.
[I 2026-04-21 18:38:35,264] Trial 3 finished with value: 0.06253131041694221 and parameters: {'hidden_dims': '[512, 64]', 'dropout': 0.30157795416637295, 'batch_norm': False, 'lr': 2.007492282795256e-05, 'weight_decay': 5.496446859789657e-06, 'epochs': 284, 'loss': 'mse', 'optimizer': 'sgd', 'use_snp_selection': False, 'weight_scheme': 'linear', 'weight_clip_max': None, 'weight_linear_min_weight': 0.24682154527102826, 'weight_linear_max_weight': 1.8338910783134623}. Best is trial 2 with value: 0.15943527835139917.
[I 2026-04-21 18:38:42,160] Trial 17 finished with value: 0.2443705738590699 and parameters: {'hidden_dims': '[512, 64]', 'dropout': 0.3539640968174703, 'batch_norm': True, 'lr': 0.0003030038533621209, 'weight_decay': 1.138257270713031e-05, 'epochs': 193, 'loss': 'mae', 'optimizer': 'adam', 'use_snp_selection': False, 'weight_scheme': 'top-heavy', 'weight_clip_max': None, 'weight_topheavy_top_frac': 0.4797339435528436, 'weight_topheavy_low': 0.5377307466599707, 'weight_topheavy_high': 5.889503437003148}. Best is trial 16 with value: 0.2503929208347688.
