Running from this directory: /cluster/work/simennes/Master_thesis
Name of job: ncv_ridge_iw
ID of job: 24337359
Array task ID: 11
The job was run on these nodes: idun-03-02
[I 2026-04-24 13:08:18,654] Trial 0 finished with value: 0.14224147903350676 and parameters: {'alpha': 12124.394605078569, 'use_snp_selection': True, 'num_snps': 5442, 'iw_method': 'pc_logistic', 'iw_clip_max': 20.0, 'iw_prob_clip': 0.010995744247886997, 'iw_n_components': 10, 'iw_logistic_c': 0.32697423511716517, 'iw_pca_fit': 'source', 'iw_solver': 'lbfgs', 'iw_rho': 0.75}. Best is trial 0 with value: 0.14224147903350676.
[I 2026-04-24 13:11:43,354] Trial 1 finished with value: 0.1790042368259455 and parameters: {'alpha': 161030.4172882474, 'use_snp_selection': False, 'iw_method': 'pc_logistic', 'iw_clip_max': 3.0, 'iw_prob_clip': 0.01279044980782762, 'iw_n_components': 1, 'iw_logistic_c': 2.0403812501143454e-05, 'iw_pca_fit': 'source', 'iw_solver': 'lbfgs', 'iw_rho': 0.75}. Best is trial 1 with value: 0.1790042368259455.
[I 2026-04-24 13:14:04,464] Trial 2 finished with value: 0.1258890321373752 and parameters: {'alpha': 188.160412035082, 'use_snp_selection': True, 'num_snps': 59763, 'iw_method': 'uniform', 'iw_clip_max': 5.0, 'iw_prob_clip': 0.0070654957343389896}. Best is trial 1 with value: 0.1790042368259455.
[I 2026-04-24 13:18:15,186] Trial 3 finished with value: 0.1530348874333498 and parameters: {'alpha': 16968.649375900754, 'use_snp_selection': True, 'num_snps': 29760, 'iw_method': 'pc_logistic', 'iw_clip_max': 20.0, 'iw_prob_clip': 0.0217559440148749, 'iw_n_components': 10, 'iw_logistic_c': 1.6382429914774194e-05, 'iw_pca_fit': 'combined', 'iw_solver': 'lbfgs', 'iw_rho': 0.1}. Best is trial 1 with value: 0.1790042368259455.
[I 2026-04-24 13:22:41,209] Trial 4 finished with value: 0.15368971651533447 and parameters: {'alpha': 19413.258622327583, 'use_snp_selection': True, 'num_snps': 41428, 'iw_method': 'pc_logistic', 'iw_clip_max': 20.0, 'iw_prob_clip': 0.008628235125022405, 'iw_n_components': 3, 'iw_logistic_c': 0.0004653526127488538, 'iw_pca_fit': 'source', 'iw_solver': 'lbfgs', 'iw_rho': 0.25}. Best is trial 1 with value: 0.1790042368259455.
[I 2026-04-24 13:24:54,177] Trial 5 finished with value: 0.17209884975020534 and parameters: {'alpha': 80135.2021263408, 'use_snp_selection': True, 'num_snps': 54789, 'iw_method': 'uniform', 'iw_clip_max': 3.0, 'iw_prob_clip': 0.012917216126205406}. Best is trial 1 with value: 0.1790042368259455.
[I 2026-04-24 13:26:28,256] Trial 6 finished with value: 0.1728772789505569 and parameters: {'alpha': 340178.6469095632, 'use_snp_selection': True, 'num_snps': 25889, 'iw_method': 'uniform', 'iw_clip_max': 3.0, 'iw_prob_clip': 0.020875611672958067}. Best is trial 1 with value: 0.1790042368259455.
[I 2026-04-24 13:27:48,660] Trial 7 finished with value: 0.16614389629996384 and parameters: {'alpha': 1242108.5193641477, 'use_snp_selection': True, 'num_snps': 15763, 'iw_method': 'uniform', 'iw_clip_max': 3.0, 'iw_prob_clip': 0.027212938580450624}. Best is trial 1 with value: 0.1790042368259455.
[I 2026-04-24 13:28:34,641] Trial 8 finished with value: 0.12619435521031985 and parameters: {'alpha': 576.4183768413645, 'use_snp_selection': False, 'iw_method': 'uniform', 'iw_clip_max': 2.0, 'iw_prob_clip': 0.0429488305231488}. Best is trial 1 with value: 0.1790042368259455.
[I 2026-04-24 13:30:03,278] Trial 9 finished with value: 0.16876451626171035 and parameters: {'alpha': 671771.9265477946, 'use_snp_selection': True, 'num_snps': 19046, 'iw_method': 'uniform', 'iw_clip_max': 20.0, 'iw_prob_clip': 0.016752592804942974}. Best is trial 1 with value: 0.1790042368259455.
[I 2026-04-24 13:33:23,733] Trial 10 finished with value: 0.1622870471021904 and parameters: {'alpha': 9837161.102143044, 'use_snp_selection': False, 'iw_method': 'pc_logistic', 'iw_clip_max': 10.0, 'iw_prob_clip': 0.006412966308601717, 'iw_n_components': 1, 'iw_logistic_c': 0.007218341230724956, 'iw_pca_fit': 'source', 'iw_solver': 'lbfgs', 'iw_rho': 0.75}. Best is trial 1 with value: 0.1790042368259455.
[I 2026-04-24 13:37:09,034] Trial 11 finished with value: 0.17958917600334073 and parameters: {'alpha': 319455.00215845375, 'use_snp_selection': False, 'iw_method': 'pc_logistic', 'iw_clip_max': 3.0, 'iw_prob_clip': 0.02786576308643991, 'iw_n_components': 1, 'iw_logistic_c': 1.399713636282935e-05, 'iw_pca_fit': 'combined', 'iw_solver': 'lbfgs', 'iw_rho': 1.0}. Best is trial 11 with value: 0.17958917600334073.
[I 2026-04-24 13:40:55,642] Trial 12 finished with value: 0.1322563790443948 and parameters: {'alpha': 1917.5398603560736, 'use_snp_selection': False, 'iw_method': 'pc_logistic', 'iw_clip_max': 3.0, 'iw_prob_clip': 0.03690470911463918, 'iw_n_components': 1, 'iw_logistic_c': 1.4405825011316045e-05, 'iw_pca_fit': 'combined', 'iw_solver': 'lbfgs', 'iw_rho': 1.0}. Best is trial 11 with value: 0.17958917600334073.
[I 2026-04-24 13:44:33,596] Trial 13 finished with value: 0.12360447915041126 and parameters: {'alpha': 14.10762195162507, 'use_snp_selection': False, 'iw_method': 'pc_logistic', 'iw_clip_max': 3.0, 'iw_prob_clip': 0.033129794978272405, 'iw_n_components': 1, 'iw_logistic_c': 0.00020825293604129918, 'iw_pca_fit': 'combined', 'iw_solver': 'lbfgs', 'iw_rho': 0.5}. Best is trial 11 with value: 0.17958917600334073.
[I 2026-04-24 13:48:25,180] Trial 14 finished with value: 0.14685665856491603 and parameters: {'alpha': 7516314.333182465, 'use_snp_selection': False, 'iw_method': 'pc_logistic', 'iw_clip_max': 10.0, 'iw_prob_clip': 0.014083297501754058, 'iw_n_components': 5, 'iw_logistic_c': 0.0003955104018201011, 'iw_pca_fit': 'combined', 'iw_solver': 'lbfgs', 'iw_rho': 0.75}. Best is trial 11 with value: 0.17958917600334073.
[I 2026-04-24 13:52:31,656] Trial 15 finished with value: 0.17039013821274596 and parameters: {'alpha': 118862.23776255993, 'use_snp_selection': False, 'iw_method': 'pc_logistic', 'iw_clip_max': 2.0, 'iw_prob_clip': 0.02076849192183654, 'iw_n_components': 20, 'iw_logistic_c': 4.9377880086220145, 'iw_pca_fit': 'source', 'iw_solver': 'lbfgs', 'iw_rho': 1.0}. Best is trial 11 with value: 0.17958917600334073.
[I 2026-04-24 13:55:59,574] Trial 16 finished with value: 0.1717613877776407 and parameters: {'alpha': 1697092.6575438946, 'use_snp_selection': False, 'iw_method': 'pc_logistic', 'iw_clip_max': 5.0, 'iw_prob_clip': 0.009584285341458675, 'iw_n_components': 2, 'iw_logistic_c': 1.058664801935072e-05, 'iw_pca_fit': 'source', 'iw_solver': 'lbfgs', 'iw_rho': 1.0}. Best is trial 11 with value: 0.17958917600334073.
[I 2026-04-24 13:59:41,805] Trial 17 finished with value: 0.17128731462884458 and parameters: {'alpha': 79420.60461919021, 'use_snp_selection': False, 'iw_method': 'pc_logistic', 'iw_clip_max': 3.0, 'iw_prob_clip': 0.02831296042797304, 'iw_n_components': 1, 'iw_logistic_c': 0.005166654903338709, 'iw_pca_fit': 'combined', 'iw_solver': 'lbfgs', 'iw_rho': 0.25}. Best is trial 11 with value: 0.17958917600334073.
[I 2026-04-24 14:03:20,809] Trial 18 finished with value: 0.13542944471155613 and parameters: {'alpha': 3551.6116296842347, 'use_snp_selection': False, 'iw_method': 'pc_logistic', 'iw_clip_max': 3.0, 'iw_prob_clip': 0.04953687907162852, 'iw_n_components': 1, 'iw_logistic_c': 0.00010890955786338982, 'iw_pca_fit': 'combined', 'iw_solver': 'lbfgs', 'iw_rho': 0.1}. Best is trial 11 with value: 0.17958917600334073.
[I 2026-04-24 14:06:51,959] Trial 19 finished with value: 0.17569374066274873 and parameters: {'alpha': 190335.8786938149, 'use_snp_selection': False, 'iw_method': 'pc_logistic', 'iw_clip_max': 3.0, 'iw_prob_clip': 0.01729408482142867, 'iw_n_components': 2, 'iw_logistic_c': 0.08532133167237173, 'iw_pca_fit': 'source', 'iw_solver': 'lbfgs', 'iw_rho': 0.5}. Best is trial 11 with value: 0.17958917600334073.
[I 2026-04-24 14:11:19,211] Trial 20 finished with value: 0.17473432023255425 and parameters: {'alpha': 1902670.0495711463, 'use_snp_selection': False, 'iw_method': 'pc_logistic', 'iw_clip_max': 5.0, 'iw_prob_clip': 0.005377377890134129, 'iw_n_components': 20, 'iw_logistic_c': 0.0014838224275716776, 'iw_pca_fit': 'combined', 'iw_solver': 'lbfgs', 'iw_rho': 0.75}. Best is trial 11 with value: 0.17958917600334073.
[I 2026-04-24 14:14:49,921] Trial 21 finished with value: 0.1754092360441126 and parameters: {'alpha': 175976.627862065, 'use_snp_selection': False, 'iw_method': 'pc_logistic', 'iw_clip_max': 3.0, 'iw_prob_clip': 0.017279855082124925, 'iw_n_components': 2, 'iw_logistic_c': 0.11263542735858433, 'iw_pca_fit': 'source', 'iw_solver': 'lbfgs', 'iw_rho': 0.5}. Best is trial 11 with value: 0.17958917600334073.
[I 2026-04-24 14:18:21,602] Trial 22 finished with value: 0.1665040710019232 and parameters: {'alpha': 55131.82632157628, 'use_snp_selection': False, 'iw_method': 'pc_logistic', 'iw_clip_max': 3.0, 'iw_prob_clip': 0.012025697904655644, 'iw_n_components': 2, 'iw_logistic_c': 0.06613041831204265, 'iw_pca_fit': 'source', 'iw_solver': 'lbfgs', 'iw_rho': 0.5}. Best is trial 11 with value: 0.17958917600334073.
[I 2026-04-24 14:21:54,320] Trial 23 finished with value: 0.17660574518137176 and parameters: {'alpha': 443132.7715188224, 'use_snp_selection': False, 'iw_method': 'pc_logistic', 'iw_clip_max': 3.0, 'iw_prob_clip': 0.025855547916108626, 'iw_n_components': 5, 'iw_logistic_c': 6.154645812741312e-05, 'iw_pca_fit': 'source', 'iw_solver': 'lbfgs', 'iw_rho': 0.5}. Best is trial 11 with value: 0.17958917600334073.
[I 2026-04-24 14:25:32,902] Trial 24 finished with value: 0.17281243486453154 and parameters: {'alpha': 526932.9002717355, 'use_snp_selection': False, 'iw_method': 'pc_logistic', 'iw_clip_max': 10.0, 'iw_prob_clip': 0.025402500602483325, 'iw_n_components': 5, 'iw_logistic_c': 5.628056890152239e-05, 'iw_pca_fit': 'source', 'iw_solver': 'lbfgs', 'iw_rho': 1.0}. Best is trial 11 with value: 0.17958917600334073.
[I 2026-04-24 14:29:05,251] Trial 25 finished with value: 0.16915962588016364 and parameters: {'alpha': 3201027.732131037, 'use_snp_selection': False, 'iw_method': 'pc_logistic', 'iw_clip_max': 3.0, 'iw_prob_clip': 0.034785146160691026, 'iw_n_components': 5, 'iw_logistic_c': 5.9004967287894815e-05, 'iw_pca_fit': 'source', 'iw_solver': 'lbfgs', 'iw_rho': 0.5}. Best is trial 11 with value: 0.17958917600334073.
[I 2026-04-24 14:32:34,694] Trial 26 finished with value: 0.16323766614275437 and parameters: {'alpha': 31884.838406127205, 'use_snp_selection': False, 'iw_method': 'pc_logistic', 'iw_clip_max': 2.0, 'iw_prob_clip': 0.022434130042728307, 'iw_n_components': 3, 'iw_logistic_c': 3.779548376977112e-05, 'iw_pca_fit': 'source', 'iw_solver': 'lbfgs', 'iw_rho': 0.75}. Best is trial 11 with value: 0.17958917600334073.
[I 2026-04-24 14:36:30,300] Trial 27 finished with value: 0.13903185493470843 and parameters: {'alpha': 3477.4756607373224, 'use_snp_selection': False, 'iw_method': 'pc_logistic', 'iw_clip_max': 3.0, 'iw_prob_clip': 0.014925457660845111, 'iw_n_components': 5, 'iw_logistic_c': 0.0012156247080991034, 'iw_pca_fit': 'combined', 'iw_solver': 'lbfgs', 'iw_rho': 1.0}. Best is trial 11 with value: 0.17958917600334073.
[I 2026-04-24 14:40:00,019] Trial 28 finished with value: 0.17719215713964884 and parameters: {'alpha': 342979.4728150409, 'use_snp_selection': False, 'iw_method': 'pc_logistic', 'iw_clip_max': 3.0, 'iw_prob_clip': 0.03192098498930157, 'iw_n_components': 1, 'iw_logistic_c': 0.00012311175047487617, 'iw_pca_fit': 'source', 'iw_solver': 'lbfgs', 'iw_rho': 0.25}. Best is trial 11 with value: 0.17958917600334073.
[I 2026-04-24 14:43:39,554] Trial 29 finished with value: 0.16324254224049736 and parameters: {'alpha': 37374.529025571996, 'use_snp_selection': False, 'iw_method': 'pc_logistic', 'iw_clip_max': 3.0, 'iw_prob_clip': 0.010053197171650697, 'iw_n_components': 1, 'iw_logistic_c': 0.0011363380156321835, 'iw_pca_fit': 'combined', 'iw_solver': 'lbfgs', 'iw_rho': 0.25}. Best is trial 11 with value: 0.17958917600334073.
[I 2026-04-24 14:47:02,268] Trial 30 finished with value: 0.16852000388691796 and parameters: {'alpha': 3732766.4978110385, 'use_snp_selection': False, 'iw_method': 'pc_logistic', 'iw_clip_max': 5.0, 'iw_prob_clip': 0.04166357385158367, 'iw_n_components': 1, 'iw_logistic_c': 0.00022738336224842166, 'iw_pca_fit': 'source', 'iw_solver': 'lbfgs', 'iw_rho': 0.25}. Best is trial 11 with value: 0.17958917600334073.
[I 2026-04-24 14:50:25,887] Trial 31 finished with value: 0.17741254962593905 and parameters: {'alpha': 363164.534613233, 'use_snp_selection': False, 'iw_method': 'pc_logistic', 'iw_clip_max': 3.0, 'iw_prob_clip': 0.030077105366364387, 'iw_n_components': 1, 'iw_logistic_c': 3.106237868362478e-05, 'iw_pca_fit': 'source', 'iw_solver': 'lbfgs', 'iw_rho': 0.25}. Best is trial 11 with value: 0.17958917600334073.
[I 2026-04-24 14:53:50,393] Trial 32 finished with value: 0.17780315087490772 and parameters: {'alpha': 278123.91328291374, 'use_snp_selection': False, 'iw_method': 'pc_logistic', 'iw_clip_max': 3.0, 'iw_prob_clip': 0.030291282544829014, 'iw_n_components': 1, 'iw_logistic_c': 1.0151549985978633e-05, 'iw_pca_fit': 'source', 'iw_solver': 'lbfgs', 'iw_rho': 0.25}. Best is trial 11 with value: 0.17958917600334073.
[I 2026-04-24 14:57:16,369] Trial 33 finished with value: 0.14712691926277366 and parameters: {'alpha': 10677.451900885915, 'use_snp_selection': False, 'iw_method': 'pc_logistic', 'iw_clip_max': 3.0, 'iw_prob_clip': 0.031098203436090682, 'iw_n_components': 1, 'iw_logistic_c': 3.0551142743616304e-05, 'iw_pca_fit': 'source', 'iw_solver': 'lbfgs', 'iw_rho': 0.25}. Best is trial 11 with value: 0.17958917600334073.
[I 2026-04-24 15:00:39,535] Trial 34 finished with value: 0.17429958363448664 and parameters: {'alpha': 938395.1351419394, 'use_snp_selection': False, 'iw_method': 'pc_logistic', 'iw_clip_max': 20.0, 'iw_prob_clip': 0.018935909389384897, 'iw_n_components': 1, 'iw_logistic_c': 2.0671199924338663e-05, 'iw_pca_fit': 'source', 'iw_solver': 'lbfgs', 'iw_rho': 0.25}. Best is trial 11 with value: 0.17958917600334073.
[I 2026-04-24 15:02:44,934] Trial 35 finished with value: 0.17784197474592073 and parameters: {'alpha': 239170.7315227191, 'use_snp_selection': True, 'num_snps': 42891, 'iw_method': 'uniform', 'iw_clip_max': 3.0, 'iw_prob_clip': 0.02338882201017436}. Best is trial 11 with value: 0.17958917600334073.
[I 2026-04-24 15:04:50,202] Trial 36 finished with value: 0.17821561290117963 and parameters: {'alpha': 169315.7419409873, 'use_snp_selection': True, 'num_snps': 43241, 'iw_method': 'uniform', 'iw_clip_max': 20.0, 'iw_prob_clip': 0.02372090391952588}. Best is trial 11 with value: 0.17958917600334073.
[I 2026-04-24 15:06:54,925] Trial 37 finished with value: 0.15854626761032986 and parameters: {'alpha': 17759.96970636894, 'use_snp_selection': True, 'num_snps': 44776, 'iw_method': 'uniform', 'iw_clip_max': 20.0, 'iw_prob_clip': 0.02410917463677751}. Best is trial 11 with value: 0.17958917600334073.
[I 2026-04-24 15:08:59,084] Trial 38 finished with value: 0.1761404554017407 and parameters: {'alpha': 125242.04236639926, 'use_snp_selection': True, 'num_snps': 41532, 'iw_method': 'uniform', 'iw_clip_max': 20.0, 'iw_prob_clip': 0.0199858043985233}. Best is trial 11 with value: 0.17958917600334073.
[I 2026-04-24 15:11:13,596] Trial 39 finished with value: 0.14412831136597598 and parameters: {'alpha': 6483.292145176681, 'use_snp_selection': True, 'num_snps': 48672, 'iw_method': 'uniform', 'iw_clip_max': 20.0, 'iw_prob_clip': 0.012771624798993585}. Best is trial 11 with value: 0.17958917600334073.
[I 2026-04-24 15:13:11,093] Trial 40 finished with value: 0.16864599902792266 and parameters: {'alpha': 44201.29385132884, 'use_snp_selection': True, 'num_snps': 34767, 'iw_method': 'uniform', 'iw_clip_max': 20.0, 'iw_prob_clip': 0.007789976981870804}. Best is trial 11 with value: 0.17958917600334073.
[I 2026-04-24 15:15:08,379] Trial 41 finished with value: 0.17620574852820262 and parameters: {'alpha': 152312.89437394505, 'use_snp_selection': True, 'num_snps': 35314, 'iw_method': 'uniform', 'iw_clip_max': 3.0, 'iw_prob_clip': 0.03965048605330385}. Best is trial 11 with value: 0.17958917600334073.
[I 2026-04-24 15:17:26,588] Trial 42 finished with value: 0.17364834182184716 and parameters: {'alpha': 956649.1090980046, 'use_snp_selection': True, 'num_snps': 51517, 'iw_method': 'uniform', 'iw_clip_max': 2.0, 'iw_prob_clip': 0.023463445619088717}. Best is trial 11 with value: 0.17958917600334073.
[I 2026-04-24 15:19:28,291] Trial 43 finished with value: 0.17541781213229365 and parameters: {'alpha': 272322.46669148013, 'use_snp_selection': True, 'num_snps': 39301, 'iw_method': 'uniform', 'iw_clip_max': 10.0, 'iw_prob_clip': 0.02882428655017195}. Best is trial 11 with value: 0.17958917600334073.
[I 2026-04-24 15:21:40,590] Trial 44 finished with value: 0.11637126358082026 and parameters: {'alpha': 108.52037126147249, 'use_snp_selection': True, 'num_snps': 47779, 'iw_method': 'uniform', 'iw_clip_max': 20.0, 'iw_prob_clip': 0.01916483814914947}. Best is trial 11 with value: 0.17958917600334073.
[I 2026-04-24 15:23:27,675] Trial 45 finished with value: 0.17125243496607243 and parameters: {'alpha': 77979.14583981436, 'use_snp_selection': True, 'num_snps': 29043, 'iw_method': 'uniform', 'iw_clip_max': 3.0, 'iw_prob_clip': 0.03652009162412936}. Best is trial 11 with value: 0.17958917600334073.
[I 2026-04-24 15:25:54,240] Trial 46 finished with value: 0.15938798181753827 and parameters: {'alpha': 26072.196053958127, 'use_snp_selection': True, 'num_snps': 58096, 'iw_method': 'uniform', 'iw_clip_max': 3.0, 'iw_prob_clip': 0.015653874461548704}. Best is trial 11 with value: 0.17958917600334073.
[I 2026-04-24 15:27:30,008] Trial 47 finished with value: 0.16972805449962206 and parameters: {'alpha': 689986.2607763885, 'use_snp_selection': True, 'num_snps': 21199, 'iw_method': 'uniform', 'iw_clip_max': 5.0, 'iw_prob_clip': 0.026513112008023688}. Best is trial 11 with value: 0.17958917600334073.
[I 2026-04-24 15:29:28,167] Trial 48 finished with value: 0.16751762429690395 and parameters: {'alpha': 3969320.901788672, 'use_snp_selection': True, 'num_snps': 36779, 'iw_method': 'uniform', 'iw_clip_max': 3.0, 'iw_prob_clip': 0.02190290157541016}. Best is trial 11 with value: 0.17958917600334073.
[I 2026-04-24 15:31:37,933] Trial 49 finished with value: 0.17101342210553716 and parameters: {'alpha': 1639316.3979069823, 'use_snp_selection': True, 'num_snps': 45252, 'iw_method': 'uniform', 'iw_clip_max': 2.0, 'iw_prob_clip': 0.04680985597624336}. Best is trial 11 with value: 0.17958917600334073.
[I 2026-04-24 15:33:58,330] Trial 50 finished with value: 0.17372379663433657 and parameters: {'alpha': 85714.99428839849, 'use_snp_selection': True, 'num_snps': 53190, 'iw_method': 'uniform', 'iw_clip_max': 10.0, 'iw_prob_clip': 0.013146362944815554}. Best is trial 11 with value: 0.17958917600334073.
[I 2026-04-24 15:37:21,051] Trial 51 finished with value: 0.1776550520041444 and parameters: {'alpha': 235448.2460145344, 'use_snp_selection': False, 'iw_method': 'pc_logistic', 'iw_clip_max': 3.0, 'iw_prob_clip': 0.02981374093964177, 'iw_n_components': 1, 'iw_logistic_c': 1.2392445364439581e-05, 'iw_pca_fit': 'source', 'iw_solver': 'lbfgs', 'iw_rho': 0.25}. Best is trial 11 with value: 0.17958917600334073.
[I 2026-04-24 15:41:27,181] Trial 52 finished with value: 0.17452449514293236 and parameters: {'alpha': 194628.84170720918, 'use_snp_selection': False, 'iw_method': 'pc_logistic', 'iw_clip_max': 3.0, 'iw_prob_clip': 0.03396442349718605, 'iw_n_components': 10, 'iw_logistic_c': 1.9905742191534024, 'iw_pca_fit': 'source', 'iw_solver': 'lbfgs', 'iw_rho': 0.75}. Best is trial 11 with value: 0.17958917600334073.
[I 2026-04-24 15:44:50,471] Trial 53 finished with value: 0.17701646755018288 and parameters: {'alpha': 239619.24029777088, 'use_snp_selection': False, 'iw_method': 'pc_logistic', 'iw_clip_max': 3.0, 'iw_prob_clip': 0.02804578752456973, 'iw_n_components': 1, 'iw_logistic_c': 1.3093293450059743e-05, 'iw_pca_fit': 'source', 'iw_solver': 'lbfgs', 'iw_rho': 0.1}. Best is trial 11 with value: 0.17958917600334073.
[I 2026-04-24 15:49:04,484] Trial 54 finished with value: 0.18374613567752085 and parameters: {'alpha': 641415.7345434496, 'use_snp_selection': False, 'iw_method': 'pc_logistic', 'iw_clip_max': 3.0, 'iw_prob_clip': 0.01064741764793975, 'iw_n_components': 10, 'iw_logistic_c': 1.0135674007288269e-05, 'iw_pca_fit': 'combined', 'iw_solver': 'lbfgs', 'iw_rho': 1.0}. Best is trial 54 with value: 0.18374613567752085.
[I 2026-04-24 15:53:22,309] Trial 55 finished with value: 0.17737037832727545 and parameters: {'alpha': 576511.7524931703, 'use_snp_selection': False, 'iw_method': 'pc_logistic', 'iw_clip_max': 3.0, 'iw_prob_clip': 0.008613763598950028, 'iw_n_components': 10, 'iw_logistic_c': 8.200626022776249e-05, 'iw_pca_fit': 'combined', 'iw_solver': 'lbfgs', 'iw_rho': 1.0}. Best is trial 54 with value: 0.18374613567752085.
[I 2026-04-24 15:57:41,441] Trial 56 finished with value: 0.1770702019199308 and parameters: {'alpha': 1201760.4570262097, 'use_snp_selection': False, 'iw_method': 'pc_logistic', 'iw_clip_max': 3.0, 'iw_prob_clip': 0.011109131252513218, 'iw_n_components': 10, 'iw_logistic_c': 2.6573937356062477e-05, 'iw_pca_fit': 'combined', 'iw_solver': 'lbfgs', 'iw_rho': 1.0}. Best is trial 54 with value: 0.18374613567752085.
[I 2026-04-24 16:02:03,018] Trial 57 finished with value: -1.0 and parameters: {'alpha': 2139782.738389359, 'use_snp_selection': False, 'iw_method': 'pc_logistic', 'iw_clip_max': 20.0, 'iw_prob_clip': 0.010386812132396124, 'iw_n_components': 10, 'iw_logistic_c': 0.00047133005162242655, 'iw_pca_fit': 'combined', 'iw_solver': 'lbfgs', 'iw_rho': 1.0}. Best is trial 54 with value: 0.18374613567752085.
