[I 2026-05-04 04:09:36,750] Trial 111 finished with value: 0.19978804166006958 and parameters: {'alpha': 254232.69226539592, 'use_snp_selection': False, 'iw_method': 'pc_logistic', 'iw_clip_max': 2.0, 'iw_prob_clip': 0.038616653739090755, 'iw_n_components': 40, 'iw_logistic_c': 7.177519076092541e-06, 'iw_pca_fit': 'combined', 'iw_solver': 'lbfgs', 'iw_rho': 1.0}. Best is trial 94 with value: 0.20008187745869602.
[I 2026-05-04 04:12:03,391] Trial 112 finished with value: 0.1992269935312388 and parameters: {'alpha': 348035.36736110126, 'use_snp_selection': False, 'iw_method': 'pc_logistic', 'iw_clip_max': 2.0, 'iw_prob_clip': 0.045458063736420876, 'iw_n_components': 40, 'iw_logistic_c': 8.13111871038986e-06, 'iw_pca_fit': 'combined', 'iw_solver': 'lbfgs', 'iw_rho': 1.0}. Best is trial 94 with value: 0.20008187745869602.
[I 2026-05-04 04:14:29,683] Trial 113 finished with value: 0.19931091427044076 and parameters: {'alpha': 310280.73636043875, 'use_snp_selection': False, 'iw_method': 'pc_logistic', 'iw_clip_max': 2.0, 'iw_prob_clip': 0.04642466936429674, 'iw_n_components': 40, 'iw_logistic_c': 7.442030226535313e-06, 'iw_pca_fit': 'combined', 'iw_solver': 'lbfgs', 'iw_rho': 1.0}. Best is trial 94 with value: 0.20008187745869602.
[I 2026-05-04 04:16:56,194] Trial 114 finished with value: 0.19930536799409135 and parameters: {'alpha': 351578.4847896088, 'use_snp_selection': False, 'iw_method': 'pc_logistic', 'iw_clip_max': 2.0, 'iw_prob_clip': 0.04998263542940803, 'iw_n_components': 40, 'iw_logistic_c': 6.765862606002886e-06, 'iw_pca_fit': 'combined', 'iw_solver': 'lbfgs', 'iw_rho': 1.0}. Best is trial 94 with value: 0.20008187745869602.
[I 2026-05-04 04:19:22,223] Trial 115 finished with value: 0.19778924112073917 and parameters: {'alpha': 336457.1826927667, 'use_snp_selection': False, 'iw_method': 'pc_logistic', 'iw_clip_max': 2.0, 'iw_prob_clip': 0.031194429945542758, 'iw_n_components': 40, 'iw_logistic_c': 8.249786488036163e-06, 'iw_pca_fit': 'combined', 'iw_solver': 'lbfgs', 'iw_rho': 1.0}. Best is trial 94 with value: 0.20008187745869602.
[I 2026-05-04 04:21:48,913] Trial 116 finished with value: 0.19914389122663817 and parameters: {'alpha': 357914.44899317814, 'use_snp_selection': False, 'iw_method': 'pc_logistic', 'iw_clip_max': 2.0, 'iw_prob_clip': 0.03990267044512814, 'iw_n_components': 40, 'iw_logistic_c': 6.152293451680587e-06, 'iw_pca_fit': 'combined', 'iw_solver': 'lbfgs', 'iw_rho': 0.9}. Best is trial 94 with value: 0.20008187745869602.
[I 2026-05-04 04:24:15,458] Trial 117 finished with value: 0.19987464304560204 and parameters: {'alpha': 358444.4911180225, 'use_snp_selection': False, 'iw_method': 'pc_logistic', 'iw_clip_max': 2.0, 'iw_prob_clip': 0.038952363085443226, 'iw_n_components': 40, 'iw_logistic_c': 2.7704399872169557e-06, 'iw_pca_fit': 'combined', 'iw_solver': 'lbfgs', 'iw_rho': 1.0}. Best is trial 94 with value: 0.20008187745869602.
[I 2026-05-04 04:26:42,068] Trial 118 finished with value: 0.19924788769849716 and parameters: {'alpha': 352117.383350949, 'use_snp_selection': False, 'iw_method': 'pc_logistic', 'iw_clip_max': 2.0, 'iw_prob_clip': 0.038932715493432433, 'iw_n_components': 40, 'iw_logistic_c': 3.651806346614714e-06, 'iw_pca_fit': 'combined', 'iw_solver': 'lbfgs', 'iw_rho': 0.75}. Best is trial 94 with value: 0.20008187745869602.
[I 2026-05-04 04:29:08,442] Trial 119 finished with value: 0.19538718971495922 and parameters: {'alpha': 384376.88622735377, 'use_snp_selection': False, 'iw_method': 'pc_logistic', 'iw_clip_max': 2.0, 'iw_prob_clip': 0.022986637142137036, 'iw_n_components': 40, 'iw_logistic_c': 2.6615120705598424e-06, 'iw_pca_fit': 'combined', 'iw_solver': 'lbfgs', 'iw_rho': 0.75}. Best is trial 94 with value: 0.20008187745869602.
[I 2026-05-04 04:29:32,790] Trial 120 finished with value: 0.1886684635591392 and parameters: {'alpha': 556880.8123347457, 'use_snp_selection': False, 'iw_method': 'uniform'}. Best is trial 94 with value: 0.20008187745869602.
[I 2026-05-04 04:31:58,867] Trial 121 finished with value: 0.19912797030138812 and parameters: {'alpha': 352408.77730872587, 'use_snp_selection': False, 'iw_method': 'pc_logistic', 'iw_clip_max': 2.0, 'iw_prob_clip': 0.039287272314092125, 'iw_n_components': 40, 'iw_logistic_c': 3.2828285857949938e-06, 'iw_pca_fit': 'combined', 'iw_solver': 'lbfgs', 'iw_rho': 0.75}. Best is trial 94 with value: 0.20008187745869602.
[I 2026-05-04 04:34:24,894] Trial 122 finished with value: 0.19862091797541642 and parameters: {'alpha': 319958.28703349724, 'use_snp_selection': False, 'iw_method': 'pc_logistic', 'iw_clip_max': 2.0, 'iw_prob_clip': 0.046400394984124696, 'iw_n_components': 40, 'iw_logistic_c': 2.140581986585616e-06, 'iw_pca_fit': 'combined', 'iw_solver': 'lbfgs', 'iw_rho': 0.75}. Best is trial 94 with value: 0.20008187745869602.
[I 2026-05-04 04:36:50,346] Trial 123 finished with value: 0.19804471451394526 and parameters: {'alpha': 398984.7617242787, 'use_snp_selection': False, 'iw_method': 'pc_logistic', 'iw_clip_max': 2.0, 'iw_prob_clip': 0.03952099279740313, 'iw_n_components': 40, 'iw_logistic_c': 6.377774648201474e-06, 'iw_pca_fit': 'combined', 'iw_solver': 'lbfgs', 'iw_rho': 0.75}. Best is trial 94 with value: 0.20008187745869602.
[I 2026-05-04 04:39:15,451] Trial 124 finished with value: 0.19171111455420914 and parameters: {'alpha': 446040.7374741706, 'use_snp_selection': False, 'iw_method': 'pc_logistic', 'iw_clip_max': 2.0, 'iw_prob_clip': 0.033689735600869526, 'iw_n_components': 40, 'iw_logistic_c': 3.422604990342514e-07, 'iw_pca_fit': 'combined', 'iw_solver': 'lbfgs', 'iw_rho': 0.9}. Best is trial 94 with value: 0.20008187745869602.
[I 2026-05-04 04:41:40,614] Trial 125 finished with value: 0.2009876959209845 and parameters: {'alpha': 353067.83908673894, 'use_snp_selection': False, 'iw_method': 'pc_logistic', 'iw_clip_max': 2.0, 'iw_prob_clip': 0.04593743211678661, 'iw_n_components': 40, 'iw_logistic_c': 3.7911042546777657e-06, 'iw_pca_fit': 'combined', 'iw_solver': 'lbfgs', 'iw_rho': 1.0}. Best is trial 125 with value: 0.2009876959209845.
[I 2026-05-04 04:44:10,643] Trial 126 finished with value: 0.18292156734475137 and parameters: {'alpha': 514134.6012276014, 'use_snp_selection': False, 'iw_method': 'pc_logistic', 'iw_clip_max': 5.0, 'iw_prob_clip': 0.04594518002096613, 'iw_n_components': 40, 'iw_logistic_c': 0.035060732136834354, 'iw_pca_fit': 'combined', 'iw_solver': 'lbfgs', 'iw_rho': 1.0}. Best is trial 125 with value: 0.2009876959209845.
[I 2026-05-04 04:46:34,180] Trial 127 finished with value: 0.19704199293055322 and parameters: {'alpha': 333131.5888696541, 'use_snp_selection': False, 'iw_method': 'pc_logistic', 'iw_clip_max': 2.0, 'iw_prob_clip': 0.035039166623915825, 'iw_n_components': 40, 'iw_logistic_c': 1.0537061940387062e-06, 'iw_pca_fit': 'combined', 'iw_solver': 'lbfgs', 'iw_rho': 1.0}. Best is trial 125 with value: 0.2009876959209845.
[I 2026-05-04 04:48:58,700] Trial 128 finished with value: 0.2011947595658492 and parameters: {'alpha': 289818.6433155556, 'use_snp_selection': False, 'iw_method': 'pc_logistic', 'iw_clip_max': 2.0, 'iw_prob_clip': 0.049535802026832776, 'iw_n_components': 40, 'iw_logistic_c': 3.99635997377959e-06, 'iw_pca_fit': 'combined', 'iw_solver': 'lbfgs', 'iw_rho': 1.0}. Best is trial 128 with value: 0.2011947595658492.
[I 2026-05-04 04:51:28,637] Trial 129 finished with value: 0.20161287604090988 and parameters: {'alpha': 288875.5136702684, 'use_snp_selection': False, 'iw_method': 'pc_logistic', 'iw_clip_max': 2.0, 'iw_prob_clip': 0.04942112983208509, 'iw_n_components': 80, 'iw_logistic_c': 4.127712733615646e-06, 'iw_pca_fit': 'combined', 'iw_solver': 'lbfgs', 'iw_rho': 1.0}. Best is trial 129 with value: 0.20161287604090988.
[I 2026-05-04 04:53:52,665] Trial 130 finished with value: 0.19821620109654853 and parameters: {'alpha': 283511.74505194876, 'use_snp_selection': False, 'iw_method': 'pc_logistic', 'iw_clip_max': 2.0, 'iw_prob_clip': 0.03803924116518532, 'iw_n_components': 60, 'iw_logistic_c': 3.5947895758456733e-06, 'iw_pca_fit': 'combined', 'iw_solver': 'lbfgs', 'iw_rho': 0.5}. Best is trial 129 with value: 0.20161287604090988.
[I 2026-05-04 04:56:22,719] Trial 131 finished with value: 0.20187334273804955 and parameters: {'alpha': 301489.7688045692, 'use_snp_selection': False, 'iw_method': 'pc_logistic', 'iw_clip_max': 2.0, 'iw_prob_clip': 0.04962021661255911, 'iw_n_components': 80, 'iw_logistic_c': 9.103180040058922e-06, 'iw_pca_fit': 'combined', 'iw_solver': 'lbfgs', 'iw_rho': 1.0}. Best is trial 131 with value: 0.20187334273804955.
[I 2026-05-04 04:58:53,251] Trial 132 finished with value: 0.201500874535605 and parameters: {'alpha': 302214.26034380286, 'use_snp_selection': False, 'iw_method': 'pc_logistic', 'iw_clip_max': 2.0, 'iw_prob_clip': 0.04995093478837084, 'iw_n_components': 80, 'iw_logistic_c': 4.702900759025577e-06, 'iw_pca_fit': 'combined', 'iw_solver': 'lbfgs', 'iw_rho': 1.0}. Best is trial 131 with value: 0.20187334273804955.
[I 2026-05-04 05:01:23,922] Trial 133 finished with value: 0.20108031536149165 and parameters: {'alpha': 300858.2590642098, 'use_snp_selection': False, 'iw_method': 'pc_logistic', 'iw_clip_max': 2.0, 'iw_prob_clip': 0.0478948774453799, 'iw_n_components': 80, 'iw_logistic_c': 1.323477705110342e-05, 'iw_pca_fit': 'combined', 'iw_solver': 'lbfgs', 'iw_rho': 1.0}. Best is trial 131 with value: 0.20187334273804955.
[I 2026-05-04 05:03:50,851] Trial 134 finished with value: 0.2006264581398498 and parameters: {'alpha': 249725.90807979798, 'use_snp_selection': False, 'iw_method': 'pc_logistic', 'iw_clip_max': 2.0, 'iw_prob_clip': 0.04668280222266148, 'iw_n_components': 80, 'iw_logistic_c': 1.673920044778277e-05, 'iw_pca_fit': 'combined', 'iw_solver': 'lbfgs', 'iw_rho': 1.0}. Best is trial 131 with value: 0.20187334273804955.
[I 2026-05-04 05:06:12,278] Trial 135 finished with value: 0.1997793338296603 and parameters: {'alpha': 251811.3357959534, 'use_snp_selection': False, 'iw_method': 'pc_logistic', 'iw_clip_max': 2.0, 'iw_prob_clip': 0.041133427560042186, 'iw_n_components': 80, 'iw_logistic_c': 1.2812781266449335e-05, 'iw_pca_fit': 'combined', 'iw_solver': 'lbfgs', 'iw_rho': 1.0}. Best is trial 131 with value: 0.20187334273804955.
[I 2026-05-04 05:08:33,816] Trial 136 finished with value: 0.19363648966981523 and parameters: {'alpha': 249689.83037229793, 'use_snp_selection': False, 'iw_method': 'pc_logistic', 'iw_clip_max': 2.0, 'iw_prob_clip': 0.00758062137023725, 'iw_n_components': 80, 'iw_logistic_c': 1.6641911024541747e-05, 'iw_pca_fit': 'combined', 'iw_solver': 'lbfgs', 'iw_rho': 1.0}. Best is trial 131 with value: 0.20187334273804955.
[I 2026-05-04 05:10:55,064] Trial 137 finished with value: 0.2009169966803377 and parameters: {'alpha': 268978.7767149335, 'use_snp_selection': False, 'iw_method': 'pc_logistic', 'iw_clip_max': 2.0, 'iw_prob_clip': 0.048686823354698344, 'iw_n_components': 80, 'iw_logistic_c': 1.215842678229234e-05, 'iw_pca_fit': 'combined', 'iw_solver': 'lbfgs', 'iw_rho': 1.0}. Best is trial 131 with value: 0.20187334273804955.
[I 2026-05-04 05:13:16,625] Trial 138 finished with value: 0.1945079898242968 and parameters: {'alpha': 294481.53793843166, 'use_snp_selection': False, 'iw_method': 'pc_logistic', 'iw_clip_max': 2.0, 'iw_prob_clip': 0.002602429968330298, 'iw_n_components': 80, 'iw_logistic_c': 1.3135097701943387e-05, 'iw_pca_fit': 'combined', 'iw_solver': 'lbfgs', 'iw_rho': 1.0}. Best is trial 131 with value: 0.20187334273804955.
[I 2026-05-04 05:15:40,493] Trial 139 finished with value: 0.19765800962254412 and parameters: {'alpha': 271848.02882476285, 'use_snp_selection': False, 'iw_method': 'pc_logistic', 'iw_clip_max': 1.5, 'iw_prob_clip': 0.049718798565067945, 'iw_n_components': 80, 'iw_logistic_c': 3.68862048896293e-05, 'iw_pca_fit': 'combined', 'iw_solver': 'lbfgs', 'iw_rho': 1.0}. Best is trial 131 with value: 0.20187334273804955.
[I 2026-05-04 05:18:02,861] Trial 140 finished with value: 0.201363639848819 and parameters: {'alpha': 252593.75720702554, 'use_snp_selection': False, 'iw_method': 'pc_logistic', 'iw_clip_max': 2.0, 'iw_prob_clip': 0.04067499537573134, 'iw_n_components': 80, 'iw_logistic_c': 4.463002600355108e-06, 'iw_pca_fit': 'combined', 'iw_solver': 'lbfgs', 'iw_rho': 1.0}. Best is trial 131 with value: 0.20187334273804955.
[I 2026-05-04 05:20:25,179] Trial 141 finished with value: 0.20113958323616435 and parameters: {'alpha': 258536.0893035702, 'use_snp_selection': False, 'iw_method': 'pc_logistic', 'iw_clip_max': 2.0, 'iw_prob_clip': 0.04073824580211404, 'iw_n_components': 80, 'iw_logistic_c': 4.313907011796048e-06, 'iw_pca_fit': 'combined', 'iw_solver': 'lbfgs', 'iw_rho': 1.0}. Best is trial 131 with value: 0.20187334273804955.
[I 2026-05-04 05:22:47,615] Trial 142 finished with value: 0.20109626187192092 and parameters: {'alpha': 254131.95829499033, 'use_snp_selection': False, 'iw_method': 'pc_logistic', 'iw_clip_max': 2.0, 'iw_prob_clip': 0.041124259004259145, 'iw_n_components': 80, 'iw_logistic_c': 4.615142689321838e-06, 'iw_pca_fit': 'combined', 'iw_solver': 'lbfgs', 'iw_rho': 1.0}. Best is trial 131 with value: 0.20187334273804955.
[I 2026-05-04 05:25:10,052] Trial 143 finished with value: 0.19891380324349747 and parameters: {'alpha': 237775.5185802855, 'use_snp_selection': False, 'iw_method': 'pc_logistic', 'iw_clip_max': 2.0, 'iw_prob_clip': 0.031312673211652604, 'iw_n_components': 80, 'iw_logistic_c': 4.766498582053774e-06, 'iw_pca_fit': 'combined', 'iw_solver': 'lbfgs', 'iw_rho': 1.0}. Best is trial 131 with value: 0.20187334273804955.
[I 2026-05-04 05:27:32,946] Trial 144 finished with value: 0.2009286827740664 and parameters: {'alpha': 274635.31643020327, 'use_snp_selection': False, 'iw_method': 'pc_logistic', 'iw_clip_max': 2.0, 'iw_prob_clip': 0.045369968867279994, 'iw_n_components': 80, 'iw_logistic_c': 4.207763710587386e-06, 'iw_pca_fit': 'combined', 'iw_solver': 'lbfgs', 'iw_rho': 1.0}. Best is trial 131 with value: 0.20187334273804955.
[I 2026-05-04 05:29:55,578] Trial 145 finished with value: 0.1968875079691722 and parameters: {'alpha': 270778.90283045545, 'use_snp_selection': False, 'iw_method': 'pc_logistic', 'iw_clip_max': 1.25, 'iw_prob_clip': 0.045068352108671106, 'iw_n_components': 80, 'iw_logistic_c': 2.6896180761256476e-06, 'iw_pca_fit': 'combined', 'iw_solver': 'lbfgs', 'iw_rho': 1.0}. Best is trial 131 with value: 0.20187334273804955.
[I 2026-05-04 05:32:18,123] Trial 146 finished with value: 0.19982738238258374 and parameters: {'alpha': 290133.59776941064, 'use_snp_selection': False, 'iw_method': 'pc_logistic', 'iw_clip_max': 2.0, 'iw_prob_clip': 0.03593473104127726, 'iw_n_components': 80, 'iw_logistic_c': 4.3283167616333755e-06, 'iw_pca_fit': 'combined', 'iw_solver': 'lbfgs', 'iw_rho': 1.0}. Best is trial 131 with value: 0.20187334273804955.
[I 2026-05-04 05:32:40,848] Trial 147 finished with value: 0.1935301073180001 and parameters: {'alpha': 272933.2837849643, 'use_snp_selection': False, 'iw_method': 'uniform'}. Best is trial 131 with value: 0.20187334273804955.
[I 2026-05-04 05:35:03,360] Trial 148 finished with value: 0.20181056306968986 and parameters: {'alpha': 316780.4115190029, 'use_snp_selection': False, 'iw_method': 'pc_logistic', 'iw_clip_max': 2.0, 'iw_prob_clip': 0.049714925377271346, 'iw_n_components': 80, 'iw_logistic_c': 2.9562666479888633e-06, 'iw_pca_fit': 'combined', 'iw_solver': 'lbfgs', 'iw_rho': 1.0}. Best is trial 131 with value: 0.20187334273804955.
[I 2026-05-04 05:37:25,896] Trial 149 finished with value: 0.19546147883383222 and parameters: {'alpha': 318580.32233191456, 'use_snp_selection': False, 'iw_method': 'pc_logistic', 'iw_clip_max': 5.0, 'iw_prob_clip': 0.04530709380196873, 'iw_n_components': 80, 'iw_logistic_c': 1.5237533475222905e-06, 'iw_pca_fit': 'combined', 'iw_solver': 'lbfgs', 'iw_rho': 1.0}. Best is trial 131 with value: 0.20187334273804955.
