[I 2026-04-18 15:31:06,664] Trial 5 finished with value: 0.09889314934166149 and parameters: {'hidden_dims': '[256, 64]', 'dropout': 0.2571412946970998, 'batch_norm': True, 'lr': 3.546238022482882e-05, 'weight_decay': 1.0185234767613396e-06, 'epochs': 119, 'loss': 'mse', 'optimizer': 'sgd', 'use_snp_selection': False, 'weight_scheme': 'linear', 'weight_clip_max': 10.0, 'weight_linear_min_weight': 0.9405832045183805, 'weight_linear_max_weight': 3.413610925325811}. Best is trial 4 with value: 0.1712585289862065.
[I 2026-04-18 15:31:32,905] Trial 20 finished with value: 0.23672204297134258 and parameters: {'hidden_dims': '[256, 64]', 'dropout': 0.1246584364339248, 'batch_norm': True, 'lr': 0.000394906053732309, 'weight_decay': 1.6996303682891308e-05, 'epochs': 264, 'loss': 'mae', 'optimizer': 'adam', 'use_snp_selection': False, 'weight_scheme': 'top-heavy', 'weight_clip_max': None, 'weight_topheavy_top_frac': 0.06658927267553982, 'weight_topheavy_low': 0.7338907103434135, 'weight_topheavy_high': 1.3596202699013604}. Best is trial 6 with value: 0.24136004433841474.
[I 2026-04-18 15:31:50,146] Trial 6 finished with value: 0.14358121748598146 and parameters: {'hidden_dims': '[256, 64]', 'dropout': 0.037961443806696214, 'batch_norm': True, 'lr': 3.644202049829694e-05, 'weight_decay': 9.73334309820277e-06, 'epochs': 243, 'loss': 'mae', 'optimizer': 'adam', 'use_snp_selection': False, 'weight_scheme': 'minmax', 'weight_clip_max': None, 'weight_minmax_eps': 0.08689611239934374}. Best is trial 4 with value: 0.1712585289862065.
[I 2026-04-18 15:32:17,360] Trial 21 finished with value: 0.2339962703140844 and parameters: {'hidden_dims': '[256, 64]', 'dropout': 0.11557592655933119, 'batch_norm': True, 'lr': 0.0003722121820303192, 'weight_decay': 2.1480338462272624e-05, 'epochs': 266, 'loss': 'mae', 'optimizer': 'adam', 'use_snp_selection': False, 'weight_scheme': 'top-heavy', 'weight_clip_max': None, 'weight_topheavy_top_frac': 0.05095884235781699, 'weight_topheavy_low': 0.7265967093323457, 'weight_topheavy_high': 1.3137041448376774}. Best is trial 6 with value: 0.24136004433841474.
[I 2026-04-18 15:32:56,415] Trial 22 finished with value: 0.24162318257671825 and parameters: {'hidden_dims': '[256, 64]', 'dropout': 0.10099822951711013, 'batch_norm': True, 'lr': 0.00022426958757053889, 'weight_decay': 1.7064607716720196e-06, 'epochs': 229, 'loss': 'mae', 'optimizer': 'adam', 'use_snp_selection': False, 'weight_scheme': 'top-heavy', 'weight_clip_max': None, 'weight_topheavy_top_frac': 0.29707795214426325, 'weight_topheavy_low': 0.8617055810480371, 'weight_topheavy_high': 1.611351544401463}. Best is trial 22 with value: 0.24162318257671825.
[I 2026-04-18 15:33:16,504] Trial 7 finished with value: 0.07621025630348273 and parameters: {'hidden_dims': '[512, 128]', 'dropout': 0.1304538168539244, 'batch_norm': False, 'lr': 1.5408060926311233e-05, 'weight_decay': 2.1989735568314356e-08, 'epochs': 250, 'loss': 'mse', 'optimizer': 'sgd', 'use_snp_selection': True, 'num_snps': 42550, 'weight_scheme': 'exponential', 'weight_clip_max': 10.0, 'weight_exponential_beta': 2.758850226029358}. Best is trial 4 with value: 0.1712585289862065.
[I 2026-04-18 15:33:34,617] Trial 23 finished with value: 0.24819099138994324 and parameters: {'hidden_dims': '[256, 64]', 'dropout': 0.035863867371492844, 'batch_norm': True, 'lr': 0.00019272329747006318, 'weight_decay': 1.4802154100117941e-06, 'epochs': 224, 'loss': 'mae', 'optimizer': 'adam', 'use_snp_selection': False, 'weight_scheme': 'top-heavy', 'weight_clip_max': None, 'weight_topheavy_top_frac': 0.3467500885003517, 'weight_topheavy_low': 1.0315598801576766, 'weight_topheavy_high': 3.0636736810382215}. Best is trial 23 with value: 0.24819099138994324.
[I 2026-04-18 15:33:58,202] Trial 8 finished with value: 0.18314114671235524 and parameters: {'hidden_dims': '[256, 128]', 'dropout': 0.05742396906738376, 'batch_norm': False, 'lr': 1.9761509510575143e-06, 'weight_decay': 2.933492239224291e-07, 'epochs': 82, 'loss': 'mae', 'optimizer': 'adam', 'use_snp_selection': True, 'num_snps': 29883, 'weight_scheme': 'minmax', 'weight_clip_max': 5.0, 'weight_minmax_eps': 0.0051288771726799584}. Best is trial 8 with value: 0.18314114671235524.
[I 2026-04-18 15:34:13,234] Trial 24 finished with value: 0.23379498647760774 and parameters: {'hidden_dims': '[256, 64]', 'dropout': 0.04053190844098961, 'batch_norm': True, 'lr': 5.7008301298394024e-05, 'weight_decay': 1.586727046928919e-06, 'epochs': 227, 'loss': 'mae', 'optimizer': 'adam', 'use_snp_selection': False, 'weight_scheme': 'top-heavy', 'weight_clip_max': None, 'weight_topheavy_top_frac': 0.35452362713378843, 'weight_topheavy_low': 1.02028400707679, 'weight_topheavy_high': 3.0783772739506845}. Best is trial 23 with value: 0.24819099138994324.
[I 2026-04-18 15:34:48,790] Trial 25 finished with value: 0.2394390249587254 and parameters: {'hidden_dims': '[256, 64]', 'dropout': 0.09224553568625676, 'batch_norm': True, 'lr': 0.0001427151703008504, 'weight_decay': 2.1930368821258907e-07, 'epochs': 206, 'loss': 'mae', 'optimizer': 'adam', 'use_snp_selection': False, 'weight_scheme': 'top-heavy', 'weight_clip_max': None, 'weight_topheavy_top_frac': 0.3328147785095091, 'weight_topheavy_low': 0.9535312073064488, 'weight_topheavy_high': 2.4320886232197196}. Best is trial 23 with value: 0.24819099138994324.
[I 2026-04-18 15:34:51,367] Trial 9 finished with value: 0.1628013436334482 and parameters: {'hidden_dims': '[256, 128]', 'dropout': 0.5795930447285386, 'batch_norm': False, 'lr': 0.00011782025260263196, 'weight_decay': 0.0005562063174273634, 'epochs': 218, 'loss': 'mae', 'optimizer': 'adamw', 'use_snp_selection': True, 'num_snps': 32226, 'weight_scheme': 'minmax', 'weight_clip_max': 5.0, 'weight_minmax_eps': 0.09600289105543994}. Best is trial 8 with value: 0.18314114671235524.
[I 2026-04-18 15:35:28,180] Trial 26 finished with value: 0.2179973280463626 and parameters: {'hidden_dims': '[256, 64]', 'dropout': 0.0013327869126423808, 'batch_norm': False, 'lr': 2.0477467209344804e-05, 'weight_decay': 4.920610529302927e-07, 'epochs': 234, 'loss': 'mae', 'optimizer': 'adamw', 'use_snp_selection': False, 'weight_scheme': 'top-heavy', 'weight_clip_max': None, 'weight_topheavy_top_frac': 0.24401017898074426, 'weight_topheavy_low': 0.8841673294602036, 'weight_topheavy_high': 4.622998656567636}. Best is trial 23 with value: 0.24819099138994324.
[I 2026-04-18 15:35:44,711] Trial 10 finished with value: 0.06431709380967476 and parameters: {'hidden_dims': '[256, 128]', 'dropout': 0.4338375928678635, 'batch_norm': False, 'lr': 1.459239318238064e-06, 'weight_decay': 3.891313547330106e-07, 'epochs': 68, 'loss': 'mae', 'optimizer': 'adam', 'use_snp_selection': True, 'num_snps': 53871, 'weight_scheme': 'uniform', 'weight_clip_max': 5.0}. Best is trial 8 with value: 0.18314114671235524.
[I 2026-04-18 15:36:09,803] Trial 11 finished with value: 0.17599133839799747 and parameters: {'hidden_dims': '[512, 64]', 'dropout': 0.0018766120545920459, 'batch_norm': False, 'lr': 0.0007728340671580595, 'weight_decay': 1.8785770760768805e-07, 'epochs': 63, 'loss': 'mae', 'optimizer': 'adam', 'use_snp_selection': False, 'weight_scheme': 'top-heavy', 'weight_clip_max': 5.0, 'weight_topheavy_top_frac': 0.1577512922996656, 'weight_topheavy_low': 1.1794432618886457, 'weight_topheavy_high': 3.491303245038004}. Best is trial 8 with value: 0.18314114671235524.
[I 2026-04-18 15:36:32,906] Trial 27 finished with value: 0.24722721801649788 and parameters: {'hidden_dims': '[256, 64]', 'dropout': 0.19598630470197814, 'batch_norm': True, 'lr': 0.0001696206880875427, 'weight_decay': 2.98233571198526e-06, 'epochs': 174, 'loss': 'mae', 'optimizer': 'adam', 'use_snp_selection': True, 'num_snps': 57166, 'weight_scheme': 'top-heavy', 'weight_clip_max': None, 'weight_topheavy_top_frac': 0.4225803666680371, 'weight_topheavy_low': 1.0999920201795441, 'weight_topheavy_high': 2.349549817202125}. Best is trial 23 with value: 0.24819099138994324.
[I 2026-04-18 15:36:33,283] Trial 12 finished with value: 0.16650237147317962 and parameters: {'hidden_dims': '[512, 64]', 'dropout': 0.0033016551831768545, 'batch_norm': False, 'lr': 0.0009914505160586267, 'weight_decay': 6.358058285186147e-08, 'epochs': 58, 'loss': 'mae', 'optimizer': 'adam', 'use_snp_selection': False, 'weight_scheme': 'top-heavy', 'weight_clip_max': 5.0, 'weight_topheavy_top_frac': 0.0605788438736726, 'weight_topheavy_low': 0.5601968356092507, 'weight_topheavy_high': 5.562662354329051}. Best is trial 8 with value: 0.18314114671235524.
[I 2026-04-18 15:37:07,599] Trial 13 finished with value: 0.14204465174908043 and parameters: {'hidden_dims': '[512, 64]', 'dropout': 0.09540446665147634, 'batch_norm': False, 'lr': 1.985357334534712e-06, 'weight_decay': 7.987152861713121e-07, 'epochs': 83, 'loss': 'mae', 'optimizer': 'adam', 'use_snp_selection': True, 'num_snps': 10236, 'weight_scheme': 'top-heavy', 'weight_clip_max': 5.0, 'weight_topheavy_top_frac': 0.4441986652266657, 'weight_topheavy_low': 1.1598564607122372, 'weight_topheavy_high': 1.2324583283695643}. Best is trial 8 with value: 0.18314114671235524.
[I 2026-04-18 15:37:28,919] Trial 14 finished with value: 0.08261386326769811 and parameters: {'hidden_dims': '[512, 64]', 'dropout': 0.4122276725384444, 'batch_norm': False, 'lr': 0.0007488970982140591, 'weight_decay': 1.1840058441529551e-08, 'epochs': 51, 'loss': 'mae', 'optimizer': 'adam', 'use_snp_selection': False, 'weight_scheme': 'exponential', 'weight_clip_max': 5.0, 'weight_exponential_beta': 7.360771302676239}. Best is trial 8 with value: 0.18314114671235524.
[I 2026-04-18 15:37:38,750] Trial 28 finished with value: 0.2452634758198208 and parameters: {'hidden_dims': '[256, 64]', 'dropout': 0.20667428402516902, 'batch_norm': True, 'lr': 0.00018243948035090467, 'weight_decay': 2.8296189874280544e-06, 'epochs': 171, 'loss': 'mae', 'optimizer': 'adam', 'use_snp_selection': True, 'num_snps': 59734, 'weight_scheme': 'top-heavy', 'weight_clip_max': 5.0, 'weight_topheavy_top_frac': 0.42795430763584685, 'weight_topheavy_low': 1.121286959321558, 'weight_topheavy_high': 2.3240572403770625}. Best is trial 23 with value: 0.24819099138994324.
[I 2026-04-18 15:38:21,503] Trial 15 finished with value: 0.1804794133717362 and parameters: {'hidden_dims': '[256, 128]', 'dropout': 0.0013623348598069175, 'batch_norm': False, 'lr': 4.070350753574985e-06, 'weight_decay': 1.3254542600010202e-07, 'epochs': 108, 'loss': 'mae', 'optimizer': 'adamw', 'use_snp_selection': True, 'num_snps': 45517, 'weight_scheme': 'uniform', 'weight_clip_max': 5.0}. Best is trial 8 with value: 0.18314114671235524.
[I 2026-04-18 15:38:36,412] Trial 29 finished with value: 0.24860537695525103 and parameters: {'hidden_dims': '[256, 128]', 'dropout': 0.17938393433564565, 'batch_norm': True, 'lr': 0.0006194355142501454, 'weight_decay': 4.848789391872539e-06, 'epochs': 103, 'loss': 'mse', 'optimizer': 'adam', 'use_snp_selection': True, 'num_snps': 59769, 'weight_scheme': 'top-heavy', 'weight_clip_max': 5.0, 'weight_topheavy_top_frac': 0.4433061919748084, 'weight_topheavy_low': 1.1588574050326135, 'weight_topheavy_high': 2.523636120570959}. Best is trial 29 with value: 0.24860537695525103.
[I 2026-04-18 15:39:14,460] Trial 16 finished with value: 0.14011974393267965 and parameters: {'hidden_dims': '[256, 128]', 'dropout': 0.10695832949607871, 'batch_norm': False, 'lr': 3.833175559855507e-06, 'weight_decay': 3.0059635294601273e-05, 'epochs': 111, 'loss': 'mae', 'optimizer': 'adamw', 'use_snp_selection': True, 'num_snps': 45650, 'weight_scheme': 'uniform', 'weight_clip_max': 5.0}. Best is trial 8 with value: 0.18314114671235524.
[I 2026-04-18 15:39:26,962] Trial 30 finished with value: 0.2511301491564206 and parameters: {'hidden_dims': '[256, 128]', 'dropout': 0.2334810343032072, 'batch_norm': True, 'lr': 0.0006128403116140516, 'weight_decay': 5.313028468519067e-06, 'epochs': 53, 'loss': 'mse', 'optimizer': 'adamw', 'use_snp_selection': True, 'num_snps': 58252, 'weight_scheme': 'top-heavy', 'weight_clip_max': 5.0, 'weight_topheavy_top_frac': 0.4127264132309424, 'weight_topheavy_low': 1.07266996575399, 'weight_topheavy_high': 2.6703784712021768}. Best is trial 30 with value: 0.2511301491564206.
[I 2026-04-18 15:40:08,215] Trial 17 finished with value: 0.18229572559713475 and parameters: {'hidden_dims': '[256, 128]', 'dropout': 0.1781796860306595, 'batch_norm': False, 'lr': 4.701944344671945e-06, 'weight_decay': 1.3748859713701807e-06, 'epochs': 140, 'loss': 'mae', 'optimizer': 'adamw', 'use_snp_selection': True, 'num_snps': 41322, 'weight_scheme': 'uniform', 'weight_clip_max': 5.0}. Best is trial 8 with value: 0.18314114671235524.
[I 2026-04-18 15:40:18,649] Trial 31 finished with value: 0.23786627694276635 and parameters: {'hidden_dims': '[256, 128]', 'dropout': 0.18235149597834266, 'batch_norm': True, 'lr': 0.0005591747022411712, 'weight_decay': 4.910980557240357e-06, 'epochs': 58, 'loss': 'mse', 'optimizer': 'adamw', 'use_snp_selection': True, 'num_snps': 59523, 'weight_scheme': 'top-heavy', 'weight_clip_max': 5.0, 'weight_topheavy_top_frac': 0.4151586234225433, 'weight_topheavy_low': 1.085565680026783, 'weight_topheavy_high': 2.6768298303337117}. Best is trial 30 with value: 0.2511301491564206.
[I 2026-04-18 15:40:52,961] Trial 18 finished with value: 0.1682690018689168 and parameters: {'hidden_dims': '[256, 128]', 'dropout': 0.18507436085228723, 'batch_norm': False, 'lr': 5.517748968317e-06, 'weight_decay': 1.4534029480492906e-06, 'epochs': 175, 'loss': 'mae', 'optimizer': 'adamw', 'use_snp_selection': True, 'num_snps': 24576, 'weight_scheme': 'uniform', 'weight_clip_max': None}. Best is trial 8 with value: 0.18314114671235524.
[I 2026-04-18 15:41:04,809] Trial 32 finished with value: 0.24602771230565756 and parameters: {'hidden_dims': '[256, 128]', 'dropout': 0.21206650721924525, 'batch_norm': True, 'lr': 0.0005627719201232564, 'weight_decay': 6.284483198793463e-07, 'epochs': 50, 'loss': 'mse', 'optimizer': 'adamw', 'use_snp_selection': True, 'num_snps': 48624, 'weight_scheme': 'top-heavy', 'weight_clip_max': 5.0, 'weight_topheavy_top_frac': 0.41087477774674025, 'weight_topheavy_low': 1.1894750986174687, 'weight_topheavy_high': 2.2607418550681198}. Best is trial 30 with value: 0.2511301491564206.
[I 2026-04-18 15:41:43,273] Trial 19 finished with value: 0.10391515974158413 and parameters: {'hidden_dims': '[256, 128]', 'dropout': 0.3687748640212636, 'batch_norm': False, 'lr': 1.1456964087741756e-06, 'weight_decay': 3.0403117130454045e-05, 'epochs': 142, 'loss': 'mae', 'optimizer': 'adamw', 'use_snp_selection': True, 'num_snps': 35625, 'weight_scheme': 'minmax', 'weight_clip_max': 10.0, 'weight_minmax_eps': 0.004331383411533601}. Best is trial 8 with value: 0.18314114671235524.
[I 2026-04-18 15:41:57,497] Trial 33 finished with value: 0.2405829728104098 and parameters: {'hidden_dims': '[256, 128]', 'dropout': 0.23823282021227354, 'batch_norm': True, 'lr': 0.0005694949707691347, 'weight_decay': 3.0711988071464125e-06, 'epochs': 110, 'loss': 'mse', 'optimizer': 'adamw', 'use_snp_selection': True, 'num_snps': 49302, 'weight_scheme': 'top-heavy', 'weight_clip_max': 5.0, 'weight_topheavy_top_frac': 0.4721005673051447, 'weight_topheavy_low': 1.0431813347603058, 'weight_topheavy_high': 3.879957630118377}. Best is trial 30 with value: 0.2511301491564206.
[I 2026-04-18 15:42:53,129] Trial 20 finished with value: 0.1611802654178049 and parameters: {'hidden_dims': '[256, 128]', 'dropout': 0.22160288127836963, 'batch_norm': False, 'lr': 2.59333708875907e-06, 'weight_decay': 0.00020040723554907847, 'epochs': 180, 'loss': 'mae', 'optimizer': 'adamw', 'use_snp_selection': True, 'num_snps': 58934, 'weight_scheme': 'uniform', 'weight_clip_max': 5.0}. Best is trial 8 with value: 0.18314114671235524.
[I 2026-04-18 15:42:55,186] Trial 34 finished with value: 0.242940998294873 and parameters: {'hidden_dims': '[256, 128]', 'dropout': 0.2957100865284802, 'batch_norm': True, 'lr': 0.00010753099427171048, 'weight_decay': 6.769528339706074e-06, 'epochs': 135, 'loss': 'mse', 'optimizer': 'adamw', 'use_snp_selection': True, 'num_snps': 52906, 'weight_scheme': 'top-heavy', 'weight_clip_max': 5.0, 'weight_topheavy_top_frac': 0.3806805271776944, 'weight_topheavy_low': 1.0099645793394607, 'weight_topheavy_high': 3.0860368027392107}. Best is trial 30 with value: 0.2511301491564206.
[I 2026-04-18 15:43:42,955] Trial 35 finished with value: 0.25664890649593197 and parameters: {'hidden_dims': '[256, 128]', 'dropout': 0.15348749589220134, 'batch_norm': True, 'lr': 0.00019948650209679737, 'weight_decay': 6.4902834430482e-08, 'epochs': 87, 'loss': 'mse', 'optimizer': 'adamw', 'use_snp_selection': True, 'num_snps': 42451, 'weight_scheme': 'linear', 'weight_clip_max': 5.0, 'weight_linear_min_weight': 0.9020572175968914, 'weight_linear_max_weight': 3.9645856116278226}. Best is trial 35 with value: 0.25664890649593197.
[I 2026-04-18 15:43:44,033] Trial 21 finished with value: 0.1677549617078741 and parameters: {'hidden_dims': '[256, 128]', 'dropout': 0.07214897983648784, 'batch_norm': False, 'lr': 6.8944210567141374e-06, 'weight_decay': 1.006966981694861e-07, 'epochs': 93, 'loss': 'mae', 'optimizer': 'adamw', 'use_snp_selection': True, 'num_snps': 44818, 'weight_scheme': 'uniform', 'weight_clip_max': 5.0}. Best is trial 8 with value: 0.18314114671235524.
[I 2026-04-18 15:44:30,400] Trial 36 finished with value: 0.24827131334622105 and parameters: {'hidden_dims': '[256, 128]', 'dropout': 0.15207303803855382, 'batch_norm': False, 'lr': 0.0005101445524487667, 'weight_decay': 2.1519518643842705e-08, 'epochs': 87, 'loss': 'mse', 'optimizer': 'adamw', 'use_snp_selection': True, 'num_snps': 41837, 'weight_scheme': 'linear', 'weight_clip_max': 5.0, 'weight_linear_min_weight': 0.9869758358929701, 'weight_linear_max_weight': 3.9592441809144825}. Best is trial 35 with value: 0.25664890649593197.
[I 2026-04-18 15:44:33,692] Trial 22 finished with value: 0.16890788350891658 and parameters: {'hidden_dims': '[256, 128]', 'dropout': 0.13537596130835458, 'batch_norm': False, 'lr': 3.185337400566164e-06, 'weight_decay': 1.9362699714683826e-06, 'epochs': 124, 'loss': 'mae', 'optimizer': 'adamw', 'use_snp_selection': True, 'num_snps': 37317, 'weight_scheme': 'uniform', 'weight_clip_max': 5.0}. Best is trial 8 with value: 0.18314114671235524.
[I 2026-04-18 15:45:16,798] Trial 37 finished with value: 0.25442032312487145 and parameters: {'hidden_dims': '[256, 128]', 'dropout': 0.1545750635137825, 'batch_norm': False, 'lr': 0.0006090022579631901, 'weight_decay': 7.890856593037619e-08, 'epochs': 82, 'loss': 'mse', 'optimizer': 'adamw', 'use_snp_selection': True, 'num_snps': 40994, 'weight_scheme': 'linear', 'weight_clip_max': 5.0, 'weight_linear_min_weight': 0.99977294574399, 'weight_linear_max_weight': 3.9494807708911788}. Best is trial 35 with value: 0.25664890649593197.
[I 2026-04-18 15:45:26,048] Trial 23 finished with value: 0.05831618944463439 and parameters: {'hidden_dims': '[256, 128]', 'dropout': 0.05502523835041404, 'batch_norm': False, 'lr': 1.1156779275635368e-06, 'weight_decay': 4.409857226629733e-07, 'epochs': 81, 'loss': 'mae', 'optimizer': 'adamw', 'use_snp_selection': True, 'num_snps': 51031, 'weight_scheme': 'uniform', 'weight_clip_max': 5.0}. Best is trial 8 with value: 0.18314114671235524.
[I 2026-04-18 15:46:01,622] Trial 38 finished with value: 0.24974664964175664 and parameters: {'hidden_dims': '[256, 128]', 'dropout': 0.16532754844776587, 'batch_norm': False, 'lr': 0.0006629533084457648, 'weight_decay': 7.411526494556717e-08, 'epochs': 73, 'loss': 'mse', 'optimizer': 'adamw', 'use_snp_selection': True, 'num_snps': 40511, 'weight_scheme': 'linear', 'weight_clip_max': 5.0, 'weight_linear_min_weight': 0.7980738819960659, 'weight_linear_max_weight': 3.1592594034412387}. Best is trial 35 with value: 0.25664890649593197.
[I 2026-04-18 15:46:18,228] Trial 24 finished with value: 0.15761052240843212 and parameters: {'hidden_dims': '[512, 128]', 'dropout': 0.11976652888727937, 'batch_norm': False, 'lr': 1.1002405273540248e-05, 'weight_decay': 2.3092364679322223e-08, 'epochs': 134, 'loss': 'mae', 'optimizer': 'adamw', 'use_snp_selection': True, 'num_snps': 27688, 'weight_scheme': 'uniform', 'weight_clip_max': 5.0}. Best is trial 8 with value: 0.18314114671235524.
[I 2026-04-18 15:46:45,555] Trial 39 finished with value: 0.2544707238991549 and parameters: {'hidden_dims': '[256, 128]', 'dropout': 0.23523752586840435, 'batch_norm': False, 'lr': 7.157609118998584e-05, 'weight_decay': 8.341130092159269e-08, 'epochs': 69, 'loss': 'mse', 'optimizer': 'adamw', 'use_snp_selection': True, 'num_snps': 39350, 'weight_scheme': 'linear', 'weight_clip_max': 5.0, 'weight_linear_min_weight': 0.7610503032846846, 'weight_linear_max_weight': 3.3250473959011}. Best is trial 35 with value: 0.25664890649593197.
[I 2026-04-18 15:47:11,829] Trial 25 finished with value: 0.15623132613066218 and parameters: {'hidden_dims': '[256, 128]', 'dropout': 0.15526884168877209, 'batch_norm': False, 'lr': 4.274883643828713e-06, 'weight_decay': 1.6427178220996068e-07, 'epochs': 163, 'loss': 'mae', 'optimizer': 'adamw', 'use_snp_selection': True, 'num_snps': 39834, 'weight_scheme': 'exponential', 'weight_clip_max': 5.0, 'weight_exponential_beta': 0.1778264367356952}. Best is trial 8 with value: 0.18314114671235524.
[I 2026-04-18 15:47:49,174] Trial 26 finished with value: 0.09235041325941498 and parameters: {'hidden_dims': '[256, 128]', 'dropout': 0.029651830882007502, 'batch_norm': True, 'lr': 1.7213225487389124e-06, 'weight_decay': 5.199817805971003e-07, 'epochs': 94, 'loss': 'mae', 'optimizer': 'adam', 'use_snp_selection': True, 'num_snps': 20200, 'weight_scheme': 'minmax', 'weight_clip_max': 5.0, 'weight_minmax_eps': 0.1992301641958255}. Best is trial 8 with value: 0.18314114671235524.
