[I 2026-04-24 16:05:49,574] Trial 58 finished with value: 0.16061585652288005 and parameters: {'alpha': 6414528.489351806, 'use_snp_selection': False, 'iw_method': 'pc_logistic', 'iw_clip_max': 3.0, 'iw_prob_clip': 0.01145480861523071, 'iw_n_components': 3, 'iw_logistic_c': 0.0194587517064798, 'iw_pca_fit': 'combined', 'iw_solver': 'lbfgs', 'iw_rho': 0.75}. Best is trial 54 with value: 0.18374613567752085.
[I 2026-04-24 16:10:12,505] Trial 59 finished with value: 0.17057535148637165 and parameters: {'alpha': 93221.58323501503, 'use_snp_selection': False, 'iw_method': 'pc_logistic', 'iw_clip_max': 5.0, 'iw_prob_clip': 0.017588850174834456, 'iw_n_components': 10, 'iw_logistic_c': 0.00018860682398999238, 'iw_pca_fit': 'combined', 'iw_solver': 'lbfgs', 'iw_rho': 1.0}. Best is trial 54 with value: 0.18374613567752085.
[I 2026-04-24 16:12:43,600] Trial 60 finished with value: 0.17340365950678915 and parameters: {'alpha': 58764.74423737711, 'use_snp_selection': True, 'num_snps': 7708, 'iw_method': 'pc_logistic', 'iw_clip_max': 3.0, 'iw_prob_clip': 0.014173601887190697, 'iw_n_components': 20, 'iw_logistic_c': 1.0779024187534408e-05, 'iw_pca_fit': 'combined', 'iw_solver': 'lbfgs', 'iw_rho': 0.1}. Best is trial 54 with value: 0.18374613567752085.
[I 2026-04-24 16:16:08,845] Trial 61 finished with value: 0.1774485043907115 and parameters: {'alpha': 375222.5279686239, 'use_snp_selection': False, 'iw_method': 'pc_logistic', 'iw_clip_max': 3.0, 'iw_prob_clip': 0.02412221373064448, 'iw_n_components': 1, 'iw_logistic_c': 1.927134868279853e-05, 'iw_pca_fit': 'source', 'iw_solver': 'lbfgs', 'iw_rho': 0.25}. Best is trial 54 with value: 0.18374613567752085.
[I 2026-04-24 16:19:48,267] Trial 62 finished with value: 0.17701484897917427 and parameters: {'alpha': 707066.5439631955, 'use_snp_selection': False, 'iw_method': 'pc_logistic', 'iw_clip_max': 3.0, 'iw_prob_clip': 0.0303094457523224, 'iw_n_components': 1, 'iw_logistic_c': 1.142415389735075e-05, 'iw_pca_fit': 'combined', 'iw_solver': 'lbfgs', 'iw_rho': 0.75}. Best is trial 54 with value: 0.18374613567752085.
[I 2026-04-24 16:23:14,441] Trial 63 finished with value: 0.1798187396830682 and parameters: {'alpha': 147282.20177193952, 'use_snp_selection': False, 'iw_method': 'pc_logistic', 'iw_clip_max': 3.0, 'iw_prob_clip': 0.009105375494604957, 'iw_n_components': 1, 'iw_logistic_c': 3.7313086866035856e-05, 'iw_pca_fit': 'source', 'iw_solver': 'lbfgs', 'iw_rho': 1.0}. Best is trial 54 with value: 0.18374613567752085.
[I 2026-04-24 16:26:53,805] Trial 64 finished with value: 0.18001742697555947 and parameters: {'alpha': 158375.5729022343, 'use_snp_selection': False, 'iw_method': 'pc_logistic', 'iw_clip_max': 3.0, 'iw_prob_clip': 0.00668773566057735, 'iw_n_components': 1, 'iw_logistic_c': 4.072346616653998e-05, 'iw_pca_fit': 'combined', 'iw_solver': 'lbfgs', 'iw_rho': 1.0}. Best is trial 54 with value: 0.18374613567752085.
[I 2026-04-24 16:30:51,863] Trial 65 finished with value: 0.1697620556977303 and parameters: {'alpha': 138310.92545543003, 'use_snp_selection': False, 'iw_method': 'pc_logistic', 'iw_clip_max': 3.0, 'iw_prob_clip': 0.006103285051476055, 'iw_n_components': 3, 'iw_logistic_c': 0.0004961428947997667, 'iw_pca_fit': 'combined', 'iw_solver': 'lbfgs', 'iw_rho': 1.0}. Best is trial 54 with value: 0.18374613567752085.
[I 2026-04-24 16:34:25,927] Trial 66 finished with value: 0.1752546241101298 and parameters: {'alpha': 420317.1656664507, 'use_snp_selection': False, 'iw_method': 'pc_logistic', 'iw_clip_max': 3.0, 'iw_prob_clip': 0.008738385829849812, 'iw_n_components': 1, 'iw_logistic_c': 0.00014029644504738635, 'iw_pca_fit': 'combined', 'iw_solver': 'lbfgs', 'iw_rho': 1.0}. Best is trial 54 with value: 0.18374613567752085.
[I 2026-04-24 16:38:39,235] Trial 67 finished with value: 0.1636840302079185 and parameters: {'alpha': 22248.165372965155, 'use_snp_selection': False, 'iw_method': 'pc_logistic', 'iw_clip_max': 10.0, 'iw_prob_clip': 0.006788150649538516, 'iw_n_components': 10, 'iw_logistic_c': 4.9349710785962035e-05, 'iw_pca_fit': 'combined', 'iw_solver': 'lbfgs', 'iw_rho': 1.0}. Best is trial 54 with value: 0.18374613567752085.
[I 2026-04-24 16:42:57,288] Trial 68 finished with value: 0.17048586185135467 and parameters: {'alpha': 57010.61688742964, 'use_snp_selection': False, 'iw_method': 'pc_logistic', 'iw_clip_max': 2.0, 'iw_prob_clip': 0.007475743110917987, 'iw_n_components': 20, 'iw_logistic_c': 0.00030923791477347574, 'iw_pca_fit': 'combined', 'iw_solver': 'lbfgs', 'iw_rho': 1.0}. Best is trial 54 with value: 0.18374613567752085.
[I 2026-04-24 16:43:43,624] Trial 69 finished with value: 0.12656647455840844 and parameters: {'alpha': 665.0449796453486, 'use_snp_selection': False, 'iw_method': 'uniform', 'iw_clip_max': 3.0, 'iw_prob_clip': 0.009047326088964759}. Best is trial 54 with value: 0.18374613567752085.
[I 2026-04-24 16:47:25,713] Trial 70 finished with value: 0.17526473495377873 and parameters: {'alpha': 129550.10137209325, 'use_snp_selection': False, 'iw_method': 'pc_logistic', 'iw_clip_max': 20.0, 'iw_prob_clip': 0.005696657394377651, 'iw_n_components': 1, 'iw_logistic_c': 0.0026763487585137412, 'iw_pca_fit': 'combined', 'iw_solver': 'lbfgs', 'iw_rho': 1.0}. Best is trial 54 with value: 0.18374613567752085.
[I 2026-04-24 16:50:50,766] Trial 71 finished with value: 0.18010157576982253 and parameters: {'alpha': 284234.64555730636, 'use_snp_selection': False, 'iw_method': 'pc_logistic', 'iw_clip_max': 3.0, 'iw_prob_clip': 0.009822256521221049, 'iw_n_components': 1, 'iw_logistic_c': 2.634989094180427e-05, 'iw_pca_fit': 'source', 'iw_solver': 'lbfgs', 'iw_rho': 1.0}. Best is trial 54 with value: 0.18374613567752085.
[I 2026-04-24 16:54:27,932] Trial 72 finished with value: 0.17754746669238614 and parameters: {'alpha': 534668.7972383846, 'use_snp_selection': False, 'iw_method': 'pc_logistic', 'iw_clip_max': 3.0, 'iw_prob_clip': 0.010316203727043007, 'iw_n_components': 1, 'iw_logistic_c': 2.42264918880827e-05, 'iw_pca_fit': 'combined', 'iw_solver': 'lbfgs', 'iw_rho': 1.0}. Best is trial 54 with value: 0.18374613567752085.
[I 2026-04-24 16:57:49,934] Trial 73 finished with value: 0.18020262085304078 and parameters: {'alpha': 186840.3068878166, 'use_snp_selection': False, 'iw_method': 'pc_logistic', 'iw_clip_max': 3.0, 'iw_prob_clip': 0.007975648577861393, 'iw_n_components': 1, 'iw_logistic_c': 8.749218594243018e-05, 'iw_pca_fit': 'source', 'iw_solver': 'lbfgs', 'iw_rho': 1.0}. Best is trial 54 with value: 0.18374613567752085.
[I 2026-04-24 17:01:11,145] Trial 74 finished with value: 0.1779866059751933 and parameters: {'alpha': 94443.83462077577, 'use_snp_selection': False, 'iw_method': 'pc_logistic', 'iw_clip_max': 3.0, 'iw_prob_clip': 0.007747296708834231, 'iw_n_components': 1, 'iw_logistic_c': 9.144400844283327e-05, 'iw_pca_fit': 'source', 'iw_solver': 'lbfgs', 'iw_rho': 1.0}. Best is trial 54 with value: 0.18374613567752085.
[I 2026-04-24 17:04:27,760] Trial 75 finished with value: 0.18022174897051982 and parameters: {'alpha': 183427.78372179935, 'use_snp_selection': False, 'iw_method': 'pc_logistic', 'iw_clip_max': 3.0, 'iw_prob_clip': 0.009286746638898374, 'iw_n_components': 1, 'iw_logistic_c': 4.420254215976237e-05, 'iw_pca_fit': 'source', 'iw_solver': 'lbfgs', 'iw_rho': 1.0}. Best is trial 54 with value: 0.18374613567752085.
[I 2026-04-24 17:07:52,117] Trial 76 finished with value: 0.17396186964945465 and parameters: {'alpha': 1010181.2158275171, 'use_snp_selection': False, 'iw_method': 'pc_logistic', 'iw_clip_max': 3.0, 'iw_prob_clip': 0.00931059880983263, 'iw_n_components': 1, 'iw_logistic_c': 4.186836543510682e-05, 'iw_pca_fit': 'source', 'iw_solver': 'lbfgs', 'iw_rho': 1.0}. Best is trial 54 with value: 0.18374613567752085.
[I 2026-04-24 17:11:15,056] Trial 77 finished with value: 0.17992670881829118 and parameters: {'alpha': 328664.90348791477, 'use_snp_selection': False, 'iw_method': 'pc_logistic', 'iw_clip_max': 3.0, 'iw_prob_clip': 0.00829075811490453, 'iw_n_components': 1, 'iw_logistic_c': 2.0389932153559474e-05, 'iw_pca_fit': 'source', 'iw_solver': 'lbfgs', 'iw_rho': 1.0}. Best is trial 54 with value: 0.18374613567752085.
[I 2026-04-24 17:14:35,803] Trial 78 finished with value: 0.1763590008689933 and parameters: {'alpha': 746304.9757950766, 'use_snp_selection': False, 'iw_method': 'pc_logistic', 'iw_clip_max': 3.0, 'iw_prob_clip': 0.008329550207185043, 'iw_n_components': 1, 'iw_logistic_c': 2.060165255352178e-05, 'iw_pca_fit': 'source', 'iw_solver': 'lbfgs', 'iw_rho': 1.0}. Best is trial 54 with value: 0.18374613567752085.
[I 2026-04-24 17:18:00,517] Trial 79 finished with value: 0.16836895279227462 and parameters: {'alpha': 2704712.999250163, 'use_snp_selection': False, 'iw_method': 'pc_logistic', 'iw_clip_max': 3.0, 'iw_prob_clip': 0.0071388547724543176, 'iw_n_components': 1, 'iw_logistic_c': 7.976201965073957e-05, 'iw_pca_fit': 'source', 'iw_solver': 'lbfgs', 'iw_rho': 1.0}. Best is trial 54 with value: 0.18374613567752085.
[I 2026-04-24 17:21:23,151] Trial 80 finished with value: 0.17181535614970675 and parameters: {'alpha': 1495389.1009345397, 'use_snp_selection': False, 'iw_method': 'pc_logistic', 'iw_clip_max': 3.0, 'iw_prob_clip': 0.008114415041052012, 'iw_n_components': 1, 'iw_logistic_c': 4.24691084200843e-05, 'iw_pca_fit': 'source', 'iw_solver': 'lbfgs', 'iw_rho': 1.0}. Best is trial 54 with value: 0.18374613567752085.
[I 2026-04-24 17:24:50,565] Trial 81 finished with value: 0.1801239444409011 and parameters: {'alpha': 298563.04809117346, 'use_snp_selection': False, 'iw_method': 'pc_logistic', 'iw_clip_max': 3.0, 'iw_prob_clip': 0.009823107655412146, 'iw_n_components': 1, 'iw_logistic_c': 2.1083457241732376e-05, 'iw_pca_fit': 'source', 'iw_solver': 'lbfgs', 'iw_rho': 1.0}. Best is trial 54 with value: 0.18374613567752085.
[I 2026-04-24 17:28:22,398] Trial 82 finished with value: 0.17981545565466167 and parameters: {'alpha': 345419.5991356602, 'use_snp_selection': False, 'iw_method': 'pc_logistic', 'iw_clip_max': 3.0, 'iw_prob_clip': 0.009712808822565522, 'iw_n_components': 1, 'iw_logistic_c': 1.9364126361750632e-05, 'iw_pca_fit': 'source', 'iw_solver': 'lbfgs', 'iw_rho': 1.0}. Best is trial 54 with value: 0.18374613567752085.
[I 2026-04-24 17:31:46,290] Trial 83 finished with value: 0.17955155436097578 and parameters: {'alpha': 369528.1191537097, 'use_snp_selection': False, 'iw_method': 'pc_logistic', 'iw_clip_max': 3.0, 'iw_prob_clip': 0.009635538757317293, 'iw_n_components': 1, 'iw_logistic_c': 2.1421407534262972e-05, 'iw_pca_fit': 'source', 'iw_solver': 'lbfgs', 'iw_rho': 1.0}. Best is trial 54 with value: 0.18374613567752085.
[I 2026-04-24 17:35:09,015] Trial 84 finished with value: 0.18036159566952153 and parameters: {'alpha': 198015.52771316288, 'use_snp_selection': False, 'iw_method': 'pc_logistic', 'iw_clip_max': 3.0, 'iw_prob_clip': 0.006401404425035581, 'iw_n_components': 1, 'iw_logistic_c': 3.690801291504503e-05, 'iw_pca_fit': 'source', 'iw_solver': 'lbfgs', 'iw_rho': 1.0}. Best is trial 54 with value: 0.18374613567752085.
[I 2026-04-24 17:38:37,263] Trial 85 finished with value: 0.1801766574849559 and parameters: {'alpha': 168317.03154284717, 'use_snp_selection': False, 'iw_method': 'pc_logistic', 'iw_clip_max': 3.0, 'iw_prob_clip': 0.006371189152433267, 'iw_n_components': 1, 'iw_logistic_c': 5.4139193326258734e-05, 'iw_pca_fit': 'source', 'iw_solver': 'lbfgs', 'iw_rho': 1.0}. Best is trial 54 with value: 0.18374613567752085.
[I 2026-04-24 17:42:05,264] Trial 86 finished with value: 0.17542910925272306 and parameters: {'alpha': 203611.813209235, 'use_snp_selection': False, 'iw_method': 'pc_logistic', 'iw_clip_max': 3.0, 'iw_prob_clip': 0.006280490886050148, 'iw_n_components': 2, 'iw_logistic_c': 6.559054637872156e-05, 'iw_pca_fit': 'source', 'iw_solver': 'lbfgs', 'iw_rho': 1.0}. Best is trial 54 with value: 0.18374613567752085.
[I 2026-04-24 17:45:29,758] Trial 87 finished with value: 0.12364457888269993 and parameters: {'alpha': 10.840867877618404, 'use_snp_selection': False, 'iw_method': 'pc_logistic', 'iw_clip_max': 3.0, 'iw_prob_clip': 0.00507768880813157, 'iw_n_components': 1, 'iw_logistic_c': 0.00013000243377785982, 'iw_pca_fit': 'source', 'iw_solver': 'lbfgs', 'iw_rho': 1.0}. Best is trial 54 with value: 0.18374613567752085.
[I 2026-04-24 17:48:55,173] Trial 88 finished with value: 0.16931815650041554 and parameters: {'alpha': 39565.13465999711, 'use_snp_selection': False, 'iw_method': 'pc_logistic', 'iw_clip_max': 5.0, 'iw_prob_clip': 0.006840098594659053, 'iw_n_components': 1, 'iw_logistic_c': 3.574455499302275e-05, 'iw_pca_fit': 'source', 'iw_solver': 'lbfgs', 'iw_rho': 1.0}. Best is trial 54 with value: 0.18374613567752085.
[I 2026-04-24 17:52:18,156] Trial 89 finished with value: 0.1548541182921236 and parameters: {'alpha': 13119.046468906234, 'use_snp_selection': False, 'iw_method': 'pc_logistic', 'iw_clip_max': 3.0, 'iw_prob_clip': 0.005778562041390604, 'iw_n_components': 1, 'iw_logistic_c': 5.7728707434143716e-05, 'iw_pca_fit': 'source', 'iw_solver': 'lbfgs', 'iw_rho': 1.0}. Best is trial 54 with value: 0.18374613567752085.
[I 2026-04-24 17:55:44,189] Trial 90 finished with value: 0.17830368482390574 and parameters: {'alpha': 524875.5028088735, 'use_snp_selection': False, 'iw_method': 'pc_logistic', 'iw_clip_max': 3.0, 'iw_prob_clip': 0.007023865269561558, 'iw_n_components': 1, 'iw_logistic_c': 1.7059570491256842e-05, 'iw_pca_fit': 'source', 'iw_solver': 'lbfgs', 'iw_rho': 1.0}. Best is trial 54 with value: 0.18374613567752085.
[I 2026-04-24 17:59:11,346] Trial 91 finished with value: 0.178535197812344 and parameters: {'alpha': 107703.32275393294, 'use_snp_selection': False, 'iw_method': 'pc_logistic', 'iw_clip_max': 3.0, 'iw_prob_clip': 0.006560240847989758, 'iw_n_components': 1, 'iw_logistic_c': 3.4753454098480725e-05, 'iw_pca_fit': 'source', 'iw_solver': 'lbfgs', 'iw_rho': 1.0}. Best is trial 54 with value: 0.18374613567752085.
[I 2026-04-24 18:02:31,312] Trial 92 finished with value: 0.18000902084795423 and parameters: {'alpha': 283260.79031130444, 'use_snp_selection': False, 'iw_method': 'pc_logistic', 'iw_clip_max': 3.0, 'iw_prob_clip': 0.007387499222196663, 'iw_n_components': 1, 'iw_logistic_c': 4.643616368090807e-05, 'iw_pca_fit': 'source', 'iw_solver': 'lbfgs', 'iw_rho': 1.0}. Best is trial 54 with value: 0.18374613567752085.
[I 2026-04-24 18:05:53,452] Trial 93 finished with value: 0.17995471298239366 and parameters: {'alpha': 277213.96706585446, 'use_snp_selection': False, 'iw_method': 'pc_logistic', 'iw_clip_max': 3.0, 'iw_prob_clip': 0.007434337068616975, 'iw_n_components': 1, 'iw_logistic_c': 6.686039206007983e-05, 'iw_pca_fit': 'source', 'iw_solver': 'lbfgs', 'iw_rho': 1.0}. Best is trial 54 with value: 0.18374613567752085.
[I 2026-04-24 18:09:23,773] Trial 94 finished with value: 0.18017526445643647 and parameters: {'alpha': 183335.25120041042, 'use_snp_selection': False, 'iw_method': 'pc_logistic', 'iw_clip_max': 3.0, 'iw_prob_clip': 0.007527022328781353, 'iw_n_components': 1, 'iw_logistic_c': 0.00011848669908161998, 'iw_pca_fit': 'source', 'iw_solver': 'lbfgs', 'iw_rho': 1.0}. Best is trial 54 with value: 0.18374613567752085.
[I 2026-04-24 18:13:00,640] Trial 95 finished with value: 0.17411355404786893 and parameters: {'alpha': 181921.4831822083, 'use_snp_selection': False, 'iw_method': 'pc_logistic', 'iw_clip_max': 3.0, 'iw_prob_clip': 0.006106679356706466, 'iw_n_components': 5, 'iw_logistic_c': 0.00017000937316730486, 'iw_pca_fit': 'source', 'iw_solver': 'lbfgs', 'iw_rho': 1.0}. Best is trial 54 with value: 0.18374613567752085.
[I 2026-04-24 18:16:23,389] Trial 96 finished with value: 0.1697161834925095 and parameters: {'alpha': 69026.94127234576, 'use_snp_selection': False, 'iw_method': 'pc_logistic', 'iw_clip_max': 3.0, 'iw_prob_clip': 0.0057058036813717955, 'iw_n_components': 1, 'iw_logistic_c': 0.0001084172060549557, 'iw_pca_fit': 'source', 'iw_solver': 'lbfgs', 'iw_rho': 0.1}. Best is trial 54 with value: 0.18374613567752085.
[I 2026-04-24 18:19:50,078] Trial 97 finished with value: 0.12378067962484858 and parameters: {'alpha': 29.19907121979103, 'use_snp_selection': False, 'iw_method': 'pc_logistic', 'iw_clip_max': 2.0, 'iw_prob_clip': 0.011962675248241786, 'iw_n_components': 2, 'iw_logistic_c': 8.37638344807338e-05, 'iw_pca_fit': 'source', 'iw_solver': 'lbfgs', 'iw_rho': 1.0}. Best is trial 54 with value: 0.18374613567752085.
[I 2026-04-24 18:23:32,469] Trial 98 finished with value: 0.1744497759228184 and parameters: {'alpha': 785387.9837739806, 'use_snp_selection': False, 'iw_method': 'pc_logistic', 'iw_clip_max': 10.0, 'iw_prob_clip': 0.007960061898978667, 'iw_n_components': 10, 'iw_logistic_c': 4.991711604250884e-05, 'iw_pca_fit': 'source', 'iw_solver': 'lbfgs', 'iw_rho': 0.5}. Best is trial 54 with value: 0.18374613567752085.
[I 2026-04-24 18:26:41,089] Trial 99 finished with value: 0.1719647965520053 and parameters: {'alpha': 45844.52088167456, 'use_snp_selection': False, 'iw_method': 'pc_logistic', 'iw_clip_max': 3.0, 'iw_prob_clip': 0.007534071085259487, 'iw_n_components': 1, 'iw_logistic_c': 0.018052680231810544, 'iw_pca_fit': 'source', 'iw_solver': 'lbfgs', 'iw_rho': 1.0}. Best is trial 54 with value: 0.18374613567752085.
