Running from this directory: /cluster/work/simennes/Master_thesis
Name of job: ncv_ridge_avggrm
ID of job: 24332645
Array task ID: 13
The job was run on these nodes: idun-03-08
[I 2026-04-22 13:51:11,557] Trial 0 finished with value: 0.15644903208873628 and parameters: {'alpha': 12124.394605078569, 'use_snp_selection': True, 'num_snps': 5442, 'weight_scheme': 'linear', 'weight_clip_max': 5.0, 'weight_linear_min_weight': 0.5849999641604302, 'weight_linear_max_weight': 1.017621356653175}. Best is trial 0 with value: 0.15644903208873628.
[I 2026-04-22 13:52:52,808] Trial 1 finished with value: 0.18933499268768766 and parameters: {'alpha': 109374.19486700959, 'use_snp_selection': True, 'num_snps': 25583, 'weight_scheme': 'minmax', 'weight_clip_max': 5.0, 'weight_minmax_eps': 0.14026014881292506}. Best is trial 1 with value: 0.18933499268768766.
[I 2026-04-22 13:55:16,299] Trial 2 finished with value: 0.1900842962179607 and parameters: {'alpha': 87498.4492964452, 'use_snp_selection': True, 'num_snps': 53815, 'weight_scheme': 'linear', 'weight_clip_max': 5.0, 'weight_linear_min_weight': 0.27089068881512934, 'weight_linear_max_weight': 2.0548794162981476}. Best is trial 2 with value: 0.1900842962179607.
[I 2026-04-22 13:56:14,471] Trial 3 finished with value: 0.19399199351211643 and parameters: {'alpha': 194477.78458557956, 'use_snp_selection': False, 'weight_scheme': 'linear', 'weight_clip_max': None, 'weight_linear_min_weight': 0.21922985165550554, 'weight_linear_max_weight': 1.6260435767424388}. Best is trial 3 with value: 0.19399199351211643.
[I 2026-04-22 13:57:12,790] Trial 4 finished with value: 0.17670621014350765 and parameters: {'alpha': 9421665.195468841, 'use_snp_selection': False, 'weight_scheme': 'minmax', 'weight_clip_max': 5.0, 'weight_minmax_eps': 0.030689801852077123}. Best is trial 3 with value: 0.19399199351211643.
[I 2026-04-22 13:58:29,686] Trial 5 finished with value: 0.14779189274787352 and parameters: {'alpha': 5024.251153421461, 'use_snp_selection': True, 'num_snps': 9046, 'weight_scheme': 'top-heavy', 'weight_clip_max': 10.0, 'weight_topheavy_top_frac': 0.08738114702774886, 'weight_topheavy_low': 0.8991910356358707, 'weight_topheavy_high': 2.2968843007908903}. Best is trial 3 with value: 0.19399199351211643.
[I 2026-04-22 13:59:17,901] Trial 6 finished with value: 0.13919987537479458 and parameters: {'alpha': 16.382429914774185, 'use_snp_selection': False, 'weight_scheme': 'uniform', 'weight_clip_max': 10.0}. Best is trial 3 with value: 0.19399199351211643.
[I 2026-04-22 14:01:32,268] Trial 7 finished with value: 0.1931791634289174 and parameters: {'alpha': 94169.1049689093, 'use_snp_selection': True, 'num_snps': 47654, 'weight_scheme': 'exponential', 'weight_clip_max': 10.0, 'weight_exponential_beta': 2.3870207999558124}. Best is trial 3 with value: 0.19399199351211643.
[I 2026-04-22 14:02:43,838] Trial 8 finished with value: 0.07346545116802215 and parameters: {'alpha': 96.38034897458088, 'use_snp_selection': True, 'num_snps': 5388, 'weight_scheme': 'minmax', 'weight_clip_max': None, 'weight_minmax_eps': 0.07791532902904205}. Best is trial 3 with value: 0.19399199351211643.
[I 2026-04-22 14:03:41,619] Trial 9 finished with value: 0.18318423241085552 and parameters: {'alpha': 2700506.792350819, 'use_snp_selection': False, 'weight_scheme': 'linear', 'weight_clip_max': 5.0, 'weight_linear_min_weight': 0.8693390069349902, 'weight_linear_max_weight': 2.1394245284712112}. Best is trial 3 with value: 0.19399199351211643.
[I 2026-04-22 14:04:28,497] Trial 10 finished with value: 0.1430517524069826 and parameters: {'alpha': 859.5702697532038, 'use_snp_selection': False, 'weight_scheme': 'uniform', 'weight_clip_max': None}. Best is trial 3 with value: 0.19399199351211643.
[I 2026-04-22 14:05:26,127] Trial 11 finished with value: 0.19732859878431608 and parameters: {'alpha': 409602.6639259898, 'use_snp_selection': False, 'weight_scheme': 'exponential', 'weight_clip_max': None, 'weight_exponential_beta': 1.976306722397911}. Best is trial 11 with value: 0.19732859878431608.
[I 2026-04-22 14:06:25,450] Trial 12 finished with value: 0.18519670895937715 and parameters: {'alpha': 680962.8765783042, 'use_snp_selection': False, 'weight_scheme': 'exponential', 'weight_clip_max': None, 'weight_exponential_beta': 0.14549224357588808}. Best is trial 11 with value: 0.19732859878431608.
[I 2026-04-22 14:07:24,221] Trial 13 finished with value: 0.16263330821445535 and parameters: {'alpha': 606844.9385713676, 'use_snp_selection': False, 'weight_scheme': 'exponential', 'weight_clip_max': None, 'weight_exponential_beta': 7.893036257468982}. Best is trial 11 with value: 0.19732859878431608.
[I 2026-04-22 14:08:22,235] Trial 14 finished with value: 0.1622192062917437 and parameters: {'alpha': 9623.523179910808, 'use_snp_selection': False, 'weight_scheme': 'top-heavy', 'weight_clip_max': None, 'weight_topheavy_top_frac': 0.4895739776974001, 'weight_topheavy_low': 0.5303602048894995, 'weight_topheavy_high': 5.909143202235775}. Best is trial 11 with value: 0.19732859878431608.
[I 2026-04-22 14:09:18,616] Trial 15 finished with value: 0.19519649574494247 and parameters: {'alpha': 715721.3874792199, 'use_snp_selection': False, 'weight_scheme': 'linear', 'weight_clip_max': None, 'weight_linear_min_weight': 0.14113035286925918, 'weight_linear_max_weight': 3.64355612642742}. Best is trial 11 with value: 0.19732859878431608.
[I 2026-04-22 14:10:17,087] Trial 16 finished with value: 0.18174916643604 and parameters: {'alpha': 2403105.9446239355, 'use_snp_selection': False, 'weight_scheme': 'exponential', 'weight_clip_max': None, 'weight_exponential_beta': 4.006553618932866}. Best is trial 11 with value: 0.19732859878431608.
[I 2026-04-22 14:11:16,118] Trial 17 finished with value: 0.17741052378106184 and parameters: {'alpha': 35136.64217601225, 'use_snp_selection': False, 'weight_scheme': 'exponential', 'weight_clip_max': None, 'weight_exponential_beta': 1.3022176600104531}. Best is trial 11 with value: 0.19732859878431608.
[I 2026-04-22 14:12:15,427] Trial 18 finished with value: 0.14573756784348027 and parameters: {'alpha': 1372.558621803536, 'use_snp_selection': False, 'weight_scheme': 'linear', 'weight_clip_max': None, 'weight_linear_min_weight': 0.13336618896534694, 'weight_linear_max_weight': 3.984486295912658}. Best is trial 11 with value: 0.19732859878431608.
[I 2026-04-22 14:13:02,248] Trial 19 finished with value: 0.1836637480804286 and parameters: {'alpha': 686558.4753828485, 'use_snp_selection': False, 'weight_scheme': 'uniform', 'weight_clip_max': None}. Best is trial 11 with value: 0.19732859878431608.
[I 2026-04-22 14:14:00,066] Trial 20 finished with value: 0.16854176855574582 and parameters: {'alpha': 9239144.019991277, 'use_snp_selection': False, 'weight_scheme': 'top-heavy', 'weight_clip_max': 10.0, 'weight_topheavy_top_frac': 0.3105689455947959, 'weight_topheavy_low': 1.1998104203775761, 'weight_topheavy_high': 4.8726329766710075}. Best is trial 11 with value: 0.19732859878431608.
[I 2026-04-22 14:14:58,893] Trial 21 finished with value: 0.19488194524262029 and parameters: {'alpha': 242226.0703956862, 'use_snp_selection': False, 'weight_scheme': 'linear', 'weight_clip_max': None, 'weight_linear_min_weight': 0.3237404288657081, 'weight_linear_max_weight': 3.9590881229398134}. Best is trial 11 with value: 0.19732859878431608.
[I 2026-04-22 14:15:56,047] Trial 22 finished with value: 0.19108201117500417 and parameters: {'alpha': 1502656.303562496, 'use_snp_selection': False, 'weight_scheme': 'linear', 'weight_clip_max': None, 'weight_linear_min_weight': 0.4321902038751166, 'weight_linear_max_weight': 3.8643154151318218}. Best is trial 11 with value: 0.19732859878431608.
[I 2026-04-22 14:16:53,367] Trial 23 finished with value: 0.19509777688570507 and parameters: {'alpha': 250455.24317934812, 'use_snp_selection': False, 'weight_scheme': 'linear', 'weight_clip_max': None, 'weight_linear_min_weight': 0.42746963966086127, 'weight_linear_max_weight': 3.1888253128154793}. Best is trial 11 with value: 0.19732859878431608.
[I 2026-04-22 14:17:50,499] Trial 24 finished with value: 0.17342584491919683 and parameters: {'alpha': 26057.673807564384, 'use_snp_selection': False, 'weight_scheme': 'linear', 'weight_clip_max': None, 'weight_linear_min_weight': 0.6045264404214132, 'weight_linear_max_weight': 3.105949424938981}. Best is trial 11 with value: 0.19732859878431608.
[I 2026-04-22 14:18:47,829] Trial 25 finished with value: 0.17357576325134855 and parameters: {'alpha': 620361.7687286027, 'use_snp_selection': False, 'weight_scheme': 'exponential', 'weight_clip_max': None, 'weight_exponential_beta': 6.083367043325115}. Best is trial 11 with value: 0.19732859878431608.
[I 2026-04-22 14:19:46,252] Trial 26 finished with value: 0.1841391963555211 and parameters: {'alpha': 3216779.4477701676, 'use_snp_selection': False, 'weight_scheme': 'linear', 'weight_clip_max': None, 'weight_linear_min_weight': 0.7787048221564035, 'weight_linear_max_weight': 3.0542139880758556}. Best is trial 11 with value: 0.19732859878431608.
[I 2026-04-22 14:20:45,537] Trial 27 finished with value: 0.17924590015939598 and parameters: {'alpha': 40875.15988444205, 'use_snp_selection': False, 'weight_scheme': 'linear', 'weight_clip_max': None, 'weight_linear_min_weight': 0.41636521989037334, 'weight_linear_max_weight': 3.252105493433519}. Best is trial 11 with value: 0.19732859878431608.
[I 2026-04-22 14:21:44,330] Trial 28 finished with value: 0.19227931254892533 and parameters: {'alpha': 325736.8198801494, 'use_snp_selection': False, 'weight_scheme': 'exponential', 'weight_clip_max': None, 'weight_exponential_beta': 3.46371412823932}. Best is trial 11 with value: 0.19732859878431608.
[I 2026-04-22 14:23:43,708] Trial 29 finished with value: 0.1376401857452009 and parameters: {'alpha': 1912.7580430981598, 'use_snp_selection': True, 'num_snps': 35465, 'weight_scheme': 'linear', 'weight_clip_max': 10.0, 'weight_linear_min_weight': 0.12711886047894355, 'weight_linear_max_weight': 3.4109613042842817}. Best is trial 11 with value: 0.19732859878431608.
[I 2026-04-22 14:24:30,237] Trial 30 finished with value: 0.16575637493137269 and parameters: {'alpha': 14614.574920098006, 'use_snp_selection': False, 'weight_scheme': 'uniform', 'weight_clip_max': 5.0}. Best is trial 11 with value: 0.19732859878431608.
[I 2026-04-22 14:25:28,225] Trial 31 finished with value: 0.19591382926011786 and parameters: {'alpha': 349312.00041644514, 'use_snp_selection': False, 'weight_scheme': 'linear', 'weight_clip_max': None, 'weight_linear_min_weight': 0.3520757180347046, 'weight_linear_max_weight': 3.732522237663184}. Best is trial 11 with value: 0.19732859878431608.
[I 2026-04-22 14:26:25,146] Trial 32 finished with value: 0.19060911578939996 and parameters: {'alpha': 1505119.4986403205, 'use_snp_selection': False, 'weight_scheme': 'linear', 'weight_clip_max': None, 'weight_linear_min_weight': 0.4260892252855162, 'weight_linear_max_weight': 2.798268529326844}. Best is trial 11 with value: 0.19732859878431608.
[I 2026-04-22 14:27:22,115] Trial 33 finished with value: 0.18795235483048012 and parameters: {'alpha': 89161.37727191306, 'use_snp_selection': False, 'weight_scheme': 'linear', 'weight_clip_max': None, 'weight_linear_min_weight': 0.2966819129547963, 'weight_linear_max_weight': 3.532184586438931}. Best is trial 11 with value: 0.19732859878431608.
[I 2026-04-22 14:29:02,380] Trial 34 finished with value: 0.19269669789190633 and parameters: {'alpha': 189454.6576174577, 'use_snp_selection': True, 'num_snps': 23670, 'weight_scheme': 'minmax', 'weight_clip_max': None, 'weight_minmax_eps': 0.19110140424105435}. Best is trial 11 with value: 0.19732859878431608.
[I 2026-04-22 14:30:00,332] Trial 35 finished with value: 0.1950390364389613 and parameters: {'alpha': 248156.18472127174, 'use_snp_selection': False, 'weight_scheme': 'linear', 'weight_clip_max': 5.0, 'weight_linear_min_weight': 0.5315524470901097, 'weight_linear_max_weight': 3.5252874785854256}. Best is trial 11 with value: 0.19732859878431608.
[I 2026-04-22 14:30:58,787] Trial 36 finished with value: 0.1930037163792444 and parameters: {'alpha': 1168062.047082014, 'use_snp_selection': False, 'weight_scheme': 'linear', 'weight_clip_max': None, 'weight_linear_min_weight': 0.19733617834825262, 'weight_linear_max_weight': 2.722629296022644}. Best is trial 11 with value: 0.19732859878431608.
[I 2026-04-22 14:33:05,059] Trial 37 finished with value: 0.1723904897020321 and parameters: {'alpha': 4302911.380655554, 'use_snp_selection': True, 'num_snps': 39811, 'weight_scheme': 'top-heavy', 'weight_clip_max': 5.0, 'weight_topheavy_top_frac': 0.1148785677311325, 'weight_topheavy_low': 0.5029807285243505, 'weight_topheavy_high': 1.3033046421274381}. Best is trial 11 with value: 0.19732859878431608.
[I 2026-04-22 14:34:02,346] Trial 38 finished with value: 0.1855929173344935 and parameters: {'alpha': 72766.48117577362, 'use_snp_selection': False, 'weight_scheme': 'minmax', 'weight_clip_max': None, 'weight_minmax_eps': 0.014698948990272478}. Best is trial 11 with value: 0.19732859878431608.
[I 2026-04-22 14:36:37,147] Trial 39 finished with value: 0.19629300179354925 and parameters: {'alpha': 400676.7787970515, 'use_snp_selection': True, 'num_snps': 59880, 'weight_scheme': 'linear', 'weight_clip_max': 10.0, 'weight_linear_min_weight': 0.353162023325118, 'weight_linear_max_weight': 3.616977926604428}. Best is trial 11 with value: 0.19732859878431608.
[I 2026-04-22 14:39:11,142] Trial 40 finished with value: 0.1914716617849159 and parameters: {'alpha': 118789.20564699688, 'use_snp_selection': True, 'num_snps': 57661, 'weight_scheme': 'linear', 'weight_clip_max': 10.0, 'weight_linear_min_weight': 0.3512421615912935, 'weight_linear_max_weight': 3.6788986465742504}. Best is trial 11 with value: 0.19732859878431608.
[I 2026-04-22 14:41:28,667] Trial 41 finished with value: 0.19748602231668771 and parameters: {'alpha': 365337.46072916477, 'use_snp_selection': True, 'num_snps': 44903, 'weight_scheme': 'linear', 'weight_clip_max': 10.0, 'weight_linear_min_weight': 0.5227250596434236, 'weight_linear_max_weight': 3.719222165505028}. Best is trial 41 with value: 0.19748602231668771.
[I 2026-04-22 14:43:50,667] Trial 42 finished with value: 0.19568092643693286 and parameters: {'alpha': 406489.9587679156, 'use_snp_selection': True, 'num_snps': 45860, 'weight_scheme': 'linear', 'weight_clip_max': 10.0, 'weight_linear_min_weight': 0.6976281379226237, 'weight_linear_max_weight': 3.6950451576446945}. Best is trial 41 with value: 0.19748602231668771.
[I 2026-04-22 14:46:10,708] Trial 43 finished with value: 0.1956178478407707 and parameters: {'alpha': 389535.8341665311, 'use_snp_selection': True, 'num_snps': 46753, 'weight_scheme': 'linear', 'weight_clip_max': 10.0, 'weight_linear_min_weight': 0.7456627420954725, 'weight_linear_max_weight': 3.6942799980403316}. Best is trial 41 with value: 0.19748602231668771.
[I 2026-04-22 14:48:49,779] Trial 44 finished with value: 0.1932441186879097 and parameters: {'alpha': 145270.24904520405, 'use_snp_selection': True, 'num_snps': 59514, 'weight_scheme': 'linear', 'weight_clip_max': 10.0, 'weight_linear_min_weight': 0.5292508289215875, 'weight_linear_max_weight': 3.3392677315643975}. Best is trial 41 with value: 0.19748602231668771.
[I 2026-04-22 14:51:12,796] Trial 45 finished with value: 0.1843882806296362 and parameters: {'alpha': 46641.55820356307, 'use_snp_selection': True, 'num_snps': 48064, 'weight_scheme': 'exponential', 'weight_clip_max': 10.0, 'weight_exponential_beta': 5.475182944074173}. Best is trial 41 with value: 0.19748602231668771.
[I 2026-04-22 14:53:24,607] Trial 46 finished with value: 0.18126530665752985 and parameters: {'alpha': 6253946.637288832, 'use_snp_selection': True, 'num_snps': 39598, 'weight_scheme': 'minmax', 'weight_clip_max': 10.0, 'weight_minmax_eps': 0.10832895679949092}. Best is trial 41 with value: 0.19748602231668771.
[I 2026-04-22 14:55:47,872] Trial 47 finished with value: 0.17875490882143563 and parameters: {'alpha': 1252167.4225808268, 'use_snp_selection': True, 'num_snps': 52396, 'weight_scheme': 'uniform', 'weight_clip_max': 10.0}. Best is trial 41 with value: 0.19748602231668771.
[I 2026-04-22 14:58:02,202] Trial 48 finished with value: 0.13034601478780528 and parameters: {'alpha': 172.10007316219696, 'use_snp_selection': True, 'num_snps': 42485, 'weight_scheme': 'linear', 'weight_clip_max': 10.0, 'weight_linear_min_weight': 0.6636933000308574, 'weight_linear_max_weight': 3.7185009101771067}. Best is trial 41 with value: 0.19748602231668771.
[I 2026-04-22 14:59:54,277] Trial 49 finished with value: 0.18500168016128174 and parameters: {'alpha': 442854.57936400885, 'use_snp_selection': True, 'num_snps': 29090, 'weight_scheme': 'top-heavy', 'weight_clip_max': 10.0, 'weight_topheavy_top_frac': 0.4950105481883528, 'weight_topheavy_low': 0.8520166705541058, 'weight_topheavy_high': 3.5158582773723506}. Best is trial 41 with value: 0.19748602231668771.
[I 2026-04-22 15:02:26,440] Trial 50 finished with value: 0.1581440404521687 and parameters: {'alpha': 5470.884070411491, 'use_snp_selection': True, 'num_snps': 53651, 'weight_scheme': 'exponential', 'weight_clip_max': 10.0, 'weight_exponential_beta': 1.6733779194803589}. Best is trial 41 with value: 0.19748602231668771.
[I 2026-04-22 15:04:44,890] Trial 51 finished with value: 0.19584390788631778 and parameters: {'alpha': 405253.6084280316, 'use_snp_selection': True, 'num_snps': 46359, 'weight_scheme': 'linear', 'weight_clip_max': 10.0, 'weight_linear_min_weight': 0.7240360113226458, 'weight_linear_max_weight': 3.8156184409280494}. Best is trial 41 with value: 0.19748602231668771.
[I 2026-04-22 15:07:00,399] Trial 52 finished with value: 0.186427214871426 and parameters: {'alpha': 2166414.5221738364, 'use_snp_selection': True, 'num_snps': 44554, 'weight_scheme': 'linear', 'weight_clip_max': 10.0, 'weight_linear_min_weight': 0.7136015288879777, 'weight_linear_max_weight': 3.995697308442444}. Best is trial 41 with value: 0.19748602231668771.
[I 2026-04-22 15:09:04,313] Trial 53 finished with value: 0.18693864431725335 and parameters: {'alpha': 60812.17083616869, 'use_snp_selection': True, 'num_snps': 35596, 'weight_scheme': 'linear', 'weight_clip_max': 10.0, 'weight_linear_min_weight': 0.8753402991357293, 'weight_linear_max_weight': 3.800134556657997}. Best is trial 41 with value: 0.19748602231668771.
[I 2026-04-22 15:11:30,804] Trial 54 finished with value: 0.1894556716656396 and parameters: {'alpha': 1010111.0301836837, 'use_snp_selection': True, 'num_snps': 50367, 'weight_scheme': 'linear', 'weight_clip_max': 10.0, 'weight_linear_min_weight': 0.981354412053608, 'weight_linear_max_weight': 3.402049749885259}. Best is trial 41 with value: 0.19748602231668771.
[I 2026-04-22 15:14:09,455] Trial 55 finished with value: 0.19286651004711883 and parameters: {'alpha': 159448.22526475316, 'use_snp_selection': True, 'num_snps': 56152, 'weight_scheme': 'linear', 'weight_clip_max': 10.0, 'weight_linear_min_weight': 0.653000850793325, 'weight_linear_max_weight': 3.5496045380388352}. Best is trial 41 with value: 0.19748602231668771.
[I 2026-04-22 15:16:19,491] Trial 56 finished with value: 0.19920788348982438 and parameters: {'alpha': 476855.06662442593, 'use_snp_selection': True, 'num_snps': 40955, 'weight_scheme': 'exponential', 'weight_clip_max': 10.0, 'weight_exponential_beta': 2.8985486846757613}. Best is trial 56 with value: 0.19920788348982438.
[I 2026-04-22 15:18:28,233] Trial 57 finished with value: 0.17592263947533165 and parameters: {'alpha': 22182.8771529005, 'use_snp_selection': True, 'num_snps': 40092, 'weight_scheme': 'exponential', 'weight_clip_max': 10.0, 'weight_exponential_beta': 2.891954682535273}. Best is trial 56 with value: 0.19920788348982438.
[I 2026-04-22 15:20:29,627] Trial 58 finished with value: 0.1799566576276833 and parameters: {'alpha': 2167927.790931173, 'use_snp_selection': True, 'num_snps': 34924, 'weight_scheme': 'exponential', 'weight_clip_max': 10.0, 'weight_exponential_beta': 5.0546394609701295}. Best is trial 56 with value: 0.19920788348982438.
[I 2026-04-22 15:22:43,898] Trial 59 finished with value: 0.1306256498496678 and parameters: {'alpha': 15.415622086295848, 'use_snp_selection': True, 'num_snps': 42963, 'weight_scheme': 'exponential', 'weight_clip_max': 5.0, 'weight_exponential_beta': 0.18259346825924427}. Best is trial 56 with value: 0.19920788348982438.
[I 2026-04-22 15:24:40,663] Trial 60 finished with value: 0.19352316162179173 and parameters: {'alpha': 822586.4582702639, 'use_snp_selection': True, 'num_snps': 30525, 'weight_scheme': 'exponential', 'weight_clip_max': 10.0, 'weight_exponential_beta': 1.8883254422485138}. Best is trial 56 with value: 0.19920788348982438.
[I 2026-04-22 15:27:08,105] Trial 61 finished with value: 0.1956014891169016 and parameters: {'alpha': 531093.9866769948, 'use_snp_selection': True, 'num_snps': 49891, 'weight_scheme': 'linear', 'weight_clip_max': 10.0, 'weight_linear_min_weight': 0.499562331094077, 'weight_linear_max_weight': 3.741306283596302}. Best is trial 56 with value: 0.19920788348982438.
[I 2026-04-22 15:29:25,342] Trial 62 finished with value: 0.197639375692277 and parameters: {'alpha': 315871.5486304037, 'use_snp_selection': True, 'num_snps': 44501, 'weight_scheme': 'exponential', 'weight_clip_max': 10.0, 'weight_exponential_beta': 3.2255541988579486}. Best is trial 56 with value: 0.19920788348982438.
[I 2026-04-22 15:31:27,814] Trial 63 finished with value: 0.19752013994957324 and parameters: {'alpha': 263926.2583903764, 'use_snp_selection': True, 'num_snps': 37746, 'weight_scheme': 'exponential', 'weight_clip_max': 10.0, 'weight_exponential_beta': 3.016625970062938}. Best is trial 56 with value: 0.19920788348982438.
