Running from this directory: /cluster/work/simennes/Master_thesis
Name of job: ncv_ridge_avggrm
ID of job: 24332636
Array task ID: 4
The job was run on these nodes: idun-04-31
[I 2026-04-22 13:51:15,100] Trial 0 finished with value: 0.137570256970403 and parameters: {'alpha': 12124.394605078569, 'use_snp_selection': True, 'num_snps': 5442, 'weight_scheme': 'linear', 'weight_clip_max': 5.0, 'weight_linear_min_weight': 0.5849999641604302, 'weight_linear_max_weight': 1.017621356653175}. Best is trial 0 with value: 0.137570256970403.
[I 2026-04-22 13:53:00,970] Trial 1 finished with value: 0.17818385776835627 and parameters: {'alpha': 109374.19486700959, 'use_snp_selection': True, 'num_snps': 25583, 'weight_scheme': 'minmax', 'weight_clip_max': 5.0, 'weight_minmax_eps': 0.14026014881292506}. Best is trial 1 with value: 0.17818385776835627.
[I 2026-04-22 13:55:31,824] Trial 2 finished with value: 0.18051726553294326 and parameters: {'alpha': 87498.4492964452, 'use_snp_selection': True, 'num_snps': 53815, 'weight_scheme': 'linear', 'weight_clip_max': 5.0, 'weight_linear_min_weight': 0.27089068881512934, 'weight_linear_max_weight': 2.0548794162981476}. Best is trial 2 with value: 0.18051726553294326.
[I 2026-04-22 13:56:34,024] Trial 3 finished with value: 0.18466129233762363 and parameters: {'alpha': 194477.78458557956, 'use_snp_selection': False, 'weight_scheme': 'linear', 'weight_clip_max': None, 'weight_linear_min_weight': 0.21922985165550554, 'weight_linear_max_weight': 1.6260435767424388}. Best is trial 3 with value: 0.18466129233762363.
[I 2026-04-22 13:57:35,479] Trial 4 finished with value: 0.17072439707405923 and parameters: {'alpha': 9421665.195468841, 'use_snp_selection': False, 'weight_scheme': 'minmax', 'weight_clip_max': 5.0, 'weight_minmax_eps': 0.030689801852077123}. Best is trial 3 with value: 0.18466129233762363.
[I 2026-04-22 13:58:58,726] Trial 5 finished with value: 0.14704856200830657 and parameters: {'alpha': 5024.251153421461, 'use_snp_selection': True, 'num_snps': 9046, 'weight_scheme': 'top-heavy', 'weight_clip_max': 10.0, 'weight_topheavy_top_frac': 0.08738114702774886, 'weight_topheavy_low': 0.8991910356358707, 'weight_topheavy_high': 2.2968843007908903}. Best is trial 3 with value: 0.18466129233762363.
[I 2026-04-22 13:59:48,737] Trial 6 finished with value: 0.1226871563177104 and parameters: {'alpha': 16.382429914774185, 'use_snp_selection': False, 'weight_scheme': 'uniform', 'weight_clip_max': 10.0}. Best is trial 3 with value: 0.18466129233762363.
[I 2026-04-22 14:02:12,080] Trial 7 finished with value: 0.18247153833312826 and parameters: {'alpha': 94169.1049689093, 'use_snp_selection': True, 'num_snps': 47654, 'weight_scheme': 'exponential', 'weight_clip_max': 10.0, 'weight_exponential_beta': 2.3870207999558124}. Best is trial 3 with value: 0.18466129233762363.
[I 2026-04-22 14:03:29,003] Trial 8 finished with value: 0.025254750107016822 and parameters: {'alpha': 96.38034897458088, 'use_snp_selection': True, 'num_snps': 5388, 'weight_scheme': 'minmax', 'weight_clip_max': None, 'weight_minmax_eps': 0.07791532902904205}. Best is trial 3 with value: 0.18466129233762363.
[I 2026-04-22 14:04:31,755] Trial 9 finished with value: 0.1737609213744526 and parameters: {'alpha': 2700506.792350819, 'use_snp_selection': False, 'weight_scheme': 'linear', 'weight_clip_max': 5.0, 'weight_linear_min_weight': 0.8693390069349902, 'weight_linear_max_weight': 2.1394245284712112}. Best is trial 3 with value: 0.18466129233762363.
[I 2026-04-22 14:05:22,903] Trial 10 finished with value: 0.12693435265300593 and parameters: {'alpha': 859.5702697532038, 'use_snp_selection': False, 'weight_scheme': 'uniform', 'weight_clip_max': None}. Best is trial 3 with value: 0.18466129233762363.
[I 2026-04-22 14:06:25,360] Trial 11 finished with value: 0.18740141983407127 and parameters: {'alpha': 409602.6639259898, 'use_snp_selection': False, 'weight_scheme': 'exponential', 'weight_clip_max': None, 'weight_exponential_beta': 1.976306722397911}. Best is trial 11 with value: 0.18740141983407127.
[I 2026-04-22 14:07:27,691] Trial 12 finished with value: 0.17457410628865175 and parameters: {'alpha': 680962.8765783042, 'use_snp_selection': False, 'weight_scheme': 'exponential', 'weight_clip_max': None, 'weight_exponential_beta': 0.14549224357588808}. Best is trial 11 with value: 0.18740141983407127.
[I 2026-04-22 14:08:29,706] Trial 13 finished with value: 0.15574523995592757 and parameters: {'alpha': 606844.9385713676, 'use_snp_selection': False, 'weight_scheme': 'exponential', 'weight_clip_max': None, 'weight_exponential_beta': 7.893036257468982}. Best is trial 11 with value: 0.18740141983407127.
[I 2026-04-22 14:09:31,760] Trial 14 finished with value: 0.14880022333118825 and parameters: {'alpha': 9623.523179910808, 'use_snp_selection': False, 'weight_scheme': 'top-heavy', 'weight_clip_max': None, 'weight_topheavy_top_frac': 0.4895739776974001, 'weight_topheavy_low': 0.5303602048894995, 'weight_topheavy_high': 5.909143202235775}. Best is trial 11 with value: 0.18740141983407127.
[I 2026-04-22 14:10:35,012] Trial 15 finished with value: 0.1862478412497956 and parameters: {'alpha': 715721.3874792199, 'use_snp_selection': False, 'weight_scheme': 'linear', 'weight_clip_max': None, 'weight_linear_min_weight': 0.14113035286925918, 'weight_linear_max_weight': 3.64355612642742}. Best is trial 11 with value: 0.18740141983407127.
[I 2026-04-22 14:11:36,210] Trial 16 finished with value: 0.17322477139100062 and parameters: {'alpha': 2403105.9446239355, 'use_snp_selection': False, 'weight_scheme': 'exponential', 'weight_clip_max': None, 'weight_exponential_beta': 4.006553618932866}. Best is trial 11 with value: 0.18740141983407127.
[I 2026-04-22 14:12:39,666] Trial 17 finished with value: 0.16722357940243449 and parameters: {'alpha': 35136.64217601225, 'use_snp_selection': False, 'weight_scheme': 'exponential', 'weight_clip_max': None, 'weight_exponential_beta': 1.3022176600104531}. Best is trial 11 with value: 0.18740141983407127.
[I 2026-04-22 14:13:41,648] Trial 18 finished with value: 0.1301763591135136 and parameters: {'alpha': 1372.558621803536, 'use_snp_selection': False, 'weight_scheme': 'linear', 'weight_clip_max': None, 'weight_linear_min_weight': 0.13336618896534694, 'weight_linear_max_weight': 3.984486295912658}. Best is trial 11 with value: 0.18740141983407127.
[I 2026-04-22 14:14:31,962] Trial 19 finished with value: 0.17298889076161456 and parameters: {'alpha': 686558.4753828485, 'use_snp_selection': False, 'weight_scheme': 'uniform', 'weight_clip_max': None}. Best is trial 11 with value: 0.18740141983407127.
[I 2026-04-22 14:15:34,449] Trial 20 finished with value: 0.16367246576289574 and parameters: {'alpha': 9239144.019991277, 'use_snp_selection': False, 'weight_scheme': 'top-heavy', 'weight_clip_max': 10.0, 'weight_topheavy_top_frac': 0.3105689455947959, 'weight_topheavy_low': 1.1998104203775761, 'weight_topheavy_high': 4.8726329766710075}. Best is trial 11 with value: 0.18740141983407127.
[I 2026-04-22 14:16:35,432] Trial 21 finished with value: 0.1856698404771045 and parameters: {'alpha': 242226.0703956862, 'use_snp_selection': False, 'weight_scheme': 'linear', 'weight_clip_max': None, 'weight_linear_min_weight': 0.3237404288657081, 'weight_linear_max_weight': 3.9590881229398134}. Best is trial 11 with value: 0.18740141983407127.
[I 2026-04-22 14:17:36,372] Trial 22 finished with value: 0.1824701417628561 and parameters: {'alpha': 1502656.303562496, 'use_snp_selection': False, 'weight_scheme': 'linear', 'weight_clip_max': None, 'weight_linear_min_weight': 0.4321902038751166, 'weight_linear_max_weight': 3.8643154151318218}. Best is trial 11 with value: 0.18740141983407127.
[I 2026-04-22 14:18:37,273] Trial 23 finished with value: 0.18566237540386057 and parameters: {'alpha': 250455.24317934812, 'use_snp_selection': False, 'weight_scheme': 'linear', 'weight_clip_max': None, 'weight_linear_min_weight': 0.42746963966086127, 'weight_linear_max_weight': 3.1888253128154793}. Best is trial 11 with value: 0.18740141983407127.
[I 2026-04-22 14:19:39,556] Trial 24 finished with value: 0.16356037527965644 and parameters: {'alpha': 26123.769454513407, 'use_snp_selection': False, 'weight_scheme': 'linear', 'weight_clip_max': None, 'weight_linear_min_weight': 0.10858513812770607, 'weight_linear_max_weight': 3.1686351735319507}. Best is trial 11 with value: 0.18740141983407127.
[I 2026-04-22 14:20:41,169] Trial 25 finished with value: 0.16563668604394813 and parameters: {'alpha': 610372.0237945298, 'use_snp_selection': False, 'weight_scheme': 'exponential', 'weight_clip_max': None, 'weight_exponential_beta': 6.083367043325115}. Best is trial 11 with value: 0.18740141983407127.
[I 2026-04-22 14:21:42,898] Trial 26 finished with value: 0.1779488759634081 and parameters: {'alpha': 3170562.5089928084, 'use_snp_selection': False, 'weight_scheme': 'linear', 'weight_clip_max': None, 'weight_linear_min_weight': 0.3690991414990106, 'weight_linear_max_weight': 3.2477716201001714}. Best is trial 11 with value: 0.18740141983407127.
[I 2026-04-22 14:22:44,738] Trial 27 finished with value: 0.16943872988295394 and parameters: {'alpha': 40875.15988444205, 'use_snp_selection': False, 'weight_scheme': 'linear', 'weight_clip_max': None, 'weight_linear_min_weight': 0.6263504192909412, 'weight_linear_max_weight': 3.5578250785600303}. Best is trial 11 with value: 0.18740141983407127.
[I 2026-04-22 14:23:44,389] Trial 28 finished with value: 0.18313943875037395 and parameters: {'alpha': 321247.9722042909, 'use_snp_selection': False, 'weight_scheme': 'exponential', 'weight_clip_max': None, 'weight_exponential_beta': 3.46371412823932}. Best is trial 11 with value: 0.18740141983407127.
[I 2026-04-22 14:25:48,978] Trial 29 finished with value: 0.15625735781963632 and parameters: {'alpha': 10501.131189073287, 'use_snp_selection': True, 'num_snps': 35465, 'weight_scheme': 'linear', 'weight_clip_max': 10.0, 'weight_linear_min_weight': 0.29664260046200647, 'weight_linear_max_weight': 2.6271200152203913}. Best is trial 11 with value: 0.18740141983407127.
[I 2026-04-22 14:26:38,721] Trial 30 finished with value: 0.13551289005682318 and parameters: {'alpha': 3295.069087306639, 'use_snp_selection': False, 'weight_scheme': 'uniform', 'weight_clip_max': 5.0}. Best is trial 11 with value: 0.18740141983407127.
[I 2026-04-22 14:27:40,725] Trial 31 finished with value: 0.18630720171915546 and parameters: {'alpha': 349312.00041644514, 'use_snp_selection': False, 'weight_scheme': 'linear', 'weight_clip_max': None, 'weight_linear_min_weight': 0.4279846476099573, 'weight_linear_max_weight': 3.107516918965431}. Best is trial 11 with value: 0.18740141983407127.
[I 2026-04-22 14:28:42,246] Trial 32 finished with value: 0.1820132533194699 and parameters: {'alpha': 1505119.4986403205, 'use_snp_selection': False, 'weight_scheme': 'linear', 'weight_clip_max': None, 'weight_linear_min_weight': 0.5006553508322841, 'weight_linear_max_weight': 3.5820135952761483}. Best is trial 11 with value: 0.18740141983407127.
[I 2026-04-22 14:29:42,148] Trial 33 finished with value: 0.1828251745076587 and parameters: {'alpha': 141350.61037619092, 'use_snp_selection': False, 'weight_scheme': 'linear', 'weight_clip_max': None, 'weight_linear_min_weight': 0.27298033130700794, 'weight_linear_max_weight': 2.8884759645725087}. Best is trial 11 with value: 0.18740141983407127.
[I 2026-04-22 14:31:28,757] Trial 34 finished with value: 0.17500967605539108 and parameters: {'alpha': 64831.47086435599, 'use_snp_selection': True, 'num_snps': 23670, 'weight_scheme': 'minmax', 'weight_clip_max': None, 'weight_minmax_eps': 0.19110140424105435}. Best is trial 11 with value: 0.18740141983407127.
[I 2026-04-22 14:32:28,828] Trial 35 finished with value: 0.18507864453606096 and parameters: {'alpha': 248156.18472127174, 'use_snp_selection': False, 'weight_scheme': 'linear', 'weight_clip_max': 5.0, 'weight_linear_min_weight': 0.7661648678516985, 'weight_linear_max_weight': 3.5579359367127625}. Best is trial 11 with value: 0.18740141983407127.
[I 2026-04-22 14:33:28,828] Trial 36 finished with value: 0.18453042372111128 and parameters: {'alpha': 1168062.047082014, 'use_snp_selection': False, 'weight_scheme': 'linear', 'weight_clip_max': None, 'weight_linear_min_weight': 0.185969392771271, 'weight_linear_max_weight': 3.9805052518252655}. Best is trial 11 with value: 0.18740141983407127.
[I 2026-04-22 14:35:41,004] Trial 37 finished with value: 0.16162607938744414 and parameters: {'alpha': 4302911.380655554, 'use_snp_selection': True, 'num_snps': 39811, 'weight_scheme': 'top-heavy', 'weight_clip_max': 5.0, 'weight_topheavy_top_frac': 0.1148785677311325, 'weight_topheavy_low': 0.5029807285243505, 'weight_topheavy_high': 1.3033046421274381}. Best is trial 11 with value: 0.18740141983407127.
[I 2026-04-22 14:36:39,665] Trial 38 finished with value: 0.18646586174569016 and parameters: {'alpha': 383114.7856058847, 'use_snp_selection': False, 'weight_scheme': 'minmax', 'weight_clip_max': None, 'weight_minmax_eps': 0.014698948990272478}. Best is trial 11 with value: 0.18740141983407127.
[I 2026-04-22 14:39:22,991] Trial 39 finished with value: 0.17937714362534113 and parameters: {'alpha': 86328.17833647116, 'use_snp_selection': True, 'num_snps': 59880, 'weight_scheme': 'minmax', 'weight_clip_max': 10.0, 'weight_minmax_eps': 0.00750812199949786}. Best is trial 11 with value: 0.18740141983407127.
[I 2026-04-22 14:40:21,563] Trial 40 finished with value: 0.175153270731212 and parameters: {'alpha': 5648067.988858254, 'use_snp_selection': False, 'weight_scheme': 'minmax', 'weight_clip_max': None, 'weight_minmax_eps': 0.07089824784925916}. Best is trial 11 with value: 0.18740141983407127.
[I 2026-04-22 14:41:20,620] Trial 41 finished with value: 0.18578656790208553 and parameters: {'alpha': 262030.1484590376, 'use_snp_selection': False, 'weight_scheme': 'minmax', 'weight_clip_max': None, 'weight_minmax_eps': 0.036714710213079926}. Best is trial 11 with value: 0.18740141983407127.
[I 2026-04-22 14:42:19,398] Trial 42 finished with value: 0.18643448000181778 and parameters: {'alpha': 339132.86558761646, 'use_snp_selection': False, 'weight_scheme': 'minmax', 'weight_clip_max': None, 'weight_minmax_eps': 0.03524034357271849}. Best is trial 11 with value: 0.18740141983407127.
[I 2026-04-22 14:43:18,207] Trial 43 finished with value: 0.18649248304578547 and parameters: {'alpha': 467288.9559049154, 'use_snp_selection': False, 'weight_scheme': 'minmax', 'weight_clip_max': None, 'weight_minmax_eps': 0.003233499024766979}. Best is trial 11 with value: 0.18740141983407127.
[I 2026-04-22 14:44:16,880] Trial 44 finished with value: 0.16059065694049712 and parameters: {'alpha': 20682.838060563034, 'use_snp_selection': False, 'weight_scheme': 'minmax', 'weight_clip_max': None, 'weight_minmax_eps': 0.00046182658871165086}. Best is trial 11 with value: 0.18740141983407127.
[I 2026-04-22 14:45:15,520] Trial 45 finished with value: 0.18252757681794113 and parameters: {'alpha': 139124.82830282566, 'use_snp_selection': False, 'weight_scheme': 'minmax', 'weight_clip_max': None, 'weight_minmax_eps': 0.037748506205913995}. Best is trial 11 with value: 0.18740141983407127.
[I 2026-04-22 14:46:14,360] Trial 46 finished with value: 0.1853449898531662 and parameters: {'alpha': 446476.4882725509, 'use_snp_selection': False, 'weight_scheme': 'minmax', 'weight_clip_max': 5.0, 'weight_minmax_eps': 0.006010023571958926}. Best is trial 11 with value: 0.18740141983407127.
[I 2026-04-22 14:47:12,840] Trial 47 finished with value: 0.123342943144253 and parameters: {'alpha': 111.12678645750782, 'use_snp_selection': False, 'weight_scheme': 'minmax', 'weight_clip_max': 10.0, 'weight_minmax_eps': 0.055347544099442425}. Best is trial 11 with value: 0.18740141983407127.
[I 2026-04-22 14:48:47,595] Trial 48 finished with value: 0.17351883575381344 and parameters: {'alpha': 53182.65378947726, 'use_snp_selection': True, 'num_snps': 17348, 'weight_scheme': 'minmax', 'weight_clip_max': None, 'weight_minmax_eps': 0.11529480300759642}. Best is trial 11 with value: 0.18740141983407127.
[I 2026-04-22 14:49:46,584] Trial 49 finished with value: 0.18072473405934977 and parameters: {'alpha': 111122.81711091154, 'use_snp_selection': False, 'weight_scheme': 'minmax', 'weight_clip_max': None, 'weight_minmax_eps': 0.025493421591508206}. Best is trial 11 with value: 0.18740141983407127.
[I 2026-04-22 14:50:46,836] Trial 50 finished with value: 0.18453406402176706 and parameters: {'alpha': 1143124.1395922157, 'use_snp_selection': False, 'weight_scheme': 'minmax', 'weight_clip_max': None, 'weight_minmax_eps': 0.062289671904660976}. Best is trial 11 with value: 0.18740141983407127.
[I 2026-04-22 14:51:46,692] Trial 51 finished with value: 0.16730403564918153 and parameters: {'alpha': 815887.9540139764, 'use_snp_selection': False, 'weight_scheme': 'exponential', 'weight_clip_max': None, 'weight_exponential_beta': 5.417600360230543}. Best is trial 11 with value: 0.18740141983407127.
[I 2026-04-22 14:52:45,350] Trial 52 finished with value: 0.18668487861413796 and parameters: {'alpha': 439991.2318205102, 'use_snp_selection': False, 'weight_scheme': 'minmax', 'weight_clip_max': None, 'weight_minmax_eps': 0.09912429820482895}. Best is trial 11 with value: 0.18740141983407127.
[I 2026-04-22 14:53:44,035] Trial 53 finished with value: 0.18662466769324448 and parameters: {'alpha': 455008.19484593056, 'use_snp_selection': False, 'weight_scheme': 'minmax', 'weight_clip_max': None, 'weight_minmax_eps': 0.11121352661463647}. Best is trial 11 with value: 0.18740141983407127.
[I 2026-04-22 14:54:43,447] Trial 54 finished with value: 0.18067545191110618 and parameters: {'alpha': 2107565.0473754304, 'use_snp_selection': False, 'weight_scheme': 'minmax', 'weight_clip_max': None, 'weight_minmax_eps': 0.10912222173401365}. Best is trial 11 with value: 0.18740141983407127.
[I 2026-04-22 14:55:43,446] Trial 55 finished with value: 0.18648061529281215 and parameters: {'alpha': 447156.6517366076, 'use_snp_selection': False, 'weight_scheme': 'minmax', 'weight_clip_max': None, 'weight_minmax_eps': 0.13876583020112282}. Best is trial 11 with value: 0.18740141983407127.
[I 2026-04-22 14:56:43,300] Trial 56 finished with value: 0.1836094166050371 and parameters: {'alpha': 159407.59698351574, 'use_snp_selection': False, 'weight_scheme': 'minmax', 'weight_clip_max': None, 'weight_minmax_eps': 0.13253188774244595}. Best is trial 11 with value: 0.18740141983407127.
[I 2026-04-22 14:57:42,596] Trial 57 finished with value: 0.18627541282471732 and parameters: {'alpha': 491457.19664576347, 'use_snp_selection': False, 'weight_scheme': 'minmax', 'weight_clip_max': None, 'weight_minmax_eps': 0.15807160255799474}. Best is trial 11 with value: 0.18740141983407127.
[I 2026-04-22 14:58:41,550] Trial 58 finished with value: 0.18481806318916016 and parameters: {'alpha': 1014459.0819620454, 'use_snp_selection': False, 'weight_scheme': 'minmax', 'weight_clip_max': 10.0, 'weight_minmax_eps': 0.09063317677886518}. Best is trial 11 with value: 0.18740141983407127.
[I 2026-04-22 14:59:29,489] Trial 59 finished with value: 0.16699815246829347 and parameters: {'alpha': 1951808.2550257244, 'use_snp_selection': False, 'weight_scheme': 'uniform', 'weight_clip_max': None}. Best is trial 11 with value: 0.18740141983407127.
[I 2026-04-22 15:00:28,363] Trial 60 finished with value: 0.17844054472481385 and parameters: {'alpha': 7510970.916866116, 'use_snp_selection': False, 'weight_scheme': 'exponential', 'weight_clip_max': None, 'weight_exponential_beta': 2.064005199408718}. Best is trial 11 with value: 0.18740141983407127.
[I 2026-04-22 15:01:27,206] Trial 61 finished with value: 0.18653846093965706 and parameters: {'alpha': 415555.67682788614, 'use_snp_selection': False, 'weight_scheme': 'minmax', 'weight_clip_max': None, 'weight_minmax_eps': 0.1314382961442194}. Best is trial 11 with value: 0.18740141983407127.
[I 2026-04-22 15:02:26,099] Trial 62 finished with value: 0.1864431566254682 and parameters: {'alpha': 496631.8786035028, 'use_snp_selection': False, 'weight_scheme': 'minmax', 'weight_clip_max': None, 'weight_minmax_eps': 0.13227518709560263}. Best is trial 11 with value: 0.18740141983407127.
[I 2026-04-22 15:03:24,835] Trial 63 finished with value: 0.18013723121097955 and parameters: {'alpha': 101689.13974312053, 'use_snp_selection': False, 'weight_scheme': 'minmax', 'weight_clip_max': None, 'weight_minmax_eps': 0.16220655761453112}. Best is trial 11 with value: 0.18740141983407127.
[I 2026-04-22 15:04:23,617] Trial 64 finished with value: 0.1802572255264612 and parameters: {'alpha': 183827.0264492664, 'use_snp_selection': False, 'weight_scheme': 'top-heavy', 'weight_clip_max': None, 'weight_topheavy_top_frac': 0.48653420412764237, 'weight_topheavy_low': 0.8618030639892897, 'weight_topheavy_high': 3.389663536372818}. Best is trial 11 with value: 0.18740141983407127.
[I 2026-04-22 15:05:22,661] Trial 65 finished with value: 0.17773526893201064 and parameters: {'alpha': 3316427.007512562, 'use_snp_selection': False, 'weight_scheme': 'minmax', 'weight_clip_max': None, 'weight_minmax_eps': 0.12311333432895392}. Best is trial 11 with value: 0.18740141983407127.
[I 2026-04-22 15:06:21,545] Trial 66 finished with value: 0.18618062594615764 and parameters: {'alpha': 656812.9317178886, 'use_snp_selection': False, 'weight_scheme': 'minmax', 'weight_clip_max': None, 'weight_minmax_eps': 0.1009294371830577}. Best is trial 11 with value: 0.18740141983407127.
[I 2026-04-22 15:08:38,805] Trial 67 finished with value: 0.15907771555097142 and parameters: {'alpha': 17460.131178987343, 'use_snp_selection': True, 'num_snps': 43745, 'weight_scheme': 'exponential', 'weight_clip_max': 5.0, 'weight_exponential_beta': 0.3545859308582804}. Best is trial 11 with value: 0.18740141983407127.
