Running from this directory: /cluster/work/simennes/Master_thesis
Name of job: ncv_ridge_iw
ID of job: 24335609
Array task ID: 15
The job was run on these nodes: idun-03-21
[I 2026-04-23 15:39:12,121] Trial 0 finished with value: 0.15541765365165505 and parameters: {'alpha': 113703.38004442609, 'use_snp_selection': True, 'num_snps': 5442, 'iw_method': 'pc_logistic', 'iw_clip_max': 10.0, 'iw_n_components': 5, 'iw_logistic_c': 4.927310296129143, 'iw_pca_fit': 'source', 'iw_solver': 'lbfgs'}. Best is trial 0 with value: 0.15541765365165505.
[I 2026-04-23 15:45:39,585] Trial 1 finished with value: 0.15429508202300787 and parameters: {'alpha': 31403.568254918682, 'use_snp_selection': True, 'num_snps': 52878, 'iw_method': 'pc_logistic', 'iw_clip_max': 25.0, 'iw_n_components': 50, 'iw_logistic_c': 0.0215474878351802, 'iw_pca_fit': 'combined', 'iw_solver': 'lbfgs'}. Best is trial 0 with value: 0.15541765365165505.
[I 2026-04-23 15:46:26,229] Trial 2 finished with value: 0.17053476382155022 and parameters: {'alpha': 843188.1730429748, 'use_snp_selection': False, 'iw_method': 'uniform', 'iw_clip_max': 10.0}. Best is trial 2 with value: 0.17053476382155022.
[I 2026-04-23 15:49:41,391] Trial 3 finished with value: 0.11889669042716422 and parameters: {'alpha': 1608.6968668824506, 'use_snp_selection': True, 'num_snps': 20835, 'iw_method': 'pc_logistic', 'iw_clip_max': None, 'iw_n_components': 10, 'iw_logistic_c': 1.0216001618506627, 'iw_pca_fit': 'source', 'iw_solver': 'lbfgs'}. Best is trial 2 with value: 0.17053476382155022.
[I 2026-04-23 15:50:26,508] Trial 4 finished with value: 0.17613528125051595 and parameters: {'alpha': 304631.0485153137, 'use_snp_selection': False, 'iw_method': 'uniform', 'iw_clip_max': 25.0}. Best is trial 4 with value: 0.17613528125051595.
[I 2026-04-23 15:54:42,536] Trial 5 finished with value: 0.14360782795844637 and parameters: {'alpha': 1969.1835550007406, 'use_snp_selection': False, 'iw_method': 'pc_logistic', 'iw_clip_max': None, 'iw_n_components': 10, 'iw_logistic_c': 72.13019609570544, 'iw_pca_fit': 'source', 'iw_solver': 'lbfgs'}. Best is trial 4 with value: 0.17613528125051595.
[I 2026-04-23 15:58:33,299] Trial 6 finished with value: 0.1637885325616401 and parameters: {'alpha': 102451.8239242939, 'use_snp_selection': True, 'num_snps': 28882, 'iw_method': 'pc_logistic', 'iw_clip_max': None, 'iw_n_components': 5, 'iw_logistic_c': 74.89693291900525, 'iw_pca_fit': 'source', 'iw_solver': 'lbfgs'}. Best is trial 4 with value: 0.17613528125051595.
[I 2026-04-23 15:59:18,284] Trial 7 finished with value: 0.14145085507480257 and parameters: {'alpha': 2141.2178673431476, 'use_snp_selection': False, 'iw_method': 'uniform', 'iw_clip_max': 25.0}. Best is trial 4 with value: 0.17613528125051595.
[I 2026-04-23 16:01:23,367] Trial 8 finished with value: 0.1611241626382469 and parameters: {'alpha': 5044402.471344981, 'use_snp_selection': True, 'num_snps': 45718, 'iw_method': 'uniform', 'iw_clip_max': 5.0}. Best is trial 4 with value: 0.17613528125051595.
[I 2026-04-23 16:05:52,269] Trial 9 finished with value: 0.16869042076895163 and parameters: {'alpha': 6685.17962248224, 'use_snp_selection': False, 'iw_method': 'pc_logistic', 'iw_clip_max': 25.0, 'iw_n_components': 10, 'iw_logistic_c': 60.72281367077526, 'iw_pca_fit': 'combined', 'iw_solver': 'lbfgs'}. Best is trial 4 with value: 0.17613528125051595.
[I 2026-04-23 16:06:37,260] Trial 10 finished with value: 0.17039911468280197 and parameters: {'alpha': 860571.7420672657, 'use_snp_selection': False, 'iw_method': 'uniform', 'iw_clip_max': 5.0}. Best is trial 4 with value: 0.17613528125051595.
[I 2026-04-23 16:07:23,565] Trial 11 finished with value: 0.1709754667378081 and parameters: {'alpha': 788941.4897203294, 'use_snp_selection': False, 'iw_method': 'uniform', 'iw_clip_max': 10.0}. Best is trial 4 with value: 0.17613528125051595.
[I 2026-04-23 16:08:08,648] Trial 12 finished with value: 0.1721144759458568 and parameters: {'alpha': 662429.7344273377, 'use_snp_selection': False, 'iw_method': 'uniform', 'iw_clip_max': 10.0}. Best is trial 4 with value: 0.17613528125051595.
[I 2026-04-23 16:08:54,070] Trial 13 finished with value: 0.16021912959586507 and parameters: {'alpha': 6288680.884093956, 'use_snp_selection': False, 'iw_method': 'uniform', 'iw_clip_max': 25.0}. Best is trial 4 with value: 0.17613528125051595.
[I 2026-04-23 16:09:39,872] Trial 14 finished with value: 0.17634380568755698 and parameters: {'alpha': 285374.8412309771, 'use_snp_selection': False, 'iw_method': 'uniform', 'iw_clip_max': 10.0}. Best is trial 14 with value: 0.17634380568755698.
[I 2026-04-23 16:10:26,872] Trial 15 finished with value: 0.1683097186955642 and parameters: {'alpha': 36021.612679774575, 'use_snp_selection': False, 'iw_method': 'uniform', 'iw_clip_max': 25.0}. Best is trial 14 with value: 0.17634380568755698.
[I 2026-04-23 16:11:12,570] Trial 16 finished with value: 0.17602462762747706 and parameters: {'alpha': 314464.6358887838, 'use_snp_selection': False, 'iw_method': 'uniform', 'iw_clip_max': 10.0}. Best is trial 14 with value: 0.17634380568755698.
[I 2026-04-23 16:11:58,359] Trial 17 finished with value: 0.16426912203999072 and parameters: {'alpha': 2320042.028519574, 'use_snp_selection': False, 'iw_method': 'uniform', 'iw_clip_max': 5.0}. Best is trial 14 with value: 0.17634380568755698.
[I 2026-04-23 16:12:45,509] Trial 18 finished with value: 0.16546899822561864 and parameters: {'alpha': 27007.985396542343, 'use_snp_selection': False, 'iw_method': 'uniform', 'iw_clip_max': 25.0}. Best is trial 14 with value: 0.17634380568755698.
[I 2026-04-23 16:13:32,396] Trial 19 finished with value: 0.17640488923993686 and parameters: {'alpha': 279485.34672008036, 'use_snp_selection': False, 'iw_method': 'uniform', 'iw_clip_max': 10.0}. Best is trial 19 with value: 0.17640488923993686.
[I 2026-04-23 16:14:17,785] Trial 20 finished with value: 0.17691150788745924 and parameters: {'alpha': 218440.3724252272, 'use_snp_selection': False, 'iw_method': 'uniform', 'iw_clip_max': 10.0}. Best is trial 20 with value: 0.17691150788745924.
[I 2026-04-23 16:15:03,065] Trial 21 finished with value: 0.17697627406472807 and parameters: {'alpha': 204547.99154223, 'use_snp_selection': False, 'iw_method': 'uniform', 'iw_clip_max': 10.0}. Best is trial 21 with value: 0.17697627406472807.
[I 2026-04-23 16:15:49,654] Trial 22 finished with value: 0.17305849065617346 and parameters: {'alpha': 63613.22184273683, 'use_snp_selection': False, 'iw_method': 'uniform', 'iw_clip_max': 10.0}. Best is trial 21 with value: 0.17697627406472807.
[I 2026-04-23 16:16:35,319] Trial 23 finished with value: 0.15760114303643755 and parameters: {'alpha': 12929.142807618424, 'use_snp_selection': False, 'iw_method': 'uniform', 'iw_clip_max': 10.0}. Best is trial 21 with value: 0.17697627406472807.
[I 2026-04-23 16:17:20,292] Trial 24 finished with value: 0.17699158245832364 and parameters: {'alpha': 169918.64865646733, 'use_snp_selection': False, 'iw_method': 'uniform', 'iw_clip_max': 10.0}. Best is trial 24 with value: 0.17699158245832364.
[I 2026-04-23 16:18:05,896] Trial 25 finished with value: 0.17694970669090504 and parameters: {'alpha': 161119.9100329809, 'use_snp_selection': False, 'iw_method': 'uniform', 'iw_clip_max': 10.0}. Best is trial 24 with value: 0.17699158245832364.
[I 2026-04-23 16:18:50,597] Trial 26 finished with value: 0.17342754148664452 and parameters: {'alpha': 67102.10884215792, 'use_snp_selection': False, 'iw_method': 'uniform', 'iw_clip_max': 10.0}. Best is trial 24 with value: 0.17699158245832364.
[I 2026-04-23 16:21:13,336] Trial 27 finished with value: 0.1636443039412816 and parameters: {'alpha': 2271656.6274574646, 'use_snp_selection': True, 'num_snps': 59564, 'iw_method': 'uniform', 'iw_clip_max': 10.0}. Best is trial 24 with value: 0.17699158245832364.
[I 2026-04-23 16:21:58,263] Trial 28 finished with value: 0.1768028275351881 and parameters: {'alpha': 144774.57228002202, 'use_snp_selection': False, 'iw_method': 'uniform', 'iw_clip_max': 10.0}. Best is trial 24 with value: 0.17699158245832364.
[I 2026-04-23 16:24:19,778] Trial 29 finished with value: 0.1504091311100807 and parameters: {'alpha': 14087.436610057588, 'use_snp_selection': True, 'num_snps': 6691, 'iw_method': 'pc_logistic', 'iw_clip_max': 10.0, 'iw_n_components': 20, 'iw_logistic_c': 0.012508090354298252, 'iw_pca_fit': 'combined', 'iw_solver': 'lbfgs'}. Best is trial 24 with value: 0.17699158245832364.
[I 2026-04-23 16:25:04,463] Trial 30 finished with value: 0.17653527448031456 and parameters: {'alpha': 128218.33603521046, 'use_snp_selection': False, 'iw_method': 'uniform', 'iw_clip_max': 10.0}. Best is trial 24 with value: 0.17699158245832364.
[I 2026-04-23 16:25:49,465] Trial 31 finished with value: 0.17698675979297954 and parameters: {'alpha': 168607.50878224717, 'use_snp_selection': False, 'iw_method': 'uniform', 'iw_clip_max': 10.0}. Best is trial 24 with value: 0.17699158245832364.
[I 2026-04-23 16:26:33,922] Trial 32 finished with value: 0.1740055962268365 and parameters: {'alpha': 484511.4612326366, 'use_snp_selection': False, 'iw_method': 'uniform', 'iw_clip_max': 10.0}. Best is trial 24 with value: 0.17699158245832364.
[I 2026-04-23 16:27:19,360] Trial 33 finished with value: 0.17131893166590953 and parameters: {'alpha': 50629.067033375024, 'use_snp_selection': False, 'iw_method': 'uniform', 'iw_clip_max': 10.0}. Best is trial 24 with value: 0.17699158245832364.
[I 2026-04-23 16:32:26,923] Trial 34 finished with value: 0.12108942286036314 and parameters: {'alpha': 1357493.4360529324, 'use_snp_selection': True, 'num_snps': 39816, 'iw_method': 'pc_logistic', 'iw_clip_max': None, 'iw_n_components': 50, 'iw_logistic_c': 0.11088291658462143, 'iw_pca_fit': 'combined', 'iw_solver': 'lbfgs'}. Best is trial 24 with value: 0.17699158245832364.
[I 2026-04-23 16:33:11,855] Trial 35 finished with value: 0.17701475158966776 and parameters: {'alpha': 181492.31829761923, 'use_snp_selection': False, 'iw_method': 'uniform', 'iw_clip_max': 10.0}. Best is trial 35 with value: 0.17701475158966776.
[I 2026-04-23 16:33:57,061] Trial 36 finished with value: 0.17502949153306682 and parameters: {'alpha': 87603.75781576372, 'use_snp_selection': False, 'iw_method': 'uniform', 'iw_clip_max': 5.0}. Best is trial 35 with value: 0.17701475158966776.
[I 2026-04-23 16:38:13,097] Trial 37 finished with value: 0.15918152953023962 and parameters: {'alpha': 429673.1969875535, 'use_snp_selection': False, 'iw_method': 'pc_logistic', 'iw_clip_max': 10.0, 'iw_n_components': 20, 'iw_logistic_c': 5.843783263081874, 'iw_pca_fit': 'source', 'iw_solver': 'lbfgs'}. Best is trial 35 with value: 0.17701475158966776.
[I 2026-04-23 16:39:49,947] Trial 38 finished with value: 0.16250979842249702 and parameters: {'alpha': 189490.25222459325, 'use_snp_selection': True, 'num_snps': 21056, 'iw_method': 'uniform', 'iw_clip_max': None}. Best is trial 35 with value: 0.17701475158966776.
[I 2026-04-23 16:40:35,898] Trial 39 finished with value: 0.1665358868948731 and parameters: {'alpha': 30015.981004386635, 'use_snp_selection': False, 'iw_method': 'uniform', 'iw_clip_max': 10.0}. Best is trial 35 with value: 0.17701475158966776.
[I 2026-04-23 16:45:23,769] Trial 40 finished with value: 0.14274256658824494 and parameters: {'alpha': 101106.80599105482, 'use_snp_selection': False, 'iw_method': 'pc_logistic', 'iw_clip_max': None, 'iw_n_components': 50, 'iw_logistic_c': 0.266451689908294, 'iw_pca_fit': 'combined', 'iw_solver': 'lbfgs'}. Best is trial 35 with value: 0.17701475158966776.
[I 2026-04-23 16:46:10,252] Trial 41 finished with value: 0.17690690211167864 and parameters: {'alpha': 155087.13043466333, 'use_snp_selection': False, 'iw_method': 'uniform', 'iw_clip_max': 10.0}. Best is trial 35 with value: 0.17701475158966776.
[I 2026-04-23 16:46:57,198] Trial 42 finished with value: 0.17429993295067028 and parameters: {'alpha': 459275.2723253572, 'use_snp_selection': False, 'iw_method': 'uniform', 'iw_clip_max': 10.0}. Best is trial 35 with value: 0.17701475158966776.
[I 2026-04-23 16:47:44,242] Trial 43 finished with value: 0.17701557770373 and parameters: {'alpha': 183833.96377792093, 'use_snp_selection': False, 'iw_method': 'uniform', 'iw_clip_max': 10.0}. Best is trial 43 with value: 0.17701557770373.
[I 2026-04-23 16:48:31,036] Trial 44 finished with value: 0.17008933979985089 and parameters: {'alpha': 43784.018804153806, 'use_snp_selection': False, 'iw_method': 'uniform', 'iw_clip_max': 10.0}. Best is trial 43 with value: 0.17701557770373.
[I 2026-04-23 16:49:16,999] Trial 45 finished with value: 0.17473648729335958 and parameters: {'alpha': 82959.86765171771, 'use_snp_selection': False, 'iw_method': 'uniform', 'iw_clip_max': 5.0}. Best is trial 43 with value: 0.17701557770373.
[I 2026-04-23 16:51:11,252] Trial 46 finished with value: 0.16466784330152787 and parameters: {'alpha': 1001344.9327046562, 'use_snp_selection': True, 'num_snps': 36247, 'iw_method': 'uniform', 'iw_clip_max': 10.0}. Best is trial 43 with value: 0.17701557770373.
[I 2026-04-23 16:51:56,055] Trial 47 finished with value: 0.17685751351020704 and parameters: {'alpha': 227312.6720610441, 'use_snp_selection': False, 'iw_method': 'uniform', 'iw_clip_max': 10.0}. Best is trial 43 with value: 0.17701557770373.
[I 2026-04-23 16:56:04,888] Trial 48 finished with value: 0.16053037556580071 and parameters: {'alpha': 398502.6377240079, 'use_snp_selection': False, 'iw_method': 'pc_logistic', 'iw_clip_max': 10.0, 'iw_n_components': 20, 'iw_logistic_c': 8.513176839209727, 'iw_pca_fit': 'source', 'iw_solver': 'lbfgs'}. Best is trial 43 with value: 0.17701557770373.
[I 2026-04-23 16:56:51,518] Trial 49 finished with value: 0.1724464693120273 and parameters: {'alpha': 628704.9063393213, 'use_snp_selection': False, 'iw_method': 'uniform', 'iw_clip_max': 10.0}. Best is trial 43 with value: 0.17701557770373.
