Running from this directory: /cluster/work/simennes/Master_thesis
Name of job: ncv_ridge_iw
ID of job: 24335603
Array task ID: 9
The job was run on these nodes: idun-03-11
[I 2026-04-23 15:39:21,604] Trial 0 finished with value: 0.1386470377199389 and parameters: {'alpha': 113703.38004442609, 'use_snp_selection': True, 'num_snps': 5442, 'iw_method': 'pc_logistic', 'iw_clip_max': 10.0, 'iw_n_components': 5, 'iw_logistic_c': 4.927310296129143, 'iw_pca_fit': 'source', 'iw_solver': 'lbfgs'}. Best is trial 0 with value: 0.1386470377199389.
[I 2026-04-23 15:45:50,938] Trial 1 finished with value: 0.15361834819352635 and parameters: {'alpha': 31403.568254918682, 'use_snp_selection': True, 'num_snps': 52878, 'iw_method': 'pc_logistic', 'iw_clip_max': 25.0, 'iw_n_components': 50, 'iw_logistic_c': 0.0215474878351802, 'iw_pca_fit': 'combined', 'iw_solver': 'lbfgs'}. Best is trial 1 with value: 0.15361834819352635.
[I 2026-04-23 15:46:39,431] Trial 2 finished with value: 0.15466916532351982 and parameters: {'alpha': 843188.1730429748, 'use_snp_selection': False, 'iw_method': 'uniform', 'iw_clip_max': 10.0}. Best is trial 2 with value: 0.15466916532351982.
[I 2026-04-23 15:50:03,606] Trial 3 finished with value: 0.12303629304762075 and parameters: {'alpha': 1608.6968668824506, 'use_snp_selection': True, 'num_snps': 20835, 'iw_method': 'pc_logistic', 'iw_clip_max': None, 'iw_n_components': 10, 'iw_logistic_c': 1.0216001618506627, 'iw_pca_fit': 'source', 'iw_solver': 'lbfgs'}. Best is trial 2 with value: 0.15466916532351982.
[I 2026-04-23 15:50:52,123] Trial 4 finished with value: 0.15750699663281378 and parameters: {'alpha': 304631.0485153137, 'use_snp_selection': False, 'iw_method': 'uniform', 'iw_clip_max': 25.0}. Best is trial 4 with value: 0.15750699663281378.
[I 2026-04-23 15:54:53,051] Trial 5 finished with value: 0.14169734043285168 and parameters: {'alpha': 1969.1835550007406, 'use_snp_selection': False, 'iw_method': 'pc_logistic', 'iw_clip_max': None, 'iw_n_components': 10, 'iw_logistic_c': 72.13019609570544, 'iw_pca_fit': 'source', 'iw_solver': 'lbfgs'}. Best is trial 4 with value: 0.15750699663281378.
[I 2026-04-23 15:58:39,201] Trial 6 finished with value: 0.15201338249099738 and parameters: {'alpha': 102451.8239242939, 'use_snp_selection': True, 'num_snps': 28882, 'iw_method': 'pc_logistic', 'iw_clip_max': None, 'iw_n_components': 5, 'iw_logistic_c': 74.89693291900525, 'iw_pca_fit': 'source', 'iw_solver': 'lbfgs'}. Best is trial 4 with value: 0.15750699663281378.
[I 2026-04-23 15:59:28,772] Trial 7 finished with value: 0.12419947311874693 and parameters: {'alpha': 2141.2178673431476, 'use_snp_selection': False, 'iw_method': 'uniform', 'iw_clip_max': 25.0}. Best is trial 4 with value: 0.15750699663281378.
[I 2026-04-23 16:01:36,699] Trial 8 finished with value: 0.14635273698171064 and parameters: {'alpha': 5044402.471344981, 'use_snp_selection': True, 'num_snps': 45718, 'iw_method': 'uniform', 'iw_clip_max': 5.0}. Best is trial 4 with value: 0.15750699663281378.
[I 2026-04-23 16:05:58,832] Trial 9 finished with value: 0.1580417151160662 and parameters: {'alpha': 6685.17962248224, 'use_snp_selection': False, 'iw_method': 'pc_logistic', 'iw_clip_max': 25.0, 'iw_n_components': 10, 'iw_logistic_c': 60.72281367077526, 'iw_pca_fit': 'combined', 'iw_solver': 'lbfgs'}. Best is trial 9 with value: 0.1580417151160662.
[I 2026-04-23 16:10:26,594] Trial 10 finished with value: 0.15788116886397807 and parameters: {'alpha': 14791.474196560503, 'use_snp_selection': False, 'iw_method': 'pc_logistic', 'iw_clip_max': 5.0, 'iw_n_components': 20, 'iw_logistic_c': 0.019975710905984476, 'iw_pca_fit': 'combined', 'iw_solver': 'lbfgs'}. Best is trial 9 with value: 0.1580417151160662.
[I 2026-04-23 16:14:57,033] Trial 11 finished with value: 0.15289597594258145 and parameters: {'alpha': 15087.386440571549, 'use_snp_selection': False, 'iw_method': 'pc_logistic', 'iw_clip_max': 5.0, 'iw_n_components': 20, 'iw_logistic_c': 0.01157552114925114, 'iw_pca_fit': 'combined', 'iw_solver': 'lbfgs'}. Best is trial 9 with value: 0.1580417151160662.
[I 2026-04-23 16:19:27,498] Trial 12 finished with value: 0.1532970851848289 and parameters: {'alpha': 12409.084812292853, 'use_snp_selection': False, 'iw_method': 'pc_logistic', 'iw_clip_max': 5.0, 'iw_n_components': 20, 'iw_logistic_c': 0.14743084599696468, 'iw_pca_fit': 'combined', 'iw_solver': 'lbfgs'}. Best is trial 9 with value: 0.1580417151160662.
[I 2026-04-23 16:23:49,804] Trial 13 finished with value: 0.15586104123598715 and parameters: {'alpha': 7941.793003658691, 'use_snp_selection': False, 'iw_method': 'pc_logistic', 'iw_clip_max': 5.0, 'iw_n_components': 10, 'iw_logistic_c': 2.7610939921497866, 'iw_pca_fit': 'combined', 'iw_solver': 'lbfgs'}. Best is trial 9 with value: 0.1580417151160662.
[I 2026-04-23 16:28:12,361] Trial 14 finished with value: 0.15900892380477002 and parameters: {'alpha': 39503.733231241225, 'use_snp_selection': False, 'iw_method': 'pc_logistic', 'iw_clip_max': 25.0, 'iw_n_components': 20, 'iw_logistic_c': 0.20124394522567615, 'iw_pca_fit': 'combined', 'iw_solver': 'lbfgs'}. Best is trial 14 with value: 0.15900892380477002.
[I 2026-04-23 16:32:57,450] Trial 15 finished with value: 0.15276233460966637 and parameters: {'alpha': 44601.19621993925, 'use_snp_selection': False, 'iw_method': 'pc_logistic', 'iw_clip_max': 25.0, 'iw_n_components': 50, 'iw_logistic_c': 0.1762955881736036, 'iw_pca_fit': 'combined', 'iw_solver': 'lbfgs'}. Best is trial 14 with value: 0.15900892380477002.
[I 2026-04-23 16:37:21,279] Trial 16 finished with value: 0.1311823510769126 and parameters: {'alpha': 538829.945379115, 'use_snp_selection': False, 'iw_method': 'pc_logistic', 'iw_clip_max': 25.0, 'iw_n_components': 10, 'iw_logistic_c': 19.137460976829022, 'iw_pca_fit': 'combined', 'iw_solver': 'lbfgs'}. Best is trial 14 with value: 0.15900892380477002.
[I 2026-04-23 16:41:46,429] Trial 17 finished with value: 0.15707336792574575 and parameters: {'alpha': 5166.038711888404, 'use_snp_selection': False, 'iw_method': 'pc_logistic', 'iw_clip_max': 25.0, 'iw_n_components': 20, 'iw_logistic_c': 0.13559877107862264, 'iw_pca_fit': 'combined', 'iw_solver': 'lbfgs'}. Best is trial 14 with value: 0.15900892380477002.
[I 2026-04-23 16:42:35,577] Trial 18 finished with value: 0.1465076708024751 and parameters: {'alpha': 8946017.598548662, 'use_snp_selection': False, 'iw_method': 'uniform', 'iw_clip_max': 25.0}. Best is trial 14 with value: 0.15900892380477002.
[I 2026-04-23 16:46:57,020] Trial 19 finished with value: 0.1534979341287358 and parameters: {'alpha': 42646.470769741216, 'use_snp_selection': False, 'iw_method': 'pc_logistic', 'iw_clip_max': 25.0, 'iw_n_components': 10, 'iw_logistic_c': 0.5609486811577432, 'iw_pca_fit': 'combined', 'iw_solver': 'lbfgs'}. Best is trial 14 with value: 0.15900892380477002.
[I 2026-04-23 16:51:23,685] Trial 20 finished with value: 0.15325700626701294 and parameters: {'alpha': 3489.4610920673235, 'use_snp_selection': False, 'iw_method': 'pc_logistic', 'iw_clip_max': 10.0, 'iw_n_components': 20, 'iw_logistic_c': 7.017692869381948, 'iw_pca_fit': 'combined', 'iw_solver': 'lbfgs'}. Best is trial 14 with value: 0.15900892380477002.
[I 2026-04-23 16:55:49,519] Trial 21 finished with value: 0.1561449720452786 and parameters: {'alpha': 16880.434266670225, 'use_snp_selection': False, 'iw_method': 'pc_logistic', 'iw_clip_max': 5.0, 'iw_n_components': 20, 'iw_logistic_c': 0.05272392575665323, 'iw_pca_fit': 'combined', 'iw_solver': 'lbfgs'}. Best is trial 14 with value: 0.15900892380477002.
[I 2026-04-23 17:00:12,626] Trial 22 finished with value: 0.15225736489807312 and parameters: {'alpha': 5567.98515964547, 'use_snp_selection': False, 'iw_method': 'pc_logistic', 'iw_clip_max': 5.0, 'iw_n_components': 20, 'iw_logistic_c': 0.03674891286474552, 'iw_pca_fit': 'combined', 'iw_solver': 'lbfgs'}. Best is trial 14 with value: 0.15900892380477002.
[I 2026-04-23 17:04:35,963] Trial 23 finished with value: 0.15803046339503546 and parameters: {'alpha': 27871.527545427354, 'use_snp_selection': False, 'iw_method': 'pc_logistic', 'iw_clip_max': 25.0, 'iw_n_components': 20, 'iw_logistic_c': 0.48222224381773454, 'iw_pca_fit': 'combined', 'iw_solver': 'lbfgs'}. Best is trial 14 with value: 0.15900892380477002.
[I 2026-04-23 17:08:59,923] Trial 24 finished with value: 0.14340086944050567 and parameters: {'alpha': 253725.4374700739, 'use_snp_selection': False, 'iw_method': 'pc_logistic', 'iw_clip_max': 25.0, 'iw_n_components': 20, 'iw_logistic_c': 0.5029456382619942, 'iw_pca_fit': 'combined', 'iw_solver': 'lbfgs'}. Best is trial 14 with value: 0.15900892380477002.
[I 2026-04-23 17:13:49,654] Trial 25 finished with value: 0.15379009382216516 and parameters: {'alpha': 36094.7893599164, 'use_snp_selection': False, 'iw_method': 'pc_logistic', 'iw_clip_max': 25.0, 'iw_n_components': 50, 'iw_logistic_c': 1.4488344729987384, 'iw_pca_fit': 'combined', 'iw_solver': 'lbfgs'}. Best is trial 14 with value: 0.15900892380477002.
[I 2026-04-23 17:14:38,394] Trial 26 finished with value: 0.15170480788955282 and parameters: {'alpha': 64272.413679495, 'use_snp_selection': False, 'iw_method': 'uniform', 'iw_clip_max': 25.0}. Best is trial 14 with value: 0.15900892380477002.
[I 2026-04-23 17:16:42,902] Trial 27 finished with value: 0.1472908012032029 and parameters: {'alpha': 170408.77975212614, 'use_snp_selection': True, 'num_snps': 5649, 'iw_method': 'pc_logistic', 'iw_clip_max': 25.0, 'iw_n_components': 5, 'iw_logistic_c': 0.3933757602195532, 'iw_pca_fit': 'combined', 'iw_solver': 'lbfgs'}. Best is trial 14 with value: 0.15900892380477002.
[I 2026-04-23 17:20:46,687] Trial 28 finished with value: 0.13796254365463334 and parameters: {'alpha': 1041.9073842737814, 'use_snp_selection': False, 'iw_method': 'pc_logistic', 'iw_clip_max': 25.0, 'iw_n_components': 10, 'iw_logistic_c': 20.657366075479345, 'iw_pca_fit': 'source', 'iw_solver': 'lbfgs'}. Best is trial 14 with value: 0.15900892380477002.
[I 2026-04-23 17:27:28,557] Trial 29 finished with value: 0.13858718348730786 and parameters: {'alpha': 1822131.6833647974, 'use_snp_selection': True, 'num_snps': 59385, 'iw_method': 'pc_logistic', 'iw_clip_max': 10.0, 'iw_n_components': 20, 'iw_logistic_c': 0.24660303419584725, 'iw_pca_fit': 'combined', 'iw_solver': 'lbfgs'}. Best is trial 14 with value: 0.15900892380477002.
[I 2026-04-23 17:31:55,565] Trial 30 finished with value: 0.15842989717582304 and parameters: {'alpha': 8424.60997437856, 'use_snp_selection': False, 'iw_method': 'pc_logistic', 'iw_clip_max': 25.0, 'iw_n_components': 20, 'iw_logistic_c': 0.08778848640647964, 'iw_pca_fit': 'combined', 'iw_solver': 'lbfgs'}. Best is trial 14 with value: 0.15900892380477002.
[I 2026-04-23 17:35:51,724] Trial 31 finished with value: 0.15579271099429487 and parameters: {'alpha': 21823.827413406547, 'use_snp_selection': False, 'iw_method': 'pc_logistic', 'iw_clip_max': 25.0, 'iw_n_components': 20, 'iw_logistic_c': 0.10204786091613116, 'iw_pca_fit': 'combined', 'iw_solver': 'lbfgs'}. Best is trial 14 with value: 0.15900892380477002.
[I 2026-04-23 17:39:49,382] Trial 32 finished with value: 0.1568388192689785 and parameters: {'alpha': 8728.894334557881, 'use_snp_selection': False, 'iw_method': 'pc_logistic', 'iw_clip_max': 25.0, 'iw_n_components': 20, 'iw_logistic_c': 0.05700465178151687, 'iw_pca_fit': 'combined', 'iw_solver': 'lbfgs'}. Best is trial 14 with value: 0.15900892380477002.
[I 2026-04-23 17:43:47,201] Trial 33 finished with value: 0.15323737620125255 and parameters: {'alpha': 85550.37765091333, 'use_snp_selection': False, 'iw_method': 'pc_logistic', 'iw_clip_max': 25.0, 'iw_n_components': 20, 'iw_logistic_c': 0.2762455044597476, 'iw_pca_fit': 'combined', 'iw_solver': 'lbfgs'}. Best is trial 14 with value: 0.15900892380477002.
[I 2026-04-23 17:48:21,386] Trial 34 finished with value: 0.15085524635644734 and parameters: {'alpha': 25968.225600313726, 'use_snp_selection': True, 'num_snps': 39579, 'iw_method': 'pc_logistic', 'iw_clip_max': 10.0, 'iw_n_components': 20, 'iw_logistic_c': 1.918427056332608, 'iw_pca_fit': 'combined', 'iw_solver': 'lbfgs'}. Best is trial 14 with value: 0.15900892380477002.
[I 2026-04-23 17:52:12,824] Trial 35 finished with value: 0.1599331471626337 and parameters: {'alpha': 4084.1417589781104, 'use_snp_selection': False, 'iw_method': 'pc_logistic', 'iw_clip_max': None, 'iw_n_components': 10, 'iw_logistic_c': 0.07791734906774962, 'iw_pca_fit': 'combined', 'iw_solver': 'lbfgs'}. Best is trial 35 with value: 0.1599331471626337.
[I 2026-04-23 17:52:57,473] Trial 36 finished with value: 0.12624679134192904 and parameters: {'alpha': 3152.942697176589, 'use_snp_selection': False, 'iw_method': 'uniform', 'iw_clip_max': None}. Best is trial 35 with value: 0.1599331471626337.
[I 2026-04-23 17:56:31,158] Trial 37 finished with value: 0.14869474636764132 and parameters: {'alpha': 7809.537171931686, 'use_snp_selection': False, 'iw_method': 'pc_logistic', 'iw_clip_max': None, 'iw_n_components': 10, 'iw_logistic_c': 0.10818775808795184, 'iw_pca_fit': 'source', 'iw_solver': 'lbfgs'}. Best is trial 35 with value: 0.1599331471626337.
[I 2026-04-23 17:59:37,189] Trial 38 finished with value: 0.14917688605562548 and parameters: {'alpha': 3932.6765455458485, 'use_snp_selection': True, 'num_snps': 21268, 'iw_method': 'pc_logistic', 'iw_clip_max': None, 'iw_n_components': 10, 'iw_logistic_c': 0.06474277851363881, 'iw_pca_fit': 'combined', 'iw_solver': 'lbfgs'}. Best is trial 35 with value: 0.1599331471626337.
[I 2026-04-23 18:00:21,866] Trial 39 finished with value: 0.12220498838280601 and parameters: {'alpha': 1319.9351710007677, 'use_snp_selection': False, 'iw_method': 'uniform', 'iw_clip_max': None}. Best is trial 35 with value: 0.1599331471626337.
[I 2026-04-23 18:04:03,441] Trial 40 finished with value: 0.1523272748573494 and parameters: {'alpha': 2294.583192970841, 'use_snp_selection': False, 'iw_method': 'pc_logistic', 'iw_clip_max': None, 'iw_n_components': 5, 'iw_logistic_c': 0.030144773855806332, 'iw_pca_fit': 'combined', 'iw_solver': 'lbfgs'}. Best is trial 35 with value: 0.1599331471626337.
[I 2026-04-23 18:08:24,873] Trial 41 finished with value: 0.15809972428905034 and parameters: {'alpha': 10369.750629239596, 'use_snp_selection': False, 'iw_method': 'pc_logistic', 'iw_clip_max': 25.0, 'iw_n_components': 10, 'iw_logistic_c': 0.7463260354172964, 'iw_pca_fit': 'combined', 'iw_solver': 'lbfgs'}. Best is trial 35 with value: 0.1599331471626337.
[I 2026-04-23 18:12:46,652] Trial 42 finished with value: 0.15860267928250094 and parameters: {'alpha': 11245.424226782234, 'use_snp_selection': False, 'iw_method': 'pc_logistic', 'iw_clip_max': 25.0, 'iw_n_components': 10, 'iw_logistic_c': 1.0249917764466903, 'iw_pca_fit': 'combined', 'iw_solver': 'lbfgs'}. Best is trial 35 with value: 0.1599331471626337.
[I 2026-04-23 18:17:11,797] Trial 43 finished with value: 0.15685476500235904 and parameters: {'alpha': 10894.564764176188, 'use_snp_selection': False, 'iw_method': 'pc_logistic', 'iw_clip_max': 25.0, 'iw_n_components': 10, 'iw_logistic_c': 0.7793212320525911, 'iw_pca_fit': 'combined', 'iw_solver': 'lbfgs'}. Best is trial 35 with value: 0.1599331471626337.
[I 2026-04-23 18:21:16,198] Trial 44 finished with value: 0.15214038695199134 and parameters: {'alpha': 17411.10565434587, 'use_snp_selection': False, 'iw_method': 'pc_logistic', 'iw_clip_max': None, 'iw_n_components': 10, 'iw_logistic_c': 0.8788391761940482, 'iw_pca_fit': 'source', 'iw_solver': 'lbfgs'}. Best is trial 35 with value: 0.1599331471626337.
[I 2026-04-23 18:25:41,849] Trial 45 finished with value: 0.15399735075446155 and parameters: {'alpha': 2422.3159196770316, 'use_snp_selection': False, 'iw_method': 'pc_logistic', 'iw_clip_max': 25.0, 'iw_n_components': 10, 'iw_logistic_c': 3.866001662983369, 'iw_pca_fit': 'combined', 'iw_solver': 'lbfgs'}. Best is trial 35 with value: 0.1599331471626337.
[I 2026-04-23 18:30:19,890] Trial 46 finished with value: 0.1404803592173355 and parameters: {'alpha': 55070.845700598984, 'use_snp_selection': True, 'num_snps': 34753, 'iw_method': 'pc_logistic', 'iw_clip_max': 10.0, 'iw_n_components': 50, 'iw_logistic_c': 0.3032217740239147, 'iw_pca_fit': 'source', 'iw_solver': 'lbfgs'}. Best is trial 35 with value: 0.1599331471626337.
[I 2026-04-23 18:31:09,594] Trial 47 finished with value: 0.1294654921504453 and parameters: {'alpha': 5172.308437099857, 'use_snp_selection': False, 'iw_method': 'uniform', 'iw_clip_max': 25.0}. Best is trial 35 with value: 0.1599331471626337.
[I 2026-04-23 18:35:34,519] Trial 48 finished with value: 0.15576835595941127 and parameters: {'alpha': 11246.573885927013, 'use_snp_selection': False, 'iw_method': 'pc_logistic', 'iw_clip_max': None, 'iw_n_components': 10, 'iw_logistic_c': 0.07596845178949105, 'iw_pca_fit': 'combined', 'iw_solver': 'lbfgs'}. Best is trial 35 with value: 0.1599331471626337.
[I 2026-04-23 18:39:30,103] Trial 49 finished with value: 0.1589194334669432 and parameters: {'alpha': 118655.89035456508, 'use_snp_selection': False, 'iw_method': 'pc_logistic', 'iw_clip_max': 25.0, 'iw_n_components': 5, 'iw_logistic_c': 1.399127663066906, 'iw_pca_fit': 'combined', 'iw_solver': 'lbfgs'}. Best is trial 35 with value: 0.1599331471626337.
