Running from this directory: /cluster/work/simennes/Master_thesis
Name of job: ncv_ridge_avggrm
ID of job: 24332646
Array task ID: 14
The job was run on these nodes: idun-03-08
[I 2026-04-22 13:51:10,922] Trial 0 finished with value: 0.14550974189570354 and parameters: {'alpha': 12124.394605078569, 'use_snp_selection': True, 'num_snps': 5442, 'weight_scheme': 'linear', 'weight_clip_max': 5.0, 'weight_linear_min_weight': 0.5849999641604302, 'weight_linear_max_weight': 1.017621356653175}. Best is trial 0 with value: 0.14550974189570354.
[I 2026-04-22 13:52:50,665] Trial 1 finished with value: 0.18828609217082964 and parameters: {'alpha': 109374.19486700959, 'use_snp_selection': True, 'num_snps': 25583, 'weight_scheme': 'minmax', 'weight_clip_max': 5.0, 'weight_minmax_eps': 0.14026014881292506}. Best is trial 1 with value: 0.18828609217082964.
[I 2026-04-22 13:55:11,286] Trial 2 finished with value: 0.17756951063442267 and parameters: {'alpha': 87498.4492964452, 'use_snp_selection': True, 'num_snps': 53815, 'weight_scheme': 'linear', 'weight_clip_max': 5.0, 'weight_linear_min_weight': 0.27089068881512934, 'weight_linear_max_weight': 2.0548794162981476}. Best is trial 1 with value: 0.18828609217082964.
[I 2026-04-22 13:56:09,304] Trial 3 finished with value: 0.18555023761512507 and parameters: {'alpha': 194477.78458557956, 'use_snp_selection': False, 'weight_scheme': 'linear', 'weight_clip_max': None, 'weight_linear_min_weight': 0.21922985165550554, 'weight_linear_max_weight': 1.6260435767424388}. Best is trial 1 with value: 0.18828609217082964.
[I 2026-04-22 13:57:07,071] Trial 4 finished with value: 0.16973057117773965 and parameters: {'alpha': 9421665.195468841, 'use_snp_selection': False, 'weight_scheme': 'minmax', 'weight_clip_max': 5.0, 'weight_minmax_eps': 0.030689801852077123}. Best is trial 1 with value: 0.18828609217082964.
[I 2026-04-22 13:58:23,496] Trial 5 finished with value: 0.14799921205357924 and parameters: {'alpha': 5024.251153421461, 'use_snp_selection': True, 'num_snps': 9046, 'weight_scheme': 'top-heavy', 'weight_clip_max': 10.0, 'weight_topheavy_top_frac': 0.08738114702774886, 'weight_topheavy_low': 0.8991910356358707, 'weight_topheavy_high': 2.2968843007908903}. Best is trial 1 with value: 0.18828609217082964.
[I 2026-04-22 13:59:10,800] Trial 6 finished with value: 0.12616508180024047 and parameters: {'alpha': 16.382429914774185, 'use_snp_selection': False, 'weight_scheme': 'uniform', 'weight_clip_max': 10.0}. Best is trial 1 with value: 0.18828609217082964.
[I 2026-04-22 14:01:23,503] Trial 7 finished with value: 0.18143023182213025 and parameters: {'alpha': 94169.1049689093, 'use_snp_selection': True, 'num_snps': 47654, 'weight_scheme': 'exponential', 'weight_clip_max': 10.0, 'weight_exponential_beta': 2.3870207999558124}. Best is trial 1 with value: 0.18828609217082964.
[I 2026-04-22 14:02:34,215] Trial 8 finished with value: 0.05611190235956854 and parameters: {'alpha': 96.38034897458088, 'use_snp_selection': True, 'num_snps': 5388, 'weight_scheme': 'minmax', 'weight_clip_max': None, 'weight_minmax_eps': 0.07791532902904205}. Best is trial 1 with value: 0.18828609217082964.
[I 2026-04-22 14:03:31,638] Trial 9 finished with value: 0.17372924977948254 and parameters: {'alpha': 2700506.792350819, 'use_snp_selection': False, 'weight_scheme': 'linear', 'weight_clip_max': 5.0, 'weight_linear_min_weight': 0.8693390069349902, 'weight_linear_max_weight': 2.1394245284712112}. Best is trial 1 with value: 0.18828609217082964.
[I 2026-04-22 14:05:25,509] Trial 10 finished with value: 0.13488607423843493 and parameters: {'alpha': 859.5702697532038, 'use_snp_selection': True, 'num_snps': 27886, 'weight_scheme': 'minmax', 'weight_clip_max': 5.0, 'weight_minmax_eps': 0.19446588700282863}. Best is trial 1 with value: 0.18828609217082964.
[I 2026-04-22 14:06:13,390] Trial 11 finished with value: 0.17676798992671766 and parameters: {'alpha': 398064.1893711017, 'use_snp_selection': False, 'weight_scheme': 'uniform', 'weight_clip_max': None}. Best is trial 1 with value: 0.18828609217082964.
[I 2026-04-22 14:07:11,693] Trial 12 finished with value: 0.17676343407697653 and parameters: {'alpha': 526082.2578821175, 'use_snp_selection': False, 'weight_scheme': 'top-heavy', 'weight_clip_max': None, 'weight_topheavy_top_frac': 0.4996369191639481, 'weight_topheavy_low': 0.5170379059205323, 'weight_topheavy_high': 5.352793790969191}. Best is trial 1 with value: 0.18828609217082964.
[I 2026-04-22 14:08:09,615] Trial 13 finished with value: 0.16463152424205943 and parameters: {'alpha': 22373.099691587424, 'use_snp_selection': False, 'weight_scheme': 'exponential', 'weight_clip_max': None, 'weight_exponential_beta': 7.104149133516018}. Best is trial 1 with value: 0.18828609217082964.
[I 2026-04-22 14:10:02,367] Trial 14 finished with value: 0.13907930140420613 and parameters: {'alpha': 1490.1048534404795, 'use_snp_selection': True, 'num_snps': 29357, 'weight_scheme': 'minmax', 'weight_clip_max': None, 'weight_minmax_eps': 0.16582443604613986}. Best is trial 1 with value: 0.18828609217082964.
[I 2026-04-22 14:11:00,558] Trial 15 finished with value: 0.1876694843682904 and parameters: {'alpha': 436355.3459356027, 'use_snp_selection': False, 'weight_scheme': 'linear', 'weight_clip_max': 5.0, 'weight_linear_min_weight': 0.10414742390904898, 'weight_linear_max_weight': 3.2753002858475733}. Best is trial 1 with value: 0.18828609217082964.
[I 2026-04-22 14:11:59,317] Trial 16 finished with value: 0.1827494715490377 and parameters: {'alpha': 1777782.3434555843, 'use_snp_selection': False, 'weight_scheme': 'linear', 'weight_clip_max': 5.0, 'weight_linear_min_weight': 0.15031072661225267, 'weight_linear_max_weight': 3.6739284358671687}. Best is trial 1 with value: 0.18828609217082964.
[I 2026-04-22 14:13:39,620] Trial 17 finished with value: 0.18386514713148236 and parameters: {'alpha': 50836.85592899919, 'use_snp_selection': True, 'num_snps': 19963, 'weight_scheme': 'minmax', 'weight_clip_max': 5.0, 'weight_minmax_eps': 0.12385684731663732}. Best is trial 1 with value: 0.18828609217082964.
[I 2026-04-22 14:14:26,398] Trial 18 finished with value: 0.16995689073790474 and parameters: {'alpha': 1214469.8117901098, 'use_snp_selection': False, 'weight_scheme': 'uniform', 'weight_clip_max': 5.0}. Best is trial 1 with value: 0.18828609217082964.
[I 2026-04-22 14:16:41,014] Trial 19 finished with value: 0.16352629447665595 and parameters: {'alpha': 8952260.376659507, 'use_snp_selection': True, 'num_snps': 42608, 'weight_scheme': 'exponential', 'weight_clip_max': 5.0, 'weight_exponential_beta': 0.701413775926087}. Best is trial 1 with value: 0.18828609217082964.
[I 2026-04-22 14:18:48,551] Trial 20 finished with value: 0.15159696087311111 and parameters: {'alpha': 5471.646145839394, 'use_snp_selection': True, 'num_snps': 38042, 'weight_scheme': 'top-heavy', 'weight_clip_max': 5.0, 'weight_topheavy_top_frac': 0.3522240793067253, 'weight_topheavy_low': 1.0682178501328932, 'weight_topheavy_high': 1.2140957943670552}. Best is trial 1 with value: 0.18828609217082964.
[I 2026-04-22 14:19:46,951] Trial 21 finished with value: 0.18639298571448357 and parameters: {'alpha': 248716.69581666228, 'use_snp_selection': False, 'weight_scheme': 'linear', 'weight_clip_max': None, 'weight_linear_min_weight': 0.10205319137993524, 'weight_linear_max_weight': 3.398138983705086}. Best is trial 1 with value: 0.18828609217082964.
[I 2026-04-22 14:20:46,083] Trial 22 finished with value: 0.18779872041161036 and parameters: {'alpha': 353270.05786570633, 'use_snp_selection': False, 'weight_scheme': 'linear', 'weight_clip_max': None, 'weight_linear_min_weight': 0.10812281313590438, 'weight_linear_max_weight': 3.4119211832389165}. Best is trial 1 with value: 0.18828609217082964.
[I 2026-04-22 14:21:45,160] Trial 23 finished with value: 0.16732465450749875 and parameters: {'alpha': 33736.69118859625, 'use_snp_selection': False, 'weight_scheme': 'linear', 'weight_clip_max': 10.0, 'weight_linear_min_weight': 0.40083438926432374, 'weight_linear_max_weight': 3.050033610301463}. Best is trial 1 with value: 0.18828609217082964.
[I 2026-04-22 14:22:40,381] Trial 24 finished with value: 0.18663685517948814 and parameters: {'alpha': 759213.9577064348, 'use_snp_selection': False, 'weight_scheme': 'linear', 'weight_clip_max': 5.0, 'weight_linear_min_weight': 0.48846193599996335, 'weight_linear_max_weight': 2.8626176639711356}. Best is trial 1 with value: 0.18828609217082964.
[I 2026-04-22 14:23:34,241] Trial 25 finished with value: 0.17849568315679093 and parameters: {'alpha': 3071374.4760284987, 'use_snp_selection': False, 'weight_scheme': 'minmax', 'weight_clip_max': None, 'weight_minmax_eps': 0.12053510658043297}. Best is trial 1 with value: 0.18828609217082964.
[I 2026-04-22 14:24:30,753] Trial 26 finished with value: 0.18565199488190431 and parameters: {'alpha': 199901.86993385846, 'use_snp_selection': False, 'weight_scheme': 'linear', 'weight_clip_max': 5.0, 'weight_linear_min_weight': 0.3424228565980609, 'weight_linear_max_weight': 3.7444733457024855}. Best is trial 1 with value: 0.18828609217082964.
[I 2026-04-22 14:25:28,699] Trial 27 finished with value: 0.1821354981962889 and parameters: {'alpha': 123289.12470225118, 'use_snp_selection': False, 'weight_scheme': 'linear', 'weight_clip_max': 5.0, 'weight_linear_min_weight': 0.6697141818715946, 'weight_linear_max_weight': 3.0854708088814187}. Best is trial 1 with value: 0.18828609217082964.
[I 2026-04-22 14:27:06,521] Trial 28 finished with value: 0.18204700115404132 and parameters: {'alpha': 699477.9325172553, 'use_snp_selection': True, 'num_snps': 18197, 'weight_scheme': 'minmax', 'weight_clip_max': None, 'weight_minmax_eps': 0.07082540114878075}. Best is trial 1 with value: 0.18828609217082964.
[I 2026-04-22 14:28:37,199] Trial 29 finished with value: 0.1693513810842682 and parameters: {'alpha': 17957.25833250972, 'use_snp_selection': True, 'num_snps': 17851, 'weight_scheme': 'linear', 'weight_clip_max': 10.0, 'weight_linear_min_weight': 0.10924823367959455, 'weight_linear_max_weight': 3.9795725530420736}. Best is trial 1 with value: 0.18828609217082964.
[I 2026-04-22 14:29:33,245] Trial 30 finished with value: 0.1523956371343717 and parameters: {'alpha': 9441.48759946611, 'use_snp_selection': False, 'weight_scheme': 'exponential', 'weight_clip_max': 5.0, 'weight_exponential_beta': 6.317124299415958}. Best is trial 1 with value: 0.18828609217082964.
[I 2026-04-22 14:30:30,733] Trial 31 finished with value: 0.1850133446419979 and parameters: {'alpha': 1090422.98241327, 'use_snp_selection': False, 'weight_scheme': 'linear', 'weight_clip_max': 5.0, 'weight_linear_min_weight': 0.4498325796916492, 'weight_linear_max_weight': 2.8303554932778914}. Best is trial 1 with value: 0.18828609217082964.
[I 2026-04-22 14:31:26,540] Trial 32 finished with value: 0.1765797893440246 and parameters: {'alpha': 70713.86060129285, 'use_snp_selection': False, 'weight_scheme': 'linear', 'weight_clip_max': 5.0, 'weight_linear_min_weight': 0.7955231030622194, 'weight_linear_max_weight': 2.5802078221020595}. Best is trial 1 with value: 0.18828609217082964.
[I 2026-04-22 14:32:21,650] Trial 33 finished with value: 0.17714497298166734 and parameters: {'alpha': 3899521.5945418365, 'use_snp_selection': False, 'weight_scheme': 'linear', 'weight_clip_max': 5.0, 'weight_linear_min_weight': 0.2602993039121725, 'weight_linear_max_weight': 3.31609084745889}. Best is trial 1 with value: 0.18828609217082964.
[I 2026-04-22 14:33:16,246] Trial 34 finished with value: 0.18712230180835918 and parameters: {'alpha': 285997.0758518532, 'use_snp_selection': False, 'weight_scheme': 'linear', 'weight_clip_max': 5.0, 'weight_linear_min_weight': 0.48714198994126184, 'weight_linear_max_weight': 2.6565873339089356}. Best is trial 1 with value: 0.18828609217082964.
[I 2026-04-22 14:34:11,526] Trial 35 finished with value: 0.18602717879600686 and parameters: {'alpha': 277584.7861689452, 'use_snp_selection': False, 'weight_scheme': 'linear', 'weight_clip_max': 5.0, 'weight_linear_min_weight': 0.7116115445524349, 'weight_linear_max_weight': 2.417078700259061}. Best is trial 1 with value: 0.18828609217082964.
[I 2026-04-22 14:35:05,306] Trial 36 finished with value: 0.17920614819849054 and parameters: {'alpha': 135761.76406567238, 'use_snp_selection': False, 'weight_scheme': 'top-heavy', 'weight_clip_max': 5.0, 'weight_topheavy_top_frac': 0.1148785677311325, 'weight_topheavy_low': 0.5029807285243505, 'weight_topheavy_high': 5.933542457630534}. Best is trial 1 with value: 0.18828609217082964.
[I 2026-04-22 14:37:23,353] Trial 37 finished with value: 0.17229577835993146 and parameters: {'alpha': 69763.27075076687, 'use_snp_selection': True, 'num_snps': 58010, 'weight_scheme': 'uniform', 'weight_clip_max': 10.0}. Best is trial 1 with value: 0.18828609217082964.
[I 2026-04-22 14:38:17,878] Trial 38 finished with value: 0.1880748193864182 and parameters: {'alpha': 355108.8624663067, 'use_snp_selection': False, 'weight_scheme': 'linear', 'weight_clip_max': None, 'weight_linear_min_weight': 0.31895839452061914, 'weight_linear_max_weight': 3.353002571124624}. Best is trial 1 with value: 0.18828609217082964.
[I 2026-04-22 14:40:15,060] Trial 39 finished with value: 0.17242342413482717 and parameters: {'alpha': 5648067.988858254, 'use_snp_selection': True, 'num_snps': 34860, 'weight_scheme': 'minmax', 'weight_clip_max': None, 'weight_minmax_eps': 0.00670609907571848}. Best is trial 1 with value: 0.18828609217082964.
[I 2026-04-22 14:41:10,809] Trial 40 finished with value: 0.18312874294153217 and parameters: {'alpha': 1850854.8694560556, 'use_snp_selection': False, 'weight_scheme': 'linear', 'weight_clip_max': None, 'weight_linear_min_weight': 0.20974644479535026, 'weight_linear_max_weight': 3.4911722518027695}. Best is trial 1 with value: 0.18828609217082964.
[I 2026-04-22 14:42:06,666] Trial 41 finished with value: 0.1881274699182651 and parameters: {'alpha': 372072.044582403, 'use_snp_selection': False, 'weight_scheme': 'linear', 'weight_clip_max': None, 'weight_linear_min_weight': 0.35502971297256786, 'weight_linear_max_weight': 3.1747140095025927}. Best is trial 1 with value: 0.18828609217082964.
[I 2026-04-22 14:43:01,686] Trial 42 finished with value: 0.18834892861760544 and parameters: {'alpha': 502301.2295365964, 'use_snp_selection': False, 'weight_scheme': 'linear', 'weight_clip_max': None, 'weight_linear_min_weight': 0.33094513065007625, 'weight_linear_max_weight': 3.1440942211877756}. Best is trial 42 with value: 0.18834892861760544.
[I 2026-04-22 14:43:57,918] Trial 43 finished with value: 0.18369846980640486 and parameters: {'alpha': 149085.20962468654, 'use_snp_selection': False, 'weight_scheme': 'linear', 'weight_clip_max': None, 'weight_linear_min_weight': 0.35877067300603965, 'weight_linear_max_weight': 3.1182262798107754}. Best is trial 42 with value: 0.18834892861760544.
[I 2026-04-22 14:44:52,426] Trial 44 finished with value: 0.1684289629522775 and parameters: {'alpha': 36993.15495508099, 'use_snp_selection': False, 'weight_scheme': 'linear', 'weight_clip_max': None, 'weight_linear_min_weight': 0.3291392027190511, 'weight_linear_max_weight': 3.6692816440825955}. Best is trial 42 with value: 0.18834892861760544.
[I 2026-04-22 14:45:47,585] Trial 45 finished with value: 0.12619864863688454 and parameters: {'alpha': 20.978444780697764, 'use_snp_selection': False, 'weight_scheme': 'minmax', 'weight_clip_max': None, 'weight_minmax_eps': 0.15254512470694606}. Best is trial 42 with value: 0.18834892861760544.
[I 2026-04-22 14:47:30,199] Trial 46 finished with value: 0.1798776661919945 and parameters: {'alpha': 541347.2056939265, 'use_snp_selection': True, 'num_snps': 26441, 'weight_scheme': 'top-heavy', 'weight_clip_max': None, 'weight_topheavy_top_frac': 0.2698207673032864, 'weight_topheavy_low': 1.1792308977767514, 'weight_topheavy_high': 3.890942079725765}. Best is trial 42 with value: 0.18834892861760544.
[I 2026-04-22 14:48:15,182] Trial 47 finished with value: 0.17053084692533574 and parameters: {'alpha': 1117759.6672009325, 'use_snp_selection': False, 'weight_scheme': 'uniform', 'weight_clip_max': None}. Best is trial 42 with value: 0.18834892861760544.
[I 2026-04-22 14:49:11,213] Trial 48 finished with value: 0.13575973024458438 and parameters: {'alpha': 2232.973374796909, 'use_snp_selection': False, 'weight_scheme': 'linear', 'weight_clip_max': None, 'weight_linear_min_weight': 0.5587391871443737, 'weight_linear_max_weight': 3.506328630308435}. Best is trial 42 with value: 0.18834892861760544.
[I 2026-04-22 14:50:34,931] Trial 49 finished with value: 0.10772982999630892 and parameters: {'alpha': 384.20703585876873, 'use_snp_selection': True, 'num_snps': 12691, 'weight_scheme': 'exponential', 'weight_clip_max': None, 'weight_exponential_beta': 4.046166268121768}. Best is trial 42 with value: 0.18834892861760544.
[I 2026-04-22 14:51:30,637] Trial 50 finished with value: 0.18775825126782564 and parameters: {'alpha': 357423.8714491359, 'use_snp_selection': False, 'weight_scheme': 'minmax', 'weight_clip_max': None, 'weight_minmax_eps': 0.19591049648562764}. Best is trial 42 with value: 0.18834892861760544.
[I 2026-04-22 14:52:26,619] Trial 51 finished with value: 0.18788689155587981 and parameters: {'alpha': 393918.73398529564, 'use_snp_selection': False, 'weight_scheme': 'minmax', 'weight_clip_max': None, 'weight_minmax_eps': 0.19229003230039576}. Best is trial 42 with value: 0.18834892861760544.
[I 2026-04-22 14:53:22,133] Trial 52 finished with value: 0.17987354076721437 and parameters: {'alpha': 96233.13922958258, 'use_snp_selection': False, 'weight_scheme': 'minmax', 'weight_clip_max': None, 'weight_minmax_eps': 0.15717684263095216}. Best is trial 42 with value: 0.18834892861760544.
[I 2026-04-22 14:54:18,146] Trial 53 finished with value: 0.18262116972608178 and parameters: {'alpha': 1771338.4421890927, 'use_snp_selection': False, 'weight_scheme': 'minmax', 'weight_clip_max': None, 'weight_minmax_eps': 0.12544208376825458}. Best is trial 42 with value: 0.18834892861760544.
[I 2026-04-22 14:55:14,545] Trial 54 finished with value: 0.18678554807836406 and parameters: {'alpha': 796570.6784434294, 'use_snp_selection': False, 'weight_scheme': 'minmax', 'weight_clip_max': None, 'weight_minmax_eps': 0.17459280945949818}. Best is trial 42 with value: 0.18834892861760544.
[I 2026-04-22 14:56:10,353] Trial 55 finished with value: 0.18534260017822018 and parameters: {'alpha': 189266.23900972784, 'use_snp_selection': False, 'weight_scheme': 'linear', 'weight_clip_max': None, 'weight_linear_min_weight': 0.29219612724900446, 'weight_linear_max_weight': 2.8926651635627083}. Best is trial 42 with value: 0.18834892861760544.
[I 2026-04-22 14:57:06,286] Trial 56 finished with value: 0.18812451400502686 and parameters: {'alpha': 362574.3539466895, 'use_snp_selection': False, 'weight_scheme': 'minmax', 'weight_clip_max': None, 'weight_minmax_eps': 0.09788718908669365}. Best is trial 42 with value: 0.18834892861760544.
[I 2026-04-22 14:59:15,057] Trial 57 finished with value: 0.17795006678829256 and parameters: {'alpha': 53345.50621249756, 'use_snp_selection': True, 'num_snps': 42271, 'weight_scheme': 'minmax', 'weight_clip_max': None, 'weight_minmax_eps': 0.09084086412522006}. Best is trial 42 with value: 0.18834892861760544.
[I 2026-04-22 15:00:10,081] Trial 58 finished with value: 0.18827345552352318 and parameters: {'alpha': 573001.7058632377, 'use_snp_selection': False, 'weight_scheme': 'minmax', 'weight_clip_max': 10.0, 'weight_minmax_eps': 0.10979635459736159}. Best is trial 42 with value: 0.18834892861760544.
[I 2026-04-22 15:01:06,004] Trial 59 finished with value: 0.17486972237980528 and parameters: {'alpha': 5219775.650911181, 'use_snp_selection': False, 'weight_scheme': 'minmax', 'weight_clip_max': 10.0, 'weight_minmax_eps': 0.10677036171221879}. Best is trial 42 with value: 0.18834892861760544.
[I 2026-04-22 15:02:44,524] Trial 60 finished with value: 0.1756710764172636 and parameters: {'alpha': 1938129.9802845498, 'use_snp_selection': True, 'num_snps': 23488, 'weight_scheme': 'minmax', 'weight_clip_max': 10.0, 'weight_minmax_eps': 0.05623566574680974}. Best is trial 42 with value: 0.18834892861760544.
[I 2026-04-22 15:03:38,565] Trial 61 finished with value: 0.18810120100195524 and parameters: {'alpha': 554801.3631734473, 'use_snp_selection': False, 'weight_scheme': 'minmax', 'weight_clip_max': 10.0, 'weight_minmax_eps': 0.14285335651377437}. Best is trial 42 with value: 0.18834892861760544.
[I 2026-04-22 15:04:32,884] Trial 62 finished with value: 0.18797636378648502 and parameters: {'alpha': 598850.6532415758, 'use_snp_selection': False, 'weight_scheme': 'minmax', 'weight_clip_max': 10.0, 'weight_minmax_eps': 0.1423252610677984}. Best is trial 42 with value: 0.18834892861760544.
[I 2026-04-22 15:05:27,702] Trial 63 finished with value: 0.1857648558750914 and parameters: {'alpha': 1151921.7246035794, 'use_snp_selection': False, 'weight_scheme': 'minmax', 'weight_clip_max': 10.0, 'weight_minmax_eps': 0.10427097545953616}. Best is trial 42 with value: 0.18834892861760544.
[I 2026-04-22 15:06:21,800] Trial 64 finished with value: 0.18511990229993996 and parameters: {'alpha': 181673.26349668726, 'use_snp_selection': False, 'weight_scheme': 'minmax', 'weight_clip_max': 10.0, 'weight_minmax_eps': 0.13998350598476833}. Best is trial 42 with value: 0.18834892861760544.
[I 2026-04-22 15:07:16,262] Trial 65 finished with value: 0.18735820740173184 and parameters: {'alpha': 766811.7594259211, 'use_snp_selection': False, 'weight_scheme': 'minmax', 'weight_clip_max': 10.0, 'weight_minmax_eps': 0.13418451574169177}. Best is trial 42 with value: 0.18834892861760544.
[I 2026-04-22 15:08:00,978] Trial 66 finished with value: 0.17548981841904374 and parameters: {'alpha': 518492.233309457, 'use_snp_selection': False, 'weight_scheme': 'uniform', 'weight_clip_max': 10.0}. Best is trial 42 with value: 0.18834892861760544.
