Running from this directory: /cluster/work/simennes/Master_thesis
Name of job: ncv_ridge_iw
ID of job: 24378209
Array task ID: 10
The job was run on these nodes: idun-04-06
[I 2026-05-04 00:17:04,703] Trial 0 finished with value: 0.2064843059155766 and parameters: {'alpha': 574323.565896313, 'use_snp_selection': False, 'iw_method': 'pc_logistic', 'iw_clip_max': 2.0, 'iw_prob_clip': 0.005989214663243749, 'iw_n_components': 20, 'iw_logistic_c': 2.8870927958158354, 'iw_pca_fit': 'combined', 'iw_solver': 'lbfgs', 'iw_rho': 1.0}. Best is trial 0 with value: 0.2064843059155766.
[I 2026-05-04 00:19:37,582] Trial 1 finished with value: 0.1980441553923097 and parameters: {'alpha': 145427.84270397192, 'use_snp_selection': False, 'iw_method': 'pc_logistic', 'iw_clip_max': 2.0, 'iw_prob_clip': 0.0022034134189735897, 'iw_n_components': 10, 'iw_logistic_c': 8.53225823447423, 'iw_pca_fit': 'combined', 'iw_solver': 'lbfgs', 'iw_rho': 1.0}. Best is trial 0 with value: 0.2064843059155766.
[I 2026-05-04 00:22:19,141] Trial 2 finished with value: 0.20888216271351623 and parameters: {'alpha': 337268.1824826383, 'use_snp_selection': False, 'iw_method': 'pc_logistic', 'iw_clip_max': 1.25, 'iw_prob_clip': 0.0011214380556681478, 'iw_n_components': 40, 'iw_logistic_c': 0.0004456301044046966, 'iw_pca_fit': 'combined', 'iw_solver': 'lbfgs', 'iw_rho': 0.5}. Best is trial 2 with value: 0.20888216271351623.
[I 2026-05-04 00:24:57,843] Trial 3 finished with value: 0.20345679634908748 and parameters: {'alpha': 623873.8362358484, 'use_snp_selection': False, 'iw_method': 'pc_logistic', 'iw_clip_max': 2.0, 'iw_prob_clip': 0.0010704282286164728, 'iw_n_components': 30, 'iw_logistic_c': 0.003649078989687946, 'iw_pca_fit': 'combined', 'iw_solver': 'lbfgs', 'iw_rho': 0.9}. Best is trial 2 with value: 0.20888216271351623.
[I 2026-05-04 00:25:27,331] Trial 4 finished with value: 0.1977715777713605 and parameters: {'alpha': 1199521.094898443, 'use_snp_selection': False, 'iw_method': 'uniform'}. Best is trial 2 with value: 0.20888216271351623.
[I 2026-05-04 00:28:12,108] Trial 5 finished with value: 0.2085419831760904 and parameters: {'alpha': 594205.5826125565, 'use_snp_selection': False, 'iw_method': 'pc_logistic', 'iw_clip_max': 1.5, 'iw_prob_clip': 0.017782866059784724, 'iw_n_components': 40, 'iw_logistic_c': 0.3876202021284575, 'iw_pca_fit': 'combined', 'iw_solver': 'lbfgs', 'iw_rho': 0.5}. Best is trial 2 with value: 0.20888216271351623.
[I 2026-05-04 00:30:43,314] Trial 6 finished with value: 0.20286591295468578 and parameters: {'alpha': 102431.18633356069, 'use_snp_selection': False, 'iw_method': 'pc_logistic', 'iw_clip_max': 1.25, 'iw_prob_clip': 0.0017147683107745938, 'iw_n_components': 20, 'iw_logistic_c': 4.32601466983518e-06, 'iw_pca_fit': 'combined', 'iw_solver': 'lbfgs', 'iw_rho': 0.9}. Best is trial 2 with value: 0.20888216271351623.
[I 2026-05-04 00:33:22,458] Trial 7 finished with value: 0.1987286530545253 and parameters: {'alpha': 1830941.3950631474, 'use_snp_selection': False, 'iw_method': 'pc_logistic', 'iw_clip_max': 2.0, 'iw_prob_clip': 0.006357173651119782, 'iw_n_components': 40, 'iw_logistic_c': 1.7003213055010015e-05, 'iw_pca_fit': 'combined', 'iw_solver': 'lbfgs', 'iw_rho': 0.5}. Best is trial 2 with value: 0.20888216271351623.
[I 2026-05-04 00:33:51,876] Trial 8 finished with value: 0.19765185213420497 and parameters: {'alpha': 1221444.8156569519, 'use_snp_selection': False, 'iw_method': 'uniform'}. Best is trial 2 with value: 0.20888216271351623.
[I 2026-05-04 00:34:21,321] Trial 9 finished with value: 0.20641918654180835 and parameters: {'alpha': 201218.30977627521, 'use_snp_selection': False, 'iw_method': 'uniform'}. Best is trial 2 with value: 0.20888216271351623.
[I 2026-05-04 00:34:50,737] Trial 10 finished with value: 0.2060596452810468 and parameters: {'alpha': 299360.6349531665, 'use_snp_selection': False, 'iw_method': 'uniform'}. Best is trial 2 with value: 0.20888216271351623.
[I 2026-05-04 00:37:34,628] Trial 11 finished with value: 0.21121186267253048 and parameters: {'alpha': 347796.61132526485, 'use_snp_selection': False, 'iw_method': 'pc_logistic', 'iw_clip_max': 1.5, 'iw_prob_clip': 0.04401504902876097, 'iw_n_components': 40, 'iw_logistic_c': 0.006828767945178502, 'iw_pca_fit': 'combined', 'iw_solver': 'lbfgs', 'iw_rho': 0.5}. Best is trial 11 with value: 0.21121186267253048.
[I 2026-05-04 00:40:17,518] Trial 12 finished with value: 0.20726992508623182 and parameters: {'alpha': 303675.1638347876, 'use_snp_selection': False, 'iw_method': 'pc_logistic', 'iw_clip_max': 5.0, 'iw_prob_clip': 0.04140223921348737, 'iw_n_components': 40, 'iw_logistic_c': 0.0029746068121942796, 'iw_pca_fit': 'combined', 'iw_solver': 'lbfgs', 'iw_rho': 0.75}. Best is trial 11 with value: 0.21121186267253048.
[I 2026-05-04 00:42:59,126] Trial 13 finished with value: 0.21073236689388314 and parameters: {'alpha': 354398.03438367625, 'use_snp_selection': False, 'iw_method': 'pc_logistic', 'iw_clip_max': 1.5, 'iw_prob_clip': 0.0005745000559553773, 'iw_n_components': 60, 'iw_logistic_c': 0.00018277181264750612, 'iw_pca_fit': 'combined', 'iw_solver': 'lbfgs', 'iw_rho': 0.5}. Best is trial 11 with value: 0.21121186267253048.
[I 2026-05-04 00:45:45,034] Trial 14 finished with value: 0.21046734272104706 and parameters: {'alpha': 389364.9847299307, 'use_snp_selection': False, 'iw_method': 'pc_logistic', 'iw_clip_max': 1.5, 'iw_prob_clip': 0.01818298481209595, 'iw_n_components': 60, 'iw_logistic_c': 0.04060399810888781, 'iw_pca_fit': 'combined', 'iw_solver': 'lbfgs', 'iw_rho': 0.5}. Best is trial 11 with value: 0.21121186267253048.
[I 2026-05-04 00:48:32,997] Trial 15 finished with value: 0.21000632558728896 and parameters: {'alpha': 199673.20638675452, 'use_snp_selection': False, 'iw_method': 'pc_logistic', 'iw_clip_max': 3.0, 'iw_prob_clip': 0.000500732814904531, 'iw_n_components': 80, 'iw_logistic_c': 0.0002854281900452669, 'iw_pca_fit': 'combined', 'iw_solver': 'lbfgs', 'iw_rho': 0.5}. Best is trial 11 with value: 0.21121186267253048.
[I 2026-05-04 00:51:11,973] Trial 16 finished with value: 0.20104606611045323 and parameters: {'alpha': 986293.714554698, 'use_snp_selection': False, 'iw_method': 'pc_logistic', 'iw_clip_max': 1.5, 'iw_prob_clip': 0.03337712720521347, 'iw_n_components': 60, 'iw_logistic_c': 2.153476778099544e-07, 'iw_pca_fit': 'combined', 'iw_solver': 'lbfgs', 'iw_rho': 0.75}. Best is trial 11 with value: 0.21121186267253048.
[I 2026-05-04 00:53:51,809] Trial 17 finished with value: 0.20166476983049786 and parameters: {'alpha': 842924.1577883721, 'use_snp_selection': False, 'iw_method': 'pc_logistic', 'iw_clip_max': 1.5, 'iw_prob_clip': 0.011662229064942534, 'iw_n_components': 50, 'iw_logistic_c': 3.140174151489524e-05, 'iw_pca_fit': 'combined', 'iw_solver': 'lbfgs', 'iw_rho': 0.5}. Best is trial 11 with value: 0.21121186267253048.
[I 2026-05-04 00:54:21,235] Trial 18 finished with value: 0.193511731569686 and parameters: {'alpha': 2521581.234133619, 'use_snp_selection': False, 'iw_method': 'uniform'}. Best is trial 11 with value: 0.21121186267253048.
[I 2026-05-04 00:57:08,405] Trial 19 finished with value: 0.21350723385352516 and parameters: {'alpha': 230859.70631081375, 'use_snp_selection': False, 'iw_method': 'pc_logistic', 'iw_clip_max': 1.5, 'iw_prob_clip': 0.0036291071249008526, 'iw_n_components': 60, 'iw_logistic_c': 0.0764372286181806, 'iw_pca_fit': 'combined', 'iw_solver': 'lbfgs', 'iw_rho': 0.5}. Best is trial 19 with value: 0.21350723385352516.
[I 2026-05-04 01:00:00,583] Trial 20 finished with value: 0.20824840441647932 and parameters: {'alpha': 214174.1546724269, 'use_snp_selection': False, 'iw_method': 'pc_logistic', 'iw_clip_max': 3.0, 'iw_prob_clip': 0.003300627593071683, 'iw_n_components': 80, 'iw_logistic_c': 0.049050106652462726, 'iw_pca_fit': 'combined', 'iw_solver': 'lbfgs', 'iw_rho': 0.5}. Best is trial 19 with value: 0.21350723385352516.
[I 2026-05-04 01:02:47,276] Trial 21 finished with value: 0.2115381159901621 and parameters: {'alpha': 403127.46701903665, 'use_snp_selection': False, 'iw_method': 'pc_logistic', 'iw_clip_max': 1.5, 'iw_prob_clip': 0.0005666900246251518, 'iw_n_components': 60, 'iw_logistic_c': 0.02356297210305131, 'iw_pca_fit': 'combined', 'iw_solver': 'lbfgs', 'iw_rho': 0.5}. Best is trial 19 with value: 0.21350723385352516.
[I 2026-05-04 01:05:34,158] Trial 22 finished with value: 0.21250868386620456 and parameters: {'alpha': 451475.01624114945, 'use_snp_selection': False, 'iw_method': 'pc_logistic', 'iw_clip_max': 1.5, 'iw_prob_clip': 0.003872818903594243, 'iw_n_components': 60, 'iw_logistic_c': 0.07143587384289887, 'iw_pca_fit': 'combined', 'iw_solver': 'lbfgs', 'iw_rho': 0.5}. Best is trial 19 with value: 0.21350723385352516.
[I 2026-05-04 01:08:21,360] Trial 23 finished with value: 0.2105401088262872 and parameters: {'alpha': 426766.4979288892, 'use_snp_selection': False, 'iw_method': 'pc_logistic', 'iw_clip_max': 1.5, 'iw_prob_clip': 0.0037994117915156078, 'iw_n_components': 60, 'iw_logistic_c': 0.13204572498977882, 'iw_pca_fit': 'combined', 'iw_solver': 'lbfgs', 'iw_rho': 0.5}. Best is trial 19 with value: 0.21350723385352516.
[I 2026-05-04 01:11:07,771] Trial 24 finished with value: 0.203200876427493 and parameters: {'alpha': 235576.2598179052, 'use_snp_selection': False, 'iw_method': 'pc_logistic', 'iw_clip_max': 5.0, 'iw_prob_clip': 0.008631463896819883, 'iw_n_components': 60, 'iw_logistic_c': 0.43921743996336143, 'iw_pca_fit': 'combined', 'iw_solver': 'lbfgs', 'iw_rho': 0.9}. Best is trial 19 with value: 0.21350723385352516.
[I 2026-05-04 01:13:54,301] Trial 25 finished with value: 0.2011768804430644 and parameters: {'alpha': 143236.71337658362, 'use_snp_selection': False, 'iw_method': 'pc_logistic', 'iw_clip_max': 1.5, 'iw_prob_clip': 0.002579865558082789, 'iw_n_components': 60, 'iw_logistic_c': 0.01817676217808676, 'iw_pca_fit': 'combined', 'iw_solver': 'lbfgs', 'iw_rho': 1.0}. Best is trial 19 with value: 0.21350723385352516.
[I 2026-05-04 01:16:46,706] Trial 26 finished with value: 0.21103475128756966 and parameters: {'alpha': 502027.0695818389, 'use_snp_selection': False, 'iw_method': 'pc_logistic', 'iw_clip_max': 1.5, 'iw_prob_clip': 0.0013020968338940339, 'iw_n_components': 60, 'iw_logistic_c': 0.8982204466171486, 'iw_pca_fit': 'combined', 'iw_solver': 'lbfgs', 'iw_rho': 0.75}. Best is trial 19 with value: 0.21350723385352516.
[I 2026-05-04 01:17:18,942] Trial 27 finished with value: 0.20143283573852813 and parameters: {'alpha': 706075.8293152417, 'use_snp_selection': False, 'iw_method': 'uniform'}. Best is trial 19 with value: 0.21350723385352516.
[I 2026-05-04 01:20:15,736] Trial 28 finished with value: 0.20947858430918087 and parameters: {'alpha': 256945.72929368477, 'use_snp_selection': False, 'iw_method': 'pc_logistic', 'iw_clip_max': 1.5, 'iw_prob_clip': 0.004076972926952535, 'iw_n_components': 30, 'iw_logistic_c': 0.09624900340679571, 'iw_pca_fit': 'combined', 'iw_solver': 'lbfgs', 'iw_rho': 0.5}. Best is trial 19 with value: 0.21350723385352516.
[I 2026-05-04 01:23:04,019] Trial 29 finished with value: 0.20786224649400467 and parameters: {'alpha': 470767.320960192, 'use_snp_selection': False, 'iw_method': 'pc_logistic', 'iw_clip_max': 1.5, 'iw_prob_clip': 0.0007150005563914076, 'iw_n_components': 10, 'iw_logistic_c': 0.014268056062324634, 'iw_pca_fit': 'combined', 'iw_solver': 'lbfgs', 'iw_rho': 0.5}. Best is trial 19 with value: 0.21350723385352516.
[I 2026-05-04 01:26:04,666] Trial 30 finished with value: 0.20655684375826805 and parameters: {'alpha': 772662.0033281768, 'use_snp_selection': False, 'iw_method': 'pc_logistic', 'iw_clip_max': 1.25, 'iw_prob_clip': 0.0018494551468494335, 'iw_n_components': 50, 'iw_logistic_c': 0.001537462407502768, 'iw_pca_fit': 'combined', 'iw_solver': 'lbfgs', 'iw_rho': 0.5}. Best is trial 19 with value: 0.21350723385352516.
[I 2026-05-04 01:29:07,655] Trial 31 finished with value: 0.20961383660568605 and parameters: {'alpha': 175167.9717068736, 'use_snp_selection': False, 'iw_method': 'pc_logistic', 'iw_clip_max': 1.5, 'iw_prob_clip': 0.02624545525023651, 'iw_n_components': 60, 'iw_logistic_c': 0.007201982548948509, 'iw_pca_fit': 'combined', 'iw_solver': 'lbfgs', 'iw_rho': 0.5}. Best is trial 19 with value: 0.21350723385352516.
[I 2026-05-04 01:32:12,637] Trial 32 finished with value: 0.21131351924988637 and parameters: {'alpha': 270988.91396532004, 'use_snp_selection': False, 'iw_method': 'pc_logistic', 'iw_clip_max': 1.5, 'iw_prob_clip': 0.010839047896226198, 'iw_n_components': 60, 'iw_logistic_c': 0.16759179691667858, 'iw_pca_fit': 'combined', 'iw_solver': 'lbfgs', 'iw_rho': 0.5}. Best is trial 19 with value: 0.21350723385352516.
[I 2026-05-04 01:35:15,403] Trial 33 finished with value: 0.20861120545940676 and parameters: {'alpha': 159110.98411264634, 'use_snp_selection': False, 'iw_method': 'pc_logistic', 'iw_clip_max': 1.5, 'iw_prob_clip': 0.0095828517684398, 'iw_n_components': 60, 'iw_logistic_c': 0.14242266614575358, 'iw_pca_fit': 'combined', 'iw_solver': 'lbfgs', 'iw_rho': 0.5}. Best is trial 19 with value: 0.21350723385352516.
[I 2026-05-04 01:38:18,274] Trial 34 finished with value: 0.2112377850796614 and parameters: {'alpha': 254917.69242198544, 'use_snp_selection': False, 'iw_method': 'pc_logistic', 'iw_clip_max': 5.0, 'iw_prob_clip': 0.014084593215499288, 'iw_n_components': 60, 'iw_logistic_c': 2.4535675256593503, 'iw_pca_fit': 'combined', 'iw_solver': 'lbfgs', 'iw_rho': 0.5}. Best is trial 19 with value: 0.21350723385352516.
[I 2026-05-04 01:41:19,454] Trial 35 finished with value: 0.2064570057333356 and parameters: {'alpha': 119866.51684123183, 'use_snp_selection': False, 'iw_method': 'pc_logistic', 'iw_clip_max': 3.0, 'iw_prob_clip': 0.005624824402382159, 'iw_n_components': 60, 'iw_logistic_c': 0.3173837166660111, 'iw_pca_fit': 'combined', 'iw_solver': 'lbfgs', 'iw_rho': 0.5}. Best is trial 19 with value: 0.21350723385352516.
[I 2026-05-04 01:44:11,261] Trial 36 finished with value: 0.20759718879508404 and parameters: {'alpha': 507131.82047175063, 'use_snp_selection': False, 'iw_method': 'pc_logistic', 'iw_clip_max': 1.5, 'iw_prob_clip': 0.006925364713018025, 'iw_n_components': 20, 'iw_logistic_c': 1.6207104412542572, 'iw_pca_fit': 'combined', 'iw_solver': 'lbfgs', 'iw_rho': 1.0}. Best is trial 19 with value: 0.21350723385352516.
[I 2026-05-04 01:47:15,287] Trial 37 finished with value: 0.2141372300424834 and parameters: {'alpha': 278429.71418931277, 'use_snp_selection': False, 'iw_method': 'pc_logistic', 'iw_clip_max': 1.5, 'iw_prob_clip': 0.005179471819001495, 'iw_n_components': 60, 'iw_logistic_c': 0.036086243435348005, 'iw_pca_fit': 'combined', 'iw_solver': 'lbfgs', 'iw_rho': 0.75}. Best is trial 37 with value: 0.2141372300424834.
[I 2026-05-04 01:47:47,747] Trial 38 finished with value: 0.20201001964895937 and parameters: {'alpha': 649190.5440933446, 'use_snp_selection': False, 'iw_method': 'uniform'}. Best is trial 37 with value: 0.2141372300424834.
[I 2026-05-04 01:50:34,903] Trial 39 finished with value: 0.20517442470784536 and parameters: {'alpha': 419168.10629653, 'use_snp_selection': False, 'iw_method': 'pc_logistic', 'iw_clip_max': 2.0, 'iw_prob_clip': 0.0027327430940604722, 'iw_n_components': 10, 'iw_logistic_c': 0.031788857555480124, 'iw_pca_fit': 'combined', 'iw_solver': 'lbfgs', 'iw_rho': 0.75}. Best is trial 37 with value: 0.2141372300424834.
[I 2026-05-04 01:53:37,595] Trial 40 finished with value: 0.2104791694984392 and parameters: {'alpha': 315980.0392638528, 'use_snp_selection': False, 'iw_method': 'pc_logistic', 'iw_clip_max': 1.5, 'iw_prob_clip': 0.004755543412169907, 'iw_n_components': 60, 'iw_logistic_c': 7.932042403374394, 'iw_pca_fit': 'combined', 'iw_solver': 'lbfgs', 'iw_rho': 0.75}. Best is trial 37 with value: 0.2141372300424834.
[I 2026-05-04 01:56:41,984] Trial 41 finished with value: 0.2127638404007513 and parameters: {'alpha': 271426.53427125426, 'use_snp_selection': False, 'iw_method': 'pc_logistic', 'iw_clip_max': 1.5, 'iw_prob_clip': 0.007872778075618543, 'iw_n_components': 60, 'iw_logistic_c': 0.14363849120247368, 'iw_pca_fit': 'combined', 'iw_solver': 'lbfgs', 'iw_rho': 0.75}. Best is trial 37 with value: 0.2141372300424834.
[I 2026-05-04 01:59:45,236] Trial 42 finished with value: 0.2087966963011724 and parameters: {'alpha': 573268.8466206862, 'use_snp_selection': False, 'iw_method': 'pc_logistic', 'iw_clip_max': 1.5, 'iw_prob_clip': 0.007146244971386605, 'iw_n_components': 60, 'iw_logistic_c': 0.04821921440513626, 'iw_pca_fit': 'combined', 'iw_solver': 'lbfgs', 'iw_rho': 0.75}. Best is trial 37 with value: 0.2141372300424834.
[I 2026-05-04 02:02:40,556] Trial 43 finished with value: 0.21100681571569813 and parameters: {'alpha': 196560.69679945143, 'use_snp_selection': False, 'iw_method': 'pc_logistic', 'iw_clip_max': 1.5, 'iw_prob_clip': 0.004860871885951452, 'iw_n_components': 30, 'iw_logistic_c': 0.6327408602952821, 'iw_pca_fit': 'combined', 'iw_solver': 'lbfgs', 'iw_rho': 0.75}. Best is trial 37 with value: 0.2141372300424834.
[I 2026-05-04 02:05:43,772] Trial 44 finished with value: 0.20892936753341265 and parameters: {'alpha': 359751.86956258677, 'use_snp_selection': False, 'iw_method': 'pc_logistic', 'iw_clip_max': 1.25, 'iw_prob_clip': 0.0008288756879843992, 'iw_n_components': 60, 'iw_logistic_c': 0.01723274425768138, 'iw_pca_fit': 'combined', 'iw_solver': 'lbfgs', 'iw_rho': 0.75}. Best is trial 37 with value: 0.2141372300424834.
[I 2026-05-04 02:06:16,213] Trial 45 finished with value: 0.20626448867312877 and parameters: {'alpha': 274767.0137554782, 'use_snp_selection': False, 'iw_method': 'uniform'}. Best is trial 37 with value: 0.2141372300424834.
[I 2026-05-04 02:09:06,594] Trial 46 finished with value: 0.20875094188295246 and parameters: {'alpha': 437568.282711374, 'use_snp_selection': False, 'iw_method': 'pc_logistic', 'iw_clip_max': 2.0, 'iw_prob_clip': 0.0029452178377071315, 'iw_n_components': 20, 'iw_logistic_c': 0.0006483126425979444, 'iw_pca_fit': 'combined', 'iw_solver': 'lbfgs', 'iw_rho': 0.9}. Best is trial 37 with value: 0.2141372300424834.
[I 2026-05-04 02:12:08,824] Trial 47 finished with value: 0.20671400882861612 and parameters: {'alpha': 229220.34628285113, 'use_snp_selection': False, 'iw_method': 'pc_logistic', 'iw_clip_max': 1.5, 'iw_prob_clip': 0.002087825654039508, 'iw_n_components': 60, 'iw_logistic_c': 0.005792087449591395, 'iw_pca_fit': 'combined', 'iw_solver': 'lbfgs', 'iw_rho': 1.0}. Best is trial 37 with value: 0.2141372300424834.
[I 2026-05-04 02:15:19,100] Trial 48 finished with value: 0.21308417575619704 and parameters: {'alpha': 330568.3113556993, 'use_snp_selection': False, 'iw_method': 'pc_logistic', 'iw_clip_max': 1.5, 'iw_prob_clip': 0.008528402458689636, 'iw_n_components': 80, 'iw_logistic_c': 0.0021564034530991497, 'iw_pca_fit': 'combined', 'iw_solver': 'lbfgs', 'iw_rho': 0.75}. Best is trial 37 with value: 0.2141372300424834.
[I 2026-05-04 02:18:29,950] Trial 49 finished with value: 0.21187133372378733 and parameters: {'alpha': 133878.84081465285, 'use_snp_selection': False, 'iw_method': 'pc_logistic', 'iw_clip_max': 1.25, 'iw_prob_clip': 0.00797494089228898, 'iw_n_components': 80, 'iw_logistic_c': 0.0022099434874478545, 'iw_pca_fit': 'combined', 'iw_solver': 'lbfgs', 'iw_rho': 0.75}. Best is trial 37 with value: 0.2141372300424834.
[I 2026-05-04 02:19:02,704] Trial 50 finished with value: 0.2060112172943087 and parameters: {'alpha': 304515.354979806, 'use_snp_selection': False, 'iw_method': 'uniform'}. Best is trial 37 with value: 0.2141372300424834.
[I 2026-05-04 02:22:13,194] Trial 51 finished with value: 0.21117415013707563 and parameters: {'alpha': 174040.44527908065, 'use_snp_selection': False, 'iw_method': 'pc_logistic', 'iw_clip_max': 1.25, 'iw_prob_clip': 0.008147050190548354, 'iw_n_components': 80, 'iw_logistic_c': 0.001631295205545746, 'iw_pca_fit': 'combined', 'iw_solver': 'lbfgs', 'iw_rho': 0.75}. Best is trial 37 with value: 0.2141372300424834.
[I 2026-05-04 02:25:18,458] Trial 52 finished with value: 0.20839517304400848 and parameters: {'alpha': 126440.5986178389, 'use_snp_selection': False, 'iw_method': 'pc_logistic', 'iw_clip_max': 1.25, 'iw_prob_clip': 0.005456158954984463, 'iw_n_components': 80, 'iw_logistic_c': 0.0001107172349808646, 'iw_pca_fit': 'combined', 'iw_solver': 'lbfgs', 'iw_rho': 0.75}. Best is trial 37 with value: 0.2141372300424834.
[I 2026-05-04 02:28:33,997] Trial 53 finished with value: 0.2068767140633637 and parameters: {'alpha': 100839.08200430567, 'use_snp_selection': False, 'iw_method': 'pc_logistic', 'iw_clip_max': 1.25, 'iw_prob_clip': 0.014602022320178865, 'iw_n_components': 80, 'iw_logistic_c': 0.008174019381599248, 'iw_pca_fit': 'combined', 'iw_solver': 'lbfgs', 'iw_rho': 0.75}. Best is trial 37 with value: 0.2141372300424834.
[I 2026-05-04 02:31:44,925] Trial 54 finished with value: 0.2125778813422575 and parameters: {'alpha': 338873.0092231402, 'use_snp_selection': False, 'iw_method': 'pc_logistic', 'iw_clip_max': 1.25, 'iw_prob_clip': 0.004041666533222421, 'iw_n_components': 80, 'iw_logistic_c': 0.002547507104097764, 'iw_pca_fit': 'combined', 'iw_solver': 'lbfgs', 'iw_rho': 0.75}. Best is trial 37 with value: 0.2141372300424834.
[I 2026-05-04 02:34:59,027] Trial 55 finished with value: 0.20024138464721714 and parameters: {'alpha': 337842.69700524537, 'use_snp_selection': False, 'iw_method': 'pc_logistic', 'iw_clip_max': 5.0, 'iw_prob_clip': 0.0036534219710631075, 'iw_n_components': 80, 'iw_logistic_c': 0.06847860532960783, 'iw_pca_fit': 'combined', 'iw_solver': 'lbfgs', 'iw_rho': 0.75}. Best is trial 37 with value: 0.2141372300424834.
[I 2026-05-04 02:38:08,161] Trial 56 finished with value: 0.21533807164677404 and parameters: {'alpha': 382035.5895317374, 'use_snp_selection': False, 'iw_method': 'pc_logistic', 'iw_clip_max': 1.5, 'iw_prob_clip': 0.004456847405355649, 'iw_n_components': 80, 'iw_logistic_c': 0.000797092155410734, 'iw_pca_fit': 'combined', 'iw_solver': 'lbfgs', 'iw_rho': 0.75}. Best is trial 56 with value: 0.21533807164677404.
